A1: Victorian Football Association
A2: Season 1971 - Division Two
A3: © Copyright Wal Williams | F3: First created: 28 March 2016
A4: Contact: joywalwi at gmail dot com | F4: Last updated: 28 March 2016 | W4: VFA Results and tables - Link to the main index page
A5: You are free to copy this document in whole or part provided that proper acknowledgement is given to the author. All rights reserved.
A7: 1971 | C7: V.F.A. SEASON 2ND DIVISION
A8: ROUND 1 | E8: 11TH APRIL | J8: WEATHER | S8: PLAYED AT
D9: 1ST QTR | H9: 2ND QTR | L9: 3RD QTR | P9: FINAL | S9: BRUNSWICK
A10: SUNSHINE | C10: 6 | D10: 2 | E10: =C10*6+D10 -> 38 | G10: 15 | H10: 7 | I10: =G10*6+H10 -> 97 | K10: 21 | L10: 15 | M10: =K10*6+L10 -> 141 | O10: 29 | P10: 18 | Q10: =O10*6+P10 -> 192 | S10: UMPIRE | X10: LADDER | AB10: ROUND | AD10: 1
A11: BRUNSWICK | C11: 1 | D11: 0 | E11: =C11*6+D11 -> 6 | G11: 7 | H11: 2 | I11: =G11*6+H11 -> 44 | K11: 9 | L11: 6 | M11: =K11*6+L11 -> 60 | O11: 14 | P11: 12 | Q11: =O11*6+P11 -> 96 | S11: DUGARD
A12: BEST PLAYERS | W12: TEAM | X12: W | Y12: L | Z12: D | AA12: FOR | AB12: AGST | AC12: % | AD12: PTS
A13: SUNSHINE | C13: GOOLD | F13: PRIOR | I13: WAGLAND | L13: BENSON | N13: CRAWFORD | Q13: McGREGOR
A14: BRUNSWICK | C14: SCHIMMELBUSCH | F14: DALTON | I14: WALLIS | L14: K GENT | W14: MORDIALLOC | X14: 1 | Y14: 0 | Z14: 0 | AA14: 119 | AB14: 45 | AC14: =(AA14*100)/AB14 -> 264.44444444444446 | AD14: =(X14*4)+(Z14*2) -> 4
A15: GOALKICKERS | H15: DOWNS 2 | J15: CHADWICK | M15: WAGLAND | P15: JAMIESON | W15: CAULFIELD | X15: 1 | Y15: 0 | Z15: 0 | AA15: 139 | AB15: 66 | AC15: =(AA15*100)/AB15 -> 210.60606060606059 | AD15: =(X15*4)+(Z15*2) -> 4
A16: SUNSHINE | C16: FERGUSON 6 | F16: BENSON 4 | H16: CRAWFORD 4 | K16: IBRAHIM 3 | N16: McGREGOR 3 | Q16: PRIOR 2 | S16: GOOLD 2 | W16: SUNSHINE | X16: 1 | Y16: 0 | Z16: 0 | AA16: 192 | AB16: 96 | AC16: =(AA16*100)/AB16 -> 200 | AD16: =(X16*4)+(Z16*2) -> 4
A17: BRUNSWICK | C17: K GENT 3 | E17: COOK 2 | G17: DALTON 2 | J17: WALLIS 2 | L17: SCHIMMELBUSCH 2 | P17: DIMMATINA | S17: A MATTHEWS | W17: CAMBERWELL | X17: 1 | Y17: 0 | Z17: 0 | AA17: 108 | AB17: 76 | AC17: =(AA17*100)/AB17 -> 142.10526315789474 | AD17: =(X17*4)+(Z17*2) -> 4
J18: WADHAM
A19: CAMBERWELL | C19: 4 | D19: 3 | E19: =C19*6+D19 -> 27 | G19: 7 | H19: 10 | I19: =G19*6+H19 -> 52 | K19: 10 | L19: 12 | M19: =K19*6+L19 -> 72 | O19: 14 | P19: 24 | Q19: =O19*6+P19 -> 108 | S19: CAMBERWELL | W19: YARRAVILLE | X19: 1 | Y19: 0 | Z19: 0 | AA19: 152 | AB19: 112 | AC19: =(AA19*100)/AB19 -> 135.71428571428572 | AD19: =(X19*4)+(Z19*2) -> 4
A20: BOX HILL | C20: 3 | D20: 2 | E20: =C20*6+D20 -> 20 | G20: 4 | H20: 5 | I20: =G20*6+H20 -> 29 | K20: 10 | L20: 10 | M20: =K20*6+L20 -> 70 | O20: 11 | P20: 10 | Q20: =O20*6+P20 -> 76 | S20: G ANDERSON | W20: FRANKSTON | X20: 0 | Y20: 1 | Z20: 0 | AA20: 112 | AB20: 152 | AC20: =(AA20*100)/AB20 -> 73.684210526315795 | AD20: =(X20*4)+(Z20*2) -> 0
A21: BEST PLAYERS | W21: BOX HILL | X21: 0 | Y21: 1 | Z21: 0 | AA21: 76 | AB21: 108 | AC21: =(AA21*100)/AB21 -> 70.370370370370367 | AD21: =(X21*4)+(Z21*2) -> 0
A22: CAMBERWELL | C22: EVANS | F22: CONYERS | I22: DE BONDE | L22: SIMPSON | O22: RYAN | Q22: FORSYTHE | W22: BRUNSWICK | X22: 0 | Y22: 1 | Z22: 0 | AA22: 96 | AB22: 192 | AC22: =(AA22*100)/AB22 -> 50 | AD22: =(X22*4)+(Z22*2) -> 0
A23: BOX HILL | C23: HUNT | F23: RALPH | I23: ROBERTSON | L23: DAWSON | O23: McQUALTER | W23: NORTHCOTE | X23: 0 | Y23: 1 | Z23: 0 | AA23: 66 | AB23: 139 | AC23: =(AA23*100)/AB23 -> 47.482014388489212 | AD23: =(X23*4)+(Z23*2) -> 0
A24: GOALKICKERS | W24: WERRIBEE | X24: 0 | Y24: 1 | Z24: 0 | AA24: 45 | AB24: 119 | AC24: =(AA24*100)/AB24 -> 37.815126050420169 | AD24: =(X24*4)+(Z24*2) -> 0
A25: CAMBERWELL | C25: DE BONDE 5 | F25: SIMPSON 2 | I25: REES 2 | K25: EDWARDS 2 | N25: CONYERS 2 | Q25: O'DONNELL
A26: BOX HILL | C26: BIERL 3 | E26: BAKER 2 | G26: COBAIN 2 | I26: DAWSON | K26: D GROWCOTT | N26: RALPH | P26: THOMPSON
A28: YARRAVILLE | C28: 2 | D28: 6 | E28: =C28*6+D28 -> 18 | G28: 10 | H28: 12 | I28: =G28*6+H28 -> 72 | K28: 16 | L28: 13 | M28: =K28*6+L28 -> 109 | O28: 22 | P28: 20 | Q28: =O28*6+P28 -> 152 | S28: YARRAVILLE
A29: FRANKSTON | C29: 3 | D29: 4 | E29: =C29*6+D29 -> 22 | G29: 5 | H29: 9 | I29: =G29*6+H29 -> 39 | K29: 13 | L29: 15 | M29: =K29*6+L29 -> 93 | O29: 15 | P29: 22 | Q29: =O29*6+P29 -> 112 | S29: CHINN
A30: BEST PLAYERS
A31: YARRAVILLE | C31: BARROW | F31: QUARANTOTTO | J31: SQUIRES | M31: WAGHORN | P31: TAURINS | R31: BONGETTI
A32: FRANKSTON | C32: LOVELOCK | F32: STRINGER | I32: WINSTANLEY | L32: SCOTT | N32: BURNS | P32: WESTON
A33: GOALKICKERS
A34: YARRAVILLE | C34: CALAZ 4 | E34: QUARANTOTTO 4 | I34: MARTIN 3 | K34: McLARIN 3 | N34: MADIGAN 3 | Q34: BONGETTI 2 | S34: BROWN 2 | V34: HEATH
A35: FRANKSTON | C35: STRINGER 4 | F35: WESTON 3 | I35: BURNS 2 | K35: LOVELOCK 2 | N35: GRAHAM 2 | Q35: CAMPBELL | T35: BEAMAN
A37: CAULFIELD | C37: 4 | D37: 14 | E37: =C37*6+D37 -> 38 | G37: 9 | H37: 20 | I37: =G37*6+H37 -> 74 | K37: 13 | L37: 24 | M37: =K37*6+L37 -> 102 | O37: 18 | P37: 31 | Q37: =O37*6+P37 -> 139 | S37: PRINCES PARK, CAULFIELD
A38: NORTHCOTE | C38: 0 | D38: 0 | E38: =C38*6+D38 -> 0 | G38: 3 | H38: 1 | I38: =G38*6+H38 -> 19 | K38: 6 | L38: 3 | M38: =K38*6+L38 -> 39 | O38: 10 | P38: 6 | Q38: =O38*6+P38 -> 66 | S38: GAMBETTA
A39: BEST PLAYERS
A40: CAULFIELD | C40: FELDMANN | F40: MAGUIRE | I40: CLARK | L40: ROBINSON | O40: GOWANS | R40: MITCHELL
A41: NORTHCOTE | C41: WILLIAMS | F41: KINNEALLY | I41: STILSBY | L41: VINEY | O41: CAREY | R41: KREYMBORG
A42: GOALKICKERS
A43: CAULFIELD | C43: ROBINSON 8 | F43: WILLIAMS 3 | I43: BROWN 2 | K43: LOGAN | M43: GOWANS | O43: BAKER | Q43: ARRELL | S43: R JEWELL
A44: NORTHCOTE | C44: WILLIAMS 2 | F44: STILSBY 2 | I44: KEANE 2 | K44: KREYMBORG | N44: RYAN | P44: LOCK | R44: McGORLICK
A46: MORDIALLOC | C46: 3 | D46: 2 | E46: =C46*6+D46 -> 20 | G46: 7 | H46: 14 | I46: =G46*6+H46 -> 56 | K46: 11 | L46: 14 | M46: =K46*6+L46 -> 80 | O46: 17 | P46: 17 | Q46: =O46*6+P46 -> 119 | S46: WERRIBEE
A47: WERRIBEE | C47: 2 | D47: 2 | E47: =C47*6+D47 -> 14 | G47: 2 | H47: 5 | I47: =G47*6+H47 -> 17 | K47: 5 | L47: 9 | M47: =K47*6+L47 -> 39 | O47: 6 | P47: 9 | Q47: =O47*6+P47 -> 45 | S47: PASK
A48: BEST PLAYERS
A49: MORDIALLOC
A50: WERRIBEE
A51: GOALKICKERS
A52: MORDIALLOC
A53: WERRIBEE
A55: ROUND 2 | E55: 17TH APRIL | J55: WEATHER | S55: PLAYED AT
D56: 1ST QTR | H56: 2ND QTR | L56: 3RD QTR | P56: FINAL | S56: MORDIALLOC
A57: BRUNSWICK | E57: =C57*6+D57 -> 0 | I57: =G57*6+H57 -> 0 | M57: =K57*6+L57 -> 0 | O57: 14 | P57: 16 | Q57: =O57*6+P57 -> 100 | S57: UMPIRE | X57: LADDER | AB57: ROUND | AD57: 2
A58: MORDIALLOC | E58: =C58*6+D58 -> 0 | I58: =G58*6+H58 -> 0 | M58: =K58*6+L58 -> 0 | O58: 8 | P58: 15 | Q58: =O58*6+P58 -> 63
A59: BEST PLAYERS | W59: TEAM | X59: W | Y59: L | Z59: D | AA59: FOR | AB59: AGST | AC59: % | AD59: PTS
A60: BRUNSWICK
A61: MORDIALLOC | W61: CAULFIELD | X61: 2 | Y61: 0 | Z61: 0 | AA61: 279 | AB61: 135 | AC61: =(AA61*100)/AB61 -> 206.66666666666666 | AD61: =(X61*4)+(Z61*2) -> 8
A62: GOALKICKERS | W62: YARRAVILLE | X62: 2 | Y62: 0 | Z62: 0 | AA62: 304 | AB62: 229 | AC62: =(AA62*100)/AB62 -> 132.75109170305677 | AD62: =(X62*4)+(Z62*2) -> 8
A63: BRUNSWICK | W63: MORDIALLOC | X63: 1 | Y63: 1 | Z63: 0 | AA63: 182 | AB63: 145 | AC63: =(AA63*100)/AB63 -> 125.51724137931035 | AD63: =(X63*4)+(Z63*2) -> 4
A64: MORDIALLOC | W64: SUNSHINE | X64: 1 | Y64: 1 | Z64: 0 | AA64: 261 | AB64: 236 | AC64: =(AA64*100)/AB64 -> 110.59322033898304 | AD64: =(X64*4)+(Z64*2) -> 4
A66: CAULFIELD | E66: =C66*6+D66 -> 0 | I66: =G66*6+H66 -> 0 | M66: =K66*6+L66 -> 0 | O66: 20 | P66: 20 | Q66: =O66*6+P66 -> 140 | S66: SUNSHINE | W66: FRANKSTON | X66: 1 | Y66: 1 | Z66: 0 | AA66: 247 | AB66: 251 | AC66: =(AA66*100)/AB66 -> 98.406374501992033 | AD66: =(X66*4)+(Z66*2) -> 4
A67: SUNSHINE | E67: =C67*6+D67 -> 0 | I67: =G67*6+H67 -> 0 | M67: =K67*6+L67 -> 0 | O67: 10 | P67: 9 | Q67: =O67*6+P67 -> 69 | W67: CAMBERWELL | X67: 1 | Y67: 1 | Z67: 0 | AA67: 160 | AB67: 175 | AC67: =(AA67*100)/AB67 -> 91.428571428571431 | AD67: =(X67*4)+(Z67*2) -> 4
A68: BEST PLAYERS | W68: NORTHCOTE | X68: 1 | Y68: 1 | Z68: 0 | AA68: 165 | AB68: 191 | AC68: =(AA68*100)/AB68 -> 86.387434554973822 | AD68: =(X68*4)+(Z68*2) -> 4
A69: CAULFIELD | W69: BRUNSWICK | X69: 1 | Y69: 1 | Z69: 0 | AA69: 196 | AB69: 255 | AC69: =(AA69*100)/AB69 -> 76.862745098039213 | AD69: =(X69*4)+(Z69*2) -> 4
A70: SUNSHINE | W70: BOX HILL | X70: 0 | Y70: 2 | Z70: 0 | AA70: 193 | AB70: 260 | AC70: =(AA70*100)/AB70 -> 74.230769230769226 | AD70: =(X70*4)+(Z70*2) -> 0
A71: GOALKICKERS | W71: WERRIBEE | X71: 0 | Y71: 2 | Z71: 0 | AA71: 144 | AB71: 254 | AC71: =(AA71*100)/AB71 -> 56.69291338582677 | AD71: =(X71*4)+(Z71*2) -> 0
A72: CAULFIELD
A73: SUNSHINE
A75: NORTHCOTE | E75: =C75*6+D75 -> 0 | I75: =G75*6+H75 -> 0 | M75: =K75*6+L75 -> 0 | O75: 14 | P75: 15 | Q75: =O75*6+P75 -> 99 | S75: NORTHCOTE
A76: CAMBERWELL | E76: =C76*6+D76 -> 0 | I76: =G76*6+H76 -> 0 | M76: =K76*6+L76 -> 0 | O76: 6 | P76: 16 | Q76: =O76*6+P76 -> 52
A77: BEST PLAYERS
A78: NORTHCOTE
A79: CAMBERWELL
A80: GOALKICKERS
A81: NORTHCOTE
A82: CAMBERWELL
A84: YARRAVILLE | E84: =C84*6+D84 -> 0 | I84: =G84*6+H84 -> 0 | M84: =K84*6+L84 -> 0 | O84: 23 | P84: 14 | Q84: =O84*6+P84 -> 152 | S84: BOX HILL
A85: BOX HILL | E85: =C85*6+D85 -> 0 | I85: =G85*6+H85 -> 0 | M85: =K85*6+L85 -> 0 | O85: 17 | P85: 15 | Q85: =O85*6+P85 -> 117
A86: BEST PLAYERS
A87: YARRAVILLE
A88: BOX HILL
A89: GOALKICKERS
A90: YARRAVILLE
A91: BOX HILL
A93: FRANKSTON | E93: =C93*6+D93 -> 0 | I93: =G93*6+H93 -> 0 | M93: =K93*6+L93 -> 0 | O93: 20 | P93: 15 | Q93: =O93*6+P93 -> 135 | S93: FRANKSTON
A94: WERRIBEE | E94: =C94*6+D94 -> 0 | I94: =G94*6+H94 -> 0 | M94: =K94*6+L94 -> 0 | O94: 14 | P94: 15 | Q94: =O94*6+P94 -> 99
A95: BEST PLAYERS
A96: FRANKSTON
A97: WERRIBEE
A98: GOALKICKERS
A99: FRANKSTON
A100: WERRIBEE
A102: ROUND 3 | E102: 1ST MAY | J102: WEATHER | S102: PLAYED AT
D103: 1ST QTR | H103: 2ND QTR | L103: 3RD QTR | P103: FINAL | S103: BOX HILL
A104: BOX HILL | C104: 6 | D104: 3 | E104: =C104*6+D104 -> 39 | G104: 10 | H104: 9 | I104: =G104*6+H104 -> 69 | K104: 16 | L104: 11 | M104: =K104*6+L104 -> 107 | O104: 22 | P104: 12 | Q104: =O104*6+P104 -> 144 | S104: UMPIRE | X104: LADDER | AB104: ROUND | AD104: 3
A105: MORDIALLOC | C105: 5 | D105: 2 | E105: =C105*6+D105 -> 32 | G105: 7 | H105: 3 | I105: =G105*6+H105 -> 45 | K105: 10 | L105: 7 | M105: =K105*6+L105 -> 67 | O105: 12 | P105: 8 | Q105: =O105*6+P105 -> 80 | S105: DUGARD
A106: BEST PLAYERS | W106: TEAM | X106: W | Y106: L | Z106: D | AA106: FOR | AB106: AGST | AC106: % | AD106: PTS
A107: BOX HILL | C107: COLE | F107: THOMPSON | I107: DAWSON | L107: CRISP | O107: BIERL | R107: JOHNSON
A108: MORDIALLOC | C108: STUDHAM | F108: WILKINSON | I108: A McGUINNESS | L108: DANCKERT | O108: WILKINS | W108: YARRAVILLE | X108: 3 | Y108: 0 | Z108: 0 | AA108: 422 | AB108: 299 | AC108: =(AA108*100)/AB108 -> 141.13712374581939 | AD108: =(X108*4)+(Z108*2) -> 12
A109: GOALKICKERS | Q109: SMITH | W109: CAULFIELD | X109: 2 | Y109: 1 | Z109: 0 | AA109: 370 | AB109: 229 | AC109: =(AA109*100)/AB109 -> 161.57205240174673 | AD109: =(X109*4)+(Z109*2) -> 8
A110: BOX HILL | C110: THOMPSON 5 | F110: COLE 5 | H110: BARNETT 3 | J110: DAWSON 2 | L110: JOHNSON 2 | O110: BIERL 2 | Q110: GROWCOTT | S110: HUMPHREY | W110: SUNSHINE | X110: 2 | Y110: 1 | Z110: 0 | AA110: 447 | AB110: 296 | AC110: =(AA110*100)/AB110 -> 151.01351351351352 | AD110: =(X110*4)+(Z110*2) -> 8
A111: MORDIALLOC | C111: WILKINSON 4 | F111: STUDHAM 3 | I111: R McGUINNESS 2 | M111: WILKINS | O111: PIERCE | Q111: McFARLAND | W111: NORTHCOTE | X111: 2 | Y111: 1 | Z111: 0 | AA111: 298 | AB111: 254 | AC111: =(AA111*100)/AB111 -> 117.32283464566929 | AD111: =(X111*4)+(Z111*2) -> 8
A113: NORTHCOTE | C113: 6 | D113: 4 | E113: =C113*6+D113 -> 40 | G113: 11 | H113: 9 | I113: =G113*6+H113 -> 75 | K113: 16 | L113: 13 | M113: =K113*6+L113 -> 109 | O113: 19 | P113: 19 | Q113: =O113*6+P113 -> 133 | S113: NORTHCOTE | W113: CAMBERWELL | X113: 2 | Y113: 1 | Z113: 0 | AA113: 254 | AB113: 266 | AC113: =(AA113*100)/AB113 -> 95.488721804511272 | AD113: =(X113*4)+(Z113*2) -> 8
A114: FRANKSTON | C114: 4 | D114: 1 | E114: =C114*6+D114 -> 25 | G114: 6 | H114: 3 | I114: =G114*6+H114 -> 39 | K114: 8 | L114: 7 | M114: =K114*6+L114 -> 55 | O114: 9 | P114: 9 | Q114: =O114*6+P114 -> 63 | S114: ANDERSON | W114: BOX HILL | X114: 1 | Y114: 2 | Z114: 0 | AA114: 337 | AB114: 340 | AC114: =(AA114*100)/AB114 -> 99.117647058823536 | AD114: =(X114*4)+(Z114*2) -> 4
A115: BEST PLAYERS | W115: MORDIALLOC | X115: 1 | Y115: 2 | Z115: 0 | AA115: 262 | AB115: 289 | AC115: =(AA115*100)/AB115 -> 90.65743944636678 | AD115: =(X115*4)+(Z115*2) -> 4
A116: NORTHCOTE | C116: VINEY | F116: LASKIE | I116: KREYMBORG | L116: PITTS | N116: RYAN | Q116: LEECH | W116: FRANKSTON | X116: 1 | Y116: 2 | Z116: 0 | AA116: 310 | AB116: 384 | AC116: =(AA116*100)/AB116 -> 80.729166666666671 | AD116: =(X116*4)+(Z116*2) -> 4
A117: FRANKSTON | C117: RENOUF | F117: ROSENBROCK | I117: LOVELOCK | L117: GRAHAM | N117: FISHER | Q117: ROWE | W117: BRUNSWICK | X117: 1 | Y117: 2 | Z117: 0 | AA117: 266 | AB117: 373 | AC117: =(AA117*100)/AB117 -> 71.31367292225201 | AD117: =(X117*4)+(Z117*2) -> 4
A118: GOALKICKERS | W118: WERRIBEE | X118: 0 | Y118: 3 | Z118: 0 | AA118: 204 | AB118: 440 | AC118: =(AA118*100)/AB118 -> 46.363636363636367 | AD118: =(X118*4)+(Z118*2) -> 0
A119: NORTHCOTE | C119: LASKIE 6 | E119: VINEY 4 | G119: RYAN 2 | I119: KREYMBORG 2 | L119: COHEN | N119: MARTIN | P119: TREGANZA | S119: STANLEY | U119: STILSBY
A120: FRANKSTON | C120: FISHER 3 | F120: LOVELOCK 2 | I120: GRAHAM 2 | L120: BURNS | N120: BEAMAN
A122: SUNSHINE | C122: 8 | D122: 8 | E122: =C122*6+D122 -> 56 | G122: 13 | H122: 11 | I122: =G122*6+H122 -> 89 | K122: 19 | L122: 19 | M122: =K122*6+L122 -> 133 | O122: 27 | P122: 24 | Q122: =O122*6+P122 -> 186 | S122: SUNSHINE
A123: WERRIBEE | C123: 1 | D123: 1 | E123: =C123*6+D123 -> 7 | G123: 5 | H123: 3 | I123: =G123*6+H123 -> 33 | K123: 6 | L123: 5 | M123: =K123*6+L123 -> 41 | O123: 9 | P123: 6 | Q123: =O123*6+P123 -> 60 | S123: GAMBETTA
A124: BEST PLAYERS
A125: SUNSHINE | C125: GOOLD | F125: WAGLAND | I125: CLARKE | L125: FERGUSON | O125: CLIFFORD
A126: WERRIBEE | C126: NEWMAN | F126: LLOYD | I126: HART | L126: ARRIGO | O126: EDWARDS
A127: GOALKICKERS
A128: SUNSHINE | C128: FERGUSON 7 | F128: McKENZIE 5 | I128: CRAWFORD 4 | L128: WAGLAND 3 | O128: PRIOR 2 | Q128: GOOLD 2 | S128: BENSON 2 | V128: JAMIESON | X128: McGREGOR
A129: WERRIBEE | C129: ROBINSON 3 | F129: HINKLEY 3 | I129: HART 2 | K129: BUTTON
A131: YARRAVILLE | C131: 2 | D131: 1 | E131: =C131*6+D131 -> 13 | G131: 8 | H131: 8 | I131: =G131*6+H131 -> 56 | K131: 8 | L131: 11 | M131: =K131*6+L131 -> 59 | O131: 17 | P131: 16 | Q131: =O131*6+P131 -> 118 | S131: YARRAVILLE
A132: BRUNSWICK | C132: 4 | D132: 2 | E132: =C132*6+D132 -> 26 | G132: 5 | H132: 3 | I132: =G132*6+H132 -> 33 | K132: 8 | L132: 7 | M132: =K132*6+L132 -> 55 | O132: 10 | P132: 10 | Q132: =O132*6+P132 -> 70 | S132: HOLZER
A133: BEST PLAYERS
A134: YARRAVILLE | C134: WAGHORNE | F134: BROWN | I134: MARTIN | L134: MATHESON | O134: DOLL | R134: QUARANTOTTO
A135: BRUNSWICK | C135: O'BRIEN | F135: MILLER | I135: EGAN | L135: DENMEAD | O135: WALLIS
A136: GOALKICKERS
A137: YARRAVILLE | C137: BONGETTI 5 | F137: CALAZ 3 | H137: KNOTT 2 | J137: MARTIN 2 | M137: MADIGAN 2 | P137: McLAREN | R137: BARROW | U137: BROWN
A138: BRUNSWICK | C138: WALLIS 3 | F138: DIMMATINA 2 | I138: COOK | K138: PERRY | M138: WROUT | O138: WADHAM | R138: SCHIMMELBUSCH
A140: CAMBERWELL | C140: 8 | D140: 4 | E140: =C140*6+D140 -> 52 | G140: 10 | H140: 5 | I140: =G140*6+H140 -> 65 | K140: 14 | L140: 9 | M140: =K140*6+L140 -> 93 | O140: 14 | P140: 10 | Q140: =O140*6+P140 -> 94 | S140: CAMBERWELL
A141: CAULFIELD | C141: 2 | D141: 1 | E141: =C141*6+D141 -> 13 | G141: 5 | H141: 3 | I141: =G141*6+H141 -> 33 | K141: 9 | L141: 6 | M141: =K141*6+L141 -> 60 | O141: 13 | P141: 13 | Q141: =O141*6+P141 -> 91 | S141: CHINN
A142: BEST PLAYERS
A143: CAMBERWELL | C143: DE BONDE | F143: EVANS | I143: McDONALD | L143: SUTTON | O143: MACKINLAY | R143: SAUERBERG
A144: CAULFIELD | C144: BROWN | F144: MAGUIRE | I144: ROBINSON | L144: ARRELL | O144: FELDMANN
A145: GOALKICKERS
A146: CAMBERWELL | C146: SUTTON 3 | E146: SIMPSON 3 | H146: FOX 2 | J146: MACKINLAY 2 | M146: EVANS 2 | O146: REES | Q146: KEDDIE
A147: CAULFIELD | C147: ROBINSON 3 | F147: JEWELL 2 | I147: CROWE 2 | K147: GOWANS 2 | M147: BROWN | O147: ARRELL | Q147: CLIFF | S147: WILLIAMS
A149: ROUND 4 | E149: 8TH MAY | J149: WEATHER | S149: PLAYED AT
D150: 1ST QTR | H150: 2ND QTR | L150: 3RD QTR | P150: FINAL | S150: FRANKSTON
A151: FRANKSTON | C151: 7 | D151: 6 | E151: =C151*6+D151 -> 48 | G151: 12 | H151: 9 | I151: =G151*6+H151 -> 81 | K151: 15 | L151: 10 | M151: =K151*6+L151 -> 100 | O151: 19 | P151: 13 | Q151: =O151*6+P151 -> 127 | S151: UMPIRE | X151: LADDER | AB151: ROUND | AD151: 4
A152: CAMBERWELL | C152: 2 | D152: 1 | E152: =C152*6+D152 -> 13 | G152: 9 | H152: 5 | I152: =G152*6+H152 -> 59 | K152: 17 | L152: 7 | M152: =K152*6+L152 -> 109 | O152: 19 | P152: 13 | Q152: =O152*6+P152 -> 127 | S152: FLANAGAN
A153: BEST PLAYERS | W153: TEAM | X153: W | Y153: L | Z153: D | AA153: FOR | AB153: AGST | AC153: % | AD153: PTS
A154: FRANKSTON | C154: ROWE | F154: LOVELOCK | I154: LEWIS | L154: WINSTANLEY | O154: GRAHAM | R154: CLARKE
A155: CAMBERWELL | C155: CONYERS | F155: EVANS | I155: YUNGHANNS | L155: D BOYD | O155: PHILLIPS | R155: REES | W155: SUNSHINE | X155: 3 | Y155: 1 | Z155: 0 | AA155: 623 | AB155: 341 | AC155: =(AA155*100)/AB155 -> 182.69794721407624 | AD155: =(X155*4)+(Z155*2) -> 12
A156: GOALKICKERS | O156: RENOUF | W156: CAULFIELD | X156: 3 | Y156: 1 | Z156: 0 | AA156: 481 | AB156: 302 | AC156: =(AA156*100)/AB156 -> 159.27152317880794 | AD156: =(X156*4)+(Z156*2) -> 12
A157: FRANKSTON | C157: CLARKE 4 | E157: STAPLETON 3 | H157: GRAHAM 3 | J157: SHEPHERD 3 | M157: WINSTANLEY 2 | P157: NEWMAN | R157: ROWE | T157: VISSER | W157: YARRAVILLE | X157: 3 | Y157: 1 | Z157: 0 | AA157: 495 | AB157: 410 | AC157: =(AA157*100)/AB157 -> 120.73170731707317 | AD157: =(X157*4)+(Z157*2) -> 12
A158: CAMBERWELL | C158: EVANS 4 | E158: YUNGHANNS 4 | H158: REES 2 | J158: EDWARDS 2 | M158: CONYERS 2 | P158: FOX 2 | R158: PHILLIPS | W158: CAMBERWELL | X158: 2 | Y158: 1 | Z158: 1 | AA158: 381 | AB158: 393 | AC158: =(AA158*100)/AB158 -> 96.946564885496187 | AD158: =(X158*4)+(Z158*2) -> 10
I159: MACKINLAY | L159: SUTTON
A160: SUNSHINE | C160: 7 | D160: 3 | E160: =C160*6+D160 -> 45 | G160: 14 | H160: 10 | I160: =G160*6+H160 -> 94 | K160: 19 | L160: 15 | M160: =K160*6+L160 -> 129 | O160: 26 | P160: 20 | Q160: =O160*6+P160 -> 176 | S160: SUNSHINE | W160: BOX HILL | X160: 2 | Y160: 2 | Z160: 0 | AA160: 475 | AB160: 450 | AC160: =(AA160*100)/AB160 -> 105.55555555555556 | AD160: =(X160*4)+(Z160*2) -> 8
A161: MORDIALLOC | C161: 1 | D161: 4 | E161: =C161*6+D161 -> 10 | G161: 1 | H161: 6 | I161: =G161*6+H161 -> 12 | K161: 3 | L161: 11 | M161: =K161*6+L161 -> 29 | O161: 5 | P161: 15 | Q161: =O161*6+P161 -> 45 | S161: JACKSON | W161: NORTHCOTE | X161: 2 | Y161: 2 | Z161: 0 | AA161: 408 | AB161: 392 | AC161: =(AA161*100)/AB161 -> 104.08163265306122 | AD161: =(X161*4)+(Z161*2) -> 8
A162: BEST PLAYERS | W162: BRUNSWICK | X162: 2 | Y162: 2 | Z162: 0 | AA162: 420 | AB162: 419 | AC162: =(AA162*100)/AB162 -> 100.23866348448688 | AD162: =(X162*4)+(Z162*2) -> 8
A163: SUNSHINE | C163: WAGLAND | F163: WOODS | I163: CRAWFORD | L163: McKENZIE | O163: IBRAHIM | Q163: NICHOLSON | W163: FRANKSTON | X163: 1 | Y163: 2 | Z163: 1 | AA163: 437 | AB163: 511 | AC163: =(AA163*100)/AB163 -> 85.518590998043052 | AD163: =(X163*4)+(Z163*2) -> 6
A164: MORDIALLOC | C164: WILKINSON | F164: McFARLAND | I164: STUDHAM | L164: SMITH | O164: LANG | W164: MORDIALLOC | X164: 1 | Y164: 3 | Z164: 0 | AA164: 307 | AB164: 465 | AC164: =(AA164*100)/AB164 -> 66.021505376344081 | AD164: =(X164*4)+(Z164*2) -> 4
A165: GOALKICKERS | W165: WERRIBEE | X165: 0 | Y165: 4 | Z165: 0 | AA165: 250 | AB165: 594 | AC165: =(AA165*100)/AB165 -> 42.08754208754209 | AD165: =(X165*4)+(Z165*2) -> 0
A166: SUNSHINE | C166: McKENZIE 6 | F166: WAGLAND 6 | I166: JAMIESON 3 | K166: BENSON 3 | M166: PRIOR 2 | O166: CRAWFORD 2 | R166: GOOLD 2 | T166: BEAN 2
A167: MORDIALLOC | C167: WILKINSON 2 | F167: McFARLAND | I167: R McGUINNESS | L167: FORD
E168: 9TH MAY | I168: WEATHER
A169: CAULFIELD | C169: 3 | D169: 3 | E169: =C169*6+D169 -> 21 | G169: 10 | H169: 9 | I169: =G169*6+H169 -> 69 | K169: 13 | L169: 16 | M169: =K169*6+L169 -> 94 | O169: 15 | P169: 21 | Q169: =O169*6+P169 -> 111 | S169: PRINCES PARK, CAULFIELD
A170: YARRAVILLE | C170: 4 | D170: 7 | E170: =C170*6+D170 -> 31 | G170: 4 | H170: 9 | I170: =G170*6+H170 -> 33 | K170: 5 | L170: 16 | M170: =K170*6+L170 -> 46 | O170: 9 | P170: 19 | Q170: =O170*6+P170 -> 73 | S170: TURNER
A171: BEST PLAYERS
A172: CAULFIELD | C172: LOGAN | F172: CLIFF | I172: R JEWELL | L172: ARRELL | O172: GOWANS | R172: MAGUIRE
A173: YARRAVILLE | C173: SQUIRES | F173: FARLEY | I173: WARWICK | L173: MADIGAN | O173: KNOTT | R173: BONGETTI
A174: GOALKICKERS
A175: CAULFIELD | C175: BROWN 5 | F175: R JEWELL 4 | I175: GOWANS | K175: HOCKING | M175: ? 1 | O175: BAKER | Q175: ROBINSON | T175: T JEWELL
A176: YARRAVILLE | C176: BONGETTI 4 | F176: WARWICK 2 | I176: STURNEIKS 2 | L176: BARROW
A178: BOX HILL | C178: 5 | D178: 4 | E178: =C178*6+D178 -> 34 | G178: 11 | H178: 7 | I178: =G178*6+H178 -> 73 | K178: 16 | L178: 12 | M178: =K178*6+L178 -> 108 | O178: 20 | P178: 18 | Q178: =O178*6+P178 -> 138 | S178: BOX HILL
A179: NORTHCOTE | C179: 3 | D179: 6 | E179: =C179*6+D179 -> 24 | G179: 7 | H179: 13 | I179: =G179*6+H179 -> 55 | K179: 10 | L179: 17 | M179: =K179*6+L179 -> 77 | O179: 15 | P179: 20 | Q179: =O179*6+P179 -> 110 | S179: McMASTER
A180: BEST PLAYERS
A181: BOX HILL | C181: COBAIN | F181: HUMPHREY | I181: COLE | L181: DAWSON | O181: THOMAS | R181: JOHNSON
A182: NORTHCOTE | C182: KOZARIS | F182: RYAN | I182: LASKIE | L182: COHEN | O182: PITTS
A183: GOALKICKERS
A184: BOX HILL | C184: BAKER 4 | E184: HUMPHREY 3 | H184: COLE 3 | J184: BIERL 2 | L184: BENNETT 2 | N184: THOMPSON 2 | Q184: SMITH | S184: JOHNSON | V184: COBAIN | X184: DAWSON
A185: NORTHCOTE | C185: McORIST 4 | F185: RYAN 3 | H185: COHEN 3 | J185: VINEY | L185: MARTIN | N185: LASKIE | P185: KREYMBORG | S185: STILSBY
A187: BRUNSWICK | C187: 7 | D187: 3 | E187: =C187*6+D187 -> 45 | G187: 7 | H187: 7 | I187: =G187*6+H187 -> 49 | K187: 12 | L187: 13 | M187: =K187*6+L187 -> 85 | O187: 23 | P187: 16 | Q187: =O187*6+P187 -> 154 | S187: BRUNSWICK
A188: WERRIBEE | C188: 1 | D188: 1 | E188: =C188*6+D188 -> 7 | G188: 3 | H188: 2 | I188: =G188*6+H188 -> 20 | K188: 6 | L188: 4 | M188: =K188*6+L188 -> 40 | O188: 7 | P188: 4 | Q188: =O188*6+P188 -> 46 | S188: ABBOTT
A189: BEST PLAYERS
A190: BRUNSWICK | C190: DENMEAD | F190: O'BRIEN | I190: WALLIS | L190: OGSTON | O190: HADZILLIAS | R190: WHELAN
A191: WERRIBEE | C191: NEWMAN | F191: LLOYD | I191: ARRIGO | L191: EDWARDS | O191: PAGE
A192: GOALKICKERS
A193: BRUNSWICK | C193: WALLIS 7 | F193: WHELAN 5 | I193: COOK 4 | K193: DIMMATINA 2 | N193: OGSTON 2 | Q193: HARRISON | S193: SCHIMMELBUSCH | W193: HADZILLIAS
A194: WERRIBEE | C194: CLAUGHTON 2 | F194: MONTGOMERY 2 | J194: ARRIGO | M194: H? 1 | O194: YOUNG
A196: ROUND 5 | E196: 15TH MAY | J196: WEATHER | S196: PLAYED AT
D197: 1ST QTR | H197: 2ND QTR | L197: 3RD QTR | P197: FINAL | S197: NORTHCOTE
A198: NORTHCOTE | C198: 4 | D198: 5 | E198: =C198*6+D198 -> 29 | G198: 10 | H198: 5 | I198: =G198*6+H198 -> 65 | K198: 16 | L198: 11 | M198: =K198*6+L198 -> 107 | O198: 21 | P198: 14 | Q198: =O198*6+P198 -> 140 | S198: UMPIRE | X198: LADDER | AB198: ROUND | AD198: 5
A199: MORDIALLOC | C199: 4 | D199: 4 | E199: =C199*6+D199 -> 28 | G199: 7 | H199: 10 | I199: =G199*6+H199 -> 52 | K199: 12 | L199: 13 | M199: =K199*6+L199 -> 85 | O199: 18 | P199: 20 | Q199: =O199*6+P199 -> 128 | S199: CHINN
A200: BEST PLAYERS | W200: TEAM | X200: W | Y200: L | Z200: D | AA200: FOR | AB200: AGST | AC200: % | AD200: PTS
A201: NORTHCOTE | C201: COHEN | F201: KINNEALLY | I201: RYAN | L201: PITTS | O201: VINEY | Q201: SMITH
A202: MORDIALLOC | C202: SMITH | F202: HARRY | I202: McFARLAND | L202: SCAIFFE | O202: DANCKERT | R202: MARTELLO | W202: CAULFIELD | X202: 4 | Y202: 1 | Z202: 0 | AA202: 669 | AB202: 344 | AC202: =(AA202*100)/AB202 -> 194.47674418604652 | AD202: =(X202*4)+(Z202*2) -> 16
A203: GOALKICKERS | W203: SUNSHINE | X203: 4 | Y203: 1 | Z203: 0 | AA203: 817 | AB203: 452 | AC203: =(AA203*100)/AB203 -> 180.75221238938053 | AD203: =(X203*4)+(Z203*2) -> 16
A204: NORTHCOTE | C204: COHEN 10 | F204: LASKIE 4 | H204: STANLEY 2 | K204: GARRETT | M204: RYAN | O204: STILSBY | Q204: VINEY | S204: LEECH | W204: YARRAVILLE | X204: 4 | Y204: 1 | Z204: 0 | AA204: 647 | AB204: 473 | AC204: =(AA204*100)/AB204 -> 136.78646934460889 | AD204: =(X204*4)+(Z204*2) -> 16
A205: MORDIALLOC | C205: HARRY 4 | F205: MATTHEWS 4 | I205: MARTELLO 4 | L205: McFARLAND 3 | O205: SCAIFFE 2 | R205: SMITH | W205: BRUNSWICK | X205: 3 | Y205: 2 | Z205: 0 | AA205: 561 | AB205: 504 | AC205: =(AA205*100)/AB205 -> 111.30952380952381 | AD205: =(X205*4)+(Z205*2) -> 12
E206: 16TH MAY | I206: WEATHER
A207: CAULFIELD | C207: 4 | D207: 6 | E207: =C207*6+D207 -> 30 | G207: 11 | H207: 10 | I207: =G207*6+H207 -> 76 | K207: 20 | L207: 15 | M207: =K207*6+L207 -> 135 | O207: 28 | P207: 20 | Q207: =O207*6+P207 -> 188 | S207: WERRIBEE | W207: NORTHCOTE | X207: 3 | Y207: 2 | Z207: 0 | AA207: 548 | AB207: 520 | AC207: =(AA207*100)/AB207 -> 105.38461538461539 | AD207: =(X207*4)+(Z207*2) -> 12
A208: WERRIBEE | C208: 1 | D208: 1 | E208: =C208*6+D208 -> 7 | G208: 3 | H208: 1 | I208: =G208*6+H208 -> 19 | K208: 4 | L208: 5 | M208: =K208*6+L208 -> 29 | O208: 6 | P208: 6 | Q208: =O208*6+P208 -> 42 | S208: ANDERSON | W208: CAMBERWELL | X208: 2 | Y208: 2 | Z208: 1 | AA208: 444 | AB208: 545 | AC208: =(AA208*100)/AB208 -> 81.467889908256879 | AD208: =(X208*4)+(Z208*2) -> 10
A209: BEST PLAYERS | W209: BOX HILL | X209: 2 | Y209: 3 | Z209: 0 | AA209: 560 | AB209: 691 | AC209: =(AA209*100)/AB209 -> 81.041968162083933 | AD209: =(X209*4)+(Z209*2) -> 8
A210: CAULFIELD | C210: T JEWELL | F210: BROWN | I210: ROBINSON | L210: GOWANS | O210: FELDMANN | W210: FRANKSTON | X210: 1 | Y210: 3 | Z210: 1 | AA210: 548 | AB210: 705 | AC210: =(AA210*100)/AB210 -> 77.730496453900713 | AD210: =(X210*4)+(Z210*2) -> 6
A211: WERRIBEE | C211: BOURKE | F211: RICHENS | I211: NEWMAN | L211: EDWARDS | O211: RIDDELL | W211: MORDIALLOC | X211: 1 | Y211: 4 | Z211: 0 | AA211: 435 | AB211: 605 | AC211: =(AA211*100)/AB211 -> 71.900826446280988 | AD211: =(X211*4)+(Z211*2) -> 4
A212: GOALKICKERS | M212: R JEWELL | P212: T JEWELL | W212: WERRIBEE | X212: 0 | Y212: 5 | Z212: 0 | AA212: 292 | AB212: 782 | AC212: =(AA212*100)/AB212 -> 37.340153452685421 | AD212: =(X212*4)+(Z212*2) -> 0
A213: CAULFIELD | C213: BROWN 8 | F213: ROBINSON 8 | I213: GOWANS 3 | K213: HOCKING 3 | N213: ARRELL | P213: CROWE | R213: BAKER | T213: LOGAN
A214: WERRIBEE | C214: MONTGOMERY 2 | F214: CLAUGHTON | I214: HINKLEY | L214: BOURKE | N214: LEECE
A216: YARRAVILLE | C216: 5 | D216: 0 | E216: =C216*6+D216 -> 30 | G216: 14 | H216: 3 | I216: =G216*6+H216 -> 87 | K216: 17 | L216: 5 | M216: =K216*6+L216 -> 107 | O216: 24 | P216: 8 | Q216: =O216*6+P216 -> 152 | S216: YARRAVILLE
A217: CAMBERWELL | C217: 1 | D217: 6 | E217: =C217*6+D217 -> 12 | G217: 2 | H217: 6 | I217: =G217*6+H217 -> 18 | K217: 5 | L217: 14 | M217: =K217*6+L217 -> 44 | O217: 7 | P217: 21 | Q217: =O217*6+P217 -> 63 | S217: DUGARD
A218: BEST PLAYERS
A219: YARRAVILLE | C219: MADIGAN | F219: KNOTT | I219: WARWICK | L219: MATHESON | O219: HEATH | Q219: BROWN
A220: CAMBERWELL | C220: CONYERS | F220: EDWARDS | I220: HAZLETT | L220: EVANS | O220: MACKINLAY
A221: GOALKICKERS
A222: YARRAVILLE | C222: MADIGAN 8 | F222: SALMON 4 | I222: BONGETTI 3 | L222: WARWICK 3 | N222: RYAN 2 | P222: DOWLING 2 | S222: STURNEIKS | V222: MATHESON
A223: CAMBERWELL | C223: YUNGHANNS 3 | F223: REES | H223: TAYLOR | J223: EDWARDS | M223: HAZLETT
A225: BRUNSWICK | C225: 5 | D225: 2 | E225: =C225*6+D225 -> 32 | G225: 11 | H225: 7 | I225: =G225*6+H225 -> 73 | K225: 16 | L225: 7 | M225: =K225*6+L225 -> 103 | O225: 22 | P225: 9 | Q225: =O225*6+P225 -> 141 | S225: BOX HILL
A226: BOX HILL | C226: 1 | D226: 5 | E226: =C226*6+D226 -> 11 | G226: 5 | H226: 12 | I226: =G226*6+H226 -> 42 | K226: 8 | L226: 16 | M226: =K226*6+L226 -> 64 | O226: 11 | P226: 19 | Q226: =O226*6+P226 -> 85 | S226: GAMBETTA
A227: BEST PLAYERS
A228: BRUNSWICK | C228: WALLIS | F228: NIVEN | I228: O'BRIEN | L228: DIMMATINA | O228: DENMEAD
A229: BOX HILL | C229: COLE | F229: HUNT | I229: SMITH | L229: HUMPHREY | O229: COBAIN
A230: GOALKICKERS
A231: BRUNSWICK | C231: WALLIS 6 | F231: COOK 5 | H231: WHELAN 3 | J231: HARRISON 2 | M231: DIMMATINA 2 | P231: OGSTON 2 | R231: DALTON 2
A232: BOX HILL | C232: BARNETT 4 | F232: SMITH 2 | H232: COLE 2 | J232: THOMPSON 2 | M232: DAWSON | O232: VICK | Q232: ? 1
A234: SUNSHINE | C234: 3 | D234: 5 | E234: =C234*6+D234 -> 23 | G234: 10 | H234: 11 | I234: =G234*6+H234 -> 71 | K234: 17 | L234: 16 | M234: =K234*6+L234 -> 118 | O234: 29 | P234: 20 | Q234: =O234*6+P234 -> 194 | S234: FRANKSTON
A235: FRANKSTON | C235: 4 | D235: 5 | E235: =C235*6+D235 -> 29 | G235: 10 | H235: 8 | I235: =G235*6+H235 -> 68 | K235: 13 | L235: 9 | M235: =K235*6+L235 -> 87 | O235: 17 | P235: 9 | Q235: =O235*6+P235 -> 111 | S235: TURNER
A236: BEST PLAYERS
A237: SUNSHINE | C237: IBRAHIM | F237: McKENZIE | I237: CRAWFORD | L237: WAGLAND | O237: PRIOR | R237: FERGUSON
A238: FRANKSTON | C238: BEAMAN | F238: BLAKE | I238: GRAHAM | L238: LOVELOCK | O238: COUTTS | R238: LLOYD
A239: GOALKICKERS
A240: SUNSHINE | C240: CRAWFORD 7 | F240: McKENZIE 6 | I240: FERGUSON 6 | K240: WAGLAND 3 | N240: CHADWICK 2 | Q240: IBRAHIM 2 | S240: PRIOR | U240: DOWNS | W240: CLARK
A241: FRANKSTON | C241: KERR 4 | E241: STAPLETON 4 | H241: COUTTS 3 | K241: LLOYD 3 | M241: SHEPHERD 2 | P241: GRAHAM
A243: ROUND 6 | E243: 22ND MAY | J243: WEATHER | S243: PLAYED AT
D244: 1ST QTR | H244: 2ND QTR | L244: 3RD QTR | P244: FINAL | S244: MORDIALLOC
A245: MORDIALLOC | C245: 3 | D245: 2 | E245: =C245*6+D245 -> 20 | G245: 8 | H245: 8 | I245: =G245*6+H245 -> 56 | K245: 10 | L245: 10 | M245: =K245*6+L245 -> 70 | O245: 16 | P245: 11 | Q245: =O245*6+P245 -> 107 | S245: UMPIRE | X245: LADDER | AB245: ROUND | AD245: 6
A246: FRANKSTON | C246: 0 | D246: 2 | E246: =C246*6+D246 -> 2 | G246: 2 | H246: 4 | I246: =G246*6+H246 -> 16 | K246: 5 | L246: 10 | M246: =K246*6+L246 -> 40 | O246: 7 | P246: 15 | Q246: =O246*6+P246 -> 57 | S246: HOLZER
A247: BEST PLAYERS | W247: TEAM | X247: W | Y247: L | Z247: D | AA247: FOR | AB247: AGST | AC247: % | AD247: PTS
A248: MORDIALLOC | C248: B McGUINNESS | F248: HARRY | I248: ZEALLY | K248: DANCKERT | N248: SMITH | Q248: McFARLAND
A249: FRANKSTON | C249: COOPER | F249: RENOUF | I249: LOVELOCK | L249: KERR | N249: McNAB | W249: CAULFIELD | X249: 5 | Y249: 1 | Z249: 0 | AA249: 792 | AB249: 446 | AC249: =(AA249*100)/AB249 -> 177.57847533632287 | AD249: =(X249*4)+(Z249*2) -> 20
A250: GOALKICKERS | W250: SUNSHINE | X250: 5 | Y250: 1 | Z250: 0 | AA250: 935 | AB250: 544 | AC250: =(AA250*100)/AB250 -> 171.875 | AD250: =(X250*4)+(Z250*2) -> 20
A251: MORDIALLOC | C251: R McGUINNESS 5 | F251: HARRY 3 | I251: SMITH 2 | K251: STUDHAM 2 | N251: McFARLAND 2 | Q251: MARTELLO | T251: SCAIFFE | W251: YARRAVILLE | X251: 5 | Y251: 1 | Z251: 0 | AA251: 777 | AB251: 596 | AC251: =(AA251*100)/AB251 -> 130.36912751677852 | AD251: =(X251*4)+(Z251*2) -> 20
A252: FRANKSTON | C252: COOPER 2 | F252: KERR | H252: LOVELOCK | K252: STAPLETON | N252: ROWE | P252: COUTTS | W252: CAMBERWELL | X252: 3 | Y252: 2 | Z252: 1 | AA252: 533 | AB252: 631 | AC252: =(AA252*100)/AB252 -> 84.469096671949288 | AD252: =(X252*4)+(Z252*2) -> 14
E253: 23RD MAY | J253: WEATHER
A254: SUNSHINE | C254: 3 | D254: 4 | E254: =C254*6+D254 -> 22 | G254: 6 | H254: 7 | I254: =G254*6+H254 -> 43 | K254: 14 | L254: 14 | M254: =K254*6+L254 -> 98 | O254: 16 | P254: 22 | Q254: =O254*6+P254 -> 118 | S254: SUNSHINE | W254: BRUNSWICK | X254: 3 | Y254: 3 | Z254: 0 | AA254: 663 | AB254: 627 | AC254: =(AA254*100)/AB254 -> 105.74162679425838 | AD254: =(X254*4)+(Z254*2) -> 12
A255: BOX HILL | C255: 7 | D255: 2 | E255: =C255*6+D255 -> 44 | G255: 11 | H255: 6 | I255: =G255*6+H255 -> 72 | K255: 12 | L255: 7 | M255: =K255*6+L255 -> 79 | O255: 14 | P255: 8 | Q255: =O255*6+P255 -> 92 | S255: ABBOTT | W255: NORTHCOTE | X255: 3 | Y255: 3 | Z255: 0 | AA255: 671 | AB255: 650 | AC255: =(AA255*100)/AB255 -> 103.23076923076923 | AD255: =(X255*4)+(Z255*2) -> 12
A256: BEST PLAYERS | W256: MORDIALLOC | X256: 2 | Y256: 4 | Z256: 0 | AA256: 542 | AB256: 662 | AC256: =(AA256*100)/AB256 -> 81.873111782477338 | AD256: =(X256*4)+(Z256*2) -> 8
A257: SUNSHINE | C257: IBRAHIM | F257: CRAWFORD | I257: PRIOR | L257: GOOLD | O257: CLARKE | R257: WAGLAND | W257: BOX HILL | X257: 2 | Y257: 4 | Z257: 0 | AA257: 652 | AB257: 809 | AC257: =(AA257*100)/AB257 -> 80.593325092707047 | AD257: =(X257*4)+(Z257*2) -> 8
A258: BOX HILL | C258: BAKER | F258: HUNT | I258: BIERL | L258: THOMPSON | O258: BARNETT | R258: VICK | W258: FRANKSTON | X258: 1 | Y258: 4 | Z258: 1 | AA258: 605 | AB258: 812 | AC258: =(AA258*100)/AB258 -> 74.50738916256158 | AD258: =(X258*4)+(Z258*2) -> 6
A259: GOALKICKERS | W259: WERRIBEE | X259: 0 | Y259: 6 | Z259: 0 | AA259: 378 | AB259: 871 | AC259: =(AA259*100)/AB259 -> 43.398392652123995 | AD259: =(X259*4)+(Z259*2) -> 0
A260: SUNSHINE | C260: PRIOR 3 | E260: GOOLD 3 | G260: McKENZIE 3 | J260: FERGUSON 2 | M260: WAGLAND 2 | P260: CRAWFORD 2 | S260: DOWNS
A261: BOX HILL | C261: BARNETT 5 | F261: COLE 4 | H261: ZANTUCK 2 | K261: VICK 2 | M261: THOMPSON
A263: CAULFIELD | C263: 4 | D263: 1 | E263: =C263*6+D263 -> 25 | G263: 9 | H263: 4 | I263: =G263*6+H263 -> 58 | K263: 16 | L263: 12 | M263: =K263*6+L263 -> 108 | O263: 18 | P263: 15 | Q263: =O263*6+P263 -> 123 | S263: BRUNSWICK
A264: BRUNSWICK | C264: 5 | D264: 5 | E264: =C264*6+D264 -> 35 | G264: 10 | H264: 7 | I264: =G264*6+H264 -> 67 | K264: 12 | L264: 8 | M264: =K264*6+L264 -> 80 | O264: 15 | P264: 12 | Q264: =O264*6+P264 -> 102 | S264: McKENZIE
A265: BEST PLAYERS
A266: CAULFIELD | C266: FELDMANN | F266: BROWN | I266: ARRELL | L266: ROBINSON | O266: CLIFF | Q266: GOWANS
A267: BRUNSWICK | C267: DIMMATINA | F267: DENMEAD | I267: GENT | L267: ROBINSON | O267: O'BRIEN | Q267: WHELAN
A268: GOALKICKERS
A269: CAULFIELD | C269: ROBINSON 5 | F269: R JEWELL 4 | I269: BROWN 2 | K269: HOCKING 2 | M269: T JEWELL 2 | P269: GOWANS | R269: GLAZNER | U269: FELDMANN
A270: BRUNSWICK | C270: WHELAN 6 | F270: DIMMATINA 3 | I270: O'BRIEN 2 | K270: WALLIS 2 | M270: COOK | O270: BOOTH
A272: CAMBERWELL | C272: 4 | D272: 5 | E272: =C272*6+D272 -> 29 | G272: 8 | H272: 7 | I272: =G272*6+H272 -> 55 | K272: 9 | L272: 14 | M272: =K272*6+L272 -> 68 | O272: 12 | P272: 17 | Q272: =O272*6+P272 -> 89 | S272: CAMBERWELL
A273: WERRIBEE | C273: 3 | D273: 3 | E273: =C273*6+D273 -> 21 | G273: 8 | H273: 5 | I273: =G273*6+H273 -> 53 | K273: 11 | L273: 5 | M273: =K273*6+L273 -> 71 | O273: 13 | P273: 8 | Q273: =O273*6+P273 -> 86 | S273: McMASTER
A274: BEST PLAYERS
A275: CAMBERWELL | C275: EVANS | F275: DE BONDE | I275: EDWARDS | L275: PACIOCCO | O275: SIMPSON | R275: HAZLETT
A276: WERRIBEE | C276: NEWMAN | F276: EDWARDS | I276: WINTLE | L276: BUTTON | O276: BOURKE | R276: HINKLEY
A277: GOALKICKERS
A278: CAMBERWELL | C278: SIMPSON 3 | F278: MACKINLAY 2 | I278: EDWARDS 2 | L278: EVANS 2 | N278: KERR 2 | P278: SUTTON
A279: WERRIBEE | C279: SNOW 3 | F279: LEECE 3 | H279: HART 2 | J279: BUTTON 2 | M279: HINKLEY | O279: PANETTA | R279: PAGE
A281: YARRAVILLE | C281: 3 | D281: 7 | E281: =C281*6+D281 -> 25 | G281: 9 | H281: 8 | I281: =G281*6+H281 -> 62 | K281: 17 | L281: 15 | M281: =K281*6+L281 -> 117 | O281: 19 | P281: 16 | Q281: =O281*6+P281 -> 130 | S281: YARRAVILLE
A282: NORTHCOTE | C282: 3 | D282: 6 | E282: =C282*6+D282 -> 24 | G282: 8 | H282: 10 | I282: =G282*6+H282 -> 58 | K282: 10 | L282: 13 | M282: =K282*6+L282 -> 73 | O282: 17 | P282: 21 | Q282: =O282*6+P282 -> 123 | S282: FLANAGAN
A283: BEST PLAYERS
A284: YARRAVILLE | C284: QUARANTOTTO | F284: WAGHORNE | I284: BROWN | L284: SQUIRES | O284: WARWICK | R284: KNOTT
A285: NORTHCOTE | C285: VINEY | F285: McORIST | I285: KREYMBORG | L285: STANLEY | O285: LASKIE | R285: CONSTANCE
A286: GOALKICKERS
A287: YARRAVILLE | C287: WAGHORNE 6 | F287: MADIGAN 5 | I287: SALMON 3 | K287: BONGETTI 2 | N287: QUARANTOTTO | Q287: MARTIN | S287: STURNEIKS
A288: NORTHCOTE | C288: STANLEY 3 | F288: COHEN 3 | H288: KREYMBORG 3 | K288: VINEY 2 | M288: McORIST | O288: KREYMBORG | R288: LASKIE | T288: PORTER | V288: CONSTANCE | X288: GARRETT
A290: ROUND 7 | E290: 30TH MAY | J290: WEATHER | S290: PLAYED AT
D291: 1ST QTR | H291: 2ND QTR | L291: 3RD QTR | P291: FINAL | S291: WERRIBEE
A292: YARRAVILLE | C292: 4 | D292: 3 | E292: =C292*6+D292 -> 27 | G292: 13 | H292: 7 | I292: =G292*6+H292 -> 85 | K292: 14 | L292: 12 | M292: =K292*6+L292 -> 96 | O292: 18 | P292: 19 | Q292: =O292*6+P292 -> 127 | S292: UMPIRE | X292: LADDER | AB292: ROUND | AD292: 7
A293: WERRIBEE | C293: 9 | D293: 1 | E293: =C293*6+D293 -> 55 | G293: 11 | H293: 3 | I293: =G293*6+H293 -> 69 | K293: 13 | L293: 8 | M293: =K293*6+L293 -> 86 | O293: 15 | P293: 10 | Q293: =O293*6+P293 -> 100 | S293: TORNEY
A294: BEST PLAYERS | W294: TEAM | X294: W | Y294: L | Z294: D | AA294: FOR | AB294: AGST | AC294: % | AD294: PTS
A295: YARRAVILLE | C295: WAGHORNE | F295: MARTIN | I295: BARROW | L295: TAURINS | O295: KNOTT
A296: WERRIBEE | C296: SNOW | F296: MONTGOMERY | I296: FARRELLY | L296: COMBEN | O296: RIDDELL | W296: SUNSHINE | X296: 6 | Y296: 1 | Z296: 0 | AA296: 1086 | AB296: 587 | AC296: =(AA296*100)/AB296 -> 185.0085178875639 | AD296: =(X296*4)+(Z296*2) -> 24
A297: GOALKICKERS | P297: RYAN | W297: CAULFIELD | X297: 6 | Y297: 1 | Z297: 0 | AA297: 879 | AB297: 509 | AC297: =(AA297*100)/AB297 -> 172.69155206286837 | AD297: =(X297*4)+(Z297*2) -> 24
A298: YARRAVILLE | C298: MADIGAN 3 | F298: MARTIN 3 | H298: WARWICK 3 | K298: STURNEIKS 2 | N298: BROWN 2 | P298: SALMON 2 | S298: DOWLING 2 | W298: YARRAVILLE | X298: 6 | Y298: 1 | Z298: 0 | AA298: 904 | AB298: 696 | AC298: =(AA298*100)/AB298 -> 129.88505747126436 | AD298: =(X298*4)+(Z298*2) -> 24
A299: WERRIBEE | C299: COMBEN 4 | F299: HART 2 | H299: HINKLEY 2 | J299: BOURKE 2 | L299: SNOW | N299: ARRIGO | P299: BUTTON | R299: PAGE | S299: PANETTA | W299: BRUNSWICK | X299: 4 | Y299: 3 | Z299: 0 | AA299: 741 | AB299: 691 | AC299: =(AA299*100)/AB299 -> 107.23589001447178 | AD299: =(X299*4)+(Z299*2) -> 16
A301: BRUNSWICK | C301: 2 | D301: 1 | E301: =C301*6+D301 -> 13 | G301: 3 | H301: 11 | I301: =G301*6+H301 -> 29 | K301: 6 | L301: 16 | M301: =K301*6+L301 -> 52 | O301: 10 | P301: 18 | Q301: =O301*6+P301 -> 78 | S301: CAMBERWELL | W301: CAMBERWELL | X301: 3 | Y301: 3 | Z301: 1 | AA301: 597 | AB301: 709 | AC301: =(AA301*100)/AB301 -> 84.203102961918191 | AD301: =(X301*4)+(Z301*2) -> 14
A302: CAMBERWELL | C302: 4 | D302: 0 | E302: =C302*6+D302 -> 24 | G302: 6 | H302: 2 | I302: =G302*6+H302 -> 38 | K302: 8 | L302: 3 | M302: =K302*6+L302 -> 51 | O302: 10 | P302: 4 | Q302: =O302*6+P302 -> 64 | S302: TURNER | W302: NORTHCOTE | X302: 3 | Y302: 4 | Z302: 0 | AA302: 714 | AB302: 801 | AC302: =(AA302*100)/AB302 -> 89.138576779026224 | AD302: =(X302*4)+(Z302*2) -> 12
A303: BEST PLAYERS | W303: BOX HILL | X303: 3 | Y303: 4 | Z303: 0 | AA303: 807 | AB303: 907 | AC303: =(AA303*100)/AB303 -> 88.974641675854471 | AD303: =(X303*4)+(Z303*2) -> 12
A304: BRUNSWICK | C304: O'BRIEN | F304: DIMMATINA | I304: PERRY | L304: MILLER | N304: ROBINSON | Q304: EGAN | W304: MORDIALLOC | X304: 2 | Y304: 5 | Z304: 0 | AA304: 605 | AB304: 749 | AC304: =(AA304*100)/AB304 -> 80.77436582109479 | AD304: =(X304*4)+(Z304*2) -> 8
A305: CAMBERWELL | C305: STEWART | F305: EDWARDS | I305: KERR | L305: KEDDIE | N305: SIMPSON | Q305: DE BONDE | W305: FRANKSTON | X305: 1 | Y305: 5 | Z305: 1 | AA305: 703 | AB305: 967 | AC305: =(AA305*100)/AB305 -> 72.699069286452954 | AD305: =(X305*4)+(Z305*2) -> 6
A306: GOALKICKERS | W306: WERRIBEE | X306: 0 | Y306: 7 | Z306: 0 | AA306: 478 | AB306: 998 | AC306: =(AA306*100)/AB306 -> 47.895791583166336 | AD306: =(X306*4)+(Z306*2) -> 0
A307: BRUNSWICK | C307: DALTON 4 | F307: PERRY 2 | H307: WHELAN | J307: WALLIS | L307: DIMMATINA | O307: ANDERSON
A308: CAMBERWELL | C308: KERR 3 | E308: SIMPSON | G308: MACKINLAY | J308: TAYLOIR | L308: EDWARDS | N308: SUTTON | P308: YUNGHANNS | S308: EVANS
A310: CAULFIELD | C310: 5 | D310: 6 | E310: =C310*6+D310 -> 36 | G310: 6 | H310: 8 | I310: =G310*6+H310 -> 44 | K310: 10 | L310: 14 | M310: =K310*6+L310 -> 74 | O310: 11 | P310: 21 | Q310: =O310*6+P310 -> 87 | S310: PRINCES PARK, CAULFIELD
A311: MORDIALLOC | C311: 1 | D311: 2 | E311: =C311*6+D311 -> 8 | G311: 5 | H311: 6 | I311: =G311*6+H311 -> 36 | K311: 8 | L311: 7 | M311: =K311*6+L311 -> 55 | O311: 9 | P311: 9 | Q311: =O311*6+P311 -> 63 | S311: GAMBETTA
A312: BEST PLAYERS
A313: CAULFIELD | C313: T JEWELL | F313: ARRELL | I313: GOWANS | L313: CLIFF | N313: WHITE | Q313: MAGUIRE
A314: MORDIALLOC | C314: HARRY | F314: STUDHAM | I314: DANCKERT | L314: LAIRD | N314: DEAN
A315: GOALKICKERS
A316: CAULFIELD | C316: R JEWELL 2 | F316: GOWANS 2 | I316: T JEWELL 2 | K316: LOGAN | M316: ROBINSON | O316: CROWE | Q316: BROWN | S316: HOCKING
A317: MORDIALLOC | C317: R McGUINNESS 2 | F317: HARRY 2 | I317: STUDHAM 2 | L317: MARTELLO | O317: SCAIFFE
A319: SUNSHINE | C319: 1 | D319: 5 | E319: =C319*6+D319 -> 11 | G319: 10 | H319: 11 | I319: =G319*6+H319 -> 71 | K319: 13 | L319: 15 | M319: =K319*6+L319 -> 93 | O319: 21 | P319: 25 | Q319: =O319*6+P319 -> 151 | S319: NORTHCOTE
A320: NORTHCOTE | C320: 3 | D320: 5 | E320: =C320*6+D320 -> 23 | G320: 3 | H320: 7 | I320: =G320*6+H320 -> 25 | K320: 3 | L320: 11 | M320: =K320*6+L320 -> 29 | O320: 5 | P320: 13 | Q320: =O320*6+P320 -> 43 | S320: DUGARD
A321: BEST PLAYERS
A322: SUNSHINE | C322: WAGLAND | F322: WOODS | I322: GOOLD | L322: PRIOR | O322: IBRAHIM | R322: BENSON
A323: NORTHCOTE | C323: PITTS | F323: McORIST | I323: LEECH | L323: KINNEALLY | O323: McGORLICK | R323: VINEY
A324: GOALKICKERS
A325: SUNSHINE | C325: McKENZIE 5 | F325: GOOLD 3 | H325: BENSON 3 | J325: PRIOR 2 | L325: IBRAHIM 2 | N325: FERGUSON 2 | Q325: CRAWFORD 2 | T325: JAMIESON | W325: WAGLAND
A326: NORTHCOTE | C326: CONSTANCE 2 | F326: STANLEY | I326: TRGANZA | L326: VINEY
A328: BOX HILL | C328: 4 | D328: 2 | E328: =C328*6+D328 -> 26 | G328: 12 | H328: 12 | I328: =G328*6+H328 -> 84 | K328: 16 | L328: 13 | M328: =K328*6+L328 -> 109 | O328: 23 | P328: 17 | Q328: =O328*6+P328 -> 155 | S328: BOX HILL
A329: FRANKSTON | C329: 8 | D329: 3 | E329: =C329*6+D329 -> 51 | G329: 8 | H329: 5 | I329: =G329*6+H329 -> 53 | K329: 13 | L329: 13 | M329: =K329*6+L329 -> 91 | O329: 14 | P329: 14 | Q329: =O329*6+P329 -> 98 | S329: ANDERSON
A330: BEST PLAYERS
A331: BOX HILL | C331: COBAIN | F331: THOMPSON | I331: BARNETT | L331: HUMPHREY | O331: LUMLEY
A332: FRANKSTON | C332: McNAM | F332: COUTTS | I332: VISSER | L332: GRAHAM | O332: CLARK
A333: GOALKICKERS
A334: BOX HILL | C334: BARNETT 8 | E334: LUMLEY 3 | G334: COBAIN 3 | I334: THOMPSON 2 | L334: VICK 2 | N334: SMITH 2 | P334: COLE | R334: CRISP | S334: HUMPHREY
A335: FRANKSTON | C335: COUTTS 4 | F335: McNAB 3 | I335: CLARK 2 | K335: KERR 2 | M335: LLOYD | O335: SCOTT | Q335: VISSER
A337: ROUND 8 | E337: 5TH JUNE | J337: WEATHER | S337: PLAYED AT
D338: 1ST QTR | H338: 2ND QTR | L338: 3RD QTR | P338: FINAL | S338: MORDIALLOC
A339: MORDIALLOC | E339: =C339*6+D339 -> 0 | I339: =G339*6+H339 -> 0 | M339: =K339*6+L339 -> 0 | O339: 18 | P339: 13 | Q339: =O339*6+P339 -> 121 | S339: UMPIRE | X339: LADDER | AB339: ROUND | AD339: 8
A340: YARRAVILLE | E340: =C340*6+D340 -> 0 | I340: =G340*6+H340 -> 0 | M340: =K340*6+L340 -> 0 | O340: 16 | P340: 11 | Q340: =O340*6+P340 -> 107
A341: BEST PLAYERS | W341: TEAM | X341: W | Y341: L | Z341: D | AA341: FOR | AB341: AGST | AC341: % | AD341: PTS
A342: MORDIALLOC
A343: YARRAVILLE | W343: SUNSHINE | X343: 7 | Y343: 1 | Z343: 0 | AA343: 1241 | AB343: 702 | AC343: =(AA343*100)/AB343 -> 176.78062678062679 | AD343: =(X343*4)+(Z343*2) -> 28
A344: GOALKICKERS | W344: CAULFIELD | X344: 7 | Y344: 1 | Z344: 0 | AA344: 1035 | AB344: 654 | AC344: =(AA344*100)/AB344 -> 158.25688073394497 | AD344: =(X344*4)+(Z344*2) -> 28
A345: MORDIALLOC | W345: YARRAVILLE | X345: 6 | Y345: 2 | Z345: 0 | AA345: 1011 | AB345: 817 | AC345: =(AA345*100)/AB345 -> 123.7454100367197 | AD345: =(X345*4)+(Z345*2) -> 24
A346: YARRAVILLE | W346: BRUNSWICK | X346: 5 | Y346: 3 | Z346: 0 | AA346: 841 | AB346: 771 | AC346: =(AA346*100)/AB346 -> 109.07911802853437 | AD346: =(X346*4)+(Z346*2) -> 20
A348: CAULFIELD | E348: =C348*6+D348 -> 0 | I348: =G348*6+H348 -> 0 | M348: =K348*6+L348 -> 0 | O348: 23 | P348: 18 | Q348: =O348*6+P348 -> 156 | S348: FRANKSTON | W348: BOX HILL | X348: 4 | Y348: 4 | Z348: 0 | AA348: 943 | AB348: 985 | AC348: =(AA348*100)/AB348 -> 95.736040609137049 | AD348: =(X348*4)+(Z348*2) -> 16
A349: FRANKSTON | E349: =C349*6+D349 -> 0 | I349: =G349*6+H349 -> 0 | M349: =K349*6+L349 -> 0 | O349: 22 | P349: 13 | Q349: =O349*6+P349 -> 145 | W349: CAMBERWELL | X349: 3 | Y349: 4 | Z349: 1 | AA349: 712 | AB349: 864 | AC349: =(AA349*100)/AB349 -> 82.407407407407405 | AD349: =(X349*4)+(Z349*2) -> 14
A350: BEST PLAYERS | W350: NORTHCOTE | X350: 3 | Y350: 5 | Z350: 0 | AA350: 794 | AB350: 901 | AC350: =(AA350*100)/AB350 -> 88.124306326304108 | AD350: =(X350*4)+(Z350*2) -> 12
A351: CAULFIELD | W351: MORDIALLOC | X351: 3 | Y351: 5 | Z351: 0 | AA351: 726 | AB351: 856 | AC351: =(AA351*100)/AB351 -> 84.813084112149539 | AD351: =(X351*4)+(Z351*2) -> 12
A352: FRANKSTON | W352: FRANKSTON | X352: 1 | Y352: 6 | Z352: 1 | AA352: 848 | AB352: 1123 | AC352: =(AA352*100)/AB352 -> 75.51202137132681 | AD352: =(X352*4)+(Z352*2) -> 6
A353: GOALKICKERS | W353: WERRIBEE | X353: 0 | Y353: 8 | Z353: 0 | AA353: 526 | AB353: 1134 | AC353: =(AA353*100)/AB353 -> 46.384479717813051 | AD353: =(X353*4)+(Z353*2) -> 0
A354: CAULFIELD
A355: FRANKSTON
E356: 6TH JUNE | I356: WEATHER
A357: SUNSHINE | E357: =C357*6+D357 -> 0 | I357: =G357*6+H357 -> 0 | M357: =K357*6+L357 -> 0 | O357: 21 | P357: 29 | Q357: =O357*6+P357 -> 155 | S357: SUNSHINE
A358: CAMBERWELL | E358: =C358*6+D358 -> 0 | I358: =G358*6+H358 -> 0 | M358: =K358*6+L358 -> 0 | O358: 17 | P358: 13 | Q358: =O358*6+P358 -> 115
A359: BEST PLAYERS
A360: SUNSHINE
A361: CAMBERWELL
A362: GOALKICKERS
A363: SUNSHINE
A364: CAMBERWELL
A366: BRUNSWICK | E366: =C366*6+D366 -> 0 | I366: =G366*6+H366 -> 0 | M366: =K366*6+L366 -> 0 | O366: 13 | P366: 22 | Q366: =O366*6+P366 -> 100 | S366: NORTHCOTE
A367: NORTHCOTE | E367: =C367*6+D367 -> 0 | I367: =G367*6+H367 -> 0 | M367: =K367*6+L367 -> 0 | O367: 11 | P367: 14 | Q367: =O367*6+P367 -> 80
A368: BEST PLAYERS
A369: BRUNSWICK
A370: NORTHCOTE
A371: GOALKICKERS
A372: BRUNSWICK
A373: NORTHCOTE
A375: BOX HILL | E375: =C375*6+D375 -> 0 | I375: =G375*6+H375 -> 0 | M375: =K375*6+L375 -> 0 | O375: 20 | P375: 16 | Q375: =O375*6+P375 -> 136 | S375: BOX HILL
A376: WERRIBEE | E376: =C376*6+D376 -> 0 | I376: =G376*6+H376 -> 0 | M376: =K376*6+L376 -> 0 | O376: 12 | P376: 6 | Q376: =O376*6+P376 -> 78
A377: BEST PLAYERS
A378: BOX HILL
A379: WERRIBEE
A380: GOALKICKERS
A381: BOX HILL
A382: WERRIBEE
A384: ROUND 9 | E384: 12TH JUNE | J384: WEATHER | S384: PLAYED AT
D385: 1ST QTR | H385: 2ND QTR | L385: 3RD QTR | P385: FINAL | S385: WERRIBEE
A386: NORTHCOTE | C386: 6 | D386: 2 | E386: =C386*6+D386 -> 38 | G386: 14 | H386: 4 | I386: =G386*6+H386 -> 88 | K386: 16 | L386: 8 | M386: =K386*6+L386 -> 104 | O386: 18 | P386: 9 | Q386: =O386*6+P386 -> 117 | S386: UMPIRE | X386: LADDER | AB386: ROUND | AD386: 9
A387: WERRIBEE | C387: 3 | D387: 6 | E387: =C387*6+D387 -> 24 | G387: 5 | H387: 10 | I387: =G387*6+H387 -> 40 | K387: 12 | L387: 13 | M387: =K387*6+L387 -> 85 | O387: 15 | P387: 16 | Q387: =O387*6+P387 -> 106 | S387: ABBOTT
A388: BEST PLAYERS | W388: TEAM | X388: W | Y388: L | Z388: D | AA388: FOR | AB388: AGST | AC388: % | AD388: PTS
A389: NORTHCOTE | C389: WILLIAMS | F389: SMITH | I389: McORIST | L389: McNEILL | O389: HOUGH | R389: GARRETT
A390: WERRIBEE | C390: HINKLEY | F390: FARRELLY | I390: LLOYD | L390: PAGE | O390: COMBEN | R390: O'BRIEN | W390: CAULFIELD | X390: 8 | Y390: 1 | Z390: 0 | AA390: 1171 | AB390: 749 | AC390: =(AA390*100)/AB390 -> 156.34178905206943 | AD390: =(X390*4)+(Z390*2) -> 32
A391: GOALKICKERS | W391: SUNSHINE | X391: 7 | Y391: 2 | Z391: 0 | AA391: 1344 | AB391: 838 | AC391: =(AA391*100)/AB391 -> 160.38186157517899 | AD391: =(X391*4)+(Z391*2) -> 28
A392: NORTHCOTE | C392: HOUGH 4 | E392: POWELL 3 | G392: MARTIN 2 | I392: GARRETT 2 | K392: RYAN 2 | M392: McORIST 2 | O392: COHEN | Q392: STILSBY | S392: KING | W392: YARRAVILLE | X392: 7 | Y392: 2 | Z392: 0 | AA392: 1147 | AB392: 920 | AC392: =(AA392*100)/AB392 -> 124.67391304347827 | AD392: =(X392*4)+(Z392*2) -> 28
A393: WERRIBEE | C393: BOURKE 4 | E393: O'BRIEN 2 | G393: ARRIGO 2 | I393: COMBEN 2 | L393: SNOW | N393: POULTON | Q393: HINKLEY | S393: PAGE | W393: BRUNSWICK | X393: 6 | Y393: 3 | Z393: 0 | AA393: 993 | AB393: 882 | AC393: =(AA393*100)/AB393 -> 112.58503401360544 | AD393: =(X393*4)+(Z393*2) -> 24
M394: NEWMAN
A395: YARRAVILLE | C395: 4 | D395: 6 | E395: =C395*6+D395 -> 30 | G395: 8 | H395: 13 | I395: =G395*6+H395 -> 61 | K395: 14 | L395: 17 | M395: =K395*6+L395 -> 101 | O395: 19 | P395: 22 | Q395: =O395*6+P395 -> 136 | S395: YARRAVILLE | W395: CAMBERWELL | X395: 4 | Y395: 4 | Z395: 1 | AA395: 790 | AB395: 940 | AC395: =(AA395*100)/AB395 -> 84.042553191489361 | AD395: =(X395*4)+(Z395*2) -> 18
A396: SUNSHINE | C396: 5 | D396: 6 | E396: =C396*6+D396 -> 36 | G396: 6 | H396: 9 | I396: =G396*6+H396 -> 45 | K396: 7 | L396: 12 | M396: =K396*6+L396 -> 54 | O396: 15 | P396: 13 | Q396: =O396*6+P396 -> 103 | S396: GAMBETTA | W396: BOX HILL | X396: 4 | Y396: 5 | Z396: 0 | AA396: 1038 | AB396: 1121 | AC396: =(AA396*100)/AB396 -> 92.595896520963421 | AD396: =(X396*4)+(Z396*2) -> 16
A397: BEST PLAYERS | W397: NORTHCOTE | X397: 4 | Y397: 5 | Z397: 0 | AA397: 911 | AB397: 1007 | AC397: =(AA397*100)/AB397 -> 90.466732869910629 | AD397: =(X397*4)+(Z397*2) -> 16
A398: YARRAVILLE | C398: KNOTT | F398: MARTIN | I398: SALMON | L398: MATHESON | O398: BROWN | R398: QUARANTOTTO | W398: MORDIALLOC | X398: 3 | Y398: 6 | Z398: 0 | AA398: 802 | AB398: 934 | AC398: =(AA398*100)/AB398 -> 85.86723768736617 | AD398: =(X398*4)+(Z398*2) -> 12
A399: SUNSHINE | C399: WOODS | F399: CHADWICK | I399: PLAIN | L399: CRAWFOED | O399: GOOLD | R399: McKENZIE | W399: FRANKSTON | X399: 1 | Y399: 7 | Z399: 1 | AA399: 959 | AB399: 1275 | AC399: =(AA399*100)/AB399 -> 75.215686274509807 | AD399: =(X399*4)+(Z399*2) -> 6
A400: GOALKICKERS | W400: WERRIBEE | X400: 0 | Y400: 9 | Z400: 0 | AA400: 632 | AB400: 1251 | AC400: =(AA400*100)/AB400 -> 50.519584332533974 | AD400: =(X400*4)+(Z400*2) -> 0
A401: YARRAVILLE | C401: CALAZ 5 | E401: SALMON 4 | H401: RYAN 3 | J401: DOWLING 3 | M401: WARWICK 2 | P401: BROWN | R401: MATHESON
A402: SUNSHINE | C402: CHADWICK 5 | F402: PRIOR 2 | H402: GOOLD 2 | J402: CRAWFORD 2 | M402: McKENZIE | P402: DOWNS | R402: DAVEY | U402: HALL
A404: CAMBERWELL | C404: 3 | D404: 6 | E404: =C404*6+D404 -> 24 | G404: 7 | H404: 9 | I404: =G404*6+H404 -> 51 | K404: 9 | L404: 14 | M404: =K404*6+L404 -> 68 | O404: 10 | P404: 18 | Q404: =O404*6+P404 -> 78 | S404: CAMBERWELL
A405: MORDIALLOC | C405: 3 | D405: 3 | E405: =C405*6+D405 -> 21 | G405: 4 | H405: 8 | I405: =G405*6+H405 -> 32 | K405: 7 | L405: 11 | M405: =K405*6+L405 -> 53 | O405: 10 | P405: 16 | Q405: =O405*6+P405 -> 76 | S405: ANDERSON
A406: BEST PLAYERS
A407: CAMBERWELL | C407: EVANS | F407: HAZLETT | I407: EDWARDS | L407: J SMITH | O407: McDONALD | R407: PACIOCCO
A408: MORDIALLOC | C408: HARRY | F408: G SMITH | I408: CLIFFORD | L408: BLACKBURN | O408: LAIRD | R408: GARDNER
A409: GOALKICKERS
A410: CAMBERWELL | C410: EDWARDS 6 | F410: J SMITH 3 | I410: SIMPSON
A411: MORDIALLOC | C411: HARRY 3 | F411: CLIFFORD 2 | I411: G SMITH 2 | L411: SCAIFFE | N411: STUDHAM | Q411: COOK
A413: CAULFIELD | C413: 2 | D413: 1 | E413: =C413*6+D413 -> 13 | G413: 10 | H413: 4 | I413: =G413*6+H413 -> 64 | K413: 12 | L413: 6 | M413: =K413*6+L413 -> 78 | O413: 21 | P413: 10 | Q413: =O413*6+P413 -> 136 | S413: PRINCES PARK, CAULFIELD
A414: BOX HILL | C414: 3 | D414: 5 | E414: =C414*6+D414 -> 23 | G414: 7 | H414: 7 | I414: =G414*6+H414 -> 49 | K414: 12 | L414: 12 | M414: =K414*6+L414 -> 84 | O414: 13 | P414: 17 | Q414: =O414*6+P414 -> 95 | S414: TORNEY
A415: BEST PLAYERS
A416: CAULFIELD | C416: CROWE | F416: CLIFF | I416: LOGAN | L416: WHITE | O416: HOCKING | R416: GOWANS
A417: BOX HILL | C417: JOHNSON | F417: COBAIN | I417: THOMPSON | L417: GROWCOTT | O417: BARNETT
A418: GOALKICKERS
A419: CAULFIELD | C419: WILLIAMS 9 | F419: CROWE 3 | H419: R JEWELL 2 | K419: BAKER 2 | M419: ARRELL | O419: BROWN | Q419: HOCKING | S419: SAUNDERS | V419: VINE
A420: BOX HILL | C420: BARNETT 5 | F420: VICK 2 | H420: SMITH 2 | J420: HEDGECOCK | M420: COBAIN | O420: McKAY | Q420: LUMLEY
A422: BRUNSWICK | C422: 5 | D422: 6 | E422: =C422*6+D422 -> 36 | G422: 12 | H422: 12 | I422: =G422*6+H422 -> 84 | K422: 15 | L422: 18 | M422: =K422*6+L422 -> 108 | O422: 22 | P422: 20 | Q422: =O422*6+P422 -> 152 | S422: BRUNSWICK
A423: FRANKSTON | C423: 3 | D423: 3 | E423: =C423*6+D423 -> 21 | G423: 4 | H423: 6 | I423: =G423*6+H423 -> 30 | K423: 9 | L423: 10 | M423: =K423*6+L423 -> 64 | O423: 16 | P423: 15 | Q423: =O423*6+P423 -> 111 | S423: DUGARD
A424: BEST PLAYERS
A425: BRUNSWICK | C425: O'BRIEN | F425: BOOTH | I425: PERRY | L425: SHARP | O425: GREIG | Q425: ALLEN
A426: FRANKSTON | C426: VISSER | F426: GRAHAM | I426: LOVELOCK | L426: McNAB | O426: LEWIS | Q426: BEAMAN
A427: GOALKICKERS
A428: BRUNSWICK | C428: BOOTH 9 | E428: PERRY 5 | G428: HOWARD 2 | I428: SHARP 2 | K428: DIMMATINA | N428: SCHIMMELBUSCH | R428: DENMEAD | T428: HORSINGTON
A429: FRANKSTON | C429: COUTTS 4 | E429: McNAB 3 | G429: ROSENBROCK 2 | J429: GRAHAM 2 | M429: RIDSDALE | O429: K LEWIS | Q429: WINSTANLEY | T429: LOVELOCK | W429: BREMNER
A431: ROUND 10 | E431: 19TH JUNE | J431: WEATHER | S431: PLAYED AT
D432: 1ST QTR | H432: 2ND QTR | L432: 3RD QTR | P432: FINAL | S432: FRANKSTON
A433: YARRAVILLE | C433: 3 | D433: 1 | E433: =C433*6+D433 -> 19 | G433: 12 | H433: 5 | I433: =G433*6+H433 -> 77 | K433: 16 | L433: 8 | M433: =K433*6+L433 -> 104 | O433: 24 | P433: 11 | Q433: =O433*6+P433 -> 155 | S433: UMPIRE | X433: LADDER | AB433: ROUND | AD433: 10
A434: FRANKSTON | C434: 3 | D434: 3 | E434: =C434*6+D434 -> 21 | G434: 6 | H434: 6 | I434: =G434*6+H434 -> 42 | K434: 9 | L434: 13 | M434: =K434*6+L434 -> 67 | O434: 10 | P434: 14 | Q434: =O434*6+P434 -> 74 | S434: FLANAGAN
A435: BEST PLAYERS | W435: TEAM | X435: W | Y435: L | Z435: D | AA435: FOR | AB435: AGST | AC435: % | AD435: PTS
A436: YARRAVILLE | C436: KNOTT | F436: QUARANTOTTO | J436: MATHESON | M436: JOSLIN | P436: CALAZ | R436: RYAN
A437: FRANKSTON | C437: BLAKE | F437: GRAHAM | J437: RENOUF | M437: VISSER | P437: LOVELOCK | W437: CAULFIELD | X437: 9 | Y437: 1 | Z437: 0 | AA437: 1310 | AB437: 819 | AC437: =(AA437*100)/AB437 -> 159.95115995115995 | AD437: =(X437*4)+(Z437*2) -> 36
A438: GOALKICKERS | P438: QUARANTOTTO | W438: SUNSHINE | X438: 8 | Y438: 2 | Z438: 0 | AA438: 1466 | AB438: 946 | AC438: =(AA438*100)/AB438 -> 154.96828752642705 | AD438: =(X438*4)+(Z438*2) -> 32
A439: YARRAVILLE | C439: CALAZ 7 | E439: RYAN 4 | G439: KNOTT 2 | I439: McLAREN 2 | K439: DOWLING 2 | N439: BROWN 2 | P439: MARTIN 2 | R439: SALMON | T439: WAGHORN | W439: YARRAVILLE | X439: 8 | Y439: 2 | Z439: 0 | AA439: 1302 | AB439: 994 | AC439: =(AA439*100)/AB439 -> 130.98591549295776 | AD439: =(X439*4)+(Z439*2) -> 32
A440: FRANKSTON | C440: TOLSON 3 | F440: COOPER 3 | I440: COUTTS 2 | L440: KERR | N440: RIDSDALE | W440: BRUNSWICK | X440: 6 | Y440: 4 | Z440: 0 | AA440: 1101 | AB440: 1004 | AC440: =(AA440*100)/AB440 -> 109.66135458167331 | AD440: =(X440*4)+(Z440*2) -> 24
A442: MORDIALLOC | C442: 1 | D442: 4 | E442: =C442*6+D442 -> 10 | G442: 5 | H442: 9 | I442: =G442*6+H442 -> 39 | K442: 7 | L442: 11 | M442: =K442*6+L442 -> 53 | O442: 11 | P442: 20 | Q442: =O442*6+P442 -> 86 | S442: MORDIALLOC | W442: BOX HILL | X442: 5 | Y442: 5 | Z442: 0 | AA442: 1157 | AB442: 1171 | AC442: =(AA442*100)/AB442 -> 98.804440649017934 | AD442: =(X442*4)+(Z442*2) -> 20
A443: WERRIBEE | C443: 2 | D443: 6 | E443: =C443*6+D443 -> 18 | G443: 3 | H443: 7 | I443: =G443*6+H443 -> 25 | K443: 7 | L443: 11 | M443: =K443*6+L443 -> 53 | O443: 8 | P443: 12 | Q443: =O443*6+P443 -> 60 | S443: STIRLING | W443: CAMBERWELL | X443: 4 | Y443: 5 | Z443: 1 | AA443: 840 | AB443: 1059 | AC443: =(AA443*100)/AB443 -> 79.320113314447596 | AD443: =(X443*4)+(Z443*2) -> 18
A444: BEST PLAYERS | W444: MORDIALLOC | X444: 4 | Y444: 6 | Z444: 0 | AA444: 888 | AB444: 994 | AC444: =(AA444*100)/AB444 -> 89.336016096579471 | AD444: =(X444*4)+(Z444*2) -> 16
A445: MORDIALLOC | C445: SCAIFFE | F445: LAIRD | I445: STUDHAM | L445: CLIFFORD | O445: GARDNER | W445: NORTHCOTE | X445: 4 | Y445: 6 | Z445: 0 | AA445: 981 | AB445: 1146 | AC445: =(AA445*100)/AB445 -> 85.602094240837701 | AD445: =(X445*4)+(Z445*2) -> 16
A446: WERRIBEE | C446: LLOYD | F446: O'BRIEN | I446: FARRELLY | L446: BOURKE | O446: McNAUGHTON | W446: FRANKSTON | X446: 1 | Y446: 8 | Z446: 1 | AA446: 1033 | AB446: 1430 | AC446: =(AA446*100)/AB446 -> 72.23776223776224 | AD446: =(X446*4)+(Z446*2) -> 6
A447: GOALKICKERS | W447: WERRIBEE | X447: 0 | Y447: 10 | Z447: 0 | AA447: 692 | AB447: 1337 | AC447: =(AA447*100)/AB447 -> 51.757666417352283 | AD447: =(X447*4)+(Z447*2) -> 0
A448: MORDIALLOC | C448: SCAIFFE 5 | F448: MONCRIEFF | I448: HARRY | K448: McFARLAND | N448: GARDNER | Q448: CLIFFORD | S448: MARTELLO
A449: WERRIBEE | C449: LEECE 2 | F449: PANETTA 2 | I449: PAGE | K449: HINKLEY | M449: WATKINS | P449: O'BRIEN
E450: 20TH JUNE | I450: WEATHER
A451: SUNSHINE | C451: 2 | D451: 2 | E451: =C451*6+D451 -> 14 | G451: 8 | H451: 4 | I451: =G451*6+H451 -> 52 | K451: 13 | L451: 7 | M451: =K451*6+L451 -> 85 | O451: 18 | P451: 14 | Q451: =O451*6+P451 -> 122 | S451: SUNSHINE
A452: BRUNSWICK | C452: 4 | D452: 4 | E452: =C452*6+D452 -> 28 | G452: 7 | H452: 7 | I452: =G452*6+H452 -> 49 | K452: 10 | L452: 11 | M452: =K452*6+L452 -> 71 | O452: 16 | P452: 12 | Q452: =O452*6+P452 -> 108 | S452: McMASTER
A453: BEST PLAYERS
A454: SUNSHINE | C454: GOOLD | F454: McKENZIE | I454: WAGLAND | L454: HALL | N454: CRAWFORD | Q454: PRIOR
A455: BRUNSWICK | C455: ALLEN | F455: DIMMATINA | I455: NIVEN | L455: BOORTH | N455: EGAN
A456: GOALKICKERS
A457: SUNSHINE | C457: WAGLAND 6 | F457: FERGUSON 3 | I457: McKENZIE 3 | L457: CRAWFORD 2 | O457: CLARK | Q457: GOOLD | S457: CHADWICK | V457: CLANCY
A458: BRUNSWICK | C458: BOOTH 5 | E458: ALLEN 3 | G458: DIMMATINA 2 | J458: GREIG 2 | L458: PERRY | N458: NIVEN | P458: SHARP | R458: LIAKOUREAS
A460: BOX HILL | C460: 6 | D460: 9 | E460: =C460*6+D460 -> 45 | G460: 9 | H460: 9 | I460: =G460*6+H460 -> 63 | K460: 14 | L460: 10 | M460: =K460*6+L460 -> 94 | O460: 17 | P460: 17 | Q460: =O460*6+P460 -> 119 | S460: BOX HILL
A461: CAMBERWELL | C461: 2 | D461: 2 | E461: =C461*6+D461 -> 14 | G461: 5 | H461: 4 | I461: =G461*6+H461 -> 34 | K461: 6 | L461: 6 | M461: =K461*6+L461 -> 42 | O461: 7 | P461: 8 | Q461: =O461*6+P461 -> 50 | S461: HOLZER
A462: BEST PLAYERS
A463: BOX HILL | C463: COBAIN | F463: JOHNSON | I463: BIERL | L463: BAKER | N463: HUNT | Q463: BARNETT
A464: CAMBERWELL | C464: FOX | F464: KERR | I464: KEDDIE | L464: SIMPSON | N464: EVANS
A465: GOALKICKERS
A466: BOX HILL | C466: BARNETT 4 | F466: COBAIN 3 | I466: THOMPSON 3 | L466: LUMLEY 3 | N466: HEDGECOCK | Q466: COLE | S466: DEED | U466: SMITH
A467: CAMBERWELL | C467: FOX 4 | E467: KERR | G467: DE BONDE | J467: EDWARDS
A469: CAULFIELD | C469: 2 | D469: 3 | E469: =C469*6+D469 -> 15 | G469: 9 | H469: 4 | I469: =G469*6+H469 -> 58 | K469: 15 | L469: 5 | M469: =K469*6+L469 -> 95 | O469: 22 | P469: 7 | Q469: =O469*6+P469 -> 139 | S469: NORTHCOTE
A470: NORTHCOTE | C470: 2 | D470: 4 | E470: =C470*6+D470 -> 16 | G470: 5 | H470: 7 | I470: =G470*6+H470 -> 37 | K470: 6 | L470: 11 | M470: =K470*6+L470 -> 47 | O470: 9 | P470: 16 | Q470: =O470*6+P470 -> 70 | S470: TURNER
A471: BEST PLAYERS
A472: CAULFIELD | C472: GOWANS | F472: CLIFF | I472: T JEWELL | L472: BAKER | O472: WHITE | R472: CROWE
A473: NORTHCOTE | C473: McORIST | F473: CAREY | I473: SMITH | L473: KINNEALLY | O473: PITTS | R473: MARTIN
A474: GOALKICKERS
A475: CAULFIELD | C475: WILLIAMS 4 | F475: R JEWELL 3 | I475: T JEWELL 3 | K475: BROWN 3 | M475: VINE 3 | O475: HOCKING 2 | Q475: ARRELL | S475: GOWANS | V475: CROWE | X475: WHITE
A476: NORTHCOTE | C476: HOUGH 2 | F476: STILSBY 2 | I476: VINEY 2 | K476: YAKSENDER | N476: MARTIN | Q476: TREGANZA
A478: ROUND 11 | E478: 24TH JUNE | J478: WEATHER | S478: PLAYED AT
D479: 1ST QTR | H479: 2ND QTR | L479: 3RD QTR | P479: FINAL | S479: BRUNSWICK
A480: BRUNSWICK | C480: 1 | D480: 1 | E480: =C480*6+D480 -> 7 | G480: 3 | H480: 11 | I480: =G480*6+H480 -> 29 | K480: 8 | L480: 16 | M480: =K480*6+L480 -> 64 | O480: 17 | P480: 22 | Q480: =O480*6+P480 -> 124 | S480: UMPIRE | X480: LADDER | AB480: ROUND | AD480: 11
A481: MORDIALLOC | C481: 2 | D481: 4 | E481: =C481*6+D481 -> 16 | G481: 2 | H481: 6 | I481: =G481*6+H481 -> 18 | K481: 5 | L481: 7 | M481: =K481*6+L481 -> 37 | O481: 6 | P481: 10 | Q481: =O481*6+P481 -> 46 | S481: TORNEY
A482: BEST PLAYERS | W482: TEAM | X482: W | Y482: L | Z482: D | AA482: FOR | AB482: AGST | AC482: % | AD482: PTS
A483: BRUNSWICK | C483: WALLIS | F483: EGAN | I483: ALLEN | L483: MILLER | O483: PERRY | R483: SKIDMORE
A484: MORDIALLOC | C484: HARRY | F484: DANCKERT | I484: A McGUINNESS | L484: SMITH | O484: STUDHAM | R484: SOUTHEE | W484: SUNSHINE | X484: 9 | Y484: 2 | Z484: 0 | AA484: 1596 | AB484: 1054 | AC484: =(AA484*100)/AB484 -> 151.42314990512335 | AD484: =(X484*4)+(Z484*2) -> 36
A485: GOALKICKERS | W485: CAULFIELD | X485: 9 | Y485: 2 | Z485: 0 | AA485: 1418 | AB485: 949 | AC485: =(AA485*100)/AB485 -> 149.4204425711275 | AD485: =(X485*4)+(Z485*2) -> 36
A486: BRUNSWICK | C486: WALLIS 7 | F486: McKINNON 3 | I486: BOOTH 3 | K486: DENMEAD | N486: O'BRIEN | P486: NIVEN | R486: OGSTON | W486: YARRAVILLE | X486: 9 | Y486: 2 | Z486: 0 | AA486: 1422 | AB486: 1104 | AC486: =(AA486*100)/AB486 -> 128.80434782608697 | AD486: =(X486*4)+(Z486*2) -> 36
A487: MORDIALLOC | C487: HARRY 2 | F487: McFARLAND | I487: SMITH | K487: SCAIFFE | M487: WILKINSON | W487: BRUNSWICK | X487: 7 | Y487: 4 | Z487: 0 | AA487: 1225 | AB487: 1050 | AC487: =(AA487*100)/AB487 -> 116.66666666666667 | AD487: =(X487*4)+(Z487*2) -> 28
E488: 25TH JUNE | I488: WEATHER
A489: WERRIBEE | C489: 4 | D489: 2 | E489: =C489*6+D489 -> 26 | G489: 8 | H489: 5 | I489: =G489*6+H489 -> 53 | K489: 11 | L489: 7 | M489: =K489*6+L489 -> 73 | O489: 14 | P489: 10 | Q489: =O489*6+P489 -> 94 | S489: WERRIBEE | W489: CAMBERWELL | X489: 5 | Y489: 5 | Z489: 1 | AA489: 909 | AB489: 1102 | AC489: =(AA489*100)/AB489 -> 82.486388384754989 | AD489: =(X489*4)+(Z489*2) -> 22
A490: FRANKSTON | C490: 2 | D490: 2 | E490: =C490*6+D490 -> 14 | G490: 5 | H490: 7 | I490: =G490*6+H490 -> 37 | K490: 7 | L490: 11 | M490: =K490*6+L490 -> 53 | O490: 9 | P490: 11 | Q490: =O490*6+P490 -> 65 | S490: McKENZIE | W490: BOX HILL | X490: 5 | Y490: 6 | Z490: 0 | AA490: 1267 | AB490: 1291 | AC490: =(AA490*100)/AB490 -> 98.14097598760651 | AD490: =(X490*4)+(Z490*2) -> 20
A491: BEST PLAYERS | W491: NORTHCOTE | X491: 4 | Y491: 7 | Z491: 0 | AA491: 1024 | AB491: 1215 | AC491: =(AA491*100)/AB491 -> 84.279835390946502 | AD491: =(X491*4)+(Z491*2) -> 16
A492: WERRIBEE | C492: HINKLEY | F492: NEWMAN | I492: LEECE | L492: O'BRIEN | O492: COMBEN | R492: BOURKE | W492: MORDIALLOC | X492: 4 | Y492: 7 | Z492: 0 | AA492: 934 | AB492: 1118 | AC492: =(AA492*100)/AB492 -> 83.542039355992841 | AD492: =(X492*4)+(Z492*2) -> 16
A493: FRANKSTON | C493: LOVELOCK | F493: ROSENBROCK | I493: COUTTS | L493: TOLSON | O493: GRAHAM | W493: FRANKSTON | X493: 1 | Y493: 9 | Z493: 1 | AA493: 1098 | AB493: 1524 | AC493: =(AA493*100)/AB493 -> 72.047244094488192 | AD493: =(X493*4)+(Z493*2) -> 6
A494: GOALKICKERS | W494: WERRIBEE | X494: 1 | Y494: 10 | Z494: 0 | AA494: 786 | AB494: 1402 | AC494: =(AA494*100)/AB494 -> 56.062767475035663 | AD494: =(X494*4)+(Z494*2) -> 4
A495: WERRIBEE | C495: HINKLEY 4 | F495: LEECE 3 | H495: O'BRIEN 2 | J495: BUTTON | L495: SNOW | N495: COMBEN | Q495: NEWMAN | T495: PAGE
A496: FRANKSTON | C496: LOVELOCK 5 | F496: TOLSON 2 | I496: GRAHAM | L496: COUTTS
A498: YARRAVILLE | C498: 4 | D498: 6 | E498: =C498*6+D498 -> 30 | G498: 7 | H498: 8 | I498: =G498*6+H498 -> 50 | K498: 12 | L498: 9 | M498: =K498*6+L498 -> 81 | O498: 18 | P498: 12 | Q498: =O498*6+P498 -> 120 | S498: YARRAVILLE
A499: BOX HILL | C499: 2 | D499: 4 | E499: =C499*6+D499 -> 16 | G499: 6 | H499: 6 | I499: =G499*6+H499 -> 42 | K499: 12 | L499: 10 | M499: =K499*6+L499 -> 82 | O499: 16 | P499: 14 | Q499: =O499*6+P499 -> 110 | S499: STIRLING
A500: BEST PLAYERS
A501: YARRAVILLE | C501: TAURINS | F501: BROWN | I501: SQUIRES | L501: QUARANTOTTO | O501: MCLAREN | R501: KNOTT
A502: BOX HILL | C502: THOMPSON | F502: COBAIN | I502: VICK | L502: DEED | N502: COLE | P502: BARNETT
A503: GOALKICKERS
A504: YARRAVILLE | C504: McLAREN 4 | F504: MARTIN 3 | H504: HEATH 2 | J504: SALMON 2 | L504: DOWLING 2 | O504: MATHESON 2 | R504: BROWN | T504: WARWICK | W504: CALAZ
A505: BOX HILL | C505: BARNETT 7 | F505: SMITH 3 | I505: VICK 3 | K505: LUMLEY | M505: COBAIN | O505: THOMPSON
A507: CAMBERWELL | C507: 2 | D507: 5 | E507: =C507*6+D507 -> 17 | G507: 6 | H507: 6 | I507: =G507*6+H507 -> 42 | K507: 9 | L507: 9 | M507: =K507*6+L507 -> 63 | O507: 10 | P507: 9 | Q507: =O507*6+P507 -> 69 | S507: CAMBERWELL
A508: NORTHCOTE | C508: 1 | D508: 4 | E508: =C508*6+D508 -> 10 | G508: 3 | H508: 12 | I508: =G508*6+H508 -> 30 | K508: 4 | L508: 14 | M508: =K508*6+L508 -> 38 | O508: 4 | P508: 19 | Q508: =O508*6+P508 -> 43 | S508: HUXTABLE
A509: BEST PLAYERS
A510: CAMBERWELL | C510: EVANS | F510: SMITH | I510: SIMPSON | L510: TAYLOR | O510: McDONALD | R510: PHILLIPS
A511: NORTHCOTE | C511: KINNEALLY | F511: SMITH | I511: RYAN | L511: McORIST | O511: ROGERS | R511: COHEN
A512: GOALKICKERS
A513: CAMBERWELL | C513: HAZLETT 4 | F513: SMITH 4 | I513: SIMPSON | K513: FOX
A514: NORTHCOTE | C514: HOUGH 2 | F514: MOORE | I514: VINEY
A516: SUNSHINE | C516: 3 | D516: 4 | E516: =C516*6+D516 -> 22 | G516: 9 | H516: 11 | I516: =G516*6+H516 -> 65 | K516: 12 | L516: 19 | M516: =K516*6+L516 -> 91 | O516: 18 | P516: 22 | Q516: =O516*6+P516 -> 130 | S516: PRINCES PARK, CAULFIELD
A517: CAULFIELD | C517: 4 | D517: 7 | E517: =C517*6+D517 -> 31 | G517: 8 | H517: 11 | I517: =G517*6+H517 -> 59 | K517: 13 | L517: 15 | M517: =K517*6+L517 -> 93 | O517: 14 | P517: 24 | Q517: =O517*6+P517 -> 108 | S517: HOLZER
A518: BEST PLAYERS
A519: SUNSHINE | C519: McKENZIE | F519: CRAWFORD | I519: PRIOR | L519: IBRAHIM | O519: WOODS | R519: HARRISON
A520: CAULFIELD | C520: T JEWELL | F520: BAKER | I520: LOGAN | L520: CROWE | O520: BROWN
A521: GOALKICKERS
A522: SUNSHINE | C522: McKENZIE 5 | F522: MORRISON 4 | I522: CRAWFFORD 3 | L522: BENSON 2 | N522: WAGLAND 2 | Q522: FERGUSON | S522: KAVANAGH
A523: CAULFIELD | C523: T JEWELL 5 | F523: BROWN 3 | I523: WILLIAMS 2 | L523: ROBINSON 2 | O523: BAKER | Q523: GOWANS
A525: ROUND 12 | E525: 3RD JULY | J525: WEATHER | S525: PLAYED AT
D526: 1ST QTR | H526: 2ND QTR | L526: 3RD QTR | P526: FINAL | S526: BOX HILL
A527: BOX HILL | E527: =C527*6+D527 -> 0 | I527: =G527*6+H527 -> 0 | M527: =K527*6+L527 -> 0 | O527: 22 | P527: 14 | Q527: =O527*6+P527 -> 146 | S527: UMPIRE | X527: LADDER | AB527: ROUND | AD527: 12
A528: MORDIALLOC | E528: =C528*6+D528 -> 0 | I528: =G528*6+H528 -> 0 | M528: =K528*6+L528 -> 0 | O528: 9 | P528: 4 | Q528: =O528*6+P528 -> 58
A529: BEST PLAYERS | W529: TEAM | X529: W | Y529: L | Z529: D | AA529: FOR | AB529: AGST | AC529: % | AD529: PTS
A530: BOX HILL
A531: MORDIALLOC | W531: CAULFIELD | X531: 10 | Y531: 2 | Z531: 0 | AA531: 1621 | AB531: 1015 | AC531: =(AA531*100)/AB531 -> 159.70443349753694 | AD531: =(X531*4)+(Z531*2) -> 40
A532: GOALKICKERS | W532: SUNSHINE | X532: 10 | Y532: 2 | Z532: 0 | AA532: 1723 | AB532: 1119 | AC532: =(AA532*100)/AB532 -> 153.97676496872208 | AD532: =(X532*4)+(Z532*2) -> 40
A533: BOX HILL | W533: YARRAVILLE | X533: 9 | Y533: 3 | Z533: 0 | AA533: 1523 | AB533: 1225 | AC533: =(AA533*100)/AB533 -> 124.32653061224489 | AD533: =(X533*4)+(Z533*2) -> 36
A534: MORDIALLOC | W534: BRUNSWICK | X534: 8 | Y534: 4 | Z534: 0 | AA534: 1346 | AB534: 1151 | AC534: =(AA534*100)/AB534 -> 116.94178974804518 | AD534: =(X534*4)+(Z534*2) -> 32
E535: 4TH JULY | I535: WEATHER
A536: FRANKSTON | E536: =C536*6+D536 -> 0 | I536: =G536*6+H536 -> 0 | M536: =K536*6+L536 -> 0 | O536: 18 | P536: 25 | Q536: =O536*6+P536 -> 133 | S536: FRANKSTON | W536: BOX HILL | X536: 6 | Y536: 6 | Z536: 0 | AA536: 1413 | AB536: 1349 | AC536: =(AA536*100)/AB536 -> 104.74425500370644 | AD536: =(X536*4)+(Z536*2) -> 24
A537: NORTHCOTE | E537: =C537*6+D537 -> 0 | I537: =G537*6+H537 -> 0 | M537: =K537*6+L537 -> 0 | O537: 18 | P537: 11 | Q537: =O537*6+P537 -> 119 | W537: CAMBERWELL | X537: 5 | Y537: 6 | Z537: 1 | AA537: 975 | AB537: 1305 | AC537: =(AA537*100)/AB537 -> 74.712643678160916 | AD537: =(X537*4)+(Z537*2) -> 22
A538: BEST PLAYERS | W538: NORTHCOTE | X538: 4 | Y538: 8 | Z538: 0 | AA538: 1143 | AB538: 1348 | AC538: =(AA538*100)/AB538 -> 84.792284866468847 | AD538: =(X538*4)+(Z538*2) -> 16
A539: FRANKSTON | W539: MORDIALLOC | X539: 4 | Y539: 8 | Z539: 0 | AA539: 992 | AB539: 1264 | AC539: =(AA539*100)/AB539 -> 78.481012658227854 | AD539: =(X539*4)+(Z539*2) -> 16
A540: NORTHCOTE | W540: FRANKSTON | X540: 2 | Y540: 9 | Z540: 1 | AA540: 1231 | AB540: 1643 | AC540: =(AA540*100)/AB540 -> 74.923919659160077 | AD540: =(X540*4)+(Z540*2) -> 10
A541: GOALKICKERS | W541: WERRIBEE | X541: 1 | Y541: 11 | Z541: 0 | AA541: 851 | AB541: 1529 | AC541: =(AA541*100)/AB541 -> 55.65729234793983 | AD541: =(X541*4)+(Z541*2) -> 4
A542: FRANKSTON
A543: NORTHCOTE
A545: CAULFIELD | E545: =C545*6+D545 -> 0 | I545: =G545*6+H545 -> 0 | M545: =K545*6+L545 -> 0 | O545: 30 | P545: 23 | Q545: =O545*6+P545 -> 203 | S545: PRINCES PARK, CAULFIELD
A546: CAMBERWELL | E546: =C546*6+D546 -> 0 | I546: =G546*6+H546 -> 0 | M546: =K546*6+L546 -> 0 | O546: 9 | P546: 12 | Q546: =O546*6+P546 -> 66
A547: BEST PLAYERS
A548: CAULFIELD
A549: CAMBERWELL
A550: GOALKICKERS
A551: CAULFIELD
A552: CAMBERWELL
A554: BRUNSWICK | E554: =C554*6+D554 -> 0 | I554: =G554*6+H554 -> 0 | M554: =K554*6+L554 -> 0 | O554: 17 | P554: 19 | Q554: =O554*6+P554 -> 121 | S554: BRUNSWICK
A555: YARRAVILLE | E555: =C555*6+D555 -> 0 | I555: =G555*6+H555 -> 0 | M555: =K555*6+L555 -> 0 | O555: 15 | P555: 11 | Q555: =O555*6+P555 -> 101
A556: BEST PLAYERS
A557: BRUNSWICK
A558: YARRAVILLE
A559: GOALKICKERS
A560: BRUNSWICK
A561: YARRAVILLE
A563: SUNSHINE | E563: =C563*6+D563 -> 0 | I563: =G563*6+H563 -> 0 | M563: =K563*6+L563 -> 0 | O563: 19 | P563: 13 | Q563: =O563*6+P563 -> 127 | S563: SUNSHINE
A564: WERRIBEE | E564: =C564*6+D564 -> 0 | I564: =G564*6+H564 -> 0 | M564: =K564*6+L564 -> 0 | O564: 9 | P564: 11 | Q564: =O564*6+P564 -> 65
A565: BEST PLAYERS
A566: SUNSHINE
A567: WERRIBEE
A568: GOALKICKERS
A569: SUNSHINE
A570: WERRIBEE
A572: ROUND 13 | E572: 10TH JULY | J572: WEATHER | S572: PLAYED AT
D573: 1ST QTR | H573: 2ND QTR | L573: 3RD QTR | P573: FINAL | S573: NORTHCOTE
A574: NORTHCOTE | C574: 6 | D574: 5 | E574: =C574*6+D574 -> 41 | G574: 10 | H574: 6 | I574: =G574*6+H574 -> 66 | K574: 14 | L574: 6 | M574: =K574*6+L574 -> 90 | O574: 20 | P574: 6 | Q574: =O574*6+P574 -> 126 | S574: UMPIRE | X574: LADDER | AB574: ROUND | AD574: 13
A575: BOX HILL | C575: 4 | D575: 5 | E575: =C575*6+D575 -> 29 | G575: 7 | H575: 10 | I575: =G575*6+H575 -> 52 | K575: 14 | L575: 14 | M575: =K575*6+L575 -> 98 | O575: 17 | P575: 21 | Q575: =O575*6+P575 -> 123 | S575: PASK
A576: BEST PLAYERS | W576: TEAM | X576: W | Y576: L | Z576: D | AA576: FOR | AB576: AGST | AC576: % | AD576: PTS
A577: NORTHCOTE | C577: McORIST | F577: SMITH | I577: ROGERS | L577: MARTIN | O577: KING | Q577: WILLIAMS
A578: BOX HILL | C578: HUNT | F578: BARNETT | I578: COLE | L578: COBAIN | O578: DEED | Q578: VICK | W578: SUNSHINE | X578: 11 | Y578: 2 | Z578: 0 | AA578: 1937 | AB578: 1193 | AC578: =(AA578*100)/AB578 -> 162.36378876781222 | AD578: =(X578*4)+(Z578*2) -> 44
A579: GOALKICKERS | N579: KING | P579: CLARKE | W579: CAULFIELD | X579: 10 | Y579: 3 | Z579: 0 | AA579: 1720 | AB579: 1135 | AC579: =(AA579*100)/AB579 -> 151.54185022026431 | AD579: =(X579*4)+(Z579*2) -> 40
A580: NORTHCOTE | C580: COHEN 5 | E580: KREYMBORG 3 | H580: McORIST 3 | J580: VINEY 2 | L580: HAMPSON 2 | O580: MARTIN | Q580: STANLEY | S580: WILLIAMS | W580: YARRAVILLE | X580: 10 | Y580: 3 | Z580: 0 | AA580: 1643 | AB580: 1324 | AC580: =(AA580*100)/AB580 -> 124.09365558912387 | AD580: =(X580*4)+(Z580*2) -> 40
A581: BOX HILL | C581: BARNETT 7 | F581: COLE 3 | H581: LUMLEY 2 | J581: SMITH 2 | M581: VICK 2 | O581: TOMLINSON | W581: BRUNSWICK | X581: 9 | Y581: 4 | Z581: 0 | AA581: 1443 | AB581: 1247 | AC581: =(AA581*100)/AB581 -> 115.7177225340818 | AD581: =(X581*4)+(Z581*2) -> 36
A583: SUNSHINE | C583: 9 | D583: 3 | E583: =C583*6+D583 -> 57 | G583: 11 | H583: 5 | I583: =G583*6+H583 -> 71 | K583: 19 | L583: 10 | M583: =K583*6+L583 -> 124 | O583: 33 | P583: 16 | Q583: =O583*6+P583 -> 214 | S583: MORDIALLOC | W583: CAMBERWELL | X583: 6 | Y583: 6 | Z583: 1 | AA583: 1092 | AB583: 1401 | AC583: =(AA583*100)/AB583 -> 77.944325481798714 | AD583: =(X583*4)+(Z583*2) -> 26
A584: MORDIALLOC | C584: 3 | D584: 2 | E584: =C584*6+D584 -> 20 | G584: 9 | H584: 6 | I584: =G584*6+H584 -> 60 | K584: 10 | L584: 6 | M584: =K584*6+L584 -> 66 | O584: 11 | P584: 8 | Q584: =O584*6+P584 -> 74 | S584: ABBOTT | W584: BOX HILL | X584: 6 | Y584: 7 | Z584: 0 | AA584: 1536 | AB584: 1475 | AC584: =(AA584*100)/AB584 -> 104.13559322033899 | AD584: =(X584*4)+(Z584*2) -> 24
A585: BEST PLAYERS | W585: NORTHCOTE | X585: 5 | Y585: 8 | Z585: 0 | AA585: 1269 | AB585: 1471 | AC585: =(AA585*100)/AB585 -> 86.267845003399046 | AD585: =(X585*4)+(Z585*2) -> 20
A586: SUNSHINE | C586: WAGLAND | F586: FERGUSON | I586: McKENZIE | L586: IBRAHIM | O586: GOOLD | R586: PRIOR | W586: MORDIALLOC | X586: 4 | Y586: 9 | Z586: 0 | AA586: 1066 | AB586: 1478 | AC586: =(AA586*100)/AB586 -> 72.124492557510152 | AD586: =(X586*4)+(Z586*2) -> 16
A587: MORDIALLOC | C587: HARRY | F587: DANCKERT | I587: SCAIFFE | L587: STUDHAM | O587: SMITH | R587: BLACKBURN | W587: FRANKSTON | X587: 2 | Y587: 10 | Z587: 1 | AA587: 1327 | AB587: 1760 | AC587: =(AA587*100)/AB587 -> 75.397727272727266 | AD587: =(X587*4)+(Z587*2) -> 10
A588: GOALKICKERS | W588: WERRIBEE | X588: 1 | Y588: 12 | Z588: 0 | AA588: 947 | AB588: 1626 | AC588: =(AA588*100)/AB588 -> 58.241082410824106 | AD588: =(X588*4)+(Z588*2) -> 4
A589: SUNSHINE | C589: McKENZIE 9 | F589: FERGUSON 8 | I589: WAGLAND 6 | K589: CRAWFORD 3 | N589: CHADWICK 3 | Q589: BENSON 2 | S589: GOOLD 2
A590: MORDIALLOC | C590: HARRY 4 | F590: STUDHAM 2 | I590: SCAIFFE 2 | L590: BLACKBURN 2 | O590: SMITH
A592: YARRAVILLE | C592: 5 | D592: 6 | E592: =C592*6+D592 -> 36 | G592: 6 | H592: 11 | I592: =G592*6+H592 -> 47 | K592: 10 | L592: 16 | M592: =K592*6+L592 -> 76 | O592: 17 | P592: 18 | Q592: =O592*6+P592 -> 120 | S592: YARRAVILLE
A593: CAULFIELD | C593: 3 | D593: 6 | E593: =C593*6+D593 -> 24 | G593: 11 | H593: 9 | I593: =G593*6+H593 -> 75 | K593: 14 | L593: 14 | M593: =K593*6+L593 -> 98 | O593: 14 | P593: 15 | Q593: =O593*6+P593 -> 99 | S593: GAMBETTA
A594: BEST PLAYERS
A595: YARRAVILLE | C595: DOWLING | F595: WAGHORNE | I595: JOSLIN | L595: WILKINSON | O595: TAURINS | R595: RYAN
A596: CAULFIELD | C596: WHITE | F596: WILLIAMS | I596: SAUNDERS | L596: GOWANS | O596: FELDMANN | R596: CLIFF
A597: GOALKICKERS
A598: YARRAVILLE | C598: DOWLING 4 | F598: CALAZ 3 | H598: MARTIN 2 | J598: SALMON 2 | M598: KNOTT 2 | O598: CONDUIT 2 | Q598: RYAN | S598: HEATH
A599: CAULFIELD | C599: BAKER 2 | E599: WILLIAMS 2 | H599: VINE 2 | J599: CROWE 2 | L599: T JEWELL 2 | O599: GOWANS | Q599: BROWN | S599: SAUNDERS | W599: ARRELL
A601: BRUNSWICK | C601: 3 | D601: 3 | E601: =C601*6+D601 -> 21 | G601: 7 | H601: 5 | I601: =G601*6+H601 -> 47 | K601: 13 | L601: 10 | M601: =K601*6+L601 -> 88 | O601: 14 | P601: 13 | Q601: =O601*6+P601 -> 97 | S601: WERRIBEE
A602: WERRIBEE | C602: 2 | D602: 6 | E602: =C602*6+D602 -> 18 | G602: 7 | H602: 12 | I602: =G602*6+H602 -> 54 | K602: 9 | L602: 16 | M602: =K602*6+L602 -> 70 | O602: 13 | P602: 18 | Q602: =O602*6+P602 -> 96 | S602: TURNER
A603: BEST PLAYERS
A604: BRUNSWICK | C604: O'BRIEN | F604: MILLER | I604: OGSTON | L604: WALLIS | O604: EGAN | R604: DIMMATINA
A605: WERRIBEE | C605: HINKLEY | F605: PAGE | I605: COMBEN | L605: LLOYD | O605: MONTGOMERY | R605: SNOW
A606: GOALKICKERS
A607: BRUNSWICK | C607: BOOTH 5 | F607: DIMMATINA 4 | I607: OGSTON 2 | L607: PERRY 2 | N607: McKINNON
A608: WERRIBEE | C608: BOURKE 4 | F608: HINKLEY 3 | I608: COMBEN 3 | L608: LEECE | N608: O'BRIEN | Q608: NEWMAN
A610: CAMBERWELL | C610: 6 | D610: 2 | E610: =C610*6+D610 -> 38 | G610: 9 | H610: 5 | I610: =G610*6+H610 -> 59 | K610: 14 | L610: 8 | M610: =K610*6+L610 -> 92 | O610: 18 | P610: 9 | Q610: =O610*6+P610 -> 117 | S610: CAMBERWELL
A611: FRANKSTON | C611: 0 | D611: 3 | E611: =C611*6+D611 -> 3 | G611: 6 | H611: 7 | I611: =G611*6+H611 -> 43 | K611: 10 | L611: 13 | M611: =K611*6+L611 -> 73 | O611: 13 | P611: 18 | Q611: =O611*6+P611 -> 96 | S611: McMASTER
A612: BEST PLAYERS
A613: CAMBERWELL | C613: EDWARDS | F613: KEDDIE | I613: DE BONDE | L613: FOX | O613: HAZLETT | R613: BRAYNE
A614: FRANKSTON | C614: COUTTS | F614: WINSTANLEY | I614: VISSER | L614: RENOUF | O614: GRAHAM | R614: KERR
A615: GOALKICKERS
A616: CAMBERWELL | C616: EDWARDS 6 | F616: KEDDIE 5 | I616: FOX 3 | K616: HAZLETT 2 | N616: SMITH | Q616: L BOYD
A617: FRANKSTON | C617: COUTTS 6 | F617: McNAB 2 | I617: KERR 2 | K617: GRAHAM | N617: COOPER | P617: LOVELOCK
A619: ROUND 14 | E619: 17TH JULY | J619: WEATHER | S619: PLAYED AT
D620: 1ST QTR | H620: 2ND QTR | L620: 3RD QTR | P620: FINAL | S620: MORDIALLOC
A621: MORDIALLOC | C621: 2 | D621: 2 | E621: =C621*6+D621 -> 14 | G621: 4 | H621: 6 | I621: =G621*6+H621 -> 30 | K621: 8 | L621: 10 | M621: =K621*6+L621 -> 58 | O621: 15 | P621: 14 | Q621: =O621*6+P621 -> 104 | S621: UMPIRE | X621: LADDER | AB621: ROUND | AD621: 14
A622: NORTHCOTE | C622: 3 | D622: 4 | E622: =C622*6+D622 -> 22 | G622: 6 | H622: 7 | I622: =G622*6+H622 -> 43 | K622: 12 | L622: 11 | M622: =K622*6+L622 -> 83 | O622: 14 | P622: 12 | Q622: =O622*6+P622 -> 96 | S622: ANDERSON
A623: BEST PLAYERS | W623: TEAM | X623: W | Y623: L | Z623: D | AA623: FOR | AB623: AGST | AC623: % | AD623: PTS
A624: MORDIALLOC | C624: DANCKERT | F624: HARRY | I624: SMITH | L624: STUDHAM | O624: A McGUINNESS | R624: McFARLAND
A625: NORTHCOTE | C625: MARTIN | F625: SMITH | I625: VINEY | L625: HAMPSON | O625: RYAN | Q625: TREGENZA | W625: SUNSHINE | X625: 12 | Y625: 2 | Z625: 0 | AA625: 2042 | AB625: 1242 | AC625: =(AA625*100)/AB625 -> 164.41223832528181 | AD625: =(X625*4)+(Z625*2) -> 48
A626: GOALKICKERS | W626: CAULFIELD | X626: 11 | Y626: 3 | Z626: 0 | AA626: 1862 | AB626: 1235 | AC626: =(AA626*100)/AB626 -> 150.76923076923077 | AD626: =(X626*4)+(Z626*2) -> 44
A627: MORDIALLOC | C627: SMITH 4 | F627: BROWN 3 | I627: HARRY 3 | K627: A McGUINNESS 2 | O627: MONCRIEFF | R627: CLIFFORD | T627: WILKINS | W627: YARRAVILLE | X627: 11 | Y627: 3 | Z627: 0 | AA627: 1747 | AB627: 1370 | AC627: =(AA627*100)/AB627 -> 127.51824817518248 | AD627: =(X627*4)+(Z627*2) -> 44
A628: NORTHCOTE | C628: COHEN 3 | E628: RYAN 2 | G628: VINEY 2 | I628: HAMPSON 2 | L628: GARRETT | N628: KING | P628: TREGENZA | R628: MARTIN | W628: BRUNSWICK | X628: 9 | Y628: 5 | Z628: 0 | AA628: 1499 | AB628: 1338 | AC628: =(AA628*100)/AB628 -> 112.03288490284007 | AD628: =(X628*4)+(Z628*2) -> 36
M629: McORIST
A630: SUNSHINE | C630: 4 | D630: 7 | E630: =C630*6+D630 -> 31 | G630: 6 | H630: 9 | I630: =G630*6+H630 -> 45 | K630: 10 | L630: 15 | M630: =K630*6+L630 -> 75 | O630: 14 | P630: 21 | Q630: =O630*6+P630 -> 105 | S630: SUNSHINE | W630: BOX HILL | X630: 7 | Y630: 7 | Z630: 0 | AA630: 1627 | AB630: 1531 | AC630: =(AA630*100)/AB630 -> 106.2704114957544 | AD630: =(X630*4)+(Z630*2) -> 28
A631: FRANKSTON | C631: 0 | D631: 4 | E631: =C631*6+D631 -> 4 | G631: 2 | H631: 10 | I631: =G631*6+H631 -> 22 | K631: 3 | L631: 11 | M631: =K631*6+L631 -> 29 | O631: 6 | P631: 13 | Q631: =O631*6+P631 -> 49 | S631: DUGARD | W631: CAMBERWELL | X631: 6 | Y631: 7 | Z631: 1 | AA631: 1138 | AB631: 1505 | AC631: =(AA631*100)/AB631 -> 75.614617940199338 | AD631: =(X631*4)+(Z631*2) -> 26
A632: BEST PLAYERS | W632: NORTHCOTE | X632: 5 | Y632: 9 | Z632: 0 | AA632: 1365 | AB632: 1575 | AC632: =(AA632*100)/AB632 -> 86.666666666666671 | AD632: =(X632*4)+(Z632*2) -> 20
A633: SUNSHINE | C633: McKENZIE | F633: GOOLD | I633: PLAIN | L633: MORRISON | O633: CHADWICK | R633: WOODS | W633: MORDIALLOC | X633: 5 | Y633: 9 | Z633: 0 | AA633: 1170 | AB633: 1574 | AC633: =(AA633*100)/AB633 -> 74.332909783989834 | AD633: =(X633*4)+(Z633*2) -> 20
A634: FRANKSTON | C634: RENOUF | F634: BEAMAN | I634: GRAHAM | L634: STOCK | O634: ROWE | R634: VISSER | W634: FRANKSTON | X634: 2 | Y634: 11 | Z634: 1 | AA634: 1376 | AB634: 1865 | AC634: =(AA634*100)/AB634 -> 73.780160857908854 | AD634: =(X634*4)+(Z634*2) -> 10
A635: GOALKICKERS | W635: WERRIBEE | X635: 1 | Y635: 13 | Z635: 0 | AA635: 1047 | AB635: 1768 | AC635: =(AA635*100)/AB635 -> 59.219457013574662 | AD635: =(X635*4)+(Z635*2) -> 4
A636: SUNSHINE | C636: McKENZIE 6 | F636: FERGUSON 2 | I636: IBRAHIM | K636: NICHOLSON | N636: JAMIESON | P636: BENSON | R636: CHADWICK | T636: WAGLAND
A637: FRANKSTON | C637: BEAMAN 3 | F637: ROWE | H637: COUTTS | J637: GRAHAM
E638: 18TH JULY | I638: WEATHER
A639: YARRAVILLE | C639: 4 | D639: 7 | E639: =C639*6+D639 -> 31 | G639: 6 | H639: 12 | I639: =G639*6+H639 -> 48 | K639: 10 | L639: 14 | M639: =K639*6+L639 -> 74 | O639: 14 | P639: 20 | Q639: =O639*6+P639 -> 104 | S639: CAMBERWELL
A640: CAMBERWELL | C640: 3 | D640: 3 | E640: =C640*6+D640 -> 21 | G640: 4 | H640: 8 | I640: =G640*6+H640 -> 32 | K640: 5 | L640: 9 | M640: =K640*6+L640 -> 39 | O640: 6 | P640: 10 | Q640: =O640*6+P640 -> 46 | S640: FLANAGAN
A641: BEST PLAYERS
A642: YARRAVILLE | C642: MARTIN | F642: MATHESON | I642: SALMON | L642: WAGHORNE | O642: TAURINS | R642: HEATH
A643: CAMBERWELL | C643: WARD | F643: PHILLIPS | I643: EVANS | L643: KEDDIE | O643: HAZLETT | R643: BOYD
A644: GOALKICKERS
A645: YARRAVILLE | C645: SALMON 4 | F645: BONGETTI 3 | I645: BROWN 2 | K645: HEATH 2 | M645: DOWLING | O645: CALAZ | Q645: RYAN
A646: CAMBERWELL | C646: KEDDIE 3 | F646: SUTTON 2 | I646: SIMPSON
A648: CAULFIELD | C648: 3 | D648: 8 | E648: =C648*6+D648 -> 26 | G648: 6 | H648: 13 | I648: =G648*6+H648 -> 49 | K648: 14 | L648: 22 | M648: =K648*6+L648 -> 106 | O648: 19 | P648: 28 | Q648: =O648*6+P648 -> 142 | S648: PRINCES PARK, CAULFIELD
A649: WERRIBEE | C649: 4 | D649: 0 | E649: =C649*6+D649 -> 24 | G649: 9 | H649: 7 | I649: =G649*6+H649 -> 61 | K649: 13 | L649: 8 | M649: =K649*6+L649 -> 86 | O649: 14 | P649: 16 | Q649: =O649*6+P649 -> 100 | S649: McMASTER
A650: BEST PLAYERS
A651: CAULFIELD | C651: CLIFF | F651: LOGAN | I651: BAKER | L651: WHITE | O651: ARRELL
A652: WERRIBEE | C652: NEWMAN | F652: COMBEN | I652: LEECE | L652: HINKLEY | O652: LLOYD | Q652: PANETTA
A653: GOALKICKERS
A654: CAULFIELD | C654: BROWN 5 | E654: WILLIAMS 4 | H654: BAKER 3 | J654: SAUNDERS 2 | M654: CLIFF | N654: DOWNS | P654: CROWE | R654: BATEMAN | T654: ARRELL
A655: WERRIBEE | C655: LEECE 3 | E655: HINKLEY 3 | H655: LLOYD 2 | J655: BUTTON 2 | M655: PANETTA 2 | P655: BOURKE 2
A657: BOX HILL | C657: 2 | D657: 3 | E657: =C657*6+D657 -> 15 | G657: 7 | H657: 9 | I657: =G657*6+H657 -> 51 | K657: 10 | L657: 11 | M657: =K657*6+L657 -> 71 | O657: 13 | P657: 13 | Q657: =O657*6+P657 -> 91 | S657: BRUNSWICK
A658: BRUNSWICK | C658: 1 | D658: 5 | E658: =C658*6+D658 -> 11 | G658: 2 | H658: 7 | I658: =G658*6+H658 -> 19 | K658: 7 | L658: 9 | M658: =K658*6+L658 -> 51 | O658: 7 | P658: 14 | Q658: =O658*6+P658 -> 56 | S658: ABBOTT
A659: BEST PLAYERS
A660: BOX HILL | C660: DEED | F660: BARNETT | I660: HUNT | L660: COBAIN | O660: THOMPSON | R660: AULICK
A661: BRUNSWICK | C661: McKINNON | F661: DIMMATINA | I661: O'BRIEN | L661: LIAKOUREAS | O661: HARRISON | R661: NIVEN
A662: GOALKICKERS
A663: BOX HILL | C663: COLE 3 | E663: THOMPSON 2 | H663: HARRIS 2 | J663: MOORE | L663: SMITH | N663: BARNETT | Q663: BIERL | S663: PATTERSON | V663: BAKER
A664: BRUNSWICK | C664: DIMMATINA 2 | F664: PERRY | H664: WALLIS | J664: LIAKOUREAS | M664: McKINNON | P664: NIVEN
A666: ROUND 15 | E666: 24TH JULY | J666: WEATHER | S666: PLAYED AT
D667: 1ST QTR | H667: 2ND QTR | L667: 3RD QTR | P667: FINAL | S667: FRANKSTON
A668: FRANKSTON | E668: =C668*6+D668 -> 0 | I668: =G668*6+H668 -> 0 | M668: =K668*6+L668 -> 0 | O668: 23 | P668: 12 | Q668: =O668*6+P668 -> 150 | S668: UMPIRE | X668: LADDER | AB668: ROUND | AD668: 15
A669: MORDIALLOC | E669: =C669*6+D669 -> 0 | I669: =G669*6+H669 -> 0 | M669: =K669*6+L669 -> 0 | O669: 17 | P669: 20 | Q669: =O669*6+P669 -> 122
A670: BEST PLAYERS | W670: TEAM | X670: W | Y670: L | Z670: D | AA670: FOR | AB670: AGST | AC670: % | AD670: PTS
A671: FRANKSTON
A672: MORDIALLOC | W672: SUNSHINE | X672: 13 | Y672: 2 | Z672: 0 | AA672: 2115 | AB672: 1314 | AC672: =(AA672*100)/AB672 -> 160.95890410958904 | AD672: =(X672*4)+(Z672*2) -> 52
A673: GOALKICKERS | W673: CAULFIELD | X673: 12 | Y673: 3 | Z673: 0 | AA673: 1967 | AB673: 1315 | AC673: =(AA673*100)/AB673 -> 149.58174904942965 | AD673: =(X673*4)+(Z673*2) -> 48
A674: FRANKSTON | W674: YARRAVILLE | X674: 11 | Y674: 4 | Z674: 0 | AA674: 1859 | AB674: 1503 | AC674: =(AA674*100)/AB674 -> 123.68596141051231 | AD674: =(X674*4)+(Z674*2) -> 44
A675: MORDIALLOC | W675: BRUNSWICK | X675: 9 | Y675: 6 | Z675: 0 | AA675: 1579 | AB675: 1443 | AC675: =(AA675*100)/AB675 -> 109.42480942480942 | AD675: =(X675*4)+(Z675*2) -> 36
E676: 25TH JULY | J676: WEATHER
A677: WERRIBEE | E677: =C677*6+D677 -> 0 | I677: =G677*6+H677 -> 0 | M677: =K677*6+L677 -> 0 | O677: 14 | P677: 10 | Q677: =O677*6+P677 -> 94 | S677: WERRIBEE | W677: BOX HILL | X677: 7 | Y677: 8 | Z677: 0 | AA677: 1699 | AB677: 1604 | AC677: =(AA677*100)/AB677 -> 105.92269326683292 | AD677: =(X677*4)+(Z677*2) -> 28
A678: CAMBERWELL | E678: =C678*6+D678 -> 0 | I678: =G678*6+H678 -> 0 | M678: =K678*6+L678 -> 0 | O678: 11 | P678: 9 | Q678: =O678*6+P678 -> 75 | W678: CAMBERWELL | X678: 6 | Y678: 8 | Z678: 1 | AA678: 1213 | AB678: 1599 | AC678: =(AA678*100)/AB678 -> 75.859912445278297 | AD678: =(X678*4)+(Z678*2) -> 26
A679: BEST PLAYERS | W679: NORTHCOTE | X679: 6 | Y679: 9 | Z679: 0 | AA679: 1497 | AB679: 1687 | AC679: =(AA679*100)/AB679 -> 88.737403675163009 | AD679: =(X679*4)+(Z679*2) -> 24
A680: WERRIBEE | W680: MORDIALLOC | X680: 5 | Y680: 10 | Z680: 0 | AA680: 1292 | AB680: 1724 | AC680: =(AA680*100)/AB680 -> 74.941995359628777 | AD680: =(X680*4)+(Z680*2) -> 20
A681: CAMBERWELL | W681: FRANKSTON | X681: 3 | Y681: 11 | Z681: 1 | AA681: 1526 | AB681: 1987 | AC681: =(AA681*100)/AB681 -> 76.799194765978868 | AD681: =(X681*4)+(Z681*2) -> 14
A682: GOALKICKERS | W682: WERRIBEE | X682: 2 | Y682: 13 | Z682: 0 | AA682: 1141 | AB682: 1843 | AC682: =(AA682*100)/AB682 -> 61.909929462832338 | AD682: =(X682*4)+(Z682*2) -> 8
A683: WERRIBEE
A684: CAMBERWELL
A686: CAULFIELD | E686: =C686*6+D686 -> 0 | I686: =G686*6+H686 -> 0 | M686: =K686*6+L686 -> 0 | O686: 15 | P686: 15 | Q686: =O686*6+P686 -> 105 | S686: PRINCES PARK, CAULFIELD
A687: BRUNSWICK | E687: =C687*6+D687 -> 0 | I687: =G687*6+H687 -> 0 | M687: =K687*6+L687 -> 0 | O687: 11 | P687: 14 | Q687: =O687*6+P687 -> 80
A688: BEST PLAYERS
A689: CAULFIELD
A690: BRUNSWICK
A691: GOALKICKERS
A692: CAULFIELD
A693: BRUNSWICK
A695: NORTHCOTE | E695: =C695*6+D695 -> 0 | I695: =G695*6+H695 -> 0 | M695: =K695*6+L695 -> 0 | O695: 20 | P695: 13 | Q695: =O695*6+P695 -> 133 | S695: NORTHCOTE
A696: YARRAVILLE | E696: =C696*6+D696 -> 0 | I696: =G696*6+H696 -> 0 | M696: =K696*6+L696 -> 0 | O696: 15 | P696: 22 | Q696: =O696*6+P696 -> 112
A697: BEST PLAYERS
A698: NORTHCOTE
A699: YARRAVILLE
A700: GOALKICKERS
A701: NORTHCOTE
A702: YARRAVILLE
A704: SUNSHINE | E704: =C704*6+D704 -> 0 | I704: =G704*6+H704 -> 0 | M704: =K704*6+L704 -> 0 | O704: 11 | P704: 7 | Q704: =O704*6+P704 -> 73 | S704: BOX HILL
A705: BOX HILL | E705: =C705*6+D705 -> 0 | I705: =G705*6+H705 -> 0 | M705: =K705*6+L705 -> 0 | O705: 10 | P705: 12 | Q705: =O705*6+P705 -> 72
A706: BEST PLAYERS
A707: SUNSHINE
A708: BOX HILL
A709: GOALKICKERS
A710: SUNSHINE
A711: BOX HILL
A713: ROUND 16 | E713: 31ST JULY | J713: WEATHER | S713: PLAYED AT
D714: 1ST QTR | H714: 2ND QTR | L714: 3RD QTR | P714: FINAL | S714: FRANKSTON
A715: FRANKSTON | C715: 5 | D715: 3 | E715: =C715*6+D715 -> 33 | G715: 9 | H715: 9 | I715: =G715*6+H715 -> 63 | K715: 12 | L715: 14 | M715: =K715*6+L715 -> 86 | O715: 19 | P715: 20 | Q715: =O715*6+P715 -> 134 | S715: UMPIRE | X715: LADDER | AB715: ROUND | AD715: 16
A716: BOX HILL | C716: 5 | D716: 6 | E716: =C716*6+D716 -> 36 | G716: 8 | H716: 12 | I716: =G716*6+H716 -> 60 | K716: 13 | L716: 16 | M716: =K716*6+L716 -> 94 | O716: 14 | P716: 22 | Q716: =O716*6+P716 -> 106
A717: BEST PLAYERS | W717: TEAM | X717: W | Y717: L | Z717: D | AA717: FOR | AB717: AGST | AC717: % | AD717: PTS
A718: FRANKSTON | C718: ROSENBROCK | F718: ROWE | I718: P LEWIS | L718: McNAB | O718: BEAMAN | R718: BREMNER
A719: BOX HILL | C719: SMITH | F719: COBAIN | I719: McQUALTER | L719: THOMPSON | O719: DEED | R719: HUNT | W719: SUNSHINE | X719: 14 | Y719: 2 | Z719: 0 | AA719: 2218 | AB719: 1412 | AC719: =(AA719*100)/AB719 -> 157.08215297450425 | AD719: =(X719*4)+(Z719*2) -> 56
A720: GOALKICKERS | W720: CAULFIELD | X720: 13 | Y720: 3 | Z720: 0 | AA720: 2076 | AB720: 1353 | AC720: =(AA720*100)/AB720 -> 153.43680709534368 | AD720: =(X720*4)+(Z720*2) -> 52
A721: FRANKSTON | C721: BEAMAN 4 | F721: COUTTS 4 | H721: McNAB 3 | J721: LOVELOCK 3 | M721: WESTON 2 | O721: BREMNER 2 | R721: NICHOLSON | W721: YARRAVILLE | X721: 12 | Y721: 4 | Z721: 0 | AA721: 2029 | AB721: 1597 | AC721: =(AA721*100)/AB721 -> 127.05072010018785 | AD721: =(X721*4)+(Z721*2) -> 48
A722: BOX HILL | C722: SMITH 5 | E722: COBAIN 3 | H722: BARNETT 2 | K722: VICK 2 | M722: THOMPSON | P722: COLE | W722: BRUNSWICK | X722: 10 | Y722: 6 | Z722: 0 | AA722: 1723 | AB722: 1502 | AC722: =(AA722*100)/AB722 -> 114.71371504660453 | AD722: =(X722*4)+(Z722*2) -> 40
A724: CAULFIELD | C724: 4 | D724: 6 | E724: =C724*6+D724 -> 30 | G724: 8 | H724: 10 | I724: =G724*6+H724 -> 58 | K724: 10 | L724: 14 | M724: =K724*6+L724 -> 74 | O724: 15 | P724: 19 | Q724: =O724*6+P724 -> 109 | S724: MORDIALLOC | W724: BOX HILL | X724: 7 | Y724: 9 | Z724: 0 | AA724: 1805 | AB724: 1738 | AC724: =(AA724*100)/AB724 -> 103.85500575373993 | AD724: =(X724*4)+(Z724*2) -> 28
A725: MORDIALLOC | C725: 4 | D725: 2 | E725: =C725*6+D725 -> 26 | G725: 5 | H725: 5 | I725: =G725*6+H725 -> 35 | K725: 5 | L725: 8 | M725: =K725*6+L725 -> 38 | O725: 5 | P725: 8 | Q725: =O725*6+P725 -> 38 | S725: FLANAGAN | W725: CAMBERWELL | X725: 6 | Y725: 9 | Z725: 1 | AA725: 1272 | AB725: 1743 | AC725: =(AA725*100)/AB725 -> 72.977624784853703 | AD725: =(X725*4)+(Z725*2) -> 26
A726: BEST PLAYERS | W726: NORTHCOTE | X726: 6 | Y726: 10 | Z726: 0 | AA726: 1595 | AB726: 1790 | AC726: =(AA726*100)/AB726 -> 89.106145251396654 | AD726: =(X726*4)+(Z726*2) -> 24
A727: CAULFIELD | C727: MAGUIRE | F727: CLIFF | I727: BROWN | L727: BATEMAN | O727: ARRELL | R727: GOWANS | W727: MORDIALLOC | X727: 5 | Y727: 11 | Z727: 0 | AA727: 1330 | AB727: 1833 | AC727: =(AA727*100)/AB727 -> 72.558647026732132 | AD727: =(X727*4)+(Z727*2) -> 20
A728: MORDIALLOC | C728: CLIFFORD | F728: SCAIFFE | I728: J McGUINNESS | L728: HARRY | O728: DANCKERT | W728: FRANKSTON | X728: 4 | Y728: 11 | Z728: 1 | AA728: 1660 | AB728: 2093 | AC728: =(AA728*100)/AB728 -> 79.311992355470622 | AD728: =(X728*4)+(Z728*2) -> 18
A729: GOALKICKERS | W729: WERRIBEE | X729: 2 | Y729: 14 | Z729: 0 | AA729: 1235 | AB729: 2013 | AC729: =(AA729*100)/AB729 -> 61.351217088922006 | AD729: =(X729*4)+(Z729*2) -> 8
A730: CAULFIELD | C730: CLIFF 4 | E730: BATEMAN 3 | H730: BROWN 2 | J730: GOWANS | L730: LOGAN | N730: WILLIAMS | P730: VINE | R730: SAUNDERS | T730: HOCKING
A731: MORDIALLOC | C731: STUDHAM 2 | F731: SCAIFFE | I731: CLIFFORD | K731: J McGUINNESS
E732: 1ST AUGUST | I732: WEATHER
A733: YARRAVILLE | C733: 10 | D733: 5 | E733: =C733*6+D733 -> 65 | G733: 12 | H733: 9 | I733: =G733*6+H733 -> 81 | K733: 22 | L733: 19 | M733: =K733*6+L733 -> 151 | O733: 25 | P733: 20 | Q733: =O733*6+P733 -> 170 | S733: YARRAVILLE
A734: WERRIBEE | C734: 1 | D734: 2 | E734: =C734*6+D734 -> 8 | G734: 7 | H734: 8 | I734: =G734*6+H734 -> 50 | K734: 9 | L734: 9 | M734: =K734*6+L734 -> 63 | O734: 13 | P734: 16 | Q734: =O734*6+P734 -> 94 | S734: ABBOTT
A735: BEST PLAYERS
A736: YARRAVILLE | C736: BONGETTI | F736: KNOTT | I736: BROWN | L736: WILKINSON | O736: SQUIRES | R736: WAGHORNE
A737: WERRIBEE | C737: NEWMAN | F737: COMBEN | I737: SNOW | L737: SIMMONS | O737: LITTLE
A738: GOALKICKERS
A739: YARRAVILLE | C739: BONGETTI 7 | F739: DOWLING 4 | H739: BROWN 4 | J739: SALMON 3 | L739: CALAZ 3 | N739: QUARANTOTTO 3 | R739: KNOTT | T739: MATHESON
A740: WERRIBEE | C740: COMBEN 5 | F740: SNOW 3 | I740: LEECE 2 | K740: O'BRIEN | M740: LLOYD | O740: HINKLEY | Q740: PAGE
A742: BRUNSWICK | C742: 3 | D742: 6 | E742: =C742*6+D742 -> 24 | G742: 6 | H742: 12 | I742: =G742*6+H742 -> 48 | K742: 12 | L742: 16 | M742: =K742*6+L742 -> 88 | O742: 20 | P742: 24 | Q742: =O742*6+P742 -> 144 | S742: BRUNSWICK
A743: CAMBERWELL | C743: 3 | D743: 2 | E743: =C743*6+D743 -> 20 | G743: 4 | H743: 4 | I743: =G743*6+H743 -> 28 | K743: 6 | L743: 6 | M743: =K743*6+L743 -> 42 | O743: 8 | P743: 11 | Q743: =O743*6+P743 -> 59 | S743: TORNEY
A744: BEST PLAYERS
A745: BRUNSWICK | C745: O'BRIEN | F745: DIMMATINA | I745: PERRY | L745: NIVEN | O745: MILLER | R745: LIAKOUREAS
A746: CAMBERWELL | C746: SIMPSON | F746: DE BONDE | I746: GRIBBIN | L746: EVANS | O746: McDONALD
A747: GOALKICKERS
A748: BRUNSWICK | C748: WALLIS 5 | E748: PERRY 4 | G748: DIMMATINA 4 | J748: LIAKOUREAS 4 | M748: WHELAN | O748: SCHIMMELBUSCH | S748: ALLEN
A749: CAMBERWELL | C749: KEDDIE 3 | F749: LOVE 2 | H749: SIMPSON | J749: CALL | L749: SMITH
A751: SUNSHINE | C751: 5 | D751: 4 | E751: =C751*6+D751 -> 34 | G751: 6 | H751: 5 | I751: =G751*6+H751 -> 41 | K751: 11 | L751: 10 | M751: =K751*6+L751 -> 76 | O751: 15 | P751: 13 | Q751: =O751*6+P751 -> 103 | S751: SUNSHINE
A752: NORTHCOTE | C752: 1 | D752: 1 | E752: =C752*6+D752 -> 7 | G752: 5 | H752: 4 | I752: =G752*6+H752 -> 34 | K752: 11 | L752: 6 | M752: =K752*6+L752 -> 72 | O752: 15 | P752: 8 | Q752: =O752*6+P752 -> 98 | S752: McMASTER
A753: BEST PLAYERS
A754: SUNSHINE | C754: CRAWFORD | F754: GOOLD | I754: McKENZIE | L754: WOODS | O754: BENSON | R754: HALL
A755: NORTHCOTE | C755: RYAN | F755: PITTS | I755: CLOTZ | L755: TREGENZA | O755: HAMPSON | R755: KINNEALLY
A756: GOALKICKERS
A757: SUNSHINE | C757: WAGLAND 3 | F757: JAMIESON 3 | I757: McKENZIE 2 | K757: CHADWICK 2 | N757: CRAWFORD | Q757: CLARKE | S757: BEAN | U757: MORRISON | X757: 1 SHORT
A758: NORTHCOTE | C758: RYAN 5 | F758: COHEN 3 | I758: VINEY 2 | K758: KING 2 | M758: TREGENZA | P758: KREYMBORG | S758: WILLIAMS
A760: ROUND 17 | E760: 7TH AUGUST | J760: WEATHER | S760: PLAYED AT
D761: 1ST QTR | H761: 2ND QTR | L761: 3RD QTR | P761: FINAL | S761: YARRAVILLE
A762: YARRAVILLE | C762: 8 | D762: 7 | E762: =C762*6+D762 -> 55 | G762: 12 | H762: 9 | I762: =G762*6+H762 -> 81 | K762: 18 | L762: 16 | M762: =K762*6+L762 -> 124 | O762: 20 | P762: 17 | Q762: =O762*6+P762 -> 137 | S762: UMPIRE | X762: LADDER | AB762: ROUND | AD762: 17
A763: MORDIALLOC | C763: 2 | D763: 1 | E763: =C763*6+D763 -> 13 | G763: 9 | H763: 2 | I763: =G763*6+H763 -> 56 | K763: 9 | L763: 3 | M763: =K763*6+L763 -> 57 | O763: 11 | P763: 11 | Q763: =O763*6+P763 -> 77 | S763: TURNER
A764: BEST PLAYERS | W764: TEAM | X764: W | Y764: L | Z764: D | AA764: FOR | AB764: AGST | AC764: % | AD764: PTS
A765: YARRAVILLE | C765: KNOTT | F765: BROWN | I765: BONGETTI | L765: RYAN | N765: MCMILLAN | Q765: DOWLING
A766: MORDIALLOC | C766: SMITH | F766: STUDHAM | I766: J McGUINNESS | L766: HARRY | N766: SCAIFFE | Q766: CLIFFORD | W766: SUNSHINE | X766: 15 | Y766: 2 | Z766: 0 | AA766: 2325 | AB766: 1483 | AC766: =(AA766*100)/AB766 -> 156.77680377612947 | AD766: =(X766*4)+(Z766*2) -> 60
A767: GOALKICKERS | W767: CAULFIELD | X767: 14 | Y767: 3 | Z767: 0 | AA767: 2256 | AB767: 1430 | AC767: =(AA767*100)/AB767 -> 157.76223776223776 | AD767: =(X767*4)+(Z767*2) -> 56
A768: YARRAVILLE | C768: KNOTT 7 | F768: DOWLING 4 | H768: BROWN 3 | J768: BONGETTI 2 | L768: MARTIN | N768: RYAN | O768: QUARANTOTTO | R768: TAURINS | W768: YARRAVILLE | X768: 13 | Y768: 4 | Z768: 0 | AA768: 2166 | AB768: 1674 | AC768: =(AA768*100)/AB768 -> 129.39068100358423 | AD768: =(X768*4)+(Z768*2) -> 52
A769: MORDIALLOC | C769: J McGUINNESS 5 | F769: SMITH 2 | I769: HARRY | K769: CLIFFORD | M769: SCAIFFE | O769: LANG | W769: BRUNSWICK | X769: 10 | Y769: 7 | Z769: 0 | AA769: 1784 | AB769: 1592 | AC769: =(AA769*100)/AB769 -> 112.06030150753769 | AD769: =(X769*4)+(Z769*2) -> 40
A771: CAULFIELD | C771: 4 | D771: 1 | E771: =C771*6+D771 -> 25 | G771: 12 | H771: 11 | I771: =G771*6+H771 -> 83 | K771: 17 | L771: 18 | M771: =K771*6+L771 -> 120 | O771: 26 | P771: 24 | Q771: =O771*6+P771 -> 180 | S771: PRINCES PARK, CAULFIELD | W771: BOX HILL | X771: 8 | Y771: 9 | Z771: 0 | AA771: 1937 | AB771: 1809 | AC771: =(AA771*100)/AB771 -> 107.07573244886677 | AD771: =(X771*4)+(Z771*2) -> 32
A772: FRANKSTON | C772: 5 | D772: 6 | E772: =C772*6+D772 -> 36 | G772: 5 | H772: 6 | I772: =G772*6+H772 -> 36 | K772: 11 | L772: 11 | M772: =K772*6+L772 -> 77 | O772: 11 | P772: 11 | Q772: =O772*6+P772 -> 77 | S772: McKENZIE | W772: NORTHCOTE | X772: 7 | Y772: 10 | Z772: 0 | AA772: 1685 | AB772: 1851 | AC772: =(AA772*100)/AB772 -> 91.031874662344677 | AD772: =(X772*4)+(Z772*2) -> 28
A773: BEST PLAYERS | W773: CAMBERWELL | X773: 6 | Y773: 10 | Z773: 1 | AA773: 1343 | AB773: 1850 | AC773: =(AA773*100)/AB773 -> 72.594594594594597 | AD773: =(X773*4)+(Z773*2) -> 26
A774: CAULFIELD | C774: WHITE | F774: BAKER | I774: ARRELL | L774: CROWE | N774: LOGAN | Q774: BATEMAN | W774: MORDIALLOC | X774: 5 | Y774: 12 | Z774: 0 | AA774: 1407 | AB774: 1970 | AC774: =(AA774*100)/AB774 -> 71.421319796954322 | AD774: =(X774*4)+(Z774*2) -> 20
A775: FRANKSTON | C775: BREMNER | F775: COOPER | I775: McNAB | L775: LOVELOCK | W775: FRANKSTON | X775: 4 | Y775: 12 | Z775: 1 | AA775: 1737 | AB775: 2273 | AC775: =(AA775*100)/AB775 -> 76.41882974043115 | AD775: =(X775*4)+(Z775*2) -> 18
A776: GOALKICKERS | W776: WERRIBEE | X776: 2 | Y776: 15 | Z776: 0 | AA776: 1308 | AB776: 2145 | AC776: =(AA776*100)/AB776 -> 60.97902097902098 | AD776: =(X776*4)+(Z776*2) -> 8
A777: CAULFIELD | C777: BATEMAN 6 | F777: HOCKING 5 | I777: LOGAN 5 | K777: CROWE 3 | M777: WILLIAMS 2 | O777: SAUNDERS 2 | R777: GOWANS 2 | T777: DOWSETT
A778: FRANKSTON | C778: McNAB 3 | F778: LOVELOCK 3 | I778: COUTTS | K778: BREMNER | M778: TOLSON | O778: ROWE | Q778: LEWIS
E779: 8TH AUGUST | I779: WEATHER
A780: BOX HILL | C780: 4 | D780: 1 | E780: =C780*6+D780 -> 25 | G780: 10 | H780: 5 | I780: =G780*6+H780 -> 65 | K780: 14 | L780: 9 | M780: =K780*6+L780 -> 93 | O780: 20 | P780: 12 | Q780: =O780*6+P780 -> 132 | S780: WERRIBEE
A781: WERRIBEE | C781: 5 | D781: 3 | E781: =C781*6+D781 -> 33 | G781: 5 | H781: 4 | I781: =G781*6+H781 -> 34 | K781: 8 | L781: 5 | M781: =K781*6+L781 -> 53 | O781: 11 | P781: 7 | Q781: =O781*6+P781 -> 73 | S781: DUGARD
A782: BEST PLAYERS
A783: BOX HILL | C783: THOMPSON | F783: HUNT | I783: BIERL | L783: AULICH | O783: PATTERSON
A784: WERRIBEE | C784: COMBEN | F784: WINTLE | I784: PANETTA | L784: CAMERON | O784: LEECE | R784: MONTGOMERY
A785: GOALKICKERS
A786: BOX HILL | C786: PATTERSON 4 | F786: BARNETT 3 | I786: ATKINSON 3 | L786: ? 3 | N786: AULICH 2 | Q786: VICK 2 | S786: ? 1
A787: WERRIBEE | C787: ? 3 | F787: LEECE 3 | I787: LLOYD 2 | K787: PAGE | M787: COMBEN
A789: SUNSHINE | C789: 3 | D789: 12 | E789: =C789*6+D789 -> 30 | G789: 4 | H789: 15 | I789: =G789*6+H789 -> 39 | K789: 10 | L789: 23 | M789: =K789*6+L789 -> 83 | O789: 13 | P789: 29 | Q789: =O789*6+P789 -> 107 | S789: CAMBERWELL
A790: CAMBERWELL | C790: 1 | D790: 0 | E790: =C790*6+D790 -> 6 | G790: 5 | H790: 6 | I790: =G790*6+H790 -> 36 | K790: 5 | L790: 6 | M790: =K790*6+L790 -> 36 | O790: 10 | P790: 11 | Q790: =O790*6+P790 -> 71 | S790: HOLZER
A791: BEST PLAYERS
A792: SUNSHINE | C792: BROWN | F792: NICHOLSON | I792: HALL | L792: FERGUSON | N792: McKENZIE | Q792: WAGLAND
A793: CAMBERWELL | C793: DE BONDE | F793: SIMPSON | I793: McDONALD | L793: EVANS
A794: GOALKICKERS
A795: SUNSHINE | C795: CHADWICK 3 | F795: JAMIESON 2 | I795: McKENZIE 2 | K795: FERGUSON 2 | N795: WAGLAND 2 | Q795: CLIFFORD | S795: NICHOLSON
A796: CAMBERWELL | C796: SIMPSON 2 | F796: EDWARDS 2 | I796: HAZLETT 2 | L796: DE BONDE 2 | O796: PHILLIPS 2
A798: NORTHCOTE | C798: 2 | D798: 2 | E798: =C798*6+D798 -> 14 | G798: 3 | H798: 6 | I798: =G798*6+H798 -> 24 | K798: 8 | L798: 7 | M798: =K798*6+L798 -> 55 | O798: 13 | P798: 12 | Q798: =O798*6+P798 -> 90 | S798: BRUNSWICK
A799: BRUNSWICK | C799: 1 | D799: 4 | E799: =C799*6+D799 -> 10 | G799: 4 | H799: 6 | I799: =G799*6+H799 -> 30 | K799: 5 | L799: 9 | M799: =K799*6+L799 -> 39 | O799: 8 | P799: 13 | Q799: =O799*6+P799 -> 61 | S799: GAMBETTA
A800: BEST PLAYERS
A801: NORTHCOTE | C801: McORIST | F801: SMITH | I801: MARTIN | L801: TREGENZA | O801: KREYMBORG | R801: CAREY
A802: BRUNSWICK | C802: SCHIMMELBUSCH | F802: ROBINSON | I802: HADZILLIAS | L802: GENT | O802: NIVEN | R802: PERRY
A803: GOALKICKERS
A804: NORTHCOTE | C804: COHEN 4 | F804: MARTIN 3 | I804: HAMPSON 2 | L804: KREYMBORG | O804: SMITH | Q804: RYAN | S804: KING
A805: BRUNSWICK | C805: WALLIS 3 | F805: SCHIMMELBUSCH 2 | J805: PERRY | L805: WROUT | N805: DIMMATINA
A807: ROUND 18 | E807: 14TH AUGUST | J807: WEATHER | S807: PLAYED AT
D808: 1ST QTR | H808: 2ND QTR | L808: 3RD QTR | P808: FINAL | S808: MORDIALLOC
A809: MORDIALLOC | C809: 9 | D809: 2 | E809: =C809*6+D809 -> 56 | G809: 12 | H809: 5 | I809: =G809*6+H809 -> 77 | K809: 18 | L809: 12 | M809: =K809*6+L809 -> 120 | O809: 23 | P809: 12 | Q809: =O809*6+P809 -> 150 | S809: UMPIRE | X809: LADDER | AB809: ROUND | AD809: 18
A810: CAMBERWELL | C810: 4 | D810: 0 | E810: =C810*6+D810 -> 24 | G810: 14 | H810: 3 | I810: =G810*6+H810 -> 87 | K810: 17 | L810: 4 | M810: =K810*6+L810 -> 106 | O810: 21 | P810: 10 | Q810: =O810*6+P810 -> 136 | S810: McKENZIE
A811: BEST PLAYERS | W811: TEAM | X811: W | Y811: L | Z811: D | AA811: FOR | AB811: AGST | AC811: % | AD811: PTS
A812: MORDIALLOC | C812: SMITH | F812: STUDHAM | I812: J McGUINNESS | L812: McFARLAND | O812: SCAIFFE
A813: CAMBERWELL | C813: HAZLETT | F813: KEDDIE | I813: EVANS | L813: CONYERS | O813: SIMPSON | W813: CAULFIELD | X813: 15 | Y813: 3 | Z813: 0 | AA813: 2390 | AB813: 1495 | AC813: =(AA813*100)/AB813 -> 159.86622073578596 | AD813: =(X813*4)+(Z813*2) -> 60
A814: GOALKICKERS | R814: HARRY | W814: SUNSHINE | X814: 15 | Y814: 3 | Z814: 0 | AA814: 2386 | AB814: 1579 | AC814: =(AA814*100)/AB814 -> 151.10829639012033 | AD814: =(X814*4)+(Z814*2) -> 60
A815: MORDIALLOC | C815: STUDHAM 5 | F815: SMITH 5 | H815: J McGUINNESS 4 | K815: SCAIFFE 3 | M815: COOK 2 | O815: MARTELLO | R815: GARDNER | T815: MONCRIEFF | W815: YARRAVILLE | X815: 14 | Y815: 4 | Z815: 0 | AA815: 2262 | AB815: 1735 | AC815: =(AA815*100)/AB815 -> 130.37463976945244 | AD815: =(X815*4)+(Z815*2) -> 56
A816: CAMBERWELL | C816: HAZLETT 7 | E816: CONYERS 3 | H816: KEDDIE 3 | J816: SIMPSON 2 | M816: ARNOTT | O816: EVANS | Q816: CALL | S816: EDWARDS | W816: BRUNSWICK | X816: 10 | Y816: 8 | Z816: 0 | AA816: 1901 | AB816: 1727 | AC816: =(AA816*100)/AB816 -> 110.07527504342791 | AD816: =(X816*4)+(Z816*2) -> 40
E817: 15TH AUGUST | H817: WEATHER | L817: O'DONNELL | O817: FRASER
A818: YARRAVILLE | C818: 4 | D818: 2 | E818: =C818*6+D818 -> 26 | G818: 6 | H818: 6 | I818: =G818*6+H818 -> 42 | K818: 8 | L818: 6 | M818: =K818*6+L818 -> 54 | O818: 14 | P818: 12 | Q818: =O818*6+P818 -> 96 | S818: SUNSHINE | W818: BOX HILL | X818: 8 | Y818: 10 | Z818: 0 | AA818: 2002 | AB818: 1943 | AC818: =(AA818*100)/AB818 -> 103.03654143077715 | AD818: =(X818*4)+(Z818*2) -> 32
A819: SUNSHINE | C819: 1 | D819: 6 | E819: =C819*6+D819 -> 12 | G819: 4 | H819: 8 | I819: =G819*6+H819 -> 32 | K819: 8 | L819: 13 | M819: =K819*6+L819 -> 61 | O819: 8 | P819: 13 | Q819: =O819*6+P819 -> 61 | S819: TORNEY | W819: NORTHCOTE | X819: 7 | Y819: 11 | Z819: 0 | AA819: 1759 | AB819: 1934 | AC819: =(AA819*100)/AB819 -> 90.951396070320584 | AD819: =(X819*4)+(Z819*2) -> 28
A820: BEST PLAYERS | W820: CAMBERWELL | X820: 6 | Y820: 11 | Z820: 1 | AA820: 1479 | AB820: 2000 | AC820: =(AA820*100)/AB820 -> 73.95 | AD820: =(X820*4)+(Z820*2) -> 26
A821: YARRAVILLE | C821: BROWN | F821: BRENNAN | I821: RYAN | L821: SQUIRES | O821: KNOTT | R821: BARROW | W821: MORDIALLOC | X821: 6 | Y821: 12 | Z821: 0 | AA821: 1557 | AB821: 2106 | AC821: =(AA821*100)/AB821 -> 73.931623931623932 | AD821: =(X821*4)+(Z821*2) -> 24
A822: SUNSHINE | C822: McKENZIE | F822: HALL | I822: BROWN | L822: FERGUSON | O822: WAGLAND | R822: PRIOR | W822: FRANKSTON | X822: 5 | Y822: 12 | Z822: 1 | AA822: 1872 | AB822: 2390 | AC822: =(AA822*100)/AB822 -> 78.326359832635987 | AD822: =(X822*4)+(Z822*2) -> 22
A823: GOALKICKERS | Q823: PTAK | W823: WERRIBEE | X823: 3 | Y823: 15 | Z823: 0 | AA823: 1391 | AB823: 2219 | AC823: =(AA823*100)/AB823 -> 62.685894547093284 | AD823: =(X823*4)+(Z823*2) -> 12
A824: YARRAVILLE | C824: BONGETTI 3 | F824: MARTIN 3 | H824: BARROW | J824: STURNEIKS | L824: KNOTT | N824: HEATH | P824: BROWN | R824: DOWLING | T824: TAURINS
A825: SUNSHINE | C825: FERGUSON 3 | F825: McKENZIE 2 | I825: CLARKE 2 | L825: NICHOLSON
A827: WERRIBEE | C827: 4 | D827: 3 | E827: =C827*6+D827 -> 27 | G827: 6 | H827: 6 | I827: =G827*6+H827 -> 42 | K827: 8 | L827: 9 | M827: =K827*6+L827 -> 57 | O827: 12 | P827: 11 | Q827: =O827*6+P827 -> 83 | S827: NORTHCOTE
A828: NORTHCOTE | C828: 2 | D828: 1 | E828: =C828*6+D828 -> 13 | G828: 2 | H828: 6 | I828: =G828*6+H828 -> 18 | K828: 5 | L828: 8 | M828: =K828*6+L828 -> 38 | O828: 10 | P828: 14 | Q828: =O828*6+P828 -> 74 | S828: CHINN
A829: BEST PLAYERS
A830: WERRIBEE | C830: WINTLE | F830: MONTGOMERY | I830: SNOW | L830: NEWMAN | O830: COMBEN | R830: ARRIGO
A831: NORTHCOTE | C831: PITTS | F831: WILLIAMS | I831: CLOTZ | L831: HAMPSON | O831: McORIST | R831: SMITH
A832: GOALKICKERS
A833: WERRIBEE | C833: SNOW 6 | F833: COMBEN 2 | I833: LLOYD | K833: BUTTON | M833: WINTLE | O833: CAMERON
A834: NORTHCOTE | C834: COHEN 4 | F834: KING 3 | I834: MARTIN | K834: SMITH | M834: RYAN
A836: CAULFIELD | C836: 7 | D836: 5 | E836: =C836*6+D836 -> 47 | G836: 11 | H836: 7 | I836: =G836*6+H836 -> 73 | K836: 19 | L836: 11 | M836: =K836*6+L836 -> 125 | O836: 20 | P836: 14 | Q836: =O836*6+P836 -> 134 | S836: BOX HILL
A837: BOX HILL | C837: 1 | D837: 3 | E837: =C837*6+D837 -> 9 | G837: 2 | H837: 6 | I837: =G837*6+H837 -> 18 | K837: 4 | L837: 7 | M837: =K837*6+L837 -> 31 | O837: 9 | P837: 11 | Q837: =O837*6+P837 -> 65 | S837: ABBOTT
A838: BEST PLAYERS
A839: CAULFIELD | C839: GOWANS | F839: HOCKING | I839: FARRELLY | L839: BATEMAN | O839: ARRELL
A840: BOX HILL | C840: DEED | F840: VICK | I840: MOORE | L840: THOMPSON | O840: HUNT
A841: GOALKICKERS
A842: CAULFIELD | C842: HOCKING 5 | F842: CLIFF 3 | H842: ARRELL 3 | J842: WILLIAMS 3 | M842: CROWE 3 | O842: MITCHELL | R842: GOWANS | T842: BATEMAN
A843: BOX HILL | C843: THOMPSON 2 | F843: BARNETT 2 | I843: PATTERSON | L843: McQUALTER | O843: ATKINSON | R843: BAKER | T843: COLE
A845: FRANKSTON | C845: 7 | D845: 4 | E845: =C845*6+D845 -> 46 | G845: 10 | H845: 8 | I845: =G845*6+H845 -> 68 | K845: 16 | L845: 12 | M845: =K845*6+L845 -> 108 | O845: 20 | P845: 15 | Q845: =O845*6+P845 -> 135 | S845: FRANKSTON
A846: BRUNSWICK | C846: 3 | D846: 1 | E846: =C846*6+D846 -> 19 | G846: 5 | H846: 8 | I846: =G846*6+H846 -> 38 | K846: 12 | L846: 12 | M846: =K846*6+L846 -> 84 | O846: 17 | P846: 15 | Q846: =O846*6+P846 -> 117 | S846: FLANAGAN
A847: BEST PLAYERS
A848: FRANKSTON | C848: ROSENBROCK | F848: COUTTS | I848: TOLSON | L848: BLAKE | N848: STAPLETON | Q848: LOVELOCK
A849: BRUNSWICK | C849: PERRY | F849: OGSTON | I849: SCHIMMELBUSCH | M849: O'BRIEN | O849: HADZILLIAS | R849: GENT
A850: GOALKICKERS
A851: FRANKSTON | C851: COUTTS 6 | E851: LOVELOCK 3 | H851: TOLSON 3 | J851: WESTON 3 | M851: BEAMAN 2 | P851: BREMNER | R851: McNAB | U851: LEWIS
A852: BRUNSWICK | C852: PERRY 4 | E852: WALLIS 4 | H852: WROUT 3 | J852: OGSTON 2 | M852: DIMMATINA 2 | P852: WHELAN | R852: HORSINGTON
A854: FINALS
A855: 1ST SEMI | E855: 22ND AUGUST | J855: WEATHER | S855: PLAYED AT
D856: 1ST QTR | H856: 2ND QTR | L856: 3RD QTR | P856: FINAL | S856: TOORAK PARK
A857: BRUNSWICK | C857: 4 | D857: 5 | E857: =C857*6+D857 -> 29 | G857: 8 | H857: 10 | I857: =G857*6+H857 -> 58 | K857: 13 | L857: 15 | M857: =K857*6+L857 -> 93 | O857: 18 | P857: 20 | Q857: =O857*6+P857 -> 128 | S857: UMPIRE
A858: YARRAVILLE | C858: 2 | D858: 1 | E858: =C858*6+D858 -> 13 | G858: 3 | H858: 7 | I858: =G858*6+H858 -> 25 | K858: 11 | L858: 8 | M858: =K858*6+L858 -> 74 | O858: 14 | P858: 15 | Q858: =O858*6+P858 -> 99 | S858: GAMBETTA
A859: BEST PLAYERS
A860: BRUNSWICK | C860: HORSINGTON | F860: PERRY | I860: DIMMATINA | L860: WALLIS | O860: COOK | R860: SCHIMMELBUSCH
A861: YARRAVILLE | C861: STURNEIKS | F861: BONGETTI | I861: BRENNAN | L861: TAURINS | O861: MARTIN | R861: QUARANTOTTO
A862: GOALKICKERS
A863: BRUNSWICK | C863: COOK 4 | E863: SCHIMMELBUSCH 4 | I863: PERRY 3 | K863: DALTON 2 | N863: WALLIS 2 | P863: NIVEN | R863: OGSTON | T863: DIMMATINA
A864: YARRAVILLE | C864: BONGETTI 5 | F864: QUARANTOTTO 3 | J864: BROWN 2 | M864: McLAREN 2 | P864: BRENNAN | R864: KNOTT
A866: 2ND SEMI | E866: 29TH AUGUST | I866: WEATHER
A867: SUNSHINE | C867: 0 | D867: 5 | E867: =C867*6+D867 -> 5 | G867: 5 | H867: 10 | I867: =G867*6+H867 -> 40 | K867: 8 | L867: 13 | M867: =K867*6+L867 -> 61 | O867: 13 | P867: 24 | Q867: =O867*6+P867 -> 102 | S867: TOORAK PARK
A868: CAULFIELD | C868: 2 | D868: 3 | E868: =C868*6+D868 -> 15 | G868: 3 | H868: 6 | I868: =G868*6+H868 -> 24 | K868: 7 | L868: 9 | M868: =K868*6+L868 -> 51 | O868: 10 | P868: 12 | Q868: =O868*6+P868 -> 72 | S868: McKENZIE
A869: BEST PLAYERS
A870: SUNSHINE | C870: WOODS | F870: McKENZIE | I870: GOOLD | L870: PRIOR | O870: BROWN | Q870: BEAN
A871: CAULFIELD | C871: CLIFF | F871: GOWANS | I871: BAKER | L871: TEMPEST | O871: ARRELL | Q871: BATEMAN
A872: GOALKICKERS
A873: SUNSHINE | C873: FERGUSON 2 | F873: PRIOR 2 | H873: BENSON 2 | J873: DARUL 2 | L873: McKENZIE | N873: NICHOLSON | Q873: WAGLAND | S873: CRAWFORD | V873: GOOLD
A874: CAULFIELD | C874: ARRELL 2 | F874: BATEMAN 2 | I874: T JEWELL 2 | L874: LOGAN | N874: HOCKING | Q874: GOWANS | S874: ROBINSON
A876: PRELIMINARY | E876: 5TH SEPTEMBER | I876: WEATHER
A877: BRUNSWICK | C877: 4 | D877: 4 | E877: =C877*6+D877 -> 28 | G877: 10 | H877: 9 | I877: =G877*6+H877 -> 69 | K877: 16 | L877: 11 | M877: =K877*6+L877 -> 107 | O877: 19 | P877: 13 | Q877: =O877*6+P877 -> 127 | S877: TOORAK PARK
A878: CAULFIELD | C878: 4 | D878: 8 | E878: =C878*6+D878 -> 32 | G878: 8 | H878: 12 | I878: =G878*6+H878 -> 60 | K878: 14 | L878: 16 | M878: =K878*6+L878 -> 100 | O878: 18 | P878: 17 | Q878: =O878*6+P878 -> 125 | S878: TORNEY
A879: BEST PLAYERS
A880: BRUNSWICK | C880: DALTON | F880: COOK | I880: McKINNON | L880: DIMMATINA | O880: NIVEN | Q880: OGSTON
A881: CAULFIELD | C881: GOWANS | F881: ARRELL | I881: WHITE | L881: MAGUIRE | O881: CLIFF | Q881: HOCKING
A882: GOALKICKERS
A883: BRUNSWICK | C883: COOK 6 | E883: OGSTON 3 | G883: WALLIS 2 | I883: DALTON 2 | K883: SCHIMMELBUSCH 2 | O883: WROUT | Q883: O'BRIEN | S883: DIMMATINA | V883: LIAKOUREAS
A884: CAULFIELD | C884: ROBINSON 4 | F884: McVEY 4 | H884: HOCKING 4 | K884: MAGUIRE 3 | N884: CLIFF | P884: BATEMAN | S884: WILLIAMS
A886: GRAND | E886: 12TH SEPTEMBER | I886: WEATHER
A887: SUNSHINE | C887: 7 | D887: 3 | E887: =C887*6+D887 -> 45 | G887: 11 | H887: 13 | I887: =G887*6+H887 -> 79 | K887: 15 | L887: 17 | M887: =K887*6+L887 -> 107 | O887: 22 | P887: 26 | Q887: =O887*6+P887 -> 158 | S887: TOORAK PARK
A888: BRUNSWICK | C888: 6 | D888: 4 | E888: =C888*6+D888 -> 40 | G888: 8 | H888: 6 | I888: =G888*6+H888 -> 54 | K888: 13 | L888: 8 | M888: =K888*6+L888 -> 86 | O888: 16 | P888: 8 | Q888: =O888*6+P888 -> 104 | S888: ANDERSON
A889: BEST PLAYERS
A890: SUNSHINE | C890: PRIOR | F890: CRAWFORD | I890: BENSON | L890: NICHOLSON | O890: FERGUSON | R890: McKENZIE
A891: BRUNSWICK | C891: I GREIG | F891: SCHIMMELBUSCH | J891: ROBINSON | M891: DIMMATINA | P891: OGSTON | R891: NIVEN
A892: GOALKICKERS
A893: SUNSHINE | C893: FERGUSON 5 | F893: DARUL 5 | H893: BENSON 2 | J893: WAGLAND 2 | M893: CRAWFORD 2 | P893: PRIOR | R893: GOOLD | T893: BROWN | V893: NICHOLSON | X893: BEAN | Y893: CHADWICK
A894: BRUNSWICK | C894: COOK 4 | E894: OGSTON 3 | G894: SCHIMMELBUSCH 3 | K894: ALLEN 2 | M894: DALTON | O894: DIMMATINA | R894: NIVEN | T894: HORSINGTON