A1: Victorian Football Association
A2: Season 1972 - Division One
A3: © Copyright Wal Williams | F3: First created: 28 July 2015
A4: Contact: joywalwi at gmail dot com | F4: Last updated: 28 July 2015 | W4: VFA Results and tables - Link to the main index page
A5: You are free to copy this document in whole or part provided that proper acknowledgement is given to the author. All rights reserved.
A7: 1972 SEASON | C7: 1ST DIVISION | CA7: \D | CB7: {GOTO}BJ3~/M{RIGHT 7}{END}{DOWN}~G4~
A8: ROUND 1 | E8: 23RD APRIL | I8: WEATHER | L8: STRONG WEST WIND RAIN COLD | S8: PLAYED AT | CB8: {GOTO}AL3~/M{END}{RIGHT}{END}{DOWN}~P3~
D9: 1ST QTR | H9: 2ND QTR | L9: 3RD QTR | P9: FINAL | S9: BEACH ROAD | CB9: {GOTO}BJ23~/M{RIGHT 7}{END}{DOWN}~V4~
A10: SANDRINGHAM | C10: 3 | D10: 4 | E10: =C10*6+D10 -> 22 | G10: 4 | H10: 7 | I10: =G10*6+H10 -> 31 | K10: 9 | L10: 11 | M10: =K10*6+L10 -> 65 | O10: 10 | P10: 13 | Q10: =O10*6+P10 -> 73 | S10: UMPIRE | X10: LADDER | AB10: ROUND | AD10: 1 | CB10: {GOTO}BJ43~/M{RIGHT 7}{END}{DOWN}~G24~
A11: PORT MELBOURNE | C11: 3 | D11: 2 | E11: =C11*6+D11 -> 20 | G11: 6 | H11: 6 | I11: =G11*6+H11 -> 42 | K11: 8 | L11: 7 | M11: =K11*6+L11 -> 55 | O11: 9 | P11: 11 | Q11: =O11*6+P11 -> 65 | S11: GAMBETTA | CB11: {GOTO}AL23~/M{END}{RIGHT}{END}{DOWN}~P23~
A12: BEST PLAYERS | W12: TEAM | X12: W | Y12: L | Z12: D | AA12: FOR | AB12: AGST | AC12: % | AD12: PTS | CB12: {GOTO}BJ63~/M{RIGHT 7}{END}{DOWN}~V24~
A13: SANDRINGHAM | C13: SCHOLES | F13: SAMPSON | I13: MURPHY | L13: CHISNALL | O13: McNICHOLAS | R13: HUTCHISON | CB13: {GOTO}BJ83~/M{RIGHT 7}{END}{DOWN}~G44~
A14: PORT MELBOURNE | C14: SKILTON | F14: MALLETT | I14: ALLEN | L14: PROFFIT | O14: HUDSON | R14: LLOYD | W14: WILLIAMSTOWN | X14: 1 | Y14: 0 | Z14: 0 | AA14: 120 | AB14: 31 | AC14: 387.09677419354841 | AD14: 4 | CB14: {GOTO}AL43~/M{END}{RIGHT}{END}{DOWN}~P43~
A15: GOALKICKERS | W15: DANDENONG | X15: 1 | Y15: 0 | Z15: 0 | AA15: 64 | AB15: 37 | AC15: 172.97297297297297 | AD15: 4 | CB15: {GOTO}BJ103~/M{RIGHT 7}{END}{DOWN}~V44~
A16: SANDRINGHAM | C16: SCHOLES 5 | F16: WARD 2 | I16: SAMPSON 2 | L16: HUTCHINSON | W16: OAKLEIGH | X16: 1 | Y16: 0 | Z16: 0 | AA16: 89 | AB16: 62 | AC16: 143.54838709677421 | AD16: 4 | CB16: {GOTO}BJ123~/M{RIGHT 7}{END}{DOWN}~G64~
A17: PORT MELBOURNE | C17: SMITH 3 | F17: ANDERSON 2 | I17: BUCKLEY | K17: COLLINS | M17: BARASSI | O17: SKILTON | W17: SUNSHINE | X17: 1 | Y17: 0 | Z17: 0 | AA17: 71 | AB17: 53 | AC17: 133.96226415094338 | AD17: 4 | CB17: {GOTO}AL63~/M{END}{RIGHT}{END}{DOWN}~P63~
CB18: {GOTO}BJ143~/M{RIGHT 7}{END}{DOWN}~V64~
A19: OAKLEIGH | C19: 2 | D19: 2 | E19: =C19*6+D19 -> 14 | G19: 4 | H19: 12 | I19: =G19*6+H19 -> 36 | K19: 7 | L19: 18 | M19: =K19*6+L19 -> 60 | O19: 11 | P19: 23 | Q19: =O19*6+P19 -> 89 | S19: OAKLEIGH | W19: SANDRINGHAM | X19: 1 | Y19: 0 | Z19: 0 | AA19: 73 | AB19: 65 | AC19: 112.30769230769231 | AD19: 4 | CB19: {GOTO}BJ163~/M{RIGHT 7}{END}{DOWN}~G84~
A20: PRAHRAN | C20: 4 | D20: 6 | E20: =C20*6+D20 -> 30 | G20: 6 | H20: 8 | I20: =G20*6+H20 -> 44 | K20: 8 | L20: 10 | M20: =K20*6+L20 -> 58 | O20: 8 | P20: 14 | Q20: =O20*6+P20 -> 62 | S20: TORNEY | W20: PORT MELBOURNE | X20: 0 | Y20: 1 | Z20: 0 | AA20: 65 | AB20: 73 | AC20: 89.041095890410958 | AD20: 0 | CB20: {GOTO}AL83~/M{END}{RIGHT}{END}{DOWN}~P83~
A21: BEST PLAYERS | W21: WAVERLEY | X21: 0 | Y21: 1 | Z21: 0 | AA21: 53 | AB21: 71 | AC21: 74.647887323943664 | AD21: 0 | CB21: {GOTO}BJ183~/M{RIGHT 7}{END}{DOWN}~V84~
A22: OAKLEIGH | C22: ROBBINS | F22: COLCOTT | I22: BARROTT | L22: WENN | O22: TAYLOR | R22: J LILLEY | W22: PRAHRAN | X22: 0 | Y22: 1 | Z22: 0 | AA22: 62 | AB22: 89 | AC22: 69.662921348314612 | AD22: 0 | CB22: {GOTO}BJ203~/M{RIGHT 7}{END}{DOWN}~G104~
A23: PRAHRAN | C23: EMSELLE | F23: JOHNSON | I23: PEACH | L23: APPLETON | O23: TUCKWELL | R23: KENNEALLY | W23: PRESTON | X23: 0 | Y23: 1 | Z23: 0 | AA23: 37 | AB23: 64 | AC23: 57.8125 | AD23: 0 | CB23: {GOTO}AL103~/M{END}{RIGHT}{END}{DOWN}~P103~
A24: GOALKICKERS | W24: COBURG | X24: 0 | Y24: 1 | Z24: 0 | AA24: 31 | AB24: 120 | AC24: 25.833333333333332 | AD24: 0 | CB24: {GOTO}BJ223~/M{RIGHT 7}{END}{DOWN}~V104~
A25: OAKLEIGH | C25: ROBBINS 2 | F25: JOHNSON 2 | I25: BILLINGS 2 | L25: FORD 2 | N25: TAYLOR | P25: COLCOTT | R25: MURNANE | CB25: {GOTO}BJ243~/M{RIGHT 7}{END}{DOWN}~G124~
A26: PRAHRAN | C26: CAFFYN 3 | F26: APPLETON 2 | I26: ROSE | K26: TUCKWELL | N26: CLARKE | CB26: {GOTO}AL123~/M{END}{RIGHT}{END}{DOWN}~P123~
CB27: {GOTO}BJ263~/M{RIGHT 7}{END}{DOWN}~V124~
A28: SUNSHINE | C28: 2 | D28: 2 | E28: =C28*6+D28 -> 14 | G28: 8 | H28: 6 | I28: =G28*6+H28 -> 54 | K28: 8 | L28: 7 | M28: =K28*6+L28 -> 55 | O28: 10 | P28: 11 | Q28: =O28*6+P28 -> 71 | S28: SUNSHINE | CB28: {GOTO}BJ283~/M{RIGHT 7}{END}{DOWN}~G144~
A29: WAVERLEY | C29: 2 | D29: 6 | E29: =C29*6+D29 -> 18 | G29: 3 | H29: 6 | I29: =G29*6+H29 -> 24 | K29: 6 | L29: 9 | M29: =K29*6+L29 -> 45 | O29: 7 | P29: 11 | Q29: =O29*6+P29 -> 53 | S29: STIRLING | CB29: {GOTO}AL143~/M{END}{RIGHT}{END}{DOWN}~P143~
A30: BEST PLAYERS | CB30: {GOTO}BJ303~/M{RIGHT 7}{END}{DOWN}~V144~
A31: SUNSHINE | C31: GOOLD | F31: WAGLAND | I31: HALL | L31: CLARKE | O31: BENSON | CB31: {GOTO}BJ323~/M{RIGHT 7}{END}{DOWN}~G164~
A32: WAVERLEY | C32: FERGUSON | F32: GOSPER | I32: HARRY | L32: IVEY | O32: STONE | R32: B ALLAN | CB32: {GOTO}AL163~/M{END}{RIGHT}{END}{DOWN}~P163~
A33: GOALKICKERS | CB33: {GOTO}BJ343~/M{RIGHT 7}{END}{DOWN}~V164~
A34: SUNSHINE | C34: WAGLAND 3 | F34: G SLADDIN 2 | I34: GOOLD 2 | K34: STONEHAM 2 | N34: PAYNE | CB34: {HOME}
A35: WAVERLEY | C35: LAKE 2 | F35: HORKINGS 2 | I35: CURTIS | K35: HARRY | M35: STONE
A37: WILLIAMSTOWN | C37: 6 | D37: 4 | E37: =C37*6+D37 -> 40 | G37: 9 | H37: 8 | I37: =G37*6+H37 -> 62 | K37: 14 | L37: 12 | M37: =K37*6+L37 -> 96 | O37: 17 | P37: 18 | Q37: =O37*6+P37 -> 120 | S37: COBURG
A38: COBURG | C38: 0 | D38: 2 | E38: =C38*6+D38 -> 2 | G38: 4 | H38: 3 | I38: =G38*6+H38 -> 27 | K38: 4 | L38: 5 | M38: =K38*6+L38 -> 29 | O38: 4 | P38: 7 | Q38: =O38*6+P38 -> 31 | S38: ABBOTT
A39: BEST PLAYERS
A40: WILLIAMSTOWN | C40: BOXALL | F40: STILLMAN | I40: PERCY | L40: JACKMAN | O40: THOMPSON | R40: FENTON
A41: COBURG | C41: HOBBS | F41: FINCHER | I41: McCARTHY | L41: HOWELL | O41: ELVERY | R41: MURPHY
A42: GOALKICKERS
A43: WILLIAMSTOWN | C43: EGAN 3 | E43: MULLIGAN 3 | H43: JACKMAN 3 | K43: FANNING 3 | N43: SVORINICH 2 | Q43: RADZIMINSKI | T43: COLLINS | W43: L STILLMAN
A44: COBURG | C44: HOWELL 2 | F44: PAVONE | I44: BRENNAN
A46: DANDENONG | C46: 4 | D46: 6 | E46: =C46*6+D46 -> 30 | G46: 4 | H46: 8 | I46: =G46*6+H46 -> 32 | K46: 7 | L46: 15 | M46: =K46*6+L46 -> 57 | O46: 8 | P46: 16 | Q46: =O46*6+P46 -> 64 | S46: DANDENONG
A47: PRESTON | C47: 1 | D47: 1 | E47: =C47*6+D47 -> 7 | G47: 4 | H47: 3 | I47: =G47*6+H47 -> 27 | K47: 5 | L47: 4 | M47: =K47*6+L47 -> 34 | O47: 5 | P47: 7 | Q47: =O47*6+P47 -> 37 | S47: FLANAGAN
A48: BEST PLAYERS
A49: DANDENONG | C49: SHINNERS | F49: DAVIES | I49: HENRIKSEN | L49: KENDALL | O49: HARRINGTON | R49: FLAHERTY
A50: PRESTON | C50: GOAD | F50: SCHICKERT | I50: ASHMEAD | L50: DOWDLE | O50: HILL | R50: LESLIE
A51: GOALKICKERS
A52: DANDENONG | C52: FLAHERTY 3 | F52: BROWN 2 | I52: KENDALL | L52: HIBBERT | O52: MILLER
A53: PRESTON | C53: DEAN 2 | F53: CLARK 2 | I53: ASHMEAD
A55: ROUND 2 | E55: 30TH APRIL | J55: WEATHER | N55: NORTH WIND FINE | S55: PLAYED AT
D56: 1ST QTR | H56: 2ND QTR | L56: 3RD QTR | P56: FINAL | S56: WILLIAMSTOWN
A57: WILLIAMSTOWN | C57: 4 | D57: 3 | E57: =C57*6+D57 -> 27 | G57: 9 | H57: 6 | I57: =G57*6+H57 -> 60 | K57: 16 | L57: 12 | M57: =K57*6+L57 -> 108 | O57: 20 | P57: 18 | Q57: =O57*6+P57 -> 138 | S57: UMPIRE | X57: LADDER | AB57: ROUND | AD57: 2
A58: SANDRINGHAM | C58: 2 | D58: 5 | E58: =C58*6+D58 -> 17 | G58: 5 | H58: 9 | I58: =G58*6+H58 -> 39 | K58: 8 | L58: 10 | M58: =K58*6+L58 -> 58 | O58: 14 | P58: 14 | Q58: =O58*6+P58 -> 98 | S58: McMASTER
A59: BEST PLAYERS | W59: TEAM | X59: W | Y59: L | Z59: D | AA59: FOR | AB59: AGST | AC59: % | AD59: PTS
A60: WILLIAMSTOWN | C60: THOMPSON | F60: FENTON | I60: PERCY | L60: MULLIGAN | O60: STILLMAN | R60: BOXALL
A61: SANDRINGHAM | C61: WALFORD | F61: SCHOLES | I61: MURPHY | L61: CHISNALL | O61: CLARKE | R61: SPURRELL | W61: WILLIAMSTOWN | X61: 2 | Y61: 0 | Z61: 0 | AA61: 258 | AB61: 129 | AC61: 200 | AD61: 8
A62: GOALKICKERS | W62: OAKLEIGH | X62: 2 | Y62: 0 | Z62: 0 | AA62: 244 | AB62: 156 | AC62: 156.41025641025641 | AD62: 8
A63: WILLIAMSTOWN | C63: MULLIGAN 8 | F63: L STILLMAN 4 | I63: SVORINICH 2 | L63: FANNING 2 | N63: RADZIMINSKI | Q63: EGAN | R63: COLLINS | T63: BOXALL | W63: DANDENONG | X63: 2 | Y63: 0 | Z63: 0 | AA63: 183 | AB63: 148 | AC63: 123.64864864864865 | AD63: 8
A64: SANDRINGHAM | C64: CLARKE 3 | E64: DARE 3 | G64: WARD 2 | I64: SAMPSON 2 | L64: SCHOLES | N64: CHISNALL | Q64: McNICHOLAS | T64: MURPHY | W64: PORT MELBOURNE | X64: 1 | Y64: 1 | Z64: 0 | AA64: 213 | AB64: 187 | AC64: 113.90374331550802 | AD64: 4
A66: PORT MELBOURNE | C66: 4 | D66: 3 | E66: =C66*6+D66 -> 27 | G66: 12 | H66: 5 | I66: =G66*6+H66 -> 77 | K66: 17 | L66: 9 | M66: =K66*6+L66 -> 111 | O66: 23 | P66: 10 | Q66: =O66*6+P66 -> 148 | S66: PORT MELBOURNE | W66: SUNSHINE | X66: 1 | Y66: 1 | Z66: 0 | AA66: 185 | AB66: 201 | AC66: 92.039800995024876 | AD66: 4
A67: SUNSHINE | C67: 4 | D67: 4 | E67: =C67*6+D67 -> 28 | G67: 5 | H67: 6 | I67: =G67*6+H67 -> 36 | K67: 10 | L67: 12 | M67: =K67*6+L67 -> 72 | O67: 16 | P67: 18 | Q67: =O67*6+P67 -> 114 | S67: TURNER | W67: SANDRINGHAM | X67: 1 | Y67: 1 | Z67: 0 | AA67: 171 | AB67: 203 | AC67: 84.236453201970448 | AD67: 4
A68: BEST PLAYERS | W68: COBURG | X68: 1 | Y68: 1 | Z68: 0 | AA68: 157 | AB68: 235 | AC68: 66.808510638297875 | AD68: 4
A69: PORT MELBOURNE | C69: HOLT | F69: CARTER | I69: SKILTON | L69: ANDERSON | O69: BUCKLEY | R69: BARASSI | W69: PRAHRAN | X69: 0 | Y69: 2 | Z69: 0 | AA69: 173 | AB69: 208 | AC69: 83.17307692307692 | AD69: 0
A70: SUNSHINE | C70: CLIFFORD | F70: CRAWFORD | I70: HOOPER | L70: BENSON | O70: WAGLAND | R70: GOOLD | W70: PRESTON | X70: 0 | Y70: 2 | Z70: 0 | AA70: 152 | AB70: 190 | AC70: 80 | AD70: 0
A71: GOALKICKERS | W71: WAVERLEY | X71: 0 | Y71: 2 | Z71: 0 | AA71: 147 | AB71: 226 | AC71: 65.044247787610615 | AD71: 0
A72: PORT MELBOURNE | C72: SMITH 5 | F72: ANDERSON 5 | I72: HOLT 5 | K72: ALLEN 3 | M72: BUCKLEY 2 | P72: HUDSON 2 | R72: SKILTON
A73: SUNSHINE | C73: WAGLAND 3 | F73: G SLADDIN 3 | I73: GOOLD 2 | K73: STONEHAM 2 | N73: PAYNE 2 | P73: CRAWFORD 2 | S73: PRIOR | U73: NICHOLSON
A75: OAKLEIGH | C75: 4 | D75: 6 | E75: =C75*6+D75 -> 30 | G75: 15 | H75: 11 | I75: =G75*6+H75 -> 101 | K75: 17 | L75: 14 | M75: =K75*6+L75 -> 116 | O75: 23 | P75: 17 | Q75: =O75*6+P75 -> 155 | S75: WAVERLEY
A76: WAVERLEY | C76: 4 | D76: 4 | E76: =C76*6+D76 -> 28 | G76: 4 | H76: 4 | I76: =G76*6+H76 -> 28 | K76: 11 | L76: 9 | M76: =K76*6+L76 -> 75 | O76: 14 | P76: 10 | Q76: =O76*6+P76 -> 94 | S76: CHINN
A77: BEST PLAYERS
A78: OAKLEIGH | C78: J LILLEY | F78: ROBBINS | I78: TAYLOR | L78: WENN | O78: T QUINN | R78: FORSTER
A79: WAVERLEY | C79: SMITH | F79: HORKINGS | I79: HARRY | L79: B ALLAN | O79: IVEY | R79: SMEDTZ
A80: GOALKICKERS
A81: OAKLEIGH | C81: TAYLOR 6 | F81: ROBBINS 5 | I81: JOHNSON 2 | L81: FORD 2 | N81: COLCOTT 2 | Q81: MURNANE 2 | T81: WENN 2 | W81: BARROTT | X81: STANTON
A82: WAVERLEY | C82: HORKINGS 4 | F82: HARRY 3 | I82: MORDEN 2 | L82: P LEES 2 | N82: STONE | P82: OWENS | R82: R ALLAN
A84: COBURG | C84: 2 | D84: 4 | E84: =C84*6+D84 -> 16 | G84: 10 | H84: 12 | I84: =G84*6+H84 -> 72 | K84: 14 | L84: 15 | M84: =K84*6+L84 -> 99 | O84: 18 | P84: 18 | Q84: =O84*6+P84 -> 126 | S84: PRESTON
A85: PRESTON | C85: 5 | D85: 6 | E85: =C85*6+D85 -> 36 | G85: 6 | H85: 8 | I85: =G85*6+H85 -> 44 | K85: 11 | L85: 14 | M85: =K85*6+L85 -> 80 | O85: 16 | P85: 19 | Q85: =O85*6+P85 -> 115 | S85: TORNEY
A86: BEST PLAYERS
A87: COBURG | C87: FEDLEY | F87: NORTON | I87: FARMER | L87: TYTLER | O87: HOWELL | R87: ERWIN
A88: PRESTON | C88: ASHMEAD | F88: ZUNNEBERG | I88: SCHICKERT | L88: MAHONEY | O88: LE GASSICK
A89: GOALKICKERS
A90: COBURG | C90: FARMER 4 | F90: FEDLEY 3 | I90: GALE 3 | K90: HOWELL 2 | N90: McCARTHY 2 | Q90: EDWARDS 2 | T90: BARNETT | W90: ERWIN
A91: PRESTON | C91: ASHMEAD 4 | F91: MAHONEY 3 | I91: LE GASSICK 3 | L91: MARTIN 2 | N91: McMAHON 2 | Q91: CLARK | S91: ZUNNEBERG
A93: DANDENONG | C93: 5 | D93: 3 | E93: =C93*6+D93 -> 33 | G93: 9 | H93: 7 | I93: =G93*6+H93 -> 61 | K93: 13 | L93: 13 | M93: =K93*6+L93 -> 91 | O93: 17 | P93: 17 | Q93: =O93*6+P93 -> 119 | S93: TOORAK PARK
A94: PRAHRAN | C94: 6 | D94: 7 | E94: =C94*6+D94 -> 43 | G94: 13 | H94: 8 | I94: =G94*6+H94 -> 86 | K94: 15 | L94: 8 | M94: =K94*6+L94 -> 98 | O94: 16 | P94: 15 | Q94: =O94*6+P94 -> 111 | S94: ANDERSON
A95: BEST PLAYERS
A96: DANDENONG | C96: HENRIKSEN | F96: BROWN | I96: MILLER | L96: FLAHERTY | O96: MELAI | R96: SHINNERS
A97: PRAHRAN | C97: EMSELLE | F97: JOHNSTON | I97: TUCKWELL | L97: CULPIN | O97: HUTCHESSON | R97: O'BRIEN
A98: GOALKICKERS
A99: DANDENONG | C99: MILLER 8 | F99: BROWN 2 | I99: ORCHARD 2 | L99: DAVENPORT 2 | O99: HIBBERT | Q99: ELLIS | S99: MADDEN
A100: PRAHRAN | C100: APPLETON 3 | F100: O'BRIEN 3 | I100: CAFFYN 2 | K100: CLARKE 2 | N100: TUCKWELL 2 | Q100: PAYNE 2 | S100: ROSE | U100: HUTCHESSON
A102: ROUND 3 | E102: 7TH MAY | M102: WEATHER | S102: PLAYED AT
D103: 1ST QTR | H103: 2ND QTR | L103: 3RD QTR | P103: FINAL | S103: SUNSHINE
A104: DANDENONG | C104: 4 | D104: 6 | E104: =C104*6+D104 -> 30 | G104: 7 | H104: 14 | I104: =G104*6+H104 -> 56 | K104: 11 | L104: 19 | M104: =K104*6+L104 -> 85 | O104: 16 | P104: 25 | Q104: =O104*6+P104 -> 121 | S104: UMPIRE | X104: LADDER | AB104: ROUND | AD104: 3
A105: SUNSHINE | C105: 3 | D105: 2 | E105: =C105*6+D105 -> 20 | G105: 7 | H105: 6 | I105: =G105*6+H105 -> 48 | K105: 13 | L105: 11 | M105: =K105*6+L105 -> 89 | O105: 17 | P105: 14 | Q105: =O105*6+P105 -> 116 | S105: ABBOTT
A106: BEST PLAYERS | W106: TEAM | X106: W | Y106: L | Z106: D | AA106: FOR | AB106: AGST | AC106: % | AD106: PTS
A107: DANDENONG | C107: FLAHERTY | F107: SHINNERS | I107: HIBBERT | L107: HENRIKSEN | O107: MILLER | R107: KENDALL
A108: SUNSHINE | C108: McKENZIE | F108: STONEHAM | I108: PRIOR | L108: BENSON | O108: CRAWFORD | R108: HALL | W108: WILLIAMSTOWN | X108: 3 | Y108: 0 | Z108: 0 | AA108: 385 | AB108: 240 | AC108: 160.41666666666666 | AD108: 12
A109: GOALKICKERS | W109: OAKLEIGH | X109: 3 | Y109: 0 | Z109: 0 | AA109: 410 | AB109: 267 | AC109: 153.55805243445693 | AD109: 12
A110: DANDENONG | C110: FLAHERTY 5 | F110: MILLER 5 | I110: BROWN 3 | L110: DAVENPORT 2 | O110: ELLIS | W110: DANDENONG | X110: 3 | Y110: 0 | Z110: 0 | AA110: 304 | AB110: 264 | AC110: 115.15151515151516 | AD110: 12
A111: SUNSHINE | C111: G SLADDIN 5 | F111: STONEHAM 3 | I111: CRAWFORD 2 | L111: McKENZIE 2 | O111: WAGLAND | Q111: PAYNE | R111: RUSSELL | T111: BEAN | W111: SANDRINGHAM | X111: 2 | Y111: 1 | Z111: 0 | AA111: 275 | AB111: 306 | AC111: 89.869281045751634 | AD111: 8
Q112: HALL
A113: SANDRINGHAM | C113: 5 | D113: 2 | E113: =C113*6+D113 -> 32 | G113: 9 | H113: 5 | I113: =G113*6+H113 -> 59 | K113: 12 | L113: 10 | M113: =K113*6+L113 -> 82 | O113: 15 | P113: 14 | Q113: =O113*6+P113 -> 104 | S113: BEACH ROAD | W113: PORT MELBOURNE | X113: 1 | Y113: 2 | Z113: 0 | AA113: 320 | AB113: 307 | AC113: 104.23452768729642 | AD113: 4
A114: COBURG | C114: 4 | D114: 5 | E114: =C114*6+D114 -> 29 | G114: 6 | H114: 11 | I114: =G114*6+H114 -> 47 | K114: 12 | L114: 12 | M114: =K114*6+L114 -> 84 | O114: 15 | P114: 13 | Q114: =O114*6+P114 -> 103 | S114: FLANAGAN | W114: SUNSHINE | X114: 1 | Y114: 2 | Z114: 0 | AA114: 301 | AB114: 322 | AC114: 93.478260869565219 | AD114: 4
A115: BEST PLAYERS | W115: PRAHRAN | X115: 1 | Y115: 2 | Z115: 0 | AA115: 293 | AB115: 315 | AC115: 93.015873015873012 | AD115: 4
A116: SANDRINGHAM | C116: WALFORD | F116: DARE | I116: MURPHY | L116: WILLS | N116: HESLOP | Q116: CHISNALL | W116: COBURG | X116: 1 | Y116: 2 | Z116: 0 | AA116: 260 | AB116: 339 | AC116: 76.69616519174042 | AD116: 4
A117: COBURG | C117: ERWIN | F117: FARMER | I117: ELVERY | L117: HOBBS | N117: McCARTHY | Q117: GALE | W117: PRESTON | X117: 0 | Y117: 3 | Z117: 0 | AA117: 263 | AB117: 356 | AC117: 73.876404494382029 | AD117: 0
A118: GOALKICKERS | W118: WAVERLEY | X118: 0 | Y118: 3 | Z118: 0 | AA118: 258 | AB118: 353 | AC118: 73.087818696883858 | AD118: 0
A119: SANDRINGHAM | C119: DARE 3 | E119: McNICHOLAS 3 | H119: AUSTIN 3 | J119: WARD 2 | L119: HESLOP 2 | N119: LOCKHART | Q119: LIPSCOMBE
A120: COBURG | C120: FEDLEY 3 | E120: PAVONE 2 | H120: FARMER 2 | J120: GALE 2 | L120: McCARTHY 2 | O120: BARNETT 2 | R120: HOWELL | U120: NAUGHTON
A122: PRAHRAN | C122: 4 | D122: 2 | E122: =C122*6+D122 -> 26 | G122: 6 | H122: 10 | I122: =G122*6+H122 -> 46 | K122: 13 | L122: 13 | M122: =K122*6+L122 -> 91 | O122: 17 | P122: 18 | Q122: =O122*6+P122 -> 120 | S122: TOORAK PARK
A123: PORT MELBOURNE | C123: 7 | D123: 6 | E123: =C123*6+D123 -> 48 | G123: 8 | H123: 9 | I123: =G123*6+H123 -> 57 | K123: 12 | L123: 13 | M123: =K123*6+L123 -> 85 | O123: 15 | P123: 17 | Q123: =O123*6+P123 -> 107 | S123: STIRLING
A124: BEST PLAYERS
A125: PRAHRAN | C125: CAFFYN | F125: PIROUET | I125: ROSE | L125: PAYNE | O125: APPLETON | R125: RON THOMAS
A126: PORT MELBOURNE | C126: ANDERSON | F126: BUCKLEY | I126: RHEINBERGER | L126: COLLINS | O126: HOLT | R126: BONNETT
A127: GOALKICKERS
A128: PRAHRAN | C128: CAFFYN 7 | F128: APPLETON 3 | I128: ROSE 3 | K128: CLARKE 2 | N128: RON THOMAS | Q128: RAY THOMAS
A129: PORT MELBOURNE | C129: SMITH 5 | F129: BUCKLEY 3 | I129: ANDERSON 3 | L129: HOLT 2 | N129: HUDSON 2
A131: OAKLEIGH | C131: 4 | D131: 4 | E131: =C131*6+D131 -> 28 | G131: 11 | H131: 7 | I131: =G131*6+H131 -> 73 | K131: 17 | L131: 11 | M131: =K131*6+L131 -> 113 | O131: 25 | P131: 16 | Q131: =O131*6+P131 -> 166 | S131: OAKLEIGH
A132: PRESTON | C132: 4 | D132: 3 | E132: =C132*6+D132 -> 27 | G132: 8 | H132: 7 | I132: =G132*6+H132 -> 55 | K132: 14 | L132: 11 | M132: =K132*6+L132 -> 95 | O132: 16 | P132: 15 | Q132: =O132*6+P132 -> 111 | S132: GAMBETTA
A133: BEST PLAYERS
A134: OAKLEIGH | C134: BARROTT | F134: FORD | I134: COLCOTT | L134: CHISHOLM | O134: FORSTER | R134: WENN
A135: PRESTON | C135: TELFORD | F135: LESLIE | I135: ZUNNEBERG | L135: ASHMEAD | O135: MAHONEY | R135: GREEN
A136: GOALKICKERS
A137: OAKLEIGH | C137: MURNANE 4 | F137: WENN 4 | H137: ROBBINS 3 | J137: FORD 3 | L137: TAYLOR 3 | N137: COLCOTT 3 | Q137: JOHNSON 2 | T137: BARROTT | W137: QUINN | X137: FORSTER
A138: PRESTON | C138: LE GASSICK 3 | F138: McMAHON 3 | I138: ZUNNEBERG 3 | L138: LLOYD 3 | N138: ASHMEAD | Q138: CLARK | S138: MAHONEY | V138: TELFORD
A140: WILLIAMSTOWN | C140: 2 | D140: 4 | E140: =C140*6+D140 -> 16 | G140: 7 | H140: 8 | I140: =G140*6+H140 -> 50 | K140: 12 | L140: 10 | M140: =K140*6+L140 -> 82 | O140: 18 | P140: 19 | Q140: =O140*6+P140 -> 127 | S140: WILLIAMSTOWN
A141: WAVERLEY | C141: 5 | D141: 6 | E141: =C141*6+D141 -> 36 | G141: 7 | H141: 10 | I141: =G141*6+H141 -> 52 | K141: 14 | L141: 14 | M141: =K141*6+L141 -> 98 | O141: 16 | P141: 15 | Q141: =O141*6+P141 -> 111 | S141: HAYES
A142: BEST PLAYERS
A143: WILLIAMSTOWN | C143: PERCY | F143: STILLMAN | I143: HANNABURY | L143: SVORINICH | O143: THOMPSON | R143: EGAN
A144: WAVERLEY | C144: R ALLAN | F144: SYKES | I144: FERGUSON | L144: STONE | O144: CRAIG | R144: HARRY
A145: GOALKICKERS
A146: WILLIAMSTOWN | C146: SVORINICH 4 | F146: EGAN 3 | H146: FANNING 3 | K146: HANNEBERY 3 | N146: MULLIGAN 2 | Q146: RADZIMINSKI | T146: COLLINS | V146: L STILLMAN
A147: WAVERLEY | C147: R ALLAN 5 | F147: STONE 4 | H147: HORKINGS 2 | K147: CURTIS | M147: HARRY | O147: REID | Q147: SYKES | S147: CRAIG
A149: ROUND 4 | E149: 14TH MAY | J149: WEATHER | N149: FINE | S149: PLAYED AT
D150: 1ST QTR | H150: 2ND QTR | L150: 3RD QTR | P150: FINAL | S150: DANDENONG
A151: OAKLEIGH | C151: 5 | D151: 2 | E151: =C151*6+D151 -> 32 | G151: 9 | H151: 7 | I151: =G151*6+H151 -> 61 | K151: 11 | L151: 10 | M151: =K151*6+L151 -> 76 | O151: 15 | P151: 17 | Q151: =O151*6+P151 -> 107 | S151: UMPIRE | X151: LADDER | AB151: ROUND | AD151: 4
A152: DANDENONG | C152: 3 | D152: 8 | E152: =C152*6+D152 -> 26 | G152: 8 | H152: 11 | I152: =G152*6+H152 -> 59 | K152: 12 | L152: 13 | M152: =K152*6+L152 -> 85 | O152: 14 | P152: 14 | Q152: =O152*6+P152 -> 98 | S152: STIRLING
A153: BEST PLAYERS | W153: TEAM | X153: W | Y153: L | Z153: D | AA153: FOR | AB153: AGST | AC153: % | AD153: PTS
A154: OAKLEIGH | C154: FORD | E154: WEST | H154: J LILLEY | K154: BARROTT | N154: ROBBINS | Q154: WENN
A155: DANDENONG | C155: EVANS | E155: BROWN | H155: ORCHARD | K155: HARRINGTON | N155: ELLIS | Q155: MELAI | W155: WILLIAMSTOWN | X155: 4 | Y155: 0 | Z155: 0 | AA155: 501 | AB155: 319 | AC155: 157.05329153605015 | AD155: 16
A156: GOALKICKERS | W156: OAKLEIGH | X156: 4 | Y156: 0 | Z156: 0 | AA156: 517 | AB156: 365 | AC156: 141.64383561643837 | AD156: 16
A157: OAKLEIGH | C157: ROBBINS 3 | E157: TAYLOR 3 | G157: FORD 2 | I157: COLCOTT 2 | L157: MURNANE 2 | O157: JOHNSON | Q157: WENN | S157: BARROTT | W157: DANDENONG | X157: 3 | Y157: 1 | Z157: 0 | AA157: 402 | AB157: 371 | AC157: 108.35579514824798 | AD157: 12
A158: DANDENONG | C158: MILLER 6 | F158: BROWN 3 | I158: DAVENPORT 3 | L158: FLAHERTY | N158: DAVIES | W158: SANDRINGHAM | X158: 3 | Y158: 1 | Z158: 0 | AA158: 410 | AB158: 421 | AC158: 97.387173396674584 | AD158: 12
A160: WILLIAMSTOWN | C160: 4 | D160: 5 | E160: =C160*6+D160 -> 29 | G160: 9 | H160: 9 | I160: =G160*6+H160 -> 63 | K160: 13 | L160: 13 | M160: =K160*6+L160 -> 91 | O160: 16 | P160: 20 | Q160: =O160*6+P160 -> 116 | S160: PORT MELBOURNE | W160: SUNSHINE | X160: 2 | Y160: 2 | Z160: 0 | AA160: 412 | AB160: 428 | AC160: 96.261682242990659 | AD160: 8
A161: PORT MELBOURNE | C161: 2 | D161: 2 | E161: =C161*6+D161 -> 14 | G161: 5 | H161: 3 | I161: =G161*6+H161 -> 33 | K161: 10 | L161: 4 | M161: =K161*6+L161 -> 64 | O161: 12 | P161: 7 | Q161: =O161*6+P161 -> 79 | S161: ANDERSON | W161: PORT MELBOURNE | X161: 1 | Y161: 3 | Z161: 0 | AA161: 399 | AB161: 423 | AC161: 94.326241134751768 | AD161: 4
A162: BEST PLAYERS | W162: PRAHRAN | X162: 1 | Y162: 3 | Z162: 0 | AA162: 411 | AB162: 450 | AC162: 91.333333333333329 | AD162: 4
A163: WILLIAMSTOWN | C163: PAPLEY | F163: BOXALL | I163: DUNLOP | L163: FENTON | O163: EGAN | Q163: PERCY | W163: PRESTON | X163: 1 | Y163: 3 | Z163: 0 | AA163: 398 | AB163: 474 | AC163: 83.966244725738392 | AD163: 4
A164: PORT MELBOURNE | C164: SWINSTEAD | F164: ALLEN | I164: MALLETT | L164: ANDERSON | O164: PROFITT | Q164: BUCKLEY | W164: COBURG | X164: 1 | Y164: 3 | Z164: 0 | AA164: 366 | AB164: 450 | AC164: 81.333333333333329 | AD164: 4
A165: GOALKICKERS | W165: WAVERLEY | X165: 0 | Y165: 4 | Z165: 0 | AA165: 373 | AB165: 488 | AC165: 76.43442622950819 | AD165: 0
A166: WILLIAMSTOWN | C166: SVORINICH 3 | F166: COLLINS 3 | I166: MULLIGAN 2 | L166: L STILLMAN 2 | O166: HANNABERY 2 | R166: PAPLEY 2 | U166: JARRARD
A167: PORT MELBOURNE | C167: SMITH 5 | F167: ANDERSON 2 | I167: BUCKLEY | K167: COLLINS | M167: SKILTON | O167: HOLT | Q167: HUDSON
A169: SUNSHINE | C169: 3 | D169: 3 | E169: =C169*6+D169 -> 21 | G169: 3 | H169: 6 | I169: =G169*6+H169 -> 24 | K169: 12 | L169: 11 | M169: =K169*6+L169 -> 83 | O169: 16 | P169: 15 | Q169: =O169*6+P169 -> 111 | S169: COBURG
A170: COBURG | C170: 2 | D170: 4 | E170: =C170*6+D170 -> 16 | G170: 7 | H170: 9 | I170: =G170*6+H170 -> 51 | K170: 12 | L170: 12 | M170: =K170*6+L170 -> 84 | O170: 15 | P170: 16 | Q170: =O170*6+P170 -> 106 | S170: McMASTER
A171: BEST PLAYERS
A172: SUNSHINE | C172: CRAWFORD | F172: WOODS | I172: STONEHAM | L172: BAWDEN | O172: McKENZIE | R172: BENSON
A173: COBURG | C173: ELVERY | F173: ERWIN | I173: FARMER | L173: NAUGHTON | O173: LAWSON
A174: GOALKICKERS
A175: SUNSHINE | C175: G SLADDIN 4 | F175: STONEHAM 2 | I175: CRAWFORD 2 | L175: McKENZIE 2 | O175: CONNELLY 2 | R175: PAYNE | T175: BENSON | V175: CHADWICK | X175: CLARKE
A176: COBURG | C176: FARMER 4 | F176: NAUGHTON 4 | I176: MARSH 2 | K176: LAWSON 2 | N176: HOWELL | P176: FEDLEY | R176: McCARTHY
A178: PRESTON | C178: 4 | D178: 5 | E178: =C178*6+D178 -> 29 | G178: 11 | H178: 7 | I178: =G178*6+H178 -> 73 | K178: 14 | L178: 12 | M178: =K178*6+L178 -> 96 | O178: 20 | P178: 15 | Q178: =O178*6+P178 -> 135 | S178: PRESTON
A179: PRAHRAN | C179: 2 | D179: 2 | E179: =C179*6+D179 -> 14 | G179: 5 | H179: 11 | I179: =G179*6+H179 -> 41 | K179: 12 | L179: 15 | M179: =K179*6+L179 -> 87 | O179: 17 | P179: 16 | Q179: =O179*6+P179 -> 118 | S179: HAYES
A180: BEST PLAYERS
A181: PRESTON | C181: CLARK | F181: SCHICKERT | I181: ZUNNEBERG | L181: TELFORD | O181: ASHMEAD | R181: McMAHON
A182: PRAHRAN | C182: APPLETON | F182: PAYNE | I182: CAFFYN | L182: CULPIN | O182: ROSE
A183: GOALKICKERS
A184: PRESTON | C184: CLARK 11 | F184: WEIGHTMAN 3 | I184: ZUNNEBERG 2 | L184: DEAN | N184: ASHMEAD | Q184: McMAHON | T184: TELFORD
A185: PRAHRAN | C185: PAYNE 7 | F185: CAFFYN 3 | I185: APPLETON 2 | L185: CLARKE 2 | N185: JOHNSON 2 | Q185: PEACH
A187: SANDRINGHAM | C187: 5 | D187: 5 | E187: =C187*6+D187 -> 35 | G187: 8 | H187: 10 | I187: =G187*6+H187 -> 58 | K187: 15 | L187: 18 | M187: =K187*6+L187 -> 108 | O187: 19 | P187: 21 | Q187: =O187*6+P187 -> 135 | S187: WAVERLEY
A188: WAVERLEY | C188: 5 | D188: 4 | E188: =C188*6+D188 -> 34 | G188: 8 | H188: 6 | I188: =G188*6+H188 -> 54 | K188: 13 | L188: 10 | M188: =K188*6+L188 -> 88 | O188: 17 | P188: 13 | Q188: =O188*6+P188 -> 115 | S188: McBAIN
A189: BEST PLAYERS
A190: SANDRINGHAM | C190: AUSTIN | F190: SCHOLES | I190: SAMPSON | L190: MURPHY | O190: HESLOP | R190: WILLS
A191: WAVERLEY | C191: R ALLAN | F191: SMEDTZ | I191: OSBORNE | L191: GOSPER | O191: B ALLAN | R191: STONE
A192: GOALKICKERS
A193: SANDRINGHAM | C193: AUSTIN 9 | F193: HESLOP 4 | I193: MURPHY 3 | L193: SCHOLES 2 | O193: SAMPSON
A194: WAVERLEY | C194: R ALLAN 8 | F194: STONE 3 | I194: LANCASHIRE 3 | L194: SYKES | N194: CRAIG | P194: PARKES
A196: ROUND 5 | E196: 21ST MAY | J196: WEATHER | N196: FINE | S196: PLAYED AT
D197: 1ST QTR | H197: 2ND QTR | L197: 3RD QTR | P197: FINAL | S197: SUNSHINE
A198: SUNSHINE | C198: 2 | D198: 2 | E198: =C198*6+D198 -> 14 | G198: 9 | H198: 6 | I198: =G198*6+H198 -> 60 | K198: 15 | L198: 12 | M198: =K198*6+L198 -> 102 | O198: 16 | P198: 16 | Q198: =O198*6+P198 -> 112 | S198: UMPIRE | X198: LADDER | AB198: ROUND | AD198: 5
A199: SANDRINGHAM | C199: 3 | D199: 1 | E199: =C199*6+D199 -> 19 | G199: 6 | H199: 5 | I199: =G199*6+H199 -> 41 | K199: 9 | L199: 8 | M199: =K199*6+L199 -> 62 | O199: 12 | P199: 10 | Q199: =O199*6+P199 -> 82 | S199: GAMBETTA
A200: BEST PLAYERS | W200: TEAM | X200: W | Y200: L | Z200: D | AA200: FOR | AB200: AGST | AC200: % | AD200: PTS
A201: SUNSHINE | C201: McKENZIE | F201: PRIOR | I201: WOODS | L201: PAYNE | O201: CLIFFORD | R201: CHADWICK
A202: SANDRINGHAM | C202: SCHOLES | F202: SAMPSON | I202: J WARD | L202: CHISNALL | O202: WALFORD | R202: LOCKHART | W202: OAKLEIGH | X202: 5 | Y202: 0 | Z202: 0 | AA202: 635 | AB202: 447 | AC202: 142.05816554809843 | AD202: 20
A203: GOALKICKERS | P203: MORRIS | R203: IBRAHIM | W203: WILLIAMSTOWN | X203: 4 | Y203: 1 | Z203: 0 | AA203: 567 | AB203: 411 | AC203: 137.95620437956205 | AD203: 16
A204: SUNSHINE | C204: G SLADDIN 4 | F204: McKENZIE 3 | I204: PAYNE 2 | K204: GOOLD | M204: STONEHAM | O204: CONNELLY | Q204: BENSON | S204: CHADWICK | W204: DANDENONG | X204: 3 | Y204: 2 | Z204: 0 | AA204: 511 | AB204: 487 | AC204: 104.92813141683779 | AD204: 12
A205: SANDRINGHAM | C205: SCHOLES 4 | F205: WARD 2 | I205: SARAU 2 | K205: SAMPSON | M205: DARE | O205: CHISNALL | Q205: HESLOP | W205: SUNSHINE | X205: 3 | Y205: 2 | Z205: 0 | AA205: 524 | AB205: 510 | AC205: 102.74509803921569 | AD205: 12
A207: PORT MELBOURNE | C207: 4 | D207: 2 | E207: =C207*6+D207 -> 26 | G207: 7 | H207: 7 | I207: =G207*6+H207 -> 49 | K207: 14 | L207: 8 | M207: =K207*6+L207 -> 92 | O207: 17 | P207: 14 | Q207: =O207*6+P207 -> 116 | S207: PORT MELBOURNE | W207: SANDRINGHAM | X207: 3 | Y207: 2 | Z207: 0 | AA207: 492 | AB207: 533 | AC207: 92.307692307692307 | AD207: 12
A208: DANDENONG | C208: 2 | D208: 5 | E208: =C208*6+D208 -> 17 | G208: 8 | H208: 10 | I208: =G208*6+H208 -> 58 | K208: 15 | L208: 14 | M208: =K208*6+L208 -> 104 | O208: 15 | P208: 19 | Q208: =O208*6+P208 -> 109 | S208: TORNEY | W208: PRAHRAN | X208: 2 | Y208: 3 | Z208: 0 | AA208: 503 | AB208: 516 | AC208: 97.480620155038764 | AD208: 8
A209: BEST PLAYERS | W209: PORT MELBOURNE | X209: 2 | Y209: 3 | Z209: 0 | AA209: 515 | AB209: 532 | AC209: 96.804511278195491 | AD209: 8
A210: PORT MELBOURNE | C210: ALLEN | F210: ANDERSON | I210: SPARGO | L210: MALLETT | O210: HUDSON | R210: SMITH | W210: PRESTON | X210: 1 | Y210: 4 | Z210: 0 | AA210: 497 | AB210: 584 | AC210: 85.102739726027394 | AD210: 4
A211: DANDENONG | C211: BROWN | F211: DAVENPORT | I211: KENDALL | L211: ORCHARD | O211: HARRINGTON | R211: PERRY | W211: WAVERLEY | X211: 1 | Y211: 4 | Z211: 0 | AA211: 483 | AB211: 587 | AC211: 82.282793867120958 | AD211: 4
A212: GOALKICKERS | W212: COBURG | X212: 1 | Y212: 4 | Z212: 0 | AA212: 448 | AB212: 568 | AC212: 78.873239436619713 | AD212: 4
A213: PORT MELBOURNE | C213: SMITH 5 | E213: ANDERSON 3 | H213: HUDSON 2 | J213: SPARGO 2 | M213: BESHARA 2 | P213: COLLINS | R213: JENSEN | T213: BEHAN
A214: DANDENONG | C214: BROWN 3 | F214: MILLER 3 | I214: DAVENPORT 3 | L214: FLAHERTY 2 | O214: SOUTHERN 2 | R214: DAVIES | T214: MELAI
A216: WAVERLEY | C216: 3 | D216: 5 | E216: =C216*6+D216 -> 23 | G216: 10 | H216: 9 | I216: =G216*6+H216 -> 69 | K216: 14 | L216: 10 | M216: =K216*6+L216 -> 94 | O216: 15 | P216: 20 | Q216: =O216*6+P216 -> 110 | S216: WAVERLEY
A217: PRESTON | C217: 4 | D217: 4 | E217: =C217*6+D217 -> 28 | G217: 6 | H217: 7 | I217: =G217*6+H217 -> 43 | K217: 14 | L217: 10 | M217: =K217*6+L217 -> 94 | O217: 14 | P217: 15 | Q217: =O217*6+P217 -> 99 | S217: HUXTABLE
A218: BEST PLAYERS
A219: WAVERLEY | C219: IVEY | F219: STONE | I219: BROWN | L219: B ALLAN | N219: HARRY | Q219: OSBORNE
A220: PRESTON | C220: ASHMEAD | F220: TELFORD | I220: GOAD | L220: MARTIN | N220: FISHER | Q220: CLARK
A221: GOALKICKERS
A222: WAVERLEY | C222: BROWN 5 | F222: R ALLAN 4 | I222: HARRY 2 | K222: PARKES 2 | N222: STONE | P222: OSBORNE
A223: PRESTON | C223: CLARK 5 | F223: ASHMEAD 4 | I223: LE GASSICK 2 | L223: McMAHON | N223: ZUNNEBERG | Q223: DRYSDALE
A225: PRAHRAN | C225: 2 | D225: 3 | E225: =C225*6+D225 -> 15 | G225: 7 | H225: 5 | I225: =G225*6+H225 -> 47 | K225: 10 | L225: 8 | M225: =K225*6+L225 -> 68 | O225: 13 | P225: 14 | Q225: =O225*6+P225 -> 92 | S225: WILLIAMSTOWN
A226: WILLIAMSTOWN | C226: 1 | D226: 6 | E226: =C226*6+D226 -> 12 | G226: 2 | H226: 16 | I226: =G226*6+H226 -> 28 | K226: 6 | L226: 20 | M226: =K226*6+L226 -> 56 | O226: 7 | P226: 24 | Q226: =O226*6+P226 -> 66 | S226: FLANAGAN
A227: BEST PLAYERS
A228: PRAHRAN | C228: JOHNSTON | F228: APPLETON | I228: RON THOMAS | L228: HUTCHESSON | O228: PAYNE | R228: KENNEALLY
A229: WILLIAMSTOWN | C229: STILLMAN | F229: FENTON | I229: BOXALL | L229: JARRARD | O229: BASTIAN | R229: EGAN
A230: GOALKICKERS
A231: PRAHRAN | C231: APPLETON 3 | F231: PEACH 3 | I231: ROSE 2 | K231: HUTCHESSON 2 | N231: CAFFYN | P231: PAYNE | R231: LANGDON
A232: WILLIAMSTOWN | C232: COLLINS 2 | F232: FANNING 2 | I232: SVORINICH | L232: EGAN | N232: JACKMAN
A234: OAKLEIGH | C234: 2 | D234: 5 | E234: =C234*6+D234 -> 17 | G234: 9 | H234: 8 | I234: =G234*6+H234 -> 62 | K234: 15 | L234: 10 | M234: =K234*6+L234 -> 100 | O234: 17 | P234: 16 | Q234: =O234*6+P234 -> 118 | S234: OAKLEIGH
A235: COBURG | C235: 2 | D235: 3 | E235: =C235*6+D235 -> 15 | G235: 5 | H235: 8 | I235: =G235*6+H235 -> 38 | K235: 8 | L235: 13 | M235: =K235*6+L235 -> 61 | O235: 11 | P235: 16 | Q235: =O235*6+P235 -> 82 | S235: ANDERSON
A236: BEST PLAYERS
A237: OAKLEIGH | C237: BARROTT | F237: CHISHOLM | I237: ROBBINS | L237: JOHNSON | O237: FORD | R237: WEST
A238: COBURG | C238: MARSH | F238: FEDLEY | I238: FINCHER | L238: HOBBS | O238: ELVERY | R238: FARMER
A239: GOALKICKERS
A240: OAKLEIGH | C240: JOHNSON 5 | F240: ROBBINS 4 | I240: BARROTT 3 | L240: COLCOTT 2 | O240: MURNANE | Q240: WENN | S240: AITKEN
A241: COBURG | C241: MARSH 4 | F241: FEDLEY 3 | I241: HOWELL | K241: GALE | M241: NAUGHTON | P241: LAWSON
A243: ROUND 6 | E243: 28TH MAY | J243: WEATHER | N243: FINE | S243: PLAYED AT
D244: 1ST QTR | H244: 2ND QTR | L244: 3RD QTR | P244: FINAL | S244: SUNSHINE
A245: WILLIAMSTOWN | C245: 3 | D245: 5 | E245: =C245*6+D245 -> 23 | G245: 5 | H245: 14 | I245: =G245*6+H245 -> 44 | K245: 12 | L245: 15 | M245: =K245*6+L245 -> 87 | O245: 14 | P245: 18 | Q245: =O245*6+P245 -> 102 | S245: UMPIRE | X245: LADDER | AB245: ROUND | AD245: 6
A246: SUNSHINE | C246: 3 | D246: 1 | E246: =C246*6+D246 -> 19 | G246: 7 | H246: 3 | I246: =G246*6+H246 -> 45 | K246: 9 | L246: 8 | M246: =K246*6+L246 -> 62 | O246: 13 | P246: 16 | Q246: =O246*6+P246 -> 94 | S246: TORNEY
A247: BEST PLAYERS | W247: TEAM | X247: W | Y247: L | Z247: D | AA247: FOR | AB247: AGST | AC247: % | AD247: PTS
A248: WILLIAMSTOWN | C248: COLLINS | F248: MULLIGAN | I248: PERCY | K248: STILLMAN | N248: HANNABURY | Q248: THOMPSON
A249: SUNSHINE | C249: McKENZIE | F249: STONEHAM | I249: WOODS | K249: CHADWICK | N249: SLADDIN | Q249: CRAWFORD | W249: WILLIAMSTOWN | X249: 5 | Y249: 1 | Z249: 0 | AA249: 669 | AB249: 505 | AC249: 132.47524752475246 | AD249: 20
A250: GOALKICKERS | W250: OAKLEIGH | X250: 5 | Y250: 1 | Z250: 0 | AA250: 756 | AB250: 573 | AC250: 131.93717277486911 | AD250: 20
A251: WILLIAMSTOWN | C251: MULLIGAN 6 | F251: COLLINS 2 | I251: JARRARD 2 | L251: SVORINICH | O251: FANNING | Q251: HANNEBERY | T251: DUNLOP | W251: DANDENONG | X251: 4 | Y251: 2 | Z251: 0 | AA251: 633 | AB251: 593 | AC251: 106.74536256323778 | AD251: 16
A252: SUNSHINE | C252: G SLADDIN 3 | F252: CRAWFORD 2 | I252: CONNELLY 2 | L252: CHADWICK 2 | O252: STONEHAM | Q252: McKENZIE | S252: CLARKE | W252: SANDRINGHAM | X252: 4 | Y252: 2 | Z252: 0 | AA252: 618 | AB252: 654 | AC252: 94.495412844036693 | AD252: 16
R253: MORRIS
A254: SANDRINGHAM | C254: 3 | D254: 4 | E254: =C254*6+D254 -> 22 | G254: 6 | H254: 15 | I254: =G254*6+H254 -> 51 | K254: 13 | L254: 18 | M254: =K254*6+L254 -> 96 | O254: 17 | P254: 24 | Q254: =O254*6+P254 -> 126 | S254: BEACH ROAD | W254: PRAHRAN | X254: 3 | Y254: 3 | Z254: 0 | AA254: 669 | AB254: 604 | AC254: 110.76158940397352 | AD254: 12
A255: OAKLEIGH | C255: 6 | D255: 5 | E255: =C255*6+D255 -> 41 | G255: 11 | H255: 8 | I255: =G255*6+H255 -> 74 | K255: 16 | L255: 13 | M255: =K255*6+L255 -> 109 | O255: 17 | P255: 19 | Q255: =O255*6+P255 -> 121 | S255: HAYES | W255: SUNSHINE | X255: 3 | Y255: 3 | Z255: 0 | AA255: 618 | AB255: 612 | AC255: 100.98039215686275 | AD255: 12
A256: BEST PLAYERS | W256: PORT MELBOURNE | X256: 2 | Y256: 4 | Z256: 0 | AA256: 623 | AB256: 646 | AC256: 96.43962848297214 | AD256: 8
A257: SANDRINGHAM | C257: I COOPER | F257: WARD | I257: SAMPSON | L257: BROWNE | O257: MURPHY | R257: AUSTIN | W257: PRESTON | X257: 2 | Y257: 4 | Z257: 0 | AA257: 611 | AB257: 692 | AC257: 88.294797687861276 | AD257: 8
A258: OAKLEIGH | C258: FORD | F258: T QUINN | I258: MURNANE | L258: BARROTT | O258: ROBBINS | R258: FORSTER | W258: COBURG | X258: 1 | Y258: 5 | Z258: 0 | AA258: 554 | AB258: 690 | AC258: 80.289855072463766 | AD258: 4
A259: GOALKICKERS | W259: WAVERLEY | X259: 1 | Y259: 5 | Z259: 0 | AA259: 571 | AB259: 753 | AC259: 75.830013280212484 | AD259: 4
A260: SANDRINGHAM | C260: COOPER 7 | F260: AUSTIN 4 | I260: SCHOLES 3 | L260: SAMPSON | N260: CLARKE | P260: DARE
A261: OAKLEIGH | C261: ROBBINS 3 | F261: FORD 3 | H261: COLCOTT 3 | K261: MURNANE 3 | N261: JOHNSON 2 | Q261: BARROTT 2 | T261: TAYLOR
A263: PRESTON | C263: 3 | D263: 3 | E263: =C263*6+D263 -> 21 | G263: 7 | H263: 11 | I263: =G263*6+H263 -> 53 | K263: 12 | L263: 14 | M263: =K263*6+L263 -> 86 | O263: 16 | P263: 18 | Q263: =O263*6+P263 -> 114 | S263: PRESTON
A264: PORT MELBOURNE | C264: 6 | D264: 5 | E264: =C264*6+D264 -> 41 | G264: 9 | H264: 7 | I264: =G264*6+H264 -> 61 | K264: 14 | L264: 11 | M264: =K264*6+L264 -> 95 | O264: 16 | P264: 12 | Q264: =O264*6+P264 -> 108 | S264: JACKSON
A265: BEST PLAYERS
A266: PRESTON | C266: ASHMEAD | F266: CLARK | I266: BAIRD | K266: GOAD | N266: WALKER | Q266: SCHICKERT
A267: PORT MELBOURNE | C267: ANDERSON | F267: PASQUILL | I267: HUDSON | K267: RHEINBERGER | N267: SPARGO | Q267: COLLINS
A268: GOALKICKERS
A269: PRESTON | C269: BAIRD 5 | F269: CLARK 4 | I269: ASHMEAD 2 | L269: ZUNNEBERG 2 | O269: IRELAND 2 | R269: McMAHON
A270: PORT MELBOURNE | C270: ANDERSON 4 | F270: SMITH 3 | I270: HUDSON 3 | L270: PASQUILL 3 | O270: BEHAN 2 | Q270: SPARGO
A272: PRAHRAN | C272: 9 | D272: 4 | E272: =C272*6+D272 -> 58 | G272: 15 | H272: 7 | I272: =G272*6+H272 -> 97 | K272: 21 | L272: 15 | M272: =K272*6+L272 -> 141 | O272: 24 | P272: 22 | Q272: =O272*6+P272 -> 166 | S272: TOORAK PARK
A273: WAVERLEY | C273: 2 | D273: 1 | E273: =C273*6+D273 -> 13 | G273: 6 | H273: 8 | I273: =G273*6+H273 -> 44 | K273: 8 | L273: 13 | M273: =K273*6+L273 -> 61 | O273: 12 | P273: 16 | Q273: =O273*6+P273 -> 88 | S273: McMASTER
A274: BEST PLAYERS
A275: PRAHRAN | C275: ROSE | F275: RAY THOMAS | I275: O'BRIEN | L275: LANGDON | O275: PEACH
A276: WAVERLEY | C276: K OSBORNE | F276: IVEY | I276: R ALLAN | L276: GOSPER | O276: STONE | R276: CRAIG
A277: GOALKICKERS
A278: PRAHRAN | C278: PAYNE 4 | E278: APPLETON 3 | H278: O'BRIEN 3 | J278: RON THOMAS 3 | M278: RAY THOMAS 3 | P278: LANGDON 3 | S278: PEACH 2 | V278: CAFFYN | X278: ROSE | Z278: HUTCHESSON
A279: WAVERLEY | C279: R ALLAN 4 | F279: STONE 2 | I279: OWENS 2 | K279: CRAIG | M279: PARKES | O279: GOSPER | Q279: PE GRANT
A281: DANDENONG | C281: 2 | D281: 2 | E281: =C281*6+D281 -> 14 | G281: 7 | H281: 6 | I281: =G281*6+H281 -> 48 | K281: 12 | L281: 12 | M281: =K281*6+L281 -> 84 | O281: 18 | P281: 14 | Q281: =O281*6+P281 -> 122 | S281: DANDENONG
A282: COBURG | C282: 5 | D282: 6 | E282: =C282*6+D282 -> 36 | G282: 8 | H282: 7 | I282: =G282*6+H282 -> 55 | K282: 10 | L282: 9 | M282: =K282*6+L282 -> 69 | O282: 16 | P282: 10 | Q282: =O282*6+P282 -> 106 | S282: HUXTABLE
A283: BEST PLAYERS
A284: DANDENONG | C284: KENDALL | F284: BROWN | I284: EVANS | L284: SHINNERS | O284: HIBBERT | R284: HENRIKSEN
A285: COBURG | C285: FARMER | F285: FEDLEY | I285: ERWIN | L285: BRENNAN | O285: HOBBS | R285: HOGAN
A286: GOALKICKERS
A287: DANDENONG | C287: HIBBERT 3 | F287: ORCHARD 3 | I287: BROWN 2 | K287: MILLER 2 | M287: DAVENPORT 2 | P287: SOUTHERN 2 | S287: KENDALL | V287: MADDEN | X287: MELAI
A288: COBURG | C288: FARMER 5 | F288: FEDLEY 4 | I288: BRENNAN 3 | L288: GALE 2 | N288: HOWELL | P288: MORRISON
A290: ROUND 7 | E290: 4TH JUNE | J290: WEATHER | N290: FINE | S290: PLAYED AT
D291: 1ST QTR | H291: 2ND QTR | L291: 3RD QTR | P291: FINAL | S291: BEACH ROAD
A292: DANDENONG | C292: 3 | D292: 4 | E292: =C292*6+D292 -> 22 | G292: 4 | H292: 15 | I292: =G292*6+H292 -> 39 | K292: 9 | L292: 19 | M292: =K292*6+L292 -> 73 | O292: 13 | P292: 27 | Q292: =O292*6+P292 -> 105 | S292: UMPIRE | X292: LADDER | AB292: ROUND | AD292: 7
A293: SANDRINGHAM | C293: 4 | D293: 2 | E293: =C293*6+D293 -> 26 | G293: 9 | H293: 7 | I293: =G293*6+H293 -> 61 | K293: 11 | L293: 12 | M293: =K293*6+L293 -> 78 | O293: 13 | P293: 16 | Q293: =O293*6+P293 -> 94 | S293: ABBOTT
A294: BEST PLAYERS | W294: TEAM | X294: W | Y294: L | Z294: D | AA294: FOR | AB294: AGST | AC294: % | AD294: PTS
A295: DANDENONG | C295: SHINNERS | F295: DAVENPORT | I295: EVANS | L295: BROWN | O295: MURPHY | R295: HENRIKSEN
A296: SANDRINGHAM | C296: CLARKE | F296: BROWNE | I296: SPURRELL | L296: LIPSCOMBE | O296: SAMPSON | R296: SARAU | W296: OAKLEIGH | X296: 6 | Y296: 1 | Z296: 0 | AA296: 925 | AB296: 687 | AC296: 134.6433770014556 | AD296: 24
A297: GOALKICKERS | W297: WILLIAMSTOWN | X297: 5 | Y297: 2 | Z297: 0 | AA297: 759 | AB297: 617 | AC297: 123.01458670988654 | AD297: 20
A298: DANDENONG | C298: DAVENPORT 4 | F298: FLAHERTY 3 | I298: BROWN 2 | L298: KENDALL | N298: HIBBERT | P298: MELAI | W298: DANDENONG | X298: 5 | Y298: 2 | Z298: 0 | AA298: 738 | AB298: 687 | AC298: 107.42358078602621 | AD298: 20
A299: SANDRINGHAM | C299: COOPER 4 | F299: LIPSCOMBE 3 | I299: CLARKE 2 | L299: WARD | N299: SAMPSON | Q299: DARE | S299: KENNEDY | W299: SANDRINGHAM | X299: 4 | Y299: 3 | Z299: 0 | AA299: 712 | AB299: 759 | AC299: 93.807641633728593 | AD299: 16
A301: OAKLEIGH | C301: 7 | D301: 2 | E301: =C301*6+D301 -> 44 | G301: 11 | H301: 10 | I301: =G301*6+H301 -> 76 | K301: 18 | L301: 14 | M301: =K301*6+L301 -> 122 | O301: 25 | P301: 19 | Q301: =O301*6+P301 -> 169 | S301: OAKLEIGH | W301: PORT MELBOURNE | X301: 3 | Y301: 4 | Z301: 0 | AA301: 779 | AB301: 768 | AC301: 101.43229166666667 | AD301: 12
A302: SUNSHINE | C302: 5 | D302: 0 | E302: =C302*6+D302 -> 30 | G302: 8 | H302: 3 | I302: =G302*6+H302 -> 51 | K302: 12 | L302: 4 | M302: =K302*6+L302 -> 76 | O302: 18 | P302: 6 | Q302: =O302*6+P302 -> 114 | S302: McBAIN | W302: PRAHRAN | X302: 3 | Y302: 4 | Z302: 0 | AA302: 742 | AB302: 764 | AC302: 97.120418848167546 | AD302: 12
A303: BEST PLAYERS | W303: SUNSHINE | X303: 3 | Y303: 4 | Z303: 0 | AA303: 732 | AB303: 781 | AC303: 93.725992317541611 | AD303: 12
A304: OAKLEIGH | C304: FORSTER | F304: BARROTT | I304: MURNANE | L304: ROBBINS | O304: CHISHOLM | R304: FORD | W304: PRESTON | X304: 3 | Y304: 4 | Z304: 0 | AA304: 723 | AB304: 782 | AC304: 92.455242966751925 | AD304: 12
A305: SUNSHINE | C305: PAYNE | F305: CRAWFORD | I305: McKENZIE | L305: MORRIS | O305: WOODS | R305: BENSON | W305: COBURG | X305: 2 | Y305: 5 | Z305: 0 | AA305: 714 | AB305: 763 | AC305: 93.577981651376149 | AD305: 8
A306: GOALKICKERS | W306: WAVERLEY | X306: 1 | Y306: 6 | Z306: 0 | AA306: 693 | AB306: 909 | AC306: 76.237623762376231 | AD306: 4
A307: OAKLEIGH | C307: JOHNSON 7 | F307: MURNANE 6 | I307: ROBBINS 5 | K307: FORD 2 | M307: QUINN 2 | O307: TAYLOR | Q307: COLCOTT | S307: BARROTT
A308: SUNSHINE | C308: MORRIS 4 | F308: CRAWFORD 3 | I308: WAGLAND 2 | L308: G SLADDIN 2 | O308: PAYNE 2 | Q308: BENSON 2 | S308: STONEHAM | V308: PRIOR | X308: McKENZIE
A310: PORT MELBOURNE | C310: 6 | D310: 5 | E310: =C310*6+D310 -> 41 | G310: 11 | H310: 9 | I310: =G310*6+H310 -> 75 | K310: 15 | L310: 11 | M310: =K310*6+L310 -> 101 | O310: 24 | P310: 12 | Q310: =O310*6+P310 -> 156 | S310: PORT MELBOURNE
A311: WAVERLEY | C311: 2 | D311: 6 | E311: =C311*6+D311 -> 18 | G311: 8 | H311: 11 | I311: =G311*6+H311 -> 59 | K311: 14 | L311: 17 | M311: =K311*6+L311 -> 101 | O311: 17 | P311: 20 | Q311: =O311*6+P311 -> 122 | S311: FLANAGAN
A312: BEST PLAYERS
A313: PORT MELBOURNE | C313: SWINSTEAD | F313: SMITH | I313: ANDERSON | L313: RHEINBERGER | O313: PASQUILL | R313: PROFFIT
A314: WAVERLEY | C314: B ALLAN | F314: STONE | I314: HARRY | L314: R ALLAN | O314: SYKES | R314: PET GRANT
A315: GOALKICKERS
A316: PORT MELBOURNE | C316: SMITH 12 | F316: ANDERSON 4 | I316: SPARGO 4 | K316: BEHAN 2 | M316: BUCKLEY | O316: HOLT
A317: WAVERLEY | C317: R ALLAN 5 | F317: BROWN 3 | I317: PE GRANT 3 | L317: WILTSHIRE 2 | O317: PARKES | Q317: OSBORNE | S317: B ALLAN | V317: HASTINGS
A319: COBURG | C319: 2 | D319: 2 | E319: =C319*6+D319 -> 14 | G319: 8 | H319: 7 | I319: =G319*6+H319 -> 55 | K319: 13 | L319: 13 | M319: =K319*6+L319 -> 91 | O319: 24 | P319: 16 | Q319: =O319*6+P319 -> 160 | S319: COBURG
A320: PRAHRAN | C320: 2 | D320: 5 | E320: =C320*6+D320 -> 17 | G320: 6 | H320: 7 | I320: =G320*6+H320 -> 43 | K320: 8 | L320: 9 | M320: =K320*6+L320 -> 57 | O320: 10 | P320: 13 | Q320: =O320*6+P320 -> 73 | S320: CARLILE
A321: BEST PLAYERS
A322: COBURG | C322: FARMER | F322: PRICE | I322: SULLIVAN | L322: HOBBS | O322: FEDLEY | R322: ERWIN
A323: PRAHRAN | C323: BRANDT | F323: APPLETON | I323: HUTCHESSON | L323: JOHNSTON | O323: LANGDON | R323: GRANGE
A324: GOALKICKERS
A325: COBURG | C325: FEDLEY 5 | F325: BRENNAN 4 | I325: FARMER 3 | K325: WATT 3 | M325: GALE 2 | O325: MARSH 2 | Q325: MORRISON 2 | T325: SULLIVAN 2 | X325: HOBBS
A326: PRAHRAN | C326: APPLETON 4 | F326: PAYNE 2 | I326: HUTCHESSON 2 | L326: RON THOMAS | O326: RAY THOMAS
A328: PRESTON | C328: 4 | D328: 7 | E328: =C328*6+D328 -> 31 | G328: 8 | H328: 9 | I328: =G328*6+H328 -> 57 | K328: 11 | L328: 14 | M328: =K328*6+L328 -> 80 | O328: 16 | P328: 16 | Q328: =O328*6+P328 -> 112 | S328: WILLIAMSTOWN
A329: WILLIAMSTOWN | C329: 2 | D329: 4 | E329: =C329*6+D329 -> 16 | G329: 7 | H329: 8 | I329: =G329*6+H329 -> 50 | K329: 10 | L329: 12 | M329: =K329*6+L329 -> 72 | O329: 12 | P329: 18 | Q329: =O329*6+P329 -> 90 | S329: STIRLING
A330: BEST PLAYERS
A331: PRESTON | C331: ZUNNEBERG | F331: WEIGHTMAN | I331: TELFORD | L331: CLARK | O331: MARTIN | R331: McMAHON
A332: WILLIAMSTOWN | C332: STILLMAN | F332: PERCY | I332: HANNABURY | L332: MULLIGAN | O332: HARVEY | R332: SVORINICH
A333: GOALKICKERS
A334: PRESTON | C334: CLARK 7 | F334: TELFORD 2 | I334: WEIGHTMAN 2 | L334: IRELAND 2 | N334: ASHMEAD | Q334: ZUNNEBERG | T334: STANLEY
A335: WILLIAMSTOWN | C335: L STILLMAN 4 | F335: SVORINICH 2 | I335: FANNING 2 | L335: NOBLE 2 | N335: MULLIGAN | Q335: JAMES
A337: ROUND 8 | E337: 10TH JUNE | J337: WEATHER | M337: SOUTH WEST WIND SHOWERS | S337: PLAYED AT
D338: 1ST QTR | H338: 2ND QTR | L338: 3RD QTR | P338: FINAL | S338: WILLIAMSTOWN
A339: WILLIAMSTOWN | C339: 6 | D339: 5 | E339: =C339*6+D339 -> 41 | G339: 8 | H339: 8 | I339: =G339*6+H339 -> 56 | K339: 16 | L339: 16 | M339: =K339*6+L339 -> 112 | O339: 19 | P339: 17 | Q339: =O339*6+P339 -> 131 | S339: UMPIRE | X339: LADDER | AB339: ROUND | AD339: 8
A340: DANDENONG | C340: 2 | D340: 3 | E340: =C340*6+D340 -> 15 | G340: 7 | H340: 8 | I340: =G340*6+H340 -> 50 | K340: 8 | L340: 8 | M340: =K340*6+L340 -> 56 | O340: 14 | P340: 18 | Q340: =O340*6+P340 -> 102 | S340: GAMBETTA
A341: BEST PLAYERS | W341: TEAM | X341: W | Y341: L | Z341: D | AA341: FOR | AB341: AGST | AC341: % | AD341: PTS
A342: WILLIAMSTOWN | C342: THOMPSON | F342: HEMLEY | I342: FANNING | L342: RADZIMINSKI | O342: STILLMAN | R342: MULLIGAN
A343: DANDENONG | C343: BROWN | F343: SHINNERS | I343: EVANS | L343: ORCHARD | O343: HENRIKSEN | R343: HARRINGTON | W343: OAKLEIGH | X343: 6 | Y343: 2 | Z343: 0 | AA343: 1021 | AB343: 817 | AC343: 124.96940024479804 | AD343: 24
A344: GOALKICKERS | O344: COLLINS | Q344: FANNING | S344: PAPLEY | W344: WILLIAMSTOWN | X344: 6 | Y344: 2 | Z344: 0 | AA344: 890 | AB344: 719 | AC344: 123.78303198887343 | AD344: 24
A345: WILLIAMSTOWN | C345: MULLIGAN 4 | F345: RADZIMINSKI 3 | J345: L STILLMAN 3 | M345: JACKMAN 3 | P345: NOBLE 2 | R345: HEMLEY 2 | W345: DANDENONG | X345: 5 | Y345: 3 | Z345: 0 | AA345: 840 | AB345: 818 | AC345: 102.68948655256723 | AD345: 20
A346: DANDENONG | C346: BROWN 6 | F346: MILLER 3 | I346: FLAHERTY 2 | L346: DAVENPORT | O346: REID | Q346: SHINNERS | W346: PORT MELBOURNE | X346: 4 | Y346: 4 | Z346: 0 | AA346: 909 | AB346: 864 | AC346: 105.20833333333333 | AD346: 16
A348: PORT MELBOURNE | C348: 8 | D348: 3 | E348: =C348*6+D348 -> 51 | G348: 13 | H348: 7 | I348: =G348*6+H348 -> 85 | K348: 16 | L348: 13 | M348: =K348*6+L348 -> 109 | O348: 19 | P348: 16 | Q348: =O348*6+P348 -> 130 | S348: PORT MELBOURNE | W348: PRAHRAN | X348: 4 | Y348: 4 | Z348: 0 | AA348: 865 | AB348: 858 | AC348: 100.81585081585082 | AD348: 16
A349: OAKLEIGH | C349: 3 | D349: 1 | E349: =C349*6+D349 -> 19 | G349: 5 | H349: 8 | I349: =G349*6+H349 -> 38 | K349: 11 | L349: 13 | M349: =K349*6+L349 -> 79 | O349: 13 | P349: 18 | Q349: =O349*6+P349 -> 96 | S349: ABBOTT | W349: PRESTON | X349: 4 | Y349: 4 | Z349: 0 | AA349: 884 | AB349: 919 | AC349: 96.19 | AD349: 16
A350: BEST PLAYERS | W350: SANDRINGHAM | X350: 4 | Y350: 4 | Z350: 0 | AA350: 849 | AB350: 920 | AC350: 92.28 | AD350: 16
A351: PORT MELBOURNE | C351: G ANDERSON | F351: HARLAND | I351: PASQUILL | L351: BUCKLEY | O351: SWINSTEAD | R351: M ALLEN | W351: COBURG | X351: 3 | Y351: 5 | Z351: 0 | AA351: 831 | AB351: 859 | AC351: 96.740395809080326 | AD351: 12
A352: OAKLEIGH | C352: MURNANE | F352: ROBBINS | I352: T QUINN | L352: WEST | O352: STANTON | R352: FORSTER | W352: SUNSHINE | X352: 3 | Y352: 5 | Z352: 0 | AA352: 826 | AB352: 904 | AC352: 91.371681415929203 | AD352: 12
A353: GOALKICKERS | W353: WAVERLEY | X353: 1 | Y353: 7 | Z353: 0 | AA353: 789 | AB353: 1026 | AC353: 76.900584795321635 | AD353: 4
A354: PORT MELBOURNE | C354: SMITH 7 | F354: HARLAND 4 | I354: PASQUILL 3 | L354: ANDERSON 2 | O354: HOLT | Q354: SPARGO | S354: FRENCH
A355: OAKLEIGH | C355: JOHNSON 4 | F355: MURNANE 4 | I355: ROBBINS 3 | L355: TAYLOR | N355: WENN
A357: PRAHRAN | C357: 7 | D357: 2 | E357: =C357*6+D357 -> 44 | G357: 9 | H357: 4 | I357: =G357*6+H357 -> 58 | K357: 13 | L357: 11 | M357: =K357*6+L357 -> 89 | O357: 18 | P357: 15 | Q357: =O357*6+P357 -> 123 | S357: TOORAK PARK
A358: SUNSHINE | C358: 4 | D358: 2 | E358: =C358*6+D358 -> 26 | G358: 6 | H358: 6 | I358: =G358*6+H358 -> 42 | K358: 10 | L358: 9 | M358: =K358*6+L358 -> 69 | O358: 14 | P358: 10 | Q358: =O358*6+P358 -> 94 | S358: ANDERSON
A359: BEST PLAYERS
A360: PRAHRAN | C360: GRANGE | F360: CULPIN | I360: APPLETON | L360: LANGDON | O360: PAYNE | R360: HUTCHESSON
A361: SUNSHINE | C361: LLOYD | F361: THOMAS | I361: WOODS | L361: PRIOR | O361: CRAWFORD | R361: BENSON
A362: GOALKICKERS
A363: PRAHRAN | C363: APPLETON 5 | F363: PAYNE 4 | H363: ANDERSON 3 | K363: CLARKE 2 | N363: HUTCHESSON | Q363: RAY THOMAS | T363: PIROUET | W363: KENNEALLY
A364: SUNSHINE | C364: CRAWFORD 3 | F364: LLOYD 3 | H364: G SLADDIN 2 | K364: WAGLAND | N364: STONEHAM | Q364: NICHOLSON | T364: BENSON | W364: COLLINS | X364: GLAVICI
A366: PRESTON | C366: 8 | D366: 7 | E366: =C366*6+D366 -> 55 | G366: 15 | H366: 8 | I366: =G366*6+H366 -> 98 | K366: 20 | L366: 14 | M366: =K366*6+L366 -> 134 | O366: 24 | P366: 17 | Q366: =O366*6+P366 -> 161 | S366: PRESTON
A367: SANDRINGHAM | C367: 2 | D367: 2 | E367: =C367*6+D367 -> 14 | G367: 8 | H367: 10 | I367: =G367*6+H367 -> 58 | K367: 12 | L367: 13 | M367: =K367*6+L367 -> 85 | O367: 20 | P367: 17 | Q367: =O367*6+P367 -> 137 | S367: CARLILE
A368: BEST PLAYERS
A369: PRESTON | C369: ZUNNEBERG | F369: HILL | I369: STANLEY | L369: CLARK | O369: MARTIN | R369: LESLIE
A370: SANDRINGHAM | C370: SAMPSON | F370: SPURRELL | I370: CLARK | L370: BROWNE | O370: CHISNALL | R370: HESLOP
A371: GOALKICKERS
A372: PRESTON | C372: CLARK 8 | F372: ZUNNEBERG 4 | I372: McMAHON 3 | L372: STANLEY 3 | O372: WEIGHTMAN 2 | R372: HUNT 2 | T372: BAIRD | V372: IRELAND
A373: SANDRINGHAM | C373: SAMPSON 6 | F373: CLARKE 5 | I373: KENNEDY 3 | L373: WARD 2 | O373: HESLOP 2 | Q373: SARAU | S373: SPURRELL
A375: COBURG | C375: 6 | D375: 1 | E375: =C375*6+D375 -> 37 | G375: 10 | H375: 4 | I375: =G375*6+H375 -> 64 | K375: 12 | L375: 7 | M375: =K375*6+L375 -> 79 | O375: 18 | P375: 9 | Q375: =O375*6+P375 -> 117 | S375: WAVERLEY
A376: WAVERLEY | C376: 6 | D376: 1 | E376: =C376*6+D376 -> 37 | G376: 8 | H376: 2 | I376: =G376*6+H376 -> 50 | K376: 12 | L376: 10 | M376: =K376*6+L376 -> 82 | O376: 14 | P376: 12 | Q376: =O376*6+P376 -> 96 | S376: TURNER
A377: BEST PLAYERS
A378: COBURG | C378: ERWIN | F378: BRENNAN | I378: FEDLEY | L378: HOWELL | O378: HOBBS | R378: WATT
A379: WAVERLEY | C379: SMEDTZ | F379: HARRY | I379: STONE | L379: B ALLAN | O379: HOCKING | R379: OSBORNE
A380: GOALKICKERS
A381: COBURG | C381: BRENNAN 5 | F381: FEDLEY 4 | I381: FARMER 2 | L381: MARSH 2 | N381: HOWELL | P381: GALE | R381: MORRISON | U381: SULLIVAN | X381: HOBBS
A382: WAVERLEY | C382: B ALLAN 3 | F382: HANCOCK 3 | I382: HARRY 2 | K382: R ALLAN 2 | N382: HOARE 2 | Q382: STONE | S382: HASTINGS
A384: ROUND 9 | D384: 18TH JUNE | I384: WEATHER | L384: FOGGY | S384: PLAYED AT
D385: 1ST QTR | H385: 2ND QTR | L385: 3RD QTR | P385: FINAL | S385: TOORAK PARK
A386: SANDRINGHAM | C386: 4 | D386: 4 | E386: =C386*6+D386 -> 28 | G386: 7 | H386: 8 | I386: =G386*6+H386 -> 50 | K386: 13 | L386: 10 | M386: =K386*6+L386 -> 88 | O386: 19 | P386: 12 | Q386: =O386*6+P386 -> 126 | S386: UMPIRE | X386: LADDER | AB386: ROUND | AD386: 9
A387: PRAHRAN | C387: 3 | D387: 3 | E387: =C387*6+D387 -> 21 | G387: 8 | H387: 7 | I387: =G387*6+H387 -> 55 | K387: 11 | L387: 12 | M387: =K387*6+L387 -> 78 | O387: 15 | P387: 15 | Q387: =O387*6+P387 -> 105 | S387: TURNER
A388: BEST PLAYERS | W388: TEAM | X388: W | Y388: L | Z388: D | AA388: FOR | AB388: AGST | AC388: % | AD388: PTS
A389: SANDRINGHAM | C389: I COOPER | F389: CHISNALL | I389: CLARK | L389: SPURRELL | O389: MURPHY | R389: SARAU
A390: PRAHRAN | C390: CULPIN | F390: APPLETON | I390: PAYNE | L390: GRANGE | O390: THYNNE | R390: PIROUET | W390: OAKLEIGH | X390: 7 | Y390: 2 | Z390: 0 | AA390: 1179 | AB390: 937 | AC390: 125.83 | AD390: 28
A391: GOALKICKERS | W391: WILLIAMSTOWN | X391: 6 | Y391: 3 | Z391: 0 | AA391: 1010 | AB391: 877 | AC391: 115.17 | AD391: 24
A392: SANDRINGHAM | C392: COOPER 12 | F392: SAMPSON 3 | I392: CLARKE | K392: CHISNALL | M392: KENNEDY | O392: JONES | W392: DANDENONG | X392: 6 | Y392: 3 | Z392: 0 | AA392: 1015 | AB392: 905 | AC392: 112.15469613259668 | AD392: 24
A393: PRAHRAN | C393: PAYNE 6 | F393: APPLETON 3 | I393: CLARKE 3 | L393: CAFFYN | N393: PIROUET | P393: ARMSTRONG | W393: PRESTON | X393: 5 | Y393: 4 | Z393: 0 | AA393: 995 | AB393: 1028 | AC393: 96.79 | AD393: 20
A395: DANDENONG | C395: 6 | D395: 4 | E395: =C395*6+D395 -> 40 | G395: 11 | H395: 14 | I395: =G395*6+H395 -> 80 | K395: 17 | L395: 10 | M395: =K395*6+L395 -> 112 | O395: 26 | P395: 19 | Q395: =O395*6+P395 -> 175 | S395: DANDENONG | W395: SANDRINGHAM | X395: 5 | Y395: 4 | Z395: 0 | AA395: 975 | AB395: 1025 | AC395: 95.12 | AD395: 20
A396: WAVERLEY | C396: 3 | D396: 4 | E396: =C396*6+D396 -> 22 | G396: 9 | H396: 9 | I396: =G396*6+H396 -> 63 | K396: 9 | L396: 13 | M396: =K396*6+L396 -> 67 | O396: 12 | P396: 15 | Q396: =O396*6+P396 -> 87 | S396: HAYES | W396: PORT MELBOURNE | X396: 4 | Y396: 5 | Z396: 0 | AA396: 996 | AB396: 962 | AC396: 103.53430353430353 | AD396: 16
A397: BEST PLAYERS | W397: PRAHRAN | X397: 4 | Y397: 5 | Z397: 0 | AA397: 970 | AB397: 984 | AC397: 98.577235772357724 | AD397: 16
A398: DANDENONG | C398: BROWN | F398: SHINNERS | I398: EVANS | L398: WOOD | O398: KENDALL | R398: ORCHARD | W398: COBURG | X398: 4 | Y398: 5 | Z398: 0 | AA398: 929 | AB398: 946 | AC398: 98.202959830866803 | AD398: 16
A399: WAVERLEY | C399: SMEDTZ | F399: CRAIG | I399: OSBORNE | L399: MORDEN | O399: HANCOCK | R399: B ALLAN | W399: SUNSHINE | X399: 3 | Y399: 6 | Z399: 0 | AA399: 935 | AB399: 1015 | AC399: 92.118226600985224 | AD399: 12
A400: GOALKICKERS | Q400: EVANS | S400: FIELDER | W400: WAVERLEY | X400: 1 | Y400: 8 | Z400: 0 | AA400: 876 | AB400: 1201 | AC400: 72.939217318900916 | AD400: 4
A401: DANDENONG | C401: BROWN 7 | E401: MILLER 7 | G401: FLAHERTY 4 | J401: ORCHARD 2 | M401: DAVENPORT 2 | P401: KENDALL | R401: HIBBERT
A402: WAVERLEY | C402: HARRY 2 | E402: R ALLAN 2 | H402: B ALLAN 2 | J402: LAKE | L402: OSBORNE | N402: WILTSHIRE | Q402: HANCOCK | T402: HOARE | V402: HOCKING
E403: 25TH JUNE | J403: WEATHER | N403: NORTH WIND
A404: OAKLEIGH | C404: 3 | D404: 6 | E404: =C404*6+D404 -> 24 | G404: 8 | H404: 10 | I404: =G404*6+H404 -> 58 | K404: 14 | L404: 17 | M404: =K404*6+L404 -> 101 | O404: 23 | P404: 20 | Q404: =O404*6+P404 -> 158 | S404: OAKLEIGH
A405: WILLIAMSTOWN | C405: 3 | D405: 5 | E405: =C405*6+D405 -> 23 | G405: 8 | H405: 10 | I405: =G405*6+H405 -> 58 | K405: 15 | L405: 14 | M405: =K405*6+L405 -> 104 | O405: 17 | P405: 18 | Q405: =O405*6+P405 -> 120 | S405: McMASTER
A406: BEST PLAYERS
A407: OAKLEIGH | C407: ROBBINS | F407: TAYLOR | I407: J LILLEY | L407: P LILLEY | O407: JOHNSON | R407: FORD
A408: WILLIAMSTOWN | C408: JACKMAN | F408: THOMPSON | I408: MULLIGAN | L408: COLLINS | O408: STILLMAN | R408: HARVEY
A409: GOALKICKERS
A410: OAKLEIGH | C410: JOHNSON 6 | F410: ROBBINS 5 | I410: TAYLOR 3 | K410: MURNANE 2 | N410: WENN 2 | P410: J LILLEY 2 | R410: FORD | T410: FORSTER | W410: CARR
A411: WILLIAMSTOWN | C411: MULLIGAN 7 | F411: COLLINS 2 | I411: JACKMAN 2 | L411: NOBLE 2 | N411: L STILLMAN | Q411: PAPLEY | S411: DUNLOP | U411: HEMLEY
A413: COBURG | C413: 5 | D413: 10 | E413: =C413*6+D413 -> 40 | G413: 6 | H413: 12 | I413: =G413*6+H413 -> 48 | K413: 12 | L413: 18 | M413: =K413*6+L413 -> 90 | O413: 13 | P413: 20 | Q413: =O413*6+P413 -> 98 | S413: COBURG
A414: PORT MELBOURNE | C414: 1 | D414: 3 | E414: =C414*6+D414 -> 9 | G414: 5 | H414: 9 | I414: =G414*6+H414 -> 39 | K414: 6 | L414: 12 | M414: =K414*6+L414 -> 48 | O414: 11 | P414: 21 | Q414: =O414*6+P414 -> 87 | S414: STIRLING
A415: BEST PLAYERS
A416: COBURG | C416: ELVERY | F416: ERWIN | I416: PRICE | K416: HOBBS | N416: BRENNAN | Q416: WATT
A417: PORT MELBOURNE | C417: SWINSTEAD | F417: ANDERSON | I417: FRENCH | K417: SPARGO | N417: AANENSEN | Q417: RHEINBERGER
A418: GOALKICKERS
A419: COBURG | C419: BRENNAN 4 | F419: FEDLEY 4 | I419: MARSH 2 | L419: HOWELL | N419: GALE | P419: HOBBS
A420: PORT MELBOURNE | C420: SMITH 4 | F420: SPARGO 2 | I420: ANDERSON | L420: COLLINS | N420: HOLT | P420: FRENCH | R420: SWINSTEAD
A422: PRESTON | C422: 8 | D422: 1 | E422: =C422*6+D422 -> 49 | G422: 9 | H422: 6 | I422: =G422*6+H422 -> 60 | K422: 14 | L422: 8 | M422: =K422*6+L422 -> 92 | O422: 17 | P422: 9 | Q422: =O422*6+P422 -> 111 | S422: SUNSHINE
A423: SUNSHINE | C423: 4 | D423: 1 | E423: =C423*6+D423 -> 25 | G423: 5 | H423: 3 | I423: =G423*6+H423 -> 33 | K423: 14 | L423: 6 | M423: =K423*6+L423 -> 90 | O423: 16 | P423: 13 | Q423: =O423*6+P423 -> 109 | S423: GAMBETTA
A424: BEST PLAYERS
A425: PRESTON | C425: WEIGHTMAN | F425: SLATER | I425: MARTIN | L425: ZUNNEBERG | O425: HILL | Q425: ASHMEAD
A426: SUNSHINE | C426: LLOYD | F426: STONEHAM | I426: McKENZIE | L426: PRIOR | O426: WOODS | Q426: CRAWFORD
A427: GOALKICKERS
A428: PRESTON | C428: CLARK 5 | E428: BAIRD 3 | G428: ASHMEAD 2 | J428: WEIGHTMAN 2 | M428: IRELAND 2 | P428: ZUNNEBERG | S428: STANLEY | V428: SLATER
A429: SUNSHINE | C429: STONEHAM 5 | F429: McKENZIE 4 | I429: LLOYD 3 | K429: CLIFFORD 2 | N429: CRAWFORD
A431: ROUND 10 | E431: 2ND JULY | J431: WEATHER | N431: FINE | S431: PLAYED AT
D432: 1ST QTR | H432: 2ND QTR | L432: 3RD QTR | P432: FINAL | S432: PRESTON
A433: PRESTON | C433: 4 | D433: 1 | E433: =C433*6+D433 -> 25 | G433: 11 | H433: 3 | I433: =G433*6+H433 -> 69 | K433: 13 | L433: 6 | M433: =K433*6+L433 -> 84 | O433: 21 | P433: 9 | Q433: =O433*6+P433 -> 135 | S433: UMPIRE | X433: LADDER | AB433: ROUND | AD433: 10
A434: DANDENONG | C434: 2 | D434: 6 | E434: =C434*6+D434 -> 18 | G434: 4 | H434: 11 | I434: =G434*6+H434 -> 35 | K434: 6 | L434: 16 | M434: =K434*6+L434 -> 52 | O434: 9 | P434: 22 | Q434: =O434*6+P434 -> 76 | S434: McBAIN
A435: BEST PLAYERS | W435: TEAM | X435: W | Y435: L | Z435: D | AA435: FOR | AB435: AGST | AC435: % | AD435: PTS
A436: PRESTON | C436: ZUNNEBERG | F436: WEIGHTMAN | I436: HILL | L436: BENNISON | O436: ASHMEAD | R436: MARTIN
A437: DANDENONG | C437: HIBBERT | F437: ORCHARD | I437: DAVENPORT | L437: EVANS | O437: SHINNERS | R437: KENNEDY | W437: OAKLEIGH | X437: 8 | Y437: 2 | Z437: 0 | AA437: 1296 | AB437: 1025 | AC437: 126.44 | AD437: 32
A438: GOALKICKERS | Q438: SLATER | W438: WILLIAMSTOWN | X438: 7 | Y438: 3 | Z438: 0 | AA438: 1132 | AB438: 971 | AC438: 116.58 | AD438: 28
A439: PRESTON | C439: CLARK 6 | F439: ASHMEAD 4 | I439: STANLEY 4 | L439: ZUNNEBERG 3 | O439: McMAHON | Q439: TELFORD | S439: WEIGHTMAN | W439: DANDENONG | X439: 6 | Y439: 4 | Z439: 0 | AA439: 1091 | AB439: 1040 | AC439: 104.90384615384616 | AD439: 24
A440: DANDENONG | C440: KENNEDY 3 | F440: FLAHERTY | I440: BROWN | K440: HIBBERT | M440: MILLER | O440: DAVENPORT | R440: SMITH | W440: PRESTON | X440: 6 | Y440: 4 | Z440: 0 | AA440: 1130 | AB440: 1104 | AC440: 102.36 | AD440: 24
A442: PORT MELBOURNE | C442: 3 | D442: 2 | E442: =C442*6+D442 -> 20 | G442: 5 | H442: 12 | I442: =G442*6+H442 -> 42 | K442: 10 | L442: 17 | M442: =K442*6+L442 -> 77 | O442: 13 | P442: 23 | Q442: =O442*6+P442 -> 101 | S442: PORT MELBOURNE | W442: PORT MELBOURNE | X442: 5 | Y442: 5 | Z442: 0 | AA442: 1097 | AB442: 1053 | AC442: 104.17853751187084 | AD442: 20
A443: SANDRINGHAM | C443: 4 | D443: 6 | E443: =C443*6+D443 -> 30 | G443: 7 | H443: 7 | I443: =G443*6+H443 -> 49 | K443: 12 | L443: 11 | M443: =K443*6+L443 -> 83 | O443: 13 | P443: 13 | Q443: =O443*6+P443 -> 91 | S443: ANDERSON | W443: SANDRINGHAM | X443: 5 | Y443: 5 | Z443: 0 | AA443: 1066 | AB443: 1126 | AC443: 94.67 | AD443: 20
A444: BEST PLAYERS | W444: PRAHRAN | X444: 4 | Y444: 6 | Z444: 0 | AA444: 1058 | AB444: 1101 | AC444: 96.094459582197999 | AD444: 16
A445: PORT MELBOURNE | C445: M ALLEN | F445: ANDERSON | I445: SWINSTEAD | L445: FRENCH | O445: HOLT | R445: RHEINBERGER | W445: COBURG | X445: 4 | Y445: 6 | Z445: 0 | AA445: 1023 | AB445: 1068 | AC445: 95.786516853932582 | AD445: 16
A446: SANDRINGHAM | C446: SARAU | F446: SCHOLES | I446: JONES | L446: SPURRELL | O446: LIPSCOMBE | R446: KENNEDY | W446: SUNSHINE | X446: 3 | Y446: 7 | Z446: 0 | AA446: 1027 | AB446: 1124 | AC446: 91.370106761565836 | AD446: 12
A447: GOALKICKERS | W447: WAVERLEY | X447: 2 | Y447: 8 | Z447: 0 | AA447: 985 | AB447: 1293 | AC447: 76.17942768754834 | AD447: 8
A448: PORT MELBOURNE | C448: SMITH 5 | F448: ANDERSON 3 | I448: HOLT 2 | K448: AANENSEN 2 | N448: FRENCH
A449: SANDRINGHAM | C449: COOPER 4 | F449: SCHOLES 2 | I449: MURPHY 2 | L449: LIPSCOMBE 2 | O449: SARAU | Q449: KENNEDY | S449: JONES
A451: WAVERLEY | C451: 2 | D451: 3 | E451: =C451*6+D451 -> 15 | G451: 10 | H451: 8 | I451: =G451*6+H451 -> 68 | K451: 13 | L451: 17 | M451: =K451*6+L451 -> 95 | O451: 15 | P451: 19 | Q451: =O451*6+P451 -> 109 | S451: WAVERLEY
A452: SUNSHINE | C452: 3 | D452: 1 | E452: =C452*6+D452 -> 19 | G452: 6 | H452: 2 | I452: =G452*6+H452 -> 38 | K452: 9 | L452: 5 | M452: =K452*6+L452 -> 59 | O452: 14 | P452: 8 | Q452: =O452*6+P452 -> 92 | S452: ABBOTT
A453: BEST PLAYERS
A454: WAVERLEY | C454: HARRY | F454: CRAIG | I454: COPPA | L454: R ALLAN | O454: OWENS | Q454: LUMLEY
A455: SUNSHINE | C455: McKENZIE | F455: CRAWFORD | I455: WOODS | L455: DE ARAUGO | O455: PRIOR | Q455: PAYNE
A456: GOALKICKERS
A457: WAVERLEY | C457: R ALLAN 6 | F457: OWENS 2 | I457: B ALLAN 2 | L457: HARRY | N457: STONE | P457: PARKES | R457: WILTSHIRE | U457: LUMLEY
A458: SUNSHINE | C458: NICHOLSON 6 | F458: CRAWFORD 3 | I458: LLOYD 2 | K458: G SLADDIN | N458: PAYNE | P458: BENSON
A460: OAKLEIGH | C460: 3 | D460: 3 | E460: =C460*6+D460 -> 21 | G460: 5 | H460: 7 | I460: =G460*6+H460 -> 37 | K460: 9 | L460: 13 | M460: =K460*6+L460 -> 67 | O460: 17 | P460: 15 | Q460: =O460*6+P460 -> 117 | S460: TOORAK PARK
A461: PRAHRAN | C461: 1 | D461: 4 | E461: =C461*6+D461 -> 10 | G461: 5 | H461: 11 | I461: =G461*6+H461 -> 41 | K461: 7 | L461: 17 | M461: =K461*6+L461 -> 59 | O461: 11 | P461: 22 | Q461: =O461*6+P461 -> 88 | S461: GAMBETTA
A462: BEST PLAYERS
A463: OAKLEIGH | C463: MURNANE | F463: FORSTER | I463: FORD | L463: CARR | O463: TAYLOR | R463: CHISHOLM
A464: PRAHRAN | C464: CLARKE | F464: PIROUET | I464: HUTCHESSON | L464: CULPIN | O464: EMSELLE | R464: APPLETON
A465: GOALKICKERS
A466: OAKLEIGH | C466: MURNANE 5 | F466: CARR 4 | I466: ROBBINS 3 | L466: TAYLOR 3 | O466: FORD
A467: PRAHRAN | C467: CLARKE 7 | F467: APPLETON | I467: O'BRIEN | K467: PAYNE | M467: LANGDON
A469: WILLIAMSTOWN | C469: 3 | D469: 4 | E469: =C469*6+D469 -> 22 | G469: 11 | H469: 11 | I469: =G469*6+H469 -> 77 | K469: 13 | L469: 13 | M469: =K469*6+L469 -> 91 | O469: 17 | P469: 20 | Q469: =O469*6+P469 -> 122 | S469: WILLIAMSTOWN
A470: COBURG | C470: 4 | D470: 6 | E470: =C470*6+D470 -> 30 | G470: 5 | H470: 6 | I470: =G470*6+H470 -> 36 | K470: 11 | L470: 13 | M470: =K470*6+L470 -> 79 | O470: 13 | P470: 16 | Q470: =O470*6+P470 -> 94 | S470: FLANAGAN
A471: BEST PLAYERS
A472: WILLIAMSTOWN | C472: THOMPSON | F472: JACKMAN | I472: PAPLEY | L472: PERCY | O472: SVORINICH | R472: HEMLEY
A473: COBURG | C473: MARSH | F473: HOBBS | I473: WATT | L473: BRENNAN | O473: PRICE | R473: FEDLEY
A474: GOALKICKERS
A475: WILLIAMSTOWN | C475: PAPLEY 5 | F475: SVORINICH 4 | I475: MULLIGAN 2 | L475: L STILLMAN 2 | O475: EGAN | Q475: JACKMAN | S475: HEMLEY | U475: PERCY
A476: COBURG | C476: FEDLEY 3 | F476: MARSH 3 | I476: BRENNAN 2 | L476: FARMER 2 | O476: WATT
A478: ROUND 11 | E478: 9TH JULY | J478: WEATHER | N478: FINE | S478: PLAYED AT
D479: 1ST QTR | H479: 2ND QTR | L479: 3RD QTR | P479: FINAL | S479: BEACH ROAD
A480: WILLIAMSTOWN | C480: 1 | D480: 1 | E480: =C480*6+D480 -> 7 | G480: 10 | H480: 9 | I480: =G480*6+H480 -> 69 | K480: 10 | L480: 15 | M480: =K480*6+L480 -> 75 | O480: 15 | P480: 24 | Q480: =O480*6+P480 -> 114 | S480: UMPIRE | X480: LADDER | AB480: ROUND | AD480: 11
A481: SANDRINGHAM | C481: 8 | D481: 3 | E481: =C481*6+D481 -> 51 | G481: 8 | H481: 6 | I481: =G481*6+H481 -> 54 | K481: 12 | L481: 8 | M481: =K481*6+L481 -> 80 | O481: 15 | P481: 8 | Q481: =O481*6+P481 -> 98 | S481: TURNER
A482: BEST PLAYERS | W482: TEAM | X482: W | Y482: L | Z482: D | AA482: FOR | AB482: AGST | AC482: % | AD482: PTS
A483: WILLIAMSTOWN | C483: THOMPSON | F483: L STILLMAN | I483: SVORINICH | L483: MULLIGAN | O483: FANNING | R483: BOXALL
A484: SANDRINGHAM | C484: BROWNE | F484: SARAU | I484: KENNEDY | L484: TOMS | O484: SAMPSON | R484: DAVEY | W484: OAKLEIGH | X484: 9 | Y484: 2 | Z484: 0 | AA484: 1412 | AB484: 1101 | AC484: 128.25 | AD484: 36
A485: GOALKICKERS | W485: WILLIAMSTOWN | X485: 8 | Y485: 3 | Z485: 0 | AA485: 1246 | AB485: 1069 | AC485: 116.56 | AD485: 32
A486: WILLIAMSTOWN | C486: SVORINICH 5 | F486: MULLIGAN 5 | I486: FANNING 2 | L486: COLLINS | N486: JACKMAN | Q486: BASTIAN | W486: DANDENONG | X486: 7 | Y486: 4 | Z486: 0 | AA486: 1189 | AB486: 1132 | AC486: 105.03533568904594 | AD486: 28
A487: SANDRINGHAM | C487: COOPER 6 | F487: HESLOP 2 | I487: KENNEDY 2 | L487: STEVENS 2 | N487: SCHOLES | Q487: SAMPSON | S487: LIPSCOMBE | W487: PRESTON | X487: 7 | Y487: 4 | Z487: 0 | AA487: 1221 | AB487: 1192 | AC487: 102.43 | AD487: 28
A489: DANDENONG | C489: 2 | D489: 0 | E489: =C489*6+D489 -> 12 | G489: 6 | H489: 5 | I489: =G489*6+H489 -> 41 | K489: 8 | L489: 9 | M489: =K489*6+L489 -> 57 | O489: 14 | P489: 14 | Q489: =O489*6+P489 -> 98 | S489: DANDENONG | W489: PORT MELBOURNE | X489: 5 | Y489: 6 | Z489: 0 | AA489: 1196 | AB489: 1164 | AC489: 102.74914089347079 | AD489: 20
A490: PRAHRAN | C490: 4 | D490: 8 | E490: =C490*6+D490 -> 32 | G490: 5 | H490: 10 | I490: =G490*6+H490 -> 40 | K490: 11 | L490: 14 | M490: =K490*6+L490 -> 80 | O490: 13 | P490: 14 | Q490: =O490*6+P490 -> 92 | S490: CRAIG | W490: SANDRINGHAM | X490: 5 | Y490: 6 | Z490: 0 | AA490: 1164 | AB490: 1240 | AC490: 93.87 | AD490: 20
A491: BEST PLAYERS | W491: PRAHRAN | X491: 4 | Y491: 7 | Z491: 0 | AA491: 1150 | AB491: 1199 | AC491: 95.91 | AD491: 16
A492: DANDENONG | C492: HIBBERT | F492: DAVIES | I492: KENNEDY | L492: KENDALL | O492: HARRINGTON | R492: SHINNERS | W492: COBURG | X492: 4 | Y492: 7 | Z492: 0 | AA492: 1111 | AB492: 1159 | AC492: 95.86 | AD492: 16
A493: PRAHRAN | C493: LANGDON | F493: CULPIN | I493: GRANGE | L493: O'BRIEN | O493: KELLY | R493: ROSE | W493: SUNSHINE | X493: 4 | Y493: 7 | Z493: 0 | AA493: 1138 | AB493: 1223 | AC493: 93.05 | AD493: 16
A494: GOALKICKERS | W494: WAVERLEY | X494: 2 | Y494: 9 | Z494: 0 | AA494: 1061 | AB494: 1409 | AC494: 75.3 | AD494: 8
A495: DANDENONG | C495: ELLIS 3 | E495: KENDALL 2 | H495: HIBBERT 2 | J495: ORCHARD 2 | M495: KENNEDY 2 | P495: MILLER | R495: SOUTHERN | U495: EVANS
A496: PRAHRAN | C496: CLARKE 4 | F496: KELLY 4 | I496: APPLETON | K496: ROSE | M496: O'BRIEN | O496: PAYNE | Q496: LANGDON
A498: PRESTON | C498: 4 | D498: 6 | E498: =C498*6+D498 -> 30 | G498: 5 | H498: 8 | I498: =G498*6+H498 -> 38 | K498: 12 | L498: 10 | M498: =K498*6+L498 -> 82 | O498: 13 | P498: 13 | Q498: =O498*6+P498 -> 91 | S498: COBURG
A499: COBURG | C499: 1 | D499: 3 | E499: =C499*6+D499 -> 9 | G499: 3 | H499: 12 | I499: =G499*6+H499 -> 30 | K499: 6 | L499: 15 | M499: =K499*6+L499 -> 51 | O499: 11 | P499: 22 | Q499: =O499*6+P499 -> 88 | S499: HAYES
A500: BEST PLAYERS
A501: PRESTON | C501: McMAHON | F501: ASHMEAD | I501: TELFORD | L501: LESLIE | O501: BENNISON | R501: SLATER
A502: COBURG | C502: HOBBS | F502: MARSH | I502: BRENNAN | L502: MORRISON | O502: WATT | R502: SULLIVAN
A503: GOALKICKERS
A504: PRESTON | C504: CLARK 3 | F504: ZUNNEBERG 3 | I504: McMAHON 2 | L504: ASHMEAD | N504: WEIGHTMAN | Q504: BAIRD | S504: STANLEY | V504: SLATER
A505: COBURG | C505: FARMER 2 | F505: MARSH 2 | I505: SULLIVAN 2 | L505: BRENNAN | N505: FEDLEY | P505: MORRISON | S505: HOBBS | V505: ROBINSON
A507: SUNSHINE | C507: 2 | D507: 2 | E507: =C507*6+D507 -> 14 | G507: 6 | H507: 6 | I507: =G507*6+H507 -> 42 | K507: 10 | L507: 7 | M507: =K507*6+L507 -> 67 | O507: 17 | P507: 9 | Q507: =O507*6+P507 -> 111 | S507: SUNSHINE
A508: PORT MELBOURNE | C508: 3 | D508: 4 | E508: =C508*6+D508 -> 22 | G508: 9 | H508: 6 | I508: =G508*6+H508 -> 60 | K508: 13 | L508: 13 | M508: =K508*6+L508 -> 91 | O508: 14 | P508: 15 | Q508: =O508*6+P508 -> 99 | S508: McMASTER
A509: BEST PLAYERS
A510: SUNSHINE | C510: WOODS | F510: LLOYD | I510: CRAWFORD | L510: WAGLAND | O510: RUSSELL | R510: HALL
A511: PORT MELBOURNE | C511: SKILTON | F511: HOLT | I511: MALLETT | L511: ANDERSON | O511: SWINSTEAD | R511: HARLAND
A512: GOALKICKERS
A513: SUNSHINE | C513: RUSSELL 7 | F513: WAGLAND 2 | I513: LLOYD 2 | K513: NEISH 2 | M513: G SLADDIN | P513: PAYNE | R513: McKENZIE | U513: BENSON
A514: PORT MELBOURNE | C514: SKILTON 4 | F514: HOLT 4 | H514: HARLAND 2 | K514: BUCKLEY | M514: ANDERSON | P514: SPARGO | R514: AANENSEN
A516: OAKLEIGH | C516: 3 | D516: 3 | E516: =C516*6+D516 -> 21 | G516: 8 | H516: 7 | I516: =G516*6+H516 -> 55 | K516: 11 | L516: 9 | M516: =K516*6+L516 -> 75 | O516: 17 | P516: 14 | Q516: =O516*6+P516 -> 116 | S516: OAKLEIGH
A517: WAVERLEY | C517: 4 | D517: 4 | E517: =C517*6+D517 -> 28 | G517: 7 | H517: 4 | I517: =G517*6+H517 -> 46 | K517: 8 | L517: 8 | M517: =K517*6+L517 -> 56 | O517: 11 | P517: 10 | Q517: =O517*6+P517 -> 76 | S517: CARLILE
A518: BEST PLAYERS
A519: OAKLEIGH | C519: FORD | F519: TAYLOR | I519: P LILLEY | L519: CARR | O519: FRYER | Q519: CHISHOLM
A520: WAVERLEY | C520: FERGUSON | F520: GOSPER | I520: PARKES | L520: CRAIG | O520: IVEY | Q520: HARRY
A521: GOALKICKERS
A522: OAKLEIGH | C522: CARR 7 | F522: ROBBINS 3 | I522: FORD 3 | K522: COLCOTT 2 | N522: TAYLOR | P522: BARROTT | R522: HOWELL
A523: WAVERLEY | C523: STONE 2 | F523: R ALLAN 2 | I523: PARKES 2 | K523: LUMLEY 2 | N523: OSBORNE | P523: B ALLAN | R523: HOARE
A525: ROUND 12 | E525: 16TH JULY | J525: WEATHER | N525: FINE | S525: PLAYED AT
D526: 1ST QTR | H526: 2ND QTR | L526: 3RD QTR | P526: FINAL | S526: PRESTON
A527: PRESTON | C527: 5 | D527: 3 | E527: =C527*6+D527 -> 33 | G527: 8 | H527: 5 | I527: =G527*6+H527 -> 53 | K527: 13 | L527: 8 | M527: =K527*6+L527 -> 86 | O527: 17 | P527: 10 | Q527: =O527*6+P527 -> 112 | S527: UMPIRE | X527: LADDER | AB527: ROUND | AD527: 12
A528: OAKLEIGH | C528: 2 | D528: 3 | E528: =C528*6+D528 -> 15 | G528: 3 | H528: 9 | I528: =G528*6+H528 -> 27 | K528: 9 | L528: 13 | M528: =K528*6+L528 -> 67 | O528: 10 | P528: 21 | Q528: =O528*6+P528 -> 81 | S528: FLANAGAN
A529: BEST PLAYERS | W529: TEAM | X529: W | Y529: L | Z529: D | AA529: FOR | AB529: AGST | AC529: % | AD529: PTS
A530: PRESTON | C530: ASHMEAD | F530: TELFORD | I530: LESLIE | L530: SCHICKERT | O530: CLARK | Q530: HILL
A531: OAKLEIGH | C531: MUNANE | F531: FORD | I531: WENN | L531: FORSTER | O531: COLCOTT | Q531: ROBBINS | W531: OAKLEIGH | X531: 9 | Y531: 3 | Z531: 0 | AA531: 1493 | AB531: 1213 | AC531: 123.08 | AD531: 36
A532: GOALKICKERS | W532: WILLIAMSTOWN | X532: 8 | Y532: 4 | Z532: 0 | AA532: 1320 | AB532: 1156 | AC532: 114.19 | AD532: 32
A533: PRESTON | C533: CLARK 8 | F533: McMAHON 3 | I533: MAHONEY 2 | L533: ASHMEAD | N533: WEIGHTMAN | Q533: DRYSDALE | S533: IRELAND | W533: DANDENONG | X533: 8 | Y533: 4 | Z533: 0 | AA533: 1309 | AB533: 1245 | AC533: 105.14056224899599 | AD533: 32
A534: OAKLEIGH | C534: MURNANE 4 | F534: ROBBINS 2 | I534: COLCOTT | K534: WENN | M534: FORSTER | O534: CARR | W534: PRESTON | X534: 8 | Y534: 4 | Z534: 0 | AA534: 1333 | AB534: 1273 | AC534: 104.71 | AD534: 32
A536: PORT MELBOURNE | C536: 8 | D536: 3 | E536: =C536*6+D536 -> 51 | G536: 17 | H536: 7 | I536: =G536*6+H536 -> 109 | K536: 21 | L536: 12 | M536: =K536*6+L536 -> 138 | O536: 27 | P536: 19 | Q536: =O536*6+P536 -> 181 | S536: PORT MELBOURNE | W536: PORT MELBOURNE | X536: 6 | Y536: 6 | Z536: 0 | AA536: 1377 | AB536: 1257 | AC536: 109.54653937947494 | AD536: 24
A537: PRAHRAN | C537: 5 | D537: 7 | E537: =C537*6+D537 -> 37 | G537: 7 | H537: 11 | I537: =G537*6+H537 -> 53 | K537: 9 | L537: 18 | M537: =K537*6+L537 -> 72 | O537: 12 | P537: 21 | Q537: =O537*6+P537 -> 93 | S537: HAYES | W537: COBURG | X537: 5 | Y537: 7 | Z537: 0 | AA537: 1247 | AB537: 1271 | AC537: 98.111723052714396 | AD537: 20
A538: BEST PLAYERS | W538: SANDRINGHAM | X538: 5 | Y538: 7 | Z538: 0 | AA538: 1276 | AB538: 1376 | AC538: 92.73 | AD538: 20
A539: PORT MELBOURNE | C539: SKILTON | F539: SWINSTEAD | I539: AANENSEN | L539: HOLT | O539: SMITH | R539: SPARGO | W539: SUNSHINE | X539: 4 | Y539: 8 | Z539: 0 | AA539: 1251 | AB539: 1343 | AC539: 93.14966492926284 | AD539: 16
A540: PRAHRAN | C540: APPLETON | F540: EMSELLE | I540: KELLY | L540: GRANGE | O540: LANGDON | R540: CULPIN | W540: PRAHRAN | X540: 4 | Y540: 8 | Z540: 0 | AA540: 1243 | AB540: 1380 | AC540: 90.072463768115938 | AD540: 16
A541: GOALKICKERS | R541: SWINSTEAD | W541: WAVERLEY | X541: 3 | Y541: 9 | Z541: 0 | AA541: 1148 | AB541: 1483 | AC541: 77.410654079568445 | AD541: 12
A542: PORT MELBOURNE | C542: SMITH 10 | F542: HOLT 5 | H542: PASQUILL 3 | K542: AANENSEN 3 | N542: HUDSON 2 | Q542: SPARGO 2 | S542: HARLAND
A543: PRAHRAN | C543: KELLY 4 | F543: APPLETON 3 | I543: PIROUET 2 | L543: PAYNE | N543: JOHNSON | P543: LANGDON
A545: COBURG | C545: 8 | D545: 2 | E545: =C545*6+D545 -> 50 | G545: 13 | H545: 4 | I545: =G545*6+H545 -> 82 | K545: 19 | L545: 6 | M545: =K545*6+L545 -> 120 | O545: 21 | P545: 10 | Q545: =O545*6+P545 -> 136 | S545: COBURG
A546: SANDRINGHAM | C546: 4 | D546: 1 | E546: =C546*6+D546 -> 25 | G546: 8 | H546: 4 | I546: =G546*6+H546 -> 52 | K546: 11 | L546: 8 | M546: =K546*6+L546 -> 74 | O546: 17 | P546: 10 | Q546: =O546*6+P546 -> 112 | S546: GAMBETTA
A547: BEST PLAYERS
A548: COBURG | C548: FARMER | F548: MARSH | I548: HOBBS | L548: SULLIVAN | O548: PAUL | R548: HOGAN
A549: SANDRINGHAM | C549: JONES | F549: BROWNE | I549: SARAU | L549: EVANS | O549: SPURRELL | R549: DAVEY
A550: GOALKICKERS
A551: COBURG | C551: FARMER 11 | F551: BRENNAN 2 | I551: FEDLEY 2 | K551: McCARTHY 2 | N551: WATT 2 | P551: MORRISON | S551: PAUL
A552: SANDRINGHAM | C552: EVANS 4 | F552: COOPER 3 | I552: JONES 3 | K552: HESLOP 2 | N552: AUBREY 2 | Q552: SAMPSON | S552: CHISNALL | V552: KENNEDY
A554: DANDENONG | C554: 4 | D554: 3 | E554: =C554*6+D554 -> 27 | G554: 6 | H554: 9 | I554: =G554*6+H554 -> 45 | K554: 11 | L554: 13 | M554: =K554*6+L554 -> 79 | O554: 17 | P554: 18 | Q554: =O554*6+P554 -> 120 | S554: DANDENONG
A555: SUNSHINE | C555: 4 | D555: 4 | E555: =C555*6+D555 -> 28 | G555: 9 | H555: 8 | I555: =G555*6+H555 -> 62 | K555: 13 | L555: 13 | M555: =K555*6+L555 -> 91 | O555: 16 | P555: 17 | Q555: =O555*6+P555 -> 113 | S555: STIRLING
A556: BEST PLAYERS
A557: DANDENONG | C557: KENDALL | F557: ELLIS | I557: MATTHEWS | L557: REID | O557: HARRINGTON | R557: HIBBERT
A558: SUNSHINE | C558: GLAVICI | F558: CRAWFORD | I558: BENSON | L558: WAGLAND | O558: PAYNE | R558: G SLADDIN
A559: GOALKICKERS
A560: DANDENONG | C560: ELLIS 5 | F560: BROWN 3 | I560: REID 3 | K560: KENNEDY 2 | N560: HARRINGTON 2 | R560: HIBBERT | U560: DAVENPORT
A561: SUNSHINE | C561: RUSSELL 4 | F561: PAYNE 3 | I561: BENSON 3 | K561: GLAVICI 3 | M561: WAGLAND | O561: CRAWFORD | R561: LLOYD
A563: WAVERLEY | C563: 3 | D563: 3 | E563: =C563*6+D563 -> 21 | G563: 6 | H563: 6 | I563: =G563*6+H563 -> 42 | K563: 11 | L563: 11 | M563: =K563*6+L563 -> 77 | O563: 12 | P563: 15 | Q563: =O563*6+P563 -> 87 | S563: WAVERLEY
A564: WILLIAMSTOWN | C564: 2 | D564: 8 | E564: =C564*6+D564 -> 20 | G564: 6 | H564: 16 | I564: =G564*6+H564 -> 52 | K564: 7 | L564: 17 | M564: =K564*6+L564 -> 59 | O564: 9 | P564: 20 | Q564: =O564*6+P564 -> 74 | S564: McMASTER
A565: BEST PLAYERS
A566: WAVERLEY | C566: FERGUSON | F566: STONE | I566: PITTS | K566: HARRY | N566: LUMLEY | Q566: LAKE
A567: WILLIAMSTOWN | C567: PERCY | F567: MULLIGAN | I567: BOXALL | K567: DUNLOP | N567: L STILLMAN | Q567: THOMPSON
A568: GOALKICKERS
A569: WAVERLEY | C569: R ALLAN 3 | F569: PITTS 3 | I569: HARRY 2 | K569: LUMLEY 2 | N569: STONE | P569: OSBORNE
A570: WILLIAMSTOWN | C570: MULLIGAN 4 | F570: HEMLEY 2 | I570: COLLINS | K570: PERCY | M570: BASTIAN
A572: ROUND 13 | E572: 23RD JULY | J572: WEATHER | N572: FINE | S572: PLAYED AT
D573: 1ST QTR | H573: 2ND QTR | L573: 3RD QTR | P573: FINAL | S573: OAKLEIGH
A574: OAKLEIGH | C574: 8 | D574: 2 | E574: =C574*6+D574 -> 50 | G574: 13 | H574: 3 | I574: =G574*6+H574 -> 81 | K574: 18 | L574: 6 | M574: =K574*6+L574 -> 114 | O574: 24 | P574: 11 | Q574: =O574*6+P574 -> 155 | S574: UMPIRE | X574: LADDER | AB574: ROUND | AD574: 13
A575: DANDENONG | C575: 2 | D575: 6 | E575: =C575*6+D575 -> 18 | G575: 6 | H575: 8 | I575: =G575*6+H575 -> 44 | K575: 10 | L575: 10 | M575: =K575*6+L575 -> 70 | O575: 13 | P575: 13 | Q575: =O575*6+P575 -> 91 | S575: McMASTER
A576: BEST PLAYERS | W576: TEAM | X576: W | Y576: L | Z576: D | AA576: FOR | AB576: AGST | AC576: % | AD576: PTS
A577: OAKLEIGH | C577: FORD | F577: P LILLEY | I577: ROBBINS | L577: WENN | O577: TAYLOR | R577: FRYER
A578: DANDENONG | C578: KENDALL | F578: DAVIES | I578: MILLER | L578: REID | O578: HIBBERT | W578: OAKLEIGH | X578: 10 | Y578: 3 | Z578: 0 | AA578: 1648 | AB578: 1304 | AC578: 126.38 | AD578: 40
A579: GOALKICKERS | P579: TAYLOR | R579: WENN | T579: CARR | W579: PRESTON | X579: 9 | Y579: 4 | Z579: 0 | AA579: 1445 | AB579: 1373 | AC579: 105.24 | AD579: 36
A580: OAKLEIGH | C580: JOHNSON 6 | F580: ROBBINS 5 | I580: MURNANE 3 | L580: COLCOTT 2 | N580: BARROTT 2 | Q580: FORSTER 2 | T580: FORD | W580: WILLIAMSTOWN | X580: 8 | Y580: 5 | Z580: 0 | AA580: 1414 | AB580: 1257 | AC580: 112.49 | AD580: 32
A581: DANDENONG | C581: MILLER 7 | F581: BROWN 3 | I581: ELLIS 2 | K581: ORCHARD | W581: DANDENONG | X581: 8 | Y581: 5 | Z581: 0 | AA581: 1400 | AB581: 1400 | AC581: 100 | AD581: 32
A583: PORT MELBOURNE | C583: 3 | D583: 5 | E583: =C583*6+D583 -> 23 | G583: 6 | H583: 9 | I583: =G583*6+H583 -> 45 | K583: 8 | L583: 11 | M583: =K583*6+L583 -> 59 | O583: 14 | P583: 17 | Q583: =O583*6+P583 -> 101 | S583: WILLIAMSTOWN | W583: PORT MELBOURNE | X583: 7 | Y583: 6 | Z583: 0 | AA583: 1478 | AB583: 1351 | AC583: 109.40044411547002 | AD583: 28
A584: WILLIAMSTOWN | C584: 5 | D584: 5 | E584: =C584*6+D584 -> 35 | G584: 7 | H584: 7 | I584: =G584*6+H584 -> 49 | K584: 12 | L584: 10 | M584: =K584*6+L584 -> 82 | O584: 13 | P584: 16 | Q584: =O584*6+P584 -> 94 | S584: STIRLING | W584: SANDRINGHAM | X584: 6 | Y584: 7 | Z584: 0 | AA584: 1405 | AB584: 1452 | AC584: 96.76 | AD584: 24
A585: BEST PLAYERS | W585: SUNSHINE | X585: 5 | Y585: 8 | Z585: 0 | AA585: 1396 | AB585: 1413 | AC585: 98.796886058032555 | AD585: 20
A586: PORT MELBOURNE | C586: SWINSTEAD | F586: ANDERSON | I586: AANENSEN | L586: SKILTON | N586: MALLETT | Q586: HUDSON | W586: COBURG | X586: 5 | Y586: 8 | Z586: 0 | AA586: 1317 | AB586: 1416 | AC586: 93.008474576271183 | AD586: 20
A587: WILLIAMSTOWN | C587: PERCY | F587: EGAN | I587: JACKMAN | L587: HARVEY | N587: THOMPSON | Q587: L STILLMAN | W587: PRAHRAN | X587: 4 | Y587: 9 | Z587: 0 | AA587: 1343 | AB587: 1492 | AC587: 90.013404825737268 | AD587: 16
A588: GOALKICKERS | W588: WAVERLEY | X588: 3 | Y588: 10 | Z588: 0 | AA588: 1224 | AB588: 1612 | AC588: 75.930521091811414 | AD588: 12
A589: PORT MELBOURNE | C589: SMITH 5 | F589: ANDERSON 2 | I589: HOLT 2 | K589: CARLON 2 | N589: HUDSON | P589: PASQUILL | R589: SWINSTEAD
A590: WILLIAMSTOWN | C590: MULLIGAN 3 | F590: JACKMAN 3 | I590: BASTIAN 2 | L590: JONIEC 2 | N590: EGAN | P590: L STILLMAN
A592: SUNSHINE | C592: 8 | D592: 3 | E592: =C592*6+D592 -> 51 | G592: 11 | H592: 6 | I592: =G592*6+H592 -> 72 | K592: 16 | L592: 10 | M592: =K592*6+L592 -> 106 | O592: 22 | P592: 13 | Q592: =O592*6+P592 -> 145 | S592: SUNSHINE
A593: COBURG | C593: 4 | D593: 4 | E593: =C593*6+D593 -> 28 | G593: 6 | H593: 8 | I593: =G593*6+H593 -> 44 | K593: 7 | L593: 11 | M593: =K593*6+L593 -> 53 | O593: 9 | P593: 16 | Q593: =O593*6+P593 -> 70 | S593: CARLILE
A594: BEST PLAYERS
A595: SUNSHINE | C595: CRAWFORD | F595: GLAVICI | I595: PRIOR | K595: McKENZIE | N595: RUSSELL | Q595: WAGLAND
A596: COBURG | C596: SULLIVAN | F596: ELVERY | I596: ERWIN | K596: MARSH | N596: FARMER | Q596: PAUL
A597: GOALKICKERS
A598: SUNSHINE | C598: RUSSELL 6 | F598: GLAVICI 5 | I598: WAGLAND 3 | L598: McKENZIE 3 | O598: G SLADDIN 2 | R598: PAYNE | T598: CRAWFORD | W598: BENSON
A599: COBURG | C599: FARMER 4 | F599: MURPHY 2 | I599: FEDLEY | K599: ERWIN | M599: SULLIVAN
A601: SANDRINGHAM | C601: 6 | D601: 6 | E601: =C601*6+D601 -> 42 | G601: 14 | H601: 10 | I601: =G601*6+H601 -> 94 | K601: 14 | L601: 15 | M601: =K601*6+L601 -> 99 | O601: 18 | P601: 21 | Q601: =O601*6+P601 -> 129 | S601: BEACH ROAD
A602: WAVERLEY | C602: 3 | D602: 4 | E602: =C602*6+D602 -> 22 | G602: 5 | H602: 8 | I602: =G602*6+H602 -> 38 | K602: 9 | L602: 15 | M602: =K602*6+L602 -> 69 | O602: 10 | P602: 16 | Q602: =O602*6+P602 -> 76 | S602: CRAIG
A603: BEST PLAYERS
A604: SANDRINGHAM | C604: KENNEDY | F604: BROWNE | I604: AUBREY | L604: COOPER | O604: STEVENS | R604: SAMPSON
A605: WAVERLEY | C605: FERGUSON | F605: CRAIG | I605: LUMLEY | L605: R ALLAN | O605: OSBORNE | R605: HARRY
A606: GOALKICKERS
A607: SANDRINGHAM | C607: COOPER 10 | F607: SAMPSON 4 | I607: AUBREY 3 | L607: WARD
A608: WAVERLEY | C608: HARRY 2 | F608: R ALLAN 2 | I608: LUMLEY 2 | L608: LAKE | N608: HORKINGS | Q608: STONE | S608: OSBORNE
A610: PRESTON | C610: 5 | D610: 5 | E610: =C610*6+D610 -> 35 | G610: 10 | H610: 8 | I610: =G610*6+H610 -> 68 | K610: 13 | L610: 13 | M610: =K610*6+L610 -> 91 | O610: 16 | P610: 16 | Q610: =O610*6+P610 -> 112 | S610: TOORAK PARK
A611: PRAHRAN | C611: 2 | D611: 4 | E611: =C611*6+D611 -> 16 | G611: 6 | H611: 17 | I611: =G611*6+H611 -> 53 | K611: 8 | L611: 20 | M611: =K611*6+L611 -> 68 | O611: 12 | P611: 28 | Q611: =O611*6+P611 -> 100 | S611: ABBOTT
A612: BEST PLAYERS
A613: PRESTON | C613: ZUNNEBERG | F613: ASHMEAD | I613: MARTIN | L613: MAHONEY | O613: BAIRD | R613: BENNISON
A614: PRAHRAN | C614: HUTCHESSON | F614: TUCKWELL | I614: ROSE | L614: EMSELLE | O614: MARINKO | R614: ANDERSON
A615: GOALKICKERS
A616: PRESTON | C616: CLARK 6 | F616: ASHMEAD 2 | I616: MAHONEY 2 | L616: ZUNNEBERG 2 | O616: WEIGHTMAN | R616: DRYSDALE | U616: BAIRD | W616: IRELAND
A617: PRAHRAN | C617: APPLETON 2 | F617: CLARKE 2 | I617: HUTCHESSON 2 | L617: ANDERSON 2 | O617: PIROUET 2 | R617: RON THOMAS | V617: GRANGE
A619: ROUND 14 | E619: 30TH JULY | J619: WEATHER | N619: NORTH WIND FINE | S619: PLAYED AT
D620: 1ST QTR | H620: 2ND QTR | L620: 3RD QTR | P620: FINAL | S620: DANDENONG
A621: DANDENONG | C621: 2 | D621: 5 | E621: =C621*6+D621 -> 17 | G621: 10 | H621: 12 | I621: =G621*6+H621 -> 72 | K621: 15 | L621: 20 | M621: =K621*6+L621 -> 110 | O621: 16 | P621: 22 | Q621: =O621*6+P621 -> 118 | S621: UMPIRE | X621: LADDER | AB621: ROUND | AD621: 14
A622: PORT MELBOURNE | C622: 6 | D622: 6 | E622: =C622*6+D622 -> 42 | G622: 8 | H622: 9 | I622: =G622*6+H622 -> 57 | K622: 13 | L622: 12 | M622: =K622*6+L622 -> 90 | O622: 17 | P622: 16 | Q622: =O622*6+P622 -> 118 | S622: FLANAGAN
A623: BEST PLAYERS | W623: TEAM | X623: W | Y623: L | Z623: D | AA623: FOR | AB623: AGST | AC623: % | AD623: PTS
A624: DANDENONG | C624: DAVIES | F624: ORCHARD | I624: REID | L624: KENDALL | N624: PERRY | Q624: EVANS
A625: PORT MELBOURNE | C625: FRENCH | F625: SKILTON | I625: MALLETT | L625: HOLT | N625: AANENSEN | Q625: RHEINBERGER | W625: OAKLEIGH | X625: 11 | Y625: 3 | Z625: 0 | AA625: 1806 | AB625: 1425 | AC625: 126.74 | AD625: 44
A626: GOALKICKERS | W626: PRESTON | X626: 10 | Y626: 4 | Z626: 0 | AA626: 1606 | AB626: 1481 | AC626: 108.44 | AD626: 40
A627: DANDENONG | C627: MILLER 4 | E627: REID 3 | G627: BROWN 2 | I627: SOUTHERN 2 | L627: ESLER 2 | N627: KENDALL | P627: MELAI | R627: PERRY | W627: DANDENONG | X627: 8 | Y627: 5 | Z627: 1 | AA627: 1518 | AB627: 1518 | AC627: 100 | AD627: 34
A628: PORT MELBOURNE | C628: HOLT 5 | E628: ANDERSON 3 | H628: SPARGO 3 | J628: SMITH | L628: COLLINS | N628: SKILTON | P628: FRENCH | R628: SWINSTEAD | W628: WILLIAMSTOWN | X628: 8 | Y628: 6 | Z628: 0 | AA628: 1523 | AB628: 1378 | AC628: 110.52 | AD628: 32
R629: AANENSEN
A630: SUNSHINE | C630: 4 | D630: 5 | E630: =C630*6+D630 -> 29 | G630: 11 | H630: 8 | I630: =G630*6+H630 -> 74 | K630: 14 | L630: 8 | M630: =K630*6+L630 -> 92 | O630: 18 | P630: 12 | Q630: =O630*6+P630 -> 120 | S630: BEACH ROAD | W630: PORT MELBOURNE | X630: 7 | Y630: 6 | Z630: 1 | AA630: 1596 | AB630: 1469 | AC630: 108.64533696392104 | AD630: 30
A631: SANDRINGHAM | C631: 3 | D631: 5 | E631: =C631*6+D631 -> 23 | G631: 5 | H631: 10 | I631: =G631*6+H631 -> 40 | K631: 9 | L631: 13 | M631: =K631*6+L631 -> 67 | O631: 12 | P631: 17 | Q631: =O631*6+P631 -> 89 | S631: ABBOTT | W631: SUNSHINE | X631: 6 | Y631: 8 | Z631: 0 | AA631: 1516 | AB631: 1502 | AC631: 100.93209054593875 | AD631: 24
A632: BEST PLAYERS | W632: SANDRINGHAM | X632: 6 | Y632: 8 | Z632: 0 | AA632: 1494 | AB632: 1572 | AC632: 95.04 | AD632: 24
A633: SUNSHINE | C633: WOODS | F633: PAYNE | I633: WAGLAND | L633: CRAWFORD | O633: BENSON | Q633: PIERZAK | W633: PRAHRAN | X633: 5 | Y633: 9 | Z633: 0 | AA633: 1464 | AB633: 1601 | AC633: 91.442848219862583 | AD633: 20
A634: SANDRINGHAM | C634: TOMS | F634: DAVEY | I634: KENNEDY | L634: COOPER | O634: SARAU | Q634: BROWNE | W634: COBURG | X634: 5 | Y634: 9 | Z634: 0 | AA634: 1438 | AB634: 1574 | AC634: 91.359593392630245 | AD634: 20
A635: GOALKICKERS | W635: WAVERLEY | X635: 3 | Y635: 11 | Z635: 0 | AA635: 1332 | AB635: 1773 | AC635: 75.126903553299499 | AD635: 12
A636: SUNSHINE | C636: WAGLAND 4 | F636: PAYNE 4 | H636: GLAVICI 3 | J636: McKENZIE 2 | M636: LLOYD 2 | O636: G SLADDIN | R636: NEISH | T636: THOMAS
A637: SANDRINGHAM | C637: COOPER 6 | F637: SPURRELL 3 | I637: WARD | K637: LOCKHART | N637: SPIDEN
A639: OAKLEIGH | C639: 8 | D639: 4 | E639: =C639*6+D639 -> 52 | G639: 12 | H639: 8 | I639: =G639*6+H639 -> 80 | K639: 18 | L639: 17 | M639: =K639*6+L639 -> 125 | O639: 23 | P639: 20 | Q639: =O639*6+P639 -> 158 | S639: COBURG
A640: COBURG | C640: 4 | D640: 3 | E640: =C640*6+D640 -> 27 | G640: 9 | H640: 10 | I640: =G640*6+H640 -> 64 | K640: 12 | L640: 13 | M640: =K640*6+L640 -> 85 | O640: 17 | P640: 19 | Q640: =O640*6+P640 -> 121 | S640: CRAIG
A641: BEST PLAYERS
A642: OAKLEIGH | C642: FORD | F642: TAYLOR | I642: ROBBINS | L642: STANTON | O642: P LILLEY | R642: WENN
A643: COBURG | C643: NAUGHTON | F643: SULLIVAN | I643: STARBUCK | L643: BRENNAN | O643: BRIDESON | R643: ELVERY
A644: GOALKICKERS
A645: OAKLEIGH | C645: ROBBINS 7 | F645: COLCOTT 4 | I645: FORD 3 | K645: TAYLOR 3 | M645: MURNANE 2 | P645: CARR 2 | R645: JOHNSON | U645: FORSTER
A646: COBURG | C646: BRENNAN 7 | F646: FEDLEY 3 | I646: MARSH 2 | K646: STARBUCK 2 | N646: MORRISON | Q646: HOBBS
A648: PRAHRAN | C648: 1 | D648: 9 | E648: =C648*6+D648 -> 15 | G648: 6 | H648: 15 | I648: =G648*6+H648 -> 51 | K648: 13 | L648: 16 | M648: =K648*6+L648 -> 94 | O648: 17 | P648: 19 | Q648: =O648*6+P648 -> 121 | S648: TOORAK PARK
A649: WILLIAMSTOWN | C649: 4 | D649: 5 | E649: =C649*6+D649 -> 29 | G649: 8 | H649: 8 | I649: =G649*6+H649 -> 56 | K649: 11 | L649: 11 | M649: =K649*6+L649 -> 77 | O649: 16 | P649: 13 | Q649: =O649*6+P649 -> 109 | S649: CHINN
A650: BEST PLAYERS
A651: PRAHRAN | C651: ROSE | F651: JOHNSTON | I651: APPLETON | L651: EMSELLE | O651: MARINKO | R651: LANGDON
A652: WILLIAMSTOWN | C652: BOXALL | F652: MULLIGAN | I652: L STILLMAN | L652: THOMPSON | O652: JACKMAN | R652: N STILLMAN
A653: GOALKICKERS
A654: PRAHRAN | C654: APPLETON 3 | F654: ANDERSON 3 | I654: O' BRIEN 2 | K654: RAY THOMAS 2 | N654: LANGDON 2 | Q654: MARINKO 2 | T654: TUCKWELL | W654: CLARKE | X654: HUTCHESSON
A655: WILLIAMSTOWN | C655: MULLIGAN 6 | F655: BOXALL 4 | I655: RADZIMINSKI 2 | L655: L STILLMAN | O655: JACKMAN | Q655: FANNING | S655: JONIEC
A657: PRESTON | C657: 11 | D657: 5 | E657: =C657*6+D657 -> 71 | G657: 11 | H657: 10 | I657: =G657*6+H657 -> 76 | K657: 19 | L657: 14 | M657: =K657*6+L657 -> 128 | O657: 24 | P657: 17 | Q657: =O657*6+P657 -> 161 | S657: PRESTON
A658: WAVERLEY | C658: 0 | D658: 0 | E658: =C658*6+D658 -> 0 | G658: 10 | H658: 4 | I658: =G658*6+H658 -> 64 | K658: 13 | L658: 7 | M658: =K658*6+L658 -> 85 | O658: 16 | P658: 12 | Q658: =O658*6+P658 -> 108 | S658: TORNEY
A659: BEST PLAYERS
A660: PRESTON | C660: MAHONEY | F660: McMAHON | I660: BENNISON | L660: CLARK | O660: ASHMEAD | R660: ZUNNEBERG
A661: WAVERLEY | C661: HARRY | F661: STONE | I661: WILTSHIRE | L661: HASTINGS | O661: OSBORNE | R661: CRAIG
A662: GOALKICKERS
A663: PRESTON | C663: CLARK 8 | F663: MAHONEY 5 | I663: McMAHON 3 | L663: WEIGHTMAN 3 | O663: ASHMEAD 2 | R663: ZUNNEBERG 2 | V663: NICHOL
A664: WAVERLEY | C664: WILTSHIRE 4 | F664: HARRY 3 | I664: STONE 3 | K664: HASTINGS 3 | N664: HORKINGS | Q664: CRAIG | S664: LUMLEY
A666: ROUND 15 | E666: 5TH AUGUST | J666: WEATHER | N666: NORTH WIND | S666: PLAYED AT
D667: 1ST QTR | H667: 2ND QTR | L667: 3RD QTR | P667: FINAL | S667: PORT MELBOURNE
A668: PORT MELBOURNE | C668: 3 | D668: 6 | E668: =C668*6+D668 -> 24 | G668: 7 | H668: 9 | I668: =G668*6+H668 -> 51 | K668: 8 | L668: 13 | M668: =K668*6+L668 -> 61 | O668: 12 | P668: 20 | Q668: =O668*6+P668 -> 92 | S668: UMPIRE | X668: LADDER | AB668: ROUND | AD668: 15
A669: PRESTON | C669: 3 | D669: 3 | E669: =C669*6+D669 -> 21 | G669: 6 | H669: 10 | I669: =G669*6+H669 -> 46 | K669: 7 | L669: 14 | M669: =K669*6+L669 -> 56 | O669: 11 | P669: 17 | Q669: =O669*6+P669 -> 83 | S669: GAMBETTA
A670: BEST PLAYERS | W670: TEAM | X670: W | Y670: L | Z670: D | AA670: FOR | AB670: AGST | AC670: % | AD670: PTS
A671: PORT MELBOURNE | C671: ALLEN | F671: SKILTON | I671: ANDERSON | L671: AANENSEN | O671: SWINSTEAD | R671: BUCKLEY
A672: PRESTON | C672: ASHMEAD | F672: WEIGHTMAN | I672: ZUNNEBERG | L672: LESLIE | O672: MARTIN | R672: TELFORD | W672: OAKLEIGH | X672: 12 | Y672: 3 | Z672: 0 | AA672: 1953 | AB672: 1504 | AC672: 129.85 | AD672: 48
A673: GOALKICKERS | W673: PRESTON | X673: 10 | Y673: 5 | Z673: 0 | AA673: 1689 | AB673: 1573 | AC673: 107.37 | AD673: 40
A674: PORT MELBOURNE | C674: SMITH 3 | F674: ANDERSON 2 | I674: AANENSEN 2 | L674: CARLON 2 | N674: SKILTON | P674: HOLT | R674: SPARGO | W674: DANDENONG | X674: 9 | Y674: 5 | Z674: 1 | AA674: 1629 | AB674: 1612 | AC674: 101.0545905707196 | AD674: 38
A675: PRESTON | C675: ASHMEAD 4 | F675: CLARK 4 | I675: McMAHON 2 | L675: NICHOL | W675: WILLIAMSTOWN | X675: 9 | Y675: 6 | Z675: 0 | AA675: 1631 | AB675: 1482 | AC675: 110.05 | AD675: 36
A677: WILLIAMSTOWN | C677: 5 | D677: 5 | E677: =C677*6+D677 -> 35 | G677: 6 | H677: 11 | I677: =G677*6+H677 -> 47 | K677: 8 | L677: 18 | M677: =K677*6+L677 -> 66 | O677: 14 | P677: 24 | Q677: =O677*6+P677 -> 108 | S677: WILLIAMSTOWN | W677: PORT MELBOURNE | X677: 8 | Y677: 6 | Z677: 1 | AA677: 1688 | AB677: 1552 | AC677: 108.76 | AD677: 34
A678: SUNSHINE | C678: 4 | D678: 9 | E678: =C678*6+D678 -> 33 | G678: 8 | H678: 11 | I678: =G678*6+H678 -> 59 | K678: 11 | L678: 12 | M678: =K678*6+L678 -> 78 | O678: 15 | P678: 14 | Q678: =O678*6+P678 -> 104 | S678: HAYES | W678: SUNSHINE | X678: 6 | Y678: 9 | Z678: 0 | AA678: 1620 | AB678: 1610 | AC678: 100.62111801242236 | AD678: 24
A679: BEST PLAYERS | W679: SANDRINGHAM | X679: 6 | Y679: 9 | Z679: 0 | AA679: 1573 | AB679: 1719 | AC679: 91.51 | AD679: 24
A680: WILLIAMSTOWN | C680: L STILLMAN | F680: PERCY | I680: JARRARD | L680: RADZIMINSKI | O680: N STILLMAN | R680: WALLACE | W680: COBURG | X680: 5 | Y680: 10 | Z680: 0 | AA680: 1532 | AB680: 1685 | AC680: 90.919881305637986 | AD680: 20
A681: SUNSHINE | C681: PIERZAK | F681: CRAWFORD | I681: WAGLAND | L681: LLOYD | O681: GLAVICI | R681: McKENZIE | W681: PRAHRAN | X681: 5 | Y681: 10 | Z681: 0 | AA681: 1549 | AB681: 1705 | AC681: 90.850439882697941 | AD681: 20
A682: GOALKICKERS | R682: WALLACE | W682: WAVERLEY | X682: 4 | Y682: 11 | Z682: 0 | AA682: 1436 | AB682: 1858 | AC682: 77.287405812701834 | AD682: 16
A683: WILLIAMSTOWN | C683: MULLIGAN 4 | F683: JAMES 2 | H683: BASTIAN 2 | J683: RADZIMINSKI | M683: EGAN | N683: L STILLMAN | Q683: BOXALL | S683: N STILLMAN
A684: SUNSHINE | C684: LLOYD 3 | E684: GLAVICI 3 | G684: RUSSELL 2 | I684: BENSON 2 | K684: G SLADDIN | M684: PAYNE | O684: CRAWFORD | R684: McKENZIE | U684: IBRAHIM
A686: WAVERLEY | C686: 5 | D686: 1 | E686: =C686*6+D686 -> 31 | G686: 9 | H686: 4 | I686: =G686*6+H686 -> 58 | K686: 12 | L686: 8 | M686: =K686*6+L686 -> 80 | O686: 15 | P686: 14 | Q686: =O686*6+P686 -> 104 | S686: WAVERLEY
A687: PRAHRAN | C687: 5 | D687: 8 | E687: =C687*6+D687 -> 38 | G687: 6 | H687: 10 | I687: =G687*6+H687 -> 46 | K687: 7 | L687: 18 | M687: =K687*6+L687 -> 60 | O687: 11 | P687: 19 | Q687: =O687*6+P687 -> 85 | S687: CARLYON
A688: BEST PLAYERS
A689: WAVERLEY | C689: FERGUSON | F689: STONE | I689: IVEY | K689: OWENS | N689: CRAIG | Q689: LUMLEY
A690: PRAHRAN | C690: APPLETON | F690: THYNNE | I690: EMSELLE | K690: THOMAS | N690: MARINKO | Q690: TUCKWELL
A691: GOALKICKERS
A692: WAVERLEY | C692: IVEY 5 | F692: STONE 3 | I692: HARRY 2 | K692: CURTIS | M692: PARKES | O692: OSBORNE | Q692: LUMLEY | S692: PITTS
A693: PRAHRAN | C693: PAYNE 2 | F693: ANDERSON 2 | I693: APPLETON | K693: TUCKWELL | N693: CLARKE | P693: O'BRIEN | R693: RAY THOMAS | V693: MARINKO | X693: EMSELLE
A695: OAKLEIGH | C695: 5 | D695: 5 | E695: =C695*6+D695 -> 35 | G695: 10 | H695: 7 | I695: =G695*6+H695 -> 67 | K695: 13 | L695: 13 | M695: =K695*6+L695 -> 91 | O695: 21 | P695: 21 | Q695: =O695*6+P695 -> 147 | S695: OAKLEIGH
A696: SANDRINGHAM | C696: 3 | D696: 4 | E696: =C696*6+D696 -> 22 | G696: 7 | H696: 9 | I696: =G696*6+H696 -> 51 | K696: 10 | L696: 12 | M696: =K696*6+L696 -> 72 | O696: 11 | P696: 13 | Q696: =O696*6+P696 -> 79 | S696: McBAIN
A697: BEST PLAYERS
A698: OAKLEIGH | C698: JOHNSON | F698: WENN | I698: BARROTT | L698: TAYLOR | O698: ROBBINS | R698: FRYER
A699: SANDRINGHAM | C699: SPURRELL | F699: STEVENS | I699: EVANS | L699: SARAU | O699: JONES | R699: WARD
A700: GOALKICKERS
A701: OAKLEIGH | C701: JOHNSON 9 | F701: MURNANE 4 | I701: FORD 2 | K701: COLCOTT 2 | N701: BARROTT 2 | Q701: ROBBINS | S701: TAYLOR
A702: SANDRINGHAM | C702: LOCKHART 3 | F702: EVANS 3 | I702: SARAU 2 | K702: AUBREY 2 | N702: JONES
A704: DANDENONG | C704: 3 | D704: 0 | E704: =C704*6+D704 -> 18 | G704: 11 | H704: 3 | I704: =G704*6+H704 -> 69 | K704: 14 | L704: 7 | M704: =K704*6+L704 -> 91 | O704: 17 | P704: 9 | Q704: =O704*6+P704 -> 111 | S704: COBURG
A705: COBURG | C705: 2 | D705: 7 | E705: =C705*6+D705 -> 19 | G705: 8 | H705: 10 | I705: =G705*6+H705 -> 58 | K705: 10 | L705: 14 | M705: =K705*6+L705 -> 74 | O705: 13 | P705: 16 | Q705: =O705*6+P705 -> 94 | S705: CHINN
A706: BEST PLAYERS
A707: DANDENONG | C707: HIBBERT | F707: WOODS | I707: EVANS | L707: KENDALL | O707: ESLER | R707: MELAI
A708: COBURG | C708: TYTLER | F708: BRENNAN | I708: ERWIN | L708: SULLIVAN | O708: MARSH | R708: McGRATH
A709: GOALKICKERS
A710: DANDENONG | C710: MILLER 4 | F710: HIBBERT 3 | I710: REID 3 | K710: SOUTHERN 2 | N710: PERRY 2 | P710: KENDALL | R710: EVANS | T710: ESLER
A711: COBURG | C711: McGRATH 3 | F711: BRENNAN 2 | I711: GALE 2 | K711: MARSH 2 | M711: WATT 2 | O711: McCARTHY | R711: STARBUCK
A713: ROUND 16 | E713: 13TH AUGUST | J713: WEATHER | M713: SOUTH WEST WIND LIGHT SHOWERS | S713: PLAYED AT
D714: 1ST QTR | H714: 2ND QTR | L714: 3RD QTR | P714: FINAL | S714: PRESTON
A715: WILLIAMSTOWN | C715: 5 | D715: 4 | E715: =C715*6+D715 -> 34 | G715: 12 | H715: 7 | I715: =G715*6+H715 -> 79 | K715: 18 | L715: 11 | M715: =K715*6+L715 -> 119 | O715: 19 | P715: 16 | Q715: =O715*6+P715 -> 130 | S715: UMPIRE | X715: LADDER | AB715: ROUND | AD715: 16
A716: PRESTON | C716: 6 | D716: 3 | E716: =C716*6+D716 -> 39 | G716: 8 | H716: 6 | I716: =G716*6+H716 -> 54 | K716: 9 | L716: 13 | M716: =K716*6+L716 -> 67 | O716: 14 | P716: 15 | Q716: =O716*6+P716 -> 99 | S716: CRAIG
A717: BEST PLAYERS | W717: TEAM | X717: W | Y717: L | Z717: D | AA717: FOR | AB717: AGST | AC717: % | AD717: PTS
A718: WILLIAMSTOWN | C718: L STILLMAN | F718: PERCY | I718: SVORINICH | L718: JAMES | N718: MULLIGAN | Q718: NOBLE
A719: PRESTON | C719: ASHMEAD | F719: MARTIN | I719: HILL | L719: PREECE | N719: TELFORD | Q719: McMAHON | W719: OAKLEIGH | X719: 12 | Y719: 4 | Z719: 0 | AA719: 2045 | AB719: 1655 | AC719: 123.56 | AD719: 48
A720: GOALKICKERS | W720: DANDENONG | X720: 10 | Y720: 5 | Z720: 1 | AA720: 1771 | AB720: 1718 | AC720: 103.08 | AD720: 42
A721: WILLIAMSTOWN | C721: SVORINICH 4 | F721: MULLIGAN 3 | I721: JAMES 3 | K721: L STILLMAN 2 | N721: WALLACE 2 | Q721: JARRARD | S721: N STILLMAN | W721: WILLIAMSTOWN | X721: 10 | Y721: 6 | Z721: 0 | AA721: 1761 | AB721: 1581 | AC721: 111.39 | AD721: 40
A722: PRESTON | C722: CLARK 6 | F722: MAHONEY 3 | I722: WEIGHTMAN 2 | L722: HUNT 2 | N722: McMAHON | W722: PRESTON | X722: 10 | Y722: 6 | Z722: 0 | AA722: 1788 | AB722: 1703 | AC722: 104.99 | AD722: 40
A724: SUNSHINE | C724: 2 | D724: 2 | E724: =C724*6+D724 -> 14 | G724: 8 | H724: 14 | I724: =G724*6+H724 -> 62 | K724: 13 | L724: 16 | M724: =K724*6+L724 -> 94 | O724: 22 | P724: 19 | Q724: =O724*6+P724 -> 151 | S724: SUNSHINE | W724: PORT MELBOURNE | X724: 9 | Y724: 6 | Z724: 1 | AA724: 1778 | AB724: 1622 | AC724: 109.62 | AD724: 38
A725: OAKLEIGH | C725: 4 | D725: 2 | E725: =C725*6+D725 -> 26 | G725: 7 | H725: 3 | I725: =G725*6+H725 -> 45 | K725: 12 | L725: 6 | M725: =K725*6+L725 -> 78 | O725: 14 | P725: 8 | Q725: =O725*6+P725 -> 92 | S725: TORNEY | W725: SUNSHINE | X725: 7 | Y725: 9 | Z725: 0 | AA725: 1771 | AB725: 1702 | AC725: 104.05405405405405 | AD725: 28
A726: BEST PLAYERS | W726: PRAHRAN | X726: 6 | Y726: 10 | Z726: 0 | AA726: 1662 | AB726: 1817 | AC726: 91.469455145844805 | AD726: 24
A727: SUNSHINE | C727: CRAWFORD | F727: GLAVICI | I727: IBRAHIM | L727: LLOYD | O727: McKENZIE | R727: BENSON | W727: SANDRINGHAM | X727: 6 | Y727: 10 | Z727: 0 | AA727: 1679 | AB727: 1861 | AC727: 90.22 | AD727: 24
A728: OAKLEIGH | C728: P LILLEY | F728: T QUINN | I728: MURNANE | L728: FORSTER | O728: J LILLEY | R728: BARROTT | W728: COBURG | X728: 5 | Y728: 11 | Z728: 0 | AA728: 1644 | AB728: 1798 | AC728: 91.434927697441609 | AD728: 20
A729: GOALKICKERS | P729: LLOYD 2 | W729: WAVERLEY | X729: 4 | Y729: 12 | Z729: 0 | AA729: 1506 | AB729: 1948 | AC729: 77.310061601642715 | AD729: 16
A730: SUNSHINE | C730: RUSSELL 6 | E730: CRAWFORD 3 | H730: McKENZIE 3 | K730: WAGLAND 2 | N730: G SLADDIN 2 | Q730: BENSON 2 | S730: IBRAHIM 2
A731: OAKLEIGH | C731: MURNANE (5) | F731: JOHNSON (4) | I731: ROBBINS (2) | L731: COLCOTT | N731: BARROTT | P731: QUINN
A733: DANDENONG | C733: 4 | D733: 6 | E733: =C733*6+D733 -> 30 | G733: 11 | H733: 15 | I733: =G733*6+H733 -> 81 | K733: 16 | L733: 22 | M733: =K733*6+L733 -> 118 | O733: 19 | P733: 28 | Q733: =O733*6+P733 -> 142 | S733: DANDENONG
A734: SANDRINGHAM | C734: 7 | D734: 0 | E734: =C734*6+D734 -> 42 | G734: 9 | H734: 2 | I734: =G734*6+H734 -> 56 | K734: 12 | L734: 6 | M734: =K734*6+L734 -> 78 | O734: 16 | P734: 10 | Q734: =O734*6+P734 -> 106 | S734: HAYES
A735: BEST PLAYERS
A736: DANDENONG | C736: MILLER | F736: BROWN | I736: DAVENPORT | L736: ORCHARD | O736: KENDALL | R736: EVANS
A737: SANDRINGHAM | C737: STEVENS | F737: TOMS | I737: JONES | L737: WARD | O737: EDWARDS | R737: SPURRELL
A738: GOALKICKERS
A739: DANDENONG | C739: MILLER 9 | F739: BROWN 4 | I739: ELLIS 2 | K739: EVANS 2 | M739: HIBBERT | O739: DAVIES
A740: SANDRINGHAM | C740: WARD 4 | F740: EDWARDS 4 | I740: STEVENS 3 | L740: SAMPSON | N740: CHISNALL | P740: LOCKHART | R740: JONES | T740: GRANT
A742: PRAHRAN | C742: 4 | D742: 1 | E742: =C742*6+D742 -> 25 | G742: 7 | H742: 11 | I742: =G742*6+H742 -> 53 | K742: 12 | L742: 14 | M742: =K742*6+L742 -> 86 | O742: 15 | P742: 23 | Q742: =O742*6+P742 -> 113 | S742: TOORAK PARK
A743: COBURG | C743: 7 | D743: 6 | E743: =C743*6+D743 -> 48 | G743: 9 | H743: 8 | I743: =G743*6+H743 -> 62 | K743: 12 | L743: 15 | M743: =K743*6+L743 -> 87 | O743: 16 | P743: 16 | Q743: =O743*6+P743 -> 112 | S743: FLANAGAN
A744: BEST PLAYERS
A745: PRAHRAN | C745: EMSELLE | F745: APPLETON | I745: TUCKWELL | L745: THOMAS | O745: MARTELLA | R745: LANGDON
A746: COBURG | C746: NAUGHTON | F746: SULLIVAN | I746: FARMER | L746: HOBBS | O746: PRICE | R746: WATT
A747: GOALKICKERS
A748: PRAHRAN | C748: APPLTON 3 | F748: TUCKWELL 3 | I748: PEACH 3 | K748: MARTELLA 3 | N748: RAY THOMAS 2 | R748: CLARKE
A749: COBURG | C749: FARMER 6 | F749: FEDLEY 4 | I749: McCARTHY 3 | L749: GALE | N749: WATT | P749: LAXTON
A751: PORT MELBOURNE | C751: 3 | D751: 4 | E751: =C751*6+D751 -> 22 | G751: 7 | H751: 7 | I751: =G751*6+H751 -> 49 | K751: 9 | L751: 11 | M751: =K751*6+L751 -> 65 | O751: 13 | P751: 12 | Q751: =O751*6+P751 -> 90 | S751: WAVERLEY
A752: WAVERLEY | C752: 2 | D752: 5 | E752: =C752*6+D752 -> 17 | G752: 4 | H752: 10 | I752: =G752*6+H752 -> 34 | K752: 7 | L752: 14 | M752: =K752*6+L752 -> 56 | O752: 9 | P752: 16 | Q752: =O752*6+P752 -> 70 | S752: ABBOTT
A753: BEST PLAYERS
A754: PORT MELBOURNE | C754: SKILTON | F754: MALLETT | I754: ALLEN | L754: HARLAND | O754: SWINSTEAD | R754: BESHARA
A755: WAVERLEY | C755: STONE | F755: B ALLAN | I755: HORKINGS | L755: PARKES | O755: HASTINGS | R755: BACKHOUSE
A756: GOALKICKERS
A757: PORT MELBOURNE | C757: HOLT 3 | F757: BESHARA 3 | I757: SMITH 2 | K757: HARLAND 2 | N757: ANDERSON | Q757: SWINSTEAD | T757: CARLON
A758: WAVERLEY | C758: CURTIS 2 | F758: PARKES 2 | I758: HASTINGS 2 | L758: IVEY 2 | N758: HARRY
A760: ROUND 17 | E760: 20TH AUGUST | J760: WEATHER | N760: FINE | S760: PLAYED AT
D761: 1ST QTR | H761: 2ND QTR | L761: 3RD QTR | P761: FINAL | S761: DANDENONG
A762: DANDENONG | C762: 5 | D762: 5 | E762: =C762*6+D762 -> 35 | G762: 8 | H762: 10 | I762: =G762*6+H762 -> 58 | K762: 14 | L762: 19 | M762: =K762*6+L762 -> 103 | O762: 17 | P762: 21 | Q762: =O762*6+P762 -> 123 | S762: UMPIRE | X762: LADDER | AB762: ROUND | AD762: 17
A763: WILLIAMSTOWN | C763: 3 | D763: 4 | E763: =C763*6+D763 -> 22 | G763: 6 | H763: 8 | I763: =G763*6+H763 -> 44 | K763: 9 | L763: 12 | M763: =K763*6+L763 -> 66 | O763: 14 | P763: 16 | Q763: =O763*6+P763 -> 100 | S763: TURNER
A764: BEST PLAYERS | W764: TEAM | X764: W | Y764: L | Z764: D | AA764: FOR | AB764: AGST | AC764: % | AD764: PTS
A765: DANDENONG | C765: ORCHARD | F765: MELAI | I765: STEDWELL | L765: DARLEY | N765: EVANS | Q765: DAVIES
A766: WILLIAMSTOWN | C766: L STILLMAN | F766: SVORINICH | I766: THOMPSON | L766: HEMLEY | N766: JACKMAN | Q766: WALLACE | W766: OAKLEIGH | X766: 13 | Y766: 4 | Z766: 0 | AA766: 2198 | AB766: 1781 | AC766: 123.41 | AD766: 52
A767: GOALKICKERS | W767: DANDENONG | X767: 11 | Y767: 5 | Z767: 1 | AA767: 1894 | AB767: 1818 | AC767: 104.18 | AD767: 46
A768: DANDENONG | C768: MILLER 5 | E768: BROWN 3 | G768: DAVENPORT 2 | J768: REID 2 | L768: SHEEHAN 2 | O768: ELLIS | Q768: MELAI | S768: EVANS | W768: WILLIAMSTOWN | X768: 10 | Y768: 7 | Z768: 0 | AA768: 1861 | AB768: 1704 | AC768: 109.21 | AD768: 40
A769: WILLIAMSTOWN | C769: SVORINICH 5 | F769: MULLIGAN 3 | I769: L STILLMAN | L769: FANNING | N769: NOBLE | P769: JAMES | R769: N STILLMAN | W769: PRESTON | X769: 10 | Y769: 7 | Z769: 0 | AA769: 1885 | AB769: 1833 | AC769: 102.84 | AD769: 40
R770: WALLACE
A771: OAKLEIGH | C771: 6 | D771: 1 | E771: =C771*6+D771 -> 37 | G771: 11 | H771: 5 | I771: =G771*6+H771 -> 71 | K771: 18 | L771: 11 | M771: =K771*6+L771 -> 119 | O771: 23 | P771: 15 | Q771: =O771*6+P771 -> 153 | S771: OAKLEIGH | W771: PORT MELBOURNE | X771: 9 | Y771: 7 | Z771: 1 | AA771: 1904 | AB771: 1775 | AC771: 107.27 | AD771: 38
A772: PORT MELBOURNE | C772: 4 | D772: 5 | E772: =C772*6+D772 -> 29 | G772: 9 | H772: 10 | I772: =G772*6+H772 -> 64 | K772: 13 | L772: 12 | M772: =K772*6+L772 -> 90 | O772: 18 | P772: 18 | Q772: =O772*6+P772 -> 126 | S772: FLANAGAN | W772: SUNSHINE | X772: 8 | Y772: 9 | Z772: 0 | AA772: 1955 | AB772: 1804 | AC772: 108.37028824833703 | AD772: 32
A773: BEST PLAYERS | W773: SANDRINGHAM | X773: 7 | Y773: 10 | Z773: 0 | AA773: 1809 | AB773: 1958 | AC773: 92.39 | AD773: 28
A774: OAKLEIGH | C774: BARROTT | F774: ROBBINS | I774: TAYLOR | L774: MURNANE | O774: CHISHOLM | R774: FORD | W774: COBURG | X774: 6 | Y774: 11 | Z774: 0 | AA774: 1768 | AB774: 1910 | AC774: 92.565445026178011 | AD774: 24
A775: PORT MELBOURNE | C775: M CARLON | F775: HARLAND | I775: RHEINBERGER | L775: ANDERSON | O775: SWINSTEAD | R775: BUCKLEY | W775: PRAHRAN | X775: 6 | Y775: 11 | Z775: 0 | AA775: 1764 | AB775: 2001 | AC775: 88.155922038980506 | AD775: 24
A776: GOALKICKERS | W776: WAVERLEY | X776: 4 | Y776: 13 | Z776: 0 | AA776: 1618 | AB776: 2072 | AC776: 78.08880308880309 | AD776: 16
A777: OAKLEIGH | C777: ROBBINS 6 | F777: MURNANE 6 | I777: BARROTT 5 | L777: CARR 2 | N777: JOHNSON | P777: TAYLOR | R777: COLCOTT | U777: QUINN
A778: PORT MELBOURNE | C778: HARLAND 6 | F778: SMITH 2 | I778: ANDERSON 2 | L778: HOLT 2 | N778: FRENCH 2 | Q778: AANENSEN | S778: CARLON
A780: SUNSHINE | C780: 7 | D780: 10 | E780: =C780*6+D780 -> 52 | G780: 11 | H780: 13 | I780: =G780*6+H780 -> 79 | K780: 15 | L780: 19 | M780: =K780*6+L780 -> 109 | O780: 27 | P780: 22 | Q780: =O780*6+P780 -> 184 | S780: SUNSHINE
A781: PRAHRAN | C781: 3 | D781: 2 | E781: =C781*6+D781 -> 20 | G781: 4 | H781: 6 | I781: =G781*6+H781 -> 30 | K781: 10 | L781: 10 | M781: =K781*6+L781 -> 70 | O781: 15 | P781: 12 | Q781: =O781*6+P781 -> 102 | S781: ABBOTT
A782: BEST PLAYERS
A783: SUNSHINE | C783: CRAWFORD | F783: G SLADDIN | I783: IBRAHAM | L783: WAGLAND | O783: LLOYD | R783: NEISH
A784: PRAHRAN | C784: MINTON-CONNELL | G784: EMSELLE | I784: MARTELLA | L784: JOHNSTON | O784: ROBESON | R784: GRANGE
A785: GOALKICKERS
A786: SUNSHINE | C786: RUSSELL 7 | F786: McKENZIE 6 | I786: WAGLAND 5 | L786: LLOYD 4 | N786: CRAWFORD 2 | Q786: G SLADDIN | T786: CONNELLY | W786: GLAVICI
A787: PRAHRAN | C787: APPLETON 3 | F787: PAYNE 3 | I787: RAY THOMAS 3 | M787: CLARKE 2 | O787: O'BRIEN | Q787: JOHNSON | S787: PEACH | U787: EMSELLE
A789: SANDRINGHAM | C789: 5 | D789: 3 | E789: =C789*6+D789 -> 33 | G789: 8 | H789: 5 | I789: =G789*6+H789 -> 53 | K789: 13 | L789: 16 | M789: =K789*6+L789 -> 94 | O789: 19 | P789: 16 | Q789: =O789*6+P789 -> 130 | S789: BEACH ROAD
A790: PRESTON | C790: 2 | D790: 4 | E790: =C790*6+D790 -> 16 | G790: 5 | H790: 8 | I790: =G790*6+H790 -> 38 | K790: 8 | L790: 9 | M790: =K790*6+L790 -> 57 | O790: 14 | P790: 13 | Q790: =O790*6+P790 -> 97 | S790: McMASTER
A791: BEST PLAYERS
A792: SANDRINGHAM | C792: SARAU | F792: STEVENS | I792: COOPER | L792: WARD | O792: EDWARS | R792: SPIDEN
A793: PRESTON | C793: ASHMEAD | F793: WEIGHTMAN | I793: LESLIE | L793: MORRIS | O793: GREEN | R793: CRAIG
A794: GOALKICKERS
A795: SANDRINGHAM | C795: COOPER 6 | F795: STEVENS 4 | I795: SARAU 3 | K795: EDWARDS 3 | N795: EVANS | P795: SPIDEN | R795: GRANT
A796: PRESTON | C796: CLARK 5 | F796: ASHMEAD 3 | I796: MARTIN 2 | K796: MAHONEY | N796: TELFORD | P796: STANLEY | R796: GOAD
A798: COBURG | C798: 3 | D798: 5 | E798: =C798*6+D798 -> 23 | G798: 9 | H798: 9 | I798: =G798*6+H798 -> 63 | K798: 14 | L798: 14 | M798: =K798*6+L798 -> 98 | O798: 18 | P798: 16 | Q798: =O798*6+P798 -> 124 | S798: COBURG
A799: WAVERLEY | C799: 3 | D799: 1 | E799: =C799*6+D799 -> 19 | G799: 5 | H799: 5 | I799: =G799*6+H799 -> 35 | K799: 12 | L799: 7 | M799: =K799*6+L799 -> 79 | O799: 17 | P799: 10 | Q799: =O799*6+P799 -> 112 | S799: McBAIN
A800: BEST PLAYERS
A801: COBURG | C801: MARSH | F801: WATT | I801: SULLIVAN | L801: PRICE | O801: NAUGHTON | R801: HOBBS
A802: WAVERLEY | C802: FERGUSON | F802: STONE | I802: BACKHOUSE | L802: HARRY | O802: IVEY
A803: GOALKICKERS
A804: COBURG | C804: FARMER 4 | F804: ERWIN 3 | I804: WATT 3 | K804: FEDLEY 2 | M804: GALE 2 | O804: McCARTHY 2 | R804: MARSH | T804: HOBBS
A805: WAVERLEY | C805: IVEY 4 | E805: LUMLEY 3 | H805: HORKINGS 2 | K805: HARRY 2 | M805: STONE 2 | O805: R ALLAN 2 | R805: OSBORNE | U805: HASTINGS
A807: ROUND 18 | E807: 27TH AUGUST | J807: WEATHER | N807: FINE | S807: PLAYED AT
D808: 1ST QTR | H808: 2ND QTR | L808: 3RD QTR | P808: FINAL | S808: WILLIAMSTOWN
A809: WILLIAMSTOWN | C809: 6 | D809: 3 | E809: =C809*6+D809 -> 39 | G809: 9 | H809: 9 | I809: =G809*6+H809 -> 63 | K809: 17 | L809: 17 | M809: =K809*6+L809 -> 119 | O809: 23 | P809: 22 | Q809: =O809*6+P809 -> 160 | S809: UMPIRE | X809: LADDER | AB809: ROUND | AD809: 18
A810: OAKLEIGH | C810: 1 | D810: 4 | E810: =C810*6+D810 -> 10 | G810: 10 | H810: 7 | I810: =G810*6+H810 -> 67 | K810: 14 | L810: 9 | M810: =K810*6+L810 -> 93 | O810: 18 | P810: 9 | Q810: =O810*6+P810 -> 117 | S810: ABBOTT
A811: BEST PLAYERS | W811: TEAM | X811: W | Y811: L | Z811: D | AA811: FOR | AB811: AGST | AC811: % | AD811: PTS
A812: WILLIAMSTOWN | C812: L STILLMAN | F812: JACKMAN | I812: THOMPSON | L812: BASTIAN | O812: SVORINICH | R812: WALLACE
A813: OAKLEIGH | C813: COLCOTT | F813: CHISHOLM | I813: ROBBINS | L813: TAYLOR | O813: MURNANE | R813: FORSTER | W813: OAKLEIGH | X813: 13 | Y813: 5 | Z813: 0 | AA813: 2315 | AB813: 1941 | AC813: 119.27 | AD813: 52
A814: GOALKICKERS | M814: JACKMAN | O814: BOXALL | Q814: HEMLEY | S814: FENTON | W814: DANDENONG | X814: 11 | Y814: 6 | Z814: 1 | AA814: 2039 | AB814: 1964 | AC814: 103.82 | AD814: 46
A815: WILLIAMSTOWN | C815: MULLIGAN 5 | F815: WALLACE 5 | I815: SVORINICH 3 | L815: L STILLMAN 3 | O815: N STILLMAN 2 | R815: RADZIMINSKI | W815: WILLIAMSTOWN | X815: 11 | Y815: 7 | Z815: 0 | AA815: 2021 | AB815: 1821 | AC815: 110.98 | AD815: 44
A816: OAKLEIGH | C816: JOHNSON 7 | F816: CARR 3 | H816: ROBBINS 2 | J816: TAYLOR 2 | M816: MURNANE 2 | P816: COLCOTT | R816: BARROTT | W816: PRESTON | X816: 11 | Y816: 7 | Z816: 0 | AA816: 2050 | AB816: 1929 | AC816: 106.27 | AD816: 44
A818: PRESTON | C818: 6 | D818: 2 | E818: =C818*6+D818 -> 38 | G818: 14 | H818: 6 | I818: =G818*6+H818 -> 90 | K818: 16 | L818: 7 | M818: =K818*6+L818 -> 103 | O818: 26 | P818: 9 | Q818: =O818*6+P818 -> 165 | S818: PRESTON | W818: PORT MELBOURNE | X818: 10 | Y818: 7 | Z818: 1 | AA818: 2076 | AB818: 1902 | AC818: 109.15 | AD818: 42
A819: SUNSHINE | C819: 5 | D819: 2 | E819: =C819*6+D819 -> 32 | G819: 8 | H819: 3 | I819: =G819*6+H819 -> 51 | K819: 13 | L819: 6 | M819: =K819*6+L819 -> 84 | O819: 15 | P819: 6 | Q819: =O819*6+P819 -> 96 | S819: HAYES | W819: SUNSHINE | X819: 8 | Y819: 10 | Z819: 0 | AA819: 2051 | AB819: 1969 | AC819: 104.16455053326561 | AD819: 32
A820: BEST PLAYERS | W820: SANDRINGHAM | X820: 8 | Y820: 10 | Z820: 0 | AA820: 1942 | AB820: 2043 | AC820: 95.06 | AD820: 32
A821: PRESTON | C821: CLARK | F821: MORRIS | I821: ASHMEAD | L821: HILL | N821: PREECE | Q821: WEIGHTMAN | W821: COBURG | X821: 6 | Y821: 12 | Z821: 0 | AA821: 1895 | AB821: 2082 | AC821: 91.018251681075895 | AD821: 24
A822: SUNSHINE | C822: McKENZIE | F822: PRIOR | I822: BENSON | L822: IBRAHIM | N822: PAYNE | Q822: CRAWFORD | W822: PRAHRAN | X822: 6 | Y822: 12 | Z822: 0 | AA822: 1849 | AB822: 2134 | AC822: 86.64479850046861 | AD822: 24
A823: GOALKICKERS | Q823: ZUNNEBERG | W823: WAVERLEY | X823: 5 | Y823: 13 | Z823: 0 | AA823: 1764 | AB823: 2217 | AC823: 79.566982408660351 | AD823: 20
A824: PRESTON | C824: CLARK 10 | F824: WEIGHTMAN 3 | I824: BAIRD 3 | K824: HILL 3 | M824: DEAN 2 | O824: TELFORD 2 | R824: ASHMEAD | U824: NICHOL
A825: SUNSHINE | C825: GOOLD 3 | E825: CHADWICK 2 | H825: LLOYD 2 | J825: WOODS 2 | M825: PAYNE | N825: CRAWFORD | Q825: McKENZIE | S825: BENSON | U825: NEISH | W825: PIERZAK
A827: PORT MELBOURNE | C827: 9 | D827: 4 | E827: =C827*6+D827 -> 58 | G827: 16 | H827: 5 | I827: =G827*6+H827 -> 101 | K827: 22 | L827: 11 | M827: =K827*6+L827 -> 143 | O827: 26 | P827: 16 | Q827: =O827*6+P827 -> 172 | S827: PORT MELBOURNE
A828: COBURG | C828: 2 | D828: 2 | E828: =C828*6+D828 -> 14 | G828: 9 | H828: 4 | I828: =G828*6+H828 -> 58 | K828: 14 | L828: 6 | M828: =K828*6+L828 -> 90 | O828: 20 | P828: 7 | Q828: =O828*6+P828 -> 127 | S828: McMASTER
A829: BEST PLAYERS
A830: PORT MELBOURNE | C830: SWINSTEAD | F830: SKILTON | I830: BUCKLEY | L830: HOLT | O830: ALLEN | R830: AANENSEN
A831: COBURG | C831: MARSH | F831: FEDLEY | I831: MORRISON | L831: HOBBS | O831: WATT | R831: McCARTHY
A832: GOALKICKERS
A833: PORT MELBOURNE | C833: COOK 5 | E833: ANDERSON 4 | H833: HOLT 4 | J833: SPARGO 4 | M833: SWINSTEAD 4 | P833: SKILTON 2 | R833: CARLON 2 | U833: BUCKLEY
A834: COBURG | C834: FEDLEY 6 | F834: FARMER 4 | I834: ERWIN 3 | K834: GALE 2 | M834: McCARTHY 2 | P834: MARSH | R834: MORRISON | U834: WATT
A836: SANDRINGHAM | C836: 6 | D836: 3 | E836: =C836*6+D836 -> 39 | G836: 7 | H836: 5 | I836: =G836*6+H836 -> 47 | K836: 16 | L836: 10 | M836: =K836*6+L836 -> 106 | O836: 20 | P836: 13 | Q836: =O836*6+P836 -> 133 | S836: BEACH ROAD
A837: PRAHRAN | C837: 2 | D837: 2 | E837: =C837*6+D837 -> 14 | G837: 9 | H837: 4 | I837: =G837*6+H837 -> 58 | K837: 11 | L837: 8 | M837: =K837*6+L837 -> 74 | O837: 12 | P837: 13 | Q837: =O837*6+P837 -> 85 | S837: McBAIN
A838: BEST PLAYERS
A839: SANDRINGHAM | C839: SPURRELL | F839: TOMS | I839: SARAU | L839: STEVENS | O839: LOCKHART | R839: EDWARDS
A840: PRAHRAN | C840: JOHNSTON | F840: HUGHES | I840: EMSELLE | L840: APPLETON | O840: PAYNE | R840: CULPIN
A841: GOALKICKERS
A842: SANDRINGHAM | C842: COOPER 6 | F842: STEVENS 3 | I842: EDWARDS 3 | L842: GRANT 3 | N842: KENNEDY 2 | Q842: SPURRELL | S842: JONES | U842: SPIDEN
A843: PRAHRAN | C843: PAYNE 4 | F843: APPLETON 2 | I843: KELLY 2 | K843: EMSELLE 2 | N843: RAY THOMAS | Q843: ANDERSON
A845: WAVERLEY | C845: 1 | D845: 1 | E845: =C845*6+D845 -> 7 | G845: 11 | H845: 7 | I845: =G845*6+H845 -> 73 | K845: 14 | L845: 11 | M845: =K845*6+L845 -> 95 | O845: 22 | P845: 14 | Q845: =O845*6+P845 -> 146 | S845: WAVERLEY
A846: DANDENONG | C846: 8 | D846: 10 | E846: =C846*6+D846 -> 58 | G846: 10 | H846: 13 | I846: =G846*6+H846 -> 73 | K846: 18 | L846: 14 | M846: =K846*6+L846 -> 122 | O846: 21 | P846: 19 | Q846: =O846*6+P846 -> 145 | S846: GAMBETTA
A847: BEST PLAYERS
A848: WAVERLEY | C848: STONE | F848: GOSPER | I848: B ALLAN | L848: PARKES | N848: CRAIG | Q848: SMEDTZ
A849: DANDENONG | C849: BROWN | F849: ORCHARD | I849: EVANS | L849: REID | N849: MELAI | Q849: DARLEY
A850: GOALKICKERS
A851: WAVERLEY | C851: PARKES 5 | E851: STONE 4 | G851: HASTINGS 3 | J851: R ALLAN 2 | M851: CRAIG 2 | O851: B ALLAN 2 | R851: HORKINGS | U851: HARRY | W851: OSBORNE | X851: IVEY
A852: DANDENONG | C852: MILLER 6 | F852: BROWN 4 | I852: FLAHERTY 3 | L852: REID 3 | N852: PERRY 2 | P852: DAVENPORT | S852: MELAI | U852: WORTHINGTON
A854: FINALS
A855: 1ST SEMI | E855: 3RD SEPTEMBER | J855: WEATHER | N855: FINE
D856: 1ST QTR | H856: 2ND QTR | L856: 3RD QTR | P856: FINAL
A857: WILLIAMSTOWN | C857: 2 | D857: 5 | E857: =C857*6+D857 -> 17 | G857: 7 | H857: 12 | I857: =G857*6+H857 -> 54 | K857: 15 | L857: 15 | M857: =K857*6+L857 -> 105 | O857: 22 | P857: 19 | Q857: =O857*6+P857 -> 151 | S857: JUNCTION OVAL
A858: PRESTON | C858: 8 | D858: 8 | E858: =C858*6+D858 -> 56 | G858: 10 | H858: 12 | I858: =G858*6+H858 -> 72 | K858: 15 | L858: 15 | M858: =K858*6+L858 -> 105 | O858: 19 | P858: 17 | Q858: =O858*6+P858 -> 131 | S858: ABBOTT
A859: BEST PLAYERS
A860: WILLIAMSTOWN | C860: JARRARD | F860: RADZIMINSKI | I860: THOMPSON | L860: SVORINICH | O860: FANNING | R860: PERCY
A861: PRESTON | C861: LESLIE | F861: WEIGHTMAN | I861: CLARK | L861: ZUNNEBERG | O861: DOWDLE | R861: DEAN
A862: GOALKICKERS
A863: WILLIAMSTOWN | C863: MULLIGAN 5 | F863: RADZIMINSKI 4 | J863: JARRARD 4 | M863: SVORINICH 3 | P863: WALLACE 3 | S863: FANNING 2 | V863: JACKMAN
A864: PRESTON | C864: CLARK 7 | F864: NICHOL 3 | I864: ZUNNEBERG 2 | L864: WEIGHTMAN 2 | O864: HILL 2 | Q864: ASHMEAD | S864: BAIRD | U864: IRELAND
A866: 2ND SEMI | E866: 10TH SEPTEMBER | J866: WEATHER | N866: FINE
A867: OAKLEIGH | C867: 3 | D867: 4 | E867: =C867*6+D867 -> 22 | G867: 14 | H867: 8 | I867: =G867*6+H867 -> 92 | K867: 18 | L867: 11 | M867: =K867*6+L867 -> 119 | O867: 27 | P867: 15 | Q867: =O867*6+P867 -> 177 | S867: JUNCTION OVAL
A868: DANDENONG | C868: 4 | D868: 7 | E868: =C868*6+D868 -> 31 | G868: 5 | H868: 10 | I868: =G868*6+H868 -> 40 | K868: 10 | L868: 18 | M868: =K868*6+L868 -> 78 | O868: 16 | P868: 19 | Q868: =O868*6+P868 -> 115 | S868: HAYES
A869: BEST PLAYERS
A870: OAKLEIGH | C870: CARR | F870: MURNANE | I870: CHISHOLM | L870: P LILLEY | O870: FRYER | R870: COLCOTT
A871: DANDENONG | C871: ORCHARD | F871: MELAI | I871: KENDALL | L871: MATTHEWS | O871: HIBBERT | R871: FLAHERTY
A872: GOALKICKERS
A873: OAKLEIGH | C873: MURNANE 6 | F873: JOHNSON 5 | I873: CARR 4 | K873: ROBBINS 3 | M873: TAYLOR 2 | O873: COLCOTT 2 | R873: BARROTT 2 | U873: LILLEY 2 | X873: FORD
A874: DANDENONG | C874: FLAHERTY 5 | F874: MILLER 3 | I874: ELLIS 3 | K874: BROWN 2 | M874: HIBBERT | O874: MELAI | Q874: STEDWELL
A876: PRELIMINARY FINAL | F876: 17TH SEPTEMBER | K876: WEATHER | N876: STRONG WESTERLY GALE
A877: DANDENONG | C877: 5 | D877: 7 | E877: =C877*6+D877 -> 37 | G877: 8 | H877: 8 | I877: =G877*6+H877 -> 56 | K877: 14 | L877: 12 | M877: =K877*6+L877 -> 96 | O877: 22 | P877: 14 | Q877: =O877*6+P877 -> 146 | S877: JUNCTION OVAL
A878: WILLIAMSTOWN | C878: 1 | D878: 1 | E878: =C878*6+D878 -> 7 | G878: 2 | H878: 8 | I878: =G878*6+H878 -> 20 | K878: 5 | L878: 9 | M878: =K878*6+L878 -> 39 | O878: 11 | P878: 16 | Q878: =O878*6+P878 -> 82 | S878: STIRLING
A879: BEST PLAYERS
A880: DANDENONG | C880: FLAHERTY | F880: ORCHARD | I880: MILLER | L880: MELAI | O880: STEDWELL | R880: HARRINGTON
A881: WILLIAMSTOWN | C881: THOMPSON | F881: HEMLEY | I881: SVORINICH | L881: JACKMAN | O881: L STILLMAN | R881: PERCY
A882: GOALKICKERS
A883: DANDENONG | C883: MILLER 9 | F883: FLAHERTY 5 | I883: HIBBERT 4 | L883: BROWN 2 | O883: ELLIS | Q883: MELAI
A884: WILLIAMSTOWN | C884: SVORINICH 6 | F884: BOXALL 2 | I884: MULLIGAN | L884: PERCY | N884: FENTON
A886: GRAND FINAL | E886: 24TH SEPTEMBER | J886: WEATHER
A887: OAKLEIGH | C887: 4 | D887: 6 | E887: 30 | G887: 11 | H887: 12 | I887: 78 | K887: 15 | L887: 13 | M887: 103 | O887: 25 | P887: 17 | Q887: =O887*6+P887 -> 167 | S887: JUNCTION OVAL
A888: DANDENONG | C888: 2 | D888: 6 | E888: 18 | G888: 8 | H888: 8 | I888: 56 | K888: 13 | L888: 14 | M888: 92 | O888: 18 | P888: 15 | Q888: =O888*6+P888 -> 123 | S888: HAYES
A889: BEST PLAYERS
A890: OAKLEIGH | C890: FORD | F890: MURNANE | I890: BARROTT | L890: TAYLOR | O890: WENN | R890: JOHNSON
A891: DANDENONG | C891: MILLER | F891: DAVIES | I891: HIBBERT | L891: FLAHERTY | O891: HARRINGTON | R891: ESLER
A892: GOALKICKERS
A893: OAKLEIGH | C893: MURNANE 7 | F893: JOHNSON 5 | I893: TAYLOR 5 | L893: BARROTT 2 | O893: J LILLEY 2 | Q893: CARR 2 | S893: ROBBINS | V893: FORD | X893: COLCOTT
A894: DANDENONG | C894: MILLER 9 | F894: FLAHERTY 4 | I894: HIBBERT 2 | L894: ELLIS | N894: DAVIES | P894: SHINNERS
A896: LIGHTNING PREMIERSHIP
A897: 1ST ROUND
A898: BOX HILL | C898: 6 | D898: 11 | E898: =C898*6+D898 -> 47
A899: MORDIALLOC | C899: 3 | D899: 6 | E899: =C899*6+D899 -> 24
A901: FRANKSTON | C901: 11 | D901: 3 | E901: =C901*6+D901 -> 69
A902: WERRIBEE | C902: 4 | D902: 6 | E902: =C902*6+D902 -> 30
A904: 2ND ROUND
A905: PORT MELB | C905: 8 | D905: 6 | E905: =C905*6+D905 -> 54
A906: SUNSHINE | C906: 6 | D906: 4 | E906: =C906*6+D906 -> 40
A908: BOX HILL | C908: 5 | D908: 6 | E908: =C908*6+D908 -> 36
A909: NORTHCOTE | C909: 4 | D909: 6 | E909: =C909*6+D909 -> 30
A911: FRANKSTON | C911: 8 | D911: 4 | E911: =C911*6+D911 -> 52
A912: CAMBERWELL | C912: 6 | D912: 2 | E912: =C912*6+D912 -> 38
A914: QTR FINALS
A915: COBURG | C915: 3 | D915: 1 | E915: =C915*6+D915 -> 19 | G915: 7 | H915: 3 | I915: =G915*6+H915 -> 45
A916: SANDRINGHAM | C916: 2 | D916: 5 | E916: =C916*6+D916 -> 17 | G916: 3 | H916: 8 | I916: =G916*6+H916 -> 26
A918: WAVERLEY | C918: 4 | D918: 3 | E918: =C918*6+D918 -> 27 | G918: 5 | H918: 5 | I918: =G918*6+H918 -> 35
A919: PRAHRAN | C919: 1 | D919: 2 | E919: =C919*6+D919 -> 8 | G919: 4 | H919: 5 | I919: =G919*6+H919 -> 29
A921: BOX HILL | C921: 3 | D921: 3 | E921: =C921*6+D921 -> 21 | G921: 3 | H921: 6 | I921: =G921*6+H921 -> 24
A922: FRANKSTON | C922: 1 | D922: 1 | E922: =C922*6+D922 -> 7 | G922: 2 | H922: 3 | I922: =G922*6+H922 -> 15
A924: SEMI FINALS
A925: PORT MELB | C925: 3 | D925: 7 | E925: =C925*6+D925 -> 25 | G925: 6 | H925: 10 | I925: =G925*6+H925 -> 46
A926: BOX HILL | C926: 1 | D926: 1 | E926: =C926*6+D926 -> 7 | G926: 2 | H926: 4 | I926: =G926*6+H926 -> 16
A928: COBURG | C928: 3 | D928: 2 | E928: =C928*6+D928 -> 20 | G928: 7 | H928: 5 | I928: =G928*6+H928 -> 47
A929: WAVERLEY | C929: 5 | D929: 0 | E929: =C929*6+D929 -> 30 | G929: 5 | H929: 1 | I929: =G929*6+H929 -> 31
A931: GRAND FINAL
A932: COBURG | C932: 3 | D932: 1 | E932: =C932*6+D932 -> 19 | G932: 6 | H932: 2 | I932: =G932*6+H932 -> 38
A933: PORT MELB | C933: 0 | D933: 3 | E933: =C933*6+D933 -> 3 | G933: 3 | H933: 8 | I933: =G933*6+H933 -> 26
A935: GOAL KICKERS
A936: COBURG | C936: McGRATH 2 | F936: HOBBS 2 | I936: BRENNAN | L936: FEDLEY
A937: PORT MELB | C937: SWINSTEAD | F937: HUDSON | I937: M CARLON
A938: BEST PLAYERS
A939: COBURG | C939: HOBBS | F939: REILLY | I939: NAUGHTON | L939: ERWIN
A940: PORT MELB | C940: HUDSON | F940: LLOYD | I940: MALLETT | L940: ANDERSON