A1: Victorian Football Association
A2: Season 1972 - Division Two
A3: © Copyright Wal Williams | F3: First created: 28 March 2016
A4: Contact: joywalwi at gmail dot com | F4: Last updated: 28 March 2016 | W4: VFA Results and tables - Link to the main index page
A5: You are free to copy this document in whole or part provided that proper acknowledgement is given to the author. All rights reserved.
A7: 1972 | C7: V.F.A. SEASON 2ND DIVISION
A8: ROUND 1 | E8: 16TH APRIL | J8: WEATHER | S8: PLAYED AT
D9: 1ST QTR | H9: 2ND QTR | L9: 3RD QTR | P9: FINAL | S9: MORDIALLOC
A10: YARRAVILLE | C10: 0 | D10: 0 | E10: =C10*6+D10 -> 0 | G10: 0 | H10: 0 | I10: =G10*6+H10 -> 0 | K10: 0 | L10: 0 | M10: =K10*6+L10 -> 0 | O10: 25 | P10: 12 | Q10: =O10*6+P10 -> 162 | S10: UMPIRE | X10: LADDER | AB10: ROUND | AD10: 1
A11: MORDIALLOC | C11: 0 | D11: 0 | E11: =C11*6+D11 -> 0 | G11: 0 | H11: 0 | I11: =G11*6+H11 -> 0 | K11: 0 | L11: 0 | M11: =K11*6+L11 -> 0 | O11: 12 | P11: 10 | Q11: =O11*6+P11 -> 82
A12: BEST PLAYERS | W12: TEAM | X12: W | Y12: L | Z12: D | AA12: FOR | AB12: AGST | AC12: % | AD12: PTS
A13: YARRAVILLE
A14: MORDIALLOC | W14: YARRAVILLE | X14: 1 | Y14: 0 | Z14: 0 | AA14: 162 | AB14: 82 | AC14: =(AA14*100)/AB14 -> 197.5609756097561 | AD14: =(X14*4)+(Z14*2) -> 4
A15: GOALKICKERS | W15: GEELONG WEST | X15: 1 | Y15: 0 | Z15: 0 | AA15: 142 | AB15: 94 | AC15: =(AA15*100)/AB15 -> 151.06382978723406 | AD15: =(X15*4)+(Z15*2) -> 4
A16: YARRAVILLE | W16: NORTHCOTE | X16: 1 | Y16: 0 | Z16: 0 | AA16: 125 | AB16: 109 | AC16: =(AA16*100)/AB16 -> 114.6788990825688 | AD16: =(X16*4)+(Z16*2) -> 4
A17: MORDIALLOC | W17: CAMBERWELL | X17: 1 | Y17: 0 | Z17: 0 | AA17: 137 | AB17: 131 | AC17: =(AA17*100)/AB17 -> 104.58015267175573 | AD17: =(X17*4)+(Z17*2) -> 4
A19: CAULFIELD | C19: 6 | D19: 4 | E19: =C19*6+D19 -> 40 | G19: 10 | H19: 6 | I19: =G19*6+H19 -> 66 | K19: 15 | L19: 4 | M19: =K19*6+L19 -> 94 | O19: 19 | P19: 18 | Q19: =O19*6+P19 -> 132 | S19: BOX HILL | W19: CAULFIELD | X19: 1 | Y19: 0 | Z19: 0 | AA19: 132 | AB19: 127 | AC19: =(AA19*100)/AB19 -> 103.93700787401575 | AD19: =(X19*4)+(Z19*2) -> 4
A20: BOX HILL | C20: 5 | D20: 3 | E20: =C20*6+D20 -> 33 | G20: 12 | H20: 6 | I20: =G20*6+H20 -> 78 | K20: 14 | L20: 9 | M20: =K20*6+L20 -> 93 | O20: 19 | P20: 13 | Q20: =O20*6+P20 -> 127 | W20: BOX HILL | X20: 0 | Y20: 1 | Z20: 0 | AA20: 127 | AB20: 132 | AC20: =(AA20*100)/AB20 -> 96.212121212121218 | AD20: =(X20*4)+(Z20*2) -> 0
A21: BEST PLAYERS | W21: FRANKSTON | X21: 0 | Y21: 1 | Z21: 0 | AA21: 131 | AB21: 137 | AC21: =(AA21*100)/AB21 -> 95.620437956204384 | AD21: =(X21*4)+(Z21*2) -> 0
A22: CAULFIELD | C22: WILLIAMS | F22: T JEWELL | I22: BROWN | L22: ROBINSON | O22: TEMPEST | R22: CLIFF | W22: WERRIBEE | X22: 0 | Y22: 1 | Z22: 0 | AA22: 109 | AB22: 125 | AC22: =(AA22*100)/AB22 -> 87.2 | AD22: =(X22*4)+(Z22*2) -> 0
A23: BOX HILL | C23: COSTELLO | F23: BRYANT | I23: COBAIN | L23: DOULIS | O23: VICK | W23: BRUNSWICK | X23: 0 | Y23: 1 | Z23: 0 | AA23: 94 | AB23: 142 | AC23: =(AA23*100)/AB23 -> 66.197183098591552 | AD23: =(X23*4)+(Z23*2) -> 0
A24: GOALKICKERS | W24: MORDIALLOC | X24: 0 | Y24: 1 | Z24: 0 | AA24: 82 | AB24: 162 | AC24: =(AA24*100)/AB24 -> 50.617283950617285 | AD24: =(X24*4)+(Z24*2) -> 0
A25: CAULFIELD | C25: BROWN 7 | F25: WILLIAMS 5 | I25: BAKER 2 | K25: T JEWELL 2 | N25: ROBINSON 2 | Q25: LOGAN
A26: BOX HILL | C26: COSTELLO 5 | F26: VICK 3 | H26: SMITH 3 | J26: McNAMEE 3 | M26: BRYANT 2 | O26: COLE | Q26: BRADFIELD | S26: COBAIN
A28: CAMBERWELL | C28: 6 | D28: 0 | E28: =C28*6+D28 -> 36 | G28: 11 | H28: 2 | I28: =G28*6+H28 -> 68 | K28: 14 | L28: 7 | M28: =K28*6+L28 -> 91 | O28: 21 | P28: 11 | Q28: =O28*6+P28 -> 137 | S28: FRANKSTON
A29: FRANKSTON | C29: 6 | D29: 5 | E29: =C29*6+D29 -> 41 | G29: 12 | H29: 7 | I29: =G29*6+H29 -> 79 | K29: 17 | L29: 9 | M29: =K29*6+L29 -> 111 | O29: 20 | P29: 11 | Q29: =O29*6+P29 -> 131
A30: BEST PLAYERS
A31: CAMBERWELL | C31: BRYANS | F31: WILSON | I31: BAKER | L31: HAZLETT | O31: STONE | Q31: SIMPSON
A32: FRANKSTON | C32: LOVELOCK | F32: SLADE | I32: McWILLIAMS
A33: GOALKICKERS
A34: CAMBERWELL | C34: STONE 4 | E34: HAMMOND 4 | H34: SIMPSON 3 | J34: BAKER 3 | L34: BRYANS 3 | N34: D BOYD | P34: CLARKE | R34: HAZLETT | T34: T WILSON
A35: FRANKSTON | C35: COUTTS 7 | E35: McNAB 4 | G35: LOVELOCK 3 | J35: FYSON 2 | L35: WESTON | N35: CLARKE | P35: McWILLIAMS | S35: SLADE
A37: NORTHCOTE | C37: 5 | D37: 4 | E37: =C37*6+D37 -> 34 | G37: 8 | H37: 9 | I37: =G37*6+H37 -> 57 | K37: 11 | L37: 12 | M37: =K37*6+L37 -> 78 | O37: 18 | P37: 17 | Q37: =O37*6+P37 -> 125 | S37: NORTHCOTE
A38: WERRIBEE | C38: 4 | D38: 6 | E38: =C38*6+D38 -> 30 | G38: 8 | H38: 7 | I38: =G38*6+H38 -> 55 | K38: 14 | L38: 9 | M38: =K38*6+L38 -> 93 | O38: 16 | P38: 13 | Q38: =O38*6+P38 -> 109
A39: BEST PLAYERS
A40: NORTHCOTE | C40: COHEN | F40: KOZARIS | I40: SMITH | L40: RYAN | N40: MARTIN | Q40: McGORLICK
A41: WERRIBEE | C41: BRYANT | F41: ARRIGO | I41: COMBEN | L41: PAICE | N41: SOMMERVILLE | Q41: SNOW
A42: GOALKICKERS
A43: NORTHCOTE | C43: COHEN 9 | F43: KOZARIS 2 | I43: KILKENNY 2 | L43: RYAN 2 | N43: MARTIN | P43: PITTS | R43: LIDDELL
A44: WERRIBEE | C44: BRYANT 4 | F44: SOMMERVILLE 3 | I44: PAGE 2 | K44: ARRIGO 2 | N44: COMBEN | P44: PAICE | R44: BOURKE | T44: BUTTON | V44: FARRELLY
A46: GEELONG WEST | C46: 0 | D46: 0 | E46: =C46*6+D46 -> 0 | G46: 0 | H46: 0 | I46: =G46*6+H46 -> 0 | K46: 0 | L46: 0 | M46: =K46*6+L46 -> 0 | O46: 21 | P46: 16 | Q46: =O46*6+P46 -> 142 | S46: GEELONG WEST
A47: BRUNSWICK | C47: 0 | D47: 0 | E47: =C47*6+D47 -> 0 | G47: 0 | H47: 0 | I47: =G47*6+H47 -> 0 | K47: 0 | L47: 0 | M47: =K47*6+L47 -> 0 | O47: 13 | P47: 16 | Q47: =O47*6+P47 -> 94
A48: BEST PLAYERS
A49: GEELONG WEST
A50: BRUNSWICK
A51: GOALKICKERS
A52: GEELONG WEST
A53: BRUNSWICK
A55: ROUND 2 | E55: 23RD APRIL | J55: WEATHER | S55: PLAYED AT
D56: 1ST QTR | H56: 2ND QTR | L56: 3RD QTR | P56: FINAL | S56: CAMBERWELL
A57: BOX HILL | C57: 4 | D57: 6 | E57: =C57*6+D57 -> 30 | G57: 5 | H57: 9 | I57: =G57*6+H57 -> 39 | K57: 9 | L57: 14 | M57: =K57*6+L57 -> 68 | O57: 11 | P57: 17 | Q57: =O57*6+P57 -> 83 | S57: UMPIRE | X57: LADDER | AB57: ROUND | AD57: 2
A58: CAMBERWELL | C58: 3 | D58: 2 | E58: =C58*6+D58 -> 20 | G58: 3 | H58: 6 | I58: =G58*6+H58 -> 24 | K58: 6 | L58: 8 | M58: =K58*6+L58 -> 44 | O58: 8 | P58: 11 | Q58: =O58*6+P58 -> 59 | S58: McMASTER
A59: BEST PLAYERS | W59: TEAM | X59: W | Y59: L | Z59: D | AA59: FOR | AB59: AGST | AC59: % | AD59: PTS
A60: BOX HILL | C60: BODEY | F60: RALPH | I60: DOULIS | L60: VICK | N60: HUMPHREY
A61: CAMBERWELL | C61: SIMPSON | F61: HOOK | I61: HAZLETT | L61: BOYD | N61: STONE | W61: CAULFIELD | X61: 2 | Y61: 0 | Z61: 0 | AA61: 259 | AB61: 180 | AC61: =(AA61*100)/AB61 -> 143.88888888888889 | AD61: =(X61*4)+(Z61*2) -> 8
A62: GOALKICKERS | W62: GEELONG WEST | X62: 2 | Y62: 0 | Z62: 0 | AA62: 248 | AB62: 179 | AC62: =(AA62*100)/AB62 -> 138.54748603351956 | AD62: =(X62*4)+(Z62*2) -> 8
A63: BOX HILL | C63: COBAIN 3 | F63: COSTELLO 2 | I63: DOULIS 2 | K63: VICK 2 | M63: COLE | O63: THOMPSON | W63: NORTHCOTE | X63: 2 | Y63: 0 | Z63: 0 | AA63: 229 | AB63: 179 | AC63: =(AA63*100)/AB63 -> 127.93296089385476 | AD63: =(X63*4)+(Z63*2) -> 8
A64: CAMBERWELL | C64: STONE 4 | F64: SIMPSON | I64: DOHERTY | L64: HAMMOND | O64: BRYANS | W64: FRANKSTON | X64: 1 | Y64: 1 | Z64: 0 | AA64: 281 | AB64: 200 | AC64: =(AA64*100)/AB64 -> 140.5 | AD64: =(X64*4)+(Z64*2) -> 4
A66: NORTHCOTE | C66: 2 | D66: 4 | E66: =C66*6+D66 -> 16 | G66: 4 | H66: 6 | I66: =G66*6+H66 -> 30 | K66: 11 | L66: 16 | M66: =K66*6+L66 -> 82 | O66: 14 | P66: 20 | Q66: =O66*6+P66 -> 104 | S66: BRUNSWICK | W66: YARRAVILLE | X66: 1 | Y66: 1 | Z66: 0 | AA66: 247 | AB66: 188 | AC66: =(AA66*100)/AB66 -> 131.38297872340425 | AD66: =(X66*4)+(Z66*2) -> 4
A67: BRUNSWICK | C67: 0 | D67: 3 | E67: =C67*6+D67 -> 3 | G67: 5 | H67: 6 | I67: =G67*6+H67 -> 36 | K67: 7 | L67: 8 | M67: =K67*6+L67 -> 50 | O67: 10 | P67: 10 | Q67: =O67*6+P67 -> 70 | S67: CHINN | W67: BOX HILL | X67: 1 | Y67: 1 | Z67: 0 | AA67: 210 | AB67: 191 | AC67: =(AA67*100)/AB67 -> 109.94764397905759 | AD67: =(X67*4)+(Z67*2) -> 4
A68: BEST PLAYERS | W68: CAMBERWELL | X68: 1 | Y68: 1 | Z68: 0 | AA68: 196 | AB68: 214 | AC68: =(AA68*100)/AB68 -> 91.588785046728972 | AD68: =(X68*4)+(Z68*2) -> 4
A69: NORTHCOTE | C69: KOZARIS | F69: RYAN | I69: SMITH | L69: HAMPSON | O69: MARTIN | R69: STANLEY | W69: BRUNSWICK | X69: 0 | Y69: 2 | Z69: 0 | AA69: 164 | AB69: 246 | AC69: =(AA69*100)/AB69 -> 66.666666666666671 | AD69: =(X69*4)+(Z69*2) -> 0
A70: BRUNSWICK | C70: HADZILLIAS | F70: ALLEN | I70: McKINNON | L70: NIVEN | O70: HORSINGTON | W70: WERRIBEE | X70: 0 | Y70: 2 | Z70: 0 | AA70: 172 | AB70: 275 | AC70: =(AA70*100)/AB70 -> 62.545454545454547 | AD70: =(X70*4)+(Z70*2) -> 0
A71: GOALKICKERS | W71: MORDIALLOC | X71: 0 | Y71: 2 | Z71: 0 | AA71: 135 | AB71: 289 | AC71: =(AA71*100)/AB71 -> 46.712802768166092 | AD71: =(X71*4)+(Z71*2) -> 0
A72: NORTHCOTE | C72: RYAN 5 | F72: KOZARIS 3 | H72: HAMPSON 2 | K72: KILKENNY 2 | N72: MARTIN | Q72: COHEN
A73: BRUNSWICK | C73: ALLEN 5 | F73: SCHIMMELBUSCH 3 | K73: DIMMATINA | N73: McCABE
A75: GEELONG WEST | C75: 3 | D75: 4 | E75: =C75*6+D75 -> 22 | G75: 8 | H75: 12 | I75: =G75*6+H75 -> 60 | K75: 10 | L75: 15 | M75: =K75*6+L75 -> 75 | O75: 15 | P75: 16 | Q75: =O75*6+P75 -> 106 | S75: YARRAVILLE
A76: YARRAVILLE | C76: 4 | D76: 3 | E76: =C76*6+D76 -> 27 | G76: 5 | H76: 3 | I76: =G76*6+H76 -> 33 | K76: 9 | L76: 8 | M76: =K76*6+L76 -> 62 | O76: 12 | P76: 13 | Q76: =O76*6+P76 -> 85 | S76: TURNER
A77: BEST PLAYERS
A78: GEELONG WEST | C78: M BROWNE | F78: SMITH | I78: HALL | L78: KEANE | N78: GOGGIN | Q78: COLLEY
A79: YARRAVILLE | C79: RYAN | F79: STURNEIKS | I79: McLAREN | L79: KNOTT | N79: DOLL | Q79: BROWN
A80: GOALKICKERS
A81: GEELONG WEST | C81: SMITH 4 | F81: McLEAN 3 | I81: KEANE 3 | K81: M BROWNE 3 | N81: GOGGIN | P81: LINKE
A82: YARRAVILLE | C82: STONE 3 | F82: MCLAREN 3 | I82: MARTIN 2 | K82: BROWN | M82: BRENNAN | O82: KNOTT | Q82: MATHESON
A84: FRANKSTON | C84: 5 | D84: 3 | E84: =C84*6+D84 -> 33 | G84: 9 | H84: 11 | I84: =G84*6+H84 -> 65 | K84: 13 | L84: 12 | M84: =K84*6+L84 -> 90 | O84: 22 | P84: 18 | Q84: =O84*6+P84 -> 150 | S84: WERRIBEE
A85: WERRIBEE | C85: 3 | D85: 2 | E85: =C85*6+D85 -> 20 | G85: 4 | H85: 5 | I85: =G85*6+H85 -> 29 | K85: 6 | L85: 12 | M85: =K85*6+L85 -> 48 | O85: 8 | P85: 15 | Q85: =O85*6+P85 -> 63 | S85: HUXTABLE
A86: BEST PLAYERS
A87: FRANKSTON | C87: McWILLIAMS | F87: RIDSDALE | I87: ROSENBROCK | L87: COUTTS | N87: ROWE | P87: LOVELOCK
A88: WERRIBEE | C88: NEWMAN | F88: SNOW | I88: ARRIGO | L88: EDWARDS | N88: SOMMERVILLE | Q88: HINKLEY
A89: GOALKICKERS
A90: FRANKSTON | C90: COUTTS 6 | E90: McNAB 3 | G90: McWILLIAMS 3 | J90: FYSON 3 | L90: LOVELOCK 3 | N90: VISSER 2 | P90: BLOOMFIELD | S90: FALKINER
A91: WERRIBEE | C91: HINKLEY 3 | F91: JOHNSON | I91: COMBEN | L91: PAICE | N91: SOMMERVILLE | Q91: FARRELLY
A93: CAULFIELD | C93: 7 | D93: 4 | E93: =C93*6+D93 -> 46 | G93: 9 | H93: 15 | I93: =G93*6+H93 -> 69 | K93: 14 | L93: 16 | M93: =K93*6+L93 -> 100 | O93: 18 | P93: 19 | Q93: =O93*6+P93 -> 127 | S93: PRINCES PARK, CAULFIELD
A94: MORDIALLOC | C94: 4 | D94: 1 | E94: =C94*6+D94 -> 25 | G94: 5 | H94: 2 | I94: =G94*6+H94 -> 32 | K94: 5 | L94: 3 | M94: =K94*6+L94 -> 33 | O94: 8 | P94: 5 | Q94: =O94*6+P94 -> 53 | S94: ANDERSON
A95: BEST PLAYERS
A96: CAULFIELD | C96: BAKER | F96: LOGAN | I96: GUINANE | L96: WHITE | N96: CLIFF | Q96: P ROBINSON
A97: MORDIALLOC | C97: SMITH | F97: HARRY | I97: SCAIFFE | L97: GARDNER | N97: GLOVER
A98: GOALKICKERS
A99: CAULFIELD | C99: BAKER 5 | F99: BROWN 3 | I99: CLIFF 3 | K99: LOGAN 3 | M99: P ROBINSON 2 | P99: WILLIAMS 2
A100: MORDIALLOC | C100: BROWN 3 | F100: SCAIFFE 3 | I100: HARRY | K100: LITTLE
A102: ROUND 3 | E102: 30TH APRIL | J102: WEATHER | S102: PLAYED AT
D103: 1ST QTR | H103: 2ND QTR | L103: 3RD QTR | P103: FINAL | S103: MORDIALLOC
A104: BRUNSWICK | C104: 6 | D104: 8 | E104: =C104*6+D104 -> 44 | G104: 7 | H104: 12 | I104: =G104*6+H104 -> 54 | K104: 12 | L104: 21 | M104: =K104*6+L104 -> 93 | O104: 17 | P104: 28 | Q104: =O104*6+P104 -> 130 | S104: UMPIRE | X104: LADDER | AB104: ROUND | AD104: 3
A105: MORDIALLOC | C105: 0 | D105: 1 | E105: =C105*6+D105 -> 1 | G105: 4 | H105: 7 | I105: =G105*6+H105 -> 31 | K105: 6 | L105: 9 | M105: =K105*6+L105 -> 45 | O105: 7 | P105: 13 | Q105: =O105*6+P105 -> 55 | S105: STIRLING
A106: BEST PLAYERS | W106: TEAM | X106: W | Y106: L | Z106: D | AA106: FOR | AB106: AGST | AC106: % | AD106: PTS
A107: BRUNSWICK | C107: SCHIMMELBUSCH | F107: I KENT | I107: OGSTON | L107: HADZILLIAS | O107: McKINNON | R107: McCABE
A108: MORDIALLOC | C108: GUY | F108: HARRY | I108: FAHEY | L108: LITTLE | O108: GARDNER | W108: GEELONG WEST | X108: 3 | Y108: 0 | Z108: 0 | AA108: 425 | AB108: 284 | AC108: =(AA108*100)/AB108 -> 149.64788732394365 | AD108: =(X108*4)+(Z108*2) -> 12
A109: GOALKICKERS | W109: CAULFIELD | X109: 3 | Y109: 0 | Z109: 0 | AA109: 393 | AB109: 288 | AC109: =(AA109*100)/AB109 -> 136.45833333333334 | AD109: =(X109*4)+(Z109*2) -> 12
A110: BRUNSWICK | C110: WHELAN 6 | F110: SCHIMMELBUSCH 5 | J110: OGSTON 4 | M110: O'BRIEN | O110: ALLEN | W110: NORTHCOTE | X110: 3 | Y110: 0 | Z110: 0 | AA110: 333 | AB110: 254 | AC110: =(AA110*100)/AB110 -> 131.10236220472441 | AD110: =(X110*4)+(Z110*2) -> 12
A111: MORDIALLOC | C111: HARRY 2 | F111: SCAIFFE 2 | I111: LITTLE | K111: SMITH | M111: FAHEY | W111: YARRAVILLE | X111: 2 | Y111: 1 | Z111: 0 | AA111: 398 | AB111: 291 | AC111: =(AA111*100)/AB111 -> 136.76975945017182 | AD111: =(X111*4)+(Z111*2) -> 8
A113: GEELONG WEST | C113: 0 | D113: 3 | E113: =C113*6+D113 -> 3 | G113: 13 | H113: 8 | I113: =G113*6+H113 -> 86 | K113: 21 | L113: 15 | M113: =K113*6+L113 -> 141 | O113: 26 | P113: 21 | Q113: =O113*6+P113 -> 177 | S113: BOX HILL | W113: FRANKSTON | X113: 1 | Y113: 2 | Z113: 0 | AA113: 356 | AB113: 304 | AC113: =(AA113*100)/AB113 -> 117.10526315789474 | AD113: =(X113*4)+(Z113*2) -> 4
A114: BOX HILL | C114: 3 | D114: 4 | E114: =C114*6+D114 -> 22 | G114: 7 | H114: 4 | I114: =G114*6+H114 -> 46 | K114: 10 | L114: 5 | M114: =K114*6+L114 -> 65 | O114: 16 | P114: 9 | Q114: =O114*6+P114 -> 105 | S114: ABBOTT | W114: BRUNSWICK | X114: 1 | Y114: 2 | Z114: 0 | AA114: 294 | AB114: 301 | AC114: =(AA114*100)/AB114 -> 97.674418604651166 | AD114: =(X114*4)+(Z114*2) -> 4
A115: BEST PLAYERS | W115: BOX HILL | X115: 1 | Y115: 2 | Z115: 0 | AA115: 315 | AB115: 368 | AC115: =(AA115*100)/AB115 -> 85.597826086956516 | AD115: =(X115*4)+(Z115*2) -> 4
A116: GEELONG WEST | C116: DEEATH | F116: R BROWNE | I116: McLEAN | L116: COLLEY | O116: LINKE | Q116: GOGGIN | W116: CAMBERWELL | X116: 1 | Y116: 2 | Z116: 0 | AA116: 299 | AB116: 365 | AC116: =(AA116*100)/AB116 -> 81.917808219178085 | AD116: =(X116*4)+(Z116*2) -> 4
A117: BOX HILL | C117: HUMPHREY | F117: RALPH | I117: SMITH | L117: THOMPSON | O117: VICK | Q117: COSTELLO | W117: WERRIBEE | X117: 0 | Y117: 3 | Z117: 0 | AA117: 280 | AB117: 409 | AC117: =(AA117*100)/AB117 -> 68.459657701711492 | AD117: =(X117*4)+(Z117*2) -> 0
A118: GOALKICKERS | W118: MORDIALLOC | X118: 0 | Y118: 3 | Z118: 0 | AA118: 190 | AB118: 419 | AC118: =(AA118*100)/AB118 -> 45.346062052505964 | AD118: =(X118*4)+(Z118*2) -> 0
A119: GEELONG WEST | C119: McLEAN 10 | F119: C SMITH 4 | H119: LINKE 3 | J119: GOGGIN 2 | L119: R BROWNE 2 | O119: COLLEY 2 | Q119: M BROWNE | S119: KEANE | U119: DEEATH
A120: BOX HILL | C120: SMITH 4 | E120: COSTELLO 4 | G120: COLE 2 | I120: THOMPSON 2 | L120: McNAMEE | N120: JUDD | O120: COBAIN | Q120: DOULIS
O121: BOYD | Q121: 1
A122: NORTHCOTE | C122: 4 | D122: 3 | E122: =C122*6+D122 -> 27 | G122: 8 | H122: 5 | I122: =G122*6+H122 -> 53 | K122: 11 | L122: 6 | M122: =K122*6+L122 -> 72 | O122: 16 | P122: 8 | Q122: =O122*6+P122 -> 104 | S122: FRANKSTON
A123: FRANKSTON | C123: 1 | D123: 9 | E123: =C123*6+D123 -> 15 | G123: 4 | H123: 18 | I123: =G123*6+H123 -> 42 | K123: 8 | L123: 19 | M123: =K123*6+L123 -> 67 | O123: 9 | P123: 21 | Q123: =O123*6+P123 -> 75 | S123: FLANAGAN
A124: BEST PLAYERS
A125: NORTHCOTE | C125: HAMPSON | F125: KOZARIS | I125: LEACH | L125: COHEN | O125: McNEILL | R125: SMITH
A126: FRANKSTON | C126: McNAB | F126: McWILLIAMS | I126: SHEPHERD | L126: ROWE | O126: ROSENBROCK | R126: VISSER
A127: GOALKICKERS
A128: NORTHCOTE | C128: COHEN 6 | F128: RYAN 3 | H128: McNEILL 2 | K128: KOZARIS 2 | N128: HAMPSON 2 | Q128: KILKENNY
A129: FRANKSTON | C129: McNAB 4 | F129: McWILLIAMS | I129: COUTTS | K129: LOVELOCK | N129: FYSON | P129: RIDOUT
A131: CAULFIELD | C131: 6 | D131: 4 | E131: =C131*6+D131 -> 40 | G131: 10 | H131: 6 | I131: =G131*6+H131 -> 66 | K131: 14 | L131: 10 | M131: =K131*6+L131 -> 94 | O131: 20 | P131: 14 | Q131: =O131*6+P131 -> 134 | S131: WERRIBEE
A132: WERRIBEE | C132: 5 | D132: 1 | E132: =C132*6+D132 -> 31 | G132: 9 | H132: 7 | I132: =G132*6+H132 -> 61 | K132: 12 | L132: 11 | M132: =K132*6+L132 -> 83 | O132: 16 | P132: 12 | Q132: =O132*6+P132 -> 108 | S132: GAMBETTA
A133: BEST PLAYERS
A134: CAULFIELD | C134: WHITE | F134: TEMPEST | I134: CLIFF | L134: BAKER | O134: GUINANE | Q134: JEWELL
A135: WERRIBEE | C135: ARRIGO | F135: HART | I135: PANETTA | L135: RIDDELL | O135: HINKLEY | Q135: BOURKE
A136: GOALKICKERS
A137: CAULFIELD | C137: BROWN 3 | E137: ROBINSON 3 | G137: BAKER 3 | I137: ARRELL 3 | K137: JEWELL 3 | M137: WILLIAMS 2 | P137: WILLIAMS | S137: CLIFF | U137: ARRELL | W137: CROOKS
A138: WERRIBEE | C138: BRYANT 4 | E138: RIDDELL 3 | H138: ARRIGO 2 | J138: COMBEN 2 | M138: SNOW 2 | O138: SOMMERVILLE | R138: PLUMMER
A140: YARRAVILLE | C140: 6 | D140: 4 | E140: =C140*6+D140 -> 40 | G140: 12 | H140: 7 | I140: =G140*6+H140 -> 79 | K140: 15 | L140: 13 | M140: =K140*6+L140 -> 103 | O140: 22 | P140: 19 | Q140: =O140*6+P140 -> 151 | S140: YARRAVILLE
A141: CAMBERWELL | C141: 2 | D141: 2 | E141: =C141*6+D141 -> 14 | G141: 7 | H141: 5 | I141: =G141*6+H141 -> 47 | K141: 12 | L141: 6 | M141: =K141*6+L141 -> 78 | O141: 15 | P141: 13 | Q141: =O141*6+P141 -> 103 | S141: HUXTABLE
A142: BEST PLAYERS
A143: YARRAVILLE | C143: WAGHORNE | F143: DOLL | I143: QUARANTOTTO | L143: BROWN | O143: KNOTT | R143: MATHESON
A144: CAMBERWELL | C144: SIMPSON | F144: HAMMOND | I144: STONE | L144: BAKER | O144: HAZLETT | R144: McDONALD
A145: GOALKICKERS
A146: YARRAVILLE | C146: KNOTT 6 | E146: McLAREN 3 | G146: STONE 2 | I146: BROWN 2 | K146: BRENNAN 2 | N146: QUARANTOTTO 2 | R146: MATHESON 2 | U146: BATES | W146: WAGHORNE | X146: STURNEIKS
A147: CAMBERWELL | C147: HAMMOND 4 | F147: STONE 3 | H147: EDWARDS 2 | K147: BAKER 2 | M147: HAZLETT 2 | O147: DOHERTY | R147: SIMPSON
A149: ROUND 4 | E149: 7TH MAY | J149: WEATHER | S149: PLAYED AT
D150: 1ST QTR | H150: 2ND QTR | L150: 3RD QTR | P150: FINAL | S150: NORTHCOTE
A151: NORTHCOTE | C151: 4 | D151: 3 | E151: =C151*6+D151 -> 27 | G151: 13 | H151: 8 | I151: =G151*6+H151 -> 86 | K151: 14 | L151: 14 | M151: =K151*6+L151 -> 98 | O151: 18 | P151: 18 | Q151: =O151*6+P151 -> 126 | S151: UMPIRE | X151: LADDER | AB151: ROUND | AD151: 4
A152: BOX HILL | C152: 3 | D152: 1 | E152: =C152*6+D152 -> 19 | G152: 8 | H152: 3 | I152: =G152*6+H152 -> 51 | K152: 13 | L152: 7 | M152: =K152*6+L152 -> 85 | O152: 13 | P152: 16 | Q152: =O152*6+P152 -> 94 | S152: JACKSON
A153: BEST PLAYERS | W153: TEAM | X153: W | Y153: L | Z153: D | AA153: FOR | AB153: AGST | AC153: % | AD153: PTS
A154: NORTHCOTE | C154: HAMPSON | F154: KILKENNY | I154: COHEN | L154: LEACH | N154: KOZARIS | Q154: McGORLICK
A155: BOX HILL | C155: VICK | F155: RALPH | I155: HUMPHREY | L155: DULIS | N155: HUNT | Q155: THOMPSON | W155: GEELONG WEST | X155: 4 | Y155: 0 | Z155: 0 | AA155: 603 | AB155: 311 | AC155: =(AA155*100)/AB155 -> 193.89067524115757 | AD155: =(X155*4)+(Z155*2) -> 16
A156: GOALKICKERS | W156: NORTHCOTE | X156: 4 | Y156: 0 | Z156: 0 | AA156: 459 | AB156: 348 | AC156: =(AA156*100)/AB156 -> 131.89655172413794 | AD156: =(X156*4)+(Z156*2) -> 16
A157: NORTHCOTE | C157: COHEN 5 | E157: HAMPSON 3 | G157: KILKENNY 3 | J157: McNEILL 3 | L157: MARTIN 2 | O157: KOZARIS | Q157: WILLIAMS | W157: CAULFIELD | X157: 4 | Y157: 0 | Z157: 0 | AA157: 535 | AB157: 412 | AC157: =(AA157*100)/AB157 -> 129.85436893203882 | AD157: =(X157*4)+(Z157*2) -> 16
A158: BOX HILL | C158: COBAIN 3 | E158: SMITH 2 | G158: DOULIS 2 | I158: JUDD 2 | K158: VICK 2 | M158: COSTELLO | O158: COLE | W158: YARRAVILLE | X158: 3 | Y158: 1 | Z158: 0 | AA158: 544 | AB158: 383 | AC158: =(AA158*100)/AB158 -> 142.03655352480419 | AD158: =(X158*4)+(Z158*2) -> 12
A160: YARRAVILLE | C160: 4 | D160: 4 | E160: =C160*6+D160 -> 28 | G160: 8 | H160: 12 | I160: =G160*6+H160 -> 60 | K160: 12 | L160: 13 | M160: =K160*6+L160 -> 85 | O160: 21 | P160: 20 | Q160: =O160*6+P160 -> 146 | S160: BRUNSWICK | W160: CAMBERWELL | X160: 2 | Y160: 2 | Z160: 0 | AA160: 493 | AB160: 470 | AC160: =(AA160*100)/AB160 -> 104.8936170212766 | AD160: =(X160*4)+(Z160*2) -> 8
A161: BRUNSWICK | C161: 4 | D161: 6 | E161: =C161*6+D161 -> 30 | G161: 6 | H161: 9 | I161: =G161*6+H161 -> 45 | K161: 9 | L161: 17 | M161: =K161*6+L161 -> 71 | O161: 12 | P161: 20 | Q161: =O161*6+P161 -> 92 | S161: ANDERSON | W161: FRANKSTON | X161: 1 | Y161: 3 | Z161: 0 | AA161: 480 | AB161: 446 | AC161: =(AA161*100)/AB161 -> 107.62331838565022 | AD161: =(X161*4)+(Z161*2) -> 4
A162: BEST PLAYERS | W162: BRUNSWICK | X162: 1 | Y162: 3 | Z162: 0 | AA162: 386 | AB162: 447 | AC162: =(AA162*100)/AB162 -> 86.353467561521256 | AD162: =(X162*4)+(Z162*2) -> 4
A163: YARRAVILLE | C163: MARTIN | F163: MATHESON | I163: BROWN | L163: WAGHORNE | O163: KNOTT | R163: JAMES | W163: BOX HILL | X163: 1 | Y163: 3 | Z163: 0 | AA163: 409 | AB163: 494 | AC163: =(AA163*100)/AB163 -> 82.793522267206484 | AD163: =(X163*4)+(Z163*2) -> 4
A164: BRUNSWICK | C164: MCKINNON | F164: HORSINGTON | I164: GENT | L164: DIMMATINA | O164: WHELAN | W164: WERRIBEE | X164: 0 | Y164: 4 | Z164: 0 | AA164: 385 | AB164: 603 | AC164: =(AA164*100)/AB164 -> 63.847429519071312 | AD164: =(X164*4)+(Z164*2) -> 0
A165: GOALKICKERS | P165: BATES | W165: MORDIALLOC | X165: 0 | Y165: 4 | Z165: 0 | AA165: 217 | AB165: 597 | AC165: =(AA165*100)/AB165 -> 36.348408710217754 | AD165: =(X165*4)+(Z165*2) -> 0
A166: YARRAVILLE | C166: DOWLING 4 | F166: KNOTT 3 | H166: JAMES 3 | J166: BRENNAN 3 | L166: MATHESON 3 | O166: MCLAREN 2 | R166: BROWN | T166: QUARANTOTTO
A167: BRUNSWICK | C167: WHELAN 5 | F167: DIMMATINA 2 | I167: OGSTON | K167: SCHIMMELBUSCH | O167: ALLEN | Q167: DALTON | S167: PERRY
A169: CAMBERWELL | C169: 2 | D169: 3 | E169: =C169*6+D169 -> 15 | G169: 10 | H169: 8 | I169: =G169*6+H169 -> 68 | K169: 19 | L169: 11 | M169: =K169*6+L169 -> 125 | O169: 30 | P169: 14 | Q169: =O169*6+P169 -> 194 | S169: CAMBERWELL
A170: WERRIBEE | C170: 4 | D170: 4 | E170: =C170*6+D170 -> 28 | G170: 7 | H170: 7 | I170: =G170*6+H170 -> 49 | K170: 11 | L170: 8 | M170: =K170*6+L170 -> 74 | O170: 16 | P170: 9 | Q170: =O170*6+P170 -> 105 | S170: O'NEILL
A171: BEST PLAYERS
A172: CAMBERWELL | C172: HAZLETT | F172: STONE | I172: HOOK | L172: SIMPSON | O172: HAMMOND | R172: SMITH
A173: WERRIBEE | C173: SNOW | F173: HART | I173: FARRELLY | L173: HINKLEY | O173: PLUMMER | R173: BOURKE
A174: GOALKICKERS
A175: CAMBERWELL | C175: HAMMOND 7 | F175: EDWARDS 5 | I175: PHILLIPS 3 | K175: BAKER 3 | M175: BRYANS 2 | O175: BURGIN 2 | Q175: BOYD 2 | S175: SIMPSON 2 | V175: STONE 2 | X175: HAZLETT | Z175: FOX
A176: WERRIBEE | C176: HART 4 | E176: SNOW 3 | G176: SOMMERVILLE 2 | J176: ARRIGO | L176: BUTTON | N176: WHITEHEAD | Q176: PLUMMER | S176: RIDDELL | U176: McNAUGHTON | X176: GOLDBERG
A178: CAULFIELD | C178: 4 | D178: 3 | E178: =C178*6+D178 -> 27 | G178: 11 | H178: 8 | I178: =G178*6+H178 -> 74 | K178: 16 | L178: 9 | M178: =K178*6+L178 -> 105 | O178: 21 | P178: 16 | Q178: =O178*6+P178 -> 142 | S178: PRINCES PARK, CAULFIELD
A179: FRANKSTON | C179: 4 | D179: 5 | E179: =C179*6+D179 -> 29 | G179: 9 | H179: 6 | I179: =G179*6+H179 -> 60 | K179: 13 | L179: 9 | M179: =K179*6+L179 -> 87 | O179: 18 | P179: 16 | Q179: =O179*6+P179 -> 124 | S179: McMASTER
A180: BEST PLAYERS
A181: CAULFIELD | C181: LOGAN | F181: ARRELL | I181: GUINANE | L181: JEWELL | O181: BAKER | Q181: BROWN
A182: FRANKSTON | C182: SKREJA | F182: BREMNER | I182: BLOOMFIELD | L182: ROSENBROCK | O182: McNAB | Q182: LOVELOCK
A183: GOALKICKERS
A184: CAULFIELD | C184: BROWN 8 | F184: ARRELL 3 | I184: LOGSN 3 | K184: BAKER 3 | M184: CRUND 2 | O184: NEIL | Q184: COLLINS
A185: FRANKSTON | C185: McNAB 5 | F185: HOUL 3 | H185: LOVELOCK 3 | K185: SKREJA 2 | M185: BLOOMFIELD 2 | P185: McWILLIAMS | S185: G ALDERSON | W185: BREMNER
A187: GEELONG WEST | C187: 2 | D187: 6 | E187: =C187*6+D187 -> 18 | G187: 11 | H187: 12 | I187: =G187*6+H187 -> 78 | K187: 18 | L187: 19 | M187: =K187*6+L187 -> 127 | O187: 25 | P187: 28 | Q187: =O187*6+P187 -> 178 | S187: GEELONG WEST
A188: MORDIALLOC | C188: 2 | D188: 2 | E188: =C188*6+D188 -> 14 | G188: 3 | H188: 3 | I188: =G188*6+H188 -> 21 | K188: 3 | L188: 3 | M188: =K188*6+L188 -> 21 | O188: 4 | P188: 3 | Q188: =O188*6+P188 -> 27 | S188: TORNEY
A189: BEST PLAYERS
A190: GEELONG WEST | C190: McLEAN | F190: DEEATH | I190: KEANE | L190: SMITH | O190: COLLEY | Q190: GOGGIN
A191: MORDIALLOC | C191: WISEMAN | F191: SMITH | I191: HARRY | L191: GARDNER | O191: SHUGG | Q191: BROWN
A192: GOALKICKERS
A193: GEELONG WEST | C193: McLEAN 13 | F193: KEANE 4 | I193: IRVINE 2 | K193: SMITH 2 | M193: MANSON | O193: GILLIES | Q193: DEEATH | S193: GOGGIN
A194: MORDIALLOC | C194: SMITH | E194: DEAN | G194: BROWN | I194: FAHEY
A196: ROUND 5 | E196: 14TH MAY | J196: WEATHER | S196: PLAYED AT
D197: 1ST QTR | H197: 2ND QTR | L197: 3RD QTR | P197: FINAL | S197: MORDIALLOC
A198: NORTHCOTE | C198: 3 | D198: 5 | E198: =C198*6+D198 -> 23 | G198: 9 | H198: 8 | I198: =G198*6+H198 -> 62 | K198: 16 | L198: 8 | M198: =K198*6+L198 -> 104 | O198: 22 | P198: 15 | Q198: =O198*6+P198 -> 147 | S198: UMPIRE | X198: LADDER | AB198: ROUND | AD198: 5
A199: MORDIALLOC | C199: 3 | D199: 3 | E199: =C199*6+D199 -> 21 | G199: 3 | H199: 8 | I199: =G199*6+H199 -> 26 | K199: 4 | L199: 12 | M199: =K199*6+L199 -> 36 | O199: 4 | P199: 15 | Q199: =O199*6+P199 -> 39 | S199: CARLISLE
A200: BEST PLAYERS | W200: TEAM | X200: W | Y200: L | Z200: D | AA200: FOR | AB200: AGST | AC200: % | AD200: PTS
A201: NORTHCOTE | C201: KOZARIS | F201: COHEN | I201: PITTS | L201: LEACH | O201: THORNELOE | R201: KILKENNY
A202: MORDIALLOC | C202: SMITH | F202: BROWN | I202: HARRY | L202: BLACKBURN | W202: GEELONG WEST | X202: 5 | Y202: 0 | Z202: 0 | AA202: 738 | AB202: 387 | AC202: =(AA202*100)/AB202 -> 190.69767441860466 | AD202: =(X202*4)+(Z202*2) -> 20
A203: GOALKICKERS | Q203: RYAN | W203: NORTHCOTE | X203: 5 | Y203: 0 | Z203: 0 | AA203: 606 | AB203: 387 | AC203: =(AA203*100)/AB203 -> 156.58914728682171 | AD203: =(X203*4)+(Z203*2) -> 20
A204: NORTHCOTE | C204: COHEN 9 | E204: THORNELOE 3 | H204: MARTIN 2 | J204: KOZARIS 2 | L204: HAMPSON 2 | O204: HOUGH | Q204: KILKENNY | S204: McNEILL | W204: CAULFIELD | X204: 5 | Y204: 0 | Z204: 0 | AA204: 651 | AB204: 478 | AC204: =(AA204*100)/AB204 -> 136.19246861924685 | AD204: =(X204*4)+(Z204*2) -> 20
A205: MORDIALLOC | C205: BROWN 2 | F205: JOHNSON | I205: HARRY | W205: YARRAVILLE | X205: 3 | Y205: 1 | Z205: 1 | AA205: 679 | AB205: 518 | AC205: =(AA205*100)/AB205 -> 131.08108108108109 | AD205: =(X205*4)+(Z205*2) -> 14
A207: BOX HILL | C207: 2 | D207: 1 | E207: =C207*6+D207 -> 13 | G207: 6 | H207: 6 | I207: =G207*6+H207 -> 42 | K207: 10 | L207: 7 | M207: =K207*6+L207 -> 67 | O207: 14 | P207: 13 | Q207: =O207*6+P207 -> 97 | S207: BOX HILL | W207: CAMBERWELL | X207: 2 | Y207: 3 | Z207: 0 | AA207: 569 | AB207: 605 | AC207: =(AA207*100)/AB207 -> 94.049586776859499 | AD207: =(X207*4)+(Z207*2) -> 8
A208: FRANKSTON | C208: 3 | D208: 10 | E208: =C208*6+D208 -> 28 | G208: 7 | H208: 12 | I208: =G208*6+H208 -> 54 | K208: 8 | L208: 15 | M208: =K208*6+L208 -> 63 | O208: 12 | P208: 16 | Q208: =O208*6+P208 -> 88 | S208: GAMBETTA | W208: BOX HILL | X208: 2 | Y208: 3 | Z208: 0 | AA208: 506 | AB208: 582 | AC208: =(AA208*100)/AB208 -> 86.941580756013749 | AD208: =(X208*4)+(Z208*2) -> 8
A209: BEST PLAYERS | W209: FRANKSTON | X209: 1 | Y209: 4 | Z209: 0 | AA209: 568 | AB209: 543 | AC209: =(AA209*100)/AB209 -> 104.60405156537753 | AD209: =(X209*4)+(Z209*2) -> 4
A210: BOX HILL | C210: RALPH | F210: HUMPHREY | I210: BRYANT | L210: BAKER | N210: DOULIS | Q210: COSTELLO | W210: BRUNSWICK | X210: 1 | Y210: 4 | Z210: 0 | AA210: 452 | AB210: 563 | AC210: =(AA210*100)/AB210 -> 80.284191829484897 | AD210: =(X210*4)+(Z210*2) -> 4
A211: FRANKSTON | C211: COOPER | F211: RENOUF | I211: FALKINER | L211: ROWE | N211: SUTTON | Q211: VAUGHAN | W211: WERRIBEE | X211: 0 | Y211: 4 | Z211: 1 | AA211: 520 | AB211: 738 | AC211: =(AA211*100)/AB211 -> 70.460704607046068 | AD211: =(X211*4)+(Z211*2) -> 2
A212: GOALKICKERS | W212: MORDIALLOC | X212: 0 | Y212: 5 | Z212: 0 | AA212: 256 | AB212: 744 | AC212: =(AA212*100)/AB212 -> 34.408602150537632 | AD212: =(X212*4)+(Z212*2) -> 0
A213: BOX HILL | C213: COSTELLO 3 | F213: THOMPSON 3 | I213: VICK 2 | K213: WAOLE? 2 | N213: COBAIN | P213: DOULIS | R213: RONALDSON | U213: SMITH
A214: FRANKSTON | C214: SKREJA 3 | E214: BREMNER 3 | H214: CLARK 2 | J214: BUNN | L214: FALKINER | N214: McNAB | P214: SUTTON
A216: WERRIBEE | C216: 4 | D216: 6 | E216: =C216*6+D216 -> 30 | G216: 10 | H216: 8 | I216: =G216*6+H216 -> 68 | K216: 15 | L216: 12 | M216: =K216*6+L216 -> 102 | O216: 20 | P216: 15 | Q216: =O216*6+P216 -> 135 | S216: WERRIBEE
A217: YARRAVILLE | C217: 5 | D217: 4 | E217: =C217*6+D217 -> 34 | G217: 7 | H217: 13 | I217: =G217*6+H217 -> 55 | K217: 14 | L217: 20 | M217: =K217*6+L217 -> 104 | O217: 18 | P217: 27 | Q217: =O217*6+P217 -> 135 | S217: TORNEY
A218: BEST PLAYERS
A219: WERRIBEE | C219: HINKLEY | F219: BRYANT | I219: COMBEN | L219: LEECE | N219: PLUMMER | Q219: SNOW
A220: YARRAVILLE | C220: KNOTT | F220: BRENNAN | I220: STONE | L220: BROWN | N220: STURNEIKS | Q220: P SMITH
A221: GOALKICKERS
A222: WERRIBEE | C222: LEECE 5 | E222: SNOW 4 | G222: PLUMMER 3 | J222: McNAUGHTON 2 | N222: HART 2 | P222: COMBEN 2 | R222: BRYANT 2
A223: YARRAVILLE | C223: BRENNAN 4 | F223: JAMES 4 | H223: MARTIN 3 | J223: DOWLING 2 | M223: KNOTT 2 | O223: TAURINS | Q223: MATHESON | U223: 1 SHORT
A225: GEELONG WEST | C225: 4 | D225: 3 | E225: =C225*6+D225 -> 27 | G225: 11 | H225: 7 | I225: =G225*6+H225 -> 73 | K225: 15 | L225: 10 | M225: =K225*6+L225 -> 100 | O225: 20 | P225: 15 | Q225: =O225*6+P225 -> 135 | S225: CAMBERWELL
A226: CAMBERWELL | C226: 1 | D226: 6 | E226: =C226*6+D226 -> 12 | G226: 3 | H226: 7 | I226: =G226*6+H226 -> 25 | K226: 8 | L226: 8 | M226: =K226*6+L226 -> 56 | O226: 11 | P226: 10 | Q226: =O226*6+P226 -> 76 | S226: FLANAGAN
A227: BEST PLAYERS
A228: GEELONG WEST | C228: LINKE | F228: DEEATH | I228: GILLIES | L228: McLEAN | N228: GOGGIN
A229: CAMBERWELL | C229: MORRIS | F229: SIMPSON | I229: HAMMOND | L229: PHILLIPS | N229: FOX
A230: GOALKICKERS
A231: GEELONG WEST | C231: McLEAN 9 | F231: LINKE 5 | H231: R BROWNE 2 | K231: MANSON | M231: SMITH | O231: M BROWNE | R231: DEEATH
A232: CAMBERWELL | C232: HAMMOND 4 | F232: PHILLIPS 2 | I232: SIMPSON 2 | L232: MORRIS 2 | O232: HAZLETT
A234: CAULFIELD | C234: 5 | D234: 2 | E234: =C234*6+D234 -> 32 | G234: 8 | H234: 5 | I234: =G234*6+H234 -> 53 | K234: 13 | L234: 11 | M234: =K234*6+L234 -> 89 | O234: 17 | P234: 14 | Q234: =O234*6+P234 -> 116 | S234: PRINCES PARK, CAULFIELD
A235: BRUNSWICK | C235: 4 | D235: 4 | E235: =C235*6+D235 -> 28 | G235: 5 | H235: 6 | I235: =G235*6+H235 -> 36 | K235: 7 | L235: 9 | M235: =K235*6+L235 -> 51 | O235: 9 | P235: 12 | Q235: =O235*6+P235 -> 66 | S235: ABBOTT
A236: BEST PLAYERS
A237: CAULFIELD | C237: BAKER | F237: ARRELL | I237: COLLINS | L237: CLIFF | N237: WHITE | Q237: GUINANE
A238: BRUNSWICK | C238: GENT | F238: McKILLOP | I238: SCHIMMELBUSCH | M238: LIAKOUREAS | P238: McCABE | R238: HORSINGTON
A239: GOALKICKERS
A240: CAULFIELD | C240: RONALDSON 4 | F240: LOGAN 4 | H240: BAKER 3 | J240: COLLINS 2 | L240: GOWANS 2 | O240: ARRELL | Q240: WHITE
A241: BRUNSWICK | C241: WHELAN 3 | F241: WROUT | H241: O'BRIEN | J241: SCHIMMELBUSCH | N241: HOWARD | Q241: DALTON | S241: HORSINGTON
A243: ROUND 6 | E243: 21ST MAY | J243: WEATHER | S243: PLAYED AT
D244: 1ST QTR | H244: 2ND QTR | L244: 3RD QTR | P244: FINAL | S244: BOX HILL
A245: BOX HILL | C245: 6 | D245: 5 | E245: =C245*6+D245 -> 41 | G245: 15 | H245: 11 | I245: =G245*6+H245 -> 101 | K245: 21 | L245: 17 | M245: =K245*6+L245 -> 143 | O245: 29 | P245: 24 | Q245: =O245*6+P245 -> 198 | S245: UMPIRE | X245: LADDER | AB245: ROUND | AD245: 6
A246: WERRIBEE | C246: 4 | D246: 3 | E246: =C246*6+D246 -> 27 | G246: 9 | H246: 4 | I246: =G246*6+H246 -> 58 | K246: 10 | L246: 11 | M246: =K246*6+L246 -> 71 | O246: 11 | P246: 14 | Q246: =O246*6+P246 -> 80 | S246: CARLILE
A247: BEST PLAYERS | W247: TEAM | X247: W | Y247: L | Z247: D | AA247: FOR | AB247: AGST | AC247: % | AD247: PTS
A248: BOX HILL | C248: JUDD | F248: BRYANT | I248: SMITH | L248: DEED | O248: RALPH | Q248: COSTELLO
A249: WERRIBEE | C249: HINKLEY | F249: HART | I249: BOURKE | L249: COMBEN | O249: KELLY | Q249: BRYANT | W249: GEELONG WEST | X249: 6 | Y249: 0 | Z249: 0 | AA249: 884 | AB249: 486 | AC249: =(AA249*100)/AB249 -> 181.89300411522635 | AD249: =(X249*4)+(Z249*2) -> 24
A250: GOALKICKERS | W250: CAULFIELD | X250: 6 | Y250: 0 | Z250: 0 | AA250: 770 | AB250: 543 | AC250: =(AA250*100)/AB250 -> 141.804788213628 | AD250: =(X250*4)+(Z250*2) -> 24
A251: BOX HILL | C251: JUDD 9 | E251: BRYANT 4 | G251: SMITH 4 | I251: COSTELLO 4 | K251: WALKER 3 | N251: DOULIS 2 | P251: THOMPSON 2 | S251: COBAIN | W251: NORTHCOTE | X251: 5 | Y251: 1 | Z251: 0 | AA251: 705 | AB251: 533 | AC251: =(AA251*100)/AB251 -> 132.27016885553471 | AD251: =(X251*4)+(Z251*2) -> 20
A252: WERRIBEE | C252: HART 3 | E252: BRYANT 2 | G252: WHITEHEAD 2 | J252: BOURKE 2 | L252: HINKLEY | N252: SNOW | W252: YARRAVILLE | X252: 3 | Y252: 2 | Z252: 1 | AA252: 744 | AB252: 637 | AC252: =(AA252*100)/AB252 -> 116.79748822605966 | AD252: =(X252*4)+(Z252*2) -> 14
A254: MORDIALLOC | C254: 7 | D254: 1 | E254: =C254*6+D254 -> 43 | G254: 10 | H254: 5 | I254: =G254*6+H254 -> 65 | K254: 15 | L254: 7 | M254: =K254*6+L254 -> 97 | O254: 19 | P254: 12 | Q254: =O254*6+P254 -> 126 | S254: FRANKSTON | W254: BOX HILL | X254: 3 | Y254: 3 | Z254: 0 | AA254: 704 | AB254: 662 | AC254: =(AA254*100)/AB254 -> 106.34441087613293 | AD254: =(X254*4)+(Z254*2) -> 12
A255: FRANKSTON | C255: 4 | D255: 2 | E255: =C255*6+D255 -> 26 | G255: 4 | H255: 11 | I255: =G255*6+H255 -> 35 | K255: 7 | L255: 16 | M255: =K255*6+L255 -> 58 | O255: 16 | P255: 21 | Q255: =O255*6+P255 -> 117 | S255: McBAIN | W255: CAMBERWELL | X255: 2 | Y255: 4 | Z255: 0 | AA255: 664 | AB255: 709 | AC255: =(AA255*100)/AB255 -> 93.653032440056421 | AD255: =(X255*4)+(Z255*2) -> 8
A256: BEST PLAYERS | W256: BRUNSWICK | X256: 2 | Y256: 4 | Z256: 0 | AA256: 556 | AB256: 658 | AC256: =(AA256*100)/AB256 -> 84.498480243161097 | AD256: =(X256*4)+(Z256*2) -> 8
A257: MORDIALLOC | C257: THOMPSON | F257: SMITH | I257: JOHNSON | L257: SHUGG | O257: GLOVER | R257: GUY | W257: FRANKSTON | X257: 1 | Y257: 5 | Z257: 0 | AA257: 685 | AB257: 669 | AC257: =(AA257*100)/AB257 -> 102.39162929745889 | AD257: =(X257*4)+(Z257*2) -> 4
A258: FRANKSTON | C258: McNAB | F258: LOVELOCK | I258: VISSER | L258: ROWE | O258: BREMNER | R258: SKREJA | W258: MORDIALLOC | X258: 1 | Y258: 5 | Z258: 0 | AA258: 382 | AB258: 861 | AC258: =(AA258*100)/AB258 -> 44.367015098722419 | AD258: =(X258*4)+(Z258*2) -> 4
A259: GOALKICKERS | W259: WERRIBEE | X259: 0 | Y259: 5 | Z259: 1 | AA259: 600 | AB259: 936 | AC259: =(AA259*100)/AB259 -> 64.102564102564102 | AD259: =(X259*4)+(Z259*2) -> 2
A260: MORDIALLOC | C260: THOMPSON 5 | F260: SHUGG 4 | H260: SMITH 3 | J260: SCAIFFE 2 | M260: HARRIS 2 | O260: GLOVER | Q260: FAHEY | S260: JOHNSON
A261: FRANKSTON | C261: LOVELOCK 5 | F261: JUNGWIRTH 4 | I261: McNAB 2 | K261: SKREJA | M261: RIDSDALE | O261: RENOUF | Q261: BLOOMFIELD | T261: SIEDE
A263: GEELONG WEST | C263: 5 | D263: 4 | E263: =C263*6+D263 -> 34 | G263: 12 | H263: 4 | I263: =G263*6+H263 -> 76 | K263: 17 | L263: 6 | M263: =K263*6+L263 -> 108 | O263: 23 | P263: 8 | Q263: =O263*6+P263 -> 146 | S263: GEELONG WEST
A264: NORTHCOTE | C264: 1 | D264: 3 | E264: =C264*6+D264 -> 9 | G264: 5 | H264: 7 | I264: =G264*6+H264 -> 37 | K264: 11 | L264: 8 | M264: =K264*6+L264 -> 74 | O264: 14 | P264: 15 | Q264: =O264*6+P264 -> 99 | S264: McMASTER
A265: BEST PLAYERS
A266: GEELONG WEST | C266: GOGGIN | F266: HALL | I266: GRATTON | L266: BARRY | O266: DEEATH | R266: R BROWNE
A267: NORTHCOTE | C267: RYAN | F267: SMITH | I267: HAMPSON | L267: THORNELOE | O267: MARTIN
A268: GOALKICKERS
A269: GEELONG WEST | C269: McLEAN 5 | F269: M BROWNE 4 | I269: GOGGIN 4 | K269: SMITH 3 | M269: LINKE 2 | O269: MANSON | Q269: R BROWNE | S269: DEEATH | U269: COLLEY | W269: KEANE
A270: NORTHCOTE | C270: COHEN 3 | F270: HAMPSON 3 | I270: RYAN 3 | K270: MARTIN | M270: STANLEY | O270: KOZARIS | Q270: McNEILL | T270: THORNELOE
A272: BRUNSWICK | C272: 4 | D272: 4 | E272: =C272*6+D272 -> 28 | G272: 8 | H272: 11 | I272: =G272*6+H272 -> 59 | K272: 10 | L272: 16 | M272: =K272*6+L272 -> 76 | O272: 14 | P272: 20 | Q272: =O272*6+P272 -> 104 | S272: BRUNSWICK
A273: CAMBERWELL | C273: 3 | D273: 7 | E273: =C273*6+D273 -> 25 | G273: 5 | H273: 9 | I273: =G273*6+H273 -> 39 | K273: 9 | L273: 14 | M273: =K273*6+L273 -> 68 | O273: 13 | P273: 17 | Q273: =O273*6+P273 -> 95 | S273: HAYES
A274: BEST PLAYERS
A275: BRUNSWICK | C275: LIAKOUREAS | F275: SCHIMMELBUSCH | J275: DALTON | M275: WROUT | O275: HIGH | Q275: HOWARD
A276: CAMBERWELL | C276: FOX | F276: BRAYNE | J276: BAKER | M276: MAGNABOSCO | P276: HAZLETT
A277: GOALKICKERS
A278: BRUNSWICK | C278: WHELAN 4 | F278: HOWARD 3 | I278: SCHIMMELBUSCH 3 | M278: OGSTON | O278: LIAKOUREAS | R278: DATSON | U278: BRIGHAM
A279: CAMBERWELL | C279: HAMMOND 4 | F279: EDWARDS 3 | I279: BAKER 3 | L279: HAZLETT 3
A281: CAULFIELD | C281: 4 | D281: 7 | E281: =C281*6+D281 -> 31 | G281: 8 | H281: 13 | I281: =G281*6+H281 -> 61 | K281: 14 | L281: 18 | M281: =K281*6+L281 -> 102 | O281: 16 | P281: 23 | Q281: =O281*6+P281 -> 119 | S281: YARRAVILLE
A282: YARRAVILLE | C282: 0 | D282: 1 | E282: =C282*6+D282 -> 1 | G282: 4 | H282: 2 | I282: =G282*6+H282 -> 26 | K282: 5 | L282: 8 | M282: =K282*6+L282 -> 38 | O282: 9 | P282: 11 | Q282: =O282*6+P282 -> 65 | S282: STIRLING
A283: BEST PLAYERS
A284: CAULFIELD | C284: GOWANS | F284: BAKER | I284: ROBINSON | L284: LOGAN | N284: FELDMANN | Q284: BROWN
A285: YARRAVILLE | C285: SQUIRE | F285: WAGHORNE | I285: KNOTT | L285: RYAN | N285: SMITH | Q285: BROWN
A286: GOALKICKERS
A287: CAULFIELD | C287: BAKER 4 | F287: ROBINSON 4 | I287: BROWN 3 | K287: LOGAN 3 | M287: COLLINS | O287: HUNTER
A288: YARRAVILLE | C288: RYAN 2 | F288: McLAREN | H288: WHITTINGTON | K288: BROWN | M288: KNOTT | O288: JAMES | Q288: BRENNAN | S288: TAURINS
A290: ROUND 7 | E290: 28TH MAY | J290: WEATHER | S290: PLAYED AT
D291: 1ST QTR | H291: 2ND QTR | L291: 3RD QTR | P291: FINAL | S291: MORDIALLOC
A292: BOX HILL | C292: 4 | D292: 5 | E292: =C292*6+D292 -> 29 | G292: 7 | H292: 6 | I292: =G292*6+H292 -> 48 | K292: 11 | L292: 9 | M292: =K292*6+L292 -> 75 | O292: 22 | P292: 14 | Q292: =O292*6+P292 -> 146 | S292: UMPIRE | X292: LADDER | AB292: ROUND | AD292: 7
A293: MORDIALLOC | C293: 3 | D293: 4 | E293: =C293*6+D293 -> 22 | G293: 4 | H293: 5 | I293: =G293*6+H293 -> 29 | K293: 7 | L293: 8 | M293: =K293*6+L293 -> 50 | O293: 10 | P293: 13 | Q293: =O293*6+P293 -> 73 | S293: ABBOTT
A294: BEST PLAYERS | W294: TEAM | X294: W | Y294: L | Z294: D | AA294: FOR | AB294: AGST | AC294: % | AD294: PTS
A295: BOX HILL | C295: BAKER | F295: BRYANT | I295: COBAIN | L295: THOMPSON | O295: DOULIS | R295: COSTELLO
A296: MORDIALLOC | C296: JOHNSON | F296: GARDNER | I296: LAUGHTON | L296: HARRY | O296: WISEMAN | R296: SMITH | W296: GEELONG WEST | X296: 7 | Y296: 0 | Z296: 0 | AA296: 1018 | AB296: 582 | AC296: =(AA296*100)/AB296 -> 174.91408934707903 | AD296: =(X296*4)+(Z296*2) -> 28
A297: GOALKICKERS | W297: CAULFIELD | X297: 7 | Y297: 0 | Z297: 0 | AA297: 926 | AB297: 632 | AC297: =(AA297*100)/AB297 -> 146.51898734177215 | AD297: =(X297*4)+(Z297*2) -> 28
A298: BOX HILL | C298: COSTELLO 5 | F298: SMITH 5 | H298: THOMPSON 4 | K298: COBAIN 3 | M298: DOULIS 2 | O298: BRYANT | Q298: VICK | R298: WALKER | W298: NORTHCOTE | X298: 5 | Y298: 2 | Z298: 0 | AA298: 794 | AB298: 657 | AC298: =(AA298*100)/AB298 -> 120.85235920852359 | AD298: =(X298*4)+(Z298*2) -> 20
A299: MORDIALLOC | C299: LAUGHLIN 4 | F299: JOHNSON 2 | I299: SMITH 2 | K299: WILKINS | M299: THOMPSON | W299: YARRAVILLE | X299: 4 | Y299: 2 | Z299: 1 | AA299: 868 | AB299: 726 | AC299: =(AA299*100)/AB299 -> 119.55922865013774 | AD299: =(X299*4)+(Z299*2) -> 18
A301: GEELONG WEST | C301: 3 | D301: 4 | E301: =C301*6+D301 -> 22 | G301: 7 | H301: 12 | I301: =G301*6+H301 -> 54 | K301: 11 | L301: 17 | M301: =K301*6+L301 -> 83 | O301: 19 | P301: 20 | Q301: =O301*6+P301 -> 134 | S301: FRANKSTON | W301: BOX HILL | X301: 4 | Y301: 3 | Z301: 0 | AA301: 850 | AB301: 735 | AC301: =(AA301*100)/AB301 -> 115.64625850340136 | AD301: =(X301*4)+(Z301*2) -> 16
A302: FRANKSTON | C302: 3 | D302: 3 | E302: =C302*6+D302 -> 21 | G302: 6 | H302: 5 | I302: =G302*6+H302 -> 41 | K302: 9 | L302: 10 | M302: =K302*6+L302 -> 64 | O302: 14 | P302: 12 | Q302: =O302*6+P302 -> 96 | W302: CAMBERWELL | X302: 2 | Y302: 5 | Z302: 0 | AA302: 753 | AB302: 865 | AC302: =(AA302*100)/AB302 -> 87.052023121387279 | AD302: =(X302*4)+(Z302*2) -> 8
A303: BEST PLAYERS | W303: BRUNSWICK | X303: 2 | Y303: 5 | Z303: 0 | AA303: 629 | AB303: 781 | AC303: =(AA303*100)/AB303 -> 80.537772087067864 | AD303: =(X303*4)+(Z303*2) -> 8
A304: GEELONG WEST | W304: WERRIBEE | X304: 1 | Y304: 5 | Z304: 1 | AA304: 723 | AB304: 1009 | AC304: =(AA304*100)/AB304 -> 71.655104063429135 | AD304: =(X304*4)+(Z304*2) -> 6
A305: FRANKSTON | W305: FRANKSTON | X305: 1 | Y305: 6 | Z305: 0 | AA305: 781 | AB305: 803 | AC305: =(AA305*100)/AB305 -> 97.260273972602747 | AD305: =(X305*4)+(Z305*2) -> 4
A306: GOALKICKERS | W306: MORDIALLOC | X306: 1 | Y306: 6 | Z306: 0 | AA306: 455 | AB306: 1007 | AC306: =(AA306*100)/AB306 -> 45.183714001986097 | AD306: =(X306*4)+(Z306*2) -> 4
A307: GEELONG WEST
A308: FRANKSTON
A310: YARRAVILLE | C310: 4 | D310: 5 | E310: =C310*6+D310 -> 29 | G310: 9 | H310: 10 | I310: =G310*6+H310 -> 64 | K310: 13 | L310: 14 | M310: =K310*6+L310 -> 92 | O310: 17 | P310: 22 | Q310: =O310*6+P310 -> 124 | S310: NORTHCOTE
A311: NORTHCOTE | C311: 3 | D311: 1 | E311: =C311*6+D311 -> 19 | G311: 8 | H311: 2 | I311: =G311*6+H311 -> 50 | K311: 10 | L311: 4 | M311: =K311*6+L311 -> 64 | O311: 14 | P311: 5 | Q311: =O311*6+P311 -> 89 | S311: GAMBETTA
A312: BEST PLAYERS
A313: YARRAVILLE | C313: WAGHORNE | F313: McLAREN | I313: STURNEIKS | L313: BROWN | O313: KNOTT | R313: SQUIRE
A314: NORTHCOTE | C314: McGORLICK | F314: COHEN | I314: KENNEALLY | L314: MARTIN | O314: KILKENNY | R314: PITTS
A315: GOALKICKERS
A316: YARRAVILLE | C316: McLAREN 6 | F316: KEENAN 4 | I316: KNOTT 2 | K316: TAURINS 2 | N316: SMITH | P316: BROWN | R316: MATHESON
A317: NORTHCOTE | C317: COHEN 6 | F317: KIKENNY 2 | I317: MARTIN | K317: STANLEY | M317: HAMPSON | O317: PITTS | Q317: TYERS | S317: WELLER
A319: WERRIBEE | C319: 3 | D319: 4 | E319: =C319*6+D319 -> 22 | G319: 9 | H319: 9 | I319: =G319*6+H319 -> 63 | K319: 15 | L319: 11 | M319: =K319*6+L319 -> 101 | O319: 18 | P319: 15 | Q319: =O319*6+P319 -> 123 | S319: WERRIBEE
A320: BRUNSWICK | C320: 5 | D320: 2 | E320: =C320*6+D320 -> 32 | G320: 6 | H320: 5 | I320: =G320*6+H320 -> 41 | K320: 9 | L320: 8 | M320: =K320*6+L320 -> 62 | O320: 10 | P320: 13 | Q320: =O320*6+P320 -> 73 | S320: McBAIN
A321: BEST PLAYERS
A322: WERRIBEE | C322: GROSSMAN | F322: KELLY | I322: PAGE | L322: McNAUGHTON | O322: BOURKE | R322: LEECE
A323: BRUNSWICK | C323: SCHIMMELBUSCH | G323: DENMEAD | J323: HIGH | L323: O'BRIEN | O323: OGSTON
A324: GOALKICKERS
A325: WERRIBEE | C325: LEECE 7 | E325: BRYANT 4 | G325: COMBEN 2 | J325: HINKLEY 2 | M325: PAGE 2 | O325: SOMMERVILLE
A326: BRUNSWICK | C326: WHELAN 5 | F326: DENMEAD 2 | I326: HOWARD | L326: ALLEN | N326: BRIGHAM
A328: CAULFIELD | C328: 4 | D328: 4 | E328: =C328*6+D328 -> 28 | G328: 8 | H328: 8 | I328: =G328*6+H328 -> 56 | K328: 13 | L328: 15 | M328: =K328*6+L328 -> 93 | O328: 23 | P328: 18 | Q328: =O328*6+P328 -> 156 | S328: CAMBERWELL
A329: CAMBERWELL | C329: 1 | D329: 5 | E329: =C329*6+D329 -> 11 | G329: 8 | H329: 7 | I329: =G329*6+H329 -> 55 | K329: 10 | L329: 10 | M329: =K329*6+L329 -> 70 | O329: 12 | P329: 17 | Q329: =O329*6+P329 -> 89 | S329: CARLILE
A330: BEST PLAYERS
A331: CAULFIELD | C331: BAKER | F331: ROBINSON | I331: HAMBLYN | L331: HUNTER | O331: FELDMANN
A332: CAMBERWELL | C332: DE BONDE | F332: MACK | I332: STONE | L332: MORRIS | O332: SIMPSON
A333: GOALKICKERS
A334: CAULFIELD | C334: HAMBLYN 6 | F334: BAKER 4 | H334: ROBINSON 3 | K334: HUNTER 3 | M334: LOGAN 2 | O334: ARRELL | Q334: GOWANS | S334: BROWN | U334: TEMPEST | W334: RENOWDEN
A335: CAMBERWELL | C335: PHILLIPS 3 | F335: HAMMOND 2 | I335: MORRIS 2 | K335: DE BONDE 2 | N335: STONE 2 | P335: DOHERTY
A337: ROUND 8 | E337: 4TH JUNE | J337: WEATHER | S337: PLAYED AT
D338: 1ST QTR | H338: 2ND QTR | L338: 3RD QTR | P338: FINAL | S338: BRUNSWICK
A339: BRUNSWICK | C339: 6 | D339: 2 | E339: =C339*6+D339 -> 38 | G339: 11 | H339: 4 | I339: =G339*6+H339 -> 70 | K339: 16 | L339: 7 | M339: =K339*6+L339 -> 103 | O339: 19 | P339: 11 | Q339: =O339*6+P339 -> 125 | S339: UMPIRE | X339: LADDER | AB339: ROUND | AD339: 8
A340: FRANKSTON | C340: 3 | D340: 2 | E340: =C340*6+D340 -> 20 | G340: 6 | H340: 5 | I340: =G340*6+H340 -> 41 | K340: 9 | L340: 8 | M340: =K340*6+L340 -> 62 | O340: 13 | P340: 11 | Q340: =O340*6+P340 -> 89 | S340: TORNEY
A341: BEST PLAYERS | W341: TEAM | X341: W | Y341: L | Z341: D | AA341: FOR | AB341: AGST | AC341: % | AD341: PTS
A342: BRUNSWICK | C342: DENMEAD | F342: SCHIMMELBUSCH | J342: WALLIS | M342: OGSTON | P342: GREIG | R342: HADZILLEAS
A343: FRANKSTON | C343: BREMNER | F343: WINSTANLEY | J343: JUNGWIRTH | M343: ROWE | P343: SKREJA | R343: BUNN | W343: GEELONG WEST | X343: 8 | Y343: 0 | Z343: 0 | AA343: 1187 | AB343: 673 | AC343: =(AA343*100)/AB343 -> 176.37444279346212 | AD343: =(X343*4)+(Z343*2) -> 32
A344: GOALKICKERS | W344: CAULFIELD | X344: 8 | Y344: 0 | Z344: 0 | AA344: 1047 | AB344: 712 | AC344: =(AA344*100)/AB344 -> 147.05056179775281 | AD344: =(X344*4)+(Z344*2) -> 32
A345: BRUNSWICK | C345: OGSTON 4 | E345: WHELAN 4 | H345: WALLIS 4 | J345: DENMEAD 3 | M345: DIMMATINA 2 | P345: SCHIMMELBUSCH | S345: DALTON | W345: BOX HILL | X345: 5 | Y345: 3 | Z345: 0 | AA345: 970 | AB345: 831 | AC345: =(AA345*100)/AB345 -> 116.72683513838749 | AD345: =(X345*4)+(Z345*2) -> 20
A346: FRANKSTON | C346: SKREJA 4 | E346: JUNGWIRTH 4 | H346: BUNN | J346: FALKINER | M346: McWILLIAMS | P346: WINSTANLEY | S346: RIDSDALE | W346: NORTHCOTE | X346: 5 | Y346: 3 | Z346: 0 | AA346: 874 | AB346: 778 | AC346: =(AA346*100)/AB346 -> 112.33933161953728 | AD346: =(X346*4)+(Z346*2) -> 20
A348: GEELONG WEST | C348: 7 | D348: 5 | E348: =C348*6+D348 -> 47 | G348: 12 | H348: 17 | I348: =G348*6+H348 -> 89 | K348: 17 | L348: 20 | M348: =K348*6+L348 -> 122 | O348: 23 | P348: 31 | Q348: =O348*6+P348 -> 169 | S348: WERRIBEE | W348: YARRAVILLE | X348: 4 | Y348: 3 | Z348: 1 | AA348: 964 | AB348: 846 | AC348: =(AA348*100)/AB348 -> 113.94799054373523 | AD348: =(X348*4)+(Z348*2) -> 18
A349: WERRIBEE | C349: 4 | D349: 1 | E349: =C349*6+D349 -> 25 | G349: 5 | H349: 2 | I349: =G349*6+H349 -> 32 | K349: 11 | L349: 4 | M349: =K349*6+L349 -> 70 | O349: 14 | P349: 7 | Q349: =O349*6+P349 -> 91 | S349: HAYES | W349: CAMBERWELL | X349: 3 | Y349: 5 | Z349: 0 | AA349: 964 | AB349: 955 | AC349: =(AA349*100)/AB349 -> 100.94240837696336 | AD349: =(X349*4)+(Z349*2) -> 12
A350: BEST PLAYERS | W350: BRUNSWICK | X350: 3 | Y350: 5 | Z350: 0 | AA350: 754 | AB350: 870 | AC350: =(AA350*100)/AB350 -> 86.666666666666671 | AD350: =(X350*4)+(Z350*2) -> 12
A351: GEELONG WEST | C351: MANSON | F351: M BROWNE | I351: LINKE | L351: GOGGIN | N351: R BROWNE | Q351: VAN ELDON | W351: WERRIBEE | X351: 1 | Y351: 6 | Z351: 1 | AA351: 814 | AB351: 1178 | AC351: =(AA351*100)/AB351 -> 69.100169779286929 | AD351: =(X351*4)+(Z351*2) -> 6
A352: WERRIBEE | C352: SNOW | F352: NEWMAN | I352: KELLY | L352: LEECE | N352: BRYANT | Q352: COMBEN | W352: FRANKSTON | X352: 1 | Y352: 7 | Z352: 0 | AA352: 870 | AB352: 928 | AC352: =(AA352*100)/AB352 -> 93.75 | AD352: =(X352*4)+(Z352*2) -> 4
A353: GOALKICKERS | P353: VAN ELDON | W353: MORDIALLOC | X353: 1 | Y353: 7 | Z353: 0 | AA353: 545 | AB353: 1218 | AC353: =(AA353*100)/AB353 -> 44.745484400656814 | AD353: =(X353*4)+(Z353*2) -> 4
A354: GEELONG WEST | C354: LINKE 4 | E354: McLEAN 3 | G354: GOGGIN 3 | I354: MANSON 2 | K354: SMITH 2 | M354: M BROWNE 2 | P354: IRVIN 2 | R354: DEEATH | T354: COLLEY
A355: WERRIBEE | C355: LEECE 4 | E355: COMBEN 4 | H355: CUNNINGHAM 3 | K355: CORDANIS | N355: BRYANT | Q355: PLUMMER
A357: CAMBERWELL | C357: 7 | D357: 7 | E357: =C357*6+D357 -> 49 | G357: 15 | H357: 12 | I357: =G357*6+H357 -> 102 | K357: 23 | L357: 16 | M357: =K357*6+L357 -> 154 | O357: 32 | P357: 19 | Q357: =O357*6+P357 -> 211 | S357: CAMBERWELL
A358: MORDIALLOC | C358: 5 | D358: 2 | E358: =C358*6+D358 -> 32 | G358: 7 | H358: 3 | I358: =G358*6+H358 -> 45 | K358: 12 | L358: 5 | M358: =K358*6+L358 -> 77 | O358: 14 | P358: 6 | Q358: =O358*6+P358 -> 90 | S358: JACKSON
A359: BEST PLAYERS
A360: CAMBERWELL | C360: BRAYNE | F360: FOX | I360: SIMPSON | L360: HAMMOND | O360: BRYCE | Q360: DE BONDE
A361: MORDIALLOC | C361: THOMPSON | F361: SMITH | I361: HARRY | L361: I McGUINNESS | O361: SCAIFFE
A362: GOALKICKERS
A363: CAMBERWELL | C363: HAMMOND 9 | F363: HAZLETT 5 | H363: SIMPSON 4 | K363: MORRIS 4 | M363: BRYCE 3 | O363: PHILLIPS 2 | Q363: MARTIN 2 | S363: BOYD | U363: BRAYNE | W363: BAKER
A364: MORDIALLOC | C364: THOMPSON 9 | F364: HARRY 3 | I364: SMITH | K364: SCAIFFE
A366: CAULFIELD | C366: 1 | D366: 7 | E366: =C366*6+D366 -> 13 | G366: 4 | H366: 10 | I366: =G366*6+H366 -> 34 | K366: 8 | L366: 15 | M366: =K366*6+L366 -> 63 | O366: 17 | P366: 19 | Q366: =O366*6+P366 -> 121 | S366: PRINCES PARK, CAULFIELD
A367: NORTHCOTE | C367: 3 | D367: 5 | E367: =C367*6+D367 -> 23 | G367: 6 | H367: 7 | I367: =G367*6+H367 -> 43 | K367: 8 | L367: 10 | M367: =K367*6+L367 -> 58 | O367: 11 | P367: 14 | Q367: =O367*6+P367 -> 80 | S367: HUXTABLE
A368: BEST PLAYERS
A369: CAULFIELD | C369: GUINANE | F369: BAKER | I369: CLIFF | L369: COLLINS | O369: RENOWDEN | R369: WILLIAMS
A370: NORTHCOTE | C370: STANLEY | F370: SMITH | I370: McGORLICK | L370: THORNELOE | O370: LEACH | R370: COHEN
A371: GOALKICKERS
A372: CAULFIELD | C372: WILLIAMS 6 | F372: BAKER 4 | I372: RENOWDEN 3 | L372: HAMBLYN | O372: COLLINS | Q372: GOWANS | T372: LOGAN
A373: NORTHCOTE | C373: COHEN 6 | F373: McNEIL 2 | I373: KOZARIS | L373: THORNELOE | O373: McGORLICK
A375: BOX HILL | C375: 9 | D375: 1 | E375: =C375*6+D375 -> 55 | G375: 10 | H375: 5 | I375: =G375*6+H375 -> 65 | K375: 13 | L375: 7 | M375: =K375*6+L375 -> 85 | O375: 18 | P375: 12 | Q375: =O375*6+P375 -> 120 | S375: YARRAVILLE
A376: YARRAVILLE | C376: 2 | D376: 3 | E376: =C376*6+D376 -> 15 | G376: 7 | H376: 10 | I376: =G376*6+H376 -> 52 | K376: 11 | L376: 15 | M376: =K376*6+L376 -> 81 | O376: 13 | P376: 18 | Q376: =O376*6+P376 -> 96 | S376: McMASTER
A377: BEST PLAYERS
A378: BOX HILL | C378: McNAMEE | F378: G SMITH | I378: BAKER | L378: THOMPSON | O378: BRYANT | Q378: VICK
A379: YARRAVILLE | C379: McLAREN | F379: KEENAN | I379: MARTIN | L379: BROWN | O379: KNOTT | Q379: QUARANTOTTO
A380: GOALKICKERS
A381: BOX HILL | C381: G SMITH 6 | F381: COSTELLO 3 | I381: COBAIN 2 | K381: THOMPSON 2 | N381: JUDD | O381: BRYANT | Q381: DOULIS | S381: ATKINSON | V381: J SMITH
A382: YARRAVILLE | C382: KEENAN 3 | F382: MATHESON 3 | I382: McLAREN 2 | L382: DOWLING 2 | O382: TAURINS 2 | R382: BROWN
A384: ROUND 9 | E384: 11TH JUNE | J384: WEATHER | S384: PLAYED AT
D385: 1ST QTR | H385: 2ND QTR | L385: 3RD QTR | P385: FINAL | S385: MORDIALLOC
A386: MORDIALLOC | C386: 6 | D386: 4 | E386: =C386*6+D386 -> 40 | G386: 8 | H386: 9 | I386: =G386*6+H386 -> 57 | K386: 11 | L386: 15 | M386: =K386*6+L386 -> 81 | O386: 15 | P386: 17 | Q386: =O386*6+P386 -> 107 | S386: UMPIRE | X386: LADDER | AB386: ROUND | AD386: 9
A387: WERRIBEE | C387: 3 | D387: 2 | E387: =C387*6+D387 -> 20 | G387: 6 | H387: 6 | I387: =G387*6+H387 -> 42 | K387: 7 | L387: 9 | M387: =K387*6+L387 -> 51 | O387: 11 | P387: 14 | Q387: =O387*6+P387 -> 80 | S387: STIRLING
A388: BEST PLAYERS | W388: TEAM | X388: W | Y388: L | Z388: D | AA388: FOR | AB388: AGST | AC388: % | AD388: PTS
A389: MORDIALLOC | C389: HARRY | F389: JOHNSON | I389: GARDNER | L389: PINNE | O389: LANG | Q389: COOK
A390: WERRIBEE | C390: HART | F390: NEWMAN | I390: KELLY | L390: SNOW | O390: LEECE | W390: GEELONG WEST | X390: 9 | Y390: 0 | Z390: 0 | AA390: 1299 | AB390: 781 | AC390: =(AA390*100)/AB390 -> 166.32522407170293 | AD390: =(X390*4)+(Z390*2) -> 36
A391: GOALKICKERS | W391: CAULFIELD | X391: 8 | Y391: 1 | Z391: 0 | AA391: 1155 | AB391: 824 | AC391: =(AA391*100)/AB391 -> 140.16990291262135 | AD391: =(X391*4)+(Z391*2) -> 32
A392: MORDIALLOC | C392: HARRIS 3 | E392: G SMITH 3 | G392: JOHNSON 2 | J392: SCAIFFE 2 | L392: LAUGHLIN 2 | O392: THOMPSON 2 | R392: HARRY | W392: BOX HILL | X392: 5 | Y392: 4 | Z392: 0 | AA392: 1080 | AB392: 954 | AC392: =(AA392*100)/AB392 -> 113.20754716981132 | AD392: =(X392*4)+(Z392*2) -> 20
A393: WERRIBEE | C393: LEECE 3 | E393: PAGE 2 | G393: PLUMMER 2 | J393: HART 2 | L393: SNOW 2 | W393: NORTHCOTE | X393: 5 | Y393: 4 | Z393: 0 | AA393: 1005 | AB393: 918 | AC393: =(AA393*100)/AB393 -> 109.47712418300654 | AD393: =(X393*4)+(Z393*2) -> 20
A395: BRUNSWICK | C395: 4 | D395: 5 | E395: =C395*6+D395 -> 29 | G395: 7 | H395: 8 | I395: =G395*6+H395 -> 50 | K395: 10 | L395: 12 | M395: =K395*6+L395 -> 72 | O395: 18 | P395: 15 | Q395: =O395*6+P395 -> 123 | S395: BOX HILL | W395: YARRAVILLE | X395: 4 | Y395: 4 | Z395: 1 | AA395: 1049 | AB395: 976 | AC395: =(AA395*100)/AB395 -> 107.47950819672131 | AD395: =(X395*4)+(Z395*2) -> 18
A396: BOX HILL | C396: 4 | D396: 6 | E396: =C396*6+D396 -> 30 | G396: 9 | H396: 15 | I396: =G396*6+H396 -> 69 | K396: 13 | L396: 19 | M396: =K396*6+L396 -> 97 | O396: 15 | P396: 20 | Q396: =O396*6+P396 -> 110 | S396: FLANAGAN | W396: CAMBERWELL | X396: 4 | Y396: 5 | Z396: 0 | AA396: 1104 | AB396: 1086 | AC396: =(AA396*100)/AB396 -> 101.65745856353591 | AD396: =(X396*4)+(Z396*2) -> 16
A397: BEST PLAYERS | W397: BRUNSWICK | X397: 4 | Y397: 5 | Z397: 0 | AA397: 877 | AB397: 980 | AC397: =(AA397*100)/AB397 -> 89.489795918367349 | AD397: =(X397*4)+(Z397*2) -> 16
A398: BRUNSWICK | C398: DALTON | F398: DIMMATINA | I398: SCHIMMELBUSCH | M398: RYAN | O398: GREIG | R398: OGSTON | W398: FRANKSTON | X398: 2 | Y398: 7 | Z398: 0 | AA398: 1000 | AB398: 1013 | AC398: =(AA398*100)/AB398 -> 98.716683119447183 | AD398: =(X398*4)+(Z398*2) -> 8
A399: BOX HILL | C399: COLE | F399: DOULIS | I399: BAKER | L399: ATKINSON | O399: RALPH | R399: VICK | W399: MORDIALLOC | X399: 2 | Y399: 7 | Z399: 0 | AA399: 652 | AB399: 1298 | AC399: =(AA399*100)/AB399 -> 50.231124807395993 | AD399: =(X399*4)+(Z399*2) -> 8
A400: GOALKICKERS | N400: SCHIMMELBUSCH | W400: WERRIBEE | X400: 1 | Y400: 7 | Z400: 1 | AA400: 894 | AB400: 1285 | AC400: =(AA400*100)/AB400 -> 69.57198443579766 | AD400: =(X400*4)+(Z400*2) -> 6
A401: BRUNSWICK | C401: WHELAN 4 | E401: DIMMATINA 4 | H401: OGSTON 3 | J401: DENMEAD 2 | M401: WALLIS | O401: WROUT | Q401: DALTON | S401: ALLEN
A402: BOX HILL | C402: G SMITH 3 | E402: J SMITH 3 | G402: THOMPSON 2 | J402: DOULIS 2 | M402: COSTELLO 2 | P402: COBAIN | R402: VICK | T402: ATKINSON
A404: FRANKSTON | C404: 6 | D404: 5 | E404: =C404*6+D404 -> 41 | G404: 13 | H404: 9 | I404: =G404*6+H404 -> 87 | K404: 16 | L404: 11 | M404: =K404*6+L404 -> 107 | O404: 19 | P404: 16 | Q404: =O404*6+P404 -> 130 | S404: FRANKSTON
A405: YARRAVILLE | C405: 2 | D405: 4 | E405: =C405*6+D405 -> 16 | G405: 4 | H405: 11 | I405: =G405*6+H405 -> 35 | K405: 6 | L405: 15 | M405: =K405*6+L405 -> 51 | O405: 11 | P405: 19 | Q405: =O405*6+P405 -> 85 | S405: HAYES
A406: BEST PLAYERS
A407: FRANKSTON | C407: ROWE | F407: WINSTANLEY | I407: BLOOMFIELD | L407: SKREJA | N407: ROSENBROCK | Q407: JUNGWIRTH
A408: YARRAVILLE | C408: WAGHORNE | F408: MARTIN | I408: WILKINSON | L408: BROWN | N408: KNOTT | Q408: TAURINS
A409: GOALKICKERS
A410: FRANKSTON | C410: JUNGWIRTH 4 | F410: WINSTANLEY 3 | I410: BLOOMFIELD 3 | L410: SKREJA 2 | N410: McNAB 2 | P410: SLADE | R410: SCOTT | S410: RIDSDALE | V410: BUNN | X410: COUTTS
A411: YARRAVILLE | C411: DOWLING 3 | F411: MATHESON 2 | I411: TAURINS 2 | L411: PATTERSON 2 | O411: BROWN | Q411: WAGHORNE
A413: CAMBERWELL | C413: 5 | D413: 2 | E413: =C413*6+D413 -> 32 | G413: 8 | H413: 7 | I413: =G413*6+H413 -> 55 | K413: 12 | L413: 10 | M413: =K413*6+L413 -> 82 | O413: 20 | P413: 20 | Q413: =O413*6+P413 -> 140 | S413: NORTHCOTE
A414: NORTHCOTE | C414: 6 | D414: 4 | E414: =C414*6+D414 -> 40 | G414: 12 | H414: 6 | I414: =G414*6+H414 -> 78 | K414: 16 | L414: 11 | M414: =K414*6+L414 -> 107 | O414: 20 | P414: 11 | Q414: =O414*6+P414 -> 131 | S414: TORNEY
A415: BEST PLAYERS
A416: CAMBERWELL | C416: DE BONDE | F416: FOX | I416: SIMPSON | L416: CLARKE | O416: STONE | R416: HAZLETT
A417: NORTHCOTE | C417: RYAN | F417: MARTIN | I417: KENNEALLY | L417: GARRETT | O417: STANLEY | R417: SMITH
A418: GOALKICKERS
A419: CAMBERWELL | C419: SIMPSON 5 | E419: STONE 4 | G419: DE BONDE 4 | J419: BAKER 2 | L419: MORRIS | N419: PHILLIPE | P419: HAMMOND | S419: HAZLETT | U419: BRYCE
A420: NORTHCOTE | C420: RYAN 6 | E420: COHEN 5 | G420: MARTIN 3 | J420: LEACH 3 | L420: GARRETT 2 | O420: KOZARIS
A422: GEELONG WEST | C422: 1 | D422: 4 | E422: =C422*6+D422 -> 10 | G422: 8 | H422: 6 | I422: =G422*6+H422 -> 54 | K422: 11 | L422: 8 | M422: =K422*6+L422 -> 74 | O422: 17 | P422: 10 | Q422: =O422*6+P422 -> 112 | S422: GEELONG WEST
A423: CAULFIELD | C423: 3 | D423: 6 | E423: =C423*6+D423 -> 24 | G423: 6 | H423: 9 | I423: =G423*6+H423 -> 45 | K423: 10 | L423: 14 | M423: =K423*6+L423 -> 74 | O423: 15 | P423: 18 | Q423: =O423*6+P423 -> 108 | S423: McBAIN
A424: BEST PLAYERS
A425: GEELONG WEST | C425: LINKE | F425: MANSON | I425: M BROWNE | L425: McLEAN | N425: COLLEY | Q425: GILLIES
A426: CAULFIELD | C426: BAKER | F426: BROWN | I426: LOGAN | L426: GUINANE | N426: RENOWDEN | Q426: HOCKING
A427: GOALKICKERS
A428: GEELONG WEST | C428: McLEAN 7 | F428: LINKE 2 | H428: IRVIN 2 | J428: COLLEY 2 | L428: HARRIS | N428: M BROWNE | Q428: DEEATH | S428: GOGGIN
A429: CAULFIELD | C429: BROWN 6 | F429: LOGAN 3 | I429: HOCKING 2 | L429: GOWANS | N429: VINE | O429: WILLIAMS | R429: HAMBLYN
A431: ROUND 10 | E431: 18TH JUNE | J431: WEATHER | S431: PLAYED AT
D432: 1ST QTR | H432: 2ND QTR | L432: 3RD QTR | P432: FINAL | S432: BRUNSWICK
A433: GEELONG WEST | C433: 3 | D433: 1 | E433: =C433*6+D433 -> 19 | G433: 8 | H433: 5 | I433: =G433*6+H433 -> 53 | K433: 18 | L433: 7 | M433: =K433*6+L433 -> 115 | O433: 23 | P433: 11 | Q433: =O433*6+P433 -> 149 | S433: UMPIRE | X433: LADDER | AB433: ROUND | AD433: 10
A434: BRUNSWICK | C434: 3 | D434: 4 | E434: =C434*6+D434 -> 22 | G434: 4 | H434: 8 | I434: =G434*6+H434 -> 32 | K434: 7 | L434: 11 | M434: =K434*6+L434 -> 53 | O434: 15 | P434: 18 | Q434: =O434*6+P434 -> 108 | S434: ABBOTT
A435: BEST PLAYERS | W435: TEAM | X435: W | Y435: L | Z435: D | AA435: FOR | AB435: AGST | AC435: % | AD435: PTS
A436: GEELONG WEST | C436: M BROWNE | F436: MANSON | I436: LINKE | L436: McLEAN | O436: IRVIN | Q436: HALL
A437: BRUNSWICK | C437: WROUT | F437: OGSTON | I437: SCHIMMELBUSCH | M437: GREIG | O437: HADZILLIAS | W437: GEELONG WEST | X437: 10 | Y437: 0 | Z437: 0 | AA437: 1448 | AB437: 889 | AC437: =(AA437*100)/AB437 -> 162.87964004499437 | AD437: =(X437*4)+(Z437*2) -> 40
A438: GOALKICKERS | W438: CAULFIELD | X438: 9 | Y438: 1 | Z438: 0 | AA438: 1309 | AB438: 958 | AC438: =(AA438*100)/AB438 -> 136.63883089770354 | AD438: =(X438*4)+(Z438*2) -> 36
A439: GEELONG WEST | C439: McLEAN 9 | E439: LINKE 5 | G439: KAMPMAN 2 | J439: MANSON 2 | L439: IRVIN 2 | N439: R BROWNE | P439: M BROWNE | S439: SMITH | W439: YARRAVILLE | X439: 5 | Y439: 4 | Z439: 1 | AA439: 1219 | AB439: 1052 | AC439: =(AA439*100)/AB439 -> 115.87452471482889 | AD439: =(X439*4)+(Z439*2) -> 22
A440: BRUNSWICK | C440: OGSTON 4 | F440: WHELAN 4 | I440: HOWARD 2 | L440: DENMEAD 2 | N440: GREIG | P440: SCHIMMELBUSCH | T440: ALLEN | W440: BOX HILL | X440: 5 | Y440: 5 | Z440: 0 | AA440: 1214 | AB440: 1108 | AC440: =(AA440*100)/AB440 -> 109.5667870036101 | AD440: =(X440*4)+(Z440*2) -> 20
A442: WERRIBEE | C442: 4 | D442: 6 | E442: =C442*6+D442 -> 30 | G442: 7 | H442: 12 | I442: =G442*6+H442 -> 54 | K442: 14 | L442: 16 | M442: =K442*6+L442 -> 100 | O442: 21 | P442: 23 | Q442: =O442*6+P442 -> 149 | S442: WERRIBEE | W442: CAMBERWELL | X442: 5 | Y442: 5 | Z442: 0 | AA442: 1244 | AB442: 1208 | AC442: =(AA442*100)/AB442 -> 102.98013245033113 | AD442: =(X442*4)+(Z442*2) -> 20
A443: NORTHCOTE | C443: 2 | D443: 4 | E443: =C443*6+D443 -> 16 | G443: 5 | H443: 4 | I443: =G443*6+H443 -> 34 | K443: 6 | L443: 5 | M443: =K443*6+L443 -> 41 | O443: 8 | P443: 7 | Q443: =O443*6+P443 -> 55 | S443: ANDERSON | W443: NORTHCOTE | X443: 5 | Y443: 5 | Z443: 0 | AA443: 1060 | AB443: 1067 | AC443: =(AA443*100)/AB443 -> 99.34395501405811 | AD443: =(X443*4)+(Z443*2) -> 20
A444: BEST PLAYERS | W444: BRUNSWICK | X444: 4 | Y444: 6 | Z444: 0 | AA444: 985 | AB444: 1129 | AC444: =(AA444*100)/AB444 -> 87.245349867139055 | AD444: =(X444*4)+(Z444*2) -> 16
A445: WERRIBEE | C445: KELLY | F445: GROSSMAN | I445: DEY | L445: BRYANT | O445: COMBEN | Q445: MONTGOMERY | W445: WERRIBEE | X445: 2 | Y445: 7 | Z445: 1 | AA445: 1043 | AB445: 1340 | AC445: =(AA445*100)/AB445 -> 77.835820895522389 | AD445: =(X445*4)+(Z445*2) -> 10
A446: NORTHCOTE | C446: STEWART | F446: STANLEY | I446: McGORLICK | L446: GARRETT | O446: SMITH | Q446: KENNEALLY | W446: FRANKSTON | X446: 2 | Y446: 8 | Z446: 0 | AA446: 1122 | AB446: 1153 | AC446: =(AA446*100)/AB446 -> 97.311361665221156 | AD446: =(X446*4)+(Z446*2) -> 8
A447: GOALKICKERS | W447: MORDIALLOC | X447: 2 | Y447: 8 | Z447: 0 | AA447: 728 | AB447: 1468 | AC447: =(AA447*100)/AB447 -> 49.591280653950953 | AD447: =(X447*4)+(Z447*2) -> 8
A448: WERRIBEE | C448: LEECE 5 | E448: BRYANT 4 | G448: HINKLEY 4 | J448: GROSSMAN 2 | M448: SOMMERVILLE 2 | P448: RIDDELL 2 | R448: JOHNSON | T448: COMBEN
A449: NORTHCOTE | C449: COHEN 3 | F449: MARTIN | I449: GARRETT | K449: KREYMBORG | N449: WILLIAMS | Q449: RYAN
A451: CAMBERWELL | C451: 6 | D451: 3 | E451: =C451*6+D451 -> 39 | G451: 13 | H451: 6 | I451: =G451*6+H451 -> 84 | K451: 16 | L451: 7 | M451: =K451*6+L451 -> 103 | O451: 21 | P451: 14 | Q451: =O451*6+P451 -> 140 | S451: CAMBERWELL
A452: FRANKSTON | C452: 3 | D452: 6 | E452: =C452*6+D452 -> 24 | G452: 8 | H452: 9 | I452: =G452*6+H452 -> 57 | K452: 12 | L452: 12 | M452: =K452*6+L452 -> 84 | O452: 18 | P452: 14 | Q452: =O452*6+P452 -> 122 | S452: McMASTER
A453: BEST PLAYERS
A454: CAMBERWELL | C454: STONE | F454: HAZLETT | I454: BRYCE | L454: BOYD | N454: PHILLIPE
A455: FRANKSTON | C455: JUNGWIRTH | F455: STAPLETON | I455: COOPER | L455: NICHOLSON | O455: SKREJA
A456: GOALKICKERS
A457: CAMBERWELL | C457: HAZLETT 5 | F457: STONE 5 | H457: HAMMOND 3 | K457: BRYCE 3 | M457: MARTIN 2 | O457: DE BONDE | R457: MORRIS | T457: PHILLIPE
A458: FRANKSTON | C458: JUNGWIRTH 10 | F458: MARTIN 3 | I458: McNAB 2 | L458: SLADE | N458: NICHOLSON | Q458: LOVELOCK
A460: CAULFIELD | C460: 5 | D460: 6 | E460: =C460*6+D460 -> 36 | G460: 8 | H460: 9 | I460: =G460*6+H460 -> 57 | K460: 18 | L460: 15 | M460: =K460*6+L460 -> 123 | O460: 23 | P460: 16 | Q460: =O460*6+P460 -> 154 | S460: PRINCES PARK, CAULFIELD
A461: BOX HILL | C461: 5 | D461: 2 | E461: =C461*6+D461 -> 32 | G461: 11 | H461: 10 | I461: =G461*6+H461 -> 76 | K461: 14 | L461: 10 | M461: =K461*6+L461 -> 94 | O461: 20 | P461: 14 | Q461: =O461*6+P461 -> 134 | S461: GAMBETTA
A462: BEST PLAYERS
A463: CAULFIELD | C463: LOGAN | F463: ARRELL | I463: RENOWDEN | L463: GOWANS | N463: BAKER | Q463: BROWN
A464: BOX HILL | C464: G SMITH | F464: CRISP | I464: McNAMEE | L464: COLE | N464: BRYANT | Q464: HUMPHREY
A465: GOALKICKERS
A466: CAULFIELD | C466: BROWN 8 | E466: HOCKING 5 | H466: BAKER 3 | J466: LOGAN 2 | L466: ARRELL | N466: GOWANS | P466: COLLINS | R466: HAMBLYN | U466: WILLIAMS
A467: BOX HILL | C467: G SMITH 11 | F467: J SMITH 3 | I467: COBAIN 2 | K467: ATKINSON | M467: THOMPSON | P467: BRYANT | R467: DOULIS
A469: YARRAVILLE | C469: 6 | D469: 1 | E469: =C469*6+D469 -> 37 | G469: 12 | H469: 10 | I469: =G469*6+H469 -> 82 | K469: 19 | L469: 11 | M469: =K469*6+L469 -> 125 | O469: 26 | P469: 14 | Q469: =O469*6+P469 -> 170 | S469: YARRAVILLE
A470: MORDIALLOC | C470: 1 | D470: 4 | E470: =C470*6+D470 -> 10 | G470: 2 | H470: 5 | I470: =G470*6+H470 -> 17 | K470: 4 | L470: 12 | M470: =K470*6+L470 -> 36 | O470: 10 | P470: 16 | Q470: =O470*6+P470 -> 76 | S470: CARLILE
A471: BEST PLAYERS
A472: YARRAVILLE | C472: BROWN | F472: KNOTT | I472: RYAN | L472: DELL | N472: CONDUIT | Q472: MARTIN
A473: MORDIALLOC | C473: PINNE | F473: WISEMAN | I473: SMITH | L473: SCAIFFE | N473: THOMPSON | Q473: LANG
A474: GOALKICKERS
A475: YARRAVILLE | C475: KNOTT 7 | E475: WAGHORNE 5 | H475: DOWLING 3 | K475: MARTIN 2 | N475: BROWN 2 | P475: MATHESON 2 | S475: QUARANTOTTO 2 | W475: KEENAN | X475: CONDUIT | Z475: COLE
A476: MORDIALLOC | C476: THOMPSON 5 | F476: HARRY 2 | I476: SCAIFFE 2 | L476: RAEBURN
A478: ROUND 11 | E478: 25TH JUNE | J478: WEATHER | S478: PLAYED AT
D479: 1ST QTR | H479: 2ND QTR | L479: 3RD QTR | P479: FINAL | S479: MORDIALLOC
A480: CAULFIELD | C480: 5 | D480: 4 | E480: =C480*6+D480 -> 34 | G480: 9 | H480: 14 | I480: =G480*6+H480 -> 68 | K480: 14 | L480: 16 | M480: =K480*6+L480 -> 100 | O480: 18 | P480: 26 | Q480: =O480*6+P480 -> 134 | S480: UMPIRE | X480: LADDER | AB480: ROUND | AD480: 11
A481: MORDIALLOC | C481: 2 | D481: 4 | E481: =C481*6+D481 -> 16 | G481: 3 | H481: 6 | I481: =G481*6+H481 -> 24 | K481: 9 | L481: 10 | M481: =K481*6+L481 -> 64 | O481: 10 | P481: 10 | Q481: =O481*6+P481 -> 70 | S481: TURNER
A482: BEST PLAYERS | W482: TEAM | X482: W | Y482: L | Z482: D | AA482: FOR | AB482: AGST | AC482: % | AD482: PTS
A483: CAULFIELD | C483: LOGAN | F483: GOWANS | I483: BAKER | L483: HODSON | O483: FELDMANN | R483: GUINANE
A484: MORDIALLOC | C484: JOHNSON | F484: HARRY | I484: GARDNER | L484: WISEMAN | O484: SMITH | R484: THOMPSON | W484: GEELONG WEST | X484: 11 | Y484: 0 | Z484: 0 | AA484: 1621 | AB484: 968 | AC484: =(AA484*100)/AB484 -> 167.45867768595042 | AD484: =(X484*4)+(Z484*2) -> 44
A485: GOALKICKERS | W485: CAULFIELD | X485: 10 | Y485: 1 | Z485: 0 | AA485: 1443 | AB485: 1028 | AC485: =(AA485*100)/AB485 -> 140.36964980544747 | AD485: =(X485*4)+(Z485*2) -> 40
A486: CAULFIELD | C486: BROWN 5 | E486: HOCKING 3 | H486: GOWANS 2 | J486: ARRELL 2 | L486: LOGAN 2 | N486: WILLIAMS 2 | Q486: HAMBLYN | S486: GUINANE | W486: BOX HILL | X486: 6 | Y486: 5 | Z486: 0 | AA486: 1325 | AB486: 1207 | AC486: =(AA486*100)/AB486 -> 109.77630488815244 | AD486: =(X486*4)+(Z486*2) -> 24
A487: MORDIALLOC | C487: THOMPSON 4 | F487: SCAIFFE 2 | I487: RAEBURN 2 | L487: HARRY 2 | W487: YARRAVILLE | X487: 5 | Y487: 5 | Z487: 1 | AA487: 1298 | AB487: 1225 | AC487: =(AA487*100)/AB487 -> 105.95918367346938 | AD487: =(X487*4)+(Z487*2) -> 22
A489: GEELONG WEST | C489: 6 | D489: 4 | E489: =C489*6+D489 -> 40 | G489: 13 | H489: 8 | I489: =G489*6+H489 -> 86 | K489: 17 | L489: 15 | M489: =K489*6+L489 -> 117 | O489: 26 | P489: 17 | Q489: =O489*6+P489 -> 173 | S489: GEELONG WEST | W489: CAMBERWELL | X489: 5 | Y489: 6 | Z489: 0 | AA489: 1343 | AB489: 1319 | AC489: =(AA489*100)/AB489 -> 101.81956027293404 | AD489: =(X489*4)+(Z489*2) -> 20
A490: YARRAVILLE | C490: 3 | D490: 3 | E490: =C490*6+D490 -> 21 | G490: 7 | H490: 4 | I490: =G490*6+H490 -> 46 | K490: 8 | L490: 5 | M490: =K490*6+L490 -> 53 | O490: 12 | P490: 7 | Q490: =O490*6+P490 -> 79 | S490: ANDERSON | W490: NORTHCOTE | X490: 5 | Y490: 6 | Z490: 0 | AA490: 1146 | AB490: 1161 | AC490: =(AA490*100)/AB490 -> 98.708010335917308 | AD490: =(X490*4)+(Z490*2) -> 20
A491: BEST PLAYERS | W491: BRUNSWICK | X491: 5 | Y491: 6 | Z491: 0 | AA491: 1074 | AB491: 1215 | AC491: =(AA491*100)/AB491 -> 88.395061728395063 | AD491: =(X491*4)+(Z491*2) -> 20
A492: GEELONG WEST | C492: McLEAN | F492: R BROWNE | I492: LINKE | L492: M BROWNE | O492: CROWE | Q492: EVANS | W492: FRANKSTON | X492: 3 | Y492: 8 | Z492: 0 | AA492: 1256 | AB492: 1267 | AC492: =(AA492*100)/AB492 -> 99.131807419100241 | AD492: =(X492*4)+(Z492*2) -> 12
A493: YARRAVILLE | C493: WAGHORNE | F493: KNOTT | I493: STURNEIKS | L493: RYAN | O493: COLE | Q493: BROWN | W493: WERRIBEE | X493: 2 | Y493: 8 | Z493: 1 | AA493: 1157 | AB493: 1474 | AC493: =(AA493*100)/AB493 -> 78.493894165535963 | AD493: =(X493*4)+(Z493*2) -> 10
A494: GOALKICKERS | W494: MORDIALLOC | X494: 2 | Y494: 9 | Z494: 0 | AA494: 798 | AB494: 1602 | AC494: =(AA494*100)/AB494 -> 49.812734082397007 | AD494: =(X494*4)+(Z494*2) -> 8
A495: GEELONG WEST | C495: McLEAN 13 | F495: KAMPMAN 3 | I495: HARRIS 3 | K495: M BROWNE 2 | N495: LINKE 2 | P495: IRVIN | R495: COLLEY | T495: DEEATH
A496: YARRAVILLE | C496: COLE 3 | E496: DOWLING 2 | H496: KNOTT 2 | J496: KEENAN 2 | M496: MARTIN | O496: BROWN | Q496: JANES
A498: BOX HILL | C498: 4 | D498: 5 | E498: =C498*6+D498 -> 29 | G498: 8 | H498: 10 | I498: =G498*6+H498 -> 58 | K498: 14 | L498: 12 | M498: =K498*6+L498 -> 96 | O498: 15 | P498: 21 | Q498: =O498*6+P498 -> 111 | S498: BOX HILL
A499: CAMBERWELL | C499: 5 | D499: 3 | E499: =C499*6+D499 -> 33 | G499: 7 | H499: 6 | I499: =G499*6+H499 -> 48 | K499: 12 | L499: 8 | M499: =K499*6+L499 -> 80 | O499: 15 | P499: 9 | Q499: =O499*6+P499 -> 99 | S499: McBAIN
A500: BEST PLAYERS
A501: BOX HILL | C501: HUMPHREY | F501: RALPH | I501: COLE | L501: COBAIN | O501: DOULIS | Q501: THOMPSON
A502: CAMBERWELL | C502: DE BONDE | F502: HOOK | I502: BRYCE | L502: MACK | O502: STONE | Q502: HAMMOND
A503: GOALKICKERS
A504: BOX HILL | C504: COSTELLO 4 | F504: THOMPSON 3 | I504: JUDD 2 | K504: COBAIN 2 | M504: ATKINSON | P504: J SMITH | R504: BRYANT | U504: DOULIS
A505: CAMBERWELL | C505: DE BONDE 6 | F505: HAMMOND 4 | I505: BAKER 3 | K505: MARTIN | M505: FERNE
A507: FRANKSTON | C507: 3 | D507: 4 | E507: =C507*6+D507 -> 22 | G507: 9 | H507: 11 | I507: =G507*6+H507 -> 65 | K507: 12 | L507: 15 | M507: =K507*6+L507 -> 87 | O507: 19 | P507: 20 | Q507: =O507*6+P507 -> 134 | S507: FRANKSTON
A508: WERRIBEE | C508: 2 | D508: 8 | E508: =C508*6+D508 -> 20 | G508: 8 | H508: 12 | I508: =G508*6+H508 -> 60 | K508: 12 | L508: 16 | M508: =K508*6+L508 -> 88 | O508: 15 | P508: 24 | Q508: =O508*6+P508 -> 114 | S508: CRAIG
A509: BEST PLAYERS
A510: FRANKSTON | C510: SKREJA | F510: LOVELOCK | I510: McNAB | L510: NICHOLSON | O510: RENOUF | R510: JUNGWIRTH
A511: WERRIBEE | C511: HART | F511: ARRIGO | I511: SOMMERVILLE | L511: BUTTON | O511: MONTGOMERY | R511: EDWARDS
A512: GOALKICKERS
A513: FRANKSTON | C513: JUNGWIRTH 5 | F513: McNAB 4 | H513: BUNN 2 | J513: LOVELOCK 2 | M513: SKREJA 2 | O513: NICHOLSON 2 | R513: SLADE | U513: SCOTT
A514: WERRIBEE | C514: LEECE 4 | F514: HINKLEY 3 | I514: BRYANT 3 | L514: RIDDELL | N514: BUTTON | P514: SOMMERVILLE | S514: ARRIGO
A516: BRUNSWICK | C516: 3 | D516: 3 | E516: =C516*6+D516 -> 21 | G516: 6 | H516: 7 | I516: =G516*6+H516 -> 43 | K516: 8 | L516: 19 | M516: =K516*6+L516 -> 67 | O516: 12 | P516: 22 | Q516: =O516*6+P516 -> 94 | S516: NORTHCOTE
A517: NORTHCOTE | C517: 2 | D517: 5 | E517: =C517*6+D517 -> 17 | G517: 5 | H517: 9 | I517: =G517*6+H517 -> 39 | K517: 6 | L517: 12 | M517: =K517*6+L517 -> 48 | O517: 12 | P517: 14 | Q517: =O517*6+P517 -> 86 | S517: CARLILE
A518: BEST PLAYERS
A519: BRUNSWICK | C519: SCHIMMELBUSCH | G519: NIVEN | I519: HADZILLEAS | L519: HORSINGTON | O519: PERRY | Q519: RYAN
A520: NORTHCOTE | C520: GARRETT | F520: KILKENNY | I520: STEWART | L520: KENNEALLY | O520: MARTIN | Q520: SMITH
A521: GOALKICKERS
A522: BRUNSWICK | C522: SCHIMMELBUSCH 5 | G522: GREIG 2 | I522: WHELAN 2 | L522: PERRY | N522: HORSINGTON | Q522: ELLIS
A523: NORTHCOTE | C523: COHEN 2 | E523: STANLEY 2 | H523: RYAN 2 | J523: McNEILL | L523: STILSBY | N523: KILKENNY | P523: GARRETT | R523: MARTIN | T523: BIENKE
A525: ROUND 12 | E525: 2ND JULY | J525: WEATHER | S525: PLAYED AT
D526: 1ST QTR | H526: 2ND QTR | L526: 3RD QTR | P526: FINAL | S526: NORTHCOTE
A527: NORTHCOTE | C527: 5 | D527: 2 | E527: =C527*6+D527 -> 32 | G527: 11 | H527: 6 | I527: =G527*6+H527 -> 72 | K527: 13 | L527: 9 | M527: =K527*6+L527 -> 87 | O527: 17 | P527: 16 | Q527: =O527*6+P527 -> 118 | S527: UMPIRE | X527: LADDER | AB527: ROUND | AD527: 12
A528: FRANKSTON | C528: 2 | D528: 8 | E528: =C528*6+D528 -> 20 | G528: 4 | H528: 10 | I528: =G528*6+H528 -> 34 | K528: 10 | L528: 15 | M528: =K528*6+L528 -> 75 | O528: 14 | P528: 16 | Q528: =O528*6+P528 -> 100 | S528: TURNER
A529: BEST PLAYERS | W529: TEAM | X529: W | Y529: L | Z529: D | AA529: FOR | AB529: AGST | AC529: % | AD529: PTS
A530: NORTHCOTE | C530: McNEILL | F530: RYAN | I530: STEWART | L530: KILKENNY | O530: GARRETT | R530: KENNEALLY
A531: FRANKSTON | C531: ROSENBROCK | F531: SKREJA | I531: JUNGWIRTH | L531: ROWE | O531: McNAB | W531: GEELONG WEST | X531: 12 | Y531: 0 | Z531: 0 | AA531: 1762 | AB531: 1028 | AC531: =(AA531*100)/AB531 -> 171.40077821011673 | AD531: =(X531*4)+(Z531*2) -> 48
A532: GOALKICKERS | W532: CAULFIELD | X532: 11 | Y532: 1 | Z532: 0 | AA532: 1592 | AB532: 1119 | AC532: =(AA532*100)/AB532 -> 142.26988382484362 | AD532: =(X532*4)+(Z532*2) -> 44
A533: NORTHCOTE | C533: RYAN 6 | E533: MARTIN 4 | H533: COHEN 2 | J533: GARRETT 2 | M533: KILKENNY | P533: McNEILL | R533: UNDERWOOD | W533: CAMBERWELL | X533: 6 | Y533: 6 | Z533: 0 | AA533: 1477 | AB533: 1406 | AC533: =(AA533*100)/AB533 -> 105.049786628734 | AD533: =(X533*4)+(Z533*2) -> 24
A534: FRANKSTON | C534: SKREJA 5 | E534: JUNGWIRTH 4 | H534: COOPER | J534: LOVELOCK | M534: AUSTIN | O534: BLOOMFIELD | R534: McNAB | W534: BOX HILL | X534: 6 | Y534: 6 | Z534: 0 | AA534: 1385 | AB534: 1348 | AC534: =(AA534*100)/AB534 -> 102.74480712166172 | AD534: =(X534*4)+(Z534*2) -> 24
A536: GEELONG WEST | C536: 9 | D536: 3 | E536: =C536*6+D536 -> 57 | G536: 11 | H536: 6 | I536: =G536*6+H536 -> 72 | K536: 17 | L536: 13 | M536: =K536*6+L536 -> 115 | O536: 21 | P536: 15 | Q536: =O536*6+P536 -> 141 | S536: GEELONG WEST | W536: NORTHCOTE | X536: 6 | Y536: 6 | Z536: 0 | AA536: 1264 | AB536: 1261 | AC536: =(AA536*100)/AB536 -> 100.23790642347343 | AD536: =(X536*4)+(Z536*2) -> 24
A537: BOX HILL | C537: 2 | D537: 2 | E537: =C537*6+D537 -> 14 | G537: 6 | H537: 5 | I537: =G537*6+H537 -> 41 | K537: 8 | L537: 7 | M537: =K537*6+L537 -> 55 | O537: 8 | P537: 12 | Q537: =O537*6+P537 -> 60 | S537: CRAIG | W537: BRUNSWICK | X537: 6 | Y537: 6 | Z537: 0 | AA537: 1168 | AB537: 1288 | AC537: =(AA537*100)/AB537 -> 90.683229813664596 | AD537: =(X537*4)+(Z537*2) -> 24
A538: BEST PLAYERS | W538: YARRAVILLE | X538: 5 | Y538: 6 | Z538: 1 | AA538: 1385 | AB538: 1359 | AC538: =(AA538*100)/AB538 -> 101.9131714495953 | AD538: =(X538*4)+(Z538*2) -> 22
A539: GEELONG WEST | C539: McLEAN | F539: R BROWNE | I539: DEEATH | L539: BARRY | O539: GOGGIN | R539: GRATTON | W539: FRANKSTON | X539: 3 | Y539: 9 | Z539: 0 | AA539: 1356 | AB539: 1385 | AC539: =(AA539*100)/AB539 -> 97.906137184115522 | AD539: =(X539*4)+(Z539*2) -> 12
A540: BOX HILL | C540: COSTELLO | F540: COLE | I540: BRYANT | L540: DOULIS | O540: RALPH | R540: ATKINSON | W540: WERRIBEE | X540: 2 | Y540: 9 | Z540: 1 | AA540: 1248 | AB540: 1623 | AC540: =(AA540*100)/AB540 -> 76.894639556377086 | AD540: =(X540*4)+(Z540*2) -> 10
A541: GOALKICKERS | W541: MORDIALLOC | X541: 2 | Y541: 10 | Z541: 0 | AA541: 871 | AB541: 1696 | AC541: =(AA541*100)/AB541 -> 51.356132075471699 | AD541: =(X541*4)+(Z541*2) -> 8
A542: GEELONG WEST | C542: McLEAN 13 | F542: MANSON 2 | I542: M BROWNE 2 | L542: BARRY | N542: HARRIS | P542: DEEATH | R542: GOGGIN
A543: BOX HILL | C543: COSTELLO 3 | F543: SMITH 2 | I543: JUDD | K543: ATKINSON | N543: DOULIS
A545: BRUNSWICK | C545: 1 | D545: 7 | E545: =C545*6+D545 -> 13 | G545: 4 | H545: 15 | I545: =G545*6+H545 -> 39 | K545: 5 | L545: 20 | M545: =K545*6+L545 -> 50 | O545: 11 | P545: 28 | Q545: =O545*6+P545 -> 94 | S545: BRUNSWICK
A546: MORDIALLOC | C546: 4 | D546: 6 | E546: =C546*6+D546 -> 30 | G546: 4 | H546: 6 | I546: =G546*6+H546 -> 30 | K546: 9 | L546: 10 | M546: =K546*6+L546 -> 64 | O546: 10 | P546: 13 | Q546: =O546*6+P546 -> 73 | S546: HAYES
A547: BEST PLAYERS
A548: BRUNSWICK | C548: SCHIMMELBUSCH | F548: NIVEN | I548: WROUT | L548: WALLIS | O548: DIMMATINA | R548: HORSINGTON
A549: MORDIALLOC | C549: SMITH | F549: McGUINNESS | I549: GARDNER | L549: WISEMAN | O549: THOMPSON | R549: PINNE
A550: GOALKICKERS
A551: BRUNSWICK | C551: WALLIS 3 | F551: WHELAN 2 | I551: BAIRD 2 | K551: HORSINGTON 2 | N551: SCHIMMELBUSCH | R551: WROUT
A552: MORDIALLOC | C552: SMITH 4 | F552: THOMPSON 3 | I552: RAEBURN 2 | L552: PINNE
A554: CAMBERWELL | C554: 7 | D554: 3 | E554: =C554*6+D554 -> 45 | G554: 10 | H554: 10 | I554: =G554*6+H554 -> 70 | K554: 14 | L554: 14 | M554: =K554*6+L554 -> 98 | O554: 19 | P554: 20 | Q554: =O554*6+P554 -> 134 | S554: CAMBERWELL
A555: YARRAVILLE | C555: 3 | D555: 7 | E555: =C555*6+D555 -> 25 | G555: 6 | H555: 13 | I555: =G555*6+H555 -> 49 | K555: 11 | L555: 14 | M555: =K555*6+L555 -> 80 | O555: 12 | P555: 15 | Q555: =O555*6+P555 -> 87 | S555: STIRLING
A556: BEST PLAYERS
A557: CAMBERWELL | C557: STONE | F557: BRYCE | I557: MAGNABOSCO | L557: HOOK | O557: HAMMOND | R557: DE BONDE
A558: YARRAVILLE | C558: MARTIN | F558: COLE | I558: BATES | L558: HENDERSON | O558: TAURINS | R558: KNOTT
A559: GOALKICKERS
A560: CAMBERWELL | C560: STONE 6 | E560: SIMPSON 4 | H560: HAZLETT 3 | K560: HAMMOND 2 | N560: FERNE 2 | P560: DOBSON | R560: DE BONDE
A561: YARRAVILLE | C561: COLE 3 | E561: BATES 2 | G561: MARTIN 2 | I561: MATHESON 2 | L561: TAURINS | N561: STURNEIKS | Q561: HENDERSON
A563: CAULFIELD | C563: 6 | D563: 4 | E563: =C563*6+D563 -> 40 | G563: 10 | H563: 11 | I563: =G563*6+H563 -> 71 | K563: 13 | L563: 14 | M563: =K563*6+L563 -> 92 | O563: 21 | P563: 23 | Q563: =O563*6+P563 -> 149 | S563: PRINCES PARK, CAULFIELD
A564: WERRIBEE | C564: 2 | D564: 7 | E564: =C564*6+D564 -> 19 | G564: 3 | H564: 10 | I564: =G564*6+H564 -> 28 | K564: 8 | L564: 15 | M564: =K564*6+L564 -> 63 | O564: 12 | P564: 19 | Q564: =O564*6+P564 -> 91 | S564: McMASTER
A565: BEST PLAYERS
A566: CAULFIELD | C566: VINE | F566: HOCKING | I566: WHITE | L566: LOGAN | O566: WILLIAMS | R566: BAKER
A567: WERRIBEE | C567: HART | F567: GROSSMAN | I567: J HINKLEY | L567: LEECE | O567: PLUMMER | R567: DEY
A568: GOALKICKERS
A569: CAULFIELD | C569: WILLIAMS 4 | F569: BAKER 4 | H569: CLIFF 4 | J569: BROWN 3 | M569: LOGAN 2 | O569: GOWANS 2 | Q569: HOCKING | S569: JEWELL
A570: WERRIBEE | C570: ARRIGO 2 | E570: HART 2 | G570: J HINKLEY 2 | J570: LEECE 2 | L570: BRYANT | N570: DEY | P570: PLUMMER | R570: RIDDELL
A572: ROUND 13 | E572: 7TH JULY | J572: WEATHER | S572: PLAYED AT
D573: 1ST QTR | H573: 2ND QTR | L573: 3RD QTR | P573: FINAL | S573: MORDIALLOC
A574: GEELONG WEST | C574: 6 | D574: 6 | E574: =C574*6+D574 -> 42 | G574: 10 | H574: 9 | I574: =G574*6+H574 -> 69 | K574: 18 | L574: 12 | M574: =K574*6+L574 -> 120 | O574: 24 | P574: 15 | Q574: =O574*6+P574 -> 159 | S574: UMPIRE | X574: LADDER | AB574: ROUND | AD574: 13
A575: MORDIALLOC | C575: 1 | D575: 0 | E575: =C575*6+D575 -> 6 | G575: 5 | H575: 8 | I575: =G575*6+H575 -> 38 | K575: 7 | L575: 11 | M575: =K575*6+L575 -> 53 | O575: 13 | P575: 13 | Q575: =O575*6+P575 -> 91 | S575: GAMBETTA
A576: BEST PLAYERS | W576: TEAM | X576: W | Y576: L | Z576: D | AA576: FOR | AB576: AGST | AC576: % | AD576: PTS
A577: GEELONG WEST | C577: DEEATH | F577: M BROWNE | I577: MANSON | L577: McLEAN | O577: LINKE | R577: GOGGIN
A578: MORDIALLOC | C578: JOHNSON | F578: GUY | I578: HARRY | L578: SMITH | O578: WISEMAN | R578: McGUINNESS | W578: GEELONG WEST | X578: 13 | Y578: 0 | Z578: 0 | AA578: 1921 | AB578: 1119 | AC578: =(AA578*100)/AB578 -> 171.67113494191241 | AD578: =(X578*4)+(Z578*2) -> 52
A579: GOALKICKERS | W579: CAULFIELD | X579: 12 | Y579: 1 | Z579: 0 | AA579: 1721 | AB579: 1199 | AC579: =(AA579*100)/AB579 -> 143.53628023352795 | AD579: =(X579*4)+(Z579*2) -> 48
A580: GEELONG WEST | C580: McLEAN 8 | E580: GOGGIN 4 | G580: R BROWNE 3 | J580: LINKE 2 | L580: MANSON 2 | N580: DEEATH 2 | P580: SMITH | R580: IRVIN | S580: M BROWNE | W580: NORTHCOTE | X580: 7 | Y580: 6 | Z580: 0 | AA580: 1352 | AB580: 1344 | AC580: =(AA580*100)/AB580 -> 100.5952380952381 | AD580: =(X580*4)+(Z580*2) -> 28
A581: MORDIALLOC | C581: SCAIFFE 3 | E581: SMITH 3 | G581: GUY 2 | I581: HARRY 2 | K581: SHUGG | M581: JOHNSON | O581: McGUINNESS | W581: CAMBERWELL | X581: 7 | Y581: 6 | Z581: 0 | AA581: 1490 | AB581: 1494 | AC581: =(AA581*100)/AB581 -> 99.732262382864789 | AD581: =(X581*4)+(Z581*2) -> 28
A583: NORTHCOTE | C583: 5 | D583: 3 | E583: =C583*6+D583 -> 33 | G583: 6 | H583: 6 | I583: =G583*6+H583 -> 42 | K583: 9 | L583: 7 | M583: =K583*6+L583 -> 61 | O583: 13 | P583: 10 | Q583: =O583*6+P583 -> 88 | S583: BOX HILL | W583: BRUNSWICK | X583: 7 | Y583: 6 | Z583: 0 | AA583: 1302 | AB583: 1402 | AC583: =(AA583*100)/AB583 -> 92.867332382310991 | AD583: =(X583*4)+(Z583*2) -> 28
A584: BOX HILL | C584: 0 | D584: 0 | E584: =C584*6+D584 -> 0 | G584: 5 | H584: 9 | I584: =G584*6+H584 -> 39 | K584: 7 | L584: 10 | M584: =K584*6+L584 -> 52 | O584: 12 | P584: 11 | Q584: =O584*6+P584 -> 83 | S584: STIRLING | W584: BOX HILL | X584: 6 | Y584: 7 | Z584: 0 | AA584: 1468 | AB584: 1436 | AC584: =(AA584*100)/AB584 -> 102.2284122562674 | AD584: =(X584*4)+(Z584*2) -> 24
A585: BEST PLAYERS | W585: YARRAVILLE | X585: 5 | Y585: 7 | Z585: 1 | AA585: 1499 | AB585: 1493 | AC585: =(AA585*100)/AB585 -> 100.40187541862022 | AD585: =(X585*4)+(Z585*2) -> 22
A586: NORTHCOTE | C586: SMITH | F586: KILKENNY | I586: GARRETT | L586: STEWART | O586: RYAN | Q586: BIENKE | W586: FRANKSTON | X586: 3 | Y586: 10 | Z586: 0 | AA586: 1436 | AB586: 1514 | AC586: =(AA586*100)/AB586 -> 94.848084544253638 | AD586: =(X586*4)+(Z586*2) -> 12
A587: BOX HILL | C587: RALPH | F587: VICK | I587: COSTELLO | L587: COBAIN | O587: HUNT | Q587: COLE | W587: WERRIBEE | X587: 2 | Y587: 10 | Z587: 1 | AA587: 1336 | AB587: 1760 | AC587: =(AA587*100)/AB587 -> 75.909090909090907 | AD587: =(X587*4)+(Z587*2) -> 10
A588: GOALKICKERS | W588: MORDIALLOC | X588: 2 | Y588: 11 | Z588: 0 | AA588: 962 | AB588: 1855 | AC588: =(AA588*100)/AB588 -> 51.859838274932613 | AD588: =(X588*4)+(Z588*2) -> 8
A589: NORTHCOTE | C589: RYAN 3 | E589: GARRETT 2 | H589: MARTIN 2 | J589: COHEN 2 | L589: BIENKE | N589: KILKENNY | Q589: STILSBY | S589: McNEILL
A590: BOX HILL | C590: COBAIN 4 | F590: G SMITH 2 | I590: COSTELLO 2 | L590: DOULIS | N590: VICK | P590: MACKO | R590: ATKINSON
A592: CAULFIELD | C592: 2 | D592: 3 | E592: =C592*6+D592 -> 15 | G592: 8 | H592: 5 | I592: =G592*6+H592 -> 53 | K592: 11 | L592: 7 | M592: =K592*6+L592 -> 73 | O592: 19 | P592: 15 | Q592: =O592*6+P592 -> 129 | S592: FRANKSTON
A593: FRANKSTON | C593: 4 | D593: 3 | E593: =C593*6+D593 -> 27 | G593: 4 | H593: 6 | I593: =G593*6+H593 -> 30 | K593: 11 | L593: 7 | M593: =K593*6+L593 -> 73 | O593: 12 | P593: 8 | Q593: =O593*6+P593 -> 80 | S593: ABBOTT
A594: BEST PLAYERS
A595: CAULFIELD | C595: GOWANS | F595: GUINANE | I595: CLIFF | L595: WILLIAMS | O595: LOGAN | Q595: BAKER
A596: FRANKSTON | C596: COOPER | F596: CLARKE | I596: LOVELOCK | L596: JUNGWIRTH | O596: SKREJA | Q596: ROSENBROCK
A597: GOALKICKERS
A598: CAULFIELD | C598: CLIFF 5 | E598: BROWN 3 | G598: WILLIAMS 3 | J598: GOWANS 2 | M598: HOCKING 2 | O598: GUINANE | Q598: JONES | S598: LOGAN | U598: BAKER
A599: FRANKSTON | C599: JUNGWIRTH 5 | F599: WINSTANLEY 3 | J599: SKREJA 2 | M599: LOVELOCK | P599: AUSTIN
A601: CAMBERWELL | C601: 7 | D601: 2 | E601: =C601*6+D601 -> 44 | G601: 13 | H601: 5 | I601: =G601*6+H601 -> 83 | K601: 18 | L601: 8 | M601: =K601*6+L601 -> 116 | O601: 21 | P601: 11 | Q601: =O601*6+P601 -> 137 | S601: WERRIBEE
A602: WERRIBEE | C602: 2 | D602: 4 | E602: =C602*6+D602 -> 16 | G602: 7 | H602: 3 | I602: =G602*6+H602 -> 45 | K602: 9 | L602: 5 | M602: =K602*6+L602 -> 59 | O602: 13 | P602: 10 | Q602: =O602*6+P602 -> 88 | S602: FLANAGAN
A603: BEST PLAYERS
A604: CAMBERWELL | C604: MORRIS | F604: FERNE | I604: EDWARDS | L604: STONE | O604: HAMMOND | R604: CLARKE
A605: WERRIBEE | C605: DEY | F605: GROSSMAN | I605: LEECE | L605: SOMMERVILLE | O605: J HINKLEY | R605: KELLY
A606: GOALKICKERS
A607: CAMBERWELL | C607: HAMMOND 8 | F607: EDWARDS 3 | I607: STONE 3 | K607: WILSON 3 | N607: SIMPSON | P607: DE BONDE | R607: BRYCE | T607: BAKER
A608: WERRIBEE | C608: LEECE 7 | F608: SOMMERVILLE 3 | J608: SNOW 2 | M608: RIDDELL
A610: BRUNSWICK | C610: 7 | D610: 6 | E610: =C610*6+D610 -> 48 | G610: 9 | H610: 7 | I610: =G610*6+H610 -> 61 | K610: 16 | L610: 14 | M610: =K610*6+L610 -> 110 | O610: 20 | P610: 14 | Q610: =O610*6+P610 -> 134 | S610: YARRAVILLE
A611: YARRAVILLE | C611: 2 | D611: 1 | E611: =C611*6+D611 -> 13 | G611: 8 | H611: 8 | I611: =G611*6+H611 -> 56 | K611: 12 | L611: 12 | M611: =K611*6+L611 -> 84 | O611: 16 | P611: 18 | Q611: =O611*6+P611 -> 114 | S611: McBEAN
A612: BEST PLAYERS
A613: BRUNSWICK | C613: GREIG | F613: WALLIS | I613: SCHIMMELBUSCH | M613: WROUT | O613: O'BRIEN | R613: BAIRD
A614: YARRAVILLE | C614: BROWN | F614: RYAN | I614: DOWLING | M614: KNOTT | O614: DAVIS | R614: TAURINS
A615: GOALKICKERS
A616: BRUNSWICK | C616: WALLIS 5 | F616: GREIG 4 | H616: SCHIMMELBUSCH 4 | L616: BAIRD 2 | N616: PERRY 2 | P616: WHELAN 2 | S616: OGSTON
A617: YARRAVILLE | C617: DOWLING 6 | F617: KNOTT 3 | H617: WITHINGTON | K617: MARTIN | M617: STONE | O617: BROWN | Q617: DAVIS | S617: TAURINS | U617: MATHESON
A619: ROUND 14 | E619: 14TH JULY | J619: WEATHER | S619: PLAYED AT
D620: 1ST QTR | H620: 2ND QTR | L620: 3RD QTR | P620: FINAL | S620: FRANKSTON
A621: FRANKSTON | C621: 4 | D621: 4 | E621: =C621*6+D621 -> 28 | G621: 14 | H621: 12 | I621: =G621*6+H621 -> 96 | K621: 18 | L621: 14 | M621: =K621*6+L621 -> 122 | O621: 23 | P621: 16 | Q621: =O621*6+P621 -> 154 | S621: UMPIRE | X621: LADDER | AB621: ROUND | AD621: 14
A622: BOX HILL | C622: 3 | D622: 8 | E622: =C622*6+D622 -> 26 | G622: 4 | H622: 9 | I622: =G622*6+H622 -> 33 | K622: 13 | L622: 17 | M622: =K622*6+L622 -> 95 | O622: 16 | P622: 22 | Q622: =O622*6+P622 -> 118 | S622: BOYD
A623: BEST PLAYERS | W623: TEAM | X623: W | Y623: L | Z623: D | AA623: FOR | AB623: AGST | AC623: % | AD623: PTS
A624: FRANKSTON | C624: JUNGWIRTH | F624: WINSTANLEY | I624: STAPLETON | L624: D CLARK | O624: SKREJA | R624: ROWE
A625: BOX HILL | C625: COSTELLO | F625: DOULIS | I625: BRYANT | L625: McNAMEE | O625: McQUALTER | R625: K RALPH | W625: GEELONG WEST | X625: 14 | Y625: 0 | Z625: 0 | AA625: 2078 | AB625: 1180 | AC625: =(AA625*100)/AB625 -> 176.10169491525423 | AD625: =(X625*4)+(Z625*2) -> 56
A626: GOALKICKERS | W626: CAULFIELD | X626: 12 | Y626: 2 | Z626: 0 | AA626: 1807 | AB626: 1300 | AC626: =(AA626*100)/AB626 -> 139 | AD626: =(X626*4)+(Z626*2) -> 48
A627: FRANKSTON | C627: JUNGWIRTH 11 | F627: LOVELOCK 3 | I627: McNAB 3 | K627: SKREJA 2 | M627: BLOOMFIELD 2 | P627: WINSTANLEY | S627: FALKINER | W627: NORTHCOTE | X627: 8 | Y627: 6 | Z627: 0 | AA627: 1462 | AB627: 1421 | AC627: =(AA627*100)/AB627 -> 102.88529204785362 | AD627: =(X627*4)+(Z627*2) -> 32
A628: BOX HILL | C628: THOMPSON 4 | F628: DOULIS 3 | H628: SMITH 2 | J628: BRYANT 2 | L628: HUMPHREY | O628: COSTELLO | R628: HARRIS | T628: G SMITH | W628: BRUNSWICK | X628: 8 | Y628: 6 | Z628: 0 | AA628: 1403 | AB628: 1488 | AC628: =(AA628*100)/AB628 -> 94.287634408602145 | AD628: =(X628*4)+(Z628*2) -> 32
N629: CRISP
A630: NORTHCOTE | C630: 4 | D630: 2 | E630: =C630*6+D630 -> 26 | G630: 8 | H630: 6 | I630: =G630*6+H630 -> 54 | K630: 13 | L630: 7 | M630: =K630*6+L630 -> 85 | O630: 17 | P630: 8 | Q630: =O630*6+P630 -> 110 | S630: NORTHCOTE | W630: CAMBERWELL | X630: 7 | Y630: 7 | Z630: 0 | AA630: 1551 | AB630: 1651 | AC630: =(AA630*100)/AB630 -> 93.943064809206547 | AD630: =(X630*4)+(Z630*2) -> 28
A631: MORDIALLOC | C631: 1 | D631: 1 | E631: =C631*6+D631 -> 7 | G631: 4 | H631: 7 | I631: =G631*6+H631 -> 31 | K631: 6 | L631: 11 | M631: =K631*6+L631 -> 47 | O631: 10 | P631: 17 | Q631: =O631*6+P631 -> 77 | S631: CHINN | W631: YARRAVILLE | X631: 6 | Y631: 7 | Z631: 1 | AA631: 1639 | AB631: 1564 | AC631: =(AA631*100)/AB631 -> 104.79539641943734 | AD631: =(X631*4)+(Z631*2) -> 26
A632: BEST PLAYERS | W632: BOX HILL | X632: 6 | Y632: 8 | Z632: 0 | AA632: 1586 | AB632: 1590 | AC632: =(AA632*100)/AB632 -> 99.74842767295597 | AD632: =(X632*4)+(Z632*2) -> 24
A633: NORTHCOTE | C633: STEWART | F633: STILSBY | I633: UNDERWOOD | L633: KILKENNY | O633: WILLIAMS | R633: GARRETT | W633: FRANKSTON | X633: 4 | Y633: 10 | Z633: 0 | AA633: 1590 | AB633: 1632 | AC633: =(AA633*100)/AB633 -> 97.42647058823529 | AD633: =(X633*4)+(Z633*2) -> 16
A634: MORDIALLOC | C634: McGUINNESS | F634: SMITH | I634: HARRY | L634: LITTLE | O634: SCAIFFE | W634: WERRIBEE | X634: 2 | Y634: 11 | Z634: 1 | AA634: 1407 | AB634: 1900 | AC634: =(AA634*100)/AB634 -> 74.05263157894737 | AD634: =(X634*4)+(Z634*2) -> 10
A635: GOALKICKERS | W635: MORDIALLOC | X635: 2 | Y635: 12 | Z635: 0 | AA635: 1039 | AB635: 1965 | AC635: =(AA635*100)/AB635 -> 52.87531806615776 | AD635: =(X635*4)+(Z635*2) -> 8
A636: NORTHCOTE | C636: STILSBY 4 | F636: RYAN 3 | H636: COHEN 3 | J636: KILKENNY 2 | M636: UNDERWOOD 2 | P636: WILLIAMS 2 | R636: BIENKE
A637: MORDIALLOC | C637: THOMPSON 4 | F637: SCAIFFE 2 | I637: COOK | K637: SMITH | M637: HARRY | O637: GUY
A639: GEELONG WEST | C639: 8 | D639: 4 | E639: =C639*6+D639 -> 52 | G639: 14 | H639: 7 | I639: =G639*6+H639 -> 91 | K639: 19 | L639: 13 | M639: =K639*6+L639 -> 127 | O639: 23 | P639: 19 | Q639: =O639*6+P639 -> 157 | S639: GEELONG WEST
A640: CAMBERWELL | C640: 0 | D640: 2 | E640: =C640*6+D640 -> 2 | G640: 4 | H640: 5 | I640: =G640*6+H640 -> 29 | K640: 6 | L640: 9 | M640: =K640*6+L640 -> 45 | O640: 8 | P640: 13 | Q640: =O640*6+P640 -> 61 | S640: CARLILE
A641: BEST PLAYERS
A642: GEELONG WEST | C642: DENT | F642: R BROWNE | I642: M BROWNE | L642: HALL | N642: DEEATH | Q642: VAN ELDON
A643: CAMBERWELL | C643: HAZLETT | F643: BRYCE | I643: MORRIS | L643: PHILLIPE
A644: GOALKICKERS
A645: GEELONG WEST | C645: McLEAN 7 | F645: M BROWNE 5 | I645: SMITH 3 | K645: HARRIS 3 | M645: MANSON 2 | O645: LINKE | Q645: R BROWNE | S645: DEEATH
A646: CAMBERWELL | C646: STONE 2 | F646: BRYCE | H646: McDONALD | K646: HAMMOND | N646: BAKER | P646: PHILLIPE | R646: WILSON
A648: BRUNSWICK | C648: 4 | D648: 4 | E648: =C648*6+D648 -> 28 | G648: 5 | H648: 6 | I648: =G648*6+H648 -> 36 | K648: 14 | L648: 9 | M648: =K648*6+L648 -> 93 | O648: 15 | P648: 11 | Q648: =O648*6+P648 -> 101 | S648: BRUNSWICK
A649: CAULFIELD | C649: 1 | D649: 2 | E649: =C649*6+D649 -> 8 | G649: 5 | H649: 7 | I649: =G649*6+H649 -> 37 | K649: 7 | L649: 8 | M649: =K649*6+L649 -> 50 | O649: 12 | P649: 14 | Q649: =O649*6+P649 -> 86 | S649: CRAIG
A650: BEST PLAYERS
A651: BRUNSWICK | C651: HADZILLIAS | F651: BAIRD | I651: NIVEN | L651: GUEST | N651: SCHIMMELBUSCH | R651: WALLIS
A652: CAULFIELD | C652: GOWANS | F652: JEWELL | I652: BAKER | L652: ARRELL | N652: VINE | Q652: HOCKING
A653: GOALKICKERS
A654: BRUNSWICK | C654: BAIRD 5 | F654: McCABE 4 | I654: SCHIMMELBUSCH 3 | M654: WALLIS 2 | O654: GREIG
A655: CAULFIELD | C655: JEWELL 4 | F655: HOCKING 3 | I655: CLIFF 2 | K655: GUINANE | M655: BAKER | O655: VINE
A657: YARRAVILLE | C657: 4 | D657: 3 | E657: =C657*6+D657 -> 27 | G657: 9 | H657: 9 | I657: =G657*6+H657 -> 63 | K657: 15 | L657: 15 | M657: =K657*6+L657 -> 105 | O657: 20 | P657: 20 | Q657: =O657*6+P657 -> 140 | S657: YARRAVILLE
A658: WERRIBEE | C658: 1 | D658: 1 | E658: =C658*6+D658 -> 7 | G658: 7 | H658: 2 | I658: =G658*6+H658 -> 44 | K658: 7 | L658: 3 | M658: =K658*6+L658 -> 45 | O658: 11 | P658: 5 | Q658: =O658*6+P658 -> 71 | S658: ABBOTT
A659: BEST PLAYERS
A660: YARRAVILLE | C660: BROWN | F660: WAGHORNE | I660: DOWLING | L660: KNOTT | N660: JAMES | Q660: WITHINGTON
A661: WERRIBEE | C661: GROSSMAN | F661: BRYANT | I661: J HINKLEY | L661: LEECE | N661: LEWXZUK | Q661: WHITEHEAD
A662: GOALKICKERS
A663: YARRAVILLE | C663: DOWLING 5 | F663: WITHINGTON 4 | J663: BROPHY 3 | M663: RYAN 3 | O663: COLE 3 | Q663: BROWN | S663: MATHESON
A664: WERRIBEE | C664: BRYANT 3 | F664: ARRIGO 2 | I664: LEECE 2 | K664: SNOW | M664: PAICE | O664: WHITEHEAD | R664: J HINKLEY
A666: ROUND 15 | E666: 23RD JULY | J666: WEATHER | S666: PLAYED AT
D667: 1ST QTR | H667: 2ND QTR | L667: 3RD QTR | P667: FINAL | S667: MORDIALLOC
A668: MORDIALLOC | C668: 6 | D668: 7 | E668: =C668*6+D668 -> 43 | G668: 12 | H668: 9 | I668: =G668*6+H668 -> 81 | K668: 17 | L668: 11 | M668: =K668*6+L668 -> 113 | O668: 19 | P668: 15 | Q668: =O668*6+P668 -> 129 | S668: UMPIRE | X668: LADDER | AB668: ROUND | AD668: 15
A669: FRANKSTON | C669: 6 | D669: 1 | E669: =C669*6+D669 -> 37 | G669: 10 | H669: 8 | I669: =G669*6+H669 -> 68 | K669: 14 | L669: 11 | M669: =K669*6+L669 -> 95 | O669: 17 | P669: 17 | Q669: =O669*6+P669 -> 119 | S669: FLANAGAN
A670: BEST PLAYERS | W670: TEAM | X670: W | Y670: L | Z670: D | AA670: FOR | AB670: AGST | AC670: % | AD670: PTS
A671: MORDIALLOC | C671: SMITH | F671: LAUGHLIN | I671: JOHNSON | L671: THOMPSON | O671: SHUGG | R671: HARRY
A672: FRANKSTON | C672: McNAB | F672: RENOUF | I672: ROWE | L672: SKREJA | O672: ROSENBROCK | R672: STAPLETON | W672: GEELONG WEST | X672: 15 | Y672: 0 | Z672: 0 | AA672: 2227 | AB672: 1248 | AC672: =(AA672*100)/AB672 -> 178.44551282051282 | AD672: =(X672*4)+(Z672*2) -> 60
A673: GOALKICKERS | W673: CAULFIELD | X673: 13 | Y673: 2 | Z673: 0 | AA673: 1986 | AB673: 1366 | AC673: =(AA673*100)/AB673 -> 145.38799414348463 | AD673: =(X673*4)+(Z673*2) -> 52
A674: MORDIALLOC | C674: THOMPSON 6 | F674: SHUGG 3 | H674: HARRY 3 | J674: SMITH 2 | L674: LITTLE 2 | N674: McGUINNESS | Q674: LAUGHLIN | S674: SCAIFFE | W674: BRUNSWICK | X674: 9 | Y674: 6 | Z674: 0 | AA674: 1548 | AB674: 1593 | AC674: =(AA674*100)/AB674 -> 97.175141242937855 | AD674: =(X674*4)+(Z674*2) -> 36
A675: FRANKSTON | C675: McNAB 3 | E675: JUNGWIRTH 3 | H675: FALKINER 2 | K675: SKREJA 2 | N675: LOVELOCK 2 | Q675: BLOOMFIELD | T675: WINSTANLEY | W675: NORTHCOTE | X675: 8 | Y675: 7 | Z675: 0 | AA675: 1530 | AB675: 1570 | AC675: =(AA675*100)/AB675 -> 97.452229299363054 | AD675: =(X675*4)+(Z675*2) -> 32
L676: EDWARDS | N676: D BOND
A677: GEELONG WEST | C677: 3 | D677: 2 | E677: =C677*6+D677 -> 20 | G677: 9 | H677: 3 | I677: =G677*6+H677 -> 57 | K677: 17 | L677: 6 | M677: =K677*6+L677 -> 108 | O677: 23 | P677: 11 | Q677: =O677*6+P677 -> 149 | S677: NORTHCOTE | W677: CAMBERWELL | X677: 7 | Y677: 8 | Z677: 0 | AA677: 1656 | AB677: 1796 | AC677: =(AA677*100)/AB677 -> 92.204899777282847 | AD677: =(X677*4)+(Z677*2) -> 28
A678: NORTHCOTE | C678: 1 | D678: 6 | E678: =C678*6+D678 -> 12 | G678: 4 | H678: 8 | I678: =G678*6+H678 -> 32 | K678: 6 | L678: 9 | M678: =K678*6+L678 -> 45 | O678: 9 | P678: 14 | Q678: =O678*6+P678 -> 68 | S678: HAYES | W678: YARRAVILLE | X678: 6 | Y678: 8 | Z678: 1 | AA678: 1705 | AB678: 1922 | AC678: =(AA678*100)/AB678 -> 88.709677419354833 | AD678: =(X678*4)+(Z678*2) -> 26
A679: BEST PLAYERS | W679: BOX HILL | X679: 6 | Y679: 9 | Z679: 0 | AA679: 1682 | AB679: 1709 | AC679: =(AA679*100)/AB679 -> 98.420128730251605 | AD679: =(X679*4)+(Z679*2) -> 24
A680: GEELONG WEST | C680: VAN ELDON | F680: DENT | I680: M BROWNE | L680: HARRIS | O680: HALL | R680: GOGGIN | W680: FRANKSTON | X680: 4 | Y680: 11 | Z680: 0 | AA680: 1709 | AB680: 1761 | AC680: =(AA680*100)/AB680 -> 97.047132311186829 | AD680: =(X680*4)+(Z680*2) -> 16
A681: NORTHCOTE | C681: SMITH | F681: BIENKE | I681: STILSBY | L681: KENNEALLY | O681: STANLEY | R681: UNDERWOOD | W681: WERRIBEE | X681: 3 | Y681: 11 | Z681: 1 | AA681: 1526 | AB681: 1996 | AC681: =(AA681*100)/AB681 -> 76.452905811623253 | AD681: =(X681*4)+(Z681*2) -> 14
A682: GOALKICKERS | W682: MORDIALLOC | X682: 3 | Y682: 12 | Z682: 0 | AA682: 1168 | AB682: 2084 | AC682: =(AA682*100)/AB682 -> 56.046065259117086 | AD682: =(X682*4)+(Z682*2) -> 12
A683: GEELONG WEST | C683: McLEAN 5 | F683: M BROWNE 4 | I683: HARRIS 4 | K683: SMITH 3 | M683: LINKE 2 | O683: R BROWNE 2 | R683: DEEATH 2 | T683: GOGGIN
A684: NORTHCOTE | C684: STILSBY 5 | F684: BIENKE 2 | I684: KILKENNY | L684: KOZARIS
A686: WERRIBEE | C686: 7 | D686: 1 | E686: =C686*6+D686 -> 43 | G686: 10 | H686: 6 | I686: =G686*6+H686 -> 66 | K686: 15 | L686: 12 | M686: =K686*6+L686 -> 102 | O686: 17 | P686: 17 | Q686: =O686*6+P686 -> 119 | S686: WERRIBEE
A687: BOX HILL | C687: 4 | D687: 4 | E687: =C687*6+D687 -> 28 | G687: 9 | H687: 10 | I687: =G687*6+H687 -> 64 | K687: 11 | L687: 13 | M687: =K687*6+L687 -> 79 | O687: 13 | P687: 18 | Q687: =O687*6+P687 -> 96 | S687: CHINN
A688: BEST PLAYERS
A689: WERRIBEE | C689: HINKLEY | F689: NEWMAN | I689: BRYANT | L689: SOMMERVILLE | O689: JOHNSON | R689: ARRIGO
A690: BOX HILL | C690: RALPH | F690: DEED | I690: DOULIS | L690: ATKINSON | O690: G SMITH | R690: McQUALTER
A691: GOALKICKERS
A692: WERRIBEE | C692: BRYANT 7 | F692: HINKLEY 3 | I692: MONTGOMERY 2 | L692: ARRIGO 2 | N692: SOMMERVILLE | Q692: WHITEHEAD | T692: LEECE
A693: BOX HILL | C693: G SMITH 5 | F693: ATKINSON 2 | I693: THOMPSON 2 | L693: BRYANT 2 | N693: DOULIS | P693: HARRIS
A695: BRUNSWICK | C695: 4 | D695: 3 | E695: =C695*6+D695 -> 27 | G695: 11 | H695: 9 | I695: =G695*6+H695 -> 75 | K695: 15 | L695: 13 | M695: =K695*6+L695 -> 103 | O695: 21 | P695: 19 | Q695: =O695*6+P695 -> 145 | S695: CAMBERWELL
A696: CAMBERWELL | C696: 4 | D696: 5 | E696: =C696*6+D696 -> 29 | G696: 6 | H696: 8 | I696: =G696*6+H696 -> 44 | K696: 14 | L696: 11 | M696: =K696*6+L696 -> 95 | O696: 15 | P696: 15 | Q696: =O696*6+P696 -> 105 | S696: GAMBETTA
A697: BEST PLAYERS
A698: BRUNSWICK | C698: SCHIMMELBUSCH | F698: BAIRD | I698: WROUT | L698: RYAN | O698: GREIG | Q698: LIAKOUREAS
A699: CAMBERWELL | C699: BRYCE | F699: DE BONDE | I699: STONE | L699: RICHMOND
A700: GOALKICKERS
A701: BRUNSWICK | C701: SCHIMMELBUSCH 6 | G701: BAIRD 5 | I701: LIAKOUREAS 2 | L701: WALLIS 2 | N701: McCABE | P701: OGSTON | R701: PERRY | S701: WROUT | U701: O'BRIEN | W701: GREIG
A702: CAMBERWELL | C702: STONE 5 | E702: RICHMOND 3 | H702: DE BONDE 2 | K702: FERNE 2 | M702: BRYCE | O702: DEITH | Q702: WILSON
A704: CAULFIELD | C704: 8 | D704: 8 | E704: =C704*6+D704 -> 56 | G704: 12 | H704: 11 | I704: =G704*6+H704 -> 83 | K704: 18 | L704: 18 | M704: =K704*6+L704 -> 126 | O704: 26 | P704: 23 | Q704: =O704*6+P704 -> 179 | S704: PRINCES PARK, CAULFIELD
A705: YARRAVILLE | C705: 2 | D705: 4 | E705: =C705*6+D705 -> 16 | G705: 7 | H705: 8 | I705: =G705*6+H705 -> 50 | K705: 7 | L705: 9 | M705: =K705*6+L705 -> 51 | O705: 9 | P705: 12 | Q705: =O705*6+P705 -> 66 | S705: BOYD
A706: BEST PLAYERS
A707: CAULFIELD | C707: HOCKING | F707: GOWANS | I707: FELDMANN | L707: CLIFF | O707: BAKER | R707: JEWELL
A708: YARRAVILLE | C708: BROWN | F708: DAVIS | I708: WITHINGTON | L708: MATHESON | O708: QUARANTOTTO | R708: KNOTT
A709: GOALKICKERS
A710: CAULFIELD | C710: HOCKING 8 | F710: CLIFF 4 | H710: BROWN 3 | J710: BAKER 3 | L710: JEWELL 2 | N710: GOWANS | P710: ARRELL | R710: VINE | T710: WILLIAMS
A711: YARRAVILLE | C711: DAVIS 3 | E711: WITHINGTON 2 | H711: TAURINS 2 | K711: BATES | M711: BROPHY
A713: ROUND 16 | E713: 31ST JULY | J713: WEATHER | S713: PLAYED AT
D714: 1ST QTR | H714: 2ND QTR | L714: 3RD QTR | P714: FINAL | S714: BOX HILL
A715: MORDIALLOC | C715: 4 | D715: 5 | E715: =C715*6+D715 -> 29 | G715: 8 | H715: 11 | I715: =G715*6+H715 -> 59 | K715: 14 | L715: 13 | M715: =K715*6+L715 -> 97 | O715: 19 | P715: 17 | Q715: =O715*6+P715 -> 131 | S715: UMPIRE | X715: LADDER | AB715: ROUND | AD715: 16
A716: BOX HILL | C716: 5 | D716: 5 | E716: =C716*6+D716 -> 35 | G716: 11 | H716: 8 | I716: =G716*6+H716 -> 74 | K716: 14 | L716: 13 | M716: =K716*6+L716 -> 97 | O716: 18 | P716: 16 | Q716: =O716*6+P716 -> 124 | S716: McMASTER
A717: BEST PLAYERS | W717: TEAM | X717: W | Y717: L | Z717: D | AA717: FOR | AB717: AGST | AC717: % | AD717: PTS
A718: MORDIALLOC | C718: SCAIFFE | F718: SMITH | I718: SHUGG | L718: HARRY | N718: GARDNER | Q718: LITTLE
A719: BOX HILL | C719: McNAMEE | F719: RALPH | I719: COSTELLO | L719: DOULIS | N719: BRYANT | Q719: G SMITH | W719: GEELONG WEST | X719: 16 | Y719: 0 | Z719: 0 | AA719: 2388 | AB719: 1323 | AC719: =(AA719*100)/AB719 -> 180.49886621315193 | AD719: =(X719*4)+(Z719*2) -> 64
A720: GOALKICKERS | W720: CAULFIELD | X720: 14 | Y720: 2 | Z720: 0 | AA720: 2132 | AB720: 1470 | AC720: =(AA720*100)/AB720 -> 145.03401360544217 | AD720: =(X720*4)+(Z720*2) -> 56
A721: MORDIALLOC | C721: G SMITH 7 | E721: SCAIFFE 5 | G721: McGUINNESS 2 | J721: THOMPSON 2 | M721: HARRY | O721: SHUGG | Q721: LAUGHLIN | W721: BRUNSWICK | X721: 10 | Y721: 6 | Z721: 0 | AA721: 1681 | AB721: 1697 | AC721: =(AA721*100)/AB721 -> 99.057159693576907 | AD721: =(X721*4)+(Z721*2) -> 40
A722: BOX HILL | C722: McNAMEE 4 | F722: JUDD 3 | H722: BRYANT 3 | J722: G SMITH 2 | M722: THOMPSON 2 | P722: COLE | Q722: DOULIS | S722: VICK | W722: NORTHCOTE | X722: 8 | Y722: 8 | Z722: 0 | AA722: 1626 | AB722: 1728 | AC722: =(AA722*100)/AB722 -> 94.097222222222229 | AD722: =(X722*4)+(Z722*2) -> 32
O723: HARRIS
A724: GEELONG WEST | C724: 4 | D724: 4 | E724: =C724*6+D724 -> 28 | G724: 9 | H724: 7 | I724: =G724*6+H724 -> 61 | K724: 15 | L724: 15 | M724: =K724*6+L724 -> 105 | O724: 24 | P724: 17 | Q724: =O724*6+P724 -> 161 | S724: GEELONG WEST | W724: YARRAVILLE | X724: 7 | Y724: 8 | Z724: 1 | AA724: 1863 | AB724: 2018 | AC724: =(AA724*100)/AB724 -> 92.319127849355795 | AD724: =(X724*4)+(Z724*2) -> 30
A725: FRANKSTON | C725: 2 | D725: 6 | E725: =C725*6+D725 -> 18 | G725: 8 | H725: 6 | I725: =G725*6+H725 -> 54 | K725: 9 | L725: 11 | M725: =K725*6+L725 -> 65 | O725: 10 | P725: 15 | Q725: =O725*6+P725 -> 75 | S725: GAMBETTA | W725: CAMBERWELL | X725: 7 | Y725: 9 | Z725: 0 | AA725: 1760 | AB725: 1942 | AC725: =(AA725*100)/AB725 -> 90.628218331616893 | AD725: =(X725*4)+(Z725*2) -> 28
A726: BEST PLAYERS | W726: BOX HILL | X726: 6 | Y726: 10 | Z726: 0 | AA726: 1806 | AB726: 1840 | AC726: =(AA726*100)/AB726 -> 98.152173913043484 | AD726: =(X726*4)+(Z726*2) -> 24
A727: GEELONG WEST | C727: GOGGIN | F727: BARRY | I727: LINKE | L727: DEEATH | O727: GILLIES | R727: HARRIS | W727: FRANKSTON | X727: 4 | Y727: 12 | Z727: 0 | AA727: 1784 | AB727: 1922 | AC727: =(AA727*100)/AB727 -> 92.819979188345471 | AD727: =(X727*4)+(Z727*2) -> 16
A728: FRANKSTON | C728: ROWE | F728: McNAB | I728: LOVELOCK | L728: ROSENBROCK | O728: BLOOMFIELD | R728: RENOUF | W728: MORDIALLOC | X728: 4 | Y728: 12 | Z728: 0 | AA728: 1299 | AB728: 2208 | AC728: =(AA728*100)/AB728 -> 58.831521739130437 | AD728: =(X728*4)+(Z728*2) -> 16
A729: GOALKICKERS | L729: ANDJELKOVIC | O729: VAN ELDON | W729: WERRIBEE | X729: 3 | Y729: 12 | Z729: 1 | AA729: 1630 | AB729: 2129 | AC729: =(AA729*100)/AB729 -> 76.561766087364958 | AD729: =(X729*4)+(Z729*2) -> 14
A730: GEELONG WEST | C730: McLEAN 4 | F730: M BROWNE 4 | I730: SMITH 4 | K730: DEEATH 3 | N730: LINKE 3 | P730: HARRIS 2 | R730: MANSON | T730: R BROWNE
A731: FRANKSTON | C731: JUNGWIRTH 3 | F731: LOVELOCK 2 | I731: McNAB 2 | K731: BLOOMFIELD | N731: McWILLIAMS | Q731: WINSTANLEY
A733: BRUNSWICK | C733: 6 | D733: 7 | E733: =C733*6+D733 -> 43 | G733: 9 | H733: 9 | I733: =G733*6+H733 -> 63 | K733: 13 | L733: 15 | M733: =K733*6+L733 -> 93 | O733: 19 | P733: 19 | Q733: =O733*6+P733 -> 133 | S733: BRUNSWICK
A734: WERRIBEE | C734: 2 | D734: 6 | E734: =C734*6+D734 -> 18 | G734: 8 | H734: 8 | I734: =G734*6+H734 -> 56 | K734: 13 | L734: 10 | M734: =K734*6+L734 -> 88 | O734: 15 | P734: 14 | Q734: =O734*6+P734 -> 104 | S734: STIRLING
A735: BEST PLAYERS
A736: BRUNSWICK | C736: SCHIMMELBUSCH | F736: HADZILLIAS | I736: WROUT | L736: LIAKOUREAS | O736: HORSINGTON | R736: O'BRIEN
A737: WERRIBEE | C737: BOURKE | F737: HINKLEY | I737: DEY | L737: BUTTON | O737: SNOW | R737: GROSSMAN
A738: GOALKICKERS
A739: BRUNSWICK | C739: LIAKOUREAS 5 | F739: SCHIMMELBUSCH 4 | J739: PERRY 4 | L739: BAIRD 2 | N739: WROUT | P739: HORSINGTON | S739: WALLIS | U739: OGSTON
A740: WERRIBEE | C740: LEECE 5 | E740: HINKLEY 3 | H740: BRYANT 3 | J740: KING 2 | L740: PAGE | N740: BUTTON
A742: CAULFIELD | C742: 4 | D742: 9 | E742: =C742*6+D742 -> 33 | G742: 8 | H742: 13 | I742: =G742*6+H742 -> 61 | K742: 13 | L742: 23 | M742: =K742*6+L742 -> 101 | O742: 20 | P742: 26 | Q742: =O742*6+P742 -> 146 | S742: PRINCES PARK, CAULFIELD
A743: CAMBERWELL | C743: 3 | D743: 2 | E743: =C743*6+D743 -> 20 | G743: 6 | H743: 7 | I743: =G743*6+H743 -> 43 | K743: 8 | L743: 9 | M743: =K743*6+L743 -> 57 | O743: 15 | P743: 14 | Q743: =O743*6+P743 -> 104 | S743: HAYES
A744: BEST PLAYERS
A745: CAULFIELD | C745: GOWANS | F745: GUINANE | I745: TEMPEST | L745: JEWELL | O745: WHITE | R745: LOGAN
A746: CAMBERWELL | C746: STONE | F746: BRYCE | I746: EDWARDS | L746: DEITH | O746: PATURZO | R746: MAGNABOSCO
A747: GOALKICKERS
A748: CAULFIELD | C748: CLIFF 4 | E748: CRUNDEN 4 | H748: BROWN 3 | J748: HOCKING 3 | M748: JEWELL 2 | O748: RENOWDEN 2 | R748: LOGAN | T748: VINE
A749: CAMBERWELL | C749: HAMMOND 4 | F749: STONE 4 | H749: BRYCE 2 | J749: DEITH 2 | L749: PATURZO 2 | O749: DE BONDE
A751: YARRAVILLE | C751: 5 | D751: 5 | E751: =C751*6+D751 -> 35 | G751: 10 | H751: 15 | I751: =G751*6+H751 -> 75 | K751: 16 | L751: 20 | M751: =K751*6+L751 -> 116 | O751: 22 | P751: 26 | Q751: =O751*6+P751 -> 158 | S751: YARRAVILLE
A752: NORTHCOTE | C752: 7 | D752: 3 | E752: =C752*6+D752 -> 45 | G752: 9 | H752: 6 | I752: =G752*6+H752 -> 60 | K752: 11 | L752: 10 | M752: =K752*6+L752 -> 76 | O752: 13 | P752: 18 | Q752: =O752*6+P752 -> 96 | S752: CARLILE
A753: BEST PLAYERS
A754: YARRAVILLE | C754: BROWN | F754: MARTIN | I754: KEENAN | L754: KNOTT | O754: MATHESON | R754: DAVIS
A755: NORTHCOTE | C755: BIENKE | F755: STANLEY | I755: MARTIN | L755: UNDERWOOD | O755: SMITH | R755: KENNEALLY
A756: GOALKICKERS
A757: YARRAVILLE | C757: MATHESON 6 | F757: MARTIN 3 | I757: KNOTT 3 | K757: COLE 3 | M757: WAGHORNE 2 | P757: BROPHY | R757: NORRIS | T757: BATES | V757: QUARANTOTTO | X757: DAVIS
A758: NORTHCOTE | C758: KREYMBORG 3 | F758: MARTIN 3 | I758: RYAN 3 | K758: BIENKE 2 | M758: GARRETT | O758: STILSBY
A760: ROUND 17 | E760: 7TH AUGUST | J760: WEATHER | S760: PLAYED AT
D761: 1ST QTR | H761: 2ND QTR | L761: 3RD QTR | P761: FINAL | S761: MORDIALLOC
A762: MORDIALLOC | C762: 3 | D762: 6 | E762: =C762*6+D762 -> 24 | G762: 6 | H762: 10 | I762: =G762*6+H762 -> 46 | K762: 11 | L762: 13 | M762: =K762*6+L762 -> 79 | O762: 17 | P762: 21 | Q762: =O762*6+P762 -> 123 | S762: UMPIRE | X762: LADDER | AB762: ROUND | AD762: 17
A763: CAMBERWELL | C763: 2 | D763: 5 | E763: =C763*6+D763 -> 17 | G763: 4 | H763: 8 | I763: =G763*6+H763 -> 32 | K763: 6 | L763: 11 | M763: =K763*6+L763 -> 47 | O763: 11 | P763: 12 | Q763: =O763*6+P763 -> 78 | S763: CRAIG
A764: BEST PLAYERS | W764: TEAM | X764: W | Y764: L | Z764: D | AA764: FOR | AB764: AGST | AC764: % | AD764: PTS
A765: MORDIALLOC | C765: SCAIFFE | F765: HARRY | I765: PINNE | L765: THOMPSON | O765: JOHNSON | R765: SMITH
A766: CAMBERWELL | C766: FOX | F766: EDWARDS | I766: HAZLETT | L766: HAMMOND | O766: DEITH | W766: GEELONG WEST | X766: 17 | Y766: 0 | Z766: 0 | AA766: 2553 | AB766: 1392 | AC766: =(AA766*100)/AB766 -> 183.40517241379311 | AD766: =(X766*4)+(Z766*2) -> 68
A767: GOALKICKERS | W767: CAULFIELD | X767: 15 | Y767: 2 | Z767: 0 | AA767: 2258 | AB767: 1552 | AC767: =(AA767*100)/AB767 -> 145.48969072164948 | AD767: =(X767*4)+(Z767*2) -> 60
A768: MORDIALLOC | C768: THOMPSON 8 | F768: HARRY 2 | H768: McGUINNESS 2 | K768: SHUGG 2 | M768: SMITH | O768: LAUGHLIN | R768: SCAIFFE | W768: BRUNSWICK | X768: 10 | Y768: 7 | Z768: 0 | AA768: 1814 | AB768: 1858 | AC768: =(AA768*100)/AB768 -> 97.631862217438112 | AD768: =(X768*4)+(Z768*2) -> 40
A769: CAMBERWELL | C769: HAMMOND 3 | F769: BAKER 2 | H769: STONE 2 | J769: DEITH | L769: PATURZO | N769: HAZLETT | P769: EDWARDS | W769: YARRAVILLE | X769: 8 | Y769: 8 | Z769: 1 | AA769: 2001 | AB769: 2095 | AC769: =(AA769*100)/AB769 -> 95.513126491646773 | AD769: =(X769*4)+(Z769*2) -> 34
A771: YARRAVILLE | C771: 7 | D771: 2 | E771: =C771*6+D771 -> 44 | G771: 8 | H771: 6 | I771: =G771*6+H771 -> 54 | K771: 13 | L771: 8 | M771: =K771*6+L771 -> 86 | O771: 21 | P771: 12 | Q771: =O771*6+P771 -> 138 | S771: BOX HILL | W771: NORTHCOTE | X771: 8 | Y771: 9 | Z771: 0 | AA771: 1708 | AB771: 1854 | AC771: =(AA771*100)/AB771 -> 92.125134843581449 | AD771: =(X771*4)+(Z771*2) -> 32
A772: BOX HILL | C772: 5 | D772: 2 | E772: =C772*6+D772 -> 32 | G772: 8 | H772: 4 | I772: =G772*6+H772 -> 52 | K772: 9 | L772: 7 | M772: =K772*6+L772 -> 61 | O772: 11 | P772: 11 | Q772: =O772*6+P772 -> 77 | S772: TORNEY | W772: CAMBERWELL | X772: 7 | Y772: 10 | Z772: 0 | AA772: 1838 | AB772: 2065 | AC772: =(AA772*100)/AB772 -> 89.007263922518163 | AD772: =(X772*4)+(Z772*2) -> 28
A773: BEST PLAYERS | W773: BOX HILL | X773: 6 | Y773: 11 | Z773: 0 | AA773: 1883 | AB773: 1978 | AC773: =(AA773*100)/AB773 -> 95.197168857431748 | AD773: =(X773*4)+(Z773*2) -> 24
A774: YARRAVILLE | C774: MARTIN | F774: KNOTT | I774: RYAN | L774: BATES | O774: SQUIRES | Q774: BROWN | W774: FRANKSTON | X774: 5 | Y774: 12 | Z774: 0 | AA774: 1945 | AB774: 2055 | AC774: =(AA774*100)/AB774 -> 94.647201946472023 | AD774: =(X774*4)+(Z774*2) -> 20
A775: BOX HILL | C775: ATKINSON | F775: RALPH | I775: COSTELLO | L775: J SMITH | W775: MORDIALLOC | X775: 5 | Y775: 12 | Z775: 0 | AA775: 1422 | AB775: 2286 | AC775: =(AA775*100)/AB775 -> 62.204724409448822 | AD775: =(X775*4)+(Z775*2) -> 20
A776: GOALKICKERS | O776: DAVIS | Q776: MATHESON | W776: WERRIBEE | X776: 3 | Y776: 13 | Z776: 1 | AA776: 1699 | AB776: 2294 | AC776: =(AA776*100)/AB776 -> 74.062772449869229 | AD776: =(X776*4)+(Z776*2) -> 14
A777: YARRAVILLE | C777: MARTIN 5 | F777: NORRIS 3 | H777: BATES 3 | J777: KNOTT 3 | L777: WAGHORNE 2 | O777: DOWLING | R777: WITHINGTON | U777: BROWN
A778: BOX HILL | C778: McNAMEE 2 | F778: G SMITH 2 | I778: COSTELLO 2 | L778: JUDD 2 | N778: J SMITH | P778: BRYANT | R778: 1 SHORT
A780: FRANKSTON | C780: 6 | D780: 3 | E780: =C780*6+D780 -> 39 | G780: 14 | H780: 4 | I780: =G780*6+H780 -> 88 | K780: 21 | L780: 7 | M780: =K780*6+L780 -> 133 | O780: 25 | P780: 11 | Q780: =O780*6+P780 -> 161 | S780: FRANKSTON
A781: BRUNSWICK | C781: 5 | D781: 0 | E781: =C781*6+D781 -> 30 | G781: 11 | H781: 2 | I781: =G781*6+H781 -> 68 | K781: 15 | L781: 6 | M781: =K781*6+L781 -> 96 | O781: 20 | P781: 13 | Q781: =O781*6+P781 -> 133 | S781: McMASTER
A782: BEST PLAYERS
A783: FRANKSTON | C783: ROWE | F783: SKREJA | I783: JUNGWIRTH | L783: CLARK | O783: McNAB | Q783: BLOOMFIELD
A784: BRUNSWICK | C784: MILLER | F784: WROUT | I784: LIKOUREAS | L784: O'BRIEN | O784: BAIRD | Q784: OGSTON
A785: GOALKICKERS
A786: FRANKSTON | C786: JUNGWIRTH 13 | F786: LOVELACE 3 | I786: CHASEMORE 3 | L786: CLARK 2 | N786: BLOOMFIELD | Q786: McNAB | S786: ROWE | U786: McWILLIAMS
A787: BRUNSWICK | C787: LIAKOUREAS 6 | F787: BAIRD 5 | H787: SCHIMMELBUSCH 3 | L787: OGSTON 3 | N787: WALLIS | P787: DALTON | R787: GREIG
A789: CAULFIELD | C789: 5 | D789: 3 | E789: =C789*6+D789 -> 33 | G789: 9 | H789: 9 | I789: =G789*6+H789 -> 63 | K789: 12 | L789: 13 | M789: =K789*6+L789 -> 85 | O789: 18 | P789: 18 | Q789: =O789*6+P789 -> 126 | S789: NORTHCOTE
A790: NORTHCOTE | C790: 0 | D790: 3 | E790: =C790*6+D790 -> 3 | G790: 4 | H790: 8 | I790: =G790*6+H790 -> 32 | K790: 7 | L790: 12 | M790: =K790*6+L790 -> 54 | O790: 11 | P790: 16 | Q790: =O790*6+P790 -> 82 | S790: FLANAGAN
A791: BEST PLAYERS
A792: CAULFIELD | C792: FELDMANN | F792: WILLIAMS | I792: CLIFF | L792: HOCKING | O792: HUNTER | Q792: RENOWDEN
A793: NORTHCOTE | C793: GARRETT | F793: STEWART | I793: BIENKE | L793: UNDERWOOD | O793: SMITH | Q793: RYAN
A794: GOALKICKERS
A795: CAULFIELD | C795: CLIFF 4 | E795: WILLIAMS 4 | H795: HOCKING 2 | J795: DOWSETT 2 | M795: CRUNDEN 2 | P795: BROWN 2 | R795: LOGAN | T795: HUNTER
A796: NORTHCOTE | C796: COHEN 2 | E796: MARTIN 2 | H796: KOZARIS 2 | K796: RYAN 2 | M796: GARRETT | O796: KING | Q796: STILSBY
A798: GEELONG WEST | C798: 11 | D798: 2 | E798: =C798*6+D798 -> 68 | G798: 13 | H798: 7 | I798: =G798*6+H798 -> 85 | K798: 21 | L798: 11 | M798: =K798*6+L798 -> 137 | O798: 25 | P798: 15 | Q798: =O798*6+P798 -> 165 | S798: GEELONG WEST
A799: WERRIBEE | C799: 2 | D799: 3 | E799: =C799*6+D799 -> 15 | G799: 5 | H799: 3 | I799: =G799*6+H799 -> 33 | K799: 6 | L799: 5 | M799: =K799*6+L799 -> 41 | O799: 10 | P799: 9 | Q799: =O799*6+P799 -> 69 | S799: ABBOTT
A800: BEST PLAYERS
A801: GEELONG WEST | C801: R BROWNE | F801: HARRIS | I801: ANDJELKOVIC | L801: GRATTON | O801: BARRY | Q801: GOGGIN
A802: WERRIBEE | C802: BUTTON | F802: SOMMERVILLE | I802: ARRIGO | L802: T EDWARDS | O802: COMBEN | Q802: NEWMAN
A803: GOALKICKERS
A804: GEELONG WEST | C804: HARRIS 5 | F804: ANDJELKOVIC 4 | I804: McLEAN 4 | K804: GOGGIN 4 | M804: SMITH 3 | O804: LINKE 2 | Q804: BARRY | S804: M BROWNE | V804: IRVIN
A805: WERRIBEE | C805: BOURKE 3 | F805: COMBEN 2 | I805: BRYANT | K805: ARRIGO | M805: BUTTON | O805: SOMMERVILLE | R805: HINKLEY
A807: ROUND 18 | E807: 14TH AUGUST | J807: WEATHER | S807: PLAYED AT
D808: 1ST QTR | H808: 2ND QTR | L808: 3RD QTR | P808: FINAL | S808: BRUNSWICK
A809: BRUNSWICK | C809: 3 | D809: 2 | E809: =C809*6+D809 -> 20 | G809: 6 | H809: 7 | I809: =G809*6+H809 -> 43 | K809: 11 | L809: 11 | M809: =K809*6+L809 -> 77 | O809: 17 | P809: 19 | Q809: =O809*6+P809 -> 121 | S809: UMPIRE | X809: LADDER | AB809: ROUND | AD809: 18
A810: BOX HILL | C810: 4 | D810: 6 | E810: =C810*6+D810 -> 30 | G810: 8 | H810: 8 | I810: =G810*6+H810 -> 56 | K810: 11 | L810: 11 | M810: =K810*6+L810 -> 77 | O810: 11 | P810: 14 | Q810: =O810*6+P810 -> 80 | S810: CARLILE
A811: BEST PLAYERS | W811: TEAM | X811: W | Y811: L | Z811: D | AA811: FOR | AB811: AGST | AC811: % | AD811: PTS
A812: BRUNSWICK | C812: O'BRIEN | F812: MILLER | I812: DALTON | L812: FORD | O812: OGSTON | R812: McCABE
A813: BOX HILL | C813: COSTELLO | F813: PERRY | I813: RALPH | L813: AULICH | O813: ATKINSON | R813: G SMITH | W813: GEELONG WEST | X813: 18 | Y813: 0 | Z813: 0 | AA813: 2697 | AB813: 1511 | AC813: =(AA813*100)/AB813 -> 178.49106551952349 | AD813: =(X813*4)+(Z813*2) -> 72
A814: GOALKICKERS | C814: 1 SHORT | W814: CAULFIELD | X814: 15 | Y814: 3 | Z814: 0 | AA814: 2377 | AB814: 1695 | AC814: =(AA814*100)/AB814 -> 140.23598820058996 | AD814: =(X814*4)+(Z814*2) -> 60
A815: BRUNSWICK | C815: OGSTON 3 | E815: PERRY 3 | G815: DIMMATINA 3 | J815: LIAKOUREAS 2 | M815: SCHIMMELBUSCH 2 | Q815: WALLIS 2 | S815: BAIRD | W815: BRUNSWICK | X815: 11 | Y815: 7 | Z815: 0 | AA815: 1935 | AB815: 1938 | AC815: =(AA815*100)/AB815 -> 99.845201238390089 | AD815: =(X815*4)+(Z815*2) -> 44
A816: BOX HILL | C816: JUDD 3 | E816: COSTELLO 3 | H816: ZANTUCK 2 | K816: BRYANT 2 | M816: PERRY | W816: YARRAVILLE | X816: 9 | Y816: 8 | Z816: 1 | AA816: 2087 | AB816: 2168 | AC816: =(AA816*100)/AB816 -> 96.263837638376387 | AD816: =(X816*4)+(Z816*2) -> 38
A818: MORDIALLOC | C818: 5 | D818: 3 | E818: =C818*6+D818 -> 33 | G818: 9 | H818: 5 | I818: =G818*6+H818 -> 59 | K818: 15 | L818: 12 | M818: =K818*6+L818 -> 102 | O818: 19 | P818: 17 | Q818: =O818*6+P818 -> 131 | S818: WERRIBEE | W818: NORTHCOTE | X818: 9 | Y818: 9 | Z818: 0 | AA818: 1845 | AB818: 1973 | AC818: =(AA818*100)/AB818 -> 93.512417638114542 | AD818: =(X818*4)+(Z818*2) -> 36
A819: WERRIBEE | C819: 3 | D819: 2 | E819: =C819*6+D819 -> 20 | G819: 6 | H819: 9 | I819: =G819*6+H819 -> 45 | K819: 8 | L819: 9 | M819: =K819*6+L819 -> 57 | O819: 12 | P819: 13 | Q819: =O819*6+P819 -> 85 | S819: GAMBETTA | W819: CAMBERWELL | X819: 7 | Y819: 11 | Z819: 0 | AA819: 1957 | AB819: 2203 | AC819: =(AA819*100)/AB819 -> 88.833408987743979 | AD819: =(X819*4)+(Z819*2) -> 28
A820: BEST PLAYERS | W820: BOX HILL | X820: 6 | Y820: 12 | Z820: 0 | AA820: 1963 | AB820: 2099 | AC820: =(AA820*100)/AB820 -> 93.520724154359215 | AD820: =(X820*4)+(Z820*2) -> 24
A821: MORDIALLOC | C821: DUNNE | F821: RAEBURN | I821: McGUINNESS | L821: WISEMAN | O821: HARRY | Q821: SMITH | W821: MORDIALLOC | X821: 6 | Y821: 12 | Z821: 0 | AA821: 1553 | AB821: 2371 | AC821: =(AA821*100)/AB821 -> 65.499789118515395 | AD821: =(X821*4)+(Z821*2) -> 24
A822: WERRIBEE | C822: LEECE | F822: SNOW | I822: BOURKE | L822: SOMMERVILLE | O822: WHITEHEAD | R822: HINKLEY | W822: FRANKSTON | X822: 5 | Y822: 13 | Z822: 0 | AA822: 2018 | AB822: 2141 | AC822: =(AA822*100)/AB822 -> 94.255021018215785 | AD822: =(X822*4)+(Z822*2) -> 20
A823: GOALKICKERS | W823: WERRIBEE | X823: 3 | Y823: 14 | Z823: 1 | AA823: 1784 | AB823: 2425 | AC823: =(AA823*100)/AB823 -> 73.567010309278345 | AD823: =(X823*4)+(Z823*2) -> 14
A824: MORDIALLOC | C824: McGUINNESS 6 | F824: HARRY 4 | H824: WILKINS 3 | J824: SMITH 2 | L824: SCAIFFE 2 | N824: JOHNSON | P824: BROWN
A825: WERRIBEE | C825: BRYANT 2 | F825: SOMMERVILLE 2 | I825: HINKLEY 2 | K825: ARRIGO | M825: COMBEN | O825: BOURKE | Q825: LEECE | S825: 1 SHORT
A827: NORTHCOTE | C827: 5 | D827: 3 | E827: =C827*6+D827 -> 33 | G827: 10 | H827: 8 | I827: =G827*6+H827 -> 68 | K827: 15 | L827: 11 | M827: =K827*6+L827 -> 101 | O827: 21 | P827: 12 | Q827: =O827*6+P827 -> 138 | S827: CAMBERWELL
A828: CAMBERWELL | C828: 8 | D828: 4 | E828: =C828*6+D828 -> 52 | G828: 13 | H828: 5 | I828: =G828*6+H828 -> 83 | K828: 16 | L828: 7 | M828: =K828*6+L828 -> 103 | O828: 18 | P828: 11 | Q828: =O828*6+P828 -> 119 | S828: McMASTER
A829: BEST PLAYERS
A830: NORTHCOTE | C830: STEWART | F830: KOZARIS | I830: BIENKE | L830: GARRETT | O830: COHEN | Q830: MARTIN
A831: CAMBERWELL | C831: EDWARDS | F831: FOX | I831: HOOK | L831: BRYCE | O831: STONE | Q831: MORRIS
A832: GOALKICKERS
A833: NORTHCOTE | C833: COHEN 4 | E833: BIENKE 4 | G833: STILSBY 4 | I833: RYAN 3 | K833: STEWART 2 | N833: GARRETT 2 | Q833: MARTIN | S833: THORNELOE
A834: CAMBERWELL | C834: HAMMOND 4 | F834: HAZLETT 3 | H834: DE BONDE 2 | K834: STONE 2 | M834: BRYCE 2 | O834: SIMPSON | Q834: McDONALD | S834: BAKER | U834: DEITH | W834: MORRIS
A836: GEELONG WEST | C836: 3 | D836: 7 | E836: =C836*6+D836 -> 25 | G836: 8 | H836: 10 | I836: =G836*6+H836 -> 58 | K836: 13 | L836: 14 | M836: =K836*6+L836 -> 92 | O836: 20 | P836: 23 | Q836: =O836*6+P836 -> 143 | S836: PRINCES PARK, CAULFIELD
A837: CAULFIELD | C837: 4 | D837: 4 | E837: =C837*6+D837 -> 28 | G837: 8 | H837: 8 | I837: =G837*6+H837 -> 56 | K837: 14 | L837: 9 | M837: =K837*6+L837 -> 93 | O837: 18 | P837: 11 | Q837: =O837*6+P837 -> 119 | S837: CHINN
A838: BEST PLAYERS
A839: GEELONG WEST | C839: R BROWNE | F839: GRATTON | I839: IRVIN | L839: MANSON | O839: M BROWNE | R839: GOGGIN
A840: CAULFIELD | C840: BAKER | F840: TEMPEST | I840: LOGAN | L840: BROWN | O840: FELDMANN | R840: HOCKING
A841: GOALKICKERS
A842: GEELONG WEST | C842: LINKE 4 | E842: HARRIS 3 | G842: R BROWNE 3 | J842: M BROWNE 2 | M842: COLLEY 2 | O842: IRVIN | Q842: MANSON | S842: SMITH | U842: DEEATH | W842: ANDJELKOVIC | X842: GOGGIN
A843: CAULFIELD | C843: BROWN 6 | F843: BAKER 3 | H843: GUINANE 2 | J843: LOGAN 2 | M843: CRUNDEN 2 | P843: CLIFF | R843: WILLIAMS | U843: HOCKING
A845: YARRAVILLE | C845: 1 | D845: 1 | E845: =C845*6+D845 -> 7 | G845: 4 | H845: 10 | I845: =G845*6+H845 -> 34 | K845: 6 | L845: 12 | M845: =K845*6+L845 -> 48 | O845: 12 | P845: 14 | Q845: =O845*6+P845 -> 86 | S845: YARRAVILLE
A846: FRANKSTON | C846: 4 | D846: 5 | E846: =C846*6+D846 -> 29 | G846: 4 | H846: 6 | I846: =G846*6+H846 -> 30 | K846: 7 | L846: 11 | M846: =K846*6+L846 -> 53 | O846: 10 | P846: 13 | Q846: =O846*6+P846 -> 73 | S846: McBAIN
A847: BEST PLAYERS
A848: YARRAVILLE | C848: JAMES | F848: WITHINGTON | I848: KNOTT | L848: DAVIS | O848: GREENEY | R848: MARTIN
A849: FRANKSTON | C849: ROSENBROCK | F849: VISSER | I849: STAPLETON | L849: McNAB | O849: FALKINER | R849: BLOOMFIELD
A850: GOALKICKERS
A851: YARRAVILLE | C851: DAVIS 3 | E851: MATHESON 3 | H851: WITHINGTON 2 | K851: WAGHORNE 2 | N851: KNOTT 2
A852: FRANKSTON | C852: JUNGWIRTH 3 | F852: LOVELOCK 2 | I852: McNAB | K852: BLOOMFIELD | N852: FALKINER | Q852: STAPLETON | T852: ROWE
A854: FINALS
A855: 1ST SEMI | E855: 20TH AUGUST | J855: WEATHER | S855: PLAYED AT
D856: 1ST QTR | H856: 2ND QTR | L856: 3RD QTR | P856: FINAL | S856: TOORAK PARK
A857: YARRAVILLE | C857: 2 | D857: 7 | E857: =C857*6+D857 -> 19 | G857: 6 | H857: 8 | I857: =G857*6+H857 -> 44 | K857: 9 | L857: 12 | M857: =K857*6+L857 -> 66 | O857: 15 | P857: 16 | Q857: =O857*6+P857 -> 106 | S857: UMPIRE
A858: BRUNSWICK | C858: 2 | D858: 4 | E858: =C858*6+D858 -> 16 | G858: 8 | H858: 13 | I858: =G858*6+H858 -> 61 | K858: 10 | L858: 19 | M858: =K858*6+L858 -> 79 | O858: 14 | P858: 19 | Q858: =O858*6+P858 -> 103 | S858: GAMBETTA
A859: BEST PLAYERS
A860: YARRAVILLE | C860: DAVIS | F860: MARTIN | I860: WITHINGTON | L860: BROWN | O860: MATHESON | R860: NORRIS
A861: BRUNSWICK | C861: SCHIMMELBUSCH | F861: DIMMATINA | I861: McCABE | L861: DALTON | O861: HADZILLIAS | R861: WALLIS
A862: GOALKICKERS
A863: YARRAVILLE | C863: DAVIS 3 | E863: NORRIS 2 | G863: DOWLING 2 | J863: BATES 2 | L863: WITHINGTON | O863: WAGHORNE | R863: MARSH | T863: KNOTT | W863: MATHESON | Y863: QUARANTOTTO
A864: BRUNSWICK | C864: SCHIMMELBUSCH 5 | G864: WALLIS 2 | I864: DIMMATINA 2 | L864: OGSTON | N864: PERRY | P864: O'BRIEN | R864: DALTON | U864: BAIRD
A866: 2ND SEMI | E866: 27TH AUGUST | J866: WEATHER
A867: GEELONG WEST | E867: =C867*6+D867 -> 0 | I867: =G867*6+H867 -> 0 | M867: =K867*6+L867 -> 0 | O867: 17 | P867: 18 | Q867: =O867*6+P867 -> 120 | S867: TOORAK PARK
A868: CAULFIELD | E868: =C868*6+D868 -> 0 | I868: =G868*6+H868 -> 0 | M868: =K868*6+L868 -> 0 | O868: 17 | P868: 13 | Q868: =O868*6+P868 -> 115
A869: BEST PLAYERS
A870: GEELONG WEST
A871: CAULFIELD
A872: GOALKICKERS
A873: GEELONG WEST
A874: CAULFIELD
A876: PRELIMINARY | E876: 3RD SEPTEMBER | J876: WEATHER
A877: CAULFIELD | E877: =C877*6+D877 -> 0 | I877: =G877*6+H877 -> 0 | M877: =K877*6+L877 -> 0 | O877: 31 | P877: 23 | Q877: =O877*6+P877 -> 209 | S877: TOORAK PARK
A878: YARRAVILLE | E878: =C878*6+D878 -> 0 | I878: =G878*6+H878 -> 0 | M878: =K878*6+L878 -> 0 | O878: 16 | P878: 11 | Q878: =O878*6+P878 -> 107
A879: BEST PLAYERS
A880: CAULFIELD
A881: YARRAVILLE
A882: GOALKICKERS
A883: CAULFIELD
A884: YARRAVILLE
A886: GRAND | E886: 10TH SEPTEMBER | J886: WEATHER
A887: GEELONG WEST | C887: 4 | D887: 1 | E887: =C887*6+D887 -> 25 | G887: 7 | H887: 10 | I887: =G887*6+H887 -> 52 | K887: 10 | L887: 13 | M887: =K887*6+L887 -> 73 | O887: 14 | P887: 16 | Q887: =O887*6+P887 -> 100 | S887: TOORAK PARK
A888: CAULFIELD | C888: 2 | D888: 5 | E888: =C888*6+D888 -> 17 | G888: 3 | H888: 5 | I888: =G888*6+H888 -> 23 | K888: 13 | L888: 7 | M888: =K888*6+L888 -> 85 | O888: 14 | P888: 10 | Q888: =O888*6+P888 -> 94 | S888: TORNEY
A889: BEST PLAYERS
A890: GEELONG WEST | C890: M BROWNE | F890: MANSON | I890: GILLIES | L890: R BROWNE | O890: DEEATH
A891: CAULFIELD | C891: DOWSETT | F891: CLIFF | I891: BAKER | L891: RENOWDEN | O891: TEMPEST | Q891: LOGAN
A892: GOALKICKERS
A893: GEELONG WEST | C893: McLEAN 3 | F893: R BROWNE 2 | I893: M BROWNE 2 | L893: HARRIS 2 | N893: LINKE | P893: MANSON | R893: COLLEY | T893: IRVIN | V893: GILLIES
A894: CAULFIELD | C894: WILLIAMS 5 | F894: BROWN 2 | I894: GUINANE 2 | L894: HOCKING | N894: HAMBLYN | Q894: LOGAN | S894: BAKER | U894: CLIFF