A1: Victorian Football Association
A2: Season 1973 - Division Two
A3: © Copyright Wal Williams | F3: First created: 28 March 2016
A4: Contact: joywalwi at gmail dot com | F4: Last updated: 28 March 2016 | W4: VFA Results and tables - Link to the main index page
A5: You are free to copy this document in whole or part provided that proper acknowledgement is given to the author. All rights reserved.
A7: 1973 | C7: V.F.A. SEASON 2ND DIVISION
A8: ROUND 1 | E8: 15TH APRIL | J8: WEATHER | S8: PLAYED AT
D9: 1ST QTR | H9: 2ND QTR | L9: 3RD QTR | P9: FINAL | S9: PRINCES PARK, CAULFIELD
A10: CAULFIELD | C10: 4 | D10: 6 | E10: =C10*6+D10 -> 30 | G10: 9 | H10: 8 | I10: =G10*6+H10 -> 62 | K10: 16 | L10: 13 | M10: =K10*6+L10 -> 109 | O10: 19 | P10: 17 | Q10: =O10*6+P10 -> 131 | S10: UMPIRE | X10: LADDER | AB10: ROUND | AD10: 1
A11: WAVERLEY | C11: 2 | D11: 3 | E11: =C11*6+D11 -> 15 | G11: 7 | H11: 13 | I11: =G11*6+H11 -> 55 | K11: 14 | L11: 13 | M11: =K11*6+L11 -> 97 | O11: 18 | P11: 22 | Q11: =O11*6+P11 -> 130 | S11: HAYES
A12: BEST PLAYERS | W12: TEAM | X12: W | Y12: L | Z12: D | AA12: FOR | AB12: AGST | AC12: % | AD12: PTS
A13: CAULFIELD | C13: ARRELL | F13: BAKER | I13: LEGH | L13: GUINANE | O13: CLIFF | Q13: SIERAKOWSKI
A14: WAVERLEY | C14: STONE | F14: McNAMEE | I14: B ALLAN | L14: CROUCH | O14: GOODWIN | R14: HOCKING | W14: CAMBERWELL | X14: 1 | Y14: 0 | Z14: 0 | AA14: 126 | AB14: 50 | AC14: =(AA14*100)/AB14 -> 252 | AD14: =(X14*4)+(Z14*2) -> 4
A15: GOALKICKERS | W15: BRUNSWICK | X15: 1 | Y15: 0 | Z15: 0 | AA15: 135 | AB15: 64 | AC15: =(AA15*100)/AB15 -> 210.9375 | AD15: =(X15*4)+(Z15*2) -> 4
A16: CAULFIELD | C16: BROWN 8 | E16: FELDMANN 2 | H16: ARRELL 2 | J16: BARNES 2 | L16: DOHERTY 2 | O16: HUDSON | Q16: BAKER | S16: RENOWDEN | W16: WERRIBEE | X16: 1 | Y16: 0 | Z16: 0 | AA16: 119 | AB16: 71 | AC16: =(AA16*100)/AB16 -> 167.6056338028169 | AD16: =(X16*4)+(Z16*2) -> 4
A17: WAVERLEY | C17: COSTELLO 3 | F17: CROUCH 3 | H17: GOODWIN 3 | K17: B ALLAN 2 | N17: DUTHIE 2 | P17: PITTS 2 | R17: HARRY | W17: YARRAVILLE | X17: 1 | Y17: 0 | Z17: 0 | AA17: 102 | AB17: 66 | AC17: =(AA17*100)/AB17 -> 154.54545454545453 | AD17: =(X17*4)+(Z17*2) -> 4
O18: HOCKING
A19: YARRAVILLE | C19: 5 | D19: 11 | E19: =C19*6+D19 -> 41 | G19: 10 | H19: 13 | I19: =G19*6+H19 -> 73 | K19: 12 | L19: 18 | M19: =K19*6+L19 -> 90 | O19: 13 | P19: 24 | Q19: =O19*6+P19 -> 102 | S19: YARRAVILLE | W19: CAULFIELD | X19: 1 | Y19: 0 | Z19: 0 | AA19: 131 | AB19: 130 | AC19: =(AA19*100)/AB19 -> 100.76923076923077 | AD19: =(X19*4)+(Z19*2) -> 4
A20: MORDIALLOC | C20: 1 | D20: 4 | E20: =C20*6+D20 -> 10 | G20: 3 | H20: 7 | I20: =G20*6+H20 -> 25 | K20: 4 | L20: 15 | M20: =K20*6+L20 -> 39 | O20: 7 | P20: 24 | Q20: =O20*6+P20 -> 66 | S20: WENN | W20: WAVERLEY | X20: 0 | Y20: 1 | Z20: 0 | AA20: 130 | AB20: 131 | AC20: =(AA20*100)/AB20 -> 99.236641221374043 | AD20: =(X20*4)+(Z20*2) -> 0
A21: BEST PLAYERS | W21: MORDIALLOC | X21: 0 | Y21: 1 | Z21: 0 | AA21: 66 | AB21: 102 | AC21: =(AA21*100)/AB21 -> 64.705882352941174 | AD21: =(X21*4)+(Z21*2) -> 0
A22: YARRAVILLE | C22: McLAREN | F22: GREENEY | I22: KEENAN | L22: QUARANTOTTO | P22: WITHINGTON | W22: FRANKSTON | X22: 0 | Y22: 1 | Z22: 0 | AA22: 71 | AB22: 119 | AC22: =(AA22*100)/AB22 -> 59.663865546218489 | AD22: =(X22*4)+(Z22*2) -> 0
A23: MORDIALLOC | C23: BLACKBURN | F23: WE? | I23: FANE | L23: BESANKO | O23: WISEMAN | R23: WALKER | W23: NORTHCOTE | X23: 0 | Y23: 0 | Z23: 0 | AA23: 64 | AB23: 135 | AC23: =(AA23*100)/AB23 -> 47.407407407407405 | AD23: =(X23*4)+(Z23*2) -> 0
A24: GOALKICKERS | W24: BOX HILL | X24: 0 | Y24: 1 | Z24: 0 | AA24: 50 | AB24: 126 | AC24: =(AA24*100)/AB24 -> 39.682539682539684 | AD24: =(X24*4)+(Z24*2) -> 0
A25: YARRAVILLE | C25: McLAREN 5 | F25: MARTIN 3 | I25: DOWLING 2 | L25: BATES 2 | N25: CALAZ
A26: MORDIALLOC | C26: WISEMAN 3 | F26: JOHNSTONE | I26: McGUINNESS | L26: FAHEY | N26: 1 SHORT
A28: WERRIBEE | C28: 4 | D28: 6 | E28: =C28*6+D28 -> 30 | G28: 8 | H28: 11 | I28: =G28*6+H28 -> 59 | K28: 15 | L28: 15 | M28: =K28*6+L28 -> 105 | O28: 17 | P28: 17 | Q28: =O28*6+P28 -> 119 | S28: WERRIBEE
A29: FRANKSTON | C29: 3 | D29: 1 | E29: =C29*6+D29 -> 19 | G29: 4 | H29: 6 | I29: =G29*6+H29 -> 30 | K29: 8 | L29: 7 | M29: =K29*6+L29 -> 55 | O29: 10 | P29: 11 | Q29: =O29*6+P29 -> 71 | S29: GAMBETTA
A30: BEST PLAYERS
A31: WERRIBEE | C31: BOURKE | F31: PAGE | I31: HARVEY | L31: LEECE | N31: COCKS | Q31: ARRIGO
A32: FRANKSTON | C32: ROSENBROCK | F32: BLAKE | I32: ROWE | L32: THATCHER
A33: GOALKICKERS
A34: WERRIBEE | C34: LEECE 5 | E34: MONTGOMERY 3 | H34: DEY 2 | J34: MITCHELL 2 | M34: HARVEY | O34: BRYANT | Q34: ARRIGO | S34: SOMMERVILLE | V34: PAGE
A35: FRANKSTON | C35: JUNGWIRTH 5 | F35: DOHERTY 2 | I35: BLOOMFIELD | L35: BEAMAN | N35: EDWARDS
A37: CAMBERWELL | C37: 3 | D37: 6 | E37: =C37*6+D37 -> 24 | G37: 9 | H37: 17 | I37: =G37*6+H37 -> 71 | K37: 13 | L37: 22 | M37: =K37*6+L37 -> 100 | O37: 17 | P37: 24 | Q37: =O37*6+P37 -> 126 | S37: CAMBERWELL
A38: BOX HILL | C38: 4 | D38: 3 | E38: =C38*6+D38 -> 27 | G38: 5 | H38: 3 | I38: =G38*6+H38 -> 33 | K38: 6 | L38: 7 | M38: =K38*6+L38 -> 43 | O38: 7 | P38: 8 | Q38: =O38*6+P38 -> 50 | S38: FLANAGAN
A39: BEST PLAYERS
A40: CAMBERWELL | C40: MARTIN | F40: DEITH | I40: BOYD | L40: PARSONS | O40: NORTON | R40: KARVELIS
A41: BOX HILL | C41: BRYANT | F41: HARRIS | I41: TIERNEY | L41: ATKINSON | O41: DOULIS | R41: AKER
A42: GOALKICKERS
A43: CAMBERWELL | C43: KARVELIS 5 | F43: DEITH 4 | H43: MARTIN 3 | J43: NORTON 2 | M43: STONE | O43: HAMMOND | R43: PATURZO
A44: BOX HILL | C44: TIERNEY 4 | F44: McMASTER | I44: ZANTUCK | L44: DOULIS
A46: BRUNSWICK | C46: 1 | D46: 4 | E46: =C46*6+D46 -> 10 | G46: 5 | H46: 11 | I46: =G46*6+H46 -> 41 | K46: 17 | L46: 12 | M46: =K46*6+L46 -> 114 | O46: 19 | P46: 21 | Q46: =O46*6+P46 -> 135 | S46: BRUNSWICK
A47: NORTHCOTE | C47: 3 | D47: 1 | E47: =C47*6+D47 -> 19 | G47: 4 | H47: 3 | I47: =G47*6+H47 -> 27 | K47: 6 | L47: 6 | M47: =K47*6+L47 -> 42 | O47: 9 | P47: 10 | Q47: =O47*6+P47 -> 64 | S47: McBAIN
A48: BEST PLAYERS
A49: BRUNSWICK | C49: LAKER | F49: HADZILLIAS | I49: BAIRD | L49: BRIGHAM | O49: O'BRIEN | R49: WROUT
A50: NORTHCOTE | C50: ROPER | F50: GELLIE | I50: KOZARIS | L50: HOUGH | O50: KREYMBORG | R50: McINTYRE
A51: GOALKICKERS
A52: BRUNSWICK | C52: GUEST 4 | E52: BAIRD 4 | G52: GUTTERSON 3 | J52: WHELAN 3 | M52: LAVER 2 | O52: BRIGHAM 2 | R52: LEWIS
A53: NORTHCOTE | C53: HOUGH 4 | F53: MARTIN 2 | I53: GELLIE 2 | K53: VALERKOU
A55: ROUND 2 | E55: 22ND APRIL | J55: WEATHER | S55: PLAYED AT
D56: 1ST QTR | H56: 2ND QTR | L56: 3RD QTR | P56: FINAL | S56: NORTHCOTE
A57: NORTHCOTE | C57: 1 | D57: 1 | E57: =C57*6+D57 -> 7 | G57: 6 | H57: 7 | I57: =G57*6+H57 -> 43 | K57: 9 | L57: 10 | M57: =K57*6+L57 -> 64 | O57: 14 | P57: 14 | Q57: =O57*6+P57 -> 98 | S57: UMPIRE | X57: LADDER | AB57: ROUND | AD57: 2
A58: CAMBERWELL | C58: 5 | D58: 7 | E58: =C58*6+D58 -> 37 | G58: 7 | H58: 8 | I58: =G58*6+H58 -> 50 | K58: 7 | L58: 14 | M58: =K58*6+L58 -> 56 | O58: 9 | P58: 17 | Q58: =O58*6+P58 -> 71 | S58: TORNEY
A59: BEST PLAYERS | W59: TEAM | X59: W | Y59: L | Z59: D | AA59: FOR | AB59: AGST | AC59: % | AD59: PTS
A60: NORTHCOTE | C60: ? | F60: COHEN | I60: WATT | L60: HEPPER | Q60: KOZARIS
A61: CAMBERWELL | C61: ? | F61: KARVELIS | I61: FOX | L61: BOYD | W61: WERRIBEE | X61: 2 | Y61: 0 | Z61: 0 | AA61: 228 | AB61: 145 | AC61: =(AA61*100)/AB61 -> 157.24137931034483 | AD61: =(X61*4)+(Z61*2) -> 8
A62: GOALKICKERS | O62: HARMAN | W62: CAULFIELD | X62: 2 | Y62: 0 | Z62: 0 | AA62: 261 | AB62: 190 | AC62: =(AA62*100)/AB62 -> 137.36842105263159 | AD62: =(X62*4)+(Z62*2) -> 8
A63: NORTHCOTE | C63: KILKENNY 3 | F63: ROPER 2 | H63: ? 1 | J63: NANKERVIS | L63: VALERKOU | N63: BIENKE | P63: KOZARIS | R63: KREYMBORG | W63: NORTHCOTE | X63: 2 | Y63: 0 | Z63: 0 | AA63: 260 | AB63: 277 | AC63: =(AA63*100)/AB63 -> 93.862815884476532 | AD63: =(X63*4)+(Z63*2) -> 8
A64: CAMBERWELL | C64: KARVELIS 4 | F64: ? 2 | H64: MARTIN 2 | K64: VEITCH | W64: CAMBERWELL | X64: 1 | Y64: 1 | Z64: 0 | AA64: 197 | AB64: 148 | AC64: =(AA64*100)/AB64 -> 133.1081081081081 | AD64: =(X64*4)+(Z64*2) -> 4
A66: WERRIBEE | C66: 4 | D66: 9 | E66: =C66*6+D66 -> 33 | G66: 6 | H66: 12 | I66: =G66*6+H66 -> 48 | K66: 13 | L66: 7 | M66: =K66*6+L66 -> 85 | O66: 15 | P66: 19 | Q66: =O66*6+P66 -> 109 | S66: BOX HILL | W66: WAVERLEY | X66: 1 | Y66: 1 | Z66: 0 | AA66: 289 | AB66: 225 | AC66: =(AA66*100)/AB66 -> 128.44444444444446 | AD66: =(X66*4)+(Z66*2) -> 4
A67: BOX HILL | C67: 1 | D67: 3 | E67: =C67*6+D67 -> 9 | G67: 5 | H67: 5 | I67: =G67*6+H67 -> 35 | K67: 5 | L67: 6 | M67: =K67*6+L67 -> 36 | O67: 11 | P67: 8 | Q67: =O67*6+P67 -> 74 | S67: MARKS | W67: YARRAVILLE | X67: 1 | Y67: 1 | Z67: 0 | AA67: 208 | AB67: 200 | AC67: =(AA67*100)/AB67 -> 104 | AD67: =(X67*4)+(Z67*2) -> 4
A68: BEST PLAYERS | W68: BRUNSWICK | X68: 1 | Y68: 1 | Z68: 0 | AA68: 229 | AB68: 223 | AC68: =(AA68*100)/AB68 -> 102.69058295964126 | AD68: =(X68*4)+(Z68*2) -> 4
A69: WERRIBEE | C69: ? | F69: DEY | I69: BOURKE | L69: ? | N69: ? | W69: FRANKSTON | X69: 1 | Y69: 1 | Z69: 0 | AA69: 205 | AB69: 225 | AC69: =(AA69*100)/AB69 -> 91.111111111111114 | AD69: =(X69*4)+(Z69*2) -> 4
A70: BOX HILL | C70: ZANTUCK | F70: ? | I70: ? | L70: BRYANT | N70: HARRIS | Q70: MACKO | W70: MORDIALLOC | X70: 0 | Y70: 2 | Z70: 0 | AA70: 126 | AB70: 232 | AC70: =(AA70*100)/AB70 -> 54.310344827586206 | AD70: =(X70*4)+(Z70*2) -> 0
A71: GOALKICKERS | W71: BOX HILL | X71: 0 | Y71: 2 | Z71: 0 | AA71: 124 | AB71: 235 | AC71: =(AA71*100)/AB71 -> 52.765957446808514 | AD71: =(X71*4)+(Z71*2) -> 0
A72: WERRIBEE | C72: ? | F72: SOMERVILLE 3 | I72: PAGE 2 | K72: ? 2 | M72: LEECE 2
A73: BOX HILL | C73: ? | F73: MACKO 2 | I73: HARRIS 2 | K73: ? | M73: ? | P73: COOK
A75: FRANKSTON | C75: 6 | D75: 2 | E75: =C75*6+D75 -> 38 | G75: 9 | H75: 3 | I75: =G75*6+H75 -> 57 | K75: 14 | L75: 13 | M75: =K75*6+L75 -> 97 | O75: 19 | P75: 20 | Q75: =O75*6+P75 -> 134 | S75: FRANKSTON
A76: YARRAVILLE | C76: 1 | D76: 4 | E76: =C76*6+D76 -> 10 | G76: 9 | H76: 8 | I76: =G76*6+H76 -> 62 | K76: 13 | L76: 17 | M76: =K76*6+L76 -> 95 | O76: 14 | P76: 22 | Q76: =O76*6+P76 -> 106 | S76: CARLILE
A77: BEST PLAYERS
A78: FRANKSTON | C78: ? | F78: BRIESE | I78: McNAB | L78: DOHERTY | O78: ? | Q78: POPE
A79: YARRAVILLE | I79: BROWN | L79: McLAREN
A80: GOALKICKERS
A81: FRANKSTON | C81: JUNGWIRTH 5 | F81: McNAB 3 | H81: ? | J81: BRIESE 2 | L81: SKREJA 2 | N81: BLOOMFIELD | Q81: ? | S81: FITZGERALD
A82: YARRAVILLE | C82: WAGHORNE 4 | F82: ? | H82: R BROWN 3 | K82: CALAZ 2 | N82: ? | Q82: MARTIN
A84: CAULFIELD | C84: 1 | D84: 1 | E84: =C84*6+D84 -> 7 | G84: 9 | H84: 8 | I84: =G84*6+H84 -> 62 | K84: 12 | L84: 8 | M84: =K84*6+L84 -> 80 | O84: 19 | P84: 16 | Q84: =O84*6+P84 -> 130 | S84: MORDIALLOC
A85: MORDIALLOC | C85: 2 | D85: 5 | E85: =C85*6+D85 -> 17 | G85: 2 | H85: 9 | I85: =G85*6+H85 -> 21 | K85: 6 | L85: 11 | M85: =K85*6+L85 -> 47 | O85: 8 | P85: 12 | Q85: =O85*6+P85 -> 60 | S85: CHINN
A86: BEST PLAYERS
A87: CAULFIELD | C87: ? | F87: WHITE | I87: ARRELL | L87: BAKER | O87: ? | R87: ?
A88: MORDIALLOC | C88: HARRY | F88: ? | I88: ? | L88: McGUINNESS | O88: GUY | Q88: PINNE
A89: GOALKICKERS
A90: CAULFIELD | C90: ? | F90: CLIFF 3 | H90: DOHERTY 2 | K90: ? 2 | M90: GOWANS 2 | P90: BARNES 2 | R90: BAKER | T90: GUINANE | W90: HUDSON
A91: MORDIALLOC | C91: McGUINNESS | F91: ? | H91: ? | J91: SMITH | L91: JOHNSTONE | O91: SCAIFFE | Q91: ? | S91: FAHEY
A93: WAVERLEY | C93: 7 | D93: 5 | E93: =C93*6+D93 -> 47 | G93: 15 | H93: 6 | I93: =G93*6+H93 -> 96 | K93: 19 | L93: 9 | M93: =K93*6+L93 -> 123 | O93: 24 | P93: 15 | Q93: =O93*6+P93 -> 159 | S93: WAVERLEY
A94: BRUNSWICK | C94: 2 | D94: 7 | E94: =C94*6+D94 -> 19 | G94: 5 | H94: 9 | I94: =G94*6+H94 -> 39 | K94: 10 | L94: 12 | M94: =K94*6+L94 -> 72 | O94: 13 | P94: 16 | Q94: =O94*6+P94 -> 94 | S94: FLANAGAN
A95: BEST PLAYERS
A96: WAVERLEY | C96: ? | F96: GOODWIN | I96: DUTHIE | L96: FERGUSON | O96: BALLAN | Q96: McNAMEE
A97: BRUNSWICK | C97: O'BRIEN | F97: ANDERSON | I97: ? | L97: WHELAN | O97: GUTTERSON
A98: GOALKICKERS
A99: WAVERLEY | C99: GOODWIN 10 | F99: McNAMEE 5 | I99: OSBORNE 5 | L99: ? 2 | N99: CLARK 2 | P99: CROUCH
A100: BRUNSWICK | C100: BAIRD 5 | E100: LAKE 2 | G100: ? 2 | I100: ? 2 | K100: ELLIS | M100: GUTTERSON
A102: ROUND 3 | E102: 29TH APRIL | J102: WEATHER | S102: PLAYED AT
D103: 1ST QTR | H103: 2ND QTR | L103: 3RD QTR | P103: FINAL | S103: MORDIALLOC
A104: FRANKSTON | C104: 10 | D104: 7 | E104: =C104*6+D104 -> 67 | G104: 13 | H104: 7 | I104: =G104*6+H104 -> 85 | K104: 17 | L104: 11 | M104: =K104*6+L104 -> 113 | O104: 20 | P104: 13 | Q104: =O104*6+P104 -> 133 | S104: UMPIRE | X104: LADDER | AB104: ROUND | AD104: 3
A105: MORDIALLOC | C105: 3 | D105: 1 | E105: =C105*6+D105 -> 19 | G105: 8 | H105: 11 | I105: =G105*6+H105 -> 59 | K105: 10 | L105: 15 | M105: =K105*6+L105 -> 75 | O105: 14 | P105: 20 | Q105: =O105*6+P105 -> 104 | S105: ABBOTT
A106: BEST PLAYERS | W106: TEAM | X106: W | Y106: L | Z106: D | AA106: FOR | AB106: AGST | AC106: % | AD106: PTS
A107: FRANKSTON | C107: McNAB | F107: LOVELOCK | I107: SKREJA | L107: RENOUF | N107: ROWE | Q107: WINSTANLEY
A108: MORDIALLOC | C108: HARRY | F108: SMITH | I108: A McGUINNESS | L108: BESANKO | N108: SCAIFFE | W108: CAULFIELD | X108: 3 | Y108: 0 | Z108: 0 | AA108: 418 | AB108: 280 | AC108: =(AA108*100)/AB108 -> 149.28571428571428 | AD108: =(X108*4)+(Z108*2) -> 12
A109: GOALKICKERS | W109: WAVERLEY | X109: 2 | Y109: 1 | Z109: 0 | AA109: 525 | AB109: 306 | AC109: =(AA109*100)/AB109 -> 171.56862745098039 | AD109: =(X109*4)+(Z109*2) -> 8
A110: FRANKSTON | C110: BRIESE 4 | E110: ? 4 | G110: McNAB 3 | I110: FITZGERALD 3 | L110: DOHERTY 2 | N110: SKREJA 2 | P110: ROWE | R110: HIGGS | W110: WERRIBEE | X110: 2 | Y110: 1 | Z110: 0 | AA110: 301 | AB110: 253 | AC110: =(AA110*100)/AB110 -> 118.97233201581028 | AD110: =(X110*4)+(Z110*2) -> 8
A111: MORDIALLOC | C111: HARRY 5 | E111: LAUGHLIN 3 | H111: SMITH 2 | J111: JOHNSTONE 2 | M111: BLACKBURN | P111: A McGUINNESS | W111: BRUNSWICK | X111: 2 | Y111: 1 | Z111: 0 | AA111: 337 | AB111: 296 | AC111: =(AA111*100)/AB111 -> 113.85135135135135 | AD111: =(X111*4)+(Z111*2) -> 8
A113: WAVERLEY | C113: 6 | D113: 5 | E113: =C113*6+D113 -> 41 | G113: 15 | H113: 8 | I113: =G113*6+H113 -> 98 | K113: 20 | L113: 11 | M113: =K113*6+L113 -> 131 | O113: 36 | P113: 20 | Q113: =O113*6+P113 -> 236 | S113: WAVERLEY | W113: YARRAVILLE | X113: 2 | Y113: 1 | Z113: 0 | AA113: 299 | AB113: 290 | AC113: =(AA113*100)/AB113 -> 103.10344827586206 | AD113: =(X113*4)+(Z113*2) -> 8
A114: BOX HILL | C114: 3 | D114: 8 | E114: =C114*6+D114 -> 26 | G114: 5 | H114: 9 | I114: =G114*6+H114 -> 39 | K114: 10 | L114: 15 | M114: =K114*6+L114 -> 75 | O114: 11 | P114: 15 | Q114: =O114*6+P114 -> 81 | S114: McBAIN | W114: FRANKSTON | X114: 2 | Y114: 1 | Z114: 0 | AA114: 338 | AB114: 329 | AC114: =(AA114*100)/AB114 -> 102.73556231003039 | AD114: =(X114*4)+(Z114*2) -> 8
A115: BEST PLAYERS | W115: NORTHCOTE | X115: 2 | Y115: 1 | Z115: 0 | AA115: 350 | AB115: 434 | AC115: =(AA115*100)/AB115 -> 80.645161290322577 | AD115: =(X115*4)+(Z115*2) -> 8
A116: WAVERLEY | C116: COSTELLO | F116: HORKINGS | I116: GOODWIN | L116: OSBORNE | O116: B ALLAN | R116: R ALLAN | W116: CAMBERWELL | X116: 1 | Y116: 2 | Z116: 0 | AA116: 287 | AB116: 239 | AC116: =(AA116*100)/AB116 -> 120.0836820083682 | AD116: =(X116*4)+(Z116*2) -> 4
A117: BOX HILL | C117: BAKER | F117: COOK | I117: EDWARDS | L117: K RALPH | O117: BRYANT | R117: DOULIS | W117: MORDIALLOC | X117: 0 | Y117: 3 | Z117: 0 | AA117: 230 | AB117: 365 | AC117: =(AA117*100)/AB117 -> 63.013698630136986 | AD117: =(X117*4)+(Z117*2) -> 0
A118: GOALKICKERS | O118: KING | Q118: IVEY | S118: 1 SHORT | W118: BOX HILL | X118: 0 | Y118: 3 | Z118: 0 | AA118: 205 | AB118: 471 | AC118: =(AA118*100)/AB118 -> 43.524416135881104 | AD118: =(X118*4)+(Z118*2) -> 0
A119: WAVERLEY | C119: GOODWIN 11 | F119: OSBORNE 4 | H119: COSTELLO 4 | K119: HARRY 4 | M119: HORKINGS 3 | O119: R ALLAN 3 | R119: PITTS 2 | T119: PARKS 2
A120: BOX HILL | C120: K HARRIS 3 | F120: EDWARDS 2 | I120: BRYANT 2 | K120: COOK | M120: FOX | N120: ZANTUCK | Q120: WATERS
A122: CAULFIELD | C122: 2 | D122: 2 | E122: =C122*6+D122 -> 14 | G122: 11 | H122: 5 | I122: =G122*6+H122 -> 71 | K122: 14 | L122: 10 | M122: =K122*6+L122 -> 94 | O122: 23 | P122: 19 | Q122: =O122*6+P122 -> 157 | S122: PRINCES PARK, CAULFIELD
A123: NORTHCOTE | C123: 7 | D123: 2 | E123: =C123*6+D123 -> 44 | G123: 8 | H123: 5 | I123: =G123*6+H123 -> 53 | K123: 11 | L123: 12 | M123: =K123*6+L123 -> 78 | O123: 13 | P123: 12 | Q123: =O123*6+P123 -> 90 | S123: STIRLING
A124: BEST PLAYERS
A125: CAULFIELD | C125: WHITE | F125: BAKER | I125: CLIFF | L125: McGUIRE | O125: DOWSETT | R125: TULLOCH
A126: NORTHCOTE | C126: LEECH | F126: MCINTYRE | I126: ROPER | L126: KOZARIS | O126: KREYMBORG | R126: COHEN
A127: GOALKICKERS
A128: CAULFIELD | C128: McGUIRE 6 | F128: CLIFF 4 | H128: GOWANS 3 | K128: DOHERTY 2 | N128: DOWSETT 2 | P128: BAKER 2 | R128: TULLOCH | T128: ARRELL | V128: GUINANE | X128: HOCKING
A129: NORTHCOTE | C129: HOUGH 3 | E129: KILKENNY 2 | H129: ROPER 2 | J129: VALERKOU 2 | M129: WATT | O129: BIENKE | Q129: COHEN | S129: GELLIE
A131: BRUNSWICK | C131: 2 | D131: 3 | E131: =C131*6+D131 -> 15 | G131: 6 | H131: 10 | I131: =G131*6+H131 -> 46 | K131: 9 | L131: 15 | M131: =K131*6+L131 -> 69 | O131: 15 | P131: 18 | Q131: =O131*6+P131 -> 108 | S131: WERRIBEE
A132: WERRIBEE | C132: 3 | D132: 5 | E132: =C132*6+D132 -> 23 | G132: 5 | H132: 6 | I132: =G132*6+H132 -> 36 | K132: 7 | L132: 10 | M132: =K132*6+L132 -> 52 | O132: 10 | P132: 13 | Q132: =O132*6+P132 -> 73 | S132: CARLILE
A133: BEST PLAYERS
A134: BRUNSWICK | C134: GUTTERSON | F134: ALLEN | I134: FEWSTER | L134: HADZILLIAS | O134: SKIDMORE
A135: WERRIBEE | C135: LEECE | F135: CORYS | I135: HARVEY | L135: NEWMAN | O135: SOMERVILLE | R135: MEYERS
A136: GOALKICKERS
A137: BRUNSWICK | C137: BAIRD 6 | E137: ALLEN 2 | G137: WHELAN 2 | I137: GUTTERSON 2 | L137: WROUT | N137: BRIGHAM | Q137: HADZILLIAS
A138: WERRIBEE | C138: SOMERVILLE 3 | F138: MITCHELL 2 | I138: MEYERS 2 | K138: O'BRIEN | M138: HINKLEY | O138: LEECE
A140: YARRAVILLE | C140: 6 | D140: 2 | E140: =C140*6+D140 -> 38 | G140: 9 | H140: 3 | I140: =G140*6+H140 -> 57 | K140: 12 | L140: 12 | M140: =K140*6+L140 -> 84 | O140: 13 | P140: 13 | Q140: =O140*6+P140 -> 91 | S140: CAMBERWELL
A141: CAMBERWELL | C141: 3 | D141: 3 | E141: =C141*6+D141 -> 21 | G141: 6 | H141: 11 | I141: =G141*6+H141 -> 47 | K141: 8 | L141: 16 | M141: =K141*6+L141 -> 64 | O141: 12 | P141: 18 | Q141: =O141*6+P141 -> 90 | S141: GAMBETTA
A142: BEST PLAYERS
A143: YARRAVILLE | C143: SQUIRES | F143: KEENAN | I143: STURNEIKS | L143: DAVIS | O143: MARTIN | R143: HARRISON
A144: CAMBERWELL | C144: EDDY | F144: FOX | I144: DEED | L144: SIMPSON | O144: PARSONS | R144: SNOW
A145: GOALKICKERS
A146: YARRAVILLE | C146: WAGHORNE 5 | F146: BATES 3 | H146: MARTIN | J146: BROWN | L146: DAVIS | N146: HOWDEN | Q146: CALAZ
A147: CAMBERWELL | C147: WHITE 3 | E147: KARVELIS 2 | H147: NORRIS 2 | J147: BRYCE | L147: STONE | N147: HAZLETT | Q147: MARTIN | S147: DEITH
A149: ROUND 4 | E149: 6TH MAY | J149: WEATHER | S149: PLAYED AT
D150: 1ST QTR | H150: 2ND QTR | L150: 3RD QTR | P150: FINAL | S150: NORTHCOTE
A151: WAVERLEY | C151: 8 | D151: 6 | E151: =C151*6+D151 -> 54 | G151: 14 | H151: 10 | I151: =G151*6+H151 -> 94 | K151: 19 | L151: 17 | M151: =K151*6+L151 -> 131 | O151: 28 | P151: 19 | Q151: =O151*6+P151 -> 187 | S151: UMPIRE | X151: LADDER | AB151: ROUND | AD151: 4
A152: NORTHCOTE | C152: 0 | D152: 1 | E152: =C152*6+D152 -> 1 | G152: 2 | H152: 3 | I152: =G152*6+H152 -> 15 | K152: 6 | L152: 6 | M152: =K152*6+L152 -> 42 | O152: 10 | P152: 10 | Q152: =O152*6+P152 -> 70 | S152: WENN
A153: BEST PLAYERS | W153: TEAM | X153: W | Y153: L | Z153: D | AA153: FOR | AB153: AGST | AC153: % | AD153: PTS
A154: WAVERLEY | C154: B ALLAN | F154: HOCKING | I154: SMEDTS | L154: HORKINGS | O154: LUMLEY | R154: STONE
A155: NORTHCOTE | C155: KILKENNY | F155: LEECH | I155: ROPER | L155: McINTYRE | O155: LASKIE | R155: HOUGH | W155: WAVERLEY | X155: 3 | Y155: 1 | Z155: 0 | AA155: 712 | AB155: 376 | AC155: =(AA155*100)/AB155 -> 189.36170212765958 | AD155: =(X155*4)+(Z155*2) -> 12
A156: GOALKICKERS | O156: OSBORNE | W156: CAULFIELD | X156: 3 | Y156: 1 | Z156: 0 | AA156: 479 | AB156: 345 | AC156: =(AA156*100)/AB156 -> 138.84057971014494 | AD156: =(X156*4)+(Z156*2) -> 12
A157: WAVERLEY | C157: GOODWIN 7 | F157: STONE 5 | H157: COSTELLO 5 | K157: LAKE 3 | M157: KING 3 | O157: HARRY 2 | Q157: HORKINGS | S157: R ALLAN | W157: BRUNSWICK | X157: 3 | Y157: 1 | Z157: 0 | AA157: 402 | AB157: 357 | AC157: =(AA157*100)/AB157 -> 112.60504201680672 | AD157: =(X157*4)+(Z157*2) -> 12
A158: NORTHCOTE | C158: ROPER 3 | F158: HOUGH 3 | I158: COHEN | K158: MARTIN | M158: NANKERVIS | P158: LASKIE | W158: YARRAVILLE | X158: 3 | Y158: 1 | Z158: 0 | AA158: 417 | AB158: 377 | AC158: =(AA158*100)/AB158 -> 110.61007957559681 | AD158: =(X158*4)+(Z158*2) -> 12
A160: MORDIALLOC | C160: 6 | D160: 6 | E160: =C160*6+D160 -> 42 | G160: 13 | H160: 7 | I160: =G160*6+H160 -> 85 | K160: 18 | L160: 9 | M160: =K160*6+L160 -> 117 | O160: 19 | P160: 12 | Q160: =O160*6+P160 -> 126 | S160: BOX HILL | W160: CAMBERWELL | X160: 2 | Y160: 2 | Z160: 0 | AA160: 411 | AB160: 320 | AC160: =(AA160*100)/AB160 -> 128.4375 | AD160: =(X160*4)+(Z160*2) -> 8
A161: BOX HILL | C161: 3 | D161: 2 | E161: =C161*6+D161 -> 20 | G161: 9 | H161: 5 | I161: =G161*6+H161 -> 59 | K161: 13 | L161: 9 | M161: =K161*6+L161 -> 87 | O161: 18 | P161: 13 | Q161: =O161*6+P161 -> 121 | S161: O'BRIEN | W161: WERRIBEE | X161: 2 | Y161: 2 | Z161: 0 | AA161: 388 | AB161: 371 | AC161: =(AA161*100)/AB161 -> 104.58221024258761 | AD161: =(X161*4)+(Z161*2) -> 8
A162: BEST PLAYERS | W162: FRANKSTON | X162: 2 | Y162: 2 | Z162: 0 | AA162: 414 | AB162: 453 | AC162: =(AA162*100)/AB162 -> 91.390728476821195 | AD162: =(X162*4)+(Z162*2) -> 8
A163: MORDIALLOC | C163: GUY | F163: JOHNSTONE | I163: WISEMAN | L163: SMITH | O163: SCAIFFE | R163: HARRY | W163: NORTHCOTE | X163: 2 | Y163: 2 | Z163: 0 | AA163: 420 | AB163: 621 | AC163: =(AA163*100)/AB163 -> 67.632850241545896 | AD163: =(X163*4)+(Z163*2) -> 8
A164: BOX HILL | C164: BRYANT | F164: CURTIS | I164: NANKERVIS | L164: ZANTUCK | O164: HARRIS | R164: ATKINSON | W164: MORDIALLOC | X164: 1 | Y164: 3 | Z164: 0 | AA164: 356 | AB164: 486 | AC164: =(AA164*100)/AB164 -> 73.251028806584358 | AD164: =(X164*4)+(Z164*2) -> 4
A165: GOALKICKERS | W165: BOX HILL | X165: 0 | Y165: 4 | Z165: 0 | AA165: 326 | AB165: 592 | AC165: =(AA165*100)/AB165 -> 55.067567567567565 | AD165: =(X165*4)+(Z165*2) -> 0
A166: MORDIALLOC | C166: WISEMAN 8 | F166: HARRY 4 | H166: SMITH 3 | J166: McGUINNESS 2 | M166: GUY | O166: WOOTTEN
A167: BOX HILL | C167: EDWARDS 3 | F167: ZANTUCK 3 | I167: BRYANT 3 | K167: HARRIS 3 | M167: TIERNEY 2 | O167: WILLIAMS 2 | R167: COOK | S167: ATKINSON
A169: CAMBERWELL | C169: 2 | D169: 3 | E169: =C169*6+D169 -> 15 | G169: 6 | H169: 7 | I169: =G169*6+H169 -> 43 | K169: 10 | L169: 12 | M169: =K169*6+L169 -> 72 | O169: 18 | P169: 16 | Q169: =O169*6+P169 -> 124 | S169: FRANKSTON
A170: FRANKSTON | C170: 4 | D170: 5 | E170: =C170*6+D170 -> 29 | G170: 7 | H170: 8 | I170: =G170*6+H170 -> 50 | K170: 10 | L170: 13 | M170: =K170*6+L170 -> 73 | O170: 11 | P170: 15 | Q170: =O170*6+P170 -> 81 | S170: STIRLING
A171: BEST PLAYERS
A172: CAMBERWELL | C172: EDDY | F172: TAYLOR | I172: PATURZO | L172: SAUERBERG | O172: HOOK | Q172: SIMPSON
A173: FRANKSTON | C173: ROSENBROCK | F173: SKREJA | I173: STAPLETON | L173: BRIESE | O173: DOHERTY
A174: GOALKICKERS
A175: CAMBERWELL | C175: PATURZO 6 | F175: SIMPSON 3 | H175: ROUTLEDGE 2 | K175: KARVELIS 2 | N175: WHITE 2 | P175: NORTON | R175: TAYLOR | T175: DEITH
A176: FRANKSTON | C176: BRIESE 2 | E176: McNAB 2 | G176: HIGGS 2 | I176: SKREJA 2 | K176: JUNGWIRTH 2 | N176: DOHERTY
A178: YARRAVILLE | C178: 1 | D178: 3 | E178: =C178*6+D178 -> 9 | G178: 5 | H178: 5 | I178: =G178*6+H178 -> 35 | K178: 7 | L178: 7 | M178: =K178*6+L178 -> 49 | O178: 17 | P178: 16 | Q178: =O178*6+P178 -> 118 | S178: YARRAVILLE
A179: WERRIBEE | C179: 6 | D179: 5 | E179: =C179*6+D179 -> 41 | G179: 9 | H179: 5 | I179: =G179*6+H179 -> 59 | K179: 11 | L179: 9 | M179: =K179*6+L179 -> 75 | O179: 13 | P179: 9 | Q179: =O179*6+P179 -> 87 | S179: HUXTABLE
A180: BEST PLAYERS
A181: YARRAVILLE | C181: BROWN | F181: MARTIN | I181: KENNON | L181: STURNEIKS | O181: QUARANTOTTO | S181: DAVIS
A182: WERRIBEE | C182: HOLCOMBE | F182: NEWMAN | I182: NASON | L182: MASON | O182: LEECE | S182: HARVEY
A183: GOALKICKERS
A184: YARRAVILLE | C184: WAGHORNE 4 | F184: McLAREN 2 | H184: BROWN 2 | J184: CALAZ 2 | L184: QUARANTOTTO 2 | O184: MARTIN 2 | R184: HOWDEN | T184: BATES | V184: DAVIS
A185: WERRIBEE | C185: NASON 3 | E185: MEYERS 3 | G185: LEECE 3 | I185: MASON 2 | K185: HINKLEY | M185: JOHNSON
A187: BRUNSWICK | C187: 1 | D187: 3 | E187: =C187*6+D187 -> 9 | G187: 2 | H187: 7 | I187: =G187*6+H187 -> 19 | K187: 3 | L187: 7 | M187: =K187*6+L187 -> 25 | O187: 9 | P187: 11 | Q187: =O187*6+P187 -> 65 | S187: BRUNSWICK
A188: CAULFIELD | C188: 1 | D188: 4 | E188: =C188*6+D188 -> 10 | G188: 5 | H188: 8 | I188: =G188*6+H188 -> 38 | K188: 7 | L188: 11 | M188: =K188*6+L188 -> 53 | O188: 8 | P188: 13 | Q188: =O188*6+P188 -> 61 | S188: GAMBETTA
A189: BEST PLAYERS
A190: BRUNSWICK | C190: HADZILLIAS | F190: FORD | I190: ALLEN | L190: FEWSTER | O190: SKIDMORE | R190: MILLER
A191: CAULFIELD | C191: GUINANE | F191: BAKER | I191: GOWANS | L191: WHITE | O191: DOWSETT | R191: CLIFF
A192: GOALKICKERS
A193: BRUNSWICK | C193: BAIRD 4 | E193: LAKER | G193: HOBBS | I193: GUTTERSON | L193: DIMMATINA | O193: BRIGHAM
A194: CAULFIELD | C194: DOHERTY 2 | F194: BROWN | H194: CLIFF | J194: HAMBLYN | M194: GOWANS | O194: BAKER | Q194: ARRELL
A196: ROUND 5 | E196: 13TH MAY | J196: WEATHER | S196: PLAYED AT
D197: 1ST QTR | H197: 2ND QTR | L197: 3RD QTR | P197: FINAL | S197: FRANKSTON
A198: FRANKSTON | C198: 6 | D198: 7 | E198: =C198*6+D198 -> 43 | G198: 14 | H198: 12 | I198: =G198*6+H198 -> 96 | K198: 19 | L198: 20 | M198: =K198*6+L198 -> 134 | O198: 21 | P198: 21 | Q198: =O198*6+P198 -> 147 | S198: UMPIRE | X198: LADDER | AB198: ROUND | AD198: 5
A199: BOX HILL | C199: 1 | D199: 6 | E199: =C199*6+D199 -> 12 | G199: 8 | H199: 10 | I199: =G199*6+H199 -> 58 | K199: 10 | L199: 14 | M199: =K199*6+L199 -> 74 | O199: 15 | P199: 22 | Q199: =O199*6+P199 -> 112 | S199: WENN
A200: BEST PLAYERS | W200: TEAM | X200: W | Y200: L | Z200: D | AA200: FOR | AB200: AGST | AC200: % | AD200: PTS
A201: FRANKSTON | C201: ROWE | F201: LOVELOCK | I201: SKREJA | L201: FALKINER | O201: BLOOMFIELD | R201: STAPLETON
A202: BOX HILL | C202: BRYANT | F202: ?SON | I202: BAKER | L202: WATERS | O202: IRELAND | W202: WAVERLEY | X202: 4 | Y202: 1 | Z202: 0 | AA202: 948 | AB202: 422 | AC202: =(AA202*100)/AB202 -> 224.64454976303318 | AD202: =(X202*4)+(Z202*2) -> 16
A203: GOALKICKERS | P203: A LLOYD | W203: BRUNSWICK | X203: 3 | Y203: 1 | Z203: 1 | AA203: 508 | AB203: 463 | AC203: =(AA203*100)/AB203 -> 109.71922246220302 | AD203: =(X203*4)+(Z203*2) -> 14
A204: FRANKSTON | C204: JUNGWIRTH 7 | F204: LOVELOCK 6 | I204: SKREJA 2 | K204: ? 2 | M204: McNAB | O204: DOHERTY | Q204: BRIESE | S204: FITZPATRICK | W204: YARRAVILLE | X204: 3 | Y204: 1 | Z204: 1 | AA204: 523 | AB204: 483 | AC204: =(AA204*100)/AB204 -> 108.2815734989648 | AD204: =(X204*4)+(Z204*2) -> 14
A205: BOX HILL | C205: ATKINSON 6 | F205: EDWARDS 3 | I205: ZANTUCK 3 | L205: CHRISTIE | N205: ROBSON | P205: HARRIS | W205: CAULFIELD | X205: 3 | Y205: 2 | Z205: 0 | AA205: 596 | AB205: 477 | AC205: =(AA205*100)/AB205 -> 124.94758909853249 | AD205: =(X205*4)+(Z205*2) -> 12
A207: NORTHCOTE | C207: 7 | D207: 4 | E207: =C207*6+D207 -> 46 | G207: 10 | H207: 8 | I207: =G207*6+H207 -> 68 | K207: 14 | L207: 12 | M207: =K207*6+L207 -> 96 | O207: 24 | P207: 12 | Q207: =O207*6+P207 -> 156 | S207: MORDIALLOC | W207: CAMBERWELL | X207: 3 | Y207: 2 | Z207: 0 | AA207: 543 | AB207: 437 | AC207: =(AA207*100)/AB207 -> 124.25629290617849 | AD207: =(X207*4)+(Z207*2) -> 12
A208: MORDIALLOC | C208: 7 | D208: 6 | E208: =C208*6+D208 -> 48 | G208: 10 | H208: 8 | I208: =G208*6+H208 -> 68 | K208: 14 | L208: 14 | M208: =K208*6+L208 -> 98 | O208: 17 | P208: 16 | Q208: =O208*6+P208 -> 118 | S208: HAYES | W208: FRANKSTON | X208: 3 | Y208: 2 | Z208: 0 | AA208: 561 | AB208: 565 | AC208: =(AA208*100)/AB208 -> 99.292035398230084 | AD208: =(X208*4)+(Z208*2) -> 12
A209: BEST PLAYERS | W209: NORTHCOTE | X209: 3 | Y209: 2 | Z209: 0 | AA209: 576 | AB209: 739 | AC209: =(AA209*100)/AB209 -> 77.943166441136668 | AD209: =(X209*4)+(Z209*2) -> 12
A210: NORTHCOTE | C210: ? | F210: HOUGH | I210: KELLY | L210: WATT | O210: ROPER | W210: WERRIBEE | X210: 2 | Y210: 3 | Z210: 0 | AA210: 434 | AB210: 607 | AC210: =(AA210*100)/AB210 -> 71.49917627677101 | AD210: =(X210*4)+(Z210*2) -> 8
A211: MORDIALLOC | C211: WOOTTEN | F211: JOHNSTONE | I211: FAHEY | L211: HUTTON | O211: WALKER | W211: MORDIALLOC | X211: 1 | Y211: 4 | Z211: 0 | AA211: 474 | AB211: 642 | AC211: =(AA211*100)/AB211 -> 73.831775700934585 | AD211: =(X211*4)+(Z211*2) -> 4
A212: GOALKICKERS | W212: BOX HILL | X212: 0 | Y212: 5 | Z212: 0 | AA212: 438 | AB212: 739 | AC212: =(AA212*100)/AB212 -> 59.269282814614343 | AD212: =(X212*4)+(Z212*2) -> 0
A213: NORTHCOTE | C213: HOUGH 5 | E213: ROPER 4 | G213: COHEN 4 | I213: LASKIE 3 | K213: NANKERVIS 3 | N213: KELLY 3 | P213: VALERKOU | R213: M
A214: MORDIALLOC | C214: FAHEY 4 | E214: WISEMAN 3 | H214: WOOTTEN 3 | K214: HARRY 2 | M214: SCAIFFE 2 | O214: ? 1 | Q214: GUY | R214: JOHNSTONE
A216: WAVERLEY | C216: 5 | D216: 3 | E216: =C216*6+D216 -> 33 | G216: 17 | H216: 4 | I216: =G216*6+H216 -> 106 | K216: 26 | L216: 16 | M216: =K216*6+L216 -> 172 | O216: 35 | P216: 26 | Q216: =O216*6+P216 -> 236 | S216: WAVERLEY
A217: WERRIBEE | C217: 4 | D217: 1 | E217: =C217*6+D217 -> 25 | G217: 4 | H217: 1 | I217: =G217*6+H217 -> 25 | K217: 7 | L217: 2 | M217: =K217*6+L217 -> 44 | O217: 7 | P217: 4 | Q217: =O217*6+P217 -> 46 | S217: O'BRIEN
A218: BEST PLAYERS
A219: WAVERLEY | C219: R ALLAN | F219: B ALLAN | I219: LUMLEY | L219: SMEDTS | O219: STONE | R219: PITTS
A220: WERRIBEE | C220: RIDDELL | F220: ?TON | I220: HARVEY | L220: COCKS | O220: BOURKE | R220: DOUGLAS
A221: GOALKICKERS
A222: WAVERLEY | C222: GOODWIN 11 | F222: STONE 5 | H222: OSBORNE 4 | K222: ? 3 | M222: HARRY 2 | O222: PITTS 2 | Q222: LAKE 2 | S222: R ALLAN 2 | V222: HORKINGS 2 | X222: DE? | Z222: STEPHENS
A223: WERRIBEE | C223: DOUGLAS 3 | F223: MEYERS 2 | I223: LEECE 2
A225: CAMBERWELL | C225: 3 | D225: 4 | E225: =C225*6+D225 -> 22 | G225: 10 | H225: 9 | I225: =G225*6+H225 -> 69 | K225: 12 | L225: 16 | M225: =K225*6+L225 -> 88 | O225: 19 | P225: 18 | Q225: =O225*6+P225 -> 132 | S225: PRINCES PARK, CAULFIELD
A226: CAULFIELD | C226: 3 | D226: 6 | E226: =C226*6+D226 -> 24 | G226: 4 | H226: 7 | I226: =G226*6+H226 -> 31 | K226: 12 | L226: 14 | M226: =K226*6+L226 -> 86 | O226: 16 | P226: 21 | Q226: =O226*6+P226 -> 117 | S226: MARKS
A227: BEST PLAYERS
A228: CAMBERWELL | C228: ? | F228: PARSONS | I228: EDDY | L228: TAYLOR | O228: HUMPHREY | R228: FOX
A229: CAULFIELD | C229: ? | F229: GLAZNER | I229: GOWANS | L229: DOWSETT | O229: ? | R229: GUINANE
A230: GOALKICKERS
A231: CAMBERWELL | C231: HAMMOND 5 | F231: PATURZO 3 | I231: HUMPHREY 3 | L231: SIMPSON 3 | N231: KARVELIS 2 | Q231: ? 2 | S231: BRYCE
A232: CAULFIELD | C232: HOCKING ? | F232: BROWN 3 | I232: BAKER 3 | K232: GLAZNER ? | M232: GOWANS | O232: DOWSETT | Q232: TULLOCH | S232: CRUNDEN
A234: BRUNSWICK | C234: 1 | D234: 4 | E234: =C234*6+D234 -> 10 | G234: 7 | H234: 8 | I234: =G234*6+H234 -> 50 | K234: 10 | L234: 10 | M234: =K234*6+L234 -> 70 | O234: 16 | P234: 10 | Q234: =O234*6+P234 -> 106 | S234: BRUNSWICK
A235: YARRAVILLE | C235: 4 | D235: 3 | E235: =C235*6+D235 -> 27 | G235: 9 | H235: 5 | I235: =G235*6+H235 -> 59 | K235: 13 | L235: 11 | M235: =K235*6+L235 -> 89 | O235: 15 | P235: 16 | Q235: =O235*6+P235 -> 106 | S235: TORNEY
A236: BEST PLAYERS
A237: BRUNSWICK | C237: ALLEN | F237: HOBBS | I237: WROUT | L237: FORD | O237: ?
A238: YARRAVILLE | C238: McLAREN | F238: MARTIN | I238: SMITH | L238: BROWN | O238: BATES
A239: GOALKICKERS
A240: BRUNSWICK | C240: ? 2 | F240: HOBBS 2 | H240: ALLEN 2 | J240: HADZILLIAS 2 | M240: DIMMATINA 2 | P240: WHELAN | R240: WROUT | T240: BRIGHAM | W240: O'BRIEN | X240: GUTTERSON | Z240: ? 1
A241: YARRAVILLE | C241: McLAREN 8 | F241: MARTIN 3 | I241: BROWN | K241: BATES | M241: DAVIS | O241: QUARANTOTTO
A243: ROUND 6 | E243: 20TH MAY | J243: WEATHER | S243: PLAYED AT
D244: 1ST QTR | H244: 2ND QTR | L244: 3RD QTR | P244: FINAL | S244: NORTHCOTE
A245: FRANKSTON | C245: 5 | D245: 2 | E245: =C245*6+D245 -> 32 | G245: 10 | H245: 4 | I245: =G245*6+H245 -> 64 | K245: 16 | L245: 8 | M245: =K245*6+L245 -> 104 | O245: 19 | P245: 13 | Q245: =O245*6+P245 -> 127 | S245: UMPIRE | X245: LADDER | AB245: ROUND | AD245: 6
A246: NORTHCOTE | C246: 1 | D246: 5 | E246: =C246*6+D246 -> 11 | G246: 4 | H246: 7 | I246: =G246*6+H246 -> 31 | K246: 7 | L246: 9 | M246: =K246*6+L246 -> 51 | O246: 10 | P246: 14 | Q246: =O246*6+P246 -> 74 | S246: MARKS
A247: BEST PLAYERS | W247: TEAM | X247: W | Y247: L | Z247: D | AA247: FOR | AB247: AGST | AC247: % | AD247: PTS
A248: FRANKSTON | C248: McNAB | F248: DOHERTY | I248: FALKINER | L248: SKREJA | O248: THATCHER | R248: BLOOMFIELD
A249: NORTHCOTE | C249: GELLIE | F249: JAMES | I249: McCLUSKY | L249: ROBERTS | O249: KILKENNY | R249: LASKIE | W249: WAVERLEY | X249: 5 | Y249: 1 | Z249: 0 | AA249: 1060 | AB249: 525 | AC249: =(AA249*100)/AB249 -> 201.9047619047619 | AD249: =(X249*4)+(Z249*2) -> 20
A250: GOALKICKERS | N250: McNAB | Q250: THATCHER | W250: BRUNSWICK | X250: 4 | Y250: 1 | Z250: 1 | AA250: 642 | AB250: 578 | AC250: =(AA250*100)/AB250 -> 111.07266435986159 | AD250: =(X250*4)+(Z250*2) -> 18
A251: FRANKSTON | C251: SKREJA 4 | E251: DOHERTY 3 | G251: FALKINER 3 | J251: JUNGWIRTH 3 | M251: LOVELOCK | O251: FITZGERALD | R251: POPE | S251: ROWE | W251: YARRAVILLE | X251: 4 | Y251: 1 | Z251: 1 | AA251: 653 | AB251: 590 | AC251: =(AA251*100)/AB251 -> 110.67796610169492 | AD251: =(X251*4)+(Z251*2) -> 18
A252: NORTHCOTE | C252: HOUGH 3 | F252: ROPER 2 | H252: GELLIE 2 | J252: ROBERTS | M252: COHEN | O252: LASKIE | W252: CAULFIELD | X252: 4 | Y252: 2 | Z252: 0 | AA252: 728 | AB252: 591 | AC252: =(AA252*100)/AB252 -> 123.18104906937394 | AD252: =(X252*4)+(Z252*2) -> 16
A254: WAVERLEY | C254: 6 | D254: 1 | E254: =C254*6+D254 -> 37 | G254: 10 | H254: 4 | I254: =G254*6+H254 -> 64 | K254: 14 | L254: 7 | M254: =K254*6+L254 -> 91 | O254: 16 | P254: 16 | Q254: =O254*6+P254 -> 112 | S254: MORDIALLOC | W254: FRANKSTON | X254: 4 | Y254: 2 | Z254: 0 | AA254: 688 | AB254: 639 | AC254: =(AA254*100)/AB254 -> 107.66823161189359 | AD254: =(X254*4)+(Z254*2) -> 16
A255: MORDIALLOC | C255: 4 | D255: 6 | E255: =C255*6+D255 -> 30 | G255: 9 | H255: 7 | I255: =G255*6+H255 -> 61 | K255: 12 | L255: 12 | M255: =K255*6+L255 -> 84 | O255: 15 | P255: 13 | Q255: =O255*6+P255 -> 103 | S255: CARLILE | W255: CAMBERWELL | X255: 3 | Y255: 3 | Z255: 0 | AA255: 658 | AB255: 571 | AC255: =(AA255*100)/AB255 -> 115.23642732049036 | AD255: =(X255*4)+(Z255*2) -> 12
A256: BEST PLAYERS | W256: NORTHCOTE | X256: 3 | Y256: 3 | Z256: 0 | AA256: 650 | AB256: 866 | AC256: =(AA256*100)/AB256 -> 75.057736720554274 | AD256: =(X256*4)+(Z256*2) -> 12
A257: WAVERLEY | C257: OSBORNE | F257: FERGUSON | I257: PITTS | L257: SMEDTS | O257: HANCOCK | R257: STONE | W257: WERRIBEE | X257: 2 | Y257: 4 | Z257: 0 | AA257: 548 | AB257: 739 | AC257: =(AA257*100)/AB257 -> 74.154262516914756 | AD257: =(X257*4)+(Z257*2) -> 8
A258: MORDIALLOC | C258: HARRY | F258: JOHNSTONE | I258: GUY | L258: RAEBURN | O258: WALKER | R258: BESANKO | W258: MORDIALLOC | X258: 1 | Y258: 5 | Z258: 0 | AA258: 577 | AB258: 754 | AC258: =(AA258*100)/AB258 -> 76.525198938992048 | AD258: =(X258*4)+(Z258*2) -> 4
A259: GOALKICKERS | W259: BOX HILL | X259: 0 | Y259: 6 | Z259: 0 | AA259: 545 | AB259: 869 | AC259: =(AA259*100)/AB259 -> 62.715765247410815 | AD259: =(X259*4)+(Z259*2) -> 0
A260: WAVERLEY | C260: GOODWIN 4 | F260: HANCOCK 3 | I260: LAKE 2 | K260: OSBORNE 2 | M260: BALLAN 2 | O260: CROUCH | Q260: PITTS | S260: ? 1
A261: MORDIALLOC | C261: HARRY 6 | E261: LAUGHLIN 3 | G261: SCAIFFE 2 | J261: WISEMAN | M261: JOHNSTONE | P261: FAHEY
A263: YARRAVILLE | C263: 3 | D263: 7 | E263: =C263*6+D263 -> 25 | G263: 5 | H263: 9 | I263: =G263*6+H263 -> 39 | K263: 11 | L263: 13 | M263: =K263*6+L263 -> 79 | O263: 19 | P263: 16 | Q263: =O263*6+P263 -> 130 | S263: YARRAVILLE
A264: BOX HILL | C264: 3 | D264: 1 | E264: =C264*6+D264 -> 19 | G264: 7 | H264: 5 | I264: =G264*6+H264 -> 47 | K264: 10 | L264: 8 | M264: =K264*6+L264 -> 68 | O264: 16 | P264: 11 | Q264: =O264*6+P264 -> 107 | S264: HAYES
A265: BEST PLAYERS
A266: YARRAVILLE | C266: SMITH | F266: JOHNSTONE | I266: BROWN | L266: HOWDEN | O266: HARVEY | R266: HARRISON
A267: BOX HILL | F267: BAKER | I267: BRYANT | L267: COOK | O267: WATERS
A268: GOALKICKERS
A269: YARRAVILLE | C269: JOHNSTONE 9 | F269: HOWDEN 3 | I269: McLAREN | K269: HARRISON | N269: SMITH | P269: MARTIN | R269: HARVEY | T269: BATES | V269: RYAN
A270: BOX HILL | C270: EDWARDS 5 | F270: WILLIAMS 3 | I270: HARRIS 2 | K270: ATKINSON 2 | N270: BRYANT | P270: CHRISTIE | R270: COOK | T270: BATE
A272: CAULFIELD | C272: 6 | D272: 0 | E272: =C272*6+D272 -> 36 | G272: 8 | H272: 6 | I272: =G272*6+H272 -> 54 | K272: 15 | L272: 11 | M272: =K272*6+L272 -> 101 | O272: 20 | P272: 12 | Q272: =O272*6+P272 -> 132 | S272: WERRIBEE
A273: WERRIBEE | C273: 4 | D273: 3 | E273: =C273*6+D273 -> 27 | G273: 9 | H273: 7 | I273: =G273*6+H273 -> 61 | K273: 13 | L273: 9 | M273: =K273*6+L273 -> 87 | O273: 17 | P273: 12 | Q273: =O273*6+P273 -> 114
A274: BEST PLAYERS
A275: CAULFIELD | C275: GUINANE | F275: GOWANS | I275: FELDMANN | L275: ARRELL | O275: JEWELL | R275: CLIFF
A276: WERRIBEE | C276: LEECE | F276: SNOW | I276: J HINKLEY | L276: BRYANT | O276: SHEAHAN | R276: HARVEY
A277: GOALKICKERS
A278: CAULFIELD | C278: GUINANE 6 | F278: JEWELL 3 | H278: HUDSON 3 | J278: CLIFF 2 | L278: BAKER 2 | N278: WATTS 2 | P278: ARRELL | R278: GOWANS
A279: WERRIBEE | C279: LEECE 6 | E279: DEY 2 | G279: SHEAHAN 2 | J279: VELISHA 2 | L279: BRYANT | N279: SNOW | P279: HARVEY | R279: N MITCHELL | U279: NARESS
A281: BRUNSWICK | C281: 7 | D281: 6 | E281: =C281*6+D281 -> 48 | G281: 11 | H281: 8 | I281: =G281*6+H281 -> 74 | K281: 18 | L281: 13 | M281: =K281*6+L281 -> 121 | O281: 20 | P281: 14 | Q281: =O281*6+P281 -> 134 | S281: CAMBERWELL
A282: CAMBERWELL | C282: 3 | D282: 2 | E282: =C282*6+D282 -> 20 | G282: 8 | H282: 8 | I282: =G282*6+H282 -> 56 | K282: 11 | L282: 9 | M282: =K282*6+L282 -> 75 | O282: 17 | P282: 13 | Q282: =O282*6+P282 -> 115 | S282: CHINN
A283: BEST PLAYERS
A284: BRUNSWICK | C284: BAIRD | F284: ALLEN | I284: HADZILLIAS | L284: HOBBS | N284: O'BRIEN | Q284: FORD
A285: CAMBERWELL | C285: FOX | F285: PARSONS | I285: HUMPHREY | L285: SIMPSON | N285: PATURZO | Q285: HAMMOND
A286: GOALKICKERS
A287: BRUNSWICK | C287: BAIRD 8 | F287: ALLEN 4 | H287: HOBBS 3 | J287: HADZILLIAS 2 | M287: O'BRIEN 2 | O287: LAKER
A288: CAMBERWELL | C288: HAMMOND 5 | F288: PATURZO 3 | I288: HUMPHREY 3 | L288: SIMPSON | N288: TAYLOR | P288: NORTON | R288: KARVELIS | T288: EDDY
A290: ROUND 7 | E290: 13TH MAY | J290: WEATHER | S290: PLAYED AT
D291: 1ST QTR | H291: 2ND QTR | L291: 3RD QTR | P291: FINAL | S291: BOX HILL
A292: NORTHCOTE | C292: 6 | D292: 6 | E292: =C292*6+D292 -> 42 | G292: 14 | H292: 9 | I292: =G292*6+H292 -> 93 | K292: 17 | L292: 11 | M292: =K292*6+L292 -> 113 | O292: 20 | P292: 16 | Q292: =O292*6+P292 -> 136 | S292: UMPIRE | X292: LADDER | AB292: ROUND | AD292: 7
A293: BOX HILL | C293: 3 | D293: 5 | E293: =C293*6+D293 -> 23 | G293: 6 | H293: 7 | I293: =G293*6+H293 -> 43 | K293: 12 | L293: 12 | M293: =K293*6+L293 -> 84 | O293: 16 | P293: 18 | Q293: =O293*6+P293 -> 114 | S293: GAMBETTA
A294: BEST PLAYERS | W294: TEAM | X294: W | Y294: L | Z294: D | AA294: FOR | AB294: AGST | AC294: % | AD294: PTS
A295: NORTHCOTE | C295: GELLIE | F295: RICHARDS | I295: VALERKOU | L295: ANDERSON | O295: ROPER | R295: BEATON
A296: BOX HILL | C296: CURTIS | F296: WATERS | I296: BRYANT | L296: ROBSON | O296: RALPH | R296: FOX | W296: WAVERLEY | X296: 6 | Y296: 1 | Z296: 0 | AA296: 1238 | AB296: 627 | AC296: =(AA296*100)/AB296 -> 197.44816586921851 | AD296: =(X296*4)+(Z296*2) -> 24
A297: GOALKICKERS | W297: BRUNSWICK | X297: 5 | Y297: 1 | Z297: 1 | AA297: 766 | AB297: 674 | AC297: =(AA297*100)/AB297 -> 113.64985163204747 | AD297: =(X297*4)+(Z297*2) -> 22
A298: NORTHCOTE | C298: RICHARDS 7 | F298: HOUGH 4 | H298: KREYMBORG 2 | K298: GOLLET 2 | M298: VALERKOU 2 | O298: STEWART | Q298: ROBERTS | S298: KILKENNY | W298: CAULFIELD | X298: 5 | Y298: 2 | Z298: 0 | AA298: 942 | AB298: 673 | AC298: =(AA298*100)/AB298 -> 139.97028231797918 | AD298: =(X298*4)+(Z298*2) -> 20
A299: BOX HILL | C299: ROBSON 5 | F299: FOX 4 | H299: EDWARDS 3 | K299: CURTIS 2 | M299: COOK 2 | W299: YARRAVILLE | X299: 4 | Y299: 2 | Z299: 1 | AA299: 735 | AB299: 804 | AC299: =(AA299*100)/AB299 -> 91.417910447761187 | AD299: =(X299*4)+(Z299*2) -> 18
A301: WAVERLEY | C301: 5 | D301: 3 | E301: =C301*6+D301 -> 33 | G301: 11 | H301: 7 | I301: =G301*6+H301 -> 73 | K301: 20 | L301: 9 | M301: =K301*6+L301 -> 129 | O301: 27 | P301: 16 | Q301: =O301*6+P301 -> 178 | S301: WAVERLEY | W301: FRANKSTON | X301: 4 | Y301: 3 | Z301: 0 | AA301: 790 | AB301: 817 | AC301: =(AA301*100)/AB301 -> 96.695226438188499 | AD301: =(X301*4)+(Z301*2) -> 16
A302: FRANKSTON | C302: 3 | D302: 5 | E302: =C302*6+D302 -> 23 | G302: 7 | H302: 10 | I302: =G302*6+H302 -> 52 | K302: 12 | L302: 16 | M302: =K302*6+L302 -> 88 | O302: 14 | P302: 18 | Q302: =O302*6+P302 -> 102 | S302: TORNEY | W302: NORTHCOTE | X302: 4 | Y302: 3 | Z302: 0 | AA302: 786 | AB302: 980 | AC302: =(AA302*100)/AB302 -> 80.204081632653057 | AD302: =(X302*4)+(Z302*2) -> 16
A303: BEST PLAYERS | W303: CAMBERWELL | X303: 3 | Y303: 4 | Z303: 0 | AA303: 756 | AB303: 694 | AC303: =(AA303*100)/AB303 -> 108.93371757925073 | AD303: =(X303*4)+(Z303*2) -> 12
A304: WAVERLEY | C304: PITTS | F304: B ALLAN | I304: STONE | L304: HORKINGS | O304: HARRY | R304: STEPHENS | W304: WERRIBEE | X304: 3 | Y304: 4 | Z304: 0 | AA304: 671 | AB304: 837 | AC304: =(AA304*100)/AB304 -> 80.167264038231778 | AD304: =(X304*4)+(Z304*2) -> 12
A305: FRANKSTON | C305: BLOOMFIELD | F305: WINSTANLEY | I305: HOPE | L305: FITZGERALD | O305: JUNGWIRTH | R305: ROWE | W305: MORDIALLOC | X305: 1 | Y305: 6 | Z305: 0 | AA305: 673 | AB305: 879 | AC305: =(AA305*100)/AB305 -> 76.564277588168366 | AD305: =(X305*4)+(Z305*2) -> 4
A306: GOALKICKERS | N306: COSTELLO 2 | W306: BOX HILL | X306: 0 | Y306: 7 | Z306: 0 | AA306: 659 | AB306: 1005 | AC306: =(AA306*100)/AB306 -> 65.572139303482587 | AD306: =(X306*4)+(Z306*2) -> 0
A307: WAVERLEY | C307: GOODWIN 8 | F307: HARRY 3 | H307: BALLAN 3 | J307: HANCOCK 3 | M307: DUTHIE 2 | O307: HORKINGS 2 | R307: STONE 2 | T307: PITTS 2
A308: FRANKSTON | C308: JUNGWIRTH 5 | F308: McNAB 3 | I308: LOVELOCK 3 | L308: ROWE | N308: THATCHER | Q308: FALKINER
A310: CAULFIELD | C310: 3 | D310: 8 | E310: =C310*6+D310 -> 26 | G310: 11 | H310: 17 | I310: =G310*6+H310 -> 83 | K310: 24 | L310: 22 | M310: =K310*6+L310 -> 166 | O310: 31 | P310: 28 | Q310: =O310*6+P310 -> 214 | S310: PRINCES PARK, CAULFIELD
A311: YARRAVILLE | C311: 2 | D311: 6 | E311: =C311*6+D311 -> 18 | G311: 3 | H311: 9 | I311: =G311*6+H311 -> 27 | K311: 8 | L311: 13 | M311: =K311*6+L311 -> 61 | O311: 11 | P311: 16 | Q311: =O311*6+P311 -> 82 | S311: FLANANGAN
A312: BEST PLAYERS
A313: CAULFIELD | C313: GOWANS | F313: CLIFF | I313: GUINANE | L313: WHITE | O313: FELDMANN | R313: TULLOCH
A314: YARRAVILLE | C314: MARTIN | F314: QUARANTOTTO | J314: SMITH | L314: BROPHY | O314: SQUIRES | R314: BATES
A315: GOALKICKERS
A316: CAULFIELD | C316: WHITE 6 | E316: GOWANS 4 | G316: CLIFF 4 | I316: ARRELL 4 | K316: JEWELL 3 | M316: HOCKING 3 | O316: BAKER 2 | Q316: GOODEN 2 | S316: WATTS | U316: HUDSON | W316: GUINANE
A317: YARRAVILLE | C317: JOHNSTONE 4 | F317: MARTIN 2 | I317: HARRISON | L317: HOWDEN | N317: BROWN | P317: McLAREN | S317: BATES
A319: WERRIBEE | C319: 5 | D319: 5 | E319: =C319*6+D319 -> 35 | G319: 9 | H319: 8 | I319: =G319*6+H319 -> 62 | K319: 13 | L319: 10 | M319: =K319*6+L319 -> 88 | O319: 18 | P319: 15 | Q319: =O319*6+P319 -> 123 | S319: CAMBERWELL
A320: CAMBERWELL | C320: 3 | D320: 2 | E320: =C320*6+D320 -> 20 | G320: 7 | H320: 5 | I320: =G320*6+H320 -> 47 | K320: 15 | L320: 6 | M320: =K320*6+L320 -> 96 | O320: 15 | P320: 8 | Q320: =O320*6+P320 -> 98 | S320: HAYES
A321: BEST PLAYERS
A322: WERRIBEE | C322: NEWMAN | F322: SHEAHAN | I322: N MITCHELL | L322: BRYANT | N322: BUTTON | Q322: COCKS
A323: CAMBERWELL | C323: FOX | F323: HUMPHREY | I323: MACK | L323: DARE | N323: PATURZO | Q323: EDDY
A324: GOALKICKERS
A325: WERRIBEE | C325: LEECE 5 | E325: N MITCHELL 5 | H325: SHEAHAN 2 | K325: ARRIGO | M325: NEWMAN | O325: COCKS | Q325: F MITCHELL | S325: SNOW | U325: DOUGLAS
A326: CAMBERWELL | C326: HAMMOND 4 | F326: PATURZO 4 | I326: KARVELIS 2 | L326: MORRIS 2 | N326: SIMPSON | P326: HUMPHREY | S326: EDDY
A328: BRUNSWICK | C328: 4 | D328: 7 | E328: =C328*6+D328 -> 31 | G328: 10 | H328: 10 | I328: =G328*6+H328 -> 70 | K328: 13 | L328: 14 | M328: =K328*6+L328 -> 92 | O328: 18 | P328: 16 | Q328: =O328*6+P328 -> 124 | S328: BRUNSWICK
A329: MORDIALLOC | C329: 1 | D329: 2 | E329: =C329*6+D329 -> 8 | G329: 5 | H329: 2 | I329: =G329*6+H329 -> 32 | K329: 10 | L329: 5 | M329: =K329*6+L329 -> 65 | O329: 15 | P329: 6 | Q329: =O329*6+P329 -> 96 | S329: STIRLING
A330: BEST PLAYERS
A331: BRUNSWICK | C331: BAIRD | F331: ALLEN | I331: FORD | L331: HADZILLIAS | O331: LIAKOUREAS | R331: WROUT
A332: MORDIALLOC | C332: RAEBURN | F332: HUTTON | I332: SCAIFFE | L332: GARDNER | O332: WOOTTEN | R332: LANG
A333: GOALKICKERS
A334: BRUNSWICK | C334: BAIRD 8 | F334: ALLEN 5 | I334: GUTTERSON 3 | L334: DIMMATINA | O334: ANDERSON
A335: MORDIALLOC | C335: PATTINSON 4 | F335: WISEMAN 3 | I335: HARRY 2 | K335: LAUGHLIN 2 | N335: WOOTTEN 2 | Q335: WEIR | S335: GARDNER
A337: ROUND 8 | E337: 3RD JUNE | J337: WEATHER | S337: PLAYED AT
D338: 1ST QTR | H338: 2ND QTR | L338: 3RD QTR | P338: FINAL | S338: NORTHCOTE
A339: NORTHCOTE | C339: 5 | D339: 3 | E339: =C339*6+D339 -> 33 | G339: 9 | H339: 5 | I339: =G339*6+H339 -> 59 | K339: 13 | L339: 7 | M339: =K339*6+L339 -> 85 | O339: 20 | P339: 14 | Q339: =O339*6+P339 -> 134 | S339: UMPIRE | X339: LADDER | AB339: ROUND | AD339: 8
A340: WERRIBEE | C340: 4 | D340: 7 | E340: =C340*6+D340 -> 31 | G340: 7 | H340: 9 | I340: =G340*6+H340 -> 51 | K340: 9 | L340: 13 | M340: =K340*6+L340 -> 67 | O340: 11 | P340: 17 | Q340: =O340*6+P340 -> 83 | S340: FLANAGAN
A341: BEST PLAYERS | W341: TEAM | X341: W | Y341: L | Z341: D | AA341: FOR | AB341: AGST | AC341: % | AD341: PTS
A342: NORTHCOTE | C342: WATT | F342: GELLIE | I342: KOZARIS | L342: VALERKOU | O342: KREYMBORG | R342: KILKENNY
A343: WERRIBEE | C343: BUTTON | F343: McCARTNEY | I343: HARVEY | L343: RIDDELL | O343: LEECE | W343: WAVERLEY | X343: 7 | Y343: 1 | Z343: 0 | AA343: 1402 | AB343: 703 | AC343: =(AA343*100)/AB343 -> 199.43100995732576 | AD343: =(X343*4)+(Z343*2) -> 28
A344: GOALKICKERS | P344: STEWART | W344: BRUNSWICK | X344: 6 | Y344: 1 | Z344: 1 | AA344: 875 | AB344: 745 | AC344: =(AA344*100)/AB344 -> 117.4496644295302 | AD344: =(X344*4)+(Z344*2) -> 26
A345: NORTHCOTE | C345: GELLIE 4 | E345: COHEN 3 | G345: RICHARDS 3 | J345: VALERKOU 3 | M345: HOUGH 2 | O345: KILKENNY 2 | R345: NANKERVIS 2 | W345: CAULFIELD | X345: 6 | Y345: 2 | Z345: 0 | AA345: 1090 | AB345: 762 | AC345: =(AA345*100)/AB345 -> 143.04461942257217 | AD345: =(X345*4)+(Z345*2) -> 24
A346: WERRIBEE | C346: DOUGLAS 3 | F346: MITCHELL 2 | I346: NEWMAN 2 | L346: BRYANT | N346: ARRIGO | P346: LEECE | R346: HINKLEY | W346: NORTHCOTE | X346: 5 | Y346: 3 | Z346: 0 | AA346: 920 | AB346: 1063 | AC346: =(AA346*100)/AB346 -> 86.547507055503289 | AD346: =(X346*4)+(Z346*2) -> 20
W347: YARRAVILLE | X347: 4 | Y347: 3 | Z347: 1 | AA347: 811 | AB347: 968 | AC347: =(AA347*100)/AB347 -> 83.780991735537185 | AD347: =(X347*4)+(Z347*2) -> 18
A348: BRUNSWICK | C348: 5 | D348: 2 | E348: =C348*6+D348 -> 32 | G348: 8 | H348: 6 | I348: =G348*6+H348 -> 54 | K348: 13 | L348: 6 | M348: =K348*6+L348 -> 84 | O348: 17 | P348: 7 | Q348: =O348*6+P348 -> 109 | S348: BOX HILL | W348: CAMBERWELL | X348: 4 | Y348: 4 | Z348: 0 | AA348: 866 | AB348: 758 | AC348: =(AA348*100)/AB348 -> 114.24802110817942 | AD348: =(X348*4)+(Z348*2) -> 16
A349: BOX HILL | C349: 3 | D349: 2 | E349: =C349*6+D349 -> 20 | G349: 6 | H349: 6 | I349: =G349*6+H349 -> 42 | K349: 9 | L349: 10 | M349: =K349*6+L349 -> 64 | O349: 10 | P349: 11 | Q349: =O349*6+P349 -> 71 | S349: ABBOTT | W349: FRANKSTON | X349: 4 | Y349: 4 | Z349: 0 | AA349: 879 | AB349: 965 | AC349: =(AA349*100)/AB349 -> 91.088082901554401 | AD349: =(X349*4)+(Z349*2) -> 16
A350: BEST PLAYERS | W350: WERRIBEE | X350: 3 | Y350: 5 | Z350: 0 | AA350: 754 | AB350: 971 | AC350: =(AA350*100)/AB350 -> 77.651905252317192 | AD350: =(X350*4)+(Z350*2) -> 12
A351: BRUNSWICK | C351: DIMMATINA | F351: BAIRD | I351: WROUT | L351: SKIDMORE | O351: GUTTERSON | R351: HOBBS | W351: MORDIALLOC | X351: 1 | Y351: 7 | Z351: 0 | AA351: 737 | AB351: 989 | AC351: =(AA351*100)/AB351 -> 74.519716885743179 | AD351: =(X351*4)+(Z351*2) -> 4
A352: BOX HILL | C352: BRYANT | F352: NANKERVIS | I352: TIERNEY | L352: CURTIS | O352: FOX | R352: DOULIS | W352: BOX HILL | X352: 0 | Y352: 8 | Z352: 0 | AA352: 730 | AB352: 1114 | AC352: =(AA352*100)/AB352 -> 65.529622980251347 | AD352: =(X352*4)+(Z352*2) -> 0
A353: GOALKICKERS
A354: BRUNSWICK | C354: BAIRD 6 | E354: GUTTERSON 3 | H354: DIMMATINA 3 | K354: ALLEN 2 | M354: HADZILLIAS | O354: ANDERSON | R354: HOBBS
A355: BOX HILL | C355: TIERNEY 4 | F355: FOX 2 | H355: PAGEY 2 | J355: CURTIS 2
A357: CAULFIELD | C357: 6 | D357: 4 | E357: =C357*6+D357 -> 40 | G357: 10 | H357: 7 | I357: =G357*6+H357 -> 67 | K357: 18 | L357: 12 | M357: =K357*6+L357 -> 120 | O357: 22 | P357: 16 | Q357: =O357*6+P357 -> 148 | S357: FRANKSTON
A358: FRANKSTON | C358: 3 | D358: 3 | E358: =C358*6+D358 -> 21 | G358: 7 | H358: 12 | I358: =G358*6+H358 -> 54 | K358: 7 | L358: 14 | M358: =K358*6+L358 -> 56 | O358: 12 | P358: 17 | Q358: =O358*6+P358 -> 89 | S358: O'BRIEN
A359: BEST PLAYERS
A360: CAULFIELD | C360: FELDMANN | F360: WHITE | I360: BAKER | L360: CLIFF | O360: DOWSETT | R360: WATTS
A361: FRANKSTON | C361: ROSENBROCK | F361: WINSTANLEY | I361: BLOOMFIELD | L361: ROWE | O361: McNAB
A362: GOALKICKERS
A363: CAULFIELD | C363: WATTS 4 | E363: WHITE 3 | G363: CLIFF 3 | I363: GOODEN 3 | K363: GOWANS 2 | N363: ARRELL 2 | P363: HUNTER 2 | R363: GUINANE | T363: BAKER | V363: JEWELL
A364: FRANKSTON | C364: JUNGWIRTH 4 | F364: BRIESE 3 | I364: McNAB 2 | K364: DOHERTY 2 | N364: FALKINER
A366: CAMBERWELL | C366: 3 | D366: 8 | E366: =C366*6+D366 -> 26 | G366: 7 | H366: 9 | I366: =G366*6+H366 -> 51 | K366: 12 | L366: 11 | M366: =K366*6+L366 -> 83 | O366: 16 | P366: 14 | Q366: =O366*6+P366 -> 110 | S366: MORDIALLOC
A367: MORDIALLOC | C367: 2 | D367: 4 | E367: =C367*6+D367 -> 16 | G367: 4 | H367: 9 | I367: =G367*6+H367 -> 33 | K367: 7 | L367: 12 | M367: =K367*6+L367 -> 54 | O367: 8 | P367: 16 | Q367: =O367*6+P367 -> 64 | S367: McBAIN
A368: BEST PLAYERS
A369: CAMBERWELL | C369: COOK | F369: SIMPSON | I369: HAZLETT | L369: HAMMOND | O369: MORRIS | R369: BRAYNE
A370: MORDIALLOC | C370: SCAIFFE | F370: HARRY | I370: LANG | L370: HUTTON | O370: RAEBURN
A371: GOALKICKERS
A372: CAMBERWELL | C372: HAMMOND 5 | F372: WILSON 3 | I372: SAUERBERG 2 | L372: HAZLETT 2 | N372: PATURZO 2 | Q372: MORRIS | S372: SHOEMAKER
A373: MORDIALLOC | C373: HARRY 3 | F373: WOOTTEN | I373: LAUGHLIN | L373: SHUGG | N373: JOHNSTONE | Q373: A McGUINNESS
A375: WAVERLEY | C375: 5 | D375: 5 | E375: =C375*6+D375 -> 35 | G375: 11 | H375: 8 | I375: =G375*6+H375 -> 74 | K375: 17 | L375: 12 | M375: =K375*6+L375 -> 114 | O375: 24 | P375: 20 | Q375: =O375*6+P375 -> 164 | S375: WAVERLEY
A376: YARRAVILLE | C376: 4 | D376: 1 | E376: =C376*6+D376 -> 25 | G376: 7 | H376: 5 | I376: =G376*6+H376 -> 47 | K376: 9 | L376: 7 | M376: =K376*6+L376 -> 61 | O376: 11 | P376: 10 | Q376: =O376*6+P376 -> 76 | S376: MARKS
A377: BEST PLAYERS
A378: WAVERLEY | C378: GOODWIN | F378: COSTELLO | I378: TOOHEY | L378: B ALLAN | O378: STONE | R378: SYKES
A379: YARRAVILLE | C379: QUARANTOTTO | F379: BROWN | I379: RYAN | L379: SMITH | O379: COLEMAN | R379: WAGHORNE
A380: GOALKICKERS
A381: WAVERLEY | C381: GOODWIN 8 | F381: B ALLAN 4 | H381: COSTELLO 4 | K381: HARRY 2 | M381: HANCOCK 2 | O381: OSBORNE | Q381: DUTHIE | S381: STONE | U381: HORKINGS
A382: YARRAVILLE | C382: DOWLING 3 | F382: JOHNSTONE 2 | I382: WAGHORNE 2 | L382: MARTIN | N382: COLEMAN | Q382: BROWN | S382: BATES
A384: ROUND 9 | E384: 10TH JUNE | J384: WEATHER | S384: PLAYED AT
D385: 1ST QTR | H385: 2ND QTR | L385: 3RD QTR | P385: FINAL | S385: YARRAVILLE
A386: YARRAVILLE | C386: 5 | D386: 2 | E386: =C386*6+D386 -> 32 | G386: 7 | H386: 3 | I386: =G386*6+H386 -> 45 | K386: 10 | L386: 9 | M386: =K386*6+L386 -> 69 | O386: 13 | P386: 15 | Q386: =O386*6+P386 -> 93 | S386: UMPIRE | X386: LADDER | AB386: ROUND | AD386: 9
A387: NORTHCOTE | C387: 3 | D387: 4 | E387: =C387*6+D387 -> 22 | G387: 8 | H387: 9 | I387: =G387*6+H387 -> 57 | K387: 10 | L387: 10 | M387: =K387*6+L387 -> 70 | O387: 10 | P387: 15 | Q387: =O387*6+P387 -> 75 | S387: O'BRIEN
A388: BEST PLAYERS | W388: TEAM | X388: W | Y388: L | Z388: D | AA388: FOR | AB388: AGST | AC388: % | AD388: PTS
A389: YARRAVILLE | C389: COLEMAN | F389: RYAN | I389: WITHINGTON | L389: QUARANTOTTO | O389: DOWLING | R389: MARTIN
A390: NORTHCOTE | C390: ROPER | F390: VALERKOU | I390: LYNCH | L390: KREYMBORG | O390: BEATON | R390: GELLIE | W390: WAVERLEY | X390: 8 | Y390: 1 | Z390: 0 | AA390: 1502 | AB390: 743 | AC390: =(AA390*100)/AB390 -> 202.15343203230148 | AD390: =(X390*4)+(Z390*2) -> 32
A391: GOALKICKERS | W391: BRUNSWICK | X391: 7 | Y391: 1 | Z391: 1 | AA391: 984 | AB391: 816 | AC391: =(AA391*100)/AB391 -> 120.58823529411765 | AD391: =(X391*4)+(Z391*2) -> 30
A392: YARRAVILLE | C392: COLEMAN 3 | F392: DOWLING 3 | I392: BARR 3 | K392: MARTIN 2 | N392: RYAN | P392: SQUIRES | W392: CAULFIELD | X392: 7 | Y392: 2 | Z392: 0 | AA392: 1252 | AB392: 812 | AC392: =(AA392*100)/AB392 -> 154.18719211822659 | AD392: =(X392*4)+(Z392*2) -> 28
A393: NORTHCOTE | C393: RYAN 2 | E393: HOUGH 2 | G393: KREYMBORG 2 | J393: KILKENNY | M393: STEWART | O393: ROPER | Q393: RICHARDS | W393: YARRAVILLE | X393: 5 | Y393: 3 | Z393: 1 | AA393: 904 | AB393: 1043 | AC393: =(AA393*100)/AB393 -> 86.673058485139023 | AD393: =(X393*4)+(Z393*2) -> 22
A395: CAULFIELD | C395: 5 | D395: 6 | E395: =C395*6+D395 -> 36 | G395: 11 | H395: 11 | I395: =G395*6+H395 -> 77 | K395: 19 | L395: 19 | M395: =K395*6+L395 -> 133 | O395: 23 | P395: 24 | Q395: =O395*6+P395 -> 162 | S395: PRINCES PARK, CAULFIELD | W395: NORTHCOTE | X395: 5 | Y395: 4 | Z395: 0 | AA395: 995 | AB395: 1156 | AC395: =(AA395*100)/AB395 -> 86.072664359861591 | AD395: =(X395*4)+(Z395*2) -> 20
A396: BOX HILL | C396: 2 | D396: 0 | E396: =C396*6+D396 -> 12 | G396: 3 | H396: 1 | I396: =G396*6+H396 -> 19 | K396: 5 | L396: 1 | M396: =K396*6+L396 -> 31 | O396: 8 | P396: 2 | Q396: =O396*6+P396 -> 50 | S396: CHINN | W396: CAMBERWELL | X396: 4 | Y396: 5 | Z396: 0 | AA396: 906 | AB396: 858 | AC396: =(AA396*100)/AB396 -> 105.5944055944056 | AD396: =(X396*4)+(Z396*2) -> 16
A397: BEST PLAYERS | W397: FRANKSTON | X397: 4 | Y397: 5 | Z397: 0 | AA397: 950 | AB397: 1074 | AC397: =(AA397*100)/AB397 -> 88.454376163873377 | AD397: =(X397*4)+(Z397*2) -> 16
A398: CAULFIELD | C398: CLIFF | F398: GOWANS | I398: GUINANE | L398: BAKER | O398: JEWELL | R398: GLAZNER | W398: WERRIBEE | X398: 4 | Y398: 5 | Z398: 0 | AA398: 888 | AB398: 1046 | AC398: =(AA398*100)/AB398 -> 84.894837476099426 | AD398: =(X398*4)+(Z398*2) -> 16
A399: BOX HILL | C399: CURTIS | F399: BRYANT | I399: COOK | L399: ZANTUCK | O399: NANKERVIS | R399: WATERS | W399: MORDIALLOC | X399: 1 | Y399: 8 | Z399: 0 | AA399: 742 | AB399: 1123 | AC399: =(AA399*100)/AB399 -> 66.073018699910946 | AD399: =(X399*4)+(Z399*2) -> 4
A400: GOALKICKERS | W400: BOX HILL | X400: 0 | Y400: 9 | Z400: 0 | AA400: 780 | AB400: 1276 | AC400: =(AA400*100)/AB400 -> 61.128526645768027 | AD400: =(X400*4)+(Z400*2) -> 0
A401: CAULFIELD | C401: CLIFF 5 | E401: WATTS 4 | G401: BAKER 3 | I401: JEWELL 3 | K401: GOWANS 2 | N401: WHITE 2 | P401: GOODEN 2 | R401: HOCKING | T401: TULLOCH
A402: BOX HILL | C402: CURTIS 3 | F402: COOK 3 | I402: LUGG | K402: EDWARDS
A404: WERRIBEE | C404: 3 | D404: 7 | E404: =C404*6+D404 -> 25 | G404: 7 | H404: 12 | I404: =G404*6+H404 -> 54 | K404: 10 | L404: 15 | M404: =K404*6+L404 -> 75 | O404: 19 | P404: 20 | Q404: =O404*6+P404 -> 134 | S404: WERRIBEE
A405: MORDIALLOC | C405: 2 | D405: 2 | E405: =C405*6+D405 -> 14 | G405: 6 | H405: 5 | I405: =G405*6+H405 -> 41 | K405: 9 | L405: 8 | M405: =K405*6+L405 -> 62 | O405: 11 | P405: 9 | Q405: =O405*6+P405 -> 75 | S405: MARKS
A406: BEST PLAYERS
A407: WERRIBEE | C407: DEY | F407: McCARTNEY | I407: BUTTON | L407: F MITCHELL | O407: NEWMAN | R407: DOUGLAS
A408: MORDIALLOC | C408: GARDNER | F408: SCAIFFE | I408: WILKINS | L408: WALKER | O408: GUY | R408: SHUGG
A409: GOALKICKERS
A410: WERRIBEE | C410: DEY 6 | E410: MONTGOMERY 4 | H410: N MITCHELL 3 | K410: LEECE 2 | M410: HINKLEY | O410: F MITCHELL | R410: SNOW | S410: DOUGLAS
A411: MORDIALLOC | C411: SHUGG 3 | F411: McGUINNESS 2 | I411: NORTON 2 | K411: WILKINS 2 | N411: SCAIFFE | P411: PINNE
A413: WAVERLEY | C413: 6 | D413: 4 | E413: =C413*6+D413 -> 40 | G413: 8 | H413: 11 | I413: =G413*6+H413 -> 59 | K413: 9 | L413: 16 | M413: =K413*6+L413 -> 70 | O413: 13 | P413: 22 | Q413: =O413*6+P413 -> 100 | S413: WERRIBEE
A414: CAMBERWELL | C414: 3 | D414: 2 | E414: =C414*6+D414 -> 20 | G414: 4 | H414: 6 | I414: =G414*6+H414 -> 30 | K414: 5 | L414: 7 | M414: =K414*6+L414 -> 37 | O414: 5 | P414: 10 | Q414: =O414*6+P414 -> 40 | S414: HUXTABLE
A415: BEST PLAYERS
A416: WAVERLEY | C416: HARRY | F416: HORKINGS | I416: B ALLAN | L416: HOCKING | O416: LUMLEY | R416: FERGUSON
A417: CAMBERWELL | C417: HUMPHREY | F417: FOX | I417: HOOK | L417: CAMERON | O417: BRAYNE | R417: MORRIS
A418: GOALKICKERS
A419: WAVERLEY | C419: GOODWIN 5 | F419: B ALLAN 3 | I419: HARRY 2 | K419: HORKINGS | N419: DUTHIE | P419: GILLESPIE
A420: CAMBERWELL | C420: PATURZO 2 | F420: DARE | H420: HAMMOND | K420: WILSON
A422: BRUNSWICK | C422: 6 | D422: 3 | E422: =C422*6+D422 -> 39 | G422: 9 | H422: 6 | I422: =G422*6+H422 -> 60 | K422: 13 | L422: 9 | M422: =K422*6+L422 -> 87 | O422: 16 | P422: 13 | Q422: =O422*6+P422 -> 109 | S422: BRUNSWICK
A423: FRANKSTON | C423: 2 | D423: 1 | E423: =C423*6+D423 -> 13 | G423: 3 | H423: 3 | I423: =G423*6+H423 -> 21 | K423: 7 | L423: 7 | M423: =K423*6+L423 -> 49 | O423: 10 | P423: 11 | Q423: =O423*6+P423 -> 71 | S423: McBEAN
A424: BEST PLAYERS
A425: BRUNSWICK | C425: DIMMATINA | F425: GUEST | I425: ANDERSON | L425: HOBBS | O425: O'BRIEN | R425: HADZILLIAS
A426: FRANKSTON | C426: FALKINER | F426: POPE | I426: BRIESE | L426: SKREJA | O426: BEAMAN | R426: McNAB
A427: GOALKICKERS
A428: BRUNSWICK | C428: BAIRD 4 | F428: DIMMATINA 4 | I428: ANDERSON 3 | L428: ALLEN 3 | N428: O'BRIEN | P428: EVERETT
A429: FRANKSTON | C429: POPE 3 | F429: BRIESE 2 | I429: McWILLIAMS 2 | L429: McNAB | N429: SKREJA | P429: JUNGWIRTH
A431: ROUND 10 | E431: 13TH JUNE | J431: WEATHER | S431: PLAYED AT
D432: 1ST QTR | H432: 2ND QTR | L432: 3RD QTR | P432: FINAL | S432: NORTHCOTE
A433: NORTHCOTE | C433: 4 | D433: 3 | E433: =C433*6+D433 -> 27 | G433: 7 | H433: 7 | I433: =G433*6+H433 -> 49 | K433: 12 | L433: 11 | M433: =K433*6+L433 -> 83 | O433: 19 | P433: 17 | Q433: =O433*6+P433 -> 131 | S433: UMPIRE | X433: LADDER | AB433: ROUND | AD433: 10
A434: BRUNSWICK | C434: 5 | D434: 1 | E434: =C434*6+D434 -> 31 | G434: 11 | H434: 3 | I434: =G434*6+H434 -> 69 | K434: 15 | L434: 7 | M434: =K434*6+L434 -> 97 | O434: 18 | P434: 8 | Q434: =O434*6+P434 -> 116 | S434: HAYES
A435: BEST PLAYERS | W435: TEAM | X435: W | Y435: L | Z435: D | AA435: FOR | AB435: AGST | AC435: % | AD435: PTS
A436: NORTHCOTE | C436: CARACELLA | F436: WATT | I436: GELLIE | L436: VALERKOU | O436: RYAN | R436: ROPER
A437: BRUNSWICK | C437: BAIRD | F437: ALLEN | I437: FORD | L437: GUEST | O437: ANDERSON | R437: HOBBS | W437: WAVERLEY | X437: 9 | Y437: 1 | Z437: 0 | AA437: 1604 | AB437: 841 | AC437: =(AA437*100)/AB437 -> 190.72532699167658 | AD437: =(X437*4)+(Z437*2) -> 36
A438: GOALKICKERS | Q438: KREYMBORG | W438: BRUNSWICK | X438: 7 | Y438: 2 | Z438: 1 | AA438: 1100 | AB438: 947 | AC438: =(AA438*100)/AB438 -> 116.15628299894404 | AD438: =(X438*4)+(Z438*2) -> 30
A439: NORTHCOTE | C439: CARACELLA 5 | F439: KREYMBORG 3 | I439: COHEN 2 | K439: HOUGH 2 | M439: VALERKOU 2 | P439: RYAN 2 | R439: RICHARDS | T439: GELLIE | W439: CAULFIELD | X439: 7 | Y439: 3 | Z439: 0 | AA439: 1350 | AB439: 914 | AC439: =(AA439*100)/AB439 -> 147.70240700218818 | AD439: =(X439*4)+(Z439*2) -> 28
A440: BRUNSWICK | C440: BAIRD 10 | F440: ALLEN 4 | H440: ANDERSON | K440: WROUT | M440: HOBBS | O440: HADZILLIAS | W440: NORTHCOTE | X440: 6 | Y440: 4 | Z440: 0 | AA440: 1126 | AB440: 1272 | AC440: =(AA440*100)/AB440 -> 88.522012578616355 | AD440: =(X440*4)+(Z440*2) -> 24
A442: CAMBERWELL | C442: 3 | D442: 3 | E442: =C442*6+D442 -> 21 | G442: 7 | H442: 7 | I442: =G442*6+H442 -> 49 | K442: 9 | L442: 11 | M442: =K442*6+L442 -> 65 | O442: 13 | P442: 16 | Q442: =O442*6+P442 -> 94 | S442: BOX HILL | W442: YARRAVILLE | X442: 5 | Y442: 4 | Z442: 1 | AA442: 983 | AB442: 1186 | AC442: =(AA442*100)/AB442 -> 82.883642495784144 | AD442: =(X442*4)+(Z442*2) -> 22
A443: BOX HILL | C443: 3 | D443: 2 | E443: =C443*6+D443 -> 20 | G443: 4 | H443: 5 | I443: =G443*6+H443 -> 29 | K443: 5 | L443: 7 | M443: =K443*6+L443 -> 37 | O443: 9 | P443: 9 | Q443: =O443*6+P443 -> 63 | S443: O'BRIEN | W443: CAMBERWELL | X443: 5 | Y443: 5 | Z443: 0 | AA443: 1000 | AB443: 921 | AC443: =(AA443*100)/AB443 -> 108.57763300760044 | AD443: =(X443*4)+(Z443*2) -> 20
A444: BEST PLAYERS | W444: FRANKSTON | X444: 5 | Y444: 5 | Z444: 0 | AA444: 1100 | AB444: 1180 | AC444: =(AA444*100)/AB444 -> 93.220338983050851 | AD444: =(X444*4)+(Z444*2) -> 20
A445: CAMBERWELL | C445: DARE | F445: MORRIS | I445: HAZLETT | L445: DOBSON | O445: HOOK | R445: PATURZO | W445: WERRIBEE | X445: 4 | Y445: 6 | Z445: 0 | AA445: 994 | AB445: 1196 | AC445: =(AA445*100)/AB445 -> 83.110367892976583 | AD445: =(X445*4)+(Z445*2) -> 16
A446: BOX HILL | C446: BRYANT | F446: MARRIOTT | I446: McMASTER | L446: EDWARDS | O446: MOORE | R446: BRIDGMAN | W446: MORDIALLOC | X446: 2 | Y446: 8 | Z446: 0 | AA446: 885 | AB446: 1202 | AC446: =(AA446*100)/AB446 -> 73.627287853577371 | AD446: =(X446*4)+(Z446*2) -> 8
A447: GOALKICKERS | Q447: MORRIS | W447: BOX HILL | X447: 0 | Y447: 10 | Z447: 0 | AA447: 843 | AB447: 1370 | AC447: =(AA447*100)/AB447 -> 61.532846715328468 | AD447: =(X447*4)+(Z447*2) -> 0
A448: CAMBERWELL | C448: DOBSON 3 | F448: PATURZO 2 | I448: HAMMOND 2 | L448: BRANDON 2 | O448: BRAYNE | Q448: HAZLETT | S448: KARVELIS
A449: BOX HILL | C449: ROBSON 3 | F449: BRYANT 2 | I449: COOK | K449: CURTIS | M449: TIERNEY | O449: HARRIS
A451: FRANKSTON | C451: 3 | D451: 4 | E451: =C451*6+D451 -> 22 | G451: 9 | H451: 9 | I451: =G451*6+H451 -> 63 | K451: 12 | L451: 14 | M451: =K451*6+L451 -> 86 | O451: 22 | P451: 18 | Q451: =O451*6+P451 -> 150 | S451: FRANKSTON
A452: WERRIBEE | C452: 6 | D452: 2 | E452: =C452*6+D452 -> 38 | G452: 9 | H452: 8 | I452: =G452*6+H452 -> 62 | K452: 12 | L452: 14 | M452: =K452*6+L452 -> 86 | O452: 15 | P452: 16 | Q452: =O452*6+P452 -> 106 | S452: FLANAGAN
A453: BEST PLAYERS
A454: FRANKSTON | C454: BRIESE | F454: McNAB | I454: DOHERTY | L454: SKREJA | O454: SHEPHERD | R454: FITZGERALD
A455: WERRIBEE | C455: HARVEY | F455: LEECE | I455: BUTTON | L455: F MITCHELL | O455: N MITCHELL | R455: BOURKE
A456: GOALKICKERS
A457: FRANKSTON | C457: SKREJA 4 | F457: JUNGWIRTH 4 | I457: McWILLIAMS 4 | L457: DOHERTY 3 | N457: BRIESE 3 | P457: McNAB | R457: POPE | T457: FALKINER | W457: SCOTT
A458: WERRIBEE | C458: LEECE 5 | F458: N MITCHELL 3 | I458: SHEAHAN 2 | L458: HINKLEY 2 | N458: BUTTON | P458: DEY | Q458: DOUGLAS
A460: MORDIALLOC | C460: 6 | D460: 3 | E460: =C460*6+D460 -> 39 | G460: 13 | H460: 6 | I460: =G460*6+H460 -> 84 | K460: 17 | L460: 9 | M460: =K460*6+L460 -> 111 | O460: 22 | P460: 11 | Q460: =O460*6+P460 -> 143 | S460: MORDIALLOC
A461: YARRAVILLE | C461: 2 | D461: 5 | E461: =C461*6+D461 -> 17 | G461: 4 | H461: 8 | I461: =G461*6+H461 -> 32 | K461: 8 | L461: 9 | M461: =K461*6+L461 -> 57 | O461: 11 | P461: 13 | Q461: =O461*6+P461 -> 79 | S461: CHINN
A462: BEST PLAYERS
A463: MORDIALLOC | C463: HARRY | F463: SHUGG | I463: PINNE | L463: WALKER | O463: GUY | R463: SCAIFFE
A464: YARRAVILLE | C464: NORRIS | F464: WITHINGTON | I464: McLAREN | L464: T SMITH | O464: MARTIN | R464: D SMITH
A465: GOALKICKERS
A466: MORDIALLOC | C466: THOMPSON 6 | F466: HARRY 5 | H466: PINNE 5 | J466: SHUGG 2 | L466: GUY 2 | N466: McGUINNESS | Q466: WILKINS
A467: YARRAVILLE | C467: McLAREN 3 | F467: MARTIN 3 | I467: DOWLING 2 | L467: SQUIRES 2 | O467: JANES
A469: WAVERLEY | C469: 4 | D469: 3 | E469: =C469*6+D469 -> 27 | G469: 7 | H469: 12 | I469: =G469*6+H469 -> 54 | K469: 12 | L469: 16 | M469: =K469*6+L469 -> 88 | O469: 14 | P469: 18 | Q469: =O469*6+P469 -> 102 | S469: WAVERLEY
A470: CAULFIELD | C470: 3 | D470: 6 | E470: =C470*6+D470 -> 24 | G470: 5 | H470: 12 | I470: =G470*6+H470 -> 42 | K470: 10 | L470: 19 | M470: =K470*6+L470 -> 79 | O470: 13 | P470: 20 | Q470: =O470*6+P470 -> 98 | S470: STIRLING
A471: BEST PLAYERS
A472: WAVERLEY | C472: R ALLAN | F472: SYKES | I472: COSTELLO | L472: DUTHIE | O472: HOCKING | R472: GOODWIN
A473: CAULFIELD | C473: GLAZNER | F473: GOWANS | I473: BAKER | L473: SMITH | O473: WHITE | R473: GUINANE
A474: GOALKICKERS
A475: WAVERLEY | C475: GOODWIN 5 | F475: COSTELLO 4 | I475: DUTHIE 3 | K475: R ALLAN | M475: HORKINGS
A476: CAULFIELD | C476: GOWANS 4 | F476: WHITE 4 | I476: HOCKING 3 | L476: GUINANE | N476: ARRELL
A478: ROUND 11 | E478: 24TH JUNE | J478: WEATHER | S478: PLAYED AT
D479: 1ST QTR | H479: 2ND QTR | L479: 3RD QTR | P479: FINAL | S479: PRINCES PARK, CAULFIELD
A480: CAULFIELD | C480: 2 | D480: 2 | E480: =C480*6+D480 -> 14 | G480: 4 | H480: 6 | I480: =G480*6+H480 -> 30 | K480: 12 | L480: 12 | M480: =K480*6+L480 -> 84 | O480: 17 | P480: 18 | Q480: =O480*6+P480 -> 120 | S480: UMPIRE | X480: LADDER | AB480: ROUND | AD480: 11
A481: MORDIALLOC | C481: 2 | D481: 5 | E481: =C481*6+D481 -> 17 | G481: 5 | H481: 9 | I481: =G481*6+H481 -> 39 | K481: 6 | L481: 11 | M481: =K481*6+L481 -> 47 | O481: 8 | P481: 13 | Q481: =O481*6+P481 -> 61 | S481: FLANAGAN
A482: BEST PLAYERS | W482: TEAM | X482: W | Y482: L | Z482: D | AA482: FOR | AB482: AGST | AC482: % | AD482: PTS
A483: CAULFIELD | C483: HOCKING | F483: FELDMANN | I483: TULLOCH | L483: SARGENT | O483: BAKER | R483: WHITE
A484: MORDIALLOC | C484: WALKER | F484: SCAIFFE | I484: SNOW | L484: GUY | O484: RAEBURN | R484: BESANKO | W484: WAVERLEY | X484: 9 | Y484: 2 | Z484: 0 | AA484: 1698 | AB484: 936 | AC484: =(AA484*100)/AB484 -> 181.41025641025641 | AD484: =(X484*4)+(Z484*2) -> 36
A485: GOALKICKERS | O485: CRUNDEN | W485: BRUNSWICK | X485: 8 | Y485: 2 | Z485: 1 | AA485: 1195 | AB485: 1041 | AC485: =(AA485*100)/AB485 -> 114.79346781940441 | AD485: =(X485*4)+(Z485*2) -> 34
A486: CAULFIELD | C486: RENOWDEN 4 | F486: BAKER 3 | H486: HOCKING 2 | K486: GOODEN 2 | N486: GUINANE 2 | P486: WHITE | R486: GOWANS | T486: PEART | W486: CAULFIELD | X486: 8 | Y486: 3 | Z486: 0 | AA486: 1470 | AB486: 975 | AC486: =(AA486*100)/AB486 -> 150.76923076923077 | AD486: =(X486*4)+(Z486*2) -> 32
A487: MORDIALLOC | C487: SCAIFFE 3 | F487: HARRY 2 | I487: SHUGG | K487: PINNE | M487: SNOW | W487: CAMBERWELL | X487: 6 | Y487: 5 | Z487: 0 | AA487: 1105 | AB487: 992 | AC487: =(AA487*100)/AB487 -> 111.39112903225806 | AD487: =(X487*4)+(Z487*2) -> 24
A489: FRANKSTON | C489: 4 | D489: 3 | E489: =C489*6+D489 -> 27 | G489: 7 | H489: 5 | I489: =G489*6+H489 -> 47 | K489: 11 | L489: 6 | M489: =K489*6+L489 -> 72 | O489: 14 | P489: 14 | Q489: =O489*6+P489 -> 98 | S489: YARRAVILLE | W489: FRANKSTON | X489: 6 | Y489: 5 | Z489: 0 | AA489: 1198 | AB489: 1275 | AC489: =(AA489*100)/AB489 -> 93.960784313725483 | AD489: =(X489*4)+(Z489*2) -> 24
A490: YARRAVILLE | C490: 3 | D490: 5 | E490: =C490*6+D490 -> 23 | G490: 8 | H490: 8 | I490: =G490*6+H490 -> 56 | K490: 11 | L490: 14 | M490: =K490*6+L490 -> 80 | O490: 13 | P490: 17 | Q490: =O490*6+P490 -> 95 | S490: GAMBETTA | W490: NORTHCOTE | X490: 6 | Y490: 5 | Z490: 0 | AA490: 1197 | AB490: 1377 | AC490: =(AA490*100)/AB490 -> 86.928104575163403 | AD490: =(X490*4)+(Z490*2) -> 24
A491: BEST PLAYERS | W491: YARRAVILLE | X491: 5 | Y491: 5 | Z491: 1 | AA491: 1078 | AB491: 1284 | AC491: =(AA491*100)/AB491 -> 83.956386292834893 | AD491: =(X491*4)+(Z491*2) -> 22
A492: FRANKSTON | C492: McNAB | F492: BRIESE | I492: SKREJA | L492: JUNGWIRTH | O492: SHEPHERD | R492: STAPLETON | W492: WERRIBEE | X492: 5 | Y492: 6 | Z492: 0 | AA492: 1118 | AB492: 1291 | AC492: =(AA492*100)/AB492 -> 86.599535243996897 | AD492: =(X492*4)+(Z492*2) -> 20
A493: YARRAVILLE | C493: MARTIN | F493: NORRIS | I493: SMITH | L493: QUARANTOTO | O493: JANES | R493: SQUIRES | W493: MORDIALLOC | X493: 2 | Y493: 9 | Z493: 0 | AA493: 946 | AB493: 1322 | AC493: =(AA493*100)/AB493 -> 71.558245083207268 | AD493: =(X493*4)+(Z493*2) -> 8
A494: GOALKICKERS | L494: LOVELOCK | O494: POPE | Q494: SCOTT | W494: BOX HILL | X494: 0 | Y494: 11 | Z494: 0 | AA494: 938 | AB494: 1494 | AC494: =(AA494*100)/AB494 -> 62.784471218206157 | AD494: =(X494*4)+(Z494*2) -> 0
A495: FRANKSTON | C495: HIGGS 3 | E495: BRIESE 2 | G495: DOHERTY | I495: SKREJA | K495: ROYLANCE | N495: JUNGWIRTH | Q495: BLOOMFIELD | T495: FALKINER
A496: YARRAVILLE | C496: McLAREN 3 | F496: MARTIN 2 | I496: COLEMAN 2 | L496: DOWLING 2 | O496: KLANISEK 2 | R496: WAHHORNE | U496: JANES
A498: WERRIBEE | C498: 5 | D498: 3 | E498: =C498*6+D498 -> 33 | G498: 12 | H498: 6 | I498: =G498*6+H498 -> 78 | K498: 15 | L498: 12 | M498: =K498*6+L498 -> 102 | O498: 18 | P498: 16 | Q498: =O498*6+P498 -> 124 | S498: WERRIBEE
A499: BOX HILL | C499: 4 | D499: 6 | E499: =C499*6+D499 -> 30 | G499: 7 | H499: 7 | I499: =G499*6+H499 -> 49 | K499: 12 | L499: 9 | M499: =K499*6+L499 -> 81 | O499: 14 | P499: 11 | Q499: =O499*6+P499 -> 95 | S499: STIRLING
A500: BEST PLAYERS
A501: WERRIBEE | C501: F MITCHELL | F501: McCARTNEY | I501: BUTTON | L501: HARVEY | O501: HINKLEY | R501: SOMERVILLE
A502: BOX HILL | C502: BRYANT | F502: BAKER | I502: CURTIS | L502: MOORE | O502: ROBSON | R502: TIERNEY
A503: GOALKICKERS
A504: WERRIBEE | C504: F MITCHELL 6 | F504: LEECE 4 | H504: BRYANT 3 | J504: SOMERVILLE 2 | M504: SHEAHAN | P504: N MITCHELL | S504: DOUGLAS
A505: BOX HILL | C505: CURTIS 4 | F505: WATERS 3 | I505: BAKER 2 | K505: McMASTER 2 | N505: COOK | P505: EDWARDS | R505: BRYANT
A507: CAMBERWELL | C507: 3 | D507: 1 | E507: =C507*6+D507 -> 19 | G507: 9 | H507: 3 | I507: =G507*6+H507 -> 57 | K507: 12 | L507: 6 | M507: =K507*6+L507 -> 78 | O507: 16 | P507: 9 | Q507: =O507*6+P507 -> 105 | S507: CAMBERWELL
A508: NORTHCOTE | C508: 3 | D508: 3 | E508: =C508*6+D508 -> 21 | G508: 6 | H508: 5 | I508: =G508*6+H508 -> 41 | K508: 8 | L508: 7 | M508: =K508*6+L508 -> 55 | O508: 10 | P508: 11 | Q508: =O508*6+P508 -> 71 | S508: WENN
A509: BEST PLAYERS
A510: CAMBERWELL | C510: PATURZO | F510: MARTIN | I510: FOX | L510: SIMPSON | O510: HOOK | R510: DARE
A511: NORTHCOTE | C511: LEECH | F511: BEATON | I511: WATT | L511: KOZARIS | O511: NANKERVIS | R511: GELLIE
A512: GOALKICKERS
A513: CAMBERWELL | C513: PATURZO 6 | F513: HAZLETT 3 | I513: KARVELIS 2 | L513: HAMMOND 2 | O513: HUMPHREY | R513: BRANDON | U513: POWER
A514: NORTHCOTE | C514: CARACELLA 3 | F514: HOUGH 2 | I514: RYAN 2 | K514: KILKENNY | N514: NANKERVIS | Q514: ROBERTS
A516: BRUNSWICK | C516: 4 | D516: 6 | E516: =C516*6+D516 -> 30 | G516: 8 | H516: 6 | I516: =G516*6+H516 -> 54 | K516: 11 | L516: 14 | M516: =K516*6+L516 -> 80 | O516: 13 | P516: 17 | Q516: =O516*6+P516 -> 95 | S516: BRUNSWICK
A517: WAVERLEY | C517: 2 | D517: 2 | E517: =C517*6+D517 -> 14 | G517: 7 | H517: 7 | I517: =G517*6+H517 -> 49 | K517: 8 | L517: 10 | M517: =K517*6+L517 -> 58 | O517: 13 | P517: 16 | Q517: =O517*6+P517 -> 94 | S517: TORNEY
A518: BEST PLAYERS
A519: BRUNSWICK | C519: HOBBS | F519: SKIDMORE | I519: BARTLETT | L519: WROUT | O519: O'BRIEN | Q519: FEWSTER
A520: WAVERLEY | C520: DUTHIE | F520: HOCKING | I520: SYKES | L520: LUMLEY | O520: SMEDTS | Q520: GOODWIN
A521: GOALKICKERS
A522: BRUNSWICK | C522: BAIRD 4 | F522: ALLEN 3 | H522: DIMMATINA 2 | K522: ANDERSON 2 | N522: HOBBS | P522: BARTLETT
A523: WAVERLEY | C523: COSTELLO 3 | F523: R ALLAN 3 | I523: GOODWIN 2 | L523: HORKINGS | N523: PITTS | P523: HARRY | R523: STONE | U523: TOOHEY
A525: ROUND 12 | E525: 1ST JULY | J525: WEATHER | S525: PLAYED AT
D526: 1ST QTR | H526: 2ND QTR | L526: 3RD QTR | P526: FINAL | S526: NORTHCOTE
A527: CAULFIELD | C527: 5 | D527: 6 | E527: =C527*6+D527 -> 36 | G527: 13 | H527: 12 | I527: =G527*6+H527 -> 90 | K527: 22 | L527: 17 | M527: =K527*6+L527 -> 149 | O527: 31 | P527: 22 | Q527: =O527*6+P527 -> 208 | S527: UMPIRE | X527: LADDER | AB527: ROUND | AD527: 12
A528: NORTHCOTE | C528: 1 | D528: 2 | E528: =C528*6+D528 -> 8 | G528: 6 | H528: 4 | I528: =G528*6+H528 -> 40 | K528: 8 | L528: 4 | M528: =K528*6+L528 -> 52 | O528: 13 | P528: 7 | Q528: =O528*6+P528 -> 85 | S528: GAMBETTA
A529: BEST PLAYERS | W529: TEAM | X529: W | Y529: L | Z529: D | AA529: FOR | AB529: AGST | AC529: % | AD529: PTS
A530: CAULFIELD | C530: GOWANS | F530: BAKER | I530: GUINANE | L530: GOODEN | O530: D FELDMANN | R530: GLAZNER
A531: NORTHCOTE | W531: WAVERLEY | X531: 10 | Y531: 2 | Z531: 0 | AA531: 1881 | AB531: 990 | AC531: =(AA531*100)/AB531 -> 190 | AD531: =(X531*4)+(Z531*2) -> 40
A532: GOALKICKERS | L532: JEWELL | N532: ARRELL | P532: D FELDMANN | W532: CAULFIELD | X532: 9 | Y532: 3 | Z532: 0 | AA532: 1678 | AB532: 1060 | AC532: =(AA532*100)/AB532 -> 158.30188679245282 | AD532: =(X532*4)+(Z532*2) -> 36
A533: CAULFIELD | C533: GOWANS 6 | E533: BAKER 5 | G533: WHITE 5 | I533: GOODEN 3 | K533: CLIFF 3 | M533: GUINANE 2 | O533: HOCKING 2 | R533: CRUNDEN 2 | W533: BRUNSWICK | X533: 8 | Y533: 3 | Z533: 1 | AA533: 1279 | AB533: 1137 | AC533: =(AA533*100)/AB533 -> 112.48900615655234 | AD533: =(X533*4)+(Z533*2) -> 34
A534: NORTHCOTE | W534: CAMBERWELL | X534: 7 | Y534: 5 | Z534: 0 | AA534: 1207 | AB534: 1079 | AC534: =(AA534*100)/AB534 -> 111.8628359592215 | AD534: =(X534*4)+(Z534*2) -> 28
A536: WAVERLEY | C536: 7 | D536: 1 | E536: =C536*6+D536 -> 43 | G536: 15 | H536: 6 | I536: =G536*6+H536 -> 96 | K536: 21 | L536: 11 | M536: =K536*6+L536 -> 137 | O536: 27 | P536: 21 | Q536: =O536*6+P536 -> 183 | S536: BOX HILL | W536: FRANKSTON | X536: 7 | Y536: 5 | Z536: 0 | AA536: 1336 | AB536: 1376 | AC536: =(AA536*100)/AB536 -> 97.093023255813947 | AD536: =(X536*4)+(Z536*2) -> 28
A537: BOX HILL | C537: 2 | D537: 6 | E537: =C537*6+D537 -> 18 | G537: 4 | H537: 8 | I537: =G537*6+H537 -> 32 | K537: 7 | L537: 11 | M537: =K537*6+L537 -> 53 | O537: 7 | P537: 12 | Q537: =O537*6+P537 -> 54 | S537: STABB | W537: WERRIBEE | X537: 6 | Y537: 6 | Z537: 0 | AA537: 1214 | AB537: 1375 | AC537: =(AA537*100)/AB537 -> 88.290909090909096 | AD537: =(X537*4)+(Z537*2) -> 24
A538: BEST PLAYERS | W538: NORTHCOTE | X538: 6 | Y538: 6 | Z538: 0 | AA538: 1282 | AB538: 1585 | AC538: =(AA538*100)/AB538 -> 80.883280757097793 | AD538: =(X538*4)+(Z538*2) -> 24
A539: WAVERLEY | C539: STONE | F539: R ALLAN | I539: IVEY | L539: MILES | O539: HANCOCK | R539: HARRY | W539: YARRAVILLE | X539: 5 | Y539: 6 | Z539: 1 | AA539: 1165 | AB539: 1386 | AC539: =(AA539*100)/AB539 -> 84.05483405483406 | AD539: =(X539*4)+(Z539*2) -> 22
A540: BOX HILL | C540: A RALPH | F540: HARRIS | I540: ROBSON | L540: EDWARDS | O540: MARTIN | R540: BAKER | W540: MORDIALLOC | X540: 2 | Y540: 10 | Z540: 0 | AA540: 1047 | AB540: 1460 | AC540: =(AA540*100)/AB540 -> 71.712328767123282 | AD540: =(X540*4)+(Z540*2) -> 8
A541: GOALKICKERS | W541: BOX HILL | X541: 0 | Y541: 12 | Z541: 0 | AA541: 992 | AB541: 1677 | AC541: =(AA541*100)/AB541 -> 59.153249850924269 | AD541: =(X541*4)+(Z541*2) -> 0
A542: WAVERLEY | C542: IVEY 6 | E542: OSBORNE 5 | G542: STONE 4 | I542: COSTELLO 3 | K542: HANCOCK 3 | N542: B ALLAN 2 | P542: PITTS 2 | R542: HARRY | T542: DE LOOSE
A543: BOX HILL | C543: EDWARDS 3 | F543: MOORE | H543: ZANTUCK | J543: BRYANT | L543: HARRIS
A545: FRANKSTON | C545: 7 | D545: 7 | E545: =C545*6+D545 -> 49 | G545: 8 | H545: 11 | I545: =G545*6+H545 -> 59 | K545: 15 | L545: 15 | M545: =K545*6+L545 -> 105 | O545: 20 | P545: 18 | Q545: =O545*6+P545 -> 138 | S545: FRANKSTON
A546: MORDIALLOC | C546: 3 | D546: 2 | E546: =C546*6+D546 -> 20 | G546: 8 | H546: 7 | I546: =G546*6+H546 -> 55 | K546: 9 | L546: 9 | M546: =K546*6+L546 -> 63 | O546: 14 | P546: 17 | Q546: =O546*6+P546 -> 101 | S546: O'BRIEN
A547: BEST PLAYERS
A548: FRANKSTON | C548: BRIESE | F548: McNAB | I548: SKREJA | L548: BLOOMFIELD | O548: ROSENBROCK | R548: FITZGERALD
A549: MORDIALLOC | C549: SHUGG | F549: SCAIFFE | I549: GARDNER | L549: WILKINS
A550: GOALKICKERS
A551: FRANKSTON | C551: JUNGWIRTH 4 | F551: SKREJA 4 | H551: BRIESE 2 | J551: BLOOMFIELD 2 | M551: FALKINER 2 | O551: LOVELOCK 2 | R551: FITZGERALD | U551: McNAB | W551: McWILLIAMS | X551: STAPLETON
A552: MORDIALLOC | C552: SHUGG 4 | E552: HARRY 2 | G552: McGUINNESS 2 | J552: McFARLANE 2 | M552: WILKINS 2 | P552: SCAIFFE | R552: PINNE
A554: CAMBERWELL | C554: 5 | D554: 3 | E554: =C554*6+D554 -> 33 | G554: 8 | H554: 8 | I554: =G554*6+H554 -> 56 | K554: 10 | L554: 10 | M554: =K554*6+L554 -> 70 | O554: 15 | P554: 12 | Q554: =O554*6+P554 -> 102 | S554: YARRAVILLE
A555: YARRAVILLE | C555: 3 | D555: 3 | E555: =C555*6+D555 -> 21 | G555: 6 | H555: 5 | I555: =G555*6+H555 -> 41 | K555: 10 | L555: 9 | M555: =K555*6+L555 -> 69 | O555: 13 | P555: 9 | Q555: =O555*6+P555 -> 87 | S555: TORNEY
A556: BEST PLAYERS
A557: CAMBERWELL | C557: HOOK | F557: HAMMOND | I557: ROUTLEDGE | L557: SIMPSON | O557: MARTIN | R557: CAMERON
A558: YARRAVILLE | C558: WITHINGTON | F558: SQUIRES | I558: MARTIN | L558: HENDERSON | O558: MATTHEWS | R558: STURNEIKS
A559: GOALKICKERS
A560: CAMBERWELL | C560: HAMMOND 6 | F560: PATURZO 2 | I560: STONE 2 | K560: KARVELIS 2 | N560: KERR | P560: SIMPSON | R560: FOX
A561: YARRAVILLE | C561: McLAREN 3 | F561: HENDERSON 3 | I561: SHIELS 2 | K561: WITHINGTON | N561: MARTIN | P561: DOWLING | R561: QUARANTOTTO | W561: STURNEIKS
A563: WERRIBEE | C563: 5 | D563: 6 | E563: =C563*6+D563 -> 36 | G563: 7 | H563: 13 | I563: =G563*6+H563 -> 55 | K563: 10 | L563: 16 | M563: =K563*6+L563 -> 76 | O563: 13 | P563: 18 | Q563: =O563*6+P563 -> 96 | S563: BRUNSWICK
A564: BRUNSWICK | C564: 3 | D564: 2 | E564: =C564*6+D564 -> 20 | G564: 5 | H564: 4 | I564: =G564*6+H564 -> 34 | K564: 8 | L564: 9 | M564: =K564*6+L564 -> 57 | O564: 12 | P564: 12 | Q564: =O564*6+P564 -> 84 | S564: ANDERSON
A565: BEST PLAYERS
A566: WERRIBEE | C566: RIDDELL | F566: SOMERVILLE | I566: BRYANT | L566: SHEAHAN | O566: HARVEY | Q566: COCKS
A567: BRUNSWICK | C567: FORD | F567: HOBBS | I567: ANDERSON | L567: ALLEN
A568: GOALKICKERS
A569: WERRIBEE | C569: BRYANT 4 | F569: SOMERVILLE 3 | I569: BUTTON 2 | K569: LEECE | M569: SHEAHAN | P569: N MITCHELL | S569: DOUGLAS
A570: BRUNSWICK | C570: BAIRD 3 | F570: ALLEN 3 | H570: DIMMATINA 2 | K570: ANDERSON | N570: HOBBS | P570: BARTLETT | R570: WROUT
A572: ROUND 13 | E572: 8TH JULY | J572: WEATHER | S572: PLAYED AT
D573: 1ST QTR | H573: 2ND QTR | L573: 3RD QTR | P573: FINAL | S573: WAVERLEY
A574: WAVERLEY | C574: 5 | D574: 2 | E574: =C574*6+D574 -> 32 | G574: 14 | H574: 6 | I574: =G574*6+H574 -> 90 | K574: 18 | L574: 13 | M574: =K574*6+L574 -> 121 | O574: 22 | P574: 18 | Q574: =O574*6+P574 -> 150 | S574: UMPIRE | X574: LADDER | AB574: ROUND | AD574: 13
A575: NORTHCOTE | C575: 2 | D575: 2 | E575: =C575*6+D575 -> 14 | G575: 7 | H575: 4 | I575: =G575*6+H575 -> 46 | K575: 9 | L575: 6 | M575: =K575*6+L575 -> 60 | O575: 12 | P575: 6 | Q575: =O575*6+P575 -> 78 | S575: MARKS
A576: BEST PLAYERS | W576: TEAM | X576: W | Y576: L | Z576: D | AA576: FOR | AB576: AGST | AC576: % | AD576: PTS
A577: WAVERLEY | C577: R ALLAN | F577: STONE | I577: HANCOCK | L577: HARRY | O577: B ALLAN | R577: FERGUSON
A578: NORTHCOTE | C578: KILKENNY | F578: NANKERVIS | I578: LEECH | L578: BEATON | O578: RYAN | R578: GELLIE | W578: WAVERLEY | X578: 11 | Y578: 2 | Z578: 0 | AA578: 2031 | AB578: 1068 | AC578: =(AA578*100)/AB578 -> 190.16853932584269 | AD578: =(X578*4)+(Z578*2) -> 44
A579: GOALKICKERS | Q579: BALLAN | S579: PARKS | W579: CAULFIELD | X579: 10 | Y579: 3 | Z579: 0 | AA579: 1812 | AB579: 1165 | AC579: =(AA579*100)/AB579 -> 155.53648068669528 | AD579: =(X579*4)+(Z579*2) -> 40
A580: WAVERLEY | C580: IVEY 6 | E580: COSTELLO 3 | G580: HARRY 2 | I580: OSBORNE 2 | K580: STONE 2 | M580: HANCOCK 2 | O580: McNAMEE | R580: DUTHIE | T580: HORKINGS | W580: BRUNSWICK | X580: 8 | Y580: 4 | Z580: 1 | AA580: 1384 | AB580: 1271 | AC580: =(AA580*100)/AB580 -> 108.89063729346971 | AD580: =(X580*4)+(Z580*2) -> 34
A581: NORTHCOTE | C581: RYAN 3 | E581: HOUGH 3 | G581: BIENKE 2 | I581: ROPER 2 | K581: COHEN | M581: VALERKOU | W581: CAMBERWELL | X581: 7 | Y581: 5 | Z581: 1 | AA581: 1311 | AB581: 1183 | AC581: =(AA581*100)/AB581 -> 110.81994928148774 | AD581: =(X581*4)+(Z581*2) -> 30
A583: CAULFIELD | C583: 4 | D583: 3 | E583: =C583*6+D583 -> 27 | G583: 8 | H583: 6 | I583: =G583*6+H583 -> 54 | K583: 13 | L583: 12 | M583: =K583*6+L583 -> 90 | O583: 20 | P583: 14 | Q583: =O583*6+P583 -> 134 | S583: PRINCES PARK, CAULFIELD | W583: FRANKSTON | X583: 7 | Y583: 5 | Z583: 1 | AA583: 1440 | AB583: 1480 | AC583: =(AA583*100)/AB583 -> 97.297297297297291 | AD583: =(X583*4)+(Z583*2) -> 30
A584: BRUNSWICK | C584: 2 | D584: 5 | E584: =C584*6+D584 -> 17 | G584: 9 | H584: 11 | I584: =G584*6+H584 -> 65 | K584: 12 | L584: 12 | M584: =K584*6+L584 -> 84 | O584: 15 | P584: 15 | Q584: =O584*6+P584 -> 105 | S584: WENN | W584: WERRIBEE | X584: 7 | Y584: 6 | Z584: 0 | AA584: 1320 | AB584: 1446 | AC584: =(AA584*100)/AB584 -> 91.286307053941911 | AD584: =(X584*4)+(Z584*2) -> 28
A585: BEST PLAYERS | W585: NORTHCOTE | X585: 6 | Y585: 7 | Z585: 0 | AA585: 1360 | AB585: 1735 | AC585: =(AA585*100)/AB585 -> 78.38616714697406 | AD585: =(X585*4)+(Z585*2) -> 24
A586: CAULFIELD | C586: HOCKING | F586: R FELDMANN | I586: GLAZNER | L586: D FELDMANN | O586: CLIFF | R586: GUINANE | W586: YARRAVILLE | X586: 5 | Y586: 7 | Z586: 1 | AA586: 1236 | AB586: 1492 | AC586: =(AA586*100)/AB586 -> 82.841823056300271 | AD586: =(X586*4)+(Z586*2) -> 22
A587: BRUNSWICK | C587: DENMEAD | F587: SKIDMORE | I587: BAIRD | L587: DIMMATINA | O587: HAMPTON | R587: HORSINGTON | W587: MORDIALLOC | X587: 3 | Y587: 10 | Z587: 0 | AA587: 1163 | AB587: 1563 | AC587: =(AA587*100)/AB587 -> 74.408189379398593 | AD587: =(X587*4)+(Z587*2) -> 12
A588: GOALKICKERS | O588: WILLIAMS | W588: BOX HILL | X588: 0 | Y588: 13 | Z588: 0 | AA588: 1095 | AB588: 1793 | AC588: =(AA588*100)/AB588 -> 61.070831009481317 | AD588: =(X588*4)+(Z588*2) -> 0
A589: CAULFIELD | C589: CLIFF 5 | E589: RENOWDEN 4 | H589: GUINANE 2 | J589: HOCKING 2 | L589: D FELDMANN 2 | O589: ARRELL | Q589: GOWANS | S589: MAGUIRE | U589: BAKER
A590: BRUNSWICK | C590: BAIRD 8 | F590: ALLEN 3 | I590: DIMMATINA 2 | L590: BARTLETT | O590: HADZILLIAS
A592: WERRIBEE | C592: 3 | D592: 3 | E592: =C592*6+D592 -> 21 | G592: 9 | H592: 7 | I592: =G592*6+H592 -> 61 | K592: 12 | L592: 8 | M592: =K592*6+L592 -> 80 | O592: 16 | P592: 10 | Q592: =O592*6+P592 -> 106 | S592: WERRIBEE
A593: YARRAVILLE | C593: 4 | D593: 3 | E593: =C593*6+D593 -> 27 | G593: 5 | H593: 5 | I593: =G593*6+H593 -> 35 | K593: 5 | L593: 14 | M593: =K593*6+L593 -> 44 | O593: 9 | P593: 17 | Q593: =O593*6+P593 -> 71 | S593: HAYES
A594: BEST PLAYERS
A595: WERRIBEE | C595: DEY | F595: F MITCHELL | I595: BUTTON | L595: SOMERVILLE | O595: B MONTGOMERY | S595: NEWMAN
A596: YARRAVILLE | C596: SQUIRES | F596: CONDUIT | I596: HENDERSON | L596: M MARTIN | O596: T SMITH
A597: GOALKICKERS
A598: WERRIBEE | C598: N MITCHELL 4 | F598: SOMERVILLE 3 | I598: SHEAHAN 2 | L598: HINKLEY 2 | N598: F MITCHELL 2 | Q598: DOUGLAS 2 | T598: BRYANT
A599: YARRAVILLE | C599: R SHIELDS 3 | F599: GREENEY | I599: STURNEIKS | K599: M MARTIN | N599: DOWLING | P599: HENDERSON | S599: BROWN
A601: CAMBERWELL | C601: 3 | D601: 5 | E601: =C601*6+D601 -> 23 | G601: 4 | H601: 13 | I601: =G601*6+H601 -> 37 | K601: 6 | L601: 19 | M601: =K601*6+L601 -> 55 | O601: 14 | P601: 20 | Q601: =O601*6+P601 -> 104 | S601: CAMBERWELL
A602: FRANKSTON | C602: 0 | D602: 4 | E602: =C602*6+D602 -> 4 | G602: 5 | H602: 5 | I602: =G602*6+H602 -> 35 | K602: 12 | L602: 7 | M602: =K602*6+L602 -> 79 | O602: 16 | P602: 8 | Q602: =O602*6+P602 -> 104 | S602: CHINN
A603: BEST PLAYERS
A604: CAMBERWELL | C604: HAMMOND | F604: PARSONS | I604: FOX | L604: HOOK | O604: MACK | R604: BARR
A605: FRANKSTON | C605: RENOUF | F605: McNAB | I605: BLOOMFIELD | L605: SHEPHERD | O605: STAPLETON | R605: FITZGERALD
A606: GOALKICKERS
A607: CAMBERWELL | C607: HAMMOND 4 | F607: STONE 3 | H607: PATURZO 2 | K607: FOX | L607: DARE | N607: KARVELIS | Q607: PARSONS | T607: KERR
A608: FRANKSTON | C608: JUNGWIRTH 5 | F608: LOVELOCK 3 | I608: McWILLIAMS 2 | L608: DOHERTY 2 | O608: ROWE | Q608: BRIESE | S608: SKREJA | U608: FALKINER
A610: MORDIALLOC | C610: 6 | D610: 4 | E610: =C610*6+D610 -> 40 | G610: 11 | H610: 9 | I610: =G610*6+H610 -> 75 | K610: 13 | L610: 11 | M610: =K610*6+L610 -> 89 | O610: 17 | P610: 14 | Q610: =O610*6+P610 -> 116 | S610: MORDIALLOC
A611: BOX HILL | C611: 6 | D611: 0 | E611: =C611*6+D611 -> 36 | G611: 7 | H611: 1 | I611: =G611*6+H611 -> 43 | K611: 11 | L611: 5 | M611: =K611*6+L611 -> 71 | O611: 16 | P611: 7 | Q611: =O611*6+P611 -> 103 | S611: TORNEY
A612: BEST PLAYERS
A613: MORDIALLOC | C613: SHUGG | F613: BESANKO | I613: SCAIFFE | L613: LANG | O613: McFARLANE
A614: BOX HILL | C614: BRYANT | F614: BAKER | I614: ROBSON | L614: NANKERVIS | O614: CURTIS | R614: K HARRIS
A615: GOALKICKERS
A616: MORDIALLOC | C616: MEAGHER 6 | F616: HARRY 3 | H616: SCAIFFE 3 | J616: LANG 3 | L616: McFARLANE | O616: McGUINNESS
A617: BOX HILL | C617: K HARRIS 3 | F617: EDWARDS 2 | I617: T MARTIN 2 | K617: BRYANT 2 | N617: COOK | O617: CURTIS | Q617: SMITH | S617: TIERNEY | U617: A HARRIS | W617: SUNDERMAN | X617: MAGILL
A619: ROUND 14 | E619: 15TH JULY | J619: WEATHER | S619: PLAYED AT
D620: 1ST QTR | H620: 2ND QTR | L620: 3RD QTR | P620: FINAL | S620: NORTHCOTE
A621: MORDIALLOC | C621: 4 | D621: 6 | E621: =C621*6+D621 -> 30 | G621: 5 | H621: 14 | I621: =G621*6+H621 -> 44 | K621: 9 | L621: 18 | M621: =K621*6+L621 -> 72 | O621: 15 | P621: 23 | Q621: =O621*6+P621 -> 113 | S621: UMPIRE | X621: LADDER | AB621: ROUND | AD621: 14
A622: NORTHCOTE | C622: 3 | D622: 4 | E622: =C622*6+D622 -> 22 | G622: 6 | H622: 8 | I622: =G622*6+H622 -> 44 | K622: 9 | L622: 11 | M622: =K622*6+L622 -> 65 | O622: 10 | P622: 15 | Q622: =O622*6+P622 -> 75 | S622: STABB
A623: BEST PLAYERS | W623: TEAM | X623: W | Y623: L | Z623: D | AA623: FOR | AB623: AGST | AC623: % | AD623: PTS
A624: MORDIALLOC | C624: GUY | F624: HARRY | I624: SMITH | L624: RAEBURN | O624: WALKER | R624: LANG
A625: NORTHCOTE | C625: NANKERVIS | F625: KREYMBORG | I625: BEATON | L625: KOZARIS | O625: GELLIE | R625: HOUGH | W625: WAVERLEY | X625: 12 | Y625: 2 | Z625: 0 | AA625: 2132 | AB625: 1167 | AC625: =(AA625*100)/AB625 -> 182.69065981148245 | AD625: =(X625*4)+(Z625*2) -> 48
A626: GOALKICKERS | W626: CAULFIELD | X626: 11 | Y626: 3 | Z626: 0 | AA626: 1942 | AB626: 1253 | AC626: =(AA626*100)/AB626 -> 154.98802873104549 | AD626: =(X626*4)+(Z626*2) -> 44
A627: MORDIALLOC | C627: MEAGHER 4 | F627: HARRY 4 | H627: LANG 3 | J627: SMITH 2 | L627: SHUGG | N627: McFARLANE | W627: BRUNSWICK | X627: 9 | Y627: 4 | Z627: 1 | AA627: 1479 | AB627: 1360 | AC627: =(AA627*100)/AB627 -> 108.75 | AD627: =(X627*4)+(Z627*2) -> 38
A628: NORTHCOTE | C628: HOUGH 3 | E628: KOZARIS 2 | H628: KREYMBORG 2 | K628: GELLIE | M628: BIENKE | O628: RYAN | W628: FRANKSTON | X628: 8 | Y628: 5 | Z628: 1 | AA628: 1599 | AB628: 1553 | AC628: =(AA628*100)/AB628 -> 102.96200901481005 | AD628: =(X628*4)+(Z628*2) -> 34
A630: FRANKSTON | C630: 6 | D630: 5 | E630: =C630*6+D630 -> 41 | G630: 9 | H630: 7 | I630: =G630*6+H630 -> 61 | K630: 16 | L630: 18 | M630: =K630*6+L630 -> 114 | O630: 23 | P630: 21 | Q630: =O630*6+P630 -> 159 | S630: BOX HILL | W630: CAMBERWELL | X630: 7 | Y630: 6 | Z630: 1 | AA630: 1399 | AB630: 1313 | AC630: =(AA630*100)/AB630 -> 106.54988575780655 | AD630: =(X630*4)+(Z630*2) -> 30
A631: BOX HILL | C631: 2 | D631: 2 | E631: =C631*6+D631 -> 14 | G631: 5 | H631: 4 | I631: =G631*6+H631 -> 34 | K631: 7 | L631: 5 | M631: =K631*6+L631 -> 47 | O631: 11 | P631: 7 | Q631: =O631*6+P631 -> 73 | S631: ABBOTT | W631: WERRIBEE | X631: 7 | Y631: 7 | Z631: 0 | AA631: 1419 | AB631: 1547 | AC631: =(AA631*100)/AB631 -> 91.725921137685845 | AD631: =(X631*4)+(Z631*2) -> 28
A632: BEST PLAYERS | W632: NORTHCOTE | X632: 6 | Y632: 8 | Z632: 0 | AA632: 1435 | AB632: 1848 | AC632: =(AA632*100)/AB632 -> 77.651515151515156 | AD632: =(X632*4)+(Z632*2) -> 24
A633: FRANKSTON | C633: STAPLETON | F633: FITZGERALD | I633: SHEPHERD | L633: RENOUF | O633: WINSTANLEY | R633: JUNGWIRTH | W633: YARRAVILLE | X633: 5 | Y633: 8 | Z633: 1 | AA633: 1325 | AB633: 1587 | AC633: =(AA633*100)/AB633 -> 83.490863264020163 | AD633: =(X633*4)+(Z633*2) -> 22
A634: BOX HILL | C634: ZANTUCK | F634: CURTIS | I634: K HARRIS | L634: NANKERVIS | O634: A RALPH | R634: BAKER | W634: MORDIALLOC | X634: 4 | Y634: 10 | Z634: 0 | AA634: 1276 | AB634: 1638 | AC634: =(AA634*100)/AB634 -> 77.899877899877893 | AD634: =(X634*4)+(Z634*2) -> 16
A635: GOALKICKERS | P635: BEAMAN | W635: BOX HILL | X635: 0 | Y635: 14 | Z635: 0 | AA635: 1168 | AB635: 1952 | AC635: =(AA635*100)/AB635 -> 59.83606557377049 | AD635: =(X635*4)+(Z635*2) -> 0
A636: FRANKSTON | C636: JUNGWIRTH 8 | F636: SKREJA 3 | H636: McWILLAMS 3 | K636: LOVELOCK 3 | N636: BRIESE 2 | P636: ROWE | R636: DOHERTY | T636: FALKINER
A637: BOX HILL | C637: CURTIS 3 | F637: ZANTUCK 3 | I637: COOK | K637: BRYANT | M637: A HARRIS | P637: K HARRIS | R637: BAKER
A639: BRUNSWICK | C639: 4 | D639: 5 | E639: =C639*6+D639 -> 29 | G639: 7 | H639: 5 | I639: =G639*6+H639 -> 47 | K639: 14 | L639: 9 | M639: =K639*6+L639 -> 93 | O639: 14 | P639: 11 | Q639: =O639*6+P639 -> 95 | S639: YARRAVILLE
A640: YARRAVILLE | C640: 1 | D640: 1 | E640: =C640*6+D640 -> 7 | G640: 9 | H640: 7 | I640: =G640*6+H640 -> 61 | K640: 11 | L640: 7 | M640: =K640*6+L640 -> 73 | O640: 13 | P640: 11 | Q640: =O640*6+P640 -> 89 | S640: O'BRIEN
A641: BEST PLAYERS
A642: BRUNSWICK | C642: FEWSTER | F642: HOBBS | I642: ALLEN | L642: McCABE | O642: O'BRIEN | R642: LIAKOUREAS
A643: YARRAVILLE | C643: SMITH | F643: BROPHY | I643: QUARANTOTTO | L643: STURNEIKS | O643: MARTIN | R643: HENDERSON
A644: GOALKICKERS
A645: BRUNSWICK | C645: ALLEN 5 | F645: BAIRD 5 | I645: HANCOCK | L645: BARTLETT | N645: HOBBS | P645: GUTTERSON
A646: YARRAVILLE | C646: BROWN 3 | F646: SHIELDS 3 | I646: MARTIN 2 | K646: JOHNSON 2 | M646: NORRIS | O646: DOWLING | R646: QUARANTOTTO
A648: WAVERLEY | C648: 2 | D648: 2 | E648: =C648*6+D648 -> 14 | G648: 6 | H648: 10 | I648: =G648*6+H648 -> 46 | K648: 9 | L648: 14 | M648: =K648*6+L648 -> 68 | O648: 14 | P648: 17 | Q648: =O648*6+P648 -> 101 | S648: WERRIBEE
A649: WERRIBEE | C649: 4 | D649: 6 | E649: =C649*6+D649 -> 30 | G649: 8 | H649: 7 | I649: =G649*6+H649 -> 55 | K649: 10 | L649: 14 | M649: =K649*6+L649 -> 74 | O649: 14 | P649: 15 | Q649: =O649*6+P649 -> 99 | S649: GAMBETTA
A650: BEST PLAYERS
A651: WAVERLEY | C651: SYKES | F651: YOUNG | I651: MILES | L651: IVEY | N651: HANCOCK | Q651: PARKS
A652: WERRIBEE | C652: N MITCHELL | F652: BUTTON | I652: HARVEY | L652: NEWMAN | N652: COCKS | Q652: J HINKLEY
A653: GOALKICKERS
A654: WAVERLEY | C654: IVEY 5 | E654: STONE 2 | G654: HARRY 2 | I654: McNAMEE 2 | L654: HANCOCK 2 | O654: COSTELLO
A655: WERRIBEE | C655: N MITCHELL 8 | F655: BRYANT 2 | I655: DOUGLAS 2 | L655: HINKLEY | N655: F MITCHELL
A657: CAULFIELD | C657: 2 | D657: 5 | E657: =C657*6+D657 -> 17 | G657: 6 | H657: 18 | I657: =G657*6+H657 -> 54 | K657: 12 | L657: 21 | M657: =K657*6+L657 -> 93 | O657: 17 | P657: 28 | Q657: =O657*6+P657 -> 130 | S657: CAMBERWELL
A658: CAMBERWELL | C658: 4 | D658: 6 | E658: =C658*6+D658 -> 30 | G658: 7 | H658: 9 | I658: =G658*6+H658 -> 51 | K658: 8 | L658: 13 | M658: =K658*6+L658 -> 61 | O658: 12 | P658: 16 | Q658: =O658*6+P658 -> 88 | S658: McBAIN
A659: BEST PLAYERS
A660: CAULFIELD | C660: MAGUIRE | F660: BAKER | I660: CLIFF | L660: WHITE | N660: DOWSETT
A661: CAMBERWELL | C661: HAMMOND | F661: NORTON | I661: HOOK | L661: FOX | N661: ROUTLEDGE | Q661: MARTIN
A662: GOALKICKERS
A663: CAULFIELD | C663: MAGUIRE 6 | F663: CLIFF 3 | H663: WHITE 2 | J663: RENOWDEN 2 | M663: JEWELL 2 | O663: GOODEN | Q663: ARRELL
A664: CAMBERWELL | C664: HAMMOND 4 | F664: WHITE 2 | H664: NORTON | J664: STONE | L664: HAZLETT | N664: HALBERG | Q664: KERR | S664: PATURZO
A666: ROUND 15 | E666: 22ND JULY | J666: WEATHER
D667: 1ST QTR | H667: 2ND QTR | L667: 3RD QTR | P667: FINAL | S667: BOX HILL
A668: YARRAVILLE | C668: 7 | D668: 4 | E668: =C668*6+D668 -> 46 | G668: 14 | H668: 5 | I668: =G668*6+H668 -> 89 | K668: 18 | L668: 12 | M668: =K668*6+L668 -> 120 | O668: 23 | P668: 14 | Q668: =O668*6+P668 -> 152 | S668: UMPIRE | X668: LADDER | AB668: ROUND | AD668: 15
A669: BOX HILL | C669: 1 | D669: 2 | E669: =C669*6+D669 -> 8 | G669: 4 | H669: 6 | I669: =G669*6+H669 -> 30 | K669: 8 | L669: 8 | M669: =K669*6+L669 -> 56 | O669: 13 | P669: 13 | Q669: =O669*6+P669 -> 91 | S669: STIRLING
A670: BEST PLAYERS | W670: TEAM | X670: W | Y670: L | Z670: D | AA670: FOR | AB670: AGST | AC670: % | AD670: PTS
A671: YARRAVILLE | C671: QUARANTOTTO | F671: BROPHY | I671: T SMITH | L671: MARTIN | N671: WAGHORNE | Q671: SHIELDS
A672: BOX HILL | C672: MAGILL | F672: EDWARDS | I672: K HARRIS | L672: TIERNEY | N672: CURTIS | Q672: BRYANT | W672: WAVERLEY | X672: 13 | Y672: 2 | Z672: 0 | AA672: 2256 | AB672: 1208 | AC672: =(AA672*100)/AB672 -> 186.75496688741723 | AD672: =(X672*4)+(Z672*2) -> 52
A673: GOALKICKERS | W673: CAULFIELD | X673: 12 | Y673: 3 | Z673: 0 | AA673: 2085 | AB673: 1324 | AC673: =(AA673*100)/AB673 -> 157.47734138972811 | AD673: =(X673*4)+(Z673*2) -> 48
A674: YARRAVILLE | C674: SHIELDS 5 | E674: DOWLING 4 | G674: JOHNSON 4 | J674: BATES 3 | L674: MARTIN 2 | N674: BROWN 2 | P674: QUARANTOTTO 2 | S674: SMITH | W674: BRUNSWICK | X674: 10 | Y674: 4 | Z674: 1 | AA674: 1622 | AB674: 1476 | AC674: =(AA674*100)/AB674 -> 109.89159891598916 | AD674: =(X674*4)+(Z674*2) -> 42
A675: BOX HILL | C675: MAGILL 5 | E675: COOK 2 | G675: A HARRIS 2 | J675: CURTIS | L675: SUNDERMAN | O675: ANSELL | Q675: ZANTUCK | W675: FRANKSTON | X675: 9 | Y675: 5 | Z675: 1 | AA675: 1768 | AB675: 1649 | AC675: =(AA675*100)/AB675 -> 107.21649484536083 | AD675: =(X675*4)+(Z675*2) -> 38
A677: FRANKSTON | C677: 7 | D677: 12 | E677: =C677*6+D677 -> 54 | G677: 11 | H677: 19 | I677: =G677*6+H677 -> 85 | K677: 16 | L677: 25 | M677: =K677*6+L677 -> 121 | O677: 23 | P677: 31 | Q677: =O677*6+P677 -> 169 | S677: FRANKSTON | W677: CAMBERWELL | X677: 7 | Y677: 7 | Z677: 1 | AA677: 1515 | AB677: 1456 | AC677: =(AA677*100)/AB677 -> 104.0521978021978 | AD677: =(X677*4)+(Z677*2) -> 30
A678: NORTHCOTE | C678: 1 | D678: 3 | E678: =C678*6+D678 -> 9 | G678: 7 | H678: 3 | I678: =G678*6+H678 -> 45 | K678: 12 | L678: 3 | M678: =K678*6+L678 -> 75 | O678: 15 | P678: 6 | Q678: =O678*6+P678 -> 96 | S678: DAVIES | W678: WERRIBEE | X678: 7 | Y678: 8 | Z678: 0 | AA678: 1490 | AB678: 1690 | AC678: =(AA678*100)/AB678 -> 88.165680473372788 | AD678: =(X678*4)+(Z678*2) -> 28
A679: BEST PLAYERS | W679: YARRAVILLE | X679: 6 | Y679: 8 | Z679: 1 | AA679: 1477 | AB679: 1678 | AC679: =(AA679*100)/AB679 -> 88.021454112038143 | AD679: =(X679*4)+(Z679*2) -> 26
A680: FRANKSTON | C680: LOVELOCK | F680: CLARK | I680: FITZGERALD | L680: BRIESE | N680: ROWE | W680: NORTHCOTE | X680: 6 | Y680: 9 | Z680: 0 | AA680: 1531 | AB680: 2017 | AC680: =(AA680*100)/AB680 -> 75.904809122459099 | AD680: =(X680*4)+(Z680*2) -> 24
A681: NORTHCOTE | C681: HOUGH | F681: ROBERTS | I681: KOZARIS | L681: BIENKE | N681: LEECH | Q681: BEATON | W681: MORDIALLOC | X681: 4 | Y681: 11 | Z681: 0 | AA681: 1317 | AB681: 1762 | AC681: =(AA681*100)/AB681 -> 74.744608399545967 | AD681: =(X681*4)+(Z681*2) -> 16
A682: GOALKICKERS | W682: BOX HILL | X682: 0 | Y682: 15 | Z682: 0 | AA682: 1259 | AB682: 2104 | AC682: =(AA682*100)/AB682 -> 59.838403041825096 | AD682: =(X682*4)+(Z682*2) -> 0
A683: FRANKSTON | C683: LOVELOCK 7 | F683: JUNGWIRTH 4 | I683: BRIESE 3 | K683: CLARK 3 | M683: FALKINER 2 | P683: DOHERTY | R683: McNAB | T683: ROWE
A684: NORTHCOTE | C684: HOUGH 7 | E684: COHEN | G684: WATT | I684: AFFLECK | K684: KILKENNY | M684: ROBERTS | O684: RYAN | Q684: BIENKE | S684: RICHARDS
A686: WAVERLEY | C686: 7 | D686: 6 | E686: =C686*6+D686 -> 48 | G686: 10 | H686: 10 | I686: =G686*6+H686 -> 70 | K686: 14 | L686: 14 | M686: =K686*6+L686 -> 98 | O686: 18 | P686: 16 | Q686: =O686*6+P686 -> 124 | S686: WAVERLEY
A687: MORDIALLOC | C687: 0 | D687: 1 | E687: =C687*6+D687 -> 1 | G687: 2 | H687: 3 | I687: =G687*6+H687 -> 15 | K687: 4 | L687: 3 | M687: =K687*6+L687 -> 27 | O687: 6 | P687: 5 | Q687: =O687*6+P687 -> 41 | S687: MURLEY
A688: BEST PLAYERS
A689: WAVERLEY | C689: STONE | F689: FERGUSON | I689: R ALLAN | L689: SYKES | N689: HARRY | Q689: MILES
A690: MORDIALLOC | C690: HARRY | F690: SMITH | I690: PINNE | L690: BESANKO | N690: WILKINS | Q690: EDDY
A691: GOALKICKERS
A692: WAVERLEY | C692: IVEY 5 | E692: HARRY 3 | G692: R ALLAN 2 | J692: OSBORNE 2 | L692: STONE 2 | N692: McNAMEE | P692: PITTS | R692: HANCOCK | T692: FISHER
A693: MORDIALLOC | C693: McFARLANE 2 | F693: WILKINS 2 | I693: LEGG? | K693: HARRY
A695: CAULFIELD | C695: 3 | D695: 4 | E695: =C695*6+D695 -> 22 | G695: 10 | H695: 6 | I695: =G695*6+H695 -> 66 | K695: 16 | L695: 7 | M695: =K695*6+L695 -> 103 | O695: 22 | P695: 11 | Q695: =O695*6+P695 -> 143 | S695: PRINCES PARK, CAULFIELD
A696: WERRIBEE | C696: 2 | D696: 2 | E696: =C696*6+D696 -> 14 | G696: 8 | H696: 9 | I696: =G696*6+H696 -> 57 | K696: 8 | L696: 13 | M696: =K696*6+L696 -> 61 | O696: 9 | P696: 17 | Q696: =O696*6+P696 -> 71 | S696: TORNEY
A697: BEST PLAYERS
A698: CAULFIELD | C698: WHITE | F698: CLIFF | I698: HOCKING | L698: GUINANE | O698: DOWSETT | R698: BAKER
A699: WERRIBEE | C699: BRENNAN | F699: HARVEY | I699: N MITCHELL | L699: NEWMAN | O699: COCKS | R699: BUTTON
A700: GOALKICKERS
A701: CAULFIELD | C701: MAGUIRE 5 | F701: CLIFF 4 | H701: GUINANE 3 | J701: WHITE 3 | L701: JEWELL 2 | N701: CRUNDEN | P701: ARRELL | R701: BAKER | T701: HOCKING
A702: WERRIBEE | C702: N MITCHELL 4 | F702: DOUGLAS 3 | I702: MONTGOMERY | L702: BRYANT
A704: BRUNSWICK | C704: 4 | D704: 3 | E704: =C704*6+D704 -> 27 | G704: 8 | H704: 4 | I704: =G704*6+H704 -> 52 | K704: 16 | L704: 10 | M704: =K704*6+L704 -> 106 | O704: 21 | P704: 17 | Q704: =O704*6+P704 -> 143 | S704: BRUNSWICK
A705: CAMBERWELL | C705: 6 | D705: 3 | E705: =C705*6+D705 -> 39 | G705: 10 | H705: 5 | I705: =G705*6+H705 -> 65 | K705: 14 | L705: 9 | M705: =K705*6+L705 -> 93 | O705: 17 | P705: 14 | Q705: =O705*6+P705 -> 116 | S705: MARKS
A706: BEST PLAYERS
A707: BRUNSWICK | C707: LAKER | F707: McFARLANE | I707: HINTON | L707: DIMMATINA | O707: O'BRIEN | R707: McCABE
A708: CAMBERWELL | C708: ROUTLEDGE | F708: HOOK | I708: PATURZO | L708: SAUERBERG | O708: HAMMOND | R708: EDDY
A709: GOALKICKERS
A710: BRUNSWICK | C710: LAKER 5 | E710: DIMMATINA 4 | H710: HINTON 3 | J710: BAIRD 3 | L710: HOBBS 2 | N710: McFARLANE 2 | Q710: BARTLET | S710: LIAKOUREAS
A711: CAMBERWELL | C711: HAMMOND 4 | F711: HALBERT 3 | I711: NORTON 2 | K711: STONE 2 | M711: HAZLETT 2 | P711: EDDY 2 | R711: PATURZO | U711: WILSON
A713: ROUND 16 | E713: 29TH JULY | J713: WEATHER | S713: PLAYED AT
D714: 1ST QTR | H714: 2ND QTR | L714: 3RD QTR | P714: FINAL | S714: NORTHCOTE
A715: NORTHCOTE | C715: 4 | D715: 3 | E715: =C715*6+D715 -> 27 | G715: 7 | H715: 5 | I715: =G715*6+H715 -> 47 | K715: 12 | L715: 10 | M715: =K715*6+L715 -> 82 | O715: 14 | P715: 14 | Q715: =O715*6+P715 -> 98 | S715: UMPIRE | X715: LADDER | AB715: ROUND | AD715: 16
A716: BOX HILL | C716: 1 | D716: 1 | E716: =C716*6+D716 -> 7 | G716: 5 | H716: 7 | I716: =G716*6+H716 -> 37 | K716: 7 | L716: 10 | M716: =K716*6+L716 -> 52 | O716: 10 | P716: 16 | Q716: =O716*6+P716 -> 76 | S716: TORNEY
A717: BEST PLAYERS | W717: TEAM | X717: W | Y717: L | Z717: D | AA717: FOR | AB717: AGST | AC717: % | AD717: PTS
A718: NORTHCOTE | C718: GELLIE | F718: KOZARIS | I718: STEWART | L718: BIENKE | N718: BEATON | Q718: ANDERSON
A719: BOX HILL | C719: BRYANT | F719: MAGILL | I719: NANKERVIS | L719: CURTIS | N719: WATERS | Q719: COOK | W719: WAVERLEY | X719: 13 | Y719: 3 | Z719: 0 | AA719: 2348 | AB719: 1319 | AC719: =(AA719*100)/AB719 -> 178.013646702047 | AD719: =(X719*4)+(Z719*2) -> 52
A720: GOALKICKERS | W720: CAULFIELD | X720: 13 | Y720: 3 | Z720: 0 | AA720: 2182 | AB720: 1405 | AC720: =(AA720*100)/AB720 -> 155.30249110320284 | AD720: =(X720*4)+(Z720*2) -> 52
A721: NORTHCOTE | C721: RYAN 3 | E721: ROPER 2 | G721: HOUGH 2 | I721: KOZARIS 2 | K721: GELLIE | M721: KILKENNY | O721: ROBERTS | Q721: NANKERVIS | S721: HOLLAND | W721: BRUNSWICK | X721: 10 | Y721: 5 | Z721: 1 | AA721: 1711 | AB721: 1571 | AC721: =(AA721*100)/AB721 -> 108.91152132399745 | AD721: =(X721*4)+(Z721*2) -> 42
A722: BOX HILL | C722: MAGILL 3 | E722: CURTIS 2 | G722: CHRISTIE 2 | I722: ZANTUCK | L722: COOK | N722: WILLIAMS | W722: FRANKSTON | X722: 10 | Y722: 5 | Z722: 1 | AA722: 1879 | AB722: 1741 | AC722: =(AA722*100)/AB722 -> 107.92647903503733 | AD722: =(X722*4)+(Z722*2) -> 42
A724: FRANKSTON | C724: 3 | D724: 6 | E724: =C724*6+D724 -> 24 | G724: 10 | H724: 7 | I724: =G724*6+H724 -> 67 | K724: 12 | L724: 10 | M724: =K724*6+L724 -> 82 | O724: 16 | P724: 15 | Q724: =O724*6+P724 -> 111 | S724: FRANKSTON | W724: CAMBERWELL | X724: 8 | Y724: 7 | Z724: 1 | AA724: 1644 | AB724: 1557 | AC724: =(AA724*100)/AB724 -> 105.58766859344894 | AD724: =(X724*4)+(Z724*2) -> 34
A725: WAVERLEY | C725: 5 | D725: 4 | E725: =C725*6+D725 -> 34 | G725: 6 | H725: 4 | I725: =G725*6+H725 -> 40 | K725: 12 | L725: 6 | M725: =K725*6+L725 -> 78 | O725: 14 | P725: 8 | Q725: =O725*6+P725 -> 92 | S725: HAYES | W725: WERRIBEE | X725: 7 | Y725: 9 | Z725: 0 | AA725: 1591 | AB725: 1819 | AC725: =(AA725*100)/AB725 -> 87.465640461792191 | AD725: =(X725*4)+(Z725*2) -> 28
A726: BEST PLAYERS | W726: NORTHCOTE | X726: 7 | Y726: 9 | Z726: 0 | AA726: 1629 | AB726: 2093 | AC726: =(AA726*100)/AB726 -> 77.830864787386531 | AD726: =(X726*4)+(Z726*2) -> 28
A727: FRANKSTON | C727: McNAB | F727: ROWE | I727: RENOUF | L727: DOHERTY | O727: ROSENBROCK | R727: LOVELOCK | W727: YARRAVILLE | X727: 6 | Y727: 9 | Z727: 1 | AA727: 1558 | AB727: 1775 | AC727: =(AA727*100)/AB727 -> 87.774647887323937 | AD727: =(X727*4)+(Z727*2) -> 26
A728: WAVERLEY | C728: SYKES | F728: B ALLAN | I728: FERGUSON | L728: HANCOCK | O728: R ALLAN | R728: MILES | W728: MORDIALLOC | X728: 5 | Y728: 11 | Z728: 0 | AA728: 1412 | AB728: 1851 | AC728: =(AA728*100)/AB728 -> 76.283090221501894 | AD728: =(X728*4)+(Z728*2) -> 20
A729: GOALKICKERS | C729: 1 SHORT | W729: BOX HILL | X729: 0 | Y729: 16 | Z729: 0 | AA729: 1335 | AB729: 2202 | AC729: =(AA729*100)/AB729 -> 60.626702997275203 | AD729: =(X729*4)+(Z729*2) -> 0
A730: FRANKSTON | C730: LOVELOCK 4 | F730: SKREJA 3 | H730: JUNGWIRTH 3 | K730: DOHERTY 2 | N730: BLOOMFIELD | Q730: CLARK | S730: WINSTANLEY
A731: WAVERLEY | C731: R ALLAN 4 | F731: COSTELLO 4 | I731: GOODWIN 3 | L731: HANCOCK 2 | O731: IVEY
A733: MORDIALLOC | C733: 6 | D733: 10 | E733: =C733*6+D733 -> 46 | G733: 9 | H733: 11 | I733: =G733*6+H733 -> 65 | K733: 13 | L733: 15 | M733: =K733*6+L733 -> 93 | O733: 13 | P733: 17 | Q733: =O733*6+P733 -> 95 | S733: MORDIALLOC
A734: BRUNSWICK | C734: 1 | D734: 0 | E734: =C734*6+D734 -> 6 | G734: 5 | H734: 8 | I734: =G734*6+H734 -> 38 | K734: 5 | L734: 10 | M734: =K734*6+L734 -> 40 | O734: 12 | P734: 17 | Q734: =O734*6+P734 -> 89 | S734: DAVIS
A735: BEST PLAYERS
A736: MORDIALLOC | C736: EDDY | F736: PINNE | I736: SMITH | L736: GUY | N736: HARRY | Q736: WILKINS
A737: BRUNSWICK | C737: O'BRIEN | F737: SKIDMORE | I737: McFARLANE | L737: ALLEN | N737: McCABE | Q737: LAKER
A738: GOALKICKERS
A739: MORDIALLOC | C739: HARRY 4 | F739: SMITH 3 | I739: MEAGHER 3 | L739: WILKINS 2 | N739: SHUGG
A740: BRUNSWICK | C740: ALLEN 4 | E740: LAKER 2 | G740: ANDERSON | I740: O'BRIEN | K740: DIMMATINA | N740: HANTON | P740: HOBBS | R740: McFARLANE
A742: CAULFIELD | C742: 6 | D742: 4 | E742: =C742*6+D742 -> 40 | G742: 7 | H742: 9 | I742: =G742*6+H742 -> 51 | K742: 12 | L742: 11 | M742: =K742*6+L742 -> 83 | O742: 14 | P742: 13 | Q742: =O742*6+P742 -> 97 | S742: YARRAVILLE
A743: YARRAVILLE | C743: 0 | D743: 2 | E743: =C743*6+D743 -> 2 | G743: 3 | H743: 8 | I743: =G743*6+H743 -> 26 | K743: 5 | L743: 9 | M743: =K743*6+L743 -> 39 | O743: 11 | P743: 15 | Q743: =O743*6+P743 -> 81 | S743: STABB
A744: BEST PLAYERS
A745: CAULFIELD | C745: TULLOCH | F745: WHITE | I745: R FELDMANN | L745: BAKER | O745: GOWANS | R745: GLAZNER
A746: YARRAVILLE | C746: JAMES | F746: MARTIN | I746: SMITH | L746: BROPHY | O746: CONDUIT | R746: BROWN
A747: GOALKICKERS
A748: CAULFIELD | C748: GOWANS 3 | E748: MAGUIRE 2 | G748: WHITE 2 | I748: BAKER 2 | K748: ARRELL | M748: GUINANE | O748: LOGAN | Q748: DOWSETT | S748: TULLOCH
A749: YARRAVILLE | C749: SHIELDS 2 | E749: BROWN 2 | G749: JOHNSON 2 | I749: BROPHY | K749: MARTIN | M749: BATES | O749: HARRISON | R749: QUARANTOTTO
A751: CAMBERWELL | C751: 3 | D751: 5 | E751: =C751*6+D751 -> 23 | G751: 7 | H751: 9 | I751: =G751*6+H751 -> 51 | K751: 11 | L751: 13 | M751: =K751*6+L751 -> 79 | O751: 18 | P751: 21 | Q751: =O751*6+P751 -> 129 | S751: WERRIBEE
A752: WERRIBEE | C752: 3 | D752: 4 | E752: =C752*6+D752 -> 22 | G752: 9 | H752: 5 | I752: =G752*6+H752 -> 59 | K752: 13 | L752: 8 | M752: =K752*6+L752 -> 86 | O752: 15 | P752: 11 | Q752: =O752*6+P752 -> 101 | S752: MURLEY
A753: BEST PLAYERS
A754: CAMBERWELL | C754: HAMMOND | F754: STONE | I754: HOOK | L754: SIMPSON | P754: HUMPHREY | S754: SAUERBERG
A755: WERRIBEE | C755: HINKLEY | F755: BRENNAN | I755: F MITCHELL | L755: SHEAHAN | P755: BRYANT | S755: BUTTON
A756: GOALKICKERS
A757: CAMBERWELL | C757: ANDREWS 4 | F757: STONE 4 | H757: SIMPSON 3 | J757: PATURZO 2 | L757: DOBSON | N757: DARE | O757: HUMPHREY | R757: PARSONS | U757: HAMMOND
A758: WERRIBEE | C758: HINKLEY 5 | E758: BRYANT 2 | G758: SOMERVILLE 2 | J758: SHEAHAN 2 | M758: F MITCHELL | O758: N MITCHELL | R758: FARRER | U758: DOUGLAS
A760: ROUND 17 | E760: 5TH AUGUST | J760: WEATHER | S760: PLAYED AT
D761: 1ST QTR | H761: 2ND QTR | L761: 3RD QTR | P761: FINAL | S761: PRINCES PARK, CAULFIELD
A762: CAULFIELD | C762: 2 | D762: 3 | E762: =C762*6+D762 -> 15 | G762: 11 | H762: 5 | I762: =G762*6+H762 -> 71 | K762: 16 | L762: 9 | M762: =K762*6+L762 -> 105 | O762: 19 | P762: 19 | Q762: =O762*6+P762 -> 133 | S762: UMPIRE | X762: LADDER | AB762: ROUND | AD762: 17
A763: FRANKSTON | C763: 3 | D763: 8 | E763: =C763*6+D763 -> 26 | G763: 8 | H763: 13 | I763: =G763*6+H763 -> 61 | K763: 13 | L763: 15 | M763: =K763*6+L763 -> 93 | O763: 16 | P763: 17 | Q763: =O763*6+P763 -> 113 | S763: MURLEY
A764: BEST PLAYERS | W764: TEAM | X764: W | Y764: L | Z764: D | AA764: FOR | AB764: AGST | AC764: % | AD764: PTS
A765: CAULFIELD | C765: R FELDMANN | F765: TULLOCH | I765: SARGENT | L765: JEWELL | O765: HOCKING | R765: BAKER
A766: FRANKSTON | C766: RENOUF | F766: McNAB | I766: STAPLETON | L766: FITZGERALD | O766: WINSTANLEY | R766: EDWARDS | W766: WAVERLEY | X766: 14 | Y766: 3 | Z766: 0 | AA766: 2463 | AB766: 1410 | AC766: =(AA766*100)/AB766 -> 174.68085106382978 | AD766: =(X766*4)+(Z766*2) -> 56
A767: GOALKICKERS | W767: CAULFIELD | X767: 14 | Y767: 3 | Z767: 0 | AA767: 2315 | AB767: 1518 | AC767: =(AA767*100)/AB767 -> 152.50329380764163 | AD767: =(X767*4)+(Z767*2) -> 56
A768: CAULFIELD | C768: LOGAN 3 | E768: CLIFF 3 | G768: WHITE 3 | I768: GOWANS 2 | K768: BROWN 2 | M768: GUINANE 2 | O768: HOCKING 2 | R768: RENOWDEN | T768: BAKER | W768: BRUNSWICK | X768: 11 | Y768: 5 | Z768: 1 | AA768: 1873 | AB768: 1618 | AC768: =(AA768*100)/AB768 -> 115.7601977750309 | AD768: =(X768*4)+(Z768*2) -> 46
A769: FRANKSTON | C769: EDWARDS 4 | F769: LOVELOCK 3 | I769: JUNGWIRTH 3 | L769: ROWE | N769: McNAB | P769: WINSTANLEY | S769: BLOOMFIELD | W769: FRANKSTON | X769: 10 | Y769: 6 | Z769: 1 | AA769: 1992 | AB769: 1874 | AC769: =(AA769*100)/AB769 -> 106.29669156883671 | AD769: =(X769*4)+(Z769*2) -> 42
M770: FALKINER | P770: BEAMAN
A771: WAVERLEY | C771: 5 | D771: 6 | E771: =C771*6+D771 -> 36 | G771: 7 | H771: 14 | I771: =G771*6+H771 -> 56 | K771: 14 | L771: 21 | M771: =K771*6+L771 -> 105 | O771: 15 | P771: 25 | Q771: =O771*6+P771 -> 115 | S771: YARRAVILLE | W771: CAMBERWELL | X771: 9 | Y771: 7 | Z771: 1 | AA771: 1774 | AB771: 1655 | AC771: =(AA771*100)/AB771 -> 107.19033232628399 | AD771: =(X771*4)+(Z771*2) -> 38
A772: YARRAVILLE | C772: 2 | D772: 1 | E772: =C772*6+D772 -> 13 | G772: 8 | H772: 4 | I772: =G772*6+H772 -> 52 | K772: 9 | L772: 5 | M772: =K772*6+L772 -> 59 | O772: 14 | P772: 7 | Q772: =O772*6+P772 -> 91 | S772: McBAIN | W772: NORTHCOTE | X772: 8 | Y772: 9 | Z772: 0 | AA772: 1738 | AB772: 2191 | AC772: =(AA772*100)/AB772 -> 79.324509356458236 | AD772: =(X772*4)+(Z772*2) -> 32
A773: BEST PLAYERS | W773: WERRIBEE | X773: 7 | Y773: 10 | Z773: 0 | AA773: 1689 | AB773: 1928 | AC773: =(AA773*100)/AB773 -> 87.603734439834028 | AD773: =(X773*4)+(Z773*2) -> 28
A774: WAVERLEY | C774: COSTELLO | F774: GILLESPIE | I774: B ALLAN | L774: HANCOCK | O774: McNAMEE | R774: IVEY | W774: YARRAVILLE | X774: 6 | Y774: 10 | Z774: 1 | AA774: 1649 | AB774: 1890 | AC774: =(AA774*100)/AB774 -> 87.248677248677254 | AD774: =(X774*4)+(Z774*2) -> 26
A775: YARRAVILLE | C775: CONDUIT | F775: HARRISON | I775: HARVEY | L775: MARTIN | O775: RYAN | R775: LEE | W775: MORDIALLOC | X775: 5 | Y775: 12 | Z775: 0 | AA775: 1510 | AB775: 1981 | AC775: =(AA775*100)/AB775 -> 76.2241292276628 | AD775: =(X775*4)+(Z775*2) -> 20
A776: GOALKICKERS | W776: BOX HILL | X776: 0 | Y776: 17 | Z776: 0 | AA776: 1382 | AB776: 2364 | AC776: =(AA776*100)/AB776 -> 58.460236886632828 | AD776: =(X776*4)+(Z776*2) -> 0
A777: WAVERLEY | C777: IVEY 5 | E777: GOODWIN 3 | H777: HANCOCK 2 | K777: GILLESPIE 2 | N777: COSTELLO 2 | Q777: R ALLAN
A778: YARRAVILLE | C778: SHIELDS 3 | E778: HARVEY 2 | G778: RYAN 2 | I778: JOHNSON 2 | L778: MARTIN | N778: BATES | P778: BROPHY | R778: WITHINGTON
A780: NORTHCOTE | C780: 7 | D780: 5 | E780: =C780*6+D780 -> 47 | G780: 10 | H780: 7 | I780: =G780*6+H780 -> 67 | K780: 13 | L780: 9 | M780: =K780*6+L780 -> 87 | O780: 16 | P780: 13 | Q780: =O780*6+P780 -> 109 | S780: WERRIBEE
A781: WERRIBEE | C781: 0 | D781: 3 | E781: =C781*6+D781 -> 3 | G781: 5 | H781: 7 | I781: =G781*6+H781 -> 37 | K781: 10 | L781: 11 | M781: =K781*6+L781 -> 71 | O781: 13 | P781: 20 | Q781: =O781*6+P781 -> 98 | S781: O'BRIEN
A782: BEST PLAYERS
A783: NORTHCOTE | C783: GELLIE | F783: COHEN | I783: RYAN | L783: A JEPHSON | O783: HOLLAND | R783: KOZARIS
A784: WERRIBEE | C784: SHEAHAN | F784: RIDDELL | I784: F MITCHELL | L784: McCARTNEY | O784: HARVEY | R784: BOURKE
A785: GOALKICKERS
A786: NORTHCOTE | C786: RYAN 5 | E786: ROPER 2 | G786: COHEN 2 | I786: GELLIE 2 | K786: HOUGH 2 | M786: NANKERVIS | O786: HOLLAND | Q786: THORNELOE
A787: WERRIBEE | C787: RIDDELL 5 | F787: F MITCHELL 4 | I787: DOUGLAS 3 | L787: SOMERVILLE
A789: CAMBERWELL | C789: 3 | D789: 5 | E789: =C789*6+D789 -> 23 | G789: 8 | H789: 8 | I789: =G789*6+H789 -> 56 | K789: 14 | L789: 14 | M789: =K789*6+L789 -> 98 | O789: 19 | P789: 16 | Q789: =O789*6+P789 -> 130 | S789: CAMBERWELL
A790: MORDIALLOC | C790: 3 | D790: 3 | E790: =C790*6+D790 -> 21 | G790: 5 | H790: 6 | I790: =G790*6+H790 -> 36 | K790: 10 | L790: 9 | M790: =K790*6+L790 -> 69 | O790: 14 | P790: 14 | Q790: =O790*6+P790 -> 98 | S790: GAMBETTA
A791: BEST PLAYERS
A792: CAMBERWELL | C792: STONE | F792: ANDREWS | I792: ROUTLEDGE | L792: HAZLETT | O792: HAMMOND | R792: BRAYNE
A793: MORDIALLOC | C793: PINNE | F793: JOHNSTONE | I793: HARRY | L793: SHUGG | O793: SMITH
A794: GOALKICKERS
A795: CAMBERWELL | C795: ANDREWS 7 | F795: STONE 3 | H795: PATURZO 3 | J795: PARSONS 2 | M795: HAMMOND 2 | P795: SIMPSON | R795: BRYCE
A796: MORDIALLOC | C796: McGUINNESS 3 | F796: SHUGG 2 | H796: SMITH 2 | J796: LANG 2 | L796: WILKINS 2 | N796: HARRY | P796: GARDNER | R796: WOOTTEN
A798: BRUNSWICK | C798: 4 | D798: 9 | E798: =C798*6+D798 -> 33 | G798: 11 | H798: 13 | I798: =G798*6+H798 -> 79 | K798: 17 | L798: 16 | M798: =K798*6+L798 -> 118 | O798: 23 | P798: 24 | Q798: =O798*6+P798 -> 162 | S798: BRUNSWICK
A799: BOX HILL | C799: 1 | D799: 1 | E799: =C799*6+D799 -> 7 | G799: 3 | H799: 4 | I799: =G799*6+H799 -> 22 | K799: 3 | L799: 6 | M799: =K799*6+L799 -> 24 | O799: 6 | P799: 11 | Q799: =O799*6+P799 -> 47 | S799: POPE
A800: BEST PLAYERS
A801: BRUNSWICK | C801: HORSINGTON | F801: HANTON | I801: ALLEN | L801: McCABE | O801: SKIDMORE | R801: McFARLANE
A802: BOX HILL | C802: WATERS | F802: BRYANT | I802: K HARRIS | L802: A HARRIS | O802: EDWARDS | R802: CURTIS
A803: GOALKICKERS
A804: BRUNSWICK | C804: BAIRD 5 | E804: ALLEN 5 | G804: McFARLANE 4 | J804: HANTON 3 | M804: HOBBS 3 | O804: WROUT 2 | Q804: LAKER
A805: BOX HILL | C805: SMITH 2 | F805: MARTIN | I805: A HARRIS | L805: BRYANT | N805: LUGG
A807: ROUND 18 | E807: 12TH AUGUST | J807: WEATHER | S807: PLAYED AT
D808: 1ST QTR | H808: 2ND QTR | L808: 3RD QTR | P808: FINAL | S808: NORTHCOTE
A809: NORTHCOTE | C809: 2 | D809: 1 | E809: =C809*6+D809 -> 13 | G809: 7 | H809: 1 | I809: =G809*6+H809 -> 43 | K809: 10 | L809: 5 | M809: =K809*6+L809 -> 65 | O809: 15 | P809: 14 | Q809: =O809*6+P809 -> 104 | S809: UMPIRE | X809: LADDER | AB809: ROUND | AD809: 18
A810: YARRAVILLE | C810: 2 | D810: 5 | E810: =C810*6+D810 -> 17 | G810: 6 | H810: 10 | I810: =G810*6+H810 -> 46 | K810: 8 | L810: 12 | M810: =K810*6+L810 -> 60 | O810: 11 | P810: 14 | Q810: =O810*6+P810 -> 80 | S810: MURLEY
A811: BEST PLAYERS | W811: TEAM | X811: W | Y811: L | Z811: D | AA811: FOR | AB811: AGST | AC811: % | AD811: PTS
A812: NORTHCOTE | C812: BIENKE | F812: GELLIE | I812: HOLLAND | L812: KOZARIS | O812: STEWART | R812: HOUGH
A813: YARRAVILLE | C813: JANES | F813: HARVEY | I813: RYAN | L813: CONDUIT | O813: SMITH | R813: MARTIN | W813: CAULFIELD | X813: 15 | Y813: 3 | Z813: 0 | AA813: 2514 | AB813: 1611 | AC813: =(AA813*100)/AB813 -> 156.05214152700185 | AD813: =(X813*4)+(Z813*2) -> 60
A814: GOALKICKERS | W814: WAVERLEY | X814: 14 | Y814: 4 | Z814: 0 | AA814: 2569 | AB814: 1517 | AC814: =(AA814*100)/AB814 -> 169.34739617666446 | AD814: =(X814*4)+(Z814*2) -> 56
A815: NORTHCOTE | C815: HOUGH 5 | E815: RYAN 2 | G815: COHEN 2 | I815: KREYMBORG 2 | L815: GELLIE | N815: BIENKE | P815: FISHER | R815: KOZARIS | W815: BRUNSWICK | X815: 12 | Y815: 5 | Z815: 1 | AA815: 1987 | AB815: 1722 | AC815: =(AA815*100)/AB815 -> 115.3890824622532 | AD815: =(X815*4)+(Z815*2) -> 50
A816: YARRAVILLE | C816: BATES 3 | E816: RYAN 3 | G816: JOHNSON 2 | I816: BROWN 2 | L816: MARTIN | W816: CAMBERWELL | X816: 10 | Y816: 7 | Z816: 1 | AA816: 1881 | AB816: 1761 | AC816: =(AA816*100)/AB816 -> 106.81431005110733 | AD816: =(X816*4)+(Z816*2) -> 42
A818: CAULFIELD | C818: 9 | D818: 2 | E818: =C818*6+D818 -> 56 | G818: 19 | H818: 5 | I818: =G818*6+H818 -> 119 | K818: 23 | L818: 7 | M818: =K818*6+L818 -> 145 | O818: 31 | P818: 13 | Q818: =O818*6+P818 -> 199 | S818: BOX HILL | W818: FRANKSTON | X818: 10 | Y818: 7 | Z818: 1 | AA818: 2096 | AB818: 1988 | AC818: =(AA818*100)/AB818 -> 105.43259557344065 | AD818: =(X818*4)+(Z818*2) -> 42
A819: BOX HILL | C819: 5 | D819: 5 | E819: =C819*6+D819 -> 35 | G819: 8 | H819: 7 | I819: =G819*6+H819 -> 55 | K819: 12 | L819: 12 | M819: =K819*6+L819 -> 84 | O819: 13 | P819: 15 | Q819: =O819*6+P819 -> 93 | S819: WENN | W819: NORTHCOTE | X819: 9 | Y819: 9 | Z819: 0 | AA819: 1842 | AB819: 2271 | AC819: =(AA819*100)/AB819 -> 81.109643328929991 | AD819: =(X819*4)+(Z819*2) -> 36
A820: BEST PLAYERS | W820: WERRIBEE | X820: 7 | Y820: 11 | Z820: 0 | AA820: 1787 | AB820: 2039 | AC820: =(AA820*100)/AB820 -> 87.641000490436483 | AD820: =(X820*4)+(Z820*2) -> 28
A821: CAULFIELD | C821: GOWANS | F821: HOCKING | I821: R FELDMANN | L821: JEWELL | O821: CLIFF | R821: GLAZNER | W821: YARRAVILLE | X821: 6 | Y821: 11 | Z821: 1 | AA821: 1729 | AB821: 1994 | AC821: =(AA821*100)/AB821 -> 86.710130391173522 | AD821: =(X821*4)+(Z821*2) -> 26
A822: BOX HILL | C822: BRYANT | F822: COOK | I822: EDWARDS | L822: A HARRIS | O822: NANKERVIS | R822: LOVE | W822: MORDIALLOC | X822: 6 | Y822: 12 | Z822: 0 | AA822: 1621 | AB822: 2079 | AC822: =(AA822*100)/AB822 -> 77.970177970177971 | AD822: =(X822*4)+(Z822*2) -> 24
A823: GOALKICKERS | W823: BOX HILL | X823: 0 | Y823: 18 | Z823: 0 | AA823: 1475 | AB823: 2563 | AC823: =(AA823*100)/AB823 -> 57.549746390948108 | AD823: =(X823*4)+(Z823*2) -> 0
A824: CAULFIELD | C824: GOWANS 7 | E824: LOGAN 7 | G824: GUINANE 5 | I824: JEWELL 3 | K824: BAKER 3 | M824: ARRELL 3 | O824: WHITE 2 | Q824: CLIFF
A825: BOX HILL | C825: LUGG 3 | E825: TIERNEY 2 | G825: BRYANT 2 | I825: MAGILL 2 | K825: EDWARDS | N825: ZANTUCK | P825: ROBSON | R825: K HARRIS
A827: BRUNSWICK | C827: 4 | D827: 3 | E827: =C827*6+D827 -> 27 | G827: 9 | H827: 7 | I827: =G827*6+H827 -> 61 | K827: 14 | L827: 10 | M827: =K827*6+L827 -> 94 | O827: 17 | P827: 12 | Q827: =O827*6+P827 -> 114 | S827: FRANKSTON
A828: FRANKSTON | C828: 5 | D828: 4 | E828: =C828*6+D828 -> 34 | G828: 9 | H828: 7 | I828: =G828*6+H828 -> 61 | K828: 13 | L828: 11 | M828: =K828*6+L828 -> 89 | O828: 15 | P828: 14 | Q828: =O828*6+P828 -> 104 | S828: GAMBETTA
A829: BEST PLAYERS
A830: BRUNSWICK | C830: HORSINGTON | F830: FORD | I830: McCABE | L830: ALLEN | O830: HANTON | R830: MILLER
A831: FRANKSTON | C831: BLOOMFIELD | F831: McNAB | I831: ROSENBROCK | L831: STAPLETON | O831: RENOUF
A832: GOALKICKERS
A833: BRUNSWICK | C833: LAKER 3 | E833: HOBBS 3 | G833: BAIRD 3 | I833: ALLEN 2 | K833: HORSINGTON | N833: SKIDMORE | P833: HANTON | R833: GUTTERSON | T833: EGAN | V833: DIMMATINA
A834: FRANKSTON | C834: EDWARDS 3 | F834: BUNN 2 | H834: FITZGERALD 2 | K834: BLOOMFIELD 2 | N834: JUNGWIRTH 2 | Q834: FALKINER | S834: DOHERTY | V834: McNAB | X834: BRIESE
A836: MORDIALLOC | C836: 6 | D836: 4 | E836: =C836*6+D836 -> 40 | G836: 8 | H836: 6 | I836: =G836*6+H836 -> 54 | K836: 16 | L836: 9 | M836: =K836*6+L836 -> 105 | O836: 17 | P836: 9 | Q836: =O836*6+P836 -> 111 | S836: MORDIALLOC
A837: WERRIBEE | C837: 0 | D837: 8 | E837: =C837*6+D837 -> 8 | G837: 6 | H837: 11 | I837: =G837*6+H837 -> 47 | K837: 6 | L837: 15 | M837: =K837*6+L837 -> 51 | O837: 13 | P837: 20 | Q837: =O837*6+P837 -> 98 | S837: POPE
A838: BEST PLAYERS
A839: MORDIALLOC | C839: HARRY | F839: SMITH | I839: GUY | L839: THOMPSON | O839: BESANKO | R839: PINNE
A840: WERRIBEE | C840: BOURKE | F840: BRYANT | I840: McCARTNEY | L840: SOMERVILLE | O840: O'BRIEN | R840: BUTTON
A841: GOALKICKERS
A842: MORDIALLOC | C842: THOMPSON 5 | F842: McGUINNESS 3 | I842: HARRY 3 | K842: GUY | L842: SHUGG | N842: SMITH | P842: LANG | R842: WOOTTEN | T842: LAUGHLIN
A843: WERRIBEE | C843: N MITCHELL 4 | F843: F MITCHELL 3 | I843: SOMERVILLE 2 | L843: SHEAHAN 2 | O843: DOUGLAS 2
A845: CAMBERWELL | C845: 4 | D845: 7 | E845: =C845*6+D845 -> 31 | G845: 6 | H845: 11 | I845: =G845*6+H845 -> 47 | K845: 13 | L845: 15 | M845: =K845*6+L845 -> 93 | O845: 15 | P845: 17 | Q845: =O845*6+P845 -> 107 | S845: WAVERLEY
A846: WAVERLEY | C846: 1 | D846: 6 | E846: =C846*6+D846 -> 12 | G846: 8 | H846: 11 | I846: =G846*6+H846 -> 59 | K846: 10 | L846: 12 | M846: =K846*6+L846 -> 72 | O846: 15 | P846: 16 | Q846: =O846*6+P846 -> 106 | S846: DAVIS
A847: BEST PLAYERS
A848: CAMBERWELL | C848: ROUTLEDGE | F848: STONE | I848: HOOK | L848: SAUERBERG | O848: HUMPHREY | R848: HAMMOND
A849: WAVERLEY | C849: B ALLAN | F849: HARRY | I849: SYKES | L849: R ALLAN | O849: OSBORNE | R849: MILES
A850: GOALKICKERS
A851: CAMBERWELL | C851: PATURZO 4 | F851: HAMMOND 2 | I851: SAUERBERG 2 | L851: DARE 2 | N851: ANDREWS 2 | Q851: STONE | S851: HUMPHREY | V851: HAZLETT
A852: WAVERLEY | C852: GOODWIN 4 | F852: IVEY 3 | H852: HARRY 3 | J852: R ALLAN | L852: OSBORNE | N852: COSTELLO | P852: GILLESPIE | R852: STONE
A854: FINALS
A855: 1ST SEMI | E855: 19TH AUGUST | J855: WEATHER | S855: PLAYED AT
D856: 1ST QTR | H856: 2ND QTR | L856: 3RD QTR | P856: FINAL | S856: TOORAK PARK
A857: BRUNSWICK | C857: 4 | D857: 6 | E857: =C857*6+D857 -> 30 | G857: 6 | H857: 9 | I857: =G857*6+H857 -> 45 | K857: 13 | L857: 13 | M857: =K857*6+L857 -> 91 | O857: 18 | P857: 14 | Q857: =O857*6+P857 -> 122 | S857: UMPIRE
A858: CAMBERWELL | C858: 1 | D858: 5 | E858: =C858*6+D858 -> 11 | G858: 5 | H858: 10 | I858: =G858*6+H858 -> 40 | K858: 7 | L858: 12 | M858: =K858*6+L858 -> 54 | O858: 10 | P858: 18 | Q858: =O858*6+P858 -> 78 | S858: TORNEY
A859: BEST PLAYERS
A860: BRUNSWICK | C860: HORSINGTON | F860: WROUT | I860: C B ? | L860: HANTON | O860: ALLEN | R860: HOBBS
A861: CAMBERWELL | C861: STONE | F861: HAMMOND | I861: SIMPSON | L861: HUMPHREY | O861: BRAYNE | R861: HOOK
A862: GOALKICKERS
A863: BRUNSWICK | C863: HORSINGTON 4 | F863: ALLEN 3 | H863: DIMMATINA 2 | K863: HOBBS 2 | M863: LAKER 2 | O863: BAIRD 2 | Q863: MILLER | S863: GUTTERSON | V863: McFARLANE
A864: CAMBERWELL | C864: STONE 3 | F864: HUMPHREY 3 | I864: ANDREWS 2 | L864: SIMPSON | N864: PATURZO
A866: 2ND SEMI | E866: 26TH AUGUST | J866: WEATHER
A867: CAULFIELD | C867: 5 | D867: 3 | E867: =C867*6+D867 -> 33 | G867: 8 | H867: 6 | I867: =G867*6+H867 -> 54 | K867: 13 | L867: 10 | M867: =K867*6+L867 -> 88 | O867: 19 | P867: 14 | Q867: =O867*6+P867 -> 128 | S867: TOORAK PARK
A868: WAVERLEY | C868: 2 | D868: 2 | E868: =C868*6+D868 -> 14 | G868: 9 | H868: 3 | I868: =G868*6+H868 -> 57 | K868: 11 | L868: 7 | M868: =K868*6+L868 -> 73 | O868: 14 | P868: 9 | Q868: =O868*6+P868 -> 93 | S868: MARKS
A869: BEST PLAYERS
A870: CAULFIELD | C870: CLIFF | F870: JEWELL | I870: WHITE | L870: TULLOCH | O870: GOWANS | R870: GUINANE
A871: WAVERLEY | C871: McNAMEE | F871: HANCOCK | I871: SYKES | L871: MILES | O871: SMEDTZ | R871: B ALLAN
A872: GOALKICKERS
A873: CAULFIELD | C873: GUINANE 5 | F873: CLIFF 4 | H873: BAKER 4 | J873: GOWANS 2 | M873: ARRELL | O873: LOGAN | Q873: HOCKING | S873: BROWN
A874: WAVERLEY | C874: COSTELLO 3 | F874: HANCOCK 2 | I874: OSBORNE 2 | K874: GOODWIN 2 | N874: SYKES | P874: HORKINGS | R874: R ALLAN | T874: McNAMEE | W874: HARRY
A876: PRELIMINARY | E876: 2ND SEPTEMBER | J876: WEATHER
A877: BRUNSWICK | C877: 6 | D877: 3 | E877: =C877*6+D877 -> 39 | G877: 6 | H877: 10 | I877: =G877*6+H877 -> 46 | K877: 12 | L877: 15 | M877: =K877*6+L877 -> 87 | O877: 17 | P877: 18 | Q877: =O877*6+P877 -> 120 | S877: TOORAK PARK
A878: WAVERLEY | C878: 6 | D878: 3 | E878: =C878*6+D878 -> 39 | G878: 10 | H878: 5 | I878: =G878*6+H878 -> 65 | K878: 13 | L878: 7 | M878: =K878*6+L878 -> 85 | O878: 14 | P878: 7 | Q878: =O878*6+P878 -> 91 | S878: McBAIN
A879: BEST PLAYERS
A880: BRUNSWICK | C880: HANTON | F880: HOBBS | I880: O'BRIEN | L880: SKIDMORE | O880: HORSINGTON | R880: DIMMATINA
A881: WAVERLEY | C881: STONE | F881: HANCOCK | I881: McNAMEE | L881: MOORE | O881: COSTELLO | R881: PETZKE
A882: GOALKICKERS
A883: BRUNSWICK | C883: HANTON 6 | F883: HOBBS 3 | H883: BAIRD 3 | J883: ALLEN | L883: HORSINGTON | O883: WROUT | Q883: DIMMATINA | T883: DENMEAD
A884: WAVERLEY | C884: IVEY 4 | E884: R ALLAN 3 | H884: LUMLEY 2 | J884: HANCOCK 2 | M884: COSTELLO | P884: PARKS | R884: GILLESPIE
A886: GRAND | E886: 9TH SEPTEMBER | J886: WEATHER
A887: CAULFIELD | C887: 4 | D887: 4 | E887: =C887*6+D887 -> 28 | G887: 10 | H887: 6 | I887: =G887*6+H887 -> 66 | K887: 12 | L887: 10 | M887: =K887*6+L887 -> 82 | O887: 18 | P887: 20 | Q887: =O887*6+P887 -> 128 | S887: TOORAK PARK
A888: BRUNSWICK | C888: 4 | D888: 11 | E888: =C888*6+D888 -> 35 | G888: 6 | H888: 13 | I888: =G888*6+H888 -> 49 | K888: 10 | L888: 21 | M888: =K888*6+L888 -> 81 | O888: 14 | P888: 22 | Q888: =O888*6+P888 -> 106 | S888: GAMBETTA
A889: BEST PLAYERS
A890: CAULFIELD | C890: WHITE | F890: LOGAN | I890: CLIFF | L890: JEWELL | O890: GLAZNER | R890: HOCKING
A891: BRUNSWICK | C891: HADZILLIAS | F891: McCABE | I891: ALLEN | L891: DIMMATINA | O891: HANTON | R891: MILLER
A892: GOALKICKERS
A893: CAULFIELD | C893: LOGAN 6 | F893: HOCKING 4 | I893: JEWELL 3 | K893: BAKER | M893: GUINANE
A894: BRUNSWICK | C894: HADZILLIAS 3 | F894: DIMMATINA 2 | I894: ALLEN 2 | K894: HOBBS 2 | M894: HANTON | O894: LIAKOUREAS | R894: GUTTERSON | U894: EGAN | W894: BAIRD