A1: Victorian Football Association
A2: Season 1973 - Division One
A3: © Copyright Wal Williams | F3: First created: 28 July 2015
A4: Contact: joywalwi at gmail dot com | F4: Last updated: 28 July 2015 | W4: VFA Results and tables - Link to the main index page
A5: You are free to copy this document in whole or part provided that proper acknowledgement is given to the author. All rights reserved.
A7: 1973 SEASON 1ST DIVISION | CA7: \D | CB7: {GOTO}BJ3~/M{RIGHT 7}{END}{DOWN}~G4~
A8: ROUND 1 | E8: 22ND APRIL | J8: WEATHER | N8: NORTH WEST WIND | S8: PLAYED AT | CB8: {GOTO}AL3~/M{END}{RIGHT}{END}{DOWN}~P3~
D9: 1ST QTR | H9: 2ND QTR | L9: 3RD QTR | P9: FINAL | S9: GEELONG WEST | CB9: {GOTO}BJ23~/M{RIGHT 7}{END}{DOWN}~V4~
A10: DANDENONG | C10: 3 | D10: 3 | E10: =C10*6+D10 -> 21 | G10: 4 | H10: 6 | I10: =G10*6+H10 -> 30 | K10: 9 | L10: 8 | M10: =K10*6+L10 -> 62 | O10: 14 | P10: 13 | Q10: =O10*6+P10 -> 97 | S10: UMPIRE | X10: LADDER | AB10: ROUND | AD10: 1 | CB10: {GOTO}BJ43~/M{RIGHT 7}{END}{DOWN}~G24~
A11: GEELONG WEST | C11: 3 | D11: 4 | E11: =C11*6+D11 -> 22 | G11: 5 | H11: 7 | I11: =G11*6+H11 -> 37 | K11: 7 | L11: 8 | M11: =K11*6+L11 -> 50 | O11: 13 | P11: 14 | Q11: =O11*6+P11 -> 92 | S11: HAYES | CB11: {GOTO}AL23~/M{END}{RIGHT}{END}{DOWN}~P23~
A12: BEST PLAYERS | W12: TEAM | X12: W | Y12: L | Z12: D | AA12: FOR | AB12: AGST | AC12: % | AD12: PTS | CB12: {GOTO}BJ63~/M{RIGHT 7}{END}{DOWN}~V24~
A13: DANDENONG | D13: FLAHERTY | G13: HIBBERT | J13: ORCHARD | M13: K SHINNERS | P13: WOODS | R13: ESLER | CB13: {GOTO}BJ83~/M{RIGHT 7}{END}{DOWN}~G44~
A14: GEELONG WEST | D14: DEEATH | G14: K J TAYLOR | J14: GOGGIN | M14: HALL | P14: SMITH | R14: KEANE | W14: PRESTON | X14: 1 | Y14: 0 | Z14: 0 | AA14: 180 | AB14: 75 | AC14: 240 | AD14: 4 | CB14: {GOTO}AL43~/M{END}{RIGHT}{END}{DOWN}~P43~
A15: GOALKICKERS | W15: PRAHRAN | X15: 1 | Y15: 0 | Z15: 0 | AA15: 143 | AB15: 99 | AC15: 144.44444444444446 | AD15: 4 | CB15: {GOTO}BJ103~/M{RIGHT 7}{END}{DOWN}~V44~
A16: DANDENONG | D16: FLAHERTY 6 | G16: REID 4 | I16: HIBBERT 2 | L16: BROWN | N16: K SHINNERS | W16: PORT MELBOURNE | X16: 1 | Y16: 0 | Z16: 0 | AA16: 143 | AB16: 121 | AC16: 118.18181818181819 | AD16: 4 | CB16: {GOTO}BJ123~/M{RIGHT 7}{END}{DOWN}~G64~
A17: GEELONG WEST | D17: McLEAN 4 | G17: K J TAYLOR 3 | J17: LINKE 2 | L17: MANSON | N17: M BROWNE | Q17: HARRIS | S17: DEEATH | W17: OAKLEIGH | X17: 1 | Y17: 0 | Z17: 0 | AA17: 103 | AB17: 88 | AC17: 117.04545454545455 | AD17: 4 | CB17: {GOTO}AL63~/M{END}{RIGHT}{END}{DOWN}~P63~
CB18: {GOTO}BJ143~/M{RIGHT 7}{END}{DOWN}~V64~
A19: PRAHRAN | C19: 2 | D19: 5 | E19: =C19*6+D19 -> 17 | G19: 7 | H19: 9 | I19: =G19*6+H19 -> 51 | K19: 12 | L19: 15 | M19: =K19*6+L19 -> 87 | O19: 21 | P19: 17 | Q19: =O19*6+P19 -> 143 | S19: TOORAK PARK | W19: DANDENONG | X19: 1 | Y19: 0 | Z19: 0 | AA19: 97 | AB19: 92 | AC19: 105.43478260869566 | AD19: 4 | CB19: {GOTO}BJ163~/M{RIGHT 7}{END}{DOWN}~G84~
A20: SUNSHINE | C20: 6 | D20: 4 | E20: =C20*6+D20 -> 40 | G20: 8 | H20: 8 | I20: =G20*6+H20 -> 56 | K20: 12 | L20: 11 | M20: =K20*6+L20 -> 83 | O20: 14 | P20: 15 | Q20: =O20*6+P20 -> 99 | S20: McBEAN | W20: GEELONG WEST | X20: 0 | Y20: 1 | Z20: 0 | AA20: 92 | AB20: 97 | AC20: 94.845360824742272 | AD20: 0 | CB20: {GOTO}AL83~/M{END}{RIGHT}{END}{DOWN}~P83~
A21: BEST PLAYERS | W21: WILLIAMSTOWN | X21: 0 | Y21: 1 | Z21: 0 | AA21: 88 | AB21: 103 | AC21: 85.4368932038835 | AD21: 0 | CB21: {GOTO}BJ183~/M{RIGHT 7}{END}{DOWN}~V84~
A22: PRAHRAN | D22: EMSELLE | G22: GRANGE | J22: SINCLAIR | M22: CLARKE | O22: TOWNSEND | R22: SMITH | W22: COBURG | X22: 0 | Y22: 1 | Z22: 0 | AA22: 121 | AB22: 143 | AC22: 84.615384615384613 | AD22: 0 | CB22: {GOTO}BJ203~/M{RIGHT 7}{END}{DOWN}~G104~
A23: SUNSHINE | D23: LLOYD | G23: L CRAWFORD | J23: R CRAWFORD | M23: GLAVICI | O23: MCKENZIE | R23: WAGLAND | W23: SUNSHINE | X23: 0 | Y23: 1 | Z23: 0 | AA23: 99 | AB23: 143 | AC23: 69.230769230769226 | AD23: 0 | CB23: {GOTO}AL103~/M{END}{RIGHT}{END}{DOWN}~P103~
A24: GOALKICKERS | O24: SINCLAIR | R24: AUSTIN | W24: SANDRINGHAM | X24: 0 | Y24: 1 | Z24: 0 | AA24: 75 | AB24: 180 | AC24: 41.666666666666664 | AD24: 0 | CB24: {GOTO}BJ223~/M{RIGHT 7}{END}{DOWN}~V104~
A25: PRAHRAN | D25: CLARKE 5 | F25: SMITH 4 | H25: APPLETON 3 | K25: McFARLANE 2 | N25: TOWNSEND 2 | Q25: BARTLETT 2 | T25: LANGDON | CB25: {GOTO}BJ243~/M{RIGHT 7}{END}{DOWN}~G124~
A26: SUNSHINE | D26: R CRAWFORD 5 | H26: RUSSELL 4 | J26: GLAVICI 2 | M26: LLOYD | O26: McKENZIE | R26: WAGLAND | CB26: {GOTO}AL123~/M{END}{RIGHT}{END}{DOWN}~P123~
CB27: {GOTO}BJ263~/M{RIGHT 7}{END}{DOWN}~V124~
A28: PORT MELBOURNE | C28: 8 | D28: 4 | E28: =C28*6+D28 -> 52 | G28: 11 | H28: 7 | I28: =G28*6+H28 -> 73 | K28: 19 | L28: 13 | M28: =K28*6+L28 -> 127 | O28: 21 | P28: 17 | Q28: =O28*6+P28 -> 143 | S28: PORT MELBOURNE | CB28: {GOTO}BJ283~/M{RIGHT 7}{END}{DOWN}~G144~
A29: COBURG | C29: 5 | D29: 2 | E29: =C29*6+D29 -> 32 | G29: 10 | H29: 5 | I29: =G29*6+H29 -> 65 | K29: 14 | L29: 9 | M29: =K29*6+L29 -> 93 | O29: 18 | P29: 13 | Q29: =O29*6+P29 -> 121 | S29: GAMBETTA | CB29: {GOTO}AL143~/M{END}{RIGHT}{END}{DOWN}~P143~
A30: BEST PLAYERS | CB30: {GOTO}BJ303~/M{RIGHT 7}{END}{DOWN}~V144~
A31: PORT MELBOURNE | D31: HARLAND | G31: HOLT | J31: HUGHES | M31: COLLINS | P31: ALLEN | S31: PROFFIT | CB31: {GOTO}BJ323~/M{RIGHT 7}{END}{DOWN}~G164~
A32: COBURG | D32: McGRATH | G32: MANNIX | J32: MORRISON | M32: ERWIN | P32: BROWN | S32: MARSH | CB32: {GOTO}AL163~/M{END}{RIGHT}{END}{DOWN}~P163~
A33: GOALKICKERS | CB33: {GOTO}BJ343~/M{RIGHT 7}{END}{DOWN}~V164~
A34: PORT MELBOURNE | D34: COOK 4 | F34: HOLT 3 | H34: ANDERSON 3 | K34: O'BRIEN 3 | M34: RHEINBERGER 2 | P34: PROFFIT 2 | R34: BEHAN | T34: HARLAND | W34: SWINSTEAD | CB34: {HOME}
A35: COBURG | D35: McGRATH 7 | G35: FARMER 4 | J35: MORRISON 4 | M35: BRENNAN 2 | P35: BROWN
A37: OAKLEIGH | C37: 5 | D37: 6 | E37: =C37*6+D37 -> 36 | G37: 6 | H37: 10 | I37: =G37*6+H37 -> 46 | K37: 11 | L37: 15 | M37: =K37*6+L37 -> 81 | O37: 14 | P37: 19 | Q37: =O37*6+P37 -> 103 | S37: WILLIAMSTOWN
A38: WILLIAMSTOWN | C38: 1 | D38: 1 | E38: =C38*6+D38 -> 7 | G38: 6 | H38: 7 | I38: =G38*6+H38 -> 43 | K38: 7 | L38: 10 | M38: =K38*6+L38 -> 52 | O38: 12 | P38: 16 | Q38: =O38*6+P38 -> 88 | S38: STIRLING
A39: BEST PLAYERS
A40: OAKLEIGH | D40: FORD | G40: MURNANE | J40: FRYER | M40: P LILLEY | P40: STEWART | S40: FORSTER
A41: WILLIAMSTOWN | D41: FANNING | G41: JARRARD | J41: COLLINS | M41: THOMPSON | P41: PERCY | S41: L STILLMAN
A42: GOALKICKERS
A43: OAKLEIGH | D43: CARR 5 | G43: FORD 3 | I43: WENN | K43: O'KANE | M43: ROBBINS | O43: HALLIDAY
A44: WILLIAMSTOWN | D44: FANNING 3 | G44: MULLIGAN 3 | J44: BOXALL | L44: PATTERSON | O44: JARRARD | Q44: BROWN | S44: GROVES | U44: L STILLMAN
A46: PRESTON | C46: 5 | D46: 3 | E46: =C46*6+D46 -> 33 | G46: 11 | H46: 10 | I46: =G46*6+H46 -> 76 | K46: 20 | L46: 13 | M46: =K46*6+L46 -> 133 | O46: 27 | P46: 18 | Q46: =O46*6+P46 -> 180 | S46: PRESTON
A47: SANDRINGHAM | C47: 2 | D47: 5 | E47: =C47*6+D47 -> 17 | G47: 3 | H47: 7 | I47: =G47*6+H47 -> 25 | K47: 7 | L47: 11 | M47: =K47*6+L47 -> 53 | O47: 10 | P47: 15 | Q47: =O47*6+P47 -> 75 | S47: ABBOTT
A48: BEST PLAYERS
A49: PRESTON | D49: McGAW | G49: WEIGHTMAN | J49: CLARK | M49: ZUNNEBERG | P49: COBAIN | R49: MORRIS
A50: SANDRINGHAM | D50: NICHOLSON | G50: EVANS | J50: WILLS | M50: SPURRELL | P50: KENNEDY | R50: BROWNE
A51: GOALKICKERS
A52: PRESTON | D52: CLARK 11 | G52: ZUNNEBERG 4 | J52: ASHMEAD 4 | M52: SMITH 3 | O52: WEIGHTMAN 2 | R52: MARKS 2 | U52: McGAW
A53: SANDRINGHAM | D53: DARE 2 | G53: SCHOLES 2 | J53: NICHOLSON 2 | M53: I COOPER 2 | P53: ZEUSCHNER | S53: EVANS
A55: ROUND 2 | E55: 29TH APRIL | J55: WEATHER | N55: NORTH WEST WIND | S55: PLAYED AT
D56: 1ST QTR | H56: 2ND QTR | L56: 3RD QTR | P56: FINAL | S56: OAKLEIGH
A57: OAKLEIGH | C57: 1 | D57: 6 | E57: =C57*6+D57 -> 12 | G57: 4 | H57: 9 | I57: =G57*6+H57 -> 33 | K57: 8 | L57: 12 | M57: =K57*6+L57 -> 60 | O57: 10 | P57: 13 | Q57: =O57*6+P57 -> 73 | S57: UMPIRE | X57: LADDER | AB57: ROUND | AD57: 2
A58: PORT MELBOURNE | C58: 1 | D58: 4 | E58: =C58*6+D58 -> 10 | G58: 4 | H58: 12 | I58: =G58*6+H58 -> 36 | K58: 6 | L58: 15 | M58: =K58*6+L58 -> 51 | O58: 8 | P58: 19 | Q58: =O58*6+P58 -> 67 | S58: HAYES
A59: BEST PLAYERS | W59: TEAM | X59: W | Y59: L | Z59: D | AA59: FOR | AB59: AGST | AC59: % | AD59: PTS
A60: OAKLEIGH | C60: TAYLOR | F60: FORD | I60: LILLEY | K60: WENN | N60: MURNANE | Q60: COLCOTT
A61: PORT MELBOURNE | C61: MALLETT | F61: SWINSTEAD | I61: COOK | K61: HARLAND | N61: HOLT | Q61: FRENCH | W61: OAKLEIGH | X61: 2 | Y61: 0 | Z61: 0 | AA61: 176 | AB61: 155 | AC61: 113.54838709677419 | AD61: 8
A62: GOALKICKERS | W62: DANDENONG | X62: 2 | Y62: 0 | Z62: 0 | AA62: 219 | AB62: 195 | AC62: 112.30769230769231 | AD62: 8
A63: OAKLEIGH | C63: COLCOTT 4 | F63: BILLING 2 | I63: MURNANE 2 | L63: WENN | N63: CARR | W63: PRAHRAN | X63: 1 | Y63: 0 | Z63: 1 | AA63: 274 | AB63: 230 | AC63: 119.1304347826087 | AD63: 6
A64: PORT MELBOURNE | C64: HOLT 3 | F64: BUCKLEY 2 | I64: HARLAND 2 | L64: HUGHES | W64: PRESTON | X64: 1 | Y64: 1 | Z64: 0 | AA64: 283 | AB64: 197 | AC64: 143.65482233502539 | AD64: 4
A66: DANDENONG | C66: 1 | D66: 3 | E66: =C66*6+D66 -> 9 | G66: 7 | H66: 13 | I66: =G66*6+H66 -> 55 | K66: 9 | L66: 15 | M66: =K66*6+L66 -> 69 | O66: 17 | P66: 20 | Q66: =O66*6+P66 -> 122 | S66: DANDENONG | W66: GEELONG WEST | X66: 1 | Y66: 1 | Z66: 0 | AA66: 210 | AB66: 177 | AC66: 118.64406779661017 | AD66: 4
A67: PRESTON | C67: 5 | D67: 10 | E67: =C67*6+D67 -> 40 | G67: 9 | H67: 10 | I67: =G67*6+H67 -> 64 | K67: 13 | L67: 14 | M67: =K67*6+L67 -> 92 | O67: 14 | P67: 19 | Q67: =O67*6+P67 -> 103 | S67: TORNEY | W67: PORT MELBOURNE | X67: 1 | Y67: 1 | Z67: 0 | AA67: 210 | AB67: 194 | AC67: 108.24742268041237 | AD67: 4
A68: BEST PLAYERS | W68: SANDRINGHAM | X68: 1 | Y68: 1 | Z68: 0 | AA68: 173 | AB68: 272 | AC68: 63.602941176470587 | AD68: 4
A69: DANDENONG | C69: FLAHERTY | F69: HIBBERT | I69: DAVIES | L69: DARLEY | O69: BROWN | R69: BECK | W69: COBURG | X69: 0 | Y69: 1 | Z69: 1 | AA69: 252 | AB69: 274 | AC69: 91.970802919708035 | AD69: 2
A70: PRESTON | C70: ASHMEAD | F70: McGAW | I70: ZUNNEBERG | L70: LESLIE | O70: MIDDLETON | R70: HALL | W70: WILLIAMSTOWN | X70: 0 | Y70: 2 | Z70: 0 | AA70: 180 | AB70: 201 | AC70: 89.552238805970148 | AD70: 0
A71: GOALKICKERS | T71: ESLER | W71: SUNSHINE | X71: 0 | Y71: 2 | Z71: 0 | AA71: 179 | AB71: 261 | AC71: 68.582375478927204 | AD71: 0
A72: DANDENONG | C72: HIBBERT 4 | F72: ELLIS 3 | H72: FLAHERTY 3 | K72: BROWN 2 | M72: ORCHARD | O72: B SHINNERS | R72: REID | T72: K SHINNERS
A73: PRESTON | C73: CLARK 4 | E73: SMITH 3 | G73: MARKS 2 | I73: ASHMEAD | K73: ZUNNENBERG | N73: WEIGHTMAN | Q73: MIDDLETON | T73: COBAIN
A75: GEELONG WEST | C75: 3 | D75: 4 | E75: =C75*6+D75 -> 22 | G75: 9 | H75: 11 | I75: =G75*6+H75 -> 65 | K75: 13 | L75: 12 | M75: =K75*6+L75 -> 90 | O75: 17 | P75: 16 | Q75: =O75*6+P75 -> 118 | S75: SUNSHINE
A76: SUNSHINE | C76: 5 | D76: 6 | E76: =C76*6+D76 -> 36 | G76: 6 | H76: 7 | I76: =G76*6+H76 -> 43 | K76: 8 | L76: 9 | M76: =K76*6+L76 -> 57 | O76: 11 | P76: 14 | Q76: =O76*6+P76 -> 80 | S76: CHINN
A77: BEST PLAYERS
A78: GEELONG WEST | C78: MANSON | F78: McLEAN | I78: HALL | L78: KEANE | O78: R BROWNE | R78: K J TAYLOR
A79: SUNSHINE | C79: WOODS | F79: WAGLAND | I79: GLAVICI | L79: LLOYD | O79: L THOMAS | R79: TOULMIN
A80: GOALKICKERS
A81: GEELONG WEST | C81: McLEAN 7 | F81: MANSON 3 | I81: K J TAYLOR 2 | L81: KEANE 2 | N81: HARRIS | P81: DEEATH | R81: GOGGIN
A82: SUNSHINE | C82: R CRAWFORD 2 | F82: LLOYD 2 | I82: McKENZIE 2 | L82: GLAVICI | N82: SLADDIN | P82: WAGLAND | R82: RUSSELL | T82: L CRAWFORD
A84: SANDRINGHAM | C84: 3 | D84: 11 | E84: =C84*6+D84 -> 29 | G84: 6 | H84: 13 | I84: =G84*6+H84 -> 49 | K84: 10 | L84: 19 | M84: =K84*6+L84 -> 79 | O84: 13 | P84: 20 | Q84: =O84*6+P84 -> 98 | S84: BEACH ROAD
A85: WILLIAMSTOWN | C85: 1 | D85: 2 | E85: =C85*6+D85 -> 8 | G85: 4 | H85: 4 | I85: =G85*6+H85 -> 28 | K85: 8 | L85: 7 | M85: =K85*6+L85 -> 55 | O85: 13 | P85: 14 | Q85: =O85*6+P85 -> 92 | S85: FLANAGAN
A86: BEST PLAYERS
A87: SANDRINGHAM | C87: TEMPLETON | F87: EVANS | I87: EDWARDS | L87: KENNEDY | O87: I COOPER | R87: C COOPER
A88: WILLIAMSTOWN | C88: LAWERSON | F88: L STILLMAN | I88: FANNING | L88: THOMPSON | O88: PERCY | R88: BOXALL
A89: GOALKICKERS
A90: SANDRINGHAM | C90: I COOPER 7 | F90: EDWARDS 2 | I90: GRANT | K90: STEVENS | M90: NICHOLSON | P90: EVANS
A91: WILLIAMSTOWN | C91: L STILLMAN 3 | F91: COLLINS 3 | I91: PATTERSON 2 | L91: RADZIMINSKI 2 | P91: JARRARD | R91: BESTER | T91: GROVES
A93: COBURG | C93: 4 | D93: 5 | E93: =C93*6+D93 -> 29 | G93: 11 | H93: 10 | I93: =G93*6+H93 -> 76 | K93: 14 | L93: 15 | M93: =K93*6+L93 -> 99 | O93: 19 | P93: 17 | Q93: =O93*6+P93 -> 131 | S93: TOORAK PARK
A94: PRAHRAN | C94: 4 | D94: 5 | E94: =C94*6+D94 -> 29 | G94: 9 | H94: 6 | I94: =G94*6+H94 -> 60 | K94: 13 | L94: 14 | M94: =K94*6+L94 -> 92 | O94: 19 | P94: 17 | Q94: =O94*6+P94 -> 131 | S94: MARKS
A95: BEST PLAYERS
A96: COBURG | C96: P McCARTHY | F96: KIRKMAN | I96: MCGRATH | L96: HOBBS | O96: STARBUCK | R96: ERWIN
A97: PRAHRAN | C97: EMSELLE | F97: BARTLETT | I97: SINCLAIR | L97: TOWNSEND | O97: APPLETON | R97: CLARKE
A98: GOALKICKERS
A99: COBURG | C99: McGRATH 4 | F99: MARSH 3 | I99: MANNIX 3 | L99: HOBBS 2 | N99: MORRISON 2 | Q99: BROWN 2 | S99: BRENNAN | V99: MITCHELL
A100: PRAHRAN | C100: CLARKE 4 | F100: SMITH 4 | I100: BARTLETT 2 | L100: EMSELLE 2 | N100: SINCLAIR 2 | Q100: APPLETON | S100: HUGHAN | V100: ROSE | X100: PAYNE | Z100: TUCKWELL
A102: ROUND 3 | E102: 6TH MAY | J102: WEATHER | N102: NORTH WEST WIND | S102: PLAYED AT
D103: 1ST QTR | H103: 2ND QTR | L103: 3RD QTR | P103: FINAL | S103: DANDENONG
A104: OAKLEIGH | C104: 5 | D104: 1 | E104: =C104*6+D104 -> 31 | G104: 7 | H104: 5 | I104: =G104*6+H104 -> 47 | K104: 8 | L104: 8 | M104: =K104*6+L104 -> 56 | O104: 13 | P104: 15 | Q104: =O104*6+P104 -> 93 | S104: UMPIRE | X104: LADDER | AB104: ROUND | AD104: 3
A105: DANDENONG | C105: 2 | D105: 3 | E105: =C105*6+D105 -> 15 | G105: 4 | H105: 5 | I105: =G105*6+H105 -> 29 | K105: 11 | L105: 8 | M105: =K105*6+L105 -> 74 | O105: 13 | P105: 8 | Q105: =O105*6+P105 -> 86 | S105: McBAIN
A106: BEST PLAYERS | W106: TEAM | X106: W | Y106: L | Z106: D | AA106: FOR | AB106: AGST | AC106: % | AD106: PTS
A107: OAKLEIGH | C107: J LILLEY | F107: WENN | I107: TAYLOR | L107: P LILLEY | O107: QUINN | R107: MURNANE
A108: DANDENONG | C108: ESLER | F108: ELLIS | I108: DARLEY | L108: K SHINNERS | O108: HIBBERT | R108: WALKER | W108: OAKLEIGH | X108: 3 | Y108: 0 | Z108: 0 | AA108: 269 | AB108: 241 | AC108: 111.61825726141079 | AD108: 12
A109: GOALKICKERS | W109: PRAHRAN | X109: 2 | Y109: 0 | Z109: 1 | AA109: 358 | AB109: 297 | AC109: 120.53872053872054 | AD109: 10
A110: OAKLEIGH | C110: MURNANE 4 | F110: WENN 3 | I110: ROBBINS 2 | L110: CLOKE | N110: TAYLOR | P110: CARR | R110: COLCOTT | W110: GEELONG WEST | X110: 2 | Y110: 1 | Z110: 0 | AA110: 391 | AB110: 299 | AC110: 130.76923076923077 | AD110: 8
A111: DANDENONG | C111: ELLIS 5 | E111: MILLER 2 | H111: HIBBERT | J111: B SHINNERS | M111: DAVIES | O111: BROWN | Q111: KENDALL | S111: FLAHERTY | W111: PORT MELBOURNE | X111: 2 | Y111: 1 | Z111: 0 | AA111: 324 | AB111: 279 | AC111: 116.12903225806451 | AD111: 8
A113: PORT MELBOURNE | C113: 3 | D113: 2 | E113: =C113*6+D113 -> 20 | G113: 7 | H113: 7 | I113: =G113*6+H113 -> 49 | K113: 8 | L113: 11 | M113: =K113*6+L113 -> 59 | O113: 16 | P113: 18 | Q113: =O113*6+P113 -> 114 | S113: PORT MELBOURNE | W113: DANDENONG | X113: 2 | Y113: 1 | Z113: 0 | AA113: 305 | AB113: 288 | AC113: 105.90277777777777 | AD113: 8
A114: PRESTON | C114: 3 | D114: 6 | E114: =C114*6+D114 -> 24 | G114: 7 | H114: 9 | I114: =G114*6+H114 -> 51 | K114: 11 | L114: 11 | M114: =K114*6+L114 -> 77 | O114: 12 | P114: 13 | Q114: =O114*6+P114 -> 85 | S114: MARKS | W114: PRESTON | X114: 1 | Y114: 2 | Z114: 0 | AA114: 368 | AB114: 311 | AC114: 118.32797427652733 | AD114: 4
A115: BEST PLAYERS | W115: SUNSHINE | X115: 1 | Y115: 2 | Z115: 0 | AA115: 263 | AB115: 342 | AC115: 76.900584795321635 | AD115: 4
A116: PORT MELBOURNE | D116: MALLETT | G116: ALLEN | I116: PROFFIT | L116: BUCKLEY | N116: RHEINBERGER | Q116: SWINSTEAD | W116: SANDRINGHAM | X116: 1 | Y116: 2 | Z116: 0 | AA116: 295 | AB116: 453 | AC116: 65.12141280353201 | AD116: 4
A117: PRESTON | D117: SHAW | G117: MARKS | I117: ASHMEAD | L117: MARTIN | N117: LESLIE | Q117: WEIGHTMAN | W117: COBURG | X117: 0 | Y117: 2 | Z117: 1 | AA117: 333 | AB117: 358 | AC117: 93.016759776536318 | AD117: 2
A118: GOALKICKERS | M118: BUCKLEY | O118: PROFFIT | Q118: HARLAND | S118: FRENCH | W118: WILLIAMSTOWN | X118: 0 | Y118: 3 | Z118: 0 | AA118: 247 | AB118: 285 | AC118: 86.666666666666671 | AD118: 0
A119: PORT MELBOURNE | D119: PASQUILL 2 | G119: CHAMBERLAIN 2 | J119: SWINSTEAD 2 | M119: HOLT 2 | O119: ALLEN | Q119: COOK | R119: ANDERSON | U119: JENSEN
A120: PRESTON | D120: MARKS 3 | G120: SMITH 2 | I120: COBAIN 2 | K120: ASHMEAD | M120: SHAW | O120: ZUNNEBERG | R120: WEIGHTMAN | U120: GRAINGER
A122: GEELONG WEST | C122: 10 | D122: 6 | E122: =C122*6+D122 -> 66 | G122: 18 | H122: 8 | I122: =G122*6+H122 -> 116 | K122: 23 | L122: 11 | M122: =K122*6+L122 -> 149 | O122: 28 | P122: 13 | Q122: =O122*6+P122 -> 181 | S122: GEELONG WEST
A123: SANDRINGHAM | C123: 3 | D123: 3 | E123: =C123*6+D123 -> 21 | G123: 9 | H123: 7 | I123: =G123*6+H123 -> 61 | K123: 9 | L123: 12 | M123: =K123*6+L123 -> 66 | O123: 18 | P123: 14 | Q123: =O123*6+P123 -> 122 | S123: CARLISLE
A124: BEST PLAYERS
A125: GEELONG WEST | D125: R BROWNE | G125: HARRIS | J125: HALL | M125: McLEAN | P125: KEANE | S125: M BROWNE
A126: SANDRINGHAM | D126: SCHOLES | G126: WILLS | J126: BROWNE | M126: KENNEDY | P126: SPURRELL | S126: NICHOLSPN
A127: GOALKICKERS
A128: GEELONG WEST | D128: McLEAN 8 | G128: HARRIS 4 | I128: GIDDINGS 4 | L128: R BROWNE 4 | O128: K TAYLOR 4 | R128: KEANE 3 | U128: M BROWNE
A129: SANDRINGHAM | D129: I COOPER 5 | G129: SCHOLES 2 | J129: ZEUSCHNER 2 | M129: GRANT 2 | O129: SAMPSON 2 | R129: BROWNE | U129: WILLS | W129: McNICHOLAS | X129: EDWARDS | AA129: PRIDGEON
A131: SUNSHINE | C131: 4 | D131: 0 | E131: =C131*6+D131 -> 24 | G131: 7 | H131: 3 | I131: =G131*6+H131 -> 45 | K131: 7 | L131: 6 | M131: =K131*6+L131 -> 48 | O131: 13 | P131: 6 | Q131: =O131*6+P131 -> 84 | S131: SUNSHINE
A132: COBURG | C132: 4 | D132: 7 | E132: =C132*6+D132 -> 31 | G132: 5 | H132: 12 | I132: =G132*6+H132 -> 42 | K132: 8 | L132: 14 | M132: =K132*6+L132 -> 62 | O132: 11 | P132: 15 | Q132: =O132*6+P132 -> 81 | S132: TORNEY
A133: BEST PLAYERS
A134: SUNSHINE | D134: WOODS | G134: WAGLAND | J134: VELLA | M134: BENSON | P134: McKENZIE | S134: GLAVICI
A135: COBURG | D135: LAKE | G135: KIRKMAN | J135: S McCARTHY | M135: P McCARTHY | P135: McGRATH | S135: MITCHELL
A136: GOALKICKERS
A137: SUNSHINE | D137: GLAVICI 3 | G137: R CRAWFORD 2 | J137: BENSON 2 | M137: WAGLAND 2 | P137: McINTYRE 2 | S137: LLOYD | U137: RUSSELL
A138: COBURG | D138: BRENNAN 2 | G138: MITCHELL 2 | J138: LAKE 2 | L138: McGRATH 2 | O138: KIRKMAN | Q138: MARSH | S138: MANNIX
A140: PRAHRAN | C140: 4 | D140: 3 | E140: =C140*6+D140 -> 27 | G140: 7 | H140: 8 | I140: =G140*6+H140 -> 50 | K140: 9 | L140: 9 | M140: =K140*6+L140 -> 63 | O140: 11 | P140: 18 | Q140: =O140*6+P140 -> 84 | S140: WILLIAMSTOWN
A141: WILLIAMSTOWN | C141: 6 | D141: 3 | E141: =C141*6+D141 -> 39 | G141: 7 | H141: 5 | I141: =G141*6+H141 -> 47 | K141: 8 | L141: 13 | M141: =K141*6+L141 -> 61 | O141: 9 | P141: 13 | Q141: =O141*6+P141 -> 67 | S141: HAYES
A142: BEST PLAYERS
A143: PRAHRAN | D143: TOWNSEND | G143: CLARKE | J143: SINCLAIR | M143: PAYNE | P143: PIROUET | S143: EMSELLE
A144: WILLIAMSTOWN | D144: L STILLMAN | G144: HANNEBURY | J144: FANNING | M144: COLLINS | P144: LAWERSON | S144: JACKMAN
A145: GOALKICKERS
A146: PRAHRAN | D146: APPLETON 5 | G146: CLARKE 3 | J146: SINCLAIR | M146: SMITH | O146: McFARLANE
A147: WILLIAMSTOWN | D147: RADZIMINSKI 2 | G147: ROACH 2 | I147: WARBURTON | L147: MULLIGAN | O147: JARRARD | Q147: L STILLMAN | T147: JACKMAN
A149: ROUND 4 | E149: 13TH MAY | J149: WEATHER | N149: NORTH WEST WIND | S149: PLAYED AT
D150: 1ST QTR | H150: 2ND QTR | L150: 3RD QTR | P150: FINAL | S150: TOORAK PARK
A151: PORT MELBOURNE | C151: 8 | D151: 5 | E151: =C151*6+D151 -> 53 | G151: 9 | H151: 8 | I151: =G151*6+H151 -> 62 | K151: 16 | L151: 14 | M151: =K151*6+L151 -> 110 | O151: 21 | P151: 17 | Q151: =O151*6+P151 -> 143 | S151: UMPIRE | X151: LADDER | AB151: ROUND | AD151: 4
A152: PRAHRAN | C152: 0 | D152: 3 | E152: =C152*6+D152 -> 3 | G152: 10 | H152: 6 | I152: =G152*6+H152 -> 66 | K152: 16 | L152: 9 | M152: =K152*6+L152 -> 105 | O152: 19 | P152: 12 | Q152: =O152*6+P152 -> 126 | S152: STIRLING
A153: BEST PLAYERS | W153: TEAM | X153: W | Y153: L | Z153: D | AA153: FOR | AB153: AGST | AC153: % | AD153: PTS
A154: PORT MELBOURNE | D154: ANDERSON | G154: M ALLEN | I154: WILLIAMS | L154: MALLETT | O154: COLLINS | R154: BROWN
A155: PRAHRAN | D155: SINCLAIR | G155: PAYNE | I155: TUCKWELL | L155: APPLETON | O155: CULPIN | R155: TOWNSEND | W155: OAKLEIGH | X155: 4 | Y155: 0 | Z155: 0 | AA155: 420 | AB155: 333 | AC155: 126.12612612612612 | AD155: 16
A156: GOALKICKERS | W156: PORT MELBOURNE | X156: 3 | Y156: 1 | Z156: 0 | AA156: 467 | AB156: 405 | AC156: 115.30864197530865 | AD156: 12
A157: PORT MELBOURNE | D157: WILLIAMS 6 | G157: ANDERSON 6 | J157: COOK 4 | L157: FRENCH 2 | N157: PROFFIT | P157: HARLAND | R157: HOLT | W157: DANDENONG | X157: 3 | Y157: 1 | Z157: 0 | AA157: 428 | AB157: 405 | AC157: 105.67901234567901 | AD157: 12
A158: PRAHRAN | D158: TUCKWELL 5 | G158: SINCLAIR 4 | J158: APPLETON 3 | M158: HUGHAN 2 | O158: SMITH 2 | Q158: BARTLETT | S158: CULPIN | W158: PRAHRAN | X158: 2 | Y158: 1 | Z158: 1 | AA158: 484 | AB158: 440 | AC158: 110 | AD158: 10
R159: O'BRIEN
A160: PRESTON | C160: 1 | D160: 3 | E160: =C160*6+D160 -> 9 | G160: 8 | H160: 9 | I160: =G160*6+H160 -> 57 | K160: 12 | L160: 13 | M160: =K160*6+L160 -> 85 | O160: 17 | P160: 22 | Q160: =O160*6+P160 -> 124 | S160: PRESTON | W160: PRESTON | X160: 2 | Y160: 2 | Z160: 0 | AA160: 492 | AB160: 414 | AC160: 118.84057971014492 | AD160: 8
A161: GEELONG WEST | C161: 6 | D161: 1 | E161: =C161*6+D161 -> 37 | G161: 9 | H161: 3 | I161: =G161*6+H161 -> 57 | K161: 13 | L161: 9 | M161: =K161*6+L161 -> 87 | O161: 15 | P161: 13 | Q161: =O161*6+P161 -> 103 | S161: FLANAGAN | W161: GEELONG WEST | X161: 2 | Y161: 2 | Z161: 0 | AA161: 494 | AB161: 423 | AC161: 116.78486997635933 | AD161: 8
A162: BEST PLAYERS | W162: WILLIAMSTOWN | X162: 1 | Y162: 3 | Z162: 0 | AA162: 379 | AB162: 415 | AC162: 91.325301204819283 | AD162: 4
A163: PRESTON | D163: LESLIE | G163: MARKS | J163: SHAW | M163: ZUNNEBERG | P163: MARTIN | R163: HARRIS | W163: SUNSHINE | X163: 1 | Y163: 3 | Z163: 0 | AA163: 355 | AB163: 493 | AC163: 72.00811359026369 | AD163: 4
A164: GEELONG WEST | D164: MANSON | G164: K J TAYLOR | J164: R BROWNE | M164: M BROWNE | P164: LINKE | R164: HARRIS | W164: SANDRINGHAM | X164: 1 | Y164: 3 | Z164: 0 | AA164: 412 | AB164: 576 | AC164: 71.527777777777771 | AD164: 4
A165: GOALKICKERS | P165: CLARK | W165: COBURG | X165: 0 | Y165: 3 | Z165: 1 | AA165: 463 | AB165: 490 | AC165: 94.489795918367349 | AD165: 2
A166: PRESTON | D166: MARKS 5 | G166: ZUNNEBERG 4 | J166: COBAIN 3 | M166: SMITH 2 | P166: ASHMEAD | R166: LE GASSICK
A167: GEELONG WEST | D167: McLEAN 3 | F167: LINKE 2 | H167: MANSON 2 | J167: M BROWNE 2 | M167: HARRIS 2 | O167: GILLIES | Q167: R BROWNE | T167: KEANE | V167: GIDDINGS
A169: WILLIAMSTOWN | C169: 9 | D169: 8 | E169: =C169*6+D169 -> 62 | G169: 11 | H169: 10 | I169: =G169*6+H169 -> 76 | K169: 14 | L169: 12 | M169: =K169*6+L169 -> 96 | O169: 19 | P169: 18 | Q169: =O169*6+P169 -> 132 | S169: COBURG
A170: COBURG | C170: 3 | D170: 2 | E170: =C170*6+D170 -> 20 | G170: 9 | H170: 6 | I170: =G170*6+H170 -> 60 | K170: 14 | L170: 13 | M170: =K170*6+L170 -> 97 | O170: 19 | P170: 16 | Q170: =O170*6+P170 -> 130 | S170: McBAIN
A171: BEST PLAYERS
A172: WILLIAMSTOWN | D172: THOMPSON | G172: L STILLMAN | J172: JACKMAN | M172: RADZIMINSKI | P172: ROACH | R172: GROENEWEGAN
A173: COBURG | D173: LAKE | G173: REILLY | J173: HOBBS | M173: S McCARTHY | P173: MANNIX | R173: P McCARTHY
A174: GOALKICKERS | Q174: THOMPSON | T174: LAWERSON | W174: N STILLMAN
A175: WILLIAMSTOWN | D175: GROENEWEGAN 3 | H175: SHAW 2 | J175: JACKMAN 2 | M175: L STILLMAN 2 | P175: ROACH 2 | R175: BOXALL | T175: HEMLEY | W175: RADZIMISKI | X175: MULLIGAN | AA175: JARRARD | AC175: COLLINS
A176: COBURG | D176: LAKE 4 | F176: McGRATH 3 | I176: S McCARTHY 3 | L176: MITCHELL 2 | O176: BROWN 2 | Q176: BRIDESON | S176: REILLY | U176: MARSH | W176: HOBBS | X176: BRENNAN | AA176: MORRISON
A178: DANDENONG | C178: 1 | D178: 4 | E178: =C178*6+D178 -> 10 | G178: 10 | H178: 7 | I178: =G178*6+H178 -> 67 | K178: 12 | L178: 12 | M178: =K178*6+L178 -> 84 | O178: 18 | P178: 15 | Q178: =O178*6+P178 -> 123 | S178: BEACH ROAD
A179: SANDRINGHAM | C179: 4 | D179: 8 | E179: =C179*6+D179 -> 32 | G179: 6 | H179: 10 | I179: =G179*6+H179 -> 46 | K179: 9 | L179: 16 | M179: =K179*6+L179 -> 70 | O179: 16 | P179: 21 | Q179: =O179*6+P179 -> 117 | S179: GAMBETTA
A180: BEST PLAYERS
A181: DANDENONG | D181: HIBBERT | G181: FLAHERTY | J181: MILLER | M181: WALKER | P181: BECK | R181: ESLER
A182: SANDRINGHAM | D182: EVANS | G182: BROWNE | J182: I COOPER | M182: PRIDGEON | P182: AUBREY | R182: C COOPER
A183: GOALKICKERS
A184: DANDENONG | D184: MILLER 8 | G184: FLAHERTY 3 | J184: BROWN 3 | M184: ORCHARD | O184: HIBBERT | Q184: REID | S184: WALKER
A185: SANDRINGHAM | D185: I COOPER 9 | G185: AUBREY 3 | J185: BROWNE 2 | M185: NICHOLSON | P185: SCHOLES
A187: OAKLEIGH | C187: 4 | D187: 6 | E187: =C187*6+D187 -> 30 | G187: 9 | H187: 9 | I187: =G187*6+H187 -> 63 | K187: 17 | L187: 11 | M187: =K187*6+L187 -> 113 | O187: 22 | P187: 19 | Q187: =O187*6+P187 -> 151 | S187: OAKLEIGH
A188: SUNSHINE | C188: 6 | D188: 1 | E188: =C188*6+D188 -> 37 | G188: 9 | H188: 5 | I188: =G188*6+H188 -> 59 | K188: 10 | L188: 8 | M188: =K188*6+L188 -> 68 | O188: 14 | P188: 8 | Q188: =O188*6+P188 -> 92 | S188: CARLISLE
A189: BEST PLAYERS
A190: OAKLEIGH | D190: P LILLEY | G190: STEPHENS | J190: MURNANE | M190: FORD | P190: J LILLEY | S190: WENN
A191: SUNSHINE | D191: WOODS | G191: NEISH | J191: McKENZIE | M191: BENSON | P191: R CRAWFORD | S191: LLOYD
A192: GOALKICKERS
A193: OAKLEIGH | D193: MURNANE 6 | G193: CARR 5 | I193: ROBBINS 4 | L193: O'KANE 2 | N193: FORD | P193: T QUINN | R193: WENN | T193: TAYLOR | V193: McLEOD
A194: SUNSHINE | D194: R CRAWFORD 4 | G194: LLOYD 4 | I194: BENSON 2 | L194: WAGLAND | N194: RUSSELL | P194: SLADDIN | R194: PAYNE
A196: ROUND 5 | E196: 20TH MAY | J196: WEATHER | N196: FINE | S196: PLAYED AT
D197: 1ST QTR | H197: 2ND QTR | L197: 3RD QTR | P197: FINAL | S197: DANDENONG
A198: DANDENONG | C198: 6 | D198: 4 | E198: =C198*6+D198 -> 40 | G198: 9 | H198: 5 | I198: =G198*6+H198 -> 59 | K198: 17 | L198: 7 | M198: =K198*6+L198 -> 109 | O198: 23 | P198: 13 | Q198: =O198*6+P198 -> 151 | S198: UMPIRE | X198: LADDER | AB198: ROUND | AD198: 5
A199: PORT MELBOURNE | C199: 2 | D199: 3 | E199: =C199*6+D199 -> 15 | G199: 6 | H199: 7 | I199: =G199*6+H199 -> 43 | K199: 8 | L199: 8 | M199: =K199*6+L199 -> 56 | O199: 9 | P199: 10 | Q199: =O199*6+P199 -> 64 | S199: FLANAGAN
A200: BEST PLAYERS | W200: TEAM | X200: W | Y200: L | Z200: D | AA200: FOR | AB200: AGST | AC200: % | AD200: PTS
A201: DANDENONG | C201: QUEAY | F201: HIBBERT | I201: MILLER | L201: FLAHERTY | O201: ESLER | R201: ELLIS
A202: PORT MELBOURNE | C202: ALLEN | F202: BEHAN | I202: PROFFIT | L202: ANDERSON | O202: SWINSTEAD | R202: HARLAND | W202: OAKLEIGH | X202: 5 | Y202: 0 | Z202: 0 | AA202: 587 | AB202: 424 | AC202: 138.4433962264151 | AD202: 20
A203: GOALKICKERS | W203: DANDENONG | X203: 4 | Y203: 1 | Z203: 0 | AA203: 579 | AB203: 469 | AC203: 123.45415778251599 | AD203: 16
A204: DANDENONG | C204: MILLER 10 | F204: FLAHERTY 5 | I204: QUEAY 2 | K204: REID 2 | M204: ELLIS 2 | O204: HIBBERT | Q204: MELAI | W204: GEELONG WEST | X204: 3 | Y204: 2 | Z204: 0 | AA204: 608 | AB204: 517 | AC204: 117.60154738878143 | AD204: 12
A205: PORT MELBOURNE | C205: WILLIAMS 3 | F205: COOK | H205: HARLAND | J205: BESHARA | M205: ANDERSON | O205: HUDSON | Q205: HUGHES | W205: PRESTON | X205: 3 | Y205: 2 | Z205: 0 | AA205: 626 | AB205: 533 | AC205: 117.4484052532833 | AD205: 12
A207: PRESTON | C207: 4 | D207: 5 | E207: =C207*6+D207 -> 29 | G207: 12 | H207: 8 | I207: =G207*6+H207 -> 80 | K207: 16 | L207: 10 | M207: =K207*6+L207 -> 106 | O207: 20 | P207: 14 | Q207: =O207*6+P207 -> 134 | S207: PRESTON | W207: PORT MELBOURNE | X207: 3 | Y207: 2 | Z207: 0 | AA207: 531 | AB207: 556 | AC207: 95.503597122302153 | AD207: 12
A208: PRAHRAN | C208: 4 | D208: 4 | E208: =C208*6+D208 -> 28 | G208: 9 | H208: 6 | I208: =G208*6+H208 -> 60 | K208: 13 | L208: 11 | M208: =K208*6+L208 -> 89 | O208: 17 | P208: 17 | Q208: =O208*6+P208 -> 119 | S208: GAMBETTA | W208: PRAHRAN | X208: 2 | Y208: 2 | Z208: 1 | AA208: 603 | AB208: 574 | AC208: 105.05226480836237 | AD208: 10
A209: BEST PLAYERS | W209: SUNSHINE | X209: 2 | Y209: 3 | Z209: 0 | AA209: 456 | AB209: 587 | AC209: 77.683134582623509 | AD209: 8
A210: PRESTON | C210: CLARK | F210: ZUNNEBERG | I210: MORRIS | L210: LESLIE | O210: SHAW | R210: SLATER | W210: WILLIAMSTOWN | X210: 1 | Y210: 4 | Z210: 0 | AA210: 473 | AB210: 529 | AC210: 89.413988657844996 | AD210: 4
A211: PRAHRAN | C211: O'BRIEN | F211: EMSELLE | I211: TOWNSEND | L211: JOHNSTON | O211: SINCLAIR | R211: PAYNE | W211: SANDRINGHAM | X211: 1 | Y211: 4 | Z211: 0 | AA211: 506 | AB211: 677 | AC211: 74.741506646971942 | AD211: 4
A212: GOALKICKERS | W212: COBURG | X212: 0 | Y212: 4 | Z212: 1 | AA212: 554 | AB212: 657 | AC212: 84.322678843226782 | AD212: 2
A213: PRESTON | C213: CLARK 8 | F213: COBAIN 3 | I213: LE GASSICK 3 | L213: GORDON 2 | N213: ZUNNEBERG 2 | Q213: MARKS | S213: SMITH
A214: PRAHRAN | C214: APPLETON 3 | F214: SINCLAIR 3 | I214: TOWNSEND 3 | L214: WEEKES 3 | N214: McFARLANE 2 | Q214: SMITH | S214: PEACH | U214: WILKIE
A216: GEELONG WEST | C216: 4 | D216: 6 | E216: =C216*6+D216 -> 30 | G216: 8 | H216: 7 | I216: =G216*6+H216 -> 55 | K216: 11 | L216: 9 | M216: =K216*6+L216 -> 75 | O216: 17 | P216: 12 | Q216: =O216*6+P216 -> 114 | S216: GEELONG WEST
A217: WILLIAMSTOWN | C217: 1 | D217: 1 | E217: =C217*6+D217 -> 7 | G217: 8 | H217: 10 | I217: =G217*6+H217 -> 58 | K217: 9 | L217: 14 | M217: =K217*6+L217 -> 68 | O217: 13 | P217: 16 | Q217: =O217*6+P217 -> 94 | S217: TORNEY
A218: BEST PLAYERS
A219: GEELONG WEST | D219: HALL | G219: HARRIS | J219: BARRY | M219: R BROWNE | P219: MANSON | S219: K J TAYLOR
A220: WILLIAMSTOWN | D220: MULLIGAN | G220: L STILLMAN | J220: HEMLEY | M220: WHITTINGTON | P220: HANNEBURY | S220: THOMPSON
A221: GOALKICKERS
A222: GEELONG WEST | D222: McLEAN 6 | G222: HARRIS 4 | I222: LINKE 2 | K222: LYNCH | M222: M BROWNE | P222: MADDEN | R222: GILLIES | T222: FORSTER
A223: WILLIAMSTOWN | D223: L STILLMAN 3 | G223: MULLIGAN 3 | J223: JARRARD 2 | M223: GROENEWEGAN 2 | Q223: WARBURTON | T223: SHAW | W223: WHITTINGTON
A225: SUNSHINE | C225: 1 | D225: 6 | E225: =C225*6+D225 -> 12 | G225: 5 | H225: 7 | I225: =G225*6+H225 -> 37 | K225: 10 | L225: 12 | M225: =K225*6+L225 -> 72 | O225: 14 | P225: 17 | Q225: =O225*6+P225 -> 101 | S225: SUNSHINE
A226: SANDRINGHAM | C226: 3 | D226: 6 | E226: =C226*6+D226 -> 24 | G226: 10 | H226: 12 | I226: =G226*6+H226 -> 72 | K226: 11 | L226: 13 | M226: =K226*6+L226 -> 79 | O226: 13 | P226: 16 | Q226: =O226*6+P226 -> 94 | S226: STIRLING
A227: BEST PLAYERS
A228: SUNSHINE | D228: GOOLD | G228: WOODS | J228: R CRAWFORD | M228: GLAVICI | O228: RUSSELL | R228: L CRAWFORD
A229: SANDRINGHAM | D229: SCHOLES | G229: EVANS | J229: EDWARDS | M229: BROWNE | O229: McCARTHY | R229: AUBREY
A230: GOALKICKERS
A231: SUNSHINE | D231: R CRAWFORD 9 | H231: LLOYD 2 | J231: L CRAWFORD 2 | N231: PAYNE
A232: SANDRINGHAM | D232: SCHOLES 5 | G232: SPIDEN 2 | I232: I COOPER 2 | L232: BROWNE | N232: EVANS | P232: EDWARDS | R232: McCARTHY
A234: OAKLEIGH | C234: 5 | D234: 3 | E234: =C234*6+D234 -> 33 | G234: 10 | H234: 4 | I234: =G234*6+H234 -> 64 | K234: 19 | L234: 14 | M234: =K234*6+L234 -> 128 | O234: 25 | P234: 17 | Q234: =O234*6+P234 -> 167 | S234: COBURG
A235: COBURG | C235: 5 | D235: 3 | E235: =C235*6+D235 -> 33 | G235: 6 | H235: 7 | I235: =G235*6+H235 -> 43 | K235: 7 | L235: 9 | M235: =K235*6+L235 -> 51 | O235: 13 | P235: 13 | Q235: =O235*6+P235 -> 91 | S235: O'BRIEN
A236: BEST PLAYERS
A237: OAKLEIGH | C237: P LILLEY | F237: O'KANE | I237: WENN | L237: ROBBINS | O237: T QUINN | R237: FORD
A238: COBURG | C238: P McCARTHY | F238: ELVERY | I238: BRENNAN | L238: PRICE | O238: MARSH | R238: LAKE
A239: GOALKICKERS
A240: OAKLEIGH | C240: ROBBINS 5 | F240: MURNANE 4 | I240: FORD 3 | K240: T QUINN 3 | M240: CARR 2 | O240: TAYLOR 2 | Q240: COLCOTT 2 | T240: J LILLEY | W240: WENN | X240: O'KANE | Z240: HOWELL
A241: COBURG | C241: McGRATH 2 | F241: MARSH 2 | I241: MORRISON 2 | L241: BRENNAN 2 | O241: LAKE | Q241: REILLY | S241: BROWN | U241: MONTGOMERY
A243: ROUND 6 | E243: 27TH MAY | J243: WEATHER | N243: FINE | S243: PLAYED AT
D244: 1ST QTR | H244: 2ND QTR | L244: 3RD QTR | P244: FINAL | S244: PORT MELBOURNE
A245: PORT MELBOURNE | C245: 2 | D245: 5 | E245: =C245*6+D245 -> 17 | G245: 8 | H245: 11 | I245: =G245*6+H245 -> 59 | K245: 12 | L245: 17 | M245: =K245*6+L245 -> 89 | O245: 16 | P245: 24 | Q245: =O245*6+P245 -> 120 | S245: UMPIRE | X245: LADDER | AB245: ROUND | AD245: 6
A246: GEELONG WEST | C246: 4 | D246: 4 | E246: =C246*6+D246 -> 28 | G246: 6 | H246: 7 | I246: =G246*6+H246 -> 43 | K246: 13 | L246: 14 | M246: =K246*6+L246 -> 92 | O246: 15 | P246: 16 | Q246: =O246*6+P246 -> 106 | S246: McBEAN
A247: BEST PLAYERS | W247: TEAM | X247: W | Y247: L | Z247: D | AA247: FOR | AB247: AGST | AC247: % | AD247: PTS
A248: PORT MELBOURNE | D248: ALLEN | G248: BROWN | I248: SWINSTEAD | L248: FRENCH | O248: MALLETT | Q248: HARLAND
A249: GEELONG WEST | D249: MANSON | G249: SMITH | I249: VAN ELDEN | L249: R BROWNE | O249: HARRIS | Q249: GOGGIN | W249: DANDENONG | X249: 5 | Y249: 1 | Z249: 0 | AA249: 708 | AB249: 572 | AC249: 123.77622377622377 | AD249: 20
A250: GOALKICKERS | P250: BESHARA | R250: ANDERSON | W250: OAKLEIGH | X250: 5 | Y250: 1 | Z250: 0 | AA250: 720 | AB250: 590 | AC250: 122.03389830508475 | AD250: 20
A251: PORT MELBOURNE | D251: SWINSTEAD 4 | G251: COOK 3 | I251: HARLAND 3 | L251: CHAMBERLAIN 2 | P251: FRENCH | R251: COLLINS | W251: PORT MELBOURNE | X251: 4 | Y251: 2 | Z251: 0 | AA251: 651 | AB251: 662 | AC251: 98.338368580060418 | AD251: 16
A252: GEELONG WEST | D252: McLEAN 5 | G252: LINKE 2 | I252: TEAGUE 2 | K252: HARRIS 2 | M252: R BROWNE 2 | P252: GOGGIN | R252: TAYLOR | W252: PRAHRAN | X252: 3 | Y252: 2 | Z252: 1 | AA252: 769 | AB252: 707 | AC252: 108.76944837340876 | AD252: 14
A254: PRAHRAN | C254: 6 | D254: 7 | E254: =C254*6+D254 -> 43 | G254: 15 | H254: 11 | I254: =G254*6+H254 -> 101 | K254: 18 | L254: 15 | M254: =K254*6+L254 -> 123 | O254: 24 | P254: 22 | Q254: =O254*6+P254 -> 166 | S254: TOORAK PARK | W254: GEELONG WEST | X254: 3 | Y254: 3 | Z254: 0 | AA254: 714 | AB254: 637 | AC254: 112.08791208791209 | AD254: 12
A255: OAKLEIGH | C255: 5 | D255: 7 | E255: =C255*6+D255 -> 37 | G255: 9 | H255: 7 | I255: =G255*6+H255 -> 61 | K255: 16 | L255: 12 | M255: =K255*6+L255 -> 108 | O255: 20 | P255: 13 | Q255: =O255*6+P255 -> 133 | S255: MARKS | W255: PRESTON | X255: 3 | Y255: 3 | Z255: 0 | AA255: 756 | AB255: 677 | AC255: 111.66912850812407 | AD255: 12
A256: BEST PLAYERS | W256: WILLIAMSTOWN | X256: 2 | Y256: 4 | Z256: 0 | AA256: 617 | AB256: 659 | AC256: 93.626707132018211 | AD256: 8
A257: PRAHRAN | D257: PAYNE | G257: SINCLAIR | J257: APPLETON | M257: WILKIE | O257: TOWNSEND | R257: EMSELLE | W257: SUNSHINE | X257: 2 | Y257: 4 | Z257: 0 | AA257: 559 | AB257: 716 | AC257: 78.072625698324018 | AD257: 8
A258: OAKLEIGH | D258: FORD | G258: ROBBINS | J258: TAYLOR | M258: FRYER | O258: MURNANE | R258: WENN | W258: COBURG | X258: 1 | Y258: 4 | Z258: 1 | AA258: 666 | AB258: 752 | AC258: 88.563829787234042 | AD258: 6
A259: GOALKICKERS | N259: WEEKES | P259: CULPIN | R259: EMSELLE | W259: SANDRINGHAM | X259: 1 | Y259: 5 | Z259: 0 | AA259: 601 | AB259: 789 | AC259: 76.172370088719902 | AD259: 4
A260: PRAHRAN | D260: SINCLAIR 5 | F260: PAYNE 5 | H260: TOWNSEND 4 | K260: APPLETON 3 | N260: TUCKWELL 2 | Q260: SMITH | S260: PEACH
A261: OAKLEIGH | D261: ROBBINS 4 | G261: CLOKE 4 | I261: MURNANE 3 | L261: FORD 2 | N261: COLCOTT 2 | Q261: O'KANE | S261: TAYLOR | V261: FRYER | X261: HALLIDAY | AA261: HOWELL
A263: COBURG | C263: 4 | D263: 6 | E263: =C263*6+D263 -> 30 | G263: 8 | H263: 12 | I263: =G263*6+H263 -> 60 | K263: 11 | L263: 13 | M263: =K263*6+L263 -> 79 | O263: 15 | P263: 22 | Q263: =O263*6+P263 -> 112 | S263: BEACH ROAD
A264: SANDRINGHAM | C264: 2 | D264: 2 | E264: =C264*6+D264 -> 14 | G264: 5 | H264: 4 | I264: =G264*6+H264 -> 34 | K264: 9 | L264: 8 | M264: =K264*6+L264 -> 62 | O264: 14 | P264: 11 | Q264: =O264*6+P264 -> 95 | S264: CHINN
A265: BEST PLAYERS
A266: COBURG | D266: HOWELL | G266: PRICE | J266: MANNIX | M266: MORRISON | P266: BRENNAN | S266: HOBBS
A267: SANDRINGHAM | D267: EVANS | G267: McNICHOLAS | J267: MURPHY | M267: C COOPER | P267: SCHOLES | S267: BROWNE
A268: GOALKICKERS
A269: COBURG | D269: BRENNAN 3 | G269: MITCHELL 2 | J269: LAKE 2 | L269: McGRATH 2 | O269: MORRISON 2 | R269: PAUL | T269: HOBBS | W269: S McCARTHY | X269: BROWN
A270: SANDRINGHAM | D270: I COOPER 5 | G270: SPURRELL 3 | J270: SHOLES 2 | M270: BROWNE 2 | P270: MURPHY | R270: EDWARDS
A272: WILLIAMSTOWN | C272: 7 | D272: 6 | E272: =C272*6+D272 -> 48 | G272: 13 | H272: 8 | I272: =G272*6+H272 -> 86 | K272: 18 | L272: 14 | M272: =K272*6+L272 -> 122 | O272: 21 | P272: 18 | Q272: =O272*6+P272 -> 144 | S272: WILLIAMSTOWN
A273: PRESTON | C273: 3 | D273: 2 | E273: =C273*6+D273 -> 20 | G273: 6 | H273: 11 | I273: =G273*6+H273 -> 47 | K273: 10 | L273: 14 | M273: =K273*6+L273 -> 74 | O273: 19 | P273: 16 | Q273: =O273*6+P273 -> 130 | S273: CRAIG
A274: BEST PLAYERS
A275: WILLIAMSTOWN | D275: L STILLMAN | G275: MULLIGAN | J275: HEMLEY | M275: WARBURTON | P275: SVORINICH | S275: HANNEBURY
A276: PRESTON | D276: SHAW | G276: MARKS | J276: McGAW | M276: RACOVOLIS | P276: GORDAN | S276: MARTIN
A277: GOALKICKERS
A278: WILLIAMSTOWN | D278: MULLIGAN 5 | G278: L STILLMAN 5 | J278: PATTERSON 3 | M278: GODRIDGE 2 | P278: PERCY 2 | R278: SVORINICH 2 | V278: WARBURTON | X278: HEMLEY | AA278: LAWERSON
A279: PRESTON | D279: RACOVOLIS 5 | G279: CLARK 4 | I279: GORDON 4 | L279: SMITH 3 | N279: McGAW | P279: SHAW | R279: LE GASSICK
A281: DANDENONG | C281: 4 | D281: 4 | E281: =C281*6+D281 -> 28 | G281: 7 | H281: 9 | I281: =G281*6+H281 -> 51 | K281: 13 | L281: 12 | M281: =K281*6+L281 -> 90 | O281: 19 | P281: 15 | Q281: =O281*6+P281 -> 129 | S281: SUNSHINE
A282: SUNSHINE | C282: 3 | D282: 3 | E282: =C282*6+D282 -> 21 | G282: 7 | H282: 5 | I282: =G282*6+H282 -> 47 | K282: 10 | L282: 11 | M282: =K282*6+L282 -> 71 | O282: 14 | P282: 19 | Q282: =O282*6+P282 -> 103 | S282: O'BRIEN
A283: BEST PLAYERS
A284: DANDENONG | D284: HIBBERT | G284: DAVIES | J284: MILLER | M284: BECK | O284: ESLER | Q284: WALKER
A285: SUNSHINE | D285: GLAVICI | G285: CLARKE | J285: L CRAWFORD | M285: WOODS | O285: NEISH | Q285: BENSON
A286: GOALKICKERS
A287: DANDENONG | D287: MILLER 7 | G287: HIBBERT 4 | I287: QUEAY 2 | K287: KENDALL 2 | N287: FLAHERTY | Q287: ELLIS | S287: REID | U287: ROBERTSON
A288: SUNSHINE | D288: R CRAWFORD 3 | H288: GLAVICI 3 | J288: BENSON 2 | M288: LLOYD | O288: SLADDIN | Q288: WAGLAND | S288: RUSSELL | V288: L CRAWFORD | X288: VELLA
A290: ROUND 7 | E290: 3RD JUNE | J290: WEATHER | N290: NORTH WIND | S290: PLAYED AT
D291: 1ST QTR | H291: 2ND QTR | L291: 3RD QTR | P291: FINAL | S291: GEELONG WEST
A292: GEELONG WEST | C292: 7 | D292: 5 | E292: =C292*6+D292 -> 47 | G292: 9 | H292: 9 | I292: =G292*6+H292 -> 63 | K292: 14 | L292: 15 | M292: =K292*6+L292 -> 99 | O292: 18 | P292: 18 | Q292: =O292*6+P292 -> 126 | S292: UMPIRE | X292: LADDER | AB292: ROUND | AD292: 7
A293: PRAHRAN | C293: 3 | D293: 4 | E293: =C293*6+D293 -> 22 | G293: 3 | H293: 7 | I293: =G293*6+H293 -> 25 | K293: 6 | L293: 10 | M293: =K293*6+L293 -> 46 | O293: 10 | P293: 14 | Q293: =O293*6+P293 -> 74 | S293: CHINN
A294: BEST PLAYERS | W294: TEAM | X294: W | Y294: L | Z294: D | AA294: FOR | AB294: AGST | AC294: % | AD294: PTS
A295: GEELONG WEST | D295: SMITH | F295: MANSON | I295: M BROWNE | L295: McLEAN | O295: LINKE | Q295: WILSON
A296: PRAHRAN | D296: GRANGE | F296: SMITH | I296: EMSELLE | L296: PIROUET | O296: HAMILTON | Q296: TOWNSEND | W296: OAKLEIGH | X296: 6 | Y296: 1 | Z296: 0 | AA296: 845 | AB296: 677 | AC296: 124.81536189069423 | AD296: 24
A297: GOALKICKERS | W297: DANDENONG | X297: 5 | Y297: 1 | Z297: 1 | AA297: 793 | AB297: 657 | AC297: 120.70015220700152 | AD297: 22
A298: GEELONG WEST | D298: McLEAN 8 | F298: LINKE 3 | H298: HARRIS 3 | J298: TEAGUE | L298: R BROWNE | O298: IRVIN | Q298: K TAYLOR | W298: PORT MELBOURNE | X298: 5 | Y298: 2 | Z298: 0 | AA298: 765 | AB298: 739 | AC298: 103.51826792963465 | AD298: 20
A299: PRAHRAN | D299: KELLY 2 | G299: TUCKWELL 2 | J299: APPLETON 2 | M299: BARTLETT | O299: EMSELLE | Q299: SINCLAIR | S299: SMITH | W299: GEELONG WEST | X299: 4 | Y299: 3 | Z299: 0 | AA299: 840 | AB299: 711 | AC299: 118.14345991561181 | AD299: 16
A301: PORT MELBOURNE | C301: 5 | D301: 6 | E301: =C301*6+D301 -> 36 | G301: 8 | H301: 9 | I301: =G301*6+H301 -> 57 | K301: 11 | L301: 17 | M301: =K301*6+L301 -> 83 | O301: 16 | P301: 18 | Q301: =O301*6+P301 -> 114 | S301: WILLIAMSTOWN | W301: PRAHRAN | X301: 3 | Y301: 3 | Z301: 1 | AA301: 843 | AB301: 833 | AC301: 101.20048019207682 | AD301: 14
A302: WILLIAMSTOWN | C302: 1 | D302: 3 | E302: =C302*6+D302 -> 9 | G302: 4 | H302: 10 | I302: =G302*6+H302 -> 34 | K302: 5 | L302: 14 | M302: =K302*6+L302 -> 44 | O302: 10 | P302: 17 | Q302: =O302*6+P302 -> 77 | S302: GAMBETTA | W302: PRESTON | X302: 3 | Y302: 4 | Z302: 0 | AA302: 866 | AB302: 798 | AC302: 108.52130325814537 | AD302: 12
A303: BEST PLAYERS | W303: SUNSHINE | X303: 3 | Y303: 4 | Z303: 0 | AA303: 680 | AB303: 826 | AC303: 82.324455205811134 | AD303: 12
A304: PORT MELBOURNE | D304: BEHAN | G304: PROFFIT | I304: MALLETT | L304: SWINSTEAD | O304: STEVENSON | R304: HARLAND | W304: WILLIAMSTOWN | X304: 2 | Y304: 5 | Z304: 0 | AA304: 694 | AB304: 773 | AC304: 89.780077619663643 | AD304: 8
A305: WILLIAMSTOWN | D305: L STILLMAN | G305: HEMLEY | I305: HANNEBURY | L305: LAWERSON | O305: GILL | R305: ROACH | W305: COBURG | X305: 1 | Y305: 4 | Z305: 2 | AA305: 751 | AB305: 837 | AC305: 89.72520908004779 | AD305: 8
A306: GOALKICKERS | W306: SANDRINGHAM | X306: 1 | Y306: 6 | Z306: 0 | AA306: 688 | AB306: 914 | AC306: 75.273522975929978 | AD306: 4
A307: PORT MELBOURNE | D307: SWINSTEAD 5 | G307: COOK 3 | I307: BECKWITH 3 | L307: HUGHES 2 | O307: BEHAN | Q307: HARLAND | S307: CHAMBERLAIN
A308: WILLIAMSTOWN | D308: L STILLMAN 5 | G308: GILL | I308: HEMLEY | K308: SVORINICH | N308: COLLINS | Q308: LAWERSON
A310: SUNSHINE | C310: 3 | D310: 3 | E310: =C310*6+D310 -> 21 | G310: 7 | H310: 6 | I310: =G310*6+H310 -> 48 | K310: 12 | L310: 11 | M310: =K310*6+L310 -> 83 | O310: 17 | P310: 19 | Q310: =O310*6+P310 -> 121 | S310: PRESTON
A311: PRESTON | C311: 5 | D311: 4 | E311: =C311*6+D311 -> 34 | G311: 8 | H311: 8 | I311: =G311*6+H311 -> 56 | K311: 12 | L311: 11 | M311: =K311*6+L311 -> 83 | O311: 16 | P311: 14 | Q311: =O311*6+P311 -> 110 | S311: HUXTABLE
A312: BEST PLAYERS
A313: SUNSHINE | D313: SLADDIN | G313: CLARKE | J313: GOOLD | M313: L CRAWFORD | P313: PIERZAK | S313: BENSON
A314: PRESTON | D314: SHAW | G314: MARTIN | J314: McGAW | M314: BAIRD | P314: CLARK | S314: SLATER
A315: GOALKICKERS
A316: SUNSHINE | D316: WAGLAND 3 | G316: RUSSELL 3 | J316: L CRAWFORD 3 | N316: R CRAWFORD 2 | R316: BENSON 2 | U316: GLAVICI (2) | W316: GOOLD | X316: LLOYD
A317: PRESTON | D317: LE GASSICK 3 | G317: CLARK 3 | I317: SMITH 3 | K317: SHAW 2 | M317: RACOVOLIS 2 | P317: HUNT | R317: COBAIN
A319: DANDENONG | C319: 4 | D319: 3 | E319: =C319*6+D319 -> 27 | G319: 4 | H319: 8 | I319: =G319*6+H319 -> 32 | K319: 9 | L319: 11 | M319: =K319*6+L319 -> 65 | O319: 12 | P319: 13 | Q319: =O319*6+P319 -> 85 | S319: DANDENONG
A320: COBURG | C320: 4 | D320: 5 | E320: =C320*6+D320 -> 29 | G320: 6 | H320: 9 | I320: =G320*6+H320 -> 45 | K320: 7 | L320: 11 | M320: =K320*6+L320 -> 53 | O320: 11 | P320: 19 | Q320: =O320*6+P320 -> 85 | S320: STIRLING
A321: BEST PLAYERS
A322: DANDENONG | D322: KENDALL | G322: K SHINNERS | J322: DAVIES | M322: DARLEY | P322: MILLER | S322: ESLER
A323: COBURG | D323: MARSH | G323: HOWELL | J323: P McCARTHY | M323: ELVERY | P323: MORRISON | S323: McGRATH
A324: GOALKICKERS
A325: DANDENONG | D325: MILLER 4 | G325: DAVIES 2 | J325: KENDALL 2 | M325: FLAHERTY 2 | P325: REID | R325: HIBBERT
A326: COBURG | D326: McGRATH 3 | G326: BRENNAN 3 | J326: HOWELL | L326: GALE | N326: LAKE | P326: REILLY | R326: MORRISON
A328: OAKLEIGH | C328: 6 | D328: 5 | E328: =C328*6+D328 -> 41 | G328: 10 | H328: 5 | I328: =G328*6+H328 -> 65 | K328: 13 | L328: 12 | M328: =K328*6+L328 -> 90 | O328: 18 | P328: 17 | Q328: =O328*6+P328 -> 125 | S328: OAKLEIGH
A329: SANDRINGHAM | C329: 2 | D329: 3 | E329: =C329*6+D329 -> 15 | G329: 7 | H329: 11 | I329: =G329*6+H329 -> 53 | K329: 11 | L329: 12 | M329: =K329*6+L329 -> 78 | O329: 12 | P329: 15 | Q329: =O329*6+P329 -> 87 | S329: TORNEY
A330: BEST PLAYERS
A331: OAKLEIGH | D331: FRYER | G331: CLOKE | J331: ROBBINS | M331: COLCOTT | P331: TAYLOR | S331: STEPHENS
A332: SANDRINGHAM | D332: TOMS | G332: I COOPER | J332: KENNEDY | M332: DAVEY | P332: SPURRELL | S332: WARD
A333: GOALKICKERS
A334: OAKLEIGH | D334: COLCOTT 6 | G334: ROBBINS 5 | J334: CLOKE 3 | M334: TAYLOR 3 | P334: WENN
A335: SANDRINGHAM | D335: I COOPER 6 | G335: AUBREY 3 | J335: HESLOP | L335: WARD | N335: KENNEDY
A337: ROUND 8 | E337: 10TH JUNE | J337: WEATHER | N337: WEST WIND RAIN | S337: PLAYED AT
D338: 1ST QTR | H338: 2ND QTR | L338: 3RD QTR | P338: FINAL | S338: TOORAK PARK
A339: PRAHRAN | C339: 6 | D339: 1 | E339: =C339*6+D339 -> 37 | G339: 12 | H339: 3 | I339: =G339*6+H339 -> 75 | K339: 15 | L339: 6 | M339: =K339*6+L339 -> 96 | O339: 17 | P339: 10 | Q339: =O339*6+P339 -> 112 | S339: UMPIRE | X339: LADDER | AB339: ROUND | AD339: 8
A340: DANDENONG | C340: 4 | D340: 4 | E340: =C340*6+D340 -> 28 | G340: 7 | H340: 10 | I340: =G340*6+H340 -> 52 | K340: 11 | L340: 14 | M340: =K340*6+L340 -> 80 | O340: 15 | P340: 17 | Q340: =O340*6+P340 -> 107 | S340: TORNEY
A341: BEST PLAYERS | W341: TEAM | X341: W | Y341: L | Z341: D | AA341: FOR | AB341: AGST | AC341: % | AD341: PTS
A342: PRAHRAN | D342: SINCLAIR | G342: APPLETON | J342: EMSELLE | M342: SMITH | O342: WEEKES | R342: TOWNSEND
A343: DANDENONG | D343: MILLER | G343: FLAHERTY | J343: BECK | M343: HIBBERT | O343: ROBERTSON | R343: ORCHARD | W343: OAKLEIGH | X343: 6 | Y343: 2 | Z343: 0 | AA343: 901 | AB343: 770 | AC343: 117.01298701298701 | AD343: 24
A344: GOALKICKERS | W344: DANDENONG | X344: 5 | Y344: 2 | Z344: 1 | AA344: 900 | AB344: 769 | AC344: 117.03511053315995 | AD344: 22
A345: PRAHRAN | D345: SINCLAIR 4 | F345: APPLETON 4 | I345: TOWNSEND 4 | L345: JOHNSTON | N345: WEEKES | P345: SMITH | R345: CULPIN | T345: ANDERSON | W345: GEELONG WEST | X345: 5 | Y345: 3 | Z345: 0 | AA345: 905 | AB345: 773 | AC345: 117.07632600258732 | AD345: 20
A346: DANDENONG | D346: MILLER 9 | G346: FLAHERTY 4 | J346: HIBBERT | L346: WOOD | W346: PORT MELBOURNE | X346: 5 | Y346: 3 | Z346: 0 | AA346: 869 | AB346: 852 | AC346: 101.99530516431925 | AD346: 20
A348: PRESTON | C348: 2 | D348: 5 | E348: =C348*6+D348 -> 17 | G348: 8 | H348: 7 | I348: =G348*6+H348 -> 55 | K348: 10 | L348: 8 | M348: =K348*6+L348 -> 68 | O348: 14 | P348: 9 | Q348: =O348*6+P348 -> 93 | S348: OAKLEIGH | W348: PRAHRAN | X348: 4 | Y348: 3 | Z348: 1 | AA348: 955 | AB348: 940 | AC348: 101.59574468085107 | AD348: 18
A349: OAKLEIGH | C349: 2 | D349: 3 | E349: =C349*6+D349 -> 15 | G349: 3 | H349: 8 | I349: =G349*6+H349 -> 26 | K349: 4 | L349: 15 | M349: =K349*6+L349 -> 39 | O349: 6 | P349: 20 | Q349: =O349*6+P349 -> 56 | S349: STIRLING | W349: PRESTON | X349: 4 | Y349: 4 | Z349: 0 | AA349: 959 | AB349: 854 | AC349: 112.29508196721312 | AD349: 16
A350: BEST PLAYERS | W350: WILLIAMSTOWN | X350: 3 | Y350: 5 | Z350: 0 | AA350: 810 | AB350: 874 | AC350: 92.677345537757432 | AD350: 12
A351: PRESTON | D351: SHAW | F351: MORRIS | I351: CLARK | L351: PREECE | O351: LESLIE | R351: WALKER | W351: SUNSHINE | X351: 3 | Y351: 5 | Z351: 0 | AA351: 781 | AB351: 942 | AC351: 82.908704883227173 | AD351: 12
A352: OAKLEIGH | D352: CLOKE | F352: NESBIT | I352: WENN | L352: P LILLEY | O352: J LILLEY | R352: FORD | W352: COBURG | X352: 1 | Y352: 5 | Z352: 2 | AA352: 813 | AB352: 902 | AC352: 90.133037694013311 | AD352: 8
A353: GOALKICKERS | W353: SANDRINGHAM | X353: 2 | Y353: 6 | Z353: 0 | AA353: 801 | AB353: 1018 | AC353: 78.683693516699407 | AD353: 8
A354: PRESTON | D354: CLARK 6 | G354: SALTMARSH 3 | J354: MUNARI 2 | M354: SHAW | O354: HUNT | Q354: COBAIN
A355: OAKLEIGH | D355: COLCOTT 2 | G355: QUINN | I355: BILLING | K355: TAYLOR | M355: CLOKE
A357: WILLIAMSTOWN | C357: 7 | D357: 6 | E357: =C357*6+D357 -> 48 | G357: 8 | H357: 12 | I357: =G357*6+H357 -> 60 | K357: 13 | L357: 19 | M357: =K357*6+L357 -> 97 | O357: 16 | P357: 20 | Q357: =O357*6+P357 -> 116 | S357: SUNSHINE
A358: SUNSHINE | C358: 3 | D358: 2 | E358: =C358*6+D358 -> 20 | G358: 7 | H358: 6 | I358: =G358*6+H358 -> 48 | K358: 10 | L358: 9 | M358: =K358*6+L358 -> 69 | O358: 15 | P358: 11 | Q358: =O358*6+P358 -> 101 | S358: FLANAGAN
A359: BEST PLAYERS
A360: WILLIAMSTOWN | D360: HANNEBURY | G360: THOMPSON | J360: COLLINS | M360: PATTERSON | P360: GILL | R360: L STILLMAN
A361: SUNSHINE | D361: PAYNE | G361: L CRAWFORD | J361: GOOLD | M361: CLARKE | P361: RUSSELL | R361: SLADDIN
A362: GOALKICKERS
A363: WILLIAMSTOWN | D363: PATTERSON 7 | G363: WARBURTON 2 | J363: LAWERSON 2 | M363: L STILLMAN 2 | P363: HEMLEY | R363: CRUMP | T363: SVORINICH
A364: SUNSHINE | D364: RUSSELL 4 | G364: PAYNE 2 | I364: GOOLD 2 | K364: GLAVICI | M364: LLOYD | O364: CHADWICK | R364: WAGLAND | U364: L CRAWFORD | X364: IZZARD | Z364: STIEGLER
A366: GEELONG WEST | C366: 3 | D366: 1 | E366: =C366*6+D366 -> 19 | G366: 5 | H366: 5 | I366: =G366*6+H366 -> 35 | K366: 6 | L366: 8 | M366: =K366*6+L366 -> 44 | O366: 9 | P366: 11 | Q366: =O366*6+P366 -> 65 | S366: COBURG
A367: COBURG | C367: 2 | D367: 5 | E367: =C367*6+D367 -> 17 | G367: 5 | H367: 7 | I367: =G367*6+H367 -> 37 | K367: 8 | L367: 10 | M367: =K367*6+L367 -> 58 | O367: 8 | P367: 14 | Q367: =O367*6+P367 -> 62 | S367: GAMBETTA
A368: BEST PLAYERS
A369: GEELONG WEST | D369: GILLIES | G369: BARRY | J369: SMITH | M369: M BROWNE | P369: HALL | S369: R BROWNE
A370: COBURG | D370: KIRKMAN | G370: MORRISON | J370: HOBBS | M370: P McCARTHY | P370: LAKE | S370: MANNIX
A371: GOALKICKERS
A372: GEELONG WEST | D372: IRVIN 2 | G372: HARRIS 2 | J372: TEAGUE | L372: LINKE | N372: McLEAN | P372: DEEATH | R372: GOGGIN
A373: COBURG | D373: LAKE 2 | G373: BRENNAN 2 | J373: HOWELL | L373: GALE | N373: McGRATH | P373: KIRKMAN
A375: SANDRINGHAM | C375: 4 | D375: 6 | E375: =C375*6+D375 -> 30 | G375: 8 | H375: 8 | I375: =G375*6+H375 -> 56 | K375: 9 | L375: 12 | M375: =K375*6+L375 -> 66 | O375: 16 | P375: 17 | Q375: =O375*6+P375 -> 113 | S375: BEACH ROAD
A376: PORT MELBOURNE | C376: 5 | D376: 5 | E376: =C376*6+D376 -> 35 | G376: 10 | H376: 11 | I376: =G376*6+H376 -> 71 | K376: 13 | L376: 15 | M376: =K376*6+L376 -> 93 | O376: 14 | P376: 20 | Q376: =O376*6+P376 -> 104 | S376: HAYES
A377: BEST PLAYERS
A378: SANDRINGHAM | D378: BROWNE | G378: I COOPER | J378: WARD | M378: SCHWARZMAN | P378: TOMS | S378: McNICHOLAS
A379: PORT MELBOURNE | D379: O'BRIEN | G379: STEVENSON | J379: COLLINS | M379: ALLEN | P379: PROFFIT | S379: ANDERSON
A380: GOALKICKERS
A381: SANDRINGHAM | D381: I COOPER 6 | G381: SCHOLES 3 | J381: WARD 3 | M381: AUBREY 2 | P381: KENNEDY | R381: HESLOP
A382: PORT MELBOURNE | D382: COOK 4 | G382: COLLINS 3 | J382: ANDERSON 3 | M382: HARLAND | O382: SWINSTEAD | R382: O'BRIEN | T382: BECKWITH
A384: ROUND 9 | D384: 17TH JUNE | I384: WEATHER | L384: WEST WIND | S384: PLAYED AT
D385: 1ST QTR | H385: 2ND QTR | L385: 3RD QTR | P385: FINAL | S385: PORT MELBOURNE
A386: PORT MELBOURNE | C386: 5 | D386: 1 | E386: =C386*6+D386 -> 31 | G386: 12 | H386: 4 | I386: =G386*6+H386 -> 76 | K386: 16 | L386: 7 | M386: =K386*6+L386 -> 103 | O386: 26 | P386: 8 | Q386: =O386*6+P386 -> 164 | S386: UMPIRE | X386: LADDER | AB386: ROUND | AD386: 9
A387: SUNSHINE | C387: 5 | D387: 5 | E387: =C387*6+D387 -> 35 | G387: 7 | H387: 7 | I387: =G387*6+H387 -> 49 | K387: 12 | L387: 13 | M387: =K387*6+L387 -> 85 | O387: 15 | P387: 18 | Q387: =O387*6+P387 -> 108 | S387: GAMBETTA
A388: BEST PLAYERS | W388: TEAM | X388: W | Y388: L | Z388: D | AA388: FOR | AB388: AGST | AC388: % | AD388: PTS
A389: PORT MELBOURNE | D389: ALLEN | G389: ANDERSON | J389: BECKWITH | M389: COLLINS | O389: PROFFIT | Q389: COOK
A390: SUNSHINE | D390: R CRAWFORD | G390: L CRAWFORD | J390: RUSSELL | M390: GOOLD | O390: CLARK | Q390: PAYNE | W390: OAKLEIGH | X390: 7 | Y390: 2 | Z390: 0 | AA390: 1032 | AB390: 858 | AC390: 120.27972027972028 | AD390: 28
A391: GOALKICKERS | M391: HUGHES | O391: HOLT | Q391: O'BRIEN | S391: HUDSON | W391: DANDENONG | X391: 6 | Y391: 2 | Z391: 1 | AA391: 1038 | AB391: 861 | AC391: 120.55749128919861 | AD391: 26
A392: PORT MELBOURNE | D392: ANDERSON 6 | G392: COOK 5 | I392: BECKWITH 5 | L392: PROFFIT 2 | N392: SWINSTEAD 2 | Q392: COLLINS | S392: WILLIAMS | W392: PORT MELBOURNE | X392: 6 | Y392: 3 | Z392: 0 | AA392: 1033 | AB392: 960 | AC392: 107.60416666666667 | AD392: 24
A393: SUNSHINE | D393: R CRAWFORD 6 | G393: RUSSELL 4 | I393: GOOLD | K393: IZZARD | M393: STEIGLER | O393: L CRAWFORD | R393: VELLA | W393: PRAHRAN | X393: 5 | Y393: 3 | Z393: 1 | AA393: 1105 | AB393: 1037 | AC393: 106.55737704918033 | AD393: 22
A395: COBURG | C395: 3 | D395: 7 | E395: =C395*6+D395 -> 25 | G395: 10 | H395: 13 | I395: =G395*6+H395 -> 73 | K395: 16 | L395: 20 | M395: =K395*6+L395 -> 116 | O395: 18 | P395: 24 | Q395: =O395*6+P395 -> 132 | S395: PRESTON | W395: GEELONG WEST | X395: 5 | Y395: 4 | Z395: 0 | AA395: 993 | AB395: 904 | AC395: 109.84513274336283 | AD395: 20
A396: PRESTON | C396: 4 | D396: 3 | E396: =C396*6+D396 -> 27 | G396: 9 | H396: 7 | I396: =G396*6+H396 -> 61 | K396: 11 | L396: 8 | M396: =K396*6+L396 -> 74 | O396: 14 | P396: 14 | Q396: =O396*6+P396 -> 98 | S396: McBAIN | W396: PRESTON | X396: 4 | Y396: 5 | Z396: 0 | AA396: 1057 | AB396: 986 | AC396: 107.20081135902637 | AD396: 16
A397: BEST PLAYERS | W397: COBURG | X397: 2 | Y397: 5 | Z397: 2 | AA397: 945 | AB397: 1000 | AC397: 94.5 | AD397: 12
A398: COBURG | D398: ERWIN | F398: KIRKMAN | I398: S McCARTHY | L398: P McCARTHY | O398: PRICE | Q398: ARTHURSON | W398: WILLIAMSTOWN | X398: 3 | Y398: 6 | Z398: 0 | AA398: 902 | AB398: 1012 | AC398: 89.130434782608702 | AD398: 12
A399: PRESTON | D399: PREECE | F399: SHAW | I399: COBAIN | L399: SLATER | O399: MARTIN | Q399: McGAW | W399: SUNSHINE | X399: 3 | Y399: 6 | Z399: 0 | AA399: 889 | AB399: 1106 | AC399: 80.379746835443044 | AD399: 12
A400: GOALKICKERS | O400: BRENNAN | R400: MANNIX | W400: SANDRINGHAM | X400: 2 | Y400: 7 | Z400: 0 | AA400: 898 | AB400: 1168 | AC400: 76.88356164383562 | AD400: 8
A401: COBURG | D401: S McCARTHY 5 | G401: BREEN 3 | I401: HOWELL 2 | K401: McGRATH 2 | N401: KIRKMAN 2 | Q401: LAKE | R401: MORRISON
A402: PRESTON | D402: CLARK 4 | F402: GRAINGER 2 | I402: COBAIN 2 | L402: SMITH 2 | N402: SHAW | P402: SALTMARSH | S402: McGAW | U402: MARTIN
E403: 24TH JUNE | J403: WEATHER | N403: NORTH WEST WIND
A404: OAKLEIGH | C404: 2 | D404: 4 | E404: =C404*6+D404 -> 16 | G404: 9 | H404: 9 | I404: =G404*6+H404 -> 63 | K404: 14 | L404: 14 | M404: =K404*6+L404 -> 98 | O404: 19 | P404: 17 | Q404: =O404*6+P404 -> 131 | S404: GEELONG WEST
A405: GEELONG WEST | C405: 2 | D405: 6 | E405: =C405*6+D405 -> 18 | G405: 5 | H405: 11 | I405: =G405*6+H405 -> 41 | K405: 6 | L405: 17 | M405: =K405*6+L405 -> 53 | O405: 11 | P405: 22 | Q405: =O405*6+P405 -> 88 | S405: HAYES
A406: BEST PLAYERS
A407: OAKLEIGH | D407: COLCOTT | G407: ROBBINS | J407: MURNANE | M407: BILLING | P407: FORD | S407: HALLIDAY
A408: GEELONG WEST | D408: DEEATH | G408: McLEAN | J408: GOGGIN | M408: GILLIES | P408: VAN ELDEN | S408: SMITH
A409: GOALKICKERS
A410: OAKLEIGH | D410: CLOKE 4 | F410: MURNANE 4 | I410: ROBBINS 3 | L410: BILLING 2 | N410: COLCOTT 2 | Q410: FORD | R410: BARR | T410: NESBIT | W410: HALLIDAY
A411: GEELONG WEST | D411: McLEAN 5 | G411: R BROWNE 2 | J411: GOGGIN 2 | M411: LINKE | O411: HARRIS
A413: DANDENONG | C413: 4 | D413: 3 | E413: =C413*6+D413 -> 27 | G413: 13 | H413: 5 | I413: =G413*6+H413 -> 83 | K413: 13 | L413: 7 | M413: =K413*6+L413 -> 85 | O413: 21 | P413: 12 | Q413: =O413*6+P413 -> 138 | S413: WILLIAMSTOWN
A414: WILLIAMSTOWN | C414: 3 | D414: 4 | E414: =C414*6+D414 -> 22 | G414: 5 | H414: 7 | I414: =G414*6+H414 -> 37 | K414: 11 | L414: 13 | M414: =K414*6+L414 -> 79 | O414: 13 | P414: 14 | Q414: =O414*6+P414 -> 92 | S414: MARKS
A415: BEST PLAYERS
A416: DANDENONG | D416: FLAHERTY | G416: HIBBERT | J416: BOND | M416: ORCHARD | P416: ESLER
A417: WILLIAMSTOWN | D417: FENTON | G417: L STILLMAN | J417: FANNING | M417: ROACH | P417: McTAGGART | S417: SCOTT
A418: GOALKICKERS
A419: DANDENONG | D419: FLAHERTY 6 | G419: BOND 4 | I419: MILLER 3 | K419: REID 2 | M419: HIBBERT | O419: ROBERTSON | R419: ELLIS | T419: KENDALL | W419: ESLER | X419: SULLIVAN
A420: WILLIAMSTOWN | D420: SVORINICH 3 | G420: L STILLMAN 3 | J420: WARBURTON 2 | N420: FANNING 2 | Q420: HEMLEY | S420: PATTERSON | V420: SCOTT
A422: PRAHRAN | C422: 0 | D422: 3 | E422: =C422*6+D422 -> 3 | G422: 6 | H422: 7 | I422: =G422*6+H422 -> 43 | K422: 15 | L422: 12 | M422: =K422*6+L422 -> 102 | O422: 23 | P422: 12 | Q422: =O422*6+P422 -> 150 | S422: TOORAK PARK
A423: SANDRINGHAM | C423: 3 | D423: 4 | E423: =C423*6+D423 -> 22 | G423: 7 | H423: 5 | I423: =G423*6+H423 -> 47 | K423: 10 | L423: 6 | M423: =K423*6+L423 -> 66 | O423: 15 | P423: 7 | Q423: =O423*6+P423 -> 97 | S423: O'BRIEN
A424: BEST PLAYERS
A425: PRAHRAN | D425: SINCLAIR | G425: APPLETON | J425: PAYNE | M425: O'BRIEN | O425: PIROUET | R425: TOWNSEND
A426: SANDRINGHAM | D426: MURPHY | G426: SCHWARZMAN | J426: SCHOLES | M426: I COOPER | O426: BRENNER | R426: WARD
A427: GOALKICKERS
A428: PRAHRAN | D428: SINCLAIR 5 | G428: PAYNE 5 | I428: TOWNSEND 4 | L428: SMITH 3 | N428: APPLETON 3 | Q428: KELLY 2 | S428: EMSELLE
A429: SANDRINGHAM | D429: I COOPER 6 | G429: MURPHY 3 | J429: SCHWARZMAN 2 | N429: SCHOLES 2 | Q429: KENNEDY | S429: WARD
A431: ROUND 10 | E431: 1ST JULY | J431: WEATHER | N431: FINE | S431: PLAYED AT
D432: 1ST QTR | H432: 2ND QTR | L432: 3RD QTR | P432: FINAL | S432: DANDENONG
A433: GEELONG WEST | C433: 2 | D433: 4 | E433: =C433*6+D433 -> 16 | G433: 7 | H433: 8 | I433: =G433*6+H433 -> 50 | K433: 13 | L433: 12 | M433: =K433*6+L433 -> 90 | O433: 20 | P433: 17 | Q433: =O433*6+P433 -> 137 | S433: UMPIRE | X433: LADDER | AB433: ROUND | AD433: 10
A434: DANDENONG | C434: 7 | D434: 2 | E434: =C434*6+D434 -> 44 | G434: 9 | H434: 5 | I434: =G434*6+H434 -> 59 | K434: 12 | L434: 6 | M434: =K434*6+L434 -> 78 | O434: 14 | P434: 10 | Q434: =O434*6+P434 -> 94 | S434: STIRLING
A435: BEST PLAYERS | W435: TEAM | X435: W | Y435: L | Z435: D | AA435: FOR | AB435: AGST | AC435: % | AD435: PTS
A436: GEELONG WEST | D436: R BROWNE | G436: JONES | J436: TAYLOR | M436: GOGGIN | O436: HARRIS | Q436: VAN ELDEN
A437: DANDENONG | D437: ORCHARD | G437: FLAHERTY | J437: HIBBERT | M437: BECK | O437: REID | Q437: BOND | W437: OAKLEIGH | X437: 8 | Y437: 2 | Z437: 0 | AA437: 1171 | AB437: 981 | AC437: 119.36799184505607 | AD437: 32
A438: GOALKICKERS | O438: MADDEN | R438: GOGGIN | W438: PORT MELBOURNE | X438: 7 | Y438: 3 | Z438: 0 | AA438: 1162 | AB438: 1084 | AC438: 107.19557195571956 | AD438: 28
A439: GEELONG WEST | D439: McLEAN 6 | F439: JONES 4 | H439: R BROWNE 2 | K439: HARRIS 2 | M439: WARREN 2 | P439: LINKE | R439: MANSON | W439: DANDENONG | X439: 6 | Y439: 3 | Z439: 1 | AA439: 1132 | AB439: 998 | AC439: 113.42685370741484 | AD439: 26
A440: DANDENONG | D440: MILLER 6 | G440: FLAHERTY 4 | J440: BOND 2 | L440: MELAI | N440: REID | W440: PRAHRAN | X440: 6 | Y440: 3 | Z440: 1 | AA440: 1273 | AB440: 1133 | AC440: 112.35657546337158 | AD440: 26
A442: PORT MELBOURNE | C442: 3 | D442: 3 | E442: =C442*6+D442 -> 21 | G442: 11 | H442: 9 | I442: =G442*6+H442 -> 75 | K442: 14 | L442: 15 | M442: =K442*6+L442 -> 99 | O442: 18 | P442: 21 | Q442: =O442*6+P442 -> 129 | S442: COBURG | W442: GEELONG WEST | X442: 6 | Y442: 4 | Z442: 0 | AA442: 1130 | AB442: 998 | AC442: 113.22645290581163 | AD442: 24
A443: COBURG | C443: 9 | D443: 6 | E443: =C443*6+D443 -> 60 | G443: 12 | H443: 8 | I443: =G443*6+H443 -> 80 | K443: 15 | L443: 15 | M443: =K443*6+L443 -> 105 | O443: 18 | P443: 16 | Q443: =O443*6+P443 -> 124 | S443: MARKS | W443: PRESTON | X443: 4 | Y443: 6 | Z443: 0 | AA443: 1175 | AB443: 1135 | AC443: 103.52422907488987 | AD443: 16
A444: BEST PLAYERS | W444: COBURG | X444: 2 | Y444: 6 | Z444: 2 | AA444: 1069 | AB444: 1129 | AC444: 94.685562444641278 | AD444: 12
A445: PORT MELBOURNE | D445: ANDERSON | G445: BROWN | J445: SWINSTEAD | M445: STEVENSON | P445: BECKWITH | S445: O'BRIEN | W445: WILLIAMSTOWN | X445: 3 | Y445: 7 | Z445: 0 | AA445: 1025 | AB445: 1151 | AC445: 89.052997393570806 | AD445: 12
A446: COBURG | D446: LAKE | G446: MORRISON | J446: S McCARTHY | M446: MANNIX | P446: P McCARTHY | S446: ERWIN | W446: SANDRINGHAM | X446: 3 | Y446: 7 | Z446: 0 | AA446: 1047 | AB446: 1286 | AC446: 81.415241057542772 | AD446: 12
A447: GOALKICKERS | N447: O'BRIEN | Q447: HUGHES | W447: SUNSHINE | X447: 3 | Y447: 7 | Z447: 0 | AA447: 985 | AB447: 1274 | AC447: 77.315541601255887 | AD447: 12
A448: PORT MELBOURNE | D448: ANDERSON 4 | G448: COOK 3 | I448: COLLINS 2 | K448: HOLT 2 | M448: SWINSTEAD 2 | P448: LOCKHART 2 | S448: BECKWITH
A449: COBURG | D449: S McCARTHY 6 | G449: LAKE 5 | I449: ERWIN 3 | K449: MORRISON 3 | N449: BREEN
A451: SANDRINGHAM | C451: 3 | D451: 7 | E451: =C451*6+D451 -> 25 | G451: 8 | H451: 10 | I451: =G451*6+H451 -> 58 | K451: 18 | L451: 12 | M451: =K451*6+L451 -> 120 | O451: 22 | P451: 17 | Q451: =O451*6+P451 -> 149 | S451: BEACH ROAD
A452: PRESTON | C452: 4 | D452: 5 | E452: =C452*6+D452 -> 29 | G452: 9 | H452: 8 | I452: =G452*6+H452 -> 62 | K452: 14 | L452: 13 | M452: =K452*6+L452 -> 97 | O452: 17 | P452: 16 | Q452: =O452*6+P452 -> 118 | S452: FLANAGAN
A453: BEST PLAYERS
A454: SANDRINGHAM | D454: I COOPER | G454: BRENNER | J454: McNICHOLAS | M454: WARD | O454: TREGEAR | R454: MURPHY
A455: PRESTON | D455: MARTIN | G455: SHAW | J455: SLATER | M455: McGAW | O455: WEIGHTMAN | R455: PREECE
A456: GOALKICKERS
A457: SANDRINGHAM | D457: I COOPER 10 | G457: NICHOLSON 3 | J457: KENNEDY 2 | M457: WARD 2 | O457: MURPHY 2 | Q457: SCHOLES | S457: TREGEAR | V457: SCHWARZMAN
A458: PRESTON | D458: CLARK 4 | F458: SHAW 4 | H458: McGAW 2 | J458: WEIGHTMAN 2 | M458: GREENWOOD | P458: GRAINGER | R458: HILL | T458: MIDDLETON | W458: SLATER
A460: PRAHRAN | C460: 7 | D460: 0 | E460: =C460*6+D460 -> 42 | G460: 15 | H460: 1 | I460: =G460*6+H460 -> 91 | K460: 18 | L460: 9 | M460: =K460*6+L460 -> 117 | O460: 26 | P460: 12 | Q460: =O460*6+P460 -> 168 | S460: SUNSHINE
A461: SUNSHINE | C461: 3 | D461: 5 | E461: =C461*6+D461 -> 23 | G461: 4 | H461: 14 | I461: =G461*6+H461 -> 38 | K461: 10 | L461: 20 | M461: =K461*6+L461 -> 80 | O461: 12 | P461: 24 | Q461: =O461*6+P461 -> 96 | S461: HAYES
A462: BEST PLAYERS
A463: PRAHRAN | D463: ANDERSON | G463: SMITH | J463: SINCLAIR | M463: APPLETON | P463: WEEKES | R463: RIPPON
A464: SUNSHINE | D464: WOODS | G464: R CRAWFORD | J464: CLARKE | M464: L CRAWFORD | P464: NEISH | R464: LLOYD
A465: GOALKICKERS
A466: PRAHRAN | D466: ANDERSON 5 | G466: APPLETON 5 | J466: WEEKES 4 | M466: SMITH 4 | O466: RIPPON 2 | Q466: PAYNE 2 | S466: EMSELLE | V466: SINCLAIR | X466: KELLY | Z466: TOWNSEND
A467: SUNSHINE | D467: R CRAWFORD 4 | H467: RUSSELL 2 | K467: PIERZAK 2 | N467: PAYNE | P467: GLAVICI | R467: NEISH | T467: L CRAWFORD
A469: OAKLEIGH | C469: 5 | D469: 5 | E469: =C469*6+D469 -> 35 | G469: 8 | H469: 11 | I469: =G469*6+H469 -> 59 | K469: 14 | L469: 12 | M469: =K469*6+L469 -> 96 | O469: 20 | P469: 19 | Q469: =O469*6+P469 -> 139 | S469: OAKLEIGH
A470: WILLIAMSTOWN | C470: 3 | D470: 6 | E470: =C470*6+D470 -> 24 | G470: 11 | H470: 7 | I470: =G470*6+H470 -> 73 | K470: 16 | L470: 12 | M470: =K470*6+L470 -> 108 | O470: 18 | P470: 15 | Q470: =O470*6+P470 -> 123 | S470: WENN
A471: BEST PLAYERS
A472: OAKLEIGH | D472: ROBBINS | G472: BARR | I472: COLCOTT | L472: FORD | O472: HALLIDAY | R472: MURNANE
A473: WILLIAMSTOWN | D473: L STILLMAN | G473: GILL | I473: MULLIGAN | L473: FENTON | O473: WARBURTON | R473: PATTERSON
A474: GOALKICKERS
A475: OAKLEIGH | D475: COLCOTT 7 | G475: HALLIDAY 3 | J475: BARR 3 | L475: MURNANE 3 | O475: WENN 2 | Q475: FORD | S475: TAYLOR
A476: WILLIAMSTOWN | D476: MULLIGAN 5 | G476: SVORINICH 4 | J476: BOXALL 3 | M476: WARBURTON | P476: PATTERSON | R476: L STILLMAN | U476: THOMPSON | X476: WHITTINGTON
A478: ROUND 11 | E478: 8TH JULY | J478: WEATHER | N478: FOGGY NO WIND | S478: PLAYED AT
D479: 1ST QTR | H479: 2ND QTR | L479: 3RD QTR | P479: FINAL | S479: PORT MELBOURNE
A480: OAKLEIGH | C480: 2 | D480: 8 | E480: =C480*6+D480 -> 20 | G480: 9 | H480: 14 | I480: =G480*6+H480 -> 68 | K480: 15 | L480: 19 | M480: =K480*6+L480 -> 109 | O480: 21 | P480: 22 | Q480: =O480*6+P480 -> 148 | S480: UMPIRE | X480: LADDER | AB480: ROUND | AD480: 11
A481: PORT MELBOURNE | C481: 3 | D481: 2 | E481: =C481*6+D481 -> 20 | G481: 9 | H481: 6 | I481: =G481*6+H481 -> 60 | K481: 14 | L481: 10 | M481: =K481*6+L481 -> 94 | O481: 19 | P481: 18 | Q481: =O481*6+P481 -> 132 | S481: STIRLING
A482: BEST PLAYERS | W482: TEAM | X482: W | Y482: L | Z482: D | AA482: FOR | AB482: AGST | AC482: % | AD482: PTS
A483: OAKLEIGH | D483: CLOKE | G483: ROBBINS | J483: BILLING | M483: STEWART | P483: WENN | R483: COLCOTT
A484: PORT MELBOURNE | D484: COOK | G484: ANDERSON | J484: BECKWITH | M484: HOLT | P484: COLLINS | R484: MALLETT | W484: OAKLEIGH | X484: 9 | Y484: 2 | Z484: 0 | AA484: 1319 | AB484: 1113 | AC484: 118.50853548966757 | AD484: 36
A485: GOALKICKERS | W485: PRAHRAN | X485: 7 | Y485: 3 | Z485: 1 | AA485: 1412 | AB485: 1210 | AC485: 116.69421487603306 | AD485: 30
A486: OAKLEIGH | D486: CLOKE 7 | G486: COLCOTT 5 | J486: TAYLOR 4 | M486: MURNANE 3 | P486: ROBBINS | R486: STEPHENS | W486: DANDENONG | X486: 7 | Y486: 3 | Z486: 1 | AA486: 1262 | AB486: 1121 | AC486: 112.57805530776093 | AD486: 30
A487: PORT MELBOURNE | D487: COOK 9 | F487: ANDERSON 3 | I487: SWINSTEAD 2 | L487: HOLT | M487: BEHAN | O487: O'BRIEN | Q487: BECKWITH | S487: HARLAND | W487: PORT MELBOURNE | X487: 7 | Y487: 4 | Z487: 0 | AA487: 1294 | AB487: 1232 | AC487: 105.03246753246754 | AD487: 28
A489: DANDENONG | C489: 2 | D489: 2 | E489: =C489*6+D489 -> 14 | G489: 9 | H489: 4 | I489: =G489*6+H489 -> 58 | K489: 17 | L489: 11 | M489: =K489*6+L489 -> 113 | O489: 19 | P489: 16 | Q489: =O489*6+P489 -> 130 | S489: PRESTON | W489: GEELONG WEST | X489: 6 | Y489: 5 | Z489: 0 | AA489: 1234 | AB489: 1132 | AC489: 109.01060070671377 | AD489: 24
A490: PRESTON | C490: 6 | D490: 5 | E490: =C490*6+D490 -> 41 | G490: 11 | H490: 6 | I490: =G490*6+H490 -> 72 | K490: 15 | L490: 7 | M490: =K490*6+L490 -> 97 | O490: 19 | P490: 9 | Q490: =O490*6+P490 -> 123 | S490: GAMBETTA | W490: PRESTON | X490: 4 | Y490: 7 | Z490: 0 | AA490: 1298 | AB490: 1265 | AC490: 102.60869565217391 | AD490: 16
A491: BEST PLAYERS | W491: SANDRINGHAM | X491: 4 | Y491: 7 | Z491: 0 | AA491: 1177 | AB491: 1383 | AC491: 85.104844540853222 | AD491: 16
A492: DANDENONG | D492: EVANS | F492: MILLER | I492: FLAHERTY | L492: ORCHARD | O492: HIBBERT | R492: KENDALL | W492: SUNSHINE | X492: 4 | Y492: 7 | Z492: 0 | AA492: 1119 | AB492: 1378 | AC492: 81.204644412191584 | AD492: 16
A493: PRESTON | D493: CLARK | F493: VICKERY | I493: SHAW | L493: MARTIN | O493: WEIGHTMAN | R493: SLATER | W493: COBURG | X493: 2 | Y493: 7 | Z493: 2 | AA493: 1146 | AB493: 1268 | AC493: 90.378548895899058 | AD493: 12
A494: GOALKICKERS | W494: WILLIAMSTOWN | X494: 3 | Y494: 8 | Z494: 0 | AA494: 1122 | AB494: 1281 | AC494: 87.587822014051525 | AD494: 12
A495: DANDENONG | D495: MILLER 7 | F495: FLAHERTY 5 | I495: BOND 2 | K495: HIBBERT | M495: EVANS | O495: REID | Q495: ELLIS | S495: KENDALL
A496: PRESTON | D496: CLARK 8 | F496: VICKERY 4 | I496: SHAW 3 | K496: McGAW 2 | N496: SLATER | P496: GORDON
A498: PRAHRAN | C498: 2 | D498: 10 | E498: =C498*6+D498 -> 22 | G498: 7 | H498: 13 | I498: =G498*6+H498 -> 55 | K498: 12 | L498: 15 | M498: =K498*6+L498 -> 87 | O498: 20 | P498: 19 | Q498: =O498*6+P498 -> 139 | S498: TOORAK PARK
A499: COBURG | C499: 3 | D499: 3 | E499: =C499*6+D499 -> 21 | G499: 5 | H499: 6 | I499: =G499*6+H499 -> 36 | K499: 8 | L499: 9 | M499: =K499*6+L499 -> 57 | O499: 11 | P499: 11 | Q499: =O499*6+P499 -> 77 | S499: FLANAGAN
A500: BEST PLAYERS
A501: PRAHRAN | D501: WEEKES | G501: RIPPON | J501: SINCLAIR | M501: O'BRIEN | P501: APPLETON | S501: SMITH
A502: COBURG | D502: ERWIN | G502: MORRISON | J502: HOBBS | M502: MANNIX | P502: ARTHURSON | S502: ELVERY
A503: GOALKICKERS
A504: PRAHRAN | D504: SINCLAIR 4 | G504: SMITH 4 | I504: McFARLANE 4 | L504: APPLETON 3 | O504: WRIGHT 2 | R504: TOWNSEND | U504: WEEKES | W504: LANGDON
A505: COBURG | D505: S McCARTHY 4 | G505: MORRISON 3 | J505: LAKE | L505: KIRKMAN | N505: O'BRIEN | P505: ERWIN
A507: SANDRINGHAM | C507: 4 | D507: 9 | E507: =C507*6+D507 -> 33 | G507: 10 | H507: 10 | I507: =G507*6+H507 -> 70 | K507: 13 | L507: 13 | M507: =K507*6+L507 -> 91 | O507: 19 | P507: 16 | Q507: =O507*6+P507 -> 130 | S507: WILLIAMSTOWN
A508: WILLIAMSTOWN | C508: 0 | D508: 3 | E508: =C508*6+D508 -> 3 | G508: 6 | H508: 9 | I508: =G508*6+H508 -> 45 | K508: 12 | L508: 11 | M508: =K508*6+L508 -> 83 | O508: 13 | P508: 19 | Q508: =O508*6+P508 -> 97 | S508: STABB
A509: BEST PLAYERS
A510: SANDRINGHAM | D510: I COOPER | G510: MURPHY | J510: SPURRELL | M510: TOMS | P510: BROWNE | S510: WARD
A511: WILLIAMSTOWN | D511: GILL | G511: FENTON | J511: WARBURTON | M511: THOMPSON | P511: L STILLMAN | S511: RADZIMINSKI
A512: GOALKICKERS
A513: SANDRINGHAM | D513: I COOPER 12 | G513: MURPHY 3 | J513: WARD 2 | L513: SCHOLES | N513: TREGEAR
A514: WILLIAMSTOWN | D514: BOXALL 3 | G514: MULLIGAN 3 | J514: COLLINS 2 | M514: SCOTT 2 | O514: WARBURTON | R514: L STILLMAN | U514: N STILLMAN
A516: SUNSHINE | C516: 4 | D516: 5 | E516: =C516*6+D516 -> 29 | G516: 6 | H516: 8 | I516: =G516*6+H516 -> 44 | K516: 12 | L516: 10 | M516: =K516*6+L516 -> 82 | O516: 20 | P516: 14 | Q516: =O516*6+P516 -> 134 | S516: GEELONG WEST
A517: GEELONG WEST | C517: 4 | D517: 4 | E517: =C517*6+D517 -> 28 | G517: 9 | H517: 7 | I517: =G517*6+H517 -> 61 | K517: 14 | L517: 10 | M517: =K517*6+L517 -> 94 | O517: 15 | P517: 14 | Q517: =O517*6+P517 -> 104 | S517: O'BRIEN
A518: BEST PLAYERS
A519: SUNSHINE | D519: L CRAWFORD | G519: R CRAWFORD | J519: LLOYD | M519: TOULMIN | P519: CLARKE | R519: GOOLD
A520: GEELONG WEST | D520: DEEATH | G520: GOGGIN | J520: GILLIES | M520: HARRIS | P520: McLEAN | R520: LINKE
A521: GOALKICKERS
A522: SUNSHINE | D522: R CRAWFORD 7 | G522: L CRAWFORD 5 | J522: WAGLAND 3 | M522: GOOLD 2 | O522: RUSSELL 2 | R522: BENSON
A523: GEELONG WEST | D523: McLEAN 6 | G523: JONES 2 | I523: GOGGIN 2 | K523: WARREN 2 | N523: HARRIS | P523: DEEATH | R523: FORSTER
A525: ROUND 12 | E525: 15TH JULY | J525: WEATHER | N525: NORTH WIND | S525: PLAYED AT
D526: 1ST QTR | H526: 2ND QTR | L526: 3RD QTR | P526: FINAL | S526: OAKLEIGH
A527: OAKLEIGH | C527: 2 | D527: 3 | E527: =C527*6+D527 -> 15 | G527: 8 | H527: 8 | I527: =G527*6+H527 -> 56 | K527: 11 | L527: 13 | M527: =K527*6+L527 -> 79 | O527: 20 | P527: 19 | Q527: =O527*6+P527 -> 139 | S527: UMPIRE | X527: LADDER | AB527: ROUND | AD527: 12
A528: DANDENONG | C528: 7 | D528: 4 | E528: =C528*6+D528 -> 46 | G528: 11 | H528: 8 | I528: =G528*6+H528 -> 74 | K528: 14 | L528: 14 | M528: =K528*6+L528 -> 98 | O528: 15 | P528: 15 | Q528: =O528*6+P528 -> 105 | S528: HAYES
A529: BEST PLAYERS | W529: TEAM | X529: W | Y529: L | Z529: D | AA529: FOR | AB529: AGST | AC529: % | AD529: PTS
A530: OAKLEIGH | D530: BILLING | F530: FORD | I530: BARR | K530: P LILLEY | N530: COLCOTT | Q530: ROBBINS
A531: DANDENONG | D531: BECK | F531: FIELDER | I531: MILLER | K531: DARLEY | N531: ESLER | Q531: FLAHERTY | W531: OAKLEIGH | X531: 10 | Y531: 2 | Z531: 0 | AA531: 1458 | AB531: 1218 | AC531: 119.70443349753694 | AD531: 40
A532: GOALKICKERS | Q532: TAYLOR | S532: FORD | W532: PRAHRAN | X532: 7 | Y532: 4 | Z532: 1 | AA532: 1525 | AB532: 1332 | AC532: 114.48948948948949 | AD532: 30
A533: OAKLEIGH | D533: COLCOTT 4 | F533: BARR 3 | H533: MURNANE 3 | K533: QUINN 2 | M533: BILLING 2 | O533: WENN 2 | Q533: CLOKE | S533: ROBBINS | W533: DANDENONG | X533: 7 | Y533: 4 | Z533: 1 | AA533: 1367 | AB533: 1260 | AC533: 108.49206349206349 | AD533: 30
A534: DANDENONG | D534: MILLER 9 | G534: ELLIS 2 | I534: BOND 2 | K534: FLAHERTY | M534: REID | W534: PORT MELBOURNE | X534: 7 | Y534: 5 | Z534: 0 | AA534: 1408 | AB534: 1377 | AC534: 102.25127087872185 | AD534: 28
A536: PRESTON | C536: 5 | D536: 4 | E536: =C536*6+D536 -> 34 | G536: 13 | H536: 6 | I536: =G536*6+H536 -> 84 | K536: 18 | L536: 9 | M536: =K536*6+L536 -> 117 | O536: 22 | P536: 13 | Q536: =O536*6+P536 -> 145 | S536: PRESTON | W536: GEELONG WEST | X536: 6 | Y536: 6 | Z536: 0 | AA536: 1323 | AB536: 1255 | AC536: 105.41832669322709 | AD536: 24
A537: PORT MELBOURNE | C537: 5 | D537: 7 | E537: =C537*6+D537 -> 37 | G537: 9 | H537: 11 | I537: =G537*6+H537 -> 65 | K537: 15 | L537: 17 | M537: =K537*6+L537 -> 107 | O537: 16 | P537: 18 | Q537: =O537*6+P537 -> 114 | S537: TORNEY | W537: PRESTON | X537: 5 | Y537: 7 | Z537: 0 | AA537: 1443 | AB537: 1379 | AC537: 104.64104423495286 | AD537: 20
A538: BEST PLAYERS | W538: SANDRINGHAM | X538: 5 | Y538: 7 | Z538: 0 | AA538: 1300 | AB538: 1472 | AC538: 88.315217391304344 | AD538: 20
A539: PRESTON | D539: SHAW | G539: SLATER | I539: LESLIE | L539: WEIGHTMAN | O539: GORDON | Q539: McGAW | W539: SUNSHINE | X539: 5 | Y539: 7 | Z539: 0 | AA539: 1248 | AB539: 1488 | AC539: 83.870967741935488 | AD539: 20
A540: PORT MELBOURNE | D540: COLLINS | G540: HOLT | I540: ANDERSON | L540: MALLET | O540: P GOSS | Q540: ALLEN | W540: WILLIAMSTOWN | X540: 4 | Y540: 8 | Z540: 0 | AA540: 1244 | AB540: 1394 | AC540: 89.23959827833572 | AD540: 16
A541: GOALKICKERS | W541: COBURG | X541: 2 | Y541: 8 | Z541: 2 | AA541: 1256 | AB541: 1397 | AC541: 89.906943450250537 | AD541: 12
A542: PRESTON | D542: CLARK 7 | F542: SHAW 6 | H542: IRELAND 3 | J542: JOHNSTON 2 | M542: SLATER | O542: McGAW | Q542: WEIGHTMAN | T542: GORDON
A543: PORT MELBOURNE | D543: BECKWITH 4 | G543: HOLT 3 | I543: SMITH 2 | K543: ANDERSON 2 | N543: COOK 2 | P543: WILLIAMS 2 | S543: P GOSS
A545: SANDRINGHAM | C545: 2 | D545: 2 | E545: =C545*6+D545 -> 14 | G545: 6 | H545: 11 | I545: =G545*6+H545 -> 47 | K545: 7 | L545: 15 | M545: =K545*6+L545 -> 57 | O545: 17 | P545: 21 | Q545: =O545*6+P545 -> 123 | S545: BEACH ROAD
A546: GEELONG WEST | C546: 5 | D546: 2 | E546: =C546*6+D546 -> 32 | G546: 8 | H546: 4 | I546: =G546*6+H546 -> 52 | K546: 12 | L546: 9 | M546: =K546*6+L546 -> 81 | O546: 13 | P546: 11 | Q546: =O546*6+P546 -> 89 | S546: MARKS
A547: BEST PLAYERS
A548: SANDRINGHAM | D548: SPURRELL | G548: TREGEAR | J548: NICHOLSON | M548: SCHOLES | P548: BRENNER | S548: TOMS
A549: GEELONG WEST | D549: M BROWNE | G549: BARRY | J549: GILLIES | M549: K TAYLOR | P549: JONES | S549: HARRIS
A550: GOALKICKERS
A551: SANDRINGHAM | D551: I COOPER 5 | G551: WARD 4 | I551: SCHWARZMAN 3 | M551: SCHOLES 2 | P551: NICHOLSON 2 | S551: TREGEAR
A552: GEELONG WEST | D552: McLEAN 6 | G552: JONES 2 | I552: HARRIS 2 | K552: R BROWNE | N552: K TAYLOR | Q552: WARREN
A554: SUNSHINE | C554: 6 | D554: 8 | E554: =C554*6+D554 -> 44 | G554: 9 | H554: 10 | I554: =G554*6+H554 -> 64 | K554: 16 | L554: 14 | M554: =K554*6+L554 -> 110 | O554: 19 | P554: 15 | Q554: =O554*6+P554 -> 129 | S554: COBURG
A555: COBURG | C555: 1 | D555: 3 | E555: =C555*6+D555 -> 9 | G555: 7 | H555: 13 | I555: =G555*6+H555 -> 55 | K555: 11 | L555: 14 | M555: =K555*6+L555 -> 80 | O555: 15 | P555: 20 | Q555: =O555*6+P555 -> 110 | S555: STIRLING
A556: BEST PLAYERS
A557: SUNSHINE | D557: BENSON | G557: WOODS | J557: CLARKE | M557: LLOYD | P557: GOOLD | S557: L CRAWFORD
A558: COBURG | D558: LAKE | G558: MANNIX | J558: PAUL | M558: BREEN | P558: ROBINSON
A559: GOALKICKERS
A560: SUNSHINE | D560: L CRAWFORD 4 | G560: BENSON 3 | I560: WAGLAND 2 | L560: LLOYD 2 | N560: TOULMIN 2 | Q560: R CRAWFORD 2 | U560: SLADDIN | X560: GOOLD | Z560: PAYNE | AB560: RUSSELL
A561: COBURG | D561: LAKE 4 | G561: PAUL 3 | I561: S McCARTHY 3 | L561: BREEN 2 | N561: HOWELL | P561: CURWOOD | S561: MANNIX
A563: WILLIAMSTOWN | C563: 3 | D563: 2 | E563: =C563*6+D563 -> 20 | G563: 7 | H563: 7 | I563: =G563*6+H563 -> 49 | K563: 15 | L563: 8 | M563: =K563*6+L563 -> 98 | O563: 18 | P563: 14 | Q563: =O563*6+P563 -> 122 | S563: TOORAK PARK
A564: PRAHRAN | C564: 4 | D564: 3 | E564: =C564*6+D564 -> 27 | G564: 6 | H564: 5 | I564: =G564*6+H564 -> 41 | K564: 10 | L564: 11 | M564: =K564*6+L564 -> 71 | O564: 16 | P564: 17 | Q564: =O564*6+P564 -> 113 | S564: CHINN
A565: BEST PLAYERS
A566: WILLIAMSTOWN | D566: BOXALL | G566: PERCY | J566: MULLIGAN | M566: GILL | O566: L STILLMAN | R566: HEMLEY
A567: PRAHRAN | D567: SINCLAIR | G567: RIPPON | J567: GUNN | M567: O'BRIEN | O567: GRANGE | R567: TOWNSEND
A568: GOALKICKERS
A569: WILLIAMSTOWN | D569: BOXALL 6 | F569: HEMLEY 3 | I569: MULLIGAN 2 | L569: COLLINS 2 | N569: PERCY 2 | P569: JARRARD | R569: RADZIMINSKI | U569: WARBURTON
A570: PRAHRAN | D570: WRIGHT 3 | F570: APPLETON 2 | I570: TOWNSEND 2 | L570: PAYNE 2 | N570: SMITH 2 | P570: LANGDON | R570: O'BRIEN | T570: SINCLAIR | W570: PIROUET | Y570: EMSELLE
A572: ROUND 13 | E572: 22ND JULY | J572: WEATHER | N572: LIGHT BREEZE DULL | S572: PLAYED AT
D573: 1ST QTR | H573: 2ND QTR | L573: 3RD QTR | P573: FINAL | S573: PORT MELBOURNE
A574: PORT MELBOURNE | C574: 7 | D574: 4 | E574: =C574*6+D574 -> 46 | G574: 13 | H574: 8 | I574: =G574*6+H574 -> 86 | K574: 18 | L574: 10 | M574: =K574*6+L574 -> 118 | O574: 23 | P574: 16 | Q574: =O574*6+P574 -> 154 | S574: UMPIRE | X574: LADDER | AB574: ROUND | AD574: 13
A575: PRAHRAN | C575: 3 | D575: 2 | E575: =C575*6+D575 -> 20 | G575: 4 | H575: 10 | I575: =G575*6+H575 -> 34 | K575: 10 | L575: 15 | M575: =K575*6+L575 -> 75 | O575: 13 | P575: 17 | Q575: =O575*6+P575 -> 95 | S575: GAMBETTA
A576: BEST PLAYERS | W576: TEAM | X576: W | Y576: L | Z576: D | AA576: FOR | AB576: AGST | AC576: % | AD576: PTS
A577: PORT MELBOURNE | D577: PROFFIT | G577: BECKWITH | J577: COOK | L577: BROWN | N577: JENSEN | Q577: STEVENSON
A578: PRAHRAN | D578: SINCLAIR | G578: RUMNEY | J578: SMITH | L578: LANGDON | N578: TOWNSEND | Q578: ANDERSON | W578: OAKLEIGH | X578: 10 | Y578: 3 | Z578: 0 | AA578: 1538 | AB578: 1335 | AC578: 115.2059925093633 | AD578: 40
A579: GOALKICKERS | S579: COLLINS | W579: DANDENONG | X579: 8 | Y579: 4 | Z579: 1 | AA579: 1493 | AB579: 1339 | AC579: 111.50112023898431 | AD579: 34
A580: PORT MELBOURNE | D580: COOK 9 | F580: HOLT 3 | H580: WILLIAMS 3 | K580: BECKWITH 2 | N580: GOSS 2 | P580: ANDERSON | R580: O'BRIEN | T580: McKAY | W580: PORT MELBOURNE | X580: 8 | Y580: 5 | Z580: 0 | AA580: 1562 | AB580: 1472 | AC580: 106.11413043478261 | AD580: 32
A581: PRAHRAN | D581: RUMNEY 5 | F581: SINCLAIR 2 | I581: APPLETON 2 | L581: WEEKES | N581: TOWNSEND | Q581: SMITH | S581: RIPPON | W581: PRAHRAN | X581: 7 | Y581: 5 | Z581: 1 | AA581: 1620 | AB581: 1486 | AC581: 109.01749663526245 | AD581: 30
A583: GEELONG WEST | C583: 6 | D583: 5 | E583: =C583*6+D583 -> 41 | G583: 12 | H583: 7 | I583: =G583*6+H583 -> 79 | K583: 17 | L583: 12 | M583: =K583*6+L583 -> 114 | O583: 22 | P583: 13 | Q583: =O583*6+P583 -> 145 | S583: GEELONG WEST | W583: GEELONG WEST | X583: 7 | Y583: 6 | Z583: 0 | AA583: 1468 | AB583: 1393 | AC583: 105.3840631730079 | AD583: 28
A584: PRESTON | C584: 4 | D584: 3 | E584: =C584*6+D584 -> 27 | G584: 11 | H584: 8 | I584: =G584*6+H584 -> 74 | K584: 16 | L584: 11 | M584: =K584*6+L584 -> 107 | O584: 21 | P584: 12 | Q584: =O584*6+P584 -> 138 | S584: STABB | W584: SUNSHINE | X584: 6 | Y584: 7 | Z584: 0 | AA584: 1365 | AB584: 1568 | AC584: 87.053571428571431 | AD584: 24
A585: BEST PLAYERS | W585: PRESTON | X585: 5 | Y585: 8 | Z585: 0 | AA585: 1581 | AB585: 1524 | AC585: 103.74015748031496 | AD585: 20
A586: GEELONG WEST | D586: McLEAN | G586: R BROWNE | J586: VAN ELDEN | M586: WOOD | O586: JONES | R586: DEEATH | W586: WILLIAMSTOWN | X586: 5 | Y586: 8 | Z586: 0 | AA586: 1339 | AB586: 1468 | AC586: 91.212534059945497 | AD586: 20
A587: PRESTON | D587: SHAW | G587: CLARK | J587: WEIGHTMAN | M587: IRELAND | O587: JOHNSTON | R587: LESLIE | W587: SANDRINGHAM | X587: 5 | Y587: 8 | Z587: 0 | AA587: 1379 | AB587: 1598 | AC587: 86.295369211514398 | AD587: 20
A588: GOALKICKERS | W588: COBURG | X588: 2 | Y588: 9 | Z588: 2 | AA588: 1330 | AB588: 1492 | AC588: 89.142091152815013 | AD588: 12
A589: GEELONG WEST | D589: McLEAN 12 | G589: WARREN 2 | J589: JONES 2 | L589: R BROWNE 2 | O589: HARRIS 2 | Q589: WOOD | S589: M BROWNE
A590: PRESTON | D590: SHAW 7 | F590: CLARK 7 | I590: WEIGHTMAN 2 | L590: JOHNSTON 2 | O590: IRELAND | Q590: STEVENS | S590: GORDON
A592: DANDENONG | C592: 3 | D592: 4 | E592: =C592*6+D592 -> 22 | G592: 6 | H592: 5 | I592: =G592*6+H592 -> 41 | K592: 13 | L592: 8 | M592: =K592*6+L592 -> 86 | O592: 19 | P592: 12 | Q592: =O592*6+P592 -> 126 | S592: DANDENONG
A593: SANDRINGHAM | C593: 3 | D593: 1 | E593: =C593*6+D593 -> 19 | G593: 4 | H593: 4 | I593: =G593*6+H593 -> 28 | K593: 8 | L593: 6 | M593: =K593*6+L593 -> 54 | O593: 12 | P593: 7 | Q593: =O593*6+P593 -> 79 | S593: ABBOTT
A594: BEST PLAYERS
A595: DANDENONG | D595: ORCHARD | G595: FIELDER | J595: BECK | M595: MILLER | O595: MUIR | R595: HIBBERT
A596: SANDRINGHAM | D596: KENNEDY | G596: CUMMINGS | J596: I COOPER | M596: TOMS | O596: SPURRELL | R596: C COOPER
A597: GOALKICKERS
A598: DANDENONG | D598: MILLER 11 | G598: FLAHERTY 3 | J598: ELLIS 2 | M598: DAVIES 2 | P598: HIBBERT
A599: SANDRINGHAM | D599: I COOPER 7 | G599: WARD 2 | J599: SPURRELL | M599: SCHOLES | O599: TREGEAR
A601: WILLIAMSTOWN | C601: 6 | D601: 8 | E601: =C601*6+D601 -> 44 | G601: 8 | H601: 12 | I601: =G601*6+H601 -> 60 | K601: 10 | L601: 20 | M601: =K601*6+L601 -> 80 | O601: 12 | P601: 23 | Q601: =O601*6+P601 -> 95 | S601: WILLIAMSTOWN
A602: COBURG | C602: 1 | D602: 3 | E602: =C602*6+D602 -> 9 | G602: 4 | H602: 5 | I602: =G602*6+H602 -> 29 | K602: 5 | L602: 11 | M602: =K602*6+L602 -> 41 | O602: 10 | P602: 14 | Q602: =O602*6+P602 -> 74 | S602: HAYES
A603: BEST PLAYERS
A604: WILLIAMSTOWN | D604: THOMPSON | G604: COLLINS | J604: HANNEBURY | M604: PERCY | O604: HEMLEY | Q604: BOXALL
A605: COBURG | D605: MANNIX | G605: HOBBS | J605: P McCARTHY | M605: GALE | O605: DOOLAN | Q605: ERWIN
A606: GOALKICKERS
A607: WILLIAMSTOWN | D607: BOXALL 6 | G607: MULLIGAN 3 | J607: PERCY 2 | M607: N STILLMAN
A608: COBURG | D608: ERWIN 4 | G608: MANNIX 2 | J608: McGRATH | M608: S McCARTHY | P608: HOBBS | R608: MORRISON
A610: SUNSHINE | C610: 3 | D610: 1 | E610: =C610*6+D610 -> 19 | G610: 7 | H610: 5 | I610: =G610*6+H610 -> 47 | K610: 12 | L610: 12 | M610: =K610*6+L610 -> 84 | O610: 17 | P610: 15 | Q610: =O610*6+P610 -> 117 | S610: SUNSHINE
A611: OAKLEIGH | C611: 3 | D611: 3 | E611: =C611*6+D611 -> 21 | G611: 5 | H611: 11 | I611: =G611*6+H611 -> 41 | K611: 7 | L611: 13 | M611: =K611*6+L611 -> 55 | O611: 11 | P611: 14 | Q611: =O611*6+P611 -> 80 | S611: McBAIN
A612: BEST PLAYERS
A613: SUNSHINE | D613: WOODS | G613: BENSON | J613: GOOLD | M613: L CRAWFORD | P613: R CRAWFORD | S613: LLOYD
A614: OAKLEIGH | D614: ROBBINS | G614: BILLING | J614: T QUINN | M614: CLOKE | P614: STEWART | S614: NISBET
A615: GOALKICKERS
A616: SUNSHINE | D616: R CRAWFORD 6 | H616: BENSON 2 | J616: McKENZIE 2 | M616: PRITCHARD 2 | P616: WAGLAND 2 | S616: SLADDIN 2 | V616: LLOYD
A617: OAKLEIGH | D617: HALLIDAY 4 | G617: ROBBINS 2 | J617: MURNANE | M617: BARR | N617: O'KANE | P617: TAYLOR | R617: SMITH
A619: ROUND 14 | E619: 29TH JULY | J619: WEATHER | N619: NORTH WIND | S619: PLAYED AT | X619: LADDER | AB619: ROUND | AD619: 14
D620: 1ST QTR | H620: 2ND QTR | L620: 3RD QTR | P620: FINAL | S620: PORT MELBOURNE
A621: DANDENONG | C621: 4 | D621: 1 | E621: =C621*6+D621 -> 25 | G621: 9 | H621: 3 | I621: =G621*6+H621 -> 57 | K621: 12 | L621: 9 | M621: =K621*6+L621 -> 81 | O621: 23 | P621: 15 | Q621: =O621*6+P621 -> 153 | S621: UMPIRE | W621: TEAM | X621: W | Y621: L | Z621: D | AA621: FOR | AB621: AGST | AC621: % | AD621: PTS
A622: PORT MELBOURNE | C622: 5 | D622: 3 | E622: =C622*6+D622 -> 33 | G622: 6 | H622: 10 | I622: =G622*6+H622 -> 46 | K622: 11 | L622: 15 | M622: =K622*6+L622 -> 81 | O622: 14 | P622: 19 | Q622: =O622*6+P622 -> 103 | S622: STIRLING
A623: BEST PLAYERS | W623: OAKLEIGH | X623: 10 | Y623: 4 | Z623: 0 | AA623: 1612 | AB623: 1430 | AC623: 112.72727272727273 | AD623: 40
A624: DANDENONG | D624: BECK | G624: HIBBERT | J624: REID | M624: ESLER | O624: KENDALL | R624: HARRINGTON | W624: DANDENONG | X624: 9 | Y624: 4 | Z624: 1 | AA624: 1646 | AB624: 1442 | AC624: 114.14701803051318 | AD624: 38
A625: PORT MELBOURNE | D625: ANDERSON | G625: HOLT | J625: MALLETT | M625: FRENCH | O625: PROFFIT | R625: STEVENSON | W625: PRAHRAN | X625: 8 | Y625: 5 | Z625: 1 | AA625: 1764 | AB625: 1577 | AC625: 111.85795814838301 | AD625: 34
A626: GOALKICKERS | W626: PORT MELBOURNE | X626: 8 | Y626: 6 | Z626: 0 | AA626: 1665 | AB626: 1625 | AC626: 102.46153846153847 | AD626: 32
A627: DANDENONG | D627: MILLER 6 | G627: BOND 5 | J627: REID 5 | L627: FLAHERTY 4 | O627: ELLIS | Q627: KENDALL | S627: DAVIES
A628: PORT MELBOURNE | D628: COOK 4 | G628: ANDERSON 4 | J628: P GOSS 2 | M628: WILLIAMS 2 | P628: ALLEN | R628: HOLT | W628: GEELONG WEST | X628: 7 | Y628: 7 | Z628: 0 | AA628: 1542 | AB628: 1507 | AC628: 102.32249502322495 | AD628: 28
W629: WILLIAMSTOWN | X629: 6 | Y629: 8 | Z629: 0 | AA629: 1453 | AB629: 1542 | AC629: 94.228274967574578 | AD629: 24
A630: PRAHRAN | C630: 7 | D630: 4 | E630: =C630*6+D630 -> 46 | G630: 11 | H630: 8 | I630: =G630*6+H630 -> 74 | K630: 16 | L630: 17 | M630: =K630*6+L630 -> 113 | O630: 21 | P630: 18 | Q630: =O630*6+P630 -> 144 | S630: TOORAK PARK | W630: SANDRINGHAM | X630: 6 | Y630: 8 | Z630: 0 | AA630: 1493 | AB630: 1678 | AC630: 88.974970202622174 | AD630: 24
A631: PRESTON | C631: 5 | D631: 1 | E631: =C631*6+D631 -> 31 | G631: 8 | H631: 5 | I631: =G631*6+H631 -> 53 | K631: 13 | L631: 6 | M631: =K631*6+L631 -> 84 | O631: 13 | P631: 13 | Q631: =O631*6+P631 -> 91 | S631: MARKS | W631: SUNSHINE | X631: 6 | Y631: 8 | Z631: 0 | AA631: 1445 | AB631: 1682 | AC631: 85.909631391200946 | AD631: 24
A632: BEST PLAYERS | W632: PRESTON | X632: 5 | Y632: 9 | Z632: 0 | AA632: 1672 | AB632: 1668 | AC632: 100.23980815347721 | AD632: 20
A633: PRAHRAN | D633: EMSELLE | G633: ROLFE | J633: PAYNE | M633: GRANGE | P633: CULPIN | R633: RIPPON | W633: COBURG | X633: 3 | Y633: 9 | Z633: 2 | AA633: 1425 | AB633: 1566 | AC633: 90.996168582375475 | AD633: 16
A634: PRESTON | D634: WEIGHTMAN | G634: MARTIN | J634: MARKS | M634: JOHNSTON | P634: IRELAND | R634: SHAW
A635: GOALKICKERS
A636: PRAHRAN | D636: PAYNE 6 | F636: WEEKES 3 | I636: RUMNEY 2 | K636: APPLETON 2 | N636: SINCLAIR 2 | Q636: TOWNSEND 2 | T636: SMITH 2 | W636: ROLFE | X636: McFARLANE
A637: PRESTON | D637: WEIGHTMAN 6 | G637: JOHNSTON 2 | J637: SLATER 2 | M637: STEVENS | O637: CLARK | Q637: GORDON
A639: WILLIAMSTOWN | C639: 2 | D639: 4 | E639: =C639*6+D639 -> 16 | G639: 6 | H639: 10 | I639: =G639*6+H639 -> 46 | K639: 14 | L639: 14 | M639: =K639*6+L639 -> 98 | O639: 16 | P639: 18 | Q639: =O639*6+P639 -> 114 | S639: WILLIAMSTOWN
A640: GEELONG WEST | C640: 4 | D640: 1 | E640: =C640*6+D640 -> 25 | G640: 8 | H640: 4 | I640: =G640*6+H640 -> 52 | K640: 9 | L640: 5 | M640: =K640*6+L640 -> 59 | O640: 10 | P640: 13 | Q640: =O640*6+P640 -> 73 | S640: McBAIN
A641: BEST PLAYERS
A642: WILLIAMSTOWN | D642: L STILLMAN | G642: HANNEBURY | J642: COURTOT | M642: PERCY | O642: RADZIMINSKI | R642: PATTERSON
A643: GEELONG WEST | D643: VAN ELDEN | G643: R BROWNE | J643: HARRIS | M643: WARREN | O643: JONES | R643: WOOD
A644: GOALKICKERS
A645: WILLIAMSTOWN | D645: L STILLMAN 5 | G645: BOXALL 3 | J645: COLLINS 2 | M645: WARBURTON 2 | P645: JACKMAN 2 | S645: HEMLEY | U645: HANNEBURY
A646: GEELONG WEST | D646: McLEAN 4 | G646: JONES 3 | I646: MANSON | K646: HARRIS | M646: WARREN
A648: SANDRINGHAM | C648: 2 | D648: 2 | E648: =C648*6+D648 -> 14 | G648: 11 | H648: 7 | I648: =G648*6+H648 -> 73 | K648: 12 | L648: 9 | M648: =K648*6+L648 -> 81 | O648: 17 | P648: 12 | Q648: =O648*6+P648 -> 114 | S648: BEACH ROAD
A649: SUNSHINE | C649: 3 | D649: 6 | E649: =C649*6+D649 -> 24 | G649: 4 | H649: 7 | I649: =G649*6+H649 -> 31 | K649: 8 | L649: 16 | M649: =K649*6+L649 -> 64 | O649: 10 | P649: 20 | Q649: =O649*6+P649 -> 80 | S649: GAMBETTA
A650: BEST PLAYERS
A651: SANDRINGHAM | D651: McNICHOLAS | G651: NICHOLSON | J651: LIPSCOMBE | M651: BROWNE | P651: RUDD | R651: SCHOLES
A652: SUNSHINE | D652: WOODS | G652: LLOYD | J652: GOOLD | M652: CHADWICK | P652: McKENZIE | R652: HALL
A653: GOALKICKERS
A654: SANDRINGHAM | D654: RUDD 4 | F654: I COOPER 3 | I654: KENNEDY 2 | L654: NICHOLSON 2 | O654: LIPSCOMBE 2 | R654: SCHOLES | U654: TREGEAR | X654: BROWNE | AA654: EDWARDS
A655: SUNSHINE | D655: McKENZIE 5 | G655: R CRAWFORD | J655: NEISH | L655: LLOYD | N655: CHADWICK | Q655: SAMPSON
A657: COBURG | C657: 0 | D657: 5 | E657: =C657*6+D657 -> 5 | G657: 6 | H657: 9 | I657: =G657*6+H657 -> 45 | K657: 9 | L657: 13 | M657: =K657*6+L657 -> 67 | O657: 13 | P657: 17 | Q657: =O657*6+P657 -> 95 | S657: OAKLEIGH
A658: OAKLEIGH | C658: 3 | D658: 2 | E658: =C658*6+D658 -> 20 | G658: 4 | H658: 8 | I658: =G658*6+H658 -> 32 | K658: 7 | L658: 12 | M658: =K658*6+L658 -> 54 | O658: 10 | P658: 14 | Q658: =O658*6+P658 -> 74 | S658: ABBOTT
A659: BEST PLAYERS
A660: COBURG | D660: McGRATH | G660: MANNIX | J660: HOBBS | M660: HOWELL | P660: LAKE | R660: ARTHURSON
A661: OAKLEIGH | D661: ROBBINS | G661: B SMITH | J661: T QUINN | M661: BILLING | P661: BARR | R661: NESBIT
A662: GOALKICKERS
A663: COBURG | D663: McGRATH 7 | G663: HOWELL | I663: GALE | K663: FEDLEY | M663: MANNIX | O663: S McCARTHY | R663: HOBBS
A664: OAKLEIGH | D664: COLCOTT 4 | G664: B SMITH 2 | J664: MURNANE 2 | M664: TAYLOR | O664: CLOKE
A666: ROUND 15 | E666: 5TH AUGUST | J666: WEATHER | N666: NORTH WIND | S666: PLAYED AT
D667: 1ST QTR | H667: 2ND QTR | L667: 3RD QTR | P667: FINAL | S667: OAKLEIGH
A668: OAKLEIGH | C668: 7 | D668: 0 | E668: =C668*6+D668 -> 42 | G668: 12 | H668: 4 | I668: =G668*6+H668 -> 76 | K668: 19 | L668: 7 | M668: =K668*6+L668 -> 121 | O668: 23 | P668: 12 | Q668: =O668*6+P668 -> 150 | S668: UMPIRE | X668: LADDER | AB668: ROUND | AD668: 15
A669: PRAHRAN | C669: 5 | D669: 4 | E669: =C669*6+D669 -> 34 | G669: 8 | H669: 7 | I669: =G669*6+H669 -> 55 | K669: 10 | L669: 12 | M669: =K669*6+L669 -> 72 | O669: 12 | P669: 16 | Q669: =O669*6+P669 -> 88 | S669: TORNEY
A670: BEST PLAYERS | W670: TEAM | X670: W | Y670: L | Z670: D | AA670: FOR | AB670: AGST | AC670: % | AD670: PTS
A671: OAKLEIGH | D671: TAYLOR | G671: ROBBINS | J671: MURNANE | M671: STEWART | P671: CARR | R671: WENN
A672: PRAHRAN | D672: ROLFE | G672: EMSELLE | J672: RIPPON | M672: SINCLAIR | P672: GRANGE | R672: GUNN | W672: OAKLEIGH | X672: 11 | Y672: 4 | Z672: 0 | AA672: 1762 | AB672: 1518 | AC672: 116.07378129117259 | AD672: 44
A673: GOALKICKERS | W673: DANDENONG | X673: 10 | Y673: 4 | Z673: 1 | AA673: 1816 | AB673: 1536 | AC673: 118.22916666666667 | AD673: 42
A674: OAKLEIGH | D674: MURNANE 8 | G674: ROBBINS 5 | J674: CARR 4 | L674: WENN 3 | N674: HALLIDAY 2 | Q674: TAYLOR | W674: PRAHRAN | X674: 8 | Y674: 6 | Z674: 1 | AA674: 1852 | AB674: 1727 | AC674: 107.23798494499131 | AD674: 34
A675: PRAHRAN | D675: RUMNEY 2 | G675: ROLFE 2 | I675: G SMITH 2 | L675: PAYNE 2 | N675: KELLY | P675: GRANGE | R675: TOWNSEND | W675: GEELONG WEST | X675: 8 | Y675: 7 | Z675: 0 | AA675: 1690 | AB675: 1608 | AC675: 105.09950248756219 | AD675: 32
R676: CHAPMAN
A677: GEELONG WEST | C677: 6 | D677: 2 | E677: =C677*6+D677 -> 38 | G677: 11 | H677: 5 | I677: =G677*6+H677 -> 71 | K677: 19 | L677: 11 | M677: =K677*6+L677 -> 125 | O677: 22 | P677: 16 | Q677: =O677*6+P677 -> 148 | S677: GEELONG WEST | W677: PORT MELBOURNE | X677: 8 | Y677: 7 | Z677: 0 | AA677: 1766 | AB677: 1773 | AC677: 99.605188945290465 | AD677: 32
A678: PORT MELBOURNE | C678: 5 | D678: 5 | E678: =C678*6+D678 -> 35 | G678: 7 | H678: 9 | I678: =G678*6+H678 -> 51 | K678: 10 | L678: 10 | M678: =K678*6+L678 -> 70 | O678: 15 | P678: 11 | Q678: =O678*6+P678 -> 101 | S678: HAYES | W678: WILLIAMSTOWN | X678: 7 | Y678: 8 | Z678: 0 | AA678: 1597 | AB678: 1644 | AC678: 97.141119221411188 | AD678: 28
A679: BEST PLAYERS | W679: SANDRINGHAM | X679: 6 | Y679: 9 | Z679: 0 | AA679: 1588 | AB679: 1823 | AC679: 87.109160724081178 | AD679: 24
A680: GEELONG WEST | D680: DEEATH | G680: R BROWNE | J680: M BROWNE | M680: VAN ELDEN | P680: LINKE | R680: WARREN | W680: SUNSHINE | X680: 6 | Y680: 9 | Z680: 0 | AA680: 1539 | AB680: 1852 | AC680: 83.099352051835851 | AD680: 24
A681: PORT MELBOURNE | D681: HOLT | G681: FRENCH | J681: STEVENSON | M681: HUGHES | P681: CARLON | R681: GOSS | W681: PRESTON | X681: 5 | Y681: 10 | Z681: 0 | AA681: 1774 | AB681: 1812 | AC681: 97.902869757174386 | AD681: 20
A682: GOALKICKERS | W682: COBURG | X682: 4 | Y682: 9 | Z682: 2 | AA682: 1570 | AB682: 1661 | AC682: 94.521372667068036 | AD682: 20
A683: GEELONG WEST | D683: McLEAN 7 | F683: LINKE 6 | H683: WOOD 2 | J683: HARRIS 2 | M683: WARREN 2 | P683: R BROWNE | R683: GILLIES | T683: GOGGIN
A684: PORT MELBOURNE | D684: COOK 4 | F684: GOSS 3 | H684: COLLINS 2 | J684: WILLIAMS 2 | M684: BROWN | O684: HOLT | Q684: FRENCH | S684: ANDERSON
A686: WILLIAMSTOWN | C686: 3 | D686: 4 | E686: =C686*6+D686 -> 22 | G686: 10 | H686: 11 | I686: =G686*6+H686 -> 71 | K686: 13 | L686: 14 | M686: =K686*6+L686 -> 92 | O686: 21 | P686: 18 | Q686: =O686*6+P686 -> 144 | S686: PRESTON
A687: PRESTON | C687: 7 | D687: 6 | E687: =C687*6+D687 -> 48 | G687: 9 | H687: 10 | I687: =G687*6+H687 -> 64 | K687: 11 | L687: 16 | M687: =K687*6+L687 -> 82 | O687: 14 | P687: 18 | Q687: =O687*6+P687 -> 102 | S687: STIRLING
A688: BEST PLAYERS
A689: WILLIAMSTOWN | D689: WARBURTON | G689: PERCY | I689: JACKMAN | L689: MULLIGAN | O689: BROWN | Q689: L STILLMAN
A690: PRESTON | D690: JOHNSTON | G690: SMITH | I690: CLARK | L690: MARTIN | O690: HILL | Q690: GREENWOOD
A691: GOALKICKERS
A692: WILLIAMSTOWN | D692: BOXALL 5 | F692: RADZIMINSKI 4 | J692: JACKMAN 4 | M692: MULLIGAN 4 | P692: HEMLEY | R692: WARBURTON | V692: BROWN | X692: L STILLMAN
A693: PRESTON | D693: CLARK 6 | G693: SMITH 4 | I693: JOHNSTON 2 | L693: WEIGHTMAN | O693: MARKS
A695: COBURG | C695: 5 | D695: 2 | E695: =C695*6+D695 -> 32 | G695: 10 | H695: 6 | I695: =G695*6+H695 -> 66 | K695: 11 | L695: 16 | M695: =K695*6+L695 -> 82 | O695: 21 | P695: 19 | Q695: =O695*6+P695 -> 145 | S695: COBURG
A696: SANDRINGHAM | C696: 6 | D696: 1 | E696: =C696*6+D696 -> 37 | G696: 7 | H696: 3 | I696: =G696*6+H696 -> 45 | K696: 11 | L696: 5 | M696: =K696*6+L696 -> 71 | O696: 13 | P696: 7 | Q696: =O696*6+P696 -> 85 | S696: DAVIS
A697: BEST PLAYERS
A698: COBURG | D698: ERWIN | G698: FEDLEY | J698: PAUL | M698: LAKE | P698: GALE | R698: MANNIX
A699: SANDRINGHAM | D699: McNICHOLAS | G699: SPURRELL | J699: I COOPER | M699: CUMMINGS | P699: KENNEDY | R699: SCHOLES
A700: GOALKICKERS
A701: COBURG | D701: FEDLEY 8 | G701: McGRATH 3 | J701: GALE 3 | L701: S McCARTHY 2 | O701: PAUL 2 | Q701: BRENNAN 2 | T701: ERWIN
A702: SANDRINGHAM | D702: I COOPER 6 | G702: KENNEDY 2 | J702: SPURRELL 2 | M702: RUDD 2 | O702: SCHOLES
A704: DANDENONG | C704: 9 | D704: 10 | E704: =C704*6+D704 -> 64 | G704: 18 | H704: 11 | I704: =G704*6+H704 -> 119 | K704: 23 | L704: 13 | M704: =K704*6+L704 -> 151 | O704: 25 | P704: 20 | Q704: =O704*6+P704 -> 170 | S704: DANDENONG
A705: SUNSHINE | C705: 1 | D705: 4 | E705: =C705*6+D705 -> 10 | G705: 5 | H705: 6 | I705: =G705*6+H705 -> 36 | K705: 9 | L705: 9 | M705: =K705*6+L705 -> 63 | O705: 14 | P705: 10 | Q705: =O705*6+P705 -> 94 | S705: MARKS
A706: BEST PLAYERS
A707: DANDENONG | D707: DAVIES | G707: HIBBERT | J707: ESLER | M707: FLAHERTY | P707: BOND | S707: BECK
A708: SUNSHINE | D708: L CRAWFORD | G708: LLOYD | J708: WOODS | M708: CASEY | P708: R CRAWFORD | S708: SLADDIN
A709: GOALKICKERS
A710: DANDENONG | D710: FLAHERTY 6 | G710: BOND 5 | I710: HIBBERT 4 | K710: FIELDER 2 | M710: KENDALL 2 | P710: K SHINNERS 2 | S710: KENNEDY (2) | V710: ELLIS | X710: DAVENPORT
A711: SUNSHINE | D711: R CRAWFORD 4 | G711: L CRAWFORD 3 | K711: LLOYD 2 | M711: CHADWICK 2 | P711: THOMAS | R711: SLADDIN | U711: McKENZIE
A713: ROUND 16 | E713: 12TH AUGUST | J713: WEATHER | N713: NORTH WIND | S713: PLAYED AT
D714: 1ST QTR | H714: 2ND QTR | L714: 3RD QTR | P714: FINAL | S714: TOORAK PARK
A715: PRAHRAN | C715: 10 | D715: 4 | E715: =C715*6+D715 -> 64 | G715: 11 | H715: 7 | I715: =G715*6+H715 -> 73 | K715: 13 | L715: 11 | M715: =K715*6+L715 -> 89 | O715: 15 | P715: 14 | Q715: =O715*6+P715 -> 104 | S715: UMPIRE | X715: LADDER | AB715: ROUND | AD715: 16
A716: GEELONG WEST | C716: 3 | D716: 0 | E716: =C716*6+D716 -> 18 | G716: 7 | H716: 3 | I716: =G716*6+H716 -> 45 | K716: 8 | L716: 3 | M716: =K716*6+L716 -> 51 | O716: 12 | P716: 6 | Q716: =O716*6+P716 -> 78 | S716: STIRLING
A717: BEST PLAYERS | W717: TEAM | X717: W | Y717: L | Z717: D | AA717: FOR | AB717: AGST | AC717: % | AD717: PTS
A718: PRAHRAN | D718: EMSELLE | G718: GUNN | I718: SINCLAIR | L718: ROLFE | N718: RIPPON | Q718: KENNEALLY
A719: GEELONG WEST | D719: R BROWNE | G719: SMITH | I719: GILLIES | L719: BARRY | N719: MADDEN | Q719: HARRIS | W719: OAKLEIGH | X719: 11 | Y719: 5 | Z719: 0 | AA719: 1874 | AB719: 1643 | AC719: 114.0596469872185 | AD719: 44
A720: GOALKICKERS | S720: O'BRIEN | W720: DANDENONG | X720: 10 | Y720: 5 | Z720: 1 | AA720: 1914 | AB720: 1664 | AC720: 115.02403846153847 | AD720: 42
A721: PRAHRAN | D721: SINCLAIR 5 | G721: ROLFE 3 | I721: APPLETON | K721: WEEKES | M721: RIPPON | O721: PEACH | Q721: PAYNE | S721: HUGHES | W721: PRAHRAN | X721: 9 | Y721: 6 | Z721: 1 | AA721: 1956 | AB721: 1805 | AC721: 108.36565096952909 | AD721: 38
A722: GEELONG WEST | D722: HARRIS 4 | G722: MADDEN 3 | J722: McLEAN 3 | M722: WARREN 2 | W722: PORT MELBOURNE | X722: 9 | Y722: 7 | Z722: 0 | AA722: 1878 | AB722: 1881 | AC722: 99.840510366826152 | AD722: 36
A724: PORT MELBOURNE | C724: 2 | D724: 4 | E724: =C724*6+D724 -> 16 | G724: 7 | H724: 9 | I724: =G724*6+H724 -> 51 | K724: 9 | L724: 12 | M724: =K724*6+L724 -> 66 | O724: 16 | P724: 16 | Q724: =O724*6+P724 -> 112 | S724: PORT MELBOURNE | W724: GEELONG WEST | X724: 8 | Y724: 8 | Z724: 0 | AA724: 1768 | AB724: 1712 | AC724: 103.27102803738318 | AD724: 32
A725: WILLIAMSTOWN | C725: 5 | D725: 6 | E725: =C725*6+D725 -> 36 | G725: 7 | H725: 10 | I725: =G725*6+H725 -> 52 | K725: 13 | L725: 14 | M725: =K725*6+L725 -> 92 | O725: 15 | P725: 18 | Q725: =O725*6+P725 -> 108 | S725: TORNEY | W725: WILLIAMSTOWN | X725: 7 | Y725: 9 | Z725: 0 | AA725: 1705 | AB725: 1756 | AC725: 97.095671981776761 | AD725: 28
A726: BEST PLAYERS | W726: SANDRINGHAM | X726: 7 | Y726: 9 | Z726: 0 | AA726: 1713 | AB726: 1935 | AC726: 88.52713178294573 | AD726: 28
A727: PORT MELBOURNE | D727: RHEINBERGER | G727: COLLINS | J727: BECKWITH | M727: COOK | O727: STEVENSON | R727: GOSS | W727: SUNSHINE | X727: 7 | Y727: 9 | Z727: 0 | AA727: 1660 | AB727: 1963 | AC727: 84.564442180336215 | AD727: 28
A728: WILLIAMSTOWN | D728: ROACH | G728: L STILLMAN | J728: RADZIMINSKI | M728: GILL | O728: BROWN | R728: THOMPSON | W728: COBURG | X728: 5 | Y728: 9 | Z728: 2 | AA728: 1698 | AB728: 1759 | AC728: 96.532120523024446 | AD728: 24
A729: GOALKICKERS | W729: PRESTON | X729: 5 | Y729: 11 | Z729: 0 | AA729: 1885 | AB729: 1933 | AC729: 97.516813243662696 | AD729: 20
A730: PORT MELBOURNE | D730: BECKWITH 5 | G730: HUGHES 2 | I730: SWINSTEAD 2 | L730: HOLT 2 | N730: WILLIAMS 2 | Q730: ANDERSON | S730: GOSS | U730: COLLINS
A731: WILLIAMSTOWN | D731: BOXALL 4 | F731: L STILLMAN 3 | I731: PERCY 3 | K731: MULLIGAN 2 | N731: WARBURTON | Q731: PATTERSON | T731: RADZIMINSKI
A733: SUNSHINE | C733: 4 | D733: 1 | E733: =C733*6+D733 -> 25 | G733: 9 | H733: 6 | I733: =G733*6+H733 -> 60 | K733: 13 | L733: 12 | M733: =K733*6+L733 -> 90 | O733: 18 | P733: 13 | Q733: =O733*6+P733 -> 121 | S733: SUNSHINE
A734: PRESTON | C734: 5 | D734: 3 | E734: =C734*6+D734 -> 33 | G734: 7 | H734: 5 | I734: =G734*6+H734 -> 47 | K734: 11 | L734: 9 | M734: =K734*6+L734 -> 75 | O734: 16 | P734: 15 | Q734: =O734*6+P734 -> 111 | S734: O'BRIEN
A735: BEST PLAYERS
A736: SUNSHINE | D736: MCKENZIE | G736: LLOYD | J736: WAGLAND | M736: PIERZAK | P736: HALL | R736: CHADWICK
A737: PRESTON | D737: SHAW | G737: ZUNNEBERG | J737: MARKS | M737: WEIGHTMAN | P737: SMITH | R737: MARTIN
A738: GOALKICKERS
A739: SUNSHINE | D739: McKENZIE 6 | G739: LLOYD 3 | I739: WAGLAND 2 | L739: L CRAWFORD 2 | O739: R CRAWFORD | R739: GOOLD | T739: BENSON | V739: THOMPSON | X739: RUSSELL
A740: PRESTON | D740: CLARK 4 | G740: McGAW 3 | I740: ZUNNEBERG 3 | L740: WEIGHTMAN 2 | O740: JOHNSTON 2 | R740: SHAW | T740: MARKS
A742: SANDRINGHAM | C742: 3 | D742: 6 | E742: =C742*6+D742 -> 24 | G742: 10 | H742: 10 | I742: =G742*6+H742 -> 70 | K742: 11 | L742: 10 | M742: =K742*6+L742 -> 76 | O742: 18 | P742: 17 | Q742: =O742*6+P742 -> 125 | S742: BEACH ROAD
A743: OAKLEIGH | C743: 3 | D743: 4 | E743: =C743*6+D743 -> 22 | G743: 7 | H743: 7 | I743: =G743*6+H743 -> 49 | K743: 13 | L743: 16 | M743: =K743*6+L743 -> 94 | O743: 16 | P743: 16 | Q743: =O743*6+P743 -> 112 | S743: HAYES
A744: BEST PLAYERS
A745: SANDRINGHAM | D745: KENNEDY | G745: I COOPER | J745: TOMS | M745: ANSELL | O745: SCHWARZMAN | R745: WARD
A746: OAKLEIGH | D746: STEPHENS | G746: BILLING | J746: O'KANE | M746: WENN | O746: ROBBINS | R746: P LILLEY
A747: GOALKICKERS
A748: SANDRINGHAM | D748: I COOPER 10 | G748: WARD 3 | I748: NICHOLSON 2 | L748: SCHOLES 2 | O748: TREGEAR
A749: OAKLEIGH | D749: MURNANE 3 | G749: BILLING 3 | I749: WENN 3 | K749: ROBBINS 3 | N749: CARR | P749: O'KANE | R749: HALLIDAY | U749: HOWELL
A751: COBURG | C751: 4 | D751: 5 | E751: =C751*6+D751 -> 29 | G751: 10 | H751: 7 | I751: =G751*6+H751 -> 67 | K751: 16 | L751: 15 | M751: =K751*6+L751 -> 111 | O751: 18 | P751: 20 | Q751: =O751*6+P751 -> 128 | S751: COBURG
A752: DANDENONG | C752: 3 | D752: 3 | E752: =C752*6+D752 -> 21 | G752: 8 | H752: 5 | I752: =G752*6+H752 -> 53 | K752: 10 | L752: 10 | M752: =K752*6+L752 -> 70 | O752: 14 | P752: 14 | Q752: =O752*6+P752 -> 98 | S752: McBAIN
A753: BEST PLAYERS
A754: COBURG | D754: HOBBS | G754: MANNIX | J754: ARTHURSON | M754: HOWELL | P754: MORRISON | S754: PAUL
A755: DANDENONG | D755: FLAHERTY | G755: DAVIES | J755: KENDALL | M755: HIBBERT | P755: BECK | S755: MELAI
A756: GOALKICKERS
A757: COBURG | D757: FEDLEY 3 | F757: PAUL 3 | H757: S McCARTHY 3 | K757: BRENNAN 3 | N757: McGRATH 2 | Q757: MANNIX 2 | T757: HOWELL | W757: HOBBS
A758: DANDENONG | D758: FLAHERTY 9 | G758: MILLER 2 | J758: K SHINNERS 2 | N758: KENDALL
A760: ROUND 17 | E760: 19TH AUGUST | J760: WEATHER | N760: SOUTH WIND COLD & WET | S760: PLAYED AT
D761: 1ST QTR | H761: 2ND QTR | L761: 3RD QTR | P761: FINAL | S761: DANDENONG
A762: DANDENONG | C762: 4 | D762: 4 | E762: =C762*6+D762 -> 28 | G762: 9 | H762: 8 | I762: =G762*6+H762 -> 62 | K762: 15 | L762: 9 | M762: =K762*6+L762 -> 99 | O762: 19 | P762: 12 | Q762: =O762*6+P762 -> 126 | S762: UMPIRE | X762: LADDER | AB762: ROUND | AD762: 17
A763: PRAHRAN | C763: 2 | D763: 4 | E763: =C763*6+D763 -> 16 | G763: 4 | H763: 6 | I763: =G763*6+H763 -> 30 | K763: 9 | L763: 8 | M763: =K763*6+L763 -> 62 | O763: 14 | P763: 8 | Q763: =O763*6+P763 -> 92 | S763: GAMBETTA
A764: BEST PLAYERS | W764: TEAM | X764: W | Y764: L | Z764: D | AA764: FOR | AB764: AGST | AC764: % | AD764: PTS
A765: DANDENONG | D765: REID | F765: EVANS | I765: KENDALL | L765: FLAHERTY | O765: HIBBERT | Q765: SOUTHERN
A766: PRAHRAN | D766: ROLFE | F766: EMSELLE | I766: RIPPON | L766: GRANGE | O766: O'BRIEN | Q766: APPLETON | W766: OAKLEIGH | X766: 12 | Y766: 5 | Z766: 0 | AA766: 1938 | AB766: 1705 | AC766: 113.66568914956012 | AD766: 48
A767: GOALKICKERS | W767: DANDENONG | X767: 11 | Y767: 5 | Z767: 1 | AA767: 2040 | AB767: 1756 | AC767: 116.17 | AD767: 46
A768: DANDENONG | D768: REID 8 | F768: MILLER 5 | I768: HIBBERT 2 | L768: SOUTHERN 2 | O768: FLAHERTY | Q768: MELAI | W768: PORT MELBOURNE | X768: 10 | Y768: 7 | Z768: 0 | AA768: 2024 | AB768: 1973 | AC768: 102.58489609731373 | AD768: 40
A769: PRAHRAN | D769: ROLFE 4 | F769: ANDERSON 3 | I769: APPLETON 2 | L769: ASHLEY | N769: GRANGE | P769: SINCLAIR | R769: WEEKES | T769: TOWNSEND | W769: PRAHRAN | X769: 9 | Y769: 7 | Z769: 1 | AA769: 2048 | AB769: 1931 | AC769: 106.06 | AD769: 38
A771: PORT MELBOURNE | C771: 5 | D771: 5 | E771: =C771*6+D771 -> 35 | G771: 12 | H771: 6 | I771: =G771*6+H771 -> 78 | K771: 17 | L771: 17 | M771: =K771*6+L771 -> 119 | O771: 22 | P771: 14 | Q771: =O771*6+P771 -> 146 | S771: PORT MELBOURNE | W771: GEELONG WEST | X771: 9 | Y771: 8 | Z771: 0 | AA771: 1874 | AB771: 1802 | AC771: 103.99556048834629 | AD771: 36
A772: SANDRINGHAM | C772: 1 | D772: 4 | E772: =C772*6+D772 -> 10 | G772: 6 | H772: 9 | I772: =G772*6+H772 -> 45 | K772: 10 | L772: 10 | M772: =K772*6+L772 -> 70 | O772: 13 | P772: 14 | Q772: =O772*6+P772 -> 92 | S772: STIRLING | W772: WILLIAMSTOWN | X772: 8 | Y772: 9 | Z772: 0 | AA772: 1771 | AB772: 1815 | AC772: 97.575757575757578 | AD772: 32
A773: BEST PLAYERS | W773: SANDRINGHAM | X773: 7 | Y773: 10 | Z773: 0 | AA773: 1805 | AB773: 2081 | AC773: 86.737145603075447 | AD773: 28
A774: PORT MELBOURNE | D774: ANDERSON | G774: RHEINBERGER | J774: COLLINS | M774: COOK | P774: HOLT | S774: HUDSON | W774: SUNSHINE | X774: 7 | Y774: 10 | Z774: 0 | AA774: 1719 | AB774: 2029 | AC774: 84.721537703302118 | AD774: 28
A775: SANDRINGHAM | D775: NICHOLSON | G775: MURPHY | J775: KENNEDY | M775: LIPSCOMBE | P775: BRENNER | S775: SPURRELL | W775: COBURG | X775: 5 | Y775: 10 | Z775: 2 | AA775: 1788 | AB775: 1865 | AC775: 95.871313672922255 | AD775: 24
A776: GOALKICKERS | W776: PRESTON | X776: 5 | Y776: 12 | Z776: 0 | AA776: 1947 | AB776: 1997 | AC776: 97.496244366549831 | AD776: 20
A777: PORT MELBOURNE | D777: HOLT 5 | F777: COOK 4 | H777: ANDERSON 4 | K777: BECKWITH 4 | N777: O'BRIEN 3 | Q777: FRENCH | S777: HUDSON
A778: SANDRINGHAM | D778: WARD 3 | G778: I COOPER 3 | J778: SPURRELL 2 | M778: WALFORD 2 | P778: ANSELL 2 | R778: SCHWARZMAN
A780: WILLIAMSTOWN | C780: 0 | D780: 5 | E780: =C780*6+D780 -> 5 | G780: 4 | H780: 12 | I780: =G780*6+H780 -> 36 | K780: 4 | L780: 14 | M780: =K780*6+L780 -> 38 | O780: 8 | P780: 18 | Q780: =O780*6+P780 -> 66 | S780: WILLIAMSTOWN
A781: SUNSHINE | C781: 3 | D781: 4 | E781: =C781*6+D781 -> 22 | G781: 5 | H781: 5 | I781: =G781*6+H781 -> 35 | K781: 8 | L781: 8 | M781: =K781*6+L781 -> 56 | O781: 8 | P781: 11 | Q781: =O781*6+P781 -> 59 | S781: HAYES
A782: BEST PLAYERS
A783: WILLIAMSTOWN | D783: HANNEBURY | G783: PERCY | J783: GILL | M783: COURTOT | O783: L STILLMAN | R783: BROWN
A784: SUNSHINE | D784: GOOLD | G784: L CRAWFORD | J784: McKENZIE | M784: LLOYD | O784: HALL | R784: NEISH
A785: GOALKICKERS
A786: WILLIAMSTOWN | D786: PATTERSON 2 | G786: L STILLMAN 2 | K786: RADZIMINSKI | N786: MULLIGAN | Q786: BROWN | S786: FANNING
A787: SUNSHINE | D787: R CRAWFORD 3 | H787: TOULMIN | J787: GOOLD | L787: BENSON | N787: WAGLAND | Q787: L CRAWFORD
A789: GEELONG WEST | C789: 2 | D789: 4 | E789: =C789*6+D789 -> 16 | G789: 7 | H789: 8 | I789: =G789*6+H789 -> 50 | K789: 10 | L789: 8 | M789: =K789*6+L789 -> 68 | O789: 15 | P789: 16 | Q789: =O789*6+P789 -> 106 | S789: GEELONG WEST
A790: COBURG | C790: 6 | D790: 3 | E790: =C790*6+D790 -> 39 | G790: 8 | H790: 6 | I790: =G790*6+H790 -> 54 | K790: 10 | L790: 10 | M790: =K790*6+L790 -> 70 | O790: 13 | P790: 12 | Q790: =O790*6+P790 -> 90 | S790: MARKS
A791: BEST PLAYERS
A792: GEELONG WEST | D792: DEEATH | G792: R BROWNE | J792: GILLIES | M792: SMITH | O792: GOGGIN | Q792: ARKLAY
A793: COBURG | D793: ERWIN | G793: McGRATH | J793: MANNIX | M793: FEDLEY | O793: GALE | Q793: S McCARTHY
A794: GOALKICKERS
A795: GEELONG WEST | D795: McLEAN 4 | G795: HARRIS 3 | I795: ARKLAY 2 | L795: LINKE 2 | N795: WARREN | P795: GILLIES | R795: WOOD | T795: R BROWNE
A796: COBURG | D796: S McCARTHY 3 | G796: McGRATH 3 | J796: HOWELL 2 | M796: FEDLEY 2 | O796: HOBBS | Q796: BRENNAN | T796: P McCARTHY
A798: OAKLEIGH | C798: 3 | D798: 0 | E798: =C798*6+D798 -> 18 | G798: 6 | H798: 4 | I798: =G798*6+H798 -> 40 | K798: 8 | L798: 7 | M798: =K798*6+L798 -> 55 | O798: 9 | P798: 10 | Q798: =O798*6+P798 -> 64 | S798: PRESTON
A799: PRESTON | C799: 3 | D799: 4 | E799: =C799*6+D799 -> 22 | G799: 5 | H799: 4 | I799: =G799*6+H799 -> 34 | K799: 6 | L799: 11 | M799: =K799*6+L799 -> 47 | O799: 8 | P799: 14 | Q799: =O799*6+P799 -> 62 | S799: STABB
A800: BEST PLAYERS
A801: OAKLEIGH | D801: STEPHENS | G801: TAYLOR | J801: BILLING | M801: WENN | O801: QUINN | Q801: MURNANE
A802: PRESTON | D802: MARTIN | G802: SHAW | J802: JOHNSTON | M802: SLATER | O802: CLARK | Q802: VICKERY
A803: GOALKICKERS
A804: OAKLEIGH | D804: WENN 3 | G804: MURNANE 2 | J804: QUINN | L804: TAYLOR | N804: FRYER | P804: CLOKE
A805: PRESTON | D805: VICKERY 3 | G805: CLARK 2 | J805: SHAW | L805: McGAW | N805: ZUNNEBERG
A807: ROUND 18 | E807: 26TH AUGUST | J807: WEATHER | N807: SOUTH WIND | S807: PLAYED AT
D808: 1ST QTR | H808: 2ND QTR | L808: 3RD QTR | P808: FINAL | S808: OAKLEIGH
A809: GEELONG WEST | C809: 5 | D809: 6 | E809: =C809*6+D809 -> 36 | G809: 7 | H809: 11 | I809: =G809*6+H809 -> 53 | K809: 11 | L809: 14 | M809: =K809*6+L809 -> 80 | O809: 16 | P809: 18 | Q809: =O809*6+P809 -> 114 | S809: UMPIRE | X809: LADDER | AB809: ROUND | AD809: 18
A810: OAKLEIGH | C810: 3 | D810: 3 | E810: =C810*6+D810 -> 21 | G810: 9 | H810: 9 | I810: =G810*6+H810 -> 63 | K810: 10 | L810: 13 | M810: =K810*6+L810 -> 73 | O810: 16 | P810: 14 | Q810: =O810*6+P810 -> 110 | S810: TORNEY
A811: BEST PLAYERS | W811: TEAM | X811: W | Y811: L | Z811: D | AA811: FOR | AB811: AGST | AC811: % | AD811: PTS
A812: GEELONG WEST | D812: R BROWNE | G812: DEEATH | J812: MANSON | M812: GOGGIN | O812: ARKLAY | R812: WARREN
A813: OAKLEIGH | D813: NISBET | G813: WENN | J813: MURNANE | M813: TAYLOR | O813: ROBBINS | R813: CLOKE | W813: DANDENONG | X813: 12 | Y813: 5 | Z813: 1 | AA813: 2144 | AB813: 1844 | AC813: 116.27 | AD813: 50
A814: GOALKICKERS | W814: OAKLEIGH | X814: 12 | Y814: 6 | Z814: 0 | AA814: 2048 | AB814: 1819 | AC814: 112.58933479934029 | AD814: 48
A815: GEELONG WEST | D815: McLEAN 4 | F815: WARREN 3 | I815: WOOD 2 | K815: ARKLAY 2 | M815: HARRIS 2 | O815: LINKE | Q815: MANSON | S815: R BROWNE | W815: PORT MELBOURNE | X815: 11 | Y815: 7 | Z815: 0 | AA815: 2191 | AB815: 2074 | AC815: 105.64127290260366 | AD815: 44
A816: OAKLEIGH | D816: MURNANE 8 | G816: QUINN 2 | I816: JOHNSON 2 | L816: ROBBINS 2 | O816: CLOKE | Q816: BARR | W816: PRAHRAN | X816: 10 | Y816: 7 | Z816: 1 | AA816: 2203 | AB816: 1997 | AC816: 110.32 | AD816: 42
A818: DANDENONG | C818: 3 | D818: 1 | E818: =C818*6+D818 -> 19 | G818: 8 | H818: 10 | I818: =G818*6+H818 -> 58 | K818: 10 | L818: 14 | M818: =K818*6+L818 -> 74 | O818: 14 | P818: 20 | Q818: =O818*6+P818 -> 104 | S818: DANDENONG | W818: GEELONG WEST | X818: 10 | Y818: 8 | Z818: 0 | AA818: 1988 | AB818: 1912 | AC818: 103.97489539748953 | AD818: 40
A819: WILLIAMSTOWN | C819: 4 | D819: 9 | E819: =C819*6+D819 -> 33 | G819: 6 | H819: 12 | I819: =G819*6+H819 -> 48 | K819: 10 | L819: 18 | M819: =K819*6+L819 -> 78 | O819: 12 | P819: 26 | Q819: =O819*6+P819 -> 98 | S819: STIRLING | W819: WILLIAMSTOWN | X819: 8 | Y819: 10 | Z819: 0 | AA819: 1859 | AB819: 1919 | AC819: 96.873371547681089 | AD819: 32
A820: BEST PLAYERS | W820: SANDRINGHAM | X820: 7 | Y820: 11 | Z820: 0 | AA820: 1871 | AB820: 2236 | AC820: 83.676207513416813 | AD820: 28
A821: DANDENONG | D821: FLAHERTY | G821: EVANS | J821: KENDALL | M821: HARRINGTON | P821: HIBBERT | R821: WALKER | W821: SUNSHINE | X821: 7 | Y821: 11 | Z821: 0 | AA821: 1820 | AB821: 2196 | AC821: 82.877959927140253 | AD821: 28
A822: WILLIAMSTOWN | D822: WARBURTON | G822: PATTERSON | J822: L STILLMAN | M822: RADZIMINSKI | P822: HEMLEY | R822: PERCY | W822: PRESTON | X822: 6 | Y822: 12 | Z822: 0 | AA822: 2118 | AB822: 2151 | AC822: 98.465829846582992 | AD822: 24
A823: GOALKICKERS | W823: COBURG | X823: 5 | Y823: 11 | Z823: 2 | AA823: 1942 | AB823: 2036 | AC823: 95.383104125736736 | AD823: 24
A824: DANDENONG | D824: MILLER 5 | G824: FLAHERTY 4 | J824: DAVIES 2 | M824: REID | O824: KENDALL | Q824: BOND
A825: WILLIAMSTOWN | D825: PATTERSON 5 | G825: BROWN 2 | I825: GILL | K825: HEMLEY | M825: PERCY | O825: WARBURTON | R825: JACKMAN
A827: PRESTON | C827: 8 | D827: 3 | E827: =C827*6+D827 -> 51 | G827: 14 | H827: 6 | I827: =G827*6+H827 -> 90 | K827: 20 | L827: 7 | M827: =K827*6+L827 -> 127 | O827: 27 | P827: 9 | Q827: =O827*6+P827 -> 171 | S827: COBURG
A828: COBURG | C828: 3 | D828: 3 | E828: =C828*6+D828 -> 21 | G828: 11 | H828: 9 | I828: =G828*6+H828 -> 75 | K828: 20 | L828: 14 | M828: =K828*6+L828 -> 134 | O828: 22 | P828: 22 | Q828: =O828*6+P828 -> 154 | S828: GAMBETTA
A829: BEST PLAYERS
A830: PRESTON | D830: WEIGHTMAN | G830: VICKERY | J830: CLARK | M830: McGAW | O830: GREENWOOD | R830: SHAW
A831: COBURG | D831: MANNIX | G831: GALE | J831: HOBBS | M831: ERWIN | O831: BRENNAN | R831: FEDLEY
A832: GOALKICKERS
A833: PRESTON | D833: WEIGHTMAN 6 | G833: VICKERY 6 | J833: CLARK 5 | M833: McGAW 3 | P833: IRELAND 3 | S833: JOHNSTON 3 | W833: ZUNNEBERG
A834: COBURG | D834: FEDLEY 4 | G834: MANNIX 4 | J834: BRENNAN 4 | M834: McGRATH 3 | P834: HOWELL 2 | S834: PAUL | U834: ERWIN | W834: S McCARTHY | X834: HOBBS | Z834: MORRISON
A836: PRAHRAN | C836: 1 | D836: 5 | E836: =C836*6+D836 -> 11 | G836: 10 | H836: 11 | I836: =G836*6+H836 -> 71 | K836: 14 | L836: 14 | M836: =K836*6+L836 -> 98 | O836: 23 | P836: 17 | Q836: =O836*6+P836 -> 155 | S836: BEACH ROAD
A837: SANDRINGHAM | C837: 3 | D837: 3 | E837: =C837*6+D837 -> 21 | G837: 4 | H837: 6 | I837: =G837*6+H837 -> 30 | K837: 8 | L837: 9 | M837: =K837*6+L837 -> 57 | O837: 9 | P837: 12 | Q837: =O837*6+P837 -> 66 | S837: HAYES
A838: BEST PLAYERS
A839: PRAHRAN | D839: EMSELLE | G839: SINCLAIR | J839: SMITH | M839: RIPPON | O839: CULPIN | R839: APPLETON
A840: SANDRINGHAM | D840: KENNEDY | G840: SPURRELL | J840: McNICHOLAS | M840: BRENNER | O840: NICHOLSON | R840: CUMMINGS
A841: GOALKICKERS
A842: PRAHRAN | D842: SMITH 6 | F842: WEEKES 4 | I842: APPLETON 3 | L842: RIPPON 3 | N842: ANDERSON 2 | Q842: ROLFE 2 | S842: SINCLAIR 2 | W842: PAYNE
A843: SANDRINGHAM | D843: EDWARDS 2 | G843: WARD 2 | I843: SPURRELL 2 | L843: SCHWARZMAN 2 | P843: NICHOLSON
A845: PORT MELBOURNE | C845: 5 | D845: 5 | E845: =C845*6+D845 -> 35 | G845: 8 | H845: 9 | I845: =G845*6+H845 -> 57 | K845: 17 | L845: 10 | M845: =K845*6+L845 -> 112 | O845: 26 | P845: 12 | Q845: =O845*6+P845 -> 168 | S845: SUNSHINE
A846: SUNSHINE | C846: 2 | D846: 4 | E846: =C846*6+D846 -> 16 | G846: 7 | H846: 12 | I846: =G846*6+H846 -> 54 | K846: 13 | L846: 15 | M846: =K846*6+L846 -> 93 | O846: 14 | P846: 17 | Q846: =O846*6+P846 -> 101 | S846: STABB
A847: BEST PLAYERS
A848: PORT MELBOURNE | D848: LOCKHART | G848: COLLINS | J848: COOK | M848: BECKWITH | P848: RHEINBERGER
A849: SUNSHINE | D849: PIERZAK | G849: LLOYD | J849: WOODS | M849: McKENZIE | P849: L CRAWFORD | T849: BENSON
A850: GOALKICKERS
A851: PORT MELBOURNE | D851: COOK 5 | F851: ANDERSON 4 | I851: BECKWITH 4 | L851: O'BRIEN 3 | N851: HARLAND 2 | Q851: P GOSS 2 | S851: SWINSTEAD 2 | W851: COLLINS | X851: HUGHES | Z851: FRENCH | AB851: HOLT
A852: SUNSHINE | D852: R CRAWFORD 4 | H852: McKENZIE 3 | K852: LLOYD 2 | M852: SLADDIN 2 | P852: RUSSELL 2 | S852: WAGLAND
A854: FINALS
A855: 1ST SEMI | E855: 3RD SEPTEMBER | J855: WEATHER | N855: WEST WIND
D856: 1ST QTR | H856: 2ND QTR | L856: 3RD QTR | P856: FINAL
A857: PRAHRAN | C857: 5 | D857: 9 | E857: =C857*6+D857 -> 39 | G857: 12 | H857: 13 | I857: =G857*6+H857 -> 85 | K857: 15 | L857: 16 | M857: =K857*6+L857 -> 106 | O857: 18 | P857: 21 | Q857: =O857*6+P857 -> 129 | S857: JUNCTION OVAL
A858: PORT MELBOURNE | C858: 6 | D858: 1 | E858: =C858*6+D858 -> 37 | G858: 6 | H858: 2 | I858: =G858*6+H858 -> 38 | K858: 9 | L858: 11 | M858: =K858*6+L858 -> 65 | O858: 10 | P858: 17 | Q858: =O858*6+P858 -> 77 | S858: GAMBETTA
A859: BEST PLAYERS
A860: PRAHRAN | D860: TOWNSEND | G860: CULPIN | J860: SINCLAIR | M860: EMSELLE | P860: PAYNE | S860: SMITH
A861: PORT MELBOURNE | D861: COOK | G861: STEVENSON | J861: MALLETT | M861: HUDSON | P861: PROFFIT | S861: RHEINBERGER
A862: GOALKICKERS
A863: PRAHRAN | D863: PAYNE 7 | G863: TOWNSEND 3 | J863: SINCLAIR 2 | M863: APPLETON 2 | P863: WRIGHT 2 | S863: RIPPON | V863: ANDERSON
A864: PORT MELBOURNE | D864: HUDSON 3 | G864: HARLAND 2 | J864: GOSS | L864: ANDERSON | N864: COOK | P864: HOLT | R864: SWINSTEAD
A866: 2ND SEMI | E866: 10TH SEPTEMBER | J866: WEATHER | N866: FINE
A867: OAKLEIGH | C867: 7 | D867: 5 | E867: =C867*6+D867 -> 47 | G867: 10 | H867: 7 | I867: =G867*6+H867 -> 67 | K867: 14 | L867: 14 | M867: =K867*6+L867 -> 98 | O867: 17 | P867: 14 | Q867: =O867*6+P867 -> 116 | S867: JUNCTION OVAL
A868: DANDENONG | C868: 0 | D868: 5 | E868: =C868*6+D868 -> 5 | G868: 4 | H868: 11 | I868: =G868*6+H868 -> 35 | K868: 7 | L868: 17 | M868: =K868*6+L868 -> 59 | O868: 13 | P868: 23 | Q868: =O868*6+P868 -> 101 | S868: HAYES
A869: BEST PLAYERS
A870: OAKLEIGH | D870: TAYLOR | G870: ROBBINS | J870: CLOKE | M870: WENN | P870: FORSTER | S870: FORD
A871: DANDENONG | D871: KENDALL | G871: MILLER | J871: DARLEY | M871: HIBBERT | P871: REID | S871: DAVIES
A872: GOALKICKERS
A873: OAKLEIGH | D873: MURNANE 5 | G873: FORD 3 | I873: WENN 3 | K873: TAYLOR 2 | N873: ROBBINS 2 | Q873: CARR | S873: BARR
A874: DANDENONG | D874: MILLER 8 | G874: HIBBERT | I874: ELLIS | K874: ORCHARD | N874: KENDALL | Q874: REID
A876: PRELIMINARY FINAL | F876: 16TH SEPTEMBER | K876: WEATHER | O876: FINE
A877: PRAHRAN | C877: 7 | D877: 4 | E877: =C877*6+D877 -> 46 | G877: 10 | H877: 5 | I877: =G877*6+H877 -> 65 | K877: 12 | L877: 11 | M877: =K877*6+L877 -> 83 | O877: 16 | P877: 14 | Q877: =O877*6+P877 -> 110 | S877: JUNCTION OVAL
A878: DANDENONG | C878: 3 | D878: 3 | E878: =C878*6+D878 -> 21 | G878: 6 | H878: 6 | I878: =G878*6+H878 -> 42 | K878: 9 | L878: 8 | M878: =K878*6+L878 -> 62 | O878: 12 | P878: 9 | Q878: =O878*6+P878 -> 81 | S878: STIRLING
A879: BEST PLAYERS
A880: PRAHRAN | D880: EMSELLE | G880: CULPIN | J880: TOWNSEND | M880: PIROUET | P880: KENNEALLY | S880: APPLETON
A881: DANDENONG | D881: ORCHARD | G881: MILLER | J881: KENDALL | M881: WOOD | P881: HIBBERT | S881: BECK
A882: GOALKICKERS
A883: PRAHRAN | D883: PAYNE 4 | G883: APPLETON 3 | J883: WRIGHT 3 | M883: SMITH 2 | O883: ANDERSON 2 | R883: TOWNSEND | U883: WEEKES
A884: DANDENONG | D884: MILLER 6 | G884: REID 2 | I884: SOUTHERN 2 | L884: BOND | N884: ELLIS
A886: GRAND FINAL | E886: 23RD SEPTEMBER | J886: WEATHER | M886: WEST WIND LIGHT RAIN
A887: PRAHRAN | C887: 2 | D887: 4 | E887: 16 | G887: 8 | H887: 12 | I887: 60 | K887: 12 | L887: 17 | M887: 89 | O887: 15 | P887: 23 | Q887: =O887*6+P887 -> 113 | S887: JUNCTION OVAL
A888: OAKLEIGH | C888: 2 | D888: 5 | E888: 17 | G888: 5 | H888: 7 | I888: 37 | K888: 7 | L888: 15 | M888: 57 | O888: 10 | P888: 18 | Q888: =O888*6+P888 -> 78 | S888: STIRLING
A889: BEST PLAYERS
A890: PRAHRAN | D890: EMSELLE | G890: SINCLAIR | J890: TOWNSEND | M890: APPLETON | P890: CULPIN | S890: ANDERSON
A891: OAKLEIGH | D891: CLOKE | G891: TAYLOR | J891: STEWART | M891: FORSTER | P891: ROBBINS | S891: P LILLEY
A892: GOALKICKERS
A893: PRAHRAN | D893: APPLETON 4 | G893: WEEKES 3 | J893: SMITH 2 | M893: ANDERSON 2 | P893: SINCLAIR | R893: EMSELLE | U893: PAYNE | W893: TOWNSEND
A894: OAKLEIGH | D894: CLOKE 3 | G894: HALLIDAY 2 | J894: FORD | L894: TAYLOR | N894: ROBBINS | P894: FORSTER | R894: O'KANE
A896: LIGHTNING PREMIERSHIP
A897: 1ST ROUND
A898: BOX HILL | C898: 1 | D898: 3 | E898: =C898*6+D898 -> 9 | G898: 5 | H898: 8 | I898: =G898*6+H898 -> 38
A899: WERRIBEE | C899: 4 | D899: 1 | E899: =C899*6+D899 -> 25 | G899: 5 | H899: 1 | I899: =G899*6+H899 -> 31
A901: YARRAVILLE | C901: 3 | D901: 4 | E901: =C901*6+D901 -> 22 | G901: 3 | H901: 4 | I901: =G901*6+H901 -> 22
A902: MORDIALLOC | C902: 0 | D902: 0 | E902: =C902*6+D902 -> 0 | G902: 1 | H902: 3 | I902: =G902*6+H902 -> 9
A904: 2ND ROUND
A905: BOX HILL | C905: 3 | D905: 3 | E905: =C905*6+D905 -> 21 | G905: 6 | H905: 5 | I905: =G905*6+H905 -> 41
A906: FRANKSTON | C906: 3 | D906: 3 | E906: =C906*6+D906 -> 21 | G906: 5 | H906: 4 | I906: =G906*6+H906 -> 34
A908: NORTHCOTE | C908: 2 | D908: 3 | E908: =C908*6+D908 -> 15 | G908: 5 | H908: 7 | I908: =G908*6+H908 -> 37
A909: YARRAVILLE | C909: 1 | D909: 0 | E909: =C909*6+D909 -> 6 | G909: 5 | H909: 0 | I909: =G909*6+H909 -> 30
A911: 3RD ROUND
A912: PRESTON | E912: =C912*6+D912 -> 0 | G912: 3 | H912: 10 | I912: =G912*6+H912 -> 28
A913: SUNSHINE | E913: =C913*6+D913 -> 0 | G913: 3 | H913: 2 | I913: =G913*6+H913 -> 20
A915: SANDRINGHAM | E915: =C915*6+D915 -> 0 | G915: 3 | H915: 9 | I915: =G915*6+H915 -> 27
A916: COBURG | E916: =C916*6+D916 -> 0 | G916: 3 | H916: 1 | I916: =G916*6+H916 -> 19
A918: 4TH ROUND
A919: PRESTON | E919: =C919*6+D919 -> 0 | G919: 8 | H919: 3 | I919: =G919*6+H919 -> 51
A920: SANDRINGHAM | E920: =C920*6+D920 -> 0 | G920: 2 | H920: 3 | I920: =G920*6+H920 -> 15
A922: NORTHCOTE | E922: =C922*6+D922 -> 0 | G922: 9 | H922: 5 | I922: =G922*6+H922 -> 59
A923: BOX HILL | E923: =C923*6+D923 -> 0 | G923: 3 | H923: 5 | I923: =G923*6+H923 -> 23
A925: SEMI-FINALS
A926: PRESTON | E926: =C926*6+D926 -> 0 | G926: 8 | H926: 4 | I926: =G926*6+H926 -> 52
A927: WILLIAMSTOWN | E927: =C927*6+D927 -> 0 | G927: 4 | H927: 7 | I927: =G927*6+H927 -> 31
A929: GEELONG WEST | E929: =C929*6+D929 -> 0 | G929: 6 | H929: 4 | I929: =G929*6+H929 -> 40
A930: NORTHCOTE | E930: =C930*6+D930 -> 0 | G930: 4 | H930: 9 | I930: =G930*6+H930 -> 33
A932: FINAL
A933: GEELONG WEST | E933: =C933*6+D933 -> 0 | G933: 8 | H933: 3 | I933: =G933*6+H933 -> 51
A934: PRESTON | E934: =C934*6+D934 -> 0 | G934: 2 | H934: 9 | I934: =G934*6+H934 -> 21