A1: Victorian Football Association
A2: Season 1974 - Division One
A3: © Copyright Wal Williams | F3: First created: 28 July 2015
A4: Contact: joywalwi at gmail dot com | F4: Last updated: 28 July 2015 | W4: VFA Results and tables - Link to the main index page
A5: You are free to copy this document in whole or part provided that proper acknowledgement is given to the author. All rights reserved.
A7: 1974 V.F.A. | B7: SEASON 1ST | F7: DIVISION | CA7: \D | CB7: {GOTO}BJ3~/M{RIGHT 7}{END}{DOWN}~G4~
A8: ROUND 1 | E8: 21ST APRIL | J8: WEATHER | N8: LIGHT RAIN | S8: PLAYED AT | CB8: {GOTO}AL3~/M{END}{RIGHT}{END}{DOWN}~P3~
D9: 1ST QTR | H9: 2ND QTR | L9: 3RD QTR | P9: FINAL | S9: BEACH ROAD | CB9: {GOTO}BJ23~/M{RIGHT 7}{END}{DOWN}~V4~
A10: CAULFIELD | C10: 4 | D10: 5 | E10: =C10*6+D10 -> 29 | G10: 11 | H10: 8 | I10: =G10*6+H10 -> 74 | K10: 14 | L10: 11 | M10: =K10*6+L10 -> 95 | O10: 17 | P10: 13 | Q10: =O10*6+P10 -> 115 | S10: UMPIRE | X10: LADDER | AB10: ROUND | AD10: 1 | CB10: {GOTO}BJ43~/M{RIGHT 7}{END}{DOWN}~G24~
A11: SANDRINGHAM | C11: 3 | D11: 5 | E11: =C11*6+D11 -> 23 | G11: 5 | H11: 6 | I11: =G11*6+H11 -> 36 | K11: 10 | L11: 12 | M11: =K11*6+L11 -> 72 | O11: 15 | P11: 15 | Q11: =O11*6+P11 -> 105 | S11: McBAIN | CB11: {GOTO}AL23~/M{END}{RIGHT}{END}{DOWN}~P23~
A12: BEST PLAYERS | W12: TEAM | X12: W | Y12: L | Z12: D | AA12: FOR | AB12: AGST | AC12: % | AD12: PTS | CB12: {GOTO}BJ63~/M{RIGHT 7}{END}{DOWN}~V24~
A13: CAULFIELD | C13: BAKER | F13: CLIFF | I13: WHITE | L13: JEWELL | O13: LEGH | R13: GLAZNER | CB13: {GOTO}BJ83~/M{RIGHT 7}{END}{DOWN}~G44~
A14: SANDRINGHAM | C14: TAYLOR | F14: MURRAY | I14: DAVEY | L14: CLARKE | O14: SCHWARZMAN | R14: SCHOLES | W14: DANDENONG | X14: 1 | Y14: 0 | Z14: 0 | AA14: 118 | AB14: 42 | AC14: 280.95238095238096 | AD14: 4 | CB14: {GOTO}AL43~/M{END}{RIGHT}{END}{DOWN}~P43~
A15: GOALKICKERS | W15: PORT MELBOURNE | X15: 1 | Y15: 0 | Z15: 0 | AA15: 145 | AB15: 104 | AC15: 139.42307692307693 | AD15: 4 | CB15: {GOTO}BJ103~/M{RIGHT 7}{END}{DOWN}~V44~
A16: CAULFIELD | C16: CLIFF 4 | E16: GUINANE 3 | H16: LOGAN 3 | J16: BROWN 2 | M16: BAKER 2 | O16: GOODEN | Q16: COATES | S16: RENOWDEN | W16: PRAHRAN | X16: 1 | Y16: 0 | Z16: 0 | AA16: 102 | AB16: 93 | AC16: 109.6774193548387 | AD16: 4 | CB16: {GOTO}BJ123~/M{RIGHT 7}{END}{DOWN}~G64~
A17: SANDRINGHAM | C17: I COOPER 4 | F17: SCHOLES 4 | I17: WARD 2 | K17: C COOPER | M17: FULLER | O17: CLARKE | Q17: SCHWARZMAN | W17: CAULFIELD | X17: 1 | Y17: 0 | Z17: 0 | AA17: 115 | AB17: 105 | AC17: 109.52380952380952 | AD17: 4 | CB17: {GOTO}AL63~/M{END}{RIGHT}{END}{DOWN}~P63~
S18: McNICHOLAS | CB18: {GOTO}BJ143~/M{RIGHT 7}{END}{DOWN}~V64~
A19: PRAHRAN | C19: 6 | D19: 6 | E19: =C19*6+D19 -> 42 | G19: 7 | H19: 10 | I19: =G19*6+H19 -> 52 | K19: 10 | L19: 10 | M19: =K19*6+L19 -> 70 | O19: 14 | P19: 18 | Q19: =O19*6+P19 -> 102 | S19: TOORAK PARK | W19: PRESTON | X19: 1 | Y19: 0 | Z19: 0 | AA19: 100 | AB19: 92 | AC19: 108.69565217391305 | AD19: 4 | CB19: {GOTO}BJ163~/M{RIGHT 7}{END}{DOWN}~G84~
A20: GEELONG WEST | C20: 3 | D20: 3 | E20: =C20*6+D20 -> 21 | G20: 8 | H20: 12 | I20: =G20*6+H20 -> 60 | K20: 9 | L20: 13 | M20: =K20*6+L20 -> 67 | O20: 13 | P20: 15 | Q20: =O20*6+P20 -> 93 | S20: STIRLING | W20: SUNSHINE | X20: 0 | Y20: 1 | Z20: 0 | AA20: 92 | AB20: 100 | AC20: 92 | AD20: 0 | CB20: {GOTO}AL83~/M{END}{RIGHT}{END}{DOWN}~P83~
A21: BEST PLAYERS | W21: SANDRINGHAM | X21: 0 | Y21: 1 | Z21: 0 | AA21: 105 | AB21: 115 | AC21: 91.304347826086953 | AD21: 0 | CB21: {GOTO}BJ183~/M{RIGHT 7}{END}{DOWN}~V84~
A22: PRAHRAN | C22: APPLETON | F22: TOWNSEND | I22: GRANGE | L22: ANDERSON | O22: JOHNSTON | R22: CHAPMAN | W22: GEELONG WEST | X22: 0 | Y22: 1 | Z22: 0 | AA22: 93 | AB22: 102 | AC22: 91.17647058823529 | AD22: 0 | CB22: {GOTO}BJ203~/M{RIGHT 7}{END}{DOWN}~G104~
A23: GEELONG WEST | C23: HARRIS | F23: STEPHENS | I23: SMITH | L23: VAN ELDEN | O23: KLINE | R23: HALL | W23: OAKLEIGH | X23: 0 | Y23: 1 | Z23: 0 | AA23: 104 | AB23: 145 | AC23: 71.724137931034477 | AD23: 0 | CB23: {GOTO}AL103~/M{END}{RIGHT}{END}{DOWN}~P103~
A24: GOALKICKERS | Q24: ANDERSON | T24: KENT | W24: WILLIAMSTOWN | X24: 0 | Y24: 1 | Z24: 0 | AA24: 42 | AB24: 118 | AC24: 35.593220338983052 | AD24: 0 | CB24: {GOTO}BJ223~/M{RIGHT 7}{END}{DOWN}~V104~
A25: PRAHRAN | C25: APPLETON 3 | F25: SMITH 3 | I25: PAYNE 2 | K25: CROWE | M25: JOHNSTON | O25: TOWNSEND | R25: HUGHES | CB25: {GOTO}BJ243~/M{RIGHT 7}{END}{DOWN}~G124~
A26: GEELONG WEST | C26: STEPHENS 3 | F26: WARREN 2 | I26: FRIEND 2 | K26: WELLS | M26: ARKLAY | O26: STOKES | Q26: MANSON | S26: LINKE | U26: GILLIES | CB26: {GOTO}AL123~/M{END}{RIGHT}{END}{DOWN}~P123~
CB27: {GOTO}BJ263~/M{RIGHT 7}{END}{DOWN}~V124~
A28: DANDENONG | C28: 4 | D28: 6 | E28: =C28*6+D28 -> 30 | G28: 6 | H28: 11 | I28: =G28*6+H28 -> 47 | K28: 12 | L28: 17 | M28: =K28*6+L28 -> 89 | O28: 16 | P28: 22 | Q28: =O28*6+P28 -> 118 | S28: DANDENONG | CB28: {GOTO}BJ283~/M{RIGHT 7}{END}{DOWN}~G144~
A29: WILLIAMSTOWN | C29: 0 | D29: 2 | E29: =C29*6+D29 -> 2 | G29: 2 | H29: 5 | I29: =G29*6+H29 -> 17 | K29: 4 | L29: 9 | M29: =K29*6+L29 -> 33 | O29: 5 | P29: 12 | Q29: =O29*6+P29 -> 42 | S29: MURLEY | CB29: {GOTO}AL143~/M{END}{RIGHT}{END}{DOWN}~P143~
A30: BEST PLAYERS | CB30: {GOTO}BJ303~/M{RIGHT 7}{END}{DOWN}~V144~
A31: DANDENONG | C31: HIBBERT | F31: PATTERSON | I31: ANGUS | L31: WALFORD | O31: MUIR | R31: FIELDER | CB31: {GOTO}BJ323~/M{RIGHT 7}{END}{DOWN}~G164~
A32: WILLIAMSTOWN | C32: SINNOTT | F32: THOMPSON | I32: FANNING | L32: VINEY | O32: LAWERSON | R32: GILL | CB32: {GOTO}AL163~/M{END}{RIGHT}{END}{DOWN}~P163~
A33: GOALKICKERS | CB33: {GOTO}BJ343~/M{RIGHT 7}{END}{DOWN}~V164~
A34: DANDENONG | C34: HIBBERT 3 | F34: FLAHERTY 3 | I34: B SHINNERS 2 | L34: MUIR 2 | N34: PATTERSON 2 | Q34: ORCHARD | S34: ANGUS | U34: KENNEDY | X34: MELAI | CB34: {HOME}
A35: WILLIAMSTOWN | C35: J SCOTT 2 | F35: L STILLMAN 2 | J35: JAMES
A37: PRESTON | C37: 5 | D37: 8 | E37: =C37*6+D37 -> 38 | G37: 7 | H37: 11 | I37: =G37*6+H37 -> 53 | K37: 9 | L37: 13 | M37: =K37*6+L37 -> 67 | O37: 14 | P37: 16 | Q37: =O37*6+P37 -> 100 | S37: SUNSHINE
A38: SUNSHINE | C38: 4 | D38: 3 | E38: =C38*6+D38 -> 27 | G38: 7 | H38: 7 | I38: =G38*6+H38 -> 49 | K38: 11 | L38: 12 | M38: =K38*6+L38 -> 78 | O38: 13 | P38: 14 | Q38: =O38*6+P38 -> 92 | S38: GAMBETTA
A39: BEST PLAYERS
A40: PRESTON | C40: CLARK | F40: MIDDLETON | I40: JINKS | L40: JOHNSTON | O40: MARTIN | R40: STEPHENS
A41: SUNSHINE | C41: LLOYD | F41: BAIRD | I41: PIERZAK | L41: BENSON | O41: GOOLD | R41: SLADDIN
A42: GOALKICKERS
A43: PRESTON | C43: MIDDLETON 5 | F43: CLARK 3 | I43: O'SULLIVAN 2 | L43: JOHNSTON 2 | O43: PETTIGREW | R43: STEWART
A44: SUNSHINE | C44: LLOYD 5 | F44: BAIRD 3 | I44: PIERZAK 2 | L44: TOULMIN | N44: ALLEN | P44: SZKINIK
A46: PORT MELBOURNE | C46: 5 | D46: 6 | E46: =C46*6+D46 -> 36 | G46: 11 | H46: 8 | I46: =G46*6+H46 -> 74 | K46: 19 | L46: 10 | M46: =K46*6+L46 -> 124 | O46: 22 | P46: 13 | Q46: =O46*6+P46 -> 145 | S46: OAKLEIGH
A47: OAKLEIGH | C47: 4 | D47: 2 | E47: =C47*6+D47 -> 26 | G47: 6 | H47: 4 | I47: =G47*6+H47 -> 40 | K47: 13 | L47: 6 | M47: =K47*6+L47 -> 84 | O47: 16 | P47: 8 | Q47: =O47*6+P47 -> 104 | S47: HAYES
A48: BEST PLAYERS
A49: PORT MELBOURNE | C49: BEHAN | F49: COOK | I49: HERROD | L49: ANDERSON | O49: GOSS | Q49: ELLIOTT
A50: OAKLEIGH | C50: RITTERMAN | F50: MOORE | I50: FORSTER | L50: BILLING | O50: PLANT | Q50: CLOKE
A51: GOALKICKERS
A52: PORT MELBOURNE | C52: ANDERSON 8 | F52: GOSS 4 | H52: BEHAN 3 | J52: BROWN 2 | M52: BUCKLEY 2 | P52: HOLT | R52: BECKWITH | U52: ELLIOTT
A53: OAKLEIGH | C53: MOORE 5 | F53: RITTERMAN 4 | I53: CLOKE 3 | K53: TESERIERO | M53: BILLING | O53: McGRATH | Q53: PLANT
A55: ROUND 2 | E55: 28TH APRIL | J55: WEATHER | N55: GROUNDS HEAVY | S55: PLAYED AT
D56: 1ST QTR | H56: 2ND QTR | L56: 3RD QTR | P56: FINAL | S56: PRESTON
A57: PRESTON | C57: 2 | D57: 3 | E57: =C57*6+D57 -> 15 | G57: 2 | H57: 5 | I57: =G57*6+H57 -> 17 | K57: 8 | L57: 9 | M57: =K57*6+L57 -> 57 | O57: 13 | P57: 12 | Q57: =O57*6+P57 -> 90 | S57: UMPIRE | X57: LADDER | AB57: ROUND | AD57: 2
A58: DANDENONG | C58: 3 | D58: 3 | E58: =C58*6+D58 -> 21 | G58: 5 | H58: 11 | I58: =G58*6+H58 -> 41 | K58: 8 | L58: 12 | M58: =K58*6+L58 -> 60 | O58: 11 | P58: 15 | Q58: =O58*6+P58 -> 81 | S58: STIRLING
A59: BEST PLAYERS | W59: TEAM | X59: W | Y59: L | Z59: D | AA59: FOR | AB59: AGST | AC59: % | AD59: PTS
A60: PRESTON | C60: G SMITH | F60: JEWELL | I60: CLARK | L60: BROWN | O60: MIDDLETON | R60: STEPHENS
A61: DANDENONG | C61: FLAHERTY | F61: ESLER | I61: B SHINNERS | L61: DAVIES | O61: HIBBERT | R61: MELAI | W61: PORT MELBOURNE | X61: 2 | Y61: 0 | Z61: 0 | AA61: 278 | AB61: 166 | AC61: 167.47 | AD61: 8
A62: GOALKICKERS | W62: PRAHRAN | X62: 2 | Y62: 0 | Z62: 0 | AA62: 205 | AB62: 145 | AC62: 141.37931034482759 | AD62: 8
A63: PRESTON | C63: CLARK 4 | F63: MIDDLETON 4 | I63: JOHNSTON 3 | L63: O'SULLIVAN | O63: WEIGHTMAN | W63: PRESTON | X63: 2 | Y63: 0 | Z63: 0 | AA63: 190 | AB63: 173 | AC63: 109.82658959537572 | AD63: 8
A64: DANDENONG | C64: FLAHERTY 4 | F64: KENNEDY 2 | I64: HIBBERT | K64: PATTERSON | N64: B SHINNERS | Q64: HOULT | S64: KENDALL | W64: DANDENONG | X64: 1 | Y64: 1 | Z64: 0 | AA64: 199 | AB64: 132 | AC64: 150.75757575757575 | AD64: 4
A66: PORT MELBOURNE | C66: 6 | D66: 3 | E66: =C66*6+D66 -> 39 | G66: 13 | H66: 5 | I66: =G66*6+H66 -> 83 | K66: 19 | L66: 9 | M66: =K66*6+L66 -> 123 | O66: 20 | P66: 13 | Q66: =O66*6+P66 -> 133 | S66: PORT MELBOURNE | W66: GEELONG WEST | X66: 1 | Y66: 1 | Z66: 0 | AA66: 187 | AB66: 145 | AC66: 128.9655172413793 | AD66: 4
A67: SUNSHINE | C67: 1 | D67: 2 | E67: =C67*6+D67 -> 8 | G67: 3 | H67: 4 | I67: =G67*6+H67 -> 22 | K67: 5 | L67: 6 | M67: =K67*6+L67 -> 36 | O67: 8 | P67: 14 | Q67: =O67*6+P67 -> 62 | S67: O'BRIEN | W67: OAKLEIGH | X67: 1 | Y67: 1 | Z67: 0 | AA67: 232 | AB67: 226 | AC67: 102.65486725663717 | AD67: 4
A68: BEST PLAYERS | W68: CAULFIELD | X68: 1 | Y68: 1 | Z68: 0 | AA68: 196 | AB68: 233 | AC68: 84.12017167381974 | AD68: 4
A69: PORT MELBOURNE | C69: ANDERSON | F69: GOSS | I69: ELLIOTT | L69: HARLAND | O69: COOK | R69: BUCKLEY | W69: SANDRINGHAM | X69: 0 | Y69: 2 | Z69: 0 | AA69: 148 | AB69: 209 | AC69: 70.813397129186598 | AD69: 0
A70: SUNSHINE | C70: GOOLD | F70: BENSON | I70: NEISH | L70: ALLEN | O70: MADDOX | R70: CRAWFORD | W70: SUNSHINE | X70: 0 | Y70: 2 | Z70: 0 | AA70: 154 | AB70: 233 | AC70: 66.09 | AD70: 0
A71: GOALKICKERS | W71: WILLIAMSTOWN | X71: 0 | Y71: 2 | Z71: 0 | AA71: 94 | AB71: 221 | AC71: 42.533936651583709 | AD71: 0
A72: PORT MELBOURNE | C72: ANDERSON 8 | F72: P GOSS 2 | I72: BUCKLEY 2 | L72: ERWIN 2 | N72: HOLT 2 | P72: ELLIOTT 2 | R72: BROWN | T72: HARLAND
A73: SUNSHINE | C73: CRAWFORD 3 | F73: DARUL 2 | I73: TOULMIN | K73: GOOLD | M73: SZKLININK
A75: GEELONG WEST | C75: 2 | D75: 5 | E75: =C75*6+D75 -> 17 | G75: 4 | H75: 7 | I75: =G75*6+H75 -> 31 | K75: 10 | L75: 10 | M75: =K75*6+L75 -> 70 | O75: 13 | P75: 16 | Q75: =O75*6+P75 -> 94 | S75: GEELONG WEST
A76: SANDRINGHAM | C76: 0 | D76: 1 | E76: =C76*6+D76 -> 1 | G76: 2 | H76: 4 | I76: =G76*6+H76 -> 16 | K76: 5 | L76: 5 | M76: =K76*6+L76 -> 35 | O76: 6 | P76: 7 | Q76: =O76*6+P76 -> 43 | S76: HAYES
A77: BEST PLAYERS
A78: GEELONG WEST | C78: STEPHENS | F78: HARRIS | I78: VAN ELDEN | L78: YATES | O78: WARREN | R78: RADOJEVIC
A79: SANDRINGHAM | C79: LYONS | F79: MURRAY | I79: TAYLOR | L79: MARSHALL | O79: LATCHEM | R79: GRANT
A80: GOALKICKERS
A81: GEELONG WEST | C81: RADOJEVIC 5 | F81: HARRIS 2 | I81: ARKLAY 2 | L81: LINKE | N81: WARREN | P81: BRIGHT | R81: MANSON
A82: SANDRINGHAM | C82: I COOPER 2 | F82: WARD | I82: GRANT | K82: LATCHEM | N82: BRENNER
A84: OAKLEIGH | C84: 4 | D84: 3 | E84: =C84*6+D84 -> 27 | G84: 10 | H84: 7 | I84: =G84*6+H84 -> 67 | K84: 15 | L84: 13 | M84: =K84*6+L84 -> 103 | O84: 18 | P84: 20 | Q84: =O84*6+P84 -> 128 | S84: PRINCES PARK
A85: CAULFIELD | C85: 3 | D85: 3 | E85: =C85*6+D85 -> 21 | G85: 5 | H85: 4 | I85: =G85*6+H85 -> 34 | K85: 8 | L85: 8 | M85: =K85*6+L85 -> 56 | O85: 11 | P85: 15 | Q85: =O85*6+P85 -> 81 | S85: WENN
A86: BEST PLAYERS
A87: OAKLEIGH | C87: MOORE | F87: RITTERMAN | I87: P LILLEY | L87: WENN | O87: STEWART | R87: PLANT
A88: CAULFIELD | C88: TEMPEST | F88: JEWELL | I88: DOWSETT | L88: R FELDMAN | O88: GOODEN | R88: WHITE
A89: GOALKICKERS
A90: OAKLEIGH | C90: MOORE 6 | F90: RITTERMAN 3 | I90: WENN 2 | K90: PLANT 2 | M90: BILLING | O90: O'KANE | Q90: FORSTER | S90: McDONALD | V90: CLOKE
A91: CAULFIELD | C91: DOWSETT 2 | F91: R FELDMAN 2 | I91: GOODEN 2 | L91: BROWN | N91: BAKER | P91: LOGAN | R91: JEWELL | T91: WHITE
A93: PRAHRAN | C93: 4 | D93: 2 | E93: =C93*6+D93 -> 26 | G93: 6 | H93: 4 | I93: =G93*6+H93 -> 40 | K93: 12 | L93: 10 | M93: =K93*6+L93 -> 82 | O93: 15 | P93: 13 | Q93: =O93*6+P93 -> 103 | S93: WILLIAMSTOWN
A94: WILLIAMSTOWN | C94: 1 | D94: 3 | E94: =C94*6+D94 -> 9 | G94: 3 | H94: 8 | I94: =G94*6+H94 -> 26 | K94: 3 | L94: 12 | M94: =K94*6+L94 -> 30 | O94: 6 | P94: 16 | Q94: =O94*6+P94 -> 52 | S94: STABB
A95: BEST PLAYERS
A96: PRAHRAN | C96: CROWE | F96: G SMITH | I96: KENT | L96: CHAPMAN | O96: PIROUET | R96: APPLETON
A97: WILLIAMSTOWN | C97: THOMPSON | F97: L STILLMAN | I97: G SCOTT | L97: JAMES | O97: LAWERSON | R97: GILL
A98: GOALKICKERS
A99: PRAHRAN | C99: G SMITH 3 | F99: APPLETON 3 | I99: ANDERSON 3 | L99: WILKIE 2 | N99: CROWE | P99: R JOHNSTON | S99: HOMANN | V99: KENT
A100: WILLIAMSTOWN | C100: SHAW 2 | F100: G SCOTT | I100: JAMES | K100: FANNING | M100: A RICHARDS
A102: ROUND 3 | E102: 5TH MAY | J102: WEATHER | N102: FINE | S102: PLAYED AT
D103: 1ST QTR | H103: 2ND QTR | L103: 3RD QTR | P103: FINAL | S103: DANDENONG
A104: DANDENONG | C104: 3 | D104: 4 | E104: =C104*6+D104 -> 22 | G104: 8 | H104: 8 | I104: =G104*6+H104 -> 56 | K104: 11 | L104: 12 | M104: =K104*6+L104 -> 78 | O104: 16 | P104: 14 | Q104: =O104*6+P104 -> 110 | S104: UMPIRE | X104: LADDER | AB104: ROUND | AD104: 3
A105: OAKLEIGH | C105: 2 | D105: 4 | E105: =C105*6+D105 -> 16 | G105: 5 | H105: 6 | I105: =G105*6+H105 -> 36 | K105: 10 | L105: 12 | M105: =K105*6+L105 -> 72 | O105: 14 | P105: 18 | Q105: =O105*6+P105 -> 102 | S105: GAMBETTA
A106: BEST PLAYERS | W106: TEAM | X106: W | Y106: L | Z106: D | AA106: FOR | AB106: AGST | AC106: % | AD106: PTS
A107: DANDENONG | C107: FLAHERTY | F107: MILLER | I107: HIBBERT | L107: BECK | N107: HARRINGTON | Q107: WALFORD
A108: OAKLEIGH | C108: CLOKE | F108: BILLING | I108: P LILLEY | L108: STEWART | N108: MCGRATH | Q108: TESERIERO | W108: PORT MELBOURNE | X108: 3 | Y108: 0 | Z108: 0 | AA108: 389 | AB108: 275 | AC108: 141.45 | AD108: 12
A109: GOALKICKERS | W109: PRAHRAN | X109: 3 | Y109: 0 | Z109: 0 | AA109: 298 | AB109: 234 | AC109: 127.35042735042735 | AD109: 12
A110: DANDENONG | C110: MILLER 6 | F110: FLAHERTY 6 | I110: B SHINNERS | L110: HIBBERT | N110: PATTERSON | Q110: WALFORD | W110: PRESTON | X110: 3 | Y110: 0 | Z110: 0 | AA110: 319 | AB110: 299 | AC110: 106.68896321070234 | AD110: 12
A111: OAKLEIGH | C111: CLOKE 4 | F111: MURNANE 2 | I111: JACKSON 2 | L111: MCDONALD 2 | O111: PLANT 2 | Q111: MCGRATH | S111: BILLING | W111: GEELONG WEST | X111: 2 | Y111: 1 | Z111: 0 | AA111: 363 | AB111: 230 | AC111: 157.82608695652175 | AD111: 8
A113: PRESTON | C113: 6 | D113: 5 | E113: =C113*6+D113 -> 41 | G113: 11 | H113: 10 | I113: =G113*6+H113 -> 76 | K113: 15 | L113: 23 | M113: =K113*6+L113 -> 113 | O113: 17 | P113: 27 | Q113: =O113*6+P113 -> 129 | S113: C'FIELD | W113: DANDENONG | X113: 2 | Y113: 1 | Z113: 0 | AA113: 309 | AB113: 234 | AC113: 132.05128205128204 | AD113: 8
A114: CAULFIELD | C114: 4 | D114: 4 | E114: =C114*6+D114 -> 28 | G114: 10 | H114: 10 | I114: =G114*6+H114 -> 70 | K114: 15 | L114: 15 | M114: =K114*6+L114 -> 105 | O114: 18 | P114: 18 | Q114: =O114*6+P114 -> 126 | S114: HAYES | W114: OAKLEIGH | X114: 1 | Y114: 2 | Z114: 0 | AA114: 334 | AB114: 336 | AC114: 99.404761904761898 | AD114: 4
A115: BEST PLAYERS | W115: CAULFIELD | X115: 1 | Y115: 2 | Z115: 0 | AA115: 322 | AB115: 362 | AC115: 88.950276243093924 | AD115: 4
A116: PRESTON | C116: WEIGHTMAN | F116: COBAIN | I116: SMITH | K116: McGAW | N116: CLARK | Q116: JOHNSTON | W116: SANDRINGHAM | X116: 0 | Y116: 3 | Z116: 0 | AA116: 257 | AB116: 320 | AC116: 80.3125 | AD116: 0
A117: CAULFIELD | C117: MAGUIRE | F117: JEWELL | I117: CLIFF | K117: RENOWDEN | N117: FRANKLIN | Q117: ROBINSON | W117: SUNSHINE | X117: 0 | Y117: 3 | Z117: 0 | AA117: 243 | AB117: 326 | AC117: 74.54 | AD117: 0
A118: GOALKICKERS | W118: WILLIAMSTOWN | X118: 0 | Y118: 3 | Z118: 0 | AA118: 179 | AB118: 397 | AC118: 45.088161209068012 | AD118: 0
A119: PRESTON | C119: CLARK 8 | E119: GRAINGER 2 | H119: WEIGHTMAN 2 | K119: JOHNSTON 2 | N119: PETTIGREW | Q119: WATERS | S119: STEWART
A120: CAULFIELD | C120: MAGUIRE 6 | F120: CLIFF 3 | H120: ROBINSON 3 | K120: JEWELL 2 | M120: RENOWDEN 2 | P120: EINSEIDEL | R120: BAKER
A122: GEELONG WEST | C122: 6 | D122: 5 | E122: =C122*6+D122 -> 41 | G122: 13 | H122: 9 | I122: =G122*6+H122 -> 87 | K122: 21 | L122: 13 | M122: =K122*6+L122 -> 139 | O122: 27 | P122: 14 | Q122: =O122*6+P122 -> 176 | S122: G. W.
A123: WILLIAMSTOWN | C123: 2 | D123: 3 | E123: =C123*6+D123 -> 15 | G123: 6 | H123: 9 | I123: =G123*6+H123 -> 45 | K123: 9 | L123: 10 | M123: =K123*6+L123 -> 64 | O123: 12 | P123: 13 | Q123: =O123*6+P123 -> 85 | S123: O'BRIEN
A124: BEST PLAYERS
A125: GEELONG WEST | C125: HARRIS | F125: TAYLOR | I125: YATES | L125: WARREN | O125: BRIGHT | Q125: MANSON
A126: WILLIAMSTOWN | C126: L STILLMAN | F126: THOMPSON | I126: SHAW | L126: AUGHTON | O126: SCOTT | Q126: N STILLMAN
A127: GOALKICKERS
A128: GEELONG WEST | C128: RADOJEVIC 5 | F128: LINKE 3 | H128: MANSON 3 | J128: ARKLAY 3 | M128: TAYLOR 3 | O128: BRIGHT 3 | Q128: HARRIS 2 | S128: STEPHENS 2 | V128: IRWIN 2 | X128: YATES
A129: WILLIAMSTOWN | C129: SHAW 5 | F129: L STILLMAN 2 | J129: FANNING 2 | M129: RICHARDS | P129: AUGHTON | R129: SCOTT
A131: PORT MELBOURNE | C131: 5 | D131: 10 | E131: =C131*6+D131 -> 40 | G131: 9 | H131: 13 | I131: =G131*6+H131 -> 67 | K131: 11 | L131: 16 | M131: =K131*6+L131 -> 82 | O131: 15 | P131: 21 | Q131: =O131*6+P131 -> 111 | S131: BEACH ROAD
A132: SANDRINGHAM | C132: 2 | D132: 2 | E132: =C132*6+D132 -> 14 | G132: 6 | H132: 8 | I132: =G132*6+H132 -> 44 | K132: 13 | L132: 12 | M132: =K132*6+L132 -> 90 | O132: 16 | P132: 13 | Q132: =O132*6+P132 -> 109 | S132: TORNEY
A133: BEST PLAYERS
A134: PORT MELBOURNE | C134: LOCKHART | F134: BUCKLEY | I134: HOLT | L134: GOSS | N134: BECKWITH | Q134: HARLAND
A135: SANDRINGHAM | C135: MURRAY | F135: COOPER | I135: KENNEDY | L135: WARD | N135: LYONS | Q135: MARSHALL
A136: GOALKICKERS
A137: PORT MELBOURNE | C137: HOLT 5 | F137: BEHAN 3 | I137: BECKWITH 3 | L137: GOSS 2 | N137: CRITCH | P137: ELLIOT
A138: SANDRINGHAM | C138: COOPER 9 | F138: MURRAY 3 | I138: TAYLOR 2 | L138: WARD | N138: LYONS
A140: PRAHRAN | C140: 3 | D140: 2 | E140: =C140*6+D140 -> 20 | G140: 8 | H140: 5 | I140: =G140*6+H140 -> 53 | K140: 9 | L140: 7 | M140: =K140*6+L140 -> 61 | O140: 14 | P140: 9 | Q140: =O140*6+P140 -> 93 | S140: TOORAK PARK
A141: SUNSHINE | C141: 3 | D141: 3 | E141: =C141*6+D141 -> 21 | G141: 6 | H141: 4 | I141: =G141*6+H141 -> 40 | K141: 11 | L141: 9 | M141: =K141*6+L141 -> 75 | O141: 13 | P141: 11 | Q141: =O141*6+P141 -> 89 | S141: DAVIS
A142: BEST PLAYERS
A143: PRAHRAN | C143: JOHNSTON | F143: TOWNSEND | I143: KENT | L143: APPLETON | O143: ROWE | Q143: GRANGE
A144: SUNSHINE | C144: CRAWFORD | F144: LLOYD | I144: MADDOX | L144: ALLEN | O144: BAIRD | Q144: HUTCHINSON
A145: GOALKICKERS
A146: PRAHRAN | C146: MCFARLANE 3 | F146: ANDERSON 3 | I146: TOWNSEND 2 | L146: G SMITH 2 | O146: JOHNSTON 2 | R146: KENT | T146: HUGHES
A147: SUNSHINE | C147: CRAWFORD 6 | F147: ALLEN 3 | I147: JONES 2 | K147: HUTCHINSON | N147: MADDOX
A149: ROUND 4 | E149: 12TH MAY | J149: WEATHER | N149: FINE | S149: PLAYED AT
D150: 1ST QTR | H150: 2ND QTR | L150: 3RD QTR | P150: FINAL | S150: PRESTON
A151: GEELONG WEST | C151: 5 | D151: 6 | E151: =C151*6+D151 -> 36 | G151: 7 | H151: 9 | I151: =G151*6+H151 -> 51 | K151: 13 | L151: 14 | M151: =K151*6+L151 -> 92 | O151: 15 | P151: 15 | Q151: =O151*6+P151 -> 105 | S151: UMPIRE | X151: LADDER | AB151: ROUND | AD151: 4
A152: PRESTON | C152: 3 | D152: 1 | E152: =C152*6+D152 -> 19 | G152: 8 | H152: 3 | I152: =G152*6+H152 -> 51 | K152: 11 | L152: 5 | M152: =K152*6+L152 -> 71 | O152: 15 | P152: 10 | Q152: =O152*6+P152 -> 100 | S152: DAVIS
A153: BEST PLAYERS | W153: TEAM | X153: W | Y153: L | Z153: D | AA153: FOR | AB153: AGST | AC153: % | AD153: PTS
A154: GEELONG WEST | C154: W DUNNE | F154: HALL | I154: BRIGHT | L154: LINKE | N154: KLINE | Q154: HARRIS
A155: PRESTON | C155: PETTIGREW | F155: WEIGHTMAN | I155: COBAIN | L155: CLARK | N155: MARTIN | Q155: VICKERY | W155: PORT MELBOURNE | X155: 4 | Y155: 0 | Z155: 0 | AA155: 505 | AB155: 366 | AC155: 137.98 | AD155: 16
A156: GOALKICKERS | W156: GEELONG WEST | X156: 3 | Y156: 1 | Z156: 0 | AA156: 468 | AB156: 330 | AC156: 141.81818181818181 | AD156: 12
A157: GEELONG WEST | C157: BRIGHT 3 | E157: HARRIS 3 | G157: ARKLAY 3 | J157: MANSON 2 | M157: FRIEND 2 | O157: LINKE | Q157: YATES | W157: DANDENONG | X157: 3 | Y157: 1 | Z157: 0 | AA157: 438 | AB157: 316 | AC157: 138.60759493670886 | AD157: 12
A158: PRESTON | C158: CLARK 6 | E158: VICKERY 4 | H158: WEIGHTMAN | K158: JOHNSTON | M158: COBAIN | O158: PETTIGREW | R158: WATERS | W158: PRAHRAN | X158: 3 | Y158: 1 | Z158: 0 | AA158: 380 | AB158: 363 | AC158: 104.68319559228649 | AD158: 12
A160: DANDENONG | C160: 3 | D160: 1 | E160: =C160*6+D160 -> 19 | G160: 6 | H160: 9 | I160: =G160*6+H160 -> 45 | K160: 10 | L160: 11 | M160: =K160*6+L160 -> 71 | O160: 19 | P160: 15 | Q160: =O160*6+P160 -> 129 | S160: TOORAK PARK | W160: PRESTON | X160: 3 | Y160: 1 | Z160: 0 | AA160: 419 | AB160: 404 | AC160: 103.71287128712871 | AD160: 12
A161: PRAHRAN | C161: 5 | D161: 4 | E161: =C161*6+D161 -> 34 | G161: 10 | H161: 7 | I161: =G161*6+H161 -> 67 | K161: 11 | L161: 8 | M161: =K161*6+L161 -> 74 | O161: 12 | P161: 10 | Q161: =O161*6+P161 -> 82 | S161: McBAIN | W161: OAKLEIGH | X161: 2 | Y161: 2 | Z161: 0 | AA161: 478 | AB161: 435 | AC161: 109.88505747126437 | AD161: 8
A162: BEST PLAYERS | W162: CAULFIELD | X162: 1 | Y162: 3 | Z162: 0 | AA162: 413 | AB162: 478 | AC162: 86.40167364016736 | AD162: 4
A163: DANDENONG | C163: FLAHERTY | F163: HARRINGTON | I163: JONES | L163: HIBBERT | N163: HENRIKSEN | Q163: MELAI | W163: WILLIAMSTOWN | X163: 1 | Y163: 3 | Z163: 0 | AA163: 310 | AB163: 507 | AC163: 61.143984220907299 | AD163: 4
A164: PRAHRAN | C164: JOHNSTON | F164: GRANGE | I164: APPLETON | L164: KENT | N164: CULPIN | Q164: HUGHES | W164: SUNSHINE | X164: 0 | Y164: 4 | Z164: 0 | AA164: 353 | AB164: 457 | AC164: 77.24 | AD164: 0
A165: GOALKICKERS | W165: SANDRINGHAM | X165: 0 | Y165: 4 | Z165: 0 | AA165: 356 | AB165: 464 | AC165: 76.724137931034477 | AD165: 0
A166: DANDENONG | C166: FLAHERTY 5 | F166: MILLER 5 | I166: JONES 4 | K166: MELAI 2 | M166: WALFORD | P166: B SHINNERS | S166: HOULT
A167: PRAHRAN | C167: APPLETON 3 | F167: K SMITH 3 | I167: ANDERSON 2 | L167: McFARLANE | O167: G SMITH | Q167: TOWNSEND | T167: KENT
A169: OAKLEIGH | C169: 4 | D169: 3 | E169: =C169*6+D169 -> 27 | G169: 8 | H169: 10 | I169: =G169*6+H169 -> 58 | K169: 11 | L169: 16 | M169: =K169*6+L169 -> 82 | O169: 20 | P169: 24 | Q169: =O169*6+P169 -> 144 | S169: OAKLEIGH
A170: SANDRINGHAM | C170: 4 | D170: 5 | E170: =C170*6+D170 -> 29 | G170: 7 | H170: 10 | I170: =G170*6+H170 -> 52 | K170: 12 | L170: 13 | M170: =K170*6+L170 -> 85 | O170: 13 | P170: 21 | Q170: =O170*6+P170 -> 99 | S170: STIRLING
A171: BEST PLAYERS
A172: OAKLEIGH | C172: BILLING | F172: D NESBIT | I172: FORSTER | L172: TESSORIERO | O172: CLOKE | R172: WENN
A173: SANDRINGHAM | C173: LYONS | F173: McNICHOLAS | I173: SPURRELL | L173: FULLER | O173: SCHWARZMANN | R173: MURLEY
A174: GOALKICKERS
A175: OAKLEIGH | C175: MOORE 6 | F175: MURNANE 3 | I175: WENN 2 | K175: BILLING 2 | M175: FOOTE 2 | O175: QUINN | Q175: TESSORIERO | T175: D NESBIT | W175: FORSTER | X175: CLOKE
A176: SANDRINGHAM | C176: SCHWARZMANN 4 | G176: LYONS 2 | I176: MCNICHOLAS 2 | L176: MURLEY | N176: CUMMING | Q176: LIDDELL | S176: LATCHAM | V176: GREEN
A178: WILLIAMSTOWN | C178: 0 | D178: 3 | E178: =C178*6+D178 -> 3 | G178: 8 | H178: 9 | I178: =G178*6+H178 -> 57 | K178: 15 | L178: 11 | M178: =K178*6+L178 -> 101 | O178: 19 | P178: 17 | Q178: =O178*6+P178 -> 131 | S178: WILLIAMSTOWN
A179: SUNSHINE | C179: 7 | D179: 5 | E179: =C179*6+D179 -> 47 | G179: 7 | H179: 7 | I179: =G179*6+H179 -> 49 | K179: 13 | L179: 11 | M179: =K179*6+L179 -> 89 | O179: 16 | P179: 14 | Q179: =O179*6+P179 -> 110 | S179: CARLILE
A180: BEST PLAYERS
A181: WILLIAMSTOWN | C181: L STILLMAN | F181: THOMPSON | I181: J SCOTT | L181: POWLEY | N181: AUGHTON | Q181: ROACHE
A182: SUNSHINE | C182: LLOYD | F182: BENSON | I182: BAIRD | L182: MADDOX | N182: VELLA | Q182: CRAWFORD
A183: GOALKICKERS
A184: WILLIAMSTOWN | C184: SHAW 4 | E184: L STILLMAN 3 | H184: POWLEY 3 | J184: J SCOTT 2 | M184: N STILLMAN 2 | P184: FANNING 2 | S184: GILL | U184: AUGHTON | X184: GUBBINS
A185: SUNSHINE | C185: LLOYD 6 | F185: BENSON 3 | I185: MADDOX 2 | L185: BAIRD 2 | N185: CRAWFORD 2 | Q185: HUTCHINSON
A187: PORT MELBOURNE | C187: 4 | D187: 2 | E187: =C187*6+D187 -> 26 | G187: 8 | H187: 6 | I187: =G187*6+H187 -> 54 | K187: 12 | L187: 11 | M187: =K187*6+L187 -> 83 | O187: 17 | P187: 14 | Q187: =O187*6+P187 -> 116 | S187: P. M.
A188: CAULFIELD | C188: 3 | D188: 4 | E188: =C188*6+D188 -> 22 | G188: 8 | H188: 11 | I188: =G188*6+H188 -> 59 | K188: 9 | L188: 16 | M188: =K188*6+L188 -> 70 | O188: 12 | P188: 19 | Q188: =O188*6+P188 -> 91 | S188: GAMBETTA
A189: BEST PLAYERS
A190: PORT MELBOURNE | C190: ELLIOT | F190: BUCKLEY | I190: COOK | K190: HARLAND | N190: HERROD | Q190: BROWN
A191: CAULFIELD | C191: PERRY | F191: CLIFF | I191: SIERAKOWSKI | L191: FELDMANN | O191: WHITE | Q191: TEMPEST
A192: GOALKICKERS
A193: PORT MELBOURNE | C193: ELLIOT 3 | E193: ANDERSON 3 | H193: BEHAN 2 | J193: HARLAND 2 | M193: HOLT 2 | O193: BROWN | Q193: GOSS | R193: COOK | T193: BUCKLEY | W193: ERWIN
A194: CAULFIELD | C194: MAGUIRE 3 | F194: ROBINSON 2 | I194: RENOWDEN 2 | L194: JEWELL 2 | O194: EINSIEDEL | Q194: CLIFF | S194: PERRY
A196: ROUND 5 | E196: 19TH MAY | J196: WEATHER | N196: SOUTH EAST WIND | S196: PLAYED AT
D197: 1ST QTR | H197: 2ND QTR | L197: 3RD QTR | P197: FINAL | S197: GEELONG WEST
A198: GEELONG WEST | C198: 4 | D198: 2 | E198: =C198*6+D198 -> 26 | G198: 8 | H198: 5 | I198: =G198*6+H198 -> 53 | K198: 11 | L198: 13 | M198: =K198*6+L198 -> 79 | O198: 13 | P198: 9 | Q198: =O198*6+P198 -> 87 | S198: UMPIRE | X198: LADDER | AB198: ROUND | AD198: 5
A199: PORT MELBOURNE | C199: 3 | D199: 8 | E199: =C199*6+D199 -> 26 | G199: 5 | H199: 14 | I199: =G199*6+H199 -> 44 | K199: 11 | L199: 15 | M199: =K199*6+L199 -> 81 | O199: 10 | P199: 17 | Q199: =O199*6+P199 -> 77 | S199: CARLILE
A200: BEST PLAYERS | W200: TEAM | X200: W | Y200: L | Z200: D | AA200: FOR | AB200: AGST | AC200: % | AD200: PTS
A201: GEELONG WEST | C201: YATES | F201: HALL | I201: SMITH | L201: VAN ELDEN | O201: HARRIS | R201: BERRY
A202: PORT MELBOURNE | C202: HERROD | F202: FRENCH | I202: COOK | L202: HOLT | O202: BECKWITH | R202: HARLAND | W202: GEELONG WEST | X202: 4 | Y202: 1 | Z202: 0 | AA202: 555 | AB202: 407 | AC202: 136.36363636363637 | AD202: 16
A203: GOALKICKERS | W203: PORT MELBOURNE | X203: 4 | Y203: 1 | Z203: 0 | AA203: 582 | AB203: 453 | AC203: 128.48 | AD203: 16
A204: GEELONG WEST | C204: STEPHENS 7 | F204: RADOJEVIC 3 | I204: ARKLAY | L204: IRVIN | N204: BRIGHT | W204: PRESTON | X204: 4 | Y204: 1 | Z204: 0 | AA204: 512 | AB204: 491 | AC204: 104.27698574338086 | AD204: 16
A205: PORT MELBOURNE | C205: HOLT 5 | F205: BECKWITH 2 | I205: N BROWN | L205: ELLIOT | N205: HARLAND | W205: DANDENONG | X205: 3 | Y205: 2 | Z205: 0 | AA205: 521 | AB205: 431 | AC205: 120.88167053364269 | AD205: 12
A207: OAKLEIGH | C207: 4 | D207: 5 | E207: =C207*6+D207 -> 29 | G207: 8 | H207: 11 | I207: =G207*6+H207 -> 59 | K207: 10 | L207: 13 | M207: =K207*6+L207 -> 73 | O207: 14 | P207: 18 | Q207: =O207*6+P207 -> 102 | S207: OAKLEIGH | W207: OAKLEIGH | X207: 3 | Y207: 2 | Z207: 0 | AA207: 580 | AB207: 520 | AC207: 111.53846153846153 | AD207: 12
A208: PRAHRAN | C208: 3 | D208: 7 | E208: =C208*6+D208 -> 25 | G208: 5 | H208: 9 | I208: =G208*6+H208 -> 39 | K208: 7 | L208: 13 | M208: =K208*6+L208 -> 55 | O208: 12 | P208: 13 | Q208: =O208*6+P208 -> 85 | S208: HAYES | W208: PRAHRAN | X208: 3 | Y208: 2 | Z208: 0 | AA208: 465 | AB208: 465 | AC208: 100 | AD208: 12
A209: BEST PLAYERS | W209: CAULFIELD | X209: 2 | Y209: 3 | Z209: 0 | AA209: 528 | AB209: 561 | AC209: 94.117647058823536 | AD209: 8
A210: OAKLEIGH | C210: P LILLEY | F210: D NESBIT | I210: WENN | L210: CLOKE | O210: MURNANE | R210: RITTERMAN | W210: SUNSHINE | X210: 1 | Y210: 4 | Z210: 0 | AA210: 437 | AB210: 517 | AC210: 84.53 | AD210: 4
A211: PRAHRAN | C211: ANDERSON | F211: JOHNSTON | I211: K SMITH | L211: CULPIN | O211: TOWNSEND | R211: GUNN | W211: WILLIAMSTOWN | X211: 1 | Y211: 4 | Z211: 0 | AA211: 397 | AB211: 600 | AC211: 66.166666666666671 | AD211: 4
A212: GOALKICKERS | R212: GAUNT | W212: SANDRINGHAM | X212: 0 | Y212: 5 | Z212: 0 | AA212: 416 | AB212: 548 | AC212: 75.912408759124091 | AD212: 0
A213: OAKLEIGH | C213: MURNANE 3 | F213: RITTERMAN 2 | I213: WENN 2 | K213: QUINN 2 | M213: J LILLEY | O213: FOOTE | Q213: CLOKE | S213: C NESBIT
A214: PRAHRAN | C214: K SMITH 5 | F214: G SMITH 3 | I214: JOHNSTON | K214: PAYNE | M214: KENT | O214: ANDERSON
A216: CAULFIELD | C216: 4 | D216: 1 | E216: =C216*6+D216 -> 25 | G216: 7 | H216: 4 | I216: =G216*6+H216 -> 46 | K216: 12 | L216: 8 | M216: =K216*6+L216 -> 80 | O216: 17 | P216: 13 | Q216: =O216*6+P216 -> 115 | S216: PRINCES PARK
A217: DANDENONG | C217: 5 | D217: 7 | E217: =C217*6+D217 -> 37 | G217: 8 | H217: 10 | I217: =G217*6+H217 -> 58 | K217: 10 | L217: 15 | M217: =K217*6+L217 -> 75 | O217: 11 | P217: 17 | Q217: =O217*6+P217 -> 83 | S217: ABBOTT
A218: BEST PLAYERS
A219: CAULFIELD | C219: WHITE | F219: FELDMANN | I219: FRIGO | L219: CLIFF | O219: PERRY | Q219: MAGUIRE
A220: DANDENONG | C220: HIBBERT | F220: JONES | I220: HENRIKSEN | L220: B SHINNERS | O220: BECK | Q220: K SHINNERS
A221: GOALKICKERS
A222: CAULFIELD | C222: MAGUIRE 5 | F222: WHITE 4 | I222: LOGAN 3 | K222: CLIFF | M222: GOODEN | O222: FRIGO | Q222: FRANKLIN | S222: JEWELL
A223: DANDENONG | C223: MILLER 5 | F223: FLAHERTY 3 | I223: BECK | K223: PATTERSON | N223: AUGUST
A225: SUNSHINE | C225: 1 | D225: 5 | E225: =C225*6+D225 -> 11 | G225: 4 | H225: 6 | I225: =G225*6+H225 -> 30 | K225: 6 | L225: 9 | M225: =K225*6+L225 -> 45 | O225: 12 | P225: 12 | Q225: =O225*6+P225 -> 84 | S225: BEACH ROAD
A226: SANDRINGHAM | C226: 3 | D226: 1 | E226: =C226*6+D226 -> 19 | G226: 6 | H226: 5 | I226: =G226*6+H226 -> 41 | K226: 7 | L226: 9 | M226: =K226*6+L226 -> 51 | O226: 8 | P226: 12 | Q226: =O226*6+P226 -> 60 | S226: GAMBETTA
A227: BEST PLAYERS
A228: SUNSHINE | C228: LLOYD | F228: PIERZAK | I228: GOOLD | L228: CLARKE | O228: ALLEN | R228: JONES
A229: SANDRINGHAM | C229: P CUMMINGS | F229: JACOBSEN | I229: MURLEY | L229: CARROLL | O229: FULLER | R229: MURRAY
A230: GOALKICKERS
A231: SUNSHINE | C231: CRAWFORD 4 | F231: BAIRD 3 | I231: JONES 2 | K231: LLOYD 2 | M231: MADDOX
A232: SANDRINGHAM | C232: COOPER | E232: FULLER | G232: LYONS | I232: LIDDELL | K232: N CUMMINGS | N232: SCHWARZMANN | R232: MURRAY | U232: CARROLL
A234: PRESTON | C234: 4 | D234: 3 | E234: =C234*6+D234 -> 27 | G234: 6 | H234: 10 | I234: =G234*6+H234 -> 46 | K234: 11 | L234: 13 | M234: =K234*6+L234 -> 79 | O234: 13 | P234: 15 | Q234: =O234*6+P234 -> 93 | S234: WILLIAMSTOWN
A235: WILLIAMSTOWN | C235: 1 | D235: 3 | E235: =C235*6+D235 -> 9 | G235: 4 | H235: 3 | I235: =G235*6+H235 -> 27 | K235: 11 | L235: 5 | M235: =K235*6+L235 -> 71 | O235: 13 | P235: 9 | Q235: =O235*6+P235 -> 87 | S235: WENN
A236: BEST PLAYERS
A237: PRESTON | C237: PETTIGREW | F237: JOHNSTON | I237: WEIGHTMAN | L237: ZUNNEBERG | O237: McGAW
A238: WILLIAMSTOWN | C238: J SCOTT | F238: AUGHTON | I238: GILL | L238: R POWLEY | O238: N STILLMAN
A239: GOALKICKERS
A240: PRESTON | C240: PETTIGREW 4 | F240: JOHNSTON 3 | I240: GRAINGER | K240: WEIGHTMAN | N240: MIDDLETON | Q240: VICKERY | S240: SMITH | U240: CLARK
A241: WILLIAMSTOWN | C241: SHAW 3 | F241: SCOTT 3 | I241: POWLEY 3 | L241: L STILLMAN 3 | O241: PERCY
A243: ROUND 6 | E243: 26TH MAY | J243: WEATHER | N243: SOUTH WEST WIND COLD | S243: PLAYED AT
D244: 1ST QTR | H244: 2ND QTR | L244: 3RD QTR | P244: FINAL | S244: TOORAK PARK
A245: PRAHRAN | C245: 4 | D245: 1 | E245: =C245*6+D245 -> 25 | G245: 10 | H245: 1 | I245: =G245*6+H245 -> 61 | K245: 12 | L245: 6 | M245: =K245*6+L245 -> 78 | O245: 17 | P245: 10 | Q245: =O245*6+P245 -> 112 | S245: UMPIRE | X245: LADDER | AB245: ROUND | AD245: 6
A246: PRESTON | C246: 4 | D246: 2 | E246: =C246*6+D246 -> 26 | G246: 7 | H246: 2 | I246: =G246*6+H246 -> 44 | K246: 10 | L246: 4 | M246: =K246*6+L246 -> 64 | O246: 13 | P246: 8 | Q246: =O246*6+P246 -> 86 | S246: GAMBETTA
A247: BEST PLAYERS | W247: TEAM | X247: W | Y247: L | Z247: D | AA247: FOR | AB247: AGST | AC247: % | AD247: PTS
A248: PRAHRAN | C248: CHAPMAN | F248: ANDERSON | I248: O'BRIEN | L248: WILLIAMS | O248: K SMITH | Q248: GUNN
A249: PRESTON | C249: VICKERY | F249: MIDDLETON | I249: JINKS | L249: WEIGHTMAN | O249: JEWELL | Q249: ZUNNEBERG | W249: GEELONG WEST | X249: 5 | Y249: 1 | Z249: 0 | AA249: 675 | AB249: 478 | AC249: 141.21338912133891 | AD249: 20
A250: GOALKICKERS | R250: ROLFE | W250: PORT MELBOURNE | X250: 5 | Y250: 1 | Z250: 0 | AA250: 730 | AB250: 549 | AC250: 132.97 | AD250: 20
A251: PRAHRAN | C251: K SMITH 4 | F251: APPLETON 4 | I251: TOWNSEND 3 | L251: WILLIAMS 2 | O251: G SMITH | Q251: JOHNSTON | S251: PAYNE | W251: DANDENONG | X251: 4 | Y251: 2 | Z251: 0 | AA251: 629 | AB251: 483 | AC251: 130.22774327122153 | AD251: 16
A252: PRESTON | C252: VICKERY 6 | F252: KIRKMAN 2 | I252: McGAW | K252: STEPHENS | M252: PETTIGREW | P252: WILSON | W252: OAKLEIGH | X252: 4 | Y252: 2 | Z252: 0 | AA252: 675 | AB252: 610 | AC252: 110.65573770491804 | AD252: 16
A254: GEELONG WEST | C254: 2 | D254: 4 | E254: =C254*6+D254 -> 16 | G254: 6 | H254: 7 | I254: =G254*6+H254 -> 43 | K254: 10 | L254: 18 | M254: =K254*6+L254 -> 78 | O254: 16 | P254: 24 | Q254: =O254*6+P254 -> 120 | S254: GEELONG WEST | W254: PRAHRAN | X254: 4 | Y254: 2 | Z254: 0 | AA254: 577 | AB254: 551 | AC254: 104.71869328493648 | AD254: 16
A255: CAULFIELD | C255: 3 | D255: 2 | E255: =C255*6+D255 -> 20 | G255: 6 | H255: 7 | I255: =G255*6+H255 -> 43 | K255: 7 | L255: 9 | M255: =K255*6+L255 -> 51 | O255: 10 | P255: 11 | Q255: =O255*6+P255 -> 71 | S255: McBAIN | W255: PRESTON | X255: 4 | Y255: 2 | Z255: 0 | AA255: 598 | AB255: 603 | AC255: 99.170812603648429 | AD255: 16
A256: BEST PLAYERS | W256: CAULFIELD | X256: 2 | Y256: 4 | Z256: 0 | AA256: 599 | AB256: 681 | AC256: 87.958883994126282 | AD256: 8
A257: GEELONG WEST | C257: HARRIS | F257: YATES | I257: KLINE | L257: FRIEND | N257: MANSON | Q257: SMITH | W257: SUNSHINE | X257: 1 | Y257: 5 | Z257: 0 | AA257: 527 | AB257: 612 | AC257: 86.11 | AD257: 4
A258: CAULFIELD | C258: CLIFF | F258: FRIGO | I258: WHITE | L258: HOGAN | N258: LEGH | Q258: BROWN | W258: WILLIAMSTOWN | X258: 1 | Y258: 5 | Z258: 0 | AA258: 493 | AB258: 748 | AC258: 65.909090909090907 | AD258: 4
A259: GOALKICKERS | W259: SANDRINGHAM | X259: 0 | Y259: 6 | Z259: 0 | AA259: 468 | AB259: 656 | AC259: 71.341463414634148 | AD259: 0
A260: GEELONG WEST | C260: RADOJEVIC 4 | F260: ARKLAY 3 | I260: MANSON 2 | L260: HARRIS 2 | N260: FRIEND 2 | Q260: YATES | S260: IRVINE | U260: WELLS
A261: CAULFIELD | C261: LOGAN 3 | F261: WHITE 3 | I261: BROWN | K261: BAKER | M261: CLIFF | O261: GOODEN
A263: OAKLEIGH | C263: 1 | D263: 1 | E263: =C263*6+D263 -> 7 | G263: 3 | H263: 7 | I263: =G263*6+H263 -> 25 | K263: 8 | L263: 11 | M263: =K263*6+L263 -> 59 | O263: 13 | P263: 17 | Q263: =O263*6+P263 -> 95 | S263: SUNSHINE
A264: SUNSHINE | C264: 7 | D264: 2 | E264: =C264*6+D264 -> 44 | G264: 9 | H264: 3 | I264: =G264*6+H264 -> 57 | K264: 13 | L264: 5 | M264: =K264*6+L264 -> 83 | O264: 14 | P264: 6 | Q264: =O264*6+P264 -> 90 | S264: O'BRIEN
A265: BEST PLAYERS
A266: OAKLEIGH | C266: WENN | F266: QUINN | I266: D NESBIT | L266: STEWART | O266: GAUNT | Q266: MURNANE
A267: SUNSHINE | C267: VELLA | F267: BENSON | I267: MADDOX | L267: BAIRD | O267: LLOYD | Q267: RICHARDS
A268: GOALKICKERS
A269: OAKLEIGH | C269: MOORE 4 | F269: O'KANE 3 | I269: MURNANE 2 | L269: RITTERMAN | O269: J LILLEY | Q269: D NESBIT | S269: GAUNT
A270: SUNSHINE | C270: CRAWFORD 4 | F270: LLOYD 3 | I270: BENSON 2 | L270: MURRAY 2 | O270: VELLA 2 | Q270: MADDOX
A272: DANDENONG | C272: 3 | D272: 2 | E272: =C272*6+D272 -> 20 | G272: 10 | H272: 7 | I272: =G272*6+H272 -> 67 | K272: 12 | L272: 10 | M272: =K272*6+L272 -> 82 | O272: 15 | P272: 18 | Q272: =O272*6+P272 -> 108 | S272: DANDENONG
A273: SANDRINGHAM | C273: 5 | D273: 5 | E273: =C273*6+D273 -> 35 | G273: 5 | H273: 5 | I273: =G273*6+H273 -> 35 | K273: 7 | L273: 8 | M273: =K273*6+L273 -> 50 | O273: 7 | P273: 10 | Q273: =O273*6+P273 -> 52 | S273: WENN
A274: BEST PLAYERS
A275: DANDENONG | C275: ANGUS | F275: MILLER | I275: DAVIES | L275: WALFORD | O275: HENRIKSEN | R275: HOULT
A276: SANDRINGHAM | C276: LYONS | F276: MARSHALL | I276: CARROLL | L276: CLARK | O276: SCHWARZMANN | R276: MURLEY
A277: GOALKICKERS
A278: DANDENONG | C278: MILLER 9 | F278: HOULT 5 | I278: B SHINNERS
A279: SANDRINGHAM | C279: LYONS 2 | F279: EDWARDS 2 | I279: CLARK | K279: JACOBSEN | N279: K ANSELL
A281: PORT MELBOURNE | C281: 8 | D281: 4 | E281: =C281*6+D281 -> 52 | G281: 11 | H281: 7 | I281: =G281*6+H281 -> 73 | K281: 17 | L281: 12 | M281: =K281*6+L281 -> 114 | O281: 22 | P281: 16 | Q281: =O281*6+P281 -> 148 | S281: PORT MELBOURNE
A282: WILLIAMSTOWN | C282: 0 | D282: 4 | E282: =C282*6+D282 -> 4 | G282: 4 | H282: 9 | I282: =G282*6+H282 -> 33 | K282: 8 | L282: 10 | M282: =K282*6+L282 -> 58 | O282: 13 | P282: 18 | Q282: =O282*6+P282 -> 96 | S282: HAYES
A283: BEST PLAYERS
A284: PORT MELBOURNE | C284: CRITCH | F284: BROWN | I284: FRENCH | L284: OWEN | N284: ERWIN | Q284: COOK
A285: WILLIAMSTOWN | C285: THOMPSON | F285: SCOTT | I285: L STILLMAN | L285: PERCY | N285: ROACHE | Q285: RADZIMINSKI
A286: GOALKICKERS
A287: PORT MELBOURNE | C287: COOK 8 | F287: ANDERSON 4 | I287: BUCKLEY 3 | L287: ELLIOT 2 | N287: GOSS 2 | P287: BEHAN | R287: BROWN | T287: HARLAND
A288: WILLIAMSTOWN | C288: L STILLMAN 4 | F288: SCOTT 3 | I288: GILL 3 | K288: RADZIMINSKI 2 | O288: FANNING
A290: ROUND 7 | E290: 2ND JUNE | J290: WEATHER | N290: FINE SUNNY | S290: PLAYED AT
D291: 1ST QTR | H291: 2ND QTR | L291: 3RD QTR | P291: FINAL | S291: OAKLEIGH
A292: OAKLEIGH | C292: 2 | D292: 5 | E292: =C292*6+D292 -> 17 | G292: 9 | H292: 10 | I292: =G292*6+H292 -> 64 | K292: 15 | L292: 11 | M292: =K292*6+L292 -> 101 | O292: 20 | P292: 18 | Q292: =O292*6+P292 -> 138 | S292: UMPIRE | X292: LADDER | AB292: ROUND | AD292: 7
A293: GEELONG WEST | C293: 5 | D293: 2 | E293: =C293*6+D293 -> 32 | G293: 11 | H293: 5 | I293: =G293*6+H293 -> 71 | K293: 16 | L293: 10 | M293: =K293*6+L293 -> 106 | O293: 18 | P293: 16 | Q293: =O293*6+P293 -> 124 | S293: HUGGINS
A294: BEST PLAYERS | W294: TEAM | X294: W | Y294: L | Z294: D | AA294: FOR | AB294: AGST | AC294: % | AD294: PTS
A295: OAKLEIGH | C295: McDONALD | F295: WENN | I295: GAUNT | L295: P LILLEY | O295: MURNANE | R295: FORD
A296: GEELONG WEST | C296: HARRIS | F296: SMITH | I296: BRIGHT | L296: IRVIN | O296: LINKE | R296: YATES | W296: PORT MELBOURNE | X296: 6 | Y296: 1 | Z296: 0 | AA296: 852 | AB296: 648 | AC296: 131.48 | AD296: 24
A297: GOALKICKERS | W297: DANDENONG | X297: 5 | Y297: 2 | Z297: 0 | AA297: 782 | AB297: 597 | AC297: 130.98827470686768 | AD297: 20
A298: OAKLEIGH | C298: McDONALD 5 | F298: MURNANE 5 | I298: MOORE 4 | K298: J LILLEY 2 | M298: GAUNT | O298: RITTERMAN | R298: T QUINN | T298: WENN | W298: GEELONG WEST | X298: 5 | Y298: 2 | Z298: 0 | AA298: 799 | AB298: 616 | AC298: 129.70779220779221 | AD298: 20
A299: GEELONG WEST | C299: HARRIS 3 | E299: FRIEND 3 | G299: IRVIN 3 | I299: STEPHENS 2 | L299: ARKLAY 2 | N299: LINKE | P299: MANSON | R299: YATES | T299: WELLS | W299: OAKLEIGH | X299: 5 | Y299: 2 | Z299: 0 | AA299: 813 | AB299: 734 | AC299: 110.76294277929155 | AD299: 20
R300: GILMORE
A301: PORT MELBOURNE | C301: 5 | D301: 2 | E301: =C301*6+D301 -> 32 | G301: 11 | H301: 4 | I301: =G301*6+H301 -> 70 | K301: 17 | L301: 5 | M301: =K301*6+L301 -> 107 | O301: 18 | P301: 14 | Q301: =O301*6+P301 -> 122 | S301: PRESTON | W301: PRAHRAN | X301: 4 | Y301: 3 | Z301: 0 | AA301: 662 | AB301: 638 | AC301: 103.76175548589342 | AD301: 16
A302: PRESTON | C302: 3 | D302: 1 | E302: =C302*6+D302 -> 19 | G302: 7 | H302: 8 | I302: =G302*6+H302 -> 50 | K302: 10 | L302: 14 | M302: =K302*6+L302 -> 74 | O302: 13 | P302: 21 | Q302: =O302*6+P302 -> 99 | S302: WENN | W302: PRESTON | X302: 4 | Y302: 3 | Z302: 0 | AA302: 697 | AB302: 725 | AC302: 96.137931034482762 | AD302: 16
A303: BEST PLAYERS | W303: CAULFIELD | X303: 2 | Y303: 5 | Z303: 0 | AA303: 708 | AB303: 801 | AC303: 88.389513108614238 | AD303: 8
A304: PORT MELBOURNE | C304: OWEN | F304: BUCKLEY | I304: HARLAND | L304: GOSS | O304: ELLIOTT | R304: CRITCH | W304: WILLIAMSTOWN | X304: 2 | Y304: 5 | Z304: 0 | AA304: 613 | AB304: 857 | AC304: 71.528588098016343 | AD304: 8
A305: PRESTON | C305: JINKS | F305: ZUNNEBERG | I305: STEPHENS | L305: WEIGHTMAN | O305: NALDER | R305: MARTIN | W305: SUNSHINE | X305: 1 | Y305: 6 | Z305: 0 | AA305: 641 | AB305: 765 | AC305: 83.79 | AD305: 4
A306: GOALKICKERS | W306: SANDRINGHAM | X306: 1 | Y306: 6 | Z306: 0 | AA306: 555 | AB306: 741 | AC306: 74.89878542510121 | AD306: 4
A307: PORT MELBOURNE | C307: HOLT 4 | E307: GOSS 3 | G307: COOK 3 | I307: BEHAN 2 | K307: ANDERSON 2 | N307: BROWN | P307: ERWIN | R307: HARLAND | U307: ELLIOTT
A308: PRESTON | C308: CLARK 3 | E308: KIRKMAN 3 | H308: WEIGHTMAN 2 | K308: PETTIGREW 2 | N308: MARSHALL | Q308: VICKERY | S308: JOHNSTON
A310: WILLIAMSTOWN | C310: 4 | D310: 3 | E310: =C310*6+D310 -> 27 | G310: 10 | H310: 9 | I310: =G310*6+H310 -> 69 | K310: 13 | L310: 15 | M310: =K310*6+L310 -> 93 | O310: 17 | P310: 18 | Q310: =O310*6+P310 -> 120 | S310: PRINCES PARK
A311: CAULFIELD | C311: 5 | D311: 2 | E311: =C311*6+D311 -> 32 | G311: 10 | H311: 7 | I311: =G311*6+H311 -> 67 | K311: 13 | L311: 11 | M311: =K311*6+L311 -> 89 | O311: 15 | P311: 19 | Q311: =O311*6+P311 -> 109 | S311: MURLEY
A312: BEST PLAYERS
A313: WILLIAMSTOWN | C313: L STILLMAN | F313: PERCY | I313: SCOTT | L313: TOWNSEND | O313: N STILLMAN | R313: SHAW
A314: CAULFIELD | C314: BAKER | F314: PERRY | I314: GUINANE | L314: GOODEN | O314: FELDMAN | R314: HOCKING
A315: GOALKICKERS
A316: WILLIAMSTOWN | C316: TOWNSEND 6 | F316: N STILLMAN 4 | J316: SCOTT 3 | M316: LANE 2 | O316: L STILLMAN | R316: PERCY
A317: CAULFIELD | C317: GUINANE 6 | F317: GOODEN 3 | I317: WHITE 2 | K317: HOCKING 2 | N317: CLIFF | P317: BAKER
A319: SANDRINGHAM | C319: 2 | D319: 6 | E319: =C319*6+D319 -> 18 | G319: 3 | H319: 9 | I319: =G319*6+H319 -> 27 | K319: 8 | L319: 13 | M319: =K319*6+L319 -> 61 | O319: 12 | P319: 15 | Q319: =O319*6+P319 -> 87 | S319: BEACH ROAD
A320: PRAHRAN | C320: 2 | D320: 4 | E320: =C320*6+D320 -> 16 | G320: 7 | H320: 6 | I320: =G320*6+H320 -> 48 | K320: 9 | L320: 10 | M320: =K320*6+L320 -> 64 | O320: 12 | P320: 13 | Q320: =O320*6+P320 -> 85 | S320: DAVIS
A321: BEST PLAYERS
A322: SANDRINGHAM | C322: R MURRAY | F322: LYONS | I322: WARD | L322: CLARKE | O322: KENNEDY | R322: MAYNE
A323: PRAHRAN | C323: TOWNSEND | F323: KENT | I323: GUNN | L323: K SMITH | O323: ANDERSON | R323: CHAPMAN
A324: GOALKICKERS
A325: SANDRINGHAM | C325: R MURRAY 7 | F325: ANSELL 2 | I325: LYONS | K325: SCHOLES | M325: K CLARKE
A326: PRAHRAN | C326: TOWNSEND 5 | F326: K SMITH 3 | I326: KENT | K326: G SMITH | M326: RIPPON | O326: APPLETON
A328: DANDENONG | C328: 4 | D328: 3 | E328: =C328*6+D328 -> 27 | G328: 9 | H328: 5 | I328: =G328*6+H328 -> 59 | K328: 15 | L328: 15 | M328: =K328*6+L328 -> 105 | O328: 22 | P328: 21 | Q328: =O328*6+P328 -> 153 | S328: SUNSHINE
A329: SUNSHINE | C329: 6 | D329: 6 | E329: =C329*6+D329 -> 42 | G329: 11 | H329: 8 | I329: =G329*6+H329 -> 74 | K329: 15 | L329: 9 | M329: =K329*6+L329 -> 99 | O329: 17 | P329: 12 | Q329: =O329*6+P329 -> 114 | S329: HAYES
A330: BEST PLAYERS
A331: DANDENONG | C331: KENDALL | F331: ANGUS | I331: MILLER | L331: HENRIKSEN | O331: WALFORD | R331: HARRINGTON
A332: SUNSHINE | C332: LLOYD | F332: ALLEN | I332: GOOLD | L332: MADDOX | O332: CLARKE | R332: RICHARDS
A333: GOALKICKERS
A334: DANDENONG | C334: MILLER 7 | F334: PATTERSON 5 | I334: FLAHERTY 4 | L334: DA ROSE 4 | O334: REID | Q334: HOULT | S334: DAVIES
A335: SUNSHINE | C335: LLOYD 4 | F335: CRAWFORD 2 | I335: BENSON 2 | L335: JONES 2 | N335: MURRAY 2 | Q335: VELLA 2 | S335: MADDOX 2 | V335: BAIRD
A337: ROUND 8 | E337: 9TH JUNE | J337: WEATHER | M337: SOUTH WEST WIND SHOWERS | S337: PLAYED AT
D338: 1ST QTR | H338: 2ND QTR | L338: 3RD QTR | P338: FINAL | S338: PORT MELBOURNE
A339: PORT MELBOURNE | C339: 6 | D339: 3 | E339: =C339*6+D339 -> 39 | G339: 10 | H339: 5 | I339: =G339*6+H339 -> 65 | K339: 15 | L339: 8 | M339: =K339*6+L339 -> 98 | O339: 17 | P339: 9 | Q339: =O339*6+P339 -> 111 | S339: UMPIRE | X339: LADDER | AB339: ROUND | AD339: 8
A340: DANDENONG | C340: 2 | D340: 1 | E340: =C340*6+D340 -> 13 | G340: 6 | H340: 8 | I340: =G340*6+H340 -> 44 | K340: 6 | L340: 12 | M340: =K340*6+L340 -> 48 | O340: 9 | P340: 16 | Q340: =O340*6+P340 -> 70 | S340: GAMBETTA
A341: BEST PLAYERS | W341: TEAM | X341: W | Y341: L | Z341: D | AA341: FOR | AB341: AGST | AC341: % | AD341: PTS
A342: PORT MELBOURNE | C342: LOCKHART | F342: BUCKLEY | I342: ELLIOTT | L342: CRITCH | O342: COOK | R342: BROWN
A343: DANDENONG | C343: HOULT | F343: ANGUS | I343: ORCHARD | L343: B SHINNERS | O343: WALFORD | R343: HARRINGTON | W343: PORT MELBOURNE | X343: 7 | Y343: 1 | Z343: 0 | AA343: 963 | AB343: 718 | AC343: 134.12 | AD343: 28
A344: GOALKICKERS | W344: GEELONG WEST | X344: 6 | Y344: 2 | Z344: 0 | AA344: 926 | AB344: 711 | AC344: 130.23909985935302 | AD344: 24
A345: PORT MELBOURNE | C345: COOK 7 | F345: HOLT 3 | H345: BECKWITH 3 | K345: ELLIOTT 2 | N345: GOSS | P345: ERWIN | W345: OAKLEIGH | X345: 6 | Y345: 2 | Z345: 0 | AA345: 898 | AB345: 802 | AC345: 111.97007481296758 | AD345: 24
A346: DANDENONG | C346: MILLER 4 | F346: B SHINNERS 2 | I346: FLAHERTY | L346: KENDALL | N346: ANGUS | W346: DANDENONG | X346: 5 | Y346: 3 | Z346: 0 | AA346: 852 | AB346: 708 | AC346: 120.33898305084746 | AD346: 20
A348: OAKLEIGH | C348: 6 | D348: 6 | E348: =C348*6+D348 -> 42 | G348: 8 | H348: 8 | I348: =G348*6+H348 -> 56 | K348: 12 | L348: 11 | M348: =K348*6+L348 -> 83 | O348: 12 | P348: 13 | Q348: =O348*6+P348 -> 85 | S348: PRESTON | W348: PRAHRAN | X348: 5 | Y348: 3 | Z348: 0 | AA348: 761 | AB348: 706 | AC348: 107.79036827195468 | AD348: 20
A349: PRESTON | C349: 1 | D349: 2 | E349: =C349*6+D349 -> 8 | G349: 3 | H349: 9 | I349: =G349*6+H349 -> 27 | K349: 5 | L349: 9 | M349: =K349*6+L349 -> 39 | O349: 9 | P349: 14 | Q349: =O349*6+P349 -> 68 | S349: McBAIN | W349: PRESTON | X349: 4 | Y349: 4 | Z349: 0 | AA349: 765 | AB349: 810 | AC349: 94.444444444444443 | AD349: 16
A350: BEST PLAYERS | W350: WILLIAMSTOWN | X350: 3 | Y350: 5 | Z350: 0 | AA350: 733 | AB350: 938 | AC350: 78.14498933901919 | AD350: 12
A351: OAKLEIGH | C351: MURNANE | F351: J LILLEY | I351: GAUNT | L351: ELLIOTT | O351: P LILLEY | R351: RITTERMAN | W351: CAULFIELD | X351: 2 | Y351: 6 | Z351: 0 | AA351: 776 | AB351: 900 | AC351: 86.222222222222229 | AD351: 8
A352: PRESTON | C352: MIDDLETON | F352: PETTIGREW | I352: WEIGHTMAN | L352: NALDER | O352: ZUNNEBERG | R352: MORRIS | W352: SUNSHINE | X352: 1 | Y352: 7 | Z352: 0 | AA352: 736 | AB352: 892 | AC352: 82.51 | AD352: 4
A353: GOALKICKERS | W353: SANDRINGHAM | X353: 1 | Y353: 7 | Z353: 0 | AA353: 636 | AB353: 861 | AC353: 73.867595818815332 | AD353: 4
A354: OAKLEIGH | C354: J LILLEY 3 | F354: MURNANE 2 | I354: GAUNT 2 | K354: RITTERMAN | N354: QUINN | P354: BILLING | R354: MOORE | T354: McDONALD
A355: PRESTON | C355: MIDDLETON 3 | F355: KIRKMAN 2 | I355: O'SULLIVAN | L355: ZUNNEBERG | O355: VICKERY | Q355: PREECE
A357: PRAHRAN | C357: 6 | D357: 4 | E357: =C357*6+D357 -> 40 | G357: 7 | H357: 7 | I357: =G357*6+H357 -> 49 | K357: 12 | L357: 17 | M357: =K357*6+L357 -> 89 | O357: 13 | P357: 21 | Q357: =O357*6+P357 -> 99 | S357: TOORAK PARK
A358: CAULFIELD | C358: 3 | D358: 0 | E358: =C358*6+D358 -> 18 | G358: 6 | H358: 8 | I358: =G358*6+H358 -> 44 | K358: 6 | L358: 11 | M358: =K358*6+L358 -> 47 | O358: 9 | P358: 14 | Q358: =O358*6+P358 -> 68 | S358: TOOHEY
A359: BEST PLAYERS
A360: PRAHRAN | C360: CHAPMAN | F360: GUNN | I360: TOWNSEND | L360: PAYNE | O360: KENT | R360: O'DONNELL
A361: CAULFIELD | C361: CLIFF | F361: BAKER | I361: MAGUIRE | L361: GLAZNER | O361: DOWSETT | R361: FELDMAN
A362: GOALKICKERS
A363: PRAHRAN | C363: K SMITH 4 | F363: TOWNSEND 3 | I363: APPLETON 2 | L363: GREENWOOD 2 | O363: McSPEERIN | R363: KENT
A364: CAULFIELD | C364: BAKER 3 | F364: GUINANE 2 | I364: MAGUIRE | K364: WHITE | M364: PERRY | O364: GOODEN
A366: WILLIAMSTOWN | C366: 2 | D366: 4 | E366: =C366*6+D366 -> 16 | G366: 6 | H366: 10 | I366: =G366*6+H366 -> 46 | K366: 9 | L366: 14 | M366: =K366*6+L366 -> 68 | O366: 17 | P366: 18 | Q366: =O366*6+P366 -> 120 | S366: WILLIAMSTOWN
A367: SANDRINGHAM | C367: 7 | D367: 4 | E367: =C367*6+D367 -> 46 | G367: 9 | H367: 5 | I367: =G367*6+H367 -> 59 | K367: 10 | L367: 7 | M367: =K367*6+L367 -> 67 | O367: 12 | P367: 9 | Q367: =O367*6+P367 -> 81 | S367: GUBBINS
A368: BEST PLAYERS
A369: WILLIAMSTOWN | C369: TOWNSEND | F369: SCOTT | I369: FANNING | L369: SHAW | O369: THOMPSON | R369: L STILLMAN
A370: SANDRINGHAM | C370: WARD | F370: SCHOLES | I370: R MURRAY | L370: SCHWARZMAN | O370: MAYNE | R370: MARSHALL
A371: GOALKICKERS
A372: WILLIAMSTOWN | C372: TOWNSEND 7 | F372: SCOTT 2 | H372: N STILLMAN 2 | K372: L STILLMAN 2 | N372: ROACH | P372: POWLEY | R372: COURTOT | U372: PERRY
A373: SANDRINGHAM | C373: WARD 4 | F373: SCHOLES 3 | I373: R MURRAY | K373: LYONS | M373: CLARKE | O373: ANSELL | Q373: STEVENS
A375: GEELONG WEST | C375: 8 | D375: 10 | E375: =C375*6+D375 -> 58 | G375: 10 | H375: 11 | I375: =G375*6+H375 -> 71 | K375: 15 | L375: 20 | M375: =K375*6+L375 -> 110 | O375: 17 | P375: 25 | Q375: =O375*6+P375 -> 127 | S375: GEELONG WEST
A376: SUNSHINE | C376: 1 | D376: 0 | E376: =C376*6+D376 -> 6 | G376: 6 | H376: 5 | I376: =G376*6+H376 -> 41 | K376: 10 | L376: 6 | M376: =K376*6+L376 -> 66 | O376: 14 | P376: 11 | Q376: =O376*6+P376 -> 95 | S376: ABBOTT
A377: BEST PLAYERS
A378: GEELONG WEST | C378: SMITH | F378: IRVIN | I378: FRIEND | L378: YATES | O378: VAN ELDEN | R378: HALL
A379: SUNSHINE | C379: GOOLD | F379: ALLEN | I379: DE ARAUGO | L379: FOREMAN | O379: VELLA | R379: LLOYD
A380: GOALKICKERS
A381: GEELONG WEST | C381: IRVIN 4 | F381: YATES 3 | I381: LINKE 2 | K381: ARKLAY 2 | N381: HARRIS 2 | Q381: JONES 2 | S381: STEPHENS | V381: WELLS
A382: SUNSHINE | C382: CRAWFORD 4 | F382: LLOYD 3 | I382: DOLL 2 | K382: FOREMAN 2 | N382: GOOLD | P382: VELLA | R382: BENSON
A384: ROUND 9 | D384: 16TH JUNE | I384: WEATHER | L384: SOUTH BREEZE FINE | S384: PLAYED AT
D385: 1ST QTR | H385: 2ND QTR | L385: 3RD QTR | P385: FINAL | S385: TOORAK PARK
A386: PORT MELBOURNE | C386: 3 | D386: 4 | E386: =C386*6+D386 -> 22 | G386: 6 | H386: 11 | I386: =G386*6+H386 -> 47 | K386: 13 | L386: 14 | M386: =K386*6+L386 -> 92 | O386: 18 | P386: 18 | Q386: =O386*6+P386 -> 126 | S386: UMPIRE | X386: LADDER | AB386: ROUND | AD386: 9
A387: PRAHRAN | C387: 5 | D387: 2 | E387: =C387*6+D387 -> 32 | G387: 8 | H387: 4 | I387: =G387*6+H387 -> 52 | K387: 13 | L387: 7 | M387: =K387*6+L387 -> 85 | O387: 18 | P387: 15 | Q387: =O387*6+P387 -> 123 | S387: O'BRIEN
A388: BEST PLAYERS | W388: TEAM | X388: W | Y388: L | Z388: D | AA388: FOR | AB388: AGST | AC388: % | AD388: PTS
A389: PORT MELBOURNE | C389: HOLT | F389: HARLAND | I389: CRITCH | L389: HUGHES | O389: COOK | Q389: BEHAN
A390: PRAHRAN | C390: PAYNE | F390: APPLETON | I390: GRANGE | L390: KENT | O390: GUNN | Q390: TOWNSEND | W390: PORT MELBOURNE | X390: 8 | Y390: 1 | Z390: 0 | AA390: 1089 | AB390: 841 | AC390: 129.49 | AD390: 32
A391: GOALKICKERS | W391: OAKLEIGH | X391: 7 | Y391: 2 | Z391: 0 | AA391: 1074 | AB391: 901 | AC391: 119.20088790233075 | AD391: 28
A392: PORT MELBOURNE | C392: HOLT 7 | E392: COOK 4 | G392: ELLIOT 2 | I392: BECKWITH | L392: HARLAND | N392: P GOSS | P392: HUGHES | R392: ERWIN | W392: GEELONG WEST | X392: 6 | Y392: 3 | Z392: 0 | AA392: 1009 | AB392: 823 | AC392: 122.6 | AD392: 24
A393: PRAHRAN | C393: APPLETON 4 | F393: TOWNSEND 3 | I393: O'DONNELL 3 | L393: GREENWOOD 2 | O393: ROLFE 2 | Q393: G SMITH | S393: PAYNE | W393: DANDENONG | X393: 6 | Y393: 3 | Z393: 0 | AA393: 964 | AB393: 791 | AC393: 121.87 | AD393: 24
Q394: ANDERSON | S394: JOHNSTON
A395: OAKLEIGH | C395: 2 | D395: 7 | E395: =C395*6+D395 -> 19 | G395: 10 | H395: 12 | I395: =G395*6+H395 -> 72 | K395: 17 | L395: 14 | M395: =K395*6+L395 -> 116 | O395: 26 | P395: 20 | Q395: =O395*6+P395 -> 176 | S395: OAKLEIGH | W395: PRAHRAN | X395: 5 | Y395: 4 | Z395: 0 | AA395: 884 | AB395: 832 | AC395: 106.25 | AD395: 20
A396: WILLIAMSTOWN | C396: 3 | D396: 1 | E396: =C396*6+D396 -> 19 | G396: 5 | H396: 4 | I396: =G396*6+H396 -> 34 | K396: 10 | L396: 11 | M396: =K396*6+L396 -> 71 | O396: 14 | P396: 15 | Q396: =O396*6+P396 -> 99 | S396: DAVIS | W396: PRESTON | X396: 5 | Y396: 4 | Z396: 0 | AA396: 889 | AB396: 894 | AC396: 99.440715883668901 | AD396: 20
A397: BEST PLAYERS | W397: WILLIAMSTOWN | X397: 3 | Y397: 6 | Z397: 0 | AA397: 832 | AB397: 1114 | AC397: 74.68581687612209 | AD397: 12
A398: OAKLEIGH | C398: QUINN | F398: RITTERMAN | I398: FORD | K398: CLOKE | N398: WENN | P398: MCGRATH | W398: SUNSHINE | X398: 2 | Y398: 7 | Z398: 0 | AA398: 867 | AB398: 987 | AC398: 87.84 | AD398: 8
A399: WILLIAMSTOWN | C399: N STILLMAN | F399: FANNING | I399: MOORE | K399: L STILLMAN | N399: KERR | P399: FENTON | W399: CAULFIELD | X399: 2 | Y399: 7 | Z399: 0 | AA399: 871 | AB399: 1031 | AC399: 84.481086323957328 | AD399: 8
A400: GOALKICKERS | W400: SANDRINGHAM | X400: 1 | Y400: 8 | Z400: 0 | AA400: 720 | AB400: 985 | AC400: 73.096446700507613 | AD400: 4
A401: OAKLEIGH | C401: MOORE 5 | E401: MURNANE 5 | H401: QUINN 4 | J401: McDONALD 4 | M401: CLOKE 4 | O401: WENN | Q401: GAUNT | S401: FORD | U401: MACGRATH
A402: WILLIAMSTOWN | C402: TOWNSEND 4 | F402: N STILLMAN 2 | I402: ROACH 2 | K402: POWLEY 2 | N402: SCOTT | P402: L STILLMAN | S402: FANNING | V402: PERCY
E403: 23RD JUNE | J403: WEATHER | N403: FINE
A404: DANDENONG | C404: 4 | D404: 2 | E404: =C404*6+D404 -> 26 | G404: 8 | H404: 5 | I404: =G404*6+H404 -> 53 | K404: 11 | L404: 12 | M404: =K404*6+L404 -> 78 | O404: 16 | P404: 16 | Q404: =O404*6+P404 -> 112 | S404: DANDENONG
A405: GEELONG WEST | C405: 5 | D405: 6 | E405: =C405*6+D405 -> 36 | G405: 8 | H405: 7 | I405: =G405*6+H405 -> 55 | K405: 10 | L405: 10 | M405: =K405*6+L405 -> 70 | O405: 12 | P405: 11 | Q405: =O405*6+P405 -> 83 | S405: TORNEY
A406: BEST PLAYERS
A407: DANDENONG | C407: MUIR | F407: ORCHARD | I407: REID | K407: ANGUS | N407: KENDALL | Q407: MILLER
A408: GEELONG WEST | C408: HARRIS | F408: SMITH | I408: HALL | K408: GILMORE | N408: STEPHENS | Q408: DUNNE
A409: GOALKICKERS
A410: DANDENONG | C410: MILLER 6 | F410: K SHINNERS 3 | I410: MUIR 3 | K410: ANGUS 2 | M410: JONES | O410: HIBBERT
A411: GEELONG WEST | C411: HARRIS 4 | F411: MANSON 2 | I411: ARKLAY 2 | K411: WELLS | M411: STEPHENS | O411: LINKE | Q411: BRIGHT
A413: SUNSHINE | C413: 7 | D413: 2 | E413: =C413*6+D413 -> 44 | G413: 13 | H413: 4 | I413: =G413*6+H413 -> 82 | K413: 16 | L413: 7 | M413: =K413*6+L413 -> 103 | O413: 20 | P413: 11 | Q413: =O413*6+P413 -> 131 | S413: SUNSHINE
A414: CAULFIELD | C414: 1 | D414: 2 | E414: =C414*6+D414 -> 8 | G414: 6 | H414: 5 | I414: =G414*6+H414 -> 41 | K414: 10 | L414: 8 | M414: =K414*6+L414 -> 68 | O414: 14 | P414: 11 | Q414: =O414*6+P414 -> 95 | S414: WENN
A415: BEST PLAYERS
A416: SUNSHINE | C416: MADDOX | F416: GOOLD | I416: CLARKE | L416: POTTER | N416: ALLEN | Q416: LLOYD
A417: CAULFIELD | C417: LEGH | F417: WHITE | I417: CLIFF | L417: LOGAN | N417: BROWN | Q417: BAKER
A418: GOALKICKERS
A419: SUNSHINE | C419: CRAWFORD 5 | F419: LLOYD 4 | H419: VELLA 3 | J419: THOMPSON 2 | M419: DOLL 2 | O419: BENSON 2 | Q419: FOREMAN | T419: CLARKE
A420: CAULFIELD | C420: GUINANE 4 | F420: LOGAN 3 | I420: WHITE 2 | K420: CLIFF 2 | M420: BAKER | O420: MAGUIRE | Q420: BROWN
A422: PRESTON | C422: 1 | D422: 3 | E422: =C422*6+D422 -> 9 | G422: 10 | H422: 10 | I422: =G422*6+H422 -> 70 | K422: 13 | L422: 18 | M422: =K422*6+L422 -> 96 | O422: 17 | P422: 22 | Q422: =O422*6+P422 -> 124 | S422: BEACH ROAD
A423: SANDRINGHAM | C423: 4 | D423: 1 | E423: =C423*6+D423 -> 25 | G423: 6 | H423: 2 | I423: =G423*6+H423 -> 38 | K423: 11 | L423: 3 | M423: =K423*6+L423 -> 69 | O423: 12 | P423: 12 | Q423: =O423*6+P423 -> 84 | S423: ABBOTT
A424: BEST PLAYERS
A425: PRESTON | C425: NALDER | F425: PETTIGREW | I425: ZUNNEBERG | L425: COBAIN | O425: MARTIN | R425: VICKERY
A426: SANDRINGHAM | C426: MACKENZIE | F426: SCHWARZMAN | I426: R MURRAY | L426: SCHOLES | O426: WARD | R426: MAYNE
A427: GOALKICKERS
A428: PRESTON | C428: VICKERY 6 | F428: MARTIN 3 | I428: CLARK 3 | K428: WEIGHTMAN 2 | N428: PETTIGREW 2 | Q428: NALDER
A429: SANDRINGHAM | C429: SCHOLES 3 | F429: MACKENZIE 2 | I429: TEMPLETON 2 | L429: R MURRAY 2 | O429: JACOBSEN | R429: LIPSCOMBE | U429: WARD
A431: ROUND 10 | E431: 30TH JUNE | J431: WEATHER | S431: PLAYED AT | X431: LADDER | AB431: ROUND | AD431: 10
D432: 1ST QTR | H432: 2ND QTR | L432: 3RD QTR | P432: FINAL | S432: PORT MELBOURNE
A433: PORT MELBOURNE | C433: 1 | D433: 5 | E433: =C433*6+D433 -> 11 | G433: 5 | H433: 12 | I433: =G433*6+H433 -> 42 | K433: 8 | L433: 16 | M433: =K433*6+L433 -> 64 | O433: 13 | P433: 25 | Q433: =O433*6+P433 -> 103 | S433: UMPIRE | W433: TEAM | X433: W | Y433: L | Z433: D | AA433: FOR | AB433: AGST | AC433: % | AD433: PTS
A434: OAKLEIGH | C434: 3 | D434: 5 | E434: =C434*6+D434 -> 23 | G434: 5 | H434: 6 | I434: =G434*6+H434 -> 36 | K434: 9 | L434: 8 | M434: =K434*6+L434 -> 62 | O434: 9 | P434: 10 | Q434: =O434*6+P434 -> 64 | S434: WENN
A435: BEST PLAYERS | W435: PORT MELBOURNE | X435: 9 | Y435: 1 | Z435: 0 | AA435: 1192 | AB435: 905 | AC435: 131.71 | AD435: 36
A436: PORT MELBOURNE | C436: HERROD | F436: BUCKLEY | I436: OWEN | K436: CRITCH | N436: HARLAND | Q436: GOSS | W436: GEELONG WEST | X436: 7 | Y436: 3 | Z436: 0 | AA436: 1139 | AB436: 925 | AC436: 123.14 | AD436: 28
A437: OAKLEIGH | C437: BILLING | F437: ELLIOTT | I437: WENN | K437: McGRATH | N437: C NESBIT | Q437: P LILLEY | W437: OAKLEIGH | X437: 7 | Y437: 3 | Z437: 0 | AA437: 1138 | AB437: 1004 | AC437: 113.34661354581674 | AD437: 28
A438: GOALKICKERS | W438: DANDENONG | X438: 6 | Y438: 4 | Z438: 0 | AA438: 1059 | AB438: 890 | AC438: 118.99 | AD438: 24
A439: PORT MELBOURNE | C439: COOK 4 | F439: GOSS 2 | H439: BEHAN 2 | J439: ELLIOTT 2 | M439: HOLT | O439: DAVIS | Q439: ANDERSON
A440: OAKLEIGH | C440: WENN 4 | F440: JACKSON 2 | I440: McDONALD | L440: J LILLEY | N440: RITTERMAN | W440: PRESTON | X440: 6 | Y440: 4 | Z440: 0 | AA440: 1015 | AB440: 988 | AC440: 102.7327935222672 | AD440: 24
W441: PRAHRAN | X441: 5 | Y441: 5 | Z441: 0 | AA441: 986 | AB441: 962 | AC441: 102.4948024948025 | AD441: 20
A442: GEELONG WEST | C442: 8 | D442: 4 | E442: =C442*6+D442 -> 52 | G442: 12 | H442: 5 | I442: =G442*6+H442 -> 77 | K442: 15 | L442: 7 | M442: =K442*6+L442 -> 97 | O442: 20 | P442: 10 | Q442: =O442*6+P442 -> 130 | S442: GEELONG WEST | W442: WILLIAMSTOWN | X442: 4 | Y442: 6 | Z442: 0 | AA442: 931 | AB442: 1209 | AC442: 77.005789909015718 | AD442: 16
A443: PRAHRAN | C443: 2 | D443: 5 | E443: =C443*6+D443 -> 17 | G443: 6 | H443: 6 | I443: =G443*6+H443 -> 42 | K443: 11 | L443: 8 | M443: =K443*6+L443 -> 74 | O443: 15 | P443: 12 | Q443: =O443*6+P443 -> 102 | S443: GAMBETTA | W443: CAULFIELD | X443: 2 | Y443: 8 | Z443: 0 | AA443: 974 | AB443: 1135 | AC443: 85.814977973568276 | AD443: 8
A444: BEST PLAYERS | W444: SUNSHINE | X444: 2 | Y444: 8 | Z444: 0 | AA444: 961 | AB444: 1113 | AC444: 86.34 | AD444: 8
A445: GEELONG WEST | C445: YATES | F445: MADDEN | I445: HARRIS | L445: GILMORE | O445: WARREN | R445: WOOD | W445: SANDRINGHAM | X445: 2 | Y445: 8 | Z445: 0 | AA445: 824 | AB445: 1088 | AC445: 75.735294117647058 | AD445: 8
A446: PRAHRAN | C446: KENT | F446: PAYNE | I446: McSPEERIN | L446: G SMITH | O446: GRANGE | R446: CROWE
A447: GOALKICKERS
A448: GEELONG WEST | C448: MADDEN 7 | F448: HARRIS 3 | I448: WARREN 3 | L448: STEPHENS 2 | N448: GILMORE 2 | Q448: KLINE | S448: ARKLAY | V448: WOOD
A449: PRAHRAN | C449: K SMITH 4 | F449: G SMITH 3 | I449: JOHNSTON 2 | L449: PAYNE 2 | N449: ANDERSON | Q449: TOWNSEND | T449: McSPEERIN | W449: O'DONNELL
A451: WILLIAMSTOWN | C451: 3 | D451: 2 | E451: =C451*6+D451 -> 20 | G451: 11 | H451: 4 | I451: =G451*6+H451 -> 70 | K451: 12 | L451: 8 | M451: =K451*6+L451 -> 80 | O451: 15 | P451: 9 | Q451: =O451*6+P451 -> 99 | S451: WILLIAMSTOWN
A452: DANDENONG | C452: 1 | D452: 6 | E452: =C452*6+D452 -> 12 | G452: 5 | H452: 8 | I452: =G452*6+H452 -> 38 | K452: 9 | L452: 11 | M452: =K452*6+L452 -> 65 | O452: 13 | P452: 17 | Q452: =O452*6+P452 -> 95 | S452: O'BRIEN
A453: BEST PLAYERS
A454: WILLIAMSTOWN | C454: LANE | F454: TOWNSEND | I454: N STILLMAN | L454: THOMPSON | O454: FANNING | R454: KERR
A455: DANDENONG | C455: ORCHARD | F455: K SHINNERS | I455: HIBBERT | L455: JONES | O455: ANGUS | R455: HENRIKSEN
A456: GOALKICKERS
A457: WILLIAMSTOWN | C457: TOWNSEND 6 | F457: N STILLMAN 4 | J457: L STILLMAN 2 | N457: HEMLEY 2 | Q457: AUGHTON
A458: DANDENONG | C458: MILLER 4 | F458: ORCHARD 3 | I458: HIBBERT 2 | L458: ANGUS | N458: HENRIKSEN | Q458: JONES | S458: HOLDEN
A460: PRESTON | C460: 6 | D460: 3 | E460: =C460*6+D460 -> 39 | G460: 8 | H460: 11 | I460: =G460*6+H460 -> 59 | K460: 12 | L460: 19 | M460: =K460*6+L460 -> 91 | O460: 17 | P460: 24 | Q460: =O460*6+P460 -> 126 | S460: PRESTON
A461: SUNSHINE | C461: 3 | D461: 4 | E461: =C461*6+D461 -> 22 | G461: 6 | H461: 10 | I461: =G461*6+H461 -> 46 | K461: 12 | L461: 10 | M461: =K461*6+L461 -> 82 | O461: 13 | P461: 16 | Q461: =O461*6+P461 -> 94 | S461: TORNEY
A462: BEST PLAYERS
A463: PRESTON | C463: MORRIS | F463: VICKERY | I463: JOHNSON | L463: COBAIN | O463: O'SULLIVAN | R463: ZUNNEBERG
A464: SUNSHINE | C464: ALLEN | F464: FOREMAN | I464: MADDOX | L464: McFETRIDGE | O464: LLOYD | R464: BENSON
A465: GOALKICKERS
A466: PRESTON | C466: VICKERY 5 | F466: JOHNSON 4 | I466: COBAIN 4 | K466: O'SULLIVAN 2 | N466: PETTIGREW | Q466: CLARK
A467: SUNSHINE | C467: MADDOX 5 | F467: McFETRIDGE 4 | J467: CRAWFORD | M467: LLOYD | O467: BENSON | R467: DOLL
A469: SANDRINGHAM | C469: 7 | D469: 9 | E469: =C469*6+D469 -> 51 | G469: 9 | H469: 11 | I469: =G469*6+H469 -> 65 | K469: 12 | L469: 19 | M469: =K469*6+L469 -> 91 | O469: 14 | P469: 20 | Q469: =O469*6+P469 -> 104 | S469: PRINCES PARK
A470: CAULFIELD | C470: 3 | D470: 3 | E470: =C470*6+D470 -> 21 | G470: 9 | H470: 8 | I470: =G470*6+H470 -> 62 | K470: 10 | L470: 10 | M470: =K470*6+L470 -> 70 | O470: 14 | P470: 19 | Q470: =O470*6+P470 -> 103 | S470: HAYES
A471: BEST PLAYERS
A472: SANDRINGHAM | C472: TAYLOR | F472: LYONS | I472: SCHWARZMAN | L472: MAYNE | O472: R MURRAY | R472: SCHOLES
A473: CAULFIELD | C473: PERRY | F473: FRANKLIN | I473: LEGH | L473: WHITE | O473: CLIFF | R473: BROWN
A474: GOALKICKERS
A475: SANDRINGHAM | C475: LYONS 3 | F475: R MURRAY 2 | I475: SCHOLES 2 | L475: CORNER 2 | N475: WARD 2 | Q475: MAYNE | S475: JACOBSEN | V475: CARROLL
A476: CAULFIELD | C476: BROWN 3 | F476: CRUNDEN 3 | I476: FRANKLIN 2 | L476: WHITE | N476: CLIFF | P476: MAGUIRE | R476: GUINANE | U476: HOCKING | X476: BAKER
A478: ROUND 11 | E478: 7TH JULY | J478: WEATHER | N478: RAIN | S478: PLAYED AT
D479: 1ST QTR | H479: 2ND QTR | L479: 3RD QTR | P479: FINAL | S479: DANDENONG
A480: DANDENONG | C480: 2 | D480: 5 | E480: =C480*6+D480 -> 17 | G480: 3 | H480: 6 | I480: =G480*6+H480 -> 24 | K480: 7 | L480: 10 | M480: =K480*6+L480 -> 52 | O480: 9 | P480: 12 | Q480: =O480*6+P480 -> 66 | S480: UMPIRE | X480: LADDER | AB480: ROUND | AD480: 11
A481: PRESTON | C481: 0 | D481: 1 | E481: =C481*6+D481 -> 1 | G481: 3 | H481: 2 | I481: =G481*6+H481 -> 20 | K481: 3 | L481: 2 | M481: =K481*6+L481 -> 20 | O481: 5 | P481: 6 | Q481: =O481*6+P481 -> 36 | S481: HAYES
A482: BEST PLAYERS | W482: TEAM | X482: W | Y482: L | Z482: D | AA482: FOR | AB482: AGST | AC482: % | AD482: PTS
A483: DANDENONG | C483: B SHINNERS | F483: HIBBERT | I483: ORCHARD | L483: KENDALL | O483: BECK | R483: ESLER
A484: PRESTON | C484: LESLIE | F484: MORRIS | I484: PETTIGREW | L484: NALDER | O484: ZUNNEBERG | R484: CLARK | W484: PORT MELBOURNE | X484: 9 | Y484: 2 | Z484: 0 | AA484: 1257 | AB484: 999 | AC484: 125.83 | AD484: 36
A485: GOALKICKERS | W485: OAKLEIGH | X485: 8 | Y485: 3 | Z485: 0 | AA485: 1237 | AB485: 1093 | AC485: 113.17474839890211 | AD485: 32
A486: DANDENONG | C486: MILLER 3 | F486: MADDEN 2 | I486: JONES 2 | L486: KENDALL | N486: ESLER | W486: DANDENONG | X486: 7 | Y486: 4 | Z486: 0 | AA486: 1125 | AB486: 926 | AC486: 121.49 | AD486: 28
A487: PRESTON | C487: VICKERY 2 | F487: CLARK 2 | I487: MARTIN | W487: GEELONG WEST | X487: 7 | Y487: 4 | Z487: 0 | AA487: 1208 | AB487: 1006 | AC487: 120.08 | AD487: 28
A489: PRAHRAN | C489: 6 | D489: 0 | E489: =C489*6+D489 -> 36 | G489: 10 | H489: 3 | I489: =G489*6+H489 -> 63 | K489: 13 | L489: 5 | M489: =K489*6+L489 -> 83 | O489: 16 | P489: 7 | Q489: =O489*6+P489 -> 103 | S489: TOORAK PARK | W489: PRAHRAN | X489: 6 | Y489: 5 | Z489: 0 | AA489: 1089 | AB489: 1028 | AC489: 105.93385214007782 | AD489: 24
A490: WILLIAMSTOWN | C490: 3 | D490: 2 | E490: =C490*6+D490 -> 20 | G490: 5 | H490: 7 | I490: =G490*6+H490 -> 37 | K490: 7 | L490: 8 | M490: =K490*6+L490 -> 50 | O490: 9 | P490: 12 | Q490: =O490*6+P490 -> 66 | S490: ABBOTT | W490: PRESTON | X490: 6 | Y490: 5 | Z490: 0 | AA490: 1051 | AB490: 1054 | AC490: 99.715370018975335 | AD490: 24
A491: BEST PLAYERS | W491: WILLIAMSTOWN | X491: 4 | Y491: 7 | Z491: 0 | AA491: 997 | AB491: 1312 | AC491: 75.990853658536579 | AD491: 16
A492: PRAHRAN | C492: K SMITH | F492: ANDERSON | I492: McSPEERIN | L492: BRITT | O492: TOWNSEND | R492: PAYNE | W492: SUNSHINE | X492: 3 | Y492: 8 | Z492: 0 | AA492: 1055 | AB492: 1178 | AC492: 89.56 | AD492: 12
A493: WILLIAMSTOWN | C493: L STILLMAN | F493: N STILLMAN | I493: ROACH | L493: SCOTT | O493: TOWNSEND | R493: LANE | W493: SANDRINGHAM | X493: 3 | Y493: 8 | Z493: 0 | AA493: 905 | AB493: 1157 | AC493: 78.219533275713047 | AD493: 12
A494: GOALKICKERS | W494: CAULFIELD | X494: 2 | Y494: 9 | Z494: 0 | AA494: 1063 | AB494: 1234 | AC494: 86.142625607779578 | AD494: 8
A495: PRAHRAN | C495: K SMITH 7 | F495: APPLETON 3 | I495: ANDERSON 2 | L495: TOWNSEND | O495: G SMITH | Q495: PAYNE | S495: JOHNSTON
A496: WILLIAMSTOWN | C496: SCOTT 3 | F496: TOWNSEND 3 | I496: FANNING | K496: L STILLMAN | N496: BOXALL
A498: OAKLEIGH | C498: 6 | D498: 5 | E498: =C498*6+D498 -> 41 | G498: 10 | H498: 8 | I498: =G498*6+H498 -> 68 | K498: 14 | L498: 8 | M498: =K498*6+L498 -> 92 | O498: 15 | P498: 9 | Q498: =O498*6+P498 -> 99 | S498: OAKLEIGH
A499: CAULFIELD | C499: 1 | D499: 5 | E499: =C499*6+D499 -> 11 | G499: 6 | H499: 13 | I499: =G499*6+H499 -> 49 | K499: 6 | L499: 18 | M499: =K499*6+L499 -> 54 | O499: 11 | P499: 23 | Q499: =O499*6+P499 -> 89 | S499: McBAIN
A500: BEST PLAYERS
A501: OAKLEIGH | C501: STEWART | F501: J LILLEY | I501: C NESBIT | L501: JACKSON | O501: BARROTT | R501: CLOKE
A502: CAULFIELD | C502: PERRY | F502: WHITE | I502: LEGH | L502: GLAZNER | O502: LOGAN | R502: BROWN
A503: GOALKICKERS
A504: OAKLEIGH | C504: MURNANE 3 | F504: STEWART 2 | I504: RITTERMAN 2 | L504: JACKSON 2 | O504: CLOKE 2 | Q504: BARROTT | T504: WENN | V504: BILLING | X504: J LILLEY
A505: CAULFIELD | C505: BROWN 6 | F505: CRUNDEN 2 | I505: BAKER | K505: LOGAN | M505: WHITE
A507: SANDRINGHAM | C507: 4 | D507: 6 | E507: =C507*6+D507 -> 30 | G507: 4 | H507: 10 | I507: =G507*6+H507 -> 34 | K507: 10 | L507: 15 | M507: =K507*6+L507 -> 75 | O507: 11 | P507: 15 | Q507: =O507*6+P507 -> 81 | S507: BEACH ROAD
A508: GEELONG WEST | C508: 3 | D508: 2 | E508: =C508*6+D508 -> 20 | G508: 6 | H508: 3 | I508: =G508*6+H508 -> 39 | K508: 8 | L508: 4 | M508: =K508*6+L508 -> 52 | O508: 10 | P508: 9 | Q508: =O508*6+P508 -> 69 | S508: HUGGINS
A509: BEST PLAYERS
A510: SANDRINGHAM | C510: MARSHALL | F510: NICHOLSON | I510: SCHOLES | L510: CORNER | O510: COOPER | R510: R MURRAY
A511: GEELONG WEST | C511: MANSON | F511: VAN ELDEN | I511: ARKLAY | L511: GILMORE | O511: MADDEN | R511: DUNNE
A512: GOALKICKERS
A513: SANDRINGHAM | C513: COOPER 4 | F513: R MURRAY 3 | I513: NICHOLSON | L513: HUNTER | N513: KENNEDY | P513: SCHOLES
A514: GEELONG WEST | C514: MADDEN 4 | F514: WARREN 2 | I514: STEPHENS | L514: LINKE | N514: HARRIS | P514: ARKLAY
A516: SUNSHINE | C516: 3 | D516: 2 | E516: =C516*6+D516 -> 20 | G516: 7 | H516: 5 | I516: =G516*6+H516 -> 47 | K516: 10 | L516: 6 | M516: =K516*6+L516 -> 66 | O516: 13 | P516: 16 | Q516: =O516*6+P516 -> 94 | S516: SUNSHINE
A517: PORT MELBOURNE | C517: 0 | D517: 6 | E517: =C517*6+D517 -> 6 | G517: 1 | H517: 9 | I517: =G517*6+H517 -> 15 | K517: 7 | L517: 14 | M517: =K517*6+L517 -> 56 | O517: 8 | P517: 17 | Q517: =O517*6+P517 -> 65 | S517: GAMBETTA
A518: BEST PLAYERS
A519: SUNSHINE | C519: ALLEN | F519: WOODS | I519: GOOLD | L519: TOULMIN | O519: BENSON | R519: LLOYD
A520: PORT MELBOURNE | C520: HERROD | F520: OWEN | I520: BUCKLEY | L520: ELLIOTT | O520: CRITCH | R520: BROWN
A521: GOALKICKERS
A522: SUNSHINE | C522: LLOYD 3 | F522: McFETRIDGE 3 | I522: VELLA 2 | K522: MADDOX 2 | N522: ALLEN | P522: BENSON | R522: FOREMAN
A523: PORT MELBOURNE | C523: HOLT 2 | F523: GOSS | H523: COOK | J523: CRITCH | L523: ELLIOTT | N523: ANDERSON | Q523: HUGHES
A525: ROUND 12 | E525: 14TH JULY | J525: WEATHER | S525: PLAYED AT
D526: 1ST QTR | H526: 2ND QTR | L526: 3RD QTR | P526: FINAL | S526: OAKLEIGH
A527: DANDENONG | C527: 2 | D527: 3 | E527: =C527*6+D527 -> 15 | G527: 5 | H527: 8 | I527: =G527*6+H527 -> 38 | K527: 9 | L527: 11 | M527: =K527*6+L527 -> 65 | O527: 14 | P527: 14 | Q527: =O527*6+P527 -> 98 | S527: UMPIRE | X527: LADDER | AB527: ROUND | AD527: 12
A528: OAKLEIGH | C528: 2 | D528: 6 | E528: =C528*6+D528 -> 18 | G528: 7 | H528: 8 | I528: =G528*6+H528 -> 50 | K528: 12 | L528: 10 | M528: =K528*6+L528 -> 82 | O528: 12 | P528: 11 | Q528: =O528*6+P528 -> 83 | S528: HUGGINS
A529: BEST PLAYERS | W529: TEAM | X529: W | Y529: L | Z529: D | AA529: FOR | AB529: AGST | AC529: % | AD529: PTS
A530: DANDENONG | C530: HARRINGTON | F530: HIBBERT | I530: MADDEN | L530: JONES | N530: ORCHARD | Q530: HENRIKSEN
A531: OAKLEIGH | C531: BARROTT | F531: CLOKE | I531: WENN | L531: J LILLEY | N531: STEWART | Q531: RITTERMAN | W531: PORT MELBOURNE | X531: 10 | Y531: 2 | Z531: 0 | AA531: 1382 | AB531: 1054 | AC531: 131.12 | AD531: 40
A532: GOALKICKERS | W532: GEELONG WEST | X532: 8 | Y532: 4 | Z532: 0 | AA532: 1303 | AB532: 1066 | AC532: 122.23 | AD532: 32
A533: DANDENONG | C533: MADDEN 4 | F533: ORCHARD 4 | I533: JONES 2 | K533: HIBBERT | M533: KENDALL | O533: MILLER | Q533: VAN DE BEEK | W533: DANDENONG | X533: 8 | Y533: 4 | Z533: 0 | AA533: 1223 | AB533: 1009 | AC533: 121.21 | AD533: 32
A534: OAKLEIGH | C534: WENN 4 | F534: CLOKE 2 | I534: BARROTT 2 | L534: RITTERMAN 2 | O534: JACKSON | Q534: STEWART | W534: OAKLEIGH | X534: 8 | Y534: 4 | Z534: 0 | AA534: 1320 | AB534: 1191 | AC534: 110.83123425692695 | AD534: 32
A536: GEELONG WEST | C536: 4 | D536: 4 | E536: =C536*6+D536 -> 28 | G536: 6 | H536: 11 | I536: =G536*6+H536 -> 47 | K536: 9 | L536: 11 | M536: =K536*6+L536 -> 65 | O536: 13 | P536: 17 | Q536: =O536*6+P536 -> 95 | S536: WILLIAMSTOWN | W536: PRAHRAN | X536: 7 | Y536: 5 | Z536: 0 | AA536: 1200 | AB536: 1083 | AC536: 110.80332409972299 | AD536: 28
A537: WILLIAMSTOWN | C537: 1 | D537: 1 | E537: =C537*6+D537 -> 7 | G537: 3 | H537: 1 | I537: =G537*6+H537 -> 19 | K537: 8 | L537: 4 | M537: =K537*6+L537 -> 52 | O537: 9 | P537: 6 | Q537: =O537*6+P537 -> 60 | S537: HAYES | W537: PRESTON | X537: 7 | Y537: 5 | Z537: 0 | AA537: 1167 | AB537: 1148 | AC537: 101.65505226480836 | AD537: 28
A538: BEST PLAYERS | W538: WILLIAMSTOWN | X538: 4 | Y538: 8 | Z538: 0 | AA538: 1057 | AB538: 1407 | AC538: 75.124378109452735 | AD538: 16
A539: GEELONG WEST | C539: MANSON | F539: HARRIS | I539: GILMORE | L539: FRIEND | O539: MADDEN | R539: DUNNE | W539: SUNSHINE | X539: 3 | Y539: 9 | Z539: 0 | AA539: 1110 | AB539: 1289 | AC539: 86.11 | AD539: 12
A540: WILLIAMSTOWN | C540: KERR | F540: PERCY | I540: BOXALL | L540: COURTOT | O540: L STILLMAN | W540: SANDRINGHAM | X540: 3 | Y540: 9 | Z540: 0 | AA540: 960 | AB540: 1282 | AC540: 74.882995319812792 | AD540: 12
A541: GOALKICKERS | W541: CAULFIELD | X541: 2 | Y541: 10 | Z541: 0 | AA541: 1157 | AB541: 1350 | AC541: 85.703703703703709 | AD541: 8
A542: GEELONG WEST | C542: MADDEN 4 | F542: LINKE 2 | I542: HARRIS 2 | L542: GILLIES 2 | O542: ARKLAY | Q542: YATES | S542: STEPHENS
A543: WILLIAMSTOWN | C543: L STILLMAN 3 | F543: TOWNSEND 2 | I543: AUGHTON | K543: HEMLEY | M543: SHAW | O543: HANNEBURY
A545: PRAHRAN | C545: 1 | D545: 8 | E545: =C545*6+D545 -> 14 | G545: 6 | H545: 13 | I545: =G545*6+H545 -> 49 | K545: 8 | L545: 16 | M545: =K545*6+L545 -> 64 | O545: 15 | P545: 21 | Q545: =O545*6+P545 -> 111 | S545: TOORAK PARK
A546: SUNSHINE | C546: 5 | D546: 4 | E546: =C546*6+D546 -> 34 | G546: 6 | H546: 4 | I546: =G546*6+H546 -> 40 | K546: 8 | L546: 6 | M546: =K546*6+L546 -> 54 | O546: 8 | P546: 7 | Q546: =O546*6+P546 -> 55 | S546: WENN
A547: BEST PLAYERS
A548: PRAHRAN | C548: ANDERSON | F548: PIROUET | I548: JOHNSTON | L548: K SMITH | O548: O'DONNELL | R548: TOWNSEND
A549: SUNSHINE | C549: ALLEN | F549: BAIRD | I549: McFETRIDGE | L549: DE ARAUGO | O549: CLARKE | R549: PIERZAK
A550: GOALKICKERS
A551: PRAHRAN | C551: JOHNSTON 4 | F551: K SMITH 2 | I551: McSPEERIN 2 | L551: ANDERSON 2 | O551: G SMITH 2 | R551: O'DONNELL | U551: APPLETON | X551: KENT
A552: SUNSHINE | C552: McFETRIDGE 3 | F552: CLARKE | H552: FOREMAN | J552: LLOYD | L552: VELLA | N552: MADDOX
A554: PRESTON | C554: 6 | D554: 7 | E554: =C554*6+D554 -> 43 | G554: 10 | H554: 8 | I554: =G554*6+H554 -> 68 | K554: 16 | L554: 14 | M554: =K554*6+L554 -> 110 | O554: 17 | P554: 14 | Q554: =O554*6+P554 -> 116 | S554: PRESTON
A555: CAULFIELD | C555: 1 | D555: 2 | E555: =C555*6+D555 -> 8 | G555: 5 | H555: 4 | I555: =G555*6+H555 -> 34 | K555: 8 | L555: 7 | M555: =K555*6+L555 -> 55 | O555: 13 | P555: 16 | Q555: =O555*6+P555 -> 94 | S555: DAVIS
A556: BEST PLAYERS
A557: PRESTON | C557: ZUNNEBERG | F557: WILSON | I557: GRAINGER | L557: PETTIGREW | O557: MARSHALL
A558: CAULFIELD | C558: PERRY | F558: DOWSETT | I558: LEGH | L558: GLAZNER | O558: EINSEDEL | R558: HOCKING
A559: GOALKICKERS
A560: PRESTON | C560: WILSON 5 | F560: VICKERY 3 | I560: MARTIN 2 | K560: WEIGHTMAN 2 | N560: MARSHALL | Q560: PETTIGREW | T560: SMITH | V560: COBAIN | X560: CLARK
A561: CAULFIELD | C561: PERRY 4 | F561: BROWN 3 | I561: CRUNDEN 3 | L561: GLAZNER 2 | O561: CLIFF
A563: PORT MELBOURNE | C563: 5 | D563: 0 | E563: =C563*6+D563 -> 30 | G563: 13 | H563: 1 | I563: =G563*6+H563 -> 79 | K563: 15 | L563: 7 | M563: =K563*6+L563 -> 97 | O563: 19 | P563: 11 | Q563: =O563*6+P563 -> 125 | S563: PORT MELBOURNE
A564: SANDRINGHAM | C564: 2 | D564: 5 | E564: =C564*6+D564 -> 17 | G564: 4 | H564: 9 | I564: =G564*6+H564 -> 33 | K564: 4 | L564: 11 | M564: =K564*6+L564 -> 35 | O564: 7 | P564: 13 | Q564: =O564*6+P564 -> 55 | S564: ABBOTT
A565: BEST PLAYERS
A566: PORT MELBOURNE | C566: HERROD | F566: BUCKLEY | I566: COOK | L566: ANDERSON | O566: ALLEN | Q566: OWEN
A567: SANDRINGHAM | C567: NICHOLSON | F567: HUNTER | I567: R MURRAY | L567: MURLEY | O567: LYONS | Q567: WARD
A568: GOALKICKERS
A569: PORT MELBOURNE | C569: COOK 7 | F569: DAVIS 4 | I569: ANDERSON 4 | L569: FRENCH 2 | O569: HOLT | Q569: HARLAND
A570: SANDRINGHAM | C570: COOPER 3 | F570: HUNTER 2 | I570: SPURRELL | L570: BROMLEY
A572: ROUND 13 | E572: 21ST JULY | J572: WEATHER | N572: NORTH WIND | S572: PLAYED AT
D573: 1ST QTR | H573: 2ND QTR | L573: 3RD QTR | P573: FINAL | S573: DANDENONG
A574: PRAHRAN | C574: 2 | D574: 4 | E574: =C574*6+D574 -> 16 | G574: 7 | H574: 4 | I574: =G574*6+H574 -> 46 | K574: 15 | L574: 7 | M574: =K574*6+L574 -> 97 | O574: 17 | P574: 7 | Q574: =O574*6+P574 -> 109 | S574: UMPIRE | X574: LADDER | AB574: ROUND | AD574: 13
A575: DANDENONG | C575: 2 | D575: 0 | E575: =C575*6+D575 -> 12 | G575: 7 | H575: 1 | I575: =G575*6+H575 -> 43 | K575: 8 | L575: 5 | M575: =K575*6+L575 -> 53 | O575: 15 | P575: 12 | Q575: =O575*6+P575 -> 102 | S575: TORNEY
A576: BEST PLAYERS | W576: TEAM | X576: W | Y576: L | Z576: D | AA576: FOR | AB576: AGST | AC576: % | AD576: PTS
A577: PRAHRAN | C577: GUNN | F577: JOHNSTON | I577: APPLETON | L577: G SMITH | N577: TOWNSEND | Q577: ANDERSON
A578: DANDENONG | C578: B SHINNERS | F578: ORCHARD | I578: HENRIKSEN | L578: HIBBERT | N578: BECK | Q578: ESLER | W578: PORT MELBOURNE | X578: 10 | Y578: 3 | Z578: 0 | AA578: 1470 | AB578: 1162 | AC578: 126.51 | AD578: 40
A579: GOALKICKERS | L579: APPLETON | N579: JOHNSTON | Q579: O'DONNELL | W579: GEELONG WEST | X579: 9 | Y579: 4 | Z579: 0 | AA579: 1392 | AB579: 1129 | AC579: 123.29 | AD579: 36
A580: PRAHRAN | C580: K SMITH 3 | F580: TOWNSEND 2 | I580: G SMITH 2 | K580: McSPEERIN 2 | N580: McFARLANE 2 | Q580: PAYNE | S580: ANDERSON | W580: DANDENONG | X580: 8 | Y580: 5 | Z580: 0 | AA580: 1325 | AB580: 1118 | AC580: 118.52 | AD580: 32
A581: DANDENONG | C581: JONES 5 | F581: MILLER 4 | I581: FLAHERTY 2 | L581: ORCHARD | N581: HIBBERT | P581: K SHINNERS | S581: DA ROSE | W581: PRAHRAN | X581: 8 | Y581: 5 | Z581: 0 | AA581: 1309 | AB581: 1185 | AC581: 110.46413502109705 | AD581: 32
A583: GEELONG WEST | C583: 1 | D583: 2 | E583: =C583*6+D583 -> 8 | G583: 6 | H583: 4 | I583: =G583*6+H583 -> 40 | K583: 7 | L583: 10 | M583: =K583*6+L583 -> 52 | O583: 12 | P583: 17 | Q583: =O583*6+P583 -> 89 | S583: GEELONG WEST | W583: OAKLEIGH | X583: 8 | Y583: 5 | Z583: 0 | AA583: 1430 | AB583: 1311 | AC583: 109.07704042715484 | AD583: 32
A584: PRESTON | C584: 2 | D584: 5 | E584: =C584*6+D584 -> 17 | G584: 3 | H584: 5 | I584: =G584*6+H584 -> 23 | K584: 6 | L584: 13 | M584: =K584*6+L584 -> 49 | O584: 8 | P584: 15 | Q584: =O584*6+P584 -> 63 | S584: GAMBETTA | W584: PRESTON | X584: 7 | Y584: 6 | Z584: 0 | AA584: 1230 | AB584: 1237 | AC584: 99.434114793856097 | AD584: 28
A585: BEST PLAYERS | W585: WILLIAMSTOWN | X585: 5 | Y585: 8 | Z585: 0 | AA585: 1161 | AB585: 1477 | AC585: 78.605280974949224 | AD585: 20
A586: GEELONG WEST | C586: WELLS | F586: GILMORE | I586: ARKLAY | L586: SMITH | O586: MANSON | R586: LINKE | W586: SANDRINGHAM | X586: 4 | Y586: 9 | Z586: 0 | AA586: 1080 | AB586: 1392 | AC586: 77.58620689655173 | AD586: 16
A587: PRESTON | C587: MARSHALL | F587: ZUNNEBERG | I587: WEIGHTMAN | L587: PETTIGREW | O587: NALDER | R587: COBAIN | W587: CAULFIELD | X587: 3 | Y587: 10 | Z587: 0 | AA587: 1265 | AB587: 1438 | AC587: 87.969401947148825 | AD587: 12
A588: GOALKICKERS | W588: SUNSHINE | X588: 3 | Y588: 10 | Z588: 0 | AA588: 1180 | AB588: 1393 | AC588: 84.71 | AD588: 12
A589: GEELONG WEST | C589: ARKLAY 3 | F589: MADDEN 3 | I589: WELLS 3 | K589: MANSON | N589: HARRIS | P589: GILLIES
A590: PRESTON | C590: MARSHALL 2 | F590: WEIGHTMAN 2 | J590: VICKERY | L590: INGLES | N590: COBAIN | P590: CLARK
A592: WILLIAMSTOWN | C592: 3 | D592: 3 | E592: =C592*6+D592 -> 21 | G592: 6 | H592: 4 | I592: =G592*6+H592 -> 40 | K592: 10 | L592: 9 | M592: =K592*6+L592 -> 69 | O592: 15 | P592: 14 | Q592: =O592*6+P592 -> 104 | S592: SUNSHINE
A593: SUNSHINE | C593: 1 | D593: 4 | E593: =C593*6+D593 -> 10 | G593: 7 | H593: 5 | I593: =G593*6+H593 -> 47 | K593: 8 | L593: 7 | M593: =K593*6+L593 -> 55 | O593: 10 | P593: 10 | Q593: =O593*6+P593 -> 70 | S593: HUGGINS
A594: BEST PLAYERS
A595: WILLIAMSTOWN | C595: FANNING | F595: LANE | I595: KERR | K595: JACKMAN | N595: GARDNER | Q595: TOWNSEND
A596: SUNSHINE | C596: ALLEN | F596: GOOLD | I596: POTTER | K596: VELLA | N596: PIERZAK | Q596: WOODS
A597: GOALKICKERS
A598: WILLIAMSTOWN | C598: FANNING 4 | F598: TOWNSEND 3 | I598: SCOTT 3 | K598: SHAW 2 | M598: JACKMAN 2 | P598: GARDNER
A599: SUNSHINE | C599: PIERZAK 2 | F599: McFETRIDGE 2 | I599: MADDOX | K599: VELLA | M599: BENSON | O599: LLOYD | Q599: FOREMAN | T599: CLIFFORD
A601: SANDRINGHAM | C601: 3 | D601: 4 | E601: =C601*6+D601 -> 22 | G601: 7 | H601: 9 | I601: =G601*6+H601 -> 51 | K601: 13 | L601: 11 | M601: =K601*6+L601 -> 89 | O601: 18 | P601: 12 | Q601: =O601*6+P601 -> 120 | S601: BEACH ROAD
A602: OAKLEIGH | C602: 3 | D602: 6 | E602: =C602*6+D602 -> 24 | G602: 7 | H602: 7 | I602: =G602*6+H602 -> 49 | K602: 12 | L602: 10 | M602: =K602*6+L602 -> 82 | O602: 16 | P602: 14 | Q602: =O602*6+P602 -> 110 | S602: O'BRIEN
A603: BEST PLAYERS
A604: SANDRINGHAM | C604: LYONS | F604: SCHOLES | I604: WARD | L604: COOPER | O604: MARSHALL | R604: CARROLL
A605: OAKLEIGH | C605: McGRATH | F605: P LILLEY | I605: TESERIERO | L605: MURNANE | O605: BILLING | R605: McDONALD
A606: GOALKICKERS
A607: SANDRINGHAM | C607: COOPER 7 | F607: HUNTER 3 | I607: WARD 3 | K607: SCHOLES 2 | N607: LYONS 2 | P607: CARROLL
A608: OAKLEIGH | C608: MURNANE 5 | F608: McDONALD 2 | I608: WENN 2 | K608: CLOKE 2 | M608: BILLING 2 | O608: TESERIERO | Q608: J LILLEY | T608: HOWELL
A610: CAULFIELD | C610: 6 | D610: 4 | E610: =C610*6+D610 -> 40 | G610: 8 | H610: 6 | I610: =G610*6+H610 -> 54 | K610: 14 | L610: 8 | M610: =K610*6+L610 -> 92 | O610: 16 | P610: 12 | Q610: =O610*6+P610 -> 108 | S610: PRINCES PARK
A611: PORT MELBOURNE | C611: 1 | D611: 2 | E611: =C611*6+D611 -> 8 | G611: 7 | H611: 5 | I611: =G611*6+H611 -> 47 | K611: 10 | L611: 10 | M611: =K611*6+L611 -> 70 | O611: 12 | P611: 16 | Q611: =O611*6+P611 -> 88 | S611: WENN
A612: BEST PLAYERS
A613: CAULFIELD | C613: HUNTER | F613: PERRY | I613: BAKER | L613: BROWN | O613: EINSEDEL | R613: WHITE
A614: PORT MELBOURNE | C614: DAVIS | F614: ALLEN | I614: BUCKLEY | L614: COOK | O614: ANDERSON | R614: FRENCH
A615: GOALKICKERS
A616: CAULFIELD | C616: BROWN 6 | F616: GUINANE 3 | I616: EASTWOOD 2 | L616: BAKER 2 | N616: GLAZNER | Q616: PERRY | S616: TULLOCH
A617: PORT MELBOURNE | C617: DAVIS 4 | F617: BEHAN 3 | I617: ANDERSON 2 | L617: COOK | N617: ERWIN | P617: HARLAND
A619: ROUND 14 | E619: 28TH JULY | J619: WEATHER | N619: SOUTH WEST WIND | S619: PLAYED AT
D620: 1ST QTR | H620: 2ND QTR | L620: 3RD QTR | P620: FINAL | S620: PORT MELBOURNE
A621: PORT MELBOURNE | C621: 4 | D621: 4 | E621: =C621*6+D621 -> 28 | G621: 6 | H621: 8 | I621: =G621*6+H621 -> 44 | K621: 9 | L621: 15 | M621: =K621*6+L621 -> 69 | O621: 15 | P621: 22 | Q621: =O621*6+P621 -> 112 | S621: UMPIRE | X621: LADDER | AB621: ROUND | AD621: 14
A622: GEELONG WEST | C622: 2 | D622: 1 | E622: =C622*6+D622 -> 13 | G622: 4 | H622: 3 | I622: =G622*6+H622 -> 27 | K622: 8 | L622: 6 | M622: =K622*6+L622 -> 54 | O622: 11 | P622: 7 | Q622: =O622*6+P622 -> 73 | S622: O'BRIEN
A623: BEST PLAYERS | W623: TEAM | X623: W | Y623: L | Z623: D | AA623: FOR | AB623: AGST | AC623: % | AD623: PTS
A624: PORT MELBOURNE | C624: HERROD | F624: ANDERSON | I624: GOSS | L624: O'BRIEN | N624: HARLAND | Q624: BROWN
A625: GEELONG WEST | C625: STEPHENS | F625: GILMORE | I625: SMITH | L625: YATES | N625: BARRY | Q625: HARRIS | W625: PORT MELBOURNE | X625: 11 | Y625: 3 | Z625: 0 | AA625: 1582 | AB625: 1235 | AC625: 128.1 | AD625: 44
A626: GOALKICKERS | R626: ELLIOTT | W626: DANDENONG | X626: 9 | Y626: 5 | Z626: 0 | AA626: 1476 | AB626: 1184 | AC626: 124.66 | AD626: 36
A627: PORT MELBOURNE | C627: GOSS 2 | E627: COOK 2 | G627: HARLAND 2 | J627: HOLT 2 | L627: DAVIS 2 | N627: ANDERSON 2 | Q627: BEHAN | S627: CRITCH | W627: GEELONG WEST | X627: 9 | Y627: 5 | Z627: 0 | AA627: 1465 | AB627: 1241 | AC627: 118.05 | AD627: 36
A628: GEELONG WEST | C628: ARKLAY 2 | F628: MADDEN 2 | I628: WELLS 2 | K628: STEPHENS | M628: WOOD | O628: HARRIS | Q628: GILMORE | S628: WARREN | W628: OAKLEIGH | X628: 9 | Y628: 5 | Z628: 0 | AA628: 1572 | AB628: 1417 | AC628: 110.93860268172195 | AD628: 36
A630: OAKLEIGH | C630: 3 | D630: 2 | E630: =C630*6+D630 -> 20 | G630: 10 | H630: 6 | I630: =G630*6+H630 -> 66 | K630: 16 | L630: 9 | M630: =K630*6+L630 -> 105 | O630: 21 | P630: 16 | Q630: =O630*6+P630 -> 142 | S630: TOORAK PARK | W630: PRAHRAN | X630: 8 | Y630: 6 | Z630: 0 | AA630: 1415 | AB630: 1327 | AC630: 106.63149962321025 | AD630: 32
A631: PRAHRAN | C631: 5 | D631: 5 | E631: =C631*6+D631 -> 35 | G631: 10 | H631: 6 | I631: =G631*6+H631 -> 66 | K631: 14 | L631: 9 | M631: =K631*6+L631 -> 93 | O631: 16 | P631: 10 | Q631: =O631*6+P631 -> 106 | S631: GAMBETTA | W631: PRESTON | X631: 8 | Y631: 6 | Z631: 0 | AA631: 1333 | AB631: 1324 | AC631: 100.6797583081571 | AD631: 32
A632: BEST PLAYERS | W632: SANDRINGHAM | X632: 5 | Y632: 9 | Z632: 0 | AA632: 1174 | AB632: 1466 | AC632: 80.081855388813096 | AD632: 20
A633: OAKLEIGH | C633: TESERIERO | F633: BILLING | I633: MURNANE | L633: CLOKE | O633: J LILLEY | R633: RITTERMAN | W633: WILLIAMSTOWN | X633: 5 | Y633: 9 | Z633: 0 | AA633: 1248 | AB633: 1580 | AC633: 78.987341772151893 | AD633: 20
A634: PRAHRAN | C634: PAYNE | F634: ANDERSON | I634: K SMITH | L634: KENT | O634: McSPEERIN | R634: CHAPMAN | W634: SUNSHINE | X634: 3 | Y634: 11 | Z634: 0 | AA634: 1254 | AB634: 1487 | AC634: 84.33 | AD634: 12
A635: GOALKICKERS | W635: CAULFIELD | X635: 3 | Y635: 11 | Z635: 0 | AA635: 1331 | AB635: 1589 | AC635: 83.763373190685968 | AD635: 12
A636: OAKLEIGH | C636: MURNANE 5 | F636: MOORE 4 | I636: CLOKE 4 | K636: RITTERMAN 3 | N636: TESERIERO 2 | Q636: J LILLEY | S636: JACKSON | V636: WENN
A637: PRAHRAN | C637: K SMITH 5 | F637: ANDERSON 2 | I637: JOHNSTON 2 | L637: G SMITH 2 | N637: McSPEERIN 2 | Q637: TOWNSEND | T637: McFARLANE | W637: CULPIN
A639: PRESTON | C639: 4 | D639: 3 | E639: =C639*6+D639 -> 27 | G639: 8 | H639: 4 | I639: =G639*6+H639 -> 52 | K639: 10 | L639: 6 | M639: =K639*6+L639 -> 66 | O639: 15 | P639: 13 | Q639: =O639*6+P639 -> 103 | S639: PRESTON
A640: WILLIAMSTOWN | C640: 4 | D640: 2 | E640: =C640*6+D640 -> 26 | G640: 6 | H640: 6 | I640: =G640*6+H640 -> 42 | K640: 8 | L640: 11 | M640: =K640*6+L640 -> 59 | O640: 12 | P640: 15 | Q640: =O640*6+P640 -> 87 | S640: TORNEY
A641: BEST PLAYERS
A642: PRESTON | C642: ZUNNEBERG | F642: INGLES | I642: MARSHALL | L642: CLARK | O642: NALDER | R642: STEPHENS
A643: WILLIAMSTOWN | C643: SCOTT | F643: GILL | I643: L STILLMAN | L643: THOMPSON | O643: FANNING | R643: PERCY
A644: GOALKICKERS
A645: PRESTON | C645: CLARK 4 | E645: COBAIN 2 | H645: MIDDLETON 2 | K645: MARTIN 2 | M645: MARSHALL | P645: WEIGHTMAN | S645: PETTIGREW | V645: WILSON | X645: IRELAND
A646: WILLIAMSTOWN | C646: SCOTT 5 | F646: TOWNSEND 2 | I646: CATER | K646: ROACH | M646: LANE | N646: FANNING | P646: L STILLMAN
A648: SANDRINGHAM | C648: 3 | D648: 3 | E648: =C648*6+D648 -> 21 | G648: 4 | H648: 4 | I648: =G648*6+H648 -> 28 | K648: 7 | L648: 7 | M648: =K648*6+L648 -> 49 | O648: 13 | P648: 16 | Q648: =O648*6+P648 -> 94 | S648: SUNSHINE
A649: SUNSHINE | C649: 3 | D649: 5 | E649: =C649*6+D649 -> 23 | G649: 5 | H649: 7 | I649: =G649*6+H649 -> 37 | K649: 9 | L649: 11 | M649: =K649*6+L649 -> 65 | O649: 10 | P649: 14 | Q649: =O649*6+P649 -> 74 | S649: HAYES
A650: BEST PLAYERS
A651: SANDRINGHAM | C651: NICHOLSON | F651: HUNTER | I651: McCARTHY | L651: MAYNE | O651: TAYLOR | R651: LYONS
A652: SUNSHINE | C652: POTTER | F652: WOODS | I652: ALLEN | L652: BAIRD | O652: LLOYD | R652: BENTLEY
A653: GOALKICKERS
A654: SANDRINGHAM | C654: LYONS 3 | F654: HUNTER 3 | I654: McCARTHY 2 | L654: MAYNE 2 | O654: COOPER 2 | R654: SCHOLES
A655: SUNSHINE | C655: BENTLEY 3 | F655: BAIRD 3 | I655: LLOYD 2 | L655: SLADDIN | O655: MADDOX
A657: DANDENONG | C657: 1 | D657: 5 | E657: =C657*6+D657 -> 11 | G657: 8 | H657: 9 | I657: =G657*6+H657 -> 57 | K657: 13 | L657: 10 | M657: =K657*6+L657 -> 88 | O657: 23 | P657: 13 | Q657: =O657*6+P657 -> 151 | S657: DANDENONG
A658: CAULFIELD | C658: 2 | D658: 2 | E658: =C658*6+D658 -> 14 | G658: 7 | H658: 4 | I658: =G658*6+H658 -> 46 | K658: 9 | L658: 6 | M658: =K658*6+L658 -> 60 | O658: 10 | P658: 6 | Q658: =O658*6+P658 -> 66 | S658: ABBOTT
A659: BEST PLAYERS
A660: DANDENONG | C660: ORCHARD | F660: ANGUS | I660: HIBBERT | L660: MADDEN | O660: FLAHERTY | R660: MELAI
A661: CAULFIELD | C661: WHITE | F661: CLIFF | I661: LOGAN | L661: GLAZNER | O661: EINSEDEL | R661: PERRY
A662: GOALKICKERS
A663: DANDENONG | C663: MADDEN 7 | F663: FLAHERTY 6 | I663: MILLER 4 | K663: ORCHARD | M663: FIELDER | O663: JONES | Q663: ANGUS | S663: MELAI | U663: HENRIKSEN
A664: CAULFIELD | C664: BROWN 3 | F664: GUINANE 2 | I664: PERRY | K664: HUNTER | M664: TULLOH | O664: WHITE | Q664: CLIFF
A666: ROUND 15 | E666: 4TH AUGUST | J666: WEATHER | N666: SOUTH WIND SHOWERS | S666: PLAYED AT
D667: 1ST QTR | H667: 2ND QTR | L667: 3RD QTR | P667: FINAL | S667: PRESTON
A668: PRAHRAN | C668: 7 | D668: 2 | E668: =C668*6+D668 -> 44 | G668: 9 | H668: 2 | I668: =G668*6+H668 -> 56 | K668: 13 | L668: 7 | M668: =K668*6+L668 -> 85 | O668: 13 | P668: 10 | Q668: =O668*6+P668 -> 88 | S668: UMPIRE | X668: LADDER | AB668: ROUND | AD668: 15
A669: PRESTON | C669: 3 | D669: 2 | E669: =C669*6+D669 -> 20 | G669: 7 | H669: 6 | I669: =G669*6+H669 -> 48 | K669: 8 | L669: 7 | M669: =K669*6+L669 -> 55 | O669: 12 | P669: 8 | Q669: =O669*6+P669 -> 80 | S669: O'BRIEN
A670: BEST PLAYERS | W670: TEAM | X670: W | Y670: L | Z670: D | AA670: FOR | AB670: AGST | AC670: % | AD670: PTS
A671: PRAHRAN | C671: PAYNE | F671: APPLETON | I671: G SMITH | L671: ANDERSON | O671: KENT | Q671: TOWNSEND
A672: PRESTON | C672: ZUNNEBERG | F672: NALDER | I672: LESLIE | L672: JINKS | O672: COBAIN | Q672: PETTIGREW | W672: PORT MELBOURNE | X672: 11 | Y672: 4 | Z672: 0 | AA672: 1622 | AB672: 1302 | AC672: 124.58 | AD672: 44
A673: GOALKICKERS | W673: DANDENONG | X673: 10 | Y673: 5 | Z673: 0 | AA673: 1598 | AB673: 1261 | AC673: 126.72 | AD673: 40
A674: PRAHRAN | C674: APPLETON 3 | F674: KENT 3 | H674: McSPEERIN 2 | K674: JOHNSTON | M674: TOWNSEND | O674: K SMITH | Q674: CHAPMAN | S674: G SMITH | W674: GEELONG WEST | X674: 10 | Y674: 5 | Z674: 0 | AA674: 1578 | AB674: 1321 | AC674: 119.45 | AD674: 40
A675: PRESTON | C675: COBAIN 4 | F675: CLARK 2 | H675: MARSHALL | J675: GRAINGER | L675: WEIGHTMAN | O675: WILSON | Q675: MIDDLETON | T675: NALDER | W675: OAKLEIGH | X675: 10 | Y675: 5 | Z675: 0 | AA675: 1678 | AB675: 1494 | AC675: 112.32 | AD675: 40
A677: DANDENONG | C677: 8 | D677: 4 | E677: =C677*6+D677 -> 52 | G677: 10 | H677: 4 | I677: =G677*6+H677 -> 64 | K677: 16 | L677: 7 | M677: =K677*6+L677 -> 103 | O677: 19 | P677: 8 | Q677: =O677*6+P677 -> 122 | S677: BEACH ROAD | W677: PRAHRAN | X677: 9 | Y677: 6 | Z677: 0 | AA677: 1503 | AB677: 1407 | AC677: 106.82302771855011 | AD677: 36
A678: SANDRINGHAM | C678: 3 | D678: 0 | E678: =C678*6+D678 -> 18 | G678: 7 | H678: 1 | I678: =G678*6+H678 -> 43 | K678: 7 | L678: 1 | M678: =K678*6+L678 -> 43 | O678: 12 | P678: 5 | Q678: =O678*6+P678 -> 77 | S678: HUGGINS | W678: PRESTON | X678: 8 | Y678: 7 | Z678: 0 | AA678: 1413 | AB678: 1412 | AC678: 100.07082152974505 | AD678: 32
A679: BEST PLAYERS | W679: WILLIAMSTOWN | X679: 6 | Y679: 9 | Z679: 0 | AA679: 1315 | AB679: 1620 | AC679: 81.172839506172835 | AD679: 24
A680: DANDENONG | C680: ORCHARD | F680: REID | I680: KENDALL | L680: ESLER | O680: MADDEN | R680: HIBBERT | W680: SANDRINGHAM | X680: 5 | Y680: 10 | Z680: 0 | AA680: 1251 | AB680: 1588 | AC680: 78.778337531486144 | AD680: 20
A681: SANDRINGHAM | C681: R MURRAY | F681: TAYLOR | I681: HUNTER | L681: WARD | O681: MARSHALL | R681: MURLEY | W681: SUNSHINE | X681: 3 | Y681: 12 | Z681: 0 | AA681: 1331 | AB681: 1593 | AC681: 83.55 | AD681: 12
A682: GOALKICKERS | O682: SHINNERS | R682: ANGUS | T682: MELAI | W682: CAULFIELD | X682: 3 | Y682: 12 | Z682: 0 | AA682: 1411 | AB682: 1702 | AC682: 82.902467685076374 | AD682: 12
A683: DANDENONG | C683: ORCHARD 3 | F683: MILLER 3 | I683: MADDEN 3 | L683: JONES 2 | N683: FLAHERTY 2 | Q683: HIBBERT | S683: FIELDER | U683: KENDALL
A684: SANDRINGHAM | C684: COOPER 2 | F684: R MURRAY 2 | I684: WARD 2 | K684: HUNTER | M684: CORNER | O684: MAYNE | Q684: LIPSCOMBE | S684: LYONS | U684: LIDDELL
A686: GEELONG WEST | C686: 5 | D686: 3 | E686: =C686*6+D686 -> 33 | G686: 5 | H686: 5 | I686: =G686*6+H686 -> 35 | K686: 11 | L686: 10 | M686: =K686*6+L686 -> 76 | O686: 17 | P686: 11 | Q686: =O686*6+P686 -> 113 | S686: PRINCES PARK
A687: CAULFIELD | C687: 0 | D687: 1 | E687: =C687*6+D687 -> 1 | G687: 5 | H687: 6 | I687: =G687*6+H687 -> 36 | K687: 7 | L687: 8 | M687: =K687*6+L687 -> 50 | O687: 11 | P687: 14 | Q687: =O687*6+P687 -> 80 | S687: TORNEY
A688: BEST PLAYERS
A689: GEELONG WEST | C689: MANSON | F689: MADDEN | I689: STEPHENS | L689: BARRY | N689: YATES | Q689: SMITH
A690: CAULFIELD | C690: CLIFF | F690: RENOWDEN | I690: EINSEDEL | L690: TEMPEST | N690: BROWN | Q690: FELDMAN
A691: GOALKICKERS
A692: GEELONG WEST | C692: MADDEN 6 | F692: HARRIS 2 | I692: STEPHENS 2 | L692: WOOD 2 | N692: LINKE | P692: MASON | R692: YATES | T692: IRVIN | V692: GILMORE
A693: CAULFIELD | C693: BROWN 3 | F693: CLIFF 2 | I693: WHITE 2 | L693: EINSEDEL | N693: GUINANE | Q693: FELDMAN | T693: EASTWOOD
A695: OAKLEIGH | C695: 3 | D695: 1 | E695: =C695*6+D695 -> 19 | G695: 7 | H695: 6 | I695: =G695*6+H695 -> 48 | K695: 11 | L695: 13 | M695: =K695*6+L695 -> 79 | O695: 15 | P695: 16 | Q695: =O695*6+P695 -> 106 | S695: OAKLEIGH
A696: SUNSHINE | C696: 4 | D696: 4 | E696: =C696*6+D696 -> 28 | G696: 6 | H696: 7 | I696: =G696*6+H696 -> 43 | K696: 8 | L696: 8 | M696: =K696*6+L696 -> 56 | O696: 11 | P696: 11 | Q696: =O696*6+P696 -> 77 | S696: DAVIS
A697: BEST PLAYERS
A698: OAKLEIGH | C698: McGRATH | F698: MOORE | I698: TESERIERO | L698: P LILLEY | O698: WENN | R698: J LILLEY
A699: SUNSHINE | C699: GOOLD | F699: SLADDIN | I699: HUTCHINSON | L699: ALLEN | O699: FOREMAN | R699: BENSON
A700: GOALKICKERS
A701: OAKLEIGH | C701: MOORE 5 | F701: TESERIERO 4 | I701: MURNANE 2 | L701: WENN 2 | N701: JACKSON | P701: BILLING
A702: SUNSHINE | C702: BENTLEY 3 | F702: FOREMAN 3 | I702: LLOYD 2 | K702: GOOLD | M702: HUTCHINSON | P702: SLADDIN
A704: WILLIAMSTOWN | C704: 0 | D704: 2 | E704: =C704*6+D704 -> 2 | G704: 4 | H704: 5 | I704: =G704*6+H704 -> 29 | K704: 4 | L704: 7 | M704: =K704*6+L704 -> 31 | O704: 9 | P704: 13 | Q704: =O704*6+P704 -> 67 | S704: WILLIAMSTOWN
A705: PORT MELBOURNE | C705: 0 | D705: 8 | E705: =C705*6+D705 -> 8 | G705: 1 | H705: 9 | I705: =G705*6+H705 -> 15 | K705: 3 | L705: 15 | M705: =K705*6+L705 -> 33 | O705: 4 | P705: 16 | Q705: =O705*6+P705 -> 40 | S705: GAMBETTA
A706: BEST PLAYERS
A707: WILLIAMSTOWN | C707: FANNING | F707: L STILLMAN | I707: RADZIMINSKI | M707: GILL | O707: SHAW | R707: N STILLMAN
A708: PORT MELBOURNE | C708: HERROD | F708: O'BRIEN | I708: HARLAND | M708: BROWN | O708: BUCKLEY | R708: ANDERSON
A709: GOALKICKERS
A710: WILLIAMSTOWN | C710: TOWNSEND 3 | F710: L STILLMAN 2 | J710: JACKMAN 2 | M710: SHAW | O710: ROACH
A711: PORT MELBOURNE | C711: BROWN | F711: COOK | H711: BUCKLEY | K711: HOLT
A713: ROUND 16 | E713: 11TH AUGUST | J713: WEATHER | N713: NORTH WIND | S713: PLAYED AT
D714: 1ST QTR | H714: 2ND QTR | L714: 3RD QTR | P714: FINAL | S714: GEELONG WEST
A715: GEELONG WEST | C715: 3 | D715: 7 | E715: =C715*6+D715 -> 25 | G715: 6 | H715: 7 | I715: =G715*6+H715 -> 43 | K715: 9 | L715: 9 | M715: =K715*6+L715 -> 63 | O715: 13 | P715: 15 | Q715: =O715*6+P715 -> 93 | S715: UMPIRE | X715: LADDER | AB715: ROUND | AD715: 16
A716: OAKLEIGH | C716: 2 | D716: 1 | E716: =C716*6+D716 -> 13 | G716: 2 | H716: 2 | I716: =G716*6+H716 -> 14 | K716: 4 | L716: 7 | M716: =K716*6+L716 -> 31 | O716: 7 | P716: 9 | Q716: =O716*6+P716 -> 51 | S716: HUGGINS
A717: BEST PLAYERS | W717: TEAM | X717: W | Y717: L | Z717: D | AA717: FOR | AB717: AGST | AC717: % | AD717: PTS
A718: GEELONG WEST | C718: HARRIS | F718: IRVIN | I718: ARKLAY | L718: VAN ELDEN | O718: DUNNE | Q718: BRIGHT
A719: OAKLEIGH | C719: J LILLEY | F719: P LILLEY | I719: TESERIERO | L719: C NESBIT | O719: CLOKE | Q719: MURNANE | W719: PORT MELBOURNE | X719: 12 | Y719: 4 | Z719: 0 | AA719: 1806 | AB719: 1370 | AC719: 131.82 | AD719: 48
A720: GOALKICKERS | W720: DANDENONG | X720: 11 | Y720: 5 | Z720: 0 | AA720: 1750 | AB720: 1334 | AC720: 131.18 | AD720: 44
A721: GEELONG WEST | C721: MADDEN 3 | F721: VAN ELDEN 3 | I721: IRVIN 2 | K721: HARRIS | M721: ARKLAY | O721: YATES | Q721: WOOD | R721: MANSON | W721: GEELONG WEST | X721: 11 | Y721: 5 | Z721: 0 | AA721: 1671 | AB721: 1372 | AC721: 121.79 | AD721: 44
A722: OAKLEIGH | C722: QUINN 2 | F722: TESERIERO 2 | I722: MURNANE | K722: WENN | M722: CLOKE | W722: OAKLEIGH | X722: 10 | Y722: 6 | Z722: 0 | AA722: 1729 | AB722: 1587 | AC722: 108.95 | AD722: 40
A724: PORT MELBOURNE | C724: 5 | D724: 6 | E724: =C724*6+D724 -> 36 | G724: 16 | H724: 13 | I724: =G724*6+H724 -> 109 | K724: 21 | L724: 18 | M724: =K724*6+L724 -> 144 | O724: 27 | P724: 22 | Q724: =O724*6+P724 -> 184 | S724: PORT MELBOURNE | W724: PRAHRAN | X724: 10 | Y724: 6 | Z724: 0 | AA724: 1617 | AB724: 1498 | AC724: 107.94392523364486 | AD724: 40
A725: PRESTON | C725: 4 | D725: 1 | E725: =C725*6+D725 -> 25 | G725: 7 | H725: 3 | I725: =G725*6+H725 -> 45 | K725: 10 | L725: 3 | M725: =K725*6+L725 -> 63 | O725: 10 | P725: 8 | Q725: =O725*6+P725 -> 68 | S725: WENN | W725: PRESTON | X725: 8 | Y725: 8 | Z725: 0 | AA725: 1481 | AB725: 1596 | AC725: 92.794486215538853 | AD725: 32
A726: BEST PLAYERS | W726: WILLIAMSTOWN | X726: 7 | Y726: 9 | Z726: 0 | AA726: 1415 | AB726: 1698 | AC726: 83.333333333333329 | AD726: 28
A727: PORT MELBOURNE | C727: BUCKLEY | F727: ANDERSON | I727: HOLT | L727: COOK | N727: OWEN | Q727: HERROD | W727: SANDRINGHAM | X727: 5 | Y727: 11 | Z727: 0 | AA727: 1342 | AB727: 1702 | AC727: 78.848413631022325 | AD727: 20
A728: PRESTON | C728: MARSHALL | F728: INGLES | I728: WILSON | L728: COBAIN | N728: NALDER | Q728: ZUNNEBERG | W728: CAULFIELD | X728: 3 | Y728: 13 | Z728: 0 | AA728: 1489 | AB728: 1802 | AC728: 82.630410654827969 | AD728: 12
A729: GOALKICKERS | N729: ERWIN | P729: LOCKHART | S729: BECKWITH | W729: SUNSHINE | X729: 3 | Y729: 13 | Z729: 0 | AA729: 1404 | AB729: 1745 | AC729: 80.46 | AD729: 12
A730: PORT MELBOURNE | C730: COOK 7 | E730: ANDERSON 6 | H730: HOLT 3 | J730: GOSS 2 | L730: HARLAND 2 | N730: ELLIOTT 2 | Q730: BEHAN | S730: BUCKLEY
A731: PRESTON | C731: MARSHALL 2 | F731: WEIGHTMAN 2 | I731: STEWART 2 | L731: JINKS 2 | N731: WILSON | P731: ZUNNEBERG
A733: WILLIAMSTOWN | C733: 2 | D733: 8 | E733: =C733*6+D733 -> 20 | G733: 4 | H733: 11 | I733: =G733*6+H733 -> 35 | K733: 10 | L733: 19 | M733: =K733*6+L733 -> 79 | O733: 13 | P733: 22 | Q733: =O733*6+P733 -> 100 | S733: WILLIAMSTOWN
A734: CAULFIELD | C734: 1 | D734: 1 | E734: =C734*6+D734 -> 7 | G734: 3 | H734: 7 | I734: =G734*6+H734 -> 25 | K734: 5 | L734: 9 | M734: =K734*6+L734 -> 39 | O734: 11 | P734: 12 | Q734: =O734*6+P734 -> 78 | S734: DAVIES
A735: BEST PLAYERS
A736: WILLIAMSTOWN | C736: SINNOTT | F736: RADZIMINSKI | I736: FANNING | L736: N STILLMAN | O736: FENTON | Q736: THOMPSON
A737: CAULFIELD | C737: CLIFF | F737: GLAZNER | I737: TEMPEST | L737: PERRY | O737: BAKER | Q737: HUNTER
A738: GOALKICKERS
A739: WILLIAMSTOWN | C739: BOXALL 4 | F739: N STILLMAN 2 | J739: ROACH 2 | L739: L STILLMAN 2 | O739: GARDNER | Q739: PERCY | S739: TWEEDLY
A740: CAULFIELD | C740: CLIFF 5 | F740: JEWELL 3 | I740: BOOTH 2 | K740: LOGAN
A742: PRAHRAN | C742: 5 | D742: 3 | E742: =C742*6+D742 -> 33 | G742: 10 | H742: 5 | I742: =G742*6+H742 -> 65 | K742: 14 | L742: 11 | M742: =K742*6+L742 -> 95 | O742: 17 | P742: 12 | Q742: =O742*6+P742 -> 114 | S742: TOORAK PARK
A743: SANDRINGHAM | C743: 2 | D743: 2 | E743: =C743*6+D743 -> 14 | G743: 4 | H743: 6 | I743: =G743*6+H743 -> 30 | K743: 10 | L743: 9 | M743: =K743*6+L743 -> 69 | O743: 13 | P743: 13 | Q743: =O743*6+P743 -> 91 | S743: HAYES
A744: BEST PLAYERS
A745: PRAHRAN | C745: ANDERSON | F745: PAYNE | I745: GUNN | L745: CHAPMAN | O745: RIPPON | R745: K SMITH
A746: SANDRINGHAM | C746: R MURRAY | F746: LYONS | I746: TOMS | L746: HUNTER | O746: NICHOLSON | R746: KENNEDY
A747: GOALKICKERS
A748: PRAHRAN | C748: K SMITH 4 | F748: APPLETON 2 | I748: CHAPMAN 2 | L748: PAYNE 2 | N748: KENT 2 | P748: JOHNSTON | R748: ROLFE | T748: RIPPON | V748: ANDERSON | X748: TOWNSEND
A749: SANDRINGHAM | C749: COOPER 6 | F749: R MURRAY 3 | I749: LYONS 2 | K749: LIDDELL | M749: NICHOLSON
A751: DANDENONG | C751: 6 | D751: 5 | E751: =C751*6+D751 -> 41 | G751: 9 | H751: 12 | I751: =G751*6+H751 -> 66 | K751: 15 | L751: 20 | M751: =K751*6+L751 -> 110 | O751: 21 | P751: 26 | Q751: =O751*6+P751 -> 152 | S751: DANDENONG
A752: SUNSHINE | C752: 2 | D752: 1 | E752: =C752*6+D752 -> 13 | G752: 6 | H752: 3 | I752: =G752*6+H752 -> 39 | K752: 9 | L752: 6 | M752: =K752*6+L752 -> 60 | O752: 11 | P752: 7 | Q752: =O752*6+P752 -> 73 | S752: O'BRIEN
A753: BEST PLAYERS
A754: DANDENONG | C754: K SHINNERS | F754: B SHINNERS | I754: ANGUS | L754: MUIR | N754: ORCHARD | Q754: MILLER
A755: SUNSHINE | C755: WAGLAND | F755: WOODS | I755: BAIRD | L755: GOOLD | N755: MADDOX | Q755: PIERZAK
A756: GOALKICKERS
A757: DANDENONG | C757: MILLER 8 | F757: FLAHERTY 3 | I757: MADDEN 3 | L757: DA ROSE 3 | N757: HIBBERT | Q757: KENDALL | S757: K SHINNERS | W757: MUIR
A758: SUNSHINE | C758: LLOYD 3 | F758: GOOLD 2 | I758: FOREMAN | K758: BENSON | M758: PIERZAK | O758: VELLA | Q758: McFETRIDGE | T758: SLADDIN
A760: ROUND 17 | E760: 18TH AUGUST | J760: WEATHER | N760: NORTH WIND | S760: PLAYED AT
D761: 1ST QTR | H761: 2ND QTR | L761: 3RD QTR | P761: FINAL | S761: DANDENONG
A762: DANDENONG | C762: 6 | D762: 4 | E762: =C762*6+D762 -> 40 | G762: 8 | H762: 5 | I762: =G762*6+H762 -> 53 | K762: 16 | L762: 11 | M762: =K762*6+L762 -> 107 | O762: 17 | P762: 12 | Q762: =O762*6+P762 -> 114 | S762: UMPIRE | X762: LADDER | AB762: ROUND | AD762: 17
A763: PORT MELBOURNE | C763: 1 | D763: 0 | E763: =C763*6+D763 -> 6 | G763: 4 | H763: 4 | I763: =G763*6+H763 -> 28 | K763: 4 | L763: 4 | M763: =K763*6+L763 -> 28 | O763: 9 | P763: 11 | Q763: =O763*6+P763 -> 65 | S763: HAYES
A764: BEST PLAYERS | W764: TEAM | X764: W | Y764: L | Z764: D | AA764: FOR | AB764: AGST | AC764: % | AD764: PTS
A765: DANDENONG | C765: REID | F765: BECK | I765: HIBBERT | L765: HENRIKSEN | O765: ANGUS | Q765: MUIR
A766: PORT MELBOURNE | C766: OWEN | F766: BECKWITH | I766: BROWN | L766: CRITCH | O766: GOSS | Q766: HOLT | W766: DANDENONG | X766: 12 | Y766: 5 | Z766: 0 | AA766: 1864 | AB766: 1399 | AC766: 133.24 | AD766: 48
A767: GOALKICKERS | W767: PORT MELBOURNE | X767: 12 | Y767: 5 | Z767: 0 | AA767: 1871 | AB767: 1484 | AC767: 126.08 | AD767: 48
A768: DANDENONG | C768: MILLER 4 | E768: MADDEN 4 | H768: FLAHERTY 3 | K768: HIBBERT 2 | N768: MUIR 2 | P768: ORCHARD | R768: K SHINNERS | W768: GEELONG WEST | X768: 12 | Y768: 5 | Z768: 0 | AA768: 1787 | AB768: 1452 | AC768: 123.07 | AD768: 48
A769: PORT MELBOURNE | C769: COOK 3 | F769: HOLT 2 | H769: GOSS | J769: HARLAND | M769: HUGHES | O769: BECKWITH | W769: OAKLEIGH | X769: 11 | Y769: 6 | Z769: 0 | AA769: 1845 | AB769: 1652 | AC769: 111.68 | AD769: 44
A771: OAKLEIGH | C771: 2 | D771: 3 | E771: =C771*6+D771 -> 15 | G771: 5 | H771: 6 | I771: =G771*6+H771 -> 36 | K771: 9 | L771: 7 | M771: =K771*6+L771 -> 61 | O771: 18 | P771: 8 | Q771: =O771*6+P771 -> 116 | S771: OAKLEIGH | W771: PRAHRAN | X771: 11 | Y771: 6 | Z771: 0 | AA771: 1737 | AB771: 1590 | AC771: 109.24528301886792 | AD771: 44
A772: PRESTON | C772: 2 | D772: 2 | E772: =C772*6+D772 -> 14 | G772: 4 | H772: 6 | I772: =G772*6+H772 -> 30 | K772: 7 | L772: 12 | M772: =K772*6+L772 -> 54 | O772: 8 | P772: 17 | Q772: =O772*6+P772 -> 65 | S772: ABBOTT | W772: PRESTON | X772: 8 | Y772: 9 | Z772: 0 | AA772: 1546 | AB772: 1712 | AC772: 90.303738317757009 | AD772: 32
A773: BEST PLAYERS | W773: WILLIAMSTOWN | X773: 8 | Y773: 9 | Z773: 0 | AA773: 1498 | AB773: 1770 | AC773: 84.632768361581924 | AD773: 32
A774: OAKLEIGH | C774: G SMITH | F774: TESERIERO | I774: GAUNT | L774: J LILLEY | O774: FORD | Q774: CLOKE | W774: SANDRINGHAM | X774: 5 | Y774: 12 | Z774: 0 | AA774: 1414 | AB774: 1785 | AC774: 79.215686274509807 | AD774: 20
A775: PRESTON | C775: ZUNNEBERG | F775: WEIGHTMAN | I775: MARSHALL | L775: INGLES | O775: COBAIN | Q775: STEPHENS | W775: CAULFIELD | X775: 3 | Y775: 14 | Z775: 0 | AA775: 1581 | AB775: 1922 | AC775: 82.258064516129039 | AD775: 12
A776: GOALKICKERS | W776: SUNSHINE | X776: 3 | Y776: 14 | Z776: 0 | AA776: 1484 | AB776: 1861 | AC776: 79.74 | AD776: 12
A777: OAKLEIGH | C777: MURNANE 5 | F777: CLOKE 5 | H777: TESERIERO 3 | K777: RITTERMAN | N777: FORD | P777: J LILLEY | R777: GAUNT | T777: BILLING
A778: PRESTON | C778: COBAIN 5 | F778: INGLIS | H778: WEIGHTMAN | K778: MARTIN
A780: WILLIAMSTOWN | C780: 5 | D780: 5 | E780: =C780*6+D780 -> 35 | G780: 6 | H780: 6 | I780: =G780*6+H780 -> 42 | K780: 10 | L780: 10 | M780: =K780*6+L780 -> 70 | O780: 12 | P780: 11 | Q780: =O780*6+P780 -> 83 | S780: BEACH ROAD
A781: SANDRINGHAM | C781: 0 | D781: 1 | E781: =C781*6+D781 -> 1 | G781: 2 | H781: 6 | I781: =G781*6+H781 -> 18 | K781: 5 | L781: 6 | M781: =K781*6+L781 -> 36 | O781: 10 | P781: 12 | Q781: =O781*6+P781 -> 72 | S781: O'BRIEN
A782: BEST PLAYERS
A783: WILLIAMSTOWN | C783: RADZIMINSKY | F783: L STILLMAN | I783: HANNEBURY | L783: TOWNSEND | O783: THOMPSON | R783: N STILLMAN
A784: SANDRINGHAM | C784: JACOBSEN | F784: KENNEDY | I784: R MURRAY | L784: MARSHALL | O784: MURLEY | R784: CORNER
A785: GOALKICKERS
A786: WILLIAMSTOWN | C786: TOWNSEND 6 | F786: BOXALL 2 | I786: AUGHTON | K786: RADZIMINSKI | N786: JACKMAN | Q786: PERCY
A787: SANDRINGHAM | C787: R MURRAY 3 | F787: LIDDELL 2 | I787: COOPER | K787: WARD | M787: CORNER | O787: MURLEY | Q787: MAYNE
A789: PRAHRAN | C789: 4 | D789: 9 | E789: =C789*6+D789 -> 33 | G789: 6 | H789: 11 | I789: =G789*6+H789 -> 47 | K789: 11 | L789: 17 | M789: =K789*6+L789 -> 83 | O789: 17 | P789: 18 | Q789: =O789*6+P789 -> 120 | S789: PRINCES PARK
A790: CAULFIELD | C790: 2 | D790: 2 | E790: =C790*6+D790 -> 14 | G790: 8 | H790: 4 | I790: =G790*6+H790 -> 52 | K790: 9 | L790: 7 | M790: =K790*6+L790 -> 61 | O790: 14 | P790: 8 | Q790: =O790*6+P790 -> 92 | S790: HUGGINS
A791: BEST PLAYERS
A792: PRAHRAN | C792: ANDERSON | F792: PAYNE | I792: CHAPMAN | L792: APPLETON | O792: TOWNSEND | R792: LYNCH
A793: CAULFIELD | C793: WHITE | F793: TEMPEST | I793: RENOWDEN | L793: GLAZNER | O793: EINSEDEL | R793: LEGH
A794: GOALKICKERS
A795: PRAHRAN | C795: TOWNSEND 3 | F795: APPLETON 3 | I795: CHAPMAN 3 | L795: K SMITH 2 | N795: KENT 2 | P795: G SMITH | R795: GRANGE | U795: CULPIN | W795: PAYNE
A796: CAULFIELD | C796: WHITE 6 | F796: EINSEDEL 2 | I796: JEWELL 2 | L796: BROWN | N796: BAKER | P796: TEMPEST | R796: HUNTER
A798: GEELONG WEST | C798: 5 | D798: 5 | E798: =C798*6+D798 -> 35 | G798: 10 | H798: 9 | I798: =G798*6+H798 -> 69 | K798: 11 | L798: 15 | M798: =K798*6+L798 -> 81 | O798: 16 | P798: 20 | Q798: =O798*6+P798 -> 116 | S798: SUNSHINE
A799: SUNSHINE | C799: 3 | D799: 2 | E799: =C799*6+D799 -> 20 | G799: 5 | H799: 3 | I799: =G799*6+H799 -> 33 | K799: 8 | L799: 4 | M799: =K799*6+L799 -> 52 | O799: 12 | P799: 8 | Q799: =O799*6+P799 -> 80 | S799: WENN
A800: BEST PLAYERS
A801: GEELONG WEST | C801: VAN ELDEN | F801: GILMORE | I801: HARRIS | L801: STEPHENS | O801: SMITH | R801: IRVIN
A802: SUNSHINE | C802: WOODS | F802: LLOYD | I802: FOREMAN | L802: PIERZAK | O802: ALLEN | R802: POTTER
A803: GOALKICKERS
A804: GEELONG WEST | C804: MADDEN 4 | F804: STEPHENS 2 | I804: ARKLAY 2 | K804: IRVIN 2 | M804: HARRIS 2 | O804: WOOD | Q804: KLINE | S804: TAYLOR | V804: VAN ELDEN
A805: SUNSHINE | C805: RUSSELL 3 | F805: LLOYD 3 | I805: ALLEN 2 | K805: BAIRD | M805: SLADDIN | O805: THOMPSON | R805: PIERZAK
A807: ROUND 18 | E807: 25TH AUGUST | J807: WEATHER | N807: SOUTH BREEZE FINE | S807: PLAYED AT
D808: 1ST QTR | H808: 2ND QTR | L808: 3RD QTR | P808: FINAL | S808: GEELONG WEST
A809: GEELONG WEST | C809: 3 | D809: 2 | E809: =C809*6+D809 -> 20 | G809: 7 | H809: 5 | I809: =G809*6+H809 -> 47 | K809: 10 | L809: 7 | M809: =K809*6+L809 -> 67 | O809: 15 | P809: 10 | Q809: =O809*6+P809 -> 100 | S809: UMPIRE | X809: LADDER | AB809: ROUND | AD809: 18
A810: DANDENONG | C810: 2 | D810: 1 | E810: =C810*6+D810 -> 13 | G810: 6 | H810: 3 | I810: =G810*6+H810 -> 39 | K810: 8 | L810: 5 | M810: =K810*6+L810 -> 53 | O810: 9 | P810: 6 | Q810: =O810*6+P810 -> 60 | S810: O'BRIEN
A811: BEST PLAYERS | W811: TEAM | X811: W | Y811: L | Z811: D | AA811: FOR | AB811: AGST | AC811: % | AD811: PTS
A812: GEELONG WEST | C812: MANSON | F812: DUNNE | I812: BARRY | L812: SMITH | O812: GILMORE | R812: BRIGHT
A813: DANDENONG | C813: HARRINGTON | F813: REID | I813: FLAHERTY | L813: K SHINNERS | O813: ANGUS | R813: HENRIKSEN | W813: PORT MELBOURNE | X813: 13 | Y813: 5 | Z813: 0 | AA813: 2028 | AB813: 1602 | AC813: 126.59 | AD813: 52
A814: GOALKICKERS | W814: GEELONG WEST | X814: 13 | Y814: 5 | Z814: 0 | AA814: 1887 | AB814: 1512 | AC814: 124.8 | AD814: 52
A815: GEELONG WEST | C815: K MADDEN 6 | F815: IRVIN 3 | I815: HARRIS 2 | K815: MANSON | M815: STEPHENS | O815: WARREN | Q815: VAN ELDEN | W815: DANDENONG | X815: 12 | Y815: 6 | Z815: 0 | AA815: 1924 | AB815: 1499 | AC815: 128.35 | AD815: 48
A816: DANDENONG | C816: G MADDEN 4 | F816: FLAHERTY 4 | I816: MILLER | W816: OAKLEIGH | X816: 11 | Y816: 7 | Z816: 0 | AA816: 1948 | AB816: 1761 | AC816: 110.62 | AD816: 44
A818: PORT MELBOURNE | C818: 4 | D818: 9 | E818: =C818*6+D818 -> 33 | G818: 8 | H818: 15 | I818: =G818*6+H818 -> 63 | K818: 19 | L818: 16 | M818: =K818*6+L818 -> 130 | O818: 23 | P818: 19 | Q818: =O818*6+P818 -> 157 | S818: PORT MELBOURNE | W818: PRAHRAN | X818: 11 | Y818: 7 | Z818: 0 | AA818: 1855 | AB818: 1747 | AC818: 106.18202633085289 | AD818: 44
A819: PRAHRAN | C819: 4 | D819: 2 | E819: =C819*6+D819 -> 26 | G819: 7 | H819: 6 | I819: =G819*6+H819 -> 48 | K819: 12 | L819: 8 | M819: =K819*6+L819 -> 80 | O819: 18 | P819: 10 | Q819: =O819*6+P819 -> 118 | S819: GAMBETTA | W819: PRESTON | X819: 9 | Y819: 9 | Z819: 0 | AA819: 1673 | AB819: 1793 | AC819: 93.30730619074177 | AD819: 36
A820: BEST PLAYERS | W820: WILLIAMSTOWN | X820: 9 | Y820: 9 | Z820: 0 | AA820: 1607 | AB820: 1873 | AC820: 85.798184730379077 | AD820: 36
A821: PORT MELBOURNE | C821: BUCKLEY | F821: HOLT | I821: ERWIN | K821: ANDERSON | N821: B BROWN | Q821: N BROWN | W821: SANDRINGHAM | X821: 5 | Y821: 13 | Z821: 0 | AA821: 1495 | AB821: 1912 | AC821: 78.190376569037653 | AD821: 20
A822: PRAHRAN | C822: WILLIAMS | F822: K SMITH | I822: GUNN | K822: CULPIN | N822: KENT | Q822: GRANGE | W822: CAULFIELD | X822: 4 | Y822: 14 | Z822: 0 | AA822: 1722 | AB822: 2010 | AC822: 85.671641791044777 | AD822: 16
A823: GOALKICKERS | W823: SUNSHINE | X823: 3 | Y823: 15 | Z823: 0 | AA823: 1572 | AB823: 2002 | AC823: 78.52 | AD823: 12
A824: PORT MELBOURNE | C824: COOK 5 | E824: ANDERSON 4 | H824: ELLIOTT 3 | J824: HOLT 3 | L824: ERWIN 3 | N824: BUCKLEY 2 | Q824: HARLAND
A825: PRAHRAN | C825: K SMITH 8 | F825: PAYNE 2 | H825: KENT 2 | J825: G SMITH | L825: CHAPMAN | N825: WILLIAMS | Q825: APPLETON | S825: CROWE | U825: CULPIN
A827: WILLIAMSTOWN | C827: 2 | D827: 9 | E827: =C827*6+D827 -> 21 | G827: 6 | H827: 12 | I827: =G827*6+H827 -> 48 | K827: 12 | L827: 14 | M827: =K827*6+L827 -> 86 | O827: 15 | P827: 19 | Q827: =O827*6+P827 -> 109 | S827: WILLIAMSTOWN
A828: OAKLEIGH | C828: 2 | D828: 5 | E828: =C828*6+D828 -> 17 | G828: 3 | H828: 11 | I828: =G828*6+H828 -> 29 | K828: 8 | L828: 15 | M828: =K828*6+L828 -> 63 | O828: 14 | P828: 19 | Q828: =O828*6+P828 -> 103 | S828: HUGGINS
A829: BEST PLAYERS
A830: WILLIAMSTOWN | C830: GILL | F830: RADZIMINSKI | I830: TOWNSEND | L830: L STILLMAN | O830: FANNING | R830: THOMPSON
A831: OAKLEIGH | C831: STEWART | F831: FORD | I831: RITTERMAN | L831: TESERIERO | O831: GAUNT | R831: CLOKE
A832: GOALKICKERS
A833: WILLIAMSTOWN | C833: TOWNSEND 5 | F833: GILL 4 | H833: RADZIMINSKI | K833: LANE | M833: N STILLMAN | P833: JACKMAN | R833: PERCY | T833: GARDNER
A834: OAKLEIGH | C834: MOORE 5 | F834: CLOKE 3 | H834: RITTERMAN 3 | K834: J LILLEY | M834: P LILLEY | P834: TESERIERO
A836: CAULFIELD | C836: 5 | D836: 6 | E836: =C836*6+D836 -> 36 | G836: 6 | H836: 12 | I836: =G836*6+H836 -> 48 | K836: 15 | L836: 20 | M836: =K836*6+L836 -> 110 | O836: 20 | P836: 21 | Q836: =O836*6+P836 -> 141 | S836: PRINCES PARK
A837: SUNSHINE | C837: 2 | D837: 2 | E837: =C837*6+D837 -> 14 | G837: 8 | H837: 4 | I837: =G837*6+H837 -> 52 | K837: 10 | L837: 5 | M837: =K837*6+L837 -> 65 | O837: 13 | P837: 10 | Q837: =O837*6+P837 -> 88 | S837: HAYES
A838: BEST PLAYERS
A839: CAULFIELD | C839: PERRY | F839: CLIFF | I839: WHITE | L839: TEMPEST | O839: RENOWDEN | R839: JEWELL
A840: SUNSHINE | C840: BAIRD | F840: BENSON | I840: LLOYD | L840: WOODS | O840: WAGLAND | R840: CLARK
A841: GOALKICKERS
A842: CAULFIELD | C842: WHITE 5 | F842: CLIFF 5 | I842: BROWN 5 | K842: HUNTER 3 | N842: BAKER | P842: PERRY
A843: SUNSHINE | C843: LLOYD 3 | F843: BAIRD 3 | I843: BENSON 2 | L843: SLADDIN | N843: FOREMAN | Q843: WAGLAND | S843: MADDOX | V843: McKENZIE
A845: PRESTON | C845: 4 | D845: 7 | E845: =C845*6+D845 -> 31 | G845: 9 | H845: 14 | I845: =G845*6+H845 -> 68 | K845: 12 | L845: 20 | M845: =K845*6+L845 -> 92 | O845: 17 | P845: 25 | Q845: =O845*6+P845 -> 127 | S845: PRESTON
A846: SANDRINGHAM | C846: 1 | D846: 4 | E846: =C846*6+D846 -> 10 | G846: 4 | H846: 7 | I846: =G846*6+H846 -> 31 | K846: 8 | L846: 13 | M846: =K846*6+L846 -> 61 | O846: 11 | P846: 15 | Q846: =O846*6+P846 -> 81 | S846: WENN
A847: BEST PLAYERS
A848: PRESTON | C848: ZUNNEBERG | F848: MARSHALL | I848: WILSON | L848: TALBOT | O848: LESLIE | R848: WEIGHTMAN
A849: SANDRINGHAM | C849: MARSHALL | F849: LYONS | I849: JACOBSEN | L849: CORNER | O849: HUNTER | R849: ANSELL
A850: GOALKICKERS
A851: PRESTON | C851: COBAIN 3 | F851: JOHNSTON 3 | I851: WEIGHTMAN 2 | L851: MIDDLETON 2 | O851: TALBOT 2 | Q851: INGLES 2 | S851: WATERS | V851: WILSON | X851: MARSHALL
A852: SANDRINGHAM | C852: LYONS 5 | F852: COOPER 2 | I852: R MURRAY | K852: SCHWARZMAN | N852: HUNTER | P852: ANSELL
A854: FINALS
A855: 1ST SEMI | E855: 1ST SEPTEMBER | J855: WEATHER | N855: SOUTH WIND
D856: 1ST QTR | H856: 2ND QTR | L856: 3RD QTR | P856: FINAL
A857: OAKLEIGH | C857: 3 | D857: 4 | E857: =C857*6+D857 -> 22 | G857: 9 | H857: 12 | I857: =G857*6+H857 -> 66 | K857: 11 | L857: 15 | M857: =K857*6+L857 -> 81 | O857: 13 | P857: 19 | Q857: =O857*6+P857 -> 97 | S857: JUNCTION OVAL
A858: DANDENONG | C858: 5 | D858: 3 | E858: =C858*6+D858 -> 33 | G858: 6 | H858: 7 | I858: =G858*6+H858 -> 43 | K858: 12 | L858: 12 | M858: =K858*6+L858 -> 84 | O858: 13 | P858: 18 | Q858: =O858*6+P858 -> 96 | S858: GAMBETTA
A859: BEST PLAYERS
A860: OAKLEIGH | C860: CLOKE | F860: RITTERMAN | I860: MURNANE | L860: J LILLEY | O860: MOORE | Q860: TESERIERO
A861: DANDENONG | C861: JONES | F861: HIBBERT | I861: FLAHERTY | L861: HARRINGTON | O861: BECK | Q861: MILLER
A862: GOALKICKERS
A863: OAKLEIGH | C863: CLOKE 4 | F863: RITTERMAN 2 | I863: MURNANE 2 | L863: MOORE 2 | N863: GAUNT | P863: P LILLEY | R863: TESERIERO
A864: DANDENONG | C864: MILLER 5 | F864: FLAHERTY 4 | I864: JONES 2 | K864: KENDALL 2
A866: 2ND SEMI | E866: 8TH SEPTEMBER | J866: WEATHER | N866: WEST WIND FINE
A867: PORT MELBOURNE | C867: 4 | D867: 4 | E867: =C867*6+D867 -> 28 | G867: 7 | H867: 7 | I867: =G867*6+H867 -> 49 | K867: 11 | L867: 8 | M867: =K867*6+L867 -> 74 | O867: 16 | P867: 14 | Q867: =O867*6+P867 -> 110 | S867: JUNCTION OVAL
A868: GEELONG WEST | C868: 1 | D868: 5 | E868: =C868*6+D868 -> 11 | G868: 8 | H868: 10 | I868: =G868*6+H868 -> 58 | K868: 11 | L868: 16 | M868: =K868*6+L868 -> 82 | O868: 11 | P868: 21 | Q868: =O868*6+P868 -> 87 | S868: HAYES
A869: BEST PLAYERS
A870: PORT MELBOURNE | C870: HARLAND | F870: ANDERSON | I870: BUCKLEY | L870: HERROD | N870: ERWIN | Q870: HOLT
A871: GEELONG WEST | C871: STEPHENS | F871: BRIGHT | I871: HARRIS | L871: GILMORE | N871: MADDEN | Q871: MANSON
A872: GOALKICKERS
A873: PORT MELBOURNE | C873: COOK 4 | F873: ANDERSON 3 | I873: BUCKLEY 3 | L873: HOLT 2 | N873: GOSS 2 | P873: BECKWITH 2
A874: GEELONG WEST | C874: MADDEN 5 | F874: MANSON 2 | I874: VAN ELDEN | L874: LINKE | N874: HARRIS | P874: WARREN
A876: PRELIMINARY FINAL | F876: 15TH SEPTEMBER | K876: WEATHER | N876: SOUTH WEST WIND SHOWERS
A877: OAKLEIGH | C877: 3 | D877: 1 | E877: =C877*6+D877 -> 19 | G877: 7 | H877: 8 | I877: =G877*6+H877 -> 50 | K877: 13 | L877: 12 | M877: =K877*6+L877 -> 90 | O877: 16 | P877: 16 | Q877: =O877*6+P877 -> 112 | S877: JUNCTION OVAL
A878: GEELONG WEST | C878: 1 | D878: 3 | E878: =C878*6+D878 -> 9 | G878: 4 | H878: 3 | I878: =G878*6+H878 -> 27 | K878: 9 | L878: 4 | M878: =K878*6+L878 -> 58 | O878: 13 | P878: 9 | Q878: =O878*6+P878 -> 87 | S878: HUGGINS
A879: BEST PLAYERS
A880: OAKLEIGH | C880: CLOKE | F880: FORD | I880: SMITH | L880: RITTERMAN | O880: MURNANE | R880: TESERIERO
A881: GEELONG WEST | C881: GILMORE | F881: VAN ELDEN | I881: IRVIN | L881: HARRIS | O881: BARRY | R881: MANSON
A882: GOALKICKERS
A883: OAKLEIGH | C883: MURNANE 5 | F883: MOORE 4 | I883: TESERIERO 2 | L883: CLOKE 2 | N883: SMITH 2 | Q883: GAUNT
A884: GEELONG WEST | C884: MANSON 3 | F884: MADDEN 2 | I884: LINKE 2 | K884: BARRY | M884: STOKES | O884: IRVIN | Q884: HALL | S884: RADOJEVIC | V884: GILMORE
A886: GRAND FINAL | E886: 22ND SEPTEMBER | J886: WEATHER | M886: SOUTH WEST WIND
A887: PORT MELBOURNE | C887: 5 | D887: 4 | E887: 34 | G887: 10 | H887: 10 | I887: 70 | K887: 17 | L887: 15 | M887: 117 | O887: 22 | P887: 20 | Q887: =O887*6+P887 -> 152 | S887: JUNCTION OVAL
A888: OAKLEIGH | C888: 3 | D888: 3 | E888: 21 | G888: 6 | H888: 7 | I888: 43 | K888: 8 | L888: 13 | M888: 61 | O888: 11 | P888: 17 | Q888: =O888*6+P888 -> 83 | S888: GAMBETTA
A889: BEST PLAYERS
A890: PORT MELBOURNE | C890: BUCKLEY | F890: GOSS | I890: ERWIN | L890: HARLAND | O890: COOK | Q890: HOLT
A891: OAKLEIGH | C891: CLOKE | F891: FORD | I891: J LILLEY | L891: RITTERMAN | O891: WENN | Q891: TESERIERO
A892: GOALKICKERS
A893: PORT MELBOURNE | C893: COOK 10 | F893: BROWN 4 | I893: HOLT 3 | K893: ANDERSON | N893: HARLAND | Q893: BUCKLEY | S893: BEHAN | U893: GOSS
A894: OAKLEIGH | C894: MOORE 4 | F894: CLOKE 3 | I894: RITTERMAN | L894: J LILLEY | N894: QUINN | P894: TESERIERO
A896: LIGHTNING PREMIERSHIP
A897: ROUND 1
A898: NORTHCOTE | C898: 3 | D898: 5 | E898: =C898*6+D898 -> 23 | G898: 5 | H898: 8 | I898: =G898*6+H898 -> 38
A899: YARRAVILLE | C899: 2 | D899: 0 | E899: =C899*6+D899 -> 12 | G899: 3 | H899: 2 | I899: =G899*6+H899 -> 20
A901: FRANKSTON | C901: 3 | D901: 1 | E901: =C901*6+D901 -> 19 | G901: 6 | H901: 2 | I901: =G901*6+H901 -> 38
A902: WERRIBEE | C902: 2 | D902: 3 | E902: =C902*6+D902 -> 15 | G902: 3 | H902: 5 | I902: =G902*6+H902 -> 23
A904: ROUND 2
A905: WILLIAMSTOWN | C905: 1 | D905: 4 | E905: =C905*6+D905 -> 10 | G905: 1 | H905: 7 | I905: =G905*6+H905 -> 13
A906: SUNSHINE | C906: 0 | D906: 2 | E906: =C906*6+D906 -> 2 | G906: 1 | H906: 2 | I906: =G906*6+H906 -> 8
A908: CAULFIELD | C908: 5 | D908: 2 | E908: =C908*6+D908 -> 32 | G908: 7 | H908: 2 | I908: =G908*6+H908 -> 44
A909: SANDRINGHAM | C909: 1 | D909: 2 | E909: =C909*6+D909 -> 8 | G909: 2 | H909: 2 | I909: =G909*6+H909 -> 14
A911: ROUND 3
A912: NORTHCOTE | C912: 4 | D912: 2 | E912: =C912*6+D912 -> 26 | G912: 7 | H912: 3 | I912: =G912*6+H912 -> 45
A913: FRANKSTON | C913: 2 | D913: 1 | E913: =C913*6+D913 -> 13 | G913: 4 | H913: 3 | I913: =G913*6+H913 -> 27
A915: WILLIAMSTOWN | C915: 3 | D915: 4 | E915: =C915*6+D915 -> 22 | G915: 6 | H915: 4 | I915: =G915*6+H915 -> 40
A916: CAULFIELD | C916: 2 | D916: 4 | E916: =C916*6+D916 -> 16 | G916: 3 | H916: 4 | I916: =G916*6+H916 -> 22
A918: SEMI FINALS
A919: PRAHRAN | C919: 4 | D919: 3 | E919: =C919*6+D919 -> 27 | G919: 7 | H919: 5 | I919: =G919*6+H919 -> 47
A920: NORTHCOTE | C920: 2 | D920: 1 | E920: =C920*6+D920 -> 13 | G920: 3 | H920: 2 | I920: =G920*6+H920 -> 20
A922: PRESTON | C922: 3 | D922: 2 | E922: =C922*6+D922 -> 20 | G922: 7 | H922: 3 | I922: =G922*6+H922 -> 45
A923: WILLIAMSTOWN | C923: 1 | D923: 0 | E923: =C923*6+D923 -> 6 | G923: 1 | H923: 3 | I923: =G923*6+H923 -> 9
A925: FINAL
A926: PRESTON | C926: 4 | D926: 1 | E926: =C926*6+D926 -> 25 | G926: 6 | H926: 2 | I926: =G926*6+H926 -> 38
A927: PRAHRAN | C927: 2 | D927: 1 | E927: =C927*6+D927 -> 13 | G927: 4 | H927: 3 | I927: =G927*6+H927 -> 27
A928: BEST PLAYERS
A929: PRESTON | C929: JOHNSTON | F929: INGLES | H929: ZUNNEBERG | K929: MORRIS
A930: PRAHRAN | C930: K SMITH | F930: G SMITH | H930: TOWNSEND | K930: WILLIAMS
A931: GOALKICKERS
A932: PRESTON | C932: JOHNSTON 2 | F932: COBAIN 2 | I932: WEIGHTMAN | L932: MARSHALL
A933: PRAHRAN | C933: K SMITH 2 | F933: G SMITH | I933: LINFORD