A1: Victorian Football Association
A2: Season 1974 - Division Two
A3: © Copyright Wal Williams | F3: First created: 28 March 2016
A4: Contact: joywalwi at gmail dot com | F4: Last updated: 28 March 2016 | W4: VFA Results and tables - Link to the main index page
A5: You are free to copy this document in whole or part provided that proper acknowledgement is given to the author. All rights reserved.
A7: 1974 | C7: V.F.A. SEASON 2ND DIVISION
A8: ROUND 1 | E8: 14TH APRIL | J8: WEATHER | S8: PLAYED AT
D9: 1ST QTR | H9: 2ND QTR | L9: 3RD QTR | P9: FINAL | S9: WAVERLEY
A10: WAVERLEY | C10: 3 | D10: 3 | E10: =C10*6+D10 -> 21 | G10: 11 | H10: 4 | I10: =G10*6+H10 -> 70 | K10: 15 | L10: 8 | M10: =K10*6+L10 -> 98 | O10: 23 | P10: 11 | Q10: =O10*6+P10 -> 149 | S10: UMPIRE | X10: LADDER | AB10: ROUND | AD10: 1
A11: CAMBERWELL | C11: 6 | D11: 7 | E11: =C11*6+D11 -> 43 | G11: 9 | H11: 8 | I11: =G11*6+H11 -> 62 | K11: 12 | L11: 14 | M11: =K11*6+L11 -> 86 | O11: 14 | P11: 14 | Q11: =O11*6+P11 -> 98 | S11: STIRLING
A12: BEST PLAYERS | W12: TEAM | X12: W | Y12: L | Z12: D | AA12: FOR | AB12: AGST | AC12: % | AD12: PTS
A13: WAVERLEY | C13: R ALLAN | F13: STONE | I13: HANCOCK | L13: HOCKING | O13: LARAGY | R13: OSBORNE
A14: CAMBERWELL | C14: STONE | F14: MOORE | I14: PATURZO | L14: SAUERBERG | W14: WAVERLEY | X14: 1 | Y14: 0 | Z14: 0 | AA14: 149 | AB14: 98 | AC14: =(AA14*100)/AB14 -> 152.0408163265306 | AD14: =(X14*4)+(Z14*2) -> 4
A15: GOALKICKERS | Q15: PARKS | S15: SMEDTS | W15: COBURG | X15: 1 | Y15: 0 | Z15: 0 | AA15: 122 | AB15: 92 | AC15: =(AA15*100)/AB15 -> 132.60869565217391 | AD15: =(X15*4)+(Z15*2) -> 4
A16: WAVERLEY | C16: ZIESLER 5 | E16: COSTELLO 5 | G16: R ALLAN 3 | J16: HANCOCK 3 | M16: HOLDSWORTH 2 | P16: HORKINGS | R16: DUTHIE | T16: HOCKING | W16: FRANKSTON | X16: 1 | Y16: 0 | Z16: 0 | AA16: 149 | AB16: 125 | AC16: =(AA16*100)/AB16 -> 119.2 | AD16: =(X16*4)+(Z16*2) -> 4
A17: CAMBERWELL | C17: MOORE 6 | F17: PATURZO 4 | I17: KENNEDY 3 | L17: HAMMOND | W17: BOX HILL | X17: 1 | Y17: 0 | Z17: 0 | AA17: 135 | AB17: 122 | AC17: =(AA17*100)/AB17 -> 110.65573770491804 | AD17: =(X17*4)+(Z17*2) -> 4
A19: FRANKSTON | C19: 7 | D19: 4 | E19: =C19*6+D19 -> 46 | G19: 11 | H19: 9 | I19: =G19*6+H19 -> 75 | K19: 17 | L19: 13 | M19: =K19*6+L19 -> 115 | O19: 22 | P19: 17 | Q19: =O19*6+P19 -> 149 | S19: FRANKSTON | W19: BRUNSWICK | X19: 1 | Y19: 0 | Z19: 0 | AA19: 95 | AB19: 89 | AC19: =(AA19*100)/AB19 -> 106.74157303370787 | AD19: =(X19*4)+(Z19*2) -> 4
A20: YARRAVILLE | C20: 7 | D20: 4 | E20: =C20*6+D20 -> 46 | G20: 8 | H20: 9 | I20: =G20*6+H20 -> 57 | K20: 15 | L20: 12 | M20: =K20*6+L20 -> 102 | O20: 18 | P20: 17 | Q20: =O20*6+P20 -> 125 | S20: GAMBETTA | W20: NORTHCOTE | X20: 0 | Y20: 1 | Z20: 0 | AA20: 89 | AB20: 95 | AC20: =(AA20*100)/AB20 -> 93.684210526315795 | AD20: =(X20*4)+(Z20*2) -> 0
A21: BEST PLAYERS | W21: MORDIALLOC | X21: 0 | Y21: 1 | Z21: 0 | AA21: 122 | AB21: 135 | AC21: =(AA21*100)/AB21 -> 90.370370370370367 | AD21: =(X21*4)+(Z21*2) -> 0
A22: FRANKSTON | C22: LEWIS | F22: CAFFYN | I22: BRIESE | L22: POPE | O22: THATCHER | R22: BEAMAN | W22: YARRAVILLE | X22: 0 | Y22: 1 | Z22: 0 | AA22: 125 | AB22: 149 | AC22: =(AA22*100)/AB22 -> 83.892617449664428 | AD22: =(X22*4)+(Z22*2) -> 0
A23: YARRAVILLE | C23: RYAN | F23: MARTIN | I23: CALAZ | L23: BARR | O23: McLAREN | R23: NORRIS | W23: WERRIBEE | X23: 0 | Y23: 1 | Z23: 0 | AA23: 92 | AB23: 122 | AC23: =(AA23*100)/AB23 -> 75.409836065573771 | AD23: =(X23*4)+(Z23*2) -> 0
A24: GOALKICKERS | M24: CLARKE | O24: EDWARDS | W24: CAMBERWELL | X24: 0 | Y24: 1 | Z24: 0 | AA24: 98 | AB24: 149 | AC24: =(AA24*100)/AB24 -> 65.771812080536918 | AD24: =(X24*4)+(Z24*2) -> 0
A25: FRANKSTON | C25: JUNGWIRTH 6 | F25: CAFFYN 4 | H25: FALKINER 4 | K25: BEAMAN 2 | N25: LOCCO 2 | P25: BRIESE | R25: TWOMEY
A26: YARRAVILLE | C26: CALAZ 4 | F26: MARTIN 4 | H26: McLAREN 3 | K26: SMITH 2 | M26: CURTIN 2 | O26: RYAN 2 | Q26: BARR
A28: BOX HILL | C28: 7 | D28: 5 | E28: =C28*6+D28 -> 47 | G28: 13 | H28: 5 | I28: =G28*6+H28 -> 83 | K28: 20 | L28: 6 | M28: =K28*6+L28 -> 126 | O28: 21 | P28: 9 | Q28: =O28*6+P28 -> 135 | S28: BOX HILL
A29: MORDIALLOC | C29: 4 | D29: 2 | E29: =C29*6+D29 -> 26 | G29: 9 | H29: 7 | I29: =G29*6+H29 -> 61 | K29: 12 | L29: 10 | M29: =K29*6+L29 -> 82 | O29: 18 | P29: 14 | Q29: =O29*6+P29 -> 122 | S29: TOOHEY
A30: BEST PLAYERS
A31: BOX HILL | C31: CURTIS | F31: BRYANT | I31: BAKER | L31: KING | N31: ZANTUCK | Q31: COUTTS
A32: MORDIALLOC | C32: RAEBURN | F32: JOHNSTONE | I32: LAUGHLIN | L32: GUY | N32: SMITH
A33: GOALKICKERS
A34: BOX HILL | C34: KING 4 | E34: ZANTUCK 4 | G34: HIGGINS 3 | I34: MAGILL 3 | K34: EDWARDS 2 | N34: BRYANT 2 | P34: BAKER 2 | R34: TIERNEY
A35: MORDIALLOC | C35: BASKIN 3 | E35: HARRY 3 | G35: McGUINNESSS 3 | J35: LAUGHLIN 2 | M35: LANG 2 | O35: SMITH | Q35: SCAIFFE | S35: THOMPSON | V35: McFARLAND | X35: PINNE
A37: BRUNSWICK | C37: 5 | D37: 4 | E37: =C37*6+D37 -> 34 | G37: 7 | H37: 9 | I37: =G37*6+H37 -> 51 | K37: 8 | L37: 13 | M37: =K37*6+L37 -> 61 | O37: 12 | P37: 23 | Q37: =O37*6+P37 -> 95 | S37: NORTHCOTE
A38: NORTHCOTE | C38: 2 | D38: 2 | E38: =C38*6+D38 -> 14 | G38: 8 | H38: 7 | I38: =G38*6+H38 -> 55 | K38: 9 | L38: 14 | M38: =K38*6+L38 -> 68 | O38: 12 | P38: 17 | Q38: =O38*6+P38 -> 89 | S38: STABB
A39: BEST PLAYERS
A40: BRUNSWICK | C40: ORTON | F40: GUEST | I40: HADZILLIAS | L40: DIMATTINA | O40: ANDERSON | R40: FORD
A41: NORTHCOTE | C41: GELLIE | F41: THORNELOE | I41: WATT | L41: BIENKE | O41: CAREY | R41: RYAN
A42: GOALKICKERS
A43: BRUNSWICK | C43: ORTON 5 | F43: BAIRD 3 | I43: DIMATTINA 2 | L43: HANTON | N43: SCHIMMELBUSCH
A44: NORTHCOTE | C44: BIENKE 4 | F44: RYAN 4 | I44: NANKERVIS | L44: McNEILL | N44: FLEMING | Q44: KILKENNY
A46: COBURG | C46: 6 | D46: 6 | E46: =C46*6+D46 -> 42 | G46: 10 | H46: 8 | I46: =G46*6+H46 -> 68 | K46: 13 | L46: 15 | M46: =K46*6+L46 -> 93 | O46: 17 | P46: 20 | Q46: =O46*6+P46 -> 122 | S46: COBURG
A47: WERRIBEE | C47: 2 | D47: 0 | E47: =C47*6+D47 -> 12 | G47: 6 | H47: 12 | I47: =G47*6+H47 -> 48 | K47: 9 | L47: 17 | M47: =K47*6+L47 -> 71 | O47: 12 | P47: 20 | Q47: =O47*6+P47 -> 92 | S47: HAYES
A48: BEST PLAYERS
A49: COBURG | C49: McGRATH | F49: BREEN | I49: HOBBS | L49: SMITH | O49: ARTHURSON | R49: BRENNAN
A50: WERRIBEE | C50: SHIELE | F50: PAICE | I50: ARRIGO | L50: NEWMAN | O50: BOURKE
A51: GOALKICKERS
A52: COBURG | C52: SMITH 5 | F52: MORRISON 3 | I52: BRENNAN 2 | L52: MANNIX 2 | N52: McGRATH 2 | Q52: LUKE 2 | S52: PITT
A53: WERRIBEE | C53: G SHIELE 4 | F53: PAICE 3 | H53: BOURKE 2 | J53: HAMBLIN | M53: ARRIGO | O53: MONTGOMERY
A55: ROUND 2 | E55: 21ST APRIL | J55: WEATHER | S55: PLAYED AT
D56: 1ST QTR | H56: 2ND QTR | L56: 3RD QTR | P56: FINAL | S56: MORDIALLOC
A57: MORDIALLOC | C57: 3 | D57: 4 | E57: =C57*6+D57 -> 22 | G57: 9 | H57: 7 | I57: =G57*6+H57 -> 61 | K57: 17 | L57: 10 | M57: =K57*6+L57 -> 112 | O57: 24 | P57: 12 | Q57: =O57*6+P57 -> 156 | S57: UMPIRE | X57: LADDER | AB57: ROUND | AD57: 2
A58: FRANKSTON | C58: 3 | D58: 3 | E58: =C58*6+D58 -> 21 | G58: 6 | H58: 10 | I58: =G58*6+H58 -> 46 | K58: 8 | L58: 13 | M58: =K58*6+L58 -> 61 | O58: 12 | P58: 14 | Q58: =O58*6+P58 -> 86 | S58: O'BRIEN
A59: BEST PLAYERS | W59: TEAM | X59: W | Y59: L | Z59: D | AA59: FOR | AB59: AGST | AC59: % | AD59: PTS
A60: MORDIALLOC | C60: BESANKO | F60: RAEBURN | I60: LANG | L60: McFARLAND | O60: JOHNSTONE | R60: WOOTTEN
A61: FRANKSTON | C61: FALKINER | F61: STAPLETON | I61: CAFFYN | L61: LOCCO | O61: BRIESE | R61: FITZGERALD | W61: WAVERLEY | X61: 2 | Y61: 0 | Z61: 0 | AA61: 238 | AB61: 160 | AC61: =(AA61*100)/AB61 -> 148.75 | AD61: =(X61*4)+(Z61*2) -> 8
A62: GOALKICKERS | W62: COBURG | X62: 2 | Y62: 0 | Z62: 0 | AA62: 233 | AB62: 168 | AC62: =(AA62*100)/AB62 -> 138.6904761904762 | AD62: =(X62*4)+(Z62*2) -> 8
A63: MORDIALLOC | C63: BASKIN 8 | F63: HARRY 5 | H63: WOOTTEN 4 | K63: BASTIAN 3 | N63: GUY 2 | P63: LAUGHLIN | R63: JOHNSTONE | W63: BRUNSWICK | X63: 2 | Y63: 0 | Z63: 0 | AA63: 193 | AB63: 163 | AC63: =(AA63*100)/AB63 -> 118.40490797546012 | AD63: =(X63*4)+(Z63*2) -> 8
A64: FRANKSTON | C64: CAFFYN 4 | F64: LOCCO 3 | I64: BRIESE 3 | K64: TWOMEY | M64: CLARK | W64: MORDIALLOC | X64: 1 | Y64: 1 | Z64: 0 | AA64: 278 | AB64: 221 | AC64: =(AA64*100)/AB64 -> 125.7918552036199 | AD64: =(X64*4)+(Z64*2) -> 4
A66: WAVERLEY | C66: 3 | D66: 7 | E66: =C66*6+D66 -> 25 | G66: 7 | H66: 12 | I66: =G66*6+H66 -> 54 | K66: 9 | L66: 14 | M66: =K66*6+L66 -> 68 | O66: 12 | P66: 17 | Q66: =O66*6+P66 -> 89 | S66: BOX HILL | W66: WERRIBEE | X66: 1 | Y66: 1 | Z66: 0 | AA66: 195 | AB66: 201 | AC66: =(AA66*100)/AB66 -> 97.014925373134332 | AD66: =(X66*4)+(Z66*2) -> 4
A67: YARRAVILLE | C67: 1 | D67: 4 | E67: =C67*6+D67 -> 10 | G67: 3 | H67: 5 | I67: =G67*6+H67 -> 23 | K67: 7 | L67: 6 | M67: =K67*6+L67 -> 48 | O67: 9 | P67: 8 | Q67: =O67*6+P67 -> 62 | S67: MARKS | W67: BOX HILL | X67: 1 | Y67: 1 | Z67: 0 | AA67: 209 | AB67: 220 | AC67: =(AA67*100)/AB67 -> 95 | AD67: =(X67*4)+(Z67*2) -> 4
A68: BEST PLAYERS | W68: FRANKSTON | X68: 1 | Y68: 1 | Z68: 0 | AA68: 235 | AB68: 281 | AC68: =(AA68*100)/AB68 -> 83.629893238434164 | AD68: =(X68*4)+(Z68*2) -> 4
A69: WAVERLEY | C69: HANCOCK | F69: PARKS | I69: R ALLAN | L69: B ALLAN | O69: ZIESLER | R69: COSTELLO | W69: NORTHCOTE | X69: 0 | Y69: 2 | Z69: 0 | AA69: 168 | AB69: 198 | AC69: =(AA69*100)/AB69 -> 84.848484848484844 | AD69: =(X69*4)+(Z69*2) -> 0
A70: YARRAVILLE | C70: SQUIRE | F70: SMITH | I70: McLAREN | L70: GREENEY | O70: LOWE | R70: WHITTINGTON | W70: YARRAVILLE | X70: 0 | Y70: 2 | Z70: 0 | AA70: 187 | AB70: 238 | AC70: =(AA70*100)/AB70 -> 78.571428571428569 | AD70: =(X70*4)+(Z70*2) -> 0
A71: GOALKICKERS | W71: CAMBERWELL | X71: 0 | Y71: 2 | Z71: 0 | AA71: 174 | AB71: 260 | AC71: =(AA71*100)/AB71 -> 66.92307692307692 | AD71: =(X71*4)+(Z71*2) -> 0
A72: WAVERLEY | C72: ZIESLER 3 | F72: COSTELLO 3 | I72: HANCOCK 2 | L72: PARKS 2 | N72: R ALLAN | Q72: DUTHIE
A73: YARRAVILLE | C73: SHIELDS 3 | F73: McLAREN 2 | I73: MARTIN 2 | L73: HOWDEN | N73: BARR
A75: COBURG | C75: 2 | D75: 9 | E75: =C75*6+D75 -> 21 | G75: 5 | H75: 15 | I75: =G75*6+H75 -> 45 | K75: 11 | L75: 17 | M75: =K75*6+L75 -> 83 | O75: 15 | P75: 21 | Q75: =O75*6+P75 -> 111 | S75: CAMBERWELL
A76: CAMBERWELL | C76: 5 | D76: 1 | E76: =C76*6+D76 -> 31 | G76: 8 | H76: 2 | I76: =G76*6+H76 -> 50 | K76: 11 | L76: 4 | M76: =K76*6+L76 -> 70 | O76: 12 | P76: 4 | Q76: =O76*6+P76 -> 76 | S76: STABB
A77: BEST PLAYERS
A78: COBURG | C78: LAKE | F78: McGRATH | I78: ARTHURSON | L78: ELVERY | O78: PAUL
A79: CAMBERWELL | C79: KENNEDY | F79: PATURZO | I79: SIMPSON | L79: STONE | O79: ROUTLEDGE
A80: GOALKICKERS
A81: COBURG | C81: McGRATH 5 | F81: LAKE 3 | H81: MORRISON 3 | K81: LUKE 2 | M81: SMITH 2
A82: CAMBERWELL | C82: KENNEDY 3 | F82: PATURZO 3 | I82: ROWLAND 2 | L82: SIMPSON | N82: MOORE | P82: SAUERBERG | S82: HAMMOND
A84: WERRIBEE | C84: 5 | D84: 2 | E84: =C84*6+D84 -> 32 | G84: 7 | H84: 8 | I84: =G84*6+H84 -> 50 | K84: 11 | L84: 14 | M84: =K84*6+L84 -> 80 | O84: 14 | P84: 19 | Q84: =O84*6+P84 -> 103 | S84: WERRIBEE
A85: NORTHCOTE | C85: 0 | D85: 9 | E85: =C85*6+D85 -> 9 | G85: 4 | H85: 12 | I85: =G85*6+H85 -> 36 | K85: 8 | L85: 16 | M85: =K85*6+L85 -> 64 | O85: 10 | P85: 19 | Q85: =O85*6+P85 -> 79 | S85: TORNEY
A86: BEST PLAYERS
A87: WERRIBEE | C87: McLEOD | F87: BOURKE | I87: JOHNSTONE | L87: NEWMAN | O87: HARVEY | R87: HOOPER
A88: NORTHCOTE | C88: McARDLE | F88: BIENKE | I88: LEECH | L88: GELLIE | O88: KOZARIS
A89: GOALKICKERS
A90: WERRIBEE | C90: McLEOD 7 | F90: BOURKE 3 | I90: ARRIGO 2 | L90: MITCHELL | N90: DOUGLAS
A91: NORTHCOTE | C91: HOUGH 4 | F91: BIENKE 3 | I91: RYAN 2 | L91: McARDLE
A93: BRUNSWICK | C93: 1 | D93: 3 | E93: =C93*6+D93 -> 9 | G93: 6 | H93: 5 | I93: =G93*6+H93 -> 41 | K93: 12 | L93: 10 | M93: =K93*6+L93 -> 82 | O93: 14 | P93: 14 | Q93: =O93*6+P93 -> 98 | S93: BRUNSWICK
A94: BOX HILL | C94: 1 | D94: 4 | E94: =C94*6+D94 -> 10 | G94: 2 | H94: 6 | I94: =G94*6+H94 -> 18 | K94: 4 | L94: 11 | M94: =K94*6+L94 -> 35 | O94: 10 | P94: 14 | Q94: =O94*6+P94 -> 74 | S94: DAVIS
A95: BEST PLAYERS
A96: BRUNSWICK | C96: DENMEAD | F96: GUEST | I96: HADZILLIAS | L96: FORD | O96: WROUT | R96: BURROWS
A97: BOX HILL | C97: COUTTS | F97: BAKER | I97: ROBSON | L97: LAETHER | O97: McFARLANE | R97: WALTER
A98: GOALKICKERS
A99: BRUNSWICK | C99: ORTON 4 | F99: HANTON 3 | I99: BAIRD 2 | K99: O'CONNOR 2 | N99: ALLAN | P99: DIMATTINA | S99: ANDERSON
A100: BOX HILL | C100: MAGILL 3 | F100: COUTTS 2 | I100: KING 2 | K100: CURTIS | M100: MCFARLANE | P100: LASKIE
A102: ROUND 3 | E102: 23RD APRIL | J102: WEATHER | S102: PLAYED AT
D103: 1ST QTR | H103: 2ND QTR | L103: 3RD QTR | P103: FINAL | S103: WERRIBEE
A104: CAMBERWELL | C104: 0 | D104: 0 | E104: =C104*6+D104 -> 0 | G104: 0 | H104: 0 | I104: =G104*6+H104 -> 0 | K104: 0 | L104: 0 | M104: =K104*6+L104 -> 0 | O104: 13 | P104: 11 | Q104: =O104*6+P104 -> 89 | S104: UMPIRE | X104: LADDER | AB104: ROUND | AD104: 3
A105: WERRIBEE | C105: 0 | D105: 0 | E105: =C105*6+D105 -> 0 | G105: 0 | H105: 0 | I105: =G105*6+H105 -> 0 | K105: 0 | L105: 0 | M105: =K105*6+L105 -> 0 | O105: 12 | P105: 16 | Q105: =O105*6+P105 -> 88
A106: BEST PLAYERS | W106: TEAM | X106: W | Y106: L | Z106: D | AA106: FOR | AB106: AGST | AC106: % | AD106: PTS
A107: CAMBERWELL
A108: WERRIBEE | W108: COBURG | X108: 3 | Y108: 0 | Z108: 0 | AA108: 462 | AB108: 271 | AC108: =(AA108*100)/AB108 -> 170.47970479704796 | AD108: =(X108*4)+(Z108*2) -> 12
A109: GOALKICKERS | W109: WAVERLEY | X109: 3 | Y109: 0 | Z109: 0 | AA109: 349 | AB109: 229 | AC109: =(AA109*100)/AB109 -> 152.40174672489084 | AD109: =(X109*4)+(Z109*2) -> 12
A110: CAMBERWELL | W110: BRUNSWICK | X110: 3 | Y110: 0 | Z110: 0 | AA110: 345 | AB110: 245 | AC110: =(AA110*100)/AB110 -> 140.81632653061226 | AD110: =(X110*4)+(Z110*2) -> 12
A111: WERRIBEE | W111: MORDIALLOC | X111: 1 | Y111: 2 | Z111: 0 | AA111: 389 | AB111: 333 | AC111: =(AA111*100)/AB111 -> 116.81681681681681 | AD111: =(X111*4)+(Z111*2) -> 4
A113: BRUNSWICK | C113: 0 | D113: 0 | E113: =C113*6+D113 -> 0 | G113: 0 | H113: 0 | I113: =G113*6+H113 -> 0 | K113: 0 | L113: 0 | M113: =K113*6+L113 -> 0 | O113: 23 | P113: 14 | Q113: =O113*6+P113 -> 152 | S113: BRUNSWICK | W113: WERRIBEE | X113: 1 | Y113: 2 | Z113: 0 | AA113: 283 | AB113: 290 | AC113: =(AA113*100)/AB113 -> 97.58620689655173 | AD113: =(X113*4)+(Z113*2) -> 4
A114: YARRAVILLE | C114: 0 | D114: 0 | E114: =C114*6+D114 -> 0 | G114: 0 | H114: 0 | I114: =G114*6+H114 -> 0 | K114: 0 | L114: 0 | M114: =K114*6+L114 -> 0 | O114: 11 | P114: 16 | Q114: =O114*6+P114 -> 82 | W114: NORTHCOTE | X114: 1 | Y114: 2 | Z114: 0 | AA114: 280 | AB114: 309 | AC114: =(AA114*100)/AB114 -> 90.614886731391579 | AD114: =(X114*4)+(Z114*2) -> 4
A115: BEST PLAYERS | W115: BOX HILL | X115: 1 | Y115: 2 | Z115: 0 | AA115: 278 | AB115: 331 | AC115: =(AA115*100)/AB115 -> 83.987915407854985 | AD115: =(X115*4)+(Z115*2) -> 4
A116: WERRIBEE | W116: CAMBERWELL | X116: 1 | Y116: 2 | Z116: 0 | AA116: 263 | AB116: 348 | AC116: =(AA116*100)/AB116 -> 75.574712643678154 | AD116: =(X116*4)+(Z116*2) -> 4
A117: BOX HILL | W117: FRANKSTON | X117: 1 | Y117: 2 | Z117: 0 | AA117: 338 | AB117: 510 | AC117: =(AA117*100)/AB117 -> 66.274509803921575 | AD117: =(X117*4)+(Z117*2) -> 4
A118: GOALKICKERS | W118: YARRAVILLE | X118: 0 | Y118: 3 | Z118: 0 | AA118: 269 | AB118: 390 | AC118: =(AA118*100)/AB118 -> 68.974358974358978 | AD118: =(X118*4)+(Z118*2) -> 0
A119: WERRIBEE
A120: BOX HILL
A122: NORTHCOTE | C122: 0 | D122: 0 | E122: =C122*6+D122 -> 0 | G122: 0 | H122: 0 | I122: =G122*6+H122 -> 0 | K122: 0 | L122: 0 | M122: =K122*6+L122 -> 0 | O122: 16 | P122: 16 | Q122: =O122*6+P122 -> 112 | S122: NORTHCOTE
A123: MORDIALLOC | C123: 0 | D123: 0 | E123: =C123*6+D123 -> 0 | G123: 0 | H123: 0 | I123: =G123*6+H123 -> 0 | K123: 0 | L123: 0 | M123: =K123*6+L123 -> 0 | O123: 17 | P123: 9 | Q123: =O123*6+P123 -> 111
A124: BEST PLAYERS
A125: NORTHCOTE
A126: MORDIALLOC
A127: GOALKICKERS
A128: NORTHCOTE
A129: MORDIALLOC
A131: WAVERLEY | C131: 0 | D131: 0 | E131: =C131*6+D131 -> 0 | G131: 0 | H131: 0 | I131: =G131*6+H131 -> 0 | K131: 0 | L131: 0 | M131: =K131*6+L131 -> 0 | O131: 17 | P131: 9 | Q131: =O131*6+P131 -> 111 | S131: WAVERLEY
A132: BOX HILL | C132: 0 | D132: 0 | E132: =C132*6+D132 -> 0 | G132: 0 | H132: 0 | I132: =G132*6+H132 -> 0 | K132: 0 | L132: 0 | M132: =K132*6+L132 -> 0 | O132: 9 | P132: 15 | Q132: =O132*6+P132 -> 69
A133: BEST PLAYERS
A134: WAVERLEY
A135: BOX HILL
A136: GOALKICKERS
A137: WAVERLEY
A138: BOX HILL
A140: COBURG | C140: 0 | D140: 0 | E140: =C140*6+D140 -> 0 | G140: 0 | H140: 0 | I140: =G140*6+H140 -> 0 | K140: 0 | L140: 0 | M140: =K140*6+L140 -> 0 | O140: 34 | P140: 25 | Q140: =O140*6+P140 -> 229 | S140: FRANKSTON
A141: FRANKSTON | C141: 0 | D141: 0 | E141: =C141*6+D141 -> 0 | G141: 0 | H141: 0 | I141: =G141*6+H141 -> 0 | K141: 0 | L141: 0 | M141: =K141*6+L141 -> 0 | O141: 15 | P141: 13 | Q141: =O141*6+P141 -> 103
A142: BEST PLAYERS
A143: COBURG
A144: FRANKSTON
A145: GOALKICKERS
A146: COBURG
A147: FRANKSTON
A149: ROUND 4 | E149: 5TH MAY | J149: WEATHER | S149: PLAYED AT
D150: 1ST QTR | H150: 2ND QTR | L150: 3RD QTR | P150: FINAL | S150: COBURG
A151: WAVERLEY | C151: 4 | D151: 4 | E151: =C151*6+D151 -> 28 | G151: 10 | H151: 8 | I151: =G151*6+H151 -> 68 | K151: 13 | L151: 10 | M151: =K151*6+L151 -> 88 | O151: 20 | P151: 14 | Q151: =O151*6+P151 -> 134 | S151: UMPIRE | X151: LADDER | AB151: ROUND | AD151: 4
A152: COBURG | C152: 10 | D152: 3 | E152: =C152*6+D152 -> 63 | G152: 12 | H152: 11 | I152: =G152*6+H152 -> 83 | K152: 17 | L152: 13 | M152: =K152*6+L152 -> 115 | O152: 18 | P152: 15 | Q152: =O152*6+P152 -> 123 | S152: STABB
A153: BEST PLAYERS | W153: TEAM | X153: W | Y153: L | Z153: D | AA153: FOR | AB153: AGST | AC153: % | AD153: PTS
A154: WAVERLEY | C154: COSTELLO | F154: PARKS | I154: HANCOCK | L154: B ALLAN | O154: R ALLAN
A155: COBURG | C155: LAKE | F155: ARTHURSON | I155: MANNIX | L155: ELVERY | O155: BREEN | W155: WAVERLEY | X155: 4 | Y155: 0 | Z155: 0 | AA155: 483 | AB155: 352 | AC155: =(AA155*100)/AB155 -> 137.21590909090909 | AD155: =(X155*4)+(Z155*2) -> 16
A156: GOALKICKERS | W156: BRUNSWICK | X156: 4 | Y156: 0 | Z156: 0 | AA156: 457 | AB156: 341 | AC156: =(AA156*100)/AB156 -> 134.0175953079179 | AD156: =(X156*4)+(Z156*2) -> 16
A157: WAVERLEY | C157: COSTELLO 8 | F157: HANCOCK 3 | I157: B ALLAN 2 | K157: ZIESLER 2 | M157: R ALLAN 2 | O157: PARKS 2 | Q157: HORKINGS | W157: COBURG | X157: 3 | Y157: 1 | Z157: 0 | AA157: 585 | AB157: 405 | AC157: =(AA157*100)/AB157 -> 144.44444444444446 | AD157: =(X157*4)+(Z157*2) -> 12
A158: COBURG | C158: LAKE 5 | E158: MANNIX 4 | H158: BRENNAN 3 | K158: BREEN 3 | M158: SMITH | O158: PAUL | Q158: MORRISON | W158: WERRIBEE | X158: 2 | Y158: 2 | Z158: 0 | AA158: 405 | AB158: 393 | AC158: =(AA158*100)/AB158 -> 103.05343511450381 | AD158: =(X158*4)+(Z158*2) -> 8
A160: WERRIBEE | C160: 8 | D160: 3 | E160: =C160*6+D160 -> 51 | G160: 13 | H160: 3 | I160: =G160*6+H160 -> 81 | K160: 15 | L160: 5 | M160: =K160*6+L160 -> 95 | O160: 19 | P160: 8 | Q160: =O160*6+P160 -> 122 | S160: YARRAVILLE | W160: NORTHCOTE | X160: 2 | Y160: 2 | Z160: 0 | AA160: 419 | AB160: 411 | AC160: =(AA160*100)/AB160 -> 101.94647201946472 | AD160: =(X160*4)+(Z160*2) -> 8
A161: YARRAVILLE | C161: 2 | D161: 3 | E161: =C161*6+D161 -> 15 | G161: 6 | H161: 9 | I161: =G161*6+H161 -> 45 | K161: 11 | L161: 11 | M161: =K161*6+L161 -> 77 | O161: 14 | P161: 19 | Q161: =O161*6+P161 -> 103 | S161: CARLILE | W161: CAMBERWELL | X161: 2 | Y161: 2 | Z161: 0 | AA161: 407 | AB161: 484 | AC161: =(AA161*100)/AB161 -> 84.090909090909093 | AD161: =(X161*4)+(Z161*2) -> 8
A162: BEST PLAYERS | W162: MORDIALLOC | X162: 1 | Y162: 3 | Z162: 0 | AA162: 485 | AB162: 445 | AC162: =(AA162*100)/AB162 -> 108.98876404494382 | AD162: =(X162*4)+(Z162*2) -> 4
A163: WERRIBEE | C163: MONTGOMERY | F163: MITCHELL | I163: HARVEY | L163: McCARTNEY | O163: BOURKE | R163: BUTTON | W163: BOX HILL | X163: 1 | Y163: 3 | Z163: 0 | AA163: 380 | AB163: 470 | AC163: =(AA163*100)/AB163 -> 80.851063829787236 | AD163: =(X163*4)+(Z163*2) -> 4
A164: YARRAVILLE | C164: COLEMAN | F164: LEWIS | I164: MARTIN | L164: BARR | O164: GREENEY | R164: LOWE | W164: FRANKSTON | X164: 1 | Y164: 3 | Z164: 0 | AA164: 474 | AB164: 654 | AC164: =(AA164*100)/AB164 -> 72.477064220183493 | AD164: =(X164*4)+(Z164*2) -> 4
A165: GOALKICKERS | W165: YARRAVILLE | X165: 0 | Y165: 4 | Z165: 0 | AA165: 372 | AB165: 512 | AC165: =(AA165*100)/AB165 -> 72.65625 | AD165: =(X165*4)+(Z165*2) -> 0
A166: WERRIBEE | C166: MITCHELL 7 | F166: HAMBLIN 4 | H166: BELLIN 2 | J166: McLEOD | L166: JOHNSTON | N166: SCHIELE | P166: ARRIGO | R166: NORTON | T166: BRYANT
A167: YARRAVILLE | C167: CALAZ 5 | E167: BLAKE 2 | G167: WHITTINGTON | J167: PATTON | L167: LOWE | N167: RYAN | P167: JOSLIN | R167: BARR | T167: LEWIS
A169: NORTHCOTE | C169: 7 | D169: 2 | E169: =C169*6+D169 -> 44 | G169: 11 | H169: 5 | I169: =G169*6+H169 -> 71 | K169: 16 | L169: 11 | M169: =K169*6+L169 -> 107 | O169: 21 | P169: 13 | Q169: =O169*6+P169 -> 139 | S169: BOX HILL
A170: BOX HILL | C170: 2 | D170: 4 | E170: =C170*6+D170 -> 16 | G170: 4 | H170: 10 | I170: =G170*6+H170 -> 34 | K170: 9 | L170: 11 | M170: =K170*6+L170 -> 65 | O170: 14 | P170: 18 | Q170: =O170*6+P170 -> 102 | S170: WENN
A171: BEST PLAYERS
A172: NORTHCOTE | C172: HOUGH | F172: McARDLE | I172: KREYMBORG | L172: KOZARIS | O172: STEWART | R172: McNEILL
A173: BOX HILL | C173: LASKIE | F173: MAGILL | I173: EDWARDS | L173: WALTER | O173: COUTTS | R173: LAWTHER
A174: GOALKICKERS
A175: NORTHCOTE | C175: HOUGH 8 | F175: KREYMBORG 6 | I175: RYAN 4 | K175: STEWART 2 | N175: GELLIE
A176: BOX HILL | C176: MAGILL 6 | F176: LASKIE 4 | I176: EDWARDS | L176: BAKER | N176: ZANTUCK | Q176: COUTTS
A178: CAMBERWELL | C178: 6 | D178: 1 | E178: =C178*6+D178 -> 37 | G178: 13 | H178: 8 | I178: =G178*6+H178 -> 86 | K178: 18 | L178: 11 | M178: =K178*6+L178 -> 119 | O178: 21 | P178: 18 | Q178: =O178*6+P178 -> 144 | S178: CAMBERWELL
A179: FRANKSTON | C179: 9 | D179: 7 | E179: =C179*6+D179 -> 61 | G179: 12 | H179: 10 | I179: =G179*6+H179 -> 82 | K179: 13 | L179: 13 | M179: =K179*6+L179 -> 91 | O179: 20 | P179: 16 | Q179: =O179*6+P179 -> 136 | S179: McBAIN
A180: BEST PLAYERS
A181: CAMBERWELL | C181: HAMMOND | F181: HODGES | I181: TIPPING | L181: KENNEDY | O181: STONE | Q181: SIMPSON
A182: FRANKSTON | C182: ELLIS | F182: BRIESE | I182: LOCCO | L182: MARTELLA
A183: GOALKICKERS
A184: CAMBERWELL | C184: HAMMOND 6 | F184: MOORE 4 | H184: STONE 4 | J184: SIMPSON 3 | M184: BRYCE 2 | O184: HODGES | Q184: TIPPING
A185: FRANKSTON | C185: BRIESE 6 | E185: CAFFYN 4 | G185: LOCCO 4 | I185: BLOOMFIELD 2 | L185: MARTELLA 2 | O185: LOVELOCK | R185: ELLIS
A187: BRUNSWICK | C187: 1 | D187: 8 | E187: =C187*6+D187 -> 14 | G187: 5 | H187: 12 | I187: =G187*6+H187 -> 42 | K187: 11 | L187: 17 | M187: =K187*6+L187 -> 83 | O187: 15 | P187: 22 | Q187: =O187*6+P187 -> 112 | S187: MORDIALLOC
A188: MORDIALLOC | C188: 2 | D188: 1 | E188: =C188*6+D188 -> 13 | G188: 6 | H188: 5 | I188: =G188*6+H188 -> 41 | K188: 11 | L188: 6 | M188: =K188*6+L188 -> 72 | O188: 14 | P188: 12 | Q188: =O188*6+P188 -> 96 | S188: STIRLING
A189: BEST PLAYERS
A190: BRUNSWICK | C190: DIMATTINA | F190: ALLAN | I190: HADZILLIAS | L190: LIAKOUREAS | O190: SKIDMORE | R190: HINTON
A191: MORDIALLOC | C191: RAEBURN | F191: WALKER | I191: SHUGG | L191: GUY | N191: JOHNSTONE | R191: WOOTTEN
A192: GOALKICKERS
A193: BRUNSWICK | C193: ALLAN 6 | F193: BAIRD 4 | I193: HADZILLIAS 2 | L193: ORTON | N193: HANTON | P193: DIMATTINA
A194: MORDIALLOC | C194: WOOTTEN 3 | F194: LAUGHLIN 2 | I194: JOHNSTONE 2 | L194: GUY 2 | N194: BASTIAN | P194: BASKIN | R194: SHUGG | T194: SMITH | V194: HARRY
A196: ROUND 5 | E196: 12TH MAY | J196: WEATHER | S196: PLAYED AT
D197: 1ST QTR | H197: 2ND QTR | L197: 3RD QTR | P197: FINAL | S197: CAMBERWELL
A198: CAMBERWELL | C198: 8 | D198: 6 | E198: =C198*6+D198 -> 54 | G198: 15 | H198: 7 | I198: =G198*6+H198 -> 97 | K198: 19 | L198: 13 | M198: =K198*6+L198 -> 127 | O198: 23 | P198: 22 | Q198: =O198*6+P198 -> 160 | S198: UMPIRE | X198: LADDER | AB198: ROUND | AD198: 5
A199: YARRAVILLE | C199: 2 | D199: 0 | E199: =C199*6+D199 -> 12 | G199: 6 | H199: 4 | I199: =G199*6+H199 -> 40 | K199: 11 | L199: 7 | M199: =K199*6+L199 -> 73 | O199: 13 | P199: 10 | Q199: =O199*6+P199 -> 88 | S199: O'BRIEN
A200: BEST PLAYERS | W200: TEAM | X200: W | Y200: L | Z200: D | AA200: FOR | AB200: AGST | AC200: % | AD200: PTS
A201: CAMBERWELL | C201: MOORE | F201: SPITHILL | I201: SIMPSON | L201: CUTTING | N201: TIPPING | Q201: HAZLETT
A202: YARRAVILLE | C202: SQUIRE | F202: LOWE | I202: T SMITH | L202: RYAN | N202: WHITTINGTON | Q202: MARTIN | W202: WAVERLEY | X202: 5 | Y202: 0 | Z202: 0 | AA202: 598 | AB202: 454 | AC202: =(AA202*100)/AB202 -> 131.71806167400882 | AD202: =(X202*4)+(Z202*2) -> 20
A203: GOALKICKERS | W203: COBURG | X203: 4 | Y203: 1 | Z203: 0 | AA203: 741 | AB203: 451 | AC203: =(AA203*100)/AB203 -> 164.30155210643017 | AD203: =(X203*4)+(Z203*2) -> 16
A204: CAMBERWELL | C204: MOORE 10 | F204: SIMPSON 6 | I204: BRYCE 3 | K204: STONE 2 | M204: TIPPING | O204: HAMMOND | W204: BRUNSWICK | X204: 4 | Y204: 1 | Z204: 0 | AA204: 559 | AB204: 456 | AC204: =(AA204*100)/AB204 -> 122.58771929824562 | AD204: =(X204*4)+(Z204*2) -> 16
A205: YARRAVILLE | C205: GREENEY 3 | F205: PATTON 3 | I205: BARR 2 | K205: CALAZ 2 | M205: WHITTINGTON | P205: MARTIN | R205: BLAKE | W205: NORTHCOTE | X205: 3 | Y205: 2 | Z205: 0 | AA205: 524 | AB205: 494 | AC205: =(AA205*100)/AB205 -> 106.07287449392713 | AD205: =(X205*4)+(Z205*2) -> 12
A207: WAVERLEY | C207: 3 | D207: 5 | E207: =C207*6+D207 -> 23 | G207: 7 | H207: 10 | I207: =G207*6+H207 -> 52 | K207: 12 | L207: 12 | M207: =K207*6+L207 -> 84 | O207: 17 | P207: 13 | Q207: =O207*6+P207 -> 115 | S207: BRUNSWICK | W207: CAMBERWELL | X207: 3 | Y207: 2 | Z207: 0 | AA207: 567 | AB207: 572 | AC207: =(AA207*100)/AB207 -> 99.12587412587412 | AD207: =(X207*4)+(Z207*2) -> 12
A208: BRUNSWICK | C208: 3 | D208: 5 | E208: =C208*6+D208 -> 23 | G208: 7 | H208: 11 | I208: =G208*6+H208 -> 53 | K208: 12 | L208: 14 | M208: =K208*6+L208 -> 86 | O208: 14 | P208: 18 | Q208: =O208*6+P208 -> 102 | S208: HAYES | W208: MORDIALLOC | X208: 2 | Y208: 3 | Z208: 0 | AA208: 575 | AB208: 521 | AC208: =(AA208*100)/AB208 -> 110.36468330134358 | AD208: =(X208*4)+(Z208*2) -> 8
A209: BEST PLAYERS | W209: WERRIBEE | X209: 2 | Y209: 3 | Z209: 0 | AA209: 481 | AB209: 483 | AC209: =(AA209*100)/AB209 -> 99.585921325051757 | AD209: =(X209*4)+(Z209*2) -> 8
A210: WAVERLEY | C210: B ALLAN | F210: R ALLAN | I210: HORKINGS | L210: FERGUSON | O210: COOK | Q210: STONE | W210: FRANKSTON | X210: 1 | Y210: 4 | Z210: 0 | AA210: 557 | AB210: 759 | AC210: =(AA210*100)/AB210 -> 73.386034255599469 | AD210: =(X210*4)+(Z210*2) -> 4
A211: BRUNSWICK | C211: SKIDMORE | F211: HORSINGTON | I211: O'CONNOR | L211: STILO | O211: FORD | Q211: HADZILLIAS | W211: BOX HILL | X211: 1 | Y211: 4 | Z211: 0 | AA211: 426 | AB211: 626 | AC211: =(AA211*100)/AB211 -> 68.051118210862626 | AD211: =(X211*4)+(Z211*2) -> 4
A212: GOALKICKERS | W212: YARRAVILLE | X212: 0 | Y212: 5 | Z212: 0 | AA212: 460 | AB212: 672 | AC212: =(AA212*100)/AB212 -> 68.452380952380949 | AD212: =(X212*4)+(Z212*2) -> 0
A213: WAVERLEY | C213: ZIESLER 4 | E213: R ALLAN 3 | G213: COSTELLO 3 | J213: B ALLAN 2 | L213: FERGUSON | N213: HORKINGS | P213: OWENS | R213: HANCOCK | T213: HOLDSWORTH
A214: BRUNSWICK | C214: ALLAN 3 | E214: BAIRD 3 | G214: O'CONNOR 2 | J214: STILO 2 | L214: JOSEPH | N214: ORTON | P214: HADZILLIAS | S214: HORSINGTON
A216: MORDIALLOC | C216: 3 | D216: 6 | E216: =C216*6+D216 -> 24 | G216: 5 | H216: 7 | I216: =G216*6+H216 -> 37 | K216: 9 | L216: 15 | M216: =K216*6+L216 -> 69 | O216: 12 | P216: 18 | Q216: =O216*6+P216 -> 90 | S216: WERRIBEE
A217: WERRIBEE | C217: 1 | D217: 3 | E217: =C217*6+D217 -> 9 | G217: 5 | H217: 9 | I217: =G217*6+H217 -> 39 | K217: 7 | L217: 9 | M217: =K217*6+L217 -> 51 | O217: 10 | P217: 16 | Q217: =O217*6+P217 -> 76 | S217: WENN
A218: BEST PLAYERS
A219: MORDIALLOC | C219: WOOTTEN | F219: SHUGG | I219: JOHNSTONE | L219: GUY | O219: BESANKO | R219: SMITH
A220: WERRIBEE | C220: McCARTNEY | F220: MONTGOMERY | I220: BUTTON | L220: HAMBLIN | O220: NEWMAN | R220: McLEOD
A221: GOALKICKERS
A222: MORDIALLOC | C222: BASKIN 4 | F222: HARRY 3 | I222: BASTIAN 2 | L222: WILKINS 2 | O222: LAUGHLIN
A223: WERRIBEE | C223: BRYANT 2 | F223: McLEOD 2 | H223: HAMBLIN | J223: ARRIGO | L223: SHIELE | N223: MITCHELL | P223: BOURKE | R223: BELLIN
A225: NORTHCOTE | C225: 4 | D225: 0 | E225: =C225*6+D225 -> 24 | G225: 5 | H225: 3 | I225: =G225*6+H225 -> 33 | K225: 11 | L225: 5 | M225: =K225*6+L225 -> 71 | O225: 16 | P225: 9 | Q225: =O225*6+P225 -> 105 | S225: NORTHCOTE
A226: FRANKSTON | C226: 4 | D226: 6 | E226: =C226*6+D226 -> 30 | G226: 5 | H226: 10 | I226: =G226*6+H226 -> 40 | K226: 9 | L226: 14 | M226: =K226*6+L226 -> 68 | O226: 11 | P226: 17 | Q226: =O226*6+P226 -> 83 | S226: STABB
A227: BEST PLAYERS
A228: NORTHCOTE | C228: GELLIE | F228: THORNELOE | I228: STEWART | L228: KOZARIS | O228: LEECH | Q228: RYAN
A229: FRANKSTON | C229: ELLIS | F229: ROSENBROCK | I229: MARTELLA | L229: DOHERTY | O229: BRIESE
A230: GOALKICKERS
A231: NORTHCOTE | C231: STEWART 4 | F231: RYAN 4 | H231: McARDLE 2 | K231: HOUGH 2 | M231: GELLIE | O231: HOLLAND | Q231: KREYMBORG | T231: NANKERVIS
A232: FRANKSTON | C232: DOHERTY 4 | F232: BRIESE 3 | H232: CAFFYN 2 | J232: LOVELOCK | M232: LOCCO
A234: COBURG | C234: 5 | D234: 10 | E234: =C234*6+D234 -> 40 | G234: 9 | H234: 12 | I234: =G234*6+H234 -> 66 | K234: 15 | L234: 19 | M234: =K234*6+L234 -> 109 | O234: 22 | P234: 24 | Q234: =O234*6+P234 -> 156 | S234: BOX HILL
A235: BOX HILL | C235: 2 | D235: 2 | E235: =C235*6+D235 -> 14 | G235: 3 | H235: 6 | I235: =G235*6+H235 -> 24 | K235: 4 | L235: 6 | M235: =K235*6+L235 -> 30 | O235: 6 | P235: 10 | Q235: =O235*6+P235 -> 46 | S235: ABBOTT
A236: BEST PLAYERS
A237: COBURG | C237: LAKE | F237: ELVERY | I237: GALE | L237: PAUL | N237: HOPGOOD | Q237: HOWELL
A238: BOX HILL | C238: CURTIS | F238: WATERS | I238: EWAN | L238: ZANTUCK | N238: COUTTS | Q238: RALPH
A239: GOALKICKERS
A240: COBURG | C240: LAKE 5 | E240: HOPGOOD 4 | H240: P McCARTHY 4 | K240: GALE 3 | M240: HARRISON 2 | O240: BRENNAN 2 | R240: BREEN | T240: BROWN
A241: BOX HILL | C241: MAGILL 3 | F241: LASKIE | H241: COUTTS | J241: ZANTUCK
A243: ROUND 6 | E243: 19TH MAY | J243: WEATHER | S243: PLAYED AT
D244: 1ST QTR | H244: 2ND QTR | L244: 3RD QTR | P244: FINAL | S244: MORDIALLOC
A245: CAMBERWELL | C245: 3 | D245: 6 | E245: =C245*6+D245 -> 24 | G245: 12 | H245: 8 | I245: =G245*6+H245 -> 80 | K245: 13 | L245: 14 | M245: =K245*6+L245 -> 92 | O245: 17 | P245: 21 | Q245: =O245*6+P245 -> 123 | S245: UMPIRE | X245: LADDER | AB245: ROUND | AD245: 6
A246: MORDIALLOC | C246: 3 | D246: 1 | E246: =C246*6+D246 -> 19 | G246: 3 | H246: 5 | I246: =G246*6+H246 -> 23 | K246: 7 | L246: 7 | M246: =K246*6+L246 -> 49 | O246: 13 | P246: 9 | Q246: =O246*6+P246 -> 87 | S246: DAVIS
A247: BEST PLAYERS | W247: TEAM | X247: W | Y247: L | Z247: D | AA247: FOR | AB247: AGST | AC247: % | AD247: PTS
A248: CAMBERWELL | C248: HAMMOND | F248: SIMPSON | I248: CUTTING | L248: HOOK | O248: MACK | R248: HAZLETT
A249: MORDIALLOC | C249: McFARLAND | F249: WOOTTEN | I249: WILKINS | L249: HARRY | O249: THOMPSON | R249: JOHNSTONE | W249: WAVERLEY | X249: 6 | Y249: 0 | Z249: 0 | AA249: 763 | AB249: 555 | AC249: =(AA249*100)/AB249 -> 137.47747747747746 | AD249: =(X249*4)+(Z249*2) -> 24
A250: GOALKICKERS | W250: COBURG | X250: 5 | Y250: 1 | Z250: 0 | AA250: 899 | AB250: 544 | AC250: =(AA250*100)/AB250 -> 165.25735294117646 | AD250: =(X250*4)+(Z250*2) -> 20
A251: CAMBERWELL | C251: MOORE 4 | E251: HAMMOND 3 | H251: SIMPSON 3 | J251: BRYCE 2 | L251: TIPPING 2 | N251: STONE | P251: HAZLETT | R251: PARSONS | W251: BRUNSWICK | X251: 5 | Y251: 1 | Z251: 0 | AA251: 725 | AB251: 542 | AC251: =(AA251*100)/AB251 -> 133.76383763837637 | AD251: =(X251*4)+(Z251*2) -> 20
A252: MORDIALLOC | C252: HARRY 6 | F252: WOOTTEN 2 | I252: WILKINS 2 | L252: LAUGHLIN | N252: McGUINNESS | Q252: PINNE | W252: CAMBERWELL | X252: 4 | Y252: 2 | Z252: 0 | AA252: 690 | AB252: 659 | AC252: =(AA252*100)/AB252 -> 104.7040971168437 | AD252: =(X252*4)+(Z252*2) -> 16
A254: BRUNSWICK | C254: 7 | D254: 2 | E254: =C254*6+D254 -> 44 | G254: 12 | H254: 4 | I254: =G254*6+H254 -> 76 | K254: 18 | L254: 7 | M254: =K254*6+L254 -> 115 | O254: 26 | P254: 10 | Q254: =O254*6+P254 -> 166 | S254: WERRIBEE | W254: NORTHCOTE | X254: 3 | Y254: 3 | Z254: 0 | AA254: 625 | AB254: 659 | AC254: =(AA254*100)/AB254 -> 94.840667678300449 | AD254: =(X254*4)+(Z254*2) -> 12
A255: WERRIBEE | C255: 2 | D255: 4 | E255: =C255*6+D255 -> 16 | G255: 7 | H255: 9 | I255: =G255*6+H255 -> 51 | K255: 11 | L255: 12 | M255: =K255*6+L255 -> 78 | O255: 12 | P255: 14 | Q255: =O255*6+P255 -> 86 | S255: TORNEY | W255: MORDIALLOC | X255: 2 | Y255: 4 | Z255: 0 | AA255: 662 | AB255: 644 | AC255: =(AA255*100)/AB255 -> 102.79503105590062 | AD255: =(X255*4)+(Z255*2) -> 8
A256: BEST PLAYERS | W256: WERRIBEE | X256: 2 | Y256: 4 | Z256: 0 | AA256: 567 | AB256: 649 | AC256: =(AA256*100)/AB256 -> 87.365177195685675 | AD256: =(X256*4)+(Z256*2) -> 8
A257: BRUNSWICK | C257: ALLAN | F257: STILO | I257: JOSEPH | L257: ORTON | O257: WROUT | Q257: O'CONNOR | W257: FRANKSTON | X257: 2 | Y257: 4 | Z257: 0 | AA257: 708 | AB257: 824 | AC257: =(AA257*100)/AB257 -> 85.922330097087382 | AD257: =(X257*4)+(Z257*2) -> 8
A258: WERRIBEE | C258: BRYANT | F258: SHIELE | I258: McLEOD | L258: McCARTNEY | O258: PAICE | Q258: MONTGOMERY | W258: BOX HILL | X258: 1 | Y258: 5 | Z258: 0 | AA258: 491 | AB258: 777 | AC258: =(AA258*100)/AB258 -> 63.191763191763194 | AD258: =(X258*4)+(Z258*2) -> 4
A259: GOALKICKERS | C259: 1 SHORT | W259: YARRAVILLE | X259: 0 | Y259: 6 | Z259: 0 | AA259: 553 | AB259: 830 | AC259: =(AA259*100)/AB259 -> 66.626506024096386 | AD259: =(X259*4)+(Z259*2) -> 0
A260: BRUNSWICK | C260: STILO 5 | E260: ORTON 5 | G260: BAIRD 5 | I260: ALLAN 5 | K260: HORSINGTON 2 | N260: WROUT | P260: JOSEPH | R260: O'CONNOR
A261: WERRIBEE | C261: SCHIELE 5 | F261: BRYANT | H261: ARRIGO | J261: PAICE | L261: MCLEOD | N261: HOOPER | P261: MITCHELL | R261: BOURKE
A263: COBURG | C263: 8 | D263: 6 | E263: =C263*6+D263 -> 54 | G263: 12 | H263: 12 | I263: =G263*6+H263 -> 84 | K263: 17 | L263: 17 | M263: =K263*6+L263 -> 119 | O263: 22 | P263: 26 | Q263: =O263*6+P263 -> 158 | S263: COBURG
A264: YARRAVILLE | C264: 4 | D264: 0 | E264: =C264*6+D264 -> 24 | G264: 10 | H264: 3 | I264: =G264*6+H264 -> 63 | K264: 12 | L264: 4 | M264: =K264*6+L264 -> 76 | O264: 14 | P264: 9 | Q264: =O264*6+P264 -> 93 | S264: MURLEY
A265: BEST PLAYERS
A266: COBURG | C266: HOPGOOD | F266: SMITH | I266: HOBBS | L266: GALE | N266: BREEN | P266: MORRISON
A267: YARRAVILLE | C267: LOWE | F267: GREENEY | I267: DOLL | L267: SQUIRE | N267: JANES | P267: MARTIN
A268: GOALKICKERS
A269: COBURG | C269: SMITH 8 | E269: MORRISON 3 | H269: BREEN 3 | J269: LAKE 2 | L269: HOBBS 2 | N269: BRENNAN | P269: MANNIX | R269: HOPGOOD | T269: GALE
A270: YARRAVILLE | C270: GREENEY 4 | F270: HARRISON 4 | I270: LEWIS 2 | K270: KLANISCHAK 2 | N270: PATTON | Q270: MARTIN
A272: WAVERLEY | C272: 6 | D272: 2 | E272: =C272*6+D272 -> 38 | G272: 11 | H272: 8 | I272: =G272*6+H272 -> 74 | K272: 20 | L272: 13 | M272: =K272*6+L272 -> 133 | O272: 25 | P272: 15 | Q272: =O272*6+P272 -> 165 | S272: WAVERLEY
A273: NORTHCOTE | C273: 5 | D273: 1 | E273: =C273*6+D273 -> 31 | G273: 9 | H273: 5 | I273: =G273*6+H273 -> 59 | K273: 13 | L273: 6 | M273: =K273*6+L273 -> 84 | O273: 15 | P273: 11 | Q273: =O273*6+P273 -> 101 | S273: McBAIN
A274: BEST PLAYERS
A275: WAVERLEY | C275: OSBORNE | F275: HORKINGS | I275: R ALLAN | L275: B ALLAN | O275: STONE | R275: ZIESLER
A276: NORTHCOTE | C276: RYAN | F276: KOZARIS | I276: WATT | L276: REDENBACH | O276: McNEILL | R276: CAREY
A277: GOALKICKERS
A278: WAVERLEY | C278: ZIESLER 6 | E278: HORKINGS 5 | G278: COSTELLO 3 | J278: SMEDTS 3 | L278: OSBORNE 2 | O278: B ALLAN | Q278: R ALLAN | S278: HASTINGS | V278: HANCOCK | X278: COOK | Y278: PARKS
A279: NORTHCOTE | C279: RYAN 6 | E279: HOUGH 5 | G279: KREYMBORG 2 | J279: KILKENNY | L279: LEECH
A281: FRANKSTON | C281: 6 | D281: 9 | E281: =C281*6+D281 -> 45 | G281: 10 | H281: 10 | I281: =G281*6+H281 -> 70 | K281: 13 | L281: 18 | M281: =K281*6+L281 -> 96 | O281: 22 | P281: 19 | Q281: =O281*6+P281 -> 151 | S281: FRANKSTON
A282: BOX HILL | C282: 2 | D282: 4 | E282: =C282*6+D282 -> 16 | G282: 5 | H282: 10 | I282: =G282*6+H282 -> 40 | K282: 6 | L282: 11 | M282: =K282*6+L282 -> 47 | O282: 8 | P282: 17 | Q282: =O282*6+P282 -> 65 | S282: O'BRIEN
A283: BEST PLAYERS
A284: FRANKSTON | C284: ELLIS | F284: DOHERTY | I284: CLARK | L284: SHEPHERD | O284: ROSENBROCK | R284: LOVELOCK
A285: BOX HILL | C285: COUTTS | F285: WALTER | I285: ZANTUCK | L285: EWAN | O285: BARNETT
A286: GOALKICKERS
A287: FRANKSTON | C287: BLOOMFIELD 6 | F287: DOHERTY 5 | I287: CAFFYN 4 | K287: BRIESE 3 | M287: CLARK 2 | O287: LOCCO | Q287: ROWE
A288: BOX HILL | C288: COUTTS 3 | F288: TAYLOR | I288: WALTER | K288: LASKIE | M288: MAGILL | O288: LAWTHER
A290: ROUND 7 | E290: 26TH MAY | J290: WEATHER | S290: PLAYED AT
D291: 1ST QTR | H291: 2ND QTR | L291: 3RD QTR | P291: FINAL | S291: YARRAVILLE
A292: YARRAVILLE | C292: 1 | D292: 4 | E292: =C292*6+D292 -> 10 | G292: 5 | H292: 9 | I292: =G292*6+H292 -> 39 | K292: 7 | L292: 14 | M292: =K292*6+L292 -> 56 | O292: 11 | P292: 21 | Q292: =O292*6+P292 -> 87 | S292: UMPIRE | X292: LADDER | AB292: ROUND | AD292: 7
A293: MORDIALLOC | C293: 5 | D293: 5 | E293: =C293*6+D293 -> 35 | G293: 6 | H293: 6 | I293: =G293*6+H293 -> 42 | K293: 12 | L293: 11 | M293: =K293*6+L293 -> 83 | O293: 12 | P293: 11 | Q293: =O293*6+P293 -> 83 | S293: TORNEY
A294: BEST PLAYERS | W294: TEAM | X294: W | Y294: L | Z294: D | AA294: FOR | AB294: AGST | AC294: % | AD294: PTS
A295: YARRAVILLE | C295: SQUIRE | F295: B WILKINSON | I295: WHITTINGTON | L295: MARTIN | O295: JANES | R295: BARR
A296: MORDIALLOC | C296: RAEBURN | F296: SCAIFFE | I296: THOMPSON | L296: JONSTONE | O296: BESANKO | R296: BASKIN | W296: WAVERLEY | X296: 7 | Y296: 0 | Z296: 0 | AA296: 935 | AB296: 646 | AC296: =(AA296*100)/AB296 -> 144.73684210526315 | AD296: =(X296*4)+(Z296*2) -> 28
A297: GOALKICKERS | W297: COBURG | X297: 6 | Y297: 1 | Z297: 0 | AA297: 1024 | AB297: 622 | AC297: =(AA297*100)/AB297 -> 164.63022508038586 | AD297: =(X297*4)+(Z297*2) -> 24
A298: YARRAVILLE | C298: R WILKINSON 2 | F298: RYAN 2 | H298: GREENEY 2 | J298: PATTON | L298: LOWE | N298: MARTIN | P298: B WILKINSON | S298: SHIELDS | W298: BRUNSWICK | X298: 6 | Y298: 1 | Z298: 0 | AA298: 817 | AB298: 633 | AC298: =(AA298*100)/AB298 -> 129.06793048973142 | AD298: =(X298*4)+(Z298*2) -> 24
A299: MORDIALLOC | C299: HARRY 3 | E299: SCAIFFE 3 | H299: BASKIN 2 | J299: DYE | L299: SHUGG | N299: WILKINS | P299: WOOTTEN | W299: CAMBERWELL | X299: 4 | Y299: 3 | Z299: 0 | AA299: 781 | AB299: 751 | AC299: =(AA299*100)/AB299 -> 103.99467376830893 | AD299: =(X299*4)+(Z299*2) -> 16
A301: BRUNSWICK | C301: 2 | D301: 1 | E301: =C301*6+D301 -> 13 | G301: 7 | H301: 9 | I301: =G301*6+H301 -> 51 | K301: 9 | L301: 14 | M301: =K301*6+L301 -> 68 | O301: 12 | P301: 20 | Q301: =O301*6+P301 -> 92 | S301: BRUNSWICK | W301: WERRIBEE | X301: 3 | Y301: 4 | Z301: 0 | AA301: 670 | AB301: 731 | AC301: =(AA301*100)/AB301 -> 91.655266757865931 | AD301: =(X301*4)+(Z301*2) -> 12
A302: CAMBERWELL | C302: 4 | D302: 5 | E302: =C302*6+D302 -> 29 | G302: 4 | H302: 6 | I302: =G302*6+H302 -> 30 | K302: 11 | L302: 7 | M302: =K302*6+L302 -> 73 | O302: 14 | P302: 7 | Q302: =O302*6+P302 -> 91 | S302: ABBOTT | W302: NORTHCOTE | X302: 3 | Y302: 4 | Z302: 0 | AA302: 703 | AB302: 784 | AC302: =(AA302*100)/AB302 -> 89.66836734693878 | AD302: =(X302*4)+(Z302*2) -> 12
A303: BEST PLAYERS | W303: MORDIALLOC | X303: 2 | Y303: 5 | Z303: 0 | AA303: 745 | AB303: 731 | AC303: =(AA303*100)/AB303 -> 101.91518467852258 | AD303: =(X303*4)+(Z303*2) -> 8
A304: BRUNSWICK | C304: O'CONNOR | F304: ORTON | I304: GUEST | L304: JOSEPH | N304: DIMATTINA | Q304: NOLAN | W304: FRANKSTON | X304: 2 | Y304: 5 | Z304: 0 | AA304: 799 | AB304: 996 | AC304: =(AA304*100)/AB304 -> 80.220883534136547 | AD304: =(X304*4)+(Z304*2) -> 8
A305: CAMBERWELL | C305: PARSONS | F305: ATKINSON | I305: SPITHILL | L305: STONE | N305: SIMPSON | Q305: HAMMOND | W305: YARRAVILLE | X305: 1 | Y305: 6 | Z305: 0 | AA305: 640 | AB305: 913 | AC305: =(AA305*100)/AB305 -> 70.098576122672512 | AD305: =(X305*4)+(Z305*2) -> 4
A306: GOALKICKERS | W306: BOX HILL | X306: 1 | Y306: 6 | Z306: 0 | AA306: 573 | AB306: 880 | AC306: =(AA306*100)/AB306 -> 65.11363636363636 | AD306: =(X306*4)+(Z306*2) -> 4
A307: BRUNSWICK | C307: ORTON 5 | F307: I ALLAN 3 | I307: VALENTINE | L307: DIMATTINA | O307: WOODHAM | R307: O'CONNOR
A308: CAMBERWELL | C308: STONE 4 | F308: SIMPSON 3 | I308: HAMMOND 3 | L308: MOORE 2 | N308: ATKINSON | Q308: BRYCE
A310: COBURG | C310: 6 | D310: 5 | E310: =C310*6+D310 -> 41 | G310: 11 | H310: 10 | I310: =G310*6+H310 -> 76 | K310: 15 | L310: 17 | M310: =K310*6+L310 -> 107 | O310: 17 | P310: 23 | Q310: =O310*6+P310 -> 125 | S310: NORTHCOTE
A311: NORTHCOTE | C311: 1 | D311: 1 | E311: =C311*6+D311 -> 7 | G311: 3 | H311: 3 | I311: =G311*6+H311 -> 21 | K311: 6 | L311: 4 | M311: =K311*6+L311 -> 40 | O311: 12 | P311: 6 | Q311: =O311*6+P311 -> 78 | S311: CARLILE
A312: BEST PLAYERS
A313: COBURG | C313: GALE | F313: MANNIX | I313: ROBINSON | L313: McGRATH | O313: HOBBS | Q313: LAKE
A314: NORTHCOTE | C314: LEECH | F314: KOZARIS | I314: RYAN | L314: McNEILL | O314: THORNELOE | R314: MCARDLE
A315: GOALKICKERS
A316: COBURG | C316: LAKE 5 | E316: McGRATH 4 | H316: SMITH 3 | J316: GALE | L316: HOBBS | N316: MORRISON | Q316: 2 SHORT
A317: NORTHCOTE | C317: RYAN 7 | F317: CHAPMAN 3 | I317: HOUSE | K317: KREYMBORG
A319: WAVERLEY | C319: 3 | D319: 2 | E319: =C319*6+D319 -> 20 | G319: 10 | H319: 8 | I319: =G319*6+H319 -> 68 | K319: 13 | L319: 12 | M319: =K319*6+L319 -> 90 | O319: 26 | P319: 16 | Q319: =O319*6+P319 -> 172 | S319: FRANKSTON
A320: FRANKSTON | C320: 4 | D320: 5 | E320: =C320*6+D320 -> 29 | G320: 6 | H320: 8 | I320: =G320*6+H320 -> 44 | K320: 10 | L320: 11 | M320: =K320*6+L320 -> 71 | O320: 13 | P320: 13 | Q320: =O320*6+P320 -> 91 | S320: MURLEY
A321: BEST PLAYERS
A322: WAVERLEY | C322: OSBORNE | F322: B ALLAN | I322: HORKINGS | L322: R ALLAN | O322: STONE | Q322: PARKS
A323: FRANKSTON | C323: BRIESE | F323: ELLIS | I323: DOHERTY | L323: BLOOMFIELD | O323: ROSENBROCK
A324: GOALKICKERS
A325: WAVERLEY | C325: ZIESLER 7 | E325: COSTELLO 4 | G325: HORKINGS 4 | J325: R ALLAN 4 | M325: COOK 2 | O325: PARKS | Q325: LUMLEY | S325: HANCOCK | V325: OSBORNE
A326: FRANKSTON | C326: BRIESE 3 | F326: LOVELOCK 3 | I326: BLOOMFIELD 2 | L326: DOHERTY | N326: CAFFYN | P326: CLARK | R326: SHEPHERD | U326: LOCCO
A328: WERRIBEE | C328: 4 | D328: 5 | E328: =C328*6+D328 -> 29 | G328: 7 | H328: 7 | I328: =G328*6+H328 -> 49 | K328: 13 | L328: 11 | M328: =K328*6+L328 -> 89 | O328: 15 | P328: 13 | Q328: =O328*6+P328 -> 103 | S328: BOX HILL
A329: BOX HILL | C329: 1 | D329: 2 | E329: =C329*6+D329 -> 8 | G329: 5 | H329: 3 | I329: =G329*6+H329 -> 33 | K329: 10 | L329: 4 | M329: =K329*6+L329 -> 64 | O329: 12 | P329: 10 | Q329: =O329*6+P329 -> 82 | S329: DAVIS
A330: BEST PLAYERS
A331: WERRIBEE | C331: HAMBLIN | F331: BOURKE | I331: MORRIS | L331: MITCHELL | O331: MONTGOMERY
A332: BOX HILL | C332: CURTIS | F332: EDWARDS | I332: TIERNEY | L332: BARNETT | O332: RALPH
A333: GOALKICKERS
A334: WERRIBEE | C334: BOURKE 5 | F334: NORTON 5 | I334: MITCHELL 4 | L334: MORRIS
A335: BOX HILL | C335: WALTER 4 | F335: TIERNEY 3 | I335: COUTTS 2 | L335: BARNETT 2 | O335: BRYANT
A337: ROUND 8 | E337: 2ND JUNE | J337: WEATHER | S337: PLAYED AT
D338: 1ST QTR | H338: 2ND QTR | L338: 3RD QTR | P338: FINAL | S338: MORDIALLOC
A339: WAVERLEY | C339: 7 | D339: 3 | E339: =C339*6+D339 -> 45 | G339: 13 | H339: 5 | I339: =G339*6+H339 -> 83 | K339: 16 | L339: 9 | M339: =K339*6+L339 -> 105 | O339: 17 | P339: 13 | Q339: =O339*6+P339 -> 115 | S339: UMPIRE | X339: LADDER | AB339: ROUND | AD339: 8
A340: MORDIALLOC | C340: 3 | D340: 0 | E340: =C340*6+D340 -> 18 | G340: 7 | H340: 1 | I340: =G340*6+H340 -> 43 | K340: 10 | L340: 4 | M340: =K340*6+L340 -> 64 | O340: 13 | P340: 8 | Q340: =O340*6+P340 -> 86 | S340: O'BRIEN
A341: BEST PLAYERS | W341: TEAM | X341: W | Y341: L | Z341: D | AA341: FOR | AB341: AGST | AC341: % | AD341: PTS
A342: WAVERLEY | C342: COOK | E342: PARKS | H342: HANCOCK | K342: STONE | N342: HORKINGS | Q342: LUMLEY
A343: MORDIALLOC | C343: BREEN | E343: GAWNE | H343: ORR | K343: WALKER | N343: BESANKO | Q343: HARRY | W343: WAVERLEY | X343: 8 | Y343: 0 | Z343: 0 | AA343: 1050 | AB343: 732 | AC343: =(AA343*100)/AB343 -> 143.44262295081967 | AD343: =(X343*4)+(Z343*2) -> 32
A344: GOALKICKERS | W344: COBURG | X344: 7 | Y344: 1 | Z344: 0 | AA344: 1173 | AB344: 724 | AC344: =(AA344*100)/AB344 -> 162.01657458563537 | AD344: =(X344*4)+(Z344*2) -> 28
A345: WAVERLEY | C345: ZIESLER 5 | E345: COSTELLO 3 | H345: HORKINGS 3 | J345: PARKS 2 | L345: COOK 2 | N345: HANCOCK | Q345: SMEDTS | W345: BRUNSWICK | X345: 6 | Y345: 2 | Z345: 0 | AA345: 919 | AB345: 782 | AC345: =(AA345*100)/AB345 -> 117.51918158567774 | AD345: =(X345*4)+(Z345*2) -> 24
A346: MORDIALLOC | C346: BASKIN 3 | E346: HARRY 3 | G346: LANG 2 | I346: GUY | J346: SHUGG | L346: WILKINS | N346: BESANKO | P346: SCAIFFE | R346: BASTIAN | W346: CAMBERWELL | X346: 5 | Y346: 3 | Z346: 0 | AA346: 898 | AB346: 847 | AC346: =(AA346*100)/AB346 -> 106.02125147579693 | AD346: =(X346*4)+(Z346*2) -> 20
A348: YARRAVILLE | C348: 4 | D348: 4 | E348: =C348*6+D348 -> 28 | G348: 7 | H348: 13 | I348: =G348*6+H348 -> 55 | K348: 11 | L348: 17 | M348: =K348*6+L348 -> 83 | O348: 12 | P348: 24 | Q348: =O348*6+P348 -> 96 | S348: YARRAVILLE | W348: WERRIBEE | X348: 4 | Y348: 4 | Z348: 0 | AA348: 759 | AB348: 808 | AC348: =(AA348*100)/AB348 -> 93.93564356435644 | AD348: =(X348*4)+(Z348*2) -> 16
A349: BOX HILL | C349: 3 | D349: 5 | E349: =C349*6+D349 -> 23 | G349: 4 | H349: 8 | I349: =G349*6+H349 -> 32 | K349: 7 | L349: 12 | M349: =K349*6+L349 -> 54 | O349: 11 | P349: 18 | Q349: =O349*6+P349 -> 84 | S349: CARLILE | W349: NORTHCOTE | X349: 3 | Y349: 5 | Z349: 0 | AA349: 799 | AB349: 901 | AC349: =(AA349*100)/AB349 -> 88.679245283018872 | AD349: =(X349*4)+(Z349*2) -> 12
A350: BEST PLAYERS | W350: MORDIALLOC | X350: 2 | Y350: 6 | Z350: 0 | AA350: 831 | AB350: 846 | AC350: =(AA350*100)/AB350 -> 98.226950354609926 | AD350: =(X350*4)+(Z350*2) -> 8
A351: YARRAVILLE | C351: SQUIRE | F351: SMITH | I351: DOLL | L351: JONES | N351: WHITTINGTON | W351: FRANKSTON | X351: 2 | Y351: 6 | Z351: 0 | AA351: 876 | AB351: 1085 | AC351: =(AA351*100)/AB351 -> 80.737327188940085 | AD351: =(X351*4)+(Z351*2) -> 8
A352: BOX HILL | C352: EDWARDS | F352: NANKERVIS | I352: COOK | L352: RALPH | N352: LASKIE | Q352: COUTTS | W352: YARRAVILLE | X352: 2 | Y352: 6 | Z352: 0 | AA352: 736 | AB352: 997 | AC352: =(AA352*100)/AB352 -> 73.821464393179539 | AD352: =(X352*4)+(Z352*2) -> 8
A353: GOALKICKERS | W353: BOX HILL | X353: 1 | Y353: 7 | Z353: 0 | AA353: 657 | AB353: 976 | AC353: =(AA353*100)/AB353 -> 67.31557377049181 | AD353: =(X353*4)+(Z353*2) -> 4
A354: YARRAVILLE | C354: GREENEY 3 | F354: RYAN 2 | H354: R WILKINSON 2 | K354: SH ? | M354: BARR | O354: LOWE | Q354: WHITTINGTON | U354: P
A355: BOX HILL | C355: RALPH 3 | F355: BRYANT 2 | I355: LASKIE 2 | K355: WALTER 2 | N355: COHEN | P355: McFARLANE
A357: CAMBERWELL | C357: 4 | D357: 3 | E357: =C357*6+D357 -> 27 | G357: 8 | H357: 9 | I357: =G357*6+H357 -> 57 | K357: 12 | L357: 15 | M357: =K357*6+L357 -> 87 | O357: 17 | P357: 15 | Q357: =O357*6+P357 -> 117 | S357: CAMBERWELL
A358: NORTHCOTE | C358: 4 | D358: 3 | E358: =C358*6+D358 -> 27 | G358: 6 | H358: 5 | I358: =G358*6+H358 -> 41 | K358: 12 | L358: 9 | M358: =K358*6+L358 -> 81 | O358: 14 | P358: 12 | Q358: =O358*6+P358 -> 96 | S358: TORNEY
A359: BEST PLAYERS
A360: CAMBERWELL | C360: PARSONS | F360: HAZLETT | I360: ATKINS? | L360: STOREY | N360: SIMPSON | Q360: CUTTING
A361: NORTHCOTE | C361: JAMES | F361: CHAPMAN | I361: KOZARIS | L361: LEECH | N361: HOGG | Q361: NANKERVIS
A362: GOALKICKERS
A363: CAMBERWELL | C363: MOORE 4 | E363: SIMPSON 3 | H363: BRYCE 3 | J363: HAZLETT 2 | M363: HAMMOND 2 | P363: TIPPING | R363: WILSON | U363: ?
A364: NORTHCOTE | C364: CHAPMAN 9 | F364: RYAN 4 | I364: HOGG
A366: WERRIBEE | C366: 3 | D366: 4 | E366: =C366*6+D366 -> 22 | G366: 6 | H366: 9 | I366: =G366*6+H366 -> 45 | K366: 10 | L366: 15 | M366: =K366*6+L366 -> 75 | O366: 12 | P366: 17 | Q366: =O366*6+P366 -> 89 | S366: WERRIBEE
A367: FRANKSTON | C367: 3 | D367: 4 | E367: =C367*6+D367 -> 22 | G367: 4 | H367: 7 | I367: =G367*6+H367 -> 31 | K367: 6 | L367: 9 | M367: =K367*6+L367 -> 45 | O367: 11 | P367: 11 | Q367: =O367*6+P367 -> 77 | S367: McBAIN
A368: BEST PLAYERS
A369: WERRIBEE | C369: WHITEHEAD | F369: BUTTON | I369: MONTGOMERY | L369: MITCHELL | O369: HAMBLIN | R369: MORRIS
A370: FRANKSTON | C370: BOND | F370: JOY | I370: HALE | L370: ROWE
A371: GOALKICKERS
A372: WERRIBEE | C372: MITCHELL 4 | F372: NORTON 3 | I372: MORRIS 2 | K372: SCHIELE 2 | N372: B WHITEHEAD
A373: FRANKSTON | C373: POPE 3 | E373: CAFFYN 2 | G373: LOVELOCK 2 | J373: FITZGERALD | M373: FALKINER | O373: SHEPHERD | R373: ELLIS
A375: COBURG | C375: 6 | D375: 3 | E375: =C375*6+D375 -> 39 | G375: 12 | H375: 10 | I375: =G375*6+H375 -> 82 | K375: 17 | L375: 6 | M375: =K375*6+L375 -> 108 | O375: 22 | P375: 17 | Q375: =O375*6+P375 -> 149 | S375: BRUNSWICK
A376: BRUNSWICK | C376: 2 | D376: 7 | E376: =C376*6+D376 -> 19 | G376: 4 | H376: 9 | I376: =G376*6+H376 -> 33 | K376: 7 | L376: 11 | M376: =K376*6+L376 -> 53 | O376: 15 | P376: 12 | Q376: =O376*6+P376 -> 102 | S376: GAMBETTA
A377: BEST PLAYERS
A378: COBURG | C378: ROBINSON | F378: LAKE | I378: S McCARTHY | L378: GALE | O378: SMITH | R378: BROWN
A379: BRUNSWICK | C379: O'CONNOR | F379: FEWSTER | I379: ALLAN | L379: DIMATTINA | O379: GUEST | R379: BRIGHAM
A380: GOALKICKERS
A381: COBURG | C381: SMITH 6 | F381: ? 4 | I381: MORRISON 3 | L381: BROWN 2 | N381: S McCARTHY 2 | Q381: McGRATH 2 | S381: HOBBS | U381: ? 1 | W381: HOPGOOD
A382: BRUNSWICK | C382: ALLAN 4 | F382: DIMATTINA 3 | I382: O'CONNOR 2 | L382: VALENTINE 2 | O382: BRIGHAM 2 | R382: WROUT | U382: HANTON
A384: ROUND 9 | E384: 9TH JUNE | J384: WEATHER | S384: PLAYED AT
D385: 1ST QTR | H385: 2ND QTR | L385: 3RD QTR | P385: FINAL | S385: NORTHCOTE
A386: NORTHCOTE | C386: 1 | D386: 3 | E386: =C386*6+D386 -> 9 | G386: 5 | H386: 8 | I386: =G386*6+H386 -> 38 | K386: 7 | L386: 11 | M386: =K386*6+L386 -> 53 | O386: 12 | P386: 14 | Q386: =O386*6+P386 -> 86 | S386: UMPIRE | X386: LADDER | AB386: ROUND | AD386: 9
A387: YARRAVILLE | C387: 3 | D387: 1 | E387: =C387*6+D387 -> 19 | G387: 6 | H387: 3 | I387: =G387*6+H387 -> 39 | K387: 10 | L387: 10 | M387: =K387*6+L387 -> 70 | O387: 12 | P387: 12 | Q387: =O387*6+P387 -> 84 | S387: O'BRIEN
A388: BEST PLAYERS | W388: TEAM | X388: W | Y388: L | Z388: D | AA388: FOR | AB388: AGST | AC388: % | AD388: PTS
A389: NORTHCOTE | C389: McNEILL | F389: KOZARIS | I389: NANKERVIS | L389: THORNELOE | O389: McARDLE | R389: CHAPMAN
A390: YARRAVILLE | C390: T SMITH | F390: COLEMAN | I390: SQUIRE | L390: WHITTINGTON | O390: BARR | R390: JOSLIN | W390: WAVERLEY | X390: 9 | Y390: 0 | Z390: 0 | AA390: 1162 | AB390: 816 | AC390: =(AA390*100)/AB390 -> 142.40196078431373 | AD390: =(X390*4)+(Z390*2) -> 36
A391: GOALKICKERS | W391: COBURG | X391: 8 | Y391: 1 | Z391: 0 | AA391: 1353 | AB391: 773 | AC391: =(AA391*100)/AB391 -> 175.03234152652004 | AD391: =(X391*4)+(Z391*2) -> 32
A392: NORTHCOTE | C392: CHAPMAN 5 | F392: HOUGH 3 | I392: RYAN 2 | K392: WATT | M392: McNEILL | W392: CAMBERWELL | X392: 6 | Y392: 3 | Z392: 0 | AA392: 1019 | AB392: 906 | AC392: =(AA392*100)/AB392 -> 112.47240618101546 | AD392: =(X392*4)+(Z392*2) -> 24
A393: YARRAVILLE | C393: BARR 3 | E393: GREENEY 2 | H393: R WILKINSON 2 | K393: B WILKINSON 2 | N393: BROPHY | P393: MARTIN | R393: RYAN | W393: BRUNSWICK | X393: 6 | Y393: 3 | Z393: 0 | AA393: 1009 | AB393: 904 | AC393: =(AA393*100)/AB393 -> 111.61504424778761 | AD393: =(X393*4)+(Z393*2) -> 24
A395: COBURG | C395: 8 | D395: 6 | E395: =C395*6+D395 -> 54 | G395: 11 | H395: 13 | I395: =G395*6+H395 -> 79 | K395: 20 | L395: 20 | M395: =K395*6+L395 -> 140 | O395: 26 | P395: 24 | Q395: =O395*6+P395 -> 180 | S395: COBURG | W395: WERRIBEE | X395: 4 | Y395: 5 | Z395: 0 | AA395: 843 | AB395: 920 | AC395: =(AA395*100)/AB395 -> 91.630434782608702 | AD395: =(X395*4)+(Z395*2) -> 16
A396: MORDIALLOC | C396: 0 | D396: 3 | E396: =C396*6+D396 -> 3 | G396: 3 | H396: 5 | I396: =G396*6+H396 -> 23 | K396: 4 | L396: 5 | M396: =K396*6+L396 -> 29 | O396: 7 | P396: 7 | Q396: =O396*6+P396 -> 49 | S396: WENN | W396: NORTHCOTE | X396: 4 | Y396: 5 | Z396: 0 | AA396: 885 | AB396: 985 | AC396: =(AA396*100)/AB396 -> 89.847715736040612 | AD396: =(X396*4)+(Z396*2) -> 16
A397: BEST PLAYERS | W397: FRANKSTON | X397: 3 | Y397: 6 | Z397: 0 | AA397: 998 | AB397: 1175 | AC397: =(AA397*100)/AB397 -> 84.936170212765958 | AD397: =(X397*4)+(Z397*2) -> 12
A398: COBURG | C398: GALE | F398: SMITH | I398: SLATER | L398: MANNIX | O398: ARTHURSON | R398: ROBINSON | W398: MORDIALLOC | X398: 2 | Y398: 7 | Z398: 0 | AA398: 880 | AB398: 1026 | AC398: =(AA398*100)/AB398 -> 85.769980506822606 | AD398: =(X398*4)+(Z398*2) -> 8
A399: MORDIALLOC | C399: THOMPSON | F399: GUY | I399: JOHNSTONE | L399: WILKINS | O399: SCAIFFE | R399: GAWNE | W399: YARRAVILLE | X399: 2 | Y399: 7 | Z399: 0 | AA399: 820 | AB399: 1083 | AC399: =(AA399*100)/AB399 -> 75.715604801477383 | AD399: =(X399*4)+(Z399*2) -> 8
A400: GOALKICKERS | W400: BOX HILL | X400: 1 | Y400: 8 | Z400: 0 | AA400: 716 | AB400: 1097 | AC400: =(AA400*100)/AB400 -> 65.268915223336379 | AD400: =(X400*4)+(Z400*2) -> 4
A401: COBURG | C401: SMITH 9 | E401: GALE 4 | G401: MANNIX 4 | J401: MORRISON 3 | M401: McCARTHY | O401: BREEN | Q401: LUKE | R401: LAKE | S401: HOPGGOD | U401: BROWN
A402: MORDIALLOC | C402: WILKINS 2 | F402: SCAIFFE | I402: O'CONNOR | L402: SMITH | N402: BASTIAN | Q402: JOHNSTONE
A404: WAVERLEY | C404: 4 | D404: 2 | E404: =C404*6+D404 -> 26 | G404: 6 | H404: 17 | I404: =G404*6+H404 -> 53 | K404: 6 | L404: 20 | M404: =K404*6+L404 -> 56 | O404: 15 | P404: 22 | Q404: =O404*6+P404 -> 112 | S404: WAVERLEY
A405: WERRIBEE | C405: 3 | D405: 7 | E405: =C405*6+D405 -> 25 | G405: 4 | H405: 8 | I405: =G405*6+H405 -> 32 | K405: 10 | L405: 16 | M405: =K405*6+L405 -> 76 | O405: 11 | P405: 18 | Q405: =O405*6+P405 -> 84 | S405: MURLEY
A406: BEST PLAYERS
A407: WAVERLEY | C407: HOCKING | F407: ZIESLER | I407: FERGUSON | L407: B ALLAN | O407: LUMLEY | R407: HORKINGS
A408: WERRIBEE | C408: McLEOD | F408: HAMBLIN | I408: PAICE | L408: BOURKE | O408: BUTTON | R408: HARVEY
A409: GOALKICKERS
A410: WAVERLEY | C410: ZIESLER 6 | F410: MCNAMEE 2 | I410: STONE 2 | K410: SMEDTS 2 | N410: HORKINGS | Q410: PARKS | S410: B ALLAN
A411: WERRIBEE | C411: MITCHELL 4 | F411: BUTTON 3 | I411: HAMBLIN | K411: MORRIS | M411: SCHIELE | O411: NORTON
A413: FRANKSTON | C413: 5 | D413: 1 | E413: =C413*6+D413 -> 31 | G413: 6 | H413: 4 | I413: =G413*6+H413 -> 40 | K413: 12 | L413: 7 | M413: =K413*6+L413 -> 79 | O413: 18 | P413: 14 | Q413: =O413*6+P413 -> 122 | S413: FRANKSTON
A414: BRUNSWICK | C414: 2 | D414: 1 | E414: =C414*6+D414 -> 13 | G414: 9 | H414: 10 | I414: =G414*6+H414 -> 64 | K414: 11 | L414: 13 | M414: =K414*6+L414 -> 79 | O414: 12 | P414: 18 | Q414: =O414*6+P414 -> 90 | S414: DAVIS
A415: BEST PLAYERS
A416: FRANKSTON | C416: FITZGERALD | F416: LOVELOCK | I416: LOCCO | L416: ROSENBROCK | O416: BLOOMFIELD | R416: ROWE
A417: BRUNSWICK | C417: O'CONNOR | F417: MILLER | I417: JOSEPH | L417: FEWSTER | O417: WROUT | R417: SKIDMORE
A418: BRUNSWICK
A419: FRANKSTON | C419: FITZGERALD 6 | F419: LOVELOCK 5 | I419: SHEPHERD 3 | L419: BLOOMFIELD 2 | O419: DOHERTY | Q419: BRIESE
A420: BRUNSWICK | C420: BRIGHAM 2 | F420: DIMATTINA 2 | I420: BURROWS 2 | L420: BAIRD 2 | N420: ALLAN | P420: O'CONNOR | R420: WROUT | U420: STILO
A422: CAMBERWELL | C422: 1 | D422: 4 | E422: =C422*6+D422 -> 10 | G422: 8 | H422: 8 | I422: =G422*6+H422 -> 56 | K422: 11 | L422: 9 | M422: =K422*6+L422 -> 75 | O422: 18 | P422: 13 | Q422: =O422*6+P422 -> 121 | S422: BOX HILL
A423: BOX HILL | C423: 1 | D423: 4 | E423: =C423*6+D423 -> 10 | G423: 4 | H423: 4 | I423: =G423*6+H423 -> 28 | K423: 8 | L423: 5 | M423: =K423*6+L423 -> 53 | O423: 9 | P423: 5 | Q423: =O423*6+P423 -> 59 | S423: HAYES
A424: BEST PLAYERS
A425: CAMBERWELL | C425: KENNEDY | F425: BRYCE | I425: SAUERBERG | L425: PARSONS | O425: WILSON | Q425: MOORE
A426: BOX HILL | C426: RDWARDS | F426: COUTTS | I426: NANKERVIS | L426: TAYLOR | O426: McCANN
A427: GOALKICKERS
A428: CAMBERWELL | C428: KENNEDY 6 | F428: BRYCE 3 | H428: STONE 2 | J428: SIMPSON 2 | L428: STOREY 2 | N428: HAMMOND | P428: HAZLETT | R428: KENNEDY?
A429: BOX HILL | C429: RALPH 3 | F429: LASKIE 3 | I429: COOK 2 | K429: TAYLOR
A431: ROUND 10 | E431: 16TH JUNE | J431: WEATHER | S431: PLAYED AT
D432: 1ST QTR | H432: 2ND QTR | L432: 3RD QTR | P432: FINAL | S432: MORDIALLOC
A433: MORDIALLOC | C433: 3 | D433: 6 | E433: =C433*6+D433 -> 24 | G433: 16 | H433: 11 | I433: =G433*6+H433 -> 107 | K433: 23 | L433: 11 | M433: =K433*6+L433 -> 149 | O433: 29 | P433: 13 | Q433: =O433*6+P433 -> 187 | S433: UMPIRE | X433: LADDER | AB433: ROUND | AD433: 10
A434: BOX HILL | C434: 1 | D434: 4 | E434: =C434*6+D434 -> 10 | G434: 8 | H434: 5 | I434: =G434*6+H434 -> 53 | K434: 14 | L434: 7 | M434: =K434*6+L434 -> 91 | O434: 14 | P434: 9 | Q434: =O434*6+P434 -> 93 | S434: ABBOTT
A435: BEST PLAYERS | W435: TEAM | X435: W | Y435: L | Z435: D | AA435: FOR | AB435: AGST | AC435: % | AD435: PTS
A436: MORDIALLOC | C436: HARRY | F436: BASKIN | I436: SCAIFFE | L436: BASTIAN | O436: WOOTTEN | R436: JOHNSTONE
A437: BOX HILL | C437: NANKERVIS | F437: CURTIS | I437: LASKIE | L437: EDWARDS | O437: McCANN | R437: RALPH | W437: COBURG | X437: 9 | Y437: 1 | Z437: 0 | AA437: 1517 | AB437: 862 | AC437: =(AA437*100)/AB437 -> 175.98607888631091 | AD437: =(X437*4)+(Z437*2) -> 36
A438: GOALKICKERS | S438: GUY | W438: WAVERLEY | X438: 9 | Y438: 1 | Z438: 0 | AA438: 1237 | AB438: 1015 | AC438: =(AA438*100)/AB438 -> 121.87192118226601 | AD438: =(X438*4)+(Z438*2) -> 36
A439: MORDIALLOC | C439: HARRY 9 | E439: BASKIN 6 | G439: WOOTTEN 4 | J439: LANG 2 | L439: BASTIAN 2 | O439: JOHNSTONE 2 | R439: GREEN 2 | T439: WILKINS | W439: CAMBERWELL | X439: 7 | Y439: 3 | Z439: 0 | AA439: 1218 | AB439: 981 | AC439: =(AA439*100)/AB439 -> 124.15902140672783 | AD439: =(X439*4)+(Z439*2) -> 28
A440: BOX HILL | C440: LASKIE 7 | F440: BAKER 2 | I440: CURTIS 2 | K440: COHEN | M440: COOK | W440: BRUNSWICK | X440: 7 | Y440: 3 | Z440: 0 | AA440: 1153 | AB440: 1003 | AC440: =(AA440*100)/AB440 -> 114.95513459621137 | AD440: =(X440*4)+(Z440*2) -> 28
A442: FRANKSTON | C442: 3 | D442: 6 | E442: =C442*6+D442 -> 24 | G442: 7 | H442: 9 | I442: =G442*6+H442 -> 51 | K442: 10 | L442: 14 | M442: =K442*6+L442 -> 74 | O442: 17 | P442: 21 | Q442: =O442*6+P442 -> 123 | S442: YARRAVILLE | W442: FRANKSTON | X442: 4 | Y442: 6 | Z442: 0 | AA442: 1121 | AB442: 1277 | AC442: =(AA442*100)/AB442 -> 87.783868441660147 | AD442: =(X442*4)+(Z442*2) -> 16
A443: YARRAVILLE | C443: 4 | D443: 2 | E443: =C443*6+D443 -> 26 | G443: 8 | H443: 7 | I443: =G443*6+H443 -> 55 | K443: 11 | L443: 9 | M443: =K443*6+L443 -> 75 | O443: 15 | P443: 12 | Q443: =O443*6+P443 -> 102 | S443: HAYES | W443: NORTHCOTE | X443: 4 | Y443: 6 | Z443: 0 | AA443: 984 | AB443: 1129 | AC443: =(AA443*100)/AB443 -> 87.156775907883087 | AD443: =(X443*4)+(Z443*2) -> 16
A444: BEST PLAYERS | W444: WERRIBEE | X444: 4 | Y444: 6 | Z444: 0 | AA444: 932 | AB444: 1084 | AC444: =(AA444*100)/AB444 -> 85.977859778597789 | AD444: =(X444*4)+(Z444*2) -> 16
A445: FRANKSTON | C445: BOND | F445: MARTELLA | I445: STAPLETON | L445: HALE | O445: SKREJA | W445: MORDIALLOC | X445: 3 | Y445: 7 | Z445: 0 | AA445: 1067 | AB445: 1119 | AC445: =(AA445*100)/AB445 -> 95.352993744414661 | AD445: =(X445*4)+(Z445*2) -> 12
A446: YARRAVILLE | C446: R WILKINSON | F446: WHITTINGTON | I446: SHIELDS | L446: SMITH | O446: MARTIN | R446: BARR | W446: YARRAVILLE | X446: 2 | Y446: 8 | Z446: 0 | AA446: 922 | AB446: 1206 | AC446: =(AA446*100)/AB446 -> 76.45107794361526 | AD446: =(X446*4)+(Z446*2) -> 8
A447: GOALKICKERS | W447: BOX HILL | X447: 1 | Y447: 9 | Z447: 0 | AA447: 809 | AB447: 1284 | AC447: =(AA447*100)/AB447 -> 63.006230529595015 | AD447: =(X447*4)+(Z447*2) -> 4
A448: FRANKSTON | C448: SKREJA 4 | E448: BRIESE 3 | G448: FITZGERALD 2 | J448: STAPLETON 2 | M448: FALKINER 2 | O448: DOHERTY 2 | R448: RIDSDALE | T448: SHEPHERD
A449: YARRAVILLE | C449: R WILKINSON 4 | F449: LOWE 2 | H449: BROPHY 2 | J449: MARTIN 2 | M449: B WILKINSON 2 | P449: CONDUIT | R449: HOWDEN | U449: BARR
A451: CAMBERWELL | C451: 7 | D451: 3 | E451: =C451*6+D451 -> 45 | G451: 19 | H451: 4 | I451: =G451*6+H451 -> 118 | K451: 25 | L451: 5 | M451: =K451*6+L451 -> 155 | O451: 31 | P451: 13 | Q451: =O451*6+P451 -> 199 | S451: CAMBERWELL
A452: WAVERLEY | C452: 3 | D452: 4 | E452: =C452*6+D452 -> 22 | G452: 5 | H452: 7 | I452: =G452*6+H452 -> 37 | K452: 8 | L452: 11 | M452: =K452*6+L452 -> 59 | O452: 10 | P452: 15 | Q452: =O452*6+P452 -> 75 | S452: GAMBETTA
A453: BEST PLAYERS
A454: CAMBERWELL | C454: MOORE | F454: STONE | I454: ATKINSON | L454: HAZLETT | O454: SAUERBERG | R454: KARVELIS
A455: WAVERLEY | C455: FERGUSON | F455: SYKES | I455: SMEDTS | L455: HOCKING | O455: HORKINGS | R455: PARKS
A456: GOALKICKERS
A457: CAMBERWELL | C457: MOORE 8 | E457: STONE 7 | G457: SIMPSON 4 | I457: KARVELIS 4 | L457: HAMMOND 3 | O457: HAZLETT 3 | Q457: BRYCE | S457: FOX
A458: WAVERLEY | C458: ZIESLER 2 | E458: HORKINGS 2 | H458: HARRY 2 | J458: McNAMEE | M458: B ALLAN | O458: HANCOCK | R458: PARKS
A460: COBURG | C460: 8 | D460: 4 | E460: =C460*6+D460 -> 52 | G460: 14 | H460: 6 | I460: =G460*6+H460 -> 90 | K460: 20 | L460: 8 | M460: =K460*6+L460 -> 128 | O460: 25 | P460: 14 | Q460: =O460*6+P460 -> 164 | S460: WERRIBEE
A461: WERRIBEE | C461: 2 | D461: 3 | E461: =C461*6+D461 -> 15 | G461: 7 | H461: 6 | I461: =G461*6+H461 -> 48 | K461: 10 | L461: 8 | M461: =K461*6+L461 -> 68 | O461: 13 | P461: 11 | Q461: =O461*6+P461 -> 89 | S461: HUGGINS
A462: BEST PLAYERS
A463: COBURG | C463: SMITH | F463: LAKE | I463: HOPGOOD | L463: ROBINSON | O463: HOWELL | R463: BREEN
A464: WERRIBEE | C464: MORRIS | F464: McLEOD | I464: WHITEHEAD | L464: HAMBLIN | O464: HARVEY | R464: JOHNSTON
A465: GOALKICKERS
A466: COBURG | C466: SMITH 8 | F466: LAKE 6 | H466: HOPGOOD 3 | K466: MORRISON 3 | N466: HOBBS 2 | P466: LUKE 2 | R466: BREEN
A467: WERRIBEE | C467: MORRIS 4 | F467: WHITEHEAD 2 | I467: CALAZ 2 | K467: DOUGLAS | M467: HAMBLIN | O467: MITCHELL | Q467: NORTON | T467: 1 SHORT
A469: BRUNSWICK | C469: 7 | D469: 3 | E469: =C469*6+D469 -> 45 | G469: 16 | H469: 5 | I469: =G469*6+H469 -> 101 | K469: 20 | L469: 9 | M469: =K469*6+L469 -> 129 | O469: 22 | P469: 12 | Q469: =O469*6+P469 -> 144 | S469: BRUNSWICK
A470: NORTHCOTE | C470: 4 | D470: 4 | E470: =C470*6+D470 -> 28 | G470: 8 | H470: 4 | I470: =G470*6+H470 -> 52 | K470: 13 | L470: 5 | M470: =K470*6+L470 -> 83 | O470: 15 | P470: 9 | Q470: =O470*6+P470 -> 99 | S470: WENN
A471: BEST PLAYERS
A472: BRUNSWICK | C472: BAIRD | F472: BRIGHAM | I472: O'CONNOR | L472: GUEST | N472: VALENTINE | Q472: STILO
A473: NORTHCOTE | C473: JAMES | F473: CHAPMAN | I473: REDENBACH | L473: RYAN | N473: McNEILL | Q473: McARDLE
A474: GOALKICKERS
A475: BRUNSWICK | C475: BAIRD 11 | F475: BRIGHAM 3 | I475: ALLAN 2 | K475: ORTON 2 | M475: VALENTINE 2 | P475: STILO | R475: O'CONNOR
A476: NORTHCOTE | C476: CHAPMAN 7 | F476: BIENKE 2 | H476: WATT | J476: KOZARIS | L476: NANKERVIS | O476: McNEILL | Q476: RYAN | S476: DOBSON
A478: ROUND 11 | E478: 23RD JUNE | J478: WEATHER | S478: PLAYED AT
D479: 1ST QTR | H479: 2ND QTR | L479: 3RD QTR | P479: FINAL | S479: NORTHCOTE
A480: NORTHCOTE | C480: 3 | D480: 1 | E480: =C480*6+D480 -> 19 | G480: 11 | H480: 9 | I480: =G480*6+H480 -> 75 | K480: 15 | L480: 12 | M480: =K480*6+L480 -> 102 | O480: 21 | P480: 18 | Q480: =O480*6+P480 -> 144 | S480: UMPIRE | X480: LADDER | AB480: ROUND | AD480: 11
A481: WERRIBEE | C481: 7 | D481: 1 | E481: =C481*6+D481 -> 43 | G481: 8 | H481: 4 | I481: =G481*6+H481 -> 52 | K481: 14 | L481: 9 | M481: =K481*6+L481 -> 93 | O481: 16 | P481: 12 | Q481: =O481*6+P481 -> 108 | S481: HAYES
A482: BEST PLAYERS | W482: TEAM | X482: W | Y482: L | Z482: D | AA482: FOR | AB482: AGST | AC482: % | AD482: PTS
A483: NORTHCOTE | C483: NANKERVIS | F483: CHAPMAN | I483: RYAN | K483: REDENBACH | N483: McARDLE | Q483: McNEILL
A484: WERRIBEE | C484: WHITEHEAD | F484: SHIELE | I484: BUTTON | K484: CALAZ | N484: PAICE | Q484: YOUNG | W484: COBURG | X484: 10 | Y484: 1 | Z484: 0 | AA484: 1663 | AB484: 974 | AC484: =(AA484*100)/AB484 -> 170.73921971252568 | AD484: =(X484*4)+(Z484*2) -> 40
A485: GOALKICKERS | W485: WAVERLEY | X485: 10 | Y485: 1 | Z485: 0 | AA485: 1248 | AB485: 1093 | AC485: =(AA485*100)/AB485 -> 114.1811527904849 | AD485: =(X485*4)+(Z485*2) -> 40
A486: NORTHCOTE | C486: CHAPMAN 8 | F486: RYAN 7 | H486: BIENKE 2 | J486: HOUGH 2 | L486: NANKERVIS | O486: STILSBY | W486: BRUNSWICK | X486: 8 | Y486: 3 | Z486: 0 | AA486: 1315 | AB486: 1092 | AC486: =(AA486*100)/AB486 -> 120.42124542124542 | AD486: =(X486*4)+(Z486*2) -> 32
A487: WERRIBEE | C487: SCHIELE 5 | E487: CALAZ 3 | G487: WHITEHEAD 2 | J487: JOHNSON | L487: McLEOD | N487: MORRIS | P487: F MITCHELL | S487: N MITCHELL | W487: CAMBERWELL | X487: 7 | Y487: 4 | Z487: 0 | AA487: 1330 | AB487: 1127 | AC487: =(AA487*100)/AB487 -> 118.01242236024845 | AD487: =(X487*4)+(Z487*2) -> 28
M488: BOURKE
A489: WAVERLEY | C489: 5 | D489: 9 | E489: =C489*6+D489 -> 39 | G489: 11 | H489: 15 | I489: =G489*6+H489 -> 81 | K489: 15 | L489: 23 | M489: =K489*6+L489 -> 113 | O489: 22 | P489: 29 | Q489: =O489*6+P489 -> 161 | S489: WAVERLEY | W489: FRANKSTON | X489: 5 | Y489: 6 | Z489: 0 | AA489: 1282 | AB489: 1404 | AC489: =(AA489*100)/AB489 -> 91.310541310541311 | AD489: =(X489*4)+(Z489*2) -> 20
A490: YARRAVILLE | C490: 3 | D490: 1 | E490: =C490*6+D490 -> 19 | G490: 6 | H490: 3 | I490: =G490*6+H490 -> 39 | K490: 9 | L490: 4 | M490: =K490*6+L490 -> 58 | O490: 12 | P490: 6 | Q490: =O490*6+P490 -> 78 | S490: DAVIS | W490: NORTHCOTE | X490: 5 | Y490: 6 | Z490: 0 | AA490: 1128 | AB490: 1237 | AC490: =(AA490*100)/AB490 -> 91.188358932902176 | AD490: =(X490*4)+(Z490*2) -> 20
A491: BEST PLAYERS | W491: WERRIBEE | X491: 4 | Y491: 7 | Z491: 0 | AA491: 1040 | AB491: 1228 | AC491: =(AA491*100)/AB491 -> 84.690553745928341 | AD491: =(X491*4)+(Z491*2) -> 16
A492: WAVERLEY | C492: STONE | F492: FERGUSON | I492: HORKINGS | L492: HARRY | N492: SMEDTS | Q492: MILES | W492: MORDIALLOC | X492: 3 | Y492: 8 | Z492: 0 | AA492: 1194 | AB492: 1280 | AC492: =(AA492*100)/AB492 -> 93.28125 | AD492: =(X492*4)+(Z492*2) -> 12
A493: YARRAVILLE | C493: JOSLIN | F493: JANES | I493: BARR | L493: SMITH | N493: WHITTINGTON | Q493: MARTIN | W493: YARRAVILLE | X493: 2 | Y493: 9 | Z493: 0 | AA493: 1000 | AB493: 1367 | AC493: =(AA493*100)/AB493 -> 73.152889539136794 | AD493: =(X493*4)+(Z493*2) -> 8
A494: GOALKICKERS | N494: STONE | P494: PARKS | W494: BOX HILL | X494: 1 | Y494: 10 | Z494: 0 | AA494: 898 | AB494: 1446 | AC494: =(AA494*100)/AB494 -> 62.102351313969571 | AD494: =(X494*4)+(Z494*2) -> 4
A495: WAVERLEY | C495: HORKINGS 7 | F495: HASTINGS 5 | I495: OWENS 2 | K495: SMEDTS 2 | M495: B ALLAN | O495: R ALLAN | Q495: HOCKING | S495: HARRY
A496: YARRAVILLE | C496: MARTIN 3 | F496: CURTIN 3 | I496: BARR 3 | K496: R WILKINSON | N496: B WILKINSON | Q496: CONDUIT
A498: COBURG | C498: 6 | D498: 1 | E498: =C498*6+D498 -> 37 | G498: 13 | H498: 4 | I498: =G498*6+H498 -> 82 | K498: 19 | L498: 5 | M498: =K498*6+L498 -> 119 | O498: 23 | P498: 8 | Q498: =O498*6+P498 -> 146 | S498: COBURG
A499: CAMBERWELL | C499: 5 | D499: 5 | E499: =C499*6+D499 -> 35 | G499: 10 | H499: 6 | I499: =G499*6+H499 -> 66 | K499: 11 | L499: 6 | M499: =K499*6+L499 -> 72 | O499: 17 | P499: 10 | Q499: =O499*6+P499 -> 112 | S499: O'BRIEN
A500: BEST PLAYERS
A501: COBURG | C501: HOPGOOD | F501: GALE | I501: BRENNAN | L501: LAKE | N501: SMITH | Q501: HOBBS
A502: CAMBERWELL | C502: WILSON | F502: SIMPSON | I502: BRYCE | L502: STOREY | N502: KARVELIS | Q502: SPITHILL
A503: GOALKICKERS
A504: COBURG | C504: LAKE 7 | E504: SMITH 5 | G504: GALE 4 | I504: HOPGOOD 3 | L504: LUKE 2 | N504: P McCARTHY | Q504: HOBBS
A505: CAMBERWELL | C505: ANDREWS 4 | F505: SIMPSON 4 | I505: BRYCE 2 | K505: STONE 2 | M505: SAUERBERG | P505: STOREY | R505: KENNEDY | U505: DUGGAN
A507: FRANKSTON | C507: 3 | D507: 4 | E507: =C507*6+D507 -> 22 | G507: 12 | H507: 10 | I507: =G507*6+H507 -> 82 | K507: 18 | L507: 17 | M507: =K507*6+L507 -> 125 | O507: 24 | P507: 17 | Q507: =O507*6+P507 -> 161 | S507: FRANKSTON
A508: MORDIALLOC | C508: 6 | D508: 7 | E508: =C508*6+D508 -> 43 | G508: 10 | H508: 8 | I508: =G508*6+H508 -> 68 | K508: 14 | L508: 11 | M508: =K508*6+L508 -> 95 | O508: 19 | P508: 13 | Q508: =O508*6+P508 -> 127 | S508: GAMBETTA
A509: BEST PLAYERS
A510: FRANKSTON | C510: MARTELLA | F510: FALKINER | I510: JOY | L510: FITZGERALD | O510: BLOOMFIELD | R510: BOND
A511: MORDIALLOC | C511: SCAIFFE | F511: WILKINS | I511: GUY | L511: HARRY | O511: McFARLAND | R511: LANG
A512: GOALKICKERS
A513: FRANKSTON | C513: FITZGERALD 7 | F513: FALKINER 5 | I513: DOHERTY 4 | L513: SKREJA 3 | N513: BLOOMFIELD | Q513: RIDSDALE | S513: SHEPHERD | V513: BRIESE | X513: BOND
A514: MORDIALLOC | C514: SCAIFFE 4 | F514: BASTIAN 4 | I514: HARRY 3 | K514: BASKIN 3 | M514: WILKINS 2 | P514: JOHNSTONE | S514: SHUGG | V514: LANG
A516: BRUNSWICK | C516: 7 | D516: 4 | E516: =C516*6+D516 -> 46 | G516: 13 | H516: 9 | I516: =G516*6+H516 -> 87 | K516: 19 | L516: 15 | M516: =K516*6+L516 -> 129 | O516: 24 | P516: 18 | Q516: =O516*6+P516 -> 162 | S516: BOX HILL
A517: BOX HILL | C517: 1 | D517: 0 | E517: =C517*6+D517 -> 6 | G517: 6 | H517: 3 | I517: =G517*6+H517 -> 39 | K517: 10 | L517: 4 | M517: =K517*6+L517 -> 64 | O517: 14 | P517: 5 | Q517: =O517*6+P517 -> 89 | S517: HUGGINS
A518: BEST PLAYERS
A519: BRUNSWICK | C519: ORTON | F519: BRIGHAM | I519: STILO | L519: HADZILLIAS | O519: WROUT | Q519: GUEST
A520: BOX HILL | C520: EDWARDS | F520: CURTIS | I520: COUTTS | L520: NANKERVIS | O520: KING | Q520: EWAN
A521: GOALKICKERS
A522: BRUNSWICK | C522: ORTON 11 | F522: WROUT 3 | I522: ALLAN 3 | K522: STILO 2 | M522: VALENTINE | O522: BRIGHAM | R522: FEWSTER | T522: BURROWS | W522: O'CONNOR
A523: BOX HILL | C523: MAGILL 4 | F523: R LOVE 3 | I523: CURTIS 3 | K523: COCK | M523: BARNETT | O523: TAYLOR | Q523: McFARLAND
A525: ROUND 12 | E525: 30TH JUNE | J525: WEATHER | S525: PLAYED AT
D526: 1ST QTR | H526: 2ND QTR | L526: 3RD QTR | P526: FINAL | S526: MORDIALLOC
A527: NORTHCOTE | C527: 4 | D527: 5 | E527: =C527*6+D527 -> 29 | G527: 6 | H527: 11 | I527: =G527*6+H527 -> 47 | K527: 15 | L527: 12 | M527: =K527*6+L527 -> 102 | O527: 20 | P527: 20 | Q527: =O527*6+P527 -> 140 | S527: UMPIRE | X527: LADDER | AB527: ROUND | AD527: 12
A528: MORDIALLOC | C528: 5 | D528: 4 | E528: =C528*6+D528 -> 34 | G528: 11 | H528: 7 | I528: =G528*6+H528 -> 73 | K528: 13 | L528: 11 | M528: =K528*6+L528 -> 89 | O528: 13 | P528: 13 | Q528: =O528*6+P528 -> 91 | S528: HUGGINS
A529: BEST PLAYERS | W529: TEAM | X529: W | Y529: L | Z529: D | AA529: FOR | AB529: AGST | AC529: % | AD529: PTS
A530: NORTHCOTE | C530: CHAPMAN | F530: NANKERVIS | I530: AFFLECK | L530: DOBSON | O530: REDENBACH | R530: MCINTYRE
A531: MORDIALLOC | C531: JOHNSTONE | F531: LANG | I531: SCAIFFE | L531: BESANKO | O531: BASKIN | R531: WILKINS | W531: COBURG | X531: 11 | Y531: 1 | Z531: 0 | AA531: 1904 | AB531: 1029 | AC531: =(AA531*100)/AB531 -> 185.03401360544217 | AD531: =(X531*4)+(Z531*2) -> 44
A532: GOALKICKERS | W532: WAVERLEY | X532: 11 | Y532: 1 | Z532: 0 | AA532: 1423 | AB532: 1173 | AC532: =(AA532*100)/AB532 -> 121.31287297527707 | AD532: =(X532*4)+(Z532*2) -> 44
A533: NORTHCOTE | C533: CHAPMAN 10 | F533: HOUGH 3 | H533: DOBSON 2 | J533: GELLIE | K533: McNEILL | M533: BIENKE | O533: RYAN | Q533: NANKERVIS | W533: BRUNSWICK | X533: 9 | Y533: 3 | Z533: 0 | AA533: 1419 | AB533: 1184 | AC533: =(AA533*100)/AB533 -> 119.84797297297297 | AD533: =(X533*4)+(Z533*2) -> 36
A534: MORDIALLOC | C534: WILKINS 3 | E534: HARRY 3 | G534: BASKIN 3 | I534: WOOTTEN | L534: O'CONNOR | N534: SCAIFFE | P534: BASTIAN | W534: CAMBERWELL | X534: 8 | Y534: 4 | Z534: 0 | AA534: 1535 | AB534: 1212 | AC534: =(AA534*100)/AB534 -> 126.65016501650165 | AD534: =(X534*4)+(Z534*2) -> 32
A536: BRUNSWICK | C536: 1 | D536: 0 | E536: =C536*6+D536 -> 6 | G536: 8 | H536: 3 | I536: =G536*6+H536 -> 51 | K536: 13 | L536: 4 | M536: =K536*6+L536 -> 82 | O536: 16 | P536: 8 | Q536: =O536*6+P536 -> 104 | S536: YARRAVILLE | W536: NORTHCOTE | X536: 6 | Y536: 6 | Z536: 0 | AA536: 1268 | AB536: 1328 | AC536: =(AA536*100)/AB536 -> 95.481927710843379 | AD536: =(X536*4)+(Z536*2) -> 24
A537: YARRAVILLE | C537: 3 | D537: 8 | E537: =C537*6+D537 -> 26 | G537: 3 | H537: 9 | I537: =G537*6+H537 -> 27 | K537: 8 | L537: 12 | M537: =K537*6+L537 -> 60 | O537: 13 | P537: 14 | Q537: =O537*6+P537 -> 92 | S537: MURLEY | W537: FRANKSTON | X537: 5 | Y537: 7 | Z537: 0 | AA537: 1337 | AB537: 1645 | AC537: =(AA537*100)/AB537 -> 81.276595744680847 | AD537: =(X537*4)+(Z537*2) -> 20
A538: BEST PLAYERS | W538: WERRIBEE | X538: 4 | Y538: 8 | Z538: 0 | AA538: 1125 | AB538: 1433 | AC538: =(AA538*100)/AB538 -> 78.506629448709006 | AD538: =(X538*4)+(Z538*2) -> 16
A539: BRUNSWICK | C539: FORD | F539: VALENTINE | I539: BAIRD | L539: MILLER | N539: ORTON | Q539: RYAN | W539: MORDIALLOC | X539: 3 | Y539: 9 | Z539: 0 | AA539: 1285 | AB539: 1420 | AC539: =(AA539*100)/AB539 -> 90.492957746478879 | AD539: =(X539*4)+(Z539*2) -> 12
A540: YARRAVILLE | C540: RYAN | F540: LOWE | I540: JONES | L540: SMITH | N540: JOSLIN | Q540: MARTIN | W540: YARRAVILLE | X540: 2 | Y540: 10 | Z540: 0 | AA540: 1092 | AB540: 1471 | AC540: =(AA540*100)/AB540 -> 74.235214140040782 | AD540: =(X540*4)+(Z540*2) -> 8
A541: GOALKICKERS | W541: BOX HILL | X541: 1 | Y541: 11 | Z541: 0 | AA541: 978 | AB541: 1621 | AC541: =(AA541*100)/AB541 -> 60.333127698951266 | AD541: =(X541*4)+(Z541*2) -> 4
A542: BRUNSWICK | C542: BAIRD 8 | F542: ORTON 2 | H542: ALLAN 2 | J542: O'CONNOR 2 | M542: WROUT | O542: SCHIMMELBUSCH
A543: YARRAVILLE | C543: MARTIN 3 | F543: CONDUIT 3 | I543: SQUIRE 2 | K543: R WILKINSON | N543: RYAN | P543: JOSLIN | R543: LEWIS | T543: LOWE
A545: CAMBERWELL | C545: 6 | D545: 2 | E545: =C545*6+D545 -> 38 | G545: 15 | H545: 5 | I545: =G545*6+H545 -> 95 | K545: 21 | L545: 16 | M545: =K545*6+L545 -> 142 | O545: 31 | P545: 19 | Q545: =O545*6+P545 -> 205 | S545: CAMBERWELL
A546: WERRIBEE | C546: 6 | D546: 5 | E546: =C546*6+D546 -> 41 | G546: 10 | H546: 7 | I546: =G546*6+H546 -> 67 | K546: 11 | L546: 11 | M546: =K546*6+L546 -> 77 | O546: 12 | P546: 13 | Q546: =O546*6+P546 -> 85 | S546: DAVIS
A547: BEST PLAYERS
A548: CAMBERWELL | C548: ATKINSON | F548: ANDREWS | I548: BRYCE | L548: LINNELL | O548: SIMPSON | R548: TIPPING
A549: WERRIBEE | C549: McLEOD | F549: MITCHELL | I549: BOURKE | L549: WHITEHEAD | O549: NEWMAN | R549: BUTTON
A550: GOALKICKERS
A551: CAMBERWELL | C551: ANDREWS 11 | F551: SIMPSON 5 | H551: STONE 3 | J551: LINNELL 3 | L551: BRYCE 3 | N551: TIPPING 2 | P551: FOX 2 | R551: HAZLETT | T551: DUNGAN
A552: WERRIBEE | C552: MORRIS 3 | E552: SCHIELE 2 | G552: McLEOD 2 | J552: F MITCHELL 2 | M552: WHITEHEAD | P552: N MITCHELL | S552: BOURKE
A554: COBURG | C554: 12 | D554: 2 | E554: =C554*6+D554 -> 74 | G554: 18 | H554: 8 | I554: =G554*6+H554 -> 116 | K554: 27 | L554: 12 | M554: =K554*6+L554 -> 174 | O554: 37 | P554: 19 | Q554: =O554*6+P554 -> 241 | S554: COBURG
A555: FRANKSTON | C555: 2 | D555: 1 | E555: =C555*6+D555 -> 13 | G555: 6 | H555: 3 | I555: =G555*6+H555 -> 39 | K555: 6 | L555: 3 | M555: =K555*6+L555 -> 39 | O555: 8 | P555: 7 | Q555: =O555*6+P555 -> 55 | S555: ABBOTT
A556: BEST PLAYERS
A557: COBURG | C557: GALE | F557: SMITH | I557: LAKE | K557: SLATER | M557: HOPGOOD | P557: ROBINSON
A558: FRANKSTON | C558: EOWE | F558: SKREJA | I558: BOND | K558: GALE | M558: JOY | P558: BRIESE
A559: GOALKICKERS
A560: COBURG | C560: SMITH 11 | E560: LAKE 6 | G560: BRENNAN 4 | J560: MORRISON 3 | M560: HOBBS 3 | O560: BREEN 3 | Q560: GALE 3 | S560: LUKE 2 | U560: HOPGOOD | W560: MANNIX
A561: FRANKSTON | C561: SKREJA 2 | F561: SHEPHERD 2 | I561: BLOOMFIELD | L561: BEAMAN | N561: FITZGERALD | Q561: LOCCO
A563: WAVERLEY | C563: 5 | D563: 7 | E563: =C563*6+D563 -> 37 | G563: 10 | H563: 14 | I563: =G563*6+H563 -> 74 | K563: 18 | L563: 21 | M563: =K563*6+L563 -> 129 | O563: 25 | P563: 25 | Q563: =O563*6+P563 -> 175 | S563: BOX HILL
A564: BOX HILL | C564: 2 | D564: 3 | E564: =C564*6+D564 -> 15 | G564: 4 | H564: 5 | I564: =G564*6+H564 -> 29 | K564: 11 | L564: 5 | M564: =K564*6+L564 -> 71 | O564: 12 | P564: 8 | Q564: =O564*6+P564 -> 80 | S564: FITZPATRICK
A565: BEST PLAYERS
A566: WAVERLEY | C566: COSTELLO | F566: STONE | I566: SMEDTS | L566: MILES | O566: OWENS | R566: PARKS
A567: BOX HILL | C567: WATERS | F567: ZANTUCK | I567: KING | L567: MAGILL | O567: EDWARDS | R567: PIERCE
A568: GOALKICKERS
A569: WAVERLEY | C569: COSTELLO 9 | F569: ZIESLER 7 | I569: HARRY 3 | K569: OWENS 2 | M569: PARKS 2 | O569: R ALLAN | Q569: SMEDTS
A570: BOX HILL | C570: MAGILL 7 | F570: ZANTUCK 3 | I570: RALPH | K570: CURTIS
A572: ROUND 13 | E572: 7TH JULY | J572: WEATHER | S572: PLAYED AT
D573: 1ST QTR | H573: 2ND QTR | L573: 3RD QTR | P573: FINAL | S573: WERRIBEE
A574: YARRAVILLE | C574: 0 | D574: 0 | E574: =C574*6+D574 -> 0 | G574: 0 | H574: 0 | I574: =G574*6+H574 -> 0 | K574: 0 | L574: 0 | M574: =K574*6+L574 -> 0 | O574: 13 | P574: 14 | Q574: =O574*6+P574 -> 92 | S574: UMPIRE | X574: LADDER | AB574: ROUND | AD574: 13
A575: WERRIBEE | C575: 0 | D575: 0 | E575: =C575*6+D575 -> 0 | G575: 0 | H575: 0 | I575: =G575*6+H575 -> 0 | K575: 0 | L575: 0 | M575: =K575*6+L575 -> 0 | O575: 9 | P575: 7 | Q575: =O575*6+P575 -> 61
A576: BEST PLAYERS | W576: TEAM | X576: W | Y576: L | Z576: D | AA576: FOR | AB576: AGST | AC576: % | AD576: PTS
A577: YARRAVILLE
A578: WERRIBEE | W578: COBURG | X578: 12 | Y578: 1 | Z578: 0 | AA578: 1972 | AB578: 1080 | AC578: =(AA578*100)/AB578 -> 182.59259259259258 | AD578: =(X578*4)+(Z578*2) -> 48
A579: GOALKICKERS | W579: WAVERLEY | X579: 11 | Y579: 2 | Z579: 0 | AA579: 1474 | AB579: 1241 | AC579: =(AA579*100)/AB579 -> 118.77518130539887 | AD579: =(X579*4)+(Z579*2) -> 44
A580: YARRAVILLE | W580: BRUNSWICK | X580: 10 | Y580: 3 | Z580: 0 | AA580: 1489 | AB580: 1235 | AC580: =(AA580*100)/AB580 -> 120.56680161943319 | AD580: =(X580*4)+(Z580*2) -> 40
A581: WERRIBEE | W581: CAMBERWELL | X581: 8 | Y581: 5 | Z581: 0 | AA581: 1575 | AB581: 1281 | AC581: =(AA581*100)/AB581 -> 122.95081967213115 | AD581: =(X581*4)+(Z581*2) -> 32
A583: BRUNSWICK | C583: 0 | D583: 0 | E583: =C583*6+D583 -> 0 | G583: 0 | H583: 0 | I583: =G583*6+H583 -> 0 | K583: 0 | L583: 0 | M583: =K583*6+L583 -> 0 | O583: 10 | P583: 10 | Q583: =O583*6+P583 -> 70 | S583: BRUNSWICK | W583: NORTHCOTE | X583: 7 | Y583: 6 | Z583: 0 | AA583: 1383 | AB583: 1381 | AC583: =(AA583*100)/AB583 -> 100.1448225923244 | AD583: =(X583*4)+(Z583*2) -> 28
A584: MORDIALLOC | C584: 0 | D584: 0 | E584: =C584*6+D584 -> 0 | G584: 0 | H584: 0 | I584: =G584*6+H584 -> 0 | K584: 0 | L584: 0 | M584: =K584*6+L584 -> 0 | O584: 7 | P584: 9 | Q584: =O584*6+P584 -> 51 | W584: FRANKSTON | X584: 6 | Y584: 7 | Z584: 0 | AA584: 1406 | AB584: 1685 | AC584: =(AA584*100)/AB584 -> 83.442136498516319 | AD584: =(X584*4)+(Z584*2) -> 24
A585: BEST PLAYERS | W585: WERRIBEE | X585: 4 | Y585: 9 | Z585: 0 | AA585: 1186 | AB585: 1525 | AC585: =(AA585*100)/AB585 -> 77.770491803278688 | AD585: =(X585*4)+(Z585*2) -> 16
A586: BRUNSWICK | W586: MORDIALLOC | X586: 3 | Y586: 10 | Z586: 0 | AA586: 1336 | AB586: 1490 | AC586: =(AA586*100)/AB586 -> 89.664429530201346 | AD586: =(X586*4)+(Z586*2) -> 12
A587: MORDIALLOC | W587: YARRAVILLE | X587: 3 | Y587: 10 | Z587: 0 | AA587: 1184 | AB587: 1532 | AC587: =(AA587*100)/AB587 -> 77.284595300261103 | AD587: =(X587*4)+(Z587*2) -> 12
A588: GOALKICKERS | W588: BOX HILL | X588: 1 | Y588: 12 | Z588: 0 | AA588: 1031 | AB588: 1736 | AC588: =(AA588*100)/AB588 -> 59.389400921658989 | AD588: =(X588*4)+(Z588*2) -> 4
A589: BRUNSWICK
A590: MORDIALLOC
A592: NORTHCOTE | C592: 0 | D592: 0 | E592: =C592*6+D592 -> 0 | G592: 0 | H592: 0 | I592: =G592*6+H592 -> 0 | K592: 0 | L592: 0 | M592: =K592*6+L592 -> 0 | O592: 16 | P592: 19 | Q592: =O592*6+P592 -> 115 | S592: NORTHCOTE
A593: BOX HILL | C593: 0 | D593: 0 | E593: =C593*6+D593 -> 0 | G593: 0 | H593: 0 | I593: =G593*6+H593 -> 0 | K593: 0 | L593: 0 | M593: =K593*6+L593 -> 0 | O593: 8 | P593: 5 | Q593: =O593*6+P593 -> 53
A594: BEST PLAYERS
A595: NORTHCOTE
A596: BOX HILL
A597: GOALKICKERS
A598: NORTHCOTE
A599: BOX HILL
A601: COBURG | C601: 0 | D601: 0 | E601: =C601*6+D601 -> 0 | G601: 0 | H601: 0 | I601: =G601*6+H601 -> 0 | K601: 0 | L601: 0 | M601: =K601*6+L601 -> 0 | O601: 9 | P601: 14 | Q601: =O601*6+P601 -> 68 | S601: WAVERLEY
A602: WAVERLEY | C602: 0 | D602: 0 | E602: =C602*6+D602 -> 0 | G602: 0 | H602: 0 | I602: =G602*6+H602 -> 0 | K602: 0 | L602: 0 | M602: =K602*6+L602 -> 0 | O602: 8 | P602: 3 | Q602: =O602*6+P602 -> 51
A603: BEST PLAYERS
A604: COBURG
A605: WAVERLEY
A606: GOALKICKERS
A607: COBURG
A608: WAVERLEY
A610: FRANKSTON | C610: 0 | D610: 0 | E610: =C610*6+D610 -> 0 | G610: 0 | H610: 0 | I610: =G610*6+H610 -> 0 | K610: 0 | L610: 0 | M610: =K610*6+L610 -> 0 | O610: 10 | P610: 9 | Q610: =O610*6+P610 -> 69 | S610: FRANKSTON
A611: CAMBERWELL | C611: 0 | D611: 0 | E611: =C611*6+D611 -> 0 | G611: 0 | H611: 0 | I611: =G611*6+H611 -> 0 | K611: 0 | L611: 0 | M611: =K611*6+L611 -> 0 | O611: 5 | P611: 10 | Q611: =O611*6+P611 -> 40
A612: BEST PLAYERS
A613: FRANKSTON
A614: CAMBERWELL
A615: GOALKICKERS
A616: FRANKSTON
A617: CAMBERWELL
A619: ROUND 14 | E619: 14TH JULY | J619: WEATHER | S619: PLAYED AT
D620: 1ST QTR | H620: 2ND QTR | L620: 3RD QTR | P620: FINAL | S620: MORDIALLOC
A621: MORDIALLOC | C621: 0 | D621: 0 | E621: =C621*6+D621 -> 0 | G621: 0 | H621: 0 | I621: =G621*6+H621 -> 0 | K621: 0 | L621: 0 | M621: =K621*6+L621 -> 0 | O621: 17 | P621: 17 | Q621: =O621*6+P621 -> 119 | S621: UMPIRE | X621: LADDER | AB621: ROUND | AD621: 14
A622: WERRIBEE | C622: 0 | D622: 0 | E622: =C622*6+D622 -> 0 | G622: 0 | H622: 0 | I622: =G622*6+H622 -> 0 | K622: 0 | L622: 0 | M622: =K622*6+L622 -> 0 | O622: 14 | P622: 15 | Q622: =O622*6+P622 -> 99
A623: BEST PLAYERS | W623: TEAM | X623: W | Y623: L | Z623: D | AA623: FOR | AB623: AGST | AC623: % | AD623: PTS
A624: MORDIALLOC
A625: WERRIBEE | W625: COBURG | X625: 13 | Y625: 1 | Z625: 0 | AA625: 2103 | AB625: 1148 | AC625: =(AA625*100)/AB625 -> 183.18815331010452 | AD625: =(X625*4)+(Z625*2) -> 52
A626: GOALKICKERS | W626: BRUNSWICK | X626: 11 | Y626: 3 | Z626: 0 | AA626: 1576 | AB626: 1302 | AC626: =(AA626*100)/AB626 -> 121.04454685099846 | AD626: =(X626*4)+(Z626*2) -> 44
A627: MORDIALLOC | W627: WAVERLEY | X627: 11 | Y627: 3 | Z627: 0 | AA627: 1541 | AB627: 1328 | AC627: =(AA627*100)/AB627 -> 116.03915662650603 | AD627: =(X627*4)+(Z627*2) -> 44
A628: WERRIBEE | W628: CAMBERWELL | X628: 9 | Y628: 5 | Z628: 0 | AA628: 1661 | AB628: 1334 | AC628: =(AA628*100)/AB628 -> 124.5127436281859 | AD628: =(X628*4)+(Z628*2) -> 36
A630: CAMBERWELL | C630: 0 | D630: 0 | E630: =C630*6+D630 -> 0 | G630: 0 | H630: 0 | I630: =G630*6+H630 -> 0 | K630: 0 | L630: 0 | M630: =K630*6+L630 -> 0 | O630: 13 | P630: 8 | Q630: =O630*6+P630 -> 86 | S630: YARRAVILLE | W630: NORTHCOTE | X630: 7 | Y630: 7 | Z630: 0 | AA630: 1496 | AB630: 1500 | AC630: =(AA630*100)/AB630 -> 99.733333333333334 | AD630: =(X630*4)+(Z630*2) -> 28
A631: YARRAVILLE | C631: 0 | D631: 0 | E631: =C631*6+D631 -> 0 | G631: 0 | H631: 0 | I631: =G631*6+H631 -> 0 | K631: 0 | L631: 0 | M631: =K631*6+L631 -> 0 | O631: 7 | P631: 11 | Q631: =O631*6+P631 -> 53 | W631: FRANKSTON | X631: 7 | Y631: 7 | Z631: 0 | AA631: 1525 | AB631: 1798 | AC631: =(AA631*100)/AB631 -> 84.816462736373751 | AD631: =(X631*4)+(Z631*2) -> 28
A632: BEST PLAYERS | W632: MORDIALLOC | X632: 4 | Y632: 10 | Z632: 0 | AA632: 1455 | AB632: 1589 | AC632: =(AA632*100)/AB632 -> 91.567023285084957 | AD632: =(X632*4)+(Z632*2) -> 16
A633: CAMBERWELL | W633: WERRIBEE | X633: 4 | Y633: 10 | Z633: 0 | AA633: 1285 | AB633: 1644 | AC633: =(AA633*100)/AB633 -> 78.163017031630176 | AD633: =(X633*4)+(Z633*2) -> 16
A634: YARRAVILLE | W634: YARRAVILLE | X634: 3 | Y634: 11 | Z634: 0 | AA634: 1237 | AB634: 1618 | AC634: =(AA634*100)/AB634 -> 76.452410383189118 | AD634: =(X634*4)+(Z634*2) -> 12
A635: GOALKICKERS | W635: BOX HILL | X635: 1 | Y635: 13 | Z635: 0 | AA635: 1099 | AB635: 1867 | AC635: =(AA635*100)/AB635 -> 58.864488484199249 | AD635: =(X635*4)+(Z635*2) -> 4
A636: CAMBERWELL
A637: YARRAVILLE
A639: COBURG | C639: 0 | D639: 0 | E639: =C639*6+D639 -> 0 | G639: 0 | H639: 0 | I639: =G639*6+H639 -> 0 | K639: 0 | L639: 0 | M639: =K639*6+L639 -> 0 | O639: 19 | P639: 17 | Q639: =O639*6+P639 -> 131 | S639: COBURG
A640: BOX HILL | C640: 0 | D640: 0 | E640: =C640*6+D640 -> 0 | G640: 0 | H640: 0 | I640: =G640*6+H640 -> 0 | K640: 0 | L640: 0 | M640: =K640*6+L640 -> 0 | O640: 11 | P640: 2 | Q640: =O640*6+P640 -> 68
A641: BEST PLAYERS
A642: COBURG
A643: BOX HILL
A644: GOALKICKERS
A645: COBURG
A646: BOX HILL
A648: BRUNSWICK | C648: 0 | D648: 0 | E648: =C648*6+D648 -> 0 | G648: 0 | H648: 0 | I648: =G648*6+H648 -> 0 | K648: 0 | L648: 0 | M648: =K648*6+L648 -> 0 | O648: 13 | P648: 9 | Q648: =O648*6+P648 -> 87 | S648: WAVERLEY
A649: WAVERLEY | C649: 0 | D649: 0 | E649: =C649*6+D649 -> 0 | G649: 0 | H649: 0 | I649: =G649*6+H649 -> 0 | K649: 0 | L649: 0 | M649: =K649*6+L649 -> 0 | O649: 9 | P649: 13 | Q649: =O649*6+P649 -> 67
A650: BEST PLAYERS
A651: BRUNSWICK
A652: WAVERLEY
A653: GOALKICKERS
A654: BRUNSWICK
A655: WAVERLEY
A657: FRANKSTON | C657: 0 | D657: 0 | E657: =C657*6+D657 -> 0 | G657: 0 | H657: 0 | I657: =G657*6+H657 -> 0 | K657: 0 | L657: 0 | M657: =K657*6+L657 -> 0 | O657: 17 | P657: 17 | Q657: =O657*6+P657 -> 119 | S657: FRANKSTON
A658: NORTHCOTE | C658: 0 | D658: 0 | E658: =C658*6+D658 -> 0 | G658: 0 | H658: 0 | I658: =G658*6+H658 -> 0 | K658: 0 | L658: 0 | M658: =K658*6+L658 -> 0 | O658: 16 | P658: 17 | Q658: =O658*6+P658 -> 113
A659: BEST PLAYERS
A660: FRANKSTON
A661: NORTHCOTE
A662: GOALKICKERS
A663: FRANKSTON
A664: NORTHCOTE
A666: ROUND 15 | E666: 21ST JULY | J666: WEATHER | S666: PLAYED AT
D667: 1ST QTR | H667: 2ND QTR | L667: 3RD QTR | P667: FINAL | S667: BOX HILL
A668: BOX HILL | C668: 3 | D668: 2 | E668: =C668*6+D668 -> 20 | G668: 9 | H668: 11 | I668: =G668*6+H668 -> 65 | K668: 13 | L668: 15 | M668: =K668*6+L668 -> 93 | O668: 16 | P668: 19 | Q668: =O668*6+P668 -> 115 | S668: UMPIRE | X668: LADDER | AB668: ROUND | AD668: 15
A669: FRANKSTON | C669: 2 | D669: 3 | E669: =C669*6+D669 -> 15 | G669: 3 | H669: 4 | I669: =G669*6+H669 -> 22 | K669: 8 | L669: 7 | M669: =K669*6+L669 -> 55 | O669: 11 | P669: 10 | Q669: =O669*6+P669 -> 76 | S669: HAYES
A670: BEST PLAYERS | W670: TEAM | X670: W | Y670: L | Z670: D | AA670: FOR | AB670: AGST | AC670: % | AD670: PTS
A671: BOX HILL | C671: KING | F671: EDWARDS | I671: TIERNEY | L671: HIGGINS | O671: G LOVE | R671: WATERS
A672: FRANKSTON | C672: JOY | F672: SHEPHERD | I672: ROSENBROCK | L672: FALKINER | O672: DOHERTY | W672: COBURG | X672: 14 | Y672: 1 | Z672: 0 | AA672: 2221 | AB672: 1234 | AC672: =(AA672*100)/AB672 -> 179.98379254457049 | AD672: =(X672*4)+(Z672*2) -> 56
A673: GOALKICKERS | W673: BRUNSWICK | X673: 12 | Y673: 3 | Z673: 0 | AA673: 1758 | AB673: 1368 | AC673: =(AA673*100)/AB673 -> 128.50877192982455 | AD673: =(X673*4)+(Z673*2) -> 48
A674: BOX HILL | C674: MAGILL 4 | E674: KING 3 | G674: COUTTS 2 | I674: BAKER 2 | K674: EDWARDS | N674: CURTIS | P674: TIERNEY | R674: BRYANT | T674: R LOVE | W674: WAVERLEY | X674: 12 | Y674: 3 | Z674: 0 | AA674: 1668 | AB674: 1440 | AC674: =(AA674*100)/AB674 -> 115.83333333333333 | AD674: =(X674*4)+(Z674*2) -> 48
A675: FRANKSTON | C675: FALKINER 4 | F675: BRIESE 3 | H675: ELLIS | J675: DOHERTY | L675: LOCCO | N675: FITZGERALD | W675: CAMBERWELL | X675: 9 | Y675: 6 | Z675: 0 | AA675: 1741 | AB675: 1465 | AC675: =(AA675*100)/AB675 -> 118.83959044368601 | AD675: =(X675*4)+(Z675*2) -> 36
A677: MORDIALLOC | C677: 4 | D677: 2 | E677: =C677*6+D677 -> 26 | G677: 12 | H677: 6 | I677: =G677*6+H677 -> 78 | K677: 16 | L677: 8 | M677: =K677*6+L677 -> 104 | O677: 20 | P677: 11 | Q677: =O677*6+P677 -> 131 | S677: CAMBERWELL | W677: NORTHCOTE | X677: 7 | Y677: 8 | Z677: 0 | AA677: 1608 | AB677: 1627 | AC677: =(AA677*100)/AB677 -> 98.832206515058388 | AD677: =(X677*4)+(Z677*2) -> 28
A678: CAMBERWELL | C678: 2 | D678: 6 | E678: =C678*6+D678 -> 18 | G678: 6 | H678: 7 | I678: =G678*6+H678 -> 43 | K678: 9 | L678: 10 | M678: =K678*6+L678 -> 64 | O678: 11 | P678: 14 | Q678: =O678*6+P678 -> 80 | S678: ABBOTT | W678: FRANKSTON | X678: 7 | Y678: 8 | Z678: 0 | AA678: 1601 | AB678: 1913 | AC678: =(AA678*100)/AB678 -> 83.690538421327759 | AD678: =(X678*4)+(Z678*2) -> 28
A679: BEST PLAYERS | W679: MORDIALLOC | X679: 5 | Y679: 10 | Z679: 0 | AA679: 1586 | AB679: 1669 | AC679: =(AA679*100)/AB679 -> 95.026962252846019 | AD679: =(X679*4)+(Z679*2) -> 20
A680: MORDIALLOC | C680: RAEBURN | F680: WOOTTEN | I680: JOHNSTONE | L680: BESANKO | O680: SCAIFFE | R680: THOMPSON | W680: WERRIBEE | X680: 4 | Y680: 11 | Z680: 0 | AA680: 1351 | AB680: 1826 | AC680: =(AA680*100)/AB680 -> 73.986856516976999 | AD680: =(X680*4)+(Z680*2) -> 16
A681: CAMBERWELL | C681: ATKINSON | F681: HAZLETT | I681: ANDREWS | L681: SAUERBERG | O681: BRYCE | R681: STONE | W681: YARRAVILLE | X681: 3 | Y681: 12 | Z681: 0 | AA681: 1323 | AB681: 1736 | AC681: =(AA681*100)/AB681 -> 76.209677419354833 | AD681: =(X681*4)+(Z681*2) -> 12
A682: GOALKICKERS | W682: BOX HILL | X682: 2 | Y682: 13 | Z682: 0 | AA682: 1214 | AB682: 1943 | AC682: =(AA682*100)/AB682 -> 62.480699948533193 | AD682: =(X682*4)+(Z682*2) -> 8
A683: MORDIALLOC | C683: WILKINS 4 | F683: WALKER 3 | I683: HARRY 3 | K683: SCAIFFE 2 | M683: SHUGG 2 | O683: LAUGHLIN | R683: DANCKERT
A684: CAMBERWELL | C684: ANDREWS 7 | F684: STONE 2 | I684: SIMPSON 2
A686: BRUNSWICK | C686: 3 | D686: 8 | E686: =C686*6+D686 -> 26 | G686: 8 | H686: 15 | I686: =G686*6+H686 -> 63 | K686: 15 | L686: 18 | M686: =K686*6+L686 -> 108 | O686: 26 | P686: 26 | Q686: =O686*6+P686 -> 182 | S686: BRUNSWICK
A687: WERRIBEE | C687: 3 | D687: 3 | E687: =C687*6+D687 -> 21 | G687: 5 | H687: 7 | I687: =G687*6+H687 -> 37 | K687: 9 | L687: 9 | M687: =K687*6+L687 -> 63 | O687: 9 | P687: 12 | Q687: =O687*6+P687 -> 66 | S687: MATTHEWS
A688: BEST PLAYERS
A689: BRUNSWICK | C689: BRIGHAM | F689: ORTON | I689: O'CONNOR | L689: ALLAN | O689: DIMATTINA | R689: GUEST
A690: WERRIBEE | C690: DARUL | F690: NEWMAN | I690: HAMBLIN | L690: McLEOD | O690: McNAUGHTON | R690: NEWITT
A691: GOALKICKERS
A692: BRUNSWICK | C692: BAIRD 6 | E692: ALLAN 6 | G692: ORTON 4 | I692: O'CONNOR 3 | L692: BRIGHAM 3 | N692: JOSEPH 2 | P692: DIMATTINA | S692: STILO
A693: WERRIBEE | C693: McLEOD 4 | F693: MORRIS | I693: WHITEHEAD | L693: HOOPER | N693: MITCHELL | Q693: DARUL
A695: WAVERLEY | C695: 7 | D695: 8 | E695: =C695*6+D695 -> 50 | G695: 12 | H695: 11 | I695: =G695*6+H695 -> 83 | K695: 16 | L695: 16 | M695: =K695*6+L695 -> 112 | O695: 18 | P695: 19 | Q695: =O695*6+P695 -> 127 | S695: NORTHCOTE
A696: NORTHCOTE | C696: 1 | D696: 2 | E696: =C696*6+D696 -> 8 | G696: 3 | H696: 3 | I696: =G696*6+H696 -> 21 | K696: 6 | L696: 9 | M696: =K696*6+L696 -> 45 | O696: 16 | P696: 16 | Q696: =O696*6+P696 -> 112 | S696: VERGONA
A697: BEST PLAYERS
A698: WAVERLEY | C698: R ALLAN | F698: FERGUSON | I698: SMEDTS | L698: HORKINGS | O698: COSTELLO | R698: GRANT
A699: NORTHCOTE | C699: CHAPMAN | F699: GELLIE | I699: DOBSON | L699: RYAN | O699: ROBERTS | R699: LEECH
A700: GOALKICKERS
A701: WAVERLEY | C701: COSTELLO 6 | F701: R ALLAN 4 | H701: PARKS 2 | J701: B ALLAN | L701: HANCOCK | N701: GRANT | P701: LANCASHIRE | S701: HASTINGS | V701: SMEDTS
A702: NORTHCOTE | C702: CHAPMAN 10 | F702: HOUGH | H702: LEECH | J702: STILSBY | L702: McNEILL | N702: RYAN | P702: DOBSON
A704: COBURG | C704: 4 | D704: 6 | E704: =C704*6+D704 -> 30 | G704: 5 | H704: 9 | I704: =G704*6+H704 -> 39 | K704: 13 | L704: 14 | M704: =K704*6+L704 -> 92 | O704: 17 | P704: 16 | Q704: =O704*6+P704 -> 118 | S704: YARRAVILLE
A705: YARRAVILLE | C705: 1 | D705: 1 | E705: =C705*6+D705 -> 7 | G705: 8 | H705: 5 | I705: =G705*6+H705 -> 53 | K705: 9 | L705: 7 | M705: =K705*6+L705 -> 61 | O705: 12 | P705: 14 | Q705: =O705*6+P705 -> 86 | S705: DAVIS
A706: BEST PLAYERS
A707: COBURG | C707: HOWELL | F707: HOPGOOD | I707: PAUL | L707: McGRATH | O707: LAKE | R707: HOBBS
A708: YARRAVILLE | C708: SHARP | F708: RYAN | I708: LEWIS | L708: JOSLIN | O708: COLEMAN | R708: SQUIRE
A709: GOALKICKERS
A710: COBURG | C710: SMITH 6 | E710: PAUL 3 | G710: BREEN 2 | I710: McGRATH 2 | L710: HOBBS 2 | N710: LUKE | P710: SLATER
A711: YARRAVILLE | C711: SHARP 4 | F711: GREENEY 3 | I711: RYAN 3 | K711: LOWE | M711: BARR
A713: ROUND 16 | E713: 28TH JULY | J713: WEATHER | S713: PLAYED AT
D714: 1ST QTR | H714: 2ND QTR | L714: 3RD QTR | P714: FINAL | S714: MORDIALLOC
A715: MORDIALLOC | C715: 4 | D715: 7 | E715: =C715*6+D715 -> 31 | G715: 6 | H715: 6 | I715: =G715*6+H715 -> 42 | K715: 10 | L715: 18 | M715: =K715*6+L715 -> 78 | O715: 15 | P715: 27 | Q715: =O715*6+P715 -> 117 | S715: UMPIRE | X715: LADDER | AB715: ROUND | AD715: 16
A716: YARRAVILLE | C716: 3 | D716: 1 | E716: =C716*6+D716 -> 19 | G716: 10 | H716: 5 | I716: =G716*6+H716 -> 65 | K716: 13 | L716: 10 | M716: =K716*6+L716 -> 88 | O716: 15 | P716: 18 | Q716: =O716*6+P716 -> 108 | S716: VERGONA
A717: BEST PLAYERS | W717: TEAM | X717: W | Y717: L | Z717: D | AA717: FOR | AB717: AGST | AC717: % | AD717: PTS
A718: MORDIALLOC | C718: ? | F718: McGUINNESS | I718: LAUGHLIN | L718: HARRY | O718: ? | R718: WOOTTEN
A719: YARRAVILLE | C719: SHARP | F719: RYAN | I719: HOWDEN | L719: MARTIN | O719: ? | R719: LEWIS | W719: COBURG | X719: 15 | Y719: 1 | Z719: 0 | AA719: 2364 | AB719: 1287 | AC719: =(AA719*100)/AB719 -> 183.68298368298369 | AD719: =(X719*4)+(Z719*2) -> 60
A720: GOALKICKERS | M720: BESANKO | P720: SCAIFFE | W720: BRUNSWICK | X720: 13 | Y720: 3 | Z720: 0 | AA720: 1915 | AB720: 1432 | AC720: =(AA720*100)/AB720 -> 133.72905027932961 | AD720: =(X720*4)+(Z720*2) -> 52
A721: MORDIALLOC | C721: ? 4 | F721: LAUGHLIN 2 | I721: WILKINS 2 | L721: ? 2 | N721: JOHNSTONE | Q721: DANCKERT | W721: WAVERLEY | X721: 13 | Y721: 3 | Z721: 0 | AA721: 1767 | AB721: 1494 | AC721: =(AA721*100)/AB721 -> 118.27309236947791 | AD721: =(X721*4)+(Z721*2) -> 52
A722: YARRAVILLE | C722: SHARP 7 | F722: JANES 2 | H722: MARTIN 2 | J722: CONDUIT 2 | M722: GREENEY | O722: HOWDEN | W722: CAMBERWELL | X722: 9 | Y722: 7 | Z722: 0 | AA722: 1805 | AB722: 1622 | AC722: =(AA722*100)/AB722 -> 111.28236744759556 | AD722: =(X722*4)+(Z722*2) -> 36
A724: BRUNSWICK | C724: 3 | D724: 4 | E724: =C724*6+D724 -> 22 | G724: 11 | H724: 5 | I724: =G724*6+H724 -> 71 | K724: 17 | L724: 8 | M724: =K724*6+L724 -> 110 | O724: 24 | P724: 13 | Q724: =O724*6+P724 -> 157 | S724: BRUNSWICK | W724: NORTHCOTE | X724: 7 | Y724: 9 | Z724: 0 | AA724: 1661 | AB724: 1770 | AC724: =(AA724*100)/AB724 -> 93.841807909604526 | AD724: =(X724*4)+(Z724*2) -> 28
A725: CAMBERWELL | C725: 2 | D725: 1 | E725: =C725*6+D725 -> 13 | G725: 6 | H725: 4 | I725: =G725*6+H725 -> 40 | K725: 8 | L725: 8 | M725: =K725*6+L725 -> 56 | O725: 9 | P725: 10 | Q725: =O725*6+P725 -> 64 | S725: HUGGINS | W725: FRANKSTON | X725: 7 | Y725: 9 | Z725: 0 | AA725: 1655 | AB725: 2012 | AC725: =(AA725*100)/AB725 -> 82.25646123260438 | AD725: =(X725*4)+(Z725*2) -> 28
A726: BEST PLAYERS | W726: MORDIALLOC | X726: 6 | Y726: 10 | Z726: 0 | AA726: 1703 | AB726: 1777 | AC726: =(AA726*100)/AB726 -> 95.835678109172761 | AD726: =(X726*4)+(Z726*2) -> 24
A727: BRUNSWICK | C727: O'CONNOR | F727: FORD | I727: BRIGHAM | L727: ? | N727: DIMATTINA | R727: ? | W727: WERRIBEE | X727: 4 | Y727: 12 | Z727: 0 | AA727: 1447 | AB727: 1954 | AC727: =(AA727*100)/AB727 -> 74.053224155578306 | AD727: =(X727*4)+(Z727*2) -> 16
A728: CAMBERWELL | C728: STONE | F728: STOREY | I728: MOORE | L728: CU ? | N728: NELL | R728: ? | W728: YARRAVILLE | X728: 3 | Y728: 13 | Z728: 0 | AA728: 1431 | AB728: 1853 | AC728: =(AA728*100)/AB728 -> 77.226119805720458 | AD728: =(X728*4)+(Z728*2) -> 12
A729: GOALKICKERS | W729: BOX HILL | X729: 3 | Y729: 13 | Z729: 0 | AA729: 1342 | AB729: 2039 | AC729: =(AA729*100)/AB729 -> 65.816576753310443 | AD729: =(X729*4)+(Z729*2) -> 12
A730: BRUNSWICK | C730: BAIRD 15 | F730: STILO 3 | H730: DIMATTINA 3 | K730: WROUT | M730: SKIDMORE | P730: BRIGHAM
A731: CAMBERWELL | C731: MOORE 2 | F731: ? | H731: ? | K731: BRYCE | M731: STOREY | O731: HAZLETT | Q731: ANDREWS
A733: BOX HILL | C733: 4 | D733: 1 | E733: =C733*6+D733 -> 25 | G733: 10 | H733: 5 | I733: =G733*6+H733 -> 65 | K733: 17 | L733: 9 | M733: =K733*6+L733 -> 111 | O733: 19 | P733: 14 | Q733: =O733*6+P733 -> 128 | S733: WERRIBEE
A734: WERRIBEE | C734: 3 | D734: 3 | E734: =C734*6+D734 -> 21 | G734: 6 | H734: 5 | I734: =G734*6+H734 -> 41 | K734: 12 | L734: 7 | M734: =K734*6+L734 -> 79 | O734: 14 | P734: 12 | Q734: =O734*6+P734 -> 96 | S734: WENN
A735: BEST PLAYERS
A736: BOX HILL | C736: CRUNDEN | F736: EDWARDS | I736: HIGGINS | L736: BRYANT | O736: ? | R736: LASKIE
A737: WERRIBEE | F737: DARUL | I737: HAMBLIN | L737: McCARTNEY | O737: ? | R737: RIDDELL
A738: GOALKICKERS
A739: BOX HILL | C739: ? | F739: LOVE 3 | H739: MAGILL 3 | J739: BAKER ? | L739: TIERNEY | N739: KING | P739: COUTTS
A740: WERRIBEE | C740: McLEOD 3 | F740: ? 2 | I740: MORRIS 2 | K740: DARUL 2 | N740: ? | O740: WHITEHEAD | R740: RIDDELL | U740: HO ? | W740: MITCHELL
A742: COBURG | C742: 4 | D742: 10 | E742: =C742*6+D742 -> 34 | G742: 6 | H742: 15 | I742: =G742*6+H742 -> 51 | K742: 13 | L742: 22 | M742: =K742*6+L742 -> 100 | O742: 20 | P742: 23 | Q742: =O742*6+P742 -> 143 | S742: COBURG
A743: NORTHCOTE | C743: 0 | D743: 1 | E743: =C743*6+D743 -> 1 | G743: 4 | H743: 6 | I743: =G743*6+H743 -> 30 | K743: 5 | L743: 10 | M743: =K743*6+L743 -> 40 | O743: 6 | P743: 17 | Q743: =O743*6+P743 -> 53 | S743: MATTHEWS
A744: BEST PLAYERS
A745: COBURG | C745: PAUL | F745: ? | I745: MANNIX | L745: SMITH | O745: HOBBS
A746: NORTHCOTE | C746: GELLIE | F746: JAMES | I746: KOZARIS | L746: ? | O746: McARDLE
A747: GOALKICKERS
A748: COBURG | C748: SMITH | F748: ? 3 | I748: BREEN 3 | K748: LAKE 3 | M748: PAUL 3 | O748: ? | Q748: HOBBS | S748: BRENNAN
A749: NORTHCOTE | C749: McARDLE 3 | F749: RYAN 2 | I749: CHAPMAN
A751: WAVERLEY | C751: 2 | D751: 1 | E751: =C751*6+D751 -> 13 | G751: 8 | H751: 8 | I751: =G751*6+H751 -> 56 | K751: 10 | L751: 12 | M751: =K751*6+L751 -> 72 | O751: 14 | P751: 15 | Q751: =O751*6+P751 -> 99 | S751: WAVERLEY
A752: FRANKSTON | C752: 2 | D752: 2 | E752: =C752*6+D752 -> 14 | G752: 4 | H752: 3 | I752: =G752*6+H752 -> 27 | K752: 5 | L752: 5 | M752: =K752*6+L752 -> 35 | O752: 8 | P752: 6 | Q752: =O752*6+P752 -> 54 | S752: DAVIS
A753: BEST PLAYERS
A754: WAVERLEY | C754: ? | F754: MILES | I754: LANCASHIRE | L754: HORKINGS | N754: B ALLAN | Q754: FERGUSON
A755: FRANKSTON | C755: FALKINER | F755: SHEPHERD | I755: ? | L755: BRIESE | N755: CLARK | Q755: BLOOMFIELD
A756: GOALKICKERS
A757: WAVERLEY | C757: ? | F757: COSTELLO 3 | I757: ZIESLER 2 | K757: GRANT ? | M757: B ALLAN | O757: HORKINGS | R757: R ALLAN
A758: FRANKSTON | C758: BLOOMFIELD 3 | F758: ? 2 | G758: 2 | I758: DOHERTY | L758: FITZGERALD | O758: HARRISON
A760: ROUND 17 | E760: 4TH AUGUST | J760: WEATHER | S760: PLAYED AT
D761: 1ST QTR | H761: 2ND QTR | L761: 3RD QTR | P761: FINAL | S761: NORTHCOTE
A762: NORTHCOTE | C762: 2 | D762: 3 | E762: =C762*6+D762 -> 15 | G762: 6 | H762: 5 | I762: =G762*6+H762 -> 41 | K762: 8 | L762: 7 | M762: =K762*6+L762 -> 55 | O762: 12 | P762: 11 | Q762: =O762*6+P762 -> 83 | S762: UMPIRE | X762: LADDER | AB762: ROUND | AD762: 17
A763: CAMBERWELL | C763: 3 | D763: 8 | E763: =C763*6+D763 -> 26 | G763: 6 | H763: 10 | I763: =G763*6+H763 -> 46 | K763: 8 | L763: 14 | M763: =K763*6+L763 -> 62 | O763: 10 | P763: 14 | Q763: =O763*6+P763 -> 74 | S763: HAYES
A764: BEST PLAYERS | W764: TEAM | X764: W | Y764: L | Z764: D | AA764: FOR | AB764: AGST | AC764: % | AD764: PTS
A765: NORTHCOTE | C765: GELLIE | F765: JAMES | I765: LEECH | L765: DOBSON | O765: ROBERTS | R765: REDENBACH
A766: CAMBERWELL | C766: STONE | F766: SIMPSON | I766: SPITHILL | L766: ATKINSON | O766: LINNELL | R766: DUNGAN | W766: COBURG | X766: 16 | Y766: 1 | Z766: 0 | AA766: 2451 | AB766: 1351 | AC766: =(AA766*100)/AB766 -> 181.42116950407106 | AD766: =(X766*4)+(Z766*2) -> 64
A767: GOALKICKERS | W767: WAVERLEY | X767: 14 | Y767: 3 | Z767: 0 | AA767: 1880 | AB767: 1544 | AC767: =(AA767*100)/AB767 -> 121.76165803108809 | AD767: =(X767*4)+(Z767*2) -> 56
A768: NORTHCOTE | C768: CHAPMAN 3 | F768: McARDLE 2 | I768: JAMES 2 | K768: STEWART | M768: BIENKE | O768: McNEILL | Q768: RYAN | S768: DOBSON | W768: BRUNSWICK | X768: 13 | Y768: 4 | Z768: 0 | AA768: 1979 | AB768: 1519 | AC768: =(AA768*100)/AB768 -> 130.2830809743252 | AD768: =(X768*4)+(Z768*2) -> 52
A769: CAMBERWELL | C769: LINNELL 3 | E769: STONE 2 | G769: SIMPSON | I769: SPITHILL | K769: HALBERT | M769: SAUERBERG | P769: MOORE | W769: CAMBERWELL | X769: 9 | Y769: 8 | Z769: 0 | AA769: 1879 | AB769: 1705 | AC769: =(AA769*100)/AB769 -> 110.20527859237536 | AD769: =(X769*4)+(Z769*2) -> 36
A771: COBURG | C771: 0 | D771: 3 | E771: =C771*6+D771 -> 3 | G771: 8 | H771: 5 | I771: =G771*6+H771 -> 53 | K771: 9 | L771: 6 | M771: =K771*6+L771 -> 60 | O771: 13 | P771: 9 | Q771: =O771*6+P771 -> 87 | S771: COBURG | W771: NORTHCOTE | X771: 8 | Y771: 9 | Z771: 0 | AA771: 1744 | AB771: 1844 | AC771: =(AA771*100)/AB771 -> 94.577006507592188 | AD771: =(X771*4)+(Z771*2) -> 32
A772: BRUNSWICK | C772: 1 | D772: 5 | E772: =C772*6+D772 -> 11 | G772: 4 | H772: 6 | I772: =G772*6+H772 -> 30 | K772: 6 | L772: 9 | M772: =K772*6+L772 -> 45 | O772: 9 | P772: 10 | Q772: =O772*6+P772 -> 64 | S772: WENN | W772: FRANKSTON | X772: 8 | Y772: 9 | Z772: 0 | AA772: 1775 | AB772: 2099 | AC772: =(AA772*100)/AB772 -> 84.564078132444024 | AD772: =(X772*4)+(Z772*2) -> 32
A773: BEST PLAYERS | W773: MORDIALLOC | X773: 6 | Y773: 11 | Z773: 0 | AA773: 1753 | AB773: 1890 | AC773: =(AA773*100)/AB773 -> 92.751322751322746 | AD773: =(X773*4)+(Z773*2) -> 24
A774: COBURG | C774: HOPGOOD | F774: BREEN | I774: GALE | L774: SLATER | N774: ROBINSON | Q774: HOBBS | W774: WERRIBEE | X774: 4 | Y774: 13 | Z774: 0 | AA774: 1534 | AB774: 2074 | AC774: =(AA774*100)/AB774 -> 73.963355834136934 | AD774: =(X774*4)+(Z774*2) -> 16
A775: BRUNSWICK | C775: EGAN | F775: FORD | I775: DIMATTINA | L775: GUEST | N775: VALENTINE | Q775: BRIGHAM | W775: BOX HILL | X775: 4 | Y775: 13 | Z775: 0 | AA775: 1402 | AB775: 2096 | AC775: =(AA775*100)/AB775 -> 66.889312977099237 | AD775: =(X775*4)+(Z775*2) -> 16
A776: GOALKICKERS | W776: YARRAVILLE | X776: 3 | Y776: 14 | Z776: 0 | AA776: 1488 | AB776: 1913 | AC776: =(AA776*100)/AB776 -> 77.783585990590694 | AD776: =(X776*4)+(Z776*2) -> 12
A777: COBURG | C777: BREEN 4 | E777: SMITH 4 | G777: HOWELL | I777: GALE | K777: MANNIX | M777: HOBBS | O777: BRENNAN
A778: BRUNSWICK | C778: VALENTINE 3 | F778: BRIGHAM | I778: NOLAN | K778: DIMATTINA | N778: BAIRD | P778: ALLAN | R778: O'CONNOR
A780: WAVERLEY | C780: 7 | D780: 8 | E780: =C780*6+D780 -> 50 | G780: 10 | H780: 8 | I780: =G780*6+H780 -> 68 | K780: 15 | L780: 17 | M780: =K780*6+L780 -> 107 | O780: 16 | P780: 17 | Q780: =O780*6+P780 -> 113 | S780: WAVERLEY
A781: MORDIALLOC | C781: 0 | D781: 1 | E781: =C781*6+D781 -> 1 | G781: 4 | H781: 6 | I781: =G781*6+H781 -> 30 | K781: 5 | L781: 6 | M781: =K781*6+L781 -> 36 | O781: 7 | P781: 8 | Q781: =O781*6+P781 -> 50 | S781: MATTHEWS
A782: BEST PLAYERS
A783: WAVERLEY | C783: SMEDTS | F783: HORKINGS | I783: MILES | L783: COSTELLO | N783: LANCASHIRE | Q783: HOCKING
A784: MORDIALLOC | C784: SCAIFFE | F784: BESANKO | I784: HARRY | L784: HUTTON | N784: WALKER | Q784: RAEBURN
A785: GOALKICKERS
A786: WAVERLEY | C786: COSTELLO 4 | F786: ZIESLER 3 | I786: LANCASHIRE 2 | L786: PARKS 2 | N786: SMEDTS 2 | Q786: GRANT | S786: HOCKING | V786: CRAWLEY
A787: MORDIALLOC | C787: HARRY 2 | F787: JOHNSTONE | I787: RAEBURN | L787: BESANKO | N787: THOMPSON | Q787: WILKINS
A789: FRANKSTON | C789: 5 | D789: 8 | E789: =C789*6+D789 -> 38 | G789: 10 | H789: 13 | I789: =G789*6+H789 -> 73 | K789: 14 | L789: 17 | M789: =K789*6+L789 -> 101 | O789: 17 | P789: 18 | Q789: =O789*6+P789 -> 120 | S789: FRANKSTON
A790: WERRIBEE | C790: 5 | D790: 3 | E790: =C790*6+D790 -> 33 | G790: 7 | H790: 4 | I790: =G790*6+H790 -> 46 | K790: 10 | L790: 7 | M790: =K790*6+L790 -> 67 | O790: 13 | P790: 9 | Q790: =O790*6+P790 -> 87 | S790: VERGONA
A791: BEST PLAYERS
A792: FRANKSTON | C792: ROWE | F792: BRIESE | I792: BEAMAN | L792: LOCCO | O792: HARRISON
A793: WERRIBEE | C793: MORRIS | F793: SCHIELE | I793: NEWMAN | L793: F MITCHELL | O793: DARUL
A794: GOALKICKERS
A795: FRANKSTON | C795: HARRISON 3 | F795: SHEPHERD 3 | I795: CLARK 3 | K795: BLOOMFIELD 2 | N795: DOHERTY 2 | Q795: LOCCO 2 | S795: BRIESE | U795: FALKINER
A796: WERRIBEE | C796: MORRIS 4 | F796: N MITCHELL 4 | I796: HAMBLIN 2 | L796: F MITCHELL 2 | O796: DARUL
A798: BOX HILL | C798: 2 | D798: 4 | E798: =C798*6+D798 -> 16 | G798: 3 | H798: 8 | I798: =G798*6+H798 -> 26 | K798: 7 | L798: 11 | M798: =K798*6+L798 -> 53 | O798: 8 | P798: 12 | Q798: =O798*6+P798 -> 60 | S798: BOX HILL
A799: YARRAVILLE | C799: 1 | D799: 4 | E799: =C799*6+D799 -> 10 | G799: 3 | H799: 10 | I799: =G799*6+H799 -> 28 | K799: 4 | L799: 11 | M799: =K799*6+L799 -> 35 | O799: 7 | P799: 15 | Q799: =O799*6+P799 -> 57 | S799: ABBOTT
A800: BEST PLAYERS
A801: BOX HILL | C801: COUTTS | F801: CURTIS | I801: WALTER | L801: DOULIS | N801: BARNETT | Q801: HIGGINS
A802: YARRAVILLE | C802: JOSLIN | F802: DOLL | I802: MARTIN | L802: CONDUIT | N802: LEWIS | Q802: BARR
A803: GOALKICKERS
A804: BOX HILL | C804: MAGILL 3 | F804: TIERNEY 2 | I804: R LOVE | K804: LASKIE | M804: BAKER
A805: YARRAVILLE | C805: SHARP 3 | F805: BARR 2 | I805: SMITH | K805: PATTERSON
A807: ROUND 18 | E807: 11TH AUGUST | J807: WEATHER | S807: PLAYED AT
D808: 1ST QTR | H808: 2ND QTR | L808: 3RD QTR | P808: FINAL | S808: MORDIALLOC
A809: COBURG | C809: 4 | D809: 2 | E809: =C809*6+D809 -> 26 | G809: 9 | H809: 5 | I809: =G809*6+H809 -> 59 | K809: 13 | L809: 6 | M809: =K809*6+L809 -> 84 | O809: 22 | P809: 8 | Q809: =O809*6+P809 -> 140 | S809: UMPIRE | X809: LADDER | AB809: ROUND | AD809: 18
A810: MORDIALLOC | C810: 5 | D810: 8 | E810: =C810*6+D810 -> 38 | G810: 7 | H810: 10 | I810: =G810*6+H810 -> 52 | K810: 8 | L810: 13 | M810: =K810*6+L810 -> 61 | O810: 10 | P810: 20 | Q810: =O810*6+P810 -> 80 | S810: GAMBETTA
A811: BEST PLAYERS | W811: TEAM | X811: W | Y811: L | Z811: D | AA811: FOR | AB811: AGST | AC811: % | AD811: PTS
A812: COBURG | C812: SMITH | F812: HOPGOOD | I812: MANNIX | L812: HOBBS | O812: SLATER | R812: ROBINSON
A813: MORDIALLOC | C813: SCAIFFE | F813: WOOTTEN | I813: ZEALLY | L813: THOMPSON | O813: WILKINS | R813: GUY | W813: COBURG | X813: 17 | Y813: 1 | Z813: 0 | AA813: 2591 | AB813: 1431 | AC813: =(AA813*100)/AB813 -> 181.06219426974144 | AD813: =(X813*4)+(Z813*2) -> 68
A814: GOALKICKERS | W814: WAVERLEY | X814: 15 | Y814: 3 | Z814: 0 | AA814: 1992 | AB814: 1631 | AC814: =(AA814*100)/AB814 -> 122.13366033108522 | AD814: =(X814*4)+(Z814*2) -> 60
A815: COBURG | C815: SMITH 13 | F815: S McCARTHY 3 | I815: MORRISON 2 | L815: PAUL | N815: MANNIX | P815: BREEN | R815: GALE | W815: BRUNSWICK | X815: 14 | Y815: 4 | Z815: 0 | AA815: 2156 | AB815: 1604 | AC815: =(AA815*100)/AB815 -> 134.41396508728181 | AD815: =(X815*4)+(Z815*2) -> 56
A816: MORDIALLOC | C816: WILKINS 4 | F816: JOHNSTONE 2 | I816: RAEBURN | L816: WOOTTEN | N816: BASTIAN | Q816: WALKER | W816: CAMBERWELL | X816: 10 | Y816: 8 | Z816: 0 | AA816: 1973 | AB816: 1763 | AC816: =(AA816*100)/AB816 -> 111.91151446398185 | AD816: =(X816*4)+(Z816*2) -> 40
A818: NORTHCOTE | C818: 2 | D818: 3 | E818: =C818*6+D818 -> 15 | G818: 8 | H818: 8 | I818: =G818*6+H818 -> 56 | K818: 11 | L818: 14 | M818: =K818*6+L818 -> 80 | O818: 17 | P818: 17 | Q818: =O818*6+P818 -> 119 | S818: YARRAVILLE | W818: NORTHCOTE | X818: 9 | Y818: 9 | Z818: 0 | AA818: 1863 | AB818: 1957 | AC818: =(AA818*100)/AB818 -> 95.196729688298419 | AD818: =(X818*4)+(Z818*2) -> 36
A819: YARRAVILLE | C819: 4 | D819: 4 | E819: =C819*6+D819 -> 28 | G819: 5 | H819: 8 | I819: =G819*6+H819 -> 38 | K819: 11 | L819: 10 | M819: =K819*6+L819 -> 76 | O819: 17 | P819: 11 | Q819: =O819*6+P819 -> 113 | S819: TORNEY | W819: FRANKSTON | X819: 8 | Y819: 10 | Z819: 0 | AA819: 1860 | AB819: 2276 | AC819: =(AA819*100)/AB819 -> 81.722319859402461 | AD819: =(X819*4)+(Z819*2) -> 32
A820: BEST PLAYERS | W820: MORDIALLOC | X820: 6 | Y820: 12 | Z820: 0 | AA820: 1833 | AB820: 2030 | AC820: =(AA820*100)/AB820 -> 90.29556650246306 | AD820: =(X820*4)+(Z820*2) -> 24
A821: NORTHCOTE | C821: GELLIE | F821: McNEILL | I821: McARDLE | L821: RYAN | N821: REDENBACH | Q821: BIENKE | W821: WERRIBEE | X821: 4 | Y821: 14 | Z821: 0 | AA821: 1621 | AB821: 2186 | AC821: =(AA821*100)/AB821 -> 74.153705397987196 | AD821: =(X821*4)+(Z821*2) -> 16
A822: YARRAVILLE | C822: JOSLIN | F822: MARTIN | I822: DOLL | L822: R WILKINSON | O822: SMITH | Q822: NORRIS | W822: BOX HILL | X822: 4 | Y822: 14 | Z822: 0 | AA822: 1460 | AB822: 2190 | AC822: =(AA822*100)/AB822 -> 66.666666666666671 | AD822: =(X822*4)+(Z822*2) -> 16
A823: GOALKICKERS | W823: YARRAVILLE | X823: 3 | Y823: 15 | Z823: 0 | AA823: 1601 | AB823: 2032 | AC823: =(AA823*100)/AB823 -> 78.789370078740163 | AD823: =(X823*4)+(Z823*2) -> 12
A824: NORTHCOTE | C824: CHAPMAN 5 | F824: RYAN 3 | H824: McNEILL 3 | J824: STEWART 3 | M824: NANLERVIS | P824: BIENKE | R824: GELLIE
A825: YARRAVILLE | C825: R WILKINSON 5 | F825: SHIELDS 4 | I825: PATTERSON 3 | L825: MARTIN | N825: BARR | P825: JOSLIN | R825: JONES | T825: LEWIS
A827: CAMBERWELL | C827: 4 | D827: 2 | E827: =C827*6+D827 -> 26 | G827: 6 | H827: 4 | I827: =G827*6+H827 -> 40 | K827: 11 | L827: 5 | M827: =K827*6+L827 -> 71 | O827: 14 | P827: 10 | Q827: =O827*6+P827 -> 94 | S827: CAMBERWELL
A828: BOX HILL | C828: 2 | D828: 4 | E828: =C828*6+D828 -> 16 | G828: 3 | H828: 8 | I828: =G828*6+H828 -> 26 | K828: 5 | L828: 10 | M828: =K828*6+L828 -> 40 | O828: 7 | P828: 16 | Q828: =O828*6+P828 -> 58 | S828: VERGONA
A829: BEST PLAYERS
A830: CAMBERWELL | C830: HOOK | F830: HALBERT | I830: BRYCE | L830: DUNGAN | O830: KARVELIS | R830: WILSON
A831: BOX HILL | C831: BARNETT | F831: BRYANT | I831: ZANTUCK | L831: CURTIS | O831: RALPH | R831: LASKIE
A832: GOALKICKERS
A833: CAMBERWELL | C833: ANDREWS 4 | F833: WILSON 3 | I833: KENNEDY 3 | L833: KARVELIS 2 | O833: LINNELL | Q833: BRYCE
A834: BOX HILL | C834: TIERNEY 2 | F834: CURTIS | I834: MAGILL | K834: McMASTER | N834: ZANTUCK | Q834: LASKIE
A836: WAVERLEY | C836: 3 | D836: 0 | E836: =C836*6+D836 -> 18 | G836: 9 | H836: 3 | I836: =G836*6+H836 -> 57 | K836: 13 | L836: 5 | M836: =K836*6+L836 -> 83 | O836: 17 | P836: 10 | Q836: =O836*6+P836 -> 112 | S836: WERRIBEE
A837: WERRIBEE | C837: 5 | D837: 5 | E837: =C837*6+D837 -> 35 | G837: 7 | H837: 7 | I837: =G837*6+H837 -> 49 | K837: 12 | L837: 7 | M837: =K837*6+L837 -> 79 | O837: 13 | P837: 9 | Q837: =O837*6+P837 -> 87 | S837: ABBOTT
A838: BEST PLAYERS
A839: WAVERLEY | C839: STONE | F839: MILES | I839: ZIESLER | L839: HORKINGS | O839: FERGUSON | R839: SYKES
A840: WERRIBEE | C840: KNEE | F840: McCARTNEY | I840: McLEOD | L840: JOHNSTON | O840: BOURKE | R840: COCKS
A841: GOALKICKERS
A842: WAVERLEY | C842: ZIESLER 7 | F842: COSTELLO 5 | I842: HORKINGS 2 | L842: OWENS | N842: GRANT | P842: LANCASHIRE
A843: WERRIBEE | C843: MORRIS 3 | E843: HAMBLIN 2 | G843: F MITCHELL 2 | J843: JOHNSTON | L843: VELISHA | N843: McLEOD | P843: WHITEHEAD | S843: NEWITT | U843: McCARTHY
A845: BRUNSWICK | C845: 1 | D845: 4 | E845: =C845*6+D845 -> 10 | G845: 10 | H845: 11 | I845: =G845*6+H845 -> 71 | K845: 17 | L845: 17 | M845: =K845*6+L845 -> 119 | O845: 26 | P845: 21 | Q845: =O845*6+P845 -> 177 | S845: BRUNSWICK
A846: FRANKSTON | C846: 4 | D846: 3 | E846: =C846*6+D846 -> 27 | G846: 7 | H846: 5 | I846: =G846*6+H846 -> 47 | K846: 10 | L846: 7 | M846: =K846*6+L846 -> 67 | O846: 13 | P846: 7 | Q846: =O846*6+P846 -> 85 | S846: MATTHEWS
A847: BEST PLAYERS
A848: BRUNSWICK | C848: BAIRD | F848: VALENTINE | I848: EGAN | L848: BRIGHAM | O848: O'CONNOR | R848: WROUT
A849: FRANKSTON | C849: BOYD | F849: ROWE | I849: LEWIS | L849: BRIESE | O849: LOCCO | R849: ARMSTRONG
A850: GOALKICKERS
A851: BRUNSWICK | C851: BAIRD 15 | F851: ORTON 3 | H851: ALLAN 2 | J851: WOODHAM 2 | M851: O'CONNOR 2 | O851: VALENTINE | R851: DIMATTINA
A852: FRANKSTON | C852: CLARK 4 | F852: BRIESE 4 | I852: SHEPHERD 2 | L852: FITZGERALD | O852: LOCCO
A854: FINALS
A855: 1ST SEMI | E855: 18TH AUGUST | J855: WEATHER | S855: PLAYED AT
D856: 1ST QTR | H856: 2ND QTR | L856: 3RD QTR | P856: FINAL | S856: TOORAK PARK
A857: BRUNSWICK | C857: 4 | D857: 3 | E857: =C857*6+D857 -> 27 | G857: 6 | H857: 6 | I857: =G857*6+H857 -> 42 | K857: 9 | L857: 7 | M857: =K857*6+L857 -> 61 | O857: 12 | P857: 8 | Q857: =O857*6+P857 -> 80 | S857: UMPIRE
A858: CAMBERWELL | C858: 4 | D858: 4 | E858: =C858*6+D858 -> 28 | G858: 5 | H858: 5 | I858: =G858*6+H858 -> 35 | K858: 8 | L858: 12 | M858: =K858*6+L858 -> 60 | O858: 11 | P858: 12 | Q858: =O858*6+P858 -> 78 | S858: GAMBETTA
A859: BEST PLAYERS
A860: BRUNSWICK | C860: VALENTINE | F860: EGAN | I860: McCABE | L860: STILO | O860: BRIGHAM | R860: DIMATTINA
A861: CAMBERWELL | C861: STONE | F861: SIMPSON | I861: KARVELIS | L861: KENNEDY | O861: SPITHILL | R861: HAZLETT
A862: GOALKICKERS
A863: BRUNSWICK | C863: BRIGHAM 3 | F863: BAIRD 2 | H863: VALENTINE 2 | K863: WOODHAM 2 | N863: DIMATTINA | Q863: ALLAN | S863: ORTON
A864: CAMBERWELL | C864: ANDREWS 3 | F864: KENNEDY 2 | I864: BRYCE 2 | K864: KARVELIS 2 | N864: LINNELL | Q864: SIMPSON
A866: 2ND SEMI | E866: 25TH AUGUST | J866: WEATHER
A867: COBURG | C867: 8 | D867: 6 | E867: =C867*6+D867 -> 54 | G867: 12 | H867: 11 | I867: =G867*6+H867 -> 83 | K867: 16 | L867: 15 | M867: =K867*6+L867 -> 111 | O867: 19 | P867: 19 | Q867: =O867*6+P867 -> 133 | S867: TOORAK PARK
A868: WAVERLEY | C868: 1 | D868: 1 | E868: =C868*6+D868 -> 7 | G868: 4 | H868: 3 | I868: =G868*6+H868 -> 27 | K868: 7 | L868: 5 | M868: =K868*6+L868 -> 47 | O868: 8 | P868: 9 | Q868: =O868*6+P868 -> 57 | S868: ABBOTT
A869: BEST PLAYERS
A870: COBURG | C870: SMITH | F870: HOPGOOD | I870: MANNIX | L870: HOBBS | N870: ROBINSON | Q870: BREEN
A871: WAVERLEY | C871: HOLDSWORTH | F871: HANCOCK | I871: SYKES | L871: SMEDTS | N871: PARKS
A872: GOALKICKERS
A873: COBURG | C873: SMITH 12 | F873: MORRISON 3 | I873: BREEN | K873: LAKE | M873: PAUL | O873: HOBBS
A874: WAVERLEY | C874: COSTELLO 2 | F874: ZIESLER 2 | I874: SMEDTS 2 | K874: OWENS | M874: HANCOCK
A876: PRELIMIMARY | E876: 1ST SEPTEMBER | J876: WEATHER
A877: BRUNSWICK | C877: 4 | D877: 3 | E877: =C877*6+D877 -> 27 | G877: 7 | H877: 12 | I877: =G877*6+H877 -> 54 | K877: 11 | L877: 16 | M877: =K877*6+L877 -> 82 | O877: 16 | P877: 22 | Q877: =O877*6+P877 -> 118 | S877: TOORAK PARK
A878: WAVERLEY | C878: 6 | D878: 5 | E878: =C878*6+D878 -> 41 | G878: 8 | H878: 8 | I878: =G878*6+H878 -> 56 | K878: 15 | L878: 10 | M878: =K878*6+L878 -> 100 | O878: 16 | P878: 13 | Q878: =O878*6+P878 -> 109 | S878: HUGGINS
A879: BEST PLAYERS
A880: BRUNSWICK | C880: O'CONNOR | F880: STILO | I880: ORTON | L880: BAIRD | O880: SKIDMORE | R880: BRIGHAM
A881: WAVERLEY | C881: SYKES | F881: COSTELLO | I881: STONE | L881: HORKINGS | O881: McNAMEE | R881: SMEDTS
A882: GOALKICKERS
A883: BRUNSWICK | C883: BAIRD 6 | F883: JOSEPH 4 | I883: STILO 3 | K883: ORTON 2 | N883: DIMATTINA
A884: WAVERLEY | C884: COSTELLO 5 | F884: ZIESLER 3 | H884: HORKINGS 2 | K884: HOLDSWORTH | N884: SYKES | P884: HANCOCK | R884: PARKS | S884: CRAWLEY | V884: SMEDTS
A886: GRAND | E886: 8TH SEPTEMBER | J886: WEATHER
A887: COBURG | C887: 4 | D887: 3 | E887: =C887*6+D887 -> 27 | G887: 8 | H887: 7 | I887: =G887*6+H887 -> 55 | K887: 13 | L887: 12 | M887: =K887*6+L887 -> 90 | O887: 18 | P887: 17 | Q887: =O887*6+P887 -> 125 | S887: TOORAK PARK
A888: BRUNSWICK | C888: 3 | D888: 5 | E888: =C888*6+D888 -> 23 | G888: 6 | H888: 10 | I888: =G888*6+H888 -> 46 | K888: 9 | L888: 13 | M888: =K888*6+L888 -> 67 | O888: 9 | P888: 15 | Q888: =O888*6+P888 -> 69 | S888: GAMBETTA
A889: BEST PLAYERS
A890: COBURG | C890: HOBBS | F890: HOPGOOD | I890: SLATER | L890: SMITH | O890: BREEN | R890: MORRISON
A891: BRUNSWICK | C891: STILO | F891: HORSINGTON | I891: EGAN | L891: VALENTINE | O891: SKIDMORE | R891: BRIGHAM
A892: GOALKICKERS
A893: COBURG | C893: SMITH 8 | F893: BREEN 3 | I893: PAUL 3 | K893: HOBBS 2 | M893: MORRISON | P893: GALE
A894: BRUNSWICK | C894: ORTON 3 | F894: WROUT 2 | I894: BAIRD 2 | K894: STILO | M894: JOSEPH