A1: Victorian Football Association
A2: Season 1975 - Division Two
A3: © Copyright Wal Williams | F3: First created: 28 March 2016
A4: Contact: joywalwi at gmail dot com | F4: Last updated: 28 March 2016 | W4: VFA Results and tables - Link to the main index page
A5: You are free to copy this document in whole or part provided that proper acknowledgement is given to the author. All rights reserved.
A7: 1975 | C7: V.F.A. SEASON 2ND DIVISION
A8: ROUND 1 | E8: 6TH APRIL | J8: WEATHER | S8: PLAYED AT
D9: 1ST QTR | H9: 2ND QTR | L9: 3RD QTR | P9: FINAL | S9: NORTHCOTE
A10: SUNSHINE | C10: 3 | D10: 1 | E10: =C10*6+D10 -> 19 | G10: 9 | H10: 4 | I10: =G10*6+H10 -> 58 | K10: 12 | L10: 5 | M10: =K10*6+L10 -> 77 | O10: 18 | P10: 9 | Q10: =O10*6+P10 -> 117 | S10: UMPIRE | X10: LADDER | AB10: ROUND | AD10: 1
A11: NORTHCOTE | C11: 3 | D11: 5 | E11: =C11*6+D11 -> 23 | G11: 5 | H11: 8 | I11: =G11*6+H11 -> 38 | K11: 11 | L11: 12 | M11: =K11*6+L11 -> 78 | O11: 15 | P11: 14 | Q11: =O11*6+P11 -> 104
A12: BEST PLAYERS | W12: TEAM | X12: W | Y12: L | Z12: D | AA12: FOR | AB12: AGST | AC12: % | AD12: PTS
A13: SUNSHINE | C13: BENSON | F13: LLOYD | I13: FOREMAN | L13: SLADDIN | O13: PIERCZK | R13: HUTCHISON
A14: NORTHCOTE | C14: McINTYRE | F14: ROBERTSON | I14: KREYMBORG | L14: WATT | O14: TRESSIDER | R14: BRAIN | W14: CAMBERWELL | X14: 1 | Y14: 0 | Z14: 0 | AA14: 143 | AB14: 85 | AC14: =(AA14*100)/AB14 -> 168.23529411764707 | AD14: =(X14*4)+(Z14*2) -> 4
A15: GOALKICKERS | W15: BRUNSWICK | X15: 1 | Y15: 0 | Z15: 0 | AA15: 131 | AB15: 101 | AC15: =(AA15*100)/AB15 -> 129.70297029702971 | AD15: =(X15*4)+(Z15*2) -> 4
A16: SUNSHINE | C16: BENSON 5 | E16: LLOYD 4 | G16: IZZARD 3 | I16: CLARKE 2 | K16: HUTCHISON 2 | N16: FOREMAN | P16: MARTIN | W16: SUNSHINE | X16: 1 | Y16: 0 | Z16: 0 | AA16: 117 | AB16: 104 | AC16: =(AA16*100)/AB16 -> 112.5 | AD16: =(X16*4)+(Z16*2) -> 4
A17: NORTHCOTE | C17: CHAPMAN 5 | F17: RYAN 3 | H17: LING 2 | J17: ROBERTSON | M17: TRESSIDER | O17: KREYMBORG | R17: JAMES | T17: McNEILL | W17: YARRAVILLE | X17: 1 | Y17: 0 | Z17: 0 | AA17: 88 | AB17: 79 | AC17: =(AA17*100)/AB17 -> 111.39240506329114 | AD17: =(X17*4)+(Z17*2) -> 4
A19: YARRAVILLE | C19: 5 | D19: 6 | E19: =C19*6+D19 -> 36 | G19: 6 | H19: 10 | I19: =G19*6+H19 -> 46 | K19: 12 | L19: 14 | M19: =K19*6+L19 -> 86 | O19: 12 | P19: 16 | Q19: =O19*6+P19 -> 88 | S19: YARRAVILLE | W19: MORDIALLOC | X19: 1 | Y19: 0 | Z19: 0 | AA19: 97 | AB19: 88 | AC19: =(AA19*100)/AB19 -> 110.22727272727273 | AD19: =(X19*4)+(Z19*2) -> 4
A20: FRANKSTON | C20: 3 | D20: 4 | E20: =C20*6+D20 -> 22 | G20: 5 | H20: 4 | I20: =G20*6+H20 -> 34 | K20: 7 | L20: 11 | M20: =K20*6+L20 -> 53 | O20: 11 | P20: 13 | Q20: =O20*6+P20 -> 79 | W20: BOX HILL | X20: 0 | Y20: 1 | Z20: 0 | AA20: 88 | AB20: 97 | AC20: =(AA20*100)/AB20 -> 90.721649484536087 | AD20: =(X20*4)+(Z20*2) -> 0
A21: BEST PLAYERS | W21: FRANKSTON | X21: 0 | Y21: 1 | Z21: 0 | AA21: 79 | AB21: 88 | AC21: =(AA21*100)/AB21 -> 89.772727272727266 | AD21: =(X21*4)+(Z21*2) -> 0
A22: YARRAVILLE | C22: SQUIRE | F22: McLAREN | I22: MARTIN | L22: ARCHER | O22: BARCLAY | R22: SHIELDS | W22: NORTHCOTE | X22: 0 | Y22: 1 | Z22: 0 | AA22: 104 | AB22: 117 | AC22: =(AA22*100)/AB22 -> 88.888888888888886 | AD22: =(X22*4)+(Z22*2) -> 0
A23: FRANKSTON | C23: KENDALL | F23: LOCCO | I23: A DOHERTY | L23: C DOHERTY | O23: FALKINER | R23: STAPLETON | W23: WERRIBEE | X23: 0 | Y23: 1 | Z23: 0 | AA23: 101 | AB23: 131 | AC23: =(AA23*100)/AB23 -> 77.099236641221367 | AD23: =(X23*4)+(Z23*2) -> 0
A24: GOALKICKERS | W24: WAVERLEY | X24: 0 | Y24: 1 | Z24: 0 | AA24: 85 | AB24: 143 | AC24: =(AA24*100)/AB24 -> 59.44055944055944 | AD24: =(X24*4)+(Z24*2) -> 0
A25: YARRAVILLE | C25: SHIELDS 5 | E25: McLAREN 4 | H25: TAURINS 3 | J25: SHARP 2 | L25: MARTIN 2 | N25: ARCHER | P25: JOSLIN
A26: FRANKSTON | C26: STAPLETON 3 | F26: HARRISON 2 | I26: FALKINER 2 | K26: A DOHERTY | N26: C DOHERTY | Q26: LOVELOCK | S26: LOCCO
A28: CAMBERWELL | C28: 5 | D28: 5 | E28: =C28*6+D28 -> 35 | G28: 9 | H28: 12 | I28: =G28*6+H28 -> 66 | K28: 13 | L28: 15 | M28: =K28*6+L28 -> 93 | O28: 21 | P28: 17 | Q28: =O28*6+P28 -> 143 | S28: CAMBERWELL
A29: WAVERLEY | C29: 3 | D29: 4 | E29: =C29*6+D29 -> 22 | G29: 5 | H29: 8 | I29: =G29*6+H29 -> 38 | K29: 8 | L29: 12 | M29: =K29*6+L29 -> 60 | O29: 12 | P29: 13 | Q29: =O29*6+P29 -> 85 | S29: HAYES
A30: BEST PLAYERS
A31: CAMBERWELL | C31: BOWDEN | F31: HAMMOND | I31: HAZLETT | L31: HOOK | O31: ANDREWS | R31: STONE
A32: WAVERLEY | C32: LEES | F32: HOLDSWORTH | I32: LARAGY | L32: COSTELLO | O32: OSBORNE
A33: GOALKICKERS
A34: CAMBERWELL | C34: HAMMOND 10 | F34: ANDREWS 7 | I34: SIMPSON 2 | L34: McCULLOCH | O34: ROBSON
A35: WAVERLEY | C35: LEES 4 | E35: ZIESLER 3 | G35: COSTELLO 2 | J35: HOLDSWORTH 2 | N35: ALLAN
A37: MORDIALLOC | C37: 5 | D37: 3 | E37: =C37*6+D37 -> 33 | G37: 11 | H37: 6 | I37: =G37*6+H37 -> 72 | K37: 11 | L37: 9 | M37: =K37*6+L37 -> 75 | O37: 14 | P37: 13 | Q37: =O37*6+P37 -> 97 | S37: MORDIALLOC
A38: BOX HILL | C38: 5 | D38: 6 | E38: =C38*6+D38 -> 36 | G38: 6 | H38: 10 | I38: =G38*6+H38 -> 46 | K38: 12 | L38: 14 | M38: =K38*6+L38 -> 86 | O38: 12 | P38: 16 | Q38: =O38*6+P38 -> 88 | S38: COLLINS
A39: BEST PLAYERS
A40: MORDIALLOC | C40: LANG | F40: SCAIFFE | I40: McDONALD | L40: HARRY | O40: O'BRIEN | R40: DINGLE
A41: BOX HILL | C41: BAKER | F41: LASKIE | I41: WATERS | L41: BRYANT | O41: TIERNEY
A42: GOALKICKERS
A43: MORDIALLOC | C43: HARRY 4 | E43: McDONALD 4 | H43: O'BRIEN 3 | J43: SCAIFFE | L43: SIGNORETTI | O43: WOOTTEN
A44: BOX HILL | C44: LASKIE 4 | E44: TURNER 2 | G44: BAKER 2 | I44: GREEN | K44: COUTTS | M44: TIERNEY | O44: LOVE
A46: BRUNSWICK | C46: 2 | D46: 1 | E46: =C46*6+D46 -> 13 | G46: 9 | H46: 6 | I46: =G46*6+H46 -> 60 | K46: 15 | L46: 9 | M46: =K46*6+L46 -> 99 | O46: 19 | P46: 17 | Q46: =O46*6+P46 -> 131 | S46: WERRIBEE
A47: WERRIBEE | C47: 6 | D47: 6 | E47: =C47*6+D47 -> 42 | G47: 8 | H47: 8 | I47: =G47*6+H47 -> 56 | K47: 13 | L47: 10 | M47: =K47*6+L47 -> 88 | O47: 15 | P47: 11 | Q47: =O47*6+P47 -> 101
A48: BEST PLAYERS
A49: BRUNSWICK | C49: NOLAN | F49: BAIRD | I49: O'CONNOR | L49: PERRY | O49: LAKER
A50: WERRIBEE | C50: BOURKE | F50: DARUL | I50: ANDERSON | L50: HARVEY | O50: DEY | Q50: McNAUGHTON
A51: GOALKICKERS
A52: BRUNSWICK | C52: BAIRD 8 | F52: O'CONNOR 2 | I52: NUNN 2 | K52: ROWE 2 | M52: BAKER | O52: NOLAN | Q52: NORTON | S52: JOSEPH | U52: LIAKOUREAS
A53: WERRIBEE | C53: JOHNSON 4 | F53: BOURKE 3 | I53: VAUGHAN 2 | L53: ARRIGO | N53: DOUGLAS | P53: McLEOD | R53: ANDERSON | T53: BELLIN | V53: KENNEDY
A55: ROUND 2 | E55: 13TH APRIL | J55: WEATHER | S55: PLAYED AT
D56: 1ST QTR | H56: 2ND QTR | L56: 3RD QTR | P56: FINAL | S56: BRUNSWICK
A57: BRUNSWICK | C57: 4 | D57: 2 | E57: =C57*6+D57 -> 26 | G57: 10 | H57: 8 | I57: =G57*6+H57 -> 68 | K57: 17 | L57: 14 | M57: =K57*6+L57 -> 116 | O57: 21 | P57: 19 | Q57: =O57*6+P57 -> 145 | S57: UMPIRE | X57: LADDER | AB57: ROUND | AD57: 2
A58: MORDIALLOC | C58: 2 | D58: 5 | E58: =C58*6+D58 -> 17 | G58: 3 | H58: 7 | I58: =G58*6+H58 -> 25 | K58: 7 | L58: 8 | M58: =K58*6+L58 -> 50 | O58: 12 | P58: 10 | Q58: =O58*6+P58 -> 82 | S58: HUGGINS
A59: BEST PLAYERS | W59: TEAM | X59: W | Y59: L | Z59: D | AA59: FOR | AB59: AGST | AC59: % | AD59: PTS
A60: BRUNSWICK | C60: ROWE | F60: HADZILLIAS | I60: O'CONNOR | L60: WARDEN | O60: SMITH | R60: FORD
A61: MORDIALLOC | C61: EDDY | F61: DEATON | I61: BESANKO | L61: SCAIFFE | O61: DINGLE | R61: DAVEY | W61: SUNSHINE | X61: 2 | Y61: 0 | Z61: 0 | AA61: 282 | AB61: 176 | AC61: =(AA61*100)/AB61 -> 160.22727272727272 | AD61: =(X61*4)+(Z61*2) -> 8
A62: GOALKICKERS | W62: BRUNSWICK | X62: 2 | Y62: 0 | Z62: 0 | AA62: 276 | AB62: 183 | AC62: =(AA62*100)/AB62 -> 150.81967213114754 | AD62: =(X62*4)+(Z62*2) -> 8
A63: BRUNSWICK | C63: BAIRD 6 | E63: WARDEN 5 | H63: ORTON 4 | J63: O'CONNOR 2 | M63: JOSEPH 2 | O63: ROWE 2 | W63: CAMBERWELL | X63: 2 | Y63: 0 | Z63: 0 | AA63: 248 | AB63: 183 | AC63: =(AA63*100)/AB63 -> 135.51912568306011 | AD63: =(X63*4)+(Z63*2) -> 8
A64: MORDIALLOC | C64: HARRY 4 | E64: O'BRIEN 3 | H64: McDONALD 2 | K64: SCAIFFE | M64: GUY | O64: DINGLE | W64: WAVERLEY | X64: 1 | Y64: 1 | Z64: 0 | AA64: 280 | AB64: 244 | AC64: =(AA64*100)/AB64 -> 114.75409836065573 | AD64: =(X64*4)+(Z64*2) -> 4
A66: CAMBERWELL | C66: 4 | D66: 5 | E66: =C66*6+D66 -> 29 | G66: 9 | H66: 9 | I66: =G66*6+H66 -> 63 | K66: 13 | L66: 13 | M66: =K66*6+L66 -> 91 | O66: 14 | P66: 21 | Q66: =O66*6+P66 -> 105 | S66: BOX HILL | W66: NORTHCOTE | X66: 1 | Y66: 1 | Z66: 0 | AA66: 233 | AB66: 243 | AC66: =(AA66*100)/AB66 -> 95.884773662551439 | AD66: =(X66*4)+(Z66*2) -> 4
A67: BOX HILL | C67: 2 | D67: 2 | E67: =C67*6+D67 -> 14 | G67: 6 | H67: 5 | I67: =G67*6+H67 -> 41 | K67: 10 | L67: 10 | M67: =K67*6+L67 -> 70 | O67: 14 | P67: 14 | Q67: =O67*6+P67 -> 98 | S67: O'BRIEN | W67: MORDIALLOC | X67: 1 | Y67: 1 | Z67: 0 | AA67: 179 | AB67: 233 | AC67: =(AA67*100)/AB67 -> 76.824034334763951 | AD67: =(X67*4)+(Z67*2) -> 4
A68: BEST PLAYERS | W68: YARRAVILLE | X68: 1 | Y68: 1 | Z68: 0 | AA68: 189 | AB68: 274 | AC68: =(AA68*100)/AB68 -> 68.978102189781026 | AD68: =(X68*4)+(Z68*2) -> 4
A69: CAMBERWELL | C69: STONE | F69: BOWDEN | I69: STOREY | L69: McCULLOCH | O69: OLIVER | R69: PARSONS | W69: FRANKSTON | X69: 0 | Y69: 2 | Z69: 0 | AA69: 205 | AB69: 217 | AC69: =(AA69*100)/AB69 -> 94.47004608294931 | AD69: =(X69*4)+(Z69*2) -> 0
A70: BOX HILL | C70: LASKIE | F70: BRYANT | I70: ZANTUCK | L70: LAWTHER | O70: BARNETT | R70: GREEN | W70: BOX HILL | X70: 0 | Y70: 2 | Z70: 0 | AA70: 186 | AB70: 202 | AC70: =(AA70*100)/AB70 -> 92.079207920792072 | AD70: =(X70*4)+(Z70*2) -> 0
A71: GOALKICKERS | W71: WERRIBEE | X71: 0 | Y71: 2 | Z71: 0 | AA71: 173 | AB71: 296 | AC71: =(AA71*100)/AB71 -> 58.445945945945944 | AD71: =(X71*4)+(Z71*2) -> 0
A72: CAMBERWELL | C72: ANDREWS 4 | F72: HAMMOND 3 | I72: SIMPSON 2 | L72: McCULLOCH 2 | O72: STONE | Q72: LINNELL | S72: STOREY
A73: BOX HILL | C73: LASKIE 7 | F73: TIERNEY 2 | I73: A'HALE 2 | K73: COUTTS | M73: KING | O73: BAKER
A75: WAVERLEY | C75: 9 | D75: 4 | E75: =C75*6+D75 -> 58 | G75: 14 | H75: 11 | I75: =G75*6+H75 -> 95 | K75: 22 | L75: 16 | M75: =K75*6+L75 -> 148 | O75: 29 | P75: 21 | Q75: =O75*6+P75 -> 195 | S75: WAVERLEY
A76: YARRAVILLE | C76: 0 | D76: 1 | E76: =C76*6+D76 -> 1 | G76: 2 | H76: 3 | I76: =G76*6+H76 -> 15 | K76: 9 | L76: 3 | M76: =K76*6+L76 -> 57 | O76: 16 | P76: 5 | Q76: =O76*6+P76 -> 101 | S76: WENN
A77: BEST PLAYERS
A78: WAVERLEY | C78: COSTELLO | F78: SMEDTS | I78: ALLAN | L78: HOLDSWORTH | O78: LEES | Q78: LARAGY
A79: YARRAVILLE | C79: A BROPHY | F79: MARTIN | I79: BARCLAY | L79: TAURINS | O79: RYAN
A80: GOALKICKERS
A81: WAVERLEY | C81: COSTELLO 8 | F81: ZIESLER 7 | I81: SMEDTS 4 | K81: McKAY 4 | M81: ALLAN 3 | O81: LANCASHIRE | R81: LEES | T81: HOLDSWORTH
A82: YARRAVILLE | C82: SHIELDS 3 | E82: BARCLAY 2 | G82: TAURINS 2 | J82: RYAN 2 | L82: MARTIN 2 | N82: LEWIS | P82: JOSLIN | R82: MATHESON | T82: LOWE | V82: McLAREN
A84: NORTHCOTE | C84: 4 | D84: 3 | E84: =C84*6+D84 -> 27 | G84: 12 | H84: 9 | I84: =G84*6+H84 -> 81 | K84: 15 | L84: 14 | M84: =K84*6+L84 -> 104 | O84: 19 | P84: 15 | Q84: =O84*6+P84 -> 129 | S84: FRANKSTON
A85: FRANKSTON | C85: 5 | D85: 5 | E85: =C85*6+D85 -> 35 | G85: 9 | H85: 7 | I85: =G85*6+H85 -> 61 | K85: 13 | L85: 10 | M85: =K85*6+L85 -> 88 | O85: 19 | P85: 12 | Q85: =O85*6+P85 -> 126 | S85: DAVIS
A86: BEST PLAYERS
A87: NORTHCOTE | C87: ROBERTS | F87: CHAPMAN | I87: RYAN | L87: REDENBACK | O87: McINTYRE | R87: AFFLECK
A88: FRANKSTON | C88: DAVIES | F88: KENDALL | I88: LLOYD | L88: DARTS | O88: LOCCO | R88: BURNS
A89: GOALKICKERS
A90: NORTHCOTE | C90: CHAPMAN 6 | F90: RYAN 3 | H90: McARDLE 3 | K90: TARGETT 3 | M90: BRAIN 2 | O90: JAMES | Q90: KREYMBORG
A91: FRANKSTON | C91: JUNGWIRTH 4 | F91: FALKINER 4 | I91: STAPLETON 4 | L91: HARRISON 3 | N91: BURNS 3 | P91: DARTS
A93: SUNSHINE | C93: 4 | D93: 5 | E93: =C93*6+D93 -> 29 | G93: 14 | H93: 5 | I93: =G93*6+H93 -> 89 | K93: 21 | L93: 11 | M93: =K93*6+L93 -> 137 | O93: 25 | P93: 15 | Q93: =O93*6+P93 -> 165 | S93: SUNSHINE
A94: WERRIBEE | C94: 1 | D94: 3 | E94: =C94*6+D94 -> 9 | G94: 4 | H94: 5 | I94: =G94*6+H94 -> 29 | K94: 9 | L94: 7 | M94: =K94*6+L94 -> 61 | O94: 10 | P94: 12 | Q94: =O94*6+P94 -> 72 | S94: HAYES
A95: BEST PLAYERS
A96: SUNSHINE | C96: GOOLD | F96: HUTCHISON | I96: BENSON | L96: LLOYD | O96: RICHARDS | R96: CLARKE
A97: WERRIBEE | C97: BOURKE | F97: DEY | I97: BELLIN | L97: SCARFE | O97: HAMBLIN | R97: McNAUGHTON
A98: GOALKICKERS
A99: SUNSHINE | C99: HUTCHISON 7 | F99: LLOYD 7 | H99: BRETT 4 | J99: MARTIN 2 | M99: BAIRD 2 | O99: CLARKE | Q99: FOREMAN | T99: PAXTON
A100: WERRIBEE | C100: MITCHELL 3 | F100: BOURKE 2 | I100: YOUNG 2 | K100: MORRIS | M100: EVANS | O100: ANDERSON
A102: ROUND 3 | E102: 20TH APRIL | J102: WEATHER | S102: PLAYED AT
D103: 1ST QTR | H103: 2ND QTR | L103: 3RD QTR | P103: FINAL | S103: FRANKSTON
A104: FRANKSTON | C104: 6 | D104: 5 | E104: =C104*6+D104 -> 41 | G104: 9 | H104: 11 | I104: =G104*6+H104 -> 65 | K104: 11 | L104: 17 | M104: =K104*6+L104 -> 83 | O104: 15 | P104: 20 | Q104: =O104*6+P104 -> 110 | S104: UMPIRE | X104: LADDER | AB104: ROUND | AD104: 3
A105: WAVERLEY | C105: 2 | D105: 4 | E105: =C105*6+D105 -> 16 | G105: 5 | H105: 10 | I105: =G105*6+H105 -> 40 | K105: 11 | L105: 13 | M105: =K105*6+L105 -> 79 | O105: 15 | P105: 16 | Q105: =O105*6+P105 -> 106 | S105: MARCY
A106: BEST PLAYERS | W106: TEAM | X106: W | Y106: L | Z106: D | AA106: FOR | AB106: AGST | AC106: % | AD106: PTS
A107: FRANKSTON | C107: LOCCO | F107: LOVELOCK | I107: THATCHER | L107: SHEPHERD | O107: D ? | R107: ROSENBROCK
A108: WAVERLEY | C108: PAPWORTH | F108: SYKES | I108: COSTELLO | L108: KO ? | O108: ALLAN | R108: LANCASHIRE | W108: CAMBERWELL | X108: 3 | Y108: 0 | Z108: 0 | AA108: 444 | AB108: 242 | AC108: =(AA108*100)/AB108 -> 183.47107438016528 | AD108: =(X108*4)+(Z108*2) -> 12
A109: GOALKICKERS | W109: SUNSHINE | X109: 3 | Y109: 0 | Z109: 0 | AA109: 392 | AB109: 245 | AC109: =(AA109*100)/AB109 -> 160 | AD109: =(X109*4)+(Z109*2) -> 12
A110: FRANKSTON | C110: HA ? 4 | F110: LOVELOCK 3 | I110: THATCHER 2 | L110: EDWARDS 2 | N110: ELLIS 2 | P110: KENDALL | R110: LOCCO | W110: BRUNSWICK | X110: 3 | Y110: 0 | Z110: 0 | AA110: 413 | AB110: 289 | AC110: =(AA110*100)/AB110 -> 142.90657439446366 | AD110: =(X110*4)+(Z110*2) -> 12
A111: WAVERLEY | C111: ZIESLER 4 | F111: COSTELLO 4 | I111: ? 2 | L111: HOLDSWORTH 2 | O111: McKAY | Q111: LEES | W111: MORDIALLOC | X111: 2 | Y111: 1 | Z111: 0 | AA111: 278 | AB111: 330 | AC111: =(AA111*100)/AB111 -> 84.242424242424249 | AD111: =(X111*4)+(Z111*2) -> 8
A113: SUNSHINE | C113: 1 | D113: 6 | E113: =C113*6+D113 -> 12 | G113: 4 | H113: 9 | I113: =G113*6+H113 -> 33 | K113: 10 | L113: 12 | M113: =K113*6+L113 -> 72 | O113: 15 | P113: 20 | Q113: =O113*6+P113 -> 110 | S113: SUNSHINE | W113: WAVERLEY | X113: 1 | Y113: 2 | Z113: 0 | AA113: 386 | AB113: 354 | AC113: =(AA113*100)/AB113 -> 109.03954802259886 | AD113: =(X113*4)+(Z113*2) -> 4
A114: BOX HILL | C114: 3 | D114: 2 | E114: =C114*6+D114 -> 20 | G114: 4 | H114: 5 | I114: =G114*6+H114 -> 29 | K114: 6 | L114: 9 | M114: =K114*6+L114 -> 45 | O114: 9 | P114: 15 | Q114: =O114*6+P114 -> 69 | S114: ABBOTT | W114: FRANKSTON | X114: 1 | Y114: 2 | Z114: 0 | AA114: 315 | AB114: 323 | AC114: =(AA114*100)/AB114 -> 97.523219814241486 | AD114: =(X114*4)+(Z114*2) -> 4
A115: BEST PLAYERS | W115: NORTHCOTE | X115: 1 | Y115: 2 | Z115: 0 | AA115: 339 | AB115: 380 | AC115: =(AA115*100)/AB115 -> 89.21052631578948 | AD115: =(X115*4)+(Z115*2) -> 4
A116: SUNSHINE | C116: SLADDIN | F116: JOWETT | I116: RICHARDS | L116: MITCHELL | O116: BAIRD | Q116: ARRIGO | W116: YARRAVILLE | X116: 1 | Y116: 2 | Z116: 0 | AA116: 286 | AB116: 373 | AC116: =(AA116*100)/AB116 -> 76.675603217158184 | AD116: =(X116*4)+(Z116*2) -> 4
A117: BOX HILL | C117: WATERS | F117: BRYANT | I117: GREEN | L117: CURTIS | O117: B ? | W117: BOX HILL | X117: 0 | Y117: 3 | Z117: 0 | AA117: 255 | AB117: 312 | AC117: =(AA117*100)/AB117 -> 81.730769230769226 | AD117: =(X117*4)+(Z117*2) -> 0
A118: GOALKICKERS | W118: WERRIBEE | X118: 0 | Y118: 3 | Z118: 0 | AA118: 232 | AB118: 492 | AC118: =(AA118*100)/AB118 -> 47.154471544715449 | AD118: =(X118*4)+(Z118*2) -> 0
A119: SUNSHINE | C119: BAIRD 5 | E119: BENSON 3 | G119: JOWETT 2 | I119: GOOLD | K119: PAXTON | M119: SLADDIN | O119: DE ARRAUGO | R119: IZZARD
A120: BOX HILL | C120: McMASTER 3 | F120: COUTTS 2 | I120: B ? 2 | K120: YEE / 2
A122: BRUNSWICK | C122: 3 | D122: 5 | E122: =C122*6+D122 -> 23 | G122: 8 | H122: 10 | I122: =G122*6+H122 -> 58 | K122: 14 | L122: 13 | M122: =K122*6+L122 -> 97 | O122: 20 | P122: 17 | Q122: =O122*6+P122 -> 137 | S122: NORTHCOTE
A123: NORTHCOTE | C123: 5 | D123: 2 | E123: =C123*6+D123 -> 32 | G123: 7 | H123: 3 | I123: =G123*6+H123 -> 45 | K123: 12 | L123: 7 | M123: =K123*6+L123 -> 79 | O123: 16 | P123: 10 | Q123: =O123*6+P123 -> 106 | S123: TORNEY
A124: BEST PLAYERS
A125: BRUNSWICK | C125: WARDEN | F125: LIAKOUREAS | I125: LAKE | L125: HADZILLIAS | O125: ? | R125: O'CONNOR
A126: NORTHCOTE | C126: AFFLECK | F126: McARDLE | I126: REDENBACH | L126: CHAPMAN | O126: M RYAN | R126: G RYAN
A127: GOALKICKERS
A128: BRUNSWICK | C128: WARDEN 7 | F128: ORTON 5 | H128: BAIRD 3 | J128: O'CONNOR | M128: LAKER | O128: VALENTINE | R128: LEWIS | U128: 1
A129: NORTHCOTE | C129: CHAPMAN 5 | F129: T ? 4 | I129: G RYAN 3 | K129: McARDLE | M129: BRAIN | O129: AFFLECK | Q129: STILSBY
A131: CAMBERWELL | C131: 9 | D131: 5 | E131: =C131*6+D131 -> 59 | G131: 13 | H131: 12 | I131: =G131*6+H131 -> 90 | K131: 25 | L131: 18 | M131: =K131*6+L131 -> 168 | O131: 29 | P131: 22 | Q131: =O131*6+P131 -> 196 | S131: CAMBERWELL
A132: WERRIBEE | C132: 2 | D132: 1 | E132: =C132*6+D132 -> 13 | G132: 6 | H132: 6 | I132: =G132*6+H132 -> 42 | K132: 6 | L132: 7 | M132: =K132*6+L132 -> 43 | O132: 8 | P132: 11 | Q132: =O132*6+P132 -> 59 | S132: VERGONA
A133: BEST PLAYERS
A134: CAMBERWELL | C134: HAMMOND | F134: SPITHILL | I134: CUTTING | L134: McCULLOCH | O134: HOOK | Q134: PARSONS
A135: WERRIBEE | C135: BORTON | F135: HAMBLIN | I135: F MITCHELL | L135: SCARFE | O135: DEY
A136: GOALKICKERS
A137: CAMBERWELL | C137: HAMMOND 11 | F137: SIMPSON 5 | I137: McCULLOCH 4 | L137: ? 2 | N137: DOBSON | P137: HOOK | R137: BO ? | T137: ANDREWS | W137: KENNEDY | X137: STONE
A138: WERRIBEE | C138: NORTON 4 | F138: BELLIN 2 | I138: F MITCHELL | L138: N MITCHELL
A140: MORDIALLOC | C140: 5 | D140: 2 | E140: =C140*6+D140 -> 32 | G140: 6 | H140: 3 | I140: =G140*6+H140 -> 39 | K140: 11 | L140: 4 | M140: =K140*6+L140 -> 70 | O140: 15 | P140: 9 | Q140: =O140*6+P140 -> 99 | S140: MORDIALLOC
A141: YARRAVILLE | C141: 2 | D141: 3 | E141: =C141*6+D141 -> 15 | G141: 10 | H141: 11 | I141: =G141*6+H141 -> 71 | K141: 12 | L141: 15 | M141: =K141*6+L141 -> 87 | O141: 13 | P141: 19 | Q141: =O141*6+P141 -> 97 | S141: MATHEWS
A142: BEST PLAYERS
A143: MORDIALLOC | C143: O ? | F143: HARRY | I143: SCAIFFE | L143: DAVEY | O143: DEATON | R143: BASTIAN
A144: YARRAVILLE | C144: JOSLIN | F144: T ? | I144: MARTIN | L144: MATTSON | O144: R WILKINSON | R144: BARCLAY
A145: GOALKICKERS
A146: MORDIALLOC | C146: O ? 6 | F146: HARRY 4 | I146: DINGLE 2 | K146: DEATON | M146: McDONALD | P146: BASTIAN
A147: YARRAVILLE | C147: R WILKINSON 2 | F147: W HARRISON 2 | I147: ? 2 | K147: BARR 2 | M147: SHIELDS 2 | O147: LOWE | Q147: MARTIN | S147: BARCLAY
A149: ROUND 4 | E149: 27TH APRIL | J149: WEATHER | S149: PLAYED AT
D150: 1ST QTR | H150: 2ND QTR | L150: 3RD QTR | P150: FINAL | S150: BRUNSWICK
A151: BRUNSWICK | C151: 3 | D151: 8 | E151: =C151*6+D151 -> 26 | G151: 7 | H151: 12 | I151: =G151*6+H151 -> 54 | K151: 10 | L151: 15 | M151: =K151*6+L151 -> 75 | O151: 16 | P151: 18 | Q151: =O151*6+P151 -> 114 | S151: UMPIRE | X151: LADDER | AB151: ROUND | AD151: 4
A152: SUNSHINE | C152: 3 | D152: 4 | E152: =C152*6+D152 -> 22 | G152: 7 | H152: 9 | I152: =G152*6+H152 -> 51 | K152: 12 | L152: 10 | M152: =K152*6+L152 -> 82 | O152: 15 | P152: 15 | Q152: =O152*6+P152 -> 105
A153: BEST PLAYERS | W153: TEAM | X153: W | Y153: L | Z153: D | AA153: FOR | AB153: AGST | AC153: % | AD153: PTS
A154: BRUNSWICK | C154: ROWE | F154: HADZILLIAS | I154: BAIRD | L154: LAKER | N154: SMITH | Q154: NOLAN
A155: SUNSHINE | C155: PIERCZAK | F155: MARTIN | I155: HUTCHISON | L155: GOOLD | N155: BENSON | Q155: BAIRD | W155: CAMBERWELL | X155: 4 | Y155: 0 | Z155: 0 | AA155: 566 | AB155: 323 | AC155: =(AA155*100)/AB155 -> 175.23219814241486 | AD155: =(X155*4)+(Z155*2) -> 16
A156: GOALKICKERS | W156: BRUNSWICK | X156: 4 | Y156: 0 | Z156: 0 | AA156: 527 | AB156: 394 | AC156: =(AA156*100)/AB156 -> 133.75634517766497 | AD156: =(X156*4)+(Z156*2) -> 16
A157: BRUNSWICK | C157: BAIRD 6 | E157: WARDEN 2 | H157: LAKER 2 | J157: ROWE 2 | L157: JOSEPH | N157: O'CONNOR | P157: ORTON | R157: SCHIMMELBUSCH | W157: SUNSHINE | X157: 3 | Y157: 1 | Z157: 0 | AA157: 497 | AB157: 359 | AC157: =(AA157*100)/AB157 -> 138.44011142061282 | AD157: =(X157*4)+(Z157*2) -> 12
A158: SUNSHINE | C158: HUTCHISON 7 | F158: BAIRD 4 | H158: JOWETT | J158: FEBEY | L158: RICHARDS | N158: PAXTON | W158: MORDIALLOC | X158: 3 | Y158: 1 | Z158: 0 | AA158: 447 | AB158: 458 | AC158: =(AA158*100)/AB158 -> 97.598253275109172 | AD158: =(X158*4)+(Z158*2) -> 12
A160: FRANKSTON | C160: 5 | D160: 3 | E160: =C160*6+D160 -> 33 | G160: 12 | H160: 9 | I160: =G160*6+H160 -> 81 | K160: 13 | L160: 9 | M160: =K160*6+L160 -> 87 | O160: 16 | P160: 11 | Q160: =O160*6+P160 -> 107 | S160: BOX HILL | W160: NORTHCOTE | X160: 2 | Y160: 2 | Z160: 0 | AA160: 504 | AB160: 477 | AC160: =(AA160*100)/AB160 -> 105.66037735849056 | AD160: =(X160*4)+(Z160*2) -> 8
A161: BOX HILL | C161: 5 | D161: 3 | E161: =C161*6+D161 -> 33 | G161: 9 | H161: 4 | I161: =G161*6+H161 -> 58 | K161: 10 | L161: 9 | M161: =K161*6+L161 -> 69 | O161: 12 | P161: 15 | Q161: =O161*6+P161 -> 87 | S161: MATHEWS | W161: FRANKSTON | X161: 2 | Y161: 2 | Z161: 0 | AA161: 422 | AB161: 410 | AC161: =(AA161*100)/AB161 -> 102.92682926829268 | AD161: =(X161*4)+(Z161*2) -> 8
A162: BEST PLAYERS | W162: WAVERLEY | X162: 1 | Y162: 3 | Z162: 0 | AA162: 514 | AB162: 523 | AC162: =(AA162*100)/AB162 -> 98.279158699808789 | AD162: =(X162*4)+(Z162*2) -> 4
A163: FRANKSTON | C163: LOVELOCK | F163: LOCCO | I163: FALKINER | L163: DAVIES | O163: EDWARDS | R163: TICKELL | W163: YARRAVILLE | X163: 1 | Y163: 3 | Z163: 0 | AA163: 367 | AB163: 495 | AC163: =(AA163*100)/AB163 -> 74.141414141414145 | AD163: =(X163*4)+(Z163*2) -> 4
A164: BOX HILL | C164: BRYANT | F164: COUTTS | I164: McMASTER | L164: LAWTHER | O164: McCANN | W164: BOX HILL | X164: 0 | Y164: 4 | Z164: 0 | AA164: 342 | AB164: 419 | AC164: =(AA164*100)/AB164 -> 81.622911694510734 | AD164: =(X164*4)+(Z164*2) -> 0
A165: GOALKICKERS | W165: WERRIBEE | X165: 0 | Y165: 4 | Z165: 0 | AA165: 329 | AB165: 657 | AC165: =(AA165*100)/AB165 -> 50.076103500761036 | AD165: =(X165*4)+(Z165*2) -> 0
A166: FRANKSTON | C166: LOVELOCK 5 | F166: THATCHER 2 | I166: EDWARDS 2 | K166: FALKINER 2 | N166: KENDALL 2 | Q166: ESLER | R166: ELLIS | T166: HUNTER
A167: BOX HILL | C167: McMASTER 4 | F167: LASKIE 2 | H167: GREEN | J167: EDWARDS | M167: COUTTS | O167: ARMSTRONG | R167: CURTIS | U167: LAWTHER
A169: MORDIALLOC | C169: 4 | D169: 4 | E169: =C169*6+D169 -> 28 | G169: 13 | H169: 9 | I169: =G169*6+H169 -> 87 | K169: 16 | L169: 10 | M169: =K169*6+L169 -> 106 | O169: 26 | P169: 13 | Q169: =O169*6+P169 -> 169 | S169: WAVERLEY
A170: WAVERLEY | C170: 6 | D170: 2 | E170: =C170*6+D170 -> 38 | G170: 11 | H170: 4 | I170: =G170*6+H170 -> 70 | K170: 14 | L170: 6 | M170: =K170*6+L170 -> 90 | O170: 20 | P170: 8 | Q170: =O170*6+P170 -> 128 | S170: VERGONA
A171: BEST PLAYERS
A172: MORDIALLOC | C172: WOOTTEN | F172: EDDY | I172: SCAIFFE | L172: DEATON | O172: DINGLE | R172: LANG
A173: WAVERLEY | C173: COSTELLO | F173: McDONALD | I173: SYKES | L173: McKAY | O173: LEES | R173: WILLEY
A174: GOALKICKERS
A175: MORDIALLOC | C175: O'BRIEN 6 | E175: DINGLE 4 | G175: WOOTTEN 4 | J175: DEATON 3 | L175: McDONALD 3 | O175: HARRY 2 | Q175: BASTIAN 2 | S175: SHUGG 2
A176: WAVERLEY | C176: COSTELLO 7 | F176: ZIESLER 4 | I176: McKAY 3 | K176: SYKES 3 | M176: WILLEY 2 | O176: ALLAN
A178: CAMBERWELL | C178: 4 | D178: 3 | E178: =C178*6+D178 -> 27 | G178: 9 | H178: 6 | I178: =G178*6+H178 -> 60 | K178: 15 | L178: 9 | M178: =K178*6+L178 -> 99 | O178: 18 | P178: 14 | Q178: =O178*6+P178 -> 122 | S178: YARRAVILLE
A179: YARRAVILLE | C179: 4 | D179: 5 | E179: =C179*6+D179 -> 29 | G179: 5 | H179: 7 | I179: =G179*6+H179 -> 37 | K179: 7 | L179: 12 | M179: =K179*6+L179 -> 54 | O179: 11 | P179: 15 | Q179: =O179*6+P179 -> 81 | S179: DISTON
A180: BEST PLAYERS
A181: CAMBERWELL | C181: HAZLETT | F181: SPITHILL | I181: STONE | L181: CROWE | O181: HOOK | R181: SIMPSON
A182: YARRAVILLE | C182: MARTIN | F182: JOSLIN | I182: SMITH | L182: SHARP | O182: DOLL
A183: GOALKICKERS
A184: CAMBERWELL | C184: HAMMOND 8 | F184: SAUERBERG 4 | I184: SIMPSON 3 | L184: STONE | N184: KENNEDY | Q184: McCULLOCH
A185: YARRAVILLE | C185: SHARP 3 | F185: RYAN 3 | H185: SHIELDS 2 | K185: R WILKINSON | N185: MATTSON | Q185: TAURINS
A187: NORTHCOTE | C187: 2 | D187: 2 | E187: =C187*6+D187 -> 14 | G187: 8 | H187: 5 | I187: =G187*6+H187 -> 53 | K187: 18 | L187: 6 | M187: =K187*6+L187 -> 114 | O187: 26 | P187: 9 | Q187: =O187*6+P187 -> 165 | S187: WERRIBEE
A188: WERRIBEE | C188: 6 | D188: 2 | E188: =C188*6+D188 -> 38 | G188: 7 | H188: 4 | I188: =G188*6+H188 -> 46 | K188: 9 | L188: 6 | M188: =K188*6+L188 -> 60 | O188: 15 | P188: 7 | Q188: =O188*6+P188 -> 97 | S188: OGSTON
A189: BEST PLAYERS
A190: NORTHCOTE | C190: CHAPMAN | F190: RYAN | I190: ROBERTS | L190: BRAIN | O190: KREYMBORG
A191: WERRIBEE | C191: BOURKE | F191: McCARTNEY | I191: HEATH | L191: HAMBLIN | O191: VAUGHAN | R191: YOUNG
A192: GOALKICKERS
A193: NORTHCOTE | C193: CHAPMAN 15 | F193: RYAN 5 | H193: LING 4 | J193: JAMES | L193: KREYMBORG
A194: WERRIBEE | C194: SCARFE 3 | E194: VAUGHAN 2 | H194: BOURKE 2 | J194: KNEE 2 | L194: HAMBLIN | N194: DEY | O194: MITCHELL | Q194: EVANS | S194: YOUNG | U194: BELLIN
A196: ROUND 5 | E196: 4TH MAY | J196: WEATHER | S196: PLAYED AT
D197: 1ST QTR | H197: 2ND QTR | L197: 3RD QTR | P197: FINAL | S197: WAVERLEY
A198: WAVERLEY | C198: 7 | D198: 2 | E198: =C198*6+D198 -> 44 | G198: 10 | H198: 4 | I198: =G198*6+H198 -> 64 | K198: 18 | L198: 5 | M198: =K198*6+L198 -> 113 | O198: 20 | P198: 9 | Q198: =O198*6+P198 -> 129 | S198: UMPIRE | X198: LADDER | AB198: ROUND | AD198: 5
A199: BOX HILL | C199: 0 | D199: 2 | E199: =C199*6+D199 -> 2 | G199: 7 | H199: 7 | I199: =G199*6+H199 -> 49 | K199: 10 | L199: 10 | M199: =K199*6+L199 -> 70 | O199: 13 | P199: 16 | Q199: =O199*6+P199 -> 94 | S199: OGSTON
A200: BEST PLAYERS | W200: TEAM | X200: W | Y200: L | Z200: D | AA200: FOR | AB200: AGST | AC200: % | AD200: PTS
A201: WAVERLEY | C201: ZIESLER | F201: LUMLEY | I201: LEES | L201: MCKAY | O201: CROUCH | R201: LARAGY
A202: BOX HILL | C202: BRYANT | F202: PAGEY | I202: LAWTHER | L202: CONNOLLY | O202: GREEN | R202: WATERS | W202: CAMBERWELL | X202: 5 | Y202: 0 | Z202: 0 | AA202: 653 | AB202: 397 | AC202: =(AA202*100)/AB202 -> 164.48362720403023 | AD202: =(X202*4)+(Z202*2) -> 20
A203: GOALKICKERS | W203: BRUNSWICK | X203: 4 | Y203: 1 | Z203: 0 | AA203: 636 | AB203: 525 | AC203: =(AA203*100)/AB203 -> 121.14285714285714 | AD203: =(X203*4)+(Z203*2) -> 16
A204: WAVERLEY | C204: ZIESLER 7 | F204: McKAY 5 | I204: COSTELLO 4 | L204: McCLURE 2 | O204: CROUCH | Q204: LEES | W204: SUNSHINE | X204: 3 | Y204: 2 | Z204: 0 | AA204: 571 | AB204: 446 | AC204: =(AA204*100)/AB204 -> 128.02690582959642 | AD204: =(X204*4)+(Z204*2) -> 12
A205: BOX HILL | C205: PAGEY 7 | F205: EDWARDS | I205: McMASTER | L205: ZANTUCK | N205: BAKER | P205: BRYANT | R205: LASKIE | W205: NORTHCOTE | X205: 3 | Y205: 2 | Z205: 0 | AA205: 631 | AB205: 563 | AC205: =(AA205*100)/AB205 -> 112.07815275310834 | AD205: =(X205*4)+(Z205*2) -> 12
A207: FRANKSTON | C207: 3 | D207: 3 | E207: =C207*6+D207 -> 21 | G207: 7 | H207: 6 | I207: =G207*6+H207 -> 48 | K207: 12 | L207: 7 | M207: =K207*6+L207 -> 79 | O207: 20 | P207: 11 | Q207: =O207*6+P207 -> 131 | S207: FRANKSTON | W207: FRANKSTON | X207: 3 | Y207: 2 | Z207: 0 | AA207: 553 | AB207: 519 | AC207: =(AA207*100)/AB207 -> 106.55105973025049 | AD207: =(X207*4)+(Z207*2) -> 12
A208: BRUNSWICK | C208: 5 | D208: 5 | E208: =C208*6+D208 -> 35 | G208: 9 | H208: 9 | I208: =G208*6+H208 -> 63 | K208: 14 | L208: 12 | M208: =K208*6+L208 -> 96 | O208: 16 | P208: 13 | Q208: =O208*6+P208 -> 109 | W208: MORDIALLOC | X208: 3 | Y208: 2 | Z208: 0 | AA208: 533 | AB208: 585 | AC208: =(AA208*100)/AB208 -> 91.111111111111114 | AD208: =(X208*4)+(Z208*2) -> 12
A209: BEST PLAYERS | W209: WAVERLEY | X209: 2 | Y209: 3 | Z209: 0 | AA209: 643 | AB209: 617 | AC209: =(AA209*100)/AB209 -> 104.21393841166937 | AD209: =(X209*4)+(Z209*2) -> 8
A210: FRANKSTON | C210: LOCCO | F210: DAVIES | I210: ELLIS | L210: KENDALL | N210: MORRISON | Q210: FALKINER | W210: YARRAVILLE | X210: 2 | Y210: 3 | Z210: 0 | AA210: 502 | AB210: 578 | AC210: =(AA210*100)/AB210 -> 86.851211072664356 | AD210: =(X210*4)+(Z210*2) -> 8
A211: BRUNSWICK | C211: LAKER | F211: JOSEPH | I211: SCHIMMELBUSCH | M211: BAIRD | O211: WARDEN | W211: BOX HILL | X211: 0 | Y211: 5 | Z211: 0 | AA211: 436 | AB211: 548 | AC211: =(AA211*100)/AB211 -> 79.56204379562044 | AD211: =(X211*4)+(Z211*2) -> 0
A212: GOALKICKERS | W212: WERRIBEE | X212: 0 | Y212: 5 | Z212: 0 | AA212: 412 | AB212: 792 | AC212: =(AA212*100)/AB212 -> 52.020202020202021 | AD212: =(X212*4)+(Z212*2) -> 0
A213: FRANKSTON | C213: HARRISON 5 | F213: LOCCO 5 | H213: ROSENBROCK 4 | K213: KENDALL 2 | M213: HUNTER | O213: LOVELOCK | R213: DARTS | T213: ELLIS
A214: BRUNSWICK | C214: BAIRD 7 | F214: WARDEN 4 | I214: SCHIMMELBUSCH 2 | M214: ZOANETTI | P214: JOSEPH | R214: LAKER
A216: CAMBERWELL | C216: 5 | D216: 6 | E216: =C216*6+D216 -> 36 | G216: 6 | H216: 7 | I216: =G216*6+H216 -> 43 | K216: 9 | L216: 12 | M216: =K216*6+L216 -> 66 | O216: 12 | P216: 15 | Q216: =O216*6+P216 -> 87 | S216: SUNSHINE
A217: SUNSHINE | C217: 2 | D217: 2 | E217: =C217*6+D217 -> 14 | G217: 4 | H217: 5 | I217: =G217*6+H217 -> 29 | K217: 7 | L217: 7 | M217: =K217*6+L217 -> 49 | O217: 11 | P217: 8 | Q217: =O217*6+P217 -> 74 | S217: MARR
A218: BEST PLAYERS
A219: CAMBERWELL | C219: OLIVER | F219: SPITHILL | I219: STONE | L219: CUTTING | O219: McCULLOCH | R219: LEES
A220: SUNSHINE | C220: SLADDIN | F220: PIERZCAK | I220: POTTER | L220: FOREMAN | O220: GOOLD | R220: BAIRD
A221: GOALKICKERS
A222: CAMBERWELL | C222: McCULLOCH 4 | F222: BOWDEN 3 | I222: ANDREWS 2 | L222: LEES | N222: STONE | P222: KENNEDY
A223: SUNSHINE | C223: BAIRD 2 | E223: HUTCHISON 2 | H223: VELLA | J223: FERGUSON | L223: MARTIN | N223: MITCHELL | P223: RUSSELL | R223: BROWN | T223: BENSON
A225: NORTHCOTE | C225: 5 | D225: 1 | E225: =C225*6+D225 -> 31 | G225: 7 | H225: 8 | I225: =G225*6+H225 -> 50 | K225: 10 | L225: 16 | M225: =K225*6+L225 -> 76 | O225: 18 | P225: 19 | Q225: =O225*6+P225 -> 127 | S225: NORTHCOTE
A226: MORDIALLOC | C226: 6 | D226: 2 | E226: =C226*6+D226 -> 38 | G226: 8 | H226: 3 | I226: =G226*6+H226 -> 51 | K226: 10 | L226: 5 | M226: =K226*6+L226 -> 65 | O226: 13 | P226: 8 | Q226: =O226*6+P226 -> 86 | S226: O'BRIE
A227: BEST PLAYERS
A228: NORTHCOTE | C228: ROBERTSON | F228: ROBERTS | I228: McINTYRE | L228: LARAGY | O228: LING | Q228: JAMES
A229: MORDIALLOC | C229: THOMPSON | F229: ROSENOW | I229: RAEBURN | L229: McNAUGHT | O229: DAVEY | Q229: BASTIAN
A230: GOALKICKERS
A231: NORTHCOTE | C231: CHAPMAN 9 | F231: G RYAN 6 | I231: JAMES 2 | K231: CAREY | M231: KREYMBORG
A232: MORDIALLOC | C232: SIGNORETTI 3 | F232: HARRY 3 | H232: WOOTTEN 2 | K232: O'BRIEN | M232: DINGLE | O232: McDONALD | R232: BASTIAN | T232: ROSENOW
A234: YARRAVILLE | C234: 5 | D234: 6 | E234: =C234*6+D234 -> 36 | G234: 11 | H234: 9 | I234: =G234*6+H234 -> 75 | K234: 16 | L234: 15 | M234: =K234*6+L234 -> 111 | O234: 19 | P234: 21 | Q234: =O234*6+P234 -> 135 | S234: WERRIBEE
A235: WERRIBEE | C235: 3 | D235: 3 | E235: =C235*6+D235 -> 21 | G235: 5 | H235: 9 | I235: =G235*6+H235 -> 39 | K235: 8 | L235: 13 | M235: =K235*6+L235 -> 61 | O235: 11 | P235: 17 | Q235: =O235*6+P235 -> 83 | S235: HUGGINS
A236: BEST PLAYERS
A237: YARRAVILLE | C237: R WILKINSON | F237: SQUIRE | I237: BARCLAY | L237: JOSLIN | O237: BARR | Q237: MARTIN
A238: WERRIBEE | C238: YOUNG | F238: BOURKE | I238: KNEE | L238: F MITCHELL | O238: NORTON
A239: GOALKICKERS
A240: YARRAVILLE | C240: P BROPHY 5 | F240: McLAREN 3 | I240: JOSLIN 3 | K240: R WILKINSON | N240: LEWIS | P240: BARR | R240: MARTIN | T240: B WILKINSON
A241: WERRIBEE | C241: NORTON 4 | F241: F MITCHELL 3 | I241: VAUGHAN | L241: SCARFE | N241: NEWITT | P241: KNEE
A243: ROUND 6 | E243: 11TH MAY | J243: WEATHER | S243: PLAYED AT
D244: 1ST QTR | H244: 2ND QTR | L244: 3RD QTR | P244: FINAL | S244: BRUNSWICK
A245: BRUNSWICK | C245: 6 | D245: 4 | E245: =C245*6+D245 -> 40 | G245: 12 | H245: 11 | I245: =G245*6+H245 -> 83 | K245: 17 | L245: 16 | M245: =K245*6+L245 -> 118 | O245: 25 | P245: 21 | Q245: =O245*6+P245 -> 171 | S245: UMPIRE | X245: LADDER | AB245: ROUND | AD245: 6
A246: WAVERLEY | C246: 1 | D246: 3 | E246: =C246*6+D246 -> 9 | G246: 3 | H246: 8 | I246: =G246*6+H246 -> 26 | K246: 5 | L246: 10 | M246: =K246*6+L246 -> 40 | O246: 7 | P246: 12 | Q246: =O246*6+P246 -> 54 | S246: ABBOTT
A247: BEST PLAYERS | W247: TEAM | X247: W | Y247: L | Z247: D | AA247: FOR | AB247: AGST | AC247: % | AD247: PTS
A248: BRUNSWICK | C248: JOSEPH | F248: SCHIMMELBUSCH | J248: ROWE | M248: BAIRD | P248: SMITH | R248: LAKER
A249: WAVERLEY | C249: McCLURE | F249: CROUCH | J249: KELAART | M249: McDONALD | P249: LUMLEY | R249: McKAY | W249: CAMBERWELL | X249: 6 | Y249: 0 | Z249: 0 | AA249: 810 | AB249: 461 | AC249: =(AA249*100)/AB249 -> 175.70498915401302 | AD249: =(X249*4)+(Z249*2) -> 24
A250: GOALKICKERS | W250: BRUNSWICK | X250: 5 | Y250: 1 | Z250: 0 | AA250: 807 | AB250: 579 | AC250: =(AA250*100)/AB250 -> 139.37823834196891 | AD250: =(X250*4)+(Z250*2) -> 20
A251: BRUNSWICK | C251: BAIRD 9 | E251: WARDEN 5 | H251: LIAKOUREAS 4 | K251: ORTON 3 | M251: JOSEPH 2 | O251: ROWE | Q251: LAKER | W251: FRANKSTON | X251: 4 | Y251: 2 | Z251: 0 | AA251: 688 | AB251: 604 | AC251: =(AA251*100)/AB251 -> 113.90728476821192 | AD251: =(X251*4)+(Z251*2) -> 16
A252: WAVERLEY | C252: LUMLEY 2 | F252: McKAY | H252: COSTELLO | J252: CROUCH | M252: ZIESLER | O252: McCLURE | W252: MORDIALLOC | X252: 4 | Y252: 2 | Z252: 0 | AA252: 626 | AB252: 631 | AC252: =(AA252*100)/AB252 -> 99.207606973058631 | AD252: =(X252*4)+(Z252*2) -> 16
A254: FRANKSTON | C254: 4 | D254: 8 | E254: =C254*6+D254 -> 32 | G254: 5 | H254: 9 | I254: =G254*6+H254 -> 39 | K254: 11 | L254: 16 | M254: =K254*6+L254 -> 82 | O254: 19 | P254: 21 | Q254: =O254*6+P254 -> 135 | S254: FRANKSTON | W254: SUNSHINE | X254: 3 | Y254: 3 | Z254: 0 | AA254: 656 | AB254: 581 | AC254: =(AA254*100)/AB254 -> 112.90877796901893 | AD254: =(X254*4)+(Z254*2) -> 12
A255: SUNSHINE | C255: 3 | D255: 2 | E255: =C255*6+D255 -> 20 | G255: 8 | H255: 4 | I255: =G255*6+H255 -> 52 | K255: 9 | L255: 6 | M255: =K255*6+L255 -> 60 | O255: 13 | P255: 7 | Q255: =O255*6+P255 -> 85 | S255: WENN | W255: YARRAVILLE | X255: 3 | Y255: 3 | Z255: 0 | AA255: 640 | AB255: 662 | AC255: =(AA255*100)/AB255 -> 96.676737160120851 | AD255: =(X255*4)+(Z255*2) -> 12
A256: BEST PLAYERS | W256: NORTHCOTE | X256: 3 | Y256: 3 | Z256: 0 | AA256: 695 | AB256: 720 | AC256: =(AA256*100)/AB256 -> 96.527777777777771 | AD256: =(X256*4)+(Z256*2) -> 12
A257: FRANKSTON | C257: LLOYD | F257: DAVIES | I257: ELLIS | L257: LOCCO | N257: KENDALL | Q257: WARD | W257: WAVERLEY | X257: 2 | Y257: 4 | Z257: 0 | AA257: 697 | AB257: 788 | AC257: =(AA257*100)/AB257 -> 88.451776649746193 | AD257: =(X257*4)+(Z257*2) -> 8
A258: SUNSHINE | C258: FOREMAN | F258: BAIRD | I258: BENSON | L258: JONES | N258: PIERZCAK | W258: BOX HILL | X258: 0 | Y258: 6 | Z258: 0 | AA258: 520 | AB258: 686 | AC258: =(AA258*100)/AB258 -> 75.801749271137027 | AD258: =(X258*4)+(Z258*2) -> 0
A259: GOALKICKERS | W259: WERRIBEE | X259: 0 | Y259: 6 | Z259: 0 | AA259: 458 | AB259: 885 | AC259: =(AA259*100)/AB259 -> 51.751412429378533 | AD259: =(X259*4)+(Z259*2) -> 0
A260: FRANKSTON | C260: LOVELOCK 6 | F260: LOCCO 4 | H260: ELLIS 3 | J260: DOHERTY 3 | M260: HARRISON | P260: TICKELL | R260: WARD
A261: SUNSHINE | C261: VELLA 3 | F261: BAIRD 3 | H261: BENSON 3 | J261: HUTCHISON 2 | M261: RUSSELL 2
A263: YARRAVILLE | C263: 4 | D263: 3 | E263: =C263*6+D263 -> 27 | G263: 7 | H263: 8 | I263: =G263*6+H263 -> 50 | K263: 13 | L263: 14 | M263: =K263*6+L263 -> 92 | O263: 19 | P263: 24 | Q263: =O263*6+P263 -> 138 | S263: YARRAVILLE
A264: BOX HILL | C264: 5 | D264: 10 | E264: =C264*6+D264 -> 40 | G264: 6 | H264: 13 | I264: =G264*6+H264 -> 49 | K264: 10 | L264: 15 | M264: =K264*6+L264 -> 75 | O264: 11 | P264: 18 | Q264: =O264*6+P264 -> 84 | S264: MARCY
A265: BEST PLAYERS
A266: YARRAVILLE | C266: R WILKINSON | F266: McNAMARA | I266: McLAREN | L266: LOWE | N266: SPARGO | Q266: MARTIN
A267: BOX HILL | C267: BRYANT | F267: LAWTHER | I267: TIERNEY | L267: LASKIE | N267: ZANTUCK
A268: GOALKICKERS
A269: YARRAVILLE | C269: R WILKINSON 5 | F269: P BROPHY 5 | I269: SPARGO 3 | K269: McNAMARA 2 | N269: MATTSON | Q269: RYAN | S269: BARR | U269: JOSLIN
A270: BOX HILL | C270: LASKIE 3 | F270: BRYANT 2 | I270: TIERNEY 2 | K270: LOVE 2 | M270: BARNETT | O270: PAGEY
A272: CAMBERWELL | C272: 4 | D272: 2 | E272: =C272*6+D272 -> 26 | G272: 13 | H272: 5 | I272: =G272*6+H272 -> 83 | K272: 18 | L272: 7 | M272: =K272*6+L272 -> 115 | O272: 24 | P272: 13 | Q272: =O272*6+P272 -> 157 | S272: CAMBERWELL
A273: NORTHCOTE | C273: 3 | D273: 6 | E273: =C273*6+D273 -> 24 | G273: 6 | H273: 7 | I273: =G273*6+H273 -> 43 | K273: 7 | L273: 13 | M273: =K273*6+L273 -> 55 | O273: 8 | P273: 16 | Q273: =O273*6+P273 -> 64 | S273: STABB
A274: BEST PLAYERS
A275: CAMBERWELL | C275: BOWDEN | F275: KENNEDY | I275: McCULLOCH | L275: HOOK | N275: CUTTING | Q275: WILSON
A276: NORTHCOTE | C276: CAREY | F276: ROBERTS | I276: McINTYRE | L276: REDENBACH | N276: G RYAN | Q276: AFFLECK
A277: GOALKICKERS
A278: CAMBERWELL | C278: HAMMOND 6 | F278: KENNEDY 5 | I278: BOWDEN 4 | K278: McCULLOCH 2 | N278: LEES 2 | P278: STONE 2 | R278: SIMPSON | T278: DOBSON | V278: SAUERBERG
A279: NORTHCOTE | C279: G RYAN 2 | F279: ROBERTSON | I279: McINTYRE | L279: McARDLE | N279: TRESSIDER | Q279: AFFLECK | T279: CHAPMAN
A281: MORDIALLOC | C281: 3 | D281: 2 | E281: =C281*6+D281 -> 20 | G281: 9 | H281: 7 | I281: =G281*6+H281 -> 61 | K281: 10 | L281: 8 | M281: =K281*6+L281 -> 68 | O281: 13 | P281: 15 | Q281: =O281*6+P281 -> 93 | S281: MORDIALLOC
A282: WERRIBEE | C282: 1 | D282: 4 | E282: =C282*6+D282 -> 10 | G282: 1 | H282: 5 | I282: =G282*6+H282 -> 11 | K282: 6 | L282: 10 | M282: =K282*6+L282 -> 46 | O282: 6 | P282: 10 | Q282: =O282*6+P282 -> 46 | S282: OGSTON
A283: BEST PLAYERS
A284: MORDIALLOC | C284: DAVEY | F284: ROSENOW | I284: EDDY | L284: THOMPSON | O284: PRIDGEON | R284: McNAUGHT
A285: WERRIBEE | C285: EYRE | F285: McCARTNEY | I285: COCKS | L285: F MITCHELL | O285: HAMBLIN
A286: GOALKICKERS
A287: MORDIALLOC | C287: O'BRIEN 4 | F287: HARRY 3 | I287: McNAUGHT 3 | L287: DINGLE | N287: GUY | P287: PRIDGEON
A288: WERRIBEE | C288: NORTON 2 | F288: F MITCHELL 2 | I288: RIDDELL | K288: ARRIGO
A290: ROUND 7 | E290: 18TH MAY | J290: WEATHER | S290: PLAYED AT
D291: 1ST QTR | H291: 2ND QTR | L291: 3RD QTR | P291: FINAL | S291: BOX HILL
A292: BRUNSWICK | C292: 4 | D292: 6 | E292: =C292*6+D292 -> 30 | G292: 11 | H292: 10 | I292: =G292*6+H292 -> 76 | K292: 13 | L292: 14 | M292: =K292*6+L292 -> 92 | O292: 20 | P292: 21 | Q292: =O292*6+P292 -> 141 | S292: UMPIRE | X292: LADDER | AB292: ROUND | AD292: 7
A293: BOX HILL | C293: 3 | D293: 5 | E293: =C293*6+D293 -> 23 | G293: 8 | H293: 8 | I293: =G293*6+H293 -> 56 | K293: 11 | L293: 11 | M293: =K293*6+L293 -> 77 | O293: 12 | P293: 16 | Q293: =O293*6+P293 -> 88 | S293: VERGONA
A294: BEST PLAYERS | W294: TEAM | X294: W | Y294: L | Z294: D | AA294: FOR | AB294: AGST | AC294: % | AD294: PTS
A295: BRUNSWICK | C295: NUNN | F295: LIAKOUREAS | I295: ORTON | L295: SMITH | N295: ROWE
A296: BOX HILL | C296: WATERS | F296: LAWTHER | I296: BRYANT | L296: TIERNEY | N296: LASKIE | W296: CAMBERWELL | X296: 7 | Y296: 0 | Z296: 0 | AA296: 896 | AB296: 536 | AC296: =(AA296*100)/AB296 -> 167.16417910447763 | AD296: =(X296*4)+(Z296*2) -> 28
A297: GOALKICKERS | P297: SCHIMMELBUSCH | W297: BRUNSWICK | X297: 6 | Y297: 1 | Z297: 0 | AA297: 948 | AB297: 667 | AC297: =(AA297*100)/AB297 -> 142.1289355322339 | AD297: =(X297*4)+(Z297*2) -> 24
A298: BRUNSWICK | C298: WARDEN 4 | F298: LIAKOUREAS 3 | I298: ORTON 3 | K298: BAIRD 3 | M298: NUNN 2 | O298: ROWE 2 | Q298: LAKER | S298: SMITH | W298: FRANKSTON | X298: 5 | Y298: 2 | Z298: 0 | AA298: 784 | AB298: 693 | AC298: =(AA298*100)/AB298 -> 113.13131313131314 | AD298: =(X298*4)+(Z298*2) -> 20
A299: BOX HILL | C299: LASKIE 4 | F299: A'HALE 3 | I299: PAGEY 2 | K299: COUTTS | M299: KING | O299: BAKER | W299: SUNSHINE | X299: 4 | Y299: 3 | Z299: 0 | AA299: 809 | AB299: 718 | AC299: =(AA299*100)/AB299 -> 112.67409470752089 | AD299: =(X299*4)+(Z299*2) -> 16
A301: SUNSHINE | C301: 6 | D301: 3 | E301: =C301*6+D301 -> 39 | G301: 10 | H301: 5 | I301: =G301*6+H301 -> 65 | K301: 17 | L301: 8 | M301: =K301*6+L301 -> 110 | O301: 24 | P301: 9 | Q301: =O301*6+P301 -> 153 | S301: SUNSHINE | W301: NORTHCOTE | X301: 4 | Y301: 3 | Z301: 0 | AA301: 842 | AB301: 837 | AC301: =(AA301*100)/AB301 -> 100.59737156511351 | AD301: =(X301*4)+(Z301*2) -> 16
A302: WAVERLEY | C302: 6 | D302: 3 | E302: =C302*6+D302 -> 39 | G302: 10 | H302: 10 | I302: =G302*6+H302 -> 70 | K302: 14 | L302: 13 | M302: =K302*6+L302 -> 97 | O302: 20 | P302: 17 | Q302: =O302*6+P302 -> 137 | S302: OAKLEY | W302: MORDIALLOC | X302: 4 | Y302: 3 | Z302: 0 | AA302: 701 | AB302: 717 | AC302: =(AA302*100)/AB302 -> 97.768479776847983 | AD302: =(X302*4)+(Z302*2) -> 16
A303: BEST PLAYERS | W303: YARRAVILLE | X303: 3 | Y303: 4 | Z303: 0 | AA303: 757 | AB303: 809 | AC303: =(AA303*100)/AB303 -> 93.572311495673674 | AD303: =(X303*4)+(Z303*2) -> 12
A304: SUNSHINE | C304: BENSON | F304: BAIRD | I304: MARTIN | L304: PIERCZAK | O304: GOOLD | Q304: SLADDIN | W304: WAVERLEY | X304: 2 | Y304: 5 | Z304: 0 | AA304: 834 | AB304: 941 | AC304: =(AA304*100)/AB304 -> 88.629117959617432 | AD304: =(X304*4)+(Z304*2) -> 8
A305: WAVERLEY | C305: ZIESLER | F305: SYKES | I305: McCLURE | L305: HANCOCK | O305: LARAGY | Q305: McDONALD | W305: BOX HILL | X305: 0 | Y305: 7 | Z305: 0 | AA305: 608 | AB305: 827 | AC305: =(AA305*100)/AB305 -> 73.518742442563479 | AD305: =(X305*4)+(Z305*2) -> 0
A306: GOALKICKERS | W306: WERRIBEE | X306: 0 | Y306: 7 | Z306: 0 | AA306: 547 | AB306: 981 | AC306: =(AA306*100)/AB306 -> 55.759429153924565 | AD306: =(X306*4)+(Z306*2) -> 0
A307: SUNSHINE | C307: BAIRD 7 | F307: GOOLD 6 | H307: LLOYD 4 | J307: SLADDIN 3 | M307: JONES 2 | O307: BENSON | Q307: MADDOX
A308: WAVERLEY | C308: ZIESLER 8 | F308: McCLURE 4 | I308: COSTELLO 2 | L308: LUMLEY 2 | N308: McKAY | P308: WILLEY | R308: OSBORNE
A310: NORTHCOTE | C310: 4 | D310: 3 | E310: =C310*6+D310 -> 27 | G310: 13 | H310: 5 | I310: =G310*6+H310 -> 83 | K310: 17 | L310: 11 | M310: =K310*6+L310 -> 113 | O310: 22 | P310: 15 | Q310: =O310*6+P310 -> 147 | S310: NORTHCOTE
A311: YARRAVILLE | C311: 10 | D311: 3 | E311: =C311*6+D311 -> 63 | G311: 13 | H311: 9 | I311: =G311*6+H311 -> 87 | K311: 14 | L311: 13 | M311: =K311*6+L311 -> 97 | O311: 17 | P311: 15 | Q311: =O311*6+P311 -> 117 | S311: MATHEWS
A312: BEST PLAYERS
A313: NORTHCOTE | C313: LEE | F313: ROBERTSON | I313: McNEILL | L313: AFFLECK | O313: CHAPMAN | R313: REDENBACH
A314: YARRAVILLE | C314: LOWE | F314: MARTIN | I314: JOSLIN | L314: McNAMARA | O314: SQUIRE | R314: BARCLAY
A315: GOALKICKERS
A316: NORTHCOTE | C316: LEE 6 | E316: CHAPMAN 5 | H316: HOUGH 3 | J316: ROBERTSON 3 | M316: G RYAN 2 | O316: LING | Q316: McNEILL | S316: AFFLECK
A317: YARRAVILLE | C317: MARTIN 3 | E317: MATTSON 3 | H317: SAYNOR 3 | J317: JOSLIN 3 | L317: McLAREN | N317: RYAN | P317: McNAMARA | S317: SPARGO | U317: R WILKINSON
A319: CAMBERWELL | C319: 6 | D319: 7 | E319: =C319*6+D319 -> 43 | G319: 8 | H319: 8 | I319: =G319*6+H319 -> 56 | K319: 11 | L319: 11 | M319: =K319*6+L319 -> 77 | O319: 12 | P319: 14 | Q319: =O319*6+P319 -> 86 | S319: MORDIALLOC
A320: MORDIALLOC | C320: 2 | D320: 0 | E320: =C320*6+D320 -> 12 | G320: 5 | H320: 1 | I320: =G320*6+H320 -> 31 | K320: 8 | L320: 4 | M320: =K320*6+L320 -> 52 | O320: 11 | P320: 9 | Q320: =O320*6+P320 -> 75 | S320: ABBOTT
A321: BEST PLAYERS
A322: CAMBERWELL | C322: WILSON | F322: SAUERBERG | I322: STOREY | L322: SIMPSON | O322: OLIVER | R322: KENNEDY
A323: MORDIALLOC | C323: THOMPSON | F323: WILLIAMSON | I323: ROSENOW | L323: LANG | O323: McNAUGHT | R323: EDDY
A324: GOALKICKERS
A325: CAMBERWELL | C325: HAMMOND 4 | F325: SAUERBERG 2 | I325: BOLGER | K325: LEES | M325: SIMPSON | O325: HOOK | Q325: KENNEDY | S325: STONE
A326: MORDIALLOC | C326: WILLIAMSON 4 | F326: HARRY 2 | H326: MOORE 2 | J326: O'BRIEN | L326: GUY | N326: DEATON
A328: FRANKSTON | C328: 5 | D328: 4 | E328: =C328*6+D328 -> 34 | G328: 0 | H328: 8 | I328: =G328*6+H328 -> 8 | K328: 8 | L328: 11 | M328: =K328*6+L328 -> 59 | O328: 14 | P328: 12 | Q328: =O328*6+P328 -> 96 | S328: WERRIBEE
A329: WERRIBEE | C329: 2 | D329: 4 | E329: =C329*6+D329 -> 16 | G329: 6 | H329: 8 | I329: =G329*6+H329 -> 44 | K329: 9 | L329: 10 | M329: =K329*6+L329 -> 64 | O329: 13 | P329: 11 | Q329: =O329*6+P329 -> 89 | S329: O'BRIEN
A330: BEST PLAYERS
A331: FRANKSTON | C331: LLOYD | F331: KENDALL | I331: EDWARDS | L331: ESLER
A332: WERRIBEE | C332: COCKS | F332: SCARFE | I332: HAMBLIN | L332: JOHNSON | O332: McCARTNEY | R332: BAXTER
A333: GOALKICKERS
A334: FRANKSTON | C334: WARD 3 | F334: LOCCO 3 | H334: EDWARDS 3 | K334: KENNEDY | M334: LOVELOCK | P334: DOHERTY | R334: ELLIS
A335: WERRIBEE | C335: SCARFE 3 | F335: BAXTER 3 | H335: ARRIGO 2 | J335: MONTGOMERY 2 | M335: PETTIGREW 2 | P335: BOURKE | R335: F MITCHELL
A337: ROUND 8 | E337: 25TH MAY | J337: WEATHER | S337: PLAYED AT
D338: 1ST QTR | H338: 2ND QTR | L338: 3RD QTR | P338: FINAL | S338: CAMBERWELL
A339: CAMBERWELL | C339: 1 | D339: 3 | E339: =C339*6+D339 -> 9 | G339: 12 | H339: 7 | I339: =G339*6+H339 -> 79 | K339: 15 | L339: 9 | M339: =K339*6+L339 -> 99 | O339: 18 | P339: 14 | Q339: =O339*6+P339 -> 122 | S339: UMPIRE | X339: LADDER | AB339: ROUND | AD339: 8
A340: BRUNSWICK | C340: 3 | D340: 5 | E340: =C340*6+D340 -> 23 | G340: 5 | H340: 7 | I340: =G340*6+H340 -> 37 | K340: 11 | L340: 18 | M340: =K340*6+L340 -> 84 | O340: 13 | P340: 21 | Q340: =O340*6+P340 -> 99 | S340: WENN
A341: BEST PLAYERS | W341: TEAM | X341: W | Y341: L | Z341: D | AA341: FOR | AB341: AGST | AC341: % | AD341: PTS
A342: CAMBERWELL | C342: OLIVER | F342: SAUERBERG | I342: SIMPSON | L342: SPITHILL | O342: HOOK | Q342: PARSONS
A343: BRUNSWICK | C343: NOLAN | F343: SMITH | I343: ORTON | L343: NUNN | N343: SCHIMMELBUSCH | W343: CAMBERWELL | X343: 8 | Y343: 0 | Z343: 0 | AA343: 1018 | AB343: 635 | AC343: =(AA343*100)/AB343 -> 160.31496062992127 | AD343: =(X343*4)+(Z343*2) -> 32
A344: GOALKICKERS | W344: BRUNSWICK | X344: 6 | Y344: 2 | Z344: 0 | AA344: 1047 | AB344: 789 | AC344: =(AA344*100)/AB344 -> 132.69961977186313 | AD344: =(X344*4)+(Z344*2) -> 24
A345: CAMBERWELL | C345: SAUERBERG 6 | F345: HAMMOND 4 | I345: BOWDEN 2 | K345: McCULLOCH 2 | N345: SIMPSON | P345: STOREY | R345: STONE | T345: KENNEDY | W345: FRANKSTON | X345: 6 | Y345: 2 | Z345: 0 | AA345: 888 | AB345: 781 | AC345: =(AA345*100)/AB345 -> 113.70038412291933 | AD345: =(X345*4)+(Z345*2) -> 24
A346: BRUNSWICK | C346: ORTON 5 | E346: BAIRD 3 | G346: WARDEN | I346: NUNN | K346: LIAKOUREAS | N346: SCHIMMELBUSCH | R346: JOSEPH | W346: NORTHCOTE | X346: 5 | Y346: 3 | Z346: 0 | AA346: 965 | AB346: 920 | AC346: =(AA346*100)/AB346 -> 104.89130434782609 | AD346: =(X346*4)+(Z346*2) -> 20
A348: BOX HILL | C348: 2 | D348: 5 | E348: =C348*6+D348 -> 17 | G348: 8 | H348: 7 | I348: =G348*6+H348 -> 55 | K348: 13 | L348: 11 | M348: =K348*6+L348 -> 89 | O348: 15 | P348: 14 | Q348: =O348*6+P348 -> 104 | S348: BOX HILL | W348: SUNSHINE | X348: 4 | Y348: 4 | Z348: 0 | AA348: 921 | AB348: 853 | AC348: =(AA348*100)/AB348 -> 107.97186400937866 | AD348: =(X348*4)+(Z348*2) -> 16
A349: WERRIBEE | C349: 5 | D349: 2 | E349: =C349*6+D349 -> 32 | G349: 10 | H349: 3 | I349: =G349*6+H349 -> 63 | K349: 13 | L349: 8 | M349: =K349*6+L349 -> 86 | O349: 14 | P349: 10 | Q349: =O349*6+P349 -> 94 | S349: MATHEWS | W349: YARRAVILLE | X349: 4 | Y349: 4 | Z349: 0 | AA349: 892 | AB349: 921 | AC349: =(AA349*100)/AB349 -> 96.851248642779581 | AD349: =(X349*4)+(Z349*2) -> 16
A350: BEST PLAYERS | W350: MORDIALLOC | X350: 4 | Y350: 4 | Z350: 0 | AA350: 789 | AB350: 821 | AC350: =(AA350*100)/AB350 -> 96.102314250913523 | AD350: =(X350*4)+(Z350*2) -> 16
A351: BOX HILL | C351: KING | F351: LAWTHER | I351: A'HALE | L351: BRYANT | O351: LASKIE | R351: BUTLER | W351: WAVERLEY | X351: 2 | Y351: 6 | Z351: 0 | AA351: 916 | AB351: 1064 | AC351: =(AA351*100)/AB351 -> 86.090225563909769 | AD351: =(X351*4)+(Z351*2) -> 8
A352: WERRIBEE | C352: COCKS | F352: FIDDIAN | I352: F MITCHELL | L352: YOUNG | O352: ARRIGO | R352: EVANS | W352: BOX HILL | X352: 1 | Y352: 7 | Z352: 0 | AA352: 712 | AB352: 921 | AC352: =(AA352*100)/AB352 -> 77.307274701411515 | AD352: =(X352*4)+(Z352*2) -> 4
A353: GOALKICKERS | W353: WERRIBEE | X353: 0 | Y353: 8 | Z353: 0 | AA353: 641 | AB353: 1085 | AC353: =(AA353*100)/AB353 -> 59.078341013824883 | AD353: =(X353*4)+(Z353*2) -> 0
A354: BOX HILL | C354: LASKIE 5 | F354: McMASTER 4 | I354: KING 3 | K354: BRYANT 2 | N354: A'HALE
A355: WERRIBEE | C355: SCARFE 3 | E355: ARRIGO 3 | G355: MONTGOMERY 3 | J355: F MITCHELL | M355: FIDDIAN | O355: NORTON | Q355: PYNE | R355: KNOESTER
A357: NORTHCOTE | C357: 4 | D357: 6 | E357: =C357*6+D357 -> 30 | G357: 8 | H357: 12 | I357: =G357*6+H357 -> 60 | K357: 13 | L357: 15 | M357: =K357*6+L357 -> 93 | O357: 17 | P357: 21 | Q357: =O357*6+P357 -> 123 | S357: WAVERLEY
A358: WAVERLEY | C358: 0 | D358: 6 | E358: =C358*6+D358 -> 6 | G358: 3 | H358: 8 | I358: =G358*6+H358 -> 26 | K358: 9 | L358: 12 | M358: =K358*6+L358 -> 66 | O358: 11 | P358: 16 | Q358: =O358*6+P358 -> 82 | S358: MARCY
A359: BEST PLAYERS
A360: NORTHCOTE | C360: ROBERTSON | F360: CAREY | I360: McINTYRE | L360: RYAN | O360: JAMES | R360: CHAPMAN
A361: WAVERLEY | C361: COSTELLO | F361: HANCOCK | I361: HASTINGS | L361: LARAGY | O361: KELAART | R361: SYKES
A362: GOALKICKERS
A363: NORTHCOTE | C363: CHAPMAN 7 | F363: RYAN 4 | H363: LEE 2 | J363: ROBERTSON 2 | M363: JAMES | O363: AFFLECK
A364: WAVERLEY | C364: COSTELLO 6 | F364: ZIESLER 2 | I364: McKAY | K364: WILLEY | M364: HANCOCK
A366: FRANKSTON | C366: 2 | D366: 4 | E366: =C366*6+D366 -> 16 | G366: 4 | H366: 11 | I366: =G366*6+H366 -> 35 | K366: 7 | L366: 15 | M366: =K366*6+L366 -> 57 | O366: 14 | P366: 20 | Q366: =O366*6+P366 -> 104 | S366: FRANKSTON
A367: MORDIALLOC | C367: 4 | D367: 4 | E367: =C367*6+D367 -> 28 | G367: 6 | H367: 7 | I367: =G367*6+H367 -> 43 | K367: 9 | L367: 13 | M367: =K367*6+L367 -> 67 | O367: 12 | P367: 16 | Q367: =O367*6+P367 -> 88 | S367: OAKLEY
A368: BEST PLAYERS
A369: FRANKSTON | C369: DAVIES | F369: KENDALL | I369: RIDSDALE | L369: EDWARDS | O369: LOVELOCK | R369: LOCCO
A370: MORDIALLOC | C370: DEATON | F370: SCAIFFE | I370: THOMPSON | L370: LANG | O370: PRIDGEON | R370: ROSENOW
A371: GOALKICKERS
A372: FRANKSTON | C372: LOVELOCK 4 | F372: WARD 3 | H372: McILWRAITH 3 | K372: DOHERTY 2 | M372: LOCCO | O372: HARRISON
A373: MORDIALLOC | C373: SCAIFFE 3 | F373: MOORE 3 | I373: WILLIAMSON 2 | L373: O'BRIEN 2 | N373: DEATON | P373: PRIDGEON
A375: YARRAVILLE | C375: 3 | D375: 4 | E375: =C375*6+D375 -> 22 | G375: 9 | H375: 6 | I375: =G375*6+H375 -> 60 | K375: 12 | L375: 10 | M375: =K375*6+L375 -> 82 | O375: 20 | P375: 15 | Q375: =O375*6+P375 -> 135 | S375: SUNSHINE
A376: SUNSHINE | C376: 4 | D376: 5 | E376: =C376*6+D376 -> 29 | G376: 10 | H376: 10 | I376: =G376*6+H376 -> 70 | K376: 13 | L376: 13 | M376: =K376*6+L376 -> 91 | O376: 16 | P376: 16 | Q376: =O376*6+P376 -> 112 | S376: HUGGINS
A377: BEST PLAYERS
A378: YARRAVILLE | C378: SPARGO | F378: SMITH | I378: JOSLIN | L378: WILKINSON | O378: TAURINS | R378: ARCHER
A379: SUNSHINE | C379: BAIRD | F379: FOREMAN | I379: BENSON | L379: PIERCZAK | O379: FOLEY | R379: SLADDIN
A380: GOALKICKERS
A381: YARRAVILLE | C381: P BROPHY 5 | F381: SPARGO 4 | I381: WILKINSON 4 | L381: ARCHER 2 | N381: McNAMARA 2 | Q381: MARTIN | S381: JOSLIN | U381: GIUNETTI
A382: SUNSHINE | C382: BAIRD 5 | F382: SLADDIN 5 | I382: BENSON 2 | K382: CLARKE | M382: PIERCZAK | O382: FOREMAN | R382: MADDOX
A384: ROUND 9 | E384: 1ST JUNE | J384: WEATHER | S384: PLAYED AT
D385: 1ST QTR | H385: 2ND QTR | L385: 3RD QTR | P385: FINAL | S385: NORTHCOTE
A386: NORTHCOTE | C386: 5 | D386: 7 | E386: =C386*6+D386 -> 37 | G386: 11 | H386: 10 | I386: =G386*6+H386 -> 76 | K386: 12 | L386: 15 | M386: =K386*6+L386 -> 87 | O386: 19 | P386: 18 | Q386: =O386*6+P386 -> 132 | S386: UMPIRE | X386: LADDER | AB386: ROUND | AD386: 9
A387: BOX HILL | C387: 4 | D387: 4 | E387: =C387*6+D387 -> 28 | G387: 7 | H387: 8 | I387: =G387*6+H387 -> 50 | K387: 15 | L387: 11 | M387: =K387*6+L387 -> 101 | O387: 18 | P387: 12 | Q387: =O387*6+P387 -> 120 | S387: HUGGINS
A388: BEST PLAYERS | W388: TEAM | X388: W | Y388: L | Z388: D | AA388: FOR | AB388: AGST | AC388: % | AD388: PTS
A389: NORTHCOTE | C389: McNEILL | F389: CHAPMAN | I389: WATT | L389: McARDLE | O389: KREYMBORG | R389: BRAIN
A390: BOX HILL | C390: BAKER | F390: BRYANT | I390: KING | L390: CROMB | O390: LASKIE | R390: TIERNEY | W390: CAMBERWELL | X390: 9 | Y390: 0 | Z390: 0 | AA390: 1137 | AB390: 725 | AC390: =(AA390*100)/AB390 -> 156.82758620689654 | AD390: =(X390*4)+(Z390*2) -> 36
A391: GOALKICKERS | W391: BRUNSWICK | X391: 7 | Y391: 2 | Z391: 0 | AA391: 1182 | AB391: 883 | AC391: =(AA391*100)/AB391 -> 133.86183465458663 | AD391: =(X391*4)+(Z391*2) -> 28
A392: NORTHCOTE | C392: CHAPMAN 10 | F392: ROBERTSON 2 | I392: MCARDLE 2 | L392: KREYMBORG 2 | O392: LEE | P392: G RYAN | R392: McNEILL | W392: FRANKSTON | X392: 6 | Y392: 3 | Z392: 0 | AA392: 978 | AB392: 900 | AC392: =(AA392*100)/AB392 -> 108.66666666666667 | AD392: =(X392*4)+(Z392*2) -> 24
A393: BOX HILL | C393: McMASTER 5 | F393: LASKIE 4 | H393: BRYANT 2 | J393: ARMSTRONG 2 | M393: COUTTS | O393: KING | P393: ZANTUCK | R393: PAGEY | T393: BAKER | W393: NORTHCOTE | X393: 6 | Y393: 3 | Z393: 0 | AA393: 1097 | AB393: 1040 | AC393: =(AA393*100)/AB393 -> 105.48076923076923 | AD393: =(X393*4)+(Z393*2) -> 24
A395: BRUNSWICK | C395: 4 | D395: 6 | E395: =C395*6+D395 -> 30 | G395: 7 | H395: 9 | I395: =G395*6+H395 -> 51 | K395: 13 | L395: 12 | M395: =K395*6+L395 -> 90 | O395: 19 | P395: 21 | Q395: =O395*6+P395 -> 135 | S395: YARRAVILLE | W395: MORDIALLOC | X395: 5 | Y395: 4 | Z395: 0 | AA395: 892 | AB395: 897 | AC395: =(AA395*100)/AB395 -> 99.442586399108137 | AD395: =(X395*4)+(Z395*2) -> 20
A396: YARRAVILLE | C396: 4 | D396: 2 | E396: =C396*6+D396 -> 26 | G396: 8 | H396: 10 | I396: =G396*6+H396 -> 58 | K396: 13 | L396: 14 | M396: =K396*6+L396 -> 92 | O396: 13 | P396: 16 | Q396: =O396*6+P396 -> 94 | S396: OAKLEY | W396: SUNSHINE | X396: 4 | Y396: 5 | Z396: 0 | AA396: 997 | AB396: 956 | AC396: =(AA396*100)/AB396 -> 104.28870292887029 | AD396: =(X396*4)+(Z396*2) -> 16
A397: BEST PLAYERS | W397: YARRAVILLE | X397: 4 | Y397: 5 | Z397: 0 | AA397: 986 | AB397: 1056 | AC397: =(AA397*100)/AB397 -> 93.371212121212125 | AD397: =(X397*4)+(Z397*2) -> 16
A398: BRUNSWICK | C398: SMITH | F398: NOLAN | I398: SCHIMMELBUSCH | M398: ORTON | O398: BRIGHAM | R398: WARDEN | W398: WAVERLEY | X398: 3 | Y398: 6 | Z398: 0 | AA398: 1055 | AB398: 1169 | AC398: =(AA398*100)/AB398 -> 90.248075278015392 | AD398: =(X398*4)+(Z398*2) -> 12
A399: YARRAVILLE | C399: McNAMARA | F399: SQUIRE | I399: TAURINS | L399: BARCLAY | O399: MARTIN | R399: NORRIS | W399: BOX HILL | X399: 1 | Y399: 8 | Z399: 0 | AA399: 832 | AB399: 1053 | AC399: =(AA399*100)/AB399 -> 79.012345679012341 | AD399: =(X399*4)+(Z399*2) -> 4
A400: GOALKICKERS | W400: WERRIBEE | X400: 0 | Y400: 9 | Z400: 0 | AA400: 746 | AB400: 1224 | AC400: =(AA400*100)/AB400 -> 60.947712418300654 | AD400: =(X400*4)+(Z400*2) -> 0
A401: BRUNSWICK | C401: BAIRD 6 | E401: JOSEPH 4 | G401: SCHIMMELBUSCH 3 | K401: ORTON 2 | M401: WARDEN | O401: BRIGHAM | Q401: LIAKOUREAS | T401: LAKER
A402: YARRAVILLE | C402: McNAMARA 5 | F402: ARCHER 3 | I402: MARTIN | K402: LEWIS | M402: R WILKINSON | P402: NORRIS | R402: SMITH
A404: CAMBERWELL | C404: 2 | D404: 2 | E404: =C404*6+D404 -> 14 | G404: 7 | H404: 5 | I404: =G404*6+H404 -> 47 | K404: 13 | L404: 6 | M404: =K404*6+L404 -> 84 | O404: 18 | P404: 11 | Q404: =O404*6+P404 -> 119 | S404: CAMBERWELL
A405: FRANKSTON | C405: 4 | D405: 3 | E405: =C405*6+D405 -> 27 | G405: 7 | H405: 5 | I405: =G405*6+H405 -> 47 | K405: 8 | L405: 7 | M405: =K405*6+L405 -> 55 | O405: 13 | P405: 12 | Q405: =O405*6+P405 -> 90 | S405: OGSTON
A406: BEST PLAYERS
A407: CAMBERWELL | C407: KENNEDY | F407: WILSON | I407: HAMMOND | L407: CROWE | O407: FOX | R407: STONE
A408: FRANKSTON | C408: ROSENBROCK | F408: FALKINER | I408: DAVIES | L408: LOCCO | O408: SHEPHERD | R408: KENDALL
A409: GOALKICKERS
A410: CAMBERWELL | C410: HAMMOND 8 | F410: KENNEDY 4 | I410: SIMPSON | K410: SAUERBERG | N410: HOOK | O410: SMITH | Q410: KARVELLIS | S410: McCULLOCH | V410: STONE
A411: FRANKSTON | C411: COSTELLO 7 | F411: ZIESLER 6 | I411: McCLURE 2 | L411: HOLDSWORTH | O411: GRANT
A413: MORDIALLOC | C413: 4 | D413: 5 | E413: =C413*6+D413 -> 29 | G413: 5 | H413: 7 | I413: =G413*6+H413 -> 37 | K413: 12 | L413: 9 | M413: =K413*6+L413 -> 81 | O413: 15 | P413: 13 | Q413: =O413*6+P413 -> 103 | S413: MORDIALLOC
A414: SUNSHINE | C414: 0 | D414: 5 | E414: =C414*6+D414 -> 5 | G414: 5 | H414: 8 | I414: =G414*6+H414 -> 38 | K414: 9 | L414: 14 | M414: =K414*6+L414 -> 68 | O414: 10 | P414: 16 | Q414: =O414*6+P414 -> 76 | S414: O'BRIEN
A415: BEST PLAYERS
A416: MORDIALLOC | C416: ROSENOW | F416: LANG | I416: DEATON | L416: McNAUGHT | O416: GUY | R416: MOORE
A417: SUNSHINE | C417: PIERCZAK | F417: BENSON | I417: FEBEY | L417: LLOYD | O417: FOREMAN | R417: MADDOX
A418: GOALKICKERS
A419: MORDIALLOC | C419: O'BRIEN 3 | E419: SCAIFFE 3 | G419: WILLIAMSON 3 | J419: MOORE 2 | L419: HARRY 2 | N419: DEATON | P419: GUY
A420: SUNSHINE | C420: LLOYD 2 | E420: BENSON 2 | G420: IZZARD 2 | I420: BAIRD | K420: FEBEY | M420: FOREMAN | O420: MARTIN
A422: WAVERLEY | C422: 5 | D422: 5 | E422: =C422*6+D422 -> 35 | G422: 10 | H422: 10 | I422: =G422*6+H422 -> 70 | K422: 16 | L422: 11 | M422: =K422*6+L422 -> 107 | O422: 21 | P422: 13 | Q422: =O422*6+P422 -> 139 | S422: WERRIBEE
A423: WERRIBEE | C423: 4 | D423: 4 | E423: =C423*6+D423 -> 28 | G423: 5 | H423: 7 | I423: =G423*6+H423 -> 37 | K423: 9 | L423: 12 | M423: =K423*6+L423 -> 66 | O423: 15 | P423: 15 | Q423: =O423*6+P423 -> 105 | S423: CARLILE
A424: BEST PLAYERS
A425: WAVERLEY | C425: MCKAY | F425: ZIESLER | I425: McDONALD | L425: COSTELLO | O425: McCLURE
A426: WERRIBEE | C426: EVANS | F426: FIDDIAN | I426: SCARFE | L426: MITCHELL | O426: YOUNG | Q426: BOURKE
A427: GOALKICKERS
A428: WAVERLEY | C428: ZIESLER 10 | F428: COSTELLO 5 | I428: HOLDSWORTH 2 | L428: HANCOCK 2 | N428: CROUCH | P428: GRANT
A429: WERRIBEE | C429: SCARFE 3 | F429: NORTON 3 | I429: MITCHELL 2 | L429: EVANS 2 | N429: BOURKE | P429: ARRIGO | R429: O'KEEFE | T429: FIDDIAN | V429: KNEE
A431: ROUND 10 | E431: 8TH JUNE | J431: WEATHER | S431: PLAYED AT
D432: 1ST QTR | H432: 2ND QTR | L432: 3RD QTR | P432: FINAL | S432: BRUNSWICK
A433: BRUNSWICK | C433: 5 | D433: 4 | E433: =C433*6+D433 -> 34 | G433: 13 | H433: 5 | I433: =G433*6+H433 -> 83 | K433: 17 | L433: 8 | M433: =K433*6+L433 -> 110 | O433: 23 | P433: 21 | Q433: =O433*6+P433 -> 159 | S433: UMPIRE | X433: LADDER | AB433: ROUND | AD433: 10
A434: WERRIBEE | C434: 1 | D434: 4 | E434: =C434*6+D434 -> 10 | G434: 3 | H434: 4 | I434: =G434*6+H434 -> 22 | K434: 5 | L434: 11 | M434: =K434*6+L434 -> 41 | O434: 6 | P434: 18 | Q434: =O434*6+P434 -> 54 | S434: OGSTON
A435: BEST PLAYERS | W435: TEAM | X435: W | Y435: L | Z435: D | AA435: FOR | AB435: AGST | AC435: % | AD435: PTS
A436: BRUNSWICK | C436: WARDEN | F436: VALENTINE | I436: ROWE | L436: SMITH | N436: BAIRD | P436: SCHIMMELBUSCH
A437: WERRIBEE | C437: COCKS | F437: McCARTNEY | I437: FIDDIAN | L437: KNIGHT | N437: SCARFE | P437: MITCHELL | W437: CAMBERWELL | X437: 10 | Y437: 0 | Z437: 0 | AA437: 1261 | AB437: 845 | AC437: =(AA437*100)/AB437 -> 149.23076923076923 | AD437: =(X437*4)+(Z437*2) -> 40
A438: GOALKICKERS | W438: BRUNSWICK | X438: 8 | Y438: 2 | Z438: 0 | AA438: 1341 | AB438: 937 | AC438: =(AA438*100)/AB438 -> 143.1163287086446 | AD438: =(X438*4)+(Z438*2) -> 32
A439: BRUNSWICK | C439: WARDEN 8 | F439: BAIRD 8 | H439: ORTON 2 | J439: BRIGHAM | L439: SMITH | N439: NUNN | P439: JOSEPH | R439: PERRY | W439: FRANKSTON | X439: 7 | Y439: 3 | Z439: 0 | AA439: 1139 | AB439: 1007 | AC439: =(AA439*100)/AB439 -> 113.10824230387288 | AD439: =(X439*4)+(Z439*2) -> 28
A440: WERRIBEE | C440: HAMBLIN 2 | F440: MITCHELL 2 | I440: FIDDIAN | K440: ARRIGO | W440: MORDIALLOC | X440: 6 | Y440: 4 | Z440: 0 | AA440: 1026 | AB440: 958 | AC440: =(AA440*100)/AB440 -> 107.09812108559498 | AD440: =(X440*4)+(Z440*2) -> 24
A442: MORDIALLOC | C442: 4 | D442: 5 | E442: =C442*6+D442 -> 29 | G442: 7 | H442: 9 | I442: =G442*6+H442 -> 51 | K442: 15 | L442: 15 | M442: =K442*6+L442 -> 105 | O442: 19 | P442: 20 | Q442: =O442*6+P442 -> 134 | S442: BOX HILL | W442: NORTHCOTE | X442: 6 | Y442: 4 | Z442: 0 | AA442: 1149 | AB442: 1203 | AC442: =(AA442*100)/AB442 -> 95.511221945137152 | AD442: =(X442*4)+(Z442*2) -> 24
A443: BOX HILL | C443: 2 | D443: 3 | E443: =C443*6+D443 -> 15 | G443: 6 | H443: 4 | I443: =G443*6+H443 -> 40 | K443: 7 | L443: 6 | M443: =K443*6+L443 -> 48 | O443: 9 | P443: 7 | Q443: =O443*6+P443 -> 61 | S443: MARCY | W443: SUNSHINE | X443: 5 | Y443: 5 | Z443: 0 | AA443: 1160 | AB443: 1008 | AC443: =(AA443*100)/AB443 -> 115.07936507936508 | AD443: =(X443*4)+(Z443*2) -> 20
A444: BEST PLAYERS | W444: YARRAVILLE | X444: 4 | Y444: 6 | Z444: 0 | AA444: 1093 | AB444: 1217 | AC444: =(AA444*100)/AB444 -> 89.811010682004934 | AD444: =(X444*4)+(Z444*2) -> 16
A445: MORDIALLOC | C445: PRIDGEON | F445: SCAIFFE | I445: HARRY | L445: McNAUGHT | O445: GUY | Q445: BROOKER | W445: WAVERLEY | X445: 3 | Y445: 7 | Z445: 0 | AA445: 1175 | AB445: 1293 | AC445: =(AA445*100)/AB445 -> 90.873936581593199 | AD445: =(X445*4)+(Z445*2) -> 12
A446: BOX HILL | C446: KING | F446: HOOGSTRA | I446: BRYANT | L446: BAKER | O446: LAWTHER | W446: BOX HILL | X446: 1 | Y446: 9 | Z446: 0 | AA446: 893 | AB446: 1187 | AC446: =(AA446*100)/AB446 -> 75.231676495366472 | AD446: =(X446*4)+(Z446*2) -> 4
A447: GOALKICKERS | N447: MOORE | P447: SLADE | W447: WERRIBEE | X447: 0 | Y447: 10 | Z447: 0 | AA447: 800 | AB447: 1383 | AC447: =(AA447*100)/AB447 -> 57.845263919016631 | AD447: =(X447*4)+(Z447*2) -> 0
A448: MORDIALLOC | C448: McNAUGHT 4 | F448: BROOKER 3 | H448: GUY 3 | J448: PRIDGEON 2 | M448: HARRY 2 | O448: SCAIFFE | Q448: EDDY | S448: WILLIAMSON
A449: BOX HILL | C449: ZANTUCK 3 | F449: McMAHON 2 | I449: McMASTER | L449: LASKIE | N449: BRYANT | P449: PAGEY
A451: CAMBERWELL | C451: 3 | D451: 5 | E451: =C451*6+D451 -> 23 | G451: 9 | H451: 9 | I451: =G451*6+H451 -> 63 | K451: 16 | L451: 12 | M451: =K451*6+L451 -> 108 | O451: 18 | P451: 16 | Q451: =O451*6+P451 -> 124 | S451: WAVERLEY
A452: WAVERLEY | C452: 3 | D452: 5 | E452: =C452*6+D452 -> 23 | G452: 8 | H452: 8 | I452: =G452*6+H452 -> 56 | K452: 13 | L452: 11 | M452: =K452*6+L452 -> 89 | O452: 17 | P452: 18 | Q452: =O452*6+P452 -> 120 | S452: TORNEY
A453: BEST PLAYERS
A454: CAMBERWELL | C454: McCULLOCH | F454: KENNEDY | I454: HAMMOND | L454: STONE | O454: FOX | R454: PARSONS
A455: WAVERLEY | C455: COSTELLO | F455: HOLDSWORTH | I455: HORKINGS | L455: HANCOCK | O455: LARAGY | R455: ZIESLER
A456: GOALKICKERS
A457: CAMBERWELL | C457: HAMMOND 7 | F457: KENNEDY 4 | I457: SIMPSON | K457: SAUERBERG | N457: HOOK | O457: SMITH | Q457: KARVELIS | S457: McCULLOCH | V457: STONE
A458: WAVERLEY | C458: COSTELLO 7 | F458: ZIESLER 6 | I458: McCLURE 2 | L458: HOLDSWORTH | O458: GRANT
A460: FRANKSTON | C460: 5 | D460: 3 | E460: =C460*6+D460 -> 33 | G460: 11 | H460: 9 | I460: =G460*6+H460 -> 75 | K460: 17 | L460: 13 | M460: =K460*6+L460 -> 115 | O460: 24 | P460: 17 | Q460: =O460*6+P460 -> 161 | S460: FRANKSTON
A461: YARRAVILLE | C461: 1 | D461: 2 | E461: =C461*6+D461 -> 8 | G461: 8 | H461: 3 | I461: =G461*6+H461 -> 51 | K461: 12 | L461: 4 | M461: =K461*6+L461 -> 76 | O461: 17 | P461: 5 | Q461: =O461*6+P461 -> 107 | S461: HAYES
A462: BEST PLAYERS
A463: FRANKSTON | C463: FALKINER | F463: DAVIES | I463: ELLIS | L463: KENDALL | O463: ESLER | R463: RIDSDALE
A464: YARRAVILLE | C464: T SMITH | F464: MARTIN | I464: ARCHER | L464: McNAMARA | O464: BARCLAY | R464: McLAREN
A465: GOALKICKERS
A466: FRANKSTON | C466: ROSENBROCK 8 | F466: LOVELOCK 3 | I466: EDWARDS 3 | K466: ELLIS 3 | M466: FALKINER 2 | O466: STAPLETON 2 | R466: ESLER | T466: A DOHERTY | W466: HUNTER
A467: YARRAVILLE | C467: McNAMARA 5 | F467: MARTIN 4 | I467: ARCHER 2 | K467: JOSLIN 2 | M467: LEWIS 2 | O467: NORRIS | Q467: BROPHY
A469: SUNSHINE | C469: 7 | D469: 3 | E469: =C469*6+D469 -> 45 | G469: 13 | H469: 8 | I469: =G469*6+H469 -> 86 | K469: 18 | L469: 10 | M469: =K469*6+L469 -> 118 | O469: 25 | P469: 13 | Q469: =O469*6+P469 -> 163 | S469: SUNSHINE
A470: NORTHCOTE | C470: 1 | D470: 2 | E470: =C470*6+D470 -> 8 | G470: 3 | H470: 7 | I470: =G470*6+H470 -> 25 | K470: 4 | L470: 6 | M470: =K470*6+L470 -> 30 | O470: 7 | P470: 10 | Q470: =O470*6+P470 -> 52 | S470: WENN
A471: BEST PLAYERS
A472: SUNSHINE | C472: IZZARD | F472: BENSON | I472: PAXTON | L472: GOOLD | O472: JONES | R472: MITCHELL
A473: NORTHCOTE | C473: JAMES | F473: ROOBERTS | I473: KREYMBORG | L473: McNEILL | O473: HOUGH | R473: McARDLE
A474: GOALKICKERS
A475: SUNSHINE | C475: IZZARD 5 | E475: LLOYD 5 | G475: BENSON 5 | I475: SLADDIN 3 | K475: MADDOX 2 | N475: FEBEY 2 | P475: HUTCHISON | S475: PAXTON | U475: PONTON
A476: NORTHCOTE | C476: HOUGH 2 | F476: CHAPMAN 2 | I476: RYAN 2 | K476: TARGETT
A478: ROUND 11 | E478: 15TH JUNE | J478: WEATHER | S478: PLAYED AT
D479: 1ST QTR | H479: 2ND QTR | L479: 3RD QTR | P479: FINAL | S479: NORTHCOTE
A480: FRANKSTON | C480: 6 | D480: 3 | E480: =C480*6+D480 -> 39 | G480: 12 | H480: 7 | I480: =G480*6+H480 -> 79 | K480: 15 | L480: 11 | M480: =K480*6+L480 -> 101 | O480: 17 | P480: 17 | Q480: =O480*6+P480 -> 119 | S480: UMPIRE | X480: LADDER | AB480: ROUND | AD480: 11
A481: NORTHCOTE | C481: 5 | D481: 3 | E481: =C481*6+D481 -> 33 | G481: 8 | H481: 3 | I481: =G481*6+H481 -> 51 | K481: 11 | L481: 9 | M481: =K481*6+L481 -> 75 | O481: 16 | P481: 12 | Q481: =O481*6+P481 -> 108 | S481: CARLILE
A482: BEST PLAYERS | W482: TEAM | X482: W | Y482: L | Z482: D | AA482: FOR | AB482: AGST | AC482: % | AD482: PTS
A483: FRANKSTON | C483: EDWARDS | F483: TICKELL | I483: A DOHERTY | L483: ESLER | O483: LOVELOCK | R483: DAVIES
A484: NORTHCOTE | C484: McINTYRE | F484: ROBERTSON | I484: M RYAN | L484: TRESSIDER | O484: ROBERTS | R484: REDENBACH | W484: CAMBERWELL | X484: 11 | Y484: 0 | Z484: 0 | AA484: 1383 | AB484: 920 | AC484: =(AA484*100)/AB484 -> 150.32608695652175 | AD484: =(X484*4)+(Z484*2) -> 44
A485: GOALKICKERS | O485: EDWARDS | W485: BRUNSWICK | X485: 9 | Y485: 2 | Z485: 0 | AA485: 1415 | AB485: 997 | AC485: =(AA485*100)/AB485 -> 141.92577733199599 | AD485: =(X485*4)+(Z485*2) -> 36
A486: FRANKSTON | C486: LOVELOCK 5 | F486: ROSENBROCK 3 | I486: A DOHERTY 3 | L486: ELLIS 2 | N486: ESLER | O486: C DOHERTY | R486: STAPLETON | W486: FRANKSTON | X486: 8 | Y486: 3 | Z486: 0 | AA486: 1258 | AB486: 1115 | AC486: =(AA486*100)/AB486 -> 112.82511210762331 | AD486: =(X486*4)+(Z486*2) -> 32
A487: NORTHCOTE | C487: McINTYRE 5 | F487: KREYMBORG 3 | I487: G RYAN 2 | K487: BREWER 2 | N487: ROBERTSON 2 | Q487: CHAPMAN | S487: HOUGH | W487: SUNSHINE | X487: 6 | Y487: 5 | Z487: 0 | AA487: 1279 | AB487: 1116 | AC487: =(AA487*100)/AB487 -> 114.60573476702508 | AD487: =(X487*4)+(Z487*2) -> 24
A489: WAVERLEY | C489: 3 | D489: 3 | E489: =C489*6+D489 -> 21 | G489: 11 | H489: 5 | I489: =G489*6+H489 -> 71 | K489: 17 | L489: 18 | M489: =K489*6+L489 -> 120 | O489: 20 | P489: 11 | Q489: =O489*6+P489 -> 131 | S489: YARRAVILLE | W489: MORDIALLOC | X489: 6 | Y489: 5 | Z489: 0 | AA489: 1086 | AB489: 1032 | AC489: =(AA489*100)/AB489 -> 105.23255813953489 | AD489: =(X489*4)+(Z489*2) -> 24
A490: YARRAVILLE | C490: 4 | D490: 11 | E490: =C490*6+D490 -> 35 | G490: 8 | H490: 12 | I490: =G490*6+H490 -> 60 | K490: 11 | L490: 15 | M490: =K490*6+L490 -> 81 | O490: 16 | P490: 17 | Q490: =O490*6+P490 -> 113 | S490: VERGONA | W490: NORTHCOTE | X490: 6 | Y490: 5 | Z490: 0 | AA490: 1257 | AB490: 1322 | AC490: =(AA490*100)/AB490 -> 95.083207261724667 | AD490: =(X490*4)+(Z490*2) -> 24
A491: BEST PLAYERS | W491: YARRAVILLE | X491: 4 | Y491: 7 | Z491: 0 | AA491: 1306 | AB491: 1348 | AC491: =(AA491*100)/AB491 -> 96.884272997032639 | AD491: =(X491*4)+(Z491*2) -> 16
A492: WAVERLEY | C492: LEES | F492: HANCOCK | I492: SYKES | L492: HOLDSWORTH | O492: ZIESLER | R492: HORKINGS | W492: WAVERLEY | X492: 4 | Y492: 7 | Z492: 0 | AA492: 1306 | AB492: 1406 | AC492: =(AA492*100)/AB492 -> 92.887624466571836 | AD492: =(X492*4)+(Z492*2) -> 16
A493: YARRAVILLE | C493: McLAREN | F493: MARTIN | I493: RYAN | L493: DOLL | O493: EVANS | R493: SQUIRE | W493: BOX HILL | X493: 1 | Y493: 10 | Z493: 0 | AA493: 968 | AB493: 1309 | AC493: =(AA493*100)/AB493 -> 73.949579831932766 | AD493: =(X493*4)+(Z493*2) -> 4
A494: GOALKICKERS | W494: WERRIBEE | X494: 0 | Y494: 11 | Z494: 0 | AA494: 908 | AB494: 1502 | AC494: =(AA494*100)/AB494 -> 60.452729693741681 | AD494: =(X494*4)+(Z494*2) -> 0
A495: WAVERLEY | C495: ZIESLER 9 | F495: GRANT 3 | H495: HORKINGS 3 | K495: COSTELLO 2 | N495: MccLURE 2 | Q495: OSBORNE
A496: YARRAVILLE | C496: SHARP 3 | E496: MARTIN 3 | G496: BROPHY 2 | I496: ARCHER 2 | K496: SAYNOR 2 | N496: NORRIS | P496: LOWE | R496: McNAMARA | U496: SQUIRE
E497: 22ND JUNE | J497: WEATHER
A498: CAMBERWELL | C498: 3 | D498: 3 | E498: =C498*6+D498 -> 21 | G498: 13 | H498: 8 | I498: =G498*6+H498 -> 86 | K498: 13 | L498: 14 | M498: =K498*6+L498 -> 92 | O498: 17 | P498: 20 | Q498: =O498*6+P498 -> 122 | S498: CAMBERWELL
A499: BOX HILL | C499: 3 | D499: 6 | E499: =C499*6+D499 -> 24 | G499: 4 | H499: 7 | I499: =G499*6+H499 -> 31 | K499: 8 | L499: 13 | M499: =K499*6+L499 -> 61 | O499: 10 | P499: 15 | Q499: =O499*6+P499 -> 75 | S499: OAKLEY
A500: BEST PLAYERS
A501: CAMBERWELL | C501: STONE | F501: HOOK | I501: WILSON | L501: SIMPSON | O501: McCULLOCH | R501: MORRIS
A502: BOX HILL | C502: LAWTHER | F502: PAGEY | I502: BRYANT | L502: BARNETT | O502: HOOGSTRA | R502: BAKER
A503: GOALKICKERS
A504: CAMBERWELL | C504: HAMMOND 5 | F504: BOWDEN 2 | I504: MORRIS 2 | K504: McCULLOCH 2 | N504: SAUERBERG 2 | Q504: SIMPSON 2 | S504: HOOK | U504: STONE
A505: BOX HILL | C505: PAGEY 5 | F505: LASKIE 2 | I505: McMAHON 2 | L505: CAMERON
A507: BRUNSWICK | C507: 3 | D507: 3 | E507: =C507*6+D507 -> 21 | G507: 4 | H507: 5 | I507: =G507*6+H507 -> 29 | K507: 7 | L507: 7 | M507: =K507*6+L507 -> 49 | O507: 11 | P507: 8 | Q507: =O507*6+P507 -> 74 | S507: MORDIALLOC
A508: MORDIALLOC | C508: 1 | D508: 3 | E508: =C508*6+D508 -> 9 | G508: 5 | H508: 5 | I508: =G508*6+H508 -> 35 | K508: 6 | L508: 7 | M508: =K508*6+L508 -> 43 | O508: 8 | P508: 12 | Q508: =O508*6+P508 -> 60 | S508: WENN
A509: BEST PLAYERS
A510: BRUNSWICK | C510: VALENTINE | F510: WARDEN | I510: BRIGHAM | L510: SMITH | O510: SKIDMORE | R510: NOLAN
A511: MORDIALLOC | C511: GUY | F511: EDDY | I511: ROSENOW | L511: MOORE | O511: DEATON | R511: LANG
A512: GOALKICKERS
A513: BRUNSWICK | C513: WARDEN 4 | F513: ORTON 4 | I513: LAKER | K513: BRIGHAM | N513: NUNN
A514: MORDIALLOC | C514: WILLIAMSON 3 | F514: McDONNELL 2 | I514: DEATON 2 | L514: MOORE
A516: SUNSHINE | C516: 6 | D516: 3 | E516: =C516*6+D516 -> 39 | G516: 12 | H516: 7 | I516: =G516*6+H516 -> 79 | K516: 15 | L516: 11 | M516: =K516*6+L516 -> 101 | O516: 17 | P516: 17 | Q516: =O516*6+P516 -> 119 | S516: WERRIBEE
A517: WERRIBEE | C517: 2 | D517: 2 | E517: =C517*6+D517 -> 14 | G517: 8 | H517: 3 | I517: =G517*6+H517 -> 51 | K517: 11 | L517: 9 | M517: =K517*6+L517 -> 75 | O517: 16 | P517: 12 | Q517: =O517*6+P517 -> 108 | S517: STABB
A518: BEST PLAYERS
A519: SUNSHINE | C519: JONES | F519: PONTON | I519: PIERCZAK | L519: GOOLD | O519: MITCHELL | R519: SLADDIN
A520: WERRIBEE | C520: YOUNG | F520: MITCHELL | I520: DEY | L520: EVANS | O520: GLEESON | R520: BOURKE
A521: GOALKICKERS
A522: SUNSHINE | C522: SLADDIN 7 | F522: LLOYD 3 | H522: BENTLEY 3 | J522: BENSON 2 | M522: JONES 2 | O522: PONTON 2 | R522: IZZARD | T522: MADDOX
A523: WERRIBEE | C523: SCARFE 3 | F523: NORTON 3 | I523: MITCHELL | L523: BOURKE | N523: KNIGHT | P523: ARRIGO
A525: ROUND 12 | E525: 29TH JUNE | J525: WEATHER | S525: PLAYED AT
D526: 1ST QTR | H526: 2ND QTR | L526: 3RD QTR | P526: FINAL | S526: WAVERLEY
A527: FRANKSTON | C527: 5 | D527: 2 | E527: =C527*6+D527 -> 32 | G527: 12 | H527: 9 | I527: =G527*6+H527 -> 81 | K527: 16 | L527: 16 | M527: =K527*6+L527 -> 112 | O527: 22 | P527: 21 | Q527: =O527*6+P527 -> 153 | S527: UMPIRE | X527: LADDER | AB527: ROUND | AD527: 12
A528: WAVERLEY | C528: 5 | D528: 3 | E528: =C528*6+D528 -> 33 | G528: 8 | H528: 4 | I528: =G528*6+H528 -> 52 | K528: 13 | L528: 7 | M528: =K528*6+L528 -> 85 | O528: 16 | P528: 10 | Q528: =O528*6+P528 -> 106 | S528: ABBOTT
A529: BEST PLAYERS | W529: TEAM | X529: W | Y529: L | Z529: D | AA529: FOR | AB529: AGST | AC529: % | AD529: PTS
A530: FRANKSTON | C530: ELLIS | F530: LOCCO | I530: SLADE | L530: KENDALL | O530: ROSENBROCK
A531: WAVERLEY | C531: COSTELLO | F531: HANCOCK | I531: O'DONNELL | L531: HORKINGS | O531: ZIESLER | R531: HOLDSWORTH | W531: CAMBERWELL | X531: 12 | Y531: 0 | Z531: 0 | AA531: 1525 | AB531: 1011 | AC531: =(AA531*100)/AB531 -> 150.84075173095945 | AD531: =(X531*4)+(Z531*2) -> 48
A532: GOALKICKERS | P532: TICKELL | R532: DAVIES | W532: BRUNSWICK | X532: 10 | Y532: 2 | Z532: 0 | AA532: 1519 | AB532: 1062 | AC532: =(AA532*100)/AB532 -> 143.03201506591338 | AD532: =(X532*4)+(Z532*2) -> 40
A533: FRANKSTON | C533: ROSENBROCK 6 | F533: FALKINER 4 | H533: DOHERTY 2 | K533: ELLIS 2 | M533: FISHER 2 | O533: LOCCO 2 | Q533: HARRISON | S533: EDWARDS | W533: FRANKSTON | X533: 9 | Y533: 3 | Z533: 0 | AA533: 1411 | AB533: 1221 | AC533: =(AA533*100)/AB533 -> 115.56101556101557 | AD533: =(X533*4)+(Z533*2) -> 36
A534: WAVERLEY | C534: COSTELLO 9 | F534: ZIESLER 3 | I534: HOLDSWORTH | L534: HORKINGS | W534: SUNSHINE | X534: 7 | Y534: 5 | Z534: 0 | AA534: 1413 | AB534: 1210 | AC534: =(AA534*100)/AB534 -> 116.77685950413223 | AD534: =(X534*4)+(Z534*2) -> 28
A536: BRUNSWICK | C536: 3 | D536: 0 | E536: =C536*6+D536 -> 18 | G536: 7 | H536: 5 | I536: =G536*6+H536 -> 47 | K536: 12 | L536: 9 | M536: =K536*6+L536 -> 81 | O536: 15 | P536: 14 | Q536: =O536*6+P536 -> 104 | S536: BRUNSWICK | W536: MORDIALLOC | X536: 6 | Y536: 6 | Z536: 0 | AA536: 1164 | AB536: 1153 | AC536: =(AA536*100)/AB536 -> 100.95403295750216 | AD536: =(X536*4)+(Z536*2) -> 24
A537: NORTHCOTE | C537: 3 | D537: 3 | E537: =C537*6+D537 -> 21 | G537: 3 | H537: 8 | I537: =G537*6+H537 -> 26 | K537: 5 | L537: 8 | M537: =K537*6+L537 -> 38 | O537: 9 | P537: 11 | Q537: =O537*6+P537 -> 65 | S537: O'BRIEN | W537: NORTHCOTE | X537: 6 | Y537: 6 | Z537: 0 | AA537: 1322 | AB537: 1426 | AC537: =(AA537*100)/AB537 -> 92.706872370266481 | AD537: =(X537*4)+(Z537*2) -> 24
A538: BEST PLAYERS | W538: YARRAVILLE | X538: 5 | Y538: 7 | Z538: 0 | AA538: 1427 | AB538: 1426 | AC538: =(AA538*100)/AB538 -> 100.07012622720897 | AD538: =(X538*4)+(Z538*2) -> 20
A539: BRUNSWICK | C539: SMITH | F539: VALENTINE | I539: EGAN | L539: BRIGHAM | O539: ORTON | R539: SKIDMORE | W539: WAVERLEY | X539: 4 | Y539: 8 | Z539: 0 | AA539: 1412 | AB539: 1559 | AC539: =(AA539*100)/AB539 -> 90.570878768441304 | AD539: =(X539*4)+(Z539*2) -> 16
A540: NORTHCOTE | C540: REDENBACH | F540: G RYAN | I540: JAMES | L540: ROBERTS | O540: ROBERTSON | W540: BOX HILL | X540: 1 | Y540: 11 | Z540: 0 | AA540: 1062 | AB540: 1443 | AC540: =(AA540*100)/AB540 -> 73.596673596673597 | AD540: =(X540*4)+(Z540*2) -> 4
A541: GOALKICKERS | W541: WERRIBEE | X541: 0 | Y541: 12 | Z541: 0 | AA541: 999 | AB541: 1644 | AC541: =(AA541*100)/AB541 -> 60.76642335766423 | AD541: =(X541*4)+(Z541*2) -> 0
A542: BRUNSWICK | C542: ORTON 6 | F542: EGAN 3 | H542: FORD 2 | J542: BRIGHAM 2 | M542: WARDEN | O542: WOODHAM
A543: NORTHCOTE | C543: CHAPMAN 3 | F543: RYAN 3 | H543: BREWER 2 | J543: MCINTYRE
A545: SUNSHINE | C545: 4 | D545: 2 | E545: =C545*6+D545 -> 26 | G545: 12 | H545: 9 | I545: =G545*6+H545 -> 81 | K545: 15 | L545: 12 | M545: =K545*6+L545 -> 102 | O545: 19 | P545: 20 | Q545: =O545*6+P545 -> 134 | S545: BOX HILL
A546: BOX HILL | C546: 5 | D546: 2 | E546: =C546*6+D546 -> 32 | G546: 8 | H546: 2 | I546: =G546*6+H546 -> 50 | K546: 10 | L546: 11 | M546: =K546*6+L546 -> 71 | O546: 13 | P546: 16 | Q546: =O546*6+P546 -> 94 | S546: TORNEY
A547: BEST PLAYERS
A548: SUNSHINE | C548: PAXTON | F548: SLADDIN | I548: BENSON | L548: BAIRD | O548: LLOYD | R548: MARTIN
A549: BOX HILL | C549: BRYANT | F549: WRIGHT | I549: HOOGSTRA | L549: ZANTUCK | O549: KIKER | R549: BUTLER
A550: GOALKICKERS
A551: SUNSHINE | C551: SLADDIN 7 | F551: LLOYD 3 | H551: PAXTON 3 | J551: BENSON 2 | M551: COURTNEY 2 | P551: IZZARD | R551: RADZIMINSKI
A552: BOX HILL | C552: WRIGHT 3 | F552: KIKER 2 | H552: HOOGSTRA 2 | K552: McFARLANE 2 | N552: LAWTHER | P552: BUTLER | R552: ZANTUCK | T552: CROTHERS
A554: YARRAVILLE | C554: 3 | D554: 0 | E554: =C554*6+D554 -> 18 | G554: 7 | H554: 7 | I554: =G554*6+H554 -> 49 | K554: 9 | L554: 10 | M554: =K554*6+L554 -> 64 | O554: 17 | P554: 19 | Q554: =O554*6+P554 -> 121 | S554: YARRAVILLE
A555: MORDIALLOC | C555: 0 | D555: 5 | E555: =C555*6+D555 -> 5 | G555: 3 | H555: 7 | I555: =G555*6+H555 -> 25 | K555: 9 | L555: 15 | M555: =K555*6+L555 -> 69 | O555: 10 | P555: 18 | Q555: =O555*6+P555 -> 78 | S555: OGSTON
A556: BEST PLAYERS
A557: YARRAVILLE | C557: SQUIRE | F557: MARTIN | I557: SHARP | L557: DOLL | O557: BARCLAY
A558: MORDIALLOC | C558: LANG | F558: GUY | I558: McDONNELL | L558: ROSENOW | O558: DEATON
A559: GOALKICKERS
A560: YARRAVILLE | C560: MARTIN 4 | F560: McNAMARA 4 | I560: RYAN 3 | K560: SAYNOR 2 | N560: WALLIS 2 | P560: SHARP | R560: McLAREN
A561: MORDIALLOC | C561: DEATON 3 | F561: McDONNELL 3 | I561: ROSENOW | L561: HARRY | N561: WILLIAMSON | Q561: GUY
A563: CAMBERWELL | C563: 5 | D563: 0 | E563: =C563*6+D563 -> 30 | G563: 9 | H563: 2 | I563: =G563*6+H563 -> 56 | K563: 13 | L563: 12 | M563: =K563*6+L563 -> 90 | O563: 21 | P563: 16 | Q563: =O563*6+P563 -> 142 | S563: WERRIBEE
A564: WERRIBEE | C564: 4 | D564: 3 | E564: =C564*6+D564 -> 27 | G564: 6 | H564: 8 | I564: =G564*6+H564 -> 44 | K564: 8 | L564: 12 | M564: =K564*6+L564 -> 60 | O564: 13 | P564: 13 | Q564: =O564*6+P564 -> 91 | S564: McBAIN/TIMBLETT
A565: BEST PLAYERS
A566: CAMBERWELL | C566: OLIVER | F566: MORRIS | I566: HAMMOND | L566: BOWDEN | O566: SIMPSON | R566: STONE
A567: WERRIBEE | C567: NORTON | F567: SCARFE | I567: EVANS | L567: HAMBLIN | O567: BELLIN | R567: COCKS
A568: GOALKICKERS
A569: CAMBERWELL | C569: HAMMOND 10 | F569: SIMPSON 5 | I569: MORRIS 2 | K569: STOREY | M569: HOOK | O569: BOWDEN | Q569: PHILLIPS
A570: WERRIBEE | C570: NORTON 9 | F570: BELLIN 3 | I570: SCARFE
A572: ROUND 13 | E572: 6TH JULY | J572: WEATHER | S572: PLAYED AT
D573: 1ST QTR | H573: 2ND QTR | L573: 3RD QTR | P573: FINAL | S573: FRANKSTON
A574: FRANKSTON | C574: 8 | D574: 5 | E574: =C574*6+D574 -> 53 | G574: 12 | H574: 8 | I574: =G574*6+H574 -> 80 | K574: 18 | L574: 10 | M574: =K574*6+L574 -> 118 | O574: 24 | P574: 17 | Q574: =O574*6+P574 -> 161 | S574: UMPIRE | X574: LADDER | AB574: ROUND | AD574: 13
A575: BOX HILL | C575: 2 | D575: 3 | E575: =C575*6+D575 -> 15 | G575: 4 | H575: 5 | I575: =G575*6+H575 -> 29 | K575: 7 | L575: 8 | M575: =K575*6+L575 -> 50 | O575: 9 | P575: 13 | Q575: =O575*6+P575 -> 67 | S575: McGIBBON
A576: BEST PLAYERS | W576: TEAM | X576: W | Y576: L | Z576: D | AA576: FOR | AB576: AGST | AC576: % | AD576: PTS
A577: FRANKSTON | C577: ? | F577: KENDALL | I577: ROSENBROCK | L577: ? | O577: WARD | R577: EDWARDS
A578: BOX HILL | C578: ?TICK | F578: McMAHON | I578: BRYANT | L578: ? | O578: ZANTUCK | R578: KIKER | W578: CAMBERWELL | X578: 13 | Y578: 0 | Z578: 0 | AA578: 1622 | AB578: 1063 | AC578: =(AA578*100)/AB578 -> 152.58701787394168 | AD578: =(X578*4)+(Z578*2) -> 52
A579: GOALKICKERS | N579: JOY | P579: LOCCO | W579: BRUNSWICK | X579: 10 | Y579: 3 | Z579: 0 | AA579: 1628 | AB579: 1189 | AC579: =(AA579*100)/AB579 -> 136.92178301093355 | AD579: =(X579*4)+(Z579*2) -> 40
A580: FRANKSTON | C580: ROSENBROCK 10 | F580: ELLIS 4 | H580: KENDALL 2 | K580: DOHERTY 2 | N580: TICKELL | P580: HARRISON | R580: FALKINER | T580: EDWARDS | W580: FRANKSTON | X580: 10 | Y580: 3 | Z580: 0 | AA580: 1572 | AB580: 1288 | AC580: =(AA580*100)/AB580 -> 122.04968944099379 | AD580: =(X580*4)+(Z580*2) -> 40
A581: BOX HILL | C581: McMAHON 3 | F581: WRIGHT 2 | I581: ZANTUCK | K581: PAGEY | M581: KIKER | O581: GROSSMAN | W581: SUNSHINE | X581: 8 | Y581: 5 | Z581: 0 | AA581: 1540 | AB581: 1319 | AC581: =(AA581*100)/AB581 -> 116.75511751326762 | AD581: =(X581*4)+(Z581*2) -> 32
A583: SUNSHINE | C583: 0 | D583: 0 | E583: =C583*6+D583 -> 0 | G583: 0 | H583: 0 | I583: =G583*6+H583 -> 0 | K583: 0 | L583: 0 | M583: =K583*6+L583 -> 0 | O583: 20 | P583: 7 | Q583: =O583*6+P583 -> 127 | S583: BOX HILL | W583: MORDIALLOC | X583: 7 | Y583: 6 | Z583: 0 | AA583: 1280 | AB583: 1246 | AC583: =(AA583*100)/AB583 -> 102.72873194221509 | AD583: =(X583*4)+(Z583*2) -> 28
A584: BRUNSWICK | C584: 0 | D584: 0 | E584: =C584*6+D584 -> 0 | G584: 0 | H584: 0 | I584: =G584*6+H584 -> 0 | K584: 0 | L584: 0 | M584: =K584*6+L584 -> 0 | O584: 16 | P584: 13 | Q584: =O584*6+P584 -> 109 | S584: MARKS | W584: NORTHCOTE | X584: 7 | Y584: 6 | Z584: 0 | AA584: 1440 | AB584: 1511 | AC584: =(AA584*100)/AB584 -> 95.301125082726671 | AD584: =(X584*4)+(Z584*2) -> 28
A585: BEST PLAYERS | W585: YARRAVILLE | X585: 5 | Y585: 8 | Z585: 0 | AA585: 1479 | AB585: 1523 | AC585: =(AA585*100)/AB585 -> 97.11096520026264 | AD585: =(X585*4)+(Z585*2) -> 20
A586: SUNSHINE | C586: GOOLD | F586: BENSON | I586: MITCHELL | L586: JONES | N586: PARSONS | Q586: PIERCZAK | W586: WAVERLEY | X586: 4 | Y586: 9 | Z586: 0 | AA586: 1505 | AB586: 1675 | AC586: =(AA586*100)/AB586 -> 89.850746268656721 | AD586: =(X586*4)+(Z586*2) -> 16
A587: BRUNSWICK | C587: ORTON | F587: OFFICER | I587: NOLAN | L587: EGAN | W587: BOX HILL | X587: 1 | Y587: 12 | Z587: 0 | AA587: 1129 | AB587: 1604 | AC587: =(AA587*100)/AB587 -> 70.386533665835415 | AD587: =(X587*4)+(Z587*2) -> 4
A588: GOALKICKERS | W588: WERRIBEE | X588: 0 | Y588: 13 | Z588: 0 | AA588: 1084 | AB588: 1762 | AC588: =(AA588*100)/AB588 -> 61.52099886492622 | AD588: =(X588*4)+(Z588*2) -> 0
A589: SUNSHINE | C589: BENSON 5 | F589: SLADDIN 3 | I589: LLOYD 3 | K589: JONES 3 | M589: RADZIMINSKI 3 | P589: MADDOX 2
A590: BRUNSWICK | C590: ORTON 7 | F590: OFFICER 3 | I590: VALENTINE 2 | L590: WARDEN 2 | N590: PERRY | P590: BRIGHAM
A592: NORTHCOTE | C592: 2 | D592: 7 | E592: =C592*6+D592 -> 19 | G592: 6 | H592: 11 | I592: =G592*6+H592 -> 47 | K592: 11 | L592: 14 | M592: =K592*6+L592 -> 80 | O592: 16 | P592: 22 | Q592: =O592*6+P592 -> 118 | S592: NORTHCOTE
A593: WERRIBEE | C593: 4 | D593: 1 | E593: =C593*6+D593 -> 25 | G593: 11 | H593: 1 | I593: =G593*6+H593 -> 67 | K593: 12 | L593: 4 | M593: =K593*6+L593 -> 76 | O593: 13 | P593: 7 | Q593: =O593*6+P593 -> 85 | S593: HAYES
A594: BEST PLAYERS
A595: NORTHCOTE | C595: JAMES | F595: DOBSON | I595: ROBERTSON | L595: BRAIN | O595: KREYMBORG | R595: DOHERTY
A596: WERRIBEE | C596: SCARFE | F596: McCARTNEY | I596: EVANS | L596: F MITCHELL | O596: YOUNG | R596: HARVEY
A597: GOALKICKERS
A598: NORTHCOTE | C598: DOBSON 3 | F598: McINTYRE 3 | I598: CHAPMAN 3 | K598: BREWER 2 | N598: M RYAN | P598: STEWART | R598: KREYMBORG | U598: NANKERVIS | X598: McKENZIE
A599: WERRIBEE | C599: NORTON 4 | F599: F MITCHELL 3 | I599: SCARFE 2 | K599: FIDDIAN 2 | N599: BOURKE | P599: JACK
A601: CAMBERWELL | C601: 4 | D601: 5 | E601: =C601*6+D601 -> 29 | G601: 8 | H601: 12 | I601: =G601*6+H601 -> 60 | K601: 10 | L601: 16 | M601: =K601*6+L601 -> 76 | O601: 13 | P601: 19 | Q601: =O601*6+P601 -> 97 | S601: CAMBERWELL
A602: YARRAVILLE | C602: 1 | D602: 3 | E602: =C602*6+D602 -> 9 | G602: 2 | H602: 5 | I602: =G602*6+H602 -> 17 | K602: 4 | L602: 6 | M602: =K602*6+L602 -> 30 | O602: 7 | P602: 10 | Q602: =O602*6+P602 -> 52 | S602: MARCY
A603: BEST PLAYERS
A604: CAMBERWELL | C604: STONE | F604: FOX | I604: McCULLOCH | L604: HOOK | N604: PHILLIPS | Q604: WHITE
A605: YARRAVILLE | C605: RYAN | F605: BARCLAY | I605: SQUIRE | L605: MARTIN | N605: DOLL
A606: GOALKICKERS
A607: CAMBERWELL | C607: HAMMOND 4 | F607: McCULLOCH 3 | I607: SIMPSON 2 | L607: BOWDEN | N607: OLIVER | P607: PHILLIPS | R607: WHITE
A608: YARRAVILLE | C608: A WALLIS 3 | F608: LEWIS | H608: LOWE | J608: MARTIN | L608: RYAN
A610: MORDIALLOC | C610: 3 | D610: 6 | E610: =C610*6+D610 -> 24 | G610: 7 | H610: 9 | I610: =G610*6+H610 -> 51 | K610: 14 | L610: 12 | M610: =K610*6+L610 -> 96 | O610: 17 | P610: 14 | Q610: =O610*6+P610 -> 116 | S610: MORDIALLOC
A611: WAVERLEY | C611: 4 | D611: 4 | E611: =C611*6+D611 -> 28 | G611: 7 | H611: 7 | I611: =G611*6+H611 -> 49 | K611: 9 | L611: 13 | M611: =K611*6+L611 -> 67 | O611: 13 | P611: 15 | Q611: =O611*6+P611 -> 93 | S611: OAKLEY
A612: BEST PLAYERS
A613: MORDIALLOC | C613: ? | F613: MASON | I613: McDONNELL | L613: DEATON | O613: ? | R613: THOMPSON
A614: WAVERLEY | C614: ? | F614: HOLDSWORTH | I614: HANCOCK | L614: COSTELLO | O614: O'DONNELL | R614: CRUSE
A615: GOALKICKERS
A616: MORDIALLOC | C616: DEATON 4 | F616: McDONNELL 3 | I616: GUY 2 | K616: ? 2 | M616: SCAIFFE 2 | P616: WILLIAMSON | S616: ? 1 | U616: DINGLE
A617: WAVERLEY | C617: COSTELLO 5 | F617: ZIESLER 3 | I617: CROUCH 3 | L617: CRUSE | N617: HOLDSWORTH
A619: ROUND 14 | E619: 13TH JULY | J619: WEATHER | S619: PLAYED AT
D620: 1ST QTR | H620: 2ND QTR | L620: 3RD QTR | P620: FINAL | S620: BRUNSWICK
A621: BRUNSWICK | C621: 0 | D621: 3 | E621: =C621*6+D621 -> 3 | G621: 8 | H621: 8 | I621: =G621*6+H621 -> 56 | K621: 8 | L621: 9 | M621: =K621*6+L621 -> 57 | O621: 13 | P621: 13 | Q621: =O621*6+P621 -> 91 | S621: UMPIRE | X621: LADDER | AB621: ROUND | AD621: 14
A622: FRANKSTON | C622: 1 | D622: 5 | E622: =C622*6+D622 -> 11 | G622: 3 | H622: 5 | I622: =G622*6+H622 -> 23 | K622: 5 | L622: 13 | M622: =K622*6+L622 -> 43 | O622: 6 | P622: 14 | Q622: =O622*6+P622 -> 50 | S622: OAKLEY
A623: BEST PLAYERS | W623: TEAM | X623: W | Y623: L | Z623: D | AA623: FOR | AB623: AGST | AC623: % | AD623: PTS
A624: BRUNSWICK | C624: NOLAN | F624: LAKER | I624: WARDEN | L624: SKIDMORE | O624: BRIGHAM | R624: OFFICER
A625: FRANKSTON | C625: DAVIES | F625: KENDALL | I625: STAPLETON | L625: LLOYD | O625: MOORE | R625: RIDSDALE | W625: CAMBERWELL | X625: 13 | Y625: 1 | Z625: 0 | AA625: 1705 | AB625: 1150 | AC625: =(AA625*100)/AB625 -> 148.2608695652174 | AD625: =(X625*4)+(Z625*2) -> 52
A626: GOALKICKERS | W626: BRUNSWICK | X626: 11 | Y626: 3 | Z626: 0 | AA626: 1719 | AB626: 1239 | AC626: =(AA626*100)/AB626 -> 138.74092009685231 | AD626: =(X626*4)+(Z626*2) -> 44
A627: BRUNSWICK | C627: BAIRD 4 | F627: McFARLANE 2 | I627: ORTON 2 | K627: WARDEN 2 | M627: ROWE | O627: OFFICER | Q627: O'CONNOR | W627: FRANKSTON | X627: 10 | Y627: 4 | Z627: 0 | AA627: 1622 | AB627: 1379 | AC627: =(AA627*100)/AB627 -> 117.62146482958666 | AD627: =(X627*4)+(Z627*2) -> 40
A628: FRANKSTON | C628: STAPLETON 2 | F628: ELLIS | H628: KENDALL | J628: ESLER | L628: RIDSDALE | W628: SUNSHINE | X628: 9 | Y628: 5 | Z628: 0 | AA628: 1627 | AB628: 1402 | AC628: =(AA628*100)/AB628 -> 116.04850213980029 | AD628: =(X628*4)+(Z628*2) -> 36
A630: WAVERLEY | C630: 2 | D630: 3 | E630: =C630*6+D630 -> 15 | G630: 10 | H630: 5 | I630: =G630*6+H630 -> 65 | K630: 12 | L630: 9 | M630: =K630*6+L630 -> 81 | O630: 15 | P630: 16 | Q630: =O630*6+P630 -> 106 | S630: BOX HILL | W630: NORTHCOTE | X630: 8 | Y630: 6 | Z630: 0 | AA630: 1508 | AB630: 1574 | AC630: =(AA630*100)/AB630 -> 95.806861499364672 | AD630: =(X630*4)+(Z630*2) -> 32
A631: BOX HILL | C631: 2 | D631: 7 | E631: =C631*6+D631 -> 19 | G631: 4 | H631: 9 | I631: =G631*6+H631 -> 33 | K631: 6 | L631: 16 | M631: =K631*6+L631 -> 52 | O631: 6 | P631: 16 | Q631: =O631*6+P631 -> 52 | S631: MARCY | W631: MORDIALLOC | X631: 7 | Y631: 7 | Z631: 0 | AA631: 1343 | AB631: 1314 | AC631: =(AA631*100)/AB631 -> 102.20700152207002 | AD631: =(X631*4)+(Z631*2) -> 28
A632: BEST PLAYERS | W632: YARRAVILLE | X632: 6 | Y632: 8 | Z632: 0 | AA632: 1575 | AB632: 1587 | AC632: =(AA632*100)/AB632 -> 99.243856332703217 | AD632: =(X632*4)+(Z632*2) -> 24
A633: WAVERLEY | C633: FERGUSON | F633: HANCOCK | I633: BOWTELL | L633: CRUSE | O633: McKAY | R633: HOLDSWORTH | W633: WAVERLEY | X633: 5 | Y633: 9 | Z633: 0 | AA633: 1611 | AB633: 1727 | AC633: =(AA633*100)/AB633 -> 93.283149971048061 | AD633: =(X633*4)+(Z633*2) -> 20
A634: BOX HILL | C634: McMASTER | F634: BRYANT | I634: RALPH | L634: BARNETT | O634: ZANTUCK | R634: WILSON | W634: BOX HILL | X634: 1 | Y634: 13 | Z634: 0 | AA634: 1181 | AB634: 1710 | AC634: =(AA634*100)/AB634 -> 69.064327485380119 | AD634: =(X634*4)+(Z634*2) -> 4
A635: GOALKICKERS | W635: WERRIBEE | X635: 0 | Y635: 14 | Z635: 0 | AA635: 1148 | AB635: 1858 | AC635: =(AA635*100)/AB635 -> 61.786867599569426 | AD635: =(X635*4)+(Z635*2) -> 0
A636: WAVERLEY | C636: COSTELLO 4 | F636: ZIESLER 4 | I636: BOWTELL 2 | L636: McKAY 2 | N636: CROUCH | P636: LEES | R636: SYKES
A637: BOX HILL | C637: McMAHON 3 | F637: RALPH | I637: EVANS | K637: ZANTUCK
A639: YARRAVILLE | C639: 1 | D639: 4 | E639: =C639*6+D639 -> 10 | G639: 7 | H639: 12 | I639: =G639*6+H639 -> 54 | K639: 8 | L639: 13 | M639: =K639*6+L639 -> 61 | O639: 13 | P639: 18 | Q639: =O639*6+P639 -> 96 | S639: YARRAVILLE
A640: WERRIBEE | C640: 2 | D640: 2 | E640: =C640*6+D640 -> 14 | G640: 4 | H640: 2 | I640: =G640*6+H640 -> 26 | K640: 6 | L640: 7 | M640: =K640*6+L640 -> 43 | O640: 9 | P640: 10 | Q640: =O640*6+P640 -> 64 | S640: TORNEY
A641: BEST PLAYERS
A642: YARRAVILLE | C642: LEWIS | F642: SQUIRE | I642: SMITH | L642: McLAREN | O642: BAKER | R642: SHARP
A643: WERRIBEE | C643: SCAIFFE | F643: MONTGOMERY | I643: KNEE | L643: HARVEY | O643: YOUNG
A644: GOALKICKERS
A645: YARRAVILLE | C645: SHARP 4 | F645: McNAMARA 3 | I645: MARTIN 2 | K645: JOSLIN 2 | M645: LEWIS | O645: WALLIS
A646: WERRIBEE | C646: SCARFE 3 | F646: MITCHELL 3 | I646: FIDDIAN | K646: NORTON | M646: MORRIS
A648: SUNSHINE | C648: 3 | D648: 8 | E648: =C648*6+D648 -> 26 | G648: 3 | H648: 10 | I648: =G648*6+H648 -> 28 | K648: 11 | L648: 15 | M648: =K648*6+L648 -> 81 | O648: 12 | P648: 15 | Q648: =O648*6+P648 -> 87 | S648: CAMBERWELL
A649: CAMBERWELL | C649: 1 | D649: 1 | E649: =C649*6+D649 -> 7 | G649: 5 | H649: 12 | I649: =G649*6+H649 -> 42 | K649: 8 | L649: 12 | M649: =K649*6+L649 -> 60 | O649: 11 | P649: 17 | Q649: =O649*6+P649 -> 83 | S649: HAYES
A650: BEST PLAYERS
A651: SUNSHINE | C651: MARTIN | F651: MITCHELL | I651: LLOYD | L651: BENSON | O651: BAIRD | R651: PONTON
A652: CAMBERWELL | C652: SPITHILL | F652: SIMPSON | I652: OLIVER | L652: HAMMOND | O652: McCULLOCH | R652: STONE
A653: GOALKICKERS
A654: SUNSHINE | C654: BAIRD 4 | F654: BENSON 3 | I654: PONTON 2 | L654: RADZIMINSKI | O654: MARTIN | Q654: IZZARD
A655: CAMBERWELL | C655: HAMMOND 6 | F655: PHILLIPS 2 | I655: ? 1 | L655: BOWDEN | N655: STONE
A657: NORTHCOTE | C657: 0 | D657: 2 | E657: =C657*6+D657 -> 2 | G657: 2 | H657: 11 | I657: =G657*6+H657 -> 23 | K657: 4 | L657: 18 | M657: =K657*6+L657 -> 42 | O657: 7 | P657: 26 | Q657: =O657*6+P657 -> 68 | S657: MORDIALLOC
A658: MORDIALLOC | C658: 3 | D658: 6 | E658: =C658*6+D658 -> 24 | G658: 4 | H658: 11 | I658: =G658*6+H658 -> 35 | K658: 8 | L658: 14 | M658: =K658*6+L658 -> 62 | O658: 8 | P658: 15 | Q658: =O658*6+P658 -> 63 | S658: McGIBBON
A659: BEST PLAYERS
A660: NORTHCOTE | C660: REDENBACH | F660: STILSBY | I660: KREYMBORG | L660: DOBSON | N660: ? | Q660: ROBERTS
A661: MORDIALLOC | C661: LANG | F661: ? | I661: SCAIFFE | L661: GRANT | N661: WILLIAMSON
A662: GOALKICKERS
A663: NORTHCOTE | C663: ? 3 | F663: BREWER | I663: McARDLE | L663: DOBSON | N663: ? 1
A664: MORDIALLOC | C664: WILLIAMSON 3 | F664: SIGNORETTI | I664: SLADE | K664: GRANT | M664: DINGLE | O664: GUY
A666: ROUND 15 | E666: 20TH JULY | J666: WEATHER | S666: PLAYED AT
D667: 1ST QTR | H667: 2ND QTR | L667: 3RD QTR | P667: FINAL | S667: BOX HILL
A668: YARRAVILLE | C668: 10 | D668: 5 | E668: =C668*6+D668 -> 65 | G668: 16 | H668: 10 | I668: =G668*6+H668 -> 106 | K668: 20 | L668: 14 | M668: =K668*6+L668 -> 134 | O668: 28 | P668: 15 | Q668: =O668*6+P668 -> 183 | S668: UMPIRE | X668: LADDER | AB668: ROUND | AD668: 15
A669: BOX HILL | C669: 2 | D669: 4 | E669: =C669*6+D669 -> 16 | G669: 8 | H669: 7 | I669: =G669*6+H669 -> 55 | K669: 10 | L669: 12 | M669: =K669*6+L669 -> 72 | O669: 17 | P669: 16 | Q669: =O669*6+P669 -> 118 | S669: OAKLEY
A670: BEST PLAYERS | W670: TEAM | X670: W | Y670: L | Z670: D | AA670: FOR | AB670: AGST | AC670: % | AD670: PTS
A671: YARRAVILLE | C671: BARCLAY | F671: RYAN | I671: LEWIS | L671: SHARP | O671: JOSLIN | R671: McLAREN
A672: BOX HILL | C672: WILSON | F672: BRYANT | I672: TIERNEY | L672: GROSSEC | O672: WATERS | R672: RALPH | W672: CAMBERWELL | X672: 13 | Y672: 2 | Z672: 0 | AA672: 1807 | AB672: 1256 | AC672: =(AA672*100)/AB672 -> 143.86942675159236 | AD672: =(X672*4)+(Z672*2) -> 52
A673: GOALKICKERS | M673: WILKINSON | P673: GREENEY | W673: BRUNSWICK | X673: 12 | Y673: 3 | Z673: 0 | AA673: 1841 | AB673: 1343 | AC673: =(AA673*100)/AB673 -> 137.08116157855548 | AD673: =(X673*4)+(Z673*2) -> 48
A674: YARRAVILLE | C674: SHARP 6 | E674: RYAN 4 | G674: TAURINS 3 | J674: SQUIRE 3 | L674: MCNAMARA 3 | O674: MARTIN 2 | R674: JOSLIN 2 | T674: LEWIS | W674: SUNSHINE | X674: 10 | Y674: 5 | Z674: 0 | AA674: 1755 | AB674: 1469 | AC674: =(AA674*100)/AB674 -> 119.46902654867256 | AD674: =(X674*4)+(Z674*2) -> 40
A675: BOX HILL | C675: LASKIE 4 | E675: TIERNEY 2 | G675: ZANTUCK 2 | J675: BRYANT 2 | L675: McMAHON | O675: McMASTER | R675: LAWTHER | T675: COUTTS | W675: FRANKSTON | X675: 10 | Y675: 5 | Z675: 0 | AA675: 1689 | AB675: 1507 | AC675: =(AA675*100)/AB675 -> 112.07697412076975 | AD675: =(X675*4)+(Z675*2) -> 40
Q676: VALE
A677: BRUNSWICK | C677: 3 | D677: 3 | E677: =C677*6+D677 -> 21 | G677: 8 | H677: 9 | I677: =G677*6+H677 -> 57 | K677: 10 | L677: 12 | M677: =K677*6+L677 -> 72 | O677: 17 | P677: 20 | Q677: =O677*6+P677 -> 122 | S677: WAVERLEY | W677: NORTHCOTE | X677: 9 | Y677: 6 | Z677: 0 | AA677: 1614 | AB677: 1676 | AC677: =(AA677*100)/AB677 -> 96.300715990453455 | AD677: =(X677*4)+(Z677*2) -> 36
A678: WAVERLEY | C678: 3 | D678: 8 | E678: =C678*6+D678 -> 26 | G678: 7 | H678: 10 | I678: =G678*6+H678 -> 52 | K678: 12 | L678: 19 | M678: =K678*6+L678 -> 91 | O678: 14 | P678: 20 | Q678: =O678*6+P678 -> 104 | S678: McGIBBON | W678: MORDIALLOC | X678: 8 | Y678: 7 | Z678: 0 | AA678: 1486 | AB678: 1378 | AC678: =(AA678*100)/AB678 -> 107.83744557329463 | AD678: =(X678*4)+(Z678*2) -> 32
A679: BEST PLAYERS | W679: YARRAVILLE | X679: 7 | Y679: 8 | Z679: 0 | AA679: 1758 | AB679: 1705 | AC679: =(AA679*100)/AB679 -> 103.10850439882698 | AD679: =(X679*4)+(Z679*2) -> 28
A680: BRUNSWICK | C680: ORTON | F680: MARANTELLI | I680: OFFICER | L680: SKIDMORE | O680: O'CONNOR | W680: WAVERLEY | X680: 5 | Y680: 10 | Z680: 0 | AA680: 1715 | AB680: 1849 | AC680: =(AA680*100)/AB680 -> 92.752839372633858 | AD680: =(X680*4)+(Z680*2) -> 20
A681: WAVERLEY | C681: COSTELLO | F681: HOLDSWORTH | I681: McCLURE | L681: BOWTELL | O681: McKAY | R681: FERGUSON | W681: BOX HILL | X681: 1 | Y681: 14 | Z681: 0 | AA681: 1299 | AB681: 1893 | AC681: =(AA681*100)/AB681 -> 68.621236133122025 | AD681: =(X681*4)+(Z681*2) -> 4
A682: GOALKICKERS | W682: WERRIBEE | X682: 0 | Y682: 15 | Z682: 0 | AA682: 1212 | AB682: 2001 | AC682: =(AA682*100)/AB682 -> 60.569715142428784 | AD682: =(X682*4)+(Z682*2) -> 0
A683: BRUNSWICK | C683: ORTON 6 | E683: BAIRD 5 | G683: MARANTELLI 2 | J683: FORD | L683: SMITH | N683: MCCABE | P683: LAKER
A684: WAVERLEY | C684: COSTELLO 6 | F684: ZIESLER 5 | I684: HANCOCK | L684: McCLURE | N684: LEES
A686: SUNSHINE | C686: 3 | D686: 2 | E686: =C686*6+D686 -> 20 | G686: 10 | H686: 3 | I686: =G686*6+H686 -> 63 | K686: 15 | L686: 6 | M686: =K686*6+L686 -> 96 | O686: 20 | P686: 8 | Q686: =O686*6+P686 -> 128 | S686: SUNSHINE
A687: FRANKSTON | C687: 2 | D687: 2 | E687: =C687*6+D687 -> 14 | G687: 4 | H687: 3 | I687: =G687*6+H687 -> 27 | K687: 8 | L687: 5 | M687: =K687*6+L687 -> 53 | O687: 10 | P687: 7 | Q687: =O687*6+P687 -> 67 | S687: MARCY
A688: BEST PLAYERS
A689: SUNSHINE | C689: BAIRD | F689: GOOLD | I689: PONTON | L689: JONES | O689: MITCHELL | R689: PAXTON
A690: FRANKSTON | C690: TICKELL | F690: ESLER | I690: THATCHER | L690: KENDALL | O690: DAVIES
A691: GOALKICKERS
A692: SUNSHINE | C692: IZZARD 4 | E692: LLOYD 4 | G692: MADDOX 3 | I692: SLADDIN 3 | K692: BENSON 2 | N692: JONES | O692: RADZIMINSKI | R692: HUTCHISON | U692: PONTON
A693: FRANKSTON | C693: ROSENBROCK 3 | F693: STAPLETON 2 | I693: KENDALL | K693: ESLER | M693: THATCHER | P693: EDWARDS | S693: LOCCO
A695: NORTHCOTE | C695: 1 | D695: 5 | E695: =C695*6+D695 -> 11 | G695: 5 | H695: 11 | I695: =G695*6+H695 -> 41 | K695: 8 | L695: 14 | M695: =K695*6+L695 -> 62 | O695: 15 | P695: 16 | Q695: =O695*6+P695 -> 106 | S695: NORTHCOTE
A696: CAMBERWELL | C696: 5 | D696: 3 | E696: =C696*6+D696 -> 33 | G696: 7 | H696: 6 | I696: =G696*6+H696 -> 48 | K696: 10 | L696: 13 | M696: =K696*6+L696 -> 73 | O696: 14 | P696: 18 | Q696: =O696*6+P696 -> 102 | S696: TORNEY
A697: BEST PLAYERS
A698: NORTHCOTE | C698: DOBSON | F698: AFFLECK | I698: ROBERTSON | L698: JAMES | O698: REDENBACH | R698: G RYAN
A699: CAMBERWELL | C699: SPITHILL | F699: SIMPSON | I699: SMITH | L699: PHILLIPS | O699: OLIVER | R699: BOWDEN
A700: GOALKICKERS
A701: NORTHCOTE | C701: CHAPMAN 5 | F701: BREWER 3 | I701: G RYAN 3 | K701: DOBSON 2 | N701: McINTYRE | P701: McARDLE
A702: CAMBERWELL | C702: SMITH 4 | E702: MOORE 2 | G702: PHILLIPS 2 | J702: SIMPSON | L702: HOOK | N702: BOWDEN | P702: STONE | R702: HAMMOND | T702: CROWE
A704: MORDIALLOC | C704: 6 | D704: 4 | E704: =C704*6+D704 -> 40 | G704: 10 | H704: 11 | I704: =G704*6+H704 -> 71 | K704: 14 | L704: 15 | M704: =K704*6+L704 -> 99 | O704: 20 | P704: 23 | Q704: =O704*6+P704 -> 143 | S704: WERRIBEE
A705: WERRIBEE | C705: 3 | D705: 5 | E705: =C705*6+D705 -> 23 | G705: 5 | H705: 6 | I705: =G705*6+H705 -> 36 | K705: 7 | L705: 10 | M705: =K705*6+L705 -> 52 | O705: 8 | P705: 16 | Q705: =O705*6+P705 -> 64 | S705: O'BRIEN
A706: BEST PLAYERS
A707: MORDIALLOC | C707: SLADE | F707: HARRY | I707: WILLIAMSON | L707: GRANT | O707: GUY | Q707: BASTIAN
A708: WERRIBEE | C708: MORRIS | F708: HAMBLIN | I708: COCKS | L708: NOTRON | O708: HARVEY
A709: GOALKICKERS
A710: MORDIALLOC | C710: HARRY 5 | E710: GUY 3 | G710: THOMPSON 3 | J710: WILLIAMSON 3 | M710: DEATON | O710: DINGLE | Q710: SCAIFFE | S710: MOORE | U710: BROOKS | W710: GRANT
A711: WERRIBEE | C711: MORRIS 3 | F711: NORTON 3 | I711: YOUNG | K711: BOURKE | M711: HAMBLIN
A713: ROUND 16 | E713: 27TH JULY | J713: WEATHER | S713: PLAYED AT
D714: 1ST QTR | H714: 2ND QTR | L714: 3RD QTR | P714: FINAL | S714: BRUNSWICK
A715: BRUNSWICK | C715: 6 | D715: 2 | E715: =C715*6+D715 -> 38 | G715: 10 | H715: 9 | I715: =G715*6+H715 -> 69 | K715: 13 | L715: 16 | M715: =K715*6+L715 -> 94 | O715: 17 | P715: 23 | Q715: =O715*6+P715 -> 125 | S715: UMPIRE | X715: LADDER | AB715: ROUND | AD715: 16
A716: BOX HILL | C716: 3 | D716: 1 | E716: =C716*6+D716 -> 19 | G716: 7 | H716: 4 | I716: =G716*6+H716 -> 46 | K716: 9 | L716: 5 | M716: =K716*6+L716 -> 59 | O716: 13 | P716: 8 | Q716: =O716*6+P716 -> 86 | S716: TORNEY
A717: BEST PLAYERS | W717: TEAM | X717: W | Y717: L | Z717: D | AA717: FOR | AB717: AGST | AC717: % | AD717: PTS
A718: BRUNSWICK | C718: O'CONNOR | F718: JOSEPH | I718: VALENTINE | L718: NOLAN | O718: FORD | R718: SKIDMORE
A719: BOX HILL | C719: GROSSEK | F719: BRYANT | I719: WILSON | L719: BAKER | O719: McMASTER | R719: McFARLANE | W719: CAMBERWELL | X719: 13 | Y719: 2 | Z719: 1 | AA719: 1955 | AB719: 1404 | AC719: =(AA719*100)/AB719 -> 139.24501424501423 | AD719: =(X719*4)+(Z719*2) -> 54
A720: GOALKICKERS | W720: BRUNSWICK | X720: 13 | Y720: 3 | Z720: 0 | AA720: 1966 | AB720: 1429 | AC720: =(AA720*100)/AB720 -> 137.57872638208536 | AD720: =(X720*4)+(Z720*2) -> 52
A721: BRUNSWICK | C721: JOSEPH 5 | F721: FORD 4 | H721: MARANTELLI 3 | K721: O'CONNOR 2 | N721: WARDEN 2 | Q721: NUNN | W721: FRANKSTON | X721: 11 | Y721: 5 | Z721: 0 | AA721: 1892 | AB721: 1565 | AC721: =(AA721*100)/AB721 -> 120.89456869009585 | AD721: =(X721*4)+(Z721*2) -> 44
A722: BOX HILL | C722: McFARLANE 4 | F722: BRYANT 3 | I722: LASKIE 2 | K722: HOOGSTRA | N722: WILSON | P722: ONLEY | R722: McMAHON | W722: SUNSHINE | X722: 11 | Y722: 5 | Z722: 0 | AA722: 1854 | AB722: 1567 | AC722: =(AA722*100)/AB722 -> 118.3152520740268 | AD722: =(X722*4)+(Z722*2) -> 44
A724: SUNSHINE | C724: 1 | D724: 2 | E724: =C724*6+D724 -> 8 | G724: 6 | H724: 9 | I724: =G724*6+H724 -> 45 | K724: 10 | L724: 11 | M724: =K724*6+L724 -> 71 | O724: 14 | P724: 15 | Q724: =O724*6+P724 -> 99 | S724: WAVERLEY | W724: NORTHCOTE | X724: 10 | Y724: 6 | Z724: 0 | AA724: 1761 | AB724: 1791 | AC724: =(AA724*100)/AB724 -> 98.324958123953095 | AD724: =(X724*4)+(Z724*2) -> 40
A725: WAVERLEY | C725: 4 | D725: 11 | E725: =C725*6+D725 -> 35 | G725: 8 | H725: 13 | I725: =G725*6+H725 -> 61 | K725: 9 | L725: 19 | M725: =K725*6+L725 -> 73 | O725: 13 | P725: 20 | Q725: =O725*6+P725 -> 98 | S725: O'BRIEN | W725: MORDIALLOC | X725: 8 | Y725: 7 | Z725: 1 | AA725: 1634 | AB725: 1526 | AC725: =(AA725*100)/AB725 -> 107.07732634338139 | AD725: =(X725*4)+(Z725*2) -> 34
A726: BEST PLAYERS | W726: YARRAVILLE | X726: 7 | Y726: 9 | Z726: 0 | AA726: 1863 | AB726: 1852 | AC726: =(AA726*100)/AB726 -> 100.5939524838013 | AD726: =(X726*4)+(Z726*2) -> 28
A727: SUNSHINE | C727: MARTIN | F727: CLARKE | I727: MITCHELL | L727: GOOLD | O727: RADZIMINSKI | R727: LLOYD | W727: WAVERLEY | X727: 5 | Y727: 11 | Z727: 0 | AA727: 1813 | AB727: 1948 | AC727: =(AA727*100)/AB727 -> 93.069815195071868 | AD727: =(X727*4)+(Z727*2) -> 20
A728: WAVERLEY | C728: HOLDSWORTH | F728: FERGUSON | I728: BOWTELL | L728: COSTELLO | O728: COOK | R728: McDONALD | W728: BOX HILL | X728: 1 | Y728: 15 | Z728: 0 | AA728: 1385 | AB728: 2018 | AC728: =(AA728*100)/AB728 -> 68.632309217046583 | AD728: =(X728*4)+(Z728*2) -> 4
A729: GOALKICKERS | W729: WERRIBEE | X729: 0 | Y729: 16 | Z729: 0 | AA729: 1270 | AB729: 2204 | AC729: =(AA729*100)/AB729 -> 57.622504537205081 | AD729: =(X729*4)+(Z729*2) -> 0
A730: SUNSHINE | C730: LLOYD 4 | F730: RADZIMINSKI 4 | I730: MADDOX 3 | L730: BAIRD | N730: SIMPSON | P730: GOOLD
A731: WAVERLEY | C731: COSTELLO 4 | F731: ZIESLER 4 | H731: HATELEY | J731: O'DONNELL | M731: HOLDSWORTH | P731: BOWTELL | R731: SYKES
A733: FRANKSTON | C733: 7 | D733: 8 | E733: =C733*6+D733 -> 50 | G733: 16 | H733: 17 | I733: =G733*6+H733 -> 113 | K733: 20 | L733: 21 | M733: =K733*6+L733 -> 141 | O733: 29 | P733: 29 | Q733: =O733*6+P733 -> 203 | S733: FRANKSTON
A734: WERRIBEE | C734: 3 | D734: 2 | E734: =C734*6+D734 -> 20 | G734: 4 | H734: 5 | I734: =G734*6+H734 -> 29 | K734: 7 | L734: 9 | M734: =K734*6+L734 -> 51 | O734: 8 | P734: 10 | Q734: =O734*6+P734 -> 58 | S734: McGIBBON
A735: BEST PLAYERS
A736: FRANKSTON | C736: ELLIS | F736: ROSENBROCK | I736: KENDALL | L736: EDWARDS | O736: THATCHER | R736: DOHERTY
A737: WERRIBEE | C737: MORRIS | F737: HARVEY | I737: EVANS | L737: KNIGHT | O737: COCKS
A738: GOALKICKERS
A739: FRANKSTON | C739: ROSENBROCK 7 | F739: EDWARDS 5 | I739: THATCHER 4 | K739: FALKINER 3 | N739: ELLIS 2 | P739: DOHERTY 2 | S739: HUNTER 2 | U739: LOCCO | W739: RIDSDALE | X739: STAPLETON | Z739: KENDALL
A740: WERRIBEE | C740: TUDOR 3 | F740: BELLIN 2 | I740: MORRIS 2 | L740: HARVEY
A742: NORTHCOTE | C742: 0 | D742: 1 | E742: =C742*6+D742 -> 1 | G742: 7 | H742: 5 | I742: =G742*6+H742 -> 47 | K742: 10 | L742: 9 | M742: =K742*6+L742 -> 69 | O742: 22 | P742: 15 | Q742: =O742*6+P742 -> 147 | S742: YARRAVILLE
A743: YARRAVILLE | C743: 7 | D743: 9 | E743: =C743*6+D743 -> 51 | G743: 10 | H743: 10 | I743: =G743*6+H743 -> 70 | K743: 15 | L743: 12 | M743: =K743*6+L743 -> 102 | O743: 17 | P743: 13 | Q743: =O743*6+P743 -> 115 | S743: WENN
A744: BEST PLAYERS
A745: NORTHCOTE | C745: ROBERTSON | F745: BRAIN | I745: AFFLECK | L745: CHAPMAN | O745: McARDLE | R745: RYAN
A746: YARRAVILLE | C746: SHARP | F746: McLAREN | I746: SMITH | L746: RYAN | O746: JOSLIN | R746: McNAMARA
A747: GOALKICKERS
A748: NORTHCOTE | C748: CHAPMAN 8 | F748: McARDLE 6 | I748: RYAN 3 | K748: DOBSON 3 | N748: JAMES | P748: McINTYRE
A749: YARRAVILLE | C749: WILKINSON 3 | F749: SQUIRE 3 | H749: McNAMARA 3 | K749: SHARP | M749: McLAREN | O749: LEWIS | Q749: HARRISON | S749: MARTIN | U749: RYAN | W749: TAURINS | X749: JOSLIN
A751: CAMBERWELL | C751: 9 | D751: 5 | E751: =C751*6+D751 -> 59 | G751: 13 | H751: 11 | I751: =G751*6+H751 -> 89 | K751: 20 | L751: 13 | M751: =K751*6+L751 -> 133 | O751: 22 | P751: 16 | Q751: =O751*6+P751 -> 148 | S751: CAMBERWELL
A752: MORDIALLOC | C752: 3 | D752: 1 | E752: =C752*6+D752 -> 19 | G752: 7 | H752: 6 | I752: =G752*6+H752 -> 48 | K752: 17 | L752: 9 | M752: =K752*6+L752 -> 111 | O752: 22 | P752: 16 | Q752: =O752*6+P752 -> 148 | S752: OGSTON
A753: BEST PLAYERS
A754: CAMBERWELL | C754: STONE | F754: SIMPSON | I754: MORRIS | L754: HAMMOND | O754: SPITHILL | R754: SMITH
A755: MORDIALLOC | C755: WILLIAMSON | F755: McCARTHY | I755: SLADE | L755: THOMPSON | O755: HARRY | R755: ROSENOW
A756: GOALKICKERS
A757: CAMBERWELL | C757: HAMMOND 6 | F757: MOORE 4 | H757: STONE 4 | J757: SMITH 4 | L757: SIMPSON 2 | O757: PHILLIPS | Q757: MORRIS
A758: MORDIALLOC | C758: WILLIAMSON 6 | F758: GUY 3 | H758: DEATON 3 | J758: HARRY 3 | L758: McDONNELL 2 | O758: McCARTHY 2 | R758: SCAIFFE | T758: MOORE | V758: SLADE
A760: ROUND 17 | E760: 3RD AUGUST | J760: WEATHER | S760: PLAYED AT
D761: 1ST QTR | H761: 2ND QTR | L761: 3RD QTR | P761: FINAL | S761: NORTHCOTE
A762: NORTHCOTE | C762: 12 | D762: 5 | E762: =C762*6+D762 -> 77 | G762: 19 | H762: 9 | I762: =G762*6+H762 -> 123 | K762: 22 | L762: 15 | M762: =K762*6+L762 -> 147 | O762: 23 | P762: 19 | Q762: =O762*6+P762 -> 157 | S762: UMPIRE | X762: LADDER | AB762: ROUND | AD762: 17
A763: WAVERLEY | C763: 2 | D763: 4 | E763: =C763*6+D763 -> 16 | G763: 5 | H763: 8 | I763: =G763*6+H763 -> 38 | K763: 8 | L763: 12 | M763: =K763*6+L763 -> 60 | O763: 14 | P763: 16 | Q763: =O763*6+P763 -> 100 | S763: DAVIS
A764: BEST PLAYERS | W764: TEAM | X764: W | Y764: L | Z764: D | AA764: FOR | AB764: AGST | AC764: % | AD764: PTS
A765: NORTHCOTE | C765: NANKERVIS | F765: DOBSON | I765: ROBERTS | L765: ROBERTSON | O765: RYAN | R765: McARDLE
A766: WAVERLEY | C766: HOLDSWORTH | F766: COSTELLO | I766: BOWTELL | L766: COOK | O766: SYKES | R766: CROUCH | W766: BRUNSWICK | X766: 14 | Y766: 3 | Z766: 0 | AA766: 2074 | AB766: 1510 | AC766: =(AA766*100)/AB766 -> 137.35099337748343 | AD766: =(X766*4)+(Z766*2) -> 56
A767: GOALKICKERS | M767: JENKINS | P767: NANKERVIS | W767: CAMBERWELL | X767: 13 | Y767: 3 | Z767: 1 | AA767: 2036 | AB767: 1512 | AC767: =(AA767*100)/AB767 -> 134.65608465608466 | AD767: =(X767*4)+(Z767*2) -> 54
A768: NORTHCOTE | C768: CHAPMAN 8 | F768: McARDLE 3 | H768: KREYMBORG 3 | K768: DOBSON 3 | N768: RYAN 2 | P768: ROBERTSON | S768: AFFLECK | W768: FRANKSTON | X768: 12 | Y768: 5 | Z768: 0 | AA768: 1978 | AB768: 1621 | AC768: =(AA768*100)/AB768 -> 122.02344231955583 | AD768: =(X768*4)+(Z768*2) -> 48
A769: WAVERLEY | C769: COSTELLO 6 | F769: ZIESLER 4 | I769: LEES | K769: BOWTELL | M769: CROUCH | O769: McKAY | W769: SUNSHINE | X769: 12 | Y769: 5 | Z769: 0 | AA769: 1979 | AB769: 1653 | AC769: =(AA769*100)/AB769 -> 119.72171808832425 | AD769: =(X769*4)+(Z769*2) -> 48
A771: SUNSHINE | C771: 3 | D771: 6 | E771: =C771*6+D771 -> 24 | G771: 8 | H771: 13 | I771: =G771*6+H771 -> 61 | K771: 14 | L771: 20 | M771: =K771*6+L771 -> 104 | O771: 17 | P771: 23 | Q771: =O771*6+P771 -> 125 | S771: YARRAVILLE | W771: NORTHCOTE | X771: 11 | Y771: 6 | Z771: 0 | AA771: 1918 | AB771: 1891 | AC771: =(AA771*100)/AB771 -> 101.42781597038604 | AD771: =(X771*4)+(Z771*2) -> 44
A772: YARRAVILLE | C772: 1 | D772: 4 | E772: =C772*6+D772 -> 10 | G772: 3 | H772: 8 | I772: =G772*6+H772 -> 26 | K772: 6 | L772: 9 | M772: =K772*6+L772 -> 45 | O772: 12 | P772: 14 | Q772: =O772*6+P772 -> 86 | S772: McGIBBON | W772: MORDIALLOC | X772: 8 | Y772: 8 | Z772: 1 | AA772: 1690 | AB772: 1612 | AC772: =(AA772*100)/AB772 -> 104.83870967741936 | AD772: =(X772*4)+(Z772*2) -> 34
A773: BEST PLAYERS | W773: YARRAVILLE | X773: 7 | Y773: 10 | Z773: 0 | AA773: 1949 | AB773: 1977 | AC773: =(AA773*100)/AB773 -> 98.583712696004042 | AD773: =(X773*4)+(Z773*2) -> 28
A774: SUNSHINE | C774: PONTON | F774: GOOLD | I774: JONES | L774: PIERCZAK | O774: MITCHELL | W774: WAVERLEY | X774: 5 | Y774: 12 | Z774: 0 | AA774: 1913 | AB774: 2105 | AC774: =(AA774*100)/AB774 -> 90.878859857482183 | AD774: =(X774*4)+(Z774*2) -> 20
A775: YARRAVILLE | C775: MARTIN | F775: SMITH | I775: McLAREN | L775: GIANETTI | O775: SQUIRE | R775: BARCLAY | W775: BOX HILL | X775: 1 | Y775: 16 | Z775: 0 | AA775: 1478 | AB775: 2133 | AC775: =(AA775*100)/AB775 -> 69.292076887013593 | AD775: =(X775*4)+(Z775*2) -> 4
A776: GOALKICKERS | W776: WERRIBEE | X776: 1 | Y776: 16 | Z776: 0 | AA776: 1385 | AB776: 2297 | AC776: =(AA776*100)/AB776 -> 60.296038310840224 | AD776: =(X776*4)+(Z776*2) -> 4
A777: SUNSHINE | C777: IZZARD 4 | E777: SLADDIN 3 | H777: BENSON 3 | J777: PONTON 2 | L777: RADZIMINSKI 2 | O777: LLOYD | Q777: JONES | S777: MADDOX
A778: YARRAVILLE | C778: LOWE 4 | F778: MARTIN 3 | I778: WAGHORNE 3 | L778: R WILKINSON | O778: RYAN
A780: BRUNSWICK | C780: 2 | D780: 7 | E780: =C780*6+D780 -> 19 | G780: 6 | H780: 14 | I780: =G780*6+H780 -> 50 | K780: 10 | L780: 18 | M780: =K780*6+L780 -> 78 | O780: 14 | P780: 24 | Q780: =O780*6+P780 -> 108 | S780: CAMBERWELL
A781: CAMBERWELL | C781: 5 | D781: 1 | E781: =C781*6+D781 -> 31 | G781: 7 | H781: 6 | I781: =G781*6+H781 -> 48 | K781: 11 | L781: 6 | M781: =K781*6+L781 -> 72 | O781: 12 | P781: 9 | Q781: =O781*6+P781 -> 81 | S781: HUGGINS
A782: BEST PLAYERS
A783: BRUNSWICK | C783: A SMITH | F783: OFFICER | I783: O'CONNOR | L783: LAKER | O783: ORTON | R783: VALENTINE
A784: CAMBERWELL | C784: STONE | F784: SIMPSON | I784: SPITHILL | L784: HAMMOND | O784: B SMITH | R784: OLIVER
A785: GOALKICKERS
A786: BRUNSWICK | C786: ORTON 4 | F786: BAIRD 3 | H786: BRIGHAM 2 | K786: VALENTINE | N786: WARDEN | P786: NUNN | R786: MARANTELLI | U786: A SMITH
A787: CAMBERWELL | C787: HAMMOND 6 | F787: B SMITH 5 | I787: MOORE
A789: FRANKSTON | C789: 4 | D789: 5 | E789: =C789*6+D789 -> 29 | G789: 6 | H789: 9 | I789: =G789*6+H789 -> 45 | K789: 8 | L789: 14 | M789: =K789*6+L789 -> 62 | O789: 11 | P789: 20 | Q789: =O789*6+P789 -> 86 | S789: MORDIALLOC
A790: MORDIALLOC | C790: 4 | D790: 5 | E790: =C790*6+D790 -> 29 | G790: 7 | H790: 6 | I790: =G790*6+H790 -> 48 | K790: 7 | L790: 8 | M790: =K790*6+L790 -> 50 | O790: 8 | P790: 8 | Q790: =O790*6+P790 -> 56 | S790: WENN
A791: BEST PLAYERS
A792: FRANKSTON | C792: ELLIS | F792: DAVIES | I792: KENDALL | L792: DOHERTY | O792: FALKINER | R792: HUNTER
A793: MORDIALLOC | C793: LANG | F793: THOMPSON | I793: EDDY | L793: GRANT | O793: SCAIFFE | R793: WILKINSON
A794: GOALKICKERS
A795: FRANKSTON | C795: EDWARDS 3 | F795: KENDALL 2 | I795: ROSENBROCK 2 | L795: ELLIS | N795: FALKINER | P795: RIDSDALE | R795: HUNTER
A796: MORDIALLOC | C796: SCAIFFE 2 | F796: McDONNELL 2 | I796: WILLIAMSON 2 | L796: GRANT | N796: HARRY
A798: WERRIBEE | C798: 2 | D798: 4 | E798: =C798*6+D798 -> 16 | G798: 11 | H798: 9 | I798: =G798*6+H798 -> 75 | K798: 12 | L798: 9 | M798: =K798*6+L798 -> 81 | O798: 17 | P798: 13 | Q798: =O798*6+P798 -> 115 | S798: WERRIBEE
A799: BOX HILL | C799: 2 | D799: 5 | E799: =C799*6+D799 -> 17 | G799: 5 | H799: 8 | I799: =G799*6+H799 -> 38 | K799: 10 | L799: 13 | M799: =K799*6+L799 -> 73 | O799: 13 | P799: 15 | Q799: =O799*6+P799 -> 93 | S799: OGSTON
A800: BEST PLAYERS
A801: WERRIBEE | C801: BOURKE | F801: BELLIN | I801: MITCHELL | L801: MORRIS | O801: COCKS | Q801: HAMBLIN
A802: BOX HILL | C802: ZANTUCK | F802: HICKS | I802: GROSSEK | L802: BAKER | O802: WILSON
A803: GOALKICKERS | C803: 1 SHORT
A804: WERRIBEE | C804: NORTON 3 | F804: DOUGLAS 3 | H804: MORRIS 2 | J804: HAMBLIN | L804: EVANS | N804: KNIGHT | P804: BOURKE | R804: BELLIN | T804: J PYNE | V804: C PYNE | X804: MITCHELL
A805: BOX HILL | C805: WALTER 3 | F805: ZANTUCK 2 | I805: McFARLANE 2 | L805: McMAHON 2 | O805: LASKIE 2 | Q805: WILSON | S805: McMASTER
A807: ROUND 18 | E807: 10TH AUGUST | J807: WEATHER | S807: PLAYED AT
D808: 1ST QTR | H808: 2ND QTR | L808: 3RD QTR | P808: FINAL | S808: BRUNSWICK
A809: BRUNSWICK | C809: 0 | D809: 0 | E809: =C809*6+D809 -> 0 | G809: 0 | H809: 0 | I809: =G809*6+H809 -> 0 | K809: 0 | L809: 0 | M809: =K809*6+L809 -> 0 | O809: 28 | P809: 21 | Q809: =O809*6+P809 -> 189 | S809: UMPIRE | X809: LADDER | AB809: ROUND | AD809: 18
A810: YARRAVILLE | C810: 0 | D810: 0 | E810: =C810*6+D810 -> 0 | G810: 0 | H810: 0 | I810: =G810*6+H810 -> 0 | K810: 0 | L810: 0 | M810: =K810*6+L810 -> 0 | O810: 8 | P810: 10 | Q810: =O810*6+P810 -> 58 | S810: MARCY
A811: BEST PLAYERS | W811: TEAM | X811: W | Y811: L | Z811: D | AA811: FOR | AB811: AGST | AC811: % | AD811: PTS
A812: BRUNSWICK
A813: YARRAVILLE | W813: BRUNSWICK | X813: 15 | Y813: 3 | Z813: 0 | AA813: 2263 | AB813: 1568 | AC813: =(AA813*100)/AB813 -> 144.32397959183675 | AD813: =(X813*4)+(Z813*2) -> 60
A814: GOALKICKERS | O814: BRIGHAM | W814: CAMBERWELL | X814: 13 | Y814: 4 | Z814: 1 | AA814: 2134 | AB814: 1622 | AC814: =(AA814*100)/AB814 -> 131.56596794081381 | AD814: =(X814*4)+(Z814*2) -> 54
A815: BRUNSWICK | C815: BAIRD 10 | F815: ORTON 9 | H815: WARDEN 2 | J815: VALENTINE 2 | M815: SKIDMORE | O815: LEWIS | Q815: NUNN | S815: WOODHAM | W815: SUNSHINE | X815: 13 | Y815: 5 | Z815: 0 | AA815: 2136 | AB815: 1715 | AC815: =(AA815*100)/AB815 -> 124.54810495626822 | AD815: =(X815*4)+(Z815*2) -> 52
A816: YARRAVILLE | C816: McNAMARA 3 | F816: A WALLIS 2 | I816: McLAREN | L816: JOSLIN | N816: LEONARD | W816: FRANKSTON | X816: 13 | Y816: 5 | Z816: 0 | AA816: 2088 | AB816: 1719 | AC816: =(AA816*100)/AB816 -> 121.46596858638743 | AD816: =(X816*4)+(Z816*2) -> 52
A818: NORTHCOTE | C818: 0 | D818: 0 | E818: =C818*6+D818 -> 0 | G818: 0 | H818: 0 | I818: =G818*6+H818 -> 0 | K818: 0 | L818: 0 | M818: =K818*6+L818 -> 0 | O818: 16 | P818: 13 | Q818: =O818*6+P818 -> 109 | S818: BOX HILL | W818: NORTHCOTE | X818: 12 | Y818: 6 | Z818: 0 | AA818: 2027 | AB818: 1991 | AC818: =(AA818*100)/AB818 -> 101.80813661476645 | AD818: =(X818*4)+(Z818*2) -> 48
A819: BOX HILL | C819: 0 | D819: 0 | E819: =C819*6+D819 -> 0 | G819: 0 | H819: 0 | I819: =G819*6+H819 -> 0 | K819: 0 | L819: 0 | M819: =K819*6+L819 -> 0 | O819: 14 | P819: 16 | Q819: =O819*6+P819 -> 100 | S819: ABBOTT | W819: MORDIALLOC | X819: 8 | Y819: 9 | Z819: 1 | AA819: 1752 | AB819: 1769 | AC819: =(AA819*100)/AB819 -> 99.039005087620126 | AD819: =(X819*4)+(Z819*2) -> 34
A820: BEST PLAYERS | W820: YARRAVILLE | X820: 7 | Y820: 11 | Z820: 0 | AA820: 2007 | AB820: 2166 | AC820: =(AA820*100)/AB820 -> 92.659279778393355 | AD820: =(X820*4)+(Z820*2) -> 28
A821: NORTHCOTE | W821: WAVERLEY | X821: 6 | Y821: 12 | Z821: 0 | AA821: 2073 | AB821: 2180 | AC821: =(AA821*100)/AB821 -> 95.091743119266056 | AD821: =(X821*4)+(Z821*2) -> 24
A822: BOX HILL | W822: BOX HILL | X822: 1 | Y822: 17 | Z822: 0 | AA822: 1578 | AB822: 2242 | AC822: =(AA822*100)/AB822 -> 70.3835860838537 | AD822: =(X822*4)+(Z822*2) -> 4
A823: GOALKICKERS | M823: RYAN | W823: WERRIBEE | X823: 1 | Y823: 17 | Z823: 0 | AA823: 1460 | AB823: 2457 | AC823: =(AA823*100)/AB823 -> 59.422059422059419 | AD823: =(X823*4)+(Z823*2) -> 4
A824: NORTHCOTE | C824: CHAPMAN 5 | F824: JENKINS 4 | H824: DOBSON | J824: BUTTERWORTH | M824: BIENKE | O824: BREWER | Q824: McARDLE | S824: ROBERTSON
A825: BOX HILL | C825: McMASTER 5 | F825: LASKIE 2 | I825: BRYANT 2 | K825: COUTTS | M825: ZANTUCK | O825: WALTER | Q825: WRIGHT | S825: VAIL
A827: WAVERLEY | C827: 0 | D827: 0 | E827: =C827*6+D827 -> 0 | G827: 0 | H827: 0 | I827: =G827*6+H827 -> 0 | K827: 0 | L827: 0 | M827: =K827*6+L827 -> 0 | O827: 23 | P827: 22 | Q827: =O827*6+P827 -> 160 | S827: WAVERLEY
A828: WERRIBEE | C828: 0 | D828: 0 | E828: =C828*6+D828 -> 0 | G828: 0 | H828: 0 | I828: =G828*6+H828 -> 0 | K828: 0 | L828: 0 | M828: =K828*6+L828 -> 0 | O828: 10 | P828: 15 | Q828: =O828*6+P828 -> 75 | S828: OAKLEY
A829: BEST PLAYERS
A830: WAVERLEY
A831: WERRIBEE
A832: GOALKICKERS
A833: WAVERLEY | C833: COSTELLO 7 | F833: ZIESLER 5 | H833: O'DONNELL 2 | K833: CROUCH 2 | N833: HORKINGS 2 | Q833: McKAY | S833: COOK | U833: BOWTELL | W833: HANCOCK | X833: CRUSE
A834: WERRIBEE | C834: NORTON 3 | F834: MITCHELL 2 | I834: HAMBLIN | K834: MORRIS | M834: DOUGLAS | O834: DEVON | Q834: BOUTE
A836: FRANKSTON | C836: 0 | D836: 0 | E836: =C836*6+D836 -> 0 | G836: 0 | H836: 0 | I836: =G836*6+H836 -> 0 | K836: 0 | L836: 0 | M836: =K836*6+L836 -> 0 | O836: 15 | P836: 20 | Q836: =O836*6+P836 -> 110 | S836: FRANKSTON
A837: CAMBERWELL | C837: 0 | D837: 0 | E837: =C837*6+D837 -> 0 | G837: 0 | H837: 0 | I837: =G837*6+H837 -> 0 | K837: 0 | L837: 0 | M837: =K837*6+L837 -> 0 | O837: 15 | P837: 8 | Q837: =O837*6+P837 -> 98
A838: BEST PLAYERS
A839: FRANKSTON
A840: CAMBERWELL
A841: GOALKICKERS
A842: FRANKSTON
A843: CAMBERWELL | C843: HAMMOND 4 | F843: SMITH 3 | H843: BOWDEN 3 | J843: SIMPSON 2 | M843: MOORE | O843: BOLGER | Q843: STOREY
A845: SUNSHINE | C845: 0 | D845: 0 | E845: =C845*6+D845 -> 0 | G845: 0 | H845: 0 | I845: =G845*6+H845 -> 0 | K845: 0 | L845: 0 | M845: =K845*6+L845 -> 0 | O845: 24 | P845: 13 | Q845: =O845*6+P845 -> 157 | S845: SUNSHINE
A846: MORDIALLOC | C846: 0 | D846: 0 | E846: =C846*6+D846 -> 0 | G846: 0 | H846: 0 | I846: =G846*6+H846 -> 0 | K846: 0 | L846: 0 | M846: =K846*6+L846 -> 0 | O846: 8 | P846: 14 | Q846: =O846*6+P846 -> 62 | S846: TORNEY
A847: BEST PLAYERS
A848: SUNSHINE
A849: MORDIALLOC
A850: GOALKICKERS
A851: SUNSHINE | C851: SLADDIN 5 | E851: IZZARD 4 | G851: LLOYD 4 | I851: VELLA 2 | K851: FOREMAN 2 | N851: BENSON 2 | P851: JONES 2 | R851: RADZIMINSKI | U851: MADDOX | W851: HUTCHISON
A852: MORDIALLOC | C852: GUY 3 | E852: DEATON 2 | H852: WILLIAMSON | K852: GRANT | M852: SIGNORTTI
A854: FINALS
A855: 1ST SEMI | E855: 17TH AUGUST | J855: WEATHER | S855: PLAYED AT
D856: 1ST QTR | H856: 2ND QTR | L856: 3RD QTR | P856: FINAL | S856: TOORAK PARK
A857: SUNSHINE | C857: 0 | D857: 0 | E857: =C857*6+D857 -> 0 | G857: 0 | H857: 0 | I857: =G857*6+H857 -> 0 | K857: 0 | L857: 0 | M857: =K857*6+L857 -> 0 | O857: 17 | P857: 15 | Q857: =O857*6+P857 -> 117 | S857: UMPIRE
A858: FRANKSTON | C858: 0 | D858: 0 | E858: =C858*6+D858 -> 0 | G858: 0 | H858: 0 | I858: =G858*6+H858 -> 0 | K858: 0 | L858: 0 | M858: =K858*6+L858 -> 0 | O858: 13 | P858: 15 | Q858: =O858*6+P858 -> 93 | S858: OGSTON
A859: BEST PLAYERS
A860: SUNSHINE | C860: MADDOX | F860: MITCHELL | I860: PIERCZAK | L860: CLARKE | O860: GOOLD | R860: SLADDIN
A861: FRANKSTON | C861: FALKINER | F861: KENDALL | I861: DAVIES | L861: LLOYD | O861: A DOHERTY | R861: ELLIS
A862: GOALKICKERS
A863: SUNSHINE | C863: SLADDIN 5 | F863: LLOYD 3 | H863: RADZIMINSKI 2 | K863: BENSON 2 | N863: IZZARD 2 | P863: FOREMAN | R863: MARTIN | T863: PAXTON
A864: FRANKSTON | C864: EDWARDS 3 | F864: C DOHERTY 2 | I864: A DOHERTY 2 | L864: FALKINER 2 | O864: WARD | Q864: LOCCO | S864: LOVELOCK | V864: HUNTER
A866: 2ND SEMI | E866: 24TH AUGUST | J866: WEATHER
A867: BRUNSWICK | C867: 6 | D867: 7 | E867: =C867*6+D867 -> 43 | G867: 12 | H867: 14 | I867: =G867*6+H867 -> 86 | K867: 16 | L867: 22 | M867: =K867*6+L867 -> 118 | O867: 24 | P867: 31 | Q867: =O867*6+P867 -> 175 | S867: TOORAK PARK
A868: CAMBERWELL | C868: 4 | D868: 8 | E868: =C868*6+D868 -> 32 | G868: 11 | H868: 9 | I868: =G868*6+H868 -> 75 | K868: 14 | L868: 13 | M868: =K868*6+L868 -> 97 | O868: 14 | P868: 14 | Q868: =O868*6+P868 -> 98 | S868: ABBOTT
A869: BEST PLAYERS
A870: BRUNSWICK | C870: ORTON | F870: SKIDMORE | I870: NUNN | L870: NOLAN | O870: SMITH | R870: LAKER
A871: CAMBERWELL | C871: SRONE | F871: KENNEDY | I871: SPITHILL | L871: HOOK | O871: STOREY | R871: OLIVER
A872: GOALKICKERS
A873: BRUNSWICK | C873: ORTON 8 | F873: BAIRD 6 | H873: WARDEN 3 | J873: NUNN 2 | L873: JOSEPH 2 | N873: BRIGHAM 2 | Q873: O'CONNOR
A874: CAMBERWELL | C874: KENNEDY 5 | F874: SMITH 4 | H874: STOREY 2 | J874: SIMPSON | L874: HAMMOND | N874: HOOK
A876: PRELIMINARY | E876: 31ST AUGUST | J876: WEATHER
A877: CAMBERWELL | C877: 3 | D877: 2 | E877: =C877*6+D877 -> 20 | G877: 8 | H877: 5 | I877: =G877*6+H877 -> 53 | K877: 13 | L877: 9 | M877: =K877*6+L877 -> 87 | O877: 15 | P877: 12 | Q877: =O877*6+P877 -> 102 | S877: TOORAK PARK
A878: SUNSHINE | C878: 2 | D878: 1 | E878: =C878*6+D878 -> 13 | G878: 5 | H878: 3 | I878: =G878*6+H878 -> 33 | K878: 9 | L878: 5 | M878: =K878*6+L878 -> 59 | O878: 15 | P878: 9 | Q878: =O878*6+P878 -> 99 | S878: WENN
A879: BEST PLAYERS
A880: CAMBERWELL | C880: STONE | F880: BOWDEN | I880: SAUERBERG | L880: SPITHILL | O880: WILSON | R880: HOOK
A881: SUNSHINE | C881: MADDOX | F881: GOOLD | I881: LLOYD | L881: MITCHELL | O881: MARTIN | R881: JONES
A882: GOALKICKERS
A883: CAMBERWELL | C883: HAMMOND 4 | F883: SMITH 3 | H883: STONE 3 | J883: KENNEDY 3 | M883: ANDREWS | O883: OLIVER
A884: SUNSHINE | C884: RADZIMINSKI 4 | F884: SLADDIN 3 | I884: LLOYD 2 | K884: MADDOX 2 | N884: SIMPSON | P884: BENSON | R884: GOOLD | T884: IZZARD
A886: GRAND | E886: 7TH SEPTEMBER | J886: WEATHER
A887: BRUNSWICK | C887: 6 | D887: 8 | E887: =C887*6+D887 -> 44 | G887: 9 | H887: 14 | I887: =G887*6+H887 -> 68 | K887: 14 | L887: 21 | M887: =K887*6+L887 -> 105 | O887: 18 | P887: 22 | Q887: =O887*6+P887 -> 130 | S887: TOORAK PARK
A888: CAMBERWELL | C888: 1 | D888: 3 | E888: =C888*6+D888 -> 9 | G888: 5 | H888: 4 | I888: =G888*6+H888 -> 34 | K888: 9 | L888: 7 | M888: =K888*6+L888 -> 61 | O888: 12 | P888: 11 | Q888: =O888*6+P888 -> 83 | S888: WENN
A889: BEST PLAYERS
A890: BRUNSWICK | C890: WARDEN | F890: O'CONNOR | I890: SKIDMORE | L890: A SMITH | O890: VALENTINE | R890: WOODHAM
A891: CAMBERWELL | C891: STONE | F891: OLIVER | I891: PARSONS | L891: WILSON | O891: BOWDEN | R891: HOOK
A892: GOALKICKERS
A893: BRUNSWICK | C893: BAIRD 3 | E893: VALENTINE 2 | H893: WARDEN 2 | K893: BRIGHAM 2 | N893: O'CONNOR 2 | Q893: ORTON | S893: ROWE | U893: LAKER | W893: WOODHAM | X893: NUNN
A894: CAMBERWELL | C894: HAMMOND 4 | F894: STONE 3 | H894: KENNEDY 2 | K894: SIMPSON | M894: ANDREWS | O894: SAUERBERG