A1: Victorian Football Association
A2: Season 1975 - Division One
A3: © Copyright Wal Williams | F3: First created: 28 July 2015
A4: Contact: joywalwi at gmail dot com | F4: Last updated: 28 July 2015 | W4: VFA Results and tables - Link to the main index page
A5: You are free to copy this document in whole or part provided that proper acknowledgement is given to the author. All rights reserved.
A7: 1975 V.F.A. | B7: SEASON 1ST | F7: DIVISION | CA7: \D | CB7: {GOTO}BJ3~/M{RIGHT 7}{END}{DOWN}~G4~
A8: ROUND 1 | E8: 20TH APRIL | J8: WEATHER | S8: PLAYED AT | CB8: {GOTO}AL3~/M{END}{RIGHT}{END}{DOWN}~P3~
D9: 1ST QTR | H9: 2ND QTR | L9: 3RD QTR | P9: FINAL | S9: PORT MELBOURNE | CB9: {GOTO}BJ23~/M{RIGHT 7}{END}{DOWN}~V4~
A10: PORT MELBOURNE | C10: 3 | D10: 3 | E10: =C10*6+D10 -> 21 | G10: 8 | H10: 6 | I10: =G10*6+H10 -> 54 | K10: 17 | L10: 11 | M10: =K10*6+L10 -> 113 | O10: 22 | P10: 17 | Q10: =O10*6+P10 -> 149 | S10: UMPIRE | X10: LADDER | AB10: ROUND | AD10: 1 | CB10: {GOTO}BJ43~/M{RIGHT 7}{END}{DOWN}~G24~
A11: DANDENONG | C11: 3 | D11: 8 | E11: =C11*6+D11 -> 26 | G11: 3 | H11: 15 | I11: =G11*6+H11 -> 33 | K11: 7 | L11: 18 | M11: =K11*6+L11 -> 60 | O11: 13 | P11: 23 | Q11: =O11*6+P11 -> 101 | S11: HUGGINS | CB11: {GOTO}AL23~/M{END}{RIGHT}{END}{DOWN}~P23~
A12: BEST PLAYERS | W12: TEAM | X12: W | Y12: L | Z12: D | AA12: FOR | AB12: AGST | AC12: % | AD12: PTS | CB12: {GOTO}BJ63~/M{RIGHT 7}{END}{DOWN}~V24~
A13: PORT MELBOURNE | D13: HERROD | G13: GOSS | I13: OWEN | L13: HARLAND | N13: BROWN | Q13: G ANDERSON | CB13: {GOTO}BJ83~/M{RIGHT 7}{END}{DOWN}~G44~
A14: DANDENONG | D14: PAYZE | G14: REID | I14: WALKER | L14: BRIESE | N14: SHINNERS | Q14: ORCHARD | W14: GEELONG WEST | X14: 1 | Y14: 0 | Z14: 0 | AA14: 134 | AB14: 76 | AC14: 176.31578947368422 | AD14: 4 | CB14: {GOTO}AL43~/M{END}{RIGHT}{END}{DOWN}~P43~
A15: GOALKICKERS | P15: WHARTON | W15: PORT MELBOURNE | X15: 1 | Y15: 0 | Z15: 0 | AA15: 149 | AB15: 101 | AC15: 147.52475247524754 | AD15: 4 | CB15: {GOTO}BJ103~/M{RIGHT 7}{END}{DOWN}~V44~
A16: PORT MELBOURNE | D16: COOK 7 | F16: HARLAND 5 | I16: HOLT 3 | K16: G ANDERSON 2 | N16: GOSS | P16: BROWN | R16: ERWIN | T16: HAENAN | W16: COBURG | X16: 1 | Y16: 0 | Z16: 0 | AA16: 94 | AB16: 64 | AC16: 146.875 | AD16: 4 | CB16: {GOTO}BJ123~/M{RIGHT 7}{END}{DOWN}~G64~
A17: DANDENONG | D17: PAYZE 3 | F17: MILLER 3 | I17: DA ROSE 2 | K17: CASTRICUM 2 | N17: SHINNERS | Q17: ESLER | S17: BRIESE | W17: SANDRINGHAM | X17: 1 | Y17: 0 | Z17: 0 | AA17: 100 | AB17: 74 | AC17: 135.13513513513513 | AD17: 4 | CB17: {GOTO}AL63~/M{END}{RIGHT}{END}{DOWN}~P63~
CB18: {GOTO}BJ143~/M{RIGHT 7}{END}{DOWN}~V64~
A19: SANDRINGHAM | C19: 5 | D19: 8 | E19: =C19*6+D19 -> 38 | G19: 9 | H19: 13 | I19: =G19*6+H19 -> 67 | K19: 12 | L19: 15 | M19: =K19*6+L19 -> 87 | O19: 14 | P19: 16 | Q19: =O19*6+P19 -> 100 | S19: PRESTON | W19: PRAHRAN | X19: 1 | Y19: 0 | Z19: 0 | AA19: 121 | AB19: 93 | AC19: 130.10752688172042 | AD19: 4 | CB19: {GOTO}BJ163~/M{RIGHT 7}{END}{DOWN}~G84~
A20: PRESTON | C20: 1 | D20: 0 | E20: =C20*6+D20 -> 6 | G20: 4 | H20: 3 | I20: =G20*6+H20 -> 27 | K20: 6 | L20: 8 | M20: =K20*6+L20 -> 44 | O20: 10 | P20: 14 | Q20: =O20*6+P20 -> 74 | S20: O'BRIEN | W20: CAULFIELD | X20: 0 | Y20: 1 | Z20: 0 | AA20: 93 | AB20: 121 | AC20: 76.859504132231407 | AD20: 0 | CB20: {GOTO}AL83~/M{END}{RIGHT}{END}{DOWN}~P83~
A21: BEST PLAYERS | W21: PRESTON | X21: 0 | Y21: 1 | Z21: 0 | AA21: 74 | AB21: 100 | AC21: 74 | AD21: 0 | CB21: {GOTO}BJ183~/M{RIGHT 7}{END}{DOWN}~V84~
A22: SANDRINGHAM | D22: COOPER | G22: LACEY | J22: BARTLETT | M22: K MURRAY | P22: WARD | W22: WILLIAMSTOWN | X22: 0 | Y22: 1 | Z22: 0 | AA22: 64 | AB22: 94 | AC22: 68.085106382978722 | AD22: 0 | CB22: {GOTO}BJ203~/M{RIGHT 7}{END}{DOWN}~G104~
A23: PRESTON | D23: GRAINGER | G23: STEPHENS | J23: ZEMSKIE | M23: MARSHALL | P23: COBAIN | R23: WEIGHTMAN | W23: DANDENONG | X23: 0 | Y23: 1 | Z23: 0 | AA23: 101 | AB23: 149 | AC23: 67.785234899328856 | AD23: 0 | CB23: {GOTO}AL103~/M{END}{RIGHT}{END}{DOWN}~P103~
A24: GOALKICKERS | W24: OAKLEIGH | X24: 0 | Y24: 1 | Z24: 0 | AA24: 76 | AB24: 134 | AC24: 56.71641791044776 | AD24: 0 | CB24: {GOTO}BJ223~/M{RIGHT 7}{END}{DOWN}~V104~
A25: SANDRINGHAM | D25: COOPER 9 | G25: R MURRAY 3 | J25: LACEY | L25: WARD | CB25: {GOTO}BJ243~/M{RIGHT 7}{END}{DOWN}~G124~
A26: PRESTON | D26: MIDDLETON 3 | G26: ZUNNEBERG 2 | J26: ZEMSKI 2 | M26: WEIGHTMAN | P26: POTTER | R26: NEWTON | CB26: {GOTO}AL123~/M{END}{RIGHT}{END}{DOWN}~P123~
CB27: {GOTO}BJ263~/M{RIGHT 7}{END}{DOWN}~V124~
A28: PRAHRAN | C28: 3 | D28: 4 | E28: =C28*6+D28 -> 22 | G28: 8 | H28: 5 | I28: =G28*6+H28 -> 53 | K28: 13 | L28: 8 | M28: =K28*6+L28 -> 86 | O28: 18 | P28: 13 | Q28: =O28*6+P28 -> 121 | S28: TOORAK PARK | CB28: {GOTO}BJ283~/M{RIGHT 7}{END}{DOWN}~G144~
A29: CAULFIELD | C29: 2 | D29: 2 | E29: =C29*6+D29 -> 14 | G29: 7 | H29: 4 | I29: =G29*6+H29 -> 46 | K29: 12 | L29: 6 | M29: =K29*6+L29 -> 78 | O29: 14 | P29: 9 | Q29: =O29*6+P29 -> 93 | S29: HAYES | CB29: {GOTO}AL143~/M{END}{RIGHT}{END}{DOWN}~P143~
A30: BEST PLAYERS | CB30: {GOTO}BJ303~/M{RIGHT 7}{END}{DOWN}~V144~
A31: PRAHRAN | D31: PAYNE | G31: GUNN | J31: CULPIN | M31: ANDERSON | P31: KENT | S31: McFAULL | CB31: {GOTO}BJ323~/M{RIGHT 7}{END}{DOWN}~G164~
A32: CAULFIELD | D32: TEMPEST | G32: CLIFF | J32: HOCKING | M32: MAGUIRE | P32: LOGAN | S32: S FRIGO | CB32: {GOTO}AL163~/M{END}{RIGHT}{END}{DOWN}~P163~
A33: GOALKICKERS | CB33: {GOTO}BJ343~/M{RIGHT 7}{END}{DOWN}~V164~
A34: PRAHRAN | D34: ANASTASIO 5 | G34: McFAULL 3 | J34: KENT 3 | L34: G SMITH 2 | N34: PAYNE 2 | Q34: ANDERSON | T34: WILLIAMS | W34: EMSELLE | CB34: {HOME}
A35: CAULFIELD | D35: CLIFF 5 | G35: HOCKING 3 | J35: MAGUIRE 2 | M35: SAUNDERS | O35: NEWTON | Q35: EASTWOOD | T35: BALL
A37: COBURG | C37: 3 | D37: 4 | E37: =C37*6+D37 -> 22 | G37: 4 | H37: 6 | I37: =G37*6+H37 -> 30 | K37: 11 | L37: 9 | M37: =K37*6+L37 -> 75 | O37: 14 | P37: 10 | Q37: =O37*6+P37 -> 94 | S37: WILLIAMSTOWN
A38: WILLIAMSTOWN | C38: 2 | D38: 2 | E38: =C38*6+D38 -> 14 | G38: 4 | H38: 6 | I38: =G38*6+H38 -> 30 | K38: 7 | L38: 10 | M38: =K38*6+L38 -> 52 | O38: 8 | P38: 16 | Q38: =O38*6+P38 -> 64 | S38: DAVIS
A39: BEST PLAYERS
A40: COBURG | D40: LUKE | G40: PITT | J40: MANNIX | M40: KOELMAN | P40: HOBBS | S40: BRENNAN
A41: WILLIAMSTOWN | D41: KERR | G41: L STILLMAN | J41: FOX
A42: GOALKICKERS
A43: COBURG | D43: LUKE 5 | G43: SMITH 4 | J43: LAKE 3 | L43: HOBBS | N43: MORRISON
A44: WILLIAMSTOWN | D44: L STILLMAN 3 | G44: TOWNSEND 2 | J44: FOX 2 | M44: BOXALL
A46: GEELONG WEST | C46: 6 | D46: 3 | E46: =C46*6+D46 -> 39 | G46: 12 | H46: 11 | I46: =G46*6+H46 -> 83 | K46: 16 | L46: 15 | M46: =K46*6+L46 -> 111 | O46: 19 | P46: 20 | Q46: =O46*6+P46 -> 134 | S46: GEELONG WEST
A47: OAKLEIGH | C47: 1 | D47: 3 | E47: =C47*6+D47 -> 9 | G47: 5 | H47: 6 | I47: =G47*6+H47 -> 36 | K47: 7 | L47: 10 | M47: =K47*6+L47 -> 52 | O47: 11 | P47: 10 | Q47: =O47*6+P47 -> 76 | S47: WENN
A48: BEST PLAYERS
A49: GEELONG WEST | D49: RADOJEVIC | G49: VAN ELDEN | J49: WELLS | M49: KLINE | O49: LYNCH | R49: FRIEND
A50: OAKLEIGH | D50: ROBERTSON | G50: PAGNOCCOLO | J50: McGRATH | M50: STEWART | O50: J LILLEY
A51: GOALKICKERS
A52: GEELONG WEST | D52: RADOJEVIC 10 | G52: ARKLAY 3 | J52: LYNCH 2 | M52: WELLS 2 | O52: VAN ELDEN | R52: MANSON
A53: OAKLEIGH | D53: TAYLOR 4 | G53: WENN 2 | I53: ROBERTSON | L53: MARTIN | N53: JACKSON | Q53: J LILLEY | S53: MOORE
A55: ROUND 2 | E55: 27TH APRIL | J55: WEATHER | S55: PLAYED AT
D56: 1ST QTR | H56: 2ND QTR | L56: 3RD QTR | P56: FINAL | S56: BEACH ROAD
A57: PORT MELBOURNE | C57: 5 | D57: 3 | E57: =C57*6+D57 -> 33 | G57: 9 | H57: 7 | I57: =G57*6+H57 -> 61 | K57: 12 | L57: 8 | M57: =K57*6+L57 -> 80 | O57: 19 | P57: 15 | Q57: =O57*6+P57 -> 129 | S57: UMPIRE | X57: LADDER | AB57: ROUND | AD57: 2
A58: SANDRINGHAM | C58: 3 | D58: 6 | E58: =C58*6+D58 -> 24 | G58: 8 | H58: 9 | I58: =G58*6+H58 -> 57 | K58: 8 | L58: 11 | M58: =K58*6+L58 -> 59 | O58: 15 | P58: 18 | Q58: =O58*6+P58 -> 108 | S58: HAYES
A59: BEST PLAYERS | W59: TEAM | X59: W | Y59: L | Z59: D | AA59: FOR | AB59: AGST | AC59: % | AD59: PTS
A60: PORT MELBOURNE | D60: GOSS | G60: HARLAND | J60: HOLT | M60: ANDERSON | P60: DAVIES | R60: CRITCH
A61: SANDRINGHAM | D61: R MURRAY | G61: COOPER | J61: BARTLETT | M61: BRENNER | P61: TOMS | R61: CLARKE | W61: GEELONG WEST | X61: 2 | Y61: 0 | Z61: 0 | AA61: 244 | AB61: 176 | AC61: 138.63636363636363 | AD61: 8
A62: GOALKICKERS | W62: PORT MELBOURNE | X62: 2 | Y62: 0 | Z62: 0 | AA62: 278 | AB62: 209 | AC62: 133.01435406698565 | AD62: 8
A63: PORT MELBOURNE | D63: HOLT 5 | F63: GOSS 4 | H63: G ANDERSON 2 | K63: BROWN 2 | M63: COOK 2 | O63: ERWIN 2 | Q63: HARLAND | S63: HAENAN | W63: COBURG | X63: 2 | Y63: 0 | Z63: 0 | AA63: 214 | AB63: 169 | AC63: 126.62721893491124 | AD63: 8
A64: SANDRINGHAM | D64: COOPER 8 | G64: R MURRAY 4 | J64: WARD | L64: LAUBE | N64: TOMS | W64: PRAHRAN | X64: 1 | Y64: 1 | Z64: 0 | AA64: 226 | AB64: 213 | AC64: 106.10328638497653 | AD64: 4
A66: COBURG | C66: 1 | D66: 3 | E66: =C66*6+D66 -> 9 | G66: 7 | H66: 8 | I66: =G66*6+H66 -> 50 | K66: 12 | L66: 14 | M66: =K66*6+L66 -> 86 | O66: 17 | P66: 18 | Q66: =O66*6+P66 -> 120 | S66: COBURG | W66: WILLIAMSTOWN | X66: 1 | Y66: 1 | Z66: 0 | AA66: 218 | AB66: 206 | AC66: 105.8252427184466 | AD66: 4
A67: PRAHRAN | C67: 5 | D67: 5 | E67: =C67*6+D67 -> 35 | G67: 8 | H67: 8 | I67: =G67*6+H67 -> 56 | K67: 13 | L67: 10 | M67: =K67*6+L67 -> 88 | O67: 15 | P67: 15 | Q67: =O67*6+P67 -> 105 | S67: WENN | W67: SANDRINGHAM | X67: 1 | Y67: 1 | Z67: 0 | AA67: 208 | AB67: 203 | AC67: 102.46305418719211 | AD67: 4
A68: BEST PLAYERS | W68: CAULFIELD | X68: 1 | Y68: 1 | Z68: 0 | AA68: 252 | AB68: 260 | AC68: 96.92307692307692 | AD68: 4
A69: COBURG | D69: GALE | G69: HOBBS | I69: SMITH | L69: PITT | N69: MANNIX | Q69: BRENNAN | W69: PRESTON | X69: 0 | Y69: 2 | Z69: 0 | AA69: 213 | AB69: 259 | AC69: 82.239382239382238 | AD69: 0
A70: PRAHRAN | D70: TOWNSEND | G70: SMITH | I70: WILLIAMS | L70: GRANGE | N70: PAYNE | Q70: EMSELLE | W70: DANDENONG | X70: 0 | Y70: 2 | Z70: 0 | AA70: 201 | AB70: 259 | AC70: 77.60617760617761 | AD70: 0
A71: GOALKICKERS | W71: OAKLEIGH | X71: 0 | Y71: 2 | Z71: 0 | AA71: 188 | AB71: 288 | AC71: 65.277777777777771 | AD71: 0
A72: COBURG | D72: SMITH 7 | G72: LAKE 4 | I72: MORRISON 2 | L72: BEATTIE 2 | O72: JOSS | Q72: MANNIX
A73: PRAHRAN | D73: WILLIAMS 4 | G73: SMITH 3 | I73: TOWNSEND 2 | L73: McFAULL | N73: POWER | P73: PAYNE | R73: ANASTASIO | U73: ANDERSON | X73: KENT
A75: WILLIAMSTOWN | C75: 11 | D75: 1 | E75: =C75*6+D75 -> 67 | G75: 13 | H75: 2 | I75: =G75*6+H75 -> 80 | K75: 18 | L75: 7 | M75: =K75*6+L75 -> 115 | O75: 24 | P75: 10 | Q75: =O75*6+P75 -> 154 | S75: OAKLEIGH
A76: OAKLEIGH | C76: 5 | D76: 3 | E76: =C76*6+D76 -> 33 | G76: 11 | H76: 8 | I76: =G76*6+H76 -> 74 | K76: 14 | L76: 12 | M76: =K76*6+L76 -> 96 | O76: 16 | P76: 16 | Q76: =O76*6+P76 -> 112 | S76: O'BRIEN
A77: BEST PLAYERS
A78: WILLIAMSTOWN | C78: KELLY | F78: BOYD | I78: FANNING | L78: KERR | O78: FOX | R78: BOXALL
A79: OAKLEIGH | C79: ROBERTSON | F79: TESERIERO | I79: TAYLOR | L79: STEWART | O79: C NISBET | R79: WENN
A80: GOALKICKERS
A81: WILLIAMSTOWN | C81: FOX 5 | E81: TOWNSEND 4 | H81: BOXALL 4 | J81: SCOTT 2 | L81: N STILLMAN 2 | O81: KELLY 2 | Q81: JACKMAN 2 | T81: DIXON | V81: KERR | X81: RICHARDS
A82: OAKLEIGH | C82: ROBERTSON 5 | F82: WHITE 3 | I82: TESERIERO 2 | L82: KUZIMAK 2 | O82: TAYLLOR | Q82: JACKSON | S82: FITZGERALD | V82: WENN
A84: CAULFIELD | C84: 3 | D84: 3 | E84: =C84*6+D84 -> 21 | G84: 7 | H84: 9 | I84: =G84*6+H84 -> 51 | K84: 14 | L84: 18 | M84: =K84*6+L84 -> 102 | O84: 23 | P84: 21 | Q84: =O84*6+P84 -> 159 | S84: PRINCES PARK
A85: PRESTON | C85: 9 | D85: 7 | E85: =C85*6+D85 -> 61 | G85: 13 | H85: 11 | I85: =G85*6+H85 -> 89 | K85: 16 | L85: 14 | M85: =K85*6+L85 -> 110 | O85: 20 | P85: 19 | Q85: =O85*6+P85 -> 139 | S85: HUGGINS
A86: BEST PLAYERS
A87: CAULFIELD | C87: MILNER | F87: RICHARDS | I87: HAYWOOD | L87: FRIGO | O87: LOGAN | R87: EINSEDEL
A88: PRESTON | C88: WEIGHTMAN | F88: MARSHALL | I88: ZEMSKI | L88: GRAINGER | O88: COBAIN | R88: JOHNSON
A89: GOALKICKERS
A90: CAULFIELD | C90: MILNER 6 | E90: RICHARDS 5 | H90: EINSEDEL 3 | J90: MAGUIRE 2 | M90: BROWN 2 | O90: FRIGO 2 | Q90: LOGAN | S90: DOWSETT | V90: EASTWOOD
A91: PRESTON | C91: WEIGHTMAN 6 | F91: ZUNNEBERG 5 | I91: REYNOLDS 3 | L91: NEWTON 2 | N91: COBAIN 2 | Q91: ZEMSKI | S91: JOHNSON
A93: GEELONG WEST | C93: 6 | D93: 5 | E93: =C93*6+D93 -> 41 | G93: 10 | H93: 10 | I93: =G93*6+H93 -> 70 | K93: 12 | L93: 13 | M93: =K93*6+L93 -> 85 | O93: 16 | P93: 14 | Q93: =O93*6+P93 -> 110 | S93: DANDENONG
A94: DANDENONG | C94: 3 | D94: 3 | E94: =C94*6+D94 -> 21 | G94: 6 | H94: 9 | I94: =G94*6+H94 -> 45 | K94: 9 | L94: 18 | M94: =K94*6+L94 -> 72 | O94: 13 | P94: 22 | Q94: =O94*6+P94 -> 100 | S94: ABBOTT
A95: BEST PLAYERS
A96: GEELONG WEST | D96: FRIEND | G96: HUGHES | J96: WOOLFE | M96: YATES | P96: GILMORE | S96: BARRY
A97: DANDENONG | D97: WALKER | G97: TRUEMAN | J97: PAYZE | M97: HENRIKSEN | P97: BRIESE | S97: SHINNERS
A98: GOALKICKERS
A99: GEELONG WEST | D99: RADOJEVIC 5 | G99: WOOLFE 4 | J99: HUGHES 2 | M99: WELLS 2 | O99: ARKLAY | Q99: LYNCH | S99: GILMORE
A100: DANDENONG | D100: BRIESE 3 | F100: PAYZE 2 | I100: PATTERSON 2 | L100: FLAHERTY 2 | O100: HARRINGTON | R100: SHINNERS | U100: DROSCHER | X100: ORCHARD
A102: ROUND 3 | E102: 4TH MAY | J102: WEATHER | S102: PLAYED AT
D103: 1ST QTR | H103: 2ND QTR | L103: 3RD QTR | P103: FINAL | S103: WILLIAMSTOWN
A104: GEELONG WEST | C104: 5 | D104: 2 | E104: =C104*6+D104 -> 32 | G104: 10 | H104: 7 | I104: =G104*6+H104 -> 67 | K104: 17 | L104: 16 | M104: =K104*6+L104 -> 118 | O104: 25 | P104: 21 | Q104: =O104*6+P104 -> 171 | S104: UMPIRE | X104: LADDER | AB104: ROUND | AD104: 3
A105: WILLIAMSTOWN | C105: 1 | D105: 2 | E105: =C105*6+D105 -> 8 | G105: 5 | H105: 6 | I105: =G105*6+H105 -> 36 | K105: 8 | L105: 9 | M105: =K105*6+L105 -> 57 | O105: 12 | P105: 16 | Q105: =O105*6+P105 -> 88 | S105: MATTHEWS
A106: BEST PLAYERS | W106: TEAM | X106: W | Y106: L | Z106: D | AA106: FOR | AB106: AGST | AC106: % | AD106: PTS
A107: GEELONG WEST | D107: YATES | G107: LYNCH | I107: GILMORE | L107: ARKLAY | N107: HUGHES | Q107: VAN ELDEN
A108: WILLIAMSTOWN | D108: KELLY | G108: KERR | I108: HANNEBURY | L108: FOX | W108: GEELONG WEST | X108: 3 | Y108: 0 | Z108: 0 | AA108: 415 | AB108: 264 | AC108: 157.19696969696969 | AD108: 12
A109: GOALKICKERS | S109: GILMORE | W109: PORT MELBOURNE | X109: 3 | Y109: 0 | Z109: 0 | AA109: 412 | AB109: 318 | AC109: 129.55974842767296 | AD109: 12
A110: GEELONG WEST | D110: YATES 6 | F110: RADOJEVIC 4 | I110: LYNCH 4 | K110: ARKLAY 3 | M110: WOOLFE 3 | O110: VAN ELDEN 2 | R110: WELLS 2 | W110: COBURG | X110: 3 | Y110: 0 | Z110: 0 | AA110: 331 | AB110: 269 | AC110: 123.04832713754647 | AD110: 12
A111: WILLIAMSTOWN | D111: BOXALL 2 | F111: L STILLMAN 2 | I111: DIXON 2 | K111: RICHARDS 2 | N111: GARDNER | P111: FOX | Q111: JACKMAN | S111: KELLY | W111: PRAHRAN | X111: 1 | Y111: 2 | Z111: 0 | AA111: 357 | AB111: 359 | AC111: 99.44 | AD111: 4
A113: PORT MELBOURNE | C113: 5 | D113: 3 | E113: =C113*6+D113 -> 33 | G113: 13 | H113: 5 | I113: =G113*6+H113 -> 83 | K113: 14 | L113: 10 | M113: =K113*6+L113 -> 94 | O113: 20 | P113: 14 | Q113: =O113*6+P113 -> 134 | S113: PORT MELBOURNE | W113: SANDRINGHAM | X113: 1 | Y113: 2 | Z113: 0 | AA113: 308 | AB113: 327 | AC113: 94.189602446483178 | AD113: 4
A114: CAULFIELD | C114: 2 | D114: 4 | E114: =C114*6+D114 -> 16 | G114: 4 | H114: 8 | I114: =G114*6+H114 -> 32 | K114: 9 | L114: 15 | M114: =K114*6+L114 -> 69 | O114: 15 | P114: 19 | Q114: =O114*6+P114 -> 109 | S114: TORNEY | W114: CAULFIELD | X114: 1 | Y114: 2 | Z114: 0 | AA114: 361 | AB114: 394 | AC114: 91.6243654822335 | AD114: 4
A115: BEST PLAYERS | W115: DANDENONG | X115: 1 | Y115: 2 | Z115: 0 | AA115: 325 | AB115: 359 | AC115: 90.529247910863504 | AD115: 4
A116: PORT MELBOURNE | D116: MOLLOY | G116: GOSS | J116: BROWN | M116: HOLT | O116: DAVIES | R116: HERROD | W116: WILLIAMSTOWN | X116: 1 | Y116: 2 | Z116: 0 | AA116: 306 | AB116: 377 | AC116: 81.167108753315645 | AD116: 4
A117: CAULFIELD | D117: HAYWOOD | G117: MAGUIRE | J117: CLIFF | M117: LOGAN | O117: TULLOCH | R117: HUNTER | W117: OAKLEIGH | X117: 1 | Y117: 2 | Z117: 0 | AA117: 334 | AB117: 419 | AC117: 79.71 | AD117: 4
A118: GOALKICKERS | W118: PRESTON | X118: 0 | Y118: 3 | Z118: 0 | AA118: 313 | AB118: 376 | AC118: 83.244680851063833 | AD118: 0
A119: PORT MELBOURNE | D119: COOK 5 | F119: GOSS 3 | H119: HOLT 3 | J119: HAENAN 2 | M119: CLARK 2 | O119: DAVIES 2 | Q119: HARLAND 2 | T119: ERWIN
A120: CAULFIELD | D120: RICHARDS 5 | G120: JOHNSON 4 | J120: EINSEDEL 3 | M120: NEWTON 2 | P120: CLIFF
A122: COBURG | C122: 4 | D122: 3 | E122: =C122*6+D122 -> 27 | G122: 7 | H122: 9 | I122: =G122*6+H122 -> 51 | K122: 11 | L122: 11 | M122: =K122*6+L122 -> 77 | O122: 17 | P122: 15 | Q122: =O122*6+P122 -> 117 | S122: PRESTON
A123: PRESTON | C123: 4 | D123: 6 | E123: =C123*6+D123 -> 30 | G123: 7 | H123: 7 | I123: =G123*6+H123 -> 49 | K123: 11 | L123: 9 | M123: =K123*6+L123 -> 75 | O123: 15 | P123: 10 | Q123: =O123*6+P123 -> 100 | S123: VERGONA
A124: BEST PLAYERS
A125: COBURG | C125: P McCARTHY | F125: BRENNAN | I125: GALE | L125: JOSS | N125: MORRISON | Q125: PITT
A126: PRESTON | C126: WATT | F126: WEIGHTMAN | I126: ZEMSKI | L126: LESLIE | N126: NEWTON | Q126: MIDDLETON
A127: GOALKICKERS
A128: COBURG | C128: SMITH 5 | F128: MORRISON 3 | I128: HODGETTS 3 | L128: BRENNAN 2 | O128: GALE 2 | Q128: LAKE | S128: BEATTIE
A129: PRESTON | C129: NEWTON 5 | F129: MIDDLETON 4 | I129: ZEMSKI | K129: IRELAND | M129: WEIGHTMAN | P129: REYNOLDS | R129: PETTIGREW | U129: POTTER
A131: DANDENONG | C131: 3 | D131: 5 | E131: =C131*6+D131 -> 23 | G131: 7 | H131: 10 | I131: =G131*6+H131 -> 52 | K131: 11 | L131: 16 | M131: =K131*6+L131 -> 82 | O131: 17 | P131: 22 | Q131: =O131*6+P131 -> 124 | S131: BEACH ROAD
A132: SANDRINGHAM | C132: 3 | D132: 6 | E132: =C132*6+D132 -> 24 | G132: 5 | H132: 8 | I132: =G132*6+H132 -> 38 | K132: 7 | L132: 11 | M132: =K132*6+L132 -> 53 | O132: 14 | P132: 16 | Q132: =O132*6+P132 -> 100 | S132: WENN
A133: BEST PLAYERS
A134: DANDENONG | C134: SHINNERS | F134: REID | I134: PAYZE | L134: BRIESE | N134: WALKER | Q134: FLAHERTY
A135: SANDRINGHAM | C135: LIDDELL | F135: K MURRAY | I135: BROWNE | L135: MAYNE | N135: COUGHLAN | Q135: COOPER
A136: GOALKICKERS
A137: DANDENONG | C137: MILLER 6 | F137: FLAHERTY 4 | I137: SHINNERS 2 | L137: REID 2 | N137: WALKER 2 | Q137: PAYZE
A138: SANDRINGHAM | C138: COOPER 5 | F138: CLARKE 3 | I138: BARTLETT 2 | L138: MACKENZIE | O138: R MURRAY | R138: LACEY | T138: MAYNE
A140: OAKLEIGH | C140: 4 | D140: 9 | E140: =C140*6+D140 -> 33 | G140: 9 | H140: 3 | I140: =G140*6+H140 -> 57 | K140: 16 | L140: 18 | M140: =K140*6+L140 -> 114 | O140: 21 | P140: 20 | Q140: =O140*6+P140 -> 146 | S140: TOORAK PARK
A141: PRAHRAN | C141: 2 | D141: 4 | E141: =C141*6+D141 -> 16 | G141: 10 | H141: 5 | I141: =G141*6+H141 -> 65 | K141: 15 | L141: 9 | M141: =K141*6+L141 -> 99 | O141: 20 | P141: 11 | Q141: =O141*6+P141 -> 131 | S141: ABBOTT
A142: BEST PLAYERS
A143: OAKLEIGH | D143: NESBIT | G143: WHITE | I143: MURNANE | M143: KING | O143: HORTON | R143: O'HALLORAN
A144: PRAHRAN | D144: ANDERSON | G144: PAYNE | I144: CUNNINGHAM | M144: BECK | O144: G SMITH | R144: TOWNSEND
A145: GOALKICKERS
A146: OAKLEIGH | D146: JOHNSON 3 | F146: ROBERTSON 3 | I146: TESERIERO 3 | L146: WHITE 3 | N146: TAYLOR 2 | Q146: MORRISON 2 | T146: HOWELL (2) | V146: KING | X146: J LILLEY | AA146: MURNANE
A147: PRAHRAN | D147: G SMITH 5 | F147: KENT 3 | H147: W JOHNSTON 2 | K147: POWER 2 | M147: PAYNE 2 | O147: ANDERSON | Q147: BECK | R147: EMSELLE | T147: TOWNSEND | W147: WILLIAMS | Y147: McFAULL
A149: ROUND 4 | E149: 11TH MAY | J149: WEATHER | N149: NORTH WIND SHOWERS | S149: PLAYED AT
D150: 1ST QTR | H150: 2ND QTR | L150: 3RD QTR | P150: FINAL | S150: COBURG
A151: PORT MELBOURNE | C151: 2 | D151: 3 | E151: =C151*6+D151 -> 15 | G151: 7 | H151: 10 | I151: =G151*6+H151 -> 52 | K151: 11 | L151: 15 | M151: =K151*6+L151 -> 81 | O151: 19 | P151: 21 | Q151: =O151*6+P151 -> 135 | S151: UMPIRE | X151: LADDER | AB151: ROUND | AD151: 4
A152: COBURG | C152: 7 | D152: 3 | E152: =C152*6+D152 -> 45 | G152: 8 | H152: 4 | I152: =G152*6+H152 -> 52 | K152: 9 | L152: 8 | M152: =K152*6+L152 -> 62 | O152: 13 | P152: 9 | Q152: =O152*6+P152 -> 87 | S152: O'BRIEN
A153: BEST PLAYERS | W153: TEAM | X153: W | Y153: L | Z153: D | AA153: FOR | AB153: AGST | AC153: % | AD153: PTS
A154: PORT MELBOURNE | D154: COOK | F154: GOSS | I154: HERROD | L154: ALLEN | O154: OWEN | Q154: G ANDERSON
A155: COBURG | D155: HOBBS | F155: BRENNAN | I155: SMITH | L155: HODGETTS | O155: PITT | W155: GEELONG WEST | X155: 4 | Y155: 0 | Z155: 0 | AA155: 572 | AB155: 365 | AC155: 156.71 | AD155: 16
A156: GOALKICKERS | W156: PORT MELBOURNE | X156: 4 | Y156: 0 | Z156: 0 | AA156: 547 | AB156: 405 | AC156: 135.06172839506172 | AD156: 16
A157: PORT MELBOURNE | D157: COOK 8 | F157: G ANDERSON 3 | I157: GOSS 2 | K157: HARLAND 2 | N157: BROWN | P157: HOLT | Q157: HARLAND | S157: DAVIES | W157: COBURG | X157: 3 | Y157: 1 | Z157: 0 | AA157: 418 | AB157: 404 | AC157: 103.46534653465346 | AD157: 12
A158: COBURG | D158: SMITH 5 | F158: HODGETTS 4 | I158: GALE | K158: LUKE | M158: McGRATH | O158: HOBBS | W158: DANDENONG | X158: 2 | Y158: 2 | Z158: 0 | AA158: 466 | AB158: 434 | AC158: 107.37 | AD158: 8
A160: GEELONG WEST | C160: 6 | D160: 2 | E160: =C160*6+D160 -> 38 | G160: 9 | H160: 8 | I160: =G160*6+H160 -> 62 | K160: 12 | L160: 11 | M160: =K160*6+L160 -> 83 | O160: 23 | P160: 19 | Q160: =O160*6+P160 -> 157 | S160: GEELONG WEST | W160: SANDRINGHAM | X160: 2 | Y160: 2 | Z160: 0 | AA160: 450 | AB160: 436 | AC160: 103.21100917431193 | AD160: 8
A161: PRAHRAN | C161: 3 | D161: 4 | E161: =C161*6+D161 -> 22 | G161: 6 | H161: 6 | I161: =G161*6+H161 -> 42 | K161: 14 | L161: 10 | M161: =K161*6+L161 -> 94 | O161: 15 | P161: 11 | Q161: =O161*6+P161 -> 101 | S161: HUGGINS | W161: PRESTON | X161: 1 | Y161: 3 | Z161: 0 | AA161: 422 | AB161: 472 | AC161: 89.406779661016955 | AD161: 4
A162: BEST PLAYERS | W162: PRAHRAN | X162: 1 | Y162: 3 | Z162: 0 | AA162: 458 | AB162: 516 | AC162: 88.76 | AD162: 4
A163: GEELONG WEST | D163: HUGHES | G163: WELLS | J163: VAN ELDEN | M163: YATES | P163: BARRY | R163: MANSON | W163: CAULFIELD | X163: 1 | Y163: 3 | Z163: 0 | AA163: 470 | AB163: 536 | AC163: 87.68656716417911 | AD163: 4
A164: PRAHRAN | D164: GUNN | G164: RIMINGTON | J164: EMSELLE | M164: TOWNSEND | P164: KENT | W164: OAKLEIGH | X164: 1 | Y164: 3 | Z164: 0 | AA164: 430 | AB164: 528 | AC164: 81.44 | AD164: 4
A165: GOALKICKERS | W165: WILLIAMSTOWN | X165: 1 | Y165: 3 | Z165: 0 | AA165: 381 | AB165: 518 | AC165: 73.55 | AD165: 4
A166: GEELONG WEST | D166: RADOJEVIC 8 | G166: WELLS 5 | I166: YATES 3 | K166: HUGHES 3 | N166: WOOLFE 2 | Q166: LYNCH | S166: BEECROFT
A167: PRAHRAN | D167: JOHNSTON 4 | G167: BIRCH 2 | I167: McSPEERIN 2 | L167: KENT 2 | N167: PAYNE 2 | Q167: EMSELLE | S167: ANDERSON | V167: HOMANN
A169: SANDRINGHAM | C169: 9 | D169: 7 | E169: =C169*6+D169 -> 61 | G169: 12 | H169: 9 | I169: =G169*6+H169 -> 81 | K169: 18 | L169: 15 | M169: =K169*6+L169 -> 123 | O169: 21 | P169: 16 | Q169: =O169*6+P169 -> 142 | S169: PRINCES PARK
A170: CAULFIELD | C170: 0 | D170: 5 | E170: =C170*6+D170 -> 5 | G170: 4 | H170: 13 | I170: =G170*6+H170 -> 37 | K170: 9 | L170: 17 | M170: =K170*6+L170 -> 71 | O170: 14 | P170: 25 | Q170: =O170*6+P170 -> 109 | S170: VERGONA
A171: BEST PLAYERS
A172: SANDRINGHAM | D172: MACKENZIE | G172: PETERS | J172: CLARKE | M172: R MURRAY | P172: HUNTER | S172: NICHOLSON
A173: CAULFIELD | D173: MAGUIRE | G173: BOOTH | J173: HOCKING | M173: EINSEDEL | P173: TEMPEST | S173: JEWELL
A174: GOALKICKERS
A175: SANDRINGHAM | D175: R MURRAY 4 | G175: CLARKE 4 | I175: DYNON 3 | K175: COOPER 2 | M175: MACKENZIE 2 | P175: NICHOLSON 2 | S175: MAYNE | U175: BARTLETT | X175: COUGHLAN
A176: CAULFIELD | D176: BOOTH 5 | G176: HOCKING 4 | J176: MILNER | L176: JEWELL | N176: SAUNDERS | Q176: BROWN | S176: MAGUIRE
A178: DANDENONG | C178: 7 | D178: 8 | E178: =C178*6+D178 -> 50 | G178: 8 | H178: 11 | I178: =G178*6+H178 -> 59 | K178: 17 | L178: 15 | M178: =K178*6+L178 -> 117 | O178: 20 | P178: 18 | Q178: =O178*6+P178 -> 138 | S178: DANDENONG
A179: WILLIAMSTOWN | C179: 1 | D179: 2 | E179: =C179*6+D179 -> 8 | G179: 5 | H179: 4 | I179: =G179*6+H179 -> 34 | K179: 8 | L179: 5 | M179: =K179*6+L179 -> 53 | O179: 11 | P179: 9 | Q179: =O179*6+P179 -> 75 | S179: TORNEY
A180: BEST PLAYERS
A181: DANDENONG | D181: SHINNERS | G181: PAYZE | J181: HARRINGTON | M181: FLAHERTY | P181: ORCHARD | S181: MELAI
A182: WILLIAMSTOWN | D182: KELLY | G182: CROSS | J182: FENTON | M182: BOYD | P182: BOXALL
A183: GOALKICKERS
A184: DANDENONG | D184: WALKER 3 | F184: DA ROSE 3 | I184: MILLER 3 | K184: ORCHARD 2 | N184: SHINNERS 2 | Q184: FLAHERTY 2 | T184: DROSCHER 2 | X184: BRIESE | Z184: PAYZE | AB184: MELAI
A185: WILLIAMSTOWN | D185: BOXALL 4 | G185: CROSS 2 | I185: FENTON 2 | L185: RICHARDS 2 | O185: KELLY
A187: PRESTON | C187: 5 | D187: 3 | E187: =C187*6+D187 -> 33 | G187: 7 | H187: 7 | I187: =G187*6+H187 -> 49 | K187: 12 | L187: 11 | M187: =K187*6+L187 -> 83 | O187: 16 | P187: 13 | Q187: =O187*6+P187 -> 109 | S187: OAKLEIGH
A188: OAKLEIGH | C188: 4 | D188: 5 | E188: =C188*6+D188 -> 29 | G188: 7 | H188: 9 | I188: =G188*6+H188 -> 51 | K188: 11 | L188: 13 | M188: =K188*6+L188 -> 79 | O188: 13 | P188: 18 | Q188: =O188*6+P188 -> 96 | S188: MATHEWS
A189: BEST PLAYERS
A190: PRESTON | D190: LESLIE | G190: PREECE | J190: IRELAND | M190: GRAINGER | P190: MARINER | R190: POTTER
A191: OAKLEIGH | D191: CHISHOLM | G191: HOWELL | J191: O'HALLORAN | M191: KING | P191: WHITE | R191: MURNANE
A192: GOALKICKERS
A193: PRESTON | D193: MARINER 6 | G193: NEWTON 3 | J193: IRELAND 2 | M193: GRAINGER | O193: PETTIGREW | R193: POTTER | T193: COBAIN | V193: ZEMSKI
A194: OAKLEIGH | D194: WHITE 3 | G194: TAYLOR 3 | J194: MURNANE 2 | M194: D NESBIT | O194: GAUNT | Q194: KING | R194: HOWELL | T194: ROBERTSON
A196: ROUND 5 | E196: 18TH MAY | J196: WEATHER | N196: FINE | S196: PLAYED AT
D197: 1ST QTR | H197: 2ND QTR | L197: 3RD QTR | P197: FINAL | S197: DANDENONG
A198: DANDENONG | C198: 3 | D198: 0 | E198: =C198*6+D198 -> 18 | G198: 5 | H198: 10 | I198: =G198*6+H198 -> 40 | K198: 8 | L198: 11 | M198: =K198*6+L198 -> 59 | O198: 15 | P198: 14 | Q198: =O198*6+P198 -> 104 | S198: UMPIRE | X198: LADDER | AB198: ROUND | AD198: 5
A199: COBURG | C199: 6 | D199: 9 | E199: =C199*6+D199 -> 45 | G199: 8 | H199: 11 | I199: =G199*6+H199 -> 59 | K199: 12 | L199: 14 | M199: =K199*6+L199 -> 86 | O199: 13 | P199: 20 | Q199: =O199*6+P199 -> 98 | S199: HUGGINS
A200: BEST PLAYERS | W200: TEAM | X200: W | Y200: L | Z200: D | AA200: FOR | AB200: AGST | AC200: % | AD200: PTS
A201: DANDENONG | D201: HENRIKSEN | G201: MELAI | J201: PAYZE | M201: SHINNERS | P201: REID | R201: MILLER
A202: COBURG | D202: HOBBS | G202: SMITH | J202: BRENNAN | M202: ROBINSON | W202: GEELONG WEST | X202: 5 | Y202: 0 | Z202: 0 | AA202: 711 | AB202: 422 | AC202: 168.48 | AD202: 20
A203: GOALKICKERS | W203: PORT MELBOURNE | X203: 5 | Y203: 0 | Z203: 0 | AA203: 744 | AB203: 493 | AC203: 150.91277890466532 | AD203: 20
A204: DANDENONG | D204: MILLER 5 | G204: FLAHERTY 2 | J204: BRIESE 2 | M204: PAYZE 2 | O204: MELAI 2 | Q204: DA ROSE | S204: ORCHARD | W204: DANDENONG | X204: 3 | Y204: 2 | Z204: 0 | AA204: 570 | AB204: 532 | AC204: 107.14 | AD204: 12
A205: COBURG | D205: SMITH 9 | G205: LUKE | I205: LAKE | K205: HOBBS | M205: MORRISON | W205: COBURG | X205: 3 | Y205: 2 | Z205: 0 | AA205: 516 | AB205: 508 | AC205: 101.5748031496063 | AD205: 12
A207: GEELONG WEST | C207: 2 | D207: 5 | E207: =C207*6+D207 -> 17 | G207: 7 | H207: 9 | I207: =G207*6+H207 -> 51 | K207: 15 | L207: 15 | M207: =K207*6+L207 -> 105 | O207: 20 | P207: 19 | Q207: =O207*6+P207 -> 139 | S207: BEACH ROAD | W207: PRAHRAN | X207: 2 | Y207: 3 | Z207: 0 | AA207: 564 | AB207: 598 | AC207: 94.31 | AD207: 8
A208: SANDRINGHAM | C208: 2 | D208: 1 | E208: =C208*6+D208 -> 13 | G208: 4 | H208: 4 | I208: =G208*6+H208 -> 28 | K208: 5 | L208: 5 | M208: =K208*6+L208 -> 35 | O208: 8 | P208: 9 | Q208: =O208*6+P208 -> 57 | S208: STABB | W208: CAULFIELD | X208: 2 | Y208: 3 | Z208: 0 | AA208: 583 | AB208: 638 | AC208: 91.379310344827587 | AD208: 8
A209: BEST PLAYERS | W209: SANDRINGHAM | X209: 2 | Y209: 3 | Z209: 0 | AA209: 507 | AB209: 575 | AC209: 88.173913043478265 | AD209: 8
A210: GEELONG WEST | D210: LYNCH | G210: WELLS | J210: HUGHES | M210: YATES | P210: KLINE | R210: MANSON | W210: PRESTON | X210: 1 | Y210: 4 | Z210: 0 | AA210: 504 | AB210: 578 | AC210: 87.197231833910038 | AD210: 4
A211: SANDRINGHAM | D211: R MURRAY | G211: LIDDELL | J211: PETERS | M211: BROWNE | P211: MURLEY | R211: MACKENZIE | W211: OAKLEIGH | X211: 1 | Y211: 4 | Z211: 0 | AA211: 532 | AB211: 641 | AC211: 83 | AD211: 4
A212: GOALKICKERS | W212: WILLIAMSTOWN | X212: 1 | Y212: 4 | Z212: 0 | AA212: 469 | AB212: 715 | AC212: 65.59 | AD212: 4
A213: GEELONG WEST | D213: RADOJEVIC 8 | G213: LYNCH 3 | I213: WELLS 3 | K213: YATES 3 | M213: HUGHES | O213: TOULMIN | Q213: GILMORE | S213: VAN ELDEN
A214: SANDRINGHAM | D214: MURLEY 2 | G214: HUNTER 2 | J214: BROWNE | L214: BARTLETT | N214: DYNON | P214: R MURRAY
A216: PRAHRAN | C216: 2 | D216: 4 | E216: =C216*6+D216 -> 16 | G216: 4 | H216: 8 | I216: =G216*6+H216 -> 32 | K216: 10 | L216: 14 | M216: =K216*6+L216 -> 74 | O216: 15 | P216: 16 | Q216: =O216*6+P216 -> 106 | S216: PRESTON
A217: PRESTON | C217: 3 | D217: 2 | E217: =C217*6+D217 -> 20 | G217: 5 | H217: 6 | I217: =G217*6+H217 -> 36 | K217: 6 | L217: 8 | M217: =K217*6+L217 -> 44 | O217: 12 | P217: 10 | Q217: =O217*6+P217 -> 82 | S217: OGSTON
A218: BEST PLAYERS
A219: PRAHRAN | D219: TOWNSEND | G219: G SMITH | J219: PAYNE | M219: ANDERSON | P219: GUNN | S219: BIRCH
A220: PRESTON | D220: GRAINGER | G220: STEWART | J220: ZEMSKI | M220: WATT | P220: LESLIE | S220: ZUNNEBERG
A221: GOALKICKERS
A222: PRAHRAN | D222: G SMITH 4 | G222: DICKSON 3 | J222: ANDERSON 2 | M222: McFAULL 2 | P222: EMSELLE | R222: TOWNSEND | U222: BIRCH | W222: KENT
A223: PRESTON | D223: SMITH 3 | G223: IRELAND 2 | J223: ZUNNEBERG 2 | M223: COBAIN 2 | P223: MARRINER | R223: PETTIGREW | U223: WILSON
A225: CAULFIELD | C225: 6 | D225: 3 | E225: =C225*6+D225 -> 39 | G225: 6 | H225: 7 | I225: =G225*6+H225 -> 43 | K225: 9 | L225: 17 | M225: =K225*6+L225 -> 71 | O225: 15 | P225: 23 | Q225: =O225*6+P225 -> 113 | S225: PRINCES PARK
A226: OAKLEIGH | C226: 1 | D226: 2 | E226: =C226*6+D226 -> 8 | G226: 5 | H226: 8 | I226: =G226*6+H226 -> 38 | K226: 7 | L226: 17 | M226: =K226*6+L226 -> 59 | O226: 14 | P226: 18 | Q226: =O226*6+P226 -> 102 | S226: HAYES
A227: BEST PLAYERS
A228: CAULFIELD | D228: MAGUIRE | G228: CLIFF | J228: HOCKING | M228: HAYWOOD | P228: McGRATH | S228: BOOTH
A229: OAKLEIGH | D229: TAYLOR | G229: ROBERTSON | J229: MURNANE | M229: GAUNT | P229: ELLIOTT | S229: QUINN
A230: GOALKICKERS
A231: CAULFIELD | D231: HOCKING 4 | G231: LOGAN 2 | I231: HAYWOOD 2 | L231: CLIFF 2 | N231: BOOTH 2 | Q231: MAGUIRE | S231: BAKER
A232: OAKLEIGH | D232: TAYLOR 7 | G232: TOOHEY 3 | J232: MURNANE 2 | M232: HOWELL | O232: McGRATH
A234: PORT MELBOURNE | C234: 3 | D234: 4 | E234: =C234*6+D234 -> 22 | G234: 16 | H234: 9 | I234: =G234*6+H234 -> 105 | K234: 22 | L234: 12 | M234: =K234*6+L234 -> 144 | O234: 30 | P234: 17 | Q234: =O234*6+P234 -> 197 | S234: PORT MELBOURNE
A235: WILLIAMSTOWN | C235: 5 | D235: 4 | E235: =C235*6+D235 -> 34 | G235: 7 | H235: 8 | I235: =G235*6+H235 -> 50 | K235: 11 | L235: 12 | M235: =K235*6+L235 -> 78 | O235: 12 | P235: 16 | Q235: =O235*6+P235 -> 88 | S235: WENN
A236: BEST PLAYERS
A237: PORT MELBOURNE | D237: COOK | F237: GOSS | I237: ERWIN | L237: HERROD | N237: ELLIOTT | Q237: DAVIES
A238: WILLIAMSTOWN | D238: BOYD | F238: BOXALL | I238: PERRY | L238: KELLY | N238: FANNING
A239: GOALKICKERS
A240: PORT MELBOURNE | D240: COOK 12 | F240: GOSS 3 | H240: HARLAND 3 | K240: ELLIOTT 3 | M240: HAENAN 3 | P240: HOLT 2 | R240: DAVIES 2 | U240: BROWN | W240: CRITCH
A241: WILLIAMSTOWN | D241: BOXALL 7 | G241: SCOTT 2 | I241: FENTON 2 | L241: CROSS
A243: ROUND 6 | E243: 25TH MAY | J243: WEATHER | N243: WEST WIND SHOWERS | S243: PLAYED AT
D244: 1ST QTR | H244: 2ND QTR | L244: 3RD QTR | P244: FINAL | S244: TOORAK PARK
A245: PORT MELBOURNE | C245: 6 | D245: 3 | E245: =C245*6+D245 -> 39 | G245: 12 | H245: 5 | I245: =G245*6+H245 -> 77 | K245: 16 | L245: 12 | M245: =K245*6+L245 -> 108 | O245: 21 | P245: 19 | Q245: =O245*6+P245 -> 145 | S245: UMPIRE | X245: LADDER | AB245: ROUND | AD245: 6
A246: PRAHRAN | C246: 1 | D246: 1 | E246: =C246*6+D246 -> 7 | G246: 4 | H246: 2 | I246: =G246*6+H246 -> 26 | K246: 6 | L246: 5 | M246: =K246*6+L246 -> 41 | O246: 8 | P246: 9 | Q246: =O246*6+P246 -> 57 | S246: VERGONA
A247: BEST PLAYERS | W247: TEAM | X247: W | Y247: L | Z247: D | AA247: FOR | AB247: AGST | AC247: % | AD247: PTS
A248: PORT MELBOURNE | D248: DAVEY | G248: GOSS | I248: OWEN | L248: HARLAND | O248: COOK | R248: HOLT
A249: PRAHRAN | D249: CUNNINGHAM | G249: GUNN | I249: O'BRIEN | L249: DICKSON | O249: TOWNSEND | R249: JOHNSTON | W249: PORT MELBOURNE | X249: 6 | Y249: 0 | Z249: 0 | AA249: 889 | AB249: 550 | AC249: 161.63636363636363 | AD249: 24
A250: GOALKICKERS | R250: DAVIES | W250: GEELONG WEST | X250: 6 | Y250: 0 | Z250: 0 | AA250: 809 | AB250: 502 | AC250: 161.16 | AD250: 24
A251: PORT MELBOURNE | D251: COOK 7 | F251: HARLAND 4 | I251: HOLT 4 | K251: BROWN | M251: GOSS | O251: ELLIOTT | Q251: HAENAN | S251: WILSMORE | W251: COBURG | X251: 4 | Y251: 2 | Z251: 0 | AA251: 676 | AB251: 594 | AC251: 113.8047138047138 | AD251: 16
A252: PRAHRAN | D252: DICKSON 4 | G252: JOHNSTON 2 | J252: PAYNE | L252: KENT | W252: DANDENONG | X252: 3 | Y252: 3 | Z252: 0 | AA252: 645 | AB252: 626 | AC252: 103.04 | AD252: 12
A254: GEELONG WEST | C254: 0 | D254: 4 | E254: =C254*6+D254 -> 4 | G254: 4 | H254: 9 | I254: =G254*6+H254 -> 33 | K254: 11 | L254: 10 | M254: =K254*6+L254 -> 76 | O254: 14 | P254: 14 | Q254: =O254*6+P254 -> 98 | S254: GEELONG WEST | W254: PRESTON | X254: 2 | Y254: 4 | Z254: 0 | AA254: 598 | AB254: 653 | AC254: 91.577335375191424 | AD254: 8
A255: CAULFIELD | C255: 3 | D255: 6 | E255: =C255*6+D255 -> 24 | G255: 6 | H255: 11 | I255: =G255*6+H255 -> 47 | K255: 9 | L255: 11 | M255: =K255*6+L255 -> 65 | O255: 11 | P255: 14 | Q255: =O255*6+P255 -> 80 | S255: O'BRIEN | W255: CAULFIELD | X255: 2 | Y255: 4 | Z255: 0 | AA255: 663 | AB255: 736 | AC255: 90.081521739130437 | AD255: 8
A256: BEST PLAYERS | W256: SANDRINGHAM | X256: 2 | Y256: 4 | Z256: 0 | AA256: 588 | AB256: 661 | AC256: 88.956127080181545 | AD256: 8
A257: GEELONG WEST | D257: LYNCH | G257: KLINE | J257: HINDSON | M257: HUGHES | O257: TOULMIN | R257: BRIGHT | W257: PRAHRAN | X257: 2 | Y257: 4 | Z257: 0 | AA257: 621 | AB257: 743 | AC257: 83.58 | AD257: 8
A258: CAULFIELD | D258: EINSEDEL | G258: MAGUIRE | J258: CLIFF | M258: BALL | O258: JACKS | R258: FRIGO | W258: WILLIAMSTOWN | X258: 2 | Y258: 4 | Z258: 0 | AA258: 555 | AB258: 796 | AC258: 69.72 | AD258: 8
A259: GOALKICKERS | W259: OAKLEIGH | X259: 1 | Y259: 5 | Z259: 0 | AA259: 618 | AB259: 801 | AC259: 77.15 | AD259: 4
A260: GEELONG WEST | D260: LYNCH 3 | G260: ARKLAY 3 | J260: RADOJEVIC 3 | M260: WELLS 2 | O260: HUGHES | Q260: TOULMIN | S260: MANSON
A261: CAULFIELD | D261: JACKS 3 | G261: CLIFF 2 | I261: BOOTH 2 | K261: LOGAN | M261: SAUNDERS | P261: SMITH | R261: HOCKING
A263: PRESTON | C263: 2 | D263: 3 | E263: =C263*6+D263 -> 15 | G263: 8 | H263: 6 | I263: =G263*6+H263 -> 54 | K263: 11 | L263: 7 | M263: =K263*6+L263 -> 73 | O263: 14 | P263: 10 | Q263: =O263*6+P263 -> 94 | S263: PRESTON
A264: DANDENONG | C264: 3 | D264: 3 | E264: =C264*6+D264 -> 21 | G264: 8 | H264: 4 | I264: =G264*6+H264 -> 52 | K264: 9 | L264: 10 | M264: =K264*6+L264 -> 64 | O264: 10 | P264: 15 | Q264: =O264*6+P264 -> 75 | S264: STABB
A265: BEST PLAYERS
A266: PRESTON | D266: MARSHALL | G266: GRAINGER | J266: LESLIE | M266: ZEMSKI | P266: STEPHENS | S266: ZUNNEBERG
A267: DANDENONG | D267: REID | G267: PAYZE | J267: SHEVLIN | M267: DROSCHER | P267: SHINNERS | S267: MADDEN
A268: GOALKICKERS
A269: PRESTON | D269: MIDDLETON 3 | G269: WEIGHTMAN 2 | J269: ZUNNEBERG 2 | M269: MARINER 2 | P269: GRAINGER 2 | S269: IRELAND | V269: MARSHALL | X269: ZEMSKI
A270: DANDENONG | D270: MADDEN 4 | G270: FLAHERTY 3 | J270: SHINNERS 2 | M270: REID
A272: WILLIAMSTOWN | C272: 2 | D272: 5 | E272: =C272*6+D272 -> 17 | G272: 4 | H272: 10 | I272: =G272*6+H272 -> 34 | K272: 8 | L272: 14 | M272: =K272*6+L272 -> 62 | O272: 11 | P272: 20 | Q272: =O272*6+P272 -> 86 | S272: WILLIAMSTOWN
A273: SANDRINGHAM | C273: 3 | D273: 8 | E273: =C273*6+D273 -> 26 | G273: 6 | H273: 10 | I273: =G273*6+H273 -> 46 | K273: 9 | L273: 10 | M273: =K273*6+L273 -> 64 | O273: 11 | P273: 15 | Q273: =O273*6+P273 -> 81 | S273: ABBOTT
A274: BEST PLAYERS
A275: WILLIAMSTOWN | D275: LANE | G275: KELLY | J275: FENTON | M275: FANNING | P275: FOX | S275: EVANS
A276: SANDRINGHAM | D276: NICHOLSON | G276: EDWARDS | J276: HUNTER | M276: CLARKE | P276: MURLEY | S276: MACKENZIE
A277: GOALKICKERS
A278: WILLIAMSTOWN | D278: FOX 5 | F278: BOXALL 2 | I278: CROSS | K278: KELLY | M278: L STILLMAN | P278: EVANS
A279: SANDRINGHAM | D279: CLARKE 3 | G279: HUNTER 2 | J279: MURLEY 2 | M279: R MURRAY | O279: DYNON | Q279: COOPER | S279: MURPHY
A281: COBURG | C281: 9 | D281: 3 | E281: =C281*6+D281 -> 57 | G281: 14 | H281: 4 | I281: =G281*6+H281 -> 88 | K281: 22 | L281: 9 | M281: =K281*6+L281 -> 141 | O281: 25 | P281: 10 | Q281: =O281*6+P281 -> 160 | S281: OAKLEIGH
A282: OAKLEIGH | C282: 2 | D282: 1 | E282: =C282*6+D282 -> 13 | G282: 5 | H282: 4 | I282: =G282*6+H282 -> 34 | K282: 6 | L282: 9 | M282: =K282*6+L282 -> 45 | O282: 12 | P282: 14 | Q282: =O282*6+P282 -> 86 | S282: OGSTON
A283: BEST PLAYERS
A284: COBURG | D284: BRENNAN | G284: CLEARY | J284: BEATTIE | M284: ROBINSON | P284: LAKE | S284: LUKE
A285: OAKLEIGH | D285: KING | G285: MURNANE | J285: KUZIMAK | M285: D NESBIT | P285: ROBERTSON | S285: McGRATH
A286: GOALKICKERS
A287: COBURG | D287: SMITH 7 | G287: BEATTIE 6 | J287: GALE 3 | L287: HODGETTS 3 | O287: PAUL 2 | Q287: PITT | R287: LAKE | T287: MORRISON | W287: BRENNAN
A288: OAKLEIGH | D288: TAYLOR 3 | G288: ROBERTSON 2 | J288: KING 2 | L288: O'HALLORAN | O288: MOORE | Q288: WHITE | S288: GAUNT | U288: MURNANE
A290: ROUND 7 | E290: 1ST JUNE | J290: WEATHER | M290: NORTH WEST WIND SHOWERS | S290: PLAYED AT
D291: 1ST QTR | H291: 2ND QTR | L291: 3RD QTR | P291: FINAL | S291: COBURG
A292: GEELONG WEST | C292: 3 | D292: 2 | E292: =C292*6+D292 -> 20 | G292: 5 | H292: 7 | I292: =G292*6+H292 -> 37 | K292: 14 | L292: 17 | M292: =K292*6+L292 -> 101 | O292: 18 | P292: 20 | Q292: =O292*6+P292 -> 128 | S292: UMPIRE | X292: LADDER | AB292: ROUND | AD292: 7
A293: COBURG | C293: 7 | D293: 2 | E293: =C293*6+D293 -> 44 | G293: 11 | H293: 7 | I293: =G293*6+H293 -> 73 | K293: 13 | L293: 11 | M293: =K293*6+L293 -> 89 | O293: 16 | P293: 15 | Q293: =O293*6+P293 -> 111 | S293: WENN
A294: BEST PLAYERS | W294: TEAM | X294: W | Y294: L | Z294: D | AA294: FOR | AB294: AGST | AC294: % | AD294: PTS
A295: GEELONG WEST | D295: GILMORE | G295: BRIGHT | J295: YATES | M295: RADOJEVIC | P295: MANSON | R295: LYNCH
A296: COBURG | D296: P McCARTHY | G296: BEATTIE | J296: LAKE | M296: CLEARY | P296: GALE | R296: MORRISON | W296: GEELONG WEST | X296: 7 | Y296: 0 | Z296: 0 | AA296: 937 | AB296: 613 | AC296: 152.85 | AD296: 28
A297: GOALKICKERS | W297: PORT MELBOURNE | X297: 6 | Y297: 1 | Z297: 0 | AA297: 988 | AB297: 659 | AC297: 149.92412746585737 | AD297: 24
A298: GEELONG WEST | D298: RADOJEVIC 9 | G298: LYNCH 2 | I298: ARKLAY 2 | K298: YATES | M298: HINDSON | O298: HUGHES | Q298: GILMORE | S298: BRIGHT | W298: COBURG | X298: 4 | Y298: 3 | Z298: 0 | AA298: 787 | AB298: 722 | AC298: 109.00277008310249 | AD298: 16
A299: COBURG | D299: SMITH 3 | F299: BEATTIE 3 | I299: HODGETTS 3 | L299: LAKE 2 | N299: CLEARY 2 | Q299: MORRISON 2 | T299: PITT | W299: DANDENONG | X299: 4 | Y299: 3 | Z299: 0 | AA299: 750 | AB299: 707 | AC299: 106.08 | AD299: 16
A301: PRESTON | C301: 4 | D301: 2 | E301: =C301*6+D301 -> 26 | G301: 6 | H301: 7 | I301: =G301*6+H301 -> 43 | K301: 9 | L301: 11 | M301: =K301*6+L301 -> 65 | O301: 16 | P301: 13 | Q301: =O301*6+P301 -> 109 | S301: PORT MELBOURNE | W301: SANDRINGHAM | X301: 3 | Y301: 4 | Z301: 0 | AA301: 744 | AB301: 762 | AC301: 97.637795275590548 | AD301: 12
A302: PORT MELBOURNE | C302: 5 | D302: 6 | E302: =C302*6+D302 -> 36 | G302: 7 | H302: 8 | I302: =G302*6+H302 -> 50 | K302: 10 | L302: 16 | M302: =K302*6+L302 -> 76 | O302: 13 | P302: 21 | Q302: =O302*6+P302 -> 99 | S302: ABBOTT | W302: CAULFIELD | X302: 3 | Y302: 4 | Z302: 0 | AA302: 820 | AB302: 864 | AC302: 94.907407407407405 | AD302: 12
A303: BEST PLAYERS | W303: PRESTON | X303: 3 | Y303: 4 | Z303: 0 | AA303: 707 | AB303: 752 | AC303: 94.015957446808514 | AD303: 12
A304: PRESTON | D304: GRAINGER | G304: LESLIE | I304: ZEMSKI | L304: ZUNNEBERG | O304: PREECE | R304: STEWART | W304: PRAHRAN | X304: 2 | Y304: 5 | Z304: 0 | AA304: 722 | AB304: 899 | AC304: 80.31 | AD304: 8
A305: PORT MELBOURNE | D305: ANDERSON | G305: COOK | I305: HAENAN | L305: DAVIS | O305: HARLAND | R305: OWEN | W305: WILLIAMSTOWN | X305: 2 | Y305: 5 | Z305: 0 | AA305: 683 | AB305: 953 | AC305: 71.67 | AD305: 8
A306: GOALKICKERS | O306: CARLSON | R306: STEWART | W306: OAKLEIGH | X306: 1 | Y306: 6 | Z306: 0 | AA306: 699 | AB306: 906 | AC306: 77.15 | AD306: 4
A307: PRESTON | D307: ZUNNEBERG 4 | G307: MARSHALL 3 | J307: MIDDLETON 2 | M307: JOHNSTON 2 | P307: WEIGHTMAN 2 | S307: McFETRIDGE
A308: PORT MELBOURNE | D308: COOK 5 | F308: HARLAND 2 | I308: BROWN | K308: HOLT | M308: ELLIOTT | O308: HAENAN | Q308: CLARKE | S308: BRINER
A310: SANDRINGHAM | C310: 2 | D310: 3 | E310: =C310*6+D310 -> 15 | G310: 10 | H310: 9 | I310: =G310*6+H310 -> 69 | K310: 19 | L310: 14 | M310: =K310*6+L310 -> 128 | O310: 23 | P310: 18 | Q310: =O310*6+P310 -> 156 | S310: BEACH ROAD
A311: PRAHRAN | C311: 5 | D311: 7 | E311: =C311*6+D311 -> 37 | G311: 6 | H311: 10 | I311: =G311*6+H311 -> 46 | K311: 8 | L311: 14 | M311: =K311*6+L311 -> 62 | O311: 14 | P311: 17 | Q311: =O311*6+P311 -> 101 | S311: MATHEWS
A312: BEST PLAYERS
A313: SANDRINGHAM | D313: LACEY | G313: PASQUILL | J313: NICHOLSON | M313: McNICHOLAS | P313: COOPER | S313: MACKENZIE
A314: PRAHRAN | D314: O'BRIEN | G314: ANDERSON | J314: DICKSON | M314: D'ANGELO | P314: CUNNINGHAM | S314: PAYNE
A315: GOALKICKERS
A316: SANDRINGHAM | D316: COOPER 7 | F316: LACEY 6 | H316: CLARKE 2 | J316: MURPHY 2 | M316: CARROLL | O316: McNICHOLAS | R316: MACKENZIE | U316: NICHOLSON | X316: DYNON | Z316: PASQUILL
A317: PRAHRAN | D317: DICKSON 3 | G317: ANASTASIO 3 | J317: GUNN 2 | L317: JOHNSTON | N317: BIRCH | P317: SMITH | R317: CUNNINGHAM | V317: ANDERSON | X317: KENT
A319: CAULFIELD | C319: 5 | D319: 7 | E319: =C319*6+D319 -> 37 | G319: 11 | H319: 8 | I319: =G319*6+H319 -> 74 | K319: 17 | L319: 16 | M319: =K319*6+L319 -> 118 | O319: 22 | P319: 25 | Q319: =O319*6+P319 -> 157 | S319: PRINCES PARK
A320: WILLIAMSTOWN | C320: 7 | D320: 1 | E320: =C320*6+D320 -> 43 | G320: 10 | H320: 4 | I320: =G320*6+H320 -> 64 | K320: 15 | L320: 10 | M320: =K320*6+L320 -> 100 | O320: 19 | P320: 14 | Q320: =O320*6+P320 -> 128 | S320: MARCY
A321: BEST PLAYERS
A322: CAULFIELD | D322: JACKS | G322: BOOTH | J322: HAYWOOD | M322: EINSEDEL | P322: BALL | S322: FRIGO
A323: WILLIAMSTOWN | D323: PERRY | G323: FOX | J323: RICHARDS | M323: SCOTT | P323: KELLY
A324: GOALKICKERS
A325: CAULFIELD | D325: MILNER 4 | F325: BOOTH 4 | H325: JACKS 3 | J325: HOCKING 3 | M325: HUNT 2 | O325: LOGAN 2 | Q325: HAYWOOD | S325: CLIFF | U325: SMITH | W325: RICHARDS
A326: WILLIAMSTOWN | D326: RICHARDS 6 | G326: FOX 5 | I326: L STILLMAN 3 | L326: BOXALL 3 | N326: SCOTT | P326: PERRY
A328: DANDENONG | C328: 6 | D328: 3 | E328: =C328*6+D328 -> 39 | G328: 10 | H328: 5 | I328: =G328*6+H328 -> 65 | K328: 12 | L328: 14 | M328: =K328*6+L328 -> 86 | O328: 15 | P328: 15 | Q328: =O328*6+P328 -> 105 | S328: DANDENONG
A329: OAKLEIGH | C329: 4 | D329: 2 | E329: =C329*6+D329 -> 26 | G329: 7 | H329: 8 | I329: =G329*6+H329 -> 50 | K329: 8 | L329: 9 | M329: =K329*6+L329 -> 57 | O329: 12 | P329: 9 | Q329: =O329*6+P329 -> 81 | S329: DAVIS
A330: BEST PLAYERS
A331: DANDENONG | D331: HARRINGTON | G331: HARPER | J331: HOLDEN | M331: SHEVLIN | O331: SHINNERS | R331: MELAI
A332: OAKLEIGH | D332: CHISHOLM | G332: GAUNT | J332: SMITH | M332: D NESBIT | O332: ROBERTSON | R332: KING
A333: GOALKICKERS
A334: DANDENONG | D334: MILLER 4 | G334: MADDEN 3 | J334: PAYZE 3 | M334: BRIESE 2 | O334: HARRINGTON 2 | R334: HOLDEN
A335: OAKLEIGH | D335: ROBERTSON 4 | G335: MOORE 2 | I335: O'HALLORAN | L335: KING | N335: TAYLOR | P335: MURNANE | R335: QUINN | T335: TOOHEY
A337: ROUND 8 | E337: 8TH JUNE | J337: WEATHER | N337: NORTH WIND | S337: PLAYED AT
D338: 1ST QTR | H338: 2ND QTR | L338: 3RD QTR | P338: FINAL | S338: BEACH ROAD
A339: COBURG | C339: 4 | D339: 1 | E339: =C339*6+D339 -> 25 | G339: 8 | H339: 7 | I339: =G339*6+H339 -> 55 | K339: 13 | L339: 13 | M339: =K339*6+L339 -> 91 | O339: 19 | P339: 16 | Q339: =O339*6+P339 -> 130 | S339: UMPIRE | X339: LADDER | AB339: ROUND | AD339: 8
A340: SANDRINGHAM | C340: 1 | D340: 7 | E340: =C340*6+D340 -> 13 | G340: 4 | H340: 10 | I340: =G340*6+H340 -> 34 | K340: 8 | L340: 16 | M340: =K340*6+L340 -> 64 | O340: 12 | P340: 18 | Q340: =O340*6+P340 -> 90 | S340: O'BRIEN
A341: BEST PLAYERS | W341: TEAM | X341: W | Y341: L | Z341: D | AA341: FOR | AB341: AGST | AC341: % | AD341: PTS
A342: COBURG | D342: ROBINSON | G342: HODGETTS | J342: BEATTIE | M342: MANNIX | P342: BURT | S342: LAKE
A343: SANDRINGHAM | D343: DYNON | G343: EDWARDS | J343: BRENNER | M343: MACKENZIE | P343: NICHOLSON | S343: PASQUILL | W343: GEELONG WEST | X343: 8 | Y343: 0 | Z343: 0 | AA343: 1048 | AB343: 722 | AC343: 145.15 | AD343: 32
A344: GOALKICKERS | W344: PORT MELBOURNE | X344: 7 | Y344: 1 | Z344: 0 | AA344: 1108 | AB344: 725 | AC344: 152.83 | AD344: 28
A345: COBURG | D345: HODGETTS 6 | G345: BEATTIE 5 | J345: SMITH 4 | M345: PAUL 2 | O345: MANNIX | Q345: LAKE | W345: COBURG | X345: 5 | Y345: 3 | Z345: 0 | AA345: 917 | AB345: 812 | AC345: 112.93103448275862 | AD345: 20
A346: SANDRINGHAM | D346: COOPER 4 | G346: DYNON 3 | J346: MACKENZIE | M346: GREEN | O346: MURPHY | Q346: LACEY | S346: PASQUILL | W346: DANDENONG | X346: 5 | Y346: 3 | Z346: 0 | AA346: 883 | AB346: 792 | AC346: 111.49 | AD346: 20
A348: GEELONG WEST | C348: 7 | D348: 3 | E348: =C348*6+D348 -> 45 | G348: 11 | H348: 6 | I348: =G348*6+H348 -> 72 | K348: 16 | L348: 12 | M348: =K348*6+L348 -> 108 | O348: 16 | P348: 15 | Q348: =O348*6+P348 -> 111 | S348: PRESTON | W348: PRESTON | X348: 3 | Y348: 5 | Z348: 0 | AA348: 816 | AB348: 863 | AC348: 94.553881807647741 | AD348: 12
A349: PRESTON | C349: 5 | D349: 1 | E349: =C349*6+D349 -> 31 | G349: 9 | H349: 3 | I349: =G349*6+H349 -> 57 | K349: 13 | L349: 6 | M349: =K349*6+L349 -> 84 | O349: 16 | P349: 13 | Q349: =O349*6+P349 -> 109 | S349: CARLISLE | W349: SANDRINGHAM | X349: 3 | Y349: 5 | Z349: 0 | AA349: 834 | AB349: 892 | AC349: 93.497757847533634 | AD349: 12
A350: BEST PLAYERS | W350: CAULFIELD | X350: 3 | Y350: 5 | Z350: 0 | AA350: 905 | AB350: 997 | AC350: 90.772316950852556 | AD350: 12
A351: GEELONG WEST | D351: MANSON | G351: GILMORE | J351: SMITH | M351: LYNCH | P351: WELLS | W351: PRAHRAN | X351: 3 | Y351: 5 | Z351: 0 | AA351: 823 | AB351: 992 | AC351: 82.96 | AD351: 12
A352: PRESTON | D352: WEIGHTMAN | G352: ZUNNEBERG | J352: GRAINGER | M352: PREECE | P352: JOHNSTON | W352: WILLIAMSTOWN | X352: 2 | Y352: 6 | Z352: 0 | AA352: 776 | AB352: 1054 | AC352: 73.62 | AD352: 8
A353: GOALKICKERS | R353: BRIGHT | W353: OAKLEIGH | X353: 1 | Y353: 7 | Z353: 0 | AA353: 765 | AB353: 1026 | AC353: 74.56 | AD353: 4
A354: GEELONG WEST | D354: RADOJEVIC 4 | G354: LYNCH 3 | I354: MANSON 2 | L354: HINDSON 2 | O354: WELLS 2 | Q354: YATES | S354: GILMORE
A355: PRESTON | D355: ZUNNEBERG 7 | G355: MIDLETON 3 | J355: JOHNSTON 2 | M355: MARSHALL | O355: IRELAND | Q355: WEIGHTMAN | T355: PETTIGREW
A357: DANDENONG | C357: 7 | D357: 5 | E357: =C357*6+D357 -> 47 | G357: 12 | H357: 8 | I357: =G357*6+H357 -> 80 | K357: 13 | L357: 9 | M357: =K357*6+L357 -> 87 | O357: 19 | P357: 19 | Q357: =O357*6+P357 -> 133 | S357: DANDENONG
A358: CAULFIELD | C358: 3 | D358: 7 | E358: =C358*6+D358 -> 25 | G358: 4 | H358: 8 | I358: =G358*6+H358 -> 32 | K358: 10 | L358: 11 | M358: =K358*6+L358 -> 71 | O358: 12 | P358: 13 | Q358: =O358*6+P358 -> 85 | S358: ABBOTT
A359: BEST PLAYERS
A360: DANDENONG | D360: MELAI | G360: HARPER | J360: SHEVLIN | M360: PAYZE | O360: HARRINGTON | R360: BRIESE
A361: CAULFIELD | D361: EINSEDEL | G361: GLAZNER | J361: BOOTH | M361: MILNER | O361: JACKS | R361: BALL
A362: GOALKICKERS
A363: DANDENONG | D363: MILLER 5 | G363: BRIESE 3 | I363: ORCHARD 3 | L363: MELAI 2 | N363: REID | P363: FLAHERTY | R363: PAYZE | T363: MORAN | V363: SHINNERS | X363: MADDEN
A364: CAULFIELD | D364: MILNER 3 | G364: BOOTH 3 | I364: LOGAN 2 | L364: MAGUIRE | N364: SMITH | P364: JACKS | R364: HOCKING
A366: PRAHRAN | C366: 5 | D366: 5 | E366: =C366*6+D366 -> 35 | G366: 8 | H366: 8 | I366: =G366*6+H366 -> 56 | K366: 12 | L366: 14 | M366: =K366*6+L366 -> 86 | O366: 14 | P366: 17 | Q366: =O366*6+P366 -> 101 | S366: TOORAK PARK
A367: WILLIAMSTOWN | C367: 2 | D367: 5 | E367: =C367*6+D367 -> 17 | G367: 9 | H367: 7 | I367: =G367*6+H367 -> 61 | K367: 11 | L367: 10 | M367: =K367*6+L367 -> 76 | O367: 13 | P367: 15 | Q367: =O367*6+P367 -> 93 | S367: HUGGINS
A368: BEST PLAYERS
A369: PRAHRAN | D369: PAYNE | G369: TOWNSEND | J369: CUNNINGHAM | M369: D'ANGELO | P369: KENT | R369: ANDERSON
A370: WILLIAMSTOWN | D370: PERRY | G370: FENTON | J370: KELLY | M370: TWEEDLY | P370: VINEY
A371: GOALKICKERS
A372: PRAHRAN | D372: JOHNSTON 4 | G372: ANASTASIO 4 | J372: DICKSON 2 | M372: TOWNSEND 2 | P372: PAYNE | R372: KENT
A373: WILLIAMSTOWN | D373: KELLY 3 | G373: HYNES 3 | I373: SCOTT 2 | K373: G RICHARDS 2 | N373: N STILLMAN 2 | Q373: FANNING
A375: PORT MELBOURNE | C375: 3 | D375: 4 | E375: =C375*6+D375 -> 22 | G375: 10 | H375: 8 | I375: =G375*6+H375 -> 68 | K375: 14 | L375: 17 | M375: =K375*6+L375 -> 101 | O375: 16 | P375: 24 | Q375: =O375*6+P375 -> 120 | S375: PORT MELBOURNE
A376: OAKLEIGH | C376: 3 | D376: 2 | E376: =C376*6+D376 -> 20 | G376: 3 | H376: 6 | I376: =G376*6+H376 -> 24 | K376: 7 | L376: 8 | M376: =K376*6+L376 -> 50 | O376: 9 | P376: 12 | Q376: =O376*6+P376 -> 66 | S376: STABB
A377: BEST PLAYERS
A378: PORT MELBOURNE | D378: MOLLOY | G378: HOLT | J378: OWEN | M378: HAENAN | P378: DAVIES | S378: CRITCH
A379: OAKLEIGH | D379: CHISHOLM | G379: C NESBIT | J379: ELLIOTT | M379: TAYLOR | P379: WENN | S379: STEWART
A380: GOALKICKERS
A381: PORT MELBOURNE | D381: HOLT 7 | G381: COOK 3 | I381: R CRITCH 2 | L381: BROWN | N381: CLARK | P381: DAVIES | R381: DALEY
A382: OAKLEIGH | D382: GOODMAN 3 | G382: ROBERTSON 3 | J382: SMITH | L382: WHITE | N382: KING
A384: ROUND 9 | D384: 15TH JUNE | I384: WEATHER | S384: PLAYED AT
D385: 1ST QTR | H385: 2ND QTR | L385: 3RD QTR | P385: FINAL | S385: GEELONG WEST
A386: GEELONG WEST | C386: 4 | D386: 1 | E386: =C386*6+D386 -> 25 | G386: 5 | H386: 9 | I386: =G386*6+H386 -> 39 | K386: 10 | L386: 11 | M386: =K386*6+L386 -> 71 | O386: 15 | P386: 18 | Q386: =O386*6+P386 -> 108 | S386: UMPIRE | X386: LADDER | AB386: ROUND | AD386: 9
A387: PORT MELBOURNE | C387: 4 | D387: 5 | E387: =C387*6+D387 -> 29 | G387: 6 | H387: 8 | I387: =G387*6+H387 -> 44 | K387: 9 | L387: 13 | M387: =K387*6+L387 -> 67 | O387: 10 | P387: 15 | Q387: =O387*6+P387 -> 75 | S387: HUGGINS
A388: BEST PLAYERS | W388: TEAM | X388: W | Y388: L | Z388: D | AA388: FOR | AB388: AGST | AC388: % | AD388: PTS
A389: GEELONG WEST | D389: MANSON | G389: RUSSELL | I389: LYNCH | L389: YATES | O389: STOKES | R389: GILLIES
A390: PORT MELBOURNE | D390: HARLAND | G390: HOLT | I390: CRITCH | L390: ANDERSON | O390: WHARTON | R390: HERROD | W390: GEELONG WEST | X390: 9 | Y390: 0 | Z390: 0 | AA390: 1156 | AB390: 797 | AC390: 145.04 | AD390: 36
A391: GOALKICKERS | W391: PORT MELBOURNE | X391: 7 | Y391: 2 | Z391: 0 | AA391: 1183 | AB391: 833 | AC391: 142.02 | AD391: 28
A392: GEELONG WEST | D392: RADOJEVIC 4 | G392: LYNCH 4 | I392: VAN ELDEN 2 | L392: WELLS 2 | N392: YATES | P392: ARKLAY | R392: BRIGHT | W392: COBURG | X392: 6 | Y392: 3 | Z392: 0 | AA392: 1037 | AB392: 895 | AC392: 115.8659217877095 | AD392: 24
A393: PORT MELBOURNE | D393: COOK 5 | G393: HOLT 3 | I393: FORD | K393: DALEY | W393: DANDENONG | X393: 6 | Y393: 3 | Z393: 0 | AA393: 972 | AB393: 878 | AC393: 110.71 | AD393: 24
A395: PRESTON | C395: 4 | D395: 8 | E395: =C395*6+D395 -> 32 | G395: 5 | H395: 10 | I395: =G395*6+H395 -> 40 | K395: 10 | L395: 16 | M395: =K395*6+L395 -> 76 | O395: 15 | P395: 21 | Q395: =O395*6+P395 -> 111 | S395: WILLIAMSTOWN | W395: PRESTON | X395: 4 | Y395: 5 | Z395: 0 | AA395: 927 | AB395: 949 | AC395: 97.681770284510009 | AD395: 16
A396: WILLIAMSTOWN | C396: 2 | D396: 5 | E396: =C396*6+D396 -> 17 | G396: 9 | H396: 14 | I396: =G396*6+H396 -> 68 | K396: 10 | L396: 16 | M396: =K396*6+L396 -> 76 | O396: 11 | P396: 20 | Q396: =O396*6+P396 -> 86 | S396: OGSTON | W396: SANDRINGHAM | X396: 3 | Y396: 6 | Z396: 0 | AA396: 905 | AB396: 970 | AC396: 93.298969072164951 | AD396: 12
A397: BEST PLAYERS | W397: CAULFIELD | X397: 3 | Y397: 6 | Z397: 0 | AA397: 988 | AB397: 1117 | AC397: 88.451208594449412 | AD397: 12
A398: PRESTON | D398: ZEMSKI | G398: MARSHALL | J398: JOHNSTON | M398: ZUNNEBERG | P398: GRAINGER | R398: WEIGHTMAN | W398: PRAHRAN | X398: 3 | Y398: 6 | Z398: 0 | AA398: 909 | AB398: 1081 | AC398: 84.09 | AD398: 12
A399: WILLIAMSTOWN | D399: PERRY | G399: THOMPSON | J399: SCOTT | M399: DENTON | P399: GARDNER | W399: OAKLEIGH | X399: 2 | Y399: 7 | Z399: 0 | AA399: 843 | AB399: 1097 | AC399: 76.85 | AD399: 8
A400: GOALKICKERS | R400: GRAINGER | W400: WILLIAMSTOWN | X400: 2 | Y400: 7 | Z400: 0 | AA400: 862 | AB400: 1165 | AC400: 73.99 | AD400: 8
A401: PRESTON | D401: ZUNNEBERG 4 | G401: SMITH 2 | I401: MIDDLETON 2 | L401: IRELAND 2 | N401: MARSHALL 2 | Q401: JOHNSTON | S401: WEIGHTMAN
A402: WILLIAMSTOWN | D402: FOX 3 | G402: GARDNER 3 | J402: FANNING 2 | M402: SCOTT 2 | O402: THOMPSON
E403: 22ND JUNE | J403: WEATHER | N403: SOUTH EAST WIND
A404: COBURG | C404: 4 | D404: 4 | E404: =C404*6+D404 -> 28 | G404: 8 | H404: 8 | I404: =G404*6+H404 -> 56 | K404: 12 | L404: 14 | M404: =K404*6+L404 -> 86 | O404: 17 | P404: 18 | Q404: =O404*6+P404 -> 120 | S404: COBURG
A405: CAULFIELD | C405: 3 | D405: 5 | E405: =C405*6+D405 -> 23 | G405: 7 | H405: 8 | I405: =G405*6+H405 -> 50 | K405: 8 | L405: 12 | M405: =K405*6+L405 -> 60 | O405: 11 | P405: 17 | Q405: =O405*6+P405 -> 83 | S405: TORNEY
A406: BEST PLAYERS
A407: COBURG | D407: LAKE | G407: GALE | I407: SMITH | L407: HODGETTS | O407: MANNIX | R407: BEATTIE
A408: CAULFIELD | D408: CLIFF | G408: BALL | I408: EINSEDEL | L408: BOOTH | O408: GLAZNER | R408: MILNER
A409: GOALKICKERS
A410: COBURG | D410: HODGETTS 5 | G410: SMITH 3 | I410: GALE 3 | K410: HOWELL 2 | N410: BEATTIE 2 | Q410: LAKE | R410: PAUL
A411: CAULFIELD | D411: BRUCE 3 | G411: HAWKING 2 | J411: MILNER 2 | M411: CLIFF | O411: GOODEN | Q411: JACKS | S411: McFARLANE
A413: DANDENONG | C413: 4 | D413: 4 | E413: =C413*6+D413 -> 28 | G413: 8 | H413: 8 | I413: =G413*6+H413 -> 56 | K413: 11 | L413: 13 | M413: =K413*6+L413 -> 79 | O413: 12 | P413: 17 | Q413: =O413*6+P413 -> 89 | S413: TOORAK PARK
A414: PRAHRAN | C414: 3 | D414: 3 | E414: =C414*6+D414 -> 21 | G414: 5 | H414: 5 | I414: =G414*6+H414 -> 35 | K414: 7 | L414: 12 | M414: =K414*6+L414 -> 54 | O414: 12 | P414: 14 | Q414: =O414*6+P414 -> 86 | S414: HAYES
A415: BEST PLAYERS
A416: DANDENONG | D416: BRIESE | G416: MELAI | J416: SHEVLIN | M416: REID | O416: MORAN | R416: HARRINGTON
A417: PRAHRAN | D417: RIMMINGTON | G417: WILKIE | J417: ANDERSON | M417: McFAULL | O417: CULPIN | R417: PAYNE
A418: GOALKICKERS
A419: DANDENONG | D419: BRIESE 3 | G419: MORAN 3 | J419: MILLER 2 | M419: MEYERS | O419: FLAHERTY | R419: MELAI | T419: WALKER
A420: PRAHRAN | D420: ANASTASIO 4 | G420: PAYNE 3 | I420: DICKSON 2 | L420: GUNN 2 | N420: KENT
A422: OAKLEIGH | C422: 0 | D422: 1 | E422: =C422*6+D422 -> 1 | G422: 5 | H422: 5 | I422: =G422*6+H422 -> 35 | K422: 6 | L422: 8 | M422: =K422*6+L422 -> 44 | O422: 11 | P422: 12 | Q422: =O422*6+P422 -> 78 | S422: OAKLEIGH
A423: SANDRINGHAM | C423: 1 | D423: 4 | E423: =C423*6+D423 -> 10 | G423: 5 | H423: 7 | I423: =G423*6+H423 -> 37 | K423: 9 | L423: 11 | M423: =K423*6+L423 -> 65 | O423: 10 | P423: 11 | Q423: =O423*6+P423 -> 71 | S423: ABBOTT
A424: BEST PLAYERS
A425: OAKLEIGH | D425: SMITH | G425: NISBET | J425: BECK | M425: CHISHOLM | P425: KING | S425: ROBERTSON
A426: SANDRINGHAM | D426: GIBSON | G426: BRENNER | J426: EDWARDS | M426: LIDDELL | P426: NICHOLSON | S426: PASQUILL
A427: GOALKICKERS
A428: OAKLEIGH | D428: KING 3 | G428: MURNANE 2 | J428: WENN 2 | L428: ELLIOTT 2 | O428: BECK | Q428: ROBERTSON
A429: SANDRINGHAM | D429: LACEY 2 | G429: CLARKE 2 | J429: BROWNE | L429: NICHOLSON | O429: PETERS | Q429: COOPER | S429: HUNTER | U429: PASQUILL
A431: ROUND 10 | E431: 29TH JUNE | J431: WEATHER | N431: NORTH WIND | S431: PLAYED AT
D432: 1ST QTR | H432: 2ND QTR | L432: 3RD QTR | P432: FINAL | S432: DANDENONG
A433: DANDENONG | C433: 3 | D433: 2 | E433: =C433*6+D433 -> 20 | G433: 5 | H433: 7 | I433: =G433*6+H433 -> 37 | K433: 8 | L433: 8 | M433: =K433*6+L433 -> 56 | O433: 14 | P433: 16 | Q433: =O433*6+P433 -> 100 | S433: UMPIRE | X433: LADDER | AB433: ROUND | AD433: 10
A434: PORT MELBOURNE | C434: 5 | D434: 8 | E434: =C434*6+D434 -> 38 | G434: 6 | H434: 11 | I434: =G434*6+H434 -> 47 | K434: 9 | L434: 18 | M434: =K434*6+L434 -> 72 | O434: 10 | P434: 21 | Q434: =O434*6+P434 -> 81 | S434: WENN
A435: BEST PLAYERS | W435: TEAM | X435: W | Y435: L | Z435: D | AA435: FOR | AB435: AGST | AC435: % | AD435: PTS
A436: DANDENONG | D436: TRUEMAN | G436: HARRINGTON | J436: REID | M436: CASTRICUM | P436: SHEVLIN | R436: FLAHERTY
A437: PORT MELBOURNE | D437: OWEN | G437: ANDERSON | J437: CRITCH | M437: WHARTON | P437: HERROD | R437: BROWN | W437: GEELONG WEST | X437: 9 | Y437: 1 | Z437: 0 | AA437: 1261 | AB437: 909 | AC437: 138.72 | AD437: 36
A438: GOALKICKERS | W438: PORT MELBOURNE | X438: 7 | Y438: 3 | Z438: 0 | AA438: 1264 | AB438: 933 | AC438: 135.48 | AD438: 28
A439: DANDENONG | D439: FLAHERTY 4 | G439: BRIESE 2 | I439: MILLER 2 | K439: ORCHARD 2 | N439: DROSCHER | Q439: PAYZE | R439: MORAN | T439: MELAI | W439: COBURG | X439: 7 | Y439: 3 | Z439: 0 | AA439: 1186 | AB439: 972 | AC439: 122.02 | AD439: 28
A440: PORT MELBOURNE | D440: COOK 4 | G440: WHARTON 4 | J440: OWEN | L440: BOND | W440: DANDENONG | X440: 7 | Y440: 3 | Z440: 0 | AA440: 1072 | AB440: 959 | AC440: 111.78 | AD440: 28
A442: SANDRINGHAM | C442: 4 | D442: 8 | E442: =C442*6+D442 -> 32 | G442: 6 | H442: 9 | I442: =G442*6+H442 -> 45 | K442: 10 | L442: 11 | M442: =K442*6+L442 -> 71 | O442: 14 | P442: 12 | Q442: =O442*6+P442 -> 96 | S442: BEACH ROAD | W442: PRESTON | X442: 4 | Y442: 6 | Z442: 0 | AA442: 1003 | AB442: 1045 | AC442: 95.980861244019138 | AD442: 16
A443: PRESTON | C443: 1 | D443: 2 | E443: =C443*6+D443 -> 8 | G443: 4 | H443: 7 | I443: =G443*6+H443 -> 31 | K443: 7 | L443: 11 | M443: =K443*6+L443 -> 53 | O443: 10 | P443: 16 | Q443: =O443*6+P443 -> 76 | S443: HUGGINS | W443: SANDRINGHAM | X443: 4 | Y443: 6 | Z443: 0 | AA443: 1001 | AB443: 1046 | AC443: 95.697896749521988 | AD443: 16
A444: BEST PLAYERS | W444: PRAHRAN | X444: 4 | Y444: 6 | Z444: 0 | AA444: 1018 | AB444: 1154 | AC444: 88.21 | AD444: 16
A445: SANDRINGHAM | D445: HUTCHINSON | G445: MACKENZIE | J445: BROWNE | M445: EDWARDS | P445: HUNTER | R445: GIBSON | W445: CAULFIELD | X445: 3 | Y445: 7 | Z445: 0 | AA445: 1061 | AB445: 1226 | AC445: 86.541598694942905 | AD445: 12
A446: PRESTON | D446: ZEMSKI | G446: STEWART | J446: WEIGHTMAN | M446: MARSHALL | P446: SMITH | R446: WATT | W446: OAKLEIGH | X446: 3 | Y446: 7 | Z446: 0 | AA446: 955 | AB446: 1202 | AC446: 79.4 | AD446: 12
A447: GOALKICKERS | W447: WILLIAMSTOWN | X447: 2 | Y447: 8 | Z447: 0 | AA447: 939 | AB447: 1314 | AC447: 71.46 | AD447: 8
A448: SANDRINGHAM | D448: COOPER 4 | F448: PASQUILL 3 | I448: LACEY | K448: MURLEY | M448: GIBSON | O448: HUNTER | Q448: KNOX | R448: FETTES | T448: HUTCHINSON
A449: PRESTON | D449: MARSHALL 2 | G449: ZUNNEBERG 2 | J449: WEIGHTMAN 2 | N449: McFETRIDGE | Q449: NEWTON | S449: PREECE | U449: IRELAND
A451: PRAHRAN | C451: 2 | D451: 2 | E451: =C451*6+D451 -> 14 | G451: 5 | H451: 5 | I451: =G451*6+H451 -> 35 | K451: 13 | L451: 12 | M451: =K451*6+L451 -> 90 | O451: 16 | P451: 13 | Q451: =O451*6+P451 -> 109 | S451: PRINCES PARK
A452: CAULFIELD | C452: 2 | D452: 4 | E452: =C452*6+D452 -> 16 | G452: 4 | H452: 10 | I452: =G452*6+H452 -> 34 | K452: 4 | L452: 13 | M452: =K452*6+L452 -> 37 | O452: 9 | P452: 19 | Q452: =O452*6+P452 -> 73 | S452: MARCY
A453: BEST PLAYERS
A454: PRAHRAN | D454: TOWNSEND | G454: EMSELLE | J454: McGUINNESS | M454: RIMMINGTON | P454: WILKIE | S454: CUNNINGHAM
A455: CAULFIELD | D455: EINSEDEL | G455: HAYWOOD | J455: MAGUIRE | M455: QUIST | P455: BALL | S455: JACKS
A456: GOALKICKERS
A457: PRAHRAN | D457: ANASTASIO 5 | G457: TOWNSEND 4 | J457: APPLETON 2 | M457: SMITH 2 | O457: EMSELLE | Q457: DICKSON | S457: PAYNE
A458: CAULFIELD | D458: BROWN 2 | G458: MILNER 2 | I458: DONALDSON 2 | L458: CLIFF | N458: RICHARDS | Q458: BOOTH
A460: COBURG | C460: 7 | D460: 10 | E460: =C460*6+D460 -> 52 | G460: 9 | H460: 14 | I460: =G460*6+H460 -> 68 | K460: 18 | L460: 20 | M460: =K460*6+L460 -> 128 | O460: 21 | P460: 23 | Q460: =O460*6+P460 -> 149 | S460: COBURG
A461: WILLIAMSTOWN | C461: 2 | D461: 3 | E461: =C461*6+D461 -> 15 | G461: 5 | H461: 6 | I461: =G461*6+H461 -> 36 | K461: 9 | L461: 7 | M461: =K461*6+L461 -> 61 | O461: 11 | P461: 11 | Q461: =O461*6+P461 -> 77 | S461: HAYES
A462: BEST PLAYERS
A463: COBURG | D463: GALE | G463: LAKE | J463: MANNIX | M463: BEATTIE | P463: HOWELL | S463: L STILLMAN
A464: WILLIAMSTOWN | D464: FANNING | G464: SCOTT | J464: BOYD | M464: PAGE
A465: GOALKICKERS
A466: COBURG | D466: SMITH 4 | F466: BEATTIE 4 | I466: HODGETTS 3 | L466: HOWELL | N466: L STILLMAN | Q466: PAUL | R466: MANNIX | U466: HOBBS | W466: MORRISON | X466: GALE | Z466: LAKE
A467: WILLIAMSTOWN | D467: FOX 3 | G467: FANNING 2 | J467: S McCARTHY 2 | N467: LUKE 2 | P467: SCOTT | R467: N STILLMAN
A469: OAKLEIGH | C469: 5 | D469: 3 | E469: =C469*6+D469 -> 33 | G469: 6 | H469: 3 | I469: =G469*6+H469 -> 39 | K469: 11 | L469: 7 | M469: =K469*6+L469 -> 73 | O469: 17 | P469: 10 | Q469: =O469*6+P469 -> 112 | S469: OAKLEIGH
A470: GEELONG WEST | C470: 4 | D470: 1 | E470: =C470*6+D470 -> 25 | G470: 8 | H470: 5 | I470: =G470*6+H470 -> 53 | K470: 12 | L470: 6 | M470: =K470*6+L470 -> 78 | O470: 16 | P470: 9 | Q470: =O470*6+P470 -> 105 | S470: OAKLEY
A471: BEST PLAYERS
A472: OAKLEIGH | D472: KING | G472: GAUNT | J472: WENN | M472: BECK | P472: MURNANE | R472: GOODMAN
A473: GEELONG WEST | D473: KLINE | G473: MANSON | J473: LYNCH | M473: RADOJEVIC | P473: BRIGHT
A474: GOALKICKERS
A475: OAKLEIGH | D475: MURNANE 5 | G475: WENN 3 | I475: TAYLOR 3 | L475: ELLIOTT 3 | O475: GAUNT | Q475: KING | R475: ROBERTSON
A476: GEELONG WEST | D476: RADOJEVIC 8 | G476: BRIGHT 2 | I476: WELLS 2 | K476: LYNCH | M476: MANSON | O476: WOOLFE | Q476: BUGGY
A478: ROUND 11 | E478: 7TH JULY | J478: WEATHER | N478: NORTH WIND WET | S478: PLAYED AT
D479: 1ST QTR | H479: 2ND QTR | L479: 3RD QTR | P479: FINAL | S479: GEELONG WEST
A480: GEELONG WEST | C480: 3 | D480: 8 | E480: =C480*6+D480 -> 26 | G480: 5 | H480: 12 | I480: =G480*6+H480 -> 42 | K480: 10 | L480: 14 | M480: =K480*6+L480 -> 74 | O480: 12 | P480: 16 | Q480: =O480*6+P480 -> 88 | S480: UMPIRE | X480: LADDER | AB480: ROUND | AD480: 11
A481: DANDENONG | C481: 1 | D481: 0 | E481: =C481*6+D481 -> 6 | G481: 6 | H481: 2 | I481: =G481*6+H481 -> 38 | K481: 7 | L481: 6 | M481: =K481*6+L481 -> 48 | O481: 12 | P481: 9 | Q481: =O481*6+P481 -> 81 | S481: TORNEY
A482: BEST PLAYERS | W482: TEAM | X482: W | Y482: L | Z482: D | AA482: FOR | AB482: AGST | AC482: % | AD482: PTS
A483: GEELONG WEST | D483: MANSON | G483: SMITH | J483: STOKES | M483: RADOJEVIC | P483: GILMORE
A484: DANDENONG | D484: ORCHARD | G484: FLAHERTY | J484: TRUEMAN | M484: MELAI | P484: HOLDEN | W484: GEELONG WEST | X484: 10 | Y484: 1 | Z484: 0 | AA484: 1349 | AB484: 990 | AC484: 136.26 | AD484: 40
A485: GOALKICKERS | W485: PORT MELBOURNE | X485: 8 | Y485: 3 | Z485: 0 | AA485: 1412 | AB485: 1021 | AC485: 138.3 | AD485: 32
A486: GEELONG WEST | D486: RADOJEVIC 8 | G486: DUNNE | I486: STOKES | K486: WELLS | M486: VAN ELDEN | W486: COBURG | X486: 7 | Y486: 4 | Z486: 0 | AA486: 1300 | AB486: 1089 | AC486: 119.38 | AD486: 28
A487: DANDENONG | D487: MILLER 4 | G487: ORCHARD 2 | J487: FLAHERTY 2 | M487: HOLDEN 2 | P487: HARPER | R487: MELAI | W487: DANDENONG | X487: 7 | Y487: 4 | Z487: 0 | AA487: 1153 | AB487: 1047 | AC487: 110.12 | AD487: 28
A489: PORT MELBOURNE | C489: 5 | D489: 4 | E489: =C489*6+D489 -> 34 | G489: 10 | H489: 13 | I489: =G489*6+H489 -> 73 | K489: 15 | L489: 21 | M489: =K489*6+L489 -> 111 | O489: 20 | P489: 28 | Q489: =O489*6+P489 -> 148 | S489: PORT MELBOURNE | W489: PRAHRAN | X489: 5 | Y489: 6 | Z489: 0 | AA489: 1135 | AB489: 1268 | AC489: 89.51 | AD489: 20
A490: SANDRINGHAM | C490: 3 | D490: 5 | E490: =C490*6+D490 -> 23 | G490: 8 | H490: 5 | I490: =G490*6+H490 -> 53 | K490: 10 | L490: 7 | M490: =K490*6+L490 -> 67 | O490: 13 | P490: 10 | Q490: =O490*6+P490 -> 88 | S490: OGSTON | W490: PRESTON | X490: 4 | Y490: 7 | Z490: 0 | AA490: 1125 | AB490: 1174 | AC490: 95.826235093696766 | AD490: 16
A491: BEST PLAYERS | W491: SANDRINGHAM | X491: 4 | Y491: 7 | Z491: 0 | AA491: 1089 | AB491: 1194 | AC491: 91.21 | AD491: 16
A492: PORT MELBOURNE | D492: MOLLOY | G492: HERROD | J492: DOYLE | M492: HAENAN | P492: COOK | S492: GOSS | W492: CAULFIELD | X492: 4 | Y492: 7 | Z492: 0 | AA492: 1190 | AB492: 1348 | AC492: 88.278931750741833 | AD492: 16
A493: SANDRINGHAM | D493: EDWARDS | G493: BROWNE | J493: LIDDELL | M493: FETTES | P493: MACKENZIE | S493: COOPER | W493: OAKLEIGH | X493: 4 | Y493: 7 | Z493: 0 | AA493: 1074 | AB493: 1286 | AC493: 83.51 | AD493: 16
A494: GOALKICKERS | R494: HOLT | W494: WILLIAMSTOWN | X494: 2 | Y494: 9 | Z494: 0 | AA494: 1023 | AB494: 1433 | AC494: 71.39 | AD494: 8
A495: PORT MELBOURNE | D495: COOK 7 | G495: DOYLE 3 | I495: WHARTON 3 | L495: GOSS 2 | N495: STREETE | P495: CRITCH | R495: HERROD | T495: BROWN
A496: SANDRINGHAM | D496: COOPER 4 | G496: PASQUILL 3 | J496: LACEY 3 | M496: KNOX | O496: HUTHINSON | R496: CLARKE | T496: HUNTER
A498: PRAHRAN | C498: 3 | D498: 1 | E498: =C498*6+D498 -> 19 | G498: 10 | H498: 3 | I498: =G498*6+H498 -> 63 | K498: 15 | L498: 7 | M498: =K498*6+L498 -> 97 | O498: 18 | P498: 9 | Q498: =O498*6+P498 -> 117 | S498: TOORAK PARK
A499: COBURG | C499: 6 | D499: 8 | E499: =C499*6+D499 -> 44 | G499: 8 | H499: 12 | I499: =G499*6+H499 -> 60 | K499: 12 | L499: 15 | M499: =K499*6+L499 -> 87 | O499: 16 | P499: 18 | Q499: =O499*6+P499 -> 114 | S499: CARLILE
A500: BEST PLAYERS
A501: PRAHRAN | D501: JOHNSTON | G501: McGUINNESS | K501: EMSELLE | N501: PAYNE | Q501: GUNN | S501: ANDERSON
A502: COBURG | D502: BEATTIE | G502: GALE | K502: MANNIX | N502: SLATER | Q502: PAUL
A503: GOALKICKERS
A504: PRAHRAN | D504: JOHNSTON 5 | G504: SMITH 4 | I504: ANASTASIO 3 | L504: GUNN 2 | N504: McFAULL 2 | Q504: DORAN | S504: APPLETON
A505: COBURG | D505: BEATTIE 6 | G505: GALE 4 | I505: SMITH 3 | L505: PAUL 3
A507: OAKLEIGH | C507: 4 | D507: 5 | E507: =C507*6+D507 -> 29 | G507: 6 | H507: 10 | I507: =G507*6+H507 -> 46 | K507: 11 | L507: 10 | M507: =K507*6+L507 -> 76 | O507: 17 | P507: 17 | Q507: =O507*6+P507 -> 119 | S507: WILLIAMSTOWN
A508: WILLIAMSTOWN | C508: 1 | D508: 5 | E508: =C508*6+D508 -> 11 | G508: 6 | H508: 8 | I508: =G508*6+H508 -> 44 | K508: 9 | L508: 11 | M508: =K508*6+L508 -> 65 | O508: 12 | P508: 12 | Q508: =O508*6+P508 -> 84 | S508: WENN
A509: BEST PLAYERS
A510: OAKLEIGH | D510: STEWART | G510: MURNANE | J510: GAUNT | M510: WENN | O510: KING
A511: WILLIAMSTOWN | D511: PAGE | G511: KERR | J511: THOMPSON | M511: POTTER | O511: KELLY
A512: GOALKICKERS
A513: OAKLEIGH | D513: MOORE 4 | G513: McDONALD 4 | J513: GAUNT 2 | M513: WENN 2 | O513: KING 2 | Q513: NISBET | S513: BILLING | U513: WHITE
A514: WILLIAMSTOWN | D514: S McCARTHY 2 | G514: GARDNER 2 | J514: VINEY 2 | L514: SCOTT 2 | N514: FOSTER 2 | Q514: FOX | R514: N STILLMAN
A516: CAULFIELD | C516: 1 | D516: 4 | E516: =C516*6+D516 -> 10 | G516: 12 | H516: 8 | I516: =G516*6+H516 -> 80 | K516: 14 | L516: 10 | M516: =K516*6+L516 -> 94 | O516: 19 | P516: 15 | Q516: =O516*6+P516 -> 129 | S516: PRESTON
A517: PRESTON | C517: 5 | D517: 3 | E517: =C517*6+D517 -> 33 | G517: 8 | H517: 3 | I517: =G517*6+H517 -> 51 | K517: 15 | L517: 7 | M517: =K517*6+L517 -> 97 | O517: 18 | P517: 14 | Q517: =O517*6+P517 -> 122 | S517: O'BRIEN
A518: BEST PLAYERS
A519: CAULFIELD | D519: HAYWOOD | G519: MAGUIRE | J519: CLIFF | M519: BOOTH | P519: MILNER | S519: HAWKING
A520: PRESTON | D520: MARSHALL | G520: PETTIGREW | J520: ZUNNEBERG | M520: WEIGHTMAN | P520: JOHNSTONE | S520: NEWTON
A521: GOALKICKERS
A522: CAULFIELD | D522: MILNER 7 | G522: BOOTH 3 | I522: MAGUIRE 2 | L522: HAWKING 2 | O522: EINSEDEL | Q522: JACKS | S522: HOCKING
A523: PRESTON | D523: NEWTON 4 | G523: WEIGHTMAN 3 | J523: ZUNNEBERG 3 | M523: JOHNSTONE 3 | P523: MRSHALL | R523: GRAINGER | U523: STEWART | X523: MIDDLETON | AA523: SMITH
A525: ROUND 12 | E525: 14TH JULY | J525: WEATHER | S525: PLAYED AT
D526: 1ST QTR | H526: 2ND QTR | L526: 3RD QTR | P526: FINAL | S526: COBURG
A527: COBURG | C527: 1 | D527: 3 | E527: =C527*6+D527 -> 9 | G527: 9 | H527: 10 | I527: =G527*6+H527 -> 64 | K527: 12 | L527: 12 | M527: =K527*6+L527 -> 84 | O527: 19 | P527: 14 | Q527: =O527*6+P527 -> 128 | S527: UMPIRE | X527: LADDER | AB527: ROUND | AD527: 12
A528: PRESTON | C528: 4 | D528: 3 | E528: =C528*6+D528 -> 27 | G528: 7 | H528: 5 | I528: =G528*6+H528 -> 47 | K528: 12 | L528: 11 | M528: =K528*6+L528 -> 83 | O528: 13 | P528: 11 | Q528: =O528*6+P528 -> 89 | S528: WENN
A529: BEST PLAYERS | W529: TEAM | X529: W | Y529: L | Z529: D | AA529: FOR | AB529: AGST | AC529: % | AD529: PTS
A530: COBURG | D530: BURT | G530: HODGETTS | J530: SLATER | M530: STILLMAN | P530: MORRISON | S530: HOWELL
A531: PRESTON | D531: MARSHALL | G531: PETTIGREW | J531: LESLIE | M531: CARLSON | P531: WEIGHTMAN | W531: GEELONG WEST | X531: 11 | Y531: 1 | Z531: 0 | AA531: 1414 | AB531: 1019 | AC531: 138.76 | AD531: 44
A532: GOALKICKERS | W532: PORT MELBOURNE | X532: 9 | Y532: 3 | Z532: 0 | AA532: 1521 | AB532: 1107 | AC532: 137.4 | AD532: 36
A533: COBURG | D533: HODGETTS 5 | G533: SMITH 4 | J533: BURT 4 | L533: STILLMAN 3 | O533: MORRISON 2 | R533: HOBBS | W533: COBURG | X533: 8 | Y533: 4 | Z533: 0 | AA533: 1428 | AB533: 1178 | AC533: 121.22 | AD533: 32
A534: PRESTON | D534: NEWTON 4 | G534: MARSHALL 2 | J534: ZUNNEBERG | M534: GRAINGER | O534: WEIGHTMAN | R534: MIDDLETON | W534: DANDENONG | X534: 8 | Y534: 4 | Z534: 0 | AA534: 1235 | AB534: 1118 | AC534: 110.47 | AD534: 32
L535: CARLSON | N535: JOHNSTONE | Q535: ZEMSKI
A536: DANDENONG | C536: 5 | D536: 9 | E536: =C536*6+D536 -> 39 | G536: 5 | H536: 10 | I536: =G536*6+H536 -> 40 | K536: 10 | L536: 19 | M536: =K536*6+L536 -> 79 | O536: 10 | P536: 22 | Q536: =O536*6+P536 -> 82 | S536: DANDENONG | W536: OAKLEIGH | X536: 5 | Y536: 7 | Z536: 0 | AA536: 1191 | AB536: 1362 | AC536: 87.45 | AD536: 20
A537: SANDRINGHAM | C537: 0 | D537: 2 | E537: =C537*6+D537 -> 2 | G537: 6 | H537: 5 | I537: =G537*6+H537 -> 41 | K537: 7 | L537: 5 | M537: =K537*6+L537 -> 47 | O537: 10 | P537: 11 | Q537: =O537*6+P537 -> 71 | S537: O'BRIEN | W537: PRAHRAN | X537: 5 | Y537: 7 | Z537: 0 | AA537: 1211 | AB537: 1385 | AC537: 87.44 | AD537: 20
A538: BEST PLAYERS | W538: PRESTON | X538: 4 | Y538: 8 | Z538: 0 | AA538: 1214 | AB538: 1302 | AC538: 93.24116743471582 | AD538: 16
A539: DANDENONG | D539: HARPER | G539: REID | J539: MADDEN | M539: HIBBERT | P539: TRUEMAN | S539: ORCHARD | W539: SANDRINGHAM | X539: 4 | Y539: 8 | Z539: 0 | AA539: 1160 | AB539: 1276 | AC539: 90.91 | AD539: 16
A540: SANDRINGHAM | D540: MACKENZIE | G540: SCHWARZMAN | J540: CLARKE | M540: FETTES | P540: HUNTER | S540: EDWARDS | W540: CAULFIELD | X540: 4 | Y540: 8 | Z540: 0 | AA540: 1276 | AB540: 1457 | AC540: 87.577213452299247 | AD540: 16
A541: GOALKICKERS | W541: WILLIAMSTOWN | X541: 2 | Y541: 10 | Z541: 0 | AA541: 1052 | AB541: 1498 | AC541: 70.23 | AD541: 8
A542: DANDENONG | D542: MILLER 3 | G542: BRIESE 2 | J542: ORCHARD | L542: MADDEN | N542: HOLDEN | P542: MORAN | R542: VAN DE BEEK
A543: SANDRINGHAM | D543: COOPER 3 | G543: HOWES 3 | J543: NICHOLSON | M543: LACEY | O543: HUUTCHINSON | R543: JACOBSEN
A545: OAKLEIGH | C545: 1 | D545: 4 | E545: =C545*6+D545 -> 10 | G545: 5 | H545: 7 | I545: =G545*6+H545 -> 37 | K545: 9 | L545: 10 | M545: =K545*6+L545 -> 64 | O545: 17 | P545: 15 | Q545: =O545*6+P545 -> 117 | S545: OAKLEIGH
A546: PRAHRAN | C546: 6 | D546: 6 | E546: =C546*6+D546 -> 42 | G546: 6 | H546: 7 | I546: =G546*6+H546 -> 43 | K546: 10 | L546: 10 | M546: =K546*6+L546 -> 70 | O546: 11 | P546: 10 | Q546: =O546*6+P546 -> 76 | S546: OGSTON
A547: BEST PLAYERS
A548: OAKLEIGH | D548: GAUNT | G548: KING | J548: D NISBET | M548: GOODMAN | P548: MURNANE | S548: STEWART
A549: PRAHRAN | D549: EMSELLE | G549: ANDERSON | J549: GUNN | M549: JOHNSTON | P549: McFAULL
A550: GOALKICKERS
A551: OAKLEIGH | D551: WENN 4 | G551: MURNANE 3 | J551: MCDONALD 3 | M551: ELLIOTT 3 | P551: GAUNT 2 | R551: WHITE | T551: KING
A552: PRAHRAN | D552: ANASTASIO 3 | G552: DICKSON 3 | J552: KENT 2 | L552: DORAN | N552: SMITH | P552: McFAULL
A554: PORT MELBOURNE | C554: 4 | D554: 2 | E554: =C554*6+D554 -> 26 | G554: 8 | H554: 5 | I554: =G554*6+H554 -> 53 | K554: 14 | L554: 7 | M554: =K554*6+L554 -> 91 | O554: 17 | P554: 7 | Q554: =O554*6+P554 -> 109 | S554: PRINCES PARK
A555: CAULFIELD | C555: 2 | D555: 2 | E555: =C555*6+D555 -> 14 | G555: 6 | H555: 7 | I555: =G555*6+H555 -> 43 | K555: 8 | L555: 7 | M555: =K555*6+L555 -> 55 | O555: 12 | P555: 14 | Q555: =O555*6+P555 -> 86 | S555: ABBOTT
A556: BEST PLAYERS
A557: PORT MELBOURNE | D557: GOSS | G557: STIBBARD | J557: COOK | M557: DOYLE | P557: DERMOTT | S557: KINGSLEY
A558: CAULFIELD | D558: MAGUIRE | G558: NEWTON | J558: EASTWOOD | M558: EINSEDEL | P558: TEMPEST | S558: LOGAN
A559: GOALKICKERS
A560: PORT MELBOURNE | D560: COOK 6 | G560: BROWN 2 | J560: GOSS 2 | L560: HOLT 2 | N560: STREET 2 | Q560: HARLAND | S560: HAENAN | V560: WHARTON
A561: CAULFIELD | D561: JACKS 3 | G561: RICHARDS 2 | J561: HOCKING 2 | M561: MAGUIRE | O561: BROWN | Q561: CLIFF | S561: BOOTH | V561: MILNER
A563: GEELONG WEST | C563: 2 | D563: 6 | E563: =C563*6+D563 -> 18 | G563: 4 | H563: 6 | I563: =G563*6+H563 -> 30 | K563: 5 | L563: 10 | M563: =K563*6+L563 -> 40 | O563: 9 | P563: 11 | Q563: =O563*6+P563 -> 65 | S563: GEELONG WEST
A564: WILLIAMSTOWN | C564: 0 | D564: 0 | E564: =C564*6+D564 -> 0 | G564: 0 | H564: 6 | I564: =G564*6+H564 -> 6 | K564: 1 | L564: 7 | M564: =K564*6+L564 -> 13 | O564: 3 | P564: 11 | Q564: =O564*6+P564 -> 29 | S564: HUGGINS
A565: BEST PLAYERS
A566: GEELONG WEST | D566: FRIEND | G566: RUSSELL | J566: STOKES | M566: GILMORE | P566: BRIGHT | R566: NOLAN
A567: WILLIAMSTOWN | D567: FENTON | G567: KELLY | J567: THOMPSON | M567: PAGE
A568: GOALKICKERS
A569: GEELONG WEST | D569: RADOJEVIC 4 | G569: WELLS 2 | I569: STEPHENS | L569: LYNCH | N569: GILMORE
A570: WILLIAMSTOWN | D570: DUKE | G570: FANNING | I570: GARDNER
A572: ROUND 13 | E572: 21ST JULY | J572: WEATHER | N572: NORTH WIND | S572: PLAYED AT
D573: 1ST QTR | H573: 2ND QTR | L573: 3RD QTR | P573: FINAL | S573: PORT MELBOURNE
A574: PORT MELBOURNE | C574: 4 | D574: 6 | E574: =C574*6+D574 -> 30 | G574: 5 | H574: 8 | I574: =G574*6+H574 -> 38 | K574: 15 | L574: 11 | M574: =K574*6+L574 -> 101 | O574: 16 | P574: 17 | Q574: =O574*6+P574 -> 113 | S574: UMPIRE | X574: LADDER | AB574: ROUND | AD574: 13
A575: COBURG | C575: 4 | D575: 2 | E575: =C575*6+D575 -> 26 | G575: 8 | H575: 7 | I575: =G575*6+H575 -> 55 | K575: 9 | L575: 7 | M575: =K575*6+L575 -> 61 | O575: 15 | P575: 12 | Q575: =O575*6+P575 -> 102 | S575: HUGGINS
A576: BEST PLAYERS | W576: TEAM | X576: W | Y576: L | Z576: D | AA576: FOR | AB576: AGST | AC576: % | AD576: PTS
A577: PORT MELBOURNE | D577: DOYLE | G577: COOK | J577: BROWN | M577: ANDERSON | P577: DAVEY | R577: HERROD
A578: COBURG | D578: MORRISON | G578: STILLMAN | J578: BURT | M578: ROBINSON | P578: PITT | R578: LAKE | W578: GEELONG WEST | X578: 12 | Y578: 1 | Z578: 0 | AA578: 1568 | AB578: 1129 | AC578: 138.88 | AD578: 48
A579: GOALKICKERS | W579: PORT MELBOURNE | X579: 10 | Y579: 3 | Z579: 0 | AA579: 1634 | AB579: 1209 | AC579: 135.15 | AD579: 40
A580: PORT MELBOURNE | D580: COOK 7 | G580: DAVIES 3 | J580: STREET 2 | M580: CRITCH 2 | P580: BROWN | R580: GOSS | W580: COBURG | X580: 8 | Y580: 5 | Z580: 0 | AA580: 1530 | AB580: 1291 | AC580: 118.51 | AD580: 32
A581: COBURG | D581: MORRISON 4 | G581: STILLMAN 3 | J581: BURT 2 | L581: LAKE 2 | N581: McGRATH 2 | Q581: BEATTIE | S581: SMITH | W581: DANDENONG | X581: 8 | Y581: 5 | Z581: 0 | AA581: 1319 | AB581: 1236 | AC581: 106.72 | AD581: 32
A583: PRESTON | C583: 3 | D583: 2 | E583: =C583*6+D583 -> 20 | G583: 5 | H583: 9 | I583: =G583*6+H583 -> 39 | K583: 10 | L583: 14 | M583: =K583*6+L583 -> 74 | O583: 15 | P583: 21 | Q583: =O583*6+P583 -> 111 | S583: PRESTON | W583: PRESTON | X583: 5 | Y583: 8 | Z583: 0 | AA583: 1325 | AB583: 1394 | AC583: 95.05021520803443 | AD583: 20
A584: OAKLEIGH | C584: 4 | D584: 7 | E584: =C584*6+D584 -> 31 | G584: 6 | H584: 9 | I584: =G584*6+H584 -> 45 | K584: 10 | L584: 12 | M584: =K584*6+L584 -> 72 | O584: 13 | P584: 14 | Q584: =O584*6+P584 -> 92 | S584: HAYES | W584: CAULFIELD | X584: 5 | Y584: 8 | Z584: 0 | AA584: 1382 | AB584: 1558 | AC584: 88.703465982028234 | AD584: 20
A585: BEST PLAYERS | W585: OAKLEIGH | X585: 5 | Y585: 8 | Z585: 0 | AA585: 1283 | AB585: 1473 | AC585: 87.1 | AD585: 20
A586: PRESTON | D586: MARSHALL | G586: CARLSON | J586: WEIGHTMAN | M586: ZEMSKI | O586: GRAINGER | R586: PETTIGREW | W586: PRAHRAN | X586: 5 | Y586: 8 | Z586: 0 | AA586: 1321 | AB586: 1539 | AC586: 85.83 | AD586: 20
A587: OAKLEIGH | D587: STEWART | G587: C NESBIT | J587: D NESBIT | M587: WENN | O587: KING | R587: McGRATH | W587: SANDRINGHAM | X587: 4 | Y587: 9 | Z587: 0 | AA587: 1261 | AB587: 1382 | AC587: 91.24 | AD587: 16
A588: GOALKICKERS | W588: WILLIAMSTOWN | X588: 3 | Y588: 10 | Z588: 0 | AA588: 1170 | AB588: 1582 | AC588: 73.96 | AD588: 12
A589: PRESTON | D589: CARLSON 4 | G589: SMITH 4 | I589: ZEMSKI 2 | K589: GRAINGER | M589: ZUNNEBERG | P589: NEWTON | R589: WALSH | T589: PETTIGREW
A590: OAKLEIGH | D590: MURNANE 3 | G590: GAUNT 3 | I590: ELLIOTT 2 | L590: BILLING 2 | O590: BECK | Q590: KING | S590: McDONALD
A592: GEELONG WEST | C592: 9 | D592: 4 | E592: =C592*6+D592 -> 58 | G592: 13 | H592: 4 | I592: =G592*6+H592 -> 82 | K592: 18 | L592: 8 | M592: =K592*6+L592 -> 116 | O592: 24 | P592: 10 | Q592: =O592*6+P592 -> 154 | S592: TOORAK PARK
A593: PRAHRAN | C593: 1 | D593: 3 | E593: =C593*6+D593 -> 9 | G593: 7 | H593: 7 | I593: =G593*6+H593 -> 49 | K593: 12 | L593: 8 | M593: =K593*6+L593 -> 80 | O593: 16 | P593: 14 | Q593: =O593*6+P593 -> 110 | S593: DAVIS
A594: BEST PLAYERS
A595: GEELONG WEST | D595: BRIGHT | G595: LYNCH | J595: YATES | M595: GILMORE | P595: WELLS
A596: PRAHRAN | D596: WILKIE | G596: McGUINNESS | J596: McFAULL | M596: SMITH | P596: WILLIAMS | S596: EMSELLE
A597: GOALKICKERS
A598: GEELONG WEST | D598: YATES 7 | G598: RADOJEVIC 6 | J598: BRIGHT 4 | M598: WELLS 3 | O598: GILMORE 2 | R598: GILLIES | T598: STEPHENS
A599: PRAHRAN | D599: SMITH 5 | G599: DORAN 4 | I599: WILLIAMS 4 | L599: KENT 2 | N599: JOHNSTON
A601: CAULFIELD | C601: 3 | D601: 4 | E601: =C601*6+D601 -> 22 | G601: 6 | H601: 8 | I601: =G601*6+H601 -> 44 | K601: 12 | L601: 12 | M601: =K601*6+L601 -> 84 | O601: 15 | P601: 16 | Q601: =O601*6+P601 -> 106 | S601: BEACH ROAD
A602: SANDRINGHAM | C602: 4 | D602: 3 | E602: =C602*6+D602 -> 27 | G602: 7 | H602: 8 | I602: =G602*6+H602 -> 50 | K602: 10 | L602: 10 | M602: =K602*6+L602 -> 70 | O602: 15 | P602: 11 | Q602: =O602*6+P602 -> 101 | S602: WENN
A603: BEST PLAYERS
A604: CAULFIELD | D604: MAGUIRE | G604: NEWTON | J604: BROWN | N604: EINSEDEL | Q604: TEMPEST | S604: DONALDSON
A605: SANDRINGHAM | D605: MURLEY | G605: MACKENZIE | J605: SCHWARZMAN | N605: LIDDELL | Q605: HUNTER | S605: COOPER
A606: GOALKICKERS
A607: CAULFIELD | D607: BROWN 5 | G607: BOOTH 2 | I607: HAWKING 2 | L607: HAYWOOD | N607: MAGUIRE | P607: McNAMEE | R607: CLIFF | T607: RICHARDS | W607: MILNER
A608: SANDRINGHAM | D608: COOPER 6 | G608: HUNTER 2 | I608: MURPHY 2 | L608: McNICHOLAS | O608: MURLEY | Q608: CLARKE | S608: HUTCHINSON | W608: FETTES
A610: WILLIAMSTOWN | C610: 4 | D610: 3 | E610: =C610*6+D610 -> 27 | G610: 10 | H610: 8 | I610: =G610*6+H610 -> 68 | K610: 11 | L610: 14 | M610: =K610*6+L610 -> 80 | O610: 17 | P610: 16 | Q610: =O610*6+P610 -> 118 | S610: WILLIAMSTOWN
A611: DANDENONG | C611: 2 | D611: 5 | E611: =C611*6+D611 -> 17 | G611: 4 | H611: 7 | I611: =G611*6+H611 -> 31 | K611: 8 | L611: 10 | M611: =K611*6+L611 -> 58 | O611: 12 | P611: 12 | Q611: =O611*6+P611 -> 84 | S611: OGSTON
A612: BEST PLAYERS
A613: WILLIAMSTOWN | D613: KELLY | G613: FENTON | J613: BOYD | M613: THOMPSON | P613: FOX | S613: HARLEY
A614: DANDENONG | D614: MADDEN | G614: WALKER | J614: ORCHARD | M614: BRIESE | P614: MILLER
A615: GOALKICKERS
A616: WILLIAMSTOWN | D616: FENTON 7 | G616: N STILLMAN 3 | J616: CROSS 2 | L616: HARLEY 2 | N616: KELLY | P616: FOX | Q616: PERRY
A617: DANDENONG | D617: MILLER 6 | G617: BRIESE 2 | I617: VAN DE BEEK 2 | L617: ORCHARD | N617: MADDEN
A619: ROUND 14 | E619: 27TH JULY | J619: WEATHER | N619: NORTH WIND FINE | S619: PLAYED AT
D620: 1ST QTR | H620: 2ND QTR | L620: 3RD QTR | P620: FINAL | S620: COBURG
A621: DANDENONG | C621: 1 | D621: 7 | E621: =C621*6+D621 -> 13 | G621: 7 | H621: 7 | I621: =G621*6+H621 -> 49 | K621: 11 | L621: 11 | M621: =K621*6+L621 -> 77 | O621: 13 | P621: 14 | Q621: =O621*6+P621 -> 92 | S621: UMPIRE | X621: LADDER | AB621: ROUND | AD621: 14
A622: COBURG | C622: 3 | D622: 0 | E622: =C622*6+D622 -> 18 | G622: 7 | H622: 6 | I622: =G622*6+H622 -> 48 | K622: 8 | L622: 8 | M622: =K622*6+L622 -> 56 | O622: 12 | P622: 15 | Q622: =O622*6+P622 -> 87 | S622: MARCY
A623: BEST PLAYERS | W623: TEAM | X623: W | Y623: L | Z623: D | AA623: FOR | AB623: AGST | AC623: % | AD623: PTS
A624: DANDENONG | D624: WALKER | G624: HARPER | J624: REID | M624: MELAI | P624: DAROSE | S624: PAYZE
A625: COBURG | D625: STILLMAN | G625: SLATER | J625: HOBBS | M625: McCARTHY | P625: BRENNAN | S625: ROBINSON | W625: GEELONG WEST | X625: 13 | Y625: 1 | Z625: 0 | AA625: 1675 | AB625: 1196 | AC625: 140.05 | AD625: 52
A626: GOALKICKERS | W626: PORT MELBOURNE | X626: 11 | Y626: 3 | Z626: 0 | AA626: 1739 | AB626: 1311 | AC626: 132.65 | AD626: 44
A627: DANDENONG | D627: MILLER 6 | G627: PAYZE 4 | I627: MORAN 2 | L627: HIBBERT | W627: DANDENONG | X627: 9 | Y627: 5 | Z627: 0 | AA627: 1411 | AB627: 1323 | AC627: 106.65 | AD627: 36
A628: COBURG | D628: HODGETTS 4 | G628: SMITH 3 | I628: BRENNAN 3 | L628: HOPGOOD 2 | W628: COBURG | X628: 8 | Y628: 6 | Z628: 0 | AA628: 1617 | AB628: 1383 | AC628: 116.92 | AD628: 32
A630: OAKLEIGH | C630: 4 | D630: 3 | E630: =C630*6+D630 -> 27 | G630: 9 | H630: 9 | I630: =G630*6+H630 -> 63 | K630: 11 | L630: 17 | M630: =K630*6+L630 -> 83 | O630: 15 | P630: 21 | Q630: =O630*6+P630 -> 111 | S630: OAKLEIGH | W630: PRESTON | X630: 6 | Y630: 8 | Z630: 0 | AA630: 1473 | AB630: 1487 | AC630: 99.058507061197048 | AD630: 24
A631: CAULFIELD | C631: 0 | D631: 5 | E631: =C631*6+D631 -> 5 | G631: 5 | H631: 12 | I631: =G631*6+H631 -> 42 | K631: 7 | L631: 18 | M631: =K631*6+L631 -> 60 | O631: 9 | P631: 22 | Q631: =O631*6+P631 -> 76 | S631: HUGGINS | W631: OAKLEIGH | X631: 6 | Y631: 8 | Z631: 0 | AA631: 1394 | AB631: 1549 | AC631: 89.99 | AD631: 24
A632: BEST PLAYERS | W632: CAULFIELD | X632: 5 | Y632: 9 | Z632: 0 | AA632: 1458 | AB632: 1669 | AC632: 87.357699221090471 | AD632: 20
A633: OAKLEIGH | D633: BILLING | G633: GAUNT | J633: BECK | M633: WENN | P633: KING | S633: TAYLOR | W633: PRAHRAN | X633: 5 | Y633: 9 | Z633: 0 | AA633: 1414 | AB633: 1687 | AC633: 83.82 | AD633: 20
A634: CAULFIELD | D634: MAGUIRE | G634: JACKS | J634: LOGAN | M634: HAWKING | P634: BROWN | W634: SANDRINGHAM | X634: 4 | Y634: 10 | Z634: 0 | AA634: 1328 | AB634: 1489 | AC634: 89.18 | AD634: 16
A635: GOALKICKERS | W635: WILLIAMSTOWN | X635: 3 | Y635: 11 | Z635: 0 | AA635: 1272 | AB635: 1687 | AC635: 75.4 | AD635: 12
A636: OAKLEIGH | D636: MOORE 4 | G636: WENN 3 | I636: GAUNT 2 | K636: BILLING 2 | M636: TAYOR 2 | O636: KING | Q636: WHITE
A637: CAULFIELD | D637: HAWKING 4 | G637: BROWN 3 | I637: BOOTH | K637: RICHARDS
A639: PRESTON | C639: 7 | D639: 1 | E639: =C639*6+D639 -> 43 | G639: 12 | H639: 7 | I639: =G639*6+H639 -> 79 | K639: 17 | L639: 12 | M639: =K639*6+L639 -> 114 | O639: 22 | P639: 16 | Q639: =O639*6+P639 -> 148 | S639: TOORAK PARK
A640: PRAHRAN | C640: 2 | D640: 4 | E640: =C640*6+D640 -> 16 | G640: 4 | H640: 5 | I640: =G640*6+H640 -> 29 | K640: 9 | L640: 10 | M640: =K640*6+L640 -> 64 | O640: 13 | P640: 15 | Q640: =O640*6+P640 -> 93 | S640: OAKLEY
A641: BEST PLAYERS
A642: PRESTON | D642: SMITH | G642: ZEMSKI | J642: MARSHALL | M642: WEIGHTMAN | P642: GRAINGER | S642: BROWN
A643: PRAHRAN | D643: SMITH | G643: O'BRIEN | J643: WILKIE | M643: GUNN | P643: JOHNSTON
A644: GOALKICKERS
A645: PRESTON | D645: NEWTON 6 | F645: ZEMSKI 4 | I645: WEIGHTMAN 4 | L645: MARSHALL 2 | O645: CARLSON 2 | R645: SMITH 2 | U645: GRAINGER | X645: IRELAND
A646: PRAHRAN | D646: SMITH 5 | G646: McFAULL 2 | J646: JOHNSTON | M646: KENT | N646: APPLETON | Q646: PAYNE | S646: ANDERSON | V646: McGUINNESS
A648: GEELONG WEST | C648: 2 | D648: 2 | E648: =C648*6+D648 -> 14 | G648: 6 | H648: 5 | I648: =G648*6+H648 -> 41 | K648: 10 | L648: 8 | M648: =K648*6+L648 -> 68 | O648: 16 | P648: 11 | Q648: =O648*6+P648 -> 107 | S648: GEELONG WEST
A649: SANDRINGHAM | C649: 1 | D649: 1 | E649: =C649*6+D649 -> 7 | G649: 5 | H649: 5 | I649: =G649*6+H649 -> 35 | K649: 5 | L649: 5 | M649: =K649*6+L649 -> 35 | O649: 9 | P649: 13 | Q649: =O649*6+P649 -> 67 | S649: HAYES
A650: BEST PLAYERS
A651: GEELONG WEST | D651: FRIEND | G651: MANSON | J651: KLINE | M651: WELLS | P651: SMITH | S651: GILMORE
A652: SANDRINGHAM | D652: MACKENZIE | G652: TAYLOR | J652: MURLEY | M652: R MURRAY | P652: LIDDELL | S652: BROWNE
A653: GOALKICKERS
A654: GEELONG WEST | D654: RADOJEVIC 5 | G654: WELLS 4 | I654: MANSON 3 | L654: STEPHENS | N654: LYNCH | P654: BRIGHT | R654: GILLIES
A655: SANDRINGHAM | D655: DYNON 3 | G655: MACKENZIE 2 | J655: R MURRAY 2 | M655: NEVILLE 2
A657: PORT MELBOURNE | C657: 1 | D657: 1 | E657: =C657*6+D657 -> 7 | G657: 6 | H657: 8 | I657: =G657*6+H657 -> 44 | K657: 13 | L657: 8 | M657: =K657*6+L657 -> 86 | O657: 16 | P657: 9 | Q657: =O657*6+P657 -> 105 | S657: WILLIAMSTOWN
A658: WILLIAMSTOWN | C658: 4 | D658: 3 | E658: =C658*6+D658 -> 27 | G658: 7 | H658: 5 | I658: =G658*6+H658 -> 47 | K658: 12 | L658: 7 | M658: =K658*6+L658 -> 79 | O658: 15 | P658: 12 | Q658: =O658*6+P658 -> 102 | S658: DAVIS
A659: BEST PLAYERS
A660: PORT MELBOURNE | D660: MOLLOY | G660: HAENAN | J660: STIBBARD | M660: STREET | P660: COOK
A661: WILLIAMSTOWN | D661: KELLY | G661: BOYD | J661: FENTON | M661: THOMPSON | P661: CROSS
A662: GOALKICKERS
A663: PORT MELBOURNE | D663: COOK 6 | G663: STREET 3 | I663: HOLT 2 | K663: STIBBARD 2 | N663: ERWIN | P663: BROWN | R663: CRITCH
A664: WILLIAMSTOWN | D664: FENTON 4 | G664: KELLY 2 | I664: SCOTT 2 | K664: FOX 2 | M664: PERRY 2 | O664: CROSS | Q664: FANNING | S664: N STILLMAN
A666: ROUND 15 | E666: 3RD AUGUST | J666: WEATHER | S666: PLAYED AT
D667: 1ST QTR | H667: 2ND QTR | L667: 3RD QTR | P667: FINAL | S667: DANDENONG
A668: DANDENONG | C668: 7 | D668: 1 | E668: =C668*6+D668 -> 43 | G668: 12 | H668: 5 | I668: =G668*6+H668 -> 77 | K668: 18 | L668: 8 | M668: =K668*6+L668 -> 116 | O668: 21 | P668: 8 | Q668: =O668*6+P668 -> 134 | S668: UMPIRE | X668: LADDER | AB668: ROUND | AD668: 15
A669: PRESTON | C669: 1 | D669: 4 | E669: =C669*6+D669 -> 10 | G669: 2 | H669: 12 | I669: =G669*6+H669 -> 24 | K669: 3 | L669: 14 | M669: =K669*6+L669 -> 32 | O669: 9 | P669: 18 | Q669: =O669*6+P669 -> 72 | S669: TORNEY
A670: BEST PLAYERS | W670: TEAM | X670: W | Y670: L | Z670: D | AA670: FOR | AB670: AGST | AC670: % | AD670: PTS
A671: DANDENONG | D671: MILLER | G671: KENNEDY | J671: HIBBERT | M671: REID | P671: HARPER | R671: HARRINGTON
A672: PRESTON | D672: MARSHALL | G672: SMITH | J672: STEVENS | M672: PETTIGREW | P672: GRAINGER | R672: WATT | W672: GEELONG WEST | X672: 13 | Y672: 2 | Z672: 0 | AA672: 1794 | AB672: 1347 | AC672: 133.18 | AD672: 52
A673: GOALKICKERS | W673: PORT MELBOURNE | X673: 12 | Y673: 3 | Z673: 0 | AA673: 1867 | AB673: 1367 | AC673: 136.58 | AD673: 48
A674: DANDENONG | D674: MILLER 12 | G674: KENNEDY 3 | J674: BRIESE 2 | M674: DROSCHER 2 | P674: MORAN | R674: MELAI | W674: DANDENONG | X674: 10 | Y674: 5 | Z674: 0 | AA674: 1545 | AB674: 1395 | AC674: 110.75 | AD674: 40
A675: PRESTON | D675: NEWTON 2 | G675: SMITH 2 | I675: COBAIN | K675: MARSHALL | M675: ZUNNEBERG | P675: WEIGHTMAN | S675: LESLIE | W675: COBURG | X675: 9 | Y675: 6 | Z675: 0 | AA675: 1740 | AB675: 1489 | AC675: 116.86 | AD675: 36
A677: COBURG | C677: 5 | D677: 7 | E677: =C677*6+D677 -> 37 | G677: 12 | H677: 9 | I677: =G677*6+H677 -> 81 | K677: 15 | L677: 14 | M677: =K677*6+L677 -> 104 | O677: 18 | P677: 15 | Q677: =O677*6+P677 -> 123 | S677: COBURG | W677: PRESTON | X677: 6 | Y677: 9 | Z677: 0 | AA677: 1545 | AB677: 1621 | AC677: 95.311536088834046 | AD677: 24
A678: OAKLEIGH | C678: 4 | D678: 4 | E678: =C678*6+D678 -> 28 | G678: 8 | H678: 12 | I678: =G678*6+H678 -> 60 | K678: 11 | L678: 18 | M678: =K678*6+L678 -> 84 | O678: 14 | P678: 22 | Q678: =O678*6+P678 -> 106 | S678: ABBOTT | W678: OAKLEIGH | X678: 6 | Y678: 9 | Z678: 0 | AA678: 1500 | AB678: 1672 | AC678: 89.71 | AD678: 24
A679: BEST PLAYERS | W679: CAULFIELD | X679: 6 | Y679: 9 | Z679: 0 | AA679: 1609 | AB679: 1788 | AC679: 89.988814317673373 | AD679: 24
A680: COBURG | D680: MANNIX | G680: SLATER | J680: LLOYD | M680: SMITH | O680: PITT | W680: SANDRINGHAM | X680: 5 | Y680: 10 | Z680: 0 | AA680: 1460 | AB680: 1572 | AC680: 92.88 | AD680: 20
A681: OAKLEIGH | D681: WHITE | G681: BECK | J681: WENN | M681: KING | O681: PAGNOCCOLO | R681: GAUNT | W681: PRAHRAN | X681: 5 | Y681: 10 | Z681: 0 | AA681: 1470 | AB681: 1815 | AC681: 80.99 | AD681: 20
A682: GOALKICKERS | R682: MANNIX | W682: WILLIAMSTOWN | X682: 3 | Y682: 12 | Z682: 0 | AA682: 1355 | AB682: 1819 | AC682: 74.49 | AD682: 12
A683: COBURG | D683: SMITH 7 | F683: BURT 2 | H683: McGRATH 2 | K683: BRENNAN 2 | N683: HODGETTS 2 | Q683: CLEARY | S683: HOPGOOD
A684: OAKLEIGH | D684: WHITE 5 | G684: MOORE 4 | I684: BECK | K684: GAUNT | M684: WENN | O684: KING | Q684: PAGNOCCOLO
A686: SANDRINGHAM | C686: 6 | D686: 5 | E686: =C686*6+D686 -> 41 | G686: 10 | H686: 8 | I686: =G686*6+H686 -> 68 | K686: 16 | L686: 16 | M686: =K686*6+L686 -> 112 | O686: 19 | P686: 18 | Q686: =O686*6+P686 -> 132 | S686: BEACH ROAD
A687: WILLIAMSTOWN | C687: 2 | D687: 4 | E687: =C687*6+D687 -> 16 | G687: 7 | H687: 10 | I687: =G687*6+H687 -> 52 | K687: 9 | L687: 12 | M687: =K687*6+L687 -> 66 | O687: 11 | P687: 17 | Q687: =O687*6+P687 -> 83 | S687: OAKLEY
A688: BEST PLAYERS
A689: SANDRINGHAM | D689: BESLEY | G689: R MURRAY | J689: MACKENZIE | M689: BRENNER | P689: MURLEY | S689: BROWNE
A690: WILLIAMSTOWN | D690: PERRY | G690: BOYCE | J690: KELLY | M690: FOX | P690: CROSS | S690: PAGE
A691: GOALKICKERS
A692: SANDRINGHAM | D692: COOPER 6 | G692: McNICHOLAS 3 | J692: R MURRAY 3 | M692: CUMMINGS 2 | P692: BESLEY 2 | R692: MACKENZIE | U692: GIBSON | W692: HUTCHINSON
A693: WILLIAMSTOWN | D693: FOX 4 | G693: FENTON 2 | J693: CROSS 2 | M693: KELLY | O693: LANE | Q693: SCOTT
A695: CAULFIELD | C695: 4 | D695: 4 | E695: =C695*6+D695 -> 28 | G695: 12 | H695: 8 | I695: =G695*6+H695 -> 80 | K695: 16 | L695: 13 | M695: =K695*6+L695 -> 109 | O695: 23 | P695: 13 | Q695: =O695*6+P695 -> 151 | S695: PRINCES PARK
A696: GEELONG WEST | C696: 3 | D696: 6 | E696: =C696*6+D696 -> 24 | G696: 7 | H696: 9 | I696: =G696*6+H696 -> 51 | K696: 11 | L696: 13 | M696: =K696*6+L696 -> 79 | O696: 17 | P696: 17 | Q696: =O696*6+P696 -> 119 | S696: O'BRIEN
A697: BEST PLAYERS
A698: CAULFIELD | D698: MAGUIRE | G698: BOOTH | J698: CLIFF | M698: NEWTON | P698: HOCKING | S698: HUNTER
A699: GEELONG WEST | D699: LYNCH | G699: YATES | J699: BARRY | M699: RADOJEVIC | P699: HUGHES | S699: BRIGHT
A700: GOALKICKERS
A701: CAULFIELD | D701: BOOTH 6 | F701: HOCKING 4 | I701: RICHARDS 3 | L701: HAWKING 3 | O701: HUNTER 2 | Q701: HAYWOOD 2 | T701: HUNT | V701: BAKER | X701: CLIFF
A702: GEELONG WEST | D702: RADOJEVIC 8 | G702: HUGHES 3 | J702: BRIGHT 3 | M702: GILMORE 2 | P702: LYNCH
A704: PORT MELBOURNE | C704: 3 | D704: 3 | E704: =C704*6+D704 -> 21 | G704: 9 | H704: 12 | I704: =G704*6+H704 -> 66 | K704: 11 | L704: 16 | M704: =K704*6+L704 -> 82 | O704: 18 | P704: 20 | Q704: =O704*6+P704 -> 128 | S704: PORT MELBOURNE
A705: PRAHRAN | C705: 2 | D705: 3 | E705: =C705*6+D705 -> 15 | G705: 3 | H705: 6 | I705: =G705*6+H705 -> 24 | K705: 5 | L705: 9 | M705: =K705*6+L705 -> 39 | O705: 7 | P705: 14 | Q705: =O705*6+P705 -> 56 | S705: MARCY
A706: BEST PLAYERS
A707: PORT MELBOURNE | D707: MOLLOY | G707: ANDERSON | J707: HERROD | M707: DOYLE | P707: BROWN | R707: EVANS
A708: PRAHRAN | D708: KENT | G708: GARCIA | J708: PAYNE | M708: JOHNSTON | P708: EMSELLE | R708: RIMMINGTON
A709: GOALKICKERS
A710: PORT MELBOURNE | D710: COOK 5 | G710: EVANS 5 | I710: STIBBARD 3 | L710: ERWIN 2 | N710: MOLLOY | P710: HOLT | R710: HARLAND
A711: PRAHRAN | D711: JOHNSTON 3 | G711: DICKSON 3 | J711: KENT
A713: ROUND 16 | E713: 10TH AUGUST | J713: WEATHER | N713: NORTH WIND | S713: PLAYED AT
D714: 1ST QTR | H714: 2ND QTR | L714: 3RD QTR | P714: FINAL | S714: GEELONG WEST
A715: GEELONG WEST | C715: 1 | D715: 7 | E715: =C715*6+D715 -> 13 | G715: 5 | H715: 12 | I715: =G715*6+H715 -> 42 | K715: 8 | L715: 20 | M715: =K715*6+L715 -> 68 | O715: 11 | P715: 24 | Q715: =O715*6+P715 -> 90 | S715: UMPIRE | X715: LADDER | AB715: ROUND | AD715: 16
A716: COBURG | C716: 3 | D716: 2 | E716: =C716*6+D716 -> 20 | G716: 4 | H716: 6 | I716: =G716*6+H716 -> 30 | K716: 4 | L716: 7 | M716: =K716*6+L716 -> 31 | O716: 9 | P716: 10 | Q716: =O716*6+P716 -> 64 | S716: OGSTON
A717: BEST PLAYERS | W717: TEAM | X717: W | Y717: L | Z717: D | AA717: FOR | AB717: AGST | AC717: % | AD717: PTS
A718: GEELONG WEST | D718: BRIGHT | G718: RUSSELL | J718: BARRY | M718: KLINE | P718: STOKES | S718: GILMORE
A719: COBURG | D719: PITT | G719: HODGETTS | J719: ROBINSON | M719: MANNIX | W719: GEELONG WEST | X719: 14 | Y719: 2 | Z719: 0 | AA719: 1884 | AB719: 1411 | AC719: 133.52 | AD719: 56
A720: GOALKICKERS | W720: PORT MELBOURNE | X720: 12 | Y720: 4 | Z720: 0 | AA720: 1964 | AB720: 1469 | AC720: 133.7 | AD720: 48
A721: GEELONG WEST | D721: RADOJEVIC 5 | G721: MANSON | I721: LYNCH | K721: WELLS | M721: HUGHES | O721: GILMORE | R721: BRIGHT | W721: DANDENONG | X721: 11 | Y721: 5 | Z721: 0 | AA721: 1640 | AB721: 1452 | AC721: 112.95 | AD721: 44
A722: COBURG | D722: SMITH 4 | G722: HODGETTS | J722: GALE | L722: STILLMAN | O722: CLEARY | W722: COBURG | X722: 9 | Y722: 7 | Z722: 0 | AA722: 1804 | AB722: 1579 | AC722: 114.25 | AD722: 36
A724: PRESTON | C724: 0 | D724: 2 | E724: =C724*6+D724 -> 2 | G724: 3 | H724: 9 | I724: =G724*6+H724 -> 27 | K724: 10 | L724: 12 | M724: =K724*6+L724 -> 72 | O724: 14 | P724: 18 | Q724: =O724*6+P724 -> 102 | S724: PRESTON | W724: PRESTON | X724: 7 | Y724: 9 | Z724: 0 | AA724: 1647 | AB724: 1718 | AC724: 95.867287543655408 | AD724: 28
A725: PORT MELBOURNE | C725: 5 | D725: 5 | E725: =C725*6+D725 -> 35 | G725: 7 | H725: 5 | I725: =G725*6+H725 -> 47 | K725: 13 | L725: 12 | M725: =K725*6+L725 -> 90 | O725: 14 | P725: 13 | Q725: =O725*6+P725 -> 97 | W725: CAULFIELD | X725: 6 | Y725: 10 | Z725: 0 | AA725: 1704 | AB725: 1899 | AC725: 89.731437598736179 | AD725: 24
A726: BEST PLAYERS | W726: OAKLEIGH | X726: 6 | Y726: 10 | Z726: 0 | AA726: 1557 | AB726: 1767 | AC726: 88.12 | AD726: 24
A727: PRESTON | W727: PRAHRAN | X727: 6 | Y727: 10 | Z727: 0 | AA727: 1569 | AB727: 1911 | AC727: 82.1 | AD727: 24
A728: PORT MELBOURNE | D728: GOSS | G728: MOLLOY | J728: ANDERSON | M728: STIBBARD | P728: BROWN | S728: OWEN | W728: SANDRINGHAM | X728: 5 | Y728: 11 | Z728: 0 | AA728: 1556 | AB728: 1671 | AC728: 93.12 | AD728: 20
A729: GOALKICKERS | R729: IRELAND | W729: WILLIAMSTOWN | X729: 4 | Y729: 12 | Z729: 0 | AA729: 1466 | AB729: 1914 | AC729: 76.59 | AD729: 16
A730: PRESTON | D730: ZEMSKI 3 | F730: MARSHALL 2 | I730: WEIGHTMAN 2 | L730: ZUNNEBERG 2 | O730: COBAIN 2 | Q730: NEWTON | S730: CARLSON
A731: PORT MELBOURNE | D731: STIBBARD 5 | G731: COOK 4 | I731: HOLT 2 | K731: HARLAND | M731: EVANS | O731: STREET
A733: DANDENONG | C733: 4 | D733: 5 | E733: =C733*6+D733 -> 29 | G733: 5 | H733: 9 | I733: =G733*6+H733 -> 39 | K733: 8 | L733: 14 | M733: =K733*6+L733 -> 62 | O733: 13 | P733: 17 | Q733: =O733*6+P733 -> 95 | S733: OAKLEIGH
A734: OAKLEIGH | C734: 4 | D734: 2 | E734: =C734*6+D734 -> 26 | G734: 6 | H734: 6 | I734: =G734*6+H734 -> 42 | K734: 7 | L734: 10 | M734: =K734*6+L734 -> 52 | O734: 7 | P734: 15 | Q734: =O734*6+P734 -> 57 | S734: McGIBBON
A735: BEST PLAYERS
A736: DANDENONG | D736: HIBBERT | G736: HARPER | I736: MADDEN | L736: MELAI | O736: HARRINGTON | R736: FLAHERTY
A737: OAKLEIGH | D737: KING | G737: BECK | I737: GOODMAN | L737: WHITE | O737: STEWART | R737: D NISBET
A738: GOALKICKERS
A739: DANDENONG | D739: FLAHERTY 3 | G739: MILLER 3 | I739: PAYZE 3 | K739: HIBBERT 2 | N739: HARRINGTON | Q739: BRIESE
A740: OAKLEIGH | D740: WENN 2 | G740: WHITE 2 | I740: BECK | K740: GAUNT | M740: KING
A742: PRAHRAN | C742: 4 | D742: 12 | E742: =C742*6+D742 -> 36 | G742: 5 | H742: 15 | I742: =G742*6+H742 -> 45 | K742: 9 | L742: 20 | M742: =K742*6+L742 -> 74 | O742: 13 | P742: 21 | Q742: =O742*6+P742 -> 99 | S742: TOORAK PARK
A743: SANDRINGHAM | C743: 2 | D743: 1 | E743: =C743*6+D743 -> 13 | G743: 6 | H743: 5 | I743: =G743*6+H743 -> 41 | K743: 9 | L743: 8 | M743: =K743*6+L743 -> 62 | O743: 14 | P743: 12 | Q743: =O743*6+P743 -> 96 | S743: HUGGINS
A744: BEST PLAYERS
A745: PRAHRAN | D745: JOHNSTON | G745: KENT | I745: TOWNSEND | L745: GARCIA | O745: WILKIE | R745: EMSELLE
A746: SANDRINGHAM | D746: MACKENZIE | G746: LIDDELL | I746: HUTCHINSON | L746: GREEN | O746: R MURRAY | R746: MURLEY
A747: GOALKICKERS
A748: PRAHRAN | D748: TOWNSEND 2 | G748: SMITH 2 | I748: PAYNE 2 | K748: McGUINNESS 2 | N748: WILLIAMS 2 | Q748: JOHNSTON | T748: McFAULL | W748: KENT
A749: SANDRINGHAM | D749: COOPER 4 | G749: MACKENZIE 3 | J749: R MURRAY 2 | M749: HUTCHINSON | P749: CUMMINGS | R749: GIBSON | T749: BESLEY | V749: GREEN
A751: WILLIAMSTOWN | C751: 3 | D751: 3 | E751: =C751*6+D751 -> 21 | G751: 8 | H751: 10 | I751: =G751*6+H751 -> 58 | K751: 11 | L751: 14 | M751: =K751*6+L751 -> 80 | O751: 15 | P751: 21 | Q751: =O751*6+P751 -> 111 | S751: WILLIAMSTOWN
A752: CAULFIELD | C752: 3 | D752: 5 | E752: =C752*6+D752 -> 23 | G752: 4 | H752: 7 | I752: =G752*6+H752 -> 31 | K752: 10 | L752: 10 | M752: =K752*6+L752 -> 70 | O752: 14 | P752: 11 | Q752: =O752*6+P752 -> 95 | S752: HAYES
A753: BEST PLAYERS
A754: WILLIAMSTOWN | D754: CROSS | G754: PAGE | I754: KRIPTOPOLOUS | M754: PORCEVINA | P754: BOYD | S754: KERR
A755: CAULFIELD | D755: MAGUIRE | G755: CLIFF | I755: RICHARDS | M755: DONALDSON | P755: EINSEDEL | S755: BAKER
A756: GOALKICKERS
A757: WILLIAMSTOWN | D757: FENTON 6 | G757: FOX 3 | I757: SCOTT 2 | K757: N STILLMAN | N757: PERRY | P757: FANNING | R757: KRIPTOPOLOUS
A758: CAULFIELD | D758: MILNER 4 | G758: HAWKING 3 | J758: BOOTH 3 | M758: MAGUIRE | O758: BROWN | Q758: CLIFF | S758: HUNTER
A760: ROUND 17 | E760: 17TH AUGUST | J760: WEATHER | N760: WEST WIND | S760: PLAYED AT
D761: 1ST QTR | H761: 2ND QTR | L761: 3RD QTR | P761: FINAL | S761: GEELONG WEST
A762: GEELONG WEST | E762: =C762*6+D762 -> 0 | I762: =G762*6+H762 -> 0 | M762: =K762*6+L762 -> 0 | O762: 22 | P762: 16 | Q762: =O762*6+P762 -> 148 | S762: UMPIRE | X762: LADDER | AB762: ROUND | AD762: 17
A763: PRESTON | E763: =C763*6+D763 -> 0 | I763: =G763*6+H763 -> 0 | M763: =K763*6+L763 -> 0 | O763: 7 | P763: 12 | Q763: =O763*6+P763 -> 54 | S763: MARCY
A764: BEST PLAYERS | W764: TEAM | X764: W | Y764: L | Z764: D | AA764: FOR | AB764: AGST | AC764: % | AD764: PTS
A765: GEELONG WEST
A766: PRESTON | W766: GEELONG WEST | X766: 15 | Y766: 2 | Z766: 0 | AA766: 2032 | AB766: 1465 | AC766: 138.7 | AD766: 60
A767: GOALKICKERS | P767: WOOLFE | S767: YATES | W767: PORT MELBOURNE | X767: 13 | Y767: 4 | Z767: 0 | AA767: 2090 | AB767: 1586 | AC767: 131.78 | AD767: 52
A768: GEELONG WEST | D768: GILMORE 5 | F768: RADOJEVIC 5 | I768: BRIGHT 3 | K768: STEPHENS 3 | N768: WELLS 2 | P768: HUGHES | R768: VAN ELDEN | W768: DANDENONG | X768: 12 | Y768: 5 | Z768: 0 | AA768: 1806 | AB768: 1563 | AC768: 115.55 | AD768: 48
A769: PRESTON | D769: NEWTON 2 | G769: BROWNE 2 | J769: ZUNNEBERG | M769: WEIGHTMAN | P769: STEWART | W769: COBURG | X769: 10 | Y769: 7 | Z769: 0 | AA769: 1903 | AB769: 1661 | AC769: 114.57 | AD769: 40
A771: DANDENONG | E771: =C771*6+D771 -> 0 | I771: =G771*6+H771 -> 0 | M771: =K771*6+L771 -> 0 | O771: 25 | P771: 16 | Q771: =O771*6+P771 -> 166 | S771: PRINCES PARK | W771: PRESTON | X771: 7 | Y771: 10 | Z771: 0 | AA771: 1701 | AB771: 1866 | AC771: 91.157556270096464 | AD771: 28
A772: CAULFIELD | E772: =C772*6+D772 -> 0 | I772: =G772*6+H772 -> 0 | M772: =K772*6+L772 -> 0 | O772: 16 | P772: 15 | Q772: =O772*6+P772 -> 111 | W772: PRAHRAN | X772: 7 | Y772: 10 | Z772: 0 | AA772: 1648 | AB772: 1980 | AC772: 83.23 | AD772: 28
A773: BEST PLAYERS | W773: OAKLEIGH | X773: 6 | Y773: 11 | Z773: 0 | AA773: 1674 | AB773: 1893 | AC773: 88.43 | AD773: 24
A774: DANDENONG | W774: CAULFIELD | X774: 6 | Y774: 11 | Z774: 0 | AA774: 1815 | AB774: 2065 | AC774: 87.893462469733663 | AD774: 24
A775: CAULFIELD | W775: SANDRINGHAM | X775: 5 | Y775: 12 | Z775: 0 | AA775: 1638 | AB775: 1770 | AC775: 92.54 | AD775: 20
A776: GOALKICKERS | W776: WILLIAMSTOWN | X776: 4 | Y776: 13 | Z776: 0 | AA776: 1535 | AB776: 1993 | AC776: 77.02 | AD776: 16
A777: DANDENONG | D777: MILLER 12 | F777: FLAHERTY 3 | I777: BRIESE 3 | K777: MADDEN 2 | N777: HIBBERT 2 | Q777: KENNEDY 2 | T777: ORCHARD
A778: CAULFIELD | D778: HAWKING 5 | G778: RICHARDS 3 | J778: EASTWOOD 2 | M778: BAKER | O778: CLIFF | Q778: BOOTH | S778: HAWKING | V778: HUNTER | X778: MILNER
A780: PRAHRAN | E780: =C780*6+D780 -> 0 | I780: =G780*6+H780 -> 0 | M780: =K780*6+L780 -> 0 | O780: 11 | P780: 13 | Q780: =O780*6+P780 -> 79 | S780: WILLIAMSTOWN
A781: WILLIAMSTOWN | E781: =C781*6+D781 -> 0 | I781: =G781*6+H781 -> 0 | M781: =K781*6+L781 -> 0 | O781: 8 | P781: 21 | Q781: =O781*6+P781 -> 69 | S781: ABBOTT
A782: BEST PLAYERS
A783: PRAHRAN
A784: WILLIAMSTOWN
A785: GOALKICKERS
A786: PRAHRAN | D786: McGUINNESS 3 | G786: JOHNSTON 2 | J786: DICKSON 2 | M786: TOWNSEND | P786: McFAULL | R786: PAYNE | T786: KENT
A787: WILLIAMSTOWN | D787: FOX 4 | F787: FENTON | I787: McCARTHY | L787: SCOTT | N787: CROSS
A789: PORT MELBOURNE | E789: =C789*6+D789 -> 0 | I789: =G789*6+H789 -> 0 | M789: =K789*6+L789 -> 0 | O789: 19 | P789: 12 | Q789: =O789*6+P789 -> 126 | S789: OAKLEIGH
A790: OAKLEIGH | E790: =C790*6+D790 -> 0 | I790: =G790*6+H790 -> 0 | M790: =K790*6+L790 -> 0 | O790: 16 | P790: 21 | Q790: =O790*6+P790 -> 117 | S790: OAKLEY
A791: BEST PLAYERS
A792: PORT MELBOURNE
A793: OAKLEIGH
A794: GOALKICKERS
A795: PORT MELBOURNE | D795: GOSS 5 | F795: COOK 5 | H795: HOLT 3 | J795: STIBBARD 3 | M795: ERWIN | O795: CRITCH | Q795: MARSHALL
A796: OAKLEIGH | D796: MOORE 4 | G796: STEWART 3 | J796: GAUNT 3 | M796: TAYLOR 2 | P796: KING 2 | R796: WENN | T796: WHITE
A798: COBURG | E798: =C798*6+D798 -> 0 | I798: =G798*6+H798 -> 0 | M798: =K798*6+L798 -> 0 | O798: 14 | P798: 15 | Q798: =O798*6+P798 -> 99 | S798: COBURG
A799: SANDRINGHAM | E799: =C799*6+D799 -> 0 | I799: =G799*6+H799 -> 0 | M799: =K799*6+L799 -> 0 | O799: 12 | P799: 10 | Q799: =O799*6+P799 -> 82 | S799: WENN
A800: BEST PLAYERS
A801: COBURG
A802: SANDRINGHAM
A803: GOALKICKERS
A804: COBURG | D804: MANNIX 6 | G804: SMITH 3 | I804: STILLMAN 2 | L804: HODGETTS 2 | O804: HOWELL
A805: SANDRINGHAM | D805: NICHOLSON 3 | G805: LIDDELL 2 | J805: COOPER 2 | M805: McNICHOLAS | P805: CLARKE | R805: HUTCHINSON | V805: SCHWARZMAN | X805: EDWARDS
A807: ROUND 18 | E807: 24TH AUGUST | J807: WEATHER | N807: FINE | S807: PLAYED AT
D808: 1ST QTR | H808: 2ND QTR | L808: 3RD QTR | P808: FINAL | S808: PORT MELBOURNE
A809: PORT MELBOURNE | C809: 2 | D809: 5 | E809: =C809*6+D809 -> 17 | G809: 7 | H809: 11 | I809: =G809*6+H809 -> 53 | K809: 14 | L809: 13 | M809: =K809*6+L809 -> 97 | O809: 17 | P809: 18 | Q809: =O809*6+P809 -> 120 | S809: UMPIRE | X809: LADDER | AB809: ROUND | AD809: 18
A810: GEELONG WEST | C810: 3 | D810: 8 | E810: =C810*6+D810 -> 26 | G810: 5 | H810: 11 | I810: =G810*6+H810 -> 41 | K810: 9 | L810: 12 | M810: =K810*6+L810 -> 66 | O810: 13 | P810: 16 | Q810: =O810*6+P810 -> 94 | S810: WENN
A811: BEST PLAYERS | W811: TEAM | X811: W | Y811: L | Z811: D | AA811: FOR | AB811: AGST | AC811: % | AD811: PTS
A812: PORT MELBOURNE | D812: HOLT | G812: DOYLE | J812: CRITCH | M812: HAENAN | P812: BOND | R812: ANDERSON
A813: GEELONG WEST | D813: YATES | G813: HUGHES | J813: BRIGHT | M813: LYNCH | P813: DUNNE | R813: GILLIES | W813: GEELONG WEST | X813: 15 | Y813: 3 | Z813: 0 | AA813: 2126 | AB813: 1585 | AC813: 134.13 | AD813: 60
A814: GOALKICKERS | W814: PORT MELBOURNE | X814: 14 | Y814: 4 | Z814: 0 | AA814: 2210 | AB814: 1680 | AC814: 131.55 | AD814: 56
A815: PORT MELBOURNE | D815: HOLT 6 | F815: DOYLE 3 | H815: COOK 2 | J815: GRANDIN 2 | M815: MOLLOY | O815: ELLIOTT | Q815: EVANS | S815: STIBBARD | W815: DANDENONG | X815: 12 | Y815: 6 | Z815: 0 | AA815: 1896 | AB815: 1690 | AC815: 112.19 | AD815: 48
A816: GEELONG WEST | D816: RADOJEVIC 5 | G816: BRIGHT 2 | I816: VAN ELDEN 2 | L816: LYNCH | N816: IRVIN | P816: WELLS | R816: HUGHES | W816: COBURG | X816: 11 | Y816: 7 | Z816: 0 | AA816: 2051 | AB816: 1765 | AC816: 116.2 | AD816: 44
A818: PRAHRAN | C818: 6 | D818: 4 | E818: =C818*6+D818 -> 40 | G818: 10 | H818: 9 | I818: =G818*6+H818 -> 69 | K818: 13 | L818: 16 | M818: =K818*6+L818 -> 94 | O818: 18 | P818: 19 | Q818: =O818*6+P818 -> 127 | S818: DANDENONG | W818: PRESTON | X818: 8 | Y818: 10 | Z818: 0 | AA818: 1829 | AB818: 1931 | AC818: 94.717762817193162 | AD818: 32
A819: DANDENONG | C819: 2 | D819: 5 | E819: =C819*6+D819 -> 17 | G819: 8 | H819: 9 | I819: =G819*6+H819 -> 57 | K819: 9 | L819: 13 | M819: =K819*6+L819 -> 67 | O819: 12 | P819: 18 | Q819: =O819*6+P819 -> 90 | S819: OGSTON | W819: PRAHRAN | X819: 8 | Y819: 10 | Z819: 0 | AA819: 1775 | AB819: 2070 | AC819: 85.75 | AD819: 32
A820: BEST PLAYERS | W820: OAKLEIGH | X820: 7 | Y820: 11 | Z820: 0 | AA820: 1794 | AB820: 2003 | AC820: 89.57 | AD820: 28
A821: PRAHRAN | D821: EMSELLE | G821: KENT | J821: GUNN | M821: TOWNSEND | P821: McFAULL | R821: WILKIE | W821: CAULFIELD | X821: 6 | Y821: 12 | Z821: 0 | AA821: 1919 | AB821: 2213 | AC821: 86.714866696791688 | AD821: 24
A822: DANDENONG | D822: DROSCHER | G822: MADDEN | J822: HARRINGTON | M822: MELAI | P822: ORCHARD | R822: DA ROSE | W822: SANDRINGHAM | X822: 5 | Y822: 13 | Z822: 0 | AA822: 1748 | AB822: 1890 | AC822: 92.49 | AD822: 20
A823: GOALKICKERS | W823: WILLIAMSTOWN | X823: 4 | Y823: 14 | Z823: 0 | AA823: 1600 | AB823: 2121 | AC823: 75.44 | AD823: 16
A824: PRAHRAN | D824: DICKSON 5 | F824: PAYNE 3 | H824: ANDERSON 3 | K824: McGUINNESS 3 | N824: KENT | P824: JOHNSTON | R824: APPLETON | U824: EMSELLE
A825: DANDENONG | D825: MILLER 3 | G825: DROSCHER 3 | J825: FLAHERTY 2 | M825: BRIESE 2 | P825: ORCHARD | R825: DA ROSE
A827: OAKLEIGH | C827: 3 | D827: 2 | E827: =C827*6+D827 -> 20 | G827: 7 | H827: 4 | I827: =G827*6+H827 -> 46 | K827: 13 | L827: 6 | M827: =K827*6+L827 -> 84 | O827: 18 | P827: 12 | Q827: =O827*6+P827 -> 120 | S827: BEACH ROAD
A828: SANDRINGHAM | C828: 5 | D828: 3 | E828: =C828*6+D828 -> 33 | G828: 7 | H828: 8 | I828: =G828*6+H828 -> 50 | K828: 11 | L828: 11 | M828: =K828*6+L828 -> 77 | O828: 16 | P828: 14 | Q828: =O828*6+P828 -> 110 | S828: HAYES
A829: BEST PLAYERS
A830: OAKLEIGH | D830: STEWART | G830: WENN | I830: GOODMAN | L830: KING | O830: MOORE | R830: BRUERTON
A831: SANDRINGHAM | D831: MURLEY | G831: GIBSON | I831: HUTCHINSON | L831: MACKENZIE | O831: BESLEY | R831: TOMS
A832: GOALKICKERS
A833: OAKLEIGH | D833: MOORE 7 | G833: KING 3 | I833: WENN 2 | K833: TAYLOR 2 | M833: WHITE 2 | O833: SHEA | Q833: KUZIMAK
A834: SANDRINGHAM | D834: COOPER 5 | G834: HUTCHINSON 3 | J834: BESLEY 2 | M834: GIBSON 2 | O834: LACEY | Q834: R MURRAY | T834: CLARKE | W834: LIDDELL
A836: COBURG | C836: 3 | D836: 3 | E836: =C836*6+D836 -> 21 | G836: 9 | H836: 13 | I836: =G836*6+H836 -> 67 | K836: 18 | L836: 13 | M836: =K836*6+L836 -> 121 | O836: 22 | P836: 16 | Q836: =O836*6+P836 -> 148 | S836: PRINCES PARK
A837: CAULFIELD | C837: 3 | D837: 5 | E837: =C837*6+D837 -> 23 | G837: 6 | H837: 7 | I837: =G837*6+H837 -> 43 | K837: 8 | L837: 16 | M837: =K837*6+L837 -> 64 | O837: 14 | P837: 20 | Q837: =O837*6+P837 -> 104 | S837: MARCY
A838: BEST PLAYERS
A839: COBURG | D839: HOPGOOD | G839: HODGETTS | J839: MANNIX | M839: LAKE | O839: PITT
A840: CAULFIELD | D840: MAGUIRE | G840: EINSEDEL | J840: CLIFF | M840: NEWTON | O840: TAYLOR
A841: GOALKICKERS
A842: COBURG | D842: HODGETTS 7 | G842: STILLMAN 4 | J842: SMITH 3 | L842: LAKE 2 | N842: HOBBS 2 | Q842: BURROWES 2 | T842: BURT | V842: LLOYD
A843: CAULFIELD | D843: CLIFF 4 | G843: MAGUIRE 3 | J843: EASTWOOD 2 | M843: HAYWOOD | O843: BOOTH | Q843: TAYLOR | S843: HUNTER | U843: MILNER
A845: PRESTON | C845: 1 | D845: 4 | E845: =C845*6+D845 -> 10 | G845: 6 | H845: 13 | I845: =G845*6+H845 -> 49 | K845: 13 | L845: 17 | M845: =K845*6+L845 -> 95 | O845: 18 | P845: 20 | Q845: =O845*6+P845 -> 128 | S845: PRESTON
A846: WILLIAMSTOWN | C846: 3 | D846: 5 | E846: =C846*6+D846 -> 23 | G846: 6 | H846: 8 | I846: =G846*6+H846 -> 44 | K846: 7 | L846: 13 | M846: =K846*6+L846 -> 55 | O846: 8 | P846: 17 | Q846: =O846*6+P846 -> 65 | S846: HUGGINS
A847: BEST PLAYERS
A848: PRESTON | D848: SMITH | G848: MARSHALL | J848: ZEMSKI | M848: CARLSON | P848: DUCKWORTH | S848: GRELLET
A849: WILLIAMSTOWN | D849: BOYD | G849: PERRY | J849: McCARTHY | M849: CROSS
A850: GOALKICKERS
A851: PRESTON | D851: SMITH 5 | G851: STEWART 5 | J851: MARSHALL 4 | M851: ROBINSON 2 | P851: WEIGHTMAN | S851: CARLSON
A852: WILLIAMSTOWN | D852: FENTON 4 | G852: CROSS | I852: FOX | K852: McCARTHY | N852: GARDNER
A854: FINALS
A855: 1ST SEMI | D855: 31ST AUGUST | J855: WEATHER | M855: SOUTH WEST WIND DULL | S855: PLAYED AT
D856: 1ST QTR | H856: 2ND QTR | L856: 3RD QTR | P856: FINAL | S856: JUNCTION OVAL
A857: DANDENONG | C857: 5 | D857: 9 | E857: =C857*6+D857 -> 39 | G857: 9 | H857: 11 | I857: =G857*6+H857 -> 65 | K857: 13 | L857: 12 | M857: =K857*6+L857 -> 90 | O857: 18 | P857: 16 | Q857: =O857*6+P857 -> 124 | S857: UMPIRE
A858: COBURG | C858: 2 | D858: 2 | E858: =C858*6+D858 -> 14 | G858: 7 | H858: 5 | I858: =G858*6+H858 -> 47 | K858: 10 | L858: 14 | M858: =K858*6+L858 -> 74 | O858: 17 | P858: 18 | Q858: =O858*6+P858 -> 120 | S858: HAYES
A859: BEST PLAYERS
A860: DANDENONG | D860: ORCHARD | G860: FLAHERTY | J860: REID | L860: HARRINGTON | O860: PAYZE | R860: MELAI
A861: COBURG | D861: HODGETTS | G861: LAKE | J861: HOWELL | L861: PITT | O861: P McCARTHY | R861: GALE
A862: GOALKICKERS
A863: DANDENONG | D863: FLAHERTY 4 | G863: MILLER 4 | I863: BRIESE 3 | K863: PAYZE 2 | M863: HIBBERT | O863: MORAN | Q863: MADDEN | S863: ORCHARD | V863: SHINNERS
A864: COBURG | D864: HODGETTS 7 | G864: SMITH 3 | I864: LAKE 2 | K864: BURT | M864: HOPGOOD | O864: MANNIX | Q864: MORRISON | T864: BRENNAN
A866: 2ND SEMI | E866: 7TH SEPTEMBER | J866: WEATHER | N866: FINE
A867: GEELONG WEST | C867: 4 | D867: 1 | E867: =C867*6+D867 -> 25 | G867: 9 | H867: 6 | I867: =G867*6+H867 -> 60 | K867: 11 | L867: 10 | M867: =K867*6+L867 -> 76 | O867: 16 | P867: 17 | Q867: =O867*6+P867 -> 113 | S867: JUNCTION OVAL
A868: PORT MELBOURNE | C868: 4 | D868: 6 | E868: =C868*6+D868 -> 30 | G868: 5 | H868: 8 | I868: =G868*6+H868 -> 38 | K868: 8 | L868: 13 | M868: =K868*6+L868 -> 61 | O868: 11 | P868: 15 | Q868: =O868*6+P868 -> 81 | S868: HUGGINS
A869: BEST PLAYERS
A870: GEELONG WEST | D870: LYNCH | G870: GILMORE | J870: RUSSELL | M870: SMITH | O870: RADOJEVIC | R870: MANSON
A871: PORT MELBOURNE | D871: CRITCH | G871: DAVEY | J871: DOYLE | M871: BROWN | O871: GOSS | R871: ANDERSON
A872: GOALKICKERS
A873: GEELONG WEST | D873: RADOJEVIC 5 | G873: LYNCH 3 | I873: HUGHES 3 | K873: STEPHENS 2 | N873: YATES | P873: WELLS | R873: VAN ELODEN
A874: PORT MELBOURNE | D874: GOSS 2 | F874: BROWN 2 | I874: ERWIN 2 | K874: BOND 2 | M874: DOYLE | O874: COOK | Q874: HOLT
A876: PRELIMINARY FINAL | F876: 14TH SEPTEMBER | K876: WEATHER | O876: FINE
A877: DANDENONG | C877: 3 | D877: 2 | E877: =C877*6+D877 -> 20 | G877: 6 | H877: 5 | I877: =G877*6+H877 -> 41 | K877: 11 | L877: 8 | M877: =K877*6+L877 -> 74 | O877: 17 | P877: 11 | Q877: =O877*6+P877 -> 113 | S877: JUNCTION OVAL
A878: PORT MELBOURNE | C878: 3 | D878: 4 | E878: =C878*6+D878 -> 22 | G878: 7 | H878: 9 | I878: =G878*6+H878 -> 51 | K878: 14 | L878: 11 | M878: =K878*6+L878 -> 95 | O878: 16 | P878: 13 | Q878: =O878*6+P878 -> 109 | S878: WENN
A879: BEST PLAYERS
A880: DANDENONG | D880: REID | F880: ORCHARD | I880: BRIESE | L880: MELAI | O880: FLAHERTY | R880: PAYZE
A881: PORT MELBOURNE | D881: GOSS | F881: CRITCH | I881: ERWIN | L881: STIBBARD | O881: ALLEN | R881: COOK
A882: GOALKICKERS
A883: DANDENONG | D883: HARRINGTON 4 | G883: ORCHARD 4 | J883: FLAHERTY 4 | M883: MELAI 2 | O883: MORAN | Q883: MILLER | S883: CASTRICUM
A884: PORT MELBOURNE | D884: COOK 6 | G884: BROWN 3 | I884: HOLT 2 | K884: OWEN | M884: ERWIN | O884: STIBBARD | R884: DAVIES | T884: CRITCH
A886: GRAND FINAL | E886: 21ST SEPTEMBER | J886: WEATHER | M886: NORTH WEST WIND FINE
A887: GEELONG WEST | C887: 7 | D887: 4 | E887: 46 | G887: 10 | H887: 5 | I887: 65 | K887: 15 | L887: 12 | M887: 102 | O887: 18 | P887: 13 | Q887: =O887*6+P887 -> 121 | S887: JUNCTION OVAL
A888: DANDENONG | C888: 1 | D888: 2 | E888: 8 | G888: 6 | H888: 7 | I888: 43 | K888: 7 | L888: 7 | M888: 49 | O888: 14 | P888: 9 | Q888: =O888*6+P888 -> 93 | S888: WENN
A889: BEST PLAYERS
A890: GEELONG WEST | D890: GILMORE | G890: LYNCH | J890: RUSSELL | M890: FRIEND | P890: YATES | R890: MANSON
A891: DANDENONG | D891: PAYZE | G891: HARPER | J891: WALKER | M891: DROSCHER | P891: MELAI | R891: BRIESE
A892: GOALKICKERS
A893: GEELONG WEST | D893: RADOJEVIC 4 | G893: WELLS 3 | I893: LYNCH 2 | K893: BRIGHT 2 | M893: STEPHENS 2 | P893: YATES 2 | R893: HUGHES | T893: GILMORE | W893: WOOLFE
A894: DANDENONG | D894: MILLER 3 | G894: BRIESE 3 | I894: PAYZE 2 | K894: ORCHARD | M894: HIBBERT | O894: CASTRICUM | R894: SHINNERS | U894: MORAN | W894: FLAHERTY
A896: REPRESENTATIVE MATCH | H896: 15TH JUNE | L896: WEATHER
D897: 1ST QTR | H897: 2ND QTR | L897: 3RD QTR | P897: FINAL
A898: OVENS & MURRAY | C898: 7 | D898: 7 | E898: =C898*6+D898 -> 49 | G898: 10 | H898: 10 | I898: =G898*6+H898 -> 70 | K898: 16 | L898: 17 | M898: =K898*6+L898 -> 113 | O898: 24 | P898: 23 | Q898: =O898*6+P898 -> 167 | S898: WANGARATTA
A899: V.F.A. | C899: 3 | D899: 5 | E899: =C899*6+D899 -> 23 | G899: 9 | H899: 7 | I899: =G899*6+H899 -> 61 | K899: 13 | L899: 8 | M899: =K899*6+L899 -> 86 | O899: 17 | P899: 9 | Q899: =O899*6+P899 -> 111
A900: BEST PLAYERS
A901: OVENS & MURRAY | D901: DOOLAN | G901: ELLIOTT | J901: BOUNDY | M901: SCOTT | P901: RICHARDSON | S901: O'HALLORAN
A902: V.F.A. | D902: CLARKE | G902: SIMPSON | J902: MURNANE | M902: ANDERSON | P902: CLIFF
A903: GOALKICKERS
A904: OVENS & MURRAY | D904: DOOLAN 8 | G904: ELLIOTT 5 | I904: NORMAN 4 | L904: RICHARDSON 2 | O904: BOUNDY 2 | R904: SCOTT 2 | U904: SAMMON 2 | X904: DEFASIO 2
A905: V.F.A. | D905: MILLER 4 | G905: R KENNEDY 3 | J905: WILLIAMS 3 | M905: HARRY 2 | O905: K CLARKE 2 | R905: SIMPSON | U905: CLIFF | W905: MELAI