A1: Victorian Football Association
A2: Season 1976 - Division One
A3: © Copyright Wal Williams | F3: First created: 28 July 2015
A4: Contact: joywalwi at gmail dot com | F4: Last updated: 28 July 2015 | W4: VFA Results and tables - Link to the main index page
A5: You are free to copy this document in whole or part provided that proper acknowledgement is given to the author. All rights reserved.
A7: 1976 V.F.A. | C7: SEASON 1ST | F7: DIVISION | CA7: \D | CB7: {GOTO}BJ3~/M{RIGHT 7}{END}{DOWN}~G4~
A8: ROUND 1 | E8: 18TH APRIL | J8: WEATHER | N8: SOUTH WIND SHOWERS | S8: PLAYED AT | CB8: {GOTO}AL3~/M{END}{RIGHT}{END}{DOWN}~P3~
D9: 1ST QTR | H9: 2ND QTR | L9: 3RD QTR | P9: FINAL | S9: DANDENONG | CB9: {GOTO}BJ23~/M{RIGHT 7}{END}{DOWN}~V4~
A10: DANDENONG | C10: 2 | D10: 8 | E10: =C10*6+D10 -> 20 | G10: 6 | H10: 8 | I10: =G10*6+H10 -> 44 | K10: 10 | L10: 11 | M10: =K10*6+L10 -> 71 | O10: 13 | P10: 14 | Q10: =O10*6+P10 -> 92 | S10: UMPIRE | X10: LADDER | AB10: ROUND | AD10: 1 | CB10: {GOTO}BJ43~/M{RIGHT 7}{END}{DOWN}~G24~
A11: SANDRINGHAM | C11: 0 | D11: 2 | E11: =C11*6+D11 -> 2 | G11: 4 | H11: 3 | I11: =G11*6+H11 -> 27 | K11: 5 | L11: 7 | M11: =K11*6+L11 -> 37 | O11: 10 | P11: 11 | Q11: =O11*6+P11 -> 71 | S11: MARCY | CB11: {GOTO}AL23~/M{END}{RIGHT}{END}{DOWN}~P23~
A12: BEST PLAYERS | W12: TEAM | X12: W | Y12: L | Z12: D | AA12: FOR | AB12: AGST | AC12: % | AD12: PTS | CB12: {GOTO}BJ63~/M{RIGHT 7}{END}{DOWN}~V24~
A13: DANDENONG | D13: REID | F13: HIBBERT | I13: HARRINGTON | L13: PAYZE | O13: BASSED | R13: THOMPSON | CB13: {GOTO}BJ83~/M{RIGHT 7}{END}{DOWN}~G44~
A14: SANDRINGHAM | D14: DYNON | F14: LIDDELL | I14: BRENNER | L14: SIMPSON | O14: MACKENZIE | R14: EDDY | W14: DANDENONG | X14: 1 | Y14: 0 | Z14: 0 | AA14: 92 | AB14: 71 | AC14: 129.57746478873239 | AD14: 4 | CB14: {GOTO}AL43~/M{END}{RIGHT}{END}{DOWN}~P43~
A15: GOALKICKERS | W15: COBURG | X15: 1 | Y15: 0 | Z15: 0 | AA15: 102 | AB15: 81 | AC15: 125.92592592592592 | AD15: 4 | CB15: {GOTO}BJ103~/M{RIGHT 7}{END}{DOWN}~V44~
A16: DANDENONG | D16: HARPER 2 | F16: BRIESE 2 | H16: ORCHARD 2 | K16: HORAZCKO 2 | N16: MILLER 2 | Q16: MELAI | S16: PAYZE | W16: PRAHRAN | X16: 1 | Y16: 0 | Z16: 0 | AA16: 118 | AB16: 97 | AC16: 121.65 | AD16: 4 | CB16: {GOTO}BJ123~/M{RIGHT 7}{END}{DOWN}~G64~
A17: SANDRINGHAM | D17: HUTCHINSON 2 | G17: CARRIGG 2 | J17: R MURRAY 2 | M17: K MURRAY | P17: HICKS | R17: EDDY | T17: SIMPSON | W17: PRESTON | X17: 1 | Y17: 0 | Z17: 0 | AA17: 127 | AB17: 107 | AC17: 118.69158878504673 | AD17: 4 | CB17: {GOTO}AL63~/M{END}{RIGHT}{END}{DOWN}~P63~
CB18: {GOTO}BJ143~/M{RIGHT 7}{END}{DOWN}~V64~
A19: COBURG | C19: 4 | D19: 3 | E19: =C19*6+D19 -> 27 | G19: 8 | H19: 9 | I19: =G19*6+H19 -> 57 | K19: 10 | L19: 13 | M19: =K19*6+L19 -> 73 | O19: 14 | P19: 18 | Q19: =O19*6+P19 -> 102 | S19: BRUNSWICK | W19: GEELONG WEST | X19: 1 | Y19: 0 | Z19: 0 | AA19: 106 | AB19: 101 | AC19: 104.95049504950495 | AD19: 4 | CB19: {GOTO}BJ163~/M{RIGHT 7}{END}{DOWN}~G84~
A20: BRUNSWICK | C20: 1 | D20: 4 | E20: =C20*6+D20 -> 10 | G20: 2 | H20: 6 | I20: =G20*6+H20 -> 18 | K20: 5 | L20: 9 | M20: =K20*6+L20 -> 39 | O20: 11 | P20: 15 | Q20: =O20*6+P20 -> 81 | S20: McGIBBON | W20: OAKLEIGH | X20: 0 | Y20: 1 | Z20: 0 | AA20: 101 | AB20: 106 | AC20: 95.283018867924525 | AD20: 0 | CB20: {GOTO}AL83~/M{END}{RIGHT}{END}{DOWN}~P83~
A21: BEST PLAYERS | W21: PORT MELBOURNE | X21: 0 | Y21: 1 | Z21: 0 | AA21: 107 | AB21: 127 | AC21: 84.251968503937007 | AD21: 0 | CB21: {GOTO}BJ183~/M{RIGHT 7}{END}{DOWN}~V84~
A22: COBURG | D22: HODGETTS | G22: FORMOSA | J22: F LLOYD | M22: MANNIX | P22: HOBBS | W22: CAULFIELD | X22: 0 | Y22: 1 | Z22: 0 | AA22: 97 | AB22: 118 | AC22: 82.2 | AD22: 0 | CB22: {GOTO}BJ203~/M{RIGHT 7}{END}{DOWN}~G104~
A23: BRUNSWICK | D23: WARDEN | G23: K LLOYD | J23: NOLAN | M23: SKIDMORE | P23: FELTHAM | S23: LAXTON | W23: BRUNSWICK | X23: 0 | Y23: 1 | Z23: 0 | AA23: 81 | AB23: 102 | AC23: 79.411764705882348 | AD23: 0 | CB23: {GOTO}AL103~/M{END}{RIGHT}{END}{DOWN}~P103~
A24: GOALKICKERS | W24: SANDRINGHAM | X24: 0 | Y24: 1 | Z24: 0 | AA24: 71 | AB24: 92 | AC24: 77.173913043478265 | AD24: 0 | CB24: {GOTO}BJ223~/M{RIGHT 7}{END}{DOWN}~V104~
A25: COBURG | D25: SMITH 4 | G25: HODGETTS 4 | J25: FORMOSA 3 | M25: GALE | O25: BURT | Q25: CLEARY | CB25: {GOTO}BJ243~/M{RIGHT 7}{END}{DOWN}~G124~
A26: BRUNSWICK | D26: K LLOYD 4 | G26: WARDEN 3 | J26: BRIGHAM 2 | M26: ORTON 2 | CB26: {GOTO}AL123~/M{END}{RIGHT}{END}{DOWN}~P123~
CB27: {GOTO}BJ263~/M{RIGHT 7}{END}{DOWN}~V124~
A28: PRESTON | C28: 4 | D28: 3 | E28: =C28*6+D28 -> 27 | G28: 5 | H28: 3 | I28: =G28*6+H28 -> 33 | K28: 15 | L28: 9 | M28: =K28*6+L28 -> 99 | O28: 19 | P28: 13 | Q28: =O28*6+P28 -> 127 | S28: PRESTON | CB28: {GOTO}BJ283~/M{RIGHT 7}{END}{DOWN}~G144~
A29: PORT MELBOURNE | C29: 4 | D29: 3 | E29: =C29*6+D29 -> 27 | G29: 10 | H29: 11 | I29: =G29*6+H29 -> 71 | K29: 11 | L29: 12 | M29: =K29*6+L29 -> 78 | O29: 15 | P29: 17 | Q29: =O29*6+P29 -> 107 | S29: WENN | CB29: {GOTO}AL143~/M{END}{RIGHT}{END}{DOWN}~P143~
A30: BEST PLAYERS | CB30: {GOTO}BJ303~/M{RIGHT 7}{END}{DOWN}~V144~
A31: PRESTON | D31: SMITH | G31: MARSHALL | J31: RENWICK | M31: CRANAGE | P31: ROBINSON | S31: STEWART | CB31: {GOTO}BJ323~/M{RIGHT 7}{END}{DOWN}~G164~
A32: PORT MELBOURNE | D32: BARROT | G32: COOK | J32: ALLEN | M32: PROFFIT | P32: BEHAN | CB32: {GOTO}AL163~/M{END}{RIGHT}{END}{DOWN}~P163~
A33: GOALKICKERS | CB33: {GOTO}BJ343~/M{RIGHT 7}{END}{DOWN}~V164~
A34: PRESTON | D34: RENWICK 4 | G34: STEWART 4 | J34: SMITH 3 | L34: ROBINSON 3 | O34: MARKS 2 | Q34: MARSHALL | T34: GRELLETT | W34: DUCKWORTH | CB34: {HOME}
A35: PORT MELBOURNE | D35: COOK 7 | G35: HOLT 3 | I35: EVANS 2 | K35: BOND | M35: BROWN | O35: WHARTON
A37: GEELONG WEST | C37: 6 | D37: 4 | E37: =C37*6+D37 -> 40 | G37: 8 | H37: 8 | I37: =G37*6+H37 -> 56 | K37: 9 | L37: 17 | M37: =K37*6+L37 -> 71 | O37: 14 | P37: 22 | Q37: =O37*6+P37 -> 106 | S37: OAKLEIGH
A38: OAKLEIGH | C38: 0 | D38: 5 | E38: =C38*6+D38 -> 5 | G38: 5 | H38: 7 | I38: =G38*6+H38 -> 37 | K38: 10 | L38: 10 | M38: =K38*6+L38 -> 70 | O38: 14 | P38: 17 | Q38: =O38*6+P38 -> 101 | S38: HAYES
A39: BEST PLAYERS
A40: GEELONG WEST | D40: HINDSON | G40: FRIEND | J40: WOOLFE | M40: STOKES | P40: WELLS | S40: GILMORE
A41: OAKLEIGH | D41: KING | G41: PETTIGREW | J41: WHITE | M41: STEWART | P41: BECK | S41: D NISBET
A42: GOALKICKERS
A43: GEELONG WEST | D43: RADOJEVIC 5 | G43: GILMORE 3 | J43: WELLS 3 | M43: STOKES | O43: BARCLAY | R43: WOOLFE
A44: OAKLEIGH | D44: WHITE 5 | G44: HAY 3 | I44: McDONALD 3 | L44: KING | N44: PETTIGREW | Q44: EDWARDS
A46: PRAHRAN | C46: 4 | D46: 3 | E46: =C46*6+D46 -> 27 | G46: 9 | H46: 8 | I46: =G46*6+H46 -> 62 | K46: 12 | L46: 10 | M46: =K46*6+L46 -> 82 | O46: 17 | P46: 16 | Q46: =O46*6+P46 -> 118 | S46: TOORAK PARK
A47: CAULFIELD | C47: 5 | D47: 8 | E47: =C47*6+D47 -> 38 | G47: 8 | H47: 9 | I47: =G47*6+H47 -> 57 | K47: 12 | L47: 12 | M47: =K47*6+L47 -> 84 | O47: 13 | P47: 19 | Q47: =O47*6+P47 -> 97 | S47: ABBOTT
A48: BEST PLAYERS
A49: PRAHRAN | D49: TOWNSEND | G49: LINDQUIST | J49: JOHNSTON | M49: ROBERTS | P49: WILLIAMS | S49: McGUINNESS
A50: CAULFIELD | D50: TEMPEST | G50: JACKS | J50: EINSEDEL | M50: DAVIDSON | P50: E MOORE | S50: HAYWOOD
A51: GOALKICKERS
A52: PRAHRAN | D52: WILLIAMS 4 | G52: K SMITH 3 | J52: JOHNSTON 3 | M52: PAYNE 2 | O52: McGUINNESS 2 | R52: LINDQUIST | U52: CLARKE | W52: DICKSON
A53: CAULFIELD | D53: HAWKING 3 | G53: BEATON 2 | I53: TAYLOR 2 | K53: HAYWOOD | N53: MAGUIRE | Q53: DAVIDSON | T53: CLIFF | V53: MILNER | X53: FRIGO
A55: ROUND 2 | E55: 2ND MAY | S55: PLAYED AT
D56: 1ST QTR | H56: 2ND QTR | J56: WEATHER | N56: FINE | P56: FINAL | S56: COBURG
A57: COBURG | C57: 7 | D57: 5 | E57: =C57*6+D57 -> 47 | G57: 11 | H57: 8 | I57: =G57*6+H57 -> 74 | K57: 16 | L57: 10 | M57: =K57*6+L57 -> 106 | O57: 18 | P57: 12 | Q57: =O57*6+P57 -> 120 | S57: UMPIRE | X57: LADDER | AB57: ROUND | AD57: 2
A58: PRAHRAN | C58: 3 | D58: 3 | E58: =C58*6+D58 -> 21 | G58: 8 | H58: 6 | I58: =G58*6+H58 -> 54 | K58: 13 | L58: 8 | M58: =K58*6+L58 -> 86 | O58: 17 | P58: 10 | Q58: =O58*6+P58 -> 112 | S58: OGSTON
A59: BEST PLAYERS | W59: TEAM | X59: W | Y59: L | Z59: D | AA59: FOR | AB59: AGST | AC59: % | AD59: PTS
A60: COBURG | D60: HEADLAM | G60: JOSS | J60: HOBBS | M60: GALE | O60: MANNIX | R60: HERBERT
A61: PRAHRAN | D61: ANDERSON | G61: TOWNSEND | J61: DICKSON | M61: WILLIAMS | O61: WILKIE | W61: COBURG | X61: 2 | Y61: 0 | Z61: 0 | AA61: 222 | AB61: 193 | AC61: 115.03 | AD61: 8
A62: GOALKICKERS | Q62: HOBBS | S62: BEATTIE | W62: GEELONG WEST | X62: 2 | Y62: 0 | Z62: 0 | AA62: 203 | AB62: 186 | AC62: 109.13978494623656 | AD62: 8
A63: COBURG | D63: SMITH 4 | F63: GALE 3 | H63: CLEARY 3 | J63: HODGETTS 2 | M63: HEADLAM | O63: BURT | P63: BROWN | R63: FORMOSA | W63: PORT MELBOURNE | X63: 1 | Y63: 1 | Z63: 0 | AA63: 257 | AB63: 225 | AC63: 114.22222222222223 | AD63: 4
A64: PRAHRAN | D64: WILLIAMS 7 | G64: K SMITH 3 | J64: DICKSON 3 | M64: JOHNSTON 2 | P64: CLARKE | R64: ANDERSON | W64: SANDRINGHAM | X64: 1 | Y64: 1 | Z64: 0 | AA64: 209 | AB64: 187 | AC64: 111.76470588235294 | AD64: 4
A66: GEELONG WEST | C66: 5 | D66: 4 | E66: =C66*6+D66 -> 34 | G66: 8 | H66: 7 | I66: =G66*6+H66 -> 55 | K66: 10 | L66: 10 | M66: =K66*6+L66 -> 70 | O66: 14 | P66: 13 | Q66: =O66*6+P66 -> 97 | S66: GEELONG WEST | W66: PRAHRAN | X66: 1 | Y66: 1 | Z66: 0 | AA66: 230 | AB66: 217 | AC66: 105.99 | AD66: 4
A67: DANDENONG | C67: 4 | D67: 3 | E67: =C67*6+D67 -> 27 | G67: 6 | H67: 9 | I67: =G67*6+H67 -> 45 | K67: 9 | L67: 14 | M67: =K67*6+L67 -> 68 | O67: 11 | P67: 19 | Q67: =O67*6+P67 -> 85 | S67: WENN | W67: DANDENONG | X67: 1 | Y67: 1 | Z67: 0 | AA67: 177 | AB67: 168 | AC67: 105.35714285714286 | AD67: 4
A68: BEST PLAYERS | W68: PRESTON | X68: 1 | Y68: 1 | Z68: 0 | AA68: 236 | AB68: 231 | AC68: 102.16450216450217 | AD68: 4
A69: GEELONG WEST | D69: VILLAROSA | G69: GILMORE | J69: HUGHES | M69: HINDSON | O69: ARKLAY | W69: CAULFIELD | X69: 1 | Y69: 1 | Z69: 0 | AA69: 221 | AB69: 227 | AC69: 97.36 | AD69: 4
A70: DANDENONG | D70: THOMPSON | G70: DROSCHER | J70: MILLER | M70: BRIESE | O70: HARRINGTON | W70: OAKLEIGH | X70: 0 | Y70: 2 | Z70: 0 | AA70: 199 | AB70: 256 | AC70: 77.734375 | AD70: 0
A71: GOALKICKERS | W71: BRUNSWICK | X71: 0 | Y71: 2 | Z71: 0 | AA71: 176 | AB71: 240 | AC71: 73.333333333333329 | AD71: 0
A72: GEELONG WEST | D72: HUGHES 5 | G72: VILLAROSA 3 | J72: WELLS 2 | M72: YATES | O72: STOKES | Q72: WOOLFE | S72: RADOJEVIC
A73: DANDENONG | D73: MILLER 5 | G73: FLAHERTY 2 | J73: BRIESE | M73: HIBBERT | O73: MELAI | Q73: HORAZCKO
A75: PORT MELBOURNE | C75: 3 | D75: 4 | E75: =C75*6+D75 -> 22 | G75: 8 | H75: 6 | I75: =G75*6+H75 -> 54 | K75: 16 | L75: 11 | M75: =K75*6+L75 -> 107 | O75: 22 | P75: 18 | Q75: =O75*6+P75 -> 150 | S75: PORT MELBOURNE
A76: OAKLEIGH | C76: 3 | D76: 1 | E76: =C76*6+D76 -> 19 | G76: 6 | H76: 4 | I76: =G76*6+H76 -> 40 | K76: 9 | L76: 10 | M76: =K76*6+L76 -> 64 | O76: 14 | P76: 14 | Q76: =O76*6+P76 -> 98 | S76: STABB
A77: BEST PLAYERS
A78: PORT MELBOURNE | D78: PROFFIT | G78: COOK | J78: R CRITCH | M78: EVANS | P78: WHARTON | S78: NEWTON
A79: OAKLEIGH | D79: KING | G79: GAUNT | J79: ROLFE | M79: PETTIGREW | P79: STEWART
A80: GOALKICKERS
A81: PORT MELBOURNE | D81: COOK 6 | G81: WHARTON 6 | J81: MERRINGTON 4 | N81: HOLT 3 | P81: COLLINS 2 | S81: NEWTON
A82: OAKLEIGH | D82: ROLFE 5 | G82: NEITZ 3 | I82: FOOTE 2 | K82: McDONALD 2 | N82: KING | P82: GAUNT
A84: SANDRINGHAM | C84: 5 | D84: 4 | E84: =C84*6+D84 -> 34 | G84: 6 | H84: 15 | I84: =G84*6+H84 -> 51 | K84: 13 | L84: 22 | M84: =K84*6+L84 -> 100 | O84: 19 | P84: 24 | Q84: =O84*6+P84 -> 138 | S84: BEACH ROAD
A85: BRUNSWICK | C85: 3 | D85: 2 | E85: =C85*6+D85 -> 20 | G85: 9 | H85: 10 | I85: =G85*6+H85 -> 64 | K85: 9 | L85: 12 | M85: =K85*6+L85 -> 66 | O85: 13 | P85: 17 | Q85: =O85*6+P85 -> 95 | S85: OAKLEY
A86: BEST PLAYERS
A87: SANDRINGHAM | D87: EDDY | G87: EDWARDS | J87: R MURRAY | M87: MACKENZIE | P87: CARIGG | S87: BEUS
A88: BRUNSWICK | D88: STONE | G88: HADZILLIAS | J88: SKIDMORE | M88: NOLAN | P88: LLOYD | S88: WARDEN
A89: GOALKICKERS
A90: SANDRINGHAM | D90: R MURRAY 7 | G90: EDDY 5 | I90: HUDSON 3 | L90: CARIGG | N90: NICHOLSON | Q90: HUTCHINSON | T90: PLEDGER
A91: BRUNSWICK | D91: LLOYD 3 | G91: STONE 2 | I91: WARDEN 2 | L91: VALENTINE 2 | O91: FITZPATRICK | R91: NUNN | T91: SCHIMMELBUSCH | X91: ORTON
A93: CAULFIELD | C93: 7 | D93: 9 | E93: =C93*6+D93 -> 51 | G93: 8 | H93: 14 | I93: =G93*6+H93 -> 62 | K93: 14 | L93: 19 | M93: =K93*6+L93 -> 103 | O93: 17 | P93: 22 | Q93: =O93*6+P93 -> 124 | S93: PRINCES PARK
A94: PRESTON | C94: 2 | D94: 4 | E94: =C94*6+D94 -> 16 | G94: 8 | H94: 10 | I94: =G94*6+H94 -> 58 | K94: 11 | L94: 13 | M94: =K94*6+L94 -> 79 | O94: 15 | P94: 19 | Q94: =O94*6+P94 -> 109 | S94: TORNEY
A95: BEST PLAYERS
A96: CAULFIELD | D96: ROWE | G96: BALL | J96: CLIFF | M96: MAGUIRE | P96: MILNER | S96: JEWELL
A97: PRESTON | D97: RENWICK | G97: LESLIE | J97: DURWOOD | M97: STEWART | P97: GRELLET | S97: SMITH
A98: GOALKICKERS
A99: CAULFIELD | D99: MILNER 5 | G99: DAVIDSON 3 | J99: CLIFF 3 | L99: ROWE 2 | N99: GOWANS 2 | Q99: BOOTH | S99: B MAGUIRE
A100: PRESTON | D100: STEWART 3 | G100: MARKS 3 | I100: RENWICK 2 | L100: WEIGHTMAN 2 | O100: CARLSON 2 | R100: IRELAND | U100: SMITH | W100: LORENZINI
A102: ROUND 3 | E102: 9TH MAY | J102: WEATHER | N102: FINE | S102: PLAYED AT
D103: 1ST QTR | H103: 2ND QTR | L103: 3RD QTR | P103: FINAL | S103: PORT MELBOURNE
A104: GEELONG WEST | C104: 5 | D104: 2 | E104: =C104*6+D104 -> 32 | G104: 7 | H104: 5 | I104: =G104*6+H104 -> 47 | K104: 14 | L104: 14 | M104: =K104*6+L104 -> 98 | O104: 16 | P104: 19 | Q104: =O104*6+P104 -> 115 | S104: UMPIRE | X104: LADDER | AB104: ROUND | AD104: 3
A105: PORT MELBOURNE | C105: 2 | D105: 4 | E105: =C105*6+D105 -> 16 | G105: 8 | H105: 12 | I105: =G105*6+H105 -> 60 | K105: 11 | L105: 16 | M105: =K105*6+L105 -> 82 | O105: 15 | P105: 23 | Q105: =O105*6+P105 -> 113 | S105: OGSTON
A106: BEST PLAYERS | W106: TEAM | X106: W | Y106: L | Z106: D | AA106: FOR | AB106: AGST | AC106: % | AD106: PTS
A107: GEELONG WEST | D107: GILMORE | G107: RADOJEVIC | J107: VILLAROSA | M107: HUGHES | O107: HINDSON | R107: McMILLAN
A108: PORT MELBOURNE | D108: WHARTON | G108: R CRITCH | J108: MERRINGTON | M108: BARROT | O108: HOLT | W108: GEELONG WEST | X108: 3 | Y108: 0 | Z108: 0 | AA108: 318 | AB108: 299 | AC108: 106.35451505016722 | AD108: 12
A109: GOALKICKERS | Q109: HUGHES | W109: PRESTON | X109: 2 | Y109: 1 | Z109: 0 | AA109: 372 | AB109: 347 | AC109: 107.20461095100865 | AD109: 8
A110: GEELONG WEST | D110: RADOJEVIC 7 | G110: STENNETT 3 | J110: STOKES 2 | M110: WOOLFE | O110: VILLAROSA | R110: HINDSON | W110: CAULFIELD | X110: 2 | Y110: 1 | Z110: 0 | AA110: 338 | AB110: 321 | AC110: 105.3 | AD110: 8
A111: PORT MELBOURNE | D111: COOK 4 | F111: HOLT 3 | H111: WHARTON 3 | K111: MERRINGTON 2 | N111: BARROT | P111: RASMUSSEN | S111: EVANS | W111: PRAHRAN | X111: 2 | Y111: 1 | Z111: 0 | AA111: 356 | AB111: 333 | AC111: 106.91 | AD111: 8
A113: PRESTON | C113: 4 | D113: 5 | E113: =C113*6+D113 -> 29 | G113: 8 | H113: 7 | I113: =G113*6+H113 -> 55 | K113: 13 | L113: 12 | M113: =K113*6+L113 -> 90 | O113: 20 | P113: 16 | Q113: =O113*6+P113 -> 136 | S113: PRESTON | W113: COBURG | X113: 2 | Y113: 1 | Z113: 0 | AA113: 338 | AB113: 329 | AC113: 102.74 | AD113: 8
A114: COBURG | C114: 5 | D114: 5 | E114: =C114*6+D114 -> 35 | G114: 7 | H114: 13 | I114: =G114*6+H114 -> 55 | K114: 13 | L114: 18 | M114: =K114*6+L114 -> 96 | O114: 16 | P114: 20 | Q114: =O114*6+P114 -> 116 | S114: HAYES | W114: PORT MELBOURNE | X114: 1 | Y114: 2 | Z114: 0 | AA114: 370 | AB114: 340 | AC114: 108.82352941176471 | AD114: 4
A115: BEST PLAYERS | W115: SANDRINGHAM | X115: 1 | Y115: 2 | Z115: 0 | AA115: 325 | AB115: 313 | AC115: 103.83386581469648 | AD115: 4
A116: PRESTON | D116: LESLIE | G116: DURWOOD | J116: MARKS | M116: GRAINGER | O116: MARSHALL | R116: SMITH | W116: DANDENONG | X116: 1 | Y116: 2 | Z116: 0 | AA116: 295 | AB116: 288 | AC116: 102.43055555555556 | AD116: 4
A117: COBURG | D117: FORMOSA | G117: SLATER | J117: HODGETTS | M117: MANNIX | O117: HOBBS | W117: BRUNSWICK | X117: 1 | Y117: 2 | Z117: 0 | AA117: 296 | AB117: 358 | AC117: 82.681564245810051 | AD117: 4
A118: GOALKICKERS | W118: OAKLEIGH | X118: 0 | Y118: 3 | Z118: 0 | AA118: 293 | AB118: 373 | AC118: 78.552278820375335 | AD118: 0
A119: PRESTON | D119: LORENZINI 4 | G119: RENWICK 4 | J119: STEWART 3 | M119: WEIGHTMAN 3 | P119: SMITH 3 | R119: CARLSON 2 | U119: IRELAND
A120: COBURG | D120: FORMOSA 4 | G120: HODGETTS 4 | J120: SMITH 3 | M120: BEATTIE 2 | P120: GALE | R120: CLEARY | T120: SCHOLES
A122: PRAHRAN | C122: 9 | D122: 4 | E122: =C122*6+D122 -> 58 | G122: 13 | H122: 6 | I122: =G122*6+H122 -> 84 | K122: 16 | L122: 12 | M122: =K122*6+L122 -> 108 | O122: 18 | P122: 18 | Q122: =O122*6+P122 -> 126 | S122: TOORAK PARK
A123: SANDRINGHAM | C123: 3 | D123: 4 | E123: =C123*6+D123 -> 22 | G123: 9 | H123: 7 | I123: =G123*6+H123 -> 61 | K123: 13 | L123: 14 | M123: =K123*6+L123 -> 92 | O123: 17 | P123: 14 | Q123: =O123*6+P123 -> 116 | S123: McGIBBON
A124: BEST PLAYERS
A125: PRAHRAN | D125: DICKSON | G125: MURRAY | J125: TOWNSEND | M125: ANDERSON | P125: McGUINNESS | S125: JOHNSTON
A126: SANDRINGHAM | D126: HUTCHINSON | G126: MACKENZIE | J126: OWENS | M126: LIDDELL | P126: CLARK | S126: HUDSON
A127: GOALKICKERS
A128: PRAHRAN | D128: WILLIAMS 4 | G128: DICKSON 3 | J128: CLARKE 3 | M128: K SMITH 3 | P128: JOHNSTON 2 | S128: TOWNSEND | V128: PAYNE | X128: ANDERSON
A129: SANDRINGHAM | D129: HUTCHINSON 4 | G129: R MURRAY 4 | J129: BEUS 3 | M129: MACKENZIE 2 | P129: HUDSON 2 | R129: OWENS | T129: EDDY
A131: CAULFIELD | C131: 7 | D131: 7 | E131: =C131*6+D131 -> 49 | G131: 10 | H131: 9 | I131: =G131*6+H131 -> 69 | K131: 13 | L131: 15 | M131: =K131*6+L131 -> 93 | O131: 16 | P131: 21 | Q131: =O131*6+P131 -> 117 | S131: OAKLEIGH
A132: OAKLEIGH | C132: 2 | D132: 2 | E132: =C132*6+D132 -> 14 | G132: 7 | H132: 5 | I132: =G132*6+H132 -> 47 | K132: 9 | L132: 8 | M132: =K132*6+L132 -> 62 | O132: 14 | P132: 10 | Q132: =O132*6+P132 -> 94 | S132: STEER
A133: BEST PLAYERS
A134: CAULFIELD | D134: HAYWOOD | G134: MAGUIRE | J134: TEMPEST | M134: MOORE | P134: HAWKING | S134: TAYLOR
A135: OAKLEIGH | D135: ROLFE | G135: LILLEY | J135: D NESBIT | M135: KING | P135: ALLISEY
A136: GOALKICKERS
A137: CAULFIELD | D137: MOORE 6 | G137: BOOTH 2 | I137: GOWANS 2 | L137: HAWKING 2 | O137: MILNER 2 | Q137: ROWE | S137: DAVIDSON
A138: OAKLEIGH | D138: ROLFE 5 | G138: LILLEY 3 | I138: KING 2 | K138: PETTIGREW | N138: FOOTE | P138: ALLISEY | R138: NEITZ
A140: BRUNSWICK | C140: 3 | D140: 5 | E140: =C140*6+D140 -> 23 | G140: 7 | H140: 7 | I140: =G140*6+H140 -> 49 | K140: 12 | L140: 8 | M140: =K140*6+L140 -> 80 | O140: 18 | P140: 12 | Q140: =O140*6+P140 -> 120 | S140: BRUNSWICK
A141: DANDENONG | C141: 2 | D141: 3 | E141: =C141*6+D141 -> 15 | G141: 6 | H141: 7 | I141: =G141*6+H141 -> 43 | K141: 12 | L141: 8 | M141: =K141*6+L141 -> 80 | O141: 18 | P141: 10 | Q141: =O141*6+P141 -> 118 | S141: VERGONA
A142: BEST PLAYERS
A143: BRUNSWICK | D143: ORTON | G143: WARDEN | J143: VALENTINE | M143: ROWE | O143: STONE | R143: LAXTON
A144: DANDENONG | D144: DROSCHER | G144: SHINNERS | J144: BRIESE | M144: MILLER | O144: TAYLOR
A145: GOALKICKERS
A146: BRUNSWICK | D146: ORTON 10 | G146: VALENTINE 3 | J146: LLOYD 2 | M146: P FELTHAM | P146: SCHIMMELBUSCH | T146: LAXTON
A147: DANDENONG | D147: MILLER 7 | G147: DROSCHER 3 | J147: TAYLOR 3 | M147: BRIESE 2 | O147: SHINNERS 2 | R147: SHEVLIN
A149: ROUND 4 | E149: 16TH MAY | J149: WEATHER | N149: SHOWERS | S149: PLAYED AT
D150: 1ST QTR | H150: 2ND QTR | L150: 3RD QTR | P150: FINAL | S150: PRINCES PARK
A151: PORT MELBOURNE | C151: 2 | D151: 6 | E151: =C151*6+D151 -> 18 | G151: 10 | H151: 9 | I151: =G151*6+H151 -> 69 | K151: 14 | L151: 12 | M151: =K151*6+L151 -> 96 | O151: 23 | P151: 17 | Q151: =O151*6+P151 -> 155 | S151: UMPIRE | X151: LADDER | AB151: ROUND | AD151: 4
A152: CAULFIELD | C152: 6 | D152: 6 | E152: =C152*6+D152 -> 42 | G152: 8 | H152: 6 | I152: =G152*6+H152 -> 54 | K152: 15 | L152: 11 | M152: =K152*6+L152 -> 101 | O152: 17 | P152: 12 | Q152: =O152*6+P152 -> 114 | S152: HAYES
A153: BEST PLAYERS | W153: TEAM | X153: W | Y153: L | Z153: D | AA153: FOR | AB153: AGST | AC153: % | AD153: PTS
A154: PORT MELBOURNE | D154: COOK | G154: G ALLEN | J154: BEHAN | M154: HAENAN | P154: RASMUSSEN | S154: MOLLOY
A155: CAULFIELD | D155: EINSEDEL | G155: HAYWOOD | J155: E MOORE | M155: MILNER | P155: TEMPEST | S155: BECK | W155: GEELONG WEST | X155: 4 | Y155: 0 | Z155: 0 | AA155: 431 | AB155: 390 | AC155: 110.51282051282051 | AD155: 16
A156: GOALKICKERS | W156: COBURG | X156: 3 | Y156: 1 | Z156: 0 | AA156: 399 | AB156: 389 | AC156: 102.57 | AD156: 12
A157: PORT MELBOURNE | D157: COOK 11 | F157: RASMUSSEN 5 | I157: BOND 3 | K157: BEHAN | M157: BARROT | O157: MERRINGTON | R157: WHARTON | W157: SANDRINGHAM | X157: 2 | Y157: 2 | Z157: 0 | AA157: 469 | AB157: 398 | AC157: 117.8391959798995 | AD157: 8
A158: CAULFIELD | D158: E MOORE 5 | F158: MILNER 3 | I158: M MOORE 2 | L158: BECK 2 | N158: HAWKING 2 | Q158: EINSEDEL | S158: BOOTH | W158: PORT MELBOURNE | X158: 2 | Y158: 2 | Z158: 0 | AA158: 525 | AB158: 454 | AC158: 115.63876651982379 | AD158: 8
R159: ROWE
A160: SANDRINGHAM | C160: 5 | D160: 12 | E160: =C160*6+D160 -> 42 | G160: 8 | H160: 15 | I160: =G160*6+H160 -> 63 | K160: 14 | L160: 19 | M160: =K160*6+L160 -> 103 | O160: 20 | P160: 24 | Q160: =O160*6+P160 -> 144 | S160: BEACH ROAD | W160: DANDENONG | X160: 2 | Y160: 2 | Z160: 0 | AA160: 398 | AB160: 382 | AC160: 104.18848167539267 | AD160: 8
A161: PRESTON | C161: 1 | D161: 2 | E161: =C161*6+D161 -> 8 | G161: 4 | H161: 11 | I161: =G161*6+H161 -> 35 | K161: 7 | L161: 13 | M161: =K161*6+L161 -> 55 | O161: 11 | P161: 19 | Q161: =O161*6+P161 -> 85 | S161: MARCY | W161: PRAHRAN | X161: 2 | Y161: 2 | Z161: 0 | AA161: 450 | AB161: 436 | AC161: 103.21 | AD161: 8
A162: BEST PLAYERS | W162: CAULFIELD | X162: 2 | Y162: 2 | Z162: 0 | AA162: 452 | AB162: 476 | AC162: 94.96 | AD162: 8
A163: SANDRINGHAM | D163: PLEDGER | G163: HUTCHINSON | J163: LIDDELL | M163: EDWARDS | P163: GOOLD | R163: MACKENZIE | W163: PRESTON | X163: 2 | Y163: 2 | Z163: 0 | AA163: 457 | AB163: 491 | AC163: 93.075356415478609 | AD163: 8
A164: PRESTON | D164: MARKS | G164: LESLIE | J164: RENWICK | M164: SMITH | P164: DURWOOD | W164: BRUNSWICK | X164: 1 | Y164: 3 | Z164: 0 | AA164: 387 | AB164: 471 | AC164: 82.165605095541395 | AD164: 4
A165: GOALKICKERS | S165: SIMPSON | W165: OAKLEIGH | X165: 0 | Y165: 4 | Z165: 0 | AA165: 353 | AB165: 434 | AC165: 81.336405529953922 | AD165: 0
A166: SANDRINGHAM | D166: EDDY 5 | F166: HUTCHINSON 4 | I166: PLEDGER 4 | K166: BEUS 2 | M166: O'BRIEN | O166: DYNON | Q166: MACKENZIE | T166: R MURRAY
A167: PRESTON | D167: MARKS 3 | G167: STEWART 2 | J167: SMITH 2 | M167: CRANAGE 2 | P167: GRELLET | R167: LORENZINI
A169: DANDENONG | C169: 1 | D169: 3 | E169: =C169*6+D169 -> 9 | G169: 9 | H169: 10 | I169: =G169*6+H169 -> 64 | K169: 9 | L169: 10 | M169: =K169*6+L169 -> 64 | O169: 14 | P169: 19 | Q169: =O169*6+P169 -> 103 | S169: DANDENONG
A170: PRAHRAN | C170: 5 | D170: 6 | E170: =C170*6+D170 -> 36 | G170: 6 | H170: 7 | I170: =G170*6+H170 -> 43 | K170: 11 | L170: 14 | M170: =K170*6+L170 -> 80 | O170: 13 | P170: 16 | Q170: =O170*6+P170 -> 94 | S170: OGSTON
A171: BEST PLAYERS
A172: DANDENONG | D172: SHINNERS | G172: VAN DE BEEK | J172: TAYLOR | M172: HIBBERT | P172: HAMMOND | S172: TRUEMAN
A173: PRAHRAN | D173: ANDERSON | G173: WILLIAMS | J173: DICKSON | M173: MURRAY | P173: TOWNSEND
A174: GOALKICKERS
A175: DANDENONG | D175: FLAHERTY 3 | G175: TAYLOR 3 | I175: MELAI 2 | K175: HIBBERT 2 | N175: BRIESE | P175: PAYZE | R175: BASSED | T175: HORAZCKO
A176: PRAHRAN | D176: JOHNSTON 3 | G176: SMITH 2 | I176: PAYNE 2 | K176: ANDERSON 2 | N176: DICKSON 2 | Q176: MURRAY | S176: LINDQUIST
A178: COBURG | C178: 2 | D178: 5 | E178: =C178*6+D178 -> 17 | G178: 5 | H178: 5 | I178: =G178*6+H178 -> 35 | K178: 7 | L178: 11 | M178: =K178*6+L178 -> 53 | O178: 8 | P178: 13 | Q178: =O178*6+P178 -> 61 | S178: COBURG
A179: OAKLEIGH | C179: 0 | D179: 3 | E179: =C179*6+D179 -> 3 | G179: 2 | H179: 6 | I179: =G179*6+H179 -> 18 | K179: 5 | L179: 10 | M179: =K179*6+L179 -> 40 | O179: 8 | P179: 12 | Q179: =O179*6+P179 -> 60 | S179: STABB
A180: BEST PLAYERS
A181: COBURG | D181: McTAGGART | G181: MANNIX | J181: GALE | M181: DOHNT | P181: HOBBS | S181: SLATER
A182: OAKLEIGH | D182: BECK | G182: KING | J182: GAUNT | M182: McGRATH | P182: PLILLEY
A183: GOALKICKERS
A184: COBURG | D184: SMITH 3 | G184: DOHNT | I184: PAUL | K184: CLEARY | M184: MANNIX | O184: HODGETTS
A185: OAKLEIGH | D185: EDWARDS 3 | G185: McDONALD 2 | K185: TESERIERO | N185: GAUNT | P185: WHITE
A187: GEELONG WEST | C187: 4 | D187: 2 | E187: =C187*6+D187 -> 26 | G187: 8 | H187: 7 | I187: =G187*6+H187 -> 55 | K187: 12 | L187: 13 | M187: =K187*6+L187 -> 85 | O187: 16 | P187: 17 | Q187: =O187*6+P187 -> 113 | S187: GEELONG WEST
A188: BRUNSWICK | C188: 4 | D188: 1 | E188: =C188*6+D188 -> 25 | G188: 7 | H188: 3 | I188: =G188*6+H188 -> 45 | K188: 10 | L188: 11 | M188: =K188*6+L188 -> 71 | O188: 13 | P188: 13 | Q188: =O188*6+P188 -> 91 | S188: McGIBBON
A189: BEST PLAYERS
A190: GEELONG WEST | D190: HUGHES | G190: EDDY | I190: HINDSON | L190: GILMORE | N190: STENNETT | R190: ARKLAY
A191: BRUNSWICK | D191: VALENTINE | G191: WARDEN | I191: STONE | L191: NOLAN | N191: SCHIMMELBUSCH | R191: HADZILLIAS
A192: GOALKICKERS
A193: GEELONG WEST | D193: RADOJEVIC 6 | G193: WELLS 4 | I193: HUGHES 2 | L193: WOOLFE 2 | N193: YATES | P193: EDDY | R193: STENNETT | U193: VILLAROSA
A194: BRUNSWICK | D194: CARLTON 3 | G194: SMITH 2 | I194: LLOYD 2 | K194: FITZPATRICK | N194: VALENTINE | Q194: WARDEN | S194: STONE | U194: LAXTON | X194: FELTHAM
A196: ROUND 5 | E196: 23RD MAY | J196: WEATHER | N196: RAIN & WIND | S196: PLAYED AT
D197: 1ST QTR | H197: 2ND QTR | L197: 3RD QTR | P197: FINAL | S197: GEELONG WEST
A198: GEELONG WEST | C198: 4 | D198: 1 | E198: =C198*6+D198 -> 25 | G198: 6 | H198: 5 | I198: =G198*6+H198 -> 41 | K198: 11 | L198: 7 | M198: =K198*6+L198 -> 73 | O198: 18 | P198: 10 | Q198: =O198*6+P198 -> 118 | S198: UMPIRE | X198: LADDER | AB198: ROUND | AD198: 5
A199: COBURG | C199: 3 | D199: 2 | E199: =C199*6+D199 -> 20 | G199: 5 | H199: 4 | I199: =G199*6+H199 -> 34 | K199: 7 | L199: 10 | M199: =K199*6+L199 -> 52 | O199: 12 | P199: 11 | Q199: =O199*6+P199 -> 83 | S199: VERGONA
A200: BEST PLAYERS | W200: TEAM | X200: W | Y200: L | Z200: D | AA200: FOR | AB200: AGST | AC200: % | AD200: PTS
A201: GEELONG WEST | D201: EDDY | G201: STOKES | J201: ARKLAY | M201: McMILLAN | P201: FRIEND
A202: COBURG | D202: HOBBS | G202: MANNIX | J202: CLEARY | M202: JOSS | P202: GALE | S202: PITT | W202: GEELONG WEST | X202: 5 | Y202: 0 | Z202: 0 | AA202: 549 | AB202: 473 | AC202: 116.0676532769556 | AD202: 20
A203: GOALKICKERS | R203: WOOLFE | W203: PORT MELBOURNE | X203: 3 | Y203: 2 | Z203: 0 | AA203: 647 | AB203: 536 | AC203: 120.70895522388059 | AD203: 12
A204: GEELONG WEST | D204: WELLS 6 | F204: RADOJEVIC 4 | I204: STENNETT 2 | L204: VILLAROSA 2 | O204: YATES | Q204: HUGHES | S204: GILMORE | W204: PRESTON | X204: 3 | Y204: 2 | Z204: 0 | AA204: 639 | AB204: 589 | AC204: 108.48896434634975 | AD204: 12
A205: COBURG | D205: CLEARY 4 | G205: SMITH 3 | I205: BEATTIE 2 | L205: GALE | N205: DOHNT | P205: PAUL | W205: CAULFIELD | X205: 3 | Y205: 2 | Z205: 0 | AA205: 583 | AB205: 564 | AC205: 103.37 | AD205: 12
A207: PORT MELBOURNE | C207: 2 | D207: 7 | E207: =C207*6+D207 -> 19 | G207: 5 | H207: 9 | I207: =G207*6+H207 -> 39 | K207: 12 | L207: 14 | M207: =K207*6+L207 -> 86 | O207: 17 | P207: 20 | Q207: =O207*6+P207 -> 122 | S207: PORT MELBOURNE | W207: COBURG | X207: 3 | Y207: 2 | Z207: 0 | AA207: 482 | AB207: 507 | AC207: 95.06 | AD207: 12
A208: DANDENONG | C208: 1 | D208: 5 | E208: =C208*6+D208 -> 11 | G208: 6 | H208: 8 | I208: =G208*6+H208 -> 44 | K208: 8 | L208: 11 | M208: =K208*6+L208 -> 59 | O208: 11 | P208: 16 | Q208: =O208*6+P208 -> 82 | S208: STABB | W208: SANDRINGHAM | X208: 2 | Y208: 3 | Z208: 0 | AA208: 557 | AB208: 529 | AC208: 105.29300567107751 | AD208: 8
A209: BEST PLAYERS | W209: DANDENONG | X209: 2 | Y209: 3 | Z209: 0 | AA209: 480 | AB209: 504 | AC209: 95.238095238095241 | AD209: 8
A210: PORT MELBOURNE | D210: MOLLOY | G210: HOLT | I210: STIBBARD | L210: BARROT | O210: BOND | Q210: HAENAN | W210: PRAHRAN | X210: 2 | Y210: 3 | Z210: 0 | AA210: 548 | AB210: 618 | AC210: 88.67 | AD210: 8
A211: DANDENONG | D211: DROSCHER | G211: BASSED | I211: SHINNERS | L211: FLAHERTY | O211: HIBBERT | Q211: VAN DE BEEK | W211: BRUNSWICK | X211: 1 | Y211: 3 | Z211: 1 | AA211: 455 | AB211: 539 | AC211: 84.415584415584419 | AD211: 6
A212: GOALKICKERS | Q212: RASMUSSEN | W212: OAKLEIGH | X212: 0 | Y212: 4 | Z212: 1 | AA212: 421 | AB212: 502 | AC212: 83.864541832669318 | AD212: 2
A213: PORT MELBOURNE | D213: COOK 4 | F213: HOLT 4 | H213: BOND 2 | J213: BARROT 2 | M213: MERRINGTON | P213: ALLEN | R213: STIBBARD | U213: COLBERT
A214: DANDENONG | D214: FLAHERTY 5 | G214: HIBBERT 2 | J214: MILLER 2 | M214: BASSED | O214: BRIESE
A216: CAULFIELD | C216: 4 | D216: 3 | E216: =C216*6+D216 -> 27 | G216: 8 | H216: 4 | I216: =G216*6+H216 -> 52 | K216: 16 | L216: 9 | M216: =K216*6+L216 -> 105 | O216: 20 | P216: 11 | Q216: =O216*6+P216 -> 131 | S216: PRINCES PARK
A217: SANDRINGHAM | C217: 3 | D217: 3 | E217: =C217*6+D217 -> 21 | G217: 5 | H217: 11 | I217: =G217*6+H217 -> 41 | K217: 8 | L217: 14 | M217: =K217*6+L217 -> 62 | O217: 12 | P217: 16 | Q217: =O217*6+P217 -> 88 | S217: WENN
A218: BEST PLAYERS
A219: CAULFIELD | D219: BECK | G219: HAYWOOD | J219: MILNER | M219: TEMPEST | P219: ROWE | R219: BOOTH
A220: SANDRINGHAM | D220: GOOLD | G220: OWEN | J220: MACKENZIE | M220: O'BRIEN | P220: EDDY
A221: GOALKICKERS
A222: CAULFIELD | D222: M MOORE 6 | G222: DAVIDSON 5 | J222: MILNER 4 | M222: RITTERMAN 2 | P222: BOOTH 2 | R222: HAWKING
A223: SANDRINGHAM | D223: O'BRIEN 3 | G223: EDDY 3 | I223: HUTCHINSON 2 | M223: LIDDELL | O223: GOOLD | Q223: MACKENZIE | T223: BEUS
A225: PRESTON | C225: 7 | D225: 4 | E225: =C225*6+D225 -> 46 | G225: 10 | H225: 8 | I225: =G225*6+H225 -> 68 | K225: 20 | L225: 12 | M225: =K225*6+L225 -> 132 | O225: 28 | P225: 14 | Q225: =O225*6+P225 -> 182 | S225: PRESTON
A226: PRAHRAN | C226: 4 | D226: 4 | E226: =C226*6+D226 -> 28 | G226: 8 | H226: 9 | I226: =G226*6+H226 -> 57 | K226: 10 | L226: 12 | M226: =K226*6+L226 -> 72 | O226: 14 | P226: 14 | Q226: =O226*6+P226 -> 98 | S226: STEELE
A227: BEST PLAYERS
A228: PRESTON | D228: MARSHALL | G228: MARKS | J228: DURWOOD | M228: LESLIE | P228: RENWICK | R228: CRANAGE
A229: PRAHRAN | D229: DICKSON | G229: WILLIAMS | J229: THURGOOD | M229: ANDERSON | P229: MURRAY | R229: CLARKE
A230: GOALKICKERS
A231: PRESTON | D231: CRANAGE 5 | G231: MARSHALL 4 | J231: MARKS 4 | L231: G SMITH 3 | N231: RENWICK 3 | Q231: ZEMSKI 3 | S231: LORENZINI 2 | W231: GRAINGER 2 | X231: GRELLET | Z231: STEWART
A232: PRAHRAN | D232: DICKSON 6 | G232: K SMITH 3 | J232: CLARKE | L232: JOHNSTON | N232: LINDQUIST | Q232: ANDERSON | T232: AHERNE
A234: OAKLEIGH | C234: 6 | D234: 2 | E234: =C234*6+D234 -> 38 | G234: 6 | H234: 2 | I234: =G234*6+H234 -> 38 | K234: 9 | L234: 6 | M234: =K234*6+L234 -> 60 | O234: 10 | P234: 8 | Q234: =O234*6+P234 -> 68 | S234: OAKLEIGH
A235: BRUNSWICK | C235: 1 | D235: 7 | E235: =C235*6+D235 -> 13 | G235: 2 | H235: 21 | I235: =G235*6+H235 -> 33 | K235: 5 | L235: 23 | M235: =K235*6+L235 -> 53 | O235: 7 | P235: 26 | Q235: =O235*6+P235 -> 68 | S235: FITZPATRICK
A236: BEST PLAYERS
A237: OAKLEIGH | D237: GOODMAN | G237: PETTIGREW | J237: LILLEY | M237: GAUNT | O237: D NESBIT | R237: C NESBIT
A238: BRUNSWICK | D238: SCHIMMELBUSCH | G238: STONE | J238: BUCKLEY | M238: ROWE | O238: NOLAN | R238: WARDEN
A239: GOALKICKERS
A240: OAKLEIGH | D240: LILLEY 3 | G240: EDWARDS 2 | J240: KING 2 | L240: COCCIARDI | O240: WHITE | Q240: D NESBIT
A241: BRUNSWICK | D241: O'KANE 2 | G241: CARLTON 2 | J241: SCHIMMELBUSCH | N241: WARDEN | P241: FELTHAM
A243: ROUND 6 | E243: 30TH MAY | J243: WEATHER | N243: STRONG NORTH WIND | S243: PLAYED AT
D244: 1ST QTR | H244: 2ND QTR | L244: 3RD QTR | P244: FINAL | S244: PRESTON
A245: PRESTON | C245: 1 | D245: 3 | E245: =C245*6+D245 -> 9 | G245: 9 | H245: 14 | I245: =G245*6+H245 -> 68 | K245: 11 | L245: 18 | M245: =K245*6+L245 -> 84 | O245: 17 | P245: 23 | Q245: =O245*6+P245 -> 125 | S245: UMPIRE | X245: LADDER | AB245: ROUND | AD245: 6
A246: GEELONG WEST | C246: 7 | D246: 3 | E246: =C246*6+D246 -> 45 | G246: 7 | H246: 3 | I246: =G246*6+H246 -> 45 | K246: 9 | L246: 8 | M246: =K246*6+L246 -> 62 | O246: 10 | P246: 9 | Q246: =O246*6+P246 -> 69 | S246: HAYES
A247: BEST PLAYERS | W247: TEAM | X247: W | Y247: L | Z247: D | AA247: FOR | AB247: AGST | AC247: % | AD247: PTS
A248: PRESTON | D248: SCHICKERT | G248: MARSHALL | J248: DURWOOD | M248: ZEMSKI | P248: CRANAGE | S248: O'SULLIVAN
A249: GEELONG WEST | D249: GILMORE | G249: HUGHES | J249: ARKLAY | M249: RADOJEVIC | P249: H SMITH | W249: GEELONG WEST | X249: 5 | Y249: 1 | Z249: 0 | AA249: 618 | AB249: 598 | AC249: 103.34448160535118 | AD249: 20
A250: GOALKICKERS | M250: O'SULLIVAN | P250: GRAINGER | R250: WEIGHTMAN | W250: PORT MELBOURNE | X250: 4 | Y250: 2 | Z250: 0 | AA250: 758 | AB250: 635 | AC250: 119.37007874015748 | AD250: 16
A251: PRESTON | D251: CRANAGE 5 | G251: STEWART 3 | J251: ZEMSKI 2 | M251: ROBINSON 2 | P251: DURWOOD | R251: MARSHALL | W251: PRESTON | X251: 4 | Y251: 2 | Z251: 0 | AA251: 764 | AB251: 658 | AC251: 116.10942249240122 | AD251: 16
A252: GEELONG WEST | D252: RADOJEVIC 4 | G252: HUGHES 2 | J252: WOOLFE | L252: STENNETT | O252: DEAN | Q252: GILMORE | W252: COBURG | X252: 4 | Y252: 2 | Z252: 0 | AA252: 615 | AB252: 599 | AC252: 102.67 | AD252: 16
A254: COBURG | C254: 5 | D254: 4 | E254: =C254*6+D254 -> 34 | G254: 8 | H254: 7 | I254: =G254*6+H254 -> 55 | K254: 16 | L254: 12 | M254: =K254*6+L254 -> 108 | O254: 20 | P254: 13 | Q254: =O254*6+P254 -> 133 | S254: BEACH ROAD | W254: PRAHRAN | X254: 3 | Y254: 3 | Z254: 0 | AA254: 717 | AB254: 678 | AC254: 105.75 | AD254: 12
A255: SANDRINGHAM | C255: 3 | D255: 3 | E255: =C255*6+D255 -> 21 | G255: 10 | H255: 4 | I255: =G255*6+H255 -> 64 | K255: 10 | L255: 8 | M255: =K255*6+L255 -> 68 | O255: 13 | P255: 14 | Q255: =O255*6+P255 -> 92 | S255: McGIBBON | W255: DANDENONG | X255: 3 | Y255: 3 | Z255: 0 | AA255: 613 | AB255: 592 | AC255: 103.54729729729729 | AD255: 12
A256: BEST PLAYERS | W256: CAULFIELD | X256: 3 | Y256: 3 | Z256: 0 | AA256: 671 | AB256: 697 | AC256: 96.27 | AD256: 12
A257: COBURG | D257: MANNIX | G257: FORMOSA | J257: BURT | M257: SLATER | O257: GALE | R257: JOSS | W257: SANDRINGHAM | X257: 2 | Y257: 4 | Z257: 0 | AA257: 649 | AB257: 662 | AC257: 98.036253776435046 | AD257: 8
A258: SANDRINGHAM | D258: OWENS | G258: EDWARDS | J258: CORNER | M258: HUNTER | O258: MACKENZIE | R258: GOOLD | W258: BRUNSWICK | X258: 1 | Y258: 4 | Z258: 1 | AA258: 554 | AB258: 650 | AC258: 85.230769230769226 | AD258: 6
A259: GOALKICKERS | R259: DOHNT | W259: OAKLEIGH | X259: 0 | Y259: 5 | Z259: 1 | AA259: 481 | AB259: 671 | AC259: 71.684053651266765 | AD259: 2
A260: COBURG | D260: FORMOSA 9 | G260: MANNIX 2 | J260: CLEARY 2 | M260: BURT 2 | O260: WALKER | Q260: HEADLAM | S260: GALE | U260: HOBBS
A261: SANDRINGHAM | D261: R MURRAY 3 | G261: CLARK 2 | I261: EDDY 2 | K261: O'BRIEN 2 | M261: MACKENZIE | P261: GOOLD | R261: BRENNER | U261: BEUS
A263: DANDENONG | C263: 2 | D263: 1 | E263: =C263*6+D263 -> 13 | G263: 12 | H263: 10 | I263: =G263*6+H263 -> 82 | K263: 13 | L263: 12 | M263: =K263*6+L263 -> 90 | O263: 19 | P263: 19 | Q263: =O263*6+P263 -> 133 | S263: DANDENONG
A264: CAULFIELD | C264: 8 | D264: 6 | E264: =C264*6+D264 -> 54 | G264: 9 | H264: 8 | I264: =G264*6+H264 -> 62 | K264: 10 | L264: 15 | M264: =K264*6+L264 -> 75 | O264: 12 | P264: 16 | Q264: =O264*6+P264 -> 88 | S264: O'BRIEN
A265: BEST PLAYERS
A266: DANDENONG | D266: HIBBERT | G266: VAN DE BEEK | J266: BRIESE | M266: SHINNERS | P266: DROSCHER | S266: CRANE
A267: CAULFIELD | D267: MILNER | G267: HAYWOOD | J267: ROWE | M267: BECK | P267: JACKS | S267: SUTTIE
A268: GOALKICKERS
A269: DANDENONG | D269: MILLER 6 | G269: BRIESE 6 | I269: FLAHERTY 2 | L269: HARRINGTON | O269: HIBBERT | Q269: HOLDEN | S269: HORAZCKO | V269: DROSCHER
A270: CAULFIELD | D270: BECK 3 | G270: MILNER 3 | I270: DAVIDSON 2 | L270: CLIFF | N270: SUTTIE | P270: BOOTH | R270: GOWANS
A272: PRAHRAN | C272: 7 | D272: 8 | E272: =C272*6+D272 -> 50 | G272: 11 | H272: 10 | I272: =G272*6+H272 -> 76 | K272: 17 | L272: 19 | M272: =K272*6+L272 -> 121 | O272: 25 | P272: 19 | Q272: =O272*6+P272 -> 169 | S272: TOORAK PARK
A273: OAKLEIGH | C273: 0 | D273: 2 | E273: =C273*6+D273 -> 2 | G273: 2 | H273: 13 | I273: =G273*6+H273 -> 25 | K273: 3 | L273: 17 | M273: =K273*6+L273 -> 35 | O273: 6 | P273: 24 | Q273: =O273*6+P273 -> 60 | S273: WENN
A274: BEST PLAYERS
A275: PRAHRAN | D275: TOWNSEND | G275: DICKSON | J275: JOHNSTON | M275: MURRAY | P275: DORAN | S275: PAYNE
A276: OAKLEIGH | D276: BECK | G276: GAUNT | J276: P LILLEY | M276: McMAHON | P276: KING | S276: BRUERTON
A277: GOALKICKERS
A278: PRAHRAN | D278: DICKSON 5 | G278: DORAN 5 | I278: JOHNSTON 4 | L278: PAYNE 3 | N278: TOWNSEND 2 | Q278: RIPPON | S278: WILLIAMS | V278: MURRAY | X278: LITTLE
A279: OAKLEIGH | D279: McMAHON 3 | G279: STEWART | I279: GAUNT | K279: KING
A281: PORT MELBOURNE | C281: 3 | D281: 5 | E281: =C281*6+D281 -> 23 | G281: 10 | H281: 9 | I281: =G281*6+H281 -> 69 | K281: 14 | L281: 10 | M281: =K281*6+L281 -> 94 | O281: 16 | P281: 15 | Q281: =O281*6+P281 -> 111 | S281: BRUNSWICK
A282: BRUNSWICK | C282: 4 | D282: 4 | E282: =C282*6+D282 -> 28 | G282: 7 | H282: 8 | I282: =G282*6+H282 -> 50 | K282: 9 | L282: 14 | M282: =K282*6+L282 -> 68 | O282: 13 | P282: 21 | Q282: =O282*6+P282 -> 99 | S282: STEELE
A283: BEST PLAYERS
A284: PORT MELBOURNE | D284: MOLLOY | G284: HOLT | J284: OWEN | M284: BARROT | P284: HERROD
A285: BRUNSWICK | D285: P ROWE | G285: SCHIMMELBUSCH | K285: STONE | M285: P FELTHAM | P285: PARK
A286: GOALKICKERS
A287: PORT MELBOURNE | D287: COOK 5 | G287: HOLT 3 | I287: RASMUSSEN 3 | L287: WHARTON 2 | O287: STIBBARD | Q287: MERRINGTON | T287: BOND
A288: BRUNSWICK | D288: PARK 3 | G288: ORTON 3 | I288: SCHIMMELBUSCH 2 | M288: NUNN | N288: WARDEN | Q288: P FELTHAM | T288: FITZPATRICK | X288: CARLTON
A290: ROUND 7 | E290: 6TH JUNE | J290: WEATHER | N290: NORTH WIND SHOWERS | S290: PLAYED AT
D291: 1ST QTR | H291: 2ND QTR | L291: 3RD QTR | P291: FINAL | S291: PORT MELBOURNE
A292: PORT MELBOURNE | C292: 5 | D292: 6 | E292: =C292*6+D292 -> 36 | G292: 12 | H292: 11 | I292: =G292*6+H292 -> 83 | K292: 16 | L292: 14 | M292: =K292*6+L292 -> 110 | O292: 18 | P292: 21 | Q292: =O292*6+P292 -> 129 | S292: UMPIRE | X292: LADDER | AB292: ROUND | AD292: 7
A293: PRAHRAN | C293: 2 | D293: 1 | E293: =C293*6+D293 -> 13 | G293: 2 | H293: 3 | I293: =G293*6+H293 -> 15 | K293: 4 | L293: 8 | M293: =K293*6+L293 -> 32 | O293: 8 | P293: 12 | Q293: =O293*6+P293 -> 60 | S293: OGSTON
A294: BEST PLAYERS | W294: TEAM | X294: W | Y294: L | Z294: D | AA294: FOR | AB294: AGST | AC294: % | AD294: PTS
A295: PORT MELBOURNE | D295: ALLEN | G295: HOLT | J295: HARLAND | M295: OWEN | O295: WHARTON | R295: HERROD
A296: PRAHRAN | D296: McGUINNESS | G296: JOHNSTON | J296: ANDERSON | M296: WILLIAMS | O296: DORAN | W296: GEELONG WEST | X296: 6 | Y296: 1 | Z296: 0 | AA296: 745 | AB296: 675 | AC296: 110.37037037037037 | AD296: 24
A297: GOALKICKERS | W297: PORT MELBOURNE | X297: 5 | Y297: 2 | Z297: 0 | AA297: 887 | AB297: 695 | AC297: 127.62589928057554 | AD297: 20
A298: PORT MELBOURNE | D298: COOK 7 | G298: HOLT 3 | I298: BOND 3 | K298: BROWN 2 | M298: HARLAND | O298: MERRINGTON | R298: RASMUSSEN | W298: COBURG | X298: 5 | Y298: 2 | Z298: 0 | AA298: 760 | AB298: 681 | AC298: 111.6 | AD298: 20
A299: PRAHRAN | D299: DORAN 4 | G299: SMITH | I299: JOHNSTON | L299: ROBERTS | N299: CLARKE | W299: PRESTON | X299: 4 | Y299: 3 | Z299: 0 | AA299: 843 | AB299: 750 | AC299: 112.4 | AD299: 16
A301: COBURG | C301: 2 | D301: 1 | E301: =C301*6+D301 -> 13 | G301: 10 | H301: 5 | I301: =G301*6+H301 -> 65 | K301: 14 | L301: 6 | M301: =K301*6+L301 -> 90 | O301: 22 | P301: 13 | Q301: =O301*6+P301 -> 145 | S301: COBURG | W301: CAULFIELD | X301: 4 | Y301: 3 | Z301: 0 | AA301: 780 | AB301: 797 | AC301: 97.87 | AD301: 16
A302: DANDENONG | C302: 4 | D302: 4 | E302: =C302*6+D302 -> 28 | G302: 4 | H302: 4 | I302: =G302*6+H302 -> 28 | K302: 9 | L302: 9 | M302: =K302*6+L302 -> 63 | O302: 12 | P302: 10 | Q302: =O302*6+P302 -> 82 | S302: WENN | W302: PRAHRAN | X302: 3 | Y302: 4 | Z302: 0 | AA302: 777 | AB302: 807 | AC302: 96.28 | AD302: 12
A303: BEST PLAYERS | W303: DANDENONG | X303: 3 | Y303: 4 | Z303: 0 | AA303: 695 | AB303: 737 | AC303: 94.301221166892802 | AD303: 12
A304: COBURG | D304: MANNIX | G304: BOURKE | J304: CLEARY | M304: HEADLAM | O304: LLOYD | R304: SLATER | W304: SANDRINGHAM | X304: 2 | Y304: 5 | Z304: 0 | AA304: 726 | AB304: 789 | AC304: 92.01520912547528 | AD304: 8
A305: DANDENONG | D305: VAN DE BEEK | G305: HIBBERT | J305: HARPER | M305: BASSED | O305: DROSCHER | R305: SHINNERS | W305: BRUNSWICK | X305: 1 | Y305: 5 | Z305: 1 | AA305: 654 | AB305: 759 | AC305: 86.166007905138343 | AD305: 6
A306: GOALKICKERS | W306: OAKLEIGH | X306: 1 | Y306: 5 | Z306: 1 | AA306: 573 | AB306: 750 | AC306: 76.4 | AD306: 6
A307: COBURG | D307: CLEARY 7 | F307: BURT 3 | H307: MANNIX 3 | J307: LLOYD 3 | L307: HEADLAM 2 | O307: DOHNT 2 | Q307: FORMOSA | S307: BEATTIE
A308: DANDENONG | D308: HIBBERT 6 | G308: VAN DE BEEK 2 | J308: FLAHERTY | M308: STUBBS | O308: SHEVLIN | Q308: WRIGHT
A310: CAULFIELD | C310: 3 | D310: 2 | E310: =C310*6+D310 -> 20 | G310: 7 | H310: 5 | I310: =G310*6+H310 -> 47 | K310: 8 | L310: 11 | M310: =K310*6+L310 -> 59 | O310: 15 | P310: 19 | Q310: =O310*6+P310 -> 109 | S310: PRINCES PARK
A311: BRUNSWICK | C311: 6 | D311: 6 | E311: =C311*6+D311 -> 42 | G311: 7 | H311: 10 | I311: =G311*6+H311 -> 52 | K311: 13 | L311: 14 | M311: =K311*6+L311 -> 92 | O311: 14 | P311: 16 | Q311: =O311*6+P311 -> 100 | S311: STABB
A312: BEST PLAYERS
A313: CAULFIELD | D313: BECK | G313: BOOTH | J313: CLIFF | M313: TEMPEST | P313: HUNTER | R313: M MOORE
A314: BRUNSWICK | D314: VALENTINE | G314: BUCKLEY | J314: ROWE | M314: WARDEN | P314: NOLAN | R314: SCHIMMELBUSCH
A315: GOALKICKERS
A316: CAULFIELD | D316: M MOORE 4 | G316: BECK 2 | I316: DAVIDSON 2 | L316: BOOTH 2 | N316: HAWKING 2 | Q316: E MOORE | S316: CLIFF | U316: ROWE
A317: BRUNSWICK | D317: VALENTINE 3 | G317: ORTON 3 | I317: NUNN 2 | K317: SCHIMMELBUSCH 2 | O317: PARK 2 | Q317: FELTHAM | S317: WARDEN
A319: GEELONG WEST | C319: 7 | D319: 6 | E319: =C319*6+D319 -> 48 | G319: 9 | H319: 9 | I319: =G319*6+H319 -> 63 | K319: 14 | L319: 12 | M319: =K319*6+L319 -> 96 | O319: 19 | P319: 13 | Q319: =O319*6+P319 -> 127 | S319: GEELONG WEST
A320: SANDRINGHAM | C320: 1 | D320: 2 | E320: =C320*6+D320 -> 8 | G320: 4 | H320: 9 | I320: =G320*6+H320 -> 33 | K320: 5 | L320: 13 | M320: =K320*6+L320 -> 43 | O320: 10 | P320: 17 | Q320: =O320*6+P320 -> 77 | S320: FITZPATRICK
A321: BEST PLAYERS
A322: GEELONG WEST | D322: YATES | G322: GILMORE | J322: ARKLAY | M322: RADOJEVIC | P322: VILLAROSA | S322: EDDY
A323: SANDRINGHAM | D323: HUTCHINSON | G323: SIMPSON | J323: EDWARDS | M323: JONES | P323: HUDSON
A324: GOALKICKERS
A325: GEELONG WEST | D325: RADOJEVIC 8 | G325: STENNETT 3 | J325: GILMORE 3 | M325: LYONS 2 | O325: WELLS | Q325: HINDSON | S325: HUGHES
A326: SANDRINGHAM | D326: JONES 3 | G326: HUDSON 2 | J326: SIMPSON | L326: OWENS | N326: CLARK | P326: HUTCHINSON | S326: HUNTER
A328: OAKLEIGH | C328: 4 | D328: 3 | E328: =C328*6+D328 -> 27 | G328: 5 | H328: 7 | I328: =G328*6+H328 -> 37 | K328: 8 | L328: 13 | M328: =K328*6+L328 -> 61 | O328: 13 | P328: 14 | Q328: =O328*6+P328 -> 92 | S328: OAKLEIGH
A329: PRESTON | C329: 2 | D329: 1 | E329: =C329*6+D329 -> 13 | G329: 5 | H329: 2 | I329: =G329*6+H329 -> 32 | K329: 10 | L329: 6 | M329: =K329*6+L329 -> 66 | O329: 11 | P329: 13 | Q329: =O329*6+P329 -> 79 | S329: MARCY
A330: BEST PLAYERS
A331: OAKLEIGH | D331: BECK | G331: GAUNT | J331: LILLEY | M331: PETTIGREW | P331: CHISHOLM | S331: WATTS
A332: PRESTON | D332: DURWOOD | G332: MARSHALL | J332: SMITH | M332: ZEMSKI | P332: SCHICKERT | S332: BROWNE
A333: GOALKICKERS
A334: OAKLEIGH | D334: GAUNT 3 | G334: ALLISEY 3 | J334: STEWART 2 | M334: ROLFE | O334: LILLEY | Q334: BECK | S334: TESERIERO | V334: FOOTE
A335: PRESTON | D335: SMITH 3 | G335: ROBNSON 3 | J335: LORENZINI 2 | M335: CRANAGE | O335: STEWART | Q335: IRELAND
A337: ROUND 8 | E337: 13TH JUNE | K337: WEATHER | O337: FINE | S337: PLAYED AT
D338: 1ST QTR | H338: 2ND QTR | L338: 3RD QTR | P338: FINAL | S338: PORT MELBOURNE
A339: COBURG | C339: 8 | D339: 3 | E339: =C339*6+D339 -> 51 | G339: 12 | H339: 7 | I339: =G339*6+H339 -> 79 | K339: 19 | L339: 10 | M339: =K339*6+L339 -> 124 | O339: 26 | P339: 15 | Q339: =O339*6+P339 -> 171 | S339: UMPIRE | X339: LADDER | AB339: ROUND | AD339: 8
A340: PORT MELBOURNE | C340: 1 | D340: 4 | E340: =C340*6+D340 -> 10 | G340: 3 | H340: 6 | I340: =G340*6+H340 -> 24 | K340: 5 | L340: 17 | M340: =K340*6+L340 -> 47 | O340: 9 | P340: 21 | Q340: =O340*6+P340 -> 75 | S340: MARCY
A341: BEST PLAYERS | W341: TEAM | X341: W | Y341: L | Z341: D | AA341: FOR | AB341: AGST | AC341: % | AD341: PTS
A342: COBURG | D342: MANNIX | G342: HEADLAM | J342: BEATTIE | M342: BURT | O342: PITT | Q342: BREEN
A343: PORT MELBOURNE | D343: MOLLOY | G343: ALLEN | J343: WHARTON | M343: HERROD | O343: PROFFIT | Q343: HAENAN | W343: COBURG | X343: 6 | Y343: 2 | Z343: 0 | AA343: 931 | AB343: 756 | AC343: 123.15 | AD343: 24
A344: GOALKICKERS | N344: DOHNT | P344: BROWN | R344: SLATER | T344: BREEN | W344: GEELONG WEST | X344: 6 | Y344: 2 | Z344: 0 | AA344: 856 | AB344: 802 | AC344: 106.73316708229426 | AD344: 24
A345: COBURG | D345: FORMOSA 5 | G345: HODGETTS 5 | J345: MANNIX 4 | M345: CLEARY 3 | O345: LLOYD 2 | Q345: BURT 2 | S345: SCHOLES | W345: PORT MELBOURNE | X345: 5 | Y345: 3 | Z345: 0 | AA345: 962 | AB345: 866 | AC345: 111.08545034642032 | AD345: 20
A346: PORT MELBOURNE | D346: BOND 2 | F346: MERRINGTON 2 | J346: WHARTON 2 | M346: RASMUSSEN | P346: HARLAND | R346: CRITCH | W346: CAULFIELD | X346: 5 | Y346: 3 | Z346: 0 | AA346: 907 | AB346: 908 | AC346: 99.89 | AD346: 20
A348: CAULFIELD | C348: 4 | D348: 4 | E348: =C348*6+D348 -> 28 | G348: 10 | H348: 6 | I348: =G348*6+H348 -> 66 | K348: 14 | L348: 9 | M348: =K348*6+L348 -> 93 | O348: 19 | P348: 13 | Q348: =O348*6+P348 -> 127 | S348: GEELONG WEST | W348: PRESTON | X348: 4 | Y348: 4 | Z348: 0 | AA348: 918 | AB348: 856 | AC348: 107.24299065420561 | AD348: 16
A349: GEELONG WEST | C349: 5 | D349: 7 | E349: =C349*6+D349 -> 37 | G349: 7 | H349: 11 | I349: =G349*6+H349 -> 53 | K349: 11 | L349: 19 | M349: =K349*6+L349 -> 85 | O349: 15 | P349: 21 | Q349: =O349*6+P349 -> 111 | S349: O'BRIEN | W349: DANDENONG | X349: 4 | Y349: 4 | Z349: 0 | AA349: 801 | AB349: 812 | AC349: 98.645320197044342 | AD349: 16
A350: BEST PLAYERS | W350: PRAHRAN | X350: 3 | Y350: 5 | Z350: 0 | AA350: 881 | AB350: 937 | AC350: 94.02 | AD350: 12
A351: CAULFIELD | D351: TEMPEST | G351: EINSEDEL | J351: M MOORE | M351: BECK | P351: BELL | R351: ROWE | W351: BRUNSWICK | X351: 2 | Y351: 5 | Z351: 1 | AA351: 784 | AB351: 863 | AC351: 90.845886442641941 | AD351: 10
A352: GEELONG WEST | D352: YATES | G352: STOKES | J352: GILMORE | M352: WOOLFE | P352: EDDY | R352: GILLIES | W352: OAKLEIGH | X352: 2 | Y352: 5 | Z352: 1 | AA352: 665 | AB352: 839 | AC352: 79.261025029797381 | AD352: 10
A353: GOALKICKERS | W353: SANDRINGHAM | X353: 2 | Y353: 6 | Z353: 0 | AA353: 815 | AB353: 881 | AC353: 92.508513053348466 | AD353: 8
A354: CAULFIELD | D354: M MOORE 10 | G354: BECK 2 | I354: DAVIDSON 2 | L354: CLIFF 2 | N354: RICHARDS 2 | Q354: HAWKING
A355: GEELONG WEST | D355: WOOLFE 4 | G355: RADOJEVIC 3 | J355: VILLAROSA 2 | M355: WELLS 2 | O355: STOKES | Q355: STENNETT | S355: HUGHES | T355: GILMORE
A357: DANDENONG | C357: 4 | D357: 2 | E357: =C357*6+D357 -> 26 | G357: 9 | H357: 10 | I357: =G357*6+H357 -> 64 | K357: 11 | L357: 12 | M357: =K357*6+L357 -> 78 | O357: 15 | P357: 16 | Q357: =O357*6+P357 -> 106 | S357: PRESTON
A358: PRESTON | C358: 4 | D358: 4 | E358: =C358*6+D358 -> 28 | G358: 7 | H358: 6 | I358: =G358*6+H358 -> 48 | K358: 9 | L358: 9 | M358: =K358*6+L358 -> 63 | O358: 11 | P358: 9 | Q358: =O358*6+P358 -> 75 | S358: ABBOTT
A359: BEST PLAYERS
A360: DANDENONG | D360: HIBBERT | G360: THOMPSON | J360: DROSCHER | M360: FLAHERTY | P360: WRIGHT | S360: SHINNERS
A361: PRESTON | D361: LESLIE | G361: SCHICKERT | J361: STEWART | M361: ZEMSKI | P361: CARLSON | S361: PREECE
A362: GOALKICKERS
A363: DANDENONG | D363: FLAHERTY 6 | G363: WRIGHT 3 | J363: HARRINGTON 2 | N363: HIBBERT 2 | Q363: CASTRICUM | T363: PAYZE
A364: PRESTON | D364: WILSON 4 | G364: STEWART 2 | J364: BROWNE | L364: CARLSON | N364: IRELAND | P364: GRELLET | R364: SMITH
A366: BRUNSWICK | C366: 6 | D366: 7 | E366: =C366*6+D366 -> 43 | G366: 9 | H366: 9 | I366: =G366*6+H366 -> 63 | K366: 16 | L366: 14 | M366: =K366*6+L366 -> 110 | O366: 19 | P366: 16 | Q366: =O366*6+P366 -> 130 | S366: TOORAK PARK
A367: PRAHRAN | C367: 5 | D367: 5 | E367: =C367*6+D367 -> 35 | G367: 7 | H367: 7 | I367: =G367*6+H367 -> 49 | K367: 10 | L367: 11 | M367: =K367*6+L367 -> 71 | O367: 14 | P367: 20 | Q367: =O367*6+P367 -> 104 | S367: VERGONA
A368: BEST PLAYERS
A369: BRUNSWICK | D369: STONE | G369: ORTON | J369: SCHIMMELBUSCH | N369: SKIDMORE | Q369: WARDEN | S369: VALENTINE
A370: PRAHRAN | D370: K SMITH | G370: McGUINNESS | J370: MOLONEY | N370: WILLIAMS | Q370: ANDERSON
A371: GOALKICKERS
A372: BRUNSWICK | D372: ORTON 9 | G372: STONE 4 | I372: WARDEN 3 | L372: VALENTINE | N372: JOSEPH | P372: LLOYD
A373: PRAHRAN | D373: K SMITH 7 | G373: PAYNE 2 | I373: DICKSON 2 | L373: DORAN | N373: WILLIAMS | Q373: McGUINNESS
A375: OAKLEIGH | C375: 2 | D375: 2 | E375: =C375*6+D375 -> 14 | G375: 6 | H375: 4 | I375: =G375*6+H375 -> 40 | K375: 11 | L375: 12 | M375: =K375*6+L375 -> 78 | O375: 12 | P375: 20 | Q375: =O375*6+P375 -> 92 | S375: OAKLEIGH
A376: SANDRINGHAM | C376: 3 | D376: 6 | E376: =C376*6+D376 -> 24 | G376: 6 | H376: 12 | I376: =G376*6+H376 -> 48 | K376: 10 | L376: 15 | M376: =K376*6+L376 -> 75 | O376: 12 | P376: 17 | Q376: =O376*6+P376 -> 89 | S376: OGSTON
A377: BEST PLAYERS
A378: OAKLEIGH | D378: PETTIGREW | G378: GAUNT | J378: CHISHOLM | M378: HAY | O378: BECK | R378: LILLEY
A379: SANDRINGHAM | D379: CLARK | G379: MACKENZIE | J379: SIMPSON | M379: PETERS | O379: HUNTER | R379: HUDSON
A380: GOALKICKERS
A381: OAKLEIGH | D381: LILLEY 4 | G381: HAY 4 | J381: ROLFE 2 | M381: GAUNT | O381: FOOTE
A382: SANDRINGHAM | D382: JONES 4 | G382: SIMPSON 3 | J382: HUTCHINSON 2 | N382: ADAMS 2 | Q382: CARRIGG
A384: ROUND 9 | E384: 20TH JUNE | J384: WEATHER | S384: PLAYED AT
D385: 1ST QTR | H385: 2ND QTR | L385: 3RD QTR | P385: FINAL | S385: COBURG
A386: CAULFIELD | C386: 2 | D386: 6 | E386: =C386*6+D386 -> 18 | G386: 5 | H386: 13 | I386: =G386*6+H386 -> 43 | K386: 11 | L386: 19 | M386: =K386*6+L386 -> 85 | O386: 20 | P386: 21 | Q386: =O386*6+P386 -> 141 | S386: UMPIRE | X386: LADDER | AB386: ROUND | AD386: 9
A387: COBURG | C387: 1 | D387: 4 | E387: =C387*6+D387 -> 10 | G387: 4 | H387: 8 | I387: =G387*6+H387 -> 32 | K387: 9 | L387: 11 | M387: =K387*6+L387 -> 65 | O387: 17 | P387: 14 | Q387: =O387*6+P387 -> 116 | S387: FITZPATRICK
A388: BEST PLAYERS | W388: TEAM | X388: W | Y388: L | Z388: D | AA388: FOR | AB388: AGST | AC388: % | AD388: PTS
A389: CAULFIELD | D389: HAYWOOD | G389: BECK | I389: TEMPEST | L389: DAVIDSON | O389: BALL | Q389: TAYLOR
A390: COBURG | D390: BURT | G390: SLATER | I390: ARTHURSON | L390: DOHNT | O390: SCHOLES | Q390: O'CALLAGHAN | W390: COBURG | X390: 6 | Y390: 3 | Z390: 0 | AA390: 1047 | AB390: 897 | AC390: 116.72 | AD390: 24
A391: GOALKICKERS | R391: ROWE | W391: PORT MELBOURNE | X391: 6 | Y391: 3 | Z391: 0 | AA391: 1101 | AB391: 983 | AC391: 112.00406917599186 | AD391: 24
A392: CAULFIELD | D392: M MOORE 6 | G392: BECK 3 | I392: HAWKING 3 | L392: CLIFF 2 | N392: TAYLOR 2 | Q392: MILNER 2 | S392: RICHARDS | W392: GEELONG WEST | X392: 6 | Y392: 3 | Z392: 0 | AA392: 963 | AB392: 924 | AC392: 104.22077922077922 | AD392: 24
A393: COBURG | D393: HODGETTS 5 | G393: SCHOLES 2 | I393: BURT 2 | K393: HEADLAM | M393: DOHNT | O393: FORMOSA | Q393: CLEARY | S393: BREEN | W393: CAULFIELD | X393: 6 | Y393: 3 | Z393: 0 | AA393: 1048 | AB393: 1024 | AC393: 102.34 | AD393: 24
N394: BEATTIE | P394: LLOYD | R394: MANNIX
A395: PRAHRAN | C395: 7 | D395: 6 | E395: =C395*6+D395 -> 48 | G395: 9 | H395: 11 | I395: =G395*6+H395 -> 65 | K395: 15 | L395: 17 | M395: =K395*6+L395 -> 107 | O395: 17 | P395: 20 | Q395: =O395*6+P395 -> 122 | S395: TOORAK PARK | W395: PRESTON | X395: 5 | Y395: 4 | Z395: 0 | AA395: 1062 | AB395: 954 | AC395: 111.32 | AD395: 20
A396: GEELONG WEST | C396: 0 | D396: 2 | E396: =C396*6+D396 -> 2 | G396: 4 | H396: 6 | I396: =G396*6+H396 -> 30 | K396: 6 | L396: 10 | M396: =K396*6+L396 -> 46 | O396: 15 | P396: 17 | Q396: =O396*6+P396 -> 107 | S396: CARLISLE | W396: DANDENONG | X396: 5 | Y396: 4 | Z396: 0 | AA396: 936 | AB396: 914 | AC396: 102.40700218818381 | AD396: 20
A397: BEST PLAYERS | W397: PRAHRAN | X397: 4 | Y397: 5 | Z397: 0 | AA397: 1003 | AB397: 1044 | AC397: 96.07 | AD397: 16
A398: PRAHRAN | D398: THORNTON | G398: McGUINNESS | J398: MOLONEY | M398: DICKSON | P398: AUSTIN | R398: PAYNE | W398: BRUNSWICK | X398: 2 | Y398: 6 | Z398: 1 | AA398: 882 | AB398: 1007 | AC398: 87.59 | AD398: 10
A399: GEELONG WEST | D399: DEEATH | G399: YATES | J399: EDDY | M399: STOKES | P399: ARKLAY | R399: FRIEND | W399: OAKLEIGH | X399: 2 | Y399: 6 | Z399: 1 | AA399: 767 | AB399: 974 | AC399: 78.747433264887064 | AD399: 10
A400: GOALKICKERS | W400: SANDRINGHAM | X400: 2 | Y400: 7 | Z400: 0 | AA400: 932 | AB400: 1020 | AC400: 91.372549019607845 | AD400: 8
A401: PRAHRAN | D401: DICKSON 5 | G401: K SMITH 3 | J401: PAYNE 3 | L401: TOWNSEND 2 | O401: AUSTIN 2 | Q401: KENT | S401: DORAN
A402: GEELONG WEST | D402: FRIEND 5 | G402: WELLS 3 | J402: HUGHES 3 | M402: SMITH | O402: STOKES | Q402: VILLAROSA | S402: ROWE
A404: PRESTON | C404: 8 | D404: 2 | E404: =C404*6+D404 -> 50 | G404: 10 | H404: 10 | I404: =G404*6+H404 -> 70 | K404: 14 | L404: 14 | M404: =K404*6+L404 -> 98 | O404: 21 | P404: 18 | Q404: =O404*6+P404 -> 144 | S404: BRUNSWICK
A405: BRUNSWICK | C405: 5 | D405: 4 | E405: =C405*6+D405 -> 34 | G405: 8 | H405: 9 | I405: =G405*6+H405 -> 57 | K405: 11 | L405: 11 | M405: =K405*6+L405 -> 77 | O405: 14 | P405: 14 | Q405: =O405*6+P405 -> 98 | S405: OGSTON
A406: BEST PLAYERS
A407: PRESTON | D407: SCHICKERT | G407: RENWICK | J407: DURWOOD | M407: MARSHALL | P407: STEWART | S407: O'SULLIVAN
A408: BRUNSWICK | D408: ROWE | G408: SCHIMMELBUSCH | K408: STONE | M408: VALENTINE | P408: WARDEN
A409: GOALKICKERS
A410: PRESTON | D410: McKEON 3 | F410: MARSHALL 3 | I410: SMITH 3 | K410: WEIGHTMAN 2 | N410: STEWART 2 | Q410: O'SULLIVAN 2 | T410: RENWICK 2 | W410: ROBINSON 2 | X410: SALTMARSH | AA410: BOLGER
A411: BRUNSWICK | D411: ORTON 4 | G411: JOSEPH 2 | I411: WARDEN 2 | L411: BELL 2 | N411: SCHIMMELBUSCH | R411: STONE | T411: GINGELL | V411: VALENTINE
A413: DANDENONG | C413: 7 | D413: 2 | E413: =C413*6+D413 -> 44 | G413: 11 | H413: 7 | I413: =G413*6+H413 -> 73 | K413: 13 | L413: 12 | M413: =K413*6+L413 -> 90 | O413: 20 | P413: 15 | Q413: =O413*6+P413 -> 135 | S413: DANDENONG
A414: OAKLEIGH | C414: 6 | D414: 1 | E414: =C414*6+D414 -> 37 | G414: 11 | H414: 4 | I414: =G414*6+H414 -> 70 | K414: 14 | L414: 8 | M414: =K414*6+L414 -> 92 | O414: 15 | P414: 12 | Q414: =O414*6+P414 -> 102 | S414: VERGONA
A415: BEST PLAYERS
A416: DANDENONG | D416: FLAHERTY | G416: THOMPSON | J416: HIBBERT | M416: SHINNERS | P416: VAN DE BEEK | S416: TRUEMAN
A417: OAKLEIGH | D417: PETTIGREW | G417: BECK | J417: CHISHOLM | M417: GOODMAN | P417: D NESBIT | S417: GAUNT
A418: GOALKICKERS
A419: DANDENONG | D419: FLAHERTY 7 | G419: HIBBERT 4 | J419: SHINNERS 4 | M419: WRIGHT 2 | P419: VAN DE BEEK 2 | T419: MELAI
A420: OAKLEIGH | D420: ROLFE 5 | G420: HAY 3 | I420: CHISHOLM 2 | L420: FOOTE 2 | N420: BECK | P420: D NESBIT | R420: WHITE
A422: PORT MELBOURNE | C422: 5 | D422: 10 | E422: =C422*6+D422 -> 40 | G422: 13 | H422: 15 | I422: =G422*6+H422 -> 93 | K422: 19 | L422: 20 | M422: =K422*6+L422 -> 134 | O422: 19 | P422: 25 | Q422: =O422*6+P422 -> 139 | S422: BEACH ROAD
A423: SANDRINGHAM | C423: 4 | D423: 2 | E423: =C423*6+D423 -> 26 | G423: 8 | H423: 4 | I423: =G423*6+H423 -> 52 | K423: 13 | L423: 12 | M423: =K423*6+L423 -> 90 | O423: 17 | P423: 15 | Q423: =O423*6+P423 -> 117 | S423: HAYES
A424: BEST PLAYERS
A425: PORT MELBOURNE | D425: SWAN | G425: HAENAN | J425: HOLT | M425: RASMUSSEN | P425: WHARTON | S425: BOND
A426: SANDRINGHAM | D426: MACKENZIE | G426: KENNEDY | J426: JONES | M426: HUNTER | P426: SIMPSON | S426: GOOLD
A427: GOALKICKERS
A428: PORT MELBOURNE | D428: COOK 5 | F428: RASMUSSEN 3 | I428: HOLT 2 | K428: HAENAN 2 | N428: WHARTON 2 | Q428: STIBBARD | S428: BARROT | U428: BOND | W428: BROWN | X428: SWAN
A429: SANDRINGHAM | D429: JONES 7 | G429: R MURRAY 2 | J429: KENNEDY 2 | M429: CORNER 2 | O429: SIMPSON | Q429: HUDSON | S429: PETERS | U429: K MURRAY
A431: ROUND 10 | E431: 27TH JUNE | J431: WEATHER | N431: RAIN | S431: PLAYED AT
D432: 1ST QTR | H432: 2ND QTR | L432: 3RD QTR | P432: FINAL | S432: PORT MELBOURNE
A433: PORT MELBOURNE | C433: 5 | D433: 2 | E433: =C433*6+D433 -> 32 | G433: 9 | H433: 7 | I433: =G433*6+H433 -> 61 | K433: 13 | L433: 9 | M433: =K433*6+L433 -> 87 | O433: 17 | P433: 14 | Q433: =O433*6+P433 -> 116 | S433: UMPIRE | X433: LADDER | AB433: ROUND | AD433: 10
A434: PRESTON | C434: 5 | D434: 1 | E434: =C434*6+D434 -> 31 | G434: 5 | H434: 6 | I434: =G434*6+H434 -> 36 | K434: 9 | L434: 9 | M434: =K434*6+L434 -> 63 | O434: 10 | P434: 13 | Q434: =O434*6+P434 -> 73 | S434: FITZPATRICK
A435: BEST PLAYERS | W435: TEAM | X435: W | Y435: L | Z435: D | AA435: FOR | AB435: AGST | AC435: % | AD435: PTS
A436: PORT MELBOURNE | D436: PROFFIT | G436: CHRISTOU | J436: ALLEN | L436: DERMOTT | O436: BARROT | R436: RASMUSSEN
A437: PRESTON | D437: WEIGHTMAN | G437: GRAINGER | J437: SMITH | L437: MARSHALL | O437: MARKS | R437: SCHICKERT | W437: PORT MELBOURNE | X437: 7 | Y437: 3 | Z437: 0 | AA437: 1217 | AB437: 1056 | AC437: 115.24621212121212 | AD437: 28
A438: GOALKICKERS | W438: GEELONG WEST | X438: 7 | Y438: 3 | Z438: 0 | AA438: 1064 | AB438: 1008 | AC438: 105.55555555555556 | AD438: 28
A439: PORT MELBOURNE | D439: CHRISTOU 5 | G439: COOK 3 | I439: BOND 3 | K439: BARROT 3 | N439: RASMUSSEN 2 | Q439: HAENAN | W439: COBURG | X439: 6 | Y439: 4 | Z439: 0 | AA439: 1141 | AB439: 1019 | AC439: 111.97 | AD439: 24
A440: PRESTON | D440: WEIGHTMAN 3 | G440: MARKS 2 | I440: IRELAND | K440: O'SULLIVAN | N440: CRANAGE | Q440: RENWICK | S440: SMITH | W440: DANDENONG | X440: 6 | Y440: 4 | Z440: 0 | AA440: 1031 | AB440: 975 | AC440: 105.74358974358974 | AD440: 24
A442: PRAHRAN | C442: 6 | D442: 3 | E442: =C442*6+D442 -> 39 | G442: 9 | H442: 9 | I442: =G442*6+H442 -> 63 | K442: 11 | L442: 12 | M442: =K442*6+L442 -> 78 | O442: 15 | P442: 18 | Q442: =O442*6+P442 -> 108 | S442: PRINCES PARK | W442: CAULFIELD | X442: 6 | Y442: 4 | Z442: 0 | AA442: 1146 | AB442: 1132 | AC442: 101.24 | AD442: 24
A443: CAULFIELD | C443: 6 | D443: 7 | E443: =C443*6+D443 -> 43 | G443: 9 | H443: 9 | I443: =G443*6+H443 -> 63 | K443: 13 | L443: 11 | M443: =K443*6+L443 -> 89 | O443: 14 | P443: 14 | Q443: =O443*6+P443 -> 98 | S443: HAYES | W443: PRESTON | X443: 5 | Y443: 5 | Z443: 0 | AA443: 1135 | AB443: 1070 | AC443: 106.07 | AD443: 20
A444: BEST PLAYERS | W444: PRAHRAN | X444: 5 | Y444: 5 | Z444: 0 | AA444: 1111 | AB444: 1142 | AC444: 97.29 | AD444: 20
A445: PRAHRAN | D445: JOHNSTON | G445: THORNTON | J445: McGUINNESS | M445: TOWNSEND | P445: MOLONEY | S445: SMITH | W445: BRUNSWICK | X445: 3 | Y445: 6 | Z445: 1 | AA445: 1004 | AB445: 1101 | AC445: 91.19 | AD445: 14
A446: CAULFIELD | D446: BALL | G446: HAYWOOD | J446: HAWKING | M446: CLIFF | P446: DAVIDSON | S446: ROWE | W446: OAKLEIGH | X446: 2 | Y446: 7 | Z446: 1 | AA446: 851 | AB446: 1075 | AC446: 79.162790697674424 | AD446: 10
A447: GOALKICKERS | W447: SANDRINGHAM | X447: 2 | Y447: 8 | Z447: 0 | AA447: 993 | AB447: 1115 | AC447: 89.058295964125563 | AD447: 8
A448: PRAHRAN | D448: K SMITH 6 | G448: DICKSON 3 | J448: WILLIAMS 2 | M448: THORNTON 2 | P448: TOWNSEND | S448: AUSTIN
A449: CAULFIELD | D449: MAGUIRE 5 | G449: CLIFF 3 | I449: M MOORE 3 | L449: BOOTH | N449: JACKS | P449: ROWE
A451: DANDENONG | C451: 4 | D451: 4 | E451: =C451*6+D451 -> 28 | G451: 6 | H451: 15 | I451: =G451*6+H451 -> 51 | K451: 10 | L451: 20 | M451: =K451*6+L451 -> 80 | O451: 12 | P451: 23 | Q451: =O451*6+P451 -> 95 | S451: BEACH ROAD
A452: SANDRINGHAM | C452: 2 | D452: 5 | E452: =C452*6+D452 -> 17 | G452: 3 | H452: 7 | I452: =G452*6+H452 -> 25 | K452: 5 | L452: 10 | M452: =K452*6+L452 -> 40 | O452: 8 | P452: 13 | Q452: =O452*6+P452 -> 61 | S452: CARLILE
A453: BEST PLAYERS
A454: DANDENONG | D454: BASSED | G454: VAN DE BEEK | J454: CRANE | M454: HARRINGTON | P454: THOMPSON | S454: SHINNERS
A455: SANDRINGHAM | D455: McCONNELL | G455: SIMPSON | J455: CARROLL | M455: HUNTER | P455: GOOLD | S455: MACKENZIE
A456: GOALKICKERS
A457: DANDENONG | D457: ORCHARD 4 | G457: HAYES 2 | I457: TAYLOR 2 | L457: MEYERS | N457: FLAHERTY | Q457: CRANE | S457: BASSED
A458: SANDRINGHAM | D458: JONES 3 | G458: EDDY 3 | I458: SIMPSON | L458: R MURRAY
A460: GEELONG WEST | C460: 2 | D460: 6 | E460: =C460*6+D460 -> 18 | G460: 5 | H460: 13 | I460: =G460*6+H460 -> 43 | K460: 9 | L460: 15 | M460: =K460*6+L460 -> 69 | O460: 14 | P460: 17 | Q460: =O460*6+P460 -> 101 | S460: GEELONG WEST
A461: OAKLEIGH | C461: 4 | D461: 5 | E461: =C461*6+D461 -> 29 | G461: 6 | H461: 6 | I461: =G461*6+H461 -> 42 | K461: 10 | L461: 7 | M461: =K461*6+L461 -> 67 | O461: 12 | P461: 12 | Q461: =O461*6+P461 -> 84 | S461: ABBOTT
A462: BEST PLAYERS
A463: GEELONG WEST | D463: HINDSON | G463: VILLAROSA | J463: YATES | M463: GILMORE | P463: EDDY | R463: WELLS
A464: OAKLEIGH | D464: LILLEY | G464: BECK | J464: PETTIGREW | M464: TULLOCH | P464: HAY | R464: CHISHOLM
A465: GOALKICKERS
A466: GEELONG WEST | D466: RADOJEVIC 4 | G466: GILMORE 4 | J466: WELLS 3 | M466: LYONS | O466: HUGHES | Q466: ROE
A467: OAKLEIGH | D467: HAY 3 | F467: NESBIT 2 | I467: TESERIERO 2 | L467: ROWLANDS 2 | O467: ROLFE | Q467: TULLOCH | T467: WHITE
A469: BRUNSWICK | C469: 0 | D469: 5 | E469: =C469*6+D469 -> 5 | G469: 6 | H469: 8 | I469: =G469*6+H469 -> 44 | K469: 15 | L469: 12 | M469: =K469*6+L469 -> 102 | O469: 18 | P469: 14 | Q469: =O469*6+P469 -> 122 | S469: COBURG
A470: COBURG | C470: 5 | D470: 4 | E470: =C470*6+D470 -> 34 | G470: 9 | H470: 6 | I470: =G470*6+H470 -> 60 | K470: 10 | L470: 9 | M470: =K470*6+L470 -> 69 | O470: 13 | P470: 16 | Q470: =O470*6+P470 -> 94 | S470: STEERE
A471: BEST PLAYERS
A472: BRUNSWICK | D472: STONE | G472: PARK | J472: LAXTON | M472: CARLTON | P472: WARDEN | S472: BUCKLEY
A473: COBURG | D473: SLATER | G473: PITT | J473: WALKER | M473: BEATTIE | P473: MANNIX
A474: GOALKICKERS
A475: BRUNSWICK | D475: ORTON 5 | G475: STONE 5 | I475: WARDEN 3 | L475: GINGELL 2 | N475: VALENTINE 2 | Q475: JOSEPH
A476: COBURG | D476: SMITH 3 | G476: BREEN 3 | I476: HEADLAM 2 | L476: FORMOSA | N476: MANNIX | P476: BEATTIE | R476: HODGETTS | U476: SCHOLES
A478: ROUND 11 | E478: 4TH JULY | J478: WEATHER | N478: WIND SHOWERS | S478: PLAYED AT
D479: 1ST QTR | H479: 2ND QTR | L479: 3RD QTR | P479: FINAL | S479: DANDENONG
A480: DANDENONG | C480: 4 | D480: 0 | E480: =C480*6+D480 -> 24 | G480: 9 | H480: 6 | I480: =G480*6+H480 -> 60 | K480: 15 | L480: 9 | M480: =K480*6+L480 -> 99 | O480: 18 | P480: 12 | Q480: =O480*6+P480 -> 120 | S480: UMPIRE | X480: LADDER | AB480: ROUND | AD480: 11
A481: GEELONG WEST | C481: 4 | D481: 2 | E481: =C481*6+D481 -> 26 | G481: 5 | H481: 3 | I481: =G481*6+H481 -> 33 | K481: 6 | L481: 6 | M481: =K481*6+L481 -> 42 | O481: 6 | P481: 12 | Q481: =O481*6+P481 -> 48 | S481: MARCY
A482: BEST PLAYERS | W482: TEAM | X482: W | Y482: L | Z482: D | AA482: FOR | AB482: AGST | AC482: % | AD482: PTS
A483: DANDENONG | D483: TRUEMAN | G483: STUBBS | J483: HARRINGTON | M483: HIBBERT | P483: BASSED | R483: THOMPSON
A484: GEELONG WEST | D484: EDDY | G484: VILLAROSA | J484: FRIEND | M484: ARKLAY | P484: HUGHES | W484: PORT MELBOURNE | X484: 8 | Y484: 3 | Z484: 0 | AA484: 1328 | AB484: 1141 | AC484: 116.38913234005258 | AD484: 32
A485: GOALKICKERS | P485: PAYZE | R485: DROSCHER | W485: DANDENONG | X485: 7 | Y485: 4 | Z485: 0 | AA485: 1151 | AB485: 1023 | AC485: 112.51221896383187 | AD485: 28
A486: DANDENONG | D486: MILLER 5 | F486: FLAHERTY 3 | I486: ORCHARD 2 | L486: HIBBERT 2 | N486: TAYLOR 2 | Q486: BASSED | S486: BRIESE | W486: GEELONG WEST | X486: 7 | Y486: 4 | Z486: 0 | AA486: 1112 | AB486: 1128 | AC486: 98.581560283687949 | AD486: 28
A487: GEELONG WEST | D487: RADOJEVIC 3 | G487: WELLS | I487: HUGHES | K487: ROE | W487: COBURG | X487: 6 | Y487: 5 | Z487: 0 | AA487: 1213 | AB487: 1119 | AC487: 108.40035746201966 | AD487: 24
A489: PRESTON | C489: 5 | D489: 2 | E489: =C489*6+D489 -> 32 | G489: 10 | H489: 4 | I489: =G489*6+H489 -> 64 | K489: 11 | L489: 5 | M489: =K489*6+L489 -> 71 | O489: 17 | P489: 12 | Q489: =O489*6+P489 -> 114 | S489: PRESTON | W489: PRESTON | X489: 6 | Y489: 5 | Z489: 0 | AA489: 1249 | AB489: 1154 | AC489: 108.23 | AD489: 24
A490: CAULFIELD | C490: 5 | D490: 1 | E490: =C490*6+D490 -> 31 | G490: 8 | H490: 7 | I490: =G490*6+H490 -> 55 | K490: 9 | L490: 9 | M490: =K490*6+L490 -> 63 | O490: 13 | P490: 6 | Q490: =O490*6+P490 -> 84 | S490: STABB | W490: PRAHRAN | X490: 6 | Y490: 5 | Z490: 0 | AA490: 1211 | AB490: 1214 | AC490: 99.75 | AD490: 24
A491: BEST PLAYERS | W491: CAULFIELD | X491: 6 | Y491: 5 | Z491: 0 | AA491: 1230 | AB491: 1246 | AC491: 98.72 | AD491: 24
A492: PRESTON | D492: WILSON | G492: MARSHALL | J492: STEWART | M492: PREECE | O492: RENWICK | Q492: LESLIE | W492: BRUNSWICK | X492: 4 | Y492: 6 | Z492: 1 | AA492: 1129 | AB492: 1185 | AC492: 95.27 | AD492: 18
A493: CAULFIELD | D493: TEMPEST | G493: HAYWOOD | J493: BECK | M493: HAWKING | O493: ROWE | Q493: EINSEDEL | W493: OAKLEIGH | X493: 2 | Y493: 8 | Z493: 1 | AA493: 936 | AB493: 1186 | AC493: 78.920741989881961 | AD493: 10
A494: GOALKICKERS | R494: BIRD | W494: SANDRINGHAM | X494: 2 | Y494: 9 | Z494: 0 | AA494: 1077 | AB494: 1240 | AC494: 86.854838709677423 | AD494: 8
A495: PRESTON | D495: WILSON 7 | F495: STEWART 2 | I495: MARKS 2 | K495: WEIGHTMAN | N495: SMITH | P495: RENWICK | R495: McKEON | T495: GRAINGER
A496: CAULFIELD | D496: DAVIDSON 3 | G496: M MOORE 3 | J496: HAWKING 2 | M496: HAYWOOD | O496: MAGUIRE | Q496: CLIFF | S496: BOOTH | U496: TAYLOR
A498: PRAHRAN | C498: 3 | D498: 4 | E498: =C498*6+D498 -> 22 | G498: 6 | H498: 13 | I498: =G498*6+H498 -> 49 | K498: 8 | L498: 18 | M498: =K498*6+L498 -> 66 | O498: 13 | P498: 22 | Q498: =O498*6+P498 -> 100 | S498: TOORAK PARK
A499: COBURG | C499: 3 | D499: 4 | E499: =C499*6+D499 -> 22 | G499: 3 | H499: 8 | I499: =G499*6+H499 -> 26 | K499: 5 | L499: 15 | M499: =K499*6+L499 -> 45 | O499: 9 | P499: 18 | Q499: =O499*6+P499 -> 72 | S499: ABBOTT
A500: BEST PLAYERS
A501: PRAHRAN | D501: WILKIE | G501: THORNTON | J501: JOHNSTON | M501: AUSTIN | P501: KELLY | S501: PAYNE
A502: COBURG | D502: WALKER | G502: McCARTHY | J502: O'CALLAGHAN | M502: BEATTIE | P502: BROWN
A503: GOALKICKERS
A504: PRAHRAN | D504: K SMITH 4 | G504: DICKSON 3 | J504: THORNTON 2 | M504: JOHNSTON | O504: WILLIAMS | R504: PAYNE | T504: WILKIE
A505: COBURG | D505: McCARTHY 3 | G505: BROWN 2 | J505: HODGETTS 2 | M505: DOHNT | O505: BEATTIE
A507: BRUNSWICK | C507: 4 | D507: 0 | E507: =C507*6+D507 -> 24 | G507: 9 | H507: 6 | I507: =G507*6+H507 -> 60 | K507: 11 | L507: 12 | M507: =K507*6+L507 -> 78 | O507: 18 | P507: 17 | Q507: =O507*6+P507 -> 125 | S507: BRUNSWICK
A508: SANDRINGHAM | C508: 4 | D508: 7 | E508: =C508*6+D508 -> 31 | G508: 5 | H508: 9 | I508: =G508*6+H508 -> 39 | K508: 11 | L508: 12 | M508: =K508*6+L508 -> 78 | O508: 12 | P508: 12 | Q508: =O508*6+P508 -> 84 | S508: VERGONA
A509: BEST PLAYERS
A510: BRUNSWICK | D510: STONE | G510: SCHIMMELBUSCH | K510: PARK | M510: ROWE | P510: WARDEN | S510: NOLAN
A511: SANDRINGHAM | D511: McCONNELL | G511: WILKINS | K511: HUNTER | M511: KENNEDY | P511: MACKENZIE
A512: GOALKICKERS
A513: BRUNSWICK | D513: SCHIMMELBUSCH 5 | H513: STONE 4 | J513: WARDEN 3 | M513: ORTON 2 | O513: JENKIN 2 | Q513: BRIGHAM | S513: LAXTON
A514: SANDRINGHAM | D514: JONES 3 | G514: KENNEDY 3 | J514: R MURRAY 2 | M514: HUNTER 2 | P514: CARROLL | R514: HUTCHINSON
A516: PORT MELBOURNE | C516: 2 | D516: 1 | E516: =C516*6+D516 -> 13 | G516: 8 | H516: 5 | I516: =G516*6+H516 -> 53 | K516: 12 | L516: 12 | M516: =K516*6+L516 -> 84 | O516: 16 | P516: 15 | Q516: =O516*6+P516 -> 111 | S516: OAKLEIGH
A517: OAKLEIGH | C517: 3 | D517: 6 | E517: =C517*6+D517 -> 24 | G517: 8 | H517: 7 | I517: =G517*6+H517 -> 55 | K517: 9 | L517: 9 | M517: =K517*6+L517 -> 63 | O517: 12 | P517: 13 | Q517: =O517*6+P517 -> 85 | S517: STEERE
A518: BEST PLAYERS
A519: PORT MELBOURNE | D519: DERMOTT | G519: RASMUSSEN | J519: ALLEN | M519: BROWN | O519: MOLLOY | R519: BARROT
A520: OAKLEIGH | D520: KING | G520: LILLEY | J520: GOODMAN | M520: BECK | O520: C NESBIT | R520: PETTIGREW
A521: GOALKICKERS
A522: PORT MELBOURNE | D522: RASMUSSEN 4 | G522: WHARTON 3 | J522: COOK 3 | L522: HOLT 2 | N522: CHRISTOU | P522: ALLEN | R522: STIBBARD | U522: DERMOTT
A523: OAKLEIGH | D523: HAY 5 | G523: McDONALD 3 | J523: KING 2 | L523: ROLFE | N523: RUNDELL
A525: ROUND 12 | E525: 11TH JULY | J525: WEATHER | N525: SOUTH WIND SHOWERS | S525: PLAYED AT
D526: 1ST QTR | H526: 2ND QTR | L526: 3RD QTR | P526: FINAL | S526: GEELONG WEST
A527: PORT MELBOURNE | E527: =C527*6+D527 -> 0 | I527: =G527*6+H527 -> 0 | M527: =K527*6+L527 -> 0 | O527: 25 | P527: 21 | Q527: =O527*6+P527 -> 171 | S527: UMPIRE | X527: LADDER | AB527: ROUND | AD527: 12
A528: GEELONG WEST | E528: =C528*6+D528 -> 0 | I528: =G528*6+H528 -> 0 | M528: =K528*6+L528 -> 0 | O528: 16 | P528: 14 | Q528: =O528*6+P528 -> 110 | S528: STABB
A529: BEST PLAYERS | W529: TEAM | X529: W | Y529: L | Z529: D | AA529: FOR | AB529: AGST | AC529: % | AD529: PTS
A530: PORT MELBOURNE | D530: HAENAN | G530: CHRISTOU | J530: COOK
A531: GEELONG WEST | D531: STOKES | G531: DEEATH | J531: HINDSON | W531: PORT MELBOURNE | X531: 9 | Y531: 3 | Z531: 0 | AA531: 1499 | AB531: 1251 | AC531: 119.82414068745004 | AD531: 36
A532: GOALKICKERS | W532: DANDENONG | X532: 8 | Y532: 4 | Z532: 0 | AA532: 1330 | AB532: 1144 | AC532: 116.25874125874125 | AD532: 32
A533: PORT MELBOURNE | D533: COOK 8 | F533: HOLT 4 | H533: CHRISTOU 3 | K533: HAENAN 2 | M533: RASMUSSEN 2 | P533: KERR 2 | R533: BROWN | T533: HARLAND | W533: PRESTON | X533: 7 | Y533: 5 | Z533: 0 | AA533: 1356 | AB533: 1250 | AC533: 107.79 | AD533: 28
A534: GEELONG WEST | D534: GRAHAM 6 | F534: GILMORE 3 | I534: WOOLFE 2 | K534: FRIEND | M534: YATES | O534: WELLS | Q534: HINDSON | S534: GILLIES | W534: CAULFIELD | X534: 7 | Y534: 5 | Z534: 0 | AA534: 1384 | AB534: 1366 | AC534: 101.32 | AD534: 28
A536: PRESTON | E536: =C536*6+D536 -> 0 | I536: =G536*6+H536 -> 0 | M536: =K536*6+L536 -> 0 | O536: 15 | P536: 17 | Q536: =O536*6+P536 -> 107 | S536: COBURG | W536: GEELONG WEST | X536: 7 | Y536: 5 | Z536: 0 | AA536: 1222 | AB536: 1299 | AC536: 94.072363356428028 | AD536: 28
A537: COBURG | E537: =C537*6+D537 -> 0 | I537: =G537*6+H537 -> 0 | M537: =K537*6+L537 -> 0 | O537: 14 | P537: 12 | Q537: =O537*6+P537 -> 96 | S537: FITZPATRICK | W537: COBURG | X537: 6 | Y537: 6 | Z537: 0 | AA537: 1309 | AB537: 1226 | AC537: 106.76998368678629 | AD537: 24
A538: BEST PLAYERS | W538: PRAHRAN | X538: 6 | Y538: 6 | Z538: 0 | AA538: 1280 | AB538: 1366 | AC538: 93.7 | AD538: 24
A539: PRESTON | D539: STEWART | G539: MARSHALL | J539: PREECE | W539: BRUNSWICK | X539: 4 | Y539: 7 | Z539: 1 | AA539: 1250 | AB539: 1364 | AC539: 91.64 | AD539: 18
A540: COBURG | D540: FORMOSA | G540: SLATER | J540: HODGETTS | W540: SANDRINGHAM | X540: 3 | Y540: 9 | Z540: 0 | AA540: 1229 | AB540: 1309 | AC540: 93.888464476699767 | AD540: 12
A541: GOALKICKERS | W541: OAKLEIGH | X541: 2 | Y541: 9 | Z541: 1 | AA541: 1056 | AB541: 1340 | AC541: 78.805970149253724 | AD541: 10
A542: PRESTON | D542: STEWART 6 | G542: SALTMARSH 3 | J542: WILSON 3 | M542: MARKS 2 | P542: ROBINSON
A543: COBURG | D543: HODGETTS 6 | G543: BROWN 2 | I543: FORMOSA 2 | L543: HEADLAM | N543: MANNIX | P543: R WESCOMBE | S543: BEATTIE
A545: CAULFIELD | E545: =C545*6+D545 -> 0 | I545: =G545*6+H545 -> 0 | M545: =K545*6+L545 -> 0 | O545: 23 | P545: 16 | Q545: =O545*6+P545 -> 154 | S545: PRINCES PARK
A546: OAKLEIGH | E546: =C546*6+D546 -> 0 | I546: =G546*6+H546 -> 0 | M546: =K546*6+L546 -> 0 | O546: 17 | P546: 18 | Q546: =O546*6+P546 -> 120 | S546: CARLILE
A547: BEST PLAYERS
A548: CAULFIELD | D548: HAWKING | G548: HAYWOOD | J548: EINSEDEL
A549: OAKLEIGH | D549: KING | G549: CHISHOLM | J549: BECK
A550: GOALKICKERS
A551: CAULFIELD | D551: HAWKING 4 | G551: M MOORE 3 | J551: SUTTIE 3 | L551: McFARLANE 3 | O551: BECK 2 | Q551: RITTERMAN 2 | T551: MILNER 2 | W551: EINSEDEL | X551: CLIFF | Z551: DAVIDSON | AB551: ROWE
A552: OAKLEIGH | D552: McDONALD 5 | G552: HAY 4 | I552: KING 3 | K552: CHISHOLM 2 | N552: PETTIGREW | Q552: A McGRATH | T552: MALONEY
A554: SANDRINGHAM | E554: =C554*6+D554 -> 0 | I554: =G554*6+H554 -> 0 | M554: =K554*6+L554 -> 0 | O554: 22 | P554: 20 | Q554: =O554*6+P554 -> 152 | S554: BEACH ROAD
A555: PRAHRAN | E555: =C555*6+D555 -> 0 | I555: =G555*6+H555 -> 0 | M555: =K555*6+L555 -> 0 | O555: 10 | P555: 9 | Q555: =O555*6+P555 -> 69 | S555: O'BRIEN
A556: BEST PLAYERS
A557: SANDRINGHAM | D557: MACKENZIE | G557: WILKINS | J557: PETERS
A558: PRAHRAN | D558: K SMITH | G558: WILLIAMS | J558: JOHNSTON
A559: GOALKICKERS
A560: SANDRINGHAM | D560: PETERS 5 | F560: R MURRAY 4 | I560: EDDY 3 | K560: HUTCHINSON 2 | N560: HUNTER 2 | Q560: CARROLL | S560: KENNEDY | V560: CARRIGG | X560: CLARK | Z560: BEUS | AB560: SIMPSON
A561: PRAHRAN | D561: K SMITH 5 | G561: LITTLE 2 | I561: AUSTIN | K561: PAYNE | M561: ANDERSON
A563: DANDENONG | E563: =C563*6+D563 -> 0 | I563: =G563*6+H563 -> 0 | M563: =K563*6+L563 -> 0 | O563: 26 | P563: 23 | Q563: =O563*6+P563 -> 179 | S563: DANDENONG
A564: BRUNSWICK | E564: =C564*6+D564 -> 0 | I564: =G564*6+H564 -> 0 | M564: =K564*6+L564 -> 0 | O564: 17 | P564: 19 | Q564: =O564*6+P564 -> 121 | S564: HAYES
A565: BEST PLAYERS
A566: DANDENONG | D566: HIBBERT | G566: DROSCHER | J566: SHINNERS
A567: BRUNSWICK | D567: STONE | G567: JENKIN | J567: NOLAN
A568: GOALKICKERS
A569: DANDENONG | D569: MILLER 5 | F569: ORCHARD 5 | I569: HIBBERT 3 | K569: FLAHERTY 3 | N569: REID 3 | P569: BRIESE 2 | R569: DROSCHER 2 | V569: HARRINGTON | X569: SHINNERS | AA569: BASSED
A570: BRUNSWICK | D570: ORTON 5 | G570: JENKIN 3 | I570: STONE 3 | K570: BRIGHAM 2 | N570: GINGELL 2 | Q570: SCHIMMELBUSCH 2
A572: ROUND 13 | E572: 18TH JULY | J572: WEATHER | S572: PLAYED AT
D573: 1ST QTR | H573: 2ND QTR | L573: 3RD QTR | P573: FINAL | S573: PORT MELBOURNE
A574: PORT MELBOURNE | C574: 6 | D574: 4 | E574: =C574*6+D574 -> 40 | G574: 9 | H574: 10 | I574: =G574*6+H574 -> 64 | K574: 16 | L574: 13 | M574: =K574*6+L574 -> 109 | O574: 24 | P574: 15 | Q574: =O574*6+P574 -> 159 | S574: UMPIRE | X574: LADDER | AB574: ROUND | AD574: 13
A575: CAULFIELD | C575: 6 | D575: 6 | E575: =C575*6+D575 -> 42 | G575: 12 | H575: 10 | I575: =G575*6+H575 -> 82 | K575: 14 | L575: 12 | M575: =K575*6+L575 -> 96 | O575: 21 | P575: 16 | Q575: =O575*6+P575 -> 142 | S575: VERGONA
A576: BEST PLAYERS | W576: TEAM | X576: W | Y576: L | Z576: D | AA576: FOR | AB576: AGST | AC576: % | AD576: PTS
A577: PORT MELBOURNE | D577: COOK | G577: BROWN | J577: CHRISTOU | M577: MOLLOY | O577: ALLEN | R577: OWEN
A578: CAULFIELD | D578: EINSEDEL | G578: HAYWOOD | J578: TEMPEST | M578: CLIFF | O578: HAWKING | R578: DAVIDSON | W578: PORT MELBOURNE | X578: 10 | Y578: 3 | Z578: 0 | AA578: 1658 | AB578: 1393 | AC578: 119.02368987796123 | AD578: 40
A579: GOALKICKERS | W579: DANDENONG | X579: 9 | Y579: 4 | Z579: 0 | AA579: 1435 | AB579: 1236 | AC579: 116.10032362459548 | AD579: 36
A580: PORT MELBOURNE | D580: COOK 13 | F580: CHRISTOU 3 | I580: RASMUSSEN 2 | L580: BROWN 2 | N580: HARLAND | P580: HOLT | Q580: BARROT | S580: BOND | W580: PRESTON | X580: 8 | Y580: 5 | Z580: 0 | AA580: 1525 | AB580: 1402 | AC580: 108.77 | AD580: 32
A581: CAULFIELD | D581: MOORE 5 | F581: DAVIDSON 3 | I581: McFARLANE 3 | L581: EINSEDEL 2 | N581: HAWKING 2 | Q581: CLIFF | R581: SUTTIE | T581: HUNT | W581: GEELONG WEST | X581: 8 | Y581: 5 | Z581: 0 | AA581: 1381 | AB581: 1387 | AC581: 99.567411679884643 | AD581: 32
N582: RITTERMAN | Q582: RICHARDS
A583: DANDENONG | C583: 3 | D583: 4 | E583: =C583*6+D583 -> 22 | G583: 5 | H583: 9 | I583: =G583*6+H583 -> 39 | K583: 12 | L583: 13 | M583: =K583*6+L583 -> 85 | O583: 15 | P583: 15 | Q583: =O583*6+P583 -> 105 | S583: TOORAK PARK | W583: COBURG | X583: 7 | Y583: 6 | Z583: 0 | AA583: 1454 | AB583: 1322 | AC583: 109.98487140695916 | AD583: 28
A584: PRAHRAN | C584: 2 | D584: 7 | E584: =C584*6+D584 -> 19 | G584: 7 | H584: 15 | I584: =G584*6+H584 -> 57 | K584: 10 | L584: 18 | M584: =K584*6+L584 -> 78 | O584: 12 | P584: 20 | Q584: =O584*6+P584 -> 92 | S584: McGIBBON | W584: CAULFIELD | X584: 7 | Y584: 6 | Z584: 0 | AA584: 1526 | AB584: 1525 | AC584: 100.07 | AD584: 28
A585: BEST PLAYERS | W585: PRAHRAN | X585: 6 | Y585: 7 | Z585: 0 | AA585: 1372 | AB585: 1471 | AC585: 93.27 | AD585: 24
A586: DANDENONG | D586: MILLER | G586: THOMPSON | J586: HIBBERT | M586: PAYZE | O586: HARRINGTON | R586: DROSCHER | W586: BRUNSWICK | X586: 4 | Y586: 8 | Z586: 1 | AA586: 1338 | AB586: 1523 | AC586: 87.85 | AD586: 18
A587: PRAHRAN | D587: KELLY | G587: AUSTIN | J587: WILLIAMS | M587: JOHNSTON | O587: THORNTON | R587: TOWNSEND | W587: SANDRINGHAM | X587: 3 | Y587: 10 | Z587: 0 | AA587: 1381 | AB587: 1478 | AC587: 93.437077131258462 | AD587: 12
A588: GOALKICKERS | W588: OAKLEIGH | X588: 2 | Y588: 10 | Z588: 1 | AA588: 1152 | AB588: 1485 | AC588: 77.575757575757578 | AD588: 10
A589: DANDENONG | D589: MILLER 6 | G589: PAYZE 4 | J589: HIBBERT 2 | M589: SHEVLIN | O589: BASSED | Q589: THOMPSON
A590: PRAHRAN | D590: SMITH 2 | F590: JOHNSTON 2 | I590: DICKSON 2 | L590: WILKIE 2 | N590: WILLIAMS | Q590: AUSTIN | S590: PAYNE | U590: THORNTON
A592: GEELONG WEST | C592: 7 | D592: 3 | E592: =C592*6+D592 -> 45 | G592: 12 | H592: 5 | I592: =G592*6+H592 -> 77 | K592: 19 | L592: 9 | M592: =K592*6+L592 -> 123 | O592: 24 | P592: 15 | Q592: =O592*6+P592 -> 159 | S592: BRUNSWICK
A593: BRUNSWICK | C593: 1 | D593: 2 | E593: =C593*6+D593 -> 8 | G593: 5 | H593: 10 | I593: =G593*6+H593 -> 40 | K593: 9 | L593: 13 | M593: =K593*6+L593 -> 67 | O593: 12 | P593: 16 | Q593: =O593*6+P593 -> 88 | S593: WENN
A594: BEST PLAYERS
A595: GEELONG WEST | D595: FRIEND | G595: McMILLAN | J595: YATES | N595: BARRY | P595: WELLS | R595: RADOJEVIC
A596: BRUNSWICK | D596: NOLAN | G596: PARK | J596: SCHIMMELBUSCH | N596: WARDEN | P596: JENKIN
A597: GOALKICKERS
A598: GEELONG WEST | D598: RADOJEVIC 8 | G598: ROE 5 | I598: FRIEND 4 | K598: McMILLAN 2 | N598: EDDY 2 | P598: WELLS | R598: GRAHAM | U598: WOOLFE
A599: BRUNSWICK | D599: WARDEN 5 | G599: ORTON 3 | I599: CARLTON | K599: SCHIMMELBUSCH | O599: PARK | Q599: WEST
A601: COBURG | C601: 4 | D601: 3 | E601: =C601*6+D601 -> 27 | G601: 8 | H601: 8 | I601: =G601*6+H601 -> 56 | K601: 17 | L601: 11 | M601: =K601*6+L601 -> 113 | O601: 22 | P601: 13 | Q601: =O601*6+P601 -> 145 | S601: OAKLEIGH
A602: OAKLEIGH | C602: 4 | D602: 5 | E602: =C602*6+D602 -> 29 | G602: 8 | H602: 10 | I602: =G602*6+H602 -> 58 | K602: 11 | L602: 14 | M602: =K602*6+L602 -> 80 | O602: 13 | P602: 18 | Q602: =O602*6+P602 -> 96 | S602: MARCY
A603: BEST PLAYERS
A604: COBURG | D604: BEATTIE | G604: HODGETTS | J604: FORMOSA | M604: SLATER | P604: CLEARY | R604: HOWELL
A605: OAKLEIGH | D605: GOODMAN | G605: BECK | J605: McGRATH | M605: PETTIGREW | P605: KING | R605: WHITE
A606: GOALKICKERS
A607: COBURG | D607: HODGETTS 8 | G607: CLEARY 5 | I607: BROWN 3 | K607: FORMOSA 2 | N607: HEADLAM | Q607: McCARTHY | T607: MANNIX | W607: HOWELL
A608: OAKLEIGH | D608: WHITE 3 | F608: HAY 2 | H608: CHISHOLM 2 | K608: McDONALD 2 | N608: GOODMAN | Q608: PETTIGREW | T608: TESERIERO | W608: D NESBIT
A610: PRESTON | C610: 7 | D610: 5 | E610: =C610*6+D610 -> 47 | G610: 12 | H610: 7 | I610: =G610*6+H610 -> 79 | K610: 20 | L610: 11 | M610: =K610*6+L610 -> 131 | O610: 26 | P610: 13 | Q610: =O610*6+P610 -> 169 | S610: PRESTON
A611: SANDRINGHAM | C611: 4 | D611: 3 | E611: =C611*6+D611 -> 27 | G611: 12 | H611: 8 | I611: =G611*6+H611 -> 80 | K611: 17 | L611: 12 | M611: =K611*6+L611 -> 114 | O611: 23 | P611: 14 | Q611: =O611*6+P611 -> 152 | S611: STEERE
A612: BEST PLAYERS
A613: PRESTON | D613: STEWART | G613: GRAINGER | J613: WILSON | M613: MARKS | O613: MARSHALL | R613: IRELAND
A614: SANDRINGHAM | D614: R MURRAY | G614: MACKENZIE | J614: WILKINS | M614: HUNTER | O614: OWENS | R614: SIMPSON
A615: GOALKICKERS
A616: PRESTON | D616: STEWART 9 | G616: WILSON 6 | I616: IRELAND 3 | L616: WEIGHTMAN 2 | O616: SALTMARSH 2 | R616: MARKS 2 | U616: SMITH | W616: MARSHALL
A617: SANDRINGHAM | D617: R MURRAY 6 | G617: EDDY 4 | I617: PETERS 3 | K617: SIMPSON 3 | N617: HUNTER 2 | Q617: KENNEDY | S617: MACKENZIE | V617: CLARK | X617: OWENS | Z617: CARROLL
A619: ROUND 14 | E619: 24TH JULY | J619: WEATHER | N619: NORTH WIND | S619: PLAYED AT
D620: 1ST QTR | H620: 2ND QTR | L620: 3RD QTR | P620: FINAL | S620: DANDENONG
A621: PORT MELBOURNE | C621: 8 | D621: 2 | E621: =C621*6+D621 -> 50 | G621: 12 | H621: 8 | I621: =G621*6+H621 -> 80 | K621: 16 | L621: 15 | M621: =K621*6+L621 -> 111 | O621: 19 | P621: 19 | Q621: =O621*6+P621 -> 133 | S621: UMPIRE | X621: LADDER | AB621: ROUND | AD621: 14
A622: DANDENONG | C622: 1 | D622: 1 | E622: =C622*6+D622 -> 7 | G622: 7 | H622: 7 | I622: =G622*6+H622 -> 49 | K622: 16 | L622: 11 | M622: =K622*6+L622 -> 107 | O622: 18 | P622: 15 | Q622: =O622*6+P622 -> 123 | S622: OGSTON
A623: BEST PLAYERS | W623: TEAM | X623: W | Y623: L | Z623: D | AA623: FOR | AB623: AGST | AC623: % | AD623: PTS
A624: PORT MELBOURNE | D624: SWAN | G624: COOK | J624: HAENAN | M624: COLBERT | P624: PROFFIT
A625: DANDENONG | D625: HIBBERT | G625: THOMPSON | J625: WRIGHT | M625: DROSCHER | P625: PAYZE | W625: PORT MELBOURNE | X625: 11 | Y625: 3 | Z625: 0 | AA625: 1791 | AB625: 1516 | AC625: 118.13984168865436 | AD625: 44
A626: GOALKICKERS | R626: BROWN | W626: DANDENONG | X626: 9 | Y626: 5 | Z626: 0 | AA626: 1558 | AB626: 1369 | AC626: 113.80569758948137 | AD626: 36
A627: PORT MELBOURNE | D627: COOK 9 | F627: HAENAN 3 | I627: RASMUSSEN 2 | L627: BARROT | N627: BOND | P627: MOLLOY | R627: CHRISTOU | W627: PRESTON | X627: 9 | Y627: 5 | Z627: 0 | AA627: 1665 | AB627: 1510 | AC627: 110.26 | AD627: 36
A628: DANDENONG | D628: PAYZE 4 | F628: MILLER 3 | H628: SHEVLIN 3 | J628: ORCHARD 3 | M628: THOMPSON 2 | P628: CRANE | R628: BRIESE | T628: HIBBERT | W628: COBURG | X628: 8 | Y628: 6 | Z628: 0 | AA628: 1646 | AB628: 1446 | AC628: 113.83125864453665 | AD628: 32
A630: COBURG | C630: 4 | D630: 2 | E630: =C630*6+D630 -> 26 | G630: 14 | H630: 8 | I630: =G630*6+H630 -> 92 | K630: 23 | L630: 11 | M630: =K630*6+L630 -> 149 | O630: 30 | P630: 12 | Q630: =O630*6+P630 -> 192 | S630: COBURG | W630: CAULFIELD | X630: 8 | Y630: 6 | Z630: 0 | AA630: 1635 | AB630: 1623 | AC630: 100.74 | AD630: 32
A631: GEELONG WEST | C631: 4 | D631: 2 | E631: =C631*6+D631 -> 26 | G631: 10 | H631: 5 | I631: =G631*6+H631 -> 65 | K631: 15 | L631: 10 | M631: =K631*6+L631 -> 100 | O631: 18 | P631: 16 | Q631: =O631*6+P631 -> 124 | S631: HAYES | W631: GEELONG WEST | X631: 8 | Y631: 6 | Z631: 0 | AA631: 1505 | AB631: 1579 | AC631: 95.313489550348322 | AD631: 32
A632: BEST PLAYERS | W632: PRAHRAN | X632: 6 | Y632: 8 | Z632: 0 | AA632: 1480 | AB632: 1611 | AC632: 91.87 | AD632: 24
A633: COBURG | D633: MANNIX | G633: HODGETTS | J633: CLEARY | M633: PITT | P633: McCARTHY | S633: FORMOSA | W633: BRUNSWICK | X633: 5 | Y633: 8 | Z633: 1 | AA633: 1475 | AB633: 1600 | AC633: 92.19 | AD633: 22
A634: GEELONG WEST | D634: GILMORE | G634: DEEATH | J634: FRIEND | M634: ROE | P634: WELLS | W634: SANDRINGHAM | X634: 3 | Y634: 11 | Z634: 0 | AA634: 1479 | AB634: 1587 | AC634: 93.194706994328925 | AD634: 12
A635: GOALKICKERS | Q635: HOWELL | W635: OAKLEIGH | X635: 2 | Y635: 11 | Z635: 1 | AA635: 1229 | AB635: 1622 | AC635: 75.770653514180026 | AD635: 10
A636: COBURG | D636: HODGETTS 10 | G636: CLEARY 6 | I636: LLOYD 4 | K636: BROWN 3 | M636: McCARTHY 2 | P636: HEADLAM | R636: BURT | T636: PAUL
A637: GEELONG WEST | D637: GILMORE 5 | F637: ROE 5 | H637: RADOJEVIC 3 | K637: FRIEND | M637: YATES | O637: EDDY | Q637: WELLS | S637: MIDDLEMISS
A639: PRESTON | C639: 5 | D639: 4 | E639: =C639*6+D639 -> 34 | G639: 8 | H639: 9 | I639: =G639*6+H639 -> 57 | K639: 16 | L639: 13 | M639: =K639*6+L639 -> 109 | O639: 21 | P639: 14 | Q639: =O639*6+P639 -> 140 | S639: TOORAK PARK
A640: PRAHRAN | C640: 8 | D640: 3 | E640: =C640*6+D640 -> 51 | G640: 10 | H640: 7 | I640: =G640*6+H640 -> 67 | K640: 12 | L640: 11 | M640: =K640*6+L640 -> 83 | O640: 16 | P640: 12 | Q640: =O640*6+P640 -> 108 | S640: MARCY
A641: BEST PLAYERS
A642: PRESTON | D642: DURWOOD | G642: SCHICKERT | J642: PREECE | M642: IRELAND | P642: SMITH | S642: MARKS
A643: PRAHRAN | D643: JOHNSTON | G643: KELLY | J643: TOWNSEND | M643: ANDERSON | P643: WILLIAMS | S643: CLAY
A644: GOALKICKERS
A645: PRESTON | D645: IRELAND 6 | G645: SMITH 3 | I645: WILSON 2 | L645: STEWART 2 | O645: SALTMARSH 2 | R645: MARKS 2 | U645: WEIGHTMAN
A646: PRAHRAN | D646: JOHNSTON 5 | G646: K SMITH 3 | J646: DICKSON 2 | M646: WILLIAMS 2 | P646: TOWNSEND | S646: PAYNE | U646: THONTON | X646: CLAY
A648: BRUNSWICK | C648: 2 | D648: 9 | E648: =C648*6+D648 -> 21 | G648: 7 | H648: 14 | I648: =G648*6+H648 -> 56 | K648: 13 | L648: 24 | M648: =K648*6+L648 -> 102 | O648: 18 | P648: 29 | Q648: =O648*6+P648 -> 137 | S648: BRUNSWICK
A649: OAKLEIGH | C649: 3 | D649: 2 | E649: =C649*6+D649 -> 20 | G649: 4 | H649: 5 | I649: =G649*6+H649 -> 29 | K649: 8 | L649: 9 | M649: =K649*6+L649 -> 57 | O649: 11 | P649: 11 | Q649: =O649*6+P649 -> 77 | S649: McGIBBON
A650: BEST PLAYERS
A651: BRUNSWICK | D651: NOLAN | G651: HUGGARD | J651: GINGELL | M651: JOSEPH | P651: SCHIMMELBUSCH | S651: BUCKLEY
A652: OAKLEIGH | D652: BECK | G652: KING | J652: LILLEY | M652: HAY | P652: McGRATH | S652: McDONALD
A653: GOALKICKERS
A654: BRUNSWICK | D654: WARDEN 5 | G654: BRIGHAM 3 | J654: GINGELL 2 | M654: HUGGARD 2 | P654: ORTON 2 | R654: VALENTINE | U654: JOSEPH | W654: PARK
A655: OAKLEIGH | D655: MOLONEY 3 | G655: COLCOTT 2 | J655: GOODMAN 2 | M655: McDONALD | P655: KING | R655: WHITE | T655: PETTIGREW
A657: CAULFIELD | C657: 5 | D657: 3 | E657: =C657*6+D657 -> 33 | G657: 9 | H657: 6 | I657: =G657*6+H657 -> 60 | K657: 11 | L657: 9 | M657: =K657*6+L657 -> 75 | O657: 15 | P657: 19 | Q657: =O657*6+P657 -> 109 | S657: BEACH ROAD
A658: SANDRINGHAM | C658: 3 | D658: 6 | E658: =C658*6+D658 -> 24 | G658: 4 | H658: 11 | I658: =G658*6+H658 -> 35 | K658: 11 | L658: 14 | M658: =K658*6+L658 -> 80 | O658: 14 | P658: 14 | Q658: =O658*6+P658 -> 98 | S658: WENN
A659: BEST PLAYERS
A660: CAULFIELD | D660: EINSEDEL | G660: HUNT | J660: HAYWOOD | M660: ROWE | O660: DAVIDSON | R660: CLIFF
A661: SANDRINGHAM | D661: HUTCHINSON | G661: GOOLD | J661: KENNEDY | M661: HUNTER | O661: OWENS | R661: SIMPSON
A662: GOALKICKERS
A663: CAULFIELD | D663: HUNT 5 | F663: MOORE 3 | I663: DAVIDSON 3 | L663: CLIFF | N663: RITTERMAN | Q663: ROWE | S663: JEWELL
A664: SANDRINGHAM | D664: EDDY 4 | F664: HUNTER 4 | I664: HUTCHINSON 2 | L664: PETERS 2 | N664: WILKINS | P664: SIMPSON
A666: ROUND 15 | E666: 1ST AUGUST | J666: WEATHER | N666: SOUTH WIND RAIN | S666: PLAYED AT
D667: 1ST QTR | H667: 2ND QTR | L667: 3RD QTR | P667: FINAL | S667: PRINCES PARK
A668: CAULFIELD | C668: 3 | D668: 7 | E668: =C668*6+D668 -> 25 | G668: 4 | H668: 8 | I668: =G668*6+H668 -> 32 | K668: 8 | L668: 9 | M668: =K668*6+L668 -> 57 | O668: 9 | P668: 13 | Q668: =O668*6+P668 -> 67 | S668: UMPIRE | X668: LADDER | AB668: ROUND | AD668: 15
A669: DANDENONG | C669: 1 | D669: 1 | E669: =C669*6+D669 -> 7 | G669: 3 | H669: 4 | I669: =G669*6+H669 -> 22 | K669: 3 | L669: 6 | M669: =K669*6+L669 -> 24 | O669: 4 | P669: 10 | Q669: =O669*6+P669 -> 34 | S669: HAYES
A670: BEST PLAYERS | W670: TEAM | X670: W | Y670: L | Z670: D | AA670: FOR | AB670: AGST | AC670: % | AD670: PTS
A671: CAULFIELD | D671: EINSEDEL | G671: CLIFF | J671: P FRIGO | M671: HAYWOOD | P671: BALL | R671: TAYLOR
A672: DANDENONG | D672: DROSCHER | G672: CRANE | J672: WRIGHT | M672: THOMPSON | P672: BRIESE | R672: PAYZE | W672: PORT MELBOURNE | X672: 12 | Y672: 3 | Z672: 0 | AA672: 1889 | AB672: 1552 | AC672: 121.7139175257732 | AD672: 48
A673: GOALKICKERS | W673: PRESTON | X673: 10 | Y673: 5 | Z673: 0 | AA673: 1756 | AB673: 1590 | AC673: 110.44 | AD673: 40
A674: CAULFIELD | D674: HUNT 2 | G674: MOORE 2 | J674: MILNER 2 | M674: BECK | O674: DAVIDSON | R674: TAYLOR | W674: COBURG | X674: 9 | Y674: 6 | Z674: 0 | AA674: 1738 | AB674: 1515 | AC674: 114.71947194719472 | AD674: 36
A675: DANDENONG | D675: DOWSETT | G675: ORCHARD | J675: CRANE | M675: THOMPSON | W675: DANDENONG | X675: 9 | Y675: 6 | Z675: 0 | AA675: 1592 | AB675: 1436 | AC675: 110.86350974930362 | AD675: 36
A677: PRESTON | C677: 6 | D677: 5 | E677: =C677*6+D677 -> 41 | G677: 8 | H677: 8 | I677: =G677*6+H677 -> 56 | K677: 10 | L677: 15 | M677: =K677*6+L677 -> 75 | O677: 12 | P677: 19 | Q677: =O677*6+P677 -> 91 | S677: GEELONG WEST | W677: CAULFIELD | X677: 9 | Y677: 6 | Z677: 0 | AA677: 1702 | AB677: 1657 | AC677: 102.72 | AD677: 36
A678: GEELONG WEST | C678: 1 | D678: 0 | E678: =C678*6+D678 -> 6 | G678: 7 | H678: 2 | I678: =G678*6+H678 -> 44 | K678: 8 | L678: 4 | M678: =K678*6+L678 -> 52 | O678: 12 | P678: 8 | Q678: =O678*6+P678 -> 80 | S678: STABB | W678: GEELONG WEST | X678: 8 | Y678: 7 | Z678: 0 | AA678: 1585 | AB678: 1670 | AC678: 94.910179640718567 | AD678: 32
A679: BEST PLAYERS | W679: PRAHRAN | X679: 6 | Y679: 9 | Z679: 0 | AA679: 1524 | AB679: 1684 | AC679: 90.5 | AD679: 24
A680: PRESTON | D680: SMITH | G680: MARKS | J680: ZEMSKI | M680: SHICKERT | P680: WILSON | R680: GRAINGER | W680: BRUNSWICK | X680: 5 | Y680: 9 | Z680: 1 | AA680: 1511 | AB680: 1698 | AC680: 88.99 | AD680: 22
A681: GEELONG WEST | D681: HUGHES | G681: FRIEND | J681: RUSSELL | M681: SMITH | P681: DEEATH | R681: YATES | W681: OAKLEIGH | X681: 3 | Y681: 11 | Z681: 1 | AA681: 1302 | AB681: 1666 | AC681: 78.151260504201687 | AD681: 14
A682: GOALKICKERS | W682: SANDRINGHAM | X682: 3 | Y682: 12 | Z682: 0 | AA682: 1548 | AB682: 1679 | AC682: 92.19773674806433 | AD682: 12
A683: PRESTON | D683: WILSON 4 | F683: MARKS 2 | H683: SALTMARSH | K683: STEWART | M683: SMITH | O683: DURWOOD | Q683: BUTLER | S683: WEIGHTMAN
A684: GEELONG WEST | D684: WELLS 3 | F684: ROE 2 | H684: FRIEND | J684: DEEATH | L684: RADOJEVIC | N684: HUGHES | P684: ANDJELKOVIC | S684: WOOLFE | V684: GILMORE
A686: OAKLEIGH | C686: 1 | D686: 1 | E686: =C686*6+D686 -> 7 | G686: 3 | H686: 5 | I686: =G686*6+H686 -> 23 | K686: 6 | L686: 7 | M686: =K686*6+L686 -> 43 | O686: 10 | P686: 13 | Q686: =O686*6+P686 -> 73 | S686: OAKLEIGH
A687: PRAHRAN | C687: 2 | D687: 1 | E687: =C687*6+D687 -> 13 | G687: 2 | H687: 3 | I687: =G687*6+H687 -> 15 | K687: 5 | L687: 7 | M687: =K687*6+L687 -> 37 | O687: 6 | P687: 8 | Q687: =O687*6+P687 -> 44 | S687: OGSTON
A688: BEST PLAYERS
A689: OAKLEIGH | D689: BECK | G689: LILLEY | I689: PETTIGREW | L689: WHITE | N689: McGRATH | Q689: GOODMAN
A690: PRAHRAN | D690: ANDERSON | G690: KELLY | I690: AUSTIN | L690: JOHNSTON | N690: TOWNSEND | Q690: WILLIAMS
A691: GOALKICKERS
A692: OAKLEIGH | D692: WHITE 5 | G692: McGRATH 2 | J692: PETTIGREW | M692: GOODMAN | P692: HOLDEN
A693: PRAHRAN | D693: K SMITH 2 | G693: DICKSON 2 | J693: JOHNSTON 2
A695: COBURG | C695: 2 | D695: 2 | E695: =C695*6+D695 -> 14 | G695: 5 | H695: 8 | I695: =G695*6+H695 -> 38 | K695: 10 | L695: 10 | M695: =K695*6+L695 -> 70 | O695: 12 | P695: 20 | Q695: =O695*6+P695 -> 92 | S695: COBURG
A696: SANDRINGHAM | C696: 3 | D696: 8 | E696: =C696*6+D696 -> 26 | G696: 4 | H696: 11 | I696: =G696*6+H696 -> 35 | K696: 7 | L696: 12 | M696: =K696*6+L696 -> 54 | O696: 9 | P696: 15 | Q696: =O696*6+P696 -> 69 | S696: BROWN
A697: BEST PLAYERS
A698: COBURG | D698: BURT | G698: MANNIX | J698: SLATER | M698: HEADLAM | P698: JOSS | R698: LLOYD
A699: SANDRINGHAM | D699: McCONNELL | G699: EDDY | J699: WILKINS | M699: BEUS | P699: DYNON | R699: HUTCHINSON
A700: GOALKICKERS
A701: COBURG | D701: HODGETTS 4 | G701: LLOYD 2 | I701: MANNIX 2 | L701: CLEARY 2 | O701: FORMOSA | Q701: BURT
A702: SANDRINGHAM | D702: EDDY 3 | G702: HUNTER 2 | J702: KENNEDY | M702: HUTCHINSON | P702: R MURRAY | S702: SIMPSON
A704: PORT MELBOURNE | C704: 4 | D704: 6 | E704: =C704*6+D704 -> 30 | G704: 7 | H704: 13 | I704: =G704*6+H704 -> 55 | K704: 10 | L704: 20 | M704: =K704*6+L704 -> 80 | O704: 12 | P704: 26 | Q704: =O704*6+P704 -> 98 | S704: PORT MELBOURNE
A705: BRUNSWICK | C705: 0 | D705: 2 | E705: =C705*6+D705 -> 2 | G705: 0 | H705: 6 | I705: =G705*6+H705 -> 6 | K705: 2 | L705: 8 | M705: =K705*6+L705 -> 20 | O705: 4 | P705: 12 | Q705: =O705*6+P705 -> 36 | S705: MARCY
A706: BEST PLAYERS
A707: PORT MELBOURNE | D707: BOND | G707: PROFFIT | J707: COLBERT | M707: HAENAN | P707: DERMOTT | S707: HOLT
A708: BRUNSWICK | D708: CARLTON | G708: PARK | J708: GINGELL | M708: JENKINS | P708: ROWE
A709: GOALKICKERS
A710: PORT MELBOURNE | D710: COOK 3 | F710: HARLAND 2 | I710: BOND 2 | K710: RASMUSSEN | N710: BECKWITH | Q710: COLBERT | S710: BARROT | U710: HOLT
A711: BRUNSWICK | D711: ORTON 2 | F711: JENKIN | I711: BRIGHAM
A713: ROUND 16 | E713: 8TH AUGUST | J713: WEATHER | N713: SOUTH WEST WIND FINE | S713: PLAYED AT
D714: 1ST QTR | H714: 2ND QTR | L714: 3RD QTR | P714: FINAL | S714: DANDENONG
A715: DANDENONG | C715: 4 | D715: 6 | E715: =C715*6+D715 -> 30 | G715: 4 | H715: 8 | I715: =G715*6+H715 -> 32 | K715: 13 | L715: 12 | M715: =K715*6+L715 -> 90 | O715: 18 | P715: 16 | Q715: =O715*6+P715 -> 124 | S715: UMPIRE | X715: LADDER | AB715: ROUND | AD715: 16
A716: COBURG | C716: 3 | D716: 2 | E716: =C716*6+D716 -> 20 | G716: 9 | H716: 6 | I716: =G716*6+H716 -> 60 | K716: 11 | L716: 12 | M716: =K716*6+L716 -> 78 | O716: 13 | P716: 12 | Q716: =O716*6+P716 -> 90 | S716: FITZPATRICK
A717: BEST PLAYERS | W717: TEAM | X717: W | Y717: L | Z717: D | AA717: FOR | AB717: AGST | AC717: % | AD717: PTS
A718: DANDENONG | D718: CRANE | G718: HIBBERT | J718: WRIGHT | M718: BRIESE | O718: TAYLOR | R718: DROSCHER
A719: COBURG | D719: LLOYD | G719: HEADLAM | J719: SLATER | M719: HOBBS | O719: O'CALLAGHAN | W719: PORT MELBOURNE | X719: 13 | Y719: 3 | Z719: 0 | AA719: 1976 | AB719: 1620 | AC719: 121.9753086419753 | AD719: 52
A720: GOALKICKERS | Q720: MILLER | S720: REID | W720: PRESTON | X720: 11 | Y720: 5 | Z720: 0 | AA720: 1888 | AB720: 1692 | AC720: 111.58 | AD720: 44
A721: DANDENONG | D721: WRIGHT 5 | F721: FLAHERTY 4 | I721: THOMPSON 2 | L721: PAYZE 2 | N721: ORCHARD | P721: TAYLOR | R721: HIBBERT | W721: DANDENONG | X721: 10 | Y721: 6 | Z721: 0 | AA721: 1716 | AB721: 1526 | AC721: 112.45085190039319 | AD721: 40
A722: COBURG | D722: LLOYD 5 | G722: WALKER 3 | J722: CLEARY 2 | M722: FORMOSA 2 | P722: DOHNT | W722: CAULFIELD | X722: 10 | Y722: 6 | Z722: 0 | AA722: 1830 | AB722: 1753 | AC722: 104.39 | AD722: 40
A724: CAULFIELD | C724: 5 | D724: 3 | E724: =C724*6+D724 -> 33 | G724: 10 | H724: 5 | I724: =G724*6+H724 -> 65 | K724: 19 | L724: 10 | M724: =K724*6+L724 -> 124 | O724: 19 | P724: 14 | Q724: =O724*6+P724 -> 128 | S724: BRUNSWICK | W724: COBURG | X724: 9 | Y724: 7 | Z724: 0 | AA724: 1828 | AB724: 1639 | AC724: 111.53142159853569 | AD724: 36
A725: BRUNSWICK | C725: 3 | D725: 1 | E725: =C725*6+D725 -> 19 | G725: 5 | H725: 6 | I725: =G725*6+H725 -> 36 | K725: 6 | L725: 13 | M725: =K725*6+L725 -> 49 | O725: 13 | P725: 18 | Q725: =O725*6+P725 -> 96 | S725: OGSTON | W725: GEELONG WEST | X725: 8 | Y725: 8 | Z725: 0 | AA725: 1713 | AB725: 1832 | AC725: 93.504366812227076 | AD725: 32
A726: BEST PLAYERS | W726: PRAHRAN | X726: 6 | Y726: 10 | Z726: 0 | AA726: 1592 | AB726: 1771 | AC726: 89.89 | AD726: 24
A727: CAULFIELD | D727: EINSEDEL | G727: DAVIDSON | J727: MAGUIRE | M727: HAYWOOD | P727: BECK | S727: HUNT | W727: BRUNSWICK | X727: 5 | Y727: 10 | Z727: 1 | AA727: 1607 | AB727: 1826 | AC727: 88.01 | AD727: 22
A728: BRUNSWICK | D728: JENKIN | G728: ORTON | J728: CARLTON | M728: FITZPATRICK | P728: SCHIMMELBUSCH | S728: NOLAN | W728: SANDRINGHAM | X728: 4 | Y728: 12 | Z728: 0 | AA728: 1710 | AB728: 1807 | AC728: 94.631986718317648 | AD728: 16
A729: GOALKICKERS | M729: HAWKING | P729: TAYLOR | R729: MILNER | W729: OAKLEIGH | X729: 3 | Y729: 12 | Z729: 1 | AA729: 1404 | AB729: 1798 | AC729: 78.086763070077865 | AD729: 14
A730: CAULFIELD | D730: HUNT 5 | F730: DAVIDSON 4 | I730: EINSEDEL 2 | L730: JEWELL 2 | N730: BECK | P730: M MOORE | R730: RITTERMAN
A731: BRUNSWICK | D731: ORTON 9 | G731: GINGELL | J731: SCHIMMELBUSCH | N731: LLOYD | P731: HUGGINS
A733: PORT MELBOURNE | C733: 3 | D733: 4 | E733: =C733*6+D733 -> 22 | G733: 4 | H733: 8 | I733: =G733*6+H733 -> 32 | K733: 10 | L733: 14 | M733: =K733*6+L733 -> 74 | O733: 12 | P733: 15 | Q733: =O733*6+P733 -> 87 | S733: TOORAK PARK
A734: PRAHRAN | C734: 3 | D734: 3 | E734: =C734*6+D734 -> 21 | G734: 4 | H734: 7 | I734: =G734*6+H734 -> 31 | K734: 6 | L734: 10 | M734: =K734*6+L734 -> 46 | O734: 9 | P734: 14 | Q734: =O734*6+P734 -> 68 | S734: STEERE
A735: BEST PLAYERS
A736: PORT MELBOURNE | D736: KERR | G736: ALLEN | I736: DERMOTT | L736: RASMUSSEN | O736: HAENAN | R736: OWEN
A737: PRAHRAN | D737: AUSTIN | G737: RIPPON | I737: KELLY | L737: LEGH | O737: WILLIAMS | R737: ROSS
A738: GOALKICKERS
A739: PORT MELBOURNE | D739: COOK 3 | F739: KERR 3 | I739: BROWN | K739: HOLT | M739: HAENAN | O739: DERMOTT | Q739: BARROT | S739: COLBERT
A740: PRAHRAN | D740: RIPPON 4 | G740: AHERNE 2 | J740: K SMITH | L740: CLAY | N740: THORNTON
A742: SANDRINGHAM | C742: 4 | D742: 5 | E742: =C742*6+D742 -> 29 | G742: 12 | H742: 12 | I742: =G742*6+H742 -> 84 | K742: 19 | L742: 14 | M742: =K742*6+L742 -> 128 | O742: 24 | P742: 18 | Q742: =O742*6+P742 -> 162 | S742: BEACH ROAD
A743: GEELONG WEST | C743: 4 | D743: 1 | E743: =C743*6+D743 -> 25 | G743: 10 | H743: 6 | I743: =G743*6+H743 -> 66 | K743: 13 | L743: 13 | M743: =K743*6+L743 -> 91 | O743: 19 | P743: 14 | Q743: =O743*6+P743 -> 128 | S743: O'BRIEN
A744: BEST PLAYERS
A745: SANDRINGHAM | D745: WILKINS | G745: R MURRAY | J745: HUNTER | M745: EDWARDS | P745: TAYLOR | R745: KENNEDY
A746: GEELONG WEST | D746: GILMORE | G746: RUSSELL | J746: YATES | M746: ROE | P746: DEEATH | R746: FRIEND
A747: GOALKICKERS
A748: SANDRINGHAM | D748: R MURRAY 9 | G748: EDDY 4 | I748: HUNTER 3 | K748: KENNEDY 2 | N748: WILKINS 2 | Q748: SIMPSON 2 | T748: EDWARDS | W748: HUTCHINSON
A749: GEELONG WEST | D749: ROE 5 | F749: MIDDLEMISS 4 | I749: STOKES 3 | K749: GILMORE 3 | N749: McMILLAN | Q749: DEEATH | S749: HINDSON | V749: HUGHES
A751: PRESTON | C751: 2 | D751: 0 | E751: =C751*6+D751 -> 12 | G751: 9 | H751: 4 | I751: =G751*6+H751 -> 58 | K751: 15 | L751: 11 | M751: =K751*6+L751 -> 101 | O751: 19 | P751: 18 | Q751: =O751*6+P751 -> 132 | S751: PRESTON
A752: OAKLEIGH | C752: 5 | D752: 6 | E752: =C752*6+D752 -> 36 | G752: 7 | H752: 8 | I752: =G752*6+H752 -> 50 | K752: 10 | L752: 9 | M752: =K752*6+L752 -> 69 | O752: 15 | P752: 12 | Q752: =O752*6+P752 -> 102 | S752: WENN
A753: BEST PLAYERS
A754: PRESTON | D754: BROWNE | G754: SCHICKERT | J754: BUTLER | M754: RENWICK | P754: O'SULLIVAN | S754: GRAINGER
A755: OAKLEIGH | D755: BECK | G755: LILLEY | J755: McGRATH | M755: KING
A756: GOALKICKERS
A757: PRESTON | D757: WILSON 7 | G757: BROWNE 4 | J757: DURWOOD 2 | M757: BUTLER 2 | O757: IRELAND 2 | R757: O'SULLIVAN 2
A758: OAKLEIGH | D758: KING 3 | F758: P LILLEY 3 | I758: FOOTE 2 | K758: A McGRATH 2 | N758: BRUERTON | Q758: EDWARDS | T758: WHITE | V758: MOLONEY
A760: ROUND 17 | E760: 15TH AUGUST | J760: WEATHER | N760: FINE SUNNY | S760: PLAYED AT
D761: 1ST QTR | H761: 2ND QTR | L761: 3RD QTR | P761: FINAL | S761: DANDENONG
A762: PRESTON | C762: 4 | D762: 6 | E762: =C762*6+D762 -> 30 | G762: 5 | H762: 8 | I762: =G762*6+H762 -> 38 | K762: 12 | L762: 11 | M762: =K762*6+L762 -> 83 | O762: 18 | P762: 12 | Q762: =O762*6+P762 -> 120 | S762: UMPIRE | X762: LADDER | AB762: ROUND | AD762: 17
A763: DANDENONG | C763: 1 | D763: 6 | E763: =C763*6+D763 -> 12 | G763: 5 | H763: 12 | I763: =G763*6+H763 -> 42 | K763: 11 | L763: 15 | M763: =K763*6+L763 -> 81 | O763: 17 | P763: 17 | Q763: =O763*6+P763 -> 119 | S763: O'BRIEN
A764: BEST PLAYERS | W764: TEAM | X764: W | Y764: L | Z764: D | AA764: FOR | AB764: AGST | AC764: % | AD764: PTS
A765: PRESTON | D765: LESLIE | G765: GRAINGER | J765: RENWICK | M765: STEWART | P765: PREECE | R765: ZEMSKI
A766: DANDENONG | D766: HIBBERT | G766: CRANE | J766: VAN DE BEEK | M766: PAYZE | P766: THOMPSON | W766: PORT MELBOURNE | X766: 14 | Y766: 3 | Z766: 0 | AA766: 2127 | AB766: 1738 | AC766: 122.38204833141542 | AD766: 56
A767: GOALKICKERS | Q767: BUTLER | W767: PRESTON | X767: 12 | Y767: 5 | Z767: 0 | AA767: 2008 | AB767: 1811 | AC767: 110.88 | AD767: 48
A768: PRESTON | D768: STEWART 5 | G768: CARLSON 3 | J768: BROWNE 3 | M768: MARKS 2 | O768: WILSON 2 | Q768: IRELAND | S768: SMITH | W768: DANDENONG | X768: 10 | Y768: 7 | Z768: 0 | AA768: 1835 | AB768: 1646 | AC768: 111.4823815309842 | AD768: 40
A769: DANDENONG | D769: ORCHARD 3 | G769: HIBBERT 2 | I769: BRIESE 2 | K769: FLAHERTY 2 | N769: PAYZE 2 | P769: VAN DE BEEK 2 | S769: THOMPSON 2 | W769: CAULFIELD | X769: 10 | Y769: 7 | Z769: 0 | AA769: 1945 | AB769: 1872 | AC769: 103.9 | AD769: 40
R770: BASSED | T770: REID
A771: PORT MELBOURNE | C771: 10 | D771: 3 | E771: =C771*6+D771 -> 63 | G771: 14 | H771: 4 | I771: =G771*6+H771 -> 88 | K771: 22 | L771: 9 | M771: =K771*6+L771 -> 141 | O771: 23 | P771: 13 | Q771: =O771*6+P771 -> 151 | S771: COBURG | W771: COBURG | X771: 9 | Y771: 8 | Z771: 0 | AA771: 1946 | AB771: 1790 | AC771: 108.71508379888269 | AD771: 36
A772: COBURG | C772: 5 | D772: 3 | E772: =C772*6+D772 -> 33 | G772: 10 | H772: 6 | I772: =G772*6+H772 -> 66 | K772: 13 | L772: 9 | M772: =K772*6+L772 -> 87 | O772: 17 | P772: 16 | Q772: =O772*6+P772 -> 118 | S772: OGSTON | W772: GEELONG WEST | X772: 9 | Y772: 8 | Z772: 0 | AA772: 1832 | AB772: 1947 | AC772: 94.093477144324595 | AD772: 36
A773: BEST PLAYERS | W773: PRAHRAN | X773: 7 | Y773: 10 | Z773: 0 | AA773: 1715 | AB773: 1891 | AC773: 90.69 | AD773: 28
A774: PORT MELBOURNE | D774: OWEN | G774: HAENAN | J774: COOK | M774: MOLLOY | P774: SWAN | W774: BRUNSWICK | X774: 5 | Y774: 11 | Z774: 1 | AA774: 1727 | AB774: 1949 | AC774: 88.61 | AD774: 22
A775: COBURG | D775: WALKER | G775: HEADLAM | J775: PITT | M775: BURT | P775: HOBBS | W775: SANDRINGHAM | X775: 5 | Y775: 12 | Z775: 0 | AA775: 1837 | AB775: 1907 | AC775: 96.329313057157833 | AD775: 20
A776: GOALKICKERS | W776: OAKLEIGH | X776: 3 | Y776: 13 | Z776: 1 | AA776: 1504 | AB776: 1925 | AC776: 78.129870129870127 | AD776: 14
A777: PORT MELBOURNE | D777: COOK 10 | F777: HOLT 3 | H777: BOND 2 | J777: RASMUSSEN 2 | M777: HARLAND | O777: HAENAN | Q777: WHARTON | S777: SWAN | U777: KERR
A778: COBURG | D778: SMITH 4 | F778: BURT 3 | H778: MANNIX 3 | J778: HEADLAM | M778: FORMOSA | O778: CLEARY | Q778: BREEN | R778: LLOYD | T778: HOWELL | W778: SCHOLES
A780: GEELONG WEST | C780: 7 | D780: 3 | E780: =C780*6+D780 -> 45 | G780: 12 | H780: 8 | I780: =G780*6+H780 -> 80 | K780: 14 | L780: 10 | M780: =K780*6+L780 -> 94 | O780: 17 | P780: 17 | Q780: =O780*6+P780 -> 119 | S780: PRINCES PARK
A781: CAULFIELD | C781: 1 | D781: 4 | E781: =C781*6+D781 -> 10 | G781: 5 | H781: 7 | I781: =G781*6+H781 -> 37 | K781: 9 | L781: 16 | M781: =K781*6+L781 -> 70 | O781: 16 | P781: 19 | Q781: =O781*6+P781 -> 115 | S781: FITZPATRICK
A782: BEST PLAYERS
A783: GEELONG WEST | D783: RUSSELL | G783: GILMORE | J783: EDDY | M783: ARKLAY | P783: DEEATH | R783: ROE
A784: CAULFIELD | D784: TEMPEST | G784: EINSEDEL | J784: SAUNDERS | M784: HAYWOOD | P784: DAVIDSON | R784: BOOTH
A785: GOALKICKERS
A786: GEELONG WEST | D786: RADOJEVIC 4 | G786: ROE 4 | I786: WELLS 2 | K786: McMILLAN | M786: EDDY | O786: HINDSON | Q786: HUGHES | S786: GILMORE | V786: TOULMIN | X786: WOOLFE
A787: CAULFIELD | D787: DAVIDSON 4 | G787: BOOTH 4 | I787: HAWKING 2 | L787: EINSEDEL | N787: CLIFF | P787: MOORE | R787: RICHARDS | U787: ROWE | W787: JEWELL
A789: PRAHRAN | C789: 2 | D789: 1 | E789: =C789*6+D789 -> 13 | G789: 6 | H789: 9 | I789: =G789*6+H789 -> 45 | K789: 10 | L789: 13 | M789: =K789*6+L789 -> 73 | O789: 18 | P789: 15 | Q789: =O789*6+P789 -> 123 | S789: BRUNSWICK
A790: BRUNSWICK | C790: 7 | D790: 5 | E790: =C790*6+D790 -> 47 | G790: 7 | H790: 9 | I790: =G790*6+H790 -> 51 | K790: 14 | L790: 15 | M790: =K790*6+L790 -> 99 | O790: 17 | P790: 18 | Q790: =O790*6+P790 -> 120 | S790: WENN
A791: BEST PLAYERS
A792: PRAHRAN | D792: TOWNSEND | G792: KELLY | J792: MOLONEY | M792: RIPPON | P792: CLAY | S792: LEGH
A793: BRUNSWICK | D793: FITZPATRICK | G793: GINGELL | J793: JENKIN | M793: CARLTON | P793: ORTON | S793: LEWIS
A794: GOALKICKERS
A795: PRAHRAN | D795: DICKSON 4 | G795: CLAY 4 | I795: WILLIAMS 2 | L795: CLARKE 2 | N795: JOHNSTON 2 | Q795: RIPPON | S795: AUSTIN | U795: HOBAN | W795: SMITH
A796: BRUNSWICK | D796: ORTON 5 | G796: WARDEN 3 | J796: GINGELL 3 | M796: SCHIMMELBUSCH 2 | Q796: FITZPATRICK 2 | U796: VALENTINE | X796: STONE
A798: SANDRINGHAM | C798: 5 | D798: 10 | E798: =C798*6+D798 -> 40 | G798: 8 | H798: 15 | I798: =G798*6+H798 -> 63 | K798: 15 | L798: 22 | M798: =K798*6+L798 -> 112 | O798: 17 | P798: 25 | Q798: =O798*6+P798 -> 127 | S798: BEACH ROAD
A799: OAKLEIGH | C799: 4 | D799: 2 | E799: =C799*6+D799 -> 26 | G799: 8 | H799: 10 | I799: =G799*6+H799 -> 58 | K799: 10 | L799: 12 | M799: =K799*6+L799 -> 72 | O799: 14 | P799: 16 | Q799: =O799*6+P799 -> 100 | S799: MARCY
A800: BEST PLAYERS
A801: SANDRINGHAM | D801: CARROLL | G801: MACKENZIE | J801: KENNEDY | M801: HUTCHINSON | P801: WILKINS | R801: OWENS
A802: OAKLEIGH | D802: KING | G802: LILLEY | J802: BECK | M802: WATTS | P802: NISBET
A803: GOALKICKERS
A804: SANDRINGHAM | D804: CARROLL 5 | G804: HUNTER 3 | I804: R MURRAY 3 | L804: HUTCHINSON 2 | O804: KENNEDY | Q804: EDWARDS | S804: WILKINS | V804: SIMPSON
A805: OAKLEIGH | D805: McDONALD 3 | G805: KING 3 | I805: COLCOTT 2 | L805: McGRATH 2 | O805: NISBET 2 | Q805: LILLEY | S805: MOLONEY
A807: ROUND 18 | E807: 22ND AUGUST | J807: WEATHER | N807: FINE | S807: PLAYED AT
D808: 1ST QTR | H808: 2ND QTR | L808: 3RD QTR | P808: FINAL | S808: PRINCES PARK
A809: CAULFIELD | C809: 6 | D809: 4 | E809: =C809*6+D809 -> 40 | G809: 9 | H809: 8 | I809: =G809*6+H809 -> 62 | K809: 14 | L809: 16 | M809: =K809*6+L809 -> 100 | O809: 22 | P809: 18 | Q809: =O809*6+P809 -> 150 | S809: UMPIRE | X809: LADDER | AB809: ROUND | AD809: 18
A810: COBURG | C810: 3 | D810: 1 | E810: =C810*6+D810 -> 19 | G810: 6 | H810: 8 | I810: =G810*6+H810 -> 44 | K810: 9 | L810: 12 | M810: =K810*6+L810 -> 66 | O810: 15 | P810: 16 | Q810: =O810*6+P810 -> 106 | S810: STABB
A811: BEST PLAYERS | W811: TEAM | X811: W | Y811: L | Z811: D | AA811: FOR | AB811: AGST | AC811: % | AD811: PTS
A812: CAULFIELD | D812: EINSEDEL | G812: MILNER | J812: DAVIDSON | M812: BOOTH | P812: SUTTIE | R812: BALL
A813: COBURG | D813: HOBBS | G813: BURT | J813: HOWELL | M813: SLATER | W813: PORT MELBOURNE | X813: 15 | Y813: 3 | Z813: 0 | AA813: 2288 | AB813: 1883 | AC813: 121.50823154540626 | AD813: 60
A814: GOALKICKERS | W814: PRESTON | X814: 13 | Y814: 5 | Z814: 0 | AA814: 2164 | AB814: 1919 | AC814: 112.76 | AD814: 52
A815: CAULFIELD | D815: MILNER 8 | F815: DAVIDSON 3 | I815: BOOTH 3 | K815: MOORE 3 | M815: SUTTIE | O815: RICHARDS | Q815: HAWKING | S815: JACKS | U815: ROWE | W815: CAULFIELD | X815: 11 | Y815: 7 | Z815: 0 | AA815: 2095 | AB815: 1978 | AC815: 105.92 | AD815: 44
A816: COBURG | D816: CLEARY 3 | F816: LLOYD 3 | H816: BREEN 2 | J816: FORMOSA 2 | M816: BURT 2 | O816: HEADLAM | Q816: O'CALLAGHAN | T816: SMITH | W816: DANDENONG | X816: 10 | Y816: 8 | Z816: 0 | AA816: 1966 | AB816: 1781 | AC816: 110.38742279618192 | AD816: 40
A818: PRAHRAN | C818: 3 | D818: 6 | E818: =C818*6+D818 -> 24 | G818: 9 | H818: 12 | I818: =G818*6+H818 -> 66 | K818: 15 | L818: 19 | M818: =K818*6+L818 -> 109 | O818: 18 | P818: 24 | Q818: =O818*6+P818 -> 132 | S818: GEELONG WEST | W818: COBURG | X818: 9 | Y818: 9 | Z818: 0 | AA818: 2052 | AB818: 1940 | AC818: 105.77319587628865 | AD818: 36
A819: GEELONG WEST | C819: 4 | D819: 5 | E819: =C819*6+D819 -> 29 | G819: 9 | H819: 9 | I819: =G819*6+H819 -> 63 | K819: 12 | L819: 13 | M819: =K819*6+L819 -> 85 | O819: 18 | P819: 20 | Q819: =O819*6+P819 -> 128 | S819: McGIBBON | W819: GEELONG WEST | X819: 9 | Y819: 9 | Z819: 0 | AA819: 1960 | AB819: 2079 | AC819: 94.27609427609427 | AD819: 36
A820: BEST PLAYERS | W820: PRAHRAN | X820: 8 | Y820: 10 | Z820: 0 | AA820: 1847 | AB820: 2019 | AC820: 91.48 | AD820: 32
A821: PRAHRAN | D821: TOWNSEND | G821: KELLY | J821: SMITH | M821: THORNTON | P821: DICKSON | S821: AUSTIN | W821: BRUNSWICK | X821: 5 | Y821: 12 | Z821: 1 | AA821: 1835 | AB821: 2105 | AC821: 87.17 | AD821: 22
A822: GEELONG WEST | D822: EDDY | G822: RADOJEVIC | J822: HUGHES | M822: WOOLFE | P822: RUSSELL | S822: FRIEND | W822: SANDRINGHAM | X822: 5 | Y822: 13 | Z822: 0 | AA822: 1982 | AB822: 2068 | AC822: 95.841392649903284 | AD822: 20
A823: GOALKICKERS | W823: OAKLEIGH | X823: 4 | Y823: 13 | Z823: 1 | AA823: 1639 | AB823: 2056 | AC823: 79.717898832684824 | AD823: 18
A824: PRAHRAN | D824: K SMITH 7 | G824: DICKSON 6 | I824: JOHNSTON | K824: TOWNSEND | M824: AUSTIN | O824: CLAY | Q824: ANDERSON
A825: GEELONG WEST | D825: RADOJEVIC 6 | G825: EDDY 2 | I825: WELLS 2 | K825: TOMKIN 2 | N825: WOOLFE 2 | Q825: GILMORE 2 | T825: McMILLAN | W825: HUGHES
A827: PRESTON | C827: 6 | D827: 6 | E827: =C827*6+D827 -> 42 | G827: 8 | H827: 9 | I827: =G827*6+H827 -> 57 | K827: 15 | L827: 15 | M827: =K827*6+L827 -> 105 | O827: 23 | P827: 18 | Q827: =O827*6+P827 -> 156 | S827: PRESTON
A828: BRUNSWICK | C828: 4 | D828: 3 | E828: =C828*6+D828 -> 27 | G828: 7 | H828: 6 | I828: =G828*6+H828 -> 48 | K828: 9 | L828: 8 | M828: =K828*6+L828 -> 62 | O828: 16 | P828: 12 | Q828: =O828*6+P828 -> 108 | S828: FITZPATRICK
A829: BEST PLAYERS
A830: PRESTON | D830: GRAINGER | G830: ZEMSKI | J830: DURWOOD | M830: RENWICK | P830: LESLIE | R830: MARKS
A831: BRUNSWICK | D831: GINGELL | G831: CARLTON | J831: FITZPATRICK | M831: LAXTON | P831: WARDEN
A832: GOALKICKERS
A833: PRESTON | D833: BUTLER 3 | F833: STEWART 3 | I833: CARLSON 3 | L833: MARKS 3 | N833: IRELAND 3 | Q833: SMITH 2 | S833: BROWNE 2 | V833: WILSON 2 | X833: McKEON | Z833: SANDERSON
A834: BRUNSWICK | D834: WARDEN 3 | G834: FITZPATRICK 2 | J834: GINGELL 2 | M834: FELTHAM 2 | P834: ORTON 2 | R834: CARLTON | U834: VALENTINE | X834: NUNN | Z834: STONE | AB834: ROWE
A836: OAKLEIGH | C836: 2 | D836: 4 | E836: =C836*6+D836 -> 16 | G836: 7 | H836: 8 | I836: =G836*6+H836 -> 50 | K836: 12 | L836: 11 | M836: =K836*6+L836 -> 83 | O836: 20 | P836: 15 | Q836: =O836*6+P836 -> 135 | S836: OAKLEIGH
A837: DANDENONG | C837: 9 | D837: 4 | E837: =C837*6+D837 -> 58 | G837: 13 | H837: 11 | I837: =G837*6+H837 -> 89 | K837: 18 | L837: 14 | M837: =K837*6+L837 -> 122 | O837: 19 | P837: 17 | Q837: =O837*6+P837 -> 131 | S837: OGSTON
A838: BEST PLAYERS
A839: OAKLEIGH | D839: McDONALD | G839: BECK | J839: HOLDEN | M839: C NISBET | P839: D McGRATH | S839: LILLEY
A840: DANDENONG | D840: STUBBS | G840: DROSCHER | J840: WRIGHT | M840: FLAHERTY | P840: BRIESE
A841: GOALKICKERS
A842: OAKLEIGH | D842: McDONALD 5 | G842: GOODMAN 3 | J842: HOLDEN 3 | M842: KING 3 | O842: ALLISEY | Q842: C NESBIT | S842: WHITE | U842: MOLONEY | X842: ROWLAND | AA842: COLCOTT
A843: DANDENONG | D843: WRIGHT 6 | F843: FLAHERTY 4 | I843: SHINNERS 3 | L843: PAYZE 2 | N843: HARRINGTON | Q843: ORCHARD | T843: BRIESE | V843: TAYLOR
A845: PORT MELBOURNE | C845: 6 | D845: 3 | E845: =C845*6+D845 -> 39 | G845: 10 | H845: 8 | I845: =G845*6+H845 -> 68 | K845: 17 | L845: 13 | M845: =K845*6+L845 -> 115 | O845: 24 | P845: 17 | Q845: =O845*6+P845 -> 161 | S845: PORT MELBOURNE
A846: SANDRINGHAM | C846: 6 | D846: 2 | E846: =C846*6+D846 -> 38 | G846: 8 | H846: 8 | I846: =G846*6+H846 -> 56 | K846: 16 | L846: 10 | M846: =K846*6+L846 -> 106 | O846: 21 | P846: 19 | Q846: =O846*6+P846 -> 145 | S846: O'BRIEN
A847: BEST PLAYERS
A848: PORT MELBOURNE | D848: COOK | G848: OWEN | J848: CHRISTOU | M848: SWAN | P848: HARLAND | S848: HAENAN
A849: SANDRINGHAM | D849: R MURRAY | G849: KENNEDY | J849: MACKENZIE | M849: DYNON | P849: WILKINS | S849: TAYLOR
A850: GOALKICKERS
A851: PORT MELBOURNE | D851: COOK 14 | G851: CHRISTOU 6 | J851: RASMUSSEN 2 | M851: HAENAN | O851: SWAN
A852: SANDRINGHAM | D852: R MURRAY 10 | G852: CARROLL 2 | J852: O'BRIEN 2 | M852: KENNEDY 2 | P852: K MURRAY | R852: CLARK | T852: FETTES | V852: PETERS | X852: EDWARDS
A854: FINALS
A855: 1ST SEMI | E855: 29TH AUGUST | J855: WEATHER | N855: FINE
D856: 1ST QTR | H856: 2ND QTR | L856: 3RD QTR | P856: FINAL
A857: DANDENONG | C857: 5 | D857: 4 | E857: =C857*6+D857 -> 34 | G857: 9 | H857: 8 | I857: =G857*6+H857 -> 62 | K857: 14 | L857: 11 | M857: =K857*6+L857 -> 95 | O857: 20 | P857: 19 | Q857: =O857*6+P857 -> 139 | S857: JUNCTION OVAL
A858: CAULFIELD | C858: 3 | D858: 2 | E858: =C858*6+D858 -> 20 | G858: 7 | H858: 5 | I858: =G858*6+H858 -> 47 | K858: 12 | L858: 6 | M858: =K858*6+L858 -> 78 | O858: 15 | P858: 9 | Q858: =O858*6+P858 -> 99 | S858: OGSTON
A859: BEST PLAYERS
A860: DANDENONG | D860: HIBBERT | G860: THOMPSON | J860: FLAHERTY | M860: WRIGHT | P860: DROSCHER | S860: VAN DE BEEK
A861: CAULFIELD | D861: TEMPEST | G861: EINSEDEL | J861: DAVIDSON | M861: MAGUIRE | P861: HAWKING | S861: BOOTH
A862: GOALKICKERS
A863: DANDENONG | D863: WRIGHT 7 | G863: FLAHERTY 5 | J863: MILLER 3 | M863: PAYZE 2 | O863: ORCHARD | Q863: HIBBERT | S863: BRIESE
A864: CAULFIELD | D864: HAWKING 4 | G864: HUNT 3 | I864: DAVIDSON 3 | L864: MILNER 2 | O864: EINSEDEL | Q864: BOOTH | S864: JACKS
A866: 2ND SEMI | E866: 5TH SEPTEMBER | J866: WEATHER | M866: SOUTH WEST WIND
A867: PORT MELBOURNE | C867: 7 | D867: 5 | E867: =C867*6+D867 -> 47 | G867: 11 | H867: 9 | I867: =G867*6+H867 -> 75 | K867: 17 | L867: 16 | M867: =K867*6+L867 -> 118 | O867: 19 | P867: 18 | Q867: =O867*6+P867 -> 132 | S867: JUNCTION OVAL
A868: PRESTON | C868: 4 | D868: 1 | E868: =C868*6+D868 -> 25 | G868: 5 | H868: 4 | I868: =G868*6+H868 -> 34 | K868: 9 | L868: 5 | M868: =K868*6+L868 -> 59 | O868: 14 | P868: 9 | Q868: =O868*6+P868 -> 93 | S868: STABB
A869: BEST PLAYERS
A870: PORT MELBOURNE | D870: HAENAN | G870: CHRISTOU | J870: SWAN | M870: BROWN | P870: ALLEN | S870: BOND
A871: PRESTON | D871: LESLIE | G871: SCHICKERT | J871: BROWNE | M871: RENWICK | P871: G SMITH | S871: GRAINGER
A872: GOALKICKERS
A873: PORT MELBOURNE | D873: CHRISTOU 5 | G873: COOK 4 | I873: HAENAN 3 | L873: HOLT 2 | N873: BROWN | P873: HARLAND | R873: BOND | T873: BARROT | V873: RASMUSSEN
A874: PRESTON | D874: SMITH 4 | F874: SCHICKERT 4 | I874: BROWNE 2 | L874: WILSON 2 | O874: STEWART | Q874: WEIGHTMAN
A876: PRELIMINARY FINAL | F876: 12TH SEPTEMBER | K876: WEATHER | N876: SOUTH WEST WIND
A877: DANDENONG | C877: 5 | D877: 7 | E877: =C877*6+D877 -> 37 | G877: 7 | H877: 10 | I877: =G877*6+H877 -> 52 | K877: 17 | L877: 16 | M877: =K877*6+L877 -> 118 | O877: 20 | P877: 16 | Q877: =O877*6+P877 -> 136 | S877: JUNCTION OVAL
A878: PRESTON | C878: 0 | D878: 1 | E878: =C878*6+D878 -> 1 | G878: 4 | H878: 1 | I878: =G878*6+H878 -> 25 | K878: 4 | L878: 3 | M878: =K878*6+L878 -> 27 | O878: 11 | P878: 8 | Q878: =O878*6+P878 -> 74 | S878: MARCY
A879: BEST PLAYERS
A880: DANDENONG | D880: HARPER | G880: DROSCHER | J880: THOMPSON | M880: FLAHERTY | P880: REID | R880: VAN DE BEEK
A881: PRESTON | D881: SMITH | G881: GRAINGER | J881: CARLSON | M881: SCHICKERT | P881: BOLGER | R881: LESLIE
A882: GOALKICKERS
A883: DANDENONG | D883: REID 5 | F883: MILLER 3 | I883: WRIGHT 3 | L883: TAYLOR 2 | N883: FLAHERTY 2 | Q883: ORCHARD | S883: BRIESE | U883: HIBBERT | X883: PAYZE | Z883: BASSED
A884: PRESTON | D884: SMITH 4 | G884: STEWART 2 | J884: McKEON | L884: DURWOOD | N884: CRANAGE | P884: ZEMSKI | R884: WILSON
A886: GRAND FINAL | E886: 19TH SEPTEMBER | J886: WEATHER | N886: NORTH WIND
A887: PORT MELBOURNE | C887: 8 | D887: 5 | E887: 53 | G887: 12 | H887: 10 | I887: 82 | K887: 13 | L887: 14 | M887: 92 | O887: 19 | P887: 18 | Q887: =O887*6+P887 -> 132 | S887: JUNCTION OVAL
A888: DANDENONG | C888: 3 | D888: 2 | E888: 20 | G888: 5 | H888: 6 | I888: 36 | K888: 8 | L888: 11 | M888: 59 | O888: 10 | P888: 15 | Q888: =O888*6+P888 -> 75 | S888: MARCY
A889: BEST PLAYERS
A890: PORT MELBOURNE | D890: HARLAND | G890: ALLEN | J890: HAENAN | M890: MOLLOY | O890: COOK | Q890: BOND
A891: DANDENONG | D891: VAN DE BEEK | G891: THOMPSON | J891: TAYLOR | M891: PAYZE | O891: HIBBERT | Q891: FLAHERTY
A892: GOALKICKERS
A893: PORT MELBOURNE | D893: COOK 5 | G893: RASMUSSEN 4 | J893: CHRISTOU 2 | M893: HOLT 2 | O893: BOND 2 | Q893: KERR 2 | S893: BROWN | U893: HAENAN
A894: DANDENONG | D894: FLAHERTY 3 | G894: BRIESE 2 | I894: TAYLOR 2 | L894: HIBBERT | N894: PAYZE | P894: WRIGHT
A896: REPRESENTATIVE MATCH | G896: 25TH APRIL | K896: WEATHER
A897: V.F.A. | C897: 6 | D897: 3 | E897: =C897*6+D897 -> 39 | G897: 11 | H897: 7 | I897: =G897*6+H897 -> 73 | K897: 17 | L897: 10 | M897: =K897*6+L897 -> 112 | O897: 19 | P897: 11 | Q897: =O897*6+P897 -> 125 | S897: BUNTON PARK
A898: OVENS & MURRAY | C898: 4 | D898: 2 | E898: =C898*6+D898 -> 26 | G898: 9 | H898: 6 | I898: =G898*6+H898 -> 60 | K898: 14 | L898: 8 | M898: =K898*6+L898 -> 92 | O898: 17 | P898: 14 | Q898: =O898*6+P898 -> 116 | S898: NORTH ALBURY
A899: BEST PLAYERS
A900: V.F.A. | D900: KING | G900: COOK | J900: MARSHALL | M900: BRIESE | O900: HOBBS | Q900: ROBERTSON
A901: OVENS & MURRAY | D901: D SMITH | G901: BOUNDY | J901: BRITTON | M901: SMEDTS | O901: ANDREWS | Q901: WAY
A902: GOALKICKERS
A903: V.F.A. | D903: COOK 5 | F903: RADOJEVIC 4 | I903: BRIESE 2 | K903: MARSHALL 2 | N903: HOLT 2 | P903: HODGETTS 2 | S903: HOBBS | U903: J SCOTT
A904: OVENS & MURRAY | D904: D SMITH 5 | G904: A SMITH 3 | J904: SMEDTS 3 | M904: RICHARDSON 2 | P904: J SMITH | R904: ALLEN | T904: SAMMON | W904: BOUNDY
A906: LIGHTNING PREMIERSHIP
A907: ROUND 1
A908: SUNSHINE | E908: =C908*6+D908 -> 0 | G908: 6 | H908: 5 | I908: =G908*6+H908 -> 41 | K908: BEST PLAYERS | N908: PAXTON | P908: FOREMAN | R908: MARTIN | V908: GOALKICKERS | X908: BRETT 2 | Z908: BAIRD | AB908: JONES | AC908: MANDICS
A909: YARRAVILLE | E909: =C909*6+D909 -> 0 | G909: 2 | H909: 5 | I909: =G909*6+H909 -> 17 | N909: BEAN | P909: PAGO | R909: GRACO | X909: MARTIN | AA909: PAGE
Z910: MACKAY | AB910: HANCOCK
A911: WAVERLEY | E911: =C911*6+D911 -> 0 | G911: 6 | H911: 6 | I911: =G911*6+H911 -> 42 | K911: BEST PLAYERS | N911: WILLIAMS | Q911: CRAWFORD | T911: SYKES | V911: GOALKICKERS | X911: COSTELLO 2 | AA911: CRAWFORD | AC911: KINNABURGH
A912: BOX HILL | E912: =C912*6+D912 -> 0 | G912: 4 | H912: 7 | I912: =G912*6+H912 -> 31 | N912: BRYANT | Q912: TUCKWELL | T912: WILSON | X912: WILSON | Z912: McGUINNESS | AC912: GORDON
AB913: BRYANT
A914: ROUND 2 | Z914: LYNCH | AB914: BELLIN
A915: WERRIBEE | E915: =C915*6+D915 -> 0 | G915: 5 | H915: 7 | I915: =G915*6+H915 -> 37 | K915: BEST PLAYERS | N915: BOURKE | Q915: BELLIN | S915: NEWMAN | V915: GOALKICKERS | X915: NEWMAN | AA915: MITCHELL | AC915: MOURKE
A916: WAVERLEY | E916: =C916*6+D916 -> 0 | G916: 5 | H916: 6 | I916: =G916*6+H916 -> 36 | N916: SYKES | Q916: McDONALD | T916: A McLURE | X916: A McLURE 2 | AA916: COSTELLO | AC916: HAROLD
X917: // | Y917: JUDD | AB917: G McLURE
A918: CAMBERWELL | E918: =C918*6+D918 -> 0 | G918: 6 | H918: 6 | I918: =G918*6+H918 -> 42 | K918: BEST PLAYERS | N918: HAZLETT | Q918: SMITH | S918: HOWARD | V918: GOALKICKERS | X918: HAMMOND 2 | AA918: SMITH 2 | AC918: HAZLETT | AD918: //
A919: SUNSHINE | E919: =C919*6+D919 -> 0 | G919: 4 | H919: 4 | I919: =G919*6+H919 -> 28 | N919: CLARKE | Q919: JONES | S919: MARTIN | X919: CLARKE | Z919: BAIRS | AB919: RADZIMINSKI
AA920: PIERZAK
A921: ROUND 3
A922: PRAHRAN | E922: =C922*6+D922 -> 0 | G922: 5 | H922: 10 | I922: =G922*6+H922 -> 40
A923: OAKLEIGH | E923: =C923*6+D923 -> 0 | G923: 1 | H923: 4 | I923: =G923*6+H923 -> 10
A925: BRUNSWICK | E925: =C925*6+D925 -> 0 | G925: 5 | H925: 3 | I925: =G925*6+H925 -> 33
A926: SANDRINGHAM | E926: =C926*6+D926 -> 0 | G926: 4 | H926: 3 | I926: =G926*6+H926 -> 27
A928: ROUND 4
A929: CAMBERWELL | E929: =C929*6+D929 -> 0 | G929: 4 | H929: 3 | I929: =G929*6+H929 -> 27
A930: WERRIBEE | E930: =C930*6+D930 -> 0 | G930: 1 | H930: 3 | I930: =G930*6+H930 -> 9
A932: BRUNSWICK | E932: =C932*6+D932 -> 0 | G932: 7 | H932: 4 | I932: =G932*6+H932 -> 46
A933: PRAHRAN | E933: =C933*6+D933 -> 0 | G933: 5 | H933: 1 | I933: =G933*6+H933 -> 31
A935: SEMI-FINALS
A936: COBURG | E936: =C936*6+D936 -> 0 | G936: 6 | H936: 4 | I936: =G936*6+H936 -> 40
A937: CAMBERWELL | E937: =C937*6+D937 -> 0 | G937: 3 | H937: 5 | I937: =G937*6+H937 -> 23
A939: BRUNSWICK | E939: =C939*6+D939 -> 0 | G939: 7 | H939: 7 | I939: =G939*6+H939 -> 49
A940: GEELONG WEST | E940: =C940*6+D940 -> 0 | G940: 4 | H940: 1 | I940: =G940*6+H940 -> 25
A942: GRAND FINAL
A943: COBURG | E943: =C943*6+D943 -> 0 | G943: 5 | H943: 7 | I943: =G943*6+H943 -> 37
A944: BRUNSWICK | E944: =C944*6+D944 -> 0 | G944: 1 | H944: 7 | I944: =G944*6+H944 -> 13