A1: Victorian Football Association
A2: Season 1976 - Division Two
A3: © Copyright Wal Williams | F3: First created: 28 March 2016
A4: Contact: joywalwi at gmail dot com | F4: Last updated: 28 March 2016 | W4: VFA Results and tables - Link to the main index page
A5: You are free to copy this document in whole or part provided that proper acknowledgement is given to the author. All rights reserved.
A7: 1976 | C7: V.F.A. SEASON 2ND DIVISION
A8: ROUND 1 | E8: 4TH APRIL | J8: WEATHER | S8: PLAYED AT
D9: 1ST QTR | H9: 2ND QTR | L9: 3RD QTR | P9: FINAL | S9: SUNSHINE
A10: SUNSHINE | C10: 3 | D10: 1 | E10: =C10*6+D10 -> 19 | G10: 7 | H10: 5 | I10: =G10*6+H10 -> 47 | K10: 11 | L10: 11 | M10: =K10*6+L10 -> 77 | O10: 14 | P10: 17 | Q10: =O10*6+P10 -> 101 | S10: UMPIRE | X10: LADDER | AB10: ROUND | AD10: 1
A11: CAMBERWELL | C11: 4 | D11: 3 | E11: =C11*6+D11 -> 27 | G11: 6 | H11: 9 | I11: =G11*6+H11 -> 45 | K11: 8 | L11: 18 | M11: =K11*6+L11 -> 66 | O11: 11 | P11: 20 | Q11: =O11*6+P11 -> 86 | S11: McGIBBON
A12: BEST PLAYERS | W12: TEAM | X12: W | Y12: L | Z12: D | AA12: FOR | AB12: AGST | AC12: % | AD12: PTS
A13: SUNSHINE | C13: BAIRD | F13: GRAY | I13: SIMPSON | L13: MANDICS | O13: WRIGHT | R13: MITCHELL
A14: CAMBERWELL | C14: SPITHILL | F14: FLANAGAN | I14: SAUERBERG | L14: STOREY | O14: CROWE | R14: FITZGERALD | W14: MORDIALLOC | X14: 1 | Y14: 0 | Z14: 0 | AA14: 194 | AB14: 58 | AC14: =(AA14*100)/AB14 -> 334.48275862068965 | AD14: =(X14*4)+(Z14*2) -> 4
A15: GOALKICKERS | W15: WILLIAMSTOWN | X15: 1 | Y15: 0 | Z15: 0 | AA15: 162 | AB15: 82 | AC15: =(AA15*100)/AB15 -> 197.5609756097561 | AD15: =(X15*4)+(Z15*2) -> 4
A16: SUNSHINE | C16: GRAY 4 | E16: PAXTON 2 | G16: SIMPSON 2 | J16: BAIRD 2 | L16: BUGDEN 2 | N16: CALDWELL 2 | W16: NORTHCOTE | X16: 1 | Y16: 0 | Z16: 0 | AA16: 190 | AB16: 109 | AC16: =(AA16*100)/AB16 -> 174.3119266055046 | AD16: =(X16*4)+(Z16*2) -> 4
A17: CAMBERWELL | C17: HAMMOND 5 | F17: STOREY 2 | I17: BRYCE | K17: LAWSON | M17: FITZGERALD | P17: FLANAGAN | W17: FRANKSTON | X17: 1 | Y17: 0 | Z17: 0 | AA17: 114 | AB17: 95 | AC17: =(AA17*100)/AB17 -> 120 | AD17: =(X17*4)+(Z17*2) -> 4
A19: FRANKSTON | C19: 4 | D19: 5 | E19: =C19*6+D19 -> 29 | G19: 6 | H19: 11 | I19: =G19*6+H19 -> 47 | K19: 10 | L19: 14 | M19: =K19*6+L19 -> 74 | O19: 16 | P19: 18 | Q19: =O19*6+P19 -> 114 | S19: FRANKSTON | W19: SUNSHINE | X19: 1 | Y19: 0 | Z19: 0 | AA19: 101 | AB19: 86 | AC19: =(AA19*100)/AB19 -> 117.44186046511628 | AD19: =(X19*4)+(Z19*2) -> 4
A20: WAVERLEY | C20: 3 | D20: 3 | E20: =C20*6+D20 -> 21 | G20: 6 | H20: 3 | I20: =G20*6+H20 -> 39 | K20: 11 | L20: 9 | M20: =K20*6+L20 -> 75 | O20: 14 | P20: 11 | Q20: =O20*6+P20 -> 95 | S20: HAYES | W20: CAMBERWELL | X20: 0 | Y20: 1 | Z20: 0 | AA20: 86 | AB20: 101 | AC20: =(AA20*100)/AB20 -> 85.148514851485146 | AD20: =(X20*4)+(Z20*2) -> 0
A21: BEST PLAYERS | W21: WAVERLEY | X21: 0 | Y21: 1 | Z21: 0 | AA21: 95 | AB21: 114 | AC21: =(AA21*100)/AB21 -> 83.333333333333329 | AD21: =(X21*4)+(Z21*2) -> 0
A22: FRANKSTON | C22: DAVIES | F22: KENNEDY | I22: HENRICKSEN | L22: DOHERTY | O22: KENDALL | R22: BOND | W22: BOX HILL | X22: 0 | Y22: 1 | Z22: 0 | AA22: 109 | AB22: 190 | AC22: =(AA22*100)/AB22 -> 57.368421052631582 | AD22: =(X22*4)+(Z22*2) -> 0
A23: WAVERLEY | C23: HANCOCK | F23: STYLES | I23: LESTER | L23: LARAGY | O23: McDONALD | R23: McLURE | W23: WERRIBEE | X23: 0 | Y23: 1 | Z23: 0 | AA23: 82 | AB23: 162 | AC23: =(AA23*100)/AB23 -> 50.617283950617285 | AD23: =(X23*4)+(Z23*2) -> 0
A24: GOALKICKERS | W24: YARRAVILLE | X24: 0 | Y24: 1 | Z24: 0 | AA24: 58 | AB24: 194 | AC24: =(AA24*100)/AB24 -> 29.896907216494846 | AD24: =(X24*4)+(Z24*2) -> 0
A25: FRANKSTON | C25: LOVELOCK 7 | F25: WARD 2 | I25: DOHERTY 2 | L25: HOGAN 2 | N25: ELLIS | P25: KENDALL | R25: STAPLETON
A26: WAVERLEY | C26: ZIESLER 5 | F26: COSTELLO 3 | I26: HANCOCK 2 | L26: HASTINGS 2 | O26: LESTER | Q26: McLURE
A28: WILLIAMSTOWN | C28: 5 | D28: 5 | E28: =C28*6+D28 -> 35 | G28: 11 | H28: 17 | I28: =G28*6+H28 -> 83 | K28: 16 | L28: 20 | M28: =K28*6+L28 -> 116 | O28: 23 | P28: 24 | Q28: =O28*6+P28 -> 162 | S28: WILLIAMSTOWN
A29: WERRIBEE | C29: 1 | D29: 7 | E29: =C29*6+D29 -> 13 | G29: 4 | H29: 8 | I29: =G29*6+H29 -> 32 | K29: 6 | L29: 13 | M29: =K29*6+L29 -> 49 | O29: 11 | P29: 16 | Q29: =O29*6+P29 -> 82 | S29: MARCY
A30: BEST PLAYERS
A31: WILLIAMSTOWN | C31: TOWNSEND | F31: KERR | I31: KENNEDY | L31: GARDINER
A32: WERRIBEE | C32: MITCHELL | F32: NEWMAN | I32: DOUGLAS
A33: GOALKICKERS
A34: WILLIAMSTOWN | C34: BOXALL 5 | F34: SCOTT 4 | H34: PAGE 3 | J34: GARDINER 3 | M34: KELLY 2 | O34: HARLEY 2 | R34: CROSS | T34: CHALMERS | W34: TOWNSEND | X34: EVANS
A35: WERRIBEE | C35: NEWMAN 3 | F35: MITCHELL 2 | I35: SCARFFE 2 | L35: JACK 2 | N35: DOUGLAS 2
A37: NORTHCOTE | C37: 4 | D37: 5 | E37: =C37*6+D37 -> 29 | G37: 13 | H37: 9 | I37: =G37*6+H37 -> 87 | K37: 19 | L37: 14 | M37: =K37*6+L37 -> 128 | O37: 28 | P37: 22 | Q37: =O37*6+P37 -> 190 | S37: BOX HILL
A38: BOX HILL | C38: 4 | D38: 4 | E38: =C38*6+D38 -> 28 | G38: 10 | H38: 12 | I38: =G38*6+H38 -> 72 | K38: 12 | L38: 15 | M38: =K38*6+L38 -> 87 | O38: 15 | P38: 19 | Q38: =O38*6+P38 -> 109 | S38: OGSTON
A39: BEST PLAYERS
A40: NORTHCOTE | C40: CHAPMAN | F40: BUTTERWORTH | I40: McINTYRE | L40: JAMES | O40: McARDLE | R40: G RYAN
A41: BOX HILL | C41: GORDON | F41: JONES | I41: BAKER | L41: GOSPER
A42: GOALKICKERS
A43: NORTHCOTE | C43: CHAPMAN 15 | F43: RYAN 3 | H43: McINTYRE 3 | K43: McARDLE 2 | N43: JAMES 2 | P43: BREWER | R43: BUTTERWORTH | U43: ROBERTSON
A44: BOX HILL | C44: GORDON 4 | F44: DAVIS 4 | H44: WILSON 2 | J44: JONES 2 | L44: LASKIE | N44: BRYANT | P44: SYKES
A46: MORDIALLOC | C46: 10 | D46: 1 | E46: =C46*6+D46 -> 61 | G46: 14 | H46: 4 | I46: =G46*6+H46 -> 88 | K46: 21 | L46: 9 | M46: =K46*6+L46 -> 135 | O46: 30 | P46: 14 | Q46: =O46*6+P46 -> 194 | S46: MORDIALLOC
A47: YARRAVILLE | C47: 1 | D47: 4 | E47: =C47*6+D47 -> 10 | G47: 4 | H47: 6 | I47: =G47*6+H47 -> 30 | K47: 6 | L47: 11 | M47: =K47*6+L47 -> 47 | O47: 7 | P47: 16 | Q47: =O47*6+P47 -> 58 | S47: ABBOTT
A48: BEST PLAYERS
A49: MORDIALLOC | C49: GRANT | F49: DEATON | I49: JOHNSTONE | L49: WILLIAMSON | O49: SLADE | R49: NEVILLE
A50: YARRAVILLE | C50: LOWE | F50: B LEE | I50: MARTIN | L50: G LEE | O50: McLAREN
A51: GOALKICKERS
A52: MORDIALLOC | C52: NEVILLE 7 | F52: GRANT 6 | H52: DEATON 5 | K52: JOHNSTONE 5 | N52: BASTIAN 4 | P52: DANCKERT | S52: DINGLE | U52: EDGE
A53: YARRAVILLE | C53: BARR | E53: GRACO | G53: HARRISON | J53: B LEE | L53: MARTIN | N53: SQUIRE | P53: JONES
A55: ROUND 2 | E55: 11TH APRIL | J55: WEATHER | S55: PLAYED AT
D56: 1ST QTR | H56: 2ND QTR | L56: 3RD QTR | P56: FINAL | S56: CAMBERWELL
A57: MORDIALLOC | C57: 5 | D57: 3 | E57: =C57*6+D57 -> 33 | G57: 17 | H57: 7 | I57: =G57*6+H57 -> 109 | K57: 19 | L57: 8 | M57: =K57*6+L57 -> 122 | O57: 26 | P57: 14 | Q57: =O57*6+P57 -> 170 | S57: UMPIRE | X57: LADDER | AB57: ROUND | AD57: 2
A58: CAMBERWELL | C58: 3 | D58: 1 | E58: =C58*6+D58 -> 19 | G58: 8 | H58: 3 | I58: =G58*6+H58 -> 51 | K58: 17 | L58: 3 | M58: =K58*6+L58 -> 105 | O58: 20 | P58: 6 | Q58: =O58*6+P58 -> 126 | S58: WENN
A59: BEST PLAYERS | W59: TEAM | X59: W | Y59: L | Z59: D | AA59: FOR | AB59: AGST | AC59: % | AD59: PTS
A60: MORDIALLOC | C60: DEATON | F60: SLADE | I60: NEVILLE | L60: BASTIAN | O60: WILLIAMSON | R60: GRANT
A61: CAMBERWELL | C61: SMITH | F61: PHILLIPS | I61: SPITHILL | L61: HAMMOND | O61: FITZGERALD | R61: STOREY | W61: MORDIALLOC | X61: 2 | Y61: 0 | Z61: 0 | AA61: 364 | AB61: 184 | AC61: =(AA61*100)/AB61 -> 197.82608695652175 | AD61: =(X61*4)+(Z61*2) -> 8
A62: GOALKICKERS | W62: FRANKSTON | X62: 2 | Y62: 0 | Z62: 0 | AA62: 300 | AB62: 155 | AC62: =(AA62*100)/AB62 -> 193.54838709677421 | AD62: =(X62*4)+(Z62*2) -> 8
A63: MORDIALLOC | C63: NEVILLE 11 | F63: DEATON 5 | I63: WILLIAMS 5 | L63: GRANT 2 | N63: BASTIAN | P63: JOHNSTONE | S63: DANCKERT | W63: WILLIAMSTOWN | X63: 2 | Y63: 0 | Z63: 0 | AA63: 310 | AB63: 170 | AC63: =(AA63*100)/AB63 -> 182.35294117647058 | AD63: =(X63*4)+(Z63*2) -> 8
A64: CAMBERWELL | C64: HAMMOND 8 | F64: LAWSON 4 | I64: STOREY 3 | K64: ANDERSON 2 | N64: BOWDEN | P64: FLANAGAN | S64: HOWARD | W64: NORTHCOTE | X64: 2 | Y64: 0 | Z64: 0 | AA64: 310 | AB64: 184 | AC64: =(AA64*100)/AB64 -> 168.47826086956522 | AD64: =(X64*4)+(Z64*2) -> 8
A66: NORTHCOTE | C66: 0 | D66: 2 | E66: =C66*6+D66 -> 2 | G66: 8 | H66: 10 | I66: =G66*6+H66 -> 58 | K66: 11 | L66: 13 | M66: =K66*6+L66 -> 79 | O66: 17 | P66: 18 | Q66: =O66*6+P66 -> 120 | S66: NORTHCOTE | W66: SUNSHINE | X66: 1 | Y66: 1 | Z66: 0 | AA66: 176 | AB66: 206 | AC66: =(AA66*100)/AB66 -> 85.4368932038835 | AD66: =(X66*4)+(Z66*2) -> 4
A67: SUNSHINE | C67: 4 | D67: 3 | E67: =C67*6+D67 -> 27 | G67: 5 | H67: 3 | I67: =G67*6+H67 -> 33 | K67: 10 | L67: 6 | M67: =K67*6+L67 -> 66 | O67: 11 | P67: 9 | Q67: =O67*6+P67 -> 75 | S67: MARCY | W67: BOX HILL | X67: 1 | Y67: 1 | Z67: 0 | AA67: 235 | AB67: 287 | AC67: =(AA67*100)/AB67 -> 81.881533101045292 | AD67: =(X67*4)+(Z67*2) -> 4
A68: BEST PLAYERS | W68: CAMBERWELL | X68: 0 | Y68: 2 | Z68: 0 | AA68: 212 | AB68: 271 | AC68: =(AA68*100)/AB68 -> 78.228782287822881 | AD68: =(X68*4)+(Z68*2) -> 0
A69: NORTHCOTE | C69: McINTYRE | F69: G RYAN | I69: LOWE | L69: BUTTERWORTH | O69: DOBSON | R69: ROBERTS | W69: WAVERLEY | X69: 0 | Y69: 2 | Z69: 0 | AA69: 183 | AB69: 262 | AC69: =(AA69*100)/AB69 -> 69.847328244274806 | AD69: =(X69*4)+(Z69*2) -> 0
A70: SUNSHINE | C70: FOREMAN | F70: SAMPSON | I70: MITCHELL | L70: PAXTON | O70: WARD | W70: WERRIBEE | X70: 0 | Y70: 2 | Z70: 0 | AA70: 179 | AB70: 288 | AC70: =(AA70*100)/AB70 -> 62.152777777777779 | AD70: =(X70*4)+(Z70*2) -> 0
A71: GOALKICKERS | W71: YARRAVILLE | X71: 0 | Y71: 2 | Z71: 0 | AA71: 118 | AB71: 380 | AC71: =(AA71*100)/AB71 -> 31.05263157894737 | AD71: =(X71*4)+(Z71*2) -> 0
A72: NORTHCOTE | C72: DOBSON 4 | E72: CHAPMAN 3 | H72: G RYAN 3 | J72: M RYAN 2 | M72: NANKERVIS 2 | P72: LOWE 2 | R72: BIENKE
A73: SUNSHINE | C73: FOREMAN 3 | F73: RADZIMINSKI 2 | I73: JONES 2 | K73: BAIRD 2 | M73: BENSON | O73: PAXTON
A75: BOX HILL | C75: 6 | D75: 5 | E75: =C75*6+D75 -> 41 | G75: 11 | H75: 7 | I75: =G75*6+H75 -> 73 | K75: 15 | L75: 10 | M75: =K75*6+L75 -> 100 | O75: 19 | P75: 12 | Q75: =O75*6+P75 -> 126 | S75: WERRIBEE
A76: WERRIBEE | C76: 1 | D76: 3 | E76: =C76*6+D76 -> 9 | G76: 7 | H76: 7 | I76: =G76*6+H76 -> 49 | K76: 7 | L76: 8 | M76: =K76*6+L76 -> 50 | O76: 14 | P76: 13 | Q76: =O76*6+P76 -> 97 | S76: HAYES
A77: BEST PLAYERS
A78: BOX HILL | C78: GORDON | F78: JONES | I78: TUCKWELL | L78: DAVIS | O78: BATES | R78: GOSPER
A79: WERRIBEE | C79: F MITCHELL | F79: J BELLIN | I79: FIDDIAN | L79: WISE | O79: NEWMAN
A80: GOALKICKERS
A81: BOX HILL | C81: GORDON 4 | F81: JONES 3 | H81: McCONNELL 3 | K81: DAVIS 3 | M81: MASTERTON 3 | P81: BRYANT 2 | R81: KEARNEY
A82: WERRIBEE | C82: JACK 4 | E82: F MITCHELL 4 | H82: J BELLIN 2 | J82: G BELLIN | M82: N MITCHELL | P82: NEWMAN | R82: LYNCH
A84: WILLIAMSTOWN | C84: 3 | D84: 4 | E84: =C84*6+D84 -> 22 | G84: 9 | H84: 11 | I84: =G84*6+H84 -> 65 | K84: 13 | L84: 20 | M84: =K84*6+L84 -> 98 | O84: 21 | P84: 22 | Q84: =O84*6+P84 -> 148 | S84: WAVERLEY
A85: WAVERLEY | C85: 3 | D85: 4 | E85: =C85*6+D85 -> 22 | G85: 6 | H85: 9 | I85: =G85*6+H85 -> 45 | K85: 10 | L85: 12 | M85: =K85*6+L85 -> 72 | O85: 12 | P85: 16 | Q85: =O85*6+P85 -> 88 | S85: ABBOTT
A86: BEST PLAYERS
A87: WILLIAMSTOWN | C87: CROSS | F87: KELLY | I87: BOYD | L87: BROWN
A88: WAVERLEY | C88: LESTER | F88: LEES | I88: HANCOCK | L88: STYLES | O88: HASTINGS
A89: GOALKICKERS
A90: WILLIAMSTOWN | C90: BOXALL 4 | F90: CROSS 3 | H90: PAGE 3 | J90: BOYD 3 | L90: BROWN 3 | N90: SCOTT 2 | P90: GARDINER | R90: FANNING | T90: KERR
A91: WAVERLEY | C91: COSTELLO 4 | F91: LESTER 4 | I91: McLURE 2 | L91: ZIESLER 2
A93: FRANNKSTON | C93: 5 | D93: 6 | E93: =C93*6+D93 -> 36 | G93: 12 | H93: 13 | I93: =G93*6+H93 -> 85 | K93: 18 | L93: 23 | M93: =K93*6+L93 -> 131 | O93: 26 | P93: 30 | Q93: =O93*6+P93 -> 186 | S93: YARRAVILLE
A94: YARRAVILLE | C94: 3 | D94: 4 | E94: =C94*6+D94 -> 22 | G94: 5 | H94: 7 | I94: =G94*6+H94 -> 37 | K94: 6 | L94: 9 | M94: =K94*6+L94 -> 45 | O94: 8 | P94: 12 | Q94: =O94*6+P94 -> 60 | S94: McGIBBON
A95: BEST PLAYERS
A96: FRANNKSTON | C96: DOHERTY | F96: HOGAN | I96: BOND | L96: CAYZER | O96: KENNEDY | R96: ADAMS
A97: YARRAVILLE | C97: LOWE | F97: GRACO | I97: DAVIDSON | L97: McLAREN | O97: SHARP
A98: GOALKICKERS
A99: FRANNKSTON | C99: HOGAN 5 | E99: DOHERTY 4 | G99: ROSENBROCK 4 | J99: CLARKE 3 | L99: KENDALL 3 | O99: ADAMS 2 | Q99: DAVIES | S99: WARD | U99: CAYZER | W99: FALKINER | X99: LOVELOCK
A100: YARRAVILLE | C100: HARRISON 3 | F100: PAGE 3 | H100: MARTIN | J100: BARR
A102: ROUND 3 | E102: 18TH APRIL | J102: WEATHER | S102: PLAYED AT
D103: 1ST QTR | H103: 2ND QTR | L103: 3RD QTR | P103: FINAL | S103: WILLIAMSTOWN
A104: WILLIAMSTOWN | C104: 3 | D104: 3 | E104: =C104*6+D104 -> 21 | G104: 12 | H104: 5 | I104: =G104*6+H104 -> 77 | K104: 13 | L104: 15 | M104: =K104*6+L104 -> 93 | O104: 20 | P104: 26 | Q104: =O104*6+P104 -> 146 | S104: UMPIRE | X104: LADDER | AB104: ROUND | AD104: 3
A105: YARRAVILLE | C105: 7 | D105: 2 | E105: =C105*6+D105 -> 44 | G105: 8 | H105: 2 | I105: =G105*6+H105 -> 50 | K105: 10 | L105: 8 | M105: =K105*6+L105 -> 68 | O105: 12 | P105: 9 | Q105: =O105*6+P105 -> 81 | S105: VERGONA
A106: BEST PLAYERS | W106: TEAM | X106: W | Y106: L | Z106: D | AA106: FOR | AB106: AGST | AC106: % | AD106: PTS
A107: WILLIAMSTOWN | C107: BOXALL | F107: TOWNSEND | I107: ? | L107: ?
A108: YARRAVILLE | C108: SQUIRE | F108: ? | I108: McLAREN | L108: GRACO | W108: MORDIALLOC | X108: 3 | Y108: 0 | Z108: 0 | AA108: 528 | AB108: 237 | AC108: =(AA108*100)/AB108 -> 222.78481012658227 | AD108: =(X108*4)+(Z108*2) -> 12
A109: GOALKICKERS | W109: WILLIAMSTOWN | X109: 3 | Y109: 0 | Z109: 0 | AA109: 456 | AB109: 251 | AC109: =(AA109*100)/AB109 -> 181.67330677290838 | AD109: =(X109*4)+(Z109*2) -> 12
A110: WILLIAMSTOWN | C110: BOXALL 9 | E110: BROWN 4 | G110: EVANS 2 | I110: ? 1 | K110: GARDINER | N110: KELLY | P110: TOWNSEND | S110: ? 1 | W110: NORTHCOTE | X110: 3 | Y110: 0 | Z110: 0 | AA110: 444 | AB110: 264 | AC110: =(AA110*100)/AB110 -> 168.18181818181819 | AD110: =(X110*4)+(Z110*2) -> 12
A111: YARRAVILLE | C111: SHARP 4 | E111: PAGE 3 | G111: ? 2 | I111: RYAN 2 | K111: MARTIN | W111: FRANKSTON | X111: 3 | Y111: 0 | Z111: 0 | AA111: 420 | AB111: 261 | AC111: =(AA111*100)/AB111 -> 160.91954022988506 | AD111: =(X111*4)+(Z111*2) -> 12
A113: FRANKSTON | C113: 4 | D113: 2 | E113: =C113*6+D113 -> 26 | G113: 10 | H113: 7 | I113: =G113*6+H113 -> 67 | K113: 17 | L113: 9 | M113: =K113*6+L113 -> 111 | O113: 18 | P113: 12 | Q113: =O113*6+P113 -> 120 | S113: FRANKSTON | W113: BOX HILL | X113: 2 | Y113: 1 | Z113: 0 | AA113: 388 | AB113: 398 | AC113: =(AA113*100)/AB113 -> 97.48743718592965 | AD113: =(X113*4)+(Z113*2) -> 8
A114: CAMBERWELL | C114: 4 | D114: 3 | E114: =C114*6+D114 -> 27 | G114: 8 | H114: 5 | I114: =G114*6+H114 -> 53 | K114: 13 | L114: 8 | M114: =K114*6+L114 -> 86 | O114: 16 | P114: 10 | Q114: =O114*6+P114 -> 106 | S114: STABB | W114: SUNSHINE | X114: 1 | Y114: 2 | Z114: 0 | AA114: 229 | AB114: 370 | AC114: =(AA114*100)/AB114 -> 61.891891891891895 | AD114: =(X114*4)+(Z114*2) -> 4
A115: BEST PLAYERS | W115: CAMBERWELL | X115: 0 | Y115: 3 | Z115: 0 | AA115: 318 | AB115: 391 | AC115: =(AA115*100)/AB115 -> 81.329923273657286 | AD115: =(X115*4)+(Z115*2) -> 0
A116: FRANKSTON | C116: KENNEDY | F116: LOVELOCK | I116: STAPLETON | L116: KENDALL | W116: WAVERLEY | X116: 0 | Y116: 3 | Z116: 0 | AA116: 294 | AB116: 415 | AC116: =(AA116*100)/AB116 -> 70.843373493975903 | AD116: =(X116*4)+(Z116*2) -> 0
A117: CAMBERWELL | C117: BOWDEN | F117: FITZGERALD | I117: HAMMOND | W117: WERRIBEE | X117: 0 | Y117: 3 | Z117: 0 | AA117: 259 | AB117: 422 | AC117: =(AA117*100)/AB117 -> 61.374407582938389 | AD117: =(X117*4)+(Z117*2) -> 0
A118: GOALKICKERS | N118: FALKINER | Q118: STAPLETON | W118: YARRAVILLE | X118: 0 | Y118: 3 | Z118: 0 | AA118: 199 | AB118: 526 | AC118: =(AA118*100)/AB118 -> 37.832699619771866 | AD118: =(X118*4)+(Z118*2) -> 0
A119: FRANKSTON | C119: LOVELOCK 4 | F119: ROSENBROCK 3 | I119: KENDALL 2 | K119: KENNEDY 2 | N119: WARD | P119: CAYZER | R119: HOGAN | T119: A ?
A120: CAMBERWELL | C120: HAMMOND 9 | F120: BOWDEN 3 | I120: CURRAN 2 | L120: HOWARD | N120: ANDERSON
A122: BOX HILL | C122: 8 | D122: 8 | E122: =C122*6+D122 -> 56 | G122: 13 | H122: 10 | I122: =G122*6+H122 -> 88 | K122: 20 | L122: 21 | M122: =K122*6+L122 -> 141 | O122: 21 | P122: 27 | Q122: =O122*6+P122 -> 153 | S122: BOX HILL
A123: WAVERLEY | C123: 4 | D123: 2 | E123: =C123*6+D123 -> 26 | G123: 11 | H123: 7 | I123: =G123*6+H123 -> 73 | K123: 13 | L123: 9 | M123: =K123*6+L123 -> 87 | O123: 16 | P123: 15 | Q123: =O123*6+P123 -> 111 | S123: TORNEY
A124: BEST PLAYERS
A125: BOX HILL | C125: GORDON | F125: MARINKO | I125: BRYANT | L125: MASTERTON | O125: McGUINNESS | R125: LOVE
A126: WAVERLEY | C126: B WILLIAMS | F126: HANCOCK | I126: STYLES | L126: COSTELLO
A127: GOALKICKERS
A128: BOX HILL | C128: GORDON 7 | F128: MASTERTON 4 | I128: JONES 4 | K128: ? 4 | M128: BRYANT 2
A129: WAVERLEY | C129: ? 4 | F129: B WILLIAMS 3 | I129: McLURE 3 | K129: McKAY 2 | M129: HANCOCK 2 | P129: LESTER 2
A131: MORDIALLOC | C131: 3 | D131: 3 | E131: =C131*6+D131 -> 21 | G131: 9 | H131: 12 | I131: =G131*6+H131 -> 66 | K131: 14 | L131: 17 | M131: =K131*6+L131 -> 101 | O131: 23 | P131: 26 | Q131: =O131*6+P131 -> 164 | S131: MORDIALLOC
A132: SUNSHINE | C132: 4 | D132: 3 | E132: =C132*6+D132 -> 27 | G132: 6 | H132: 5 | I132: =G132*6+H132 -> 41 | K132: 8 | L132: 5 | M132: =K132*6+L132 -> 53 | O132: 8 | P132: 5 | Q132: =O132*6+P132 -> 53 | S132: OGSTON
A133: BEST PLAYERS
A134: MORDIALLOC | C134: WILLIAMSON | F134: JOHNSTONE | I134: BASTIAN | L134: ? | O134: McNAUGHT | R134: DEATON
A135: SUNSHINE | C135: FOREMAN | F135: DE ARRAUGO | I135: NUNN | O135: WARD
A136: GOALKICKERS
A137: MORDIALLOC | C137: ? | F137: NEVILLE 4 | I137: JOHNSTONE 4 | L137: ? | N137: BASTIAN 2 | Q137: GRANT 2 | T137: WILLIAMSON
A138: SUNSHINE | C138: ? 3 | F138: JONES 2 | I138: MANDICS 2 | L138: ? 1
A140: NORTHCOTE | C140: 2 | D140: 2 | E140: =C140*6+D140 -> 14 | G140: 8 | H140: 6 | I140: =G140*6+H140 -> 54 | K140: 14 | L140: 10 | M140: =K140*6+L140 -> 94 | O140: 20 | P140: 14 | Q140: =O140*6+P140 -> 134 | S140: WERRIBEE
A141: WERRIBEE | C141: 3 | D141: 2 | E141: =C141*6+D141 -> 20 | G141: 8 | H141: 7 | I141: =G141*6+H141 -> 55 | K141: 9 | L141: 11 | M141: =K141*6+L141 -> 65 | O141: 11 | P141: 14 | Q141: =O141*6+P141 -> 80 | S141: OAKLEY
A142: BEST PLAYERS
A143: NORTHCOTE | C143: JENKINS | F143: M RYAN | I143: ROBERTSON | L143: CHAPMAN | O143: McINTYRE | R143: G RYAN
A144: WERRIBEE | C144: SCARFFE | F144: WISE | I144: KNIGHT | L144: ? | O144: MOLAN
A145: GOALKICKERS
A146: NORTHCOTE | C146: CHAPMAN 7 | F146: JENKINS 5 | I146: MCARDLE 3 | L146: M RYAN 2 | N146: G RYAN 2 | Q146: ROBERTSON
A147: WERRIBEE | C147: LYNCH 6 | F147: MOLAN 2 | I147: P ? 1 | L147: WISE | N147: WHITEHEAD
A149: ROUND 4 | E149: 2ND MAY | J149: WEATHER | S149: PLAYED AT
D150: 1ST QTR | H150: 2ND QTR | L150: 3RD QTR | P150: FINAL | S150: CAMBERWELL
A151: CAMBERWELL | C151: 8 | D151: 4 | E151: =C151*6+D151 -> 52 | G151: 10 | H151: 5 | I151: =G151*6+H151 -> 65 | K151: 15 | L151: 8 | M151: =K151*6+L151 -> 98 | O151: 21 | P151: 13 | Q151: =O151*6+P151 -> 139 | S151: UMPIRE | X151: LADDER | AB151: ROUND | AD151: 4
A152: WILLIAMSTOWN | C152: 3 | D152: 4 | E152: =C152*6+D152 -> 22 | G152: 7 | H152: 16 | I152: =G152*6+H152 -> 58 | K152: 12 | L152: 17 | M152: =K152*6+L152 -> 89 | O152: 15 | P152: 20 | Q152: =O152*6+P152 -> 110 | S152: ABBOTT
A153: BEST PLAYERS | W153: TEAM | X153: W | Y153: L | Z153: D | AA153: FOR | AB153: AGST | AC153: % | AD153: PTS
A154: CAMBERWELL | C154: BOWDEN | F154: PARSONS | I154: STOREY | L154: PHILLIPS | O154: BRYCE | Q154: K CURRAN
A155: WILLIAMSTOWN | C155: LOWE | F155: KERR | I155: ALLEN | L155: GARDINER | O155: PERRY | W155: MORDIALLOC | X155: 4 | Y155: 0 | Z155: 0 | AA155: 665 | AB155: 331 | AC155: =(AA155*100)/AB155 -> 200.90634441087613 | AD155: =(X155*4)+(Z155*2) -> 16
A156: GOALKICKERS | N156: SAUERBERG | W156: FRANKSTON | X156: 4 | Y156: 0 | Z156: 0 | AA156: 567 | AB156: 372 | AC156: =(AA156*100)/AB156 -> 152.41935483870967 | AD156: =(X156*4)+(Z156*2) -> 16
A157: CAMBERWELL | C157: HAMMOND 6 | F157: BRYCE 4 | H157: HOWARD 2 | J157: STOREY 2 | L157: FLANAGAN 2 | O157: FITZGERALD 2 | R157: K CURRAN 2 | W157: WILLIAMSTOWN | X157: 3 | Y157: 1 | Z157: 0 | AA157: 566 | AB157: 390 | AC157: =(AA157*100)/AB157 -> 145.12820512820514 | AD157: =(X157*4)+(Z157*2) -> 12
A158: WILLIAMSTOWN | C158: GARDINER 4 | F158: BOXALL 2 | I158: SCOTT 2 | K158: EVANS 2 | M158: BROWN 2 | O158: HARLEY | Q158: KELLY | S158: CROSS | W158: NORTHCOTE | X158: 3 | Y158: 1 | Z158: 0 | AA158: 538 | AB158: 401 | AC158: =(AA158*100)/AB158 -> 134.16458852867831 | AD158: =(X158*4)+(Z158*2) -> 12
A160: BOX HILL | C160: 7 | D160: 7 | E160: =C160*6+D160 -> 49 | G160: 8 | H160: 10 | I160: =G160*6+H160 -> 58 | K160: 16 | L160: 17 | M160: =K160*6+L160 -> 113 | O160: 19 | P160: 22 | Q160: =O160*6+P160 -> 136 | S160: YARRAVILLE | W160: BOX HILL | X160: 3 | Y160: 1 | Z160: 0 | AA160: 524 | AB160: 520 | AC160: =(AA160*100)/AB160 -> 100.76923076923077 | AD160: =(X160*4)+(Z160*2) -> 12
A161: YARRAVILLE | C161: 2 | D161: 2 | E161: =C161*6+D161 -> 14 | G161: 8 | H161: 9 | I161: =G161*6+H161 -> 57 | K161: 10 | L161: 14 | M161: =K161*6+L161 -> 74 | O161: 17 | P161: 20 | Q161: =O161*6+P161 -> 122 | S161: MARCY | W161: CAMBERWELL | X161: 1 | Y161: 3 | Z161: 0 | AA161: 457 | AB161: 501 | AC161: =(AA161*100)/AB161 -> 91.21756487025948 | AD161: =(X161*4)+(Z161*2) -> 4
A162: BEST PLAYERS | W162: WAVERLEY | X162: 1 | Y162: 3 | Z162: 0 | AA162: 435 | AB162: 510 | AC162: =(AA162*100)/AB162 -> 85.294117647058826 | AD162: =(X162*4)+(Z162*2) -> 4
A163: BOX HILL | C163: BRYANT | F163: JONES | I163: MARINKO | L163: SYKES | O163: GORDON | W163: SUNSHINE | X163: 1 | Y163: 3 | Z163: 0 | AA163: 340 | AB163: 517 | AC163: =(AA163*100)/AB163 -> 65.764023210831724 | AD163: =(X163*4)+(Z163*2) -> 4
A164: YARRAVILLE | C164: MARTIN | F164: BLAKE | I164: SQUIRE | L164: RYAN | O164: CORCORAN | W164: WERRIBEE | X164: 0 | Y164: 4 | Z164: 0 | AA164: 354 | AB164: 563 | AC164: =(AA164*100)/AB164 -> 62.877442273534633 | AD164: =(X164*4)+(Z164*2) -> 0
A165: GOALKICKERS | W165: YARRAVILLE | X165: 0 | Y165: 4 | Z165: 0 | AA165: 321 | AB165: 662 | AC165: =(AA165*100)/AB165 -> 48.489425981873111 | AD165: =(X165*4)+(Z165*2) -> 0
A166: BOX HILL | C166: BRYANT 6 | F166: JONES 5 | I166: GORDON 5 | L166: MASTERTON 3
A167: YARRAVILLE | C167: MARTIN 4 | F167: SQUIRE 3 | H167: CHARD 2 | J167: BARR 2 | L167: RYAN 2 | N167: WILKINSON 2 | Q167: BLAKE | S167: LEE
A169: MORDIALLOC | C169: 3 | D169: 4 | E169: =C169*6+D169 -> 22 | G169: 9 | H169: 6 | I169: =G169*6+H169 -> 60 | K169: 16 | L169: 9 | M169: =K169*6+L169 -> 105 | O169: 21 | P169: 11 | Q169: =O169*6+P169 -> 137 | S169: NORTHCOTE
A170: NORTHCOTE | C170: 3 | D170: 5 | E170: =C170*6+D170 -> 23 | G170: 6 | H170: 6 | I170: =G170*6+H170 -> 42 | K170: 9 | L170: 9 | M170: =K170*6+L170 -> 63 | O170: 14 | P170: 10 | Q170: =O170*6+P170 -> 94 | S170: HAYES
A171: BEST PLAYERS
A172: MORDIALLOC | C172: JOHNSTONE | F172: ROSENOW | I172: LANG | L172: MOORE | O172: ? | R172: GRANT
A173: NORTHCOTE | C173: JENKINS | F173: BUTTERWORTH | I173: BIENKE | L173: MORLEY | O173: McNEILL | R173: ROBERTS
A174: GOALKICKERS
A175: MORDIALLOC | C175: JOHNSTONE 6 | F175: NEVILLE 5 | H175: DEATON 2 | J175: WILLIAMSON 2 | M175: BASTIAN 2 | O175: GRANT | Q175: SLADE | S175: BLOOMFIELD | V175: McNAUGHT
A176: NORTHCOTE | C176: JENKINS 3 | F176: McARDLE 3 | I176: ? 2 | K176: ROBERTSON 2 | N176: BIENKE | P176: ? 1 | R176: NANKERVIS | U176: McNEILL
A178: WAVERLEY | C178: 5 | D178: 3 | E178: =C178*6+D178 -> 33 | G178: 8 | H178: 4 | I178: =G178*6+H178 -> 52 | K178: 15 | L178: 8 | M178: =K178*6+L178 -> 98 | O178: 22 | P178: 9 | Q178: =O178*6+P178 -> 141 | S178: WAVERLEY
A179: WERRIBEE | C179: 2 | D179: 4 | E179: =C179*6+D179 -> 16 | G179: 5 | H179: 12 | I179: =G179*6+H179 -> 42 | K179: 10 | L179: 13 | M179: =K179*6+L179 -> 73 | O179: 13 | P179: 17 | Q179: =O179*6+P179 -> 95 | S179: McGIBBON
A180: BEST PLAYERS
A181: WAVERLEY | C181: LEES | F181: COOK | I181: COSTELLO | L181: HASTINGS | O181: KELAART | R181: MILES
A182: WERRIBEE | C182: NEWMAN | F182: SCARFFE | I182: DOUGLAS | L182: FIDDIN | O182: NORTON
A183: GOALKICKERS
A184: WAVERLEY | C184: COSTELLO 5 | F184: HASTINGS 4 | I184: CARVER 3 | K184: McLURE 2 | N184: McDONALD 2 | Q184: McKAY 2 | S184: HOCKING 2 | V184: LEES | W184: MORRIS
A185: WERRIBEE | C185: F MITCHELL 4 | F185: HOVEY 4 | I185: FIDDIAN 2 | L185: LYNCH 2 | N185: WISE
A187: FRANKSTON | C187: 3 | D187: 3 | E187: =C187*6+D187 -> 21 | G187: 7 | H187: 6 | I187: =G187*6+H187 -> 48 | K187: 14 | L187: 11 | M187: =K187*6+L187 -> 95 | O187: 22 | P187: 15 | Q187: =O187*6+P187 -> 147 | S187: SUNSHINE
A188: SUNSHINE | C188: 7 | D188: 4 | E188: =C188*6+D188 -> 46 | G188: 10 | H188: 8 | I188: =G188*6+H188 -> 68 | K188: 12 | L188: 12 | M188: =K188*6+L188 -> 84 | O188: 16 | P188: 15 | Q188: =O188*6+P188 -> 111 | S188: VERGONA
A189: BEST PLAYERS
A190: FRANKSTON | C190: DAVIES | F190: BOND | I190: FALKINER | L190: DOCKING | O190: WARD | R190: TICKELL
A191: SUNSHINE | C191: JONES | F191: WARD | I191: STEIGLER | L191: RICHARDS | O191: BAIRD | R191: PAXTON
A192: GOALKICKERS
A193: FRANKSTON | C193: LOVELOCK 5 | F193: DOCKING 4 | I193: ADAMS 4 | K193: HOGAN 3 | M193: WARD 3 | O193: KENDALL | Q193: DOHERTY | S193: STAPLETON
A194: SUNSHINE | C194: BAIRD 6 | F194: HUTCHISON 3 | I194: FOREMAN 2 | L194: BENSON 2 | N194: RADZIMINSKI | Q194: JONES | S194: MANDICS
A196: ROUND 5 | E196: 9TH MAY | J196: WEATHER | S196: PLAYED AT
D197: 1ST QTR | H197: 2ND QTR | L197: 3RD QTR | P197: FINAL | S197: BOX HILL
A198: CAMBERWELL | C198: 6 | D198: 4 | E198: =C198*6+D198 -> 40 | G198: 9 | H198: 4 | I198: =G198*6+H198 -> 58 | K198: 15 | L198: 9 | M198: =K198*6+L198 -> 99 | O198: 20 | P198: 10 | Q198: =O198*6+P198 -> 130 | S198: UMPIRE | X198: LADDER | AB198: ROUND | AD198: 5
A199: BOX HILL | C199: 3 | D199: 3 | E199: =C199*6+D199 -> 21 | G199: 5 | H199: 11 | I199: =G199*6+H199 -> 41 | K199: 7 | L199: 15 | M199: =K199*6+L199 -> 57 | O199: 13 | P199: 19 | Q199: =O199*6+P199 -> 97 | S199: OAKLEY
A200: BEST PLAYERS | W200: TEAM | X200: W | Y200: L | Z200: D | AA200: FOR | AB200: AGST | AC200: % | AD200: PTS
A201: CAMBERWELL | C201: KENNEDY | F201: BRYCE | I201: ANDERSON | L201: HAMMOND | O201: STOREY | R201: SPITHILL
A202: BOX HILL | C202: McGUINNESS | F202: BATES | I202: LAWTHER | L202: BAKER | O202: BRYANT | W202: FRANKSTON | X202: 5 | Y202: 0 | Z202: 0 | AA202: 677 | AB202: 474 | AC202: =(AA202*100)/AB202 -> 142.82700421940928 | AD202: =(X202*4)+(Z202*2) -> 20
A203: GOALKICKERS | W203: MORDIALLOC | X203: 4 | Y203: 1 | Z203: 0 | AA203: 767 | AB203: 441 | AC203: =(AA203*100)/AB203 -> 173.92290249433105 | AD203: =(X203*4)+(Z203*2) -> 16
A204: CAMBERWELL | C204: HAMMOND 9 | F204: KENNEDY 3 | I204: NIELSON 3 | K204: STOREY 2 | M204: BRYCE | O204: ANDERSON | R204: JUDD | W204: WILLIAMSTOWN | X204: 4 | Y204: 1 | Z204: 0 | AA204: 728 | AB204: 472 | AC204: =(AA204*100)/AB204 -> 154.23728813559322 | AD204: =(X204*4)+(Z204*2) -> 16
A205: BOX HILL | C205: JONES 3 | E205: SYKES | G205: GORDON | I205: DAVIS | K205: McGUINNESS | N205: BRYANT | P205: KARVELIS | W205: NORTHCOTE | X205: 4 | Y205: 1 | Z205: 0 | AA205: 674 | AB205: 477 | AC205: =(AA205*100)/AB205 -> 141.29979035639414 | AD205: =(X205*4)+(Z205*2) -> 16
A207: WILLIAMSTOWN | C207: 5 | D207: 6 | E207: =C207*6+D207 -> 36 | G207: 9 | H207: 15 | I207: =G207*6+H207 -> 69 | K207: 16 | L207: 19 | M207: =K207*6+L207 -> 115 | O207: 23 | P207: 24 | Q207: =O207*6+P207 -> 162 | S207: WILLIAMSTOWN | W207: BOX HILL | X207: 3 | Y207: 2 | Z207: 0 | AA207: 621 | AB207: 650 | AC207: =(AA207*100)/AB207 -> 95.538461538461533 | AD207: =(X207*4)+(Z207*2) -> 12
A208: SUNSHINE | C208: 3 | D208: 1 | E208: =C208*6+D208 -> 19 | G208: 7 | H208: 6 | I208: =G208*6+H208 -> 48 | K208: 9 | L208: 8 | M208: =K208*6+L208 -> 62 | O208: 12 | P208: 10 | Q208: =O208*6+P208 -> 82 | S208: FITZPATRICK | W208: CAMBERWELL | X208: 2 | Y208: 3 | Z208: 0 | AA208: 587 | AB208: 598 | AC208: =(AA208*100)/AB208 -> 98.160535117056853 | AD208: =(X208*4)+(Z208*2) -> 8
A209: BEST PLAYERS | W209: WAVERLEY | X209: 1 | Y209: 4 | Z209: 0 | AA209: 511 | AB209: 646 | AC209: =(AA209*100)/AB209 -> 79.102167182662541 | AD209: =(X209*4)+(Z209*2) -> 4
A210: WILLIAMSTOWN | C210: FANNING | F210: BROWN | I210: GARDINER | L210: KELLY | O210: KERR | R210: PORCEVINA | W210: WERRIBEE | X210: 1 | Y210: 4 | Z210: 0 | AA210: 534 | AB210: 692 | AC210: =(AA210*100)/AB210 -> 77.167630057803464 | AD210: =(X210*4)+(Z210*2) -> 4
A211: SUNSHINE | C211: BENSON | F211: BAIRD | I211: SCHROEDER | L211: WRIGHT | O211: SIMPSON | W211: SUNSHINE | X211: 1 | Y211: 4 | Z211: 0 | AA211: 422 | AB211: 679 | AC211: =(AA211*100)/AB211 -> 62.150220913107511 | AD211: =(X211*4)+(Z211*2) -> 4
A212: GOALKICKERS | W212: YARRAVILLE | X212: 0 | Y212: 5 | Z212: 0 | AA212: 450 | AB212: 842 | AC212: =(AA212*100)/AB212 -> 53.444180522565318 | AD212: =(X212*4)+(Z212*2) -> 0
A213: WILLIAMSTOWN | C213: BROWN 10 | F213: GARDINER 5 | I213: SCOTT 3 | K213: PAGE 2 | M213: DIXON 2 | O213: FANNING
A214: SUNSHINE | C214: BAIRD 3 | F214: WRIGHT 3 | I214: JONES 2 | K214: VELLA 2 | M214: BUGDEN | O214: HUTCHISON
A216: FRANKSTON | C216: 4 | D216: 3 | E216: =C216*6+D216 -> 27 | G216: 7 | H216: 9 | I216: =G216*6+H216 -> 51 | K216: 12 | L216: 13 | M216: =K216*6+L216 -> 85 | O216: 16 | P216: 14 | Q216: =O216*6+P216 -> 110 | S216: FRANKSTON
A217: MORDIALLOC | C217: 4 | D217: 6 | E217: =C217*6+D217 -> 30 | G217: 8 | H217: 9 | I217: =G217*6+H217 -> 57 | K217: 11 | L217: 13 | M217: =K217*6+L217 -> 79 | O217: 14 | P217: 18 | Q217: =O217*6+P217 -> 102 | S217: WENN
A218: BEST PLAYERS
A219: FRANKSTON | C219: HENRICKSEN | F219: STAPLETON | I219: BOND | L219: DAVIES | O219: WARD | R219: FALKINER
A220: MORDIALLOC | C220: BASTIAN | F220: EDDY | I220: LANG | L220: SLADE | O220: NORRIS | R220: MOORE
A221: GOALKICKERS
A222: FRANKSTON | C222: DOCKING 4 | F222: FALKINER 2 | I222: WARD 2 | K222: C DOHERTY 2 | N222: KENDALL 2 | P222: STAPLETON | S222: A DOHERTY | V222: BOOTH | X222: KENNEDY
A223: MORDIALLOC | C223: NEVILLE 5 | F223: JOHNSTONE 3 | I223: NORRIS 2 | K223: BASTIAN 2 | N223: GRANT | P223: DINGLE
A225: NORTHCOTE | C225: 4 | D225: 3 | E225: =C225*6+D225 -> 27 | G225: 8 | H225: 9 | I225: =G225*6+H225 -> 57 | K225: 15 | L225: 11 | M225: =K225*6+L225 -> 101 | O225: 20 | P225: 16 | Q225: =O225*6+P225 -> 136 | S225: NORTHCOTE
A226: WAVERLEY | C226: 1 | D226: 5 | E226: =C226*6+D226 -> 11 | G226: 5 | H226: 9 | I226: =G226*6+H226 -> 39 | K226: 8 | L226: 13 | M226: =K226*6+L226 -> 61 | O226: 10 | P226: 16 | Q226: =O226*6+P226 -> 76 | S226: STABB
A227: BEST PLAYERS
A228: NORTHCOTE | C228: LOWE | F228: BRAIN | I228: T ROBERTS | L228: M RYAN | O228: AFFLECK | R228: DOBSON
A229: WAVERLEY | C229: KELAART | F229: B WILLIAMS | I229: MILES | L229: MILBURN | O229: HANCOCK | R229: K McDONALD
A230: GOALKICKERS
A231: NORTHCOTE | C231: CHAPMAN 8 | F231: DOBSON 4 | H231: A ROBERTS 2 | K231: ROBERTSON 2 | N231: M RYAN | P231: JENKINS | R231: McNEILL | T231: G RYAN
A232: WAVERLEY | C232: COSTELLO 5 | F232: HASTINGS 2 | I232: ? 2 | K232: HANCOCK
A234: WERRIBEE | C234: 6 | D234: 6 | E234: =C234*6+D234 -> 42 | G234: 8 | H234: 12 | I234: =G234*6+H234 -> 60 | K234: 17 | L234: 19 | M234: =K234*6+L234 -> 121 | O234: 26 | P234: 24 | Q234: =O234*6+P234 -> 180 | S234: WERRIBEE
A235: YARRAVILLE | C235: 5 | D235: 2 | E235: =C235*6+D235 -> 32 | G235: 11 | H235: 4 | I235: =G235*6+H235 -> 70 | K235: 14 | L235: 5 | M235: =K235*6+L235 -> 89 | O235: 20 | P235: 9 | Q235: =O235*6+P235 -> 129 | S235: STEERE
A236: BEST PLAYERS
A237: WERRIBEE | C237: NORTON | F237: WISE | I237: DOUGLAS | L237: SCHIELE | O237: LYNCH | R237: COCKS
A238: YARRAVILLE | C238: MARTIN | F238: B LEE | I238: LOWE | L238: McLAREN | O238: REEVE | R238: SQUIRE
A239: GOALKICKERS
A240: WERRIBEE | C240: SCHIELE 9 | F240: HOVEY 4 | H240: LYNCH 4 | J240: F MITCHELL 3 | M240: NEWMAN 2 | O240: WISE 2 | Q240: NORTON | S240: DOUGLAS
A241: YARRAVILLE | C241: MARTIN 3 | F241: WILKINSON 3 | I241: JONES 3 | K241: SQUIRE 3 | M241: BLAKE 2 | O241: BARR 2 | Q241: McLAREN | S241: LOWE | U241: RYAN | W241: CHARD
A243: ROUND 6 | E243: 16TH MAY | J243: WEATHER | S243: PLAYED AT
D244: 1ST QTR | H244: 2ND QTR | L244: 3RD QTR | P244: FINAL | S244: MORDIALLOC
A245: MORDIALLOC | C245: 2 | D245: 1 | E245: =C245*6+D245 -> 13 | G245: 8 | H245: 7 | I245: =G245*6+H245 -> 55 | K245: 11 | L245: 8 | M245: =K245*6+L245 -> 74 | O245: 15 | P245: 13 | Q245: =O245*6+P245 -> 103 | S245: UMPIRE | X245: LADDER | AB245: ROUND | AD245: 6
A246: WILLIAMSTOWN | C246: 4 | D246: 9 | E246: =C246*6+D246 -> 33 | G246: 5 | H246: 9 | I246: =G246*6+H246 -> 39 | K246: 11 | L246: 13 | M246: =K246*6+L246 -> 79 | O246: 13 | P246: 19 | Q246: =O246*6+P246 -> 97 | S246: VERGONA
A247: BEST PLAYERS | W247: TEAM | X247: W | Y247: L | Z247: D | AA247: FOR | AB247: AGST | AC247: % | AD247: PTS
A248: MORDIALLOC | C248: GUY | F248: NORRIS | I248: BASTIAN | L248: SLADE | O248: DEATON | R248: THOMPSON
A249: WILLIAMSTOWN | C249: KERR | F249: CROSS | I249: GARDINER | L249: PERCY | O249: PORCEVINA | W249: FRANKSTON | X249: 6 | Y249: 0 | Z249: 0 | AA249: 830 | AB249: 552 | AC249: =(AA249*100)/AB249 -> 150.36231884057972 | AD249: =(X249*4)+(Z249*2) -> 24
A250: GOALKICKERS | R250: WILLIAMSON | W250: MORDIALLOC | X250: 5 | Y250: 1 | Z250: 0 | AA250: 870 | AB250: 538 | AC250: =(AA250*100)/AB250 -> 161.71003717472118 | AD250: =(X250*4)+(Z250*2) -> 20
A251: MORDIALLOC | C251: NEVILLE 5 | F251: NORRIS 3 | H251: BLOOMFIELD | K251: JOHNSTONE | N251: DINGLE | P251: GRANT | R251: BASTIAN | T251: DEATON | W251: WILLIAMSTOWN | X251: 4 | Y251: 2 | Z251: 0 | AA251: 825 | AB251: 575 | AC251: =(AA251*100)/AB251 -> 143.47826086956522 | AD251: =(X251*4)+(Z251*2) -> 16
A252: WILLIAMSTOWN | C252: SCOTT 5 | F252: GARDINER 3 | I252: HARLEY 2 | K252: CROSS | M252: ALEXANDER | P252: MAHONEY | W252: NORTHCOTE | X252: 4 | Y252: 2 | Z252: 0 | AA252: 752 | AB252: 630 | AC252: =(AA252*100)/AB252 -> 119.36507936507937 | AD252: =(X252*4)+(Z252*2) -> 16
A254: FRANKSTON | C254: 4 | D254: 8 | E254: =C254*6+D254 -> 32 | G254: 7 | H254: 1 | I254: =G254*6+H254 -> 43 | K254: 19 | L254: 18 | M254: =K254*6+L254 -> 132 | O254: 22 | P254: 21 | Q254: =O254*6+P254 -> 153 | S254: FRANKSTON | W254: CAMBERWELL | X254: 3 | Y254: 3 | Z254: 0 | AA254: 709 | AB254: 693 | AC254: =(AA254*100)/AB254 -> 102.30880230880231 | AD254: =(X254*4)+(Z254*2) -> 12
A255: NORTHCOTE | C255: 0 | D255: 0 | E255: =C255*6+D255 -> 0 | G255: 3 | H255: 2 | I255: =G255*6+H255 -> 20 | K255: 6 | L255: 10 | M255: =K255*6+L255 -> 46 | O255: 10 | P255: 18 | Q255: =O255*6+P255 -> 78 | S255: O'BRIEN | W255: BOX HILL | X255: 3 | Y255: 3 | Z255: 0 | AA255: 709 | AB255: 765 | AC255: =(AA255*100)/AB255 -> 92.679738562091501 | AD255: =(X255*4)+(Z255*2) -> 12
A256: BEST PLAYERS | W256: WAVERLEY | X256: 2 | Y256: 4 | Z256: 0 | AA256: 630 | AB256: 762 | AC256: =(AA256*100)/AB256 -> 82.677165354330711 | AD256: =(X256*4)+(Z256*2) -> 8
A257: FRANKSTON | C257: HENRICKSEN | F257: TICKELL | I257: FALKINER | L257: LOVELOCK | O257: EDWARDS | R257: DOCKING | W257: SUNSHINE | X257: 2 | Y257: 4 | Z257: 0 | AA257: 537 | AB257: 767 | AC257: =(AA257*100)/AB257 -> 70.013037809647983 | AD257: =(X257*4)+(Z257*2) -> 8
A258: NORTHCOTE | C258: BUTTERWORTH | F258: DOBSON | I258: RYAN | L258: BREWER | O258: LOWE | R258: ROBERTS | W258: WERRIBEE | X258: 1 | Y258: 5 | Z258: 0 | AA258: 629 | AB258: 814 | AC258: =(AA258*100)/AB258 -> 77.272727272727266 | AD258: =(X258*4)+(Z258*2) -> 4
A259: GOALKICKERS | K259: A DOHERTY | N259: DAVIES | W259: YARRAVILLE | X259: 0 | Y259: 6 | Z259: 0 | AA259: 566 | AB259: 961 | AC259: =(AA259*100)/AB259 -> 58.896982310093655 | AD259: =(X259*4)+(Z259*2) -> 0
A260: FRANKSTON | C260: LOVELOCK 5 | F260: ROSENBROCK 4 | I260: C DOHERTY 3 | L260: EDWARDS 2 | N260: DOCKING 2 | P260: KENDALL 2 | S260: WARD 2
A261: NORTHCOTE | C261: BREWER 5 | F261: ROBERTS 2 | I261: DOBSON | K261: BRAIN | M261: ROBERTSON
A263: CAMBERWELL | C263: 5 | D263: 1 | E263: =C263*6+D263 -> 31 | G263: 10 | H263: 5 | I263: =G263*6+H263 -> 65 | K263: 15 | L263: 7 | M263: =K263*6+L263 -> 97 | O263: 18 | P263: 14 | Q263: =O263*6+P263 -> 122 | S263: CAMBERWELL
A264: WERRIBEE | C264: 1 | D264: 7 | E264: =C264*6+D264 -> 13 | G264: 6 | H264: 7 | I264: =G264*6+H264 -> 43 | K264: 11 | L264: 11 | M264: =K264*6+L264 -> 77 | O264: 14 | P264: 11 | Q264: =O264*6+P264 -> 95 | S264: FITZPATRICK
A265: BEST PLAYERS
A266: CAMBERWELL | C266: SMITH | F266: IND | I266: K CURRAN | L266: BRYCE | O266: HOWARD | R266: FOX
A267: WERRIBEE | C267: NEWMAN | F267: WISE | I267: HUDSON | L267: KNIGHT | O267: LYNCH
A268: GOALKICKERS
A269: CAMBERWELL | C269: HAMMOND 6 | F269: BRYCE 3 | H269: KENNEDY 2 | K269: NEILSON 2 | N269: K CURRAN 2 | Q269: HOWARD | S269: SMITH | U269: JUDD
A270: WERRIBEE | C270: SCHIELE 4 | E270: F MITCHELL 3 | H270: G FIDDIAN 2 | K270: NORTON | M270: DOUGLAS | O270: WISE | Q270: BOURKE | S270: LYNCH
A272: SUNSHINE | C272: 3 | D272: 4 | E272: =C272*6+D272 -> 22 | G272: 5 | H272: 7 | I272: =G272*6+H272 -> 37 | K272: 7 | L272: 10 | M272: =K272*6+L272 -> 52 | O272: 17 | P272: 13 | Q272: =O272*6+P272 -> 115 | S272: SUNSHINE
A273: BOX HILL | C273: 4 | D273: 3 | E273: =C273*6+D273 -> 27 | G273: 5 | H273: 7 | I273: =G273*6+H273 -> 37 | K273: 11 | L273: 10 | M273: =K273*6+L273 -> 76 | O273: 13 | P273: 10 | Q273: =O273*6+P273 -> 88 | S273: STEERE
A274: BEST PLAYERS
A275: SUNSHINE | C275: CLARKE | F275: BAIRD | I275: NUTTALL | L275: PONTON | O275: DE ARRAUGO | R275: COURTNEY
A276: BOX HILL | C276: BRYANT | F276: McGUINNESS | I276: GOSPER | L276: BAKER | O276: LASKIE
A277: GOALKICKERS
A278: SUNSHINE | C278: BAIRD 8 | E278: DE ARRAUGO 3 | H278: JONES 2 | J278: COURTNEY 2 | M278: WARD | O278: SAMPSON
A279: BOX HILL | C279: LASKIE 3 | E279: JONES 2 | G279: MASTERTON 2 | J279: McCONNELL 2 | M279: McGUINNESS 2 | P279: LAWTHER | R279: McMASTER
A281: WAVERLEY | C281: 6 | D281: 2 | E281: =C281*6+D281 -> 38 | G281: 10 | H281: 4 | I281: =G281*6+H281 -> 64 | K281: 11 | L281: 9 | M281: =K281*6+L281 -> 75 | O281: 18 | P281: 11 | Q281: =O281*6+P281 -> 119 | S281: YARRAVILLE
A282: YARRAVILLE | C282: 3 | D282: 2 | E282: =C282*6+D282 -> 20 | G282: 8 | H282: 6 | I282: =G282*6+H282 -> 54 | K282: 13 | L282: 11 | M282: =K282*6+L282 -> 89 | O282: 17 | P282: 14 | Q282: =O282*6+P282 -> 116 | S282: WENN
A283: BEST PLAYERS
A284: WAVERLEY | C284: MORRIS | F284: STYLES | I284: CRAWFORD | L284: McDONALD | O284: LEES
A285: YARRAVILLE | C285: LEGAWIEC | F285: MARTIN | I285: BAKER | L285: LOWE | O285: LEE | Q285: GRACO
A286: GOALKICKERS
A287: WAVERLEY | C287: COSTELLO 6 | F287: MORRIS 4 | I287: LEES 3 | K287: HASTINGS 2 | N287: O'DONNELL 2 | Q287: ALLEN
A288: YARRAVILLE | C288: BLAKE 4 | F288: MARTIN 4 | I288: W ? 3 | K288: WILKINSON 3 | N288: RYAN 2 | P288: LEGAWIEC
A290: ROUND 7 | E290: 23RD MAY | J290: WEATHER | S290: PLAYED AT
D291: 1ST QTR | H291: 2ND QTR | L291: 3RD QTR | P291: FINAL | S291: WILLIAMSTOWN
A292: WILLIAMSTOWN | C292: 6 | D292: 4 | E292: =C292*6+D292 -> 40 | G292: 6 | H292: 4 | I292: =G292*6+H292 -> 40 | K292: 14 | L292: 9 | M292: =K292*6+L292 -> 93 | O292: 19 | P292: 12 | Q292: =O292*6+P292 -> 126 | S292: UMPIRE | X292: LADDER | AB292: ROUND | AD292: 7
A293: FRANKSTON | C293: 2 | D293: 0 | E293: =C293*6+D293 -> 12 | G293: 5 | H293: 6 | I293: =G293*6+H293 -> 36 | K293: 8 | L293: 6 | M293: =K293*6+L293 -> 54 | O293: 11 | P293: 9 | Q293: =O293*6+P293 -> 75
A294: BEST PLAYERS | W294: TEAM | X294: W | Y294: L | Z294: D | AA294: FOR | AB294: AGST | AC294: % | AD294: PTS
A295: WILLIAMSTOWN | C295: BOYD | F295: ALEXANDER | J295: KERR | M295: CROSS
A296: FRANKSTON | C296: FALKINER | F296: KENDALL | J296: HOGAN | M296: WARD | W296: MORDIALLOC | X296: 6 | Y296: 1 | Z296: 0 | AA296: 1016 | AB296: 573 | AC296: =(AA296*100)/AB296 -> 177.31239092495636 | AD296: =(X296*4)+(Z296*2) -> 24
A297: GOALKICKERS | W297: FRANKSTON | X297: 6 | Y297: 1 | Z297: 0 | AA297: 905 | AB297: 678 | AC297: =(AA297*100)/AB297 -> 133.48082595870207 | AD297: =(X297*4)+(Z297*2) -> 24
A298: WILLIAMSTOWN | C298: ALEXANDER 4 | F298: BROWN 4 | H298: SCOTT 3 | J298: FANNING 2 | L298: GARDINER 2 | O298: CROSS 2 | Q298: HARLEY | S298: PERCY | W298: WILLIAMSTOWN | X298: 5 | Y298: 2 | Z298: 0 | AA298: 951 | AB298: 650 | AC298: =(AA298*100)/AB298 -> 146.30769230769232 | AD298: =(X298*4)+(Z298*2) -> 20
A299: FRANKSTON | C299: DOHERTY 3 | F299: HOGAN 2 | H299: KENDALL 2 | K299: WARD 2 | N299: KENNEDY | P299: DOCKING | W299: NORTHCOTE | X299: 5 | Y299: 2 | Z299: 0 | AA299: 965 | AB299: 699 | AC299: =(AA299*100)/AB299 -> 138.05436337625179 | AD299: =(X299*4)+(Z299*2) -> 20
A301: MORDIALLOC | C301: 7 | D301: 6 | E301: =C301*6+D301 -> 48 | G301: 15 | H301: 11 | I301: =G301*6+H301 -> 101 | K301: 16 | L301: 16 | M301: =K301*6+L301 -> 112 | O301: 21 | P301: 20 | Q301: =O301*6+P301 -> 146 | S301: BOX HILL | W301: CAMBERWELL | X301: 4 | Y301: 3 | Z301: 0 | AA301: 798 | AB301: 742 | AC301: =(AA301*100)/AB301 -> 107.54716981132076 | AD301: =(X301*4)+(Z301*2) -> 16
A302: BOX HILL | C302: 1 | D302: 2 | E302: =C302*6+D302 -> 8 | G302: 2 | H302: 4 | I302: =G302*6+H302 -> 16 | K302: 3 | L302: 7 | M302: =K302*6+L302 -> 25 | O302: 4 | P302: 11 | Q302: =O302*6+P302 -> 35 | S302: OGSTON | W302: BOX HILL | X302: 3 | Y302: 4 | Z302: 0 | AA302: 744 | AB302: 911 | AC302: =(AA302*100)/AB302 -> 81.668496158068052 | AD302: =(X302*4)+(Z302*2) -> 12
A303: BEST PLAYERS | W303: WERRIBEE | X303: 2 | Y303: 5 | Z303: 0 | AA303: 738 | AB303: 909 | AC303: =(AA303*100)/AB303 -> 81.188118811881182 | AD303: =(X303*4)+(Z303*2) -> 8
A304: MORDIALLOC | C304: WALSH | F304: DINGLE | I304: NEVILLE | L304: WILLIAMSON | O304: NORRIS | R304: SLADE | W304: WAVERLEY | X304: 2 | Y304: 5 | Z304: 0 | AA304: 679 | AB304: 851 | AC304: =(AA304*100)/AB304 -> 79.788484136310217 | AD304: =(X304*4)+(Z304*2) -> 8
A305: BOX HILL | C305: SYKES | F305: TUCKWELL | I305: McMASTER | L305: GOSPER | O305: BRYANT | W305: SUNSHINE | X305: 2 | Y305: 5 | Z305: 0 | AA305: 632 | AB305: 876 | AC305: =(AA305*100)/AB305 -> 72.146118721461193 | AD305: =(X305*4)+(Z305*2) -> 8
A306: GOALKICKERS | W306: YARRAVILLE | X306: 0 | Y306: 7 | Z306: 0 | AA306: 635 | AB306: 1174 | AC306: =(AA306*100)/AB306 -> 54.088586030664395 | AD306: =(X306*4)+(Z306*2) -> 0
A307: MORDIALLOC | C307: NEVILLE 10 | F307: WILLIAMSON 5 | I307: GRANT 2 | K307: NORRIS 2 | M307: SLADE | O307: JOHNSTONE
A308: BOX HILL | C308: TUCKWELL 2 | F308: DAVIS 2
A310: CAMBERWELL | C310: 1 | D310: 6 | E310: =C310*6+D310 -> 12 | G310: 3 | H310: 11 | I310: =G310*6+H310 -> 29 | K310: 8 | L310: 13 | M310: =K310*6+L310 -> 61 | O310: 12 | P310: 17 | Q310: =O310*6+P310 -> 89 | S310: WAVERLEY
A311: WAVERLEY | C311: 1 | D311: 1 | E311: =C311*6+D311 -> 7 | G311: 5 | H311: 4 | I311: =G311*6+H311 -> 34 | K311: 7 | L311: 6 | M311: =K311*6+L311 -> 48 | O311: 7 | P311: 7 | Q311: =O311*6+P311 -> 49 | S311: HAYES
A312: BEST PLAYERS
A313: CAMBERWELL | C313: SMITH | F313: HOWARD | I313: WILSON | L313: FOX | O313: KENNEDY | R313: BRYCE
A314: WAVERLEY | C314: MILES | F314: W McDONALD | I314: STYLES | L314: HANCOCK | O314: MORRIS | R314: G McLURE
A315: GOALKICKERS
A316: CAMBERWELL | C316: HAMMOND 4 | F316: JUDD 2 | H316: STOREY 2 | J316: BRYCE | L316: ANDERSON | O316: NEILSON | Q316: K CURREN
A317: WAVERLEY | C317: McKAY 2 | F317: STYLES | H317: COSTELLO | J317: HANCOCK | M317: G McLURE | P317: HASTINGS
A319: NORTHCOTE | C319: 2 | D319: 3 | E319: =C319*6+D319 -> 15 | G319: 11 | H319: 9 | I319: =G319*6+H319 -> 75 | K319: 16 | L319: 16 | M319: =K319*6+L319 -> 112 | O319: 32 | P319: 21 | Q319: =O319*6+P319 -> 213 | S319: NORTHCOTE
A320: YARRAVILLE | C320: 2 | D320: 6 | E320: =C320*6+D320 -> 18 | G320: 5 | H320: 8 | I320: =G320*6+H320 -> 38 | K320: 8 | L320: 13 | M320: =K320*6+L320 -> 61 | O320: 9 | P320: 15 | Q320: =O320*6+P320 -> 69 | S320: McGIBBON
A321: BEST PLAYERS
A322: NORTHCOTE | C322: McARDLE | F322: McORIST | I322: LOWE | L322: BREWER | O322: G RYAN | R322: BIENKE
A323: YARRAVILLE | C323: BLAKE | F323: B LEE | I323: MCLAREN | L323: DOLL | O323: GREENEY
A324: GOALKICKERS
A325: NORTHCOTE | C325: BREWER 6 | F325: G RYAN 6 | H325: McORIST 5 | J325: CHAPMAN 4 | M325: DOHERTY 4 | O325: DOBSON 3 | R325: LOWE 2 | T325: ROBERTSON | W325: BIENKE
A326: YARRAVILLE | C326: BLAKE 4 | F326: WILKINSON 3 | I326: B LEE | K326: WALLIS
A328: WERRIBEE | C328: 0 | D328: 3 | E328: =C328*6+D328 -> 3 | G328: 9 | H328: 6 | I328: =G328*6+H328 -> 60 | K328: 12 | L328: 11 | M328: =K328*6+L328 -> 83 | O328: 16 | P328: 13 | Q328: =O328*6+P328 -> 109 | S328: WERRIBEE
A329: SUNSHINE | C329: 2 | D329: 5 | E329: =C329*6+D329 -> 17 | G329: 7 | H329: 5 | I329: =G329*6+H329 -> 47 | K329: 12 | L329: 6 | M329: =K329*6+L329 -> 78 | O329: 14 | P329: 11 | Q329: =O329*6+P329 -> 95 | S329: O'BRIEN
A330: BEST PLAYERS
A331: WERRIBEE | C331: SCARFFE | F331: WISE | I331: J BELLIN | L331: NEWMAN | O331: DOUGLAS | R331: SCHIELE
A332: SUNSHINE | C332: NUTTALL | F332: JONES | I332: BAIRD | L332: PONTON | O332: FOREMAN | R332: FOLEY
A333: GOALKICKERS
A334: WERRIBEE | C334: SCHIELE 5 | F334: SCARFFE 4 | I334: PAICE 2 | K334: G BELLIN | M334: J BELLIN | O334: WISE | Q334: MITCHELL | S334: NEWMAN
A335: SUNSHINE | C335: FOREMAN 4 | F335: BAIRD 4 | H335: VELLA 2 | J335: BENSON 2 | M335: MARTIN | O335: COURTNEY
A337: ROUND 8 | E337: 30TH MAY | J337: WEATHER | S337: PLAYED AT
D338: 1ST QTR | H338: 2ND QTR | L338: 3RD QTR | P338: FINAL | S338: WILLIAMSTOWN
A339: NORTHCOTE | C339: 2 | D339: 7 | E339: =C339*6+D339 -> 19 | G339: 4 | H339: 13 | I339: =G339*6+H339 -> 37 | K339: 9 | L339: 19 | M339: =K339*6+L339 -> 73 | O339: 13 | P339: 21 | Q339: =O339*6+P339 -> 99 | S339: UMPIRE | X339: LADDER | AB339: ROUND | AD339: 8
A340: WILLIAMSTOWN | C340: 3 | D340: 3 | E340: =C340*6+D340 -> 21 | G340: 8 | H340: 7 | I340: =G340*6+H340 -> 55 | K340: 10 | L340: 11 | M340: =K340*6+L340 -> 71 | O340: 13 | P340: 13 | Q340: =O340*6+P340 -> 91 | S340: STABB
A341: BEST PLAYERS | W341: TEAM | X341: W | Y341: L | Z341: D | AA341: FOR | AB341: AGST | AC341: % | AD341: PTS
A342: NORTHCOTE | C342: G RYAN | F342: McARDLE | I342: T ROBERTS | M342: McORIST
A343: WILLIAMSTOWN | C343: BOYD | F343: KENNEDY | I343: PERCY | M343: HARLEY | W343: MORDIALLOC | X343: 7 | Y343: 1 | Z343: 0 | AA343: 1179 | AB343: 681 | AC343: =(AA343*100)/AB343 -> 173.12775330396477 | AD343: =(X343*4)+(Z343*2) -> 28
A344: GOALKICKERS | W344: FRANKSTON | X344: 7 | Y344: 1 | Z344: 0 | AA344: 1063 | AB344: 765 | AC344: =(AA344*100)/AB344 -> 138.95424836601308 | AD344: =(X344*4)+(Z344*2) -> 28
A345: NORTHCOTE | C345: CHAPMAN 3 | F345: BREWER 2 | H345: McORIST 2 | K345: G RYAN 2 | M345: BIENKE | O345: BUTTERWORTH | R345: DOBSON | T345: McNEILL | W345: NORTHCOTE | X345: 6 | Y345: 2 | Z345: 0 | AA345: 1064 | AB345: 790 | AC345: =(AA345*100)/AB345 -> 134.68354430379748 | AD345: =(X345*4)+(Z345*2) -> 24
A346: WILLIAMSTOWN | C346: BROWN 5 | F346: GARDINER 3 | I346: PERCY | K346: SCOTT | M346: BRINER | O346: BOXALL | Q346: HARLEY | W346: WILLIAMSTOWN | X346: 5 | Y346: 3 | Z346: 0 | AA346: 1042 | AB346: 749 | AC346: =(AA346*100)/AB346 -> 139.11882510013351 | AD346: =(X346*4)+(Z346*2) -> 20
A348: CAMBERWELL | C348: 10 | D348: 4 | E348: =C348*6+D348 -> 64 | G348: 19 | H348: 15 | I348: =G348*6+H348 -> 129 | K348: 23 | L348: 21 | M348: =K348*6+L348 -> 159 | O348: 33 | P348: 27 | Q348: =O348*6+P348 -> 225 | S348: CAMBERWELL | W348: CAMBERWELL | X348: 5 | Y348: 3 | Z348: 0 | AA348: 1023 | AB348: 834 | AC348: =(AA348*100)/AB348 -> 122.66187050359713 | AD348: =(X348*4)+(Z348*2) -> 20
A349: YARRAVILLE | C349: 3 | D349: 8 | E349: =C349*6+D349 -> 26 | G349: 4 | H349: 9 | I349: =G349*6+H349 -> 33 | K349: 9 | L349: 18 | M349: =K349*6+L349 -> 72 | O349: 12 | P349: 20 | Q349: =O349*6+P349 -> 92 | S349: OGSTON | W349: BOX HILL | X349: 3 | Y349: 5 | Z349: 0 | AA349: 831 | AB349: 1069 | AC349: =(AA349*100)/AB349 -> 77.736202057998128 | AD349: =(X349*4)+(Z349*2) -> 12
A350: BEST PLAYERS | W350: SUNSHINE | X350: 3 | Y350: 5 | Z350: 0 | AA350: 762 | AB350: 982 | AC350: =(AA350*100)/AB350 -> 77.596741344195522 | AD350: =(X350*4)+(Z350*2) -> 12
A351: CAMBERWELL | C351: HOWARD | F351: FITZGERALD | I351: JUDD | L351: KENNEDY | O351: HAMMOND | R351: FOX | W351: WAVERLEY | X351: 2 | Y351: 6 | Z351: 0 | AA351: 785 | AB351: 981 | AC351: =(AA351*100)/AB351 -> 80.020387359836903 | AD351: =(X351*4)+(Z351*2) -> 8
A352: YARRAVILLE | C352: GRACO | F352: LOWE | I352: SQUIRE | L352: WALLIS | O352: MARTIN | R352: RYAN | W352: WERRIBEE | X352: 2 | Y352: 6 | Z352: 0 | AA352: 846 | AB352: 1072 | AC352: =(AA352*100)/AB352 -> 78.917910447761187 | AD352: =(X352*4)+(Z352*2) -> 8
A353: GOALKICKERS | N353: FOX | P353: WILSON | R353: NEILSON | W353: YARRAVILLE | X353: 0 | Y353: 8 | Z353: 0 | AA353: 727 | AB353: 1399 | AC353: =(AA353*100)/AB353 -> 51.96568977841315 | AD353: =(X353*4)+(Z353*2) -> 0
A354: CAMBERWELL | C354: HAMMOND 14 | F354: KENNEDY 4 | H354: BOWDEN 3 | J354: K CURREN 3 | M354: BRYCE 2 | O354: STOREY 2 | Q354: HOWARD | S354: FITZGERALD
A355: YARRAVILLE | C355: WILKINSON 4 | F355: EVANS 4 | I355: LEE | K355: MARTIN | M355: RYAN | O355: SQUIRE
A357: FRANKSTON | C357: 4 | D357: 5 | E357: =C357*6+D357 -> 29 | G357: 7 | H357: 14 | I357: =G357*6+H357 -> 56 | K357: 18 | L357: 21 | M357: =K357*6+L357 -> 129 | O357: 22 | P357: 26 | Q357: =O357*6+P357 -> 158 | S357: WAVERLEY
A358: BOX HILL | C358: 5 | D358: 7 | E358: =C358*6+D358 -> 37 | G358: 7 | H358: 12 | I358: =G358*6+H358 -> 54 | K358: 9 | L358: 13 | M358: =K358*6+L358 -> 67 | O358: 12 | P358: 15 | Q358: =O358*6+P358 -> 87 | S358: WENN
A359: BEST PLAYERS
A360: FRANKSTON | C360: EDWARDS | F360: DOCKING | I360: BOYD | L360: CLARKE | O360: ELLIS | Q360: BOND
A361: BOX HILL | C361: LAWTHER | F361: MARINKO | I361: TUCKWELL | L361: GOSPER
A362: GOALKICKERS
A363: FRANKSTON | C363: DOCKING 5 | F363: C DOHERTY 5 | I363: ROSENBROCK 5 | L363: BOYD 3 | N363: WARD 3 | P363: S CLARKE
A364: BOX HILL | C364: BATES 4 | E364: JONES 3 | G364: TUCKWELL | I364: GORDON | K364: McMASTER | N364: MIGHELL | P364: LASKIE
A366: MORDIALLOC | C366: 3 | D366: 2 | E366: =C366*6+D366 -> 20 | G366: 14 | H366: 6 | I366: =G366*6+H366 -> 90 | K366: 18 | L366: 8 | M366: =K366*6+L366 -> 116 | O366: 25 | P366: 13 | Q366: =O366*6+P366 -> 163 | S366: MORDIALLOC
A367: WERRIBEE | C367: 3 | D367: 6 | E367: =C367*6+D367 -> 24 | G367: 7 | H367: 6 | I367: =G367*6+H367 -> 48 | K367: 14 | L367: 11 | M367: =K367*6+L367 -> 95 | O367: 16 | P367: 12 | Q367: =O367*6+P367 -> 108 | S367: MARCY
A368: BEST PLAYERS
A369: MORDIALLOC | C369: SLADE | F369: BASTIAN | I369: BLOOMFIELD | L369: JOHNSTONE | O369: DINGLE | R369: NEVILLE
A370: WERRIBEE | C370: NEWMAN | F370: DOUGLAS | I370: F MITCHELL | L370: WHITEHEAD | O370: SCHIELE | R370: OUGH
A371: GOALKICKERS
A372: MORDIALLOC | C372: NEVILLE 9 | F372: JOHNSTONE 9 | I372: BLOOMFIELD 2 | L372: NORRIS | N372: DINGLE | P372: GRANT | R372: WILLIAMSON | U372: DEATON
A373: WERRIBEE | C373: F MITCHELL 5 | F373: SCHIELE 5 | I373: J BELLIN | K373: BOURKE | M373: WISE | O373: SCARFFE | Q373: PAICE | S373: DOUGLAS
A375: SUNSHINE | C375: 4 | D375: 2 | E375: =C375*6+D375 -> 26 | G375: 12 | H375: 3 | I375: =G375*6+H375 -> 75 | K375: 18 | L375: 5 | M375: =K375*6+L375 -> 113 | O375: 20 | P375: 10 | Q375: =O375*6+P375 -> 130 | S375: SUNSHINE
A376: WAVERLEY | C376: 5 | D376: 3 | E376: =C376*6+D376 -> 33 | G376: 9 | H376: 4 | I376: =G376*6+H376 -> 58 | K376: 12 | L376: 6 | M376: =K376*6+L376 -> 78 | O376: 16 | P376: 10 | Q376: =O376*6+P376 -> 106 | S376: FITZPATRICK
A377: BEST PLAYERS
A378: SUNSHINE | C378: RADZIMINSKI | F378: VELLA | I378: PONTON | L378: JONES | O378: FOLEY | R378: MANDICS
A379: WAVERLEY | C379: McDONALD | F379: McKAY | I379: McLURE | L379: KELAART | O379: WILLIAMS
A380: GOALKICKERS
A381: SUNSHINE | C381: MANDICS 6 | F381: RADZIMINSKI 5 | I381: MARTIN 3 | K381: VELLA 3 | M381: BAIRD 2 | O381: PONTON
A382: WAVERLEY | C382: McKAY 7 | F382: COSTELLO 3 | I382: HANCOCK 2 | L382: MORRIS | N382: STYLES | P382: McLURE | R382: HOLDSWORTH
A384: ROUND 9 | E384: 6TH JUNE | J384: WEATHER | S384: PLAYED AT
D385: 1ST QTR | H385: 2ND QTR | L385: 3RD QTR | P385: FINAL | S385: NORTHCOTE
A386: CAMBERWELL | C386: 3 | D386: 2 | E386: =C386*6+D386 -> 20 | G386: 7 | H386: 11 | I386: =G386*6+H386 -> 53 | K386: 15 | L386: 13 | M386: =K386*6+L386 -> 103 | O386: 21 | P386: 17 | Q386: =O386*6+P386 -> 143 | S386: UMPIRE | X386: LADDER | AB386: ROUND | AD386: 9
A387: NORTHCOTE | C387: 4 | D387: 5 | E387: =C387*6+D387 -> 29 | G387: 8 | H387: 7 | I387: =G387*6+H387 -> 55 | K387: 12 | L387: 14 | M387: =K387*6+L387 -> 86 | O387: 16 | P387: 16 | Q387: =O387*6+P387 -> 112 | S387: O'BRIEN
A388: BEST PLAYERS | W388: TEAM | X388: W | Y388: L | Z388: D | AA388: FOR | AB388: AGST | AC388: % | AD388: PTS
A389: CAMBERWELL | C389: STOREY | F389: NEILSON | I389: HAMMOND | L389: FOX | O389: KENNEDY | R389: FITZGERALD
A390: NORTHCOTE | C390: BRAIN | F390: McINTYRE | I390: M RYAN | L390: McARDLE | O390: McORIST | R390: MORLEY | W390: MORDIALLOC | X390: 8 | Y390: 1 | Z390: 0 | AA390: 1319 | AB390: 743 | AC390: =(AA390*100)/AB390 -> 177.52355316285329 | AD390: =(X390*4)+(Z390*2) -> 32
A391: GOALKICKERS | W391: FRANKSTON | X391: 8 | Y391: 1 | Z391: 0 | AA391: 1163 | AB391: 857 | AC391: =(AA391*100)/AB391 -> 135.70595099183197 | AD391: =(X391*4)+(Z391*2) -> 32
A392: CAMBERWELL | C392: HAMMOND 9 | F392: LAWSON 5 | H392: HOWARD | J392: BRYCE | K392: STOREY | M392: KENNEDY | O392: K CURREN | R392: JUDD | T392: BOWDEN | W392: WILLIAMSTOWN | X392: 6 | Y392: 3 | Z392: 0 | AA392: 1160 | AB392: 838 | AC392: =(AA392*100)/AB392 -> 138.42482100238664 | AD392: =(X392*4)+(Z392*2) -> 24
A393: NORTHCOTE | C393: CHAPMAN 5 | F393: DOBSON 3 | H393: MORLEY 3 | J393: G RYAN 2 | L393: M RYAN | N393: BUTTERWORTH | Q393: BREWER | W393: NORTHCOTE | X393: 6 | Y393: 3 | Z393: 0 | AA393: 1176 | AB393: 933 | AC393: =(AA393*100)/AB393 -> 126.04501607717042 | AD393: =(X393*4)+(Z393*2) -> 24
A395: WILLIAMSTOWN | C395: 7 | D395: 4 | E395: =C395*6+D395 -> 46 | G395: 10 | H395: 10 | I395: =G395*6+H395 -> 70 | K395: 15 | L395: 13 | M395: =K395*6+L395 -> 103 | O395: 17 | P395: 16 | Q395: =O395*6+P395 -> 118 | S395: BOX HILL | W395: CAMBERWELL | X395: 6 | Y395: 3 | Z395: 0 | AA395: 1166 | AB395: 946 | AC395: =(AA395*100)/AB395 -> 123.25581395348837 | AD395: =(X395*4)+(Z395*2) -> 24
A396: BOX HILL | C396: 1 | D396: 1 | E396: =C396*6+D396 -> 7 | G396: 8 | H396: 3 | I396: =G396*6+H396 -> 51 | K396: 8 | L396: 4 | M396: =K396*6+L396 -> 52 | O396: 13 | P396: 11 | Q396: =O396*6+P396 -> 89 | S396: HAYES | W396: SUNSHINE | X396: 3 | Y396: 6 | Z396: 0 | AA396: 875 | AB396: 1108 | AC396: =(AA396*100)/AB396 -> 78.971119133574007 | AD396: =(X396*4)+(Z396*2) -> 12
A397: BEST PLAYERS | W397: BOX HILL | X397: 3 | Y397: 6 | Z397: 0 | AA397: 920 | AB397: 1187 | AC397: =(AA397*100)/AB397 -> 77.506318449873632 | AD397: =(X397*4)+(Z397*2) -> 12
A398: WILLIAMSTOWN | C398: BOYD | F398: FANNING | I398: KENNEDY | L398: MOORE | O398: KERR | R398: PAGE | W398: WERRIBEE | X398: 2 | Y398: 7 | Z398: 0 | AA398: 938 | AB398: 1172 | AC398: =(AA398*100)/AB398 -> 80.034129692832764 | AD398: =(X398*4)+(Z398*2) -> 8
A399: BOX HILL | C399: TUCKWELL | F399: BATES | I399: DWYER | L399: WILSON | O399: BRYANT | W399: WAVERLEY | X399: 2 | Y399: 7 | Z399: 0 | AA399: 847 | AB399: 1121 | AC399: =(AA399*100)/AB399 -> 75.557537912578056 | AD399: =(X399*4)+(Z399*2) -> 8
A400: GOALKICKERS | W400: YARRAVILLE | X400: 1 | Y400: 8 | Z400: 0 | AA400: 853 | AB400: 1512 | AC400: =(AA400*100)/AB400 -> 56.415343915343918 | AD400: =(X400*4)+(Z400*2) -> 4
A401: WILLIAMSTOWN | C401: GARDINER 4 | F401: SCOTT 3 | H401: FANNING 2 | J401: ALEXANDER 2 | M401: BROWN 2 | O401: PAGE | P401: PERCY | R401: KENNEDY | T401: HARLEY
A402: BOX HILL | C402: BATES 4 | E402: DWYER 3 | G402: JONES | I402: LAWTHER | K402: GORDON | M402: LASKIE | O402: TUCKWELL | R402: McGUINNESS
A404: MORDIALLOC | C404: 4 | D404: 11 | E404: =C404*6+D404 -> 35 | G404: 10 | H404: 15 | I404: =G404*6+H404 -> 75 | K404: 18 | L404: 18 | M404: =K404*6+L404 -> 126 | O404: 20 | P404: 20 | Q404: =O404*6+P404 -> 140 | S404: WAVERLEY
A405: WAVERLEY | C405: 2 | D405: 1 | E405: =C405*6+D405 -> 13 | G405: 4 | H405: 9 | I405: =G405*6+H405 -> 33 | K405: 4 | L405: 11 | M405: =K405*6+L405 -> 35 | O405: 8 | P405: 14 | Q405: =O405*6+P405 -> 62
A406: BEST PLAYERS
A407: MORDIALLOC | C407: DEATON | F407: GUY | I407: LANG | L407: BASTIAN | O407: EDDY | R407: THOMPSON
A408: WAVERLEY | C408: W McDONALD | F408: HASTINGS | I408: LEES | L408: MILES | O408: HAROLD
A409: GOALKICKERS
A410: MORDIALLOC | C410: NEVILLE 7 | F410: DEATON 4 | I410: JOHNSTONE 3 | L410: NORRIS 2 | N410: DINGLE 2 | P410: WALSH | R410: BASTIAN
A411: WAVERLEY | C411: G McLURE 3 | F411: McKAY 2 | I411: K MCDONALD | L411: HASTINGS | N411: LEES
A413: FRANKSTON | C413: 2 | D413: 3 | E413: =C413*6+D413 -> 15 | G413: 6 | H413: 5 | I413: =G413*6+H413 -> 41 | K413: 11 | L413: 7 | M413: =K413*6+L413 -> 73 | O413: 15 | P413: 10 | Q413: =O413*6+P413 -> 100 | S413: WERRIBEE
A414: WERRIBEE | C414: 6 | D414: 1 | E414: =C414*6+D414 -> 37 | G414: 11 | H414: 4 | I414: =G414*6+H414 -> 70 | K414: 12 | L414: 7 | M414: =K414*6+L414 -> 79 | O414: 14 | P414: 8 | Q414: =O414*6+P414 -> 92 | S414: McGIBBON
A415: BEST PLAYERS
A416: FRANKSTON | C416: BOYD | F416: BOND | I416: DOCKING | L416: SMALE
A417: WERRIBEE | C417: DOUGLAS | F417: WISE | I417: OUGH | L417: NEWMAN | O417: J BELLIN | Q417: SCHIELE
A418: GOALKICKERS
A419: FRANKSTON | C419: CLARKE 3 | E419: WARD 2 | G419: DAVIES 2 | I419: LOVELOCK 2 | L419: ELLIS 2 | N419: DOCKING | P419: ROSENBROCK | S419: KENNEDY | V419: SMALE
A420: WERRIBEE | C420: SCHIELE 6 | F420: LYNCH 3 | H420: BOURKE 2 | J420: SCARFFE 2 | M420: J BELLIN
A422: YARRAVILLE | C422: 4 | D422: 6 | E422: =C422*6+D422 -> 30 | G422: 12 | H422: 13 | I422: =G422*6+H422 -> 85 | K422: 13 | L422: 15 | M422: =K422*6+L422 -> 93 | O422: 17 | P422: 24 | Q422: =O422*6+P422 -> 126 | S422: YARRAVILLE
A423: SUNSHINE | C423: 5 | D423: 10 | E423: =C423*6+D423 -> 40 | G423: 5 | H423: 10 | I423: =G423*6+H423 -> 40 | K423: 16 | L423: 14 | M423: =K423*6+L423 -> 110 | O423: 16 | P423: 17 | Q423: =O423*6+P423 -> 113 | S423: CARLILE
A424: BEST PLAYERS
A425: YARRAVILLE | C425: GREENEY | F425: LOWE | I425: GRACO | L425: JONES | O425: REEVE | R425: WILKINSON
A426: SUNSHINE | C426: JONES | F426: FOREMAN | I426: RADZIMINSKI | L426: MARTIN | O426: CLARKE | R426: DE ARRAUGO
A427: GOALKICKERS
A428: YARRAVILLE | C428: WILKINSON 3 | F428: EVANS 3 | H428: B LEE 2 | J428: MARTIN 2 | L428: RYAN 2 | N428: JONES 2 | P428: GRACO | R428: SQUIRE | T428: BLAKE
A429: SUNSHINE | C429: MARTIN 5 | F429: FOREMAN 4 | I429: RADZIMINSKI 4 | L429: MANDICS | N429: BENSON | P429: BAIRD
A431: ROUND 10 | E431: 13TH JUNE | J431: WEATHER | S431: PLAYED AT
D432: 1ST QTR | H432: 2ND QTR | L432: 3RD QTR | P432: FINAL | S432: CAMBERWELL
A433: CAMBERWELL | C433: 4 | D433: 3 | E433: =C433*6+D433 -> 27 | G433: 8 | H433: 5 | I433: =G433*6+H433 -> 53 | K433: 16 | L433: 12 | M433: =K433*6+L433 -> 108 | O433: 23 | P433: 15 | Q433: =O433*6+P433 -> 153 | S433: UMPIRE | X433: LADDER | AB433: ROUND | AD433: 10
A434: SUNSHINE | C434: 6 | D434: 3 | E434: =C434*6+D434 -> 39 | G434: 10 | H434: 7 | I434: =G434*6+H434 -> 67 | K434: 14 | L434: 7 | M434: =K434*6+L434 -> 91 | O434: 23 | P434: 8 | Q434: =O434*6+P434 -> 146 | S434: WENN
A435: BEST PLAYERS | W435: TEAM | X435: W | Y435: L | Z435: D | AA435: FOR | AB435: AGST | AC435: % | AD435: PTS
A436: CAMBERWELL | C436: KENNEDY | F436: HAMMOND | I436: SPITHILL | L436: JUDD | O436: NEILSON | R436: SMITH
A437: SUNSHINE | C437: MARTIN | F437: JONES | I437: FOLEY | L437: SAMPSON | O437: BENSON | R437: FOREMAN | W437: MORDIALLOC | X437: 9 | Y437: 1 | Z437: 0 | AA437: 1516 | AB437: 867 | AC437: =(AA437*100)/AB437 -> 174.8558246828143 | AD437: =(X437*4)+(Z437*2) -> 36
A438: GOALKICKERS | W438: FRANKSTON | X438: 9 | Y438: 1 | Z438: 0 | AA438: 1303 | AB438: 962 | AC438: =(AA438*100)/AB438 -> 135.44698544698545 | AD438: =(X438*4)+(Z438*2) -> 36
A439: CAMBERWELL | C439: HAMMOND 11 | F439: SMITH 5 | H439: LAWSON 2 | J439: BOLGER 2 | L439: KENNEDY | N439: K CURREN | Q439: JUDD | W439: NORTHCOTE | X439: 7 | Y439: 3 | Z439: 0 | AA439: 1314 | AB439: 1023 | AC439: =(AA439*100)/AB439 -> 128.4457478005865 | AD439: =(X439*4)+(Z439*2) -> 28
A440: SUNSHINE | C440: BENSON 5 | E440: FOREMAN 4 | G440: MANDICS 4 | J440: MARTIN 3 | L440: JONES 2 | N440: DE ARRAUGO 2 | Q440: BAIRD | S440: RADZIMINSKI | W440: CAMBERWELL | X440: 7 | Y440: 3 | Z440: 0 | AA440: 1319 | AB440: 1092 | AC440: =(AA440*100)/AB440 -> 120.78754578754578 | AD440: =(X440*4)+(Z440*2) -> 28
O441: PONTON
A442: NORTHCOTE | C442: 4 | D442: 4 | E442: =C442*6+D442 -> 28 | G442: 8 | H442: 7 | I442: =G442*6+H442 -> 55 | K442: 13 | L442: 12 | M442: =K442*6+L442 -> 90 | O442: 20 | P442: 18 | Q442: =O442*6+P442 -> 138 | S442: NORTHCOTE | W442: WILLIAMSTOWN | X442: 6 | Y442: 4 | Z442: 0 | AA442: 1234 | AB442: 936 | AC442: =(AA442*100)/AB442 -> 131.83760683760684 | AD442: =(X442*4)+(Z442*2) -> 24
A443: BOX HILL | C443: 6 | D443: 2 | E443: =C443*6+D443 -> 38 | G443: 10 | H443: 5 | I443: =G443*6+H443 -> 65 | K443: 10 | L443: 11 | M443: =K443*6+L443 -> 71 | O443: 12 | P443: 18 | Q443: =O443*6+P443 -> 90 | S443: MURLEY | W443: WERRIBEE | X443: 3 | Y443: 7 | Z443: 0 | AA443: 1036 | AB443: 1246 | AC443: =(AA443*100)/AB443 -> 83.146067415730343 | AD443: =(X443*4)+(Z443*2) -> 12
A444: BEST PLAYERS | W444: SUNSHINE | X444: 3 | Y444: 7 | Z444: 0 | AA444: 1021 | AB444: 1261 | AC444: =(AA444*100)/AB444 -> 80.967486122125294 | AD444: =(X444*4)+(Z444*2) -> 12
A445: NORTHCOTE | C445: MCARDLE | F445: McINTYRE | I445: ROBERTSON | L445: DOBSON | O445: LEE | R445: McNEILL | W445: BOX HILL | X445: 3 | Y445: 7 | Z445: 0 | AA445: 1010 | AB445: 1325 | AC445: =(AA445*100)/AB445 -> 76.226415094339629 | AD445: =(X445*4)+(Z445*2) -> 12
A446: BOX HILL | C446: WILSON | F446: BATES | I446: TUCKWELL | L446: BAKER | O446: MARINKO | R446: WATERS | W446: WAVERLEY | X446: 2 | Y446: 8 | Z446: 0 | AA446: 952 | AB446: 1261 | AC446: =(AA446*100)/AB446 -> 75.495638382236322 | AD446: =(X446*4)+(Z446*2) -> 8
A447: GOALKICKERS | M447: ROBERTSON | P447: M RYAN | W447: YARRAVILLE | X447: 1 | Y447: 9 | Z447: 0 | AA447: 977 | AB447: 1709 | AC447: =(AA447*100)/AB447 -> 57.167934464599178 | AD447: =(X447*4)+(Z447*2) -> 4
A448: NORTHCOTE | C448: CHAPMAN 5 | F448: DOBSON 4 | H448: A ROBERTS 3 | K448: McORIST 2 | N448: BREWER 2 | Q448: MORLEY | S448: McNEILL
A449: BOX HILL | C449: BATES 3 | E449: MURPHY 2 | G449: JONES 2 | I449: LASKIE | K449: TUCKWELL | M449: GOSPER | O449: BRYANT | Q449: GORDON
A451: FRANKSTON | C451: 5 | D451: 5 | E451: =C451*6+D451 -> 35 | G451: 10 | H451: 9 | I451: =G451*6+H451 -> 69 | K451: 15 | L451: 15 | M451: =K451*6+L451 -> 105 | O451: 20 | P451: 20 | Q451: =O451*6+P451 -> 140 | S451: WAVERLEY
A452: WAVERLEY | C452: 1 | D452: 3 | E452: =C452*6+D452 -> 9 | G452: 10 | H452: 5 | I452: =G452*6+H452 -> 65 | K452: 13 | L452: 9 | M452: =K452*6+L452 -> 87 | O452: 15 | P452: 15 | Q452: =O452*6+P452 -> 105 | S452: CARLILE
A453: BEST PLAYERS
A454: FRANKSTON | C454: STAPLETON | F454: DAVIES | I454: WARD | L454: SMALE | N454: ROWE | Q454: TICKELL
A455: WAVERLEY | C455: HAROLD | F455: HANKINSON | I455: G McLURE | L455: MILES | N455: HANCOCK
A456: GOALKICKERS
A457: FRANKSTON | C457: DOCKING 4 | F457: STAPLETON 3 | I457: LOVELOCK 2 | K457: SMALE 2 | M457: WARD 2 | O457: KENNEDY 2 | R457: DAVIES 2 | T457: CLARKE | V457: FALKINER | X457: KENDALL
A458: WAVERLEY | C458: McKAY 4 | F458: COSTELLO 3 | I458: McLURE 2 | K458: STYLES 2 | M458: HAROLD 2 | O458: HASTINGS | R458: CRAWFORD
A460: WERRIBEE | C460: 6 | D460: 2 | E460: =C460*6+D460 -> 38 | G460: 9 | H460: 6 | I460: =G460*6+H460 -> 60 | K460: 11 | L460: 11 | M460: =K460*6+L460 -> 77 | O460: 14 | P460: 14 | Q460: =O460*6+P460 -> 98 | S460: WERRIBEE
A461: WILLIAMSTOWN | C461: 1 | D461: 2 | E461: =C461*6+D461 -> 8 | G461: 2 | H461: 7 | I461: =G461*6+H461 -> 19 | K461: 4 | L461: 10 | M461: =K461*6+L461 -> 34 | O461: 10 | P461: 14 | Q461: =O461*6+P461 -> 74 | S461: FITZPATRICK
A462: BEST PLAYERS
A463: WERRIBEE | C463: P WHITEHEAD | F463: WISE | I463: J BELLIN | L463: DOUGLAS | P463: MITCHELL | S463: NEWMAN
A464: WILLIAMSTOWN | C464: BOYD | F464: MOORE | I464: KERR | L464: KENNEDY | P464: PORCEVINA
A465: GOALKICKERS
A466: WERRIBEE | C466: SCHIELE 5 | F466: WISE 3 | H466: EVANS 3 | J466: BOURKE 2 | M466: J BELLIN
A467: WILLIAMSTOWN | C467: BOXALL 3 | F467: PERCY | H467: SCOTT | J467: DIXON | L467: CHALMERS | O467: FANNING | Q467: KENNEDY | S467: HARLEY
A469: MORDIALLOC | C469: 9 | D469: 7 | E469: =C469*6+D469 -> 61 | G469: 17 | H469: 13 | I469: =G469*6+H469 -> 115 | K469: 23 | L469: 18 | M469: =K469*6+L469 -> 156 | O469: 28 | P469: 29 | Q469: =O469*6+P469 -> 197 | S469: YARRAVILLE
A470: YARRAVILLE | C470: 4 | D470: 3 | E470: =C470*6+D470 -> 27 | G470: 10 | H470: 3 | I470: =G470*6+H470 -> 63 | K470: 13 | L470: 9 | M470: =K470*6+L470 -> 87 | O470: 19 | P470: 10 | Q470: =O470*6+P470 -> 124 | S470: STABB
A471: BEST PLAYERS
A472: MORDIALLOC | C472: GUY | F472: NEVILLE | I472: JOHNSTONE | L472: DEATON | O472: EDDY | R472: NORRIS
A473: YARRAVILLE | C473: SQUIRE | F473: G LEE | I473: MARTIN | L473: LEGAWIEC | O473: WILSON | R473: BLAKE
A474: GOALKICKERS
A475: MORDIALLOC | C475: NEVILLE 13 | F475: GUY 3 | H475: JOHNSTONE 3 | K475: NORRIS 3 | M475: DEATON 2 | O475: BASTIAN | Q475: DINGLE | S475: WOOTTEN | V475: MICHAELIDES
A476: YARRAVILLE | C476: EVANS 6 | F476: SQUIRE 4 | H476: RYAN 2 | J476: GRACO 2 | L476: BLAKE | N476: WILKINSON | Q476: B LEE | S476: MARTIN | V476: JONES
A478: ROUND 11 | E478: 20TH JUNE | J478: WEATHER | S478: PLAYED AT
D479: 1ST QTR | H479: 2ND QTR | L479: 3RD QTR | P479: FINAL | S479: MORDIALLOC
A480: MORDIALLOC | C480: 7 | D480: 2 | E480: =C480*6+D480 -> 44 | G480: 11 | H480: 12 | I480: =G480*6+H480 -> 78 | K480: 18 | L480: 18 | M480: =K480*6+L480 -> 126 | O480: 23 | P480: 28 | Q480: =O480*6+P480 -> 166 | S480: UMPIRE | X480: LADDER | AB480: ROUND | AD480: 11
A481: CAMBERWELL | C481: 5 | D481: 2 | E481: =C481*6+D481 -> 32 | G481: 9 | H481: 4 | I481: =G481*6+H481 -> 58 | K481: 13 | L481: 4 | M481: =K481*6+L481 -> 82 | O481: 14 | P481: 7 | Q481: =O481*6+P481 -> 91 | S481: MARCY
A482: BEST PLAYERS | W482: TEAM | X482: W | Y482: L | Z482: D | AA482: FOR | AB482: AGST | AC482: % | AD482: PTS
A483: MORDIALLOC | C483: GUY | F483: NORRIS | I483: McCARTHY | L483: DEATON | O483: NEVILLE | R483: WALSH
A484: CAMBERWELL | C484: KENNEDY | F484: SMITH | I484: LAWSON | L484: L CURRAN | O484: SPITHILL | R484: HAMMOND | W484: MORDIALLOC | X484: 10 | Y484: 1 | Z484: 0 | AA484: 1682 | AB484: 958 | AC484: =(AA484*100)/AB484 -> 175.57411273486431 | AD484: =(X484*4)+(Z484*2) -> 40
A485: GOALKICKERS | W485: FRANKSTON | X485: 10 | Y485: 1 | Z485: 0 | AA485: 1531 | AB485: 1017 | AC485: =(AA485*100)/AB485 -> 150.54080629301868 | AD485: =(X485*4)+(Z485*2) -> 40
A486: MORDIALLOC | C486: NEVILLE 10 | F486: DINGLE 3 | H486: BLOOMFIELD 3 | K486: NORRIS 2 | M486: JOHNSTONE 2 | P486: DEATON | R486: BASTIAN | T486: McCARTHY | W486: NORTHCOTE | X486: 8 | Y486: 3 | Z486: 0 | AA486: 1412 | AB486: 1119 | AC486: =(AA486*100)/AB486 -> 126.18409294012511 | AD486: =(X486*4)+(Z486*2) -> 32
A487: CAMBERWELL | C487: HAMMOND 7 | F487: LAWSON 2 | I487: NEILSON | K487: JUDD | M487: BOLGER | O487: L CURREN | R487: BOWDEN | W487: WILLIAMSTOWN | X487: 7 | Y487: 4 | Z487: 0 | AA487: 1393 | AB487: 1071 | AC487: =(AA487*100)/AB487 -> 130.06535947712419 | AD487: =(X487*4)+(Z487*2) -> 28
A489: NORTHCOTE | C489: 3 | D489: 4 | E489: =C489*6+D489 -> 22 | G489: 7 | H489: 9 | I489: =G489*6+H489 -> 51 | K489: 8 | L489: 13 | M489: =K489*6+L489 -> 61 | O489: 13 | P489: 20 | Q489: =O489*6+P489 -> 98 | S489: SUNSHINE | W489: CAMBERWELL | X489: 7 | Y489: 4 | Z489: 0 | AA489: 1410 | AB489: 1258 | AC489: =(AA489*100)/AB489 -> 112.08267090620032 | AD489: =(X489*4)+(Z489*2) -> 28
A490: SUNSHINE | C490: 7 | D490: 3 | E490: =C490*6+D490 -> 45 | G490: 10 | H490: 6 | I490: =G490*6+H490 -> 66 | K490: 13 | L490: 9 | M490: =K490*6+L490 -> 87 | O490: 14 | P490: 12 | Q490: =O490*6+P490 -> 96 | S490: STABB | W490: BOX HILL | X490: 4 | Y490: 7 | Z490: 0 | AA490: 1114 | AB490: 1421 | AC490: =(AA490*100)/AB490 -> 78.395496129486276 | AD490: =(X490*4)+(Z490*2) -> 16
A491: BEST PLAYERS | W491: WERRIBEE | X491: 3 | Y491: 8 | Z491: 0 | AA491: 1132 | AB491: 1350 | AC491: =(AA491*100)/AB491 -> 83.851851851851848 | AD491: =(X491*4)+(Z491*2) -> 12
A492: NORTHCOTE | C492: LEE | F492: BRAIN | I492: BREWER | L492: BUTTERWORTH | O492: T ROBERTS | R492: RYAN | W492: SUNSHINE | X492: 3 | Y492: 8 | Z492: 0 | AA492: 1117 | AB492: 1359 | AC492: =(AA492*100)/AB492 -> 82.192788815305377 | AD492: =(X492*4)+(Z492*2) -> 12
A493: SUNSHINE | C493: MARTIN | F493: PIERCZAK | I493: SIMPSON | L493: BENSON | O493: FOREMAN | R493: DE ARRAUGO | W493: WAVERLEY | X493: 2 | Y493: 9 | Z493: 0 | AA493: 1085 | AB493: 1420 | AC493: =(AA493*100)/AB493 -> 76.408450704225359 | AD493: =(X493*4)+(Z493*2) -> 8
A494: GOALKICKERS | W494: YARRAVILLE | X494: 1 | Y494: 10 | Z494: 0 | AA494: 1032 | AB494: 1937 | AC494: =(AA494*100)/AB494 -> 53.278265358802273 | AD494: =(X494*4)+(Z494*2) -> 4
A495: NORTHCOTE | C495: CHAPMAN 5 | F495: BREWER 4 | I495: LEE 2 | K495: A ROBERTS | N495: M RYAN
A496: SUNSHINE | C496: McDONALD 4 | F496: FOREMAN 3 | I496: BAIRD 2 | K496: DE ARRAUGO 2 | N496: JONES 2 | P496: MANDICS
A498: WILLIAMSTOWN | C498: 4 | D498: 4 | E498: =C498*6+D498 -> 28 | G498: 8 | H498: 9 | I498: =G498*6+H498 -> 57 | K498: 18 | L498: 15 | M498: =K498*6+L498 -> 123 | O498: 23 | P498: 21 | Q498: =O498*6+P498 -> 159 | S498: WILLIAMSTOWN
A499: WAVERLEY | C499: 6 | D499: 0 | E499: =C499*6+D499 -> 36 | G499: 12 | H499: 4 | I499: =G499*6+H499 -> 76 | K499: 14 | L499: 6 | M499: =K499*6+L499 -> 90 | O499: 21 | P499: 9 | Q499: =O499*6+P499 -> 135 | S499: STEERE
A500: BEST PLAYERS
A501: WILLIAMSTOWN | C501: PERCY | F501: BOYD | I501: PAGE | L501: KENNEDY | O501: HARLEY | R501: MAHONEY
A502: WAVERLEY | C502: G McLURE | F502: CRAWFORD | I502: McKAY | L502: STYLES | O502: HAROLD
A503: GOALKICKERS
A504: WILLIAMSTOWN | C504: BROWN 7 | F504: CROSS 4 | H504: PERCY 4 | J504: HARLEY 4 | L504: MAHONEY 2 | O504: GARDINER 2
A505: WAVERLEY | C505: G McLURE 9 | F505: McKAY 5 | H505: COSTELLO 2 | K505: HANCOCK 2 | N505: HANKINSON | Q505: CARVER | S505: HASTINGS
A507: BOX HILL | C507: 4 | D507: 4 | E507: =C507*6+D507 -> 28 | G507: 9 | H507: 6 | I507: =G507*6+H507 -> 60 | K507: 13 | L507: 8 | M507: =K507*6+L507 -> 86 | O507: 16 | P507: 8 | Q507: =O507*6+P507 -> 104 | S507: BOX HILL
A508: WERRIBEE | C508: 4 | D508: 1 | E508: =C508*6+D508 -> 25 | G508: 8 | H508: 8 | I508: =G508*6+H508 -> 56 | K508: 10 | L508: 13 | M508: =K508*6+L508 -> 73 | O508: 13 | P508: 18 | Q508: =O508*6+P508 -> 96 | S508: O'BRIEN
A509: BEST PLAYERS
A510: BOX HILL | C510: TUCKWELL | F510: WILSON | I510: WATERS | L510: GOSPER | O510: LASKIE | R510: LAWTHER
A511: WERRIBEE | C511: SCHIELE | F511: HUDSON | I511: YOUNG | L511: WHITEHEAD | O511: SCARFFE
A512: GOALKICKERS
A513: BOX HILL | C513: LASKIE 4 | E513: GORDON 3 | G513: JONES 2 | I513: TUCKWELL 2 | L513: MARINKO | N513: GOSPER | P513: BATES | R513: MURPHY | T513: McGUINNESS
A514: WERRIBEE | C514: SCHIELE 7 | F514: LYNCH 2 | I514: DOUGLAS | L514: MITCHELL | N514: TUDOR | P514: BOURKE
A516: FRANKSTON | C516: 12 | D516: 6 | E516: =C516*6+D516 -> 78 | G516: 18 | H516: 9 | I516: =G516*6+H516 -> 117 | K516: 24 | L516: 16 | M516: =K516*6+L516 -> 160 | O516: 34 | P516: 24 | Q516: =O516*6+P516 -> 228 | S516: FRANKSTON
A517: YARRAVILLE | C517: 1 | D517: 1 | E517: =C517*6+D517 -> 7 | G517: 4 | H517: 7 | I517: =G517*6+H517 -> 31 | K517: 5 | L517: 11 | M517: =K517*6+L517 -> 41 | O517: 7 | P517: 13 | Q517: =O517*6+P517 -> 55 | S517: ABBOTT
A518: BEST PLAYERS
A519: FRANKSTON | C519: THATCHER | F519: DOCKING | I519: CLARKE | L519: KENNEDY | O519: ESLER | R519: BOND
A520: YARRAVILLE | C520: WILSON | F520: LEE | I520: BARR | L520: MARTIN | O520: LEGOWIEC
A521: GOALKICKERS
A522: FRANKSTON | C522: BOND 7 | E522: CLARKE 4 | G522: CAYZER 4 | I522: DOCKING 4 | K522: SMALE 3 | M522: KENNEDY 3 | O522: LOVELOCK 3 | R522: WARD 2 | T522: THATCHER 2 | W522: STAPLETON | X522: ROWE
A523: YARRAVILLE | C523: RYAN 2 | E523: MARTIN | G523: JONES | I523: BARR | K523: SQUIRE | M523: EVANS
A525: ROUND 12 | E525: 27TH JUNE | J525: WEATHER | S525: PLAYED AT
D526: 1ST QTR | H526: 2ND QTR | L526: 3RD QTR | P526: FINAL | S526: CAMBERWELL
A527: FRANKSTON | C527: 4 | D527: 7 | E527: =C527*6+D527 -> 31 | G527: 5 | H527: 10 | I527: =G527*6+H527 -> 40 | K527: 11 | L527: 17 | M527: =K527*6+L527 -> 83 | O527: 16 | P527: 22 | Q527: =O527*6+P527 -> 118 | S527: UMPIRE | X527: LADDER | AB527: ROUND | AD527: 12
A528: CAMBERWELL | C528: 3 | D528: 3 | E528: =C528*6+D528 -> 21 | G528: 5 | H528: 10 | I528: =G528*6+H528 -> 40 | K528: 10 | L528: 10 | M528: =K528*6+L528 -> 70 | O528: 13 | P528: 12 | Q528: =O528*6+P528 -> 90 | S528: OGSTON
A529: BEST PLAYERS | W529: TEAM | X529: W | Y529: L | Z529: D | AA529: FOR | AB529: AGST | AC529: % | AD529: PTS
A530: FRANKSTON | C530: CAYZER | F530: DOCKING | I530: CLARKE | L530: DAVIES | O530: KENNEDY | R530: HENRICKSEN
A531: CAMBERWELL | C531: KENNEDY | F531: FOX | I531: SMITH | L531: HAZLETT | O531: JUDD | R531: BROWN | W531: MORDIALLOC | X531: 11 | Y531: 1 | Z531: 0 | AA531: 1833 | AB531: 1027 | AC531: =(AA531*100)/AB531 -> 178.48101265822785 | AD531: =(X531*4)+(Z531*2) -> 44
A532: GOALKICKERS | W532: FRANKSTON | X532: 11 | Y532: 1 | Z532: 0 | AA532: 1649 | AB532: 1107 | AC532: =(AA532*100)/AB532 -> 148.96115627822945 | AD532: =(X532*4)+(Z532*2) -> 44
A533: FRANKSTON | C533: DAVIES 3 | E533: WARD 3 | G533: CLARKE 3 | I533: SMALE 2 | K533: THATCHER 2 | N533: KENNEDY | P533: CAYZER | R533: DOCKING | W533: NORTHCOTE | X533: 9 | Y533: 3 | Z533: 0 | AA533: 1563 | AB533: 1221 | AC533: =(AA533*100)/AB533 -> 128.009828009828 | AD533: =(X533*4)+(Z533*2) -> 36
A534: CAMBERWELL | C534: SMITH 4 | E534: ANDREWS 2 | H534: ANDERSON | J534: STOREY | L534: BROWN | N534: JUD | P534: KENNEDY | R534: 2 SHORT | W534: WILLIAMSTOWN | X534: 8 | Y534: 4 | Z534: 0 | AA534: 1527 | AB534: 1140 | AC534: =(AA534*100)/AB534 -> 133.94736842105263 | AD534: =(X534*4)+(Z534*2) -> 32
A536: NORTHCOTE | C536: 8 | D536: 3 | E536: =C536*6+D536 -> 51 | G536: 15 | H536: 5 | I536: =G536*6+H536 -> 95 | K536: 19 | L536: 11 | M536: =K536*6+L536 -> 125 | O536: 22 | P536: 19 | Q536: =O536*6+P536 -> 151 | S536: NORTHCOTE | W536: CAMBERWELL | X536: 7 | Y536: 5 | Z536: 0 | AA536: 1500 | AB536: 1376 | AC536: =(AA536*100)/AB536 -> 109.01162790697674 | AD536: =(X536*4)+(Z536*2) -> 28
A537: WERRIBEE | C537: 2 | D537: 2 | E537: =C537*6+D537 -> 14 | G537: 5 | H537: 4 | I537: =G537*6+H537 -> 34 | K537: 12 | L537: 4 | M537: =K537*6+L537 -> 76 | O537: 16 | P537: 6 | Q537: =O537*6+P537 -> 102 | S537: WENN | W537: BOX HILL | X537: 4 | Y537: 8 | Z537: 0 | AA537: 1224 | AB537: 1563 | AC537: =(AA537*100)/AB537 -> 78.310940499040314 | AD537: =(X537*4)+(Z537*2) -> 16
A538: BEST PLAYERS | W538: WERRIBEE | X538: 3 | Y538: 9 | Z538: 0 | AA538: 1234 | AB538: 1501 | AC538: =(AA538*100)/AB538 -> 82.211858760826118 | AD538: =(X538*4)+(Z538*2) -> 12
A539: NORTHCOTE | C539: BRAIN | F539: JAMES | I539: LEE | L539: ROBERTSON | O539: T ROBERTS | R539: CHAPMAN | W539: WAVERLEY | X539: 3 | Y539: 9 | Z539: 0 | AA539: 1227 | AB539: 1530 | AC539: =(AA539*100)/AB539 -> 80.196078431372555 | AD539: =(X539*4)+(Z539*2) -> 12
A540: WERRIBEE | C540: COCKS | F540: SCARFFE | I540: EVANS | L540: TUDOR | O540: MITCHELL | W540: SUNSHINE | X540: 3 | Y540: 9 | Z540: 0 | AA540: 1186 | AB540: 1510 | AC540: =(AA540*100)/AB540 -> 78.543046357615893 | AD540: =(X540*4)+(Z540*2) -> 12
A541: GOALKICKERS | W541: YARRAVILLE | X541: 1 | Y541: 11 | Z541: 0 | AA541: 1101 | AB541: 2071 | AC541: =(AA541*100)/AB541 -> 53.162723322066633 | AD541: =(X541*4)+(Z541*2) -> 4
A542: NORTHCOTE | C542: CHAPMAN 7 | F542: BREWER 5 | I542: JENKINS 4 | K542: LEE 2 | M542: M RYAN | O542: BIENKE | Q542: AFFLECK | S542: McNEILL
A543: WERRIBEE | C543: LYNCH 5 | E543: MITCHELL 3 | H543: SCHIELE 3 | J543: COCKS 2 | L543: DOUGLAS | N543: BOURKE | P543: SCARFFE
A545: MORDIALLOC | C545: 7 | D545: 5 | E545: =C545*6+D545 -> 47 | G545: 11 | H545: 9 | I545: =G545*6+H545 -> 75 | K545: 19 | L545: 11 | M545: =K545*6+L545 -> 125 | O545: 23 | P545: 13 | Q545: =O545*6+P545 -> 151 | S545: SUNSHINE
A546: SUNSHINE | C546: 2 | D546: 2 | E546: =C546*6+D546 -> 14 | G546: 4 | H546: 6 | I546: =G546*6+H546 -> 30 | K546: 5 | L546: 9 | M546: =K546*6+L546 -> 39 | O546: 9 | P546: 15 | Q546: =O546*6+P546 -> 69 | S546: VERGONA
A547: BEST PLAYERS
A548: MORDIALLOC | C548: DEATON | F548: DINGLE | I548: SLADE | L548: THOMPSON | O548: NORRIS | R548: EDDY
A549: SUNSHINE | C549: DE ARRAUGO | F549: JONES | I549: SAMPSON | L549: BENSON | O549: FOREMAN | R549: FOLEY
A550: GOALKICKERS
A551: MORDIALLOC | C551: NEVILLE 7 | F551: DEATON 5 | I551: DINGLE 3 | K551: GUY 2 | M551: JOHNSTONE 2 | P551: NORRIS 2 | R551: SLADE | T551: THOMPSON
A552: SUNSHINE | C552: RADZIMINSKI 2 | F552: MANDICS 2 | I552: DE ARRAUGIO 2 | L552: FOREMAN | N552: HUTCHISON | Q552: McDONALD
A554: WILLIAMSTOWN | C554: 3 | D554: 8 | E554: =C554*6+D554 -> 26 | G554: 6 | H554: 13 | I554: =G554*6+H554 -> 49 | K554: 13 | L554: 16 | M554: =K554*6+L554 -> 94 | O554: 19 | P554: 20 | Q554: =O554*6+P554 -> 134 | S554: YARRAVILLE
A555: YARRAVILLE | C555: 2 | D555: 0 | E555: =C555*6+D555 -> 12 | G555: 7 | H555: 7 | I555: =G555*6+H555 -> 49 | K555: 9 | L555: 8 | M555: =K555*6+L555 -> 62 | O555: 10 | P555: 9 | Q555: =O555*6+P555 -> 69 | S555: O'BRIEN
A556: BEST PLAYERS
A557: WILLIAMSTOWN | C557: PERCY | F557: ROWE | I557: HARLEY | L557: ALLEN | O557: MOORE | R557: PORCEVINA
A558: YARRAVILLE | C558: JONES | F558: RYAN | I558: ALLEN | L558: BLAKE | O558: SQUIRE | R558: MARTIN
A559: GOALKICKERS
A560: WILLIAMSTOWN | C560: BROWN 5 | E560: ALLEN 3 | G560: SCOTT 2 | I560: PERCY 2 | K560: MAHONEY 2 | N560: PORCEVINA 2 | Q560: KENNEDY 2 | T560: HARLEY
A561: YARRAVILLE | C561: B LEE 3 | E561: GRACO 2 | G561: BLAKE | I561: ALLEN | K561: WILSON | M561: REEVE | O561: RYAN
A563: WAVERLEY | C563: 7 | D563: 3 | E563: =C563*6+D563 -> 45 | G563: 14 | H563: 11 | I563: =G563*6+H563 -> 95 | K563: 18 | L563: 14 | M563: =K563*6+L563 -> 122 | O563: 21 | P563: 16 | Q563: =O563*6+P563 -> 142 | S563: WAVERLEY
A564: BOX HILL | C564: 7 | D564: 3 | E564: =C564*6+D564 -> 45 | G564: 8 | H564: 5 | I564: =G564*6+H564 -> 53 | K564: 10 | L564: 10 | M564: =K564*6+L564 -> 70 | O564: 16 | P564: 14 | Q564: =O564*6+P564 -> 110 | S564: MARCY
A565: BEST PLAYERS
A566: WAVERLEY | C566: STYLES | F566: MILES | I566: McKAY | L566: HOLDSWORTH | O566: KELAART | R566: MORRIS
A567: BOX HILL | C567: LAWTHER | F567: BRYANT | I567: LASKIE | L567: GOSPER | O567: MARINKO | R567: WILSON
A568: GOALKICKERS
A569: WAVERLEY | C569: McKAY 7 | E569: COSTELLO 4 | G569: STYLES 2 | I569: HAROLD 2 | K569: HOLDSWORTH 2 | N569: MORRIS | P569: CARVER | R569: CRAWFORD | U569: MILES
A570: BOX HILL | C570: BRYANT 4 | F570: GORDON 3 | I570: BATES 3 | K570: LASKIE 2 | M570: GOSPER | O570: JONES | Q570: McFARLANE | T570: LAWTHER
A572: ROUND 13 | E572: 4TH JULY | J572: WEATHER | S572: PLAYED AT
D573: 1ST QTR | H573: 2ND QTR | L573: 3RD QTR | P573: FINAL | S573: WILLIAMSTOWN
A574: WILLIAMSTOWN | C574: 6 | D574: 9 | E574: =C575*6+D575 -> 45 | G574: 10 | H574: 11 | I574: =G575*6+H575 -> 71 | K574: 19 | L574: 19 | M574: =K575*6+L575 -> 133 | O574: 25 | P574: 24 | Q574: =O575*6+P575 -> 174 | S574: UMPIRE | X574: LADDER | AB574: ROUND | AD574: 13
A575: CAMBERWELL | C575: 3 | D575: 2 | E575: =C576*6+D576 -> 20 | G575: 7 | H575: 8 | I575: =G576*6+H576 -> 50 | K575: 11 | L575: 10 | M575: =K576*6+L576 -> 76 | O575: 18 | P575: 11 | Q575: =O576*6+P576 -> 119 | S575: McGIBBON
A576: BEST PLAYERS | W576: TEAM | X576: W | Y576: L | Z576: D | AA576: FOR | AB576: AGST | AC576: % | AD576: PTS
A577: WILLIAMSTOWN | C577: PERCY | F577: ALEXANDER | I577: PORCEVINA | L577: TWEEDLY | O577: GARDINER | R577: BROWN
A578: CAMBERWELL | C578: BOWDEN | F578: BRYCE | I578: SMITH | L578: KENNEDY | O578: FOX | R578: STOREY | W578: MORDIALLOC | X578: 12 | Y578: 1 | Z578: 0 | AA578: 1922 | AB578: 1100 | AC578: =(AA579*100)/AB579 -> 174.72727272727272 | AD578: =(X579*4)+(Z579*2) -> 48
A579: GOALKICKERS | W579: FRANKSTON | X579: 12 | Y579: 1 | Z579: 0 | AA579: 1775 | AB579: 1196 | AC579: =(AA580*100)/AB580 -> 148.41137123745818 | AD579: =(X580*4)+(Z580*2) -> 48
A580: WILLIAMSTOWN | C580: BROWN 9 | F580: SCOTT 5 | H580: GARDINER 5 | K580: PERCY 3 | M580: TWEEDLY 2 | P580: BRINER | W580: WILLIAMSTOWN | X580: 9 | Y580: 4 | Z580: 0 | AA580: 1701 | AB580: 1259 | AC580: =(AA581*100)/AB581 -> 135.10722795869737 | AD580: =(X581*4)+(Z581*2) -> 36
A581: CAMBERWELL | C581: HAMMOND 6 | F581: BRYCE 2 | H581: ANDREWS 2 | K581: JUDD 2 | M581: SMITH | O581: FOX | P581: SPITHILL | R581: STOREY | T581: ANDERSON | W581: NORTHCOTE | X581: 9 | Y581: 4 | Z581: 0 | AA581: 1636 | AB581: 1310 | AC581: =(AA582*100)/AB582 -> 124.8854961832061 | AD581: =(X582*4)+(Z582*2) -> 36
O582: KENNEDY
A583: MORDIALLOC | C583: 3 | D583: 4 | E583: =C584*6+D584 -> 22 | G583: 5 | H583: 7 | I583: =G584*6+H584 -> 37 | K583: 7 | L583: 13 | M583: =K584*6+L584 -> 55 | O583: 12 | P583: 17 | Q583: =O584*6+P584 -> 89 | S583: MORDIALLOC | W583: CAMBERWELL | X583: 7 | Y583: 6 | Z583: 0 | AA583: 1619 | AB583: 1550 | AC583: =(AA584*100)/AB584 -> 104.45161290322581 | AD583: =(X584*4)+(Z584*2) -> 28
A584: NORTHCOTE | C584: 4 | D584: 2 | E584: =C585*6+D585 -> 26 | G584: 5 | H584: 3 | I584: =G585*6+H585 -> 33 | K584: 10 | L584: 5 | M584: =K585*6+L585 -> 65 | O584: 11 | P584: 7 | Q584: =O585*6+P585 -> 73 | S584: CARLILE | W584: BOX HILL | X584: 5 | Y584: 8 | Z584: 0 | AA584: 1349 | AB584: 1666 | AC584: =(AA585*100)/AB585 -> 80.972388955582232 | AD584: =(X585*4)+(Z585*2) -> 20
A585: BEST PLAYERS | W585: WERRIBEE | X585: 4 | Y585: 9 | Z585: 0 | AA585: 1359 | AB585: 1602 | AC585: =(AA586*100)/AB586 -> 84.831460674157299 | AD585: =(X586*4)+(Z586*2) -> 16
A586: MORDIALLOC | C586: DEATON | F586: GUY | I586: THOMPSON | L586: EDDY | O586: ROSENOW | R586: WALSH | W586: WAVERLEY | X586: 3 | Y586: 10 | Z586: 0 | AA586: 1328 | AB586: 1655 | AC586: =(AA587*100)/AB587 -> 80.241691842900309 | AD586: =(X587*4)+(Z587*2) -> 12
A587: NORTHCOTE | C587: McARDLE | F587: BRAIN | I587: JAMES | L587: McINTYRE | O587: T ROBERTS | R587: AFFLECK | W587: SUNSHINE | X587: 3 | Y587: 10 | Z587: 0 | AA587: 1275 | AB587: 1636 | AC587: =(AA588*100)/AB588 -> 77.933985330073355 | AD587: =(X588*4)+(Z588*2) -> 12
A588: GOALKICKERS | W588: YARRAVILLE | X588: 1 | Y588: 12 | Z588: 0 | AA588: 1204 | AB588: 2196 | AC588: =(AA589*100)/AB589 -> 54.826958105646632 | AD588: =(X589*4)+(Z589*2) -> 4
A589: MORDIALLOC | C589: NEVILLE 4 | F589: JOHNSTONE 3 | I589: NORRIS 3 | K589: DEATON | M589: GUY
A590: NORTHCOTE | C590: CHAPMAN 3 | F590: ROBERTSON | I590: M RYAN | K590: BIENKE | M590: JENKINS | O590: AFFLECK | Q590: BREWER | S590: G RYAN | U590: LOWE
A592: BOX HILL | C592: 3 | D592: 5 | E592: =C593*6+D593 -> 23 | G592: 6 | H592: 10 | I592: =G593*6+H593 -> 46 | K592: 13 | L592: 14 | M592: =K593*6+L593 -> 92 | O592: 18 | P592: 17 | Q592: =O593*6+P593 -> 125 | S592: BOX HILL
A593: YARRAVILLE | C593: 3 | D593: 1 | E593: =C594*6+D594 -> 19 | G593: 9 | H593: 6 | I593: =G594*6+H594 -> 60 | K593: 12 | L593: 9 | M593: =K594*6+L594 -> 81 | O593: 15 | P593: 13 | Q593: =O594*6+P594 -> 103 | S593: OGSTON
A594: BEST PLAYERS
A595: BOX HILL | C595: BRYANT | F595: WATERS | I595: BAKER | L595: GOSPER | O595: LAWTHER | R595: LASKIE
A596: YARRAVILLE | C596: BLAKE | F596: LEGAWIECZ | I596: JONES | L596: SQUIRE | O596: RYAN | R596: McLAREN
A597: GOALKICKERS
A598: BOX HILL | C598: BRYANT 4 | F598: LASKIE 3 | H598: GORDON 3 | J598: JONES 2 | L598: TUCKWELL 2 | O598: CROTHERS 2 | R598: BATES | T598: MIGHELL
A599: YARRAVILLE | C599: LEGAWIECZ 3 | F599: BLAKE 3 | H599: CURTIN 2 | J599: RYAN 2 | L599: WILSON 2 | N599: SQUIRE 2 | P599: MARTIN | R599: GRACO
A601: FRANKSTON | C601: 5 | D601: 2 | E601: =C602*6+D602 -> 32 | G601: 8 | H601: 6 | I601: =G602*6+H602 -> 54 | K601: 12 | L601: 13 | M601: =K602*6+L602 -> 85 | O601: 18 | P601: 18 | Q601: =O602*6+P602 -> 126 | S601: FRANKSTON
A602: SUNSHINE | C602: 4 | D602: 2 | E602: =C603*6+D603 -> 26 | G602: 7 | H602: 2 | I602: =G603*6+H603 -> 44 | K602: 9 | L602: 3 | M602: =K603*6+L603 -> 57 | O602: 14 | P602: 5 | Q602: =O603*6+P603 -> 89 | S602: BROWN
A603: BEST PLAYERS
A604: FRANKSTON | C604: SMALE | F604: TICKELL | I604: KENNEDY | L604: CAYZER | O604: ESLER | R604: CLARKE
A605: SUNSHINE | C605: WARD | F605: GRAY | I605: JONES | L605: DE ARRAUGO | O605: SAMPSON | R605: MARTIN
A606: GOALKICKERS
A607: FRANKSTON | C607: GRUMMISCH 5 | F607: LOVELOCK 3 | I607: DOCKING 3 | K607: SMALE 3 | N607: DAVIES | P607: KENNEDY | R607: ADAMS | T607: THATCHER
A608: SUNSHINE | C608: MANDICS 4 | F608: JONES 4 | H608: WARD 2 | J608: CLARKE | L608: STEIGLER | N608: FOREMAN | Q608: DE ARRAUGO
A610: WERRIBEE | C610: 8 | D610: 4 | E610: =C611*6+D611 -> 52 | G610: 12 | H610: 8 | I610: =G611*6+H611 -> 80 | K610: 15 | L610: 11 | M610: =K611*6+L611 -> 101 | O610: 18 | P610: 17 | Q610: =O611*6+P611 -> 125 | S610: WERRIBEE
A611: WAVERLEY | C611: 3 | D611: 1 | E611: =C612*6+D612 -> 19 | G611: 3 | H611: 3 | I611: =G612*6+H612 -> 21 | K611: 10 | L611: 3 | M611: =K612*6+L612 -> 63 | O611: 16 | P611: 5 | Q611: =O612*6+P612 -> 101 | S611: HAYES
A612: BEST PLAYERS
A613: WERRIBEE | C613: BOURKE | F613: TUDOR | I613: OUGH | L613: NEWMAN | O613: SCHIELE | R613: SCARFFE
A614: WAVERLEY | C614: WENBOURNE | F614: STYLES | I614: SHARP | L614: HOLDSWORTH | O614: HAROLD
A615: GOALKICKERS
A616: WERRIBEE | C616: SCHIELE 4 | F616: J BELLIN 3 | H616: NEWMAN 2 | K616: MITCHELL 2 | N616: LYNCH 2 | P616: EVANS 2 | R616: YOUNG | T616: COCKS | V616: TUDOR
A617: WAVERLEY | C617: COSTELLO 7 | F617: McKAY 3 | I617: MORRIS 2 | L617: KINNABURGH 2 | O617: HANCOCK 2
A619: ROUND 14 | E619: 11TH JULY | J619: WEATHER | S619: PLAYED AT
D620: 1ST QTR | H620: 2ND QTR | L620: 3RD QTR | P620: FINAL | S620: MORDIALLOC
A621: FRANKSTON | C621: 0 | D621: 0 | E621: =C622*6+D622 -> 0 | G621: 0 | H621: 0 | I621: =G622*6+H622 -> 0 | K621: 0 | L621: 0 | M621: =K622*6+L622 -> 0 | O621: 20 | P621: 13 | Q621: =O622*6+P622 -> 133 | S621: UMPIRE | X621: LADDER | AB621: ROUND | AD621: 14
A622: MORDIALLOC | C622: 0 | D622: 0 | E622: =C623*6+D623 -> 0 | G622: 0 | H622: 0 | I622: =G623*6+H623 -> 0 | K622: 0 | L622: 0 | M622: =K623*6+L623 -> 0 | O622: 14 | P622: 17 | Q622: =O623*6+P623 -> 101 | S622: McGIBBON
A623: BEST PLAYERS | W623: TEAM | X623: W | Y623: L | Z623: D | AA623: FOR | AB623: AGST | AC623: % | AD623: PTS
A624: FRANKSTON | C624: CAYZER | F624: KENNEDY | I624: ELLIS
A625: MORDIALLOC | W625: FRANKSTON | X625: 13 | Y625: 1 | Z625: 0 | AA625: 1908 | AB625: 1297 | AC625: =(AA626*100)/AB626 -> 147.10871241326137 | AD625: =(X626*4)+(Z626*2) -> 52
A626: GOALKICKERS | W626: MORDIALLOC | X626: 12 | Y626: 2 | Z626: 0 | AA626: 2023 | AB626: 1233 | AC626: =(AA627*100)/AB627 -> 164.0713706407137 | AD626: =(X627*4)+(Z627*2) -> 48
A627: FRANKSTON | C627: ELLIS 6 | E627: CAYZER 5 | G627: WARD 2 | I627: DOCKING 2 | K627: KENNEDY | M627: ADAMS | O627: THATCHER | R627: LOVELOCK | T627: SMALE | W627: WILLIAMSTOWN | X627: 10 | Y627: 4 | Z627: 0 | AA627: 1854 | AB627: 1397 | AC627: =(AA628*100)/AB628 -> 132.71295633500358 | AD627: =(X628*4)+(Z628*2) -> 40
A628: MORDIALLOC | C628: NEVILLE 3 | E628: JOHNSTONE 3 | H628: GUY 2 | J628: DINGLE 2 | L628: NORRIS 2 | N628: WALSH | P628: SLADE | W628: NORTHCOTE | X628: 9 | Y628: 5 | Z628: 0 | AA628: 1755 | AB628: 1430 | AC628: =(AA629*100)/AB629 -> 122.72727272727273 | AD628: =(X629*4)+(Z629*2) -> 36
A630: CAMBERWELL | C630: 0 | D630: 0 | E630: =C631*6+D631 -> 0 | G630: 0 | H630: 0 | I630: =G631*6+H631 -> 0 | K630: 0 | L630: 0 | M630: =K631*6+L631 -> 0 | O630: 25 | P630: 22 | Q630: =O631*6+P631 -> 172 | S630: CAMBERWELL | W630: CAMBERWELL | X630: 8 | Y630: 6 | Z630: 0 | AA630: 1791 | AB630: 1647 | AC630: =(AA631*100)/AB631 -> 108.7431693989071 | AD630: =(X631*4)+(Z631*2) -> 32
A631: BOX HILL | C631: 0 | D631: 0 | E631: =C632*6+D632 -> 0 | G631: 0 | H631: 0 | I631: =G632*6+H632 -> 0 | K631: 0 | L631: 0 | M631: =K632*6+L632 -> 0 | O631: 13 | P631: 19 | Q631: =O632*6+P632 -> 97 | S631: BROWN | W631: WERRIBEE | X631: 5 | Y631: 9 | Z631: 0 | AA631: 1484 | AB631: 1676 | AC631: =(AA632*100)/AB632 -> 88.544152744630068 | AD631: =(X632*4)+(Z632*2) -> 20
A632: BEST PLAYERS | W632: BOX HILL | X632: 5 | Y632: 9 | Z632: 0 | AA632: 1446 | AB632: 1838 | AC632: =(AA633*100)/AB633 -> 78.672470076169745 | AD632: =(X633*4)+(Z633*2) -> 20
A633: CAMBERWELL | C633: FOX | F633: HAMMOND | I633: KENNEDY | W633: WAVERLEY | X633: 4 | Y633: 10 | Z633: 0 | AA633: 1448 | AB633: 1774 | AC633: =(AA634*100)/AB634 -> 81.62344983089065 | AD633: =(X634*4)+(Z634*2) -> 16
A634: BOX HILL | W634: SUNSHINE | X634: 3 | Y634: 11 | Z634: 0 | AA634: 1413 | AB634: 1789 | AC634: =(AA635*100)/AB635 -> 78.982671883733929 | AD634: =(X635*4)+(Z635*2) -> 12
A635: GOALKICKERS | W635: YARRAVILLE | X635: 1 | Y635: 13 | Z635: 0 | AA635: 1278 | AB635: 2321 | AC635: =(AA636*100)/AB636 -> 55.062473071951743 | AD635: =(X636*4)+(Z636*2) -> 4
A636: CAMBERWELL | C636: HAMMOND 10 | F636: SMITH 6 | H636: BRYCE 2 | J636: BRAYNE 2 | L636: FITZGERALD 2 | O636: KENNEDY | Q636: FOX | S636: BOWDEN
A637: BOX HILL | C637: GORDON 4 | F637: TUCKWELL 3 | I637: BATES 2 | K637: STEWART | M637: JONES | O637: LESLIE | Q637: GOSPER
A639: WILLIAMSTOWN | C639: 0 | D639: 0 | E639: =C640*6+D640 -> 0 | G639: 0 | H639: 0 | I639: =G640*6+H640 -> 0 | K639: 0 | L639: 0 | M639: =K640*6+L640 -> 0 | O639: 23 | P639: 15 | Q639: =O640*6+P640 -> 153 | S639: SUNSHINE
A640: SUNSHINE | C640: 0 | D640: 0 | E640: =C641*6+D641 -> 0 | G640: 0 | H640: 0 | I640: =G641*6+H641 -> 0 | K640: 0 | L640: 0 | M640: =K641*6+L641 -> 0 | O640: 21 | P640: 12 | Q640: =O641*6+P641 -> 138 | S640: STEERE
A641: BEST PLAYERS
A642: WILLIAMSTOWN | C642: MILDENHALL | F642: SCOTT | I642: ALEXANDER
A643: SUNSHINE
A644: GOALKICKERS
A645: WILLIAMSTOWN | C645: MILDENHALL 6 | F645: GARDINER 4 | I645: SCOTT 4 | K645: BRINER 4 | M645: CHALMERS 2 | P645: PERCY | R645: HARLEY | T645: MARSHALL
A646: SUNSHINE | C646: RADZIMINSKI 4 | F646: FOREMAN 3 | I646: MANDICS 3 | K646: DE ARRAUGO 2 | N646: BENSON 2 | P646: WARD | R646: JONES | T646: BUGDEN | W646: MITCHELL | X646: BRETT | Y646: GRAY | Z646: PIERCZAK
A648: WERRIBEE | C648: 0 | D648: 0 | E648: =C649*6+D649 -> 0 | G648: 0 | H648: 0 | I648: =G649*6+H649 -> 0 | K648: 0 | L648: 0 | M648: =K649*6+L649 -> 0 | O648: 18 | P648: 17 | Q648: =O649*6+P649 -> 125 | S648: YARRAVILLE
A649: YARRAVILLE | C649: 0 | D649: 0 | E649: =C650*6+D650 -> 0 | G649: 0 | H649: 0 | I649: =G650*6+H650 -> 0 | K649: 0 | L649: 0 | M649: =K650*6+L650 -> 0 | O649: 10 | P649: 14 | Q649: =O650*6+P650 -> 74 | S649: MURLEY
A650: BEST PLAYERS
A651: WERRIBEE | C651: OUGH | F651: COCKS | I651: NEWMAN
A652: YARRAVILLE | C652: JONES | F652: LEGAWIECZ | I652: BLAKE
A653: GOALKICKERS
A654: WERRIBEE | C654: MITCHELL 4 | F654: SCHIELE 4 | I654: LYNCH 3 | K654: EVANS 2 | M654: J BELLIN | O654: COCKS | Q654: BOURKE | S654: SCARFFE | V654: NEWMAN
A655: YARRAVILLE | C655: GRACO 3 | F655: WILSON 3 | I655: HARRISON 2 | L655: BLAKE | N655: SQUIRE
A657: WAVERLEY | C657: 0 | D657: 0 | E657: =C658*6+D658 -> 0 | G657: 0 | H657: 0 | I657: =G658*6+H658 -> 0 | K657: 0 | L657: 0 | M657: =K658*6+L658 -> 0 | O657: 18 | P657: 12 | Q657: =O658*6+P658 -> 120 | S657: WAVERLEY
A658: NORTHCOTE | C658: 0 | D658: 0 | E658: =C659*6+D659 -> 0 | G658: 0 | H658: 0 | I658: =G659*6+H659 -> 0 | K658: 0 | L658: 0 | M658: =K659*6+L659 -> 0 | O658: 17 | P658: 17 | Q658: =O659*6+P659 -> 119 | S658: OGSTON
A659: BEST PLAYERS
A660: WAVERLEY | C660: STYLES | F660: HOLDSWORTH | I660: WENBOURNE
A661: NORTHCOTE | C661: STILSBY | F661: T ROBERTS | I661: CHAPMAN
A662: GOALKICKERS
A663: WAVERLEY | C663: McKAY 7 | E663: COSTELLO 3 | H663: KINNABURGH 2 | K663: HOLDSWORTH 2 | N663: HAROLD | P663: MORRIS | R663: HANCOCK | T663: B WILLIAMS
A664: NORTHCOTE | C664: CHAPMAN 4 | F664: ROBERTSON 3 | I664: STILSBY 2 | K664: McNEILL 2 | N664: GRANT 2 | P664: McINTYRE | R664: JENKINS | T664: AFFLECK | V664: G RYAN
A666: ROUND 15 | E666: 18TH JULY | J666: WEATHER | S666: PLAYED AT
D667: 1ST QTR | H667: 2ND QTR | L667: 3RD QTR | P667: FINAL | S667: WERRIBEE
A668: WERRIBEE | C668: 6 | D668: 3 | E668: =C669*6+D669 -> 39 | G668: 13 | H668: 8 | I668: =G669*6+H669 -> 86 | K668: 20 | L668: 12 | M668: =K669*6+L669 -> 132 | O668: 28 | P668: 15 | Q668: =O669*6+P669 -> 183 | S668: UMPIRE | X668: LADDER | AB668: ROUND | AD668: 15
A669: CAMBERWELL | C669: 5 | D669: 3 | E669: =C670*6+D670 -> 33 | G669: 8 | H669: 7 | I669: =G670*6+H670 -> 55 | K669: 11 | L669: 11 | M669: =K670*6+L670 -> 77 | O669: 15 | P669: 13 | Q669: =O670*6+P670 -> 103 | S669: STABB
A670: BEST PLAYERS | W670: TEAM | X670: W | Y670: L | Z670: D | AA670: FOR | AB670: AGST | AC670: % | AD670: PTS
A671: WERRIBEE | C671: COCKS | F671: SCHIELE | I671: MITCHELL | L671: DOUGLAS | O671: LYNCH | R671: WISE
A672: CAMBERWELL | C672: BRAYNE | F672: LAWSON | I672: FOX | L672: TOLEMAN | O672: BROWN | R672: BRYCE | W672: FRANKSTON | X672: 13 | Y672: 1 | Z672: 1 | AA672: 2023 | AB672: 1412 | AC672: =(AA673*100)/AB673 -> 143.27195467422095 | AD672: =(X673*4)+(Z673*2) -> 54
A673: GOALKICKERS | W673: MORDIALLOC | X673: 13 | Y673: 2 | Z673: 0 | AA673: 2239 | AB673: 1350 | AC673: =(AA674*100)/AB674 -> 165.85185185185185 | AD673: =(X674*4)+(Z674*2) -> 52
A674: WERRIBEE | C674: SCHIELE 10 | F674: MITCHELL 7 | I674: LYNCH 4 | K674: NEWMAN 3 | N674: EVANS 2 | P674: TUDOR 2 | W674: WILLIAMSTOWN | X674: 10 | Y674: 5 | Z674: 0 | AA674: 1971 | AB674: 1613 | AC674: =(AA675*100)/AB675 -> 122.1946683199008 | AD674: =(X675*4)+(Z675*2) -> 40
A675: CAMBERWELL | C675: HAMMOND 7 | F675: SMITH 2 | H675: ANDERSON 2 | K675: BRAYNE | M675: SPITHILL | O675: FITZGERALD | R675: KENNEDY | W675: NORTHCOTE | X675: 9 | Y675: 5 | Z675: 1 | AA675: 1870 | AB675: 1545 | AC675: =(AA676*100)/AB676 -> 121.03559870550161 | AD675: =(X676*4)+(Z676*2) -> 38
A677: MORDIALLOC | C677: 13 | D677: 2 | E677: =C678*6+D678 -> 80 | G677: 18 | H677: 4 | I677: =G678*6+H678 -> 112 | K677: 28 | L677: 11 | M677: =K678*6+L678 -> 179 | O677: 34 | P677: 12 | Q677: =O678*6+P678 -> 216 | S677: WILLIAMSTOWN | W677: CAMBERWELL | X677: 8 | Y677: 7 | Z677: 0 | AA677: 1894 | AB677: 1830 | AC677: =(AA678*100)/AB678 -> 103.49726775956285 | AD677: =(X678*4)+(Z678*2) -> 32
A678: WILLIAMSTOWN | C678: 1 | D678: 1 | E678: =C679*6+D679 -> 7 | G678: 8 | H678: 4 | I678: =G679*6+H679 -> 52 | K678: 9 | L678: 6 | M678: =K679*6+L679 -> 60 | O678: 18 | P678: 9 | Q678: =O679*6+P679 -> 117 | S678: HAYES | W678: WERRIBEE | X678: 6 | Y678: 9 | Z678: 0 | AA678: 1667 | AB678: 1779 | AC678: =(AA679*100)/AB679 -> 93.704328274311408 | AD678: =(X679*4)+(Z679*2) -> 24
A679: BEST PLAYERS | W679: BOX HILL | X679: 6 | Y679: 9 | Z679: 0 | AA679: 1586 | AB679: 1950 | AC679: =(AA680*100)/AB680 -> 81.333333333333329 | AD679: =(X680*4)+(Z680*2) -> 24
A680: MORDIALLOC | C680: BASTIAN | F680: WALSH | I680: GUY | L680: LANG | O680: McCARTHY | R680: MOORE | W680: WAVERLEY | X680: 5 | Y680: 10 | Z680: 0 | AA680: 1604 | AB680: 1848 | AC680: =(AA681*100)/AB681 -> 86.796536796536799 | AD680: =(X681*4)+(Z681*2) -> 20
A681: WILLIAMSTOWN | C681: GARDINER | F681: ALEXANDER | I681: PORCEVINA | L681: LOWE | O681: PERCY | W681: SUNSHINE | X681: 3 | Y681: 12 | Z681: 0 | AA681: 1525 | AB681: 1929 | AC681: =(AA682*100)/AB682 -> 79.056505961638152 | AD681: =(X682*4)+(Z682*2) -> 12
A682: GOALKICKERS | J682: DINGLE | M682: SLADE | O682: ROSENOW | W682: YARRAVILLE | X682: 1 | Y682: 14 | Z682: 0 | AA682: 1352 | AB682: 2477 | AC682: =(AA683*100)/AB683 -> 54.582155833669759 | AD682: =(X683*4)+(Z683*2) -> 4
A683: MORDIALLOC | C683: NEVILLE 12 | F683: GUY 4 | G683: DEATON 3 | J683: WALSH 3 | L683: NORRIS 3 | N683: McCARTHY 2 | Q683: BLOOMFIELD 2 | T683: WILLIAMSON 2
A684: WILLIAMSTOWN | C684: GARDINER 6 | F684: GARTH 3 | H684: ALLEN 3 | J684: SCOTT | L684: TWEEDLY | N684: DIXON | P684: HARLEY | R684: MILDENHALL | U684: PERCY
A686: BOX HILL | C686: 3 | D686: 8 | E686: =C687*6+D687 -> 26 | G686: 9 | H686: 12 | I686: =G687*6+H687 -> 66 | K686: 15 | L686: 17 | M686: =K687*6+L687 -> 107 | O686: 20 | P686: 20 | Q686: =O687*6+P687 -> 140 | S686: BOX HILL
A687: SUNSHINE | C687: 3 | D687: 6 | E687: =C688*6+D688 -> 24 | G687: 7 | H687: 14 | I687: =G688*6+H688 -> 56 | K687: 9 | L687: 15 | M687: =K688*6+L688 -> 69 | O687: 15 | P687: 22 | Q687: =O688*6+P688 -> 112 | S687: MURLEY
A688: BEST PLAYERS
A689: BOX HILL | C689: LASKIE | F689: GOSPER | I689: BATES | L689: MARINKO | O689: TUCKWELL | R689: McGUINNESS
A690: SUNSHINE | C690: PIERCZAK | F690: PAXTON | I690: DE ARRAUGO | L690: RADZIMINSKI | O690: MARTIN | R690: CLARKE
A691: GOALKICKERS
A692: BOX HILL | C692: BATES 5 | F692: JONES 4 | H692: DWYER 4 | J692: GORDON 3 | M692: MARINKO 2 | P692: LASKIE 2
A693: SUNSHINE | C693: RADZIMINSKI 6 | F693: BENSON 2 | I693: WARD 2 | K693: PIERCZAK 2 | N693: MANDICS 2 | Q693: FOREMAN | S693: BAIRD | U693: CLARKE
A695: WAVERLEY | C695: 4 | D695: 1 | E695: =C696*6+D696 -> 25 | G695: 12 | H695: 8 | I695: =G696*6+H696 -> 80 | K695: 18 | L695: 12 | M695: =K696*6+L696 -> 120 | O695: 23 | P695: 18 | Q695: =O696*6+P696 -> 156 | S695: WAVERLEY
A696: YARRAVILLE | C696: 3 | D696: 5 | E696: =C697*6+D697 -> 23 | G696: 7 | H696: 7 | I696: =G697*6+H697 -> 49 | K696: 8 | L696: 12 | M696: =K697*6+L697 -> 60 | O696: 10 | P696: 14 | Q696: =O697*6+P697 -> 74 | S696: BROWN
A697: BEST PLAYERS
A698: WAVERLEY | C698: HOLDSWORTH | F698: STYLES | I698: McKAY | L698: SHARD | O698: COSTELLO | R698: WENBOURNE
A699: YARRAVILLE | C699: MARTIN | F699: LOWE | I699: JONES | L699: HARRISON | O699: DOLL | R699: GRACO
A700: GOALKICKERS
A701: WAVERLEY | C701: McKAY 7 | E701: COSTELLO 6 | G701: CRAWFORD 2 | J701: HANCOCK 2 | M701: HASTINGS 2 | P701: STYLES | R701: MORRIS | T701: HAROLD | V701: KINNABURGH
A702: YARRAVILLE | C702: B LEE 3 | E702: WILSON 3 | H702: BLAKE | J702: HARRISON | M702: CORCORAN | P702: ALLEN
A704: NORTHCOTE | C704: 3 | D704: 4 | E704: =C705*6+D705 -> 22 | G704: 11 | H704: 9 | I704: =G705*6+H705 -> 75 | K704: 15 | L704: 16 | M704: =K705*6+L705 -> 106 | O704: 16 | P704: 19 | Q704: =O705*6+P705 -> 115 | S704: NORTHCOTE
A705: FRANKSTON | C705: 2 | D705: 3 | E705: =C706*6+D706 -> 15 | G705: 3 | H705: 10 | I705: =G706*6+H706 -> 28 | K705: 11 | L705: 16 | M705: =K706*6+L706 -> 82 | O705: 16 | P705: 19 | Q705: =O706*6+P706 -> 115 | S705: FITZPATRICK
A706: BEST PLAYERS
A707: NORTHCOTE | C707: ROBERTSON | F707: BUTTERWORTH | J707: M RYAN | L707: ROBERTS | O707: JENKINS | R707: McORIST
A708: FRANKSTON | C708: KENNEDY | F708: JOY | I708: BOND | L708: TICKELL | O708: ELLIS | R708: ADAMS
A709: GOALKICKERS
A710: NORTHCOTE | C710: ROBERTSON 5 | F710: JENKINS 4 | H710: M RYAN 2 | K710: BIENKE | M710: CHAPMAN | O710: STILSBY | Q710: McNEILL | S710: McORIST
A711: FRANKSTON | C711: LOVELOCK 4 | F711: ELLIS 4 | H711: WARD 3 | J711: CAYZER 2 | L711: DAVIES | N711: DOCKING | P711: HENRICKSEN
A713: ROUND 16 | E713: 25TH JULY | J713: WEATHER | S713: PLAYED AT
D714: 1ST QTR | H714: 2ND QTR | L714: 3RD QTR | P714: FINAL | S714: FRANKSTON
A715: FRANKSTON | C715: 3 | D715: 9 | E715: =C716*6+D716 -> 27 | G715: 8 | H715: 13 | I715: =G716*6+H716 -> 61 | K715: 12 | L715: 13 | M715: =K716*6+L716 -> 85 | O715: 19 | P715: 16 | Q715: =O716*6+P716 -> 130 | S715: UMPIRE | X715: LADDER | AB715: ROUND | AD715: 16
A716: WILLIAMSTOWN | C716: 3 | D716: 4 | E716: =C717*6+D717 -> 22 | G716: 5 | H716: 12 | I716: =G717*6+H717 -> 42 | K716: 8 | L716: 17 | M716: =K717*6+L717 -> 65 | O716: 13 | P716: 24 | Q716: =O717*6+P717 -> 102 | S716: O'BRIEN
A717: BEST PLAYERS | W717: TEAM | X717: W | Y717: L | Z717: D | AA717: FOR | AB717: AGST | AC717: % | AD717: PTS
A718: FRANKSTON | C718: KENNEDY | F718: DAVIES | I718: SMALE | L718: HENRICKSEN | Q718: KENDALL
A719: WILLIAMSTOWN | C719: LOWE | F719: PERCY | I719: MILDENHALL | L719: MAHONEY | O719: CROSS | Q719: KERR | W719: FRANKSTON | X719: 14 | Y719: 1 | Z719: 1 | AA719: 2153 | AB719: 1514 | AC719: =(AA720*100)/AB720 -> 142.20607661822984 | AD719: =(X720*4)+(Z720*2) -> 58
A720: GOALKICKERS | M720: ? 1 | O720: THATCHER | W720: MORDIALLOC | X720: 14 | Y720: 2 | Z720: 0 | AA720: 2399 | AB720: 1468 | AC720: =(AA721*100)/AB721 -> 163.41961852861036 | AD720: =(X721*4)+(Z721*2) -> 56
A721: FRANKSTON | C721: ? 5 | F721: CLARKE 3 | I721: KENNEDY 3 | L721: ? 2 | N721: WARD | P721: ELLIS | R721: HOGAN | T721: CAYZER | W721: NORTHCOTE | X721: 10 | Y721: 5 | Z721: 1 | AA721: 2028 | AB721: 1603 | AC721: =(AA722*100)/AB722 -> 126.51278852152214 | AD721: =(X722*4)+(Z722*2) -> 42
A722: WILLIAMSTOWN | C722: MILDENHALL 4 | F722: CROSS 3 | H722: PERCY 2 | J722: SCOTT 2 | L722: BRINER | N722: HARLEY | W722: WILLIAMSTOWN | X722: 10 | Y722: 6 | Z722: 0 | AA722: 2073 | AB722: 1743 | AC722: =(AA723*100)/AB723 -> 118.93287435456111 | AD722: =(X723*4)+(Z723*2) -> 40
A724: CAMBERWELL | C724: 7 | D724: 7 | E724: =C725*6+D725 -> 49 | G724: 11 | H724: 11 | I724: =G725*6+H725 -> 77 | K724: 13 | L724: 14 | M724: =K725*6+L725 -> 92 | O724: 22 | P724: 21 | Q724: =O725*6+P725 -> 153 | S724: CAMBERWELL | W724: CAMBERWELL | X724: 9 | Y724: 7 | Z724: 0 | AA724: 2047 | AB724: 1928 | AC724: =(AA725*100)/AB725 -> 106.17219917012449 | AD724: =(X725*4)+(Z725*2) -> 36
A725: WAVERLEY | C725: 4 | D725: 2 | E725: =C726*6+D726 -> 26 | G725: 6 | H725: 8 | I725: =G726*6+H726 -> 44 | K725: 11 | L725: 10 | M725: =K726*6+L726 -> 76 | O725: 14 | P725: 14 | Q725: =O726*6+P726 -> 98 | S725: STEERE | W725: WERRIBEE | X725: 6 | Y725: 10 | Z725: 0 | AA725: 1775 | AB725: 1889 | AC725: =(AA726*100)/AB726 -> 93.965060878771837 | AD725: =(X726*4)+(Z726*2) -> 24
A726: BEST PLAYERS | W726: BOX HILL | X726: 6 | Y726: 10 | Z726: 0 | AA726: 1704 | AB726: 2110 | AC726: =(AA727*100)/AB727 -> 80.758293838862556 | AD726: =(X727*4)+(Z727*2) -> 24
A727: CAMBERWELL | C727: ? | F727: SMITH | I727: KENNEDY | L727: SPITHILL | O727: W ? | Q727: SAUERBERG | W727: WAVERLEY | X727: 5 | Y727: 11 | Z727: 0 | AA727: 1702 | AB727: 2001 | AC727: =(AA728*100)/AB728 -> 85.05747126436782 | AD727: =(X728*4)+(Z728*2) -> 20
A728: WAVERLEY | C728: ? | F728: STYLES | I728: CRAWFORD | L728: G McLURE | O728: McKAY | Q728: COSTELLO | W728: SUNSHINE | X728: 4 | Y728: 12 | Z728: 0 | AA728: 1635 | AB728: 2037 | AC728: =(AA729*100)/AB729 -> 80.265095729013254 | AD728: =(X729*4)+(Z729*2) -> 16
A729: GOALKICKERS | W729: YARRAVILLE | X729: 1 | Y729: 15 | Z729: 0 | AA729: 1410 | AB729: 2635 | AC729: =(AA730*100)/AB730 -> 53.510436432637569 | AD729: =(X730*4)+(Z730*2) -> 4
A730: CAMBERWELL | C730: ? 8 | F730: HAMMOND 7 | I730: WATSON 3 | L730: KENNEDY 2 | O730: SPITHILL | Q730: K CURRAN
A731: WAVERLEY | C731: CRAWFORD 3 | F731: ? 2 | I731: KINNABURGH 2 | L731: MCKAY | N731: ? 1 | P731: HAROLD
A733: MORDIALLOC | C733: 2 | D733: 2 | E733: =C734*6+D734 -> 14 | G733: 9 | H733: 6 | I733: =G734*6+H734 -> 60 | K733: 19 | L733: 8 | M733: =K734*6+L734 -> 122 | O733: 25 | P733: 10 | Q733: =O734*6+P734 -> 160 | S733: MORDIALLOC
A734: BOX HILL | C734: 6 | D734: 6 | E734: =C735*6+D735 -> 42 | G734: 10 | H734: 9 | I734: =G735*6+H735 -> 69 | K734: 10 | L734: 13 | M734: =K735*6+L735 -> 73 | O734: 17 | P734: 16 | Q734: =O735*6+P735 -> 118 | S734: FITZPATRICK
A735: BEST PLAYERS
A736: MORDIALLOC | C736: ? | F736: SLADE | I736: BASTIAN | L736: NEVILLE | O736: ? | R736: LANG
A737: BOX HILL | C737: LASKIE | F737: ? | I737: GOSPER | L737: MARINKO | O737: LAWTHER
A738: GOALKICKERS
A739: MORDIALLOC | C739: NEVILLE 9 | F739: NORRIS 6 | I739: McCARTHY ? | L739: ?? | N739: DINGLE 2 | P739: DEATON 2 | S739: ? 1
A740: BOX HILL | C740: LASKIE 4 | F740: ? 4 | I740: GORDON 3 | K740: DWYER 3 | M740: BRYANT | O740: ? 1 | Q740: McGUINNESS
A742: NORTHCOTE | C742: 9 | D742: 3 | E742: =C743*6+D743 -> 57 | G742: 14 | H742: 6 | I742: =G743*6+H743 -> 90 | K742: 19 | L742: 9 | M742: =K743*6+L743 -> 123 | O742: 24 | P742: 14 | Q742: =O743*6+P743 -> 158 | S742: YARRAVILLE
A743: YARRAVILLE | C743: 1 | D743: 2 | E743: =C744*6+D744 -> 8 | G743: 4 | H743: 6 | I743: =G744*6+H744 -> 30 | K743: 7 | L743: 11 | M743: =K744*6+L744 -> 53 | O743: 7 | P743: 16 | Q743: =O744*6+P744 -> 58 | S743: STABB
A744: BEST PLAYERS
A745: NORTHCOTE | C745: N ? | F745: McARDLE | I745: CHAPMAN | L745: LEE | N745: J ? | Q745: B ?
A746: YARRAVILLE | C746: GRACO | F746: EDWARDS | I746: SQUIRE | L746: DOLL | N746: RYAN | Q746: HA
A747: GOALKICKERS
A748: NORTHCOTE | C748: CHAPMAN 10 | F748: McORIST 4 | I748: TARGETT 2 | L748: BIENKE 2 | N748: JENKINS 2 | Q748: LEE | R748: NANKERVIS | V748: ? 1 | X748: G RYAN
A749: YARRAVILLE | C749: EDWARDS 2 | F749: WILSON 2 | I749: HARRISON | L749: B LEE | N749: SQUIRE
A751: SUNSHINE | C751: 6 | D751: 2 | E751: =C752*6+D752 -> 38 | G751: 11 | H751: 4 | I751: =G752*6+H752 -> 70 | K751: 12 | L751: 7 | M751: =K752*6+L752 -> 79 | O751: 16 | P751: 14 | Q751: =O752*6+P752 -> 110 | S751: SUNSHINE
A752: WERRIBEE | C752: 3 | D752: 4 | E752: =C753*6+D753 -> 22 | G752: 5 | H752: 6 | I752: =G753*6+H753 -> 36 | K752: 15 | L752: 10 | M752: =K753*6+L753 -> 100 | O752: 16 | P752: 12 | Q752: =O753*6+P753 -> 108 | S752: W BROWN
A753: BEST PLAYERS
A754: SUNSHINE | C754: ? | F754: PAXTON | I754: PIERCZAK | L754: FOREMAN | O754: ? | R754: MARTIN
A755: WERRIBEE | C755: MITCHELL | F755: ? | I755: KNIGHT | L755: BOURKE | N755: TUDOR
A756: GOALKICKERS
A757: SUNSHINE | C757: ? 4 | F757: FOREMAN 4 | I757: BRETT 4 | K757: JONES 3 | M757: DE ARRAUGO
A758: WERRIBEE | C758: MITCHELL 6 | F758: ? 4 | I758: SCHIELE 2 | K758: J BELLIN | M758: BOURKE | O758: ? 1 | Q758: WISE
A760: ROUND 17 | E760: 1ST AUGUST | J760: WEATHER | S760: PLAYED AT
D761: 1ST QTR | H761: 2ND QTR | L761: 3RD QTR | P761: FINAL | S761: NORTHCOTE
A762: WILLIAMSTOWN | C762: 10 | D762: 0 | E762: =C763*6+D763 -> 60 | G762: 12 | H762: 1 | I762: =G763*6+H763 -> 73 | K762: 14 | L762: 3 | M762: =K763*6+L763 -> 87 | O762: 16 | P762: 4 | Q762: =O763*6+P763 -> 100 | S762: UMPIRE | X762: LADDER | AB762: ROUND | AD762: 17
A763: NORTHCOTE | C763: 0 | D763: 2 | E763: =C764*6+D764 -> 2 | G763: 0 | H763: 12 | I763: =G764*6+H764 -> 12 | K763: 1 | L763: 16 | M763: =K764*6+L764 -> 22 | O763: 6 | P763: 21 | Q763: =O764*6+P764 -> 57 | S763: McGIBBON
A764: BEST PLAYERS | W764: TEAM | X764: W | Y764: L | Z764: D | AA764: FOR | AB764: AGST | AC764: % | AD764: PTS
A765: WILLIAMSTOWN | C765: TWEEDLY | F765: ALEXANDER | I765: BURGESS | L765: MAHONEY | O765: PORCEVINA | R765: CROSS
A766: NORTHCOTE | C766: McORIST | F766: STILSBY | I766: LEE | L766: ROBERTSON | O766: McINTYRE | W766: FRANKSTON | X766: 15 | Y766: 1 | Z766: 1 | AA766: 2233 | AB766: 1550 | AC766: =(AA767*100)/AB767 -> 144.06451612903226 | AD766: =(X767*4)+(Z767*2) -> 62
A767: GOALKICKERS | W767: MORDIALLOC | X767: 14 | Y767: 3 | Z767: 0 | AA767: 2491 | AB767: 1571 | AC767: =(AA768*100)/AB768 -> 158.56142584341183 | AD767: =(X768*4)+(Z768*2) -> 56
A768: WILLIAMSTOWN | C768: GARDINER 5 | F768: CROSS 3 | H768: HARLEY 2 | J768: BROWN 2 | L768: MILDENHALL 2 | O768: ALLEN | Q768: SMITH | W768: WILLIAMSTOWN | X768: 11 | Y768: 6 | Z768: 0 | AA768: 2173 | AB768: 1800 | AC768: =(AA769*100)/AB769 -> 120.72222222222223 | AD768: =(X769*4)+(Z769*2) -> 44
A769: NORTHCOTE | C769: McORIST 2 | F769: ROBERTSON | I769: JAMES | K769: JENKINS | M769: CHAPMAN | W769: NORTHCOTE | X769: 10 | Y769: 6 | Z769: 1 | AA769: 2085 | AB769: 1703 | AC769: =(AA770*100)/AB770 -> 122.43100411039342 | AD769: =(X770*4)+(Z770*2) -> 42
A771: CAMBERWELL | C771: 8 | D771: 8 | E771: =C772*6+D772 -> 56 | G771: 11 | H771: 15 | I771: =G772*6+H772 -> 81 | K771: 16 | L771: 16 | M771: =K772*6+L772 -> 112 | O771: 16 | P771: 19 | Q771: =O772*6+P772 -> 115 | S771: YARRAVILLE | W771: CAMBERWELL | X771: 10 | Y771: 7 | Z771: 0 | AA771: 2162 | AB771: 1984 | AC771: =(AA772*100)/AB772 -> 108.97177419354838 | AD771: =(X772*4)+(Z772*2) -> 40
A772: YARRAVILLE | C772: 0 | D772: 1 | E772: =C773*6+D773 -> 1 | G772: 2 | H772: 3 | I772: =G773*6+H773 -> 15 | K772: 5 | L772: 5 | M772: =K773*6+L773 -> 35 | O772: 8 | P772: 8 | Q772: =O773*6+P773 -> 56 | S772: FITZPATRICK | W772: WERRIBEE | X772: 7 | Y772: 10 | Z772: 0 | AA772: 1878 | AB772: 1981 | AC772: =(AA773*100)/AB773 -> 94.800605754669363 | AD772: =(X773*4)+(Z773*2) -> 28
A773: BEST PLAYERS | W773: BOX HILL | X773: 6 | Y773: 11 | Z773: 0 | AA773: 1740 | AB773: 2190 | AC773: =(AA774*100)/AB774 -> 79.452054794520549 | AD773: =(X774*4)+(Z774*2) -> 24
A774: CAMBERWELL | C774: BRAYNE | F774: LAWSON | I774: WATSON | L774: McCULLOCH | O774: SAUERBERG | R774: HAZLETT | W774: WAVERLEY | X774: 5 | Y774: 12 | Z774: 0 | AA774: 1737 | AB774: 2067 | AC774: =(AA775*100)/AB775 -> 84.034833091436866 | AD774: =(X775*4)+(Z775*2) -> 20
A775: YARRAVILLE | C775: DOLL | F775: McLAREN | I775: JONES | L775: GRACO | O775: B LEE | R775: EDWARDS | W775: SUNSHINE | X775: 5 | Y775: 12 | Z775: 0 | AA775: 1701 | AB775: 2072 | AC775: =(AA776*100)/AB776 -> 82.094594594594597 | AD775: =(X776*4)+(Z776*2) -> 20
A776: GOALKICKERS | W776: YARRAVILLE | X776: 1 | Y776: 16 | Z776: 0 | AA776: 1466 | AB776: 2750 | AC776: =(AA777*100)/AB777 -> 53.309090909090912 | AD776: =(X777*4)+(Z777*2) -> 4
A777: CAMBERWELL | C777: SMITH 4 | E777: SPITHILL 2 | G777: BOWDEN 2 | I777: K CURRAN 2 | L777: WATSON 2 | O777: HAMMOND 2 | R777: BROWN | T777: McCULLOCH
A778: YARRAVILLE | C778: PAGE 2 | E778: ALLEN 2 | H778: GREENEY | J778: HARRISON | M778: LOWE | O778: EDWARDS
A780: WERRIBEE | C780: 6 | D780: 8 | E780: =C781*6+D781 -> 44 | G780: 6 | H780: 8 | I780: =G781*6+H781 -> 44 | K780: 14 | L780: 12 | M780: =K781*6+L781 -> 96 | O780: 15 | P780: 13 | Q780: =O781*6+P781 -> 103 | S780: WERRIBEE
A781: MORDIALLOC | C781: 1 | D781: 2 | E781: =C782*6+D782 -> 8 | G781: 8 | H781: 8 | I781: =G782*6+H782 -> 56 | K781: 9 | L781: 10 | M781: =K782*6+L782 -> 64 | O781: 13 | P781: 14 | Q781: =O782*6+P782 -> 92 | S781: STEERE
A782: BEST PLAYERS
A783: WERRIBEE | C783: BOURKE | F783: DOUGLAS | I783: YOUNG | L783: MITCHELL | O783: EVANS | R783: HUDSON
A784: MORDIALLOC | C784: McCARTHY | F784: NORRIS | I784: WALSH | L784: DEATON | O784: K MOORE | R784: BASTIAN
A785: GOALKICKERS
A786: WERRIBEE | C786: SCHIELE 3 | E786: TUDOR 3 | G786: MITCHELL 2 | J786: EVANS 2 | L786: LYNCH | N786: COCKS | P786: HUDSON | R786: BOURKE | T786: YOUNG
A787: MORDIALLOC | C787: NEVILLE 4 | E787: NORRIS 3 | G787: WALSH 2 | I787: DEATON 2 | L787: K MOORE | N787: BLOOMFIELD
A789: FRANKSTON | C789: 3 | D789: 2 | E789: =C790*6+D790 -> 20 | G789: 7 | H789: 5 | I789: =G790*6+H790 -> 47 | K789: 10 | L789: 5 | M789: =K790*6+L790 -> 65 | O789: 12 | P789: 8 | Q789: =O790*6+P790 -> 80 | S789: BOX HILL
A790: BOX HILL | C790: 3 | D790: 2 | E790: =C791*6+D791 -> 20 | G790: 4 | H790: 5 | I790: =G791*6+H791 -> 29 | K790: 5 | L790: 6 | M790: =K791*6+L791 -> 36 | O790: 5 | P790: 6 | Q790: =O791*6+P791 -> 36 | S790: WENN
A791: BEST PLAYERS
A792: FRANKSTON | C792: DAVIES | F792: KENNEDY | I792: LEWIS | L792: LLOYD | O792: LOVELOCK | R792: KENDALL
A793: BOX HILL | C793: WILSON | F793: LAWTHER | I793: LASKIE | L793: TUCKWELL | O793: McGUINNESS
A794: GOALKICKERS
A795: FRANKSTON | C795: LOVELOCK 3 | F795: HOGAN 2 | H795: KENDALL 2 | K795: ELLIS | M795: THATCHER | O795: ADAMS | Q795: KENNEDY | S795: WARD
A796: BOX HILL | C796: GOSPER | E796: LASKIE | G796: LEHMANN | J796: WRIGHT | L796: BRYANT
A798: SUNSHINE | C798: 1 | D798: 3 | E798: =C799*6+D799 -> 9 | G798: 3 | H798: 5 | I798: =G799*6+H799 -> 23 | K798: 5 | L798: 10 | M798: =K799*6+L799 -> 40 | O798: 9 | P798: 12 | Q798: =O799*6+P799 -> 66 | S798: WAVERLEY
A799: WAVERLEY | C799: 1 | D799: 2 | E799: =C800*6+D800 -> 8 | G799: 4 | H799: 3 | I799: =G800*6+H800 -> 27 | K799: 4 | L799: 4 | M799: =K800*6+L800 -> 28 | O799: 5 | P799: 5 | Q799: =O800*6+P800 -> 35 | S799: O'BRIEN
A800: BEST PLAYERS
A801: SUNSHINE | C801: PAXTON | F801: MARTIN | I801: PIERCZAK | L801: BRETT | O801: DE ARRAUGO | R801: NUTTALL
A802: WAVERLEY | C802: COSTELLO | F802: KELAART | I802: HOLDSWORTH | L802: HANCOCK | O802: MILES | R802: CRAWFORD
A803: GOALKICKERS
A804: SUNSHINE | C804: MANDICS 4 | F804: RADZIMINSKI 2 | I804: NUTTALL | K804: FOREMAN | N804: BRETT
A805: WAVERLEY | C805: STYLES | E805: HAROLD | G805: COSTELLO | J805: KINNABURGH | M805: McKAY
A807: ROUND 18 | E807: 8TH AUGUST | J807: WEATHER | S807: PLAYED AT
D808: 1ST QTR | H808: 2ND QTR | L808: 3RD QTR | P808: FINAL | S808: CAMBERWELL
A809: NORTHCOTE | C809: 12 | D809: 6 | E809: =C810*6+D810 -> 78 | G809: 13 | H809: 11 | I809: =G810*6+H810 -> 89 | K809: 18 | L809: 12 | M809: =K810*6+L810 -> 120 | O809: 20 | P809: 20 | Q809: =O810*6+P810 -> 140 | S809: UMPIRE | X809: LADDER | AB809: ROUND | AD809: 18
A810: CAMBERWELL | C810: 2 | D810: 2 | E810: =C811*6+D811 -> 14 | G810: 7 | H810: 9 | I810: =G811*6+H811 -> 51 | K810: 9 | L810: 14 | M810: =K811*6+L811 -> 68 | O810: 14 | P810: 16 | Q810: =O811*6+P811 -> 100 | S810: STABB
A811: BEST PLAYERS | W811: TEAM | X811: W | Y811: L | Z811: D | AA811: FOR | AB811: AGST | AC811: % | AD811: PTS
A812: NORTHCOTE | C812: REDENBACH | F812: BUTTERWORTH | I812: JENKINS | L812: CHAPMAN | O812: ROBERTS | R812: McORIST
A813: CAMBERWELL | C813: McCULLOCH | F813: SMITH | I813: BRAYNE | L813: WATSON | O813: K CURRAN | R813: SAUERBERG | W813: FRANKSTON | X813: 16 | Y813: 1 | Z813: 1 | AA813: 2390 | AB813: 1665 | AC813: =(AA814*100)/AB814 -> 143.54354354354354 | AD813: =(X814*4)+(Z814*2) -> 66
A814: GOALKICKERS | W814: MORDIALLOC | X814: 14 | Y814: 4 | Z814: 0 | AA814: 2619 | AB814: 1728 | AC814: =(AA815*100)/AB815 -> 151.5625 | AD814: =(X815*4)+(Z815*2) -> 56
A815: NORTHCOTE | C815: CHAPMAN 7 | F815: ROBERTSON 4 | I815: McORIST 4 | K815: JENKINS 2 | N815: BIENKE | P815: LEE | Q815: STILSBY | W815: WILLIAMSTOWN | X815: 12 | Y815: 6 | Z815: 0 | AA815: 2375 | AB815: 1898 | AC815: =(AA816*100)/AB816 -> 125.13171759747102 | AD815: =(X816*4)+(Z816*2) -> 48
A816: CAMBERWELL | C816: SMITH 6 | E816: STOREY 2 | G816: WATSON 2 | I816: SAUERBERG 2 | L816: BOWDEN | N816: KENNEDY | W816: NORTHCOTE | X816: 11 | Y816: 6 | Z816: 1 | AA816: 2225 | AB816: 1803 | AC816: =(AA817*100)/AB817 -> 123.40543538546866 | AD816: =(X817*4)+(Z817*2) -> 46
A818: FRANKSTON | C818: 7 | D818: 1 | E818: =C819*6+D819 -> 43 | G818: 12 | H818: 5 | I818: =G819*6+H819 -> 77 | K818: 18 | L818: 12 | M818: =K819*6+L819 -> 120 | O818: 24 | P818: 13 | Q818: =O819*6+P819 -> 157 | S818: FRANKSTON | W818: CAMBERWELL | X818: 10 | Y818: 8 | Z818: 0 | AA818: 2262 | AB818: 2124 | AC818: =(AA819*100)/AB819 -> 106.49717514124293 | AD818: =(X819*4)+(Z819*2) -> 40
A819: WERRIBEE | C819: 5 | D819: 2 | E819: =C820*6+D820 -> 32 | G819: 9 | H819: 5 | I819: =G820*6+H820 -> 59 | K819: 11 | L819: 5 | M819: =K820*6+L820 -> 71 | O819: 18 | P819: 7 | Q819: =O820*6+P820 -> 115 | S819: OAKLEY | W819: WERRIBEE | X819: 7 | Y819: 11 | Z819: 0 | AA819: 1993 | AB819: 2138 | AC819: =(AA820*100)/AB820 -> 93.217960710944809 | AD819: =(X820*4)+(Z820*2) -> 28
A820: BEST PLAYERS | W820: SUNSHINE | X820: 6 | Y820: 12 | Z820: 0 | AA820: 1906 | AB820: 2164 | AC820: =(AA821*100)/AB821 -> 88.077634011090566 | AD820: =(X821*4)+(Z821*2) -> 24
A821: FRANKSTON | C821: KENNEDY | F821: SMALE | I821: WARD | L821: JOY | O821: LEWIS | R821: KENDALL | W821: WAVERLEY | X821: 6 | Y821: 12 | Z821: 0 | AA821: 1894 | AB821: 2195 | AC821: =(AA822*100)/AB822 -> 86.287015945330296 | AD821: =(X822*4)+(Z822*2) -> 24
A822: WERRIBEE | C822: LYNCH | F822: BOURKE | I822: YOUNG | L822: EVANS | O822: NEWMAN | R822: COCKS | W822: BOX HILL | X822: 6 | Y822: 12 | Z822: 0 | AA822: 1838 | AB822: 2392 | AC822: =(AA823*100)/AB823 -> 76.839464882943147 | AD822: =(X823*4)+(Z823*2) -> 24
A823: GOALKICKERS | O823: SMALE | Q823: DOCKING | W823: YARRAVILLE | X823: 1 | Y823: 17 | Z823: 0 | AA823: 1558 | AB823: 2955 | AC823: =(AA824*100)/AB824 -> 52.724196277495771 | AD823: =(X824*4)+(Z824*2) -> 4
A824: FRANKSTON | C824: LOVELOCK 6 | F824: STAPLETON 5 | I824: WARD 4 | K824: LOCCO 3 | M824: KENDALL | O824: CLARKE | Q824: LLOYD | S824: KENNEDY
A825: WERRIBEE | C825: LYNCH 6 | E825: SCHIELE 4 | G825: MITCHELL 3 | J825: EVANS | L825: TUDOR | N825: BOURKE | P825: COCKS | R825: WISE
A827: WILLIAMSTOWN | C827: 3 | D827: 3 | E827: =C828*6+D828 -> 21 | G827: 17 | H827: 8 | I827: =G828*6+H828 -> 110 | K827: 21 | L827: 15 | M827: =K828*6+L828 -> 141 | O827: 30 | P827: 22 | Q827: =O828*6+P828 -> 202 | S827: WILLIAMSTOWN
A828: BOX HILL | C828: 3 | D828: 5 | E828: =C829*6+D829 -> 23 | G828: 5 | H828: 7 | I828: =G829*6+H829 -> 37 | K828: 11 | L828: 11 | M828: =K829*6+L829 -> 77 | O828: 14 | P828: 14 | Q828: =O829*6+P829 -> 98 | S828: BROWN
A829: BEST PLAYERS
A830: WILLIAMSTOWN | C830: PERCY | F830: FANNING | I830: CROSS | L830: GARDINER | O830: LOWE | Q830: BURGESS
A831: BOX HILL | C831: BAKER | F831: LAWTHER | I831: BRYANT
A832: GOALKICKERS
A833: WILLIAMSTOWN | C833: BROWN 6 | F833: CROSS 6 | I833: GARDINER 5 | L833: BRINER 4 | N833: HARLEY 4 | Q833: PERCY 3 | S833: MILDENHALL 2
A834: BOX HILL | C834: BAKER 5 | F834: GORDON 3 | I834: TUCKWELL 2 | L834: BRYANT 2 | N834: LASKIE | P834: MIGHELL
A836: WAVERLEY | C836: 3 | D836: 2 | E836: =C837*6+D837 -> 20 | G836: 12 | H836: 4 | I836: =G837*6+H837 -> 76 | K836: 18 | L836: 6 | M836: =K837*6+L837 -> 114 | O836: 25 | P836: 7 | Q836: =O837*6+P837 -> 157 | S836: MORDIALLOC
A837: MORDIALLOC | C837: 3 | D837: 3 | E837: =C838*6+D838 -> 21 | G837: 10 | H837: 7 | I837: =G838*6+H838 -> 67 | K837: 12 | L837: 14 | M837: =K838*6+L838 -> 86 | O837: 18 | P837: 20 | Q837: =O838*6+P838 -> 128 | S837: McGIBBON
A838: BEST PLAYERS
A839: WAVERLEY | C839: STYLES | F839: G McLURE | I839: A McLURE | L839: COSTELLO | O839: HOLDSWORTH | R839: KINNABURGH
A840: MORDIALLOC | C840: NORRIS | F840: WALSH | I840: SLADE | L840: BLOOMFIELD | O840: GUY | Q840: JOHNSTONE
A841: GOALKICKERS
A842: WAVERLEY | C842: COSTELLO 6 | F842: McKAY 5 | H842: A McLURE 4 | K842: KINNABURGH 4 | N842: W MCDONALD 2 | R842: CRAWFORD 2 | U842: HAROLD 2
A843: MORDIALLOC | C843: NORRIS 6 | F843: NEVILLE 4 | I843: GRANT 2 | K843: JOHNSTONE 2 | N843: McCARTHY | Q843: WALSH | S843: DEATON | V843: GUY
A845: SUNSHINE | C845: 7 | D845: 4 | E845: =C846*6+D846 -> 46 | G845: 12 | H845: 10 | I845: =G846*6+H846 -> 82 | K845: 24 | L845: 15 | M845: =K846*6+L846 -> 159 | O845: 31 | P845: 19 | Q845: =O846*6+P846 -> 205 | S845: SUNSHINE
A846: YARRAVILLE | C846: 4 | D846: 2 | E846: =C847*6+D847 -> 26 | G846: 7 | H846: 7 | I846: =G847*6+H847 -> 49 | K846: 8 | L846: 9 | M846: =K847*6+L847 -> 57 | O846: 13 | P846: 14 | Q846: =O847*6+P847 -> 92 | S846: MARCY
A847: BEST PLAYERS
A848: SUNSHINE | C848: JONES | F848: BRETT | I848: FOREMAN | L848: DE ARRAUGO | O848: MANDICS | R848: PIERCZAK
A849: YARRAVILLE | C849: HARRISON | F849: GRACO | I849: SQUIRE | L849: MARTIN | O849: PAGE | R849: JONES
A850: GOALKICKERS
A851: SUNSHINE | C851: MANDICS 8 | F851: RADZIMINSKI 6 | I851: BAIRD 5 | K851: JONES 5 | M851: FOREMAN | O851: CLARKE | Q851: BENSON | S851: BOYD | U851: MARTIN
A852: YARRAVILLE | C852: PAGE 3 | F852: HARRISON 2 | I852: B LEE 2 | K852: MARTIN 2 | M852: GREENEY | O852: MCLAREN | Q852: LOWE | S852: ALLEN
A854: FINALS
A855: 1ST SEMI | E855: 15TH AUGUST | J855: WEATHER | S855: PLAYED AT
D856: 1ST QTR | H856: 2ND QTR | L856: 3RD QTR | P856: FINAL | S856: TOORAK PARK
A857: WILLIAMSTOWN | C857: 3 | D857: 3 | E857: =C858*6+D858 -> 21 | G857: 8 | H857: 10 | I857: =G858*6+H858 -> 58 | K857: 13 | L857: 12 | M857: =K858*6+L858 -> 90 | O857: 16 | P857: 20 | Q857: =O858*6+P858 -> 116 | S857: UMPIRE
A858: NORTHCOTE | C858: 5 | D858: 4 | E858: =C859*6+D859 -> 34 | G858: 7 | H858: 5 | I858: =G859*6+H859 -> 47 | K858: 14 | L858: 9 | M858: =K859*6+L859 -> 93 | O858: 17 | P858: 10 | Q858: =O859*6+P859 -> 112 | S858: McGIBBON
A859: BEST PLAYERS
A860: WILLIAMSTOWN | C860: LOWE | F860: ALEXANDER | I860: CROSS | L860: FANNING | O860: PERCY | R860: HARLEY
A861: NORTHCOTE | C861: McINTYRE | F861: BUTTERWORTH | I861: T ROBERTS | L861: LEE | O861: BIENKE | R861: REDENBACH
A862: GOALKICKERS
A863: WILLIAMSTOWN | C863: BROWN 5 | E863: HARLEY 5 | G863: GARDINER 2 | J863: ALLEN | L863: CROSS | N863: PERCY | P863: MAHONEY
A864: NORTHCOTE | C864: CHAPMAN 4 | F864: BUTTERWORTH 4 | J864: ROBERTSON 2 | M864: LEE 2 | O864: JENKINS 2 | Q864: G RYAN | S864: MCORIST | V864: BIENKE
A866: 2ND SEMI | E866: 22ND AUGUST | J866: WEATHER
A867: MORDIALLOC | C867: 5 | D867: 3 | E867: =C868*6+D868 -> 33 | G867: 9 | H867: 7 | I867: =G868*6+H868 -> 61 | K867: 14 | L867: 9 | M867: =K868*6+L868 -> 93 | O867: 17 | P867: 17 | Q867: =O868*6+P868 -> 119 | S867: TOORAK PARK
A868: FRANKSTON | C868: 5 | D868: 2 | E868: =C869*6+D869 -> 32 | G868: 8 | H868: 7 | I868: =G869*6+H869 -> 55 | K868: 12 | L868: 13 | M868: =K869*6+L869 -> 85 | O868: 13 | P868: 14 | Q868: =O869*6+P869 -> 92 | S868: MARCY
A869: BEST PLAYERS
A870: MORDIALLOC | C870: GUY | F870: WALSH | I870: BLOOMFIELD | L870: DEATON | O870: LANG | R870: ROSENOW
A871: FRANKSTON | C871: KENNEDY | F871: HENRICKSEN | I871: ESLER | L871: JOY | O871: LOVELOCK | R871: TICKELL
A872: GOALKICKERS
A873: MORDIALLOC | C873: NEVILLE 4 | E873: DEATON 3 | G873: GUY 2 | I873: SLADE 2 | K873: JOHNSTONE 2 | N873: NORRIS 2 | P873: WILLIAMSON | S873: BLOOMFIELD
A874: FRANKSTON | C874: LOVELOCK 3 | F874: KENNEDY 2 | I874: DOCKING 2 | K874: WARD | M874: HENRICKSEN | P874: CLARKE | R874: KENDALL | T874: SMALE | V874: LOCCO
A876: PRELIMINARY | E876: 29TH AUGUST | J876: WEATHER
A877: WILLIAMSTOWN | C877: 2 | D877: 6 | E877: =C878*6+D878 -> 18 | G877: 6 | H877: 10 | I877: =G878*6+H878 -> 46 | K877: 10 | L877: 12 | M877: =K878*6+L878 -> 72 | O877: 18 | P877: 12 | Q877: =O878*6+P878 -> 120 | S877: TOORAK PARK
A878: FRANKSTON | C878: 8 | D878: 3 | E878: =C879*6+D879 -> 51 | G878: 11 | H878: 6 | I878: =G879*6+H879 -> 72 | K878: 15 | L878: 11 | M878: =K879*6+L879 -> 101 | O878: 17 | P878: 16 | Q878: =O879*6+P879 -> 118 | S878: STABB
A879: BEST PLAYERS
A880: WILLIAMSTOWN | C880: LOWE | F880: PERCY | I880: FANNING | L880: MAHONEY | O880: CROSS | R880: PORCEVINA
A881: FRANKSTON | C881: HENRICKSEN | F881: ELLIS | I881: DAVIES | L881: KENDALL | O881: WARD | R881: KENNEDY
A882: GOALKICKERS
A883: WILLIAMSTOWN | C883: BOXALL 4 | E883: MAHONEY 4 | H883: MILDENHALL 2 | K883: CROSS 2 | M883: PERCY 2 | O883: ALEXANDER | R883: HARLEY | T883: GARDINER | W883: TWEEDLY
A884: FRANKSTON | C884: LOVELOCK 4 | F884: WARD 3 | H884: DAVIES 2 | J884: KENNEDY 2 | M884: CAYZER | O884: ELLIS | Q884: KENDALL | S884: SMALE | U884: STAPLETON | X884: FALKINER
A886: GRAND | E886: 5TH SEPTEMBER | J886: WEATHER
A887: WILLIAMSTOWN | C887: 2 | D887: 1 | E887: =C888*6+D888 -> 13 | G887: 8 | H887: 2 | I887: =G888*6+H888 -> 50 | K887: 13 | L887: 5 | M887: =K888*6+L888 -> 83 | O887: 19 | P887: 13 | Q887: =O888*6+P888 -> 127 | S887: TOORAK PARK
A888: MORDIALLOC | C888: 3 | D888: 4 | E888: =C889*6+D889 -> 22 | G888: 4 | H888: 10 | I888: =G889*6+H889 -> 34 | K888: 8 | L888: 12 | M888: =K889*6+L889 -> 60 | O888: 9 | P888: 16 | Q888: =O889*6+P889 -> 70 | S888: MARCY
A889: BEST PLAYERS
A890: WILLIAMSTOWN | C890: BOYD | F890: KERR | I890: PERCY | L890: FANNING | O890: BOXALL | R890: LOWE
A891: MORDIALLOC | C891: ROSENOW | F891: THOMPSON | I891: JOHNSTONE | L891: DEATON | O891: SLADE | R891: BASTIAN
A892: GOALKICKERS
A893: WILLIAMSTOWN | C893: BOXALL 7 | F893: MILDENHALL 3 | I893: MAHONEY 2 | L893: CROSS 2 | N893: GARDINER 2 | Q893: TWEEDLY | S893: HARLEY | U893: BROWN
A894: MORDIALLOC | C894: JOHNSTONE 3 | F894: WILLIAMSON 2 | I894: NORRIS 2 | K894: NEVILLE | M894: DEATON