A1: Victorian Football Association
A2: Season 1977 - Division One
A3: © Copyright Wal Williams | F3: First created: 28 July 2015
A4: Contact: joywalwi at gmail dot com | F4: Last updated: 28 July 2015 | W4: VFA Results and tables - Link to the main index page
A5: You are free to copy this document in whole or part provided that proper acknowledgement is given to the author. All rights reserved.
A7: 1977 V.F.A. | B7: SEASON 1ST | F7: DIVISION | CA7: \D | CB7: {GOTO}BJ3~/M{RIGHT 7}{END}{DOWN}~G4~
A8: ROUND 1 | E8: 3RD APRIL | J8: WEATHER | N8: WEST WIND FINE | S8: PLAYED AT | CB8: {GOTO}AL3~/M{END}{RIGHT}{END}{DOWN}~P3~
D9: 1ST QTR | H9: 2ND QTR | L9: 3RD QTR | P9: FINAL | S9: COBURG | CB9: {GOTO}BJ23~/M{RIGHT 7}{END}{DOWN}~V4~
A10: COBURG | C10: 5 | D10: 2 | E10: =C10*6+D10 -> 32 | G10: 9 | H10: 5 | I10: =G10*6+H10 -> 59 | K10: 13 | L10: 9 | M10: =K10*6+L10 -> 87 | O10: 15 | P10: 15 | Q10: =O10*6+P10 -> 105 | S10: UMPIRE | X10: LADDER | AB10: ROUND | AD10: 1 | CB10: {GOTO}BJ43~/M{RIGHT 7}{END}{DOWN}~G24~
A11: DANDENONG | C11: 1 | D11: 4 | E11: =C11*6+D11 -> 10 | G11: 4 | H11: 9 | I11: =G11*6+H11 -> 33 | K11: 7 | L11: 11 | M11: =K11*6+L11 -> 53 | O11: 10 | P11: 17 | Q11: =O11*6+P11 -> 77 | S11: O'BRIEN | CB11: {GOTO}AL23~/M{END}{RIGHT}{END}{DOWN}~P23~
A12: BEST PLAYERS | W12: TEAM | X12: W | Y12: L | Z12: D | AA12: FOR | AB12: AGST | AC12: % | AD12: PTS | CB12: {GOTO}BJ63~/M{RIGHT 7}{END}{DOWN}~V24~
A13: COBURG | D13: CLEARY | G13: PERRY | J13: STILLMAN | M13: PITT | P13: BURT | CB13: {GOTO}BJ83~/M{RIGHT 7}{END}{DOWN}~G44~
A14: DANDENONG | D14: THOMPSON | G14: HARPER | J14: HIBBERT | M14: VAN DE BEEK | P14: WRIGHT | W14: PORT MELBOURNE | X14: 1 | Y14: 0 | Z14: 0 | AA14: 159 | AB14: 98 | AC14: 162.24489795918367 | AD14: 4 | CB14: {GOTO}AL43~/M{END}{RIGHT}{END}{DOWN}~P43~
A15: GOALKICKERS | W15: PRAHRAN | X15: 1 | Y15: 0 | Z15: 0 | AA15: 131 | AB15: 96 | AC15: 136.45833333333334 | AD15: 4 | CB15: {GOTO}BJ103~/M{RIGHT 7}{END}{DOWN}~V44~
A16: COBURG | D16: HODGETTS 5 | G16: R HERBERT 2 | J16: PERRY 2 | L16: CLEARY 2 | N16: McDONALD | Q16: BURT | R16: DOHNT | T16: DOUGLAS | W16: COBURG | X16: 1 | Y16: 0 | Z16: 0 | AA16: 105 | AB16: 77 | AC16: 136.36363636363637 | AD16: 4 | CB16: {GOTO}BJ123~/M{RIGHT 7}{END}{DOWN}~G64~
A17: DANDENONG | D17: THOMPSON 4 | G17: McDONALD 2 | J17: WRIGHT | L17: MILLER | N17: LUKAS | P17: HIBBERT | W17: GEELONG WEST | X17: 1 | Y17: 0 | Z17: 0 | AA17: 100 | AB17: 84 | AC17: 119.04761904761905 | AD17: 4 | CB17: {GOTO}AL63~/M{END}{RIGHT}{END}{DOWN}~P63~
CB18: {GOTO}BJ143~/M{RIGHT 7}{END}{DOWN}~V64~
A19: PORT MELBOURNE | C19: 4 | D19: 3 | E19: =C19*6+D19 -> 27 | G19: 13 | H19: 9 | I19: =G19*6+H19 -> 87 | K19: 17 | L19: 12 | M19: =K19*6+L19 -> 114 | O19: 23 | P19: 21 | Q19: =O19*6+P19 -> 159 | S19: PORT MELBOURNE | W19: SANDRINGHAM | X19: 1 | Y19: 0 | Z19: 0 | AA19: 117 | AB19: 114 | AC19: 102.63157894736842 | AD19: 4 | CB19: {GOTO}BJ163~/M{RIGHT 7}{END}{DOWN}~G84~
A20: PRESTON | C20: 6 | D20: 3 | E20: =C20*6+D20 -> 39 | G20: 7 | H20: 6 | I20: =G20*6+H20 -> 48 | K20: 10 | L20: 10 | M20: =K20*6+L20 -> 70 | O20: 14 | P20: 14 | Q20: =O20*6+P20 -> 98 | S20: MARCY | W20: BRUNSWICK | X20: 0 | Y20: 1 | Z20: 0 | AA20: 114 | AB20: 117 | AC20: 97.435897435897431 | AD20: 0 | CB20: {GOTO}AL83~/M{END}{RIGHT}{END}{DOWN}~P83~
A21: BEST PLAYERS | W21: WILLIAMSTOWN | X21: 0 | Y21: 1 | Z21: 0 | AA21: 84 | AB21: 100 | AC21: 84 | AD21: 0 | CB21: {GOTO}BJ183~/M{RIGHT 7}{END}{DOWN}~V84~
A22: PORT MELBOURNE | D22: P GOSS | G22: AANENSEN | J22: PROFFIT | M22: CRITCH | P22: COOK | R22: K GOSS | W22: DANDENONG | X22: 0 | Y22: 1 | Z22: 0 | AA22: 77 | AB22: 105 | AC22: 73.333333333333329 | AD22: 0 | CB22: {GOTO}BJ203~/M{RIGHT 7}{END}{DOWN}~G104~
A23: PRESTON | D23: MARSHALL | G23: WILMOT | J23: WOOD | M23: DURWOOD | P23: LORENZINI | R23: BROWNE | W23: CAULFIELD | X23: 0 | Y23: 1 | Z23: 0 | AA23: 96 | AB23: 131 | AC23: 73.282442748091597 | AD23: 0 | CB23: {GOTO}AL103~/M{END}{RIGHT}{END}{DOWN}~P103~
A24: GOALKICKERS | W24: PRESTON | X24: 0 | Y24: 1 | Z24: 0 | AA24: 98 | AB24: 159 | AC24: 61.635220125786162 | AD24: 0 | CB24: {GOTO}BJ223~/M{RIGHT 7}{END}{DOWN}~V104~
A25: PORT MELBOURNE | D25: COOK 10 | F25: CHRISTOU 4 | I25: P GOSS 3 | K25: SWAN 2 | M25: BOND 2 | O25: WHARTON | Q25: BROWN | CB25: {GOTO}BJ243~/M{RIGHT 7}{END}{DOWN}~G124~
A26: PRESTON | D26: LORENZINI 3 | G26: WILMOT 3 | J26: MARSHALL 2 | M26: O'SULLIVAN 2 | P26: BROWNE 2 | R26: DURWOOD | U26: CARLSON | CB26: {GOTO}AL123~/M{END}{RIGHT}{END}{DOWN}~P123~
CB27: {GOTO}BJ263~/M{RIGHT 7}{END}{DOWN}~V124~
A28: PRAHRAN | C28: 2 | D28: 8 | E28: =C28*6+D28 -> 20 | G28: 6 | H28: 10 | I28: =G28*6+H28 -> 46 | K28: 11 | L28: 16 | M28: =K28*6+L28 -> 82 | O28: 18 | P28: 23 | Q28: =O28*6+P28 -> 131 | S28: TOORAK PARK | CB28: {GOTO}BJ283~/M{RIGHT 7}{END}{DOWN}~G144~
A29: CAULFIELD | C29: 4 | D29: 1 | E29: =C29*6+D29 -> 25 | G29: 9 | H29: 5 | I29: =G29*6+H29 -> 59 | K29: 11 | L29: 9 | M29: =K29*6+L29 -> 75 | O29: 14 | P29: 12 | Q29: =O29*6+P29 -> 96 | S29: FITZPATRICK | CB29: {GOTO}AL143~/M{END}{RIGHT}{END}{DOWN}~P143~
A30: BEST PLAYERS | CB30: {GOTO}BJ303~/M{RIGHT 7}{END}{DOWN}~V144~
A31: PRAHRAN | D31: JOHNSTON | G31: CLAY | J31: PEPE | M31: KELLY | O31: BRACHER | R31: KENT | CB31: {GOTO}BJ323~/M{RIGHT 7}{END}{DOWN}~G164~
A32: CAULFIELD | D32: CRUSE | G32: DAVIDSON | J32: O'SULLIVAN | M32: HAYWOOD | O32: HAWKING | R32: MAGUIRE | CB32: {GOTO}AL163~/M{END}{RIGHT}{END}{DOWN}~P163~
A33: GOALKICKERS | CB33: {GOTO}BJ343~/M{RIGHT 7}{END}{DOWN}~V164~
A34: PRAHRAN | D34: JOHNSTON 5 | G34: CLAY 3 | I34: RIPPON 3 | K34: ANDERSON 2 | N34: BRACHER 2 | Q34: AUSTIN | S34: PEPE | U34: THORNTON | CB34: {HOME}
A35: CAULFIELD | D35: O'SULLIVAN 4 | G35: BECK 2 | I35: HAYWOOD | K35: MAGUIRE | M35: DAVIDSON | O35: BROWN | Q35: CLIFF | R35: SUTHERLAND | U35: ROWE | W35: MILNER
A37: GEELONG WEST | C37: 1 | D37: 8 | E37: =C37*6+D37 -> 14 | G37: 3 | H37: 11 | I37: =G37*6+H37 -> 29 | K37: 9 | L37: 15 | M37: =K37*6+L37 -> 69 | O37: 13 | P37: 22 | Q37: =O37*6+P37 -> 100 | S37: GEELONG WEST
A38: WILLIAMSTOWN | C38: 3 | D38: 1 | E38: =C38*6+D38 -> 19 | G38: 7 | H38: 3 | I38: =G38*6+H38 -> 45 | K38: 9 | L38: 8 | M38: =K38*6+L38 -> 62 | O38: 12 | P38: 12 | Q38: =O38*6+P38 -> 84 | S38: WENN
A39: BEST PLAYERS
A40: GEELONG WEST | D40: RUSSELL | G40: YATES | J40: AYLMER | M40: EDDY | O40: BERRY | R40: STENNETT
A41: WILLIAMSTOWN | D41: GARDINER | G41: DIXON | J41: PORCEVINA | M41: COURTOT | O41: MAHONEY
A42: GOALKICKERS
A43: GEELONG WEST | D43: AYLMER 3 | G43: STENNETT 3 | J43: ROE 2 | L43: WOOLFE 2 | O43: WELLS | Q43: RADOJEVIC | T43: DEEATH
A44: WILLIAMSTOWN | D44: MAHONEY 4 | G44: BOXALL 2 | J44: DIXON | L44: GARDINER | O44: BROWN | Q44: ALEXANDER | T44: PERCY | V44: OLD
A46: SANDRINGHAM | C46: 4 | D46: 3 | E46: =C46*6+D46 -> 27 | G46: 6 | H46: 9 | I46: =G46*6+H46 -> 45 | K46: 12 | L46: 18 | M46: =K46*6+L46 -> 90 | O46: 16 | P46: 21 | Q46: =O46*6+P46 -> 117 | S46: BEACH ROAD
A47: BRUNSWICK | C47: 4 | D47: 4 | E47: =C47*6+D47 -> 28 | G47: 9 | H47: 8 | I47: =G47*6+H47 -> 62 | K47: 13 | L47: 9 | M47: =K47*6+L47 -> 87 | O47: 17 | P47: 12 | Q47: =O47*6+P47 -> 114 | S47: STABB
A48: BEST PLAYERS
A49: SANDRINGHAM | D49: CLARK | G49: PLEDGER | J49: CARROLL | M49: FRANKLIN | P49: McNICHOLAS
A50: BRUNSWICK | D50: JENKIN | G50: NOLAN | J50: DELEDIO | M50: STONE | P50: O'CALLAGHAN
A51: GOALKICKERS
A52: SANDRINGHAM | D52: GILES 5 | G52: SIMPSON 3 | J52: KENNEDY 2 | M52: PLEDGER 2 | P52: CARROLL 2 | S52: McCONNELL | V52: HUTCHINSON
A53: BRUNSWICK | D53: O'CALLAGHAN 3 | H53: JENKIN 3 | J53: ORTON 3 | M53: WARDEN 2 | P53: WILLIAMS 2 | S53: HALLEY | U53: STONE | W53: WEST | X53: LEWIS
A55: ROUND 2 | E55: 10TH APRIL | J55: WEATHER | N55: FINE | S55: PLAYED AT
D56: 1ST QTR | H56: 2ND QTR | L56: 3RD QTR | P56: FINAL | S56: BRUNSWICK
A57: BRUNSWICK | C57: 5 | D57: 7 | E57: =C57*6+D57 -> 37 | G57: 8 | H57: 14 | I57: =G57*6+H57 -> 62 | K57: 16 | L57: 16 | M57: =K57*6+L57 -> 112 | O57: 22 | P57: 19 | Q57: =O57*6+P57 -> 151 | S57: UMPIRE | X57: LADDER | AB57: ROUND | AD57: 2
A58: GEELONG WEST | C58: 3 | D58: 5 | E58: =C58*6+D58 -> 23 | G58: 10 | H58: 8 | I58: =G58*6+H58 -> 68 | K58: 13 | L58: 13 | M58: =K58*6+L58 -> 91 | O58: 17 | P58: 15 | Q58: =O58*6+P58 -> 117 | S58: O'BRIEN
A59: BEST PLAYERS | W59: TEAM | X59: W | Y59: L | Z59: D | AA59: FOR | AB59: AGST | AC59: % | AD59: PTS
A60: BRUNSWICK | D60: O'CALLAGHAN | G60: NOLAN | J60: JENKIN | M60: STONE | O60: GINGELL | Q60: WARDEN
A61: GEELONG WEST | D61: GILMORE | G61: WOOLFE | J61: RADOJEVIC | M61: EDDY | O61: FRIEND | Q61: CHAPMAN | W61: PORT MELBOURNE | X61: 2 | Y61: 0 | Z61: 0 | AA61: 305 | AB61: 219 | AC61: 139.26940639269407 | AD61: 8
A62: GOALKICKERS | O62: WEST | Q62: JENKIN | W62: COBURG | X62: 2 | Y62: 0 | Z62: 0 | AA62: 256 | AB62: 204 | AC62: 125.49019607843137 | AD62: 8
A63: BRUNSWICK | D63: WARDEN 5 | F63: WILLIAMS 4 | I63: ORTON 3 | K63: O'CALLAGHAN 2 | N63: STONE 2 | P63: HADZILLIAS 2 | S63: HALLEY | W63: SANDRINGHAM | X63: 2 | Y63: 0 | Z63: 0 | AA63: 248 | AB63: 227 | AC63: 109.25110132158591 | AD63: 8
A64: GEELONG WEST | D64: RADOJEVIC 7 | G64: WELLS 2 | I64: GILMORE 2 | L64: DEEATH 2 | N64: WOOLFE 2 | Q64: STENNETT | S64: ROE | W64: PRAHRAN | X64: 1 | Y64: 1 | Z64: 0 | AA64: 249 | AB64: 215 | AC64: 115.81395348837209 | AD64: 4
A66: WILLIAMSTOWN | C66: 4 | D66: 7 | E66: =C66*6+D66 -> 31 | G66: 9 | H66: 10 | I66: =G66*6+H66 -> 64 | K66: 13 | L66: 14 | M66: =K66*6+L66 -> 92 | O66: 17 | P66: 17 | Q66: =O66*6+P66 -> 119 | S66: WILLIAMSTOWN | W66: BRUNSWICK | X66: 1 | Y66: 1 | Z66: 0 | AA66: 265 | AB66: 234 | AC66: 113.24786324786325 | AD66: 4
A67: PRAHRAN | C67: 2 | D67: 2 | E67: =C67*6+D67 -> 14 | G67: 5 | H67: 5 | I67: =G67*6+H67 -> 35 | K67: 12 | L67: 14 | M67: =K67*6+L67 -> 86 | O67: 17 | P67: 16 | Q67: =O67*6+P67 -> 118 | S67: OGSTON | W67: WILLIAMSTOWN | X67: 1 | Y67: 1 | Z67: 0 | AA67: 203 | AB67: 218 | AC67: 93.11926605504587 | AD67: 4
A68: BEST PLAYERS | W68: GEELONG WEST | X68: 1 | Y68: 1 | Z68: 0 | AA68: 217 | AB68: 235 | AC68: 92.340425531914889 | AD68: 4
A69: WILLIAMSTOWN | D69: GARDNER | G69: FANNING | J69: ALLEN | M69: PORCEVINA | P69: CROSS | R69: POWLEY | W69: DANDENONG | X69: 0 | Y69: 2 | Z69: 0 | AA69: 190 | AB69: 236 | AC69: 80.508474576271183 | AD69: 0
A70: PRAHRAN | D70: AUSTIN | G70: BRACHER | J70: KELLY | M70: KENT | P70: HEVERIN | R70: CLAY | W70: CAULFIELD | X70: 0 | Y70: 2 | Z70: 0 | AA70: 217 | AB70: 277 | AC70: 78.33935018050542 | AD70: 0
A71: GOALKICKERS | N71: POTTER | P71: EDWARDS | R71: BROWN | W71: PRESTON | X71: 0 | Y71: 2 | Z71: 0 | AA71: 225 | AB71: 310 | AC71: 72.58064516129032 | AD71: 0
A72: WILLIAMSTOWN | D72: CROSS 4 | F72: BOXALL 3 | I72: GARDNER 3 | L72: BRINER | N72: POWLEY | P72: TOWNSEND | R72: MAHONEY
A73: PRAHRAN | D73: BRACHER 8 | G73: JOHNSTON 2 | J73: CLAY 2 | L73: AUSTIN | N73: PEPE | P73: RIPPON | R73: THORNTON | U73: KENT
A75: SANDRINGHAM | C75: 5 | D75: 6 | E75: =C75*6+D75 -> 36 | G75: 9 | H75: 11 | I75: =G75*6+H75 -> 65 | K75: 12 | L75: 18 | M75: =K75*6+L75 -> 90 | O75: 18 | P75: 23 | Q75: =O75*6+P75 -> 131 | S75: DANDENONG
A76: DANDENONG | C76: 5 | D76: 3 | E76: =C76*6+D76 -> 33 | G76: 9 | H76: 6 | I76: =G76*6+H76 -> 60 | K76: 15 | L76: 7 | M76: =K76*6+L76 -> 97 | O76: 17 | P76: 11 | Q76: =O76*6+P76 -> 113 | S76: STEERE
A77: BEST PLAYERS
A78: SANDRINGHAM | D78: COELLI | G78: HUTCHINSON | J78: FRANKLIN | M78: JONES | O78: CARROLL | R78: PLEDGER
A79: DANDENONG | D79: THOMPSON | G79: HARPER | J79: VAN DE BEEK | M79: HIBBERT | O79: WRIGHT
A80: GOALKICKERS
A81: SANDRINGHAM | D81: JONES 9 | G81: SIMPSON 2 | J81: CARROLL 2 | M81: O'BRIEN 2 | P81: HUTCHINSON | S81: PLEDGER | V81: FRANKLIN
A82: DANDENONG | D82: FLAHERTY 4 | G82: WRIGHT 4 | J82: MILLER 3 | M82: THOMPSON 2 | P82: HARRINGTON | S82: LUKAS | U82: BRIESE | W82: GOODES
A84: COBURG | C84: 10 | D84: 4 | E84: =C84*6+D84 -> 64 | G84: 13 | H84: 5 | I84: =G84*6+H84 -> 83 | K84: 18 | L84: 10 | M84: =K84*6+L84 -> 118 | O84: 23 | P84: 13 | Q84: =O84*6+P84 -> 151 | S84: PRESTON
A85: PRESTON | C85: 3 | D85: 3 | E85: =C85*6+D85 -> 21 | G85: 9 | H85: 9 | I85: =G85*6+H85 -> 63 | K85: 15 | L85: 10 | M85: =K85*6+L85 -> 100 | O85: 19 | P85: 13 | Q85: =O85*6+P85 -> 127 | S85: FITZPATRICK
A86: BEST PLAYERS
A87: COBURG | D87: CLEARY | G87: HODGETTS | J87: STILLMAN | M87: ROBERTSON | P87: DOHNT
A88: PRESTON | D88: MARSHALL | G88: STEWART | J88: O'SULLIVAN | M88: WOOD | P88: DURWOOD | S88: BROWNE
A89: GOALKICKERS
A90: COBURG | D90: HODGETTS 7 | G90: CLEARY 5 | I90: DOUGLAS 2 | L90: DOHNT 2 | N90: BURT 2 | P90: R HERBERT 2 | S90: ROBERTSON | V90: LLOYD | X90: WESCOMBE
A91: PRESTON | D91: BROWNE 4 | G91: RINGIN 3 | I91: WOOD 2 | K91: O'SULLIVAN 2 | N91: NEWTON 2 | Q91: DURWOOD 2 | T91: CARLSON 2 | W91: MARSHALL
A93: PORT MELBOURNE | C93: 6 | D93: 4 | E93: =C93*6+D93 -> 40 | G93: 11 | H93: 6 | I93: =G93*6+H93 -> 72 | K93: 17 | L93: 11 | M93: =K93*6+L93 -> 113 | O93: 21 | P93: 20 | Q93: =O93*6+P93 -> 146 | S93: PRINCES PARK
A94: CAULFIELD | C94: 5 | D94: 3 | E94: =C94*6+D94 -> 33 | G94: 12 | H94: 6 | I94: =G94*6+H94 -> 78 | K94: 15 | L94: 6 | M94: =K94*6+L94 -> 96 | O94: 18 | P94: 13 | Q94: =O94*6+P94 -> 121 | S94: STABB
A95: BEST PLAYERS
A96: PORT MELBOURNE | D96: K GOSS | G96: AANENSEN | J96: CRITCH | M96: MOLONEY | P96: P GOSS | S96: TINSLEY
A97: CAULFIELD | D97: HAYWOOD | G97: SIERAKOWSKI | J97: CRUSE | M97: TAYLOR | P97: WHITE | S97: MILNER
A98: GOALKICKERS
A99: PORT MELBOURNE | D99: COOK 6 | F99: P GOSS 4 | H99: MOLONEY 3 | K99: CHRISTOU 2 | N99: BOND 2 | P99: WHARTON 2 | S99: BROWN | U99: BECKWITH
A100: CAULFIELD | D100: MILNER 6 | G100: BECK 4 | I100: ROWE 3 | K100: TAYLOR 2 | M100: McMILLAN | P100: DAVIDSON | R100: O'SULLIVAN
A102: ROUND 3 | E102: 17TH APRIL | J102: WEATHER | N102: FINE | S102: PLAYED AT
D103: 1ST QTR | H103: 2ND QTR | L103: 3RD QTR | P103: FINAL | S103: TOORAK PARK
A104: BRUNSWICK | C104: 6 | D104: 2 | E104: =C104*6+D104 -> 38 | G104: 10 | H104: 6 | I104: =G104*6+H104 -> 66 | K104: 17 | L104: 11 | M104: =K104*6+L104 -> 113 | O104: 23 | P104: 16 | Q104: =O104*6+P104 -> 154 | S104: UMPIRE | X104: LADDER | AB104: ROUND | AD104: 3
A105: PRAHRAN | C105: 7 | D105: 1 | E105: =C105*6+D105 -> 43 | G105: 10 | H105: 11 | I105: =G105*6+H105 -> 71 | K105: 12 | L105: 14 | M105: =K105*6+L105 -> 86 | O105: 16 | P105: 18 | Q105: =O105*6+P105 -> 114 | S105: MARCY
A106: BEST PLAYERS | W106: TEAM | X106: W | Y106: L | Z106: D | AA106: FOR | AB106: AGST | AC106: % | AD106: PTS
A107: BRUNSWICK | D107: GINGELL | G107: NOLAN | J107: JENKIN | M107: WARDEN | P107: STONE | R107: WEST
A108: PRAHRAN | D108: AUSTIN | G108: CUNNINGHAM | J108: LEGH | M108: HEVERIN | P108: SMITH | R108: CLARKE | W108: PORT MELBOURNE | X108: 3 | Y108: 0 | Z108: 0 | AA108: 487 | AB108: 301 | AC108: 161.79401993355481 | AD108: 12
A109: GOALKICKERS | N109: WARDEN 2 | Q109: ORTON 2 | W109: COBURG | X109: 3 | Y109: 0 | Z109: 0 | AA109: 409 | AB109: 341 | AC109: 119.94134897360703 | AD109: 12
A110: BRUNSWICK | D110: HUGGARD 4 | G110: STONE 4 | I110: WEST 3 | K110: GINGELL 2 | M110: HADZILLIAS 2 | P110: HALLEY 2 | R110: JENKIN 2 | W110: BRUNSWICK | X110: 2 | Y110: 1 | Z110: 0 | AA110: 419 | AB110: 348 | AC110: 120.40229885057471 | AD110: 8
A111: PRAHRAN | D111: BRACHER 5 | G111: PEPE 2 | I111: AUSTIN 2 | K111: K SMITH 2 | N111: CLARKE | P111: JOHNSTON | R111: ANDERSON | U111: KENT | W111: GEELONG WEST | X111: 2 | Y111: 1 | Z111: 0 | AA111: 356 | AB111: 342 | AC111: 104.09 | AD111: 8
Q112: THORNTON
A113: GEELONG WEST | C113: 4 | D113: 6 | E113: =C113*6+D113 -> 30 | G113: 10 | H113: 13 | I113: =G113*6+H113 -> 73 | K113: 13 | L113: 21 | M113: =K113*6+L113 -> 99 | O113: 19 | P113: 25 | Q113: =O113*6+P113 -> 139 | S113: GEELONG WEST | W113: SANDRINGHAM | X113: 2 | Y113: 1 | Z113: 0 | AA113: 355 | AB113: 366 | AC113: 96.99 | AD113: 8
A114: SANDRINGHAM | C114: 3 | D114: 2 | E114: =C114*6+D114 -> 20 | G114: 9 | H114: 4 | I114: =G114*6+H114 -> 58 | K114: 15 | L114: 6 | M114: =K114*6+L114 -> 96 | O114: 16 | P114: 11 | Q114: =O114*6+P114 -> 107 | S114: TORNEY | W114: PRAHRAN | X114: 1 | Y114: 2 | Z114: 0 | AA114: 363 | AB114: 369 | AC114: 98.373983739837399 | AD114: 4
A115: BEST PLAYERS | W115: DANDENONG | X115: 1 | Y115: 2 | Z115: 0 | AA115: 283 | AB115: 324 | AC115: 87.345679012345684 | AD115: 4
A116: GEELONG WEST | D116: YATES | G116: WELLS | J116: RADOJEVIC | M116: GILMORE | P116: EDDY | R116: ROE | W116: WILLIAMSTOWN | X116: 1 | Y116: 2 | Z116: 0 | AA116: 285 | AB116: 400 | AC116: 71.25 | AD116: 4
A117: SANDRINGHAM | D117: WILKINS | G117: McNICHOLAS | J117: PLEDGER | M117: JONES | W117: CAULFIELD | X117: 0 | Y117: 3 | Z117: 0 | AA117: 354 | AB117: 430 | AC117: 82.325581395348834 | AD117: 0
A118: GOALKICKERS | W118: PRESTON | X118: 0 | Y118: 3 | Z118: 0 | AA118: 313 | AB118: 403 | AC118: 77.66749379652606 | AD118: 0
A119: GEELONG WEST | D119: RADOJEVIC 6 | G119: ROE 3 | I119: WELLS 3 | K119: STENNETT 2 | N119: GILMORE 2 | Q119: CHAPMAN | S119: DEEATH | U119: WOOLFE
A120: SANDRINGHAM | D120: JONES 5 | F120: PLEDGER 4 | I120: O'BRIEN 2 | K120: FRANKLIN | M120: CARROLL | O120: CLARK | Q120: GOOLD | S120: McCONNELL
A122: PORT MELBOURNE | C122: 6 | D122: 8 | E122: =C122*6+D122 -> 44 | G122: 13 | H122: 11 | I122: =G122*6+H122 -> 89 | K122: 19 | L122: 22 | M122: =K122*6+L122 -> 136 | O122: 25 | P122: 32 | Q122: =O122*6+P122 -> 182 | S122: PORT MELBOURNE
A123: WILLIAMSTOWN | C123: 5 | D123: 1 | E123: =C123*6+D123 -> 31 | G123: 6 | H123: 6 | I123: =G123*6+H123 -> 42 | K123: 7 | L123: 13 | M123: =K123*6+L123 -> 55 | O123: 11 | P123: 16 | Q123: =O123*6+P123 -> 82 | S123: STEERE
A124: BEST PLAYERS
A125: PORT MELBOURNE | D125: CHRISTOU | G125: P GOSS | J125: TINSLEY | M125: AANENSEN | P125: GREENING | S125: HOLT
A126: WILLIAMSTOWN | D126: LOWE | G126: POTTER | J126: GARDNER | M126: DIXON | P126: MAHONEY | S126: BOXALL
A127: GOALKICKERS
A128: PORT MELBOURNE | D128: COOK 7 | F128: HOLT 5 | H128: P GOSS 4 | J128: GREENING 2 | M128: BOND 2 | O128: CHRISTOU 2 | R128: K GOSS | T128: WHARTON | W128: G ALLEN
A129: WILLIAMSTOWN | D129: BOXALL 2 | G129: MAHONEY 2 | J129: BROWN 2 | M129: EDWARDS | O129: GARDNER | Q129: DIXON | S129: CROSS | U129: TOWNSEND
A131: DANDENONG | C131: 5 | D131: 2 | E131: =C131*6+D131 -> 32 | G131: 9 | H131: 4 | I131: =G131*6+H131 -> 58 | K131: 10 | L131: 10 | M131: =K131*6+L131 -> 70 | O131: 13 | P131: 15 | Q131: =O131*6+P131 -> 93 | S131: PRESTON
A132: PRESTON | C132: 4 | D132: 2 | E132: =C132*6+D132 -> 26 | G132: 8 | H132: 6 | I132: =G132*6+H132 -> 54 | K132: 10 | L132: 12 | M132: =K132*6+L132 -> 72 | O132: 12 | P132: 16 | Q132: =O132*6+P132 -> 88 | S132: OGSTON
A133: BEST PLAYERS
A134: DANDENONG | D134: FLAHERTY | G134: HARPER | J134: GOODES | M134: VAN DE BEEK | P134: THOMPSON | S134: REID
A135: PRESTON | D135: DUCKWORTH | G135: PREECE | J135: SALTMARSH | M135: DURWOOD | P135: BROWNE | S135: O'SULLIVAN
A136: GOALKICKERS
A137: DANDENONG | D137: FLAHERTY 4 | G137: TAYLOR 2 | J137: WRIGHT 2 | M137: ORCHARD | O137: HIBBERT | Q137: MILLER | S137: VAN DE BEEK | V137: GOODES
A138: PRESTON | D138: BROWNE 3 | G138: DURWOOD 3 | J138: MARSHALL | M138: NEWTON | O138: RENWICK | Q138: RINGIN | S138: JOLLY | U138: DUCKWORTH
A140: COBURG | C140: 6 | D140: 8 | E140: =C140*6+D140 -> 44 | G140: 11 | H140: 11 | I140: =G140*6+H140 -> 77 | K140: 14 | L140: 17 | M140: =K140*6+L140 -> 101 | O140: 22 | P140: 21 | Q140: =O140*6+P140 -> 153 | S140: COBURG
A141: CAULFIELD | C141: 6 | D141: 3 | E141: =C141*6+D141 -> 39 | G141: 12 | H141: 4 | I141: =G141*6+H141 -> 76 | K141: 18 | L141: 6 | M141: =K141*6+L141 -> 114 | O141: 21 | P141: 11 | Q141: =O141*6+P141 -> 137 | S141: WENN
A142: BEST PLAYERS
A143: COBURG | D143: R HERBERT | G143: STILLMAN | J143: DOHNT | M143: HODGETTS | P143: BURT
A144: CAULFIELD | D144: HAYWOOD | G144: DAVIDSON | J144: ROWE | M144: SUTHERLAND | P144: WHITE
A145: GOALKICKERS
A146: COBURG | D146: HODGETTS 7 | G146: CLEARY 4 | I146: HEADLAM 2 | L146: DOUGLAS 2 | O146: DOHNT 2 | Q146: BURT 2 | S146: R HERBERT | V146: R WESCOMBE
A147: CAULFIELD | D147: MILNER 5 | G147: ROWE 4 | I147: SUTHERLAND 4 | L147: DAVIDSON 3 | O147: BECK 2 | Q147: O'SULLIVAN | T147: HAYWOOD | W147: McMILLAN
A149: ROUND 4 | E149: 24TH APRIL | J149: WEATHER | N149: FINE | S149: PLAYED AT
D150: 1ST QTR | H150: 2ND QTR | L150: 3RD QTR | P150: FINAL | S150: BRUNSWICK
A151: BRUNSWICK | C151: 3 | D151: 3 | E151: =C151*6+D151 -> 21 | G151: 5 | H151: 5 | I151: =G151*6+H151 -> 35 | K151: 12 | L151: 11 | M151: =K151*6+L151 -> 83 | O151: 17 | P151: 17 | Q151: =O151*6+P151 -> 119 | S151: UMPIRE | X151: LADDER | AB151: ROUND | AD151: 4
A152: PORT MELBOURNE | C152: 8 | D152: 4 | E152: =C152*6+D152 -> 52 | G152: 9 | H152: 9 | I152: =G152*6+H152 -> 63 | K152: 10 | L152: 11 | M152: =K152*6+L152 -> 71 | O152: 10 | P152: 14 | Q152: =O152*6+P152 -> 74 | S152: FITZPATRICK
A153: BEST PLAYERS | W153: TEAM | X153: W | Y153: L | Z153: D | AA153: FOR | AB153: AGST | AC153: % | AD153: PTS
A154: BRUNSWICK | D154: HALLEY | G154: GINGELL | J154: JENKIN | M154: STONE | O154: NOLAN | Q154: WILLIAMS
A155: PORT MELBOURNE | D155: CRITCH | G155: K GOSS | J155: ALLEN | M155: OWEN | O155: PROFFIT | Q155: CHRISTOU | W155: COBURG | X155: 4 | Y155: 0 | Z155: 0 | AA155: 520 | AB155: 407 | AC155: 127.76412776412776 | AD155: 16
A156: GOALKICKERS | N156: JENKIN | Q156: GINGELL | W156: PORT MELBOURNE | X156: 3 | Y156: 1 | Z156: 0 | AA156: 561 | AB156: 420 | AC156: 133.57142857142858 | AD156: 12
A157: BRUNSWICK | D157: HALLEY 3 | F157: ORTON 3 | H157: WARDEN 2 | K157: STONE 2 | M157: HUGGARD 2 | P157: LAKER 2 | R157: O'CALLAGHAN | W157: BRUNSWICK | X157: 3 | Y157: 1 | Z157: 0 | AA157: 538 | AB157: 422 | AC157: 127.48815165876778 | AD157: 12
A158: PORT MELBOURNE | D158: COOK 3 | G158: CHRISTOU 3 | J158: P GOSS 2 | M158: HAENAN 2 | W158: SANDRINGHAM | X158: 3 | Y158: 1 | Z158: 0 | AA158: 494 | AB158: 466 | AC158: 106.01 | AD158: 12
A160: SANDRINGHAM | C160: 3 | D160: 4 | E160: =C160*6+D160 -> 22 | G160: 6 | H160: 9 | I160: =G160*6+H160 -> 45 | K160: 11 | L160: 14 | M160: =K160*6+L160 -> 80 | O160: 20 | P160: 19 | Q160: =O160*6+P160 -> 139 | S160: BEACH ROAD | W160: GEELONG WEST | X160: 3 | Y160: 1 | Z160: 0 | AA160: 460 | AB160: 438 | AC160: 105.02 | AD160: 12
A161: PRAHRAN | C161: 3 | D161: 1 | E161: =C161*6+D161 -> 19 | G161: 7 | H161: 4 | I161: =G161*6+H161 -> 46 | K161: 12 | L161: 7 | M161: =K161*6+L161 -> 79 | O161: 15 | P161: 10 | Q161: =O161*6+P161 -> 100 | S161: WENN | W161: CAULFIELD | X161: 1 | Y161: 3 | Z161: 0 | AA161: 504 | AB161: 552 | AC161: 91.304347826086953 | AD161: 4
A162: BEST PLAYERS | W162: PRAHRAN | X162: 1 | Y162: 3 | Z162: 0 | AA162: 463 | AB162: 508 | AC162: 91.141732283464563 | AD162: 4
A163: SANDRINGHAM | D163: HUTCHINSON | G163: WILKINS | J163: CARROLL | M163: O'BRIEN | O163: McCONNELL | W163: DANDENONG | X163: 1 | Y163: 3 | Z163: 0 | AA163: 379 | AB163: 428 | AC163: 88.55140186915888 | AD163: 4
A164: PRAHRAN | D164: AUSTIN | G164: RIPPON | J164: HYNES | M164: ZEMSKI | W164: WILLIAMSTOWN | X164: 1 | Y164: 3 | Z164: 0 | AA164: 351 | AB164: 511 | AC164: 68.688845401174163 | AD164: 4
A165: GOALKICKERS | P165: McCONNELL | S165: GOOLD | W165: PRESTON | X165: 0 | Y165: 4 | Z165: 0 | AA165: 435 | AB165: 553 | AC165: 78.661844484629299 | AD165: 0
A166: SANDRINGHAM | D166: HUTCHINSON 5 | G166: CARROLL 4 | J166: JONES 3 | L166: KENNEDY 2 | N166: PLEDGER 2 | Q166: WILKINS | S166: O'BRIEN
A167: PRAHRAN | D167: BRACHER 5 | G167: HYNES 4 | I167: SMITH | K167: AUSTIN | M167: ZEMSKI | O167: PEPE | Q167: THORNTON | T167: KENT
A169: GEELONG WEST | C169: 9 | D169: 3 | E169: =C169*6+D169 -> 57 | G169: 13 | H169: 4 | I169: =G169*6+H169 -> 82 | K169: 15 | L169: 6 | M169: =K169*6+L169 -> 96 | O169: 16 | P169: 8 | Q169: =O169*6+P169 -> 104 | S169: DANDENONG
A170: DANDENONG | C170: 4 | D170: 2 | E170: =C170*6+D170 -> 26 | G170: 7 | H170: 6 | I170: =G170*6+H170 -> 48 | K170: 11 | L170: 14 | M170: =K170*6+L170 -> 80 | O170: 13 | P170: 18 | Q170: =O170*6+P170 -> 96 | S170: STABB
A171: BEST PLAYERS
A172: GEELONG WEST | D172: FRIEND | G172: DEEATH | J172: CHAPMAN | M172: WOOLFE | P172: RADOJEVIC | S172: EDDY
A173: DANDENONG | D173: WRIGHT | G173: TAYLOR | J173: THOMPSON | M173: HARPER | P173: HIBBERT | S173: BRIESE
A174: GOALKICKERS
A175: GEELONG WEST | D175: RADOJEVIC 6 | G175: WOOLFE 4 | J175: ROE 2 | L175: STENNETT 2 | O175: RUSSELL | Q175: YATES
A176: DANDENONG | D176: TAYLOR 2 | G176: FLAHERTY 2 | J176: MILLER 2 | M176: WRIGHT 2 | P176: HORAZCKO | R176: BRIESE | T176: HARRINGTON | X176: HIBBERT | Z176: PAYZE
A178: CAULFIELD | C178: 4 | D178: 5 | E178: =C178*6+D178 -> 29 | G178: 11 | H178: 9 | I178: =G178*6+H178 -> 75 | K178: 16 | L178: 13 | M178: =K178*6+L178 -> 109 | O178: 22 | P178: 18 | Q178: =O178*6+P178 -> 150 | S178: PRINCES PARK
A179: PRESTON | C179: 6 | D179: 4 | E179: =C179*6+D179 -> 40 | G179: 9 | H179: 7 | I179: =G179*6+H179 -> 61 | K179: 14 | L179: 11 | M179: =K179*6+L179 -> 95 | O179: 18 | P179: 14 | Q179: =O179*6+P179 -> 122 | S179: O'BRIEN
A180: BEST PLAYERS
A181: CAULFIELD | D181: DAVIDSON | G181: EINSEDEL | J181: P FRIGO | M181: MILNER | P181: MAGUIRE | S181: CRUSE
A182: PRESTON | D182: DURWOOD | G182: SALTMARSH | J182: PREECE | M182: STEWART | P182: RYLES
A183: GOALKICKERS
A184: CAULFIELD | D184: MILNER 6 | F184: ROWE 4 | H184: CRUSE 3 | J184: BECK 2 | L184: DAVIDSON 2 | O184: O'SULLIVAN 2 | R184: EINSEDEL | U184: SUTHERLAND | X184: P FRIGO
A185: PRESTON | D185: WILMOT 4 | G185: STEWART 3 | J185: BROWNE 3 | M185: CARLSON 2 | P185: WOOD 2 | R185: MARSHALL | U185: DURWOOD | X185: GRELLET | AA185: RINGIN
A187: COBURG | C187: 5 | D187: 2 | E187: =C187*6+D187 -> 32 | G187: 10 | H187: 4 | I187: =G187*6+H187 -> 64 | K187: 13 | L187: 7 | M187: =K187*6+L187 -> 85 | O187: 17 | P187: 9 | Q187: =O187*6+P187 -> 111 | S187: WILLIAMSTOWN
A188: WILLIAMSTOWN | C188: 1 | D188: 1 | E188: =C188*6+D188 -> 7 | G188: 2 | H188: 6 | I188: =G188*6+H188 -> 18 | K188: 5 | L188: 9 | M188: =K188*6+L188 -> 39 | O188: 9 | P188: 12 | Q188: =O188*6+P188 -> 66 | S188: MARCY
A189: BEST PLAYERS
A190: COBURG | D190: BURT | G190: PITT | J190: PRICE | M190: HERBERT | P190: McMILLAN
A191: WILLIAMSTOWN | D191: GARDNER | G191: LOWE | J191: POTTER | M191: PERCY | P191: KERR
A192: GOALKICKERS
A193: COBURG | D193: CLEARY 3 | G193: HODGETTS 3 | J193: R HERBERT 3 | M193: DOUGLAS 2 | P193: DOHNT 2 | R193: HEADLAM | U193: BURT | W193: LLOYD | X193: McDONALD
A194: WILLIAMSTOWN | D194: WARD 2 | G194: MAHONEY 2 | J194: GARDNER | L194: CROSS | N194: DIXON | P194: LOWE | R194: HICKMAN
A196: ROUND 5 | E196: 1ST MAY | J196: WEATHER | N196: FINE | S196: PLAYED AT
D197: 1ST QTR | H197: 2ND QTR | L197: 3RD QTR | P197: FINAL | S197: COBURG
A198: COBURG | C198: 7 | D198: 6 | E198: =C198*6+D198 -> 48 | G198: 9 | H198: 8 | I198: =G198*6+H198 -> 62 | K198: 17 | L198: 17 | M198: =K198*6+L198 -> 119 | O198: 17 | P198: 20 | Q198: =O198*6+P198 -> 122 | S198: UMPIRE | X198: LADDER | AB198: ROUND | AD198: 5
A199: GEELONG WEST | C199: 1 | D199: 3 | E199: =C199*6+D199 -> 9 | G199: 4 | H199: 9 | I199: =G199*6+H199 -> 33 | K199: 6 | L199: 13 | M199: =K199*6+L199 -> 49 | O199: 13 | P199: 18 | Q199: =O199*6+P199 -> 96 | S199: STEERE
A200: BEST PLAYERS | W200: TEAM | X200: W | Y200: L | Z200: D | AA200: FOR | AB200: AGST | AC200: % | AD200: PTS
A201: COBURG | D201: DOHNT | F201: MANNIX | I201: ROBERTSON | L201: LLOYD | N201: R HERBERT | Q201: FORMOSA
A202: GEELONG WEST | D202: FRIEND | F202: YATES | I202: WOOLFE | L202: HINDSON | N202: CHAPMAN | Q202: DEEATH | W202: COBURG | X202: 5 | Y202: 0 | Z202: 0 | AA202: 642 | AB202: 503 | AC202: 127.63419483101391 | AD202: 20
A203: GOALKICKERS | W203: PORT MELBOURNE | X203: 4 | Y203: 1 | Z203: 0 | AA203: 726 | AB203: 505 | AC203: 143.76 | AD203: 16
A204: COBURG | D204: HODGETTS 5 | G204: DOHNT 4 | I204: LLOYD 3 | K204: ROBERTSON 2 | N204: DOUGLAS | P204: FORMOSA | R204: R HERBERT | W204: BRUNSWICK | X204: 4 | Y204: 1 | Z204: 0 | AA204: 663 | AB204: 537 | AC204: 123.46368715083798 | AD204: 16
A205: GEELONG WEST | D205: RADOJEVIC ( 4 | G205: WELLS 2 | I205: ROE 2 | K205: WOOLFE 2 | N205: ARKLAY | P205: STENNETT | R205: GILMORE | W205: SANDRINGHAM | X205: 4 | Y205: 1 | Z205: 0 | AA205: 658 | AB205: 571 | AC205: 115.24 | AD205: 16
A207: BRUNSWICK | C207: 3 | D207: 4 | E207: =C207*6+D207 -> 22 | G207: 9 | H207: 13 | I207: =G207*6+H207 -> 67 | K207: 13 | L207: 17 | M207: =K207*6+L207 -> 95 | O207: 17 | P207: 23 | Q207: =O207*6+P207 -> 125 | S207: PRINCES PARK | W207: GEELONG WEST | X207: 3 | Y207: 2 | Z207: 0 | AA207: 556 | AB207: 560 | AC207: 99.29 | AD207: 12
A208: CAULFIELD | C208: 7 | D208: 4 | E208: =C208*6+D208 -> 46 | G208: 9 | H208: 7 | I208: =G208*6+H208 -> 61 | K208: 15 | L208: 12 | M208: =K208*6+L208 -> 102 | O208: 16 | P208: 19 | Q208: =O208*6+P208 -> 115 | S208: TORNEY | W208: DANDENONG | X208: 2 | Y208: 3 | Z208: 0 | AA208: 537 | AB208: 507 | AC208: 105.91715976331361 | AD208: 8
A209: BEST PLAYERS | W209: CAULFIELD | X209: 1 | Y209: 4 | Z209: 0 | AA209: 619 | AB209: 677 | AC209: 91.432791728212706 | AD209: 4
A210: BRUNSWICK | D210: STONE | G210: NOLAN | I210: WEST | L210: WARDEN | N210: GINGELL | Q210: JENKIN | W210: PRAHRAN | X210: 1 | Y210: 4 | Z210: 0 | AA210: 548 | AB210: 673 | AC210: 81.43 | AD210: 4
A211: CAULFIELD | D211: DAVIDSON | G211: CRUSE | I211: HAYWOOD | L211: TEMPEST | N211: EINSEDEL | Q211: ROWE | W211: WILLIAMSTOWN | X211: 1 | Y211: 4 | Z211: 0 | AA211: 430 | AB211: 669 | AC211: 64.275037369207766 | AD211: 4
A212: GOALKICKERS | W212: PRESTON | X212: 0 | Y212: 5 | Z212: 0 | AA212: 540 | AB212: 717 | AC212: 75.313807531380746 | AD212: 0
A213: BRUNSWICK | D213: STONE 7 | F213: ORTON 4 | H213: HADZILLIAS | K213: HATLEY | M213: WILLIAMS | O213: WEST | Q213: O'CALLAGHAN | T213: CARLTON
A214: CAULFIELD | D214: DAVIDSON 5 | G214: ROWE 4 | I214: BECK 3 | K214: O'SULLIVAN 2 | N214: CRUSE | P214: MILNER
A216: PORT MELBOURNE | C216: 4 | D216: 4 | E216: =C216*6+D216 -> 28 | G216: 8 | H216: 8 | I216: =G216*6+H216 -> 56 | K216: 16 | L216: 13 | M216: =K216*6+L216 -> 109 | O216: 24 | P216: 21 | Q216: =O216*6+P216 -> 165 | S216: PORT MELBOURNE
A217: PRAHRAN | C217: 1 | D217: 4 | E217: =C217*6+D217 -> 10 | G217: 5 | H217: 9 | I217: =G217*6+H217 -> 39 | K217: 8 | L217: 13 | M217: =K217*6+L217 -> 61 | O217: 11 | P217: 19 | Q217: =O217*6+P217 -> 85 | S217: OGSTON
A218: BEST PLAYERS
A219: PORT MELBOURNE | D219: CRITCH | G219: HAENAN | J219: K GOSS | M219: TINSLEY | P219: ALLEN | R219: GREENING
A220: PRAHRAN | D220: KELLY | G220: RIPPON | J220: AUSTIN | M220: SMITH | P220: CLAY | R220: JOHNSTON
A221: GOALKICKERS
A222: PORT MELBOURNE | D222: COOK 8 | F222: HOLT 4 | H222: ALLEN 4 | J222: P GOSS 3 | M222: BOND | O222: K GOSS | Q222: ANDERSON | S222: RASMUSSEN | W222: CRITCH | Y222: EVANS
A223: PRAHRAN | D223: SMITH 3 | G223: CLAY 2 | I223: HYNES 2 | K223: JOHNSTON | M223: PEPE | O223: RIPPON | Q223: AUSTIN
A225: DANDENONG | C225: 3 | D225: 8 | E225: =C225*6+D225 -> 26 | G225: 9 | H225: 16 | I225: =G225*6+H225 -> 70 | K225: 14 | L225: 22 | M225: =K225*6+L225 -> 106 | O225: 21 | P225: 32 | Q225: =O225*6+P225 -> 158 | S225: DANDENONG
A226: WILLIAMSTOWN | C226: 3 | D226: 1 | E226: =C226*6+D226 -> 19 | G226: 4 | H226: 3 | I226: =G226*6+H226 -> 27 | K226: 10 | L226: 6 | M226: =K226*6+L226 -> 66 | O226: 12 | P226: 7 | Q226: =O226*6+P226 -> 79 | S226: FITZPATRICK
A227: BEST PLAYERS
A228: DANDENONG | D228: HIBBERT | G228: FLAHERTY | J228: SHINNERS | M228: TAYLOR | P228: BRIESE | R228: HARPER
A229: WILLIAMSTOWN | D229: LOWE | G229: BRINER | J229: PORCEVINA | M229: ALLEN | P229: CROSS | R229: PERCY
A230: GOALKICKERS
A231: DANDENONG | D231: WRIGHT 5 | F231: FLAHERTY 5 | I231: HIBBERT 3 | L231: BRIESE 2 | N231: SHEVLIN 2 | Q231: PAYZE 2 | S231: TAYLOR | U231: LYNN
A232: WILLIAMSTOWN | D232: BRINER 5 | F232: GARDNER 2 | I232: LOWE | K232: MAHONEY | M232: DONNELLY | O232: CROSS | Q232: HICKMAN
A234: SANDRINGHAM | C234: 7 | D234: 1 | E234: =C234*6+D234 -> 43 | G234: 14 | H234: 9 | I234: =G234*6+H234 -> 93 | K234: 19 | L234: 15 | M234: =K234*6+L234 -> 129 | O234: 24 | P234: 20 | Q234: =O234*6+P234 -> 164 | S234: PRESTON
A235: PRESTON | C235: 7 | D235: 1 | E235: =C235*6+D235 -> 43 | G235: 10 | H235: 4 | I235: =G235*6+H235 -> 64 | K235: 12 | L235: 7 | M235: =K235*6+L235 -> 79 | O235: 16 | P235: 9 | Q235: =O235*6+P235 -> 105 | S235: McBAIN
A236: BEST PLAYERS
A237: SANDRINGHAM | D237: CARROLL | G237: HUTCHINSON | J237: GOOLD | M237: KENNEDY | P237: COELLI | R237: CLARK
A238: PRESTON | D238: WILMOT | G238: PREECE | J238: STEWART | M238: DOUGLAS | P238: CROXFORD
A239: GOALKICKERS
A240: SANDRINGHAM | D240: HUTCHINSON 6 | G240: JONES 4 | I240: KENNEDY 4 | L240: CARROLL 3 | O240: PLEDGER 2 | R240: BEUS | T240: PETERS | V240: O'BRIEN | X240: FRANKLIN | AA240: CLARK
A241: PRESTON | D241: WILMOT 4 | G241: O'SULLIVAN 3 | J241: PODGER 3 | M241: THOMPSON 2 | P241: MARSHALL 2 | S241: STEWART | V241: GRELLET
A243: ROUND 6 | E243: 8TH MAY | J243: WEATHER | N243: NORTH WIND | S243: PLAYED AT
D244: 1ST QTR | H244: 2ND QTR | L244: 3RD QTR | P244: FINAL | S244: PORT MELBOURNE
A245: PORT MELBOURNE | C245: 3 | D245: 3 | E245: =C245*6+D245 -> 21 | G245: 8 | H245: 7 | I245: =G245*6+H245 -> 55 | K245: 13 | L245: 11 | M245: =K245*6+L245 -> 89 | O245: 17 | P245: 16 | Q245: =O245*6+P245 -> 118 | S245: UMPIRE | X245: LADDER | AB245: ROUND | AD245: 6
A246: DANDENONG | C246: 2 | D246: 0 | E246: =C246*6+D246 -> 12 | G246: 6 | H246: 4 | I246: =G246*6+H246 -> 40 | K246: 9 | L246: 9 | M246: =K246*6+L246 -> 63 | O246: 12 | P246: 13 | Q246: =O246*6+P246 -> 85 | S246: O'BRIEN
A247: BEST PLAYERS | W247: TEAM | X247: W | Y247: L | Z247: D | AA247: FOR | AB247: AGST | AC247: % | AD247: PTS
A248: PORT MELBOURNE | D248: CHRISTOU | G248: ANDERSON | J248: IVANOFF | M248: SWAN | O248: GREENING | R248: AANENSEN
A249: DANDENONG | D249: HARPER | G249: THOMPSON | J249: SHINNERS | M249: FLAHERTY | O249: VAN DE BEEK | R249: HIBBERT | W249: COBURG | X249: 6 | Y249: 0 | Z249: 0 | AA249: 768 | AB249: 607 | AC249: 126.52388797364085 | AD249: 24
A250: GOALKICKERS | Q250: HAENAN | W250: PORT MELBOURNE | X250: 5 | Y250: 1 | Z250: 0 | AA250: 844 | AB250: 590 | AC250: 143.05 | AD250: 20
A251: PORT MELBOURNE | D251: COOK 5 | F251: CHRISTOU 3 | I251: P GOSS 2 | K251: RASMUSSEN 2 | N251: HOLT 2 | P251: AANENSEN | R251: CRITCH | W251: BRUNSWICK | X251: 5 | Y251: 1 | Z251: 0 | AA251: 795 | AB251: 644 | AC251: 123.44720496894411 | AD251: 20
A252: DANDENONG | D252: FLAHERTY 3 | G252: SHEVLIN 2 | J252: PAYZE 2 | L252: WRIGHT 2 | N252: BRIESE | P252: TAYLOR | R252: LYNN | W252: SANDRINGHAM | X252: 5 | Y252: 1 | Z252: 0 | AA252: 773 | AB252: 679 | AC252: 113.84 | AD252: 20
A254: SANDRINGHAM | C254: 3 | D254: 2 | E254: =C254*6+D254 -> 20 | G254: 10 | H254: 8 | I254: =G254*6+H254 -> 68 | K254: 10 | L254: 13 | M254: =K254*6+L254 -> 73 | O254: 16 | P254: 19 | Q254: =O254*6+P254 -> 115 | S254: BEACH ROAD | W254: GEELONG WEST | X254: 4 | Y254: 2 | Z254: 0 | AA254: 744 | AB254: 640 | AC254: 116.25 | AD254: 16
A255: CAULFIELD | C255: 4 | D255: 7 | E255: =C255*6+D255 -> 31 | G255: 6 | H255: 9 | I255: =G255*6+H255 -> 45 | K255: 11 | L255: 16 | M255: =K255*6+L255 -> 82 | O255: 15 | P255: 18 | Q255: =O255*6+P255 -> 108 | S255: STABB | W255: DANDENONG | X255: 2 | Y255: 4 | Z255: 0 | AA255: 622 | AB255: 625 | AC255: 99.52 | AD255: 8
A256: BEST PLAYERS | W256: CAULFIELD | X256: 1 | Y256: 5 | Z256: 0 | AA256: 727 | AB256: 792 | AC256: 91.792929292929287 | AD256: 4
A257: SANDRINGHAM | D257: McNICHOLAS | G257: PLEDGER | I257: COELLI | L257: GOOLD | N257: EDWARDS | Q257: FRANKLIN | W257: PRAHRAN | X257: 1 | Y257: 5 | Z257: 0 | AA257: 652 | AB257: 799 | AC257: 81.6 | AD257: 4
A258: CAULFIELD | D258: O'SULLIVAN | G258: CLIFF | I258: SIERAKOWSKI | L258: DAVIDSON | N258: CRUSE | Q258: EINSEDEL | W258: WILLIAMSTOWN | X258: 1 | Y258: 5 | Z258: 0 | AA258: 537 | AB258: 801 | AC258: 67.041198501872657 | AD258: 4
A259: GOALKICKERS | Q259: O'BRIEN | W259: PRESTON | X259: 0 | Y259: 6 | Z259: 0 | AA259: 620 | AB259: 905 | AC259: 68.508287292817684 | AD259: 0
A260: SANDRINGHAM | D260: HUTCHINSON 4 | G260: SIMS 3 | I260: BEUS 3 | K260: CLARK | M260: PETERS | O260: KENNEDY | Q260: PLEDGER | S260: McNICHOLAS
A261: CAULFIELD | D261: O'SULLIVAN 6 | G261: MAGUIRE 2 | J261: DAVIDSON | M261: CLIFF | N261: BOOTH | P261: CRUSE | R261: RUSS | T261: ALLAN | V261: MILNER
A263: GEELONG WEST | C263: 3 | D263: 2 | E263: =C263*6+D263 -> 20 | G263: 11 | H263: 5 | I263: =G263*6+H263 -> 71 | K263: 19 | L263: 7 | M263: =K263*6+L263 -> 121 | O263: 29 | P263: 14 | Q263: =O263*6+P263 -> 188 | S263: GEELONG WEST
A264: PRESTON | C264: 5 | D264: 3 | E264: =C264*6+D264 -> 33 | G264: 7 | H264: 8 | I264: =G264*6+H264 -> 50 | K264: 10 | L264: 10 | M264: =K264*6+L264 -> 70 | O264: 11 | P264: 14 | Q264: =O264*6+P264 -> 80 | S264: WENN
A265: BEST PLAYERS
A266: GEELONG WEST | D266: RADOJEVIC | G266: DEEATH | J266: RUSSELL | M266: FRIEND | P266: CHAPMAN | S266: VILLAROSA
A267: PRESTON | D267: PREECE | G267: STEWART | J267: SALTMARSH | M267: WOOD | P267: McKEON | S267: CROXFORD
A268: GOALKICKERS
A269: GEELONG WEST | D269: RADOJEVIC 12 | G269: G WELLS 5 | J269: WOOLFE 5 | M269: GILMORE 3 | P269: DEEATH 3 | R269: ARKLAY
A270: PRESTON | D270: STEWART 4 | G270: BROWNE 3 | J270: McKEON | L270: MARSHALL | O270: WOOD
A272: BRUNSWICK | C272: 6 | D272: 5 | E272: =C272*6+D272 -> 41 | G272: 11 | H272: 8 | I272: =G272*6+H272 -> 74 | K272: 13 | L272: 16 | M272: =K272*6+L272 -> 94 | O272: 19 | P272: 18 | Q272: =O272*6+P272 -> 132 | S272: BRUNSWICK
A273: WILLIAMSTOWN | C273: 1 | D273: 3 | E273: =C273*6+D273 -> 9 | G273: 6 | H273: 7 | I273: =G273*6+H273 -> 43 | K273: 10 | L273: 13 | M273: =K273*6+L273 -> 73 | O273: 15 | P273: 17 | Q273: =O273*6+P273 -> 107 | S273: OGSTON
A274: BEST PLAYERS
A275: BRUNSWICK | D275: GINGELL | G275: STONE | I275: WEST | L275: BUCKLEY | N275: NOLAN | Q275: WARDEN
A276: WILLIAMSTOWN | D276: TWEEDLY | G276: LOWE | I276: PORCEVINA | L276: CROSS | N276: HICKMAN | Q276: KERR
A277: GOALKICKERS
A278: BRUNSWICK | D278: WARDEN 5 | G278: ORTON 4 | I278: GINGELL 4 | L278: HALLEY | N278: BUCKLEY | P278: HUGGARD | R278: STONE | T278: LAKER | V278: O'CALLAGHAN
A279: WILLIAMSTOWN | D279: LOWE 4 | G279: GARDNER 3 | J279: TWEEDLY 3 | M279: CROSS 3 | O279: BRINER | Q279: KENNEDY
A281: COBURG | C281: 3 | D281: 2 | E281: =C281*6+D281 -> 20 | G281: 6 | H281: 8 | I281: =G281*6+H281 -> 44 | K281: 11 | L281: 11 | M281: =K281*6+L281 -> 77 | O281: 18 | P281: 18 | Q281: =O281*6+P281 -> 126 | S281: TOORAK PARK
A282: PRAHRAN | C282: 7 | D282: 7 | E282: =C282*6+D282 -> 49 | G282: 10 | H282: 10 | I282: =G282*6+H282 -> 70 | K282: 13 | L282: 14 | M282: =K282*6+L282 -> 92 | O282: 15 | P282: 14 | Q282: =O282*6+P282 -> 104 | S282: FITZPATRICK
A283: BEST PLAYERS
A284: COBURG | D284: HODGETTS | G284: McDONALD | J284: DOUGLAS | M284: ROBERTSON | P284: DOHNT
A285: PRAHRAN | D285: KENT | G285: DOWELL | J285: SMITH | M285: KELLY | P285: RIPPON | S285: WILKIE
A286: GOALKICKERS
A287: COBURG | D287: HODGETTS 8 | G287: DOHNT 2 | I287: R HERBERT 2 | L287: HEADLAM | N287: ROBERTSON | Q287: FORMOSA | S287: McDONALD | V287: STILLMAN | X287: SCHOLES
A288: PRAHRAN | D288: SMITH 6 | G288: KENT 3 | I288: THORNTON 2 | L288: CLAY | N288: BRACHER | Q288: HYNES | S288: ANDERSON
A290: ROUND 7 | E290: 15TH MAY | J290: WEATHER | N290: SOUTH EAST WIND FINE | S290: PLAYED AT
D291: 1ST QTR | H291: 2ND QTR | L291: 3RD QTR | P291: FINAL | S291: COBURG
A292: PORT MELBOURNE | C292: 3 | D292: 8 | E292: =C292*6+D292 -> 26 | G292: 9 | H292: 16 | I292: =G292*6+H292 -> 70 | K292: 14 | L292: 18 | M292: =K292*6+L292 -> 102 | O292: 16 | P292: 26 | Q292: =O292*6+P292 -> 122 | S292: UMPIRE | X292: LADDER | AB292: ROUND | AD292: 7
A293: COBURG | C293: 2 | D293: 2 | E293: =C293*6+D293 -> 14 | G293: 4 | H293: 5 | I293: =G293*6+H293 -> 29 | K293: 7 | L293: 9 | M293: =K293*6+L293 -> 51 | O293: 10 | P293: 12 | Q293: =O293*6+P293 -> 72 | S293: STABB
A294: BEST PLAYERS | W294: TEAM | X294: W | Y294: L | Z294: D | AA294: FOR | AB294: AGST | AC294: % | AD294: PTS
A295: PORT MELBOURNE | D295: AANENSEN | G295: SWAN | J295: GREENING | M295: IVANOFF | O295: RASMUSSEN | R295: HARLAND
A296: COBURG | D296: DOHNT | G296: HERBERT | J296: ROBERTSON | M296: PRICE | O296: MANNIX | R296: LLOYD | W296: PORT MELBOURNE | X296: 6 | Y296: 1 | Z296: 0 | AA296: 966 | AB296: 662 | AC296: 145.92 | AD296: 24
A297: GOALKICKERS | W297: COBURG | X297: 6 | Y297: 1 | Z297: 0 | AA297: 840 | AB297: 729 | AC297: 115.22633744855968 | AD297: 24
A298: PORT MELBOURNE | D298: COOK 7 | G298: RASMUSSEN 3 | J298: EVANS 2 | M298: HAENAN 2 | P298: CHRISTOU | R298: HOLT | W298: SANDRINGHAM | X298: 6 | Y298: 1 | Z298: 0 | AA298: 878 | AB298: 780 | AC298: 112.56 | AD298: 24
A299: COBURG | D299: HODGETTS 4 | G299: CLEARY 2 | J299: McDONALD 2 | M299: MANNIX | O299: STILLMAN | W299: BRUNSWICK | X299: 5 | Y299: 2 | Z299: 0 | AA299: 848 | AB299: 765 | AC299: 110.84967320261438 | AD299: 20
A301: DANDENONG | C301: 4 | D301: 1 | E301: =C301*6+D301 -> 25 | G301: 9 | H301: 6 | I301: =G301*6+H301 -> 60 | K301: 10 | L301: 9 | M301: =K301*6+L301 -> 69 | O301: 18 | P301: 13 | Q301: =O301*6+P301 -> 121 | S301: DANDENONG | W301: GEELONG WEST | X301: 4 | Y301: 3 | Z301: 0 | AA301: 857 | AB301: 797 | AC301: 107.53 | AD301: 16
A302: BRUNSWICK | C302: 2 | D302: 2 | E302: =C302*6+D302 -> 14 | G302: 2 | H302: 2 | I302: =G302*6+H302 -> 14 | K302: 5 | L302: 9 | M302: =K302*6+L302 -> 39 | O302: 7 | P302: 11 | Q302: =O302*6+P302 -> 53 | S302: WENN | W302: DANDENONG | X302: 3 | Y302: 4 | Z302: 0 | AA302: 743 | AB302: 678 | AC302: 109.58702064896755 | AD302: 12
A303: BEST PLAYERS | W303: CAULFIELD | X303: 2 | Y303: 5 | Z303: 0 | AA303: 884 | AB303: 905 | AC303: 97.679558011049721 | AD303: 8
A304: DANDENONG | D304: BRIESE | F304: HIBBERT | I304: THOMPSON | L304: TAYLOR | O304: VAN DE BEEK | R304: HARPER | W304: PRAHRAN | X304: 2 | Y304: 5 | Z304: 0 | AA304: 766 | AB304: 896 | AC304: 85.49 | AD304: 8
A305: BRUNSWICK | D305: NOLAN | F305: STONE | I305: BUCKLEY | L305: HADZILLIAS | W305: WILLIAMSTOWN | X305: 1 | Y305: 6 | Z305: 0 | AA305: 638 | AB305: 906 | AC305: 70.419426048565128 | AD305: 4
A306: GOALKICKERS | W306: PRESTON | X306: 0 | Y306: 7 | Z306: 0 | AA306: 717 | AB306: 1019 | AC306: 70.363101079489695 | AD306: 0
A307: DANDENONG | D307: PAYZE 4 | F307: HIBBERT 3 | I307: BRIESE 3 | K307: SHEVLIN 3 | M307: FLAHERTY 2 | P307: WRIGHT 2 | S307: TAYLOR
A308: BRUNSWICK | D308: WILLIAMS | F308: CARLTON | I308: GINGELL | K308: WARDEN | M308: ORTON | O308: HADZILLIAS | R308: HALLEY
A310: CAULFIELD | C310: 5 | D310: 1 | E310: =C310*6+D310 -> 31 | G310: 11 | H310: 7 | I310: =G310*6+H310 -> 73 | K310: 14 | L310: 10 | M310: =K310*6+L310 -> 94 | O310: 24 | P310: 13 | Q310: =O310*6+P310 -> 157 | S310: PRINCES PARK
A311: GEELONG WEST | C311: 0 | D311: 9 | E311: =C311*6+D311 -> 9 | G311: 3 | H311: 14 | I311: =G311*6+H311 -> 32 | K311: 11 | L311: 17 | M311: =K311*6+L311 -> 83 | O311: 15 | P311: 23 | Q311: =O311*6+P311 -> 113 | S311: MARCY
A312: BEST PLAYERS
A313: CAULFIELD | D313: CRUSE | G313: CLIFF | J313: TEMPEST | M313: EINSEDEL | P313: DAVIDSON | S313: ROWE
A314: GEELONG WEST | D314: HINDSON | G314: CHAPMAN | J314: RUSSELL | M314: SMITH | P314: FRIEND | S314: DEEATH
A315: GOALKICKERS
A316: CAULFIELD | D316: CRUSE 5 | F316: BOOTH 5 | I316: ALLAN 3 | K316: DAVIDSON 3 | N316: MILNER 2 | Q316: ROWE 2 | S316: O'SULLIVAN | V316: MAGUIRE | W316: CLIFF | X316: IRELAND
A317: GEELONG WEST | D317: RADOJEVIC 6 | G317: HINDSON 2 | J317: WOOLFE 2 | M317: STOKES | O317: ARKLAY | Q317: WELLS | S317: GILMORE | V317: ROE
A319: PRAHRAN | C319: 7 | D319: 5 | E319: =C319*6+D319 -> 47 | G319: 10 | H319: 6 | I319: =G319*6+H319 -> 66 | K319: 16 | L319: 10 | M319: =K319*6+L319 -> 106 | O319: 17 | P319: 12 | Q319: =O319*6+P319 -> 114 | S319: PRESTON
A320: PRESTON | C320: 4 | D320: 3 | E320: =C320*6+D320 -> 27 | G320: 6 | H320: 7 | I320: =G320*6+H320 -> 43 | K320: 10 | L320: 9 | M320: =K320*6+L320 -> 69 | O320: 14 | P320: 13 | Q320: =O320*6+P320 -> 97 | S320: SNOOKS
A321: BEST PLAYERS
A322: PRAHRAN | D322: AUSTIN | G322: RIPPON | J322: THORNTON | M322: POWELL | P322: KELLY | S322: ANDERSON
A323: PRESTON | D323: MIDDLETON | G323: CARLSON | J323: STEWART | M323: CLIFFORD | P323: CROXFORD | S323: PREECE
A324: GOALKICKERS
A325: PRAHRAN | D325: SMITH 4 | F325: JOHNSTON 3 | I325: ANDERSON 3 | L325: HEVERIN 2 | N325: BRACHER | P325: AUSTIN | R325: PEPE | T325: THORNTON | W325: TRIMBOLI
A326: PRESTON | D326: STEWART 5 | G326: CARLSON 3 | J326: DUCKWORTH 2 | M326: WOOD 2 | O326: McCULLOCH | R326: CLIFFORD
A328: SANDRINGHAM | C328: 4 | D328: 2 | E328: =C328*6+D328 -> 26 | G328: 6 | H328: 9 | I328: =G328*6+H328 -> 45 | K328: 10 | L328: 10 | M328: =K328*6+L328 -> 70 | O328: 15 | P328: 15 | Q328: =O328*6+P328 -> 105 | S328: WILLIAMSTOWN
A329: WILLIAMSTOWN | C329: 5 | D329: 2 | E329: =C329*6+D329 -> 32 | G329: 8 | H329: 4 | I329: =G329*6+H329 -> 52 | K329: 12 | L329: 8 | M329: =K329*6+L329 -> 80 | O329: 15 | P329: 11 | Q329: =O329*6+P329 -> 101 | S329: STEERE
A330: BEST PLAYERS
A331: SANDRINGHAM | D331: McNICHOLAS | G331: ROBERTS-THOMSON | K331: O'BRIEN | M331: PLEDGER | P331: GOOLD
A332: WILLIAMSTOWN | D332: CROSS | G332: LOVE | K332: ALLEN | M332: TWEEDLY | P332: FANNING | S332: PORCEVINA
A333: GOALKICKERS
A334: SANDRINGHAM | D334: HUNTER 3 | G334: O'BRIEN 3 | I334: HUTCHINSON 3 | L334: KENNEDY 2 | O334: BEUS | Q334: McNICHOLAS | T334: PLEDGER
A335: WILLIAMSTOWN | D335: LOWE 4 | F335: GARDNER 3 | I335: CROSS 2 | K335: RICHARDS 2 | N335: DONNELLY | Q335: KENNEDY | S335: EDWARDS | V335: NASH
A337: ROUND 8 | E337: 29TH MAY | J337: WEATHER | N337: SOUTH WEST WIND COLD | S337: PLAYED AT
D338: 1ST QTR | H338: 2ND QTR | L338: 3RD QTR | P338: FINAL | S338: PORT MELBOURNE
A339: PORT MELBOURNE | C339: 6 | D339: 3 | E339: =C339*6+D339 -> 39 | G339: 16 | H339: 8 | I339: =G339*6+H339 -> 104 | K339: 24 | L339: 15 | M339: =K339*6+L339 -> 159 | O339: 30 | P339: 18 | Q339: =O339*6+P339 -> 198 | S339: UMPIRE | X339: LADDER | AB339: ROUND | AD339: 8
A340: SANDRINGHAM | C340: 5 | D340: 2 | E340: =C340*6+D340 -> 32 | G340: 12 | H340: 2 | I340: =G340*6+H340 -> 74 | K340: 15 | L340: 9 | M340: =K340*6+L340 -> 99 | O340: 20 | P340: 13 | Q340: =O340*6+P340 -> 133 | S340: WENN
A341: BEST PLAYERS | W341: TEAM | X341: W | Y341: L | Z341: D | AA341: FOR | AB341: AGST | AC341: % | AD341: PTS
A342: PORT MELBOURNE | D342: AANENSEN | G342: IVANOFF | J342: CHRISTOU | M342: COOK | O342: HOLT | Q342: CRITCH
A343: SANDRINGHAM | D343: O'BRIEN | G343: KENNEDY | J343: SIMS | M343: J McNICHOLAS | W343: PORT MELBOURNE | X343: 7 | Y343: 1 | Z343: 0 | AA343: 1164 | AB343: 795 | AC343: 146.42 | AD343: 28
A344: GOALKICKERS | W344: COBURG | X344: 7 | Y344: 1 | Z344: 0 | AA344: 947 | AB344: 828 | AC344: 114.3719806763285 | AD344: 28
A345: PORT MELBOURNE | D345: COOK 10 | F345: CHRISTOU 9 | I345: HAENAN 4 | K345: K GOSS 3 | M345: ROBERTSON | P345: HOLT | R345: EVANS | T345: P GOSS | W345: SANDRINGHAM | X345: 6 | Y345: 2 | Z345: 0 | AA345: 1011 | AB345: 978 | AC345: 103.37 | AD345: 24
A346: SANDRINGHAM | D346: SIMS 3 | F346: LYONS 3 | H346: O'BRIEN 3 | J346: McCONNELL 2 | M346: PLEDGER 2 | P346: FRANKLIN 2 | S346: KENNEDY | W346: BRUNSWICK | X346: 5 | Y346: 3 | Z346: 0 | AA346: 947 | AB346: 872 | AC346: 108.60091743119266 | AD346: 20
M347: CARROLL | O347: BEUS | Q347: WILKINS | S347: HUTCHINSON
A348: COBURG | C348: 5 | D348: 3 | E348: =C348*6+D348 -> 33 | G348: 6 | H348: 5 | I348: =G348*6+H348 -> 41 | K348: 11 | L348: 11 | M348: =K348*6+L348 -> 77 | O348: 16 | P348: 11 | Q348: =O348*6+P348 -> 107 | S348: COBURG | W348: DANDENONG | X348: 4 | Y348: 4 | Z348: 0 | AA348: 921 | AB348: 768 | AC348: 119.921875 | AD348: 16
A349: BRUNSWICK | C349: 2 | D349: 7 | E349: =C349*6+D349 -> 19 | G349: 9 | H349: 11 | I349: =G349*6+H349 -> 65 | K349: 11 | L349: 15 | M349: =K349*6+L349 -> 81 | O349: 13 | P349: 21 | Q349: =O349*6+P349 -> 99 | S349: MARCY | W349: GEELONG WEST | X349: 4 | Y349: 4 | Z349: 0 | AA349: 970 | AB349: 960 | AC349: 101.04 | AD349: 16
A350: BEST PLAYERS | W350: PRAHRAN | X350: 3 | Y350: 5 | Z350: 0 | AA350: 929 | AB350: 1009 | AC350: 85.31 | AD350: 12
A351: COBURG | D351: STILLMAN | G351: DOUGLAS | J351: ROBERTSON | M351: PERRY | O351: CLEARY | R351: HEADLAM | W351: CAULFIELD | X351: 2 | Y351: 6 | Z351: 0 | AA351: 974 | AB351: 1083 | AC351: 89.935364727608501 | AD351: 8
A352: BRUNSWICK | D352: JENKIN | G352: GINGELL | J352: HALLEY | M352: STONE | O352: HADZILLIAS | R352: HALLEY | W352: PRESTON | X352: 1 | Y352: 7 | Z352: 0 | AA352: 831 | AB352: 1128 | AC352: 73.670212765957444 | AD352: 4
A353: GOALKICKERS | W353: WILLIAMSTOWN | X353: 1 | Y353: 7 | Z353: 0 | AA353: 747 | AB353: 1020 | AC353: 73.235294117647058 | AD353: 4
A354: COBURG | D354: BURT 3 | F354: STILLMAN 3 | I354: HODGETTS 3 | L354: R HERBERT 2 | O354: MCDONALD 2 | R354: CLEARY 2 | U354: DOHNT
A355: BRUNSWICK | D355: ORTON 4 | F355: HALLEY 2 | I355: GINGELL 2 | L355: DEMETRIOU 2 | O355: STONE | Q355: JENKIN | S355: WILLIAMS
A357: DANDENONG | C357: 10 | D357: 8 | E357: =C357*6+D357 -> 68 | G357: 15 | H357: 9 | I357: =G357*6+H357 -> 99 | K357: 21 | L357: 15 | M357: =K357*6+L357 -> 141 | O357: 27 | P357: 16 | Q357: =O357*6+P357 -> 178 | S357: DANDENONG
A358: CAULFIELD | C358: 2 | D358: 3 | E358: =C358*6+D358 -> 15 | G358: 5 | H358: 6 | I358: =G358*6+H358 -> 36 | K358: 8 | L358: 12 | M358: =K358*6+L358 -> 60 | O358: 12 | P358: 18 | Q358: =O358*6+P358 -> 90 | S358: HUGGINS
A359: BEST PLAYERS
A360: DANDENONG | D360: LYNN | G360: HIBBERT | J360: BRIESE | M360: TAYLOR | P360: SHINNERS | S360: PAYZE
A361: CAULFIELD | D361: DAVIDSON | G361: BALL | J361: EINSEDEL | M361: HAYWOOD | P361: CLIFF | S361: SUTHERLAND
A362: GOALKICKERS
A363: DANDENONG | D363: BRIESE 6 | F363: PAYZE 6 | H363: WRIGHT 3 | J363: SHEVLIN 3 | M363: SHINNERS 2 | P363: FLAHERTY 2 | S363: TAYLOR 2 | V363: LYNN | X363: THOMPSON | AA363: HIBBERT
A364: CAULFIELD | D364: SUTHERLAND 3 | G364: CLIFF 2 | I364: O'SULLIVAN | L364: EINSEDEL | N364: HAYWOOD | Q364: IRELAND | S364: CRUSE | U364: TAYLOR | W364: ROWE
A366: PRAHRAN | C366: 6 | D366: 1 | E366: =C366*6+D366 -> 37 | G366: 13 | H366: 5 | I366: =G366*6+H366 -> 83 | K366: 18 | L366: 10 | M366: =K366*6+L366 -> 118 | O366: 25 | P366: 13 | Q366: =O366*6+P366 -> 163 | S366: TOORAK PARK
A367: GEELONG WEST | C367: 6 | D367: 3 | E367: =C367*6+D367 -> 39 | G367: 9 | H367: 9 | I367: =G367*6+H367 -> 63 | K367: 12 | L367: 16 | M367: =K367*6+L367 -> 88 | O367: 16 | P367: 17 | Q367: =O367*6+P367 -> 113 | S367: TORNEY
A368: BEST PLAYERS
A369: PRAHRAN | D369: SMITH | G369: KENT | J369: KELLY | M369: DOWELL | P369: JOHNSTON | S369: THORNTON
A370: GEELONG WEST | D370: CHAPMAN | G370: HINDSON | J370: STENNETT | M370: DEEATH | P370: GILMORE | S370: WOOLFE
A371: GOALKICKERS
A372: PRAHRAN | D372: SMITH 9 | F372: JOHNSTON 4 | I372: BRACHER 3 | L372: HEVERIN 2 | N372: AUSTEN 2 | Q372: PEPE 2 | S372: THORNTON 2 | W372: ANDERSON
A373: GEELONG WEST | D373: GILMORE 4 | F373: WELLS 4 | I373: STENNETT 2 | L373: RADOJEVIC 2 | O373: STOKES | Q373: HINDSON | S373: BERRY | U373: WOOLFE
A375: PRESTON | C375: 2 | D375: 2 | E375: =C375*6+D375 -> 14 | G375: 7 | H375: 5 | I375: =G375*6+H375 -> 47 | K375: 11 | L375: 7 | M375: =K375*6+L375 -> 73 | O375: 17 | P375: 12 | Q375: =O375*6+P375 -> 114 | S375: PRESTON
A376: WILLIAMSTOWN | C376: 4 | D376: 5 | E376: =C376*6+D376 -> 29 | G376: 7 | H376: 8 | I376: =G376*6+H376 -> 50 | K376: 14 | L376: 11 | M376: =K376*6+L376 -> 95 | O376: 16 | P376: 13 | Q376: =O376*6+P376 -> 109 | S376: STABB
A377: BEST PLAYERS
A378: PRESTON | D378: RENWICK | G378: WILMOT | J378: SANDERSON | M378: PREECE
A379: WILLIAMSTOWN | D379: FANNING | G379: VAN DER SCHUERAN | L379: NASH | N379: LOWE | P379: ALEXANDER
A380: GOALKICKERS
A381: PRESTON | D381: STEWART 4 | G381: MARKS 2 | I381: RENWICK 2 | L381: WILMOT 2 | N381: CARLSON 2 | Q381: CLIFFORD 2 | T381: CONSTANTINE 2 | X381: O'SULLIVAN
A382: WILLIAMSTOWN | D382: LOWE 6 | G382: GARDNER 4 | J382: NASH 3 | L382: KENNEDY 2 | O382: BRINER
A384: ROUND 9 | E384: 5TH JUNE | J384: WEATHER | N384: FINE & SUNNY | S384: PLAYED AT
D385: 1ST QTR | H385: 2ND QTR | L385: 3RD QTR | P385: FINAL | S385: BEACH ROAD
A386: SANDRINGHAM | C386: 7 | D386: 1 | E386: =C386*6+D386 -> 43 | G386: 8 | H386: 7 | I386: =G386*6+H386 -> 55 | K386: 16 | L386: 15 | M386: =K386*6+L386 -> 111 | O386: 23 | P386: 17 | Q386: =O386*6+P386 -> 155 | S386: UMPIRE | X386: LADDER | AB386: ROUND | AD386: 9
A387: COBURG | C387: 5 | D387: 3 | E387: =C387*6+D387 -> 33 | G387: 9 | H387: 6 | I387: =G387*6+H387 -> 60 | K387: 12 | L387: 7 | M387: =K387*6+L387 -> 79 | O387: 20 | P387: 10 | Q387: =O387*6+P387 -> 130 | S387: STEERE
A388: BEST PLAYERS | W388: TEAM | X388: W | Y388: L | Z388: D | AA388: FOR | AB388: AGST | AC388: % | AD388: PTS
A389: SANDRINGHAM | D389: FRANKLIN | G389: O'BRIEN | J389: PETERS | L389: CLARK | O389: BEUS | Q389: HUTCHINSON
A390: COBURG | D390: ROBERTSON | G390: DOUGLAS | J390: CLEARY | L390: McTAGGART | O390: PERRY | W390: PORT MELBOURNE | X390: 8 | Y390: 1 | Z390: 0 | AA390: 1274 | AB390: 904 | AC390: 140.93 | AD390: 32
A391: GOALKICKERS | P391: KENNEDY | R391: McNICHOLAS | W391: COBURG | X391: 7 | Y391: 2 | Z391: 0 | AA391: 1077 | AB391: 983 | AC391: 109.56256358087488 | AD391: 28
A392: SANDRINGHAM | D392: O'BRIEN 5 | F392: HUTCHINSON 5 | I392: SIMS 4 | K392: CARROLL 3 | N392: LYONS 2 | P392: PLEDGER | R392: CLARK | W392: SANDRINGHAM | X392: 7 | Y392: 2 | Z392: 0 | AA392: 1166 | AB392: 1108 | AC392: 105.23 | AD392: 28
A393: COBURG | D393: CLEARY 5 | F393: HODGETTS 4 | I393: MANNIX 3 | K393: PERRY 2 | M393: HERBERT 2 | P393: McMILLAN | R393: STILLMAN | W393: DANDENONG | X393: 5 | Y393: 4 | Z393: 0 | AA393: 1041 | AB393: 867 | AC393: 120.06920415224913 | AD393: 20
Q394: WESCOMBE
A395: PORT MELBOURNE | C395: 8 | D395: 2 | E395: =C395*6+D395 -> 50 | G395: 10 | H395: 6 | I395: =G395*6+H395 -> 66 | K395: 14 | L395: 10 | M395: =K395*6+L395 -> 94 | O395: 16 | P395: 14 | Q395: =O395*6+P395 -> 110 | S395: GEELONG WEST | W395: BRUNSWICK | X395: 5 | Y395: 4 | Z395: 0 | AA395: 1073 | AB395: 1012 | AC395: 106.02766798418972 | AD395: 20
A396: GEELONG WEST | C396: 3 | D396: 3 | E396: =C396*6+D396 -> 21 | G396: 7 | H396: 7 | I396: =G396*6+H396 -> 49 | K396: 11 | L396: 11 | M396: =K396*6+L396 -> 77 | O396: 16 | P396: 13 | Q396: =O396*6+P396 -> 109 | S396: OGSTON | W396: GEELONG WEST | X396: 4 | Y396: 5 | Z396: 0 | AA396: 1079 | AB396: 1070 | AC396: 100.84 | AD396: 16
A397: BEST PLAYERS | W397: PRAHRAN | X397: 3 | Y397: 6 | Z397: 0 | AA397: 1028 | AB397: 1129 | AC397: 91.05 | AD397: 12
A398: PORT MELBOURNE | D398: IVANOFF | G398: CHRISTOU | J398: EVANS | M398: AANENSEN | P398: P GOSS | R398: CRITCH | W398: CAULFIELD | X398: 2 | Y398: 7 | Z398: 0 | AA398: 1084 | AB398: 1214 | AC398: 89.291598023064253 | AD398: 8
A399: GEELONG WEST | D399: DEEATH | G399: WOOLFE | J399: CHAPMAN | M399: MIDDLEMISS | P399: RUSSELL | R399: N EDDY | W399: WILLIAMSTOWN | X399: 2 | Y399: 7 | Z399: 0 | AA399: 878 | AB399: 1130 | AC399: 77.69911504424779 | AD399: 8
A400: GOALKICKERS | W400: PRESTON | X400: 2 | Y400: 7 | Z400: 0 | AA400: 971 | AB400: 1254 | AC400: 77.432216905901115 | AD400: 8
A401: PORT MELBOURNE | D401: COOK 5 | F401: CHRISTOU 3 | I401: HOLT 2 | K401: CRITCH 2 | M401: BECKWITH | O401: P GOSS | Q401: HAENAN | S401: EVANS
A402: GEELONG WEST | D402: MIDDLEMISS 5 | G402: WELLS 3 | I402: RADOJEVIC 2 | L402: STENNETT 2 | O402: WOOLFE 2 | Q402: CHAPMAN | S402: GILMORE
A404: DANDENONG | C404: 3 | D404: 7 | E404: =C404*6+D404 -> 25 | G404: 9 | H404: 11 | I404: =G404*6+H404 -> 65 | K404: 14 | L404: 16 | M404: =K404*6+L404 -> 100 | O404: 17 | P404: 18 | Q404: =O404*6+P404 -> 120 | S404: TOORAK PARK
A405: PRAHRAN | C405: 5 | D405: 0 | E405: =C405*6+D405 -> 30 | G405: 8 | H405: 2 | I405: =G405*6+H405 -> 50 | K405: 12 | L405: 4 | M405: =K405*6+L405 -> 76 | O405: 15 | P405: 9 | Q405: =O405*6+P405 -> 99 | S405: HEDGER
A406: BEST PLAYERS
A407: DANDENONG | D407: THOMPSON | G407: HARPER | J407: LYNN | M407: SHINNERS | P407: TAYLOR | R407: BRIESE
A408: PRAHRAN | D408: KELLY | G408: KENT | J408: AUSTIN | M408: CUNNINGHAM | P408: CLAY | R408: JOHNSTON
A409: GOALKICKERS
A410: DANDENONG | D410: SHEVLIN 5 | G410: BADROCK 3 | J410: BRIESE 3 | M410: TAYLOR 2 | O410: WRIGHT 2 | R410: PAYZE | T410: HIBBERT
A411: PRAHRAN | D411: JOHNSTON 4 | G411: SMITH 3 | I411: AUSTIN 3 | K411: CUNNINGHAM 3 | N411: HEVERIN | P411: AHERNE
A413: WILLIAMSTOWN | C413: 1 | D413: 1 | E413: =C413*6+D413 -> 7 | G413: 8 | H413: 4 | I413: =G413*6+H413 -> 52 | K413: 14 | L413: 6 | M413: =K413*6+L413 -> 90 | O413: 20 | P413: 11 | Q413: =O413*6+P413 -> 131 | S413: WILLIAMSTOWN
A414: CAULFIELD | C414: 3 | D414: 6 | E414: =C414*6+D414 -> 24 | G414: 6 | H414: 11 | I414: =G414*6+H414 -> 47 | K414: 12 | L414: 14 | M414: =K414*6+L414 -> 86 | O414: 16 | P414: 14 | Q414: =O414*6+P414 -> 110 | S414: O'BRIEN
A415: BEST PLAYERS
A416: WILLIAMSTOWN | D416: MAHONEY | G416: FANNING | J416: LOWE | M416: ALEXANDER | P416: NASH | R416: VAN DER SCHUEREN
A417: CAULFIELD | D417: O'SULLIVAN | G417: CLIFF | J417: GOODEN | M417: ROWE
A418: GOALKICKERS
A419: WILLIAMSTOWN | D419: LOWE 5 | F419: MAHONEY 5 | I419: GARDNER 4 | L419: NASH 2 | N419: CROSS 2 | Q419: VAN DER SCHUEREN | U419: BRINER
A420: CAULFIELD | D420: O'SULLIVAN 5 | G420: CLIFF 2 | I420: GOODEN 2 | L420: ROWE 2 | N420: SUTHERLAND 2 | R420: DAVIDSON | U420: HUNT | W420: SAUNDERS
A422: PRESTON | C422: 3 | D422: 1 | E422: =C422*6+D422 -> 19 | G422: 8 | H422: 9 | I422: =G422*6+H422 -> 57 | K422: 15 | L422: 10 | M422: =K422*6+L422 -> 100 | O422: 21 | P422: 14 | Q422: =O422*6+P422 -> 140 | S422: BRUNSWICK
A423: BRUNSWICK | C423: 4 | D423: 6 | E423: =C423*6+D423 -> 30 | G423: 8 | H423: 11 | I423: =G423*6+H423 -> 59 | K423: 15 | L423: 15 | M423: =K423*6+L423 -> 105 | O423: 18 | P423: 18 | Q423: =O423*6+P423 -> 126 | S423: HUGGINS
A424: BEST PLAYERS
A425: PRESTON | D425: SANDERSON | G425: CARLSON | J425: RENWICK | M425: CLIFFORD | P425: STEWART | S425: McCULLOCH
A426: BRUNSWICK | D426: GINGELL | G426: DEMETRIOU | J426: JENKIN | M426: NOLAN | P426: WEST | S426: STONE
A427: GOALKICKERS
A428: PRESTON | D428: CARLSON 5 | G428: CLIFFORD 4 | J428: MIDDLETON 3 | M428: MARKS 3 | O428: WILMOT 2 | R428: KING | T428: STEWART | W428: O'SULLIVAN | X428: RENWICK
A429: BRUNSWICK | D429: GINGELL 6 | G429: HALLEY 4 | J429: ORTON 3 | M429: WARDEN 2 | P429: PARK | R429: STONE | T429: JENKIN
A431: ROUND 10 | E431: 19TH JUNE | J431: WEATHER | N431: GROUNDS HEAVY | S431: PLAYED AT
D432: 1ST QTR | H432: 2ND QTR | L432: 3RD QTR | P432: FINAL | S432: DANDENONG
A433: DANDENONG | C433: 7 | D433: 5 | E433: =C433*6+D433 -> 47 | G433: 7 | H433: 7 | I433: =G433*6+H433 -> 49 | K433: 11 | L433: 9 | M433: =K433*6+L433 -> 75 | O433: 12 | P433: 10 | Q433: =O433*6+P433 -> 82 | S433: UMPIRE | X433: LADDER | AB433: ROUND | AD433: 10
A434: COBURG | C434: 1 | D434: 2 | E434: =C434*6+D434 -> 8 | G434: 3 | H434: 4 | I434: =G434*6+H434 -> 22 | K434: 3 | L434: 8 | M434: =K434*6+L434 -> 26 | O434: 6 | P434: 12 | Q434: =O434*6+P434 -> 48 | S434: STABB
A435: BEST PLAYERS | W435: TEAM | X435: W | Y435: L | Z435: D | AA435: FOR | AB435: AGST | AC435: % | AD435: PTS
A436: DANDENONG | D436: THOMPSON | G436: FLAHERTY | J436: REID | M436: VAN DE BEEK | P436: TAYLOR | R436: HARPER
A437: COBURG | D437: ROBERTSON | G437: BURT | J437: PRICE | M437: STILLMAN | P437: MANNIX | W437: PORT MELBOURNE | X437: 9 | Y437: 1 | Z437: 0 | AA437: 1369 | AB437: 981 | AC437: 139.55 | AD437: 36
A438: GOALKICKERS | W438: COBURG | X438: 7 | Y438: 3 | Z438: 0 | AA438: 1125 | AB438: 1065 | AC438: 105.63380281690141 | AD438: 28
A439: DANDENONG | D439: FLAHERTY 6 | G439: WRIGHT 2 | J439: THOMPSON | M439: SHEVLIN | O439: PAYZE | Q439: BRIESE | W439: SANDRINGHAM | X439: 7 | Y439: 3 | Z439: 0 | AA439: 1228 | AB439: 1180 | AC439: 104.07 | AD439: 28
A440: COBURG | D440: HODGETTS 3 | G440: HERBERT | J440: STILLMAN | M440: DOUGLAS | W440: DANDENONG | X440: 6 | Y440: 4 | Z440: 0 | AA440: 1123 | AB440: 915 | AC440: 122.73224043715847 | AD440: 24
A442: BRUNSWICK | C442: 0 | D442: 2 | E442: =C442*6+D442 -> 2 | G442: 4 | H442: 6 | I442: =G442*6+H442 -> 30 | K442: 7 | L442: 6 | M442: =K442*6+L442 -> 48 | O442: 11 | P442: 6 | Q442: =O442*6+P442 -> 72 | S442: BRUNSWICK | W442: BRUNSWICK | X442: 6 | Y442: 4 | Z442: 0 | AA442: 1145 | AB442: 1074 | AC442: 106.61080074487896 | AD442: 24
A443: SANDRINGHAM | C443: 3 | D443: 4 | E443: =C443*6+D443 -> 22 | G443: 6 | H443: 6 | I443: =G443*6+H443 -> 42 | K443: 7 | L443: 10 | M443: =K443*6+L443 -> 52 | O443: 8 | P443: 14 | Q443: =O443*6+P443 -> 62 | S443: OGSTON | W443: GEELONG WEST | X443: 5 | Y443: 5 | Z443: 0 | AA443: 1142 | AB443: 1106 | AC443: 103.25 | AD443: 20
A444: BEST PLAYERS | W444: CAULFIELD | X444: 3 | Y444: 7 | Z444: 0 | AA444: 1178 | AB444: 1289 | AC444: 91.38867339022498 | AD444: 12
A445: BRUNSWICK | D445: HADZILLIAS | G445: NOLAN | J445: STAEHR | M445: HALLEY | P445: WEST | R445: HARVEY | W445: PRAHRAN | X445: 3 | Y445: 7 | Z445: 0 | AA445: 1103 | AB445: 1223 | AC445: 90.19 | AD445: 12
A446: SANDRINGHAM | D446: McNICHOLAS | G446: CLARK | J446: WILKINS | M446: KENNEDY | P446: PLEDGER | R446: O'BRIEN | W446: PRESTON | X446: 2 | Y446: 8 | Z446: 0 | AA446: 1048 | AB446: 1349 | AC446: 77.687175685693106 | AD446: 8
A447: GOALKICKERS | W447: WILLIAMSTOWN | X447: 2 | Y447: 8 | Z447: 0 | AA447: 914 | AB447: 1193 | AC447: 76.613579212070405 | AD447: 8
A448: BRUNSWICK | D448: ORTON 5 | G448: BYRNE 2 | J448: DEMETRIOU 2 | N448: BUCKLEY | P448: GINGELL
A449: SANDRINGHAM | D449: KENNEDY 3 | G449: PLEDGER | J449: O'BRIEN | L449: CARROLL | N449: McNICHOLAS | Q449: LYONS
A451: CAULFIELD | C451: 3 | D451: 3 | E451: =C451*6+D451 -> 21 | G451: 6 | H451: 4 | I451: =G451*6+H451 -> 40 | K451: 8 | L451: 6 | M451: =K451*6+L451 -> 54 | O451: 14 | P451: 10 | Q451: =O451*6+P451 -> 94 | S451: PRINCES PARK
A452: PRAHRAN | C452: 4 | D452: 6 | E452: =C452*6+D452 -> 30 | G452: 6 | H452: 11 | I452: =G452*6+H452 -> 47 | K452: 8 | L452: 13 | M452: =K452*6+L452 -> 61 | O452: 10 | P452: 15 | Q452: =O452*6+P452 -> 75 | S452: WENN
A453: BEST PLAYERS
A454: CAULFIELD | D454: EINSEDEL | G454: O'SULLIVAN | J454: HAYWOOD | M454: SIERAKOWSKI | P454: DAVIDSON | S454: CLIFF
A455: PRAHRAN | D455: KENT | G455: AUSTIN | J455: PEPE | M455: CLAY | P455: KELLY | S455: SMITH
A456: GOALKICKERS
A457: CAULFIELD | D457: CLIFF 3 | G457: GOODEN 3 | J457: ROWE 2 | L457: CRUSE 2 | N457: DAVIDSON 2 | Q457: HAYWOOD | T457: O'SULLIVAN
A458: PRAHRAN | D458: JOHNSTON 4 | G458: SMITH 3 | I458: AUSTIN 2 | L458: KENT
A460: GEELONG WEST | C460: 5 | D460: 2 | E460: =C460*6+D460 -> 32 | G460: 6 | H460: 2 | I460: =G460*6+H460 -> 38 | K460: 8 | L460: 4 | M460: =K460*6+L460 -> 52 | O460: 9 | P460: 9 | Q460: =O460*6+P460 -> 63 | S460: WILLIAMSTOWN
A461: WILLIAMSTOWN | C461: 1 | D461: 5 | E461: =C461*6+D461 -> 11 | G461: 3 | H461: 8 | I461: =G461*6+H461 -> 26 | K461: 4 | L461: 12 | M461: =K461*6+L461 -> 36 | O461: 4 | P461: 12 | Q461: =O461*6+P461 -> 36 | S461: MARCY
A462: BEST PLAYERS
A463: GEELONG WEST | D463: WOOLFE | G463: ROE | J463: SCALE | M463: RUSSELL | P463: EDDY
A464: WILLIAMSTOWN | D464: ALLEN | G464: PERCY | J464: PORCEVINA | M464: NASH | P464: VAN DER SCHUEREN
A465: GOALKICKERS
A466: GEELONG WEST | D466: WOOLFE 5 | G466: ROE 2 | J466: DURRAN | M466: MIDDLEMISS
A467: WILLIAMSTOWN | D467: NASH 2 | G467: TWEEDLY | J467: MAHONEY
A469: PORT MELBOURNE | C469: 4 | D469: 8 | E469: =C469*6+D469 -> 32 | G469: 5 | H469: 11 | I469: =G469*6+H469 -> 41 | K469: 8 | L469: 16 | M469: =K469*6+L469 -> 64 | O469: 13 | P469: 17 | Q469: =O469*6+P469 -> 95 | S469: PRESTON
A470: PRESTON | C470: 3 | D470: 1 | E470: =C470*6+D470 -> 19 | G470: 6 | H470: 5 | I470: =G470*6+H470 -> 41 | K470: 8 | L470: 7 | M470: =K470*6+L470 -> 55 | O470: 11 | P470: 11 | Q470: =O470*6+P470 -> 77 | S470: TORNEY
A471: BEST PLAYERS
A472: PORT MELBOURNE | D472: CRITCH | G472: COLBERT | J472: HOLT | M472: DERMOTT | P472: HAENAN | S472: EVANS
A473: PRESTON | D473: CLIFFORD | G473: O'SULLIVAN | J473: McCULLOCH | M473: CARLSON | P473: PREECE | S473: KING
A474: GOALKICKERS
A475: PORT MELBOURNE | D475: COOK 3 | F475: HOLT 2 | H475: RASMUSSEN 2 | K475: CHRISTOU | M475: BECKWITH | P475: CRITCH | R475: BOND | T475: EVANS | V475: COLBERT
A476: PRESTON | D476: CARLSON 4 | G476: O'SULLIVAN | J476: RENWICK | L476: HAMMOND | N476: RYLES | P476: WILMOT | R476: STEWART | U476: MARKS
A478: ROUND 11 | E478: 26TH JUNE | J478: WEATHER | N478: SHOWERS | S478: PLAYED AT
D479: 1ST QTR | H479: 2ND QTR | L479: 3RD QTR | P479: FINAL | S479: BEACH ROAD
A480: SANDRINGHAM | C480: 5 | D480: 4 | E480: =C480*6+D480 -> 34 | G480: 8 | H480: 11 | I480: =G480*6+H480 -> 59 | K480: 14 | L480: 15 | M480: =K480*6+L480 -> 99 | O480: 20 | P480: 21 | Q480: =O480*6+P480 -> 141 | S480: UMPIRE | X480: LADDER | AB480: ROUND | AD480: 11
A481: DANDENONG | C481: 3 | D481: 4 | E481: =C481*6+D481 -> 22 | G481: 6 | H481: 6 | I481: =G481*6+H481 -> 42 | K481: 9 | L481: 10 | M481: =K481*6+L481 -> 64 | O481: 11 | P481: 14 | Q481: =O481*6+P481 -> 80 | S481: MARCY
A482: BEST PLAYERS | W482: TEAM | X482: W | Y482: L | Z482: D | AA482: FOR | AB482: AGST | AC482: % | AD482: PTS
A483: SANDRINGHAM | D483: O'BRIEN | G483: CLARK | I483: KENNEDY | L483: COELLI | O483: FRANKLIN | R483: SIMS
A484: DANDENONG | D484: THOMPSON | G484: PAYZE | I484: TAYLOR | L484: SHINNERS | O484: REID | R484: BRIESE | W484: PORT MELBOURNE | X484: 9 | Y484: 2 | Z484: 0 | AA484: 1463 | AB484: 1119 | AC484: 130.74 | AD484: 36
A485: GOALKICKERS | S485: BELL | W485: SANDRINGHAM | X485: 8 | Y485: 3 | Z485: 0 | AA485: 1369 | AB485: 1260 | AC485: 108.65 | AD485: 32
A486: SANDRINGHAM | D486: FRANKLIN 5 | G486: O'BRIEN 4 | I486: CARROLL 3 | L486: SIMS 3 | N486: KENNEDY 2 | Q486: WILKINS | S486: HUTCHINSON | W486: COBURG | X486: 8 | Y486: 3 | Z486: 0 | AA486: 1256 | AB486: 1160 | AC486: 108.27586206896552 | AD486: 32
A487: DANDENONG | D487: PAYZE 3 | F487: BRIESE 2 | I487: SHINNERS 2 | L487: WRIGHT | N487: ORCHARD | Q487: MADDEN | S487: TAYLOR | W487: DANDENONG | X487: 6 | Y487: 5 | Z487: 0 | AA487: 1203 | AB487: 1056 | AC487: 113.92045454545455 | AD487: 24
A489: GEELONG WEST | C489: 5 | D489: 1 | E489: =C489*6+D489 -> 31 | G489: 10 | H489: 8 | I489: =G489*6+H489 -> 68 | K489: 18 | L489: 11 | M489: =K489*6+L489 -> 119 | O489: 23 | P489: 14 | Q489: =O489*6+P489 -> 152 | S489: GEELONG WEST | W489: GEELONG WEST | X489: 6 | Y489: 5 | Z489: 0 | AA489: 1294 | AB489: 1234 | AC489: 104.86 | AD489: 24
A490: BRUNSWICK | C490: 6 | D490: 9 | E490: =C490*6+D490 -> 45 | G490: 10 | H490: 9 | I490: =G490*6+H490 -> 69 | K490: 13 | L490: 11 | M490: =K490*6+L490 -> 89 | O490: 19 | P490: 14 | Q490: =O490*6+P490 -> 128 | S490: WENN | W490: BRUNSWICK | X490: 6 | Y490: 5 | Z490: 0 | AA490: 1273 | AB490: 1226 | AC490: 103.83360522022838 | AD490: 24
A491: BEST PLAYERS | W491: CAULFIELD | X491: 4 | Y491: 7 | Z491: 0 | AA491: 1316 | AB491: 1383 | AC491: 95.155459146782363 | AD491: 16
A492: GEELONG WEST | D492: WELLS | F492: DEEATH | I492: GILMORE | L492: WOOLFE | O492: MIDDLEMISS | R492: SCALE | W492: PRAHRAN | X492: 4 | Y492: 7 | Z492: 0 | AA492: 1222 | AB492: 1333 | AC492: 91.67 | AD492: 16
A493: BRUNSWICK | D493: HARVEY | F493: BUCKLEY | I493: NOLAN | L493: TOY | O493: LEWIS | R493: STONE | W493: WILLIAMSTOWN | X493: 2 | Y493: 9 | Z493: 0 | AA493: 1024 | AB493: 1312 | AC493: 78.048780487804876 | AD493: 8
A494: GOALKICKERS | O494: FAGAN | Q494: RUSSELL | S494: B EDDY | W494: PRESTON | X494: 2 | Y494: 9 | Z494: 0 | AA494: 1143 | AB494: 1480 | AC494: 77.229729729729726 | AD494: 8
A495: GEELONG WEST | D495: WELLS 6 | F495: MIDDLEMISS 5 | I495: STENNETT 2 | L495: RADOJEVIC 2 | O495: GILMORE 2 | R495: WOOLFE 2
A496: BRUNSWICK | D496: GINGELL 4 | F496: ORTON 3 | I496: TOY 3 | K496: STONE 2 | M496: PARK | N496: BYRNE | P496: WEST | R496: JENKIN | T496: HADZILLIAS
A498: PRAHRAN | C498: 8 | D498: 5 | E498: =C498*6+D498 -> 53 | G498: 10 | H498: 7 | I498: =G498*6+H498 -> 67 | K498: 17 | L498: 9 | M498: =K498*6+L498 -> 111 | O498: 18 | P498: 11 | Q498: =O498*6+P498 -> 119 | S498: TOORAK PARK
A499: WILLIAMSTOWN | C499: 2 | D499: 1 | E499: =C499*6+D499 -> 13 | G499: 9 | H499: 2 | I499: =G499*6+H499 -> 56 | K499: 12 | L499: 5 | M499: =K499*6+L499 -> 77 | O499: 17 | P499: 8 | Q499: =O499*6+P499 -> 110 | S499: TORNEY
A500: BEST PLAYERS
A501: PRAHRAN | D501: JOHNSTON | G501: SMITH | J501: PEPE | L501: LEGH | O501: ZEMSKI | R501: GUNN
A502: WILLIAMSTOWN | D502: TWEEDLY | G502: CROSS | J502: PERCY | L502: NASH | O502: FANNING | R502: PORCEVINA
A503: GOALKICKERS
A504: PRAHRAN | D504: SMITH 6 | G504: HYNES 3 | I504: GUNN 3 | K504: KENT | M504: PEPE | N504: THORNTON | Q504: JOHNSTON | S504: AHERNE | U504: ZEMSKI
A505: WILLIAMSTOWN | D505: TWEEDLY 6 | G505: NASH 4 | I505: LOWE 3 | K505: MAHONEY 2 | N505: GARDNER | Q505: POWLEY
A507: CAULFIELD | C507: 5 | D507: 7 | E507: =C507*6+D507 -> 37 | G507: 13 | H507: 11 | I507: =G507*6+H507 -> 89 | K507: 16 | L507: 13 | M507: =K507*6+L507 -> 109 | O507: 20 | P507: 18 | Q507: =O507*6+P507 -> 138 | S507: PORT MELBOURNE
A508: PORT MELBOURNE | C508: 5 | D508: 3 | E508: =C508*6+D508 -> 33 | G508: 7 | H508: 8 | I508: =G508*6+H508 -> 50 | K508: 9 | L508: 19 | M508: =K508*6+L508 -> 73 | O508: 12 | P508: 22 | Q508: =O508*6+P508 -> 94 | S508: FITZPATRICK
A509: BEST PLAYERS
A510: CAULFIELD | D510: CLIFF | G510: HAYWOOD | J510: TEMPEST | M510: EINSEDEL | P510: BECK | R510: BALL
A511: PORT MELBOURNE | D511: GREENING | G511: IVANOFF | J511: BOND | M511: OWEN | P511: ANDERSON
A512: GOALKICKERS
A513: CAULFIELD | D513: CLIFF 4 | F513: BECK 3 | H513: MILNER 3 | J513: DAVIDSON 3 | M513: SUTHERLAND 2 | P513: GOODEN 2 | R513: O'SULLIVAN | U513: ROWE | W513: SAUNDERS
A514: PORT MELBOURNE | D514: COOK 4 | G514: BOND 3 | I514: RASMUSSEN 2 | L514: MOLONEY | N514: COLBERT | Q514: BECKWITH
A516: COBURG | C516: 4 | D516: 4 | E516: =C516*6+D516 -> 28 | G516: 7 | H516: 6 | I516: =G516*6+H516 -> 48 | K516: 15 | L516: 9 | M516: =K516*6+L516 -> 99 | O516: 20 | P516: 11 | Q516: =O516*6+P516 -> 131 | S516: COBURG
A517: PRESTON | C517: 2 | D517: 3 | E517: =C517*6+D517 -> 15 | G517: 6 | H517: 8 | I517: =G517*6+H517 -> 44 | K517: 8 | L517: 9 | M517: =K517*6+L517 -> 57 | O517: 13 | P517: 17 | Q517: =O517*6+P517 -> 95 | S517: HEDGER
A518: BEST PLAYERS
A519: COBURG | D519: PERRY | G519: ROBERTSON | J519: CLEARY | M519: STILLMAN | P519: HERBERT
A520: PRESTON | D520: MIDDLETON | G520: KING | J520: WATT | M520: STEWART | P520: MARKS
A521: GOALKICKERS
A522: COBURG | D522: CLEARY 5 | F522: HODGETTS 4 | I522: McDONALD 3 | L522: PRICE 2 | N522: ROBERTSON | Q522: PITT | R522: LLOYD | T522: STILLMAN | W522: HERBERT | X522: HURST
A523: PRESTON | D523: SALTMARSH 4 | G523: MARKS 3 | I523: STEWART 2 | L523: CLIFFORD | N523: MIDDLETON | Q523: SANDERSON | T523: HAMMOND
A525: ROUND 12 | E525: 10TH JULY | J525: WEATHER | N525: NORTH WIND | S525: PLAYED AT
D526: 1ST QTR | H526: 2ND QTR | L526: 3RD QTR | P526: FINAL | S526: BEACH ROAD
A527: SANDRINGHAM | C527: 10 | D527: 3 | E527: =C527*6+D527 -> 63 | G527: 11 | H527: 8 | I527: =G527*6+H527 -> 74 | K527: 18 | L527: 14 | M527: =K527*6+L527 -> 122 | O527: 22 | P527: 15 | Q527: =O527*6+P527 -> 147 | S527: UMPIRE | X527: LADDER | AB527: ROUND | AD527: 12
A528: GEELONG WEST | C528: 2 | D528: 2 | E528: =C528*6+D528 -> 14 | G528: 10 | H528: 4 | I528: =G528*6+H528 -> 64 | K528: 13 | L528: 6 | M528: =K528*6+L528 -> 84 | O528: 19 | P528: 11 | Q528: =O528*6+P528 -> 125 | S528: HUGGINS
A529: BEST PLAYERS | W529: TEAM | X529: W | Y529: L | Z529: D | AA529: FOR | AB529: AGST | AC529: % | AD529: PTS
A530: SANDRINGHAM | D530: WILKINS | G530: CARROLL | J530: LYONS | M530: COELLI | O530: SIMS | R530: O'BRIEN
A531: GEELONG WEST | D531: WOOLFE | G531: RUSSELL | J531: DEEATH | M531: FRIEND | O531: GILMORE | R531: CHAPMAN | W531: PORT MELBOURNE | X531: 10 | Y531: 2 | Z531: 0 | AA531: 1623 | AB531: 1216 | AC531: 133.47 | AD531: 40
A532: GOALKICKERS | P532: McNICHOLAS | W532: SANDRINGHAM | X532: 9 | Y532: 3 | Z532: 0 | AA532: 1516 | AB532: 1385 | AC532: 109.46 | AD532: 36
A533: SANDRINGHAM | D533: CARROLL 6 | F533: SIMS 3 | H533: KENNEDY 3 | K533: JONES 3 | M533: FRANKLIN 3 | P533: HUTCHINSON 2 | S533: WILKINS | W533: COBURG | X533: 9 | Y533: 3 | Z533: 0 | AA533: 1368 | AB533: 1253 | AC533: 109.17797286512371 | AD533: 36
A534: GEELONG WEST | D534: GILMORE 4 | F534: WOOLFE 3 | I534: MIDDLEMISS 3 | L534: RADOJEVIC 3 | O534: CHAPMAN 2 | R534: DEEATH | T534: HINDSON | W534: DANDENONG | X534: 7 | Y534: 5 | Z534: 0 | AA534: 1369 | AB534: 1154 | AC534: 118.63084922010398 | AD534: 28
P535: RUSSELL | R535: DURRAN
A536: COBURG | C536: 3 | D536: 2 | E536: =C536*6+D536 -> 20 | G536: 9 | H536: 6 | I536: =G536*6+H536 -> 60 | K536: 11 | L536: 10 | M536: =K536*6+L536 -> 76 | O536: 16 | P536: 16 | Q536: =O536*6+P536 -> 112 | S536: PRINCES PARK | W536: GEELONG WEST | X536: 6 | Y536: 6 | Z536: 0 | AA536: 1419 | AB536: 1381 | AC536: 102.75 | AD536: 24
A537: CAULFIELD | C537: 3 | D537: 10 | E537: =C537*6+D537 -> 28 | G537: 7 | H537: 15 | I537: =G537*6+H537 -> 57 | K537: 8 | L537: 21 | M537: =K537*6+L537 -> 69 | O537: 11 | P537: 27 | Q537: =O537*6+P537 -> 93 | S537: OGSTON | W537: BRUNSWICK | X537: 6 | Y537: 6 | Z537: 0 | AA537: 1370 | AB537: 1341 | AC537: 102.16256524981357 | AD537: 24
A538: BEST PLAYERS | W538: PRAHRAN | X538: 5 | Y538: 7 | Z538: 0 | AA538: 1337 | AB538: 1430 | AC538: 93.5 | AD538: 20
A539: COBURG | D539: CLEARY | G539: HARTIGAN | J539: PRICE | M539: DOUGLAS | P539: PERRY | R539: MICHALCZYK | W539: CAULFIELD | X539: 4 | Y539: 8 | Z539: 0 | AA539: 1409 | AB539: 1495 | AC539: 94.247491638795992 | AD539: 16
A540: CAULFIELD | D540: SIERAKOWSKI | G540: HAYWOOD | J540: O'SULLIVAN | M540: CRUSE | P540: ROWE | R540: HAWKING | W540: WILLIAMSTOWN | X540: 2 | Y540: 10 | Z540: 0 | AA540: 1121 | AB540: 1472 | AC540: 76.154891304347828 | AD540: 8
A541: GOALKICKERS | W541: PRESTON | X541: 2 | Y541: 10 | Z541: 0 | AA541: 1241 | AB541: 1646 | AC541: 75.394896719319561 | AD541: 8
A542: COBURG | D542: CLEARY 6 | G542: HODGETTS 3 | J542: BURT 3 | L542: DOUGLAS 2 | O542: STILLMAN | R542: HERBERT
A543: CAULFIELD | D543: SUTHERLAND 2 | G543: MILNER 2 | I543: EINSEDEL | K543: HAYWOOD | M543: DAVIDSON | O543: HUNT | Q543: BECK | S543: CLIFF | U543: CRUSE
A545: PRAHRAN | C545: 2 | D545: 4 | E545: =C545*6+D545 -> 16 | G545: 4 | H545: 7 | I545: =G545*6+H545 -> 31 | K545: 11 | L545: 10 | M545: =K545*6+L545 -> 76 | O545: 17 | P545: 13 | Q545: =O545*6+P545 -> 115 | S545: BRUNSWICK
A546: BRUNSWICK | C546: 3 | D546: 1 | E546: =C546*6+D546 -> 19 | G546: 7 | H546: 6 | I546: =G546*6+H546 -> 48 | K546: 9 | L546: 10 | M546: =K546*6+L546 -> 64 | O546: 14 | P546: 13 | Q546: =O546*6+P546 -> 97 | S546: MATTHEWS
A547: BEST PLAYERS
A548: PRAHRAN | D548: CLAY | G548: GUNN | J548: SMITH | M548: ROBERTS | P548: McFAULL | S548: KENT
A549: BRUNSWICK | D549: BUCKLEY | G549: CARLTON | J549: NOLAN | M549: GINGELL
A550: GOALKICKERS
A551: PRAHRAN | D551: SMITH 7 | G551: GUNN 5 | I551: THORNTON 2 | L551: McFAULL | N551: AUSTIN | P551: KENT
A552: BRUNSWICK | D552: CARLTON 3 | G552: ORTON 2 | I552: TOY 2 | K552: HOGAN | M552: GINGELL | O552: PARK | Q552: JENKIN | S552: HUGGARD | W552: STONE | Y552: WEST
A554: DANDENONG | C554: 11 | D554: 2 | E554: =C554*6+D554 -> 68 | G554: 14 | H554: 2 | I554: =G554*6+H554 -> 86 | K554: 21 | L554: 6 | M554: =K554*6+L554 -> 132 | O554: 26 | P554: 10 | Q554: =O554*6+P554 -> 166 | S554: DANDENONG
A555: PRESTON | C555: 1 | D555: 2 | E555: =C555*6+D555 -> 8 | G555: 9 | H555: 10 | I555: =G555*6+H555 -> 64 | K555: 11 | L555: 11 | M555: =K555*6+L555 -> 77 | O555: 13 | P555: 20 | Q555: =O555*6+P555 -> 98 | S555: McBAIN
A556: BEST PLAYERS
A557: DANDENONG | D557: SHEVLIN | G557: VAN DE BEEK | J557: TAYLOR | M557: HARRINGTON | P557: THOMPSON | S557: WRIGHT
A558: PRESTON | D558: STEWART | G558: SANDERSON | J558: MIDDLETON | M558: CROXFORD | P558: PREECE | S558: CLIFFORD
A559: GOALKICKERS
A560: DANDENONG | D560: WRIGHT 7 | F560: SHEVLIN 5 | I560: FLAHERTY 3 | L560: BRIESE 3 | N560: TAYLOR 3 | Q560: HARRINGTON | T560: HIBBERT | W560: SHINNERS | X560: LYNN | Z560: PAYZE
A561: PRESTON | D561: STEWART 5 | G561: CARLSON 3 | J561: WILMOT 2 | M561: MARKS | O561: CLIFFORD | Q561: MIDDLETON
A563: PORT MELBOURNE | C563: 5 | D563: 6 | E563: =C563*6+D563 -> 36 | G563: 11 | H563: 8 | I563: =G563*6+H563 -> 74 | K563: 17 | L563: 13 | M563: =K563*6+L563 -> 115 | O563: 24 | P563: 16 | Q563: =O563*6+P563 -> 160 | S563: WILLIAMSTOWN
A564: WILLIAMSTOWN | C564: 5 | D564: 1 | E564: =C564*6+D564 -> 31 | G564: 8 | H564: 4 | I564: =G564*6+H564 -> 52 | K564: 11 | L564: 7 | M564: =K564*6+L564 -> 73 | O564: 14 | P564: 13 | Q564: =O564*6+P564 -> 97 | S564: STABB
A565: BEST PLAYERS
A566: PORT MELBOURNE | D566: EVANS | G566: OWEN | I566: HOLT | K566: STIBBARD | O566: COOK | Q566: CRITCH
A567: WILLIAMSTOWN | D567: PORCEVINA | G567: CROSS | I567: KERR | K567: VAN DER SCHUEREN | O567: PERCY | Q567: KENNEDY
A568: GOALKICKERS
A569: PORT MELBOURNE | D569: COOK 8 | F569: RASMUSSEN 4 | I569: CHRISTOU 3 | L569: HAENAN 3 | N569: EVANS 3 | Q569: STIBBARD 2 | T569: HOLT
A570: WILLIAMSTOWN | D570: GARDNER 4 | G570: TWEEDLY 2 | J570: CROSS 2 | L570: NASH 2 | N570: LOWE | P570: DONNELLY | R570: FANNING | U570: POWLEY
A572: ROUND 13 | E572: 17TH JULY | J572: WEATHER | N572: FINE | S572: PLAYED AT
D573: 1ST QTR | H573: 2ND QTR | L573: 3RD QTR | P573: FINAL | S573: GEELONG WEST
A574: GEELONG WEST | C574: 9 | D574: 3 | E574: =C574*6+D574 -> 57 | G574: 12 | H574: 6 | I574: =G574*6+H574 -> 78 | K574: 20 | L574: 11 | M574: =K574*6+L574 -> 131 | O574: 25 | P574: 12 | Q574: =O574*6+P574 -> 162 | S574: UMPIRE | X574: LADDER | AB574: ROUND | AD574: 13
A575: DANDENONG | C575: 5 | D575: 5 | E575: =C575*6+D575 -> 35 | G575: 9 | H575: 10 | I575: =G575*6+H575 -> 64 | K575: 12 | L575: 12 | M575: =K575*6+L575 -> 84 | O575: 18 | P575: 17 | Q575: =O575*6+P575 -> 125 | S575: TORNEY
A576: BEST PLAYERS | W576: TEAM | X576: W | Y576: L | Z576: D | AA576: FOR | AB576: AGST | AC576: % | AD576: PTS
A577: GEELONG WEST | D577: RUSSELL | G577: RADOJEVIC | J577: GILMORE | M577: DEEATH | P577: WOOLFE | R577: HINDSON
A578: DANDENONG | D578: HARPER | G578: HARRINGTON | J578: HIBBERT | M578: THOMPSON | P578: BRIESE | R578: TAYLOR | W578: PORT MELBOURNE | X578: 11 | Y578: 2 | Z578: 0 | AA578: 1771 | AB578: 1309 | AC578: 135.29 | AD578: 44
A579: GOALKICKERS | R579: SMITH | W579: COBURG | X579: 10 | Y579: 3 | Z579: 0 | AA579: 1464 | AB579: 1347 | AC579: 108.68596881959911 | AD579: 40
A580: GEELONG WEST | D580: RADOJEVIC 9 | G580: MIDDLEMISS 4 | J580: FAGAN 3 | L580: WELLS 2 | N580: GILMORE 2 | Q580: ROE 2 | S580: WOOLFE 2 | W580: SANDRINGHAM | X580: 9 | Y580: 4 | Z580: 0 | AA580: 1617 | AB580: 1497 | AC580: 108.02 | AD580: 36
A581: DANDENONG | D581: WRIGHT 4 | F581: BRIESE 3 | H581: TAYLOR 2 | J581: FLAHERTY 2 | M581: THOMPSON 2 | P581: HARRINGTON | S581: ORCHARD | W581: DANDENONG | X581: 7 | Y581: 6 | Z581: 0 | AA581: 1494 | AB581: 1316 | AC581: 113.5258358662614 | AD581: 28
N582: SHEVLIN | P582: PAYZE | R582: VAN DE BEEK
A583: PORT MELBOURNE | C583: 6 | D583: 5 | E583: =C583*6+D583 -> 41 | G583: 8 | H583: 13 | I583: =G583*6+H583 -> 61 | K583: 16 | L583: 19 | M583: =K583*6+L583 -> 115 | O583: 21 | P583: 22 | Q583: =O583*6+P583 -> 148 | S583: PORT MELBOURNE | W583: GEELONG WEST | X583: 7 | Y583: 6 | Z583: 0 | AA583: 1581 | AB583: 1506 | AC583: 104.98 | AD583: 28
A584: BRUNSWICK | C584: 5 | D584: 2 | E584: =C584*6+D584 -> 32 | G584: 9 | H584: 4 | I584: =G584*6+H584 -> 58 | K584: 11 | L584: 9 | M584: =K584*6+L584 -> 75 | O584: 13 | P584: 15 | Q584: =O584*6+P584 -> 93 | S584: OGSTON | W584: BRUNSWICK | X584: 6 | Y584: 7 | Z584: 0 | AA584: 1463 | AB584: 1489 | AC584: 98.253861652115518 | AD584: 24
A585: BEST PLAYERS | W585: PRAHRAN | X585: 6 | Y585: 7 | Z585: 0 | AA585: 1449 | AB585: 1531 | AC585: 94.64 | AD585: 24
A586: PORT MELBOURNE | D586: HOLT | G586: AANENSEN | J586: GREENING | M586: CHRISTOU | O586: OWEN | R586: IVANOFF | W586: CAULFIELD | X586: 5 | Y586: 8 | Z586: 0 | AA586: 1540 | AB586: 1614 | AC586: 95.41511771995043 | AD586: 20
A587: BRUNSWICK | D587: CARLTON | G587: STONE | J587: WEST | M587: ORTON | O587: WILLIAMS | R587: TOWNSING | W587: WILLIAMSTOWN | X587: 2 | Y587: 11 | Z587: 0 | AA587: 1215 | AB587: 1568 | AC587: 77.487244897959187 | AD587: 8
A588: GOALKICKERS | W588: PRESTON | X588: 2 | Y588: 11 | Z588: 0 | AA588: 1360 | AB588: 1777 | AC588: 76.533483398987059 | AD588: 8
A589: PORT MELBOURNE | D589: COOK 5 | F589: BOND 4 | H589: CHRISTOU 4 | K589: HOLT 3 | M589: EVANS 2 | O589: GREENING | Q589: AANENSEN | T589: HAENAN
A590: BRUNSWICK | D590: ORTON 3 | G590: HALLEY 3 | J590: TOY 3 | L590: HOGAN 2 | N590: STONE | P590: GINGELL
A592: PRAHRAN | C592: 5 | D592: 5 | E592: =C592*6+D592 -> 35 | G592: 6 | H592: 12 | I592: =G592*6+H592 -> 48 | K592: 10 | L592: 13 | M592: =K592*6+L592 -> 73 | O592: 16 | P592: 16 | Q592: =O592*6+P592 -> 112 | S592: TOORAK PARK
A593: SANDRINGHAM | C593: 5 | D593: 4 | E593: =C593*6+D593 -> 34 | G593: 7 | H593: 9 | I593: =G593*6+H593 -> 51 | K593: 12 | L593: 13 | M593: =K593*6+L593 -> 85 | O593: 14 | P593: 17 | Q593: =O593*6+P593 -> 101 | S593: HEDGER
A594: BEST PLAYERS
A595: PRAHRAN | D595: ZEMSKI | G595: THORNTON | J595: CLARKE | M595: McFAULL | P595: KELLY | R595: GUNN
A596: SANDRINGHAM | D596: WILKINS | G596: CARROLL | J596: KENNEDY | M596: LYONS | P596: CLARK | R596: SIMS
A597: GOALKICKERS
A598: PRAHRAN | D598: CLARKE 4 | G598: SMITH 2 | I598: GUNN 2 | K598: KENT 2 | M598: JOHNSTON 2 | P598: McFAULL | R598: HYNES | T598: ZEMSKI | V598: THORNTON
A599: SANDRINGHAM | D599: HUTCHINSON 3 | G599: SIMS 2 | I599: KENNEDY 2 | L599: JONES 2 | N599: FRANKLIN | Q599: WILKINS | S599: McNICHOLAS | V599: DUNN | X599: CARROLL
A601: CAULFIELD | C601: 6 | D601: 6 | E601: =C601*6+D601 -> 42 | G601: 9 | H601: 8 | I601: =G601*6+H601 -> 62 | K601: 15 | L601: 9 | M601: =K601*6+L601 -> 99 | O601: 20 | P601: 11 | Q601: =O601*6+P601 -> 131 | S601: PRESTON
A602: PRESTON | C602: 2 | D602: 3 | E602: =C602*6+D602 -> 15 | G602: 8 | H602: 4 | I602: =G602*6+H602 -> 52 | K602: 12 | L602: 10 | M602: =K602*6+L602 -> 82 | O602: 18 | P602: 11 | Q602: =O602*6+P602 -> 119 | S602: MARCY
A603: BEST PLAYERS
A604: CAULFIELD | D604: HAYWOOD | G604: DAVIDSON | J604: MILNER | M604: ROWE | P604: O'SULLIVAN | S604: SUTHERLAND
A605: PRESTON | D605: RENWICK | G605: WILMOT | J605: MARKS | M605: CLIFFORD | P605: SANDERSON | S605: STEWART
A606: GOALKICKERS
A607: CAULFIELD | D607: SUTHERLAND 4 | G607: CRUSE 3 | I607: ROWE 3 | K607: O'SULLIVAN 3 | N607: MILNER 2 | Q607: HAYWOOD 2 | T607: BECK | V607: CLIFF | X607: GOODEN
A608: PRESTON | D608: STEWART 5 | G608: CARLSON 4 | J608: MARKS 3 | L608: RENWICK 2 | O608: WILMOT 2 | R608: CLIFFORD | U608: O'SULLIVAN
A610: COBURG | C610: 3 | D610: 3 | E610: =C610*6+D610 -> 21 | G610: 7 | H610: 6 | I610: =G610*6+H610 -> 48 | K610: 9 | L610: 9 | M610: =K610*6+L610 -> 63 | O610: 14 | P610: 12 | Q610: =O610*6+P610 -> 96 | S610: COBURG
A611: WILLIAMSTOWN | C611: 1 | D611: 6 | E611: =C611*6+D611 -> 12 | G611: 5 | H611: 11 | I611: =G611*6+H611 -> 41 | K611: 8 | L611: 13 | M611: =K611*6+L611 -> 61 | O611: 13 | P611: 16 | Q611: =O611*6+P611 -> 94 | S611: FITZPATRICK
A612: BEST PLAYERS
A613: COBURG | D613: DOUGLAS | G613: PERRY | J613: DOHNT | M613: CLEARY
A614: WILLIAMSTOWN | D614: COURTOT | G614: VAN DER SCHUEREN | K614: BROWN | M614: CROSS | O614: LOWE
A615: GOALKICKERS
A616: COBURG | D616: CLEARY 4 | G616: HERBERT 3 | J616: DOUGLAS 2 | M616: DOHNT 2 | O616: BURT | Q616: FORMOSA | S616: McDONALD
A617: WILLIAMSTOWN | D617: LOWE 5 | G617: CROSS 3 | J617: GARDNER 2 | M617: BRINER | O617: COURTOT | Q617: PERCY
A619: ROUND 14 | E619: 24TH JULY | J619: WEATHER | M619: WEST WIND COLD CLOUDY | S619: PLAYED AT
D620: 1ST QTR | H620: 2ND QTR | L620: 3RD QTR | P620: FINAL | S620: GEELONG WEST
A621: GEELONG WEST | C621: 3 | D621: 7 | E621: =C621*6+D621 -> 25 | G621: 3 | H621: 13 | I621: =G621*6+H621 -> 31 | K621: 6 | L621: 16 | M621: =K621*6+L621 -> 52 | O621: 10 | P621: 19 | Q621: =O621*6+P621 -> 79 | S621: UMPIRE | X621: LADDER | AB621: ROUND | AD621: 14
A622: COBURG | C622: 1 | D622: 2 | E622: =C622*6+D622 -> 8 | G622: 4 | H622: 7 | I622: =G622*6+H622 -> 31 | K622: 7 | L622: 9 | M622: =K622*6+L622 -> 51 | O622: 7 | P622: 13 | Q622: =O622*6+P622 -> 55 | S622: MARCY
A623: BEST PLAYERS | W623: TEAM | X623: W | Y623: L | Z623: D | AA623: FOR | AB623: AGST | AC623: % | AD623: PTS
A624: GEELONG WEST | D624: CHAPMAN | G624: ROE | J624: GILMORE | M624: HINDSON | P624: YATES | R624: FRIEND
A625: COBURG | D625: PERRY | G625: MANNIX | J625: CLEARY | M625: BURT | P625: HERBERT | R625: STILLMAN | W625: PORT MELBOURNE | X625: 12 | Y625: 2 | Z625: 0 | AA625: 1913 | AB625: 1450 | AC625: 131.93 | AD625: 48
A626: GOALKICKERS | W626: SANDRINGHAM | X626: 10 | Y626: 4 | Z626: 0 | AA626: 1728 | AB626: 1607 | AC626: 107.53 | AD626: 40
A627: GEELONG WEST | D627: ROE 3 | F627: WELLS 2 | I627: RADOJEVIC 2 | L627: FAGAN | N627: WOOLFE | P627: LEWIS | W627: COBURG | X627: 10 | Y627: 4 | Z627: 0 | AA627: 1519 | AB627: 1426 | AC627: 106.52173913043478 | AD627: 40
A628: COBURG | D628: CLEARY 2 | F628: McDONALD 2 | I628: HERBERT 2 | L628: MANNIX | W628: DANDENONG | X628: 8 | Y628: 6 | Z628: 0 | AA628: 1569 | AB628: 1390 | AC628: 112.87769784172662 | AD628: 32
A630: PORT MELBOURNE | C630: 10 | D630: 8 | E630: =C630*6+D630 -> 68 | G630: 13 | H630: 13 | I630: =G630*6+H630 -> 91 | K630: 16 | L630: 20 | M630: =K630*6+L630 -> 116 | O630: 20 | P630: 22 | Q630: =O630*6+P630 -> 142 | S630: TOORAK PARK | W630: GEELONG WEST | X630: 8 | Y630: 6 | Z630: 0 | AA630: 1660 | AB630: 1561 | AC630: 106.34 | AD630: 32
A631: PRAHRAN | C631: 3 | D631: 2 | E631: =C631*6+D631 -> 20 | G631: 10 | H631: 8 | I631: =G631*6+H631 -> 68 | K631: 17 | L631: 10 | M631: =K631*6+L631 -> 112 | O631: 21 | P631: 15 | Q631: =O631*6+P631 -> 141 | S631: WENN | W631: BRUNSWICK | X631: 7 | Y631: 7 | Z631: 0 | AA631: 1585 | AB631: 1599 | AC631: 99.124452782989366 | AD631: 28
A632: BEST PLAYERS | W632: PRAHRAN | X632: 6 | Y632: 8 | Z632: 0 | AA632: 1590 | AB632: 1673 | AC632: 95.04 | AD632: 24
A633: PORT MELBOURNE | D633: AANENSEN | G633: GREENING | J633: COOK | M633: HOLT | P633: OWEN | R633: SWAN | W633: CAULFIELD | X633: 5 | Y633: 9 | Z633: 0 | AA633: 1650 | AB633: 1736 | AC633: 95.046082949308754 | AD633: 20
A634: PRAHRAN | D634: AUSTIN | G634: SMITH | J634: THORNTON | M634: CLARKE | P634: ROBERTS | R634: JOHNSTON | W634: WILLIAMSTOWN | X634: 2 | Y634: 12 | Z634: 0 | AA634: 1289 | AB634: 1643 | AC634: 78.454047474132679 | AD634: 8
A635: GOALKICKERS | O635: RASMUSSEN | W635: PRESTON | X635: 2 | Y635: 12 | Z635: 0 | AA635: 1470 | AB635: 1888 | AC635: 77.860169491525426 | AD635: 8
A636: PORT MELBOURNE | D636: COOK 7 | F636: EVANS 3 | H636: CHRISTOU 2 | K636: BOND 2 | M636: HOLT 2 | O636: HARLAND | Q636: AANENSEN | T636: HAENAN
A637: PRAHRAN | D637: SMITH 7 | F637: CLARKE 4 | I637: JOHNSTON 3 | L637: THORNTON 3 | O637: GUNN | Q637: McFAULL | S637: AUSTIN | U637: ZEMSKI
A639: BRUNSWICK | C639: 4 | D639: 4 | E639: =C639*6+D639 -> 28 | G639: 6 | H639: 9 | I639: =G639*6+H639 -> 45 | K639: 11 | L639: 13 | M639: =K639*6+L639 -> 79 | O639: 18 | P639: 14 | Q639: =O639*6+P639 -> 122 | S639: BRUNSWICK
A640: CAULFIELD | C640: 4 | D640: 3 | E640: =C640*6+D640 -> 27 | G640: 8 | H640: 8 | I640: =G640*6+H640 -> 56 | K640: 14 | L640: 12 | M640: =K640*6+L640 -> 96 | O640: 16 | P640: 14 | Q640: =O640*6+P640 -> 110 | S640: HUGGINS
A641: BEST PLAYERS
A642: BRUNSWICK | D642: WILLIAMS | G642: WEST | J642: NOLAN | M642: STONE | O642: DEMETRIOU | R642: TOY
A643: CAULFIELD | D643: HAYWOOD | G643: TEMPEST | J643: HAWKING | M643: ROWE | O643: BOOTH | R643: SIERAKOWSKI
A644: GOALKICKERS
A645: BRUNSWICK | D645: DEMETRIOU 4 | G645: HALLEY 3 | J645: GINGELL 3 | M645: STONE 3 | O645: ORTON 2 | Q645: TOY 2 | S645: HARVEY
A646: CAULFIELD | D646: DAVIDSON 4 | G646: BOOTH 3 | I646: SUTHERLAND 2 | L646: ROWE 2 | N646: MILNER 2 | Q646: CRUSE | S646: GOODEN | V646: O'SULLIVAN
A648: DANDENONG | C648: 2 | D648: 2 | E648: =C648*6+D648 -> 14 | G648: 3 | H648: 6 | I648: =G648*6+H648 -> 24 | K648: 8 | L648: 6 | M648: =K648*6+L648 -> 54 | O648: 11 | P648: 9 | Q648: =O648*6+P648 -> 75 | S648: WILLIAMSTOWN
A649: WILLIAMSTOWN | C649: 2 | D649: 2 | E649: =C649*6+D649 -> 14 | G649: 5 | H649: 5 | I649: =G649*6+H649 -> 35 | K649: 7 | L649: 11 | M649: =K649*6+L649 -> 53 | O649: 10 | P649: 14 | Q649: =O649*6+P649 -> 74 | S649: HEDGER
A650: BEST PLAYERS
A651: DANDENONG | D651: HARRINGTON | G651: GOODES | J651: BEVAN | M651: FLAHERTY | O651: VAN DE BEEK | R651: THOMPSON
A652: WILLIAMSTOWN | D652: ALLEN | G652: PORCEVINA | J652: FANNING | M652: POWLEY | O652: BROWN | R652: COURTOT
A653: GOALKICKERS
A654: DANDENONG | D654: FLAHERTY 4 | G654: WRIGHT 2 | J654: HARRINGTON 2 | N654: BRIESE | P654: HIBBERT | R654: SHINNERS
A655: WILLIAMSTOWN | D655: FANNING 3 | G655: TWEEDLY 2 | J655: LOWE 2 | L655: CROSS | N655: GARDNER | P655: COURTOT
A657: SANDRINGHAM | C657: 2 | D657: 1 | E657: =C657*6+D657 -> 13 | G657: 9 | H657: 9 | I657: =G657*6+H657 -> 63 | K657: 11 | L657: 9 | M657: =K657*6+L657 -> 75 | O657: 16 | P657: 15 | Q657: =O657*6+P657 -> 111 | S657: BEACH ROAD
A658: PRESTON | C658: 6 | D658: 3 | E658: =C658*6+D658 -> 39 | G658: 7 | H658: 5 | I658: =G658*6+H658 -> 47 | K658: 13 | L658: 12 | M658: =K658*6+L658 -> 90 | O658: 16 | P658: 14 | Q658: =O658*6+P658 -> 110 | S658: MATHEWS
A659: BEST PLAYERS
A660: SANDRINGHAM | D660: BELL | G660: McNICHOLAS | J660: LYONS | M660: WALLEY | O660: O'BRIEN
A661: PRESTON | D661: CLIFFORD | G661: STEWART | J661: RENWICK | M661: CARLSON
A662: GOALKICKERS
A663: SANDRINGHAM | D663: BELL 4 | F663: LYONS 4 | H663: O'BRIEN 2 | J663: WALLEY 2 | M663: SIMS | O663: CARROLL | Q663: KENNEDY | T663: McNICHOLAS
A664: PRESTON | D664: LORENZINI 5 | G664: CARLSON 3 | J664: RENWICK 2 | M664: CLIFFORD 2 | P664: STEWART | R664: MARKS | T664: SANDERSON | W664: SEARLE
A666: ROUND 15 | E666: 31ST JULY | J666: WEATHER | N666: NORTH WIND COLD | S666: PLAYED AT
D667: 1ST QTR | H667: 2ND QTR | L667: 3RD QTR | P667: FINAL | S667: DANDENONG
A668: PORT MELBOURNE | C668: 4 | D668: 7 | E668: =C668*6+D668 -> 31 | G668: 10 | H668: 9 | I668: =G668*6+H668 -> 69 | K668: 10 | L668: 9 | M668: =K668*6+L668 -> 69 | O668: 13 | P668: 15 | Q668: =O668*6+P668 -> 93 | S668: UMPIRE | X668: LADDER | AB668: ROUND | AD668: 15
A669: DANDENONG | C669: 2 | D669: 4 | E669: =C669*6+D669 -> 16 | G669: 4 | H669: 8 | I669: =G669*6+H669 -> 32 | K669: 11 | L669: 11 | M669: =K669*6+L669 -> 77 | O669: 12 | P669: 13 | Q669: =O669*6+P669 -> 85 | S669: HUGGINS
A670: BEST PLAYERS | W670: TEAM | X670: W | Y670: L | Z670: D | AA670: FOR | AB670: AGST | AC670: % | AD670: PTS
A671: PORT MELBOURNE | D671: EVANS | G671: HAENAN | J671: PROFFIT | M671: SWAN | O671: HOLT | Q671: AANENSEN
A672: DANDENONG | D672: HARPER | G672: TAYLOR | J672: PAYZE | M672: GOODES | O672: BEVAN | Q672: HIBBERT | W672: PORT MELBOURNE | X672: 13 | Y672: 2 | Z672: 0 | AA672: 2006 | AB672: 1535 | AC672: 130.68 | AD672: 52
A673: GOALKICKERS | W673: SANDRINGHAM | X673: 11 | Y673: 4 | Z673: 0 | AA673: 1837 | AB673: 1710 | AC673: 107.43 | AD673: 44
A674: PORT MELBOURNE | D674: COOK 4 | F674: HAENAN 3 | I674: CHRISTOU 2 | L674: SWAN | N674: HOLT | P674: BOND | R674: RASMUSSEN | W674: COBURG | X674: 10 | Y674: 5 | Z674: 0 | AA674: 1601 | AB674: 1516 | AC674: 105.60686015831135 | AD674: 40
A675: DANDENONG | D675: PAYZE 3 | F675: FLAHERTY 2 | I675: HARRINGTON 2 | L675: SHINNERS | N675: SHEVLIN | P675: WRIGHT | R675: GOODES | T675: BRIESE | W675: DANDENONG | X675: 8 | Y675: 7 | Z675: 0 | AA675: 1654 | AB675: 1483 | AC675: 111.53068105192177 | AD675: 32
A677: PRAHRAN | C677: 2 | D677: 1 | E677: =C677*6+D677 -> 13 | G677: 6 | H677: 12 | I677: =G677*6+H677 -> 48 | K677: 7 | L677: 13 | M677: =K677*6+L677 -> 55 | O677: 12 | P677: 18 | Q677: =O677*6+P677 -> 90 | S677: COBURG | W677: GEELONG WEST | X677: 8 | Y677: 7 | Z677: 0 | AA677: 1728 | AB677: 1687 | AC677: 102.43 | AD677: 32
A678: COBURG | C678: 4 | D678: 7 | E678: =C678*6+D678 -> 31 | G678: 5 | H678: 8 | I678: =G678*6+H678 -> 38 | K678: 9 | L678: 20 | M678: =K678*6+L678 -> 74 | O678: 10 | P678: 22 | Q678: =O678*6+P678 -> 82 | S678: MATHEWS | W678: BRUNSWICK | X678: 8 | Y678: 7 | Z678: 0 | AA678: 1664 | AB678: 1677 | AC678: 99.224806201550393 | AD678: 32
A679: BEST PLAYERS | W679: PRAHRAN | X679: 7 | Y679: 8 | Z679: 0 | AA679: 1680 | AB679: 1755 | AC679: 95.73 | AD679: 28
A680: PRAHRAN | D680: THORNTON | G680: CLAY | I680: CLARKE | L680: KENT | O680: McFAULL | R680: JEFFREY | W680: CAULFIELD | X680: 5 | Y680: 10 | Z680: 0 | AA680: 1753 | AB680: 1845 | AC680: 95.013550135501362 | AD680: 20
A681: COBURG | D681: DOUGLAS | G681: PERRY | I681: BURT | L681: ARTHURSON | O681: DOHNT | W681: PRESTON | X681: 3 | Y681: 12 | Z681: 0 | AA681: 1596 | AB681: 1956 | AC681: 81.595092024539881 | AD681: 12
A682: GOALKICKERS | W682: WILLIAMSTOWN | X682: 2 | Y682: 13 | Z682: 0 | AA682: 1367 | AB682: 1722 | AC682: 79.38443670150987 | AD682: 8
A683: PRAHRAN | D683: SMITH 4 | G683: THORNTON 2 | J683: JEFFREY 2 | M683: CLAY | N683: CLARKE | P683: RIPPON | R683: ZEMSKI
A684: COBURG | D684: BURT 3 | F684: DOUGLAS | H684: DOHNT | J684: CLEARY | L684: STILLMAN | N684: BEATTIE | P684: PERRY | R684: HERBERT
A686: BRUNSWICK | C686: 1 | D686: 1 | E686: =C686*6+D686 -> 7 | G686: 7 | H686: 7 | I686: =G686*6+H686 -> 49 | K686: 9 | L686: 8 | M686: =K686*6+L686 -> 62 | O686: 11 | P686: 13 | Q686: =O686*6+P686 -> 79 | S686: WILLIAMSTOWN
A687: WILLIAMSTOWN | C687: 5 | D687: 2 | E687: =C687*6+D687 -> 32 | G687: 6 | H687: 4 | I687: =G687*6+H687 -> 40 | K687: 9 | L687: 10 | M687: =K687*6+L687 -> 64 | O687: 11 | P687: 12 | Q687: =O687*6+P687 -> 78 | S687: WENN
A688: BEST PLAYERS
A689: BRUNSWICK | D689: TOY | G689: GINGELL | J689: STONE | M689: NOLAN | O689: WEST | R689: HARVEY
A690: WILLIAMSTOWN | D690: PORCEVINA | G690: BROWN | J690: GARDNER | M690: PERCY | O690: TWEEDLY
A691: GOALKICKERS
A692: BRUNSWICK | D692: TOY 3 | F692: GINGELL 2 | I692: LAWRENCE | L692: ORTON | N692: DEMETRIOU | Q692: HARVEY | S692: BUCKLEY | V692: MARANTELLI
A693: WILLIAMSTOWN | D693: LOWE 2 | F693: NASH 2 | H693: MAHONEY 2 | K693: GARDNER 2 | N693: SCOTT | P693: TWEEDLY | R693: DONNELLY
A695: PRESTON | C695: 3 | D695: 7 | E695: =C695*6+D695 -> 25 | G695: 7 | H695: 8 | I695: =G695*6+H695 -> 50 | K695: 13 | L695: 16 | M695: =K695*6+L695 -> 94 | O695: 18 | P695: 18 | Q695: =O695*6+P695 -> 126 | S695: PRESTON
A696: GEELONG WEST | C696: 1 | D696: 4 | E696: =C696*6+D696 -> 10 | G696: 4 | H696: 7 | I696: =G696*6+H696 -> 31 | K696: 4 | L696: 11 | M696: =K696*6+L696 -> 35 | O696: 9 | P696: 14 | Q696: =O696*6+P696 -> 68 | S696: OGSTON
A697: BEST PLAYERS
A698: PRESTON | D698: STEWART | G698: RENWICK | J698: WILMOT | M698: PREECE | O698: SANDERSON | R698: CLIFFORD
A699: GEELONG WEST | D699: DEEATH | G699: YATES | J699: ROE | M699: HINDSON | O699: CHAPMAN | R699: WOOLFE
A700: GOALKICKERS
A701: PRESTON | D701: WILMOT 4 | F701: SALTMARSH 3 | I701: LORENZINI 3 | L701: MARKS 3 | N701: CROXFORD 2 | Q701: STEWART | T701: CLIFFORD | W701: RINGIN
A702: GEELONG WEST | D702: RADOJEVIC 3 | G702: WOOLFE 3 | J702: STOKES | L702: STENNETT | N702: DEEATH
A704: SANDRINGHAM | C704: 2 | D704: 3 | E704: =C704*6+D704 -> 15 | G704: 8 | H704: 12 | I704: =G704*6+H704 -> 60 | K704: 11 | L704: 18 | M704: =K704*6+L704 -> 84 | O704: 14 | P704: 25 | Q704: =O704*6+P704 -> 109 | S704: PRINCES PARK
A705: CAULFIELD | C705: 4 | D705: 7 | E705: =C705*6+D705 -> 31 | G705: 5 | H705: 9 | I705: =G705*6+H705 -> 39 | K705: 12 | L705: 15 | M705: =K705*6+L705 -> 87 | O705: 14 | P705: 19 | Q705: =O705*6+P705 -> 103 | S705: TORNEY
A706: BEST PLAYERS
A707: SANDRINGHAM | D707: CLARK | G707: LYONS | J707: WILKINS | M707: McNICHOLAS | P707: ROBERTS-THOMSON | T707: EDWARDS
A708: CAULFIELD | D708: HAWKINS | G708: TEMPEST | J708: HUNT | M708: RICHARDS | P708: HAYWOOD | T708: ROWE
A709: GOALKICKERS
A710: SANDRINGHAM | D710: CARROLL 3 | G710: LYONS 3 | I710: SIMS 2 | K710: BELL 2 | M710: WILKINS | O710: KENNEDY | Q710: WALLEY | S710: O'BRIEN
A711: CAULFIELD | D711: HUNT 3 | G711: HAYWOOD 2 | J711: CLIFF 2 | L711: SUTHERLAND 2 | O711: ROWE 2 | Q711: O'SULLIVAN | T711: EINSEDEL | W711: BECK
A713: ROUND 16 | E713: 7TH AUGUST | J713: WEATHER | N713: SOUTH WIND SHOWERS | S713: PLAYED AT
D714: 1ST QTR | H714: 2ND QTR | L714: 3RD QTR | P714: FINAL | S714: PORT MELBOURNE
A715: PORT MELBOURNE | C715: 3 | D715: 4 | E715: =C715*6+D715 -> 22 | G715: 6 | H715: 11 | I715: =G715*6+H715 -> 47 | K715: 9 | L715: 14 | M715: =K715*6+L715 -> 68 | O715: 14 | P715: 19 | Q715: =O715*6+P715 -> 103 | S715: UMPIRE | X715: LADDER | AB715: ROUND | AD715: 16
A716: COBURG | C716: 3 | D716: 3 | E716: =C716*6+D716 -> 21 | G716: 5 | H716: 6 | I716: =G716*6+H716 -> 36 | K716: 10 | L716: 10 | M716: =K716*6+L716 -> 70 | O716: 11 | P716: 16 | Q716: =O716*6+P716 -> 82 | S716: HEDGER
A717: BEST PLAYERS | W717: TEAM | X717: W | Y717: L | Z717: D | AA717: FOR | AB717: AGST | AC717: % | AD717: PTS
A718: PORT MELBOURNE | D718: EVANS | G718: ANDERSON | J718: AANENSEN | M718: SWAN | O718: IVANOFF
A719: COBURG | D719: DOHNT | G719: BURT | J719: McMILLAN | M719: LLOYD | O719: PITT | W719: PORT MELBOURNE | X719: 14 | Y719: 2 | Z719: 0 | AA719: 2109 | AB719: 1617 | AC719: 130.43 | AD719: 56
A720: GOALKICKERS | Q720: RASMUSSEN | W720: SANDRINGHAM | X720: 12 | Y720: 4 | Z720: 0 | AA720: 2037 | AB720: 1851 | AC720: 110.05 | AD720: 48
A721: PORT MELBOURNE | D721: COOK 5 | F721: BOND 2 | H721: HARLAND | J721: CHRISTOU | L721: EVANS | N721: AANENSEN | P721: SWAN | R721: PROFFIT | W721: COBURG | X721: 10 | Y721: 6 | Z721: 0 | AA721: 1683 | AB721: 1619 | AC721: 103.95305744286597 | AD721: 40
A722: COBURG | D722: DOHNT 4 | G722: LLOYD 4 | I722: BEATTIE | K722: PERRY | M722: ROBERTSON | W722: GEELONG WEST | X722: 9 | Y722: 7 | Z722: 0 | AA722: 1855 | AB722: 1792 | AC722: 103.52 | AD722: 36
A724: BRUNSWICK | C724: 1 | D724: 6 | E724: =C724*6+D724 -> 12 | G724: 3 | H724: 6 | I724: =G724*6+H724 -> 24 | K724: 8 | L724: 9 | M724: =K724*6+L724 -> 57 | O724: 11 | P724: 14 | Q724: =O724*6+P724 -> 80 | S724: BRUNSWICK | W724: BRUNSWICK | X724: 9 | Y724: 7 | Z724: 0 | AA724: 1744 | AB724: 1729 | AC724: 100.86755349913244 | AD724: 36
A725: DANDENONG | C725: 3 | D725: 5 | E725: =C725*6+D725 -> 23 | G725: 3 | H725: 9 | I725: =G725*6+H725 -> 27 | K725: 3 | L725: 10 | M725: =K725*6+L725 -> 28 | O725: 7 | P725: 10 | Q725: =O725*6+P725 -> 52 | S725: MARCY | W725: DANDENONG | X725: 8 | Y725: 8 | Z725: 0 | AA725: 1706 | AB725: 1563 | AC725: 109.149072296865 | AD725: 32
A726: BEST PLAYERS | W726: PRAHRAN | X726: 7 | Y726: 9 | Z726: 0 | AA726: 1735 | AB726: 1867 | AC726: 92.93 | AD726: 28
A727: BRUNSWICK | D727: MARANTELLI | G727: TOY | J727: GINGELL | M727: WEST | O727: NOLAN | R727: ORTON | W727: CAULFIELD | X727: 5 | Y727: 11 | Z727: 0 | AA727: 1858 | AB727: 1972 | AC727: 94.219066937119678 | AD727: 20
A728: DANDENONG | D728: LYNN | G728: TAYLOR | J728: SHINNERS | M728: O'DEA | O728: HARPER | W728: PRESTON | X728: 4 | Y728: 12 | Z728: 0 | AA728: 1708 | AB728: 2011 | AC728: 84.932869219293877 | AD728: 16
A729: GOALKICKERS | W729: WILLIAMSTOWN | X729: 2 | Y729: 14 | Z729: 0 | AA729: 1508 | AB729: 1922 | AC729: 78.459937565036427 | AD729: 8
A730: BRUNSWICK | D730: MARANTELLI 6 | G730: ORTON 2 | I730: GINGELL | K730: STONE | M730: DEMETRIOU
A731: DANDENONG | D731: O'DEA 2 | G731: FLAHERTY 2 | J731: BRIESE | L731: TAYLOR | N731: BEVAN
A733: GEELONG WEST | C733: 6 | D733: 4 | E733: =C733*6+D733 -> 40 | G733: 10 | H733: 6 | I733: =G733*6+H733 -> 66 | K733: 13 | L733: 8 | M733: =K733*6+L733 -> 86 | O733: 19 | P733: 13 | Q733: =O733*6+P733 -> 127 | S733: GEELONG WEST
A734: CAULFIELD | C734: 4 | D734: 3 | E734: =C734*6+D734 -> 27 | G734: 6 | H734: 4 | I734: =G734*6+H734 -> 40 | K734: 14 | L734: 10 | M734: =K734*6+L734 -> 94 | O734: 15 | P734: 15 | Q734: =O734*6+P734 -> 105 | S734: STEERE
A735: BEST PLAYERS
A736: GEELONG WEST | D736: WOOLFE | G736: GILMORE | J736: CHAPMAN | N736: DEATH | P736: ROE | R736: WELLS
A737: CAULFIELD | D737: O'SULLIVAN | G737: HAYWOOD | J737: SIERAKOWSKI | N737: ROWE | P737: CLIFF | R737: CRUSE
A738: GOALKICKERS
A739: GEELONG WEST | D739: WELLS 4 | F739: ROE 3 | H739: WOOLFE 3 | J739: HINDSON 2 | M739: RADOJEVIC 2 | P739: FAGAN 2 | R739: GILMORE 2 | U739: SMITH
A740: CAULFIELD | D740: O'SULLIVAN 3 | G740: GOODEN 3 | J740: HAYWOOD 2 | M740: DAVIDSON 2 | P740: SUTHERLAND 2 | S740: CLIFF | U740: BOOTH | W740: ROWE
A742: PRESTON | C742: 4 | D742: 6 | E742: =C742*6+D742 -> 30 | G742: 5 | H742: 9 | I742: =G742*6+H742 -> 39 | K742: 11 | L742: 15 | M742: =K742*6+L742 -> 81 | O742: 16 | P742: 16 | Q742: =O742*6+P742 -> 112 | S742: TOORAK PARK
A743: PRAHRAN | C743: 0 | D743: 1 | E743: =C743*6+D743 -> 1 | G743: 3 | H743: 4 | I743: =G743*6+H743 -> 22 | K743: 4 | L743: 4 | M743: =K743*6+L743 -> 28 | O743: 8 | P743: 7 | Q743: =O743*6+P743 -> 55 | S743: FITZPATRICK
A744: BEST PLAYERS
A745: PRESTON | D745: RENWICK | G745: CARLSON | J745: STEWART | M745: WATT | P745: DURWOOD | S745: PREECE
A746: PRAHRAN | D746: JOHNSTON | G746: CLAY | J746: McGUINNESS | M746: McFAULL | P746: ROBERTS | S746: KELLY
A747: GOALKICKERS
A748: PRESTON | D748: CARLSON 6 | G748: RINGIN 3 | I748: LORENZINI 2 | L748: WILMOT 2 | N748: RENWICK | P748: MARKS | R748: SALTMARSH
A749: PRAHRAN | D749: CLARKE 2 | G749: SMITH 2 | I749: ZEMSKI 2 | L749: JEFFREY | N749: JOHNSTON
A751: SANDRINGHAM | C751: 8 | D751: 3 | E751: =C751*6+D751 -> 51 | G751: 14 | H751: 9 | I751: =G751*6+H751 -> 93 | K751: 22 | L751: 12 | M751: =K751*6+L751 -> 144 | O751: 30 | P751: 20 | Q751: =O751*6+P751 -> 200 | S751: BEACH ROAD
A752: WILLIAMSTOWN | C752: 6 | D752: 2 | E752: =C752*6+D752 -> 38 | G752: 12 | H752: 4 | I752: =G752*6+H752 -> 76 | K752: 17 | L752: 10 | M752: =K752*6+L752 -> 112 | O752: 21 | P752: 15 | Q752: =O752*6+P752 -> 141 | S752: STABB
A753: BEST PLAYERS
A754: SANDRINGHAM | D754: WALLEY | G754: BELL | J754: O'BRIEN | M754: CLARK | O754: PLEDGER | R754: McNICHOLAS
A755: WILLIAMSTOWN | D755: LOWE | G755: NASH | J755: FANNING | M755: TWEEDLY | O755: VAN DEN SCHUEREN | S755: COURTOT
A756: GOALKICKERS
A757: SANDRINGHAM | D757: O'BRIEN 5 | F757: BELL 5 | H757: WALLEY 4 | J757: HUTCHINSON 4 | M757: CARROLL 3 | P757: PLEDGER 3 | R757: LAUBE 2 | U757: LYONS | W757: CLARK | X757: KENNEDY | AA757: PETERS
A758: WILLIAMSTOWN | D758: LOWE 6 | F758: VAN DEN SCHUEREN 6 | K758: NASH 3 | M758: GARDNER 2 | P758: CROSS 2 | R758: PERCY | T758: DONNELLY
A760: ROUND 17 | E760: 21ST AUGUST | J760: WEATHER | N760: WEST WIND SHOWERS | S760: PLAYED AT
D761: 1ST QTR | H761: 2ND QTR | L761: 3RD QTR | P761: FINAL | S761: BEACH ROAD
A762: SANDRINGHAM | C762: 3 | D762: 12 | E762: =C762*6+D762 -> 30 | G762: 5 | H762: 16 | I762: =G762*6+H762 -> 46 | K762: 15 | L762: 17 | M762: =K762*6+L762 -> 107 | O762: 18 | P762: 19 | Q762: =O762*6+P762 -> 127 | S762: UMPIRE | X762: LADDER | AB762: ROUND | AD762: 17
A763: P0RT MELBOURNE | C763: 0 | D763: 2 | E763: =C763*6+D763 -> 2 | G763: 0 | H763: 8 | I763: =G763*6+H763 -> 8 | K763: 2 | L763: 9 | M763: =K763*6+L763 -> 21 | O763: 9 | P763: 10 | Q763: =O763*6+P763 -> 64 | S763: WENN
A764: BEST PLAYERS | W764: TEAM | X764: W | Y764: L | Z764: D | AA764: FOR | AB764: AGST | AC764: % | AD764: PTS
A765: SANDRINGHAM | D765: COELLI | G765: WILKINS | J765: ROBERTS-THOMSON | N765: CLARK | P765: BEUS | R765: PLEDGER
A766: P0RT MELBOURNE | D766: BEECROFT | G766: STIBBARD | J766: OWEN | W766: PORT MELBOURNE | X766: 14 | Y766: 3 | Z766: 0 | AA766: 2173 | AB766: 1744 | AC766: 124.6 | AD766: 56
A767: GOALKICKERS | R767: PLEDGER | W767: SANDRINGHAM | X767: 13 | Y767: 4 | Z767: 0 | AA767: 2164 | AB767: 1915 | AC767: 113 | AD767: 52
A768: SANDRINGHAM | D768: PETERS 4 | F768: O'BRIEN 3 | I768: HUTCHINSON 3 | L768: BELL 3 | N768: WILKINS 2 | Q768: CARROLL 2 | T768: WALLEY | W768: GEELONG WEST | X768: 10 | Y768: 7 | Z768: 0 | AA768: 1978 | AB768: 1889 | AC768: 104.71 | AD768: 40
A769: P0RT MELBOURNE | D769: COOK 3 | G769: CHRISTOU 2 | J769: SWAN | L769: PROFFIT | N769: AANENSEN | Q769: EVANS | W769: COBURG | X769: 10 | Y769: 7 | Z769: 0 | AA769: 1810 | AB769: 1754 | AC769: 103.19270239452679 | AD769: 40
A771: BRUNSWICK | C771: 5 | D771: 4 | E771: =C771*6+D771 -> 34 | G771: 10 | H771: 5 | I771: =G771*6+H771 -> 65 | K771: 18 | L771: 11 | M771: =K771*6+L771 -> 119 | O771: 20 | P771: 15 | Q771: =O771*6+P771 -> 135 | S771: BRUNSWICK | W771: BRUNSWICK | X771: 10 | Y771: 7 | Z771: 0 | AA771: 1879 | AB771: 1856 | AC771: 101.23922413793103 | AD771: 40
A772: COBURG | C772: 3 | D772: 2 | E772: =C772*6+D772 -> 20 | G772: 4 | H772: 8 | I772: =G772*6+H772 -> 32 | K772: 8 | L772: 9 | M772: =K772*6+L772 -> 57 | O772: 19 | P772: 13 | Q772: =O772*6+P772 -> 127 | S772: STABB | W772: DANDENONG | X772: 9 | Y772: 8 | Z772: 0 | AA772: 1855 | AB772: 1673 | AC772: 110.87866108786611 | AD772: 36
A773: BEST PLAYERS | W773: PRAHRAN | X773: 7 | Y773: 10 | Z773: 0 | AA773: 1832 | AB773: 1990 | AC773: 92.06 | AD773: 28
A774: BRUNSWICK | D774: STONE | G774: JENKIN | J774: ORTON | M774: GINGELL | O774: NOLAN | R774: MARANTELLI | W774: CAULFIELD | X774: 5 | Y774: 12 | Z774: 0 | AA774: 1968 | AB774: 2121 | AC774: 92.786421499292786 | AD774: 20
A775: COBURG | D775: BURT | G775: PERRY | J775: PITT | M775: PRICE | O775: HURST | W775: PRESTON | X775: 5 | Y775: 12 | Z775: 0 | AA775: 1858 | AB775: 2094 | AC775: 88.729703915950338 | AD775: 20
A776: GOALKICKERS | N776: DEMETRIOU | Q776: TOY | W776: WILLIAMSTOWN | X776: 2 | Y776: 15 | Z776: 0 | AA776: 1591 | AB776: 2072 | AC776: 76.785714285714292 | AD776: 8
A777: BRUNSWICK | D777: ORTON 6 | F777: MARANTELLI 4 | I777: STONE 3 | K777: WEST | M777: CARLTON | O777: GINGELL | Q777: JENKIN | S777: LAWRENCE
A778: COBURG | D778: HODGETTS 6 | G778: STILLMAN 3 | J778: WESCOMBE 2 | M778: BEATTIE 2 | O778: LLOYD 2 | Q778: DOUGLAS | S778: BURT | U778: PITT | W778: HARTIGAN
A780: GEELONG WEST | C780: 3 | D780: 5 | E780: =C780*6+D780 -> 23 | G780: 7 | H780: 9 | I780: =G780*6+H780 -> 51 | K780: 13 | L780: 14 | M780: =K780*6+L780 -> 92 | O780: 17 | P780: 21 | Q780: =O780*6+P780 -> 123 | S780: GEELONG WEST
A781: PRAHRAN | C781: 4 | D781: 5 | E781: =C781*6+D781 -> 29 | G781: 7 | H781: 7 | I781: =G781*6+H781 -> 49 | K781: 10 | L781: 11 | M781: =K781*6+L781 -> 71 | O781: 14 | P781: 13 | Q781: =O781*6+P781 -> 97 | S781: HUGGINS
A782: BEST PLAYERS
A783: GEELONG WEST | D783: HINDSON | G783: GILMORE | J783: DEEATH | M783: WELLS | O783: RADOJEVIC | R783: RUSSELL
A784: PRAHRAN | D784: JOHNSTON | G784: ZEMSKI | J784: ANDERSON | M784: DOWELL | O784: THOMAS
A785: GOALKICKERS
A786: GEELONG WEST | D786: RADOJEVIC 4 | G786: WELLS 4 | I786: GILMORE 3 | L786: WOOLFE 2 | N786: FAGAN 2 | Q786: SMITH | S786: ROE
A787: PRAHRAN | D787: JOHNSTON 4 | G787: SMITH 3 | I787: McFAULL 2 | L787: GUNN | N787: RIPPON | P787: LITTLE | R787: ANDERSON | U787: THORNTON
A789: PRESTON | C789: 3 | D789: 4 | E789: =C789*6+D789 -> 22 | G789: 7 | H789: 12 | I789: =G789*6+H789 -> 54 | K789: 13 | L789: 17 | M789: =K789*6+L789 -> 95 | O789: 21 | P789: 24 | Q789: =O789*6+P789 -> 150 | S789: WILLIAMSTOWN
A790: WILLIAMSTOWN | C790: 1 | D790: 3 | E790: =C790*6+D790 -> 9 | G790: 7 | H790: 8 | I790: =G790*6+H790 -> 50 | K790: 10 | L790: 14 | M790: =K790*6+L790 -> 74 | O790: 11 | P790: 17 | Q790: =O790*6+P790 -> 83 | S790: MARCY
A791: BEST PLAYERS
A792: PRESTON | D792: STEWART | G792: DURWOOD | J792: CLIFFORD | M792: O'SULLIVAN | P792: MARKS | R792: RENWICK
A793: WILLIAMSTOWN | D793: COURTOT | G793: FANNING | J793: SCOTT | M793: GARDNER
A794: GOALKICKERS
A795: PRESTON | D795: CLIFFORD 6 | G795: CARLSON 6 | J795: LORENZINI 2 | M795: WILMOT 2 | O795: MARKS 2 | Q795: STEWART | S795: RENWICK | V795: RINGIN
A796: WILLIAMSTOWN | D796: SCOTT 3 | G796: GARDNER 3 | J796: DONNELLY 2 | M796: TWEEDLY | O796: NASH | Q796: CROSS
A798: DANDENONG | C798: 9 | D798: 4 | E798: =C798*6+D798 -> 58 | G798: 12 | H798: 7 | I798: =G798*6+H798 -> 79 | K798: 19 | L798: 14 | M798: =K798*6+L798 -> 128 | O798: 22 | P798: 17 | Q798: =O798*6+P798 -> 149 | S798: PRINCES PARK
A799: CAULFIELD | C799: 1 | D799: 5 | E799: =C799*6+D799 -> 11 | G799: 3 | H799: 12 | I799: =G799*6+H799 -> 30 | K799: 8 | L799: 15 | M799: =K799*6+L799 -> 63 | O799: 15 | P799: 20 | Q799: =O799*6+P799 -> 110 | S799: TORNEY
A800: BEST PLAYERS
A801: DANDENONG | D801: HIBBERT | G801: STUBBS | J801: SHINNERS | M801: THOMPSON | P801: HARPER | S801: HARRINGTON
A802: CAULFIELD | D802: O'SULLIVAN | G802: HUNT | J802: SIERAKOWSKI | M802: RICHARDS | P802: DAVIDSON | S802: HAYWOOD
A803: GOALKICKERS
A804: DANDENONG | D804: THOMPSON 5 | G804: HARRINGTON 3 | J804: HIBBERT 3 | M804: BRIESE 3 | O804: PAYZE 2 | Q804: FLAHERTY 2 | T804: BEVAN | V804: WRIGHT | X804: SHEVLIN | Z804: GOODES
A805: CAULFIELD | D805: O'SULLIVAN 4 | G805: SIERAKOWSKI 3 | J805: CLIFF 2 | L805: EINSEDEL 2 | O805: DAVIDSON | Q805: SELBY | S805: RICHARDS | V805: ROWE
A807: ROUND 18 | E807: 28TH AUGUST | M807: WEATHER | S807: PLAYED AT
D808: 1ST QTR | H808: 2ND QTR | L808: 3RD QTR | P808: FINAL | S808: PORT MELBOURNE
A809: PORT MELBOURNE | C809: 1 | D809: 3 | E809: =C809*6+D809 -> 9 | G809: 4 | H809: 8 | I809: =G809*6+H809 -> 32 | K809: 10 | L809: 13 | M809: =K809*6+L809 -> 73 | O809: 23 | P809: 15 | Q809: =O809*6+P809 -> 153 | S809: UMPIRE | X809: LADDER | AB809: ROUND | AD809: 18
A810: GEELONG WEST | C810: 5 | D810: 5 | E810: =C810*6+D810 -> 35 | G810: 10 | H810: 5 | I810: =G810*6+H810 -> 65 | K810: 11 | L810: 14 | M810: =K810*6+L810 -> 80 | O810: 18 | P810: 19 | Q810: =O810*6+P810 -> 127 | S810: MARCY
A811: BEST PLAYERS | W811: TEAM | X811: W | Y811: L | Z811: D | AA811: FOR | AB811: AGST | AC811: % | AD811: PTS
A812: PORT MELBOURNE | D812: P GOSS | G812: IVANOFF | I812: EVANS | L812: HARLAND | O812: COOK | Q812: BEECROFT
A813: GEELONG WEST | D813: HINDSON | G813: EDDY | I813: RADOJEVIC | L813: SCALE | O813: ROE | Q813: GILMORE | W813: PORT MELBOURNE | X813: 15 | Y813: 3 | Z813: 0 | AA813: 2326 | AB813: 1871 | AC813: 124.32 | AD813: 60
A814: GOALKICKERS | P814: HARLAND | R814: P GOSS | W814: SANDRINGHAM | X814: 13 | Y814: 5 | Z814: 0 | AA814: 2231 | AB814: 2106 | AC814: 105.94 | AD814: 52
A815: PORT MELBOURNE | D815: COOK 7 | F815: RASMUSSEN 5 | I815: EVANS 3 | K815: HAENAN 2 | N815: GREENING 2 | Q815: BEECROFT | S815: CHRISTOU | W815: COBURG | X815: 11 | Y815: 7 | Z815: 0 | AA815: 2001 | AB815: 1821 | AC815: =2001*100/1821 -> 109.8846787479407 | AD815: 44
A816: GEELONG WEST | D816: RADOJEVIC 6 | G816: ROE 3 | I816: WELLS 3 | K816: CHAPMAN 2 | N816: WOOLFE | P816: GILMORE | R816: FAGAN | T816: HINDSON | W816: BRUNSWICK | X816: 11 | Y816: 7 | Z816: 0 | AA816: 2041 | AB816: 1991 | AC816: =2041*100/1991 -> 102.51130085384229 | AD816: 44
A818: COBURG | C818: 5 | D818: 5 | E818: =C818*6+D818 -> 35 | G818: 10 | H818: 8 | I818: =G818*6+H818 -> 68 | K818: 20 | L818: 14 | M818: =K818*6+L818 -> 134 | O818: 29 | P818: 17 | Q818: =O818*6+P818 -> 191 | S818: COBURG | W818: DANDENONG | X818: 10 | Y818: 8 | Z818: 0 | AA818: 2005 | AB818: 1734 | AC818: =2005*100/1734 -> 115.62860438292964 | AD818: 40
A819: SANDRINGHAM | C819: 2 | D819: 2 | E819: =C819*6+D819 -> 14 | G819: 5 | H819: 10 | I819: =G819*6+H819 -> 40 | K819: 6 | L819: 13 | M819: =K819*6+L819 -> 49 | O819: 8 | P819: 19 | Q819: =O819*6+P819 -> 67 | S819: OGSTON | W819: GEELONG WEST | X819: 10 | Y819: 8 | Z819: 0 | AA819: 2105 | AB819: 2042 | AC819: 103.09 | AD819: 40
A820: BEST PLAYERS | W820: PRAHRAN | X820: 7 | Y820: 11 | Z820: 0 | AA820: 1893 | AB820: 2140 | AC820: 88.46 | AD820: 28
A821: COBURG | D821: HURST | G821: PERRY | J821: DOHNT | M821: STILLMAN | P821: PITT | R821: DOUGLAS | W821: CAULFIELD | X821: 6 | Y821: 12 | Z821: 0 | AA821: 2131 | AB821: 2226 | AC821: =2131*100/2226 -> 95.732255166217428 | AD821: 24
A822: SANDRINGHAM | D822: CLARK | G822: McNICHOLAS | J822: BELL | M822: O'BRIEN | W822: PRESTON | X822: 5 | Y822: 13 | Z822: 0 | AA822: 1993 | AB822: 2256 | AC822: =1993*100/2256 -> 88.342198581560282 | AD822: 20
A823: GOALKICKERS | F823: HERBERT 2 | I823: HURST 2 | L823: PERRY | N823: CLEARY | P823: LLOYD | R823: BURT | T823: DOHNT | W823: WILLIAMSTOWN | X823: 2 | Y823: 16 | Z823: 0 | AA823: 1696 | AB823: 2235 | AC823: =1696*100/2235 -> 75.883668903803127 | AD823: 8
A824: COBURG | D824: FORMOSA 7 | G824: ROBERTSON 3 | J824: HEADLAM 3 | M824: STILLMAN 3 | P824: BEATTIE 2 | R824: HODGETTS 2
A825: SANDRINGHAM | D825: BELL 3 | G825: O'BRIEN 2 | J825: HUTCHINSON | M825: McNICHOLAS | P825: BEUS
A827: DANDENONG | C827: 5 | D827: 9 | E827: =C827*6+D827 -> 39 | G827: 9 | H827: 11 | I827: =G827*6+H827 -> 65 | K827: 19 | L827: 18 | M827: =K827*6+L827 -> 132 | O827: 21 | P827: 24 | Q827: =O827*6+P827 -> 150 | S827: DANDENONG
A828: PRAHRAN | C828: 0 | D828: 3 | E828: =C828*6+D828 -> 3 | G828: 3 | H828: 7 | I828: =G828*6+H828 -> 25 | K828: 5 | L828: 7 | M828: =K828*6+L828 -> 37 | O828: 8 | P828: 13 | Q828: =O828*6+P828 -> 61 | S828: STABB
A829: BEST PLAYERS
A830: DANDENONG | D830: STUBBS | G830: TAYLOR | J830: REID | M830: HIBBERT | P830: BRIESE | R830: THOMPSON
A831: PRAHRAN | D831: KENT | G831: DOWELL | J831: ANDERSON
A832: GOALKICKERS
A833: DANDENONG | D833: FLAHERTY 6 | G833: THOMPSON 4 | J833: BRIESE 3 | L833: TAYLOR 3 | N833: PAYZE 2 | P833: HARRINGTON | S833: HIBBERT | V833: SHINNERS
A834: PRAHRAN | D834: AUSTIN 3 | G834: SMITH 2 | J834: GUNN | L834: CLARKE | N834: ANDERSON
A836: CAULFIELD | C836: 7 | D836: 4 | E836: =C836*6+D836 -> 46 | G836: 12 | H836: 11 | I836: =G836*6+H836 -> 83 | K836: 16 | L836: 13 | M836: =K836*6+L836 -> 109 | O836: 24 | P836: 19 | Q836: =O836*6+P836 -> 163 | S836: PRINCES PARK
A837: WILLIAMSTOWN | C837: 5 | D837: 2 | E837: =C837*6+D837 -> 32 | G837: 7 | H837: 8 | I837: =G837*6+H837 -> 50 | K837: 12 | L837: 13 | M837: =K837*6+L837 -> 85 | O837: 15 | P837: 15 | Q837: =O837*6+P837 -> 105 | S837: HEDGER
A838: BEST PLAYERS
A839: CAULFIELD | D839: O'SULLIVAN | G839: HAWKING | J839: RICHARDS | M839: EINSEDEL | P839: CLIFF | R839: DAVIDSON
A840: WILLIAMSTOWN | D840: GARDNER | G840: DONNELLY | J840: KERR | M840: ALLEN | P840: McVEIGH
A841: GOALKICKERS
A842: CAULFIELD | D842: O'SULLIVAN 5 | G842: CLIFF 5 | I842: BOOTH 3 | K842: ROWE 3 | M842: EINSEDEL 2 | P842: GOODEN 2 | R842: HAYWOOD | U842: HUNT | W842: SUTHERLAND | X842: KAY
A843: WILLIAMSTOWN | D843: GARDNER 4 | G843: BROWN 3 | I843: SCOTT 2 | K843: CROSS 2 | M843: NASH | O843: MAHONEY | Q843: COURTOT | S843: LOWE
A845: BRUNSWICK | C845: 8 | D845: 4 | E845: =C845*6+D845 -> 52 | G845: 9 | H845: 5 | I845: =G845*6+H845 -> 59 | K845: 21 | L845: 10 | M845: =K845*6+L845 -> 136 | O845: 25 | P845: 12 | Q845: =O845*6+P845 -> 162 | S845: PRESTON
A846: PRESTON | C846: 2 | D846: 4 | E846: =C846*6+D846 -> 16 | G846: 9 | H846: 11 | I846: =G846*6+H846 -> 65 | K846: 11 | L846: 15 | M846: =K846*6+L846 -> 81 | O846: 18 | P846: 27 | Q846: =O846*6+P846 -> 135 | S846: TORNEY
A847: BEST PLAYERS
A848: BRUNSWICK | D848: GINGELL | G848: MARANTELLI | J848: STONE | M848: JENKIN | P848: HALLEY | R848: ORTON
A849: PRESTON | D849: STEWART | G849: WILMOT | J849: MARKS | M849: RENWICK | P849: KING | R849: PREECE
A850: GOALKICKERS
A851: BRUNSWICK | D851: MARANTELLI 7 | G851: ORTON 5 | I851: HARVEY 5 | L851: GINGELL 3 | N851: JENKIN | P851: HUGGARD | R851: LAWRENCE | U851: STONE | W851: TOY
A852: PRESTON | D852: STEWART 5 | G852: LORENZINI 3 | J852: MARKS 3 | M852: CARLSON 2 | P852: CROXFORD | R852: CLIFFORD | U852: WILMOT | X852: RENWICK | AA852: WALSH
A854: FINALS
A855: 1ST SEMI | E855: 4TH SEPTEMBER | J855: WEATHER | N855: SOUTH WIND
D856: 1ST QTR | H856: 2ND QTR | L856: 3RD QTR | P856: FINAL
A857: COBURG | C857: 7 | D857: 5 | E857: =C857*6+D857 -> 47 | G857: 13 | H857: 6 | I857: =G857*6+H857 -> 84 | K857: 20 | L857: 10 | M857: =K857*6+L857 -> 130 | O857: 27 | P857: 11 | Q857: =O857*6+P857 -> 173 | S857: JUNCTION OVAL
A858: BRUNSWICK | C858: 6 | D858: 1 | E858: =C858*6+D858 -> 37 | G858: 10 | H858: 6 | I858: =G858*6+H858 -> 66 | K858: 13 | L858: 12 | M858: =K858*6+L858 -> 90 | O858: 20 | P858: 19 | Q858: =O858*6+P858 -> 139 | S858: STABB
A859: BEST PLAYERS
A860: COBURG | D860: DOHNT | G860: BURT | J860: DOUGLAS | M860: HURST | O860: ROBERTSON | R860: FORMOSA
A861: BRUNSWICK | D861: HARVEY | G861: GINGELL | J861: STONE | M861: ORTON | O861: MARANTELLI | R861: WEST
A862: GOALKICKERS
A863: COBURG | D863: ROBERTSON 6 | G863: FORMOSA 5 | J863: BEATTIE 5 | M863: HEADLAM 2 | P863: DOHNT 2 | R863: BURT 2 | T863: CLEARY 2 | W863: HERBERT 2 | X863: McMILLAN
A864: BRUNSWICK | D864: ORTON 4 | F864: MARANTELLI 4 | J864: HARVEY 3 | M864: GINGELL 2 | P864: WEST 2 | R864: STONE 2 | U864: JENKIN | W864: DELEDIO | X864: TOY
A866: 2ND SEMI | E866: 11TH SEPTEMBER | J866: WEATHER | N866: FINE
A867: PORT MELBOURNE | C867: 4 | D867: 14 | E867: =C867*6+D867 -> 38 | G867: 8 | H867: 19 | I867: =G867*6+H867 -> 67 | K867: 19 | L867: 24 | M867: =K867*6+L867 -> 138 | O867: 23 | P867: 28 | Q867: =O867*6+P867 -> 166 | S867: JUNCTION OVAL
A868: SANDRINGHAM | C868: 4 | D868: 1 | E868: =C868*6+D868 -> 25 | G868: 10 | H868: 4 | I868: =G868*6+H868 -> 64 | K868: 12 | L868: 5 | M868: =K868*6+L868 -> 77 | O868: 18 | P868: 7 | Q868: =O868*6+P868 -> 115 | S868: MARCY
A869: BEST PLAYERS
A870: PORT MELBOURNE | D870: EVANS | G870: RASMUSSEN | J870: CRITCH | M870: HARLAND | O870: P GOSS | R870: COOK
A871: SANDRINGHAM | D871: CLARK | G871: WILKINS | J871: HUTCHINSON | M871: LYONS | O871: McNICHOLAS
A872: GOALKICKERS
A873: PORT MELBOURNE | D873: COOK 9 | F873: HOLT 3 | H873: EVANS 3 | J873: CHRISTOU 2 | M873: HARLAND 2 | P873: RASMUSSEN | S873: CRITCH | U873: P GOSS | X873: HAENAN
A874: SANDRINGHAM | D874: HUTCHINSON 4 | G874: O'BRIEN 3 | I874: LYONS 3 | K874: CARROLL 2 | N874: McNICHOLAS 2 | R874: CLARK | T874: KENNEDY | W874: LAUBE | X874: BELL
A876: PRELIMINARY FINAL | F876: 18TH SEPTEMBER | K876: WEATHER | N876: SOUTH WEST WIND
A877: SANDRINGHAM | C877: 4 | D877: 8 | E877: =C877*6+D877 -> 32 | G877: 7 | H877: 13 | I877: =G877*6+H877 -> 55 | K877: 13 | L877: 20 | M877: =K877*6+L877 -> 98 | O877: 15 | P877: 23 | Q877: =O877*6+P877 -> 113 | S877: JUNCTION OVAL
A878: COBURG | C878: 3 | D878: 0 | E878: =C878*6+D878 -> 18 | G878: 5 | H878: 3 | I878: =G878*6+H878 -> 33 | K878: 6 | L878: 5 | M878: =K878*6+L878 -> 41 | O878: 16 | P878: 6 | Q878: =O878*6+P878 -> 102 | S878: STABB
A879: BEST PLAYERS
A880: SANDRINGHAM | D880: GOOLD | G880: KENNEDY | J880: LAUBE | M880: CLARK | O880: HUTCHINSON | R880: BELL
A881: COBURG | D881: HARTIGAN | G881: DOUGLAS | J881: PRICE | M881: HURST | O881: STILLMAN
A882: GOALKICKERS
A883: SANDRINGHAM | D883: HUTCHINSON 3 | G883: GILES 3 | I883: SIMS 2 | K883: O'BRIEN 2 | M883: LAUBE 2 | O883: GOOLD | Q883: KENNEDY | T883: BELL
A884: COBURG | D884: HODGETTS 4 | G884: CLEARY 3 | J884: ROBERTSON 2 | M884: DOHNT 2 | O884: FORMOSA 2 | R884: DOUGLAS | U884: BEATTIE | X884: PERRY
A886: GRAND FINAL | E886: 25TH SEPTEMBER | K886: WEATHER | M886: NORTH BREEZE FINE & SUNNY
A887: PORT MELBOURNE | C887: 6 | D887: 4 | E887: 40 | G887: 13 | H887: 9 | I887: 87 | K887: 18 | L887: 14 | M887: 122 | O887: 23 | P887: 19 | Q887: =O887*6+P887 -> 157 | S887: JUNCTION OVAL
A888: SANDRINGHAM | C888: 2 | D888: 2 | E888: 14 | G888: 3 | H888: 4 | I888: 22 | K888: 3 | L888: 8 | M888: 26 | O888: 7 | P888: 15 | Q888: =O888*6+P888 -> 57 | S888: MARCY
A889: BEST PLAYERS
A890: PORT MELBOURNE | D890: CHRISTOU | G890: GREENING | J890: COOK | M890: HOLT | O890: RASMUSSEN | R890: IVANOFF
A891: SANDRINGHAM | D891: KENNEDY | G891: HUTCHINSON | J891: FRANKLIN | M891: CLARK | O891: COELLI
A892: GOALKICKERS
A893: PORT MELBOURNE | D893: COOK 9 | G893: RASMUSSEN 5 | K893: CHRISTOU 4 | N893: HOLT 3 | P893: CLARK 2
A894: SANDRINGHAM | D894: SIMS 2 | G894: GILES | J894: LYONS | L894: KENNEDY | O894: O'BRIEN | R894: LAUBE
A896: REPRESENTATIVE MATCH | G896: 12TH JUNE
A897: QUEENSLAND | C897: 4 | D897: 2 | E897: =C897*6+D897 -> 26 | G897: 5 | H897: 4 | I897: =G897*6+H897 -> 34 | K897: 9 | L897: 14 | M897: =K897*6+L897 -> 68 | O897: 14 | P897: 18 | Q897: =O897*6+P897 -> 102
A898: V.F.A. | C898: 3 | D898: 6 | E898: =C898*6+D898 -> 24 | G898: 7 | H898: 10 | I898: =G898*6+H898 -> 52 | K898: 12 | L898: 15 | M898: =K898*6+L898 -> 87 | O898: 13 | P898: 17 | Q898: =O898*6+P898 -> 95 | S898: SIMMONS
A899: BEST PLAYERS
A900: QUEENSLAND | D900: CRAIG | G900: HAYES | J900: MOLONEY | M900: TAYLOR | O900: WILLEMSE | R900: PELLY
A901: V.F.A. | D901: COOK | G901: GINGELL | J901: PROFFIT | M901: DOHNT | O901: ROBERTSON | R901: THOMPSON
A902: GOALKICKERS
A903: QUEENSLAND | D903: CRAIG 5 | G903: RUSHBROOK 3 | J903: CAPPELINI 2 | M903: CLARKE 2 | P903: BROWNE | R903: OMELANIK
A904: V.F.A. | D904: COOK 9 | G904: GOSS | I904: GINGELL | K904: FRIEND | M904: KELLY
A906: CENTENARY CUP
A907: 1ST ROUND | E907: 22ND MAY | I907: WEATHER | L907: SHOWERS
D908: 1ST QTR | H908: 2ND QTR | L908: 3RD QTR | P908: FINAL
A909: GEELONG WEST | C909: 4 | D909: 6 | E909: =C909*6+D909 -> 30 | G909: 7 | H909: 10 | I909: =G909*6+H909 -> 52 | K909: 14 | L909: 13 | M909: =K909*6+L909 -> 97 | O909: 17 | P909: 16 | Q909: =O909*6+P909 -> 118 | S909: GEELONG WEST
A910: MORDIALLOC | C910: 3 | D910: 5 | E910: =C910*6+D910 -> 23 | G910: 5 | H910: 13 | I910: =G910*6+H910 -> 43 | K910: 11 | L910: 16 | M910: =K910*6+L910 -> 82 | O910: 16 | P910: 20 | Q910: =O910*6+P910 -> 116 | S910: STABB
A911: BEST PLAYERS
A912: GEELONG WEST | D912: FAGAN | G912: CHAPMAN | J912: DEEATH | M912: YATES | O912: SMITH
A913: MORDIALLOC | D913: DINGLE | G913: WALSH | J913: CRITCH | M913: NORRIS | O913: LANG | Q913: JOHNSTONE
A914: GOALKICKERS
A915: GEELONG WEST | D915: RADOJEVIC 4 | G915: YATES 3 | I915: STENNETT 3 | L915: WOOLFE 3 | N915: FAGAN 2 | Q915: DEEATH | S915: SMITH
A916: MORDIALLOC | D916: DINGLE 3 | G916: BLOOMFIELD 3 | J916: MILDENHALL 2 | N916: NORRIS 2 | Q916: WILLIAMSON 2 | U916: DEATON (2) | X916: ROSENOW | AA916: NEVILLE
A918: CAULFIELD | C918: 4 | D918: 6 | E918: =C918*6+D918 -> 30 | G918: 7 | H918: 9 | I918: =G918*6+H918 -> 51 | K918: 13 | L918: 12 | M918: =K918*6+L918 -> 90 | O918: 17 | P918: 17 | Q918: =O918*6+P918 -> 119 | S918: PRESTON
A919: PRESTON | C919: 4 | D919: 0 | E919: =C919*6+D919 -> 24 | G919: 9 | H919: 2 | I919: =G919*6+H919 -> 56 | K919: 15 | L919: 6 | M919: =K919*6+L919 -> 96 | O919: 18 | P919: 10 | Q919: =O919*6+P919 -> 118 | S919: TORNEY
A920: BEST PLAYERS
A921: CAULFIELD | D921: EINSEDEL | G921: CLIFF | J921: IRELAND | M921: ROWE | O921: HAYWOOD
A922: PRESTON | D922: CLIFFORD | G922: PREECE | J922: KING
A923: GOALKICKERS
A924: CAULFIELD | D924: CLIFF 6 | G924: ALLAN 3 | J924: ROWE 2 | L924: MILNER 2 | N924: CRUSE 2 | P924: O'SULLIVAN | S924: IRELAND
A925: PRESTON | D925: MARKS 5 | G925: STEWART 5 | J925: CARLSON 3 | M925: CROOK 2 | O925: CLIFFORD 2 | R925: O'SULLIVAN
A927: PRAHRAN | C927: 4 | D927: 3 | E927: =C927*6+D927 -> 27 | G927: 10 | H927: 6 | I927: =G927*6+H927 -> 66 | K927: 14 | L927: 6 | M927: =K927*6+L927 -> 90 | O927: 18 | P927: 9 | Q927: =O927*6+P927 -> 117 | S927: YARRAVILLE
A928: YARRAVILLE | C928: 5 | D928: 5 | E928: =C928*6+D928 -> 35 | G928: 11 | H928: 9 | I928: =G928*6+H928 -> 75 | K928: 13 | L928: 10 | M928: =K928*6+L928 -> 88 | O928: 15 | P928: 12 | Q928: =O928*6+P928 -> 102 | S928: MARCY
A929: BEST PLAYERS
A930: PRAHRAN | D930: RIPPON | G930: JOHNSTON | J930: KENT | M930: SMITH | O930: CLAY | R930: DOWELL
A931: YARRAVILLE | D931: THORPE | G931: SIMMONS | J931: WELLINGTON | M931: RYAN | O931: JONES | R931: SAIT
A932: GOALKICKERS
A933: PRAHRAN | D933: JOHNSTON 5 | G933: SMITH 5 | I933: THORNTON 3 | L933: BRACHER 3 | O933: GROSS 2
A934: YARRAVILLE | D934: BISSET 4 | G934: SAIT 3 | I934: GRANDIN 3 | L934: GIBSON 2 | O934: SIMMONS | Q934: HAYES | S934: KEOGH
A936: FRANKSTON | C936: 4 | D936: 6 | E936: =C936*6+D936 -> 30 | G936: 12 | H936: 10 | I936: =G936*6+H936 -> 82 | K936: 13 | L936: 13 | M936: =K936*6+L936 -> 91 | O936: 21 | P936: 22 | Q936: =O936*6+P936 -> 148 | S936: FRANKSTON
A937: SANDRINGHAM | C937: 7 | D937: 4 | E937: =C937*6+D937 -> 46 | G937: 10 | H937: 8 | I937: =G937*6+H937 -> 68 | K937: 15 | L937: 13 | M937: =K937*6+L937 -> 103 | O937: 19 | P937: 13 | Q937: =O937*6+P937 -> 127 | S937: SNOOKS
A938: BEST PLAYERS
A939: FRANKSTON | D939: JONES | G939: LEWIS | J939: MACE | M939: KENNEDY | O939: LLOYD | R939: LOCCO
A940: SANDRINGHAM | D940: ADAMS | G940: KENNEDY | J940: PETERS
A941: GOALKICKERS
A942: FRANKSTON | D942: HARRISON 4 | G942: DAVIES 3 | I942: ELLIS 3 | K942: JONES 3 | M942: BOYD 3 | O942: CLARKE 2 | R942: GUY 2 | T942: KENNEDY
A943: SANDRINGHAM | D943: BEUS 4 | F943: DUNN 3 | H943: SIMPSON 3 | K943: McCONNELL 3 | N943: PETERS 2 | Q943: DYNON 2 | S943: CARROLL | V943: HUNTER
A945: COBURG | C945: 6 | D945: 5 | E945: =C945*6+D945 -> 41 | G945: 8 | H945: 13 | I945: =G945*6+H945 -> 61 | K945: 18 | L945: 13 | M945: =K945*6+L945 -> 121 | O945: 23 | P945: 19 | Q945: =O945*6+P945 -> 157 | S945: COBURG
A946: WILLIAMSTOWN | C946: 1 | D946: 2 | E946: =C946*6+D946 -> 8 | G946: 5 | H946: 2 | I946: =G946*6+H946 -> 32 | K946: 10 | L946: 5 | M946: =K946*6+L946 -> 65 | O946: 15 | P946: 7 | Q946: =O946*6+P946 -> 97 | S946: WENN
A947: BEST PLAYERS
A948: COBURG | D948: McTAGGART | G948: BURT | J948: HEADLAM | M948: PERRY | O948: MANNIX | R948: R HERBERT
A949: WILLIAMSTOWN | D949: MAHONEY | G949: ALEXANDER | J949: BRINER | M949: NASH | O949: HICKMAN | R949: KENNEDY
A950: GOALKICKERS
A951: COBURG | D951: HEADLAM 5 | G951: BURT 3 | I951: McDONALD 3 | L951: PERRY 3 | N951: R HERBERT 2 | Q951: WESCOMBE 2 | T951: McMILLAN 2 | X951: DOUGLAS | AA951: ROBERTSON | AC951: MANNIX
A952: WILLIAMSTOWN | D952: LOWE 3 | F952: POTTER 3 | I952: CROSS 2 | K952: GARDNER 2 | N952: BRINER | P952: DONNELLY | R952: DIXON | T952: FANNING | W952: NASH
A954: BRUNSWICK | C954: 4 | D954: 7 | E954: =C954*6+D954 -> 31 | G954: 6 | H954: 10 | I954: =G954*6+H954 -> 46 | K954: 12 | L954: 19 | M954: =K954*6+L954 -> 91 | O954: 16 | P954: 24 | Q954: =O954*6+P954 -> 120 | S954: OAKLEIGH
A955: OAKLEIGH | C955: 2 | D955: 4 | E955: =C955*6+D955 -> 16 | G955: 5 | H955: 6 | I955: =G955*6+H955 -> 36 | K955: 9 | L955: 9 | M955: =K955*6+L955 -> 63 | O955: 10 | P955: 12 | Q955: =O955*6+P955 -> 72 | S955: O'BRIEN
A956: BEST PLAYERS
A957: BRUNSWICK | D957: BUCKLEY | G957: HALLEY | J957: WEST | M957: DEMETRIOU | P957: O'CALLAGHAN | S957: CARLTON
A958: OAKLEIGH | D958: EDWARDS | G958: HAY | J958: NESBIT | M958: FRYER | P958: KING
A959: GOALKICKERS
A960: BRUNSWICK | D960: HUGGARD 3 | G960: ORTON 2 | I960: BYRNE 2 | K960: DEMETRIOU 2 | N960: HALLEY 2 | Q960: CARLTON | S960: O'CALLAGHAN | W960: JENKIN | X960: WILLIAMS | AA960: BUCKLEY
A961: OAKLEIGH | D961: COLCOTT 3 | G961: FRYER 2 | I961: BURKE 2 | K961: HAY | L961: McMAHON | N961: WATT
A963: DANDENONG | C963: 3 | D963: 6 | E963: =C963*6+D963 -> 24 | G963: 11 | H963: 10 | I963: =G963*6+H963 -> 76 | K963: 15 | L963: 16 | M963: =K963*6+L963 -> 106 | O963: 20 | P963: 19 | Q963: =O963*6+P963 -> 139 | S963: DANDENONG
A964: CAMBERWELL | C964: 2 | D964: 4 | E964: =C964*6+D964 -> 16 | G964: 5 | H964: 6 | I964: =G964*6+H964 -> 36 | K964: 9 | L964: 8 | M964: =K964*6+L964 -> 62 | O964: 13 | P964: 12 | Q964: =O964*6+P964 -> 90 | S964: OGSTON
A965: BEST PLAYERS
A966: DANDENONG | D966: BRIESE | G966: LYNN | J966: VAN DE BEEK | M966: TAYLOR | O966: SHEVLIN | R966: BADROCK
A967: CAMBERWELL | D967: JUDD | G967: PHILLIPS | J967: FITZGERALD | M967: SPITHILL | O967: MARTIN | R967: HAZLETT
A968: GOALKICKERS
A969: DANDENONG | D969: BRIESE 6 | F969: SHEVLIN 5 | I969: WRIGHT 4 | K969: HARRINGTON | N969: HIBBERT | P969: SHINNERS | R969: LYNN | T969: McCONNELL
A970: CAMBERWELL | D970: B SMITH 4 | G970: FITZGERALD 4 | J970: HARROP 2 | M970: HUMPHREY | P970: WALLACE | R970: POWER
A972: PORT MELBOURNE | C972: 6 | D972: 4 | E972: =C972*6+D972 -> 40 | G972: 15 | H972: 17 | I972: =G972*6+H972 -> 107 | K972: 18 | L972: 22 | M972: =K972*6+L972 -> 130 | O972: 22 | P972: 32 | Q972: =O972*6+P972 -> 164 | S972: PORT MELBOURNE
A973: WERRIBEE | C973: 0 | D973: 5 | E973: =C973*6+D973 -> 5 | G973: 1 | H973: 9 | I973: =G973*6+H973 -> 15 | K973: 5 | L973: 15 | M973: =K973*6+L973 -> 45 | O973: 7 | P973: 19 | Q973: =O973*6+P973 -> 61 | S973: STEERE
A974: BEST PLAYERS
A975: PORT MELBOURNE | D975: CRITCH | G975: IVANOFF | J975: ALLEN | M975: CHRISTOU | O975: EVANS | R975: GREENING
A976: WERRIBEE | D976: LYNCH | G976: OUGH | J976: G BELLIN | M976: LYONS | O976: J BELLIN
A977: GOALKICKERS
A978: PORT MELBOURNE | D978: COOK 6 | F978: CHRISTOU 6 | I978: P GOSS 3 | K978: EVANS | M978: RASMUSSEN | P978: ALLEN | R978: HAENAN | U978: STIBBARD | X978: DALEY | Z978: CRITCH
A979: WERRIBEE | D979: OUGH 3 | G979: JACK | I979: LYONS | K979: LYNCH | M979: MITCHELL
A981: QUARTER FINALS | E981: 3RD JULY | J981: WEATHER | O981: FINE BUT GROUNDS BAD
A982: DANDENONG | C982: 3 | D982: 2 | E982: =C982*6+D982 -> 20 | G982: 5 | H982: 5 | I982: =G982*6+H982 -> 35 | K982: 6 | L982: 9 | M982: =K982*6+L982 -> 45 | O982: 10 | P982: 9 | Q982: =O982*6+P982 -> 69 | S982: BRUNSWICK
A983: BRUNSWICK | C983: 0 | D983: 2 | E983: =C983*6+D983 -> 2 | G983: 4 | H983: 6 | I983: =G983*6+H983 -> 30 | K983: 7 | L983: 9 | M983: =K983*6+L983 -> 51 | O983: 8 | P983: 10 | Q983: =O983*6+P983 -> 58 | S983: FITZPATRICK
A984: BEST PLAYERS
A985: DANDENONG | D985: PAYZE | G985: REID | J985: TAYLOR | M985: HARRINGTON | P985: LYNN | R985: STUBBS
A986: BRUNSWICK | D986: NOLAN | G986: BUCKLEY | J986: CARLTON | M986: ROWE | P986: HADZILLIAS
A987: GOALKICKERS
A988: DANDENONG | D988: BRIESE 3 | G988: PAYZE 2 | I988: THOMPSON | L988: FLAHERTY | N988: McCONNELL | Q988: GOODES | S988: TAYLOR
A989: BRUNSWICK | D989: HOGAN 2 | G989: CARLTON 2 | J989: HUGGARD 2 | M989: ORTON | O989: HADZILLIAS
A991: PORT MELBOURNE | C991: 3 | D991: 3 | E991: =C991*6+D991 -> 21 | G991: 5 | H991: 3 | I991: =G991*6+H991 -> 33 | K991: 9 | L991: 6 | M991: =K991*6+L991 -> 60 | O991: 13 | P991: 9 | Q991: =O991*6+P991 -> 87 | S991: PORT MELBOURNE
A992: COBURG | C992: 4 | D992: 3 | E992: =C992*6+D992 -> 27 | G992: 4 | H992: 6 | I992: =G992*6+H992 -> 30 | K992: 7 | L992: 9 | M992: =K992*6+L992 -> 51 | O992: 9 | P992: 12 | Q992: =O992*6+P992 -> 66 | S992: HUGGINS
A993: BEST PLAYERS
A994: PORT MELBOURNE | D994: HOLT | G994: GREENING | J994: PROFFIT | M994: BEECROFT | P994: CRITCH | R994: EVANS
A995: COBURG | D995: DOUGLAS | G995: PERRY | J995: SRILLMAN | M995: DOHNT | P995: BURT
A996: GOALKICKERS
A997: PORT MELBOURNE | D997: COOK 6 | G997: STIBBARD 2 | J997: CRITCH | L997: EVANS | N997: HAENAN | P997: BEECROFT | R997: HOLT
A998: COBURG | D998: CLEARY 3 | G998: R HERBERT 2 | J998: DOHNT | L998: PRICE | N998: HARTIGAN | Q998: McDONALD
A1000: CAULFIELD | C1000: 3 | D1000: 3 | E1000: =C1000*6+D1000 -> 21 | G1000: 8 | H1000: 8 | I1000: =G1000*6+H1000 -> 56 | K1000: 11 | L1000: 12 | M1000: =K1000*6+L1000 -> 78 | O1000: 17 | P1000: 14 | Q1000: =O1000*6+P1000 -> 116 | S1000: PRINCES PARK
A1001: GEELONG WEST | C1001: 8 | D1001: 4 | E1001: =C1001*6+D1001 -> 52 | G1001: 10 | H1001: 5 | I1001: =G1001*6+H1001 -> 65 | K1001: 12 | L1001: 14 | M1001: =K1001*6+L1001 -> 86 | O1001: 15 | P1001: 16 | Q1001: =O1001*6+P1001 -> 106 | S1001: HEDGER
A1002: BEST PLAYERS
A1003: CAULFIELD | D1003: TEMPEST | G1003: HAYWOOD | J1003: EINSEDEL | M1003: SIERAKOWSKI | P1003: DAVIDSON | S1003: BALL
A1004: GEELONG WEST | D1004: SCALE | G1004: WOOLFE | J1004: N EDDY | M1004: FAGAN | P1004: RUSSELL | S1004: BEEKOF
A1005: GOALKICKERS
A1006: CAULFIELD | D1006: CRUSE 4 | F1006: CLIFF 3 | H1006: MILNER 3 | J1006: HAYWOOD 2 | M1006: ROWE 2 | O1006: BECK | Q1006: TEMPEST | S1006: GOODEN
A1007: GEELONG WEST | D1007: WOOLFE 4 | G1007: FAGAN 4 | I1007: MIDDLEMISS 2 | L1007: STENNETT 2 | O1007: RADOJEVIC 2 | R1007: LEORKE
E1008: 6TH JULY | J1008: WEATHER | M1008: FINE
A1009: PRAHRAN | C1009: 10 | D1009: 6 | E1009: =C1009*6+D1009 -> 66 | G1009: 18 | H1009: 7 | I1009: =G1009*6+H1009 -> 115 | K1009: 24 | L1009: 11 | M1009: =K1009*6+L1009 -> 155 | O1009: 31 | P1009: 13 | Q1009: =O1009*6+P1009 -> 199 | S1009: TOORAK PARK
A1010: FRANKSTON | C1010: 0 | D1010: 5 | E1010: =C1010*6+D1010 -> 5 | G1010: 2 | H1010: 8 | I1010: =G1010*6+H1010 -> 20 | K1010: 7 | L1010: 11 | M1010: =K1010*6+L1010 -> 53 | O1010: 11 | P1010: 12 | Q1010: =O1010*6+P1010 -> 78 | S1010: MARCY
A1011: BEST PLAYERS
A1012: PRAHRAN | D1012: McFAULL | G1012: JOHNSTON | J1012: ZEMSKI | M1012: CLARKE | P1012: HYNES | S1012: PEPE
A1013: FRANKSTON | D1013: TICKELL | G1013: NORRIS | J1013: CARLSON | M1013: HUNTER | P1013: PETERS | S1013: WORTHINGTON
A1014: GOALKICKERS
A1015: PRAHRAN | D1015: McFAULL 6 | G1015: ANDERSON 5 | J1015: GUNN 4 | L1015: THORNTON 4 | O1015: JOHNSTON 3 | R1015: AUSTIN 3 | U1015: HYNES 3 | X1015: PEPE 3
A1016: FRANKSTON | D1016: ROSENBROCK (3) | G1016: GEDDES (2) | J1016: HUNTER (2) | M1016: WORTHINGTON (2) | Q1016: BOYD | S1016: CARLSON
A1018: SEMI FINALS | D1018: 1ST SEMI | G1018: 3RD AUGUST
A1019: PORT MELBOURNE | C1019: 3 | D1019: 4 | E1019: =C1019*6+D1019 -> 22 | G1019: 9 | H1019: 11 | I1019: =G1019*6+H1019 -> 65 | K1019: 13 | L1019: 15 | M1019: =K1019*6+L1019 -> 93 | O1019: 20 | P1019: 17 | Q1019: =O1019*6+P1019 -> 137 | S1019: SOUTH MELBOURNE
A1020: PRAHRAN | C1020: 1 | D1020: 0 | E1020: =C1020*6+D1020 -> 6 | G1020: 3 | H1020: 3 | I1020: =G1020*6+H1020 -> 21 | K1020: 5 | L1020: 7 | M1020: =K1020*6+L1020 -> 37 | O1020: 7 | P1020: 9 | Q1020: =O1020*6+P1020 -> 51 | S1020: TORNEY
A1021: BEST PLAYERS
A1022: PORT MELBOURNE | D1022: HOLT | G1022: SWAN | J1022: EVANS | M1022: BOND | P1022: PROFFIT | S1022: GREENING
A1023: PRAHRAN | D1023: JOHNSTON | G1023: AUSTIN | J1023: McGUINNESS | M1023: KELLY | P1023: ROBERTS | S1023: McFAULL
A1024: GOALKICKERS
A1025: PORT MELBOURNE | D1025: COOK 6 | F1025: BOND 4 | H1025: HOLT 3 | J1025: HAENAN 2 | M1025: EVANS 2 | O1025: ALLEN | Q1025: RASMUSSEN | T1025: ANDERSON
A1026: PRAHRAN | D1026: CLAY 2 | G1026: RIPPON | J1026: JOHNSTON | M1026: ALLDAY | O1026: AUSTIN | Q1026: HYNES
A1028: 2ND SEMI | E1028: 10TH AUGUST
A1029: CAULFIELD | C1029: 3 | D1029: 7 | E1029: =C1029*6+D1029 -> 25 | G1029: 8 | H1029: 10 | I1029: =G1029*6+H1029 -> 58 | K1029: 11 | L1029: 12 | M1029: =K1029*6+L1029 -> 78 | O1029: 18 | P1029: 15 | Q1029: =O1029*6+P1029 -> 123 | S1029: SOUTH MELBOURNE
A1030: DANDENONG | C1030: 6 | D1030: 0 | E1030: =C1030*6+D1030 -> 36 | G1030: 9 | H1030: 2 | I1030: =G1030*6+H1030 -> 56 | K1030: 12 | L1030: 7 | M1030: =K1030*6+L1030 -> 79 | O1030: 13 | P1030: 8 | Q1030: =O1030*6+P1030 -> 86
A1031: BEST PLAYERS
A1032: CAULFIELD | D1032: O'SULLIVAN | G1032: DAVIDSON | J1032: HAYWOOD | M1032: SELBY | P1032: MILNER | S1032: GOODEN
A1033: DANDENONG | D1033: PAYZE | G1033: SHINNERS | J1033: HIBBERT | M1033: BRIESE | P1033: WRIGHT | S1033: McCONNELL
A1034: GOALKICKERS
A1035: CAULFIELD | D1035: O'SULLIVAN 4 | G1035: DAVIDSON 3 | J1035: GOODEN 3 | M1035: CLIFF 2 | O1035: MILNER 2 | Q1035: EINSEDEL | S1035: HAYWOOD | V1035: BOOTH | X1035: SUTHERLAND
A1036: DANDENONG | D1036: PAYZE 5 | G1036: WRIGHT 3 | J1036: FLAHERTY 2 | M1036: LYNN 2 | O1036: HARRINGTON
A1038: FINAL | E1038: 14TH AUGUST
A1039: PORT MELBOURNE | C1039: 6 | D1039: 6 | E1039: =C1039*6+D1039 -> 42 | G1039: 13 | H1039: 10 | I1039: =G1039*6+H1039 -> 88 | K1039: 21 | L1039: 11 | M1039: =K1039*6+L1039 -> 137 | O1039: 26 | P1039: 16 | Q1039: =O1039*6+P1039 -> 172 | S1039: TOORAK PARK
A1040: CAULFIELD | C1040: 3 | D1040: 2 | E1040: =C1040*6+D1040 -> 20 | G1040: 6 | H1040: 4 | I1040: =G1040*6+H1040 -> 40 | K1040: 8 | L1040: 8 | M1040: =K1040*6+L1040 -> 56 | O1040: 15 | P1040: 11 | Q1040: =O1040*6+P1040 -> 101 | S1040: STABB
A1041: BEST PLAYERS
A1042: PORT MELBOURNE | D1042: COOK | G1042: BEECROFT | J1042: HOLT | M1042: IVANOFF | O1042: STIBBARD | R1042: HARLAND
A1043: CAULFIELD | D1043: O'SULLIVAN | G1043: TEMPEST | J1043: SIERAKOWSKI | M1043: DAVIDSON | O1043: HAYWOOD | R1043: SELBY
A1044: GOALKICKERS
A1045: PORT MELBOURNE | D1045: COOK (12) | G1045: HOLT (5) | J1045: CHRISTOU (4) | M1045: BOND (2) | O1045: CRITCH | Q1045: EVANS | S1045: ANDERSON
A1046: CAULFIELD | D1046: O'SULLIVAN (7) | G1046: MILNER (2) | J1046: SUTHERLAND | M1046: HAYWOOD | O1046: EINSEDEL | R1046: BOOTH
A1048: LIGHTNING PREMIERSHIP
A1049: 1ST ROUND
A1050: WERRIBEE | C1050: 6 | D1050: 8 | E1050: =C1050*6+D1050 -> 44
A1051: BOX HILL | C1051: 4 | D1051: 4 | E1051: =C1051*6+D1051 -> 28
A1053: WAVERLEY | C1053: 5 | D1053: 1 | E1053: =C1053*6+D1053 -> 31
A1054: SUNSHINE | C1054: 3 | D1054: 1 | E1054: =C1054*6+D1054 -> 19
A1056: 2ND ROUND
A1057: FRANKSTON | C1057: 8 | D1057: 4 | E1057: =C1057*6+D1057 -> 52
A1058: WERRIBEE | C1058: 6 | D1058: 2 | E1058: =C1058*6+D1058 -> 38
A1060: NORTHCOTE | C1060: 7 | D1060: 8 | E1060: =C1060*6+D1060 -> 50
A1061: WAVERLEY | C1061: 5 | D1061: 4 | E1061: =C1061*6+D1061 -> 34
A1063: 3RD ROUND
A1064: PRAHRAN | C1064: 7 | D1064: 4 | E1064: =C1064*6+D1064 -> 46
A1065: WILLIAMSTOWN | C1065: 4 | D1065: 3 | E1065: =C1065*6+D1065 -> 27
A1067: CAULFIELD | C1067: 6 | D1067: 7 | E1067: =C1067*6+D1067 -> 43
A1068: PRESTON | C1068: 5 | D1068: 5 | E1068: =C1068*6+D1068 -> 35
A1070: 4TH ROUND
A1071: FRANKSTON | C1071: 6 | D1071: 4 | E1071: =C1071*6+D1071 -> 40
A1072: NORTHCOTE | C1072: 5 | D1072: 4 | E1072: =C1072*6+D1072 -> 34
A1074: CAULFIELD | C1074: 9 | D1074: 5 | E1074: =C1074*6+D1074 -> 59
A1075: PRAHRAN | C1075: 3 | D1075: 4 | E1075: =C1075*6+D1075 -> 22
A1077: SEMI FINALS
A1078: DANDENONG | C1078: 5 | D1078: 3 | E1078: =C1078*6+D1078 -> 33
A1079: FRANKSTON | C1079: 1 | D1079: 6 | E1079: =C1079*6+D1079 -> 12
A1081: CAULFIELD | C1081: 5 | D1081: 6 | E1081: =C1081*6+D1081 -> 36
A1082: GEELONG WEST | C1082: 2 | D1082: 12 | E1082: =C1082*6+D1082 -> 24
A1084: FINAL
A1085: CAULFIELD | C1085: 4 | D1085: 7 | E1085: =C1085*6+D1085 -> 31
A1086: DANDENONG | C1086: 4 | D1086: 3 | E1086: =C1086*6+D1086 -> 27
A1088: ARDMONA CUP
A1089: 1ST ROUND | E1089: 20TH MARCH
D1090: 1ST QTR | H1090: 2ND QTR | L1090: 3RD QTR | P1090: FINAL
A1091: CLAREMONT | C1091: 2 | D1091: 0 | E1091: =C1091*6+D1091 -> 12 | G1091: 4 | H1091: 3 | I1091: =G1091*6+H1091 -> 27 | K1091: 10 | L1091: 6 | M1091: =K1091*6+L1091 -> 66 | O1091: 13 | P1091: 7 | Q1091: =O1091*6+P1091 -> 85
A1092: STH ADELAIDE | C1092: 0 | D1092: 0 | E1092: =C1092*6+D1092 -> 0 | G1092: 2 | H1092: 3 | I1092: =G1092*6+H1092 -> 15 | K1092: 4 | L1092: 3 | M1092: =K1092*6+L1092 -> 27 | O1092: 8 | P1092: 5 | Q1092: =O1092*6+P1092 -> 53
A1093: BEST PLAYERS
A1094: CLAREMONT
A1095: STH ADELAIDE
A1096: GOALKICKERS
A1097: CLAREMONT
A1098: STH ADELAIDE
A1100: WEST PERTH | C1100: 4 | D1100: 4 | E1100: =C1100*6+D1100 -> 28 | G1100: 8 | H1100: 8 | I1100: =G1100*6+H1100 -> 56 | K1100: 11 | L1100: 11 | M1100: =K1100*6+L1100 -> 77 | O1100: 16 | P1100: 20 | Q1100: =O1100*6+P1100 -> 116
A1101: NTH ADELAIDE | C1101: 3 | D1101: 1 | E1101: =C1101*6+D1101 -> 19 | G1101: 3 | H1101: 4 | I1101: =G1101*6+H1101 -> 22 | K1101: 7 | L1101: 10 | M1101: =K1101*6+L1101 -> 52 | O1101: 9 | P1101: 11 | Q1101: =O1101*6+P1101 -> 65
A1102: BEST PLAYERS
A1103: WEST PERTH
A1104: NTH ADELAIDE
A1105: GOALKICKERS
A1106: WEST PERTH
A1107: NTH ADELAIDE
A1109: EAST FREMANTLE | C1109: 2 | D1109: 3 | E1109: =C1109*6+D1109 -> 15 | G1109: 5 | H1109: 3 | I1109: =G1109*6+H1109 -> 33 | K1109: 7 | L1109: 4 | M1109: =K1109*6+L1109 -> 46 | O1109: 14 | P1109: 9 | Q1109: =O1109*6+P1109 -> 93
A1110: WEST ADELAIDE | C1110: 3 | D1110: 2 | E1110: =C1110*6+D1110 -> 20 | G1110: 4 | H1110: 5 | I1110: =G1110*6+H1110 -> 29 | K1110: 8 | L1110: 6 | M1110: =K1110*6+L1110 -> 54 | O1110: 9 | P1110: 9 | Q1110: =O1110*6+P1110 -> 63
A1111: BEST PLAYERS
A1112: EAST FREMANTLE
A1113: WEST ADELAIDE
A1114: GOALKICKERS
A1115: EAST FREMANTLE
A1116: WEST ADELAIDE
D1118: 5TH APRIL
A1119: PRESTON | C1119: 4 | D1119: 2 | E1119: =C1119*6+D1119 -> 26 | G1119: 5 | H1119: 6 | I1119: =G1119*6+H1119 -> 36 | K1119: 11 | L1119: 9 | M1119: =K1119*6+L1119 -> 75 | O1119: 15 | P1119: 10 | Q1119: =O1119*6+P1119 -> 100
A1120: N.S.W. | C1120: 0 | D1120: 2 | E1120: =C1120*6+D1120 -> 2 | G1120: 2 | H1120: 5 | I1120: =G1120*6+H1120 -> 17 | K1120: 8 | L1120: 5 | M1120: =K1120*6+L1120 -> 53 | O1120: 11 | P1120: 7 | Q1120: =O1120*6+P1120 -> 73
A1121: BEST PLAYERS
A1122: PRESTON | D1122: MARSHALL | G1122: WOOD | J1122: O'SULLIVAN | M1122: SALTMARSH | P1122: SANDERSON
A1123: N.S.W. | D1123: PENDERICK | G1123: PRENTICE | J1123: PERIS | M1123: GOSS | P1123: JEWELL
A1124: GOALKICKERS
A1125: PRESTON | D1125: O'SULLIVAN 4 | G1125: WOOD 3 | I1125: RINGIN 2 | K1125: SMITH 2 | M1125: NEWTON | O1125: SANDERSON | R1125: WILMOT | U1125: DURWOOD
A1126: N.S.W. | D1126: PERIS 3 | G1126: PENDERICK 3 | J1126: GOSS 2 | L1126: McLEAN 2 | O1126: PRENTICE
D1128: 12TH APRIL
A1129: DANDENONG | C1129: 4 | D1129: 2 | E1129: =C1129*6+D1129 -> 26 | G1129: 7 | H1129: 5 | I1129: =G1129*6+H1129 -> 47 | K1129: 10 | L1129: 6 | M1129: =K1129*6+L1129 -> 66 | O1129: 14 | P1129: 8 | Q1129: =O1129*6+P1129 -> 92
A1130: CENTRAL DISTRICTS | C1130: 3 | D1130: 7 | E1130: =C1130*6+D1130 -> 25 | G1130: 5 | H1130: 9 | I1130: =G1130*6+H1130 -> 39 | K1130: 8 | L1130: 13 | M1130: =K1130*6+L1130 -> 61 | O1130: 11 | P1130: 17 | Q1130: =O1130*6+P1130 -> 83
A1131: BEST PLAYERS
A1132: DANDENONG | D1132: HIBBERT | G1132: PAYZE | J1132: LUKAS | L1132: VAN DE BEEK | O1132: McCONNELL | R1132: REID
A1133: CENTRAL DISTRICTS | D1133: VIVIAN | G1133: MOREY | J1133: SKINNER | L1133: NALDER | O1133: M NORSWORTHY | R1133: HARRINGTON
A1134: GOALKICKERS
A1135: DANDENONG | D1135: LUKAS 3 | F1135: PAYZE 2 | H1135: FLAHERTY 2 | K1135: HIBBERT | M1135: BEVAN | O1135: WRIGHT | Q1135: THOMPSON | T1135: MILLER | W1135: MCCONNELL | X1135: VAN DE BEEK
A1136: CENTRAL DISTRICTS | D1136: HARRINGTON 3 | G1136: M NORSWORTHY 2 | K1136: RUDD 2 | M1136: PRICE | O1136: BEYTHEN | Q1136: HUGHES | S1136: HEINRICH
D1137: 19TH APRIL
A1138: A.C.T. | C1138: 2 | D1138: 0 | E1138: =C1138*6+D1138 -> 12 | G1138: 6 | H1138: 2 | I1138: =G1138*6+H1138 -> 38 | K1138: 9 | L1138: 6 | M1138: =K1138*6+L1138 -> 60 | O1138: 14 | P1138: 11 | Q1138: =O1138*6+P1138 -> 95 | S1138: ADELAIDE
A1139: CAULFIELD | C1139: 3 | D1139: 4 | E1139: =C1139*6+D1139 -> 22 | G1139: 8 | H1139: 6 | I1139: =G1139*6+H1139 -> 54 | K1139: 8 | L1139: 9 | M1139: =K1139*6+L1139 -> 57 | O1139: 11 | P1139: 10 | Q1139: =O1139*6+P1139 -> 76 | S1139: ARGENT
A1140: BEST PLAYERS
A1141: A.C.T. | D1141: DEMAINE | G1141: WIASAK | J1141: GILBERT | L1141: BLACK | O1141: GRIGG | R1141: ZELTNER
A1142: CAULFIELD | D1142: DAVIDSON | G1142: EINSEDEL | J1142: BECK | L1142: O'SULLIVAN
A1143: GOALKICKERS
A1144: A.C.T. | D1144: BLACK 4 | G1144: FELLOW 2 | I1144: MCDONALD 2 | L1144: LYSEWYCZ 2 | O1144: WIDERA | Q1144: BLACKABY | T1144: PAYNE | V1144: ZELTNER
A1145: CAULFIELD | D1145: O'SULLIVAN 4 | G1145: MILNER 2 | I1145: HAWKING | L1145: HUNT | N1145: BECK | P1145: RICHARDS | R1145: DAVIDSON
A1147: 2ND ROUND
A1148: STH FREMANTLE | C1148: 2 | D1148: 1 | E1148: =C1148*6+D1148 -> 13 | G1148: 6 | H1148: 3 | I1148: =G1148*6+H1148 -> 39 | K1148: 10 | L1148: 9 | M1148: =K1148*6+L1148 -> 69 | O1148: 13 | P1148: 14 | Q1148: =O1148*6+P1148 -> 92
A1149: TASMANIA | C1149: 5 | D1149: 3 | E1149: =C1149*6+D1149 -> 33 | G1149: 9 | H1149: 8 | I1149: =G1149*6+H1149 -> 62 | K1149: 10 | L1149: 10 | M1149: =K1149*6+L1149 -> 70 | O1149: 13 | P1149: 11 | Q1149: =O1149*6+P1149 -> 89
A1150: BEST PLAYERS
A1151: STH FREMANTLE
A1152: TASMANIA
A1153: GOALKICKERS
A1154: STH FREMANTLE
A1155: TASMANIA
A1157: PORT MELBOURNE | C1157: 4 | D1157: 3 | E1157: =C1157*6+D1157 -> 27 | G1157: 7 | H1157: 5 | I1157: =G1157*6+H1157 -> 47 | K1157: 11 | L1157: 8 | M1157: =K1157*6+L1157 -> 74 | O1157: 17 | P1157: 9 | Q1157: =O1157*6+P1157 -> 111
A1158: QUEENSLAND | C1158: 2 | D1158: 2 | E1158: =C1158*6+D1158 -> 14 | G1158: 4 | H1158: 2 | I1158: =G1158*6+H1158 -> 26 | K1158: 8 | L1158: 4 | M1158: =K1158*6+L1158 -> 52 | O1158: 12 | P1158: 8 | Q1158: =O1158*6+P1158 -> 80
A1159: BEST PLAYERS
A1160: PORT MELBOURNE | D1160: K GOSS | G1160: P GOSS | I1160: EVANS | L1160: SWAN | O1160: RASMUUSSEN | R1160: COOK
A1161: QUEENSLAND | D1161: FARRER | G1161: WELLER | I1161: STACKPOOLE | L1161: OMCLANVIK | O1161: MOLONEY | R1161: WILLEMSE
A1162: GOALKICKERS
A1163: PORT MELBOURNE | D1163: RASMUSSEN 5 | G1163: COOK 5 | I1163: CHRISTOU 2 | L1163: HOLT 2 | N1163: HAENAN | P1163: P GOSS | R1163: K GOSS
A1164: QUEENSLAND | D1164: CRAIG 3 | F1164: BROWNE 2 | I1164: BACKWELL 2 | L1164: CLARKE | N1164: OMCLANVIK | Q1164: HEATHCOTE | T1164: LAKE | V1164: FITZPATRICK
A1166: STURT | E1166: =C1166*6+D1166 -> 0 | I1166: =G1166*6+H1166 -> 0 | M1166: =K1166*6+L1166 -> 0 | O1166: 18 | P1166: 23 | Q1166: =O1166*6+P1166 -> 131
A1167: CLAREMONT | E1167: =C1167*6+D1167 -> 0 | I1167: =G1167*6+H1167 -> 0 | M1167: =K1167*6+L1167 -> 0 | O1167: 7 | P1167: 3 | Q1167: =O1167*6+P1167 -> 45
A1168: BEST PLAYERS
A1169: STURT
A1170: CLAREMONT
A1171: GOALKICKERS
A1172: STURT
A1173: CLAREMONT
A1175: NORWOOD | E1175: =C1175*6+D1175 -> 0 | I1175: =G1175*6+H1175 -> 0 | M1175: =K1175*6+L1175 -> 0 | O1175: 18 | P1175: 17 | Q1175: =O1175*6+P1175 -> 125
A1176: ACT | E1176: =C1176*6+D1176 -> 0 | I1176: =G1176*6+H1176 -> 0 | M1176: =K1176*6+L1176 -> 0 | O1176: 8 | P1176: 11 | Q1176: =O1176*6+P1176 -> 59
A1177: BEST PLAYERS
A1178: NORWOOD
A1179: ACT
A1180: GOALKICKERS
A1181: NORWOOD
A1182: ACT
C1183: 24TH MAY
A1184: EAST FREEMANTLE | C1184: 2 | D1184: 4 | E1184: =C1184*6+D1184 -> 16 | G1184: 6 | H1184: 5 | I1184: =G1184*6+H1184 -> 41 | K1184: 12 | L1184: 9 | M1184: =K1184*6+L1184 -> 81 | O1184: 18 | P1184: 17 | Q1184: =O1184*6+P1184 -> 125
A1185: PRESTON | C1185: 1 | D1185: 6 | E1185: =C1185*6+D1185 -> 12 | G1185: 1 | H1185: 7 | I1185: =G1185*6+H1185 -> 13 | K1185: 5 | L1185: 11 | M1185: =K1185*6+L1185 -> 41 | O1185: 7 | P1185: 14 | Q1185: =O1185*6+P1185 -> 56
A1186: BEST PLAYERS
A1187: EAST FREEMANTLE | D1187: HOLLINS | G1187: JEZ | J1187: PEAKE | M1187: HICKS | P1187: MAGEE | S1187: ANGEL
A1188: PRESTON | D1188: RENWICK | G1188: MARKS | J1188: CROXFORD | M1188: CONSTANTINE | P1188: SANDERSON | S1188: CROXFORD
A1189: GOALKICKERS
A1190: EAST FREEMANTLE | D1190: HOLLINS 4 | F1190: SPRIGGS 3 | I1190: JEZ 2 | J1190: CARRAT 2 | M1190: NEESHAM | O1190: JOHNSON | Q1190: HICKS | S1190: MAGEE | U1190: ANGEL | W1190: BRENTON | X1190: NEEDLE
A1191: PRESTON | D1191: O'SULLIVAN 3 | G1191: MARKS | I1191: CLIFFORD | K1191: KING | M1191: STEWART
A1193: PORT ADELAIDE | E1193: =C1193*6+D1193 -> 0 | I1193: =G1193*6+H1193 -> 0 | M1193: =K1193*6+L1193 -> 0 | O1193: 25 | P1193: 18 | Q1193: =O1193*6+P1193 -> 168
A1194: WEST PERTH | E1194: =C1194*6+D1194 -> 0 | I1194: =G1194*6+H1194 -> 0 | M1194: =K1194*6+L1194 -> 0 | O1194: 4 | P1194: 3 | Q1194: =O1194*6+P1194 -> 27
A1195: BEST PLAYERS
A1196: PORT ADELAIDE
A1197: WEST PERTH
A1198: GOALKICKERS
A1199: PORT ADELAIDE
A1200: WEST PERTH
B1201: 6TH JUNE
A1202: EAST PERTH | C1202: 2 | D1202: 2 | E1202: =C1202*6+D1202 -> 14 | G1202: 5 | H1202: 5 | I1202: =G1202*6+H1202 -> 35 | K1202: 6 | L1202: 9 | M1202: =K1202*6+L1202 -> 45 | O1202: 7 | P1202: 12 | Q1202: =O1202*6+P1202 -> 54
A1203: DANDENONG | C1203: 3 | D1203: 2 | E1203: =C1203*6+D1203 -> 20 | G1203: 4 | H1203: 4 | I1203: =G1203*6+H1203 -> 28 | K1203: 6 | L1203: 6 | M1203: =K1203*6+L1203 -> 42 | O1203: 6 | P1203: 7 | Q1203: =O1203*6+P1203 -> 43
A1204: BEST PLAYERS
A1205: EAST PERTH | D1205: OTWAY | G1205: TAYLOR | I1205: McCULLOCH | L1205: SMITH | O1205: HAMILTON | R1205: DUDA
A1206: DANDENONG | D1206: HARPER | G1206: PAYZE | I1206: VAN DE BEEK | L1206: McCONNELL | O1206: THOMPSON
A1207: GOALKICKERS
A1208: EAST PERTH | D1208: DUDA 4 | G1208: VERSTEGEN | J1208: OTWAY | L1208: STEWART
A1209: DANDENONG | D1209: WRIGHT 2 | G1209: SHEVLIN | J1209: PAYZE | L1209: HIBBERT | O1209: BRIESE
A1211: PERTH | E1211: =C1211*6+D1211 -> 0 | I1211: =G1211*6+H1211 -> 0 | M1211: =K1211*6+L1211 -> 0 | O1211: 21 | P1211: 14 | Q1211: =O1211*6+P1211 -> 140
A1212: GLENELG | E1212: =C1212*6+D1212 -> 0 | I1212: =G1212*6+H1212 -> 0 | M1212: =K1212*6+L1212 -> 0 | O1212: 13 | P1212: 9 | Q1212: =O1212*6+P1212 -> 87
A1213: BEST PLAYERS
A1214: PERTH
A1215: GLENELG
A1216: GOALKICKERS
A1217: PERTH
A1218: GLENELG
A1220: QUARTER FINALS
A1221: STURT | C1221: 4 | D1221: 4 | E1221: =C1221*6+D1221 -> 28 | G1221: 9 | H1221: 6 | I1221: =G1221*6+H1221 -> 60 | K1221: 15 | L1221: 10 | M1221: =K1221*6+L1221 -> 100 | O1221: 19 | P1221: 11 | Q1221: =O1221*6+P1221 -> 125
A1222: STH FREMANTLE | C1222: 0 | D1222: 4 | E1222: =C1222*6+D1222 -> 4 | G1222: 2 | H1222: 6 | I1222: =G1222*6+H1222 -> 18 | K1222: 5 | L1222: 10 | M1222: =K1222*6+L1222 -> 40 | O1222: 9 | P1222: 14 | Q1222: =O1222*6+P1222 -> 68
A1223: BEST PLAYERS
A1224: STURT
A1225: STH FREMANTLE
A1226: GOALKICKERS
A1227: STURT
A1228: STH FREMANTLE
A1230: E FREMANTLE | C1230: 3 | D1230: 2 | E1230: =C1230*6+D1230 -> 20 | G1230: 6 | H1230: 5 | I1230: =G1230*6+H1230 -> 41 | K1230: 7 | L1230: 7 | M1230: =K1230*6+L1230 -> 49 | O1230: 14 | P1230: 14 | Q1230: =O1230*6+P1230 -> 98
A1231: PERTH | C1231: 1 | D1231: 2 | E1231: =C1231*6+D1231 -> 8 | G1231: 4 | H1231: 3 | I1231: =G1231*6+H1231 -> 27 | K1231: 10 | L1231: 6 | M1231: =K1231*6+L1231 -> 66 | O1231: 11 | P1231: 7 | Q1231: =O1231*6+P1231 -> 73
A1232: BEST PLAYERS
A1233: E FREMANTLE
A1234: PERTH
A1235: GOALKICKERS
A1236: E FREMANTLE
A1237: PERTH
A1239: E PERTH | C1239: 3 | D1239: 3 | E1239: =C1239*6+D1239 -> 21 | G1239: 6 | H1239: 3 | I1239: =G1239*6+H1239 -> 39 | K1239: 9 | L1239: 6 | M1239: =K1239*6+L1239 -> 60 | O1239: 13 | P1239: 8 | Q1239: =O1239*6+P1239 -> 86
A1240: PORT ADELAIDE | C1240: 1 | D1240: 3 | E1240: =C1240*6+D1240 -> 9 | G1240: 4 | H1240: 4 | I1240: =G1240*6+H1240 -> 28 | K1240: 9 | L1240: 6 | M1240: =K1240*6+L1240 -> 60 | O1240: 13 | P1240: 6 | Q1240: =O1240*6+P1240 -> 84
A1241: BEST PLAYERS
A1242: E PERTH
A1243: PORT ADELAIDE
A1244: GOALKICKERS
A1245: E PERTH
A1246: PORT ADELAIDE
A1248: NORWOOD | E1248: =C1248*6+D1248 -> 0 | I1248: =G1248*6+H1248 -> 0 | M1248: =K1248*6+L1248 -> 0 | O1248: 23 | P1248: 14 | Q1248: =O1248*6+P1248 -> 152 | S1248: NORWOOD
A1249: PORT MELBOURNE | E1249: =C1249*6+D1249 -> 0 | I1249: =G1249*6+H1249 -> 0 | M1249: =K1249*6+L1249 -> 0 | O1249: 12 | P1249: 10 | Q1249: =O1249*6+P1249 -> 82
A1250: BEST PLAYERS
A1251: NORWOOD | D1251: BURTON | G1251: ROSSER | J1251: KERLEY | M1251: SEEKAMP
A1252: PORT MELBOURNE | D1252: COOK | G1252: CRITCH | J1252: EVANS | M1252: CHRISTOU
A1253: GOALKICKERS
A1254: NORWOOD | D1254: ADLER (6) | F1254: MADDISON (4) | I1254: CRAIG (2) | K1254: ZUBRANICH (2) | N1254: FLENNEMANN (2) | R1254: ROSSER (2) | U1254: DILLON | V1254: BURTON | X1254: KERLEY | Z1254: MICHAELANNY | AC1254: GREGG
A1255: PORT MELBOURNE | D1255: COOK (7) | G1255: HOLT (2) | I1255: EVANS | K1255: RASMUSSEN | N1255: CHRISTOU
A1257: SEMI-FINALS
A1258: NORWOOD | C1258: 3 | D1258: 3 | E1258: =C1258*6+D1258 -> 21 | G1258: 7 | H1258: 7 | I1258: =G1258*6+H1258 -> 49 | K1258: 13 | L1258: 8 | M1258: =K1258*6+L1258 -> 86 | O1258: 17 | P1258: 11 | Q1258: =O1258*6+P1258 -> 113
A1259: STURT | C1259: 0 | D1259: 1 | E1259: =C1259*6+D1259 -> 1 | G1259: 0 | H1259: 4 | I1259: =G1259*6+H1259 -> 4 | K1259: 2 | L1259: 7 | M1259: =K1259*6+L1259 -> 19 | O1259: 8 | P1259: 9 | Q1259: =O1259*6+P1259 -> 57
A1260: BEST PLAYERS
A1261: NORWOOD
A1262: STURT
A1263: GOALKICKERS
A1264: NORWOOD
A1265: STURT
A1267: E PERTH | C1267: 2 | D1267: 2 | E1267: =C1267*6+D1267 -> 14 | G1267: 6 | H1267: 6 | I1267: =G1267*6+H1267 -> 42 | K1267: 10 | L1267: 8 | M1267: =K1267*6+L1267 -> 68 | O1267: 12 | P1267: 13 | Q1267: =O1267*6+P1267 -> 85
A1268: E FREMANTLE | C1268: 1 | D1268: 4 | E1268: =C1268*6+D1268 -> 10 | G1268: 2 | H1268: 5 | I1268: =G1268*6+H1268 -> 17 | K1268: 2 | L1268: 8 | M1268: =K1268*6+L1268 -> 20 | O1268: 3 | P1268: 11 | Q1268: =O1268*6+P1268 -> 29
A1269: BEST PLAYERS
A1270: E PERTH
A1271: E FREMANTLE
A1272: GOALKICKERS
A1273: E PERTH
A1274: E FREMANTLE
A1276: FINAL
A1277: NORWOOD | E1277: =C1277*6+D1277 -> 0 | I1277: =G1277*6+H1277 -> 0 | M1277: =K1277*6+L1277 -> 0 | Q1277: =O1277*6+P1277 -> 0
A1278: E PERTH | E1278: =C1278*6+D1278 -> 0 | I1278: =G1278*6+H1278 -> 0 | M1278: =K1278*6+L1278 -> 0 | Q1278: =O1278*6+P1278 -> 0
A1279: BEST PLAYERS
A1280: NORWOOD
A1281: E PERTH
A1282: GOALKICKERS
A1283: NORWOOD
A1284: E PERTH