A1: Victorian Football Association
A2: Season 1977 - Division Two
A3: © Copyright Wal Williams | F3: First created: 28 March 2016
A4: Contact: joywalwi at gmail dot com | F4: Last updated: 28 March 2016 | W4: VFA Results and tables - Link to the main index page
A5: You are free to copy this document in whole or part provided that proper acknowledgement is given to the author. All rights reserved.
A7: 1977 | C7: V.F.A. SEASON 2ND DIVISION
A8: ROUND 1 | E8: 4TH APRIL | J8: WEATHER | S8: PLAYED AT
D9: 1ST QTR | H9: 2ND QTR | L9: 3RD QTR | P9: FINAL | S9: CAMBERWELL
A10: CAMBERWELL | C10: 2 | D10: 1 | E10: =C10*6+D10 -> 13 | G10: 10 | H10: 3 | I10: =G10*6+H10 -> 63 | K10: 15 | L10: 8 | M10: =K10*6+L10 -> 98 | O10: 19 | P10: 11 | Q10: =O10*6+P10 -> 125 | S10: UMPIRE | X10: LADDER | AB10: ROUND | AD10: 1
A11: FRANKSTON | C11: 4 | D11: 3 | E11: =C11*6+D11 -> 27 | G11: 6 | H11: 4 | I11: =G11*6+H11 -> 40 | K11: 12 | L11: 8 | M11: =K11*6+L11 -> 80 | O11: 13 | P11: 13 | Q11: =O11*6+P11 -> 91 | S11: OAKLEY
A12: BEST PLAYERS | W12: TEAM | X12: W | Y12: L | Z12: D | AA12: FOR | AB12: AGST | AC12: % | AD12: PTS
A13: CAMBERWELL | C13: WALLACE | F13: R SMITH | I13: B SMITH | L13: HOOK | O13: HUMPHREY | R13: JUDD
A14: FRANKSTON | C14: GUY | F14: ESLER | I14: STAPLETON | L14: HENRICKSEN | O14: BOYD | R14: LEWIS | W14: WAVERLEY | X14: 1 | Y14: 0 | Z14: 0 | AA14: 199 | AB14: 63 | AC14: =(AA14*100)/AB14 -> 315.87301587301585 | AD14: =(X14*4)+(Z14*2) -> 4
A15: GOALKICKERS | W15: CAMBERWELL | X15: 1 | Y15: 0 | Z15: 0 | AA15: 125 | AB15: 91 | AC15: =(AA15*100)/AB15 -> 137.36263736263737 | AD15: =(X15*4)+(Z15*2) -> 4
A16: CAMBERWELL | C16: B SMITH 8 | F16: HUMPHREY 4 | I16: A SMITH 2 | K16: ALEXEEF | M16: HARROP | O16: FITZGERALD | R16: IND | S16: WALLACE | W16: NORTHCOTE | X16: 1 | Y16: 0 | Z16: 0 | AA16: 145 | AB16: 117 | AC16: =(AA16*100)/AB16 -> 123.93162393162393 | AD16: =(X16*4)+(Z16*2) -> 4
A17: FRANKSTON | C17: NORRIS 4 | E17: KENNEDY 2 | H17: JONES 2 | J17: GUY | L17: CLARKE | N17: HUNTER | P17: ESLER | R17: THATCHER | W17: OAKLEIGH | X17: 1 | Y17: 0 | Z17: 0 | AA17: 150 | AB17: 126 | AC17: =(AA17*100)/AB17 -> 119.04761904761905 | AD17: =(X17*4)+(Z17*2) -> 4
A19: OAKLEIGH | C19: 3 | D19: 5 | E19: =C19*6+D19 -> 23 | G19: 8 | H19: 7 | I19: =G19*6+H19 -> 55 | K19: 19 | L19: 9 | M19: =K19*6+L19 -> 123 | O19: 23 | P19: 12 | Q19: =O19*6+P19 -> 150 | S19: WERRIBEE | W19: SUNSHINE | X19: 1 | Y19: 0 | Z19: 0 | AA19: 111 | AB19: 110 | AC19: =(AA19*100)/AB19 -> 100.90909090909091 | AD19: =(X19*4)+(Z19*2) -> 4
A20: WERRIBEE | C20: 4 | D20: 4 | E20: =C20*6+D20 -> 28 | G20: 8 | H20: 8 | I20: =G20*6+H20 -> 56 | K20: 14 | L20: 10 | M20: =K20*6+L20 -> 94 | O20: 18 | P20: 18 | Q20: =O20*6+P20 -> 126 | S20: CARLILE | W20: YARRAVILLE | X20: 0 | Y20: 1 | Z20: 0 | AA20: 110 | AB20: 111 | AC20: =(AA20*100)/AB20 -> 99.099099099099092 | AD20: =(X20*4)+(Z20*2) -> 0
A21: BEST PLAYERS | W21: WERRIBEE | X21: 0 | Y21: 1 | Z21: 0 | AA21: 126 | AB21: 150 | AC21: =(AA21*100)/AB21 -> 84 | AD21: =(X21*4)+(Z21*2) -> 0
A22: OAKLEIGH | C22: BECK | F22: McDONALD | I22: BARROTT | L22: KING | W22: MORDIALLOC | X22: 0 | Y22: 1 | Z22: 0 | AA22: 117 | AB22: 145 | AC22: =(AA22*100)/AB22 -> 80.689655172413794 | AD22: =(X22*4)+(Z22*2) -> 0
A23: WERRIBEE | C23: SQUIRE | F23: J BOURKE | I23: LYNCH | L23: MARTIN | O23: KNIGHT | W23: FRANKSTON | X23: 0 | Y23: 1 | Z23: 0 | AA23: 91 | AB23: 125 | AC23: =(AA23*100)/AB23 -> 72.8 | AD23: =(X23*4)+(Z23*2) -> 0
A24: GOALKICKERS | W24: BOX HILL | X24: 0 | Y24: 1 | Z24: 0 | AA24: 63 | AB24: 199 | AC24: =(AA24*100)/AB24 -> 31.658291457286431 | AD24: =(X24*4)+(Z24*2) -> 0
A25: OAKLEIGH | C25: McDONALD 6 | F25: MURNANE 5 | I25: COLCOTT 4 | L25: WHITE 3 | N25: GOODMAN 2 | Q25: KING | R25: BECK | T25: HAY
A26: WERRIBEE | C26: LYNCH 5 | E26: SQUIRE 5 | G26: MARTIN 2 | J26: J BOURKE | L26: A BOURKE | N26: TUDOR | P26: JACK | R26: LYONS | T26: B OUGH
A28: WAVERLEY | C28: 6 | D28: 3 | E28: =C28*6+D28 -> 39 | G28: 12 | H28: 7 | I28: =G28*6+H28 -> 79 | K28: 22 | L28: 11 | M28: =K28*6+L28 -> 143 | O28: 30 | P28: 19 | Q28: =O28*6+P28 -> 199 | S28: WAVERLEY
A29: BOX HILL | C29: 3 | D29: 1 | E29: =C29*6+D29 -> 19 | G29: 8 | H29: 2 | I29: =G29*6+H29 -> 50 | K29: 10 | L29: 3 | M29: =K29*6+L29 -> 63 | O29: 10 | P29: 3 | Q29: =O29*6+P29 -> 63 | S29: STEERE
A30: BEST PLAYERS
A31: WAVERLEY | C31: K McKAY | F31: GILL | I31: DUNNE | L31: HOLDSWORTH | O31: B WILLIAMS | R31: M WILLIE
A32: BOX HILL | C32: TUCKWELL | F32: GRANT PICKETT | J32: MAU | L32: EDWARDS
A33: GOALKICKERS
A34: WAVERLEY | C34: K McKAY 10 | F34: GILL 5 | H34: HOLDSWORTH 3 | K34: HAROLD 3 | N34: DUNNE 3 | P34: COSTELLO 2 | S34: G McLURE 2 | V34: A McLURE 2
A35: BOX HILL | C35: MAU 3 | E35: GORDON 2 | H35: McGUINNESS 2 | K35: EDWARDS | M35: JONES | O35: TUCKWELL
A37: NORTHCOTE | C37: 4 | D37: 4 | E37: =C37*6+D37 -> 28 | G37: 13 | H37: 9 | I37: =G37*6+H37 -> 87 | K37: 16 | L37: 10 | M37: =K37*6+L37 -> 106 | O37: 22 | P37: 13 | Q37: =O37*6+P37 -> 145 | S37: NORTHCOTE
A38: MORDIALLOC | C38: 3 | D38: 7 | E38: =C38*6+D38 -> 25 | G38: 4 | H38: 2 | I38: =G38*6+H38 -> 26 | K38: 14 | L38: 20 | M38: =K38*6+L38 -> 104 | O38: 16 | P38: 21 | Q38: =O38*6+P38 -> 117 | S38: TORNEY
A39: BEST PLAYERS
A40: NORTHCOTE | C40: G RYAN | F40: HOWELL | I40: McINTYRE | L40: ILLIOV | O40: WALL | R40: HOBBS
A41: MORDIALLOC | C41: MOORE | F41: GUY | I41: SLADE | L41: CRITCH | O41: SCOTT | R41: LANG
A42: GOALKICKERS
A43: NORTHCOTE | C43: G RYAN 6 | F43: ILLIOV 5 | H43: WALL 4 | J43: BREWER 3 | M43: McGREGOR 2 | P43: MORTON | R43: HOBBS
A44: MORDIALLOC | C44: DEATON 3 | E44: WILLIAMSON 2 | H44: NEVILLE 2 | J44: GUY | K44: DINGLE | M44: SLADE | O44: JOHNSTONE | R44: POTTER | T44: MOORE | V44: BORRIS | X44: SCOTT | Z44: CRITCH
A46: SUNSHINE | C46: 5 | D46: 1 | E46: =C46*6+D46 -> 31 | G46: 10 | H46: 7 | I46: =G46*6+H46 -> 67 | K46: 14 | L46: 10 | M46: =K46*6+L46 -> 94 | O46: 16 | P46: 15 | Q46: =O46*6+P46 -> 111 | S46: YARRAVILLE
A47: YARRAVILLE | C47: 3 | D47: 5 | E47: =C47*6+D47 -> 23 | G47: 7 | H47: 9 | I47: =G47*6+H47 -> 51 | K47: 10 | L47: 14 | M47: =K47*6+L47 -> 74 | O47: 15 | P47: 20 | Q47: =O47*6+P47 -> 110 | S47: OGSTON
A48: BEST PLAYERS
A49: SUNSHINE | C49: MITCHELL | F49: BAIRD | I49: FOLEY | L49: BENSON | O49: PAXTON | R49: BRETT
A50: YARRAVILLE | C50: THORPE | F50: WELLINGTON | I50: SIMMONS | L50: SAIT
A51: GOALKICKERS
A52: SUNSHINE | C52: RADZIMINSKI 4 | F52: MANDICS 4 | I52: CLARKE 2 | K52: BROWN 2 | M52: JONES | O52: McDONALD | R52: PAXTON | T52: BRETT
A53: YARRAVILLE | C53: BISSET 4 | F53: SAIT 4 | H53: PRIEST 2 | J53: PLUMMER 2 | M53: THORPE | O53: COLLINS | Q53: RICHES
A55: ROUND 2 | E55: 11TH APRIL | J55: WEATHER | S55: PLAYED AT
D56: 1ST QTR | H56: 2ND QTR | L56: 3RD QTR | P56: FINAL | S56: OAKLEIGH
A57: CAMBERWELL | C57: 8 | D57: 0 | E57: =C57*6+D57 -> 48 | G57: 15 | H57: 0 | I57: =G57*6+H57 -> 90 | K57: 19 | L57: 3 | M57: =K57*6+L57 -> 117 | O57: 22 | P57: 6 | Q57: =O57*6+P57 -> 138 | S57: UMPIRE | X57: LADDER | AB57: ROUND | AD57: 2
A58: OAKLEIGH | C58: 5 | D58: 1 | E58: =C58*6+D58 -> 31 | G58: 8 | H58: 5 | I58: =G58*6+H58 -> 53 | K58: 16 | L58: 10 | M58: =K58*6+L58 -> 106 | O58: 21 | P58: 11 | Q58: =O58*6+P58 -> 137 | S58: TORNEY
A59: BEST PLAYERS | W59: TEAM | X59: W | Y59: L | Z59: D | AA59: FOR | AB59: AGST | AC59: % | AD59: PTS
A60: CAMBERWELL | C60: JUDD | F60: ALEXEEF | I60: L CURRAN | L60: WALLACE | O60: HOWARD | R60: OLIVER
A61: OAKLEIGH | C61: WHITE | F61: BURKE | I61: BECK | L61: MURNANE | W61: SUNSHINE | X61: 2 | Y61: 0 | Z61: 0 | AA61: 221 | AB61: 174 | AC61: =(AA61*100)/AB61 -> 127.01149425287356 | AD61: =(X61*4)+(Z61*2) -> 8
A62: GOALKICKERS | W62: CAMBERWELL | X62: 2 | Y62: 0 | Z62: 0 | AA62: 263 | AB62: 228 | AC62: =(AA62*100)/AB62 -> 115.35087719298245 | AD62: =(X62*4)+(Z62*2) -> 8
A63: CAMBERWELL | C63: B SMITH 7 | F63: ALEXEEF 6 | H63: WALLACE 3 | K63: HOWARD 2 | N63: NEILSON 2 | Q63: OLIVER | S63: HOOK | W63: WAVERLEY | X63: 1 | Y63: 1 | Z63: 0 | AA63: 263 | AB63: 173 | AC63: =(AA63*100)/AB63 -> 152.02312138728323 | AD63: =(X63*4)+(Z63*2) -> 4
A64: OAKLEIGH | C64: BURKE 6 | E64: WHITE 5 | G64: McDONALD 3 | J64: MURNANE 2 | M64: BECK | N64: BARROTT | P64: STEWART | R64: SPLATT | T64: COLCOTT | W64: WERRIBEE | X64: 1 | Y64: 1 | Z64: 0 | AA64: 258 | AB64: 226 | AC64: =(AA64*100)/AB64 -> 114.15929203539822 | AD64: =(X64*4)+(Z64*2) -> 4
A66: FRANKSTON | C66: 6 | D66: 4 | E66: =C66*6+D66 -> 40 | G66: 12 | H66: 6 | I66: =G66*6+H66 -> 78 | K66: 19 | L66: 8 | M66: =K66*6+L66 -> 122 | O66: 24 | P66: 13 | Q66: =O66*6+P66 -> 157 | S66: FRANKSTON | W66: OAKLEIGH | X66: 1 | Y66: 1 | Z66: 0 | AA66: 287 | AB66: 264 | AC66: =(AA66*100)/AB66 -> 108.71212121212122 | AD66: =(X66*4)+(Z66*2) -> 4
A67: NORTHCOTE | C67: 5 | D67: 2 | E67: =C67*6+D67 -> 32 | G67: 9 | H67: 7 | I67: =G67*6+H67 -> 61 | K67: 17 | L67: 11 | M67: =K67*6+L67 -> 113 | O67: 22 | P67: 13 | Q67: =O67*6+P67 -> 145 | S67: CARLILE | W67: NORTHCOTE | X67: 1 | Y67: 1 | Z67: 0 | AA67: 290 | AB67: 274 | AC67: =(AA67*100)/AB67 -> 105.83941605839416 | AD67: =(X67*4)+(Z67*2) -> 4
A68: BEST PLAYERS | W68: MORDIALLOC | X68: 1 | Y68: 1 | Z68: 0 | AA68: 264 | AB68: 271 | AC68: =(AA68*100)/AB68 -> 97.416974169741692 | AD68: =(X68*4)+(Z68*2) -> 4
A69: FRANKSTON | C69: DAVIES | F69: ESLER | I69: STAPLETON | L69: THATCHER | O69: LEWIS | R69: GUY | W69: FRANKSTON | X69: 1 | Y69: 1 | Z69: 0 | AA69: 248 | AB69: 270 | AC69: =(AA69*100)/AB69 -> 91.851851851851848 | AD69: =(X69*4)+(Z69*2) -> 4
A70: NORTHCOTE | C70: HOWELL | F70: BREWER | I70: McINTYRE | L70: McGRATH | O70: MORTON | R70: McARDLE | W70: YARRAVILLE | X70: 0 | Y70: 2 | Z70: 0 | AA70: 236 | AB70: 258 | AC70: =(AA70*100)/AB70 -> 91.47286821705427 | AD70: =(X70*4)+(Z70*2) -> 0
A71: GOALKICKERS | L71: ESLER | N71: ELLIS | P71: GUY | W71: BOX HILL | X71: 0 | Y71: 2 | Z71: 0 | AA71: 139 | AB71: 331 | AC71: =(AA71*100)/AB71 -> 41.993957703927492 | AD71: =(X71*4)+(Z71*2) -> 0
A72: FRANKSTON | C72: DAVIES 8 | E72: THATCHER 4 | H72: KENNEDY 2 | J72: McILWRAITH 2 | M72: STAPLETON 2 | P72: NORRIS 2 | R72: ERIKSON
A73: NORTHCOTE | C73: WALL 4 | E73: STILSBY 4 | G73: BRIGHAM 3 | I73: BREWER 3 | K73: McGRATH 2 | N73: T ? 2 | P73: HOWELL | R73: McORIST | T73: G RYAN | V73: McFARLANE
A75: WERRIBEE | C75: 5 | D75: 4 | E75: =C75*6+D75 -> 34 | G75: 13 | H75: 6 | I75: =G75*6+H75 -> 84 | K75: 15 | L75: 12 | M75: =K75*6+L75 -> 102 | O75: 19 | P75: 18 | Q75: =O75*6+P75 -> 132 | S75: BOX HILL
A76: BOX HILL | C76: 2 | D76: 5 | E76: =C76*6+D76 -> 17 | G76: 6 | H76: 10 | I76: =G76*6+H76 -> 46 | K76: 8 | L76: 13 | M76: =K76*6+L76 -> 61 | O76: 10 | P76: 16 | Q76: =O76*6+P76 -> 76 | S76: OAKLEY
A77: BEST PLAYERS
A78: WERRIBEE | C78: WHITEHEAD | F78: SQUIRE | I78: LYONS | L78: WISE | O78: MARTIN
A79: BOX HILL | C79: PARRY | F79: COOK | I79: LASKIE | L79: EDWARDS | O79: CINNAMOND | R79: TUCKWELL
A80: GOALKICKERS
A81: WERRIBEE | C81: SQUIRE 6 | E81: JACK 3 | G81: WISE 3 | I81: MARTIN 2 | K81: G BELLIN | M81: DOUGLAS | O81: MITCHELL | R81: J BELLIN | T81: LYNCH
A82: BOX HILL | C82: EDWARDS 2 | F82: JONES 2 | H82: LASKIE 2 | J82: GORDON | M82: McGUINNESS | P82: MAU | R82: HARPER
A84: SUNSHINE | C84: 1 | D84: 3 | E84: =C84*6+D84 -> 9 | G84: 5 | H84: 8 | I84: =G84*6+H84 -> 38 | K84: 9 | L84: 12 | M84: =K84*6+L84 -> 66 | O84: 16 | P84: 14 | Q84: =O84*6+P84 -> 110 | S84: SUNSHINE
A85: WAVERLEY | C85: 2 | D85: 3 | E85: =C85*6+D85 -> 15 | G85: 5 | H85: 7 | I85: =G85*6+H85 -> 37 | K85: 7 | L85: 11 | M85: =K85*6+L85 -> 53 | O85: 8 | P85: 16 | Q85: =O85*6+P85 -> 64 | S85: WENN
A86: BEST PLAYERS
A87: SUNSHINE | C87: PAXTON | F87: CLARKE | I87: PIERCZAK | L87: BRETT | O87: MITCHELL | R87: McDONALD
A88: WAVERLEY | C88: WESTAWAY | F88: A McLURE | I88: DUNNE | L88: KELAART | O88: HAROLD | R88: HOLDSWORTH
A89: GOALKICKERS
A90: SUNSHINE | C90: MANDICS 4 | F90: VELLA 3 | H90: McDONALD 3 | K90: BROWN 2 | N90: BRETT | P90: CLARKE | R90: BENSON | T90: BAIRD
A91: WAVERLEY | C91: A McLURE 3 | F91: HAROLD | H91: HOLDSWORTH | K91: G McLURE | N91: K McKAY | P91: COSTELLO
A93: MORDIALLOC | C93: 5 | D93: 5 | E93: =C93*6+D93 -> 35 | G93: 14 | H93: 10 | I93: =G93*6+H93 -> 94 | K93: 16 | L93: 12 | M93: =K93*6+L93 -> 108 | O93: 22 | P93: 15 | Q93: =O93*6+P93 -> 147 | S93: MORDIALLOC
A94: YARRAVILLE | C94: 3 | D94: 4 | E94: =C94*6+D94 -> 22 | G94: 8 | H94: 4 | I94: =G94*6+H94 -> 52 | K94: 15 | L94: 9 | M94: =K94*6+L94 -> 99 | O94: 18 | P94: 18 | Q94: =O94*6+P94 -> 126 | S94: MARCY
A95: BEST PLAYERS
A96: MORDIALLOC | C96: NORRIS | F96: WILLIAMSON | I96: O'NEILL | L96: ROGERSON | O96: CRITCH | R96: NEVILLE
A97: YARRAVILLE | C97: SIMMONS | F97: SAIT | I97: WELLINGTON | L97: MAIOLO | O97: THORPE | R97: JONES
A98: GOALKICKERS
A99: MORDIALLOC | C99: NEVILLE 5 | E99: DEATON 3 | G99: NORRIS 3 | I99: SCOTT 2 | K99: JOHNSTONE 2 | N99: DINGLE 2 | P99: WILLIAMSON | S99: SLADE | U99: O'NEILL | W99: WALSH | X99: ROGERSON
A100: YARRAVILLE | C100: BISSET 4 | E100: RICHES 4 | G100: SIMMONS 2 | J100: PRIEST 2 | L100: THORPE 2 | N100: BROWN | P100: SAIT | R100: MAIOLO | T100: WELLINGTON
A102: ROUND 3 | E102: 17TH APRIL | J102: WEATHER | S102: PLAYED AT
D103: 1ST QTR | H103: 2ND QTR | L103: 3RD QTR | P103: FINAL | S103: NORTHCOTE
A104: CAMBERWELL | C104: 3 | D104: 4 | E104: =C104*6+D104 -> 22 | G104: 13 | H104: 7 | I104: =G104*6+H104 -> 85 | K104: 18 | L104: 11 | M104: =K104*6+L104 -> 119 | O104: 26 | P104: 13 | Q104: =O104*6+P104 -> 169 | S104: UMPIRE | X104: LADDER | AB104: ROUND | AD104: 3
A105: NORTHCOTE | C105: 4 | D105: 4 | E105: =C105*6+D105 -> 28 | G105: 9 | H105: 7 | I105: =G105*6+H105 -> 61 | K105: 13 | L105: 14 | M105: =K105*6+L105 -> 92 | O105: 16 | P105: 17 | Q105: =O105*6+P105 -> 113 | S105: STABB
A106: BEST PLAYERS | W106: TEAM | X106: W | Y106: L | Z106: D | AA106: FOR | AB106: AGST | AC106: % | AD106: PTS
A107: CAMBERWELL | C107: JUDD | F107: HAMMOND | I107: IND | K107: B SMITH | N107: NIELSON | Q107: SPITHILL
A108: NORTHCOTE | C108: HOWELL | F108: McINTYRE | I108: MORTON | K108: STILSBY | N108: ROBERTS | Q108: REDENBACH | W108: CAMBERWELL | X108: 3 | Y108: 0 | Z108: 0 | AA108: 432 | AB108: 341 | AC108: =(AA108*100)/AB108 -> 126.68621700879766 | AD108: =(X108*4)+(Z108*2) -> 12
A109: GOALKICKERS | Q109: HOWARD | W109: OAKLEIGH | X109: 2 | Y109: 1 | Z109: 0 | AA109: 439 | AB109: 352 | AC109: =(AA109*100)/AB109 -> 124.71590909090909 | AD109: =(X109*4)+(Z109*2) -> 8
A110: CAMBERWELL | C110: HAMMOND 10 | F110: B SMITH 6 | H110: NIELSON 2 | J110: A SMITH 2 | L110: R SMITH | N110: OLIVER | P110: WALLACE | R110: KENNEDY | T110: HUMPHREY | W110: SUNSHINE | X110: 2 | Y110: 1 | Z110: 0 | AA110: 341 | AB110: 297 | AC110: =(AA110*100)/AB110 -> 114.81481481481481 | AD110: =(X110*4)+(Z110*2) -> 8
A111: NORTHCOTE | C111: MORTON 5 | E111: STILSBY 4 | G111: ILLIOV 2 | I111: HOBBS | K111: McGRATH | N111: McGREGOR | Q111: ROBERTS | S111: BREWER | W111: MORDIALLOC | X111: 2 | Y111: 1 | Z111: 0 | AA111: 413 | AB111: 370 | AC111: =(AA111*100)/AB111 -> 111.62162162162163 | AD111: =(X111*4)+(Z111*2) -> 8
A113: WERRIBEE | C113: 7 | D113: 8 | E113: =C113*6+D113 -> 50 | G113: 12 | H113: 11 | I113: =G113*6+H113 -> 83 | K113: 15 | L113: 14 | M113: =K113*6+L113 -> 104 | O113: 18 | P113: 15 | Q113: =O113*6+P113 -> 123 | S113: WERRIBEE | W113: WERRIBEE | X113: 2 | Y113: 1 | Z113: 0 | AA113: 381 | AB113: 346 | AC113: =(AA113*100)/AB113 -> 110.11560693641619 | AD113: =(X113*4)+(Z113*2) -> 8
A114: SUNSHINE | C114: 3 | D114: 8 | E114: =C114*6+D114 -> 26 | G114: 10 | H114: 8 | I114: =G114*6+H114 -> 68 | K114: 13 | L114: 13 | M114: =K114*6+L114 -> 91 | O114: 17 | P114: 18 | Q114: =O114*6+P114 -> 120 | S114: FITZPATRICK | W114: WAVERLEY | X114: 1 | Y114: 2 | Z114: 0 | AA114: 362 | AB114: 322 | AC114: =(AA114*100)/AB114 -> 112.42236024844721 | AD114: =(X114*4)+(Z114*2) -> 4
A115: BEST PLAYERS | W115: YARRAVILLE | X115: 1 | Y115: 2 | Z115: 0 | AA115: 350 | AB115: 351 | AC115: =(AA115*100)/AB115 -> 99.715099715099711 | AD115: =(X115*4)+(Z115*2) -> 4
A116: WERRIBEE | C116: LYNCH | F116: BOURKE | I116: WHITEHEAD | L116: LEECE | N116: HUDSON | W116: NORTHCOTE | X116: 1 | Y116: 2 | Z116: 0 | AA116: 403 | AB116: 443 | AC116: =(AA116*100)/AB116 -> 90.970654627539503 | AD116: =(X116*4)+(Z116*2) -> 4
A117: SUNSHINE | C117: MANDICS | F117: CLARKE | I117: BRETT | L117: VELLA | N117: PIERCZAK | W117: FRANKSTON | X117: 1 | Y117: 2 | Z117: 0 | AA117: 341 | AB117: 384 | AC117: =(AA117*100)/AB117 -> 88.802083333333329 | AD117: =(X117*4)+(Z117*2) -> 4
A118: GOALKICKERS | W118: BOX HILL | X118: 0 | Y118: 3 | Z118: 0 | AA118: 227 | AB118: 483 | AC118: =(AA118*100)/AB118 -> 46.997929606625256 | AD118: =(X118*4)+(Z118*2) -> 0
A119: WERRIBEE | C119: LEECE 7 | E119: LYNCH 2 | G119: MAT 2 | I119: MITCHELL 2 | L119: BOURKE 2 | N119: HUDSON | P119: TUDOR | R119: LYNCH
A120: SUNSHINE | C120: MANDICS 6 | F120: BAIRD 6 | I120: BRETT | K120: FOLEY | M120: VELLA | O120: RADZIMINSKI | R120: PAXTON
A122: MORDIALLOC | C122: 0 | D122: 7 | E122: =C122*6+D122 -> 7 | G122: 7 | H122: 9 | I122: =G122*6+H122 -> 51 | K122: 14 | L122: 16 | M122: =K122*6+L122 -> 100 | O122: 21 | P122: 23 | Q122: =O122*6+P122 -> 149 | S122: WAVERLEY
A123: WAVERLEY | C123: 3 | D123: 3 | E123: =C123*6+D123 -> 21 | G123: 6 | H123: 9 | I123: =G123*6+H123 -> 45 | K123: 8 | L123: 12 | M123: =K123*6+L123 -> 60 | O123: 14 | P123: 15 | Q123: =O123*6+P123 -> 99 | S123: SNOOKS
A124: BEST PLAYERS
A125: MORDIALLOC | C125: WILLIAMSON | F125: DINGLE | I125: MOORE | L125: DEATON | N125: CRITCH | Q125: BLOOMFIELD
A126: WAVERLEY | C126: HOLDSWORTH | F126: MILES | I126: STYLES | L126: GILL | N126: HAROLD | Q126: KELAART
A127: GOALKICKERS
A128: MORDIALLOC | C128: M ? 6 | F128: DEATON 5 | I128: ROBERTSON 3 | L128: NORRIS 3 | N128: DINGLE 2 | P128: WELLINGTON | S128: JOHNSTONE
A129: WAVERLEY | C129: LEES 4 | E129: A McLURE 3 | H129: HOLDSWORTH 2 | K129: CARVER 2 | M129: CRAWLEY | O129: McKAY | Q129: MILES
A131: YARRAVILLE | C131: 8 | D131: 4 | E131: =C131*6+D131 -> 52 | G131: 10 | H131: 11 | I131: =G131*6+H131 -> 71 | K131: 13 | L131: 13 | M131: =K131*6+L131 -> 91 | O131: 16 | P131: 18 | Q131: =O131*6+P131 -> 114 | S131: YARRAVILLE
A132: FRANKSTON | C132: 2 | D132: 4 | E132: =C132*6+D132 -> 16 | G132: 4 | H132: 8 | I132: =G132*6+H132 -> 32 | K132: 9 | L132: 13 | M132: =K132*6+L132 -> 67 | O132: 12 | P132: 21 | Q132: =O132*6+P132 -> 93 | S132: McBAIN
A133: BEST PLAYERS
A134: YARRAVILLE | C134: JONES | F134: GRACO | I134: WELLINGTON | L134: MAIOLO | N134: KIRKMAN | Q134: PRIEST
A135: FRANKSTON | C135: GUY | F135: THATCHER | I135: CAYZER | L135: LEWIS | N135: DAVIES | Q135: TICKELL
A136: GOALKICKERS
A137: YARRAVILLE | C137: BISSET 6 | E137: WELLINGTON 3 | H137: KIRKMAN 2 | K137: MAIOLO 2 | N137: SAIT | O137: JONES | Q137: EDWARDS
A138: FRANKSTON | C138: DAVIES 4 | F138: STAPLETON 2 | I138: THATCHER 2 | L138: NORRIS 2 | N138: JONES | P138: BEADIE
A140: OAKLEIGH | C140: 3 | D140: 4 | E140: =C140*6+D140 -> 22 | G140: 9 | H140: 8 | I140: =G140*6+H140 -> 62 | K140: 16 | L140: 12 | M140: =K140*6+L140 -> 108 | O140: 22 | P140: 20 | Q140: =O140*6+P140 -> 152 | S140: BOX HILL
A141: BOX HILL | C141: 2 | D141: 4 | E141: =C141*6+D141 -> 16 | G141: 6 | H141: 5 | I141: =G141*6+H141 -> 41 | K141: 9 | L141: 6 | M141: =K141*6+L141 -> 60 | O141: 13 | P141: 10 | Q141: =O141*6+P141 -> 88 | S141: O'BRIEN
A142: BEST PLAYERS
A143: OAKLEIGH | C143: KING | F143: EDWARDS | I143: CHISHOLM | L143: GOODMAN | O143: BURKE
A144: BOX HILL | C144: COOK | F144: EDWARDS | I144: LASKIE | L144: WELLINGS | O144: MAU
A145: GOALKICKERS
A146: OAKLEIGH | C146: BURKE 6 | F146: McDONALD 5 | I146: HAY 4 | J146: BRUERTON 2 | M146: MURNANE 2 | P146: KING 2 | R146: HARTLEY
A147: BOX HILL | C147: EDWARDS 3 | F147: LASKIE 3 | H147: FARRUGIA 2 | K147: PICKETT | M147: TUCKWELL | O147: CINNAMOND | R147: GORDON | T147: MAU
A149: ROUND 4 | E149: 24TH APRIL | J149: WEATHER | S149: PLAYED AT
D150: 1ST QTR | H150: 2ND QTR | L150: 3RD QTR | P150: FINAL | S150: CAMBERWELL
A151: CAMBERWELL | C151: 6 | D151: 3 | E151: =C151*6+D151 -> 39 | G151: 11 | H151: 4 | I151: =G151*6+H151 -> 70 | K151: 18 | L151: 10 | M151: =K151*6+L151 -> 118 | O151: 26 | P151: 16 | Q151: =O151*6+P151 -> 172 | S151: UMPIRE | X151: LADDER | AB151: ROUND | AD151: 4
A152: YARRAVILLE | C152: 5 | D152: 2 | E152: =C152*6+D152 -> 32 | G152: 8 | H152: 6 | I152: =G152*6+H152 -> 54 | K152: 11 | L152: 10 | M152: =K152*6+L152 -> 76 | O152: 14 | P152: 11 | Q152: =O152*6+P152 -> 95 | S152: OGSTON
A153: BEST PLAYERS | W153: TEAM | X153: W | Y153: L | Z153: D | AA153: FOR | AB153: AGST | AC153: % | AD153: PTS
A154: CAMBERWELL | C154: SPITHILL | F154: JUDD | I154: HAMMOND | L154: WALLACE | O154: NEILSON | R154: HARROP
A155: YARRAVILLE | C155: NIL | W155: CAMBERWELL | X155: 4 | Y155: 0 | Z155: 0 | AA155: 604 | AB155: 436 | AC155: =(AA155*100)/AB155 -> 138.53211009174311 | AD155: =(X155*4)+(Z155*2) -> 16
A156: GOALKICKERS | W156: MORDIALLOC | X156: 3 | Y156: 1 | Z156: 0 | AA156: 572 | AB156: 433 | AC156: =(AA156*100)/AB156 -> 132.10161662817552 | AD156: =(X156*4)+(Z156*2) -> 12
A157: CAMBERWELL | C157: HAMMOND 12 | F157: HARROP 7 | I157: B SMITH 4 | L157: WILSON | N157: WALLACE | Q157: A SMITH | W157: SUNSHINE | X157: 3 | Y157: 1 | Z157: 0 | AA157: 522 | AB157: 417 | AC157: =(AA157*100)/AB157 -> 125.17985611510791 | AD157: =(X157*4)+(Z157*2) -> 12
A158: YARRAVILLE | C158: BISSET 4 | E158: THORPE 3 | G158: WELLINGTON 2 | J158: SAIT | L158: COLLINS | N158: RICHES | P158: KIRKMAN | R158: JONES | W158: OAKLEIGH | X158: 3 | Y158: 1 | Z158: 0 | AA158: 582 | AB158: 479 | AC158: =(AA158*100)/AB158 -> 121.50313152400835 | AD158: =(X158*4)+(Z158*2) -> 12
A160: OAKLEIGH | C160: 4 | D160: 5 | E160: =C160*6+D160 -> 29 | G160: 13 | H160: 12 | I160: =G160*6+H160 -> 90 | K160: 18 | L160: 17 | M160: =K160*6+L160 -> 125 | O160: 20 | P160: 23 | Q160: =O160*6+P160 -> 143 | S160: OAKLEIGH | W160: FRANKSTON | X160: 2 | Y160: 2 | Z160: 0 | AA160: 525 | AB160: 473 | AC160: =(AA160*100)/AB160 -> 110.99365750528541 | AD160: =(X160*4)+(Z160*2) -> 8
A161: NORTHCOTE | C161: 4 | D161: 3 | E161: =C161*6+D161 -> 27 | G161: 7 | H161: 5 | I161: =G161*6+H161 -> 47 | K161: 11 | L161: 8 | M161: =K161*6+L161 -> 74 | O161: 19 | P161: 13 | Q161: =O161*6+P161 -> 127 | S161: McBAIN | W161: WERRIBEE | X161: 2 | Y161: 2 | Z161: 0 | AA161: 444 | AB161: 505 | AC161: =(AA161*100)/AB161 -> 87.920792079207928 | AD161: =(X161*4)+(Z161*2) -> 8
A162: BEST PLAYERS | W162: NORTHCOTE | X162: 1 | Y162: 3 | Z162: 0 | AA162: 530 | AB162: 586 | AC162: =(AA162*100)/AB162 -> 90.443686006825942 | AD162: =(X162*4)+(Z162*2) -> 4
A163: OAKLEIGH | C163: FRYER | F163: KING | I163: EDWARDS | L163: HOLDEN | O163: BURKE | R163: MURNANE | W163: WAVERLEY | X163: 1 | Y163: 3 | Z163: 0 | AA163: 451 | AB163: 506 | AC163: =(AA163*100)/AB163 -> 89.130434782608702 | AD163: =(X163*4)+(Z163*2) -> 4
A164: NORTHCOTE | C164: HOBBS | F164: MORTON | I164: McARDLE | L164: McGRATH | O164: REDENBACH | R164: BUTLER | W164: YARRAVILLE | X164: 1 | Y164: 3 | Z164: 0 | AA164: 445 | AB164: 523 | AC164: =(AA164*100)/AB164 -> 85.086042065009565 | AD164: =(X164*4)+(Z164*2) -> 4
A165: GOALKICKERS | P165: HARTLEY | W165: BOX HILL | X165: 0 | Y165: 4 | Z165: 0 | AA165: 347 | AB165: 664 | AC165: =(AA165*100)/AB165 -> 52.25903614457831 | AD165: =(X165*4)+(Z165*2) -> 0
A166: OAKLEIGH | C166: BURKE 7 | E166: MURNANE 4 | H166: KING 2 | J166: McDONALD 2 | M166: HOLDEN | O166: SPLATT | Q166: WHITE | S166: BARROTT
A167: NORTHCOTE | C167: MORTON 4 | F167: DEMIR 4 | H167: STILSBY 3 | J167: BUTLER 2 | L167: McORIST 2 | N167: R JOHNSTON | Q167: HOBBS | S167: McGRATH | V167: McGREGOR
A169: SUNSHINE | C169: 5 | D169: 12 | E169: =C169*6+D169 -> 42 | G169: 11 | H169: 17 | I169: =G169*6+H169 -> 83 | K169: 18 | L169: 24 | M169: =K169*6+L169 -> 132 | O169: 25 | P169: 31 | Q169: =O169*6+P169 -> 181 | S169: SUNSHINE
A170: BOX HILL | C170: 2 | D170: 2 | E170: =C170*6+D170 -> 14 | G170: 6 | H170: 7 | I170: =G170*6+H170 -> 43 | K170: 8 | L170: 5 | M170: =K170*6+L170 -> 53 | O170: 17 | P170: 18 | Q170: =O170*6+P170 -> 120 | S170: SNOOKS
A171: BEST PLAYERS
A172: SUNSHINE | C172: PAXTON | F172: VELLA | I172: MARTIN | L172: SEARLE | O172: JONES | Q172: BENSON
A173: BOX HILL | C173: JONES | F173: LASKIE | I173: WELLINGS | L173: VIRTH
A174: GOALKICKERS
A175: SUNSHINE | C175: RADZIMINSKI 5 | F175: MARTIN 3 | H175: BRETT 3 | J175: CLARKE 3 | L175: VELLA 3 | N175: BENSON 2 | P175: McDONALD 2 | S175: PAXTON | U175: HOLLOW | W175: JONES | X175: SEARLE
A176: BOX HILL | C176: LASKIE 4 | F176: MAU 3 | H176: CINNAMOND 2 | K176: FARRUGIA 2 | N176: WELLINGS 2 | Q176: LOVE | R176: EDWARDS | U176: LEES | W176: PICKETT
A178: FRANKSTON | C178: 7 | D178: 5 | E178: =C178*6+D178 -> 47 | G178: 15 | H178: 11 | I178: =G178*6+H178 -> 101 | K178: 20 | L178: 17 | M178: =K178*6+L178 -> 137 | O178: 27 | P178: 22 | Q178: =O178*6+P178 -> 184 | S178: FRANKSTON
A179: WAVERLEY | C179: 5 | D179: 3 | E179: =C179*6+D179 -> 33 | G179: 6 | H179: 6 | I179: =G179*6+H179 -> 42 | K179: 10 | L179: 9 | M179: =K179*6+L179 -> 69 | O179: 13 | P179: 11 | Q179: =O179*6+P179 -> 89 | S179: TORNEY
A180: BEST PLAYERS
A181: FRANKSTON | C181: BOYD | F181: JONES | I181: THATCHER | L181: DAVIES | O181: LEWIS | R181: RIDSDALE
A182: WAVERLEY | C182: HANKINSON | F182: HOLDSWORTH | I182: W McDONALD | L182: KELAART | O182: CARVER | R182: A McLURE
A183: GOALKICKERS
A184: FRANKSTON | C184: JONES 7 | E184: BOYD 5 | G184: DAVIES 5 | I184: CLARKE 2 | K184: STAPLETON | N184: KENNEDY | P184: THATCHER | R184: NORRIS | T184: EDWARDS
A185: WAVERLEY | C185: A McLURE 4 | F185: K McKAY 3 | I185: KINNABURGH | L185: G McLURE | N185: KELAART | P185: HAROLD | R185: CARVER
A187: MORDIALLOC | C187: 5 | D187: 4 | E187: =C187*6+D187 -> 34 | G187: 10 | H187: 10 | I187: =G187*6+H187 -> 70 | K187: 16 | L187: 16 | M187: =K187*6+L187 -> 112 | O187: 23 | P187: 21 | Q187: =O187*6+P187 -> 159 | S187: MORDIALLOC
A188: WERRIBEE | C188: 2 | D188: 4 | E188: =C188*6+D188 -> 16 | G188: 5 | H188: 4 | I188: =G188*6+H188 -> 34 | K188: 6 | L188: 5 | M188: =K188*6+L188 -> 41 | O188: 9 | P188: 9 | Q188: =O188*6+P188 -> 63 | S188: STEERE
A189: BEST PLAYERS
A190: MORDIALLOC | C190: WALSH | F190: O'NEILL | I190: MOORE | L190: SLADE | O190: DEATON | R190: DINGLE
A191: WERRIBEE | C191: A BOURKE | F191: KNIGHT | I191: WHITEHEAD
A192: GOALKICKERS
A193: MORDIALLOC | C193: NEVILLE 6 | F193: DEATON 5 | H193: JOHNSTONE 4 | K193: DINGLE 3 | M193: MICHAELIDES 2 | P193: MILDENHALL | S193: MOORE | U193: SLADE
A194: WERRIBEE | C194: LYONS 4 | F194: MARTIN 2 | I194: WISE 2 | K194: F MITCHELL
A196: ROUND 5 | E196: 1ST MAY | J196: WEATHER | S196: PLAYED AT
D197: 1ST QTR | H197: 2ND QTR | L197: 3RD QTR | P197: FINAL | S197: WERRIBEE
A198: FRANKSTON | C198: 2 | D198: 5 | E198: =C198*6+D198 -> 17 | G198: 4 | H198: 10 | I198: =G198*6+H198 -> 34 | K198: 9 | L198: 20 | M198: =K198*6+L198 -> 74 | O198: 16 | P198: 26 | Q198: =O198*6+P198 -> 122 | S198: UMPIRE | X198: LADDER | AB198: ROUND | AD198: 5
A199: WERRIBEE | C199: 4 | D199: 4 | E199: =C199*6+D199 -> 28 | G199: 7 | H199: 5 | I199: =G199*6+H199 -> 47 | K199: 11 | L199: 7 | M199: =K199*6+L199 -> 73 | O199: 14 | P199: 10 | Q199: =O199*6+P199 -> 94 | S199: SNOOKS
A200: BEST PLAYERS | W200: TEAM | X200: W | Y200: L | Z200: D | AA200: FOR | AB200: AGST | AC200: % | AD200: PTS
A201: FRANKSTON | C201: BOYD | F201: GUY | I201: KENNEDY | L201: JONES | N201: LLOYD
A202: WERRIBEE | C202: SQUIRE | F202: WHITEHEAD | I202: JACK | L202: LYONS | N202: A BOURKE | Q202: LEECE | W202: CAMBERWELL | X202: 5 | Y202: 0 | Z202: 0 | AA202: 716 | AB202: 516 | AC202: =(AA202*100)/AB202 -> 138.75968992248062 | AD202: =(X202*4)+(Z202*2) -> 20
A203: GOALKICKERS | W203: MORDIALLOC | X203: 4 | Y203: 1 | Z203: 0 | AA203: 776 | AB203: 522 | AC203: =(AA203*100)/AB203 -> 148.65900383141764 | AD203: =(X203*4)+(Z203*2) -> 16
A204: FRANKSTON | C204: DAVIES 3 | E204: GUY 3 | G204: BOYD 3 | I204: KENNEDY 2 | L204: LOVELOCK 2 | N204: JONES 2 | P204: HARRISON | W204: OAKLEIGH | X204: 4 | Y204: 1 | Z204: 0 | AA204: 727 | AB204: 608 | AC204: =(AA204*100)/AB204 -> 119.57236842105263 | AD204: =(X204*4)+(Z204*2) -> 16
A205: WERRIBEE | C205: LEECE 6 | F205: JACK 4 | H205: G BELLIN | J205: LYONS | L205: MARTIN | N205: HUDSON | W205: SUNSHINE | X205: 3 | Y205: 2 | Z205: 0 | AA205: 651 | AB205: 562 | AC205: =(AA205*100)/AB205 -> 115.83629893238434 | AD205: =(X205*4)+(Z205*2) -> 12
A207: CAMBERWELL | C207: 6 | D207: 8 | E207: =C207*6+D207 -> 44 | G207: 10 | H207: 13 | I207: =G207*6+H207 -> 73 | K207: 14 | L207: 16 | M207: =K207*6+L207 -> 100 | O207: 16 | P207: 16 | Q207: =O207*6+P207 -> 112 | S207: WAVERLEY | W207: FRANKSTON | X207: 3 | Y207: 2 | Z207: 0 | AA207: 647 | AB207: 567 | AC207: =(AA207*100)/AB207 -> 114.10934744268077 | AD207: =(X207*4)+(Z207*2) -> 12
A208: WAVERLEY | C208: 4 | D208: 0 | E208: =C208*6+D208 -> 24 | G208: 5 | H208: 5 | I208: =G208*6+H208 -> 35 | K208: 7 | L208: 10 | M208: =K208*6+L208 -> 52 | O208: 11 | P208: 14 | Q208: =O208*6+P208 -> 80 | S208: MARCY | W208: YARRAVILLE | X208: 2 | Y208: 3 | Z208: 0 | AA208: 568 | AB208: 609 | AC208: =(AA208*100)/AB208 -> 93.267651888341547 | AD208: =(X208*4)+(Z208*2) -> 8
A209: BEST PLAYERS | W209: WERRIBEE | X209: 2 | Y209: 3 | Z209: 0 | AA209: 538 | AB209: 627 | AC209: =(AA209*100)/AB209 -> 85.805422647527905 | AD209: =(X209*4)+(Z209*2) -> 8
A210: CAMBERWELL | C210: HOOK | F210: HUMPHREY | I210: HARROP | L210: B SMITH | O210: OLIVER | R210: NEILSON | W210: NORTHCOTE | X210: 1 | Y210: 4 | Z210: 0 | AA210: 616 | AB210: 709 | AC210: =(AA210*100)/AB210 -> 86.882933709449929 | AD210: =(X210*4)+(Z210*2) -> 4
A211: WAVERLEY | C211: CARVER | F211: MILES | I211: W McDONALD | L211: HOLDSWORTH | O211: HANKINSON | W211: WAVERLEY | X211: 1 | Y211: 4 | Z211: 0 | AA211: 531 | AB211: 618 | AC211: =(AA211*100)/AB211 -> 85.922330097087382 | AD211: =(X211*4)+(Z211*2) -> 4
A212: GOALKICKERS | W212: BOX HILL | X212: 0 | Y212: 5 | Z212: 0 | AA212: 436 | AB212: 868 | AC212: =(AA212*100)/AB212 -> 50.230414746543779 | AD212: =(X212*4)+(Z212*2) -> 0
A213: CAMBERWELL | C213: B SMITH 5 | F213: HARROP 5 | I213: HAMMOND 3 | L213: WALLACE 2 | O213: NEILSON
A214: WAVERLEY | C214: A McLURE 4 | F214: CARVER 3 | I214: LEES 2 | K214: McKAY | M214: MILES
A216: YARRAVILLE | C216: 10 | D216: 14 | E216: =C216*6+D216 -> 74 | G216: 11 | H216: 17 | I216: =G216*6+H216 -> 83 | K216: 14 | L216: 25 | M216: =K216*6+L216 -> 109 | O216: 16 | P216: 27 | Q216: =O216*6+P216 -> 123 | S216: YARRAVILLE
A217: NORTHCOTE | C217: 1 | D217: 1 | E217: =C217*6+D217 -> 7 | G217: 10 | H217: 6 | I217: =G217*6+H217 -> 66 | K217: 11 | L217: 8 | M217: =K217*6+L217 -> 74 | O217: 12 | P217: 14 | Q217: =O217*6+P217 -> 86 | S217: O'BRIEN
A218: BEST PLAYERS
A219: YARRAVILLE | C219: BISSET | F219: RICHES | I219: HAYES | L219: THORPE | O219: JONES | Q219: WELLINGTON
A220: NORTHCOTE | C220: R JOHNSTON | F220: McFARLANE | I220: McGREGOR | L220: McINTYRE | O220: ROBERTS
A221: GOALKICKERS
A222: YARRAVILLE | C222: BISSET 7 | E222: SAIT 2 | G222: HAYES 2 | I222: HARLEY 2 | K222: SIMMONS | N222: GIBSON | P222: SMITH
A223: NORTHCOTE | C223: McFARLANE 3 | F223: WESCOMBE 2 | I223: MORTON 2 | L223: McGRATH 2 | O223: McGREGOR | R223: DEMIR | T223: JOHNSTON
A225: MORDIALLOC | C225: 4 | D225: 4 | E225: =C225*6+D225 -> 28 | G225: 16 | H225: 7 | I225: =G225*6+H225 -> 103 | K225: 22 | L225: 9 | M225: =K225*6+L225 -> 141 | O225: 32 | P225: 12 | Q225: =O225*6+P225 -> 204 | S225: BOX HILL
A226: BOX HILL | C226: 2 | D226: 4 | E226: =C226*6+D226 -> 16 | G226: 4 | H226: 6 | I226: =G226*6+H226 -> 30 | K226: 9 | L226: 8 | M226: =K226*6+L226 -> 62 | O226: 13 | P226: 11 | Q226: =O226*6+P226 -> 89 | S226: WENN
A227: BEST PLAYERS
A228: MORDIALLOC | C228: MILDENHALL | F228: DINGLE | I228: NEVILLE | L228: WILLIAMSON | O228: BLOOMFIELD | R228: DEATON
A229: BOX HILL | C229: JONES | F229: HIGGINS | I229: VIRTH | L229: COOK | O229: LEES | R229: LAWTHER
A230: GOALKICKERS
A231: MORDIALLOC | C231: NEVILLE 8 | F231: MILDENHALL 7 | I231: DEATON 5 | K231: DINGLE 3 | M231: JOHNSTONE 3 | P231: MICHAELIDES 3 | S231: BLOOMFIELD | V231: WILLIAMSON | X231: MOORE
A232: BOX HILL | C232: MAU 3 | E232: LASKIE 2 | G232: FARRUGIA 2 | J232: PICKETT 2 | M232: EDWARDS | O232: A'HALE | Q232: WELLINGS | T232: LEES
A234: OAKLEIGH | C234: 7 | D234: 7 | E234: =C234*6+D234 -> 49 | G234: 11 | H234: 15 | I234: =G234*6+H234 -> 81 | K234: 17 | L234: 21 | M234: =K234*6+L234 -> 123 | O234: 20 | P234: 25 | Q234: =O234*6+P234 -> 145 | S234: OAKLEIGH
A235: SUNSHINE | C235: 6 | D235: 2 | E235: =C235*6+D235 -> 38 | G235: 10 | H235: 3 | I235: =G235*6+H235 -> 63 | K235: 12 | L235: 6 | M235: =K235*6+L235 -> 78 | O235: 19 | P235: 15 | Q235: =O235*6+P235 -> 129 | S235: STEERE
A236: BEST PLAYERS
A237: OAKLEIGH | C237: BURKE | F237: KING | I237: EDWARDS | L237: HOLDEN | O237: MURNANE | R237: FRYER
A238: SUNSHINE | C238: MARTIN | F238: RADZIMINSKI | I238: BENSON | L238: PAXTON | O238: MITCHELL | R238: McDONALD
A239: GOALKICKERS
A240: OAKLEIGH | C240: BURKE 11 | F240: HOLDEN 3 | I240: MURNANE 3 | L240: KING | N240: McDONALD | Q240: ALLISEY
A241: SUNSHINE | C241: MANDICS 5 | F241: RADZIMINSKI 5 | I241: CLARKE 3 | K241: BRETT 2 | M241: SEARLE 2 | O241: BENSON | Q241: VELLA
A243: ROUND 6 | E243: 8TH MAY | J243: WEATHER | S243: PLAYED AT
D244: 1ST QTR | H244: 2ND QTR | L244: 3RD QTR | P244: FINAL | S244: CAMBERWELL
A245: CAMBERWELL | C245: 7 | D245: 2 | E245: =C245*6+D245 -> 44 | G245: 13 | H245: 6 | I245: =G245*6+H245 -> 84 | K245: 19 | L245: 8 | M245: =K245*6+L245 -> 122 | O245: 27 | P245: 12 | Q245: =O245*6+P245 -> 174 | S245: UMPIRE | X245: LADDER | AB245: ROUND | AD245: 6
A246: WERRIBEE | C246: 6 | D246: 2 | E246: =C246*6+D246 -> 38 | G246: 8 | H246: 4 | I246: =G246*6+H246 -> 52 | K246: 15 | L246: 6 | M246: =K246*6+L246 -> 96 | O246: 17 | P246: 8 | Q246: =O246*6+P246 -> 110 | S246: McBAIN
A247: BEST PLAYERS | W247: TEAM | X247: W | Y247: L | Z247: D | AA247: FOR | AB247: AGST | AC247: % | AD247: PTS
A248: CAMBERWELL | C248: OLIVER | F248: HOOK | I248: JUDD | L248: R SMITH | O248: B SMITH | R248: NEILSON
A249: WERRIBEE | C249: J BELLIN | F249: BOURKE | I249: MARTIN | L249: YOUNG | O249: LEECE | R249: LYONS | W249: CAMBERWELL | X249: 6 | Y249: 0 | Z249: 0 | AA249: 890 | AB249: 626 | AC249: =(AA249*100)/AB249 -> 142.17252396166134 | AD249: =(X249*4)+(Z249*2) -> 24
A250: GOALKICKERS | W250: MORDIALLOC | X250: 5 | Y250: 1 | Z250: 0 | AA250: 926 | AB250: 614 | AC250: =(AA250*100)/AB250 -> 150.81433224755699 | AD250: =(X250*4)+(Z250*2) -> 20
A251: CAMBERWELL | C251: HAMMOND 8 | F251: B SMITH 7 | I251: HARROP 6 | K251: NEILSON 3 | N251: HOWARD | P251: WALLACE | R251: O'BRIEN | W251: FRANKSTON | X251: 4 | Y251: 2 | Z251: 0 | AA251: 859 | AB251: 669 | AC251: =(AA251*100)/AB251 -> 128.40059790732437 | AD251: =(X251*4)+(Z251*2) -> 16
A252: WERRIBEE | C252: LEECE 6 | F252: SQUIRE 3 | H252: LYONS 2 | J252: JACK 2 | L252: MARTIN 2 | N252: J BELLIN | P252: JOHNSON | W252: OAKLEIGH | X252: 4 | Y252: 2 | Z252: 0 | AA252: 816 | AB252: 728 | AC252: =(AA252*100)/AB252 -> 112.08791208791209 | AD252: =(X252*4)+(Z252*2) -> 16
A254: NORTHCOTE | C254: 6 | D254: 10 | E254: =C254*6+D254 -> 46 | G254: 9 | H254: 16 | I254: =G254*6+H254 -> 70 | K254: 16 | L254: 20 | M254: =K254*6+L254 -> 116 | O254: 22 | P254: 25 | Q254: =O254*6+P254 -> 157 | S254: NORTHCOTE | W254: SUNSHINE | X254: 3 | Y254: 3 | Z254: 0 | AA254: 743 | AB254: 712 | AC254: =(AA254*100)/AB254 -> 104.35393258426966 | AD254: =(X254*4)+(Z254*2) -> 12
A255: WAVERLEY | C255: 1 | D255: 3 | E255: =C255*6+D255 -> 9 | G255: 3 | H255: 6 | I255: =G255*6+H255 -> 24 | K255: 5 | L255: 9 | M255: =K255*6+L255 -> 39 | O255: 7 | P255: 15 | Q255: =O255*6+P255 -> 57 | S255: SNOOKS | W255: YARRAVILLE | X255: 3 | Y255: 3 | Z255: 0 | AA255: 688 | AB255: 698 | AC255: =(AA255*100)/AB255 -> 98.567335243553003 | AD255: =(X255*4)+(Z255*2) -> 12
A256: BEST PLAYERS | W256: NORTHCOTE | X256: 2 | Y256: 4 | Z256: 0 | AA256: 773 | AB256: 766 | AC256: =(AA256*100)/AB256 -> 100.91383812010444 | AD256: =(X256*4)+(Z256*2) -> 8
A257: NORTHCOTE | C257: MCARDLE | F257: McINTYRE | I257: MORTON | L257: McGREGOR | O257: HOBBS | R257: HOWELL | W257: WERRIBEE | X257: 2 | Y257: 4 | Z257: 0 | AA257: 648 | AB257: 801 | AC257: =(AA257*100)/AB257 -> 80.898876404494388 | AD257: =(X257*4)+(Z257*2) -> 8
A258: WAVERLEY | C258: CRAWFORD | F258: CRONIN | I258: STYLES | L258: HANKINSON | O258: HAROLD | R258: W McDONALD | W258: WAVERLEY | X258: 1 | Y258: 5 | Z258: 0 | AA258: 588 | AB258: 775 | AC258: =(AA258*100)/AB258 -> 75.870967741935488 | AD258: =(X258*4)+(Z258*2) -> 4
A259: GOALKICKERS | W259: BOX HILL | X259: 0 | Y259: 6 | Z259: 0 | AA259: 538 | AB259: 1080 | AC259: =(AA259*100)/AB259 -> 49.814814814814817 | AD259: =(X259*4)+(Z259*2) -> 0
A260: NORTHCOTE | C260: MORTON 9 | F260: McFARLANE 4 | I260: McGREGOR 4 | L260: DOBSON 2 | N260: WESCOMBE | Q260: R JOHNSTON | T260: McGRATH
A261: WAVERLEY | C261: CRAWFORD 2 | F261: STYLES | H261: A McLURE | K261: MILES | M261: LEES | N261: HANKINSON
A263: YARRAVILLE | C263: 3 | D263: 3 | E263: =C263*6+D263 -> 21 | G263: 8 | H263: 14 | I263: =G263*6+H263 -> 62 | K263: 13 | L263: 16 | M263: =K263*6+L263 -> 94 | O263: 16 | P263: 24 | Q263: =O263*6+P263 -> 120 | S263: YARRAVILLE
A264: OAKLEIGH | C264: 6 | D264: 6 | E264: =C264*6+D264 -> 42 | G264: 7 | H264: 3 | I264: =G264*6+H264 -> 45 | K264: 9 | L264: 9 | M264: =K264*6+L264 -> 63 | O264: 13 | P264: 11 | Q264: =O264*6+P264 -> 89 | S264: TORNEY
A265: BEST PLAYERS
A266: YARRAVILLE | C266: WELLINGTON | F266: THORPE | I266: PRIEST | L266: GRACO | O266: MERRINGTON | R266: LEGAWIEC
A267: OAKLEIGH | C267: BRUERTON | F267: KING | I267: HOLDEN | L267: COLCOTT | O267: EDWARDS | R267: HAY
A268: GOALKICKERS
A269: YARRAVILLE | C269: SHIELDS 5 | F269: SIMMONS 2 | I269: BISSET 2 | K269: SAIT 2 | M269: WELLINGTON 2 | P269: THORPE | R269: JONES | T269: GIBSON
A270: OAKLEIGH | C270: COLCOTT 3 | F270: MURNANE 3 | I270: HOLDEN 2 | K270: BRUERTON 2 | N270: BARROTT | Q270: WENN | S270: WHITE
A272: FRANKSTON | C272: 6 | D272: 9 | E272: =C272*6+D272 -> 45 | G272: 11 | H272: 15 | I272: =G272*6+H272 -> 81 | K272: 25 | L272: 17 | M272: =K272*6+L272 -> 167 | O272: 31 | P272: 26 | Q272: =O272*6+P272 -> 212 | S272: FRANKSTON
A273: BOX HILL | C273: 2 | D273: 3 | E273: =C273*6+D273 -> 15 | G273: 4 | H273: 8 | I273: =G273*6+H273 -> 32 | K273: 7 | L273: 11 | M273: =K273*6+L273 -> 53 | O273: 15 | P273: 12 | Q273: =O273*6+P273 -> 102 | S273: STEERE
A274: BEST PLAYERS
A275: FRANKSTON | C275: GUY | F275: DAVIES | I275: MACE | L275: JONES | O275: KENNEDY | R275: ESLER
A276: BOX HILL | C276: COOK | F276: LASKIE | I276: VIRTH | L276: LEES | O276: EDWARDS | R276: PICKETT
A277: GOALKICKERS
A278: FRANKSTON | C278: DAVIES 13 | F278: JONES 4 | H278: GUY 3 | J278: HARRISON 3 | M278: THATCHER 2 | P278: LOVELOCK | R278: KENNEDY | T278: CAYZER | V278: MACE | X278: BOYD
A279: BOX HILL | C279: LASKIE 5 | F279: LEES 2 | H279: MAU 2 | J279: McGUINNESS 2 | M279: WELLINGS | P279: COOK | R279: PICKETT | U279: JONES
A281: MORDIALLOC | C281: 4 | D281: 3 | E281: =C281*6+D281 -> 27 | G281: 12 | H281: 4 | I281: =G281*6+H281 -> 76 | K281: 16 | L281: 8 | M281: =K281*6+L281 -> 104 | O281: 22 | P281: 18 | Q281: =O281*6+P281 -> 150 | S281: MORDIALLOC
A282: SUNSHINE | C282: 3 | D282: 5 | E282: =C282*6+D282 -> 23 | G282: 5 | H282: 6 | I282: =G282*6+H282 -> 36 | K282: 9 | L282: 17 | M282: =K282*6+L282 -> 71 | O282: 12 | P282: 20 | Q282: =O282*6+P282 -> 92 | S282: MARCY
A283: BEST PLAYERS
A284: MORDIALLOC | C284: DEATON | F284: LANG | I284: NORRIS | L284: NEVILLE | O284: SLADE | R284: THOMPSON
A285: SUNSHINE | C285: RADZIMINSKI | F285: McDONALD | I285: MARTIN | L285: PAXTON | O285: VELLA | R285: BAIRD
A286: GOALKICKERS
A287: MORDIALLOC | C287: NEVILLE 9 | F287: DEATON 6 | I287: NORRIS 3 | K287: WALSH 2 | M287: MILDENHALL | P287: BLOOMFIELD
A288: SUNSHINE | C288: VELLA 5 | F288: MANDICS 4 | I288: PAXTON | K288: MCDONALD | N288: CLARKE
A290: ROUND 7 | E290: 15TH MAY | J290: WEATHER | S290: PLAYED AT
D291: 1ST QTR | H291: 2ND QTR | L291: 3RD QTR | P291: FINAL | S291: OAKLEIGH
A292: MORDIALLOC | C292: 4 | D292: 5 | E292: =C292*6+D292 -> 29 | G292: 8 | H292: 6 | I292: =G292*6+H292 -> 54 | K292: 15 | L292: 9 | M292: =K292*6+L292 -> 99 | O292: 17 | P292: 11 | Q292: =O292*6+P292 -> 113 | S292: UMPIRE | X292: LADDER | AB292: ROUND | AD292: 7
A293: OAKLEIGH | C293: 4 | D293: 4 | E293: =C293*6+D293 -> 28 | G293: 7 | H293: 6 | I293: =G293*6+H293 -> 48 | K293: 10 | L293: 6 | M293: =K293*6+L293 -> 66 | O293: 12 | P293: 12 | Q293: =O293*6+P293 -> 84 | S293: FITZPATRICK
A294: BEST PLAYERS | W294: TEAM | X294: W | Y294: L | Z294: D | AA294: FOR | AB294: AGST | AC294: % | AD294: PTS
A295: MORDIALLOC | C295: LANG | F295: DINGLE | I295: WALSH | L295: DEATON | O295: BASTIAN | R295: GRANT
A296: OAKLEIGH | C296: HOLDEN | F296: BRUERTON | I296: COLCOTT | L296: GOODMAN | O296: WENN | R296: RHEINBERGER | W296: CAMBERWELL | X296: 7 | Y296: 0 | Z296: 0 | AA296: 1002 | AB296: 706 | AC296: =(AA296*100)/AB296 -> 141.92634560906515 | AD296: =(X296*4)+(Z296*2) -> 28
A297: GOALKICKERS | W297: MORDIALLOC | X297: 6 | Y297: 1 | Z297: 0 | AA297: 1039 | AB297: 698 | AC297: =(AA297*100)/AB297 -> 148.85386819484242 | AD297: =(X297*4)+(Z297*2) -> 24
A298: MORDIALLOC | C298: NEVILLE 6 | E298: DEATON 3 | G298: NORRIS 3 | I298: BLOOMFIELD 2 | L298: WILLIAMSON | O298: JOHNSTONE | R298: SLADE | W298: FRANKSTON | X298: 5 | Y298: 2 | Z298: 0 | AA298: 998 | AB298: 761 | AC298: =(AA298*100)/AB298 -> 131.14323258869908 | AD298: =(X298*4)+(Z298*2) -> 20
A299: OAKLEIGH | C299: HOLDEN 3 | E299: MURNANE 2 | H299: BRUERTON 2 | K299: COLCOTT 2 | N299: McMAHON | Q299: AINSLEY | S299: BURKE | W299: YARRAVILLE | X299: 4 | Y299: 3 | Z299: 0 | AA299: 818 | AB299: 763 | AC299: =(AA299*100)/AB299 -> 107.20838794233289 | AD299: =(X299*4)+(Z299*2) -> 16
A301: FRANKSTON | C301: 5 | D301: 7 | E301: =C301*6+D301 -> 37 | G301: 8 | H301: 11 | I301: =G301*6+H301 -> 59 | K301: 16 | L301: 17 | M301: =K301*6+L301 -> 113 | O301: 20 | P301: 19 | Q301: =O301*6+P301 -> 139 | S301: SUNSHINE | W301: OAKLEIGH | X301: 4 | Y301: 3 | Z301: 0 | AA301: 900 | AB301: 841 | AC301: =(AA301*100)/AB301 -> 107.01545778834721 | AD301: =(X301*4)+(Z301*2) -> 16
A302: SUNSHINE | C302: 0 | D302: 3 | E302: =C302*6+D302 -> 3 | G302: 2 | H302: 8 | I302: =G302*6+H302 -> 20 | K302: 3 | L302: 11 | M302: =K302*6+L302 -> 29 | O302: 13 | P302: 14 | Q302: =O302*6+P302 -> 92 | S302: O'BRIEN | W302: SUNSHINE | X302: 3 | Y302: 4 | Z302: 0 | AA302: 835 | AB302: 851 | AC302: =(AA302*100)/AB302 -> 98.119858989424202 | AD302: =(X302*4)+(Z302*2) -> 12
A303: BEST PLAYERS | W303: WERRIBEE | X303: 3 | Y303: 4 | Z303: 0 | AA303: 815 | AB303: 917 | AC303: =(AA303*100)/AB303 -> 88.876772082878958 | AD303: =(X303*4)+(Z303*2) -> 12
A304: FRANKSTON | C304: MACE | F304: LOCCO | I304: HARRISON | L304: B JONES | O304: DAVIES | R304: GUY | W304: NORTHCOTE | X304: 2 | Y304: 5 | Z304: 0 | AA304: 889 | AB304: 933 | AC304: =(AA304*100)/AB304 -> 95.284030010718112 | AD304: =(X304*4)+(Z304*2) -> 8
A305: SUNSHINE | C305: MARTIN | F305: McDONALD | I305: VELLA | L305: R JONES | O305: PAXTON | R305: CLARKE | W305: WAVERLEY | X305: 1 | Y305: 6 | Z305: 0 | AA305: 653 | AB305: 905 | AC305: =(AA305*100)/AB305 -> 72.154696132596683 | AD305: =(X305*4)+(Z305*2) -> 4
A306: GOALKICKERS | W306: BOX HILL | X306: 0 | Y306: 7 | Z306: 0 | AA306: 618 | AB306: 1192 | AC306: =(AA306*100)/AB306 -> 51.845637583892618 | AD306: =(X306*4)+(Z306*2) -> 0
A307: FRANKSTON | C307: DAVIES 4 | E307: CAYZER 4 | G307: HARRISON 4 | J307: JONES 2 | L307: KENNEDY 2 | O307: LOVELOCK 2 | R307: GUY
A308: SUNSHINE | C308: SEARLE 3 | E308: McDONALD 2 | H308: VELLA 2 | J308: BAIRD | L308: RADZIMINSKI | O308: JONES | Q308: MANDICS | S308: B 1 ? | U308: SAID
A310: CAMBERWELL | C310: 6 | D310: 8 | E310: =C310*6+D310 -> 44 | G310: 10 | H310: 13 | I310: =G310*6+H310 -> 73 | K310: 14 | L310: 16 | M310: =K310*6+L310 -> 100 | O310: 16 | P310: 16 | Q310: =O310*6+P310 -> 112 | S310: BOX HILL
A311: BOX HILL | C311: 4 | D311: 0 | E311: =C311*6+D311 -> 24 | G311: 5 | H311: 5 | I311: =G311*6+H311 -> 35 | K311: 7 | L311: 10 | M311: =K311*6+L311 -> 52 | O311: 11 | P311: 14 | Q311: =O311*6+P311 -> 80 | S311: TORNEY
A312: BEST PLAYERS
A313: CAMBERWELL | C313: R SMITH | F313: JUDD | I313: NEILSON | L313: POWER | O313: HUMPHREY | R313: HAMMOND
A314: BOX HILL | C314: EDWARDS | F314: COOK | I314: WILLIAMS | L314: LASKIE | O314: JONES | R314: LUCAS
A315: GOALKICKERS
A316: CAMBERWELL | C316: HAMMOND 9 | F316: B SMITH 2 | H316: HARROP 2 | J316: HUMPHREY | M316: FITZGERALD | O316: WALLACE | Q316: R SMITH | S316: NEILSON | U316: POWER
A317: BOX HILL | C317: McGUINNESS 4 | F317: LASKIE 2 | I317: PICKETT 2 | K317: WRIGHT | M317: WILLIAMS
A319: YARRAVILLE | C319: 5 | D319: 10 | E319: =C319*6+D319 -> 40 | G319: 7 | H319: 18 | I319: =G319*6+H319 -> 60 | K319: 13 | L319: 25 | M319: =K319*6+L319 -> 103 | O319: 17 | P319: 28 | Q319: =O319*6+P319 -> 130 | S319: WAVERLEY
A320: WAVERLEY | C320: 3 | D320: 0 | E320: =C320*6+D320 -> 18 | G320: 6 | H320: 2 | I320: =G320*6+H320 -> 38 | K320: 7 | L320: 2 | M320: =K320*6+L320 -> 44 | O320: 10 | P320: 5 | Q320: =O320*6+P320 -> 65 | S320: HUGGINS
A321: BEST PLAYERS
A322: YARRAVILLE | C322: PRIEST | F322: BISSET | I322: JONES | L322: THORPE | O322: HENRY | R322: GRACO
A323: WAVERLEY | C323: HANKINSON | F323: CRAWFORD | I323: HAROLD | L323: STYLES | O323: J CRAWLEY | R323: DUNNE
A324: GOALKICKERS
A325: YARRAVILLE | C325: GIBSON 6 | E325: SIMMONS 2 | H325: WELLINGTON 2 | K325: SHIELDS 2 | N325: BISSETT | P325: SAIT | R325: HARVEY | T325: HAYES | V325: KEOGH
A326: WAVERLEY | C326: A McLURE 3 | F326: HOLDSWORTH 2 | J326: C WILLIAMS | M326: McDONALD | P326: KINNABURGH | S326: G McLURE | V326: CRAWFORD
A328: WERRIBEE | C328: 7 | D328: 1 | E328: =C328*6+D328 -> 43 | G328: 13 | H328: 4 | I328: =G328*6+H328 -> 82 | K328: 20 | L328: 9 | M328: =K328*6+L328 -> 129 | O328: 26 | P328: 11 | Q328: =O328*6+P328 -> 167 | S328: WERRIBEE
A329: NORTHCOTE | C329: 6 | D329: 5 | E329: =C329*6+D329 -> 41 | G329: 7 | H329: 8 | I329: =G329*6+H329 -> 50 | K329: 12 | L329: 13 | M329: =K329*6+L329 -> 85 | O329: 16 | P329: 20 | Q329: =O329*6+P329 -> 116 | S329: OGSTON
A330: BEST PLAYERS
A331: WERRIBEE | C331: LYNCH | F331: MITCHELL | I331: LEECE | L331: J BOURKE | O331: OUGH | R331: JACK
A332: NORTHCOTE | C332: JOHNSTON | F332: McINTYRE | I332: REDENBACH | L332: DOBSON | O332: HOBBS
A333: GOALKICKERS
A334: WERRIBEE | C334: LEECE 7 | E334: DOUGLAS 4 | G334: JACK 4 | I334: LYONS 4 | K334: MARTIN 2 | N334: MITCHELL 2 | Q334: J BOURKE | S334: J BELLIN | U334: SQUIRE
A335: NORTHCOTE | C335: JOHNSTON 4 | F335: McFARLANE 4 | I335: MORTON 4 | K335: RYAN 3 | M335: HOWELL
A337: ROUND 8 | E337: 29TH MAY | J337: WEATHER | S337: PLAYED AT
D338: 1ST QTR | H338: 2ND QTR | L338: 3RD QTR | P338: FINAL | S338: YARRAVILLE
A339: YARRAVILLE | C339: 5 | D339: 7 | E339: =C339*6+D339 -> 37 | G339: 12 | H339: 14 | I339: =G339*6+H339 -> 86 | K339: 19 | L339: 18 | M339: =K339*6+L339 -> 132 | O339: 23 | P339: 28 | Q339: =O339*6+P339 -> 166 | S339: UMPIRE | X339: LADDER | AB339: ROUND | AD339: 8
A340: WERRIBEE | C340: 1 | D340: 2 | E340: =C340*6+D340 -> 8 | G340: 6 | H340: 5 | I340: =G340*6+H340 -> 41 | K340: 10 | L340: 9 | M340: =K340*6+L340 -> 69 | O340: 15 | P340: 14 | Q340: =O340*6+P340 -> 104 | S340: O'BRIEN
A341: BEST PLAYERS | W341: TEAM | X341: W | Y341: L | Z341: D | AA341: FOR | AB341: AGST | AC341: % | AD341: PTS
A342: YARRAVILLE | C342: RYAN | F342: HAYES | I342: GRANDIN | L342: SIMMONS | O342: KEOGH | R342: GIBSON
A343: WERRIBEE | C343: LYONS | F343: MARTIN | I343: J BOURKE | L343: LEECE | O343: T OUGH | R343: LYNCH | W343: CAMBERWELL | X343: 8 | Y343: 0 | Z343: 0 | AA343: 1167 | AB343: 806 | AC343: =(AA343*100)/AB343 -> 144.78908188585609 | AD343: =(X343*4)+(Z343*2) -> 32
A344: GOALKICKERS | W344: MORDIALLOC | X344: 7 | Y344: 1 | Z344: 0 | AA344: 1176 | AB344: 808 | AC344: =(AA344*100)/AB344 -> 145.54455445544554 | AD344: =(X344*4)+(Z344*2) -> 28
A345: YARRAVILLE | C345: GRANDIN 9 | F345: GIBSON 4 | H345: BISSET 3 | J345: THORPE 3 | L345: HAYES 2 | N345: SIMMONS | P345: PLUMMER | W345: FRANKSTON | X345: 5 | Y345: 3 | Z345: 0 | AA345: 1108 | AB345: 898 | AC345: =(AA345*100)/AB345 -> 123.38530066815144 | AD345: =(X345*4)+(Z345*2) -> 20
A346: WERRIBEE | C346: LEECE 5 | E346: MARTIN 4 | G346: LYONS 2 | I346: DOUGLAS | K346: MITCHELL | M346: YOUNG | O346: J BELLIN | W346: YARRAVILLE | X346: 5 | Y346: 3 | Z346: 0 | AA346: 984 | AB346: 867 | AC346: =(AA346*100)/AB346 -> 113.49480968858131 | AD346: =(X346*4)+(Z346*2) -> 20
A348: WAVERLEY | C348: 3 | D348: 2 | E348: =C348*6+D348 -> 20 | G348: 11 | H348: 2 | I348: =G348*6+H348 -> 68 | K348: 16 | L348: 0 | M348: =K348*6+L348 -> 96 | O348: 23 | P348: 11 | Q348: =O348*6+P348 -> 149 | S348: WAVERLEY | W348: OAKLEIGH | X348: 4 | Y348: 4 | Z348: 0 | AA348: 1037 | AB348: 990 | AC348: =(AA348*100)/AB348 -> 104.74747474747475 | AD348: =(X348*4)+(Z348*2) -> 16
A349: OAKLEIGH | C349: 7 | D349: 3 | E349: =C349*6+D349 -> 45 | G349: 10 | H349: 7 | I349: =G349*6+H349 -> 67 | K349: 13 | L349: 0 | M349: =K349*6+L349 -> 78 | O349: 21 | P349: 11 | Q349: =O349*6+P349 -> 137 | S349: HEDGER | W349: NORTHCOTE | X349: 3 | Y349: 5 | Z349: 0 | AA349: 1088 | AB349: 997 | AC349: =(AA349*100)/AB349 -> 109.12738214643932 | AD349: =(X349*4)+(Z349*2) -> 12
A350: BEST PLAYERS | W350: SUNSHINE | X350: 3 | Y350: 5 | Z350: 0 | AA350: 935 | AB350: 1016 | AC350: =(AA350*100)/AB350 -> 92.027559055118104 | AD350: =(X350*4)+(Z350*2) -> 12
A351: WAVERLEY | C351: ? | F351: McLURE | I351: COSTELLO | L351: ? | O351: WILLIAMS | R351: STYLES | W351: WERRIBEE | X351: 3 | Y351: 5 | Z351: 0 | AA351: 919 | AB351: 1083 | AC351: =(AA351*100)/AB351 -> 84.856879039704523 | AD351: =(X351*4)+(Z351*2) -> 12
A352: OAKLEIGH | C352: ? | F352: McDONALD | I352: HAY | L352: NISBET | O352: ? | R352: WYATT | W352: WAVERLEY | X352: 2 | Y352: 6 | Z352: 0 | AA352: 802 | AB352: 1042 | AC352: =(AA352*100)/AB352 -> 76.967370441458726 | AD352: =(X352*4)+(Z352*2) -> 8
A353: GOALKICKERS | Q353: HANKINSON | W353: BOX HILL | X353: 0 | Y353: 8 | Z353: 0 | AA353: 682 | AB353: 1391 | AC353: =(AA353*100)/AB353 -> 49.029475197699497 | AD353: =(X353*4)+(Z353*2) -> 0
A354: WAVERLEY | C354: ? | E354: COSTELLO 5 | H354: P WILLIAMS ? | K354: C ? 2 | M354: CRONIN | O354: K McDONALD | R354: ? 1 | T354: STYLES
A355: OAKLEIGH | C355: McDONALD ? | F355: ? 3 | H355: BURKE 3 | K355: MURNANE ? | N355: ? 2 | P355: KING 2 | R355: HAY 2 | U355: EDWARDS
A357: NORTHCOTE | C357: 7 | D357: 4 | E357: =C357*6+D357 -> 46 | G357: 14 | H357: 10 | I357: =G357*6+H357 -> 94 | K357: 21 | L357: 19 | M357: =K357*6+L357 -> 145 | O357: 29 | P357: 25 | Q357: =O357*6+P357 -> 199 | S357: NORTHCOTE
A358: BOX HILL | C358: 2 | D358: 6 | E358: =C358*6+D358 -> 18 | G358: 5 | H358: 8 | I358: =G358*6+H358 -> 38 | K358: 7 | L358: 12 | M358: =K358*6+L358 -> 54 | O358: 8 | P358: 16 | Q358: =O358*6+P358 -> 64 | S358: FITZPATRICK
A359: BEST PLAYERS
A360: NORTHCOTE | C360: ? | F360: RYAN | I360: DOBSON | L360: McFARLANE | O360: ? | Q360: REDENBACH
A361: BOX HILL | C361: ? | F361: ? | I361: PICKETT | L361: WELLINGS | O361: ?
A362: GOALKICKERS
A363: NORTHCOTE | C363: G RYAN 6 | F363: BRIGHAM 5 | I363: DOBSON 4 | K363: McFARLANE 3 | N363: McGRATH 3 | Q363: R JOHNSTON 2 | T363: MORTON 2 | W363: ROBERTS | X363: McGREGOR | Z363: HOWELL | AB363: G SMITH
A364: BOX HILL | C364: BATES 4 | F364: McMAHON | I364: PICKETT | K364: WELLINGS | N364: TUCKWELL
A366: CAMBERWELL | C366: 9 | D366: 8 | E366: =C366*6+D366 -> 62 | G366: 11 | H366: 11 | I366: =G366*6+H366 -> 77 | K366: 18 | L366: 13 | M366: =K366*6+L366 -> 121 | O366: 25 | P366: 15 | Q366: =O366*6+P366 -> 165 | S366: CAMBERWELL
A367: SUNSHINE | C367: 2 | D367: 3 | E367: =C367*6+D367 -> 15 | G367: 7 | H367: 7 | I367: =G367*6+H367 -> 49 | K367: 12 | L367: 11 | M367: =K367*6+L367 -> 83 | O367: 14 | P367: 16 | Q367: =O367*6+P367 -> 100 | S367: SNOOKS
A368: BEST PLAYERS
A369: CAMBERWELL | C369: SPITHILL | F369: HUMPHREY | I369: WALLACE | L369: OLIVER | O369: B SMITH | R369: HAZLETT
A370: SUNSHINE | C370: BLAKE | F370: BOYD | I370: SEARLE | L370: BUGDEN | O370: MARTIN | R370: BENSON
A371: GOALKICKERS
A372: CAMBERWELL | C372: HAMMOND 8 | F372: B SMITH 6 | I372: HARROP 5 | L372: WALLACE 4 | O372: FITZGERALD | R372: R SMITH
A373: SUNSHINE | C373: BENSON 3 | E373: MANDICS 3 | H373: SEARLE 2 | J373: VELLA 2 | L373: BLAKE 2 | N373: McDONALD | Q373: JONES
A375: MORDIALLOC | C375: 6 | D375: 12 | E375: =C375*6+D375 -> 48 | G375: 8 | H375: 13 | I375: =G375*6+H375 -> 61 | K375: 15 | L375: 15 | M375: =K375*6+L375 -> 105 | O375: 20 | P375: 17 | Q375: =O375*6+P375 -> 137 | S375: FRANKSTON
A376: FRANKSTON | C376: 3 | D376: 2 | E376: =C376*6+D376 -> 20 | G376: 7 | H376: 5 | I376: =G376*6+H376 -> 47 | K376: 10 | L376: 7 | M376: =K376*6+L376 -> 67 | O376: 16 | P376: 14 | Q376: =O376*6+P376 -> 110 | S376: CARLILE
A377: BEST PLAYERS
A378: MORDIALLOC | C378: ROGERSON | F378: SLADE | I378: DEATON | L378: ROSENOW | O378: BLOOMFIELD | R378: NORRIS
A379: FRANKSTON | C379: KENNEDY | F379: MACE | I379: ESLER | L379: TICKELL | O379: HENRICKSEN | R379: LLOYD
A380: GOALKICKERS
A381: MORDIALLOC | C381: DEATON 4 | F381: NORRIS 4 | H381: BLOOMFIELD 3 | K381: WALSH 2 | M381: GUY 2 | O381: DINGLE | Q381: KNEEBONE | S381: ROGERSON
A382: FRANKSTON | C382: HARRISON 4 | F382: DAVIES 2 | H382: KENNEDY 2 | K382: TICKELL | M382: GUY | N382: HENRICKSEN | Q382: LLOYD | S382: THATCHER | V382: LOVELOCK | X382: ELLIS | Y382: LOCCO
A384: ROUND 9 | E384: 5TH JUNE | J384: WEATHER | S384: PLAYED AT
D385: 1ST QTR | H385: 2ND QTR | L385: 3RD QTR | P385: FINAL | S385: WERRIBEE
A386: WERRIBEE | C386: 0 | D386: 0 | E386: =C386*6+D386 -> 0 | G386: 0 | H386: 0 | I386: =G386*6+H386 -> 0 | K386: 0 | L386: 0 | M386: =K386*6+L386 -> 0 | O386: 22 | P386: 16 | Q386: =O386*6+P386 -> 148 | S386: UMPIRE | X386: LADDER | AB386: ROUND | AD386: 9
A387: WAVERLEY | C387: 0 | D387: 0 | E387: =C387*6+D387 -> 0 | G387: 0 | H387: 0 | I387: =G387*6+H387 -> 0 | K387: 0 | L387: 0 | M387: =K387*6+L387 -> 0 | O387: 14 | P387: 12 | Q387: =O387*6+P387 -> 96
A388: BEST PLAYERS | W388: TEAM | X388: W | Y388: L | Z388: D | AA388: FOR | AB388: AGST | AC388: % | AD388: PTS
A389: WERRIBEE
A390: WAVERLEY | W390: MORDIALLOC | X390: 8 | Y390: 1 | Z390: 0 | AA390: 1259 | AB390: 867 | AC390: =(AA390*100)/AB390 -> 145.21337946943484 | AD390: =(X390*4)+(Z390*2) -> 32
A391: GOALKICKERS | W391: CAMBERWELL | X391: 8 | Y391: 1 | Z391: 0 | AA391: 1226 | AB391: 889 | AC391: =(AA391*100)/AB391 -> 137.90776152980877 | AD391: =(X391*4)+(Z391*2) -> 32
A392: WERRIBEE | W392: YARRAVILLE | X392: 6 | Y392: 3 | Z392: 0 | AA392: 1202 | AB392: 936 | AC392: =(AA392*100)/AB392 -> 128.41880341880341 | AD392: =(X392*4)+(Z392*2) -> 24
A393: WAVERLEY | W393: FRANKSTON | X393: 5 | Y393: 4 | Z393: 0 | AA393: 1185 | AB393: 1001 | AC393: =(AA393*100)/AB393 -> 118.38161838161838 | AD393: =(X393*4)+(Z393*2) -> 20
A395: YARRAVILLE | C395: 0 | D395: 0 | E395: =C395*6+D395 -> 0 | G395: 0 | H395: 0 | I395: =G395*6+H395 -> 0 | K395: 0 | L395: 0 | M395: =K395*6+L395 -> 0 | O395: 33 | P395: 20 | Q395: =O395*6+P395 -> 218 | S395: BOX HILL | W395: OAKLEIGH | X395: 5 | Y395: 4 | Z395: 0 | AA395: 1150 | AB395: 1067 | AC395: =(AA395*100)/AB395 -> 107.7788191190253 | AD395: =(X395*4)+(Z395*2) -> 20
A396: BOX HILL | C396: 0 | D396: 0 | E396: =C396*6+D396 -> 0 | G396: 0 | H396: 0 | I396: =G396*6+H396 -> 0 | K396: 0 | L396: 0 | M396: =K396*6+L396 -> 0 | O396: 10 | P396: 9 | Q396: =O396*6+P396 -> 69 | W396: NORTHCOTE | X396: 4 | Y396: 5 | Z396: 0 | AA396: 1192 | AB396: 1091 | AC396: =(AA396*100)/AB396 -> 109.25756186984418 | AD396: =(X396*4)+(Z396*2) -> 16
A397: BEST PLAYERS | W397: WERRIBEE | X397: 4 | Y397: 5 | Z397: 0 | AA397: 1067 | AB397: 1179 | AC397: =(AA397*100)/AB397 -> 90.500424088210352 | AD397: =(X397*4)+(Z397*2) -> 16
A398: YARRAVILLE | W398: SUNSHINE | X398: 3 | Y398: 6 | Z398: 0 | AA398: 1029 | AB398: 1120 | AC398: =(AA398*100)/AB398 -> 91.875 | AD398: =(X398*4)+(Z398*2) -> 12
A399: BOX HILL | W399: WAVERLEY | X399: 2 | Y399: 7 | Z399: 0 | AA399: 898 | AB399: 1190 | AC399: =(AA399*100)/AB399 -> 75.462184873949582 | AD399: =(X399*4)+(Z399*2) -> 8
A400: GOALKICKERS | W400: BOX HILL | X400: 0 | Y400: 9 | Z400: 0 | AA400: 751 | AB400: 1609 | AC400: =(AA400*100)/AB400 -> 46.674953387197014 | AD400: =(X400*4)+(Z400*2) -> 0
A401: YARRAVILLE
A402: BOX HILL
A404: NORTHCOTE | C404: 0 | D404: 0 | E404: =C404*6+D404 -> 0 | G404: 0 | H404: 0 | I404: =G404*6+H404 -> 0 | K404: 0 | L404: 0 | M404: =K404*6+L404 -> 0 | O404: 14 | P404: 20 | Q404: =O404*6+P404 -> 104 | S404: SUNSHINE
A405: SUNSHINE | C405: 0 | D405: 0 | E405: =C405*6+D405 -> 0 | G405: 0 | H405: 0 | I405: =G405*6+H405 -> 0 | K405: 0 | L405: 0 | M405: =K405*6+L405 -> 0 | O405: 14 | P405: 10 | Q405: =O405*6+P405 -> 94
A406: BEST PLAYERS
A407: NORTHCOTE
A408: SUNSHINE
A409: GOALKICKERS
A410: NORTHCOTE
A411: SUNSHINE
A413: MORDIALLOC | C413: 0 | D413: 0 | E413: =C413*6+D413 -> 0 | G413: 0 | H413: 0 | I413: =G413*6+H413 -> 0 | K413: 0 | L413: 0 | M413: =K413*6+L413 -> 0 | O413: 12 | P413: 11 | Q413: =O413*6+P413 -> 83 | S413: MORDIALLOC
A414: CAMBERWELL | C414: 0 | D414: 0 | E414: =C414*6+D414 -> 0 | G414: 0 | H414: 0 | I414: =G414*6+H414 -> 0 | K414: 0 | L414: 0 | M414: =K414*6+L414 -> 0 | O414: 8 | P414: 11 | Q414: =O414*6+P414 -> 59
A415: BEST PLAYERS
A416: MORDIALLOC
A417: CAMBERWELL
A418: GOALKICKERS
A419: MORDIALLOC
A420: CAMBERWELL
A422: OAKLEIGH | C422: 0 | D422: 0 | E422: =C422*6+D422 -> 0 | G422: 0 | H422: 0 | I422: =G422*6+H422 -> 0 | K422: 0 | L422: 0 | M422: =K422*6+L422 -> 0 | O422: 17 | P422: 11 | Q422: =O422*6+P422 -> 113 | S422: OAKLEIGH
A423: FRANKSTON | C423: 0 | D423: 0 | E423: =C423*6+D423 -> 0 | G423: 0 | H423: 0 | I423: =G423*6+H423 -> 0 | K423: 0 | L423: 0 | M423: =K423*6+L423 -> 0 | O423: 10 | P423: 17 | Q423: =O423*6+P423 -> 77 | S423: McGIBBON
A424: BEST PLAYERS
A425: OAKLEIGH
A426: FRANKSTON
A427: GOALKICKERS
A428: OAKLEIGH
A429: FRANKSTON
A431: ROUND 10 | E431: 12TH JUNE | J431: WEATHER | S431: PLAYED AT
D432: 1ST QTR | H432: 2ND QTR | L432: 3RD QTR | P432: FINAL | S432: OAKLEIGH
A433: OAKLEIGH | C433: 1 | D433: 7 | E433: =C433*6+D433 -> 13 | G433: 4 | H433: 14 | I433: =G433*6+H433 -> 38 | K433: 10 | L433: 17 | M433: =K433*6+L433 -> 77 | O433: 14 | P433: 22 | Q433: =O433*6+P433 -> 106 | S433: UMPIRE | X433: LADDER | AB433: ROUND | AD433: 10
A434: WERRIBEE | C434: 3 | D434: 2 | E434: =C434*6+D434 -> 20 | G434: 6 | H434: 3 | I434: =G434*6+H434 -> 39 | K434: 7 | L434: 6 | M434: =K434*6+L434 -> 48 | O434: 9 | P434: 8 | Q434: =O434*6+P434 -> 62 | S434: MATHEWS
A435: BEST PLAYERS | W435: TEAM | X435: W | Y435: L | Z435: D | AA435: FOR | AB435: AGST | AC435: % | AD435: PTS
A436: OAKLEIGH | C436: KING | F436: FRYER | I436: WES BARROTT | L436: SPLATT | O436: BURKE | R436: COLCOTT
A437: WERRIBEE | C437: KNIGHT | F437: LYONS | I437: MARTIN | L437: OUGH | O437: LEECE | W437: MORDIALLOC | X437: 9 | Y437: 1 | Z437: 0 | AA437: 1394 | AB437: 951 | AC437: =(AA437*100)/AB437 -> 146.58254468980022 | AD437: =(X437*4)+(Z437*2) -> 36
A438: GOALKICKERS | W438: CAMBERWELL | X438: 8 | Y438: 2 | Z438: 0 | AA438: 1328 | AB438: 1024 | AC438: =(AA438*100)/AB438 -> 129.6875 | AD438: =(X438*4)+(Z438*2) -> 32
A439: OAKLEIGH | C439: COLCOTT 6 | F439: McDONALD 4 | I439: BURKE 2 | K439: EDWARDS | N439: FRYER | W439: YARRAVILLE | X439: 7 | Y439: 3 | Z439: 0 | AA439: 1291 | AB439: 1004 | AC439: =(AA439*100)/AB439 -> 128.58565737051794 | AD439: =(X439*4)+(Z439*2) -> 28
A440: WERRIBEE | C440: LEECE 4 | F440: LYONS 2 | I440: MITCHELL | L440: J BOURKE | O440: DOUGLAS | W440: FRANKSTON | X440: 6 | Y440: 4 | Z440: 0 | AA440: 1320 | AB440: 1103 | AC440: =(AA440*100)/AB440 -> 119.67361740707162 | AD440: =(X440*4)+(Z440*2) -> 24
A442: WAVERLEY | C442: 3 | D442: 6 | E442: =C442*6+D442 -> 24 | G442: 4 | H442: 7 | I442: =G442*6+H442 -> 31 | K442: 9 | L442: 12 | M442: =K442*6+L442 -> 66 | O442: 14 | P442: 16 | Q442: =O442*6+P442 -> 100 | S442: BOX HILL | W442: OAKLEIGH | X442: 6 | Y442: 4 | Z442: 0 | AA442: 1256 | AB442: 1129 | AC442: =(AA442*100)/AB442 -> 111.2488928255093 | AD442: =(X442*4)+(Z442*2) -> 24
A443: BOX HILL | C443: 3 | D443: 5 | E443: =C443*6+D443 -> 23 | G443: 9 | H443: 7 | I443: =G443*6+H443 -> 61 | K443: 10 | L443: 7 | M443: =K443*6+L443 -> 67 | O443: 10 | P443: 9 | Q443: =O443*6+P443 -> 69 | S443: CASEY | W443: NORTHCOTE | X443: 4 | Y443: 6 | Z443: 0 | AA443: 1276 | AB443: 1226 | AC443: =(AA443*100)/AB443 -> 104.07830342577488 | AD443: =(X443*4)+(Z443*2) -> 16
A444: BEST PLAYERS | W444: WERRIBEE | X444: 4 | Y444: 6 | Z444: 0 | AA444: 1129 | AB444: 1285 | AC444: =(AA444*100)/AB444 -> 87.859922178988327 | AD444: =(X444*4)+(Z444*2) -> 16
A445: WAVERLEY | C445: STYLES | F445: K McDONALD | I445: KELAART | L445: CRAWFORD | O445: ATKINSON | R445: HASAN | W445: SUNSHINE | X445: 3 | Y445: 7 | Z445: 0 | AA445: 1097 | AB445: 1209 | AC445: =(AA445*100)/AB445 -> 90.736145574855257 | AD445: =(X445*4)+(Z445*2) -> 12
A446: BOX HILL | C446: GORDON | F446: McMAHON | I446: WELLINGS | L446: McGUINNESS | O446: BATES | R446: PATTISON | W446: WAVERLEY | X446: 3 | Y446: 7 | Z446: 0 | AA446: 998 | AB446: 1259 | AC446: =(AA446*100)/AB446 -> 79.26926131850675 | AD446: =(X446*4)+(Z446*2) -> 12
A447: GOALKICKERS | P447: HOLDSWORTH | W447: BOX HILL | X447: 0 | Y447: 10 | Z447: 0 | AA447: 820 | AB447: 1709 | AC447: =(AA447*100)/AB447 -> 47.981275599765944 | AD447: =(X447*4)+(Z447*2) -> 0
A448: WAVERLEY | C448: COSTELLO 4 | F448: G McLURE 2 | I448: A McLURE 2 | K448: STYLES 2 | M448: KELAART | O448: KINNABURGH | R448: R CRAWFORD
A449: BOX HILL | C449: McGUINNESS 3 | F449: BATES 3 | I449: PICKETT 2 | L449: LAWTHER | N449: McMAHON
A451: YARRAVILLE | C451: 1 | D451: 3 | E451: =C451*6+D451 -> 9 | G451: 7 | H451: 5 | I451: =G451*6+H451 -> 47 | K451: 11 | L451: 11 | M451: =K451*6+L451 -> 77 | O451: 12 | P451: 17 | Q451: =O451*6+P451 -> 89 | S451: SUNSHINE
A452: SUNSHINE | C452: 2 | D452: 1 | E452: =C452*6+D452 -> 13 | G452: 6 | H452: 3 | I452: =G452*6+H452 -> 39 | K452: 8 | L452: 6 | M452: =K452*6+L452 -> 54 | O452: 10 | P452: 8 | Q452: =O452*6+P452 -> 68 | S452: HEDGER
A453: BEST PLAYERS
A454: YARRAVILLE | C454: SIMMONS | F454: BISSET | I454: BROWN | L454: WELLINGTON | O454: KEOGH | R454: LOWE
A455: SUNSHINE | C455: CLARKE | F455: SIMPSON | I455: MARTIN | L455: JONES | O455: BUGDEN
A456: GOALKICKERS
A457: YARRAVILLE | C457: BISSET 4 | F457: GRANDIN 4 | I457: GIBSON 2 | K457: SAIT | M457: WELLINGTON
A458: SUNSHINE | C458: RADZIMINSKI 2 | F458: JONES 2 | H458: MCDONALD 2 | K458: BRETT | M458: SIMPSON
A460: MORDIALLOC | C460: 4 | D460: 4 | E460: =C460*6+D460 -> 28 | G460: 12 | H460: 6 | I460: =G460*6+H460 -> 78 | K460: 14 | L460: 9 | M460: =K460*6+L460 -> 93 | O460: 20 | P460: 15 | Q460: =O460*6+P460 -> 135 | S460: MORDIALLOC
A461: NORTHCOTE | C461: 5 | D461: 6 | E461: =C461*6+D461 -> 36 | G461: 7 | H461: 7 | I461: =G461*6+H461 -> 49 | K461: 12 | L461: 12 | M461: =K461*6+L461 -> 84 | O461: 12 | P461: 12 | Q461: =O461*6+P461 -> 84 | S461: HUGGINS
A462: BEST PLAYERS
A463: MORDIALLOC | C463: MOORE | F463: GUY | I463: DINGLE | L463: DEATON | O463: NORRIS | R463: WILLIAMSON
A464: NORTHCOTE | C464: McARDLE | F464: M RYAN | I464: HOWELL | L464: DOBSON | O464: HOBBS | R464: G RYAN
A465: GOALKICKERS
A466: MORDIALLOC | C466: DEATON 5 | F466: WILLIAMSON 3 | I466: MILDENHALL 3 | L466: NORRIS 2 | N466: GUY 2 | O466: DINGLE | Q466: JOHNSTONE | S466: MOORE | U466: WALSH | W466: ROGERSON
A467: NORTHCOTE | C467: MORTON 4 | F467: M RYAN 4 | I467: R JOHNSTON 2 | L467: DEMIR | N467: G RYAN
A469: FRANKSTON | C469: 3 | D469: 4 | E469: =C469*6+D469 -> 22 | G469: 9 | H469: 7 | I469: =G469*6+H469 -> 61 | K469: 13 | L469: 11 | M469: =K469*6+L469 -> 89 | O469: 20 | P469: 15 | Q469: =O469*6+P469 -> 135 | S469: FRANKSTON
A470: CAMBERWELL | C470: 8 | D470: 2 | E470: =C470*6+D470 -> 50 | G470: 11 | H470: 3 | I470: =G470*6+H470 -> 69 | K470: 13 | L470: 6 | M470: =K470*6+L470 -> 84 | O470: 16 | P470: 6 | Q470: =O470*6+P470 -> 102 | S470: FITZPATRICK
A471: BEST PLAYERS
A472: FRANKSTON | C472: GUY | F472: GEDDES | I472: BOND | L472: JONES | O472: LOCCO | Q472: HUNTER
A473: CAMBERWELL | C473: WALLACE | F473: HOOK | I473: ATKINSON | L473: HAMMOND
A474: GOALKICKERS
A475: FRANKSTON | C475: GUY 5 | E475: GEDDES 5 | G475: JONES 3 | I475: STAPLETON 2 | L475: BOYD 2 | N475: ESLER | P475: KENNEDY | R475: DAVIES
A476: CAMBERWELL | C476: HAMMOND 5 | F476: ALEXEEF 3 | I476: B SMITH 3 | L476: FITZGERALD 3 | O476: HOOK | Q476: JONES
A478: ROUND 11 | E478: 19TH JUNE | J478: WEATHER | S478: PLAYED AT
D479: 1ST QTR | H479: 2ND QTR | L479: 3RD QTR | P479: FINAL | S479: WERRIBEE
A480: WERRIBEE | C480: 0 | D480: 0 | E480: =C480*6+D480 -> 0 | G480: 0 | H480: 0 | I480: =G480*6+H480 -> 0 | K480: 0 | L480: 0 | M480: =K480*6+L480 -> 0 | O480: 19 | P480: 14 | Q480: =O480*6+P480 -> 128 | S480: UMPIRE | X480: LADDER | AB480: ROUND | AD480: 11
A481: BOX HILL | C481: 0 | D481: 0 | E481: =C481*6+D481 -> 0 | G481: 0 | H481: 0 | I481: =G481*6+H481 -> 0 | K481: 0 | L481: 0 | M481: =K481*6+L481 -> 0 | O481: 13 | P481: 9 | Q481: =O481*6+P481 -> 87
A482: BEST PLAYERS | W482: TEAM | X482: W | Y482: L | Z482: D | AA482: FOR | AB482: AGST | AC482: % | AD482: PTS
A483: WERRIBEE
A484: BOX HILL | W484: MORDIALLOC | X484: 9 | Y484: 2 | Z484: 0 | AA484: 1449 | AB484: 1069 | AC484: =(AA484*100)/AB484 -> 135.54724041159963 | AD484: =(X484*4)+(Z484*2) -> 36
A485: GOALKICKERS | W485: YARRAVILLE | X485: 8 | Y485: 3 | Z485: 0 | AA485: 1409 | AB485: 1059 | AC485: =(AA485*100)/AB485 -> 133.05004721435316 | AD485: =(X485*4)+(Z485*2) -> 32
A486: WERRIBEE | W486: CAMBERWELL | X486: 8 | Y486: 3 | Z486: 0 | AA486: 1406 | AB486: 1145 | AC486: =(AA486*100)/AB486 -> 122.79475982532752 | AD486: =(X486*4)+(Z486*2) -> 32
A487: BOX HILL | W487: OAKLEIGH | X487: 7 | Y487: 4 | Z487: 0 | AA487: 1377 | AB487: 1207 | AC487: =(AA487*100)/AB487 -> 114.08450704225352 | AD487: =(X487*4)+(Z487*2) -> 28
A489: WAVERLEY | C489: 0 | D489: 0 | E489: =C489*6+D489 -> 0 | G489: 0 | H489: 0 | I489: =G489*6+H489 -> 0 | K489: 0 | L489: 0 | M489: =K489*6+L489 -> 0 | O489: 16 | P489: 18 | Q489: =O489*6+P489 -> 114 | S489: WAVERLEY | W489: FRANKSTON | X489: 6 | Y489: 5 | Z489: 0 | AA489: 1373 | AB489: 1190 | AC489: =(AA489*100)/AB489 -> 115.3781512605042 | AD489: =(X489*4)+(Z489*2) -> 24
A490: SUNSHINE | C490: 0 | D490: 0 | E490: =C490*6+D490 -> 0 | G490: 0 | H490: 0 | I490: =G490*6+H490 -> 0 | K490: 0 | L490: 0 | M490: =K490*6+L490 -> 0 | O490: 6 | P490: 7 | Q490: =O490*6+P490 -> 43 | W490: NORTHCOTE | X490: 5 | Y490: 6 | Z490: 0 | AA490: 1363 | AB490: 1279 | AC490: =(AA490*100)/AB490 -> 106.56763096168882 | AD490: =(X490*4)+(Z490*2) -> 20
A491: BEST PLAYERS | W491: WERRIBEE | X491: 5 | Y491: 6 | Z491: 0 | AA491: 1257 | AB491: 1372 | AC491: =(AA491*100)/AB491 -> 91.618075801749271 | AD491: =(X491*4)+(Z491*2) -> 20
A492: WAVERLEY | W492: WAVERLEY | X492: 4 | Y492: 7 | Z492: 0 | AA492: 1112 | AB492: 1302 | AC492: =(AA492*100)/AB492 -> 85.407066052227336 | AD492: =(X492*4)+(Z492*2) -> 16
A493: SUNSHINE | W493: SUNSHINE | X493: 3 | Y493: 8 | Z493: 0 | AA493: 1140 | AB493: 1323 | AC493: =(AA493*100)/AB493 -> 86.167800453514744 | AD493: =(X493*4)+(Z493*2) -> 12
A494: GOALKICKERS | W494: BOX HILL | X494: 0 | Y494: 11 | Z494: 0 | AA494: 907 | AB494: 1837 | AC494: =(AA494*100)/AB494 -> 49.373979314099074 | AD494: =(X494*4)+(Z494*2) -> 0
A495: WAVERLEY
A496: SUNSHINE
A498: YARRAVILLE | C498: 0 | D498: 0 | E498: =C498*6+D498 -> 0 | G498: 0 | H498: 0 | I498: =G498*6+H498 -> 0 | K498: 0 | L498: 0 | M498: =K498*6+L498 -> 0 | O498: 18 | P498: 10 | Q498: =O498*6+P498 -> 118 | S498: YARRAVILLE
A499: MORDIALLOC | C499: 0 | D499: 0 | E499: =C499*6+D499 -> 0 | G499: 0 | H499: 0 | I499: =G499*6+H499 -> 0 | K499: 0 | L499: 0 | M499: =K499*6+L499 -> 0 | O499: 8 | P499: 7 | Q499: =O499*6+P499 -> 55
A500: BEST PLAYERS
A501: YARRAVILLE
A502: MORDIALLOC
A503: GOALKICKERS
A504: YARRAVILLE
A505: MORDIALLOC
A507: NORTHCOTE | C507: 0 | D507: 0 | E507: =C507*6+D507 -> 0 | G507: 0 | H507: 0 | I507: =G507*6+H507 -> 0 | K507: 0 | L507: 0 | M507: =K507*6+L507 -> 0 | O507: 13 | P507: 9 | Q507: =O507*6+P507 -> 87 | S507: FRANKSTON
A508: FRANKSTON | C508: 0 | D508: 0 | E508: =C508*6+D508 -> 0 | G508: 0 | H508: 0 | I508: =G508*6+H508 -> 0 | K508: 0 | L508: 0 | M508: =K508*6+L508 -> 0 | O508: 7 | P508: 11 | Q508: =O508*6+P508 -> 53
A509: BEST PLAYERS
A510: NORTHCOTE
A511: FRANKSTON
A512: GOALKICKERS
A513: NORTHCOTE
A514: FRANKSTON
A516: OAKLEIGH | C516: 0 | D516: 0 | E516: =C516*6+D516 -> 0 | G516: 0 | H516: 0 | I516: =G516*6+H516 -> 0 | K516: 0 | L516: 0 | M516: =K516*6+L516 -> 0 | O516: 17 | P516: 19 | Q516: =O516*6+P516 -> 121 | S516: CAMBERWELL
A517: CAMBERWELL | C517: 0 | D517: 0 | E517: =C517*6+D517 -> 0 | G517: 0 | H517: 0 | I517: =G517*6+H517 -> 0 | K517: 0 | L517: 0 | M517: =K517*6+L517 -> 0 | O517: 12 | P517: 6 | Q517: =O517*6+P517 -> 78
A518: BEST PLAYERS
A519: OAKLEIGH
A520: CAMBERWELL
A521: GOALKICKERS
A522: OAKLEIGH
A523: CAMBERWELL
A525: ROUND 12 | E525: 26TH JUNE | J525: WEATHER | S525: PLAYED AT
D526: 1ST QTR | H526: 2ND QTR | L526: 3RD QTR | P526: FINAL | S526: SUNSHINE
A527: WERRIBEE | C527: 3 | D527: 2 | E527: =C527*6+D527 -> 20 | G527: 4 | H527: 7 | I527: =G527*6+H527 -> 31 | K527: 8 | L527: 10 | M527: =K527*6+L527 -> 58 | O527: 11 | P527: 15 | Q527: =O527*6+P527 -> 81 | S527: UMPIRE | X527: LADDER | AB527: ROUND | AD527: 12
A528: SUNSHINE | C528: 2 | D528: 4 | E528: =C528*6+D528 -> 16 | G528: 4 | H528: 4 | I528: =G528*6+H528 -> 28 | K528: 7 | L528: 9 | M528: =K528*6+L528 -> 51 | O528: 7 | P528: 11 | Q528: =O528*6+P528 -> 53 | S528: MARCY
A529: BEST PLAYERS | W529: TEAM | X529: W | Y529: L | Z529: D | AA529: FOR | AB529: AGST | AC529: % | AD529: PTS
A530: WERRIBEE | C530: MARTIN | F530: J BELLIN | I530: KNIGHT | L530: LYNCH | N530: G BELLIN | Q530: HUDSON
A531: SUNSHINE | C531: MARTIN | F531: JONES | I531: BAIRD | L531: BLAKE | N531: SCHROEDER | Q531: PIERCZAK | W531: MORDIALLOC | X531: 10 | Y531: 2 | Z531: 0 | AA531: 1575 | AB531: 1137 | AC531: =(AA531*100)/AB531 -> 138.52242744063324 | AD531: =(X531*4)+(Z531*2) -> 40
A532: GOALKICKERS | W532: CAMBERWELL | X532: 9 | Y532: 3 | Z532: 0 | AA532: 1503 | AB532: 1232 | AC532: =(AA532*100)/AB532 -> 121.99675324675324 | AD532: =(X532*4)+(Z532*2) -> 36
A533: WERRIBEE | C533: OUGH 4 | F533: HUDSON 3 | I533: MARTIN | L533: J BELLIN | N533: LYNCH | P533: SQUIRE | W533: YARRAVILLE | X533: 9 | Y533: 3 | Z533: 0 | AA533: 1531 | AB533: 1263 | AC533: =(AA533*100)/AB533 -> 121.21931908155186 | AD533: =(X533*4)+(Z533*2) -> 36
A534: SUNSHINE | C534: VELLA 2 | F534: MANDICS 2 | I534: JONES | K534: J SIMPSON | N534: PAUL SIMPSON | W534: OAKLEIGH | X534: 8 | Y534: 4 | Z534: 0 | AA534: 1534 | AB534: 1252 | AC534: =(AA534*100)/AB534 -> 122.52396166134186 | AD534: =(X534*4)+(Z534*2) -> 32
A536: MORDIALLOC | C536: 8 | D536: 3 | E536: =C536*6+D536 -> 51 | G536: 9 | H536: 6 | I536: =G536*6+H536 -> 60 | K536: 16 | L536: 13 | M536: =K536*6+L536 -> 109 | O536: 18 | P536: 18 | Q536: =O536*6+P536 -> 126 | S536: MORDIALLOC | W536: FRANKSTON | X536: 6 | Y536: 6 | Z536: 0 | AA536: 1477 | AB536: 1312 | AC536: =(AA536*100)/AB536 -> 112.57621951219512 | AD536: =(X536*4)+(Z536*2) -> 24
A537: WAVERLEY | C537: 0 | D537: 0 | E537: =C537*6+D537 -> 0 | G537: 3 | H537: 2 | I537: =G537*6+H537 -> 20 | K537: 3 | L537: 2 | M537: =K537*6+L537 -> 20 | O537: 10 | P537: 8 | Q537: =O537*6+P537 -> 68 | S537: WENN | W537: WERRIBEE | X537: 6 | Y537: 6 | Z537: 0 | AA537: 1338 | AB537: 1425 | AC537: =(AA537*100)/AB537 -> 93.89473684210526 | AD537: =(X537*4)+(Z537*2) -> 24
A538: BEST PLAYERS | W538: NORTHCOTE | X538: 5 | Y538: 7 | Z538: 0 | AA538: 1450 | AB538: 1376 | AC538: =(AA538*100)/AB538 -> 105.37790697674419 | AD538: =(X538*4)+(Z538*2) -> 20
A539: MORDIALLOC | C539: NORRIS | F539: ROGERSON | I539: MOORE | L539: MILDENHALL | O539: GUY | Q539: WILLIAMSON | W539: WAVERLEY | X539: 4 | Y539: 8 | Z539: 0 | AA539: 1180 | AB539: 1428 | AC539: =(AA539*100)/AB539 -> 82.63305322128852 | AD539: =(X539*4)+(Z539*2) -> 16
A540: WAVERLEY | C540: W McDONALD | F540: K McDONALD | I540: STYLES | L540: HOLDSWORTH | O540: COSTELLO | W540: SUNSHINE | X540: 3 | Y540: 9 | Z540: 0 | AA540: 1193 | AB540: 1404 | AC540: =(AA540*100)/AB540 -> 84.971509971509974 | AD540: =(X540*4)+(Z540*2) -> 12
A541: GOALKICKERS | R541: BLOOMFIELD | W541: BOX HILL | X541: 0 | Y541: 12 | Z541: 0 | AA541: 952 | AB541: 1994 | AC541: =(AA541*100)/AB541 -> 47.743229689067199 | AD541: =(X541*4)+(Z541*2) -> 0
A542: MORDIALLOC | C542: NORRIS 4 | F542: ROGERSON 4 | I542: WALSH 2 | K542: MILDENHALL 2 | N542: DEATON 2 | P542: GUY | Q542: DINGLE | S542: SLADE
A543: WAVERLEY | C543: COSTELLO 6 | F543: G McLURE 2 | I543: A McLURE | L543: K McDONALD
A545: YARRAVILLE | C545: 5 | D545: 3 | E545: =C545*6+D545 -> 33 | G545: 8 | H545: 6 | I545: =G545*6+H545 -> 54 | K545: 13 | L545: 8 | M545: =K545*6+L545 -> 86 | O545: 18 | P545: 14 | Q545: =O545*6+P545 -> 122 | S545: FRANKSTON
A546: FRANKSTON | C546: 7 | D546: 1 | E546: =C546*6+D546 -> 43 | G546: 9 | H546: 3 | I546: =G546*6+H546 -> 57 | K546: 13 | L546: 9 | M546: =K546*6+L546 -> 87 | O546: 15 | P546: 14 | Q546: =O546*6+P546 -> 104 | S546: OGSTON
A547: BEST PLAYERS
A548: YARRAVILLE | C548: RICHES | F548: SAIT | I548: SIMMONS | L548: JONES | O548: GIBSON | R548: KEOGH
A549: FRANKSTON | C549: McILWRAITH | F549: GUY | I549: MACE | L549: HARRISON | O549: LEWIS | R549: HUNTER
A550: GOALKICKERS
A551: YARRAVILLE | C551: GRANDIN 4 | F551: GIBSON 4 | I551: SAIT 3 | K551: SIMMONS 2 | N551: HAYES 2 | P551: BISSET | R551: BROWN | T551: RICHES
A552: FRANKSTON | C552: DAVIES 5 | F552: HARRISON 4 | I552: GUY 2 | K552: CLARKE | M552: JONES | O552: BOYD | Q552: GEDDES
A554: CAMBERWELL | C554: 3 | D554: 2 | E554: =C554*6+D554 -> 20 | G554: 12 | H554: 3 | I554: =G554*6+H554 -> 75 | K554: 13 | L554: 5 | M554: =K554*6+L554 -> 83 | O554: 15 | P554: 7 | Q554: =O554*6+P554 -> 97 | S554: CAMBERWELL
A555: NORTHCOTE | C555: 6 | D555: 2 | E555: =C555*6+D555 -> 38 | G555: 8 | H555: 4 | I555: =G555*6+H555 -> 52 | K555: 10 | L555: 7 | M555: =K555*6+L555 -> 67 | O555: 13 | P555: 9 | Q555: =O555*6+P555 -> 87 | S555: MATHEWS
A556: BEST PLAYERS
A557: CAMBERWELL | C557: HOWARD | F557: HOOK | I557: OLIVER | L557: CURRAN | O557: NEILSON | R557: ALEXEEF
A558: NORTHCOTE | C558: G RYAN | F558: McARDLE | I558: REDENBACH | L558: McGREGOR | O558: M RYAN | R558: DOBSON
A559: GOALKICKERS
A560: CAMBERWELL | C560: HAMMOND 5 | F560: B SMITH 4 | I560: HOWARD 2 | L560: WALLACE 2 | O560: ALEXEEF | Q560: OLIVER
A561: NORTHCOTE | C561: G RYAN 6 | F561: BENNETT 3 | I561: BREWER | K561: HOBBS | M561: M RYAN | O561: R JOHNSTON
A563: OAKLEIGH | C563: 5 | D563: 10 | E563: =C563*6+D563 -> 40 | G563: 5 | H563: 15 | I563: =G563*6+H563 -> 45 | K563: 17 | L563: 17 | M563: =K563*6+L563 -> 119 | O563: 22 | P563: 25 | Q563: =O563*6+P563 -> 157 | S563: OAKLEIGH
A564: BOX HILL | C564: 0 | D564: 2 | E564: =C564*6+D564 -> 2 | G564: 3 | H564: 5 | I564: =G564*6+H564 -> 23 | K564: 5 | L564: 7 | M564: =K564*6+L564 -> 37 | O564: 6 | P564: 9 | Q564: =O564*6+P564 -> 45 | S564: TORNEY
A565: BEST PLAYERS
A566: OAKLEIGH | C566: McDONALD | F566: BRUERTON | I566: KING | L566: GOODMAN | O566: WES BARROTT | R566: BURKE
A567: BOX HILL | C567: WILLIAMS | F567: JONES | I567: GORDON | L567: COOK | O567: LUCAS | R567: CRUSE
A568: GOALKICKERS
A569: OAKLEIGH | C569: McDONALD 8 | F569: COLCOTT 5 | H569: EDWARDS 3 | K569: BRUERTON | N569: COCCIARDI | P569: WATTS | R569: McMAHON | U569: 2 SHORT
A570: BOX HILL | C570: PATTISON 2 | F570: CRUSE | I570: LUCAS | L570: LASKIE | N570: GARRY PICKETT
A572: ROUND 13 | E572: 10TH JULY | J572: WEATHER | S572: PLAYED AT
D573: 1ST QTR | H573: 2ND QTR | L573: 3RD QTR | P573: FINAL | S573: YARRAVILLE
A574: YARRAVILLE | C574: 7 | D574: 5 | E574: =C574*6+D574 -> 47 | G574: 9 | H574: 5 | I574: =G574*6+H574 -> 59 | K574: 15 | L574: 14 | M574: =K574*6+L574 -> 104 | O574: 19 | P574: 16 | Q574: =O574*6+P574 -> 130 | S574: UMPIRE | X574: LADDER | AB574: ROUND | AD574: 13
A575: CAMBERWELL | C575: 1 | D575: 4 | E575: =C575*6+D575 -> 10 | G575: 5 | H575: 16 | I575: =G575*6+H575 -> 46 | K575: 5 | L575: 19 | M575: =K575*6+L575 -> 49 | O575: 7 | P575: 24 | Q575: =O575*6+P575 -> 66 | S575: TORNEY
A576: BEST PLAYERS | W576: TEAM | X576: W | Y576: L | Z576: D | AA576: FOR | AB576: AGST | AC576: % | AD576: PTS
A577: YARRAVILLE | C577: SAIT | F577: PRIEST | I577: THORPE | L577: BROWN | O577: RICHES | R577: HENRY
A578: CAMBERWELL | C578: OLIVER | F578: HOOK | I578: WALLACE | L578: R SMITH | O578: JUDD | R578: HOWARD | W578: MORDIALLOC | X578: 11 | Y578: 2 | Z578: 0 | AA578: 1709 | AB578: 1220 | AC578: =(AA578*100)/AB578 -> 140.08196721311475 | AD578: =(X578*4)+(Z578*2) -> 44
A579: GOALKICKERS | W579: YARRAVILLE | X579: 10 | Y579: 3 | Z579: 0 | AA579: 1661 | AB579: 1329 | AC579: =(AA579*100)/AB579 -> 124.98118886380738 | AD579: =(X579*4)+(Z579*2) -> 40
A580: YARRAVILLE | C580: GRANDIN 6 | F580: THORPE 2 | H580: SAIT 2 | J580: PLUMMER 2 | M580: GIBSON 2 | O580: SIMMONS | Q580: BROWN | S580: WELLINGTON | W580: OAKLEIGH | X580: 9 | Y580: 4 | Z580: 0 | AA580: 1653 | AB580: 1363 | AC580: =(AA580*100)/AB580 -> 121.27659574468085 | AD580: =(X580*4)+(Z580*2) -> 36
A581: CAMBERWELL | C581: HAMMOND 2 | F581: OLIVER | I581: WALLACE | K581: FITZGERALD | N581: R SMITH | Q581: NEILSON | W581: CAMBERWELL | X581: 9 | Y581: 4 | Z581: 0 | AA581: 1569 | AB581: 1362 | AC581: =(AA581*100)/AB581 -> 115.19823788546256 | AD581: =(X581*4)+(Z581*2) -> 36
A583: OAKLEIGH | C583: 5 | D583: 4 | E583: =C583*6+D583 -> 34 | G583: 13 | H583: 7 | I583: =G583*6+H583 -> 85 | K583: 0 | L583: 0 | M583: =K583*6+L583 -> 0 | O583: 17 | P583: 17 | Q583: =O583*6+P583 -> 119 | S583: NORTHCOTE | W583: FRANKSTON | X583: 7 | Y583: 6 | Z583: 0 | AA583: 1623 | AB583: 1457 | AC583: =(AA583*100)/AB583 -> 111.39327385037748 | AD583: =(X583*4)+(Z583*2) -> 28
A584: NORTHCOTE | C584: 4 | D584: 4 | E584: =C584*6+D584 -> 28 | G584: 8 | H584: 4 | I584: =G584*6+H584 -> 52 | K584: 0 | L584: 0 | M584: =K584*6+L584 -> 0 | O584: 17 | P584: 9 | Q584: =O584*6+P584 -> 111 | S584: MARCY | W584: WERRIBEE | X584: 6 | Y584: 7 | Z584: 0 | AA584: 1421 | AB584: 1559 | AC584: =(AA584*100)/AB584 -> 91.148171905067358 | AD584: =(X584*4)+(Z584*2) -> 24
A585: BEST PLAYERS | W585: NORTHCOTE | X585: 5 | Y585: 8 | Z585: 0 | AA585: 1561 | AB585: 1495 | AC585: =(AA585*100)/AB585 -> 104.41471571906355 | AD585: =(X585*4)+(Z585*2) -> 20
A586: OAKLEIGH | C586: W ? | F586: BURKE | I586: BRUERTON | L586: GOODMAN | O586: KING | W586: SUNSHINE | X586: 4 | Y586: 9 | Z586: 0 | AA586: 1322 | AB586: 1489 | AC586: =(AA586*100)/AB586 -> 88.784419073203495 | AD586: =(X586*4)+(Z586*2) -> 16
A587: NORTHCOTE | C587: ? | F587: MCARDLE | I587: BENNETT | L587: Mc ? | O587: G EGO | Q587: M RYAN | W587: WAVERLEY | X587: 4 | Y587: 9 | Z587: 0 | AA587: 1326 | AB587: 1574 | AC587: =(AA587*100)/AB587 -> 84.243964421855139 | AD587: =(X587*4)+(Z587*2) -> 16
A588: GOALKICKERS | W588: BOX HILL | X588: 0 | Y588: 13 | Z588: 0 | AA588: 1037 | AB588: 2123 | AC588: =(AA588*100)/AB588 -> 48.845972680169574 | AD588: =(X588*4)+(Z588*2) -> 0
A589: OAKLEIGH | C589: ? | F589: WYATT 4 | I589: BURKE 3 | K589: M ? 1 | M589: EDWARDS | P589: WENN | R589: COLCOTT
A590: NORTHCOTE | C590: BENNETT 7 | F590: G RYAN ? | I590: ? 2 | L590: MORTON 2 | O590: M RYAN | Q590: McFARLANE
A592: FRANKSTON | C592: 6 | D592: 3 | E592: =C592*6+D592 -> 39 | G592: 13 | H592: 6 | I592: =G592*6+H592 -> 84 | K592: 17 | L592: 11 | M592: =K592*6+L592 -> 113 | O592: 21 | P592: 20 | Q592: =O592*6+P592 -> 146 | S592: WAVERLEY
A593: WAVERLEY | C593: 9 | D593: 3 | E593: =C593*6+D593 -> 57 | G593: 13 | H593: 4 | I593: =G593*6+H593 -> 82 | K593: 21 | L593: 4 | M593: =K593*6+L593 -> 130 | O593: 23 | P593: 7 | Q593: =O593*6+P593 -> 145 | S593: HEDGER
A594: BEST PLAYERS
A595: FRANKSTON | C595: GUY | F595: LEWIS | I595: DAVIES | L595: GEDDES | O595: McILWRAITH | R595: WORTHINGTON
A596: WAVERLEY | C596: HOLDSWORTH | F596: G McLURE | I596: B WILLIAMS | L596: HANKINSON | O596: MORRIS | R596: W McDONALD
A597: GOALKICKERS
A598: FRANKSTON | C598: DAVIES 7 | F598: GEDDES 4 | H598: HARRISON 3 | K598: WORTHINGTON 2 | O598: BOYD 2 | Q598: McILWRAITH | T598: NORRIS | V598: EDWARDS
A599: WAVERLEY | C599: G McLURE 8 | F599: COSTELLO 5 | I599: W McDONALD 2 | L599: HANKINSON 2 | O599: CRAWFORD 2 | R599: B WILLIAMS | U599: KINNABURGH | X599: P WILLIAMS | Z599: HOLDSWORTH
A601: SUNSHINE | C601: 5 | D601: 9 | E601: =C601*6+D601 -> 39 | G601: 8 | H601: 13 | I601: =G601*6+H601 -> 61 | K601: 10 | L601: 20 | M601: =K601*6+L601 -> 80 | O601: 18 | P601: 21 | Q601: =O601*6+P601 -> 129 | S601: BOX HILL
A602: BOX HILL | C602: 6 | D602: 2 | E602: =C602*6+D602 -> 38 | G602: 10 | H602: 7 | I602: =G602*6+H602 -> 67 | K602: 11 | L602: 11 | M602: =K602*6+L602 -> 77 | O602: 12 | P602: 13 | Q602: =O602*6+P602 -> 85 | S602: WENN
A603: BEST PLAYERS
A604: SUNSHINE | C604: MANDICS | F604: VELLA | I604: PETER SIMPSON | L604: ?
A605: BOX HILL | C605: CON? | F605: ? | I605: COOK | L605: WELLINGS | O605: BATES
A606: GOALKICKERS
A607: SUNSHINE | C607: MANDICS 4 | F607: BUGDEN 4 | I607: SEARLE 4 | K607: VELLA 2 | M607: BAIRD | O607: PAUL SIMPSON | R607: MARTIN | T607: BENSON
A608: BOX HILL | C608: PATTISON 2 | F608: McGUINNESS 2 | I608: CO?BE 2 | K608: LASKIE | M608: COOK | O608: CROTHERS | R608: CRUSE | S608: BATES | U608: WRIGHT
A610: MORDIALLOC | C610: 3 | D610: 6 | E610: =C610*6+D610 -> 24 | G610: 7 | H610: 10 | I610: =G610*6+H610 -> 52 | K610: 16 | L610: 13 | M610: =K610*6+L610 -> 109 | O610: 20 | P610: 14 | Q610: =O610*6+P610 -> 134 | S610: WERRIBEE
A611: WERRIBEE | C611: 1 | D611: 4 | E611: =C611*6+D611 -> 10 | G611: 4 | H611: 7 | I611: =G611*6+H611 -> 31 | K611: 6 | L611: 8 | M611: =K611*6+L611 -> 44 | O611: 12 | P611: 11 | Q611: =O611*6+P611 -> 83 | S611: FITZPATRICK
A612: BEST PLAYERS
A613: MORDIALLOC | C613: NORRIS | F613: GUY | I613: JOHNSTONE | L613: ? | O613: ?
A614: WERRIBEE | C614: LYNCH | F614: MARTIN | I614: ? | L614: G BELLIN | O614: SQUIRE
A615: GOALKICKERS
A616: MORDIALLOC | C616: ? | F616: DEATON 3 | I616: MILDENHALL 3 | L616: ? | O616: ROGERSON 2 | R616: GUY ?
A617: WERRIBEE | C617: LEECE 6 | F617: ? | H617: ? | K617: LYONS
A619: ROUND 14 | E619: 17TH JULY | J619: WEATHER | S619: PLAYED AT
D620: 1ST QTR | H620: 2ND QTR | L620: 3RD QTR | P620: FINAL | S620: NORTHCOTE
A621: YARRAVILLE | C621: 1 | D621: 6 | E621: =C621*6+D621 -> 12 | G621: 3 | H621: 7 | I621: =G621*6+H621 -> 25 | K621: 7 | L621: 13 | M621: =K621*6+L621 -> 55 | O621: 10 | P621: 14 | Q621: =O621*6+P621 -> 74 | S621: UMPIRE | X621: LADDER | AB621: ROUND | AD621: 14
A622: NORTHCOTE | C622: 0 | D622: 6 | E622: =C622*6+D622 -> 6 | G622: 3 | H622: 8 | I622: =G622*6+H622 -> 26 | K622: 5 | L622: 12 | M622: =K622*6+L622 -> 42 | O622: 8 | P622: 17 | Q622: =O622*6+P622 -> 65 | S622: STABB
A623: BEST PLAYERS | W623: TEAM | X623: W | Y623: L | Z623: D | AA623: FOR | AB623: AGST | AC623: % | AD623: PTS
A624: YARRAVILLE | C624: KEOGH | F624: JONES | I624: HENRY | L624: SIMMONS | O624: THORPE | R624: LOWE
A625: NORTHCOTE | C625: McINTYRE | F625: BRAIN | I625: REDENBACH | L625: M RYAN | O625: McFARLANE | R625: AFFLECK | W625: MORDIALLOC | X625: 12 | Y625: 2 | Z625: 0 | AA625: 1911 | AB625: 1293 | AC625: =(AA625*100)/AB625 -> 147.79582366589327 | AD625: =(X625*4)+(Z625*2) -> 48
A626: GOALKICKERS | W626: YARRAVILLE | X626: 11 | Y626: 3 | Z626: 0 | AA626: 1735 | AB626: 1394 | AC626: =(AA626*100)/AB626 -> 124.46197991391679 | AD626: =(X626*4)+(Z626*2) -> 44
A627: YARRAVILLE | C627: BISSET 3 | F627: SAIT 3 | I627: WELLINGTON 2 | L627: GIBSON 2 | W627: OAKLEIGH | X627: 10 | Y627: 4 | Z627: 0 | AA627: 1828 | AB627: 1463 | AC627: =(AA627*100)/AB627 -> 124.94873547505127 | AD627: =(X627*4)+(Z627*2) -> 40
A628: NORTHCOTE | C628: ROBERTS 2 | F628: M RYAN | H628: MORTON | J628: DEMIR | L628: BURLEIGH | O628: BENNETT | Q628: HOWELL | W628: CAMBERWELL | X628: 10 | Y628: 4 | Z628: 0 | AA628: 1747 | AB628: 1422 | AC628: =(AA628*100)/AB628 -> 122.85513361462729 | AD628: =(X628*4)+(Z628*2) -> 40
A630: CAMBERWELL | C630: 8 | D630: 6 | E630: =C630*6+D630 -> 54 | G630: 15 | H630: 10 | I630: =G630*6+H630 -> 100 | K630: 20 | L630: 20 | M630: =K630*6+L630 -> 140 | O630: 26 | P630: 22 | Q630: =O630*6+P630 -> 178 | S630: CAMBERWELL | W630: FRANKSTON | X630: 8 | Y630: 6 | Z630: 0 | AA630: 1810 | AB630: 1578 | AC630: =(AA630*100)/AB630 -> 114.70215462610899 | AD630: =(X630*4)+(Z630*2) -> 32
A631: WAVERLEY | C631: 1 | D631: 1 | E631: =C631*6+D631 -> 7 | G631: 2 | H631: 4 | I631: =G631*6+H631 -> 16 | K631: 3 | L631: 4 | M631: =K631*6+L631 -> 22 | O631: 9 | P631: 6 | Q631: =O631*6+P631 -> 60 | S631: McBAIN | W631: WERRIBEE | X631: 6 | Y631: 8 | Z631: 0 | AA631: 1542 | AB631: 1746 | AC631: =(AA631*100)/AB631 -> 88.31615120274914 | AD631: =(X631*4)+(Z631*2) -> 24
A632: BEST PLAYERS | W632: NORTHCOTE | X632: 5 | Y632: 9 | Z632: 0 | AA632: 1626 | AB632: 1569 | AC632: =(AA632*100)/AB632 -> 103.63288718929255 | AD632: =(X632*4)+(Z632*2) -> 20
A633: CAMBERWELL | C633: HOWARD | F633: NEILSON | I633: HAMMOND | L633: PHILLIPS | O633: K CURRAN | R633: OLIVER | W633: SUNSHINE | X633: 4 | Y633: 10 | Z633: 0 | AA633: 1422 | AB633: 1664 | AC633: =(AA633*100)/AB633 -> 85.456730769230774 | AD633: =(X633*4)+(Z633*2) -> 16
A634: WAVERLEY | C634: B WILLIAMS | F634: CRAWFORD | I634: CRONIN | L634: GRANT | O634: HANKINSON | R634: G McDONALD | W634: WAVERLEY | X634: 4 | Y634: 10 | Z634: 0 | AA634: 1386 | AB634: 1752 | AC634: =(AA634*100)/AB634 -> 79.109589041095887 | AD634: =(X634*4)+(Z634*2) -> 16
A635: GOALKICKERS | O635: OLIVER | Q635: IND | W635: BOX HILL | X635: 0 | Y635: 14 | Z635: 0 | AA635: 1110 | AB635: 2325 | AC635: =(AA635*100)/AB635 -> 47.741935483870968 | AD635: =(X635*4)+(Z635*2) -> 0
A636: CAMBERWELL | C636: HAMMOND 13 | F636: HOWARD 3 | H636: WALLACE 3 | K636: NEILSON 2 | N636: HOOK | P636: FITZGERALD | S636: K CURRAN
A637: WAVERLEY | C637: COSTELLO 2 | F637: CRAWFORD 2 | I637: G McLURE 2 | L637: P WILLIAMS 2 | O637: HANKINSON
A639: MORDIALLOC | C639: 10 | D639: 5 | E639: =C639*6+D639 -> 65 | G639: 17 | H639: 9 | I639: =G639*6+H639 -> 111 | K639: 22 | L639: 11 | M639: =K639*6+L639 -> 143 | O639: 31 | P639: 16 | Q639: =O639*6+P639 -> 202 | S639: MORDIALLOC
A640: BOX HILL | C640: 2 | D640: 3 | E640: =C640*6+D640 -> 15 | G640: 4 | H640: 8 | I640: =G640*6+H640 -> 32 | K640: 8 | L640: 12 | M640: =K640*6+L640 -> 60 | O640: 10 | P640: 13 | Q640: =O640*6+P640 -> 73 | S640: MATHEWS
A641: BEST PLAYERS
A642: MORDIALLOC | C642: DEATON | F642: MILDENHALL | I642: MICHAELIDES | L642: MUNDAY | O642: JOHNSTONE | R642: LANG
A643: BOX HILL | C643: G McGUINNESS | F643: ROBINSON | I643: JONES | L643: TUCKWELL | O643: LASKIE | R643: COOK
A644: GOALKICKERS
A645: MORDIALLOC | C645: DEATON 10 | F645: JOHNSTONE 7 | I645: NORRIS 6 | K645: ROGERSON 2 | N645: MUNDAY 2 | P645: MILDENHALL | S645: DINGLE | U645: ROSENOW | W645: GUY
A646: BOX HILL | C646: G McGUINNESS 3 | F646: JOFFE 2 | I646: LASKIE 2 | K646: SAUNDERS | N646: LOVE | P646: BROWN
A648: FRANKSTON | C648: 5 | D648: 6 | E648: =C648*6+D648 -> 36 | G648: 15 | H648: 9 | I648: =G648*6+H648 -> 99 | K648: 22 | L648: 12 | M648: =K648*6+L648 -> 144 | O648: 28 | P648: 19 | Q648: =O648*6+P648 -> 187 | S648: FRANKSTON
A649: WERRIBEE | C649: 2 | D649: 5 | E649: =C649*6+D649 -> 17 | G649: 7 | H649: 8 | I649: =G649*6+H649 -> 50 | K649: 12 | L649: 16 | M649: =K649*6+L649 -> 88 | O649: 17 | P649: 19 | Q649: =O649*6+P649 -> 121 | S649: WENN
A650: BEST PLAYERS
A651: FRANKSTON | C651: BOYD | F651: McILWRAITH | I651: GEDDES | L651: MACE | O651: LEWIS | R651: WORTHINGTON
A652: WERRIBEE | C652: LEECE | F652: MARTIN | I652: EVANS | L652: J BELLIN | O652: KENNEDY
A653: GOALKICKERS
A654: FRANKSTON | C654: DAVIES 6 | F654: CLARKE 4 | H654: GEDDES 3 | J654: HUNTER 3 | L654: WORTHINGTON 3 | O654: GUY 2 | Q654: HARRISON 2 | S654: BOYD 2 | U654: CARLSON | W654: McILWRAITH
A655: WERRIBEE | C655: LEECE 8 | F655: SQUIRE 3 | I655: LYNCH 2 | K655: HUDSON 2 | N655: J BELLIN | P655: TUDOR
A657: OAKLEIGH | C657: 4 | D657: 6 | E657: =C657*6+D657 -> 30 | G657: 10 | H657: 14 | I657: =G657*6+H657 -> 74 | K657: 17 | L657: 19 | M657: =K657*6+L657 -> 121 | O657: 25 | P657: 25 | Q657: =O657*6+P657 -> 175 | S657: SUNSHINE
A658: SUNSHINE | C658: 5 | D658: 2 | E658: =C658*6+D658 -> 32 | G658: 8 | H658: 6 | I658: =G658*6+H658 -> 54 | K658: 12 | L658: 8 | M658: =K658*6+L658 -> 80 | O658: 15 | P658: 10 | Q658: =O658*6+P658 -> 100 | S658: HUGGINS
A659: BEST PLAYERS
A660: OAKLEIGH | C660: LEISHMAN | F660: KING | I660: GOODMAN | L660: WENN | O660: WYATT | R660: BARROTT
A661: SUNSHINE | C661: MARTIN | F661: PETER SIMPSON | J661: VELLA | L661: CLARKE | O661: BENSON
A662: GOALKICKERS
A663: OAKLEIGH | C663: WENN 7 | F663: WES BARROTT 5 | J663: KING 4 | L663: LEISHMAN 4 | O663: McDONALD 3 | R663: WYATT 2
A664: SUNSHINE | C664: McDONALD 4 | F664: BAIRD 2 | H664: BENSON 2 | J664: MANDICS 2 | L664: PAUL SIMPSON 2 | P664: VELLA | R664: MARTIN | T664: BUGDEN
A666: ROUND 15 | E666: 24TH JULY | J666: WEATHER | S666: PLAYED AT
D667: 1ST QTR | H667: 2ND QTR | L667: 3RD QTR | P667: FINAL | S667: OAKLEIGH
A668: OAKLEIGH | C668: 4 | D668: 3 | E668: =C668*6+D668 -> 27 | G668: 11 | H668: 5 | I668: =G668*6+H668 -> 71 | K668: 15 | L668: 11 | M668: =K668*6+L668 -> 101 | O668: 19 | P668: 12 | Q668: =O668*6+P668 -> 126 | S668: UMPIRE | X668: LADDER | AB668: ROUND | AD668: 15
A669: YARRAVILLE | C669: 4 | D669: 3 | E669: =C669*6+D669 -> 27 | G669: 7 | H669: 5 | I669: =G669*6+H669 -> 47 | K669: 9 | L669: 10 | M669: =K669*6+L669 -> 64 | O669: 16 | P669: 15 | Q669: =O669*6+P669 -> 111 | S669: STEERE
A670: BEST PLAYERS | W670: TEAM | X670: W | Y670: L | Z670: D | AA670: FOR | AB670: AGST | AC670: % | AD670: PTS
A671: OAKLEIGH | C671: BURKE | F671: KING | I671: BARROTT | L671: FRYER | O671: BRUERTON | R671: WENN
A672: YARRAVILLE | C672: PRIEST | F672: SAIT | I672: HENRY | L672: MERRINGTON | O672: WELLINGTON | R672: BISSET | W672: MORDIALLOC | X672: 13 | Y672: 2 | Z672: 0 | AA672: 2012 | AB672: 1387 | AC672: =(AA672*100)/AB672 -> 145.06128334534966 | AD672: =(X672*4)+(Z672*2) -> 52
A673: GOALKICKERS | Q673: LEISHMAN | W673: OAKLEIGH | X673: 11 | Y673: 4 | Z673: 0 | AA673: 1954 | AB673: 1574 | AC673: =(AA673*100)/AB673 -> 124.1423125794155 | AD673: =(X673*4)+(Z673*2) -> 44
A674: OAKLEIGH | C674: McDONALD 5 | F674: WES BARROTT 3 | I674: BURKE 2 | K674: FRYER 2 | M674: McMAHON 2 | P674: WYATT 2 | R674: EDWARDS | T674: COLLARD? | W674: CAMBERWELL | X674: 11 | Y674: 4 | Z674: 0 | AA674: 1851 | AB674: 1498 | AC674: =(AA674*100)/AB674 -> 123.56475300400534 | AD674: =(X674*4)+(Z674*2) -> 44
A675: YARRAVILLE | C675: BISSET 4 | E675: GIBSON 4 | G675: SAIT 2 | I675: HAYES 2 | K675: GRANDIN 2 | M675: WELLINGTON | P675: SAMPSON | W675: YARRAVILLE | X675: 11 | Y675: 4 | Z675: 0 | AA675: 1846 | AB675: 1520 | AC675: =(AA675*100)/AB675 -> 121.44736842105263 | AD675: =(X675*4)+(Z675*2) -> 44
A677: CAMBERWELL | C677: 4 | D677: 2 | E677: =C677*6+D677 -> 26 | G677: 10 | H677: 5 | I677: =G677*6+H677 -> 65 | K677: 12 | L677: 7 | M677: =K677*6+L677 -> 79 | O677: 15 | P677: 14 | Q677: =O677*6+P677 -> 104 | S677: WERRIBEE | W677: FRANKSTON | X677: 9 | Y677: 6 | Z677: 0 | AA677: 1935 | AB677: 1665 | AC677: =(AA677*100)/AB677 -> 116.21621621621621 | AD677: =(X677*4)+(Z677*2) -> 36
A678: WERRIBEE | C678: 3 | D678: 3 | E678: =C678*6+D678 -> 21 | G678: 5 | H678: 5 | I678: =G678*6+H678 -> 35 | K678: 9 | L678: 10 | M678: =K678*6+L678 -> 64 | O678: 11 | P678: 10 | Q678: =O678*6+P678 -> 76 | S678: STABB | W678: NORTHCOTE | X678: 6 | Y678: 9 | Z678: 0 | AA678: 1729 | AB678: 1649 | AC678: =(AA678*100)/AB678 -> 104.85142510612492 | AD678: =(X678*4)+(Z678*2) -> 24
A679: BEST PLAYERS | W679: WERRIBEE | X679: 6 | Y679: 9 | Z679: 0 | AA679: 1618 | AB679: 1850 | AC679: =(AA679*100)/AB679 -> 87.459459459459453 | AD679: =(X679*4)+(Z679*2) -> 24
A680: CAMBERWELL | C680: FITZGERALD | F680: ALEXEEF | I680: SPITHILL | L680: HOOK | O680: HAZLETT | R680: HOWARD | W680: SUNSHINE | X680: 4 | Y680: 11 | Z680: 0 | AA680: 1516 | AB680: 1765 | AC680: =(AA680*100)/AB680 -> 85.892351274787529 | AD680: =(X680*4)+(Z680*2) -> 16
A681: WERRIBEE | C681: KNIGHT | F681: WISE | I681: MARTIN | L681: DOUGLAS | O681: MACKEY | R681: J BELLIN | W681: WAVERLEY | X681: 4 | Y681: 11 | Z681: 0 | AA681: 1466 | AB681: 1855 | AC681: =(AA681*100)/AB681 -> 79.029649595687331 | AD681: =(X681*4)+(Z681*2) -> 16
A682: GOALKICKERS | W682: BOX HILL | X682: 0 | Y682: 15 | Z682: 0 | AA682: 1197 | AB682: 2450 | AC682: =(AA682*100)/AB682 -> 48.857142857142854 | AD682: =(X682*4)+(Z682*2) -> 0
A683: CAMBERWELL | C683: HAMMOND 6 | F683: NEILSON 2 | I683: WALLACE 2 | K683: HOWARD | N683: IND | O683: HOOK | Q683: FITZGERALD | T683: R SMITH
A684: WERRIBEE | C684: LEECE 3 | E684: LYONS 3 | G684: WISE | I684: TUDOR | K684: J BELLIN | M684: T OUGH | O684: SQUIRE
A686: NORTHCOTE | C686: 1 | D686: 0 | E686: =C686*6+D686 -> 6 | G686: 6 | H686: 4 | I686: =G686*6+H686 -> 40 | K686: 9 | L686: 5 | M686: =K686*6+L686 -> 59 | O686: 15 | P686: 13 | Q686: =O686*6+P686 -> 103 | S686: WAVERLEY
A687: WAVERLEY | C687: 3 | D687: 8 | E687: =C687*6+D687 -> 26 | G687: 4 | H687: 9 | I687: =G687*6+H687 -> 33 | K687: 7 | L687: 12 | M687: =K687*6+L687 -> 54 | O687: 11 | P687: 14 | Q687: =O687*6+P687 -> 80 | S687: TORNEY
A688: BEST PLAYERS
A689: NORTHCOTE | C689: McGREGOR | F689: AFFLECK | I689: BURLEIGH | L689: M RYAN | O689: McARDLE | R689: McINTYRE
A690: WAVERLEY | C690: MORRIS | F690: HANKINSON | I690: GRANT | L690: GILL | O690: CRONIN | R690: K McDONALD
A691: GOALKICKERS
A692: NORTHCOTE | C692: BENNETT 4 | F692: AFFLECK 3 | H692: McINTYRE 2 | K692: HOBBS | M692: M RYAN | O692: BRAIN | Q692: DOBSON | S692: BRIGHAM | V692: G RYAN
A693: WAVERLEY | C693: HANKINSON 2 | F693: COSTELLO 2 | I693: K McDONALD 2 | L693: G McLURE | N693: P WILLIAMS | Q693: WATERS | S693: GILL | U693: CRAWFORD
A695: FRANKSTON | C695: 1 | D695: 2 | E695: =C695*6+D695 -> 8 | G695: 9 | H695: 7 | I695: =G695*6+H695 -> 61 | K695: 11 | L695: 12 | M695: =K695*6+L695 -> 78 | O695: 18 | P695: 17 | Q695: =O695*6+P695 -> 125 | S695: BOX HILL
A696: BOX HILL | C696: 3 | D696: 7 | E696: =C696*6+D696 -> 25 | G696: 4 | H696: 9 | I696: =G696*6+H696 -> 33 | K696: 8 | L696: 14 | M696: =K696*6+L696 -> 62 | O696: 12 | P696: 15 | Q696: =O696*6+P696 -> 87 | S696: FITZPATRICK
A697: BEST PLAYERS
A698: FRANKSTON | C698: GUY | F698: KENNEDY | I698: BOYD | L698: CLARKE | O698: McILWRAITH | R698: HUNTER
A699: BOX HILL | C699: SAUNDERS | F699: ROBINSON | I699: LASKIE | L699: HARPER | O699: TUCKWELL | R699: BATES
A700: GOALKICKERS
A701: FRANKSTON | C701: KENNEDY 3 | E701: HUNTER 3 | G701: HARRISON 3 | J701: CLARKE 2 | L701: McILWRAITH 2 | O701: DAVIES | Q701: GUY | R701: BOYD | T701: ESLER | V701: GEDDES
A702: BOX HILL | C702: BATES 4 | F702: McGUINNESS 3 | I702: LASKIE 2 | K702: CONNOLLY | N702: COOK | P702: JONES
A704: MORDIALLOC | C704: 3 | D704: 5 | E704: =C704*6+D704 -> 23 | G704: 5 | H704: 8 | I704: =G704*6+H704 -> 38 | K704: 9 | L704: 9 | M704: =K704*6+L704 -> 63 | O704: 15 | P704: 11 | Q704: =O704*6+P704 -> 101 | S704: SUNSHINE
A705: SUNSHINE | C705: 6 | D705: 3 | E705: =C705*6+D705 -> 39 | G705: 7 | H705: 5 | I705: =G705*6+H705 -> 47 | K705: 9 | L705: 10 | M705: =K705*6+L705 -> 64 | O705: 14 | P705: 10 | Q705: =O705*6+P705 -> 94 | S705: OGSTON
A706: BEST PLAYERS
A707: MORDIALLOC | C707: LANG | F707: WILLIAMSON | I707: DEATON | L707: NORRIS | O707: JOHNSTONE | R707: MEAGHER
A708: SUNSHINE | C708: JONES | F708: FOLEY | I708: CLARKE | L708: BAIRD | O708: VELLA | R708: PETER SIMPSON
A709: GOALKICKERS
A710: MORDIALLOC | C710: DEATON 5 | F710: NORRIS 4 | H710: MILDENHALL 2 | K710: MUNDAY | M710: NEVILLE | O710: DINGLE | Q710: 1 SHORT
A711: SUNSHINE | C711: BAIRD 6 | F711: JONES 4 | H711: VELLA 2 | J711: PAXTON | M711: MATHEWS
A713: ROUND 16 | E713: 31ST JULY | J713: WEATHER | S713: PLAYED AT
D714: 1ST QTR | H714: 2ND QTR | L714: 3RD QTR | P714: FINAL | S714: CAMBERWELL
A715: CAMBERWELL | C715: 4 | D715: 6 | E715: =C715*6+D715 -> 30 | G715: 9 | H715: 7 | I715: =G715*6+H715 -> 61 | K715: 17 | L715: 12 | M715: =K715*6+L715 -> 114 | O715: 22 | P715: 12 | Q715: =O715*6+P715 -> 144 | S715: UMPIRE | X715: LADDER | AB715: ROUND | AD715: 16
A716: BOX HILL | C716: 2 | D716: 0 | E716: =C716*6+D716 -> 12 | G716: 10 | H716: 5 | I716: =G716*6+H716 -> 65 | K716: 12 | L716: 7 | M716: =K716*6+L716 -> 79 | O716: 21 | P716: 11 | Q716: =O716*6+P716 -> 137 | S716: MARCY
A717: BEST PLAYERS | W717: TEAM | X717: W | Y717: L | Z717: D | AA717: FOR | AB717: AGST | AC717: % | AD717: PTS
A718: CAMBERWELL | C718: SPITHILL | F718: HAMMOND | I718: HOOK | L718: OLIVER | O718: JUDD | R718: FITZGERALD
A719: BOX HILL | C719: CONNOLLY | F719: WELLINGS | I719: COOK | L719: GORDON | O719: LASKIE | R719: BATES | W719: MORDIALLOC | X719: 14 | Y719: 2 | Z719: 0 | AA719: 2153 | AB719: 1461 | AC719: =(AA719*100)/AB719 -> 147.36481861738534 | AD719: =(X719*4)+(Z719*2) -> 56
A720: GOALKICKERS | W720: YARRAVILLE | X720: 12 | Y720: 4 | Z720: 0 | AA720: 1944 | AB720: 1593 | AC720: =(AA720*100)/AB720 -> 122.03389830508475 | AD720: =(X720*4)+(Z720*2) -> 48
A721: CAMBERWELL | C721: HAMMOND 10 | F721: B SMITH 5 | I721: JUDD 3 | K721: OLIVER 2 | M721: WALLACE | O721: NEILSON | W721: CAMBERWELL | X721: 12 | Y721: 4 | Z721: 0 | AA721: 1995 | AB721: 1635 | AC721: =(AA721*100)/AB721 -> 122.01834862385321 | AD721: =(X721*4)+(Z721*2) -> 48
A722: BOX HILL | C722: JOFFE 4 | E722: LASKIE 4 | G722: CONNOLLY 4 | J722: GORDON 3 | M722: McGUINNESS 2 | P722: SAUNDERS 2 | R722: BATES | T722: COOK | W722: OAKLEIGH | X722: 11 | Y722: 5 | Z722: 0 | AA722: 2028 | AB722: 1715 | AC722: =(AA722*100)/AB722 -> 118.25072886297376 | AD722: =(X722*4)+(Z722*2) -> 44
A724: MORDIALLOC | C724: 3 | D724: 2 | E724: =C724*6+D724 -> 20 | G724: 9 | H724: 10 | I724: =G724*6+H724 -> 64 | K724: 11 | L724: 13 | M724: =K724*6+L724 -> 79 | O724: 21 | P724: 15 | Q724: =O724*6+P724 -> 141 | S724: MORDIALLOC | W724: FRANKSTON | X724: 10 | Y724: 6 | Z724: 0 | AA724: 2115 | AB724: 1787 | AC724: =(AA724*100)/AB724 -> 118.35478455512032 | AD724: =(X724*4)+(Z724*2) -> 40
A725: OAKLEIGH | C725: 2 | D725: 3 | E725: =C725*6+D725 -> 15 | G725: 2 | H725: 4 | I725: =G725*6+H725 -> 16 | K725: 6 | L725: 8 | M725: =K725*6+L725 -> 44 | O725: 10 | P725: 14 | Q725: =O725*6+P725 -> 74 | S725: STABB | W725: NORTHCOTE | X725: 7 | Y725: 9 | Z725: 0 | AA725: 1860 | AB725: 1710 | AC725: =(AA725*100)/AB725 -> 108.7719298245614 | AD725: =(X725*4)+(Z725*2) -> 28
A726: BEST PLAYERS | W726: WERRIBEE | X726: 6 | Y726: 10 | Z726: 0 | AA726: 1679 | AB726: 1981 | AC726: =(AA726*100)/AB726 -> 84.75517415446744 | AD726: =(X726*4)+(Z726*2) -> 24
A727: MORDIALLOC | C727: WILLIAMSON | F727: THOMPSON | I727: ? | L727: ROSENOW | O727: NORRIS | R727: MOORE | W727: SUNSHINE | X727: 4 | Y727: 12 | Z727: 0 | AA727: 1638 | AB727: 1945 | AC727: =(AA727*100)/AB727 -> 84.2159383033419 | AD727: =(X727*4)+(Z727*2) -> 16
A728: OAKLEIGH | C728: W BARROTT | F728: HAY | I728: KING | L728: WHITE | O728: McDONALD | R728: EDWARDS | W728: WAVERLEY | X728: 4 | Y728: 12 | Z728: 0 | AA728: 1539 | AB728: 1953 | AC728: =(AA728*100)/AB728 -> 78.801843317972356 | AD728: =(X728*4)+(Z728*2) -> 16
A729: GOALKICKERS | P729: MILDENHALL | W729: BOX HILL | X729: 0 | Y729: 16 | Z729: 0 | AA729: 1334 | AB729: 2594 | AC729: =(AA729*100)/AB729 -> 51.426368542791053 | AD729: =(X729*4)+(Z729*2) -> 0
A730: MORDIALLOC | C730: NEVILLE 7 | F730: DEATON 4 | H730: NORRIS 3 | J730: BLOOMFIELD 2 | M730: WILLIAMSON 2 | P730: JOHNSTONE | S730: O'NEILL
A731: OAKLEIGH | C731: McDONALD 5 | F731: COLCOTT 2 | I731: WYATT | K731: W BARROTT | N731: EDWARDS
A733: NORTHCOTE | C733: 5 | D733: 1 | E733: =C733*6+D733 -> 31 | G733: 10 | H733: 4 | I733: =G733*6+H733 -> 64 | K733: 14 | L733: 7 | M733: =K733*6+L733 -> 91 | O733: 20 | P733: 11 | Q733: =O733*6+P733 -> 131 | S733: NORTHCOTE
A734: WERRIBEE | C734: 2 | D734: 4 | E734: =C734*6+D734 -> 16 | G734: 4 | H734: 6 | I734: =G734*6+H734 -> 30 | K734: 5 | L734: 8 | M734: =K734*6+L734 -> 38 | O734: 8 | P734: 13 | Q734: =O734*6+P734 -> 61 | S734: HEDGER
A735: BEST PLAYERS
A736: NORTHCOTE | C736: McARDLE | F736: McINTYRE | I736: ROBERTS | L736: BRIGHAM | O736: G RYAN | R736: M RYAN
A737: WERRIBEE | C737: MARTIN | F737: BOURKE | I737: EVANS | L737: KNIGHT | O737: MACKAY
A738: GOALKICKERS
A739: NORTHCOTE | C739: BRIGHAM 6 | F739: BENNETT 4 | I739: ROBERTS 3 | K739: G RYAN 3 | N739: M RYAN 2 | P739: McINTYRE | R739: HOWELL
A740: WERRIBEE | C740: MARTIN 3 | F740: LEECE 2 | I740: EVANS | K740: WISE | M740: LYNCH
A742: FRANKSTON | C742: 8 | D742: 7 | E742: =C742*6+D742 -> 55 | G742: 13 | H742: 11 | I742: =G742*6+H742 -> 89 | K742: 21 | L742: 11 | M742: =K742*6+L742 -> 137 | O742: 27 | P742: 18 | Q742: =O742*6+P742 -> 180 | S742: FRANKSTON
A743: SUNSHINE | C743: 4 | D743: 2 | E743: =C743*6+D743 -> 26 | G743: 8 | H743: 7 | I743: =G743*6+H743 -> 55 | K743: 11 | L743: 10 | M743: =K743*6+L743 -> 76 | O743: 18 | P743: 14 | Q743: =O743*6+P743 -> 122 | S743: STEERE
A744: BEST PLAYERS
A745: FRANKSTON | C745: HARRISON | F745: HUNTER | I745: GUY | L745: ESLER | O745: KENNEDY | R745: LANE
A746: SUNSHINE | C746: BAIRD | F746: MITCHELL | I746: VELLA | L746: MATTHEWS | O746: JONES | R746: SIMPSON
A747: GOALKICKERS
A748: FRANKSTON | C748: HUNTER 8 | F748: HARRISON 4 | I748: DAVIES 3 | K748: McILWRAITH 3 | N748: KENNEDY 2 | Q748: GUY 2 | S748: GEDDES 2 | V748: CLARKE | Y748: ESLER | AA748: WORTHINGTON
A749: SUNSHINE | C749: BAIRD 5 | F749: CLARKE 2 | I749: VELLA 2 | K749: BENSON 2 | M749: BRETT 2 | O749: LAKE | Q749: JONES | S749: PAXTON | V749: MATTHEWS | X749: McDONALD
A751: YARRAVILLE | C751: 5 | D751: 9 | E751: =C751*6+D751 -> 39 | G751: 6 | H751: 9 | I751: =G751*6+H751 -> 45 | K751: 11 | L751: 18 | M751: =K751*6+L751 -> 84 | O751: 13 | P751: 20 | Q751: =O751*6+P751 -> 98 | S751: YARRAVILLE
A752: WAVERLEY | C752: 0 | D752: 0 | E752: =C752*6+D752 -> 0 | G752: 7 | H752: 6 | I752: =G752*6+H752 -> 48 | K752: 7 | L752: 6 | M752: =K752*6+L752 -> 48 | O752: 10 | P752: 13 | Q752: =O752*6+P752 -> 73 | S752: FITZPATRICK
A753: BEST PLAYERS
A754: YARRAVILLE | C754: LOWE | F754: SIMMONS | I754: SAIT | L754: R? | O754: THORPE | R754: BROWN
A755: WAVERLEY | C755: G McLURE | F755: COSTELLO | I755: GRANT | L755: CRAWFORD | O755: P WILLIAMS | R755: CRONIN
A756: GOALKICKERS
A757: YARRAVILLE | C757: THORPE 3 | F757: BISSET 3 | I757: WELLINGTON 2 | L757: LOWE 2 | N757: GIBSON 2 | P757: SIMMONS | R757: SAIT
A758: WAVERLEY | C758: DUNNE 3 | F758: G McLURE 2 | I758: K McDONALD 2 | L758: B WILLIAMS | O758: W McDONALD | R758: A McLURE
A760: ROUND 17 | E760: 7TH AUGUST | J760: WEATHER | S760: PLAYED AT
D761: 1ST QTR | H761: 2ND QTR | L761: 3RD QTR | P761: FINAL | S761: MORDIALLOC
A762: FRANKSTON | C762: 5 | D762: 6 | E762: =C762*6+D762 -> 36 | G762: 8 | H762: 11 | I762: =G762*6+H762 -> 59 | K762: 15 | L762: 15 | M762: =K762*6+L762 -> 105 | O762: 17 | P762: 19 | Q762: =O762*6+P762 -> 121 | S762: UMPIRE | X762: LADDER | AB762: ROUND | AD762: 17
A763: MORDIALLOC | C763: 1 | D763: 6 | E763: =C763*6+D763 -> 12 | G763: 6 | H763: 9 | I763: =G763*6+H763 -> 45 | K763: 11 | L763: 11 | M763: =K763*6+L763 -> 77 | O763: 16 | P763: 14 | Q763: =O763*6+P763 -> 110 | S763: TORNEY
A764: BEST PLAYERS | W764: TEAM | X764: W | Y764: L | Z764: D | AA764: FOR | AB764: AGST | AC764: % | AD764: PTS
A765: FRANKSTON | C765: LOCCO | F765: GUY | I765: EVANS | L765: KENNEDY | O765: MACE | R765: HUNTER
A766: MORDIALLOC | C766: DEATON | F766: DINGLE | I766: LANG | L766: CRITCH | O766: O'NEILL | R766: MUNDAY | W766: MORDIALLOC | X766: 14 | Y766: 3 | Z766: 0 | AA766: 2263 | AB766: 1582 | AC766: =(AA766*100)/AB766 -> 143.04677623261693 | AD766: =(X766*4)+(Z766*2) -> 56
A767: GOALKICKERS | W767: YARRAVILLE | X767: 13 | Y767: 4 | Z767: 0 | AA767: 2072 | AB767: 1655 | AC767: =(AA767*100)/AB767 -> 125.1963746223565 | AD767: =(X767*4)+(Z767*2) -> 52
A768: FRANKSTON | C768: DAVIES 4 | F768: JONES 3 | H768: HUNTER 3 | J768: LOCCO 3 | L768: KENNEDY 2 | O768: GEDDES | Q768: GUY | W768: CAMBERWELL | X768: 13 | Y768: 4 | Z768: 0 | AA768: 2130 | AB768: 1730 | AC768: =(AA768*100)/AB768 -> 123.121387283237 | AD768: =(X768*4)+(Z768*2) -> 52
A769: MORDIALLOC | C769: DINGLE 4 | F769: NEVILLE 4 | I769: NORRIS 3 | K769: DEATON 3 | N769: ROSENOW | P769: BLOOMFIELD | W769: OAKLEIGH | X769: 12 | Y769: 5 | Z769: 0 | AA769: 2199 | AB769: 1833 | AC769: =(AA769*100)/AB769 -> 119.96726677577742 | AD769: =(X769*4)+(Z769*2) -> 48
A771: CAMBERWELL | C771: 6 | D771: 4 | E771: =C771*6+D771 -> 40 | G771: 12 | H771: 7 | I771: =G771*6+H771 -> 79 | K771: 15 | L771: 9 | M771: =K771*6+L771 -> 99 | O771: 20 | P771: 15 | Q771: =O771*6+P771 -> 135 | S771: SUNSHINE | W771: FRANKSTON | X771: 11 | Y771: 6 | Z771: 0 | AA771: 2236 | AB771: 1897 | AC771: =(AA771*100)/AB771 -> 117.87032156035846 | AD771: =(X771*4)+(Z771*2) -> 44
A772: SUNSHINE | C772: 3 | D772: 2 | E772: =C772*6+D772 -> 20 | G772: 9 | H772: 5 | I772: =G772*6+H772 -> 59 | K772: 12 | L772: 9 | M772: =K772*6+L772 -> 81 | O772: 14 | P772: 11 | Q772: =O772*6+P772 -> 95 | S772: MATHEWS | W772: NORTHCOTE | X772: 8 | Y772: 9 | Z772: 0 | AA772: 1936 | AB772: 1757 | AC772: =(AA772*100)/AB772 -> 110.18782014797951 | AD772: =(X772*4)+(Z772*2) -> 32
A773: BEST PLAYERS | W773: WERRIBEE | X773: 6 | Y773: 11 | Z773: 0 | AA773: 1741 | AB773: 2109 | AC773: =(AA773*100)/AB773 -> 82.550972024656232 | AD773: =(X773*4)+(Z773*2) -> 24
A774: CAMBERWELL | C774: HOWARD | F774: PHILLIPS | I774: SPITHILL | L774: WALLACE | O774: FITZGERALD | R774: B SMITH | W774: SUNSHINE | X774: 4 | Y774: 13 | Z774: 0 | AA774: 1733 | AB774: 2080 | AC774: =(AA774*100)/AB774 -> 83.317307692307693 | AD774: =(X774*4)+(Z774*2) -> 16
A775: SUNSHINE | C775: MARTIN | F775: McDONALD | I775: MITCHELL | L775: BAIRD | O775: SEVERS | Q775: PETER SIMPSON | W775: WAVERLEY | X775: 4 | Y775: 13 | Z775: 0 | AA775: 1657 | AB775: 2124 | AC775: =(AA775*100)/AB775 -> 78.013182674199626 | AD775: =(X775*4)+(Z775*2) -> 16
A776: GOALKICKERS | W776: BOX HILL | X776: 0 | Y776: 17 | Z776: 0 | AA776: 1381 | AB776: 2670 | AC776: =(AA776*100)/AB776 -> 51.722846441947567 | AD776: =(X776*4)+(Z776*2) -> 0
A777: CAMBERWELL | C777: HAMMOND 7 | F777: B SMITH 6 | I777: KENNEDY 2 | L777: ATKINSON 2 | N777: HOWARD | Q777: MARTIN | S777: OLIVER
A778: SUNSHINE | C778: SAID 4 | E778: BLAKE 2 | G778: JONES 2 | I778: MA? 2 | L778: BRETT | N778: SEARLE | P778: McDONALD | S778: VELLA
A780: OAKLEIGH | C780: 1 | D780: 3 | E780: =C780*6+D780 -> 9 | G780: 12 | H780: 7 | I780: =G780*6+H780 -> 79 | K780: 19 | L780: 8 | M780: =K780*6+L780 -> 122 | O780: 27 | P780: 9 | Q780: =O780*6+P780 -> 171 | S780: OAKLEIGH
A781: WAVERLEY | C781: 3 | D781: 5 | E781: =C781*6+D781 -> 23 | G781: 8 | H781: 12 | I781: =G781*6+H781 -> 60 | K781: 12 | L781: 20 | M781: =K781*6+L781 -> 92 | O781: 16 | P781: 22 | Q781: =O781*6+P781 -> 118 | S781: WENN
A782: BEST PLAYERS
A783: OAKLEIGH | C783: KING | F783: GOODMAN | I783: ? | L783: BALL | O783: BARROTT | R783: EDWARDS
A784: WAVERLEY | C784: DUNNE | F784: ? | I784: GRANT | L784: HOLDSWORTH | O784: GILL | R784: B WILLIAMS
A785: GOALKICKERS
A786: OAKLEIGH | C786: COLCOTT 8 | F786: ROWLINGS 4 | I786: KING 4 | K786: WENN 3 | M786: EDWARDS 2 | O786: COCCIARDI 2 | R786: ? 2 | T786: McDONALD | W786: HOLDEN
A787: WAVERLEY | C787: COSTELLO 4 | F787: MILES 4 | H787: McDONALD 2 | K787: CRAWFORD 2 | N787: HANKINSON | Q787: G McLURE | T787: A McLURE | W787: DUNNE
A789: YARRAVILLE | C789: 4 | D789: 7 | E789: =C789*6+D789 -> 31 | G789: 6 | H789: 14 | I789: =G789*6+H789 -> 50 | K789: 12 | L789: 18 | M789: =K789*6+L789 -> 90 | O789: 18 | P789: 20 | Q789: =O789*6+P789 -> 128 | S789: WERRIBEE
A790: WERRIBEE | C790: 1 | D790: 5 | E790: =C790*6+D790 -> 11 | G790: 3 | H790: 6 | I790: =G790*6+H790 -> 24 | K790: 4 | L790: 10 | M790: =K790*6+L790 -> 34 | O790: 8 | P790: 14 | Q790: =O790*6+P790 -> 62 | S790: OGSTON
A791: BEST PLAYERS
A792: YARRAVILLE | C792: ? | F792: SAIT | I792: WELLINGTON | L792: JONES | O792: ?
A793: WERRIBEE | C793: WISE | F793: MARTIN | I793: ? | L793: J BELLIN | O793: J BOURKE
A794: GOALKICKERS
A795: YARRAVILLE | C795: ? | F795: GIBSON 3 | H795: S? 2 | J795: ? 2 | L795: SAIT 2 | N795: LOWE 2 | P795: THORPE
A796: WERRIBEE | C796: LEECE 3 | F796: MARTIN 2 | I796: BELLIN 2 | K796: MITCHELL
A798: NORTHCOTE | C798: 3 | D798: 11 | E798: =C798*6+D798 -> 29 | G798: 5 | H798: 15 | I798: =G798*6+H798 -> 45 | K798: 7 | L798: 18 | M798: =K798*6+L798 -> 60 | O798: 9 | P798: 22 | Q798: =O798*6+P798 -> 76 | S798: BOX HILL
A799: BOX HILL | C799: 2 | D799: 1 | E799: =C799*6+D799 -> 13 | G799: 4 | H799: 1 | I799: =G799*6+H799 -> 25 | K799: 6 | L799: 2 | M799: =K799*6+L799 -> 38 | O799: 7 | P799: 5 | Q799: =O799*6+P799 -> 47 | S799: HUGGINS
A800: BEST PLAYERS
A801: NORTHCOTE | C801: M? | F801: RYAN | I801: BRAIN | L801: BRIGHAM | O801: ? | Q801: McINTYRE
A802: BOX HILL | C802: RA? | F802: SAUNDERS | I802: TUCKWELL | L802: LASKIE | O802: ? | Q802: BATES
A803: GOALKICKERS
A804: NORTHCOTE | C804: G RYAN 2 | F804: BRIGHAM 2 | I804: M RYAN | K804: ? 1 | M804: ROBERTS | O804: BENNETT | Q804: McFARLANE
A805: BOX HILL | C805: FARRUGIA 2 | F805: JOFFE 2 | I805: TUCKWELL | L805: McGUINNESS | O805: HARPER
A807: ROUND 18 | E807: 14TH AUGUST | J807: WEATHER | S807: PLAYED AT
D808: 1ST QTR | H808: 2ND QTR | L808: 3RD QTR | P808: FINAL | S808: CAMBERWELL
A809: CAMBERWELL | C809: 5 | D809: 2 | E809: =C809*6+D809 -> 32 | G809: 11 | H809: 3 | I809: =G809*6+H809 -> 69 | K809: 17 | L809: 5 | M809: =K809*6+L809 -> 107 | O809: 18 | P809: 8 | Q809: =O809*6+P809 -> 116 | S809: UMPIRE | X809: LADDER | AB809: ROUND | AD809: 18
A810: MORDIALLOC | C810: 5 | D810: 4 | E810: =C810*6+D810 -> 34 | G810: 7 | H810: 4 | I810: =G810*6+H810 -> 46 | K810: 12 | L810: 9 | M810: =K810*6+L810 -> 81 | O810: 14 | P810: 15 | Q810: =O810*6+P810 -> 99 | S810: WENN
A811: BEST PLAYERS | W811: TEAM | X811: W | Y811: L | Z811: D | AA811: FOR | AB811: AGST | AC811: % | AD811: PTS
A812: CAMBERWELL | C812: R SMITH | F812: WALLACE | I812: HAZLETT | L812: HOWARD | O812: A SMITH | R812: HAMMOND
A813: MORDIALLOC | C813: GUY | F813: WILLIAMSON | I813: NORRIS | L813: LANG | O813: SLADE | R813: DEATON | W813: MORDIALLOC | X813: 14 | Y813: 4 | Z813: 0 | AA813: 2362 | AB813: 1698 | AC813: =(AA813*100)/AB813 -> 139.10482921083627 | AD813: =(X813*4)+(Z813*2) -> 56
A814: GOALKICKERS | W814: YARRAVILLE | X814: 14 | Y814: 4 | Z814: 0 | AA814: 2273 | AB814: 1733 | AC814: =(AA814*100)/AB814 -> 131.1598384304674 | AD814: =(X814*4)+(Z814*2) -> 56
A815: CAMBERWELL | C815: HAMMOND 8 | F815: B SMITH 3 | I815: MART? 2 | L815: ATKINSON 2 | O815: WALLACE 2 | R815: BRYANS | W815: CAMBERWELL | X815: 14 | Y815: 4 | Z815: 0 | AA815: 2246 | AB815: 1829 | AC815: =(AA815*100)/AB815 -> 122.79934390377255 | AD815: =(X815*4)+(Z815*2) -> 56
A816: MORDIALLOC | C816: NORRIS 5 | F816: NEVILLE 3 | I816: GUY 2 | K816: JOHNSTONE 2 | N816: ROGERSON | Q816: DINGLE | W816: OAKLEIGH | X816: 13 | Y816: 5 | Z816: 0 | AA816: 2353 | AB816: 1935 | AC816: =(AA816*100)/AB816 -> 121.60206718346254 | AD816: =(X816*4)+(Z816*2) -> 52
A818: OAKLEIGH | C818: 1 | D818: 3 | E818: =C818*6+D818 -> 9 | G818: 9 | H818: 8 | I818: =G818*6+H818 -> 62 | K818: 15 | L818: 12 | M818: =K818*6+L818 -> 102 | O818: 23 | P818: 16 | Q818: =O818*6+P818 -> 154 | S818: F'TPN | W818: FRANKSTON | X818: 11 | Y818: 7 | Z818: 0 | AA818: 2338 | AB818: 2051 | AC818: =(AA818*100)/AB818 -> 113.99317406143345 | AD818: =(X818*4)+(Z818*2) -> 44
A819: FRANKSTON | C819: 9 | D819: 5 | E819: =C819*6+D819 -> 59 | G819: 12 | H819: 6 | I819: =G819*6+H819 -> 78 | K819: 13 | L819: 11 | M819: =K819*6+L819 -> 89 | O819: 15 | P819: 12 | Q819: =O819*6+P819 -> 102 | S819: OGSTON | W819: NORTHCOTE | X819: 8 | Y819: 10 | Z819: 0 | AA819: 2060 | AB819: 1926 | AC819: =(AA819*100)/AB819 -> 106.95742471443405 | AD819: =(X819*4)+(Z819*2) -> 32
A820: BEST PLAYERS | W820: WERRIBEE | X820: 6 | Y820: 12 | Z820: 0 | AA820: 1851 | AB820: 2250 | AC820: =(AA820*100)/AB820 -> 82.266666666666666 | AD820: =(X820*4)+(Z820*2) -> 24
A821: OAKLEIGH | C821: HAY | F821: KING | I821: EDWARDS | L821: McDONALD | O821: COCCIARDI | R821: BRUERTON | W821: SUNSHINE | X821: 5 | Y821: 13 | Z821: 0 | AA821: 1902 | AB821: 2204 | AC821: =(AA821*100)/AB821 -> 86.297640653357533 | AD821: =(X821*4)+(Z821*2) -> 20
A822: FRANKSTON | C822: MACE | F822: GUY | I822: LOCCO | L822: BOYD | O822: GEDDES | R822: KENNEDY | W822: WAVERLEY | X822: 5 | Y822: 13 | Z822: 0 | AA822: 1798 | AB822: 2234 | AC822: =(AA822*100)/AB822 -> 80.483437779767229 | AD822: =(X822*4)+(Z822*2) -> 20
A823: GOALKICKERS | W823: BOX HILL | X823: 0 | Y823: 18 | Z823: 0 | AA823: 1459 | AB823: 2871 | AC823: =(AA823*100)/AB823 -> 50.818530128874954 | AD823: =(X823*4)+(Z823*2) -> 0
A824: OAKLEIGH | C824: McDONALD 7 | F824: HOLDEN 5 | I824: COLCOTT 4 | K824: EDWARDS 2 | N824: FRYER 2 | P824: WES BARROTT 2 | T824: KING
A825: FRANKSTON | C825: DAVIES 5 | F825: HUNTER 3 | I825: GEDDES 3 | K825: GUY 2 | M825: LOCCO | O825: WORTHINGTON
A827: SUNSHINE | C827: 4 | D827: 2 | E827: =C827*6+D827 -> 26 | G827: 12 | H827: 2 | I827: =G827*6+H827 -> 74 | K827: 19 | L827: 4 | M827: =K827*6+L827 -> 118 | O827: 27 | P827: 7 | Q827: =O827*6+P827 -> 169 | S827: NORTHCOTE
A828: NORTHCOTE | C828: 3 | D828: 9 | E828: =C828*6+D828 -> 27 | G828: 6 | H828: 14 | I828: =G828*6+H828 -> 50 | K828: 13 | L828: 21 | M828: =K828*6+L828 -> 99 | O828: 17 | P828: 22 | Q828: =O828*6+P828 -> 124 | S828: MARCY
A829: BEST PLAYERS
A830: SUNSHINE | C830: PETER SIMPSON | F830: BLAKE | I830: BAIRD | L830: BENSON | O830: CLARKE
A831: NORTHCOTE | C831: McGREGOR | F831: ROBERTS | I831: McINTYRE | L831: G SMITH | O831: G RYAN
A832: GOALKICKERS
A833: SUNSHINE | C833: SAID 7 | E833: VELLA 4 | G833: MANDICS 3 | J833: BAIRD 2 | L833: JONES 2 | N833: McDONALD 2 | Q833: MARTIN | S833: BENNETT | U833: RADZIMINSKI
A834: NORTHCOTE | C834: ILLIOV 4 | E834: ROBERTS 3 | G834: AFFLECK 2 | J834: BRIGHAM 2 | L834: G RYAN 2 | N834: R JOHNSTON | Q834: McINTYRE | S834: MORTON | U834: G SMITH
A836: YARRAVILLE | C836: 7 | D836: 3 | E836: =C836*6+D836 -> 45 | G836: 16 | H836: 8 | I836: =G836*6+H836 -> 104 | K836: 22 | L836: 13 | M836: =K836*6+L836 -> 145 | O836: 30 | P836: 21 | Q836: =O836*6+P836 -> 201 | S836: YARRAVILLE
A837: BOX HILL | C837: 3 | D837: 4 | E837: =C837*6+D837 -> 22 | G837: 4 | H837: 7 | I837: =G837*6+H837 -> 31 | K837: 7 | L837: 10 | M837: =K837*6+L837 -> 52 | O837: 11 | P837: 12 | Q837: =O837*6+P837 -> 78 | S837: HEDGER
A838: BEST PLAYERS
A839: YARRAVILLE | C839: THORPE | F839: SAIT | I839: JONES | L839: LOWE | O839: MERRINGTON | R839: RICHES
A840: BOX HILL | C840: HARPER | F840: JOFFE | I840: CONNOLLY | L840: SAUNDERS | O840: JONES | R840: RALPH
A841: GOALKICKERS
A842: YARRAVILLE | C842: SAIT 6 | E842: LOWE 6 | G842: HARVEY 5 | I842: WELLINGTON 4 | L842: GIBSON 4 | N842: BISSET 2 | P842: THORPE 2 | R842: HARLEY
A843: BOX HILL | C843: GORDON 3 | F843: JOFFE 3 | H843: PARRY 2 | J843: McGUINNES | M843: COOK | N843: LASKIE
A845: WAVERLEY | C845: 5 | D845: 3 | E845: =C845*6+D845 -> 33 | G845: 8 | H845: 8 | I845: =G845*6+H845 -> 56 | K845: 13 | L845: 11 | M845: =K845*6+L845 -> 89 | O845: 21 | P845: 15 | Q845: =O845*6+P845 -> 141 | S845: WAVERLEY
A846: WERRIBEE | C846: 4 | D846: 2 | E846: =C846*6+D846 -> 26 | G846: 8 | H846: 4 | I846: =G846*6+H846 -> 52 | K846: 14 | L846: 5 | M846: =K846*6+L846 -> 89 | O846: 17 | P846: 8 | Q846: =O846*6+P846 -> 110 | S846: HUGGINS
A847: BEST PLAYERS
A848: WAVERLEY | C848: P WILLIAMS | F848: DUNNE | I848: HICKEY | L848: MILES | O848: J CRAWLEY | R848: MORRISON
A849: WERRIBEE | C849: MITCHELL | F849: SQUIRE | I849: McCARTNEY | L849: MARTIN | O849: YOUNG | R849: WISE
A850: GOALKICKERS
A851: WAVERLEY | C851: MILES 6 | F851: HICKEY 5 | H851: COSTELLO 3 | J851: MORRISON 2 | M851: PLUMMER | O851: G McLURE | Q851: W McDONALD | T851: MORRIS | V851: HOLDSWORTH
A852: WERRIBEE | C852: LEECE 5 | F852: MOLONEY 4 | I852: YOUNG 4 | K852: TUBBS | M852: MARTIN | O852: WISE | Q852: BOURKE
A854: FINALS
A855: 1ST SEMI | E855: 21ST AUGUST | J855: WEATHER | S855: PLAYED AT
D856: 1ST QTR | H856: 2ND QTR | L856: 3RD QTR | P856: FINAL | S856: TOORAK PARK
A857: CAMBERWELL | C857: 5 | D857: 2 | E857: =C857*6+D857 -> 32 | G857: 10 | H857: 4 | I857: =G857*6+H857 -> 64 | K857: 20 | L857: 9 | M857: =K857*6+L857 -> 129 | O857: 25 | P857: 12 | Q857: =O857*6+P857 -> 162 | S857: UMPIRE
A858: OAKLEIGH | C858: 2 | D858: 3 | E858: =C858*6+D858 -> 15 | G858: 3 | H858: 6 | I858: =G858*6+H858 -> 24 | K858: 8 | L858: 8 | M858: =K858*6+L858 -> 56 | O858: 11 | P858: 13 | Q858: =O858*6+P858 -> 79 | S858: OGSTON
A859: BEST PLAYERS
A860: CAMBERWELL | C860: B SMITH | F860: HAMMOND | I860: SPITHILL | L860: ATKINSON | O860: PHILLIPS | R860: HARROP
A861: OAKLEIGH | F861: HOLDEN | I861: COLCOTT | L861: HAY | O861: BURKE | R861: BRUERTON
A862: GOALKICKERS
A863: CAMBERWELL | C863: HAMMOND 9 | F863: B SMITH 4 | I863: HARROP 3 | K863: HOWARD 2 | M863: KENNEDY 2 | O863: WALLACE 2 | R863: HOOK | T863: FITZGERALD | W863: ATKINSON
A864: OAKLEIGH | C864: COLCOTT 5 | F864: HOLDEN 3 | I864: BURKE 2 | K864: McDONALD
A866: 2ND SEMI | E866: 28TH AUGUST | J866: WEATHER
A867: YARRAVILLE | C867: 1 | D867: 4 | E867: =C867*6+D867 -> 10 | G867: 4 | H867: 10 | I867: =G867*6+H867 -> 34 | K867: 10 | L867: 15 | M867: =K867*6+L867 -> 75 | O867: 19 | P867: 20 | Q867: =O867*6+P867 -> 134 | S867: TOORAK PARK
A868: MORDIALLOC | C868: 5 | D868: 5 | E868: =C868*6+D868 -> 35 | G868: 7 | H868: 6 | I868: =G868*6+H868 -> 48 | K868: 11 | L868: 10 | M868: =K868*6+L868 -> 76 | O868: 15 | P868: 15 | Q868: =O868*6+P868 -> 105 | S868: WENN
A869: BEST PLAYERS
A870: YARRAVILLE | C870: SAIT | F870: PRIEST | I870: THORPE | L870: BROWN | O870: WELLINGTON
A871: MORDIALLOC | C871: WILLIAMSON | F871: LANG | I871: ROGERSON | L871: JOHNSTONE
A872: GOALKICKERS
A873: YARRAVILLE | C873: BISSETT 3 | F873: GRANDIN 3 | I873: SAIT 2 | K873: WELLINGTON | N873: HARVEY | P873: HARLEY | R873: ?SON | U873: 7 SHORT
A874: MORDIALLOC | C874: DEATON 5 | F874: NEVILLE 3 | I874: NORRIS 3 | K874: JOHNSTONE | N874: SLADE | P874: MILDENHALL | S874: ROGERSON
A876: PRELIMINARY | E876: 4TH SEPTEMBER | J876: WEATHER
A877: MORDIALLOC | C877: 6 | D877: 2 | E877: =C877*6+D877 -> 38 | G877: 9 | H877: 4 | I877: =G877*6+H877 -> 58 | K877: 13 | L877: 8 | M877: =K877*6+L877 -> 86 | O877: 16 | P877: 9 | Q877: =O877*6+P877 -> 105 | S877: TOORAK PARK
A878: CAMBERWELL | C878: 2 | D878: 5 | E878: =C878*6+D878 -> 17 | G878: 3 | H878: 8 | I878: =G878*6+H878 -> 26 | K878: 6 | L878: 11 | M878: =K878*6+L878 -> 47 | O878: 12 | P878: 15 | Q878: =O878*6+P878 -> 87 | S878: TORNEY
A879: BEST PLAYERS
A880: MORDIALLOC | C880: JOHNSTONE | F880: NORRIS | I880: SLADE | L880: WILLIAMS | O880: WALSH | R880: ROSENOW
A881: CAMBERWELL | C881: WALLACE | F881: HOWARD | I881: JUDD | L881: HAZLETT | O881: HAMMOND | R881: ALEXEEF
A882: GOALKICKERS
A883: MORDIALLOC | C883: NORRIS 5 | F883: DEATON 3 | I883: BLOOMFIELD 2 | L883: NEVILLE 2 | N883: DINGLE | P883: SLADE | R883: ROGERSON | U883: SCOTT
A884: CAMBERWELL | C884: HAMMOND 5 | F884: B SMITH 2 | I884: WALLACE 2 | L884: HOWARD | N884: HARROP | P884: HAZLETT
A886: GRAND | E886: 11TH SEPTEMBER | J886: WEATHER
A887: MORDIALLOC | C887: 5 | D887: 5 | E887: =C887*6+D887 -> 35 | G887: 10 | H887: 11 | I887: =G887*6+H887 -> 71 | K887: 12 | L887: 14 | M887: =K887*6+L887 -> 86 | O887: 19 | P887: 19 | Q887: =O887*6+P887 -> 133 | S887: TOORAK PARK
A888: YARRAVILLE | C888: 5 | D888: 2 | E888: =C888*6+D888 -> 32 | G888: 10 | H888: 6 | I888: =G888*6+H888 -> 66 | K888: 11 | L888: 9 | M888: =K888*6+L888 -> 75 | O888: 14 | P888: 11 | Q888: =O888*6+P888 -> 95 | S888: TORNEY
A889: BEST PLAYERS
A890: MORDIALLOC | C890: SLADE | F890: GUY | I890: MILDENHALL | L890: ROSENOW | O890: THOMPSON | R890: SCOTT
A891: YARRAVILLE | C891: PRIEST | F891: SAIT | I891: GIBSON | L891: THORPE | O891: SIMMONS | R891: LOWE
A892: GOALKICKERS
A893: MORDIALLOC | C893: NEVILLE 8 | F893: DEATON 4 | I893: NORRIS 2 | K893: SCOTT 2 | M893: BLOOMFIELD | P893: JOHNSTONE | S893: GUY
A894: YARRAVILLE | C894: GIBSON 4 | F894: GRANDIN 3 | I894: BISSET 3 | K894: WELLINGTON 2 | N894: SAIT | P894: LOWE