A1: Victorian Football Association
A2: Season 1978 - Division One
A3: © Copyright Wal Williams | F3: First created: 28 July 2015
A4: Contact: joywalwi at gmail dot com | F4: Last updated: 1 July 2017 | W4: VFA Results and tables - Link to the main index page
A5: You are free to copy this document in whole or part provided that proper acknowledgement is given to the author. All rights reserved.
A7: 1978 V.F.A. | B7: SEASON 1ST | F7: DIVISION | CA7: \D | CB7: {GOTO}BJ3~/M{RIGHT 7}{END}{DOWN}~G4~
A8: ROUND 1 | E8: 23RD APRIL | J8: WEATHER | N8: FINE | S8: PLAYED AT | CB8: {GOTO}AL3~/M{END}{RIGHT}{END}{DOWN}~P3~
D9: 1ST QTR | H9: 2ND QTR | L9: 3RD QTR | P9: FINAL | S9: PRESTON | CB9: {GOTO}BJ23~/M{RIGHT 7}{END}{DOWN}~V4~
A10: PRESTON | C10: 2 | D10: 2 | E10: =C10*6+D10 -> 14 | G10: 6 | H10: 4 | I10: =G10*6+H10 -> 40 | K10: 10 | L10: 11 | M10: =K10*6+L10 -> 71 | O10: 16 | P10: 13 | Q10: =O10*6+P10 -> 109 | S10: UMPIRE | X10: LADDER | AB10: ROUND | AD10: 1 | CB10: {GOTO}BJ43~/M{RIGHT 7}{END}{DOWN}~G24~
A11: BRUNSWICK | C11: 2 | D11: 4 | E11: =C11*6+D11 -> 16 | G11: 6 | H11: 10 | I11: =G11*6+H11 -> 46 | K11: 10 | L11: 15 | M11: =K11*6+L11 -> 75 | O11: 14 | P11: 17 | Q11: =O11*6+P11 -> 101 | S11: FITZPATRICK | CB11: {GOTO}AL23~/M{END}{RIGHT}{END}{DOWN}~P23~
A12: BEST PLAYERS | W12: TEAM | X12: W | Y12: L | Z12: D | AA12: FOR | AB12: AGST | AC12: % | AD12: PTS | CB12: {GOTO}BJ63~/M{RIGHT 7}{END}{DOWN}~V24~
A13: PRESTON | C13: CARLSON | F13: MARKS | I13: KING | K13: SMITH | N13: MEESE | CB13: {GOTO}BJ83~/M{RIGHT 7}{END}{DOWN}~G44~
A14: BRUNSWICK | C14: ORTON | F14: TOY | I14: NOLAN | K14: GINGELL | N14: LAKER | W14: PORT MELBOURNE | X14: 1 | Y14: 0 | Z14: 0 | AA14: 176 | AB14: 109 | AC14: 161.46788990825689 | AD14: 4 | CB14: {GOTO}AL43~/M{END}{RIGHT}{END}{DOWN}~P43~
A15: GOALKICKERS | W15: PRAHRAN | X15: 1 | Y15: 0 | Z15: 0 | AA15: 146 | AB15: 115 | AC15: 126.95652173913044 | AD15: 4 | CB15: {GOTO}BJ103~/M{RIGHT 7}{END}{DOWN}~V44~
A16: PRESTON | C16: CARLSON 6 | F16: CANN 2 | H16: MARSHALL 2 | K16: MARKS 2 | M16: LORENZINI | O16: SHEPHERD | Q16: WILMOT | S16: ROJO | W16: DANDENONG | X16: 1 | Y16: 0 | Z16: 0 | AA16: 134 | AB16: 110 | AC16: 121.81818181818181 | AD16: 4 | CB16: {GOTO}BJ123~/M{RIGHT 7}{END}{DOWN}~G64~
A17: BRUNSWICK | C17: MARANTELLI 2 | F17: ORTON 2 | H17: CADDY 2 | J17: WEST 2 | L17: SEERY | N17: O'CONNOR | Q17: GINGELL | S17: STONE | U17: TOY | W17: MORDIALLOC | X17: 1 | Y17: 0 | Z17: 0 | AA17: 107 | AB17: 96 | AC17: 111.45833333333333 | AD17: 4 | CB17: {GOTO}AL63~/M{END}{RIGHT}{END}{DOWN}~P63~
R18: SCULLY | CB18: {GOTO}BJ143~/M{RIGHT 7}{END}{DOWN}~V64~
A19: MORDIALLOC | C19: 5 | D19: 3 | E19: =C19*6+D19 -> 33 | G19: 6 | H19: 9 | I19: =G19*6+H19 -> 45 | K19: 11 | L19: 11 | M19: =K19*6+L19 -> 77 | O19: 14 | P19: 23 | Q19: =O19*6+P19 -> 107 | S19: PRINCES PARK | W19: PRESTON | X19: 1 | Y19: 0 | Z19: 0 | AA19: 109 | AB19: 101 | AC19: 107.92079207920793 | AD19: 4 | CB19: {GOTO}BJ163~/M{RIGHT 7}{END}{DOWN}~G84~
A20: CAULFIELD | C20: 5 | D20: 2 | E20: =C20*6+D20 -> 32 | G20: 9 | H20: 12 | I20: =G20*6+H20 -> 66 | K20: 10 | L20: 17 | M20: =K20*6+L20 -> 77 | O20: 13 | P20: 18 | Q20: =O20*6+P20 -> 96 | S20: O'BRIEN | W20: BRUNSWICK | X20: 0 | Y20: 1 | Z20: 0 | AA20: 101 | AB20: 109 | AC20: 92.660550458715591 | AD20: 0 | CB20: {GOTO}AL83~/M{END}{RIGHT}{END}{DOWN}~P83~
A21: BEST PLAYERS | W21: CAULFIELD | X21: 0 | Y21: 1 | Z21: 0 | AA21: 96 | AB21: 107 | AC21: 89.719626168224295 | AD21: 0 | CB21: {GOTO}BJ183~/M{RIGHT 7}{END}{DOWN}~V84~
A22: MORDIALLOC | C22: NORRIS | F22: LANG | I22: CRITCH | L22: SCOTT | N22: WALSH | Q22: ROSENOW | W22: COBURG | X22: 0 | Y22: 1 | Z22: 0 | AA22: 110 | AB22: 134 | AC22: 82.089552238805965 | AD22: 0 | CB22: {GOTO}BJ203~/M{RIGHT 7}{END}{DOWN}~G104~
A23: CAULFIELD | C23: SUTHERLAND | F23: KING | I23: MOORE | L23: ROWE | N23: SIERAKOWSKI | Q23: MAGUIRE | W23: GEELONG WEST | X23: 0 | Y23: 1 | Z23: 0 | AA23: 115 | AB23: 146 | AC23: 78.767123287671239 | AD23: 0 | CB23: {GOTO}AL103~/M{END}{RIGHT}{END}{DOWN}~P103~
A24: GOALKICKERS | W24: SANDRINGHAM | X24: 0 | Y24: 1 | Z24: 0 | AA24: 109 | AB24: 176 | AC24: 61.93181818181818 | AD24: 0 | CB24: {GOTO}BJ223~/M{RIGHT 7}{END}{DOWN}~V104~
A25: MORDIALLOC | C25: NEVILLE 4 | F25: SCOTT 3 | H25: NORRIS 2 | J25: GUY | L25: DEATON | N25: SLADE | P25: MILDENHALL | S25: BOURNE | CB25: {GOTO}BJ243~/M{RIGHT 7}{END}{DOWN}~G124~
A26: CAULFIELD | C26: MOORE 5 | F26: CLIFF 3 | H26: KING 2 | J26: HAWKING 2 | M26: COOK | CB26: {GOTO}AL123~/M{END}{RIGHT}{END}{DOWN}~P123~
CB27: {GOTO}BJ263~/M{RIGHT 7}{END}{DOWN}~V124~
A28: PRAHRAN | C28: 5 | D28: 3 | E28: =C28*6+D28 -> 33 | G28: 8 | H28: 3 | I28: =G28*6+H28 -> 51 | K28: 15 | L28: 10 | M28: =K28*6+L28 -> 100 | O28: 22 | P28: 14 | Q28: =O28*6+P28 -> 146 | S28: TOORAK PARK | CB28: {GOTO}BJ283~/M{RIGHT 7}{END}{DOWN}~G144~
A29: GEELONG WEST | C29: 2 | D29: 3 | E29: =C29*6+D29 -> 15 | G29: 5 | H29: 12 | I29: =G29*6+H29 -> 42 | K29: 12 | L29: 13 | M29: =K29*6+L29 -> 85 | O29: 16 | P29: 19 | Q29: =O29*6+P29 -> 115 | S29: HEDGER | CB29: {GOTO}AL143~/M{END}{RIGHT}{END}{DOWN}~P143~
A30: BEST PLAYERS | CB30: {GOTO}BJ303~/M{RIGHT 7}{END}{DOWN}~V144~
A31: PRAHRAN | C31: JOHNSTON | F31: LITTLE | I31: RUSSELL | L31: KELLY | O31: PEPE | R31: THORNTON | CB31: {GOTO}BJ323~/M{RIGHT 7}{END}{DOWN}~G164~
A32: GEELONG WEST | C32: McKENNA | F32: EDDY | I32: RUSSELL | L32: GILMORE | O32: VILLAROSA | R32: CHAPMAN | CB32: {GOTO}AL163~/M{END}{RIGHT}{END}{DOWN}~P163~
A33: GOALKICKERS | CB33: {GOTO}BJ343~/M{RIGHT 7}{END}{DOWN}~V164~
A34: PRAHRAN | C34: JOHNSTON 9 | F34: SMITH 5 | I34: PREEN 4 | K34: CLARKE 2 | N34: LITTLE | P34: GROSS | CB34: {HOME}
A35: GEELONG WEST | C35: McKENNA 8 | F35: WOOLFE 2 | I35: VILLAROSA 2 | L35: CHAPMAN | N35: HAYDEN | P35: ROE | R35: RADOJEVIC
A37: PORT MELBOURNE | C37: 5 | D37: 5 | E37: =C37*6+D37 -> 35 | G37: 11 | H37: 10 | I37: =G37*6+H37 -> 76 | K37: 18 | L37: 15 | M37: =K37*6+L37 -> 123 | O37: 26 | P37: 20 | Q37: =O37*6+P37 -> 176 | S37: PORT MELBOURNE
A38: SANDRINGHAM | C38: 3 | D38: 2 | E38: =C38*6+D38 -> 20 | G38: 8 | H38: 4 | I38: =G38*6+H38 -> 52 | K38: 12 | L38: 9 | M38: =K38*6+L38 -> 81 | O38: 16 | P38: 13 | Q38: =O38*6+P38 -> 109 | S38: STABB
A39: BEST PLAYERS
A40: PORT MELBOURNE | C40: HAENAN | F40: K GOSS | I40: TREASURE | L40: STIBBARD | O40: RASMUSSEN | R40: CHRISTOU
A41: SANDRINGHAM | C41: BARCLAY | F41: BELL | I41: KENNEDY | L41: ROBERTS-THOMSON | P41: HUNTER | R41: SIMS
A42: GOALKICKERS
A43: PORT MELBOURNE | C43: COOK 6 | E43: CHRISTOU 5 | H43: RASMUSSEN 4 | K43: HAENAN 3 | N43: HARLAND 2 | Q43: K GOSS 2 | S43: AANENSEN | V43: TREASURE | X43: JEFFRIES | Z43: P GOSS
A44: SANDRINGHAM | C44: GIAMPAOLO 3 | F44: O'BRIEN 3 | I44: FRANKLIN 2 | L44: KENNEDY 2 | O44: BELL 2 | Q44: HUNTER | S44: CLARK | U44: GILES | W44: HUTCHINSON
A46: DANDENONG | C46: 3 | D46: 7 | E46: =C46*6+D46 -> 25 | G46: 9 | H46: 9 | I46: =G46*6+H46 -> 63 | K46: 15 | L46: 12 | M46: =K46*6+L46 -> 102 | O46: 20 | P46: 14 | Q46: =O46*6+P46 -> 134 | S46: DANDENONG
A47: COBURG | C47: 2 | D47: 0 | E47: =C47*6+D47 -> 12 | G47: 5 | H47: 4 | I47: =G47*6+H47 -> 34 | K47: 10 | L47: 7 | M47: =K47*6+L47 -> 67 | O47: 16 | P47: 14 | Q47: =O47*6+P47 -> 110 | S47: WENN
A48: BEST PLAYERS
A49: DANDENONG | C49: ROSS | F49: ELLIS | I49: LUKAS | L49: WRIGHT | O49: DROSCHER | R49: TAYLOR
A50: COBURG | C50: BEATTIE | F50: MANNIX | I50: BURT | L50: PITT | O50: BREEN
A51: GOALKICKERS
A52: DANDENONG | C52: WRIGHT 6 | F52: REID 3 | H52: ELLIS 3 | J52: GUY 3 | L52: TAYLOR 2 | N52: THOMPSON | Q52: McCONNELL | T52: ROSS
A53: COBURG | C53: R SMITH 4 | F53: P McODNALD 3 | J53: WILSON 2 | M53: HODGETTS 2 | P53: CLEARY | R53: MANNIX | U53: PRICE | W53: HERBERT | X53: BEATTIE
A55: ROUND 2 | E55: 30TH APRIL | J55: WEATHER | S55: PLAYED AT
D56: 1ST QTR | H56: 2ND QTR | L56: 3RD QTR | P56: FINAL | S56: MORDIALLOC
A57: MORDIALLOC | C57: 7 | D57: 4 | E57: =C57*6+D57 -> 46 | G57: 13 | H57: 4 | I57: =G57*6+H57 -> 82 | K57: 19 | L57: 7 | M57: =K57*6+L57 -> 121 | O57: 22 | P57: 9 | Q57: =O57*6+P57 -> 141 | S57: UMPIRE | X57: LADDER | AB57: ROUND | AD57: 2
A58: PRESTON | C58: 3 | D58: 3 | E58: =C58*6+D58 -> 21 | G58: 9 | H58: 9 | I58: =G58*6+H58 -> 63 | K58: 13 | L58: 10 | M58: =K58*6+L58 -> 88 | O58: 21 | P58: 14 | Q58: =O58*6+P58 -> 140 | S58: HEDGER
A59: BEST PLAYERS | W59: TEAM | X59: W | Y59: L | Z59: D | AA59: FOR | AB59: AGST | AC59: % | AD59: PTS
A60: MORDIALLOC | C60: DEATON | F60: MILDENHALL | I60: WILLIAMSON | L60: SLADE | N60: WALSH | Q60: JOHNSTON
A61: PRESTON | C61: MARTIN | F61: MARKS | I61: DURWOOD | L61: WILMOT | N61: G SMITH | Q61: JESSOP | W61: PORT MELBOURNE | X61: 2 | Y61: 0 | Z61: 0 | AA61: 303 | AB61: 215 | AC61: 140.93023255813952 | AD61: 8
A62: GOALKICKERS | W62: MORDIALLOC | X62: 2 | Y62: 0 | Z62: 0 | AA62: 248 | AB62: 236 | AC62: 105.08474576271186 | AD62: 8
A63: MORDIALLOC | C63: DEATON 7 | F63: NEVILLE 6 | I63: MILDENHALL 4 | L63: GUY 2 | N63: NORRIS 2 | Q63: WILLIAMSON | W63: BRUNSWICK | X63: 1 | Y63: 1 | Z63: 0 | AA63: 235 | AB63: 212 | AC63: 110.84905660377359 | AD63: 4
A64: PRESTON | C64: GONSALVES 6 | F64: MARKS 4 | I64: G SMITH 3 | L64: MARTIN 2 | N64: BOLGER | P64: CANN | R64: MEESE | T64: CARLSON | W64: GEELONG WEST | X64: 1 | Y64: 1 | Z64: 0 | AA64: 277 | AB64: 251 | AC64: 110.35856573705179 | AD64: 4
N65: LORENZINI | Q65: SHEPHERD
A66: BRUNSWICK | C66: 6 | D66: 7 | E66: =C66*6+D66 -> 43 | G66: 10 | H66: 14 | I66: =G66*6+H66 -> 74 | K66: 16 | L66: 19 | M66: =K66*6+L66 -> 115 | O66: 19 | P66: 20 | Q66: =O66*6+P66 -> 134 | S66: BRUNSWICK | W66: PRESTON | X66: 1 | Y66: 1 | Z66: 0 | AA66: 249 | AB66: 242 | AC66: 102.89256198347107 | AD66: 4
A67: DANDENONG | C67: 3 | D67: 7 | E67: =C67*6+D67 -> 25 | G67: 8 | H67: 10 | I67: =G67*6+H67 -> 58 | K67: 10 | L67: 12 | M67: =K67*6+L67 -> 72 | O67: 14 | P67: 19 | Q67: =O67*6+P67 -> 103 | S67: OAKLEY | W67: DANDENONG | X67: 1 | Y67: 1 | Z67: 0 | AA67: 237 | AB67: 244 | AC67: 97.131147540983605 | AD67: 4
A68: BEST PLAYERS | W68: SANDRINGHAM | X68: 1 | Y68: 1 | Z68: 0 | AA68: 263 | AB68: 271 | AC68: 97.047970479704802 | AD68: 4
A69: BRUNSWICK | C69: WEST | F69: VALENTINE | I69: NOLAN | L69: LAKER | N69: DELL | Q69: ORTON | W69: PRAHRAN | X69: 1 | Y69: 1 | Z69: 0 | AA69: 241 | AB69: 269 | AC69: 89.591078066914491 | AD69: 4
A70: DANDENONG | C70: SHINNERS | F70: GUY | I70: ROSS | L70: REID | N70: ALLAN | Q70: GOODES | W70: COBURG | X70: 0 | Y70: 2 | Z70: 0 | AA70: 216 | AB70: 261 | AC70: 82.758620689655174 | AD70: 0
A71: GOALKICKERS | W71: CAULFIELD | X71: 0 | Y71: 2 | Z71: 0 | AA71: 201 | AB71: 269 | AC71: 74.721189591078073 | AD71: 0
A72: BRUNSWICK | C72: SEERY 4 | E72: ORTON 3 | G72: DE BOER 3 | I72: STONE 3 | K72: HARVEY 2 | M72: NOLAN | O72: MARANTELLI | R72: VALENTINE | U72: WEST
A73: DANDENONG | C73: SHINNERS 4 | F73: GUY 3 | H73: ALLAN 3 | J73: BRIESE 2 | M73: REID 2
A75: GEELONG WEST | C75: 5 | D75: 2 | E75: =C75*6+D75 -> 32 | G75: 12 | H75: 8 | I75: =G75*6+H75 -> 80 | K75: 19 | L75: 15 | M75: =K75*6+L75 -> 129 | O75: 24 | P75: 18 | Q75: =O75*6+P75 -> 162 | S75: GEELONG WEST
A76: CAULFIELD | C76: 7 | D76: 2 | E76: =C76*6+D76 -> 44 | G76: 9 | H76: 3 | I76: =G76*6+H76 -> 57 | K76: 12 | L76: 9 | M76: =K76*6+L76 -> 81 | O76: 15 | P76: 15 | Q76: =O76*6+P76 -> 105 | S76: STABB
A77: BEST PLAYERS
A78: GEELONG WEST | C78: McKENNA | F78: HINDSON | I78: WOOLFE | L78: RUSSELL | O78: YATES | R78: FRIEND
A79: CAULFIELD | C79: ROWE | F79: HUNT | I79: BALL | L79: TROTT | O79: SUTHERLAND | R79: MAGUIRE
A80: GOALKICKERS
A81: GEELONG WEST | C81: McKENNA 11 | F81: WOOLFE 5 | I81: RADOJEVIC 4 | L81: PARSONS | N81: FAGAN | P81: VILLAROSA | S81: HINDSON
A82: CAULFIELD | C82: ROWE 4 | F82: MAGUIRE 4 | I82: O'SULLIVAN 2 | L82: CLIFF | N82: SUTHERLAND | Q82: LESTER | S82: MOORE | U82: SMITH
A84: PORT MELBOURNE | C84: 5 | D84: 2 | E84: =C84*6+D84 -> 32 | G84: 7 | H84: 12 | I84: =G84*6+H84 -> 54 | K84: 10 | L84: 17 | M84: =K84*6+L84 -> 77 | O84: 18 | P84: 19 | Q84: =O84*6+P84 -> 127 | S84: COBURG
A85: COBURG | C85: 6 | D85: 6 | E85: =C85*6+D85 -> 42 | G85: 9 | H85: 7 | I85: =G85*6+H85 -> 61 | K85: 14 | L85: 10 | M85: =K85*6+L85 -> 94 | O85: 15 | P85: 16 | Q85: =O85*6+P85 -> 106 | S85: FITZPATRICK
A86: BEST PLAYERS
A87: PORT MELBOURNE | C87: STIBBARD | F87: RASMUSSEN | I87: CHRISTOU | L87: P GOSS | O87: AANENSEN | R87: BEECROFT
A88: COBURG | C88: PRICE | F88: SMITH | I88: BEATTIE | L88: ROBERTSON | O88: CLEARY
A89: GOALKICKERS
A90: PORT MELBOURNE | C90: RASMUSSEN 4 | F90: COOK 4 | H90: HARLAND 3 | K90: HAENAN 3 | M90: CHRISTOU | P90: G ALLEN | R90: STIBBARD | U90: TREASURE
A91: COBURG | C91: SMITH 7 | F91: WILSON 2 | I91: MANNIX 2 | L91: CLEARY | N91: McDONALD | Q91: CHIODO | S91: BEATTIE
A93: SANDRINGHAM | C93: 6 | D93: 6 | E93: =C93*6+D93 -> 42 | G93: 7 | H93: 16 | I93: =G93*6+H93 -> 58 | K93: 12 | L93: 22 | M93: =K93*6+L93 -> 94 | O93: 21 | P93: 28 | Q93: =O93*6+P93 -> 154 | S93: BEACH ROAD
A94: PRAHRAN | C94: 3 | D94: 2 | E94: =C94*6+D94 -> 20 | G94: 10 | H94: 6 | I94: =G94*6+H94 -> 66 | K94: 11 | L94: 13 | M94: =K94*6+L94 -> 79 | O94: 13 | P94: 17 | Q94: =O94*6+P94 -> 95 | S94: WENN
A95: BEST PLAYERS
A96: SANDRINGHAM | C96: SIMS | F96: CLARK | I96: BARCLAY | L96: GIAMPAOLO | O96: ROBERTS-THOMSON
A97: PRAHRAN | C97: PEPE | F97: LITTLE | I97: THORNTON | L97: McGUINNESS | O97: SMITH
A98: GOALKICKERS
A99: SANDRINGHAM | C99: SIMS 6 | E99: GIAMPAOLO 5 | H99: GILES 4 | J99: CLARK 2 | M99: HUTCHINSON 2 | P99: McNICHOLAS | S99: BELL
A100: PRAHRAN | C100: K SMITH 6 | F100: JOHNSTON 3 | I100: CLARKE 2 | L100: THORNTON | O100: McGUINNESS
A102: ROUND 3 | E102: 7TH MAY | J102: WEATHER | N102: FINE | S102: PLAYED AT
D103: 1ST QTR | H103: 2ND QTR | L103: 3RD QTR | P103: FINAL | S103: MORDIALLOC
A104: BRUNSWICK | C104: 3 | D104: 2 | E104: =C104*6+D104 -> 20 | G104: 9 | H104: 8 | I104: =G104*6+H104 -> 62 | K104: 12 | L104: 11 | M104: =K104*6+L104 -> 83 | O104: 15 | P104: 14 | Q104: =O104*6+P104 -> 104 | S104: UMPIRE | X104: LADDER | AB104: ROUND | AD104: 3
A105: MORDIALLOC | C105: 2 | D105: 3 | E105: =C105*6+D105 -> 15 | G105: 4 | H105: 6 | I105: =G105*6+H105 -> 30 | K105: 7 | L105: 11 | M105: =K105*6+L105 -> 53 | O105: 9 | P105: 15 | Q105: =O105*6+P105 -> 69 | S105: GROOM
A106: BEST PLAYERS | W106: TEAM | X106: W | Y106: L | Z106: D | AA106: FOR | AB106: AGST | AC106: % | AD106: PTS
A107: BRUNSWICK | C107: CADDY | F107: NOLAN | I107: HARVEY | L107: WEST | O107: O'CONNOR | R107: ORTON
A108: MORDIALLOC | C108: NORRIS | F108: WILLIAMSON | I108: DEATON | L108: THOMPSON | O108: SCOTT | R108: SLADE | W108: PORT MELBOURNE | X108: 3 | Y108: 0 | Z108: 0 | AA108: 456 | AB108: 358 | AC108: 127.37430167597765 | AD108: 12
A109: GOALKICKERS | W109: SANDRINGHAM | X109: 2 | Y109: 1 | Z109: 0 | AA109: 425 | AB109: 333 | AC109: 127.62762762762763 | AD109: 8
A110: BRUNSWICK | C110: ORTON 4 | E110: TOY 4 | G110: CADDY 2 | I110: DE BOER | K110: O'CONNOR | M110: VALENTINE | P110: LAWRENCE | S110: LEWIS | W110: BRUNSWICK | X110: 2 | Y110: 1 | Z110: 0 | AA110: 339 | AB110: 281 | AC110: 120.64056939501779 | AD110: 8
A111: MORDIALLOC | C111: NORRIS 4 | F111: DEATON | H111: WILLIAMSON | K111: NEVILLE | M111: SCOTT | O111: ROGERSON | W111: GEELONG WEST | X111: 2 | Y111: 1 | Z111: 0 | AA111: 416 | AB111: 384 | AC111: 108.33333333333333 | AD111: 8
A113: GEELONG WEST | C113: 2 | D113: 3 | E113: =C113*6+D113 -> 15 | G113: 12 | H113: 5 | I113: =G113*6+H113 -> 77 | K113: 15 | L113: 7 | M113: =K113*6+L113 -> 97 | O113: 21 | P113: 13 | Q113: =O113*6+P113 -> 139 | S113: PRESTON | W113: PRAHRAN | X113: 2 | Y113: 1 | Z113: 0 | AA113: 336 | AB113: 348 | AC113: 96.551724137931032 | AD113: 8
A114: PRESTON | C114: 7 | D114: 7 | E114: =C114*6+D114 -> 49 | G114: 10 | H114: 13 | I114: =G114*6+H114 -> 73 | K114: 15 | L114: 19 | M114: =K114*6+L114 -> 109 | O114: 19 | P114: 19 | Q114: =O114*6+P114 -> 133 | S114: WENN | W114: MORDIALLOC | X114: 2 | Y114: 1 | Z114: 0 | AA114: 317 | AB114: 340 | AC114: 93.235294117647058 | AD114: 8
A115: BEST PLAYERS | W115: PRESTON | X115: 1 | Y115: 2 | Z115: 0 | AA115: 382 | AB115: 381 | AC115: 100.26246719160105 | AD115: 4
A116: GEELONG WEST | C116: HINDSON | F116: WOOLFE | I116: GILMORE | L116: RUSSELL | O116: FRIEND | W116: DANDENONG | X116: 1 | Y116: 2 | Z116: 0 | AA116: 380 | AB116: 397 | AC116: 95.71788413098237 | AD116: 4
A117: PRESTON | C117: WILMOT | F117: JESSOP | I117: CARLSON | L117: MARKS | O117: BOLGER | R117: TOWAN | W117: COBURG | X117: 0 | Y117: 3 | Z117: 0 | AA117: 295 | AB117: 356 | AC117: 82.865168539325836 | AD117: 0
A118: GOALKICKERS | O118: CHAPMAN | R118: GILMORE | W118: CAULFIELD | X118: 0 | Y118: 3 | Z118: 0 | AA118: 263 | AB118: 431 | AC118: 61.02088167053364 | AD118: 0
A119: GEELONG WEST | C119: McKENNA 4 | F119: WOOLFE 4 | I119: HOVEY 3 | K119: STENNETT 2 | N119: PARSONS 2 | Q119: FAGAN 2 | S119: STOKES | U119: HINDSON
A120: PRESTON | C120: CARLSON 5 | F120: JESSOP 5 | I120: WILMOT 4 | L120: GONSALVES | O120: MARKS | Q120: CANN
A122: PORT MELBOURNE | C122: 2 | D122: 5 | E122: =C122*6+D122 -> 17 | G122: 11 | H122: 11 | I122: =G122*6+H122 -> 77 | K122: 15 | L122: 17 | M122: =K122*6+L122 -> 107 | O122: 22 | P122: 21 | Q122: =O122*6+P122 -> 153 | S122: PORT MELBOURNE
A123: DANDENONG | C123: 9 | D123: 3 | E123: =C123*6+D123 -> 57 | G123: 12 | H123: 5 | I123: =G123*6+H123 -> 77 | K123: 18 | L123: 13 | M123: =K123*6+L123 -> 121 | O123: 21 | P123: 17 | Q123: =O123*6+P123 -> 143 | S123: HEDGER
A124: BEST PLAYERS
A125: PORT MELBOURNE | C125: AANENSEN | F125: ALLEN | I125: COOK | L125: HARLAND | O125: IVANOFF | R125: BOND
A126: DANDENONG | C126: SHINNERS | F126: BRIESE | I126: HIBBERT | L126: ELLIS | O126: ROSS | R126: HORAZCKO
A127: GOALKICKERS
A128: PORT MELBOURNE | C128: COOK 8 | E128: RASMUSSEN 3 | H128: HARLAND 3 | K128: TREASURE 2 | N128: AANENSEN 2 | Q128: CHRISTOU 2 | T128: G ALLEN | W128: IVANOFF
A129: DANDENONG | C129: BRIESE 5 | E129: REID 4 | G129: GUY 3 | I129: ELLIS 2 | K129: ALLAN 2 | M129: SHINNERS 2 | P129: PRENDERGAST 2 | T129: WRIGHT
A131: PRAHRAN | C131: 3 | D131: 8 | E131: =C131*6+D131 -> 26 | G131: 6 | H131: 12 | I131: =G131*6+H131 -> 48 | K131: 8 | L131: 13 | M131: =K131*6+L131 -> 61 | O131: 13 | P131: 17 | Q131: =O131*6+P131 -> 95 | S131: TOORAK PARK
A132: COBURG | C132: 3 | D132: 0 | E132: =C132*6+D132 -> 18 | G132: 8 | H132: 3 | I132: =G132*6+H132 -> 51 | K132: 10 | L132: 5 | M132: =K132*6+L132 -> 65 | O132: 12 | P132: 7 | Q132: =O132*6+P132 -> 79 | S132: O'BRIEN
A133: BEST PLAYERS
A134: PRAHRAN | C134: PREEN | F134: PEPE | I134: ANDERSON | L134: McGUINNESS | O134: KEKOVICH | R134: TAYLOR
A135: COBURG | C135: BURT | F135: BEATTIE | I135: PITT | L135: HERBERT
A136: GOALKICKERS
A137: PRAHRAN | C137: SMITH 3 | F137: ANDERSON 3 | I137: JOHNSTON 2 | L137: CLARKE | N137: LITTLE | P137: AUSTIN | R137: McGUINNESS | U137: TAYLOR
A138: COBURG | C138: HERBERT 4 | F138: BEATTIE 2 | I138: McDONALD | L138: NOONAN | N138: CLEARY | P138: WILSON | R138: BURT | T138: DOHNT
A140: SANDRINGHAM | C140: 8 | D140: 6 | E140: =C140*6+D140 -> 54 | G140: 11 | H140: 7 | I140: =G140*6+H140 -> 73 | K140: 18 | L140: 13 | M140: =K140*6+L140 -> 121 | O140: 24 | P140: 18 | Q140: =O140*6+P140 -> 162 | S140: PRINCES PARK
A141: CAULFIELD | C141: 0 | D141: 1 | E141: =C141*6+D141 -> 1 | G141: 4 | H141: 3 | I141: =G141*6+H141 -> 27 | K141: 8 | L141: 5 | M141: =K141*6+L141 -> 53 | O141: 9 | P141: 8 | Q141: =O141*6+P141 -> 62 | S141: MATTHEWS
A142: BEST PLAYERS
A143: SANDRINGHAM | C143: CLARK | F143: KENNEDY | I143: ROBERTSON | L143: PLEDGER | O143: HUNTER
A144: CAULFIELD | C144: BALL | F144: HAWKING | I144: HOLDEN | L144: TROTT | O144: HUNT | R144: COOK
A145: GOALKICKERS
A146: SANDRINGHAM | C146: HUTCHINSON 5 | F146: BELL 3 | H146: KENNEDY 3 | K146: HUNTER 3 | M146: CLARK 3 | O146: PLEDGER 2 | Q146: GILES | R146: SIMS | T146: LYONS | V146: GIAMPAOLO
A147: CAULFIELD | C147: TROTT 3 | F147: MOORE 2 | I147: AMBLER | K147: BOOTH | M147: SUTHERLAND | P147: LESTER
A149: ROUND 4 | E149: 14TH MAY | J149: WEATHER | S149: PLAYED AT
D150: 1ST QTR | H150: 2ND QTR | L150: 3RD QTR | P150: FINAL | S150: BRUNSWICK
A151: PORT MELBOURNE | C151: 5 | D151: 6 | E151: =C151*6+D151 -> 36 | G151: 8 | H151: 6 | I151: =G151*6+H151 -> 54 | K151: 10 | L151: 12 | M151: =K151*6+L151 -> 72 | O151: 18 | P151: 13 | Q151: =O151*6+P151 -> 121 | S151: UMPIRE | X151: LADDER | AB151: ROUND | AD151: 4
A152: BRUNSWICK | C152: 3 | D152: 3 | E152: =C152*6+D152 -> 21 | G152: 3 | H152: 7 | I152: =G152*6+H152 -> 25 | K152: 10 | L152: 12 | M152: =K152*6+L152 -> 72 | O152: 13 | P152: 18 | Q152: =O152*6+P152 -> 96 | S152: O'BRIEN
A153: BEST PLAYERS | W153: TEAM | X153: W | Y153: L | Z153: D | AA153: FOR | AB153: AGST | AC153: % | AD153: PTS
A154: PORT MELBOURNE | C154: AANENSEN | F154: BOND | I154: CHRISTOU | L154: IVANOFF | O154: RASMUSSEN | R154: P GOSS
A155: BRUNSWICK | C155: NOLAN | F155: ORTON | I155: LAWRENCE | L155: TOY | O155: HARVEY | R155: GINGELL | W155: PORT MELBOURNE | X155: 4 | Y155: 0 | Z155: 0 | AA155: 577 | AB155: 454 | AC155: 127.09 | AD155: 16
A156: GOALKICKERS | Q156: HARLAND | W156: GEELONG WEST | X156: 3 | Y156: 1 | Z156: 0 | AA156: 538 | AB156: 505 | AC156: 106.53465346534654 | AD156: 12
A157: PORT MELBOURNE | C157: HAENAN 4 | F157: RASMUSSEN 4 | I157: COOK 3 | K157: CHRISTOU 2 | N157: P GOSS 2 | P157: BOND | R157: AANENSEN | W157: PRAHRAN | X157: 3 | Y157: 1 | Z157: 0 | AA157: 458 | AB157: 445 | AC157: 102.92134831460675 | AD157: 12
A158: BRUNSWICK | C158: ORTON 6 | F158: GINGELL 2 | I158: SEERY 2 | K158: TOY | M158: CADDY | W158: SANDRINGHAM | X158: 2 | Y158: 2 | Z158: 0 | AA158: 544 | AB158: 459 | AC158: 118.51851851851852 | AD158: 8
A160: GEELONG WEST | C160: 5 | D160: 5 | E160: =C160*6+D160 -> 35 | G160: 9 | H160: 6 | I160: =G160*6+H160 -> 60 | K160: 16 | L160: 12 | M160: =K160*6+L160 -> 108 | O160: 18 | P160: 14 | Q160: =O160*6+P160 -> 122 | S160: GEELONG WEST | W160: BRUNSWICK | X160: 2 | Y160: 2 | Z160: 0 | AA160: 435 | AB160: 402 | AC160: 108.21 | AD160: 8
A161: MORDIALLOC | C161: 3 | D161: 6 | E161: =C161*6+D161 -> 24 | G161: 10 | H161: 9 | I161: =G161*6+H161 -> 69 | K161: 12 | L161: 10 | M161: =K161*6+L161 -> 82 | O161: 18 | P161: 13 | Q161: =O161*6+P161 -> 121 | S161: SNOOKS | W161: PRESTON | X161: 2 | Y161: 2 | Z161: 0 | AA161: 508 | AB161: 500 | AC161: 101.6 | AD161: 8
A162: BEST PLAYERS | W162: MORDIALLOC | X162: 2 | Y162: 2 | Z162: 0 | AA162: 438 | AB162: 462 | AC162: 94.805194805194802 | AD162: 8
A163: GEELONG WEST | C163: GILMORE | F163: YATES | I163: PARSONS | L163: RUSSELL | O163: STENNETT | R163: FAGAN | W163: COBURG | X163: 1 | Y163: 3 | Z163: 0 | AA163: 481 | AB163: 463 | AC163: 103.88768898488121 | AD163: 4
A164: MORDIALLOC | C164: SCOTT | F164: JUDSON | I164: SLADE | L164: CRITCH | O164: NEVILLE | R164: JOHNSTON | W164: DANDENONG | X164: 1 | Y164: 3 | Z164: 0 | AA164: 477 | AB164: 519 | AC164: 91.907514450867055 | AD164: 4
A165: GOALKICKERS | R165: WOOLFE | W165: CAULFIELD | X165: 0 | Y165: 4 | Z165: 0 | AA165: 370 | AB165: 617 | AC165: 59.967585089141004 | AD165: 0
A166: GEELONG WEST | C166: RADOJEVIC 4 | F166: FAGAN 3 | H166: STENNETT 3 | K166: PARSONS 3 | N166: McKENNA 2 | Q166: CHAPMAN | S166: GILMORE
A167: MORDIALLOC | C167: NEVILLE 9 | F167: NORRIS 3 | I167: SCOTT 2 | K167: DAVIDSON | N167: DINGLE | P167: WILLIAMSON | S167: DEATON
A169: PRAHRAN | C169: 6 | D169: 2 | E169: =C169*6+D169 -> 38 | G169: 9 | H169: 5 | I169: =G169*6+H169 -> 59 | K169: 14 | L169: 7 | M169: =K169*6+L169 -> 91 | O169: 18 | P169: 14 | Q169: =O169*6+P169 -> 122 | S169: DANDENONG
A170: DANDENONG | C170: 4 | D170: 6 | E170: =C170*6+D170 -> 30 | G170: 8 | H170: 8 | I170: =G170*6+H170 -> 56 | K170: 12 | L170: 10 | M170: =K170*6+L170 -> 82 | O170: 14 | P170: 13 | Q170: =O170*6+P170 -> 97 | S170: FITZPATRICK
A171: BEST PLAYERS
A172: PRAHRAN | C172: JOHNSTON | F172: ROD KELLY | J172: KENT | L172: LITTLE | N172: PEPE | Q172: KEKOVICH
A173: DANDENONG | C173: GOODES | F173: PRENDERGAST | J173: ELLIS | L173: LUKAS | N173: TAYLOR | Q173: DISTON
A174: GOALKICKERS
A175: PRAHRAN | C175: JOHNSTON 8 | F175: SMITH 4 | I175: ANDERSON 2 | L175: LITTLE | N175: KEKOVICH | Q175: KENT | R175: RAE
A176: DANDENONG | C176: PRENDERGAST 5 | F176: DISTON 4 | I176: TAYLOR 2 | L176: ELLIS 2 | N176: REID
A178: COBURG | C178: 4 | D178: 7 | E178: =C178*6+D178 -> 31 | G178: 14 | H178: 10 | I178: =G178*6+H178 -> 94 | K178: 18 | L178: 13 | M178: =K178*6+L178 -> 121 | O178: 28 | P178: 18 | Q178: =O178*6+P178 -> 186 | S178: COBURG
A179: CAULFIELD | C179: 4 | D179: 2 | E179: =C179*6+D179 -> 26 | G179: 7 | H179: 5 | I179: =G179*6+H179 -> 47 | K179: 11 | L179: 8 | M179: =K179*6+L179 -> 74 | O179: 16 | P179: 11 | Q179: =O179*6+P179 -> 107 | S179: WILSON
A180: BEST PLAYERS
A181: COBURG | C181: BEATTIE | F181: NOONAN | I181: BREEN | L181: ROBERTSON | O181: HERBERT | R181: MILROY
A182: CAULFIELD | C182: ROWE | F182: TAYLOR | I182: TROTT | L182: O'SULLIVAN | O182: ALDRIDGE | R182: CRUSE
A183: GOALKICKERS
A184: COBURG | C184: NOONAN 6 | F184: MILROY 5 | I184: BEATTIE 5 | L184: ROBERTSON 3 | O184: MANNIX 3 | R184: CLEARY 2 | U184: HERBERT (2) | Y184: BURT | AA184: HARTIGAN
A185: CAULFIELD | C185: O'SULLIVAN 4 | F185: HUNT 3 | H185: CLIFF 2 | J185: HOLDEN 2 | M185: ROWE | O185: HAWKING | Q185: ALDRIDGE | S185: KING | U185: SUTHERLAND | X185: MAGUIRE
A187: PRESTON | C187: 6 | D187: 6 | E187: =C187*6+D187 -> 42 | G187: 10 | H187: 12 | I187: =G187*6+H187 -> 72 | K187: 14 | L187: 13 | M187: =K187*6+L187 -> 97 | O187: 18 | P187: 18 | Q187: =O187*6+P187 -> 126 | S187: BEACH ROAD
A188: SANDRINGHAM | C188: 1 | D188: 7 | E188: =C188*6+D188 -> 13 | G188: 6 | H188: 10 | I188: =G188*6+H188 -> 46 | K188: 12 | L188: 13 | M188: =K188*6+L188 -> 85 | O188: 17 | P188: 17 | Q188: =O188*6+P188 -> 119 | S188: OAKLEY
A189: BEST PLAYERS
A190: PRESTON | C190: DURWOOD | F190: McCONNELL | I190: LORENZINI | L190: McCULLOCH | O190: MARTIN | R190: CARLSON
A191: SANDRINGHAM | C191: ROBERTSON | F191: ROBERTS-THOMSON | K191: GILES
A192: GOALKICKERS
A193: PRESTON | C193: GONSALVES 5 | F193: CARLSON 4 | I193: CANN 3 | K193: MARKS 3 | M193: JESSOP 2 | O193: LORENZINI
A194: SANDRINGHAM | C194: GILES 5 | E194: KENNEDY 4 | H194: LYONS 2 | J194: SIMS 2 | L194: PLEDGER 2 | O194: GIAMPAOLO | R194: HUTCHINSON
A196: ROUND 5 | E196: 21ST MAY | J196: WEATHER | S196: PLAYED AT
D197: 1ST QTR | H197: 2ND QTR | L197: 3RD QTR | P197: FINAL | S197: BRUNSWICK
A198: SANDRINGHAM | C198: 4 | D198: 4 | E198: =C198*6+D198 -> 28 | G198: 9 | H198: 6 | I198: =G198*6+H198 -> 60 | K198: 14 | L198: 8 | M198: =K198*6+L198 -> 92 | O198: 18 | P198: 10 | Q198: =O198*6+P198 -> 118 | S198: UMPIRE | X198: LADDER | AB198: ROUND | AD198: 5
A199: BRUNSWICK | C199: 3 | D199: 3 | E199: =C199*6+D199 -> 21 | G199: 8 | H199: 5 | I199: =G199*6+H199 -> 53 | K199: 12 | L199: 10 | M199: =K199*6+L199 -> 82 | O199: 14 | P199: 18 | Q199: =O199*6+P199 -> 102 | S199: HEDGER
A200: BEST PLAYERS | W200: TEAM | X200: W | Y200: L | Z200: D | AA200: FOR | AB200: AGST | AC200: % | AD200: PTS
A201: SANDRINGHAM | C201: LYONS | E201: SIMS | H201: GIAMPAOLO | K201: ROBERTSON | N201: KENNEDY | Q201: ROBERTS-THOMSON
A202: BRUNSWICK | C202: CADDY | E202: GINGELL | H202: DELEDIO | K202: TOY | N202: NOLAN | Q202: O'CONNOR | W202: PORT MELBOURNE | X202: 4 | Y202: 1 | Z202: 0 | AA202: 658 | AB202: 561 | AC202: 117.29 | AD202: 16
A203: GOALKICKERS | P203: T O'BRIEN | R203: HUTCHINSON | W203: SANDRINGHAM | X203: 3 | Y203: 2 | Z203: 0 | AA203: 662 | AB203: 561 | AC203: 118.00356506238859 | AD203: 12
A204: SANDRINGHAM | C204: KENNEDY 3 | F204: GIAMPAOLO 3 | I204: FRANKLIN 3 | L204: GILES 2 | N204: SIMS 2 | P204: LYONS | R204: ADAMS | T204: MILLER | W204: PRESTON | X204: 3 | Y204: 2 | Z204: 0 | AA204: 615 | AB204: 581 | AC204: 105.85197934595524 | AD204: 12
A205: BRUNSWICK | C205: SEERY 3 | E205: ORTON 2 | G205: GINGELL 2 | I205: WEST 2 | K205: O'CONNOR | M205: HARVEY | O205: CROTTY | Q205: TOY | R205: HADZILLIAS | W205: PRAHRAN | X205: 3 | Y205: 2 | Z205: 0 | AA205: 591 | AB205: 590 | AC205: 100.16949152542372 | AD205: 12
A207: PRESTON | C207: 4 | D207: 2 | E207: =C207*6+D207 -> 26 | G207: 8 | H207: 4 | I207: =G207*6+H207 -> 52 | K207: 13 | L207: 6 | M207: =K207*6+L207 -> 84 | O207: 16 | P207: 11 | Q207: =O207*6+P207 -> 107 | S207: PRESTON | W207: GEELONG WEST | X207: 3 | Y207: 2 | Z207: 0 | AA207: 640 | AB207: 642 | AC207: 99.688473520249218 | AD207: 12
A208: PORT MELBOURNE | C208: 3 | D208: 4 | E208: =C208*6+D208 -> 22 | G208: 4 | H208: 6 | I208: =G208*6+H208 -> 30 | K208: 9 | L208: 13 | M208: =K208*6+L208 -> 67 | O208: 11 | P208: 15 | Q208: =O208*6+P208 -> 81 | S208: STABB | W208: COBURG | X208: 2 | Y208: 3 | Z208: 0 | AA208: 618 | AB208: 565 | AC208: 109.38053097345133 | AD208: 8
A209: BEST PLAYERS | W209: BRUNSWICK | X209: 2 | Y209: 3 | Z209: 0 | AA209: 537 | AB209: 520 | AC209: 103.27 | AD209: 8
A210: PRESTON | C210: MARKS | F210: DURWOOD | I210: ROJO | L210: MARTIN | O210: CARLSON | R210: McCULLOCH | W210: MORDIALLOC | X210: 2 | Y210: 3 | Z210: 0 | AA210: 536 | AB210: 566 | AC210: 94.699646643109546 | AD210: 8
A211: PORT MELBOURNE | C211: ALLEN | F211: IVANOFF | I211: PROFFIT | W211: DANDENONG | X211: 2 | Y211: 3 | Z211: 0 | AA211: 581 | AB211: 617 | AC211: 94.165316045380877 | AD211: 8
A212: GOALKICKERS | W212: CAULFIELD | X212: 1 | Y212: 4 | Z212: 0 | AA212: 515 | AB212: 750 | AC212: 68.666666666666671 | AD212: 4
A213: PRESTON | C213: GONSALVES 4 | F213: CARLSON 3 | I213: CANN 3 | K213: MARKS 3 | M213: LORENZINI | P213: MARSHALL | R213: RINGIN
A214: PORT MELBOURNE | C214: COOK 3 | E214: HAENAN 2 | H214: LOWE | J214: CHRISTOU | M214: AANENSEN | O214: BOND | Q214: P GOSS | S214: TREASURE
A216: DANDENONG | C216: 2 | D216: 3 | E216: =C216*6+D216 -> 15 | G216: 8 | H216: 9 | I216: =G216*6+H216 -> 57 | K216: 10 | L216: 13 | M216: =K216*6+L216 -> 73 | O216: 15 | P216: 14 | Q216: =O216*6+P216 -> 104 | S216: MORDIALLOC
A217: MORDIALLOC | C217: 6 | D217: 1 | E217: =C217*6+D217 -> 37 | G217: 8 | H217: 4 | I217: =G217*6+H217 -> 52 | K217: 10 | L217: 7 | M217: =K217*6+L217 -> 67 | O217: 14 | P217: 14 | Q217: =O217*6+P217 -> 98 | S217: MATTHEWS
A218: BEST PLAYERS
A219: DANDENONG | C219: HIBBERT | F219: GUY | I219: BRIESE | L219: DISTON | O219: ROSS | Q219: DROSCHER
A220: MORDIALLOC | C220: DEATON | F220: JUDSON | I220: NORRIS | L220: CRITCH | O220: SCOTT | Q220: TURNER
A221: GOALKICKERS
A222: DANDENONG | C222: ROSS 3 | E222: BRIESE 3 | G222: PRENDERGAST 3 | J222: DISTON 2 | M222: REID | N222: HIBBERT | P222: GUY | Q222: WRIGHT
A223: MORDIALLOC | C223: NEVILLE 5 | F223: DEATON 4 | I223: NORRIS 3 | K223: ROGERSON | N223: SLADE
A225: COBURG | C225: 4 | D225: 6 | E225: =C225*6+D225 -> 30 | G225: 10 | H225: 13 | I225: =G225*6+H225 -> 73 | K225: 16 | L225: 17 | M225: =K225*6+L225 -> 113 | O225: 19 | P225: 23 | Q225: =O225*6+P225 -> 137 | S225: GEELONG WEST
A226: GEELONG WEST | C226: 3 | D226: 3 | E226: =C226*6+D226 -> 21 | G226: 8 | H226: 7 | I226: =G226*6+H226 -> 55 | K226: 11 | L226: 10 | M226: =K226*6+L226 -> 76 | O226: 15 | P226: 12 | Q226: =O226*6+P226 -> 102 | S226: GROOM
A227: BEST PLAYERS
A228: COBURG | C228: BEATTIE | F228: HURST | I228: MILROY | L228: BURT | O228: HARTIGAN
A229: GEELONG WEST | C229: MIDDLEMISS | F229: HINDSON | I229: YATES | L229: GILMORE | O229: PARSONS
A230: GOALKICKERS
A231: COBURG | C231: HERBERT 3 | F231: MANNIX 3 | I231: MILROY 3 | K231: DOHNT 2 | M231: BEATTIE 2 | O231: NOONAN 2 | R231: BURT | T231: HARTIGAN | W231: HURST | X231: CLEARY
A232: GEELONG WEST | C232: McKENNA 6 | F232: MIDDLEMISS 4 | J232: PARSONS 3 | M232: GILMORE | O232: RADOJEVIC
A234: CAULFIELD | C234: 6 | D234: 4 | E234: =C234*6+D234 -> 40 | G234: 9 | H234: 8 | I234: =G234*6+H234 -> 62 | K234: 16 | L234: 11 | M234: =K234*6+L234 -> 107 | O234: 22 | P234: 13 | Q234: =O234*6+P234 -> 145 | S234: PRINCES PARK
A235: PRAHRAN | C235: 5 | D235: 6 | E235: =C235*6+D235 -> 36 | G235: 9 | H235: 13 | I235: =G235*6+H235 -> 67 | K235: 15 | L235: 17 | M235: =K235*6+L235 -> 107 | O235: 19 | P235: 19 | Q235: =O235*6+P235 -> 133 | S235: SNOOKS
A236: BEST PLAYERS
A237: CAULFIELD | C237: M TAYLOR | F237: TROTT | I237: COOK | L237: SMITH | O237: ROWE | R237: FRIGO
A238: PRAHRAN | C238: KEKOVICH | F238: HEVERIN | I238: McGUINNESS | L238: JOHNSTON | O238: P TAYLOR
A239: GOALKICKERS
A240: CAULFIELD | C240: TROTT 4 | F240: MOORE 4 | I240: SMITH 4 | K240: COOK 3 | M240: SUTHERLAND 3 | P240: D TAYLOR 2 | S240: ROWE | U240: O'SULLIVAN
A241: PRAHRAN | C241: KEKOVICH 6 | F241: JOHNSTON 4 | I241: P TAYLOR 2 | L241: LITTLE 2 | N241: CLARKE | P241: PREEN | R241: WALL | T241: ANDERSON | W241: McGUINNESS
A243: ROUND 6 | E243: 28TH MAY | J243: WEATHER | N243: NORTH WEST WIND | S243: PLAYED AT
D244: 1ST QTR | H244: 2ND QTR | L244: 3RD QTR | P244: FINAL | S244: TOORAK PARK
A245: PRAHRAN | C245: 5 | D245: 4 | E245: =C245*6+D245 -> 34 | G245: 8 | H245: 9 | I245: =G245*6+H245 -> 57 | K245: 13 | L245: 10 | M245: =K245*6+L245 -> 88 | O245: 21 | P245: 15 | Q245: =O245*6+P245 -> 141 | S245: UMPIRE | X245: LADDER | AB245: ROUND | AD245: 6
A246: PRESTON | C246: 3 | D246: 4 | E246: =C246*6+D246 -> 22 | G246: 12 | H246: 12 | I246: =G246*6+H246 -> 84 | K246: 17 | L246: 18 | M246: =K246*6+L246 -> 120 | O246: 20 | P246: 21 | Q246: =O246*6+P246 -> 141 | S246: HEDGER
A247: BEST PLAYERS | W247: TEAM | X247: W | Y247: L | Z247: D | AA247: FOR | AB247: AGST | AC247: % | AD247: PTS
A248: PRAHRAN | C248: SMITH | F248: DWYER | I248: RAE | K248: TAYLOR | N248: ANDERSON | Q248: JOHNSTON
A249: PRESTON | C249: MARKS | F249: JESSOP | I249: ROJO | K249: MARSHALL | N249: DURWOOD | Q249: TOWAN | W249: PORT MELBOURNE | X249: 5 | Y249: 1 | Z249: 0 | AA249: 798 | AB249: 650 | AC249: 122.77 | AD249: 20
A250: GOALKICKERS | O250: PEPE | Q250: ANDERSON | W250: SANDRINGHAM | X250: 4 | Y250: 2 | Z250: 0 | AA250: 749 | AB250: 647 | AC250: 115.76506955177743 | AD250: 16
A251: PRAHRAN | C251: SMITH 7 | E251: PREEN 3 | G251: JOHNSTON 2 | J251: RAE 2 | L251: THORNTON 2 | O251: DWYER | Q251: AUSTIN | S251: KEKOVICH | W251: PRESTON | X251: 3 | Y251: 2 | Z251: 1 | AA251: 756 | AB251: 722 | AC251: 104.70914127423822 | AD251: 14
A252: PRESTON | C252: MARKS 6 | E252: GONSALVES 4 | H252: LORENZINI 3 | K252: DURWOOD 2 | N252: ROJO | P252: CARLSON | R252: CANN | T252: RINGIN | W252: PRAHRAN | X252: 3 | Y252: 2 | Z252: 1 | AA252: 732 | AB252: 731 | AC252: 100.13679890560876 | AD252: 14
P253: JESSOP
A254: SANDRINGHAM | C254: 5 | D254: 5 | E254: =C254*6+D254 -> 35 | G254: 6 | H254: 7 | I254: =G254*6+H254 -> 43 | K254: 9 | L254: 11 | M254: =K254*6+L254 -> 65 | O254: 12 | P254: 15 | Q254: =O254*6+P254 -> 87 | S254: COBURG | W254: DANDENONG | X254: 3 | Y254: 3 | Z254: 0 | AA254: 715 | AB254: 711 | AC254: 100.56258790436006 | AD254: 12
A255: COBURG | C255: 1 | D255: 3 | E255: =C255*6+D255 -> 9 | G255: 6 | H255: 12 | I255: =G255*6+H255 -> 48 | K255: 9 | L255: 16 | M255: =K255*6+L255 -> 70 | O255: 11 | P255: 20 | Q255: =O255*6+P255 -> 86 | S255: STABB | W255: GEELONG WEST | X255: 3 | Y255: 3 | Z255: 0 | AA255: 734 | AB255: 776 | AC255: 94.587628865979383 | AD255: 12
A256: BEST PLAYERS | W256: COBURG | X256: 2 | Y256: 4 | Z256: 0 | AA256: 704 | AB256: 652 | AC256: 107.97546012269939 | AD256: 8
A257: SANDRINGHAM | C257: FRANKLIN | F257: SIMS | I257: ROBERTS-THOMSON | M257: GILMORE | O257: ROBERTSON | R257: CLARK | W257: BRUNSWICK | X257: 2 | Y257: 4 | Z257: 0 | AA257: 634 | AB257: 621 | AC257: 102.09 | AD257: 8
A258: COBURG | C258: COLLEY | F258: BURT | I258: PITT | M258: BREEN | O258: HURST | R258: HERBERT | W258: MORDIALLOC | X258: 2 | Y258: 4 | Z258: 0 | AA258: 625 | AB258: 706 | AC258: 88.526912181303118 | AD258: 8
A259: GOALKICKERS | W259: CAULFIELD | X259: 2 | Y259: 4 | Z259: 0 | AA259: 616 | AB259: 847 | AC259: 72.727272727272734 | AD259: 8
A260: SANDRINGHAM | C260: FRANKLIN 4 | F260: GILES 2 | H260: PLEDGER | J260: KENNEDY | L260: MANNIX | N260: GILMORE | P260: HUNTER | R260: ADAMS
A261: COBURG | C261: HERBERT 3 | F261: BURT | H261: HARTIGAN | K261: HURST | M261: CLEARY | O261: NOONAN | Q261: MILROY | S261: MANNIX | U261: BEATTIE
A263: CAULFIELD | C263: 2 | D263: 11 | E263: =C263*6+D263 -> 23 | G263: 4 | H263: 15 | I263: =G263*6+H263 -> 39 | K263: 10 | L263: 19 | M263: =K263*6+L263 -> 79 | O263: 13 | P263: 23 | Q263: =O263*6+P263 -> 101 | S263: PRINCES PARK
A264: BRUNSWICK | C264: 2 | D264: 6 | E264: =C264*6+D264 -> 18 | G264: 7 | H264: 11 | I264: =G264*6+H264 -> 53 | K264: 9 | L264: 12 | M264: =K264*6+L264 -> 66 | O264: 13 | P264: 19 | Q264: =O264*6+P264 -> 97 | S264: WENN
A265: BEST PLAYERS
A266: CAULFIELD | C266: HAWKING | F266: HUNT | I266: ROWE | L266: SUTHERLAND | O266: SUTTIE | R266: TAYLOR
A267: BRUNSWICK | C267: GINGELL | F267: TOY | I267: O'SHANNESSY | L267: NOLAN | O267: DELEDIO
A268: GOALKICKERS
A269: CAULFIELD | C269: SUTHERLAND 3 | F269: MOORE 3 | I269: TROTT 2 | K269: ROWE 2 | M269: SMITH 2 | O269: COOK
A270: BRUNSWICK | C270: GINGELL 4 | F270: WEST | H270: CADDY | J270: ORTON | L270: TOY | M270: WARDEN | O270: HARVEY | Q270: VALENTINE | T270: O'CONNOR | W270: SEERY
A272: DANDENONG | C272: 0 | D272: 0 | E272: =C272*6+D272 -> 0 | G272: 7 | H272: 8 | I272: =G272*6+H272 -> 50 | K272: 10 | L272: 9 | M272: =K272*6+L272 -> 69 | O272: 20 | P272: 14 | Q272: =O272*6+P272 -> 134 | S272: DANDENONG
A273: GEELONG WEST | C273: 6 | D273: 6 | E273: =C273*6+D273 -> 42 | G273: 7 | H273: 6 | I273: =G273*6+H273 -> 48 | K273: 11 | L273: 8 | M273: =K273*6+L273 -> 74 | O273: 14 | P273: 10 | Q273: =O273*6+P273 -> 94 | S273: O'BRIEN
A274: BEST PLAYERS
A275: DANDENONG | C275: LUKAS | F275: SHINNERS | I275: TAYLOR | L275: HORAZCKO | O275: ELLIS | R275: ROSS
A276: GEELONG WEST | C276: WOOLFE | F276: VILLAROSA | I276: GILMORE | L276: MIDDLEMISS | O276: YATES
A277: GOALKICKERS
A278: DANDENONG | C278: ELLIS 5 | E278: REID 4 | G278: DISTON 3 | I278: SHINNERS 2 | L278: ROSS 2 | N278: GOODES | P278: THOMPSON | R278: GUY | T278: HIBBERT
A279: GEELONG WEST | C279: WOOLFE 7 | F279: McKENNA 2 | I279: MIDDLEMISS 2 | L279: FAGAN | N279: VILLAROSA | Q279: HOVEY
A281: PORT MELBOURNE | C281: 3 | D281: 1 | E281: =C281*6+D281 -> 19 | G281: 10 | H281: 6 | I281: =G281*6+H281 -> 66 | K281: 14 | L281: 8 | M281: =K281*6+L281 -> 92 | O281: 21 | P281: 14 | Q281: =O281*6+P281 -> 140 | S281: PORT MELBOURNE
A282: MORDIALLOC | C282: 4 | D282: 3 | E282: =C282*6+D282 -> 27 | G282: 5 | H282: 5 | I282: =G282*6+H282 -> 35 | K282: 8 | L282: 13 | M282: =K282*6+L282 -> 61 | O282: 12 | P282: 17 | Q282: =O282*6+P282 -> 89 | S282: GROOM
A283: BEST PLAYERS
A284: PORT MELBOURNE | C284: K GOSS | F284: P GOSS | I284: IVANOFF | L284: WHARTON | O284: AANENSEN | R284: COOK
A285: MORDIALLOC | C285: DEATON | F285: SCOTT | I285: BURNS | L285: WILLIAMSON | O285: JOHNSTON | R285: CRITCH
A286: GOALKICKERS
A287: PORT MELBOURNE | C287: COOK 8 | E287: BYRNE 3 | G287: P GOSS 2 | I287: PAGAN 2 | K287: K GOSS 2 | M287: HAENAN | O287: LOWE | Q287: WHARTON | T287: AANENSEN
A288: MORDIALLOC | C288: JOHNSTON 3 | F288: NORRIS 2 | I288: BARDOEL | K288: SCOTT | M288: TURNER | O288: SIGNORETTI | R288: NEVILLE | U288: WILLIAMSON | X288: DEATON
A290: ROUND 7 | E290: 11TH JUNE | J290: WEATHER | N290: WEST WIND DULL COLD | S290: PLAYED AT
D291: 1ST QTR | H291: 2ND QTR | L291: 3RD QTR | P291: FINAL | S291: BEACH ROAD
A292: DANDENONG | C292: 7 | D292: 5 | E292: =C292*6+D292 -> 47 | G292: 10 | H292: 6 | I292: =G292*6+H292 -> 66 | K292: 14 | L292: 9 | M292: =K292*6+L292 -> 93 | O292: 15 | P292: 13 | Q292: =O292*6+P292 -> 103 | S292: UMPIRE | X292: LADDER | AB292: ROUND | AD292: 7
A293: SANDRINGHAM | C293: 2 | D293: 2 | E293: =C293*6+D293 -> 14 | G293: 9 | H293: 8 | I293: =G293*6+H293 -> 62 | K293: 11 | L293: 12 | M293: =K293*6+L293 -> 78 | O293: 14 | P293: 16 | Q293: =O293*6+P293 -> 100 | S293: OAKLEY
A294: BEST PLAYERS | W294: TEAM | X294: W | Y294: L | Z294: D | AA294: FOR | AB294: AGST | AC294: % | AD294: PTS
A295: DANDENONG | C295: DROSCHER | F295: ROSS | H295: TOWNSEND | K295: TAYLOR | M295: SHINNERS | Q295: BRIESE
A296: SANDRINGHAM | C296: GIAMPAOLO | F296: SIMS | H296: HUTCHINSON | K296: GILES | M296: ROBERTS-THOMSON | Q296: ROBERTSON | W296: PORT MELBOURNE | X296: 6 | Y296: 1 | Z296: 0 | AA296: 892 | AB296: 719 | AC296: 124.06 | AD296: 24
A297: GOALKICKERS | W297: PRESTON | X297: 4 | Y297: 2 | Z297: 1 | AA297: 853 | AB297: 808 | AC297: 105.56930693069307 | AD297: 18
A298: DANDENONG | C298: ROSS 5 | E298: TOWNSEND 5 | H298: BRIESE | J298: TAYLOR | L298: SHINNERS | N298: ELLIS | P298: REID | W298: PRAHRAN | X298: 4 | Y298: 2 | Z298: 1 | AA298: 834 | AB298: 830 | AC298: 100.48192771084338 | AD298: 18
A299: SANDRINGHAM | C299: GILES 3 | E299: PLEDGER 2 | H299: HUTCHINSON 2 | K299: FRANKLIN 2 | N299: GILMORE 2 | Q299: SIMS | R299: KENNEDY | W299: SANDRINGHAM | X299: 4 | Y299: 3 | Z299: 0 | AA299: 849 | AB299: 750 | AC299: 113.2 | AD299: 16
R300: ADAMS
A301: PORT MELBOURNE | C301: 3 | D301: 8 | E301: =C301*6+D301 -> 26 | G301: 4 | H301: 15 | I301: =G301*6+H301 -> 39 | K301: 7 | L301: 19 | M301: =K301*6+L301 -> 61 | O301: 12 | P301: 22 | Q301: =O301*6+P301 -> 94 | S301: GEELONG WEST | W301: DANDENONG | X301: 4 | Y301: 3 | Z301: 0 | AA301: 818 | AB301: 811 | AC301: 100.86313193588163 | AD301: 16
A302: GEELONG WEST | C302: 2 | D302: 2 | E302: =C302*6+D302 -> 14 | G302: 6 | H302: 5 | I302: =G302*6+H302 -> 41 | K302: 8 | L302: 5 | M302: =K302*6+L302 -> 53 | O302: 10 | P302: 9 | Q302: =O302*6+P302 -> 69 | S302: WILSON | W302: BRUNSWICK | X302: 3 | Y302: 4 | Z302: 0 | AA302: 717 | AB302: 695 | AC302: 103.17 | AD302: 12
A303: BEST PLAYERS | W303: GEELONG WEST | X303: 3 | Y303: 4 | Z303: 0 | AA303: 803 | AB303: 870 | AC303: 92.298850574712645 | AD303: 12
A304: PORT MELBOURNE | C304: IVANOFF | F304: STIBBARD | I304: PAGAN | L304: RASMUSSEN | O304: AANENSEN | R304: HARLAND | W304: COBURG | X304: 2 | Y304: 5 | Z304: 0 | AA304: 778 | AB304: 735 | AC304: 105.85034013605443 | AD304: 8
A305: GEELONG WEST | C305: VILLAROSA | F305: BEEKOF | I305: PARSONS | L305: McKENNA | O305: SMITH | R305: FRIEND | W305: MORDIALLOC | X305: 2 | Y305: 5 | Z305: 0 | AA305: 724 | AB305: 808 | AC305: 89.603960396039611 | AD305: 8
A306: GOALKICKERS | W306: CAULFIELD | X306: 2 | Y306: 5 | Z306: 0 | AA306: 702 | AB306: 944 | AC306: 74.36440677966101 | AD306: 8
A307: PORT MELBOURNE | C307: COOK 4 | E307: WHARTON 2 | H307: PAGAN | J307: CRITCH | L307: KERR | N307: RASMUSSEN | Q307: K GOSS | S307: BYRNE
A308: GEELONG WEST | C308: McKENNA 7 | F308: HINDSON | I308: McGILLIVRAY | L308: WOOLFE
A310: BRUNSWICK | C310: 4 | D310: 4 | E310: =C310*6+D310 -> 28 | G310: 7 | H310: 5 | I310: =G310*6+H310 -> 47 | K310: 10 | L310: 5 | M310: =K310*6+L310 -> 65 | O310: 12 | P310: 11 | Q310: =O310*6+P310 -> 83 | S310: BRUNSWICK
A311: COBURG | C311: 3 | D311: 1 | E311: =C311*6+D311 -> 19 | G311: 6 | H311: 6 | I311: =G311*6+H311 -> 42 | K311: 8 | L311: 9 | M311: =K311*6+L311 -> 57 | O311: 10 | P311: 14 | Q311: =O311*6+P311 -> 74 | S311: MATTHEWS
A312: BEST PLAYERS
A313: BRUNSWICK | C313: CADDY | F313: LAWRENCE | I313: BUCKLEY | L313: ORTON | O313: STAEHR | R313: NOLAN
A314: COBURG | C314: MILROY | F314: LAIDLER | I314: SMITH | L314: BURT | O314: MCDONALD
A315: GOALKICKERS
A316: BRUNSWICK | C316: CADDY 4 | F316: HARVEY 3 | I316: GINGELL 2 | L316: LAWRENCE 2 | O316: ORTON
A317: COBURG | C317: SMITH 6 | F317: CLEARY 2 | I317: WESCOMBE | L317: LLOYD
A319: PRAHRAN | C319: 3 | D319: 2 | E319: =C319*6+D319 -> 20 | G319: 6 | H319: 5 | I319: =G319*6+H319 -> 41 | K319: 9 | L319: 8 | M319: =K319*6+L319 -> 62 | O319: 15 | P319: 12 | Q319: =O319*6+P319 -> 102 | S319: MORDIALLOC
A320: MORDIALLOC | C320: 3 | D320: 1 | E320: =C320*6+D320 -> 19 | G320: 7 | H320: 6 | I320: =G320*6+H320 -> 48 | K320: 13 | L320: 8 | M320: =K320*6+L320 -> 86 | O320: 15 | P320: 9 | Q320: =O320*6+P320 -> 99 | S320: STABB
A321: BEST PLAYERS
A322: PRAHRAN | C322: ANDERSON | F322: DWYER | I322: FOLEY | L322: THORNTON | O322: SMITH | R322: AUSTIN
A323: MORDIALLOC | C323: JUDSON | F323: BURNS | I323: BARDOEL | L323: JOHNSTON | O323: ROSENOW | R323: NORRIS
A324: GOALKICKERS
A325: PRAHRAN | C325: SMITH 6 | F325: DWYER 3 | I325: FOLEY 2 | L325: KEKOVICH | O325: JOHNSTON | R325: AUSTIN | T325: RAE
A326: MORDIALLOC | C326: NEVILLE 4 | F326: NORRIS 4 | I326: DEATON 2 | L326: BARROT | N326: JOHNSTON | Q326: SABBATUCCI | T326: BARDOEL | W326: SCOTT
A328: PRESTON | C328: 6 | D328: 2 | E328: =C328*6+D328 -> 38 | G328: 6 | H328: 5 | I328: =G328*6+H328 -> 41 | K328: 12 | L328: 11 | M328: =K328*6+L328 -> 83 | O328: 14 | P328: 13 | Q328: =O328*6+P328 -> 97 | S328: PRESTON
A329: CAULFIELD | C329: 2 | D329: 2 | E329: =C329*6+D329 -> 14 | G329: 7 | H329: 8 | I329: =G329*6+H329 -> 50 | K329: 10 | L329: 10 | M329: =K329*6+L329 -> 70 | O329: 12 | P329: 14 | Q329: =O329*6+P329 -> 86 | S329: McBAIN
A330: BEST PLAYERS
A331: PRESTON | C331: MARTIN | F331: McCONNELL | I331: RENWICK | L331: JESSOP | O331: KING
A332: CAULFIELD | C332: TAYLOR | F332: HUNT | I332: TROTT | L332: O'SULLIVAN | O332: COOK
A333: GOALKICKERS
A334: PRESTON | C334: CARLSON 4 | F334: GONSALVES 4 | I334: MARKS 3 | L334: MARSHALL | N334: MARTIN | P334: RENWICK
A335: CAULFIELD | C335: COOK 3 | F335: SMITH 3 | I335: TROTT 2 | K335: SUTHERLAND | N335: MOORE | P335: KING | R335: ALDRIDGE
A337: ROUND 8 | E337: 18TH JUNE | J337: WEATHER | N337: STRONG SOUTH EAST WIND | S337: PLAYED AT
D338: 1ST QTR | H338: 2ND QTR | L338: 3RD QTR | P338: FINAL | S338: TOORAK PARK
A339: PORT MELBOURNE | C339: 7 | D339: 3 | E339: =C339*6+D339 -> 45 | G339: 7 | H339: 5 | I339: =G339*6+H339 -> 47 | K339: 13 | L339: 8 | M339: =K339*6+L339 -> 86 | O339: 16 | P339: 11 | Q339: =O339*6+P339 -> 107 | S339: UMPIRE | X339: LADDER | AB339: ROUND | AD339: 8
A340: PRAHRAN | C340: 1 | D340: 1 | E340: =C340*6+D340 -> 7 | G340: 8 | H340: 7 | I340: =G340*6+H340 -> 55 | K340: 11 | L340: 11 | M340: =K340*6+L340 -> 77 | O340: 15 | P340: 16 | Q340: =O340*6+P340 -> 106 | S340: WENN
A341: BEST PLAYERS | W341: TEAM | X341: W | Y341: L | Z341: D | AA341: FOR | AB341: AGST | AC341: % | AD341: PTS
A342: PORT MELBOURNE | C342: HAENAN | F342: WHARTON | I342: P GOSS | K342: IVANOFF | N342: STIBBARD | Q342: PROFFIT
A343: PRAHRAN | C343: ANDERSON | F343: PEPE | I343: KELLY | K343: JOHNSTON | N343: DWYER | Q343: AUSTIN | W343: PORT MELBOURNE | X343: 7 | Y343: 1 | Z343: 0 | AA343: 999 | AB343: 825 | AC343: 121.09 | AD343: 28
A344: GOALKICKERS | W344: PRESTON | X344: 5 | Y344: 2 | Z344: 1 | AA344: 954 | AB344: 903 | AC344: 105.64784053156146 | AD344: 22
A345: PORT MELBOURNE | C345: COOK 4 | E345: PAGAN 2 | G345: P GOSS 2 | I345: K GOSS 2 | K345: RASMUSSEN 2 | N345: WHARTON 2 | Q345: BECKWITH | S345: HARLAND | W345: SANDRINGHAM | X345: 5 | Y345: 3 | Z345: 0 | AA345: 987 | AB345: 849 | AC345: 116.25441696113074 | AD345: 20
A346: PRAHRAN | C346: SMITH 4 | F346: JOHNSTON 4 | I346: DWYER 3 | K346: TAYLOR 2 | N346: KEKOVICH | Q346: PEPE | W346: PRAHRAN | X346: 4 | Y346: 3 | Z346: 1 | AA346: 940 | AB346: 937 | AC346: 100.32017075773746 | AD346: 18
A348: GEELONG WEST | C348: 3 | D348: 1 | E348: =C348*6+D348 -> 19 | G348: 5 | H348: 4 | I348: =G348*6+H348 -> 34 | K348: 10 | L348: 7 | M348: =K348*6+L348 -> 67 | O348: 13 | P348: 11 | Q348: =O348*6+P348 -> 89 | S348: BRUNSWICK | W348: DANDENONG | X348: 4 | Y348: 4 | Z348: 0 | AA348: 918 | AB348: 958 | AC348: 95.824634655532364 | AD348: 16
A349: BRUNSWICK | C349: 5 | D349: 8 | E349: =C349*6+D349 -> 38 | G349: 10 | H349: 9 | I349: =G349*6+H349 -> 69 | K349: 11 | L349: 12 | M349: =K349*6+L349 -> 78 | O349: 12 | P349: 14 | Q349: =O349*6+P349 -> 86 | S349: SNOOKS | W349: GEELONG WEST | X349: 4 | Y349: 4 | Z349: 0 | AA349: 892 | AB349: 956 | AC349: 93.305439330543933 | AD349: 16
A350: BEST PLAYERS | W350: BRUNSWICK | X350: 3 | Y350: 5 | Z350: 0 | AA350: 803 | AB350: 784 | AC350: 102.42 | AD350: 12
A351: GEELONG WEST | C351: YATES | F351: WOOLFE | I351: PARSONS | L351: HANNAN | O351: SCALE | R351: CHAPMAN | W351: CAULFIELD | X351: 3 | Y351: 5 | Z351: 0 | AA351: 849 | AB351: 1044 | AC351: 81.321839080459768 | AD351: 12
A352: BRUNSWICK | C352: DELEDIO | F352: BUCKLEY | I352: GINGELL | L352: CADDY | O352: O'SHANNESSY | W352: COBURG | X352: 2 | Y352: 6 | Z352: 0 | AA352: 873 | AB352: 836 | AC352: 104.42583732057416 | AD352: 8
A353: GOALKICKERS | W353: MORDIALLOC | X353: 2 | Y353: 6 | Z353: 0 | AA353: 823 | AB353: 946 | AC353: 86.997885835095133 | AD353: 8
A354: GEELONG WEST | C354: McKENNA 4 | F354: FAGAN 3 | I354: RADOJEVIC 2 | L354: WOOLFE 2 | O354: BEEKOF | Q354: PARSONS
A355: BRUNSWICK | C355: CADDY 3 | F355: STONE 3 | I355: WARDEN 2 | L355: GINGELL | N355: WEST | O355: ORTON | Q355: TOY
A357: PRESTON | C357: 2 | D357: 1 | E357: =C357*6+D357 -> 13 | G357: 7 | H357: 4 | I357: =G357*6+H357 -> 46 | K357: 8 | L357: 12 | M357: =K357*6+L357 -> 60 | O357: 14 | P357: 17 | Q357: =O357*6+P357 -> 101 | S357: PRESTON
A358: COBURG | C358: 5 | D358: 4 | E358: =C358*6+D358 -> 34 | G358: 8 | H358: 7 | I358: =G358*6+H358 -> 55 | K358: 12 | L358: 11 | M358: =K358*6+L358 -> 83 | O358: 14 | P358: 11 | Q358: =O358*6+P358 -> 95 | S358: OAKLEY
A359: BEST PLAYERS
A360: PRESTON | C360: MARSHALL | F360: MARTIN | I360: MARKS | L360: McCONNELL | O360: BOLGER
A361: COBURG | C361: BURT | F361: COLLINS | I361: LAIDLER | L361: DOHNT | O361: MILROY
A362: GOALKICKERS
A363: PRESTON | C363: SALTMARSH 3 | F363: MARSHALL 3 | I363: MARKS 2 | K363: GONSALVES 2 | N363: RINGIN | P363: CARLSON | R363: LORENZINI | U363: RENWICK
A364: COBURG | C364: SMITH 5 | F364: CLEARY 3 | I364: McMILLAN | K364: DOHNT | M364: BURT | N364: WILSON | P364: HARTIGAN | R364: LLOYD
A366: SANDRINGHAM | C366: 5 | D366: 1 | E366: =C366*6+D366 -> 31 | G366: 9 | H366: 3 | I366: =G366*6+H366 -> 57 | K366: 16 | L366: 8 | M366: =K366*6+L366 -> 104 | O366: 21 | P366: 12 | Q366: =O366*6+P366 -> 138 | S366: MORDIALLOC
A367: MORDIALLOC | C367: 3 | D367: 5 | E367: =C367*6+D367 -> 23 | G367: 10 | H367: 12 | I367: =G367*6+H367 -> 72 | K367: 12 | L367: 16 | M367: =K367*6+L367 -> 88 | O367: 13 | P367: 21 | Q367: =O367*6+P367 -> 99 | S367: WILSON
A368: BEST PLAYERS
A369: SANDRINGHAM | C369: SIMS | F369: GILES | I369: MILLER | L369: GIAMPAOLO | O369: HUTCHINSON
A370: MORDIALLOC | C370: BURNS | F370: WILLIAMSON | I370: BARDOEL | L370: SCOTT | O370: SLADE | R370: SIGNORETTI
A371: GOALKICKERS
A372: SANDRINGHAM | C372: GILES 6 | E372: HUTCHINSON 4 | H372: MILLER 3 | J372: LYONS 2 | L372: GILMORE 2 | O372: DEAGAN | Q372: KENNEDY | S372: SIMS | U372: PLEDGER
A373: MORDIALLOC | C373: WILLIAMSON 3 | F373: ROGERSON 2 | I373: BARDOEL 2 | L373: NORRIS | N373: WALSH | P373: BLOOMFIELD | S373: JOHNSTON | V373: NEVILLE | X373: SLADE
A375: CAULFIELD | C375: 4 | D375: 4 | E375: =C375*6+D375 -> 28 | G375: 11 | H375: 7 | I375: =G375*6+H375 -> 73 | K375: 17 | L375: 14 | M375: =K375*6+L375 -> 116 | O375: 22 | P375: 15 | Q375: =O375*6+P375 -> 147 | S375: PRINCES PARK
A376: DANDENONG | C376: 1 | D376: 2 | E376: =C376*6+D376 -> 8 | G376: 3 | H376: 7 | I376: =G376*6+H376 -> 25 | K376: 5 | L376: 9 | M376: =K376*6+L376 -> 39 | O376: 14 | P376: 16 | Q376: =O376*6+P376 -> 100 | S376: GROOM
A377: BEST PLAYERS
A378: CAULFIELD | C378: KING | F378: HAYWOOD | J378: ROWE | L378: FRIGO | N378: COOK | Q378: ADAMS
A379: DANDENONG | C379: TAYLOR | F379: McCONNELL | J379: BRIESE | L379: ROSS | N379: SHEVLIN
A380: GOALKICKERS
A381: CAULFIELD | C381: MOORE 5 | E381: KING 5 | G381: O'SULLIVAN 3 | J381: TROTT 2 | L381: TAYLOR 2 | N381: HOLDEN 2 | Q381: FRIGO | S381: ALDRIDGE | V381: ROWE
A382: DANDENONG | C382: ROSS 5 | F382: TAYLOR 4 | I382: BRIESE 2 | K382: GUY | M382: TOWNSEND | P382: HIBBERT
A384: ROUND 9 | E384: 25TH JUNE | J384: WEATHER | N384: SOUTH WIND | S384: PLAYED AT
D385: 1ST QTR | H385: 2ND QTR | L385: 3RD QTR | P385: FINAL | S385: DANDENONG
A386: PRESTON | C386: 5 | D386: 5 | E386: =C386*6+D386 -> 35 | G386: 15 | H386: 13 | I386: =G386*6+H386 -> 103 | K386: 18 | L386: 13 | M386: =K386*6+L386 -> 121 | O386: 20 | P386: 18 | Q386: =O386*6+P386 -> 138 | S386: UMPIRE | X386: LADDER | AB386: ROUND | AD386: 9
A387: DANDENONG | C387: 7 | D387: 2 | E387: =C387*6+D387 -> 44 | G387: 14 | H387: 6 | I387: =G387*6+H387 -> 90 | K387: 15 | L387: 10 | M387: =K387*6+L387 -> 100 | O387: 20 | P387: 14 | Q387: =O387*6+P387 -> 134 | S387: WENN
A388: BEST PLAYERS | W388: TEAM | X388: W | Y388: L | Z388: D | AA388: FOR | AB388: AGST | AC388: % | AD388: PTS
A389: PRESTON | C389: BOLGER | F389: WALSH | I389: MARTIN | L389: LORENZINI | O389: MARSHALL | R389: MARKS
A390: DANDENONG | C390: GUY | F390: TAYLOR | I390: SHEVLIN | L390: McCONNELL | O390: HORAZCKO | W390: PORT MELBOURNE | X390: 7 | Y390: 2 | Z390: 0 | AA390: 1094 | AB390: 965 | AC390: 113.37 | AD390: 28
A391: GOALKICKERS | W391: PRESTON | X391: 6 | Y391: 2 | Z391: 1 | AA391: 1092 | AB391: 1037 | AC391: 105.30376084860174 | AD391: 26
A392: PRESTON | C392: SALTMARSH 4 | F392: GONSALVES 4 | I392: MARKS 4 | K392: MARSHALL 2 | N392: LORENZINI 2 | Q392: MARTIN 2 | S392: JESSOP 2 | W392: SANDRINGHAM | X392: 5 | Y392: 4 | Z392: 0 | AA392: 1091 | AB392: 978 | AC392: 111.55419222903886 | AD392: 20
A393: DANDENONG | C393: BRIESE 5 | E393: PRENDERGAST 5 | H393: TAYLOR 4 | J393: HIBBERT 2 | M393: TOWNSEND 2 | P393: LYNN | R393: DISTON | W393: GEELONG WEST | X393: 5 | Y393: 4 | Z393: 0 | AA393: 1021 | AB393: 1060 | AC393: 96.320754716981128 | AD393: 20
A395: GEELONG WEST | C395: 4 | D395: 3 | E395: =C395*6+D395 -> 27 | G395: 6 | H395: 9 | I395: =G395*6+H395 -> 45 | K395: 11 | L395: 13 | M395: =K395*6+L395 -> 79 | O395: 19 | P395: 15 | Q395: =O395*6+P395 -> 129 | S395: BEACH ROAD | W395: PRAHRAN | X395: 4 | Y395: 4 | Z395: 1 | AA395: 1037 | AB395: 1061 | AC395: 97.737983034872755 | AD395: 18
A396: SANDRINGHAM | C396: 6 | D396: 7 | E396: =C396*6+D396 -> 43 | G396: 10 | H396: 9 | I396: =G396*6+H396 -> 69 | K396: 12 | L396: 13 | M396: =K396*6+L396 -> 85 | O396: 14 | P396: 20 | Q396: =O396*6+P396 -> 104 | S396: GROOM | W396: BRUNSWICK | X396: 4 | Y396: 5 | Z396: 0 | AA396: 927 | AB396: 881 | AC396: 105.22 | AD396: 16
A397: BEST PLAYERS | W397: DANDENONG | X397: 4 | Y397: 5 | Z397: 0 | AA397: 1052 | AB397: 1096 | AC397: 95.985401459854018 | AD397: 16
A398: GEELONG WEST | C398: PARSONS | F398: YATES | I398: BEEKOF | L398: RADOJEVIC | O398: SCALE | Q398: CHAPMAN | W398: CAULFIELD | X398: 4 | Y398: 5 | Z398: 0 | AA398: 989 | AB398: 1139 | AC398: 86.830553116769096 | AD398: 16
A399: SANDRINGHAM | C399: GIAMPAOLO | F399: McCONNELL | I399: SPARKS | W399: COBURG | X399: 3 | Y399: 6 | Z399: 0 | AA399: 1028 | AB399: 960 | AC399: 107.08333333333333 | AD399: 12
A400: GOALKICKERS | P400: HANNAN | R400: AITCHISON | W400: MORDIALLOC | X400: 2 | Y400: 7 | Z400: 0 | AA400: 947 | AB400: 1101 | AC400: 86.012715712988197 | AD400: 8
A401: GEELONG WEST | C401: RADOJEVIC 8 | F401: BEEKOF 3 | I401: PARSONS 2 | L401: VILLAROSA | N401: FRIEND | P401: FAGAN | R401: McGILLIVRAY
A402: SANDRINGHAM | C402: GIAMPAOLO 2 | F402: PLEDGER 2 | I402: O'BRIEN 2 | K402: GILES | M402: HUNTER | O402: SPARKS | Q402: SIMS | R402: LYONS | T402: FRANKLIN | W402: WILKINS | X402: GILMORE
A404: BRUNSWICK | C404: 5 | D404: 3 | E404: =C404*6+D404 -> 33 | G404: 7 | H404: 5 | I404: =G404*6+H404 -> 47 | K404: 15 | L404: 10 | M404: =K404*6+L404 -> 100 | O404: 19 | P404: 10 | Q404: =O404*6+P404 -> 124 | S404: TOORAK PARK
A405: PRAHRAN | C405: 2 | D405: 2 | E405: =C405*6+D405 -> 14 | G405: 10 | H405: 7 | I405: =G405*6+H405 -> 67 | K405: 12 | L405: 7 | M405: =K405*6+L405 -> 79 | O405: 14 | P405: 13 | Q405: =O405*6+P405 -> 97 | S405: O'BRIEN
A406: BEST PLAYERS
A407: BRUNSWICK | C407: CADDY | F407: LAWRENCE | I407: O'CONNOR | L407: ORTON | O407: DELEDIO | R407: BUCKLEY
A408: PRAHRAN | C408: TAYLOR | F408: JEFFREY | I408: ZEMSKI | L408: PREEN
A409: GOALKICKERS
A410: BRUNSWICK | C410: ORTON 6 | F410: O'CONNOR 3 | I410: BR VALENTINE 3 | L410: WEST 2 | N410: STONE 2 | Q410: WARDEN | S410: CADDY | U410: TOY
A411: PRAHRAN | C411: TAYLOR 3 | F411: PEPE 2 | H411: PREEN 2 | J411: THORNTON 2 | M411: ZEMSKI | O411: RAE | P411: DWYER | R411: JOHNSTON | U411: AUSTIN
A413: COBURG | C413: 10 | D413: 2 | E413: =C413*6+D413 -> 62 | G413: 14 | H413: 6 | I413: =G413*6+H413 -> 90 | K413: 18 | L413: 11 | M413: =K413*6+L413 -> 119 | O413: 23 | P413: 17 | Q413: =O413*6+P413 -> 155 | S413: COBURG
A414: MORDIALLOC | C414: 4 | D414: 2 | E414: =C414*6+D414 -> 26 | G414: 6 | H414: 9 | I414: =G414*6+H414 -> 45 | K414: 11 | L414: 13 | M414: =K414*6+L414 -> 79 | O414: 18 | P414: 16 | Q414: =O414*6+P414 -> 124 | S414: McBAIN
A415: BEST PLAYERS
A416: COBURG | C416: BURT | F416: NOONAN | I416: PITT | L416: DOHNT | O416: S McDONALD
A417: MORDIALLOC | C417: BYRNE | F417: WILLIAMSON | I417: BARDOEL | L417: SLADE | O417: JUDSON
A418: GOALKICKERS
A419: COBURG | C419: SMITH 5 | E419: CLEARY 4 | G419: BURT 4 | I419: S McDONALD 3 | L419: LLOYD 2 | N419: NOONAN 2 | Q419: HERBERT 2 | S419: MANNIX
A420: MORDIALLOC | C420: BYRNE 9 | F420: JOHNSTON 5 | I420: DEATON | K420: POPE | M420: JUDSON | O420: NORRIS
A422: CAULFIELD | C422: 4 | D422: 5 | E422: =C422*6+D422 -> 29 | G422: 7 | H422: 11 | I422: =G422*6+H422 -> 53 | K422: 13 | L422: 16 | M422: =K422*6+L422 -> 94 | O422: 20 | P422: 20 | Q422: =O422*6+P422 -> 140 | S422: PORT MELBOURNE
A423: PORT MELBOURNE | C423: 6 | D423: 3 | E423: =C423*6+D423 -> 39 | G423: 9 | H423: 8 | I423: =G423*6+H423 -> 62 | K423: 10 | L423: 11 | M423: =K423*6+L423 -> 71 | O423: 13 | P423: 17 | Q423: =O423*6+P423 -> 95 | S423: MATTHEWS
A424: BEST PLAYERS
A425: CAULFIELD | C425: FRIGO | F425: KING | I425: HUNT | K425: M TAYLOR | N425: COOK | P425: ADAMS
A426: PORT MELBOURNE | C426: IVANOFF | F426: BEECROFT | I426: COOK | K426: K GOSS | N426: LOWE
A427: GOALKICKERS
A428: CAULFIELD | C428: HOLDEN 4 | F428: O'SULLIVAN 3 | I428: TROTT 3 | K428: MOORE 3 | M428: KING 2 | O428: ROWE 2 | Q428: COOK | R428: TAYLOR | T428: SMITH
A429: PORT MELBOURNE | C429: LOWE 5 | E429: COOK 4 | G429: BECKWITH | I429: PROFFIT | K429: WHARTON | M429: RASMUSSEN
A431: ROUND 10 | E431: 2ND JULY | J431: WEATHER | N431: RAIN | S431: PLAYED AT
D432: 1ST QTR | H432: 2ND QTR | L432: 3RD QTR | P432: FINAL | S432: BEACH ROAD
A433: PORT MELBOURNE | C433: 5 | D433: 1 | E433: =C433*6+D433 -> 31 | G433: 9 | H433: 3 | I433: =G433*6+H433 -> 57 | K433: 12 | L433: 8 | M433: =K433*6+L433 -> 80 | O433: 14 | P433: 11 | Q433: =O433*6+P433 -> 95 | S433: UMPIRE | X433: LADDER | AB433: ROUND | AD433: 10
A434: SANDRINGHAM | C434: 4 | D434: 1 | E434: =C434*6+D434 -> 25 | G434: 7 | H434: 6 | I434: =G434*6+H434 -> 48 | K434: 9 | L434: 11 | M434: =K434*6+L434 -> 65 | O434: 11 | P434: 17 | Q434: =O434*6+P434 -> 83 | S434: HEDGER
A435: BEST PLAYERS | W435: TEAM | X435: W | Y435: L | Z435: D | AA435: FOR | AB435: AGST | AC435: % | AD435: PTS
A436: PORT MELBOURNE | C436: BECKWITH | F436: K GOSS | I436: HAENAN | L436: BEDFORD | O436: LOWE | R436: DERMOTT
A437: SANDRINGHAM | C437: ADAMS | F437: GIAMPAOLO | I437: SPARKS | L437: PLEDGER | O437: ROBERTSON | R437: WILKINS | W437: PORT MELBOURNE | X437: 8 | Y437: 2 | Z437: 0 | AA437: 1189 | AB437: 1048 | AC437: 113.45 | AD437: 32
A438: GOALKICKERS | W438: PRESTON | X438: 6 | Y438: 3 | Z438: 1 | AA438: 1142 | AB438: 1099 | AC438: 103.91264786169245 | AD438: 26
A439: PORT MELBOURNE | C439: COOK 5 | F439: LOWE 5 | I439: RASMUSSEN 3 | L439: BECKWITH | W439: PRAHRAN | X439: 5 | Y439: 4 | Z439: 1 | AA439: 1129 | AB439: 1137 | AC439: 99.296394019349165 | AD439: 22
A440: SANDRINGHAM | C440: HUNTER 3 | F440: PLEDGER 3 | I440: LAUBE | K440: HUTCHINSON | N440: MILLER | P440: MANNIX | R440: DEAGAN | W440: SANDRINGHAM | X440: 5 | Y440: 5 | Z440: 0 | AA440: 1174 | AB440: 1073 | AC440: 109.41286113699907 | AD440: 20
A442: PRAHRAN | C442: 4 | D442: 5 | E442: =C442*6+D442 -> 29 | G442: 4 | H442: 8 | I442: =G442*6+H442 -> 32 | K442: 11 | L442: 14 | M442: =K442*6+L442 -> 80 | O442: 13 | P442: 14 | Q442: =O442*6+P442 -> 92 | S442: GEELONG WEST | W442: BRUNSWICK | X442: 5 | Y442: 5 | Z442: 0 | AA442: 989 | AB442: 931 | AC442: 106.23 | AD442: 20
A443: GEELONG WEST | C443: 4 | D443: 0 | E443: =C443*6+D443 -> 24 | G443: 8 | H443: 3 | I443: =G443*6+H443 -> 51 | K443: 10 | L443: 3 | M443: =K443*6+L443 -> 63 | O443: 11 | P443: 10 | Q443: =O443*6+P443 -> 76 | S443: McBAIN | W443: GEELONG WEST | X443: 5 | Y443: 5 | Z443: 0 | AA443: 1097 | AB443: 1152 | AC443: 95.225694444444443 | AD443: 20
A444: BEST PLAYERS | W444: CAULFIELD | X444: 5 | Y444: 5 | Z444: 0 | AA444: 1083 | AB444: 1210 | AC444: 89.504132231404952 | AD444: 20
A445: PRAHRAN | C445: KENT | F445: ANDERSON | I445: McGUINNESS | L445: FOLEY | N445: WALL | Q445: KEKOVICH | W445: COBURG | X445: 4 | Y445: 6 | Z445: 0 | AA445: 1125 | AB445: 1050 | AC445: 107.14285714285714 | AD445: 16
A446: GEELONG WEST | C446: VILLAROSA | F446: YATES | I446: SCALE | L446: PARSONS | N446: RUSSELL | Q446: DURRAN | W446: DANDENONG | X446: 4 | Y446: 6 | Z446: 0 | AA446: 1142 | AB446: 1193 | AC446: 95.725062866722553 | AD446: 16
A447: GOALKICKERS | W447: MORDIALLOC | X447: 2 | Y447: 8 | Z447: 0 | AA447: 1018 | AB447: 1195 | AC447: 85.188284518828453 | AD447: 8
A448: PRAHRAN | C448: KEKOVICH 3 | F448: PREEN 3 | H448: CLARKE 2 | J448: SMITH 2 | M448: McGUINNESS | P448: JOHNSTON | R448: DWYER
A449: GEELONG WEST | C449: RADOJEVIC 3 | F449: BEEKOF 2 | I449: PARSONS 2 | L449: GILMORE | N449: HINDSON | Q449: YATES | S449: DURRAN
A451: BRUNSWICK | C451: 1 | D451: 3 | E451: =C451*6+D451 -> 9 | G451: 4 | H451: 4 | I451: =G451*6+H451 -> 28 | K451: 7 | L451: 5 | M451: =K451*6+L451 -> 47 | O451: 9 | P451: 8 | Q451: =O451*6+P451 -> 62 | S451: BRUNSWICK
A452: PRESTON | C452: 2 | D452: 2 | E452: =C452*6+D452 -> 14 | G452: 4 | H452: 4 | I452: =G452*6+H452 -> 28 | K452: 6 | L452: 7 | M452: =K452*6+L452 -> 43 | O452: 7 | P452: 8 | Q452: =O452*6+P452 -> 50 | S452: STABB
A453: BEST PLAYERS
A454: BRUNSWICK | C454: NOLAN | F454: BUCKLEY | I454: O'SHANNESSY | L454: CADDY | O454: ORTON | R454: LAWRENCE
A455: PRESTON | C455: MARSHALL | F455: MARKS | I455: MARTIN | L455: McCONNELL | O455: McCULLOCH | R455: WALSH
A456: GOALKICKERS
A457: BRUNSWICK | C457: STONE 3 | F457: ORTON 2 | I457: CADDY | K457: NOLAN | M457: LAWRENCE | P457: TOY
A458: PRESTON | C458: GONSALVES 2 | F458: LORENZINI | I458: MARSHALL | L458: SALTMARSH | O458: MARKS | Q458: JESSOP
A460: COBURG | C460: 6 | D460: 5 | E460: =C460*6+D460 -> 41 | G460: 8 | H460: 8 | I460: =G460*6+H460 -> 56 | K460: 9 | L460: 14 | M460: =K460*6+L460 -> 68 | O460: 13 | P460: 19 | Q460: =O460*6+P460 -> 97 | S460: COBURG
A461: DANDENONG | C461: 5 | D461: 4 | E461: =C461*6+D461 -> 34 | G461: 7 | H461: 8 | I461: =G461*6+H461 -> 50 | K461: 8 | L461: 10 | M461: =K461*6+L461 -> 58 | O461: 13 | P461: 12 | Q461: =O461*6+P461 -> 90 | S461: O'BRIEN
A462: BEST PLAYERS
A463: COBURG | C463: BREEN | F463: COLLINS | I463: BURT | K463: MILROY | N463: LAIDLER | Q463: SMITH
A464: DANDENONG | C464: McCONNELL | F464: DROSCHER | I464: LYNN | K464: GUY | N464: HIBBERT | Q464: TAYLOR
A465: GOALKICKERS
A466: COBURG | C466: SMITH 7 | F466: McDONALD 2 | I466: McMILLAN | K466: BURT | M466: NOONAN | O466: HERBERT
A467: DANDENONG | C467: PRENDERGAST 4 | G467: SHEVLIN 3 | J467: THOMPSON 2 | M467: GUY | N467: HIBBERT | P467: BRIESE | R467: DISTON
A469: CAULFIELD | C469: 1 | D469: 1 | E469: =C469*6+D469 -> 7 | G469: 5 | H469: 3 | I469: =G469*6+H469 -> 33 | K469: 7 | L469: 6 | M469: =K469*6+L469 -> 48 | O469: 14 | P469: 10 | Q469: =O469*6+P469 -> 94 | S469: MORDIALLOC
A470: MORDIALLOC | C470: 2 | D470: 5 | E470: =C470*6+D470 -> 17 | G470: 3 | H470: 11 | I470: =G470*6+H470 -> 29 | K470: 6 | L470: 16 | M470: =K470*6+L470 -> 52 | O470: 9 | P470: 17 | Q470: =O470*6+P470 -> 71 | S470: FITZPATRICK
A471: BEST PLAYERS
A472: CAULFIELD | C472: HUNT | F472: O'SULLIVAN | I472: COOK | L472: ROWE | O472: KING | Q472: FRIGO
A473: MORDIALLOC | C473: BURNS | F473: WILLIAMSON | I473: BLOOMFIELD | L473: ROGERSON | O473: CRITCH | Q473: NORRIS
A474: GOALKICKERS
A475: CAULFIELD | C475: TROTT 3 | E475: MOORE 3 | G475: HOLDEN 2 | I475: KING 2 | K475: MORRIS 2 | M475: O'SULLIVAN | P475: HAWKING
A476: MORDIALLOC | C476: BOURNE 3 | F476: SLADE 2 | I476: JOHNSTON | L476: JUDSON | N476: NORRIS | P476: SABBATUCCI
A478: ROUND 11 | E478: 9TH JULY | J478: WEATHER | N478: NORTH WIND | S478: PLAYED AT
D479: 1ST QTR | H479: 2ND QTR | L479: 3RD QTR | P479: FINAL | S479: TOORAK PARK
A480: PRAHRAN | C480: 6 | D480: 7 | E480: =C480*6+D480 -> 43 | G480: 9 | H480: 12 | I480: =G480*6+H480 -> 66 | K480: 12 | L480: 15 | M480: =K480*6+L480 -> 87 | O480: 19 | P480: 21 | Q480: =O480*6+P480 -> 135 | S480: UMPIRE | X480: LADDER | AB480: ROUND | AD480: 11
A481: SANDRINGHAM | C481: 2 | D481: 5 | E481: =C481*6+D481 -> 17 | G481: 3 | H481: 8 | I481: =G481*6+H481 -> 26 | K481: 5 | L481: 15 | M481: =K481*6+L481 -> 45 | O481: 8 | P481: 18 | Q481: =O481*6+P481 -> 66 | S481: FITZPATRICK
A482: BEST PLAYERS | W482: TEAM | X482: W | Y482: L | Z482: D | AA482: FOR | AB482: AGST | AC482: % | AD482: PTS
A483: PRAHRAN | C483: PREEN | F483: PEPE | I483: THORNTON | L483: FOLEY | N483: DWYER | Q483: ZEMSKI
A484: SANDRINGHAM | C484: PLEDGER | F484: BARCLAY | I484: PETERS | L484: COELLI | W484: PORT MELBOURNE | X484: 9 | Y484: 2 | Z484: 0 | AA484: 1359 | AB484: 1167 | AC484: 116.45 | AD484: 36
A485: GOALKICKERS | W485: PRESTON | X485: 7 | Y485: 3 | Z485: 1 | AA485: 1293 | AB485: 1210 | AC485: 106.85950413223141 | AD485: 30
A486: PRAHRAN | C486: SMITH 4 | E486: KEKOVICH 4 | H486: JOHNSTON 3 | K486: DWYER 2 | M486: TAYLOR 2 | O486: PREEN 2 | Q486: AUSTIN | S486: THORNTON | W486: PRAHRAN | X486: 6 | Y486: 4 | Z486: 1 | AA486: 1264 | AB486: 1203 | AC486: 105.07065669160433 | AD486: 26
A487: SANDRINGHAM | C487: PLEDGER 3 | F487: GIAMPAOLO 2 | I487: HUTCHINSON 2 | L487: DEAGAN | W487: CAULFIELD | X487: 6 | Y487: 5 | Z487: 0 | AA487: 1212 | AB487: 1306 | AC487: 92.802450229709038 | AD487: 24
A489: CAULFIELD | C489: 5 | D489: 5 | E489: =C489*6+D489 -> 35 | G489: 8 | H489: 9 | I489: =G489*6+H489 -> 57 | K489: 17 | L489: 11 | M489: =K489*6+L489 -> 113 | O489: 19 | P489: 15 | Q489: =O489*6+P489 -> 129 | S489: PRINCES PARK | W489: SANDRINGHAM | X489: 5 | Y489: 6 | Z489: 0 | AA489: 1240 | AB489: 1208 | AC489: 102.64900662251655 | AD489: 20
A490: GEELONG WEST | C490: 0 | D490: 1 | E490: =C490*6+D490 -> 1 | G490: 2 | H490: 10 | I490: =G490*6+H490 -> 22 | K490: 7 | L490: 13 | M490: =K490*6+L490 -> 55 | O490: 13 | P490: 18 | Q490: =O490*6+P490 -> 96 | S490: HEDGER | W490: DANDENONG | X490: 5 | Y490: 6 | Z490: 0 | AA490: 1298 | AB490: 1285 | AC490: 101.01167315175097 | AD490: 20
A491: BEST PLAYERS | W491: BRUNSWICK | X491: 5 | Y491: 6 | Z491: 0 | AA491: 1081 | AB491: 1087 | AC491: 99.45 | AD491: 20
A492: CAULFIELD | C492: TROTT | F492: ROWE | I492: KING | L492: O'SULLIVAN | O492: BOOTH | R492: TAYLOR | W492: GEELONG WEST | X492: 5 | Y492: 6 | Z492: 0 | AA492: 1193 | AB492: 1281 | AC492: 93.130366900858704 | AD492: 20
A493: GEELONG WEST | C493: MIDDLEMISS | F493: VILLAROSA | I493: SCALE | L493: RUSSELL | O493: YATES | R493: EDDY | W493: COBURG | X493: 4 | Y493: 7 | Z493: 0 | AA493: 1244 | AB493: 1220 | AC493: 101.9672131147541 | AD493: 16
A494: GOALKICKERS | W494: MORDIALLOC | X494: 2 | Y494: 9 | Z494: 0 | AA494: 1129 | AB494: 1346 | AC494: 83.878157503714704 | AD494: 8
A495: CAULFIELD | C495: O'SULLIVAN 4 | F495: TROTT 4 | I495: KING 4 | K495: MAGUIRE 2 | N495: TAYLOR 2 | Q495: ROWE 2 | S495: FRIGO
A496: GEELONG WEST | C496: McKENNA 4 | F496: MIDDLEMISS 4 | J496: WOOLFE 3 | M496: EDDY | O496: GILMORE
A498: DANDENONG | C498: 4 | D498: 10 | E498: =C498*6+D498 -> 34 | G498: 6 | H498: 12 | I498: =G498*6+H498 -> 48 | K498: 18 | L498: 17 | M498: =K498*6+L498 -> 125 | O498: 23 | P498: 18 | Q498: =O498*6+P498 -> 156 | S498: DANDENONG
A499: BRUNSWICK | C499: 2 | D499: 2 | E499: =C499*6+D499 -> 14 | G499: 5 | H499: 6 | I499: =G499*6+H499 -> 36 | K499: 7 | L499: 7 | M499: =K499*6+L499 -> 49 | O499: 13 | P499: 14 | Q499: =O499*6+P499 -> 92 | S499: STEERE
A500: BEST PLAYERS
A501: DANDENONG | C501: WRIGHT | F501: GUY | I501: REID | L501: McCONNELL | O501: HIBBERT | R501: THOMPSON
A502: BRUNSWICK | C502: STAEHR | F502: ORTON | I502: O'CONNOR | L502: LAWRENCE | O502: WHITFORD | R502: BOURKE
A503: GOALKICKERS
A504: DANDENONG | C504: REID 5 | E504: ELLIS 4 | G504: GUY 4 | I504: TAYLOR 3 | K504: THOMPSON 2 | N504: HIBBERT | P504: TOWNSEND | R504: DROSCHER | U504: WRIGHT | X504: PRENDERGAST
A505: BRUNSWICK | C505: ORTON 6 | F505: VALENTINE 2 | I505: O'CONNOR | K505: GINGELL | M505: STONE | O505: LAWRENCE | R505: STAEHR
A507: PORT MELBOURNE | C507: 3 | D507: 4 | E507: =C507*6+D507 -> 22 | G507: 9 | H507: 6 | I507: =G507*6+H507 -> 60 | K507: 21 | L507: 12 | M507: =K507*6+L507 -> 138 | O507: 26 | P507: 14 | Q507: =O507*6+P507 -> 170 | S507: PORT MELBOURNE
A508: COBURG | C508: 2 | D508: 3 | E508: =C508*6+D508 -> 15 | G508: 7 | H508: 8 | I508: =G508*6+H508 -> 50 | K508: 10 | L508: 13 | M508: =K508*6+L508 -> 73 | O508: 17 | P508: 17 | Q508: =O508*6+P508 -> 119 | S508: GROOM
A509: BEST PLAYERS
A510: PORT MELBOURNE | C510: P GOSS | F510: K GOSS | I510: COOK | L510: AANENSEN | O510: DERMOTT | R510: RASMUSSEN
A511: COBURG | C511: SMITH | F511: BURT | I511: DOHNT
A512: GOALKICKERS
A513: PORT MELBOURNE | C513: COOK 6 | E513: REID 5 | G513: RASMUSSSEN 5 | J513: HAENAN 3 | M513: P GOSS 2 | O513: CHRISTOU | Q513: LOWE | S513: BECKWITH | V513: JAMIESON | X513: K GOSS
A514: COBURG | C514: SMITH 7 | F514: NOONAN 3 | I514: DOHNT 3 | K514: MANNIX 2 | N514: COLLINS | P514: HERBERT
A516: PRESTON | C516: 3 | D516: 5 | E516: =C516*6+D516 -> 23 | G516: 11 | H516: 10 | I516: =G516*6+H516 -> 76 | K516: 14 | L516: 15 | M516: =K516*6+L516 -> 99 | O516: 22 | P516: 19 | Q516: =O516*6+P516 -> 151 | S516: PRESTON
A517: MORDIALLOC | C517: 6 | D517: 2 | E517: =C517*6+D517 -> 38 | G517: 10 | H517: 4 | I517: =G517*6+H517 -> 64 | K517: 16 | L517: 8 | M517: =K517*6+L517 -> 104 | O517: 17 | P517: 9 | Q517: =O517*6+P517 -> 111 | S517: SNOOKS
A518: BEST PLAYERS
A519: PRESTON | C519: BOLGER | F519: McCONNELL | J519: McCULLOCH | M519: NICLASEN | P519: DURWOOD | S519: WALSH
A520: MORDIALLOC | C520: BARDOEL | F520: WILLIAMSON | J520: NORRIS | M520: LANG | P520: BLOOMFIELD | S520: BOURNE
A521: GOALKICKERS
A522: PRESTON | C522: McCULLOCH 5 | F522: LORENZINI 4 | I522: NICLASEN 3 | L522: DURWOOD 2 | O522: MARTIN 2 | Q522: MARKS 2 | S522: JESSOP 2 | V522: KING | X522: CROOKE
A523: MORDIALLOC | C523: BOURNE 5 | F523: JOHNSTON 3 | I523: NORRIS 3 | K523: DEATON 2 | N523: BLOOMFIELD | Q523: BARDOEL | S523: WILLIAMSON | W523: ROGERSON
A525: ROUND 12 | E525: 16TH JULY | J525: WEATHER | N525: NORTH WIND RAIN | S525: PLAYED AT
D526: 1ST QTR | H526: 2ND QTR | L526: 3RD QTR | P526: FINAL | S526: GEELONG WEST
A527: PRESTON | C527: 6 | D527: 5 | E527: =C527*6+D527 -> 41 | G527: 9 | H527: 8 | I527: =G527*6+H527 -> 62 | K527: 14 | L527: 12 | M527: =K527*6+L527 -> 96 | O527: 21 | P527: 13 | Q527: =O527*6+P527 -> 139 | S527: UMPIRE | X527: LADDER | AB527: ROUND | AD527: 12
A528: GEELONG WEST | C528: 0 | D528: 3 | E528: =C528*6+D528 -> 3 | G528: 4 | H528: 8 | I528: =G528*6+H528 -> 32 | K528: 12 | L528: 10 | M528: =K528*6+L528 -> 82 | O528: 16 | P528: 12 | Q528: =O528*6+P528 -> 108 | S528: O'BRIEN
A529: BEST PLAYERS | W529: TEAM | X529: W | Y529: L | Z529: D | AA529: FOR | AB529: AGST | AC529: % | AD529: PTS
A530: PRESTON | C530: McCONNELL | F530: ROJO | I530: NICLASEN | L530: MARTIN | O530: BOLGER
A531: GEELONG WEST | C531: EDDY | F531: SMITH | I531: McKENNA | L531: DURRAN | O531: MIDDLEMISS | W531: PORT MELBOURNE | X531: 9 | Y531: 3 | Z531: 0 | AA531: 1460 | AB531: 1295 | AC531: 112.74 | AD531: 36
A532: GOALKICKERS | P532: RINGIN | R532: CANN | T532: WILMOT | W532: PRESTON | X532: 8 | Y532: 3 | Z532: 1 | AA532: 1432 | AB532: 1318 | AC532: 108.649468892261 | AD532: 34
A533: PRESTON | C533: GONSALVES 6 | F533: NICLASEN 4 | I533: RENWICK 3 | L533: McCONNELL | N533: JESSOP | P533: DURWOOD | R533: MARTIN | T533: CROOKE | W533: PRAHRAN | X533: 6 | Y533: 5 | Z533: 1 | AA533: 1367 | AB533: 1352 | AC533: 101.1094674556213 | AD533: 26
A534: GEELONG WEST | C534: McKENNA 5 | F534: MIDDLEMISS 3 | I534: RADOJEVIC 3 | L534: WOOLFE 2 | N534: DURRAN | P534: FRIEND | R534: EDDY | W534: SANDRINGHAM | X534: 6 | Y534: 6 | Z534: 0 | AA534: 1364 | AB534: 1296 | AC534: 105.24691358024691 | AD534: 24
A536: SANDRINGHAM | C536: 1 | D536: 0 | E536: =C536*6+D536 -> 6 | G536: 6 | H536: 7 | I536: =G536*6+H536 -> 43 | K536: 7 | L536: 7 | M536: =K536*6+L536 -> 49 | O536: 18 | P536: 16 | Q536: =O536*6+P536 -> 124 | S536: BEACH ROAD | W536: DANDENONG | X536: 6 | Y536: 6 | Z536: 0 | AA536: 1426 | AB536: 1386 | AC536: 102.88600288600288 | AD536: 24
A537: CAULFIELD | C537: 2 | D537: 12 | E537: =C537*6+D537 -> 24 | G537: 3 | H537: 16 | I537: =G537*6+H537 -> 34 | K537: 10 | L537: 26 | M537: =K537*6+L537 -> 86 | O537: 10 | P537: 28 | Q537: =O537*6+P537 -> 88 | S537: GROOM | W537: BRUNSWICK | X537: 6 | Y537: 6 | Z537: 0 | AA537: 1166 | AB537: 1165 | AC537: 100.09 | AD537: 24
A538: BEST PLAYERS | W538: CAULFIELD | X538: 6 | Y538: 6 | Z538: 0 | AA538: 1300 | AB538: 1430 | AC538: 90.909090909090907 | AD538: 24
A539: SANDRINGHAM | C539: COELLI | F539: HUTCHINSON | I539: PLEDGER | L539: BARCLAY | W539: COBURG | X539: 5 | Y539: 7 | Z539: 0 | AA539: 1393 | AB539: 1323 | AC539: 105.29100529100529 | AD539: 20
A540: CAULFIELD | C540: TAYLOR | F540: HUNT | I540: KING | L540: MOORE | O540: BALL | Q540: TROTT | W540: GEELONG WEST | X540: 5 | Y540: 7 | Z540: 0 | AA540: 1301 | AB540: 1420 | AC540: 91.619718309859152 | AD540: 20
A541: GOALKICKERS | Q541: LAUBE | S541: WILKINS | W541: MORDIALLOC | X541: 2 | Y541: 10 | Z541: 0 | AA541: 1207 | AB541: 1431 | AC541: 84.346610761705108 | AD541: 8
A542: SANDRINGHAM | C542: PLEDGER 5 | F542: HUTCHINSON 4 | I542: CARROLL 2 | L542: BEUS 2 | N542: FRANKLIN | Q542: OSBORNE | S542: DEAGAN
A543: CAULFIELD | C543: MOORE 3 | F543: TROTT | H543: O'SULLIVAN | K543: KING | L543: TAYLOR | N543: SMITH | P543: HOLDEN | R543: MORRISON
A545: DANDENONG | C545: 3 | D545: 0 | E545: =C545*6+D545 -> 18 | G545: 11 | H545: 9 | I545: =G545*6+H545 -> 75 | K545: 13 | L545: 11 | M545: =K545*6+L545 -> 89 | O545: 19 | P545: 14 | Q545: =O545*6+P545 -> 128 | S545: DANDENONG
A546: PORT MELBOURNE | C546: 6 | D546: 9 | E546: =C546*6+D546 -> 45 | G546: 8 | H546: 9 | I546: =G546*6+H546 -> 57 | K546: 12 | L546: 15 | M546: =K546*6+L546 -> 87 | O546: 14 | P546: 17 | Q546: =O546*6+P546 -> 101 | S546: STABB
A547: BEST PLAYERS
A548: DANDENONG | C548: HORAZCKO | F548: HIBBERT | I548: ROSS | L548: SHINNERS | O548: THOMPSON | R548: SHEVLIN
A549: PORT MELBOURNE | C549: HAENAN | F549: DERMOTT | I549: JAMIESON | L549: BEDFORD | O549: MOLLOY
A550: GOALKICKERS
A551: DANDENONG | C551: PRENDERGAST 5 | F551: THOMPSON 4 | I551: ELLIS 4 | L551: HIBBERT 3 | O551: TAYLOR | Q551: DROSCHER | T551: TOWNSEND
A552: PORT MELBOURNE | C552: HAENAN 5 | F552: RASMUSSEN 3 | I552: JAMIESON 3 | L552: COOK 2 | O552: K GOSS
A554: BRUNSWICK | C554: 4 | D554: 4 | E554: =C554*6+D554 -> 28 | G554: 7 | H554: 9 | I554: =G554*6+H554 -> 51 | K554: 10 | L554: 15 | M554: =K554*6+L554 -> 75 | O554: 11 | P554: 19 | Q554: =O554*6+P554 -> 85 | S554: BRUNSWICK
A555: MORDIALLOC | C555: 2 | D555: 4 | E555: =C555*6+D555 -> 16 | G555: 3 | H555: 6 | I555: =G555*6+H555 -> 24 | K555: 6 | L555: 8 | M555: =K555*6+L555 -> 44 | O555: 11 | P555: 12 | Q555: =O555*6+P555 -> 78 | S555: WENN
A556: BEST PLAYERS
A557: BRUNSWICK | C557: LAWRENCE | F557: O'CONNOR | I557: McGHIE | L557: BUCKLEY | O557: SEERY
A558: MORDIALLOC | C558: WILLIAMSON | F558: JOHNSTON | I558: SLADE | L558: MOORE | O558: DEATON | R558: DINGLE
A559: GOALKICKERS
A560: BRUNSWICK | C560: ORTON 2 | F560: TOY 2 | H560: O'CONNOR | K560: GINGELL | M560: McGHIE | O560: WEST | Q560: STONE | S560: LAWRENCE | V560: NEWBOLD
A561: MORDIALLOC | C561: NORRIS 4 | F561: MOORE 2 | I561: DEATON | K561: BOURNE | M561: DINGLE | O561: WILLIAMSON | R561: ROGERSON
A563: COBURG | C563: 4 | D563: 6 | E563: =C563*6+D563 -> 30 | G563: 12 | H563: 11 | I563: =G563*6+H563 -> 83 | K563: 13 | L563: 11 | M563: =K563*6+L563 -> 89 | O563: 22 | P563: 17 | Q563: =O563*6+P563 -> 149 | S563: COBURG
A564: PRAHRAN | C564: 4 | D564: 4 | E564: =C564*6+D564 -> 28 | G564: 6 | H564: 5 | I564: =G564*6+H564 -> 41 | K564: 12 | L564: 17 | M564: =K564*6+L564 -> 89 | O564: 14 | P564: 19 | Q564: =O564*6+P564 -> 103 | S564: OAKLEY
A565: BEST PLAYERS
A566: COBURG | C566: PRICE | F566: BURT | I566: MANNIX | L566: MILROY | O566: DOHNT | R566: NOONAN
A567: PRAHRAN | C567: CLARKE | F567: PEPE | I567: WALL | L567: JOHNSTON | O567: FOLEY
A568: GOALKICKERS
A569: COBURG | C569: CLEARY 4 | E569: BEATTIE 4 | H569: BURT 3 | J569: SMITH 3 | M569: HERBERT 2 | P569: NOONAN 2 | R569: DOHNT | T569: LLOYD | V569: MANNIX | X569: McDONALD
A570: PRAHRAN | C570: JOHNSTON 5 | F570: KEKOVICH 3 | I570: CLARKE 2 | L570: TAYLOR | N570: PREEN | P570: SMITH | R570: AUSTIN
A572: ROUND 13 | E572: 23RD JULY | J572: WEATHER | N572: WEST WIND SHOWERS | S572: PLAYED AT
D573: 1ST QTR | H573: 2ND QTR | L573: 3RD QTR | P573: FINAL | S573: PRESTON
A574: PRESTON | C574: 5 | D574: 7 | E574: =C574*6+D574 -> 37 | G574: 11 | H574: 13 | I574: =G574*6+H574 -> 79 | K574: 15 | L574: 17 | M574: =K574*6+L574 -> 107 | O574: 21 | P574: 18 | Q574: =O574*6+P574 -> 144 | S574: UMPIRE | X574: LADDER | AB574: ROUND | AD574: 13
A575: SANDRINGHAM | C575: 1 | D575: 4 | E575: =C575*6+D575 -> 10 | G575: 4 | H575: 8 | I575: =G575*6+H575 -> 32 | K575: 9 | L575: 12 | M575: =K575*6+L575 -> 66 | O575: 9 | P575: 16 | Q575: =O575*6+P575 -> 70 | S575: McBAIN
A576: BEST PLAYERS | W576: TEAM | X576: W | Y576: L | Z576: D | AA576: FOR | AB576: AGST | AC576: % | AD576: PTS
A577: PRESTON | C577: LORENZINI | F577: JESSOP | I577: NICLASEN | L577: CANN | N577: MARTIN | Q577: DURWOOD
A578: SANDRINGHAM | C578: PETERS | F578: COELLI | I578: GIAMPAOLO | L578: CLARK | W578: PORT MELBOURNE | X578: 10 | Y578: 3 | Z578: 0 | AA578: 1626 | AB578: 1399 | AC578: 116.23 | AD578: 40
A579: GOALKICKERS | W579: PRESTON | X579: 9 | Y579: 3 | Z579: 1 | AA579: 1576 | AB579: 1388 | AC579: 113.54466858789625 | AD579: 38
A580: PRESTON | C580: CANN 4 | E580: LORENZINI 4 | H580: NICLASEN 4 | J580: GONSALVES 3 | M580: JESSOP 2 | O580: RINGIN 2 | Q580: MARTIN | S580: MARSHALL | W580: PRAHRAN | X580: 7 | Y580: 5 | Z580: 1 | AA580: 1502 | AB580: 1440 | AC580: 104.30555555555556 | AD580: 30
A581: SANDRINGHAM | C581: HUTCHINSON 2 | F581: CARROLL 2 | I581: CLARK | K581: PLEDGER | M581: DEAGAN | O581: GIAMPAOLO | R581: MILLER | W581: COBURG | X581: 6 | Y581: 7 | Z581: 0 | AA581: 1509 | AB581: 1425 | AC581: 105.89473684210526 | AD581: 24
A583: PRAHRAN | C583: 3 | D583: 4 | E583: =C583*6+D583 -> 22 | G583: 9 | H583: 10 | I583: =G583*6+H583 -> 64 | K583: 13 | L583: 14 | M583: =K583*6+L583 -> 92 | O583: 20 | P583: 15 | Q583: =O583*6+P583 -> 135 | S583: TOORAK PARK | W583: SANDRINGHAM | X583: 6 | Y583: 7 | Z583: 0 | AA583: 1434 | AB583: 1440 | AC583: 99.583333333333329 | AD583: 24
A584: DANDENONG | C584: 5 | D584: 2 | E584: =C584*6+D584 -> 32 | G584: 7 | H584: 4 | I584: =G584*6+H584 -> 46 | K584: 10 | L584: 8 | M584: =K584*6+L584 -> 68 | O584: 12 | P584: 16 | Q584: =O584*6+P584 -> 88 | S584: GROOM | W584: DANDENONG | X584: 6 | Y584: 7 | Z584: 0 | AA584: 1514 | AB584: 1521 | AC584: 99.539776462853382 | AD584: 24
A585: BEST PLAYERS | W585: BRUNSWICK | X585: 6 | Y585: 7 | Z585: 0 | AA585: 1270 | AB585: 1331 | AC585: 95.42 | AD585: 24
A586: PRAHRAN | C586: KENT | F586: SMITH | I586: CLARKE | L586: AUSTIN | O586: JEFFREY | R586: PEPE | W586: CAULFIELD | X586: 6 | Y586: 7 | Z586: 0 | AA586: 1402 | AB586: 1546 | AC586: 90.685640362225101 | AD586: 24
A587: DANDENONG | C587: SHINNERS | F587: GUY | I587: HORAZCKO | L587: TAYLOR | O587: TOWNSEND | R587: LYNN | W587: GEELONG WEST | X587: 5 | Y587: 8 | Z587: 0 | AA587: 1388 | AB587: 1536 | AC587: 90.364583333333329 | AD587: 20
A588: GOALKICKERS | W588: MORDIALLOC | X588: 3 | Y588: 10 | Z588: 0 | AA588: 1323 | AB588: 1518 | AC588: 87.154150197628454 | AD588: 12
A589: PRAHRAN | C589: SMITH 7 | F589: PREEN 4 | H589: JOHNSTON 3 | K589: CLARKE 2 | M589: LITTLE 2 | O589: DWYER 2
A590: DANDENONG | C590: ROSS 3 | F590: REID 3 | H590: LYNN 2 | J590: GUY | K590: TOWNSEND | N590: TAYLOR | P590: BRIESE
A592: PORT MELBOURNE | C592: 5 | D592: 6 | E592: =C592*6+D592 -> 36 | G592: 11 | H592: 12 | I592: =G592*6+H592 -> 78 | K592: 16 | L592: 14 | M592: =K592*6+L592 -> 110 | O592: 25 | P592: 16 | Q592: =O592*6+P592 -> 166 | S592: PORT MELBOURNE
A593: BRUNSWICK | C593: 6 | D593: 2 | E593: =C593*6+D593 -> 38 | G593: 8 | H593: 4 | I593: =G593*6+H593 -> 52 | K593: 12 | L593: 5 | M593: =K593*6+L593 -> 77 | O593: 16 | P593: 8 | Q593: =O593*6+P593 -> 104 | S593: OAKLEY
A594: BEST PLAYERS
A595: PORT MELBOURNE | C595: P GOSS | F595: AANENSEN | I595: COOK | K595: IVANOFF | N595: DERMOTT | Q595: JI CHRISTOU
A596: BRUNSWICK | C596: STONE | F596: WEST | I596: BUCKLEY | K596: ORTON | N596: DELEDIO
A597: GOALKICKERS
A598: PORT MELBOURNE | C598: COOK 5 | E598: JI CHRISTOU 5 | H598: RASMUSSEN 4 | K598: K GOSS 2 | M598: HAENAN | O598: STIBBARD | Q598: JAMIESON | T598: BEDFORD | W598: P GOSS
A599: BRUNSWICK | C599: ORTON 5 | F599: MARANTELLI 4 | J599: STONE 2 | L599: GINGELL 2 | N599: LAWRENCE | Q599: TOY | R599: BUCKLEY
A601: COBURG | C601: 5 | D601: 5 | E601: =C601*6+D601 -> 35 | G601: 7 | H601: 13 | I601: =G601*6+H601 -> 55 | K601: 13 | L601: 19 | M601: =K601*6+L601 -> 97 | O601: 15 | P601: 26 | Q601: =O601*6+P601 -> 116 | S601: PRINCES PARK
A602: CAULFIELD | C602: 1 | D602: 7 | E602: =C602*6+D602 -> 13 | G602: 7 | H602: 12 | I602: =G602*6+H602 -> 54 | K602: 9 | L602: 15 | M602: =K602*6+L602 -> 69 | O602: 14 | P602: 18 | Q602: =O602*6+P602 -> 102 | S602: WENN
A603: BEST PLAYERS
A604: COBURG | C604: BREEN | F604: MANNIX | I604: COLLINS | K604: HURST | N604: DOHNT
A605: CAULFIELD | C605: HUNT | F605: BALL | I605: MOORE | K605: MORRISON | N605: M TAYLOR | Q605: SMITH
A606: GOALKICKERS
A607: COBURG | C607: MANNIX 6 | F607: DOHNT 2 | I607: NOONAN 2 | L607: SMITH 2 | N607: BURT | P607: LLOYD | R607: BREEN
A608: CAULFIELD | C608: MOORE 6 | F608: KING 2 | H608: SMITH 2 | J608: MAGUIRE | M608: HUNT | N608: TROTT | P608: HAWKING
A610: MORDIALLOC | C610: 6 | D610: 4 | E610: =C610*6+D610 -> 40 | G610: 11 | H610: 8 | I610: =G610*6+H610 -> 74 | K610: 16 | L610: 10 | M610: =K610*6+L610 -> 106 | O610: 17 | P610: 14 | Q610: =O610*6+P610 -> 116 | S610: MORDIALLOC
A611: GEELONG WEST | C611: 4 | D611: 2 | E611: =C611*6+D611 -> 26 | G611: 8 | H611: 5 | I611: =G611*6+H611 -> 53 | K611: 11 | L611: 6 | M611: =K611*6+L611 -> 72 | O611: 13 | P611: 9 | Q611: =O611*6+P611 -> 87 | S611: STABB
A612: BEST PLAYERS
A613: MORDIALLOC | C613: WILLIAMSON | F613: NORRIS | I613: SCOTT | L613: DEATON | O613: BOURNE | R613: MOORE
A614: GEELONG WEST | C614: EDDY | F614: McKENNA | I614: SCALE | L614: HINDSON | O614: MIDDLESMISS
A615: GOALKICKERS
A616: MORDIALLOC | C616: BOURNE 7 | F616: NORRIS 3 | I616: BARDOEL 2 | L616: WILLIAMSON 2 | O616: DINGLE | Q616: JOHNSTON | S616: MOORE
A617: GEELONG WEST | C617: McKENNA 6 | F617: RADOJEVIC 2 | I617: HINDSON 2 | L617: EDDY | N617: HAYDEN | P617: FRIEND
A619: ROUND 14 | E619: 30TH JULY | J619: WEATHER | N619: NORTH WIND | S619: PLAYED AT
D620: 1ST QTR | H620: 2ND QTR | L620: 3RD QTR | P620: FINAL | S620: PORT MELBOURNE
A621: PRESTON | C621: 3 | D621: 7 | E621: =C621*6+D621 -> 25 | G621: 7 | H621: 8 | I621: =G621*6+H621 -> 50 | K621: 11 | L621: 13 | M621: =K621*6+L621 -> 79 | O621: 16 | P621: 19 | Q621: =O621*6+P621 -> 115 | S621: UMPIRE | X621: LADDER | AB621: ROUND | AD621: 14
A622: PORT MELBOURNE | C622: 3 | D622: 3 | E622: =C622*6+D622 -> 21 | G622: 6 | H622: 11 | I622: =G622*6+H622 -> 47 | K622: 11 | L622: 14 | M622: =K622*6+L622 -> 80 | O622: 12 | P622: 18 | Q622: =O622*6+P622 -> 90 | S622: WENN
A623: BEST PLAYERS | W623: TEAM | X623: W | Y623: L | Z623: D | AA623: FOR | AB623: AGST | AC623: % | AD623: PTS
A624: PRESTON | C624: McCONNELL | F624: MARTIN | I624: LORENZINI | L624: MARSHALL | O624: DURWOOD | R624: ROJO
A625: PORT MELBOURNE | C625: IVANOFF | F625: BEECROFT | I625: RASMUSSEN | L625: AANENSEN | O625: DERMOTT | W625: PRESTON | X625: 10 | Y625: 3 | Z625: 1 | AA625: 1691 | AB625: 1478 | AC625: 114.41136671177267 | AD625: 42
A626: GOALKICKERS | R626: JESSOP | W626: PORT MELBOURNE | X626: 10 | Y626: 4 | Z626: 0 | AA626: 1716 | AB626: 1514 | AC626: 113.34 | AD626: 40
A627: PRESTON | C627: LORENZINI 6 | F627: KING 2 | H627: RENWICK 2 | J627: McCONNELL | M627: DURWOOD | O627: MARSHALL | Q627: WILMOT | S627: CANN | W627: PRAHRAN | X627: 8 | Y627: 5 | Z627: 1 | AA627: 1681 | AB627: 1594 | AC627: 105.45796737766625 | AD627: 34
A628: PORT MELBOURNE | C628: RASMUSSEN 5 | F628: COOK 4 | H628: JI CHRISTOU 2 | K628: K GOSS | W628: COBURG | X628: 7 | Y628: 7 | Z628: 0 | AA628: 1651 | AB628: 1505 | AC628: 109.70099667774086 | AD628: 28
A630: SANDRINGHAM | C630: 5 | D630: 2 | E630: =C630*6+D630 -> 32 | G630: 12 | H630: 9 | I630: =G630*6+H630 -> 81 | K630: 20 | L630: 14 | M630: =K630*6+L630 -> 134 | O630: 24 | P630: 19 | Q630: =O630*6+P630 -> 163 | S630: BEACH ROAD | W630: DANDENONG | X630: 7 | Y630: 7 | Z630: 0 | AA630: 1731 | AB630: 1636 | AC630: 105.80684596577017 | AD630: 28
A631: BRUNSWICK | C631: 8 | D631: 5 | E631: =C631*6+D631 -> 53 | G631: 9 | H631: 5 | I631: =G631*6+H631 -> 59 | K631: 15 | L631: 10 | M631: =K631*6+L631 -> 100 | O631: 18 | P631: 14 | Q631: =O631*6+P631 -> 122 | S631: FITZPATRICK | W631: SANDRINGHAM | X631: 7 | Y631: 7 | Z631: 0 | AA631: 1597 | AB631: 1562 | AC631: 102.24071702944943 | AD631: 28
A632: BEST PLAYERS | W632: BRUNSWICK | X632: 6 | Y632: 8 | Z632: 0 | AA632: 1392 | AB632: 1494 | AC632: 93.17 | AD632: 24
A633: SANDRINGHAM | C633: GIAMPAOLO | F633: PLEDGER | I633: BEUS | L633: SIMS | O633: LYONS | W633: CAULFIELD | X633: 6 | Y633: 8 | Z633: 0 | AA633: 1556 | AB633: 1725 | AC633: 90.20289855072464 | AD633: 24
A634: BRUNSWICK | C634: GINGELL | F634: BUCKLEY | I634: NOLAN | L634: ORTON | O634: DELEDIO | W634: GEELONG WEST | X634: 5 | Y634: 9 | Z634: 0 | AA634: 1468 | AB634: 1678 | AC634: 87.48510131108462 | AD634: 20
A635: GOALKICKERS | L635: OSBORNE | N635: CLARK | P635: DEAGAN | R635: WILKINS | W635: MORDIALLOC | X635: 3 | Y635: 11 | Z635: 0 | AA635: 1438 | AB635: 1735 | AC635: 82.881844380403464 | AD635: 12
A636: SANDRINGHAM | C636: PLEDGER 5 | F636: BEUS 3 | H636: GIAMPAOLO 3 | K636: SIMS 3 | M636: KENNEDY 2 | P636: HUTCHINSON 2 | S636: GILES 2
A637: BRUNSWICK | C637: GINGELL 6 | F637: ORTON 6 | I637: VALENTINE 2 | L637: STONE 2 | O637: NOLAN 2
A639: DANDENONG | C639: 5 | D639: 1 | E639: =C639*6+D639 -> 31 | G639: 17 | H639: 6 | I639: =G639*6+H639 -> 108 | K639: 24 | L639: 9 | M639: =K639*6+L639 -> 153 | O639: 33 | P639: 19 | Q639: =O639*6+P639 -> 217 | S639: DANDENONG
A640: MORDIALLOC | C640: 6 | D640: 4 | E640: =C640*6+D640 -> 40 | G640: 6 | H640: 4 | I640: =G640*6+H640 -> 40 | K640: 15 | L640: 11 | M640: =K640*6+L640 -> 101 | O640: 17 | P640: 13 | Q640: =O640*6+P640 -> 115 | S640: HEDGER
A641: BEST PLAYERS
A642: DANDENONG | C642: TAYLOR | F642: HIBBERT | I642: McCONNELL | L642: LUKAS | N642: BRIESE | P642: VAN DE BEEK
A643: MORDIALLOC | C643: BOURNE | F643: NORRIS | I643: WILLIAMSON | L643: SCOTT | N643: SLADE | P643: JOHNSTON
A644: GOALKICKERS
A645: DANDENONG | C645: PRENDERGAST 5 | F645: TAYLOR 4 | I645: ELLIS 4 | K645: REID 4 | M645: HIBBERT 4 | O645: THOMPSON 3 | R645: BRIESE 3 | U645: DROSCHER 3 | X645: VAN DE BEEK | AA645: HARRINGTON | AC645: GUY
A646: MORDIALLOC | C646: BOURNE 9 | F646: WILLIAMSON 5 | J646: JOHNSTON | M646: ROGERSON | O646: BARDOEL
A648: PRAHRAN | C648: 9 | D648: 2 | E648: =C648*6+D648 -> 56 | G648: 17 | H648: 12 | I648: =G648*6+H648 -> 114 | K648: 20 | L648: 19 | M648: =K648*6+L648 -> 139 | O648: 26 | P648: 23 | Q648: =O648*6+P648 -> 179 | S648: TOORAK PARK
A649: CAULFIELD | C649: 5 | D649: 5 | E649: =C649*6+D649 -> 35 | G649: 7 | H649: 7 | I649: =G649*6+H649 -> 49 | K649: 17 | L649: 14 | M649: =K649*6+L649 -> 116 | O649: 23 | P649: 16 | Q649: =O649*6+P649 -> 154 | S649: McBAIN
A650: BEST PLAYERS
A651: PRAHRAN | C651: SMITH | F651: JOHNSTON | I651: PEPE | L651: KENT | O651: KEKOVICH | R651: JEFFREY
A652: CAULFIELD | C652: KING | F652: COOK | I652: MAGUIRE | L652: O'SULLIVAN | O652: MORRISON | R652: BOOTH
A653: GOALKICKERS
A654: PRAHRAN | C654: SMITH 11 | F654: JOHNSTON 6 | I654: KEKOVICH 3 | L654: DWYER 2 | N654: PREEN 2 | P654: AUSTIN | R654: CLARKE
A655: CAULFIELD | C655: O'SULLIVAN 7 | F655: MAGUIRE 5 | I655: MOORE 3 | L655: KING 3 | N655: COOK 2 | Q655: ALDRIDGE | S655: ROWE | U655: COCCIARDI
A657: COBURG | C657: 2 | D657: 5 | E657: =C657*6+D657 -> 17 | G657: 9 | H657: 7 | I657: =G657*6+H657 -> 61 | K657: 17 | L657: 11 | M657: =K657*6+L657 -> 113 | O657: 21 | P657: 16 | Q657: =O657*6+P657 -> 142 | S657: COBURG
A658: GEELONG WEST | C658: 0 | D658: 1 | E658: =C658*6+D658 -> 1 | G658: 4 | H658: 6 | I658: =G658*6+H658 -> 30 | K658: 6 | L658: 10 | M658: =K658*6+L658 -> 46 | O658: 11 | P658: 14 | Q658: =O658*6+P658 -> 80 | S658: STEERE
A659: BEST PLAYERS
A660: COBURG | C660: BURT | F660: COLLINS | I660: PRICE | L660: BEATTIE | O660: LAIDLER
A661: GEELONG WEST | C661: KARNILOWICZ | F661: EDDY | I661: BEEKOF | L661: VILLAROSA | O661: YATES
A662: GOALKICKERS
A663: COBURG | C663: SMITH 4 | E663: HARBINSON 3 | H663: NOONAN 3 | K663: BURT 3 | M663: DOHNT 2 | O663: LLOYD 2 | Q663: CLEARY 2 | S663: LAIDLER | V663: BEATTIE
A664: GEELONG WEST | C664: McKENNA 5 | F664: HINDSON 2 | I664: WOOLFE | K664: HAYDEN | M664: KARNILOWICZ | P664: GILMORE
A666: ROUND 15 | E666: 6TH AUGUST | J666: WEATHER | N666: NORTH WIND DULL | S666: PLAYED AT
D667: 1ST QTR | H667: 2ND QTR | L667: 3RD QTR | P667: FINAL | S667: PRESTON
A668: PRAHRAN | C668: 4 | D668: 4 | E668: =C668*6+D668 -> 28 | G668: 10 | H668: 6 | I668: =G668*6+H668 -> 66 | K668: 16 | L668: 7 | M668: =K668*6+L668 -> 103 | O668: 22 | P668: 11 | Q668: =O668*6+P668 -> 143 | S668: UMPIRE | X668: LADDER | AB668: ROUND | AD668: 15
A669: PRESTON | C669: 6 | D669: 6 | E669: =C669*6+D669 -> 42 | G669: 8 | H669: 8 | I669: =G669*6+H669 -> 56 | K669: 14 | L669: 14 | M669: =K669*6+L669 -> 98 | O669: 20 | P669: 18 | Q669: =O669*6+P669 -> 138 | S669: STABB
A670: BEST PLAYERS | W670: TEAM | X670: W | Y670: L | Z670: D | AA670: FOR | AB670: AGST | AC670: % | AD670: PTS
A671: PRAHRAN | C671: AUSTIN | F671: KENT | I671: CHAPMAN | L671: JOHNSTON | O671: SMITH | R671: CLARKE
A672: PRESTON | C672: CANN | F672: MARTIN | I672: ROJO | L672: DURWOOD | O672: McCULLOCH | R672: McCONNELL | W672: PORT MELBOURNE | X672: 11 | Y672: 4 | Z672: 0 | AA672: 1897 | AB672: 1624 | AC672: 116.81 | AD672: 44
A673: GOALKICKERS | W673: PRESTON | X673: 10 | Y673: 4 | Z673: 1 | AA673: 1829 | AB673: 1621 | AC673: 112.83158544108575 | AD673: 42
A674: PRAHRAN | C674: SMITH 6 | E674: JOHNSTON 5 | H674: CLARKE 3 | J674: PREEN 3 | L674: KEKOVICH 2 | O674: KENT | Q674: AUSTIN | S674: LITTLE | W674: PRAHRAN | X674: 9 | Y674: 5 | Z674: 1 | AA674: 1824 | AB674: 1732 | AC674: 105.31177829099308 | AD674: 38
A675: PRESTON | C675: CANN 8 | E675: ROJO 3 | G675: McCULLOCH 3 | J675: RINGIN 2 | L675: JESSOP | N675: MARSHALL | Q675: DURWOOD | S675: BOLGER | W675: COBURG | X675: 8 | Y675: 7 | Z675: 0 | AA675: 1766 | AB675: 1618 | AC675: 109.14709517923362 | AD675: 32
A677: COBURG | C677: 7 | D677: 4 | E677: =C677*6+D677 -> 46 | G677: 9 | H677: 9 | I677: =G677*6+H677 -> 63 | K677: 15 | L677: 13 | M677: =K677*6+L677 -> 103 | O677: 17 | P677: 13 | Q677: =O677*6+P677 -> 115 | S677: BEACH ROAD | W677: DANDENONG | X677: 8 | Y677: 7 | Z677: 0 | AA677: 1850 | AB677: 1726 | AC677: 107.18424101969873 | AD677: 32
A678: SANDRINGHAM | C678: 2 | D678: 3 | E678: =C678*6+D678 -> 15 | G678: 6 | H678: 3 | I678: =G678*6+H678 -> 39 | K678: 7 | L678: 17 | M678: =K678*6+L678 -> 59 | O678: 15 | P678: 23 | Q678: =O678*6+P678 -> 113 | S678: HEDGER | W678: SANDRINGHAM | X678: 7 | Y678: 8 | Z678: 0 | AA678: 1710 | AB678: 1677 | AC678: 101.96779964221825 | AD678: 28
A679: BEST PLAYERS | W679: BRUNSWICK | X679: 7 | Y679: 8 | Z679: 0 | AA679: 1540 | AB679: 1572 | AC679: 97.96 | AD679: 28
A680: COBURG | C680: BEATTIE | F680: BREEN | I680: BURT | L680: P McDONALD | O680: SMITH | R680: HURST | W680: CAULFIELD | X680: 6 | Y680: 9 | Z680: 0 | AA680: 1634 | AB680: 1873 | AC680: 87.239722370528568 | AD680: 24
A681: SANDRINGHAM | C681: LYONS | F681: GIAMPAOLO | I681: DEAGAN | L681: HUTCHINSON | O681: OSBORNE | W681: GEELONG WEST | X681: 5 | Y681: 10 | Z681: 0 | AA681: 1558 | AB681: 1797 | AC681: 86.700055648302722 | AD681: 20
A682: GOALKICKERS | W682: MORDIALLOC | X682: 3 | Y682: 12 | Z682: 0 | AA682: 1548 | AB682: 1916 | AC682: 80.793319415448849 | AD682: 12
A683: COBURG | C683: SMITH 8 | F683: MANNIX 2 | I683: NOONAN 2 | L683: CLEARY 2 | N683: MILROY | P683: BURT | R683: HODGETTS
A684: SANDRINGHAM | C684: GILES 4 | F684: WILKINS 3 | I684: GIAMPAOLO 3 | L684: BEUS 2 | N684: OSBORNE | P684: LYONS | R684: HUTCHINSON
A686: BRUNSWICK | C686: 5 | D686: 3 | E686: =C686*6+D686 -> 33 | G686: 12 | H686: 8 | I686: =G686*6+H686 -> 80 | K686: 15 | L686: 14 | M686: =K686*6+L686 -> 104 | O686: 22 | P686: 16 | Q686: =O686*6+P686 -> 148 | S686: BRUNSWICK
A687: CAULFIELD | C687: 2 | D687: 4 | E687: =C687*6+D687 -> 16 | G687: 2 | H687: 7 | I687: =G687*6+H687 -> 19 | K687: 6 | L687: 8 | M687: =K687*6+L687 -> 44 | O687: 11 | P687: 12 | Q687: =O687*6+P687 -> 78 | S687: CASEY
A688: BEST PLAYERS
A689: BRUNSWICK | C689: BUCKLEY | F689: O'CONNOR | I689: TOY | K689: STONE | N689: SEERY | P689: DELL
A690: CAULFIELD | C690: KING | F690: TROTT | I690: MAGUIRE | K690: AMBLER | N690: BOOTH | P690: O'SULLIVAN
A691: GOALKICKERS
A692: BRUNSWICK | C692: TOY 6 | E692: MARANTELLI 4 | H692: GINGELL 3 | J692: ORTON 3 | M692: DELL 2 | O692: VALENTINE 2 | R692: MAGUIRE | U692: WEST
A693: CAULFIELD | C693: O'SULLIVAN 3 | G693: MAGUIRE 3 | J693: SUTHERLAND 2 | N693: TROTT | P693: COOK | R693: KING
A695: DANDENONG | C695: 6 | D695: 5 | E695: =C695*6+D695 -> 41 | G695: 10 | H695: 11 | I695: =G695*6+H695 -> 71 | K695: 15 | L695: 14 | M695: =K695*6+L695 -> 104 | O695: 16 | P695: 23 | Q695: =O695*6+P695 -> 119 | S695: GEELONG WEST
A696: GEELONG WEST | C696: 5 | D696: 3 | E696: =C696*6+D696 -> 33 | G696: 8 | H696: 5 | I696: =G696*6+H696 -> 53 | K696: 12 | L696: 8 | M696: =K696*6+L696 -> 80 | O696: 13 | P696: 12 | Q696: =O696*6+P696 -> 90 | S696: WENN
A697: BEST PLAYERS
A698: DANDENONG | C698: SHINNERS | F698: TAYLOR | I698: GUY | L698: HIBBERT | O698: REID | Q698: HARRINGTON
A699: GEELONG WEST | C699: GILMORE | F699: SCALE | I699: KARNILOWICZ | L699: VILLAROSA | O699: YATES | Q699: EDDY
A700: GOALKICKERS
A701: DANDENONG | C701: HIBBERT 4 | F701: REID 3 | H701: ELLIS 3 | J701: BRIESE 2 | M701: HARRINGTON | P701: GUY | Q701: ROSS | R701: DISTON
A702: GEELONG WEST | C702: RADOJEVIC 5 | F702: MIDDLEMISS 3 | J702: FRIEND 2 | M702: HOVEY | O702: GILMORE | Q702: PARSONS
A704: PORT MELBOURNE | C704: 7 | D704: 7 | E704: =C704*6+D704 -> 49 | G704: 12 | H704: 12 | I704: =G704*6+H704 -> 84 | K704: 21 | L704: 16 | M704: =K704*6+L704 -> 142 | O704: 27 | P704: 19 | Q704: =O704*6+P704 -> 181 | S704: MORDIALLOC
A705: MORDIALLOC | C705: 4 | D705: 3 | E705: =C705*6+D705 -> 27 | G705: 8 | H705: 6 | I705: =G705*6+H705 -> 54 | K705: 11 | L705: 9 | M705: =K705*6+L705 -> 75 | O705: 16 | P705: 14 | Q705: =O705*6+P705 -> 110 | S705: GROOM
A706: BEST PLAYERS
A707: PORT MELBOURNE | C707: BEDFORD | F707: JI CHRISTOU | I707: COOK | K707: RASMUSSEN | N707: G ALLEN | Q707: BOND
A708: MORDIALLOC | C708: LANE | F708: MOORE | I708: TURNER | K708: BOURNE | N708: DEATON | Q708: WILLIAMSON
A709: GOALKICKERS
A710: PORT MELBOURNE | C710: COOK 9 | E710: JI CHRISTOU 3 | H710: WHARTON 3 | K710: RASMUSSEN 3 | N710: BEDFORD 2 | Q710: JAMIESON 2 | T710: K GOSS 2 | W710: G ALLEN | X710: BOND | Z710: MOLONEY
A711: MORDIALLOC | C711: DEATON 5 | F711: NEVILLE 4 | I711: BOURNE 4 | L711: TURNER | N711: SABBATUCCI | Q711: JOHNSTON
A713: ROUND 16 | E713: 13TH AUGUST | J713: WEATHER | M713: SOUTH WEST WIND GROUNDS SOFT | S713: PLAYED AT
D714: 1ST QTR | H714: 2ND QTR | L714: 3RD QTR | P714: FINAL | S714: COBURG
A715: COBURG | C715: 1 | D715: 0 | E715: =C715*6+D715 -> 6 | G715: 3 | H715: 3 | I715: =G715*6+H715 -> 21 | K715: 6 | L715: 7 | M715: =K715*6+L715 -> 43 | O715: 7 | P715: 11 | Q715: =O715*6+P715 -> 53 | S715: UMPIRE | X715: LADDER | AB715: ROUND | AD715: 16
A716: BRUNSWICK | C716: 3 | D716: 7 | E716: =C716*6+D716 -> 25 | G716: 4 | H716: 12 | I716: =G716*6+H716 -> 36 | K716: 4 | L716: 17 | M716: =K716*6+L716 -> 41 | O716: 5 | P716: 18 | Q716: =O716*6+P716 -> 48 | S716: GROOM
A717: BEST PLAYERS | W717: TEAM | X717: W | Y717: L | Z717: D | AA717: FOR | AB717: AGST | AC717: % | AD717: PTS
A718: COBURG | C718: MILROY | F718: BURT | I718: BEATTIE | L718: HODGETTS | O718: MANNIX | R718: TOLLEY
A719: BRUNSWICK | C719: NOLAN | F719: McGHIE | I719: BUCKLEY | L719: O'CONNOR | O719: DELEDIO | R719: STONE | W719: PRESTON | X719: 11 | Y719: 4 | Z719: 1 | AA719: 1939 | AB719: 1700 | AC719: 114.05882352941177 | AD719: 46
A720: GOALKICKERS | W720: PORT MELBOURNE | X720: 11 | Y720: 5 | Z720: 0 | AA720: 2041 | AB720: 1770 | AC720: 115.31 | AD720: 44
A721: COBURG | C721: MANNIX 2 | F721: BEATTIE | I721: NOONAN | K721: HURST | M721: DOHNT | O721: SMITH | W721: PRAHRAN | X721: 10 | Y721: 5 | Z721: 1 | AA721: 1964 | AB721: 1779 | AC721: 110.39910061832491 | AD721: 42
A722: BRUNSWICK | C722: ORTON 2 | F722: DELL | H722: BA VALENTINE | K722: MARANTELLI | W722: COBURG | X722: 9 | Y722: 7 | Z722: 0 | AA722: 1819 | AB722: 1666 | AC722: 109.18367346938776 | AD722: 36
A724: DANDENONG | C724: 2 | D724: 5 | E724: =C724*6+D724 -> 17 | G724: 8 | H724: 6 | I724: =G724*6+H724 -> 54 | K724: 11 | L724: 8 | M724: =K724*6+L724 -> 74 | O724: 14 | P724: 10 | Q724: =O724*6+P724 -> 94 | S724: DANDENONG | W724: DANDENONG | X724: 9 | Y724: 7 | Z724: 0 | AA724: 1944 | AB724: 1805 | AC724: 107.70083102493075 | AD724: 36
A725: SANDRINGHAM | C725: 4 | D725: 3 | E725: =C725*6+D725 -> 27 | G725: 7 | H725: 7 | I725: =G725*6+H725 -> 49 | K725: 10 | L725: 10 | M725: =K725*6+L725 -> 70 | O725: 11 | P725: 13 | Q725: =O725*6+P725 -> 79 | S725: STABB | W725: SANDRINGHAM | X725: 7 | Y725: 9 | Z725: 0 | AA725: 1789 | AB725: 1771 | AC725: 101.0163749294184 | AD725: 28
A726: BEST PLAYERS | W726: BRUNSWICK | X726: 7 | Y726: 9 | Z726: 0 | AA726: 1588 | AB726: 1625 | AC726: 97.72 | AD726: 28
A727: DANDENONG | C727: BRIESE | F727: TOWNSEND | I727: TAYLOR | L727: WRIGHT | O727: SHINNERS | R727: McCONNELL | W727: GEELONG WEST | X727: 6 | Y727: 10 | Z727: 0 | AA727: 1704 | AB727: 1941 | AC727: 87.789799072642964 | AD727: 24
A728: SANDRINGHAM | C728: GIAMPAOLO | F728: SIMS | I728: FRANKLIN | L728: BARCLAY | O728: HUTCHINSON | R728: LYONS | W728: CAULFIELD | X728: 6 | Y728: 10 | Z728: 0 | AA728: 1713 | AB728: 1983 | AC728: 86.384266263237521 | AD728: 24
A729: GOALKICKERS | W729: MORDIALLOC | X729: 3 | Y729: 13 | Z729: 0 | AA729: 1595 | AB729: 2056 | AC729: 77.577821011673151 | AD729: 12
A730: DANDENONG | C730: BRIESE 8 | F730: TOWNSEND 2 | I730: ELLIS 2 | K730: PRENDERGAST 2
A731: SANDRINGHAM | C731: GILES 2 | E731: PLEDGER 2 | H731: WILKINS | J731: HUTCHINSON | M731: BEUS | N731: GIAMPAOLO | Q731: OSBORNE | T731: SIMS | V731: CLARK
A733: PRESTON | C733: 7 | D733: 7 | E733: =C733*6+D733 -> 49 | G733: 9 | H733: 9 | I733: =G733*6+H733 -> 63 | K733: 12 | L733: 16 | M733: =K733*6+L733 -> 88 | O733: 15 | P733: 20 | Q733: =O733*6+P733 -> 110 | S733: PRINCES PARK
A734: CAULFIELD | C734: 1 | D734: 6 | E734: =C734*6+D734 -> 12 | G734: 7 | H734: 12 | I734: =G734*6+H734 -> 54 | K734: 7 | L734: 14 | M734: =K734*6+L734 -> 56 | O734: 10 | P734: 19 | Q734: =O734*6+P734 -> 79 | S734: FITZPATRICK
A735: BEST PLAYERS
A736: PRESTON | C736: RENWICK | F736: CANN | H736: WILMOT | K736: WALSH | N736: McCULLOCH | Q736: MARSHALL
A737: CAULFIELD | C737: TROTT | F737: KING | H737: BOOTH | K737: HAWKING | N737: AMBLER | Q737: HUNT
A738: GOALKICKERS
A739: PRESTON | C739: RINGIN 3 | E739: CANN 3 | G739: LORENZINI 3 | J739: RENWICK 2 | M739: McONNELL | O739: WILMOT | Q739: MARSHALL | T739: McCONNELL
A740: CAULFIELD | C740: O'SULLIVAN 2 | G740: TROTT | I740: FRIGO | K740: LESTER | M740: MOORE | O740: KING | Q740: HAWKING | S740: TAYLOR | U740: ROWE
A742: PRAHRAN | C742: 4 | D742: 2 | E742: =C742*6+D742 -> 26 | G742: 10 | H742: 9 | I742: =G742*6+H742 -> 69 | K742: 14 | L742: 15 | M742: =K742*6+L742 -> 99 | O742: 19 | P742: 26 | Q742: =O742*6+P742 -> 140 | S742: TOORAK PARK
A743: MORDIALLOC | C743: 3 | D743: 5 | E743: =C743*6+D743 -> 23 | G743: 5 | H743: 6 | I743: =G743*6+H743 -> 36 | K743: 6 | L743: 11 | M743: =K743*6+L743 -> 47 | O743: 6 | P743: 11 | Q743: =O743*6+P743 -> 47 | S743: OAKLEY
A744: BEST PLAYERS
A745: PRAHRAN | C745: KEKOVICH | F745: PREEN | H745: JEFFREY | K745: KENT | N745: AUSTIN | Q745: CLARKE
A746: MORDIALLOC | C746: NORRIS | F746: DINGLE | H746: WILLIAMSON | K746: LONG | N746: TURNER | Q746: BARDOEL
A747: GOALKICKERS
A748: PRAHRAN | C748: PREEN 7 | F748: SMITH 6 | I748: JOHNSTON 3 | L748: CLARKE 2 | O748: KEKOVICH
A749: MORDIALLOC | C749: WILLIAMSON | F749: DINGLE | H749: NEVILLE | J749: NORRIS | L749: MOORE | N749: BOURNE
A751: GEELONG WEST | C751: 5 | D751: 5 | E751: =C751*6+D751 -> 35 | G751: 9 | H751: 8 | I751: =G751*6+H751 -> 62 | K751: 14 | L751: 11 | M751: =K751*6+L751 -> 95 | O751: 22 | P751: 14 | Q751: =O751*6+P751 -> 146 | S751: PORT MELBOURNE
A752: PORT MELBOURNE | C752: 5 | D752: 5 | E752: =C752*6+D752 -> 35 | G752: 9 | H752: 8 | I752: =G752*6+H752 -> 62 | K752: 18 | L752: 12 | M752: =K752*6+L752 -> 120 | O752: 21 | P752: 18 | Q752: =O752*6+P752 -> 144 | S752: HEDGER
A753: BEST PLAYERS
A754: GEELONG WEST | C754: GILMORE | F754: SMITH | I754: HAYDEN | L754: RADOJEVIC | O754: RUSSELL | R754: BEEKOF
A755: PORT MELBOURNE | C755: K GOSS | F755: JI CHRISTOU | I755: BOND | L755: AANENSEN | O755: JO CHRISTOU | R755: P GOSS
A756: GOALKICKERS
A757: GEELONG WEST | C757: RADOJEVIC 8 | F757: McGILLIVRAY 4 | J757: McKENNA 3 | M757: GILMORE 3 | P757: McMAHON 2 | S757: RUSSELL | U757: ROE
A758: PORT MELBOURNE | C758: COOK 7 | E758: JI CHRISTOU 5 | H758: HAENAN 3 | K758: BEDFORD 2 | N758: P GOSS 2 | Q758: K GOSS | S758: WHARTON
A760: ROUND 17 | E760: 20TH AUGUST | J760: WEATHER | N760: SHOWERS | S760: PLAYED AT
D761: 1ST QTR | H761: 2ND QTR | L761: 3RD QTR | P761: FINAL | S761: COBURG
A762: PRESTON | C762: 3 | D762: 3 | E762: =C762*6+D762 -> 21 | G762: 6 | H762: 4 | I762: =G762*6+H762 -> 40 | K762: 13 | L762: 7 | M762: =K762*6+L762 -> 85 | O762: 17 | P762: 13 | Q762: =O762*6+P762 -> 115 | S762: UMPIRE | X762: LADDER | AB762: ROUND | AD762: 17
A763: COBURG | C763: 5 | D763: 4 | E763: =C763*6+D763 -> 34 | G763: 12 | H763: 7 | I763: =G763*6+H763 -> 79 | K763: 16 | L763: 9 | M763: =K763*6+L763 -> 105 | O763: 17 | P763: 12 | Q763: =O763*6+P763 -> 114 | S763: WENN
A764: BEST PLAYERS | W764: TEAM | X764: W | Y764: L | Z764: D | AA764: FOR | AB764: AGST | AC764: % | AD764: PTS
A765: PRESTON | C765: WILMOT | F765: MARKS | I765: LORENZINI | L765: MARTIN | O765: MARSHALL | R765: BOLGER
A766: COBURG | C766: MILROY | F766: BREEN | I766: PITT | L766: CLEARY | O766: DOHNT | R766: BURT | W766: PRESTON | X766: 12 | Y766: 4 | Z766: 1 | AA766: 2054 | AB766: 1814 | AC766: 113.23042998897463 | AD766: 50
A767: GOALKICKERS | P767: WILMOT | R767: ROJO | W767: PORT MELBOURNE | X767: 12 | Y767: 5 | Z767: 0 | AA767: 2138 | AB767: 1863 | AC767: 114.76 | AD767: 48
A768: PRESTON | C768: LORENZINI 3 | F768: CANN 3 | H768: GONSALVES 2 | K768: MARKS 2 | M768: RYLES 2 | O768: RENWICK | Q768: MARSHALL | T768: RINGIN | W768: PRAHRAN | X768: 10 | Y768: 6 | Z768: 1 | AA768: 2057 | AB768: 1876 | AC768: 109.64818763326225 | AD768: 42
A769: COBURG | C769: SMITH 4 | E769: HERBERT 3 | H769: MILROY 3 | J769: CLEARY 2 | M769: MANNIX 2 | P769: NOONAN | R769: BURT | T769: DOHNT | W769: DANDENONG | X769: 10 | Y769: 7 | Z769: 0 | AA769: 2095 | AB769: 1896 | AC769: 110.4957805907173 | AD769: 40
A771: PORT MELBOURNE | C771: 5 | D771: 1 | E771: =C771*6+D771 -> 31 | G771: 8 | H771: 5 | I771: =G771*6+H771 -> 53 | K771: 11 | L771: 7 | M771: =K771*6+L771 -> 73 | O771: 14 | P771: 13 | Q771: =O771*6+P771 -> 97 | S771: PORT MELBOURNE | W771: COBURG | X771: 9 | Y771: 8 | Z771: 0 | AA771: 1933 | AB771: 1781 | AC771: 108.53453116226839 | AD771: 36
A772: PRAHRAN | C772: 2 | D772: 3 | E772: =C772*6+D772 -> 15 | G772: 7 | H772: 7 | I772: =G772*6+H772 -> 49 | K772: 13 | L772: 8 | M772: =K772*6+L772 -> 86 | O772: 14 | P772: 9 | Q772: =O772*6+P772 -> 93 | S772: STABB | W772: SANDRINGHAM | X772: 8 | Y772: 9 | Z772: 0 | AA772: 1960 | AB772: 1853 | AC772: 105.774419859687 | AD772: 32
A773: BEST PLAYERS | W773: BRUNSWICK | X773: 8 | Y773: 9 | Z773: 0 | AA773: 1733 | AB773: 1743 | AC773: 99.43 | AD773: 32
A774: PORT MELBOURNE | C774: DERMOTT | F774: RASMUSSEN | I774: IVANOFF | L774: P GOSS | N774: HARLAND | Q774: STIBBARD | W774: GEELONG WEST | X774: 6 | Y774: 11 | Z774: 0 | AA774: 1822 | AB774: 2086 | AC774: 87.344199424736331 | AD774: 24
A775: PRAHRAN | C775: KEKOVICH | F775: PREEN | I775: CHAPMAN | L775: KENT | N775: PEPE | Q775: McGUINNESS | W775: CAULFIELD | X775: 6 | Y775: 11 | Z775: 0 | AA775: 1804 | AB775: 2134 | AC775: 84.536082474226802 | AD775: 24
A776: GOALKICKERS | W776: MORDIALLOC | X776: 3 | Y776: 14 | Z776: 0 | AA776: 1677 | AB776: 2227 | AC776: 75.30309833857207 | AD776: 12
A777: PORT MELBOURNE | C777: RASMUSSEN 4 | F777: COOK 3 | H777: AANENSEN 2 | K777: JI CHRISTOU 2 | N777: BEDFORD | P777: G ALLEN | R777: MOLONEY
A778: PRAHRAN | C778: KEKOVICH 6 | F778: PREEN 4 | I778: JOHNSTON 2 | L778: AUSTIN | N778: SMITH
A780: BRUNSWICK | C780: 5 | D780: 3 | E780: =C780*6+D780 -> 33 | G780: 11 | H780: 7 | I780: =G780*6+H780 -> 73 | K780: 16 | L780: 13 | M780: =K780*6+L780 -> 109 | O780: 21 | P780: 19 | Q780: =O780*6+P780 -> 145 | S780: GEELONG WEST
A781: GEELONG WEST | C781: 3 | D781: 4 | E781: =C781*6+D781 -> 22 | G781: 7 | H781: 7 | I781: =G781*6+H781 -> 49 | K781: 10 | L781: 11 | M781: =K781*6+L781 -> 71 | O781: 17 | P781: 16 | Q781: =O781*6+P781 -> 118 | S781: FITZPATRICK
A782: BEST PLAYERS
A783: BRUNSWICK | C783: GINGELL | F783: STONE | I783: O'CONNOR | L783: SEERY | O783: DELL | R783: NOLAN
A784: GEELONG WEST | C784: GILMORE | F784: EDDY | I784: HAYDEN | L784: RUSSELL | O784: DEEATH
A785: GOALKICKERS
A786: BRUNSWICK | C786: MARANTELLI 4 | F786: DELEDIO 3 | I786: STONE 3 | K786: LAWRENCE 3 | N786: GINGELL 2 | Q786: ORTON 2 | S786: LEWIS | U786: WHITFORD | X786: HADZILLIAS | AA786: TOY
A787: GEELONG WEST | C787: RADOJEVIC 6 | F787: MIDDLEMISS 3 | J787: HAYDEN 2 | M787: EDDY 2 | O787: GILMORE | Q787: PARSONS | S787: McMAHON | V787: RUSSELL
A789: DANDENONG | C789: 8 | D789: 3 | E789: =C789*6+D789 -> 51 | G789: 12 | H789: 11 | I789: =G789*6+H789 -> 83 | K789: 15 | L789: 14 | M789: =K789*6+L789 -> 104 | O789: 22 | P789: 19 | Q789: =O789*6+P789 -> 151 | S789: DANDENONG
A790: CAULFIELD | C790: 3 | D790: 7 | E790: =C790*6+D790 -> 25 | G790: 6 | H790: 10 | I790: =G790*6+H790 -> 46 | K790: 10 | L790: 12 | M790: =K790*6+L790 -> 72 | O790: 13 | P790: 13 | Q790: =O790*6+P790 -> 91 | S790: McBAIN
A791: BEST PLAYERS
A792: DANDENONG | C792: HORAZCKO | F792: VAN DE BEEK | I792: GUY | K792: WRIGHT | N792: TOWNSEND
A793: CAULFIELD | C793: MAGUIRE | F793: TROTT | I793: LESTER | K793: BALL | N793: COMMADEUR
A794: GOALKICKERS
A795: DANDENONG | C795: BRIESE 6 | E795: TOWNSEND 4 | H795: TAYLOR 3 | J795: ELLIS 2 | L795: PRENDERGAST 2 | O795: HORAZCKO 2 | R795: VAN DE BEEK | V795: DROSCHER | X795: THOMPSON
A796: CAULFIELD | C796: SMITH 3 | F796: FRIGO 2 | H796: LESTER 2 | J796: KING 2 | L796: O'SULLIVAN | O796: TROTT | Q796: BOOTH | S796: HAWKING
A798: SANDRINGHAM | C798: 5 | D798: 5 | E798: =C798*6+D798 -> 35 | G798: 11 | H798: 7 | I798: =G798*6+H798 -> 73 | K798: 16 | L798: 13 | M798: =K798*6+L798 -> 109 | O798: 26 | P798: 15 | Q798: =O798*6+P798 -> 171 | S798: BEACH ROAD
A799: MORDIALLOC | C799: 2 | D799: 4 | E799: =C799*6+D799 -> 16 | G799: 5 | H799: 10 | I799: =G799*6+H799 -> 40 | K799: 10 | L799: 11 | M799: =K799*6+L799 -> 71 | O799: 11 | P799: 16 | Q799: =O799*6+P799 -> 82 | S799: GROOM
A800: BEST PLAYERS
A801: SANDRINGHAM | C801: GIAMPAOLO | F801: COELLI | I801: HUTCHINSON | L801: SIMS | O801: GILES
A802: MORDIALLOC | C802: SLADE | F802: NORRIS | I802: BARDOEL | L802: WILLIAMSON | O802: SCOTT | Q802: DINGLE
A803: GOALKICKERS
A804: SANDRINGHAM | C804: GILES 6 | E804: BEUS 5 | G804: PLEDGER 3 | J804: HUTCHINSON 3 | M804: GIAMPAOLO 3 | P804: MANNIX 2 | R804: WILKINS | U804: O'BRIEN | W804: CLARK | X804: SIMS
A805: MORDIALLOC | C805: NORRIS 3 | F805: WILLIAMSON 2 | J805: SLADE | L805: DINGLE | N805: BOURNE | P805: ROGERSON | R805: BARDOEL | U805: TURNER
A807: ROUND 18 | E807: 27TH AUGUST | J807: WEATHER | N807: SOUTH WEST WIND | S807: PLAYED AT
D808: 1ST QTR | H808: 2ND QTR | L808: 3RD QTR | P808: FINAL | S808: PRESTON
A809: DANDENONG | C809: 8 | D809: 6 | E809: =C809*6+D809 -> 54 | G809: 9 | H809: 8 | I809: =G809*6+H809 -> 62 | K809: 21 | L809: 11 | M809: =K809*6+L809 -> 137 | O809: 28 | P809: 13 | Q809: =O809*6+P809 -> 181 | S809: UMPIRE | X809: LADDER | AB809: ROUND | AD809: 18
A810: PRESTON | C810: 2 | D810: 5 | E810: =C810*6+D810 -> 17 | G810: 10 | H810: 13 | I810: =G810*6+H810 -> 73 | K810: 13 | L810: 16 | M810: =K810*6+L810 -> 94 | O810: 17 | P810: 19 | Q810: =O810*6+P810 -> 121 | S810: HEDGER
A811: BEST PLAYERS | W811: TEAM | X811: W | Y811: L | Z811: D | AA811: FOR | AB811: AGST | AC811: % | AD811: PTS
A812: DANDENONG | C812: THOMPSON | F812: ELLIS | I812: VAN DE BEEK | L812: GUY | O812: TOWNSEND | R812: TAYLOR
A813: PRESTON | C813: CANN | F813: MARSHALL | I813: MARKS | L813: BOLGER | O813: McCULLOCH | R813: COOK | W813: PORT MELBOURNE | X813: 13 | Y813: 5 | Z813: 0 | AA813: 2305 | AB813: 1996 | AC813: 115.48 | AD813: 52
A814: GOALKICKERS | Q814: VAN DE BEEK | W814: PRESTON | X814: 12 | Y814: 5 | Z814: 1 | AA814: 2175 | AB814: 1995 | AC814: 109.02255639097744 | AD814: 50
A815: DANDENONG | C815: ELLIS 8 | E815: THOMPSON 7 | H815: TOWNSEND 3 | K815: TAYLOR 3 | M815: GUY 3 | O815: REID | P815: ALLEN | R815: BRIESE | T815: ROSS | W815: PRAHRAN | X815: 11 | Y815: 6 | Z815: 1 | AA815: 2221 | AB815: 1965 | AC815: 113.02798982188295 | AD815: 46
A816: PRESTON | C816: MARKS 4 | F816: SALTMARSH 3 | I816: LORENZINI 3 | L816: COOK 3 | N816: FREMANTLE 2 | Q816: MARSHALL 2 | W816: DANDENONG | X816: 11 | Y816: 7 | Z816: 0 | AA816: 2276 | AB816: 2017 | AC816: 112.84085275161131 | AD816: 44
A818: PRAHRAN | C818: 5 | D818: 3 | E818: =C818*6+D818 -> 33 | G818: 10 | H818: 7 | I818: =G818*6+H818 -> 67 | K818: 15 | L818: 11 | M818: =K818*6+L818 -> 101 | O818: 25 | P818: 14 | Q818: =O818*6+P818 -> 164 | S818: BRUNSWICK | W818: COBURG | X818: 10 | Y818: 8 | Z818: 0 | AA818: 2087 | AB818: 1887 | AC818: 110.5988341282459 | AD818: 40
A819: BRUNSWICK | C819: 5 | D819: 5 | E819: =C819*6+D819 -> 35 | G819: 6 | H819: 6 | I819: =G819*6+H819 -> 42 | K819: 12 | L819: 8 | M819: =K819*6+L819 -> 80 | O819: 13 | P819: 11 | Q819: =O819*6+P819 -> 89 | S819: WENN | W819: SANDRINGHAM | X819: 8 | Y819: 10 | Z819: 0 | AA819: 2054 | AB819: 1967 | AC819: 104.42297915607524 | AD819: 32
A820: BEST PLAYERS | W820: BRUNSWICK | X820: 8 | Y820: 10 | Z820: 0 | AA820: 1822 | AB820: 1907 | AC820: 95.54 | AD820: 32
A821: PRAHRAN | C821: TAYLOR | F821: PREEN | I821: RAE | L821: JOHNSTON | O821: KEKOVICH | R821: CHAPMAN | W821: GEELONG WEST | X821: 7 | Y821: 11 | Z821: 0 | AA821: 1936 | AB821: 2180 | AC821: 88.807339449541288 | AD821: 28
A822: BRUNSWICK | C822: TOY | F822: SEERY | I822: O'CONNOR | L822: GINGELL | O822: STONE | R822: NOLAN | W822: CAULFIELD | X822: 6 | Y822: 12 | Z822: 0 | AA822: 1937 | AB822: 2301 | AC822: 84.18 | AD822: 24
A823: GOALKICKERS | W823: MORDIALLOC | X823: 3 | Y823: 15 | Z823: 0 | AA823: 1783 | AB823: 2381 | AC823: 74.884502309953803 | AD823: 12
A824: PRAHRAN | C824: JOHNSTON 6 | F824: SMITH 5 | H824: KEKOVICH 5 | K824: TAYLOR 3 | M824: THORNTON 2 | P824: D'ANGELO 2 | S824: PREEN | U824: RAE
A825: BRUNSWICK | C825: LAWRENCE 3 | F825: TOY 2 | H825: GINGELL 2 | J825: STONE | L825: NOLAN | N825: HARVEY | P825: HUGGARD | R825: VALENTINE | U825: MARANTELLI
A827: GEELONG WEST | C827: 5 | D827: 12 | E827: =C827*6+D827 -> 42 | G827: 6 | H827: 13 | I827: =G827*6+H827 -> 49 | K827: 14 | L827: 16 | M827: =K827*6+L827 -> 100 | O827: 16 | P827: 18 | Q827: =O827*6+P827 -> 114 | S827: GEELONG WEST
A828: SANDRINGHAM | C828: 2 | D828: 3 | E828: =C828*6+D828 -> 15 | G828: 2 | H828: 11 | I828: =G828*6+H828 -> 23 | K828: 4 | L828: 17 | M828: =K828*6+L828 -> 41 | O828: 12 | P828: 22 | Q828: =O828*6+P828 -> 94 | S828: CASEY
A829: BEST PLAYERS
A830: GEELONG WEST | C830: GILMORE | F830: VILLAROSA | I830: BEEKOF | L830: EDDY | O830: ROE | R830: RUSSELL
A831: SANDRINGHAM | C831: COELLI | F831: PETERS | I831: FRANKLIN | L831: WILKINS
A832: GOALKICKERS
A833: GEELONG WEST | C833: GILMORE 4 | F833: ROE 3 | H833: RADOJEVIC 3 | K833: MIDDLEMISS 2 | N833: PARSONS | P833: EDDY | R833: FRIEND | T833: RUSSELL
A834: SANDRINGHAM | C834: GILES 3 | F834: DEAGAN 2 | I834: T O'BRIEN 2 | L834: CAMPBELL 2 | O834: PLEDGER | Q834: CLARK | S834: MANNIX
A836: COBURG | C836: 5 | D836: 6 | E836: =C836*6+D836 -> 36 | G836: 8 | H836: 9 | I836: =G836*6+H836 -> 57 | K836: 16 | L836: 15 | M836: =K836*6+L836 -> 111 | O836: 22 | P836: 22 | Q836: =O836*6+P836 -> 154 | S836: MORDIALLOC
A837: MORDIALLOC | C837: 5 | D837: 1 | E837: =C837*6+D837 -> 31 | G837: 12 | H837: 5 | I837: =G837*6+H837 -> 77 | K837: 13 | L837: 9 | M837: =K837*6+L837 -> 87 | O837: 15 | P837: 16 | Q837: =O837*6+P837 -> 106 | S837: STABB
A838: BEST PLAYERS
A839: COBURG | C839: MILROY | F839: MANNIX | I839: NOONAN | L839: LAIDLER | O839: COLLINS
A840: MORDIALLOC | C840: NORRIS | F840: WILLIAMSON | I840: DEATON | L840: SLADE | O840: DINGLE | R840: MOORE
A841: GOALKICKERS
A842: COBURG | C842: SMITH 6 | E842: MANNIX 3 | G842: HERBERT 2 | I842: COLLINS 2 | L842: NOONAN 2 | N842: PRICE | P842: BEATTIE | R842: BREEN | T842: CLEARY | W842: HURST | X842: BURT | Z842: DOHNT
A843: MORDIALLOC | C843: DEATON 5 | F843: NORRIS 3 | I843: NEVILLE 2 | L843: WILLIAMSON | O843: ROGERSON | Q843: BOURNE | S843: TURNER | U843: SCOTT
A845: PORT MELBOURNE | C845: 6 | D845: 7 | E845: =C845*6+D845 -> 43 | G845: 9 | H845: 11 | I845: =G845*6+H845 -> 65 | K845: 15 | L845: 21 | M845: =K845*6+L845 -> 111 | O845: 24 | P845: 23 | Q845: =O845*6+P845 -> 167 | S845: PRINCES PARK
A846: CAULFIELD | C846: 4 | D846: 0 | E846: =C846*6+D846 -> 24 | G846: 11 | H846: 7 | I846: =G846*6+H846 -> 73 | K846: 13 | L846: 10 | M846: =K846*6+L846 -> 88 | O846: 20 | P846: 13 | Q846: =O846*6+P846 -> 133 | S846: OAKLEY
A847: BEST PLAYERS
A848: PORT MELBOURNE | C848: COOK | F848: BEECROFT | I848: HARLAND | L848: JI CHRISTOU | O848: K GOSS | R848: CRITCH
A849: CAULFIELD | C849: TROTT | F849: BALL | I849: MOORE | L849: KING | O849: O'SULLIVAN | R849: BOOTH
A850: GOALKICKERS
A851: PORT MELBOURNE | C851: COOK 10 | F851: JI CHRISTOU 4 | I851: G ALLEN 2 | L851: HARLAND 2 | O851: RASMUSSEN 2 | R851: OWEN | T851: HAENAN | W851: K GOSS | X851: JAMIESON
A852: CAULFIELD | C852: MOORE 7 | F852: TROTT 4 | I852: KING 3 | K852: LESTER 2 | M852: MAGUIRE 2 | P852: FRIGO | R852: BOOTH
A854: FINALS
A855: 1ST SEMI | E855: 3RD SEPTEMBER | J855: WEATHER | N855: NORTH WIND
D856: 1ST QTR | H856: 2ND QTR | L856: 3RD QTR | P856: FINAL
A857: PRAHRAN | C857: 4 | D857: 3 | E857: =C857*6+D857 -> 27 | G857: 11 | H857: 10 | I857: =G857*6+H857 -> 76 | K857: 14 | L857: 13 | M857: =K857*6+L857 -> 97 | O857: 21 | P857: 16 | Q857: =O857*6+P857 -> 142 | S857: JUNCTION OVAL
A858: DANDENONG | C858: 5 | D858: 4 | E858: =C858*6+D858 -> 34 | G858: 11 | H858: 6 | I858: =G858*6+H858 -> 72 | K858: 15 | L858: 14 | M858: =K858*6+L858 -> 104 | O858: 17 | P858: 15 | Q858: =O858*6+P858 -> 117 | S858: STABB
A859: BEST PLAYERS
A860: PRAHRAN | C860: ANDERSON | F860: TAYLOR | I860: PEPE | L860: SMITH | O860: RU KELLY | R860: D'ANGELO
A861: DANDENONG | C861: LUKAS | F861: TOWNSEND | I861: SHINNERS | L861: VAN DE BEEK | O861: GUY | R861: TAYLOR
A862: GOALKICKERS
A863: PRAHRAN | C863: SMITH 7 | F863: RAE 4 | H863: AUSTIN 4 | J863: CLARKE | L863: D'ANGELO | N863: PREEN | P863: PEPE | R863: THORNTON | U863: TAYLOR
A864: DANDENONG | C864: TOWNSEND 7 | F864: THOMPSON 3 | I864: ROSS 2 | K864: TAYLOR 2 | N864: LYNN | P864: GUY | R864: HARRINGTON
A866: 2ND SEMI | D866: 10TH SEPTEMBER | J866: WEATHER | M866: NORTH WIND FINE
A867: PRESTON | C867: 10 | D867: 4 | E867: =C867*6+D867 -> 64 | G867: 14 | H867: 8 | I867: =G867*6+H867 -> 92 | K867: 18 | L867: 11 | M867: =K867*6+L867 -> 119 | O867: 20 | P867: 14 | Q867: =O867*6+P867 -> 134 | S867: JUNCTION OVAL
A868: PORT MELBOURNE | C868: 4 | D868: 5 | E868: =C868*6+D868 -> 29 | G868: 10 | H868: 7 | I868: =G868*6+H868 -> 67 | K868: 15 | L868: 10 | M868: =K868*6+L868 -> 100 | O868: 19 | P868: 16 | Q868: =O868*6+P868 -> 130 | S868: WENN
A869: BEST PLAYERS
A870: PRESTON | C870: MARSHALL | F870: BOLGER | I870: MARKS | L870: DURWOOD | O870: MARTIN | Q870: McCONNELL
A871: PORT MELBOURNE | C871: K GOSS | F871: G ALLEN | I871: BEDFORD | L871: P GOSS | O871: BOND | Q871: COOK
A872: GOALKICKERS
A873: PRESTON | C873: CANN 5 | E873: MARSHALL 5 | H873: LORENZINI 3 | K873: MARKS 2 | M873: GONSALVES 2 | P873: WILMOT | R873: DURWOOD | U873: ROJO
A874: PORT MELBOURNE | C874: COOK 8 | E874: RASMUSSEN 3 | H874: BEDFORD 2 | K874: BOND 2 | M874: P GOSS 2 | O874: HARLAND | Q874: JI CHRISTOU
A876: PRELIMINARY FINAL | F876: 17TH SEPTEMBER | K876: WEATHER
A877: PRAHRAN | C877: 5 | D877: 1 | E877: =C877*6+D877 -> 31 | G877: 10 | H877: 7 | I877: =G877*6+H877 -> 67 | K877: 13 | L877: 9 | M877: =K877*6+L877 -> 87 | O877: 20 | P877: 14 | Q877: =O877*6+P877 -> 134 | S877: JUNCTION OVAL
A878: PORT MELBOURNE | C878: 4 | D878: 7 | E878: =C878*6+D878 -> 31 | G878: 9 | H878: 10 | I878: =G878*6+H878 -> 64 | K878: 15 | L878: 15 | M878: =K878*6+L878 -> 105 | O878: 16 | P878: 16 | Q878: =O878*6+P878 -> 112 | S878: HEDGER
A879: BEST PLAYERS
A880: PRAHRAN | C880: ANDERSON | F880: PEPE | I880: KEKOVICH | L880: CHAPMAN | O880: RAE | R880: PREEN
A881: PORT MELBOURNE | C881: K GOSS | F881: JI CHRISTOU | I881: HAENAN | L881: IVANOFF | O881: STIBBARD | R881: HARLAND
A882: GOALKICKERS
A883: PRAHRAN | C883: KEKOVICH 5 | F883: PREEN 4 | H883: SMITH 3 | J883: AUSTIN 2 | M883: D'ANGELO 2 | P883: CLARKE | R883: JOHNSTON | U883: DWYER | W883: TAYLOR
A884: PORT MELBOURNE | C884: COOK 4 | F884: JO CHRISTOU 4 | J884: K GOSS 3 | M884: RASMUSSEN 2 | P884: BEDFORD 2 | S884: P GOSS
A886: GRAND FINAL | D886: 24TH SEPTEMBER | J886: WEATHER | N886: SOUTH WIND FINE
A887: PRAHRAN | C887: 8 | D887: 3 | E887: 51 | G887: 9 | H887: 7 | I887: 61 | K887: 18 | L887: 12 | M887: 120 | O887: 21 | P887: 15 | Q887: =O887*6+P887 -> 141 | S887: JUNCTION OVAL
A888: PRESTON | C888: 5 | D888: 3 | E888: 33 | G888: 10 | H888: 11 | I888: 71 | K888: 13 | L888: 12 | M888: 90 | O888: 17 | P888: 17 | Q888: =O888*6+P888 -> 119 | S888: WENN
A889: BEST PLAYERS
A890: PRAHRAN | C890: McGUINNESS | F890: PEPE | I890: AUSTIN | L890: ANDERSON | O890: FOLEY | Q890: SMITH
A891: PRESTON | C891: BOLGER | F891: RENWICK | I891: MARSHALL | L891: MARKS | O891: MARTIN | Q891: CANN
A892: GOALKICKERS
A893: PRAHRAN | C893: SMITH 7 | F893: PREEN 4 | I893: JOHNSTON 4 | L893: AUSTIN 2 | O893: CLARKE | Q893: KEKOVICH | S893: TAYLOR | U893: DWYER
A894: PRESTON | C894: CANN 4 | E894: GONSALVES 3 | H894: RENWICK 2 | K894: LORENZINI 2 | N894: WILMOT 2 | Q894: MARKS 2 | S894: DURWOOD | V894: RINGIN
A896: REPRESENTATIVE MATCH | G896: 4TH JUNE
A897: QUEENSLAND | C897: 2 | D897: 0 | E897: =C897*6+D897 -> 12 | G897: 7 | H897: 4 | I897: =G897*6+H897 -> 46 | K897: 15 | L897: 9 | M897: =K897*6+L897 -> 99 | O897: 18 | P897: 14 | Q897: =O897*6+P897 -> 122
A898: V.F.A. | C898: 3 | D898: 6 | E898: =C898*6+D898 -> 24 | G898: 6 | H898: 12 | I898: =G898*6+H898 -> 48 | K898: 10 | L898: 14 | M898: =K898*6+L898 -> 74 | O898: 14 | P898: 20 | Q898: =O898*6+P898 -> 104
A899: BEST PLAYERS
A900: QUEENSLAND
A901: V.F.A.
A902: GOALKICKERS
A903: QUEENSLAND
A904: V.F.A.
A906: V.F.A. TEAMS IN N.F.L. COMPETITION
E907: 9TH MAY | I907: WEATHER | M907: SOUTH WIND COLD & WET
D908: 1ST QTR | H908: 2ND QTR | L908: 3RD QTR | P908: FINAL
A909: PORT MELBOURNE | C909: 1 | D909: 7 | E909: =C909*6+D909 -> 13 | G909: 7 | H909: 8 | I909: =G909*6+H909 -> 50 | K909: 11 | L909: 15 | M909: =K909*6+L909 -> 81 | O909: 12 | P909: 20 | Q909: =O909*6+P909 -> 92 | S909: SOUTH MELBOURNE
A910: N.S.W. | C910: 1 | D910: 2 | E910: =C910*6+D910 -> 8 | G910: 2 | H910: 2 | I910: =G910*6+H910 -> 14 | K910: 4 | L910: 3 | M910: =K910*6+L910 -> 27 | O910: 7 | P910: 4 | Q910: =O910*6+P910 -> 46
A911: BEST PLAYERS
A912: PORT MELBOURNE | C912: COOK | F912: RASMUSSEN | I912: GOSS | L912: ALLEN | N912: PROFFIT | Q912: BEECROFT
A913: N.S.W. | C913: CERATO | F913: W GOSS | I913: CLARIDGE | L913: S WAY | N913: PENDRICK | Q913: FOSTER
A914: GOALKICKERS
A915: PORT MELBOURNE | C915: COOK 8 | F915: ALLEN 2 | I915: P GOSS | K915: CHRISTOU
A916: N.S.W. | C916: CERATO 3 | F916: S WAY 2 | I916: PENDRICK | K916: L WRAY
D918: 23RD MAY | J918: WEATHER | M918: RAIN GROUND BAD
A919: SANDRINGHAM | C919: 2 | D919: 2 | E919: =C919*6+D919 -> 14 | G919: 5 | H919: 5 | I919: =G919*6+H919 -> 35 | K919: 8 | L919: 7 | M919: =K919*6+L919 -> 55 | O919: 12 | P919: 10 | Q919: =O919*6+P919 -> 82 | S919: SOUTH MELBOURNE
A920: A.C.T. | C920: 4 | D920: 3 | E920: =C920*6+D920 -> 27 | G920: 6 | H920: 4 | I920: =G920*6+H920 -> 40 | K920: 9 | L920: 5 | M920: =K920*6+L920 -> 59 | O920: 12 | P920: 6 | Q920: =O920*6+P920 -> 78 | S920: HEDGER/STABB
A921: BEST PLAYERS
A922: SANDRINGHAM | C922: GILMORE | F922: LYONS | I922: HUNTER | L922: PLEDGER | O922: SIMS
A923: A.C.T. | C923: BRISTOW | F923: BLACK | I923: HARRINGTON | L923: BLACKABY | O923: COWELL
A924: GOALKICKERS
A925: SANDRINGHAM | C925: GILMORE 5 | F925: HUNTER 2 | I925: HIGGS | K925: KENNEDY | N925: DEAGAN | P925: MANNIX | R925: BEUS
A926: A.C.T. | C926: MANSON 3 | F926: WHITE 2 | I926: BLACK 2 | K926: COWELL 2 | N926: NEAGLE | P926: BROCK | R926: LESYEWIK
E928: 6TH JUNE | J928: WEATHER | M928: RAIN
A929: COBURG | C929: 3 | D929: 3 | E929: =C929*6+D929 -> 21 | G929: 6 | H929: 4 | I929: =G929*6+H929 -> 40 | K929: 9 | L929: 8 | M929: =K929*6+L929 -> 62 | O929: 10 | P929: 11 | Q929: =O929*6+P929 -> 71 | S929: SOUTH MELBOURNE
A930: EAST PERTH | C930: 2 | D930: 2 | E930: =C930*6+D930 -> 14 | G930: 3 | H930: 4 | I930: =G930*6+H930 -> 22 | K930: 6 | L930: 6 | M930: =K930*6+L930 -> 42 | O930: 7 | P930: 7 | Q930: =O930*6+P930 -> 49 | S930: WENN/GROOM
A931: BEST PLAYERS
A932: COBURG | C932: BREEN | F932: MILROY | I932: BURT | L932: PITT | N932: LLOYD
A933: EAST PERTH | C933: SMITH | F933: HAMILTON | I933: ROBERTSON | L933: DA-RE
A934: GOALKICKERS
A935: COBURG | C935: LLOYD 4 | F935: CLEARY 2 | I935: McMILLAN | K935: DOHNT | M935: PITT | O935: McDONALD
A936: EAST PERTH | C936: OTWAY 2 | F936: DUDA | H936: HAMILTON | K936: RAY | M936: THOMSON | O936: ARNOLD | Q936: DA-RE
A938: QUARTER FINALS
E939: 20TH JUNE | J939: WEATHER | M939: RAIN COLD FOGGY
A940: PORT MELBOURNE | C940: 1 | D940: 6 | E940: =C940*6+D940 -> 12 | G940: 3 | H940: 12 | I940: =G940*6+H940 -> 30 | K940: 11 | L940: 14 | M940: =K940*6+L940 -> 80 | O940: 13 | P940: 18 | Q940: =O940*6+P940 -> 96 | S940: SOUTH MELBOURNE
A941: QUEENSLAND | C941: 2 | D941: 3 | E941: =C941*6+D941 -> 15 | G941: 4 | H941: 3 | I941: =G941*6+H941 -> 27 | K941: 6 | L941: 5 | M941: =K941*6+L941 -> 41 | O941: 9 | P941: 6 | Q941: =O941*6+P941 -> 60
A942: BEST PLAYERS
A943: PORT MELBOURNE | C943: G ALLEN | F943: BECKWITH | I943: HARLAND | L943: TREASURE | O943: COOK | R943: IVANOFF
A944: QUEENSLAND | C944: CLARKE | F944: DUNELL | I944: Z TAYLOR | L944: CATTELLINI | O944: KIMMORLEY | R944: WALLACE
A945: GOALKICKERS
A946: PORT MELBOURNE | C946: G ALLEN 4 | F946: RASMUSSEN 3 | I946: BECKWITH 3 | L946: COOK 2 | N946: LOWE
A947: QUEENSLAND | C947: CLARKE 6 | F947: BUCKWELL | I947: DUNELL | K947: CATTELLINI
D949: 4TH JULY | J949: WEATHER | M949: COLD WET
A950: SOUTH ADELAIDE | C950: 4 | D950: 2 | E950: =C950*6+D950 -> 26 | G950: 6 | H950: 6 | I950: =G950*6+H950 -> 42 | K950: 10 | L950: 9 | M950: =K950*6+L950 -> 69 | O950: 14 | P950: 14 | Q950: =O950*6+P950 -> 98 | S950: SOUTH MELBOURNE
A951: SANDRINGHAM | C951: 1 | D951: 2 | E951: =C951*6+D951 -> 8 | G951: 2 | H951: 3 | I951: =G951*6+H951 -> 15 | K951: 3 | L951: 4 | M951: =K951*6+L951 -> 22 | O951: 5 | P951: 5 | Q951: =O951*6+P951 -> 35
A952: BEST PLAYERS
A953: SOUTH ADELAIDE | C953: MINNIS | F953: SLATTERY | I953: BAYNES | L953: FRY | O953: COTTER | R953: HAYNES
A954: SANDRINGHAM | C954: GIAMPAOLO | F954: COELLI | I954: PETERS | L954: O'BRIEN | O954: FRANKLIN | R954: WILKINS
A955: GOALKICKERS
A956: SOUTH ADELAIDE | C956: MINNIS 5 | E956: COBB 3 | G956: BUTLER 2 | I956: LYONS 2 | K956: HATELEY | M956: GREEN
A957: SANDRINGHAM | C957: GIAMPAOLO 2 | F957: POLSON | H957: KENNEDY | J957: OSBORNE
A959: GLENELG | C959: 5 | D959: 0 | E959: =C959*6+D959 -> 30 | G959: 7 | H959: 2 | I959: =G959*6+H959 -> 44 | K959: 10 | L959: 8 | M959: =K959*6+L959 -> 68 | O959: 15 | P959: 11 | Q959: =O959*6+P959 -> 101 | S959: NORWOOD
A960: COBURG | C960: 2 | D960: 1 | E960: =C960*6+D960 -> 13 | G960: 6 | H960: 4 | I960: =G960*6+H960 -> 40 | K960: 8 | L960: 4 | M960: =K960*6+L960 -> 52 | O960: 13 | P960: 6 | Q960: =O960*6+P960 -> 84 | S960: ARGENT/SCHOELEFIELD
A961: BEST PLAYERS
A962: GLENELG | C962: HOLST | F962: McINERNEY | I962: COPPING | L962: CAREY | O962: JOHNSTON | R962: HERCOCK
A963: COBURG | C963: PITT | F963: CLEARY | I963: LLOYD | L963: BREEN | O963: HERBERT | R963: TOLLEY
A964: GOALKICKERS
A965: GLENELG | C965: PHILLIS 6 | F965: McINERNEY 3 | I965: MACVICAR 2 | L965: HOLST 2 | N965: COPPING | P965: CAREY
A966: COBURG | C966: SMITH 5 | F966: MANNIX 3 | I966: CLEARY 2 | L966: McMILLAN | N966: HERBERT | P966: NOONAN
A968: SEMI FINAL | E968: 18TH JULY | J968: WEATHER
A969: SOUTH ADELAIDE | C969: 1 | D969: 3 | E969: =C969*6+D969 -> 9 | G969: 3 | H969: 6 | I969: =G969*6+H969 -> 24 | K969: 7 | L969: 9 | M969: =K969*6+L969 -> 51 | O969: 9 | P969: 14 | Q969: =O969*6+P969 -> 68 | S969: SOUTH MELBOURNE
A970: PORT MELBOURNE | C970: 3 | D970: 3 | E970: =C970*6+D970 -> 21 | G970: 6 | H970: 4 | I970: =G970*6+H970 -> 40 | K970: 8 | L970: 6 | M970: =K970*6+L970 -> 54 | O970: 9 | P970: 9 | Q970: =O970*6+P970 -> 63
A971: BEST PLAYERS
A972: SOUTH ADELAIDE
A973: PORT MELBOURNE
A974: GOALKICKERS
A975: SOUTH ADELAIDE | C975: HARRADINE 2 | F975: RUSCUKLIC 2 | I975: BAYNES | K975: BENNETT | M975: HINES | O975: McINNES | Q975: SCHNEEBICHLER
A976: PORT MELBOURNE | C976: COOK 5 | F976: RASMUSSEN 2 | I976: BEDFORD | K976: P GOSS
A978: LIGHTNING PREMIERSHIP
A979: 1ST ROUND | H979: 2ND ROUND
A980: BOX HILL | C980: 7 | D980: 3 | E980: =C980*6+D980 -> 45 | H980: BOX HILL | K980: 5 | L980: 5 | M980: =K980*6+L980 -> 35
A981: SUNSHINE | C981: 5 | D981: 7 | E981: =C981*6+D981 -> 37 | H981: NORTHCOTE | K981: 2 | L981: 6 | M981: =K981*6+L981 -> 18
A983: WERRIBEE | C983: 7 | D983: 6 | E983: =C983*6+D983 -> 48 | H983: WERRIBEE | K983: 7 | L983: 2 | M983: =K983*6+L983 -> 44
A984: WILLIAMSTOWN | C984: 4 | D984: 5 | E984: =C984*6+D984 -> 29 | H984: WAVERLEY | K984: 4 | L984: 5 | M984: =K984*6+L984 -> 29
A986: 3RD ROUND | H986: 4TH ROUND
A987: MORDIALLOC | C987: 6 | D987: 7 | E987: =C987*6+D987 -> 43 | H987: WERRIBEE | K987: 5 | L987: 4 | M987: =K987*6+L987 -> 34
A988: BRUNSWICK | C988: 4 | D988: 6 | E988: =C988*6+D988 -> 30 | H988: BOX HILL | K988: 4 | L988: 3 | M988: =K988*6+L988 -> 27
A990: CAULFIELD | C990: 6 | D990: 7 | E990: =C990*6+D990 -> 43 | H990: CAULFIELD | K990: 6 | L990: 3 | M990: =K990*6+L990 -> 39
A991: GEELONG WEST | C991: 5 | D991: 5 | E991: =C991*6+D991 -> 35 | H991: MORDIALLOC | K991: 2 | L991: 5 | M991: =K991*6+L991 -> 17
A993: SEMI-FINALS
A994: WERRIBEE | C994: 7 | D994: 1 | E994: =C994*6+D994 -> 43 | H994: SANDRINGHAM | K994: 8 | L994: 1 | M994: =K994*6+L994 -> 49
A995: COBURG | C995: 6 | D995: 2 | E995: =C995*6+D995 -> 38 | H995: CAULFIELD | K995: 4 | L995: 6 | M995: =K995*6+L995 -> 30
A997: FINAL
A998: WERRIBEE | C998: 5 | D998: 2 | E998: =C998*6+D998 -> 32
A999: SANDRINGHAM | C999: 3 | D999: 10 | E999: =C999*6+D999 -> 28