A1: Victorian Football Association
A2: Season 1978 - Division Two
A3: © Copyright Wal Williams | F3: First created: 28 March 2016
A4: Contact: joywalwi at gmail dot com | F4: Last updated: 28 March 2016 | W4: VFA Results and tables - Link to the main index page
A5: You are free to copy this document in whole or part provided that proper acknowledgement is given to the author. All rights reserved.
A7: 1978 | C7: V.F.A. SEASON 2ND DIVISION
A8: ROUND 1 | E8: 9TH APRIL | J8: WEATHER | S8: PLAYED AT
D9: 1ST QTR | H9: 2ND QTR | L9: 3RD QTR | P9: FINAL | S9: SUNSHINE
A10: WAVERLEY | C10: 0 | D10: 0 | E10: =C10*6+D10 -> 0 | G10: 0 | H10: 0 | I10: =G10*6+H10 -> 0 | K10: 0 | L10: 0 | M10: =K10*6+L10 -> 0 | O10: 24 | P10: 10 | Q10: =O10*6+P10 -> 154 | S10: UMPIRE | X10: LADDER | AB10: ROUND | AD10: 1
A11: SUNSHINE | C11: 0 | D11: 0 | E11: =C11*6+D11 -> 0 | G11: 0 | H11: 0 | I11: =G11*6+H11 -> 0 | K11: 0 | L11: 0 | M11: =K11*6+L11 -> 0 | O11: 14 | P11: 16 | Q11: =O11*6+P11 -> 100
A12: BEST PLAYERS | W12: TEAM | X12: W | Y12: L | Z12: D | AA12: FOR | AB12: AGST | AC12: % | AD12: PTS
A13: WAVERLEY
A14: SUNSHINE | W14: CAMBERWELL | X14: 1 | Y14: 0 | Z14: 0 | AA14: 141 | AB14: 73 | AC14: =(AA14*100)/AB14 -> 193.15068493150685 | AD14: =(X14*4)+(Z14*2) -> 4
A15: GOALKICKERS | W15: WILLIAMSTOWN | X15: 1 | Y15: 0 | Z15: 0 | AA15: 140 | AB15: 88 | AC15: =(AA15*100)/AB15 -> 159.09090909090909 | AD15: =(X15*4)+(Z15*2) -> 4
A16: WAVERLEY | W16: FRANKSTON | X16: 1 | Y16: 0 | Z16: 0 | AA16: 176 | AB16: 111 | AC16: =(AA16*100)/AB16 -> 158.55855855855856 | AD16: =(X16*4)+(Z16*2) -> 4
A17: SUNSHINE | W17: WAVERLEY | X17: 1 | Y17: 0 | Z17: 0 | AA17: 154 | AB17: 100 | AC17: =(AA17*100)/AB17 -> 154 | AD17: =(X17*4)+(Z17*2) -> 4
A19: FRANKSTON | C19: 0 | D19: 0 | E19: =C19*6+D19 -> 0 | G19: 0 | H19: 0 | I19: =G19*6+H19 -> 0 | K19: 0 | L19: 0 | M19: =K19*6+L19 -> 0 | O19: 26 | P19: 20 | Q19: =O19*6+P19 -> 176 | S19: FRANKSTON | W19: NORTHCOTE | X19: 1 | Y19: 0 | Z19: 0 | AA19: 164 | AB19: 142 | AC19: =(AA19*100)/AB19 -> 115.49295774647888 | AD19: =(X19*4)+(Z19*2) -> 4
A20: YARRAVILLE | C20: 0 | D20: 0 | E20: =C20*6+D20 -> 0 | G20: 0 | H20: 0 | I20: =G20*6+H20 -> 0 | K20: 0 | L20: 0 | M20: =K20*6+L20 -> 0 | O20: 17 | P20: 9 | Q20: =O20*6+P20 -> 111 | W20: OAKLEIGH | X20: 0 | Y20: 1 | Z20: 0 | AA20: 142 | AB20: 164 | AC20: =(AA20*100)/AB20 -> 86.58536585365853 | AD20: =(X20*4)+(Z20*2) -> 0
A21: BEST PLAYERS | W21: SUNSHINE | X21: 0 | Y21: 1 | Z21: 0 | AA21: 100 | AB21: 154 | AC21: =(AA21*100)/AB21 -> 64.935064935064929 | AD21: =(X21*4)+(Z21*2) -> 0
A22: FRANKSTON | W22: YARRAVILLE | X22: 0 | Y22: 1 | Z22: 0 | AA22: 111 | AB22: 176 | AC22: =(AA22*100)/AB22 -> 63.06818181818182 | AD22: =(X22*4)+(Z22*2) -> 0
A23: YARRAVILLE | W23: WERRIBEE | X23: 0 | Y23: 1 | Z23: 0 | AA23: 88 | AB23: 140 | AC23: =(AA23*100)/AB23 -> 62.857142857142854 | AD23: =(X23*4)+(Z23*2) -> 0
A24: GOALKICKERS | W24: BOX HILL | X24: 0 | Y24: 1 | Z24: 0 | AA24: 73 | AB24: 141 | AC24: =(AA24*100)/AB24 -> 51.773049645390074 | AD24: =(X24*4)+(Z24*2) -> 0
A25: FRANKSTON
A26: YARRAVILLE
A28: CAMBERWELL | C28: 0 | D28: 0 | E28: =C28*6+D28 -> 0 | G28: 0 | H28: 0 | I28: =G28*6+H28 -> 0 | K28: 0 | L28: 0 | M28: =K28*6+L28 -> 0 | O28: 21 | P28: 15 | Q28: =O28*6+P28 -> 141 | S28: BOX HILL
A29: BOX HILL | C29: 0 | D29: 0 | E29: =C29*6+D29 -> 0 | G29: 0 | H29: 0 | I29: =G29*6+H29 -> 0 | K29: 0 | L29: 0 | M29: =K29*6+L29 -> 0 | O29: 10 | P29: 13 | Q29: =O29*6+P29 -> 73 | S29: STEERE
A30: BEST PLAYERS
A31: CAMBERWELL
A32: BOX HILL
A33: GOALKICKERS
A34: CAMBERWELL
A35: BOX HILL
A37: NORTHCOTE | C37: 0 | D37: 0 | E37: =C37*6+D37 -> 0 | G37: 0 | H37: 0 | I37: =G37*6+H37 -> 0 | K37: 0 | L37: 0 | M37: =K37*6+L37 -> 0 | O37: 25 | P37: 14 | Q37: =O37*6+P37 -> 164 | S37: OAKLEIGH
A38: OAKLEIGH | C38: 0 | D38: 0 | E38: =C38*6+D38 -> 0 | G38: 0 | H38: 0 | I38: =G38*6+H38 -> 0 | K38: 0 | L38: 0 | M38: =K38*6+L38 -> 0 | O38: 21 | P38: 16 | Q38: =O38*6+P38 -> 142
A39: BEST PLAYERS
A40: NORTHCOTE
A41: OAKLEIGH
A42: GOALKICKERS
A43: NORTHCOTE
A44: OAKLEIGH
A46: WILLIAMSTOWN | C46: 0 | D46: 0 | E46: =C46*6+D46 -> 0 | G46: 0 | H46: 0 | I46: =G46*6+H46 -> 0 | K46: 0 | L46: 0 | M46: =K46*6+L46 -> 0 | O46: 21 | P46: 14 | Q46: =O46*6+P46 -> 140 | S46: WILLIAMSTOWN
A47: WERRIBEE | C47: 0 | D47: 0 | E47: =C47*6+D47 -> 0 | G47: 0 | H47: 0 | I47: =G47*6+H47 -> 0 | K47: 0 | L47: 0 | M47: =K47*6+L47 -> 0 | O47: 13 | P47: 10 | Q47: =O47*6+P47 -> 88
A48: BEST PLAYERS
A49: WILLIAMSTOWN
A50: WERRIBEE
A51: GOALKICKERS
A52: WILLIAMSTOWN
A53: WERRIBEE
A55: ROUND 2 | E55: 16TH APRIL | J55: WEATHER | S55: PLAYED AT
D56: 1ST QTR | H56: 2ND QTR | L56: 3RD QTR | P56: FINAL | S56: CAMBERWELL
A57: CAMBERWELL | C57: 6 | D57: 4 | E57: =C57*6+D57 -> 40 | G57: 8 | H57: 5 | I57: =G57*6+H57 -> 53 | K57: 16 | L57: 7 | M57: =K57*6+L57 -> 103 | O57: 20 | P57: 7 | Q57: =O57*6+P57 -> 127 | S57: UMPIRE | X57: LADDER | AB57: ROUND | AD57: 2
A58: FRANKSTON | C58: 2 | D58: 4 | E58: =C58*6+D58 -> 16 | G58: 4 | H58: 14 | I58: =G58*6+H58 -> 38 | K58: 6 | L58: 19 | M58: =K58*6+L58 -> 55 | O58: 11 | P58: 25 | Q58: =O58*6+P58 -> 91 | S58: FITZPATRICK
A59: BEST PLAYERS | W59: TEAM | X59: W | Y59: L | Z59: D | AA59: FOR | AB59: AGST | AC59: % | AD59: PTS
A60: CAMBERWELL | C60: R SMITH | F60: CHAMBERLAIN | J60: HASSETT | M60: OLIVER | O60: HAMMOND | R60: HARROP
A61: FRANKSTON | C61: MACE | F61: BATTY | J61: ORCHARD | M61: RIDSDALE | P61: A HARPER | W61: CAMBERWELL | X61: 2 | Y61: 0 | Z61: 0 | AA61: 268 | AB61: 164 | AC61: =(AA61*100)/AB61 -> 163.41463414634146 | AD61: =(X61*4)+(Z61*2) -> 8
A62: GOALKICKERS | W62: WAVERLEY | X62: 2 | Y62: 0 | Z62: 0 | AA62: 297 | AB62: 224 | AC62: =(AA62*100)/AB62 -> 132.58928571428572 | AD62: =(X62*4)+(Z62*2) -> 8
A63: CAMBERWELL | C63: HAMMOND 7 | F63: HARROP 5 | H63: SPITHILL 2 | J63: CHAMBERLAIN 2 | N63: HOOK | P63: INNES | R63: OLIVER | T63: ALEXEEF | W63: NORTHCOTE | X63: 2 | Y63: 0 | Z63: 0 | AA63: 319 | AB63: 270 | AC63: =(AA63*100)/AB63 -> 118.14814814814815 | AD63: =(X63*4)+(Z63*2) -> 8
A64: FRANKSTON | C64: RYAN 2 | E64: REIDY 2 | G64: GEDDES 2 | I64: CARLSON | K64: WORTHINGTON | N64: DANKS | P64: MACE | R64: ORCHARD | W64: YARRAVILLE | X64: 1 | Y64: 1 | Z64: 0 | AA64: 305 | AB64: 266 | AC64: =(AA64*100)/AB64 -> 114.66165413533835 | AD64: =(X64*4)+(Z64*2) -> 4
A66: NORTHCOTE | C66: 7 | D66: 2 | E66: =C66*6+D66 -> 44 | G66: 11 | H66: 4 | I66: =G66*6+H66 -> 70 | K66: 16 | L66: 8 | M66: =K66*6+L66 -> 104 | O66: 23 | P66: 17 | Q66: =O66*6+P66 -> 155 | S66: NORTHCOTE | W66: WILLIAMSTOWN | X66: 1 | Y66: 1 | Z66: 0 | AA66: 264 | AB66: 231 | AC66: =(AA66*100)/AB66 -> 114.28571428571429 | AD66: =(X66*4)+(Z66*2) -> 4
A67: BOX HILL | C67: 5 | D67: 4 | E67: =C67*6+D67 -> 34 | G67: 11 | H67: 6 | I67: =G67*6+H67 -> 72 | K67: 16 | L67: 11 | M67: =K67*6+L67 -> 107 | O67: 19 | P67: 14 | Q67: =O67*6+P67 -> 128 | S67: O'BRIEN | W67: OAKLEIGH | X67: 1 | Y67: 1 | Z67: 0 | AA67: 295 | AB67: 261 | AC67: =(AA67*100)/AB67 -> 113.02681992337165 | AD67: =(X67*4)+(Z67*2) -> 4
A68: BEST PLAYERS | W68: FRANKSTON | X68: 1 | Y68: 1 | Z68: 0 | AA68: 267 | AB68: 238 | AC68: =(AA68*100)/AB68 -> 112.18487394957984 | AD68: =(X68*4)+(Z68*2) -> 4
A69: NORTHCOTE | C69: HOBBS | F69: ILLIOV | I69: JAMES | L69: McGREGOR | O69: HOWELL | R69: McCONCHIE | W69: BOX HILL | X69: 0 | Y69: 2 | Z69: 0 | AA69: 201 | AB69: 296 | AC69: =(AA69*100)/AB69 -> 67.905405405405403 | AD69: =(X69*4)+(Z69*2) -> 0
A70: BOX HILL | C70: S HARPER | F70: G COOK | I70: DICKENSON | L70: A McFARLANE | O70: WITHERS | R70: JOFFE | W70: WERRIBEE | X70: 0 | Y70: 2 | Z70: 0 | AA70: 185 | AB70: 293 | AC70: =(AA70*100)/AB70 -> 63.139931740614337 | AD70: =(X70*4)+(Z70*2) -> 0
A71: GOALKICKERS | Q71: RYAN | W71: SUNSHINE | X71: 0 | Y71: 2 | Z71: 0 | AA71: 190 | AB71: 348 | AC71: =(AA71*100)/AB71 -> 54.597701149425291 | AD71: =(X71*4)+(Z71*2) -> 0
A72: NORTHCOTE | C72: ILLIOV 8 | E72: SMITH 4 | G72: RENNARD 2 | I72: HOLLAND 2 | K72: McCONCHIE 2 | N72: F McGRATH | Q72: JAMES | S72: ROBERTS | U72: HOBBS
A73: BOX HILL | C73: JOFFE 5 | E73: McGUINNESS 4 | H73: INGLETON 3 | K73: WITHERS 2 | N73: DICKENSON 2 | Q73: SAUNDERS 2 | T73: COOK
A75: WAVERLEY | C75: 6 | D75: 2 | E75: =C75*6+D75 -> 38 | G75: 13 | H75: 6 | I75: =G75*6+H75 -> 84 | K75: 16 | L75: 11 | M75: =K75*6+L75 -> 107 | O75: 21 | P75: 17 | Q75: =O75*6+P75 -> 143 | S75: WAVERLEY
A76: WILLIAMSTOWN | C76: 5 | D76: 1 | E76: =C76*6+D76 -> 31 | G76: 12 | H76: 5 | I76: =G76*6+H76 -> 77 | K76: 15 | L76: 9 | M76: =K76*6+L76 -> 99 | O76: 18 | P76: 16 | Q76: =O76*6+P76 -> 124 | S76: WENN
A77: BEST PLAYERS
A78: WAVERLEY | C78: HOLDSWORTH | F78: AUSTIN | I78: STYLES | L78: COSTELLO | O78: R KINNABURGH | S78: McKAY
A79: WILLIAMSTOWN | C79: TWEEDLY | F79: BROWN | I79: FORBES | L79: GOETZ | O79: BEBEND | R79: PHILPOTT
A80: GOALKICKERS
A81: WAVERLEY | C81: McKAY 7 | E81: R KINNABURGH 3 | H81: RAWLINGS 3 | K81: COSTELLO 2 | N81: HOLDSWORTH | Q81: BARNES | S81: GILL | U81: STYLES | W81: JAMIESON | X81: HANKINSON
A82: WILLIAMSTOWN | C82: GOETZ 7 | E82: M TAYLOR 4 | H82: PHILPOTT 2 | K82: JOHN 2 | M82: L TAYLOR | O82: MILDENHALL | R82: BURGESS
A84: OAKLEIGH | C84: 7 | D84: 5 | E84: =C84*6+D84 -> 47 | G84: 10 | H84: 6 | I84: =G84*6+H84 -> 66 | K84: 17 | L84: 10 | M84: =K84*6+L84 -> 112 | O84: 23 | P84: 15 | Q84: =O84*6+P84 -> 153 | S84: WERRIBEE
A85: WERRIBEE | C85: 3 | D85: 4 | E85: =C85*6+D85 -> 22 | G85: 10 | H85: 6 | I85: =G85*6+H85 -> 66 | K85: 11 | L85: 5 | M85: =K85*6+L85 -> 71 | O85: 14 | P85: 13 | Q85: =O85*6+P85 -> 97 | S85: STEERE
A86: BEST PLAYERS
A87: OAKLEIGH | C87: LEISHMAN | F87: CURTAIN | I87: WENN | L87: ROWLANDS | O87: J HARTLRY
A88: WERRIBEE | C88: EVANS | F88: OUGH | I88: MITCHELL | L88: HUNT | N88: KNIGHT | Q88: McCARTNEY
A89: GOALKICKERS
A90: OAKLEIGH | C90: WENN 8 | E90: ROWLANDS 4 | H90: LEISHMAN 4 | K90: J HARTLEY 3 | N90: G HARTLEY | Q90: CURTAIN | S90: MACKEY | U90: McDONALD
A91: WERRIBEE | C91: MITCHELL 5 | F91: POWER 2 | I91: HUNT 2 | K91: LEECE 2 | M91: EVANS | O91: J BELLIN | Q91: SQUIRE
A93: YARRAVILLE | C93: 6 | D93: 12 | E93: =C93*6+D93 -> 48 | G93: 10 | H93: 18 | I93: =G93*6+H93 -> 78 | K93: 19 | L93: 22 | M93: =K93*6+L93 -> 136 | O93: 28 | P93: 26 | Q93: =O93*6+P93 -> 194 | S93: YARRAVILLE
A94: SUNSHINE | C94: 2 | D94: 4 | E94: =C94*6+D94 -> 16 | G94: 5 | H94: 6 | I94: =G94*6+H94 -> 36 | K94: 9 | L94: 8 | M94: =K94*6+L94 -> 62 | O94: 13 | P94: 12 | Q94: =O94*6+P94 -> 90 | S94: STABB
A95: BEST PLAYERS
A96: YARRAVILLE | C96: WELLINGTON | F96: SIMMONS | I96: L RYAN | L96: M FOTHERINGHAM | P96: J RYAN | R96: HIGGINS
A97: SUNSHINE | C97: T BRETT | F97: RADZIMINSKI | I97: McDONALD | L97: J SIMPSON | O97: MATTHEWS
A98: GOALKICKERS
A99: YARRAVILLE | C99: M FOTHERINGHAM 11 | G99: WELLINGTON 3 | J99: L RYAN 3 | L99: LOWE 3 | N99: SAIT 2 | P99: HIGGINS 2 | R99: SHARP 2 | T99: BREHENY | V99: MAGEE
A100: SUNSHINE | C100: BENSON 4 | F100: POLLOCK 3 | I100: J SIMPSON 2 | L100: T BRETT 2 | N100: VELLA | P100: MANDICS
A102: ROUND 3 | E102: 23RD APRIL | J102: WEATHER | S102: PLAYED AT
D103: 1ST QTR | H103: 2ND QTR | L103: 3RD QTR | P103: FINAL | S103: OAKLEIGH
A104: OAKLEIGH | C104: 3 | D104: 3 | E104: =C104*6+D104 -> 21 | G104: 10 | H104: 5 | I104: =G104*6+H104 -> 65 | K104: 14 | L104: 12 | M104: =K104*6+L104 -> 96 | O104: 23 | P104: 17 | Q104: =O104*6+P104 -> 155 | S104: UMPIRE | X104: LADDER | AB104: ROUND | AD104: 3
A105: WILLIAMSTOWN | C105: 5 | D105: 3 | E105: =C105*6+D105 -> 33 | G105: 9 | H105: 7 | I105: =G105*6+H105 -> 61 | K105: 17 | L105: 7 | M105: =K105*6+L105 -> 109 | O105: 22 | P105: 14 | Q105: =O105*6+P105 -> 146 | S105: MATTHEWS
A106: BEST PLAYERS | W106: TEAM | X106: W | Y106: L | Z106: D | AA106: FOR | AB106: AGST | AC106: % | AD106: PTS
A107: OAKLEIGH | C107: LEISHMAN | F107: ROWLINGS | I107: WENN | K107: EDWARDS | N107: FRYER | Q107: BRUERTON
A108: WILLIAMSTOWN | C108: McVEIGH | F108: COURTOT | I108: KERR | K108: JOHN | N108: BEBEND | Q108: MARSHALL | W108: CAMBERWELL | X108: 3 | Y108: 0 | Z108: 0 | AA108: 426 | AB108: 203 | AC108: =(AA108*100)/AB108 -> 209.85221674876848 | AD108: =(X108*4)+(Z108*2) -> 12
A109: GOALKICKERS | W109: FRANKSTON | X109: 2 | Y109: 1 | Z109: 0 | AA109: 492 | AB109: 322 | AC109: =(AA109*100)/AB109 -> 152.79503105590061 | AD109: =(X109*4)+(Z109*2) -> 8
A110: OAKLEIGH | C110: WENN 7 | E110: ROWLANDS 6 | H110: LEISHMAN 5 | J110: BURKE | L110: CURTAIN | N110: GOODMAN | Q110: McDONALD | T110: ZUBIN | W110: YARRAVILLE | X110: 2 | Y110: 1 | Z110: 0 | AA110: 425 | AB110: 351 | AC110: =(AA110*100)/AB110 -> 121.08262108262109 | AD110: =(X110*4)+(Z110*2) -> 8
A111: WILLIAMSTOWN | C111: GOETZ 5 | E111: FORBES 3 | G111: JOHN 3 | I111: CROSS 2 | K111: BURGESS 2 | N111: HICKMAN 2 | Q111: FANNING | S111: TWEEDLY | W111: WAVERLEY | X111: 2 | Y111: 1 | Z111: 0 | AA111: 382 | AB111: 344 | AC111: =(AA111*100)/AB111 -> 111.04651162790698 | AD111: =(X111*4)+(Z111*2) -> 8
J112: MARSHALL | M112: MILDENHALL | P112: TINSLEY
A113: CAMBERWELL | C113: 4 | D113: 10 | E113: =C113*6+D113 -> 34 | G113: 8 | H113: 16 | I113: =G113*6+H113 -> 64 | K113: 16 | L113: 17 | M113: =K113*6+L113 -> 113 | O113: 23 | P113: 20 | Q113: =O113*6+P113 -> 158 | S113: SUNSHINE | W113: OAKLEIGH | X113: 2 | Y113: 1 | Z113: 0 | AA113: 450 | AB113: 407 | AC113: =(AA113*100)/AB113 -> 110.56511056511056 | AD113: =(X113*4)+(Z113*2) -> 8
A114: SUNSHINE | C114: 1 | D114: 0 | E114: =C114*6+D114 -> 6 | G114: 2 | H114: 3 | I114: =G114*6+H114 -> 15 | K114: 2 | L114: 6 | M114: =K114*6+L114 -> 18 | O114: 5 | P114: 9 | Q114: =O114*6+P114 -> 39 | S114: WILSON | W114: NORTHCOTE | X114: 2 | Y114: 1 | Z114: 0 | AA114: 403 | AB114: 495 | AC114: =(AA114*100)/AB114 -> 81.414141414141412 | AD114: =(X114*4)+(Z114*2) -> 8
A115: BEST PLAYERS | W115: WILLIAMSTOWN | X115: 1 | Y115: 2 | Z115: 0 | AA115: 410 | AB115: 386 | AC115: =(AA115*100)/AB115 -> 106.21761658031087 | AD115: =(X115*4)+(Z115*2) -> 4
A116: CAMBERWELL | C116: JUDD | F116: R SMITH | I116: A SMITH | L116: HAMMOND | O116: INNES | R116: L CURREN | W116: WERRIBEE | X116: 1 | Y116: 2 | Z116: 0 | AA116: 322 | AB116: 405 | AC116: =(AA116*100)/AB116 -> 79.506172839506178 | AD116: =(X116*4)+(Z116*2) -> 4
A117: SUNSHINE | C117: JONES | F117: MORLEY | I117: LEWIS | L117: T BRETT | O117: L BRETT | R117: MANDICS | W117: BOX HILL | X117: 0 | Y117: 3 | Z117: 0 | AA117: 313 | AB117: 433 | AC117: =(AA117*100)/AB117 -> 72.286374133949195 | AD117: =(X117*4)+(Z117*2) -> 0
A118: GOALKICKERS | W118: SUNSHINE | X118: 0 | Y118: 3 | Z118: 0 | AA118: 229 | AB118: 506 | AC118: =(AA118*100)/AB118 -> 45.25691699604743 | AD118: =(X118*4)+(Z118*2) -> 0
A119: CAMBERWELL | C119: HAMMOND 8 | F119: ALEXEEF 3 | H119: SPITHILL 3 | J119: HARROP 3 | L119: CHAMBERLAIN 2 | O119: B SMITH 2 | R119: HOOK | T119: INNES
A120: SUNSHINE | C120: BENSON | F120: JONES | H120: T BRETT | J120: L BRETT | M120: MENADUE
A122: YARRAVILLE | C122: 4 | D122: 3 | E122: =C122*6+D122 -> 27 | G122: 11 | H122: 3 | I122: =G122*6+H122 -> 69 | K122: 13 | L122: 7 | M122: =K122*6+L122 -> 85 | O122: 18 | P122: 12 | Q122: =O122*6+P122 -> 120 | S122: YARRAVILLE
A123: WAVERLEY | C123: 2 | D123: 3 | E123: =C123*6+D123 -> 15 | G123: 10 | H123: 3 | I123: =G123*6+H123 -> 63 | K123: 11 | L123: 7 | M123: =K123*6+L123 -> 73 | O123: 13 | P123: 7 | Q123: =O123*6+P123 -> 85 | S123: SNOOKS
A124: BEST PLAYERS
A125: YARRAVILLE | C125: WELLINGTON | F125: WARD | I125: SIMMONS | L125: M FOTHERINGHAM | P125: SAIT | R125: J RYAN
A126: WAVERLEY | C126: STYLES | F126: MORRISON | I126: AUSTIN | L126: McKAY | N126: P WILLIAMS | R126: POORE
A127: GOALKICKERS
A128: YARRAVILLE | C128: M FOTHERINGHAM 10 | G128: BREHENEY 3 | J128: LOWE 2 | L128: CURTAIN | N128: RYAN | P128: SAIT
A129: WAVERLEY | C129: McKAY 7 | F129: JAMIESON 2 | I129: POORE 2 | K129: COSTELLO | N129: R KINNABURGH
A131: FRANKSTON | C131: 4 | D131: 7 | E131: =C131*6+D131 -> 31 | G131: 16 | H131: 11 | I131: =G131*6+H131 -> 107 | K131: 25 | L131: 18 | M131: =K131*6+L131 -> 168 | O131: 34 | P131: 21 | Q131: =O131*6+P131 -> 225 | S131: FRANKSTON
A132: NORTHCOTE | C132: 5 | D132: 4 | E132: =C132*6+D132 -> 34 | G132: 6 | H132: 8 | I132: =G132*6+H132 -> 44 | K132: 8 | L132: 9 | M132: =K132*6+L132 -> 57 | O132: 11 | P132: 18 | Q132: =O132*6+P132 -> 84 | S132: OAKLEY
A133: BEST PLAYERS
A134: FRANKSTON | C134: ORCHARD | F134: HUNTER | I134: MACE | L134: BOYD | N134: RYAN | P134: A HARPER
A135: NORTHCOTE | C135: JAMES | F135: McGREGOR | I135: HOBBS | L135: McLEOD | N135: RENNARD
A136: GOALKICKERS
A137: FRANKSTON | C137: HUNTER 10 | F137: BOYD 3 | H137: RYAN 3 | J137: MEMBREY 3 | L137: CLARKE 3 | N137: JONES 2 | P137: ROBERTS 2 | R137: BELL 2 | T137: SAMPSON 2 | W137: A HARPER | X137: MACE | Z137: ORCHARD | AB137: REILLY
A138: NORTHCOTE | C138: McGRATH 4 | F138: RYAN 3 | H138: ILLIOV 2 | J138: SMITH | L138: MCLEOD
A140: WERRIBEE | C140: 6 | D140: 5 | E140: =C140*6+D140 -> 41 | G140: 11 | H140: 9 | I140: =G140*6+H140 -> 75 | K140: 14 | L140: 13 | M140: =K140*6+L140 -> 97 | O140: 20 | P140: 17 | Q140: =O140*6+P140 -> 137 | S140: BOX HILL
A141: BOX HILL | C141: 3 | D141: 1 | E141: =C141*6+D141 -> 19 | G141: 8 | H141: 5 | I141: =G141*6+H141 -> 53 | K141: 15 | L141: 9 | M141: =K141*6+L141 -> 99 | O141: 17 | P141: 10 | Q141: =O141*6+P141 -> 112 | S141: GROOM
A142: BEST PLAYERS
A143: WERRIBEE | C143: LEECE | F143: YOUNG | I143: HUNT | L143: POWER | N143: OUGH | Q143: KNIGHT
A144: BOX HILL | C144: WITHERS | F144: BATES | I144: HARPER | L144: JOFFE | N144: DICKENSON | Q144: McFARLANE
A145: GOALKICKERS
A146: WERRIBEE | C146: LEECE 7 | F146: HUNT 3 | H146: MITCHELL 3 | K146: OUGH 3 | M146: LANCASTER 2 | P146: J BELLIN | R146: WHITE
A147: BOX HILL | C147: WITHERS 5 | F147: PARSONS 4 | I147: JOFFE 3 | K147: McGUINNESS 2 | N147: HARPER | P147: COOK | R147: LOVE
A149: ROUND 4 | E149: 30TH APRIL | J149: WEATHER | S149: PLAYED AT
D150: 1ST QTR | H150: 2ND QTR | L150: 3RD QTR | P150: FINAL | S150: CAMBERWELL
A151: CAMBERWELL | C151: 0 | D151: 0 | E151: =C151*6+D151 -> 0 | G151: 0 | H151: 0 | I151: =G151*6+H151 -> 0 | K151: 0 | L151: 0 | M151: =K151*6+L151 -> 0 | O151: 25 | P151: 22 | Q151: =O151*6+P151 -> 172 | S151: UMPIRE | X151: LADDER | AB151: ROUND | AD151: 4
A152: YARRAVILLE | C152: 0 | D152: 0 | E152: =C152*6+D152 -> 0 | G152: 0 | H152: 0 | I152: =G152*6+H152 -> 0 | K152: 0 | L152: 10 | M152: =K152*6+L152 -> 10 | O152: 14 | P152: 16 | Q152: =O152*6+P152 -> 100
A153: BEST PLAYERS | W153: TEAM | X153: W | Y153: L | Z153: D | AA153: FOR | AB153: AGST | AC153: % | AD153: PTS
A154: CAMBERWELL
A155: YARRAVILLE | W155: CAMBERWELL | X155: 4 | Y155: 0 | Z155: 0 | AA155: 598 | AB155: 303 | AC155: =(AA155*100)/AB155 -> 197.35973597359737 | AD155: =(X155*4)+(Z155*2) -> 16
A156: GOALKICKERS | W156: FRANKSTON | X156: 3 | Y156: 1 | Z156: 0 | AA156: 665 | AB156: 463 | AC156: =(AA156*100)/AB156 -> 143.62850971922245 | AD156: =(X156*4)+(Z156*2) -> 12
A157: CAMBERWELL | W157: NORTHCOTE | X157: 3 | Y157: 1 | Z157: 0 | AA157: 571 | AB157: 590 | AC157: =(AA157*100)/AB157 -> 96.779661016949149 | AD157: =(X157*4)+(Z157*2) -> 12
A158: YARRAVILLE | W158: WAVERLEY | X158: 2 | Y158: 1 | Z158: 1 | AA158: 505 | AB158: 467 | AC158: =(AA158*100)/AB158 -> 108.13704496788009 | AD158: =(X158*4)+(Z158*2) -> 10
A160: WAVERLEY | C160: 0 | D160: 0 | E160: =C160*6+D160 -> 0 | G160: 0 | H160: 0 | I160: =G160*6+H160 -> 0 | K160: 0 | L160: 0 | M160: =K160*6+L160 -> 0 | O160: 18 | P160: 15 | Q160: =O160*6+P160 -> 123 | S160: WAVERLEY | W160: OAKLEIGH | X160: 2 | Y160: 1 | Z160: 1 | AA160: 573 | AB160: 530 | AC160: =(AA160*100)/AB160 -> 108.11320754716981 | AD160: =(X160*4)+(Z160*2) -> 10
A161: OAKLEIGH | C161: 0 | D161: 0 | E161: =C161*6+D161 -> 0 | G161: 0 | H161: 0 | I161: =G161*6+H161 -> 0 | K161: 0 | L161: 0 | M161: =K161*6+L161 -> 0 | O161: 17 | P161: 21 | Q161: =O161*6+P161 -> 123 | W161: WILLIAMSTOWN | X161: 2 | Y161: 2 | Z161: 0 | AA161: 591 | AB161: 490 | AC161: =(AA161*100)/AB161 -> 120.61224489795919 | AD161: =(X161*4)+(Z161*2) -> 8
A162: BEST PLAYERS | W162: YARRAVILLE | X162: 2 | Y162: 2 | Z162: 0 | AA162: 525 | AB162: 523 | AC162: =(AA162*100)/AB162 -> 100.38240917782026 | AD162: =(X162*4)+(Z162*2) -> 8
A163: WAVERLEY | W163: WERRIBEE | X163: 1 | Y163: 3 | Z163: 0 | AA163: 463 | AB163: 578 | AC163: =(AA163*100)/AB163 -> 80.103806228373699 | AD163: =(X163*4)+(Z163*2) -> 4
A164: OAKLEIGH | W164: BOX HILL | X164: 0 | Y164: 4 | Z164: 0 | AA164: 417 | AB164: 614 | AC164: =(AA164*100)/AB164 -> 67.915309446254071 | AD164: =(X164*4)+(Z164*2) -> 0
A165: GOALKICKERS | W165: SUNSHINE | X165: 0 | Y165: 4 | Z165: 0 | AA165: 324 | AB165: 674 | AC165: =(AA165*100)/AB165 -> 48.071216617210681 | AD165: =(X165*4)+(Z165*2) -> 0
A166: WAVERLEY
A167: OAKLEIGH
A169: WILLIAMSTOWN | C169: 0 | D169: 0 | E169: =C169*6+D169 -> 0 | G169: 0 | H169: 0 | I169: =G169*6+H169 -> 0 | K169: 0 | L169: 0 | M169: =K169*6+L169 -> 0 | O169: 28 | P169: 13 | Q169: =O169*6+P169 -> 181 | S169: WILLIAMSTOWN
A170: BOX HILL | C170: 0 | D170: 0 | E170: =C170*6+D170 -> 0 | G170: 0 | H170: 0 | I170: =G170*6+H170 -> 0 | K170: 0 | L170: 0 | M170: =K170*6+L170 -> 0 | O170: 15 | P170: 14 | Q170: =O170*6+P170 -> 104
A171: BEST PLAYERS
A172: WILLIAMSTOWN
A173: BOX HILL
A174: GOALKICKERS
A175: WILLIAMSTOWN
A176: BOX HILL
A178: NORTHCOTE | C178: 0 | D178: 0 | E178: =C178*6+D178 -> 0 | G178: 0 | H178: 0 | I178: =G178*6+H178 -> 0 | K178: 0 | L178: 0 | M178: =K178*6+L178 -> 0 | O178: 24 | P178: 24 | Q178: =O178*6+P178 -> 168 | S178: NORTHCOTE
A179: SUNSHINE | C179: 0 | D179: 0 | E179: =C179*6+D179 -> 0 | G179: 0 | H179: 0 | I179: =G179*6+H179 -> 0 | K179: 0 | L179: 0 | M179: =K179*6+L179 -> 0 | O179: 14 | P179: 11 | Q179: =O179*6+P179 -> 95
A180: BEST PLAYERS
A181: NORTHCOTE
A182: SUNSHINE
A183: GOALKICKERS
A184: NORTHCOTE
A185: SUNSHINE
A187: FRANKSTON | C187: 0 | D187: 0 | E187: =C187*6+D187 -> 0 | G187: 0 | H187: 0 | I187: =G187*6+H187 -> 0 | K187: 0 | L187: 0 | M187: =K187*6+L187 -> 0 | O187: 27 | P187: 11 | Q187: =O187*6+P187 -> 173 | S187: WERRIBEE
A188: WERRIBEE | C188: 0 | D188: 0 | E188: =C188*6+D188 -> 0 | G188: 0 | H188: 0 | I188: =G188*6+H188 -> 0 | K188: 0 | L188: 0 | M188: =K188*6+L188 -> 0 | O188: 22 | P188: 9 | Q188: =O188*6+P188 -> 141
A189: BEST PLAYERS
A190: FRANKSTON
A191: WERRIBEE
A192: GOALKICKERS
A193: FRANKSTON
A194: WERRIBEE
A196: ROUND 5 | E196: 7TH MAY | J196: WEATHER | S196: PLAYED AT
D197: 1ST QTR | H197: 2ND QTR | L197: 3RD QTR | P197: FINAL | S197: SUNSHINE
A198: WERRIBEE | C198: 2 | D198: 6 | E198: =C198*6+D198 -> 18 | G198: 6 | H198: 12 | I198: =G198*6+H198 -> 48 | K198: 10 | L198: 17 | M198: =K198*6+L198 -> 77 | O198: 15 | P198: 19 | Q198: =O198*6+P198 -> 109 | S198: UMPIRE | X198: LADDER | AB198: ROUND | AD198: 5
A199: SUNSHINE | C199: 3 | D199: 6 | E199: =C199*6+D199 -> 24 | G199: 6 | H199: 7 | I199: =G199*6+H199 -> 43 | K199: 8 | L199: 8 | M199: =K199*6+L199 -> 56 | O199: 12 | P199: 10 | Q199: =O199*6+P199 -> 82 | S199: FITZPATRICK
A200: BEST PLAYERS | W200: TEAM | X200: W | Y200: L | Z200: D | AA200: FOR | AB200: AGST | AC200: % | AD200: PTS
A201: WERRIBEE | C201: A BOURKE | F201: LANCASTER | I201: G BELLIN | L201: MARTIN | O201: McCARTHY | R201: POWER
A202: SUNSHINE | C202: PETER SIMPSON | F202: BUGDEN | I202: T BRETT | L202: JONES | O202: SEVERS | R202: BENSON | W202: CAMBERWELL | X202: 5 | Y202: 0 | Z202: 0 | AA202: 705 | AB202: 394 | AC202: =(AA202*100)/AB202 -> 178.93401015228426 | AD202: =(X202*4)+(Z202*2) -> 20
A203: GOALKICKERS | Q203: J BELLIN | W203: FRANKSTON | X203: 4 | Y203: 1 | Z203: 0 | AA203: 802 | AB203: 562 | AC203: =(AA203*100)/AB203 -> 142.70462633451956 | AD203: =(X203*4)+(Z203*2) -> 16
A204: WERRIBEE | C204: WHITE 4 | E204: MARTIN 2 | G204: POWER 2 | I204: G BELLIN | K204: HUNT | M204: DOUGLAS | O204: JACK | Q204: LANCASTER | S204: OUGH | W204: OAKLEIGH | X204: 3 | Y204: 1 | Z204: 1 | AA204: 712 | AB204: 623 | AC204: =(AA204*100)/AB204 -> 114.28571428571429 | AD204: =(X204*4)+(Z204*2) -> 14
A205: SUNSHINE | C205: SAID 6 | F205: J SIMPSON 2 | I205: L BRETT | K205: T BRETT | M205: JONES | O205: PAUL SIMPSON | W205: YARRAVILLE | X205: 3 | Y205: 2 | Z205: 0 | AA205: 650 | AB205: 629 | AC205: =(AA205*100)/AB205 -> 103.33863275039745 | AD205: =(X205*4)+(Z205*2) -> 12
A207: FRANKSTON | C207: 6 | D207: 12 | E207: =C207*6+D207 -> 48 | G207: 8 | H207: 18 | I207: =G207*6+H207 -> 66 | K207: 14 | L207: 24 | M207: =K207*6+L207 -> 108 | O207: 18 | P207: 29 | Q207: =O207*6+P207 -> 137 | S207: FRANKSTON | W207: NORTHCOTE | X207: 3 | Y207: 2 | Z207: 0 | AA207: 677 | AB207: 715 | AC207: =(AA207*100)/AB207 -> 94.68531468531468 | AD207: =(X207*4)+(Z207*2) -> 12
A208: WILLIAMSTOWN | C208: 1 | D208: 1 | E208: =C208*6+D208 -> 7 | G208: 8 | H208: 5 | I208: =G208*6+H208 -> 53 | K208: 12 | L208: 6 | M208: =K208*6+L208 -> 78 | O208: 15 | P208: 9 | Q208: =O208*6+P208 -> 99 | S208: SNOOKS | W208: WAVERLEY | X208: 2 | Y208: 2 | Z208: 1 | AA208: 596 | AB208: 574 | AC208: =(AA208*100)/AB208 -> 103.83275261324042 | AD208: =(X208*4)+(Z208*2) -> 10
A209: BEST PLAYERS | W209: WILLIAMSTOWN | X209: 2 | Y209: 3 | Z209: 0 | AA209: 690 | AB209: 627 | AC209: =(AA209*100)/AB209 -> 110.04784688995215 | AD209: =(X209*4)+(Z209*2) -> 8
A210: FRANKSTON | C210: MACE | F210: ORCHARD | I210: A HARPER | L210: JONES | N210: RIDSDALE | Q210: BOYD | W210: WERRIBEE | X210: 2 | Y210: 3 | Z210: 0 | AA210: 572 | AB210: 660 | AC210: =(AA210*100)/AB210 -> 86.666666666666671 | AD210: =(X210*4)+(Z210*2) -> 8
A211: WILLIAMSTOWN | C211: FORBES | F211: FANNING | I211: TINSLEY | L211: BURGESS | N211: McVEIGH | W211: BOX HILL | X211: 0 | Y211: 5 | Z211: 0 | AA211: 510 | AB211: 753 | AC211: =(AA211*100)/AB211 -> 67.729083665338649 | AD211: =(X211*4)+(Z211*2) -> 0
A212: GOALKICKERS | W212: SUNSHINE | X212: 0 | Y212: 5 | Z212: 0 | AA212: 406 | AB212: 783 | AC212: =(AA212*100)/AB212 -> 51.851851851851855 | AD212: =(X212*4)+(Z212*2) -> 0
A213: FRANKSTON | C213: HUNTER 4 | E213: JONES 4 | G213: KENNEDY 3 | I213: RYAN 3 | K213: ROBERTS | M213: BELL | O213: BOYD | Q213: MACE
A214: WILLIAMSTOWN | C214: CROSS 4 | F214: BURGESS 3 | I214: FORBES 3 | K214: HICKMAN 2 | N214: FANNING | Q214: NASH | S214: JOHN
A216: OAKLEIGH | C216: 5 | D216: 9 | E216: =C216*6+D216 -> 39 | G216: 12 | H216: 13 | I216: =G216*6+H216 -> 85 | K216: 19 | L216: 17 | M216: =K216*6+L216 -> 131 | O216: 21 | P216: 13 | Q216: =O216*6+P216 -> 139 | S216: BOX HILL
A217: BOX HILL | C217: 1 | D217: 3 | E217: =C217*6+D217 -> 9 | G217: 4 | H217: 6 | I217: =G217*6+H217 -> 30 | K217: 7 | L217: 11 | M217: =K217*6+L217 -> 53 | O217: 13 | P217: 15 | Q217: =O217*6+P217 -> 93 | S217: OAKLEY
A218: BEST PLAYERS
A219: OAKLEIGH | C219: BURKE | F219: SPLATT | I219: GOODMAN | L219: FRYER | O219: J HARTLEY | R219: ZUBIN
A220: BOX HILL | C220: CONNOLLY | F220: WESTMORELAND | J220: McFARLANE | M220: GAUL | O220: LUCAS | R220: BATES
A221: GOALKICKERS
A222: OAKLEIGH | C222: THOMAS 4 | F222: KUZIMAK 3 | I222: GOODMAN 3 | K222: WHITE 2 | M222: McDONALD 2 | P222: ROWLINGS 2 | S222: ZUBIN 2 | U222: KUZIMAK 2 | X222: WOOD
A223: BOX HILL | C223: BATES 4 | E223: WESTMORELAND 3 | I223: ROBINSON | L223: HARPER | N223: RALPH | P223: WITHERS | R223: HUNTER | U223: GAUL
A225: YARRAVILLE | C225: 7 | D225: 10 | E225: =C225*6+D225 -> 52 | G225: 11 | H225: 13 | I225: =G225*6+H225 -> 79 | K225: 16 | L225: 21 | M225: =K225*6+L225 -> 117 | O225: 17 | P225: 23 | Q225: =O225*6+P225 -> 125 | S225: YARRAVILLE
A226: NORTHCOTE | C226: 3 | D226: 3 | E226: =C226*6+D226 -> 21 | G226: 7 | H226: 5 | I226: =G226*6+H226 -> 47 | K226: 10 | L226: 5 | M226: =K226*6+L226 -> 65 | O226: 16 | P226: 10 | Q226: =O226*6+P226 -> 106 | S226: WILSON
A227: BEST PLAYERS
A228: YARRAVILLE | C228: WELLINGTON | F228: SIMMONS | I228: SAIT | K228: P FOTHERINGHAM | O228: CALVERT | R228: HIGGINS
A229: NORTHCOTE | C229: HOLLAND | F229: JENKINS | I229: REDENBACH | L229: OLIVER | O229: McGREGOR | R229: RYAN
A230: GOALKICKERS
A231: YARRAVILLE | C231: M FOTHERINGHAM 5 | G231: SAIT 4 | I231: WELLINGTON 2 | L231: LOWE 2 | N231: BREHENEY 2 | Q231: GRACE | S231: HIGGINS
A232: NORTHCOTE | C232: McGRATH 4 | F232: JENKINS 4 | I232: HOLLAND 3 | L232: OLIVER 2 | N232: HOWELL | Q232: BURLEIGH | S232: McGREGOR
A234: CAMBERWELL | C234: 6 | D234: 7 | E234: =C234*6+D234 -> 43 | G234: 8 | H234: 9 | I234: =G234*6+H234 -> 57 | K234: 11 | L234: 13 | M234: =K234*6+L234 -> 79 | O234: 15 | P234: 17 | Q234: =O234*6+P234 -> 107 | S234: WAVERLEY
A235: WAVERLEY | C235: 0 | D235: 3 | E235: =C235*6+D235 -> 3 | G235: 3 | H235: 12 | I235: =G235*6+H235 -> 30 | K235: 8 | L235: 15 | M235: =K235*6+L235 -> 63 | O235: 12 | P235: 19 | Q235: =O235*6+P235 -> 91 | S235: STABB
A236: BEST PLAYERS
A237: CAMBERWELL | C237: BARR | F237: OLIVER | I237: HAZLETT | L237: HOOK | N237: INNES | Q237: A SMITH
A238: WAVERLEY | C238: HOLDSWORTH | F238: R KINNABURGH | J238: STYLES | L238: BARNES | N238: TYQUIN | Q238: RAWLINGS
A239: GOALKICKERS
A240: CAMBERWELL | C240: B SMITH 5 | F240: ARMSTRONG 3 | I240: HARROP 3 | K240: CHAMBERLAIN | N240: A SMITH | P240: ADJGEMIS | S240: HOOK
A241: WAVERLEY | C241: R KINNABURGH 2 | G241: RAWLINGS 2 | J241: McKAY 2 | L241: HAROLD | N241: JAMIESON | P241: TYQUIN | R241: POORE | T241: MORRIS | V241: STYLES
A243: ROUND 6 | E243: 14TH MAY | J243: WEATHER | S243: PLAYED AT
D244: 1ST QTR | H244: 2ND QTR | L244: 3RD QTR | P244: FINAL | S244: WILLIAMSTOWN
A245: SUNSHINE | C245: 8 | D245: 4 | E245: =C245*6+D245 -> 52 | G245: 10 | H245: 6 | I245: =G245*6+H245 -> 66 | K245: 20 | L245: 7 | M245: =K245*6+L245 -> 127 | O245: 23 | P245: 12 | Q245: =O245*6+P245 -> 150 | S245: UMPIRE | X245: LADDER | AB245: ROUND | AD245: 6
A246: WILLIAMSTOWN | C246: 1 | D246: 4 | E246: =C246*6+D246 -> 10 | G246: 3 | H246: 9 | I246: =G246*6+H246 -> 27 | K246: 6 | L246: 13 | M246: =K246*6+L246 -> 49 | O246: 12 | P246: 17 | Q246: =O246*6+P246 -> 89 | S246: GROOM
A247: BEST PLAYERS | W247: TEAM | X247: W | Y247: L | Z247: D | AA247: FOR | AB247: AGST | AC247: % | AD247: PTS
A248: SUNSHINE | C248: RADZIMINSKI | F248: MANDICS | I248: SEARLE | L248: BAIRD | O248: BLAKE | R248: BENSON
A249: WILLIAMSTOWN | C249: McVEIGH | F249: BEBEND | I249: MILDENHALL | L249: L TAYLOR | O249: FANNING | W249: CAMBERWELL | X249: 6 | Y249: 0 | Z249: 0 | AA249: 811 | AB249: 486 | AC249: =(AA249*100)/AB249 -> 166.8724279835391 | AD249: =(X249*4)+(Z249*2) -> 24
A250: GOALKICKERS | N250: PAUL SIMPSON | R250: REDENBACH | W250: FRANKSTON | X250: 5 | Y250: 1 | Z250: 0 | AA250: 908 | AB250: 654 | AC250: =(AA250*100)/AB250 -> 138.83792048929664 | AD250: =(X250*4)+(Z250*2) -> 20
A251: SUNSHINE | C251: MANDICS 6 | F251: SEARLE 5 | H251: SAID 4 | J251: RADZIMINSKI 2 | M251: BLAKE | O251: T BRETT | Q251: JONES | S251: BENSON | W251: YARRAVILLE | X251: 4 | Y251: 2 | Z251: 0 | AA251: 754 | AB251: 720 | AC251: =(AA251*100)/AB251 -> 104.72222222222223 | AD251: =(X251*4)+(Z251*2) -> 16
A252: WILLIAMSTOWN | C252: MILDENHALL 3 | F252: NASH 2 | H252: L TAYLOR 2 | J252: TWEEDLY | M252: PATON | O252: JOHN | Q252: HICKMAN | S252: OLIDS | W252: WAVERLEY | X252: 3 | Y252: 2 | Z252: 1 | AA252: 769 | AB252: 669 | AC252: =(AA252*100)/AB252 -> 114.94768310911809 | AD252: =(X252*4)+(Z252*2) -> 14
A254: CAMBERWELL | C254: 3 | D254: 2 | E254: =C254*6+D254 -> 20 | G254: 9 | H254: 4 | I254: =G254*6+H254 -> 58 | K254: 14 | L254: 6 | M254: =K254*6+L254 -> 90 | O254: 16 | P254: 10 | Q254: =O254*6+P254 -> 106 | S254: NORTHCOTE | W254: OAKLEIGH | X254: 3 | Y254: 2 | Z254: 1 | AA254: 804 | AB254: 729 | AC254: =(AA254*100)/AB254 -> 110.2880658436214 | AD254: =(X254*4)+(Z254*2) -> 14
A255: NORTHCOTE | C255: 6 | D255: 4 | E255: =C255*6+D255 -> 40 | G255: 7 | H255: 8 | I255: =G255*6+H255 -> 50 | K255: 12 | L255: 12 | M255: =K255*6+L255 -> 84 | O255: 13 | P255: 14 | Q255: =O255*6+P255 -> 92 | S255: MATTHEWS | W255: NORTHCOTE | X255: 3 | Y255: 3 | Z255: 0 | AA255: 769 | AB255: 821 | AC255: =(AA255*100)/AB255 -> 93.666260657734469 | AD255: =(X255*4)+(Z255*2) -> 12
A256: BEST PLAYERS | W256: WILLIAMSTOWN | X256: 2 | Y256: 4 | Z256: 0 | AA256: 779 | AB256: 777 | AC256: =(AA256*100)/AB256 -> 100.25740025740026 | AD256: =(X256*4)+(Z256*2) -> 8
A257: CAMBERWELL | C257: ADGEMIS | F257: HOOK | I257: OLIVER | L257: SIMPSON | O257: SPITHILL | R257: HARROP | W257: WERRIBEE | X257: 2 | Y257: 4 | Z257: 0 | AA257: 663 | AB257: 764 | AC257: =(AA257*100)/AB257 -> 86.78010471204189 | AD257: =(X257*4)+(Z257*2) -> 8
A258: NORTHCOTE | C258: BRAIN | F258: HOLLAND | I258: REDENBACH | L258: McGRATH | O258: ROBERTS | R258: M RYAN | W258: SUNSHINE | X258: 1 | Y258: 5 | Z258: 0 | AA258: 556 | AB258: 872 | AC258: =(AA258*100)/AB258 -> 63.761467889908253 | AD258: =(X258*4)+(Z258*2) -> 4
A259: GOALKICKERS | W259: BOX HILL | X259: 0 | Y259: 6 | Z259: 0 | AA259: 605 | AB259: 770 | AC259: =(AA259*100)/AB259 -> 78.571428571428569 | AD259: =(X259*4)+(Z259*2) -> 0
A260: CAMBERWELL | C260: HAMMOND 4 | F260: HARROP 4 | I260: A SMITH 3 | L260: ALEXEEF 2 | N260: ADGEMIS 2 | Q260: SIMPSON
A261: NORTHCOTE | C261: McGRATH 7 | F261: OLIVER 2 | I261: JENKINS | K261: MORTON | M261: HOBBS | O261: ROBERTS
A263: FRANKSTON | C263: 5 | D263: 5 | E263: =C263*6+D263 -> 35 | G263: 9 | H263: 4 | I263: =G263*6+H263 -> 58 | K263: 14 | L263: 6 | M263: =K263*6+L263 -> 90 | O263: 16 | P263: 10 | Q263: =O263*6+P263 -> 106 | S263: OAKLEIGH
A264: OAKLEIGH | C264: 2 | D264: 1 | E264: =C264*6+D264 -> 13 | G264: 7 | H264: 8 | I264: =G264*6+H264 -> 50 | K264: 12 | L264: 12 | M264: =K264*6+L264 -> 84 | O264: 13 | P264: 14 | Q264: =O264*6+P264 -> 92 | S264: STABB
A265: BEST PLAYERS
A266: FRANKSTON | C266: A HARPER | F266: ROBERTS | I266: MACE | L266: BELL | N266: JONES | Q266: SAMPSON
A267: OAKLEIGH | C267: GOODMAN | F267: WATTS | I267: EDWARDS | L267: SPLATT | N267: LEISHMAN | Q267: ROWLINGS
A268: GOALKICKERS
A269: FRANKSTON | C269: RYAN 4 | E269: ORCHARD 4 | H269: HUNTER 3 | J269: SAMPSON 2 | M269: JONES 2 | O269: LOCCO 2 | Q269: KENNEDY | S269: MACE | U269: BELL
A270: OAKLEIGH | C270: WENN 4 | F270: GOODMAN 4 | I270: ROWLANDS 3 | L270: G HARTLEY | O270: KUZIMAK | Q270: SPLATT | S270: LEISHMAN
A272: WAVERLEY | C272: 6 | D272: 7 | E272: =C272*6+D272 -> 43 | G272: 11 | H272: 12 | I272: =G272*6+H272 -> 78 | K272: 17 | L272: 13 | M272: =K272*6+L272 -> 115 | O272: 26 | P272: 17 | Q272: =O272*6+P272 -> 173 | S272: BOX HILL
A273: BOX HILL | C273: 1 | D273: 2 | E273: =C273*6+D273 -> 8 | G273: 5 | H273: 6 | I273: =G273*6+H273 -> 36 | K273: 9 | L273: 12 | M273: =K273*6+L273 -> 66 | O273: 13 | P273: 17 | Q273: =O273*6+P273 -> 95 | S273: HEDGER
A274: BEST PLAYERS
A275: WAVERLEY | C275: COSTELLO | F275: W McDONALD | J275: ? | L275: GILL | N275: BARNES | Q275: STYLES
A276: BOX HILL | C276: DICKENSON | F276: GAUL | H276: WESTMORELAND | L276: KIKER | N276: JOFFE | Q276: WITHERS
A277: GOALKICKERS
A278: WAVERLEY | C278: COSTELLO 10 | F278: McKAY 6 | H278: BARNES 3 | J278: HAROLD 3 | M278: POORE | O278: GILL | P278: MORRIS | R278: RAWLINGS
A279: BOX HILL | C279: GAUL 4 | E279: JOFFE 3 | G279: KLUEGER | I279: WESTMORELAND | M279: LASKIE | O279: DICKENSON | R279: LAWTHER | V279: WITHERS
A281: YARRAVILLE | C281: 2 | D281: 3 | E281: =C281*6+D281 -> 15 | G281: 10 | H281: 5 | I281: =G281*6+H281 -> 65 | K281: 11 | L281: 8 | M281: =K281*6+L281 -> 74 | O281: 15 | P281: 14 | Q281: =O281*6+P281 -> 104 | S281: WERRIBEE
A282: WERRIBEE | C282: 2 | D282: 6 | E282: =C282*6+D282 -> 18 | G282: 5 | H282: 10 | I282: =G282*6+H282 -> 40 | K282: 9 | L282: 13 | M282: =K282*6+L282 -> 67 | O282: 12 | P282: 19 | Q282: =O282*6+P282 -> 91 | S282: WENN
A283: BEST PLAYERS
A284: YARRAVILLE | C284: MAGEE | F284: SIMMONS | I284: WELLINGTON | L284: WARD | N284: CALVERT | Q284: M FOTHERINGHAM
A285: WERRIBEE | C285: LANCASTER | F285: LEECE | I285: HASSETT | L285: YOUNG | N285: JACK | Q285: DOUGLAS
A286: GOALKICKERS
A287: YARRAVILLE | C287: M FOTHERINGHAM 9 | G287: MAGEE | I287: WELLINGTON | L287: SAIT | N287: SHARP | P287: HARLEY | R287: SAMPSON
A288: WERRIBEE | C288: LEECE 7 | F288: J BELLIN 2 | I288: DOUGLAS | L288: EVANS | N288: OUGH
A290: ROUND 7 | E290: 21ST MAY | J290: WEATHER | S290: PLAYED AT
D291: 1ST QTR | H291: 2ND QTR | L291: 3RD QTR | P291: FINAL | S291: YARRAVILLE
A292: YARRAVILLE | C292: 6 | D292: 2 | E292: =C292*6+D292 -> 38 | G292: 16 | H292: 10 | I292: =G292*6+H292 -> 106 | K292: 20 | L292: 13 | M292: =K292*6+L292 -> 133 | O292: 27 | P292: 20 | Q292: =O292*6+P292 -> 182 | S292: UMPIRE | X292: LADDER | AB292: ROUND | AD292: 7
A293: WILLIAMSTOWN | C293: 3 | D293: 6 | E293: =C293*6+D293 -> 24 | G293: 5 | H293: 8 | I293: =G293*6+H293 -> 38 | K293: 6 | L293: 10 | M293: =K293*6+L293 -> 46 | O293: 12 | P293: 11 | Q293: =O293*6+P293 -> 83 | S293: O'BRIEN
A294: BEST PLAYERS | W294: TEAM | X294: W | Y294: L | Z294: D | AA294: FOR | AB294: AGST | AC294: % | AD294: PTS
A295: YARRAVILLE | C295: SAIT | F295: SIMMONS | I295: THORPE | L295: HARLEY | O295: GRACO | R295: M FOTHERINGHAM
A296: WILLIAMSTOWN | C296: MILDENHALL | F296: PHILPOTT | I296: NASH | L296: LOWE | O296: McVEIGH | R296: JOHN | W296: CAMBERWELL | X296: 7 | Y296: 0 | Z296: 0 | AA296: 1019 | AB296: 567 | AC296: =(AA296*100)/AB296 -> 179.71781305114638 | AD296: =(X296*4)+(Z296*2) -> 28
A297: GOALKICKERS | C297: 2 SHORT | N297: WELLINGTON | Q297: JONES | W297: FRANKSTON | X297: 6 | Y297: 1 | Z297: 0 | AA297: 1110 | AB297: 786 | AC297: =(AA297*100)/AB297 -> 141.22137404580153 | AD297: =(X297*4)+(Z297*2) -> 24
A298: YARRAVILLE | C298: M FOTHERINGHAM 8 | G298: SAIT 5 | I298: THORPE 2 | K298: KELLY 2 | M298: HARLEY 2 | O298: J RYAN 2 | Q298: SIMMONS | S298: MAGEE | W298: YARRAVILLE | X298: 5 | Y298: 2 | Z298: 0 | AA298: 936 | AB298: 803 | AC298: =(AA298*100)/AB298 -> 116.56288916562889 | AD298: =(X298*4)+(Z298*2) -> 20
A299: WILLIAMSTOWN | C299: LOWE 5 | F299: JOHN 3 | H299: MILDENHALL 2 | K299: NASH | M299: MITCHELL | W299: WAVERLEY | X299: 4 | Y299: 2 | Z299: 1 | AA299: 898 | AB299: 779 | AC299: =(AA299*100)/AB299 -> 115.27599486521181 | AD299: =(X299*4)+(Z299*2) -> 18
A301: SUNSHINE | C301: 8 | D301: 3 | E301: =C301*6+D301 -> 51 | G301: 11 | H301: 3 | I301: =G301*6+H301 -> 69 | K301: 19 | L301: 9 | M301: =K301*6+L301 -> 123 | O301: 28 | P301: 12 | Q301: =O301*6+P301 -> 180 | S301: SUNSHINE | W301: OAKLEIGH | X301: 3 | Y301: 3 | Z301: 1 | AA301: 950 | AB301: 909 | AC301: =(AA301*100)/AB301 -> 104.51045104510452 | AD301: =(X301*4)+(Z301*2) -> 14
A302: OAKLEIGH | C302: 5 | D302: 4 | E302: =C302*6+D302 -> 34 | G302: 13 | H302: 10 | I302: =G302*6+H302 -> 88 | K302: 16 | L302: 14 | M302: =K302*6+L302 -> 110 | O302: 21 | P302: 20 | Q302: =O302*6+P302 -> 146 | S302: WILSON | W302: NORTHCOTE | X302: 3 | Y302: 4 | Z302: 0 | AA302: 879 | AB302: 950 | AC302: =(AA302*100)/AB302 -> 92.526315789473685 | AD302: =(X302*4)+(Z302*2) -> 12
A303: BEST PLAYERS | W303: WILLIAMSTOWN | X303: 2 | Y303: 5 | Z303: 0 | AA303: 862 | AB303: 959 | AC303: =(AA303*100)/AB303 -> 89.885297184567264 | AD303: =(X303*4)+(Z303*2) -> 8
A304: SUNSHINE | C304: MANDICS | F304: T BRETT | I304: BUGDEN | L304: REDENBACH | O304: McDONALD | R304: P SIMPSON | W304: WERRIBEE | X304: 2 | Y304: 5 | Z304: 0 | AA304: 744 | AB304: 972 | AC304: =(AA304*100)/AB304 -> 76.543209876543216 | AD304: =(X304*4)+(Z304*2) -> 8
A305: OAKLEIGH | C305: GOODMAN | F305: FRYER | I305: LEISHMAN | L305: ROWLANDS | O305: MACKEY | W305: SUNSHINE | X305: 2 | Y305: 5 | Z305: 0 | AA305: 736 | AB305: 1018 | AC305: =(AA305*100)/AB305 -> 72.29862475442043 | AD305: =(X305*4)+(Z305*2) -> 8
A306: GOALKICKERS | K306: RADZIMINSKI | N306: SEARLE | P306: JONES | R306: P SIMPSON | W306: BOX HILL | X306: 0 | Y306: 7 | Z306: 0 | AA306: 737 | AB306: 972 | AC306: =(AA306*100)/AB306 -> 75.823045267489718 | AD306: =(X306*4)+(Z306*2) -> 0
A307: SUNSHINE | C307: MANDICS 6 | F307: SAID 5 | H307: T BRETT 4 | J307: REDENBACH 3 | M307: BENSON 2 | O307: J SIMPSON 2 | R307: RICHARDS 2
A308: OAKLEIGH | C308: THOMAS 5 | E308: MILLER 4 | G308: ROWLANDS 4 | J308: FRYER 2 | L308: McDONALD 2 | O308: BURKE | Q308: GOODMAN | T308: LEISHMAN | W308: ZUBIN
A310: CAMBERWELL | C310: 7 | D310: 3 | E310: =C310*6+D310 -> 45 | G310: 13 | H310: 8 | I310: =G310*6+H310 -> 86 | K310: 25 | L310: 11 | M310: =K310*6+L310 -> 161 | O310: 32 | P310: 16 | Q310: =O310*6+P310 -> 208 | S310: CAMBERWELL
A311: WERRIBEE | C311: 4 | D311: 3 | E311: =C311*6+D311 -> 27 | G311: 5 | H311: 8 | I311: =G311*6+H311 -> 38 | K311: 10 | L311: 9 | M311: =K311*6+L311 -> 69 | O311: 12 | P311: 9 | Q311: =O311*6+P311 -> 81 | S311: OAKLEY
A312: BEST PLAYERS
A313: CAMBERWELL | C313: HARROP | F313: HAMMOND | I313: OLIVER | L313: CHAMBERLAIN | O313: INNES | R313: NEILSON
A314: WERRIBEE | C314: JACK | F314: DOUGLAS | I314: YOUNG | L314: BOURKE | O314: MARTIN | R314: J BELLIN
A315: GOALKICKERS
A316: CAMBERWELL | C316: HARROP 13 | F316: HAMMOND 6 | I316: SIMPSON 3 | K316: ADGEMIS 3 | N316: ALEXEEF 2 | P316: NEILSON 2 | R316: HOOK 2 | T316: WITHERS
A317: WERRIBEE | C317: MARTIN 3 | F317: J BELLIN 3 | I317: WHITE 3 | K317: LANCASTER 2 | N317: COLLINS
A319: FRANKSTON | C319: 6 | D319: 1 | E319: =C319*6+D319 -> 37 | G319: 16 | H319: 8 | I319: =G319*6+H319 -> 104 | K319: 27 | L319: 10 | M319: =K319*6+L319 -> 172 | O319: 31 | P319: 16 | Q319: =O319*6+P319 -> 202 | S319: FRANKSTON
A320: BOX HILL | C320: 7 | D320: 5 | E320: =C320*6+D320 -> 47 | G320: 12 | H320: 6 | I320: =G320*6+H320 -> 78 | K320: 16 | L320: 10 | M320: =K320*6+L320 -> 106 | O320: 19 | P320: 18 | Q320: =O320*6+P320 -> 132 | S320: McBAIN
A321: BEST PLAYERS
A322: FRANKSTON | C322: DANKS | F322: SAMPSON | I322: BOYD | L322: TICKELL | O322: STAPLETON | R322: GEDDES
A323: BOX HILL | C323: GAUL | F323: WITHERS | I323: DICKENSON | L323: WESTMORELAND | P323: RALPH | R323: JOFFE
A324: GOALKICKERS
A325: FRANKSTON | C325: DANKS 8 | E325: HUNTER 6 | G325: RYAN 5 | I325: KENNEDY 2 | K325: LOVELOCK 2 | N325: SAMPSON 2 | Q325: LOCCO | S325: MACE | U325: ROBERTS | W325: ORCHARD | X325: JONES | Z325: MEMBREY
A326: BOX HILL | C326: WITHERS 5 | E326: GAUL 5 | G326: RALPH 3 | I326: WESTMORELAND 2 | M326: JOFFE 2 | O326: KIKER | Q326: KRUEGER
A328: WAVERLEY | C328: 5 | D328: 4 | E328: =C328*6+D328 -> 34 | G328: 9 | H328: 7 | I328: =G328*6+H328 -> 61 | K328: 12 | L328: 10 | M328: =K328*6+L328 -> 82 | O328: 19 | P328: 15 | Q328: =O328*6+P328 -> 129 | S328: WAVERLEY
A329: NORTHCOTE | C329: 4 | D329: 3 | E329: =C329*6+D329 -> 27 | G329: 6 | H329: 6 | I329: =G329*6+H329 -> 42 | K329: 11 | L329: 10 | M329: =K329*6+L329 -> 76 | O329: 16 | P329: 14 | Q329: =O329*6+P329 -> 110 | S329: WENN
A330: BEST PLAYERS
A331: WAVERLEY | C331: JAMIESON | F331: GILL | I331: BARNES | L331: COSTELLO | O331: STYLES | R331: P WILLIAMS
A332: NORTHCOTE | C332: GREGURIK | F332: McCONCHIE | I332: M RYAN | L332: GRAHAM | O332: McINTYRE
A333: GOALKICKERS
A334: WAVERLEY | C334: COSTELLO 6 | F334: JAMIESON 5 | I334: McKAY 3 | K334: HAROLD | M334: GILL | N334: RAWLINGS | Q334: BARNES | S334: KINNABURGH
A335: NORTHCOTE | C335: GREGURIK 4 | F335: McGRATH 3 | I335: McCONCHIE 3 | L335: HOLLAND 2 | O335: HOBBS 2 | Q335: M RYAN | S335: BURLEIGH
A337: ROUND 8 | E337: 28TH MAY | J337: WEATHER | S337: PLAYED AT
D338: 1ST QTR | H338: 2ND QTR | L338: 3RD QTR | P338: FINAL | S338: BOX HILL
A339: BOX HILL | C339: 0 | D339: 3 | E339: =C339*6+D339 -> 3 | G339: 4 | H339: 8 | I339: =G339*6+H339 -> 32 | K339: 9 | L339: 11 | M339: =K339*6+L339 -> 65 | O339: 17 | P339: 17 | Q339: =O339*6+P339 -> 119 | S339: UMPIRE | X339: LADDER | AB339: ROUND | AD339: 8
A340: SUNSHINE | C340: 6 | D340: 4 | E340: =C340*6+D340 -> 40 | G340: 9 | H340: 7 | I340: =G340*6+H340 -> 61 | K340: 15 | L340: 17 | M340: =K340*6+L340 -> 107 | O340: 17 | P340: 17 | Q340: =O340*6+P340 -> 119 | S340: SNOOKS
A341: BEST PLAYERS | W341: TEAM | X341: W | Y341: L | Z341: D | AA341: FOR | AB341: AGST | AC341: % | AD341: PTS
A342: BOX HILL | C342: KIKER | F342: CONNOLY | I342: GAUL | L342: WESTMORELAND | O342: WITHERS | R342: INGLETON
A343: SUNSHINE | C343: BENSON | F343: RADZIMINSKI | I343: BUGDEN | L343: REDENBACH | O343: P SIMPSON | R343: SAID | W343: CAMBERWELL | X343: 8 | Y343: 0 | Z343: 0 | AA343: 1165 | AB343: 644 | AC343: =(AA343*100)/AB343 -> 180.90062111801242 | AD343: =(X343*4)+(Z343*2) -> 32
A344: GOALKICKERS | W344: FRANKSTON | X344: 7 | Y344: 1 | Z344: 0 | AA344: 1291 | AB344: 887 | AC344: =(AA344*100)/AB344 -> 145.54678692220969 | AD344: =(X344*4)+(Z344*2) -> 28
A345: BOX HILL | C345: RALPH 4 | E345: GAUL 3 | G345: WESTMORELAND 3 | K345: WITHERS 2 | N345: INGLETON 2 | Q345: McGUINNESS 2 | T345: KIKER | W345: YARRAVILLE | X345: 5 | Y345: 3 | Z345: 0 | AA345: 1013 | AB345: 915 | AC345: =(AA345*100)/AB345 -> 110.7103825136612 | AD345: =(X345*4)+(Z345*2) -> 20
A346: SUNSHINE | C346: SAID 5 | E346: REDENBACH 4 | H346: J SIMPSON 3 | K346: MANDICS 2 | M346: RICHARDS | O346: BENSON | Q346: RADZIMINSKI | W346: OAKLEIGH | X346: 4 | Y346: 3 | Z346: 1 | AA346: 1062 | AB346: 986 | AC346: =(AA346*100)/AB346 -> 107.7079107505071 | AD346: =(X346*4)+(Z346*2) -> 18
A348: FRANKSTON | C348: 4 | D348: 2 | E348: =C348*6+D348 -> 26 | G348: 15 | H348: 5 | I348: =G348*6+H348 -> 95 | K348: 18 | L348: 6 | M348: =K348*6+L348 -> 114 | O348: 28 | P348: 13 | Q348: =O348*6+P348 -> 181 | S348: FRANKSTON | W348: WAVERLEY | X348: 4 | Y348: 3 | Z348: 1 | AA348: 999 | AB348: 960 | AC348: =(AA348*100)/AB348 -> 104.0625 | AD348: =(X348*4)+(Z348*2) -> 18
A349: WAVERLEY | C349: 4 | D349: 4 | E349: =C349*6+D349 -> 28 | G349: 6 | H349: 7 | I349: =G349*6+H349 -> 43 | K349: 11 | L349: 10 | M349: =K349*6+L349 -> 76 | O349: 15 | P349: 11 | Q349: =O349*6+P349 -> 101 | S349: OAKLEY | W349: NORTHCOTE | X349: 4 | Y349: 4 | Z349: 0 | AA349: 1035 | AB349: 1042 | AC349: =(AA349*100)/AB349 -> 99.328214971209206 | AD349: =(X349*4)+(Z349*2) -> 16
A350: BEST PLAYERS | W350: SUNSHINE | X350: 2 | Y350: 5 | Z350: 1 | AA350: 855 | AB350: 1137 | AC350: =(AA350*100)/AB350 -> 75.197889182058049 | AD350: =(X350*4)+(Z350*2) -> 10
A351: FRANKSTON | C351: ORCHARD | F351: MACE | H351: BELL | J351: BATTY | M351: SAMPSON | P351: KENNEDY | W351: WILLIAMSTOWN | X351: 2 | Y351: 6 | Z351: 0 | AA351: 939 | AB351: 1105 | AC351: =(AA351*100)/AB351 -> 84.977375565610856 | AD351: =(X351*4)+(Z351*2) -> 8
A352: WAVERLEY | C352: MORRISON | F352: P WILLIAMS | I352: AUSTIN | K352: STYLES | M352: BARNES | P352: TYQUIN | W352: WERRIBEE | X352: 2 | Y352: 6 | Z352: 0 | AA352: 836 | AB352: 1128 | AC352: =(AA352*100)/AB352 -> 74.113475177304963 | AD352: =(X352*4)+(Z352*2) -> 8
A353: GOALKICKERS | O353: ROBERTS | W353: BOX HILL | X353: 0 | Y353: 7 | Z353: 1 | AA353: 856 | AB353: 1091 | AC353: =(AA353*100)/AB353 -> 78.460128322639775 | AD353: =(X353*4)+(Z353*2) -> 2
A354: FRANKSTON | C354: HUNTER 8 | E354: LOVELOCK 5 | G354: LOCCO 4 | I354: MACE 2 | K354: HARPER | M354: KENNEDY | O354: ORCHARD | Q354: DANKS | S354: JONES | U354: BELL
A355: WAVERLEY | C355: BARNES 4 | F355: McKAY 3 | I355: RAWLINGS 2 | L355: COSTELLO 2 | N355: P WILLIAMS | Q355: AUSTIN | S355: HOLDSWORTH | W355: JAMIESON
A357: OAKLEIGH | C357: 5 | D357: 3 | E357: =C357*6+D357 -> 33 | G357: 8 | H357: 5 | I357: =G357*6+H357 -> 53 | K357: 10 | L357: 10 | M357: =K357*6+L357 -> 70 | O357: 16 | P357: 16 | Q357: =O357*6+P357 -> 112 | S357: OAKLEIGH
A358: YARRAVILLE | C358: 2 | D358: 3 | E358: =C358*6+D358 -> 15 | G358: 3 | H358: 2 | I358: =G358*6+H358 -> 20 | K358: 8 | L358: 14 | M358: =K358*6+L358 -> 62 | O358: 10 | P358: 17 | Q358: =O358*6+P358 -> 77 | S358: MATTHEWS
A359: BEST PLAYERS
A360: OAKLEIGH | C360: J HARTLEY | F360: WATTS | I360: LEISHMAN | L360: GOODMAN | O360: SPLATT
A361: YARRAVILLE | C361: SAIT | F361: SIMMONS | I361: WELLINGTON | L361: WARD | O361: L RYAN | R361: J RYAN
A362: GOALKICKERS
A363: OAKLEIGH | C363: THOMAS 4 | F363: MILLER 4 | H363: McDONALD 2 | K363: LEISHMAN 2 | N363: KUZIMAK | Q363: BURKE | S363: WENN | U363: GOODMAN
A364: YARRAVILLE | C364: M FOTHERINGHAM 3 | G364: L RYAN 2 | I364: J RYAN 2 | K364: WELLINGTON | N364: SAIT | P364: LOWE
A366: CAMBERWELL | C366: 6 | D366: 4 | E366: =C366*6+D366 -> 40 | G366: 7 | H366: 6 | I366: =G366*6+H366 -> 48 | K366: 14 | L366: 8 | M366: =K366*6+L366 -> 92 | O366: 22 | P366: 14 | Q366: =O366*6+P366 -> 146 | S366: WILLIAMSTOWN
A367: WILLIAMSTOWN | C367: 3 | D367: 2 | E367: =C367*6+D367 -> 20 | G367: 7 | H367: 4 | I367: =G367*6+H367 -> 46 | K367: 8 | L367: 5 | M367: =K367*6+L367 -> 53 | O367: 12 | P367: 5 | Q367: =O367*6+P367 -> 77 | S367: R WILSON
A368: BEST PLAYERS
A369: CAMBERWELL | C369: HOOK | F369: INNES | I369: HAMMOND | L369: CHAMBERLAIN | O369: B SMITH | R369: SIMPSON
A370: WILLIAMSTOWN | C370: ALEXANDER | F370: L TAYLOR | I370: ENRIGHT | L370: TINSLEY | O370: BEBEND | R370: PATON
A371: GOALKICKERS
A372: CAMBERWELL | C372: HAMMOND 8 | F372: B SMITH 5 | I372: SIMPSON 3 | L372: HARROP 3 | N372: A SMITH 2 | Q372: ADGEMIS
A373: WILLIAMSTOWN | C373: LOWE 4 | F373: FANNING 2 | I373: L TAYLOR 2 | L373: JOHN 2 | N373: PATON | P373: BURGESS
A375: NORTHCOTE | C375: 6 | D375: 6 | E375: =C375*6+D375 -> 42 | G375: 8 | H375: 11 | I375: =G375*6+H375 -> 59 | K375: 17 | L375: 15 | M375: =K375*6+L375 -> 117 | O375: 23 | P375: 18 | Q375: =O375*6+P375 -> 156 | S375: WERRIBEE
A376: WERRIBEE | C376: 5 | D376: 1 | E376: =C376*6+D376 -> 31 | G376: 8 | H376: 5 | I376: =G376*6+H376 -> 53 | K376: 9 | L376: 9 | M376: =K376*6+L376 -> 63 | O376: 13 | P376: 14 | Q376: =O376*6+P376 -> 92 | S376: McBAIN
A377: BEST PLAYERS
A378: NORTHCOTE | C378: G RYAN | F378: A HOLLAND | I378: McCONCHIE | L378: HOBBS | N378: G HOLLAND | Q378: M RYAN
A379: WERRIBEE | C379: McCARTNEY | F379: OUGH | I379: KNIGHT | L379: J BELLIN | N379: MARTIN
A380: GOALKICKERS
A381: NORTHCOTE | C381: G RYAN 10 | F381: McGRATH 5 | I381: McCONCHIE 3 | L381: AFFLECK 2 | N381: SMITH | P381: HOBBS | R381: GRAHAM
A382: WERRIBEE | C382: POWER 3 | F382: J BELLIN 2 | I382: COLLINS 2 | L382: WHITE 2 | N382: BOURKE | P382: LANCASTER | S382: OUGH | U382: MARTIN
A384: ROUND 9 | E384: 11TH JUNE | J384: WEATHER | S384: PLAYED AT
D385: 1ST QTR | H385: 2ND QTR | L385: 3RD QTR | P385: FINAL | S385: SUNSHINE
A386: SUNSHINE | C386: 0 | D386: 0 | E386: =C386*6+D386 -> 0 | G386: 0 | H386: 0 | I386: =G386*6+H386 -> 0 | K386: 0 | L386: 0 | M386: =K386*6+L386 -> 0 | O386: 15 | P386: 10 | Q386: =O386*6+P386 -> 100 | S386: UMPIRE | X386: LADDER | AB386: ROUND | AD386: 9
A387: FRANKSTON | C387: 0 | D387: 0 | E387: =C387*6+D387 -> 0 | G387: 0 | H387: 0 | I387: =G387*6+H387 -> 0 | K387: 0 | L387: 10 | M387: =K387*6+L387 -> 10 | O387: 12 | P387: 25 | Q387: =O387*6+P387 -> 97
A388: BEST PLAYERS | W388: TEAM | X388: W | Y388: L | Z388: D | AA388: FOR | AB388: AGST | AC388: % | AD388: PTS
A389: SUNSHINE
A390: FRANKSTON | W390: CAMBERWELL | X390: 8 | Y390: 1 | Z390: 0 | AA390: 1266 | AB390: 770 | AC390: =(AA390*100)/AB390 -> 164.41558441558442 | AD390: =(X390*4)+(Z390*2) -> 32
A391: GOALKICKERS | W391: FRANKSTON | X391: 7 | Y391: 2 | Z391: 0 | AA391: 1388 | AB391: 987 | AC391: =(AA391*100)/AB391 -> 140.62816616008107 | AD391: =(X391*4)+(Z391*2) -> 28
A392: SUNSHINE | W392: YARRAVILLE | X392: 6 | Y392: 3 | Z392: 0 | AA392: 1174 | AB392: 979 | AC392: =(AA392*100)/AB392 -> 119.91828396322778 | AD392: =(X392*4)+(Z392*2) -> 24
A393: FRANKSTON | W393: OAKLEIGH | X393: 5 | Y393: 3 | Z393: 1 | AA393: 1188 | AB393: 1087 | AC393: =(AA393*100)/AB393 -> 109.2916283348666 | AD393: =(X393*4)+(Z393*2) -> 22
A395: OAKLEIGH | C395: 0 | D395: 0 | E395: =C395*6+D395 -> 0 | G395: 0 | H395: 0 | I395: =G395*6+H395 -> 0 | K395: 0 | L395: 0 | M395: =K395*6+L395 -> 0 | O395: 18 | P395: 18 | Q395: =O395*6+P395 -> 126 | S395: CAMBERWELL | W395: WAVERLEY | X395: 5 | Y395: 3 | Z395: 1 | AA395: 1116 | AB395: 1046 | AC395: =(AA395*100)/AB395 -> 106.69216061185469 | AD395: =(X395*4)+(Z395*2) -> 22
A396: CAMBERWELL | C396: 0 | D396: 0 | E396: =C396*6+D396 -> 0 | G396: 0 | H396: 0 | I396: =G396*6+H396 -> 0 | K396: 0 | L396: 0 | M396: =K396*6+L396 -> 0 | O396: 14 | P396: 17 | Q396: =O396*6+P396 -> 101 | W396: NORTHCOTE | X396: 5 | Y396: 4 | Z396: 0 | AA396: 1194 | AB396: 1110 | AC396: =(AA396*100)/AB396 -> 107.56756756756756 | AD396: =(X396*4)+(Z396*2) -> 20
A397: BEST PLAYERS | W397: SUNSHINE | X397: 3 | Y397: 5 | Z397: 1 | AA397: 955 | AB397: 1234 | AC397: =(AA397*100)/AB397 -> 77.390599675850893 | AD397: =(X397*4)+(Z397*2) -> 14
A398: OAKLEIGH | W398: WILLIAMSTOWN | X398: 2 | Y398: 7 | Z398: 0 | AA398: 1007 | AB398: 1264 | AC398: =(AA398*100)/AB398 -> 79.667721518987335 | AD398: =(X398*4)+(Z398*2) -> 8
A399: CAMBERWELL | W399: WERRIBEE | X399: 2 | Y399: 7 | Z399: 0 | AA399: 922 | AB399: 1245 | AC399: =(AA399*100)/AB399 -> 74.056224899598391 | AD399: =(X399*4)+(Z399*2) -> 8
A400: GOALKICKERS | W400: BOX HILL | X400: 0 | Y400: 8 | Z400: 1 | AA400: 920 | AB400: 1252 | AC400: =(AA400*100)/AB400 -> 73.482428115015978 | AD400: =(X400*4)+(Z400*2) -> 2
A401: OAKLEIGH
A402: CAMBERWELL
A404: YARRAVILLE | C404: 0 | D404: 0 | E404: =C404*6+D404 -> 0 | G404: 0 | H404: 0 | I404: =G404*6+H404 -> 0 | K404: 0 | L404: 0 | M404: =K404*6+L404 -> 0 | O404: 24 | P404: 17 | Q404: =O404*6+P404 -> 161 | S404: YARRAVILLE
A405: BOX HILL | C405: 0 | D405: 0 | E405: =C405*6+D405 -> 0 | G405: 0 | H405: 0 | I405: =G405*6+H405 -> 0 | K405: 0 | L405: 0 | M405: =K405*6+L405 -> 0 | O405: 9 | P405: 10 | Q405: =O405*6+P405 -> 64
A406: BEST PLAYERS
A407: YARRAVILLE
A408: BOX HILL
A409: GOALKICKERS
A410: YARRAVILLE
A411: BOX HILL
A413: NORTHCOTE | C413: 0 | D413: 0 | E413: =C413*6+D413 -> 0 | G413: 0 | H413: 0 | I413: =G413*6+H413 -> 0 | K413: 0 | L413: 0 | M413: =K413*6+L413 -> 0 | O413: 23 | P413: 21 | Q413: =O413*6+P413 -> 159 | S413: NORTHCOTE
A414: WILLIAMSTOWN | C414: 0 | D414: 0 | E414: =C414*6+D414 -> 0 | G414: 0 | H414: 0 | I414: =G414*6+H414 -> 0 | K414: 0 | L414: 0 | M414: =K414*6+L414 -> 0 | O414: 10 | P414: 8 | Q414: =O414*6+P414 -> 68
A415: BEST PLAYERS
A416: NORTHCOTE
A417: WILLIAMSTOWN
A418: GOALKICKERS
A419: NORTHCOTE
A420: WILLIAMSTOWN
A422: WAVERLEY | C422: 0 | D422: 0 | E422: =C422*6+D422 -> 0 | G422: 0 | H422: 0 | I422: =G422*6+H422 -> 0 | K422: 0 | L422: 0 | M422: =K422*6+L422 -> 0 | O422: 16 | P422: 21 | Q422: =O422*6+P422 -> 117 | S422: WAVERLEY
A423: WERRIBEE | C423: 0 | D423: 0 | E423: =C423*6+D423 -> 0 | G423: 0 | H423: 0 | I423: =G423*6+H423 -> 0 | K423: 0 | L423: 0 | M423: =K423*6+L423 -> 0 | O423: 12 | P423: 14 | Q423: =O423*6+P423 -> 86
A424: BEST PLAYERS
A425: WAVERLEY
A426: WERRIBEE
A427: GOALKICKERS
A428: WAVERLEY
A429: WERRIBEE
A431: ROUND 10 | E431: 18TH JUNE | J431: WEATHER | S431: PLAYED AT
D432: 1ST QTR | H432: 2ND QTR | L432: 3RD QTR | P432: FINAL | S432: WAVERLEY
A433: WAVERLEY | C433: 0 | D433: 0 | E433: =C433*6+D433 -> 0 | G433: 0 | H433: 0 | I433: =G433*6+H433 -> 0 | K433: 0 | L433: 0 | M433: =K433*6+L433 -> 0 | O433: 15 | P433: 20 | Q433: =O433*6+P433 -> 110 | S433: UMPIRE | X433: LADDER | AB433: ROUND | AD433: 10
A434: SUNSHINE | C434: 0 | D434: 0 | E434: =C434*6+D434 -> 0 | G434: 0 | H434: 0 | I434: =G434*6+H434 -> 0 | K434: 0 | L434: 10 | M434: =K434*6+L434 -> 10 | O434: 14 | P434: 15 | Q434: =O434*6+P434 -> 99
A435: BEST PLAYERS | W435: TEAM | X435: W | Y435: L | Z435: D | AA435: FOR | AB435: AGST | AC435: % | AD435: PTS
A436: WAVERLEY
A437: SUNSHINE | W437: CAMBERWELL | X437: 9 | Y437: 1 | Z437: 0 | AA437: 1418 | AB437: 830 | AC437: =(AA437*100)/AB437 -> 170.84337349397592 | AD437: =(X437*4)+(Z437*2) -> 36
A438: GOALKICKERS | W438: FRANKSTON | X438: 8 | Y438: 2 | Z438: 0 | AA438: 1518 | AB438: 1088 | AC438: =(AA438*100)/AB438 -> 139.52205882352942 | AD438: =(X438*4)+(Z438*2) -> 32
A439: WAVERLEY | W439: OAKLEIGH | X439: 6 | Y439: 3 | Z439: 1 | AA439: 1313 | AB439: 1210 | AC439: =(AA439*100)/AB439 -> 108.51239669421487 | AD439: =(X439*4)+(Z439*2) -> 26
A440: SUNSHINE | W440: WAVERLEY | X440: 6 | Y440: 3 | Z440: 1 | AA440: 1226 | AB440: 1145 | AC440: =(AA440*100)/AB440 -> 107.07423580786026 | AD440: =(X440*4)+(Z440*2) -> 26
A442: FRANKSTON | C442: 0 | D442: 0 | E442: =C442*6+D442 -> 0 | G442: 0 | H442: 0 | I442: =G442*6+H442 -> 0 | K442: 0 | L442: 0 | M442: =K442*6+L442 -> 0 | O442: 19 | P442: 16 | Q442: =O442*6+P442 -> 130 | S442: YARRAVILLE | W442: YARRAVILLE | X442: 6 | Y442: 4 | Z442: 0 | AA442: 1275 | AB442: 1109 | AC442: =(AA442*100)/AB442 -> 114.96844003606853 | AD442: =(X442*4)+(Z442*2) -> 24
A443: YARRAVILLE | C443: 0 | D443: 0 | E443: =C443*6+D443 -> 0 | G443: 0 | H443: 0 | I443: =G443*6+H443 -> 0 | K443: 0 | L443: 0 | M443: =K443*6+L443 -> 0 | O443: 14 | P443: 17 | Q443: =O443*6+P443 -> 101 | W443: NORTHCOTE | X443: 5 | Y443: 5 | Z443: 0 | AA443: 1317 | AB443: 1235 | AC443: =(AA443*100)/AB443 -> 106.63967611336032 | AD443: =(X443*4)+(Z443*2) -> 20
A444: BEST PLAYERS | W444: SUNSHINE | X444: 3 | Y444: 6 | Z444: 1 | AA444: 1054 | AB444: 1344 | AC444: =(AA444*100)/AB444 -> 78.422619047619051 | AD444: =(X444*4)+(Z444*2) -> 14
A445: FRANKSTON | W445: WERRIBEE | X445: 3 | Y445: 7 | Z445: 0 | AA445: 1059 | AB445: 1344 | AC445: =(AA445*100)/AB445 -> 78.794642857142861 | AD445: =(X445*4)+(Z445*2) -> 12
A446: YARRAVILLE | W446: WILLIAMSTOWN | X446: 2 | Y446: 8 | Z446: 0 | AA446: 1106 | AB446: 1401 | AC446: =(AA446*100)/AB446 -> 78.94361170592434 | AD446: =(X446*4)+(Z446*2) -> 8
A447: GOALKICKERS | W447: BOX HILL | X447: 0 | Y447: 9 | Z447: 1 | AA447: 980 | AB447: 1404 | AC447: =(AA447*100)/AB447 -> 69.800569800569804 | AD447: =(X447*4)+(Z447*2) -> 2
A448: FRANKSTON
A449: YARRAVILLE
A451: CAMBERWELL | C451: 0 | D451: 0 | E451: =C451*6+D451 -> 0 | G451: 0 | H451: 0 | I451: =G451*6+H451 -> 0 | K451: 0 | L451: 0 | M451: =K451*6+L451 -> 0 | O451: 23 | P451: 14 | Q451: =O451*6+P451 -> 152 | S451: CAMBERWELL
A452: BOX HILL | C452: 0 | D452: 0 | E452: =C452*6+D452 -> 0 | G452: 0 | H452: 0 | I452: =G452*6+H452 -> 0 | K452: 0 | L452: 0 | M452: =K452*6+L452 -> 0 | O452: 7 | P452: 18 | Q452: =O452*6+P452 -> 60
A453: BEST PLAYERS
A454: CAMBERWELL
A455: BOX HILL
A456: GOALKICKERS
A457: CAMBERWELL
A458: BOX HILL
A460: OAKLEIGH | C460: 0 | D460: 0 | E460: =C460*6+D460 -> 0 | G460: 0 | H460: 0 | I460: =G460*6+H460 -> 0 | K460: 0 | L460: 0 | M460: =K460*6+L460 -> 0 | O460: 18 | P460: 17 | Q460: =O460*6+P460 -> 125 | S460: NORTHCOTE
A461: NORTHCOTE | C461: 0 | D461: 0 | E461: =C461*6+D461 -> 0 | G461: 0 | H461: 0 | I461: =G461*6+H461 -> 0 | K461: 0 | L461: 0 | M461: =K461*6+L461 -> 0 | O461: 18 | P461: 15 | Q461: =O461*6+P461 -> 123
A462: BEST PLAYERS
A463: OAKLEIGH
A464: NORTHCOTE
A465: GOALKICKERS
A466: OAKLEIGH
A467: NORTHCOTE
A469: WERRIBEE | C469: 0 | D469: 0 | E469: =C469*6+D469 -> 0 | G469: 0 | H469: 0 | I469: =G469*6+H469 -> 0 | K469: 0 | L469: 0 | M469: =K469*6+L469 -> 0 | O469: 19 | P469: 23 | Q469: =O469*6+P469 -> 137 | S469: WERRIBEE
A470: WILLIAMSTOWN | C470: 0 | D470: 0 | E470: =C470*6+D470 -> 0 | G470: 0 | H470: 0 | I470: =G470*6+H470 -> 0 | K470: 0 | L470: 0 | M470: =K470*6+L470 -> 0 | O470: 15 | P470: 9 | Q470: =O470*6+P470 -> 99
A471: BEST PLAYERS
A472: WERRIBEE
A473: WILLIAMSTOWN
A474: GOALKICKERS
A475: WERRIBEE
A476: WILLIAMSTOWN
A478: ROUND 11 | E478: 25TH JUNE | J478: WEATHER | S478: PLAYED AT
D479: 1ST QTR | H479: 2ND QTR | L479: 3RD QTR | P479: FINAL | S479: SUNSHINE
A480: YARRAVILLE | C480: 3 | D480: 7 | E480: =C480*6+D480 -> 25 | G480: 11 | H480: 11 | I480: =G480*6+H480 -> 77 | K480: 15 | L480: 15 | M480: =K480*6+L480 -> 105 | O480: 16 | P480: 19 | Q480: =O480*6+P480 -> 115 | S480: UMPIRE | X480: LADDER | AB480: ROUND | AD480: 11
A481: SUNSHINE | C481: 3 | D481: 4 | E481: =C481*6+D481 -> 22 | G481: 8 | H481: 4 | I481: =G481*6+H481 -> 52 | K481: 11 | L481: 9 | M481: =K481*6+L481 -> 75 | O481: 16 | P481: 13 | Q481: =O481*6+P481 -> 109 | S481: FITZPATRICK
A482: BEST PLAYERS | W482: TEAM | X482: W | Y482: L | Z482: D | AA482: FOR | AB482: AGST | AC482: % | AD482: PTS
A483: YARRAVILLE | C483: BROPHY | F483: SAIT | I483: WELLINGTON | L483: GRACO | N483: M FOTHERINGHAM | R483: JONES
A484: SUNSHINE | C484: MANDICS | F484: BLAKE | I484: SAID | L484: PETER SIMPSON | O484: RADZIMINSKI | W484: CAMBERWELL | X484: 9 | Y484: 2 | Z484: 0 | AA484: 1504 | AB484: 942 | AC484: =(AA484*100)/AB484 -> 159.66029723991508 | AD484: =(X484*4)+(Z484*2) -> 36
A485: GOALKICKERS | W485: FRANKSTON | X485: 9 | Y485: 2 | Z485: 0 | AA485: 1630 | AB485: 1174 | AC485: =(AA485*100)/AB485 -> 138.84156729131175 | AD485: =(X485*4)+(Z485*2) -> 36
A486: YARRAVILLE | C486: M FOTHERINGHAM 7 | G486: JONES 3 | I486: SAIT | J486: LOWE | L486: CALVERT | N486: WELLINGTON | Q486: CAHILL | S486: HARLEY | W486: OAKLEIGH | X486: 7 | Y486: 3 | Z486: 1 | AA486: 1439 | AB486: 1304 | AC486: =(AA486*100)/AB486 -> 110.35276073619632 | AD486: =(X486*4)+(Z486*2) -> 30
A487: SUNSHINE | C487: SAID 6 | E487: T BRETT 2 | H487: RADZIMINSKI 2 | K487: MANDICS 2 | N487: JONES 2 | P487: PAUL SIMPSON | S487: RICHARDS | W487: WAVERLEY | X487: 7 | Y487: 3 | Z487: 1 | AA487: 1340 | AB487: 1252 | AC487: =(AA487*100)/AB487 -> 107.02875399361022 | AD487: =(X487*4)+(Z487*2) -> 30
A489: FRANKSTON | C489: 8 | D489: 2 | E489: =C489*6+D489 -> 50 | G489: 11 | H489: 6 | I489: =G489*6+H489 -> 72 | K489: 15 | L489: 13 | M489: =K489*6+L489 -> 103 | O489: 16 | P489: 16 | Q489: =O489*6+P489 -> 112 | S489: FRANKSTON | W489: YARRAVILLE | X489: 7 | Y489: 4 | Z489: 0 | AA489: 1390 | AB489: 1218 | AC489: =(AA489*100)/AB489 -> 114.12151067323481 | AD489: =(X489*4)+(Z489*2) -> 28
A490: CAMBERWELL | C490: 3 | D490: 4 | E490: =C490*6+D490 -> 22 | G490: 6 | H490: 11 | I490: =G490*6+H490 -> 47 | K490: 9 | L490: 15 | M490: =K490*6+L490 -> 69 | O490: 11 | P490: 20 | Q490: =O490*6+P490 -> 86 | S490: SNOOKS | W490: NORTHCOTE | X490: 6 | Y490: 5 | Z490: 0 | AA490: 1474 | AB490: 1328 | AC490: =(AA490*100)/AB490 -> 110.99397590361446 | AD490: =(X490*4)+(Z490*2) -> 24
A491: BEST PLAYERS | W491: SUNSHINE | X491: 3 | Y491: 7 | Z491: 1 | AA491: 1163 | AB491: 1459 | AC491: =(AA491*100)/AB491 -> 79.712131596984236 | AD491: =(X491*4)+(Z491*2) -> 14
A492: FRANKSTON | C492: MACE | F492: A HARPER | I492: ORCHARD | L492: JONES | O492: RIDSDALE | R492: GEDDES | W492: WERRIBEE | X492: 3 | Y492: 8 | Z492: 0 | AA492: 1153 | AB492: 1470 | AC492: =(AA492*100)/AB492 -> 78.435374149659864 | AD492: =(X492*4)+(Z492*2) -> 12
A493: CAMBERWELL | C493: R SMITH | F493: NEILSON | I493: SPITHILL | L493: McCARTHY | O493: CHAMBERLAIN | R493: B SMITH | W493: WILLIAMSTOWN | X493: 2 | Y493: 9 | Z493: 0 | AA493: 1213 | AB493: 1515 | AC493: =(AA493*100)/AB493 -> 80.06600660066006 | AD493: =(X493*4)+(Z493*2) -> 8
A494: GOALKICKERS | W494: BOX HILL | X494: 0 | Y494: 10 | Z494: 1 | AA494: 1073 | AB494: 1561 | AC494: =(AA494*100)/AB494 -> 68.737988468930169 | AD494: =(X494*4)+(Z494*2) -> 2
A495: FRANKSTON | C495: GEDDES 4 | F495: RIDSDALE 3 | I495: HUNTER 3 | K495: JONES 2 | M495: RYAN 2 | O495: BELL | Q495: WORTHINGTON
A496: CAMBERWELL | C496: NEILSON 3 | F496: B SMITH 3 | I496: HAMMOND 2 | L496: SPITHILL | N496: SIMPSON | P496: BRYCE
A498: NORTHCOTE | C498: 6 | D498: 4 | E498: =C498*6+D498 -> 40 | G498: 10 | H498: 8 | I498: =G498*6+H498 -> 68 | K498: 18 | L498: 16 | M498: =K498*6+L498 -> 124 | O498: 23 | P498: 19 | Q498: =O498*6+P498 -> 157 | S498: BOX HILL
A499: BOX HILL | C499: 6 | D499: 3 | E499: =C499*6+D499 -> 39 | G499: 9 | H499: 10 | I499: =G499*6+H499 -> 64 | K499: 9 | L499: 15 | M499: =K499*6+L499 -> 69 | O499: 12 | P499: 21 | Q499: =O499*6+P499 -> 93 | S499: STEERE
A500: BEST PLAYERS
A501: NORTHCOTE | C501: McLEOD | F501: McINTYRE | I501: OLIVERI | L501: McGRATH | N501: GREGURIK | Q501: ROBERTS
A502: BOX HILL | C502: CONNOLLY | F502: WITHERS | I502: WESTMORELAND | M502: DICKENSON | P502: JOFFE | R502: LUCAS
A503: GOALKICKERS
A504: NORTHCOTE | C504: OLIVERI 6 | F504: McGRATH 5 | I504: GREGURIK 4 | L504: G RYAN 2 | N504: M RYAN 2 | Q504: A HOLLAND 2 | T504: G HOLLAND 2
A505: BOX HILL | C505: WITHERS 4 | F505: FARRUGIA 3 | I505: INGLETON 2 | L505: JOFFE | N505: MAU | P505: CONNOLLY
A507: OAKLEIGH | C507: 7 | D507: 3 | E507: =C507*6+D507 -> 45 | G507: 9 | H507: 9 | I507: =G507*6+H507 -> 63 | K507: 12 | L507: 17 | M507: =K507*6+L507 -> 89 | O507: 17 | P507: 24 | Q507: =O507*6+P507 -> 126 | S507: OAKLEIGH
A508: WERRIBEE | C508: 4 | D508: 0 | E508: =C508*6+D508 -> 24 | G508: 7 | H508: 4 | I508: =G508*6+H508 -> 46 | K508: 10 | L508: 7 | M508: =K508*6+L508 -> 67 | O508: 14 | P508: 10 | Q508: =O508*6+P508 -> 94 | S508: OAKLEY
A509: BEST PLAYERS
A510: OAKLEIGH | C510: BRUERTON | F510: PLUMB | I510: GOODMAN | L510: D MILLER | O510: W MILLER | R510: CURTAIN
A511: WERRIBEE | C511: MARTIN | F511: McCARTHY | I511: LEECE | L511: POWER | O511: SQUIRE | R511: LANCASTER
A512: GOALKICKERS
A513: OAKLEIGH | C513: PLUMB 4 | F513: CURTAIN 3 | I513: D MILLER 3 | L513: LEMON 2 | N513: TOCKNELL 2 | Q513: BRUERTON | S513: MATHEY | U513: LEISHMAN
A514: WERRIBEE | C514: LEECE 6 | F514: MARTIN 3 | I514: MASON 2 | K514: BOURKE | M514: KNIGHT | O514: DOUGLAS
A516: WAVERLEY | C516: 7 | D516: 1 | E516: =C516*6+D516 -> 43 | G516: 11 | H516: 7 | I516: =G516*6+H516 -> 73 | K516: 13 | L516: 9 | M516: =K516*6+L516 -> 87 | O516: 17 | P516: 12 | Q516: =O516*6+P516 -> 114 | S516: WILLIAMSTOWN
A517: WILLIAMSTOWN | C517: 6 | D517: 2 | E517: =C517*6+D517 -> 38 | G517: 7 | H517: 8 | I517: =G517*6+H517 -> 50 | K517: 10 | L517: 15 | M517: =K517*6+L517 -> 75 | O517: 15 | P517: 17 | Q517: =O517*6+P517 -> 107 | S517: STABB
A518: BEST PLAYERS
A519: WAVERLEY | C519: STYLES | F519: ALLDAY | I519: POORE | L519: McKAY | O519: TYQUIN | R519: HOLDSWORTH
A520: WILLIAMSTOWN | C520: JOHN | F520: L TALOR | I520: KERR | L520: BEBEND | O520: CROSS | R520: BOXALL
A521: GOALKICKERS
A522: WAVERLEY | C522: McKAY 7 | F522: POORE 6 | I522: COSTELLO 2 | L522: STYLES
A523: WILLIAMSTOWN | C523: GOETZ 4 | F523: TWEEDLY 2 | I523: SHEEHAN 2 | L523: HICKMAN 2 | O523: BRINER | Q523: CROSS | S523: BEBEND | U523: JOHN | W523: L TAYLOR
A525: ROUND 12 | E525: 2ND JULY | J525: WEATHER | S525: PLAYED AT
D526: 1ST QTR | H526: 2ND QTR | L526: 3RD QTR | P526: FINAL | S526: CAMBERWELL
A527: SUNSHINE | C527: 0 | D527: 0 | E527: =C527*6+D527 -> 0 | G527: 0 | H527: 0 | I527: =G527*6+H527 -> 0 | K527: 0 | L527: 0 | M527: =K527*6+L527 -> 0 | O527: 17 | P527: 18 | Q527: =O527*6+P527 -> 120 | S527: UMPIRE | X527: LADDER | AB527: ROUND | AD527: 12
A528: CAMBERWELL | C528: 0 | D528: 0 | E528: =C528*6+D528 -> 0 | G528: 0 | H528: 0 | I528: =G528*6+H528 -> 0 | K528: 0 | L528: 10 | M528: =K528*6+L528 -> 10 | O528: 17 | P528: 11 | Q528: =O528*6+P528 -> 113
A529: BEST PLAYERS | W529: TEAM | X529: W | Y529: L | Z529: D | AA529: FOR | AB529: AGST | AC529: % | AD529: PTS
A530: SUNSHINE
A531: CAMBERWELL | W531: CAMBERWELL | X531: 9 | Y531: 3 | Z531: 0 | AA531: 1617 | AB531: 1062 | AC531: =(AA531*100)/AB531 -> 152.25988700564972 | AD531: =(X531*4)+(Z531*2) -> 36
A532: GOALKICKERS | W532: FRANKSTON | X532: 9 | Y532: 3 | Z532: 0 | AA532: 1703 | AB532: 1263 | AC532: =(AA532*100)/AB532 -> 134.83768804433888 | AD532: =(X532*4)+(Z532*2) -> 36
A533: SUNSHINE | W533: OAKLEIGH | X533: 8 | Y533: 3 | Z533: 1 | AA533: 1534 | AB533: 1367 | AC533: =(AA533*100)/AB533 -> 112.21653255303585 | AD533: =(X533*4)+(Z533*2) -> 34
A534: CAMBERWELL | W534: YARRAVILLE | X534: 8 | Y534: 4 | Z534: 0 | AA534: 1488 | AB534: 1303 | AC534: =(AA534*100)/AB534 -> 114.19800460475825 | AD534: =(X534*4)+(Z534*2) -> 32
A536: NORTHCOTE | C536: 0 | D536: 0 | E536: =C536*6+D536 -> 0 | G536: 0 | H536: 0 | I536: =G536*6+H536 -> 0 | K536: 0 | L536: 0 | M536: =K536*6+L536 -> 0 | O536: 13 | P536: 11 | Q536: =O536*6+P536 -> 89 | S536: NORTHCOTE | W536: WAVERLEY | X536: 7 | Y536: 4 | Z536: 1 | AA536: 1425 | AB536: 1350 | AC536: =(AA536*100)/AB536 -> 105.55555555555556 | AD536: =(X536*4)+(Z536*2) -> 30
A537: FRANKSTON | C537: 0 | D537: 0 | E537: =C537*6+D537 -> 0 | G537: 0 | H537: 0 | I537: =G537*6+H537 -> 0 | K537: 0 | L537: 0 | M537: =K537*6+L537 -> 0 | O537: 10 | P537: 13 | Q537: =O537*6+P537 -> 73 | W537: NORTHCOTE | X537: 7 | Y537: 5 | Z537: 0 | AA537: 1563 | AB537: 1401 | AC537: =(AA537*100)/AB537 -> 111.56316916488223 | AD537: =(X537*4)+(Z537*2) -> 28
A538: BEST PLAYERS | W538: SUNSHINE | X538: 4 | Y538: 7 | Z538: 1 | AA538: 1283 | AB538: 1572 | AC538: =(AA538*100)/AB538 -> 81.61577608142494 | AD538: =(X538*4)+(Z538*2) -> 18
A539: NORTHCOTE | W539: WERRIBEE | X539: 4 | Y539: 8 | Z539: 0 | AA539: 1222 | AB539: 1505 | AC539: =(AA539*100)/AB539 -> 81.196013289036543 | AD539: =(X539*4)+(Z539*2) -> 16
A540: FRANKSTON | W540: WILLIAMSTOWN | X540: 2 | Y540: 10 | Z540: 0 | AA540: 1276 | AB540: 1610 | AC540: =(AA540*100)/AB540 -> 79.254658385093165 | AD540: =(X540*4)+(Z540*2) -> 8
A541: GOALKICKERS | W541: BOX HILL | X541: 0 | Y541: 11 | Z541: 1 | AA541: 1108 | AB541: 1630 | AC541: =(AA541*100)/AB541 -> 67.975460122699388 | AD541: =(X541*4)+(Z541*2) -> 2
A542: NORTHCOTE
A543: FRANKSTON
A545: OAKLEIGH | C545: 0 | D545: 0 | E545: =C545*6+D545 -> 0 | G545: 0 | H545: 0 | I545: =G545*6+H545 -> 0 | K545: 0 | L545: 0 | M545: =K545*6+L545 -> 0 | O545: 12 | P545: 23 | Q545: =O545*6+P545 -> 95 | S545: WILLIAMSTOWN
A546: WILLIAMSTOWN | C546: 0 | D546: 0 | E546: =C546*6+D546 -> 0 | G546: 0 | H546: 0 | I546: =G546*6+H546 -> 0 | K546: 0 | L546: 0 | M546: =K546*6+L546 -> 0 | O546: 8 | P546: 15 | Q546: =O546*6+P546 -> 63
A547: BEST PLAYERS
A548: OAKLEIGH
A549: WILLIAMSTOWN
A550: GOALKICKERS
A551: OAKLEIGH
A552: WILLIAMSTOWN
A554: WERRIBEE | C554: 0 | D554: 0 | E554: =C554*6+D554 -> 0 | G554: 0 | H554: 0 | I554: =G554*6+H554 -> 0 | K554: 0 | L554: 0 | M554: =K554*6+L554 -> 0 | O554: 9 | P554: 15 | Q554: =O554*6+P554 -> 69 | S554: WERRIBEE
A555: BOX HILL | C555: 0 | D555: 0 | E555: =C555*6+D555 -> 0 | G555: 0 | H555: 0 | I555: =G555*6+H555 -> 0 | K555: 0 | L555: 0 | M555: =K555*6+L555 -> 0 | O555: 4 | P555: 11 | Q555: =O555*6+P555 -> 35
A556: BEST PLAYERS
A557: WERRIBEE
A558: BOX HILL
A559: GOALKICKERS
A560: WERRIBEE
A561: BOX HILL
A563: YARRAVILLE | C563: 0 | D563: 0 | E563: =C563*6+D563 -> 0 | G563: 0 | H563: 0 | I563: =G563*6+H563 -> 0 | K563: 0 | L563: 0 | M563: =K563*6+L563 -> 0 | O563: 14 | P563: 14 | Q563: =O563*6+P563 -> 98 | S563: WAVERLEY
A564: WAVERLEY | C564: 0 | D564: 0 | E564: =C564*6+D564 -> 0 | G564: 0 | H564: 0 | I564: =G564*6+H564 -> 0 | K564: 0 | L564: 0 | M564: =K564*6+L564 -> 0 | O564: 12 | P564: 13 | Q564: =O564*6+P564 -> 85
A565: BEST PLAYERS
A566: YARRAVILLE
A567: WAVERLEY
A568: GOALKICKERS
A569: YARRAVILLE
A570: WAVERLEY
A572: ROUND 13 | E572: 9TH JULY | J572: WEATHER | S572: PLAYED AT
D573: 1ST QTR | H573: 2ND QTR | L573: 3RD QTR | P573: FINAL | S573: SUNSHINE
A574: SUNSHINE | C574: 0 | D574: 0 | E574: =C574*6+D574 -> 0 | G574: 0 | H574: 0 | I574: =G574*6+H574 -> 0 | K574: 0 | L574: 0 | M574: =K574*6+L574 -> 0 | O574: 19 | P574: 8 | Q574: =O574*6+P574 -> 122 | S574: UMPIRE | X574: LADDER | AB574: ROUND | AD574: 13
A575: NORTHCOTE | C575: 0 | D575: 0 | E575: =C575*6+D575 -> 0 | G575: 0 | H575: 0 | I575: =G575*6+H575 -> 0 | K575: 0 | L575: 10 | M575: =K575*6+L575 -> 10 | O575: 12 | P575: 17 | Q575: =O575*6+P575 -> 89
A576: BEST PLAYERS | W576: TEAM | X576: W | Y576: L | Z576: D | AA576: FOR | AB576: AGST | AC576: % | AD576: PTS
A577: SUNSHINE
A578: NORTHCOTE | W578: CAMBERWELL | X578: 10 | Y578: 3 | Z578: 0 | AA578: 1692 | AB578: 1133 | AC578: =(AA578*100)/AB578 -> 149.33804060017653 | AD578: =(X578*4)+(Z578*2) -> 40
A579: GOALKICKERS | W579: FRANKSTON | X579: 10 | Y579: 3 | Z579: 0 | AA579: 1908 | AB579: 1367 | AC579: =(AA579*100)/AB579 -> 139.575713240673 | AD579: =(X579*4)+(Z579*2) -> 40
A580: SUNSHINE | W580: OAKLEIGH | X580: 9 | Y580: 3 | Z580: 1 | AA580: 1688 | AB580: 1455 | AC580: =(AA580*100)/AB580 -> 116.01374570446735 | AD580: =(X580*4)+(Z580*2) -> 38
A581: NORTHCOTE | W581: YARRAVILLE | X581: 8 | Y581: 5 | Z581: 0 | AA581: 1559 | AB581: 1368 | AC581: =(AA581*100)/AB581 -> 113.96198830409357 | AD581: =(X581*4)+(Z581*2) -> 32
A583: FRANKSTON | C583: 0 | D583: 0 | E583: =C583*6+D583 -> 0 | G583: 0 | H583: 0 | I583: =G583*6+H583 -> 0 | K583: 0 | L583: 0 | M583: =K583*6+L583 -> 0 | O583: 31 | P583: 19 | Q583: =O583*6+P583 -> 205 | S583: FRANKSTON | W583: WAVERLEY | X583: 7 | Y583: 5 | Z583: 1 | AA583: 1513 | AB583: 1504 | AC583: =(AA583*100)/AB583 -> 100.59840425531915 | AD583: =(X583*4)+(Z583*2) -> 30
A584: WERRIBEE | C584: 0 | D584: 0 | E584: =C584*6+D584 -> 0 | G584: 0 | H584: 0 | I584: =G584*6+H584 -> 0 | K584: 0 | L584: 0 | M584: =K584*6+L584 -> 0 | O584: 15 | P584: 14 | Q584: =O584*6+P584 -> 104 | W584: NORTHCOTE | X584: 7 | Y584: 6 | Z584: 0 | AA584: 1652 | AB584: 1523 | AC584: =(AA584*100)/AB584 -> 108.47012475377544 | AD584: =(X584*4)+(Z584*2) -> 28
A585: BEST PLAYERS | W585: SUNSHINE | X585: 5 | Y585: 7 | Z585: 1 | AA585: 1405 | AB585: 1661 | AC585: =(AA585*100)/AB585 -> 84.587597832630948 | AD585: =(X585*4)+(Z585*2) -> 22
A586: FRANKSTON | W586: WERRIBEE | X586: 4 | Y586: 9 | Z586: 0 | AA586: 1326 | AB586: 1710 | AC586: =(AA586*100)/AB586 -> 77.543859649122808 | AD586: =(X586*4)+(Z586*2) -> 16
A587: WERRIBEE | W587: WILLIAMSTOWN | X587: 2 | Y587: 11 | Z587: 0 | AA587: 1395 | AB587: 1776 | AC587: =(AA587*100)/AB587 -> 78.547297297297291 | AD587: =(X587*4)+(Z587*2) -> 8
A588: GOALKICKERS | W588: BOX HILL | X588: 1 | Y588: 11 | Z588: 1 | AA588: 1274 | AB588: 1749 | AC588: =(AA588*100)/AB588 -> 72.841623785020005 | AD588: =(X588*4)+(Z588*2) -> 6
A589: FRANKSTON
A590: WERRIBEE
A592: BOX HILL | C592: 0 | D592: 0 | E592: =C592*6+D592 -> 0 | G592: 0 | H592: 0 | I592: =G592*6+H592 -> 0 | K592: 0 | L592: 0 | M592: =K592*6+L592 -> 0 | O592: 25 | P592: 16 | Q592: =O592*6+P592 -> 166 | S592: BOX HILL
A593: WILLIAMSTOWN | C593: 0 | D593: 0 | E593: =C593*6+D593 -> 0 | G593: 0 | H593: 0 | I593: =G593*6+H593 -> 0 | K593: 0 | L593: 0 | M593: =K593*6+L593 -> 0 | O593: 17 | P593: 17 | Q593: =O593*6+P593 -> 119
A594: BEST PLAYERS
A595: BOX HILL
A596: WILLIAMSTOWN
A597: GOALKICKERS
A598: BOX HILL
A599: WILLIAMSTOWN
A601: OAKLEIGH | C601: 0 | D601: 0 | E601: =C601*6+D601 -> 0 | G601: 0 | H601: 0 | I601: =G601*6+H601 -> 0 | K601: 0 | L601: 0 | M601: =K601*6+L601 -> 0 | O601: 23 | P601: 16 | Q601: =O601*6+P601 -> 154 | S601: OAKLEIGH
A602: WAVERLEY | C602: 0 | D602: 0 | E602: =C602*6+D602 -> 0 | G602: 0 | H602: 0 | I602: =G602*6+H602 -> 0 | K602: 0 | L602: 0 | M602: =K602*6+L602 -> 0 | O602: 13 | P602: 10 | Q602: =O602*6+P602 -> 88
A603: BEST PLAYERS
A604: OAKLEIGH
A605: WAVERLEY
A606: GOALKICKERS
A607: OAKLEIGH
A608: WAVERLEY
A610: CAMBERWELL | C610: 0 | D610: 0 | E610: =C610*6+D610 -> 0 | G610: 0 | H610: 0 | I610: =G610*6+H610 -> 0 | K610: 0 | L610: 0 | M610: =K610*6+L610 -> 0 | O610: 10 | P610: 15 | Q610: =O610*6+P610 -> 75 | S610: YARRAVILLE
A611: YARRAVILLE | C611: 0 | D611: 0 | E611: =C611*6+D611 -> 0 | G611: 0 | H611: 0 | I611: =G611*6+H611 -> 0 | K611: 0 | L611: 0 | M611: =K611*6+L611 -> 0 | O611: 10 | P611: 11 | Q611: =O611*6+P611 -> 71
A612: BEST PLAYERS
A613: CAMBERWELL
A614: YARRAVILLE
A615: GOALKICKERS
A616: CAMBERWELL
A617: YARRAVILLE
A619: ROUND 14 | E619: 16TH JULY | J619: WEATHER | S619: PLAYED AT
D620: 1ST QTR | H620: 2ND QTR | L620: 3RD QTR | P620: FINAL | S620: WERRIBEE
A621: WERRIBEE | C621: 2 | D621: 5 | E621: =C621*6+D621 -> 17 | G621: 5 | H621: 10 | I621: =G621*6+H621 -> 40 | K621: 9 | L621: 19 | M621: =K621*6+L621 -> 73 | O621: 15 | P621: 23 | Q621: =O621*6+P621 -> 113 | S621: UMPIRE | X621: LADDER | AB621: ROUND | AD621: 14
A622: SUNSHINE | C622: 3 | D622: 4 | E622: =C622*6+D622 -> 22 | G622: 10 | H622: 9 | I622: =G622*6+H622 -> 69 | K622: 11 | L622: 10 | M622: =K622*6+L622 -> 76 | O622: 15 | P622: 14 | Q622: =O622*6+P622 -> 104 | S622: McBAIN
A623: BEST PLAYERS | W623: TEAM | X623: W | Y623: L | Z623: D | AA623: FOR | AB623: AGST | AC623: % | AD623: PTS
A624: WERRIBEE | C624: WHITEHEAD | F624: G BELLIN | I624: LEECE | L624: G WRIGHT | O624: SQUIRE | R624: P WILSON
A625: SUNSHINE | C625: JONES | F625: RADZIMINSKI | I625: WRIGHT | L625: BAIRD | O625: BENSON | R625: BLAKE | W625: CAMBERWELL | X625: 11 | Y625: 3 | Z625: 0 | AA625: 1872 | AB625: 1192 | AC625: =(AA625*100)/AB625 -> 157.04697986577182 | AD625: =(X625*4)+(Z625*2) -> 44
A626: GOALKICKERS | W626: FRANKSTON | X626: 11 | Y626: 3 | Z626: 0 | AA626: 2015 | AB626: 1451 | AC626: =(AA626*100)/AB626 -> 138.8697450034459 | AD626: =(X626*4)+(Z626*2) -> 44
A627: WERRIBEE | C627: LEECE 7 | F627: G BELLIN 6 | I627: BOURKE | L627: HUGHES | W627: OAKLEIGH | X627: 10 | Y627: 3 | Z627: 1 | AA627: 1838 | AB627: 1505 | AC627: =(AA627*100)/AB627 -> 122.12624584717608 | AD627: =(X627*4)+(Z627*2) -> 42
A628: SUNSHINE | C628: SAID 6 | F628: BENSON 2 | I628: MCDONALD 2 | L628: SEARLE 2 | N628: RADZIMINSKI | Q628: MANDICS | S628: JONES | W628: YARRAVILLE | X628: 9 | Y628: 5 | Z628: 0 | AA628: 1669 | AB628: 1480 | AC628: =(AA628*100)/AB628 -> 112.77027027027027 | AD628: =(X628*4)+(Z628*2) -> 36
A630: FRANKSTON | C630: 2 | D630: 5 | E630: =C630*6+D630 -> 17 | G630: 5 | H630: 13 | I630: =G630*6+H630 -> 43 | K630: 9 | L630: 17 | M630: =K630*6+L630 -> 71 | O630: 14 | P630: 23 | Q630: =O630*6+P630 -> 107 | S630: WILLIAMSTOWN | W630: WAVERLEY | X630: 7 | Y630: 6 | Z630: 1 | AA630: 1572 | AB630: 1684 | AC630: =(AA630*100)/AB630 -> 93.349168646080756 | AD630: =(X630*4)+(Z630*2) -> 30
A631: WILLIAMSTOWN | C631: 4 | D631: 4 | E631: =C631*6+D631 -> 28 | G631: 6 | H631: 6 | I631: =G631*6+H631 -> 42 | K631: 10 | L631: 10 | M631: =K631*6+L631 -> 70 | O631: 12 | P631: 12 | Q631: =O631*6+P631 -> 84 | S631: STEERE | W631: NORTHCOTE | X631: 7 | Y631: 7 | Z631: 0 | AA631: 1754 | AB631: 1633 | AC631: =(AA631*100)/AB631 -> 107.40967544396815 | AD631: =(X631*4)+(Z631*2) -> 28
A632: BEST PLAYERS | W632: SUNSHINE | X632: 5 | Y632: 8 | Z632: 1 | AA632: 1509 | AB632: 1774 | AC632: =(AA632*100)/AB632 -> 85.062006764374289 | AD632: =(X632*4)+(Z632*2) -> 22
A633: FRANKSTON | C633: BOYD | F633: KENNEDY | I633: MACE | L633: ORCHARD | O633: ROBERTS | R633: BENNETT | W633: WERRIBEE | X633: 5 | Y633: 9 | Z633: 0 | AA633: 1439 | AB633: 1814 | AC633: =(AA633*100)/AB633 -> 79.327453142227128 | AD633: =(X633*4)+(Z633*2) -> 20
A634: WILLIAMSTOWN | C634: BEBEND | F634: BURGESS | I634: BOXALL | L634: L TAYLOR | O634: FANNING | R634: COURTOT | W634: WILLIAMSTOWN | X634: 2 | Y634: 12 | Z634: 0 | AA634: 1479 | AB634: 1883 | AC634: =(AA634*100)/AB634 -> 78.544875199150297 | AD634: =(X634*4)+(Z634*2) -> 8
A635: GOALKICKERS | W635: BOX HILL | X635: 1 | Y635: 12 | Z635: 1 | AA635: 1324 | AB635: 1899 | AC635: =(AA635*100)/AB635 -> 69.720905739863085 | AD635: =(X635*4)+(Z635*2) -> 6
A636: FRANKSTON | C636: ROBERTS 4 | F636: SAMPSON 3 | I636: ORCHARD 3 | L636: KENNEDY 2 | O636: HUNTER | Q636: LOCCO
A637: WILLIAMSTOWN | C637: BOXALL 5 | F637: JOHN 3 | H637: CROSS 2 | J637: L TAYLOR | M637: TWEEDLY
A639: OAKLEIGH | C639: 3 | D639: 6 | E639: =C639*6+D639 -> 24 | G639: 10 | H639: 10 | I639: =G639*6+H639 -> 70 | K639: 14 | L639: 11 | M639: =K639*6+L639 -> 95 | O639: 22 | P639: 18 | Q639: =O639*6+P639 -> 150 | S639: OAKLEIGH
A640: BOX HILL | C640: 1 | D640: 0 | E640: =C640*6+D640 -> 6 | G640: 3 | H640: 1 | I640: =G640*6+H640 -> 19 | K640: 5 | L640: 8 | M640: =K640*6+L640 -> 38 | O640: 7 | P640: 8 | Q640: =O640*6+P640 -> 50 | S640: CASEY
A641: BEST PLAYERS
A642: OAKLEIGH | C642: WENN | F642: GOODMAN | I642: BRUERTON | L642: FRYER | O642: HARTLEY | R642: SPLATT
A643: BOX HILL | C643: CONNOLLY | F643: DICKENSON | I643: JOFFE | L643: LAWTHER | O643: WITHERS | R643: BATES
A644: GOALKICKERS
A645: OAKLEIGH | C645: GOODMAN 4 | F645: McDONALD 4 | I645: WENN 3 | K645: D MILLER 3 | N645: THOMAS 2 | P645: PAGNOCCOLO 2 | S645: LEISHMAN 2 | W645: BRUERTON | X645: SMART
A646: BOX HILL | C646: McGETTIGAN 2 | F646: ARTHUR | H646: CONNOLLY | J646: WESTMORELAND | N646: TAYLOR | P646: JOFFE
A648: YARRAVILLE | C648: 1 | D648: 4 | E648: =C648*6+D648 -> 10 | G648: 7 | H648: 8 | I648: =G648*6+H648 -> 50 | K648: 10 | L648: 11 | M648: =K648*6+L648 -> 71 | O648: 16 | P648: 14 | Q648: =O648*6+P648 -> 110 | S648: NORTHCOTE
A649: NORTHCOTE | C649: 3 | D649: 4 | E649: =C649*6+D649 -> 22 | G649: 7 | H649: 5 | I649: =G649*6+H649 -> 47 | K649: 9 | L649: 13 | M649: =K649*6+L649 -> 67 | O649: 14 | P649: 18 | Q649: =O649*6+P649 -> 102 | S649: SNOOKS
A650: BEST PLAYERS
A651: YARRAVILLE | C651: SAIT | F651: BROWN | I651: THORPE | L651: SIMMONS | O651: WELLINGTON | R651: M FOTHERINGHAM
A652: NORTHCOTE | C652: DOBSON | F652: McARDLE | I652: McGREGOR | L652: ROBERTS | O652: M RYAN | R652: McINTYRE
A653: GOALKICKERS
A654: YARRAVILLE | C654: M FOTHERINGHAM 8 | G654: LEE 4 | I654: THORPE 2 | K654: WELLINGTON | N654: BROWN
A655: NORTHCOTE | C655: G RYAN 5 | F655: G HOLLAND 2 | I655: MITCHELL 2 | L655: OLIVERI 2 | N655: M RYAN 2 | Q655: DOBSON
A657: CAMBERWELL | C657: 5 | D657: 3 | E657: =C657*6+D657 -> 33 | G657: 11 | H657: 3 | I657: =G657*6+H657 -> 69 | K657: 12 | L657: 9 | M657: =K657*6+L657 -> 81 | O657: 28 | P657: 12 | Q657: =O657*6+P657 -> 180 | S657: CAMBERWELL
A658: WAVERLEY | C658: 2 | D658: 1 | E658: =C658*6+D658 -> 13 | G658: 6 | H658: 9 | I658: =G658*6+H658 -> 45 | K658: 6 | L658: 10 | M658: =K658*6+L658 -> 46 | O658: 7 | P658: 17 | Q658: =O658*6+P658 -> 59 | S658: HEDGER
A659: BEST PLAYERS
A660: CAMBERWELL | C660: OLIVER | F660: NEILSON | I660: HIRST | L660: JUDD | O660: B SMITH | R660: SPITHILL
A661: WAVERLEY | C661: STLES | F661: K McDONALD | I661: HUNTER | L661: GILL | O661: ALLDAY | R661: TYQUIN
A662: GOALKICKERS
A663: CAMBERWELL | C663: B SMITH 8 | F663: SIMPSON 5 | H663: NEILSON 4 | J663: HIRST 4 | L663: HARROP 3 | N663: CHAMBERLAIN 2 | R663: McCARTHY | T663: ALEXEEF
A664: WAVERLEY | C664: HUNTER 2 | F664: CRAWFORD | I664: JAMIESON | K664: TYQUIN | N664: RAWLINGS | Q664: McKAY
A666: ROUND 15 | E666: 23RD JULY | J666: WEATHER | S666: PLAYED AT
D667: 1ST QTR | H667: 2ND QTR | L667: 3RD QTR | P667: FINAL | S667: CAMBERWELL
A668: CAMBERWELL | C668: 0 | D668: 0 | E668: =C668*6+D668 -> 0 | G668: 0 | H668: 0 | I668: =G668*6+H668 -> 0 | K668: 0 | L668: 0 | M668: =K668*6+L668 -> 0 | O668: 12 | P668: 15 | Q668: =O668*6+P668 -> 87 | S668: UMPIRE | X668: LADDER | AB668: ROUND | AD668: 15
A669: NORTHCOTE | C669: 0 | D669: 0 | E669: =C669*6+D669 -> 0 | G669: 0 | H669: 0 | I669: =G669*6+H669 -> 0 | K669: 0 | L669: 0 | M669: =K669*6+L669 -> 0 | O669: 6 | P669: 14 | Q669: =O669*6+P669 -> 50
A670: BEST PLAYERS | W670: TEAM | X670: W | Y670: L | Z670: D | AA670: FOR | AB670: AGST | AC670: % | AD670: PTS
A671: CAMBERWELL
A672: NORTHCOTE | W672: CAMBERWELL | X672: 12 | Y672: 3 | Z672: 0 | AA672: 1959 | AB672: 1242 | AC672: =(AA672*100)/AB672 -> 157.72946859903382 | AD672: =(X672*4)+(Z672*2) -> 48
A673: GOALKICKERS | W673: FRANKSTON | X673: 12 | Y673: 3 | Z673: 0 | AA673: 2158 | AB673: 1531 | AC673: =(AA673*100)/AB673 -> 140.95362508164598 | AD673: =(X673*4)+(Z673*2) -> 48
A674: CAMBERWELL | W674: OAKLEIGH | X674: 10 | Y674: 4 | Z674: 1 | AA674: 1918 | AB674: 1648 | AC674: =(AA674*100)/AB674 -> 116.38349514563107 | AD674: =(X674*4)+(Z674*2) -> 42
A675: NORTHCOTE | W675: YARRAVILLE | X675: 10 | Y675: 5 | Z675: 0 | AA675: 1779 | AB675: 1576 | AC675: =(AA675*100)/AB675 -> 112.88071065989848 | AD675: =(X675*4)+(Z675*2) -> 40
A677: SUNSHINE | C677: 0 | D677: 0 | E677: =C677*6+D677 -> 0 | G677: 0 | H677: 0 | I677: =G677*6+H677 -> 0 | K677: 0 | L677: 0 | M677: =K677*6+L677 -> 0 | O677: 21 | P677: 12 | Q677: =O677*6+P677 -> 138 | S677: SUNSHINE | W677: WAVERLEY | X677: 8 | Y677: 6 | Z677: 1 | AA677: 1659 | AB677: 1763 | AC677: =(AA677*100)/AB677 -> 94.100964265456611 | AD677: =(X677*4)+(Z677*2) -> 34
A678: WILLIAMSTOWN | C678: 0 | D678: 0 | E678: =C678*6+D678 -> 0 | G678: 0 | H678: 0 | I678: =G678*6+H678 -> 0 | K678: 0 | L678: 0 | M678: =K678*6+L678 -> 0 | O678: 11 | P678: 18 | Q678: =O678*6+P678 -> 84 | W678: NORTHCOTE | X678: 7 | Y678: 8 | Z678: 0 | AA678: 1804 | AB678: 1720 | AC678: =(AA678*100)/AB678 -> 104.88372093023256 | AD678: =(X678*4)+(Z678*2) -> 28
A679: BEST PLAYERS | W679: SUNSHINE | X679: 6 | Y679: 8 | Z679: 1 | AA679: 1647 | AB679: 1858 | AC679: =(AA679*100)/AB679 -> 88.64370290635091 | AD679: =(X679*4)+(Z679*2) -> 26
A680: SUNSHINE | W680: WERRIBEE | X680: 5 | Y680: 10 | Z680: 0 | AA680: 1535 | AB680: 1924 | AC680: =(AA680*100)/AB680 -> 79.781704781704775 | AD680: =(X680*4)+(Z680*2) -> 20
A681: WILLIAMSTOWN | W681: WILLIAMSTOWN | X681: 2 | Y681: 13 | Z681: 0 | AA681: 1563 | AB681: 2021 | AC681: =(AA681*100)/AB681 -> 77.337951509153882 | AD681: =(X681*4)+(Z681*2) -> 8
A682: GOALKICKERS | W682: BOX HILL | X682: 1 | Y682: 13 | Z682: 1 | AA682: 1403 | AB682: 1986 | AC682: =(AA682*100)/AB682 -> 70.644511581067476 | AD682: =(X682*4)+(Z682*2) -> 6
A683: SUNSHINE
A684: WILLIAMSTOWN
A686: FRANKSTON | C686: 0 | D686: 0 | E686: =C686*6+D686 -> 0 | G686: 0 | H686: 0 | I686: =G686*6+H686 -> 0 | K686: 0 | L686: 0 | M686: =K686*6+L686 -> 0 | O686: 20 | P686: 23 | Q686: =O686*6+P686 -> 143 | S686: FRANKSTON
A687: OAKLEIGH | C687: 0 | D687: 0 | E687: =C687*6+D687 -> 0 | G687: 0 | H687: 0 | I687: =G687*6+H687 -> 0 | K687: 0 | L687: 0 | M687: =K687*6+L687 -> 0 | O687: 11 | P687: 14 | Q687: =O687*6+P687 -> 80
A688: BEST PLAYERS
A689: FRANKSTON
A690: OAKLEIGH
A691: GOALKICKERS
A692: FRANKSTON
A693: OAKLEIGH
A695: WAVERLEY | C695: 0 | D695: 0 | E695: =C695*6+D695 -> 0 | G695: 0 | H695: 0 | I695: =G695*6+H695 -> 0 | K695: 0 | L695: 0 | M695: =K695*6+L695 -> 0 | O695: 13 | P695: 9 | Q695: =O695*6+P695 -> 87 | S695: WAVERLEY
A696: BOX HILL | C696: 0 | D696: 0 | E696: =C696*6+D696 -> 0 | G696: 0 | H696: 0 | I696: =G696*6+H696 -> 0 | K696: 0 | L696: 0 | M696: =K696*6+L696 -> 0 | O696: 11 | P696: 13 | Q696: =O696*6+P696 -> 79
A697: BEST PLAYERS
A698: WAVERLEY
A699: BOX HILL
A700: GOALKICKERS
A701: WAVERLEY
A702: BOX HILL
A704: YARRAVILLE | C704: 0 | D704: 0 | E704: =C704*6+D704 -> 0 | G704: 0 | H704: 0 | I704: =G704*6+H704 -> 0 | K704: 0 | L704: 0 | M704: =K704*6+L704 -> 0 | O704: 16 | P704: 14 | Q704: =O704*6+P704 -> 110 | S704: YARRAVILLE
A705: WERRIBEE | C705: 0 | D705: 0 | E705: =C705*6+D705 -> 0 | G705: 0 | H705: 0 | I705: =G705*6+H705 -> 0 | K705: 0 | L705: 0 | M705: =K705*6+L705 -> 0 | O705: 14 | P705: 12 | Q705: =O705*6+P705 -> 96
A706: BEST PLAYERS
A707: YARRAVILLE
A708: WERRIBEE
A709: GOALKICKERS
A710: YARRAVILLE
A711: WERRIBEE
A713: ROUND 16 | E713: 30TH JULY | J713: WEATHER | S713: PLAYED AT
D714: 1ST QTR | H714: 2ND QTR | L714: 3RD QTR | P714: FINAL | S714: OAKLEIGH
A715: OAKLEIGH | C715: 3 | D715: 6 | E715: =C715*6+D715 -> 24 | G715: 6 | H715: 8 | I715: =G715*6+H715 -> 44 | K715: 13 | L715: 14 | M715: =K715*6+L715 -> 92 | O715: 19 | P715: 19 | Q715: =O715*6+P715 -> 133 | S715: UMPIRE | X715: LADDER | AB715: ROUND | AD715: 16
A716: SUNSHINE | C716: 5 | D716: 1 | E716: =C716*6+D716 -> 31 | G716: 7 | H716: 5 | I716: =G716*6+H716 -> 47 | K716: 10 | L716: 8 | M716: =K716*6+L716 -> 68 | O716: 11 | P716: 12 | Q716: =O716*6+P716 -> 78 | S716: TORNEY
A717: BEST PLAYERS | W717: TEAM | X717: W | Y717: L | Z717: D | AA717: FOR | AB717: AGST | AC717: % | AD717: PTS
A718: OAKLEIGH | C718: LEISHMAN | F718: CURTAIN | I718: PAGNOCCOLO | L718: FRYER | N718: GOODMAN | Q718: EVANS
A719: SUNSHINE | C719: MANDICS | F719: JONES | I719: McDONALD | W719: CAMBERWELL | X719: 13 | Y719: 3 | Z719: 0 | AA719: 2094 | AB719: 1355 | AC719: =(AA719*100)/AB719 -> 154.53874538745387 | AD719: =(X719*4)+(Z719*2) -> 52
A720: GOALKICKERS | P720: FRYER | R720: McMAHON | W720: FRANKSTON | X720: 13 | Y720: 3 | Z720: 0 | AA720: 2345 | AB720: 1623 | AC720: =(AA720*100)/AB720 -> 144.48552064078865 | AD720: =(X720*4)+(Z720*2) -> 52
A721: OAKLEIGH | C721: BRUERTON 3 | F721: PAGNOCCOLO 3 | I721: GOODMAN 3 | K721: HAY 2 | M721: FRENCH 2 | O721: THOMAS | Q721: EDWARDS | S721: D MILLER | W721: OAKLEIGH | X721: 11 | Y721: 4 | Z721: 1 | AA721: 2051 | AB721: 1726 | AC721: =(AA721*100)/AB721 -> 118.82966396292005 | AD721: =(X721*4)+(Z721*2) -> 46
A722: SUNSHINE | C722: MANDICS 2 | F722: JONES 2 | H722: McDONALD 2 | K722: REDENBACH | N722: SIMPSON | P722: RADZIMINSKI | S722: WRIGHT | W722: YARRAVILLE | X722: 10 | Y722: 6 | Z722: 0 | AA722: 1881 | AB722: 1736 | AC722: =(AA722*100)/AB722 -> 108.35253456221199 | AD722: =(X722*4)+(Z722*2) -> 40
M723: A SCHROEDER
A724: FRANKSTON | C724: 9 | D724: 1 | E724: =C724*6+D724 -> 55 | G724: 18 | H724: 5 | I724: =G724*6+H724 -> 113 | K724: 22 | L724: 8 | M724: =K724*6+L724 -> 140 | O724: 29 | P724: 13 | Q724: =O724*6+P724 -> 187 | S724: BOX HILL | W724: WAVERLEY | X724: 8 | Y724: 7 | Z724: 1 | AA724: 1732 | AB724: 1850 | AC724: =(AA724*100)/AB724 -> 93.621621621621628 | AD724: =(X724*4)+(Z724*2) -> 34
A725: BOX HILL | C725: 4 | D725: 6 | E725: =C725*6+D725 -> 30 | G725: 5 | H725: 8 | I725: =G725*6+H725 -> 38 | K725: 10 | L725: 13 | M725: =K725*6+L725 -> 73 | O725: 13 | P725: 14 | Q725: =O725*6+P725 -> 92 | S725: GROOM | W725: NORTHCOTE | X725: 8 | Y725: 8 | Z725: 0 | AA725: 1891 | AB725: 1793 | AC725: =(AA725*100)/AB725 -> 105.46569994422755 | AD725: =(X725*4)+(Z725*2) -> 32
A726: BEST PLAYERS | W726: SUNSHINE | X726: 6 | Y726: 9 | Z726: 1 | AA726: 1725 | AB726: 1991 | AC726: =(AA726*100)/AB726 -> 86.639879457559019 | AD726: =(X726*4)+(Z726*2) -> 26
A727: FRANKSTON | C727: SAMPSON | F727: ORCHARD | I727: KENNEDY | L727: JONES | O727: MACE | R727: BOYD | W727: WERRIBEE | X727: 5 | Y727: 11 | Z727: 0 | AA727: 1648 | AB727: 2059 | AC727: =(AA727*100)/AB727 -> 80.038853812530348 | AD727: =(X727*4)+(Z727*2) -> 20
A728: BOX HILL | C728: GAUL | F728: WESTMORELAND | J728: JOFFE | L728: KIKER | O728: HALE | R728: DICKENSON | W728: WILLIAMSTOWN | X728: 3 | Y728: 13 | Z728: 0 | AA728: 1723 | AB728: 2123 | AC728: =(AA728*100)/AB728 -> 81.158737635421573 | AD728: =(X728*4)+(Z728*2) -> 12
A729: GOALKICKERS | L729: DANKS | N729: ROBERTS | Q729: TICKELL | W729: BOX HILL | X729: 1 | Y729: 14 | Z729: 1 | AA729: 1495 | AB729: 2173 | AC729: =(AA729*100)/AB729 -> 68.798895536125173 | AD729: =(X729*4)+(Z729*2) -> 6
A730: FRANKSTON | C730: HUNTER 5 | F730: KENNEDY 5 | H730: STAPLETON 4 | K730: MACE 3 | M730: JONES 3 | O730: RIDSDALE 2 | R730: RYAN 2 | T730: SAMPSON 2
A731: BOX HILL | C731: JOFFE 5 | F731: RALPH 3 | H731: DICKENSON 2 | L731: KIKER | N731: HARPER | P731: HALE
A733: WILLIAMSTOWN | C733: 2 | D733: 4 | E733: =C733*6+D733 -> 16 | G733: 10 | H733: 10 | I733: =G733*6+H733 -> 70 | K733: 16 | L733: 15 | M733: =K733*6+L733 -> 111 | O733: 24 | P733: 16 | Q733: =O733*6+P733 -> 160 | S733: WILLIAMSTOWN
A734: YARRAVILLE | C734: 6 | D734: 4 | E734: =C734*6+D734 -> 40 | G734: 10 | H734: 5 | I734: =G734*6+H734 -> 65 | K734: 13 | L734: 10 | M734: =K734*6+L734 -> 88 | O734: 15 | P734: 12 | Q734: =O734*6+P734 -> 102 | S734: STABB
A735: BEST PLAYERS
A736: WILLIAMSTOWN | C736: FANNING | F736: BURGESS | I736: BROWN | L736: MILDENHALL | O736: CROSS | R736: JOHN
A737: YARRAVILLE | C737: SIMMONS | F737: WELLINGTON | I737: P FOTHERINGHAM | M737: LEE | O737: GRACO | R737: SAIT
A738: GOALKICKERS
A739: WILLIAMSTOWN | C739: BOXALL 6 | F739: CROSS 4 | H739: BURGESS 4 | J739: JOHN 3 | L739: PATON 2 | N739: L TAYLOR 2 | Q739: FANNING | S739: LOWE | U739: HICKMAN
A740: YARRAVILLE | C740: SIMMONS 4 | F740: SAIT 3 | H740: K JONES 3 | J740: WELLINGTON 2 | M740: THORPE | O740: KELLY | Q740: LOWE
A742: CAMBERWELL | C742: 6 | D742: 4 | E742: =C742*6+D742 -> 40 | G742: 11 | H742: 9 | I742: =G742*6+H742 -> 75 | K742: 16 | L742: 17 | M742: =K742*6+L742 -> 113 | O742: 20 | P742: 15 | Q742: =O742*6+P742 -> 135 | S742: WERRIBEE
A743: WERRIBEE | C743: 3 | D743: 3 | E743: =C743*6+D743 -> 21 | G743: 3 | H743: 10 | I743: =G743*6+H743 -> 28 | K743: 10 | L743: 12 | M743: =K743*6+L743 -> 72 | O743: 16 | P743: 17 | Q743: =O743*6+P743 -> 113 | S743: OAKLEY
A744: BEST PLAYERS
A745: CAMBERWELL | C745: HIRST | F745: McNAMARA | I745: BARR | L745: HARROP | O745: WRIGHT | R745: SIMPSON
A746: WERRIBEE | C746: JACK | F746: POWER | I746: LEECE | L746: LINEHAN | O746: DOUGLAS | R746: BOURKE
A747: GOALKICKERS
A748: CAMBERWELL | C748: HARROP 5 | F748: ALEXEEF 3 | H748: HIRST 3 | J748: SIMPSON 2 | L748: NEILSON 2 | N748: HOOK 2 | P748: COWLEY 2 | S748: HAMMOND
A749: WERRIBEE | C749: LEECE 5 | E749: LINEHAN 4 | H749: DOUGLAS 3 | K749: G BELLIN 2 | M749: WISE 2
A751: NORTHCOTE | C751: 0 | D751: 10 | E751: =C751*6+D751 -> 10 | G751: 2 | H751: 14 | I751: =G751*6+H751 -> 26 | K751: 7 | L751: 19 | M751: =K751*6+L751 -> 61 | O751: 11 | P751: 21 | Q751: =O751*6+P751 -> 87 | S751: NORTHCOTE
A752: WAVERLEY | C752: 3 | D752: 2 | E752: =C752*6+D752 -> 20 | G752: 8 | H752: 3 | I752: =G752*6+H752 -> 51 | K752: 10 | L752: 4 | M752: =K752*6+L752 -> 64 | O752: 11 | P752: 7 | Q752: =O752*6+P752 -> 73 | S752: CASEY
A753: BEST PLAYERS
A754: NORTHCOTE | C754: McCONCHIE | F754: DOBSON | I754: McGREGOR | L754: M RYAN | O754: McINTYRE | R754: HAYSOM
A755: WAVERLEY | C755: STYLES | F755: TYQUIN | I755: W McDONALD | L755: HANKINSON | O755: KELAART | R755: ALLDAY
A756: GOALKICKERS
A757: NORTHCOTE | C757: McGRATH 4 | F757: G RYAN 2 | I757: BRIGHAM 2 | L757: M RYAN | N757: SMITH | P757: HAYSOM
A758: WAVERLEY | C758: McKAY 3 | F758: HANKINSON 3 | I758: TYQUIN | K758: SEEHUSEN | N758: JAMIESON | P758: BARNES | R758: COSTELLO
A760: ROUND 17 | E760: 6TH AUGUST | J760: WEATHER | S760: PLAYED AT
D761: 1ST QTR | H761: 2ND QTR | L761: 3RD QTR | P761: FINAL | S761: CAMBERWELL
A762: CAMBERWELL | C762: 0 | D762: 0 | E762: =C762*6+D762 -> 0 | G762: 0 | H762: 0 | I762: =G762*6+H762 -> 0 | K762: 0 | L762: 0 | M762: =K762*6+L762 -> 0 | O762: 22 | P762: 28 | Q762: =O762*6+P762 -> 160 | S762: UMPIRE | X762: LADDER | AB762: ROUND | AD762: 17
A763: WILLIAMSTOWN | C763: 0 | D763: 0 | E763: =C763*6+D763 -> 0 | G763: 0 | H763: 0 | I763: =G763*6+H763 -> 0 | K763: 0 | L763: 10 | M763: =K763*6+L763 -> 10 | O763: 8 | P763: 3 | Q763: =O763*6+P763 -> 51
A764: BEST PLAYERS | W764: TEAM | X764: W | Y764: L | Z764: D | AA764: FOR | AB764: AGST | AC764: % | AD764: PTS
A765: CAMBERWELL
A766: WILLIAMSTOWN | W766: CAMBERWELL | X766: 14 | Y766: 3 | Z766: 0 | AA766: 2254 | AB766: 1406 | AC766: =(AA766*100)/AB766 -> 160.31294452347083 | AD766: =(X766*4)+(Z766*2) -> 56
A767: GOALKICKERS | W767: FRANKSTON | X767: 14 | Y767: 3 | Z767: 0 | AA767: 2487 | AB767: 1700 | AC767: =(AA767*100)/AB767 -> 146.29411764705881 | AD767: =(X767*4)+(Z767*2) -> 56
A768: CAMBERWELL | W768: OAKLEIGH | X768: 11 | Y768: 5 | Z768: 1 | AA768: 2156 | AB768: 1845 | AC768: =(AA768*100)/AB768 -> 116.85636856368563 | AD768: =(X768*4)+(Z768*2) -> 46
A769: WILLIAMSTOWN | W769: YARRAVILLE | X769: 11 | Y769: 6 | Z769: 0 | AA769: 2000 | AB769: 1841 | AC769: =(AA769*100)/AB769 -> 108.63661053775122 | AD769: =(X769*4)+(Z769*2) -> 44
A771: YARRAVILLE | C771: 0 | D771: 0 | E771: =C771*6+D771 -> 0 | G771: 0 | H771: 0 | I771: =G771*6+H771 -> 0 | K771: 0 | L771: 0 | M771: =K771*6+L771 -> 0 | O771: 16 | P771: 23 | Q771: =O771*6+P771 -> 119 | S771: YARRAVILLE | W771: NORTHCOTE | X771: 9 | Y771: 8 | Z771: 0 | AA771: 2039 | AB771: 1876 | AC771: =(AA771*100)/AB771 -> 108.68869936034115 | AD771: =(X771*4)+(Z771*2) -> 36
A772: OAKLEIGH | C772: 0 | D772: 0 | E772: =C772*6+D772 -> 0 | G772: 0 | H772: 0 | I772: =G772*6+H772 -> 0 | K772: 0 | L772: 0 | M772: =K772*6+L772 -> 0 | O772: 16 | P772: 9 | Q772: =O772*6+P772 -> 105 | W772: WAVERLEY | X772: 8 | Y772: 8 | Z772: 1 | AA772: 1809 | AB772: 1992 | AC772: =(AA772*100)/AB772 -> 90.813253012048193 | AD772: =(X772*4)+(Z772*2) -> 34
A773: BEST PLAYERS | W773: SUNSHINE | X773: 7 | Y773: 9 | Z773: 1 | AA773: 1856 | AB773: 2081 | AC773: =(AA773*100)/AB773 -> 89.187890437289767 | AD773: =(X773*4)+(Z773*2) -> 30
A774: YARRAVILLE | W774: WERRIBEE | X774: 5 | Y774: 12 | Z774: 0 | AA774: 1731 | AB774: 2207 | AC774: =(AA774*100)/AB774 -> 78.432260987766199 | AD774: =(X774*4)+(Z774*2) -> 20
A775: OAKLEIGH | W775: WILLIAMSTOWN | X775: 3 | Y775: 14 | Z775: 0 | AA775: 1774 | AB775: 2283 | AC775: =(AA775*100)/AB775 -> 77.704774419623305 | AD775: =(X775*4)+(Z775*2) -> 12
A776: GOALKICKERS | W776: BOX HILL | X776: 1 | Y776: 15 | Z776: 1 | AA776: 1585 | AB776: 2304 | AC776: =(AA776*100)/AB776 -> 68.793402777777771 | AD776: =(X776*4)+(Z776*2) -> 6
A777: YARRAVILLE
A778: OAKLEIGH
A780: SUNSHINE | C780: 0 | D780: 0 | E780: =C780*6+D780 -> 0 | G780: 0 | H780: 0 | I780: =G780*6+H780 -> 0 | K780: 0 | L780: 0 | M780: =K780*6+L780 -> 0 | O780: 19 | P780: 17 | Q780: =O780*6+P780 -> 131 | S780: SUNSHINE
A781: BOX HILL | C781: 0 | D781: 0 | E781: =C781*6+D781 -> 0 | G781: 0 | H781: 0 | I781: =G781*6+H781 -> 0 | K781: 0 | L781: 0 | M781: =K781*6+L781 -> 0 | O781: 13 | P781: 12 | Q781: =O781*6+P781 -> 90
A782: BEST PLAYERS
A783: SUNSHINE
A784: BOX HILL
A785: GOALKICKERS
A786: SUNSHINE
A787: BOX HILL
A789: FRANKSTON | C789: 0 | D789: 0 | E789: =C789*6+D789 -> 0 | G789: 0 | H789: 0 | I789: =G789*6+H789 -> 0 | K789: 0 | L789: 0 | M789: =K789*6+L789 -> 0 | O789: 21 | P789: 16 | Q789: =O789*6+P789 -> 142 | S789: WAVERLEY
A790: WAVERLEY | C790: 0 | D790: 0 | E790: =C790*6+D790 -> 0 | G790: 0 | H790: 0 | I790: =G790*6+H790 -> 0 | K790: 0 | L790: 0 | M790: =K790*6+L790 -> 0 | O790: 10 | P790: 17 | Q790: =O790*6+P790 -> 77
A791: BEST PLAYERS
A792: FRANKSTON
A793: WAVERLEY
A794: GOALKICKERS
A795: FRANKSTON
A796: WAVERLEY
A798: NORTHCOTE | C798: 0 | D798: 0 | E798: =C798*6+D798 -> 0 | G798: 0 | H798: 0 | I798: =G798*6+H798 -> 0 | K798: 0 | L798: 0 | M798: =K798*6+L798 -> 0 | O798: 20 | P798: 28 | Q798: =O798*6+P798 -> 148 | S798: NORTHCOTE
A799: WERRIBEE | C799: 0 | D799: 0 | E799: =C799*6+D799 -> 0 | G799: 0 | H799: 0 | I799: =G799*6+H799 -> 0 | K799: 0 | L799: 0 | M799: =K799*6+L799 -> 0 | O799: 12 | P799: 11 | Q799: =O799*6+P799 -> 83
A800: BEST PLAYERS
A801: NORTHCOTE
A802: WERRIBEE
A803: GOALKICKERS
A804: NORTHCOTE
A805: WERRIBEE
A807: ROUND 18 | E807: 13TH AUGUST | J807: WEATHER | S807: PLAYED AT
D808: 1ST QTR | H808: 2ND QTR | L808: 3RD QTR | P808: FINAL | S808: FRANKSTON
A809: FRANKSTON | C809: 11 | D809: 5 | E809: =C809*6+D809 -> 71 | G809: 16 | H809: 12 | I809: =G809*6+H809 -> 108 | K809: 18 | L809: 18 | M809: =K809*6+L809 -> 126 | O809: 23 | P809: 24 | Q809: =O809*6+P809 -> 162 | S809: UMPIRE | X809: LADDER | AB809: ROUND | AD809: 18
A810: SUNSHINE | C810: 1 | D810: 2 | E810: =C810*6+D810 -> 8 | G810: 4 | H810: 6 | I810: =G810*6+H810 -> 30 | K810: 6 | L810: 10 | M810: =K810*6+L810 -> 46 | O810: 10 | P810: 14 | Q810: =O810*6+P810 -> 74 | S810: CASEY
A811: BEST PLAYERS | W811: TEAM | X811: W | Y811: L | Z811: D | AA811: FOR | AB811: AGST | AC811: % | AD811: PTS
A812: FRANKSTON | C812: BOYD | F812: RYAN | I812: MACE | L812: KENNEDY | O812: ORCHARD | R812: JONES
A813: SUNSHINE | C813: REDENBACH | F813: PAUL SIMPSON | I813: BENSON | L813: RADZIMINSKI | O813: BUGDEN | W813: FRANKSTON | X813: 15 | Y813: 3 | Z813: 0 | AA813: 2649 | AB813: 1774 | AC813: =(AA813*100)/AB813 -> 149.32356257046223 | AD813: =(X813*4)+(Z813*2) -> 60
A814: GOALKICKERS | R814: BOYD | W814: CAMBERWELL | X814: 14 | Y814: 4 | Z814: 0 | AA814: 2341 | AB814: 1517 | AC814: =(AA814*100)/AB814 -> 154.31773236651284 | AD814: =(X814*4)+(Z814*2) -> 56
A815: FRANKSTON | C815: RYAN 7 | E815: DANKS 4 | G815: BELL 3 | I815: GUNN 2 | K815: LOCCO 2 | M815: MACE | O815: ORCHARD | R815: HUNTER | T815: REIDY | W815: OAKLEIGH | X815: 12 | Y815: 5 | Z815: 1 | AA815: 2267 | AB815: 1932 | AC815: =(AA815*100)/AB815 -> 117.33954451345755 | AD815: =(X815*4)+(Z815*2) -> 50
A816: SUNSHINE | C816: WRIGHT 2 | E816: BENSON 2 | G816: RADZIMINSKI 2 | J816: SCHROEDER | M816: PAUL SIMPSON | P816: McDONALD | S816: MRAVIEK | W816: YARRAVILLE | X816: 12 | Y816: 6 | Z816: 0 | AA816: 2136 | AB816: 1893 | AC816: =(AA816*100)/AB816 -> 112.83676703645008 | AD816: =(X816*4)+(Z816*2) -> 48
A818: YARRAVILLE | C818: 6 | D818: 6 | E818: =C818*6+D818 -> 42 | G818: 12 | H818: 11 | I818: =G818*6+H818 -> 83 | K818: 19 | L818: 13 | M818: =K818*6+L818 -> 127 | O818: 20 | P818: 16 | Q818: =O818*6+P818 -> 136 | S818: BOX HILL | W818: NORTHCOTE | X818: 10 | Y818: 8 | Z818: 0 | AA818: 2218 | AB818: 1943 | AC818: =(AA818*100)/AB818 -> 114.1533710756562 | AD818: =(X818*4)+(Z818*2) -> 40
A819: BOX HILL | C819: 2 | D819: 0 | E819: =C819*6+D819 -> 12 | G819: 3 | H819: 1 | I819: =G819*6+H819 -> 19 | K819: 5 | L819: 2 | M819: =K819*6+L819 -> 32 | O819: 8 | P819: 4 | Q819: =O819*6+P819 -> 52 | S819: WILSON | W819: WAVERLEY | X819: 8 | Y819: 9 | Z819: 1 | AA819: 1881 | AB819: 2087 | AC819: =(AA819*100)/AB819 -> 90.129372304743654 | AD819: =(X819*4)+(Z819*2) -> 34
A820: BEST PLAYERS | W820: SUNSHINE | X820: 7 | Y820: 10 | Z820: 1 | AA820: 1930 | AB820: 2243 | AC820: =(AA820*100)/AB820 -> 86.045474810521625 | AD820: =(X820*4)+(Z820*2) -> 30
A821: YARRAVILLE | C821: HARLEY | F821: SAIT | I821: WELLINGTON | L821: WARD | O821: GRACO | R821: RYAN | W821: WERRIBEE | X821: 6 | Y821: 12 | Z821: 0 | AA821: 1816 | AB821: 2279 | AC821: =(AA821*100)/AB821 -> 79.684071961386579 | AD821: =(X821*4)+(Z821*2) -> 24
A822: BOX HILL | C822: RALPH | F822: JOFFE | I822: LUCAS | L822: BYRNE | O822: BATES | R822: ROBINSON | W822: WILLIAMSTOWN | X822: 3 | Y822: 15 | Z822: 0 | AA822: 1841 | AB822: 2462 | AC822: =(AA822*100)/AB822 -> 74.776604386677505 | AD822: =(X822*4)+(Z822*2) -> 12
A823: GOALKICKERS | O823: SHARP | Q823: HARLEY | W823: BOX HILL | X823: 1 | Y823: 16 | Z823: 1 | AA823: 1637 | AB823: 2440 | AC823: =(AA823*100)/AB823 -> 67.090163934426229 | AD823: =(X823*4)+(Z823*2) -> 6
A824: YARRAVILLE | C824: L RYAN 4 | E824: M FOTHERINGHAM 3 | I824: SAIT 3 | K824: SIMMONS 2 | N824: WELLINGTON 2 | Q824: CALVERT 2 | S824: LOWE 2
A825: BOX HILL | C825: COOK 2 | E825: FARRUGIA | H825: RALPH | J825: HARPER | L825: JOFFE | N825: KIKER | P825: CONNOLLY
A827: OAKLEIGH | C827: 5 | D827: 5 | E827: =C827*6+D827 -> 35 | G827: 10 | H827: 9 | I827: =G827*6+H827 -> 69 | K827: 15 | L827: 14 | M827: =K827*6+L827 -> 104 | O827: 16 | P827: 15 | Q827: =O827*6+P827 -> 111 | S827: OAKLEIGH
A828: CAMBERWELL | C828: 4 | D828: 2 | E828: =C828*6+D828 -> 26 | G828: 7 | H828: 3 | I828: =G828*6+H828 -> 45 | K828: 9 | L828: 4 | M828: =K828*6+L828 -> 58 | O828: 13 | P828: 9 | Q828: =O828*6+P828 -> 87 | S828: WENN
A829: BEST PLAYERS
A830: OAKLEIGH | C830: WENN | F830: GOODMAN | I830: PAGNOCCOLO | L830: FRYER | O830: TESERIERO | R830: MACKEY
A831: CAMBERWELL | C831: HOOK | F831: A SMITH | I831: ALEXEEF
A832: GOALKICKERS
A833: OAKLEIGH | C833: THOMAS 5 | E833: PAGNOCCOLO 3 | H833: GOODMAN 2 | K833: D MILLER 2 | N833: BURKE | P833: CURTAIN | R833: FRYER | T833: McDONALD
A834: CAMBERWELL | C834: ALEXEEF 5 | F834: B SMITH 3 | I834: HARROP 2 | L834: SIMPSON | N834: HAMMOND | Q834: HOOK
A836: NORTHCOTE | C836: 7 | D836: 10 | E836: =C836*6+D836 -> 52 | G836: 10 | H836: 12 | I836: =G836*6+H836 -> 72 | K836: 19 | L836: 16 | M836: =K836*6+L836 -> 130 | O836: 27 | P836: 17 | Q836: =O836*6+P836 -> 179 | S836: WILLIAMSTOWN
A837: WILLIAMSTOWN | C837: 1 | D837: 2 | E837: =C837*6+D837 -> 8 | G837: 4 | H837: 4 | I837: =G837*6+H837 -> 28 | K837: 7 | L837: 6 | M837: =K837*6+L837 -> 48 | O837: 10 | P837: 7 | Q837: =O837*6+P837 -> 67 | S837: TORNEY
A838: BEST PLAYERS
A839: NORTHCOTE | C839: G RYAN | F839: McCONCHIE | I839: M RYAN | L839: ROBSON | O839: DOBSON | R839: McCARTHY
A840: WILLIAMSTOWN | C840: L TAYLOR | F840: BEBEND | I840: McVEIGH | L840: BURGESS | O840: HICKMAN
A841: GOALKICKERS
A842: NORTHCOTE | C842: G RYAN 6 | F842: ILLIOV 4 | H842: McGRATH 4 | K842: DOBSON 3 | N842: THORNELOE 3 | Q842: McCONCHIE 2 | T842: HAYSOM 2 | W842: M RYAN 2 | X842: BRAIN
A843: WILLIAMSTOWN | C843: HICKMAN 5 | F843: CROSS | H843: GOETZ | J843: PATON | L843: COURTOT | N843: BOXALL
A845: WERRIBEE | C845: 0 | D845: 2 | E845: =C845*6+D845 -> 2 | G845: 4 | H845: 5 | I845: =G845*6+H845 -> 29 | K845: 10 | L845: 6 | M845: =K845*6+L845 -> 66 | O845: 13 | P845: 7 | Q845: =O845*6+P845 -> 85 | S845: WERRIBEE
A846: WAVERLEY | C846: 4 | D846: 4 | E846: =C846*6+D846 -> 28 | G846: 7 | H846: 7 | I846: =G846*6+H846 -> 49 | K846: 9 | L846: 9 | M846: =K846*6+L846 -> 63 | O846: 10 | P846: 12 | Q846: =O846*6+P846 -> 72 | S846: McBAIN
A847: BEST PLAYERS
A848: WERRIBEE | C848: BOURKE | F848: HUGHES | I848: EVANS | L848: YOUNG | O848: G BELLIN | R848: MARTIN
A849: WAVERLEY | C849: STYLES | F849: TYQUIN | I849: McDONALD | L849: COSTELLO | O849: JAMIESON | R849: HAROLD
A850: GOALKICKERS
A851: WERRIBEE | C851: LEECE 4 | F851: MARTIN 3 | I851: EVANS 2 | K851: G BELLIN | M851: BOURKE | O851: J BELLIN | Q851: WISE
A852: WAVERLEY | C852: McKAY 4 | F852: TYQUIN 3 | I852: COSTELLO 2 | L852: HAROLD
A854: FINALS
A855: 1ST SEMI | E855: 20TH AUGUST | J855: WEATHER | S855: PLAYED AT
D856: 1ST QTR | H856: 2ND QTR | L856: 3RD QTR | P856: FINAL | S856: TOORAKPK
A857: OAKLEIGH | C857: 3 | D857: 8 | E857: =C857*6+D857 -> 26 | G857: 11 | H857: 12 | I857: =G857*6+H857 -> 78 | K857: 21 | L857: 16 | M857: =K857*6+L857 -> 142 | O857: 28 | P857: 22 | Q857: =O857*6+P857 -> 190 | S857: UMPIRE
A858: YARRAVILLE | C858: 5 | D858: 2 | E858: =C858*6+D858 -> 32 | G858: 10 | H858: 6 | I858: =G858*6+H858 -> 66 | K858: 11 | L858: 8 | M858: =K858*6+L858 -> 74 | O858: 15 | P858: 10 | Q858: =O858*6+P858 -> 100 | S858: OAKLEY
A859: BEST PLAYERS
A860: OAKLEIGH | C860: WENN | F860: PAGNOCCOLO | I860: THOMAS | L860: GOODMAN | O860: WYATT | R860: FRYER
A861: YARRAVILLE | C861: SAIT | F861: THORPE | I861: M FOTHERINGHAM | M861: LRYAN | O861: SIMMONS | R861: KELLY
A862: GOALKICKERS
A863: OAKLEIGH | C863: THOMAS 7 | F863: WENN 5 | H863: GOODMAN 4 | K863: MILLER 3 | M863: TESERIERO 2 | O863: WYATT 2 | Q863: PAGNOCCOLO 2 | T863: KUZIMAK | W863: BURKE | X863: McDONALD
A864: YARRAVILLE | C864: M FOTHERINGHAM 5 | G864: LOWE 3 | I864: GRACO | K864: KELLY | M864: J RYAN | O864: L RYAN | Q864: SAIT | R864: SIMMONS | U864: THORPE
A866: 2ND SEMI | E866: 27TH AUGUST | J866: WEATHER
A867: FRANKSTON | C867: 2 | D867: 1 | E867: =C867*6+D867 -> 13 | G867: 7 | H867: 7 | I867: =G867*6+H867 -> 49 | K867: 12 | L867: 7 | M867: =K867*6+L867 -> 79 | O867: 18 | P867: 12 | Q867: =O867*6+P867 -> 120 | S867: TOORAK PARK
A868: CAMBERWELL | C868: 5 | D868: 4 | E868: =C868*6+D868 -> 34 | G868: 7 | H868: 5 | I868: =G868*6+H868 -> 47 | K868: 12 | L868: 8 | M868: =K868*6+L868 -> 80 | O868: 16 | P868: 8 | Q868: =O868*6+P868 -> 104 | S868: GROOM
A869: BEST PLAYERS
A870: FRANKSTON | C870: KENNEDY | F870: MERCOULIA | I870: SAMPSON | L870: JONES | O870: A HARPER | R870: MACE
A871: CAMBERWELL | C871: SAMPSON | F871: HOOK | I871: HAMMOND | L871: BARR | O871: OLIVER | R871: R SMITH
A872: GOALKICKERS
A873: FRANKSTON | C873: HUNTER 5 | F873: KENNEDY 4 | I873: SAMPSON 3 | L873: JONES 3 | N873: ROBERTS 2 | Q873: ORCHARD
A874: CAMBERWELL | C874: SIMPSON 6 | F874: B SMITH 4 | I874: WRIGHT 2 | L874: NEILSON 2 | N874: HARROP | Q874: ALEXEEF
A876: PRELIMINARY | E876: 3RD SEPTEMBER | J876: WEATHER
A877: CAMBERWELL | C877: 6 | D877: 3 | E877: =C877*6+D877 -> 39 | G877: 10 | H877: 9 | I877: =G877*6+H877 -> 69 | K877: 12 | L877: 23 | M877: =K877*6+L877 -> 95 | O877: 15 | P877: 26 | Q877: =O877*6+P877 -> 116 | S877: TOORAK PARK
A878: OAKLEIGH | C878: 3 | D878: 3 | E878: =C878*6+D878 -> 21 | G878: 3 | H878: 12 | I878: =G878*6+H878 -> 30 | K878: 6 | L878: 15 | M878: =K878*6+L878 -> 51 | O878: 10 | P878: 19 | Q878: =O878*6+P878 -> 79 | S878: HEDGER
A879: BEST PLAYERS
A880: CAMBERWELL | C880: OLIVER | F880: NEILSON | I880: HAZLETT | L880: INNES | O880: HOOK | Q880: HIRST
A881: OAKLEIGH | C881: WYATT | F881: PAGNOCCOLO | I881: BRUERTON | L881: GOODMAN | O881: EDWARDS
A882: GOALKICKERS
A883: CAMBERWELL | C883: HAMMOND 6 | F883: B SMITH 5 | I883: SIMPSON 2 | L883: HIRST | N883: CHAMBERLAIN
A884: OAKLEIGH | C884: WYATT 3 | F884: PAGNOCCOLO 2 | J884: BRUERTON | M884: CURTAIN | O884: GOODMAN | R884: D MILLER | T884: McDONALD
A886: GRAND | E886: 10TH SEPTEMBER | J886: WEATHER
A887: FRANKSTON | C887: 1 | D887: 2 | E887: =C887*6+D887 -> 8 | G887: 7 | H887: 7 | I887: =G887*6+H887 -> 49 | K887: 9 | L887: 8 | M887: =K887*6+L887 -> 62 | O887: 15 | P887: 13 | Q887: =O887*6+P887 -> 103 | S887: TOORAK PK
A888: CAMBERWELL | C888: 2 | D888: 4 | E888: =C888*6+D888 -> 16 | G888: 5 | H888: 5 | I888: =G888*6+H888 -> 35 | K888: 9 | L888: 11 | M888: =K888*6+L888 -> 65 | O888: 13 | P888: 11 | Q888: =O888*6+P888 -> 89 | S888: GROOM
A889: BEST PLAYERS
A890: FRANKSTON | C890: BOYD | F890: ORCHARD | I890: KENNEDY | L890: BATTY | O890: JONES | R890: SAMPSON
A891: CAMBERWELL | C891: SPITHILL | F891: HIRST | I891: B SMITH | L891: WRIGHT | O891: HAMMOND | R891: K CURRAN
A892: GOALKICKERS
A893: FRANKSTON | C893: HUNTER 6 | F893: ROBERTS 3 | I893: ORCHARD 3 | L893: BELL | N893: BOYD | P893: SAMPSON
A894: CAMBERWELL | C894: HAMMOND 5 | F894: B SMITH 3 | I894: WITHERS | L894: ADGEMIS | N894: HIRST | P894: WRIGHT | R894: SPITHILL