A1: Victorian Football Association
A2: Season 1979 - Division Two
A3: © Copyright Wal Williams | F3: First created: 28 March 2016
A4: Contact: joywalwi at gmail dot com | F4: Last updated: 28 March 2016 | W4: VFA Results and tables - Link to the main index page
A5: You are free to copy this document in whole or part provided that proper acknowledgement is given to the author. All rights reserved.
A7: 1979 | C7: V.F.A. SEASON 2ND DIVISION
A8: ROUND 1 | E8: 8TH APRIL | J8: WEATHER | S8: PLAYED AT
D9: 1ST QTR | H9: 2ND QTR | L9: 3RD QTR | P9: FINAL | S9: WAVERLEY
A10: MORDIALLOC | C10: 0 | D10: 0 | E10: =C10*6+D10 -> 0 | G10: 0 | H10: 0 | I10: =G10*6+H10 -> 0 | K10: 0 | L10: 0 | M10: =K10*6+L10 -> 0 | O10: 18 | P10: 19 | Q10: =O10*6+P10 -> 127 | S10: UMPIRE | X10: LADDER | AB10: ROUND | AD10: 1
A11: WAVERLEY | C11: 0 | D11: 0 | E11: =C11*6+D11 -> 0 | G11: 0 | H11: 0 | I11: =G11*6+H11 -> 0 | K11: 0 | L11: 0 | M11: =K11*6+L11 -> 0 | O11: 15 | P11: 20 | Q11: =O11*6+P11 -> 110
A12: BEST PLAYERS | W12: TEAM | X12: W | Y12: L | Z12: D | AA12: FOR | AB12: AGST | AC12: % | AD12: PTS
A13: MORDIALLOC
A14: WAVERLEY | W14: OAKLEIGH | X14: 1 | Y14: 0 | Z14: 0 | AA14: 135 | AB14: 63 | AC14: =(AA14*100)/AB14 -> 214.28571428571428 | AD14: =(X14*4)+(Z14*2) -> 4
A15: GOALKICKERS | W15: CAMBERWELL | X15: 1 | Y15: 0 | Z15: 0 | AA15: 200 | AB15: 97 | AC15: =(AA15*100)/AB15 -> 206.18556701030928 | AD15: =(X15*4)+(Z15*2) -> 4
A16: MORDIALLOC | W16: YARRAVILLE | X16: 1 | Y16: 0 | Z16: 0 | AA16: 161 | AB16: 110 | AC16: =(AA16*100)/AB16 -> 146.36363636363637 | AD16: =(X16*4)+(Z16*2) -> 4
A17: WAVERLEY | W17: NORTHCOTE | X17: 1 | Y17: 0 | Z17: 0 | AA17: 125 | AB17: 97 | AC17: =(AA17*100)/AB17 -> 128.86597938144331 | AD17: =(X17*4)+(Z17*2) -> 4
A19: CAMBERWELL | C19: 0 | D19: 0 | E19: =C19*6+D19 -> 0 | G19: 0 | H19: 0 | I19: =G19*6+H19 -> 0 | K19: 0 | L19: 0 | M19: =K19*6+L19 -> 0 | O19: 29 | P19: 26 | Q19: =O19*6+P19 -> 200 | S19: CAMBERWELL | W19: MORDIALLOC | X19: 1 | Y19: 0 | Z19: 0 | AA19: 127 | AB19: 110 | AC19: =(AA19*100)/AB19 -> 115.45454545454545 | AD19: =(X19*4)+(Z19*2) -> 4
A20: SUNSHINE | C20: 0 | D20: 0 | E20: =C20*6+D20 -> 0 | G20: 0 | H20: 0 | I20: =G20*6+H20 -> 0 | K20: 0 | L20: 0 | M20: =K20*6+L20 -> 0 | O20: 14 | P20: 13 | Q20: =O20*6+P20 -> 97 | W20: WAVERLEY | X20: 0 | Y20: 1 | Z20: 0 | AA20: 110 | AB20: 127 | AC20: =(AA20*100)/AB20 -> 86.614173228346459 | AD20: =(X20*4)+(Z20*2) -> 0
A21: BEST PLAYERS | W21: BOX HILL | X21: 0 | Y21: 1 | Z21: 0 | AA21: 97 | AB21: 125 | AC21: =(AA21*100)/AB21 -> 77.6 | AD21: =(X21*4)+(Z21*2) -> 0
A22: CAMBERWELL | W22: WILLIAMSTOWN | X22: 0 | Y22: 1 | Z22: 0 | AA22: 110 | AB22: 161 | AC22: =(AA22*100)/AB22 -> 68.322981366459629 | AD22: =(X22*4)+(Z22*2) -> 0
A23: SUNSHINE | W23: SUNSHINE | X23: 0 | Y23: 1 | Z23: 0 | AA23: 97 | AB23: 200 | AC23: =(AA23*100)/AB23 -> 48.5 | AD23: =(X23*4)+(Z23*2) -> 0
A24: GOALKICKERS | W24: WERRIBEE | X24: 0 | Y24: 1 | Z24: 0 | AA24: 63 | AB24: 135 | AC24: =(AA24*100)/AB24 -> 46.666666666666664 | AD24: =(X24*4)+(Z24*2) -> 0
A25: CAMBERWELL
A26: SUNSHINE
A28: YARRAVILLE | C28: 0 | D28: 0 | E28: =C28*6+D28 -> 0 | G28: 0 | H28: 0 | I28: =G28*6+H28 -> 0 | K28: 0 | L28: 0 | M28: =K28*6+L28 -> 0 | O28: 25 | P28: 11 | Q28: =O28*6+P28 -> 161 | S28: YARRAVILLE
A29: WILLIAMSTOWN | C29: 0 | D29: 0 | E29: =C29*6+D29 -> 0 | G29: 0 | H29: 0 | I29: =G29*6+H29 -> 0 | K29: 0 | L29: 0 | M29: =K29*6+L29 -> 0 | O29: 16 | P29: 14 | Q29: =O29*6+P29 -> 110
A30: BEST PLAYERS
A31: YARRAVILLE
A32: WILLIAMSTOWN
A33: GOALKICKERS
A34: YARRAVILLE
A35: WILLIAMSTOWN
A37: NORTHCOTE | C37: 0 | D37: 0 | E37: =C37*6+D37 -> 0 | G37: 0 | H37: 0 | I37: =G37*6+H37 -> 0 | K37: 0 | L37: 0 | M37: =K37*6+L37 -> 0 | O37: 18 | P37: 17 | Q37: =O37*6+P37 -> 125 | S37: NORTHCOTE
A38: BOX HILL | C38: 0 | D38: 0 | E38: =C38*6+D38 -> 0 | G38: 0 | H38: 0 | I38: =G38*6+H38 -> 0 | K38: 0 | L38: 0 | M38: =K38*6+L38 -> 0 | O38: 13 | P38: 19 | Q38: =O38*6+P38 -> 97
A39: BEST PLAYERS
A40: NORTHCOTE
A41: BOX HILL
A42: GOALKICKERS
A43: NORTHCOTE
A44: BOX HILL
A46: OAKLEIGH | C46: 0 | D46: 0 | E46: =C46*6+D46 -> 0 | G46: 0 | H46: 0 | I46: =G46*6+H46 -> 0 | K46: 0 | L46: 0 | M46: =K46*6+L46 -> 0 | O46: 19 | P46: 21 | Q46: =O46*6+P46 -> 135 | S46: WERRIBEE
A47: WERRIBEE | C47: 0 | D47: 0 | E47: =C47*6+D47 -> 0 | G47: 0 | H47: 0 | I47: =G47*6+H47 -> 0 | K47: 0 | L47: 0 | M47: =K47*6+L47 -> 0 | O47: 9 | P47: 9 | Q47: =O47*6+P47 -> 63
A48: BEST PLAYERS
A49: OAKLEIGH
A50: WERRIBEE
A51: GOALKICKERS
A52: OAKLEIGH
A53: WERRIBEE
A55: ROUND 2 | E55: 15TH APRIL | J55: WEATHER | S55: PLAYED AT
D56: 1ST QTR | H56: 2ND QTR | L56: 3RD QTR | P56: FINAL | S56: SUNSHINE
A57: WAVERLEY | C57: 0 | D57: 0 | E57: =C57*6+D57 -> 0 | G57: 0 | H57: 0 | I57: =G57*6+H57 -> 0 | K57: 0 | L57: 0 | M57: =K57*6+L57 -> 0 | O57: 20 | P57: 25 | Q57: =O57*6+P57 -> 145 | S57: UMPIRE | X57: LADDER | AB57: ROUND | AD57: 2
A58: SUNSHINE | C58: 0 | D58: 0 | E58: =C58*6+D58 -> 0 | G58: 0 | H58: 0 | I58: =G58*6+H58 -> 0 | K58: 0 | L58: 0 | M58: =K58*6+L58 -> 0 | O58: 16 | P58: 9 | Q58: =O58*6+P58 -> 105
A59: BEST PLAYERS | W59: TEAM | X59: W | Y59: L | Z59: D | AA59: FOR | AB59: AGST | AC59: % | AD59: PTS
A60: WAVERLEY
A61: SUNSHINE | W61: OAKLEIGH | X61: 2 | Y61: 0 | Z61: 0 | AA61: 330 | AB61: 151 | AC61: =(AA61*100)/AB61 -> 218.54304635761591 | AD61: =(X61*4)+(Z61*2) -> 8
A62: GOALKICKERS | W62: YARRAVILLE | X62: 2 | Y62: 0 | Z62: 0 | AA62: 358 | AB62: 171 | AC62: =(AA62*100)/AB62 -> 209.35672514619884 | AD62: =(X62*4)+(Z62*2) -> 8
A63: WAVERLEY | W63: MORDIALLOC | X63: 2 | Y63: 0 | Z63: 0 | AA63: 336 | AB63: 212 | AC63: =(AA63*100)/AB63 -> 158.49056603773585 | AD63: =(X63*4)+(Z63*2) -> 8
A64: SUNSHINE | W64: CAMBERWELL | X64: 1 | Y64: 1 | Z64: 0 | AA64: 312 | AB64: 229 | AC64: =(AA64*100)/AB64 -> 136.24454148471617 | AD64: =(X64*4)+(Z64*2) -> 4
A66: WILLIAMSTOWN | C66: 0 | D66: 0 | E66: =C66*6+D66 -> 0 | G66: 0 | H66: 0 | I66: =G66*6+H66 -> 0 | K66: 0 | L66: 0 | M66: =K66*6+L66 -> 0 | O66: 19 | P66: 18 | Q66: =O66*6+P66 -> 132 | S66: WILLIAMSTOWN | W66: WAVERLEY | X66: 1 | Y66: 1 | Z66: 0 | AA66: 255 | AB66: 232 | AC66: =(AA66*100)/AB66 -> 109.91379310344827 | AD66: =(X66*4)+(Z66*2) -> 4
A67: CAMBERWELL | C67: 0 | D67: 0 | E67: =C67*6+D67 -> 0 | G67: 0 | H67: 0 | I67: =G67*6+H67 -> 0 | K67: 0 | L67: 0 | M67: =K67*6+L67 -> 0 | O67: 16 | P67: 16 | Q67: =O67*6+P67 -> 112 | W67: WILLIAMSTOWN | X67: 1 | Y67: 1 | Z67: 0 | AA67: 242 | AB67: 273 | AC67: =(AA67*100)/AB67 -> 88.644688644688642 | AD67: =(X67*4)+(Z67*2) -> 4
A68: BEST PLAYERS | W68: NORTHCOTE | X68: 1 | Y68: 1 | Z68: 0 | AA68: 213 | AB68: 292 | AC68: =(AA68*100)/AB68 -> 72.945205479452056 | AD68: =(X68*4)+(Z68*2) -> 4
A69: WILLIAMSTOWN | W69: SUNSHINE | X69: 0 | Y69: 2 | Z69: 0 | AA69: 202 | AB69: 345 | AC69: =(AA69*100)/AB69 -> 58.550724637681157 | AD69: =(X69*4)+(Z69*2) -> 0
A70: CAMBERWELL | W70: BOX HILL | X70: 0 | Y70: 2 | Z70: 0 | AA70: 158 | AB70: 322 | AC70: =(AA70*100)/AB70 -> 49.068322981366457 | AD70: =(X70*4)+(Z70*2) -> 0
A71: GOALKICKERS | W71: WERRIBEE | X71: 0 | Y71: 2 | Z71: 0 | AA71: 165 | AB71: 344 | AC71: =(AA71*100)/AB71 -> 47.965116279069768 | AD71: =(X71*4)+(Z71*2) -> 0
A72: WILLIAMSTOWN
A73: CAMBERWELL
A75: YARRAVILLE | C75: 0 | D75: 0 | E75: =C75*6+D75 -> 0 | G75: 0 | H75: 0 | I75: =G75*6+H75 -> 0 | K75: 0 | L75: 0 | M75: =K75*6+L75 -> 0 | O75: 29 | P75: 23 | Q75: =O75*6+P75 -> 197 | S75: BOX HILL
A76: BOX HILL | C76: 0 | D76: 0 | E76: =C76*6+D76 -> 0 | G76: 0 | H76: 0 | I76: =G76*6+H76 -> 0 | K76: 0 | L76: 0 | M76: =K76*6+L76 -> 0 | O76: 8 | P76: 13 | Q76: =O76*6+P76 -> 61
A77: BEST PLAYERS
A78: YARRAVILLE
A79: BOX HILL
A80: GOALKICKERS
A81: YARRAVILLE
A82: BOX HILL
A84: OAKLEIGH | C84: 0 | D84: 0 | E84: =C84*6+D84 -> 0 | G84: 0 | H84: 0 | I84: =G84*6+H84 -> 0 | K84: 0 | L84: 0 | M84: =K84*6+L84 -> 0 | O84: 30 | P84: 15 | Q84: =O84*6+P84 -> 195 | S84: OAKLEIGH
A85: NORTHCOTE | C85: 0 | D85: 0 | E85: =C85*6+D85 -> 0 | G85: 0 | H85: 0 | I85: =G85*6+H85 -> 0 | K85: 0 | L85: 0 | M85: =K85*6+L85 -> 0 | O85: 12 | P85: 16 | Q85: =O85*6+P85 -> 88
A86: BEST PLAYERS
A87: OAKLEIGH
A88: NORTHCOTE
A89: GOALKICKERS
A90: OAKLEIGH
A91: NORTHCOTE
A93: MORDIALLOC | C93: 0 | D93: 0 | E93: =C93*6+D93 -> 0 | G93: 0 | H93: 0 | I93: =G93*6+H93 -> 0 | K93: 0 | L93: 0 | M93: =K93*6+L93 -> 0 | O93: 33 | P93: 11 | Q93: =O93*6+P93 -> 209 | S93: MORDIALLOC
A94: WERRIBEE | C94: 0 | D94: 0 | E94: =C94*6+D94 -> 0 | G94: 0 | H94: 0 | I94: =G94*6+H94 -> 0 | K94: 0 | L94: 0 | M94: =K94*6+L94 -> 0 | O94: 15 | P94: 12 | Q94: =O94*6+P94 -> 102
A95: BEST PLAYERS
A96: MORDIALLOC
A97: WERRIBEE
A98: GOALKICKERS
A99: MORDIALLOC
A100: WERRIBEE
A102: ROUND 3 | E102: 22ND APRIL | J102: WEATHER | S102: PLAYED AT
D103: 1ST QTR | H103: 2ND QTR | L103: 3RD QTR | P103: FINAL | S103: WAVERLEY
A104: WILLIAMSTOWN | C104: 0 | D104: 0 | E104: =C104*6+D104 -> 0 | G104: 0 | H104: 0 | I104: =G104*6+H104 -> 0 | K104: 0 | L104: 0 | M104: =K104*6+L104 -> 0 | O104: 17 | P104: 11 | Q104: =O104*6+P104 -> 113 | S104: UMPIRE | X104: LADDER | AB104: ROUND | AD104: 3
A105: WAVERLEY | C105: 0 | D105: 0 | E105: =C105*6+D105 -> 0 | G105: 0 | H105: 0 | I105: =G105*6+H105 -> 0 | K105: 0 | L105: 0 | M105: =K105*6+L105 -> 0 | O105: 11 | P105: 15 | Q105: =O105*6+P105 -> 81
A106: BEST PLAYERS | W106: TEAM | X106: W | Y106: L | Z106: D | AA106: FOR | AB106: AGST | AC106: % | AD106: PTS
A107: WILLIAMSTOWN
A108: WAVERLEY | W108: MORDIALLOC | X108: 3 | Y108: 0 | Z108: 0 | AA108: 463 | AB108: 277 | AC108: =(AA108*100)/AB108 -> 167.1480144404332 | AD108: =(X108*4)+(Z108*2) -> 12
A109: GOALKICKERS | W109: YARRAVILLE | X109: 3 | Y109: 0 | Z109: 0 | AA109: 489 | AB109: 293 | AC109: =(AA109*100)/AB109 -> 166.89419795221843 | AD109: =(X109*4)+(Z109*2) -> 12
A110: WILLIAMSTOWN | W110: CAMBERWELL | X110: 2 | Y110: 1 | Z110: 0 | AA110: 543 | AB110: 300 | AC110: =(AA110*100)/AB110 -> 181 | AD110: =(X110*4)+(Z110*2) -> 8
A111: WAVERLEY | W111: OAKLEIGH | X111: 2 | Y111: 1 | Z111: 0 | AA111: 452 | AB111: 282 | AC111: =(AA111*100)/AB111 -> 160.28368794326241 | AD111: =(X111*4)+(Z111*2) -> 8
A113: CAMBERWELL | C113: 0 | D113: 0 | E113: =C113*6+D113 -> 0 | G113: 0 | H113: 0 | I113: =G113*6+H113 -> 0 | K113: 0 | L113: 0 | M113: =K113*6+L113 -> 0 | O113: 34 | P113: 27 | Q113: =O113*6+P113 -> 231 | S113: CAMBERWELL | W113: NORTHCOTE | X113: 2 | Y113: 1 | Z113: 0 | AA113: 434 | AB113: 371 | AC113: =(AA113*100)/AB113 -> 116.98113207547169 | AD113: =(X113*4)+(Z113*2) -> 8
A114: BOX HILL | C114: 0 | D114: 0 | E114: =C114*6+D114 -> 0 | G114: 0 | H114: 0 | I114: =G114*6+H114 -> 0 | K114: 0 | L114: 0 | M114: =K114*6+L114 -> 0 | O114: 9 | P114: 17 | Q114: =O114*6+P114 -> 71 | W114: WILLIAMSTOWN | X114: 2 | Y114: 1 | Z114: 0 | AA114: 355 | AB114: 354 | AC114: =(AA114*100)/AB114 -> 100.28248587570621 | AD114: =(X114*4)+(Z114*2) -> 8
A115: BEST PLAYERS | W115: WAVERLEY | X115: 1 | Y115: 2 | Z115: 0 | AA115: 336 | AB115: 345 | AC115: =(AA115*100)/AB115 -> 97.391304347826093 | AD115: =(X115*4)+(Z115*2) -> 4
A116: CAMBERWELL | W116: SUNSHINE | X116: 0 | Y116: 3 | Z116: 0 | AA116: 267 | AB116: 472 | AC116: =(AA116*100)/AB116 -> 56.567796610169495 | AD116: =(X116*4)+(Z116*2) -> 0
A117: BOX HILL | W117: WERRIBEE | X117: 0 | Y117: 3 | Z117: 0 | AA117: 244 | AB117: 565 | AC117: =(AA117*100)/AB117 -> 43.185840707964601 | AD117: =(X117*4)+(Z117*2) -> 0
A118: GOALKICKERS | W118: BOX HILL | X118: 0 | Y118: 3 | Z118: 0 | AA118: 229 | AB118: 553 | AC118: =(AA118*100)/AB118 -> 41.410488245931283 | AD118: =(X118*4)+(Z118*2) -> 0
A119: CAMBERWELL
A120: BOX HILL
A122: YARRAVILLE | C122: 0 | D122: 0 | E122: =C122*6+D122 -> 0 | G122: 0 | H122: 0 | I122: =G122*6+H122 -> 0 | K122: 0 | L122: 0 | M122: =K122*6+L122 -> 0 | O122: 20 | P122: 11 | Q122: =O122*6+P122 -> 131 | S122: YARRAVILLE
A123: OAKLEIGH | C123: 0 | D123: 0 | E123: =C123*6+D123 -> 0 | G123: 0 | H123: 0 | I123: =G123*6+H123 -> 0 | K123: 0 | L123: 0 | M123: =K123*6+L123 -> 0 | O123: 17 | P123: 20 | Q123: =O123*6+P123 -> 122
A124: BEST PLAYERS
A125: YARRAVILLE
A126: OAKLEIGH
A127: GOALKICKERS
A128: YARRAVILLE
A129: OAKLEIGH
A131: NORTHCOTE | C131: 0 | D131: 0 | E131: =C131*6+D131 -> 0 | G131: 0 | H131: 0 | I131: =G131*6+H131 -> 0 | K131: 0 | L131: 0 | M131: =K131*6+L131 -> 0 | O131: 33 | P131: 23 | Q131: =O131*6+P131 -> 221 | S131: NORTHCOTE
A132: WERRIBEE | C132: 0 | D132: 0 | E132: =C132*6+D132 -> 0 | G132: 0 | H132: 0 | I132: =G132*6+H132 -> 0 | K132: 0 | L132: 0 | M132: =K132*6+L132 -> 0 | O132: 11 | P132: 13 | Q132: =O132*6+P132 -> 79
A133: BEST PLAYERS
A134: NORTHCOTE
A135: WERRIBEE
A136: GOALKICKERS
A137: NORTHCOTE
A138: WERRIBEE
A140: MORDIALLOC | C140: 0 | D140: 0 | E140: =C140*6+D140 -> 0 | G140: 0 | H140: 0 | I140: =G140*6+H140 -> 0 | K140: 0 | L140: 0 | M140: =K140*6+L140 -> 0 | O140: 18 | P140: 19 | Q140: =O140*6+P140 -> 127 | S140: SUNSHINE
A141: SUNSHINE | C141: 0 | D141: 0 | E141: =C141*6+D141 -> 0 | G141: 0 | H141: 0 | I141: =G141*6+H141 -> 0 | K141: 0 | L141: 0 | M141: =K141*6+L141 -> 0 | O141: 9 | P141: 11 | Q141: =O141*6+P141 -> 65
A142: BEST PLAYERS
A143: MORDIALLOC
A144: SUNSHINE
A145: GOALKICKERS
A146: MORDIALLOC
A147: SUNSHINE
A149: ROUND 4 | E149: 29TH APRIL | J149: WEATHER | S149: PLAYED AT
D150: 1ST QTR | H150: 2ND QTR | L150: 3RD QTR | P150: FINAL | S150: BOX HILL
A151: WAVERLEY | C151: 0 | D151: 0 | E151: =C151*6+D151 -> 0 | G151: 0 | H151: 0 | I151: =G151*6+H151 -> 0 | K151: 0 | L151: 0 | M151: =K151*6+L151 -> 0 | O151: 22 | P151: 11 | Q151: =O151*6+P151 -> 143 | S151: UMPIRE | X151: LADDER | AB151: ROUND | AD151: 4
A152: BOX HILL | C152: 0 | D152: 0 | E152: =C152*6+D152 -> 0 | G152: 0 | H152: 0 | I152: =G152*6+H152 -> 0 | K152: 0 | L152: 0 | M152: =K152*6+L152 -> 0 | O152: 19 | P152: 11 | Q152: =O152*6+P152 -> 125
A153: BEST PLAYERS | W153: TEAM | X153: W | Y153: L | Z153: D | AA153: FOR | AB153: AGST | AC153: % | AD153: PTS
A154: WAVERLEY
A155: BOX HILL | W155: YARRAVILLE | X155: 4 | Y155: 0 | Z155: 0 | AA155: 683 | AB155: 409 | AC155: =(AA155*100)/AB155 -> 166.99266503667482 | AD155: =(X155*4)+(Z155*2) -> 16
A156: GOALKICKERS | W156: CAMBERWELL | X156: 3 | Y156: 1 | Z156: 0 | AA156: 676 | AB156: 395 | AC156: =(AA156*100)/AB156 -> 171.13924050632912 | AD156: =(X156*4)+(Z156*2) -> 12
A157: WAVERLEY | W157: MORDIALLOC | X157: 3 | Y157: 1 | Z157: 0 | AA157: 583 | AB157: 398 | AC157: =(AA157*100)/AB157 -> 146.4824120603015 | AD157: =(X157*4)+(Z157*2) -> 12
A158: BOX HILL | W158: WILLIAMSTOWN | X158: 3 | Y158: 1 | Z158: 0 | AA158: 544 | AB158: 451 | AC158: =(AA158*100)/AB158 -> 120.62084257206209 | AD158: =(X158*4)+(Z158*2) -> 12
A160: CAMBERWELL | C160: 0 | D160: 0 | E160: =C160*6+D160 -> 0 | G160: 0 | H160: 0 | I160: =G160*6+H160 -> 0 | K160: 0 | L160: 0 | M160: =K160*6+L160 -> 0 | O160: 19 | P160: 19 | Q160: =O160*6+P160 -> 133 | S160: OAKLEIGH | W160: NORTHCOTE | X160: 3 | Y160: 1 | Z160: 0 | AA160: 555 | AB160: 491 | AC160: =(AA160*100)/AB160 -> 113.0346232179226 | AD160: =(X160*4)+(Z160*2) -> 12
A161: OAKLEIGH | C161: 0 | D161: 0 | E161: =C161*6+D161 -> 0 | G161: 0 | H161: 0 | I161: =G161*6+H161 -> 0 | K161: 0 | L161: 0 | M161: =K161*6+L161 -> 0 | O161: 14 | P161: 11 | Q161: =O161*6+P161 -> 95 | W161: OAKLEIGH | X161: 2 | Y161: 2 | Z161: 0 | AA161: 547 | AB161: 415 | AC161: =(AA161*100)/AB161 -> 131.80722891566265 | AD161: =(X161*4)+(Z161*2) -> 8
A162: BEST PLAYERS | W162: WAVERLEY | X162: 2 | Y162: 2 | Z162: 0 | AA162: 479 | AB162: 470 | AC162: =(AA162*100)/AB162 -> 101.91489361702128 | AD162: =(X162*4)+(Z162*2) -> 8
A163: CAMBERWELL | W163: SUNSHINE | X163: 0 | Y163: 4 | Z163: 0 | AA163: 364 | AB163: 661 | AC163: =(AA163*100)/AB163 -> 55.06807866868381 | AD163: =(X163*4)+(Z163*2) -> 0
A164: OAKLEIGH | W164: BOX HILL | X164: 0 | Y164: 4 | Z164: 0 | AA164: 354 | AB164: 696 | AC164: =(AA164*100)/AB164 -> 50.862068965517238 | AD164: =(X164*4)+(Z164*2) -> 0
A165: GOALKICKERS | W165: WERRIBEE | X165: 0 | Y165: 4 | Z165: 0 | AA165: 360 | AB165: 759 | AC165: =(AA165*100)/AB165 -> 47.430830039525695 | AD165: =(X165*4)+(Z165*2) -> 0
A166: CAMBERWELL
A167: OAKLEIGH
A169: YARRAVILLE | C169: 0 | D169: 0 | E169: =C169*6+D169 -> 0 | G169: 0 | H169: 0 | I169: =G169*6+H169 -> 0 | K169: 0 | L169: 0 | M169: =K169*6+L169 -> 0 | O169: 29 | P169: 20 | Q169: =O169*6+P169 -> 194 | S169: WERRIBEE
A170: WERRIBEE | C170: 0 | D170: 0 | E170: =C170*6+D170 -> 0 | G170: 0 | H170: 0 | I170: =G170*6+H170 -> 0 | K170: 0 | L170: 0 | M170: =K170*6+L170 -> 0 | O170: 17 | P170: 14 | Q170: =O170*6+P170 -> 116
A171: BEST PLAYERS
A172: YARRAVILLE
A173: WERRIBEE
A174: GOALKICKERS
A175: YARRAVILLE
A176: WERRIBEE
A178: NORTHCOTE | C178: 0 | D178: 0 | E178: =C178*6+D178 -> 0 | G178: 0 | H178: 0 | I178: =G178*6+H178 -> 0 | K178: 0 | L178: 0 | M178: =K178*6+L178 -> 0 | O178: 17 | P178: 19 | Q178: =O178*6+P178 -> 121 | S178: MORDIALLOC
A179: MORDIALLOC | C179: 0 | D179: 0 | E179: =C179*6+D179 -> 0 | G179: 0 | H179: 0 | I179: =G179*6+H179 -> 0 | K179: 0 | L179: 0 | M179: =K179*6+L179 -> 0 | O179: 18 | P179: 12 | Q179: =O179*6+P179 -> 120
A180: BEST PLAYERS
A181: NORTHCOTE
A182: MORDIALLOC
A183: GOALKICKERS
A184: NORTHCOTE
A185: MORDIALLOC
A187: WILLIAMSTOWN | C187: 0 | D187: 0 | E187: =C187*6+D187 -> 0 | G187: 0 | H187: 0 | I187: =G187*6+H187 -> 0 | K187: 0 | L187: 0 | M187: =K187*6+L187 -> 0 | O187: 28 | P187: 21 | Q187: =O187*6+P187 -> 189 | S187: WILLIAMSTOWN
A188: SUNSHINE | C188: 0 | D188: 0 | E188: =C188*6+D188 -> 0 | G188: 0 | H188: 0 | I188: =G188*6+H188 -> 0 | K188: 0 | L188: 0 | M188: =K188*6+L188 -> 0 | O188: 13 | P188: 19 | Q188: =O188*6+P188 -> 97
A189: BEST PLAYERS
A190: WILLIAMSTOWN
A191: SUNSHINE
A192: GOALKICKERS
A193: WILLIAMSTOWN
A194: SUNSHINE
A196: ROUND 5 | E196: 6TH MAY | J196: WEATHER | S196: PLAYED AT
D197: 1ST QTR | H197: 2ND QTR | L197: 3RD QTR | P197: FINAL | S197: CAMBERWELL
A198: CAMBERWELL | C198: 9 | D198: 7 | E198: =C198*6+D198 -> 61 | G198: 19 | H198: 8 | I198: =G198*6+H198 -> 122 | K198: 28 | L198: 15 | M198: =K198*6+L198 -> 183 | O198: 32 | P198: 21 | Q198: =O198*6+P198 -> 213 | S198: UMPIRE | X198: LADDER | AB198: ROUND | AD198: 5
A199: WERRIBEE | C199: 1 | D199: 2 | E199: =C199*6+D199 -> 8 | G199: 7 | H199: 3 | I199: =G199*6+H199 -> 45 | K199: 9 | L199: 5 | M199: =K199*6+L199 -> 59 | O199: 16 | P199: 8 | Q199: =O199*6+P199 -> 104 | S199: R MORGAN
A200: BEST PLAYERS | W200: TEAM | X200: W | Y200: L | Z200: D | AA200: FOR | AB200: AGST | AC200: % | AD200: PTS
A201: CAMBERWELL | C201: JUDD | F201: McFEE | I201: ALEXEEF | L201: SIMPSON | O201: ROHLEDER | R201: DAVIDSON
A202: FRANKSTON | C202: LINEHAN | F202: JACK | I202: DOUGHERTY | L202: HUGHES | O202: LANCASTER | R202: PEARCE | W202: CAMBERWELL | X202: 4 | Y202: 1 | Z202: 0 | AA202: 889 | AB202: 499 | AC202: =(AA202*100)/AB202 -> 178.15631262525051 | AD202: =(X202*4)+(Z202*2) -> 16
A203: GOALKICKERS | N203: HAYWOOD 2 | Q203: CHAMBERLAIN | W203: YARRAVILLE | X203: 4 | Y203: 1 | Z203: 0 | AA203: 804 | AB203: 537 | AC203: =(AA203*100)/AB203 -> 149.72067039106145 | AD203: =(X203*4)+(Z203*2) -> 16
A204: CAMBERWELL | C204: SIMPSON 6 | F204: DAVIDSON 5 | I204: MOORE 5 | K204: COWLEY 5 | N204: McFEE 4 | P204: TEAKEL 2 | R204: ROHLEDER 2 | W204: MORDIALLOC | X204: 4 | Y204: 1 | Z204: 0 | AA204: 712 | AB204: 497 | AC204: =(AA204*100)/AB204 -> 143.25955734406438 | AD204: =(X204*4)+(Z204*2) -> 16
A205: FRANKSTON | C205: LINEHAN 2 | F205: HUGHES 2 | H205: MARTIN 2 | J205: EVANS 2 | L205: WHITE | N205: NUSPEN | P205: BELLIN | R205: MEMBREY | T205: DOUGHERTY | W205: NORTHCOTE | X205: 4 | Y205: 1 | Z205: 0 | AA205: 683 | AB205: 612 | AC205: =(AA205*100)/AB205 -> 111.60130718954248 | AD205: =(X205*4)+(Z205*2) -> 16
C206: 3 SHORT
A207: MORDIALLOC | C207: 5 | D207: 1 | E207: =C207*6+D207 -> 31 | G207: 12 | H207: 2 | I207: =G207*6+H207 -> 74 | K207: 15 | L207: 6 | M207: =K207*6+L207 -> 96 | O207: 20 | P207: 9 | Q207: =O207*6+P207 -> 129 | S207: MORDIALLOC | W207: OAKLEIGH | X207: 3 | Y207: 2 | Z207: 0 | AA207: 733 | AB207: 514 | AC207: =(AA207*100)/AB207 -> 142.6070038910506 | AD207: =(X207*4)+(Z207*2) -> 12
A208: WILLIAMSTOWN | C208: 5 | D208: 6 | E208: =C208*6+D208 -> 36 | G208: 6 | H208: 12 | I208: =G208*6+H208 -> 48 | K208: 11 | L208: 13 | M208: =K208*6+L208 -> 79 | O208: 13 | P208: 21 | Q208: =O208*6+P208 -> 99 | S208: OAKLEY | W208: WILLIAMSTOWN | X208: 3 | Y208: 2 | Z208: 0 | AA208: 643 | AB208: 580 | AC208: =(AA208*100)/AB208 -> 110.86206896551724 | AD208: =(X208*4)+(Z208*2) -> 12
A209: BEST PLAYERS | W209: WAVERLEY | X209: 2 | Y209: 3 | Z209: 0 | AA209: 578 | AB209: 656 | AC209: =(AA209*100)/AB209 -> 88.109756097560975 | AD209: =(X209*4)+(Z209*2) -> 8
A210: MORDIALLOC | C210: SLADE | F210: GUY | I210: WILLIAMSON | L210: NEVILLE | O210: MASON | R210: WALSH | W210: SUNSHINE | X210: 1 | Y210: 4 | Z210: 0 | AA210: 532 | AB210: 785 | AC210: =(AA210*100)/AB210 -> 67.770700636942678 | AD210: =(X210*4)+(Z210*2) -> 4
A211: WILLIAMSTOWN | C211: M TALOR | F211: COURTOT | I211: MORRIS | L211: BEBEND | O211: KERR | R211: JOHN | W211: BOX HILL | X211: 0 | Y211: 5 | Z211: 0 | AA211: 478 | AB211: 864 | AC211: =(AA211*100)/AB211 -> 55.324074074074076 | AD211: =(X211*4)+(Z211*2) -> 0
A212: GOALKICKERS | W212: WERRIBEE | X212: 0 | Y212: 5 | Z212: 0 | AA212: 464 | AB212: 973 | AC212: =(AA212*100)/AB212 -> 47.687564234326821 | AD212: =(X212*4)+(Z212*2) -> 0
A213: MORDIALLOC | C213: NEVILLE 6 | F213: DEATON 5 | H213: MORRIS 4 | J213: GUY 2 | K213: WILLIAMSON | N213: W FELTHAM | Q213: ROGERSON
A214: WILLIAMSTOWN | C214: JOHN 5 | E214: KERR 2 | G214: HICKMAN 2 | J214: CROSS | L214: NEWMAN | N214: BEBEND | P214: MORRIS
A216: OAKLEIGH | C216: 3 | D216: 10 | E216: =C216*6+D216 -> 28 | G216: 12 | H216: 12 | I216: =G216*6+H216 -> 84 | K216: 17 | L216: 21 | M216: =K216*6+L216 -> 123 | O216: 27 | P216: 24 | Q216: =O216*6+P216 -> 186 | S216: WAVERLEY
A217: WAVERLEY | C217: 5 | D217: 2 | E217: =C217*6+D217 -> 32 | G217: 11 | H217: 8 | I217: =G217*6+H217 -> 74 | K217: 12 | L217: 11 | M217: =K217*6+L217 -> 83 | O217: 14 | P217: 15 | Q217: =O217*6+P217 -> 99 | S217: GROOM
A218: BEST PLAYERS
A219: OAKLEIGH | C219: HEVERIN | F219: LEISHMAN | I219: CURTIN | L219: LENNIE | O219: McDONALD | R219: DUNN
A220: WAVERLEY | C220: KINNABURGH | F220: BARNES | I220: STYLES | L220: COSTELLO | O220: K McDONALD
A221: GOALKICKERS
A222: OAKLEIGH | C222: CURTIN 7 | E222: McDONALD 4 | H222: THOMAS 3 | J222: WENN 3 | L222: D MILLER 3 | O222: PAGNOCCOLO 3 | R222: GOODMAN 2 | U222: DUNN 2
A223: WAVERLEY | C223: COSTELLO 4 | F223: LYNDEN 2 | I223: BARNES 2 | K223: JAMIESON 2 | N223: P ANGELIS 2 | Q223: McLURE | S223: MORRIS
A225: NORTHCOTE | C225: 5 | D225: 2 | E225: =C225*6+D225 -> 32 | G225: 8 | H225: 9 | I225: =G225*6+H225 -> 57 | K225: 10 | L225: 14 | M225: =K225*6+L225 -> 74 | O225: 18 | P225: 20 | Q225: =O225*6+P225 -> 128 | S225: YARRAVILLE
A226: YARRAVILLE | C226: 5 | D226: 2 | E226: =C226*6+D226 -> 32 | G226: 6 | H226: 5 | I226: =G226*6+H226 -> 41 | K226: 12 | L226: 10 | M226: =K226*6+L226 -> 82 | O226: 18 | P226: 13 | Q226: =O226*6+P226 -> 121 | S226: R CASEY
A227: BEST PLAYERS
A228: NORTHCOTE | C228: WATTS | F228: RYAN | I228: McARDLE | L228: BRAIN | O228: EDWARDS | R228: SMITH
A229: YARRAVILLE | C229: GRACO | E229: M FOTHERINGHAM | I229: SHARP | L229: B SMITH | O229: KEOGH | R229: PAGAN
A230: GOALKICKERS
A231: NORTHCOTE | C231: WATTS 7 | F231: BRAIN 5 | H231: RYAN 2 | J231: GRAHAM 2 | M231: ROBERTS | O231: MITCHELL
A232: YARRAVILLE | C232: M FOTHERINGHAM 9 | G232: PAGAN 3 | I232: L RYAN | K232: G BROWN | M232: LAXTON | O232: SAIT | Q232: SIMMONS
A234: SUNSHINE | C234: 5 | D234: 1 | E234: =C234*6+D234 -> 31 | G234: 11 | H234: 9 | I234: =G234*6+H234 -> 75 | K234: 18 | L234: 11 | M234: =K234*6+L234 -> 119 | O234: 25 | P234: 18 | Q234: =O234*6+P234 -> 168 | S234: SUNSHINE
A235: BOX HILL | C235: 4 | D235: 6 | E235: =C235*6+D235 -> 30 | G235: 9 | H235: 7 | I235: =G235*6+H235 -> 61 | K235: 15 | L235: 12 | M235: =K235*6+L235 -> 102 | O235: 18 | P235: 16 | Q235: =O235*6+P235 -> 124 | S235: McBAIN
A236: BEST PLAYERS
A237: SUNSHINE | C237: PETER SIMPSON | F237: A SCHROEDER | I237: FOLEY | K237: PAUL SIMPSON | N237: BAIRD | P237: KENNEDY
A238: BOX HILL | C238: CRUSE | F238: DICKENSON | I238: LAWTHER | L238: HARPER | N238: ROBINSON | Q238: JOFFE
A239: GOALKICKERS
A240: SUNSHINE | C240: A SCHROEDER 8 | F240: SAID 8 | H240: R JONES 2 | J240: MANDICS 2 | M240: PAUL SIMPSON 2 | Q240: MENADUE | S240: CARLAND | V240: BAIRD
A241: BOX HILL | C241: CRUSE 3 | E241: JOFFE 3 | G241: BATES 2 | I241: RALPH | K241: LYNN | M241: LAWTHER | O241: HARPER | Q241: ROBINSON | S241: JOFFE?
A243: ROUND 6 | E243: 13TH MAY | J243: WEATHER | S243: PLAYED AT
D244: 1ST QTR | H244: 2ND QTR | L244: 3RD QTR | P244: FINAL | S244: NORTHCOTE
A245: NORTHCOTE | C245: 0 | D245: 0 | E245: =C245*6+D245 -> 0 | G245: 0 | H245: 0 | I245: =G245*6+H245 -> 0 | K245: 0 | L245: 0 | M245: =K245*6+L245 -> 0 | O245: 16 | P245: 19 | Q245: =O245*6+P245 -> 115 | S245: UMPIRE | X245: LADDER | AB245: ROUND | AD245: 6
A246: CAMBERWELL | C246: 0 | D246: 0 | E246: =C246*6+D246 -> 0 | G246: 0 | H246: 0 | I246: =G246*6+H246 -> 0 | K246: 0 | L246: 0 | M246: =K246*6+L246 -> 0 | O246: 16 | P246: 12 | Q246: =O246*6+P246 -> 108
A247: BEST PLAYERS | W247: TEAM | X247: W | Y247: L | Z247: D | AA247: FOR | AB247: AGST | AC247: % | AD247: PTS
A248: NORTHCOTE
A249: CAMBERWELL | W249: MORDIALLOC | X249: 5 | Y249: 1 | Z249: 0 | AA249: 852 | AB249: 590 | AC249: =(AA249*100)/AB249 -> 144.40677966101694 | AD249: =(X249*4)+(Z249*2) -> 20
A250: GOALKICKERS | W250: NORTHCOTE | X250: 5 | Y250: 1 | Z250: 0 | AA250: 798 | AB250: 720 | AC250: =(AA250*100)/AB250 -> 110.83333333333333 | AD250: =(X250*4)+(Z250*2) -> 20
A251: NORTHCOTE | W251: CAMBERWELL | X251: 4 | Y251: 2 | Z251: 0 | AA251: 997 | AB251: 614 | AC251: =(AA251*100)/AB251 -> 162.37785016286645 | AD251: =(X251*4)+(Z251*2) -> 16
A252: CAMBERWELL | W252: OAKLEIGH | X252: 4 | Y252: 2 | Z252: 0 | AA252: 922 | AB252: 617 | AC252: =(AA252*100)/AB252 -> 149.43273905996759 | AD252: =(X252*4)+(Z252*2) -> 16
A254: MORDIALLOC | C254: 0 | D254: 0 | E254: =C254*6+D254 -> 0 | G254: 0 | H254: 0 | I254: =G254*6+H254 -> 0 | K254: 0 | L254: 0 | M254: =K254*6+L254 -> 0 | O254: 21 | P254: 14 | Q254: =O254*6+P254 -> 140 | S254: YARRAVILLE | W254: YARRAVILLE | X254: 4 | Y254: 2 | Z254: 0 | AA254: 897 | AB254: 677 | AC254: =(AA254*100)/AB254 -> 132.49630723781388 | AD254: =(X254*4)+(Z254*2) -> 16
A255: YARRAVILLE | C255: 0 | D255: 0 | E255: =C255*6+D255 -> 0 | G255: 0 | H255: 0 | I255: =G255*6+H255 -> 0 | K255: 0 | L255: 0 | M255: =K255*6+L255 -> 0 | O255: 13 | P255: 15 | Q255: =O255*6+P255 -> 93 | W255: WILLIAMSTOWN | X255: 4 | Y255: 2 | Z255: 0 | AA255: 740 | AB255: 663 | AC255: =(AA255*100)/AB255 -> 111.61387631975867 | AD255: =(X255*4)+(Z255*2) -> 16
A256: BEST PLAYERS | W256: WAVERLEY | X256: 2 | Y256: 4 | Z256: 0 | AA256: 723 | AB256: 803 | AC256: =(AA256*100)/AB256 -> 90.037359900373602 | AD256: =(X256*4)+(Z256*2) -> 8
A257: MORDIALLOC | W257: SUNSHINE | X257: 1 | Y257: 5 | Z257: 0 | AA257: 635 | AB257: 974 | AC257: =(AA257*100)/AB257 -> 65.195071868583156 | AD257: =(X257*4)+(Z257*2) -> 4
A258: YARRAVILLE | W258: WERRIBEE | X258: 1 | Y258: 5 | Z258: 0 | AA258: 611 | AB258: 1118 | AC258: =(AA258*100)/AB258 -> 54.651162790697676 | AD258: =(X258*4)+(Z258*2) -> 4
A259: GOALKICKERS | W259: BOX HILL | X259: 0 | Y259: 6 | Z259: 0 | AA259: 561 | AB259: 961 | AC259: =(AA259*100)/AB259 -> 58.376690946930282 | AD259: =(X259*4)+(Z259*2) -> 0
A260: MORDIALLOC
A261: YARRAVILLE
A263: OAKLEIGH | C263: 0 | D263: 0 | E263: =C263*6+D263 -> 0 | G263: 0 | H263: 0 | I263: =G263*6+H263 -> 0 | K263: 0 | L263: 0 | M263: =K263*6+L263 -> 0 | O263: 28 | P263: 21 | Q263: =O263*6+P263 -> 189 | S263: OAKLEIGH
A264: SUNSHINE | C264: 0 | D264: 0 | E264: =C264*6+D264 -> 0 | G264: 0 | H264: 0 | I264: =G264*6+H264 -> 0 | K264: 0 | L264: 0 | M264: =K264*6+L264 -> 0 | O264: 15 | P264: 13 | Q264: =O264*6+P264 -> 103
A265: BEST PLAYERS
A266: OAKLEIGH
A267: SUNSHINE
A268: GOALKICKERS
A269: OAKLEIGH
A270: SUNSHINE
A272: WILLIAMSTOWN | C272: 0 | D272: 0 | E272: =C272*6+D272 -> 0 | G272: 0 | H272: 0 | I272: =G272*6+H272 -> 0 | K272: 0 | L272: 0 | M272: =K272*6+L272 -> 0 | O272: 14 | P272: 13 | Q272: =O272*6+P272 -> 97 | S272: BOX HILL
A273: BOX HILL | C273: 0 | D273: 0 | E273: =C273*6+D273 -> 0 | G273: 0 | H273: 0 | I273: =G273*6+H273 -> 0 | K273: 0 | L273: 0 | M273: =K273*6+L273 -> 0 | O273: 12 | P273: 11 | Q273: =O273*6+P273 -> 83
A274: BEST PLAYERS
A275: WILLIAMSTOWN
A276: BOX HILL
A277: GOALKICKERS
A278: WILLIAMSTOWN
A279: BOX HILL
A281: WERRIBEE | C281: 0 | D281: 0 | E281: =C281*6+D281 -> 0 | G281: 0 | H281: 0 | I281: =G281*6+H281 -> 0 | K281: 0 | L281: 0 | M281: =K281*6+L281 -> 0 | O281: 22 | P281: 15 | Q281: =O281*6+P281 -> 147 | S281: WERRIBEE
A282: WAVERLEY | C282: 0 | D282: 0 | E282: =C282*6+D282 -> 0 | G282: 0 | H282: 0 | I282: =G282*6+H282 -> 0 | K282: 0 | L282: 0 | M282: =K282*6+L282 -> 0 | O282: 22 | P282: 13 | Q282: =O282*6+P282 -> 145
A283: BEST PLAYERS
A284: WERRIBEE
A285: WAVERLEY
A286: GOALKICKERS
A287: WERRIBEE
A288: WAVERLEY
A290: ROUND 7 | E290: 20TH MAY | J290: WEATHER | S290: PLAYED AT
D291: 1ST QTR | H291: 2ND QTR | L291: 3RD QTR | P291: FINAL | S291: WAVERLEY
A292: NORTHCOTE | C292: 0 | D292: 0 | E292: =C292*6+D292 -> 0 | G292: 0 | H292: 0 | I292: =G292*6+H292 -> 0 | K292: 0 | L292: 0 | M292: =K292*6+L292 -> 0 | O292: 21 | P292: 18 | Q292: =O292*6+P292 -> 144 | S292: UMPIRE | X292: LADDER | AB292: ROUND | AD292: 7
A293: WAVERLEY | C293: 0 | D293: 0 | E293: =C293*6+D293 -> 0 | G293: 0 | H293: 0 | I293: =G293*6+H293 -> 0 | K293: 0 | L293: 0 | M293: =K293*6+L293 -> 0 | O293: 18 | P293: 16 | Q293: =O293*6+P293 -> 124
A294: BEST PLAYERS | W294: TEAM | X294: W | Y294: L | Z294: D | AA294: FOR | AB294: AGST | AC294: % | AD294: PTS
A295: NORTHCOTE
A296: WAVERLEY | W296: MORDIALLOC | X296: 6 | Y296: 1 | Z296: 0 | AA296: 1088 | AB296: 691 | AC296: =(AA296*100)/AB296 -> 157.45296671490593 | AD296: =(X296*4)+(Z296*2) -> 24
A297: GOALKICKERS | W297: NORTHCOTE | X297: 6 | Y297: 1 | Z297: 0 | AA297: 942 | AB297: 844 | AC297: =(AA297*100)/AB297 -> 111.61137440758294 | AD297: =(X297*4)+(Z297*2) -> 24
A298: NORTHCOTE | W298: CAMBERWELL | X298: 5 | Y298: 2 | Z298: 0 | AA298: 1111 | AB298: 693 | AC298: =(AA298*100)/AB298 -> 160.31746031746033 | AD298: =(X298*4)+(Z298*2) -> 20
A299: WAVERLEY | W299: OAKLEIGH | X299: 5 | Y299: 2 | Z299: 0 | AA299: 1071 | AB299: 736 | AC299: =(AA299*100)/AB299 -> 145.51630434782609 | AD299: =(X299*4)+(Z299*2) -> 20
A301: CAMBERWELL | C301: 0 | D301: 0 | E301: =C301*6+D301 -> 0 | G301: 0 | H301: 0 | I301: =G301*6+H301 -> 0 | K301: 0 | L301: 0 | M301: =K301*6+L301 -> 0 | O301: 16 | P301: 18 | Q301: =O301*6+P301 -> 114 | S301: CAMBERWELL | W301: YARRAVILLE | X301: 4 | Y301: 3 | Z301: 0 | AA301: 976 | AB301: 791 | AC301: =(AA301*100)/AB301 -> 123.38811630847029 | AD301: =(X301*4)+(Z301*2) -> 16
A302: YARRAVILLE | C302: 0 | D302: 0 | E302: =C302*6+D302 -> 0 | G302: 0 | H302: 0 | I302: =G302*6+H302 -> 0 | K302: 0 | L302: 0 | M302: =K302*6+L302 -> 0 | O302: 11 | P302: 13 | Q302: =O302*6+P302 -> 79 | W302: WILLIAMSTOWN | X302: 4 | Y302: 3 | Z302: 0 | AA302: 859 | AB302: 812 | AC302: =(AA302*100)/AB302 -> 105.78817733990148 | AD302: =(X302*4)+(Z302*2) -> 16
A303: BEST PLAYERS | W303: WAVERLEY | X303: 2 | Y303: 5 | Z303: 0 | AA303: 847 | AB303: 947 | AC303: =(AA303*100)/AB303 -> 89.440337909186908 | AD303: =(X303*4)+(Z303*2) -> 8
A304: CAMBERWELL | W304: SUNSHINE | X304: 2 | Y304: 5 | Z304: 0 | AA304: 789 | AB304: 1080 | AC304: =(AA304*100)/AB304 -> 73.055555555555557 | AD304: =(X304*4)+(Z304*2) -> 8
A305: YARRAVILLE | W305: WERRIBEE | X305: 1 | Y305: 6 | Z305: 0 | AA305: 717 | AB305: 1272 | AC305: =(AA305*100)/AB305 -> 56.367924528301884 | AD305: =(X305*4)+(Z305*2) -> 4
A306: GOALKICKERS | W306: BOX HILL | X306: 0 | Y306: 7 | Z306: 0 | AA306: 662 | AB306: 1197 | AC306: =(AA306*100)/AB306 -> 55.304928989139512 | AD306: =(X306*4)+(Z306*2) -> 0
A307: CAMBERWELL
A308: YARRAVILLE
A310: SUNSHINE | C310: 0 | D310: 0 | E310: =C310*6+D310 -> 0 | G310: 0 | H310: 0 | I310: =G310*6+H310 -> 0 | K310: 0 | L310: 0 | M310: =K310*6+L310 -> 0 | O310: 22 | P310: 22 | Q310: =O310*6+P310 -> 154 | S310: SUNSHINE
A311: WERRIBEE | C311: 0 | D311: 0 | E311: =C311*6+D311 -> 0 | G311: 0 | H311: 0 | I311: =G311*6+H311 -> 0 | K311: 0 | L311: 0 | M311: =K311*6+L311 -> 0 | O311: 15 | P311: 16 | Q311: =O311*6+P311 -> 106
A312: BEST PLAYERS
A313: SUNSHINE
A314: WERRIBEE
A315: GOALKICKERS
A316: SUNSHINE
A317: WERRIBEE
A319: OAKLEIGH | C319: 0 | D319: 0 | E319: =C319*6+D319 -> 0 | G319: 0 | H319: 0 | I319: =G319*6+H319 -> 0 | K319: 0 | L319: 0 | M319: =K319*6+L319 -> 0 | O319: 22 | P319: 17 | Q319: =O319*6+P319 -> 149 | S319: WILLIAMSTOWN
A320: WILLIAMSTOWN | C320: 0 | D320: 0 | E320: =C320*6+D320 -> 0 | G320: 0 | H320: 0 | I320: =G320*6+H320 -> 0 | K320: 0 | L320: 0 | M320: =K320*6+L320 -> 0 | O320: 18 | P320: 11 | Q320: =O320*6+P320 -> 119
A321: BEST PLAYERS
A322: OAKLEIGH
A323: WILLIAMSTOWN
A324: GOALKICKERS
A325: OAKLEIGH
A326: WILLIAMSTOWN
A328: MORDIALLOC | C328: 0 | D328: 0 | E328: =C328*6+D328 -> 0 | G328: 0 | H328: 0 | I328: =G328*6+H328 -> 0 | K328: 0 | L328: 0 | M328: =K328*6+L328 -> 0 | O328: 36 | P328: 20 | Q328: =O328*6+P328 -> 236 | S328: MORDIALLOC
A329: BOX HILL | C329: 0 | D329: 0 | E329: =C329*6+D329 -> 0 | G329: 0 | H329: 0 | I329: =G329*6+H329 -> 0 | K329: 0 | L329: 0 | M329: =K329*6+L329 -> 0 | O329: 15 | P329: 11 | Q329: =O329*6+P329 -> 101
A330: BEST PLAYERS
A331: MORDIALLOC
A332: BOX HILL
A333: GOALKICKERS
A334: MORDIALLOC
A335: BOX HILL
A337: ROUND 8 | E337: 27TH MAY | J337: WEATHER | S337: PLAYED AT
D338: 1ST QTR | H338: 2ND QTR | L338: 3RD QTR | P338: FINAL | S338: YARRAVILLE
A339: YARRAVILLE | C339: 11 | D339: 3 | E339: =C339*6+D339 -> 69 | G339: 15 | H339: 8 | I339: =G339*6+H339 -> 98 | K339: 23 | L339: 11 | M339: =K339*6+L339 -> 149 | O339: 29 | P339: 11 | Q339: =O339*6+P339 -> 185 | S339: UMPIRE | X339: LADDER | AB339: ROUND | AD339: 8
A340: WAVERLEY | C340: 4 | D340: 3 | E340: =C340*6+D340 -> 27 | G340: 11 | H340: 6 | I340: =G340*6+H340 -> 72 | K340: 13 | L340: 7 | M340: =K340*6+L340 -> 85 | O340: 16 | P340: 10 | Q340: =O340*6+P340 -> 106 | S340: M WILSON
A341: BEST PLAYERS | W341: TEAM | X341: W | Y341: L | Z341: D | AA341: FOR | AB341: AGST | AC341: % | AD341: PTS
A342: YARRAVILLE | C342: BROWN | F342: KEOGH | I342: SHARP | K342: McFETRIDGE | O342: SIMMONS | R342: L RYAN
A343: WAVERLEY | C343: WILLIAMS | F343: P ANGELIS | I343: BARNES | K343: KINNABURGH | O343: K McDONALD | R343: ALLAN | W343: NORTHCOTE | X343: 7 | Y343: 1 | Z343: 0 | AA343: 1062 | AB343: 949 | AC343: =(AA343*100)/AB343 -> 111.9072708113804 | AD343: =(X343*4)+(Z343*2) -> 28
A344: GOALKICKERS | K344: PERRETT | M344: PAGAN | O344: KEOGH | Q344: LANCIANA | W344: CAMBERWELL | X344: 6 | Y344: 2 | Z344: 0 | AA344: 1198 | AB344: 753 | AC344: =(AA344*100)/AB344 -> 159.09694555112881 | AD344: =(X344*4)+(Z344*2) -> 24
A345: YARRAVILLE | C345: M FOTHERINGHAM 6 | G345: L RYAN 5 | I345: McFETRIDGE 4 | L345: BROWN 3 | N345: SHARP 3 | P345: HIGGINS 3 | R345: RADZIMINSKI 2 | W345: MORDIALLOC | X345: 6 | Y345: 2 | Z345: 0 | AA345: 1148 | AB345: 778 | AC345: =(AA345*100)/AB345 -> 147.55784061696659 | AD345: =(X345*4)+(Z345*2) -> 24
A346: WAVERLEY | C346: P ANGELIS 9 | F346: BARNES 2 | I346: KERR 2 | K346: MCLURE 2 | N346: COSTELLO | W346: OAKLEIGH | X346: 6 | Y346: 2 | Z346: 0 | AA346: 1186 | AB346: 815 | AC346: =(AA346*100)/AB346 -> 145.52147239263803 | AD346: =(X346*4)+(Z346*2) -> 24
A348: CAMBERWELL | C348: 5 | D348: 2 | E348: =C348*6+D348 -> 32 | G348: 7 | H348: 6 | I348: =G348*6+H348 -> 48 | K348: 10 | L348: 7 | M348: =K348*6+L348 -> 67 | O348: 13 | P348: 9 | Q348: =O348*6+P348 -> 87 | S348: CAMBERWELL | W348: YARRAVILLE | X348: 5 | Y348: 3 | Z348: 0 | AA348: 1161 | AB348: 897 | AC348: =(AA348*100)/AB348 -> 129.4314381270903 | AD348: =(X348*4)+(Z348*2) -> 20
A349: MORDIALLOC | C349: 2 | D349: 4 | E349: =C349*6+D349 -> 16 | G349: 4 | H349: 7 | I349: =G349*6+H349 -> 31 | K349: 7 | L349: 10 | M349: =K349*6+L349 -> 52 | O349: 8 | P349: 12 | Q349: =O349*6+P349 -> 60 | S349: MATTHEWS | W349: WILLIAMSTOWN | X349: 5 | Y349: 3 | Z349: 0 | AA349: 997 | AB349: 901 | AC349: =(AA349*100)/AB349 -> 110.65482796892341 | AD349: =(X349*4)+(Z349*2) -> 20
A350: BEST PLAYERS | W350: WAVERLEY | X350: 2 | Y350: 6 | Z350: 0 | AA350: 953 | AB350: 1132 | AC350: =(AA350*100)/AB350 -> 84.187279151943457 | AD350: =(X350*4)+(Z350*2) -> 8
A351: CAMBERWELL | C351: HAYWOOD | F351: NEILSON | I351: TEAKEL | K351: ROHLEDER | O351: COOK | Q351: JUDD | W351: SUNSHINE | X351: 2 | Y351: 6 | Z351: 0 | AA351: 894 | AB351: 1200 | AC351: =(AA351*100)/AB351 -> 74.5 | AD351: =(X351*4)+(Z351*2) -> 8
A352: MORDIALLOC | C352: LANG | F352: SLADE | I352: SCOTT | K352: MASON | N352: PAUL FELTHAM | R352: PETER FELTHAM | W352: WERRIBEE | X352: 1 | Y352: 7 | Z352: 0 | AA352: 806 | AB352: 1410 | AC352: =(AA352*100)/AB352 -> 57.163120567375884 | AD352: =(X352*4)+(Z352*2) -> 4
A353: GOALKICKERS | W353: BOX HILL | X353: 0 | Y353: 8 | Z353: 0 | AA353: 741 | AB353: 1312 | AC353: =(AA353*100)/AB353 -> 56.478658536585364 | AD353: =(X353*4)+(Z353*2) -> 0
A354: CAMBERWELL | C354: COWLEY 5 | F354: SIMPSON 2 | I354: NEILSON 2 | L354: HIRST 2 | N354: DAVIDSON | Q354: SLACIK
A355: MORDIALLOC | C355: NEVILLE 2 | F355: SLADE 2 | I355: GUY | K355: WILLIAMSON | N355: PAUL FELTHAM | R355: MICHAELIDES
A357: NORTHCOTE | C357: 2 | D357: 5 | E357: =C357*6+D357 -> 17 | G357: 8 | H357: 14 | I357: =G357*6+H357 -> 62 | K357: 13 | L357: 19 | M357: =K357*6+L357 -> 97 | O357: 16 | P357: 24 | Q357: =O357*6+P357 -> 120 | S357: NORTHCOTE
A358: SUNSHINE | C358: 4 | D358: 6 | E358: =C358*6+D358 -> 30 | G358: 9 | H358: 6 | I358: =G358*6+H358 -> 60 | K358: 12 | L358: 12 | M358: =K358*6+L358 -> 84 | O358: 15 | P358: 15 | Q358: =O358*6+P358 -> 105 | S358: TORNEY
A359: BEST PLAYERS
A360: NORTHCOTE | C360: M RYAN | F360: McQUINN | I360: EDWARDS | L360: G SMITH | O360: WATTS | R360: G RYAN
A361: SUNSHINE | C361: FOLEY | F361: BENSON | I361: PETER SIMPSON | L361: REDENBACH | O361: MEMBREY | R361: T BRETT
A362: GOALKICKERS
A363: NORTHCOTE | C363: SMITH 4 | E363: GRAHAM 3 | H363: WATTS 2 | J363: OLIVERI 2 | L363: G RYAN 2 | N363: THORNELOE | Q363: G HOLLAND | S363: MITCHELL
A364: SUNSHINE | C364: SAID 3 | E364: THEODARIDES 2 | H364: MATHEWS 2 | K364: T BRETT 2 | N364: REDENBACH 2 | Q364: MENADUE 2 | S364: PETER SIMPSON 2
A366: WILLIAMSTOWN | C366: 7 | D366: 5 | E366: =C366*6+D366 -> 47 | G366: 12 | H366: 9 | I366: =G366*6+H366 -> 81 | K366: 16 | L366: 11 | M366: =K366*6+L366 -> 107 | O366: 20 | P366: 18 | Q366: =O366*6+P366 -> 138 | S366: WERRIBEE
A367: WERRIBEE | C367: 3 | D367: 5 | E367: =C367*6+D367 -> 23 | G367: 7 | H367: 8 | I367: =G367*6+H367 -> 50 | K367: 7 | L367: 10 | M367: =K367*6+L367 -> 52 | O367: 13 | P367: 11 | Q367: =O367*6+P367 -> 89 | S367: STABB
A368: BEST PLAYERS
A369: WILLIAMSTOWN | C369: KENNEDY | F369: KERR | I369: PHILPOTT | L369: LAVELLE | O369: M TAYLOR | R369: COURTOT
A370: WERRIBEE | C370: JACK | F370: SQUIRE | I370: HASSETT | L370: HUGHES | O370: MARTIN | R370: LANCASTER
A371: GOALKICKERS
A372: WILLIAMSTOWN | C372: LAVELLE 6 | F372: McVEIGH 3 | I372: CROSS 3 | K372: TWEEDLY 2 | N372: DOYLE 2 | P372: ENRIGHT | R372: WALSH | T372: SHEEHAN | W372: BEBEND
A373: WERRIBEE | C373: HUGHES 4 | F373: MARTIN 3 | I373: HAVARD 2 | L373: LANCASTER | O373: CHAMBERLAIN | R373: NUSPAN | U373: MEMBREY
A375: OAKLEIGH | C375: 4 | D375: 5 | E375: =C375*6+D375 -> 29 | G375: 10 | H375: 8 | I375: =G375*6+H375 -> 68 | K375: 15 | L375: 12 | M375: =K375*6+L375 -> 102 | O375: 16 | P375: 19 | Q375: =O375*6+P375 -> 115 | S375: OAKLEIGH
A376: BOX HILL | C376: 2 | D376: 2 | E376: =C376*6+D376 -> 14 | G376: 4 | H376: 9 | I376: =G376*6+H376 -> 33 | K376: 6 | L376: 9 | M376: =K376*6+L376 -> 45 | O376: 11 | P376: 13 | Q376: =O376*6+P376 -> 79 | S376: STEERE
A377: BEST PLAYERS
A378: OAKLEIGH | C378: GOODMAN | F378: BRUERTON | I378: THOMPSON | L378: CURTAIN | O378: WENN | R378: HEVERIN
A379: BOX HILL | C379: HARPER | F379: TAYLOR | I379: ROBINSON | L379: SAUNDERS | O379: RALPH | R379: CRUSE
A380: GOALKICKERS
A381: OAKLEIGH | C381: WENN 3 | E381: GOODMAN 3 | H381: THOMAS 2 | J381: CURTAIN 2 | L381: D MILLER 2 | O381: HEVERIN | Q381: LEISHMAN | S381: DUNN | U381: PAGNOCCOLO
A382: BOX HILL | C382: McLERIE 3 | F382: RICH 3 | H382: RALPH 2 | J382: LAWTHER | M382: McGETTIGAN | P382: HALE
A384: ROUND 9 | E384: 3RD JUNE | J384: WEATHER | S384: PLAYED AT
D385: 1ST QTR | H385: 2ND QTR | L385: 3RD QTR | P385: FINAL | S385: WAVERLEY
A386: CAMBERWELL | C386: 0 | D386: 0 | E386: =C386*6+D386 -> 0 | G386: 0 | H386: 0 | I386: =G386*6+H386 -> 0 | K386: 0 | L386: 0 | M386: =K386*6+L386 -> 0 | O386: 28 | P386: 16 | Q386: =O386*6+P386 -> 184 | S386: UMPIRE | X386: LADDER | AB386: ROUND | AD386: 9
A387: WAVERLEY | C387: 0 | D387: 0 | E387: =C387*6+D387 -> 0 | G387: 0 | H387: 0 | I387: =G387*6+H387 -> 0 | K387: 0 | L387: 0 | M387: =K387*6+L387 -> 0 | O387: 12 | P387: 20 | Q387: =O387*6+P387 -> 92
A388: BEST PLAYERS | W388: TEAM | X388: W | Y388: L | Z388: D | AA388: FOR | AB388: AGST | AC388: % | AD388: PTS
A389: CAMBERWELL
A390: WAVERLEY | W390: CAMBERWELL | X390: 7 | Y390: 2 | Z390: 0 | AA390: 1212 | AB390: 845 | AC390: =(AA390*100)/AB390 -> 143.4319526627219 | AD390: =(X390*4)+(Z390*2) -> 28
A391: GOALKICKERS | W391: OAKLEIGH | X391: 7 | Y391: 2 | Z391: 0 | AA391: 1356 | AB391: 970 | AC391: =(AA391*100)/AB391 -> 139.79381443298968 | AD391: =(X391*4)+(Z391*2) -> 28
A392: CAMBERWELL | W392: NORTHCOTE | X392: 7 | Y392: 2 | Z392: 0 | AA392: 1180 | AB392: 1130 | AC392: =(AA392*100)/AB392 -> 104.42477876106194 | AD392: =(X392*4)+(Z392*2) -> 28
A393: WAVERLEY | W393: MORDIALLOC | X393: 6 | Y393: 3 | Z393: 0 | AA393: 1303 | AB393: 948 | AC393: =(AA393*100)/AB393 -> 137.44725738396625 | AD393: =(X393*4)+(Z393*2) -> 24
A395: WILLIAMSTOWN | C395: 0 | D395: 0 | E395: =C395*6+D395 -> 0 | G395: 0 | H395: 0 | I395: =G395*6+H395 -> 0 | K395: 0 | L395: 0 | M395: =K395*6+L395 -> 0 | O395: 27 | P395: 19 | Q395: =O395*6+P395 -> 181 | S395: WILLIAMSTOWN | W395: YARRAVILLE | X395: 6 | Y395: 3 | Z395: 0 | AA395: 1262 | AB395: 988 | AC395: =(AA395*100)/AB395 -> 127.7327935222672 | AD395: =(X395*4)+(Z395*2) -> 24
A396: NORTHCOTE | C396: 0 | D396: 0 | E396: =C396*6+D396 -> 0 | G396: 0 | H396: 0 | I396: =G396*6+H396 -> 0 | K396: 0 | L396: 0 | M396: =K396*6+L396 -> 0 | O396: 17 | P396: 16 | Q396: =O396*6+P396 -> 118 | W396: WILLIAMSTOWN | X396: 6 | Y396: 3 | Z396: 0 | AA396: 1178 | AB396: 1019 | AC396: =(AA396*100)/AB396 -> 115.603532875368 | AD396: =(X396*4)+(Z396*2) -> 24
A397: BEST PLAYERS | W397: WAVERLEY | X397: 2 | Y397: 7 | Z397: 0 | AA397: 1045 | AB397: 1316 | AC397: =(AA397*100)/AB397 -> 79.40729483282675 | AD397: =(X397*4)+(Z397*2) -> 8
A398: WILLIAMSTOWN | W398: SUNSHINE | X398: 2 | Y398: 7 | Z398: 0 | AA398: 985 | AB398: 1301 | AC398: =(AA398*100)/AB398 -> 75.71099154496541 | AD398: =(X398*4)+(Z398*2) -> 8
A399: NORTHCOTE | W399: BOX HILL | X399: 1 | Y399: 8 | Z399: 0 | AA399: 872 | AB399: 1435 | AC399: =(AA399*100)/AB399 -> 60.766550522648082 | AD399: =(X399*4)+(Z399*2) -> 4
A400: GOALKICKERS | W400: WERRIBEE | X400: 1 | Y400: 8 | Z400: 0 | AA400: 929 | AB400: 1541 | AC400: =(AA400*100)/AB400 -> 60.28552887735237 | AD400: =(X400*4)+(Z400*2) -> 4
A401: WILLIAMSTOWN
A402: NORTHCOTE
A404: OAKLEIGH | C404: 0 | D404: 0 | E404: =C404*6+D404 -> 0 | G404: 0 | H404: 0 | I404: =G404*6+H404 -> 0 | K404: 0 | L404: 0 | M404: =K404*6+L404 -> 0 | O404: 26 | P404: 14 | Q404: =O404*6+P404 -> 170 | S404: MORDIALLOC
A405: MORDIALLOC | C405: 0 | D405: 0 | E405: =C405*6+D405 -> 0 | G405: 0 | H405: 0 | I405: =G405*6+H405 -> 0 | K405: 0 | L405: 0 | M405: =K405*6+L405 -> 0 | O405: 24 | P405: 11 | Q405: =O405*6+P405 -> 155
A406: BEST PLAYERS
A407: OAKLEIGH
A408: MORDIALLOC
A409: GOALKICKERS
A410: OAKLEIGH
A411: MORDIALLOC
A413: YARRAVILLE | C413: 0 | D413: 0 | E413: =C413*6+D413 -> 0 | G413: 0 | H413: 0 | I413: =G413*6+H413 -> 0 | K413: 0 | L413: 0 | M413: =K413*6+L413 -> 0 | O413: 14 | P413: 17 | Q413: =O413*6+P413 -> 101 | S413: SUNSHINE
A414: SUNSHINE | C414: 0 | D414: 0 | E414: =C414*6+D414 -> 0 | G414: 0 | H414: 0 | I414: =G414*6+H414 -> 0 | K414: 0 | L414: 0 | M414: =K414*6+L414 -> 0 | O414: 14 | P414: 7 | Q414: =O414*6+P414 -> 91
A415: BEST PLAYERS
A416: YARRAVILLE
A417: SUNSHINE
A418: GOALKICKERS
A419: YARRAVILLE
A420: SUNSHINE
A422: BOX HILL | C422: 0 | D422: 0 | E422: =C422*6+D422 -> 0 | G422: 0 | H422: 0 | I422: =G422*6+H422 -> 0 | K422: 0 | L422: 0 | M422: =K422*6+L422 -> 0 | O422: 19 | P422: 17 | Q422: =O422*6+P422 -> 131 | S422: BOX HILL
A423: WERRIBEE | C423: 0 | D423: 0 | E423: =C423*6+D423 -> 0 | G423: 0 | H423: 0 | I423: =G423*6+H423 -> 0 | K423: 0 | L423: 0 | M423: =K423*6+L423 -> 0 | O423: 18 | P423: 15 | Q423: =O423*6+P423 -> 123
A424: BEST PLAYERS
A425: BOX HILL
A426: WERRIBEE
A427: GOALKICKERS
A428: BOX HILL
A429: WERRIBEE
A431: ROUND 10 | E431: 10TH JUNE | J431: WEATHER | S431: PLAYED AT
D432: 1ST QTR | H432: 2ND QTR | L432: 3RD QTR | P432: FINAL | S432: MORDIALLOC
A433: MORDIALLOC | C433: 0 | D433: 0 | E433: =C433*6+D433 -> 0 | G433: 0 | H433: 0 | I433: =G433*6+H433 -> 0 | K433: 0 | L433: 0 | M433: =K433*6+L433 -> 0 | O433: 19 | P433: 18 | Q433: =O433*6+P433 -> 132 | S433: UMPIRE | X433: LADDER | AB433: ROUND | AD433: 10
A434: WAVERLEY | C434: 0 | D434: 0 | E434: =C434*6+D434 -> 0 | G434: 0 | H434: 0 | I434: =G434*6+H434 -> 0 | K434: 0 | L434: 0 | M434: =K434*6+L434 -> 0 | O434: 11 | P434: 11 | Q434: =O434*6+P434 -> 77
A435: BEST PLAYERS | W435: TEAM | X435: W | Y435: L | Z435: D | AA435: FOR | AB435: AGST | AC435: % | AD435: PTS
A436: MORDIALLOC
A437: WAVERLEY | W437: OAKLEIGH | X437: 8 | Y437: 2 | Z437: 0 | AA437: 1492 | AB437: 1054 | AC437: =(AA437*100)/AB437 -> 141.55597722960152 | AD437: =(X437*4)+(Z437*2) -> 32
A438: GOALKICKERS | W438: CAMBERWELL | X438: 8 | Y438: 2 | Z438: 0 | AA438: 1327 | AB438: 949 | AC438: =(AA438*100)/AB438 -> 139.8314014752371 | AD438: =(X438*4)+(Z438*2) -> 32
A439: MORDIALLOC | W439: NORTHCOTE | X439: 8 | Y439: 2 | Z439: 0 | AA439: 1323 | AB439: 1171 | AC439: =(AA439*100)/AB439 -> 112.98035866780529 | AD439: =(X439*4)+(Z439*2) -> 32
A440: WAVERLEY | W440: MORDIALLOC | X440: 7 | Y440: 3 | Z440: 0 | AA440: 1435 | AB440: 1025 | AC440: =(AA440*100)/AB440 -> 140 | AD440: =(X440*4)+(Z440*2) -> 28
A442: CAMBERWELL | C442: 0 | D442: 0 | E442: =C442*6+D442 -> 0 | G442: 0 | H442: 0 | I442: =G442*6+H442 -> 0 | K442: 0 | L442: 0 | M442: =K442*6+L442 -> 0 | O442: 16 | P442: 19 | Q442: =O442*6+P442 -> 115 | S442: SUNSHINE | W442: WILLIAMSTOWN | X442: 7 | Y442: 3 | Z442: 0 | AA442: 1362 | AB442: 1084 | AC442: =(AA442*100)/AB442 -> 125.64575645756457 | AD442: =(X442*4)+(Z442*2) -> 28
A443: SUNSHINE | C443: 0 | D443: 0 | E443: =C443*6+D443 -> 0 | G443: 0 | H443: 0 | I443: =G443*6+H443 -> 0 | K443: 0 | L443: 0 | M443: =K443*6+L443 -> 0 | O443: 15 | P443: 14 | Q443: =O443*6+P443 -> 104 | W443: YARRAVILLE | X443: 6 | Y443: 4 | Z443: 0 | AA443: 1327 | AB443: 1172 | AC443: =(AA443*100)/AB443 -> 113.22525597269625 | AD443: =(X443*4)+(Z443*2) -> 24
A444: BEST PLAYERS | W444: WAVERLEY | X444: 2 | Y444: 8 | Z444: 0 | AA444: 1122 | AB444: 1448 | AC444: =(AA444*100)/AB444 -> 77.486187845303874 | AD444: =(X444*4)+(Z444*2) -> 8
A445: CAMBERWELL | W445: SUNSHINE | X445: 2 | Y445: 8 | Z445: 0 | AA445: 1089 | AB445: 1416 | AC445: =(AA445*100)/AB445 -> 76.906779661016955 | AD445: =(X445*4)+(Z445*2) -> 8
A446: SUNSHINE | W446: WERRIBEE | X446: 1 | Y446: 9 | Z446: 0 | AA446: 1013 | AB446: 1677 | AC446: =(AA446*100)/AB446 -> 60.405485986881338 | AD446: =(X446*4)+(Z446*2) -> 4
A447: GOALKICKERS | W447: BOX HILL | X447: 1 | Y447: 9 | Z447: 0 | AA447: 913 | AB447: 1578 | AC447: =(AA447*100)/AB447 -> 57.858048162230673 | AD447: =(X447*4)+(Z447*2) -> 4
A448: CAMBERWELL
A449: SUNSHINE
A451: WILLIAMSTOWN | C451: 0 | D451: 0 | E451: =C451*6+D451 -> 0 | G451: 0 | H451: 0 | I451: =G451*6+H451 -> 0 | K451: 0 | L451: 0 | M451: =K451*6+L451 -> 0 | O451: 27 | P451: 22 | Q451: =O451*6+P451 -> 184 | S451: WILLIAMSTOWN
A452: YARRAVILLE | C452: 0 | D452: 0 | E452: =C452*6+D452 -> 0 | G452: 0 | H452: 0 | I452: =G452*6+H452 -> 0 | K452: 0 | L452: 0 | M452: =K452*6+L452 -> 0 | O452: 9 | P452: 11 | Q452: =O452*6+P452 -> 65
A453: BEST PLAYERS
A454: WILLIAMSTOWN
A455: YARRAVILLE
A456: GOALKICKERS
A457: WILLIAMSTOWN
A458: YARRAVILLE
A460: NORTHCOTE | C460: 0 | D460: 0 | E460: =C460*6+D460 -> 0 | G460: 0 | H460: 0 | I460: =G460*6+H460 -> 0 | K460: 0 | L460: 0 | M460: =K460*6+L460 -> 0 | O460: 21 | P460: 17 | Q460: =O460*6+P460 -> 143 | S460: BOX HILL
A461: BOX HILL | C461: 0 | D461: 0 | E461: =C461*6+D461 -> 0 | G461: 0 | H461: 0 | I461: =G461*6+H461 -> 0 | K461: 0 | L461: 0 | M461: =K461*6+L461 -> 0 | O461: 5 | P461: 11 | Q461: =O461*6+P461 -> 41
A462: BEST PLAYERS
A463: NORTHCOTE
A464: BOX HILL
A465: GOALKICKERS
A466: NORTHCOTE
A467: BOX HILL
A469: OAKLEIGH | C469: 0 | D469: 0 | E469: =C469*6+D469 -> 0 | G469: 0 | H469: 0 | I469: =G469*6+H469 -> 0 | K469: 0 | L469: 0 | M469: =K469*6+L469 -> 0 | O469: 18 | P469: 28 | Q469: =O469*6+P469 -> 136 | S469: OAKLEIGH
A470: WERRIBEE | C470: 0 | D470: 0 | E470: =C470*6+D470 -> 0 | G470: 0 | H470: 0 | I470: =G470*6+H470 -> 0 | K470: 0 | L470: 0 | M470: =K470*6+L470 -> 0 | O470: 13 | P470: 6 | Q470: =O470*6+P470 -> 84
A471: BEST PLAYERS
A472: OAKLEIGH
A473: WERRIBEE
A474: GOALKICKERS
A475: OAKLEIGH
A476: WERRIBEE
A478: ROUND 11 | E478: 24TH JUNE | J478: WEATHER | S478: PLAYED AT
D479: 1ST QTR | H479: 2ND QTR | L479: 3RD QTR | P479: FINAL | S479: WAVERLEY
A480: WAVERLEY | C480: 0 | D480: 0 | E480: =C480*6+D480 -> 0 | G480: 0 | H480: 0 | I480: =G480*6+H480 -> 0 | K480: 0 | L480: 0 | M480: =K480*6+L480 -> 0 | O480: 33 | P480: 26 | Q480: =O480*6+P480 -> 224 | S480: UMPIRE | X480: LADDER | AB480: ROUND | AD480: 11
A481: SUNSHINE | C481: 0 | D481: 0 | E481: =C481*6+D481 -> 0 | G481: 0 | H481: 0 | I481: =G481*6+H481 -> 0 | K481: 0 | L481: 0 | M481: =K481*6+L481 -> 0 | O481: 19 | P481: 13 | Q481: =O481*6+P481 -> 127
A482: BEST PLAYERS | W482: TEAM | X482: W | Y482: L | Z482: D | AA482: FOR | AB482: AGST | AC482: % | AD482: PTS
A483: WAVERLEY
A484: SUNSHINE | W484: OAKLEIGH | X484: 9 | Y484: 2 | Z484: 0 | AA484: 1605 | AB484: 1140 | AC484: =(AA484*100)/AB484 -> 140.78947368421052 | AD484: =(X484*4)+(Z484*2) -> 36
A485: GOALKICKERS | W485: CAMBERWELL | X485: 9 | Y485: 2 | Z485: 0 | AA485: 1454 | AB485: 1044 | AC485: =(AA485*100)/AB485 -> 139.272030651341 | AD485: =(X485*4)+(Z485*2) -> 36
A486: WAVERLEY | W486: MORDIALLOC | X486: 8 | Y486: 3 | Z486: 0 | AA486: 1616 | AB486: 1149 | AC486: =(AA486*100)/AB486 -> 140.64403829416884 | AD486: =(X486*4)+(Z486*2) -> 32
A487: SUNSHINE | W487: NORTHCOTE | X487: 8 | Y487: 3 | Z487: 0 | AA487: 1409 | AB487: 1284 | AC487: =(AA487*100)/AB487 -> 109.73520249221184 | AD487: =(X487*4)+(Z487*2) -> 32
A489: CAMBERWELL | C489: 0 | D489: 0 | E489: =C489*6+D489 -> 0 | G489: 0 | H489: 0 | I489: =G489*6+H489 -> 0 | K489: 0 | L489: 0 | M489: =K489*6+L489 -> 0 | O489: 18 | P489: 19 | Q489: =O489*6+P489 -> 127 | S489: CAMBERWELL | W489: YARRAVILLE | X489: 7 | Y489: 4 | Z489: 0 | AA489: 1511 | AB489: 1246 | AC489: =(AA489*100)/AB489 -> 121.26805778491172 | AD489: =(X489*4)+(Z489*2) -> 28
A490: WILLIAMSTOWN | C490: 0 | D490: 0 | E490: =C490*6+D490 -> 0 | G490: 0 | H490: 0 | I490: =G490*6+H490 -> 0 | K490: 0 | L490: 0 | M490: =K490*6+L490 -> 0 | O490: 13 | P490: 17 | Q490: =O490*6+P490 -> 95 | W490: WILLIAMSTOWN | X490: 7 | Y490: 4 | Z490: 0 | AA490: 1457 | AB490: 1211 | AC490: =(AA490*100)/AB490 -> 120.31379025598679 | AD490: =(X490*4)+(Z490*2) -> 28
A491: BEST PLAYERS | W491: WAVERLEY | X491: 3 | Y491: 8 | Z491: 0 | AA491: 1346 | AB491: 1575 | AC491: =(AA491*100)/AB491 -> 85.460317460317455 | AD491: =(X491*4)+(Z491*2) -> 12
A492: CAMBERWELL | W492: SUNSHINE | X492: 2 | Y492: 9 | Z492: 0 | AA492: 1216 | AB492: 1640 | AC492: =(AA492*100)/AB492 -> 74.146341463414629 | AD492: =(X492*4)+(Z492*2) -> 8
A493: WILLIAMSTOWN | W493: WERRIBEE | X493: 1 | Y493: 10 | Z493: 0 | AA493: 1137 | AB493: 1858 | AC493: =(AA493*100)/AB493 -> 61.194833153928954 | AD493: =(X493*4)+(Z493*2) -> 4
A494: GOALKICKERS | W494: BOX HILL | X494: 1 | Y494: 10 | Z494: 0 | AA494: 987 | AB494: 1762 | AC494: =(AA494*100)/AB494 -> 56.015891032917139 | AD494: =(X494*4)+(Z494*2) -> 4
A495: CAMBERWELL
A496: WILLIAMSTOWN
A498: YARRAVILLE | C498: 0 | D498: 0 | E498: =C498*6+D498 -> 0 | G498: 0 | H498: 0 | I498: =G498*6+H498 -> 0 | K498: 0 | L498: 0 | M498: =K498*6+L498 -> 0 | O498: 28 | P498: 16 | Q498: =O498*6+P498 -> 184 | S498: YARRAVILLE
A499: BOX HILL | C499: 0 | D499: 0 | E499: =C499*6+D499 -> 0 | G499: 0 | H499: 0 | I499: =G499*6+H499 -> 0 | K499: 0 | L499: 0 | M499: =K499*6+L499 -> 0 | O499: 11 | P499: 8 | Q499: =O499*6+P499 -> 74
A500: BEST PLAYERS
A501: YARRAVILLE
A502: BOX HILL
A503: GOALKICKERS
A504: YARRAVILLE
A505: BOX HILL
A507: OAKLEIGH | C507: 0 | D507: 0 | E507: =C507*6+D507 -> 0 | G507: 0 | H507: 0 | I507: =G507*6+H507 -> 0 | K507: 0 | L507: 0 | M507: =K507*6+L507 -> 0 | O507: 16 | P507: 17 | Q507: =O507*6+P507 -> 113 | S507: NORTHCOTE
A508: NORTHCOTE | C508: 0 | D508: 0 | E508: =C508*6+D508 -> 0 | G508: 0 | H508: 0 | I508: =G508*6+H508 -> 0 | K508: 0 | L508: 0 | M508: =K508*6+L508 -> 0 | O508: 12 | P508: 14 | Q508: =O508*6+P508 -> 86
A509: BEST PLAYERS
A510: OAKLEIGH
A511: NORTHCOTE
A512: GOALKICKERS
A513: OAKLEIGH
A514: NORTHCOTE
A516: MORDIALLOC | C516: 0 | D516: 0 | E516: =C516*6+D516 -> 0 | G516: 0 | H516: 0 | I516: =G516*6+H516 -> 0 | K516: 0 | L516: 0 | M516: =K516*6+L516 -> 0 | O516: 28 | P516: 13 | Q516: =O516*6+P516 -> 181 | S516: WERRIBEE
A517: WERRIBEE | C517: 0 | D517: 0 | E517: =C517*6+D517 -> 0 | G517: 0 | H517: 0 | I517: =G517*6+H517 -> 0 | K517: 0 | L517: 0 | M517: =K517*6+L517 -> 0 | O517: 19 | P517: 10 | Q517: =O517*6+P517 -> 124
A518: BEST PLAYERS
A519: MORDIALLOC
A520: WERRIBEE
A521: GOALKICKERS
A522: MORDIALLOC
A523: WERRIBEE
A525: ROUND 12 | E525: 1ST JULY | J525: WEATHER | S525: PLAYED AT
D526: 1ST QTR | H526: 2ND QTR | L526: 3RD QTR | P526: FINAL | S526: WILLIAMSTOWN
A527: WILLIAMSTOWN | C527: 4 | D527: 6 | E527: =C527*6+D527 -> 30 | G527: 7 | H527: 7 | I527: =G527*6+H527 -> 49 | K527: 11 | L527: 10 | M527: =K527*6+L527 -> 76 | O527: 15 | P527: 16 | Q527: =O527*6+P527 -> 106 | S527: UMPIRE | X527: LADDER | AB527: ROUND | AD527: 12
A528: WAVERLEY | C528: 4 | D528: 2 | E528: =C528*6+D528 -> 26 | G528: 7 | H528: 11 | I528: =G528*6+H528 -> 53 | K528: 8 | L528: 15 | M528: =K528*6+L528 -> 63 | O528: 13 | P528: 21 | Q528: =O528*6+P528 -> 99 | S528: CASEY
A529: BEST PLAYERS | W529: TEAM | X529: W | Y529: L | Z529: D | AA529: FOR | AB529: AGST | AC529: % | AD529: PTS
A530: WILLIAMSTOWN | C530: MILDENHALL | F530: SHEEAHN | I530: COURTOT | L530: WALSH | O530: ENRIGHT | R530: McTAGGART
A531: WAVERLEY | C531: BARNES | F531: STYLES | I531: McLURE | K531: DEREK HARRINGTON | O531: ALLAN | R531: KINNABURGH | W531: OAKLEIGH | X531: 10 | Y531: 2 | Z531: 0 | AA531: 1756 | AB531: 1230 | AC531: =(AA531*100)/AB531 -> 142.76422764227641 | AD531: =(X531*4)+(Z531*2) -> 40
A532: GOALKICKERS | P532: WALSH | W532: CAMBERWELL | X532: 10 | Y532: 2 | Z532: 0 | AA532: 1581 | AB532: 1132 | AC532: =(AA532*100)/AB532 -> 139.66431095406361 | AD532: =(X532*4)+(Z532*2) -> 40
A533: WILLIAMSTOWN | C533: L TAYLOR 3 | F533: JOHN 3 | H533: PHILPOTT 2 | K533: CROSS 2 | M533: GANNON | O533: LAVELLE | Q533: McTAGGART | S533: ENRIGHT | W533: MORDIALLOC | X533: 9 | Y533: 3 | Z533: 0 | AA533: 1776 | AB533: 1195 | AC533: =(AA533*100)/AB533 -> 148.61924686192469 | AD533: =(X533*4)+(Z533*2) -> 36
A534: WAVERLEY | C534: P ANGELIS 3 | F534: COSTELLO 3 | I534: BARNES 3 | K534: McLURE | M534: COLLINS | O534: DANE HARRINGTON | S534: WESTROPE | W534: NORTHCOTE | X534: 9 | Y534: 3 | Z534: 0 | AA534: 1569 | AB534: 1366 | AC534: =(AA534*100)/AB534 -> 114.86090775988286 | AD534: =(X534*4)+(Z534*2) -> 36
A536: CAMBERWELL | C536: 5 | D536: 5 | E536: =C536*6+D536 -> 35 | G536: 8 | H536: 12 | I536: =G536*6+H536 -> 60 | K536: 13 | L536: 17 | M536: =K536*6+L536 -> 95 | O536: 17 | P536: 25 | Q536: =O536*6+P536 -> 127 | S536: BOX HILL | W536: WILLIAMSTOWN | X536: 8 | Y536: 4 | Z536: 0 | AA536: 1563 | AB536: 1310 | AC536: =(AA536*100)/AB536 -> 119.31297709923665 | AD536: =(X536*4)+(Z536*2) -> 32
A537: BOX HILL | C537: 5 | D537: 1 | E537: =C537*6+D537 -> 31 | G537: 10 | H537: 2 | I537: =G537*6+H537 -> 62 | K537: 11 | L537: 2 | M537: =K537*6+L537 -> 68 | O537: 14 | P537: 4 | Q537: =O537*6+P537 -> 88 | S537: MATHEWS | W537: YARRAVILLE | X537: 7 | Y537: 5 | Z537: 0 | AA537: 1601 | AB537: 1397 | AC537: =(AA537*100)/AB537 -> 114.60272011453114 | AD537: =(X537*4)+(Z537*2) -> 28
A538: BEST PLAYERS | W538: WAVERLEY | X538: 3 | Y538: 9 | Z538: 0 | AA538: 1445 | AB538: 1681 | AC538: =(AA538*100)/AB538 -> 85.96073765615705 | AD538: =(X538*4)+(Z538*2) -> 12
A539: CAMBERWELL | C539: COWLEY | F539: ALEXEEF | I539: WRIGHT | L539: COOK | N539: JUDD | Q539: HAYWOOD | W539: SUNSHINE | X539: 2 | Y539: 10 | Z539: 0 | AA539: 1262 | AB539: 1810 | AC539: =(AA539*100)/AB539 -> 69.723756906077341 | AD539: =(X539*4)+(Z539*2) -> 8
A540: BOX HILL | C540: ROBINSON | F540: RALPH | I540: FLANAGAN | L540: CRUSE | N540: DICKENSON | Q540: LAWTHER | W540: WERRIBEE | X540: 1 | Y540: 11 | Z540: 0 | AA540: 1219 | AB540: 2018 | AC540: =(AA540*100)/AB540 -> 60.406342913776015 | AD540: =(X540*4)+(Z540*2) -> 4
A541: GOALKICKERS | W541: BOX HILL | X541: 1 | Y541: 11 | Z541: 0 | AA541: 1075 | AB541: 1889 | AC541: =(AA541*100)/AB541 -> 56.908417151932241 | AD541: =(X541*4)+(Z541*2) -> 4
A542: CAMBERWELL | C542: COWLEY 6 | F542: HARROP 5 | I542: HIRST 2 | K542: HAYWOOD | N542: SIMPSON | P542: SPITHILL | R542: NEILSON
A543: BOX HILL | C543: CRUSE 4 | F543: McGETTIGAN 4 | I543: McLERIE 2 | K543: LAWTHER 2 | N543: FLANAGAN 2
A545: OAKLEIGH | C545: 9 | D545: 4 | E545: =C545*6+D545 -> 58 | G545: 13 | H545: 10 | I545: =G545*6+H545 -> 88 | K545: 20 | L545: 15 | M545: =K545*6+L545 -> 135 | O545: 22 | P545: 19 | Q545: =O545*6+P545 -> 151 | S545: OAKLEIGH
A546: YARRAVILLE | C546: 4 | D546: 2 | E546: =C546*6+D546 -> 26 | G546: 7 | H546: 4 | I546: =G546*6+H546 -> 46 | K546: 12 | L546: 7 | M546: =K546*6+L546 -> 79 | O546: 13 | P546: 12 | Q546: =O546*6+P546 -> 90 | S546: SNOOKS
A547: BEST PLAYERS
A548: OAKLEIGH | C548: WENN | F548: THOMPSON | I548: D MILLER | L548: GOODMAN | O548: TESSERIERO | R548: CURTIN
A549: YARRAVILLE | C549: SIMMONS | F549: WARD | I549: SAIT | L549: SHARP | O549: PAGAN | R549: M FOTHERINGHAM
A550: GOALKICKERS
A551: OAKLEIGH | C551: D MILLER 6 | F551: TOCKNELL 4 | I551: McDONALD 4 | L551: GOODMAN 2 | O551: WENN 2 | Q551: THOMAS 2 | S551: TESSERIERO | V551: NEARY
A552: YARRAVILLE | C552: M FOTHERINGHAM 5 | G552: SAIT 4 | I552: RADZIMINSKI 2 | L552: SHARP | N552: DI NATALE
A554: NORTHCOTE | C554: 7 | D554: 4 | E554: =C554*6+D554 -> 46 | G554: 13 | H554: 5 | I554: =G554*6+H554 -> 83 | K554: 17 | L554: 11 | M554: =K554*6+L554 -> 113 | O554: 24 | P554: 16 | Q554: =O554*6+P554 -> 160 | S554: WERRIBEE
A555: WERRIBEE | C555: 3 | D555: 2 | E555: =C555*6+D555 -> 20 | G555: 7 | H555: 6 | I555: =G555*6+H555 -> 48 | K555: 8 | L555: 10 | M555: =K555*6+L555 -> 58 | O555: 11 | P555: 16 | Q555: =O555*6+P555 -> 82 | S555: M WILSON
A556: BEST PLAYERS
A557: NORTHCOTE | C557: A HOLLAND | F557: WATTS | I557: ROBERTS | L557: G RYAN | O557: McQUIN | R557: BRAIN
A558: WERRIBEE | C558: KNIGHT | F558: NUSPAN | I558: MEMBREY | L558: DOUGLAS | O558: MANNIX
A559: GOALKICKERS
A560: NORTHCOTE | C560: A HOLLAND 4 | F560: OLIVERI 4 | H560: M RYAN 3 | J560: WATTS 3 | L560: PROWSE 3 | N560: GREGURIK 3 | P560: MEGNA | R560: THORNELOE | T560: G RYAN | V560: McQUIN
A561: WERRIBEE | C561: JACK 3 | E561: MEMBREY 3 | H561: EVANS 2 | J561: MARTIN | L561: CHAMBERLAIN | O561: MANNIX
A563: MORDIALLOC | C563: 5 | D563: 9 | E563: =C563*6+D563 -> 39 | G563: 9 | H563: 13 | I563: =G563*6+H563 -> 67 | K563: 16 | L563: 15 | M563: =K563*6+L563 -> 111 | O563: 25 | P563: 20 | Q563: =O563*6+P563 -> 170 | S563: MORDIALLOC
A564: SUNSHINE | C564: 0 | D564: 4 | E564: =C564*6+D564 -> 4 | G564: 1 | H564: 5 | I564: =G564*6+H564 -> 11 | K564: 4 | L564: 9 | M564: =K564*6+L564 -> 33 | O564: 6 | P564: 10 | Q564: =O564*6+P564 -> 46 | S564: VERGONA
A565: BEST PLAYERS
A566: MORDIALLOC | C566: GUY | E566: SCOTT | H566: MOORE | K566: SLADE | N566: NEVILLE | Q566: McILWRAITH
A567: SUNSHINE | C567: BAIRD | E567: L BRETT | H567: A SCHROEDER | K567: SIMPSON | N567: MATHEWS | Q567: SAID
A568: GOALKICKERS
A569: MORDIALLOC | C569: NEVILLE 11 | F569: DEATON 4 | I569: WALSH 3 | K569: McILWRAITH 3 | N569: WILLIAMSON 2 | Q569: W FELTHAM | T569: SLADE
A570: SUNSHINE | C570: SAID 4 | F570: A SCHROEDER | I570: FOLEY
A572: ROUND 13 | E572: 8TH JULY | J572: WEATHER | S572: PLAYED AT
D573: 1ST QTR | H573: 2ND QTR | L573: 3RD QTR | P573: FINAL | S573: CAMBERWELL
A574: CAMBERWELL | C574: 0 | D574: 0 | E574: =C574*6+D574 -> 0 | G574: 0 | H574: 0 | I574: =G574*6+H574 -> 0 | K574: 0 | L574: 0 | M574: =K574*6+L574 -> 0 | O574: 24 | P574: 15 | Q574: =O574*6+P574 -> 159 | S574: UMPIRE | X574: LADDER | AB574: ROUND | AD574: 13
A575: OAKLEIGH | C575: 0 | D575: 0 | E575: =C575*6+D575 -> 0 | G575: 0 | H575: 0 | I575: =G575*6+H575 -> 0 | K575: 0 | L575: 0 | M575: =K575*6+L575 -> 0 | O575: 19 | P575: 12 | Q575: =O575*6+P575 -> 126
A576: BEST PLAYERS | W576: TEAM | X576: W | Y576: L | Z576: D | AA576: FOR | AB576: AGST | AC576: % | AD576: PTS
A577: CAMBERWELL
A578: OAKLEIGH | W578: CAMBERWELL | X578: 11 | Y578: 2 | Z578: 0 | AA578: 1740 | AB578: 1258 | AC578: =(AA578*100)/AB578 -> 138.31478537360891 | AD578: =(X578*4)+(Z578*2) -> 44
A579: GOALKICKERS | W579: OAKLEIGH | X579: 10 | Y579: 3 | Z579: 0 | AA579: 1882 | AB579: 1389 | AC579: =(AA579*100)/AB579 -> 135.49316054715624 | AD579: =(X579*4)+(Z579*2) -> 40
A580: CAMBERWELL | W580: NORTHCOTE | X580: 10 | Y580: 3 | Z580: 0 | AA580: 1694 | AB580: 1455 | AC580: =(AA580*100)/AB580 -> 116.42611683848797 | AD580: =(X580*4)+(Z580*2) -> 40
A581: OAKLEIGH | W581: MORDIALLOC | X581: 9 | Y581: 4 | Z581: 0 | AA581: 1865 | AB581: 1323 | AC581: =(AA581*100)/AB581 -> 140.96749811035525 | AD581: =(X581*4)+(Z581*2) -> 36
A583: YARRAVILLE | C583: 0 | D583: 0 | E583: =C583*6+D583 -> 0 | G583: 0 | H583: 0 | I583: =G583*6+H583 -> 0 | K583: 0 | L583: 0 | M583: =K583*6+L583 -> 0 | O583: 17 | P583: 26 | Q583: =O583*6+P583 -> 128 | S583: YARRAVILLE | W583: WILLIAMSTOWN | X583: 9 | Y583: 4 | Z583: 0 | AA583: 1659 | AB583: 1393 | AC583: =(AA583*100)/AB583 -> 119.09547738693468 | AD583: =(X583*4)+(Z583*2) -> 36
A584: WERRIBEE | C584: 0 | D584: 0 | E584: =C584*6+D584 -> 0 | G584: 0 | H584: 0 | I584: =G584*6+H584 -> 0 | K584: 0 | L584: 0 | M584: =K584*6+L584 -> 0 | O584: 8 | P584: 8 | Q584: =O584*6+P584 -> 56 | W584: YARRAVILLE | X584: 8 | Y584: 5 | Z584: 0 | AA584: 1729 | AB584: 1453 | AC584: =(AA584*100)/AB584 -> 118.99518238128012 | AD584: =(X584*4)+(Z584*2) -> 32
A585: BEST PLAYERS | W585: WAVERLEY | X585: 4 | Y585: 9 | Z585: 0 | AA585: 1604 | AB585: 1781 | AC585: =(AA585*100)/AB585 -> 90.061763054463782 | AD585: =(X585*4)+(Z585*2) -> 16
A586: YARRAVILLE | W586: SUNSHINE | X586: 2 | Y586: 11 | Z586: 0 | AA586: 1345 | AB586: 1906 | AC586: =(AA586*100)/AB586 -> 70.566631689401888 | AD586: =(X586*4)+(Z586*2) -> 8
A587: WERRIBEE | W587: WERRIBEE | X587: 1 | Y587: 12 | Z587: 0 | AA587: 1275 | AB587: 2146 | AC587: =(AA587*100)/AB587 -> 59.412861136999069 | AD587: =(X587*4)+(Z587*2) -> 4
A588: GOALKICKERS | W588: BOX HILL | X588: 1 | Y588: 12 | Z588: 0 | AA588: 1175 | AB588: 2048 | AC588: =(AA588*100)/AB588 -> 57.373046875 | AD588: =(X588*4)+(Z588*2) -> 4
A589: YARRAVILLE
A590: WERRIBEE
A592: NORTHCOTE | C592: 0 | D592: 0 | E592: =C592*6+D592 -> 0 | G592: 0 | H592: 0 | I592: =G592*6+H592 -> 0 | K592: 0 | L592: 0 | M592: =K592*6+L592 -> 0 | O592: 18 | P592: 17 | Q592: =O592*6+P592 -> 125 | S592: NORTHCOTE
A593: MORDIALLOC | C593: 0 | D593: 0 | E593: =C593*6+D593 -> 0 | G593: 0 | H593: 0 | I593: =G593*6+H593 -> 0 | K593: 0 | L593: 0 | M593: =K593*6+L593 -> 0 | O593: 12 | P593: 17 | Q593: =O593*6+P593 -> 89
A594: BEST PLAYERS
A595: NORTHCOTE
A596: MORDIALLOC
A597: GOALKICKERS
A598: NORTHCOTE
A599: MORDIALLOC
A601: WAVERLEY | C601: 0 | D601: 0 | E601: =C601*6+D601 -> 0 | G601: 0 | H601: 0 | I601: =G601*6+H601 -> 0 | K601: 0 | L601: 0 | M601: =K601*6+L601 -> 0 | O601: 24 | P601: 15 | Q601: =O601*6+P601 -> 159 | S601: WAVERLEY
A602: BOX HILL | C602: 0 | D602: 0 | E602: =C602*6+D602 -> 0 | G602: 0 | H602: 0 | I602: =G602*6+H602 -> 0 | K602: 0 | L602: 0 | M602: =K602*6+L602 -> 0 | O602: 14 | P602: 16 | Q602: =O602*6+P602 -> 100
A603: BEST PLAYERS
A604: WAVERLEY
A605: BOX HILL
A606: GOALKICKERS
A607: WAVERLEY
A608: BOX HILL
A610: WILLIAMSTOWN | C610: 0 | D610: 0 | E610: =C610*6+D610 -> 0 | G610: 0 | H610: 0 | I610: =G610*6+H610 -> 0 | K610: 0 | L610: 0 | M610: =K610*6+L610 -> 0 | O610: 14 | P610: 12 | Q610: =O610*6+P610 -> 96 | S610: SUNSHINE
A611: SUNSHINE | C611: 0 | D611: 0 | E611: =C611*6+D611 -> 0 | G611: 0 | H611: 0 | I611: =G611*6+H611 -> 0 | K611: 0 | L611: 0 | M611: =K611*6+L611 -> 0 | O611: 12 | P611: 11 | Q611: =O611*6+P611 -> 83
A612: BEST PLAYERS
A613: WILLIAMSTOWN
A614: SUNSHINE
A615: GOALKICKERS
A616: WILLIAMSTOWN
A617: SUNSHINE
A619: ROUND 14 | E619: 15TH JULY | J619: WEATHER | S619: PLAYED AT
D620: 1ST QTR | H620: 2ND QTR | L620: 3RD QTR | P620: FINAL | S620: WILLIAMSTOWN
A621: WILLIAMSTOWN | C621: 3 | D621: 0 | E621: =C621*6+D621 -> 18 | G621: 7 | H621: 2 | I621: =G621*6+H621 -> 44 | K621: 10 | L621: 2 | M621: =K621*6+L621 -> 62 | O621: 15 | P621: 9 | Q621: =O621*6+P621 -> 99 | S621: UMPIRE | X621: LADDER | AB621: ROUND | AD621: 14
A622: MORDIALLOC | C622: 5 | D622: 3 | E622: =C622*6+D622 -> 33 | G622: 8 | H622: 3 | I622: =G622*6+H622 -> 51 | K622: 12 | L622: 9 | M622: =K622*6+L622 -> 81 | O622: 12 | P622: 11 | Q622: =O622*6+P622 -> 83 | S622: MORGAN
A623: BEST PLAYERS | W623: TEAM | X623: W | Y623: L | Z623: D | AA623: FOR | AB623: AGST | AC623: % | AD623: PTS
A624: WILLIAMSTOWN | C624: CROSS | F624: COATES | I624: ENRIGHT | L624: GOETZ | O624: BEBEND | R624: SHEEHAN
A625: MORDIALLOC | C625: SLADE | F625: W FELTHAM | I625: WILLIAMSON | L625: JOHNSTONE | O625: ROGERSON | R625: CRITCH | W625: CAMBERWELL | X625: 12 | Y625: 2 | Z625: 0 | AA625: 1858 | AB625: 1323 | AC625: =(AA625*100)/AB625 -> 140.43839758125472 | AD625: =(X625*4)+(Z625*2) -> 48
A626: GOALKICKERS | Q626: M TAYLOR | W626: OAKLEIGH | X626: 11 | Y626: 3 | Z626: 0 | AA626: 2013 | AB626: 1515 | AC626: =(AA626*100)/AB626 -> 132.87128712871288 | AD626: =(X626*4)+(Z626*2) -> 44
A627: WILLIAMSTOWN | C627: KERR 3 | E627: CROSS 2 | G627: GANNON 2 | J627: L TAYLOR 2 | M627: WALSH 2 | O627: CONDON | Q627: COATES | S627: S PHILPOTT | W627: NORTHCOTE | X627: 11 | Y627: 3 | Z627: 0 | AA627: 1801 | AB627: 1526 | AC627: =(AA627*100)/AB627 -> 118.02096985583223 | AD627: =(X627*4)+(Z627*2) -> 44
A628: MORDIALLOC | C628: NEVILLE 5 | F628: SLADE 2 | H628: W FELTHAM | K628: PETER FELTHAM | O628: DINGLE | Q628: JOHNSTONE | S628: BARDOEL | W628: WILLIAMSTOWN | X628: 10 | Y628: 4 | Z628: 0 | AA628: 1758 | AB628: 1476 | AC628: =(AA628*100)/AB628 -> 119.10569105691057 | AD628: =(X628*4)+(Z628*2) -> 40
A630: NORTHCOTE | C630: 5 | D630: 4 | E630: =C630*6+D630 -> 34 | G630: 9 | H630: 5 | I630: =G630*6+H630 -> 59 | K630: 11 | L630: 8 | M630: =K630*6+L630 -> 74 | O630: 15 | P630: 17 | Q630: =O630*6+P630 -> 107 | S630: NORTHCOTE | W630: MORDIALLOC | X630: 9 | Y630: 5 | Z630: 0 | AA630: 1948 | AB630: 1422 | AC630: =(AA630*100)/AB630 -> 136.99015471167371 | AD630: =(X630*4)+(Z630*2) -> 36
A631: YARRAVILLE | C631: 3 | D631: 2 | E631: =C631*6+D631 -> 20 | G631: 3 | H631: 7 | I631: =G631*6+H631 -> 25 | K631: 8 | L631: 8 | M631: =K631*6+L631 -> 56 | O631: 10 | P631: 11 | Q631: =O631*6+P631 -> 71 | S631: STABB | W631: YARRAVILLE | X631: 8 | Y631: 6 | Z631: 0 | AA631: 1800 | AB631: 1560 | AC631: =(AA631*100)/AB631 -> 115.38461538461539 | AD631: =(X631*4)+(Z631*2) -> 32
A632: BEST PLAYERS | W632: WAVERLEY | X632: 4 | Y632: 10 | Z632: 0 | AA632: 1730 | AB632: 1912 | AC632: =(AA632*100)/AB632 -> 90.48117154811716 | AD632: =(X632*4)+(Z632*2) -> 16
A633: NORTHCOTE | C633: McARDLE | F633: McINTYRE | I633: ROBERTS | L633: GREGURIK | O633: McQUIN | R633: EDWARDS | W633: SUNSHINE | X633: 2 | Y633: 12 | Z633: 0 | AA633: 1431 | AB633: 2010 | AC633: =(AA633*100)/AB633 -> 71.194029850746276 | AD633: =(X633*4)+(Z633*2) -> 8
A634: YARRAVILLE | C634: SMITH | F634: SIMMONS | I634: WELLINGTON | L634: PAGAN | O634: SAIT | R634: SHARP | W634: BOX HILL | X634: 2 | Y634: 12 | Z634: 0 | AA634: 1279 | AB634: 2134 | AC634: =(AA634*100)/AB634 -> 59.93439550140581 | AD634: =(X634*4)+(Z634*2) -> 8
A635: GOALKICKERS | O635: EDWARDS | R635: G HOLLAND | W635: WERRIBEE | X635: 1 | Y635: 13 | Z635: 0 | AA635: 1340 | AB635: 2264 | AC635: =(AA635*100)/AB635 -> 59.187279151943464 | AD635: =(X635*4)+(Z635*2) -> 4
A636: NORTHCOTE | C636: McCONCHIE 2 | F636: WATTS 2 | H636: THORNELOE 2 | K636: GREGURIK 2 | N636: G RYAN 2 | P636: A HOLLAND 2 | S636: M RYAN
A637: YARRAVILLE | C637: M FOTHERINGHAM 4 | G637: WELLINGTON 2 | J637: PAGAN | L637: SAIT | N637: SHARP | P637: RADZIMINSKI
A639: OAKLEIGH | C639: 5 | D639: 2 | E639: =C639*6+D639 -> 32 | G639: 12 | H639: 9 | I639: =G639*6+H639 -> 81 | K639: 14 | L639: 14 | M639: =K639*6+L639 -> 98 | O639: 18 | P639: 23 | Q639: =O639*6+P639 -> 131 | S639: OAKLEIGH
A640: WAVERLEY | C640: 5 | D640: 4 | E640: =C640*6+D640 -> 34 | G640: 8 | H640: 5 | I640: =G640*6+H640 -> 53 | K640: 15 | L640: 10 | M640: =K640*6+L640 -> 100 | O640: 19 | P640: 12 | Q640: =O640*6+P640 -> 126 | S640: TORNEY
A641: BEST PLAYERS
A642: OAKLEIGH | C642: THOMAS | F642: McDONALD | I642: HEVERIN | L642: GOODMAN | O642: NEARY
A643: WAVERLEY | C643: COSTELLO | F643: ALLDAY | I643: COLLINS | K643: DEREK HARRINGTON | O643: WILLIAMS | R643: STYLES
A644: GOALKICKERS
A645: OAKLEIGH | C645: COLLINS 6 | F645: BRUERTON 3 | I645: GOODMAN 2 | K645: McDONALD 2 | N645: HEVERIN | P645: FRYER | R645: NEARY | T645: D MILLER | W645: PAGNOCCOLO
A646: WAVERLEY | C646: COSTELLO 10 | F646: P ANGELIS 4 | I646: DANE HARRINGTON 2 | M646: DEREK HARRINGTON | Q646: BARNES | S646: McLURE
A648: CAMBERWELL | C648: 1 | D648: 4 | E648: =C648*6+D648 -> 10 | G648: 7 | H648: 10 | I648: =G648*6+H648 -> 52 | K648: 12 | L648: 13 | M648: =K648*6+L648 -> 85 | O648: 17 | P648: 16 | Q648: =O648*6+P648 -> 118 | S648: WERRIBEE
A649: WERRIBEE | C649: 3 | D649: 7 | E649: =C649*6+D649 -> 25 | G649: 4 | H649: 7 | I649: =G649*6+H649 -> 31 | K649: 8 | L649: 9 | M649: =K649*6+L649 -> 57 | O649: 9 | P649: 11 | Q649: =O649*6+P649 -> 65 | S649: VERGONA
A650: BEST PLAYERS
A651: CAMBERWELL | C651: OLIVER | F651: WRIGHT | I651: JUDD | L651: DAVIDSON | O651: HAYWOOD | R651: McFEE
A652: WERRIBEE | C652: BOURKE | F652: DOUGHERTY | I652: MANNIX | L652: JACK | O652: GUDDE | R652: HIGGINS
A653: GOALKICKERS
A654: CAMBERWELL | C654: HAYWOOD 4 | F654: HARROP 4 | I654: SLACIK 3 | K654: SIMPSON 2 | M654: TEAKEL 2 | O654: CHAMBERLAIN | R654: MOORE
A655: WERRIBEE | C655: DOUGLAS 4 | F655: DOUGHERTY 2 | I655: MANNIX 2 | L655: COLLINS
A657: BOX HILL | C657: 4 | D657: 7 | E657: =C657*6+D657 -> 31 | G657: 11 | H657: 12 | I657: =G657*6+H657 -> 78 | K657: 12 | L657: 18 | M657: =K657*6+L657 -> 90 | O657: 14 | P657: 20 | Q657: =O657*6+P657 -> 104 | S657: BOX HILL
A658: SUNSHINE | C658: 3 | D658: 3 | E658: =C658*6+D658 -> 21 | G658: 5 | H658: 7 | I658: =G658*6+H658 -> 37 | K658: 7 | L658: 14 | M658: =K658*6+L658 -> 56 | O658: 11 | P658: 20 | Q658: =O658*6+P658 -> 86 | S658: OAKLEY
A659: BEST PLAYERS
A660: BOX HILL | C660: BATES | F660: TUCKWELL | I660: HARPER | L660: RALPH | O660: LAWTHER | R660: CONNOLLY
A661: SUNSHINE | C661: T BRETT | F661: LEWIS | I661: SCHROEDER | L661: McDONALD | O661: BAIRD | R661: JONES
A662: GOALKICKERS
A663: BOX HILL | C663: McLERIE 5 | F663: CONNOLLY 2 | I663: JOFFE 2 | K663: WITHERS 2 | N663: FLANAGAN | Q663: LAWTHER | S663: McGETTIGAN
A664: SUNSHINE | C664: SCHROEDER 4 | F664: SAID 4 | H664: JONES 2 | J664: G RADFORD | M664: BAIRD
A666: ROUND 15 | E666: 22ND JULY | J666: WEATHER | S666: PLAYED AT
D667: 1ST QTR | H667: 2ND QTR | L667: 3RD QTR | P667: FINAL | S667: CAMBERWELL
A668: CAMBERWELL | C668: 0 | D668: 0 | E668: =C668*6+D668 -> 0 | G668: 0 | H668: 0 | I668: =G668*6+H668 -> 0 | K668: 0 | L668: 0 | M668: =K668*6+L668 -> 0 | O668: 20 | P668: 21 | Q668: =O668*6+P668 -> 141 | S668: UMPIRE | X668: LADDER | AB668: ROUND | AD668: 15
A669: NORTHCOTE | C669: 0 | D669: 0 | E669: =C669*6+D669 -> 0 | G669: 0 | H669: 0 | I669: =G669*6+H669 -> 0 | K669: 0 | L669: 0 | M669: =K669*6+L669 -> 0 | O669: 13 | P669: 11 | Q669: =O669*6+P669 -> 89
A670: BEST PLAYERS | W670: TEAM | X670: W | Y670: L | Z670: D | AA670: FOR | AB670: AGST | AC670: % | AD670: PTS
A671: CAMBERWELL
A672: NORTHCOTE | W672: CAMBERWELL | X672: 13 | Y672: 2 | Z672: 0 | AA672: 1999 | AB672: 1412 | AC672: =(AA672*100)/AB672 -> 141.57223796033995 | AD672: =(X672*4)+(Z672*2) -> 52
A673: GOALKICKERS | W673: OAKLEIGH | X673: 11 | Y673: 4 | Z673: 0 | AA673: 2066 | AB673: 1585 | AC673: =(AA673*100)/AB673 -> 130.34700315457414 | AD673: =(X673*4)+(Z673*2) -> 44
A674: CAMBERWELL | W674: WILLIAMSTOWN | X674: 11 | Y674: 4 | Z674: 0 | AA674: 1926 | AB674: 1558 | AC674: =(AA674*100)/AB674 -> 123.62002567394094 | AD674: =(X674*4)+(Z674*2) -> 44
A675: NORTHCOTE | W675: NORTHCOTE | X675: 11 | Y675: 4 | Z675: 0 | AA675: 1890 | AB675: 1667 | AC675: =(AA675*100)/AB675 -> 113.37732453509298 | AD675: =(X675*4)+(Z675*2) -> 44
A677: MORDIALLOC | C677: 0 | D677: 0 | E677: =C677*6+D677 -> 0 | G677: 0 | H677: 0 | I677: =G677*6+H677 -> 0 | K677: 0 | L677: 0 | M677: =K677*6+L677 -> 0 | O677: 10 | P677: 17 | Q677: =O677*6+P677 -> 77 | S677: MORDIALLOC | W677: MORDIALLOC | X677: 10 | Y677: 5 | Z677: 0 | AA677: 2025 | AB677: 1479 | AC677: =(AA677*100)/AB677 -> 136.91683569979716 | AD677: =(X677*4)+(Z677*2) -> 40
A678: YARRAVILLE | C678: 0 | D678: 0 | E678: =C678*6+D678 -> 0 | G678: 0 | H678: 0 | I678: =G678*6+H678 -> 0 | K678: 0 | L678: 0 | M678: =K678*6+L678 -> 0 | O678: 8 | P678: 9 | Q678: =O678*6+P678 -> 57 | W678: YARRAVILLE | X678: 8 | Y678: 7 | Z678: 0 | AA678: 1857 | AB678: 1637 | AC678: =(AA678*100)/AB678 -> 113.43921808185705 | AD678: =(X678*4)+(Z678*2) -> 32
A679: BEST PLAYERS | W679: WAVERLEY | X679: 5 | Y679: 10 | Z679: 0 | AA679: 1835 | AB679: 2013 | AC679: =(AA679*100)/AB679 -> 91.157476403378041 | AD679: =(X679*4)+(Z679*2) -> 20
A680: MORDIALLOC | W680: SUNSHINE | X680: 3 | Y680: 12 | Z680: 0 | AA680: 1501 | AB680: 2063 | AC680: =(AA680*100)/AB680 -> 72.758119243819678 | AD680: =(X680*4)+(Z680*2) -> 12
A681: YARRAVILLE | W681: BOX HILL | X681: 2 | Y681: 13 | Z681: 0 | AA681: 1361 | AB681: 2302 | AC681: =(AA681*100)/AB681 -> 59.122502172024326 | AD681: =(X681*4)+(Z681*2) -> 8
A682: GOALKICKERS | W682: WERRIBEE | X682: 1 | Y682: 14 | Z682: 0 | AA682: 1441 | AB682: 2369 | AC682: =(AA682*100)/AB682 -> 60.827353313634447 | AD682: =(X682*4)+(Z682*2) -> 4
A683: MORDIALLOC
A684: YARRAVILLE
A686: WAVERLEY | C686: 0 | D686: 0 | E686: =C686*6+D686 -> 0 | G686: 0 | H686: 0 | I686: =G686*6+H686 -> 0 | K686: 0 | L686: 0 | M686: =K686*6+L686 -> 0 | O686: 13 | P686: 27 | Q686: =O686*6+P686 -> 105 | S686: WAVERLEY
A687: WERRIBEE | C687: 0 | D687: 0 | E687: =C687*6+D687 -> 0 | G687: 0 | H687: 0 | I687: =G687*6+H687 -> 0 | K687: 0 | L687: 0 | M687: =K687*6+L687 -> 0 | O687: 15 | P687: 11 | Q687: =O687*6+P687 -> 101
A688: BEST PLAYERS
A689: WAVERLEY
A690: WERRIBEE
A691: GOALKICKERS
A692: WAVERLEY
A693: WERRIBEE
A695: SUNSHINE | C695: 0 | D695: 0 | E695: =C695*6+D695 -> 0 | G695: 0 | H695: 0 | I695: =G695*6+H695 -> 0 | K695: 0 | L695: 0 | M695: =K695*6+L695 -> 0 | O695: 9 | P695: 16 | Q695: =O695*6+P695 -> 70 | S695: SUNSHINE
A696: OAKLEIGH | C696: 0 | D696: 0 | E696: =C696*6+D696 -> 0 | G696: 0 | H696: 0 | I696: =G696*6+H696 -> 0 | K696: 0 | L696: 0 | M696: =K696*6+L696 -> 0 | O696: 6 | P696: 17 | Q696: =O696*6+P696 -> 53
A697: BEST PLAYERS
A698: SUNSHINE
A699: OAKLEIGH
A700: GOALKICKERS
A701: SUNSHINE
A702: OAKLEIGH
A704: WILLIAMSTOWN | C704: 0 | D704: 0 | E704: =C704*6+D704 -> 0 | G704: 0 | H704: 0 | I704: =G704*6+H704 -> 0 | K704: 0 | L704: 0 | M704: =K704*6+L704 -> 0 | O704: 26 | P704: 12 | Q704: =O704*6+P704 -> 168 | S704: WILLIAMSTOWN
A705: BOX HILL | C705: 0 | D705: 0 | E705: =C705*6+D705 -> 0 | G705: 0 | H705: 0 | I705: =G705*6+H705 -> 0 | K705: 0 | L705: 0 | M705: =K705*6+L705 -> 0 | O705: 12 | P705: 10 | Q705: =O705*6+P705 -> 82
A706: BEST PLAYERS
A707: WILLIAMSTOWN
A708: BOX HILL
A709: GOALKICKERS
A710: WILLIAMSTOWN
A711: BOX HILL
A713: ROUND 16 | E713: 29TH JULY | J713: WEATHER | S713: PLAYED AT
D714: 1ST QTR | H714: 2ND QTR | L714: 3RD QTR | P714: FINAL | S714: NORTHCOTE
A715: WAVERLEY | C715: 0 | D715: 0 | E715: =C715*6+D715 -> 0 | G715: 0 | H715: 0 | I715: =G715*6+H715 -> 0 | K715: 0 | L715: 0 | M715: =K715*6+L715 -> 0 | O715: 27 | P715: 12 | Q715: =O715*6+P715 -> 174 | S715: UMPIRE | X715: LADDER | AB715: ROUND | AD715: 16
A716: NORTHCOTE | C716: 0 | D716: 0 | E716: =C716*6+D716 -> 0 | G716: 0 | H716: 0 | I716: =G716*6+H716 -> 0 | K716: 0 | L716: 0 | M716: =K716*6+L716 -> 0 | O716: 20 | P716: 19 | Q716: =O716*6+P716 -> 139
A717: BEST PLAYERS | W717: TEAM | X717: W | Y717: L | Z717: D | AA717: FOR | AB717: AGST | AC717: % | AD717: PTS
A718: WAVERLEY
A719: NORTHCOTE | W719: CAMBERWELL | X719: 13 | Y719: 3 | Z719: 0 | AA719: 2105 | AB719: 1524 | AC719: =(AA719*100)/AB719 -> 138.12335958005249 | AD719: =(X719*4)+(Z719*2) -> 52
A720: GOALKICKERS | W720: OAKLEIGH | X720: 12 | Y720: 4 | Z720: 0 | AA720: 2236 | AB720: 1684 | AC720: =(AA720*100)/AB720 -> 132.77909738717341 | AD720: =(X720*4)+(Z720*2) -> 48
A721: WAVERLEY | W721: MORDIALLOC | X721: 11 | Y721: 5 | Z721: 0 | AA721: 2224 | AB721: 1601 | AC721: =(AA721*100)/AB721 -> 138.91317926296065 | AD721: =(X721*4)+(Z721*2) -> 44
A722: NORTHCOTE | W722: WILLIAMSTOWN | X722: 11 | Y722: 5 | Z722: 0 | AA722: 2025 | AB722: 1728 | AC722: =(AA722*100)/AB722 -> 117.1875 | AD722: =(X722*4)+(Z722*2) -> 44
A724: YARRAVILLE | C724: 0 | D724: 0 | E724: =C724*6+D724 -> 0 | G724: 0 | H724: 0 | I724: =G724*6+H724 -> 0 | K724: 0 | L724: 0 | M724: =K724*6+L724 -> 0 | O724: 16 | P724: 16 | Q724: =O724*6+P724 -> 112 | S724: YARRAVILLE | W724: NORTHCOTE | X724: 11 | Y724: 5 | Z724: 0 | AA724: 2029 | AB724: 1841 | AC724: =(AA724*100)/AB724 -> 110.21184139054861 | AD724: =(X724*4)+(Z724*2) -> 44
A725: CAMBERWELL | C725: 0 | D725: 0 | E725: =C725*6+D725 -> 0 | G725: 0 | H725: 0 | I725: =G725*6+H725 -> 0 | K725: 0 | L725: 0 | M725: =K725*6+L725 -> 0 | O725: 16 | P725: 10 | Q725: =O725*6+P725 -> 106 | W725: YARRAVILLE | X725: 9 | Y725: 7 | Z725: 0 | AA725: 1969 | AB725: 1743 | AC725: =(AA725*100)/AB725 -> 112.96615031554791 | AD725: =(X725*4)+(Z725*2) -> 36
A726: BEST PLAYERS | W726: WAVERLEY | X726: 6 | Y726: 10 | Z726: 0 | AA726: 2009 | AB726: 2152 | AC726: =(AA726*100)/AB726 -> 93.35501858736059 | AD726: =(X726*4)+(Z726*2) -> 24
A727: YARRAVILLE | W727: SUNSHINE | X727: 3 | Y727: 13 | Z727: 0 | AA727: 1589 | AB727: 2177 | AC727: =(AA727*100)/AB727 -> 72.9903536977492 | AD727: =(X727*4)+(Z727*2) -> 12
A728: CAMBERWELL | W728: WERRIBEE | X728: 2 | Y728: 14 | Z728: 0 | AA728: 1555 | AB728: 2457 | AC728: =(AA728*100)/AB728 -> 63.288563288563289 | AD728: =(X728*4)+(Z728*2) -> 8
A729: GOALKICKERS | W729: BOX HILL | X729: 2 | Y729: 14 | Z729: 0 | AA729: 1483 | AB729: 2501 | AC729: =(AA729*100)/AB729 -> 59.296281487405039 | AD729: =(X729*4)+(Z729*2) -> 8
A730: YARRAVILLE
A731: CAMBERWELL
A733: WERRIBEE | C733: 0 | D733: 0 | E733: =C733*6+D733 -> 0 | G733: 0 | H733: 0 | I733: =G733*6+H733 -> 0 | K733: 0 | L733: 0 | M733: =K733*6+L733 -> 0 | O733: 16 | P733: 18 | Q733: =O733*6+P733 -> 114 | S733: WERRIBEE
A734: SUNSHINE | C734: 0 | D734: 0 | E734: =C734*6+D734 -> 0 | G734: 0 | H734: 0 | I734: =G734*6+H734 -> 0 | K734: 0 | L734: 0 | M734: =K734*6+L734 -> 0 | O734: 10 | P734: 28 | Q734: =O734*6+P734 -> 88
A735: BEST PLAYERS
A736: WERRIBEE
A737: SUNSHINE
A738: GOALKICKERS
A739: WERRIBEE
A740: SUNSHINE
A742: OAKLEIGH | C742: 0 | D742: 0 | E742: =C742*6+D742 -> 0 | G742: 0 | H742: 0 | I742: =G742*6+H742 -> 0 | K742: 0 | L742: 0 | M742: =K742*6+L742 -> 0 | O742: 26 | P742: 14 | Q742: =O742*6+P742 -> 170 | S742: OAKLEIGH
A743: WILLIAMSTOWN | C743: 0 | D743: 0 | E743: =C743*6+D743 -> 0 | G743: 0 | H743: 0 | I743: =G743*6+H743 -> 0 | K743: 0 | L743: 0 | M743: =K743*6+L743 -> 0 | O743: 14 | P743: 15 | Q743: =O743*6+P743 -> 99
A744: BEST PLAYERS
A745: OAKLEIGH
A746: WILLIAMSTOWN
A747: GOALKICKERS
A748: OAKLEIGH
A749: WILLIAMSTOWN
A751: MORDIALLOC | C751: 0 | D751: 0 | E751: =C751*6+D751 -> 0 | G751: 0 | H751: 0 | I751: =G751*6+H751 -> 0 | K751: 0 | L751: 0 | M751: =K751*6+L751 -> 0 | O751: 31 | P751: 13 | Q751: =O751*6+P751 -> 199 | S751: BOX HILL
A752: BOX HILL | C752: 0 | D752: 0 | E752: =C752*6+D752 -> 0 | G752: 0 | H752: 0 | I752: =G752*6+H752 -> 0 | K752: 0 | L752: 0 | M752: =K752*6+L752 -> 0 | O752: 19 | P752: 8 | Q752: =O752*6+P752 -> 122
A753: BEST PLAYERS
A754: MORDIALLOC
A755: BOX HILL
A756: GOALKICKERS
A757: MORDIALLOC
A758: BOX HILL
A760: ROUND 17 | E760: 5TH AUGUST | J760: WEATHER | S760: PLAYED AT
D761: 1ST QTR | H761: 2ND QTR | L761: 3RD QTR | P761: FINAL | S761: WAVERLEY
A762: YARRAVILLE | C762: 0 | D762: 0 | E762: =C762*6+D762 -> 0 | G762: 0 | H762: 0 | I762: =G762*6+H762 -> 0 | K762: 0 | L762: 0 | M762: =K762*6+L762 -> 0 | O762: 15 | P762: 17 | Q762: =O762*6+P762 -> 107 | S762: UMPIRE | X762: LADDER | AB762: ROUND | AD762: 17
A763: WAVERLEY | C763: 0 | D763: 0 | E763: =C763*6+D763 -> 0 | G763: 0 | H763: 0 | I763: =G763*6+H763 -> 0 | K763: 0 | L763: 0 | M763: =K763*6+L763 -> 0 | O763: 12 | P763: 14 | Q763: =O763*6+P763 -> 86
A764: BEST PLAYERS | W764: TEAM | X764: W | Y764: L | Z764: D | AA764: FOR | AB764: AGST | AC764: % | AD764: PTS
A765: YARRAVILLE
A766: WAVERLEY | W766: CAMBERWELL | X766: 13 | Y766: 4 | Z766: 0 | AA766: 2210 | AB766: 1646 | AC766: =(AA766*100)/AB766 -> 134.26488456865127 | AD766: =(X766*4)+(Z766*2) -> 52
A767: GOALKICKERS | W767: OAKLEIGH | X767: 13 | Y767: 4 | Z767: 0 | AA767: 2393 | AB767: 1784 | AC767: =(AA767*100)/AB767 -> 134.13677130044843 | AD767: =(X767*4)+(Z767*2) -> 52
A768: YARRAVILLE | W768: MORDIALLOC | X768: 12 | Y768: 5 | Z768: 0 | AA768: 2346 | AB768: 1706 | AC768: =(AA768*100)/AB768 -> 137.51465416178195 | AD768: =(X768*4)+(Z768*2) -> 48
A769: WAVERLEY | W769: WILLIAMSTOWN | X769: 12 | Y769: 5 | Z769: 0 | AA769: 2204 | AB769: 1804 | AC769: =(AA769*100)/AB769 -> 122.17294900221729 | AD769: =(X769*4)+(Z769*2) -> 48
A771: MORDIALLOC | C771: 0 | D771: 0 | E771: =C771*6+D771 -> 0 | G771: 0 | H771: 0 | I771: =G771*6+H771 -> 0 | K771: 0 | L771: 0 | M771: =K771*6+L771 -> 0 | O771: 18 | P771: 14 | Q771: =O771*6+P771 -> 122 | S771: MORDIALLOC | W771: NORTHCOTE | X771: 11 | Y771: 6 | Z771: 0 | AA771: 2129 | AB771: 1953 | AC771: =(AA771*100)/AB771 -> 109.01177675371224 | AD771: =(X771*4)+(Z771*2) -> 44
A772: CAMBERWELL | C772: 0 | D772: 0 | E772: =C772*6+D772 -> 0 | G772: 0 | H772: 0 | I772: =G772*6+H772 -> 0 | K772: 0 | L772: 0 | M772: =K772*6+L772 -> 0 | O772: 16 | P772: 9 | Q772: =O772*6+P772 -> 105 | W772: YARRAVILLE | X772: 10 | Y772: 7 | Z772: 0 | AA772: 2076 | AB772: 1829 | AC772: =(AA772*100)/AB772 -> 113.50464734827774 | AD772: =(X772*4)+(Z772*2) -> 40
A773: BEST PLAYERS | W773: WAVERLEY | X773: 6 | Y773: 11 | Z773: 0 | AA773: 2095 | AB773: 2259 | AC773: =(AA773*100)/AB773 -> 92.740150509074809 | AD773: =(X773*4)+(Z773*2) -> 24
A774: MORDIALLOC | W774: SUNSHINE | X774: 4 | Y774: 13 | Z774: 0 | AA774: 1701 | AB774: 2277 | AC774: =(AA774*100)/AB774 -> 74.703557312252968 | AD774: =(X774*4)+(Z774*2) -> 16
A775: CAMBERWELL | W775: WERRIBEE | X775: 2 | Y775: 15 | Z775: 0 | AA775: 1631 | AB775: 2641 | AC775: =(AA775*100)/AB775 -> 61.756910261264672 | AD775: =(X775*4)+(Z775*2) -> 8
A776: GOALKICKERS | W776: BOX HILL | X776: 2 | Y776: 15 | Z776: 0 | AA776: 1583 | AB776: 2658 | AC776: =(AA776*100)/AB776 -> 59.556057185854023 | AD776: =(X776*4)+(Z776*2) -> 8
A777: MORDIALLOC
A778: CAMBERWELL
A780: SUNSHINE | C780: 0 | D780: 0 | E780: =C780*6+D780 -> 0 | G780: 0 | H780: 0 | I780: =G780*6+H780 -> 0 | K780: 0 | L780: 0 | M780: =K780*6+L780 -> 0 | O780: 16 | P780: 16 | Q780: =O780*6+P780 -> 112 | S780: SUNSHINE
A781: NORTHCOTE | C781: 0 | D781: 0 | E781: =C781*6+D781 -> 0 | G781: 0 | H781: 0 | I781: =G781*6+H781 -> 0 | K781: 0 | L781: 0 | M781: =K781*6+L781 -> 0 | O781: 14 | P781: 16 | Q781: =O781*6+P781 -> 100
A782: BEST PLAYERS
A783: SUNSHINE
A784: NORTHCOTE
A785: GOALKICKERS
A786: SUNSHINE
A787: NORTHCOTE
A789: WILLIAMSTOWN | C789: 0 | D789: 0 | E789: =C789*6+D789 -> 0 | G789: 0 | H789: 0 | I789: =G789*6+H789 -> 0 | K789: 0 | L789: 0 | M789: =K789*6+L789 -> 0 | O789: 27 | P789: 22 | Q789: =O789*6+P789 -> 184 | S789: WILLIAMSTOWN
A790: WERRIBEE | C790: 0 | D790: 0 | E790: =C790*6+D790 -> 0 | G790: 0 | H790: 0 | I790: =G790*6+H790 -> 0 | K790: 0 | L790: 0 | M790: =K790*6+L790 -> 0 | O790: 12 | P790: 4 | Q790: =O790*6+P790 -> 76
A791: BEST PLAYERS
A792: WILLIAMSTOWN
A793: WERRIBEE
A794: GOALKICKERS
A795: WILLIAMSTOWN
A796: WERRIBEE
A798: OAKLEIGH | C798: 0 | D798: 0 | E798: =C798*6+D798 -> 0 | G798: 0 | H798: 0 | I798: =G798*6+H798 -> 0 | K798: 0 | L798: 0 | M798: =K798*6+L798 -> 0 | O798: 22 | P798: 25 | Q798: =O798*6+P798 -> 157 | S798: BOX HILL
A799: BOX HILL | C799: 0 | D799: 0 | E799: =C799*6+D799 -> 0 | G799: 0 | H799: 0 | I799: =G799*6+H799 -> 0 | K799: 0 | L799: 0 | M799: =K799*6+L799 -> 0 | O799: 14 | P799: 16 | Q799: =O799*6+P799 -> 100
A800: BEST PLAYERS
A801: OAKLEIGH
A802: BOX HILL
A803: GOALKICKERS
A804: OAKLEIGH
A805: BOX HILL
A807: ROUND 18 | E807: 12TH AUGUST | J807: WEATHER | S807: PLAYED AT
D808: 1ST QTR | H808: 2ND QTR | L808: 3RD QTR | P808: FINAL | S808: CAMBERWELL
A809: CAMBERWELL | C809: 0 | D809: 0 | E809: =C809*6+D809 -> 0 | G809: 0 | H809: 0 | I809: =G809*6+H809 -> 0 | K809: 0 | L809: 0 | M809: =K809*6+L809 -> 0 | O809: 15 | P809: 7 | Q809: =O809*6+P809 -> 97 | S809: UMPIRE | X809: LADDER | AB809: ROUND | AD809: 18
A810: WAVERLEY | C810: 0 | D810: 0 | E810: =C810*6+D810 -> 0 | G810: 0 | H810: 0 | I810: =G810*6+H810 -> 0 | K810: 0 | L810: 0 | M810: =K810*6+L810 -> 0 | O810: 6 | P810: 16 | Q810: =O810*6+P810 -> 52
A811: BEST PLAYERS | W811: TEAM | X811: W | Y811: L | Z811: D | AA811: FOR | AB811: AGST | AC811: % | AD811: PTS
A812: CAMBERWELL
A813: WAVERLEY | W813: OAKLEIGH | X813: 14 | Y813: 4 | Z813: 0 | AA813: 2486 | AB813: 1827 | AC813: =(AA813*100)/AB813 -> 136.07006020799125 | AD813: =(X813*4)+(Z813*2) -> 56
A814: GOALKICKERS | W814: CAMBERWELL | X814: 14 | Y814: 4 | Z814: 0 | AA814: 2307 | AB814: 1698 | AC814: =(AA814*100)/AB814 -> 135.86572438162545 | AD814: =(X814*4)+(Z814*2) -> 56
A815: CAMBERWELL | W815: MORDIALLOC | X815: 12 | Y815: 6 | Z815: 0 | AA815: 2389 | AB815: 1799 | AC815: =(AA815*100)/AB815 -> 132.79599777654252 | AD815: =(X815*4)+(Z815*2) -> 48
A816: WAVERLEY | W816: WILLIAMSTOWN | X816: 12 | Y816: 6 | Z816: 0 | AA816: 2273 | AB816: 1883 | AC816: =(AA816*100)/AB816 -> 120.71163037705789 | AD816: =(X816*4)+(Z816*2) -> 48
A818: YARRAVILLE | C818: 0 | D818: 0 | E818: =C818*6+D818 -> 0 | G818: 0 | H818: 0 | I818: =G818*6+H818 -> 0 | K818: 0 | L818: 0 | M818: =K818*6+L818 -> 0 | O818: 21 | P818: 12 | Q818: =O818*6+P818 -> 138 | S818: YARRAVILLE | W818: NORTHCOTE | X818: 12 | Y818: 6 | Z818: 0 | AA818: 2208 | AB818: 2022 | AC818: =(AA818*100)/AB818 -> 109.19881305637982 | AD818: =(X818*4)+(Z818*2) -> 48
A819: SUNSHINE | C819: 0 | D819: 0 | E819: =C819*6+D819 -> 0 | G819: 0 | H819: 0 | I819: =G819*6+H819 -> 0 | K819: 0 | L819: 0 | M819: =K819*6+L819 -> 0 | O819: 2 | P819: 7 | Q819: =O819*6+P819 -> 19 | W819: YARRAVILLE | X819: 11 | Y819: 7 | Z819: 0 | AA819: 2214 | AB819: 1848 | AC819: =(AA819*100)/AB819 -> 119.8051948051948 | AD819: =(X819*4)+(Z819*2) -> 44
A820: BEST PLAYERS | W820: WAVERLEY | X820: 6 | Y820: 12 | Z820: 0 | AA820: 2147 | AB820: 2356 | AC820: =(AA820*100)/AB820 -> 91.129032258064512 | AD820: =(X820*4)+(Z820*2) -> 24
A821: YARRAVILLE | W821: SUNSHINE | X821: 4 | Y821: 14 | Z821: 0 | AA821: 1720 | AB821: 2415 | AC821: =(AA821*100)/AB821 -> 71.221532091097302 | AD821: =(X821*4)+(Z821*2) -> 16
A822: SUNSHINE | W822: BOX HILL | X822: 3 | Y822: 15 | Z822: 0 | AA822: 1673 | AB822: 2710 | AC822: =(AA822*100)/AB822 -> 61.73431734317343 | AD822: =(X822*4)+(Z822*2) -> 12
A823: GOALKICKERS | W823: WERRIBEE | X823: 2 | Y823: 16 | Z823: 0 | AA823: 1683 | AB823: 2731 | AC823: =(AA823*100)/AB823 -> 61.625778103258881 | AD823: =(X823*4)+(Z823*2) -> 8
A824: YARRAVILLE
A825: SUNSHINE
A827: NORTHCOTE | C827: 0 | D827: 0 | E827: =C827*6+D827 -> 0 | G827: 0 | H827: 0 | I827: =G827*6+H827 -> 0 | K827: 0 | L827: 0 | M827: =K827*6+L827 -> 0 | O827: 11 | P827: 13 | Q827: =O827*6+P827 -> 79 | S827: NORTHCOTE
A828: WILLIAMSTOWN | C828: 0 | D828: 0 | E828: =C828*6+D828 -> 0 | G828: 0 | H828: 0 | I828: =G828*6+H828 -> 0 | K828: 0 | L828: 0 | M828: =K828*6+L828 -> 0 | O828: 8 | P828: 21 | Q828: =O828*6+P828 -> 69
A829: BEST PLAYERS
A830: NORTHCOTE
A831: WILLIAMSTOWN
A832: GOALKICKERS
A833: NORTHCOTE
A834: WILLIAMSTOWN
A836: BOX HILL | C836: 0 | D836: 0 | E836: =C836*6+D836 -> 0 | G836: 0 | H836: 0 | I836: =G836*6+H836 -> 0 | K836: 0 | L836: 0 | M836: =K836*6+L836 -> 0 | O836: 13 | P836: 12 | Q836: =O836*6+P836 -> 90 | S836: WERRIBEE
A837: WERRIBEE | C837: 0 | D837: 0 | E837: =C837*6+D837 -> 0 | G837: 0 | H837: 0 | I837: =G837*6+H837 -> 0 | K837: 0 | L837: 0 | M837: =K837*6+L837 -> 0 | O837: 7 | P837: 10 | Q837: =O837*6+P837 -> 52
A838: BEST PLAYERS
A839: BOX HILL
A840: WERRIBEE
A841: GOALKICKERS
A842: BOX HILL
A843: WERRIBEE
A845: OAKLEIGH | C845: 0 | D845: 0 | E845: =C845*6+D845 -> 0 | G845: 0 | H845: 0 | I845: =G845*6+H845 -> 0 | K845: 0 | L845: 0 | M845: =K845*6+L845 -> 0 | O845: 13 | P845: 15 | Q845: =O845*6+P845 -> 93 | S845: OAKLEIGH
A846: MORDIALLOC | C846: 0 | D846: 0 | E846: =C846*6+D846 -> 0 | G846: 0 | H846: 0 | I846: =G846*6+H846 -> 0 | K846: 0 | L846: 0 | M846: =K846*6+L846 -> 0 | O846: 5 | P846: 13 | Q846: =O846*6+P846 -> 43
A847: BEST PLAYERS
A848: OAKLEIGH
A849: MORDIALLOC
A850: GOALKICKERS
A851: OAKLEIGH
A852: MORDIALLOC
A854: FINALS
A855: 1ST SEMI | E855: 19TH AUGUST | J855: WEATHER | S855: PLAYED AT
D856: 1ST QTR | H856: 2ND QTR | L856: 3RD QTR | P856: FINAL | S856: TOORAK PARK
A857: MORDIALLOC | C857: 3 | D857: 3 | E857: =C857*6+D857 -> 21 | G857: 6 | H857: 7 | I857: =G857*6+H857 -> 43 | K857: 10 | L857: 11 | M857: =K857*6+L857 -> 71 | O857: 14 | P857: 12 | Q857: =O857*6+P857 -> 96 | S857: UMPIRE
A858: WILLIAMSTOWN | C858: 1 | D858: 4 | E858: =C858*6+D858 -> 10 | G858: 1 | H858: 7 | I858: =G858*6+H858 -> 13 | K858: 2 | L858: 10 | M858: =K858*6+L858 -> 22 | O858: 3 | P858: 10 | Q858: =O858*6+P858 -> 28 | S858: MATHEWS
A859: BEST PLAYERS
A860: MORDIALLOC | C860: WILLIAMSON | F860: SCOTT | I860: PETER FELTHAM | M860: SLADE | O860: LANG | Q860: W FELTHAM
A861: WILLIAMSTOWN | C861: KENNEDY | F861: L TAYLOR | I861: SIMPSON | L861: BEBEND | N861: SHEEHAN | Q861: WALSH
A862: GOALKICKERS
A863: MORDIALLOC | C863: NEVILLE 6 | F863: DINGLE 3 | H863: W FELTHAM 2 | K863: PAUL FELTHAM | O863: DEATON | Q863: GUY
A864: WILLIAMSTOWN | C864: COATES | F864: JOHN | H864: A PHILPOTT
A866: 2ND SEMI | E866: 26TH AUGUST | J866: WEATHER
A867: OAKLEIGH | C867: 0 | D867: 0 | E867: =C867*6+D867 -> 0 | G867: 0 | H867: 0 | I867: =G867*6+H867 -> 0 | K867: 0 | L867: 0 | M867: =K867*6+L867 -> 0 | O867: 17 | P867: 15 | Q867: =O867*6+P867 -> 117 | S867: TOORAK PARK
A868: CAMBERWELL | C868: 0 | D868: 0 | E868: =C868*6+D868 -> 0 | G868: 0 | H868: 0 | I868: =G868*6+H868 -> 0 | K868: 0 | L868: 0 | M868: =K868*6+L868 -> 0 | O868: 16 | P868: 13 | Q868: =O868*6+P868 -> 109
A869: BEST PLAYERS
A870: OAKLEIGH
A871: CAMBERWELL
A872: GOALKICKERS
A873: OAKLEIGH
A874: CAMBERWELL
A876: PRELIMINARY | E876: 2ND SEPTEMBER | J876: WEATHER
A877: CAMBERWELL | C877: 0 | D877: 0 | E877: =C877*6+D877 -> 0 | G877: 0 | H877: 0 | I877: =G877*6+H877 -> 0 | K877: 0 | L877: 0 | M877: =K877*6+L877 -> 0 | O877: 19 | P877: 14 | Q877: =O877*6+P877 -> 128 | S877: TOORAK PARK
A878: MORDIALLOC | C878: 0 | D878: 0 | E878: =C878*6+D878 -> 0 | G878: 0 | H878: 0 | I878: =G878*6+H878 -> 0 | K878: 0 | L878: 0 | M878: =K878*6+L878 -> 0 | O878: 14 | P878: 11 | Q878: =O878*6+P878 -> 95
A879: BEST PLAYERS
A880: CAMBERWELL
A881: MORDIALLOC
A882: GOALKICKERS
A883: CAMBERWELL
A884: MORDIALLOC
A886: GRAND | E886: 9TH SEPTEMBER | J886: WEATHER
A887: CAMBERWELL | C887: 6 | D887: 5 | E887: =C887*6+D887 -> 41 | G887: 12 | H887: 7 | I887: =G887*6+H887 -> 79 | K887: 15 | L887: 10 | M887: =K887*6+L887 -> 100 | O887: 18 | P887: 14 | Q887: =O887*6+P887 -> 122 | S887: TOORAK PARK
A888: OAKLEIGH | C888: 2 | D888: 2 | E888: =C888*6+D888 -> 14 | G888: 4 | H888: 5 | I888: =G888*6+H888 -> 29 | K888: 6 | L888: 7 | M888: =K888*6+L888 -> 43 | O888: 12 | P888: 11 | Q888: =O888*6+P888 -> 83
A889: BEST PLAYERS
A890: CAMBERWELL
A891: OAKLEIGH
A892: GOALKICKERS
A893: CAMBERWELL
A894: OAKLEIGH