A1: Victorian Football Association
A2: Season 1979 - Division One
A3: © Copyright Wal Williams | F3: First created: 28 July 2015
A4: Contact: joywalwi at gmail dot com | F4: Last updated: 28 July 2015 | W4: VFA Results and tables - Link to the main index page
A5: You are free to copy this document in whole or part provided that proper acknowledgement is given to the author. All rights reserved.
A7: 1979 V.F.A. SEASON FIRST DIVISION
A8: ROUND 1 | E8: 22ND APRIL | M8: WEATHER | S8: PLAYED AT
C9: 1ST QTR | H9: 2ND QTR | L9: 3RD QTR | P9: FINAL | S9: BEACH ROAD
A10: SANDRINGHAM | C10: 5 | D10: 8 | E10: =C10*6+D10 -> 38 | G10: 12 | H10: 13 | I10: =G10*6+H10 -> 85 | K10: 16 | L10: 17 | M10: =K10*6+L10 -> 113 | O10: 29 | P10: 20 | Q10: =O10*6+P10 -> 194 | S10: UMPIRE | X10: LADDER | AB10: ROUND | AD10: 1
A11: PORT MELBOURNE | C11: 4 | D11: 0 | E11: =C11*6+D11 -> 24 | G11: 5 | H11: 5 | I11: =G11*6+H11 -> 35 | K11: 10 | L11: 9 | M11: =K11*6+L11 -> 69 | O11: 13 | P11: 12 | Q11: =O11*6+P11 -> 90 | S11: STABB
A12: BEST PLAYERS | W12: TEAM | X12: W | Y12: L | Z12: D | AA12: FOR | AB12: AGST | AC12: % | AD12: PTS
A13: SANDRINGHAM | D13: SIMS | G13: HAYES | J13: WILKINS | M13: WALLEY | P13: GALVIN
A14: PORT MELBOURNE | D14: GREENING | G14: AANENSEN | J14: HOLT | M14: EVANS | W14: GEELONG WEST | X14: 1 | Y14: 0 | Z14: 0 | AA14: 193 | AB14: 71 | AC14: 271.83098591549293 | AD14: 4
A15: GOALKICKERS | L15: SIMS | N15: WILKINS | P15: GILMORE | W15: SANDRINGHAM | X15: 1 | Y15: 0 | Z15: 0 | AA15: 194 | AB15: 90 | AC15: 215.55555555555554 | AD15: 4
A16: SANDRINGHAM | D16: WALLEY 6 | F16: HUTCHISON 5 | I16: PLEDGER 4 | K16: HAYES 4 | M16: BELL 3 | O16: GIAMPAOLO 2 | R16: LYONS 2 | W16: COBURG | X16: 1 | Y16: 0 | Z16: 0 | AA16: 165 | AB16: 87 | AC16: 189.65517241379311 | AD16: 4
A17: PORT MELBOURNE | D17: HOLT 4 | G17: O'RILEY 3 | I17: LOWE 2 | K17: RASMUSSEN 2 | N17: CHRISTOU | Q17: B CLARK | W17: PRESTON | X17: 1 | Y17: 0 | Z17: 0 | AA17: 150 | AB17: 99 | AC17: 151.5151515151515 | AD17: 4
A19: PRESTON | C19: 5 | D19: 3 | E19: =C19*6+D19 -> 33 | G19: 10 | H19: 6 | I19: =G19*6+H19 -> 66 | K19: 17 | L19: 11 | M19: =K19*6+L19 -> 113 | O19: 22 | P19: 18 | Q19: =O19*6+P19 -> 150 | S19: TOORAK PARK | W19: BRUNSWICK | X19: 1 | Y19: 0 | Z19: 0 | AA19: 126 | AB19: 118 | AC19: 106.77966101694915 | AD19: 4
A20: PRAHRAN | C20: 4 | D20: 4 | E20: =C20*6+D20 -> 28 | G20: 8 | H20: 8 | I20: =G20*6+H20 -> 56 | K20: 10 | L20: 12 | M20: =K20*6+L20 -> 72 | O20: 14 | P20: 15 | Q20: =O20*6+P20 -> 99 | S20: WENN | W20: DANDENONG | X20: 0 | Y20: 1 | Z20: 0 | AA20: 118 | AB20: 126 | AC20: 93.650793650793645 | AD20: 0
A21: BEST PLAYERS | W21: PRAHRAN | X21: 0 | Y21: 1 | Z21: 0 | AA21: 99 | AB21: 150 | AC21: 66 | AD21: 0
A22: PRESTON | D22: BATT | F22: VANN | I22: JESSOP | L22: MARSHALL | O22: RYLES | R22: BOLGER | W22: FRANKSTON | X22: 0 | Y22: 1 | Z22: 0 | AA22: 87 | AB22: 165 | AC22: 52.727272727272727 | AD22: 0
A23: PRAHRAN | D23: TAYLOR | F23: WISE | I23: DICKSON | L23: KEKOVICH | O23: ROD KELY | R23: THORNTON | W23: PORT MELBOURNE | X23: 0 | Y23: 1 | Z23: 0 | AA23: 90 | AB23: 194 | AC23: 46.391752577319586 | AD23: 0
A24: GOALKICKERS | W24: CAULFIELD | X24: 0 | Y24: 1 | Z24: 0 | AA24: 71 | AB24: 193 | AC24: 36.787564766839381 | AD24: 0
A25: PRESTON | D25: VANN 10 | G25: CANN 4 | I25: JESSOP 3 | K25: BATT 2 | M25: MARTIN 2 | P25: DURWOOD
A26: PRAHRAN | D26: WISE 4 | G26: KEKOVICH 3 | J26: DICKSON 2 | M26: PREEN 2 | O26: CLARKE | Q26: D'ANGELO | S26: SMITH
A28: COBURG | C28: 5 | D28: 4 | E28: =C28*6+D28 -> 34 | G28: 10 | H28: 7 | I28: =G28*6+H28 -> 67 | K28: 19 | L28: 11 | M28: =K28*6+L28 -> 125 | O28: 25 | P28: 15 | Q28: =O28*6+P28 -> 165 | S28: COBURG
A29: FRANKSTON | C29: 5 | D29: 4 | E29: =C29*6+D29 -> 34 | G29: 6 | H29: 9 | I29: =G29*6+H29 -> 45 | K29: 9 | L29: 9 | M29: =K29*6+L29 -> 63 | O29: 13 | P29: 9 | Q29: =O29*6+P29 -> 87 | S29: McBAIN
A30: BEST PLAYERS
A31: COBURG | D31: BEATTIE | G31: BREEN | J31: CLEARY | M31: A HARBINSON | P31: SMITH | S31: DOHNT
A32: FRANKSTON | D32: SERAFINI | G32: GEDDES | J32: BARRY | M32: HUNTER | P32: LOCCO | S32: BELL
A33: GOALKICKERS
A34: COBURG | D34: SMITH 7 | F34: BEATTIE 3 | I34: HALSALL 3 | L34: DOHNT 3 | N34: BURT 2 | P34: LAIDLER 2 | R34: CLEARY 2 | U34: HODGE | W34: MILROY | X34: PITT
A35: FRANKSTON | D35: SERAFINI 6 | G35: HUNTER 2 | J35: DANKS | L35: JONES | N35: HALL | P35: GEDDES | R35: SHIELDS
A37: BRUNSWICK | C37: 4 | D37: 4 | E37: =C37*6+D37 -> 28 | G37: 8 | H37: 7 | I37: =G37*6+H37 -> 55 | K37: 13 | L37: 12 | M37: =K37*6+L37 -> 90 | O37: 19 | P37: 12 | Q37: =O37*6+P37 -> 126 | S37: DANDENONG
A38: DANDENONG | C38: 5 | D38: 5 | E38: =C38*6+D38 -> 35 | G38: 10 | H38: 9 | I38: =G38*6+H38 -> 69 | K38: 14 | L38: 13 | M38: =K38*6+L38 -> 97 | O38: 17 | P38: 16 | Q38: =O38*6+P38 -> 118 | S38: CASEY
A39: BEST PLAYERS
A40: BRUNSWICK | D40: SEERY | G40: WEST | J40: BUCKLEY | M40: CADDY | P40: FANNING | S40: LEWIS
A41: DANDENONG | D41: VAN DE BEEK | G41: WOODMAN | J41: MADDEN | M41: REID | P41: THOMPSON | S41: GOODES
A42: GOALKICKERS
A43: BRUNSWICK | D43: TOY 5 | F43: WEST 4 | H43: GUNSTON 3 | K43: B SMITH 3 | N43: CADDY | P43: STONE | R43: ORTON | T43: VALENTINE
A44: DANDENONG | D44: THOMPSON 6 | G44: WOODMAN 4 | J44: GOODES 3 | M44: MADDEN 3 | P44: COVENTRY
A46: GEELONG WEST | C46: 4 | D46: 5 | E46: =C46*6+D46 -> 29 | G46: 11 | H46: 11 | I46: =G46*6+H46 -> 77 | K46: 19 | L46: 15 | M46: =K46*6+L46 -> 129 | O46: 29 | P46: 19 | Q46: =O46*6+P46 -> 193 | S46: GEELONG WEST
A47: CAULFIELD | C47: 5 | D47: 7 | E47: =C47*6+D47 -> 37 | G47: 6 | H47: 8 | I47: =G47*6+H47 -> 44 | K47: 10 | L47: 9 | M47: =K47*6+L47 -> 69 | O47: 10 | P47: 11 | Q47: =O47*6+P47 -> 71
A48: BEST PLAYERS
A49: GEELONG WEST | D49: STENNETT | G49: GILMORE | J49: RADOJEVIC | M49: PARSONS
A50: CAULFIELD | D50: G SMITH | G50: RUSS | J50: MICHAELS
A51: GOALKICKERS
A52: GEELONG WEST | D52: RADOJEVIC 9 | G52: GILMORE 6 | J52: WOOLFE 5 | M52: SMITH 5 | O52: STENNETT 4
A53: CAULFIELD | D53: G SMITH 5 | G53: RUSS 4 | J53: MICHAELS
A55: ROUND 2 | E55: 29TH APRIL | J55: WEATHER | N55: FINE | S55: PLAYED AT
D56: 1ST QTR | H56: 2ND QTR | L56: 3RD QTR | P56: FINAL | S56: PORT MELBOURNE
A57: PORT MELBOURNE | C57: 3 | D57: 3 | E57: =C57*6+D57 -> 21 | G57: 6 | H57: 10 | I57: =G57*6+H57 -> 46 | K57: 11 | L57: 16 | M57: =K57*6+L57 -> 82 | O57: 20 | P57: 20 | Q57: =O57*6+P57 -> 140 | S57: UMPIRE | X57: LADDER | AB57: ROUND | AD57: 2
A58: DANDENONG | C58: 4 | D58: 5 | E58: =C58*6+D58 -> 29 | G58: 9 | H58: 8 | I58: =G58*6+H58 -> 62 | K58: 13 | L58: 11 | M58: =K58*6+L58 -> 89 | O58: 18 | P58: 14 | Q58: =O58*6+P58 -> 122 | S58: WENN
A59: BEST PLAYERS | W59: TEAM | X59: W | Y59: L | Z59: D | AA59: FOR | AB59: AGST | AC59: % | AD59: PTS
A60: PORT MELBOURNE | D60: AANENSEN | G60: SWAN | J60: K GOSS | M60: HAENAN | P60: COOK | R60: DEMETRIOU
A61: DANDENONG | D61: MADDEN | G61: McCONNELL | J61: SHINNERS | M61: VAN DE BEEK | P61: LUKAS | R61: DROSCHER | W61: GEELONG WEST | X61: 2 | Y61: 0 | Z61: 0 | AA61: 335 | AB61: 168 | AC61: 199.4047619047619 | AD61: 8
A62: GOALKICKERS | W62: PRESTON | X62: 2 | Y62: 0 | Z62: 0 | AA62: 335 | AB62: 244 | AC62: 137.29508196721312 | AD62: 8
A63: PORT MELBOURNE | D63: COOK 7 | F63: SWAN 4 | H63: McKENNA 3 | K63: EVANS 2 | M63: LOWE | O63: RASMUSSEN | R63: HOLT | T63: O'RILEY | W63: COBURG | X63: 1 | Y63: 1 | Z63: 0 | AA63: 269 | AB63: 207 | AC63: 129.95169082125605 | AD63: 4
A64: DANDENONG | D64: PRENDERGAST 3 | G64: THOMPSON 2 | J64: REID 2 | L64: McKAY 2 | N64: COUSINS 2 | Q64: GOODES | S64: MADDEN | W64: SANDRINGHAM | X64: 1 | Y64: 1 | Z64: 0 | AA64: 339 | AB64: 275 | AC64: 123.27272727272727 | AD64: 4
O65: WOODMAN | R65: LUKAS
A66: PRESTON | C66: 7 | D66: 3 | E66: =C66*6+D66 -> 45 | G66: 17 | H66: 7 | I66: =G66*6+H66 -> 109 | K66: 21 | L66: 11 | M66: =K66*6+L66 -> 137 | O66: 27 | P66: 23 | Q66: =O66*6+P66 -> 185 | S66: PRESTON | W66: PRAHRAN | X66: 1 | Y66: 1 | Z66: 0 | AA66: 267 | AB66: 295 | AC66: 90.508474576271183 | AD66: 4
A67: SANDRINGHAM | C67: 5 | D67: 2 | E67: =C67*6+D67 -> 32 | G67: 11 | H67: 4 | I67: =G67*6+H67 -> 70 | K67: 19 | L67: 5 | M67: =K67*6+L67 -> 119 | O67: 23 | P67: 7 | Q67: =O67*6+P67 -> 145 | S67: GROOM | W67: BRUNSWICK | X67: 1 | Y67: 1 | Z67: 0 | AA67: 223 | AB67: 260 | AC67: 85.769230769230774 | AD67: 4
A68: BEST PLAYERS | W68: PORT MELBOURNE | X68: 1 | Y68: 1 | Z68: 0 | AA68: 230 | AB68: 316 | AC68: 72.784810126582272 | AD68: 4
A69: PRESTON | D69: MARSHALL | G69: KING | J69: LORENZINI | M69: MARTIN | P69: McCULLOCH | S69: BOLGER | W69: CAULFIELD | X69: 1 | Y69: 1 | Z69: 0 | AA69: 191 | AB69: 297 | AC69: 64.309764309764304 | AD69: 4
A70: SANDRINGHAM | D70: OSBORNE | G70: HUTCHISON | J70: MULLER | M70: GALVIN | W70: DANDENONG | X70: 0 | Y70: 2 | Z70: 0 | AA70: 240 | AB70: 266 | AC70: 90.225563909774436 | AD70: 0
A71: GOALKICKERS | K71: RYLES 2 | M71: BATT | O71: CANN | Q71: JESSOP | S71: PLAIN | W71: FRANKSTON | X71: 0 | Y71: 2 | Z71: 0 | AA71: 232 | AB71: 333 | AC71: 69.669669669669673 | AD71: 0
A72: PRESTON | D72: LORENZINI 5 | G72: VANN 4 | I72: MARKS 3 | K72: MARSHALL 3 | N72: DURWOOD 2 | Q72: MARTIN 2 | S72: NICLASSEN 2
A73: SANDRINGHAM | D73: HUTCHISON 7 | G73: BELL 5 | I73: SIMS 3 | K73: MULLER 2 | M73: KEAST | O73: WILKINS | Q73: DEAGAN | S73: GALVIN | U73: WALLEY | X73: GIAMPAOLO
A75: PRAHRAN | C75: 5 | D75: 8 | E75: =C75*6+D75 -> 38 | G75: 11 | H75: 9 | I75: =G75*6+H75 -> 75 | K75: 17 | L75: 16 | M75: =K75*6+L75 -> 118 | O75: 24 | P75: 24 | Q75: =O75*6+P75 -> 168 | S75: FRANKSTON
A76: FRANKSTON | C76: 10 | D76: 4 | E76: =C76*6+D76 -> 64 | G76: 14 | H76: 8 | I76: =G76*6+H76 -> 92 | K76: 17 | L76: 10 | M76: =K76*6+L76 -> 112 | O76: 22 | P76: 13 | Q76: =O76*6+P76 -> 145 | S76: STABB
A77: BEST PLAYERS
A78: PRAHRAN | D78: SMITH | G78: KENT | J78: McGUINNESS | M78: LOWE | O78: DICKSON | R78: THORNTON
A79: FRANKSTON | D79: GEDDES | G79: SERAFINI | J79: WALTON | M79: KEDDIE | O79: DOCHERTY | R79: HALL
A80: GOALKICKERS
A81: PRAHRAN | D81: SMITH 14 | G81: PREEN 2 | I81: DICKSON 2 | L81: TAYLOR 2 | N81: KENT | P81: WISE | R81: CHAPMAN | U81: DWYER
A82: FRANKSTON | D82: SERAFINI 7 | G82: WALTON 4 | J82: KEDDIE 2 | M82: MACE 2 | O82: JONES 2 | Q82: HUNTER | S82: RIDSDALE | V82: MERCOULIA | X82: DOCHERTY | AA82: BOYD
A84: GEELONG WEST | C84: 5 | D84: 6 | E84: =C84*6+D84 -> 36 | G84: 7 | H84: 11 | I84: =G84*6+H84 -> 53 | K84: 16 | L84: 13 | M84: =K84*6+L84 -> 109 | O84: 21 | P84: 16 | Q84: =O84*6+P84 -> 142 | S84: BRUNSWICK
A85: BRUNSWICK | C85: 4 | D85: 3 | E85: =C85*6+D85 -> 27 | G85: 8 | H85: 6 | I85: =G85*6+H85 -> 54 | K85: 10 | L85: 7 | M85: =K85*6+L85 -> 67 | O85: 14 | P85: 13 | Q85: =O85*6+P85 -> 97 | S85: OAKLEY
A86: BEST PLAYERS
A87: GEELONG WEST | D87: RADOJEVIC | G87: WOOLFE | J87: YATES | M87: RUSSELL | O87: GILMORE | R87: BROWNE
A88: BRUNSWICK | D88: HADZILLIAS | G88: SEERY | J88: FANNING | M88: B SMITH | O88: STONE | R88: BUCKLEY
A89: GOALKICKERS
A90: GEELONG WEST | D90: RADOJEVIC 12 | G90: SCARLETT 3 | J90: STENNETT 2 | M90: G WELLS 2 | P90: GILMORE | R90: BEEKOF
A91: BRUNSWICK | D91: B SMITH 5 | G91: TOY 3 | I91: STONE 2 | K91: DE BOER | M91: GUNSTON | P91: ORTON | R91: BOURKE
A93: CAULFIELD | C93: 7 | D93: 4 | E93: =C93*6+D93 -> 46 | G93: 11 | H93: 9 | I93: =G93*6+H93 -> 75 | K93: 13 | L93: 19 | M93: =K93*6+L93 -> 97 | O93: 17 | P93: 18 | Q93: =O93*6+P93 -> 120 | S93: PRINCES PARK
A94: COBURG | C94: 4 | D94: 5 | E94: =C94*6+D94 -> 29 | G94: 6 | H94: 7 | I94: =G94*6+H94 -> 43 | K94: 10 | L94: 20 | M94: =K94*6+L94 -> 80 | O94: 14 | P94: 20 | Q94: =O94*6+P94 -> 104 | S94: FITZPATRICK
A95: BEST PLAYERS
A96: CAULFIELD | D96: RUSS | G96: SMITH | J96: HAWKING | M96: ROWE | O96: AMBLER | R96: EINSEDEL
A97: COBURG | D97: BURT | G97: DOUGLAS | J97: BREEN | M97: PRICE
A98: GOALKICKERS
A99: CAULFIELD | D99: SMITH 5 | F99: ROWE 2 | H99: HARTLEY 2 | J99: TROTT 2 | L99: DAVIDSON 2 | O99: O'SULLIVAN | R99: MICHAELS | U99: RUSS | W99: KING
A100: COBURG | D100: SMITH 3 | G100: BURT 3 | I100: STEVEN 2 | K100: BREEN 2 | M100: BEATTIE | O100: DOHNT | Q100: LAIDLER | S100: HARTIGAN
A102: ROUND 3 | E102: 6TH MAY | J102: WEATHER | N102: FINE | S102: PLAYED AT
D103: 1ST QTR | H103: 2ND QTR | L103: 3RD QTR | P103: FINAL | S103: DANDENONG
A104: DANDENONG | C104: 7 | D104: 7 | E104: =C104*6+D104 -> 49 | G104: 12 | H104: 9 | I104: =G104*6+H104 -> 81 | K104: 20 | L104: 15 | M104: =K104*6+L104 -> 135 | O104: 21 | P104: 18 | Q104: =O104*6+P104 -> 144 | S104: UMPIRE | X104: LADDER | AB104: ROUND | AD104: 3
A105: PRESTON | C105: 2 | D105: 2 | E105: =C105*6+D105 -> 14 | G105: 4 | H105: 7 | I105: =G105*6+H105 -> 31 | K105: 5 | L105: 12 | M105: =K105*6+L105 -> 42 | O105: 10 | P105: 20 | Q105: =O105*6+P105 -> 80 | S105: FITZPATRICK
A106: BEST PLAYERS | W106: TEAM | X106: W | Y106: L | Z106: D | AA106: FOR | AB106: AGST | AC106: % | AD106: PTS
A107: DANDENONG | D107: COUSINS | G107: BRIESE | I107: LUKAS | L107: McCONNELL | O107: BADROCK | R107: SHINNERS
A108: PRESTON | D108: MARKS | G108: BOLGER | I108: FREEMAN | W108: GEELONG WEST | X108: 3 | Y108: 0 | Z108: 0 | AA108: 470 | AB108: 268 | AC108: 175.37313432835822 | AD108: 12
A109: GOALKICKERS | O109: VAN DE BEEK | S109: MADDEN | W109: PRAHRAN | X109: 2 | Y109: 1 | Z109: 0 | AA109: 471 | AB109: 426 | AC109: 110.56338028169014 | AD109: 8
A110: DANDENONG | D110: THOMPSON 5 | G110: BRIESE 5 | I110: SHINNERS 3 | L110: PRENDERGAST 3 | O110: COUSINS | Q110: LUKAS | S110: HORAZCKO | W110: PRESTON | X110: 2 | Y110: 1 | Z110: 0 | AA110: 415 | AB110: 388 | AC110: 106.96 | AD110: 8
A111: PRESTON | D111: MARKS 3 | F111: LORENZINI 2 | I111: BATT 2 | K111: SALTMARSH | N111: MARTIN | P111: NICLASSEN | W111: PORT MELBOURNE | X111: 2 | Y111: 1 | Z111: 0 | AA111: 404 | AB111: 467 | AC111: 86.509635974304075 | AD111: 8
A113: FRANKSTON | C113: 6 | D113: 5 | E113: =C113*6+D113 -> 41 | G113: 13 | H113: 11 | I113: =G113*6+H113 -> 89 | K113: 18 | L113: 16 | M113: =K113*6+L113 -> 124 | O113: 26 | P113: 21 | Q113: =O113*6+P113 -> 177 | S113: BEACH ROAD | W113: DANDENONG | X113: 1 | Y113: 2 | Z113: 0 | AA113: 384 | AB113: 346 | AC113: 110.98 | AD113: 4
A114: SANDRINGHAM | C114: 4 | D114: 2 | E114: =C114*6+D114 -> 26 | G114: 12 | H114: 8 | I114: =G114*6+H114 -> 80 | K114: 16 | L114: 14 | M114: =K114*6+L114 -> 110 | O114: 19 | P114: 16 | Q114: =O114*6+P114 -> 130 | S114: WENN | W114: COBURG | X114: 1 | Y114: 2 | Z114: 0 | AA114: 369 | AB114: 342 | AC114: 107.89473684210526 | AD114: 4
A115: BEST PLAYERS | W115: SANDRINGHAM | X115: 1 | Y115: 2 | Z115: 0 | AA115: 469 | AB115: 452 | AC115: 103.76106194690266 | AD115: 4
A116: FRANKSTON | D116: KENNEDY | G116: GEDDES | J116: MACE | M116: HALL | O116: HUNTER | R116: STAPLETON | W116: FRANKSTON | X116: 1 | Y116: 2 | Z116: 0 | AA116: 409 | AB116: 463 | AC116: 88.336933045356375 | AD116: 4
A117: SANDRINGHAM | D117: OSBORNE | G117: HUTCHISON | J117: LYONS | W117: BRUNSWICK | X117: 1 | Y117: 2 | Z117: 0 | AA117: 374 | AB117: 434 | AC117: 86.175115207373267 | AD117: 4
A118: GOALKICKERS | N118: MACE | P118: RIDSDALE | S118: WALTON | W118: CAULFIELD | X118: 1 | Y118: 2 | Z118: 0 | AA118: 322 | AB118: 501 | AC118: 64.271457085828345 | AD118: 4
A119: FRANKSTON | D119: HUNTER 7 | F119: SERAFINI 6 | I119: HALL 3 | K119: MERCOULIA 2 | N119: KENNEDY 2 | Q119: JONES 2 | S119: BOYD
A120: SANDRINGHAM | D120: WALLEY 4 | G120: HUTCHINSON 4 | J120: PLEDGER 2 | M120: HAYES 2 | O120: GILMORE 2 | R120: SIMS 2 | T120: LYONS | V120: CLARK | X120: ADAMS
A122: PRAHRAN | C122: 7 | D122: 3 | E122: =C122*6+D122 -> 45 | G122: 13 | H122: 9 | I122: =G122*6+H122 -> 87 | K122: 22 | L122: 12 | M122: =K122*6+L122 -> 144 | O122: 31 | P122: 18 | Q122: =O122*6+P122 -> 204 | S122: TOORAK PARK
A123: CAULFIELD | C123: 6 | D123: 3 | E123: =C123*6+D123 -> 39 | G123: 12 | H123: 8 | I123: =G123*6+H123 -> 80 | K123: 15 | L123: 14 | M123: =K123*6+L123 -> 104 | O123: 19 | P123: 17 | Q123: =O123*6+P123 -> 131 | S123: TORNEY
A124: BEST PLAYERS
A125: PRAHRAN | D125: AUSTIN | G125: McGUINNESS | J125: SMITH | L125: DICKSON | O125: PREEN | Q125: THORNTON
A126: CAULFIELD | D126: DAVIDSON | G126: RUSS | J126: ROWE | L126: HAWKING
A127: GOALKICKERS
A128: PRAHRAN | D128: SMITH 10 | F128: DICKSON 6 | I128: CLARKE 4 | K128: PREEN 3 | M128: AUSTIN 2 | O128: DWYER 2 | Q128: TWOMEY 2 | T128: TAYLOR | W128: CHAPMAN
A129: CAULFIELD | D129: DAVIDSON 3 | G129: HAWKING 3 | J129: LESTER 3 | M129: TROTT 2 | O129: ROWE 2 | Q129: O'SULLIVAN 2 | T129: KING | V129: RUSS | X129: SUTHERLAND | AB129: HARTLEY
A131: GEELONG WEST | C131: 5 | D131: 4 | E131: =C131*6+D131 -> 34 | G131: 10 | H131: 9 | I131: =G131*6+H131 -> 69 | K131: 16 | L131: 13 | M131: =K131*6+L131 -> 109 | O131: 19 | P131: 21 | Q131: =O131*6+P131 -> 135 | S131: COBURG
A132: COBURG | C132: 6 | D132: 4 | E132: =C132*6+D132 -> 40 | G132: 7 | H132: 8 | I132: =G132*6+H132 -> 50 | K132: 10 | L132: 9 | M132: =K132*6+L132 -> 69 | O132: 15 | P132: 10 | Q132: =O132*6+P132 -> 100 | S132: STABB
A133: BEST PLAYERS
A134: GEELONG WEST | D134: YATES | G134: SCARLETT | J134: ARKLAY | L134: STENNETT | O134: GILMORE | R134: G WELLS
A135: COBURG | D135: BURT | G135: HARTIGAN | J135: PITT | L135: CLEARY | O135: COLLINS
A136: GOALKICKERS
A137: GEELONG WEST | D137: RADOJEVIC 6 | G137: SCARLETT 3 | J137: STENNETT 2 | M137: WOOLFE 2 | O137: S WELLS | Q137: G WELLS | S137: YATES | U137: ARKLAY | X137: GILMORE | AA137: BEEKOF
A138: COBURG | D138: SMITH 5 | F138: CLEARY 2 | I138: BREEN 2 | K138: SIMPSON | M138: HARBINSON | P138: LAIDLER | R138: DOHNT | T138: DOUGLAS | W138: BEATTIE
A140: PORT MELBOURNE | C140: 7 | D140: 5 | E140: =C140*6+D140 -> 47 | G140: 14 | H140: 10 | I140: =G140*6+H140 -> 94 | K140: 19 | L140: 15 | M140: =K140*6+L140 -> 129 | O140: 26 | P140: 18 | Q140: =O140*6+P140 -> 174 | S140: PORT MELBOURNE
A141: BRUNSWICK | C141: 6 | D141: 4 | E141: =C141*6+D141 -> 40 | G141: 13 | H141: 8 | I141: =G141*6+H141 -> 86 | K141: 17 | L141: 12 | M141: =K141*6+L141 -> 114 | O141: 22 | P141: 19 | Q141: =O141*6+P141 -> 151 | S141: MATHEWS
A142: BEST PLAYERS
A143: PORT MELBOURNE | D143: K GOSS | G143: G EVANS | J143: AANENSEN | M143: DERMOTT | O143: COOK | R143: HARLAND
A144: BRUNSWICK | D144: R SMITH | G144: BYRNE | J144: TOY | M144: DELL | O144: STONE | R144: GUNSTONE
A145: GOALKICKERS
A146: PORT MELBOURNE | D146: COOK 10 | F146: EVANS 7 | H146: THORPE 2 | J146: McKENNA 2 | M146: K GOSS 2 | O146: AANENSEN | R146: O'RILEY | T146: HOLT
A147: BRUNSWICK | D147: R SMITH 9 | G147: DELL 3 | I147: GUNSTONE 2 | L147: BYRNE 2 | N147: TOY 2 | P147: LAWRENCE | R147: ORTON | T147: McCUTCHEON | X147: STONE
A149: ROUND 4 | E149: 13TH MAY | J149: WEATHER | N149: SOUTH WEST WIND | S149: PLAYED AT
D150: 1ST QTR | H150: 2ND QTR | L150: 3RD QTR | P150: FINAL | S150: GEELONG WEST
A151: GEELONG WEST | C151: 5 | D151: 4 | E151: =C151*6+D151 -> 34 | G151: 12 | H151: 9 | I151: =G151*6+H151 -> 81 | K151: 17 | L151: 11 | M151: =K151*6+L151 -> 113 | O151: 22 | P151: 13 | Q151: =O151*6+P151 -> 145 | S151: UMPIRE | X151: LADDER | AB151: ROUND | AD151: 4
A152: PRAHRAN | C152: 4 | D152: 4 | E152: =C152*6+D152 -> 28 | G152: 5 | H152: 9 | I152: =G152*6+H152 -> 39 | K152: 11 | L152: 21 | M152: =K152*6+L152 -> 87 | O152: 15 | P152: 23 | Q152: =O152*6+P152 -> 113 | S152: MORGAN
A153: BEST PLAYERS | W153: TEAM | X153: W | Y153: L | Z153: D | AA153: FOR | AB153: AGST | AC153: % | AD153: PTS
A154: GEELONG WEST | D154: G WELLS | G154: DURRAN | J154: RUSSELL | M154: S WELLS | O154: GILMORE | Q154: SCARLETT
A155: PRAHRAN | D155: McGUINNESS | G155: TAYLOR | J155: THORNTON | M155: SMITH | O155: DWYER | Q155: FOLEY | W155: GEELONG WEST | X155: 4 | Y155: 0 | Z155: 0 | AA155: 615 | AB155: 381 | AC155: 161.41732283464566 | AD155: 16
A156: GOALKICKERS | S156: ARKLAY | W156: PORT MELBOURNE | X156: 3 | Y156: 1 | Z156: 0 | AA156: 494 | AB156: 557 | AC156: 88.689407540394967 | AD156: 12
A157: GEELONG WEST | D157: STENNETT 6 | G157: RADOJEVIC 4 | J157: GILMORE 4 | M157: SCARLETT 3 | P157: G WELLS 2 | R157: S WELLS 2 | W157: COBURG | X157: 2 | Y157: 2 | Z157: 0 | AA157: 481 | AB157: 444 | AC157: 108.33333333333333 | AD157: 8
A158: PRAHRAN | D158: SMITH 8 | G158: DICKSON 2 | J158: McGUINNESS 2 | N158: PREEN | P158: TAYLOR | R158: ZUENERT | W158: PRESTON | X158: 2 | Y158: 2 | Z158: 0 | AA158: 505 | AB158: 478 | AC158: 105.65 | AD158: 8
A160: CAULFIELD | C160: 4 | D160: 5 | E160: =C160*6+D160 -> 29 | G160: 7 | H160: 8 | I160: =G160*6+H160 -> 50 | K160: 15 | L160: 15 | M160: =K160*6+L160 -> 105 | O160: 19 | P160: 19 | Q160: =O160*6+P160 -> 133 | S160: PRINCES PARK | W160: PRAHRAN | X160: 2 | Y160: 2 | Z160: 0 | AA160: 584 | AB160: 571 | AC160: 102.27670753064798 | AD160: 8
A161: SANDRINGHAM | C161: 3 | D161: 5 | E161: =C161*6+D161 -> 23 | G161: 10 | H161: 12 | I161: =G161*6+H161 -> 72 | K161: 14 | L161: 17 | M161: =K161*6+L161 -> 101 | O161: 18 | P161: 21 | Q161: =O161*6+P161 -> 129 | S161: McBAIN | W161: FRANKSTON | X161: 2 | Y161: 2 | Z161: 0 | AA161: 527 | AB161: 577 | AC161: 91.334488734835361 | AD161: 8
A162: BEST PLAYERS | W162: CAULFIELD | X162: 2 | Y162: 2 | Z162: 0 | AA162: 455 | AB162: 630 | AC162: 72.222222222222229 | AD162: 8
A163: CAULFIELD | D163: P FRIGO | G163: KING | J163: TAYLOR | M163: BOOTH | O163: BRAZIER | W163: DANDENONG | X163: 1 | Y163: 3 | Z163: 0 | AA163: 498 | AB163: 464 | AC163: 107.33 | AD163: 4
A164: SANDRINGHAM | D164: GIAMPAOLO | G164: OSBORNE | J164: HUTCHISON | M164: SIMS | O164: CLARK | W164: SANDRINGHAM | X164: 1 | Y164: 3 | Z164: 0 | AA164: 598 | AB164: 585 | AC164: 102.22222222222223 | AD164: 4
A165: GOALKICKERS | Q165: ROWE | W165: BRUNSWICK | X165: 1 | Y165: 3 | Z165: 0 | AA165: 476 | AB165: 546 | AC165: 87.179487179487182 | AD165: 4
A166: CAULFIELD | D166: G SMITH 5 | F166: TAYLOR 5 | I166: EINSEDEL 2 | L166: HARTLEY 2 | N166: BOOTH | P166: DAVIDSON | R166: KING | T166: SAUNDERS
A167: SANDRINGHAM | D167: GIAMPAOLO 5 | G167: BELL 4 | I167: HUTCHISON 2 | L167: SIMS 2 | N167: PLEDGER | P167: MULLER | R167: GILMORE | U167: WALLEY | X167: HAYES
A169: FRANKSTON | C169: 2 | D169: 2 | E169: =C169*6+D169 -> 14 | G169: 10 | H169: 11 | I169: =G169*6+H169 -> 71 | K169: 12 | L169: 21 | M169: =K169*6+L169 -> 93 | O169: 15 | P169: 28 | Q169: =O169*6+P169 -> 118 | S169: FRANKSTON
A170: DANDENONG | C170: 6 | D170: 4 | E170: =C170*6+D170 -> 40 | G170: 9 | H170: 7 | I170: =G170*6+H170 -> 61 | K170: 15 | L170: 10 | M170: =K170*6+L170 -> 100 | O170: 16 | P170: 18 | Q170: =O170*6+P170 -> 114 | S170: MATHEWS
A171: BEST PLAYERS
A172: FRANKSTON | D172: GEDDES | G172: SERAFINI | J172: JONES | L172: MACE | O172: HALL | R172: YOUNG
A173: DANDENONG | D173: McCONNELL | G173: WOODMAN | J173: REID | L173: MADDEN | O173: SHINNERS | R173: LUKAS
A174: GOALKICKERS
A175: FRANKSTON | D175: SERAFINI 6 | G175: KENNEDY 2 | J175: SAMPSON 2 | M175: MACE | N175: JONES | P175: RIDSDALE | R175: MERCOULIA | U175: WALTON
A176: DANDENONG | D176: WOODMAN 4 | G176: WRIGHT 3 | J176: GUY 3 | L176: SHINNERS 2 | O176: MADDEN 2 | R176: COUSINS | U176: THOMPSON
A178: COBURG | C178: 5 | D178: 9 | E178: =C178*6+D178 -> 39 | G178: 9 | H178: 16 | I178: =G178*6+H178 -> 70 | K178: 12 | L178: 20 | M178: =K178*6+L178 -> 92 | O178: 15 | P178: 22 | Q178: =O178*6+P178 -> 112 | S178: BRUNSWICK
A179: BRUNSWICK | C179: 2 | D179: 3 | E179: =C179*6+D179 -> 15 | G179: 8 | H179: 5 | I179: =G179*6+H179 -> 53 | K179: 12 | L179: 8 | M179: =K179*6+L179 -> 80 | O179: 15 | P179: 12 | Q179: =O179*6+P179 -> 102 | S179: TORNEY
A180: BEST PLAYERS
A181: COBURG | D181: BURT | G181: HARBINSON | J181: DOUGLAS | M181: DOHNT | O181: CLEARY | R181: BEATTIE
A182: BRUNSWICK | D182: STONE | G182: TOY | J182: R SMITH | M182: BUCKLEY | O182: SEERY | R182: LAWRENCE
A183: GOALKICKERS
A184: COBURG | D184: SMITH 6 | G184: BEATTIE 3 | J184: BURT 2 | L184: HERBERT 2 | O184: HALBERT 2
A185: BRUNSWICK | D185: STONE 4 | G185: TOY 3 | I185: B SMITH 2 | L185: BUCKLEY 2 | N185: FANNING | P185: GUNSTONE | R185: HADZILLIAS | U185: BYRNE
A187: PORT MELBOURNE | C187: 4 | D187: 2 | E187: =C187*6+D187 -> 26 | G187: 7 | H187: 9 | I187: =G187*6+H187 -> 51 | K187: 9 | L187: 14 | M187: =K187*6+L187 -> 68 | O187: 12 | P187: 18 | Q187: =O187*6+P187 -> 90 | S187: PRESTON | W187: MATCH AWARDED TO
A188: PRESTON | C188: 4 | D188: 5 | E188: =C188*6+D188 -> 29 | G188: 8 | H188: 9 | I188: =G188*6+H188 -> 57 | K188: 11 | L188: 11 | M188: =K188*6+L188 -> 77 | O188: 13 | P188: 12 | Q188: =O188*6+P188 -> 90 | S188: STABB | W188: PORT MELBOURNE
A189: BEST PLAYERS
A190: PORT MELBOURNE | D190: DERMOTT | G190: K GOSS | J190: AANENSEN | M190: SWAN | O190: O'RILEY | R190: EVANS
A191: PRESTON | D191: BOLGER | G191: G MARSHALL | J191: P MARSHALL | M191: TOWAN | O191: MARTIN | R191: FREEMAN
A192: GOALKICKERS
A193: PORT MELBOURNE | D193: McKENNA 4 | G193: COOK 2 | I193: O'RILEY 2 | K193: EVANS 2 | M193: BEDFORD | O193: SWAN
A194: PRESTON | D194: VANN 3 | G194: NICLASSEN 2 | J194: WALSH 2 | M194: G MARSHALL 2 | P194: P MARSHALL | S194: JESSOP | U194: CANN
A196: ROUND 5 | E196: 20TH MAY | J196: WEATHER | N196: FINE | S196: PLAYED AT
D197: 1ST QTR | H197: 2ND QTR | L197: 3RD QTR | P197: FINAL | S197: DANDENONG
A198: DANDENONG | C198: 1 | D198: 6 | E198: =C198*6+D198 -> 12 | G198: 7 | H198: 13 | I198: =G198*6+H198 -> 55 | K198: 11 | L198: 17 | M198: =K198*6+L198 -> 83 | O198: 18 | P198: 22 | Q198: =O198*6+P198 -> 130 | S198: UMPIRE | X198: LADDER | AB198: ROUND | AD198: 5
A199: COBURG | C199: 4 | D199: 4 | E199: =C199*6+D199 -> 28 | G199: 8 | H199: 12 | I199: =G199*6+H199 -> 60 | K199: 13 | L199: 12 | M199: =K199*6+L199 -> 90 | O199: 16 | P199: 14 | Q199: =O199*6+P199 -> 110 | S199: OAKLEY
A200: BEST PLAYERS | W200: TEAM | X200: W | Y200: L | Z200: D | AA200: FOR | AB200: AGST | AC200: % | AD200: PTS
A201: DANDENONG | D201: REID | F201: ALLAN | I201: THOMPSON | L201: VAN DE BEEK | O201: MADDEN | Q201: WRIGHT
A202: COBURG | D202: PRICE | F202: FISHER | I202: BEATTIE | L202: DOUGLAS | W202: GEELONG WEST | X202: 5 | Y202: 0 | Z202: 0 | AA202: 736 | AB202: 491 | AC202: 149.89816700610999 | AD202: 20
A203: GOALKICKERS | W203: PRAHRAN | X203: 3 | Y203: 2 | Z203: 0 | AA203: 722 | AB203: 697 | AC203: 103.5868005738881 | AD203: 12
A204: DANDENONG | D204: WRIGHT 4 | F204: MADDEN 4 | I204: BRIESE 3 | K204: THOMPSON 3 | N204: WOODMAN 2 | Q204: SHINNERS | S204: McKAY | W204: PORT MELBOURNE | X204: 3 | Y204: 2 | Z204: 0 | AA204: 604 | AB204: 678 | AC204: 89.08554572271386 | AD204: 12
A205: COBURG | D205: SMITH 4 | F205: PRICE 3 | H205: HALBERT 2 | K205: DOHNT 2 | M205: FISHER | O205: CLEARY | Q205: BREEN | S205: SANDERSON | W205: CAULFIELD | X205: 3 | Y205: 2 | Z205: 0 | AA205: 583 | AB205: 766 | AC205: 76.10966057441253 | AD205: 12
A207: PRAHRAN | C207: 3 | D207: 5 | E207: =C207*6+D207 -> 23 | G207: 9 | H207: 10 | I207: =G207*6+H207 -> 64 | K207: 14 | L207: 14 | M207: =K207*6+L207 -> 98 | O207: 20 | P207: 18 | Q207: =O207*6+P207 -> 138 | S207: BEACH ROAD | W207: DANDENONG | X207: 2 | Y207: 3 | Z207: 0 | AA207: 628 | AB207: 574 | AC207: 109.41 | AD207: 8
A208: SANDRINGHAM | C208: 3 | D208: 3 | E208: =C208*6+D208 -> 21 | G208: 7 | H208: 6 | I208: =G208*6+H208 -> 48 | K208: 16 | L208: 7 | M208: =K208*6+L208 -> 103 | O208: 19 | P208: 12 | Q208: =O208*6+P208 -> 126 | S208: FITZPATRICK | W208: PRESTON | X208: 2 | Y208: 3 | Z208: 0 | AA208: 641 | AB208: 606 | AC208: 105.78 | AD208: 8
A209: BEST PLAYERS | W209: COBURG | X209: 2 | Y209: 3 | Z209: 0 | AA209: 591 | AB209: 574 | AC209: 102.96167247386759 | AD209: 8
A210: PRAHRAN | D210: DICKSON | G210: ZEUNART | J210: CHAPMAN | M210: PREEN | O210: AUSTIN | Q210: THORNTON | W210: FRANKSTON | X210: 2 | Y210: 3 | Z210: 0 | AA210: 656 | AB210: 710 | AC210: 92.394366197183103 | AD210: 8
A211: SANDRINGHAM | D211: MULLER | G211: HAYES | J211: GIAMPAOLO | M211: SIMS | O211: ELLIOTT | Q211: WILKINS | W211: BRUNSWICK | X211: 2 | Y211: 3 | Z211: 0 | AA211: 609 | AB211: 675 | AC211: 90.222222222222229 | AD211: 8
A212: GOALKICKERS | W212: SANDRINGHAM | X212: 1 | Y212: 4 | Z212: 0 | AA212: 724 | AB212: 723 | AC212: 100.13831258644537 | AD212: 4
A213: PRAHRAN | D213: SMITH 5 | F213: DICKSON 4 | I213: PREEN 3 | K213: ZEUNART 2 | N213: WISE 2 | P213: TWOMEY 2 | R213: TAYLOR | T213: CLARKE
A214: SANDRINGHAM | D214: HAYES 4 | F214: HUTCHISON 3 | I214: McNICHOLAS 3 | L214: ELLIOTT 3 | N214: GIAMPAOLO 2 | Q214: MACKIE 2 | S214: MULLER | U214: SIMS
A216: GEELONG WEST | C216: 4 | D216: 7 | E216: =C216*6+D216 -> 31 | G216: 6 | H216: 12 | I216: =G216*6+H216 -> 48 | K216: 11 | L216: 16 | M216: =K216*6+L216 -> 82 | O216: 17 | P216: 19 | Q216: =O216*6+P216 -> 121 | S216: PORT MELBOURNE
A217: PORT MELBOURNE | C217: 4 | D217: 6 | E217: =C217*6+D217 -> 30 | G217: 7 | H217: 10 | I217: =G217*6+H217 -> 52 | K217: 10 | L217: 17 | M217: =K217*6+L217 -> 77 | O217: 15 | P217: 20 | Q217: =O217*6+P217 -> 110 | S217: GROOM
A218: BEST PLAYERS
A219: GEELONG WEST | D219: DURRAN | G219: G WELLS | J219: RUSSELL | M219: DEEATH | O219: SMITH
A220: PORT MELBOURNE | D220: AANENSEN | G220: O'RILEY | J220: DERMOTT | M220: SWAN | O220: EVANS | Q220: STIBBARD
A221: GOALKICKERS
A222: GEELONG WEST | D222: RADOJEVIC 4 | G222: G WELLS 4 | J222: STENNETT 2 | M222: DEEATH | O222: BROWNE | Q222: ARKLAY | S222: HINCK | U222: BEEKOF | W222: GILMORE | X222: S WELLS
A223: PORT MELBOURNE | D223: CHRISTOU 5 | G223: COOK 2 | I223: B CLARK 2 | L223: LOWE 2 | N223: O'RILEY 2 | Q223: K GOSS | S223: SCOTT
A225: BRUNSWICK | C225: 3 | D225: 6 | E225: =C225*6+D225 -> 24 | G225: 10 | H225: 11 | I225: =G225*6+H225 -> 71 | K225: 13 | L225: 13 | M225: =K225*6+L225 -> 91 | O225: 19 | P225: 19 | Q225: =O225*6+P225 -> 133 | S225: BRUNSWICK
A226: FRANKSTON | C226: 6 | D226: 5 | E226: =C226*6+D226 -> 41 | G226: 11 | H226: 9 | I226: =G226*6+H226 -> 75 | K226: 16 | L226: 11 | M226: =K226*6+L226 -> 107 | O226: 19 | P226: 15 | Q226: =O226*6+P226 -> 129 | S226: HEDGER
A227: BEST PLAYERS
A228: BRUNSWICK | D228: STONE | G228: SEERY | J228: THORSEN | M228: BUCKLEY | O228: WEST | Q228: LAWRENCE
A229: FRANKSTON | D229: HUNTER | G229: KEDDIE | J229: DOCHERTY | M229: KENNEDY | O229: WALTON
A230: GOALKICKERS
A231: BRUNSWICK | D231: STONE 6 | G231: TOY 5 | I231: B SMITH 4 | L231: WEST 2 | N231: DELL | P231: BUCKLEY
A232: FRANKSTON | D232: SERAFINI 6 | G232: KENNEDY 5 | J232: HUNTER 2 | M232: WALTON 2 | P232: DOCHERTY 2 | S232: GEDDES | U232: MERCOULIA
A234: PRESTON | C234: 6 | D234: 4 | E234: =C234*6+D234 -> 40 | G234: 13 | H234: 7 | I234: =G234*6+H234 -> 85 | K234: 15 | L234: 10 | M234: =K234*6+L234 -> 100 | O234: 20 | P234: 16 | Q234: =O234*6+P234 -> 136 | S234: PRESTON | W234: MATCH AWARDED TO
A235: CAULFIELD | C235: 7 | D235: 0 | E235: =C235*6+D235 -> 42 | G235: 11 | H235: 0 | I235: =G235*6+H235 -> 66 | K235: 16 | L235: 8 | M235: =K235*6+L235 -> 104 | O235: 20 | P235: 8 | Q235: =O235*6+P235 -> 128 | S235: MATHEWS | W235: CAULFIELD
A236: BEST PLAYERS
A237: PRESTON | D237: BOLGER | G237: McCONNELL | J237: MARKS | M237: G MARSHALL | P237: MARTIN | R237: P MARSHALL
A238: CAULFIELD | D238: ROWE | G238: ADAMS | J238: KING | M238: AMBLER | P238: McLAUGHLIN
A239: GOALKICKERS
A240: PRESTON | D240: MARKS 5 | F240: VANN 3 | H240: G MARSHALL 2 | K240: CANN 2 | M240: JESSOP 2 | O240: LORENZINI 2 | R240: P MARSHALL 2 | V240: BATT | X240: McCONNELL
A241: CAULFIELD | D241: SMITH 4 | F241: TAYLOR 3 | I241: DAVIDSON 3 | L241: EINSEDEL 2 | N241: KING 2 | P241: ROWE 2 | R241: O'SULLIVAN | U241: BOOTH | W241: HUNTER | X241: UPFAL
A243: ROUND 6 | E243: 27TH MAY | J243: WEATHER | N243: SHOWERS | S243: PLAYED AT
D244: 1ST QTR | H244: 2ND QTR | L244: 3RD QTR | P244: FINAL | S244: BEACH ROAD
A245: SANDRINGHAM | C245: 6 | D245: 2 | E245: =C245*6+D245 -> 38 | G245: 12 | H245: 10 | I245: =G245*6+H245 -> 82 | K245: 13 | L245: 10 | M245: =K245*6+L245 -> 88 | O245: 15 | P245: 14 | Q245: =O245*6+P245 -> 104 | S245: UMPIRE | X245: LADDER | AB245: ROUND | AD245: 6
A246: BRUNSWICK | C246: 0 | D246: 4 | E246: =C246*6+D246 -> 4 | G246: 0 | H246: 9 | I246: =G246*6+H246 -> 9 | K246: 6 | L246: 17 | M246: =K246*6+L246 -> 53 | O246: 10 | P246: 20 | Q246: =O246*6+P246 -> 80 | S246: MORGAN
A247: BEST PLAYERS | W247: TEAM | X247: W | Y247: L | Z247: D | AA247: FOR | AB247: AGST | AC247: % | AD247: PTS
A248: SANDRINGHAM | D248: MILLER | G248: ROBINSON | J248: O'BRIEN | M248: SIMS | O248: HAYES | R248: ELLIOTT
A249: BRUNSWICK | D249: FANNING | G249: LAWRENCE | J249: STONE | M249: HARVEY | O249: R SMITH | R249: KIMPTON | W249: GEELONG WEST | X249: 6 | Y249: 0 | Z249: 0 | AA249: 856 | AB249: 591 | AC249: 144.83925549915398 | AD249: 24
A250: GOALKICKERS | W250: COBURG | X250: 3 | Y250: 3 | Z250: 0 | AA250: 719 | AB250: 643 | AC250: 111.81959564541214 | AD250: 12
A251: SANDRINGHAM | D251: HAYES 3 | F251: MANNIX 3 | I251: SIMS 3 | K251: CARROLL 2 | N251: ELLIOTT 2 | Q251: BELL | R251: LYONS | W251: DANDENONG | X251: 3 | Y251: 3 | Z251: 0 | AA251: 715 | AB251: 657 | AC251: 108.83 | AD251: 12
A252: BRUNSWICK | D252: BYE 3 | F252: DOLAN 2 | I252: THORSEN 2 | L252: B SMITH | N252: CROTTY | P252: STONE | W252: PRAHRAN | X252: 3 | Y252: 3 | Z252: 0 | AA252: 805 | AB252: 784 | AC252: 102.67857142857143 | AD252: 12
A254: DANDENONG | C254: 3 | D254: 0 | E254: =C254*6+D254 -> 18 | G254: 8 | H254: 3 | I254: =G254*6+H254 -> 51 | K254: 9 | L254: 5 | M254: =K254*6+L254 -> 59 | O254: 13 | P254: 9 | Q254: =O254*6+P254 -> 87 | S254: TOORAK PARK | W254: FRANKSTON | X254: 3 | Y254: 3 | Z254: 0 | AA254: 778 | AB254: 825 | AC254: 94.303030303030297 | AD254: 12
A255: PRAHRAN | C255: 4 | D255: 1 | E255: =C255*6+D255 -> 25 | G255: 5 | H255: 3 | I255: =G255*6+H255 -> 33 | K255: 13 | L255: 4 | M255: =K255*6+L255 -> 82 | O255: 13 | P255: 5 | Q255: =O255*6+P255 -> 83 | S255: GROOM | W255: PORT MELBOURNE | X255: 3 | Y255: 3 | Z255: 0 | AA255: 673 | AB255: 806 | AC255: 83.498759305210925 | AD255: 12
A256: BEST PLAYERS | W256: CAULFIELD | X256: 3 | Y256: 3 | Z256: 0 | AA256: 698 | AB256: 888 | AC256: 78.603603603603602 | AD256: 12
A257: DANDENONG | D257: BRIESE | G257: DROSCHER | J257: COUSINS | M257: McCONNELL | P257: WOODMAN | R257: THOMPSON | W257: SANDRINGHAM | X257: 2 | Y257: 4 | Z257: 0 | AA257: 828 | AB257: 803 | AC257: 103.11332503113324 | AD257: 8
A258: PRAHRAN | D258: AUSTIN | G258: THORNTON | J258: PEPE | M258: FOLEY | P258: ZEUNART | W258: PRESTON | X258: 2 | Y258: 4 | Z258: 0 | AA258: 741 | AB258: 726 | AC258: 102.07 | AD258: 8
A259: GOALKICKERS | W259: BRUNSWICK | X259: 2 | Y259: 4 | Z259: 0 | AA259: 689 | AB259: 779 | AC259: 88.446726572528888 | AD259: 8
A260: DANDENONG | D260: THOMPSON 4 | G260: BRIESE 3 | I260: McKAY 2 | K260: WOODMAN | N260: COUSINS | P260: ALLAN | R260: WRIGHT
A261: PRAHRAN | D261: DICKSON 4 | G261: SMITH 3 | I261: CLARKE 2 | L261: SOULOS | N261: ZEUNART | P261: WISE | Q261: PREEN
A263: COBURG | C263: 10 | D263: 3 | E263: =C263*6+D263 -> 63 | G263: 12 | H263: 8 | I263: =G263*6+H263 -> 80 | K263: 15 | L263: 9 | M263: =K263*6+L263 -> 99 | O263: 19 | P263: 14 | Q263: =O263*6+P263 -> 128 | S263: COBURG
A264: PORT MELBOURNE | C264: 5 | D264: 3 | E264: =C264*6+D264 -> 33 | G264: 6 | H264: 8 | I264: =G264*6+H264 -> 44 | K264: 7 | L264: 11 | M264: =K264*6+L264 -> 53 | O264: 9 | P264: 15 | Q264: =O264*6+P264 -> 69 | S264: FITZPATRICK
A265: BEST PLAYERS
A266: COBURG | D266: FISHER | G266: BURT | J266: DOHNT | L266: PITT | N266: MILROY | P266: CLEARY
A267: PORT MELBOURNE | D267: AANENSEN | G267: STIBBARD | J267: SWAN | L267: DERMOTT
A268: GOALKICKERS
A269: COBURG | D269: SMITH 5 | G269: FISHER 4 | I269: CLEARY 3 | K269: DOHNT 3 | M269: PRICE 2 | O269: HERBERT | Q269: HALBERT
A270: PORT MELBOURNE | D270: O'RILEY 2 | G270: COOK 2 | J270: HARLAND | L270: AANENSEN | N270: BEDFORD | P270: WHARTON | R270: EVANS
A272: GEELONG WEST | C272: 7 | D272: 5 | E272: =C272*6+D272 -> 47 | G272: 9 | H272: 7 | I272: =G272*6+H272 -> 61 | K272: 15 | L272: 11 | M272: =K272*6+L272 -> 101 | O272: 18 | P272: 12 | Q272: =O272*6+P272 -> 120 | S272: GEELONG WEST
A273: PRESTON | C273: 1 | D273: 3 | E273: =C273*6+D273 -> 9 | G273: 4 | H273: 6 | I273: =G273*6+H273 -> 30 | K273: 8 | L273: 8 | M273: =K273*6+L273 -> 56 | O273: 14 | P273: 16 | Q273: =O273*6+P273 -> 100 | S273: HEDGER
A274: BEST PLAYERS
A275: GEELONG WEST | D275: GIBSON | F275: RUSSELL | I275: SCARLETT | L275: RADOJEVIC | O275: DURRAN | R275: WOOLFE
A276: PRESTON | D276: BOLGER | F276: McCONNELL | I276: McCULLOCH | L276: COOPER | O276: G MARSHALL | R276: WALSH
A277: GOALKICKERS
A278: GEELONG WEST | D278: RADOJEVIC 7 | G278: HINCK 2 | I278: G WELLS 2 | L278: STENNETT 2 | O278: BROWNE | Q278: DEEATH | S278: GILMORE | V278: PARSONS | X278: WOOLFE
A279: PRESTON | D279: COOPER 5 | G279: MARTIN 3 | J279: G MARSHALL 2 | N279: BATT | P279: VANN | R279: PLAIN | T279: NICLASSEN
A281: FRANKSTON | C281: 5 | D281: 5 | E281: =C281*6+D281 -> 35 | G281: 8 | H281: 9 | I281: =G281*6+H281 -> 57 | K281: 13 | L281: 16 | M281: =K281*6+L281 -> 94 | O281: 17 | P281: 20 | Q281: =O281*6+P281 -> 122 | S281: PRINCES PARK
A282: CAULFIELD | C282: 4 | D282: 6 | E282: =C282*6+D282 -> 30 | G282: 9 | H282: 8 | I282: =G282*6+H282 -> 62 | K282: 12 | L282: 13 | M282: =K282*6+L282 -> 85 | O282: 16 | P282: 19 | Q282: =O282*6+P282 -> 115 | S282: OAKLEY
A283: BEST PLAYERS
A284: FRANKSTON | D284: RYAN | G284: JONES | J284: GEDDES | L284: KEDDIE | N284: YOUNG | P284: SERAFINI
A285: CAULFIELD | D285: KING | G285: BOOTH | J285: FRIGO | L285: AMBLER | N285: COONEY
A286: GOALKICKERS
A287: FRANKSTON | D287: SERAFINI 8 | G287: B JONES 4 | J287: WALTON 2 | M287: SAMPSON | O287: RYAN | Q287: LYNN
A288: CAULFIELD | D288: BOOTH 3 | F288: AMBLER 2 | I288: HAWKING 2 | L288: TAYLOR 2 | N288: O'SULLIVAN | Q288: DAVIDSON | S288: P FRIGO | U288: LESTER | W288: KING | X288: ROWE | Z288: SMITH
A290: ROUND 7 | E290: 3RD JUNE | J290: WEATHER | N290: NORTH WIND FINE | S290: PLAYED AT
D291: 1ST QTR | H291: 2ND QTR | L291: 3RD QTR | P291: FINAL | S291: DANDENONG
A292: DANDENONG | C292: 8 | D292: 4 | E292: =C292*6+D292 -> 52 | G292: 11 | H292: 6 | I292: =G292*6+H292 -> 72 | K292: 18 | L292: 11 | M292: =K292*6+L292 -> 119 | O292: 25 | P292: 13 | Q292: =O292*6+P292 -> 163 | S292: UMPIRE | X292: LADDER | AB292: ROUND | AD292: 7
A293: SANDRINGHAM | C293: 1 | D293: 1 | E293: =C293*6+D293 -> 7 | G293: 7 | H293: 7 | I293: =G293*6+H293 -> 49 | K293: 11 | L293: 10 | M293: =K293*6+L293 -> 76 | O293: 16 | P293: 16 | Q293: =O293*6+P293 -> 112 | S293: TORNEY
A294: BEST PLAYERS | W294: TEAM | X294: W | Y294: L | Z294: D | AA294: FOR | AB294: AGST | AC294: % | AD294: PTS
A295: DANDENONG | D295: WRIGHT | G295: VAN DE BEEK | J295: HARPER | M295: COUSINS | O295: LUKAS
A296: SANDRINGHAM | D296: OSBORNE | G296: MACKIE | J296: McLEAN | W296: GEELONG WEST | X296: 7 | Y296: 0 | Z296: 0 | AA296: 1029 | AB296: 734 | AC296: 140.19073569482288 | AD296: 28
A297: GOALKICKERS | K297: VAN DE BEEK | N297: McCONNELL | Q297: ALLAN | S297: COUSINS | W297: DANDENONG | X297: 4 | Y297: 3 | Z297: 0 | AA297: 878 | AB297: 769 | AC297: 114.17 | AD297: 16
A298: DANDENONG | D298: WRIGHT 7 | F298: WOODMAN 3 | I298: LUKAS 3 | K298: THOMPSON 3 | N298: BRIESE 2 | P298: BADROCK 2 | S298: SKETCHLEY | W298: COBURG | X298: 4 | Y298: 3 | Z298: 0 | AA298: 855 | AB298: 765 | AC298: 111.76470588235294 | AD298: 16
A299: SANDRINGHAM | D299: ELLIOTT 4 | F299: MACKIE 3 | I299: MILLER 2 | K299: CLARK 2 | M299: SIMS 2 | O299: LYONS 2 | Q299: GALVIN | W299: PRAHRAN | X299: 4 | Y299: 3 | Z299: 0 | AA299: 978 | AB299: 922 | AC299: 106.07375271149675 | AD299: 16
A301: GEELONG WEST | C301: 8 | D301: 4 | E301: =C301*6+D301 -> 52 | G301: 14 | H301: 8 | I301: =G301*6+H301 -> 92 | K301: 20 | L301: 10 | M301: =K301*6+L301 -> 130 | O301: 26 | P301: 17 | Q301: =O301*6+P301 -> 173 | S301: FRANKSTON | W301: BRUNSWICK | X301: 3 | Y301: 4 | Z301: 0 | AA301: 810 | AB301: 868 | AC301: 93.31797235023042 | AD301: 12
A302: FRANKSTON | C302: 4 | D302: 1 | E302: =C302*6+D302 -> 25 | G302: 11 | H302: 6 | I302: =G302*6+H302 -> 72 | K302: 17 | L302: 7 | M302: =K302*6+L302 -> 109 | O302: 22 | P302: 11 | Q302: =O302*6+P302 -> 143 | S302: STABB | W302: FRANKSTON | X302: 3 | Y302: 4 | Z302: 0 | AA302: 921 | AB302: 998 | AC302: 92.284569138276552 | AD302: 12
A303: BEST PLAYERS | W303: PORT MELBOURNE | X303: 3 | Y303: 4 | Z303: 0 | AA303: 811 | AB303: 979 | AC303: 82.839632277834525 | AD303: 12
A304: GEELONG WEST | D304: GILMORE | G304: SCARLETT | J304: BROWNE | M304: RADOJEVIC | P304: SMITH | R304: WOOLFE | W304: CAULFIELD | X304: 3 | Y304: 4 | Z304: 0 | AA304: 787 | AB304: 1009 | AC304: 77.998017839444998 | AD304: 12
A305: FRANKSTON | D305: JONES | G305: STAPLETON | J305: LEWIS | M305: MACE | W305: PRESTON | X305: 2 | Y305: 5 | Z305: 0 | AA305: 863 | AB305: 862 | AC305: 100.12 | AD305: 8
A306: GOALKICKERS | L306: WOOLFE | N306: SCARLETT | P306: DEEATH | R306: HINCK | W306: SANDRINGHAM | X306: 2 | Y306: 5 | Z306: 0 | AA306: 940 | AB306: 966 | AC306: 97.308488612836442 | AD306: 8
A307: GEELONG WEST | D307: RADOJEVIC 7 | G307: BROWNE 5 | J307: GILMORE 4 | M307: G WELLS 2 | P307: PARSONS 2 | S307: STENNETT 2
A308: FRANKSTON | D308: SERAFINI 5 | F308: MACE 3 | H308: BOYD 3 | J308: HUNTER 2 | M308: RYAN 2 | O308: WALTON 2 | R308: KENNEDY | U308: JONES | W308: ORCHARD | X308: LEWIS | Z308: GEDDES
A310: COBURG | C310: 2 | D310: 3 | E310: =C310*6+D310 -> 15 | G310: 10 | H310: 7 | I310: =G310*6+H310 -> 67 | K310: 15 | L310: 8 | M310: =K310*6+L310 -> 98 | O310: 21 | P310: 10 | Q310: =O310*6+P310 -> 136 | S310: PRESTON
A311: PRESTON | C311: 2 | D311: 6 | E311: =C311*6+D311 -> 18 | G311: 9 | H311: 9 | I311: =G311*6+H311 -> 63 | K311: 13 | L311: 10 | M311: =K311*6+L311 -> 88 | O311: 18 | P311: 14 | Q311: =O311*6+P311 -> 122 | S311: CASEY
A312: BEST PLAYERS
A313: COBURG | D313: BURT | G313: DOHNT | I313: MILROY | K313: HARBINSON | N313: SMITH | P313: PRICE
A314: PRESTON | D314: McCONNELL | G314: TOWAN | I314: MARKS | K314: MARTIN | N314: COOPER | P314: G MARSHALL
A315: GOALKICKERS
A316: COBURG | D316: R SMITH 8 | G316: CLEARY 3 | I316: FISHER 3 | K316: BEATTIE 2 | N316: BREEN 2 | P316: PRICE 2 | R316: HARBINSON
A317: PRESTON | D317: VANN 2 | F317: MARSHALL 2 | I317: MARTIN 2 | K317: COOPER 2 | N317: LORENZINI 2 | Q317: McPHIE 2 | S317: WALSH | U317: JESSOP | W317: MARKS | X317: BATT
A319: PRAHRAN | C319: 7 | D319: 3 | E319: =C319*6+D319 -> 45 | G319: 11 | H319: 8 | I319: =G319*6+H319 -> 74 | K319: 20 | L319: 11 | M319: =K319*6+L319 -> 131 | O319: 26 | P319: 17 | Q319: =O319*6+P319 -> 173 | S319: PORT MELBOURNE
A320: PORT MELBOURNE | C320: 5 | D320: 2 | E320: =C320*6+D320 -> 32 | G320: 7 | H320: 9 | I320: =G320*6+H320 -> 51 | K320: 13 | L320: 13 | M320: =K320*6+L320 -> 91 | O320: 20 | P320: 18 | Q320: =O320*6+P320 -> 138 | S320: WENN
A321: BEST PLAYERS
A322: PRAHRAN | D322: CLARKE | G322: ZEUNART | J322: AUSTIN | M322: THORNTON | P322: McGUINNESS | S322: SMITH
A323: PORT MELBOURNE | D323: K GOSS | G323: SWAN | J323: PYE | M323: COOK | P323: P GOSS
A324: GOALKICKERS
A325: PRAHRAN | D325: SMITH 8 | G325: DICKSON 6 | J325: DWYER 4 | M325: CLARKE 4 | P325: PREEN 2 | R325: THURGOOD | U325: KEKOVICH
A326: PORT MELBOURNE | D326: COOK 5 | G326: O'RILEY 5 | J326: GREENING 3 | M326: SCOTT 3 | O326: EVANS 2 | Q326: P GOSS | S326: HAENAN
A328: BRUNSWICK | C328: 4 | D328: 4 | E328: =C328*6+D328 -> 28 | G328: 5 | H328: 11 | I328: =G328*6+H328 -> 41 | K328: 11 | L328: 17 | M328: =K328*6+L328 -> 83 | O328: 17 | P328: 19 | Q328: =O328*6+P328 -> 121 | S328: BRUNSWICK
A329: CAULFIELD | C329: 3 | D329: 3 | E329: =C329*6+D329 -> 21 | G329: 4 | H329: 9 | I329: =G329*6+H329 -> 33 | K329: 6 | L329: 13 | M329: =K329*6+L329 -> 49 | O329: 12 | P329: 17 | Q329: =O329*6+P329 -> 89 | S329: WILSON
A330: BEST PLAYERS
A331: BRUNSWICK | D331: BROWN | G331: STONE | I331: WEST | L331: FANNING | O331: BOURKE | R331: BUCKLEY
A332: CAULFIELD | D332: DAVIDSON | G332: HUNT | I332: EINSEDEL | L332: BRASIER | O332: RUSS
A333: GOALKICKERS
A334: BRUNSWICK | D334: ORTON 4 | F334: STONE 4 | H334: HEDLEY 2 | J334: BOURKE 2 | M334: R SMITH | O334: HARVEY | Q334: B SMITH | S334: WEST | U334: LEWIS
A335: CAULFIELD | D335: TROTT 3 | G335: SMITH 3 | I335: DAVIDSON | K335: HARTLEY | M335: KING | O335: BOOTH | Q335: RUSS | R335: UPFAL
A337: ROUND 8 | D337: 8TH APRIL | L337: 10TH JUNE | S337: PLAYED AT
D338: 1ST QTR | H338: 2ND QTR | L338: 3RD QTR | P338: FINAL | S338: BRUNSWICK
A339: PRESTON | C339: 5 | D339: 5 | E339: =C339*6+D339 -> 35 | G339: 10 | H339: 7 | I339: =G339*6+H339 -> 67 | K339: 18 | L339: 11 | M339: =K339*6+L339 -> 119 | O339: 26 | P339: 16 | Q339: =O339*6+P339 -> 172 | S339: UMPIRE | X339: LADDER | AB339: ROUND | AD339: 8
A340: BRUNSWICK | C340: 2 | D340: 3 | E340: =C340*6+D340 -> 15 | G340: 7 | H340: 7 | I340: =G340*6+H340 -> 49 | K340: 11 | L340: 8 | M340: =K340*6+L340 -> 74 | O340: 13 | P340: 13 | Q340: =O340*6+P340 -> 91 | S340: STABB
A341: BEST PLAYERS | W341: TEAM | X341: W | Y341: L | Z341: D | AA341: FOR | AB341: AGST | AC341: % | AD341: PTS
A342: PRESTON | D342: BOLGER | G342: TOWAN | J342: VANN | L342: NICLASSEN | O342: MARKS | Q342: McCONNELL
A343: BRUNSWICK | D343: SMITH | G343: FANNING | J343: DELL | L343: STONE | O343: LEWIS | W343: GEELONG WEST | X343: 8 | Y343: 0 | Z343: 0 | AA343: 1206 | AB343: 858 | AC343: 140.55944055944056 | AD343: 32
A344: GOALKICKERS | M344: DURWOOD | P344: P MARSHALL | S344: ROJO | W344: PRAHRAN | X344: 5 | Y344: 3 | Z344: 0 | AA344: 1096 | AB344: 1038 | AC344: 105.58766859344894 | AD344: 20
A345: PRESTON | D345: MARKS 4 | F345: NICLASSEN 4 | I345: BOLGER 4 | K345: VANN 3 | M345: DUNBAR 3 | O345: COOKE 2 | Q345: JESSOP 2 | S345: CANN | W345: DANDENONG | X345: 4 | Y345: 4 | Z345: 0 | AA345: 982 | AB345: 879 | AC345: 111.72 | AD345: 16
A346: BRUNSWICK | D346: SMITH 6 | G346: TOY 3 | I346: LEWIS 2 | K346: STONE 2 | W346: COBURG | X346: 4 | Y346: 4 | Z346: 0 | AA346: 971 | AB346: 883 | AC346: 109.96602491506229 | AD346: 16
A348: CAULFIELD | C348: 4 | D348: 6 | E348: =C348*6+D348 -> 30 | G348: 9 | H348: 9 | I348: =G348*6+H348 -> 63 | K348: 12 | L348: 12 | M348: =K348*6+L348 -> 84 | O348: 16 | P348: 14 | Q348: =O348*6+P348 -> 110 | S348: DANDENONG | W348: PORT MELBOURNE | X348: 4 | Y348: 4 | Z348: 0 | AA348: 920 | AB348: 1076 | AC348: 85.501858736059475 | AD348: 16
A349: DANDENONG | C349: 4 | D349: 1 | E349: =C349*6+D349 -> 25 | G349: 11 | H349: 3 | I349: =G349*6+H349 -> 69 | K349: 12 | L349: 3 | M349: =K349*6+L349 -> 75 | O349: 16 | P349: 8 | Q349: =O349*6+P349 -> 104 | S349: CASEY | W349: CAULFIELD | X349: 4 | Y349: 4 | Z349: 0 | AA349: 897 | AB349: 1113 | AC349: 80.59299191374663 | AD349: 16
A350: BEST PLAYERS | W350: PRESTON | X350: 3 | Y350: 5 | Z350: 0 | AA350: 1035 | AB350: 953 | AC350: 108.6 | AD350: 12
A351: CAULFIELD | D351: RUSS | G351: BRASIER | J351: DAVIDSON | M351: TROTT | P351: HARTLEY | W351: FRANKSTON | X351: 3 | Y351: 5 | Z351: 0 | AA351: 1018 | AB351: 1107 | AC351: 91.960252935862698 | AD351: 12
A352: DANDENONG | D352: VAN DE BEEK | G352: REID | J352: COUSINS | M352: THOMPSON | P352: McCONNELL | W352: BRUNSWICK | X352: 3 | Y352: 5 | Z352: 0 | AA352: 901 | AB352: 1040 | AC352: 86.634615384615387 | AD352: 12
A353: GOALKICKERS | N353: DAVIDSON | Q353: ROWE | W353: SANDRINGHAM | X353: 2 | Y353: 6 | Z353: 0 | AA353: 1064 | AB353: 1143 | AC353: 93.088363954505681 | AD353: 8
A354: CAULFIELD | D354: O'SULLIVAN 3 | G354: SMITH 2 | I354: RUSS 2 | K354: HARTLEY 2 | N354: UPFAL 2 | P354: TROTT 2 | R354: O'LOUGHLIN
A355: DANDENONG | D355: WRIGHT 4 | G355: SKETCHLEY 2 | J355: ALLAN 2 | L355: THOMPSON 2 | O355: WOODMAN | Q355: SHINNERS | S355: COUSINS | V355: BRIESE
P356: LEONIDAS | R356: MADDEN
A357: GEELONG WEST | C357: 2 | D357: 4 | E357: =C357*6+D357 -> 16 | G357: 9 | H357: 8 | I357: =G357*6+H357 -> 62 | K357: 17 | L357: 11 | M357: =K357*6+L357 -> 113 | O357: 27 | P357: 15 | Q357: =O357*6+P357 -> 177 | S357: BEACH ROAD
A358: SANDRINGHAM | C358: 4 | D358: 3 | E358: =C358*6+D358 -> 27 | G358: 5 | H358: 7 | I358: =G358*6+H358 -> 37 | K358: 12 | L358: 12 | M358: =K358*6+L358 -> 84 | O358: 18 | P358: 16 | Q358: =O358*6+P358 -> 124 | S358: MATHEWS
A359: BEST PLAYERS
A360: GEELONG WEST | D360: BROWNE | G360: LUNN | J360: EDDY | M360: SCARLETT | P360: DEEATH | R360: RUSSELL
A361: SANDRINGHAM | D361: COELLI | G361: LYONS | J361: CLARK | M361: WILKINS | P361: McNICHOLAS
A362: GOALKICKERS
A363: GEELONG WEST | D363: G WELLS 6 | G363: BROWNE 6 | J363: LUNN 5 | L363: GILMORE 3 | N363: WOOLFE 3 | Q363: EDDY 2 | S363: HINCK | U363: PARSONS
A364: SANDRINGHAM | D364: LYONS 5 | G364: McLEAN 3 | J364: GIAMPAOLO 2 | M364: WILKINS 2 | P364: McNICHOLAS 2 | S364: ELLIOTT 2 | V364: CLARK | X364: PLEDGER
A366: PRAHRAN | C366: 8 | D366: 2 | E366: =C366*6+D366 -> 50 | G366: 12 | H366: 5 | I366: =G366*6+H366 -> 77 | K366: 17 | L366: 6 | M366: =K366*6+L366 -> 108 | O366: 18 | P366: 10 | Q366: =O366*6+P366 -> 118 | S366: TOORAK PARK
A367: COBURG | C367: 2 | D367: 4 | E367: =C367*6+D367 -> 16 | G367: 7 | H367: 8 | I367: =G367*6+H367 -> 50 | K367: 10 | L367: 11 | M367: =K367*6+L367 -> 71 | O367: 17 | P367: 14 | Q367: =O367*6+P367 -> 116 | S367: STABB
A368: BEST PLAYERS
A369: PRAHRAN | D369: DICKSON | G369: JEFFREY | J369: McFAULL | M369: FOLEY | P369: ZEUNART | S369: CLARKE
A370: COBURG | D370: HALSALL | G370: PITT | J370: BURT | M370: FISHER | P370: MILROY | S370: BEATTIE
A371: GOALKICKERS
A372: PRAHRAN | D372: McFAULL 5 | G372: DICKSON 5 | J372: CLARKE 3 | M372: PREEN 2 | O372: SMITH 2 | Q372: TAYLOR
A373: COBURG | D373: HALSALL 6 | G373: BEATTIE 3 | J373: HARBINSON 3 | M373: SMITH | O373: HALBERT | Q373: BREEN | S373: FISHER | U373: PRICE
A375: PORT MELBOURNE | C375: 6 | D375: 5 | E375: =C375*6+D375 -> 41 | G375: 11 | H375: 6 | I375: =G375*6+H375 -> 72 | K375: 15 | L375: 11 | M375: =K375*6+L375 -> 101 | O375: 16 | P375: 13 | Q375: =O375*6+P375 -> 109 | S375: PORT MELBOURNE
A376: FRANKSTON | C376: 3 | D376: 3 | E376: =C376*6+D376 -> 21 | G376: 8 | H376: 11 | I376: =G376*6+H376 -> 59 | K376: 10 | L376: 15 | M376: =K376*6+L376 -> 75 | O376: 13 | P376: 19 | Q376: =O376*6+P376 -> 97 | S376: TORNEY
A377: BEST PLAYERS
A378: PORT MELBOURNE | D378: COOK | G378: AANENSEN | J378: JEFFRIES | M378: SWAN | P378: DAVIES
A379: FRANKSTON | D379: ORCHARD | G379: WALTON | J379: FARQUHAR | M379: SAMPSON | P379: GEDDES
A380: GOALKICKERS
A381: PORT MELBOURNE | D381: COOK 7 | G381: McKENNA 3 | J381: JEFFRIES 2 | M381: O'RILEY 2 | O381: STIBBARD | Q381: EVANS
A382: FRANKSTON | D382: SERAFINI 3 | G382: ORCHARD 3 | J382: WALTON 3 | M382: SAMPSON 2 | P382: JONES | R382: HUNTER
A384: ROUND 9 | E384: 24TH JUNE | M384: WEATHER | S384: PLAYED AT
D385: 1ST QTR | H385: 2ND QTR | L385: 3RD QTR | P385: FINAL | S385: TOORAK PARK
A386: PRAHRAN | C386: 5 | D386: 1 | E386: =C386*6+D386 -> 31 | G386: 11 | H386: 4 | I386: =G386*6+H386 -> 70 | K386: 13 | L386: 9 | M386: =K386*6+L386 -> 87 | O386: 17 | P386: 14 | Q386: =O386*6+P386 -> 116 | S386: UMPIRE | X386: LADDER | AB386: ROUND | AD386: 9
A387: BRUNSWICK | C387: 3 | D387: 5 | E387: =C387*6+D387 -> 23 | G387: 5 | H387: 7 | I387: =G387*6+H387 -> 37 | K387: 11 | L387: 13 | M387: =K387*6+L387 -> 79 | O387: 16 | P387: 16 | Q387: =O387*6+P387 -> 112 | S387: MATHEWS
A388: BEST PLAYERS | W388: TEAM | X388: W | Y388: L | Z388: D | AA388: FOR | AB388: AGST | AC388: % | AD388: PTS
A389: PRAHRAN | D389: PEPE | G389: LOWE | J389: AUSTIN | M389: SMITH | O389: CLARKE | R389: ZEUNART
A390: BRUNSWICK | D390: R SMITH | G390: FANNING | J390: STONE | M390: WEST | O390: B SMITH | R390: SEERY | W390: GEELONG WEST | X390: 9 | Y390: 0 | Z390: 0 | AA390: 1382 | AB390: 967 | AC390: 142.91623578076525 | AD390: 36
A391: GOALKICKERS | W391: PRAHRAN | X391: 6 | Y391: 3 | Z391: 0 | AA391: 1212 | AB391: 1150 | AC391: 105.39130434782609 | AD391: 24
A392: PRAHRAN | D392: K SMITH 6 | G392: CLARKE 3 | I392: PREEN 2 | K392: DICKSON 2 | N392: McFAULL | P392: DWYER | R392: AUSTIN | T392: PEPE | W392: COBURG | X392: 5 | Y392: 4 | Z392: 0 | AA392: 1091 | AB392: 990 | AC392: 110.20202020202021 | AD392: 20
A393: BRUNSWICK | D393: B SMITH 5 | G393: WEST 2 | I393: STONE 2 | K393: TOY 2 | M393: ORTON 2 | O393: BOURKE | Q393: R SMITH | S393: BYRNE | W393: CAULFIELD | X393: 5 | Y393: 5 | Z393: 0 | AA393: 1014 | AB393: 1228 | AC393: 82.573289902280123 | AD393: 20
A395: COBURG | C395: 3 | D395: 1 | E395: =C395*6+D395 -> 19 | G395: 10 | H395: 4 | I395: =G395*6+H395 -> 64 | K395: 11 | L395: 9 | M395: =K395*6+L395 -> 75 | O395: 17 | P395: 18 | Q395: =O395*6+P395 -> 120 | S395: COBURG | W395: DANDENONG | X395: 4 | Y395: 5 | Z395: 0 | AA395: 1091 | AB395: 1055 | AC395: 103.41 | AD395: 16
A396: SANDRINGHAM | C396: 5 | D396: 3 | E396: =C396*6+D396 -> 33 | G396: 9 | H396: 3 | I396: =G396*6+H396 -> 57 | K396: 14 | L396: 11 | M396: =K396*6+L396 -> 95 | O396: 16 | P396: 11 | Q396: =O396*6+P396 -> 107 | S396: CASEY | W396: FRANKSTON | X396: 4 | Y396: 5 | Z396: 0 | AA396: 1193 | AB396: 1275 | AC396: 93.568627450980387 | AD396: 16
A397: BEST PLAYERS | W397: PORT MELBOURNE | X397: 4 | Y397: 5 | Z397: 0 | AA397: 1035 | AB397: 1193 | AC397: 86.756077116512998 | AD397: 16
A398: COBURG | D398: DOUGLAS | G398: MILROY | J398: CLEARY | M398: SMITH | O398: HARTIGAN | R398: HALBERT | W398: PRESTON | X398: 3 | Y398: 6 | Z398: 0 | AA398: 1203 | AB398: 1128 | AC398: 106.65 | AD398: 12
A399: SANDRINGHAM | D399: D O'BRIEN | G399: WILKINS | J399: HODGES | M399: T O'BRIEN | O399: PLEDGER | R399: LYONS | W399: BRUNSWICK | X399: 3 | Y399: 6 | Z399: 0 | AA399: 1013 | AB399: 1156 | AC399: 87.629757785467135 | AD399: 12
A400: GOALKICKERS | W400: SANDRINGHAM | X400: 2 | Y400: 7 | Z400: 0 | AA400: 1171 | AB400: 1263 | AC400: 92.715756136183685 | AD400: 8
A401: COBURG | D401: SMITH 5 | G401: CLEARY 4 | J401: DOHNT 3 | L401: HALBERT 2 | O401: BEATTIE | Q401: HALSALL | S401: BURT
A402: SANDRINGHAM | D402: LYONS 4 | F402: T O'BRIEN 3 | I402: BELL 2 | K402: ELLIOTT 2 | M402: HODGES | O402: GIAMPAOLO | R402: McNICHOLAS | U402: McGUFFY | X402: SIMS
A404: GEELONG WEST | C404: 7 | D404: 7 | E404: =C404*6+D404 -> 49 | G404: 11 | H404: 10 | I404: =G404*6+H404 -> 76 | K404: 20 | L404: 15 | M404: =K404*6+L404 -> 135 | O404: 26 | P404: 20 | Q404: =O404*6+P404 -> 176 | S404: GEELONG WEST
A405: DANDENONG | C405: 3 | D405: 4 | E405: =C405*6+D405 -> 22 | G405: 9 | H405: 7 | I405: =G405*6+H405 -> 61 | K405: 13 | L405: 10 | M405: =K405*6+L405 -> 88 | O405: 16 | P405: 13 | Q405: =O405*6+P405 -> 109 | S405: WENN
A406: BEST PLAYERS
A407: GEELONG WEST | D407: ARKLAY | G407: GILMORE | J407: BROWNE | M407: G WELLS | P407: EDDY | R407: PARSONS
A408: DANDENONG | D408: VAN DE BEEK | G408: COUSINS | J408: PRENDERGAST | M408: DROSCHER | P408: WRIGHT | R408: McCONNELL
A409: GOALKICKERS
A410: GEELONG WEST | D410: RADOJEVIC 8 | G410: GILMORE 3 | J410: PARSONS 3 | M410: LUNN 3 | O410: BROWNE 3 | R410: G WELLS 3 | U410: ARKLAY | X410: DEEATH | Z410: STENNETT
A411: DANDENONG | D411: PRENDERGAST 3 | G411: VAN DE BEEK 3 | J411: THOMPSON 2 | M411: TAYLOR 2 | O411: WOODMAN | R411: COUSINS | T411: BRIESE | V411: McKAY | X411: HORAZCKO | AA411: WRIGHT
A413: CAULFIELD | C413: 3 | D413: 4 | E413: =C413*6+D413 -> 22 | G413: 7 | H413: 8 | I413: =G413*6+H413 -> 50 | K413: 12 | L413: 12 | M413: =K413*6+L413 -> 84 | O413: 17 | P413: 15 | Q413: =O413*6+P413 -> 117 | S413: PRINCES PARK
A414: PORT MELBOURNE | C414: 5 | D414: 5 | E414: =C414*6+D414 -> 35 | G414: 8 | H414: 10 | I414: =G414*6+H414 -> 58 | K414: 14 | L414: 15 | M414: =K414*6+L414 -> 99 | O414: 16 | P414: 19 | Q414: =O414*6+P414 -> 115 | S414: TORNEY
A415: BEST PLAYERS
A416: CAULFIELD | D416: RUSS | G416: DAVIDSON | J416: FRIGO | M416: KING | O416: S O'SULLIVAN | S416: BOOTH
A417: PORT MELBOURNE | D417: SWAN | G417: HAENAN | J417: GREENING | M417: O'RILEY | O417: AANENSEN | S417: JEFFRIES
A418: GOALKICKERS
A419: CAULFIELD | D419: O'SULLIVAN 4 | G419: RUSS 4 | I419: DAVIDSON 2 | L419: ADAMS 2 | N419: FRIGO | P419: KING | Q419: O'LOUGHLIN | T419: HAWKING | W419: ROWE
A420: PORT MELBOURNE | D420: COOK 6 | G420: O'RILEY 2 | I420: McKENNA 2 | L420: P GOSS | N420: AANENSEN | Q420: SINCLAIR | S420: DERMOTT | V420: EVANS
A422: FRANKSTON | C422: 8 | D422: 5 | E422: =C422*6+D422 -> 53 | G422: 14 | H422: 11 | I422: =G422*6+H422 -> 95 | K422: 23 | L422: 16 | M422: =K422*6+L422 -> 154 | O422: 26 | P422: 19 | Q422: =O422*6+P422 -> 175 | S422: FRANKSTON
A423: PRESTON | C423: 6 | D423: 4 | E423: =C423*6+D423 -> 40 | G423: 14 | H423: 11 | I423: =G423*6+H423 -> 95 | K423: 16 | L423: 14 | M423: =K423*6+L423 -> 110 | O423: 25 | P423: 18 | Q423: =O423*6+P423 -> 168 | S423: GROOM
A424: BEST PLAYERS
A425: FRANKSTON | D425: ORCHARD | G425: SAMPSON | J425: WALTON | M425: HALL | O425: SERAFINI | R425: RYAN
A426: PRESTON | D426: COOPER | G426: McCONNELL | J426: WATT | M426: BOLGER | O426: JESSOP | R426: McCULLOCH
A427: GOALKICKERS
A428: FRANKSTON | D428: SERAFINI 9 | G428: HALL 4 | I428: WALTON 4 | L428: MERCOULIA 3 | O428: RYAN 2 | Q428: ORCHARD 2 | T428: JONES | V428: MACE
A429: PRESTON | D429: VANN 5 | F429: MARKS 4 | I429: COOPER 4 | K429: LORENZINI 3 | N429: JESSOP 3 | P429: P MARSHALL | S429: G MARSHALL | W429: McCONNELL | X429: BATT
A431: ROUND 10 | E431: 1ST JULY | J431: WEATHER | N431: NORTH WEST WIND COLD | S431: PLAYED AT
D432: 1ST QTR | H432: 2ND QTR | L432: 3RD QTR | P432: FINAL | S432: BRUNSWICK
A433: BRUNSWICK | C433: 2 | D433: 3 | E433: =C433*6+D433 -> 15 | G433: 7 | H433: 6 | I433: =G433*6+H433 -> 48 | K433: 11 | L433: 8 | M433: =K433*6+L433 -> 74 | O433: 13 | P433: 16 | Q433: =O433*6+P433 -> 94 | S433: UMPIRE | X433: LADDER | AB433: ROUND | AD433: 10
A434: DANDENONG | C434: 5 | D434: 4 | E434: =C434*6+D434 -> 34 | G434: 8 | H434: 7 | I434: =G434*6+H434 -> 55 | K434: 12 | L434: 12 | M434: =K434*6+L434 -> 84 | O434: 13 | P434: 13 | Q434: =O434*6+P434 -> 91 | S434: OAKLEY
A435: BEST PLAYERS | W435: TEAM | X435: W | Y435: L | Z435: D | AA435: FOR | AB435: AGST | AC435: % | AD435: PTS
A436: BRUNSWICK | D436: DOLAN | G436: WEST | J436: B SMITH | M436: BYRNE | O436: BROWN | R436: BOURKE
A437: DANDENONG | D437: HARPER | G437: VAN DE BEEK | J437: WOODMAN | M437: REID | O437: LEONIDAS | R437: BRIESE | W437: GEELONG WEST | X437: 9 | Y437: 1 | Z437: 0 | AA437: 1469 | AB437: 1094 | AC437: 134.27787934186472 | AD437: 36
A438: GOALKICKERS | W438: COBURG | X438: 6 | Y438: 4 | Z438: 0 | AA438: 1248 | AB438: 1107 | AC438: 112.73712737127371 | AD438: 24
A439: BRUNSWICK | D439: B SMITH 4 | G439: BYRNE 3 | J439: STONE 2 | L439: TOY | M439: WEST | N439: DOLAN | P439: ORTON | W439: PRAHRAN | X439: 6 | Y439: 4 | Z439: 0 | AA439: 1314 | AB439: 1275 | AC439: 103.05882352941177 | AD439: 24
A440: DANDENONG | D440: BRIESE 4 | G440: WOODMAN 3 | J440: GOODES 2 | M440: MADDEN 2 | P440: WRIGHT | R440: TAYLOR | W440: CAULFIELD | X440: 6 | Y440: 4 | Z440: 0 | AA440: 1141 | AB440: 1315 | AC440: 86.768060836501903 | AD440: 24
A442: PORT MELBOURNE | C442: 1 | D442: 3 | E442: =C442*6+D442 -> 9 | G442: 7 | H442: 10 | I442: =G442*6+H442 -> 52 | K442: 11 | L442: 14 | M442: =K442*6+L442 -> 80 | O442: 17 | P442: 19 | Q442: =O442*6+P442 -> 121 | S442: PORT MELBOURNE | W442: PORT MELBOURNE | X442: 5 | Y442: 5 | Z442: 0 | AA442: 1156 | AB442: 1271 | AC442: 90.952006294256492 | AD442: 20
A443: SANDRINGHAM | C443: 2 | D443: 8 | E443: =C443*6+D443 -> 20 | G443: 5 | H443: 10 | I443: =G443*6+H443 -> 40 | K443: 8 | L443: 12 | M443: =K443*6+L443 -> 60 | O443: 10 | P443: 18 | Q443: =O443*6+P443 -> 78 | S443: GROOM | W443: PRESTON | X443: 4 | Y443: 6 | Z443: 0 | AA443: 1328 | AB443: 1230 | AC443: 107.97 | AD443: 16
A444: BEST PLAYERS | W444: DANDENONG | X444: 4 | Y444: 6 | Z444: 0 | AA444: 1182 | AB444: 1149 | AC444: 102.87 | AD444: 16
A445: PORT MELBOURNE | D445: K GOSS | G445: CARTER | I445: AANENSEN | L445: SINCLAIR | N445: P GOSS | Q445: STIBBARD | W445: FRANKSTON | X445: 4 | Y445: 6 | Z445: 0 | AA445: 1310 | AB445: 1432 | AC445: 91.480446927374302 | AD445: 16
A446: SANDRINGHAM | D446: PLEDGER | G446: MILLER | I446: D O'BRIEN | W446: BRUNSWICK | X446: 4 | Y446: 6 | Z446: 0 | AA446: 1107 | AB446: 1247 | AC446: 88.77305533279872 | AD446: 16
A447: GOALKICKERS | S447: DERMOTT | W447: SANDRINGHAM | X447: 2 | Y447: 8 | Z447: 0 | AA447: 1249 | AB447: 1384 | AC447: 90.24566473988439 | AD447: 8
A448: PORT MELBOURNE | D448: COOK 4 | F448: McKENNA 3 | I448: EVANS 3 | K448: P GOSS | M448: SINCLAIR | O448: DAVIES | Q448: SWAN | R448: THORPE | T448: K GOSS
A449: SANDRINGHAM | D449: HUTCHISON 3 | G449: BELL 2 | I449: HODGES | K449: GIAMPAOLO | N449: BEUS | P449: T O'BRIEN | R449: ELLIOTT
A451: PRESTON | C451: 4 | D451: 3 | E451: =C451*6+D451 -> 27 | G451: 9 | H451: 5 | I451: =G451*6+H451 -> 59 | K451: 13 | L451: 10 | M451: =K451*6+L451 -> 88 | O451: 19 | P451: 11 | Q451: =O451*6+P451 -> 125 | S451: PRESTON
A452: PRAHRAN | C452: 0 | D452: 4 | E452: =C452*6+D452 -> 4 | G452: 4 | H452: 8 | I452: =G452*6+H452 -> 32 | K452: 6 | L452: 12 | M452: =K452*6+L452 -> 48 | O452: 14 | P452: 18 | Q452: =O452*6+P452 -> 102 | S452: STABB
A453: BEST PLAYERS
A454: PRESTON | D454: McCONNELL | G454: JESSOP | J454: WILMOT | L454: RINGIN | N454: BOLGER | Q454: BATT
A455: PRAHRAN | D455: McGUINNESS | G455: THORNTON | J455: SMITH | L455: ZEUNART
A456: GOALKICKERS
A457: PRESTON | D457: JESSOP 4 | G457: MARKS 4 | I457: P MARSHALL 3 | L457: LORENZINI 2 | O457: WILMOT 2 | Q457: COOPER 2 | T457: VANN | V457: RINGIN
A458: PRAHRAN | D458: SMITH 5 | G458: PREEN 3 | I458: ZEUNART 2 | L458: CLARKE | N458: McFAULL | P458: DICKSON | R458: LITTLE
A460: COBURG | C460: 4 | D460: 3 | E460: =C460*6+D460 -> 27 | G460: 15 | H460: 10 | I460: =G460*6+H460 -> 100 | K460: 18 | L460: 14 | M460: =K460*6+L460 -> 122 | O460: 22 | P460: 25 | Q460: =O460*6+P460 -> 157 | S460: FRANKSTON
A461: FRANKSTON | C461: 3 | D461: 4 | E461: =C461*6+D461 -> 22 | G461: 3 | H461: 7 | I461: =G461*6+H461 -> 25 | K461: 13 | L461: 14 | M461: =K461*6+L461 -> 92 | O461: 17 | P461: 15 | Q461: =O461*6+P461 -> 117 | S461: WENN
A462: BEST PLAYERS
A463: COBURG | D463: HARBINSON | G463: PITT | I463: BEATTIE | L463: FISHER | O463: BURT | Q463: DOUGLAS
A464: FRANKSTON | D464: ORCHARD | G464: HALL | I464: BOYD | L464: STAPLETON | O464: MACE | Q464: WALTON
A465: GOALKICKERS
A466: COBURG | D466: BEATTIE 6 | G466: CLEARY 3 | J466: PRICE 3 | L466: COLLINS 3 | N466: BREEN 3 | Q466: FISHER 2 | S466: HALBERT | V466: DOHNT
A467: FRANKSTON | D467: HALL 3 | F467: MACE 3 | H467: ORCHARD 3 | K467: SAMPSON 2 | N467: SERAFINI | P467: JONES | R467: GRIMBLATT | U467: HUNTER | X467: GORDON | Z467: WALTON
A469: CAULFIELD | C469: 4 | D469: 7 | E469: =C469*6+D469 -> 31 | G469: 9 | H469: 11 | I469: =G469*6+H469 -> 65 | K469: 15 | L469: 15 | M469: =K469*6+L469 -> 105 | O469: 18 | P469: 19 | Q469: =O469*6+P469 -> 127 | S469: PRINCES PARK
A470: GEELONG WEST | C470: 2 | D470: 1 | E470: =C470*6+D470 -> 13 | G470: 5 | H470: 7 | I470: =G470*6+H470 -> 37 | K470: 7 | L470: 9 | M470: =K470*6+L470 -> 51 | O470: 12 | P470: 15 | Q470: =O470*6+P470 -> 87 | S470: TORNEY
A471: BEST PLAYERS
A472: CAULFIELD | D472: BOOTH | G472: TROTT | J472: DAVIDSON | M472: HUNT | O472: COONEY | R472: ROWE
A473: GEELONG WEST | D473: SMITH | G473: DURRAN | J473: RUSSELL | M473: DEEATH | O473: EDDY
A474: GOALKICKERS
A475: CAULFIELD | D475: TROTT 5 | F475: SUTHERLAND 3 | J475: DAVIDSON 3 | M475: BOOTH 3 | O475: O'SULLIVAN | R475: EINSEDEL | U475: UPFAL | W475: ROWE
A476: GEELONG WEST | D476: RADOJEVIC 5 | G476: STENNETT 2 | J476: G WELLS 2 | M476: PARSONS | O476: ARKLAY | Q476: SCARLETT
A478: ROUND 11 | E478: 8TH JULY | J478: WEATHER | N478: NORTH WIND | S478: PLAYED AT
D479: 1ST QTR | H479: 2ND QTR | L479: 3RD QTR | P479: FINAL | S479: DANDENONG
A480: DANDENONG | C480: 3 | D480: 6 | E480: =C480*6+D480 -> 24 | G480: 5 | H480: 11 | I480: =G480*6+H480 -> 41 | K480: 13 | L480: 14 | M480: =K480*6+L480 -> 92 | O480: 16 | P480: 14 | Q480: =O480*6+P480 -> 110 | S480: UMPIRE | X480: LADDER | AB480: ROUND | AD480: 11
A481: PORT MELBOURNE | C481: 0 | D481: 2 | E481: =C481*6+D481 -> 2 | G481: 4 | H481: 8 | I481: =G481*6+H481 -> 32 | K481: 6 | L481: 10 | M481: =K481*6+L481 -> 46 | O481: 15 | P481: 15 | Q481: =O481*6+P481 -> 105 | S481: CASEY
A482: BEST PLAYERS | W482: TEAM | X482: W | Y482: L | Z482: D | AA482: FOR | AB482: AGST | AC482: % | AD482: PTS
A483: DANDENONG | D483: BRIESE | G483: WOODMAN | J483: McCONNELL | M483: REID | O483: LUKAS | R483: TAYLOR
A484: PORT MELBOURNE | D484: AANENSEN | G484: CARTER | J484: DERMOTT | M484: CHRISTOU | O484: HAENAN | R484: SWAN | W484: GEELONG WEST | X484: 10 | Y484: 1 | Z484: 0 | AA484: 1590 | AB484: 1193 | AC484: 133.27745180217937 | AD484: 40
A485: GOALKICKERS | W485: COBURG | X485: 7 | Y485: 4 | Z485: 0 | AA485: 1362 | AB485: 1203 | AC485: 113.21695760598504 | AD485: 28
A486: DANDENONG | D486: BRIESE 6 | G486: LUKAS 4 | J486: PRENDERGAST 3 | N486: TAYLOR 2 | Q486: HORAZCKO | W486: PRAHRAN | X486: 7 | Y486: 4 | Z486: 0 | AA486: 1499 | AB486: 1339 | AC486: 111.94921583271098 | AD486: 28
A487: PORT MELBOURNE | D487: COOK 5 | F487: THORPE 2 | I487: EVANS 2 | K487: WHARTON 2 | N487: CHRISTOU | P487: SWAN | R487: JEFFRIES | T487: SINCLAIR | W487: CAULFIELD | X487: 6 | Y487: 5 | Z487: 0 | AA487: 1237 | AB487: 1429 | AC487: 86.564030790762772 | AD487: 24
A489: SANDRINGHAM | C489: 6 | D489: 3 | E489: =C489*6+D489 -> 39 | G489: 13 | H489: 7 | I489: =G489*6+H489 -> 85 | K489: 18 | L489: 8 | M489: =K489*6+L489 -> 116 | O489: 24 | P489: 11 | Q489: =O489*6+P489 -> 155 | S489: BEACH ROAD | W489: DANDENONG | X489: 5 | Y489: 6 | Z489: 0 | AA489: 1292 | AB489: 1254 | AC489: 103.03 | AD489: 20
A490: PRESTON | C490: 2 | D490: 1 | E490: =C490*6+D490 -> 13 | G490: 5 | H490: 6 | I490: =G490*6+H490 -> 36 | K490: 11 | L490: 11 | M490: =K490*6+L490 -> 77 | O490: 14 | P490: 14 | Q490: =O490*6+P490 -> 98 | S490: HEDGER | W490: PORT MELBOURNE | X490: 5 | Y490: 6 | Z490: 0 | AA490: 1261 | AB490: 1381 | AC490: 91.31 | AD490: 20
A491: BEST PLAYERS | W491: PRESTON | X491: 4 | Y491: 7 | Z491: 0 | AA491: 1426 | AB491: 1385 | AC491: 102.96 | AD491: 16
A492: SANDRINGHAM | D492: HUTCHISON | G492: HODGES | J492: WILKINS | M492: PLEDGER | W492: BRUNSWICK | X492: 4 | Y492: 7 | Z492: 0 | AA492: 1206 | AB492: 1368 | AC492: 88.15789473684211 | AD492: 16
A493: PRESTON | D493: JESSOP | G493: MARTIN | J493: CANN | M493: McCONNELL | W493: FRANKSTON | X493: 4 | Y493: 7 | Z493: 0 | AA493: 1374 | AB493: 1617 | AC493: 84.972170686456394 | AD493: 16
A494: GOALKICKERS | R494: BEUS | W494: SANDRINGHAM | X494: 3 | Y494: 8 | Z494: 0 | AA494: 1404 | AB494: 1482 | AC494: 94.736842105263165 | AD494: 12
A495: SANDRINGHAM | D495: HUTCHISON 5 | G495: HODGES 4 | I495: GIAMPAOLO 3 | L495: T O'BRIEN 3 | N495: BELL 2 | P495: KEAST (2) | R495: WILKINS 2 | U495: CLARK 2
A496: PRESTON | D496: LORENZINI 4 | G496: JESSOP 4 | I496: P MARSHALL 2 | M496: BATT | N496: COOPER | P496: MARKS | R496: McCULLOCH
A498: PRAHRAN | C498: 5 | D498: 5 | E498: =C498*6+D498 -> 35 | G498: 15 | H498: 9 | I498: =G498*6+H498 -> 99 | K498: 23 | L498: 15 | M498: =K498*6+L498 -> 153 | O498: 27 | P498: 23 | Q498: =O498*6+P498 -> 185 | S498: TOORAK PARK
A499: FRANKSTON | C499: 1 | D499: 5 | E499: =C499*6+D499 -> 11 | G499: 3 | H499: 7 | I499: =G499*6+H499 -> 25 | K499: 5 | L499: 10 | M499: =K499*6+L499 -> 40 | O499: 8 | P499: 16 | Q499: =O499*6+P499 -> 64 | S499: OAKLEY
A500: BEST PLAYERS
A501: PRAHRAN | D501: CLARKE | G501: PEPE | J501: THORNTON | M501: SMITH | O501: DICKSON | R501: AMDERSON
A502: FRANKSTON | D502: FARQUHAR | G502: HOUSDEN | J502: KENNEDY | M502: KEDDIE | O502: ORCHARD
A503: GOALKICKERS
A504: PRAHRAN | D504: SMITH 9 | G504: DICKSON 8 | J504: CLARKE 3 | M504: LITTLE 3 | O504: LOWE 2 | Q504: ROD KELLY | T504: ANDERSON
A505: FRANKSTON | D505: SERAFINI 3 | G505: KENNEDY | J505: SAMPSON | M505: JONES | O505: HALL | Q505: STAPLETON
A507: GEELONG WEST | C507: 4 | D507: 6 | E507: =C507*6+D507 -> 30 | G507: 8 | H507: 10 | I507: =G507*6+H507 -> 58 | K507: 12 | L507: 11 | M507: =K507*6+L507 -> 83 | O507: 17 | P507: 19 | Q507: =O507*6+P507 -> 121 | S507: GEELONG WEST
A508: BRUNSWICK | C508: 4 | D508: 3 | E508: =C508*6+D508 -> 27 | G508: 10 | H508: 3 | I508: =G508*6+H508 -> 63 | K508: 12 | L508: 8 | M508: =K508*6+L508 -> 80 | O508: 15 | P508: 9 | Q508: =O508*6+P508 -> 99 | S508: STABB
A509: BEST PLAYERS
A510: GEELONG WEST | D510: YATES | G510: BROWNE | J510: ARKLAY | M510: RUSSELL | P510: SMITH
A511: BRUNSWICK | D511: WEST | G511: DOLAN | J511: TOY | M511: STONE | P511: BYRNE
A512: GOALKICKERS
A513: GEELONG WEST | D513: RADOJEVIC 5 | G513: BROWNE 4 | J513: YATES 2 | L513: ARKLAY 2 | N513: LUNN | P513: DEEATH | R513: G WELLS | U513: SCARLETT
A514: BRUNSWICK | D514: WEST 3 | F514: B SMITH 3 | I514: ORTON 2 | K514: DOLAN 2 | M514: BUCKLEY | O514: HARVEY | Q514: BYRNE | S514: HUGGARD
A516: COBURG | C516: 4 | D516: 3 | E516: =C516*6+D516 -> 27 | G516: 8 | H516: 9 | I516: =G516*6+H516 -> 57 | K516: 11 | L516: 12 | M516: =K516*6+L516 -> 78 | O516: 16 | P516: 18 | Q516: =O516*6+P516 -> 114 | S516: COBURG
A517: CAULFIELD | C517: 6 | D517: 4 | E517: =C517*6+D517 -> 40 | G517: 7 | H517: 5 | I517: =G517*6+H517 -> 47 | K517: 11 | L517: 14 | M517: =K517*6+L517 -> 80 | O517: 13 | P517: 18 | Q517: =O517*6+P517 -> 96 | S517: MATHEWS
A518: BEST PLAYERS
A519: COBURG | D519: NIMMO | G519: LAIDLER | J519: DOHNT | M519: HALBERT | P519: COLLINS
A520: CAULFIELD | D520: EINSEDEL | G520: SUTHERLAND | J520: ROWE | M520: S O'SULLIVAN | P520: BRASIER
A521: GOALKICKERS
A522: COBURG | D522: BEATTIE 4 | G522: HERBERT 4 | J522: COLLINS 2 | M522: DOHNT 2 | O522: HALBERT | Q522: BURT | R522: BREEN | T522: FISHER
A523: CAULFIELD | D523: S O'SULLIVAN 3 | H523: UPFAL 3 | J523: ROWE 2 | L523: KING | N523: SUTHERLAND | Q523: DAVIDSON | S523: TROTT | U523: FRIGO
A525: ROUND 12 | E525: 15TH JULY | J525: WEATHER | N525: NORTH WIND | S525: PLAYED AT
D526: 1ST QTR | H526: 2ND QTR | L526: 3RD QTR | P526: FINAL | S526: PRESTON
A527: PRESTON | C527: 5 | D527: 9 | E527: =C527*6+D527 -> 39 | G527: 7 | H527: 11 | I527: =G527*6+H527 -> 53 | K527: 15 | L527: 18 | M527: =K527*6+L527 -> 108 | O527: 18 | P527: 20 | Q527: =O527*6+P527 -> 128 | S527: UMPIRE | X527: LADDER | AB527: ROUND | AD527: 12
A528: DANDENONG | C528: 0 | D528: 1 | E528: =C528*6+D528 -> 1 | G528: 7 | H528: 5 | I528: =G528*6+H528 -> 47 | K528: 13 | L528: 9 | M528: =K528*6+L528 -> 87 | O528: 19 | P528: 12 | Q528: =O528*6+P528 -> 126 | S528: MATHEWS
A529: BEST PLAYERS | W529: TEAM | X529: W | Y529: L | Z529: D | AA529: FOR | AB529: AGST | AC529: % | AD529: PTS
A530: PRESTON | D530: CANN | G530: McCONNELL | J530: MARTIN | M530: P MARSHALL | P530: SCANLON | S530: WATT
A531: DANDENONG | D531: PRENDERGAST | G531: LUKAS | J531: SHINNERS | M531: WRIGHT | P531: TAYLOR | S531: GUY | W531: GEELONG WEST | X531: 10 | Y531: 2 | Z531: 0 | AA531: 1684 | AB531: 1299 | AC531: 129.6381832178599 | AD531: 40
A532: GOALKICKERS | P532: RINGIN | R532: MARKS | W532: COBURG | X532: 8 | Y532: 4 | Z532: 0 | AA532: 1468 | AB532: 1297 | AC532: 113.18427139552814 | AD532: 32
A533: PRESTON | D533: SCANLON 3 | F533: DURWOOD 3 | I533: CANN 3 | K533: JESSOP 3 | M533: LORENZINI | O533: P MARSHALL | R533: BATT | T533: COOPER | W533: PRAHRAN | X533: 7 | Y533: 5 | Z533: 0 | AA533: 1613 | AB533: 1478 | AC533: 109.1339648173207 | AD533: 28
A534: DANDENONG | D534: PRENDERGAST 8 | G534: LUKAS 5 | I534: SHINNERS | K534: COUSINS | M534: BRIESE | O534: COVENTRY | Q534: MADDEN | S534: TAYLOR | W534: CAULFIELD | X534: 7 | Y534: 5 | Z534: 0 | AA534: 1376 | AB534: 1543 | AC534: 89.176928062216462 | AD534: 28
A536: FRANKSTON | C536: 5 | D536: 9 | E536: =C536*6+D536 -> 39 | G536: 11 | H536: 13 | I536: =G536*6+H536 -> 79 | K536: 16 | L536: 19 | M536: =K536*6+L536 -> 115 | O536: 23 | P536: 20 | Q536: =O536*6+P536 -> 158 | S536: FRANKSTON | W536: PORT MELBOURNE | X536: 6 | Y536: 6 | Z536: 0 | AA536: 1390 | AB536: 1495 | AC536: 92.98 | AD536: 24
A537: SANDRINGHAM | C537: 3 | D537: 3 | E537: =C537*6+D537 -> 21 | G537: 12 | H537: 8 | I537: =G537*6+H537 -> 80 | K537: 18 | L537: 10 | M537: =K537*6+L537 -> 118 | O537: 21 | P537: 15 | Q537: =O537*6+P537 -> 141 | S537: SNOOKS | W537: PRESTON | X537: 5 | Y537: 7 | Z537: 0 | AA537: 1554 | AB537: 1511 | AC537: 102.85 | AD537: 20
A538: BEST PLAYERS | W538: DANDENONG | X538: 5 | Y538: 7 | Z538: 0 | AA538: 1418 | AB538: 1382 | AC538: 102.6 | AD538: 20
A539: FRANKSTON | D539: MACE | G539: GEDDES | J539: SERAFINI | M539: KEDDIE | P539: BOYD | S539: HALL | W539: FRANKSTON | X539: 5 | Y539: 7 | Z539: 0 | AA539: 1532 | AB539: 1758 | AC539: 87.144482366325363 | AD539: 20
A540: SANDRINGHAM | D540: LYONS | G540: KEAST | J540: T O'BRIEN | M540: McLEAN | P540: WILKINS | W540: BRUNSWICK | X540: 4 | Y540: 8 | Z540: 0 | AA540: 1320 | AB540: 1497 | AC540: 88.176352705410821 | AD540: 16
A541: GOALKICKERS | N541: DOCHERTY | Q541: BATTY | S541: BOYD | W541: SANDRINGHAM | X541: 3 | Y541: 9 | Z541: 0 | AA541: 1545 | AB541: 1640 | AC541: 94.207317073170728 | AD541: 12
A542: FRANKSTON | D542: SERAFINI 8 | F542: HALL 4 | H542: RASMUSSEN 3 | K542: KENNEDY | M542: SAMPSON | O542: MEMBREY | Q542: LEWIS | S542: HOUSDEN
A543: SANDRINGHAM | D543: KEAST 7 | F543: T O'BRIEN 4 | I543: GIAMPAOLO 3 | L543: WILKINS 3 | N543: HUTCHISON 2 | Q543: HODGES | S543: CLARK
A545: CAULFIELD | C545: 5 | D545: 9 | E545: =C545*6+D545 -> 39 | G545: 10 | H545: 11 | I545: =G545*6+H545 -> 71 | K545: 14 | L545: 15 | M545: =K545*6+L545 -> 99 | O545: 20 | P545: 19 | Q545: =O545*6+P545 -> 139 | S545: PRINCES PARK
A546: PRAHRAN | C546: 3 | D546: 2 | E546: =C546*6+D546 -> 20 | G546: 7 | H546: 7 | I546: =G546*6+H546 -> 49 | K546: 9 | L546: 9 | M546: =K546*6+L546 -> 63 | O546: 17 | P546: 12 | Q546: =O546*6+P546 -> 114 | S546: GROOM
A547: BEST PLAYERS
A548: CAULFIELD | D548: BRASIER | G548: ROWE | J548: SUTHERLAND | M548: O'SULLIVAN | P548: BOOTH | R548: COONEY
A549: PRAHRAN | D549: THORNTON | G549: DICKSON | J549: WISE | M549: McFAULL | P549: PREEN
A550: GOALKICKERS
A551: CAULFIELD | D551: ROWE 4 | F551: SMITH 3 | H551: BOOTH 3 | J551: SUTHERLAND 2 | N551: CROCKER 2 | Q551: RUSS 2 | S551: O'SULLIVAN | V551: EINSEDEL | X551: DAVIDSON | AA551: AMBLER
A552: PRAHRAN | D552: DICKSON 5 | G552: PREEN 4 | I552: SMITH 2 | K552: WISE 2 | M552: CLARKE | O552: McFAULL | Q552: LOWE | S552: McGUINNESS
A554: COBURG | C554: 6 | D554: 3 | E554: =C554*6+D554 -> 39 | G554: 9 | H554: 6 | I554: =G554*6+H554 -> 60 | K554: 13 | L554: 9 | M554: =K554*6+L554 -> 87 | O554: 16 | P554: 10 | Q554: =O554*6+P554 -> 106 | S554: GEELONG WEST
A555: GEEL0NG WEST | C555: 4 | D555: 1 | E555: =C555*6+D555 -> 25 | G555: 9 | H555: 4 | I555: =G555*6+H555 -> 58 | K555: 12 | L555: 7 | M555: =K555*6+L555 -> 79 | O555: 14 | P555: 10 | Q555: =O555*6+P555 -> 94 | S555: CASEY
A556: BEST PLAYERS
A557: COBURG | D557: HARBINSON | G557: PITT | J557: DOUGLAS | M557: BURT | P557: SMITH | R557: LAIDLER
A558: GEEL0NG WEST | D558: YATES | G558: G WELLS | J558: BROWNE | M558: PARSONS | P558: ARKLAY
A559: GOALKICKERS
A560: COBURG | D560: SMITH 6 | G560: LAIDLER 3 | J560: HALBERT 2 | M560: HERBERT 2 | P560: BEATTIE | R560: HALSALL | U560: COLLINS
A561: GEEL0NG WEST | D561: G WELLS 4 | G561: PARSONS 3 | J561: HINCK 2 | M561: BROWNE 2 | P561: SARLETT | R561: RADOJEVIC | U561: S WELLS
A563: PORT MELBOURNE | C563: 3 | D563: 0 | E563: =C563*6+D563 -> 18 | G563: 7 | H563: 1 | I563: =G563*6+H563 -> 43 | K563: 13 | L563: 5 | M563: =K563*6+L563 -> 83 | O563: 20 | P563: 9 | Q563: =O563*6+P563 -> 129 | S563: BRUNSWICK
A564: BRUNSWICK | C564: 3 | D564: 4 | E564: =C564*6+D564 -> 22 | G564: 7 | H564: 8 | I564: =G564*6+H564 -> 50 | K564: 10 | L564: 10 | M564: =K564*6+L564 -> 70 | O564: 17 | P564: 12 | Q564: =O564*6+P564 -> 114 | S564: HEDGER
A565: BEST PLAYERS
A566: PORT MELBOURNE | D566: AANENSEN | G566: K GOSS | J566: HARLAND | M566: DAVIES | O566: SINCLAIR | R566: CARTER
A567: BRUNSWICK | D567: SMITH | G567: BUCKLEY | J567: HARVEY | M567: WEST | O567: STONE | R567: BOURKE
A568: GOALKICKERS
A569: PORT MELBOURNE | D569: COOK 5 | G569: McKENNA 4 | J569: CHRISTOU 3 | M569: SWAN 3 | O569: THORPE 3 | R569: HARLAND 2
A570: BRUNSWICK | D570: STONE 4 | G570: HARVEY 3 | J570: B SMITH 2 | M570: HUGGARD 2 | P570: ORTON 2 | R570: BYRNE 2 | U570: WEST | W570: TOY
A572: ROUND 13 | E572: 15TH APRIL | J572: WEATHER | M572: FINE | S572: PLAYED AT
D573: 1ST QTR | H573: 2ND QTR | L573: 3RD QTR | P573: FINAL | S573: PORT MELBOURNE
A574: PORT MELBOURNE | C574: 5 | D574: 5 | E574: =C574*6+D574 -> 35 | G574: 9 | H574: 8 | I574: =G574*6+H574 -> 62 | K574: 13 | L574: 14 | M574: =K574*6+L574 -> 92 | O574: 19 | P574: 19 | Q574: =O574*6+P574 -> 133 | S574: UMPIRE | X574: LADDER | AB574: ROUND | AD574: 13
A575: PRESTON | C575: 4 | D575: 3 | E575: =C575*6+D575 -> 27 | G575: 8 | H575: 9 | I575: =G575*6+H575 -> 57 | K575: 13 | L575: 12 | M575: =K575*6+L575 -> 90 | O575: 19 | P575: 18 | Q575: =O575*6+P575 -> 132 | S575: GROOM
A576: BEST PLAYERS | W576: TEAM | X576: W | Y576: L | Z576: D | AA576: FOR | AB576: AGST | AC576: % | AD576: PTS
A577: PORT MELBOURNE | D577: AANENSEN | G577: GREENING | J577: P GOSS | M577: K GOSS | P577: EVANS | R577: CHRISTOU
A578: PRESTON | D578: JESSOP | G578: CANN | J578: TOWAN | M578: NICLASSEN | P578: RYLES | R578: McCULLOCH | W578: GEELONG WEST | X578: 10 | Y578: 3 | Z578: 0 | AA578: 1772 | AB578: 1390 | AC578: 127.4820143884892 | AD578: 40
A579: GOALKICKERS | W579: COBURG | X579: 9 | Y579: 4 | Z579: 0 | AA579: 1583 | AB579: 1365 | AC579: 115.97069597069597 | AD579: 36
A580: PORT MELBOURNE | D580: LOWE 5 | F580: EVANS 4 | H580: O'RILEY 4 | J580: P GOSS 3 | L580: CHRISTOU | N580: HOLT | P580: RASMUSSEN | W580: PRAHRAN | X580: 8 | Y580: 5 | Z580: 0 | AA580: 1704 | AB580: 1566 | AC580: 108.81226053639847 | AD580: 32
A581: PRESTON | D581: JESSOP 6 | F581: MARKS 3 | I581: VANN 3 | K581: NICLASSEN 2 | N581: DURWOOD | Q581: P MARSHALL | T581: WALSH | W581: PORT MELBOURNE | X581: 7 | Y581: 6 | Z581: 0 | AA581: 1523 | AB581: 1627 | AC581: 93.61 | AD581: 28
E582: 22ND JULY | J582: WEATHER | M582: NORTH WIND | R582: DUNBAR | T582: PLAIN
A583: PRAHRAN | C583: 2 | D583: 12 | E583: =C583*6+D583 -> 24 | G583: 4 | H583: 16 | I583: =G583*6+H583 -> 40 | K583: 10 | L583: 19 | M583: =K583*6+L583 -> 79 | O583: 12 | P583: 19 | Q583: =O583*6+P583 -> 91 | S583: TOORAK PARK | W583: CAULFIELD | X583: 7 | Y583: 6 | Z583: 0 | AA583: 1460 | AB583: 1637 | AC583: 89.187538179596828 | AD583: 28
A584: GEELONG WEST | C584: 3 | D584: 0 | E584: =C584*6+D584 -> 18 | G584: 6 | H584: 5 | I584: =G584*6+H584 -> 41 | K584: 8 | L584: 7 | M584: =K584*6+L584 -> 55 | O584: 13 | P584: 10 | Q584: =O584*6+P584 -> 88 | S584: HEDGER | W584: DANDENONG | X584: 6 | Y584: 7 | Z584: 0 | AA584: 1579 | AB584: 1448 | AC584: 109.05 | AD584: 24
A585: BEST PLAYERS | W585: PRESTON | X585: 5 | Y585: 8 | Z585: 0 | AA585: 1686 | AB585: 1644 | AC585: 102.55 | AD585: 20
A586: PRAHRAN | D586: ROD KELLY | G586: WISE | I586: DICKSON | L586: KEKOVICH | O586: McFAULL | Q586: SOULOS | W586: FRANKSTON | X586: 5 | Y586: 8 | Z586: 0 | AA586: 1598 | AB586: 1919 | AC586: 83.272537780093799 | AD586: 20
A587: GEELONG WEST | D587: DURRAN | G587: YATES | I587: S WELLS | L587: BROWNE | O587: DEEATH | Q587: GIBSON | W587: SANDRINGHAM | X587: 4 | Y587: 9 | Z587: 0 | AA587: 1639 | AB587: 1724 | AC587: 95.069605568445482 | AD587: 16
A588: GOALKICKERS | W588: BRUNSWICK | X588: 4 | Y588: 9 | Z588: 0 | AA588: 1388 | AB588: 1612 | AC588: 86.104218362282879 | AD588: 16
A589: PRAHRAN | D589: DICKSON 4 | G589: SOULOS 2 | J589: SMITH 2 | L589: KEKOVICH | N589: WISE | P589: AUSTIN | R589: THORNTON
A590: GEELONG WEST | D590: STENNETT 4 | G590: BROWNE 2 | J590: PARSONS 2 | M590: FRIEND 2 | O590: LUNN | Q590: S WELLS | S590: G WELLS
A592: SANDRINGHAM | C592: 9 | D592: 5 | E592: =C592*6+D592 -> 59 | G592: 9 | H592: 7 | I592: =G592*6+H592 -> 61 | K592: 12 | L592: 10 | M592: =K592*6+L592 -> 82 | O592: 14 | P592: 10 | Q592: =O592*6+P592 -> 94 | S592: BEACH ROAD
A593: CAULFIELD | C593: 0 | D593: 1 | E593: =C593*6+D593 -> 1 | G593: 5 | H593: 8 | I593: =G593*6+H593 -> 38 | K593: 6 | L593: 11 | M593: =K593*6+L593 -> 47 | O593: 11 | P593: 18 | Q593: =O593*6+P593 -> 84 | S593: TORNEY
A594: BEST PLAYERS
A595: SANDRINGHAM | D595: OSBORNE | G595: GIAMPAOLO | J595: ELLIOTT | M595: WILKINS | O595: CLARK | Q595: T O'BRIEN
A596: CAULFIELD | D596: O'SULLIVAN | G596: BRASIER | J596: RUSS | M596: BOOTH
A597: GOALKICKERS
A598: SANDRINGHAM | D598: HUTCHISON 5 | G598: BELL 4 | I598: BEUS 3 | K598: McNICHOLAS | N598: KEAST
A599: CAULFIELD | D599: BOOTH 3 | G599: SUTHERLAND 2 | J599: DAVIDSON 2 | M599: SMITH 2 | O599: CROCKER | Q599: RUSS
A601: DANDENONG | C601: 6 | D601: 11 | E601: =C601*6+D601 -> 47 | G601: 13 | H601: 12 | I601: =G601*6+H601 -> 90 | K601: 20 | L601: 20 | M601: =K601*6+L601 -> 140 | O601: 23 | P601: 23 | Q601: =O601*6+P601 -> 161 | S601: DANDENONG
A602: FRANKSTON | C602: 1 | D602: 0 | E602: =C602*6+D602 -> 6 | G602: 6 | H602: 3 | I602: =G602*6+H602 -> 39 | K602: 7 | L602: 3 | M602: =K602*6+L602 -> 45 | O602: 10 | P602: 6 | Q602: =O602*6+P602 -> 66 | S602: GROOM
A603: BEST PLAYERS
A604: DANDENONG | D604: McCONNELL | G604: GUY | J604: WOODMAN | M604: MADDEN | P604: LUKAS | R604: BRIESE
A605: FRANKSTON | D605: BOYD | G605: ORCHARD | J605: GEDDES | M605: FARQUHAR | P605: STAPLETON
A606: GOALKICKERS
A607: DANDENONG | D607: PRENDERGAST 4 | G607: LUKAS 4 | I607: MADDEN 4 | L607: TAYLOR 3 | N607: GUY 3 | P607: SHINNERS 2 | S607: BRIESE 2 | V607: LAMBERT
A608: FRANKSTON | D608: SERAFINI 2 | G608: BOYD 2 | I608: ORCHARD 2 | L608: SAMPSON | N608: MEMBREY | Q608: YOUNG | S608: DOCHERTY
A610: COBURG | C610: 2 | D610: 2 | E610: =C610*6+D610 -> 14 | G610: 9 | H610: 8 | I610: =G610*6+H610 -> 62 | K610: 11 | L610: 10 | M610: =K610*6+L610 -> 76 | O610: 17 | P610: 13 | Q610: =O610*6+P610 -> 115 | S610: COBURG
A611: BRUNSWICK | C611: 3 | D611: 5 | E611: =C611*6+D611 -> 23 | G611: 3 | H611: 7 | I611: =G611*6+H611 -> 25 | K611: 5 | L611: 12 | M611: =K611*6+L611 -> 42 | O611: 9 | P611: 14 | Q611: =O611*6+P611 -> 68 | S611: OAKLEY
A612: BEST PLAYERS
A613: COBURG | D613: DOUGLAS | G613: HARBINSON | J613: HALBERT | M613: HALSALL | P613: BURT | R613: FISHER
A614: BRUNSWICK | D614: R SMITH | G614: STONE | J614: WEST | M614: DOLAN | P614: BOURKE | R614: HUGGARD
A615: GOALKICKERS
A616: COBURG | D616: SMITH 4 | G616: HALSALL 4 | J616: FISHER 3 | M616: BURT 2 | O616: BEATTIE | Q616: HALBERT | S616: DOHNT | U616: COLLINS
A617: BRUNSWICK | D617: STONE 4 | G617: TOY 2 | I617: BOURKE | K617: BYRNE | M617: ORTON
A619: ROUND 14 | E619: 29TH JULY | J619: WEATHER | N619: FINE | S619: PLAYED AT
D620: 1ST QTR | H620: 2ND QTR | L620: 3RD QTR | P620: FINAL | S620: COBURG
A621: COBURG | C621: 4 | D621: 6 | E621: =C621*6+D621 -> 30 | G621: 6 | H621: 10 | I621: =G621*6+H621 -> 46 | K621: 11 | L621: 18 | M621: =K621*6+L621 -> 84 | O621: 20 | P621: 20 | Q621: =O621*6+P621 -> 140 | S621: UMPIRE | X621: LADDER | AB621: ROUND | AD621: 14
A622: DANDENONG | C622: 3 | D622: 1 | E622: =C622*6+D622 -> 19 | G622: 8 | H622: 3 | I622: =G622*6+H622 -> 51 | K622: 15 | L622: 5 | M622: =K622*6+L622 -> 95 | O622: 21 | P622: 10 | Q622: =O622*6+P622 -> 136 | S622: SNOOKS
A623: BEST PLAYERS | W623: TEAM | X623: W | Y623: L | Z623: D | AA623: FOR | AB623: AGST | AC623: % | AD623: PTS
A624: COBURG | D624: HALBERT | F624: HALSALL | I624: PITT | L624: HARBINSON | O624: HARTIGAN | R624: BURT
A625: DANDENONG | D625: GUY | F625: BRIESE | I625: SHINNERS | L625: DROSCHER | O625: HARPER | R625: SHEEHAN | W625: GEELONG WEST | X625: 11 | Y625: 3 | Z625: 0 | AA625: 1898 | AB625: 1513 | AC625: 125.4461335095836 | AD625: 44
A626: GOALKICKERS | W626: COBURG | X626: 10 | Y626: 4 | Z626: 0 | AA626: 1723 | AB626: 1501 | AC626: 114.79013990672885 | AD626: 40
A627: COBURG | D627: SMITH 6 | F627: BURT 3 | H627: HALBERT 2 | J627: HALSALL 2 | M627: HERBERT (2) | P627: BEATTIE | R627: DOHNT | T627: CLEARY | W627: PRAHRAN | X627: 8 | Y627: 6 | Z627: 0 | AA627: 1812 | AB627: 1682 | AC627: 107.72889417360285 | AD627: 32
A628: DANDENONG | D628: SHINNERS 5 | F628: PRENDERGAST 3 | J628: MADDEN 3 | M628: GUY 2 | O628: LAMBERT 2 | R628: BRIESE 2 | W628: PORT MELBOURNE | X628: 7 | Y628: 7 | Z628: 0 | AA628: 1646 | AB628: 1753 | AC628: 93.9 | AD628: 28
M629: SHEEHAN 2 | P629: LUKAS | R629: VAN DE BEEK
A630: SANDRINGHAM | C630: 2 | D630: 3 | E630: =C630*6+D630 -> 15 | G630: 5 | H630: 10 | I630: =G630*6+H630 -> 40 | K630: 11 | L630: 15 | M630: =K630*6+L630 -> 81 | O630: 16 | P630: 20 | Q630: =O630*6+P630 -> 116 | S630: TOORAK PARK | W630: CAULFIELD | X630: 7 | Y630: 7 | Z630: 0 | AA630: 1581 | AB630: 1798 | AC630: 87.931034482758619 | AD630: 28
A631: PRAHRAN | C631: 6 | D631: 3 | E631: =C631*6+D631 -> 39 | G631: 9 | H631: 7 | I631: =G631*6+H631 -> 61 | K631: 12 | L631: 9 | M631: =K631*6+L631 -> 81 | O631: 16 | P631: 12 | Q631: =O631*6+P631 -> 108 | S631: TORNEY | W631: DANDENONG | X631: 6 | Y631: 8 | Z631: 0 | AA631: 1715 | AB631: 1588 | AC631: 108 | AD631: 24
A632: BEST PLAYERS | W632: PRESTON | X632: 6 | Y632: 8 | Z632: 0 | AA632: 1852 | AB632: 1765 | AC632: 104.93 | AD632: 24
A633: SANDRINGHAM | D633: OSBORNE | G633: HUTCHISON | J633: PLEDGER | M633: KEAST | O633: McNICHOLAS | R633: CHAPMAN | W633: FRANKSTON | X633: 6 | Y633: 8 | Z633: 0 | AA633: 1763 | AB633: 2078 | AC633: 84.841193455245431 | AD633: 24
A634: PRAHRAN | D634: DICKSON | G634: ZEUNART | J634: McGUINNESS | M634: AUSTIN | O634: THORNTON | R634: WISE | W634: SANDRINGHAM | X634: 5 | Y634: 9 | Z634: 0 | AA634: 1755 | AB634: 1832 | AC634: 95.796943231441048 | AD634: 20
A635: GOALKICKERS | W635: BRUNSWICK | X635: 4 | Y635: 10 | Z635: 0 | AA635: 1547 | AB635: 1777 | AC635: 87.056837366347779 | AD635: 16
A636: SANDRINGHAM | D636: HUTCHISON 7 | G636: BELL 3 | I636: CLARK 2 | K636: CHAPMAN 2 | N636: T O'BRIEN | Q636: CAMPBELL
A637: PRAHRAN | D637: DICKSON 7 | G637: SMITH 3 | I637: WISE 3 | K637: LOWE 2 | M637: KEKOVICH
A639: PRESTON | C639: 7 | D639: 5 | E639: =C639*6+D639 -> 47 | G639: 13 | H639: 13 | I639: =G639*6+H639 -> 91 | K639: 21 | L639: 17 | M639: =K639*6+L639 -> 143 | O639: 23 | P639: 23 | Q639: =O639*6+P639 -> 161 | S639: PRINCES PARK
A640: CAULFIELD | C640: 2 | D640: 4 | E640: =C640*6+D640 -> 16 | G640: 10 | H640: 10 | I640: =G640*6+H640 -> 70 | K640: 15 | L640: 13 | M640: =K640*6+L640 -> 103 | O640: 17 | P640: 19 | Q640: =O640*6+P640 -> 121 | S640: VERGONA
A641: BEST PLAYERS
A642: PRESTON | D642: MARKS | G642: MARTIN | J642: McCULLOCH | M642: O'KEEFE | P642: LORENZINI | S642: JESSOP
A643: CAULFIELD | D643: ADAMS | G643: KING | J643: SMITH | M643: SUTHERLAND
A644: GOALKICKERS
A645: PRESTON | D645: LORENZINI 7 | G645: JESSOP 4 | I645: SCANLON 3 | L645: COOPER 2 | N645: G MARSHALL 2 | R645: MARKS | T645: VANN | W645: P MARSHALL | X645: MARTIN | Z645: DURWOOD
A646: CAULFIELD | D646: SUTHERLAND 5 | G646: KING 3 | I646: O'SULLIVAN 3 | L646: DAVIDSON 2 | O646: SMITH 2 | Q646: MICHAELS | T646: CROCKER
A648: GEELONG WEST | C648: 6 | D648: 3 | E648: =C648*6+D648 -> 39 | G648: 12 | H648: 4 | I648: =G648*6+H648 -> 76 | K648: 14 | L648: 10 | M648: =K648*6+L648 -> 94 | O648: 18 | P648: 18 | Q648: =O648*6+P648 -> 126 | S648: GEELONG WEST
A649: PORT MELBOURNE | C649: 8 | D649: 2 | E649: =C649*6+D649 -> 50 | G649: 12 | H649: 5 | I649: =G649*6+H649 -> 77 | K649: 15 | L649: 10 | M649: =K649*6+L649 -> 100 | O649: 18 | P649: 15 | Q649: =O649*6+P649 -> 123 | S649: STABB
A650: BEST PLAYERS
A651: GEELONG WEST | D651: BROWNE | G651: DEEATH | J651: ARKLAY | M651: SMITH | P651: S WELLS | S651: YATES
A652: PORT MELBOURNE | D652: K GOSS | G652: SWAN | J652: SINCLAIR | M652: CARTER | P652: DERMOTT | S652: DAVIES
A653: GOALKICKERS
A654: GEELONG WEST | D654: BROWNE 4 | G654: RADOJEVIC 3 | J654: DEEATH 2 | M654: STENNETT 2 | P654: LUNN 2 | R654: PARSONS 2 | U654: YATES | W654: S WELLS | X654: G WELLS
A655: PORT MELBOURNE | D655: McKENNA 6 | G655: COOK 5 | I655: EVANS 3 | K655: SWAN 2 | M655: HARLAND | P655: CHRISTOU
A657: FRANKSTON | C657: 7 | D657: 4 | E657: =C657*6+D657 -> 46 | G657: 16 | H657: 9 | I657: =G657*6+H657 -> 105 | K657: 21 | L657: 14 | M657: =K657*6+L657 -> 140 | O657: 24 | P657: 21 | Q657: =O657*6+P657 -> 165 | S657: FRANKSTON
A658: BRUNSWICK | C658: 7 | D658: 3 | E658: =C658*6+D658 -> 45 | G658: 12 | H658: 6 | I658: =G658*6+H658 -> 78 | K658: 18 | L658: 8 | M658: =K658*6+L658 -> 116 | O658: 24 | P658: 15 | Q658: =O658*6+P658 -> 159 | S658: TORNEY
A659: BEST PLAYERS
A660: FRANKSTON | D660: SERAFINI | G660: SAMPSON | J660: WALTON | M660: MACE | O660: RYAN | R660: GEDDES
A661: BRUNSWICK | D661: SMITH | G661: LEWIS | J661: STONE | M661: DOLAN | O661: SPENCER | R661: BOURKE
A662: GOALKICKERS
A663: FRANKSTON | D663: SERAFINI 10 | G663: RYAN 4 | I663: ORCHARD 3 | L663: WALTON 3 | N663: SAMPSON 2 | Q663: HALL | R663: MEMBREY
A664: BRUNSWICK | D664: STONE 6 | F664: TOY 5 | H664: GUNSTONE 3 | K664: SPENCER 3 | M664: MARANTELLI 2 | P664: BOURKE 2 | R664: BUCKLEY | U664: LAWRENCE | X664: DOLAN
A666: ROUND 15 | E666: 5TH AUGUST | J666: WEATHER | N666: NORTH WIND RAIN | S666: PLAYED AT
D667: 1ST QTR | H667: 2ND QTR | L667: 3RD QTR | P667: FINAL | S667: BRUNSWICK
A668: SANDRINGHAM | C668: 2 | D668: 2 | E668: =C668*6+D668 -> 14 | G668: 7 | H668: 8 | I668: =G668*6+H668 -> 50 | K668: 10 | L668: 11 | M668: =K668*6+L668 -> 71 | O668: 14 | P668: 19 | Q668: =O668*6+P668 -> 103 | S668: UMPIRE | X668: LADDER | AB668: ROUND | AD668: 15
A669: BRUNSWICK | C669: 2 | D669: 5 | E669: =C669*6+D669 -> 17 | G669: 5 | H669: 11 | I669: =G669*6+H669 -> 41 | K669: 9 | L669: 16 | M669: =K669*6+L669 -> 70 | O669: 10 | P669: 18 | Q669: =O669*6+P669 -> 78 | S669: HEDGER
A670: BEST PLAYERS | W670: TEAM | X670: W | Y670: L | Z670: D | AA670: FOR | AB670: AGST | AC670: % | AD670: PTS
A671: SANDRINGHAM | D671: LYONS | G671: ELLIOTT | J671: DEAGAN | M671: SIMS | O671: OSBORNE | R671: KEAST
A672: BRUNSWICK | D672: BOURKE | G672: BUCKLEY | J672: LAWRENCE | W672: GEELONG WEST | X672: 12 | Y672: 3 | Z672: 0 | AA672: 2044 | AB672: 1639 | AC672: 124.71018913971935 | AD672: 48
A673: GOALKICKERS | W673: COBURG | X673: 10 | Y673: 5 | Z673: 0 | AA673: 1807 | AB673: 1604 | AC673: 112.65586034912718 | AD673: 40
A674: SANDRINGHAM | D674: CAMPBELL 3 | G674: BELL 3 | I674: KEAST 3 | K674: HUTCHINSON 2 | N674: ELLIOTT | P674: SIMS | Q674: PLEDGER | W674: PRAHRAN | X674: 8 | Y674: 7 | Z674: 0 | AA674: 1898 | AB674: 1820 | AC674: 104.28571428571429 | AD674: 32
A675: BRUNSWICK | D675: GINGELL 3 | G675: LAWRENCE 3 | J675: SPENCER | L675: DOLAN | N675: B SMITH | P675: FANNING | W675: PORT MELBOURNE | X675: 8 | Y675: 7 | Z675: 0 | AA675: 1749 | AB675: 1837 | AC675: 95.21 | AD675: 32
A677: DANDENONG | C677: 7 | D677: 2 | E677: =C677*6+D677 -> 44 | G677: 10 | H677: 8 | I677: =G677*6+H677 -> 68 | K677: 16 | L677: 11 | M677: =K677*6+L677 -> 107 | O677: 21 | P677: 12 | Q677: =O677*6+P677 -> 138 | S677: DANDENONG | W677: CAULFIELD | X677: 8 | Y677: 7 | Z677: 0 | AA677: 1742 | AB677: 1946 | AC677: 89.5169578622816 | AD677: 32
A678: PRAHRAN | C678: 2 | D678: 4 | E678: =C678*6+D678 -> 16 | G678: 3 | H678: 9 | I678: =G678*6+H678 -> 27 | K678: 7 | L678: 11 | M678: =K678*6+L678 -> 53 | O678: 12 | P678: 14 | Q678: =O678*6+P678 -> 86 | S678: OAKLEY | W678: DANDENONG | X678: 7 | Y678: 8 | Z678: 0 | AA678: 1853 | AB678: 1674 | AC678: 110.69 | AD678: 28
A679: BEST PLAYERS | W679: PRESTON | X679: 6 | Y679: 9 | Z679: 0 | AA679: 1973 | AB679: 1911 | AC679: 103.24 | AD679: 24
A680: DANDENONG | D680: LAMBERT | G680: MADDEN | J680: BRIESE | M680: P KNIGHT | O680: DROSCHER | R680: VAN DE BEEK | W680: SANDRINGHAM | X680: 6 | Y680: 9 | Z680: 0 | AA680: 1858 | AB680: 1910 | AC680: 97.277486910994767 | AD680: 24
A681: PRAHRAN | D681: ZEUNART | G681: THORNTON | J681: PREEN | M681: AUSTIN | O681: LOWE | W681: FRANKSTON | X681: 6 | Y681: 9 | Z681: 0 | AA681: 1911 | AB681: 2239 | AC681: 85.350602947744534 | AD681: 24
A682: GOALKICKERS | O682: SHINNERS | R682: WOODMAN | W682: BRUNSWICK | X682: 4 | Y682: 11 | Z682: 0 | AA682: 1625 | AB682: 1880 | AC682: 86.436170212765958 | AD682: 16
A683: DANDENONG | D683: MADDEN 5 | F683: TAYLOR 3 | I683: BRIESE 3 | K683: LAMBERT 3 | N683: GUY 2 | P683: WRIGHT 2 | R683: VAN DE BEEK
A684: PRAHRAN | D684: SMITH 3 | G684: McGUINNESS 2 | J684: THORNTON 2 | M684: DICKSON 2 | P684: CLARKE | R684: LOWE | T684: PREEN
A686: PORT MELBOURNE | C686: 6 | D686: 3 | E686: =C686*6+D686 -> 39 | G686: 8 | H686: 8 | I686: =G686*6+H686 -> 56 | K686: 13 | L686: 10 | M686: =K686*6+L686 -> 88 | O686: 15 | P686: 13 | Q686: =O686*6+P686 -> 103 | S686: PORT MELBOURNE
A687: COBURG | C687: 2 | D687: 3 | E687: =C687*6+D687 -> 15 | G687: 4 | H687: 8 | I687: =G687*6+H687 -> 32 | K687: 7 | L687: 14 | M687: =K687*6+L687 -> 56 | O687: 11 | P687: 18 | Q687: =O687*6+P687 -> 84 | S687: GROOM
A688: BEST PLAYERS
A689: PORT MELBOURNE | D689: AANENSEN | G689: SINCLAIR | J689: CARTER | M689: COOK | O689: CHRISTOU | R689: SWAN
A690: COBURG | D690: CLEARY | G690: LAIDLER | J690: HERBERT | M690: HARTIGAN | O690: MILROY | R690: HALSALL
A691: GOALKICKERS
A692: PORT MELBOURNE | D692: COOK 7 | G692: McKENNA 3 | J692: EVANS | L692: LOWE | N692: HARLAND | Q692: GREENING | S692: K GOSS
A693: COBURG | D693: HALSALL 4 | G693: FISHER 2 | I693: COLLINS 2 | L693: DOHNT | N693: BURT | P693: PITT
A695: GEELONG WEST | C695: 3 | D695: 3 | E695: =C695*6+D695 -> 21 | G695: 10 | H695: 9 | I695: =G695*6+H695 -> 69 | K695: 16 | L695: 13 | M695: =K695*6+L695 -> 109 | O695: 21 | P695: 20 | Q695: =O695*6+P695 -> 146 | S695: PRESTON
A696: PRESTON | C696: 8 | D696: 7 | E696: =C696*6+D696 -> 55 | G696: 13 | H696: 11 | I696: =G696*6+H696 -> 89 | K696: 17 | L696: 16 | M696: =K696*6+L696 -> 118 | O696: 18 | P696: 18 | Q696: =O696*6+P696 -> 126 | S696: WENN
A697: BEST PLAYERS
A698: GEELONG WEST | D698: PARSONS | G698: ARKLAY | J698: YATES | M698: TAYLOR | O698: EDDY | Q698: GILMORE
A699: PRESTON | D699: JESSOP | G699: McCULLOCH | J699: MARKS | M699: VANN | O699: CANN | Q699: MARTIN
A700: GOALKICKERS
A701: GEELONG WEST | D701: STENNETT 4 | G701: PARSONS 4 | J701: YATES 4 | L701: BROWNE 3 | N701: LUNN 2 | P701: ARKLAY 2 | R701: S WELLS | U701: TAYLOR
A702: PRESTON | D702: VANN 4 | F702: LORENZINI 3 | I702: JESSOP 3 | K702: SCANLON 2 | N702: CANN 2 | P702: COOPER 2 | R702: DURWOOD | U702: WILMOT
A704: CAULFIELD | C704: 2 | D704: 6 | E704: =C704*6+D704 -> 18 | G704: 13 | H704: 10 | I704: =G704*6+H704 -> 88 | K704: 18 | L704: 15 | M704: =K704*6+L704 -> 123 | O704: 24 | P704: 17 | Q704: =O704*6+P704 -> 161 | S704: FRANKSTON
A705: FRANKSTON | C705: 5 | D705: 9 | E705: =C705*6+D705 -> 39 | G705: 10 | H705: 15 | I705: =G705*6+H705 -> 75 | K705: 17 | L705: 19 | M705: =K705*6+L705 -> 121 | O705: 20 | P705: 28 | Q705: =O705*6+P705 -> 148 | S705: FITZPATRICK
A706: BEST PLAYERS
A707: CAULFIELD | D707: DAVIDSON | G707: ADAMS | J707: O'SULLIVAN | M707: AMBLER | P707: MORRISON | S707: HUNT
A708: FRANKSTON | D708: WALTON | G708: ORCHARD | J708: MACE | M708: FARQUHAR | P708: RASMUSSEN | S708: SERAFINI
A709: GOALKICKERS
A710: CAULFIELD | D710: O'LOUGHLIN 4 | G710: STAIT 4 | I710: O'SULLIVAN 3 | L710: DAVIDSON 3 | O710: RUSS 3 | Q710: ROWE 2 | S710: SMITH 2 | V710: MORRISON | X710: ADAMS
A711: FRANKSTON | D711: SERAFINI 6 | G711: WALTON 5 | J711: RASMUSSEN 4 | M711: ORCHARD | O711: DANKS | Q711: JONES | S711: HUNTER | V711: RYAN
A713: ROUND 16 | E713: 12TH AUGUST | J713: WEATHER | N713: RAIN | S713: PLAYED AT
D714: 1ST QTR | H714: 2ND QTR | L714: 3RD QTR | P714: FINAL | S714: BEACH ROAD
A715: SANDRINGHAM | C715: 2 | D715: 5 | E715: =C715*6+D715 -> 17 | G715: 3 | H715: 9 | I715: =G715*6+H715 -> 27 | K715: 5 | L715: 16 | M715: =K715*6+L715 -> 46 | O715: 6 | P715: 16 | Q715: =O715*6+P715 -> 52 | S715: UMPIRE | X715: LADDER | AB715: ROUND | AD715: 16
A716: DANDENONG | C716: 0 | D716: 1 | E716: =C716*6+D716 -> 1 | G716: 2 | H716: 3 | I716: =G716*6+H716 -> 15 | K716: 2 | L716: 6 | M716: =K716*6+L716 -> 18 | O716: 6 | P716: 13 | Q716: =O716*6+P716 -> 49 | S716: STABB
A717: BEST PLAYERS | W717: TEAM | X717: W | Y717: L | Z717: D | AA717: FOR | AB717: AGST | AC717: % | AD717: PTS
A718: SANDRINGHAM | D718: PLEDGER | G718: DEAGAN | J718: LYONS | M718: GILMORE | P718: COELLI | R718: CHAPMAN
A719: DANDENONG | D719: HARPER | G719: HORAZCKO | J719: DROSCHER | M719: McCONNELL | P719: KNIGHT | R719: SHINNERS | W719: GEELONG WEST | X719: 13 | Y719: 3 | Z719: 0 | AA719: 2158 | AB719: 1701 | AC719: 126.86654908877131 | AD719: 52
A720: GOALKICKERS | W720: COBURG | X720: 11 | Y720: 5 | Z720: 0 | AA720: 1925 | AB720: 1694 | AC720: 113.63636363636364 | AD720: 44
A721: SANDRINGHAM | D721: ELLIOTT | G721: BELL | I721: GILMORE | K721: CAMPBELL | N721: KEAST | P721: PLEDGER | W721: PRAHRAN | X721: 9 | Y721: 7 | Z721: 0 | AA721: 1972 | AB721: 1889 | AC721: 104.39385918475384 | AD721: 36
A722: DANDENONG | D722: KNIGHT | G722: MADDEN | I722: SHEEHAN | K722: PRENDERGAST | N722: SHINNERS | P722: McKAY | W722: CAULFIELD | X722: 9 | Y722: 7 | Z722: 0 | AA722: 1817 | AB722: 2014 | AC722: 90.218470705064547 | AD722: 36
A724: GEELONG WEST | C724: 1 | D724: 2 | E724: =C724*6+D724 -> 8 | G724: 5 | H724: 11 | I724: =G724*6+H724 -> 41 | K724: 9 | L724: 13 | M724: =K724*6+L724 -> 67 | O724: 16 | P724: 18 | Q724: =O724*6+P724 -> 114 | S724: GEELONG WEST | W724: PORT MELBOURNE | X724: 8 | Y724: 8 | Z724: 0 | AA724: 1818 | AB724: 1911 | AC724: 95.13 | AD724: 32
A725: FRANKSTON | C725: 3 | D725: 5 | E725: =C725*6+D725 -> 23 | G725: 3 | H725: 7 | I725: =G725*6+H725 -> 25 | K725: 4 | L725: 15 | M725: =K725*6+L725 -> 39 | O725: 7 | P725: 20 | Q725: =O725*6+P725 -> 62 | S725: VERGONA | W725: DANDENONG | X725: 7 | Y725: 9 | Z725: 0 | AA725: 1902 | AB725: 1726 | AC725: 110.2 | AD725: 28
A726: BEST PLAYERS | W726: SANDRINGHAM | X726: 7 | Y726: 9 | Z726: 0 | AA726: 1910 | AB726: 1959 | AC726: 97.498723838693209 | AD726: 28
A727: GEELONG WEST | D727: DURRAN | G727: GIBSON | J727: GILMORE | M727: LUNN | P727: YATES | R727: S WELLS | W727: PRESTON | X727: 6 | Y727: 10 | Z727: 0 | AA727: 2063 | AB727: 2029 | AC727: 101.68 | AD727: 24
A728: FRANKSTON | D728: JONES | G728: HOUSDEN | J728: ORCHARD | M728: FARQUHAR | P728: BELL | R728: BONUDA | W728: FRANKSTON | X728: 6 | Y728: 10 | Z728: 0 | AA728: 1973 | AB728: 2353 | AC728: 83.850403739906497 | AD728: 24
A729: GOALKICKERS | W729: BRUNSWICK | X729: 4 | Y729: 12 | Z729: 0 | AA729: 1693 | AB729: 1955 | AC729: 86.598465473145779 | AD729: 16
A730: GEELONG WEST | D730: STENNETT 5 | G730: G WELLS 5 | J730: GILMORE 2 | M730: S WELLS 2 | P730: PARSONS | R730: LUNN
A731: FRANKSTON | D731: SERAFINI 2 | G731: HUNTER 2 | J731: DANKS | L731: DOCHERTY | O731: BOYD
A733: COBURG | C733: 5 | D733: 6 | E733: =C733*6+D733 -> 36 | G733: 6 | H733: 10 | I733: =G733*6+H733 -> 46 | K733: 12 | L733: 13 | M733: =K733*6+L733 -> 85 | O733: 17 | P733: 16 | Q733: =O733*6+P733 -> 118 | S733: COBURG
A734: PRESTON | C734: 4 | D734: 1 | E734: =C734*6+D734 -> 25 | G734: 8 | H734: 6 | I734: =G734*6+H734 -> 54 | K734: 11 | L734: 7 | M734: =K734*6+L734 -> 73 | O734: 13 | P734: 12 | Q734: =O734*6+P734 -> 90 | S734: FITZPATRICK
A735: BEST PLAYERS
A736: COBURG | D736: HERBERT | G736: MILROY | J736: LAIDLER | M736: CLEARY | O736: NIMMO | R736: FISHER
A737: PRESTON | D737: JESSOP | G737: McCULLOCH | J737: MARTIN | M737: COOPER
A738: GOALKICKERS
A739: COBURG | D739: SMITH 6 | G739: COLLINS 3 | J739: CLEARY 3 | M739: HERBERT 2 | P739: HALSALL 2 | S739: HALBERT
A740: PRESTON | D740: JESSOP 3 | G740: WALSH 3 | J740: CANN 2 | L740: MARSHALL 2 | O740: TOWAN | Q740: LORENZINI | S740: VANN
A742: PRAHRAN | C742: 3 | D742: 4 | E742: =C742*6+D742 -> 22 | G742: 5 | H742: 5 | I742: =G742*6+H742 -> 35 | K742: 9 | L742: 8 | M742: =K742*6+L742 -> 62 | O742: 10 | P742: 14 | Q742: =O742*6+P742 -> 74 | S742: TOORAK PARK
A743: PORT MELBOURNE | C743: 1 | D743: 3 | E743: =C743*6+D743 -> 9 | G743: 4 | H743: 7 | I743: =G743*6+H743 -> 31 | K743: 6 | L743: 7 | M743: =K743*6+L743 -> 43 | O743: 10 | P743: 9 | Q743: =O743*6+P743 -> 69 | S743: HEDGER
A744: BEST PLAYERS
A745: PRAHRAN | D745: PREEN | G745: JEFFREY | J745: THORNTON | M745: WISE | O745: LITTLE | R745: CHAPMAN
A746: PORT MELBOURNE | D746: AANENSEN | G746: P GOSS | J746: K GOSS | M746: DERMOTT | O746: SINCLAIR | R746: DAVIES
A747: GOALKICKERS
A748: PRAHRAN | D748: DICKSON 3 | G748: CHAPMAN 2 | J748: McGUINNESS 2 | N748: LITTLE | P748: SMITH | R748: ZEUNART
A749: PORT MELBOURNE | D749: McKENNA 4 | G749: COOK 2 | I749: HARLAND 2 | L749: SINCLAIR | N749: SCOTT
A751: CAULFIELD | C751: 2 | D751: 5 | E751: =C751*6+D751 -> 17 | G751: 7 | H751: 12 | I751: =G751*6+H751 -> 54 | K751: 8 | L751: 17 | M751: =K751*6+L751 -> 65 | O751: 9 | P751: 21 | Q751: =O751*6+P751 -> 75 | S751: PRINCES PARK
A752: BRUNSWICK | C752: 2 | D752: 3 | E752: =C752*6+D752 -> 15 | G752: 2 | H752: 6 | I752: =G752*6+H752 -> 18 | K752: 7 | L752: 14 | M752: =K752*6+L752 -> 56 | O752: 8 | P752: 20 | Q752: =O752*6+P752 -> 68 | S752: MATHEWS
A753: BEST PLAYERS
A754: CAULFIELD | D754: AMBLER | G754: SUTTIE | J754: KING | M754: BOOTH | O754: ROWE
A755: BRUNSWICK | D755: LAWRENCE | G755: BUCKLEY | J755: HUGGARD | M755: BROWN | O755: LEWIS
A756: GOALKICKERS
A757: CAULFIELD | D757: KING 3 | G757: HUNT 2 | J757: BOOTH 2 | M757: O'SULLIVAN | P757: O'LOUGHLIN
A758: BRUNSWICK | D758: BA VALENTINE 3 | H758: GINGELL | J758: BOURKE | L758: LEWIS | N758: WEST | P758: LAWRENCE
A760: ROUND 17 | E760: 19TH AUGUST | J760: WEATHER | N760: NORTH WEST WIND RAIN | S760: PLAYED AT
D761: 1ST QTR | H761: 2ND QTR | L761: 3RD QTR | P761: FINAL | S761: PRINCES PARK
A762: DANDENONG | C762: 3 | D762: 10 | E762: =C762*6+D762 -> 28 | G762: 9 | H762: 14 | I762: =G762*6+H762 -> 68 | K762: 15 | L762: 16 | M762: =K762*6+L762 -> 106 | O762: 19 | P762: 23 | Q762: =O762*6+P762 -> 137 | S762: UMPIRE | X762: LADDER | AB762: ROUND | AD762: 17
A763: CAULFIELD | C763: 4 | D763: 2 | E763: =C763*6+D763 -> 26 | G763: 7 | H763: 5 | I763: =G763*6+H763 -> 47 | K763: 12 | L763: 8 | M763: =K763*6+L763 -> 80 | O763: 15 | P763: 11 | Q763: =O763*6+P763 -> 101 | S763: SNOOKS
A764: BEST PLAYERS | W764: TEAM | X764: W | Y764: L | Z764: D | AA764: FOR | AB764: AGST | AC764: % | AD764: PTS
A765: DANDENONG | D765: BRIESE | F765: GUY | I765: WOODMAN | L765: DROSCHER | O765: LAMBERT | Q765: MADDEN
A766: CAULFIELD | D766: KING | F766: SUTTIE | I766: ADAMS | L766: FRIGO | O766: ROWE | Q766: HUNT | W766: GEELONG WEST | X766: 14 | Y766: 3 | Z766: 0 | AA766: 2248 | AB766: 1760 | AC766: 127.72727272727273 | AD766: 56
A767: GOALKICKERS | Q767: PRENDERGAST | W767: COBURG | X767: 12 | Y767: 5 | Z767: 0 | AA767: 2039 | AB767: 1780 | AC767: 114.55056179775281 | AD767: 48
A768: DANDENONG | D768: BRIESE 4 | F768: LAMBERT 3 | I768: GUY 3 | K768: MADDEN 3 | N768: TOWNSEND 2 | Q768: WRIGHT 2 | S768: SHINNERS | W768: PRAHRAN | X768: 9 | Y768: 8 | Z768: 0 | AA768: 2058 | AB768: 2003 | AC768: 102.74588117823265 | AD768: 36
A769: CAULFIELD | D769: KING 4 | F769: HAWKING 3 | I769: ROWE 2 | K769: BOOTH 2 | M769: RUSS 2 | O769: O'SULLIVAN | R769: SMITH | W769: PORT MELBOURNE | X769: 9 | Y769: 8 | Z769: 0 | AA769: 1947 | AB769: 2030 | AC769: 95.91 | AD769: 36
A771: GEELONG WEST | C771: 4 | D771: 3 | E771: =C771*6+D771 -> 27 | G771: 10 | H771: 5 | I771: =G771*6+H771 -> 65 | K771: 11 | L771: 11 | M771: =K771*6+L771 -> 77 | O771: 13 | P771: 12 | Q771: =O771*6+P771 -> 90 | S771: GEELONG WEST | W771: CAULFIELD | X771: 9 | Y771: 8 | Z771: 0 | AA771: 1918 | AB771: 2151 | AC771: 89.167828916782895 | AD771: 36
A772: SANDRINGHAM | C772: 1 | D772: 2 | E772: =C772*6+D772 -> 8 | G772: 4 | H772: 4 | I772: =G772*6+H772 -> 28 | K772: 5 | L772: 8 | M772: =K772*6+L772 -> 38 | O772: 8 | P772: 11 | Q772: =O772*6+P772 -> 59 | S772: OAKLEY | W772: DANDENONG | X772: 8 | Y772: 9 | Z772: 0 | AA772: 2039 | AB772: 1827 | AC772: 111.6 | AD772: 32
A773: BEST PLAYERS | W773: PRESTON | X773: 7 | Y773: 10 | Z773: 0 | AA773: 2194 | AB773: 2128 | AC773: 103.1 | AD773: 28
A774: GEELONG WEST | D774: RUSSELL | G774: SCARLETT | J774: S WELLS | M774: FRIEND | P774: GIBSON | S774: YATES | W774: SANDRINGHAM | X774: 7 | Y774: 10 | Z774: 0 | AA774: 1969 | AB774: 2049 | AC774: 96.095656417764758 | AD774: 28
A775: SANDRINGHAM | D775: GIAMPAOLO | G775: CLARK | J775: McLEAN | M775: O'BRIEN | P775: LYONS | S775: COELLI | W775: FRANKSTON | X775: 6 | Y775: 11 | Z775: 0 | AA775: 2092 | AB775: 2482 | AC775: 84.286865431103948 | AD775: 24
A776: GOALKICKERS | W776: BRUNSWICK | X776: 4 | Y776: 13 | Z776: 0 | AA776: 1792 | AB776: 2086 | AC776: 85.90604026845638 | AD776: 16
A777: GEELONG WEST | D777: PARSONS 4 | G777: RADOJEVIC 3 | J777: G WELLS 2 | M777: BROWNE 2 | P777: GILMORE | R777: SCARLETT
A778: SANDRINGHAM | D778: KEAST 2 | G778: LYONS 2 | J778: PLEDGER | L778: CLARK | N778: BELL | P778: GILMORE
A780: COBURG | C780: 4 | D780: 3 | E780: =C780*6+D780 -> 27 | G780: 10 | H780: 6 | I780: =G780*6+H780 -> 66 | K780: 14 | L780: 13 | M780: =K780*6+L780 -> 97 | O780: 16 | P780: 18 | Q780: =O780*6+P780 -> 114 | S780: COBURG
A781: PRAHRAN | C781: 4 | D781: 2 | E781: =C781*6+D781 -> 26 | G781: 7 | H781: 3 | I781: =G781*6+H781 -> 45 | K781: 10 | L781: 8 | M781: =K781*6+L781 -> 68 | O781: 13 | P781: 8 | Q781: =O781*6+P781 -> 86 | S781: WENN
A782: BEST PLAYERS
A783: COBURG | D783: MILROY | F783: HALSALL | I783: HARTIGAN | L783: BURT | N783: FISHER | Q783: LAIDLER
A784: PRAHRAN | D784: FOLEY | F784: PREEN | I784: ZEUNART | L784: ANDERSON | N784: JEFFREY
A785: GOALKICKERS
A786: COBURG | D786: HALSALL 5 | G786: FISHER 3 | I786: BEATTIE 2 | L786: HALBERT | N786: SMITH | P786: HARTIGAN | R786: CLEARY | T786: TOLLEY | V786: HODGE
A787: PRAHRAN | D787: SMITH 2 | F787: CHAPMAN 2 | I787: PREEN 2 | K787: LITTLE 2 | M787: CLARKE | O787: DICKSON | Q787: WISE | S787: ZEUNART | V787: CUNNINGHAM
A789: PORT MELBOURNE | C789: 4 | D789: 1 | E789: =C789*6+D789 -> 25 | G789: 10 | H789: 4 | I789: =G789*6+H789 -> 64 | K789: 16 | L789: 8 | M789: =K789*6+L789 -> 104 | O789: 20 | P789: 9 | Q789: =O789*6+P789 -> 129 | S789: FRANKSTON
A790: FRANKSTON | C790: 3 | D790: 3 | E790: =C790*6+D790 -> 21 | G790: 10 | H790: 8 | I790: =G790*6+H790 -> 68 | K790: 13 | L790: 12 | M790: =K790*6+L790 -> 90 | O790: 17 | P790: 17 | Q790: =O790*6+P790 -> 119 | S790: STABB
A791: BEST PLAYERS
A792: PORT MELBOURNE | D792: CARTER | G792: AANENSEN | J792: SWAN | M792: P GOSS | O792: HAENAN | R792: HARLAND
A793: FRANKSTON | D793: ORCHARD | G793: FARQUHAR | J793: GEDDES | M793: HOUSDEN | O793: SAMPSON | R793: BELL
A794: GOALKICKERS
A795: PORT MELBOURNE | D795: COOK 5 | F795: McKENNA 4 | I795: SWAN 3 | K795: HARLAND 3 | N795: P GOSS | P795: K GOSS | R795: AANENSEN | U795: SINCLAIR | X795: EVANS
A796: FRANKSTON | D796: SERAFINI 2 | F796: ORCHARD 2 | I796: HOUSDEN 2 | L796: WALTON 2 | N796: LYNN 2 | P796: JONES | R796: HUNTER | T796: RIDSDALE | W796: RASMUSSEN | X796: BONIWELL | AA796: YOUNG
A798: PRESTON | C798: 6 | D798: 6 | E798: =C798*6+D798 -> 42 | G798: 8 | H798: 14 | I798: =G798*6+H798 -> 62 | K798: 15 | L798: 20 | M798: =K798*6+L798 -> 110 | O798: 18 | P798: 23 | Q798: =O798*6+P798 -> 131 | S798: PRESTON
A799: BRUNSWICK | C799: 3 | D799: 5 | E799: =C799*6+D799 -> 23 | G799: 6 | H799: 12 | I799: =G799*6+H799 -> 48 | K799: 8 | L799: 18 | M799: =K799*6+L799 -> 66 | O799: 13 | P799: 21 | Q799: =O799*6+P799 -> 99 | S799: GROOM
A800: BEST PLAYERS
A801: PRESTON | D801: MARKS | G801: JESSOP | J801: CANN | M801: VANN | O801: BOLGER | R801: O'KEEFE
A802: BRUNSWICK | D802: WEST | G802: STONE | J802: BOURKE | M802: BYRNE | O802: BROWN | R802: TOY
A803: GOALKICKERS
A804: PRESTON | D804: VANN 3 | F804: JESSOP 3 | H804: COOPER 3 | J804: LORENZINI 2 | M804: CANN 2 | O804: DURWOOD | Q804: P MARSHALL | T804: MARKS | W804: CROOKE | X804: SAVIC
A805: BRUNSWICK | D805: BOURKE 4 | G805: GINGELL 3 | J805: TOY 2 | L805: HUGGARD | N805: BYRNE | P805: STONE | R805: WEST
A807: ROUND 18 | E807: 26TH AUGUST | J807: WEATHER | S807: PLAYED AT
D808: 1ST QTR | H808: 2ND QTR | L808: 3RD QTR | P808: FINAL | S808: BRUNSWICK
A809: PRAHRAN | C809: 10 | D809: 6 | E809: =C809*6+D809 -> 66 | G809: 15 | H809: 11 | I809: =G809*6+H809 -> 101 | K809: 20 | L809: 17 | M809: =K809*6+L809 -> 137 | O809: 24 | P809: 23 | Q809: =O809*6+P809 -> 167 | S809: UMPIRE | X809: LADDER | AB809: ROUND | AD809: 18
A810: BRUNSWICK | C810: 5 | D810: 1 | E810: =C810*6+D810 -> 31 | G810: 11 | H810: 6 | I810: =G810*6+H810 -> 72 | K810: 15 | L810: 10 | M810: =K810*6+L810 -> 100 | O810: 19 | P810: 13 | Q810: =O810*6+P810 -> 127 | S810: STABB
A811: BEST PLAYERS | W811: TEAM | X811: W | Y811: L | Z811: D | AA811: FOR | AB811: AGST | AC811: % | AD811: PTS
A812: PRAHRAN | D812: WISE | G812: SMITH | I812: KENT | K812: ROD KELLY | N812: CHAPMAN | Q812: PREEN
A813: BRUNSWICK | D813: LAWRENCE | G813: STONE | I813: ORTON | K813: CROTTY | N813: WEST | Q813: BA VALENTINE | W813: GEELONG WEST | X813: 15 | Y813: 3 | Z813: 0 | AA813: 2397 | AB813: 1908 | AC813: 125.62893081761007 | AD813: 60
A814: GOALKICKERS | W814: COBURG | X814: 12 | Y814: 6 | Z814: 0 | AA814: 2157 | AB814: 1915 | AC814: 112.63707571801567 | AD814: 48
A815: PRAHRAN | D815: SMITH 10 | F815: CHAPMAN 4 | I815: CLARKE 3 | K815: WISE 2 | M815: SOULOS 2 | O815: PREEN | Q815: LITTLE | S815: ZEUNERT | W815: PRAHRAN | X815: 10 | Y815: 8 | Z815: 0 | AA815: 2225 | AB815: 2130 | AC815: 104.46009389671362 | AD815: 40
A816: BRUNSWICK | D816: ORTON 5 | F816: STONE 4 | H816: TOY 2 | J816: GINGELL 2 | M816: BA VALENTINE | P816: GUNSTONE | R816: LAWRENCE | W816: PORT MELBOURNE | X816: 10 | Y816: 8 | Z816: 0 | AA816: 2062 | AB816: 2119 | AC816: 97.31 | AD816: 40
N817: BOURKE | Q817: WEST
A818: SANDRINGHAM | C818: 3 | D818: 2 | E818: =C818*6+D818 -> 20 | G818: 11 | H818: 5 | I818: =G818*6+H818 -> 71 | K818: 15 | L818: 9 | M818: =K818*6+L818 -> 99 | O818: 20 | P818: 15 | Q818: =O818*6+P818 -> 135 | S818: BEACH ROAD | W818: CAULFIELD | X818: 9 | Y818: 9 | Z818: 0 | AA818: 2007 | AB818: 2266 | AC818: 88.57016769638129 | AD818: 36
A819: COBURG | C819: 4 | D819: 2 | E819: =C819*6+D819 -> 26 | G819: 8 | H819: 3 | I819: =G819*6+H819 -> 51 | K819: 14 | L819: 6 | M819: =K819*6+L819 -> 90 | O819: 18 | P819: 10 | Q819: =O819*6+P819 -> 118 | S819: MATHEWS | W819: DANDENONG | X819: 8 | Y819: 10 | Z819: 0 | AA819: 2187 | AB819: 1976 | AC819: 110.68 | AD819: 32
A820: BEST PLAYERS | W820: PRESTON | X820: 8 | Y820: 10 | Z820: 0 | AA820: 2337 | AB820: 2238 | AC820: 104.42 | AD820: 32
A821: SANDRINGHAM | D821: PLEDGER | G821: McLEAN | J821: CLARK | M821: DEAGAN | O821: GILMORE | R821: LYONS | W821: SANDRINGHAM | X821: 8 | Y821: 10 | Z821: 0 | AA821: 2104 | AB821: 2167 | AC821: 97.092754960775267 | AD821: 32
A822: COBURG | D822: HARTIGAN | G822: HALBERT | J822: NIMMO | M822: BEATTIE | O822: DOUGLAS | W822: FRANKSTON | X822: 6 | Y822: 12 | Z822: 0 | AA822: 2202 | AB822: 2625 | AC822: 83.885714285714286 | AD822: 24
A823: GOALKICKERS | N823: GIAMPAOLO | Q823: GILMORE | S823: SIMS | W823: BRUNSWICK | X823: 4 | Y823: 14 | Z823: 0 | AA823: 1919 | AB823: 2253 | AC823: 85.17532179316467 | AD823: 16
A824: SANDRINGHAM | D824: PLEDGER 7 | F824: KEAST 2 | H824: McNICHOLAS 2 | K824: T O'BRIEN 2 | N824: CHAPMAN | Q824: CLARK | S824: ELLIOTT | U824: BELL
A825: COBURG | D825: HALSALL 5 | G825: BEATTIE 3 | J825: HERBERT 2 | M825: HALBERT 2 | P825: CLEARY 2 | R825: PRICE 2 | U825: FISHER
A827: GEELONG WEST | C827: 4 | D827: 3 | E827: =C827*6+D827 -> 27 | G827: 13 | H827: 7 | I827: =G827*6+H827 -> 85 | K827: 17 | L827: 10 | M827: =K827*6+L827 -> 112 | O827: 22 | P827: 17 | Q827: =O827*6+P827 -> 149 | S827: DANDENONG
A828: DANDENONG | C828: 10 | D828: 4 | E828: =C828*6+D828 -> 64 | G828: 12 | H828: 6 | I828: =G828*6+H828 -> 78 | K828: 18 | L828: 10 | M828: =K828*6+L828 -> 118 | O828: 22 | P828: 16 | Q828: =O828*6+P828 -> 148 | S828: TORNEY
A829: BEST PLAYERS
A830: GEELONG WEST | D830: YATES | G830: FRIEND | I830: SCARLETT | L830: RADOJEVIC | O830: STENNETT | R830: G WELLS
A831: DANDENONG | D831: LAMBERT | G831: GUY | I831: DROSCHER | L831: COUSINS | O831: MADDDEN | R831: TOWNSEND
A832: GOALKICKERS
A833: GEELONG WEST | D833: RADOJEVIC 8 | G833: STENNETT 5 | J833: ARKLAY 2 | M833: G WELLS 2 | P833: HINCK 2 | R833: EDDY | T833: SCARLETT | W833: TAYLOR
A834: DANDENONG | D834: LAMBERT 6 | G834: MADDEN 4 | J834: TOWNSEND 3 | M834: PRENDERGAST 3 | Q834: BRIESE 2 | S834: SHINNERS | V834: McKAY | X834: TAYLOR | Z834: DROSCHER
A836: PORT MELBOURNE | C836: 5 | D836: 7 | E836: =C836*6+D836 -> 37 | G836: 8 | H836: 11 | I836: =G836*6+H836 -> 59 | K836: 12 | L836: 15 | M836: =K836*6+L836 -> 87 | O836: 16 | P836: 19 | Q836: =O836*6+P836 -> 115 | S836: PORT MELBOURNE
A837: CAULFIELD | C837: 1 | D837: 1 | E837: =C837*6+D837 -> 7 | G837: 7 | H837: 5 | I837: =G837*6+H837 -> 47 | K837: 12 | L837: 8 | M837: =K837*6+L837 -> 80 | O837: 13 | P837: 11 | Q837: =O837*6+P837 -> 89 | S837: GROOM
A838: BEST PLAYERS
A839: PORT MELBOURNE | D839: DERMOTT | G839: K GOSS | J839: AANENSEN | M839: P GOSS | P839: CARTER | S839: HAENAN
A840: CAULFIELD | D840: ROWE | G840: SUTTIE | J840: DAVIDSON | M840: HUNT | P840: MORRISON | S840: FRIGO
A841: GOALKICKERS
A842: PORT MELBOURNE | D842: McKENNA 4 | G842: COOK 3 | I842: K GOSS 2 | K842: GREENING 2 | N842: SWAN | P842: HARLAND | R842: SINCLAIR | U842: EVANS | W842: JEFFRIES
A843: CAULFIELD | D843: DAVIDSON 6 | G843: ROWE 3 | I843: BOOTH 2 | K843: SMITH 2
A845: PRESTON | C845: 5 | D845: 6 | E845: =C845*6+D845 -> 36 | G845: 6 | H845: 7 | I845: =G845*6+H845 -> 43 | K845: 15 | L845: 13 | M845: =K845*6+L845 -> 103 | O845: 21 | P845: 17 | Q845: =O845*6+P845 -> 143 | S845: PRESTON
A846: FRANKSTON | C846: 1 | D846: 5 | E846: =C846*6+D846 -> 11 | G846: 7 | H846: 10 | I846: =G846*6+H846 -> 52 | K846: 10 | L846: 12 | M846: =K846*6+L846 -> 72 | O846: 15 | P846: 20 | Q846: =O846*6+P846 -> 110 | S846: OAKLEY
A847: BEST PLAYERS
A848: PRESTON | D848: MARKS | G848: MARTIN | J848: COOPER | M848: CANN | O848: BOLGER | R848: O'KEEFE
A849: FRANKSTON | D849: WALTON | G849: LYNN | J849: GEDDES | M849: HOUSDEN | O849: SAMPSON
A850: GOALKICKERS
A851: PRESTON | D851: BATT 4 | F851: COOPER 3 | I851: MARKS 3 | K851: VANN 3 | M851: DURWOOD 2 | P851: JESSOP 2 | R851: P MARSHALL | V851: CANN | X851: O'KEEFE | Z851: CROOKE
A852: FRANKSTON | D852: SERAFINI 5 | G852: DANKS 3 | I852: RASMUSSEN 3 | L852: ORCHARD 2 | O852: JONES | Q852: WALTON
A854: FINALS
A855: 1ST SEMI | E855: 2ND SEPTEMBER | J855: WEATHER | M855: NORTH WIND
D856: 1ST QTR | H856: 2ND QTR | L856: 3RD QTR | P856: FINAL
A857: PORT MELBOURNE | C857: 3 | D857: 5 | E857: =C857*6+D857 -> 23 | G857: 4 | H857: 13 | I857: =G857*6+H857 -> 37 | K857: 8 | L857: 15 | M857: =K857*6+L857 -> 63 | O857: 14 | P857: 17 | Q857: =O857*6+P857 -> 101 | S857: JUNCTION OVAL
A858: PRAHRAN | C858: 0 | D858: 4 | E858: =C858*6+D858 -> 4 | G858: 1 | H858: 6 | I858: =G858*6+H858 -> 12 | K858: 11 | L858: 8 | M858: =K858*6+L858 -> 74 | O858: 13 | P858: 11 | Q858: =O858*6+P858 -> 89 | S858: GROOM
A859: BEST PLAYERS
A860: PORT MELBOURNE | D860: AANENSEN | G860: DERMOTT | J860: CARTER | M860: SWAN | O860: SINCLAIR | R860: HARLAND
A861: PRAHRAN | D861: WISE | G861: THORNTON | J861: ROD KELLY | M861: PREEN | O861: ZEUNART | R861: THURGOOD
A862: GOALKICKERS
A863: PORT MELBOURNE | D863: McKENNA 4 | G863: COOK 2 | I863: HARLAND 2 | L863: STIBBARD 2 | O863: K GOSS | Q863: SWAN | R863: P GOSS | T863: SINCLAIR
A864: PRAHRAN | D864: DICKSON 3 | G864: SMITH 3 | I864: WISE 3 | K864: SOULOS | M864: CHAPMAN | O864: PEPE | Q864: ZEUNART
A866: 2ND SEMI | E866: 9TH SEPTEMBER | J866: WEATHER | N866: NORTH WEST WIND
A867: COBURG | C867: 1 | D867: 4 | E867: =C867*6+D867 -> 10 | G867: 5 | H867: 8 | I867: =G867*6+H867 -> 38 | K867: 11 | L867: 12 | M867: =K867*6+L867 -> 78 | O867: 16 | P867: 21 | Q867: =O867*6+P867 -> 117 | S867: JUNCTION OVAL
A868: GEELONG WEST | C868: 3 | D868: 3 | E868: =C868*6+D868 -> 21 | G868: 7 | H868: 7 | I868: =G868*6+H868 -> 49 | K868: 10 | L868: 10 | M868: =K868*6+L868 -> 70 | O868: 14 | P868: 12 | Q868: =O868*6+P868 -> 96 | S868: STABB
A869: BEST PLAYERS
A870: COBURG | D870: BEATTIE | G870: COLLINS | J870: HARBINSON | M870: DOHNT | O870: DOUGLAS | R870: MILROY
A871: GEELONG WEST | D871: GIBSON | G871: RADOJEVIC | J871: ARKLAY | M871: S WELLS | O871: YATES | R871: GILMORE
A872: GOALKICKERS
A873: COBURG | D873: COLLINS 4 | F873: BEATTIE 3 | I873: CLEARY 2 | L873: FISHER 2 | N873: HALSALL | P873: DOHNT | R873: SMITH | T873: HERBERT | W873: HALBERT
A874: GEELONG WEST | D874: RADOJEVIC 6 | G874: S WELLS 2 | J874: G WELLS 2 | M874: BROWNE 2 | P874: STENNETT | R874: WOOLFE
A876: PRELIMINARY FINAL | F876: 16TH SEPTEMBER | K876: WEATHER
A877: GEELONG WEST | C877: 3 | D877: 0 | E877: =C877*6+D877 -> 18 | G877: 9 | H877: 3 | I877: =G877*6+H877 -> 57 | K877: 11 | L877: 4 | M877: =K877*6+L877 -> 70 | O877: 16 | P877: 11 | Q877: =O877*6+P877 -> 107 | S877: JUNCTION OVAL
A878: PORT MELBOURNE | C878: 4 | D878: 2 | E878: =C878*6+D878 -> 26 | G878: 5 | H878: 4 | I878: =G878*6+H878 -> 34 | K878: 9 | L878: 10 | M878: =K878*6+L878 -> 64 | O878: 11 | P878: 11 | Q878: =O878*6+P878 -> 77 | S878: GROOM
A879: BEST PLAYERS
A880: GEELONG WEST | D880: DURRAN | G880: ARKLAY | J880: SMITH | M880: DEEATH | O880: GILMORE | R880: RADOJEVIC
A881: PORT MELBOURNE | D881: STIBBARD | G881: DERMOTT | J881: HAENAN | M881: PYE | O881: K GOSS | R881: DAVIES
A882: GOALKICKERS
A883: GEELONG WEST | D883: RADOJEVIC 6 | G883: GILMORE 3 | J883: EDDY 3 | L883: STENNETT 2 | O883: DEEATH | Q883: LUNN
A884: PORT MELBOURNE | D884: McKENNA 5 | G884: STIBBARD 2 | J884: DAVIES | L884: PYE | M884: EVANS | O884: JEFFRIES
A886: GRAND FINAL | F886: 23RD SEPTEMBER | K886: WEATHER
A887: COBURG | C887: 1 | D887: 6 | E887: =C887*6+D887 -> 12 | G887: 5 | H887: 8 | I887: =G887*6+H887 -> 38 | K887: 13 | L887: 13 | M887: =K887*6+L887 -> 91 | O887: 16 | P887: 15 | Q887: =O887*6+P887 -> 111 | S887: JUNCTION OVAL
A888: GEELONG WEST | C888: 5 | D888: 8 | E888: =C888*6+D888 -> 38 | G888: 8 | H888: 9 | I888: =G888*6+H888 -> 57 | K888: 11 | L888: 11 | M888: =K888*6+L888 -> 77 | O888: 14 | P888: 19 | Q888: =O888*6+P888 -> 103 | S888: STABB
A889: BEST PLAYERS
A890: COBURG | D890: DOHNT | G890: HERBERT | J890: MILROY | M890: HALBERT | O890: HARTIGAN | R890: PITT
A891: GEELONG WEST | D891: BROWNE | G891: LUNN | J891: SMITH | M891: GIBSON | O891: ARKLAY | R891: GILMORE
A892: GOALKICKERS
A893: COBURG | D893: SMITH 3 | F893: HALBERT 3 | I893: HALSALL 2 | L893: DOHNT 2 | N893: CLEARY 2 | Q893: BEATTIE | S893: HARTIGAN | V893: MILROY | X893: FISHER
A894: GEELONG WEST | D894: RADOJEVIC 4 | G894: GILMORE 3 | J894: S WELLS 2 | M894: LUNN 2 | O894: SCARLETT | Q894: ARKLAY | S894: GILMORE
A896: REPRESENTATIVE MATCH | G896: 17TH JUNE | K896: WEATHER
C897: 1ST QTR | H897: 2ND QTR | L897: 3RD QTR | P897: FINAL
A898: V.F.A. | C898: 8 | D898: 11 | E898: =C898*6+D898 -> 59 | G898: 11 | H898: 15 | I898: =G898*6+H898 -> 81 | K898: 20 | L898: 22 | M898: =K898*6+L898 -> 142 | O898: 28 | P898: 26 | Q898: =O898*6+P898 -> 194 | S898: TOORAK PARK
A899: QUEENSLAND | C899: 0 | D899: 0 | E899: =C899*6+D899 -> 0 | G899: 4 | H899: 4 | I899: =G899*6+H899 -> 28 | K899: 5 | L899: 6 | M899: =K899*6+L899 -> 36 | O899: 5 | P899: 8 | Q899: =O899*6+P899 -> 38 | S899: GROOM/STABB
A900: BEST PLAYERS
A901: V.F.A. | D901: PEPE | G901: BURT | I901: JONES | K901: WEST | M901: RUSSELL | P901: K SMITH
A902: QUEENSLAND | D902: Z TAYLOR | G902: IVES | I902: P TAYLOR | K902: STACKPOOLE
A903: GOALKICKERS
A904: V.F.A. | D904: COOK 7 | F904: K SMITH 7 | I904: JONES 3 | K904: BEATTIE 2 | M904: BOLGER 2 | O904: BURT 2 | Q904: WOOLFE | S904: GILMORE | W904: AUSTIN | X904: WEST | Z904: RYAN
A905: QUEENSLAND | D905: NEWTON 2 | G905: FROST | I905: BLACKFORD | L905: WELLER
A907: ESCORT CUP MATCHES
E908: 25TH APRIL
A909: PORT ADELAIDE | C909: 4 | D909: 3 | E909: =C909*6+D909 -> 27 | G909: 6 | H909: 4 | I909: =G909*6+H909 -> 40 | K909: 6 | L909: 5 | M909: =K909*6+L909 -> 41 | O909: 13 | P909: 11 | Q909: =O909*6+P909 -> 89 | S909: PRESTON
A910: PRAHRAN | C910: 1 | D910: 2 | E910: =C910*6+D910 -> 8 | G910: 3 | H910: 6 | I910: =G910*6+H910 -> 24 | K910: 5 | L910: 8 | M910: =K910*6+L910 -> 38 | O910: 6 | P910: 8 | Q910: =O910*6+P910 -> 44
A911: BEST PLAYERS
A912: PORT ADELAIDE | D912: CLIFFORD | G912: M WILLIAMS | J912: PHILLIPS | M912: FALETIC | P912: HOFNER | R912: CURTIS
A913: PRAHRAN | D913: LOWE | G913: DICKSON | J913: TAYLOR | M913: ZEUNART | P913: McGUINNESS
A914: GOALKICKERS
A915: PORT ADELAIDE | D915: EVANS 3 | F915: TREDREA 2 | I915: M WILLIAMS 2 | L915: A WILLIAMS 2 | O915: CLIFFORD 2 | R915: BOYD | T915: HOFNER
A916: PRAHRAN | D916: LOWE | F916: PREEN | H916: DICKSON | J916: ANDERSON | M916: THORNTON | P916: TAYLOR
A918: CENTRAL DISTRICTS | C918: 6 | D918: 4 | E918: =C918*6+D918 -> 40 | G918: 6 | H918: 7 | I918: =G918*6+H918 -> 43 | K918: 10 | L918: 12 | M918: =K918*6+L918 -> 72 | O918: 16 | P918: 12 | Q918: =O918*6+P918 -> 108 | S918: PRESTON
A919: PRESTON | C919: 2 | D919: 0 | E919: =C919*6+D919 -> 12 | G919: 6 | H919: 3 | I919: =G919*6+H919 -> 39 | K919: 6 | L919: 8 | M919: =K919*6+L919 -> 44 | O919: 11 | P919: 10 | Q919: =O919*6+P919 -> 76
A920: BEST PLAYERS
A921: CENTRAL DISTRICTS | D921: BLETHYN | G921: STEVENSON | J921: DUCKWORTH | M921: VIVIAN | O921: JONES | Q921: HARRINGTON
A922: PRESTON | D922: P MARSHALL | G922: BOLGER | J922: JESSOP | M922: PLAIN | O922: LORENZINI | R922: KING
A923: GOALKICKERS
A924: CENTRAL DISTRICTS | D924: BLETHYN 3 | F924: JONES 3 | H924: McKAY 2 | J924: WILSON 2 | M924: GRAHAM | O924: STEVENSON | R924: DUCKWORTH | V924: VAN DOMMEIE | X924: KREIG | Z924: MULZE
A925: PRESTON | D925: LORENZINI 3 | G925: VANN 2 | I925: DURWOOD | L925: BATT | N925: MARKS | P925: JESSOP | R925: NICLASSEN | U925: PLAIN
A927: LIGHTNING PREMIERSHIP
A928: ROUND 1
A929: WAVERLEY | C929: 3 | D929: 9 | E929: =C929*6+D929 -> 27 | H929: BOX HILL | K929: 6 | L929: 5 | M929: =K929*6+L929 -> 41
A930: WERRIBEE | C930: 2 | D930: 4 | E930: =C930*6+D930 -> 16 | H930: SUNSHINE | K930: 3 | L930: 1 | M930: =K930*6+L930 -> 19
A932: ROUND 2
A933: NORTHCOTE | C933: 9 | D933: 2 | E933: =C933*6+D933 -> 56 | H933: YARRAVILLE | K933: 7 | L933: 6 | M933: =K933*6+L933 -> 48
A934: WAVERLEY | C934: 2 | D934: 2 | E934: =C934*6+D934 -> 14 | H934: BOX HILL | K934: 4 | L934: 2 | M934: =K934*6+L934 -> 26
A936: ROUND 3
A937: PRESTON | C937: 5 | D937: 7 | E937: =C937*6+D937 -> 37 | H937: SANDRINGHAM | K937: 5 | L937: 4 | M937: =K937*6+L937 -> 34
A938: BRUNSWICK | C938: 5 | D938: 3 | E938: =C938*6+D938 -> 33 | H938: FRANKSTON | K938: 3 | L938: 7 | M938: =K938*6+L938 -> 25
A940: ROUND 4
A941: YARRAVILLE | C941: 6 | D941: 8 | E941: =C941*6+D941 -> 44 | H941: SANDRINGHAM | K941: 5 | L941: 6 | M941: =K941*6+L941 -> 36
A942: NORTHCOTE | C942: 1 | D942: 5 | E942: =C942*6+D942 -> 11 | H942: PRESTON | K942: 4 | L942: 3 | M942: =K942*6+L942 -> 27
A944: SEMI-FINALS
A945: YARRAVILLE | C945: 6 | D945: 6 | E945: =C945*6+D945 -> 42 | H945: SANDRINGHAM | K945: 7 | L945: 4 | M945: =K945*6+L945 -> 46
A946: CAULFIELD | C946: 4 | D946: 4 | E946: =C946*6+D946 -> 28 | H946: DANDENONG | K946: 4 | L946: 5 | M946: =K946*6+L946 -> 29
A948: FINAL
A949: SANDRINGHAM | C949: 3 | D949: 5 | E949: =C949*6+D949 -> 23
A950: YARRAVILLE | C950: 2 | D950: 5 | E950: =C950*6+D950 -> 17