A1: Victorian Football Association
A2: Season 1980 - Division Two
A3: © Copyright Wal Williams | F3: First created: 28 March 2016
A4: Contact: joywalwi at gmail dot com | F4: Last updated: 28 March 2016 | W4: VFA Results and tables - Link to the main index page
A5: You are free to copy this document in whole or part provided that proper acknowledgement is given to the author. All rights reserved.
A7: 1980 | C7: V.F.A. SEASON 2ND DIVISION
A8: ROUND 1 | E8: 6TH APRIL | J8: WEATHER | S8: PLAYED AT
D9: 1ST QTR | H9: 2ND QTR | L9: 3RD QTR | P9: FINAL | S9: NORTHCOTE
A10: NORTHCOTE | C10: 0 | D10: 0 | E10: =C10*6+D10 -> 0 | G10: 0 | H10: 0 | I10: =G10*6+H10 -> 0 | K10: 0 | L10: 0 | M10: =K10*6+L10 -> 0 | O10: 19 | P10: 22 | Q10: =O10*6+P10 -> 136 | S10: UMPIRE | X10: LADDER | AB10: ROUND | AD10: 1
A11: WERRIBEE | C11: 0 | D11: 0 | E11: =C11*6+D11 -> 0 | G11: 0 | H11: 0 | I11: =G11*6+H11 -> 0 | K11: 0 | L11: 0 | M11: =K11*6+L11 -> 0 | O11: 15 | P11: 18 | Q11: =O11*6+P11 -> 108
A12: BEST PLAYERS | W12: TEAM | X12: W | Y12: L | Z12: D | AA12: FOR | AB12: AGST | AC12: % | AD12: PTS
A13: NORTHCOTE
A14: WERRIBEE | W14: OAKLEIGH | X14: 1 | Y14: 0 | Z14: 0 | AA14: 185 | AB14: 103 | AC14: =(AA14*100)/AB14 -> 179.61165048543688 | AD14: =(X14*4)+(Z14*2) -> 4
A15: GOALKICKERS | W15: WAVERLEY | X15: 1 | Y15: 0 | Z15: 0 | AA15: 112 | AB15: 72 | AC15: =(AA15*100)/AB15 -> 155.55555555555554 | AD15: =(X15*4)+(Z15*2) -> 4
A16: NORTHCOTE | W16: MORDIALLOC | X16: 1 | Y16: 0 | Z16: 0 | AA16: 111 | AB16: 84 | AC16: =(AA16*100)/AB16 -> 132.14285714285714 | AD16: =(X16*4)+(Z16*2) -> 4
A17: WERRIBEE | W17: YARRAVILLE | X17: 1 | Y17: 0 | Z17: 0 | AA17: 101 | AB17: 78 | AC17: =(AA17*100)/AB17 -> 129.48717948717947 | AD17: =(X17*4)+(Z17*2) -> 4
A19: OAKLEIGH | C19: 0 | D19: 0 | E19: =C19*6+D19 -> 0 | G19: 0 | H19: 0 | I19: =G19*6+H19 -> 0 | K19: 0 | L19: 0 | M19: =K19*6+L19 -> 0 | O19: 27 | P19: 23 | Q19: =O19*6+P19 -> 185 | S19: BOX HILL | W19: NORTHCOTE | X19: 1 | Y19: 0 | Z19: 0 | AA19: 136 | AB19: 108 | AC19: =(AA19*100)/AB19 -> 125.92592592592592 | AD19: =(X19*4)+(Z19*2) -> 4
A20: BOX HILL | C20: 0 | D20: 0 | E20: =C20*6+D20 -> 0 | G20: 0 | H20: 0 | I20: =G20*6+H20 -> 0 | K20: 0 | L20: 0 | M20: =K20*6+L20 -> 0 | O20: 15 | P20: 13 | Q20: =O20*6+P20 -> 103 | W20: WERRIBEE | X20: 0 | Y20: 1 | Z20: 0 | AA20: 108 | AB20: 136 | AC20: =(AA20*100)/AB20 -> 79.411764705882348 | AD20: =(X20*4)+(Z20*2) -> 0
A21: BEST PLAYERS | W21: WILLIAMSTOWN | X21: 0 | Y21: 1 | Z21: 0 | AA21: 78 | AB21: 101 | AC21: =(AA21*100)/AB21 -> 77.227722772277232 | AD21: =(X21*4)+(Z21*2) -> 0
A22: OAKLEIGH | W22: BRUNSWICK | X22: 0 | Y22: 1 | Z22: 0 | AA22: 84 | AB22: 111 | AC22: =(AA22*100)/AB22 -> 75.675675675675677 | AD22: =(X22*4)+(Z22*2) -> 0
A23: BOX HILL | W23: SUNSHINE | X23: 0 | Y23: 1 | Z23: 0 | AA23: 72 | AB23: 112 | AC23: =(AA23*100)/AB23 -> 64.285714285714292 | AD23: =(X23*4)+(Z23*2) -> 0
A24: GOALKICKERS | W24: BOX HILL | X24: 0 | Y24: 1 | Z24: 0 | AA24: 103 | AB24: 185 | AC24: =(AA24*100)/AB24 -> 55.675675675675677 | AD24: =(X24*4)+(Z24*2) -> 0
A25: OAKLEIGH
A26: BOX HILL
A28: YARRAVILLE | C28: 0 | D28: 0 | E28: =C28*6+D28 -> 0 | G28: 0 | H28: 0 | I28: =G28*6+H28 -> 0 | K28: 0 | L28: 0 | M28: =K28*6+L28 -> 0 | O28: 15 | P28: 11 | Q28: =O28*6+P28 -> 101 | S28: WILLIAMSTOWN
A29: WILLIAMSTOWN | C29: 0 | D29: 0 | E29: =C29*6+D29 -> 0 | G29: 0 | H29: 0 | I29: =G29*6+H29 -> 0 | K29: 0 | L29: 0 | M29: =K29*6+L29 -> 0 | O29: 11 | P29: 12 | Q29: =O29*6+P29 -> 78
A30: BEST PLAYERS
A31: YARRAVILLE
A32: WILLIAMSTOWN
A33: GOALKICKERS
A34: YARRAVILLE
A35: WILLIAMSTOWN
A37: WAVERLEY | C37: 0 | D37: 0 | E37: =C37*6+D37 -> 0 | G37: 0 | H37: 0 | I37: =G37*6+H37 -> 0 | K37: 0 | L37: 0 | M37: =K37*6+L37 -> 0 | O37: 17 | P37: 10 | Q37: =O37*6+P37 -> 112 | S37: SUNSHINE
A38: SUNSHINE | C38: 0 | D38: 0 | E38: =C38*6+D38 -> 0 | G38: 0 | H38: 0 | I38: =G38*6+H38 -> 0 | K38: 0 | L38: 0 | M38: =K38*6+L38 -> 0 | O38: 10 | P38: 12 | Q38: =O38*6+P38 -> 72
A39: BEST PLAYERS
A40: WAVERLEY
A41: SUNSHINE
A42: GOALKICKERS
A43: WAVERLEY
A44: SUNSHINE
A46: MORDIALLOC | C46: 0 | D46: 0 | E46: =C46*6+D46 -> 0 | G46: 0 | H46: 0 | I46: =G46*6+H46 -> 0 | K46: 0 | L46: 0 | M46: =K46*6+L46 -> 0 | O46: 17 | P46: 9 | Q46: =O46*6+P46 -> 111 | S46: MORDIALLOC
A47: BRUNSWICK | C47: 0 | D47: 0 | E47: =C47*6+D47 -> 0 | G47: 0 | H47: 0 | I47: =G47*6+H47 -> 0 | K47: 0 | L47: 0 | M47: =K47*6+L47 -> 0 | O47: 11 | P47: 18 | Q47: =O47*6+P47 -> 84
A48: BEST PLAYERS
A49: MORDIALLOC
A50: BRUNSWICK
A51: GOALKICKERS
A52: MORDIALLOC
A53: BRUNSWICK
A55: ROUND 2 | E55: 13TH APRIL | J55: WEATHER | S55: PLAYED AT
D56: 1ST QTR | H56: 2ND QTR | L56: 3RD QTR | P56: FINAL | S56: OAKLEIGH
A57: OAKLEIGH | C57: 0 | D57: 0 | E57: =C57*6+D57 -> 0 | G57: 0 | H57: 0 | I57: =G57*6+H57 -> 0 | K57: 0 | L57: 0 | M57: =K57*6+L57 -> 0 | O57: 20 | P57: 12 | Q57: =O57*6+P57 -> 132 | S57: UMPIRE | X57: LADDER | AB57: ROUND | AD57: 2
A58: NORTHCOTE | C58: 0 | D58: 0 | E58: =C58*6+D58 -> 0 | G58: 0 | H58: 0 | I58: =G58*6+H58 -> 0 | K58: 0 | L58: 0 | M58: =K58*6+L58 -> 0 | O58: 17 | P58: 20 | Q58: =O58*6+P58 -> 122
A59: BEST PLAYERS | W59: TEAM | X59: W | Y59: L | Z59: D | AA59: FOR | AB59: AGST | AC59: % | AD59: PTS
A60: OAKLEIGH
A61: NORTHCOTE | W61: YARRAVILLE | X61: 2 | Y61: 0 | Z61: 0 | AA61: 283 | AB61: 191 | AC61: =(AA61*100)/AB61 -> 148.16753926701571 | AD61: =(X61*4)+(Z61*2) -> 8
A62: GOALKICKERS | W62: OAKLEIGH | X62: 2 | Y62: 0 | Z62: 0 | AA62: 317 | AB62: 225 | AC62: =(AA62*100)/AB62 -> 140.88888888888889 | AD62: =(X62*4)+(Z62*2) -> 8
A63: OAKLEIGH | W63: WAVERLEY | X63: 2 | Y63: 0 | Z63: 0 | AA63: 280 | AB63: 218 | AC63: =(AA63*100)/AB63 -> 128.44036697247705 | AD63: =(X63*4)+(Z63*2) -> 8
A64: NORTHCOTE | W64: BRUNSWICK | X64: 1 | Y64: 1 | Z64: 0 | AA64: 268 | AB64: 223 | AC64: =(AA64*100)/AB64 -> 120.17937219730942 | AD64: =(X64*4)+(Z64*2) -> 4
A66: YARRAVILLE | C66: 0 | D66: 0 | E66: =C66*6+D66 -> 0 | G66: 0 | H66: 0 | I66: =G66*6+H66 -> 0 | K66: 0 | L66: 0 | M66: =K66*6+L66 -> 0 | O66: 26 | P66: 26 | Q66: =O66*6+P66 -> 182 | S66: YARRAVILLE | W66: NORTHCOTE | X66: 1 | Y66: 1 | Z66: 0 | AA66: 258 | AB66: 240 | AC66: =(AA66*100)/AB66 -> 107.5 | AD66: =(X66*4)+(Z66*2) -> 4
A67: BOX HILL | C67: 0 | D67: 0 | E67: =C67*6+D67 -> 0 | G67: 0 | H67: 0 | I67: =G67*6+H67 -> 0 | K67: 0 | L67: 0 | M67: =K67*6+L67 -> 0 | O67: 17 | P67: 11 | Q67: =O67*6+P67 -> 113 | W67: MORDIALLOC | X67: 1 | Y67: 1 | Z67: 0 | AA67: 219 | AB67: 205 | AC67: =(AA67*100)/AB67 -> 106.82926829268293 | AD67: =(X67*4)+(Z67*2) -> 4
A68: BEST PLAYERS | W68: WERRIBEE | X68: 1 | Y68: 1 | Z68: 0 | AA68: 229 | AB68: 244 | AC68: =(AA68*100)/AB68 -> 93.852459016393439 | AD68: =(X68*4)+(Z68*2) -> 4
A69: YARRAVILLE | W69: WILLIAMSTOWN | X69: 0 | Y69: 2 | Z69: 0 | AA69: 224 | AB69: 269 | AC69: =(AA69*100)/AB69 -> 83.271375464684013 | AD69: =(X69*4)+(Z69*2) -> 0
A70: BOX HILL | W70: SUNSHINE | X70: 0 | Y70: 2 | Z70: 0 | AA70: 184 | AB70: 296 | AC70: =(AA70*100)/AB70 -> 62.162162162162161 | AD70: =(X70*4)+(Z70*2) -> 0
A71: GOALKICKERS | W71: BOX HILL | X71: 0 | Y71: 2 | Z71: 0 | AA71: 215 | AB71: 367 | AC71: =(AA71*100)/AB71 -> 58.583106267029976 | AD71: =(X71*4)+(Z71*2) -> 0
A72: YARRAVILLE
A73: BOX HILL
A75: WAVERLEY | C75: 0 | D75: 0 | E75: =C75*6+D75 -> 0 | G75: 0 | H75: 0 | I75: =G75*6+H75 -> 0 | K75: 0 | L75: 0 | M75: =K75*6+L75 -> 0 | O75: 25 | P75: 18 | Q75: =O75*6+P75 -> 168 | S75: WAVERLEY
A76: WILLIAMSTOWN | C76: 0 | D76: 0 | E76: =C76*6+D76 -> 0 | G76: 0 | H76: 0 | I76: =G76*6+H76 -> 0 | K76: 0 | L76: 0 | M76: =K76*6+L76 -> 0 | O76: 23 | P76: 8 | Q76: =O76*6+P76 -> 146
A77: BEST PLAYERS
A78: WAVERLEY
A79: WILLIAMSTOWN
A80: GOALKICKERS
A81: WAVERLEY
A82: WILLIAMSTOWN
A84: BRUNSWICK | C84: 0 | D84: 0 | E84: =C84*6+D84 -> 0 | G84: 0 | H84: 0 | I84: =G84*6+H84 -> 0 | K84: 0 | L84: 0 | M84: =K84*6+L84 -> 0 | O84: 28 | P84: 16 | Q84: =O84*6+P84 -> 184 | S84: BRUNSWICK
A85: SUNSHINE | C85: 0 | D85: 0 | E85: =C85*6+D85 -> 0 | G85: 0 | H85: 0 | I85: =G85*6+H85 -> 0 | K85: 0 | L85: 0 | M85: =K85*6+L85 -> 0 | O85: 17 | P85: 10 | Q85: =O85*6+P85 -> 112
A86: BEST PLAYERS
A87: BRUNSWICK
A88: SUNSHINE
A89: GOALKICKERS
A90: BRUNSWICK
A91: SUNSHINE
A93: WERRIBEE | C93: 0 | D93: 0 | E93: =C93*6+D93 -> 0 | G93: 0 | H93: 0 | I93: =G93*6+H93 -> 0 | K93: 0 | L93: 0 | M93: =K93*6+L93 -> 0 | O93: 17 | P93: 19 | Q93: =O93*6+P93 -> 121 | S93: WERRIBEE
A94: MORDIALLOC | C94: 0 | D94: 0 | E94: =C94*6+D94 -> 0 | G94: 0 | H94: 0 | I94: =G94*6+H94 -> 0 | K94: 0 | L94: 0 | M94: =K94*6+L94 -> 0 | O94: 16 | P94: 12 | Q94: =O94*6+P94 -> 108
A95: BEST PLAYERS
A96: WERRIBEE
A97: MORDIALLOC
A98: GOALKICKERS
A99: WERRIBEE
A100: MORDIALLOC
A102: ROUND 3 | E102: 20TH APRIL | J102: WEATHER | S102: PLAYED AT
D103: 1ST QTR | H103: 2ND QTR | L103: 3RD QTR | P103: FINAL | S103: WILLIAMSTOWN
A104: WILLIAMSTOWN | C104: 6 | D104: 6 | E104: =C104*6+D104 -> 42 | G104: 10 | H104: 9 | I104: =G104*6+H104 -> 69 | K104: 12 | L104: 12 | M104: =K104*6+L104 -> 84 | O104: 18 | P104: 14 | Q104: =O104*6+P104 -> 122 | S104: UMPIRE | X104: LADDER | AB104: ROUND | AD104: 3
A105: BRUNSWICK | C105: 3 | D105: 6 | E105: =C105*6+D105 -> 24 | G105: 5 | H105: 14 | I105: =G105*6+H105 -> 44 | K105: 10 | L105: 19 | M105: =K105*6+L105 -> 79 | O105: 15 | P105: 22 | Q105: =O105*6+P105 -> 112 | S105: TORNEY
A106: BEST PLAYERS | W106: TEAM | X106: W | Y106: L | Z106: D | AA106: FOR | AB106: AGST | AC106: % | AD106: PTS
A107: WILLIAMSTOWN | C107: M TAYLOR | F107: COURTOT | I107: CUTAJAR | L107: CHAPMAN | O107: KENNEDY | R107: KERR
A108: BRUNSWICK | C108: KIMPTON | F108: SMITH | I108: TOY | L108: LAWRENCE | W108: YARRAVILLE | X108: 3 | Y108: 0 | Z108: 0 | AA108: 462 | AB108: 296 | AC108: =(AA108*100)/AB108 -> 156.08108108108109 | AD108: =(X108*4)+(Z108*2) -> 12
A109: GOALKICKERS | Q109: BEBEND | W109: OAKLEIGH | X109: 3 | Y109: 0 | Z109: 0 | AA109: 507 | AB109: 341 | AC109: =(AA109*100)/AB109 -> 148.68035190615836 | AD109: =(X109*4)+(Z109*2) -> 12
A110: WILLIAMSTOWN | C110: CHAPMAN 5 | F110: GOETZ 3 | H110: JOHN 3 | J110: L TAYLOR 2 | M110: M TAYLOR 2 | P110: S PHILPOTT | S110: COATES | W110: WAVERLEY | X110: 3 | Y110: 0 | Z110: 0 | AA110: 444 | AB110: 345 | AC110: =(AA110*100)/AB110 -> 128.69565217391303 | AD110: =(X110*4)+(Z110*2) -> 12
A111: BRUNSWICK | C111: TOY 4 | E111: GUNSTON 2 | H111: CROTTY 2 | J111: BYE 2 | L111: MARANTELLI | O111: NOLAN | Q111: LAWRENCE | S111: WHILEY | U111: WEST | W111: BRUNSWICK | X111: 1 | Y111: 2 | Z111: 0 | AA111: 380 | AB111: 345 | AC111: =(AA111*100)/AB111 -> 110.14492753623189 | AD111: =(X111*4)+(Z111*2) -> 4
A113: YARRAVILLE | C113: 6 | D113: 6 | E113: =C113*6+D113 -> 42 | G113: 13 | H113: 4 | I113: =G113*6+H113 -> 82 | K113: 19 | L113: 17 | M113: =K113*6+L113 -> 131 | O113: 26 | P113: 23 | Q113: =O113*6+P113 -> 179 | S113: NORTHCOTE | W113: MORDIALLOC | X113: 1 | Y113: 2 | Z113: 0 | AA113: 358 | AB113: 385 | AC113: =(AA113*100)/AB113 -> 92.987012987012989 | AD113: =(X113*4)+(Z113*2) -> 4
A114: NORTHCOTE | C114: 2 | D114: 1 | E114: =C114*6+D114 -> 13 | G114: 8 | H114: 2 | I114: =G114*6+H114 -> 50 | K114: 13 | L114: 5 | M114: =K114*6+L114 -> 83 | O114: 16 | P114: 9 | Q114: =O114*6+P114 -> 105 | S114: GROOM | W114: WILLIAMSTOWN | X114: 1 | Y114: 2 | Z114: 0 | AA114: 346 | AB114: 381 | AC114: =(AA114*100)/AB114 -> 90.813648293963254 | AD114: =(X114*4)+(Z114*2) -> 4
A115: BEST PLAYERS | W115: NORTHCOTE | X115: 1 | Y115: 2 | Z115: 0 | AA115: 363 | AB115: 419 | AC115: =(AA115*100)/AB115 -> 86.634844868735087 | AD115: =(X115*4)+(Z115*2) -> 4
A116: YARRAVILLE | C116: LAXTON | F116: DI NATALE | I116: SAIT | K116: P RYAN | N116: J RYAN | Q116: HARLEY | W116: SUNSHINE | X116: 1 | Y116: 2 | Z116: 0 | AA116: 364 | AB116: 435 | AC116: =(AA116*100)/AB116 -> 83.678160919540232 | AD116: =(X116*4)+(Z116*2) -> 4
A117: NORTHCOTE | C117: ARNOTT | F117: McKENNA | I117: BRAIN | K117: SHEPHERD | N117: EDWARDS | Q117: MEGNA | W117: WERRIBEE | X117: 1 | Y117: 2 | Z117: 0 | AA117: 345 | AB117: 434 | AC117: =(AA117*100)/AB117 -> 79.493087557603687 | AD117: =(X117*4)+(Z117*2) -> 4
A118: GOALKICKERS | N118: POWER | P118: HARLEY | R118: McFETRIDGE | W118: BOX HILL | X118: 0 | Y118: 3 | Z118: 0 | AA118: 343 | AB118: 531 | AC118: =(AA118*100)/AB118 -> 64.595103578154422 | AD118: =(X118*4)+(Z118*2) -> 0
A119: YARRAVILLE | C119: SAIT 4 | E119: PERUSSICH 4 | H119: M FOTHERINGHAM 4 | L119: DI NATALE 4 | O119: P RYAN 3 | Q119: BREHENEY 2 | S119: DUDDERIDGE 2
A120: NORTHCOTE | C120: McKENNA 7 | F120: EDWARDS 2 | I120: G RYAN 2 | K120: M RYAN | M120: P RYAN | O120: MEGNA | Q120: TAIRI | S120: MITCHELL
A122: OAKLEIGH | C122: 10 | D122: 3 | E122: =C122*6+D122 -> 63 | G122: 16 | H122: 7 | I122: =G122*6+H122 -> 103 | K122: 23 | L122: 15 | M122: =K122*6+L122 -> 153 | O122: 28 | P122: 22 | Q122: =O122*6+P122 -> 190 | S122: OAKLEIGH
A123: WERRIBEE | C123: 7 | D123: 3 | E123: =C123*6+D123 -> 45 | G123: 9 | H123: 8 | I123: =G123*6+H123 -> 62 | K123: 14 | L123: 10 | M123: =K123*6+L123 -> 94 | O123: 17 | P123: 14 | Q123: =O123*6+P123 -> 116 | S123: GRIFFITH
A124: BEST PLAYERS
A125: OAKLEIGH | C125: W MILLER | F125: D MILLER | I125: EDWARDS | L125: WOOD | O125: NEARY | R125: DUNN
A126: WERRIBEE | C126: BURNS | F126: JACK | I126: GUDDE | L126: LYONS
A127: GOALKICKERS
A128: OAKLEIGH | C128: NEARY 7 | E128: WOOD 6 | G128: D MILLER 6 | J128: THOMAS 3 | M128: McDONALD 2 | P128: PAGNOCCOLO 2 | S128: MATTHEY | V128: LEMMONS
A129: WERRIBEE | C129: BURNS 6 | F129: GUDDE 4 | I129: LANCASTER 2 | L129: MARTIN 2 | N129: DEMPSTER | Q129: PRICE | S129: BENT
A131: WAVERLEY | C131: 3 | D131: 4 | E131: =C131*6+D131 -> 22 | G131: 12 | H131: 8 | I131: =G131*6+H131 -> 80 | K131: 17 | L131: 10 | M131: =K131*6+L131 -> 112 | O131: 25 | P131: 14 | Q131: =O131*6+P131 -> 164 | S131: BOX HILL
A132: BOX HILL | C132: 4 | D132: 3 | E132: =C132*6+D132 -> 27 | G132: 7 | H132: 5 | I132: =G132*6+H132 -> 47 | K132: 16 | L132: 8 | M132: =K132*6+L132 -> 104 | O132: 20 | P132: 8 | Q132: =O132*6+P132 -> 128 | S132: FITZPATRICK
A133: BEST PLAYERS
A134: WAVERLEY | C134: SULLIVAN | F134: CLARKE | I134: P ANGELIS | L134: HOLDSWORTH | O134: BARNES | R134: WILLIAMS
A135: BOX HILL | C135: CONNOLLY | F135: CRUSE | I135: DICKENSON | L135: SCRIMSHAW | O135: WITHERS | R135: LYNN
A136: GOALKICKERS
A137: WAVERLEY | C137: P ANGELIS 9 | F137: BARNES 5 | I137: COSTELLO 4 | K137: J ANGELIS 2 | N137: McLURE 2 | P137: SULLIVAN | S137: KERR | U137: HOLDSWORTH
A138: BOX HILL | C138: SCRIMSHAW 7 | F138: GOODEN 4 | I138: WITHERS 4 | L138: CLARKE | N138: CONNOLLY | P138: DICKENSON | S138: GAUL | U138: MARSHALL
A140: SUNSHINE | C140: 5 | D140: 5 | E140: =C140*6+D140 -> 35 | G140: 14 | H140: 5 | I140: =G140*6+H140 -> 89 | K140: 17 | L140: 10 | M140: =K140*6+L140 -> 112 | O140: 28 | P140: 12 | Q140: =O140*6+P140 -> 180 | S140: SUNSHINE
A141: MORDIALLOC | C141: 5 | D141: 3 | E141: =C141*6+D141 -> 33 | G141: 7 | H141: 8 | I141: =G141*6+H141 -> 50 | K141: 15 | L141: 10 | M141: =K141*6+L141 -> 100 | O141: 21 | P141: 13 | Q141: =O141*6+P141 -> 139 | S141: WILSON
A142: BEST PLAYERS
A143: SUNSHINE | C143: PEREIRA | F143: JONES | I143: T BRETT | L143: FOLEY
A144: MORDIALLOC | C144: WARREN | F144: MARGHERITI | I144: MOORE | L144: NEVILLE | O144: GUY | Q144: PEARCE
A145: GOALKICKERS
A146: SUNSHINE | C146: JAMES 4 | E146: CRAWFORD 4 | H146: SIMMONS 4 | K146: BROWN 3 | M146: FOLEY 3 | O146: PEARCE 3 | Q146: JONES 2 | S146: CAMERON 2 | V146: PEREIRA | X146: T BRETT | Z146: R McLEAN
A147: MORDIALLOC | C147: NEVILLE 6 | F147: PARKER 3 | H147: GUY 2 | J147: ROGERSON 2 | M147: PAUL BARDOEL 2 | Q147: MOORE 2 | S147: MARGHERITI | V147: DINGLE | X147: DEATON | Z147: McILWRAITH
A149: ROUND 4 | E149: 27TH APRIL | J149: WEATHER | S149: PLAYED AT
D150: 1ST QTR | H150: 2ND QTR | L150: 3RD QTR | P150: FINAL | S150: YARRAVILLE
A151: YARRAVILLE | C151: 6 | D151: 3 | E151: =C151*6+D151 -> 39 | G151: 12 | H151: 6 | I151: =G151*6+H151 -> 78 | K151: 24 | L151: 11 | M151: =K151*6+L151 -> 155 | O151: 28 | P151: 15 | Q151: =O151*6+P151 -> 183 | S151: UMPIRE | X151: LADDER | AB151: ROUND | AD151: 4
A152: OAKLEIGH | C152: 0 | D152: 5 | E152: =C152*6+D152 -> 5 | G152: 5 | H152: 6 | I152: =G152*6+H152 -> 36 | K152: 9 | L152: 7 | M152: =K152*6+L152 -> 61 | O152: 17 | P152: 11 | Q152: =O152*6+P152 -> 113 | S152: MATTHEWS
A153: BEST PLAYERS | W153: TEAM | X153: W | Y153: L | Z153: D | AA153: FOR | AB153: AGST | AC153: % | AD153: PTS
A154: YARRAVILLE | C154: MCFETRIDGE | F154: KEOGH | I154: J RYAN | L154: DI NATALE | O154: B SMITH
A155: OAKLEIGH | C155: ALLISEY | F155: SPLATT | I155: WALSH | L155: D MILLER | O155: PAGNOCCOLO | W155: YARRAVILLE | X155: 4 | Y155: 0 | Z155: 0 | AA155: 645 | AB155: 409 | AC155: =(AA155*100)/AB155 -> 157.70171149144255 | AD155: =(X155*4)+(Z155*2) -> 16
A156: GOALKICKERS | G156: WARD | I156: LAXTON | K156: NUSPEN | M156: DUDDERIDGE | P156: CADD | R156: HARLEY | W156: WAVERLEY | X156: 4 | Y156: 0 | Z156: 0 | AA156: 551 | AB156: 450 | AC156: =(AA156*100)/AB156 -> 122.44444444444444 | AD156: =(X156*4)+(Z156*2) -> 16
A157: YARRAVILLE | C157: SAVILLE 5 | F157: McFETRIDGE 4 | I157: PERUSSICH 3 | K157: SAIT 3 | M157: POWER 3 | O157: DI NATALE 2 | R157: P FOTHERINGHAM 2 | W157: OAKLEIGH | X157: 3 | Y157: 1 | Z157: 0 | AA157: 620 | AB157: 524 | AC157: =(AA157*100)/AB157 -> 118.32061068702291 | AD157: =(X157*4)+(Z157*2) -> 12
A158: OAKLEIGH | C158: WOOD 3 | E158: HEVERIN 3 | G158: MATTHEY 3 | J158: HEVERIN | L158: EDWARDS | N158: HARTLEY | P158: WALSH | R158: D MILLER | T158: LEMMONS | W158: BRUNSWICK | X158: 2 | Y158: 2 | Z158: 0 | AA158: 529 | AB158: 417 | AC158: =(AA158*100)/AB158 -> 126.85851318944844 | AD158: =(X158*4)+(Z158*2) -> 8
N159: DOYLE | P159: PAGNOCCOLO
A160: BRUNSWICK | C160: 2 | D160: 8 | E160: =C160*6+D160 -> 20 | G160: 7 | H160: 14 | I160: =G160*6+H160 -> 56 | K160: 13 | L160: 19 | M160: =K160*6+L160 -> 97 | O160: 21 | P160: 23 | Q160: =O160*6+P160 -> 149 | S160: BRUNSWICK | W160: WILLIAMSTOWN | X160: 2 | Y160: 2 | Z160: 0 | AA160: 492 | AB160: 493 | AC160: =(AA160*100)/AB160 -> 99.797160243407703 | AD160: =(X160*4)+(Z160*2) -> 8
A161: BOX HILL | C161: 2 | D161: 3 | E161: =C161*6+D161 -> 15 | G161: 4 | H161: 7 | I161: =G161*6+H161 -> 31 | K161: 7 | L161: 11 | M161: =K161*6+L161 -> 53 | O161: 9 | P161: 18 | Q161: =O161*6+P161 -> 72 | S161: MORGAN | W161: SUNSHINE | X161: 2 | Y161: 2 | Z161: 0 | AA161: 492 | AB161: 542 | AC161: =(AA161*100)/AB161 -> 90.774907749077485 | AD161: =(X161*4)+(Z161*2) -> 8
A162: BEST PLAYERS | W162: NORTHCOTE | X162: 1 | Y162: 3 | Z162: 0 | AA162: 468 | AB162: 526 | AC162: =(AA162*100)/AB162 -> 88.973384030418245 | AD162: =(X162*4)+(Z162*2) -> 4
A163: BRUNSWICK | C163: GUNSTON | F163: CROTTY | I163: TOY | L163: KIMPSTON | O163: WHILEY | R163: MARANTELLI | W163: MORDIALLOC | X163: 1 | Y163: 3 | Z163: 0 | AA163: 470 | AB163: 531 | AC163: =(AA163*100)/AB163 -> 88.512241054613938 | AD163: =(X163*4)+(Z163*2) -> 4
A164: BOX HILL | C164: FLANAGAN | F164: TAYLOR | I164: SAUNDERS | L164: DICKENSON | O164: HALL | R164: HOOGSTRA | W164: WERRIBEE | X164: 1 | Y164: 3 | Z164: 0 | AA164: 452 | AB164: 562 | AC164: =(AA164*100)/AB164 -> 80.42704626334519 | AD164: =(X164*4)+(Z164*2) -> 4
A165: GOALKICKERS | W165: BOX HILL | X165: 0 | Y165: 4 | Z165: 0 | AA165: 415 | AB165: 680 | AC165: =(AA165*100)/AB165 -> 61.029411764705884 | AD165: =(X165*4)+(Z165*2) -> 0
A166: BRUNSWICK | C166: GUNSTON 9 | F166: MARANTELLI 3 | I166: CROTTY 3 | K166: WEST 2 | M166: BYE 2 | O166: LAWRENCE | R166: WALKER
A167: BOX HILL | C167: McLERIE 3 | F167: RICH 2 | H167: RALPH | J167: WITHERS | M167: GAUL | O167: MARSHALL
A169: WAVERLEY | C169: 4 | D169: 12 | E169: =C169*6+D169 -> 36 | G169: 6 | H169: 19 | I169: =G169*6+H169 -> 55 | K169: 11 | L169: 22 | M169: =K169*6+L169 -> 88 | O169: 14 | P169: 23 | Q169: =O169*6+P169 -> 107 | S169: WAVERLEY
A170: NORTHCOTE | C170: 3 | D170: 2 | E170: =C170*6+D170 -> 20 | G170: 7 | H170: 8 | I170: =G170*6+H170 -> 50 | K170: 11 | L170: 9 | M170: =K170*6+L170 -> 75 | O170: 15 | P170: 15 | Q170: =O170*6+P170 -> 105 | S170: CASEY
A171: BEST PLAYERS
A172: WAVERLEY | C172: MORRIS | F172: COSTELLO | I172: WILLIAMS | L172: SULLIVAN | O172: W McDONALD | R172: AUSTIN
A173: NORTHCOTE | C173: P RYAN | F173: BRAIN | I173: MEGNA | L173: M RYAN | O173: PHILLIPE | R173: COURTS
A174: GOALKICKERS
A175: WAVERLEY | C175: P ANGELIS 5 | F175: McLURE 3 | H175: COSTELLO 2 | K175: J ANGELIS | N175: KERR | P175: SULLIVAN | R175: WHITE
A176: NORTHCOTE | C176: McKENNA 5 | F176: P RYAN 4 | H176: G RYAN 2 | J176: PHILLIPE 2 | L176: M RYAN | N176: THORNELOE
A178: WILLIAMSTOWN | C178: 1 | D178: 4 | E178: =C178*6+D178 -> 10 | G178: 6 | H178: 11 | I178: =G178*6+H178 -> 47 | K178: 12 | L178: 12 | M178: =K178*6+L178 -> 84 | O178: 21 | P178: 20 | Q178: =O178*6+P178 -> 146 | S178: MORDIALLOC
A179: MORDIALLOC | C179: 7 | D179: 3 | E179: =C179*6+D179 -> 45 | G179: 12 | H179: 3 | I179: =G179*6+H179 -> 75 | K179: 15 | L179: 9 | M179: =K179*6+L179 -> 99 | O179: 17 | P179: 10 | Q179: =O179*6+P179 -> 112 | S179: GRIFFITH
A180: BEST PLAYERS
A181: WILLIAMSTOWN | C181: COURTOT | F181: JOHN | I181: CUTAJAR | L181: KERR | O181: TWEEDLY | R181: GANNON
A182: MORDIALLOC | C182: GUY | F182: NEVILLE | I182: WARREN | L182: MAGUIRE | O182: PARKER | R182: EASTON
A183: GOALKICKERS
A184: WILLIAMSTOWN | C184: TWEEDLY 5 | F184: GOETZ 4 | H184: PHILPOTT 4 | K184: KERR 2 | M184: ENRIGHT 2 | O184: COATES | Q184: GANNON | S184: L TAYLOR | V184: CHAPMAN
A185: MORDIALLOC | C185: NEVILLE 8 | F185: W FELTHAM 3 | I185: DINGLE 2 | K185: ROGERSON 2 | N185: WALSH | P185: PARKER
A187: SUNSHINE | C187: 6 | D187: 1 | E187: =C187*6+D187 -> 37 | G187: 10 | H187: 11 | I187: =G187*6+H187 -> 71 | K187: 15 | L187: 12 | M187: =K187*6+L187 -> 102 | O187: 19 | P187: 14 | Q187: =O187*6+P187 -> 128 | S187: WERRIBEE
A188: WERRIBEE | C188: 3 | D188: 6 | E188: =C188*6+D188 -> 24 | G188: 5 | H188: 7 | I188: =G188*6+H188 -> 37 | K188: 12 | L188: 13 | M188: =K188*6+L188 -> 85 | O188: 15 | P188: 17 | Q188: =O188*6+P188 -> 107 | S188: GROOM
A189: BEST PLAYERS
A190: SUNSHINE | C190: MATHEWS | F190: BROWN | I190: CRAWFORD | L190: LEWIS | N190: ORMSTON
A191: WERRIBEE | C191: LEECE | F191: BREEN | I191: JACK | L191: HUGHES
A192: GOALKICKERS
A193: SUNSHINE | C193: BROWN 5 | F193: JAMES 4 | H193: SIMMONS 2 | K193: CAMERON 2 | N193: JONES 2 | P193: CRAWFORD 2 | S193: PEREIRA 2
A194: WERRIBEE | C194: LEECE 9 | F194: BURNS 3 | I194: WILLIAMS | L194: LYONS | N194: JACK
A196: ROUND 5 | E196: 4TH MAY | J196: WEATHER | S196: PLAYED AT
D197: 1ST QTR | H197: 2ND QTR | L197: 3RD QTR | P197: FINAL | S197: OAKLEIGH
A198: WAVERLEY | C198: 8 | D198: 7 | E198: =C198*6+D198 -> 55 | G198: 11 | H198: 10 | I198: =G198*6+H198 -> 76 | K198: 17 | L198: 18 | M198: =K198*6+L198 -> 120 | O198: 24 | P198: 24 | Q198: =O198*6+P198 -> 168 | S198: UMPIRE | X198: LADDER | AB198: ROUND | AD198: 5
A199: OAKLEIGH | C199: 3 | D199: 2 | E199: =C199*6+D199 -> 20 | G199: 8 | H199: 10 | I199: =G199*6+H199 -> 58 | K199: 15 | L199: 12 | M199: =K199*6+L199 -> 102 | O199: 20 | P199: 17 | Q199: =O199*6+P199 -> 137 | S199: STABB
A200: BEST PLAYERS | W200: TEAM | X200: W | Y200: L | Z200: D | AA200: FOR | AB200: AGST | AC200: % | AD200: PTS
A201: WAVERLEY | C201: WILLIAMS | F201: AUSTIN | I201: SULLIVAN | L201: P ANGELIS | O201: COSTELLO | R201: LOVELL
A202: OAKLEIGH | C202: LEISHMAN | F202: THOMAS | I202: TAYLOR | L202: EDWARDS | O202: PAGNOCCOLO | R202: HEVERIN | W202: YARRAVILLE | X202: 5 | Y202: 0 | Z202: 0 | AA202: 799 | AB202: 511 | AC202: =(AA202*100)/AB202 -> 156.36007827788649 | AD202: =(X202*4)+(Z202*2) -> 20
A203: GOALKICKERS | M203: J ANGELIS | P203: HOLDSWORTH | W203: WAVERLEY | X203: 5 | Y203: 0 | Z203: 0 | AA203: 719 | AB203: 587 | AC203: =(AA203*100)/AB203 -> 122.48722316865417 | AD203: =(X203*4)+(Z203*2) -> 20
A204: WAVERLEY | C204: P ANGELIS 5 | F204: COSTELLO 5 | I204: KAYE 4 | K204: HENWOOD 3 | N204: SULLIVAN 2 | Q204: McLURE 2 | S204: BARNES | W204: BRUNSWICK | X204: 3 | Y204: 2 | Z204: 0 | AA204: 707 | AB204: 556 | AC204: =(AA204*100)/AB204 -> 127.15827338129496 | AD204: =(X204*4)+(Z204*2) -> 12
A205: OAKLEIGH | C205: THOMAS 6 | F205: WOOD 4 | H205: LEISHMAN 3 | K205: NEARY 2 | M205: PAGNOCCOLO 2 | P205: HEVERIN | R205: TAYLOR | T205: McDONALD | W205: OAKLEIGH | X205: 3 | Y205: 2 | Z205: 0 | AA205: 757 | AB205: 692 | AC205: =(AA205*100)/AB205 -> 109.39306358381504 | AD205: =(X205*4)+(Z205*2) -> 12
A207: BRUNSWICK | C207: 5 | D207: 5 | E207: =C207*6+D207 -> 35 | G207: 10 | H207: 6 | I207: =G207*6+H207 -> 66 | K207: 17 | L207: 12 | M207: =K207*6+L207 -> 114 | O207: 27 | P207: 16 | Q207: =O207*6+P207 -> 178 | S207: NORTHCOTE | W207: WILLIAMSTOWN | X207: 3 | Y207: 2 | Z207: 0 | AA207: 650 | AB207: 601 | AC207: =(AA207*100)/AB207 -> 108.153078202995 | AD207: =(X207*4)+(Z207*2) -> 12
A208: NORTHCOTE | C208: 3 | D208: 4 | E208: =C208*6+D208 -> 22 | G208: 8 | H208: 10 | I208: =G208*6+H208 -> 58 | K208: 15 | L208: 16 | M208: =K208*6+L208 -> 106 | O208: 20 | P208: 19 | Q208: =O208*6+P208 -> 139 | S208: GRIFFITHS | W208: MORDIALLOC | X208: 2 | Y208: 3 | Z208: 0 | AA208: 654 | AB208: 676 | AC208: =(AA208*100)/AB208 -> 96.745562130177518 | AD208: =(X208*4)+(Z208*2) -> 8
A209: BEST PLAYERS | W209: SUNSHINE | X209: 2 | Y209: 3 | Z209: 0 | AA209: 600 | AB209: 700 | AC209: =(AA209*100)/AB209 -> 85.714285714285708 | AD209: =(X209*4)+(Z209*2) -> 8
A210: BRUNSWICK | C210: HUGGARD | F210: LAWRENCE | I210: MARANTELLI | L210: NOLAN | O210: R SMITH | R210: CROTTY | W210: NORTHCOTE | X210: 1 | Y210: 4 | Z210: 0 | AA210: 607 | AB210: 704 | AC210: =(AA210*100)/AB210 -> 86.221590909090907 | AD210: =(X210*4)+(Z210*2) -> 4
A211: NORTHCOTE | C211: P RYAN | F211: JURGENSTEIN | I211: MORLEY | L211: TAIRI | O211: McKENNA | W211: WERRIBEE | X211: 1 | Y211: 4 | Z211: 0 | AA211: 554 | AB211: 716 | AC211: =(AA211*100)/AB211 -> 77.374301675977648 | AD211: =(X211*4)+(Z211*2) -> 4
A212: GOALKICKERS | W212: BOX HILL | X212: 0 | Y212: 5 | Z212: 0 | AA212: 540 | AB212: 854 | AC212: =(AA212*100)/AB212 -> 63.231850117096016 | AD212: =(X212*4)+(Z212*2) -> 0
A213: BRUNSWICK | C213: BYE 6 | E213: TOY 5 | G213: MARANTELLI 4 | J213: GUNSTON 4 | M213: WEST 4 | O213: LAWRENCE 2 | R213: CROTTY | T213: NOLAN
A214: NORTHCOTE | C214: McKENNA 6 | F214: JURGENSTEIN 4 | I214: P RYAN 3 | K214: DILORIO 3 | M214: MEGNA 2 | O214: McINTYRE | R214: MORLEY
A216: MORDIALLOC | C216: 8 | D216: 4 | E216: =C216*6+D216 -> 52 | G216: 14 | H216: 9 | I216: =G216*6+H216 -> 93 | K216: 19 | L216: 14 | M216: =K216*6+L216 -> 128 | O216: 26 | P216: 18 | Q216: =O216*6+P216 -> 174 | S216: BOX HILL
A217: BOX HILL | C217: 4 | D217: 1 | E217: =C217*6+D217 -> 25 | G217: 9 | H217: 4 | I217: =G217*6+H217 -> 58 | K217: 13 | L217: 6 | M217: =K217*6+L217 -> 84 | O217: 19 | P217: 11 | Q217: =O217*6+P217 -> 125 | S217: MATHEWS
A218: BEST PLAYERS
A219: MORDIALLOC | C219: DEATON | F219: ROGERSON | I219: PARKER | L219: NEVILLE | O219: WALSH | R219: GUY
A220: BOX HILL | C220: DICKENSON | F220: HOOGSTRA | I220: WITHERS | L220: LAWTHER | O220: HARPER | R220: SCRIMSHAW
A221: GOALKICKERS
A222: MORDIALLOC | C222: NEVILLE 11 | F222: WALSH 4 | H222: PAUL BARDOEL 3 | K222: GUY 2 | M222: ROGERSON 2 | P222: DEATON 2 | R222: MAGUIRE | U222: DINGLE
A223: BOX HILL | C223: SCRIMSHAW 6 | F223: WITHERS 4 | I223: GOODEN 2 | K223: McLERIE 2 | N223: GAUL 2 | P223: LAWTHER | R223: DICKENSON | U223: HALE
A225: WILLIAMSTOWN | C225: 5 | D225: 4 | E225: =C225*6+D225 -> 34 | G225: 13 | H225: 8 | I225: =G225*6+H225 -> 86 | K225: 20 | L225: 14 | M225: =K225*6+L225 -> 134 | O225: 23 | P225: 20 | Q225: =O225*6+P225 -> 158 | S225: WILLIAMSTOWN
A226: SUNSHINE | C226: 2 | D226: 2 | E226: =C226*6+D226 -> 14 | G226: 5 | H226: 4 | I226: =G226*6+H226 -> 34 | K226: 12 | L226: 4 | M226: =K226*6+L226 -> 76 | O226: 17 | P226: 6 | Q226: =O226*6+P226 -> 108 | S226: MORGAN
A227: BEST PLAYERS
A228: WILLIAMSTOWN | C228: CUTAJAR | F228: COURTOT | I228: KERR | L228: GOETZ | O228: KENNEDY | R228: TWEEDLY
A229: SUNSHINE | C229: P BROWNE | F229: PIERCZAK | I229: LAVERDE | L229: PEARCE | O229: ORMSTON
A230: GOALKICKERS
A231: WILLIAMSTOWN | C231: ENRIGHT 6 | F231: JONES 3 | H231: TWEEDLY 3 | K231: KERR 2 | M231: CHAPMAN 2 | O231: GANNON 2 | R231: JOHN 2 | T231: R SMITH | W231: S PHILPOTT | X231: COURTOT
A232: SUNSHINE | C232: JAMES 5 | F232: R McLEAN 3 | I232: SIMMONS 3 | K232: CAMERON 2 | N232: JONES 2 | P232: P BROWNE | S232: WILLIAMS
A234: YARRAVILLE | C234: 6 | D234: 5 | E234: =C234*6+D234 -> 41 | G234: 9 | H234: 11 | I234: =G234*6+H234 -> 65 | K234: 15 | L234: 13 | M234: =K234*6+L234 -> 103 | O234: 21 | P234: 28 | Q234: =O234*6+P234 -> 154 | S234: WERRIBEE
A235: WERRIBEE | C235: 6 | D235: 1 | E235: =C235*6+D235 -> 37 | G235: 9 | H235: 6 | I235: =G235*6+H235 -> 60 | K235: 12 | L235: 14 | M235: =K235*6+L235 -> 86 | O235: 14 | P235: 18 | Q235: =O235*6+P235 -> 102 | S235: FITZPATRICK
A236: BEST PLAYERS
A237: YARRAVILLE | C237: LAXTON | F237: P RYAN | H237: M FOTHERINGHAM | L237: WARD | N237: POWER | P237: CADD
A238: WERRIBEE | C238: WILLIAMS | F238: BREEN | H238: MITCHELL | K238: YOUNG
A239: GOALKICKERS
A240: YARRAVILLE | C240: M FOTHERINGHAM 9 | G240: P RYAN 3 | J240: DI NATALE 2 | M240: PERUSSICH 2 | O240: WARD 2 | Q240: SAIT 2 | S240: RADZIMINSKI
A241: WERRIBEE | C241: WHITE 3 | E241: BREEN 3 | G241: MANNIX 2 | J241: HUGHES 2 | L241: WILLIAMS | N241: JACK | P241: LANCASTER | S241: GUDDE
A243: ROUND 6 | E243: 11TH MAY | J243: WEATHER | S243: PLAYED AT
D244: 1ST QTR | H244: 2ND QTR | L244: 3RD QTR | P244: FINAL | S244: WAVERLEY
A245: WAVERLEY | C245: 5 | D245: 4 | E245: =C245*6+D245 -> 34 | G245: 8 | H245: 8 | I245: =G245*6+H245 -> 56 | K245: 14 | L245: 12 | M245: =K245*6+L245 -> 96 | O245: 18 | P245: 12 | Q245: =O245*6+P245 -> 120 | S245: UMPIRE | X245: LADDER | AB245: ROUND | AD245: 6
A246: YARRAVILLE | C246: 4 | D246: 6 | E246: =C246*6+D246 -> 30 | G246: 10 | H246: 10 | I246: =G246*6+H246 -> 70 | K246: 12 | L246: 10 | M246: =K246*6+L246 -> 82 | O246: 17 | P246: 12 | Q246: =O246*6+P246 -> 114 | S246: TORNEY
A247: BEST PLAYERS | W247: TEAM | X247: W | Y247: L | Z247: D | AA247: FOR | AB247: AGST | AC247: % | AD247: PTS
A248: WAVERLEY | C248: COSTELLO | F248: WILLIAMS | I248: P ANGELIS | L248: SULLIVAN | O248: KINNABURGH | R248: AUSTIN
A249: YARRAVILLE | C249: SAVILLE | F249: SAIT | I249: PAGAN | L249: DI NATALE | O249: KEOGH | R249: LAXTON | W249: WAVERLEY | X249: 6 | Y249: 0 | Z249: 0 | AA249: 839 | AB249: 701 | AC249: =(AA249*100)/AB249 -> 119.68616262482168 | AD249: =(X249*4)+(Z249*2) -> 24
A250: GOALKICKERS | W250: YARRAVILLE | X250: 5 | Y250: 1 | Z250: 0 | AA250: 913 | AB250: 631 | AC250: =(AA250*100)/AB250 -> 144.69096671949288 | AD250: =(X250*4)+(Z250*2) -> 20
A251: WAVERLEY | C251: P ANGELIS 9 | F251: McLURE 4 | H251: COSTELLO 2 | K251: HOLDSWORTH | N251: KAYE | P251: SULLIVAN | W251: BRUNSWICK | X251: 4 | Y251: 2 | Z251: 0 | AA251: 818 | AB251: 637 | AC251: =(AA251*100)/AB251 -> 128.414442700157 | AD251: =(X251*4)+(Z251*2) -> 16
A252: YARRAVILLE | C252: M FOTHERINGHAM 4 | G252: SAIT 3 | I252: PAGAN 3 | K252: DUDDERIDGE 2 | N252: DI NATALE 2 | Q252: RYAN | S252: BUCKLEY | W252: WILLIAMSTOWN | X252: 4 | Y252: 2 | Z252: 0 | AA252: 834 | AB252: 684 | AC252: =(AA252*100)/AB252 -> 121.92982456140351 | AD252: =(X252*4)+(Z252*2) -> 16
M253: PERUSSICH
A254: MORDIALLOC | C254: 5 | D254: 5 | E254: =C254*6+D254 -> 35 | G254: 13 | H254: 8 | I254: =G254*6+H254 -> 86 | K254: 19 | L254: 12 | M254: =K254*6+L254 -> 126 | O254: 22 | P254: 15 | Q254: =O254*6+P254 -> 147 | S254: MORDIALLOC | W254: MORDIALLOC | X254: 3 | Y254: 3 | Z254: 0 | AA254: 801 | AB254: 767 | AC254: =(AA254*100)/AB254 -> 104.43285528031291 | AD254: =(X254*4)+(Z254*2) -> 12
A255: NORTHCOTE | C255: 5 | D255: 4 | E255: =C255*6+D255 -> 34 | G255: 7 | H255: 4 | I255: =G255*6+H255 -> 46 | K255: 9 | L255: 5 | M255: =K255*6+L255 -> 59 | O255: 14 | P255: 7 | Q255: =O255*6+P255 -> 91 | S255: MORGAN | W255: OAKLEIGH | X255: 3 | Y255: 3 | Z255: 0 | AA255: 838 | AB255: 803 | AC255: =(AA255*100)/AB255 -> 104.35865504358655 | AD255: =(X255*4)+(Z255*2) -> 12
A256: BEST PLAYERS | W256: SUNSHINE | X256: 3 | Y256: 3 | Z256: 0 | AA256: 770 | AB256: 769 | AC256: =(AA256*100)/AB256 -> 100.13003901170352 | AD256: =(X256*4)+(Z256*2) -> 12
A257: MORDIALLOC | C257: NEVILLE | F257: PARKER | I257: PETER BARDOEL | L257: R LAING | O257: DINGLE | R257: BATTY | W257: NORTHCOTE | X257: 1 | Y257: 5 | Z257: 0 | AA257: 698 | AB257: 851 | AC257: =(AA257*100)/AB257 -> 82.021151586368973 | AD257: =(X257*4)+(Z257*2) -> 4
A258: NORTHCOTE | C258: P RYAN | F258: MEGNA | I258: JURGENSTEIN | L258: McINTYRE | O258: McKENNA | W258: WERRIBEE | X258: 1 | Y258: 5 | Z258: 0 | AA258: 637 | AB258: 900 | AC258: =(AA258*100)/AB258 -> 70.777777777777771 | AD258: =(X258*4)+(Z258*2) -> 4
A259: GOALKICKERS | W259: BOX HILL | X259: 0 | Y259: 6 | Z259: 0 | AA259: 609 | AB259: 1024 | AC259: =(AA259*100)/AB259 -> 59.47265625 | AD259: =(X259*4)+(Z259*2) -> 0
A260: MORDIALLOC | C260: NEVILLE 14 | F260: DEATON 2 | I260: DINGLE 2 | K260: PARKER 2 | N260: R LAING | P260: EASTON
A261: NORTHCOTE | C261: McKENNA 7 | F261: JURGENSTEIN 2 | I261: M RYAN | K261: MEGNA | M261: P RYAN | O261: EWING | Q261: DILORIO
A263: BRUNSWICK | C263: 3 | D263: 4 | E263: =C263*6+D263 -> 22 | G263: 4 | H263: 6 | I263: =G263*6+H263 -> 30 | K263: 12 | L263: 12 | M263: =K263*6+L263 -> 84 | O263: 16 | P263: 15 | Q263: =O263*6+P263 -> 111 | S263: BRUNSWICK
A264: OAKLEIGH | C264: 0 | D264: 3 | E264: =C264*6+D264 -> 3 | G264: 4 | H264: 12 | I264: =G264*6+H264 -> 36 | K264: 7 | L264: 14 | M264: =K264*6+L264 -> 56 | O264: 11 | P264: 15 | Q264: =O264*6+P264 -> 81 | S264: WILSON
A265: BEST PLAYERS
A266: BRUNSWICK | C266: CROTTY | F266: NOLAN | I266: LAWRENCE | L266: LAKER | N266: KIMPTON
A267: OAKLEIGH | C267: KILLEAN | F267: HEVERIN | I267: HARTLEY | L267: WALSH | N267: TAYLOR | Q267: McDONALD
A268: GOALKICKERS
A269: BRUNSWICK | C269: GUNSTON 3 | F269: MARANTELLI 3 | I269: BYE 3 | K269: CLEARY 2 | N269: WEST 2 | P269: LAKER | R269: NOLAN | T269: TOY
A270: OAKLEIGH | C270: MOWATT 3 | F270: EDWARDS 2 | I270: McDONALD 2 | L270: NEARY 2 | N270: THOMAS | Q270: MATTHEY
A272: SUNSHINE | C272: 4 | D272: 3 | E272: =C272*6+D272 -> 27 | G272: 12 | H272: 14 | I272: =G272*6+H272 -> 86 | K272: 16 | L272: 20 | M272: =K272*6+L272 -> 116 | O272: 24 | P272: 26 | Q272: =O272*6+P272 -> 170 | S272: SUNSHINE
A273: BOX HILL | C273: 3 | D273: 6 | E273: =C273*6+D273 -> 24 | G273: 4 | H273: 6 | I273: =G273*6+H273 -> 30 | K273: 9 | L273: 8 | M273: =K273*6+L273 -> 62 | O273: 10 | P273: 9 | Q273: =O273*6+P273 -> 69 | S273: GRIFFITH
A274: BEST PLAYERS
A275: SUNSHINE | C275: SIMMONS | F275: JAMES | I275: PIERCZAK | L275: BROWN | O275: JONES
A276: BOX HILL | C276: HALE | F276: WITHERS | I276: CLARKE | L276: SAUNDERS | O276: CRUSE
A277: GOALKICKERS
A278: SUNSHINE | C278: JAMES 6 | E278: SIMMONS 5 | G278: R McLEAN 3 | J278: JONES 3 | L278: WRIGHT 3 | N278: A SCHROEDER 2 | Q278: LAVERDE | S278: PEARCE
A279: BOX HILL | C279: McLERIE 3 | F279: GOODEN 2 | I279: WITHERS | K279: HOOGSTRA | N279: LAWTHER | Q279: CRUSE | S279: DICKENSON
A281: WILLIAMSTOWN | C281: 7 | D281: 5 | E281: =C281*6+D281 -> 47 | G281: 11 | H281: 11 | I281: =G281*6+H281 -> 77 | K281: 22 | L281: 13 | M281: =K281*6+L281 -> 145 | O281: 28 | P281: 16 | Q281: =O281*6+P281 -> 184 | S281: WILLIAMSTOWN
A282: WERRIBEE | C282: 3 | D282: 6 | E282: =C282*6+D282 -> 24 | G282: 6 | H282: 8 | I282: =G282*6+H282 -> 44 | K282: 7 | L282: 9 | M282: =K282*6+L282 -> 51 | O282: 12 | P282: 11 | Q282: =O282*6+P282 -> 83 | S282: VERGONA
A283: BEST PLAYERS
A284: WILLIAMSTOWN | C284: JOHN | F284: CUTAJAR | I284: S PHILPOTT | L284: A PHILPOTT | O284: ENRIGHT | R284: R JONES
A285: WERRIBEE | C285: BREEN | F285: LYONS | I285: HUGHES | L285: LEECE | O285: LANCASTER
A286: GOALKICKERS
A287: WILLIAMSTOWN | C287: ENRIGHT 7 | F287: A PHILPOTT 3 | I287: M TAYLOR 3 | L287: TWEEDLY 2 | O287: GANNON 2 | R287: R SMITH 2 | T287: R JONES 2 | W287: S PHILPOTT 2 | X287: BEBEND 2 | Z287: JOHN 2 | AB287: KERR
A288: WERRIBEE | C288: LEECE 3 | F288: BREEN 3 | H288: LYONS 2 | J288: PRICE 2 | L288: HUGHES | N288: YOUNG
A290: ROUND 7 | E290: 18TH MAY | J290: WEATHER | S290: PLAYED AT
D291: 1ST QTR | H291: 2ND QTR | L291: 3RD QTR | P291: FINAL | S291: OAKLEIGH
A292: MORDIALLOC | C292: 6 | D292: 2 | E292: =C292*6+D292 -> 38 | G292: 8 | H292: 5 | I292: =G292*6+H292 -> 53 | K292: 15 | L292: 8 | M292: =K292*6+L292 -> 98 | O292: 18 | P292: 11 | Q292: =O292*6+P292 -> 119 | S292: UMPIRE | X292: LADDER | AB292: ROUND | AD292: 7
A293: OAKLEIGH | C293: 4 | D293: 4 | E293: =C293*6+D293 -> 28 | G293: 7 | H293: 9 | I293: =G293*6+H293 -> 51 | K293: 8 | L293: 12 | M293: =K293*6+L293 -> 60 | O293: 12 | P293: 17 | Q293: =O293*6+P293 -> 89 | S293: SUNSHINE
A294: BEST PLAYERS | W294: TEAM | X294: W | Y294: L | Z294: D | AA294: FOR | AB294: AGST | AC294: % | AD294: PTS
A295: MORDIALLOC | C295: BATTY | F295: GUY | I295: DEATON | L295: LANG | N295: PAUL BARDOEL | R295: WALSH
A296: OAKLEIGH | C296: KILLEAN | F296: LEISHMAN | I296: TAYLOR | L296: HEVERIN | W296: WAVERLEY | X296: 6 | Y296: 1 | Z296: 0 | AA296: 943 | AB296: 838 | AC296: =(AA296*100)/AB296 -> 112.52983293556086 | AD296: =(X296*4)+(Z296*2) -> 24
A297: GOALKICKERS | W297: YARRAVILLE | X297: 5 | Y297: 2 | Z297: 0 | AA297: 1041 | AB297: 782 | AC297: =(AA297*100)/AB297 -> 133.12020460358056 | AD297: =(X297*4)+(Z297*2) -> 20
A298: MORDIALLOC | C298: NEVILLE 6 | F298: DEATON 3 | I298: GUY 2 | K298: LANG 2 | M298: WALSH 2 | O298: PARKER | Q298: MOORE | S298: PETER BARDOEL | W298: BRUNSWICK | X298: 5 | Y298: 2 | Z298: 0 | AA298: 969 | AB298: 765 | AC298: =(AA298*100)/AB298 -> 126.66666666666667 | AD298: =(X298*4)+(Z298*2) -> 20
A299: OAKLEIGH | C299: WOOD 2 | E299: TAYLOR 2 | G299: ADAMS 2 | I299: HARTLEY | K299: MATTHEY | M299: WALSH | O299: DUNN | Q299: LEMMONS | S299: NEARY | W299: WILLIAMSTOWN | X299: 5 | Y299: 2 | Z299: 0 | AA299: 962 | AB299: 800 | AC299: =(AA299*100)/AB299 -> 120.25 | AD299: =(X299*4)+(Z299*2) -> 20
A301: SUNSHINE | C301: 7 | D301: 4 | E301: =C301*6+D301 -> 46 | G301: 10 | H301: 8 | I301: =G301*6+H301 -> 68 | K301: 16 | L301: 10 | M301: =K301*6+L301 -> 106 | O301: 18 | P301: 15 | Q301: =O301*6+P301 -> 123 | S301: NORTHCOTE | W301: MORDIALLOC | X301: 4 | Y301: 3 | Z301: 0 | AA301: 920 | AB301: 856 | AC301: =(AA301*100)/AB301 -> 107.4766355140187 | AD301: =(X301*4)+(Z301*2) -> 16
A302: NORTHCOTE | C302: 3 | D302: 1 | E302: =C302*6+D302 -> 19 | G302: 7 | H302: 8 | I302: =G302*6+H302 -> 50 | K302: 10 | L302: 14 | M302: =K302*6+L302 -> 74 | O302: 17 | P302: 16 | Q302: =O302*6+P302 -> 118 | S302: FITZPATRICK | W302: SUNSHINE | X302: 4 | Y302: 3 | Z302: 0 | AA302: 893 | AB302: 887 | AC302: =(AA302*100)/AB302 -> 100.67643742953777 | AD302: =(X302*4)+(Z302*2) -> 16
A303: BEST PLAYERS | W303: OAKLEIGH | X303: 3 | Y303: 4 | Z303: 0 | AA303: 927 | AB303: 922 | AC303: =(AA303*100)/AB303 -> 100.54229934924078 | AD303: =(X303*4)+(Z303*2) -> 12
A304: SUNSHINE | C304: JAMES | F304: SCHROEDER | I304: FOLEY | L304: STOKES | W304: WERRIBEE | X304: 2 | Y304: 5 | Z304: 0 | AA304: 774 | AB304: 1004 | AC304: =(AA304*100)/AB304 -> 77.091633466135463 | AD304: =(X304*4)+(Z304*2) -> 8
A305: NORTHCOTE | C305: ROULSTON | F305: JURGENSTEIN | I305: McKENNA | L305: DILORIO | O305: EDWARDS | R305: MEGNA | W305: NORTHCOTE | X305: 1 | Y305: 6 | Z305: 0 | AA305: 816 | AB305: 974 | AC305: =(AA305*100)/AB305 -> 83.778234086242293 | AD305: =(X305*4)+(Z305*2) -> 4
A306: GOALKICKERS | W306: BOX HILL | X306: 0 | Y306: 7 | Z306: 0 | AA306: 725 | AB306: 1152 | AC306: =(AA306*100)/AB306 -> 62.934027777777779 | AD306: =(X306*4)+(Z306*2) -> 0
A307: SUNSHINE | C307: JAMES 9 | F307: FOLEY 3 | H307: PEARCE 2 | J307: SIMMONS | L307: R McLEAN | O307: CRAWFORD | R307: LEWIS
A308: NORTHCOTE | C308: McKENNA 7 | F308: MEGNA 4 | I308: COURTS 2 | K308: JURGENSTEIN 2 | N308: ROULSTON | Q308: P RYAN
A310: WILLIAMSTOWN | C310: 3 | D310: 3 | E310: =C310*6+D310 -> 21 | G310: 9 | H310: 8 | I310: =G310*6+H310 -> 62 | K310: 15 | L310: 11 | M310: =K310*6+L310 -> 101 | O310: 19 | P310: 14 | Q310: =O310*6+P310 -> 128 | S310: BOX HILL
A311: BOX HILL | C311: 4 | D311: 4 | E311: =C311*6+D311 -> 28 | G311: 5 | H311: 9 | I311: =G311*6+H311 -> 39 | K311: 12 | L311: 11 | M311: =K311*6+L311 -> 83 | O311: 17 | P311: 14 | Q311: =O311*6+P311 -> 116 | S311: TORNEY
A312: BEST PLAYERS
A313: WILLIAMSTOWN | C313: GOETZ | F313: JONES | I313: BEBEND | L313: WALSH | O313: KENNEDY | R313: TWEEDLY
A314: BOX HILL | C314: CLARKE | F314: WITHERS | I314: MUIR | L314: LEAN | O314: RICH | R314: DICKENSON
A315: GOALKICKERS
A316: WILLIAMSTOWN | C316: TWEEDLY 5 | F316: ENRIGHT 5 | H316: A PHILPOTT 2 | K316: M TAYLOR 2 | N316: R SMITH 2 | Q316: BRISCOE | S316: BEBEND | U316: JONES
A317: BOX HILL | C317: LEAN 4 | E317: GOODEN 3 | G317: WITHERS 3 | I317: McLERIE 2 | K317: RICH | L317: CRUSE | N317: BICKLEY | P317: DICKENSON | R317: GAUL
A319: BRUNSWICK | C319: 7 | D319: 4 | E319: =C319*6+D319 -> 46 | G319: 15 | H319: 8 | I319: =G319*6+H319 -> 98 | K319: 20 | L319: 10 | M319: =K319*6+L319 -> 130 | O319: 23 | P319: 13 | Q319: =O319*6+P319 -> 151 | S319: YARRAVILLE
A320: YARRAVILLE | C320: 4 | D320: 3 | E320: =C320*6+D320 -> 27 | G320: 10 | H320: 4 | I320: =G320*6+H320 -> 64 | K320: 17 | L320: 6 | M320: =K320*6+L320 -> 108 | O320: 20 | P320: 8 | Q320: =O320*6+P320 -> 128 | S320: STABB
A321: BEST PLAYERS
A322: BRUNSWICK | C322: CLEARY | F322: SMITH | I322: LAWRENCE | L322: SAHLBERG | O322: WEST
A323: YARRAVILLE | C323: PERRUSSICH | F323: SAIT | I323: WARD | L323: LAXTON | O323: PAGAN | Q323: M FOTHERINGHAM
A324: GOALKICKERS
A325: BRUNSWICK | C325: CLEARY 7 | F325: BYE 5 | H325: SAHLBERG 5 | K325: GUNSTON 4 | M325: TOY 2
A326: YARRAVILLE | C326: M FOTHERINGHAM 9 | G326: PERUSSICH 4 | J326: HARLEY 2 | L326: SAIT 2 | N326: RADZIMINSKI | Q326: PAGAN | S326: P RYAN
A328: WERRIBEE | C328: 4 | D328: 1 | E328: =C328*6+D328 -> 25 | G328: 9 | H328: 4 | I328: =G328*6+H328 -> 58 | K328: 16 | L328: 7 | M328: =K328*6+L328 -> 103 | O328: 21 | P328: 11 | Q328: =O328*6+P328 -> 137 | S328: WERRIBEE
A329: WAVERLEY | C329: 3 | D329: 5 | E329: =C329*6+D329 -> 23 | G329: 7 | H329: 7 | I329: =G329*6+H329 -> 49 | K329: 9 | L329: 10 | M329: =K329*6+L329 -> 64 | O329: 15 | P329: 14 | Q329: =O329*6+P329 -> 104 | S329: MATHEWS
A330: BEST PLAYERS
A331: WERRIBEE | C331: LEECE | F331: LANCASTER | I331: BREEN | L331: LYONS | O331: WILLIAMS | R331: MITCHELL
A332: WAVERLEY | C332: LOVELL | F332: P ANGELIS | I332: KERR | L332: McLURE | O332: KINNABURGH | R332: SULLIVAN
A333: GOALKICKERS
A334: WERRIBEE | C334: LEECE 13 | F334: BREEN 2 | H334: WILLIAMS | J334: LANCASTER | M334: LYONS | O334: GUDDE | Q334: DAY | R334: SMITH
A335: WAVERLEY | C335: P ANGELIS 8 | F335: McLURE 3 | I335: COSTELLO 2 | L335: SULLIVAN 2
A337: ROUND 8 | E337: 25TH MAY | J337: WEATHER | S337: PLAYED AT
D338: 1ST QTR | H338: 2ND QTR | L338: 3RD QTR | P338: FINAL | S338: WILLIAMSTOWN
A339: WILLIAMSTOWN | C339: 6 | D339: 5 | E339: =C339*6+D339 -> 41 | G339: 12 | H339: 9 | I339: =G339*6+H339 -> 81 | K339: 16 | L339: 15 | M339: =K339*6+L339 -> 111 | O339: 22 | P339: 18 | Q339: =O339*6+P339 -> 150 | S339: UMPIRE | X339: LADDER | AB339: ROUND | AD339: 8
A340: NORTHCOTE | C340: 4 | D340: 4 | E340: =C340*6+D340 -> 28 | G340: 9 | H340: 8 | I340: =G340*6+H340 -> 62 | K340: 10 | L340: 11 | M340: =K340*6+L340 -> 71 | O340: 15 | P340: 13 | Q340: =O340*6+P340 -> 103 | S340: WILSON
A341: BEST PLAYERS | W341: TEAM | X341: W | Y341: L | Z341: D | AA341: FOR | AB341: AGST | AC341: % | AD341: PTS
A342: WILLIAMSTOWN | C342: BEBEND | F342: TWEEDLY | I342: ENRIGHT | L342: A PHILPOTT | O342: S PHILPOTT | R342: CUTAJAR
A343: NORTHCOTE | C343: JURGENSTEIN | F343: EDWARDS | I343: P RYAN | L343: McINTYRE | O343: DILORIO | R343: M RYAN | W343: YARRAVILLE | X343: 6 | Y343: 2 | Z343: 0 | AA343: 1155 | AB343: 876 | AC343: =(AA343*100)/AB343 -> 131.84931506849315 | AD343: =(X343*4)+(Z343*2) -> 24
A344: GOALKICKERS | W344: BRUNSWICK | X344: 6 | Y344: 2 | Z344: 0 | AA344: 1138 | AB344: 871 | AC344: =(AA344*100)/AB344 -> 130.65442020665901 | AD344: =(X344*4)+(Z344*2) -> 24
A345: WILLIAMSTOWN | C345: ENRIGHT 7 | F345: A PHILPOTT 4 | I345: M TAYLOR 3 | L345: COATES 3 | N345: DUNN 2 | P345: GANNON | R345: L TAYLOR | T345: JONES | W345: WILLIAMSTOWN | X345: 6 | Y345: 2 | Z345: 0 | AA345: 1112 | AB345: 903 | AC345: =(AA345*100)/AB345 -> 123.14507198228128 | AD345: =(X345*4)+(Z345*2) -> 24
A346: NORTHCOTE | C346: P RYAN 3 | F346: MCKENNA 2 | I346: THORNELOE 2 | L346: MITCHELL 2 | O346: JURGENSTEIN | R346: D SMITH | T346: EDWARDS | W346: WAVERLEY | X346: 6 | Y346: 2 | Z346: 0 | AA346: 1049 | AB346: 1007 | AC346: =(AA346*100)/AB346 -> 104.1708043694141 | AD346: =(X346*4)+(Z346*2) -> 24
M347: COURTS | P347: MASSOURAS
A348: WERRIBEE | C348: 8 | D348: 2 | E348: =C348*6+D348 -> 50 | G348: 16 | H348: 7 | I348: =G348*6+H348 -> 103 | K348: 22 | L348: 12 | M348: =K348*6+L348 -> 144 | O348: 28 | P348: 16 | Q348: =O348*6+P348 -> 184 | S348: BOX HILL | W348: MORDIALLOC | X348: 4 | Y348: 4 | Z348: 0 | AA348: 1014 | AB348: 970 | AC348: =(AA348*100)/AB348 -> 104.5360824742268 | AD348: =(X348*4)+(Z348*2) -> 16
A349: BOX HILL | C349: 3 | D349: 3 | E349: =C349*6+D349 -> 21 | G349: 8 | H349: 4 | I349: =G349*6+H349 -> 52 | K349: 16 | L349: 5 | M349: =K349*6+L349 -> 101 | O349: 19 | P349: 9 | Q349: =O349*6+P349 -> 123 | S349: OAKLEY | W349: OAKLEIGH | X349: 4 | Y349: 4 | Z349: 0 | AA349: 1045 | AB349: 1021 | AC349: =(AA349*100)/AB349 -> 102.35063663075417 | AD349: =(X349*4)+(Z349*2) -> 16
A350: BEST PLAYERS | W350: SUNSHINE | X350: 4 | Y350: 4 | Z350: 0 | AA350: 992 | AB350: 1005 | AC350: =(AA350*100)/AB350 -> 98.706467661691548 | AD350: =(X350*4)+(Z350*2) -> 16
A351: WERRIBEE | C351: MENADUE | F351: LANCASTER | I351: TAYLOR | L351: LYONS | O351: DAY | R351: GUDDE | W351: WERRIBEE | X351: 3 | Y351: 5 | Z351: 0 | AA351: 958 | AB351: 1127 | AC351: =(AA351*100)/AB351 -> 85.004436557231585 | AD351: =(X351*4)+(Z351*2) -> 12
A352: BOX HILL | C352: TAYLOR | F352: CLARKE | I352: GOODEN | L352: CRUSE | O352: DICKENSON | W352: NORTHCOTE | X352: 1 | Y352: 7 | Z352: 0 | AA352: 919 | AB352: 1124 | AC352: =(AA352*100)/AB352 -> 81.761565836298928 | AD352: =(X352*4)+(Z352*2) -> 4
A353: GOALKICKERS | M353: SMITH | O353: BOURKE | W353: BOX HILL | X353: 0 | Y353: 8 | Z353: 0 | AA353: 848 | AB353: 1336 | AC353: =(AA353*100)/AB353 -> 63.473053892215567 | AD353: =(X353*4)+(Z353*2) -> 0
A354: WERRIBEE | C354: GUDDE 5 | E354: DAY 5 | G354: TAYLOR 5 | I354: WILLIAMS 3 | L354: LYONS 3 | N354: MENADUE 3 | Q354: JACK | R354: LANCASTER
A355: BOX HILL | C355: LEAN 4 | E355: GOODEN 3 | G355: SCRIMSHAW 3 | J355: McLERIE 3 | M355: LAWTHER 2 | P355: GAUL | R355: WITHERS | T355: CRUSE
O356: DICKENSON
A357: OAKLEIGH | C357: 4 | D357: 4 | E357: =C357*6+D357 -> 28 | G357: 7 | H357: 5 | I357: =G357*6+H357 -> 47 | K357: 14 | L357: 7 | M357: =K357*6+L357 -> 91 | O357: 18 | P357: 10 | Q357: =O357*6+P357 -> 118 | S357: SUNSHINE
A358: SUNSHINE | C358: 2 | D358: 4 | E358: =C358*6+D358 -> 16 | G358: 9 | H358: 5 | I358: =G358*6+H358 -> 59 | K358: 12 | L358: 10 | M358: =K358*6+L358 -> 82 | O358: 14 | P358: 15 | Q358: =O358*6+P358 -> 99 | S358: TORNEY
A359: BEST PLAYERS
A360: OAKLEIGH | C360: SPLATT | F360: LEISHMAN | I360: WOOD | L360: HEVERIN | O360: ALLISEY | R360: NEARY
A361: SUNSHINE | C361: BRETT | F361: CRAWFORD | I361: JAMES | L361: A SCHROEDER
A362: GOALKICKERS
A363: OAKLEIGH | C363: NEARY 8 | F363: CURTAIN 4 | I363: LEMMONS 2 | L363: HEVERIN | N363: LEISHMAN | Q363: HARTLEY | S363: DUNN
A364: SUNSHINE | C364: JAMES 4 | F364: SIMMONS 4 | I364: PEARCE 2 | L364: A SCHROEDER 2 | O364: JONES | Q364: SHERIDAN
A366: YARRAVILLE | C366: 2 | D366: 8 | E366: =C366*6+D366 -> 20 | G366: 8 | H366: 12 | I366: =G366*6+H366 -> 60 | K366: 11 | L366: 13 | M366: =K366*6+L366 -> 79 | O366: 16 | P366: 18 | Q366: =O366*6+P366 -> 114 | S366: MORDIALLOC
A367: MORDIALLOC | C367: 1 | D367: 1 | E367: =C367*6+D367 -> 7 | G367: 8 | H367: 5 | I367: =G367*6+H367 -> 53 | K367: 11 | L367: 9 | M367: =K367*6+L367 -> 75 | O367: 14 | P367: 10 | Q367: =O367*6+P367 -> 94 | S367: GRIFFITH
A368: BEST PLAYERS
A369: YARRAVILLE | C369: PERUSSICH | F369: HARLEY | I369: RADZIMINSKI | L369: J RYAN | O369: COOK | R369: SAIT
A370: MORDIALLOC | C370: NEVILLE | F370: WARREN | I370: GUY | L370: PETER BARDOEL | O370: PARKER | R370: WALSH
A371: GOALKICKERS
A372: YARRAVILLE | C372: J RYAN 6 | F372: McFETRIDGE 3 | I372: PERUSSICH 2 | L372: PAGAN 2 | N372: SAIT | O372: CADD | Q372: LORD
A373: MORDIALLOC | C373: NEVILLE 9 | F373: GUY | H373: PETER BARDOEL | K373: PARKER | M373: WALSH | O373: EASTON
A375: BRUNSWICK | C375: 7 | D375: 6 | E375: =C375*6+D375 -> 48 | G375: 13 | H375: 10 | I375: =G375*6+H375 -> 88 | K375: 20 | L375: 14 | M375: =K375*6+L375 -> 134 | O375: 25 | P375: 19 | Q375: =O375*6+P375 -> 169 | S375: BRUNSWICK
A376: WAVERLEY | C376: 2 | D376: 6 | E376: =C376*6+D376 -> 18 | G376: 8 | H376: 9 | I376: =G376*6+H376 -> 57 | K376: 10 | L376: 13 | M376: =K376*6+L376 -> 73 | O376: 15 | P376: 16 | Q376: =O376*6+P376 -> 106 | S376: GROOM
A377: BEST PLAYERS
A378: BRUNSWICK | C378: LAWRENCE | F378: LEAHY | I378: DOLAN | L378: SMITH | N378: MARANTELLI | R378: LAKER
A379: WAVERLEY | C379: STYLES | F379: MORRIS | I379: SULLIVAN | L379: KINNABURGH | O379: P ANGELIS | R379: HARRINGTON
A380: GOALKICKERS
A381: BRUNSWICK | C381: GUNSTON 6 | F381: BYE 6 | H381: CLEARY 4 | J381: MARANTELLI 3 | M381: DOLAN 2 | O381: LAKER | Q381: WEST | S381: SAHLBERG | V381: BROWNE
A382: WAVERLEY | C382: P ANGELIS 6 | F382: SULLIVAN 2 | I382: KERR 2 | K382: McLURE | M382: HARRINGTON | P382: KAYE | R382: K McDONALD | U382: COSTELLO
A384: ROUND 9 | E384: 1ST JUNE | J384: WEATHER | S384: PLAYED AT
D385: 1ST QTR | H385: 2ND QTR | L385: 3RD QTR | P385: FINAL | S385: WERRIBEE
A386: WERRIBEE | C386: 2 | D386: 5 | E386: =C386*6+D386 -> 17 | G386: 4 | H386: 12 | I386: =G386*6+H386 -> 36 | K386: 8 | L386: 16 | M386: =K386*6+L386 -> 64 | O386: 15 | P386: 21 | Q386: =O386*6+P386 -> 111 | S386: UMPIRE | X386: LADDER | AB386: ROUND | AD386: 9
A387: BRUNSWICK | C387: 5 | D387: 5 | E387: =C387*6+D387 -> 35 | G387: 6 | H387: 8 | I387: =G387*6+H387 -> 44 | K387: 9 | L387: 11 | M387: =K387*6+L387 -> 65 | O387: 14 | P387: 12 | Q387: =O387*6+P387 -> 96 | S387: FITZPATRICK
A388: BEST PLAYERS | W388: TEAM | X388: W | Y388: L | Z388: D | AA388: FOR | AB388: AGST | AC388: % | AD388: PTS
A389: WERRIBEE | C389: LANCASTER | F389: GUDDE | I389: HUGHES | L389: LEECE | N389: MENADUE | Q389: DAY
A390: BRUNSWICK | C390: SAHLBERG | F390: LAWRENCE | I390: DOLAN | L390: LAKER | W390: YARRAVILLE | X390: 7 | Y390: 2 | Z390: 0 | AA390: 1267 | AB390: 953 | AC390: =(AA390*100)/AB390 -> 132.94858342077649 | AD390: =(X390*4)+(Z390*2) -> 28
A391: GOALKICKERS | W391: BRUNSWICK | X391: 6 | Y391: 3 | Z391: 0 | AA391: 1234 | AB391: 982 | AC391: =(AA391*100)/AB391 -> 125.66191446028513 | AD391: =(X391*4)+(Z391*2) -> 24
A392: WERRIBEE | C392: LEECE 8 | F392: BREEN 2 | I392: GUDDE 2 | K392: DAY 2 | M392: TAYLOR | W392: WILLIAMSTOWN | X392: 6 | Y392: 3 | Z392: 0 | AA392: 1202 | AB392: 1009 | AC392: =(AA392*100)/AB392 -> 119.12784935579782 | AD392: =(X392*4)+(Z392*2) -> 24
A393: BRUNSWICK | C393: BYE 3 | E393: MARANTELLI 2 | H393: SAHLBERG 2 | K393: CLEARY 2 | N393: BELL 2 | P393: LAKER | R393: KIMPTON | T393: CROTTY | W393: WAVERLEY | X393: 6 | Y393: 3 | Z393: 0 | AA393: 1153 | AB393: 1122 | AC393: =(AA393*100)/AB393 -> 102.76292335115865 | AD393: =(X393*4)+(Z393*2) -> 24
A395: NORTHCOTE | C395: 3 | D395: 3 | E395: =C395*6+D395 -> 21 | G395: 8 | H395: 5 | I395: =G395*6+H395 -> 53 | K395: 13 | L395: 10 | M395: =K395*6+L395 -> 88 | O395: 20 | P395: 13 | Q395: =O395*6+P395 -> 133 | S395: NORTHCOTE | W395: MORDIALLOC | X395: 5 | Y395: 4 | Z395: 0 | AA395: 1129 | AB395: 1074 | AC395: =(AA395*100)/AB395 -> 105.12104283054003 | AD395: =(X395*4)+(Z395*2) -> 20
A396: BOX HILL | C396: 5 | D396: 1 | E396: =C396*6+D396 -> 31 | G396: 8 | H396: 4 | I396: =G396*6+H396 -> 52 | K396: 13 | L396: 8 | M396: =K396*6+L396 -> 86 | O396: 15 | P396: 10 | Q396: =O396*6+P396 -> 100 | S396: VERGONA | W396: OAKLEIGH | X396: 5 | Y396: 4 | Z396: 0 | AA396: 1151 | AB396: 1111 | AC396: =(AA396*100)/AB396 -> 103.60036003600361 | AD396: =(X396*4)+(Z396*2) -> 20
A397: BEST PLAYERS | W397: SUNSHINE | X397: 4 | Y397: 5 | Z397: 0 | AA397: 1069 | AB397: 1117 | AC397: =(AA397*100)/AB397 -> 95.702775290957916 | AD397: =(X397*4)+(Z397*2) -> 16
A398: NORTHCOTE | C398: ROULSTON | F398: P RYAN | I398: M RYAN | L398: JURGENSTEIN | O398: TAIRI | R398: McINTYRE | W398: WERRIBEE | X398: 4 | Y398: 5 | Z398: 0 | AA398: 1069 | AB398: 1223 | AC398: =(AA398*100)/AB398 -> 87.408013082583807 | AD398: =(X398*4)+(Z398*2) -> 16
A399: BOX HILL | C399: SAUNDERS | F399: HOOGSTRA | I399: DICKENSON | L399: CONNOLLY | O399: WITHERS | R399: LAWTHER | W399: NORTHCOTE | X399: 2 | Y399: 7 | Z399: 0 | AA399: 1052 | AB399: 1224 | AC399: =(AA399*100)/AB399 -> 85.947712418300654 | AD399: =(X399*4)+(Z399*2) -> 8
A400: GOALKICKERS | R400: MASSOULAS | W400: BOX HILL | X400: 0 | Y400: 9 | Z400: 0 | AA400: 948 | AB400: 1469 | AC400: =(AA400*100)/AB400 -> 64.533696392103465 | AD400: =(X400*4)+(Z400*2) -> 0
A401: NORTHCOTE | C401: P RYAN 7 | F401: McKENNA 5 | I401: M RYAN 2 | K401: JURGENSTEIN 2 | N401: DILORIO | P401: THORNELOE | S401: SMITH
A402: BOX HILL | C402: HALE 3 | E402: MCLERIE 2 | G402: CRUSE 2 | I402: DICKENSON 2 | L402: BICKLEY 2 | N402: CONNOLY | P402: SAUNDERS | S402: LAWTHER | V402: WITHERS
A404: YARRAVILLE | C404: 2 | D404: 4 | E404: =C404*6+D404 -> 16 | G404: 3 | H404: 9 | I404: =G404*6+H404 -> 27 | K404: 7 | L404: 14 | M404: =K404*6+L404 -> 56 | O404: 16 | P404: 16 | Q404: =O404*6+P404 -> 112 | S404: YARRAVILLE
A405: SUNSHINE | C405: 4 | D405: 4 | E405: =C405*6+D405 -> 28 | G405: 6 | H405: 6 | I405: =G405*6+H405 -> 42 | K405: 9 | L405: 8 | M405: =K405*6+L405 -> 62 | O405: 11 | P405: 11 | Q405: =O405*6+P405 -> 77 | S405: GROOM
A406: BEST PLAYERS
A407: YARRAVILLE | C407: SAIT | F407: SIMPSON | I407: HARLEY | L407: M FOTHERINGHAM | P407: MAGEE | R407: LAXTON
A408: SUNSHINE | C408: PIERCZAK | F408: R JONES | I408: ORMSTON | L408: T BRETT | O408: L BRETT
A409: GOALKICKERS
A410: YARRAVILLE | C410: PAGAN 4 | F410: SAIT 3 | H410: PERUSSICH 3 | K410: J RYAN 2 | M410: HUGGINS | O410: WARD | Q410: McFETRIDGE | T410: SIMPSON
A411: SUNSHINE | C411: JAMES 3 | F411: SIMMONS 3 | I411: CRAWFORD 2 | L411: R McLEAN | N411: FOLEY | P411: SHERIDAN
A413: MORDIALLOC | C413: 7 | D413: 0 | E413: =C413*6+D413 -> 42 | G413: 12 | H413: 5 | I413: =G413*6+H413 -> 77 | K413: 17 | L413: 5 | M413: =K413*6+L413 -> 107 | O413: 18 | P413: 7 | Q413: =O413*6+P413 -> 115 | S413: WAVERLEY
A414: WAVERLEY | C414: 2 | D414: 7 | E414: =C414*6+D414 -> 19 | G414: 7 | H414: 14 | I414: =G414*6+H414 -> 56 | K414: 10 | L414: 22 | M414: =K414*6+L414 -> 82 | O414: 13 | P414: 26 | Q414: =O414*6+P414 -> 104 | S414: WILSON
A415: BEST PLAYERS
A416: MORDIALLOC | C416: GUY | F416: PARKER | I416: MAGUIRE | L416: PAUL BARDOEL | O416: MARGHERITI | R416: DEATON
A417: WAVERLEY | C417: HOLDSWORTH | F417: LOVELL | I417: KINNABURGH | L417: AUSTIN | O417: HARRINGTON | R417: P ANGELIS
A418: GOALKICKERS
A419: MORDIALLOC | C419: NEVILLE 7 | F419: DEATON 5 | I419: PAUL BARDOEL 3 | M419: DWYER 2 | O419: PARKER
A420: WAVERLEY | C420: P ANGELIS 5 | F420: COSTELLO 3 | I420: HARRINGTON 2 | L420: KERR | N420: BARNES | P420: K McDONALD
A422: OAKLEIGH | C422: 4 | D422: 2 | E422: =C422*6+D422 -> 26 | G422: 8 | H422: 5 | I422: =G422*6+H422 -> 53 | K422: 13 | L422: 12 | M422: =K422*6+L422 -> 90 | O422: 15 | P422: 16 | Q422: =O422*6+P422 -> 106 | S422: OAKLEIGH
A423: WILLIAMSTOWN | C423: 2 | D423: 4 | E423: =C423*6+D423 -> 16 | G423: 8 | H423: 7 | I423: =G423*6+H423 -> 55 | K423: 11 | L423: 9 | M423: =K423*6+L423 -> 75 | O423: 13 | P423: 12 | Q423: =O423*6+P423 -> 90 | S423: STABB
A424: BEST PLAYERS
A425: OAKLEIGH | C425: DUNN | F425: ALLISEY | I425: HEVERIN | L425: HARTLEY | O425: TAYLOR | R425: SPLATT
A426: WILLIAMSTOWN | C426: COURTOT | F426: JOHN | I426: COATES | L426: R SMITH | O426: PHILPOTT | R426: TAYLOR
A427: GOALKICKERS
A428: OAKLEIGH | C428: TAYLOR 4 | F428: WALSH 3 | I428: NEARY 3 | K428: HEVERIN | M428: LEISHMAN | P428: CURTAIN | R428: DUNN | T428: ALLISEY
A429: WILLIAMSTOWN | C429: R SMITH 4 | F429: ENRIGHT 4 | I429: CUTAJAR | L429: GANNON | N429: COATES | P429: GOETZ | R429: CLARKE
A431: ROUND 10 | E431: 8TH JUNE | J431: WEATHER | S431: PLAYED AT
D432: 1ST QTR | H432: 2ND QTR | L432: 3RD QTR | P432: FINAL | S432: WERRIBEE
A433: WERRIBEE | C433: 5 | D433: 8 | E433: =C433*6+D433 -> 38 | G433: 12 | H433: 10 | I433: =G433*6+H433 -> 82 | K433: 17 | L433: 17 | M433: =K433*6+L433 -> 119 | O433: 23 | P433: 24 | Q433: =O433*6+P433 -> 162 | S433: UMPIRE | X433: LADDER | AB433: ROUND | AD433: 10
A434: NORTHCOTE | C434: 6 | D434: 2 | E434: =C434*6+D434 -> 38 | G434: 9 | H434: 5 | I434: =G434*6+H434 -> 59 | K434: 12 | L434: 8 | M434: =K434*6+L434 -> 80 | O434: 16 | P434: 10 | Q434: =O434*6+P434 -> 106 | S434: BUDGE
A435: BEST PLAYERS | W435: TEAM | X435: W | Y435: L | Z435: D | AA435: FOR | AB435: AGST | AC435: % | AD435: PTS
A436: WERRIBEE | C436: JACK | F436: SQUIRE | I436: GUDDE | L436: LANCASTER | O436: YOUNG | R436: PRICE
A437: NORTHCOTE | C437: P RYAN | F437: MEGNA | I437: G SMITH | L437: SHEPHERD | O437: McKENNA | R437: M RYAN | W437: YARRAVILLE | X437: 8 | Y437: 2 | Z437: 0 | AA437: 1389 | AB437: 1072 | AC437: =(AA437*100)/AB437 -> 129.57089552238807 | AD437: =(X437*4)+(Z437*2) -> 32
A438: GOALKICKERS | O438: LANCASTER | W438: BRUNSWICK | X438: 7 | Y438: 3 | Z438: 0 | AA438: 1364 | AB438: 1064 | AC438: =(AA438*100)/AB438 -> 128.19548872180451 | AD438: =(X438*4)+(Z438*2) -> 28
A439: WERRIBEE | C439: LEECE 5 | E439: DAY 4 | G439: TAYLOR 3 | I439: WILLIAMS 2 | K439: DEMPSTER 2 | N439: BREEN 2 | P439: GUDDE 2 | R439: MENADUE 2 | W439: WAVERLEY | X439: 7 | Y439: 3 | Z439: 0 | AA439: 1291 | AB439: 1219 | AC439: =(AA439*100)/AB439 -> 105.90648072190319 | AD439: =(X439*4)+(Z439*2) -> 28
A440: NORTHCOTE | C440: McKENNA 6 | F440: P RYAN 6 | I440: G SMITH 3 | L440: JURGENSTEIN | W440: WILLIAMSTOWN | X440: 6 | Y440: 4 | Z440: 0 | AA440: 1321 | AB440: 1131 | AC440: =(AA440*100)/AB440 -> 116.79929266136163 | AD440: =(X440*4)+(Z440*2) -> 24
A442: OAKLEIGH | C442: 5 | D442: 4 | E442: =C442*6+D442 -> 34 | G442: 10 | H442: 9 | I442: =G442*6+H442 -> 69 | K442: 16 | L442: 14 | M442: =K442*6+L442 -> 110 | O442: 20 | P442: 24 | Q442: =O442*6+P442 -> 144 | S442: OAKLEIGH | W442: OAKLEIGH | X442: 6 | Y442: 4 | Z442: 0 | AA442: 1295 | AB442: 1176 | AC442: =(AA442*100)/AB442 -> 110.11904761904762 | AD442: =(X442*4)+(Z442*2) -> 24
A443: BOX HILL | C443: 5 | D443: 3 | E443: =C443*6+D443 -> 33 | G443: 6 | H443: 5 | I443: =G443*6+H443 -> 41 | K443: 9 | L443: 7 | M443: =K443*6+L443 -> 61 | O443: 9 | P443: 11 | Q443: =O443*6+P443 -> 65 | S443: MORGAN | W443: MORDIALLOC | X443: 5 | Y443: 5 | Z443: 0 | AA443: 1211 | AB443: 1204 | AC443: =(AA443*100)/AB443 -> 100.58139534883721 | AD443: =(X443*4)+(Z443*2) -> 20
A444: BEST PLAYERS | W444: WERRIBEE | X444: 5 | Y444: 5 | Z444: 0 | AA444: 1231 | AB444: 1329 | AC444: =(AA444*100)/AB444 -> 92.626034612490599 | AD444: =(X444*4)+(Z444*2) -> 20
A445: OAKLEIGH | C445: SPLATT | F445: ALLISEY | I445: TAYLOR | L445: PLUMB | O445: CURTAIN | W445: SUNSHINE | X445: 4 | Y445: 6 | Z445: 0 | AA445: 1166 | AB445: 1255 | AC445: =(AA445*100)/AB445 -> 92.908366533864537 | AD445: =(X445*4)+(Z445*2) -> 16
A446: BOX HILL | C446: GOODEN | F446: WITHERS | I446: CRUSE | L446: CONNOLLY | O446: LAWTHER | R446: HOOGSTRA | W446: NORTHCOTE | X446: 2 | Y446: 8 | Z446: 0 | AA446: 1158 | AB446: 1386 | AC446: =(AA446*100)/AB446 -> 83.549783549783555 | AD446: =(X446*4)+(Z446*2) -> 8
A447: GOALKICKERS | W447: BOX HILL | X447: 0 | Y447: 10 | Z447: 0 | AA447: 1013 | AB447: 1613 | AC447: =(AA447*100)/AB447 -> 62.802231866088036 | AD447: =(X447*4)+(Z447*2) -> 0
A448: OAKLEIGH | C448: NEARY 5 | F448: WALSH 4 | H448: WOOD 3 | J448: LEISHMAN 2 | M448: HARTLEY 2 | O448: McDONALD 2 | R448: TAYLOR | T448: DUNN
A449: BOX HILL | C449: GOODEN 4 | F449: SCRIMSHAW 2 | I449: GAUL | K449: WITHERS | M449: DICKENSON
A451: YARRAVILLE | C451: 2 | D451: 3 | E451: =C451*6+D451 -> 15 | G451: 7 | H451: 9 | I451: =G451*6+H451 -> 51 | K451: 13 | L451: 10 | M451: =K451*6+L451 -> 88 | O451: 18 | P451: 14 | Q451: =O451*6+P451 -> 122 | S451: YARRAVILLE
A452: WILLIAMSTOWN | C452: 5 | D452: 4 | E452: =C452*6+D452 -> 34 | G452: 6 | H452: 8 | I452: =G452*6+H452 -> 44 | K452: 14 | L452: 15 | M452: =K452*6+L452 -> 99 | O452: 17 | P452: 17 | Q452: =O452*6+P452 -> 119 | S452: OAKLEY
A453: BEST PLAYERS
A454: YARRAVILLE | C454: SAIT | F454: HIGGINS | I454: M FOTHERINGHAM | M454: RADZIMINSKI | P454: PAGAN | R454: HARLEY
A455: WILLIAMSTOWN | C455: KENNEDY | F455: ENRIGHT | I455: COURTOT | L455: BRADDY | O455: M TAYLOR | R455: JOHN
A456: GOALKICKERS
A457: YARRAVILLE | C457: M FOTHERINGHAM 6 | G457: PAGAN 2 | I457: SAIT 2 | K457: HARLEY 2 | M457: STIBBARD 2 | P457: PERUSSICH 2 | R457: J RYAN | T457: McFETRIDGE
A458: WILLIAMSTOWN | C458: ENRIGHT 6 | F458: TAYLOR 3 | H458: CHAPMAN 2 | K458: BRADDY 2 | N458: PHILPOTT | P458: R SMITH | R458: COATES | T458: JOHN
A460: WAVERLEY | C460: 3 | D460: 1 | E460: =C460*6+D460 -> 19 | G460: 12 | H460: 5 | I460: =G460*6+H460 -> 77 | K460: 14 | L460: 5 | M460: =K460*6+L460 -> 89 | O460: 22 | P460: 6 | Q460: =O460*6+P460 -> 138 | S460: WAVERLEY
A461: SUNSHINE | C461: 3 | D461: 2 | E461: =C461*6+D461 -> 20 | G461: 4 | H461: 4 | I461: =G461*6+H461 -> 28 | K461: 9 | L461: 9 | M461: =K461*6+L461 -> 63 | O461: 14 | P461: 13 | Q461: =O461*6+P461 -> 97 | S461: GIBSON
A462: BEST PLAYERS
A463: WAVERLEY | C463: SULLIVAN | F463: HOLDSWORTH | I463: CLARKE | L463: P ANGELIS | O463: MORRIS | R463: W McDONALD
A464: SUNSHINE | C464: BRETT | F464: MATTHEWS | I464: PIERCZAK | L464: JONES | O464: DARCY | R464: JAMES
A465: GOALKICKERS
A466: WAVERLEY | C466: P ANGELIS 8 | F466: MORRIS 6 | H466: CHALKER 4 | K466: CLARKE | M466: PRITCHETT | O466: COSTELLO | R466: BARNES
A467: SUNSHINE | C467: JAMES 6 | F467: SMITH 2 | H467: SIMMONS | J467: BRETT | L467: FOLEY | N467: LAVERDE | Q467: DARCY | S467: R MCLEAN
A469: BRUNSWICK | C469: 2 | D469: 8 | E469: =C469*6+D469 -> 20 | G469: 4 | H469: 15 | I469: =G469*6+H469 -> 39 | K469: 10 | L469: 20 | M469: =K469*6+L469 -> 80 | O469: 18 | P469: 22 | Q469: =O469*6+P469 -> 130 | S469: BRUNSWICK
A470: MORDIALLOC | C470: 2 | D470: 1 | E470: =C470*6+D470 -> 13 | G470: 5 | H470: 4 | I470: =G470*6+H470 -> 34 | K470: 9 | L470: 6 | M470: =K470*6+L470 -> 60 | O470: 12 | P470: 10 | Q470: =O470*6+P470 -> 82 | S470: MATHEWS
A471: BEST PLAYERS
A472: BRUNSWICK | C472: LAWRENCE | F472: SAHLBERG | I472: TOY | L472: WHILEY | O472: LEAHY | R472: LAKER
A473: MORDIALLOC | C473: GUY | F473: DINGLE | I473: PARKER | L473: MARGHERITI | O473: WALSH | R473: MOORE
A474: GOALKICKERS
A475: BRUNSWICK | C475: CLEARY 4 | F475: TOY 3 | G475: MARANTELLI 3 | J475: SCULLY 3 | L475: DOLAN 2 | N475: LAKER | P475: CROTTY | R475: GUNSTON
A476: MORDIALLOC | C476: NEVILLE 3 | F476: GUY 2 | H476: DINGLE 2 | K476: WALSH 2 | M476: PAUL BARDOEL | P476: DEATON | R476: McLOUGHLIN
A478: ROUND 11 | E478: 22ND JUNE | J478: WEATHER | S478: PLAYED AT
D479: 1ST QTR | H479: 2ND QTR | L479: 3RD QTR | P479: FINAL | S479: NORTHCOTE
A480: NORTHCOTE | C480: 0 | D480: 0 | E480: =C480*6+D480 -> 0 | G480: 0 | H480: 0 | I480: =G480*6+H480 -> 0 | K480: 0 | L480: 0 | M480: =K480*6+L480 -> 0 | O480: 14 | P480: 19 | Q480: =O480*6+P480 -> 103 | S480: UMPIRE | X480: LADDER | AB480: ROUND | AD480: 11
A481: OAKLEIGH | C481: 0 | D481: 0 | E481: =C481*6+D481 -> 0 | G481: 0 | H481: 0 | I481: =G481*6+H481 -> 0 | K481: 0 | L481: 0 | M481: =K481*6+L481 -> 0 | O481: 5 | P481: 11 | Q481: =O481*6+P481 -> 41
A482: BEST PLAYERS | W482: TEAM | X482: W | Y482: L | Z482: D | AA482: FOR | AB482: AGST | AC482: % | AD482: PTS
A483: NORTHCOTE
A484: OAKLEIGH | W484: YARRAVILLE | X484: 9 | Y484: 2 | Z484: 0 | AA484: 1529 | AB484: 1161 | AC484: =(AA484*100)/AB484 -> 131.69681309216193 | AD484: =(X484*4)+(Z484*2) -> 36
A485: GOALKICKERS | W485: BRUNSWICK | X485: 7 | Y485: 4 | Z485: 0 | AA485: 1443 | AB485: 1167 | AC485: =(AA485*100)/AB485 -> 123.65038560411311 | AD485: =(X485*4)+(Z485*2) -> 28
A486: NORTHCOTE | W486: WILLIAMSTOWN | X486: 7 | Y486: 4 | Z486: 0 | AA486: 1435 | AB486: 1224 | AC486: =(AA486*100)/AB486 -> 117.23856209150327 | AD486: =(X486*4)+(Z486*2) -> 28
A487: OAKLEIGH | W487: WAVERLEY | X487: 7 | Y487: 4 | Z487: 0 | AA487: 1384 | AB487: 1333 | AC487: =(AA487*100)/AB487 -> 103.82595648912228 | AD487: =(X487*4)+(Z487*2) -> 28
A489: YARRAVILLE | C489: 0 | D489: 0 | E489: =C489*6+D489 -> 0 | G489: 0 | H489: 0 | I489: =G489*6+H489 -> 0 | K489: 0 | L489: 0 | M489: =K489*6+L489 -> 0 | O489: 19 | P489: 26 | Q489: =O489*6+P489 -> 140 | S489: BOX HILL | W489: OAKLEIGH | X489: 6 | Y489: 5 | Z489: 0 | AA489: 1336 | AB489: 1279 | AC489: =(AA489*100)/AB489 -> 104.45660672400312 | AD489: =(X489*4)+(Z489*2) -> 24
A490: BOX HILL | C490: 0 | D490: 0 | E490: =C490*6+D490 -> 0 | G490: 0 | H490: 0 | I490: =G490*6+H490 -> 0 | K490: 0 | L490: 0 | M490: =K490*6+L490 -> 0 | O490: 11 | P490: 23 | Q490: =O490*6+P490 -> 89 | W490: MORDIALLOC | X490: 6 | Y490: 5 | Z490: 0 | AA490: 1326 | AB490: 1298 | AC490: =(AA490*100)/AB490 -> 102.15716486902927 | AD490: =(X490*4)+(Z490*2) -> 24
A491: BEST PLAYERS | W491: SUNSHINE | X491: 5 | Y491: 6 | Z491: 0 | AA491: 1269 | AB491: 1334 | AC491: =(AA491*100)/AB491 -> 95.127436281859076 | AD491: =(X491*4)+(Z491*2) -> 20
A492: YARRAVILLE | W492: WERRIBEE | X492: 5 | Y492: 6 | Z492: 0 | AA492: 1325 | AB492: 1444 | AC492: =(AA492*100)/AB492 -> 91.7590027700831 | AD492: =(X492*4)+(Z492*2) -> 20
A493: BOX HILL | W493: NORTHCOTE | X493: 3 | Y493: 8 | Z493: 0 | AA493: 1261 | AB493: 1427 | AC493: =(AA493*100)/AB493 -> 88.367203924316755 | AD493: =(X493*4)+(Z493*2) -> 12
A494: GOALKICKERS | W494: BOX HILL | X494: 0 | Y494: 11 | Z494: 0 | AA494: 1102 | AB494: 1753 | AC494: =(AA494*100)/AB494 -> 62.86366229321164 | AD494: =(X494*4)+(Z494*2) -> 0
A495: YARRAVILLE
A496: BOX HILL
A498: WILLIAMSTOWN | C498: 0 | D498: 0 | E498: =C498*6+D498 -> 0 | G498: 0 | H498: 0 | I498: =G498*6+H498 -> 0 | K498: 0 | L498: 0 | M498: =K498*6+L498 -> 0 | O498: 16 | P498: 18 | Q498: =O498*6+P498 -> 114 | S498: WILLIAMSTOWN
A499: WAVERLEY | C499: 0 | D499: 0 | E499: =C499*6+D499 -> 0 | G499: 0 | H499: 0 | I499: =G499*6+H499 -> 0 | K499: 0 | L499: 0 | M499: =K499*6+L499 -> 0 | O499: 13 | P499: 15 | Q499: =O499*6+P499 -> 93
A500: BEST PLAYERS
A501: WILLIAMSTOWN
A502: WAVERLEY
A503: GOALKICKERS
A504: WILLIAMSTOWN
A505: WAVERLEY
A507: SUNSHINE | C507: 0 | D507: 0 | E507: =C507*6+D507 -> 0 | G507: 0 | H507: 0 | I507: =G507*6+H507 -> 0 | K507: 0 | L507: 0 | M507: =K507*6+L507 -> 0 | O507: 15 | P507: 13 | Q507: =O507*6+P507 -> 103 | S507: SUNSHINE
A508: BRUNSWICK | C508: 0 | D508: 0 | E508: =C508*6+D508 -> 0 | G508: 0 | H508: 0 | I508: =G508*6+H508 -> 0 | K508: 0 | L508: 0 | M508: =K508*6+L508 -> 0 | O508: 10 | P508: 19 | Q508: =O508*6+P508 -> 79
A509: BEST PLAYERS
A510: SUNSHINE
A511: BRUNSWICK
A512: GOALKICKERS
A513: SUNSHINE
A514: BRUNSWICK
A516: MORDIALLOC | C516: 0 | D516: 0 | E516: =C516*6+D516 -> 0 | G516: 0 | H516: 0 | I516: =G516*6+H516 -> 0 | K516: 0 | L516: 0 | M516: =K516*6+L516 -> 0 | O516: 17 | P516: 13 | Q516: =O516*6+P516 -> 115 | S516: MORDIALLOC
A517: WERRIBEE | C517: 0 | D517: 0 | E517: =C517*6+D517 -> 0 | G517: 0 | H517: 0 | I517: =G517*6+H517 -> 0 | K517: 0 | L517: 0 | M517: =K517*6+L517 -> 0 | O517: 13 | P517: 16 | Q517: =O517*6+P517 -> 94
A518: BEST PLAYERS
A519: MORDIALLOC
A520: WERRIBEE
A521: GOALKICKERS
A522: MORDIALLOC
A523: WERRIBEE
A525: ROUND 12 | E525: 29TH JUNE | J525: WEATHER | S525: PLAYED AT
D526: 1ST QTR | H526: 2ND QTR | L526: 3RD QTR | P526: FINAL | S526: WAVERLEY
A527: BOX HILL | C527: 3 | D527: 3 | E527: =C527*6+D527 -> 21 | G527: 3 | H527: 3 | I527: =G527*6+H527 -> 21 | K527: 6 | L527: 4 | M527: =K527*6+L527 -> 40 | O527: 7 | P527: 4 | Q527: =O527*6+P527 -> 46 | S527: UMPIRE | X527: LADDER | AB527: ROUND | AD527: 12
A528: WAVERLEY | C528: 1 | D528: 3 | E528: =C528*6+D528 -> 9 | G528: 2 | H528: 8 | I528: =G528*6+H528 -> 20 | K528: 3 | L528: 13 | M528: =K528*6+L528 -> 31 | O528: 3 | P528: 14 | Q528: =O528*6+P528 -> 32 | S528: MATTHEWS
A529: BEST PLAYERS | W529: TEAM | X529: W | Y529: L | Z529: D | AA529: FOR | AB529: AGST | AC529: % | AD529: PTS
A530: BOX HILL | C530: HARPER | F530: McLERIE | I530: TAYLOR | L530: DICKENSON | O530: CAREY | Q530: LAWTHER
A531: WAVERLEY | C531: HOLDSWORTH | F531: SULLIVAN | I531: W McDONALD | W531: YARRAVILLE | X531: 9 | Y531: 3 | Z531: 0 | AA531: 1582 | AB531: 1232 | AC531: =(AA531*100)/AB531 -> 128.40909090909091 | AD531: =(X531*4)+(Z531*2) -> 36
A532: GOALKICKERS | W532: BRUNSWICK | X532: 8 | Y532: 4 | Z532: 0 | AA532: 1518 | AB532: 1217 | AC532: =(AA532*100)/AB532 -> 124.73294987674609 | AD532: =(X532*4)+(Z532*2) -> 32
A533: BOX HILL | C533: SUMMERS 2 | F533: DICKENSON 2 | I533: MARSHALL | L533: CAREY | N533: LAWTHER | W533: WILLIAMSTOWN | X533: 7 | Y533: 5 | Z533: 0 | AA533: 1485 | AB533: 1299 | AC533: =(AA533*100)/AB533 -> 114.31870669745959 | AD533: =(X533*4)+(Z533*2) -> 28
A534: WAVERLEY | C534: McLURE | F534: BARNES | I534: P ANGELIS | W534: WAVERLEY | X534: 7 | Y534: 5 | Z534: 0 | AA534: 1416 | AB534: 1379 | AC534: =(AA534*100)/AB534 -> 102.68310369833212 | AD534: =(X534*4)+(Z534*2) -> 28
A536: NORTHCOTE | C536: 4 | D536: 1 | E536: =C536*6+D536 -> 25 | G536: 7 | H536: 4 | I536: =G536*6+H536 -> 46 | K536: 7 | L536: 5 | M536: =K536*6+L536 -> 47 | O536: 11 | P536: 5 | Q536: =O536*6+P536 -> 71 | S536: YARRAVILLE | W536: OAKLEIGH | X536: 6 | Y536: 6 | Z536: 0 | AA536: 1405 | AB536: 1355 | AC536: =(AA536*100)/AB536 -> 103.69003690036901 | AD536: =(X536*4)+(Z536*2) -> 24
A537: YARRAVILLE | C537: 4 | D537: 3 | E537: =C537*6+D537 -> 27 | G537: 5 | H537: 5 | I537: =G537*6+H537 -> 35 | K537: 7 | L537: 7 | M537: =K537*6+L537 -> 49 | O537: 7 | P537: 11 | Q537: =O537*6+P537 -> 53 | S537: SNOOKS | W537: MORDIALLOC | X537: 6 | Y537: 6 | Z537: 0 | AA537: 1376 | AB537: 1361 | AC537: =(AA537*100)/AB537 -> 101.10213078618662 | AD537: =(X537*4)+(Z537*2) -> 24
A538: BEST PLAYERS | W538: SUNSHINE | X538: 6 | Y538: 6 | Z538: 0 | AA538: 1332 | AB538: 1384 | AC538: =(AA538*100)/AB538 -> 96.242774566473983 | AD538: =(X538*4)+(Z538*2) -> 24
A539: NORTHCOTE | C539: DILORIO | F539: THORNELOE | I539: MEGNA | L539: JURGENSTEIN | O539: McINTYRE | R539: McNAMARA | W539: WERRIBEE | X539: 6 | Y539: 6 | Z539: 0 | AA539: 1401 | AB539: 1513 | AC539: =(AA539*100)/AB539 -> 92.597488433575677 | AD539: =(X539*4)+(Z539*2) -> 24
A540: YARRAVILLE | C540: SIMPSON | F540: SHARP | I540: McGHIE | L540: COLBERT | O540: STIBBARD | R540: KEOGH | W540: NORTHCOTE | X540: 4 | Y540: 8 | Z540: 0 | AA540: 1332 | AB540: 1480 | AC540: =(AA540*100)/AB540 -> 90 | AD540: =(X540*4)+(Z540*2) -> 16
A541: GOALKICKERS | W541: BOX HILL | X541: 1 | Y541: 11 | Z541: 0 | AA541: 1148 | AB541: 1785 | AC541: =(AA541*100)/AB541 -> 64.313725490196077 | AD541: =(X541*4)+(Z541*2) -> 4
A542: NORTHCOTE | C542: P RYAN 3 | F542: M RYAN 2 | I542: McKENNA 2 | L542: JURGENSTEIN 2 | O542: THORNELOE | R542: DILORIO
A543: YARRAVILLE | C543: SIMPSON | E543: HIGGINS | G543: SAIT | I543: P RYAN | K543: COLBERT | M543: BUCKLEY | O543: HARLEY
A545: BRUNSWICK | C545: 5 | D545: 2 | E545: =C545*6+D545 -> 32 | G545: 7 | H545: 4 | I545: =G545*6+H545 -> 46 | K545: 9 | L545: 9 | M545: =K545*6+L545 -> 63 | O545: 11 | P545: 9 | Q545: =O545*6+P545 -> 75 | S545: BRUNSWICK
A546: WILLIAMSTOWN | C546: 1 | D546: 2 | E546: =C546*6+D546 -> 8 | G546: 4 | H546: 7 | I546: =G546*6+H546 -> 31 | K546: 4 | L546: 7 | M546: =K546*6+L546 -> 31 | O546: 7 | P546: 8 | Q546: =O546*6+P546 -> 50
A547: BEST PLAYERS
A548: BRUNSWICK
A549: WILLIAMSTOWN
A550: GOALKICKERS
A551: BRUNSWICK
A552: WILLIAMSTOWN
A554: SUNSHINE | C554: 0 | D554: 0 | E554: =C554*6+D554 -> 0 | G554: 5 | H554: 6 | I554: =G554*6+H554 -> 36 | K554: 5 | L554: 6 | M554: =K554*6+L554 -> 36 | O554: 9 | P554: 9 | Q554: =O554*6+P554 -> 63 | S554: MORDIALLOC
A555: MORDIALLOC | C555: 3 | D555: 3 | E555: =C555*6+D555 -> 21 | G555: 3 | H555: 4 | I555: =G555*6+H555 -> 22 | K555: 5 | L555: 7 | M555: =K555*6+L555 -> 37 | O555: 7 | P555: 8 | Q555: =O555*6+P555 -> 50 | S555: BUDGE
A556: BEST PLAYERS
A557: SUNSHINE | C557: MATTHEWS | F557: PIERCZAK | I557: CRAWFORD | L557: JONES | N557: BRETT | Q557: M McLEAN
A558: MORDIALLOC | C558: WALSH | F558: MARGHERITI | I558: BATTY | L558: GUY | N558: McLOUGHLIN | Q558: DEATON
A559: GOALKICKERS
A560: SUNSHINE | C560: JAMES 4 | F560: R McLEAN 2 | I560: PERIERA | K560: CRAWFORD | N560: BRETT
A561: MORDIALLOC | C561: NEVILLE 3 | F561: DEATON 2 | I561: PARKER | K561: WALSH
A563: WERRIBEE | C563: 3 | D563: 7 | E563: =C563*6+D563 -> 25 | G563: 4 | H563: 7 | I563: =G563*6+H563 -> 31 | K563: 10 | L563: 10 | M563: =K563*6+L563 -> 70 | O563: 11 | P563: 10 | Q563: =O563*6+P563 -> 76 | S563: WERRIBEE
A564: OAKLEIGH | C564: 0 | D564: 0 | E564: =C564*6+D564 -> 0 | G564: 4 | H564: 2 | I564: =G564*6+H564 -> 26 | K564: 5 | L564: 4 | M564: =K564*6+L564 -> 34 | O564: 10 | P564: 9 | Q564: =O564*6+P564 -> 69
A565: BEST PLAYERS
A566: WERRIBEE
A567: OAKLEIGH | C567: PLUMB | F567: KILLEAN | I567: TAYLOR | L567: LEISHMAN | N567: HEVERIN
A568: GOALKICKERS
A569: WERRIBEE
A570: OAKLEIGH | C570: NEARY 2 | E570: HEVERIN 2 | G570: DUNN 2 | I570: WENN | K570: WOOD | M570: PAGNOCCOLO | P570: 1 SHORT
A572: ROUND 13 | E572: 6TH JULY | J572: WEATHER | S572: PLAYED AT
D573: 1ST QTR | H573: 2ND QTR | L573: 3RD QTR | P573: FINAL | S573: OAKLEIGH
A574: YARRAVILLE | C574: 5 | D574: 5 | E574: =C574*6+D574 -> 35 | G574: 8 | H574: 8 | I574: =G574*6+H574 -> 56 | K574: 11 | L574: 11 | M574: =K574*6+L574 -> 77 | O574: 15 | P574: 11 | Q574: =O574*6+P574 -> 101 | S574: UMPIRE | X574: LADDER | AB574: ROUND | AD574: 13
A575: OAKLEIGH | C575: 2 | D575: 3 | E575: =C575*6+D575 -> 15 | G575: 5 | H575: 5 | I575: =G575*6+H575 -> 35 | K575: 7 | L575: 9 | M575: =K575*6+L575 -> 51 | O575: 10 | P575: 12 | Q575: =O575*6+P575 -> 72 | S575: OAKLEY
A576: BEST PLAYERS | W576: TEAM | X576: W | Y576: L | Z576: D | AA576: FOR | AB576: AGST | AC576: % | AD576: PTS
A577: YARRAVILLE | C577: KEOGH | F577: BUCKINGHAM | I577: SIMPSON | L577: S McGHIE | N577: M FOTHERINGHAM | R577: P RYAN
A578: OAKLEIGH | C578: LEISHMAN | F578: BATTERSBY | I578: TAYLOR | L578: SPLATT | N578: PLUMB | P578: KILLEAN | W578: YARRAVILLE | X578: 10 | Y578: 3 | Z578: 0 | AA578: 1683 | AB578: 1304 | AC578: =(AA578*100)/AB578 -> 129.06441717791412 | AD578: =(X578*4)+(Z578*2) -> 40
A579: GOALKICKERS | W579: BRUNSWICK | X579: 9 | Y579: 4 | Z579: 0 | AA579: 1638 | AB579: 1281 | AC579: =(AA579*100)/AB579 -> 127.8688524590164 | AD579: =(X579*4)+(Z579*2) -> 36
A580: YARRAVILLE | C580: M FOTHERINGHAM 7 | G580: SAIT 3 | I580: DI NATALE 2 | L580: HIGGINS | N580: S McGHIE | Q580: PAGAN | W580: WAVERLEY | X580: 8 | Y580: 5 | Z580: 0 | AA580: 1502 | AB580: 1424 | AC580: =(AA580*100)/AB580 -> 105.47752808988764 | AD580: =(X580*4)+(Z580*2) -> 32
A581: OAKLEIGH | C581: LEISHMAN 2 | F581: WOOD 2 | H581: ALLISEY 2 | J581: MOWETT | M581: WENN | O581: WALSH | Q581: TAYLOR | W581: WILLIAMSTOWN | X581: 7 | Y581: 6 | Z581: 0 | AA581: 1573 | AB581: 1402 | AC581: =(AA581*100)/AB581 -> 112.19686162624822 | AD581: =(X581*4)+(Z581*2) -> 28
A583: BRUNSWICK | C583: 4 | D583: 4 | E583: =C583*6+D583 -> 28 | G583: 8 | H583: 8 | I583: =G583*6+H583 -> 56 | K583: 10 | L583: 11 | M583: =K583*6+L583 -> 71 | O583: 17 | P583: 18 | Q583: =O583*6+P583 -> 120 | S583: BOX HILL | W583: MORDIALLOC | X583: 7 | Y583: 6 | Z583: 0 | AA583: 1479 | AB583: 1449 | AC583: =(AA583*100)/AB583 -> 102.0703933747412 | AD583: =(X583*4)+(Z583*2) -> 28
A584: BOX HILL | C584: 4 | D584: 2 | E584: =C584*6+D584 -> 26 | G584: 6 | H584: 5 | I584: =G584*6+H584 -> 41 | K584: 9 | L584: 9 | M584: =K584*6+L584 -> 63 | O584: 9 | P584: 10 | Q584: =O584*6+P584 -> 64 | S584: CASEY | W584: SUNSHINE | X584: 7 | Y584: 6 | Z584: 0 | AA584: 1454 | AB584: 1456 | AC584: =(AA584*100)/AB584 -> 99.862637362637358 | AD584: =(X584*4)+(Z584*2) -> 28
A585: BEST PLAYERS | W585: OAKLEIGH | X585: 6 | Y585: 7 | Z585: 0 | AA585: 1477 | AB585: 1456 | AC585: =(AA585*100)/AB585 -> 101.44230769230769 | AD585: =(X585*4)+(Z585*2) -> 24
A586: BRUNSWICK | C586: LAKER | F586: TOY | I586: BYE | K586: SMITH | W586: WERRIBEE | X586: 6 | Y586: 7 | Z586: 0 | AA586: 1473 | AB586: 1635 | AC586: =(AA586*100)/AB586 -> 90.091743119266056 | AD586: =(X586*4)+(Z586*2) -> 24
A587: BOX HILL | C587: TAYLOR | F587: CONNOLLY | I587: CRUSE | K587: GOODEN | N587: DICKENSON | Q587: HOOGSTRA | W587: NORTHCOTE | X587: 4 | Y587: 9 | Z587: 0 | AA587: 1377 | AB587: 1566 | AC587: =(AA587*100)/AB587 -> 87.931034482758619 | AD587: =(X587*4)+(Z587*2) -> 16
A588: GOALKICKERS | W588: BOX HILL | X588: 1 | Y588: 12 | Z588: 0 | AA588: 1212 | AB588: 1905 | AC588: =(AA588*100)/AB588 -> 63.622047244094489 | AD588: =(X588*4)+(Z588*2) -> 4
A589: BRUNSWICK | C589: BYE 6 | E589: TOY 3 | G589: LAKER 3 | I589: GUNSTON 3 | L589: CROTTY | N589: JUDGE
A590: BOX HILL | C590: CRUSE 3 | E590: SUMMERS | G590: McGETTIGAN | J590: MARSHALL | M590: GOODEN | O590: CAREY | Q590: SAUNDERS
A592: WAVERLEY | C592: 4 | D592: 6 | E592: =C592*6+D592 -> 30 | G592: 7 | H592: 7 | I592: =G592*6+H592 -> 49 | K592: 7 | L592: 9 | M592: =K592*6+L592 -> 51 | O592: 11 | P592: 20 | Q592: =O592*6+P592 -> 86 | S592: NORTHCOTE
A593: NORTHCOTE | C593: 1 | D593: 2 | E593: =C593*6+D593 -> 8 | G593: 2 | H593: 3 | I593: =G593*6+H593 -> 15 | K593: 6 | L593: 7 | M593: =K593*6+L593 -> 43 | O593: 6 | P593: 9 | Q593: =O593*6+P593 -> 45 | S593: GROOM
A594: BEST PLAYERS
A595: WAVERLEY | C595: LOVELL | F595: HOLDSWORTH | I595: McLURE | L595: BARNES | N595: SULLIVAN | Q595: CARLSON
A596: NORTHCOTE | C596: MEGNA | F596: McINTYRE | I596: BODDY | L596: JURGENSTEIN
A597: GOALKICKERS
A598: WAVERLEY | C598: BARNES 4 | F598: McLURE 2 | H598: P ANGELIS 2 | K598: LOVELL | M598: K McDONALD | P598: HENWOOD
A599: NORTHCOTE | C599: McKENNA 2 | F599: JURGENSTEIN | I599: ROULSTON | L599: THORNELOE | O599: SHEPHERD
A601: MORDIALLOC | C601: 3 | D601: 2 | E601: =C601*6+D601 -> 20 | G601: 9 | H601: 3 | I601: =G601*6+H601 -> 57 | K601: 12 | L601: 7 | M601: =K601*6+L601 -> 79 | O601: 15 | P601: 13 | Q601: =O601*6+P601 -> 103 | S601: WILLIAMSTOWN
A602: WILLIAMSTOWN | C602: 2 | D602: 6 | E602: =C602*6+D602 -> 18 | G602: 3 | H602: 12 | I602: =G602*6+H602 -> 30 | K602: 7 | L602: 15 | M602: =K602*6+L602 -> 57 | O602: 11 | P602: 22 | Q602: =O602*6+P602 -> 88 | S602: VERGONA
A603: BEST PLAYERS
A604: MORDIALLOC | C604: GUY | E604: ROGERSON | H604: MARGHERITI | K604: PARKER | N604: MOORE | Q604: SLADE
A605: WILLIAMSTOWN | C605: JOHN | E605: CONDON | H605: TWEEDLY | K605: BEBEND | N605: S PHILPOTT | Q605: BRADDY
A606: GOALKICKERS
A607: MORDIALLOC | C607: NEVILLE 5 | F607: DEATON 2 | H607: MOORE 2 | J607: ROGERSON 2 | M607: GUY | N607: PETER BARDOEL | R607: PARKER | T607: SLADE
A608: WILLIAMSTOWN | C608: TWEEDLY 3 | F608: JOHN 3 | H608: BRADDY 2 | K608: M TAYLOR | N608: MONTEBRUNO | Q608: BURNETT
A610: SUNSHINE | C610: 1 | D610: 4 | E610: =C610*6+D610 -> 10 | G610: 9 | H610: 11 | I610: =G610*6+H610 -> 65 | K610: 12 | L610: 15 | M610: =K610*6+L610 -> 87 | O610: 17 | P610: 20 | Q610: =O610*6+P610 -> 122 | S610: SUNSHINE
A611: WERRIBEE | C611: 1 | D611: 3 | E611: =C611*6+D611 -> 9 | G611: 3 | H611: 3 | I611: =G611*6+H611 -> 21 | K611: 7 | L611: 9 | M611: =K611*6+L611 -> 51 | O611: 10 | P611: 12 | Q611: =O611*6+P611 -> 72 | S611: TORNEY
A612: BEST PLAYERS
A613: SUNSHINE | C613: MATTHEWS | F613: JONES | H613: DARCY | J613: SIMMONS | M613: R McLEAN
A614: WERRIBEE | C614: MITCHELL | F614: MENADUE | I614: GUDDE
A615: GOALKICKERS
A616: SUNSHINE | C616: R McLEAN 6 | F616: SIMMONS 3 | I616: JAMES 2 | K616: PEREIRA 2 | M616: A SCHROEDER | P616: CRAWFORD | S616: JONES | U616: RICHARDSON
A617: WERRIBEE | C617: LEECE 3 | F617: DEMPSTER 3 | I617: HUGHES | K617: LYONS | M617: TAYLOR | O617: WISE
A619: ROUND 14 | E619: 13TH JULY | J619: WEATHER | S619: PLAYED AT
D620: 1ST QTR | H620: 2ND QTR | L620: 3RD QTR | P620: FINAL | S620: BRUNSWICK
A621: BRUNSWICK | C621: 6 | D621: 3 | E621: =C621*6+D621 -> 39 | G621: 9 | H621: 5 | I621: =G621*6+H621 -> 59 | K621: 13 | L621: 7 | M621: =K621*6+L621 -> 85 | O621: 16 | P621: 8 | Q621: =O621*6+P621 -> 104 | S621: UMPIRE | X621: LADDER | AB621: ROUND | AD621: 14
A622: NORTHCOTE | C622: 2 | D622: 1 | E622: =C622*6+D622 -> 13 | G622: 5 | H622: 4 | I622: =G622*6+H622 -> 34 | K622: 8 | L622: 5 | M622: =K622*6+L622 -> 53 | O622: 9 | P622: 7 | Q622: =O622*6+P622 -> 61 | S622: TORNEY
A623: BEST PLAYERS | W623: TEAM | X623: W | Y623: L | Z623: D | AA623: FOR | AB623: AGST | AC623: % | AD623: PTS
A624: BRUNSWICK | C624: SMITH | F624: BOURKE | I624: CROTTY | L624: WEST | O624: LEAHY | Q624: NOLAN
A625: NORTHCOTE | C625: McNAMARA | F625: EDWARDS | I625: JURGENSTEIN | L625: MEGNA | O625: McKENNA | W625: YARRAVILLE | X625: 11 | Y625: 3 | Z625: 0 | AA625: 1754 | AB625: 1370 | AC625: =(AA625*100)/AB625 -> 128.02919708029196 | AD625: =(X625*4)+(Z625*2) -> 44
A626: GOALKICKERS | W626: BRUNSWICK | X626: 10 | Y626: 4 | Z626: 0 | AA626: 1742 | AB626: 1342 | AC626: =(AA626*100)/AB626 -> 129.80625931445604 | AD626: =(X626*4)+(Z626*2) -> 40
A627: BRUNSWICK | C627: GUNSTON 4 | F627: BYE 3 | G627: SAHLBERG 2 | J627: MARANTELLI 2 | M627: LAKER | O627: WEST | Q627: LAWRENCE | S627: JUDGE | U627: TOY | W627: MORDIALLOC | X627: 8 | Y627: 6 | Z627: 0 | AA627: 1653 | AB627: 1537 | AC627: =(AA627*100)/AB627 -> 107.54716981132076 | AD627: =(X627*4)+(Z627*2) -> 32
A628: NORTHCOTE | C628: McKENNA 4 | F628: DILORIO 2 | I628: M RYAN | K628: MITCHELL | M628: MEGNA | W628: WAVERLEY | X628: 8 | Y628: 6 | Z628: 0 | AA628: 1545 | AB628: 1496 | AC628: =(AA628*100)/AB628 -> 103.27540106951872 | AD628: =(X628*4)+(Z628*2) -> 32
A630: MORDIALLOC | C630: 4 | D630: 1 | E630: =C630*6+D630 -> 25 | G630: 14 | H630: 10 | I630: =G630*6+H630 -> 94 | K630: 16 | L630: 15 | M630: =K630*6+L630 -> 111 | O630: 26 | P630: 18 | Q630: =O630*6+P630 -> 174 | S630: MORDIALLOC | W630: SUNSHINE | X630: 8 | Y630: 6 | Z630: 0 | AA630: 1576 | AB630: 1562 | AC630: =(AA630*100)/AB630 -> 100.89628681177977 | AD630: =(X630*4)+(Z630*2) -> 32
A631: BOX HILL | C631: 4 | D631: 1 | E631: =C631*6+D631 -> 25 | G631: 7 | H631: 3 | I631: =G631*6+H631 -> 45 | K631: 10 | L631: 5 | M631: =K631*6+L631 -> 65 | O631: 12 | P631: 16 | Q631: =O631*6+P631 -> 88 | S631: SNOOKS | W631: WILLIAMSTOWN | X631: 7 | Y631: 7 | Z631: 0 | AA631: 1679 | AB631: 1524 | AC631: =(AA631*100)/AB631 -> 110.17060367454069 | AD631: =(X631*4)+(Z631*2) -> 28
A632: BEST PLAYERS | W632: OAKLEIGH | X632: 7 | Y632: 7 | Z632: 0 | AA632: 1549 | AB632: 1499 | AC632: =(AA632*100)/AB632 -> 103.33555703802536 | AD632: =(X632*4)+(Z632*2) -> 28
A633: MORDIALLOC | C633: DEATON | F633: MARGHERITI | I633: PETERS | L633: McILWRAITH | O633: BATTY | R633: ROGERSON | W633: WERRIBEE | X633: 6 | Y633: 8 | Z633: 0 | AA633: 1539 | AB633: 1706 | AC633: =(AA633*100)/AB633 -> 90.211019929660026 | AD633: =(X633*4)+(Z633*2) -> 24
A634: BOX HILL | C634: TAYLOR | F634: McLERIE | I634: DICKENSON | L634: SUMMERS | O634: HARPER | R634: LAWTHER | W634: NORTHCOTE | X634: 4 | Y634: 10 | Z634: 0 | AA634: 1438 | AB634: 1670 | AC634: =(AA634*100)/AB634 -> 86.107784431137731 | AD634: =(X634*4)+(Z634*2) -> 16
A635: GOALKICKERS | N635: SLADE | P635: PETER BARDOEL | W635: BOX HILL | X635: 1 | Y635: 13 | Z635: 0 | AA635: 1300 | AB635: 2079 | AC635: =(AA635*100)/AB635 -> 62.53006253006253 | AD635: =(X635*4)+(Z635*2) -> 4
A636: MORDIALLOC | C636: DEATON 6 | F636: ROGERSON 5 | I636: NEVILLE 4 | K636: PARKER 3 | N636: MOORE 2 | P636: McILWRAITH 2 | S636: WALSH 2
A637: BOX HILL | C637: MARSHALL 4 | F637: SUMMERS 2 | I637: GOODEN 2 | K637: WITHERS | M637: McGETTIGAN | P637: DICKENSON | S637: DWYER
A639: SUNSHINE | C639: 7 | D639: 3 | E639: =C639*6+D639 -> 45 | G639: 9 | H639: 4 | I639: =G639*6+H639 -> 58 | K639: 16 | L639: 6 | M639: =K639*6+L639 -> 102 | O639: 19 | P639: 8 | Q639: =O639*6+P639 -> 122 | S639: SUNSHINE
A640: WILLIAMSTOWN | C640: 3 | D640: 2 | E640: =C640*6+D640 -> 20 | G640: 10 | H640: 6 | I640: =G640*6+H640 -> 66 | K640: 13 | L640: 7 | M640: =K640*6+L640 -> 85 | O640: 16 | P640: 10 | Q640: =O640*6+P640 -> 106 | S640: COLISIMO
A641: BEST PLAYERS
A642: SUNSHINE | C642: SIMMONS | F642: JAMES | I642: RICHARDSON | L642: M McLEAN
A643: WILLIAMSTOWN | C643: BEBEND | F643: KENNEDY | I643: JOHN | L643: M TAYLOR | O643: R SMITH | R643: EUDEY
A644: GOALKICKERS
A645: SUNSHINE | C645: JAMES 6 | F645: RICHARDSON 6 | I645: SIMMONS 3 | L645: R McLEAN 2 | O645: CRAWFORD | R645: A SCHROEDER
A646: WILLIAMSTOWN | C646: ENRIGHT 5 | F646: CHAPMAN 4 | I646: TWEEDLY 3 | L646: SMITH | N646: BEBEND | P646: JOHN | R646: A PHILPOTT
A648: OAKLEIGH | C648: 2 | D648: 5 | E648: =C648*6+D648 -> 17 | G648: 5 | H648: 7 | I648: =G648*6+H648 -> 37 | K648: 7 | L648: 11 | M648: =K648*6+L648 -> 53 | O648: 10 | P648: 12 | Q648: =O648*6+P648 -> 72 | S648: WAVERLEY
A649: WAVERLEY | C649: 3 | D649: 0 | E649: =C649*6+D649 -> 18 | G649: 5 | H649: 4 | I649: =G649*6+H649 -> 34 | K649: 5 | L649: 4 | M649: =K649*6+L649 -> 34 | O649: 6 | P649: 7 | Q649: =O649*6+P649 -> 43 | S649: VERGONA
A650: BEST PLAYERS
A651: OAKLEIGH | C651: McDONALD | F651: PLUMB | I651: WALSH | L651: HEVERIN | O651: KILLEAN
A652: WAVERLEY | C652: LOVELL | F652: STYLES | I652: MORRIS | L652: HOLDSWORTH | O652: CARLSON | R652: K McDONALD
A653: GOALKICKERS
A654: OAKLEIGH | C654: WOOD 3 | E654: McDONALD 2 | H654: THOMAS | J654: HEVERIN | L654: LEISHMAN | O654: PLUMB | Q654: COLLINS
A655: WAVERLEY | C655: P ANGELIS 2 | F655: McLURE | H655: BARNES | J655: MORRIS | L655: COSTELLO
A657: YARRAVILLE | C657: 7 | D657: 3 | E657: =C657*6+D657 -> 45 | G657: 7 | H657: 5 | I657: =G657*6+H657 -> 47 | K657: 9 | L657: 10 | M657: =K657*6+L657 -> 64 | O657: 10 | P657: 11 | Q657: =O657*6+P657 -> 71 | S657: YARRAVILLE
A658: WERRIBEE | C658: 1 | D658: 4 | E658: =C658*6+D658 -> 10 | G658: 5 | H658: 10 | I658: =G658*6+H658 -> 40 | K658: 7 | L658: 11 | M658: =K658*6+L658 -> 53 | O658: 8 | P658: 18 | Q658: =O658*6+P658 -> 66 | S658: CASEY
A659: BEST PLAYERS
A660: YARRAVILLE | C660: SAIT | E660: SIMPSON | H660: PAGAN | K660: KEOGH | N660: LAXTON | Q660: S McGHIE
A661: WERRIBEE | C661: BREEN | E661: MENADUE | H661: LANCASTER | K661: PRICE | N661: GUDDE | Q661: LEECE
A662: GOALKICKERS
A663: YARRAVILLE | C663: SAIT 4 | E663: JONES 2 | G663: P RYAN 2 | J663: DI NATALE | M663: PAGAN
A664: WERRIBEE | C664: LEECE 3 | E664: DEMPSTER 2 | H664: MENADUE 2 | K664: WILLIAMS
A666: ROUND 15 | E666: 20TH JULY | J666: WEATHER | S666: PLAYED AT
D667: 1ST QTR | H667: 2ND QTR | L667: 3RD QTR | P667: FINAL | S667: YARRAVILLE
A668: YARRAVILLE | C668: 3 | D668: 1 | E668: =C668*6+D668 -> 19 | G668: 5 | H668: 7 | I668: =G668*6+H668 -> 37 | K668: 7 | L668: 8 | M668: =K668*6+L668 -> 50 | O668: 13 | P668: 11 | Q668: =O668*6+P668 -> 89 | S668: UMPIRE | X668: LADDER | AB668: ROUND | AD668: 15
A669: WAVERLEY | C669: 1 | D669: 10 | E669: =C669*6+D669 -> 16 | G669: 1 | H669: 12 | I669: =G669*6+H669 -> 18 | K669: 7 | L669: 20 | M669: =K669*6+L669 -> 62 | O669: 11 | P669: 22 | Q669: =O669*6+P669 -> 88 | S669: STABB
A670: BEST PLAYERS | W670: TEAM | X670: W | Y670: L | Z670: D | AA670: FOR | AB670: AGST | AC670: % | AD670: PTS
A671: YARRAVILLE | C671: SHARP | F671: SAIT | I671: KEOGH | L671: O'CONNOR | O671: DI NATALE | R671: PAGAN
A672: WAVERLEY | C672: WENBORNE | F672: STYLES | I672: CLARKE | L672: BARNES | O672: HOLDSWORTH | R672: CARLSON | W672: YARRAVILLE | X672: 12 | Y672: 3 | Z672: 0 | AA672: 1843 | AB672: 1458 | AC672: =(AA672*100)/AB672 -> 126.40603566529492 | AD672: =(X672*4)+(Z672*2) -> 48
A673: GOALKICKERS | W673: BRUNSWICK | X673: 10 | Y673: 5 | Z673: 0 | AA673: 1817 | AB673: 1445 | AC673: =(AA673*100)/AB673 -> 125.74394463667819 | AD673: =(X673*4)+(Z673*2) -> 40
A674: YARRAVILLE | C674: M FOTHERINGHAM 7 | G674: SAIT 3 | I674: P RYAN | K674: J RYAN | M674: DI NATALE | W674: MORDIALLOC | X674: 9 | Y674: 6 | Z674: 0 | AA674: 1729 | AB674: 1607 | AC674: =(AA674*100)/AB674 -> 107.59178593652769 | AD674: =(X674*4)+(Z674*2) -> 36
A675: WAVERLEY | C675: COSTELLO 4 | F675: SULLIVAN 3 | I675: MORRIS | K675: HOLDSWORTH | N675: BARNES | P675: KAYE | W675: SUNSHINE | X675: 9 | Y675: 6 | Z675: 0 | AA675: 1659 | AB675: 1583 | AC675: =(AA675*100)/AB675 -> 104.80101073910296 | AD675: =(X675*4)+(Z675*2) -> 36
A677: OAKLEIGH | C677: 5 | D677: 4 | E677: =C677*6+D677 -> 34 | G677: 7 | H677: 6 | I677: =G677*6+H677 -> 48 | K677: 12 | L677: 9 | M677: =K677*6+L677 -> 81 | O677: 15 | P677: 13 | Q677: =O677*6+P677 -> 103 | S677: OAKLEIGH | W677: WILLIAMSTOWN | X677: 8 | Y677: 7 | Z677: 0 | AA677: 1810 | AB677: 1642 | AC677: =(AA677*100)/AB677 -> 110.23142509135201 | AD677: =(X677*4)+(Z677*2) -> 32
A678: BRUNSWICK | C678: 1 | D678: 1 | E678: =C678*6+D678 -> 7 | G678: 4 | H678: 3 | I678: =G678*6+H678 -> 27 | K678: 7 | L678: 6 | M678: =K678*6+L678 -> 48 | O678: 11 | P678: 9 | Q678: =O678*6+P678 -> 75 | S678: FITZPATRICK | W678: OAKLEIGH | X678: 8 | Y678: 7 | Z678: 0 | AA678: 1652 | AB678: 1574 | AC678: =(AA678*100)/AB678 -> 104.95552731893265 | AD678: =(X678*4)+(Z678*2) -> 32
A679: BEST PLAYERS | W679: WAVERLEY | X679: 8 | Y679: 7 | Z679: 0 | AA679: 1633 | AB679: 1585 | AC679: =(AA679*100)/AB679 -> 103.02839116719242 | AD679: =(X679*4)+(Z679*2) -> 32
A680: OAKLEIGH | C680: LEISHMAN | F680: TAYLOR | I680: WENN | L680: THOMAS | O680: HARTLEY | R680: COLLINS | W680: WERRIBEE | X680: 6 | Y680: 9 | Z680: 0 | AA680: 1657 | AB680: 1837 | AC680: =(AA680*100)/AB680 -> 90.201415351115955 | AD680: =(X680*4)+(Z680*2) -> 24
A681: BRUNSWICK | C681: BYE | F681: NOLAN | I681: LAWRENCE | L681: DOLAN | W681: NORTHCOTE | X681: 4 | Y681: 11 | Z681: 0 | AA681: 1508 | AB681: 1746 | AC681: =(AA681*100)/AB681 -> 86.368843069874004 | AD681: =(X681*4)+(Z681*2) -> 16
A682: GOALKICKERS | W682: BOX HILL | X682: 1 | Y682: 14 | Z682: 0 | AA682: 1321 | AB682: 2162 | AC682: =(AA682*100)/AB682 -> 61.100832562442186 | AD682: =(X682*4)+(Z682*2) -> 4
A683: OAKLEIGH | C683: THOMAS 6 | F683: McDONALD 3 | I683: LEISHMAN 2 | L683: LENNIE | N683: PLUMB | P683: WENN | R683: WALSH
A684: BRUNSWICK | C684: BYE 5 | E684: SCULLY 2 | G684: GUNSTON | I684: CROTTY | K684: SAHLBERG | N684: TOY
A686: WILLIAMSTOWN | C686: 6 | D686: 4 | E686: =C686*6+D686 -> 40 | G686: 10 | H686: 12 | I686: =G686*6+H686 -> 72 | K686: 14 | L686: 14 | M686: =K686*6+L686 -> 98 | O686: 19 | P686: 17 | Q686: =O686*6+P686 -> 131 | S686: WERRIBEE
A687: WERRIBEE | C687: 4 | D687: 2 | E687: =C687*6+D687 -> 26 | G687: 8 | H687: 3 | I687: =G687*6+H687 -> 51 | K687: 13 | L687: 5 | M687: =K687*6+L687 -> 83 | O687: 18 | P687: 10 | Q687: =O687*6+P687 -> 118 | S687: OAKLEY
A688: BEST PLAYERS
A689: WILLIAMSTOWN | C689: TAYLOR | F689: COURTOT | I689: TWEEDLY | L689: EUDEY | O689: JOHN | R689: SMITH
A690: WERRIBEE | C690: LANCASTER | F690: LEECE | I690: DOUGLAS | L690: JACK | O690: MENADUE | R690: PRICE
A691: GOALKICKERS
A692: WILLIAMSTOWN | C692: TWEEDLY 5 | F692: CHAPMAN 4 | I692: SMITH 4 | K692: KERR | M692: M TAYLOR | O692: S PHILPOTT | R692: WILLIAMS | T692: JOHN | V692: ENRIGHT
A693: WERRIBEE | C693: LEECE 10 | F693: DEMPSTER 4 | I693: MENADUE | L693: HUGHES | N693: LYONS | P693: TAYLOR
A695: MORDIALLOC | C695: 3 | D695: 2 | E695: =C695*6+D695 -> 20 | G695: 4 | H695: 4 | I695: =G695*6+H695 -> 28 | K695: 8 | L695: 4 | M695: =K695*6+L695 -> 52 | O695: 11 | P695: 10 | Q695: =O695*6+P695 -> 76 | S695: NORTHCOTE
A696: NORTHCOTE | C696: 1 | D696: 2 | E696: =C696*6+D696 -> 8 | G696: 7 | H696: 5 | I696: =G696*6+H696 -> 47 | K696: 7 | L696: 14 | M696: =K696*6+L696 -> 56 | O696: 9 | P696: 16 | Q696: =O696*6+P696 -> 70 | S696: COLISIMO
A697: BEST PLAYERS
A698: MORDIALLOC | C698: ROGERSON | F698: GUY | I698: PETERS | K698: McILWRAITH | O698: PARKER | R698: WALSH
A699: NORTHCOTE | C699: McINTYRE | F699: JURGENSTEIN | I699: MEGNA | K699: DILORIO | O699: BRAIN
A700: GOALKICKERS
A701: MORDIALLOC | C701: MAGUIRE 3 | F701: PETERS 3 | H701: DEARON | J701: PETER BARDOEL | M701: PARKER | O701: McILWRAITH | R701: ROGERSON
A702: NORTHCOTE | C702: McKENNA 3 | F702: JURGENSTEIN 2 | J702: EDWARDS | M702: DILORIO | O702: KITE | Q702: GRAHAM
A704: SUNSHINE | C704: 1 | D704: 6 | E704: =C704*6+D704 -> 12 | G704: 4 | H704: 9 | I704: =G704*6+H704 -> 33 | K704: 6 | L704: 9 | M704: =K704*6+L704 -> 45 | O704: 12 | P704: 11 | Q704: =O704*6+P704 -> 83 | S704: BOX HILL
A705: BOX HILL | C705: 0 | D705: 9 | E705: =C705*6+D705 -> 9 | G705: 0 | H705: 9 | I705: =G705*6+H705 -> 9 | K705: 1 | L705: 13 | M705: =K705*6+L705 -> 19 | O705: 1 | P705: 15 | Q705: =O705*6+P705 -> 21 | S705: GROOM
A706: BEST PLAYERS
A707: SUNSHINE | C707: PIECZAK | F707: SCHROEDER | I707: RICHARDSON | L707: SIMMONS | O707: MATTHEWS
A708: BOX HILL | C708: DICKENSON | F708: HARPER | I708: McLERIE | L708: TAYLOR | O708: MARSHALL | R708: RICH
A709: GOALKICKERS
A710: SUNSHINE | C710: SIMMONS 3 | F710: JAMES 2 | H710: PERIERA 2 | K710: SCHROEDER 2 | N710: RICHARDSON | Q710: R MCLEAN | S710: AXON
A711: BOX HILL | C711: GOODEN
A713: ROUND 16 | E713: 27TH JULY | J713: WEATHER | S713: PLAYED AT
D714: 1ST QTR | H714: 2ND QTR | L714: 3RD QTR | P714: FINAL | S714: MORDIALLOC
A715: MORDIALLOC | C715: 3 | D715: 5 | E715: =C715*6+D715 -> 23 | G715: 9 | H715: 9 | I715: =G715*6+H715 -> 63 | K715: 14 | L715: 10 | M715: =K715*6+L715 -> 94 | O715: 19 | P715: 16 | Q715: =O715*6+P715 -> 130 | S715: UMPIRE | X715: LADDER | AB715: ROUND | AD715: 16
A716: OAKLEIGH | C716: 2 | D716: 1 | E716: =C716*6+D716 -> 13 | G716: 5 | H716: 1 | I716: =G716*6+H716 -> 31 | K716: 9 | L716: 6 | M716: =K716*6+L716 -> 60 | O716: 14 | P716: 8 | Q716: =O716*6+P716 -> 92 | S716: MATTHEWS
A717: BEST PLAYERS | W717: TEAM | X717: W | Y717: L | Z717: D | AA717: FOR | AB717: AGST | AC717: % | AD717: PTS
A718: MORDIALLOC | C718: MOORE | F718: WALSH | I718: PETERS | L718: ROGERSON | O718: SLADE | R718: PARKER
A719: OAKLEIGH | C719: COLLINS | F719: HARTLEY | I719: TAYLOR | L719: LEISHMAN | O719: ALLISEY | W719: YARRAVILLE | X719: 12 | Y719: 4 | Z719: 0 | AA719: 1919 | AB719: 1549 | AC719: =(AA719*100)/AB719 -> 123.88637830858619 | AD719: =(X719*4)+(Z719*2) -> 48
A720: GOALKICKERS | R720: GUY | W720: BRUNSWICK | X720: 11 | Y720: 5 | Z720: 0 | AA720: 1908 | AB720: 1521 | AC720: =(AA720*100)/AB720 -> 125.44378698224853 | AD720: =(X720*4)+(Z720*2) -> 44
A721: MORDIALLOC | C721: DEATON 3 | F721: NEVILLE 3 | H721: PETER BARDOEL 3 | K721: MOORE 3 | M721: PETERS 3 | O721: ROGERSON | R721: WALSH | T721: PARKER | W721: MORDIALLOC | X721: 10 | Y721: 6 | Z721: 0 | AA721: 1859 | AB721: 1699 | AC721: =(AA721*100)/AB721 -> 109.41730429664509 | AD721: =(X721*4)+(Z721*2) -> 40
A722: OAKLEIGH | C722: LEISHMAN 3 | F722: WOOD 3 | H722: PLUMB 2 | J722: TAYLOR 2 | M722: COLLINS | O722: CURTAIN | Q722: DOYLE | S722: LENNIE | W722: WILLIAMSTOWN | X722: 9 | Y722: 7 | Z722: 0 | AA722: 1975 | AB722: 1699 | AC722: =(AA722*100)/AB722 -> 116.24484991171278 | AD722: =(X722*4)+(Z722*2) -> 36
A724: NORTHCOTE | C724: 4 | D724: 2 | E724: =C724*6+D724 -> 26 | G724: 6 | H724: 4 | I724: =G724*6+H724 -> 40 | K724: 10 | L724: 6 | M724: =K724*6+L724 -> 66 | O724: 13 | P724: 17 | Q724: =O724*6+P724 -> 95 | S724: SUNSHINE | W724: WAVERLEY | X724: 9 | Y724: 7 | Z724: 0 | AA724: 1747 | AB724: 1665 | AC724: =(AA724*100)/AB724 -> 104.92492492492492 | AD724: =(X724*4)+(Z724*2) -> 36
A725: SUNSHINE | C725: 2 | D725: 3 | E725: =C725*6+D725 -> 15 | G725: 7 | H725: 7 | I725: =G725*6+H725 -> 49 | K725: 7 | L725: 9 | M725: =K725*6+L725 -> 51 | O725: 8 | P725: 12 | Q725: =O725*6+P725 -> 60 | S725: OAKLEY | W725: SUNSHINE | X725: 9 | Y725: 7 | Z725: 0 | AA725: 1719 | AB725: 1678 | AC725: =(AA725*100)/AB725 -> 102.44338498212157 | AD725: =(X725*4)+(Z725*2) -> 36
A726: BEST PLAYERS | W726: OAKLEIGH | X726: 8 | Y726: 8 | Z726: 0 | AA726: 1744 | AB726: 1704 | AC726: =(AA726*100)/AB726 -> 102.34741784037558 | AD726: =(X726*4)+(Z726*2) -> 32
A727: NORTHCOTE | C727: MEGNA | F727: EDWARDS | I727: McQUINN | L727: KITE | N727: P RYAN | Q727: McINTYRE | W727: WERRIBEE | X727: 6 | Y727: 10 | Z727: 0 | AA727: 1737 | AB727: 1951 | AC727: =(AA727*100)/AB727 -> 89.031266017426958 | AD727: =(X727*4)+(Z727*2) -> 24
A728: SUNSHINE | C728: SHERIDAN | F728: PIERCZAK | I728: SIMMONS | L728: FOLEY | N728: JAMES | W728: NORTHCOTE | X728: 5 | Y728: 11 | Z728: 0 | AA728: 1603 | AB728: 1806 | AC728: =(AA728*100)/AB728 -> 88.759689922480618 | AD728: =(X728*4)+(Z728*2) -> 20
A729: GOALKICKERS | W729: BOX HILL | X729: 1 | Y729: 15 | Z729: 0 | AA729: 1378 | AB729: 2327 | AC729: =(AA729*100)/AB729 -> 59.217877094972067 | AD729: =(X729*4)+(Z729*2) -> 4
A730: NORTHCOTE | C730: McKENNA 4 | F730: JURGENSTEIN 2 | I730: P RYAN 2 | K730: M RYAN | M730: EDWARDS | P730: DILORIO | R730: TAIRI | T730: MEGNA
A731: SUNSHINE | C731: JAMES 5 | F731: FOLEY 2 | I731: RICHARDSON
A733: BRUNSWICK | C733: 3 | D733: 2 | E733: =C733*6+D733 -> 20 | G733: 6 | H733: 5 | I733: =G733*6+H733 -> 41 | K733: 11 | L733: 8 | M733: =K733*6+L733 -> 74 | O733: 13 | P733: 13 | Q733: =O733*6+P733 -> 91 | S733: BRUNSWICK
A734: YARRAVILLE | C734: 2 | D734: 7 | E734: =C734*6+D734 -> 19 | G734: 7 | H734: 10 | I734: =G734*6+H734 -> 52 | K734: 7 | L734: 14 | M734: =K734*6+L734 -> 56 | O734: 10 | P734: 16 | Q734: =O734*6+P734 -> 76 | S734: SNOOKS
A735: BEST PLAYERS
A736: BRUNSWICK | C736: NOLAN | F736: DOLAN | I736: HADZILLIAS | L736: BURKE | N736: LAWRENCE | Q736: SAHLBERG
A737: YARRAVILLE | C737: KEOGH | F737: S McGHIE | I737: P RYAN | L737: SHARP | N737: DI NATALE | Q737: O'CONNOR
A738: GOALKICKERS
A739: BRUNSWICK | C739: WEST 2 | E739: GUNSTON 2 | G739: SAHLBERG 2 | J739: LEAHY | L739: LAKER | N739: LAWRENCE | P739: TOY | Q739: HEDLEY | S739: BYE | U739: SCULLY
A740: YARRAVILLE | C740: DI NATALE 2 | F740: P RYAN 2 | I740: PAGAN 2 | K740: BUCKLEY | M740: SHARP | O740: M FOTHERINGHAM | S740: STIBBARD
A742: WILLIAMSTOWN | C742: 8 | D742: 3 | E742: =C742*6+D742 -> 51 | G742: 10 | H742: 5 | I742: =G742*6+H742 -> 65 | K742: 16 | L742: 12 | M742: =K742*6+L742 -> 108 | O742: 25 | P742: 15 | Q742: =O742*6+P742 -> 165 | S742: WILLIAMSTOWN
A743: BOX HILL | C743: 2 | D743: 0 | E743: =C743*6+D743 -> 12 | G743: 5 | H743: 6 | I743: =G743*6+H743 -> 36 | K743: 5 | L743: 6 | M743: =K743*6+L743 -> 36 | O743: 8 | P743: 9 | Q743: =O743*6+P743 -> 57 | S743: FITZPATRICK
A744: BEST PLAYERS
A745: WILLIAMSTOWN | C745: FAIRLEY | F745: EUDEY | I745: M TAYLOR | L745: R SMITH | O745: COURTOT | R745: KERR
A746: BOX HILL | C746: HARPER | F746: RALPH | I746: CONNOLLY | L746: RICH | O746: WITHERS | R746: DICKENSON
A747: GOALKICKERS
A748: WILLIAMSTOWN | C748: FAIRLEY 8 | F748: MONTEBRUNO 4 | I748: GANNON 3 | K748: BURNETT 3 | N748: KERR 2 | P748: TWEEDLY 2 | S748: R SMITH 2 | V748: GOETZ
A749: BOX HILL | C749: WITHERS 5 | F749: DICKENSON | I749: RICH | K749: McGETTIGAN
A751: WAVERLEY | C751: 10 | D751: 6 | E751: =C751*6+D751 -> 66 | G751: 10 | H751: 8 | I751: =G751*6+H751 -> 68 | K751: 13 | L751: 11 | M751: =K751*6+L751 -> 89 | O751: 17 | P751: 12 | Q751: =O751*6+P751 -> 114 | S751: WAVERLEY
A752: WERRIBEE | C752: 3 | D752: 1 | E752: =C752*6+D752 -> 19 | G752: 5 | H752: 3 | I752: =G752*6+H752 -> 33 | K752: 7 | L752: 5 | M752: =K752*6+L752 -> 47 | O752: 12 | P752: 8 | Q752: =O752*6+P752 -> 80 | S752: WILSON
A753: BEST PLAYERS
A754: WAVERLEY | C754: HOLDSWORTH | F754: STYLES | I754: SULLIVAN | L754: BARNES | O754: WENBORNE | R754: WILLIAMS
A755: WERRIBEE | C755: DEMPSTER | F755: DOUGLAS | I755: SMITH | L755: JACK | O755: BREEN | R755: TAYLOR
A756: GOALKICKERS
A757: WAVERLEY | C757: P ANGELIS 7 | F757: SULLIVAN 3 | I757: BARNES 3 | K757: COSTELLO 3 | N757: DAVIES
A758: WERRIBEE | C758: DEMPSTER 5 | F758: BREEN 4 | I758: WILLIAMS | L758: LEECE | N758: MENADUE
A760: ROUND 17 | E760: 3RD AUGUST | J760: WEATHER | S760: PLAYED AT
D761: 1ST QTR | H761: 2ND QTR | L761: 3RD QTR | P761: FINAL | S761: NORTHCOTE
A762: NORTHCOTE | C762: 5 | D762: 3 | E762: =C762*6+D762 -> 33 | G762: 9 | H762: 4 | I762: =G762*6+H762 -> 58 | K762: 12 | L762: 12 | M762: =K762*6+L762 -> 84 | O762: 15 | P762: 17 | Q762: =O762*6+P762 -> 107 | S762: UMPIRE | X762: LADDER | AB762: ROUND | AD762: 17
A763: WILLIAMSTOWN | C763: 1 | D763: 2 | E763: =C763*6+D763 -> 8 | G763: 3 | H763: 7 | I763: =G763*6+H763 -> 25 | K763: 10 | L763: 10 | M763: =K763*6+L763 -> 70 | O763: 14 | P763: 14 | Q763: =O763*6+P763 -> 98 | S763: STABB
A764: BEST PLAYERS | W764: TEAM | X764: W | Y764: L | Z764: D | AA764: FOR | AB764: AGST | AC764: % | AD764: PTS
A765: NORTHCOTE | C765: McKENNA | F765: EDWARDS | I765: McINTYRE | L765: MEGNA | N765: JURGENSTEIN | Q765: McQUINN
A766: WILLIAMSTOWN | C766: SINNOTT | F766: TWEEDLY | I766: FAIRLEY | L766: KERR | N766: TAYLOR | Q766: JOHN | W766: YARRAVILLE | X766: 13 | Y766: 4 | Z766: 0 | AA766: 2058 | AB766: 1646 | AC766: =(AA766*100)/AB766 -> 125.03037667071689 | AD766: =(X766*4)+(Z766*2) -> 52
A767: GOALKICKERS | W767: BRUNSWICK | X767: 11 | Y767: 6 | Z767: 0 | AA767: 1983 | AB767: 1617 | AC767: =(AA767*100)/AB767 -> 122.63450834879406 | AD767: =(X767*4)+(Z767*2) -> 44
A768: NORTHCOTE | C768: McKENNA 8 | F768: JURGENSTEIN 3 | I768: ROULSTON | L768: MEGNA | N768: McNEILL | P768: P RYAN | W768: MORDIALLOC | X768: 10 | Y768: 7 | Z768: 0 | AA768: 1956 | AB768: 1838 | AC768: =(AA768*100)/AB768 -> 106.42002176278564 | AD768: =(X768*4)+(Z768*2) -> 40
A769: WILLIAMSTOWN | C769: CHAPMAN 4 | F769: JOHN 3 | I769: FAIELEY 3 | L769: KERR | N769: TWEEDLY | Q769: GANNON | S769: GOETZ | W769: WAVERLEY | X769: 10 | Y769: 7 | Z769: 0 | AA769: 1843 | AB769: 1740 | AC769: =(AA769*100)/AB769 -> 105.91954022988506 | AD769: =(X769*4)+(Z769*2) -> 40
W770: WILLIAMSTOWN | X770: 9 | Y770: 8 | Z770: 0 | AA770: 2073 | AB770: 1806 | AC770: =(AA770*100)/AB770 -> 114.78405315614619 | AD770: =(X770*4)+(Z770*2) -> 36
A771: OAKLEIGH | C771: 3 | D771: 5 | E771: =C771*6+D771 -> 23 | G771: 11 | H771: 7 | I771: =G771*6+H771 -> 73 | K771: 15 | L771: 10 | M771: =K771*6+L771 -> 100 | O771: 23 | P771: 12 | Q771: =O771*6+P771 -> 150 | S771: OAKLEIGH | W771: OAKLEIGH | X771: 9 | Y771: 8 | Z771: 0 | AA771: 1894 | AB771: 1771 | AC771: =(AA771*100)/AB771 -> 106.94522868435912 | AD771: =(X771*4)+(Z771*2) -> 36
A772: SUNSHINE | C772: 2 | D772: 6 | E772: =C772*6+D772 -> 18 | G772: 4 | H772: 8 | I772: =G772*6+H772 -> 32 | K772: 7 | L772: 14 | M772: =K772*6+L772 -> 56 | O772: 8 | P772: 19 | Q772: =O772*6+P772 -> 67 | S772: CASEY | W772: SUNSHINE | X772: 9 | Y772: 8 | Z772: 0 | AA772: 1786 | AB772: 1828 | AC772: =(AA772*100)/AB772 -> 97.702407002188181 | AD772: =(X772*4)+(Z772*2) -> 36
A773: BEST PLAYERS | W773: WERRIBEE | X773: 7 | Y773: 10 | Z773: 0 | AA773: 1891 | AB773: 2071 | AC773: =(AA773*100)/AB773 -> 91.308546595847417 | AD773: =(X773*4)+(Z773*2) -> 28
A774: OAKLEIGH | C774: McDONALD | F774: LEISHMAN | I774: CURTAIN | L774: THOMAS | N774: HARTLEY | Q774: WENN | W774: NORTHCOTE | X774: 6 | Y774: 11 | Z774: 0 | AA774: 1710 | AB774: 1904 | AC774: =(AA774*100)/AB774 -> 89.810924369747895 | AD774: =(X774*4)+(Z774*2) -> 24
A775: SUNSHINE | C775: M McLEAN | F775: BRETT | I775: LEWIS | L775: JAMES | N775: FOLEY | W775: BOX HILL | X775: 1 | Y775: 16 | Z775: 0 | AA775: 1498 | AB775: 2481 | AC775: =(AA775*100)/AB775 -> 60.378879484079 | AD775: =(X775*4)+(Z775*2) -> 4
A776: GOALKICKERS
A777: OAKLEIGH | C777: THOMAS 5 | F777: WOOD 4 | H777: WENN 3 | J777: NEARY 3 | L777: TAYLOR 2 | N777: ALLISEY 2 | P777: COLLINS 2 | R777: WALSH | T777: McDONALD
A778: SUNSHINE | C778: PEREIRA 4 | F778: SIMMONS | I778: BRETT | K778: LEWIS | M778: JONES
A780: YARRAVILLE | C780: 3 | D780: 5 | E780: =C780*6+D780 -> 23 | G780: 10 | H780: 8 | I780: =G780*6+H780 -> 68 | K780: 16 | L780: 10 | M780: =K780*6+L780 -> 106 | O780: 21 | P780: 13 | Q780: =O780*6+P780 -> 139 | S780: YARRAVILLE
A781: MORDIALLOC | C781: 5 | D781: 4 | E781: =C781*6+D781 -> 34 | G781: 5 | H781: 5 | I781: =G781*6+H781 -> 35 | K781: 10 | L781: 11 | M781: =K781*6+L781 -> 71 | O781: 14 | P781: 13 | Q781: =O781*6+P781 -> 97 | S781: TORNEY
A782: BEST PLAYERS
A783: YARRAVILLE | C783: PAGAN | F783: BREHENEY | I783: P RYAN | L783: SAIT | N783: BUCKLEY | Q783: LEITCH
A784: MORDIALLOC | C784: MOORE | F784: GUY | I784: PARKER | L784: LANG | N784: BATTY | Q784: SLADE
A785: GOALKICKERS
A786: YARRAVILLE | C786: M FOTHERINGHAM 5 | G786: BREHENEY 4 | J786: BUCKLEY 4 | L786: SAIT 3 | N786: P RYAN 2 | P786: PAGAN | R786: LAXTON | T786: DI NATALE
A787: MORDIALLOC | C787: DEATON 3 | F787: PARKER 3 | H787: NEVILLE 2 | J787: MOORE 2 | L787: GUY 2 | N787: MAGUIRE | P787: ROGERSON
A789: WAVERLEY | C789: 5 | D789: 7 | E789: =C789*6+D789 -> 37 | G789: 9 | H789: 14 | I789: =G789*6+H789 -> 68 | K789: 10 | L789: 18 | M789: =K789*6+L789 -> 78 | O789: 13 | P789: 18 | Q789: =O789*6+P789 -> 96 | S789: WAVERLEY
A790: BRUNSWICK | C790: 4 | D790: 3 | E790: =C790*6+D790 -> 27 | G790: 6 | H790: 4 | I790: =G790*6+H790 -> 40 | K790: 9 | L790: 9 | M790: =K790*6+L790 -> 63 | O790: 11 | P790: 9 | Q790: =O790*6+P790 -> 75 | S790: VERGONA
A791: BEST PLAYERS
A792: WAVERLEY | C792: COSTELLO | F792: WILLIAMS | I792: HOLDSWORTH | L792: KAYE | N792: LOVELL | Q792: PRITCHETT
A793: BRUNSWICK | C793: WEST | F793: LAKER | I793: DOLAN | L793: LEAHY
A794: GOALKICKERS
A795: WAVERLEY | C795: CHALKER 3 | F795: P ANGELIS 3 | I795: COSTELLO 2 | K795: PRITCHETT 2 | N795: SULLIVAN | P795: DAVIES | R795: KAYE
A796: BRUNSWICK | C796: WEST 3 | E796: GUNSTON 2 | H796: TOY 2 | J796: LAKER | L796: LEAHY | N796: BYE | O796: SAHLBERG
A798: WERRIBEE | C798: 8 | D798: 3 | E798: =C798*6+D798 -> 51 | G798: 12 | H798: 6 | I798: =G798*6+H798 -> 78 | K798: 17 | L798: 17 | M798: =K798*6+L798 -> 119 | O798: 24 | P798: 10 | Q798: =O798*6+P798 -> 154 | S798: WERRIBEE
A799: BOX HILL | C799: 4 | D799: 3 | E799: =C799*6+D799 -> 27 | G799: 10 | H799: 3 | I799: =G799*6+H799 -> 63 | K799: 14 | L799: 8 | M799: =K799*6+L799 -> 92 | O799: 18 | P799: 12 | Q799: =O799*6+P799 -> 120 | S799: MORGAN
A800: BEST PLAYERS
A801: WERRIBEE | C801: LEECE | F801: DEMPSTER | I801: GUDDE | L801: BREEN | O801: TAYLOR | R801: WISE
A802: BOX HILL | C802: HARPER | F802: RICH | I802: WITHERS | L802: McFARLANE | O802: MARSHALL | R802: CRUSE
A803: GOALKICKERS
A804: WERRIBEE | C804: LEECE 15 | F804: BREEN 3 | H804: DOUGLAS 3 | K804: MITCHELL | N804: WILLIAMS | Q804: MENADUE
A805: BOX HILL | C805: WITHERS 8 | F805: GOODEN 3 | I805: CRUSE 3 | K805: MARSHALL 2 | N805: LEAN | P805: SAUNDERS
A807: ROUND 18 | E807: 10TH AUGUST | J807: WEATHER | S807: PLAYED AT
D808: 1ST QTR | H808: 2ND QTR | L808: 3RD QTR | P808: FINAL | S808: WILLIAMSTOWN
A809: WILLIAMSTOWN | C809: 1 | D809: 1 | E809: =C809*6+D809 -> 7 | G809: 9 | H809: 5 | I809: =G809*6+H809 -> 59 | K809: 10 | L809: 8 | M809: =K809*6+L809 -> 68 | O809: 13 | P809: 12 | Q809: =O809*6+P809 -> 90 | S809: UMPIRE | X809: LADDER | AB809: ROUND | AD809: 18
A810: OAKLEIGH | C810: 4 | D810: 2 | E810: =C810*6+D810 -> 26 | G810: 4 | H810: 4 | I810: =G810*6+H810 -> 28 | K810: 9 | L810: 10 | M810: =K810*6+L810 -> 64 | O810: 12 | P810: 13 | Q810: =O810*6+P810 -> 85 | S810: GROOM
A811: BEST PLAYERS | W811: TEAM | X811: W | Y811: L | Z811: D | AA811: FOR | AB811: AGST | AC811: % | AD811: PTS
A812: WILLIAMSTOWN | C812: CONDON | F812: EUDEY | I812: R SMITH | L812: KERR | O812: TWEEDLY | R812: KENNEDY
A813: OAKLEIGH | C813: TAYLOR | F813: LEISHMAN | I813: COLLINS | L813: CURTAIN | O813: WENN | R813: KILLEAN | W813: YARRAVILLE | X813: 14 | Y813: 4 | Z813: 0 | AA813: 2121 | AB813: 1703 | AC813: =(AA813*100)/AB813 -> 124.54492072812684 | AD813: =(X813*4)+(Z813*2) -> 56
A814: GOALKICKERS | W814: BRUNSWICK | X814: 12 | Y814: 6 | Z814: 0 | AA814: 2092 | AB814: 1669 | AC814: =(AA814*100)/AB814 -> 125.34451767525465 | AD814: =(X814*4)+(Z814*2) -> 48
A815: WILLIAMSTOWN | C815: R SMITH 3 | F815: COATES 2 | H815: EUDEY 2 | J815: BURNETT 2 | L815: KERR | N815: MONTEBRUNO | Q815: ENRIGHT | S815: FAIRLEY | W815: WAVERLEY | X815: 11 | Y815: 7 | Z815: 0 | AA815: 1939 | AB815: 1826 | AC815: =(AA815*100)/AB815 -> 106.18838992332968 | AD815: =(X815*4)+(Z815*2) -> 44
A816: OAKLEIGH | C816: WALSH 3 | E816: NEARY 2 | G816: LEISHMAN 2 | J816: CURTAIN | L816: ALLISEY | N816: WOOD | P816: TAYLOR | R816: McDONALD | W816: WILLIAMSTOWN | X816: 10 | Y816: 8 | Z816: 0 | AA816: 2163 | AB816: 1891 | AC816: =(AA816*100)/AB816 -> 114.38392384981491 | AD816: =(X816*4)+(Z816*2) -> 40
A818: YARRAVILLE | C818: 2 | D818: 4 | E818: =C818*6+D818 -> 16 | G818: 2 | H818: 5 | I818: =G818*6+H818 -> 17 | K818: 5 | L818: 11 | M818: =K818*6+L818 -> 41 | O818: 8 | P818: 15 | Q818: =O818*6+P818 -> 63 | S818: SUNSHINE | W818: MORDIALLOC | X818: 10 | Y818: 8 | Z818: 0 | AA818: 2042 | AB818: 1934 | AC818: =(AA818*100)/AB818 -> 105.58428128231644 | AD818: =(X818*4)+(Z818*2) -> 40
A819: SUNSHINE | C819: 1 | D819: 2 | E819: =C819*6+D819 -> 8 | G819: 3 | H819: 10 | I819: =G819*6+H819 -> 28 | K819: 5 | L819: 12 | M819: =K819*6+L819 -> 42 | O819: 7 | P819: 15 | Q819: =O819*6+P819 -> 57 | S819: MORGAN | W819: OAKLEIGH | X819: 9 | Y819: 9 | Z819: 0 | AA819: 1979 | AB819: 1861 | AC819: =(AA819*100)/AB819 -> 106.34067705534659 | AD819: =(X819*4)+(Z819*2) -> 36
A820: BEST PLAYERS | W820: SUNSHINE | X820: 9 | Y820: 9 | Z820: 0 | AA820: 1843 | AB820: 1891 | AC820: =(AA820*100)/AB820 -> 97.461660497091486 | AD820: =(X820*4)+(Z820*2) -> 36
A821: YARRAVILLE | C821: S McGHIE | F821: PAGAN | I821: LEITCH | L821: DI NATALE | O821: SAIT | Q821: JONES | W821: NORTHCOTE | X821: 7 | Y821: 11 | Z821: 0 | AA821: 1850 | AB821: 1950 | AC821: =(AA821*100)/AB821 -> 94.871794871794876 | AD821: =(X821*4)+(Z821*2) -> 28
A822: SUNSHINE | C822: T BRETT | F822: PIERCZAK | I822: SHERIDAN | L822: MATTHEWS | W822: WERRIBEE | X822: 7 | Y822: 11 | Z822: 0 | AA822: 1943 | AB822: 2180 | AC822: =(AA822*100)/AB822 -> 89.128440366972484 | AD822: =(X822*4)+(Z822*2) -> 28
A823: GOALKICKERS | W823: BOX HILL | X823: 1 | Y823: 17 | Z823: 0 | AA823: 1544 | AB823: 2621 | AC823: =(AA823*100)/AB823 -> 58.908813429988555 | AD823: =(X823*4)+(Z823*2) -> 4
A824: YARRAVILLE | C824: M FOTHERINGHAM | G824: WARD | I824: DI NATALE | K824: GRAY | M824: BUCKLEY | O824: RADZIMINSKI | R824: BREHENEY | T824: PAGAN
A825: SUNSHINE | C825: LEWIS 2 | F825: SIMMONS 2 | I825: RICHARDSON | L825: JAMES | N825: FOLEY
A827: NORTHCOTE | C827: 6 | D827: 9 | E827: =C827*6+D827 -> 45 | G827: 9 | H827: 12 | I827: =G827*6+H827 -> 66 | K827: 17 | L827: 16 | M827: =K827*6+L827 -> 118 | O827: 20 | P827: 20 | Q827: =O827*6+P827 -> 140 | S827: BOX HILL
A828: BOX HILL | C828: 0 | D828: 2 | E828: =C828*6+D828 -> 2 | G828: 4 | H828: 4 | I828: =G828*6+H828 -> 28 | K828: 6 | L828: 7 | M828: =K828*6+L828 -> 43 | O828: 6 | P828: 10 | Q828: =O828*6+P828 -> 46 | S828: WILSON
A829: BEST PLAYERS
A830: NORTHCOTE | C830: EDWARDS | F830: P RYAN | I830: McQUINN | L830: McINTYRE | O830: KITE | R830: M RYAN
A831: BOX HILL | C831: SUMMERS | F831: HARPER | I831: WITHERS | L831: McFARLANE | O831: CRUSE | R831: RALPH
A832: GOALKICKERS
A833: NORTHCOTE | C833: McKENNA 7 | F833: P RYAN 3 | H833: ROULSTON 3 | K833: THORNELOE 2 | N833: JURGENSTEIN 2 | Q833: M RYAN 2 | S833: MITCHELL
A834: BOX HILL | C834: MARSHALL 2 | F834: WITHERS 2 | I834: LEAN | K834: LENNOX
A836: WAVERLEY | C836: 6 | D836: 6 | E836: =C836*6+D836 -> 42 | G836: 6 | H836: 6 | I836: =G836*6+H836 -> 42 | K836: 13 | L836: 10 | M836: =K836*6+L836 -> 88 | O836: 14 | P836: 12 | Q836: =O836*6+P836 -> 96 | S836: MORDIALLOC
A837: MORDIALLOC | C837: 0 | D837: 1 | E837: =C837*6+D837 -> 1 | G837: 6 | H837: 8 | I837: =G837*6+H837 -> 44 | K837: 8 | L837: 10 | M837: =K837*6+L837 -> 58 | O837: 12 | P837: 14 | Q837: =O837*6+P837 -> 86 | S837: CASEY
A838: BEST PLAYERS
A839: WAVERLEY | C839: WILLIAMS | F839: SULLIVAN | I839: McLURE | L839: LOVELL | O839: KAYE | R839: KINNABURGH
A840: MORDIALLOC | C840: BATTY | F840: SLADE | I840: ROGERSON | L840: McILWRAITH | O840: GUY | R840: CRITCH
A841: GOALKICKERS
A842: WAVERLEY | C842: P ANGELIS 5 | F842: McLURE 2 | H842: SULLIVAN 2 | K842: COSTELLO 2 | N842: HOLDSWORTH | Q842: KAYE | S842: BEDDOE
A843: MORDIALLOC | C843: McILWRAITH 3 | F843: PARKER 2 | H843: GUY 2 | J843: ROGERSON 2 | M843: MAGUIRE | O843: SLADE | Q843: PETERS
A845: BRUNSWICK | C845: 4 | D845: 6 | E845: =C845*6+D845 -> 30 | G845: 6 | H845: 8 | I845: =G845*6+H845 -> 44 | K845: 12 | L845: 13 | M845: =K845*6+L845 -> 85 | O845: 15 | P845: 19 | Q845: =O845*6+P845 -> 109 | S845: BRUNSWICK
A846: WERRIBEE | C846: 1 | D846: 1 | E846: =C846*6+D846 -> 7 | G846: 2 | H846: 3 | I846: =G846*6+H846 -> 15 | K846: 6 | L846: 6 | M846: =K846*6+L846 -> 42 | O846: 7 | P846: 10 | Q846: =O846*6+P846 -> 52 | S846: TORNEY
A847: BEST PLAYERS
A848: BRUNSWICK | C848: BURKE | F848: SMITH | I848: WEST | L848: DOLAN | O848: SAHLBERG | R848: LAWRENCE
A849: WERRIBEE | C849: DOUGLAS | F849: LANCASTER | I849: GUDDE | L849: MENADUE | O849: WISE
A850: GOALKICKERS
A851: BRUNSWICK | C851: GUNSTON 5 | F851: BYE 4 | H851: WEST 2 | J851: DOLAN | L851: LAKER | N851: CROTTY | P851: MARANTELLI
A852: WERRIBEE | C852: LEECE 2 | F852: DAY 2 | H852: GUDDE | J852: MITCHELL | M852: BREEN
A854: FINALS
A855: 1ST SEMI | E855: 17TH AUGUST | J855: WEATHER | S855: PLAYED AT
D856: 1ST QTR | H856: 2ND QTR | L856: 3RD QTR | P856: FINAL | S856: TOORAK PARK
A857: WAVERLEY | C857: 8 | D857: 5 | E857: =C857*6+D857 -> 53 | G857: 11 | H857: 8 | I857: =G857*6+H857 -> 74 | K857: 18 | L857: 11 | M857: =K857*6+L857 -> 119 | O857: 21 | P857: 13 | Q857: =O857*6+P857 -> 139 | S857: UMPIRE
A858: WILLIAMSTOWN | C858: 2 | D858: 3 | E858: =C858*6+D858 -> 15 | G858: 6 | H858: 8 | I858: =G858*6+H858 -> 44 | K858: 8 | L858: 11 | M858: =K858*6+L858 -> 59 | O858: 13 | P858: 18 | Q858: =O858*6+P858 -> 96 | S858: CASEY/TORNEY
A859: BEST PLAYERS
A860: WAVERLEY | C860: BARNES | F860: CARLSON | I860: SULLIVAN | L860: McLURE | O860: LOVELL | R860: WILLIAMS
A861: WILLIAMSTOWN | C861: EUDEY | F861: COURTOT | I861: TWEEDLY | L861: FAIRLEY | O861: BURNETT | R861: COATES
A862: GOALKICKERS
A863: WAVERLEY | C863: BARNES 5 | F863: P ANGELIS 4 | I863: McLURE 4 | K863: CHALKER 3 | N863: BEDDOE 2 | P863: SULLIVAN | R863: LOVELL | T863: COSTELLO
A864: WILLIAMSTOWN | C864: TWEEDLY 3 | F864: BURNETT 2 | I864: ENRIGHT 2 | K864: FAIRLEY 2 | M864: KERR | O864: KENNEDY | Q864: MONTEBRUNO | T864: EUDEY
A866: 2ND SEMI | E866: 24TH AUGUST | J866: WEATHER
A867: BRUNSWICK | C867: 8 | D867: 8 | E867: =C867*6+D867 -> 56 | G867: 11 | H867: 11 | I867: =G867*6+H867 -> 77 | K867: 16 | L867: 12 | M867: =K867*6+L867 -> 108 | O867: 19 | P867: 16 | Q867: =O867*6+P867 -> 130 | S867: TOORAK PARK
A868: YARRAVILLE | C868: 2 | D868: 1 | E868: =C868*6+D868 -> 13 | G868: 7 | H868: 7 | I868: =G868*6+H868 -> 49 | K868: 12 | L868: 9 | M868: =K868*6+L868 -> 81 | O868: 16 | P868: 12 | Q868: =O868*6+P868 -> 108 | S868: OAKLEY/VERGONA
A869: BEST PLAYERS
A870: BRUNSWICK | C870: NOLAN | F870: WEST | I870: LAKER | K870: CROTTY | O870: HADZILLIAS | R870: GUNSTON
A871: YARRAVILLE | C871: LAXTON | F871: DAVIS | I871: SAIT | K871: M FOTHERINGHAM | O871: DI NATALE | R871: KEOGH
A872: GOALKICKERS
A873: BRUNSWICK | C873: GUNSTON 4 | F873: LAKER 3 | H873: WEST 3 | J873: CLEARY 3 | L873: BYE 2 | N873: NOLAN | P873: CROTTY | R873: SCULLY | T873: TOY
A874: YARRAVILLE | C874: M FOTHERINGHAM 7 | G874: SAIT 2 | I874: BREHENEY 2 | L874: DI NATALE 2 | O874: WARD 2 | Q874: SHARP
A876: PRELIMINARY | E876: 31ST AUGUST | J876: WEATHER
A877: YARRAVILLE | C877: 2 | D877: 8 | E877: =C877*6+D877 -> 20 | G877: 12 | H877: 10 | I877: =G877*6+H877 -> 82 | K877: 17 | L877: 13 | M877: =K877*6+L877 -> 115 | O877: 19 | P877: 16 | Q877: =O877*6+P877 -> 130 | S877: TOORAK PARK
A878: WAVERLEY | C878: 5 | D878: 3 | E878: =C878*6+D878 -> 33 | G878: 8 | H878: 7 | I878: =G878*6+H878 -> 55 | K878: 12 | L878: 8 | M878: =K878*6+L878 -> 80 | O878: 14 | P878: 15 | Q878: =O878*6+P878 -> 99 | S878: WILSON/STABB
A879: BEST PLAYERS
A880: YARRAVILLE | C880: M FOTHERINGHAM | G880: SAIT | I880: P RYAN | L880: RADZIMINSKI | O880: SAVILLE | R880: BREHENEY
A881: WAVERLEY | C881: CLARKE | F881: McLURE | I881: P ANGELIS | L881: BEDDOE
A882: GOALKICKERS
A883: YARRAVILLE | C883: M FOTHERINGHAM 10 | G883: SAVILLE 4 | J883: BREHENEY 2 | M883: DI NATALE | P883: GRAY | R883: SAIT
A884: WAVERLEY | C884: P ANGELIS 6 | F884: McLURE 2 | H884: CHALKER 2 | K884: COSTELLO | N884: HOLDSWORTH | Q884: SULLIVAN | S884: BARNES
A886: GRAND | E886: 7TH SEPTEMBER | J886: WEATHER
A887: BRUNSWICK | C887: 8 | D887: 8 | E887: =C887*6+D887 -> 56 | G887: 9 | H887: 12 | I887: =G887*6+H887 -> 66 | K887: 16 | L887: 22 | M887: =K887*6+L887 -> 118 | O887: 20 | P887: 27 | Q887: =O887*6+P887 -> 147 | S887: TOORAK PARK
A888: YARRAVILLE | C888: 2 | D888: 4 | E888: =C888*6+D888 -> 16 | G888: 8 | H888: 10 | I888: =G888*6+H888 -> 58 | K888: 9 | L888: 12 | M888: =K888*6+L888 -> 66 | O888: 14 | P888: 14 | Q888: =O888*6+P888 -> 98 | S888: TORNEY/STABB
A889: BEST PLAYERS
A890: BRUNSWICK | C890: NOLAN | F890: SAHLBERG | I890: LAKER | L890: BURKE | O890: TOY | Q890: LAWRENCE
A891: YARRAVILLE | C891: SAIT | F891: BUCKLEY | I891: P RYAN | L891: DAVIS | O891: RADZIMINSKI | R891: WARD
A892: GOALKICKERS
A893: BRUNSWICK | C893: CLEARY 3 | F893: GUNSTON 3 | I893: CROTTY 3 | K893: WEST 2 | M893: NOLAN 2 | O893: SAHLBERG 2 | R893: KIMPTON | T893: DOLAN | V893: LAWRENCE | X893: HUGGARD | Z893: TOY
A894: YARRAVILLE | C894: M FOTHERINGHAM 5 | G894: RADZIMINSKI 3 | J894: SIMPSON 3 | M894: SAIT | N894: DAVIS | P894: BREHENEY