A1: Victorian Football Association
A2: Season 1980 - Division One
A3: © Copyright Wal Williams | F3: First created: 28 July 2015
A4: Contact: joywalwi at gmail dot com | F4: Last updated: 28 July 2015 | W4: VFA Results and tables - Link to the main index page
A5: You are free to copy this document in whole or part provided that proper acknowledgement is given to the author. All rights reserved.
A7: 1980 V.F.A. | B7: SEASON 1ST | F7: DIVISION | CA7: \D | CB7: {GOTO}BJ3~/M{RIGHT 7}{END}{DOWN}~G4~
A8: ROUND 1 | D8: 6TH APRIL | I8: WEATHER | S8: PLAYED AT | CB8: {GOTO}AL3~/M{END}{RIGHT}{END}{DOWN}~P3~
D9: 1ST QTR | H9: 2ND QTR | L9: 3RD QTR | P9: FINAL | S9: COBURG | CB9: {GOTO}BJ23~/M{RIGHT 7}{END}{DOWN}~V4~
A10: COBURG | C10: 6 | D10: 2 | E10: =C10*6+D10 -> 38 | G10: 12 | H10: 7 | I10: =G10*6+H10 -> 79 | K10: 22 | L10: 15 | M10: =K10*6+L10 -> 147 | O10: 27 | P10: 17 | Q10: =O10*6+P10 -> 179 | S10: UMPIRE | X10: LADDER | AB10: ROUND | AD10: 1 | CB10: {GOTO}BJ43~/M{RIGHT 7}{END}{DOWN}~G24~
A11: GEELONG WEST | C11: 4 | D11: 3 | E11: =C11*6+D11 -> 27 | G11: 4 | H11: 10 | I11: =G11*6+H11 -> 34 | K11: 7 | L11: 11 | M11: =K11*6+L11 -> 53 | O11: 14 | P11: 14 | Q11: =O11*6+P11 -> 98 | S11: STABB | CB11: {GOTO}AL23~/M{END}{RIGHT}{END}{DOWN}~P23~
A12: BEST PLAYERS | W12: TEAM | X12: W | Y12: L | Z12: D | AA12: FOR | AB12: AGST | AC12: % | AD12: PTS | CB12: {GOTO}BJ63~/M{RIGHT 7}{END}{DOWN}~V24~
A13: COBURG | D13: DOUGLAS | G13: HALSALL | J13: HALBERT | M13: BURT | O13: COLLINS | Q13: HARTIGAN | CB13: {GOTO}BJ83~/M{RIGHT 7}{END}{DOWN}~G44~
A14: GEELONG WEST | D14: WOOLFE | G14: DENMEAD | J14: GILMORE | M14: DREWETT | O14: YATES | Q14: G WELLS | W14: COBURG | X14: 1 | Y14: 0 | Z14: 0 | AA14: 179 | AB14: 98 | AC14: 182.65306122448979 | AD14: 4 | CB14: {GOTO}AL43~/M{END}{RIGHT}{END}{DOWN}~P43~
A15: GOALKICKERS | R15: COLLINS | W15: PORT MELBOURNE | X15: 1 | Y15: 0 | Z15: 0 | AA15: 155 | AB15: 117 | AC15: 132.47863247863248 | AD15: 4 | CB15: {GOTO}BJ103~/M{RIGHT 7}{END}{DOWN}~V44~
A16: COBURG | D16: SMITH 7 | F16: HALSALL 6 | I16: HALBERT 4 | L16: CLEARY 3 | N16: BURT 2 | P16: FISHER 2 | R16: MILROY | T16: HERBERT | W16: FRANKSTON | X16: 1 | Y16: 0 | Z16: 0 | AA16: 112 | AB16: 106 | AC16: 105.66037735849056 | AD16: 4 | CB16: {GOTO}BJ123~/M{RIGHT 7}{END}{DOWN}~G64~
A17: GEELONG WEST | D17: WOOLFE 4 | G17: RADOJEVIC 3 | J17: S WELLS 2 | M17: DAX 2 | O17: GILMORE | Q17: YATES | S17: HINCK | W17: PRAHRAN | X17: 1 | Y17: 0 | Z17: 0 | AA17: 144 | AB17: 138 | AC17: 104.34782608695652 | AD17: 4 | CB17: {GOTO}AL63~/M{END}{RIGHT}{END}{DOWN}~P63~
CB18: {GOTO}BJ143~/M{RIGHT 7}{END}{DOWN}~V64~
A19: PORT MELBOURNE | C19: 6 | D19: 5 | E19: =C19*6+D19 -> 41 | G19: 12 | H19: 7 | I19: =G19*6+H19 -> 79 | K19: 16 | L19: 11 | M19: =K19*6+L19 -> 107 | O19: 23 | P19: 17 | Q19: =O19*6+P19 -> 155 | S19: PORT MELBOURNE | W19: CAULFIELD | X19: 0 | Y19: 0 | Z19: 1 | AA19: 120 | AB19: 120 | AC19: 100 | AD19: 2 | CB19: {GOTO}BJ163~/M{RIGHT 7}{END}{DOWN}~G84~
A20: CAMBERWELL | C20: 3 | D20: 2 | E20: =C20*6+D20 -> 20 | G20: 7 | H20: 3 | I20: =G20*6+H20 -> 45 | K20: 14 | L20: 6 | M20: =K20*6+L20 -> 90 | O20: 18 | P20: 9 | Q20: =O20*6+P20 -> 117 | S20: GROOM | W20: DANDENONG | X20: 0 | Y20: 0 | Z20: 1 | AA20: 120 | AB20: 120 | AC20: 100 | AD20: 2 | CB20: {GOTO}AL83~/M{END}{RIGHT}{END}{DOWN}~P83~
A21: BEST PLAYERS | W21: SANDRINGHAM | X21: 0 | Y21: 1 | Z21: 0 | AA21: 138 | AB21: 144 | AC21: 95.833333333333329 | AD21: 0 | CB21: {GOTO}BJ183~/M{RIGHT 7}{END}{DOWN}~V84~
A22: PORT MELBOURNE | D22: DERMOTT | G22: DAVIES | I22: HOLT | L22: COOK | N22: AANENSEN | Q22: JIM CHRISTOU | W22: PRESTON | X22: 0 | Y22: 1 | Z22: 0 | AA22: 106 | AB22: 112 | AC22: 94.642857142857139 | AD22: 0 | CB22: {GOTO}BJ203~/M{RIGHT 7}{END}{DOWN}~G104~
A23: CAMBERWELL | D23: FRYER | G23: OLIVER | I23: COWLEY | L23: HAYWOOD | N23: JUDD | Q23: FENTON | W23: CAMBERWELL | X23: 0 | Y23: 1 | Z23: 0 | AA23: 117 | AB23: 155 | AC23: 75.483870967741936 | AD23: 0 | CB23: {GOTO}AL103~/M{END}{RIGHT}{END}{DOWN}~P103~
A24: GOALKICKERS | S24: BIANCO | W24: GEELONG WEST | X24: 0 | Y24: 1 | Z24: 0 | AA24: 98 | AB24: 179 | AC24: 54.74860335195531 | AD24: 0 | CB24: {GOTO}BJ223~/M{RIGHT 7}{END}{DOWN}~V104~
A25: PORT MELBOURNE | D25: COOK 6 | F25: HOLT 5 | H25: JIM CHRISTOU 4 | K25: SWAN 3 | M25: O'RILEY | O25: BRICE | Q25: DERMOTT | S25: EVANS | CB25: {GOTO}BJ243~/M{RIGHT 7}{END}{DOWN}~G124~
A26: CAMBERWELL | D26: COWLEY 6 | G26: HAYWOOD 4 | J26: D'ANGELO 2 | M26: MUIR 2 | O26: FRYER | Q26: MASON | S26: NEILSON | U26: YOUNG | CB26: {GOTO}AL123~/M{END}{RIGHT}{END}{DOWN}~P123~
E27: 13TH APRIL | J27: WEATHER | M27: SOUTH WEST WIND FINE & SUNNY | CB27: {GOTO}BJ263~/M{RIGHT 7}{END}{DOWN}~V124~
A28: CAULFIELD | C28: 4 | D28: 3 | E28: =C28*6+D28 -> 27 | G28: 7 | H28: 13 | I28: =G28*6+H28 -> 55 | K28: 8 | L28: 19 | M28: =K28*6+L28 -> 67 | O28: 16 | P28: 24 | Q28: =O28*6+P28 -> 120 | S28: PRINCES PARK | CB28: {GOTO}BJ283~/M{RIGHT 7}{END}{DOWN}~G144~
A29: DANDENONG | C29: 5 | D29: 6 | E29: =C29*6+D29 -> 36 | G29: 8 | H29: 11 | I29: =G29*6+H29 -> 59 | K29: 13 | L29: 18 | M29: =K29*6+L29 -> 96 | O29: 16 | P29: 24 | Q29: =O29*6+P29 -> 120 | S29: TORNEY | CB29: {GOTO}AL143~/M{END}{RIGHT}{END}{DOWN}~P143~
A30: BEST PLAYERS | CB30: {GOTO}BJ303~/M{RIGHT 7}{END}{DOWN}~V144~
A31: CAULFIELD | D31: EINSEDEL | G31: SUTTIE | J31: BOOTH | M31: MORRISON | P31: AMBLER | R31: DAVIDSON | CB31: {GOTO}BJ323~/M{RIGHT 7}{END}{DOWN}~G164~
A32: DANDENONG | D32: MADDEN | G32: TOWNSEND | J32: BIFFIN | M32: HORAZCKO | P32: WRIGHT | R32: GUY | CB32: {GOTO}AL163~/M{END}{RIGHT}{END}{DOWN}~P163~
A33: GOALKICKERS | CB33: {GOTO}BJ343~/M{RIGHT 7}{END}{DOWN}~V164~
A34: CAULFIELD | D34: DAVIDSON 5 | G34: AMBLER 3 | J34: BOOTH 3 | M34: SHERIDAN 2 | P34: O'SULLIVAN | S34: RUSS | U34: HAWKING | CB34: {HOME}
A35: DANDENONG | D35: BIFFIN 4 | F35: MADDEN 4 | I35: HORAZCKO 2 | L35: ORTON | N35: COUSINS | P35: COVENTRY | R35: WALLACE | U35: GUY | W35: WARD
A37: PRAHRAN | C37: 3 | D37: 3 | E37: =C37*6+D37 -> 21 | G37: 6 | H37: 6 | I37: =G37*6+H37 -> 42 | K37: 14 | L37: 10 | M37: =K37*6+L37 -> 94 | O37: 22 | P37: 12 | Q37: =O37*6+P37 -> 144 | S37: TOORAK PARK
A38: SANDRINGHAM | C38: 5 | D38: 3 | E38: =C38*6+D38 -> 33 | G38: 12 | H38: 12 | I38: =G38*6+H38 -> 84 | K38: 14 | L38: 17 | M38: =K38*6+L38 -> 101 | O38: 20 | P38: 18 | Q38: =O38*6+P38 -> 138 | S38: GROOM
A39: BEST PLAYERS
A40: PRAHRAN | D40: McFAULL | G40: ANDERSON | J40: PREEN | M40: CLARKE | P40: ZEUNART | R40: SMITH
A41: SANDRINGHAM | D41: SIMS | G41: BELL | J41: GIAMPAOLO | M41: CLARK | P41: ELLIOTT | R41: LYONS
A42: GOALKICKERS
A43: PRAHRAN | D43: SMITH 6 | F43: PREEN 5 | H43: CLARKE 5 | J43: STONE 2 | L43: SOULOS | N43: DELLAMARTA | Q43: ZEUNART | S43: DICKSON
A44: SANDRINGHAM | D44: BELL 8 | F44: HUNT 6 | I44: CHAPMAN 2 | L44: CLARK | N44: WAY | P44: BEUS | R44: ELLIOTT
A46: FRANKSTON | C46: 4 | D46: 8 | E46: =C46*6+D46 -> 32 | G46: 10 | H46: 9 | I46: =G46*6+H46 -> 69 | K46: 12 | L46: 16 | M46: =K46*6+L46 -> 88 | O46: 15 | P46: 22 | Q46: =O46*6+P46 -> 112 | S46: FRANKSTON
A47: PRESTON | C47: 4 | D47: 1 | E47: =C47*6+D47 -> 25 | G47: 10 | H47: 6 | I47: =G47*6+H47 -> 66 | K47: 10 | L47: 12 | M47: =K47*6+L47 -> 72 | O47: 15 | P47: 16 | Q47: =O47*6+P47 -> 106 | S47: MATHEWS
A48: BEST PLAYERS
A49: FRANKSTON | D49: MIHOCEK | G49: RUGGLES | J49: BELL | M49: HORLER | P49: S TICKELL | R49: THOMPSON
A50: PRESTON | D50: PREECE | G50: MARTIN | J50: McCULLOCH | M50: McCONNELL | P50: MEESE | R50: MARKS
A51: GOALKICKERS
A52: FRANKSTON | D52: WALTON 3 | G52: SAMPSON 3 | J52: JONES 2 | L52: DISTON 2 | N52: SERAFINI 2 | Q52: KENNEDY | S52: HUMPHREY | V52: BELL
A53: PRESTON | D53: FRAZER 5 | G53: MARKS 4 | J53: JESSOP 2 | M53: CANN 2 | O53: NICLASSEN | R53: MEESE
A55: ROUND 2 | E55: 20TH APRIL | I55: WEATHER | L55: NORTH WEST WIND CLOUDY BUT DRY | S55: PLAYED AT
D56: 1ST QTR | H56: 2ND QTR | L56: 3RD QTR | P56: FINAL | S56: PRESTON
A57: PRESTON | C57: 6 | D57: 3 | E57: =C57*6+D57 -> 39 | G57: 10 | H57: 5 | I57: =G57*6+H57 -> 65 | K57: 13 | L57: 10 | M57: =K57*6+L57 -> 88 | O57: 20 | P57: 19 | Q57: =O57*6+P57 -> 139 | S57: UMPIRE | X57: LADDER | AB57: ROUND | AD57: 2
A58: CAULFIELD | C58: 2 | D58: 5 | E58: =C58*6+D58 -> 17 | G58: 5 | H58: 10 | I58: =G58*6+H58 -> 40 | K58: 8 | L58: 14 | M58: =K58*6+L58 -> 62 | O58: 12 | P58: 17 | Q58: =O58*6+P58 -> 89 | S58: STABB
A59: BEST PLAYERS | W59: TEAM | X59: W | Y59: L | Z59: D | AA59: FOR | AB59: AGST | AC59: % | AD59: PTS
A60: PRESTON | D60: JESSOP | G60: PREECE | J60: McCONNELL | M60: FRAZER | P60: MEESE | R60: McCULLOCH
A61: CAULFIELD | D61: AMBLER | G61: STAIT | J61: EINSEDEL | M61: DAVIDSON | W61: COBURG | X61: 2 | Y61: 0 | Z61: 0 | AA61: 330 | AB61: 238 | AC61: 138.65546218487395 | AD61: 8
A62: GOALKICKERS | W62: PRESTON | X62: 1 | Y62: 1 | Z62: 0 | AA62: 245 | AB62: 201 | AC62: 121.8905472636816 | AD62: 4
A63: PRESTON | D63: JESSOP 7 | F63: FRAZER 6 | I63: McCONNELL 2 | L63: CANN 2 | N63: P MARSHALL | Q63: G MARSHALL | T63: COOPER | W63: SANDRINGHAM | X63: 1 | Y63: 1 | Z63: 0 | AA63: 284 | AB63: 254 | AC63: 111.81102362204724 | AD63: 4
A64: CAULFIELD | D64: BRUMMELLAN 3 | G64: DAVIDSON 2 | J64: HOLDEN 2 | M64: BOOTH 2 | O64: KING | Q64: STAIT | S64: AMBLER | W64: PORT MELBOURNE | X64: 1 | Y64: 1 | Z64: 0 | AA64: 265 | AB64: 263 | AC64: 100.76045627376426 | AD64: 4
A66: COBURG | C66: 4 | D66: 5 | E66: =C66*6+D66 -> 29 | G66: 6 | H66: 10 | I66: =G66*6+H66 -> 46 | K66: 11 | L66: 18 | M66: =K66*6+L66 -> 84 | O66: 22 | P66: 19 | Q66: =O66*6+P66 -> 151 | S66: DANDENONG | W66: FRANKSTON | X66: 1 | Y66: 1 | Z66: 0 | AA66: 257 | AB66: 257 | AC66: 100 | AD66: 4
A67: DANDENONG | C67: 8 | D67: 4 | E67: =C67*6+D67 -> 52 | G67: 13 | H67: 7 | I67: =G67*6+H67 -> 85 | K67: 16 | L67: 10 | M67: =K67*6+L67 -> 106 | O67: 21 | P67: 14 | Q67: =O67*6+P67 -> 140 | S67: VERGONA | W67: PRAHRAN | X67: 1 | Y67: 1 | Z67: 0 | AA67: 258 | AB67: 260 | AC67: 99.230769230769226 | AD67: 4
A68: BEST PLAYERS | W68: CAMBERWELL | X68: 1 | Y68: 1 | Z68: 0 | AA68: 268 | AB68: 300 | AC68: 89.333333333333329 | AD68: 4
A69: COBURG | D69: BEATTIE | G69: CLEARY | J69: BURT | M69: HALBERT | P69: CURRAN | R69: WESCOMBE | W69: GEELONG WEST | X69: 1 | Y69: 1 | Z69: 0 | AA69: 220 | AB69: 293 | AC69: 75.085324232081916 | AD69: 4
A70: DANDENONG | D70: BIFFIN | G70: LAMBERT | J70: DROSCHER | M70: ORTON | P70: MADDEN | W70: DANDENONG | X70: 0 | Y70: 1 | Z70: 1 | AA70: 260 | AB70: 271 | AC70: 95.9409594095941 | AD70: 2
A71: GOALKICKERS | W71: CAULFIELD | X71: 0 | Y71: 1 | Z71: 1 | AA71: 209 | AB71: 259 | AC71: 80.6949806949807 | AD71: 2
A72: COBURG | D72: HALBERT 6 | G72: SMITH 5 | I72: COLLINS 4 | L72: CLEARY 2 | N72: WESCOMBE 2 | Q72: BEATTIE | S72: HERBERT
A73: DANDENONG | D73: BIFFIN 8 | F73: ORTON 3 | H73: MADDEN 3 | J73: LAMBERT | L73: GUY | M73: WALLACE | O73: TOWNSEND | Q73: SHEVLIN | S73: WARD | U73: TAYLOR
A75: SANDRINGHAM | C75: 4 | D75: 5 | E75: =C75*6+D75 -> 29 | G75: 9 | H75: 9 | I75: =G75*6+H75 -> 63 | K75: 17 | L75: 11 | M75: =K75*6+L75 -> 113 | O75: 22 | P75: 14 | Q75: =O75*6+P75 -> 146 | S75: BEACH ROAD
A76: PORT MELBOURNE | C76: 2 | D76: 6 | E76: =C76*6+D76 -> 18 | G76: 9 | H76: 12 | I76: =G76*6+H76 -> 66 | K76: 13 | L76: 16 | M76: =K76*6+L76 -> 94 | O76: 15 | P76: 20 | Q76: =O76*6+P76 -> 110 | S76: MATHEWS
A77: BEST PLAYERS
A78: SANDRINGHAM | D78: HUNT | G78: PLEDGER | J78: SARAU | M78: OSBORNE | P78: BELL | R78: CLARK
A79: PORT MELBOURNE | D79: BIANCO | G79: COOK | J79: BRADBURY | M79: AANENSEN | P79: GOSS | R79: EBEYER
A80: GOALKICKERS
A81: SANDRINGHAM | D81: HUNT 9 | F81: BELL 4 | H81: PLEDGER 2 | K81: WAY 2 | M81: BEUS | N81: CHAPMAN | Q81: KEAST | S81: HAYES | U81: SIMS
A82: PORT MELBOURNE | D82: COOK 8 | G82: BIANCO 4 | J82: JIM CHRISTOU | M82: EBEYER | O82: SWAN
A84: CAMBERWELL | C84: 6 | D84: 3 | E84: =C84*6+D84 -> 39 | G84: 10 | H84: 5 | I84: =G84*6+H84 -> 65 | K84: 18 | L84: 11 | M84: =K84*6+L84 -> 119 | O84: 23 | P84: 13 | Q84: =O84*6+P84 -> 151 | S84: C'WELL
A85: FRANKSTON | C85: 6 | D85: 2 | E85: =C85*6+D85 -> 38 | G85: 11 | H85: 9 | I85: =G85*6+H85 -> 75 | K85: 14 | L85: 10 | M85: =K85*6+L85 -> 94 | O85: 22 | P85: 13 | Q85: =O85*6+P85 -> 145 | S85: SNOOKS
A86: BEST PLAYERS
A87: CAMBERWELL | D87: CHAMBERLAIN | G87: NEILSON | J87: COOK | M87: JUDD | O87: FRYER | Q87: COWLEY
A88: FRANKSTON | D88: WALTON | G88: ALDRIDGE | J88: TICKELL | M88: BELL | O88: BOYD | Q88: SAMPSON
A89: GOALKICKERS
A90: CAMBERWELL | D90: COWLEY 5 | F90: SIMPSON 4 | I90: SPITHILL 3 | K90: FLOWER 3 | M90: CHAMBERLAIN 2 | Q90: SLACIK | S90: FRYER | U90: PRETTO | W90: D'ANGELO | X90: NEILSON | AA90: HAYWOOD
A91: FRANKSTON | D91: SERAFINI 5 | F91: WALTON 5 | I91: ALDRIDGE 3 | L91: HUMPHREY 3 | O91: BOYD | Q91: SAMPSON | S91: MIHOCEK | V91: JONES | X91: DISTON | Z91: BELL
A93: GEELONG WEST | C93: 2 | D93: 6 | E93: =C93*6+D93 -> 18 | G93: 9 | H93: 9 | I93: =G93*6+H93 -> 63 | K93: 12 | L93: 12 | M93: =K93*6+L93 -> 84 | O93: 17 | P93: 20 | Q93: =O93*6+P93 -> 122 | S93: GEELONG WEST
A94: PRAHRAN | C94: 5 | D94: 4 | E94: =C94*6+D94 -> 34 | G94: 8 | H94: 7 | I94: =G94*6+H94 -> 55 | K94: 14 | L94: 10 | M94: =K94*6+L94 -> 94 | O94: 17 | P94: 12 | Q94: =O94*6+P94 -> 114 | S94: CASEY
A95: BEST PLAYERS
A96: GEELONG WEST | D96: YATES | G96: GILMORE | J96: S WELLS | M96: MANSON | P96: HINCK | R96: SCARLETT
A97: PRAHRAN | D97: PREEN | G97: CHAPMAN | J97: KELLY | M97: McGUINNESS
A98: GOALKICKERS
A99: GEELONG WEST | D99: RADOJEVIC 5 | G99: YATES 3 | I99: G WELLS 3 | L99: M BROWNE 3 | O99: S WELLS | Q99: GILMORE | S99: WOOLFE
A100: PRAHRAN | D100: PREEN 6 | F100: SMITH 3 | H100: CLARKE | J100: DELLAMARTA | M100: STONE | O100: THORNE | Q100: CHAPMAN | S100: AUSTIN | U100: PEPE | W100: FOLEY
A102: ROUND 3 | E102: 27TH APRIL | M102: WEATHER | Q102: FINE | S102: PLAYED AT
D103: 1ST QTR | H103: 2ND QTR | L103: 3RD QTR | P103: FINAL | S103: FRANKSTON
A104: FRANKSTON | C104: 4 | D104: 5 | E104: =C104*6+D104 -> 29 | G104: 8 | H104: 7 | I104: =G104*6+H104 -> 55 | K104: 14 | L104: 9 | M104: =K104*6+L104 -> 93 | O104: 23 | P104: 13 | Q104: =O104*6+P104 -> 151 | S104: UMPIRE | X104: LADDER | AB104: ROUND | AD104: 3
A105: SANDRINGHAM | C105: 6 | D105: 3 | E105: =C105*6+D105 -> 39 | G105: 8 | H105: 6 | I105: =G105*6+H105 -> 54 | K105: 13 | L105: 8 | M105: =K105*6+L105 -> 86 | O105: 17 | P105: 11 | Q105: =O105*6+P105 -> 113 | S105: STABB
A106: BEST PLAYERS | W106: TEAM | X106: W | Y106: L | Z106: D | AA106: FOR | AB106: AGST | AC106: % | AD106: PTS
A107: FRANKSTON | D107: HOUSDEN | G107: ALDRIDGE | J107: JEFFREYS | M107: RUGGLES | O107: WALTON | R107: SERAFINI
A108: SANDRINGHAM | D108: CLARK | G108: OSBORNE | J108: LYONS | M108: HAYES | O108: SIMS | W108: COBURG | X108: 3 | Y108: 0 | Z108: 0 | AA108: 466 | AB108: 345 | AC108: 135.07246376811594 | AD108: 12
A109: GOALKICKERS | R109: GRIMBLATT | W109: PRESTON | X109: 2 | Y109: 1 | Z109: 0 | AA109: 406 | AB109: 290 | AC109: 140 | AD109: 8
A110: FRANKSTON | D110: SERAFINI 7 | F110: WALTON 5 | I110: THOMPSON 4 | L110: ALDRIDGE 2 | O110: HUMPHREY 2 | R110: JEFFREY | T110: BELL | W110: PORT MELBOURNE | X110: 2 | Y110: 1 | Z110: 0 | AA110: 466 | AB110: 404 | AC110: 115.34653465346534 | AD110: 8
A111: SANDRINGHAM | D111: HUNT 7 | F111: WAY 2 | H111: BELL 2 | J111: CHAPMAN 2 | M111: HODGES | O111: KEAST | Q111: BEUS | S111: HAYES | W111: FRANKSTON | X111: 2 | Y111: 1 | Z111: 0 | AA111: 408 | AB111: 370 | AC111: 110.27027027027027 | AD111: 8
A113: PRESTON | C113: 7 | D113: 3 | E113: =C113*6+D113 -> 45 | G113: 12 | H113: 10 | I113: =G113*6+H113 -> 82 | K113: 19 | L113: 13 | M113: =K113*6+L113 -> 127 | O113: 24 | P113: 17 | Q113: =O113*6+P113 -> 161 | S113: C'WELL | W113: PRAHRAN | X113: 2 | Y113: 1 | Z113: 0 | AA113: 394 | AB113: 367 | AC113: 107.35694822888283 | AD113: 8
A114: CAMBERWELL | C114: 0 | D114: 2 | E114: =C114*6+D114 -> 2 | G114: 3 | H114: 8 | I114: =G114*6+H114 -> 26 | K114: 6 | L114: 13 | M114: =K114*6+L114 -> 49 | O114: 12 | P114: 17 | Q114: =O114*6+P114 -> 89 | S114: VERGONA | W114: SANDRINGHAM | X114: 1 | Y114: 2 | Z114: 0 | AA114: 397 | AB114: 405 | AC114: 98.024691358024697 | AD114: 4
A115: BEST PLAYERS | W115: CAMBERWELL | X115: 1 | Y115: 2 | Z115: 0 | AA115: 357 | AB115: 461 | AC115: 77.440347071583517 | AD115: 4
A116: PRESTON | D116: McCONNELL | G116: FREEMANTLE | J116: COOPER | M116: MARTIN | O116: MEESE | Q116: FRAZER | W116: GEELONG WEST | X116: 1 | Y116: 2 | Z116: 0 | AA116: 361 | AB116: 494 | AC116: 73.07692307692308 | AD116: 4
A117: CAMBERWELL | D117: TEAKEL | G117: SLACIK | J117: CHAMBERLAIN | M117: NEILSON | W117: DANDENONG | X117: 0 | Y117: 2 | Z117: 1 | AA117: 367 | AB117: 407 | AC117: 90.171990171990174 | AD117: 2
A118: GOALKICKERS | Q118: McCONNELL | W118: CAULFIELD | X118: 0 | Y118: 2 | Z118: 1 | AA118: 316 | AB118: 395 | AC118: 80 | AD118: 2
A119: PRESTON | D119: FRAZER 5 | F119: McGAW 4 | I119: JESSOP 4 | K119: BATT 3 | M119: COOPER 3 | O119: MARTIN 2 | Q119: MARKS | S119: P MARSHALL
A120: CAMBERWELL | D120: FLOWER 4 | G120: SIMPSON 3 | J120: OLIVER 2 | M120: SLACIK | O120: JUDD | Q120: COWLEY
A122: PRAHRAN | C122: 4 | D122: 4 | E122: =C122*6+D122 -> 28 | G122: 10 | H122: 8 | I122: =G122*6+H122 -> 68 | K122: 12 | L122: 10 | M122: =K122*6+L122 -> 82 | O122: 20 | P122: 16 | Q122: =O122*6+P122 -> 136 | S122: TOORAK PARK
A123: DANDENONG | C123: 3 | D123: 8 | E123: =C123*6+D123 -> 26 | G123: 4 | H123: 11 | I123: =G123*6+H123 -> 35 | K123: 12 | L123: 21 | M123: =K123*6+L123 -> 93 | O123: 14 | P123: 23 | Q123: =O123*6+P123 -> 107 | S123: M WILSON
A124: BEST PLAYERS
A125: PRAHRAN | D125: McGUINNESS | G125: JEFFREY | J125: DELLAMARTA | M125: AUSTIN | O125: DICKSON | R125: ZEUNART
A126: DANDENONG | D126: DROSCHER | G126: KNIGHT | J126: ROSS | M126: WALLACE | O126: McCONNELL
A127: GOALKICKERS
A128: PRAHRAN | D128: DICKSON 5 | G128: DELLAMARTA 4 | J128: ZEUNART 3 | M128: THORNE 2 | P128: PREEN 2 | R128: SMITH 2 | U128: CLARKE | W128: AUSTIN
A129: DANDENONG | D129: LAMBERT 3 | G129: WALLACE 2 | J129: BRIESE 2 | M129: MADDEN 2 | P129: ROSS 2 | R129: LUKAS | T129: WRIGHT | V129: TOWNSEND
A131: PORT MELBOURNE | C131: 8 | D131: 6 | E131: =C131*6+D131 -> 54 | G131: 12 | H131: 11 | I131: =G131*6+H131 -> 83 | K131: 17 | L131: 17 | M131: =K131*6+L131 -> 119 | O131: 30 | P131: 21 | Q131: =O131*6+P131 -> 201 | S131: PORT MELBOURNE
A132: GEELONG WEST | C132: 2 | D132: 2 | E132: =C132*6+D132 -> 14 | G132: 8 | H132: 4 | I132: =G132*6+H132 -> 52 | K132: 15 | L132: 7 | M132: =K132*6+L132 -> 97 | O132: 22 | P132: 9 | Q132: =O132*6+P132 -> 141 | S132: TORNEY
A133: BEST PLAYERS
A134: PORT MELBOURNE | D134: JIM CHRISTOU | G134: COOK | J134: BIANCO | M134: JO CHRISTOU | P134: SINCLAIR | S134: EBEYER
A135: GEELONG WEST | D135: G WELLS | G135: BROWNE | J135: S WELLS | M135: TAYLOR | P135: DREWETT
A136: GOALKICKERS
A137: PORT MELBOURNE | D137: COOK 11 | G137: JIM CHRISTOU 7 | J137: BIANCO 4 | M137: BRICE 3 | O137: EVANS 2 | Q137: P GOSS 2 | S137: O'RILEY | U137: O'NEILL
A138: GEELONG WEST | D138: G WELLS 6 | G138: RADOJEVIC 5 | J138: GILMORE 3 | M138: BROWNE 3 | P138: S WELLS 2 | R138: BEATON | T138: YATES | V138: MANSON
A140: COBURG | C140: 1 | D140: 4 | E140: =C140*6+D140 -> 10 | G140: 9 | H140: 10 | I140: =G140*6+H140 -> 64 | K140: 16 | L140: 14 | M140: =K140*6+L140 -> 110 | O140: 20 | P140: 16 | Q140: =O140*6+P140 -> 136 | S140: COBURG
A141: CAULFIELD | C141: 4 | D141: 7 | E141: =C141*6+D141 -> 31 | G141: 6 | H141: 11 | I141: =G141*6+H141 -> 47 | K141: 9 | L141: 14 | M141: =K141*6+L141 -> 68 | O141: 15 | P141: 17 | Q141: =O141*6+P141 -> 107 | S141: FITZPATRICK
A142: BEST PLAYERS
A143: COBURG | D143: HALBERT | G143: DOUGLAS | J143: DOHNT | M143: MILROY | P143: PITT | R143: HARTIGAN
A144: CAULFIELD | D144: RUSS | G144: EINSEDEL | J144: KING | M144: MORRISON | P144: FRIGO
A145: GOALKICKERS
A146: COBURG | D146: SMITH 5 | F146: HALSALL 3 | I146: WESCOMBE 3 | L146: CLEARY 2 | N146: DOUGLAS 2 | Q146: COLLINS 2 | T146: BEATTIE | W146: HALBERT | X146: DOHNT
A147: CAULFIELD | D147: KING 4 | G147: BRUMMELLAN 2 | K147: DAVIDSON 2 | N147: UPFAL 2 | P147: TROTT | R147: O'SULLIVAN | U147: SUTTIE | W147: HOLDEN
A149: ROUND 4 | E149: 4TH MAY | J149: WEATHER | N149: FINE & SUNNY | S149: PLAYED AT
D150: 1ST QTR | H150: 2ND QTR | L150: 3RD QTR | P150: FINAL | S150: PRESTON
A151: COBURG | C151: 5 | D151: 3 | E151: =C151*6+D151 -> 33 | G151: 7 | H151: 10 | I151: =G151*6+H151 -> 52 | K151: 16 | L151: 17 | M151: =K151*6+L151 -> 113 | O151: 17 | P151: 18 | Q151: =O151*6+P151 -> 120 | S151: UMPIRE | X151: LADDER | AB151: ROUND | AD151: 4
A152: PRESTON | C152: 3 | D152: 3 | E152: =C152*6+D152 -> 21 | G152: 9 | H152: 5 | I152: =G152*6+H152 -> 59 | K152: 11 | L152: 7 | M152: =K152*6+L152 -> 73 | O152: 16 | P152: 13 | Q152: =O152*6+P152 -> 109 | S152: GROOM
A153: BEST PLAYERS | W153: TEAM | X153: W | Y153: L | Z153: D | AA153: FOR | AB153: AGST | AC153: % | AD153: PTS
A154: COBURG | D154: HALBERT | G154: PITT | I154: BURT | L154: DOUGLAS | N154: HERBERT | Q154: DOHNT
A155: PRESTON | D155: TOWAN | G155: COOPER | I155: McCULLOCH | L155: MARTIN | N155: PREECE | Q155: JESSOP | W155: COBURG | X155: 4 | Y155: 0 | Z155: 0 | AA155: 586 | AB155: 454 | AC155: 129.07488986784142 | AD155: 16
A156: GOALKICKERS | Q156: WESCOMBE | W156: PRAHRAN | X156: 3 | Y156: 1 | Z156: 0 | AA156: 558 | AB156: 503 | AC156: 110.93439363817097 | AD156: 12
A157: COBURG | D157: HALSALL 4 | G157: HERBERT 3 | J157: BURT 3 | L157: COLLINS 2 | N157: BEATTIE | P157: HALBERT | R157: SMITH | W157: PRESTON | X157: 2 | Y157: 2 | Z157: 0 | AA157: 515 | AB157: 410 | AC157: 125.60975609756098 | AD157: 8
A158: PRESTON | D158: FRAZER 5 | F158: JESSOP 3 | I158: P MARSHALL 3 | L158: BATT 2 | N158: CANN | P158: MARKS | R158: McGAW | W158: SANDRINGHAM | X158: 2 | Y158: 2 | Z158: 0 | AA158: 557 | AB158: 525 | AC158: 106.0952380952381 | AD158: 8
A160: SANDRINGHAM | C160: 3 | D160: 4 | E160: =C160*6+D160 -> 22 | G160: 13 | H160: 7 | I160: =G160*6+H160 -> 85 | K160: 17 | L160: 10 | M160: =K160*6+L160 -> 112 | O160: 24 | P160: 16 | Q160: =O160*6+P160 -> 160 | S160: BEACH ROAD | W160: PORT MELBOURNE | X160: 2 | Y160: 2 | Z160: 0 | AA160: 610 | AB160: 584 | AC160: 104.45205479452055 | AD160: 8
A161: CAMBERWELL | C161: 5 | D161: 5 | E161: =C161*6+D161 -> 35 | G161: 7 | H161: 11 | I161: =G161*6+H161 -> 53 | K161: 11 | L161: 14 | M161: =K161*6+L161 -> 80 | O161: 17 | P161: 18 | Q161: =O161*6+P161 -> 120 | S161: TORNEY | W161: FRANKSTON | X161: 2 | Y161: 2 | Z161: 0 | AA161: 529 | AB161: 518 | AC161: 102.12355212355213 | AD161: 8
A162: BEST PLAYERS | W162: GEELONG WEST | X162: 2 | Y162: 2 | Z162: 0 | AA162: 509 | AB162: 615 | AC162: 82.764227642276424 | AD162: 8
A163: SANDRINGHAM | D163: LYONS | G163: OSBORNE | J163: ELLIOTT | M163: WAY | O163: O'BRIEN | R163: SIMS | W163: DANDENONG | X163: 1 | Y163: 2 | Z163: 1 | AA163: 547 | AB163: 551 | AC163: 99.274047186932847 | AD163: 6
A164: CAMBERWELL | D164: FRYER | G164: HAYWOOD | J164: SPITHILL | M164: SLACIK | O164: COOK | R164: WRIGHT | W164: CAMBERWELL | X164: 1 | Y164: 3 | Z164: 0 | AA164: 477 | AB164: 621 | AC164: 76.811594202898547 | AD164: 4
A165: GOALKICKERS | W165: CAULFIELD | X165: 0 | Y165: 3 | Z165: 1 | AA165: 452 | AB165: 559 | AC165: 80.858676207513412 | AD165: 2
A166: SANDRINGHAM | D166: O'BRIEN 5 | F166: HUNT 5 | H166: LYONS 4 | J166: BELL 2 | L166: ELLIOTT 2 | N166: COELLI | P166: CHAPMAN | R166: HAYES | T166: SIMS | V166: WAY
A167: CAMBERWELL | D167: SLACIK 4 | F167: SIMPSON 2 | I167: FRYER 2 | K167: WALLEY 2 | M167: PRETTO 2 | O167: HAYWOOD | Q167: COOK | R167: KEANE | T167: NEILSON | V167: OLIVER
A169: GEELONG WEST | C169: 9 | D169: 3 | E169: =C169*6+D169 -> 57 | G169: 13 | H169: 13 | I169: =G169*6+H169 -> 91 | K169: 18 | L169: 14 | M169: =K169*6+L169 -> 122 | O169: 22 | P169: 16 | Q169: =O169*6+P169 -> 148 | S169: GEELONG WEST
A170: FRANKSTON | C170: 2 | D170: 4 | E170: =C170*6+D170 -> 16 | G170: 3 | H170: 8 | I170: =G170*6+H170 -> 26 | K170: 11 | L170: 13 | M170: =K170*6+L170 -> 79 | O170: 17 | P170: 19 | Q170: =O170*6+P170 -> 121 | S170: WILSON
A171: BEST PLAYERS
A172: GEELONG WEST | D172: S WELLS | G172: BEEKOF | J172: GILMORE | M172: MANSON | P172: S TAYLOR | S172: RADOJEVIC
A173: FRANKSTON | D173: BREMNER | G173: BELL | J173: GEDDES | M173: HORLER | P173: HOUSDEN | S173: SERAFINI
A174: GOALKICKERS
A175: GEELONG WEST | D175: RADOJEVIC 6 | G175: S WELLS 5 | J175: S TAYLOR 4 | M175: GILMORE 2 | P175: G WELLS 2 | R175: CRICHTON | U175: FOOTE | W175: YATES
A176: FRANKSTON | D176: SERAFINI 6 | G176: WALTON 4 | J176: HUMPHREY 3 | M176: ALDRIDGE 2 | P176: BELL 2
A178: PRAHRAN | C178: 7 | D178: 4 | E178: =C178*6+D178 -> 46 | G178: 14 | H178: 8 | I178: =G178*6+H178 -> 92 | K178: 19 | L178: 12 | M178: =K178*6+L178 -> 126 | O178: 25 | P178: 14 | Q178: =O178*6+P178 -> 164 | S178: PRINCES PARK
A179: CAULFIELD | C179: 4 | D179: 3 | E179: =C179*6+D179 -> 27 | G179: 7 | H179: 9 | I179: =G179*6+H179 -> 51 | K179: 10 | L179: 13 | M179: =K179*6+L179 -> 73 | O179: 20 | P179: 16 | Q179: =O179*6+P179 -> 136 | S179: VERGONA
A180: BEST PLAYERS
A181: PRAHRAN | D181: McGUINNESS | G181: THORNE | J181: McFAULL | M181: ANDERSON | P181: SMITH | S181: TWOMEY
A182: CAULFIELD | D182: TAYLOR | G182: MORRISON | J182: RUSS | M182: BOOTH | P182: EINSEDEL | S182: MAIDMENT
A183: GOALKICKERS
A184: PRAHRAN | D184: SMITH 8 | F184: CLARKE 5 | I184: DELLAMARTA 3 | L184: DICKSON 3 | N184: THORNE 2 | Q184: PEPE 2 | S184: PREEN | U184: JEFFREY
A185: CAULFIELD | D185: MAIDMENT 4 | G185: O'SULLIVAN 4 | J185: DAVIDSON 3 | M185: AMBLER 3 | P185: BRUMMELLAN 3 | S185: TROTT 2 | V185: BOOTH
A187: DANDENONG | C187: 6 | D187: 2 | E187: =C187*6+D187 -> 38 | G187: 17 | H187: 6 | I187: =G187*6+H187 -> 108 | K187: 24 | L187: 12 | M187: =K187*6+L187 -> 156 | O187: 27 | P187: 18 | Q187: =O187*6+P187 -> 180 | S187: DANDENONG
A188: PORT MELBOURNE | C188: 7 | D188: 3 | E188: =C188*6+D188 -> 45 | G188: 12 | H188: 6 | I188: =G188*6+H188 -> 78 | K188: 15 | L188: 9 | M188: =K188*6+L188 -> 99 | O188: 22 | P188: 12 | Q188: =O188*6+P188 -> 144 | S188: CASEY
A189: BEST PLAYERS
A190: DANDENONG | D190: ROSS | G190: BIFFIN | J190: WALLACE | M190: DROSCHER | P190: MADDEN | S190: WRIGHT
A191: PORT MELBOURNE | D191: JO CHRISTOU | G191: COOK | J191: THOMPSON | M191: EVANS | P191: GOSS | S191: DAVIES
A192: GOALKICKERS
A193: DANDENONG | D193: BIFFIN 7 | F193: HORAZCKO 4 | I193: TOWNSEND 4 | L193: MADDEN 3 | N193: PRENDERGAST 3 | R193: LAMBERT 2 | U193: BRIESE 2 | X193: WALLACE | AA193: LUKAS
A194: PORT MELBOURNE | D194: COOK 9 | F194: EVANS 4 | I194: BRICE 2 | K194: BIANCO 2 | M194: O'RILEY | O194: JIM CHRISTOU | R194: SWAN | T194: ALLENDER | W194: EBEYER
A196: ROUND 5 | E196: 11TH MAY | M196: WEATHER | S196: PLAYED AT
D197: 1ST QTR | H197: 2ND QTR | L197: 3RD QTR | P197: FINAL | S197: PORT MELBOURNE
A198: PORT MELBOURNE | C198: 9 | D198: 4 | E198: =C198*6+D198 -> 58 | G198: 11 | H198: 7 | I198: =G198*6+H198 -> 73 | K198: 17 | L198: 14 | M198: =K198*6+L198 -> 116 | O198: 20 | P198: 18 | Q198: =O198*6+P198 -> 138 | S198: UMPIRE | X198: LADDER | AB198: ROUND | AD198: 5
A199: PRAHRAN | C199: 4 | D199: 0 | E199: =C199*6+D199 -> 24 | G199: 9 | H199: 5 | I199: =G199*6+H199 -> 59 | K199: 12 | L199: 8 | M199: =K199*6+L199 -> 80 | O199: 15 | P199: 16 | Q199: =O199*6+P199 -> 106 | S199: STABB
A200: BEST PLAYERS | W200: TEAM | X200: W | Y200: L | Z200: D | AA200: FOR | AB200: AGST | AC200: % | AD200: PTS
A201: PORT MELBOURNE | D201: GOSS | G201: EBEYER | I201: SINCLAIR | L201: BRICE | N201: JIM CHRISTOU | Q201: DAVIES
A202: PRAHRAN | D202: TWOMEY | G202: STONE | I202: McFAULL | L202: THORNE | N202: CHAPMAN | Q202: McGUINNESS | W202: COBURG | X202: 5 | Y202: 0 | Z202: 0 | AA202: 731 | AB202: 540 | AC202: 135.37037037037038 | AD202: 20
A203: GOALKICKERS | N203: SINCLAIR | Q203: HARLAND | W203: PORT MELBOURNE | X203: 3 | Y203: 2 | Z203: 0 | AA203: 748 | AB203: 690 | AC203: 108.40579710144928 | AD203: 12
A204: PORT MELBOURNE | D204: COOK 4 | F204: O'RILEY 4 | H204: BIANCO 3 | J204: JIM CHRISTOU 3 | N204: BRICE 2 | P204: EBEYER | R204: ALLENDER | W204: PRAHRAN | X204: 3 | Y204: 2 | Z204: 0 | AA204: 664 | AB204: 641 | AC204: 103.58814352574103 | AD204: 12
A205: PRAHRAN | D205: SMITH 5 | G205: DICKSON 3 | J205: MILLS 2 | L205: THORNE 2 | N205: STONE | P205: THURGOOD | R205: LITTLE | W205: GEELONG WEST | X205: 3 | Y205: 2 | Z205: 0 | AA205: 640 | AB205: 735 | AC205: 87.074829931972786 | AD205: 12
A207: GEELONG WEST | C207: 1 | D207: 3 | E207: =C207*6+D207 -> 9 | G207: 7 | H207: 11 | I207: =G207*6+H207 -> 53 | K207: 9 | L207: 17 | M207: =K207*6+L207 -> 71 | O207: 18 | P207: 23 | Q207: =O207*6+P207 -> 131 | S207: PRESTON | W207: DANDENONG | X207: 2 | Y207: 2 | Z207: 1 | AA207: 657 | AB207: 617 | AC207: 106.48298217179902 | AD207: 10
A208: PRESTON | C208: 6 | D208: 2 | E208: =C208*6+D208 -> 38 | G208: 10 | H208: 3 | I208: =G208*6+H208 -> 63 | K208: 16 | L208: 6 | M208: =K208*6+L208 -> 102 | O208: 19 | P208: 6 | Q208: =O208*6+P208 -> 120 | S208: MATHEWS | W208: PRESTON | X208: 2 | Y208: 3 | Z208: 0 | AA208: 635 | AB208: 541 | AC208: 117.37523105360444 | AD208: 8
A209: BEST PLAYERS | W209: SANDRINGHAM | X209: 2 | Y209: 3 | Z209: 0 | AA209: 623 | AB209: 635 | AC209: 98.110236220472444 | AD209: 8
A210: GEELONG WEST | D210: GILMORE | G210: DREWETT | J210: RADOJEVIC | M210: S WELLS | O210: BURNS | Q210: DENMEAD | W210: FRANKSTON | X210: 2 | Y210: 3 | Z210: 0 | AA210: 615 | AB210: 663 | AC210: 92.76018099547511 | AD210: 8
A211: PRESTON | D211: McCONNELL | G211: McGAW | J211: PREECE | M211: CANN | O211: McKEON | Q211: McCULLOCH | W211: CAULFIELD | X211: 1 | Y211: 3 | Z211: 1 | AA211: 602 | AB211: 678 | AC211: 88.790560471976406 | AD211: 6
A212: GOALKICKERS | W212: CAMBERWELL | X212: 1 | Y212: 4 | Z212: 0 | AA212: 596 | AB212: 771 | AC212: 77.302204928664068 | AD212: 4
A213: GEELONG WEST | D213: RADOJEVIC 5 | G213: BROWNE 3 | J213: YATES 3 | L213: S WELLS 3 | O213: BURNS 2 | Q213: DENMEAD 2
A214: PRESTON | D214: CANN 4 | F214: JESSOP 2 | H214: MARKS 2 | J214: FREEMANTLE 2 | M214: P MARSHALL 2 | P214: CLARKE 2 | R214: McGAW | T214: McCONNELL | W214: ANDERSON | X214: G MARSHALL | AB214: FREEMAN
A216: COBURG | C216: 4 | D216: 4 | E216: =C216*6+D216 -> 28 | G216: 6 | H216: 10 | I216: =G216*6+H216 -> 46 | K216: 12 | L216: 10 | M216: =K216*6+L216 -> 82 | O216: 22 | P216: 13 | Q216: =O216*6+P216 -> 145 | S216: FRANKSTON
A217: FRANKSTON | C217: 2 | D217: 7 | E217: =C217*6+D217 -> 19 | G217: 4 | H217: 10 | I217: =G217*6+H217 -> 34 | K217: 10 | L217: 11 | M217: =K217*6+L217 -> 71 | O217: 12 | P217: 14 | Q217: =O217*6+P217 -> 86 | S217: CASEY
A218: BEST PLAYERS
A219: COBURG | D219: MILROY | G219: HERBERT | J219: DOUGLAS | M219: COLLINS | P219: BURT | R219: WESCOMBE
A220: FRANKSTON | D220: GEDDES | G220: BELL | J220: LYNN | M220: HOUSDEN | P220: BREMNER | R220: SERAFINI
A221: GOALKICKERS
A222: COBURG | D222: CLEARY 4 | F222: BEATTIE 3 | I222: HALBERT 3 | L222: COLLINS 3 | N222: FISHER 3 | P222: HERBERT 2 | R222: MILROY 2 | U222: BURT | W222: LAWRENCE
A223: FRANKSTON | D223: SERAFINI 8 | G223: HUMPHREY 2 | J223: JONES | L223: MIHOCEK
A225: DANDENONG | C225: 2 | D225: 1 | E225: =C225*6+D225 -> 13 | G225: 9 | H225: 7 | I225: =G225*6+H225 -> 61 | K225: 10 | L225: 10 | M225: =K225*6+L225 -> 70 | O225: 16 | P225: 14 | Q225: =O225*6+P225 -> 110 | S225: BEACH ROAD
A226: SANDRINGHAM | C226: 2 | D226: 7 | E226: =C226*6+D226 -> 19 | G226: 2 | H226: 9 | I226: =G226*6+H226 -> 21 | K226: 7 | L226: 14 | M226: =K226*6+L226 -> 56 | O226: 8 | P226: 18 | Q226: =O226*6+P226 -> 66 | S226: FITZPATRICK
A227: BEST PLAYERS
A228: DANDENONG | D228: DROSCHER | G228: WALLACE | J228: RUSSELL | M228: McCONNELL | P228: KNIGHT | R228: TOWNSEND
A229: SANDRINGHAM | D229: ELLIOTT | G229: O'BRIEN | J229: HAYES | M229: LYONS
A230: GOALKICKERS
A231: DANDENONG | D231: LAMBERT 3 | G231: TOWNSEND 3 | J231: BIFFIN 3 | L231: MADDEN 2 | O231: BRIESE 2 | Q231: GUY | R231: WALLACE | U231: McCONNELL
A232: SANDRINGHAM | D232: O'BRIEN 2 | G232: HUNT | I232: ELLIOTT | K232: BELL | M232: DEAGAN | O232: McCONNELL | R232: CHAPMAN
A234: CAULFIELD | C234: 5 | D234: 1 | E234: =C234*6+D234 -> 31 | G234: 14 | H234: 2 | I234: =G234*6+H234 -> 86 | K234: 18 | L234: 6 | M234: =K234*6+L234 -> 114 | O234: 23 | P234: 12 | Q234: =O234*6+P234 -> 150 | S234: C'WELL
A235: CAMBERWELL | C235: 8 | D235: 5 | E235: =C235*6+D235 -> 53 | G235: 11 | H235: 8 | I235: =G235*6+H235 -> 74 | K235: 13 | L235: 14 | M235: =K235*6+L235 -> 92 | O235: 17 | P235: 17 | Q235: =O235*6+P235 -> 119 | S235: GROOM
A236: BEST PLAYERS
A237: CAULFIELD | D237: KING | G237: SUTTIE | J237: O'SULLIVAN | M237: DAVIDSON | P237: MORRISON | S237: TAYLOR
A238: CAMBERWELL | D238: HAYWOOD | G238: KEANE | J238: FRYER | M238: JUDD | P238: TEAKEL
A239: GOALKICKERS
A240: CAULFIELD | D240: DAVIDSON 7 | G240: MILNER 4 | I240: RUSS 3 | K240: TROTT 2 | M240: BRUMMELLAN 2 | P240: MORRISON 2 | S240: O'SULLIVAN 2 | W240: KING
A241: CAMBERWELL | D241: FLOWER 4 | G241: FRYER 3 | I241: PRETTO 3 | K241: BARR 3 | M241: OLIVER 2 | O241: WRIGHT | Q241: CHAMBERLAIN
A243: ROUND 6 | E243: 18TH MAY | M243: WEATHER | S243: PLAYED AT
D244: 1ST QTR | H244: 2ND QTR | L244: 3RD QTR | P244: FINAL | S244: DANDENONG
A245: GEELONG WEST | C245: 2 | D245: 2 | E245: =C245*6+D245 -> 14 | G245: 9 | H245: 6 | I245: =G245*6+H245 -> 60 | K245: 15 | L245: 10 | M245: =K245*6+L245 -> 100 | O245: 21 | P245: 14 | Q245: =O245*6+P245 -> 140 | S245: UMPIRE | X245: LADDER | AB245: ROUND | AD245: 6
A246: DANDENONG | C246: 5 | D246: 5 | E246: =C246*6+D246 -> 35 | G246: 10 | H246: 9 | I246: =G246*6+H246 -> 69 | K246: 14 | L246: 12 | M246: =K246*6+L246 -> 96 | O246: 18 | P246: 16 | Q246: =O246*6+P246 -> 124 | S246: VERGONA
A247: BEST PLAYERS | W247: TEAM | X247: W | Y247: L | Z247: D | AA247: FOR | AB247: AGST | AC247: % | AD247: PTS
A248: GEELONG WEST | D248: YATES | G248: S WELLS | J248: WOOLFE | M248: TAYLOR | P248: RADOJEVIC
A249: DANDENONG | D249: LAMBERT | G249: WALLACE | J249: TOWNSEND | M249: BIFFIN | P249: WRIGHT | W249: COBURG | X249: 6 | Y249: 0 | Z249: 0 | AA249: 840 | AB249: 645 | AC249: 130.23255813953489 | AD249: 24
A250: GOALKICKERS | O250: MANSON | Q250: BROWNE | W250: PORT MELBOURNE | X250: 4 | Y250: 2 | Z250: 0 | AA250: 933 | AB250: 821 | AC250: 113.64190012180268 | AD250: 16
A251: GEELONG WEST | D251: RADOJEVIC 7 | G251: TAYLOR 3 | I251: WOOLFE 2 | K251: G WELLS 2 | N251: FOOTE 2 | P251: ARKLAY 2 | R251: GILMORE | W251: PRAHRAN | X251: 4 | Y251: 2 | Z251: 0 | AA251: 787 | AB251: 759 | AC251: 103.68906455862978 | AD251: 16
A252: DANDENONG | D252: TOWNSEND 4 | G252: BIFFIN 3 | I252: LAMBERT 3 | L252: WALLACE 2 | O252: PRENDERGAST 2 | R252: BRIESE | W252: GEELONG WEST | X252: 4 | Y252: 2 | Z252: 0 | AA252: 780 | AB252: 859 | AC252: 90.803259604190913 | AD252: 16
M253: HORAZCKO | O253: MADDEN | R253: ROSS
A254: PORT MELBOURNE | C254: 8 | D254: 6 | E254: =C254*6+D254 -> 54 | G254: 12 | H254: 8 | I254: =G254*6+H254 -> 80 | K254: 21 | L254: 10 | M254: =K254*6+L254 -> 136 | O254: 29 | P254: 11 | Q254: =O254*6+P254 -> 185 | S254: PORT MELBOURNE | W254: DANDENONG | X254: 2 | Y254: 3 | Z254: 1 | AA254: 781 | AB254: 757 | AC254: 103.17040951122853 | AD254: 10
A255: PRESTON | C255: 3 | D255: 2 | E255: =C255*6+D255 -> 20 | G255: 10 | H255: 8 | I255: =G255*6+H255 -> 68 | K255: 12 | L255: 11 | M255: =K255*6+L255 -> 83 | O255: 19 | P255: 17 | Q255: =O255*6+P255 -> 131 | S255: WILSON | W255: CAULFIELD | X255: 2 | Y255: 3 | Z255: 1 | AA255: 758 | AB255: 802 | AC255: 94.51371571072319 | AD255: 10
A256: BEST PLAYERS | W256: PRESTON | X256: 2 | Y256: 4 | Z256: 0 | AA256: 766 | AB256: 726 | AC256: 105.50964187327824 | AD256: 8
A257: PORT MELBOURNE | D257: COOK | F257: ALLENDER | I257: O'RILEY | K257: EBEYER | M257: WILKINSON | P257: JO CHRISTOU | W257: SANDRINGHAM | X257: 2 | Y257: 4 | Z257: 0 | AA257: 747 | AB257: 791 | AC257: 94.437420986093557 | AD257: 8
A258: PRESTON | D258: BATT | F258: McKEON | I258: COOPER | W258: FRANKSTON | X258: 2 | Y258: 4 | Z258: 0 | AA258: 733 | AB258: 786 | AC258: 93.256997455470739 | AD258: 8
A259: GOALKICKERS | W259: CAMBERWELL | X259: 1 | Y259: 5 | Z259: 0 | AA259: 701 | AB259: 880 | AC259: 79.659090909090907 | AD259: 4
A260: PORT MELBOURNE | D260: COOK 11 | F260: ALLENDER 6 | I260: BRICE 6 | K260: JIM CHRISTOU 2 | N260: GOSS 2 | P260: EBEYER | R260: BIANCO
A261: PRESTON | D261: BATT 3 | F261: CANN 3 | H261: COOPER 3 | J261: CLARKE 2 | M261: COSMA | O261: P MARSHALL | R261: FREEMANTLE | V261: McKEON | X261: MARKS
A263: CAULFIELD | C263: 5 | D263: 4 | E263: =C263*6+D263 -> 34 | G263: 9 | H263: 8 | I263: =G263*6+H263 -> 62 | K263: 16 | L263: 12 | M263: =K263*6+L263 -> 108 | O263: 24 | P263: 12 | Q263: =O263*6+P263 -> 156 | S263: PRINCES PARK
A264: SANDRINGHAM | C264: 5 | D264: 2 | E264: =C264*6+D264 -> 32 | G264: 11 | H264: 4 | I264: =G264*6+H264 -> 70 | K264: 14 | L264: 8 | M264: =K264*6+L264 -> 92 | O264: 19 | P264: 10 | Q264: =O264*6+P264 -> 124 | S264: GRIFFITH
A265: BEST PLAYERS
A266: CAULFIELD | D266: MORRISON | G266: DAVIDSON | J266: KING | M266: O'SULLIVAN | P266: EINSEDEL
A267: SANDRINGHAM | D267: OSBORNE | G267: COELLI | J267: WAY | M267: KENT
A268: GOALKICKERS
A269: CAULFIELD | D269: BRUMMELLAN 6 | G269: DAVIDSON 5 | J269: O'SULLIVAN 3 | M269: KING 3 | O269: TROTT 2 | Q269: BOOTH 2 | S269: MILNER 2 | V269: AMBLER
A270: SANDRINGHAM | D270: BELL 5 | F270: HUNT 4 | H270: WAY 3 | J270: MAILING 3 | M270: ELLIOTT | O270: GIAMPAOLO | R270: LYONS | T270: SIMS
A272: PRAHRAN | C272: 6 | D272: 4 | E272: =C272*6+D272 -> 40 | G272: 12 | H272: 5 | I272: =G272*6+H272 -> 77 | K272: 16 | L272: 11 | M272: =K272*6+L272 -> 107 | O272: 18 | P272: 15 | Q272: =O272*6+P272 -> 123 | S272: TOORAK PARK
A273: FRANKSTON | C273: 4 | D273: 5 | E273: =C273*6+D273 -> 29 | G273: 11 | H273: 9 | I273: =G273*6+H273 -> 75 | K273: 12 | L273: 9 | M273: =K273*6+L273 -> 81 | O273: 17 | P273: 16 | Q273: =O273*6+P273 -> 118 | S273: GROOM
A274: BEST PLAYERS
A275: PRAHRAN | D275: ANDERSON | G275: STONE | J275: THORNE | M275: DELLAMARTA | P275: MILLS | S275: McFAULL
A276: FRANKSTON | D276: BELL | G276: GEDDES | J276: WALTON | M276: THOMPSON | P276: LYNN | S276: JONES
A277: GOALKICKERS
A278: PRAHRAN | D278: SMITH 5 | F278: DELLAMARTA 3 | J278: THORNE 3 | M278: CLARKE 2 | P278: MILLS | R278: STONE | T278: DICKSON | W278: LITTLE | X278: ZEUNART
A279: FRANKSTON | D279: BELL 5 | F279: SERAFINI 5 | I279: WALTON 3 | L279: KENNEDY 2 | O279: JONES | Q279: HARRINGTON | T279: TICKELL | W279: HOUSDEN
A281: COBURG | C281: 6 | D281: 4 | E281: =C281*6+D281 -> 40 | G281: 9 | H281: 11 | I281: =G281*6+H281 -> 65 | K281: 13 | L281: 14 | M281: =K281*6+L281 -> 92 | O281: 15 | P281: 19 | Q281: =O281*6+P281 -> 109 | S281: COBURG
A282: CAMBERWELL | C282: 2 | D282: 4 | E282: =C282*6+D282 -> 16 | G282: 3 | H282: 7 | I282: =G282*6+H282 -> 25 | K282: 10 | L282: 14 | M282: =K282*6+L282 -> 74 | O282: 15 | P282: 15 | Q282: =O282*6+P282 -> 105 | S282: MORGAN
A283: BEST PLAYERS
A284: COBURG | D284: PITT | G284: NIMMO | J284: COLLINS | M284: DOHNT | P284: HERBERT
A285: CAMBERWELL | D285: JUDD | G285: HAYWOOD | J285: PRETTO | M285: NEILSON | P285: FRYER | S285: DAVIDSON
A286: GOALKICKERS
A287: COBURG | D287: SMITH 7 | G287: COLLINS 3 | J287: HERBERT 2 | M287: DOHNT | O287: BEATTIE | Q287: WESCOMBE
A288: CAMBERWELL | D288: NEILSON 7 | G288: WRIGHT 3 | J288: TEMPLETON 2 | M288: HAYWOOD | O288: COWLEY | Q288: DAVIDSON
A290: ROUND 7 | E290: 25TH MAY | J290: WEATHER | N290: NORTH WEST WIND FINE | S290: PLAYED AT
D291: 1ST QTR | H291: 2ND QTR | L291: 3RD QTR | P291: FINAL | S291: GEELONG WEST
A292: GEELONG WEST | C292: 8 | D292: 0 | E292: =C292*6+D292 -> 48 | G292: 13 | H292: 5 | I292: =G292*6+H292 -> 83 | K292: 24 | L292: 12 | M292: =K292*6+L292 -> 156 | O292: 30 | P292: 14 | Q292: =O292*6+P292 -> 194 | S292: UMPIRE | X292: LADDER | AB292: ROUND | AD292: 7
A293: CAULFIELD | C293: 9 | D293: 5 | E293: =C293*6+D293 -> 59 | G293: 14 | H293: 8 | I293: =G293*6+H293 -> 92 | K293: 16 | L293: 13 | M293: =K293*6+L293 -> 109 | O293: 21 | P293: 15 | Q293: =O293*6+P293 -> 141 | S293: CASEY
A294: BEST PLAYERS | W294: TEAM | X294: W | Y294: L | Z294: D | AA294: FOR | AB294: AGST | AC294: % | AD294: PTS
A295: GEELONG WEST | D295: S WELLS | G295: S TAYLOR | J295: RADOJEVIC | M295: BROWNE | P295: G WELLS | R295: TODD
A296: CAULFIELD | D296: DAVIDSON | G296: BRUMMELLAN | J296: MORRISON | M296: HAWKING | P296: KING | W296: COBURG | X296: 7 | Y296: 0 | Z296: 0 | AA296: 993 | AB296: 758 | AC296: 131.00263852242745 | AD296: 28
A297: GOALKICKERS | Q297: WOOLFE 2 | W297: PRAHRAN | X297: 5 | Y297: 2 | Z297: 0 | AA297: 925 | AB297: 890 | AC297: 103.93258426966293 | AD297: 20
A298: GEELONG WEST | D298: RADOJEVIC 7 | G298: G WELLS 5 | J298: BROWNE 4 | M298: TAYLOR 3 | O298: ARKLAY 3 | Q298: GILMORE 3 | T298: YATES 3 | W298: GEELONG WEST | X298: 5 | Y298: 2 | Z298: 0 | AA298: 974 | AB298: 1000 | AC298: 97.4 | AD298: 20
A299: CAULFIELD | D299: BRUMMELLAN 6 | G299: DAVIDSON 5 | J299: TAYLOR 2 | M299: O'SULLIVAN 2 | P299: BOOTH 2 | R299: KING | T299: TROTT | W299: PORT MELBOURNE | X299: 4 | Y299: 3 | Z299: 0 | AA299: 1062 | AB299: 982 | AC299: 108.14663951120163 | AD299: 16
O300: MITCHELL | Q300: HUNT
A301: DANDENONG | C301: 9 | D301: 4 | E301: =C301*6+D301 -> 58 | G301: 14 | H301: 8 | I301: =G301*6+H301 -> 92 | K301: 22 | L301: 12 | M301: =K301*6+L301 -> 144 | O301: 26 | P301: 15 | Q301: =O301*6+P301 -> 171 | S301: PRESTON | W301: DANDENONG | X301: 3 | Y301: 3 | Z301: 1 | AA301: 952 | AB301: 915 | AC301: 104.04371584699453 | AD301: 14
A302: PRESTON | C302: 3 | D302: 3 | E302: =C302*6+D302 -> 21 | G302: 8 | H302: 7 | I302: =G302*6+H302 -> 55 | K302: 12 | L302: 13 | M302: =K302*6+L302 -> 85 | O302: 23 | P302: 20 | Q302: =O302*6+P302 -> 158 | S302: STABB | W302: FRANKSTON | X302: 3 | Y302: 4 | Z302: 0 | AA302: 894 | AB302: 915 | AC302: 97.704918032786878 | AD302: 12
A303: BEST PLAYERS | W303: CAULFIELD | X303: 2 | Y303: 4 | Z303: 1 | AA303: 899 | AB303: 996 | AC303: 90.261044176706832 | AD303: 10
A304: DANDENONG | D304: TOWNSEND | G304: LAMBERT | J304: WRIGHT | M304: HORAZCKO | P304: LUKAS | R304: BRIESE | W304: PRESTON | X304: 2 | Y304: 5 | Z304: 0 | AA304: 924 | AB304: 897 | AC304: 103.01003344481606 | AD304: 8
A305: PRESTON | D305: McCULLOCH | G305: BATT | J305: G MARSHALL | M305: McKEON | P305: TOWAN | R305: COOPER | W305: SANDRINGHAM | X305: 2 | Y305: 5 | Z305: 0 | AA305: 860 | AB305: 944 | AC305: 91.101694915254242 | AD305: 8
A306: GOALKICKERS | N306: ALLISON | P306: HORAZCKO | R306: PRENDERGAST | W306: CAMBERWELL | X306: 1 | Y306: 6 | Z306: 0 | AA306: 832 | AB306: 1018 | AC306: 81.72888015717092 | AD306: 4
A307: DANDENONG | D307: TOWNSEND 5 | G307: LAMBERT 4 | J307: BRIESE 3 | L307: ORTON 3 | N307: HARPER 2 | Q307: MADDEN 2 | T307: WRIGHT
A308: PRESTON | D308: COOPER 4 | F308: NICLASSEN 4 | I308: MARTIN 3 | K308: P MARSHALL 3 | N308: BATT 3 | P308: CANN 2 | R308: FRAZER 2 | U308: WALSH | W308: G MARSHALL
A310: COBURG | C310: 4 | D310: 9 | E310: =C310*6+D310 -> 33 | G310: 10 | H310: 10 | I310: =G310*6+H310 -> 70 | K310: 16 | L310: 17 | M310: =K310*6+L310 -> 113 | O310: 22 | P310: 21 | Q310: =O310*6+P310 -> 153 | S310: BEACH ROAD
A311: SANDRINGHAM | C311: 4 | D311: 2 | E311: =C311*6+D311 -> 26 | G311: 9 | H311: 6 | I311: =G311*6+H311 -> 60 | K311: 11 | L311: 7 | M311: =K311*6+L311 -> 73 | O311: 17 | P311: 11 | Q311: =O311*6+P311 -> 113 | S311: VERGONA
A312: BEST PLAYERS
A313: COBURG | D313: NIMMO | G313: DOHNT | J313: COLLINS | M313: FISHER | O313: SMITH | Q313: MILROY
A314: SANDRINGHAM | D314: WAY | G314: KEAST | J314: COELLI | M314: SIMS | O314: OSBORNE | Q314: ELLIOTT
A315: GOALKICKERS
A316: COBURG | D316: SMITH 7 | F316: FISHER 5 | I316: COLLINS 3 | L316: HALSALL 2 | O316: HALBERT 2 | R316: BURT | T316: PITT | V316: WESCOMBE
A317: SANDRINGHAM | D317: HUNT 5 | F317: HUTCHINSON 2 | J317: BELL 2 | L317: KEAST 2 | N317: WAY 2 | P317: ELLIOTT 2 | R317: MAILING | U317: GIAMPAOLO
A319: PRAHRAN | C319: 5 | D319: 3 | E319: =C319*6+D319 -> 33 | G319: 9 | H319: 6 | I319: =G319*6+H319 -> 60 | K319: 11 | L319: 9 | M319: =K319*6+L319 -> 75 | O319: 21 | P319: 12 | Q319: =O319*6+P319 -> 138 | S319: C'WELL
A320: CAMBERWELL | C320: 5 | D320: 5 | E320: =C320*6+D320 -> 35 | G320: 10 | H320: 8 | I320: =G320*6+H320 -> 68 | K320: 16 | L320: 11 | M320: =K320*6+L320 -> 107 | O320: 20 | P320: 11 | Q320: =O320*6+P320 -> 131 | S320: FITZPATRICK
A321: BEST PLAYERS
A322: PRAHRAN | D322: ANDERSON | G322: FOLEY | J322: CHAPMAN | M322: McFAULL | P322: THORNE | S322: STONE
A323: CAMBERWELL | D323: NEILSON | G323: WRIGHT | J323: COOK | M323: SLACIK
A324: GOALKICKERS
A325: PRAHRAN | D325: SMITH 6 | G325: CHAPMAN 5 | J325: STONE 3 | L325: DELLAMARTA 2 | O325: PREEN 2 | Q325: MILLS | S325: CLARKE | U325: WISE
A326: CAMBERWELL | D326: WRIGHT 4 | F326: ROHLEDER 3 | I326: SLACIK 2 | K326: COWLEY 2 | M326: DAVIDSON 2 | P326: TEMPLETON | R326: JUDD | T326: HIRST | W326: CHAMBERLAIN | X326: FRYER | Z326: KEANE | AB326: SPITHILL
A328: FRANKSTON | C328: 4 | D328: 4 | E328: =C328*6+D328 -> 28 | G328: 12 | H328: 8 | I328: =G328*6+H328 -> 80 | K328: 17 | L328: 12 | M328: =K328*6+L328 -> 114 | O328: 24 | P328: 17 | Q328: =O328*6+P328 -> 161 | S328: FRANKSTON
A329: PORT MELBOURNE | C329: 7 | D329: 4 | E329: =C329*6+D329 -> 46 | G329: 12 | H329: 9 | I329: =G329*6+H329 -> 81 | K329: 13 | L329: 12 | M329: =K329*6+L329 -> 90 | O329: 19 | P329: 15 | Q329: =O329*6+P329 -> 129 | S329: MATHEWS
A330: BEST PLAYERS
A331: FRANKSTON | D331: JEFFREYS | G331: HUMPHRIES | J331: SERAFINI | M331: HOUSDEN | P331: BREMNER
A332: PORT MELBOURNE | D332: ALLENDER | G332: JOHN CHRISTOU | K332: SWAN | M332: JIM CHRISTOU
A333: GOALKICKERS
A334: FRANKSTON | D334: SERAFINI 7 | F334: BREMNER 4 | I334: CLARKE 3 | K334: KENNEDY 2 | N334: JEFFREYS 2 | Q334: JONES 2 | S334: WALTON 2 | W334: SAMPSON | X334: S TICKELL
A335: PORT MELBOURNE | D335: COOK 6 | G335: JIM CHRISTOU 3 | J335: ALLENDER 3 | M335: SWAN 3 | O335: BIANCO | Q335: WILKINSON | T335: AANENSEN | W335: BRICE
A337: ROUND 8 | E337: 1ST JUNE | J337: WEATHER | N337: FINE | S337: PLAYED AT
D338: 1ST QTR | H338: 2ND QTR | L338: 3RD QTR | P338: FINAL | S338: TOORAK PARK
A339: COBURG | C339: 7 | D339: 2 | E339: =C339*6+D339 -> 44 | G339: 13 | H339: 8 | I339: =G339*6+H339 -> 86 | K339: 17 | L339: 10 | M339: =K339*6+L339 -> 112 | O339: 20 | P339: 16 | Q339: =O339*6+P339 -> 136 | S339: UMPIRE | X339: LADDER | AB339: ROUND | AD339: 8
A340: PRAHRAN | C340: 5 | D340: 5 | E340: =C340*6+D340 -> 35 | G340: 8 | H340: 7 | I340: =G340*6+H340 -> 55 | K340: 14 | L340: 13 | M340: =K340*6+L340 -> 97 | O340: 15 | P340: 17 | Q340: =O340*6+P340 -> 107 | S340: MATHEWS
A341: BEST PLAYERS | W341: TEAM | X341: W | Y341: L | Z341: D | AA341: FOR | AB341: AGST | AC341: % | AD341: PTS
A342: COBURG | D342: MILROY | G342: NIMMO | J342: SMITH | M342: BURT | O342: PITT | Q342: HARTIGAN
A343: PRAHRAN | D343: SMITH | G343: ANDERSON | J343: McGUINNESS | M343: KELLY | O343: STONE | W343: COBURG | X343: 8 | Y343: 0 | Z343: 0 | AA343: 1129 | AB343: 865 | AC343: 130.52023121387282 | AD343: 32
A344: GOALKICKERS | R344: BELL | W344: GEELONG WEST | X344: 6 | Y344: 2 | Z344: 0 | AA344: 1162 | AB344: 1119 | AC344: 103.84271671134942 | AD344: 24
A345: COBURG | D345: SMITH 10 | F345: HERBERT 2 | I345: WESCOMBE 2 | L345: HALBERT | N345: HALSALL | P345: COLLINS | R345: NIMMO | T345: FISHER | W345: PORT MELBOURNE | X345: 5 | Y345: 3 | Z345: 0 | AA345: 1193 | AB345: 1070 | AC345: 111.49532710280374 | AD345: 20
A346: PRAHRAN | D346: SMITH 7 | F346: DELLAMARTA 2 | J346: STONE 2 | M346: MILLS | O346: THORNE | Q346: CHAPMAN | S346: PREEN | W346: PRAHRAN | X346: 5 | Y346: 3 | Z346: 0 | AA346: 1032 | AB346: 1026 | AC346: 100.58479532163743 | AD346: 20
A348: PORT MELBOURNE | C348: 4 | D348: 4 | E348: =C348*6+D348 -> 28 | G348: 9 | H348: 7 | I348: =G348*6+H348 -> 61 | K348: 13 | L348: 9 | M348: =K348*6+L348 -> 87 | O348: 20 | P348: 11 | Q348: =O348*6+P348 -> 131 | S348: PORT MELBOURNE | W348: DANDENONG | X348: 4 | Y348: 3 | Z348: 1 | AA348: 1098 | AB348: 1033 | AC348: 106.29235237173282 | AD348: 18
A349: CAULFIELD | C349: 3 | D349: 3 | E349: =C349*6+D349 -> 21 | G349: 8 | H349: 6 | I349: =G349*6+H349 -> 54 | K349: 12 | L349: 11 | M349: =K349*6+L349 -> 83 | O349: 12 | P349: 16 | Q349: =O349*6+P349 -> 88 | S349: OAKLEY | W349: FRANKSTON | X349: 3 | Y349: 5 | Z349: 0 | AA349: 1012 | AB349: 1061 | AC349: 95.381715362865222 | AD349: 12
A350: BEST PLAYERS | W350: SANDRINGHAM | X350: 3 | Y350: 5 | Z350: 0 | AA350: 1012 | AB350: 1078 | AC350: 93.877551020408163 | AD350: 12
A351: PORT MELBOURNE | D351: ALLENDER | G351: WILKINSON | J351: O'RILEY | L351: DERMOTT | N351: JOHN CHRISTOU | R351: AANENSEN | W351: CAULFIELD | X351: 2 | Y351: 5 | Z351: 1 | AA351: 987 | AB351: 1127 | AC351: 87.577639751552795 | AD351: 10
A352: CAULFIELD | D352: O'SULLIVAN | G352: HAWKING | J352: KING | L352: EINSEDEL | N352: DAVIDSON | W352: PRESTON | X352: 2 | Y352: 6 | Z352: 0 | AA352: 1058 | AB352: 1049 | AC352: 100.85795996186845 | AD352: 8
A353: GOALKICKERS | W353: CAMBERWELL | X353: 1 | Y353: 7 | Z353: 0 | AA353: 951 | AB353: 1206 | AC353: 78.855721393034827 | AD353: 4
A354: PORT MELBOURNE | D354: COOK 6 | F354: ALLENDER 6 | I354: EBEYER 2 | K354: O'RILEY 2 | M354: BRICE | N354: WILKINSON | Q354: AANENSEN | T354: JIM CHRISTOU
A355: CAULFIELD | D355: DAVIDSON 3 | G355: O'SULLIVAN 3 | J355: TROTT 2 | L355: RUSS 2 | N355: BOOTH | P355: MAIDMENT
A357: DANDENONG | C357: 10 | D357: 3 | E357: =C357*6+D357 -> 63 | G357: 15 | H357: 6 | I357: =G357*6+H357 -> 96 | K357: 20 | L357: 7 | M357: =K357*6+L357 -> 127 | O357: 23 | P357: 8 | Q357: =O357*6+P357 -> 146 | S357: FRANKSTON
A358: FRANKSTON | C358: 4 | D358: 2 | E358: =C358*6+D358 -> 26 | G358: 10 | H358: 4 | I358: =G358*6+H358 -> 64 | K358: 12 | L358: 7 | M358: =K358*6+L358 -> 79 | O358: 18 | P358: 10 | Q358: =O358*6+P358 -> 118 | S358: TORNEY
A359: BEST PLAYERS
A360: DANDENONG | D360: DROSCHER | G360: LUKAS | J360: PRENDERGAST | M360: WALLACE | P360: HORAZCKO
A361: FRANKSTON | D361: MONCRIEFF | G361: LYNN | J361: JONES | M361: ALDRIDGE
A362: GOALKICKERS
A363: DANDENONG | D363: BIFFIN 8 | G363: TOWNSEND 7 | J363: MADDEN 3 | M363: LAMBERT 2 | P363: COUSINS | R363: LUKAS | T363: WRIGHT
A364: FRANKSTON | D364: WALTON 4 | G364: JONES 3 | I364: SERAFINI 2 | L364: JEFFREYS 2 | O364: ALDRIDGE 2 | R364: CLARK 2 | U364: BELL | W364: SAMPSON | X364: HARRINGTON
A366: SANDRINGHAM | C366: 3 | D366: 4 | E366: =C366*6+D366 -> 22 | G366: 10 | H366: 9 | I366: =G366*6+H366 -> 69 | K366: 16 | L366: 11 | M366: =K366*6+L366 -> 107 | O366: 23 | P366: 14 | Q366: =O366*6+P366 -> 152 | S366: PRESTON
A367: PRESTON | C367: 5 | D367: 6 | E367: =C367*6+D367 -> 36 | G367: 9 | H367: 12 | I367: =G367*6+H367 -> 66 | K367: 15 | L367: 16 | M367: =K367*6+L367 -> 106 | O367: 19 | P367: 20 | Q367: =O367*6+P367 -> 134 | S367: CASEY
A368: BEST PLAYERS
A369: SANDRINGHAM | D369: MAILING | G369: KEAST | J369: BELL | M369: HODGES | P369: ELLIOTT | S369: SARAU
A370: PRESTON | D370: P MARSHALL | G370: COOPER | J370: McKEON | M370: BATT
A371: GOALKICKERS
A372: SANDRINGHAM | D372: HUNT 7 | G372: MAILING 7 | J372: BELL 3 | L372: PLEDGER 2 | N372: HODGES | P372: CLARK | R372: MANNIX | U372: BEUS
A373: PRESTON | D373: P MARSHALL 4 | G373: BATT 4 | I373: CANN 3 | K373: FRAZER 2 | M373: CLARKE 2 | P373: COOPER 2 | R373: COSMA | U373: MARTIN
A375: GEELONG WEST | C375: 4 | D375: 4 | E375: =C375*6+D375 -> 28 | G375: 11 | H375: 8 | I375: =G375*6+H375 -> 74 | K375: 19 | L375: 16 | M375: =K375*6+L375 -> 130 | O375: 27 | P375: 26 | Q375: =O375*6+P375 -> 188 | S375: C'WELL
A376: CAMBERWELL | C376: 4 | D376: 8 | E376: =C376*6+D376 -> 32 | G376: 9 | H376: 9 | I376: =G376*6+H376 -> 63 | K376: 15 | L376: 12 | M376: =K376*6+L376 -> 102 | O376: 17 | P376: 17 | Q376: =O376*6+P376 -> 119 | S376: GRIFFITHS
A377: BEST PLAYERS
A378: GEELONG WEST | D378: WOOLFE | G378: TAYLOR | J378: GIBSON | M378: FRIEND | O378: FOOTE | Q378: BROWNE
A379: CAMBERWELL | D379: NEILSON | G379: ROHLEDER | J379: COOK | M379: BARR | O379: HIRST | Q379: WRIGHT
A380: GOALKICKERS
A381: GEELONG WEST | D381: BROWNE 6 | F381: RADOJEVIC 4 | I381: WOOLFE 4 | K381: YATES 4 | M381: G WELLS 2 | P381: TAYLOR 2 | R381: BURNS 2 | U381: S WELLS | X381: ARKLAY | Z381: FOOTE
A382: CAMBERWELL | D382: ROHLEDER 3 | G382: WRIGHT 3 | I382: SLACIK 3 | K382: KING 2 | M382: HIRST 2 | O382: SIMPSON 2 | R382: TEMPLETON | U382: KEANE
A384: ROUND 9 | E384: 8TH JUNE | J384: WEATHER | N384: NORTH WEST WIND COLD | S384: PLAYED AT
D385: 1ST QTR | H385: 2ND QTR | L385: 3RD QTR | P385: FINAL | S385: COBURG
A386: PORT MELBOURNE | C386: 7 | D386: 1 | E386: =C386*6+D386 -> 43 | G386: 12 | H386: 6 | I386: =G386*6+H386 -> 78 | K386: 19 | L386: 11 | M386: =K386*6+L386 -> 125 | O386: 22 | P386: 12 | Q386: =O386*6+P386 -> 144 | S386: UMPIRE | X386: LADDER | AB386: ROUND | AD386: 9
A387: COBURG | C387: 6 | D387: 4 | E387: =C387*6+D387 -> 40 | G387: 13 | H387: 9 | I387: =G387*6+H387 -> 87 | K387: 16 | L387: 12 | M387: =K387*6+L387 -> 108 | O387: 19 | P387: 18 | Q387: =O387*6+P387 -> 132 | S387: STABB
A388: BEST PLAYERS | W388: TEAM | X388: W | Y388: L | Z388: D | AA388: FOR | AB388: AGST | AC388: % | AD388: PTS
A389: PORT MELBOURNE | D389: ALLENDER | G389: COOK | I389: WILKINSON | L389: EBEYER | O389: DERMOTT | R389: BRICE
A390: COBURG | D390: COLLINS | G390: DOHNT | I390: SMITH | L390: NIMMO | O390: SALTMARSH | W390: COBURG | X390: 8 | Y390: 1 | Z390: 0 | AA390: 1261 | AB390: 1009 | AC390: 124.97522299306243 | AD390: 32
A391: GOALKICKERS | W391: GEELONG WEST | X391: 7 | Y391: 2 | Z391: 0 | AA391: 1309 | AB391: 1250 | AC391: 104.72 | AD391: 28
A392: PORT MELBOURNE | D392: COOK 8 | F392: ALLENDER 5 | I392: EVANS 2 | K392: EBEYER 2 | M392: WILKINSON 2 | P392: O'RILEY | R392: BRICE | T392: DAVIES | W392: PORT MELBOURNE | X392: 6 | Y392: 3 | Z392: 0 | AA392: 1337 | AB392: 1202 | AC392: 111.23128119800333 | AD392: 24
A393: COBURG | D393: SMITH 5 | F393: HALBERT 2 | I393: HALSALL 2 | L393: COLLINS 2 | N393: FISHER 2 | P393: WESCOMBE 2 | S393: DOHNT | W393: PRAHRAN | X393: 6 | Y393: 3 | Z393: 0 | AA393: 1164 | AB393: 1155 | AC393: 100.77922077922078 | AD393: 24
N394: BURT | P394: HERBERT | R394: BELL
A395: CAULFIELD | C395: 5 | D395: 2 | E395: =C395*6+D395 -> 32 | G395: 10 | H395: 5 | I395: =G395*6+H395 -> 65 | K395: 17 | L395: 9 | M395: =K395*6+L395 -> 111 | O395: 22 | P395: 12 | Q395: =O395*6+P395 -> 144 | S395: PRINCES PARK | W395: DANDENONG | X395: 5 | Y395: 3 | Z395: 1 | AA395: 1201 | AB395: 1098 | AC395: 109.38069216757741 | AD395: 22
A396: FRANKSTON | C396: 5 | D396: 2 | E396: =C396*6+D396 -> 32 | G396: 10 | H396: 4 | I396: =G396*6+H396 -> 64 | K396: 14 | L396: 9 | M396: =K396*6+L396 -> 93 | O396: 18 | P396: 15 | Q396: =O396*6+P396 -> 123 | S396: GROOM | W396: CAULFIELD | X396: 3 | Y396: 5 | Z396: 1 | AA396: 1131 | AB396: 1250 | AC396: 90.48 | AD396: 14
A397: BEST PLAYERS | W397: FRANKSTON | X397: 3 | Y397: 6 | Z397: 0 | AA397: 1135 | AB397: 1205 | AC397: 94.190871369294612 | AD397: 12
A398: CAULFIELD | D398: O'SULLIVAN | G398: MORRISON | J398: KING | M398: BOOTH | O398: TROTT | R398: EINSEDEL | W398: SANDRINGHAM | X398: 3 | Y398: 6 | Z398: 0 | AA398: 1143 | AB398: 1225 | AC398: 93.306122448979593 | AD398: 12
A399: FRANKSTON | D399: LYNN | G399: MONCRIEFF | J399: KENNEDY | M399: JONES | O399: HORLER | W399: PRESTON | X399: 2 | Y399: 7 | Z399: 0 | AA399: 1187 | AB399: 1181 | AC399: 100.50804403048264 | AD399: 8
A400: GOALKICKERS | Q400: AMBLER | W400: CAMBERWELL | X400: 1 | Y400: 8 | Z400: 0 | AA400: 1016 | AB400: 1309 | AC400: 77.616501145912906 | AD400: 4
A401: CAULFIELD | D401: TROTT 7 | F401: DAVIDSON 4 | I401: BOOTH 3 | K401: FRIGO 2 | M401: O'SULLIVAN 2 | P401: RUSS 2 | R401: BRUMMELLAN
A402: FRANKSTON | D402: WALTON 4 | F402: TICKELL 3 | I402: CLARK 2 | K402: BELL 2 | M402: KENNEDY | O402: JEFFREYS | Q402: JONES | R402: BREMNER | U402: LEGGE
O403: HORLER | Q403: THOMPSON
A404: GEELONG WEST | C404: 4 | D404: 6 | E404: =C404*6+D404 -> 30 | G404: 12 | H404: 11 | I404: =G404*6+H404 -> 83 | K404: 18 | L404: 11 | M404: =K404*6+L404 -> 119 | O404: 22 | P404: 15 | Q404: =O404*6+P404 -> 147 | S404: GEELONG WEST
A405: SANDRINGHAM | C405: 5 | D405: 4 | E405: =C405*6+D405 -> 34 | G405: 11 | H405: 6 | I405: =G405*6+H405 -> 72 | K405: 17 | L405: 7 | M405: =K405*6+L405 -> 109 | O405: 20 | P405: 11 | Q405: =O405*6+P405 -> 131 | S405: TORNEY
A406: BEST PLAYERS
A407: GEELONG WEST | D407: GILMORE | G407: HINCK | J407: S WELLS | M407: G WELLS | O407: MANSON | R407: BURNS
A408: SANDRINGHAM | D408: LYONS | G408: KEAST | J408: ELLIOTT | M408: BEUS | O408: WAY | R408: CLARK
A409: GOALKICKERS
A410: GEELONG WEST | D410: RADOJEVIC 6 | G410: BURNS 5 | I410: S TAYLOR 2 | L410: G WELLS 2 | N410: YATES 2 | P410: GILMORE 2 | R410: BROWNE | U410: WOOLFE | X410: ARKLAY
A411: SANDRINGHAM | D411: HUNT 3 | F411: ELLIOTT 3 | I411: WAY 3 | K411: BEUS 3 | M411: BELL 2 | O411: MAILING 2 | R411: CAMPBELL 2 | V411: LYONS | X411: MANNIX
A413: PRAHRAN | C413: 6 | D413: 4 | E413: =C413*6+D413 -> 40 | G413: 8 | H413: 10 | I413: =G413*6+H413 -> 58 | K413: 17 | L413: 12 | M413: =K413*6+L413 -> 114 | O413: 19 | P413: 18 | Q413: =O413*6+P413 -> 132 | S413: TOORAK PARK
A414: PRESTON | C414: 5 | D414: 4 | E414: =C414*6+D414 -> 34 | G414: 11 | H414: 7 | I414: =G414*6+H414 -> 73 | K414: 14 | L414: 11 | M414: =K414*6+L414 -> 95 | O414: 19 | P414: 15 | Q414: =O414*6+P414 -> 129 | S414: VERGONA
A415: BEST PLAYERS
A416: PRAHRAN | D416: WISE | G416: THORNE | J416: McGUINNESS | M416: SMITH | O416: ZEUNART | R416: AUSTIN
A417: PRESTON | D417: COOPER | G417: McCULLOCH | J417: MARKS | M417: MARTIN | O417: P MARSHALL | R417: JESSOP
A418: GOALKICKERS
A419: PRAHRAN | D419: SMITH 8 | G419: MILLS 3 | I419: THORNE 3 | L419: ZEUNART 2 | O419: STONE 2 | Q419: CLARKE
A420: PRESTON | D420: P MARSHALL 5 | G420: JESSOP 3 | I420: BATT 2 | K420: G MARSHALL 2 | N420: COOPER 2 | Q420: McCONNELL | T420: CLARKE | V420: CANN | X420: MARKS | Z420: COSMA
A422: DANDENONG | C422: 2 | D422: 5 | E422: =C422*6+D422 -> 17 | G422: 7 | H422: 7 | I422: =G422*6+H422 -> 49 | K422: 9 | L422: 10 | M422: =K422*6+L422 -> 64 | O422: 15 | P422: 13 | Q422: =O422*6+P422 -> 103 | S422: DANDENONG
A423: CAMBERWELL | C423: 2 | D423: 4 | E423: =C423*6+D423 -> 16 | G423: 5 | H423: 6 | I423: =G423*6+H423 -> 36 | K423: 8 | L423: 8 | M423: =K423*6+L423 -> 56 | O423: 9 | P423: 11 | Q423: =O423*6+P423 -> 65 | S423: CASEY
A424: BEST PLAYERS
A425: DANDENONG | D425: COUSINS | G425: COVENTRY | J425: LUKAS | M425: HARPER | O425: WALLACE | R425: HORAZCKO
A426: CAMBERWELL | D426: HIRST | G426: TEAKEL | J426: PRETTO | M426: NEILSON | O426: WRIGHT | R426: JUDD
A427: GOALKICKERS
A428: DANDENONG | D428: TOWNSEND 4 | G428: ORTON 3 | I428: LAMBERT 2 | L428: MADDEN 2 | N428: COVENTRY 2 | Q428: BRIESE | S428: LUKAS
A429: CAMBERWELL | D429: HIRST 4 | G429: BARR 2 | I429: MOIR | K429: NEILSON | M429: ROHLEDER
A431: ROUND 10 | E431: 22ND JUNE | J431: WEATHER | S431: PLAYED AT
D432: 1ST QTR | H432: 2ND QTR | L432: 3RD QTR | P432: FINAL | S432: GEELONG WEST
A433: COBURG | C433: 2 | D433: 5 | E433: =C433*6+D433 -> 17 | G433: 8 | H433: 7 | I433: =G433*6+H433 -> 55 | K433: 15 | L433: 11 | M433: =K433*6+L433 -> 101 | O433: 21 | P433: 13 | Q433: =O433*6+P433 -> 139 | S433: UMPIRE | X433: LADDER | AB433: ROUND | AD433: 10
A434: GEELONG WEST | C434: 2 | D434: 3 | E434: =C434*6+D434 -> 15 | G434: 8 | H434: 7 | I434: =G434*6+H434 -> 55 | K434: 8 | L434: 9 | M434: =K434*6+L434 -> 57 | O434: 15 | P434: 10 | Q434: =O434*6+P434 -> 100 | S434: GROOM
A435: BEST PLAYERS | W435: TEAM | X435: W | Y435: L | Z435: D | AA435: FOR | AB435: AGST | AC435: % | AD435: PTS
A436: COBURG | D436: DOHNT | G436: BURT | I436: COLLINS | L436: MILROY | O436: HALBERT | R436: DOUGLAS
A437: GEELONG WEST | D437: GIBSON | G437: HINCK | I437: YATES | L437: TAYLOR | O437: BROWNE | R437: FOOTT | W437: COBURG | X437: 9 | Y437: 1 | Z437: 0 | AA437: 1400 | AB437: 1109 | AC437: 126.23985572587917 | AD437: 36
A438: GOALKICKERS | S438: BURT | W438: PORT MELBOURNE | X438: 7 | Y438: 3 | Z438: 0 | AA438: 1474 | AB438: 1277 | AC438: 115.4267815191856 | AD438: 28
A439: COBURG | D439: COLLINS 5 | F439: SMITH 5 | H439: DOHNT 3 | J439: HALSALL 2 | M439: HERBERT 2 | P439: BEATTIE | R439: FISHER | T439: HODGE | W439: PRAHRAN | X439: 7 | Y439: 3 | Z439: 0 | AA439: 1310 | AB439: 1285 | AC439: 101.94552529182879 | AD439: 28
A440: GEELONG WEST | D440: RADOJEVIC 5 | G440: S TAYLOR 2 | J440: MANSON 2 | M440: SCARLETT | O440: YATES | Q440: BROWNE | S440: G WELLS | W440: GEELONG WEST | X440: 7 | Y440: 3 | Z440: 0 | AA440: 1409 | AB440: 1389 | AC440: 101.43988480921526 | AD440: 28
R441: S WELLS
A442: DANDENONG | C442: 5 | D442: 6 | E442: =C442*6+D442 -> 36 | G442: 6 | H442: 7 | I442: =G442*6+H442 -> 43 | K442: 8 | L442: 17 | M442: =K442*6+L442 -> 65 | O442: 11 | P442: 17 | Q442: =O442*6+P442 -> 83 | S442: DANDENONG | W442: DANDENONG | X442: 6 | Y442: 3 | Z442: 1 | AA442: 1284 | AB442: 1155 | AC442: 111.16883116883118 | AD442: 26
A443: CAULFIELD | C443: 2 | D443: 3 | E443: =C443*6+D443 -> 15 | G443: 4 | H443: 6 | I443: =G443*6+H443 -> 30 | K443: 4 | L443: 10 | M443: =K443*6+L443 -> 34 | O443: 7 | P443: 15 | Q443: =O443*6+P443 -> 57 | S443: MATHEWS | W443: CAULFIELD | X443: 3 | Y443: 6 | Z443: 1 | AA443: 1188 | AB443: 1333 | AC443: 89.122280570142536 | AD443: 14
A444: BEST PLAYERS | W444: PRESTON | X444: 3 | Y444: 7 | Z444: 0 | AA444: 1326 | AB444: 1292 | AC444: 102.63157894736842 | AD444: 12
A445: DANDENONG | D445: WALLACE | G445: HORAZCKO | J445: LUKAS | M445: PRENDERGAST | P445: McCONNELL | W445: SANDRINGHAM | X445: 3 | Y445: 7 | Z445: 0 | AA445: 1273 | AB445: 1371 | AC445: 92.851932895696578 | AD445: 12
A446: CAULFIELD | D446: EINSEDEL | G446: BRAZIER | J446: LESTER | M446: O'SULLIVAN | P446: AMBLER | S446: MORRISON | W446: FRANKSTON | X446: 3 | Y446: 7 | Z446: 0 | AA446: 1246 | AB446: 1344 | AC446: 92.708333333333329 | AD446: 12
A447: GOALKICKERS | W447: CAMBERWELL | X447: 1 | Y447: 9 | Z447: 0 | AA447: 1091 | AB447: 1446 | AC447: 75.449515905947436 | AD447: 4
A448: DANDENONG | D448: MADDEN 2 | G448: LAMBERT 2 | J448: ORTON 2 | L448: WRIGHT 2 | N448: TOWNSEND | Q448: BRIESE | S448: COUSINS
A449: CAULFIELD | D449: O'SULLIVAN 2 | G449: MAIDMENT 2 | J449: TAYLOR | L449: TROTT | N449: EINSEDEL
A451: PRESTON | C451: 3 | D451: 4 | E451: =C451*6+D451 -> 22 | G451: 11 | H451: 7 | I451: =G451*6+H451 -> 73 | K451: 17 | L451: 9 | M451: =K451*6+L451 -> 111 | O451: 21 | P451: 13 | Q451: =O451*6+P451 -> 139 | S451: PRESTON
A452: FRANKSTON | C452: 6 | D452: 3 | E452: =C452*6+D452 -> 39 | G452: 8 | H452: 4 | I452: =G452*6+H452 -> 52 | K452: 14 | L452: 9 | M452: =K452*6+L452 -> 93 | O452: 17 | P452: 9 | Q452: =O452*6+P452 -> 111 | S452: OAKLEY
A453: BEST PLAYERS
A454: PRESTON | D454: P MARSHALL | G454: MARTIN | J454: BATT | M454: McKEON | O454: PREECE | R454: TOWAN
A455: FRANKSTON | D455: KENNEDY | G455: HUNTER | J455: MONCRIEFF | M455: GEDDES | O455: BREMNER | R455: LYNN
A456: GOALKICKERS
A457: PRESTON | D457: P MARSHALL 7 | G457: BATT 6 | I457: JESSOP 3 | K457: FRAZER | M457: McKEON | O457: VANN | Q457: MARKS | S457: COOPER
A458: FRANKSTON | D458: HUNTER 7 | G458: JONES 3 | I458: KENNEDY 2 | L458: GEDDES 2 | N458: BREMNER 2 | Q458: WATSON
A460: PRAHRAN | C460: 6 | D460: 5 | E460: =C460*6+D460 -> 41 | G460: 9 | H460: 7 | I460: =G460*6+H460 -> 61 | K460: 14 | L460: 11 | M460: =K460*6+L460 -> 95 | O460: 22 | P460: 14 | Q460: =O460*6+P460 -> 146 | S460: BEACH ROAD
A461: SANDRINGHAM | C461: 4 | D461: 1 | E461: =C461*6+D461 -> 25 | G461: 10 | H461: 6 | I461: =G461*6+H461 -> 66 | K461: 16 | L461: 7 | M461: =K461*6+L461 -> 103 | O461: 20 | P461: 10 | Q461: =O461*6+P461 -> 130 | S461: STABB
A462: BEST PLAYERS
A463: PRAHRAN | D463: WISE | G463: ANDERSON | J463: THORNE | M463: STONE | O463: SMITH | Q463: KELLY
A464: SANDRINGHAM | D464: HUNT | G464: OSBORNE | J464: PLEDGER | M464: WAY | O464: MAILING | Q464: KEAST
A465: GOALKICKERS
A466: PRAHRAN | D466: SMITH 7 | F466: McGUINNESS 4 | I466: THORNE 3 | K466: CLARKE 2 | M466: CHAPMAN 2 | P466: ZEUNART | R466: STONE | T466: DICKSON | W466: AUSTIN
A467: SANDRINGHAM | D467: HUNT 8 | G467: MAILING 6 | J467: BELL 2 | L467: KEAST 2 | N467: BEUS | P467: HAYES
A469: PORT MELBOURNE | C469: 5 | D469: 6 | E469: =C469*6+D469 -> 36 | G469: 9 | H469: 7 | I469: =G469*6+H469 -> 61 | K469: 16 | L469: 10 | M469: =K469*6+L469 -> 106 | O469: 21 | P469: 11 | Q469: =O469*6+P469 -> 137 | S469: C'WELL
A470: CAMBERWELL | C470: 2 | D470: 3 | E470: =C470*6+D470 -> 15 | G470: 4 | H470: 7 | I470: =G470*6+H470 -> 31 | K470: 7 | L470: 8 | M470: =K470*6+L470 -> 50 | O470: 10 | P470: 15 | Q470: =O470*6+P470 -> 75 | S470: GIBSON
A471: BEST PLAYERS
A472: PORT MELBOURNE | D472: BIANCO | G472: ALLENDER | J472: JOHNSON | M472: AANENSEN | P472: PYE | R472: BRICE
A473: CAMBERWELL | D473: JUDD | G473: TEMPLETON | J473: WRIGHT | M473: PRETTO | P473: FRYER | R473: ROURKE
A474: GOALKICKERS
A475: PORT MELBOURNE | D475: COOK 7 | F475: BIANCO 4 | I475: EBEYER 3 | K475: JIM CHRISTOU 2 | N475: O'RILEY | P475: ALLENDER | R475: AANENSEN | U475: WILKINSON | X475: BRICE
A476: CAMBERWELL | D476: BARR 2 | G476: JUDD 2 | I476: WRIGHT | K476: OLIVER | M476: ROHLEDER | O476: CAHILL | Q476: ROURKE | S476: COWLEY
A478: ROUND 11 | E478: 29TH JUNE | J478: WEATHER | N478: WET WINDY | S478: PLAYED AT
D479: 1ST QTR | H479: 2ND QTR | L479: 3RD QTR | P479: FINAL | S479: TOORAK PARK
A480: PRAHRAN | C480: 3 | D480: 2 | E480: =C480*6+D480 -> 20 | G480: 5 | H480: 5 | I480: =G480*6+H480 -> 35 | K480: 7 | L480: 8 | M480: =K480*6+L480 -> 50 | O480: 11 | P480: 13 | Q480: =O480*6+P480 -> 79 | S480: UMPIRE | X480: LADDER | AB480: ROUND | AD480: 11
A481: GEELONG WEST | C481: 5 | D481: 2 | E481: =C481*6+D481 -> 32 | G481: 6 | H481: 5 | I481: =G481*6+H481 -> 41 | K481: 8 | L481: 10 | M481: =K481*6+L481 -> 58 | O481: 10 | P481: 14 | Q481: =O481*6+P481 -> 74 | S481: OAKLEY
A482: BEST PLAYERS | W482: TEAM | X482: W | Y482: L | Z482: D | AA482: FOR | AB482: AGST | AC482: % | AD482: PTS
A483: PRAHRAN | D483: DELLAMARTA | G483: ANDRSON | J483: CLARKE | M483: WISE | O483: AUSTIN | Q483: THORNE
A484: GEELONG WEST | D484: GILMORE | G484: BURNS | J484: TAYLOR | M484: S WELLS | O484: YATES | Q484: SCARLETT | W484: COBURG | X484: 10 | Y484: 1 | Z484: 0 | AA484: 1467 | AB484: 1154 | AC484: 127.12305025996534 | AD484: 40
A485: GOALKICKERS | W485: PRAHRAN | X485: 8 | Y485: 3 | Z485: 0 | AA485: 1389 | AB485: 1359 | AC485: 102.2075055187638 | AD485: 32
A486: PRAHRAN | D486: DELLAMARTA 6 | H486: SMITH 2 | K486: MILLS | M486: THORNE | O486: AUSTIN | W486: PORT MELBOURNE | X486: 7 | Y486: 4 | Z486: 0 | AA486: 1547 | AB486: 1360 | AC486: 113.75 | AD486: 28
A487: GEELONG WEST | D487: SCARLETT 2 | G487: RADOJEVIC 2 | J487: ARKLAY 2 | M487: BURNS | O487: TAYLOR | Q487: G WELLS | S487: CRICHTON | W487: GEELONG WEST | X487: 7 | Y487: 4 | Z487: 0 | AA487: 1483 | AB487: 1468 | AC487: 101.02179836512262 | AD487: 28
A489: COBURG | C489: 3 | D489: 2 | E489: =C489*6+D489 -> 20 | G489: 5 | H489: 3 | I489: =G489*6+H489 -> 33 | K489: 8 | L489: 8 | M489: =K489*6+L489 -> 56 | O489: 9 | P489: 13 | Q489: =O489*6+P489 -> 67 | S489: COBURG | W489: DANDENONG | X489: 6 | Y489: 4 | Z489: 1 | AA489: 1329 | AB489: 1222 | AC489: 108.75613747954174 | AD489: 26
A490: DANDENONG | C490: 2 | D490: 1 | E490: =C490*6+D490 -> 13 | G490: 3 | H490: 2 | I490: =G490*6+H490 -> 20 | K490: 6 | L490: 3 | M490: =K490*6+L490 -> 39 | O490: 6 | P490: 9 | Q490: =O490*6+P490 -> 45 | S490: CASEY | W490: PRESTON | X490: 4 | Y490: 7 | Z490: 0 | AA490: 1409 | AB490: 1369 | AC490: 102.9218407596786 | AD490: 16
A491: BEST PLAYERS | W491: FRANKSTON | X491: 4 | Y491: 7 | Z491: 0 | AA491: 1327 | AB491: 1407 | AC491: 94.314143567874908 | AD491: 16
A492: COBURG | D492: HERBERT | G492: BURT | J492: MILROY | M492: NIMMO | P492: WESCOMBE | R492: SMITH | W492: SANDRINGHAM | X492: 4 | Y492: 7 | Z492: 0 | AA492: 1356 | AB492: 1444 | AC492: 93.905817174515235 | AD492: 16
A493: DANDENONG | D493: DROSCHER | G493: HORAZCKO | J493: HARPER | M493: TOWNSEND | P493: WRIGHT | R493: S KNIGHT | W493: CAULFIELD | X493: 3 | Y493: 7 | Z493: 1 | AA493: 1265 | AB493: 1416 | AC493: 89.336158192090394 | AD493: 14
A494: GOALKICKERS | W494: CAMBERWELL | X494: 1 | Y494: 10 | Z494: 0 | AA494: 1154 | AB494: 1527 | AC494: 75.573018991486578 | AD494: 4
A495: COBURG | D495: SMITH 4 | G495: HALBERT | I495: BURT | K495: HERBERT | M495: FISHER | O495: WESCOMBE
A496: DANDENONG | D496: TOWNSEND 3 | H496: BRIESE 2 | K496: WRIGHT
A498: PRESTON | C498: 5 | D498: 4 | E498: =C498*6+D498 -> 34 | G498: 8 | H498: 6 | I498: =G498*6+H498 -> 54 | K498: 11 | L498: 9 | M498: =K498*6+L498 -> 75 | O498: 12 | P498: 11 | Q498: =O498*6+P498 -> 83 | S498: PRINCES PARK
A499: CAULFIELD | C499: 2 | D499: 1 | E499: =C499*6+D499 -> 13 | G499: 5 | H499: 10 | I499: =G499*6+H499 -> 40 | K499: 6 | L499: 15 | M499: =K499*6+L499 -> 51 | O499: 10 | P499: 17 | Q499: =O499*6+P499 -> 77 | S499: TORNEY
A500: BEST PLAYERS
A501: PRESTON | D501: MARKS | G501: VANN | J501: GOUGH | M501: McCULLOCH | P501: MARTIN
A502: CAULFIELD | D502: AMBLER | G502: EINSEDEL | J502: MILNER | M502: O'SULLIVAN | P502: McLEOD | S502: MORRISON
A503: GOALKICKERS
A504: PRESTON | D504: CANN 3 | F504: FRAZER 3 | I504: BATT 2 | K504: MARTIN | M504: VANN | O504: WILLIAMS | R504: MARKS
A505: CAULFIELD | D505: DAVIDSON 4 | G505: MILNER 4 | J505: RUSS 2
A507: FRANKSTON | C507: 0 | D507: 4 | E507: =C507*6+D507 -> 4 | G507: 2 | H507: 6 | I507: =G507*6+H507 -> 18 | K507: 7 | L507: 11 | M507: =K507*6+L507 -> 53 | O507: 11 | P507: 15 | Q507: =O507*6+P507 -> 81 | S507: FRANKSTON
A508: CAMBERWELL | C508: 2 | D508: 0 | E508: =C508*6+D508 -> 12 | G508: 6 | H508: 2 | I508: =G508*6+H508 -> 38 | K508: 9 | L508: 2 | M508: =K508*6+L508 -> 56 | O508: 10 | P508: 3 | Q508: =O508*6+P508 -> 63 | S508: STABB
A509: BEST PLAYERS
A510: FRANKSTON | D510: HUNTER | G510: ALDRIDGE | J510: BOYD | M510: BREMNER | P510: WALTON | S510: GEDDES
A511: CAMBERWELL | D511: NEILSON | G511: JUDD | J511: CHAMBERLAIN | M511: TEMPLETON | P511: CAHILL | S511: PRETTO
A512: GOALKICKERS
A513: FRANKSTON | D513: SERAFINI 3 | G513: ALDRIDGE 3 | J513: BOYD 2 | L513: HUNTER | N513: BREMNER | P513: GEDDES
A514: CAMBERWELL | D514: WRIGHT 3 | G514: JUDD 2 | I514: CHAMBERLAIN | L514: BARR | M514: HIRST | O514: SLACIK | Q514: ROURKE
A516: SANDRINGHAM | C516: 3 | D516: 6 | E516: =C516*6+D516 -> 24 | G516: 5 | H516: 11 | I516: =G516*6+H516 -> 41 | K516: 7 | L516: 14 | M516: =K516*6+L516 -> 56 | O516: 10 | P516: 23 | Q516: =O516*6+P516 -> 83 | S516: PORT MELBOURNE
A517: PORT MELBOURNE | C517: 1 | D517: 3 | E517: =C517*6+D517 -> 9 | G517: 6 | H517: 3 | I517: =G517*6+H517 -> 39 | K517: 10 | L517: 7 | M517: =K517*6+L517 -> 67 | O517: 11 | P517: 7 | Q517: =O517*6+P517 -> 73 | S517: VERGONA
A518: BEST PLAYERS
A519: SANDRINGHAM | D519: WAY | G519: PLEDGER | J519: CLARK | M519: WILKINS | P519: KEAST | S519: OSBORNE
A520: PORT MELBOURNE | D520: AANENSEN | G520: EBEYER | J520: GOSS | M520: WILKINSON | P520: DERMOTT
A521: GOALKICKERS
A522: SANDRINGHAM | D522: HUNT 4 | G522: MAILING 2 | J522: KEAST | L522: SIMS | N522: MACKIE | P522: BEUS
A523: PORT MELBOURNE | D523: WILKINSON 3 | G523: COOK 3 | I523: SWAN 2 | K523: GOSS | M523: EBEYER | O523: BIANCO
A525: ROUND 12 | E525: 6TH JULY | S525: PLAYED AT
D526: 1ST QTR | H526: 2ND QTR | L526: 3RD QTR | P526: FINAL | S526: BEACH ROAD
A527: SANDRINGHAM | C527: 6 | D527: 2 | E527: =C527*6+D527 -> 38 | G527: 10 | H527: 8 | I527: =G527*6+H527 -> 68 | K527: 16 | L527: 12 | M527: =K527*6+L527 -> 108 | O527: 21 | P527: 16 | Q527: =O527*6+P527 -> 142 | S527: UMPIRE | X527: LADDER | AB527: ROUND | AD527: 12
A528: FRANKSTON | C528: 1 | D528: 3 | E528: =C528*6+D528 -> 9 | G528: 5 | H528: 4 | I528: =G528*6+H528 -> 34 | K528: 7 | L528: 6 | M528: =K528*6+L528 -> 48 | O528: 9 | P528: 8 | Q528: =O528*6+P528 -> 62 | S528: MATHEWS
A529: BEST PLAYERS | W529: TEAM | X529: W | Y529: L | Z529: D | AA529: FOR | AB529: AGST | AC529: % | AD529: PTS
A530: SANDRINGHAM | D530: KEAST | F530: HAYES | I530: CLARK | L530: OSBORNE | O530: HODGES | R530: MACKIE
A531: FRANKSTON | D531: JEFFRIES | F531: HORLER | I531: GEDDES | L531: HUNTER | W531: COBURG | X531: 11 | Y531: 1 | Z531: 0 | AA531: 1593 | AB531: 1245 | AC531: 127.95180722891567 | AD531: 44
A532: GOALKICKERS | W532: GEELONG WEST | X532: 8 | Y532: 4 | Z532: 0 | AA532: 1576 | AB532: 1552 | AC532: 101.54639175257732 | AD532: 32
A533: SANDRINGHAM | D533: HUNT 7 | F533: HAYES 4 | H533: SIMS 3 | J533: KEAST | L533: GIAMPAOLO | N533: LYONS | P533: BELL | Q533: MAILING | S533: WILKINS | W533: PRAHRAN | X533: 8 | Y533: 4 | Z533: 0 | AA533: 1474 | AB533: 1485 | AC533: 99.259259259259252 | AD533: 32
A534: FRANKSTON | D534: SERAFINI 4 | G534: ALDRIDGE 2 | J534: JONES | L534: HUNTER | N534: FARQUHAR | W534: DANDENONG | X534: 7 | Y534: 4 | Z534: 1 | AA534: 1455 | AB534: 1307 | AC534: 111.32364192807957 | AD534: 30
E535: 13TH JULY | J535: WEATHER | M535: NORTH WEST WIND RAIN
A536: GEELONG WEST | C536: 4 | D536: 5 | E536: =C536*6+D536 -> 29 | G536: 6 | H536: 7 | I536: =G536*6+H536 -> 43 | K536: 11 | L536: 12 | M536: =K536*6+L536 -> 78 | O536: 13 | P536: 15 | Q536: =O536*6+P536 -> 93 | S536: GEELONG WEST | W536: PORT MELBOURNE | X536: 7 | Y536: 5 | Z536: 0 | AA536: 1631 | AB536: 1453 | AC536: 112.25051617343428 | AD536: 28
A537: PORT MELBOURNE | C537: 2 | D537: 5 | E537: =C537*6+D537 -> 17 | G537: 5 | H537: 4 | I537: =G537*6+H537 -> 34 | K537: 10 | L537: 7 | M537: =K537*6+L537 -> 67 | O537: 12 | P537: 12 | Q537: =O537*6+P537 -> 84 | S537: MATHEWS | W537: SANDRINGHAM | X537: 5 | Y537: 7 | Z537: 0 | AA537: 1498 | AB537: 1506 | AC537: 99.468791500664011 | AD537: 20
A538: BEST PLAYERS | W538: PRESTON | X538: 4 | Y538: 8 | Z538: 0 | AA538: 1495 | AB538: 1466 | AC538: 101.97817189631651 | AD538: 16
A539: GEELONG WEST | D539: TAYLOR | G539: GIBSON | I539: MANSON | L539: RADOJEVIC | O539: ARKLAY | Q539: S WELLS | W539: FRANKSTON | X539: 4 | Y539: 8 | Z539: 0 | AA539: 1389 | AB539: 1549 | AC539: 89.670755326016788 | AD539: 16
A540: PORT MELBOURNE | D540: HALL | G540: O'RILEY | I540: JOHN CHRISTOU | L540: EVANS | O540: DAVIES | Q540: EBEYER | W540: CAULFIELD | X540: 3 | Y540: 8 | Z540: 1 | AA540: 1356 | AB540: 1542 | AC540: 87.937743190661479 | AD540: 14
A541: GOALKICKERS | W541: CAMBERWELL | X541: 2 | Y541: 10 | Z541: 0 | AA541: 1251 | AB541: 1613 | AC541: 77.557346559206451 | AD541: 8
A542: GEELONG WEST | D542: RADOJEVIC 7 | G542: WOOLFE 2 | J542: MANSON | L542: ARKLAY | N542: HINCK | P542: YATES
A543: PORT MELBOURNE | D543: EVANS 5 | G543: O'RILEY 3 | J543: EBEYER 3 | M543: COOK
A545: DANDENONG | C545: 1 | D545: 3 | E545: =C545*6+D545 -> 9 | G545: 10 | H545: 9 | I545: =G545*6+H545 -> 69 | K545: 16 | L545: 14 | M545: =K545*6+L545 -> 110 | O545: 18 | P545: 18 | Q545: =O545*6+P545 -> 126 | S545: DANDENONG
A546: PRAHRAN | C546: 5 | D546: 3 | E546: =C546*6+D546 -> 33 | G546: 7 | H546: 3 | I546: =G546*6+H546 -> 45 | K546: 11 | L546: 6 | M546: =K546*6+L546 -> 72 | O546: 12 | P546: 13 | Q546: =O546*6+P546 -> 85 | S546: GROOM
A547: BEST PLAYERS
A548: DANDENONG | D548: WRIGHT | G548: BRIESE | J548: HARPER | M548: COUSINS | P548: P KNIGHT | R548: LAMBERT
A549: PRAHRAN | D549: McGUINNESS | G549: LOWE | J549: FOLEY | M549: ANDERSON
A550: GOALKICKERS
A551: DANDENONG | D551: BIFFIN 4 | F551: POWLES 4 | I551: LAMBERT 3 | L551: BRIESE 2 | N551: TOWNSEND 2 | Q551: McCONNELL 2 | T551: PRENDERGAST
A552: PRAHRAN | D552: LOWE 4 | G552: DELLAMARTA 2 | J552: SMITH 2 | M552: MILLS | O552: THORNE | Q552: CHAPMAN | T552: McGUINNESS
A554: CAMBERWELL | C554: 5 | D554: 3 | E554: =C554*6+D554 -> 33 | G554: 9 | H554: 8 | I554: =G554*6+H554 -> 62 | K554: 10 | L554: 11 | M554: =K554*6+L554 -> 71 | O554: 14 | P554: 13 | Q554: =O554*6+P554 -> 97 | S554: PRESTON
A555: PRESTON | C555: 2 | D555: 3 | E555: =C555*6+D555 -> 15 | G555: 5 | H555: 9 | I555: =G555*6+H555 -> 39 | K555: 10 | L555: 14 | M555: =K555*6+L555 -> 74 | O555: 11 | P555: 20 | Q555: =O555*6+P555 -> 86 | S555: BUDGE
A556: BEST PLAYERS
A557: CAMBERWELL | D557: HIPWORTH | G557: WRIGHT | J557: TEAKEL | M557: NEILSON | P557: JUDD | R557: SPITHILL
A558: PRESTON | D558: CLARK | G558: McKEON | J558: TOWAN | M558: JESSOP
A559: GOALKICKERS
A560: CAMBERWELL | D560: SPITHILL 3 | G560: SLACIK 3 | I560: ROURKE 2 | L560: JUDD 2 | N560: TEMPLETON | Q560: HIRST | R560: HIPWORTH | U560: DAVIDSON
A561: PRESTON | D561: JESSOP 3 | G561: VANN 2 | I561: FRAZER 2 | L561: BATT 2 | N561: McKEON | Q561: CANN
A563: COBURG | C563: 7 | D563: 2 | E563: =C563*6+D563 -> 44 | G563: 10 | H563: 5 | I563: =G563*6+H563 -> 65 | K563: 16 | L563: 12 | M563: =K563*6+L563 -> 108 | O563: 19 | P563: 12 | Q563: =O563*6+P563 -> 126 | S563: PRINCES PARK
A564: CAULFIELD | C564: 4 | D564: 3 | E564: =C564*6+D564 -> 27 | G564: 8 | H564: 5 | I564: =G564*6+H564 -> 53 | K564: 10 | L564: 10 | M564: =K564*6+L564 -> 70 | O564: 13 | P564: 13 | Q564: =O564*6+P564 -> 91 | S564: OAKLEY
A565: BEST PLAYERS
A566: COBURG | D566: BURT | G566: MILROY | J566: DOUGLAS | M566: HARTIGAN | P566: BEATTIE | S566: PITT
A567: CAULFIELD | D567: BRASIER | G567: EINSEDEL | J567: DAVIDSON | M567: RUSS | P567: MORRISON | S567: MITCHELL
A568: GOALKICKERS
A569: COBURG | D569: SMITH 6 | G569: COLLINS 4 | J569: FISHER 4 | M569: HERBERT 3 | P569: HALBERT 2
A570: CAULFIELD | D570: DAVIDSON 5 | G570: O'LOUGHLIN 3 | J570: O'SULLIVAN 2 | M570: TROTT | O570: LESTER | Q570: KING
A572: ROUND 13 | E572: 20TH JULY | J572: WEATHER | N572: NORTH WEST WIND RAIN | S572: PLAYED AT
D573: 1ST QTR | H573: 2ND QTR | L573: 3RD QTR | P573: FINAL | S573: PORT MELBOURNE
A574: PORT MELBOURNE | C574: 3 | D574: 3 | E574: =C574*6+D574 -> 21 | G574: 9 | H574: 9 | I574: =G574*6+H574 -> 63 | K574: 15 | L574: 12 | M574: =K574*6+L574 -> 102 | O574: 21 | P574: 14 | Q574: =O574*6+P574 -> 140 | S574: UMPIRE | X574: LADDER | AB574: ROUND | AD574: 13
A575: DANDENONG | C575: 5 | D575: 6 | E575: =C575*6+D575 -> 36 | G575: 9 | H575: 9 | I575: =G575*6+H575 -> 63 | K575: 10 | L575: 14 | M575: =K575*6+L575 -> 74 | O575: 14 | P575: 18 | Q575: =O575*6+P575 -> 102 | S575: TORNEY
A576: BEST PLAYERS | W576: TEAM | X576: W | Y576: L | Z576: D | AA576: FOR | AB576: AGST | AC576: % | AD576: PTS
A577: PORT MELBOURNE | D577: O'RILEY | G577: DEMETRIOU | J577: EBEYER | M577: SWAN | O577: WILKINSON | R577: DERMOTT
A578: DANDENONG | D578: WALLACE | G578: LAMBERT | J578: HEAP | M578: S KNIGHT | W578: COBURG | X578: 12 | Y578: 1 | Z578: 0 | AA578: 1754 | AB578: 1307 | AC578: 134.20045906656466 | AD578: 48
A579: GOALKICKERS | O579: WILKINSON | R579: EVANS | W579: GEELONG WEST | X579: 9 | Y579: 4 | Z579: 0 | AA579: 1705 | AB579: 1662 | AC579: 102.58724428399519 | AD579: 36
A580: PORT MELBOURNE | D580: COOK 6 | F580: JIM CHRISTOU 4 | J580: ALLENDER 2 | M580: O'RILEY 2 | O580: BRICE 2 | Q580: EBEYER | S580: DERMOTT | W580: PRAHRAN | X580: 9 | Y580: 4 | Z580: 0 | AA580: 1594 | AB580: 1599 | AC580: 99.687304565353344 | AD580: 36
A581: DANDENONG | D581: LAMBERT 4 | G581: BRIESE 3 | I581: BIFFIN 3 | K581: TOWNSEND 2 | N581: McCONNELL | Q581: WALLACE | W581: PORT MELBOURNE | X581: 8 | Y581: 5 | Z581: 0 | AA581: 1771 | AB581: 1555 | AC581: 113.89067524115755 | AD581: 32
A583: COBURG | C583: 6 | D583: 3 | E583: =C583*6+D583 -> 39 | G583: 12 | H583: 7 | I583: =G583*6+H583 -> 79 | K583: 16 | L583: 7 | M583: =K583*6+L583 -> 103 | O583: 25 | P583: 11 | Q583: =O583*6+P583 -> 161 | S583: COBURG | W583: DANDENONG | X583: 7 | Y583: 5 | Z583: 1 | AA583: 1557 | AB583: 1447 | AC583: 107.60193503800967 | AD583: 30
A584: PRESTON | C584: 3 | D584: 2 | E584: =C584*6+D584 -> 20 | G584: 5 | H584: 3 | I584: =G584*6+H584 -> 33 | K584: 8 | L584: 12 | M584: =K584*6+L584 -> 60 | O584: 8 | P584: 14 | Q584: =O584*6+P584 -> 62 | S584: VERGONA | W584: SANDRINGHAM | X584: 6 | Y584: 7 | Z584: 0 | AA584: 1592 | AB584: 1582 | AC584: 100.63211125158028 | AD584: 24
A585: BEST PLAYERS | W585: PRESTON | X585: 4 | Y585: 9 | Z585: 0 | AA585: 1557 | AB585: 1627 | AC585: 95.697602950215114 | AD585: 16
A586: COBURG | D586: DOHNT | G586: FISHER | J586: SMITH | M586: HARTIGAN | P586: WESCOMBE | R586: PITT | W586: FRANKSTON | X586: 4 | Y586: 9 | Z586: 0 | AA586: 1499 | AB586: 1678 | AC586: 89.332538736591175 | AD586: 16
A587: PRESTON | D587: MARKS | G587: McKEON | J587: McGAW | W587: CAULFIELD | X587: 3 | Y587: 9 | Z587: 1 | AA587: 1470 | AB587: 1662 | AC587: 88.447653429602894 | AD587: 14
A588: GOALKICKERS | T588: BEATTIE | W588: CAMBERWELL | X588: 2 | Y588: 11 | Z588: 0 | AA588: 1327 | AB588: 1707 | AC588: 77.738722905682479 | AD588: 8
A589: COBURG | D589: SMITH 8 | F589: DOHNT 4 | H589: COLLINS 4 | J589: HALBERT 2 | M589: WESCOMBE 2 | P589: HERBERT 2 | R589: SHELDON | U589: FISHER
A590: PRESTON | D590: McKEON 3 | G590: BATT 2 | I590: MARKS | K590: VANN | M590: RUTTY
A592: SANDRINGHAM | C592: 1 | D592: 3 | E592: =C592*6+D592 -> 9 | G592: 7 | H592: 7 | I592: =G592*6+H592 -> 49 | K592: 8 | L592: 7 | M592: =K592*6+L592 -> 55 | O592: 14 | P592: 10 | Q592: =O592*6+P592 -> 94 | S592: C'WELL
A593: CAMBERWELL | C593: 5 | D593: 8 | E593: =C593*6+D593 -> 38 | G593: 7 | H593: 10 | I593: =G593*6+H593 -> 52 | K593: 10 | L593: 13 | M593: =K593*6+L593 -> 73 | O593: 10 | P593: 16 | Q593: =O593*6+P593 -> 76 | S593: CASEY
A594: BEST PLAYERS
A595: SANDRINGHAM | D595: WILKINS | G595: GIAMPAOLO | J595: PLEDGER | M595: WAY | O595: CLARK | Q595: OSBORNE
A596: CAMBERWELL | D596: PRETTO | G596: CHAMBERLAIN | J596: NEILSON | M596: TEMPLETON | O596: JUDD
A597: GOALKICKERS
A598: SANDRINGHAM | D598: HAYES 3 | G598: HUNT 2 | I598: GIAMPAOLO 2 | L598: WAY 2 | N598: MAILING 2 | Q598: MACKIE | S598: LYONS | U598: BEUS
A599: CAMBERWELL | D599: SPITHILL 3 | G599: SLACIK 3 | I599: HAYWOOD | L599: TEMPLETON | O599: DAVIDSON | R599: JUDD
A601: GEELONG WEST | C601: 9 | D601: 3 | E601: =C601*6+D601 -> 57 | G601: 12 | H601: 6 | I601: =G601*6+H601 -> 78 | K601: 17 | L601: 12 | M601: =K601*6+L601 -> 114 | O601: 19 | P601: 15 | Q601: =O601*6+P601 -> 129 | S601: FRANKSTON
A602: FRANKSTON | C602: 1 | D602: 4 | E602: =C602*6+D602 -> 10 | G602: 7 | H602: 4 | I602: =G602*6+H602 -> 46 | K602: 8 | L602: 8 | M602: =K602*6+L602 -> 56 | O602: 16 | P602: 14 | Q602: =O602*6+P602 -> 110 | S602: SNOOKS
A603: BEST PLAYERS
A604: GEELONG WEST | D604: GIBSON | G604: HINCK | J604: WOOLFE | M604: G WELLS | O604: CRICHTON | R604: BURNETT
A605: FRANKSTON | D605: HOUSDEN | G605: JEFFRIES | J605: BOYD | M605: RUGGLES | O605: STEWART | R605: SERAFINI
A606: GOALKICKERS
A607: GEELONG WEST | D607: WOOLFE 5 | G607: RADOJEVIC 4 | J607: CRICHTON 3 | M607: S WELLS 3 | P607: TAYLOR | R607: YATES | T607: BURNETT | W607: BURNS
A608: FRANKSTON | D608: SERAFINI 7 | G608: WALTON 2 | J608: RUGGLES 2 | M608: KENNEDY | O608: ALDRIDGE | R608: JONES | T608: HUNTER | V608: FARQUHAR
A610: PRAHRAN | C610: 9 | D610: 2 | E610: =C610*6+D610 -> 56 | G610: 11 | H610: 4 | I610: =G610*6+H610 -> 70 | K610: 15 | L610: 9 | M610: =K610*6+L610 -> 99 | O610: 18 | P610: 12 | Q610: =O610*6+P610 -> 120 | S610: TOORAK PARK
A611: CAULFIELD | C611: 1 | D611: 2 | E611: =C611*6+D611 -> 8 | G611: 8 | H611: 6 | I611: =G611*6+H611 -> 54 | K611: 11 | L611: 9 | M611: =K611*6+L611 -> 75 | O611: 17 | P611: 12 | Q611: =O611*6+P611 -> 114 | S611: MATHEWS
A612: BEST PLAYERS
A613: PRAHRAN | D613: JEFFREY | G613: THORNE | J613: SMITH | M613: ANDERSON | P613: DICKSON | S613: WISE
A614: CAULFIELD | D614: EINSEDEL | G614: RUSS | J614: AMBLER | M614: KING | P614: O'LOUGHLIN | S614: O'SULLIVAN
A615: GOALKICKERS
A616: PRAHRAN | D616: SMITH 8 | G616: THORNE 3 | J616: CHAPMAN 2 | M616: DELLAMARTA | P616: LOWE | R616: DICKSON | T616: AUSTIN | V616: McGUINNESS
A617: CAULFIELD | D617: AMBLER 4 | G617: O'LOUGHLIN 4 | J617: MILNER 3 | M617: RUSS 3 | O617: KING 2 | Q617: HUNT
A619: ROUND 14 | E619: 26TH JULY | J619: WEATHER | M619: NORTH WEST WIND SHOWERS | S619: PLAYED AT
D620: 1ST QTR | H620: 2ND QTR | L620: 3RD QTR | P620: FINAL | S620: TOORAK PARK
A621: PORT MELBOURNE | C621: 3 | D621: 4 | E621: =C621*6+D621 -> 22 | G621: 6 | H621: 10 | I621: =G621*6+H621 -> 46 | K621: 10 | L621: 16 | M621: =K621*6+L621 -> 76 | O621: 18 | P621: 23 | Q621: =O621*6+P621 -> 131 | S621: UMPIRE | X621: LADDER | AB621: ROUND | AD621: 14
A622: PRAHRAN | C622: 5 | D622: 4 | E622: =C622*6+D622 -> 34 | G622: 7 | H622: 10 | I622: =G622*6+H622 -> 52 | K622: 14 | L622: 13 | M622: =K622*6+L622 -> 97 | O622: 15 | P622: 17 | Q622: =O622*6+P622 -> 107 | S622: CASEY
A623: BEST PLAYERS | W623: TEAM | X623: W | Y623: L | Z623: D | AA623: FOR | AB623: AGST | AC623: % | AD623: PTS
A624: PORT MELBOURNE | D624: DERMOTT | G624: O'RILEY | I624: GOSS | L624: AANENSEN | O624: EBEYER | R624: BRICE
A625: PRAHRAN | D625: WISE | G625: MILLS | I625: McGUINNESS | L625: SMITH | O625: DICKSON | R625: CHAPMAN | W625: COBURG | X625: 13 | Y625: 1 | Z625: 0 | AA625: 1949 | AB625: 1380 | AC625: 141.231884057971 | AD625: 52
A626: GOALKICKERS | Q626: DERMOTT | W626: PORT MELBOURNE | X626: 9 | Y626: 5 | Z626: 0 | AA626: 1902 | AB626: 1662 | AC626: 114.4404332129964 | AD626: 36
A627: PORT MELBOURNE | D627: COOK 7 | F627: JIM CHRISTOU 2 | J627: ALLENDER 2 | M627: WILKINSON 2 | P627: GOSS 2 | R627: EBEYER 2 | W627: GEELONG WEST | X627: 9 | Y627: 5 | Z627: 0 | AA627: 1820 | AB627: 1821 | AC627: 99.945085118066999 | AD627: 36
A628: PRAHRAN | D628: SMITH 6 | F628: LOWE 2 | H628: WISE 2 | J628: SOULOS | L628: DELLAMARTA | O628: STONE | Q628: CHAPMAN | S628: DICKSON | W628: PRAHRAN | X628: 9 | Y628: 5 | Z628: 0 | AA628: 1701 | AB628: 1730 | AC628: 98.323699421965316 | AD628: 36
A630: SANDRINGHAM | C630: 6 | D630: 4 | E630: =C630*6+D630 -> 40 | G630: 9 | H630: 6 | I630: =G630*6+H630 -> 60 | K630: 12 | L630: 11 | M630: =K630*6+L630 -> 83 | O630: 14 | P630: 12 | Q630: =O630*6+P630 -> 96 | S630: DANDENONG | W630: DANDENONG | X630: 7 | Y630: 6 | Z630: 1 | AA630: 1635 | AB630: 1543 | AC630: 105.96241088788075 | AD630: 30
A631: DANDENONG | C631: 3 | D631: 1 | E631: =C631*6+D631 -> 19 | G631: 6 | H631: 6 | I631: =G631*6+H631 -> 42 | K631: 7 | L631: 12 | M631: =K631*6+L631 -> 54 | O631: 10 | P631: 16 | Q631: =O631*6+P631 -> 76 | S631: STABB | W631: SANDRINGHAM | X631: 7 | Y631: 7 | Z631: 0 | AA631: 1688 | AB631: 1660 | AC631: 101.68674698795181 | AD631: 28
A632: BEST PLAYERS | W632: PRESTON | X632: 5 | Y632: 9 | Z632: 0 | AA632: 1716 | AB632: 1742 | AC632: 98.507462686567166 | AD632: 20
A633: SANDRINGHAM | D633: HODGES | G633: KEAST | J633: BEUS | M633: OSBORNE | P633: CLARK | R633: HAYES | W633: CAULFIELD | X633: 4 | Y633: 9 | Z633: 1 | AA633: 1625 | AB633: 1780 | AC633: 91.292134831460672 | AD633: 18
A634: DANDENONG | D634: LUKAS | G634: S KNIGHT | J634: COUSINS | M634: WALLACE | P634: HARPER | W634: FRANKSTON | X634: 4 | Y634: 10 | Z634: 0 | AA634: 1572 | AB634: 1873 | AC634: 83.929524826481583 | AD634: 16
A635: GOALKICKERS | W635: CAMBERWELL | X635: 2 | Y635: 12 | Z635: 0 | AA635: 1445 | AB635: 1862 | AC635: 77.604726100966701 | AD635: 8
A636: SANDRINGHAM | D636: HUNT 4 | G636: BEUS 3 | I636: HAYES 3 | K636: WAY 2 | M636: GIAMPAOLO | P636: MAILING
A637: DANDENONG | D637: LAMBERT 2 | G637: BIFFIN 2 | I637: HEAP 2 | K637: WRIGHT | M637: HORAZCKO | P637: LUKAS | R637: BRIESE
A639: PRESTON | C639: 6 | D639: 3 | E639: =C639*6+D639 -> 39 | G639: 10 | H639: 11 | I639: =G639*6+H639 -> 71 | K639: 14 | L639: 16 | M639: =K639*6+L639 -> 100 | O639: 23 | P639: 21 | Q639: =O639*6+P639 -> 159 | S639: GEELONG WEST
A640: GEELONG WEST | C640: 3 | D640: 3 | E640: =C640*6+D640 -> 21 | G640: 10 | H640: 6 | I640: =G640*6+H640 -> 66 | K640: 15 | L640: 10 | M640: =K640*6+L640 -> 100 | O640: 17 | P640: 13 | Q640: =O640*6+P640 -> 115 | S640: GROOM
A641: BEST PLAYERS
A642: PRESTON | D642: MARKS | G642: P MARSHALL | J642: BATT | M642: FRAZER | O642: McEWAN | R642: PREECE
A643: GEELONG WEST | D643: RADOJEVIC | G643: WOOLFE | J643: G WELLS | M643: GIBSON
A644: GOALKICKERS
A645: PRESTON | D645: FRAZER 7 | F645: COOPER 4 | I645: McKEON 3 | K645: BATT 2 | M645: MIERS 2 | O645: JESSOP 2 | Q645: P MARSHALL | T645: MARKS | W645: MARTIN
A646: GEELONG WEST | D646: RADOJEVIC 6 | G646: BURNS 2 | I646: BROWNE | K646: BRIGHT | M646: MANSON | O646: G WELLS | Q646: S WELLS | S646: WOOLFE | W646: CRICHTON | X646: BEATON | AA646: HINCK
A648: CAULFIELD | C648: 7 | D648: 8 | E648: =C648*6+D648 -> 50 | G648: 13 | H648: 14 | I648: =G648*6+H648 -> 92 | K648: 18 | L648: 18 | M648: =K648*6+L648 -> 126 | O648: 22 | P648: 23 | Q648: =O648*6+P648 -> 155 | S648: PRINCES PARK
A649: CAMBERWELL | C649: 2 | D649: 2 | E649: =C649*6+D649 -> 14 | G649: 4 | H649: 4 | I649: =G649*6+H649 -> 28 | K649: 11 | L649: 8 | M649: =K649*6+L649 -> 74 | O649: 17 | P649: 16 | Q649: =O649*6+P649 -> 118 | S649: VERGONA
A650: BEST PLAYERS
A651: CAULFIELD | D651: DAVIDSON | G651: O'SULLIVAN | J651: RUSS | M651: EINSEDEL | O651: MILNER | Q651: O'LOUGHLIN
A652: CAMBERWELL | D652: WRIGHT | G652: NEILSON | J652: CAHILL | M652: PRETTO | O652: TEAKEL | Q652: SLACIK
A653: GOALKICKERS
A654: CAULFIELD | D654: DAVIDSON 5 | G654: O'LOUGHLIN 3 | J654: KING 3 | L654: O'SULLIVAN 2 | O654: RUSS 2 | Q654: BRUMMELLAN 2 | U654: MILNER 2 | X654: TROTT | Z654: UPFAL | AB654: AMBLER
A655: CAMBERWELL | D655: WRIGHT 3 | G655: HAYWOOD 2 | J655: TEMPLETON 2 | M655: DAVIDSON 2 | P655: FRYER 2 | R655: ROURKE 2 | U655: PEVITT 2 | X655: SLACIK | Z655: JUDD
A657: COBURG | C657: 6 | D657: 4 | E657: =C657*6+D657 -> 40 | G657: 11 | H657: 11 | I657: =G657*6+H657 -> 77 | K657: 16 | L657: 15 | M657: =K657*6+L657 -> 111 | O657: 29 | P657: 21 | Q657: =O657*6+P657 -> 195 | S657: COBURG
A658: FRANKSTON | C658: 4 | D658: 1 | E658: =C658*6+D658 -> 25 | G658: 5 | H658: 2 | I658: =G658*6+H658 -> 32 | K658: 11 | L658: 6 | M658: =K658*6+L658 -> 72 | O658: 11 | P658: 7 | Q658: =O658*6+P658 -> 73 | S658: TORNEY
A659: BEST PLAYERS
A660: COBURG | D660: MILROY | G660: COLLINS | J660: HALBERT | M660: FISHER | P660: NIMMO | R660: HERBERT
A661: FRANKSTON | D661: THOMPSON | G661: HOUSDEN | J661: HUMPHREY | M661: MERRINGTON | P661: SERAFINI
A662: GOALKICKERS
A663: COBURG | D663: COLLINS 5 | F663: FISHER 5 | H663: HALBERT 4 | J663: SMITH 4 | L663: MILROY 3 | N663: WESCOMBE 2 | Q663: HERBERT 2 | T663: SHELDON 2 | W663: DOHNT | X663: SALTMARSH
A664: FRANKSTON | D664: SERAFINI 5 | G664: HUNTER 2 | J664: WALTON 2 | M664: KENNEDY | O664: BELL
A666: ROUND 15 | E666: 3RD AUGUST | J666: WEATHER | N666: WEST WIND FINE | S666: PLAYED AT
D667: 1ST QTR | H667: 2ND QTR | L667: 3RD QTR | P667: FINAL | S667: GEE | T667: W
A668: GEELONG WEST | C668: 4 | D668: 3 | E668: =C668*6+D668 -> 27 | G668: 6 | H668: 7 | I668: =G668*6+H668 -> 43 | K668: 9 | L668: 13 | M668: =K668*6+L668 -> 67 | O668: 14 | P668: 17 | Q668: =O668*6+P668 -> 101 | S668: UMPIRE | X668: LADDER | AB668: ROUND | AD668: 15
A669: DANDENONG | C669: 3 | D669: 4 | E669: =C669*6+D669 -> 22 | G669: 8 | H669: 10 | I669: =G669*6+H669 -> 58 | K669: 10 | L669: 12 | M669: =K669*6+L669 -> 72 | O669: 13 | P669: 13 | Q669: =O669*6+P669 -> 91 | S669: OAKLEY
A670: BEST PLAYERS | W670: TEAM | X670: W | Y670: L | Z670: D | AA670: FOR | AB670: AGST | AC670: % | AD670: PTS
A671: GEELONG WEST | D671: DENMEAD | G671: CRICHTON | J671: FOOTE | M671: WOOLFE | P671: GIBSON | S671: FRIEND
A672: DANDENONG | D672: COUSINS | G672: P KNIGHT | J672: S KNIGHT | M672: WALLACE | P672: LUKAS | W672: COBURG | X672: 14 | Y672: 1 | Z672: 0 | AA672: 2064 | AB672: 1486 | AC672: 138.89636608344549 | AD672: 56
A673: GOALKICKERS | W673: PORT MELBOURNE | X673: 10 | Y673: 5 | Z673: 0 | AA673: 2057 | AB673: 1762 | AC673: 116.74233825198638 | AD673: 40
A674: GEELONG WEST | D674: CRICHTON 4 | G674: G WELLS 3 | J674: TAYLOR 3 | M674: S WELLS | O674: WOOLFE | Q674: MANSON | S674: BURNETT | W674: GEELONG WEST | X674: 10 | Y674: 5 | Z674: 0 | AA674: 1921 | AB674: 1912 | AC674: 100.47071129707113 | AD674: 40
A675: DANDENONG | D675: ORTON 4 | G675: LAMBERT 2 | J675: P KNIGHT 2 | M675: WRIGHT 2 | P675: MADDEN 2 | S675: ROSS | W675: PRAHRAN | X675: 10 | Y675: 5 | Z675: 0 | AA675: 1857 | AB675: 1867 | AC675: 99.46438136047135 | AD675: 40
A677: PORT MELBOURNE | C677: 6 | D677: 6 | E677: =C677*6+D677 -> 42 | G677: 9 | H677: 9 | I677: =G677*6+H677 -> 63 | K677: 19 | L677: 14 | M677: =K677*6+L677 -> 128 | O677: 23 | P677: 17 | Q677: =O677*6+P677 -> 155 | S677: PRESTON | W677: SANDRINGHAM | X677: 8 | Y677: 7 | Z677: 0 | AA677: 1836 | AB677: 1782 | AC677: 103.03030303030303 | AD677: 32
A678: PRESTON | C678: 4 | D678: 2 | E678: =C678*6+D678 -> 26 | G678: 7 | H678: 8 | I678: =G678*6+H678 -> 50 | K678: 10 | L678: 9 | M678: =K678*6+L678 -> 69 | O678: 14 | P678: 16 | Q678: =O678*6+P678 -> 100 | S678: SNOOKS | W678: DANDENONG | X678: 7 | Y678: 7 | Z678: 1 | AA678: 1726 | AB678: 1644 | AC678: 104.98783454987834 | AD678: 30
A679: BEST PLAYERS | W679: PRESTON | X679: 5 | Y679: 10 | Z679: 0 | AA679: 1816 | AB679: 1897 | AC679: 95.730100158144438 | AD679: 20
A680: PORT MELBOURNE | D680: ALLENDER | G680: JIM CHRISTOU | J680: EBEYER | M680: SWAN | O680: BRICE | Q680: GOSS | W680: CAULFIELD | X680: 4 | Y680: 10 | Z680: 1 | AA680: 1747 | AB680: 1928 | AC680: 90.612033195020743 | AD680: 18
A681: PRESTON | D681: McEWAN | G681: TOWAN | J681: JESSOP | W681: FRANKSTON | X681: 4 | Y681: 11 | Z681: 0 | AA681: 1709 | AB681: 2029 | AC681: 84.228684080827989 | AD681: 16
A682: GOALKICKERS | Q682: AANENSEN | W682: CAMBERWELL | X682: 2 | Y682: 13 | Z682: 0 | AA682: 1551 | AB682: 1977 | AC682: 78.45220030349013 | AD682: 8
A683: PORT MELBOURNE | D683: COOK 4 | F683: ALLENDER 4 | I683: EBEYER 4 | K683: JIM CHRISTOU 3 | N683: O'RILEY 3 | P683: EVANS 2 | R683: GOSS | T683: WILKINSON
A684: PRESTON | D684: FRAZER 2 | F684: COOPER 2 | I684: McEWAN 2 | L684: JESSOP 2 | N684: VANN 2 | P684: MARKS | R684: CANN | T684: MIERS | V684: MARTIN
A686: SANDRINGHAM | C686: 7 | D686: 1 | E686: =C686*6+D686 -> 43 | G686: 13 | H686: 7 | I686: =G686*6+H686 -> 85 | K686: 17 | L686: 12 | M686: =K686*6+L686 -> 114 | O686: 22 | P686: 16 | Q686: =O686*6+P686 -> 148 | S686: BEACH ROAD
A687: CAULFIELD | C687: 7 | D687: 6 | E687: =C687*6+D687 -> 48 | G687: 10 | H687: 7 | I687: =G687*6+H687 -> 67 | K687: 13 | L687: 10 | M687: =K687*6+L687 -> 88 | O687: 18 | P687: 14 | Q687: =O687*6+P687 -> 122 | S687: WILSON
A688: BEST PLAYERS
A689: SANDRINGHAM | D689: BEUS | G689: JONES | J689: PLEDGER | M689: LYONS | O689: KEAST | R689: KELLY
A690: CAULFIELD | D690: O'SULLIVAN | G690: EINSEDEL | J690: MILNER | M690: KING | O690: AMBLER | R690: LESTER
A691: GOALKICKERS
A692: SANDRINGHAM | D692: JONES 9 | F692: MAILING 4 | I692: BEUS 3 | K692: PLEDGER | M692: ELLIOTT | O692: CLARK | Q692: KELLY | S692: WAY | U692: GILMORE
A693: CAULFIELD | D693: MILNER 6 | F693: O'SULLIVAN 5 | I693: DAVIDSON 2 | L693: O'LOUGHLIN 2 | O693: TROTT | Q693: BRUMMELLAN | U693: AMBLER
A695: PRAHRAN | C695: 6 | D695: 3 | E695: =C695*6+D695 -> 39 | G695: 14 | H695: 8 | I695: =G695*6+H695 -> 92 | K695: 17 | L695: 12 | M695: =K695*6+L695 -> 114 | O695: 23 | P695: 18 | Q695: =O695*6+P695 -> 156 | S695: FRANKSTON
A696: FRANKSTON | C696: 5 | D696: 7 | E696: =C696*6+D696 -> 37 | G696: 6 | H696: 13 | I696: =G696*6+H696 -> 49 | K696: 17 | L696: 16 | M696: =K696*6+L696 -> 118 | O696: 20 | P696: 17 | Q696: =O696*6+P696 -> 137 | S696: FITZPATRICK
A697: BEST PLAYERS
A698: PRAHRAN | D698: THORNE | G698: SMITH | I698: JEFFREY | L698: ANDERSON | O698: DICKSON | R698: WISE
A699: FRANKSTON | D699: HUNTER | G699: BOYD | I699: WILLIAMS | L699: GEDDES | O699: HARRINGTON
A700: GOALKICKERS
A701: PRAHRAN | D701: SMITH 8 | G701: THORNE 5 | J701: DICKSON 3 | M701: STONE 2 | O701: McGUINNESS 2 | R701: MILLS | T701: SOULOS | W701: WISE
A702: FRANKSTON | D702: SERAFINI 7 | G702: HUNTER 4 | J702: WILLIAMS 3 | M702: JONES 2 | O702: KENNEDY | Q702: JEFFRIES | S702: BELL | U702: LEGGE
A704: COBURG | C704: 9 | D704: 2 | E704: =C704*6+D704 -> 56 | G704: 12 | H704: 6 | I704: =G704*6+H704 -> 78 | K704: 14 | L704: 10 | M704: =K704*6+L704 -> 94 | O704: 17 | P704: 13 | Q704: =O704*6+P704 -> 115 | S704: C'WELL
A705: CAMBERWELL | C705: 2 | D705: 2 | E705: =C705*6+D705 -> 14 | G705: 10 | H705: 3 | I705: =G705*6+H705 -> 63 | K705: 11 | L705: 7 | M705: =K705*6+L705 -> 73 | O705: 16 | P705: 10 | Q705: =O705*6+P705 -> 106 | S705: GROOM
A706: BEST PLAYERS
A707: COBURG | D707: NIMMO | G707: HALBERT | J707: HARTIGAN | M707: COLLINS | P707: PITT
A708: CAMBERWELL | D708: CHAMBERLAIN | G708: TEMPLETON | J708: NEILSON | M708: JUDD | P708: PRETTO
A709: GOALKICKERS
A710: COBURG | D710: SMITH 5 | G710: HALBERT 5 | J710: FISHER 4 | M710: COLLINS 2 | P710: HODGE
A711: CAMBERWELL | D711: HAYWOOD 4 | G711: WRIGHT 2 | I711: NEILSON 2 | L711: PEVITT 2 | N711: SPITHILL | P711: CHAMBERLAIN | S711: COOK | U711: JUDD | W711: SLACIK
A713: ROUND 16 | E713: 10TH AUGUST | J713: WEATHER | M713: STRONG NORTH WIND FINE | S713: PLAYED AT
D714: 1ST QTR | H714: 2ND QTR | L714: 3RD QTR | P714: FINAL | S714: COBURG
A715: COBURG | C715: 6 | D715: 4 | E715: =C715*6+D715 -> 40 | G715: 9 | H715: 6 | I715: =G715*6+H715 -> 60 | K715: 18 | L715: 7 | M715: =K715*6+L715 -> 115 | O715: 19 | P715: 8 | Q715: =O715*6+P715 -> 122 | S715: UMPIRE | X715: LADDER | AB715: ROUND | AD715: 16
A716: SANDRINGHAM | C716: 3 | D716: 4 | E716: =C716*6+D716 -> 22 | G716: 9 | H716: 9 | I716: =G716*6+H716 -> 63 | K716: 11 | L716: 14 | M716: =K716*6+L716 -> 80 | O716: 16 | P716: 20 | Q716: =O716*6+P716 -> 116 | S716: OAKLEY
A717: BEST PLAYERS | W717: TEAM | X717: W | Y717: L | Z717: D | AA717: FOR | AB717: AGST | AC717: % | AD717: PTS
A718: COBURG | D718: PITT | G718: BEATTIE | J718: BURT | L718: SMITH | N718: HALBERT | Q718: WESCOMBE
A719: SANDRINGHAM | D719: GIAMPAOLO | G719: KEAST | J719: HUNT | L719: GILMORE | N719: HODGES | Q719: SCOTT | W719: COBURG | X719: 15 | Y719: 1 | Z719: 0 | AA719: 2186 | AB719: 1602 | AC719: 136.45443196004993 | AD719: 60
A720: GOALKICKERS | W720: PORT MELBOURNE | X720: 11 | Y720: 5 | Z720: 0 | AA720: 2224 | AB720: 1822 | AC720: 122.06366630076839 | AD720: 44
A721: COBURG | D721: SMITH 6 | F721: BEATTIE 5 | I721: HERBERT 3 | L721: FISHER 2 | N721: BURT | P721: DOHNT | R721: WESCOMBE | W721: GEELONG WEST | X721: 11 | Y721: 5 | Z721: 0 | AA721: 2015 | AB721: 1999 | AC721: 100.80040020010004 | AD721: 44
A722: SANDRINGHAM | D722: HUNT 7 | G722: JONES 3 | I722: MAILING 2 | L722: ELLIOTT 2 | O722: PLEDGER | Q722: WAY | W722: PRAHRAN | X722: 10 | Y722: 6 | Z722: 0 | AA722: 1931 | AB722: 1963 | AC722: 98.369842078451356 | AD722: 40
A724: DANDENONG | C724: 7 | D724: 5 | E724: =C724*6+D724 -> 47 | G724: 7 | H724: 7 | I724: =G724*6+H724 -> 49 | K724: 16 | L724: 17 | M724: =K724*6+L724 -> 113 | O724: 17 | P724: 21 | Q724: =O724*6+P724 -> 123 | S724: DANDENONG | W724: DANDENONG | X724: 8 | Y724: 7 | Z724: 1 | AA724: 1849 | AB724: 1733 | AC724: 106.6935949221004 | AD724: 34
A725: PRESTON | C725: 0 | D725: 2 | E725: =C725*6+D725 -> 2 | G725: 8 | H725: 6 | I725: =G725*6+H725 -> 54 | K725: 11 | L725: 8 | M725: =K725*6+L725 -> 74 | O725: 13 | P725: 11 | Q725: =O725*6+P725 -> 89 | S725: FITZPATRICK | W725: SANDRINGHAM | X725: 8 | Y725: 8 | Z725: 0 | AA725: 1952 | AB725: 1904 | AC725: 102.52100840336135 | AD725: 32
A726: BEST PLAYERS | W726: PRESTON | X726: 5 | Y726: 11 | Z726: 0 | AA726: 1905 | AB726: 2020 | AC726: 94.306930693069305 | AD726: 20
A727: DANDENONG | D727: P KNIGHT | G727: S KNIGHT | J727: COUSINS | M727: ORTON | O727: WALLACE | W727: CAULFIELD | X727: 4 | Y727: 11 | Z727: 1 | AA727: 1834 | AB727: 2022 | AC727: 90.702274975272005 | AD727: 18
A728: PRESTON | D728: BATT | G728: CANN | J728: PREECE | M728: McGAW | O728: MARKS | W728: FRANKSTON | X728: 4 | Y728: 12 | Z728: 0 | AA728: 1769 | AB728: 2196 | AC728: 80.555555555555557 | AD728: 16
A729: GOALKICKERS | R729: ALLISON | W729: CAMBERWELL | X729: 3 | Y729: 13 | Z729: 0 | AA729: 1647 | AB729: 2051 | AC729: 80.302291565090201 | AD729: 12
A730: DANDENONG | D730: ORTON 5 | F730: BIFFIN 3 | H730: MADDEN 2 | J730: TOWNSEND 2 | M730: WALLACE | O730: COVENTRY | Q730: HORAZCKO | T730: P KNIGHT
A731: PRESTON | D731: MARKS 3 | F731: COOPER 2 | I731: JESSOP 2 | K731: P MARSHALL | N731: BATT | P731: VANN | R731: McGAW | T731: CANN
A733: GEELONG WEST | C733: 1 | D733: 1 | E733: =C733*6+D733 -> 7 | G733: 6 | H733: 9 | I733: =G733*6+H733 -> 45 | K733: 7 | L733: 12 | M733: =K733*6+L733 -> 54 | O733: 13 | P733: 16 | Q733: =O733*6+P733 -> 94 | S733: PRINCES PK
A734: CAULFIELD | C734: 5 | D734: 3 | E734: =C734*6+D734 -> 33 | G734: 5 | H734: 6 | I734: =G734*6+H734 -> 36 | K734: 9 | L734: 13 | M734: =K734*6+L734 -> 67 | O734: 12 | P734: 15 | Q734: =O734*6+P734 -> 87 | S734: STABB
A735: BEST PLAYERS
A736: GEELONG WEST | D736: YATES | G736: MANSON | J736: HINCK | M736: GIBSON | O736: ARKLAY | R736: FRIEND
A737: CAULFIELD | D737: O'SULLIVAN | G737: AMBLER | J737: RUSS | M737: LESTER | O737: KING
A738: GOALKICKERS
A739: GEELONG WEST | D739: G WELLS 5 | G739: YATES | I739: FOOTE | K739: TAYLOR | M739: WOOLFE | O739: GIBSON | Q739: GILMORE | S739: S WELLS | V739: DEATON
A740: CAULFIELD | D740: DAVIDSON 3 | G740: RUSS 2 | I740: BOOTH 2 | K740: O'SULLIVAN | N740: O'LOUGHLIN | Q740: BRUMMELLAN | T740: MORRISON | W740: MITCHELL
A742: CAMBERWELL | C742: 2 | D742: 2 | E742: =C742*6+D742 -> 14 | G742: 5 | H742: 6 | I742: =G742*6+H742 -> 36 | K742: 8 | L742: 12 | M742: =K742*6+L742 -> 60 | O742: 13 | P742: 18 | Q742: =O742*6+P742 -> 96 | S742: TOORAK PARK
A743: PRAHRAN | C743: 2 | D743: 5 | E743: =C743*6+D743 -> 17 | G743: 4 | H743: 11 | I743: =G743*6+H743 -> 35 | K743: 7 | L743: 19 | M743: =K743*6+L743 -> 61 | O743: 9 | P743: 20 | Q743: =O743*6+P743 -> 74 | S743: SNOOKS
A744: BEST PLAYERS
A745: CAMBERWELL | D745: CHAMBERLAIN | G745: TEMPLETON | J745: WRIGHT | M745: SLACIK | O745: TEAKEL | R745: PRETTO
A746: PRAHRAN | D746: FOLEY | G746: DICKSON | J746: STONE | M746: PEPE | O746: KELLY
A747: GOALKICKERS
A748: CAMBERWELL | D748: JUDD 3 | F748: COOK 3 | H748: NEILSON 2 | J748: CHAMBERLAIN | M748: WRIGHT | O748: CAHILL | Q748: SLACIK | S748: ROURKE
A749: PRAHRAN | D749: SOULOS 2 | G749: DICKSON 2 | J749: SMITH 2 | M749: CHAPMAN | O749: PEPE | Q749: ZEUNART
A751: PORT MELBOURNE | C751: 6 | D751: 2 | E751: =C751*6+D751 -> 38 | G751: 10 | H751: 9 | I751: =G751*6+H751 -> 69 | K751: 19 | L751: 15 | M751: =K751*6+L751 -> 129 | O751: 25 | P751: 17 | Q751: =O751*6+P751 -> 167 | S751: PORT MELBOURNE
A752: FRANKSTON | C752: 0 | D752: 3 | E752: =C752*6+D752 -> 3 | G752: 1 | H752: 4 | I752: =G752*6+H752 -> 10 | K752: 3 | L752: 7 | M752: =K752*6+L752 -> 25 | O752: 8 | P752: 12 | Q752: =O752*6+P752 -> 60 | S752: VERGONA
A753: BEST PLAYERS
A754: PORT MELBOURNE | D754: O'RILEY | F754: JOHN CHRISTOU | J754: JIM CHRISTOU | M754: O'NEILL | O754: AANENSEN | R754: SWAN
A755: FRANKSTON | D755: LEGGE | F755: LYNN | J755: BOYD
A756: GOALKICKERS
A757: PORT MELBOURNE | D757: O'RILEY 7 | F757: JIM CHRISTOU 6 | J757: ALLENDER 4 | M757: HOLT 4 | O757: EBEYER 2 | Q757: SWAN | S757: EVANS
A758: FRANKSTON | D758: SERAFINI 2 | G758: JONES 2 | I758: LEGGE 2 | K758: WILLIAMS | M758: STEWART
A760: ROUND 17 | E760: 17TH AUGUST | M760: WEATHER | S760: PLAYED AT
D761: 1ST QTR | H761: 2ND QTR | L761: 3RD QTR | P761: FINAL | S761: COBURG
A762: COBURG | C762: 6 | D762: 3 | E762: =C762*6+D762 -> 39 | G762: 13 | H762: 11 | I762: =G762*6+H762 -> 89 | K762: 21 | L762: 14 | M762: =K762*6+L762 -> 140 | O762: 29 | P762: 17 | Q762: =O762*6+P762 -> 191 | S762: UMPIRE | X762: LADDER | AB762: ROUND | AD762: 17
A763: PRAHRAN | C763: 3 | D763: 4 | E763: =C763*6+D763 -> 22 | G763: 7 | H763: 4 | I763: =G763*6+H763 -> 46 | K763: 13 | L763: 6 | M763: =K763*6+L763 -> 84 | O763: 18 | P763: 11 | Q763: =O763*6+P763 -> 119 | S763: STABB
A764: BEST PLAYERS | W764: TEAM | X764: W | Y764: L | Z764: D | AA764: FOR | AB764: AGST | AC764: % | AD764: PTS
A765: COBURG | D765: BURT | G765: HALBERT | J765: MILROY | M765: BEATTIE | O765: SALTMARSH | R765: CURRAN
A766: PRAHRAN | D766: JEFFREY | G766: CHAPMAN | J766: PEPE | M766: DICKSON | O766: ANDERSON | R766: WISE | W766: COBURG | X766: 16 | Y766: 1 | Z766: 0 | AA766: 2377 | AB766: 1721 | AC766: 138.11737361998837 | AD766: 64
A767: GOALKICKERS | K767: TOLLEY | M767: PITT | O767: BURT | Q767: DOHNT | S767: COLLINS | W767: PORT MELBOURNE | X767: 12 | Y767: 5 | Z767: 0 | AA767: 2379 | AB767: 1920 | AC767: 123.90625 | AD767: 48
A768: COBURG | D768: SMITH 7 | F768: BEATTIE 3 | I768: HALBERT 3 | L768: HALSALL 3 | N768: FISHER 3 | P768: WESCOMBE 2 | S768: HERBERT 2 | W768: GEELONG WEST | X768: 12 | Y768: 5 | Z768: 0 | AA768: 2139 | AB768: 2097 | AC768: 102.00286123032905 | AD768: 48
A769: PRAHRAN | D769: SMITH 5 | F769: CHAPMAN 5 | I769: DICKSON 2 | L769: CLARKE | N769: SOULOS | P769: STONE | R769: WISE | W769: PRAHRAN | X769: 10 | Y769: 7 | Z769: 0 | AA769: 2050 | AB769: 2154 | AC769: 95.171773444753953 | AD769: 40
O770: McGUINNESS | R770: THURGOOD
A771: SANDRINGHAM | C771: 4 | D771: 1 | E771: =C771*6+D771 -> 25 | G771: 8 | H771: 4 | I771: =G771*6+H771 -> 52 | K771: 11 | L771: 5 | M771: =K771*6+L771 -> 71 | O771: 15 | P771: 6 | Q771: =O771*6+P771 -> 96 | S771: BEACH ROAD | W771: DANDENONG | X771: 9 | Y771: 7 | Z771: 1 | AA771: 1982 | AB771: 1859 | AC771: 106.61646046261431 | AD771: 38
A772: PRESTON | C772: 4 | D772: 6 | E772: =C772*6+D772 -> 30 | G772: 6 | H772: 12 | I772: =G772*6+H772 -> 48 | K772: 9 | L772: 17 | M772: =K772*6+L772 -> 71 | O772: 9 | P772: 22 | Q772: =O772*6+P772 -> 76 | S772: VERGONA | W772: SANDRINGHAM | X772: 9 | Y772: 8 | Z772: 0 | AA772: 2048 | AB772: 1980 | AC772: 103.43434343434343 | AD772: 36
A773: BEST PLAYERS | W773: PRESTON | X773: 5 | Y773: 12 | Z773: 0 | AA773: 1981 | AB773: 2116 | AC773: 93.620037807183365 | AD773: 20
A774: SANDRINGHAM | D774: GIAMPAOLO | G774: HODGES | J774: CLARK | M774: HUNT | O774: GILMORE | R774: OSBORNE | W774: CAULFIELD | X774: 4 | Y774: 12 | Z774: 1 | AA774: 1932 | AB774: 2177 | AC774: 88.745980707395503 | AD774: 18
A775: PRESTON | D775: TOWAN | G775: COOPER | J775: CANN | M775: BOLGER | O775: MIERS | W775: FRANKSTON | X775: 4 | Y775: 13 | Z775: 0 | AA775: 1895 | AB775: 2329 | AC775: 81.365392872477457 | AD775: 16
A776: GOALKICKERS | W776: CAMBERWELL | X776: 3 | Y776: 14 | Z776: 0 | AA776: 1745 | AB776: 2175 | AC776: 80.229885057471265 | AD776: 12
A777: SANDRINGHAM | D777: HUNT 6 | G777: MAILING 4 | J777: WAY 2 | L777: CLARK | N777: HAYES | P777: GILMORE
A778: PRESTON | D778: FRAZER 2 | G778: BATT 2 | I778: COOPER 2 | L778: CLARKE | N778: MARKS | P778: JESSOP
A780: DANDENONG | C780: 7 | D780: 10 | E780: =C780*6+D780 -> 52 | G780: 9 | H780: 11 | I780: =G780*6+H780 -> 65 | K780: 15 | L780: 19 | M780: =K780*6+L780 -> 109 | O780: 18 | P780: 25 | Q780: =O780*6+P780 -> 133 | S780: DANDENONG
A781: FRANKSTON | C781: 3 | D781: 3 | E781: =C781*6+D781 -> 21 | G781: 12 | H781: 8 | I781: =G781*6+H781 -> 80 | K781: 14 | L781: 8 | M781: =K781*6+L781 -> 92 | O781: 19 | P781: 12 | Q781: =O781*6+P781 -> 126 | S781: GROOM
A782: BEST PLAYERS
A783: DANDENONG | D783: COVENTRY | G783: LUKAS | J783: WRIGHT | L783: ORTON | N783: SHEVLIN | Q783: WALLACE
A784: FRANKSTON | D784: KENNEDY | G784: HUNTER | J784: BELL | L784: GEDDES | N784: HARRINGTON | Q784: STEWART
A785: GOALKICKERS
A786: DANDENONG | D786: ORTON 5 | G786: MADDEN 3 | J786: COVENTRY 3 | M786: BIFFIN 3 | O786: COUSINS 2 | R786: P KNIGHT 2
A787: FRANKSTON | D787: HUNTER 6 | G787: SERAFINI 5 | J787: WILLIAMS 2 | M787: KENNEDY | O787: HARRINGTON | R787: BOYD | T787: HOUSDEN | W787: LEGGE | X787: STEWART
A789: PORT MELBOURNE | C789: 5 | D789: 9 | E789: =C789*6+D789 -> 39 | G789: 8 | H789: 14 | I789: =G789*6+H789 -> 62 | K789: 19 | L789: 27 | M789: =K789*6+L789 -> 141 | O789: 20 | P789: 35 | Q789: =O789*6+P789 -> 155 | S789: PRINCES PARK
A790: CAULFIELD | C790: 2 | D790: 1 | E790: =C790*6+D790 -> 13 | G790: 4 | H790: 6 | I790: =G790*6+H790 -> 30 | K790: 5 | L790: 9 | M790: =K790*6+L790 -> 39 | O790: 14 | P790: 14 | Q790: =O790*6+P790 -> 98 | S790: OAKLEY
A791: BEST PLAYERS
A792: PORT MELBOURNE | D792: AANENSEN | G792: WILKINSON | J792: JOHNSON | L792: SWAN | N792: ALLENDER | Q792: HALL
A793: CAULFIELD | D793: EINSEDEL | G793: LESTER | J793: KING | L793: O'SULLIVAN | O793: BRASIER
A794: GOALKICKERS
A795: PORT MELBOURNE | D795: O'RILEY 5 | G795: WILKINSON 4 | J795: HOLT 4 | L795: SWAN 3 | N795: ALLENDER 2 | Q795: EVANS | S795: JIM CHRISTOU
A796: CAULFIELD | D796: UPFAL 3 | F796: O'SULLIVAN 2 | I796: DAVIDSON 2 | L796: O'LOUGHLIN 2 | O796: BRUMMELLAN 2 | R796: EINSEDEL | U796: BOOTH | X796: TAYLOR
A798: GEELONG WEST | C798: 6 | D798: 6 | E798: =C798*6+D798 -> 42 | G798: 10 | H798: 10 | I798: =G798*6+H798 -> 70 | K798: 13 | L798: 14 | M798: =K798*6+L798 -> 92 | O798: 18 | P798: 16 | Q798: =O798*6+P798 -> 124 | S798: GEELONG WEST
A799: CAMBERWELL | C799: 4 | D799: 1 | E799: =C799*6+D799 -> 25 | G799: 10 | H799: 5 | I799: =G799*6+H799 -> 65 | K799: 12 | L799: 6 | M799: =K799*6+L799 -> 78 | O799: 14 | P799: 14 | Q799: =O799*6+P799 -> 98 | S799: WILSON
A800: BEST PLAYERS
A801: GEELONG WEST | D801: CRICHTON | G801: BROWNE | J801: DENMEAD | M801: MANSON | P801: TAYLOR
A802: CAMBERWELL | D802: WRIGHT | G802: FRYER | J802: TEAKEL | M802: PEVITT | P802: COOK | R802: PRETTO
A803: GOALKICKERS
A804: GEELONG WEST | D804: BROWNE 5 | G804: TAYLOR 4 | I804: G WELLS 3 | L804: GILMORE 2 | O804: BURNS | Q804: WOOLFE | T804: S WELLS | W804: MANSON
A805: CAMBERWELL | D805: PEVITT 5 | G805: COOK 3 | I805: WRIGHT 2 | L805: HAYWOOD | N805: HIPWORTH | Q805: CAHILL | S805: BROSCHE
A807: ROUND 18 | E807: 24TH AUGUST | J807: WEATHER | N807: WEST WIND SHOWERS | S807: PLAYED AT
D808: 1ST QTR | H808: 2ND QTR | L808: 3RD QTR | P808: FINAL | S808: PORT MELBOURNE
A809: PORT MELBOURNE | C809: 5 | D809: 5 | E809: =C809*6+D809 -> 35 | G809: 6 | H809: 12 | I809: =G809*6+H809 -> 48 | K809: 14 | L809: 18 | M809: =K809*6+L809 -> 102 | O809: 19 | P809: 24 | Q809: =O809*6+P809 -> 138 | S809: UMPIRE | X809: LADDER | AB809: ROUND | AD809: 18
A810: COBURG | C810: 3 | D810: 3 | E810: =C810*6+D810 -> 21 | G810: 6 | H810: 6 | I810: =G810*6+H810 -> 42 | K810: 13 | L810: 8 | M810: =K810*6+L810 -> 86 | O810: 16 | P810: 9 | Q810: =O810*6+P810 -> 105 | S810: GROOM
A811: BEST PLAYERS | W811: TEAM | X811: W | Y811: L | Z811: D | AA811: FOR | AB811: AGST | AC811: % | AD811: PTS
A812: PORT MELBOURNE | D812: AANENSEN | G812: O'NEILL | J812: JIM CHRISTOU | M812: EVANS | O812: HALL | Q812: SWAN
A813: COBURG | D813: HALBERT | G813: WESCOMBE | J813: NIMMO | M813: DOUGLAS | W813: COBURG | X813: 16 | Y813: 2 | Z813: 0 | AA813: 2482 | AB813: 1859 | AC813: 133.51264120494889 | AD813: 64
A814: GOALKICKERS | W814: PORT MELBOURNE | X814: 13 | Y814: 5 | Z814: 0 | AA814: 2517 | AB814: 2025 | AC814: 124.29629629629629 | AD814: 52
A815: PORT MELBOURNE | D815: COOK 4 | F815: ALLENDER 4 | I815: EBEYER 3 | K815: BRICE 2 | M815: JIM CHRISTOU 2 | Q815: O'RILEY 2 | S815: EVANS 2 | W815: GEELONG WEST | X815: 12 | Y815: 6 | Z815: 0 | AA815: 2252 | AB815: 2230 | AC815: 100.98654708520179 | AD815: 48
A816: COBURG | D816: HALBERT 6 | F816: HERBERT 2 | I816: FISHER 2 | K816: HALSALL | M816: BURT | N816: HARTIGAN | Q816: SMITH | R816: WESCOMBE | W816: SANDRINGHAM | X816: 10 | Y816: 8 | Z816: 0 | AA816: 2181 | AB816: 2093 | AC816: 104.2044911610129 | AD816: 40
P817: MILROY
A818: SANDRINGHAM | C818: 4 | D818: 4 | E818: =C818*6+D818 -> 28 | G818: 11 | H818: 9 | I818: =G818*6+H818 -> 75 | K818: 13 | L818: 12 | M818: =K818*6+L818 -> 90 | O818: 20 | P818: 13 | Q818: =O818*6+P818 -> 133 | S818: BEACH ROAD | W818: PRAHRAN | X818: 10 | Y818: 8 | Z818: 0 | AA818: 2189 | AB818: 2361 | AC818: 92.7149512918255 | AD818: 40
A819: GEELONG WEST | C819: 8 | D819: 2 | E819: =C819*6+D819 -> 50 | G819: 13 | H819: 5 | I819: =G819*6+H819 -> 83 | K819: 16 | L819: 9 | M819: =K819*6+L819 -> 105 | O819: 17 | P819: 11 | Q819: =O819*6+P819 -> 113 | S819: CASEY | W819: DANDENONG | X819: 9 | Y819: 8 | Z819: 1 | AA819: 2093 | AB819: 1975 | AC819: 105.9746835443038 | AD819: 38
A820: BEST PLAYERS | W820: PRESTON | X820: 6 | Y820: 12 | Z820: 0 | AA820: 2188 | AB820: 2255 | AC820: 97.028824833702885 | AD820: 24
A821: SANDRINGHAM | D821: GIAMPAOLO | G821: KEAST | J821: PLEDGER | M821: LYONS | O821: WAY | Q821: BEUS | W821: FRANKSTON | X821: 5 | Y821: 13 | Z821: 0 | AA821: 2028 | AB821: 2428 | AC821: 83.525535420098848 | AD821: 20
A822: GEELONG WEST | D822: GIBSON | G822: GILMORE | J822: G WELLS | M822: MANSON | O822: S WELLS | Q822: HINCK | W822: CAULFIELD | X822: 4 | Y822: 13 | Z822: 1 | AA822: 2031 | AB822: 2310 | AC822: 87.922077922077918 | AD822: 18
A823: GOALKICKERS | W823: CAMBERWELL | X823: 4 | Y823: 14 | Z823: 0 | AA823: 1861 | AB823: 2286 | AC823: 81.408573928258974 | AD823: 16
A824: SANDRINGHAM | D824: HUNT 7 | F824: PLEDGER 3 | I824: BEUS 3 | K824: SIMS 2 | M824: MAILING 2 | P824: HODGES | R824: CLARK | T824: DEAGAN
A825: GEELONG WEST | D825: G WELLS 8 | F825: YATES 2 | I825: S WELLS 2 | L825: GILMORE 2 | N825: TAYLOR | P825: CRICHTON | R825: BURNETT
A827: PRESTON | C827: 7 | D827: 4 | E827: =C827*6+D827 -> 46 | G827: 14 | H827: 4 | I827: =G827*6+H827 -> 88 | K827: 23 | L827: 7 | M827: =K827*6+L827 -> 145 | O827: 32 | P827: 15 | Q827: =O827*6+P827 -> 207 | S827: PRESTON
A828: PRAHRAN | C828: 3 | D828: 2 | E828: =C828*6+D828 -> 20 | G828: 10 | H828: 8 | I828: =G828*6+H828 -> 68 | K828: 16 | L828: 10 | M828: =K828*6+L828 -> 106 | O828: 21 | P828: 13 | Q828: =O828*6+P828 -> 139 | S828: WILSON
A829: BEST PLAYERS
A830: PRESTON | D830: McEWAN | G830: McKEON | J830: PREECE | M830: FRAZER | O830: JESSOP | R830: COOPER
A831: PRAHRAN | D831: PREEN | G831: WISE | J831: PEPE | M831: AUSTIN | O831: CHAPMAN
A832: GOALKICKERS
A833: PRESTON | D833: FRAZER 7 | F833: JESSOP 6 | H833: P MARSHALL 3 | K833: VANN 3 | M833: McEWAN 3 | P833: MIERS 2 | R833: BATT 2 | T833: CANN 2 | W833: MARKS 2 | X833: McCULLOCH | AA833: COOPER
A834: PRAHRAN | D834: PREEN 9 | G834: K SMITH 3 | J834: DICKSON 3 | M834: CHAPMAN 2 | P834: MILLS 2 | R834: CLARKE | T834: WISE
A836: FRANKSTON | C836: 4 | D836: 2 | E836: =C836*6+D836 -> 26 | G836: 10 | H836: 5 | I836: =G836*6+H836 -> 65 | K836: 15 | L836: 5 | M836: =K836*6+L836 -> 95 | O836: 21 | P836: 7 | Q836: =O836*6+P836 -> 133 | S836: FRANKSTON
A837: CAULFIELD | C837: 5 | D837: 4 | E837: =C837*6+D837 -> 34 | G837: 8 | H837: 6 | I837: =G837*6+H837 -> 54 | K837: 11 | L837: 12 | M837: =K837*6+L837 -> 78 | O837: 14 | P837: 15 | Q837: =O837*6+P837 -> 99 | S837: TORNEY
A838: BEST PLAYERS
A839: FRANKSTON | D839: BELL | G839: HOUSDEN | J839: LYNN | L839: WILLIAMS | O839: STEWART | R839: BOYD
A840: CAULFIELD | D840: O'SULLIVAN | G840: RUSS | J840: KING | L840: DAVIDSON | O840: ADAMS | R840: MILNER
A841: GOALKICKERS
A842: FRANKSTON | D842: SERAFINI 7 | F842: HOUSDEN 5 | I842: HUNTER 2 | L842: HARRINGTON 2 | O842: KENNEDY | Q842: WILLIAMS | T842: HORLER | W842: STEWART | X842: LANE
A843: CAULFIELD | D843: MILNER 5 | G843: TAYLOR 2 | I843: O'SULLIVAN 2 | L843: KING | N843: DAVIDSON | Q843: UPFAL | S843: MITCHELL | V843: SUTTIE
A845: CAMBERWELL | C845: 3 | D845: 5 | E845: =C845*6+D845 -> 23 | G845: 8 | H845: 9 | I845: =G845*6+H845 -> 57 | K845: 13 | L845: 9 | M845: =K845*6+L845 -> 87 | O845: 17 | P845: 14 | Q845: =O845*6+P845 -> 116 | S845: C'WELL
A846: DANDENONG | C846: 6 | D846: 4 | E846: =C846*6+D846 -> 40 | G846: 8 | H846: 5 | I846: =G846*6+H846 -> 53 | K846: 13 | L846: 12 | M846: =K846*6+L846 -> 90 | O846: 16 | P846: 15 | Q846: =O846*6+P846 -> 111 | S846: SNOOKS
A847: BEST PLAYERS
A848: CAMBERWELL | D848: FRYER | G848: PRETTO | J848: CHAMBERLAIN | M848: SAUDAUSKAS | P848: HIPWORTH | S848: NEILSON
A849: DANDENONG | D849: P KNIGHT | G849: ORTON | J849: HARPER | M849: McCONNELL | P849: WALLACE | S849: LACEY
A850: GOALKICKERS
A851: CAMBERWELL | D851: HAYWOOD 6 | G851: HIPWORTH 2 | J851: ROURKE 2 | M851: PEVITT 2 | O851: TEMPLETON | R851: WALLEY | T851: FRYER | W851: SAUDAUSKAS | X851: JUDD
A852: DANDENONG | D852: ORTON 6 | G852: P KNIGHT 4 | J852: MADDEN 3 | M852: BIFFIN 2 | P852: LAMBERT
A854: FINALS
A855: 1ST SEMI | E855: 31ST AUGUST | J855: WEATHER | M855: WEST WIND SHOWERS
D856: 1ST QTR | H856: 2ND QTR | L856: 3RD QTR | P856: FINAL
A857: GEELONG WEST | C857: 3 | D857: 3 | E857: =C857*6+D857 -> 21 | G857: 9 | H857: 6 | I857: =G857*6+H857 -> 60 | K857: 11 | L857: 8 | M857: =K857*6+L857 -> 74 | O857: 17 | P857: 14 | Q857: =O857*6+P857 -> 116 | S857: JUNCTION OVAL
A858: SANDRINGHAM | C858: 1 | D858: 5 | E858: =C858*6+D858 -> 11 | G858: 4 | H858: 8 | I858: =G858*6+H858 -> 32 | K858: 8 | L858: 11 | M858: =K858*6+L858 -> 59 | O858: 12 | P858: 12 | Q858: =O858*6+P858 -> 84 | S858: GROOM/TORNEY
A859: BEST PLAYERS
A860: GEELONG WEST | D860: BURNS | F860: GILMORE | I860: GIBSON | L860: CRICHTON | O860: BEATON | Q860: SCARLETT
A861: SANDRINGHAM | D861: CLARK | F861: BEUS | I861: OSBORNE | L861: MAILING | O861: HAYES | Q861: GIAMPAOLO
A862: GOALKICKERS
A863: GEELONG WEST | D863: CRICHTON 4 | G863: BURNS 3 | I863: G WELLS 3 | L863: TAYLOR 3 | N863: S WELLS | P863: YATES | R863: GIBSON | T863: MANSON
A864: SANDRINGHAM | D864: MAILING 4 | G864: BELL 3 | I864: CLARK 2 | K864: BEUS | M864: HUNT | O864: HAYES
A866: 2ND SEMI | E866: 7TH SEPTEMBER | J866: WEATHER | M866: SOUTH WEST BREEZE FINE
A867: PORT MELBOURNE | C867: 6 | D867: 2 | E867: =C867*6+D867 -> 38 | G867: 11 | H867: 6 | I867: =G867*6+H867 -> 72 | K867: 17 | L867: 10 | M867: =K867*6+L867 -> 112 | O867: 22 | P867: 18 | Q867: =O867*6+P867 -> 150 | S867: JUNCTION OVAL
A868: COBURG | C868: 3 | D868: 4 | E868: =C868*6+D868 -> 22 | G868: 9 | H868: 5 | I868: =G868*6+H868 -> 59 | K868: 11 | L868: 8 | M868: =K868*6+L868 -> 74 | O868: 15 | P868: 10 | Q868: =O868*6+P868 -> 100 | S868: VERGONA/GROOM
A869: BEST PLAYERS
A870: PORT MELBOURNE | D870: AANENSEN | G870: O'NEILL | J870: JIM CHRISTOU | M870: O'RILEY | P870: WILKINSON | S870: SWAN
A871: COBURG | D871: HALBERT | G871: WESCOMBE | J871: HERBERT | M871: NIMMO | P871: BEATTIE
A872: GOALKICKERS
A873: PORT MELBOURNE | D873: COOK 7 | G873: O'RILEY 4 | J873: JIM CHRISTOU 4 | N873: SWAN 3 | P873: WILKINSON 2 | S873: ALLENDER | V873: EVANS
A874: COBURG | D874: SMITH 3 | G874: HALSALL 3 | J874: HALBERT 3 | M874: BEATTIE 3 | P874: HERBERT 2 | S874: WESCOMBE
A876: PRELIMINARY FINAL | F876: 14TH SEPTEMBER | K876: WEATHER | O876: NORTH WIND
A877: COBURG | C877: 2 | D877: 1 | E877: =C877*6+D877 -> 13 | G877: 6 | H877: 6 | I877: =G877*6+H877 -> 42 | K877: 9 | L877: 12 | M877: =K877*6+L877 -> 66 | O877: 14 | P877: 16 | Q877: =O877*6+P877 -> 100 | S877: JUNCTION OVAL
A878: GEELONG WEST | C878: 1 | D878: 8 | E878: =C878*6+D878 -> 14 | G878: 4 | H878: 9 | I878: =G878*6+H878 -> 33 | K878: 8 | L878: 14 | M878: =K878*6+L878 -> 62 | O878: 12 | P878: 17 | Q878: =O878*6+P878 -> 89 | S878: SNOOKS/OAKLEY
A879: BEST PLAYERS
A880: COBURG | D880: NIMMO | G880: BURT | I880: CLEARY | L880: HALBERT | O880: HERBERT | R880: DOHNT
A881: GEELONG WEST | D881: HINCK | G881: GIBSON | I881: S WELLS | L881: SCARLETT | O881: BROWNE | R881: RADOJEVIC
A882: GOALKICKERS
A883: COBURG | D883: SMITH 3 | G883: HALBERT 3 | J883: HALSALL 2 | M883: COLLINS 2 | P883: BURT | R883: HERBERT | U883: CLEARY | X883: WESCOMBE
A884: GEELONG WEST | D884: RADOJEVIC 5 | G884: CRICHTON 2 | J884: G WELLS 2 | M884: BURNS | O884: TAYLOR | Q884: MANSON
A886: GRAND FINAL | E886: 21ST SEPTEMBER | J886: WEATHER | M886: WEST WIND DULL
A887: PORT MELBOURNE | C887: 1 | D887: 2 | E887: 8 | G887: 2 | H887: 9 | I887: 21 | K887: 5 | L887: 11 | M887: 41 | O887: 11 | P887: 15 | Q887: =O887*6+P887 -> 81 | S887: JUNCTION OVAL
A888: COBURG | C888: 3 | D888: 5 | E888: 23 | G888: 5 | H888: 8 | I888: 38 | K888: 8 | L888: 10 | M888: 58 | O888: 10 | P888: 10 | Q888: =O888*6+P888 -> 70 | S888: GROOM/VERGONA
A889: BEST PLAYERS
A890: PORT MELBOURNE | D890: DERMOTT | G890: JOHNSON | J890: EBEYER | M890: AANENSEN | P890: JIM CHRISTOU | S890: BRICE
A891: COBURG | D891: NIMMO | G891: HALBERT | J891: HARTIGAN | M891: CAMERON | P891: DOHNT | S891: MILROY
A892: GOALKICKERS
A893: PORT MELBOURNE | D893: COOK 4 | G893: JIM CHRISTOU 3 | K893: EBEYER 2 | N893: EVANS | P893: SWAN
A894: COBURG | D894: SMITH 2 | G894: DOUGLAS 2 | J894: COLLINS 2 | M894: HERBERT 2 | P894: DOHNT | R894: CLEARY
A896: REPRESENTATIVE MATCHES | G896: 15TH JUNE
D897: 1ST QTR | H897: 2ND QTR | L897: 3RD QTR | P897: FINAL
A898: V.F.A. | C898: 8 | D898: 6 | E898: =C898*6+D898 -> 54 | G898: 13 | H898: 12 | I898: =G898*6+H898 -> 90 | K898: 17 | L898: 16 | M898: =K898*6+L898 -> 118 | O898: 28 | P898: 19 | Q898: =O898*6+P898 -> 187
A899: NORTHERN TAS | C899: 3 | D899: 2 | E899: =C899*6+D899 -> 20 | G899: 4 | H899: 6 | I899: =G899*6+H899 -> 30 | K899: 6 | L899: 10 | M899: =K899*6+L899 -> 46 | O899: 9 | P899: 12 | Q899: =O899*6+P899 -> 66
A900: BEST PLAYERS
A901: V.F.A. | D901: ALLENDER | G901: RYAN | I901: BURT | K901: S WELLS | N901: MARTIN
A902: NORTHERN TAS | D902: NOONAN | G902: ALFORD | I902: CUFF | K902: DONNES | N902: HOWELL
A903: GOALKICKERS
A904: V.F.A. | D904: COOK 5 | F904: SMITH 5 | H904: S WELLS 4 | J904: O'SULLIVAN 3 | M904: G WELLS 3 | P904: McCONNELL 2 | S904: RYAN 2 | U904: ALLENDER 2 | X904: DAVIDSON | AA904: HALBERT | AC904: JIM CHRISTOU
A905: NORTHERN TAS | D905: HOWELL 4 | G905: ROOSEN 2 | J905: BROWN | L905: CUFF | N905: CLARK
E907: 5TH JULY
A908: S.A. | C908: 3 | D908: 5 | E908: =C908*6+D908 -> 23 | G908: 9 | H908: 11 | I908: =G908*6+H908 -> 65 | K908: 15 | L908: 16 | M908: =K908*6+L908 -> 106 | O908: 19 | P908: 21 | Q908: =O908*6+P908 -> 135 | S908: FOOTBALL PARK
A909: V.F.A. | C909: 1 | D909: 5 | E909: =C909*6+D909 -> 11 | G909: 5 | H909: 10 | I909: =G909*6+H909 -> 40 | K909: 11 | L909: 13 | M909: =K909*6+L909 -> 79 | O909: 15 | P909: 15 | Q909: =O909*6+P909 -> 105 | S909: FOSTER (S.A.)
A910: BEST PLAYERS | S910: STABB (V.F.A.)
A911: S.A. | D911: JONAS | G911: PHILLIPS | J911: GRAHAM | M911: SEWER | P911: DAVIES | R911: EBERT
A912: V.F.A. | D912: BURT | G912: WELLS | J912: SMITH | M912: WRIGHT | P912: GILMORE | R912: PITT
A913: GOALKICKERS
A914: S.A. | D914: JONAS 5 | F914: DAVIES 3 | I914: EBERT 3 | K914: SEWER 2 | M914: EVANS 2 | O914: NORSWORTHY | R914: CUNNINGHAM | V914: KENNEDY | X914: MORRIS
A915: V.F.A. | D915: SMITH 6 | G915: WELLS 3 | I915: DAVIDSON 2 | L915: HALBERT | N915: RYAN | P915: COOK | R915: COLLINS