A1: Victorian Football Association
A2: Season 1981 - Division One
A3: © Copyright Wal Williams | F3: First created: 14 November 2015
A4: Contact: joywalwi at gmail dot com | F4: Last updated: 14 November 2015 | W4: VFA Results and tables - Link to the main index page
A5: You are free to copy this document in whole or part provided that proper acknowledgement is given to the author. All rights reserved.
A7: 1981 | B7: 1ST DIVISION
A9: ROUND 1 | D9: 5TH APRIL | I9: WEATHER | S9: VENUE: PORT MELBOURNE | X9: LADDER | AB9: ROUND | AD9: 1
D10: 1ST QTR | H10: 2ND QTR | L10: 3RD QTR | P10: FINAL | S10: UMPIRES
A11: PORT MELBOURNE | C11: 3 | D11: 9 | E11: 27 | G11: 6 | H11: 14 | I11: 50 | K11: 11 | L11: 18 | M11: 84 | O11: 17 | P11: 24 | Q11: 126 | S11: VERGONA | W11: TEAM | X11: W | Y11: L | Z11: D | AA11: FOR | AB11: AGST | AC11: % | AD11: PTS
A12: SANDRINGHAM | C12: 2 | D12: 1 | E12: 13 | G12: 7 | H12: 3 | I12: 45 | K12: 10 | L12: 7 | M12: 67 | O12: 15 | P12: 11 | Q12: 101 | S12: GROOM
A13: BEST PLAYERS | W13: DANDENONG | X13: 1 | Y13: 0 | Z13: 0 | AA13: 139 | AB13: 83 | AC13: =(AA13/AB13)*100 -> 167.46987951807228 | AD13: =(X13*4)+(Z13*2) -> 4
A14: PORT MELBOURNE | C14: ANDERSON | F14: DAVIES | I14: HALL | K14: DERMOTT | N14: JOHN CHRISTOU | Q14: SWAN | W14: PRESTON | X14: 1 | Y14: 0 | Z14: 0 | AA14: 203 | AB14: 134 | AC14: =(AA14/AB14)*100 -> 151.49253731343285 | AD14: =(X14*4)+(Z14*2) -> 4
A15: SANDRINGHAM | C15: OSBORNE | F15: DROSCHER | I15: HAYES | K15: WILKINS | N15: SCOTT | Q15: HODGES | W15: PRAHRAN | X15: 1 | Y15: 0 | Z15: 0 | AA15: 153 | AB15: 115 | AC15: =(AA15/AB15)*100 -> 133.04347826086956 | AD15: =(X15*4)+(Z15*2) -> 4
A16: GOALKICKERS | Q16: O'RILEY | S16: EBEYER | W16: COBURG | X16: 1 | Y16: 0 | Z16: 0 | AA16: 164 | AB16: 124 | AC16: =(AA16/AB16)*100 -> 132.25806451612902 | AD16: =(X16*4)+(Z16*2) -> 4
A17: PORT MELBOURNE | C17: COOK 4 | E17: ALLENDER 3 | H17: BRICE 2 | J17: P GOSS 2 | L17: JIM CHRISTOU 2 | O17: JOHN CHRISTOU | R17: SWAN
A18: SANDRINGHAM | C18: HUNT 4 | E18: GILMORE 4 | H18: HAYES 4 | J18: MAILING | L18: SIMS | M18: BEUS | W18: PORT MELBOURNE | X18: 1 | Y18: 0 | Z18: 0 | AA18: 126 | AB18: 101 | AC18: =(AA18/AB18)*100 -> 124.75247524752476 | AD18: =(X18*4)+(Z18*2) -> 4
S19: VENUE: PRESTON | W19: SANDRINGHAM | X19: 0 | Y19: 1 | Z19: 0 | AA19: 101 | AB19: 126 | AC19: =(AA19/AB19)*100 -> 80.158730158730165 | AD19: =(X19*4)+(Z19*2) -> 0
A20: PRESTON | C20: 2 | D20: 9 | E20: 21 | G20: 9 | H20: 15 | I20: 69 | K20: 17 | L20: 18 | M20: 120 | O20: 30 | P20: 23 | Q20: 203 | S20: STABB | W20: GEELONG WEST | X20: 0 | Y20: 1 | Z20: 0 | AA20: 124 | AB20: 164 | AC20: =(AA20/AB20)*100 -> 75.609756097560975 | AD20: =(X20*4)+(Z20*2) -> 0
A21: CAULFIELD | C21: 7 | D21: 3 | E21: 45 | G21: 9 | H21: 10 | I21: 64 | K21: 16 | L21: 13 | M21: 109 | O21: 20 | P21: 14 | Q21: 134 | S21: TORNEY | W21: FRANKSTON | X21: 0 | Y21: 1 | Z21: 0 | AA21: 115 | AB21: 153 | AC21: =(AA21/AB21)*100 -> 75.16339869281046 | AD21: =(X21*4)+(Z21*2) -> 0
A22: BEST PLAYERS | W22: CAULFIELD | X22: 0 | Y22: 1 | Z22: 0 | AA22: 134 | AB22: 203 | AC22: =(AA22/AB22)*100 -> 66.009852216748769 | AD22: =(X22*4)+(Z22*2) -> 0
A23: PRESTON | C23: P MARSHALL | F23: McEWAN | I23: HEARD | K23: COOPER | N23: BARTLETT | Q23: WARREN | W23: BRUNSWICK | X23: 0 | Y23: 1 | Z23: 0 | AA23: 83 | AB23: 139 | AC23: =(AA23/AB23)*100 -> 59.712230215827333 | AD23: =(X23*4)+(Z23*2) -> 0
A24: CAULFIELD | C24: RUSS | F24: EINSEDEL | I24: CROOK | K24: RICHARDS | N24: STAIT
A25: GOALKICKERS
A26: PRESTON | C26: COOPER 5 | E26: G L ANDERSON 5 | H26: McEWAN 4 | J26: VANN 4 | L26: JESSOP 4 | N26: HALAS 4 | P26: CANN 2 | R26: McCULLOCH | W26: BARTLETT
A27: CAULFIELD | C27: CROOK 4 | E27: MORRISON 3 | H27: DAVIDSON 2 | K27: BRUMMELLAN 2 | N27: GIULLERI 2 | Q27: STAIT 2 | S27: MILNER 2 | W27: O'SULLIVAN | X27: SHERIDAN | AA27: ROWE
D28: 12TH APRIL
A29: PRAHRAN | C29: 8 | D29: 5 | E29: 53 | G29: 13 | H29: 6 | I29: 84 | K29: 16 | L29: 9 | M29: 105 | O29: 23 | P29: 15 | Q29: 153 | S29: VENUE: TOORAK PARK
A30: FRANKSTON | C30: 1 | D30: 8 | E30: 14 | G30: 6 | H30: 12 | I30: 48 | K30: 13 | L30: 16 | M30: 94 | O30: 16 | P30: 19 | Q30: 115 | S30: CASEY :STABB
A31: BEST PLAYERS
A32: PRAHRAN | C32: FOLEY | E32: SMITH | H32: THORNE | K32: McCORMACK | N32: NIDDRIE | Q32: McFAUL
A33: FRANKSTON | C33: BOND | E33: MOULTON | H33: BEATON | K33: ENBOM | N33: HORLER | Q33: LOCKWOOD
A34: GOALKICKERS
A35: PRAHRAN | C35: SMITH 7 | E35: NIDDRIE 3 | G35: THORNE 3 | I35: CHAPMAN 3 | L35: MILLS 2 | N35: SAMIOS 2 | P35: DICKSON | R35: RHODES | U35: McCORMACK
A36: FRANKSTON | C36: BOND 4 | E36: LOCKWOOD 2 | H36: SERAFINI 2 | J36: KENTER | L36: MIHOCEK | N36: BEATON | P36: ENBOM | R36: CLIFFORD | U36: HORLER | X36: BELL | Z36: WALTON
A38: DANDENONG | C38: 9 | D38: 9 | E38: 63 | G38: 12 | H38: 11 | I38: 83 | K38: 14 | L38: 16 | M38: 100 | O38: 20 | P38: 19 | Q38: 139 | S38: VENUE: DANDENONG
A39: BRUNSWICK | C39: 1 | D39: 2 | E39: 8 | G39: 5 | H39: 11 | I39: 41 | K39: 6 | L39: 14 | M39: 50 | O39: 11 | P39: 17 | Q39: 83 | S39: OGSTON :VERGONA
A40: BEST PLAYERS
A41: DANDENONG | C41: LACEY | F41: ROSS | I41: BIFFIN | K41: ORTON | N41: COUSINS | Q41: LUKAS
A42: BRUNSWICK | C42: R SMITH | F42: LEAHY | I42: BROWN | K42: HICKMAN | N42: GUNSTON
A43: GOALKICKERS
A44: DANDENONG | C44: WOODMAN 3 | F44: HENWOOD 3 | I44: ORTON 3 | K44: MADDEN 2 | M44: P KNIGHT 2 | P44: CARROLL 2 | R44: ROSS 2 | T44: LUKAS 2 | V44: LACEY
A45: BRUNSWICK | C45: GUNSTON 3 | F45: SAHLBERG 2 | I45: WEST | J45: TOY | L45: LAKER | N45: STILLMAN | Q45: HICKMAN | S45: SCULLY
A47: COBURG | C47: 9 | D47: 6 | E47: 60 | G47: 15 | H47: 8 | I47: 98 | K47: 20 | L47: 10 | M47: 130 | O47: 25 | P47: 14 | Q47: 164 | S47: VENUE: COBURG
A48: GEELONG WEST | C48: 3 | D48: 0 | E48: 18 | G48: 11 | H48: 1 | I48: 67 | K48: 15 | L48: 7 | M48: 97 | O48: 18 | P48: 16 | Q48: 124 | S48: TORNEY :GROOM
A49: BEST PLAYERS
A50: COBURG | C50: CLEARY | F50: IRONMONGER | I50: HARTIGAN | K50: ALLISON | M50: MILROY | O50: HERBERT
A51: GEELONG WEST | C51: TAYLOR | F51: RADOJEVIC | I51: PHIPPS | K51: TODD | M51: CANTWELL | O51: ROBINSON
A52: GOALKICKERS
A53: COBURG | C53: IRONMONGER 6 | F53: MILROY 4 | H53: GILMOUR 3 | J53: HERBERT 3 | M53: CLEARY 3 | O53: ALLISON 2 | Q53: DOHNT | S53: GIBB | U53: WILLIAMS | X53: WESCOMBE
A54: GEELONG WEST | C54: RADOJEVIC 7 | F54: TAYLOR 3 | I54: CANTWELL 2 | L54: BROWNE | N54: TORNEY | P54: WOOLFE | R54: CHAPMAN | U54: RUSSELL | X54: TODD
A56: ROUND 2 | D56: 19TH APRIL | I56: WEATHER | S56: VENUE: BEACH ROAD
D57: 1ST QTR | H57: 2ND QTR | L57: 3RD QTR | P57: FINAL | S57: UMPIRES
A58: SANDRINGHAM | C58: 4 | D58: 4 | E58: 28 | G58: 5 | H58: 11 | I58: 41 | K58: 16 | L58: 14 | M58: 110 | O58: 19 | P58: 18 | Q58: 132 | S58: OGSTON | X58: LADDER | AB58: ROUND | AD58: 2
A59: COBURG | C59: 6 | D59: 3 | E59: 39 | G59: 9 | H59: 7 | I59: 61 | K59: 11 | L59: 9 | M59: 75 | O59: 18 | P59: 13 | Q59: 121 | S59: SNOOKS
A60: BEST PLAYERS | W60: TEAM | X60: W | Y60: L | Z60: D | AA60: FOR | AB60: AGST | AC60: % | AD60: PTS
A61: SANDRINGHAM | C61: WILKINS | F61: MERCER | I61: OSBORNE | L61: HUNT | N61: DROSCHER | Q61: SCOTT
A62: COBURG | C62: BURT | F62: ALLISON | I62: MILROY | L62: HARBINSON | O62: PITT | Q62: GILMOUR | W62: PORT MELBOURNE | X62: 2 | Y62: 0 | Z62: 0 | AA62: 313 | AB62: 166 | AC62: =(AA62/AB62)*100 -> 188.55421686746988 | AD62: =(X62*4)+(Z62*2) -> 8
A63: GOALKICKERS | W63: PRESTON | X63: 2 | Y63: 0 | Z63: 0 | AA63: 360 | AB63: 246 | AC63: =(AA63/AB63)*100 -> 146.34146341463415 | AD63: =(X63*4)+(Z63*2) -> 8
A64: SANDRINGHAM | C64: HUNT 7 | E64: MAILING 3 | G64: GILMORE 2 | I64: WAY 2 | K64: BEUS 2 | M64: HAYES | O64: BARCLAY | Q64: ADAMS | W64: DANDENONG | X64: 2 | Y64: 0 | Z64: 0 | AA64: 277 | AB64: 219 | AC64: =(AA64/AB64)*100 -> 126.48401826484019 | AD64: =(X64*4)+(Z64*2) -> 8
A65: COBURG | C65: ALLISON 6 | F65: MILROY 4 | H65: IRONMONGER 2 | K65: SMITH 2 | M65: GILMOUR 2 | O65: DOHNT | Q65: CLEARY | W65: COBURG | X65: 1 | Y65: 1 | Z65: 0 | AA65: 285 | AB65: 256 | AC65: =(AA65/AB65)*100 -> 111.328125 | AD65: =(X65*4)+(Z65*2) -> 4
S66: VENUE: FRANKSTON
A67: PORT MELBOURNE | C67: 7 | D67: 5 | E67: 47 | G67: 15 | H67: 9 | I67: 99 | K67: 17 | L67: 15 | M67: 117 | O67: 28 | P67: 19 | Q67: 187 | S67: TORNEY | W67: PRAHRAN | X67: 1 | Y67: 1 | Z67: 0 | AA67: 299 | AB67: 275 | AC67: =(AA67/AB67)*100 -> 108.72727272727272 | AD67: =(X67*4)+(Z67*2) -> 4
A68: FRANKSTON | C68: 1 | D68: 1 | E68: 7 | G68: 4 | H68: 4 | I68: 28 | K68: 8 | L68: 4 | M68: 52 | O68: 10 | P68: 5 | Q68: 65 | S68: STEERE | W68: SANDRINGHAM | X68: 1 | Y68: 1 | Z68: 0 | AA68: 233 | AB68: 247 | AC68: =(AA68/AB68)*100 -> 94.331983805668017 | AD68: =(X68*4)+(Z68*2) -> 4
A69: BEST PLAYERS | W69: CAULFIELD | X69: 1 | Y69: 1 | Z69: 0 | AA69: 294 | AB69: 349 | AC69: =(AA69/AB69)*100 -> 84.240687679083095 | AD69: =(X69*4)+(Z69*2) -> 4
A70: PORT MELBOURNE | C70: GOSS | F70: AANENSEN | I70: HALL | L70: DERMOTT | N70: COOK | Q70: TANTSIS | W70: GEELONG WEST | X70: 0 | Y70: 2 | Z70: 0 | AA70: 260 | AB70: 302 | AC70: =(AA70/AB70)*100 -> 86.092715231788077 | AD70: =(X70*4)+(Z70*2) -> 0
A71: FRANKSTON | C71: MIHOCEK | F71: BOND | I71: HUMPHREY | L71: HUNTER | N71: EMBOM | Q71: KENTER | W71: BRUNSWICK | X71: 0 | Y71: 2 | Z71: 0 | AA71: 195 | AB71: 296 | AC71: =(AA71/AB71)*100 -> 65.878378378378372 | AD71: =(X71*4)+(Z71*2) -> 0
A72: GOALKICKERS | P72: AANENSEN | S72: O'RILEY | W72: FRANKSTON | X72: 0 | Y72: 2 | Z72: 0 | AA72: 180 | AB72: 340 | AC72: =(AA72/AB72)*100 -> 52.941176470588239 | AD72: =(X72*4)+(Z72*2) -> 0
A73: PORT MELBOURNE | C73: COOK 10 | E73: EVANS 4 | G73: BRICE 3 | I73: ALLENDER 3 | L73: JIM CHRISTOU 2 | O73: WILKINSON 2 | R73: GOSS | T73: RODDA
A74: FRANKSTON | C74: HUNTER 3 | E74: BEATON 2 | H74: THOMPSON 2 | K74: MIHOCEK | M74: MOULTON | P74: SALA
A76: DANDENONG | C76: 6 | D76: 3 | E76: 39 | G76: 10 | H76: 6 | I76: 66 | K76: 13 | L76: 8 | M76: 86 | O76: 21 | P76: 12 | Q76: 138 | S76: VENUE: GEELONG WEST
A77: GEELONG WEST | C77: 6 | D77: 6 | E77: 42 | G77: 10 | H77: 13 | I77: 73 | K77: 16 | L77: 18 | M77: 114 | O77: 19 | P77: 22 | Q77: 136 | S77: WILSON :STABB
A78: BEST PLAYERS
A79: DANDENONG | C79: BIFFEN | F79: WOODMAN | I79: HEAP | L79: MADDEN | O79: TOWNSEND | R79: KNIGHT
A80: GEELONG WEST | C80: CRICHTON | F80: ROBINSON | I80: TORNEY | L80: RADOJEVIC | O80: TAYLOR | R80: BROWNE
A81: GOALKICKERS
A82: DANDENONG | C82: HENWOOD 4 | F82: ORTON 3 | H82: WOODMAN 3 | K82: BIFFIN 3 | M82: MADDEN 2 | O82: COVENTRY 2 | R82: ROSS 2 | U82: WALLACE | X82: P KNIGHT
A83: GEELONG WEST | C83: RADOJEVIC 6 | F83: TODD 5 | H83: TAYLOR 3 | K83: CRICHTON 2 | N83: GILMORE 2 | Q83: WOOLFE 2 | S83: TORNEY
A85: CAULFIELD | C85: 2 | D85: 2 | E85: 14 | G85: 11 | H85: 11 | I85: 77 | K85: 15 | L85: 13 | M85: 103 | O85: 23 | P85: 22 | Q85: 160 | S85: VENUE: PRINCES PARK
A86: PRAHRAN | C86: 8 | D86: 7 | E86: 55 | G86: 11 | H86: 13 | I86: 79 | K86: 15 | L86: 19 | M86: 109 | O86: 21 | P86: 20 | Q86: 146 | S86: GROOM :VERGONA
A87: BEST PLAYERS
A88: CAULFIELD | C88: O'DWYER | F88: BOOTH | I88: GIULLERI | L88: RICHARDS | O88: EINSEDEL | Q88: BRUMMELLAN
A89: PRAHRAN | C89: DICKSON | F89: THORNE | I89: DELLAMARTA | L89: ELLETT
A90: GOALKICKERS
A91: CAULFIELD | C91: BRUMMELLAN 5 | F91: CROOK 5 | H91: GIULLERI 4 | J91: BOOTH 4 | L91: O'SULLIVAN 2 | O91: RUSS | P91: DAVIDSON | R91: MILNER
A92: PRAHRAN | C92: SMITH 5 | F92: DELLAMARTA 3 | I92: SOULOS 3 | K92: McFAUL 2 | M92: THORNE 2 | O92: CHAPMAN 2 | R92: McCORMACK 2 | W92: COUNCIL 2
A94: PRESTON | C94: 3 | D94: 2 | E94: 20 | G94: 12 | H94: 4 | I94: 76 | K94: 17 | L94: 5 | M94: 107 | O94: 25 | P94: 7 | Q94: 157 | S94: VENUE: BRUNSWICK
A95: BRUNSWICK | C95: 3 | D95: 5 | E95: 23 | G95: 9 | H95: 6 | I95: 60 | K95: 13 | L95: 12 | M95: 90 | O95: 16 | P95: 16 | Q95: 112 | S95: CASEY :FITZPATRICK
A96: BEST PLAYERS
A97: PRESTON | C97: MARKS | F97: BRINE | I97: CANN | L97: HEARD | O97: McCULLOCH | R97: WARREN
A98: BRUNSWICK | C98: WEST | F98: R SMITH | I98: SAHLBERG | L98: BROWN | O98: NOLAN | R98: LEAHY
A99: GOALKICKERS
A100: PRESTON | C100: ANDERSON 4 | F100: McGAW 4 | H100: HALAS 4 | J100: VANN 3 | L100: MARKS 3 | N100: JESSOP 3 | P100: CANN 2 | R100: McEWAN | U100: BUX
A101: BRUNSWICK | C101: WEST 3 | E101: TOY 3 | G101: SCULLY 3 | I101: GUNSTON 2 | L101: LEAHY 2 | N101: DOLAN | P101: SAHLBERG | R101: CALLANDER
A103: ROUND 3 | D103: 26TH APRIL | I103: WEATHER | S103: PLAYED AT
D104: 1ST QTR | H104: 2ND QTR | L104: 3RD QTR | P104: FINAL | S104: PRESTON
A105: PRESTON | C105: 3 | D105: 7 | E105: 25 | G105: 12 | H105: 12 | I105: 84 | K105: 16 | L105: 15 | M105: 111 | O105: 25 | P105: 21 | Q105: 171 | S105: UMPIRES | X105: LADDER | AB105: ROUND | AD105: 3
A106: DANDENONG | C106: 5 | D106: 2 | E106: 32 | G106: 5 | H106: 4 | I106: 34 | K106: 9 | L106: 9 | M106: 63 | O106: 11 | P106: 12 | Q106: 78 | S106: TORNEY :OAKLEY
A107: BEST PLAYERS | W107: TEAM | X107: W | Y107: L | Z107: D | AA107: FOR | AB107: AGST | AC107: % | AD107: PTS
A108: PRESTON | C108: HEARD | F108: CANN | I108: BUX | K108: McCULLOCH | N108: GOUGH | Q108: WARREN
A109: DANDENONG | C109: HENWOOD | F109: COUSINS | I109: HEAP | K109: ROSS | N109: P KNIGHT | W109: PORT MELBOURNE | X109: 3 | Y109: 0 | Z109: 0 | AA109: 499 | AB109: 272 | AC109: =(AA109/AB109)*100 -> 183.45588235294116 | AD109: =(X109*4)+(Z109*2) -> 12
A110: GOALKICKERS | M110: McGAW | P110: TOWAN | S110: MARKS | W110: PRESTON | X110: 3 | Y110: 0 | Z110: 0 | AA110: 531 | AB110: 324 | AC110: =(AA110/AB110)*100 -> 163.88888888888889 | AD110: =(X110*4)+(Z110*2) -> 12
A111: PRESTON | C111: CANN 4 | E111: HALAS 4 | G111: BARTLETT 3 | J111: JESSOP 3 | L111: McCULLOCH 2 | O111: G L ANDERSON 2 | R111: COOPER | W111: SANDRINGHAM | X111: 2 | Y111: 1 | Z111: 0 | AA111: 433 | AB111: 289 | AC111: =(AA111/AB111)*100 -> 149.82698961937717 | AD111: =(X111*4)+(Z111*2) -> 8
A112: DANDENONG | C112: HENWOOD 7 | F112: TOWNSEND 2 | I112: BIFFIN 2 | W112: DANDENONG | X112: 2 | Y112: 1 | Z112: 0 | AA112: 355 | AB112: 390 | AC112: =(AA112/AB112)*100 -> 91.025641025641022 | AD112: =(X112*4)+(Z112*2) -> 8
S113: VENUE: PORT MELBOURNE
A114: PORT MELBOURNE | C114: 7 | D114: 6 | E114: 48 | G114: 16 | H114: 10 | I114: 106 | K114: 24 | L114: 14 | M114: 158 | O114: 28 | P114: 18 | Q114: 186 | S114: STABB | W114: COBURG | X114: 1 | Y114: 2 | Z114: 0 | AA114: 397 | AB114: 373 | AC114: =(AA114/AB114)*100 -> 106.4343163538874 | AD114: =(X114*4)+(Z114*2) -> 4
A115: CAULFIELD | C115: 4 | D115: 4 | E115: 28 | G115: 10 | H115: 7 | I115: 67 | K115: 13 | L115: 15 | M115: 93 | O115: 15 | P115: 16 | Q115: 106 | S115: OGSTON | W115: PRAHRAN | X115: 1 | Y115: 2 | Z115: 0 | AA115: 462 | AB115: 442 | AC115: =(AA115/AB115)*100 -> 104.52488687782807 | AD115: =(X115*4)+(Z115*2) -> 4
A116: BEST PLAYERS | W116: BRUNSWICK | X116: 1 | Y116: 2 | Z116: 0 | AA116: 362 | AB116: 459 | AC116: =(AA116/AB116)*100 -> 78.86710239651417 | AD116: =(X116*4)+(Z116*2) -> 4
A117: PORT MELBOURNE | C117: DAVIES | F117: AANENAEN | I117: WILKINSON | L117: ALLENDER | O117: JIM CHRISTOU | R117: DOYLE | W117: CAULFIELD | X117: 1 | Y117: 2 | Z117: 0 | AA117: 400 | AB117: 535 | AC117: =(AA117/AB117)*100 -> 74.766355140186917 | AD117: =(X117*4)+(Z117*2) -> 4
A118: CAULFIELD | C118: EINSEDEL | F118: RICHARDS | I118: O'DWYER | L118: BOOTH | W118: FRANKSTON | X118: 1 | Y118: 2 | Z118: 0 | AA118: 297 | AB118: 452 | AC118: =(AA118/AB118)*100 -> 65.707964601769902 | AD118: =(X118*4)+(Z118*2) -> 4
A119: GOALKICKERS | Q119: EVANS | W119: GEELONG WEST | X119: 0 | Y119: 3 | Z119: 0 | AA119: 302 | AB119: 502 | AC119: =(AA119/AB119)*100 -> 60.159362549800797 | AD119: =(X119*4)+(Z119*2) -> 0
A120: PORT MELBOURNE | C120: COOK 7 | E120: ALLENDER 6 | H120: O'RILEY 4 | J120: JIM CHRISTOU 3 | M120: BRICE 3 | O120: WILKINSON 3 | R120: ANDERSON
A121: CAULFIELD | C121: DAVIDSON 3 | F121: MILNER 3 | H121: ROWE 2 | J121: O'SULLIVAN | M121: CROOK | O121: O'DWYER | Q121: BRUMMELLAN | T121: GIULLERI | W121: STAIT | X121: O'BRIEN
A123: SANDRINGHAM | C123: 6 | D123: 3 | E123: 39 | G123: 15 | H123: 6 | I123: 96 | K123: 24 | L123: 13 | M123: 157 | O123: 31 | P123: 14 | Q123: 200 | S123: VENUE: BEACH ROAD
A124: GEELONG WEST | C124: 1 | D124: 4 | E124: 10 | G124: 2 | H124: 9 | I124: 21 | K124: 3 | L124: 10 | M124: 28 | O124: 5 | P124: 12 | Q124: 42 | S124: CASEY :COLISIMO
A125: BEST PLAYERS
A126: SANDRINGHAM | C126: WILKINS | F126: MANNIX | I126: BEUS | K126: SCOTT | N126: WAY | Q126: PLEDGER
A127: GEELONG WEST | C127: WILSON | F127: TAYLOR | I127: YATES | K127: ROBINSON | N127: McDOWELL | Q127: CRICHTON
A128: GOALKICKERS
A129: SANDRINGHAM | C129: HUNT 9 | E129: MAILING 6 | G129: MANNIX 3 | I129: WAY 3 | K129: CHAPMAN 3 | N129: BELL 2 | P129: ADAMS | R129: SARAU | T129: BEUS | W129: GILMORE | X129: HAYES
A130: GEELONG WEST | C130: TAYLOR 2 | F130: CARR | H130: CRICHTON | K130: BROWNE
A132: BRUNSWICK | C132: 9 | D132: 5 | E132: 59 | G132: 13 | H132: 9 | I132: 87 | K132: 21 | L132: 14 | M132: 140 | O132: 25 | P132: 17 | Q132: 167 | S132: VENUE: TOORAK PARK
A133: PRAHRAN | C133: 6 | D133: 3 | E133: 39 | G133: 12 | H133: 7 | I133: 79 | K133: 20 | L133: 9 | M133: 129 | O133: 25 | P133: 13 | Q133: 163 | S133: STEERE :GRIFFITHS
A134: BEST PLAYERS
A135: BRUNSWICK | C135: LAKER | F135: SAHLBERG | I135: NOLAN | L135: SMITH | N135: WEST | P135: CALLANDER
A136: PRAHRAN | C136: THORNE | F136: SMITH | I136: MILLS | L136: DICKSON | N136: HINE
A137: GOALKICKERS
A138: BRUNSWICK | C138: CALLANDER 4 | F138: WEST 4 | H138: SAHLBERG 3 | K138: GUNSTON 3 | M138: SCULLY 3 | O138: BYE 2 | Q138: CROTTY 2 | S138: HICKMAN | V138: DOLAN | X138: LEAHY
A139: PRAHRAN | C139: SMITH 9 | E139: MCCORMACK 5 | H139: MILLS 4 | J139: CHAPMAN 2 | M139: MAXWELL 2 | O139: THORNE | Q139: NIDDRIE | S139: ELLETT | V139: KIMPTON
A141: FRANKSTON | C141: 4 | D141: 3 | E141: 27 | G141: 9 | H141: 6 | I141: 60 | K141: 15 | L141: 12 | M141: 102 | O141: 17 | P141: 15 | Q141: 117 | S141: VENUE: COBURG
A142: COBURG | C142: 5 | D142: 1 | E142: 31 | G142: 9 | H142: 8 | I142: 62 | K142: 10 | L142: 12 | M142: 72 | O142: 16 | P142: 16 | Q142: 112 | S142: FITZPATRICK :WILSON
A143: BEST PLAYERS
A144: FRANKSTON | C144: JONES | F144: HUNPHREY | I144: GEDDES | L144: HOUSDEN | O144: LYNN
A145: COBURG | C145: BURT | F145: MILROY | I145: ALLISON | L145: HERBERT | O145: SANDERSON
A146: GOALKICKERS
A147: FRANKSTON | C147: SERAFINI 5 | F147: HUNTER 3 | I147: BOND 2 | K147: G WILLIAMS 2 | N147: BELL 2 | P147: MOULTON | R147: LANE | T147: HAMILL
A148: COBURG | C148: IRONMONGER 3 | F148: ALLISON 3 | I148: BURT 2 | K148: WOOD 2 | M148: PENBURTHY 2 | P148: GILMOUR | R148: DOHNT | T148: HERBERT | W148: MILROY
A150: ROUND 4 | D150: 3RD MAY | I150: WEATHER | S150: VENUE: DANDENONG
D151: 1ST QTR | H151: 2ND QTR | L151: 3RD QTR | P151: FINAL | S151: UMPIRES
A152: PRAHRAN | C152: 4 | D152: 5 | E152: 29 | G152: 9 | H152: 9 | I152: 63 | K152: 14 | L152: 12 | M152: 96 | O152: 20 | P152: 19 | Q152: 139 | S152: OGSTON | X152: LADDER | AB152: ROUND | AD152: 4
A153: DANDENONG | C153: 6 | D153: 4 | E153: 40 | G153: 8 | H153: 7 | I153: 55 | K153: 13 | L153: 17 | M153: 95 | O153: 18 | P153: 20 | Q153: 128 | S153: FITZPATRICK
A154: BEST PLAYERS | W154: TEAM | X154: W | Y154: L | Z154: D | AA154: FOR | AB154: AGST | AC154: % | AD154: PTS
A155: PRAHRAN | C155: SOULOS | F155: THORNE | I155: McFAULL | L155: McCORMACK | O155: DICKSON | Q155: HINE
A156: DANDENONG | C156: WOODMAN | F156: HEAP | I156: ORTON | L156: LUKAS | O156: COUSINS | Q156: S KNIGHT | W156: PORT MELBOURNE | X156: 4 | Y156: 0 | Z156: 0 | AA156: 640 | AB156: 369 | AC156: =(AA156/AB156)*100 -> 173.44173441734418 | AD156: =(X156*4)+(Z156*2) -> 16
A157: GOALKICKERS | N157: CHAPMAN | Q157: AUSTEN | W157: PRESTON | X157: 4 | Y157: 0 | Z157: 0 | AA157: 690 | AB157: 450 | AC157: =(AA157/AB157)*100 -> 153.33333333333334 | AD157: =(X157*4)+(Z157*2) -> 16
A158: PRAHRAN | C158: K SMITH 4 | E158: SOULOS 3 | G158: McDONALD 3 | J158: MILLS 2 | L158: THORNE 2 | N158: McCORMACK 2 | Q158: STONE | W158: SANDRINGHAM | X158: 3 | Y158: 1 | Z158: 0 | AA158: 546 | AB158: 392 | AC158: =(AA158/AB158)*100 -> 139.28571428571428 | AD158: =(X158*4)+(Z158*2) -> 12
A159: DANDENONG | C159: ORTON 5 | E159: HENWOOD 5 | H159: HEAP 4 | J159: LUKAS 2 | L159: COUSINS 2 | N159: WOODMAN | Q159: ROSS | W159: COBURG | X159: 2 | Y159: 2 | Z159: 0 | AA159: 532 | AB159: 488 | AC159: =(AA159/AB159)*100 -> 109.01639344262296 | AD159: =(X159*4)+(Z159*2) -> 8
S160: VENUE: BRUNSWICK
A161: PORT MELBOURNE | C161: 3 | D161: 9 | E161: 27 | G161: 12 | H161: 12 | I161: 84 | K161: 15 | L161: 21 | M161: 111 | O161: 19 | P161: 27 | Q161: 141 | S161: VERGONA | W161: PRAHRAN | X161: 2 | Y161: 2 | Z161: 0 | AA161: 601 | AB161: 570 | AC161: =(AA161/AB161)*100 -> 105.43859649122807 | AD161: =(X161*4)+(Z161*2) -> 8
A162: BRUNSWICK | C162: 1 | D162: 4 | E162: 10 | G162: 4 | H162: 8 | I162: 32 | K162: 7 | L162: 11 | M162: 53 | O162: 14 | P162: 13 | Q162: 97 | S162: WILSON | W162: DANDENONG | X162: 2 | Y162: 2 | Z162: 0 | AA162: 483 | AB162: 529 | AC162: =(AA162/AB162)*100 -> 91.304347826086953 | AD162: =(X162*4)+(Z162*2) -> 8
A163: BEST PLAYERS | W163: CAULFIELD | X163: 1 | Y163: 3 | Z163: 0 | AA163: 515 | AB163: 670 | AC163: =(AA163/AB163)*100 -> 76.865671641791039 | AD163: =(X163*4)+(Z163*2) -> 4
A164: PORT MELBOURNE | C164: GOSS | E164: AANENSEN | H164: HALL | J164: DAVIES | M164: KAVANAGH | P164: ANDERSON | W164: BRUNSWICK | X164: 1 | Y164: 3 | Z164: 0 | AA164: 459 | AB164: 600 | AC164: =(AA164/AB164)*100 -> 76.5 | AD164: =(X164*4)+(Z164*2) -> 4
A165: BRUNSWICK | C165: WEST | E165: NOLAN | H165: BROWN | J165: ANDERSON | M165: KIMPTON | W165: FRANKSTON | X165: 1 | Y165: 3 | Z165: 0 | AA165: 400 | AB165: 565 | AC165: =(AA165/AB165)*100 -> 70.796460176991147 | AD165: =(X165*4)+(Z165*2) -> 4
A166: GOALKICKERS | W166: GEELONG WEST | X166: 0 | Y166: 4 | Z166: 0 | AA166: 428 | AB166: 661 | AC166: =(AA166/AB166)*100 -> 64.750378214826014 | AD166: =(X166*4)+(Z166*2) -> 0
A167: PORT MELBOURNE | C167: COOK 5 | E167: ANDERSON 3 | H167: EVANS 3 | J167: GOSS 2 | L167: O'RILEY 2 | N167: DOYLE 2 | P167: KAVANAGH | S167: BRICE
A168: BRUNSWICK | C168: ANDERSON 6 | F168: WEST 4 | H168: STAFFORD 2 | K168: GUNSTON 2
A170: COBURG | C170: 5 | D170: 6 | E170: 36 | G170: 8 | H170: 9 | I170: 57 | K170: 16 | L170: 12 | M170: 108 | O170: 20 | P170: 15 | Q170: 135 | S170: VENUE: PRINCES PARK
A171: CAULFIELD | C171: 3 | D171: 4 | E171: 22 | G171: 6 | H171: 11 | I171: 47 | K171: 10 | L171: 12 | M171: 72 | O171: 16 | P171: 19 | Q171: 115 | S171: OAKLEY :COLISIMO
A172: BEST PLAYERS
A173: COBURG | C173: BURT | F173: MILROY | I173: FITZGERALD | L173: SANDERSON | O173: WILLIAMS | R173: PITT
A174: CAULFIELD | C174: GIULLERI | F174: ROSS | I174: MORRISON
A175: GOALKICKERS
A176: COBURG | C176: IRONMONGER 6 | F176: ALLINSON 3 | I176: M HARBINSON 3 | L176: HERBERT 2 | N176: EADE 2 | P176: WESCOMBE 2 | S176: WILLIAMS | W176: FITZGERALD
A177: CAULFIELD | C177: McDONALD 4 | F177: ROWE 4 | H177: O'SULLIVAN | J177: CROOK | L177: GIULLERI | N177: BOOTH | P177: PEARCE | R177: MORRISON | U177: O'BRIEN | X177: MITCHELL
A179: SANDRINGHAM | C179: 1 | D179: 0 | E179: 6 | G179: 3 | H179: 9 | I179: 27 | K179: 12 | L179: 11 | M179: 83 | O179: 16 | P179: 17 | Q179: 113 | S179: VENUE: FRANKSTON
A180: FRANKSTON | C180: 5 | D180: 7 | E180: 37 | G180: 8 | H180: 9 | I180: 57 | K180: 12 | L180: 15 | M180: 87 | O180: 14 | P180: 19 | Q180: 103 | S180: GROOM :GRIFFITHS
A181: BEST PLAYERS
A182: SANDRINGHAM | C182: PLEDGER | F182: HUNT | I182: SARAU | L182: GILMORE | N182: ADAMS | Q182: DROSCHER
A183: FRANKSTON | C183: JONES | F183: MOULTON | I183: HOUSDEN | L183: CASEY | N183: LYNN
A184: GOALKICKERS
A185: SANDRINGHAM | C185: HUNT 6 | F185: WILKINS 2 | I185: O'BRIEN 2 | K185: WAY 2 | M185: ADAMS | O185: BELL | Q185: GILMORE
A186: FRANKSTON | C186: SERAFINI 5 | F186: MOULTON 2 | I186: LANE 2 | K186: JONES | M186: WILLIAMS | O186: BELL | Q186: HORLER | S186: HAMILL
A188: PRESTON | C188: 8 | D188: 1 | E188: 49 | G188: 12 | H188: 6 | I188: 78 | K188: 18 | L188: 9 | M188: 117 | O188: 24 | P188: 15 | Q188: 159 | S188: VENUE: GEELONG WEST
A189: GEELONG WEST | C189: 6 | D189: 2 | E189: 38 | G189: 11 | H189: 4 | I189: 70 | K189: 16 | L189: 6 | M189: 102 | O189: 20 | P189: 6 | Q189: 126 | S189: HUTCHINSON :STEERE
A190: BEST PLAYERS
A191: PRESTON | C191: McGAW | F191: MARKS | I191: BRYAN | L191: JESSOP | N191: VANN | Q191: HALAS
A192: GEELONG WEST | C192: TODD | F192: ROBINSON | I192: TAYLOR | L192: RADOJEVIC | N192: YATES | Q192: BROWNE
A193: GOALKICKERS
A194: PRESTON | C194: VANN 6 | E194: HALAS 5 | G194: McGAW 3 | I194: ANDERSON 2 | L194: CANN | N194: MARKS | P194: BARTLETT
A195: GEELONG WEST | C195: RADOJEVIC 8 | F195: ELLIS 4 | H195: BEATON 2 | J195: BENTLEY 2 | M195: TODD 2 | O195: CRICHTON | Q195: TAYLOR
A197: ROUND 5 | D197: 10TH MAY | I197: WEATHER | S197: PLAYED AT
D198: 1ST QTR | H198: 2ND QTR | L198: 3RD QTR | P198: FINAL | S198: COBURG
A199: PRESTON | C199: 5 | D199: 2 | E199: 32 | G199: 7 | H199: 6 | I199: 48 | K199: 10 | L199: 12 | M199: 72 | O199: 17 | P199: 19 | Q199: 121 | S199: UMPIRES | X199: LADDER | AB199: ROUND | AD199: 5
A200: COBURG | C200: 3 | D200: 6 | E200: 24 | G200: 8 | H200: 9 | I200: 57 | K200: 8 | L200: 10 | M200: 58 | O200: 11 | P200: 16 | Q200: 82 | S200: WILSON :STABB
A201: BEST PLAYERS | W201: TEAM | X201: W | Y201: L | Z201: D | AA201: FOR | AB201: AGST | AC201: % | AD201: PTS
A202: PRESTON | C202: MARKS | F202: WARREN | I202: BRINE | L202: HEARD | O202: COOPER | R202: BANKS
A203: COBURG | C203: DOUGLAS | F203: BURT | I203: A HARBINSON | L203: FITZGERALD | W203: PORT MELBOURNE | X203: 5 | Y203: 0 | Z203: 0 | AA203: 862 | AB203: 438 | AC203: =(AA203/AB203)*100 -> 196.80365296803652 | AD203: =(X203*4)+(Z203*2) -> 20
A204: GOALKICKERS | W204: PRESTON | X204: 5 | Y204: 0 | Z204: 0 | AA204: 811 | AB204: 532 | AC204: =(AA204/AB204)*100 -> 152.44360902255639 | AD204: =(X204*4)+(Z204*2) -> 20
A205: PRESTON | C205: HALAS 5 | F205: BANKS 3 | H205: VANN 3 | J205: CANN 2 | L205: COOPER 2 | N205: BARTLETT | Q205: JESSOP | W205: SANDRINGHAM | X205: 4 | Y205: 1 | Z205: 0 | AA205: 673 | AB205: 506 | AC205: =(AA205/AB205)*100 -> 133.00395256916997 | AD205: =(X205*4)+(Z205*2) -> 16
A206: COBURG | C206: MILROY 3 | F206: HERBERT 2 | I206: IRONMONGER | L206: BURT | M206: ALLISON | O206: M HARBINSON | R206: WILLIAMS | W206: COBURG | X206: 2 | Y206: 3 | Z206: 0 | AA206: 614 | AB206: 609 | AC206: =(AA206/AB206)*100 -> 100.82101806239739 | AD206: =(X206*4)+(Z206*2) -> 8
N207: FITZGERALD | S207: VENUE: PORT MELBOURNE
A208: PORT MELBOURNE | C208: 5 | D208: 5 | E208: 35 | G208: 9 | H208: 11 | I208: 65 | K208: 22 | L208: 18 | M208: 150 | O208: 33 | P208: 24 | Q208: 222 | S208: TORNEY | W208: DANDENONG | X208: 2 | Y208: 3 | Z208: 0 | AA208: 597 | AB208: 656 | AC208: =(AA208/AB208)*100 -> 91.006097560975604 | AD208: =(X208*4)+(Z208*2) -> 8
A209: PRAHRAN | C209: 4 | D209: 0 | E209: 24 | G209: 7 | H209: 4 | I209: 46 | K209: 8 | L209: 6 | M209: 54 | O209: 10 | P209: 9 | Q209: 69 | S209: OAKLEY | W209: PRAHRAN | X209: 2 | Y209: 3 | Z209: 0 | AA209: 670 | AB209: 792 | AC209: =(AA209/AB209)*100 -> 84.595959595959584 | AD209: =(X209*4)+(Z209*2) -> 8
A210: BEST PLAYERS | W210: FRANKSTON | X210: 2 | Y210: 3 | Z210: 0 | AA210: 525 | AB210: 667 | AC210: =(AA210/AB210)*100 -> 78.710644677661165 | AD210: =(X210*4)+(Z210*2) -> 8
A211: PORT MELBOURNE | C211: GOSS | E211: JIM CHRISTOU | H211: JOHN CHRISTOU | L211: HALL | N211: O'RILEY | Q211: WILKINSON | W211: BRUNSWICK | X211: 1 | Y211: 4 | Z211: 0 | AA211: 561 | AB211: 725 | AC211: =(AA211/AB211)*100 -> 77.379310344827587 | AD211: =(X211*4)+(Z211*2) -> 4
A212: PRAHRAN | C212: STONE | E212: FOLEY | H212: DICKSON | L212: McFAULL | W212: CAULFIELD | X212: 1 | Y212: 4 | Z212: 0 | AA212: 618 | AB212: 818 | AC212: =(AA212/AB212)*100 -> 75.55012224938875 | AD212: =(X212*4)+(Z212*2) -> 4
A213: GOALKICKERS | W213: GEELONG WEST | X213: 1 | Y213: 4 | Z213: 0 | AA213: 576 | AB213: 764 | AC213: =(AA213/AB213)*100 -> 75.392670157068068 | AD213: =(X213*4)+(Z213*2) -> 4
A214: PORT MELBOURNE | C214: JIM CHRISTOU 8 | F214: COOK 6 | H214: O'RILEY 5 | J214: ANDERSON 3 | M214: BRICE 3 | O214: EVANS 3 | Q214: SWAN 2 | S214: GOSS 2 | U214: DOYLE
A215: PRAHRAN | C215: SMITH 4 | F215: AUSTEN 2 | I215: STONE 2 | K215: NIDDRIE | M215: MILLS
A217: SANDRINGHAM | C217: 2 | D217: 8 | E217: 20 | G217: 6 | H217: 13 | I217: 49 | K217: 11 | L217: 16 | M217: 82 | O217: 18 | P217: 19 | Q217: 127 | S217: VENUE: BEACH ROAD
A218: DANDENONG | C218: 3 | D218: 2 | E218: 20 | G218: 8 | H218: 3 | I218: 51 | K218: 14 | L218: 8 | M218: 92 | O218: 17 | P218: 12 | Q218: 114 | S218: VERGONA :STEERE
A219: BEST PLAYERS
A220: SANDRINGHAM | C220: HAYES | F220: SCOTT | I220: WAY | L220: ADAMS | O220: OSBORNE | R220: PLEDGER
A221: DANDENONG | C221: McCONNELL | F221: HEAP | I221: P KNIGHT | L221: MADDEN | O221: HENWOOD | R221: BIFFEN
A222: GOALKICKERS
A223: SANDRINGHAM | C223: HUNT 4 | E223: MAILING 3 | G223: WILKINS 2 | I223: WAY 2 | K223: PLEDGER | M223: BELL | N223: MANNIX | P223: GILMORE | R223: SIMS | T223: BEUS | V223: CHAPMAN
A224: DANDENONG | C224: HENWOOD 6 | F224: COVENTRY 2 | I224: HORAZCKO 2 | L224: WOODMAN | N224: LUKAS | P224: HARPER | R224: MADDEN | U224: ROSS | W224: CALLERY | X224: McCONNELL
A226: FRANKSTON | C226: 6 | D226: 2 | E226: 38 | G226: 9 | H226: 7 | I226: 61 | K226: 12 | L226: 10 | M226: 82 | O226: 18 | P226: 17 | Q226: 125 | S226: VENUE: FRANKSTON
A227: BRUNSWICK | C227: 9 | D227: 2 | E227: 56 | G227: 11 | H227: 4 | I227: 70 | K227: 14 | L227: 12 | M227: 96 | O227: 15 | P227: 12 | Q227: 102 | S227: FITZPATRICK :RYAN
A228: BEST PLAYERS
A229: FRANKSTON | C229: JONES | F229: SALA | I229: ENBOM | L229: HOUSDEN | O229: CASEY
A230: BRUNSWICK | C230: LAKER | F230: WEST | I230: CROTTY | L230: TOY | O230: STAFFORD
A231: GOALKICKERS
A232: FRANKSTON | C232: SERAFINI 4 | E232: WALTON 3 | H232: BOYD 3 | J232: JONES 2 | L232: LANE 2 | N232: BOND | P232: GEDDES | R232: BELL | T232: WILLIAMS
A233: BRUNSWICK | C233: GUNSTON 3 | F233: TOY 3 | H233: STAFFORD 3 | J233: HUGGARD 2 | M233: ANDERSON 2 | P233: SAHLBERG | R233: HICKMAN
A235: GEELONG WEST | C235: 3 | D235: 4 | E235: 22 | G235: 10 | H235: 9 | I235: 69 | K235: 16 | L235: 11 | M235: 107 | O235: 22 | P235: 16 | Q235: 148 | S235: VENUE: GEELONG WEST
A236: CAULFIELD | C236: 4 | D236: 6 | E236: 30 | G236: 4 | H236: 9 | I236: 33 | K236: 9 | L236: 16 | M236: 70 | O236: 14 | P236: 19 | Q236: 103 | S236: BLOOM :GROOM
A237: BEST PLAYERS
A238: GEELONG WEST | C238: TAYLOR | F238: BROWNE | I238: TORNEY | L238: BENTLEY | O238: ELLIS | Q238: GILMOUR
A239: CAULFIELD | C239: RUSS | F239: McDONALD | I239: ROWE | L239: HOGAN
A240: GOALKICKERS
A241: GEELONG WEST | C241: BENTLEY 7 | E241: TAYLOR 6 | G241: RADOJEVIC 3 | J241: CRICHTON 2 | M241: CANTWELL | P241: CARR | R241: ELLIS | T241: POULTER
A242: CAULFIELD | C242: ROWE 4 | E242: CROOK 2 | G242: BRUMMELLAN 2 | J242: M DUNCAN 2 | M242: McDONALD | P242: BRASIER | R242: BOOTH | T242: HOGAN
A244: ROUND 6 | D244: 17TH MAY | I244: WEATHER | S244: VENUE: PRESTON
D245: 1ST QTR | H245: 2ND QTR | L245: 3RD QTR | P245: FINAL | S245: UMPIRES
A246: SANDRINGHAM | C246: 5 | D246: 3 | E246: 33 | G246: 9 | H246: 6 | I246: 60 | K246: 13 | L246: 7 | M246: 85 | O246: 18 | P246: 14 | Q246: 122 | S246: OAKLEY | X246: LADDER | AB246: ROUND | AD246: 6
A247: PRESTON | C247: 7 | D247: 5 | E247: 47 | G247: 11 | H247: 5 | I247: 71 | K247: 12 | L247: 11 | M247: 83 | O247: 15 | P247: 12 | Q247: 102 | S247: OGSTON
A248: BEST PLAYERS | W248: TEAM | X248: W | Y248: L | Z248: D | AA248: FOR | AB248: AGST | AC248: % | AD248: PTS
A249: SANDRINGHAM | C249: HUNT | E249: SIMS | G249: GILMORE | J249: MANNIX | M249: PLEDGER | P249: BELL
A250: PRESTON | C250: JESSOP | E250: CANN | G250: VANN | J250: BRINE | M250: WARREN | P250: McCULLOCH | W250: PORT MELBOURNE | X250: 6 | Y250: 0 | Z250: 0 | AA250: 1040 | AB250: 509 | AC250: =(AA250/AB250)*100 -> 204.3222003929273 | AD250: =(X250*4)+(Z250*2) -> 24
A251: GOALKICKERS | W251: PRESTON | X251: 5 | Y251: 1 | Z251: 0 | AA251: 913 | AB251: 654 | AC251: =(AA251/AB251)*100 -> 139.60244648318044 | AD251: =(X251*4)+(Z251*2) -> 20
A252: SANDRINGHAM | C252: HUNT 10 | E252: O'BRIEN 3 | G252: GILMORE 2 | I252: ADAMS | K252: SIMS | M252: WAY | W252: SANDRINGHAM | X252: 5 | Y252: 1 | Z252: 0 | AA252: 795 | AB252: 608 | AC252: =(AA252/AB252)*100 -> 130.75657894736844 | AD252: =(X252*4)+(Z252*2) -> 20
A253: PRESTON | C253: VANN 5 | E253: JESSOP 3 | G253: McGAW 3 | I253: HALAS 2 | K253: McEWAN | M253: ANDERSON | W253: PRAHRAN | X253: 3 | Y253: 3 | Z253: 0 | AA253: 788 | AB253: 901 | AC253: =(AA253/AB253)*100 -> 87.458379578246394 | AD253: =(X253*4)+(Z253*2) -> 12
S254: VENUE: TOORAK PARK
A255: PRAHRAN | C255: 2 | D255: 1 | E255: 13 | G255: 10 | H255: 3 | I255: 63 | K255: 13 | L255: 6 | M255: 84 | O255: 18 | P255: 10 | Q255: 118 | S255: GROOM | W255: FRANKSTON | X255: 3 | Y255: 3 | Z255: 0 | AA255: 651 | AB255: 777 | AC255: =(AA255/AB255)*100 -> 83.78378378378379 | AD255: =(X255*4)+(Z255*2) -> 12
A256: COBURG | C256: 8 | D256: 6 | E256: 54 | G256: 11 | H256: 8 | I256: 74 | K256: 12 | L256: 14 | M256: 86 | O256: 15 | P256: 19 | Q256: 109 | S256: CROXFORD | W256: COBURG | X256: 2 | Y256: 4 | Z256: 0 | AA256: 723 | AB256: 727 | AC256: =(AA256/AB256)*100 -> 99.449793672627237 | AD256: =(X256*4)+(Z256*2) -> 8
A257: BEST PLAYERS | W257: BRUNSWICK | X257: 2 | Y257: 4 | Z257: 0 | AA257: 675 | AB257: 837 | AC257: =(AA257/AB257)*100 -> 80.645161290322577 | AD257: =(X257*4)+(Z257*2) -> 8
A258: PRAHRAN | C258: McFAULL | F258: McCORMACK | J258: STONE | M258: FOLEY | P258: DICKSON | S258: LOWE | W258: DANDENONG | X258: 2 | Y258: 4 | Z258: 0 | AA258: 707 | AB258: 782 | AC258: =(AA258/AB258)*100 -> 90.409207161125309 | AD258: =(X258*4)+(Z258*2) -> 8
A259: COBURG | C259: HALSALL | F259: A HARBINSON | J259: DOUGLAS | M259: FITZGERALD | P259: M HARBINSON | S259: HERBERT | W259: CAULFIELD | X259: 1 | Y259: 5 | Z259: 0 | AA259: 730 | AB259: 932 | AC259: =(AA259/AB259)*100 -> 78.326180257510728 | AD259: =(X259*4)+(Z259*2) -> 4
A260: GOALKICKERS | W260: GEELONG WEST | X260: 1 | Y260: 5 | Z260: 0 | AA260: 647 | AB260: 942 | AC260: =(AA260/AB260)*100 -> 68.683651804670916 | AD260: =(X260*4)+(Z260*2) -> 4
A261: PRAHRAN | C261: McCORMACK 5 | F261: MILLS 3 | H261: STONE 3 | J261: THORNE 2 | M261: AUSTEN 2 | O261: McDONALD 2 | R261: ELLETT
A262: COBURG | C262: HALSALL 4 | F262: M HARBINSON 4 | J262: SMITH 2 | L262: ALLISON 2 | N262: FITZGERALD 2 | Q262: A HARBINSON
A264: FRANKSTON | C264: 2 | D264: 2 | E264: 14 | G264: 6 | H264: 5 | I264: 41 | K264: 13 | L264: 7 | M264: 85 | O264: 19 | P264: 12 | Q264: 126 | S264: VENUE: DANDENONG
A265: DANDENONG | C265: 3 | D265: 5 | E265: 23 | G265: 7 | H265: 8 | I265: 50 | K265: 11 | L265: 12 | M265: 78 | O265: 16 | P265: 14 | Q265: 110 | S265: STABB :BLOOM
A266: BEST PLAYERS
A267: FRANKSTON | C267: SERAFINI | F267: JONES | I267: MOULTON | L267: GEDDES | O267: BELL | Q267: CZARNECKI
A268: DANDENONG | C268: WOODMAN | F268: MADDEN | I268: COUSINS | L268: S KNIGHT | O268: ROSS | Q268: McCONNELL
A269: GOALKICKERS
A270: FRANKSTON | C270: SERAFINI 8 | F270: GEDDES 2 | H270: WALTON 2 | J270: CZARNECKI 2 | M270: JONES | O270: SALA | Q270: LANE | R270: MOULTON | U270: HOUSTON
A271: DANDENONG | C271: ROSS 3 | E271: WOODMAN 3 | H271: BIFFIN 3 | J271: CALLERY 2 | M271: COUSINS | O271: HENWOOD | Q271: COVENTRY | S271: McCONNELL | W271: HORAZCKO
A273: BRUNSWICK | C273: 5 | D273: 3 | E273: 33 | G273: 10 | H273: 5 | I273: 65 | K273: 14 | L273: 12 | M273: 96 | O273: 17 | P273: 16 | Q273: 114 | S273: VENUE: BRUNSWICK
A274: CAULFIELD | C274: 5 | D274: 4 | E274: 34 | G274: 8 | H274: 8 | I274: 56 | K274: 13 | L274: 11 | M274: 89 | O274: 17 | P274: 14 | Q274: 112 | S274: TORNEY :BUDGE
A275: BEST PLAYERS
A276: BRUNSWICK | C276: HICKMAN | F276: GUNSTONE | I276: BROWN | L276: NOLAN | N276: KIMPTON
A277: CAULFIELD | C277: McDONALD | F277: DUNCAN | I277: AMBLER | L277: HOGAN | N277: ROWE
A278: GOALKICKERS
A279: BRUNSWICK | C279: GUNSTONE 5 | F279: TOY 3 | H279: STAFFORD 2 | K279: CROTTY 2 | M279: ANDERSON 2 | P279: NOLAN | R279: RYAN | T279: SCULLY
A280: CAULFIELD | C280: DAVIDSON 6 | F280: BOOTH 4 | H280: ROWE 3 | J280: DUNCAN | L280: HOGAN | N280: AMBLER | P280: MORRISON
A282: PORT MELBOURNE | C282: 3 | D282: 6 | E282: 24 | G282: 8 | H282: 10 | I282: 58 | K282: 17 | L282: 13 | M282: 115 | O282: 27 | P282: 16 | Q282: 178 | S282: VENUE: PORT MELBOURNE
A283: GEELONG WEST | C283: 2 | D283: 2 | E283: 14 | G283: 4 | H283: 6 | I283: 30 | K283: 7 | L283: 13 | M283: 55 | O283: 9 | P283: 17 | Q283: 71 | S283: RYAN :CASEY
A284: BEST PLAYERS
A285: PORT MELBOURNE | C285: DERMOTT | F285: THOMPSON | I285: AANENSEN | L285: GOSS | N285: ANDERSON | Q285: JOHN CHRISTOU
A286: GEELONG WEST | C286: BEATON | F286: CRICHTON | I286: TORNEY | L286: WILSON | N286: LYNCH | Q286: GILMOUR
A287: GOALKICKERS
A288: PORT MELBOURNE | C288: ANDERSON 5 | F288: COOK 5 | H288: EVANS 4 | J288: JIM CHRISTOU 3 | M288: SWAN 3 | O288: KAVANAGH 3 | R288: GOSS | T288: O'RILEY | W288: AANENSEN | X288: BRICE
A289: GEELONG WEST | C289: TORNEY 4 | F289: GILMOUR | I289: BENTLEY | K289: LYNCH | M289: TAYLOR | O289: WILSON
A291: ROUND 7 | D291: 24TH MAY | I291: WEATHER
D292: 1ST QTR | H292: 2ND QTR | L292: 3RD QTR | P292: FINAL | S292: VENUE: BEACH ROAD
A293: SANDRINGHAM | C293: 5 | D293: 5 | E293: 35 | G293: 9 | H293: 10 | I293: 64 | K293: 15 | L293: 12 | M293: 102 | O293: 16 | P293: 18 | Q293: 114 | S293: UMPIRES | X293: LADDER | AB293: ROUND | AD293: 7
A294: PRAHRAN | C294: 2 | D294: 2 | E294: 14 | G294: 6 | H294: 9 | I294: 45 | K294: 12 | L294: 15 | M294: 87 | O294: 12 | P294: 19 | Q294: 91 | S294: STABB :CASEY
A295: BEST PLAYERS | W295: TEAM | X295: W | Y295: L | Z295: D | AA295: FOR | AB295: AGST | AC295: % | AD295: PTS
A296: SANDRINGHAM | C296: SIMS | F296: WILKINS | I296: MAILING | L296: BELL | N296: SCOTT | Q296: PLEDGER
A297: PRAHRAN | C297: DICKSON | F297: STONE | I297: THORNE | L297: HINE | N297: McFAULL | Q297: TWOMEY | W297: PORT MELBOURNE | X297: 6 | Y297: 1 | Z297: 0 | AA297: 1131 | AB297: 665 | AC297: =(AA297/AB297)*100 -> 170.0751879699248 | AD297: =(X297*4)+(Z297*2) -> 24
A298: GOALKICKERS | W298: SANDRINGHAM | X298: 6 | Y298: 1 | Z298: 0 | AA298: 909 | AB298: 699 | AC298: =(AA298/AB298)*100 -> 130.04291845493563 | AD298: =(X298*4)+(Z298*2) -> 24
A299: SANDRINGHAM | C299: MAILING 4 | F299: HUNT 3 | H299: GILMORE 3 | K299: CHAPMAN 2 | N299: O'BRIEN | P299: ADAMS | R299: BEUS | T299: WAY | W299: PRESTON | X299: 5 | Y299: 2 | Z299: 0 | AA299: 1023 | AB299: 785 | AC299: =(AA299/AB299)*100 -> 130.31847133757961 | AD299: =(X299*4)+(Z299*2) -> 20
A300: PRAHRAN | C300: CLARKE 4 | F300: McDONALD 3 | I300: STONE 2 | K300: McCORMACK 2 | N300: YOUNG | W300: FRANKSTON | X300: 4 | Y300: 3 | Z300: 0 | AA300: 782 | AB300: 887 | AC300: =(AA300/AB300)*100 -> 88.162344983089071 | AD300: =(X300*4)+(Z300*2) -> 16
S301: VENUE: FRANKSTON
A302: FRANKSTON | C302: 3 | D302: 4 | E302: 22 | G302: 8 | H302: 10 | I302: 58 | K302: 14 | L302: 13 | M302: 97 | O302: 19 | P302: 17 | Q302: 131 | S302: GROOM | W302: COBURG | X302: 3 | Y302: 4 | Z302: 0 | AA302: 879 | AB302: 818 | AC302: =(AA302/AB302)*100 -> 107.45721271393643 | AD302: =(X302*4)+(Z302*2) -> 12
A303: PRESTON | C303: 5 | D303: 7 | E303: 37 | G303: 7 | H303: 11 | I303: 53 | K303: 10 | L303: 15 | M303: 75 | O303: 15 | P303: 20 | Q303: 110 | S303: VERGONA | W303: DANDENONG | X303: 3 | Y303: 4 | Z303: 0 | AA303: 831 | AB303: 888 | AC303: =(AA303/AB303)*100 -> 93.581081081081081 | AD303: =(X303*4)+(Z303*2) -> 12
A304: BEST PLAYERS | W304: PRAHRAN | X304: 3 | Y304: 4 | Z304: 0 | AA304: 879 | AB304: 1015 | AC304: =(AA304/AB304)*100 -> 86.600985221674875 | AD304: =(X304*4)+(Z304*2) -> 12
A305: FRANKSTON | C305: KENNEDY | F305: JONES | I305: HUMPHREY | L305: SALA | N305: BELL | Q305: LANE | W305: BRUNSWICK | X305: 2 | Y305: 5 | Z305: 0 | AA305: 790 | AB305: 987 | AC305: =(AA305/AB305)*100 -> 80.040526849037491 | AD305: =(X305*4)+(Z305*2) -> 8
A306: PRESTON | C306: G ANDERSON | F306: HEARD | I306: WARREN | L306: MARCON | N306: GOUGH | Q306: BRINE | W306: GEELONG WEST | X306: 2 | Y306: 5 | Z306: 0 | AA306: 797 | AB306: 1057 | AC306: =(AA306/AB306)*100 -> 75.402081362346266 | AD306: =(X306*4)+(Z306*2) -> 8
A307: GOALKICKERS | W307: CAULFIELD | X307: 1 | Y307: 6 | Z307: 0 | AA307: 836 | AB307: 1056 | AC307: =(AA307/AB307)*100 -> 79.166666666666657 | AD307: =(X307*4)+(Z307*2) -> 4
A308: FRANKSTON | C308: SERAFINI 7 | F308: HOUSTON 4 | I308: MOULTON 3 | L308: SALA 2 | N308: JONES | P308: GEDDES | R308: LANE
A309: PRESTON | C309: MARCON 5 | F309: G L ANDERSON 5 | J309: LORENZINI 2 | M309: HALAS | O309: McGAW | Q309: VANN
A311: COBURG | C311: 3 | D311: 7 | E311: 25 | G311: 8 | H311: 10 | I311: 58 | K311: 16 | L311: 12 | M311: 108 | O311: 23 | P311: 18 | Q311: 156 | S311: VENUE: COBURG
A312: PORT MELBOURNE | C312: 6 | D312: 0 | E312: 36 | G312: 7 | H312: 2 | I312: 44 | K312: 8 | L312: 4 | M312: 52 | O312: 14 | P312: 7 | Q312: 91 | S312: BUDGE :FITZPATRICK
A313: BEST PLAYERS
A314: COBURG | C314: A HARBINSON | F314: DOUGLAS | I314: HERBERT | L314: CLEARY | N314: HARTIGAN | Q314: MILROY
A315: PORT MELBOURNE | C315: JOHN CHRISTOU | F315: JIM CHRISTOU | I315: SWAN | L315: DERMOTT
A316: GOALKICKERS
A317: COBURG | C317: HERBERT 5 | E317: SHELDON 4 | H317: SMITH 3 | J317: IRONMONGER 2 | M317: HALSALL 2 | P317: ALLISON 2 | R317: M HARBINSON 2 | W317: HARTIGAN | X317: CLEARY | AA317: MILROY
A318: PORT MELBOURNE | C318: JIM CHRISTOU 4 | F318: COOK 2 | H318: ANDERSON 2 | K318: JOHN CHRISTOU | N318: AANENSEN | Q318: BRICE | S318: EVANS | U318: O'RILEY | X318: KAVANAGH
A320: DANDENONG | C320: 2 | D320: 8 | E320: 20 | G320: 5 | H320: 12 | I320: 42 | K320: 12 | L320: 13 | M320: 85 | O320: 18 | P320: 16 | Q320: 124 | S320: VENUE: PRINCES PARK
A321: CAULFIELD | C321: 6 | D321: 5 | E321: 41 | G321: 12 | H321: 7 | I321: 79 | K321: 14 | L321: 12 | M321: 96 | O321: 15 | P321: 16 | Q321: 106 | S321: OGSTON :CROXFORD
A322: BEST PLAYERS
A323: DANDENONG | C323: ORTON | F323: MADDEN | I323: TONKS | K323: COVENTRY | N323: McCONNELL | Q323: CALLERY
A324: CAULFIELD | C324: RUSS | F324: LESTER | I324: ROWE | K324: RICHARDS
A325: GOALKICKERS
A326: DANDENONG | C326: ORTON 3 | E326: CALLERY 3 | H326: WOODMAN 2 | K326: COUSINS 2 | M326: WRIGHT 2 | O326: ROSS | P326: COVENTRY | R326: KNIGHT | U326: ALLISON | X326: MADDEN
A327: CAULFIELD | C327: DAVIDSON 3 | F327: J McDONALD 3 | I327: ROWE 3 | K327: O'DWYER | M327: BOOTH | O327: HOGAN | Q327: ADAMS | S327: AMBLER | W327: DUNCAN
A329: GEELONG WEST | C329: 8 | D329: 4 | E329: 52 | G329: 12 | H329: 8 | I329: 80 | K329: 15 | L329: 12 | M329: 102 | O329: 22 | P329: 18 | Q329: 150 | S329: VENUE: GEELONG WEST
A330: BRUNSWICK | C330: 2 | D330: 3 | E330: 15 | G330: 5 | H330: 7 | I330: 37 | K330: 14 | L330: 12 | M330: 96 | O330: 16 | P330: 19 | Q330: 115 | S330: COLISIMO :McBAIN
A331: BEST PLAYERS
A332: GEELONG WEST | C332: TORNEY | F332: POULTER | I332: EDDY | L332: ELLIS | N332: LYNCH | Q332: GILMOUR
A333: BRUNSWICK | C333: WEST | F333: CROTTY | I333: GUNSTON | L333: WILEY | N333: PARKER | Q333: BROWN
A334: GOALKICKERS
A335: GEELONG WEST | C335: BENTLEY 6 | F335: RADOJEVIC 4 | I335: GILMOUR 3 | L335: ELLIS 3 | N335: POULTER 2 | Q335: CANTWELL | T335: EDDY | W335: WILSON | X335: TORNEY
A336: BRUNSWICK | C336: GUNSTON 5 | F336: CROTTY 3 | I336: HICKMAN 2 | L336: RYAN 2 | N336: SAHLBERG | Q336: TOY | R336: JUDGE | T336: ANDERSON
A338: ROUND 8 | D338: 31ST MAY | I338: WEATHER | S338: PLAYED AT
D339: 1ST QTR | H339: 2ND QTR | L339: 3RD QTR | P339: FINAL | S339: PORT MELBOURNE
A340: PORT MELBOURNE | C340: 7 | D340: 4 | E340: 46 | G340: 11 | H340: 9 | I340: 75 | K340: 19 | L340: 13 | M340: 127 | O340: 27 | P340: 14 | Q340: 176 | S340: UMPIRES | X340: LADDER | AB340: ROUND | AD340: 8
A341: DANDENONG | C341: 7 | D341: 1 | E341: 43 | G341: 9 | H341: 3 | I341: 57 | K341: 14 | L341: 7 | M341: 91 | O341: 18 | P341: 10 | Q341: 118 | S341: STABB :OAKLEY
A342: BEST PLAYERS | W342: TEAM | X342: W | Y342: L | Z342: D | AA342: FOR | AB342: AGST | AC342: % | AD342: PTS
A343: PORT MELBOURNE | C343: O'RILEY | F343: DOYLE | I343: JOHN CHRISTOU | L343: SWAN | N343: AANENSEN | Q343: BRADBURY
A344: DANDENONG | C344: COVENTRY | F344: ORTON | I344: CALLERY | L344: TONKS | N344: TOWNSEND | Q344: BIFFEN | W344: PORT MELBOURNE | X344: 7 | Y344: 1 | Z344: 0 | AA344: 1307 | AB344: 783 | AC344: =(AA344/AB344)*100 -> 166.9220945083014 | AD344: =(X344*4)+(Z344*2) -> 28
A345: GOALKICKERS | M345: JIM CHRISTOU | P345: KAVANAGH | R345: EBEYER | W345: SANDRINGHAM | X345: 7 | Y345: 1 | Z345: 0 | AA345: 1024 | AB345: 799 | AC345: =(AA345/AB345)*100 -> 128.1602002503129 | AD345: =(X345*4)+(Z345*2) -> 28
A346: PORT MELBOURNE | C346: DAVIS 5 | E346: O'RILEY 4 | G346: EVANS 4 | I346: WILKINSON 3 | L346: ANDERSON 2 | N346: COOK 2 | P346: SWAN 2 | R346: AANENSEN 2 | W346: PRESTON | X346: 6 | Y346: 2 | Z346: 0 | AA346: 1216 | AB346: 886 | AC346: =(AA346/AB346)*100 -> 137.24604966139955 | AD346: =(X346*4)+(Z346*2) -> 24
A347: DANDENONG | C347: ORTON 4 | E347: CALLERY 3 | G347: TOWNSEND 2 | J347: WRIGHT 2 | L347: ROSS 2 | N347: WOODMAN | Q347: COVENTRY | S347: ALLISON | W347: COBURG | X347: 4 | Y347: 4 | Z347: 0 | AA347: 1035 | AB347: 917 | AC347: =(AA347/AB347)*100 -> 112.86804798255179 | AD347: =(X347*4)+(Z347*2) -> 16
M348: McCONNELL | P348: P KNIGHT | S348: VENUE: TOORAK PARK
A349: PRESTON | C349: 9 | D349: 4 | E349: 58 | G349: 11 | H349: 11 | I349: 77 | K349: 19 | L349: 17 | M349: 131 | O349: 28 | P349: 25 | Q349: 193 | S349: TORNEY | W349: FRANKSTON | X349: 4 | Y349: 4 | Z349: 0 | AA349: 849 | AB349: 991 | AC349: =(AA349/AB349)*100 -> 85.671039354187698 | AD349: =(X349*4)+(Z349*2) -> 16
A350: PRAHRAN | C350: 2 | D350: 3 | E350: 15 | G350: 7 | H350: 4 | I350: 46 | K350: 11 | L350: 7 | M350: 73 | O350: 15 | P350: 11 | Q350: 101 | S350: FITZPATRICK | W350: DANDENONG | X350: 3 | Y350: 5 | Z350: 0 | AA350: 949 | AB350: 1064 | AC350: =(AA350/AB350)*100 -> 89.191729323308266 | AD350: =(X350*4)+(Z350*2) -> 12
A351: BEST PLAYERS | W351: PRAHRAN | X351: 3 | Y351: 5 | Z351: 0 | AA351: 980 | AB351: 1208 | AC351: =(AA351/AB351)*100 -> 81.125827814569533 | AD351: =(X351*4)+(Z351*2) -> 12
A352: PRESTON | C352: BUX | F352: WARREN | I352: McGAW | L352: JESSOP | N352: MARCON | Q352: MARKS | W352: GEELONG WEST | X352: 3 | Y352: 5 | Z352: 0 | AA352: 901 | AB352: 1124 | AC352: =(AA352/AB352)*100 -> 80.160142348754448 | AD352: =(X352*4)+(Z352*2) -> 12
A353: PRAHRAN | C353: STONE | F353: NIDDRIE | I353: FOLEY | L353: MILLS | N353: McFAULL | W353: BRUNSWICK | X353: 2 | Y353: 6 | Z353: 0 | AA353: 889 | AB353: 1143 | AC353: =(AA353/AB353)*100 -> 77.777777777777786 | AD353: =(X353*4)+(Z353*2) -> 8
A354: GOALKICKERS | P354: McKEON | S354: MEESE | W354: CAULFIELD | X354: 1 | Y354: 7 | Z354: 0 | AA354: 936 | AB354: 1171 | AC354: =(AA354/AB354)*100 -> 79.931682322801024 | AD354: =(X354*4)+(Z354*2) -> 4
A355: PRESTON | C355: HALAS 5 | E355: JESSOP 5 | G355: MARKS 4 | I355: VANN 3 | K355: MARCON 3 | M355: ANDERSON 3 | P355: McEWAN | R355: BANKS
A356: PRAHRAN | C356: NIDDRIE 5 | F356: MILLS 4 | H356: STONE 3 | J356: DICKSON | L356: MAXWELL | N356: McDONALD
A358: COBURG | C358: 4 | D358: 7 | E358: 31 | G358: 11 | H358: 14 | I358: 80 | K358: 18 | L358: 16 | M358: 124 | O358: 23 | P358: 18 | Q358: 156 | S358: VENUE: COBURG
A359: BRUNSWICK | C359: 5 | D359: 1 | E359: 31 | G359: 8 | H359: 5 | I359: 53 | K359: 10 | L359: 7 | M359: 67 | O359: 15 | P359: 9 | Q359: 99 | S359: VERGONA :CROXFORD
A360: BEST PLAYERS
A361: COBURG | C361: HERBERT | F361: MILROY | I361: A HARBINSON | L361: SMITH | O361: BURT | Q361: PRETTO
A362: BRUNSWICK | C362: WEST | F362: NOLAN | I362: GUNSTON | L362: HICKMAN | O362: JUDGE | Q362: HODGE
A363: GOALKICKERS
A364: COBURG | C364: SMITH 8 | E364: M HARBINSON 6 | H364: ALLISON 3 | J364: HALSALL | L364: BURT | M364: HARTIGAN | P364: HERBERT | R364: SHELDON | U364: WOOD
A365: BRUNSWICK | C365: GUNSTON 4 | F365: SAHLBERG 3 | I365: RYAN 2 | K365: WEST | M365: KIMPTON | O365: LAKER | Q365: HICKMAN | S365: CROTTY | V365: HODGE
A367: GEELONG WEST | C367: 4 | D367: 2 | E367: 26 | G367: 8 | H367: 6 | I367: 54 | K367: 11 | L367: 7 | M367: 73 | O367: 15 | P367: 14 | Q367: 104 | S367: VENUE: GEELONG WEST
A368: FRANKSTON | C368: 2 | D368: 13 | E368: 25 | G368: 4 | H368: 13 | I368: 37 | K368: 7 | L368: 17 | M368: 59 | O368: 8 | P368: 19 | Q368: 67 | S368: CASEY :OGSTON
A369: BEST PLAYERS
A370: GEELONG WEST | C370: GILMOUR | F370: TAYLOR | I370: BENTLEY | L370: WILSON | N370: CRICHTON | Q370: ROBINSON
A371: FRANKSTON | C371: MIHOCEK | F371: JONES | I371: SALA | L371: GEDDES | N371: ENBOM | Q371: HORLER
A372: GOALKICKERS
A373: GEELONG WEST | C373: BENTLEY 4 | F373: CANTWELL 3 | I373: RADOJEVIC 3 | L373: TAYLOR 2 | N373: TODD 2 | P373: POULTER | R373: EDDY
A374: FRANKSTON | C374: SERAFINI 4 | F374: BOND | H374: MOULTON | J374: CZARNECKI | M374: LANE
D375: 7TH JUNE
A376: SANDRINGHAM | C376: 3 | D376: 5 | E376: 23 | G376: 6 | H376: 8 | I376: 44 | K376: 12 | L376: 13 | M376: 85 | O376: 16 | P376: 19 | Q376: 115 | S376: VENUE: BEACH ROAD
A377: CAULFIELD | C377: 2 | D377: 2 | E377: 14 | G377: 5 | H377: 11 | I377: 41 | K377: 9 | L377: 15 | M377: 69 | O377: 14 | P377: 16 | Q377: 100 | S377: VERGONA :GROOM
A378: BEST PLAYERS
A379: SANDRINGHAM | C379: SIMS | F379: SCOTT | I379: DROSCHER | L379: CHAPMAN | O379: MERCER | Q379: SARAU
A380: CAULFIELD | C380: LESTER | F380: RICHARDS | I380: BRASIER | L380: AMBLER | O380: MILNER | Q380: ROWE
A381: GOALKICKERS
A382: SANDRINGHAM | C382: HUNT 5 | E382: MAILING 2 | G382: MANNIX 2 | I382: HODGES | K382: ADAMS | M382: CARROLL | O382: GILMORE | Q382: SIMS | R382: WAY | T382: CHAPMAN
A383: CAULFIELD | C383: MILNER 4 | E383: ROWE 3 | G383: CROOK 2 | I383: BOOTH 2 | K383: DUNCAN | M383: RUSS | O383: BRUMMELLAN
A385: ROUND 9 | D385: 14TH JUNE | I385: WEATHER | S385: PLAYED AT
D386: 1ST QTR | H386: 2ND QTR | L386: 3RD QTR | P386: FINAL | S386: PRESTON
A387: PORT MELBOURNE | C387: 4 | D387: 4 | E387: 28 | G387: 12 | H387: 8 | I387: 80 | K387: 18 | L387: 9 | M387: 117 | O387: 18 | P387: 11 | Q387: 119 | S387: UMPIRES | X387: LADDER | AB387: ROUND | AD387: 9
A388: PRESTON | C388: 3 | D388: 4 | E388: 22 | G388: 6 | H388: 7 | I388: 43 | K388: 10 | L388: 10 | M388: 70 | O388: 15 | P388: 12 | Q388: 102 | S388: CASEY :OGSTON
A389: BEST PLAYERS | W389: TEAM | X389: W | Y389: L | Z389: D | AA389: FOR | AB389: AGST | AC389: % | AD389: PTS
A390: PORT MELBOURNE | C390: SWAN | F390: O'RILEY | I390: THOMPSON | L390: KAVANAGH | O390: ANDERSON | Q390: BRADBURY
A391: PRESTON | C391: McGAW | F391: MARKS | I391: TOWAN | L391: McKEON | O391: EATON | Q391: HEARD | W391: PORT MELBOURNE | X391: 8 | Y391: 1 | Z391: 0 | AA391: 1426 | AB391: 885 | AC391: =(AA391/AB391)*100 -> 161.12994350282486 | AD391: =(X391*4)+(Z391*2) -> 32
A392: GOALKICKERS | W392: SANDRINGHAM | X392: 8 | Y392: 1 | Z392: 0 | AA392: 1114 | AB392: 852 | AC392: =(AA392/AB392)*100 -> 130.75117370892019 | AD392: =(X392*4)+(Z392*2) -> 32
A393: PORT MELBOURNE | C393: ANDERSON 4 | F393: O'RILEY 4 | H393: COOK 3 | J393: EBEYER 3 | L393: WILKINSON 2 | O393: JIM CHRISTOU | R393: KAVANAGH | W393: PRESTON | X393: 6 | Y393: 3 | Z393: 0 | AA393: 1318 | AB393: 1005 | AC393: =(AA393/AB393)*100 -> 131.14427860696517 | AD393: =(X393*4)+(Z393*2) -> 24
A394: PRESTON | C394: HALAS 5 | E394: McGAW 4 | G394: VANN 2 | I394: JESSOP 2 | K394: MARKS | M394: BARTLETT | W394: COBURG | X394: 5 | Y394: 4 | Z394: 0 | AA394: 1142 | AB394: 1011 | AC394: =(AA394/AB394)*100 -> 112.9574678536103 | AD394: =(X394*4)+(Z394*2) -> 20
S395: VENUE: DANDENONG
A396: COBURG | C396: 5 | D396: 5 | E396: 35 | G396: 10 | H396: 8 | I396: 68 | K396: 12 | L396: 9 | M396: 81 | O396: 16 | P396: 11 | Q396: 107 | S396: GROOM | W396: PRAHRAN | X396: 4 | Y396: 5 | Z396: 0 | AA396: 1105 | AB396: 1284 | AC396: =(AA396/AB396)*100 -> 86.059190031152639 | AD396: =(X396*4)+(Z396*2) -> 16
A397: DANDENONG | C397: 5 | D397: 3 | E397: 33 | G397: 9 | H397: 5 | I397: 59 | K397: 14 | L397: 7 | M397: 91 | O397: 14 | P397: 10 | Q397: 94 | S397: STEERE | W397: FRANKSTON | X397: 4 | Y397: 5 | Z397: 0 | AA397: 946 | AB397: 1107 | AC397: =(AA397/AB397)*100 -> 85.456187895212281 | AD397: =(X397*4)+(Z397*2) -> 16
A398: BEST PLAYERS | W398: DANDENONG | X398: 3 | Y398: 6 | Z398: 0 | AA398: 1043 | AB398: 1171 | AC398: =(AA398/AB398)*100 -> 89.069171648163959 | AD398: =(X398*4)+(Z398*2) -> 12
A399: COBURG | C399: M HARBINSON | F399: HERBERT | I399: MILROY | L399: BURT | N399: CLEARY | Q399: PITT | W399: GEELONG WEST | X399: 3 | Y399: 6 | Z399: 0 | AA399: 977 | AB399: 1249 | AC399: =(AA399/AB399)*100 -> 78.222578062449955 | AD399: =(X399*4)+(Z399*2) -> 12
A400: DANDENONG | C400: ORTON | F400: ROSS | I400: CALLERY | L400: WRIGHT | N400: COVENTRY | Q400: BIFFIN | W400: CAULFIELD | X400: 2 | Y400: 7 | Z400: 0 | AA400: 1052 | AB400: 1268 | AC400: =(AA400/AB400)*100 -> 82.965299684542586 | AD400: =(X400*4)+(Z400*2) -> 8
A401: GOALKICKERS | W401: BRUNSWICK | X401: 2 | Y401: 7 | Z401: 0 | AA401: 942 | AB401: 1233 | AC401: =(AA401/AB401)*100 -> 76.399026763990264 | AD401: =(X401*4)+(Z401*2) -> 8
A402: COBURG | C402: M HARBINSON 6 | F402: SMITH 4 | H402: CLEARY 3 | J402: SHELDON | L402: McCARTHY | N402: ALLISON
A403: DANDENONG | C403: ORTON 3 | E403: HENWOOD 2 | H403: TOWNSEND 2 | K403: ROSS 2 | M403: COUSINS 2 | O403: WOODMAN | Q403: CALLERY | S403: MADDEN
A405: PRAHRAN | C405: 6 | D405: 5 | E405: 41 | G405: 10 | H405: 6 | I405: 66 | K405: 16 | L405: 9 | M405: 105 | O405: 19 | P405: 11 | Q405: 125 | S405: VENUE: TOORAK PARK
A406: GEELONG WEST | C406: 1 | D406: 5 | E406: 11 | G406: 7 | H406: 6 | I406: 48 | K406: 8 | L406: 10 | M406: 58 | O406: 10 | P406: 16 | Q406: 76 | S406: VERGONA :OAKLEY
A407: BEST PLAYERS
A408: PRAHRAN | C408: SMITH | F408: DICKSON | I408: McFAULL | L408: STONE | N408: McCORMACK | Q408: THORNE
A409: GEELONG WEST | C409: GILMOUR | F409: LYNCH | I409: TAYLOR | L409: BROWNE | N409: ROBERTSON | Q409: CRICHTON
A410: GOALKICKERS
A411: PRAHRAN | C411: SMITH 10 | E411: YOUNG 3 | G411: MILLS 2 | I411: CLARKE 2 | K411: DICKSON | M411: AUSTIN
A412: GEELONG WEST | C412: BENTLEY 2 | F412: TAYLOR 2 | I412: TORNEY 2 | K412: LYNCH | M412: GILMOUR | O412: ROBERTSON | R412: BROWNE
A414: CAULFIELD | C414: 4 | D414: 3 | E414: 27 | G414: 11 | H414: 6 | I414: 72 | K414: 12 | L414: 11 | M414: 83 | O414: 17 | P414: 14 | Q414: 116 | S414: VENUE: PRINCES PARK
A415: FRANKSTON | C415: 4 | D415: 5 | E415: 29 | G415: 8 | H415: 7 | I415: 55 | K415: 11 | L415: 11 | M415: 77 | O415: 14 | P415: 13 | Q415: 97 | S415: COLISIMO :TORNEY
A416: BEST PLAYERS
A417: CAULFIELD | C417: BRASIER | F417: RICHARDS | I417: O'DWYER | L417: DAVIDSON | N417: ROWE | Q417: O'LOUGHLIN
A418: FRANKSTON | C418: LANE | F418: JONES | I418: HUMPHREY | L418: CASEY | N418: MIHOCEK | Q418: BELL
A419: GOALKICKERS
A420: CAULFIELD | C420: ROWE 4 | E420: DAVIDSON 3 | H420: O'LOUGHLIN 3 | K420: MILNER 2 | M420: CROOK 2 | O420: GIULLERI | Q420: BOOTH | S420: DUNCAN
A421: FRANKSTON | C421: SERAFINI 3 | F421: JONES 2 | H421: BELL 2 | J421: MOULTON | M421: KENNEDY | O421: SALA | P421: EMBOM | R421: HORLER | U421: LANE | W421: HOUSTON
A423: SANDRINGHAM | C423: 3 | D423: 3 | E423: 21 | G423: 8 | H423: 11 | I423: 59 | K423: 10 | L423: 13 | M423: 73 | O423: 12 | P423: 18 | Q423: 90 | S423: VENUE: BRUNSWICK
A424: BRUNSWICK | C424: 2 | D424: 5 | E424: 17 | G424: 2 | H424: 6 | I424: 18 | K424: 5 | L424: 10 | M424: 40 | O424: 7 | P424: 11 | Q424: 53 | S424: STABB :FITZPATRICK
A425: BEST PLAYERS
A426: SANDRINGHAM | C426: SARAU | F426: O'BRIEN | I426: WILKINS | L426: MANNIX | N426: HUNT
A427: BRUNSWICK | C427: WEST | F427: GUNSTON | I427: CALLANDER | L427: NOLAN | N427: LEAHY | P427: HICKMAN
A428: GOALKICKERS
A429: SANDRINGHAM | C429: HUNT 4 | F429: MAILING 2 | I429: MANNIX 2 | K429: WAY 2 | M429: O'BRIEN | O429: HAYES
A430: BRUNSWICK | C430: GUNSTON 3 | F430: JUDGE | H430: CALLANDER | K430: HICKMAN | M430: DEANS
A432: ROUND 10 | D432: 21ST JUNE | I432: WEATHER | S432: PLAYED AT
D433: 1ST QTR | H433: 2ND QTR | L433: 3RD QTR | P433: FINAL | S433: BEACH ROAD
A434: PORT MELBOURNE | C434: 7 | D434: 4 | E434: 46 | G434: 19 | H434: 12 | I434: 126 | K434: 24 | L434: 15 | M434: 159 | O434: 32 | P434: 22 | Q434: 214 | S434: UMPIRES | X434: LADDER | AB434: ROUND | AD434: 10
A435: SANDRINGHAM | C435: 7 | D435: 0 | E435: 42 | G435: 9 | H435: 0 | I435: 54 | K435: 13 | L435: 3 | M435: 81 | O435: 20 | P435: 5 | Q435: 125 | S435: TORNEY :OAKLEY
A436: BEST PLAYERS | W436: TEAM | X436: W | Y436: L | Z436: D | AA436: FOR | AB436: AGST | AC436: % | AD436: PTS
A437: PORT MELBOURNE | C437: SWAN | E437: O'RILEY | G437: THOMPSON | J437: AANENSEN | M437: KAVANAGH | P437: JOHN CHRISTOU
A438: SANDRINGHAM | C438: SIMS | E438: WAY | G438: HUNT | I438: ADAMS | W438: PORT MELBOURNE | X438: 9 | Y438: 1 | Z438: 0 | AA438: 1640 | AB438: 1010 | AC438: =(AA438/AB438)*100 -> 162.37623762376239 | AD438: =(X438*4)+(Z438*2) -> 36
A439: GOALKICKERS | Q439: BRICE | W439: SANDRINGHAM | X439: 8 | Y439: 2 | Z439: 0 | AA439: 1239 | AB439: 1066 | AC439: =(AA439/AB439)*100 -> 116.22889305816135 | AD439: =(X439*4)+(Z439*2) -> 32
A440: PORT MELBOURNE | C440: COOK 8 | E440: O'RILEY 7 | G440: KAVANAGH 5 | J440: SWAN 3 | L440: ANDERSON 3 | O440: JIM CHRISTOU 3 | R440: EVANS 2 | W440: PRESTON | X440: 7 | Y440: 3 | Z440: 0 | AA440: 1492 | AB440: 1090 | AC440: =(AA440/AB440)*100 -> 136.88073394495413 | AD440: =(X440*4)+(Z440*2) -> 28
A441: SANDRINGHAM | C441: HUNT 7 | E441: MAILING 2 | G441: ADAMS 2 | I441: BELL 2 | K441: WAY 2 | M441: CHAPMAN 2 | O441: O'BRIEN | Q441: BEUS | S441: HAYES | W441: COBURG | X441: 5 | Y441: 5 | Z441: 0 | AA441: 1247 | AB441: 1126 | AC441: =(AA441/AB441)*100 -> 110.74600355239788 | AD441: =(X441*4)+(Z441*2) -> 20
S442: VENUE: FRANKSTON
A443: FRANKSTON | C443: 5 | D443: 5 | E443: 35 | G443: 12 | H443: 9 | I443: 81 | K443: 19 | L443: 16 | M443: 130 | O443: 25 | P443: 21 | Q443: 171 | S443: OGSTON | W443: FRANKSTON | X443: 5 | Y443: 5 | Z443: 0 | AA443: 1117 | AB443: 1195 | AC443: =(AA443/AB443)*100 -> 93.472803347280333 | AD443: =(X443*4)+(Z443*2) -> 20
A444: PRAHRAN | C444: 1 | D444: 2 | E444: 8 | G444: 7 | H444: 7 | I444: 49 | K444: 8 | L444: 13 | M444: 61 | O444: 12 | P444: 16 | Q444: 88 | S444: WILSON | W444: DANDENONG | X444: 4 | Y444: 6 | Z444: 0 | AA444: 1129 | AB444: 1254 | AC444: =(AA444/AB444)*100 -> 90.03189792663477 | AD444: =(X444*4)+(Z444*2) -> 16
A445: BEST PLAYERS | W445: PRAHRAN | X445: 4 | Y445: 6 | Z445: 0 | AA445: 1193 | AB445: 1455 | AC445: =(AA445/AB445)*100 -> 81.993127147766316 | AD445: =(X445*4)+(Z445*2) -> 16
A446: FRANKSTON | C446: JONES | F446: HOUSDEN | I446: BEATON | L446: CZARNECKI | O446: BOYD | Q446: CASEY | W446: GEELONG WEST | X446: 4 | Y446: 6 | Z446: 0 | AA446: 1092 | AB446: 1354 | AC446: =(AA446/AB446)*100 -> 80.649926144756279 | AD446: =(X446*4)+(Z446*2) -> 16
A447: PRAHRAN | C447: STONE | F447: McFAULL | I447: MAXWELL | L447: DICKSON | W447: CAULFIELD | X447: 2 | Y447: 8 | Z447: 0 | AA447: 1167 | AB447: 1383 | AC447: =(AA447/AB447)*100 -> 84.381778741865503 | AD447: =(X447*4)+(Z447*2) -> 8
A448: GOALKICKERS | R448: HAMILL | W448: BRUNSWICK | X448: 2 | Y448: 8 | Z448: 0 | AA448: 1025 | AB448: 1319 | AC448: =(AA448/AB448)*100 -> 77.710386656558001 | AD448: =(X448*4)+(Z448*2) -> 8
A449: FRANKSTON | C449: SERAFINI 6 | F449: MOULTON 5 | I449: JONES 3 | K449: BOYD 3 | M449: BEATON 2 | O449: SALA 2 | Q449: BELL 2 | S449: CZARNECKI
A450: PRAHRAN | C450: SMITH 6 | F450: MAXWELL 3 | I450: MILLS | K450: CHAPMAN | M450: McCORMACK
A452: GEELONG WEST | C452: 3 | D452: 2 | E452: 20 | G452: 8 | H452: 5 | I452: 53 | K452: 13 | L452: 11 | M452: 89 | O452: 17 | P452: 13 | Q452: 115 | S452: VENUE: GEELONG WEST
A453: COBURG | C453: 3 | D453: 5 | E453: 23 | G453: 8 | H453: 10 | I453: 58 | K453: 10 | L453: 12 | M453: 72 | O453: 15 | P453: 15 | Q453: 105 | S453: STABB :FITZPATRICK
A454: BEST PLAYERS
A455: GEELONG WEST | C455: LYNCH | F455: EDDY | I455: RADOJEVIC | L455: BURNETT | O455: POULTER | Q455: YATES
A456: COBURG | C456: HERBERT | F456: FITZGERALD | I456: HALSALL | L456: BURT | O456: LAIDLER
A457: GOALKICKERS
A458: GEELONG WEST | C458: RADOJEVIC 8 | F458: LYNCH 2 | H458: TAYLOR 2 | J458: EDDY 2 | L458: YATES | N458: FOOTT | P458: GILMOUR
A459: COBURG | C459: LAIDLER 5 | F459: SHELDON 3 | I459: PRNBERTHY 3 | L459: HALSALL | N459: HERBERT | P459: CLEARY | R459: M HARBINSON
A461: DANDENONG | C461: 3 | D461: 1 | E461: 19 | G461: 6 | H461: 5 | I461: 41 | K461: 10 | L461: 8 | M461: 68 | O461: 12 | P461: 14 | Q461: 86 | S461: VENUE: BRUNSWICK
A462: BRUNSWICK | C462: 3 | D462: 6 | E462: 24 | G462: 4 | H462: 11 | I462: 35 | K462: 7 | L462: 13 | M462: 55 | O462: 12 | P462: 11 | Q462: 83 | S462: BLOOM :COLISIMO
A463: BEST PLAYERS
A464: DANDENONG | C464: WOODMAN | F464: WALLACE | I464: MADDEN | L464: CALLAERY | O464: CARROLL | Q464: COUSINS
A465: BRUNSWICK | C465: HUGGARD | F465: CALLANDER | I465: RYAN | L465: NOLAN | O465: JUDGE | Q465: CROTTY
A466: GOALKICKERS
A467: DANDENONG | C467: CARROLL 3 | F467: ORTON 3 | H467: WOODMAN 2 | K467: CROWLEY 2 | N467: HENWOOD | Q467: OSBORNE
A468: BRUNSWICK | C468: RYAN 5 | F468: GUNSTON 2 | I468: CROTTY 2 | K468: SAHLBERG 2 | N468: JUDGE
A470: PRESTON | C470: 4 | D470: 6 | E470: 30 | G470: 10 | H470: 13 | I470: 73 | K470: 14 | L470: 23 | M470: 107 | O470: 24 | P470: 30 | Q470: 174 | S470: VENUE: PRINCES PARK
A471: CAULFIELD | C471: 3 | D471: 4 | E471: 22 | G471: 6 | H471: 11 | I471: 47 | K471: 8 | L471: 13 | M471: 61 | O471: 12 | P471: 13 | Q471: 85 | S471: GROOM :STEERE
A472: BEST PLAYERS
A473: PRESTON | C473: BRINE | F473: BOLGER | I473: TOWAN | K473: WARREN | N473: McKEON | Q473: COOPER
A474: CAULFIELD | C474: O'DWYER | F474: ROWE | I474: AMBLER
A475: GOALKICKERS
A476: PRESTON | C476: HALAS 5 | E476: MARCON 4 | H476: McGAW 3 | J476: VANN 3 | L476: WHITE 3 | N476: MOORE 2 | P476: BRINE 2 | R476: COOPER | U476: PREECE
A477: CAULFIELD | C477: ROWE 4 | F477: MILNER 3 | I477: STEWART 3 | L477: CROOK | N477: DUNCAN
A479: ROUND 11 | D479: 28TH JUNE | I479: WEATHER | S479: PLAYED AT
D480: 1ST QTR | H480: 2ND QTR | L480: 3RD QTR | P480: FINAL | S480: COBURG
A481: COBURG | C481: 5 | D481: 0 | E481: 30 | G481: 12 | H481: 3 | I481: 75 | K481: 14 | L481: 5 | M481: 89 | O481: 19 | P481: 7 | Q481: 121 | S481: UMPIRES | X481: LADDER | AB481: ROUND | AD481: 11
A482: SANDRINGHAM | C482: 1 | D482: 5 | E482: 11 | G482: 4 | H482: 7 | I482: 31 | K482: 7 | L482: 10 | M482: 52 | O482: 8 | P482: 12 | Q482: 60 | S482: OGSTON :CASEY
A483: BEST PLAYERS | W483: TEAM | X483: W | Y483: L | Z483: D | AA483: FOR | AB483: AGST | AC483: % | AD483: PTS
A484: COBURG | C484: FITZGERALD | F484: MILROY | I484: BURT | K484: PRETTO | N484: HERBERT | Q484: DOUGLAS
A485: SANDRINGHAM | C485: HODGES | F485: GILMORE | I485: OSBORNE | W485: PORT MELBOURNE | X485: 10 | Y485: 1 | Z485: 0 | AA485: 1797 | AB485: 1139 | AC485: =(AA485/AB485)*100 -> 157.76997366110623 | AD485: =(X485*4)+(Z485*2) -> 40
A486: GOALKICKERS | W486: PRESTON | X486: 8 | Y486: 3 | Z486: 0 | AA486: 1656 | AB486: 1160 | AC486: =(AA486/AB486)*100 -> 142.75862068965517 | AD486: =(X486*4)+(Z486*2) -> 32
A487: COBURG | C487: DOUGLAS 4 | F487: ALLISON 4 | I487: LAIDLER 4 | K487: M HARBINSON 3 | N487: MILROY 2 | P487: HERBERT | R487: A HARBINSON | W487: SANDRINGHAM | X487: 8 | Y487: 3 | Z487: 0 | AA487: 1299 | AB487: 1187 | AC487: =(AA487/AB487)*100 -> 109.43555181128897 | AD487: =(X487*4)+(Z487*2) -> 32
A488: SANDRINGHAM | C488: HUNT 3 | F488: ADAMS 2 | I488: WAY | K488: BEUS | M488: HAYES | W488: COBURG | X488: 6 | Y488: 5 | Z488: 0 | AA488: 1368 | AB488: 1186 | AC488: =(AA488/AB488)*100 -> 115.34569983136593 | AD488: =(X488*4)+(Z488*2) -> 24
S489: VENUE: PORT MELBOURNE
A490: PORT MELBOURNE | C490: 4 | D490: 6 | E490: 30 | G490: 8 | H490: 9 | I490: 57 | K490: 16 | L490: 16 | M490: 112 | O490: 23 | P490: 19 | Q490: 157 | S490: GROOM | W490: DANDENONG | X490: 5 | Y490: 6 | Z490: 0 | AA490: 1258 | AB490: 1350 | AC490: =(AA490/AB490)*100 -> 93.185185185185176 | AD490: =(X490*4)+(Z490*2) -> 20
A491: FRANKSTON | C491: 2 | D491: 3 | E491: 15 | G491: 9 | H491: 10 | I491: 64 | K491: 13 | L491: 14 | M491: 92 | O491: 19 | P491: 15 | Q491: 129 | S491: STABB | W491: FRANKSTON | X491: 5 | Y491: 6 | Z491: 0 | AA491: 1246 | AB491: 1352 | AC491: =(AA491/AB491)*100 -> 92.15976331360946 | AD491: =(X491*4)+(Z491*2) -> 20
A492: BEST PLAYERS | W492: PRAHRAN | X492: 5 | Y492: 6 | Z492: 0 | AA492: 1345 | AB492: 1529 | AC492: =(AA492/AB492)*100 -> 87.965990843688687 | AD492: =(X492*4)+(Z492*2) -> 20
A493: PORT MELBOURNE | C493: AANENSEN | F493: SWAN | I493: JIM CHRISTOU | L493: ANDERSON | O493: O'RILEY | R493: DAVIS | W493: GEELONG WEST | X493: 4 | Y493: 7 | Z493: 0 | AA493: 1188 | AB493: 1483 | AC493: =(AA493/AB493)*100 -> 80.107889413351316 | AD493: =(X493*4)+(Z493*2) -> 16
A494: FRANKSTON | C494: CZARNECKI | F494: JONES | I494: SERAFINI | L494: BEATON | O494: HUMPHREY | W494: CAULFIELD | X494: 2 | Y494: 9 | Z494: 0 | AA494: 1241 | AB494: 1535 | AC494: =(AA494/AB494)*100 -> 80.846905537459278 | AD494: =(X494*4)+(Z494*2) -> 8
A495: GOALKICKERS | W495: BRUNSWICK | X495: 2 | Y495: 9 | Z495: 0 | AA495: 1095 | AB495: 1483 | AC495: =(AA495/AB495)*100 -> 73.836817262306127 | AD495: =(X495*4)+(Z495*2) -> 8
A496: PORT MELBOURNE | C496: JIM CHRISTOU 6 | F496: COOK 5 | H496: O'RILEY 3 | J496: ANDERSON 3 | M496: DAVIS 2 | O496: BRICE | Q496: EBEYER | S496: SWAN | U496: EVANS
A497: FRANKSTON | C497: SERAFINI 9 | F497: JONES 2 | H497: BELL 2 | J497: MOULTON | M497: BEATON | O497: GEDDES | Q497: ENBOM | S497: CZARNECKI | W497: BOYD
A499: DANDENONG | C499: 7 | D499: 10 | E499: 52 | G499: 9 | H499: 12 | I499: 66 | K499: 14 | L499: 18 | M499: 102 | O499: 18 | P499: 21 | Q499: 129 | S499: VENUE: DANDENONG
A500: GEELONG WEST | C500: 1 | D500: 0 | E500: 6 | G500: 9 | H500: 4 | I500: 58 | K500: 12 | L500: 4 | M500: 76 | O500: 15 | P500: 6 | Q500: 96 | S500: VERGONA :TORNEY
A501: BEST PLAYERS
A502: DANDENONG | C502: WOODMAN | F502: COVENTRY | I502: WALLACE | L502: CALLERY | O502: TOWNSEND | R502: ORTON
A503: GEELONG WEST | C503: GILMOUR | F503: FOOTT | I503: BENTLEY | L503: TORNEY
A504: GOALKICKERS
A505: DANDENONG | C505: ORTON 4 | E505: CALLERY 3 | H505: ROSS 3 | J505: MADDEN | L505: CARROLL | N505: HENWOOD | Q505: CROWLEY | S505: COVENTRY | V505: WALLACE
A506: GEELONG WEST | C506: RADOJEVIC 5 | F506: BENTLEY 3 | I506: LYNCH 2 | K506: GILMOUR 2 | M506: TODD | O506: CRICHTON | Q506: BURNETT
A508: PRAHRAN | C508: 6 | D508: 3 | E508: 39 | G508: 12 | H508: 4 | I508: 76 | K508: 19 | L508: 7 | M508: 121 | O508: 24 | P508: 8 | Q508: 152 | S508: VENUE: TOORAK PARK
A509: CAULFIELD | C509: 2 | D509: 1 | E509: 13 | G509: 3 | H509: 9 | I509: 27 | K509: 5 | L509: 9 | M509: 39 | O509: 10 | P509: 14 | Q509: 74 | S509: CROXFORD :RYAN
A510: BEST PLAYERS
A511: PRAHRAN | C511: THORNE | F511: DICKSON | I511: CLARKE | L511: TWOMEY | O511: AUSTIN | Q511: McCORMACK
A512: CAULFIELD | C512: O'DWYER | F512: RICHARDS | I512: LESTER | L512: STEWART
A513: GOALKICKERS
A514: PRAHRAN | C514: SMITH 4 | E514: THORNE 4 | G514: STONE 3 | I514: MILLS 2 | K514: CLARKE 2 | M514: AUSTIN 2 | O514: TWOMEY 2 | Q514: REED 2 | S514: S YOUNG | V514: McCORMACK | X514: ELLETT
A515: CAULFIELD | C515: O'LOUGHLIN 4 | F515: GIULLERI | H515: STEWART | J515: ROWE | L515: MILNER | N515: MITCHELL | Q515: AMBLER
A517: PRESTON | C517: 5 | D517: 9 | E517: 39 | G517: 10 | H517: 14 | I517: 74 | K517: 22 | L517: 20 | M517: 152 | O517: 23 | P517: 26 | Q517: 164 | S517: VENUE: PRESTON
A518: BRUNSWICK | C518: 3 | D518: 1 | E518: 19 | G518: 5 | H518: 5 | I518: 35 | K518: 6 | L518: 6 | M518: 42 | O518: 10 | P518: 10 | Q518: 70 | S518: OAKLEY :GRIFFITH
A519: BEST PLAYERS
A520: PRESTON | C520: BUX | F520: VANN | I520: BOLGER | L520: HEARD | O520: McGAW | Q520: TOWAN
A521: BRUNSWICK | C521: NOLAN | F521: CUBETTA | I521: GUNSTON | L521: CHANDLER | O521: WEST | Q521: DEANS
A522: GOALKICKERS
A523: PRESTON | C523: VANN 6 | E523: McGAW 3 | G523: HALAS 3 | I523: BODEN 3 | K523: BRAMLEY 2 | M523: McKEON 2 | O523: GOUGH 2 | Q523: MOORE | S523: WHITE
A524: BRUNSWICK | C524: GUNSTON 3 | F524: RYAN 2 | H524: CUBETTA | J524: CALLANDER | M524: DEANS | O524: TOY | Q524: JUDGE
A526: ROUND 12 | D526: 5TH JULY | I526: WEATHER | S526: PLAYED AT
D527: 1ST QTR | H527: 2ND QTR | L527: 3RD QTR | P527: FINAL | S527: DANDENONG
A528: DANDENONG | C528: 0 | D528: 2 | E528: 2 | G528: 3 | H528: 8 | I528: 26 | K528: 7 | L528: 11 | M528: 53 | O528: 12 | P528: 14 | Q528: 86 | S528: UMPIRES | X528: LADDER | AB528: ROUND | AD528: 12
A529: PRESTON | C529: 4 | D529: 3 | E529: 27 | G529: 6 | H529: 3 | I529: 39 | K529: 9 | L529: 7 | M529: 61 | O529: 9 | P529: 9 | Q529: 63 | S529: WILSON :CROXFORD
A530: BEST PLAYERS | W530: TEAM | X530: W | Y530: L | Z530: D | AA530: FOR | AB530: AGST | AC530: % | AD530: PTS
A531: DANDENONG | C531: WOODMAN | F531: TOWNSEND | I531: ORSBORNE | L531: COUSINS | O531: CARROLL | R531: WALLACE
A532: PRESTON | C532: TOWAN | F532: BUX | I532: WARREN | L532: BOLGER | O532: McGAW | W532: PORT MELBOURNE | X532: 11 | Y532: 1 | Z532: 0 | AA532: 1975 | AB532: 1239 | AC532: =(AA532/AB532)*100 -> 159.40274414850686 | AD532: =(X532*4)+(Z532*2) -> 44
A533: GOALKICKERS | W533: PRESTON | X533: 8 | Y533: 4 | Z533: 0 | AA533: 1719 | AB533: 1246 | AC533: =(AA533/AB533)*100 -> 137.96147672552166 | AD533: =(X533*4)+(Z533*2) -> 32
A534: DANDENONG | C534: WOODMAN 2 | F534: WALLACE 2 | I534: COVENTRY 2 | L534: ORTON 2 | N534: ALLISON 2 | Q534: ORSBORNE | W534: SANDRINGHAM | X534: 8 | Y534: 4 | Z534: 0 | AA534: 1352 | AB534: 1258 | AC534: =(AA534/AB534)*100 -> 107.47217806041336 | AD534: =(X534*4)+(Z534*2) -> 32
A535: PRESTON | C535: HALAS 3 | F535: VANN 2 | H535: BODEN 2 | J535: McGAW | L535: WHITE | W535: COBURG | X535: 6 | Y535: 6 | Z535: 0 | AA535: 1481 | AB535: 1306 | AC535: =(AA535/AB535)*100 -> 113.39969372128638 | AD535: =(X535*4)+(Z535*2) -> 24
S536: VENUE: GEELONG WEST
A537: GEELONG WEST | C537: 5 | D537: 2 | E537: 32 | G537: 8 | H537: 4 | I537: 52 | K537: 8 | L537: 8 | M537: 56 | O537: 10 | P537: 11 | Q537: 71 | S537: GROOM | W537: DANDENONG | X537: 6 | Y537: 6 | Z537: 0 | AA537: 1344 | AB537: 1413 | AC537: =(AA537/AB537)*100 -> 95.116772823779201 | AD537: =(X537*4)+(Z537*2) -> 24
A538: SANDRINGHAM | C538: 2 | D538: 3 | E538: 15 | G538: 4 | H538: 5 | I538: 29 | K538: 5 | L538: 10 | M538: 40 | O538: 7 | P538: 11 | Q538: 53 | S538: FITZPATRICK | W538: FRANKSTON | X538: 6 | Y538: 6 | Z538: 0 | AA538: 1366 | AB538: 1465 | AC538: =(AA538/AB538)*100 -> 93.242320819112621 | AD538: =(X538*4)+(Z538*2) -> 24
A539: BEST PLAYERS | W539: PRAHRAN | X539: 5 | Y539: 7 | Z539: 0 | AA539: 1396 | AB539: 1588 | AC539: =(AA539/AB539)*100 -> 87.909319899244338 | AD539: =(X539*4)+(Z539*2) -> 20
A540: GEELONG WEST | C540: BROWNE | F540: TORNEY | I540: BEATON | L540: FOOTT | O540: EDDY | R540: ROBINSON | W540: GEELONG WEST | X540: 5 | Y540: 7 | Z540: 0 | AA540: 1259 | AB540: 1536 | AC540: =(AA540/AB540)*100 -> 81.966145833333343 | AD540: =(X540*4)+(Z540*2) -> 20
A541: SANDRINGHAM | C541: HUNT | F541: SCOTT | I541: PLEDGER | L541: HODGES | O541: MERCER | R541: MULLER | W541: BRUNSWICK | X541: 3 | Y541: 9 | Z541: 0 | AA541: 1154 | AB541: 1534 | AC541: =(AA541/AB541)*100 -> 75.228161668839633 | AD541: =(X541*4)+(Z541*2) -> 12
A542: GOALKICKERS | W542: CAULFIELD | X542: 2 | Y542: 10 | Z542: 0 | AA542: 1341 | AB542: 1713 | AC542: =(AA542/AB542)*100 -> 78.283712784588445 | AD542: =(X542*4)+(Z542*2) -> 8
A543: GEELONG WEST | C543: RADOJEVIC 4 | F543: YATES 3 | H543: BENTLEY | J543: CANTWELL | M543: TODD
A544: SANDRINGHAM | C544: HUNT 6 | F544: PLEDGER
D545: 12TH JULY
A546: FRANKSTON | C546: 2 | D546: 3 | E546: 15 | G546: 10 | H546: 6 | I546: 66 | K546: 14 | L546: 6 | M546: 90 | O546: 18 | P546: 12 | Q546: 120 | S546: VENUE: FRANKSTON
A547: COBURG | C547: 6 | D547: 3 | E547: 39 | G547: 11 | H547: 4 | I547: 70 | K547: 15 | L547: 9 | M547: 99 | O547: 17 | P547: 11 | Q547: 113 | S547: TORNEY :FITZPATRICK
A548: BEST PLAYERS
A549: FRANKSTON | C549: HUMPHREY | F549: CZARNECKI | I549: JONES | L549: BELL | O549: LYNN | Q549: HOUSDEN
A550: COBURG | C550: MILROY | F550: BURT | I550: HALSALL | L550: ALLISON
A551: GOALKICKERS
A552: FRANKSTON | C552: SERAFINI 7 | F552: BEATON 2 | I552: CZARNECKI 2 | L552: BOYD 2 | N552: JONES | P552: MOULTON | R552: GEDDES | U552: BELL | W552: GRIMBLATT
A553: COBURG | C553: ALLISON 5 | F553: CLEARY 3 | I553: HERBERT 2 | L553: GIBB 2 | N553: HALSALL | P553: DOHNT | R553: SMITH | U553: BURT | W553: PRETTO
A555: BRUNSWICK | C555: 3 | D555: 1 | E555: 19 | G555: 4 | H555: 3 | I555: 27 | K555: 5 | L555: 9 | M555: 39 | O555: 8 | P555: 11 | Q555: 59 | S555: VENUE: BRUNSWICK
A556: PRAHRAN | C556: 2 | D556: 4 | E556: 16 | G556: 3 | H556: 10 | I556: 28 | K556: 3 | L556: 11 | M556: 29 | O556: 6 | P556: 15 | Q556: 51 | S556: STABB :VERGONA
A557: BEST PLAYERS
A558: BRUNSWICK | C558: WEST | F558: HUGGARD | I558: LEAHY | L558: DEANS | N558: HICKMAN | Q558: GUNSTON
A559: PRAHRAN | C559: DICKSON | F559: McCORMACK | I559: THORNE | L559: HINE | N559: STONE
A560: GOALKICKERS
A561: BRUNSWICK | C561: LEAHY 3 | F561: GUNSTON 2 | I561: CROTTY | K561: SAHLBERG | N561: JUDGE
A562: PRAHRAN | C562: SMITH 2 | F562: CLARKE 2 | I562: MILLS | K562: STONE
A564: PORT MELBOURNE | C564: 5 | D564: 2 | E564: 32 | G564: 15 | H564: 9 | I564: 99 | K564: 20 | L564: 11 | M564: 131 | O564: 27 | P564: 16 | Q564: 178 | S564: VENUE: PRINCES PARK
A565: CAULFIELD | C565: 4 | D565: 9 | E565: 33 | G565: 5 | H565: 9 | I565: 39 | K565: 12 | L565: 11 | M565: 83 | O565: 14 | P565: 16 | Q565: 100 | S565: BLOOM :WILSON
A566: BEST PLAYERS
A567: PORT MELBOURNE | C567: KAVANAGH | F567: AANENSEN | I567: ANDERSON | L567: DERMOTT | O567: O'RILEY | R567: SWAN
A568: CAULFIELD | C568: AMBLER | F568: LESTER | I568: D COONEY
A569: GOALKICKERS
A570: PORT MELBOURNE | C570: COOK 7 | E570: ANDERSON 6 | H570: O'RILEY 4 | J570: KAVANAGH 3 | M570: EVANS 2 | O570: EBEYER | Q570: JOHNSON | S570: DERMOTT | W570: JIM CHRISTOU | X570: DAVIS
A571: CAULFIELD | C571: D COONEY 3 | F571: MITCHELL 3 | I571: O'LOUGHLIN 2 | L571: MILNER 2 | N571: ROWE | P571: BOOTH | R571: AMBLER | U571: LESTER
A573: ROUND 13 | D573: 19TH JULY | I573: WEATHER | S573: VENUE: BEACH ROAD
D574: 1ST QTR | H574: 2ND QTR | L574: 3RD QTR | P574: FINAL | S574: UMPIRES
A575: SANDRINGHAM | C575: 2 | D575: 3 | E575: 15 | G575: 9 | H575: 9 | I575: 63 | K575: 15 | L575: 14 | M575: 104 | O575: 21 | P575: 20 | Q575: 146 | S575: OAKLEY :CROXFORD | X575: LADDER | AB575: ROUND | AD575: 13
A576: FRANKSTON | C576: 2 | D576: 5 | E576: 17 | G576: 2 | H576: 5 | I576: 17 | K576: 4 | L576: 8 | M576: 32 | O576: 5 | P576: 11 | Q576: 41
A577: BEST PLAYERS | W577: TEAM | X577: W | Y577: L | Z577: D | AA577: FOR | AB577: AGST | AC577: % | AD577: PTS
A578: SANDRINGHAM | C578: PLEDGER | F578: OSBORNE | I578: CALLERY | L578: SCOTT | N578: WAY | Q578: MULLER
A579: FRANKSTON | C579: CASEY | F579: HOUSDEN | I579: KENTER | L579: LYNN | N579: CZARNECKI | Q579: BEATON | W579: PORT MELBOURNE | X579: 12 | Y579: 1 | Z579: 0 | AA579: 2250 | AB579: 1327 | AC579: =(AA579/AB579)*100 -> 169.55538809344387 | AD579: =(X579*4)+(Z579*2) -> 48
A580: GOALKICKERS | W580: PRESTON | X580: 9 | Y580: 4 | Z580: 0 | AA580: 1883 | AB580: 1343 | AC580: =(AA580/AB580)*100 -> 140.20848845867462 | AD580: =(X580*4)+(Z580*2) -> 36
A581: SANDRINGHAM | C581: HUNT 5 | E581: PLEDGER 3 | G581: MACLEOD 3 | J581: WAY 3 | L581: CALLERY 3 | O581: BEUS 2 | Q581: MANNIX | S581: SIMS | W581: SANDRINGHAM | X581: 9 | Y581: 4 | Z581: 0 | AA581: 1498 | AB581: 1299 | AC581: =(AA581/AB581)*100 -> 115.31947652040031 | AD581: =(X581*4)+(Z581*2) -> 36
A582: FRANKSTON | C582: SERAFINI 2 | F582: MIHOCEK | I582: JONES | K582: BOYD | W582: COBURG | X582: 7 | Y582: 6 | Z582: 0 | AA582: 1628 | AB582: 1436 | AC582: =(AA582/AB582)*100 -> 113.37047353760445 | AD582: =(X582*4)+(Z582*2) -> 28
S583: VENUE: TOORAK PARK
A584: PRAHRAN | C584: 5 | D584: 2 | E584: 32 | G584: 9 | H584: 7 | I584: 61 | K584: 14 | L584: 9 | M584: 93 | O584: 16 | P584: 16 | Q584: 112 | S584: GROOM | W584: DANDENONG | X584: 6 | Y584: 7 | Z584: 0 | AA584: 1444 | AB584: 1525 | AC584: =(AA584/AB584)*100 -> 94.688524590163937 | AD584: =(X584*4)+(Z584*2) -> 24
A585: DANDENONG | C585: 4 | D585: 3 | E585: 27 | G585: 7 | H585: 11 | I585: 53 | K585: 12 | L585: 17 | M585: 89 | O585: 13 | P585: 22 | Q585: 100 | S585: GRIFFITH | W585: PRAHRAN | X585: 6 | Y585: 7 | Z585: 0 | AA585: 1508 | AB585: 1688 | AC585: =(AA585/AB585)*100 -> 89.33649289099526 | AD585: =(X585*4)+(Z585*2) -> 24
A586: BEST PLAYERS | W586: FRANKSTON | X586: 6 | Y586: 7 | Z586: 0 | AA586: 1407 | AB586: 1611 | AC586: =(AA586/AB586)*100 -> 87.337057728119177 | AD586: =(X586*4)+(Z586*2) -> 24
A587: PRAHRAN | C587: THORNE | F587: McCORMACK | I587: MILLS | L587: STONE | O587: WARBURTON | R587: McFAULL | W587: GEELONG WEST | X587: 5 | Y587: 8 | Z587: 0 | AA587: 1356 | AB587: 1700 | AC587: =(AA587/AB587)*100 -> 79.764705882352942 | AD587: =(X587*4)+(Z587*2) -> 20
A588: DANDENONG | C588: WALLACE | F588: WOODMAN | I588: COVENTRY | L588: TOWNSEND | O588: MADDEN | W588: BRUNSWICK | X588: 3 | Y588: 10 | Z588: 0 | AA588: 1242 | AB588: 1809 | AC588: =(AA588/AB588)*100 -> 68.656716417910445 | AD588: =(X588*4)+(Z588*2) -> 12
A589: GOALKICKERS | W589: CAULFIELD | X589: 2 | Y589: 11 | Z589: 0 | AA589: 1471 | AB589: 1860 | AC589: =(AA589/AB589)*100 -> 79.086021505376351 | AD589: =(X589*4)+(Z589*2) -> 8
A590: PRAHRAN | C590: MILLS 8 | E590: THORNE 2 | G590: McDONALD 2 | J590: McCORMACK 2 | M590: STONE | O590: ELLETT
A591: DANDENONG | C591: WALLACE 2 | F591: CARROLL 2 | I591: ORTON 2 | K591: ORSBORNE 2 | N591: WOODMAN | Q591: LACEY | S591: ROSS | U591: JONES | W591: MADDEN
A593: COBURG | C593: 4 | D593: 6 | E593: 30 | G593: 10 | H593: 10 | I593: 70 | K593: 16 | L593: 13 | M593: 109 | O593: 22 | P593: 15 | Q593: 147 | S593: VENUE: COBURG
A594: CAULFIELD | C594: 2 | D594: 1 | E594: 13 | G594: 9 | H594: 5 | I594: 59 | K594: 16 | L594: 8 | M594: 104 | O594: 20 | P594: 10 | Q594: 130 | S594: VERGONA :STEERE
A595: BEST PLAYERS
A596: COBURG | C596: HALSALL | F596: IRONMONGER | I596: LAIDLER | L596: CLEARY | O596: HERBERT
A597: CAULFIELD | C597: McDONALD | F597: ROWE | I597: AMBLER | L597: ADAMS | O597: MORRISON
A598: GOALKICKERS
A599: COBURG | C599: HALSALL 7 | E599: IRONMONGER 6 | H599: PRETTO 2 | J599: HERBERT 2 | M599: CLEARY 2 | O599: HALBERT | Q599: BURT | R599: ALLISON
A600: CAULFIELD | C600: McDONALD 6 | F600: DAVIDSON 4 | I600: ROWE 4 | K600: MILNER 2 | M600: BOOTH | O600: COONEY | Q600: RUSS | R600: HOGAN
A602: PRESTON | C602: 4 | D602: 8 | E602: 32 | G602: 10 | H602: 15 | I602: 75 | K602: 18 | L602: 17 | M602: 125 | O602: 24 | P602: 20 | Q602: 164 | S602: VENUE: PRESTON
A603: GEELONG WEST | C603: 0 | D603: 1 | E603: 1 | G603: 4 | H603: 5 | I603: 29 | K603: 6 | L603: 7 | M603: 43 | O603: 14 | P603: 13 | Q603: 97 | S603: STABB :TORNEY
A604: BEST PLAYERS
A605: PRESTON | C605: McKEON | F605: MARCON | I605: McGAW | L605: McCULLOCH | O605: EATON | R605: BRINE
A606: GEELONG WEST | C606: GILMOUR | F606: EDDY | I606: BEATON | L606: BROWNE | O606: RADOJEVIC | R606: TODD
A607: GOALKICKERS
A608: PRESTON | C608: McGAW 4 | E608: COOPER 4 | G608: MARKS 3 | I608: VANN 3 | K608: McEWAN 2 | M608: MARCON 2 | O608: WHITE 2 | Q608: HEARD | S608: BRINE | U608: McKEON | X608: HALAS
A609: GEELONG WEST | C609: RADOJEVIC 5 | F609: POULTER 2 | I609: BURNETT 2 | K609: BROWNE | M609: McDOWELL | O609: TODD | P609: EDDY | R609: GILMOUR
A611: PORT MELBOURNE | C611: 5 | D611: 9 | E611: 39 | G611: 19 | H611: 14 | I611: 128 | K611: 26 | L611: 19 | M611: 175 | O611: 42 | P611: 23 | Q611: 275 | S611: VENUE: PORT MELBOURNE
A612: BRUNSWICK | C612: 3 | D612: 1 | E612: 19 | G612: 7 | H612: 2 | I612: 44 | K612: 12 | L612: 4 | M612: 76 | O612: 13 | P612: 10 | Q612: 88 | S612: COLISIMO :HUTCHINSON
A613: BEST PLAYERS
A614: PORT MELBOURNE | C614: P GOSS | F614: DERMOTT | I614: AANENSEN | L614: DAVIS | O614: SWAN | R614: DEMETRIOU
A615: BRUNSWICK | C615: DEANS | F615: B BROWN | I615: CALLANDER | L615: WEST | O615: WILEY
A616: GOALKICKERS
A617: PORT MELBOURNE | C617: COOK 12 | E617: JIM CHRISTOU 6 | H617: KAVANAGH 5 | K617: DAVIS 4 | M617: SWAN 4 | O617: ANDERSON 4 | R617: GOSS 3 | U617: EVANS 2 | X617: WILKINSON | AA617: DAVIS
A618: BRUNSWICK | C618: TOY 4 | E618: GUNSTON 3 | H618: LEAHY 2 | J618: RYAN 2 | L618: CALLANDER | O618: JUDGE
A620: ROUND 14 | D620: 26TH JULY | I620: WEATHER | S620: VENUE: PRESTON
D621: 1ST QTR | H621: 2ND QTR | L621: 3RD QTR | P621: FINAL | S621: UMPIRES
A622: PRESTON | C622: 4 | D622: 3 | E622: 27 | G622: 9 | H622: 4 | I622: 58 | K622: 11 | L622: 10 | M622: 76 | O622: 13 | P622: 12 | Q622: 90 | S622: TORNEY | X622: LADDER | AB622: ROUND | AD622: 14
A623: COBURG | C623: 2 | D623: 2 | E623: 14 | G623: 4 | H623: 5 | I623: 29 | K623: 8 | L623: 7 | M623: 55 | O623: 12 | P623: 12 | Q623: 84 | S623: CASEY
A624: BEST PLAYERS | W624: TEAM | X624: W | Y624: L | Z624: D | AA624: FOR | AB624: AGST | AC624: % | AD624: PTS
A625: PRESTON | C625: MARCON | F625: HEARD | I625: BOLGER | L625: BUX | O625: GOUGH | Q625: TOWAN
A626: COBURG | C626: JAMES | F626: BURT | I626: FITZGERALD | L626: CLEARY | O626: PRETTO | W626: PORT MELBOURNE | X626: 12 | Y626: 2 | Z626: 0 | AA626: 2355 | AB626: 1442 | AC626: =(AA626/AB626)*100 -> 163.31484049930651 | AD626: =(X626*4)+(Z626*2) -> 48
A627: GOALKICKERS | W627: PRESTON | X627: 10 | Y627: 4 | Z627: 0 | AA627: 1973 | AB627: 1427 | AC627: =(AA627/AB627)*100 -> 138.26208829712684 | AD627: =(X627*4)+(Z627*2) -> 40
A628: PRESTON | C628: McEWAN 3 | F628: McGAW 3 | H628: WHITE 3 | J628: MEESE 2 | L628: VANN | N628: BRINE | W628: SANDRINGHAM | X628: 9 | Y628: 5 | Z628: 0 | AA628: 1540 | AB628: 1389 | AC628: =(AA628/AB628)*100 -> 110.87113030957522 | AD628: =(X628*4)+(Z628*2) -> 36
A629: COBURG | C629: HERBERT 3 | F629: HALSALL 2 | I629: FITZGERALD 2 | L629: HALBERT | N629: BURT | P629: CLEARY | R629: WOOD | W629: COBURG | X629: 7 | Y629: 7 | Z629: 0 | AA629: 1712 | AB629: 1526 | AC629: =(AA629/AB629)*100 -> 112.18872870249017 | AD629: =(X629*4)+(Z629*2) -> 28
O630: ALLISON | S630: VENUE: DANDENONG
A631: DANDENONG | C631: 5 | D631: 6 | E631: 36 | G631: 6 | H631: 9 | I631: 45 | K631: 9 | L631: 15 | M631: 69 | O631: 12 | P631: 18 | Q631: 90 | S631: STABB | W631: DANDENONG | X631: 7 | Y631: 7 | Z631: 0 | AA631: 1534 | AB631: 1567 | AC631: =(AA631/AB631)*100 -> 97.894065092533495 | AD631: =(X631*4)+(Z631*2) -> 28
A632: SANDRINGHAM | C632: 0 | D632: 1 | E632: 1 | G632: 3 | H632: 2 | I632: 20 | K632: 4 | L632: 2 | M632: 26 | O632: 6 | P632: 6 | Q632: 42 | S632: TORNEY | W632: FRANKSTON | X632: 7 | Y632: 7 | Z632: 0 | AA632: 1542 | AB632: 1686 | AC632: =(AA632/AB632)*100 -> 91.459074733096088 | AD632: =(X632*4)+(Z632*2) -> 28
A633: BEST PLAYERS | W633: PRAHRAN | X633: 7 | Y633: 7 | Z633: 0 | AA633: 1623 | AB633: 1793 | AC633: =(AA633/AB633)*100 -> 90.518683770217507 | AD633: =(X633*4)+(Z633*2) -> 28
A634: DANDENONG | C634: WOODMAN | F634: TOWNSEND | I634: HARPER | L634: ALLISON | O634: WALLACE | R634: THOMPSON | W634: GEELONG WEST | X634: 6 | Y634: 8 | Z634: 0 | AA634: 1502 | AB634: 1819 | AC634: =(AA634/AB634)*100 -> 82.572842221000556 | AD634: =(X634*4)+(Z634*2) -> 24
A635: SANDRINGHAM | C635: MACLEOD | F635: MERCER | I635: OSBORNE | L635: MULLER | W635: BRUNSWICK | X635: 3 | Y635: 11 | Z635: 0 | AA635: 1317 | AB635: 1944 | AC635: =(AA635/AB635)*100 -> 67.746913580246911 | AD635: =(X635*4)+(Z635*2) -> 12
A636: GOALKICKERS | W636: CAULFIELD | X636: 2 | Y636: 12 | Z636: 0 | AA636: 1590 | AB636: 2006 | AC636: =(AA636/AB636)*100 -> 79.262213359920239 | AD636: =(X636*4)+(Z636*2) -> 8
A637: DANDENONG | C637: TOWNSEND 3 | F637: ALLISON 2 | I637: WOODMAN 2 | L637: COVENTRY | N637: ROSS | P637: LUKAS | R637: LACEY | T637: WALLACE
A638: SANDRINGHAM | C638: HUNT 3 | F638: MACLEOD | I638: MULLER | K638: BEUS
A640: PRAHRAN | C640: 1 | D640: 2 | E640: 8 | G640: 5 | H640: 7 | I640: 37 | K640: 9 | L640: 17 | M640: 71 | O640: 16 | P640: 19 | Q640: 115 | S640: VENUE: TOORAK PARK
A641: PORT MELBOURNE | C641: 5 | D641: 6 | E641: 36 | G641: 8 | H641: 10 | I641: 58 | K641: 10 | L641: 12 | M641: 72 | O641: 15 | P641: 15 | Q641: 105 | S641: FITZPATRICK :OAKLEY
A642: BEST PLAYERS
A643: PRAHRAN | C643: THORNE | F643: WALLACE | I643: STONE | L643: DICKSON | O643: TWOMEY | R643: SMITH
A644: PORT MELBOURNE | C644: GOSS | F644: ANDERSON | I644: COOK | L644: DOYLE | O644: CLARK | R644: EBEYER
A645: GOALKICKERS
A646: PRAHRAN | C646: SMITH 6 | E646: STONE 3 | G646: THORNE 2 | I646: AUSTIN 2 | K646: MILLS | M646: CLARKE | O646: McDONALD
A647: PORT MELBOURNE | C647: ANDERSON 5 | F647: COOK 3 | H647: GOSS 2 | J647: EBEYER 2 | L647: DAVIS | N647: BRICE | P647: KAVANAGH
A649: FRANKSTON | C649: 3 | D649: 9 | E649: 27 | G649: 7 | H649: 11 | I649: 53 | K649: 12 | L649: 21 | M649: 93 | O649: 19 | P649: 21 | Q649: 135 | S649: VENUE: BRUNSWICK
A650: BRUNSWICK | C650: 1 | D650: 2 | E650: 8 | G650: 5 | H650: 9 | I650: 39 | K650: 5 | L650: 10 | M650: 40 | O650: 10 | P650: 15 | Q650: 75 | S650: GRIFFITHS :THOMSON
A651: BEST PLAYERS
A652: FRANKSTON | C652: CZRNECKI | F652: BEATON | I652: LYNN | L652: KENNEDY | O652: KENTER | R652: DOCHERTY
A653: BRUNSWICK | C653: CROTTY | F653: WEST | I653: GUNSTON | L653: CLEARY
A654: GOALKICKERS
A655: FRANKSTON | C655: SERAFINI 7 | F655: BOYD 3 | H655: KENNEDY 2 | K655: HUNTER 2 | M655: BEATON 2 | O655: BELL 2 | Q655: MERCOULIA | T655: LYNN
A656: BRUNSWICK | C656: WEST 3 | E656: GUNSTON 3 | H656: CLEARY 2 | J656: CROTTY | L656: SAHLBERG | O656: HUGGARD
A658: GEELONG WEST | C658: 8 | D658: 8 | E658: 56 | G658: 11 | H658: 12 | I658: 78 | K658: 17 | L658: 16 | M658: 118 | O658: 21 | P658: 20 | Q658: 146 | S658: VENUE: PRINCES PARK
A659: CAULFIELD | C659: 4 | D659: 2 | E659: 26 | G659: 9 | H659: 6 | I659: 60 | K659: 11 | L659: 12 | M659: 78 | O659: 17 | P659: 17 | Q659: 119 | S659: CROXFORD :CASEY
A660: BEST PLAYERS
A661: GEELONG WEST | C661: KRANJC | F661: CRICHTON | I661: TODD | L661: EDDY | O661: ELLIS | R661: BROWNE
A662: CAULFIELD | C662: ROWE | F662: AMBLER | I662: DAVIDSON | L662: MILNER
A663: GOALKICKERS
A664: GEELONG WEST | C664: RADOJEVIC 5 | F664: McDOWELL 3 | I664: ELLIS 3 | K664: BENTLEY 3 | M664: EDDY 2 | O664: DENMEAD 2 | R664: ROBINSON | U664: BROWNE | X664: GILMOUR
A665: CAULFIELD | C665: ROWE 4 | E665: DAVIDSON 3 | H665: BOOTH 3 | J665: MILNER 3 | L665: J McDONALD 2 | O665: O'DWYER | Q665: D COONEY
A667: ROUND 15 | D667: 2ND AUGUST | I667: WEATHER | S667: VENUE: BEACH ROAD
S668: UMPIRES
A669: PRESTON | C669: 4 | D669: 2 | E669: 26 | G669: 8 | H669: 7 | I669: 55 | K669: 16 | L669: 10 | M669: 106 | O669: 23 | P669: 14 | Q669: 152 | S669: OAKLEY | X669: LADDER | AB669: ROUND | AD669: 15
A670: SANDRINGHAM | C670: 6 | D670: 7 | E670: 43 | G670: 8 | H670: 8 | I670: 56 | K670: 9 | L670: 12 | M670: 66 | O670: 11 | P670: 14 | Q670: 80 | S670: CROXFORD
A671: BEST PLAYERS | W671: TEAM | X671: W | Y671: L | Z671: D | AA671: FOR | AB671: AGST | AC671: % | AD671: PTS
A672: PRESTON | C672: HEARD | F672: MARCON | I672: TOWAN | L672: EATON | O672: WARREN | R672: BUX
A673: SANDRINGHAM | C673: MANNIX | F673: DROSCHER | I673: PLEDGER | L673: MERCER | W673: PORT MELBOURNE | X673: 13 | Y673: 2 | Z673: 0 | AA673: 2469 | AB673: 1522 | AC673: =(AA673/AB673)*100 -> 162.22076215505913 | AD673: =(X673*4)+(Z673*2) -> 52
A674: GOALKICKERS | O674: BRINE | Q674: McEWAN | S674: BUX | W674: PRESTON | X674: 11 | Y674: 4 | Z674: 0 | AA674: 2125 | AB674: 1507 | AC674: =(AA674/AB674)*100 -> 141.00862641008626 | AD674: =(X674*4)+(Z674*2) -> 44
A675: PRESTON | C675: MARCON 5 | E675: WHITE 3 | G675: McGAW 3 | I675: LORENZINI 2 | L675: MEESE 2 | N675: G MARSHALL | Q675: HALAS | S675: McKEON | W675: SANDRINGHAM | X675: 9 | Y675: 6 | Z675: 0 | AA675: 1620 | AB675: 1541 | AC675: =(AA675/AB675)*100 -> 105.12654120700844 | AD675: =(X675*4)+(Z675*2) -> 36
A676: SANDRINGHAM | C676: HUNT 2 | E676: PLEDGER 2 | G676: BELL 2 | I676: MACLEOD | K676: MANNIX | M676: SIMS | N676: BEUS | P676: CALLERY | W676: FRANKSTON | X676: 8 | Y676: 7 | Z676: 0 | AA676: 1665 | AB676: 1785 | AC676: =(AA676/AB676)*100 -> 93.277310924369743 | AD676: =(X676*4)+(Z676*2) -> 32
S677: VENUE: FRANKSTON
A678: FRANKSTON | C678: 2 | D678: 2 | E678: 14 | G678: 3 | H678: 5 | I678: 23 | K678: 17 | L678: 7 | M678: 109 | O678: 19 | P678: 9 | Q678: 123 | S678: FITZPATRICK | W678: PRAHRAN | X678: 8 | Y678: 7 | Z678: 0 | AA678: 1717 | AB678: 1876 | AC678: =(AA678/AB678)*100 -> 91.524520255863536 | AD678: =(X678*4)+(Z678*2) -> 32
A679: DANDENONG | C679: 4 | D679: 6 | E679: 30 | G679: 5 | H679: 13 | I679: 43 | K679: 8 | L679: 14 | M679: 62 | O679: 14 | P679: 15 | Q679: 99 | S679: VERGONA | W679: COBURG | X679: 7 | Y679: 8 | Z679: 0 | AA679: 1795 | AB679: 1620 | AC679: =(AA679/AB679)*100 -> 110.80246913580247 | AD679: =(X679*4)+(Z679*2) -> 28
A680: BEST PLAYERS | W680: DANDENONG | X680: 7 | Y680: 8 | Z680: 0 | AA680: 1633 | AB680: 1690 | AC680: =(AA680/AB680)*100 -> 96.627218934911241 | AD680: =(X680*4)+(Z680*2) -> 28
A681: FRANKSTON | C681: LYNN | F681: BEATON | I681: BELL | L681: SALA | O681: BOYD | R681: GEDDES | W681: GEELONG WEST | X681: 6 | Y681: 9 | Z681: 0 | AA681: 1582 | AB681: 1933 | AC681: =(AA681/AB681)*100 -> 81.84169684428349 | AD681: =(X681*4)+(Z681*2) -> 24
A682: DANDENONG | C682: WRIGHT | F682: KNIGHT | I682: WALLACE | L682: WOODMAN | O682: TOWNSEND | W682: CAULFIELD | X682: 3 | Y682: 12 | Z682: 0 | AA682: 1707 | AB682: 2093 | AC682: =(AA682/AB682)*100 -> 81.55757286192069 | AD682: =(X682*4)+(Z682*2) -> 12
A683: GOALKICKERS | P683: KENTER | R683: HUNTER | W683: BRUNSWICK | X683: 3 | Y683: 12 | Z683: 0 | AA683: 1404 | AB683: 2061 | AC683: =(AA683/AB683)*100 -> 68.122270742358083 | AD683: =(X683*4)+(Z683*2) -> 12
A684: FRANKSTON | C684: SERAFINI 4 | F684: BEATON 4 | I684: JONES 3 | K684: GEDDES 2 | M684: MERCOULIA 2 | P684: SALA | R684: KENNEDY
A685: DANDENONG | C685: HENWOOD 5 | F685: TOWNSEND 5 | I685: WOODMAN | L685: WALLACE | N685: COUSINS | P685: HEAP
A687: PRAHRAN | C687: 1 | D687: 3 | E687: 9 | G687: 7 | H687: 6 | I687: 48 | K687: 11 | L687: 10 | M687: 76 | O687: 14 | P687: 10 | Q687: 94 | S687: VENUE: COBURG
A688: COBURG | C688: 3 | D688: 6 | E688: 24 | G688: 10 | H688: 10 | I688: 70 | K688: 10 | L688: 12 | M688: 72 | O688: 11 | P688: 17 | Q688: 83 | S688: CASEY :STABB
A689: BEST PLAYERS
A690: PRAHRAN | C690: THORNE | F690: DICKSON | I690: McDONALD | L690: McCORMACK | O690: TWOMEY | R690: McFAULL
A691: COBURG | C691: PRETTO | F691: CURRAN | I691: FITZGERALD | L691: BURT | O691: IRONMONGER
A692: GOALKICKERS
A693: PRAHRAN | C693: MCCORMACK 4 | F693: MCDONALD 3 | I693: THORNE 2 | K693: AUSTIN 2 | M693: STONE | O693: YOUNG | Q693: SMITH
A694: COBURG | C694: IRONMONGER 3 | F694: HALSALL 3 | I694: M HARBINSON 2 | L694: DOUGLAS | N694: LAIDLER | P694: HERBERT
A696: CAULFIELD | C696: 6 | D696: 10 | E696: 46 | G696: 6 | H696: 13 | I696: 49 | K696: 13 | L696: 19 | M696: 97 | O696: 16 | P696: 21 | Q696: 117 | S696: VENUE: PRINCES PARK
A697: BRUNSWICK | C697: 2 | D697: 0 | E697: 12 | G697: 6 | H697: 2 | I697: 38 | K697: 8 | L697: 6 | M697: 54 | O697: 13 | P697: 9 | Q697: 87 | S697: OGSTON :TORNEY
A698: BEST PLAYERS
A699: CAULFIELD | C699: MORRISO9N | F699: SUTTIE | I699: O'DWYER | L699: AMBLER | O699: ROWE
A700: BRUNSWICK | C700: NOLAN | F700: GUNSTON | I700: RYAN | L700: WILEY | O700: DEANS | R700: CROTTY
A701: GOALKICKERS
A702: CAULFIELD | C702: MORRISON 5 | F702: MILNER 2 | H702: D COONEY 2 | K702: RUSS | M702: DAVIDSON | O702: J McDONALD | R702: LESTER | T702: PEARCE | W702: HOGAN | X702: ROWE
A703: BRUNSWICK | C703: GUNSTON 4 | F703: TOY 2 | H703: HICKMAN 2 | J703: CLEARY | L703: RYAN | N703: WEST | P703: LUBETTA | R703: CHANDLER
A705: PORT MELBOURNE | C705: 9 | D705: 5 | E705: 59 | G705: 11 | H705: 10 | I705: 76 | K705: 13 | L705: 15 | M705: 93 | O705: 16 | P705: 18 | Q705: 114 | S705: VENUE: GEELONG WEST
A706: GEELONG WEST | C706: 2 | D706: 4 | E706: 16 | G706: 3 | H706: 10 | I706: 28 | K706: 5 | L706: 13 | M706: 43 | O706: 10 | P706: 20 | Q706: 80 | S706: GROOM :WILSON
A707: BEST PLAYERS
A708: PORT MELBOURNE | C708: SWAN | F708: JIM CHRISTOU | I708: P GOSS | L708: BRADBURY | O708: AANENSEN | R708: DOYLE
A709: GEELONG WEST | C709: EDDY | F709: GILMOUR | I709: CRICHTON | L709: BURNETT
A710: GOALKICKERS
A711: PORT MELBOURNE | C711: JIM CHRISTOU 7 | F711: O'RILEY 2 | H711: DAVIS 2 | J711: KAVANAGH 2 | M711: COOK | O711: SWAN | Q711: EBEYER
A712: GEELONG WEST | C712: ROBINSON 2 | F712: EDDY 2 | H712: GILMOUR 2 | J712: CRICHTON | M712: BENTLEY | O712: McDOWELL | Q712: RADOJEVIC
A714: ROUND 16 | D714: 9TH AUGUST | I714: WEATHER | S714: VENUE: PRESTON
D715: 1ST QTR | H715: 2ND QTR | L715: 3RD QTR | P715: FINAL | S715: UMPIRES
A716: PRESTON | C716: 3 | D716: 3 | E716: 21 | G716: 5 | H716: 6 | I716: 36 | K716: 6 | L716: 6 | M716: 42 | O716: 9 | P716: 8 | Q716: 62 | S716: TORNEY | X716: LADDER | AB716: ROUND | AD716: 16
A717: FRANKSTON | C717: 1 | D717: 3 | E717: 9 | G717: 2 | H717: 4 | I717: 16 | K717: 4 | L717: 6 | M717: 30 | O717: 6 | P717: 7 | Q717: 43 | S717: CASEY
A718: BEST PLAYERS | W718: TEAM | X718: W | Y718: L | Z718: D | AA718: FOR | AB718: AGST | AC718: % | AD718: PTS
A719: PRESTON | C719: WARREN | F719: TOWAN | I719: McEWAN | L719: COOPER | O719: HEARD | R719: BOLGER
A720: FRANKSTON | C720: BOYD | F720: LYNN | I720: BELL | L720: BEATON | O720: SALA | R720: CLIFFORD | W720: PORT MELBOURNE | X720: 14 | Y720: 2 | Z720: 0 | AA720: 2550 | AB720: 1593 | AC720: =(AA720/AB720)*100 -> 160.075329566855 | AD720: =(X720*4)+(Z720*2) -> 56
A721: GOALKICKERS | W721: PRESTON | X721: 12 | Y721: 4 | Z721: 0 | AA721: 2187 | AB721: 1550 | AC721: =(AA721/AB721)*100 -> 141.09677419354838 | AD721: =(X721*4)+(Z721*2) -> 48
A722: PRESTON | C722: McKEON 3 | F722: G MARSHALL 2 | I722: COOPER | K722: McEWAN | M722: McGAW | O722: HALAS | W722: SANDRINGHAM | X722: 9 | Y722: 7 | Z722: 0 | AA722: 1715 | AB722: 1659 | AC722: =(AA722/AB722)*100 -> 103.37552742616035 | AD722: =(X722*4)+(Z722*2) -> 36
A723: FRANKSTON | C723: SERAFINI 2 | F723: KENNEDY | I723: HUNTER | K723: BELL | M723: CZARNECKI | W723: PRAHRAN | X723: 9 | Y723: 7 | Z723: 0 | AA723: 1835 | AB723: 1971 | AC723: =(AA723/AB723)*100 -> 93.099949264332821 | AD723: =(X723*4)+(Z723*2) -> 36
S724: VENUE: TOORAK PARK
A725: PRAHRAN | C725: 6 | D725: 3 | E725: 39 | G725: 9 | H725: 3 | I725: 57 | K725: 14 | L725: 5 | M725: 89 | O725: 18 | P725: 10 | Q725: 118 | S725: GROOM | W725: FRANKSTON | X725: 8 | Y725: 8 | Z725: 0 | AA725: 1708 | AB725: 1847 | AC725: =(AA725/AB725)*100 -> 92.474282620465615 | AD725: =(X725*4)+(Z725*2) -> 32
A726: SANDRINGHAM | C726: 2 | D726: 1 | E726: 13 | G726: 10 | H726: 7 | I726: 67 | K726: 13 | L726: 9 | M726: 87 | O726: 14 | P726: 11 | Q726: 95 | S726: OGSTON | W726: COBURG | X726: 7 | Y726: 9 | Z726: 0 | AA726: 1866 | AB726: 1701 | AC726: =(AA726/AB726)*100 -> 109.70017636684304 | AD726: =(X726*4)+(Z726*2) -> 28
A727: BEST PLAYERS | W727: DANDENONG | X727: 7 | Y727: 9 | Z727: 0 | AA727: 1700 | AB727: 1758 | AC727: =(AA727/AB727)*100 -> 96.700796359499435 | AD727: =(X727*4)+(Z727*2) -> 28
A728: PRAHRAN | C728: McFAULL | F728: DICKSON | I728: THORNE | L728: JEFFREY | O728: McDONALD | R728: STONE | W728: GEELONG WEST | X728: 7 | Y728: 9 | Z728: 0 | AA728: 1654 | AB728: 1982 | AC728: =(AA728/AB728)*100 -> 83.451059535822409 | AD728: =(X728*4)+(Z728*2) -> 28
A729: SANDRINGHAM | C729: DROSCHER | F729: MACLEOD | I729: MERCER | L729: ADAMS | O729: SCOTT | R729: MAILING | W729: CAULFIELD | X729: 4 | Y729: 12 | Z729: 0 | AA729: 1775 | AB729: 2160 | AC729: =(AA729/AB729)*100 -> 82.175925925925924 | AD729: =(X729*4)+(Z729*2) -> 16
A730: GOALKICKERS | P730: TWOMEY | R730: McDONALD | W730: BRUNSWICK | X730: 3 | Y730: 13 | Z730: 0 | AA730: 1453 | AB730: 2133 | AC730: =(AA730/AB730)*100 -> 68.12001875293015 | AD730: =(X730*4)+(Z730*2) -> 12
A731: PRAHRAN | C731: MILLS 3 | E731: SMITH 3 | G731: McCORMACK 3 | J731: CLARKE 2 | L731: SOULOS 2 | N731: STONE | P731: THORNE | R731: AUSTIN
A732: SANDRINGHAM | C732: HUNT 4 | E732: WILKINS 2 | G732: HAYES 2 | I732: MACLEOD 2 | L732: MAILING | N732: MANNIX | P732: GILMORE | R732: BEUS
A734: PORT MELBOURNE | C734: 4 | D734: 4 | E734: 28 | G734: 7 | H734: 6 | I734: 48 | K734: 9 | L734: 11 | M734: 65 | O734: 11 | P734: 15 | Q734: 81 | S734: VENUE: PORT MELBOURNE
A735: COBURG | C735: 3 | D735: 1 | E735: 19 | G735: 5 | H735: 3 | I735: 33 | K735: 8 | L735: 6 | M735: 54 | O735: 10 | P735: 11 | Q735: 71 | S735: VERGONA :CROXFORD
A736: BEST PLAYERS
A737: PORT MELBOURNE | C737: DERMOTT | F737: AANENSEN | I737: EVANS | L737: DOYLE | O737: BRADBURY | R737: GOSS
A738: COBURG | C738: MILROY | F738: FITZGERALD | I738: CLEARY | L738: M HARBINSON | O738: PRETTO
A739: GOALKICKERS
A740: PORT MELBOURNE | C740: O'RILEY 3 | F740: COOK 3 | H740: JIM CHRISTOU 2 | K740: SWAN 2 | M740: DAVIS
A741: COBURG | C741: M HARBINSON 4 | F741: FITZGERALD 2 | I741: CLEARY 2 | K741: IRONMONGER | N741: SMITH
A743: CAULFIELD | C743: 6 | D743: 2 | E743: 38 | G743: 6 | H743: 3 | I743: 39 | K743: 8 | L743: 5 | M743: 53 | O743: 10 | P743: 8 | Q743: 68 | S743: VENUE: DANDENONG
A744: DANDENONG | C744: 3 | D744: 4 | E744: 22 | G744: 7 | H744: 8 | I744: 50 | K744: 8 | L744: 11 | M744: 59 | O744: 9 | P744: 13 | Q744: 67 | S744: STABB :GRIFFITH
A745: BEST PLAYERS
A746: CAULFIELD | C746: BRASIER | F746: AMBLER | I746: ROWE | L746: RICHARDS | O746: RUSS
A747: DANDENONG | C747: TOWNSEND | F747: ALLISON | I747: WALLACE | L747: HARPER | O747: POWLES | R747: P KNIGHT
A748: GOALKICKERS
A749: CAULFIELD | C749: ROWE 2 | E749: MILNER 2 | G749: RUSS | I749: DAVIDSON | K749: GIULLERI | M749: J McDONALD | P749: MORRISON | R749: DUNCAN
A750: DANDENONG | C750: ROSS 4 | E750: WOODMAN | H750: HENWOOD | J750: HORAZCKO | M750: ALLISON | O750: ORSBORNE
A752: GEELONG WEST | C752: 3 | D752: 1 | E752: 19 | G752: 5 | H752: 4 | I752: 34 | K752: 6 | L752: 5 | M752: 41 | O752: 11 | P752: 6 | Q752: 72 | S752: VENUE: BRUNSWICK
A753: BRUNSWICK | C753: 4 | D753: 0 | E753: 24 | G753: 7 | H753: 2 | I753: 44 | K753: 7 | L753: 5 | M753: 47 | O753: 7 | P753: 7 | Q753: 49 | S753: OAKLEY :FITZPATRICK
A754: BEST PLAYERS
A755: GEELONG WEST | C755: BURNETT | F755: ROBINSON | I755: BROWNE | L755: BENTLEY | O755: TODD
A756: BRUNSWICK | C756: CROTTY | F756: DEANS | I756: ANDERSON | L756: SCULLY | O756: HUGGARD
A757: GOALKICKERS
A758: GEELONG WEST | C758: BENTLEY 4 | F758: BURNETT 2 | I758: RADOJEVIC 2 | L758: ELLIS | M758: GILMOUR | O758: BROWNE
A759: BRUNSWICK | C759: ANDERSON 2 | F759: NOLAN | H759: SAHLBERG | K759: HUGGARD | M759: CALLANDER | P759: HICKMAN
A761: ROUND 17 | D761: 16TH AUGUST | I761: WEATHER | S761: VENUE: PRESTON
D762: 1ST QTR | H762: 2ND QTR | L762: 3RD QTR | P762: FINAL | S762: UMPIRES
A763: PRAHRAN | C763: 3 | D763: 0 | E763: 18 | G763: 9 | H763: 4 | I763: 58 | K763: 13 | L763: 8 | M763: 86 | O763: 17 | P763: 11 | Q763: 113 | S763: STABB | X763: LADDER | AB763: ROUND | AD763: 17
A764: PRESTON | C764: 3 | D764: 5 | E764: 23 | G764: 4 | H764: 5 | I764: 29 | K764: 12 | L764: 7 | M764: 79 | O764: 14 | P764: 8 | Q764: 92 | S764: GRIFFITH
A765: BEST PLAYERS | W765: TEAM | X765: W | Y765: L | Z765: D | AA765: FOR | AB765: AGST | AC765: % | AD765: PTS
A766: PRAHRAN | C766: STONE | F766: FOLEY | I766: McDONALD | L766: REED | O766: SOULOS | R766: THORNE
A767: PRESTON | C767: BOLGER | F767: MARCON | I767: HEARD | L767: GOUGH | O767: WARREN | W767: PORT MELBOURNE | X767: 15 | Y767: 2 | Z767: 0 | AA767: 2692 | AB767: 1656 | AC767: =(AA767/AB767)*100 -> 162.56038647342993 | AD767: =(X767*4)+(Z767*2) -> 60
A768: GOALKICKERS | W768: PRESTON | X768: 12 | Y768: 5 | Z768: 0 | AA768: 2279 | AB768: 1663 | AC768: =(AA768/AB768)*100 -> 137.04149128081781 | AD768: =(X768*4)+(Z768*2) -> 48
A769: PRAHRAN | C769: THORNE 4 | F769: SMITH 4 | H769: AUSTIN 3 | J769: CLARKE 2 | L769: SOULOS 2 | N769: STONE | P769: McDONALD | W769: PRAHRAN | X769: 10 | Y769: 7 | Z769: 0 | AA769: 1948 | AB769: 2063 | AC769: =(AA769/AB769)*100 -> 94.425593795443532 | AD769: =(X769*4)+(Z769*2) -> 40
A770: PRESTON | C770: MARCON 3 | F770: WHITE 2 | H770: MARKS 2 | J770: McGAW 2 | L770: VANN | N770: BUX | P770: HEARD | R770: McEWAN | W770: SANDRINGHAM | X770: 9 | Y770: 8 | Z770: 0 | AA770: 1782 | AB770: 1823 | AC770: =(AA770/AB770)*100 -> 97.75095995611629 | AD770: =(X770*4)+(Z770*2) -> 36
P771: HALAS | S771: VENUE: FRANKSTON
A772: FRANKSTON | C772: 5 | D772: 6 | E772: 36 | G772: 9 | H772: 8 | I772: 62 | K772: 15 | L772: 13 | M772: 103 | O772: 20 | P772: 16 | Q772: 136 | S772: OGSTON | W772: FRANKSTON | X772: 9 | Y772: 8 | Z772: 0 | AA772: 1844 | AB772: 1967 | AC772: =(AA772/AB772)*100 -> 93.746822572445339 | AD772: =(X772*4)+(Z772*2) -> 36
A773: GEELONG WEST | C773: 3 | D773: 4 | E773: 22 | G773: 9 | H773: 8 | I773: 62 | K773: 12 | L773: 11 | M773: 83 | O773: 17 | P773: 18 | Q773: 120 | S773: GROOM | W773: COBURG | X773: 8 | Y773: 9 | Z773: 0 | AA773: 1987 | AB773: 1747 | AC773: =(AA773/AB773)*100 -> 113.7378362907842 | AD773: =(X773*4)+(Z773*2) -> 32
A774: BEST PLAYERS | W774: DANDENONG | X774: 7 | Y774: 10 | Z774: 0 | AA774: 1763 | AB774: 1900 | AC774: =(AA774/AB774)*100 -> 92.78947368421052 | AD774: =(X774*4)+(Z774*2) -> 28
A775: FRANKSTON | C775: SERAFINI | F775: LYNN | I775: KENNEDY | L775: BELL | O775: KENTER | R775: BOND | W775: GEELONG WEST | X775: 7 | Y775: 10 | Z775: 0 | AA775: 1774 | AB775: 2118 | AC775: =(AA775/AB775)*100 -> 83.758262511803579 | AD775: =(X775*4)+(Z775*2) -> 28
A776: GEELONG WEST | C776: BROWNE | F776: CRICHTON | I776: EDDY | L776: YATES | O776: McDOWELL | R776: TORNEY | W776: CAULFIELD | X776: 5 | Y776: 12 | Z776: 0 | AA776: 1939 | AB776: 2227 | AC776: =(AA776/AB776)*100 -> 87.067804220925012 | AD776: =(X776*4)+(Z776*2) -> 20
A777: GOALKICKERS | W777: BRUNSWICK | X777: 3 | Y777: 14 | Z777: 0 | AA777: 1499 | AB777: 2254 | AC777: =(AA777/AB777)*100 -> 66.503992901508425 | AD777: =(X777*4)+(Z777*2) -> 12
A778: FRANKSTON | C778: SERAFINI 11 | F778: KENNEDY 2 | I778: MOULTON | K778: BOND | M778: JONES | O778: BEATON | Q778: BELL | S778: CZARNECKI
A779: GEELONG WEST | C779: BROWNE 5 | F779: EDDY 3 | H779: CRICHTON 3 | K779: DENMEAD 2 | N779: RADOJEVIC 2 | Q779: ELLIS | S779: TODD
A781: PORT MELBOURNE | C781: 6 | D781: 12 | E781: 48 | G781: 8 | H781: 13 | I781: 61 | K781: 15 | L781: 21 | M781: 111 | O781: 20 | P781: 22 | Q781: 142 | S781: VENUE: DANDENONG
A782: DANDENONG | C782: 1 | D782: 0 | E782: 6 | G782: 4 | H782: 4 | I782: 28 | K782: 6 | L782: 4 | M782: 40 | O782: 9 | P782: 9 | Q782: 63 | S782: TORNEY ;OAKLEY
A783: BEST PLAYERS
A784: PORT MELBOURNE | C784: EVANS | F784: DEMETRIOU | I784: AANENSEN | L784: DOYLE | O784: SWAN | Q784: JOHNSON
A785: DANDENONG | C785: POWLES | F785: THOMPSON | I785: WOODMAN | L785: P KNIGHT | O785: LUKAS | Q785: HORAZCKO
A786: GOALKICKERS
A787: PORT MELBOURNE | C787: COOK 5 | E787: ANDERSON 4 | H787: JIM CHRISTOU 3 | K787: KAVANAGH 3 | N787: O'RILEY | P787: BRICE | R787: SWAN | T787: P GOSS | V787: EBEYER
A788: DANDENONG | C788: COVENTRY 3 | F788: ORTON 2 | H788: WOODMAN | K788: TOWNSEND | N788: TONKS | P788: WEBB
A790: CAULFIELD | C790: 6 | D790: 7 | E790: 43 | G790: 13 | H790: 11 | I790: 89 | K790: 20 | L790: 14 | M790: 134 | O790: 25 | P790: 14 | Q790: 164 | S790: VENUE: PRINCES PARK
A791: SANDRINGHAM | C791: 3 | D791: 2 | E791: 20 | G791: 4 | H791: 7 | I791: 31 | K791: 6 | L791: 10 | M791: 46 | O791: 9 | P791: 13 | Q791: 67 | S791: RYAN :STEERE
A792: BEST PLAYERS
A793: CAULFIELD | C793: PEARCE | F793: BRASIER | I793: GIULLERI | L793: DAVIDSON | O793: AMBLER | R793: MILNER
A794: SANDRINGHAM | C794: MERCER | F794: HAYES | I794: MACLEOD | L794: ADAMS | O794: DROSCHER
A795: GOALKICKERS
A796: CAULFIELD | C796: MILNER 4 | E796: GIULLERI 4 | G796: PEARCE 3 | I796: DAVIDSON 3 | L796: O'DWYER 2 | N796: J McDONALD 2 | Q796: ROWE 2 | S796: COONEY | W796: MORRISON | X796: AMBLER | AA796: RUSS | AB796: CROOK
A797: SANDRINGHAM | C797: HUNT 2 | E797: MACLEOD 2 | H797: MAILING | J797: CARROLL | L797: GILMORE | N797: SIMS | P797: BENCRAFT
A799: COBURG | C799: 4 | D799: 4 | E799: 28 | G799: 6 | H799: 6 | I799: 42 | K799: 12 | L799: 10 | M799: 82 | O799: 18 | P799: 13 | Q799: 121 | S799: VENUE: BRUNSWICK
A800: BRUNSWICK | C800: 0 | D800: 1 | E800: 1 | G800: 4 | H800: 2 | I800: 26 | K800: 6 | L800: 3 | M800: 39 | O800: 7 | P800: 4 | Q800: 46 | S800: CASEY :COLISIMO
A801: BEST PLAYERS
A802: COBURG | C802: BURT | E802: FITZGERALD | H802: HALSALL | K802: PRETTO | N802: EADE | Q802: M HARBINSON
A803: BRUNSWICK | C803: DEANS | E803: CROTTY | H803: SCULLY | K803: TOY | N803: LEAHY
A804: GOALKICKERS
A805: COBURG | C805: M HARBINSON 4 | F805: HALBERT 3 | I805: DOUGLAS 3 | L805: HALSALL 3 | N805: FITZGERALD 2 | Q805: HERBERT | S805: CLEARY | V805: MILROY
A806: BRUNSWICK | C806: GUNSTON 3 | F806: SAGGERS | H806: BYE | I806: LEAHY | K806: ANDERSON
A808: ROUND 18 | D808: 23RD AUGUST | I808: WEATHER | S808: VENUE: PORT MELBOURNE
D809: 1ST QTR | H809: 2ND QTR | L809: 3RD QTR | P809: FINAL | S809: UMPIRES
A810: PORT MELBOURNE | C810: 3 | D810: 4 | E810: 22 | G810: 8 | H810: 12 | I810: 60 | K810: 14 | L810: 14 | M810: 98 | O810: 21 | P810: 15 | Q810: 141 | S810: OGSTON | X810: LADDER | AB810: ROUND | AD810: 18
A811: PRESTON | C811: 6 | D811: 0 | E811: 36 | G811: 8 | H811: 0 | I811: 48 | K811: 11 | L811: 3 | M811: 69 | O811: 15 | P811: 5 | Q811: 95 | S811: FITZPATRICK
A812: BEST PLAYERS | W812: TEAM | X812: W | Y812: L | Z812: D | AA812: FOR | AB812: AGST | AC812: % | AD812: PTS
A813: PORT MELBOURNE | C813: BRADBURY | F813: AANENSEN | I813: SWAN | L813: DAVIES | O813: ANDERSON | R813: GOSS
A814: PRESTON | C814: EATON | F814: HALAS | I814: BUX | L814: PREECE | O814: MARKS | R814: BRINE | W814: PORT MELBOURNE | X814: 16 | Y814: 2 | Z814: 0 | AA814: 2833 | AB814: 1751 | AC814: =(AA814/AB814)*100 -> 161.79326099371787 | AD814: =(X814*4)+(Z814*2) -> 64
A815: GOALKICKERS | M815: ANDERSON | P815: KAVANAGH | R815: EBEYER | W815: PRESTON | X815: 12 | Y815: 6 | Z815: 0 | AA815: 2374 | AB815: 1804 | AC815: =(AA815/AB815)*100 -> 131.59645232815964 | AD815: =(X815*4)+(Z815*2) -> 48
A816: PORT MELBOURNE | C816: COOK 5 | E816: DAVIS 3 | G816: O'RILEY 3 | I816: JIM CHRISTOU 2 | L816: SWAN 2 | N816: WILKINSON | Q816: P GOSS | S816: BRICE | W816: SANDRINGHAM | X816: 10 | Y816: 8 | Z816: 0 | AA816: 1954 | AB816: 1927 | AC816: =(AA816/AB816)*100 -> 101.40114167099117 | AD816: =(X816*4)+(Z816*2) -> 40
A817: PRESTON | C817: HALAS 6 | E817: MARKS 3 | G817: MARCON 2 | J817: McGAW | L817: WHITE | N817: P MARSHALL | Q817: G MARSHALL | W817: FRANKSTON | X817: 10 | Y817: 8 | Z817: 0 | AA817: 2005 | AB817: 2089 | AC817: =(AA817/AB817)*100 -> 95.978937290569661 | AD817: =(X817*4)+(Z817*2) -> 40
S818: VENUE: COBURG
A819: COBURG | C819: 3 | D819: 1 | E819: 19 | G819: 10 | H819: 7 | I819: 67 | K819: 17 | L819: 12 | M819: 114 | O819: 28 | P819: 17 | Q819: 185 | S819: STEERE | W819: PRAHRAN | X819: 10 | Y819: 8 | Z819: 0 | AA819: 2032 | AB819: 2159 | AC819: =(AA819/AB819)*100 -> 94.117647058823522 | AD819: =(X819*4)+(Z819*2) -> 40
A820: DANDENONG | C820: 5 | D820: 3 | E820: 33 | G820: 8 | H820: 8 | I820: 56 | K820: 10 | L820: 11 | M820: 71 | O820: 12 | P820: 13 | Q820: 85 | S820: RYAN | W820: COBURG | X820: 9 | Y820: 9 | Z820: 0 | AA820: 2172 | AB820: 1832 | AC820: =(AA820/AB820)*100 -> 118.55895196506549 | AD820: =(X820*4)+(Z820*2) -> 36
A821: BEST PLAYERS | W821: GEELONG WEST | X821: 8 | Y821: 10 | Z821: 0 | AA821: 1870 | AB821: 2202 | AC821: =(AA821/AB821)*100 -> 84.922797456857396 | AD821: =(X821*4)+(Z821*2) -> 32
A822: COBURG | C822: EADE | F822: IRONMONGER | I822: FITZGERALD | L822: HERBERT | O822: BURT | R822: HALBERT | W822: DANDENONG | X822: 7 | Y822: 11 | Z822: 0 | AA822: 1848 | AB822: 2085 | AC822: =(AA822/AB822)*100 -> 88.633093525179845 | AD822: =(X822*4)+(Z822*2) -> 28
A823: DANDENONG | C823: KNIGHT | F823: WOODMAN | I823: WRIGHT | L823: HENWOOD | O823: TOWNSEND | W823: CAULFIELD | X823: 5 | Y823: 13 | Z823: 0 | AA823: 2061 | AB823: 2388 | AC823: =(AA823/AB823)*100 -> 86.306532663316588 | AD823: =(X823*4)+(Z823*2) -> 20
A824: GOALKICKERS | P824: BURT | R824: WOOD | W824: BRUNSWICK | X824: 3 | Y824: 14 | Z824: 0 | AA824: 1499 | AB824: 2254 | AC824: =(AA824/AB824)*100 -> 66.503992901508425 | AD824: =(X824*4)+(Z824*2) -> 12
A825: COBURG | C825: IRONMONGER 9 | F825: HALSALL 4 | I825: FITZGERALD 4 | L825: HERBERT 3 | N825: M HARBINSON 3 | Q825: CLEARY 2 | S825: HALBERT
A826: DANDENONG | C826: TOWNSEND 5 | F826: HENWOOD 3 | I826: ORTON 3 | K826: WOODMAN
A828: FRANKSTON | C828: 7 | D828: 5 | E828: 47 | G828: 9 | H828: 7 | I828: 61 | K828: 16 | L828: 12 | M828: 108 | O828: 24 | P828: 17 | Q828: 161 | S828: VENUE: FRANKSTON
A829: CAULFIELD | C829: 6 | D829: 6 | E829: 42 | G829: 11 | H829: 6 | I829: 72 | K829: 14 | L829: 6 | M829: 90 | O829: 19 | P829: 8 | Q829: 122 | S829: COLISMO :OAKLEY
A830: BEST PLAYERS
A831: FRANKSTON | C831: KENNEDY | F831: BELL | I831: CZARNECKI | L831: SALA | O831: KENTER | R831: HUNTER
A832: CAULFIELD | C832: AMBLER | F832: DAVIDSON | I832: LESTER | L832: RICHARDS | O832: MORRISON
A833: GOALKICKERS
A834: FRANKSTON | C834: SERAFINI 7 | F834: GEDDES 4 | H834: JONES 3 | J834: CZARNECKI 3 | M834: MERCOULIA 2 | P834: KENNEDY | R834: HUNTER | U834: BEATON | X834: BELL | Z834: LANE
A835: CAULFIELD | C835: DAVIDSON 3 | F835: ROWE 3 | H835: DUNCAN 3 | J835: J McDONALD 2 | M835: MORRISON 2 | P835: RUSS 2 | R835: O'DWYER | U835: GIULLERI | X835: PEARCE | Z835: AMBLER
A837: GEELONG WEST | C837: 1 | D837: 3 | E837: 9 | G837: 6 | H837: 7 | I837: 43 | K837: 10 | L837: 10 | M837: 70 | O837: 13 | P837: 18 | Q837: 96 | S837: VENUE: GEELONG WEST
A838: PRAHRAN | C838: 4 | D838: 2 | E838: 26 | G838: 9 | H838: 7 | I838: 61 | K838: 11 | L838: 12 | M838: 78 | O838: 12 | P838: 12 | Q838: 84 | S838: CASEY :CROXFORD
A839: BEST PLAYERS
A840: GEELONG WEST | C840: BROWNE | F840: TODD | I840: BEATON | L840: WILSON | O840: TORNEY | R840: YATES
A841: PRAHRAN | C841: McCORMACK | F841: RHODES | I841: TWOMEY | L841: DICKSON | O841: WALLACE
A842: GOALKICKERS
A843: GEELONG WEST | C843: BROWNE 4 | F843: RADOJEVIC 4 | I843: BURNETT 2 | L843: CANTWELL | N843: CRICHTON | Q843: ELLIS
A844: PRAHRAN | C844: SMITH 4 | F844: CHAPMAN 2 | I844: TORCASSIO 2 | L844: CLARKE | N844: RHODES | P844: McDONALD | R844: McCORMACK
A846: SANDRINGHAM | C846: 7 | D846: 4 | E846: 46 | G846: 13 | H846: 9 | I846: 87 | K846: 18 | L846: 13 | M846: 121 | O846: 26 | P846: 16 | Q846: 172 | S846: VENUE: BEACH ROAD
A847: BRUNSWICK | C847: 3 | D847: 2 | E847: 20 | G847: 8 | H847: 5 | I847: 53 | K847: 13 | L847: 8 | M847: 86 | O847: 16 | P847: 8 | Q847: 104 | S847: VERGONA ;TORNEY
A848: BEST PLAYERS
A849: SANDRINGHAM | C849: ADAMS | F849: HUNT | I849: BEUS | L849: WILKINS | O849: DROSCHER | R849: CALLERY
A850: BRUNSWICK | C850: TOY | F850: DEANS | I850: LEAHY | L850: PARKER | O850: CROTTY
A851: GOALKICKERS
A852: SANDRINGHAM | C852: HUNT 11 | E852: PLEDGER 4 | G852: MACLEOD 3 | J852: WILKINS 2 | M852: MAILING 2 | P852: GILMORE 2 | R852: CALLERY | U852: BENCRAFT
A853: BRUNSWICK | C853: LEAHY 3 | E853: ANDERSON 3 | H853: SAGGERS 3 | J853: SAHLBERG 2 | M853: GUNSTON 2 | P853: PARKER | R853: CROTTY | U853: WEST
A855: FINALS
A856: 1ST SEMI | D856: 30TH AUGUST | I856: WEATHER | S856: PLAYED AT
D857: 1ST QTR | H857: 2ND QTR | L857: 3RD QTR | P857: FINAL | S857: JUNCTION OVAL
A858: SANDRINGHAM | C858: 4 | D858: 3 | E858: 27 | G858: 5 | H858: 7 | I858: 37 | K858: 11 | L858: 14 | M858: 80 | O858: 14 | P858: 16 | Q858: 100 | S858: UMPIRES
A859: FRANKSTON | C859: 4 | D859: 0 | E859: 24 | G859: 10 | H859: 2 | I859: 62 | K859: 12 | L859: 5 | M859: 77 | O859: 13 | P859: 5 | Q859: 83 | S859: VERGONA ;GROOM
A860: BEST PLAYERS
A861: SANDRINGHAM | C861: WILKINS | F861: PLEDGER | I861: MACLEOD | L861: HODGES | O861: MERCER | R861: SCOTT
A862: FRANKSTON | C862: LYNN | F862: BOND | I862: KENNEDY | L862: KENTER | O862: SALA | R862: JONES
A863: GOALKICKERS
A864: SANDRINGHAM | C864: HUNT 5 | E864: PLEDGER 2 | H864: MACLEOD 2 | K864: CALLERY 2 | N864: GILMORE | P864: MANNIX | R864: MAILING
A865: FRANKSTON | C865: SERAFINI 4 | F865: HUNTER 3 | I865: JONES 2 | K865: BEATON | M865: SALA | O865: MERCOULIA | R865: LYNN
A867: 2ND SEMI | D867: 6TH SEPTEMBER | I867: WEATHER | S867: PLAYED AT
A868: PORT MELBOURNE | C868: 6 | D868: 4 | E868: 40 | G868: 12 | H868: 13 | I868: 85 | K868: 17 | L868: 18 | M868: 120 | O868: 22 | P868: 25 | Q868: 157 | S868: JUNCTION OVAL
A869: PRESTON | C869: 3 | D869: 2 | E869: 20 | G869: 6 | H869: 4 | I869: 40 | K869: 7 | L869: 10 | M869: 52 | O869: 12 | P869: 14 | Q869: 86 | S869: UMPIRES
A870: BEST PLAYERS | S870: OGSTON :OAKLEY
A871: PORT MELBOURNE | C871: P GOSS | F871: THOMPSON | I871: EVANS | L871: AANENSEN | O871: JOHN CHRISTOU | R871: BRICE
A872: PRESTON | C872: P MARSHALL | F872: HALAS | I872: McEWAN | L872: WARREN | O872: McGAW | R872: EATON
A873: GOALKICKERS
A874: PORT MELBOURNE | C874: COOK 5 | E874: O'RILEY 3 | G874: JIM CHRISTOU 3 | J874: ANDERSON 3 | M874: P GOSS 2 | O874: KAVANAGH 2 | R874: EVANS 2 | U874: BRICE | X874: SWAN
A875: PRESTON | C875: HALAS 5 | E875: G MARSHALL 2 | H875: P MARSHALL | K875: COOPER | M875: BOLGER | O875: McEWAN | Q875: McGAW
A877: PRELIMINARY FINAL | G877: 13TH SEPTEMBER | S877: PLAYED AT
A878: PRESTON | C878: 8 | D878: 5 | E878: 53 | G878: 15 | H878: 7 | I878: 97 | K878: 22 | L878: 7 | M878: 139 | O878: 28 | P878: 7 | Q878: 175 | S878: JUNCTION OVAL
A879: SANDRINGHAM | C879: 3 | D879: 2 | E879: 20 | G879: 8 | H879: 7 | I879: 55 | K879: 15 | L879: 9 | M879: 99 | O879: 26 | P879: 12 | Q879: 168 | S879: UMPIRES
A880: BEST PLAYERS | S880: STABB :FITZPATRICK
A881: PRESTON | C881: HEARD | F881: BUX | I881: MARKS | L881: McEWAN | O881: BARTLETT | R881: McDONNELL
A882: SANDRINGHAM | C882: MACLEOD | F882: HUNT | I882: HODGES | L882: SIMS | O882: PLEDGER | R882: CALLERY
A883: GOALKICKERS
A884: PRESTON | C884: MARKS 7 | F884: HEARD 5 | H884: McDONNELL 4 | K884: McGAW 3 | M884: HALAS 3 | O884: McEWAN 2 | Q884: BUX | R884: VANN | T884: BARTLETT | X884: BODEN
A885: SANDRINGHAM | C885: HUNT 10 | F885: MAILING 5 | I885: MACLEOD 4 | L885: PLEDGER 2 | O885: GILMORE 2 | Q885: WILKINS | S885: MANNIX | V885: CALLERY
A887: GRAND FINAL | D887: 20TH SEPTEMBER | S887: PLAYED AT
A888: PORT MELBOURNE | C888: 6 | D888: 6 | E888: 42 | G888: 9 | H888: 9 | I888: 63 | K888: 19 | L888: 14 | M888: 128 | O888: 32 | P888: 19 | Q888: 211 | S888: JUNCTION OVAL
A889: PRESTON | C889: 2 | D889: 1 | E889: 13 | G889: 9 | H889: 4 | I889: 58 | K889: 11 | L889: 8 | M889: 74 | O889: 15 | P889: 8 | Q889: 98 | S889: UMPIRES
A890: BEST PLAYERS | S890: GROOM :FITZPATRICK
A891: PORT MELBOURNE | C891: AANENSEN | F891: EBEYER | I891: COOK | L891: DOYLE | O891: EVANS | R891: KAVANAGH
A892: PRESTON | C892: BARTLETT | F892: BOLGER | I892: McGAW | L892: WARREN | O892: BRINE | R892: HEARD
A893: GOALKICKERS
A894: PORT MELBOURNE | C894: COOK 8 | E894: ANDERSON 5 | H894: O'RILEY 4 | J894: JIM CHRISTOU 4 | M894: GOSS 3 | O894: EVANS 3 | Q894: DAVIES 2 | S894: EBEYER 2 | V894: SWAN
A895: PRESTON | C895: HALAS 5 | E895: BUX 2 | G895: VANN | I895: HEARD | K895: COOPER | M895: McEWAN | O895: BRINE | Q895: MARKS | S895: BODEN | U895: McGAW
A897: REPRESENTATIVE MATCH | G897: 7TH JUNE
A898: G.N.L. (TAS) | C898: 2 | D898: 5 | E898: 17 | G898: 4 | H898: 11 | I898: 35 | K898: 12 | L898: 16 | M898: 88 | O898: 15 | P898: 20 | Q898: 110
A899: V.F.A. | C899: 4 | D899: 2 | E899: 26 | G899: 10 | H899: 3 | I899: 63 | K899: 12 | L899: 7 | M899: 79 | O899: 15 | P899: 10 | Q899: 100
A900: BEST PLAYERS
A901: G.N.L. (TAS) | C901: WILLIAMS | F901: REYNOLDS | I901: DUNNE | L901: ANTHONY | O901: D'OLIVER | R901: ZELESIO
A902: V.F.A. | C902: WILKINS | F902: AANENSEN | I902: JOHN CHRISTOU | L902: JONES | O902: DERMOTT | R902: JUDD
A903: GOALKICKERS
A904: G.N.L. (TAS) | C904: WILLIAMS 4 | F904: REYNOLDS 4 | I904: D'OLIVER 2 | L904: YOUNG 2 | N904: MANASSA 2 | Q904: CLARK
A905: V.F.A. | C905: JESSOP 4 | F905: RADOJEVIC 3 | I905: JONES 2 | K905: MILROY 2 | M905: WILKINS | O905: WEST | Q905: JIM CHRISTOU | T905: HERBERT