A1: Victorian Football Association
A2: Season 1981 - Division Two
A3: © Copyright Wal Williams | F3: First created: 28 March 2016
A4: Contact: joywalwi at gmail dot com | F4: Last updated: 28 March 2016 | W4: VFA Results and tables - Link to the main index page
A5: You are free to copy this document in whole or part provided that proper acknowledgement is given to the author. All rights reserved.
A7: 1981 | C7: V.F.A. SEASON 2ND DIVISION
A8: ROUND 1 | E8: 5TH APRIL | J8: WEATHER | S8: PLAYED AT
D9: 1ST QTR | H9: 2ND QTR | L9: 3RD QTR | P9: FINAL | S9: MORDIALLOC
A10: MORDIALLOC | C10: 0 | D10: 0 | E10: =C10*6+D10 -> 0 | G10: 0 | H10: 0 | I10: =G10*6+H10 -> 0 | K10: 0 | L10: 0 | M10: =K10*6+L10 -> 0 | O10: 23 | P10: 11 | Q10: =O10*6+P10 -> 149 | S10: UMPIRE | X10: LADDER | AB10: ROUND | AD10: 1
A11: OAKLEIGH | C11: 0 | D11: 0 | E11: =C11*6+D11 -> 0 | G11: 0 | H11: 0 | I11: =G11*6+H11 -> 0 | K11: 0 | L11: 0 | M11: =K11*6+L11 -> 0 | O11: 21 | P11: 7 | Q11: =O11*6+P11 -> 133
A12: BEST PLAYERS | W12: TEAM | X12: W | Y12: L | Z12: D | AA12: FOR | AB12: AGST | AC12: % | AD12: PTS
A13: MORDIALLOC
A14: OAKLEIGH | W14: WAVERLEY | X14: 1 | Y14: 0 | Z14: 0 | AA14: 343 | AB14: 53 | AC14: =(AA14*100)/AB14 -> 647.16981132075466 | AD14: =(X14*4)+(Z14*2) -> 4
A15: GOALKICKERS | W15: CAMBERWELL | X15: 1 | Y15: 0 | Z15: 0 | AA15: 204 | AB15: 85 | AC15: =(AA15*100)/AB15 -> 240 | AD15: =(X15*4)+(Z15*2) -> 4
A16: MORDIALLOC | W16: WERRIBEE | X16: 1 | Y16: 0 | Z16: 0 | AA16: 179 | AB16: 109 | AC16: =(AA16*100)/AB16 -> 164.22018348623854 | AD16: =(X16*4)+(Z16*2) -> 4
A17: OAKLEIGH | W17: MORDIALLOC | X17: 1 | Y17: 0 | Z17: 0 | AA17: 149 | AB17: 133 | AC17: =(AA17*100)/AB17 -> 112.03007518796993 | AD17: =(X17*4)+(Z17*2) -> 4
A19: WERRIBEE | C19: 0 | D19: 0 | E19: =C19*6+D19 -> 0 | G19: 0 | H19: 0 | I19: =G19*6+H19 -> 0 | K19: 0 | L19: 0 | M19: =K19*6+L19 -> 0 | O19: 26 | P19: 23 | Q19: =O19*6+P19 -> 179 | S19: WERRIBEE | W19: WILLIAMSTOWN | X19: 1 | Y19: 0 | Z19: 0 | AA19: 121 | AB19: 117 | AC19: =(AA19*100)/AB19 -> 103.41880341880342 | AD19: =(X19*4)+(Z19*2) -> 4
A20: BOX HILL | C20: 0 | D20: 0 | E20: =C20*6+D20 -> 0 | G20: 0 | H20: 0 | I20: =G20*6+H20 -> 0 | K20: 0 | L20: 0 | M20: =K20*6+L20 -> 0 | O20: 17 | P20: 7 | Q20: =O20*6+P20 -> 109 | W20: YARRAVILLE | X20: 0 | Y20: 1 | Z20: 0 | AA20: 117 | AB20: 121 | AC20: =(AA20*100)/AB20 -> 96.694214876033058 | AD20: =(X20*4)+(Z20*2) -> 0
A21: BEST PLAYERS | W21: OAKLEIGH | X21: 0 | Y21: 1 | Z21: 0 | AA21: 133 | AB21: 149 | AC21: =(AA21*100)/AB21 -> 89.261744966442947 | AD21: =(X21*4)+(Z21*2) -> 0
A22: WERRIBEE | W22: BOX HILL | X22: 0 | Y22: 1 | Z22: 0 | AA22: 109 | AB22: 179 | AC22: =(AA22*100)/AB22 -> 60.893854748603353 | AD22: =(X22*4)+(Z22*2) -> 0
A23: BOX HILL | W23: NORTHCOTE | X23: 0 | Y23: 1 | Z23: 0 | AA23: 85 | AB23: 204 | AC23: =(AA23*100)/AB23 -> 41.666666666666664 | AD23: =(X23*4)+(Z23*2) -> 0
A24: GOALKICKERS | W24: SUNSHINE | X24: 0 | Y24: 1 | Z24: 0 | AA24: 53 | AB24: 343 | AC24: =(AA24*100)/AB24 -> 15.451895043731778 | AD24: =(X24*4)+(Z24*2) -> 0
A25: WERRIBEE
A26: BOX HILL
A28: WILLIAMSTOWN | C28: 0 | D28: 0 | E28: =C28*6+D28 -> 0 | G28: 0 | H28: 0 | I28: =G28*6+H28 -> 0 | K28: 0 | L28: 0 | M28: =K28*6+L28 -> 0 | O28: 16 | P28: 25 | Q28: =O28*6+P28 -> 121 | S28: YARRAVILLE
A29: YARRAVILLE | C29: 0 | D29: 0 | E29: =C29*6+D29 -> 0 | G29: 0 | H29: 0 | I29: =G29*6+H29 -> 0 | K29: 0 | L29: 0 | M29: =K29*6+L29 -> 0 | O29: 18 | P29: 9 | Q29: =O29*6+P29 -> 117
A30: BEST PLAYERS
A31: WILLIAMSTOWN
A32: YARRAVILLE
A33: GOALKICKERS
A34: WILLIAMSTOWN
A35: YARRAVILLE
A37: WAVERLEY | C37: 0 | D37: 0 | E37: =C37*6+D37 -> 0 | G37: 0 | H37: 0 | I37: =G37*6+H37 -> 0 | K37: 0 | L37: 0 | M37: =K37*6+L37 -> 0 | O37: 52 | P37: 31 | Q37: =O37*6+P37 -> 343 | S37: WAVERLEY
A38: SUNSHINE | C38: 0 | D38: 0 | E38: =C38*6+D38 -> 0 | G38: 0 | H38: 0 | I38: =G38*6+H38 -> 0 | K38: 0 | L38: 0 | M38: =K38*6+L38 -> 0 | O38: 8 | P38: 5 | Q38: =O38*6+P38 -> 53
A39: BEST PLAYERS
A40: WAVERLEY
A41: SUNSHINE
A42: GOALKICKERS
A43: WAVERLEY
A44: SUNSHINE
A46: CAMBERWELL | C46: 0 | D46: 0 | E46: =C46*6+D46 -> 0 | G46: 0 | H46: 0 | I46: =G46*6+H46 -> 0 | K46: 0 | L46: 0 | M46: =K46*6+L46 -> 0 | O46: 32 | P46: 12 | Q46: =O46*6+P46 -> 204 | S46: CAMBERWELL
A47: NORTHCOTE | C47: 0 | D47: 0 | E47: =C47*6+D47 -> 0 | G47: 0 | H47: 0 | I47: =G47*6+H47 -> 0 | K47: 0 | L47: 0 | M47: =K47*6+L47 -> 0 | O47: 12 | P47: 13 | Q47: =O47*6+P47 -> 85
A48: BEST PLAYERS
A49: CAMBERWELL
A50: NORTHCOTE
A51: GOALKICKERS
A52: CAMBERWELL
A53: NORTHCOTE
A55: ROUND 2 | E55: 12TH APRIL | J55: WEATHER | S55: PLAYED AT
D56: 1ST QTR | H56: 2ND QTR | L56: 3RD QTR | P56: FINAL | S56: BOX HILL
A57: MORDIALLOC | C57: 0 | D57: 0 | E57: =C57*6+D57 -> 0 | G57: 0 | H57: 0 | I57: =G57*6+H57 -> 0 | K57: 0 | L57: 0 | M57: =K57*6+L57 -> 0 | O57: 24 | P57: 17 | Q57: =O57*6+P57 -> 161 | S57: UMPIRE | X57: LADDER | AB57: ROUND | AD57: 2
A58: BOX HILL | C58: 0 | D58: 0 | E58: =C58*6+D58 -> 0 | G58: 0 | H58: 0 | I58: =G58*6+H58 -> 0 | K58: 0 | L58: 0 | M58: =K58*6+L58 -> 0 | O58: 14 | P58: 16 | Q58: =O58*6+P58 -> 100
A59: BEST PLAYERS | W59: TEAM | X59: W | Y59: L | Z59: D | AA59: FOR | AB59: AGST | AC59: % | AD59: PTS
A60: MORDIALLOC
A61: BOX HILL | W61: WAVERLEY | X61: 2 | Y61: 0 | Z61: 0 | AA61: 452 | AB61: 137 | AC61: =(AA61*100)/AB61 -> 329.92700729927009 | AD61: =(X61*4)+(Z61*2) -> 8
A62: GOALKICKERS | W62: CAMBERWELL | X62: 2 | Y62: 0 | Z62: 0 | AA62: 352 | AB62: 172 | AC62: =(AA62*100)/AB62 -> 204.65116279069767 | AD62: =(X62*4)+(Z62*2) -> 8
A63: MORDIALLOC | W63: MORDIALLOC | X63: 2 | Y63: 0 | Z63: 0 | AA63: 310 | AB63: 233 | AC63: =(AA63*100)/AB63 -> 133.04721030042919 | AD63: =(X63*4)+(Z63*2) -> 8
A64: BOX HILL | W64: WERRIBEE | X64: 1 | Y64: 0 | Z64: 1 | AA64: 313 | AB64: 243 | AC64: =(AA64*100)/AB64 -> 128.80658436213992 | AD64: =(X64*4)+(Z64*2) -> 6
A66: WILLIAMSTOWN | C66: 0 | D66: 0 | E66: =C66*6+D66 -> 0 | G66: 0 | H66: 0 | I66: =G66*6+H66 -> 0 | K66: 0 | L66: 0 | M66: =K66*6+L66 -> 0 | O66: 21 | P66: 8 | Q66: =O66*6+P66 -> 134 | S66: WILLIAMSTOWN | W66: WILLIAMSTOWN | X66: 1 | Y66: 0 | Z66: 1 | AA66: 255 | AB66: 238 | AC66: =(AA66*100)/AB66 -> 107.14285714285714 | AD66: =(X66*4)+(Z66*2) -> 6
A67: WERRIBEE | C67: 0 | D67: 0 | E67: =C67*6+D67 -> 0 | G67: 0 | H67: 0 | I67: =G67*6+H67 -> 0 | K67: 0 | L67: 0 | M67: =K67*6+L67 -> 0 | O67: 21 | P67: 8 | Q67: =O67*6+P67 -> 134 | W67: YARRAVILLE | X67: 1 | Y67: 1 | Z67: 0 | AA67: 250 | AB67: 207 | AC67: =(AA67*100)/AB67 -> 120.77294685990339 | AD67: =(X67*4)+(Z67*2) -> 4
A68: BEST PLAYERS | W68: OAKLEIGH | X68: 0 | Y68: 2 | Z68: 0 | AA68: 220 | AB68: 297 | AC68: =(AA68*100)/AB68 -> 74.074074074074076 | AD68: =(X68*4)+(Z68*2) -> 0
A69: WILLIAMSTOWN | W69: BOX HILL | X69: 0 | Y69: 2 | Z69: 0 | AA69: 209 | AB69: 340 | AC69: =(AA69*100)/AB69 -> 61.470588235294116 | AD69: =(X69*4)+(Z69*2) -> 0
A70: WERRIBEE | W70: NORTHCOTE | X70: 0 | Y70: 2 | Z70: 0 | AA70: 169 | AB70: 313 | AC70: =(AA70*100)/AB70 -> 53.993610223642172 | AD70: =(X70*4)+(Z70*2) -> 0
A71: GOALKICKERS | W71: SUNSHINE | X71: 0 | Y71: 2 | Z71: 0 | AA71: 139 | AB71: 476 | AC71: =(AA71*100)/AB71 -> 29.201680672268907 | AD71: =(X71*4)+(Z71*2) -> 0
A72: WILLIAMSTOWN
A73: WERRIBEE
A75: YARRAVILLE | C75: 0 | D75: 0 | E75: =C75*6+D75 -> 0 | G75: 0 | H75: 0 | I75: =G75*6+H75 -> 0 | K75: 0 | L75: 0 | M75: =K75*6+L75 -> 0 | O75: 19 | P75: 19 | Q75: =O75*6+P75 -> 133 | S75: SUNSHINE
A76: SUNSHINE | C76: 0 | D76: 0 | E76: =C76*6+D76 -> 0 | G76: 0 | H76: 0 | I76: =G76*6+H76 -> 0 | K76: 0 | L76: 0 | M76: =K76*6+L76 -> 0 | O76: 12 | P76: 14 | Q76: =O76*6+P76 -> 86
A77: BEST PLAYERS
A78: YARRAVILLE
A79: SUNSHINE
A80: GOALKICKERS
A81: YARRAVILLE
A82: SUNSHINE
A84: WAVERLEY | C84: 0 | D84: 0 | E84: =C84*6+D84 -> 0 | G84: 0 | H84: 0 | I84: =G84*6+H84 -> 0 | K84: 0 | L84: 0 | M84: =K84*6+L84 -> 0 | O84: 16 | P84: 13 | Q84: =O84*6+P84 -> 109 | S84: NORTHCOTE
A85: NORTHCOTE | C85: 0 | D85: 0 | E85: =C85*6+D85 -> 0 | G85: 0 | H85: 0 | I85: =G85*6+H85 -> 0 | K85: 0 | L85: 0 | M85: =K85*6+L85 -> 0 | O85: 12 | P85: 12 | Q85: =O85*6+P85 -> 84
A86: BEST PLAYERS
A87: WAVERLEY
A88: NORTHCOTE
A89: GOALKICKERS
A90: WAVERLEY
A91: NORTHCOTE
A93: CAMBERWELL | C93: 0 | D93: 0 | E93: =C93*6+D93 -> 0 | G93: 0 | H93: 0 | I93: =G93*6+H93 -> 0 | K93: 0 | L93: 0 | M93: =K93*6+L93 -> 0 | O93: 21 | P93: 22 | Q93: =O93*6+P93 -> 148 | S93: WERRIBEE
A94: OAKLEIGH | C94: 0 | D94: 0 | E94: =C94*6+D94 -> 0 | G94: 0 | H94: 0 | I94: =G94*6+H94 -> 0 | K94: 0 | L94: 0 | M94: =K94*6+L94 -> 0 | O94: 12 | P94: 15 | Q94: =O94*6+P94 -> 87
A95: BEST PLAYERS
A96: CAMBERWELL
A97: OAKLEIGH
A98: GOALKICKERS
A99: CAMBERWELL
A100: OAKLEIGH
A102: ROUND 3 | E102: 19TH APRIL | J102: WEATHER | S102: PLAYED AT
D103: 1ST QTR | H103: 2ND QTR | L103: 3RD QTR | P103: FINAL | S103: MORDIALLOC
A104: WILLIAMSTOWN | C104: 0 | D104: 0 | E104: =C104*6+D104 -> 0 | G104: 0 | H104: 0 | I104: =G104*6+H104 -> 0 | K104: 0 | L104: 0 | M104: =K104*6+L104 -> 0 | O104: 19 | P104: 22 | Q104: =O104*6+P104 -> 136 | S104: UMPIRE | X104: LADDER | AB104: ROUND | AD104: 3
A105: MORDIALLOC | C105: 0 | D105: 0 | E105: =C105*6+D105 -> 0 | G105: 0 | H105: 0 | I105: =G105*6+H105 -> 0 | K105: 0 | L105: 0 | M105: =K105*6+L105 -> 0 | O105: 13 | P105: 11 | Q105: =O105*6+P105 -> 89
A106: BEST PLAYERS | W106: TEAM | X106: W | Y106: L | Z106: D | AA106: FOR | AB106: AGST | AC106: % | AD106: PTS
A107: WILLIAMSTOWN
A108: MORDIALLOC | W108: CAMBERWELL | X108: 3 | Y108: 0 | Z108: 0 | AA108: 487 | AB108: 261 | AC108: =(AA108*100)/AB108 -> 186.59003831417624 | AD108: =(X108*4)+(Z108*2) -> 12
A109: GOALKICKERS | W109: WERRIBEE | X109: 2 | Y109: 0 | Z109: 1 | AA109: 516 | AB109: 290 | AC109: =(AA109*100)/AB109 -> 177.93103448275863 | AD109: =(X109*4)+(Z109*2) -> 10
A110: WILLIAMSTOWN | W110: WILLIAMSTOWN | X110: 2 | Y110: 0 | Z110: 1 | AA110: 391 | AB110: 327 | AC110: =(AA110*100)/AB110 -> 119.57186544342508 | AD110: =(X110*4)+(Z110*2) -> 10
A111: MORDIALLOC | W111: WAVERLEY | X111: 2 | Y111: 1 | Z111: 0 | AA111: 541 | AB111: 272 | AC111: =(AA111*100)/AB111 -> 198.89705882352942 | AD111: =(X111*4)+(Z111*2) -> 8
A113: WERRIBEE | C113: 0 | D113: 0 | E113: =C113*6+D113 -> 0 | G113: 0 | H113: 0 | I113: =G113*6+H113 -> 0 | K113: 0 | L113: 0 | M113: =K113*6+L113 -> 0 | O113: 30 | P113: 23 | Q113: =O113*6+P113 -> 203 | S113: WERRIBEE | W113: MORDIALLOC | X113: 2 | Y113: 1 | Z113: 0 | AA113: 399 | AB113: 369 | AC113: =(AA113*100)/AB113 -> 108.130081300813 | AD113: =(X113*4)+(Z113*2) -> 8
A114: SUNSHINE | C114: 0 | D114: 0 | E114: =C114*6+D114 -> 0 | G114: 0 | H114: 0 | I114: =G114*6+H114 -> 0 | K114: 0 | L114: 0 | M114: =K114*6+L114 -> 0 | O114: 7 | P114: 5 | Q114: =O114*6+P114 -> 47 | W114: YARRAVILLE | X114: 1 | Y114: 2 | Z114: 0 | AA114: 360 | AB114: 334 | AC114: =(AA114*100)/AB114 -> 107.78443113772455 | AD114: =(X114*4)+(Z114*2) -> 4
A115: BEST PLAYERS | W115: OAKLEIGH | X115: 1 | Y115: 2 | Z115: 0 | AA115: 408 | AB115: 381 | AC115: =(AA115*100)/AB115 -> 107.08661417322834 | AD115: =(X115*4)+(Z115*2) -> 4
A116: WERRIBEE | W116: NORTHCOTE | X116: 1 | Y116: 2 | Z116: 0 | AA116: 296 | AB116: 423 | AC116: =(AA116*100)/AB116 -> 69.976359338061471 | AD116: =(X116*4)+(Z116*2) -> 4
A117: SUNSHINE | W117: BOX HILL | X117: 0 | Y117: 3 | Z117: 0 | AA117: 293 | AB117: 520 | AC117: =(AA117*100)/AB117 -> 56.346153846153847 | AD117: =(X117*4)+(Z117*2) -> 0
A118: GOALKICKERS | W118: SUNSHINE | X118: 0 | Y118: 3 | Z118: 0 | AA118: 186 | AB118: 679 | AC118: =(AA118*100)/AB118 -> 27.39322533136966 | AD118: =(X118*4)+(Z118*2) -> 0
A119: WERRIBEE
A120: SUNSHINE
A122: NORTHCOTE | C122: 0 | D122: 0 | E122: =C122*6+D122 -> 0 | G122: 0 | H122: 0 | I122: =G122*6+H122 -> 0 | K122: 0 | L122: 0 | M122: =K122*6+L122 -> 0 | O122: 19 | P122: 13 | Q122: =O122*6+P122 -> 127 | S122: YARRAVILLE
A123: YARRAVILLE | C123: 0 | D123: 0 | E123: =C123*6+D123 -> 0 | G123: 0 | H123: 0 | I123: =G123*6+H123 -> 0 | K123: 0 | L123: 0 | M123: =K123*6+L123 -> 0 | O123: 16 | P123: 14 | Q123: =O123*6+P123 -> 110
A124: BEST PLAYERS
A125: NORTHCOTE
A126: YARRAVILLE
A127: GOALKICKERS
A128: NORTHCOTE
A129: YARRAVILLE
A131: CAMBERWELL | C131: 0 | D131: 0 | E131: =C131*6+D131 -> 0 | G131: 0 | H131: 0 | I131: =G131*6+H131 -> 0 | K131: 0 | L131: 0 | M131: =K131*6+L131 -> 0 | O131: 21 | P131: 9 | Q131: =O131*6+P131 -> 135 | S131: WAVERLEY
A132: WAVERLEY | C132: 0 | D132: 0 | E132: =C132*6+D132 -> 0 | G132: 0 | H132: 0 | I132: =G132*6+H132 -> 0 | K132: 0 | L132: 0 | M132: =K132*6+L132 -> 0 | O132: 13 | P132: 11 | Q132: =O132*6+P132 -> 89
A133: BEST PLAYERS
A134: CAMBERWELL
A135: WAVERLEY
A136: GOALKICKERS
A137: CAMBERWELL
A138: WAVERLEY
A140: OAKLEIGH | C140: 0 | D140: 0 | E140: =C140*6+D140 -> 0 | G140: 0 | H140: 0 | I140: =G140*6+H140 -> 0 | K140: 0 | L140: 0 | M140: =K140*6+L140 -> 0 | O140: 27 | P140: 26 | Q140: =O140*6+P140 -> 188 | S140: BOX HILL
A141: BOX HILL | C141: 0 | D141: 0 | E141: =C141*6+D141 -> 0 | G141: 0 | H141: 0 | I141: =G141*6+H141 -> 0 | K141: 0 | L141: 0 | M141: =K141*6+L141 -> 0 | O141: 12 | P141: 12 | Q141: =O141*6+P141 -> 84
A142: BEST PLAYERS
A143: OAKLEIGH
A144: BOX HILL
A145: GOALKICKERS
A146: OAKLEIGH
A147: BOX HILL
A149: ROUND 4 | E149: 26TH APRIL | J149: WEATHER | S149: PLAYED AT
D150: 1ST QTR | H150: 2ND QTR | L150: 3RD QTR | P150: FINAL | S150: OAKLEIGH
A151: OAKLEIGH | C151: 1 | D151: 3 | E151: =C151*6+D151 -> 9 | G151: 11 | H151: 6 | I151: =G151*6+H151 -> 72 | K151: 15 | L151: 11 | M151: =K151*6+L151 -> 101 | O151: 18 | P151: 13 | Q151: =O151*6+P151 -> 121 | S151: UMPIRE | X151: LADDER | AB151: ROUND | AD151: 4
A152: WAVERLEY | C152: 3 | D152: 3 | E152: =C152*6+D152 -> 21 | G152: 8 | H152: 6 | I152: =G152*6+H152 -> 54 | K152: 11 | L152: 10 | M152: =K152*6+L152 -> 76 | O152: 17 | P152: 13 | Q152: =O152*6+P152 -> 115 | S152: RYAN
A153: BEST PLAYERS | W153: TEAM | X153: W | Y153: L | Z153: D | AA153: FOR | AB153: AGST | AC153: % | AD153: PTS
A154: OAKLEIGH | C154: GILL | E154: COLLINS | H154: BATTERSBY | K154: ANSELL | N154: BRUERTON | Q154: G HEVERIN
A155: WAVERLEY | C155: BRICK | E155: STYLES | H155: McLURE | K155: CLARKE | N155: ANGELIS | Q155: HOLDSWORTH | W155: CAMBERWELL | X155: 4 | Y155: 0 | Z155: 0 | AA155: 767 | AB155: 348 | AC155: =(AA155*100)/AB155 -> 220.40229885057471 | AD155: =(X155*4)+(Z155*2) -> 16
A156: GOALKICKERS | W156: WILLIAMSTOWN | X156: 3 | Y156: 0 | Z156: 1 | AA156: 573 | AB156: 387 | AC156: =(AA156*100)/AB156 -> 148.06201550387595 | AD156: =(X156*4)+(Z156*2) -> 14
A157: OAKLEIGH | C157: GILL 4 | E157: G HEVERIN 3 | G157: COLLINS 3 | I157: WOOD 2 | K157: PIPIROS 2 | M157: C HEVERIN | O157: WENN | Q157: CURTAIN | S157: ALLISEY | W157: MORDIALLOC | X157: 3 | Y157: 1 | Z157: 0 | AA157: 587 | AB157: 447 | AC157: =(AA157*100)/AB157 -> 131.31991051454139 | AD157: =(X157*4)+(Z157*2) -> 12
A158: WAVERLEY | C158: ANGELIS 5 | F158: STYLES 4 | H158: McLURE 4 | J158: ALEXANDER | M158: HOLDSWORTH | P158: McDONALD | S158: PRITCHETT | W158: WERRIBEE | X158: 2 | Y158: 1 | Z158: 1 | AA158: 612 | AB158: 422 | AC158: =(AA158*100)/AB158 -> 145.02369668246445 | AD158: =(X158*4)+(Z158*2) -> 10
A160: CAMBERWELL | C160: 10 | D160: 5 | E160: =C160*6+D160 -> 65 | G160: 18 | H160: 11 | I160: =G160*6+H160 -> 119 | K160: 30 | L160: 18 | M160: =K160*6+L160 -> 198 | O160: 43 | P160: 22 | Q160: =O160*6+P160 -> 280 | S160: CAMBERWELL | W160: WAVERLEY | X160: 2 | Y160: 2 | Z160: 0 | AA160: 656 | AB160: 393 | AC160: =(AA160*100)/AB160 -> 166.92111959287533 | AD160: =(X160*4)+(Z160*2) -> 8
A161: YARRAVILLE | C161: 0 | D161: 1 | E161: =C161*6+D161 -> 1 | G161: 6 | H161: 2 | I161: =G161*6+H161 -> 38 | K161: 9 | L161: 4 | M161: =K161*6+L161 -> 58 | O161: 13 | P161: 9 | Q161: =O161*6+P161 -> 87 | S161: GROOM | W161: OAKLEIGH | X161: 2 | Y161: 2 | Z161: 0 | AA161: 529 | AB161: 496 | AC161: =(AA161*100)/AB161 -> 106.65322580645162 | AD161: =(X161*4)+(Z161*2) -> 8
A162: BEST PLAYERS | W162: NORTHCOTE | X162: 2 | Y162: 2 | Z162: 0 | AA162: 428 | AB162: 519 | AC162: =(AA162*100)/AB162 -> 82.46628131021194 | AD162: =(X162*4)+(Z162*2) -> 8
A163: CAMBERWELL | C163: STEVENSON | F163: SPITHILL | I163: CHAMBERLAIN | L163: DAVIDSON | O163: McFEE | R163: WRIGHT | W163: YARRAVILLE | X163: 1 | Y163: 3 | Z163: 0 | AA163: 447 | AB163: 614 | AC163: =(AA163*100)/AB163 -> 72.801302931596098 | AD163: =(X163*4)+(Z163*2) -> 4
A164: YARRAVILLE | C164: BROWN | F164: SIMPSON | I164: GRAY | L164: FOTHERINGHAM | O164: ROGOWISC | R164: ROZOZIC | W164: BOX HILL | X164: 0 | Y164: 4 | Z164: 0 | AA164: 353 | AB164: 702 | AC164: =(AA164*100)/AB164 -> 50.284900284900282 | AD164: =(X164*4)+(Z164*2) -> 0
A165: GOALKICKERS | J165: SPITHILL | M165: PEVITT | O165: KING | W165: SUNSHINE | X165: 0 | Y165: 4 | Z165: 0 | AA165: 264 | AB165: 867 | AC165: =(AA165*100)/AB165 -> 30.449826989619378 | AD165: =(X165*4)+(Z165*2) -> 0
A166: CAMBERWELL | C166: STEVENSON 15 | F166: DAVIDSON 10 | I166: COWLEY 3 | K166: ROURKE 3 | M166: ASHTON 3 | O166: HIRST 2 | Q166: CHAMBERLAIN 2 | T166: NEILSON 2
A167: YARRAVILLE | C167: SIMPSON 5 | F167: THORPE | H167: SAMPSON | J167: DUDDERIDGE | M167: KEOGH | O167: RYAN | Q167: FOTHERINGHAM | T167: GRAY | V167: ROZOZIC
A169: WILLIAMSTOWN | C169: 5 | D169: 6 | E169: =C169*6+D169 -> 36 | G169: 12 | H169: 13 | I169: =G169*6+H169 -> 85 | K169: 21 | L169: 16 | M169: =K169*6+L169 -> 142 | O169: 26 | P169: 26 | Q169: =O169*6+P169 -> 182 | S169: WILLIAMSTOWN
A170: BOX HILL | C170: 0 | D170: 3 | E170: =C170*6+D170 -> 3 | G170: 3 | H170: 5 | I170: =G170*6+H170 -> 23 | K170: 7 | L170: 9 | M170: =K170*6+L170 -> 51 | O170: 8 | P170: 12 | Q170: =O170*6+P170 -> 60 | S170: HUTCHISON
A171: BEST PLAYERS
A172: WILLIAMSTOWN | C172: KELLY | E172: GILDAY | H172: L TAYLOR | K172: M TAYLOR | N172: McRAE | Q172: FAIRLEY
A173: BOX HILL | C173: PETTIGREW | F173: CONNOLLY | I173: McNALLY | L173: MARSHALL
A174: GOALKICKERS
A175: WILLIAMSTOWN | C175: GILDAY 7 | F175: FAIRLEY 3 | H175: JENKINSON 3 | K175: ENRIGHT 3 | N175: BEBEND 3 | P175: KELLY 2 | R175: CHAPMAN 2 | U175: J SINNOTT | W175: MONTEBRUNO | X175: S PHILPOTT
A176: BOX HILL | C176: WITHERS 4 | F176: CONNOLLY | I176: KAINEY | K176: DICKENSON | N176: MARSHALL
A178: NORTHCOTE | C178: 3 | D178: 6 | E178: =C178*6+D178 -> 24 | G178: 6 | H178: 12 | I178: =G178*6+H178 -> 48 | K178: 10 | L178: 18 | M178: =K178*6+L178 -> 78 | O178: 18 | P178: 24 | Q178: =O178*6+P178 -> 132 | S178: NORTHCOTE
A179: WEERRIBEE | C179: 2 | D179: 1 | E179: =C179*6+D179 -> 13 | G179: 9 | H179: 6 | I179: =G179*6+H179 -> 60 | K179: 11 | L179: 9 | M179: =K179*6+L179 -> 75 | O179: 14 | P179: 12 | Q179: =O179*6+P179 -> 96 | S179: VERGONA
A180: BEST PLAYERS
A181: NORTHCOTE | C181: PEART | F181: EDWARDS | H181: M RYAN | K181: MEGNA | N181: COURTS | Q181: P RYAN
A182: WEERRIBEE | C182: LANCASTER | F182: WALSH | H182: HUGHES | K182: SIDEROW | N182: DOUGLAS | Q182: MERCURI
A183: GOALKICKERS
A184: NORTHCOTE | C184: M RYAN 5 | F184: HEPBURN 4 | I184: PHILLIPE 3 | K184: EDWARDS 2 | N184: P RYAN 2 | P184: MASOULIS | S184: GRAHAM
A185: WEERRIBEE | C185: LEECE 4 | E185: BREEN 2 | G185: LINEHAN 2 | J185: WALSH | L185: REDENBACH | O185: DAY | Q185: BOLING | S185: MERCURI | V185: SIMMONS
A187: MORDIALLOC | C187: 9 | D187: 8 | E187: =C187*6+D187 -> 62 | G187: 16 | H187: 13 | I187: =G187*6+H187 -> 109 | K187: 21 | L187: 15 | M187: =K187*6+L187 -> 141 | O187: 27 | P187: 26 | Q187: =O187*6+P187 -> 188 | S187: SUNSHINE
A188: SUNSHINE | C188: 4 | D188: 3 | E188: =C188*6+D188 -> 27 | G188: 5 | H188: 6 | I188: =G188*6+H188 -> 36 | K188: 7 | L188: 10 | M188: =K188*6+L188 -> 52 | O188: 11 | P188: 12 | Q188: =O188*6+P188 -> 78 | S188: BLOOM
A189: BEST PLAYERS
A190: MORDIALLOC | C190: ROGERSON | F190: MASON | H190: BOURNE | K190: ALVES | M190: WALSH | P190: PETERS
A191: SUNSHINE | C191: TWENTYMAN | F191: CLARKE | H191: GORE | J191: GROSSMAN | M191: COCHIERELLA
A192: GOALKICKERS
A193: MORDIALLOC | C193: BOURNE 10 | F193: ROGERSON 5 | I193: PARKER 4 | K193: DEATON 3 | N193: DANIELS 3 | Q193: ALVES | S193: WALSH
A194: SUNSHINE | C194: M WILLIAMS 3 | F194: BENSON 2 | I194: G BROWN 2 | L194: GROSSMAN | O194: COCHIERELLA | R194: FOLEY | T194: R SMITH
A196: ROUND 5 | E196: 3RD MAY | J196: WEATHER | S196: PLAYED AT
D197: 1ST QTR | H197: 2ND QTR | L197: 3RD QTR | P197: FINAL | S197: OAKLEIGH
A198: OAKLEIGH | C198: 9 | D198: 3 | E198: =C198*6+D198 -> 57 | G198: 15 | H198: 6 | I198: =G198*6+H198 -> 96 | K198: 22 | L198: 11 | M198: =K198*6+L198 -> 143 | O198: 32 | P198: 14 | Q198: =O198*6+P198 -> 206 | S198: UMPIRE | X198: LADDER | AB198: ROUND | AD198: 5
A199: WILLIAMSTOWN | C199: 4 | D199: 3 | E199: =C199*6+D199 -> 27 | G199: 6 | H199: 8 | I199: =G199*6+H199 -> 44 | K199: 11 | L199: 11 | M199: =K199*6+L199 -> 77 | O199: 15 | P199: 13 | Q199: =O199*6+P199 -> 103 | S199: TORNEY
A200: BEST PLAYERS | W200: TEAM | X200: W | Y200: L | Z200: D | AA200: FOR | AB200: AGST | AC200: % | AD200: PTS
A201: OAKLEIGH | C201: McDONALD | F201: COLLINS | I201: BATTERSBY | L201: WOOD | N201: C HEVERIN | Q201: BRUERTON
A202: WILLIAMSTOWN | C202: FAIRLEY | F202: CUTAJAR | I202: M TAYLOR | L202: BEBEND | W202: CAMBERWELL | X202: 5 | Y202: 0 | Z202: 0 | AA202: 878 | AB202: 443 | AC202: =(AA202*100)/AB202 -> 198.19413092550789 | AD202: =(X202*4)+(Z202*2) -> 20
A203: GOALKICKERS | W203: MORDIALLOC | X203: 4 | Y203: 1 | Z203: 0 | AA203: 745 | AB203: 545 | AC203: =(AA203*100)/AB203 -> 136.69724770642202 | AD203: =(X203*4)+(Z203*2) -> 16
A204: OAKLEIGH | C204: WOOD 6 | E204: OTT 5 | F204: McDONALD 5 | I204: WENN 5 | K204: C HEVERIN 3 | N204: PLUMB 3 | P204: CURTAIN 2 | R204: COLLINS 2 | T204: TAYLOR | W204: WILLIAMSTOWN | X204: 3 | Y204: 1 | Z204: 1 | AA204: 676 | AB204: 593 | AC204: =(AA204*100)/AB204 -> 113.99662731871838 | AD204: =(X204*4)+(Z204*2) -> 14
A205: WILLIAMSTOWN | C205: JENKINSON 3 | F205: MONTEBRUNO 2 | J205: S PHILPOTT 2 | M205: McRAE 2 | O205: M TAYLOR | R205: EUDEY | T205: GILDAY | W205: WAVERLEY | X205: 3 | Y205: 2 | Z205: 0 | AA205: 796 | AB205: 510 | AC205: =(AA205*100)/AB205 -> 156.07843137254903 | AD205: =(X205*4)+(Z205*2) -> 12
I206: WRIGHT | L206: J SINNOTT | O206: A PHILPOTT
A207: CAMBERWELL | C207: 4 | D207: 2 | E207: =C207*6+D207 -> 26 | G207: 9 | H207: 5 | I207: =G207*6+H207 -> 59 | K207: 14 | L207: 7 | M207: =K207*6+L207 -> 91 | O207: 17 | P207: 9 | Q207: =O207*6+P207 -> 111 | S207: WERRIBEE | W207: OAKLEIGH | X207: 3 | Y207: 2 | Z207: 0 | AA207: 735 | AB207: 599 | AC207: =(AA207*100)/AB207 -> 122.70450751252086 | AD207: =(X207*4)+(Z207*2) -> 12
A208: WERRIBEE | C208: 3 | D208: 6 | E208: =C208*6+D208 -> 24 | G208: 5 | H208: 9 | I208: =G208*6+H208 -> 39 | K208: 9 | L208: 12 | M208: =K208*6+L208 -> 66 | O208: 13 | P208: 17 | Q208: =O208*6+P208 -> 95 | S208: STABB | W208: WERRIBEE | X208: 2 | Y208: 2 | Z208: 1 | AA208: 707 | AB208: 533 | AC208: =(AA208*100)/AB208 -> 132.64540337711068 | AD208: =(X208*4)+(Z208*2) -> 10
A209: BEST PLAYERS | W209: NORTHCOTE | X209: 2 | Y209: 3 | Z209: 0 | AA209: 526 | AB209: 677 | AC209: =(AA209*100)/AB209 -> 77.69571639586411 | AD209: =(X209*4)+(Z209*2) -> 8
A210: CAMBERWELL | C210: JUDD | E210: HOWARD | H210: HIRST | K210: WRIGHT | N210: COOK | W210: YARRAVILLE | X210: 1 | Y210: 4 | Z210: 0 | AA210: 564 | AB210: 754 | AC210: =(AA210*100)/AB210 -> 74.801061007957557 | AD210: =(X210*4)+(Z210*2) -> 4
A211: WERRIBEE | C211: JACK | E211: VOLKERING | H211: WALSH | K211: HUGHES | N211: LANCASTER | W211: BOX HILL | X211: 1 | Y211: 4 | Z211: 0 | AA211: 490 | AB211: 786 | AC211: =(AA211*100)/AB211 -> 62.340966921119595 | AD211: =(X211*4)+(Z211*2) -> 4
A212: GOALKICKERS | W212: SUNSHINE | X212: 0 | Y212: 5 | Z212: 0 | AA212: 348 | AB212: 1004 | AC212: =(AA212*100)/AB212 -> 34.661354581673308 | AD212: =(X212*4)+(Z212*2) -> 0
A213: CAMBERWELL | C213: STEVENSON 7 | F213: HOWARD 3 | I213: DAVIDSON 2 | L213: HIRST 2 | N213: COWLEY 2 | Q213: KING
A214: WERRIBEE | C214: LEECE 4 | E214: GUDDE 2 | G214: WALSH | I214: REDENBACH | K214: PARKES | M214: TAYLOR | O214: VOLKERING | R214: MERCURI | T214: SIMMONS
A216: MORDIALLOC | C216: 5 | D216: 10 | E216: =C216*6+D216 -> 40 | G216: 11 | H216: 10 | I216: =G216*6+H216 -> 76 | K216: 18 | L216: 13 | M216: =K216*6+L216 -> 121 | O216: 24 | P216: 14 | Q216: =O216*6+P216 -> 158 | S216: MORDIALLOC
A217: NORTHCOTE | C217: 3 | D217: 2 | E217: =C217*6+D217 -> 20 | G217: 9 | H217: 5 | I217: =G217*6+H217 -> 59 | K217: 12 | L217: 9 | M217: =K217*6+L217 -> 81 | O217: 14 | P217: 14 | Q217: =O217*6+P217 -> 98 | S217: RYAN
A218: BEST PLAYERS
A219: MORDIALLOC | C219: ROGERSON | F219: BOURNE | I219: DEATON | L219: WALSH | N219: MASON | P219: PETER BARDOEL
A220: NORTHCOTE | C220: M RYAN | F220: DILORIO | I220: P RYAN | L220: PEART | N220: GRAHAM | Q220: McINTYRE
A221: GOALKICKERS
A222: MORDIALLOC | C222: BOURNE 11 | F222: DEATON 5 | I222: PETER BARDOEL 3 | M222: ROGERSON 3 | P222: MASON | R222: PAGNOCCOLO
A223: NORTHCOTE | C223: PHILLIPE 5 | F223: G RYAN 2 | I223: DILORIO 2 | K223: M RYAN 2 | N223: HEPBURN | P223: ROULSTON | R223: EDWARDS
A225: WAVERLEY | C225: 7 | D225: 2 | E225: =C225*6+D225 -> 44 | G225: 10 | H225: 6 | I225: =G225*6+H225 -> 66 | K225: 17 | L225: 10 | M225: =K225*6+L225 -> 112 | O225: 21 | P225: 14 | Q225: =O225*6+P225 -> 140 | S225: YARRAVILLE
A226: YARRAVILLE | C226: 2 | D226: 4 | E226: =C226*6+D226 -> 16 | G226: 9 | H226: 10 | I226: =G226*6+H226 -> 64 | K226: 13 | L226: 12 | M226: =K226*6+L226 -> 90 | O226: 17 | P226: 15 | Q226: =O226*6+P226 -> 117 | S226: BLOOM
A227: BEST PLAYERS
A228: WAVERLEY | C228: BRICK | E228: WILLIAMS | H228: LOVELL | K228: CLARKE | N228: K McDONALD | Q228: HOLDSWORTH
A229: YARRAVILLE | C229: LEITCH | E229: S McGHIE | H229: PAGE | K229: B SMITH | N229: G BROWN | Q229: RYAN
A230: GOALKICKERS
A231: WAVERLEY | C231: DAVIES 4 | E231: McLURE 4 | G231: BRICK 3 | I231: HOLDSWORTH 2 | L231: K McDONALD 2 | O231: ANGELIS | Q231: STYLES | S231: ALEXANDER | V231: KINNABURGH | X231: WILLIAMS | Z231: PRITCHETT
A232: YARRAVILLE | C232: LEITCH 5 | E232: DUDDERIDGE 3 | H232: G BROWN 2 | K232: SAMPSON | N232: FOTHERINGHAM | Q232: ROGOZIK | S232: SIMPSON | V232: DAVIS | X232: PAGE
A234: BOX HILL | C234: 4 | D234: 8 | E234: =C234*6+D234 -> 32 | G234: 10 | H234: 18 | I234: =G234*6+H234 -> 78 | K234: 14 | L234: 19 | M234: =K234*6+L234 -> 103 | O234: 19 | P234: 23 | Q234: =O234*6+P234 -> 137 | S234: BOX HILL
A235: SUNSHINE | C235: 2 | D235: 4 | E235: =C235*6+D235 -> 16 | G235: 4 | H235: 8 | I235: =G235*6+H235 -> 32 | K235: 7 | L235: 17 | M235: =K235*6+L235 -> 59 | O235: 10 | P235: 24 | Q235: =O235*6+P235 -> 84 | S235: CASEY
A236: BEST PLAYERS
A237: BOX HILL | C237: McNALLY | F237: CONNOLLY | I237: LAWTHER | L237: DICKENSON | O237: PETTIGREW | R237: McKENZIE
A238: SUNSHINE | C238: WILLIAMS | F238: MEREDITH | I238: BROWN | L238: D HUNT | O238: R CLARKE
A239: GOALKICKERS
A240: BOX HILL | C240: LAWTHER 5 | F240: McKENZIE 3 | I240: CONNOLLY 2 | K240: DICKENSON 2 | N240: RICH 2 | P240: PENROSE 2 | R240: PETTIGREW | U240: KAINEY | W240: MARSHALL
A241: SUNSHINE | C241: D HUNT 2 | F241: BENSON 2 | I241: DARCY 2 | K241: WILLIAMS 2 | N241: S HUNT | P241: FOLEY
A243: ROUND 6 | E243: 10TH MAY | J243: WEATHER | S243: PLAYED AT
D244: 1ST QTR | H244: 2ND QTR | L244: 3RD QTR | P244: FINAL | S244: CAMBERWELL
A245: MORDIALLOC | C245: 4 | D245: 11 | E245: =C245*6+D245 -> 35 | G245: 8 | H245: 15 | I245: =G245*6+H245 -> 63 | K245: 14 | L245: 16 | M245: =K245*6+L245 -> 100 | O245: 19 | P245: 17 | Q245: =O245*6+P245 -> 131 | S245: UMPIRE | X245: LADDER | AB245: ROUND | AD245: 6
A246: CAMBERWELL | C246: 3 | D246: 0 | E246: =C246*6+D246 -> 18 | G246: 9 | H246: 4 | I246: =G246*6+H246 -> 58 | K246: 8 | L246: 6 | M246: =K246*6+L246 -> 54 | O246: 12 | P246: 13 | Q246: =O246*6+P246 -> 85 | S246: COLOSIMO
A247: BEST PLAYERS | W247: TEAM | X247: W | Y247: L | Z247: D | AA247: FOR | AB247: AGST | AC247: % | AD247: PTS
A248: MORDIALLOC | C248: ROGERSON | F248: WARREN | I248: PETER BARDOEL | M248: GUY | O248: MASON | Q248: LANG
A249: CAMBERWELL | C249: OLIVER | F249: TAYLOR | I249: R McFEE | L249: TEAKEL | W249: CAMBERWELL | X249: 5 | Y249: 1 | Z249: 0 | AA249: 963 | AB249: 574 | AC249: =(AA249*100)/AB249 -> 167.77003484320556 | AD249: =(X249*4)+(Z249*2) -> 20
A250: GOALKICKERS | W250: MORDIALLOC | X250: 5 | Y250: 1 | Z250: 0 | AA250: 876 | AB250: 630 | AC250: =(AA250*100)/AB250 -> 139.04761904761904 | AD250: =(X250*4)+(Z250*2) -> 20
A251: MORDIALLOC | C251: BOURNE 8 | F251: PARKER 4 | I251: PETER BARDOEL 3 | M251: PAGNOCCOLO 2 | P251: CRITCH | R251: ROGERSON | W251: WILLIAMSTOWN | X251: 4 | Y251: 1 | Z251: 1 | AA251: 866 | AB251: 664 | AC251: =(AA251*100)/AB251 -> 130.42168674698794 | AD251: =(X251*4)+(Z251*2) -> 18
A252: CAMBERWELL | C252: STEVENSON 2 | F252: HIRST 2 | H252: SPITHILL 2 | K252: DAVIDSON 2 | N252: PEVITT | P252: KING | R252: ROURKE | T252: ASHTON | W252: OAKLEIGH | X252: 4 | Y252: 2 | Z252: 0 | AA252: 866 | AB252: 682 | AC252: =(AA252*100)/AB252 -> 126.97947214076247 | AD252: =(X252*4)+(Z252*2) -> 16
A254: OAKLEIGH | C254: 2 | D254: 4 | E254: =C254*6+D254 -> 16 | G254: 8 | H254: 12 | I254: =G254*6+H254 -> 60 | K254: 12 | L254: 16 | M254: =K254*6+L254 -> 88 | O254: 18 | P254: 23 | Q254: =O254*6+P254 -> 131 | S254: YARRAVILLE | W254: WERRIBEE | X254: 3 | Y254: 2 | Z254: 1 | AA254: 798 | AB254: 607 | AC254: =(AA254*100)/AB254 -> 131.46622734761121 | AD254: =(X254*4)+(Z254*2) -> 14
A255: YARRAVILLE | C255: 2 | D255: 2 | E255: =C255*6+D255 -> 14 | G255: 5 | H255: 3 | I255: =G255*6+H255 -> 33 | K255: 11 | L255: 4 | M255: =K255*6+L255 -> 70 | O255: 13 | P255: 5 | Q255: =O255*6+P255 -> 83 | S255: HUTCHISON | W255: WAVERLEY | X255: 3 | Y255: 3 | Z255: 0 | AA255: 870 | AB255: 601 | AC255: =(AA255*100)/AB255 -> 144.75873544093179 | AD255: =(X255*4)+(Z255*2) -> 12
A256: BEST PLAYERS | W256: NORTHCOTE | X256: 3 | Y256: 3 | Z256: 0 | AA256: 722 | AB256: 772 | AC256: =(AA256*100)/AB256 -> 93.523316062176164 | AD256: =(X256*4)+(Z256*2) -> 12
A257: OAKLEIGH | C257: C HEVERIN | F257: MILLER | I257: BRUERTON | L257: CURTAIN | O257: ALLISEY | R257: McDONALD | W257: YARRAVILLE | X257: 1 | Y257: 5 | Z257: 0 | AA257: 647 | AB257: 885 | AC257: =(AA257*100)/AB257 -> 73.10734463276836 | AD257: =(X257*4)+(Z257*2) -> 4
A258: YARRAVILLE | C258: PRIEST | F258: GRAY | I258: BROWN | L258: SMITH | O258: PAGE | R258: S McGHIE | W258: BOX HILL | X258: 1 | Y258: 5 | Z258: 0 | AA258: 585 | AB258: 982 | AC258: =(AA258*100)/AB258 -> 59.572301425661912 | AD258: =(X258*4)+(Z258*2) -> 4
A259: GOALKICKERS | W259: SUNSHINE | X259: 0 | Y259: 6 | Z259: 0 | AA259: 419 | AB259: 1194 | AC259: =(AA259*100)/AB259 -> 35.092127303182579 | AD259: =(X259*4)+(Z259*2) -> 0
A260: OAKLEIGH | C260: WOOD 4 | E260: TAYLOR 3 | G260: OTT 3 | I260: PLUMB 2 | K260: NEARY 2 | M260: C HEBERIN | O260: WENN | Q260: McDONALD | S260: COLLINS
A261: YARRAVILLE | C261: DUDDERIDGE 3 | F261: SIMPSON 2 | I261: LEITCH 2 | K261: WARD | M261: BROWN | O261: RYAN | Q261: GRAY | R261: PRIEST | T261: FOTHERINGHAM
A263: WERRIBEE | C263: 2 | D263: 2 | E263: =C263*6+D263 -> 14 | G263: 2 | H263: 2 | I263: =G263*6+H263 -> 14 | K263: 10 | L263: 9 | M263: =K263*6+L263 -> 69 | O263: 13 | P263: 13 | Q263: =O263*6+P263 -> 91 | S263: WAVERLEY
A264: WAVERLEY | C264: 0 | D264: 1 | E264: =C264*6+D264 -> 1 | G264: 2 | H264: 3 | I264: =G264*6+H264 -> 15 | K264: 6 | L264: 5 | M264: =K264*6+L264 -> 41 | O264: 11 | P264: 8 | Q264: =O264*6+P264 -> 74 | S264: OGSTON
A265: BEST PLAYERS
A266: WERRIBEE | C266: SIMMONS | F266: MENADUE | I266: WALSH | L266: GUDDE | O266: BREEN | R266: HUGHES
A267: WAVERLEY | C267: WILLIAMS | F267: W McDONALD | I267: K McDONALD | L267: PRITCHARD | O267: VENVILLE | R267: CSOTI
A268: GOALKICKERS
A269: WERRIBEE | C269: SIMMONS 3 | F269: REDENBACH 2 | I269: DOUGLAS 2 | K269: JACK 2 | M269: TAYLOR | O269: BREEN | Q269: VOLKERING | S269: MERCURI
A270: WAVERLEY | C270: DAVIES 2 | F270: ANGELIS 2 | H270: WILLIAMS | K270: HOLDSWORTH | N270: PRITCHARD | P270: SULLIVAN | R270: VENVILLE | T270: K McDONALD | W270: ALEXANDER
A272: NORTHCOTE | C272: 10 | D272: 7 | E272: =C272*6+D272 -> 67 | G272: 14 | H272: 10 | I272: =G272*6+H272 -> 94 | K272: 21 | L272: 20 | M272: =K272*6+L272 -> 146 | O272: 29 | P272: 22 | Q272: =O272*6+P272 -> 196 | S272: NORTHCOTE
A273: BOX HILL | C273: 2 | D273: 2 | E273: =C273*6+D273 -> 14 | G273: 8 | H273: 3 | I273: =G273*6+H273 -> 51 | K273: 10 | L273: 5 | M273: =K273*6+L273 -> 65 | O273: 15 | P273: 5 | Q273: =O273*6+P273 -> 95 | S273: CROXFORD
A274: BEST PLAYERS
A275: NORTHCOTE | C275: P RYAN | F275: McINTYRE | I275: M RYAN | L275: PEART | N275: HEPBURN | Q275: GRAHAM
A276: BOX HILL | C276: DICKENSON | F276: MARSHALL | I276: RICH | L276: LENNOX
A277: GOALKICKERS
A278: NORTHCOTE | C278: P RYAN 7 | F278: HEPBURN 5 | H278: GRAHAM 5 | K278: WATTS 4 | M278: ROULSTON 3 | O278: JURGENSTEIN 2 | R278: M RYAN | T278: McQUINN | V278: DILORIO
A279: BOX HILL | C279: RICH 4 | E279: KAINEY 3 | G279: McKENZIE 2 | J279: DICKENSON 2 | M279: CONNOLLY | O279: PETTIGREW | R279: CRUSE | T279: McNALLY
A281: WILLIAMSTOWN | C281: 6 | D281: 10 | E281: =C281*6+D281 -> 46 | G281: 11 | H281: 12 | I281: =G281*6+H281 -> 78 | K281: 18 | L281: 24 | M281: =K281*6+L281 -> 132 | O281: 27 | P281: 28 | Q281: =O281*6+P281 -> 190 | S281: SUNSHINE
A282: SUNSHINE | C282: 0 | D282: 1 | E282: =C282*6+D282 -> 1 | G282: 3 | H282: 8 | I282: =G282*6+H282 -> 26 | K282: 4 | L282: 8 | M282: =K282*6+L282 -> 32 | O282: 10 | P282: 11 | Q282: =O282*6+P282 -> 71 | S282: BUDGE
A283: BEST PLAYERS
A284: WILLIAMSTOWN | C284: TAYLOR | F284: GOETZ | I284: CUTAJAR | L284: JOHN | O284: McRAE | R284: KENNEDY
A285: SUNSHINE | C285: BROWN | F285: COCHIERELLA | I285: CLARKE | L285: BENSON | O285: D HUNT
A286: GOALKICKERS
A287: WILLIAMSTOWN | C287: COATES 6 | F287: JOHN 6 | H287: CHAPMAN 3 | K287: TAYLOR 3 | N287: PHILPOTT 3 | Q287: CUTAJAR 2 | S287: MONTEBRUNO 2 | W287: GOETZ | X287: SINNOTT
A288: SUNSHINE | C288: CHATTERTON 3 | F288: D HUNT 2 | I288: VELLA | K288: COCHIERELLA | N288: BENSON | P288: MILES | R288: WILLIAMS
A290: ROUND 7 | E290: 17TH MAY | J290: WEATHER | S290: PLAYED AT
D291: 1ST QTR | H291: 2ND QTR | L291: 3RD QTR | P291: FINAL | S291: OAKLEIGH
A292: OAKLEIGH | C292: 4 | D292: 9 | E292: =C292*6+D292 -> 33 | G292: 15 | H292: 11 | I292: =G292*6+H292 -> 101 | K292: 28 | L292: 18 | M292: =K292*6+L292 -> 186 | O292: 39 | P292: 22 | Q292: =O292*6+P292 -> 256 | S292: UMPIRE | X292: LADDER | AB292: ROUND | AD292: 7
A293: SUNSHINE | C293: 6 | D293: 3 | E293: =C293*6+D293 -> 39 | G293: 8 | H293: 6 | I293: =G293*6+H293 -> 54 | K293: 8 | L293: 7 | M293: =K293*6+L293 -> 55 | O293: 12 | P293: 8 | Q293: =O293*6+P293 -> 80 | S293: COLOSIMO
A294: BEST PLAYERS | W294: TEAM | X294: W | Y294: L | Z294: D | AA294: FOR | AB294: AGST | AC294: % | AD294: PTS
A295: OAKLEIGH | C295: McDONALD | F295: WOOD | I295: CURTAIN | L295: OTT | O295: TAYLOR | R295: WENN
A296: SUNSHINE | C296: COCHIERELLA | F296: WILLIAMS | I296: BROWN | L296: PRSTON | O296: PRICE | W296: CAMBERWELL | X296: 6 | Y296: 1 | Z296: 0 | AA296: 1125 | AB296: 641 | AC296: =(AA296*100)/AB296 -> 175.50702028081122 | AD296: =(X296*4)+(Z296*2) -> 24
A297: GOALKICKERS | P297: McDONNELL | W297: OAKLEIGH | X297: 5 | Y297: 2 | Z297: 0 | AA297: 1122 | AB297: 762 | AC297: =(AA297*100)/AB297 -> 147.24409448818898 | AD297: =(X297*4)+(Z297*2) -> 20
A298: OAKLEIGH | C298: McDONALD 11 | F298: WENN 8 | H298: WOOD 5 | J298: OTT 5 | K298: CURTAIN 3 | N298: TAYLOR 2 | P298: GILL 2 | R298: THOMAS | T298: WALSH | W298: MORDIALLOC | X298: 5 | Y298: 2 | Z298: 0 | AA298: 975 | AB298: 752 | AC298: =(AA298*100)/AB298 -> 129.65425531914894 | AD298: =(X298*4)+(Z298*2) -> 20
A299: SUNSHINE | C299: N/A | W299: WERRIBEE | X299: 4 | Y299: 2 | Z299: 1 | AA299: 952 | AB299: 689 | AC299: =(AA299*100)/AB299 -> 138.17126269956458 | AD299: =(X299*4)+(Z299*2) -> 18
A301: WAVERLEY | C301: 2 | D301: 3 | E301: =C301*6+D301 -> 15 | G301: 8 | H301: 7 | I301: =G301*6+H301 -> 55 | K301: 10 | L301: 9 | M301: =K301*6+L301 -> 69 | O301: 18 | P301: 14 | Q301: =O301*6+P301 -> 122 | S301: MORDIALLOC | W301: WILLIAMSTOWN | X301: 4 | Y301: 2 | Z301: 1 | AA301: 949 | AB301: 763 | AC301: =(AA301*100)/AB301 -> 124.37745740498035 | AD301: =(X301*4)+(Z301*2) -> 18
A302: MORDIALLOC | C302: 4 | D302: 3 | E302: =C302*6+D302 -> 27 | G302: 5 | H302: 7 | I302: =G302*6+H302 -> 37 | K302: 12 | L302: 13 | M302: =K302*6+L302 -> 85 | O302: 14 | P302: 15 | Q302: =O302*6+P302 -> 99 | S302: FITZPATRICK | W302: WAVERLEY | X302: 4 | Y302: 3 | Z302: 0 | AA302: 992 | AB302: 700 | AC302: =(AA302*100)/AB302 -> 141.71428571428572 | AD302: =(X302*4)+(Z302*2) -> 16
A303: BEST PLAYERS | W303: NORTHCOTE | X303: 4 | Y303: 3 | Z303: 0 | AA303: 821 | AB303: 855 | AC303: =(AA303*100)/AB303 -> 96.023391812865498 | AD303: =(X303*4)+(Z303*2) -> 16
A304: WAVERLEY | C304: B WILLIAMS | F304: VENVILLE | I304: BEDDOE | L304: W McDONALD | O304: CLARKE | R304: K McDONALD | W304: YARRAVILLE | X304: 1 | Y304: 6 | Z304: 0 | AA304: 729 | AB304: 1039 | AC304: =(AA304*100)/AB304 -> 70.163618864292587 | AD304: =(X304*4)+(Z304*2) -> 4
A305: MORDIALLOC | C305: WALSH | E305: PETER BARDOEL | I305: MASON | L305: GUY | N305: BATTY | W305: BOX HILL | X305: 1 | Y305: 6 | Z305: 0 | AA305: 652 | AB305: 1144 | AC305: =(AA305*100)/AB305 -> 56.993006993006993 | AD305: =(X305*4)+(Z305*2) -> 4
A306: GOALKICKERS | W306: SUNSHINE | X306: 0 | Y306: 7 | Z306: 0 | AA306: 499 | AB306: 1450 | AC306: =(AA306*100)/AB306 -> 34.413793103448278 | AD306: =(X306*4)+(Z306*2) -> 0
A307: WAVERLEY | C307: ANGELIS 5 | F307: VENVILLE 5 | I307: BEDDOE 3 | K307: McLURE 2 | N307: LOVELL | P307: B WILLIAMS | S307: SULLIVAN
A308: MORDIALLOC | C308: BOURNE 3 | F308: ROGERSON 3 | I308: DEATON 2 | K308: PETER BARDOEL 2 | O308: PAGNOCCOLO 2 | R308: PARKER | T308: PETERS
A310: CAMBERWELL | C310: 7 | D310: 3 | E310: =C310*6+D310 -> 45 | G310: 15 | H310: 6 | I310: =G310*6+H310 -> 96 | K310: 19 | L310: 11 | M310: =K310*6+L310 -> 125 | O310: 24 | P310: 18 | Q310: =O310*6+P310 -> 162 | S310: BOX HILL
A311: BOX HILL | C311: 5 | D311: 1 | E311: =C311*6+D311 -> 31 | G311: 6 | H311: 3 | I311: =G311*6+H311 -> 39 | K311: 10 | L311: 6 | M311: =K311*6+L311 -> 66 | O311: 10 | P311: 7 | Q311: =O311*6+P311 -> 67 | S311: HUTCHISON
A312: BEST PLAYERS
A313: CAMBERWELL | C313: HOWARD | F313: OLIVER | I313: TEAKEL | L313: McFEE | O313: TAYLOR | R313: STEVENSON
A314: BOX HILL | C314: PETTIGREW | F314: RICH | I314: ROBINSON | L314: CONNOLLY | O314: HARPER | R314: DAVIS
A315: GOALKICKERS
A316: CAMBERWELL | C316: STEVENSON 10 | F316: HOWARD 4 | I316: DAVIDSON 3 | L316: ASHTON 3 | N316: HAMMOND | Q316: TAYLOR | S316: ROURKE | V316: HIRST
A317: BOX HILL | C317: HALE 2 | E317: KAINEY 2 | G317: DICKENSON | J317: LENNOX | L317: McKENZIE | N317: McNALLY | P317: PICKETT | R317: PENROSE
A319: WERRIBEE | C319: 6 | D319: 5 | E319: =C319*6+D319 -> 41 | G319: 13 | H319: 9 | I319: =G319*6+H319 -> 87 | K319: 16 | L319: 19 | M319: =K319*6+L319 -> 115 | O319: 22 | P319: 22 | Q319: =O319*6+P319 -> 154 | S319: WERRIBEE
A320: YARAVILLE | C320: 3 | D320: 2 | E320: =C320*6+D320 -> 20 | G320: 5 | H320: 6 | I320: =G320*6+H320 -> 36 | K320: 6 | L320: 7 | M320: =K320*6+L320 -> 43 | O320: 11 | P320: 16 | Q320: =O320*6+P320 -> 82 | S320: McBAIN
A321: BEST PLAYERS
A322: WERRIBEE | C322: WALSH | F322: HUGHES | I322: REDENBACH | L322: DOUGLAS | O322: LANCASTER | R322: JACK
A323: YARAVILLE | C323: SQUIRE | F323: McGHIE | I323: FOTHERINGHAM | L323: GRAY | O323: SIMPSON | R323: BROWN
A324: GOALKICKERS
A325: WERRIBEE | C325: DOUGLAS 7 | F325: WALSH 4 | H325: SIMMONS 3 | K325: HUGHES 2 | N325: PRICE 2 | P325: LANCASTER | S325: TAYLOR | U325: LEECE
A326: YARAVILLE | C326: FOTHERINGHAM 4 | G326: SMITH 2 | I326: LEITCH | K326: DUDDERIDGE | N326: RYAN | P326: NORRIS | R326: PRIEST
A328: NORTHCOTE | C328: 5 | D328: 4 | E328: =C328*6+D328 -> 34 | G328: 6 | H328: 5 | I328: =G328*6+H328 -> 41 | K328: 13 | L328: 8 | M328: =K328*6+L328 -> 86 | O328: 15 | P328: 9 | Q328: =O328*6+P328 -> 99 | S328: WILLIAMSTOWN
A329: WILLIAMSTOWN | C329: 0 | D329: 2 | E329: =C329*6+D329 -> 2 | G329: 6 | H329: 10 | I329: =G329*6+H329 -> 46 | K329: 9 | L329: 12 | M329: =K329*6+L329 -> 66 | O329: 11 | P329: 17 | Q329: =O329*6+P329 -> 83 | S329: WILSON
A330: BEST PLAYERS
A331: NORTHCOTE | C331: JURGENSTEIN | F331: HEPBURN | I331: MEGNA | L331: McINTYRE | O331: P RYAN
A332: WILLIAMSTOWN | C332: JONES | F332: EUDEY | I332: L TAYLOR | L332: M TAYLOR | O332: CUTAJAR | R332: JOHN
A333: GOALKICKERS
A334: NORTHCOTE | C334: HEPBURN 6 | F334: G RYAN 2 | I334: MEGNA 2 | K334: JURGENSTEIN 2 | N334: M RYAN | P334: WEIGHTMAN | S334: P RYAN
A335: WILLIAMSTOWN | C335: FAIRLEY 4 | F335: GANNON 2 | I335: JOHN 2 | K335: M TAYLOR | N335: EUDEY | P335: BEBEND
A337: ROUND 8 | E337: 24TH MAY | J337: WEATHER | S337: PLAYED AT
D338: 1ST QTR | H338: 2ND QTR | L338: 3RD QTR | P338: FINAL | S338: CAMBERWELL
A339: CAMBERWELL | C339: 4 | D339: 1 | E339: =C339*6+D339 -> 25 | G339: 9 | H339: 2 | I339: =G339*6+H339 -> 56 | K339: 17 | L339: 4 | M339: =K339*6+L339 -> 106 | O339: 24 | P339: 10 | Q339: =O339*6+P339 -> 154 | S339: UMPIRE | X339: LADDER | AB339: ROUND | AD339: 8
A340: WILLIAMSTOWN | C340: 7 | D340: 6 | E340: =C340*6+D340 -> 48 | G340: 11 | H340: 9 | I340: =G340*6+H340 -> 75 | K340: 14 | L340: 13 | M340: =K340*6+L340 -> 97 | O340: 15 | P340: 18 | Q340: =O340*6+P340 -> 108 | S340: STEERE
A341: BEST PLAYERS | W341: TEAM | X341: W | Y341: L | Z341: D | AA341: FOR | AB341: AGST | AC341: % | AD341: PTS
A342: CAMBERWELL | C342: OLIVER | F342: HIRST | I342: WRIGHT | L342: JUDD | N342: CHAMBERLAIN | R342: HAMMOND
A343: WILLIAMSTOWN | C343: GOETZ | F343: KENNEDY | I343: FAIRLEY | L343: MONTEBRUNO | O343: BEBEND | R343: MILLER | W343: CAMBERWELL | X343: 7 | Y343: 1 | Z343: 0 | AA343: 1279 | AB343: 749 | AC343: =(AA343*100)/AB343 -> 170.76101468624833 | AD343: =(X343*4)+(Z343*2) -> 28
A344: GOALKICKERS | W344: MORDIALLOC | X344: 6 | Y344: 2 | Z344: 0 | AA344: 1094 | AB344: 826 | AC344: =(AA344*100)/AB344 -> 132.44552058111381 | AD344: =(X344*4)+(Z344*2) -> 24
A345: CAMBERWELL | C345: STEVENSON 6 | F345: HIRST 6 | H345: HAMMOND 4 | K345: DAVIDSON 3 | N345: ROURKE 2 | P345: JUDD | R345: TAYLOR | T345: HOWARD | W345: WERRIBEE | X345: 5 | Y345: 2 | Z345: 1 | AA345: 1094 | AB345: 788 | AC345: =(AA345*100)/AB345 -> 138.83248730964468 | AD345: =(X345*4)+(Z345*2) -> 22
A346: WILLIAMSTOWN | C346: MONTEBRUNO 4 | G346: COATES 3 | J346: JOHN 3 | L346: EUDEY 2 | N346: FAIRLEY | P346: KELLY | R346: JONES | W346: WAVERLEY | X346: 5 | Y346: 3 | Z346: 0 | AA346: 1233 | AB346: 761 | AC346: =(AA346*100)/AB346 -> 162.02365308804204 | AD346: =(X346*4)+(Z346*2) -> 20
A348: MORDIALLOC | C348: 3 | D348: 6 | E348: =C348*6+D348 -> 24 | G348: 9 | H348: 11 | I348: =G348*6+H348 -> 65 | K348: 11 | L348: 15 | M348: =K348*6+L348 -> 81 | O348: 16 | P348: 23 | Q348: =O348*6+P348 -> 119 | S348: YARRAVILLE | W348: OAKLEIGH | X348: 5 | Y348: 3 | Z348: 0 | AA348: 1221 | AB348: 904 | AC348: =(AA348*100)/AB348 -> 135.06637168141592 | AD348: =(X348*4)+(Z348*2) -> 20
A349: YARRAVILLE | C349: 1 | D349: 1 | E349: =C349*6+D349 -> 7 | G349: 4 | H349: 4 | I349: =G349*6+H349 -> 28 | K349: 7 | L349: 10 | M349: =K349*6+L349 -> 52 | O349: 10 | P349: 14 | Q349: =O349*6+P349 -> 74 | S349: BLOOM | W349: NORTHCOTE | X349: 5 | Y349: 3 | Z349: 0 | AA349: 1030 | AB349: 914 | AC349: =(AA349*100)/AB349 -> 112.69146608315098 | AD349: =(X349*4)+(Z349*2) -> 20
A350: BEST PLAYERS | W350: WILLIAMSTOWN | X350: 4 | Y350: 3 | Z350: 1 | AA350: 1057 | AB350: 917 | AC350: =(AA350*100)/AB350 -> 115.26717557251908 | AD350: =(X350*4)+(Z350*2) -> 18
A351: MORDIALLOC | C351: PETER BARDOEL | F351: GUY | I351: DUNBAR | L351: MASON | O351: ROGERSON | R351: PARKER | W351: YARRAVILLE | X351: 1 | Y351: 7 | Z351: 0 | AA351: 803 | AB351: 1158 | AC351: =(AA351*100)/AB351 -> 69.343696027633854 | AD351: =(X351*4)+(Z351*2) -> 4
A352: YARRAVILLE | C352: McGHIE | F352: GRAY | I352: SQUIRE | L352: SIMPSON | O352: FOTHERINGHAM | S352: BROWN | W352: BOX HILL | X352: 1 | Y352: 7 | Z352: 0 | AA352: 713 | AB352: 1385 | AC352: =(AA352*100)/AB352 -> 51.48014440433213 | AD352: =(X352*4)+(Z352*2) -> 4
A353: GOALKICKERS | W353: SUNSHINE | X353: 0 | Y353: 8 | Z353: 0 | AA353: 558 | AB353: 1659 | AC353: =(AA353*100)/AB353 -> 33.634719710669074 | AD353: =(X353*4)+(Z353*2) -> 0
A354: MORDIALLOC | C354: BOURNE 3 | E354: MOORE 2 | G354: PARKER 2 | I354: WALSH 2 | K354: PETERS 2 | M354: DANIELS | O354: DEATON | Q354: CRITCH | S354: PAGNOCCOLO
A355: YARRAVILLE | C355: FOTHERINGHAM 3 | G355: DUDDERIDGE 2 | J355: SMITH 2 | L355: PRIEST | N355: GRAY | P355: LEITCH
A357: WERRIBEE | C357: 6 | D357: 7 | E357: =C357*6+D357 -> 43 | G357: 10 | H357: 10 | I357: =G357*6+H357 -> 70 | K357: 13 | L357: 13 | M357: =K357*6+L357 -> 91 | O357: 21 | P357: 16 | Q357: =O357*6+P357 -> 142 | S357: WERRIBEE
A358: OAKLEIGH | C358: 3 | D358: 1 | E358: =C358*6+D358 -> 19 | G358: 7 | H358: 1 | I358: =G358*6+H358 -> 43 | K358: 13 | L358: 4 | M358: =K358*6+L358 -> 82 | O358: 15 | P358: 9 | Q358: =O358*6+P358 -> 99 | S358: OAKLEY
A359: BEST PLAYERS
A360: WERRIBEE | C360: TAYLOR | F360: GREEN | I360: WALSH | L360: LANCASTER | O360: HUGHES | R360: PARKES
A361: OAKLEIGH | C361: HEVERIN | F361: WENN | I361: BATTERSBY | L361: MATTHET | O361: McDONNELL | R361: CURTAIN
A362: GOALKICKERS | C362: 3 SHORT
A363: WERRIBEE | C363: LEECE 4 | E363: WALSH 3 | G363: TAYLOR 3 | J363: SIMMONS 2 | M363: GREEN | O363: SIDEROW | Q363: PRICE | S363: FREEMAN | V363: ASLING | X363: PARKES
A364: OAKLEIGH | C364: THOMAS 5 | F364: WOOD 3 | H364: McDONNELL 2 | K364: HEVERIN 2 | N364: PLUMB | P364: WENN | R364: CURTAIN
A366: WAVERLEY | C366: 7 | D366: 6 | E366: =C366*6+D366 -> 48 | G366: 16 | H366: 10 | I366: =G366*6+H366 -> 106 | K366: 28 | L366: 17 | M366: =K366*6+L366 -> 185 | O366: 36 | P366: 25 | Q366: =O366*6+P366 -> 241 | S366: WAVERLEY
A367: BOX HILL | C367: 2 | D367: 0 | E367: =C367*6+D367 -> 12 | G367: 5 | H367: 4 | I367: =G367*6+H367 -> 34 | K367: 7 | L367: 6 | M367: =K367*6+L367 -> 48 | O367: 9 | P367: 7 | Q367: =O367*6+P367 -> 61 | S367: TORNEY
A368: BEST PLAYERS
A369: WAVERLEY | C369: K McDONALD | F369: HOLDSWORTH | I369: DAVIES | L369: ANGELIS | O369: VENVILLE | R369: STYLES
A370: BOX HILL | C370: TAYLOR | F370: RICH | I370: MARSHALL | L370: SMITH | O370: KAINEY
A371: GOALKICKERS | C371: 2 SHORT
A372: WAVERLEY | C372: ANGELIS 10 | F372: DAVIES 7 | H372: VENVILLE 4 | K372: K McDONALD 3 | N372: LOVELL 3 | P372: HOLDSWORTH 2 | S372: STYLES 2 | U372: SULLIVAN | W372: CHALKER | X372: WILLIAMS
A373: BOX HILL | C373: MARSHALL 3 | F373: KAINEY 2 | I373: FARRUGIA 2 | L373: RICH | N373: CROTHERS
A375: NORTHCOTE | C375: 9 | D375: 7 | E375: =C375*6+D375 -> 61 | G375: 18 | H375: 11 | I375: =G375*6+H375 -> 119 | K375: 27 | L375: 19 | M375: =K375*6+L375 -> 181 | O375: 31 | P375: 23 | Q375: =O375*6+P375 -> 209 | S375: NORTHCOTE
A376: SUNSHINE | C376: 1 | D376: 1 | E376: =C376*6+D376 -> 7 | G376: 3 | H376: 3 | I376: =G376*6+H376 -> 21 | K376: 4 | L376: 4 | M376: =K376*6+L376 -> 28 | O376: 9 | P376: 5 | Q376: =O376*6+P376 -> 59 | S376: HUTCHISON
A377: BEST PLAYERS
A378: NORTHCOTE | C378: P RYAN | F378: PEART | I378: M RYAN | L378: MEGNA | O378: EDWARDS | R378: GRAHAM
A379: SUNSHINE | C379: WILLIAMS | F379: PRICE | I379: PRESTON | L379: CALLANDER | O379: COCHIERELLA | R379: ORMSTON
A380: GOALKICKERS
A381: NORTHCOTE | C381: P RYAN 8 | F381: HEPBURN 7 | H381: GRAHAM 6 | J381: MEGNA 2 | L381: JURGENSTEIN 2 | O381: EDWARDS 2 | R381: MINNETT 2 | U381: DILORIO | W381: M RYAN
A382: SUNSHINE | C382: WILLIAMS 3 | F382: MENADUE 2 | I382: CALLANDER 2 | L382: BENSON | N382: CHATTERTON
A384: ROUND 9 | E384: 31ST MAY | J384: WEATHER | S384: PLAYED AT
D385: 1ST QTR | H385: 2ND QTR | L385: 3RD QTR | P385: FINAL | S385: MORDIALLOC
A386: MORDIALLOC | C386: 5 | D386: 0 | E386: =C386*6+D386 -> 30 | G386: 8 | H386: 2 | I386: =G386*6+H386 -> 50 | K386: 11 | L386: 6 | M386: =K386*6+L386 -> 72 | O386: 16 | P386: 8 | Q386: =O386*6+P386 -> 104 | S386: UMPIRE | X386: LADDER | AB386: ROUND | AD386: 9
A387: WERRIBEE | C387: 4 | D387: 4 | E387: =C387*6+D387 -> 28 | G387: 6 | H387: 6 | I387: =G387*6+H387 -> 42 | K387: 9 | L387: 8 | M387: =K387*6+L387 -> 62 | O387: 14 | P387: 13 | Q387: =O387*6+P387 -> 97 | S387: GROOM
A388: BEST PLAYERS | W388: TEAM | X388: W | Y388: L | Z388: D | AA388: FOR | AB388: AGST | AC388: % | AD388: PTS
A389: MORDIALLOC | C389: WALSH | F389: ROGERSON | I389: PETER BARDOEL | M389: PARKER | O389: BOURNE | R389: CRITCH
A390: WERRIBEE | C390: WALSH | F390: LANCASTER | I390: REDENBACH | M390: JACK | O390: PARKES | W390: CAMBERWELL | X390: 8 | Y390: 1 | Z390: 0 | AA390: 1415 | AB390: 838 | AC390: =(AA390*100)/AB390 -> 168.85441527446301 | AD390: =(X390*4)+(Z390*2) -> 32
A391: GOALKICKERS | W391: MORDIALLOC | X391: 7 | Y391: 2 | Z391: 0 | AA391: 1198 | AB391: 923 | AC391: =(AA391*100)/AB391 -> 129.79414951245937 | AD391: =(X391*4)+(Z391*2) -> 28
A392: MORDIALLOC | C392: BOURNE 7 | F392: PARKER 3 | I392: MOORE 2 | K392: ROGERSON 2 | N392: WALSH | P392: PETER BARDOEL | W392: WAVERLEY | X392: 6 | Y392: 3 | Z392: 0 | AA392: 1411 | AB392: 853 | AC392: =(AA392*100)/AB392 -> 165.41617819460726 | AD392: =(X392*4)+(Z392*2) -> 24
A393: WERRIBEE | C393: JACK 3 | E393: LEECE 3 | G393: WALSH 2 | I393: ROGERSON 2 | L393: PRICE 2 | N393: PARKES | P393: SIDEROW | W393: OAKLEIGH | X393: 6 | Y393: 3 | Z393: 0 | AA393: 1384 | AB393: 994 | AC393: =(AA393*100)/AB393 -> 139.23541247484908 | AD393: =(X393*4)+(Z393*2) -> 24
A395: YARRAVILLE | C395: 6 | D395: 5 | E395: =C395*6+D395 -> 41 | G395: 12 | H395: 9 | I395: =G395*6+H395 -> 81 | K395: 17 | L395: 21 | M395: =K395*6+L395 -> 123 | O395: 24 | P395: 25 | Q395: =O395*6+P395 -> 169 | S395: BOX HILL | W395: WERRIBEE | X395: 5 | Y395: 3 | Z395: 1 | AA395: 1191 | AB395: 892 | AC395: =(AA395*100)/AB395 -> 133.5201793721973 | AD395: =(X395*4)+(Z395*2) -> 22
A396: BOX HILL | C396: 7 | D396: 2 | E396: =C396*6+D396 -> 44 | G396: 13 | H396: 5 | I396: =G396*6+H396 -> 83 | K396: 15 | L396: 7 | M396: =K396*6+L396 -> 97 | O396: 19 | P396: 11 | Q396: =O396*6+P396 -> 125 | S396: STEERE | W396: NORTHCOTE | X396: 5 | Y396: 4 | Z396: 0 | AA396: 1120 | AB396: 1077 | AC396: =(AA396*100)/AB396 -> 103.99257195914578 | AD396: =(X396*4)+(Z396*2) -> 20
A397: BEST PLAYERS | W397: WILLIAMSTOWN | X397: 4 | Y397: 4 | Z397: 1 | AA397: 1149 | AB397: 1095 | AC397: =(AA397*100)/AB397 -> 104.93150684931507 | AD397: =(X397*4)+(Z397*2) -> 18
A398: YARRAVILLE | C398: MARTIN | F398: SMITH | I398: McMAHON | L398: LEITCH | N398: GRAY | W398: YARRAVILLE | X398: 2 | Y398: 7 | Z398: 0 | AA398: 972 | AB398: 1283 | AC398: =(AA398*100)/AB398 -> 75.75993764614185 | AD398: =(X398*4)+(Z398*2) -> 8
A399: BOX HILL | C399: CRUSE | F399: HALE | I399: CAREY | L399: HARPER | N399: CONNOLLY | W399: BOX HILL | X399: 1 | Y399: 8 | Z399: 0 | AA399: 838 | AB399: 1554 | AC399: =(AA399*100)/AB399 -> 53.925353925353924 | AD399: =(X399*4)+(Z399*2) -> 4
A400: GOALKICKERS | W400: SUNSHINE | X400: 0 | Y400: 9 | Z400: 0 | AA400: 647 | AB400: 1795 | AC400: =(AA400*100)/AB400 -> 36.044568245125348 | AD400: =(X400*4)+(Z400*2) -> 0
A401: YARRAVILLE | C401: SMITH 7 | E401: LEITCH 5 | G401: MARTIN 4 | I401: GRAY 3 | K401: ROGOWICZ 2 | N401: BROWN | P401: PRIEST | R401: McMAHON
A402: BOX HILL | C402: WITHERS 4 | F402: SMITH 4 | H402: MARSHALL 3 | K402: RICH 2 | M402: PICKETT 2 | O402: KAINEY | Q402: CONNOLLY | S402: HALE | U402: LAWTHER
A404: WAVERLEY | C404: 5 | D404: 2 | E404: =C404*6+D404 -> 32 | G404: 11 | H404: 6 | I404: =G404*6+H404 -> 72 | K404: 17 | L404: 10 | M404: =K404*6+L404 -> 112 | O404: 27 | P404: 16 | Q404: =O404*6+P404 -> 178 | S404: WILLIAMSTOWN
A405: WILLIAMSTOWN | C405: 1 | D405: 5 | E405: =C405*6+D405 -> 11 | G405: 2 | H405: 6 | I405: =G405*6+H405 -> 18 | K405: 10 | L405: 8 | M405: =K405*6+L405 -> 68 | O405: 14 | P405: 8 | Q405: =O405*6+P405 -> 92 | S405: HUTCHISON
A406: BEST PLAYERS
A407: WAVERLEY | C407: DAVIES | F407: VENVILLE | I407: HOLDSWORTH | L407: CSOTI | O407: KINNABURGH | R407: LOVELL
A408: WILLIAMSTOWN | C408: KELLY | F408: FAIRLEY | I408: BEBEND | L408: T PHILPOTT | O408: MONTEBRUNO | R408: L TAYLOR
A409: GOALKICKERS
A410: WAVERLEY | C410: ANGELIS 8 | F410: DAVIES 5 | H410: VENVILLE 3 | K410: WILLIAMS 3 | N410: McLURE 3 | P410: BEDDOE 2 | R410: STYLES 2 | T410: CARLSON
A411: WILLIAMSTOWN | C411: FAIRLEY 5 | F411: KELLY 3 | H411: COATES 2 | K411: EUDEY | M411: JOHN | O411: CUTAJAR | R411: MONTEBRUNO
A413: CAMBERWELL | C413: 3 | D413: 4 | E413: =C413*6+D413 -> 22 | G413: 7 | H413: 11 | I413: =G413*6+H413 -> 53 | K413: 11 | L413: 23 | M413: =K413*6+L413 -> 89 | O413: 17 | P413: 34 | Q413: =O413*6+P413 -> 136 | S413: SUNSHINE
A414: SUNSHINE | C414: 6 | D414: 3 | E414: =C414*6+D414 -> 39 | G414: 11 | H414: 5 | I414: =G414*6+H414 -> 71 | K414: 13 | L414: 9 | M414: =K414*6+L414 -> 87 | O414: 13 | P414: 11 | Q414: =O414*6+P414 -> 89 | S414: WILSON
A415: BEST PLAYERS
A416: CAMBERWELL | C416: WRIGHT | F416: JUDD | I416: STEVENSON | L416: DAVIDSON | O416: HOWARD | R416: TEAKEL
A417: SUNSHINE | C417: BROWN | F417: DAVIS | I417: HUNT | L417: CLARKE | O417: MENADUE | R417: WILLIAMS
A418: GOALKICKERS
A419: CAMBERWELL | C419: STEVENSON 6 | F419: DAVIDSON 5 | I419: HAMMOND 3 | L419: ROURKE 2 | O419: JUDD
A420: SUNSHINE | C420: MENADUE 6 | F420: GROSSMAN 2 | I420: MANEY 2 | K420: BROWN 2 | N420: COCHIERELLA
E421: 7TH JUNE | I421: WEATHER
A422: OAKLEIGH | C422: 5 | D422: 7 | E422: =C422*6+D422 -> 37 | G422: 10 | H422: 12 | I422: =G422*6+H422 -> 72 | K422: 14 | L422: 13 | M422: =K422*6+L422 -> 97 | O422: 24 | P422: 19 | Q422: =O422*6+P422 -> 163 | S422: OAKLEIGH
A423: NORTHCOTE | C423: 3 | D423: 3 | E423: =C423*6+D423 -> 21 | G423: 10 | H423: 8 | I423: =G423*6+H423 -> 68 | K423: 11 | L423: 11 | M423: =K423*6+L423 -> 77 | O423: 12 | P423: 18 | Q423: =O423*6+P423 -> 90 | S423: STABB
A424: BEST PLAYERS
A425: OAKLEIGH | C425: MATTHEY | F425: WENN | I425: THOMAS | L425: TAYLOR | O425: McDONALD | R425: WOOD
A426: NORTHCOTE | C426: MEGNA | F426: PEART | I426: JURGENSTEIN | L426: M RYAN | O426: HEPBURN | R426: DILORIO
A427: GOALKICKERS
A428: OAKLEIGH | C428: THOMAS 7 | F428: WENN 4 | H428: TAYLOR 3 | J428: McDONALD 3 | M428: WOOD 3 | O428: C HEVERIN 2 | R428: OWEN 2
A429: NORTHCOTE | C429: HEPBURN 5 | F429: P RYAN 3 | I429: M RYAN | K429: JURGENSTEIN | N429: MEGNA | P429: MINNETT
A431: ROUND 10 | E431: 7TH JUNE | J431: WEATHER | S431: PLAYED AT
D432: 1ST QTR | H432: 2ND QTR | L432: 3RD QTR | P432: FINAL | S432: WILLIAMSTOWN
A433: WILLIAMSTOWN | C433: 6 | D433: 3 | E433: =C433*6+D433 -> 39 | G433: 11 | H433: 6 | I433: =G433*6+H433 -> 72 | K433: 18 | L433: 8 | M433: =K433*6+L433 -> 116 | O433: 22 | P433: 14 | Q433: =O433*6+P433 -> 146 | S433: UMPIRE | X433: LADDER | AB433: ROUND | AD433: 10
A434: YARRAVILLE | C434: 5 | D434: 5 | E434: =C434*6+D434 -> 35 | G434: 8 | H434: 9 | I434: =G434*6+H434 -> 57 | K434: 13 | L434: 11 | M434: =K434*6+L434 -> 89 | O434: 18 | P434: 15 | Q434: =O434*6+P434 -> 123 | S434: OGSTON
A435: BEST PLAYERS | W435: TEAM | X435: W | Y435: L | Z435: D | AA435: FOR | AB435: AGST | AC435: % | AD435: PTS
A436: WILLIAMSTOWN | C436: KELLY | F436: BEBEND | I436: JONES | K436: SMITH | N436: FAIRLEY | Q436: MILLER
A437: YARRAVILLE | C437: GRAY | F437: B SMITH | I437: BROWN | K437: SQUIRE | N437: SAMPSON | Q437: MARTIN | W437: CAMBERWELL | X437: 8 | Y437: 2 | Z437: 0 | AA437: 1474 | AB437: 902 | AC437: =(AA437*100)/AB437 -> 163.41463414634146 | AD437: =(X437*4)+(Z437*2) -> 32
A438: GOALKICKERS | W438: WAVERLEY | X438: 7 | Y438: 3 | Z438: 0 | AA438: 1598 | AB438: 886 | AC438: =(AA438*100)/AB438 -> 180.36117381489842 | AD438: =(X438*4)+(Z438*2) -> 28
A439: WILLIAMSTOWN | C439: BEBEND 4 | F439: JONES 4 | H439: FAIRLEY 3 | J439: GILDAY 3 | L439: KELLY 2 | N439: SMITH 2 | P439: EUDEY 2 | R439: GOETZ | T439: JOHN | W439: OAKLEIGH | X439: 7 | Y439: 3 | Z439: 0 | AA439: 1465 | AB439: 1066 | AC439: =(AA439*100)/AB439 -> 137.42964352720449 | AD439: =(X439*4)+(Z439*2) -> 28
A440: YARRAVILLE | C440: B SMITH 7 | F440: GRAY 3 | H440: FOTHERINGHAM 3 | L440: McMAHON 2 | O440: LEITCH 2 | R440: SAMPSON | W440: MORDIALLOC | X440: 7 | Y440: 3 | Z440: 0 | AA440: 1270 | AB440: 1004 | AC440: =(AA440*100)/AB440 -> 126.49402390438247 | AD440: =(X440*4)+(Z440*2) -> 28
A442: OAKLEIGH | C442: 5 | D442: 2 | E442: =C442*6+D442 -> 32 | G442: 8 | H442: 5 | I442: =G442*6+H442 -> 53 | K442: 10 | L442: 8 | M442: =K442*6+L442 -> 68 | O442: 12 | P442: 9 | Q442: =O442*6+P442 -> 81 | S442: OAKLEIGH | W442: WERRIBEE | X442: 6 | Y442: 3 | Z442: 1 | AA442: 1299 | AB442: 960 | AC442: =(AA442*100)/AB442 -> 135.3125 | AD442: =(X442*4)+(Z442*2) -> 26
A443: MORDIALLOC | C443: 3 | D443: 2 | E443: =C443*6+D443 -> 20 | G443: 6 | H443: 5 | I443: =G443*6+H443 -> 41 | K443: 7 | L443: 12 | M443: =K443*6+L443 -> 54 | O443: 9 | P443: 18 | Q443: =O443*6+P443 -> 72 | S443: WILSON | W443: NORTHCOTE | X443: 6 | Y443: 4 | Z443: 0 | AA443: 1184 | AB443: 1136 | AC443: =(AA443*100)/AB443 -> 104.22535211267606 | AD443: =(X443*4)+(Z443*2) -> 24
A444: BEST PLAYERS | W444: WILLIAMSTOWN | X444: 5 | Y444: 4 | Z444: 1 | AA444: 1295 | AB444: 1218 | AC444: =(AA444*100)/AB444 -> 106.32183908045977 | AD444: =(X444*4)+(Z444*2) -> 22
A445: OAKLEIGH | C445: MATTHEY | F445: HARTLEY | I445: COLLINS | L445: WENN | O445: TAYLOR | R445: GILL | W445: YARRAVILLE | X445: 2 | Y445: 8 | Z445: 0 | AA445: 1095 | AB445: 1429 | AC445: =(AA445*100)/AB445 -> 76.627011896431071 | AD445: =(X445*4)+(Z445*2) -> 8
A446: MORDIALLOC | C446: DUNBAR | F446: ROGERSON | I446: WALSH | L446: PAGNOCCOLO | O446: CRITCH | W446: BOX HILL | X446: 1 | Y446: 9 | Z446: 0 | AA446: 906 | AB446: 1662 | AC446: =(AA446*100)/AB446 -> 54.512635379061372 | AD446: =(X446*4)+(Z446*2) -> 4
A447: GOALKICKERS | W447: SUNSHINE | X447: 0 | Y447: 10 | Z447: 0 | AA447: 680 | AB447: 1982 | AC447: =(AA447*100)/AB447 -> 34.308779011099901 | AD447: =(X447*4)+(Z447*2) -> 0
A448: OAKLEIGH | C448: WOOD 4 | F448: GILL 3 | H448: C HEVERIN 2 | K448: WENN 2 | M448: SPLATT | O448: McDONALD
A449: MORDIALLOC | C449: PAGNOCCOLO 2 | F449: ROGERSON 2 | I449: PETER BARDOEL | L449: PARKER | N449: WALSH | P449: MARGHERITI | S449: BOURKE
A451: WERRIBEE | C451: 3 | D451: 3 | E451: =C451*6+D451 -> 21 | G451: 6 | H451: 9 | I451: =G451*6+H451 -> 45 | K451: 12 | L451: 15 | M451: =K451*6+L451 -> 87 | O451: 15 | P451: 18 | Q451: =O451*6+P451 -> 108 | S451: BOX HILL
A452: BOX HILL | C452: 4 | D452: 0 | E452: =C452*6+D452 -> 24 | G452: 6 | H452: 0 | I452: =G452*6+H452 -> 36 | K452: 9 | L452: 1 | M452: =K452*6+L452 -> 55 | O452: 11 | P452: 2 | Q452: =O452*6+P452 -> 68 | S452: RYAN
A453: BEST PLAYERS
A454: WERRIBEE | C454: WALSH | F454: JACK | I454: LANCASTER | L454: ASLING | O454: HUGHES | R454: MITCHELL
A455: BOX HILL | C455: CRUSE | F455: DICKENSON | I455: HALE | L455: TAYLOR | O455: RICH
A456: GOALKICKERS
A457: WERRIBEE | C457: WILLIAMS 4 | F457: WALSH 2 | H457: VOLKERING 2 | K457: FREEMAN 2 | N457: DOUGLAS | P457: GREEN | R457: LANCASTER | U457: SIMMONS | W457: REDENBACH
A458: BOX HILL | C458: LAWTHER 5 | F458: WITHERS 5 | I458: CRUSE
A460: NORTHCOTE | C460: 2 | D460: 3 | E460: =C460*6+D460 -> 15 | G460: 3 | H460: 12 | I460: =G460*6+H460 -> 30 | K460: 4 | L460: 15 | M460: =K460*6+L460 -> 39 | O460: 8 | P460: 16 | Q460: =O460*6+P460 -> 64 | S460: NORTHCOTE
A461: CAMBERWELL | C461: 4 | D461: 3 | E461: =C461*6+D461 -> 27 | G461: 5 | H461: 3 | I461: =G461*6+H461 -> 33 | K461: 9 | L461: 5 | M461: =K461*6+L461 -> 59 | O461: 9 | P461: 5 | Q461: =O461*6+P461 -> 59 | S461: GRIFFITH
A462: BEST PLAYERS
A463: NORTHCOTE | C463: ARMSTRONG | F463: McINTYRE | I463: MEGNA | L463: BRAIN | O463: P RYAN | R463: DILORIO
A464: CAMBERWELL | C464: WRIGHT | F464: OLIVER | I464: R McFEE | L464: RICE | O464: COOK | R464: TEAKEL
A465: GOALKICKERS
A466: NORTHCOTE | C466: PHILLIPE 4 | F466: JURGENSTEIN 3 | I466: HEPBURN
A467: CAMBERWELL | C467: I McFEE 3 | F467: DAVIDSON 2 | I467: HIRST | K467: STEVENSON | N467: CHAMBERLAIN | Q467: OLIVER
A469: WAVERLEY | C469: 10 | D469: 9 | E469: =C469*6+D469 -> 69 | G469: 16 | H469: 13 | I469: =G469*6+H469 -> 109 | K469: 25 | L469: 22 | M469: =K469*6+L469 -> 172 | O469: 27 | P469: 25 | Q469: =O469*6+P469 -> 187 | S469: SUNSHINE
A470: SUNSHINE | C470: 0 | D470: 0 | E470: =C470*6+D470 -> 0 | G470: 2 | H470: 6 | I470: =G470*6+H470 -> 18 | K470: 2 | L470: 8 | M470: =K470*6+L470 -> 20 | O470: 4 | P470: 9 | Q470: =O470*6+P470 -> 33 | S470: BLOOM
A471: BEST PLAYERS
A472: WAVERLEY | C472: WILLIAMS | F472: STYLES | I472: McDONALD | L472: CSOTI | O472: HOLDSWORTH | R472: LOVELL
A473: SUNSHINE | C473: GROSSMAN | F473: BROWN | I473: DAVIS | L473: CHATTERTON | O473: MEREDITH
A474: GOALKICKERS
A475: WAVERLEY | C475: WILLIAMS 5 | F475: BEDDOE 5 | H475: VENVILLE 4 | K475: STYLES 4 | M475: ANGELIS 2 | O475: LOVELL | Q475: DAVIO | S475: R KINNABURGH | W475: G KINNABURGH | X475: McLURE | Z475: McDONALD | AB475: HOLDSWORTH
A476: SUNSHINE | C476: DAVIS 2 | F476: MEREDITH | I476: CHATTERTON
A478: ROUND 11 | E478: 21ST JUNE | J478: WEATHER | S478: PLAYED AT
D479: 1ST QTR | H479: 2ND QTR | L479: 3RD QTR | P479: FINAL | S479: CAMBERWELL
A480: CAMBERWELL | C480: 4 | D480: 2 | E480: =C480*6+D480 -> 26 | G480: 11 | H480: 3 | I480: =G480*6+H480 -> 69 | K480: 16 | L480: 8 | M480: =K480*6+L480 -> 104 | O480: 22 | P480: 10 | Q480: =O480*6+P480 -> 142 | S480: UMPIRE | X480: LADDER | AB480: ROUND | AD480: 11
A481: OAKLEIGH | C481: 3 | D481: 4 | E481: =C481*6+D481 -> 22 | G481: 7 | H481: 8 | I481: =G481*6+H481 -> 50 | K481: 9 | L481: 10 | M481: =K481*6+L481 -> 64 | O481: 13 | P481: 18 | Q481: =O481*6+P481 -> 96 | S481: CROXFORD
A482: BEST PLAYERS | W482: TEAM | X482: W | Y482: L | Z482: D | AA482: FOR | AB482: AGST | AC482: % | AD482: PTS
A483: CAMBERWELL | C483: HIRST | F483: OLIVER | I483: R McFEE | L483: WRIGHT | O483: DAVIDSON | R483: HOWARD
A484: OAKLEIGH | C484: MATTHEY | F484: GILL | I484: WENN | L484: THOMAS | O484: CURTAIN | R484: COLLINS | W484: CAMBERWELL | X484: 9 | Y484: 2 | Z484: 0 | AA484: 1616 | AB484: 998 | AC484: =(AA484*100)/AB484 -> 161.92384769539078 | AD484: =(X484*4)+(Z484*2) -> 36
A485: GOALKICKERS | W485: WAVERLEY | X485: 8 | Y485: 3 | Z485: 0 | AA485: 1714 | AB485: 962 | AC485: =(AA485*100)/AB485 -> 178.17047817047816 | AD485: =(X485*4)+(Z485*2) -> 32
A486: CAMBERWELL | C486: STEVENSON 9 | F486: HIRST 5 | H486: DAVIDSON 4 | K486: ROURKE 2 | N486: COOK | P486: OLIVER | W486: MORDIALLOC | X486: 8 | Y486: 3 | Z486: 0 | AA486: 1473 | AB486: 1074 | AC486: =(AA486*100)/AB486 -> 137.15083798882682 | AD486: =(X486*4)+(Z486*2) -> 32
A487: OAKLEIGH | C487: THOMAS 4 | F487: GILL 3 | H487: WOOD | J487: C HEVERIN | L487: CURTAIN | N487: McDONALD | Q487: LEMMONS | S487: COLLINS | W487: WERRIBEE | X487: 7 | Y487: 3 | Z487: 1 | AA487: 1453 | AB487: 1043 | AC487: =(AA487*100)/AB487 -> 139.30968360498562 | AD487: =(X487*4)+(Z487*2) -> 30
A489: MORDIALLOC | C489: 5 | D489: 5 | E489: =C489*6+D489 -> 35 | G489: 13 | H489: 12 | I489: =G489*6+H489 -> 90 | K489: 22 | L489: 16 | M489: =K489*6+L489 -> 148 | O489: 31 | P489: 17 | Q489: =O489*6+P489 -> 203 | S489: MORDIALLOC | W489: OAKLEIGH | X489: 7 | Y489: 4 | Z489: 0 | AA489: 1561 | AB489: 1208 | AC489: =(AA489*100)/AB489 -> 129.22185430463577 | AD489: =(X489*4)+(Z489*2) -> 28
A490: BOX HILL | C490: 2 | D490: 1 | E490: =C490*6+D490 -> 13 | G490: 5 | H490: 1 | I490: =G490*6+H490 -> 31 | K490: 8 | L490: 2 | M490: =K490*6+L490 -> 50 | O490: 11 | P490: 4 | Q490: =O490*6+P490 -> 70 | S490: VERGONA | W490: NORTHCOTE | X490: 6 | Y490: 5 | Z490: 0 | AA490: 1260 | AB490: 1252 | AC490: =(AA490*100)/AB490 -> 100.63897763578275 | AD490: =(X490*4)+(Z490*2) -> 24
A491: BEST PLAYERS | W491: WILLIAMSTOWN | X491: 5 | Y491: 5 | Z491: 1 | AA491: 1378 | AB491: 1372 | AC491: =(AA491*100)/AB491 -> 100.43731778425656 | AD491: =(X491*4)+(Z491*2) -> 22
A492: MORDIALLOC | C492: ROGERSON | F492: PETER BARDOEL | J492: BOURNE | M492: WARREN | P492: DEATON | R492: O'HANLON | W492: YARRAVILLE | X492: 3 | Y492: 8 | Z492: 0 | AA492: 1246 | AB492: 1485 | AC492: =(AA492*100)/AB492 -> 83.905723905723903 | AD492: =(X492*4)+(Z492*2) -> 12
A493: BOX HILL | C493: PETTIGREW | F493: DICKENSON | J493: CRUSE | M493: LENNOX | P493: HALE | W493: BOX HILL | X493: 1 | Y493: 10 | Z493: 0 | AA493: 976 | AB493: 1865 | AC493: =(AA493*100)/AB493 -> 52.332439678284182 | AD493: =(X493*4)+(Z493*2) -> 4
A494: GOALKICKERS | L494: CRITCH | N494: PETER BARDOEL | R494: PARKER | W494: SUNSHINE | X494: 0 | Y494: 11 | Z494: 0 | AA494: 736 | AB494: 2133 | AC494: =(AA494*100)/AB494 -> 34.505391467416786 | AD494: =(X494*4)+(Z494*2) -> 0
A495: MORDIALLOC | C495: BOURNE 11 | F495: O'HANLON 5 | I495: DEATON 4 | K495: MOORE 2 | M495: McILWRAITH 2 | P495: ROGERSON 2 | S495: PAUL BARDOEL 2
A496: BOX HILL | C496: DICKENSON 2 | F496: LAWTHER 2 | I496: KAINEY 2 | K496: CRUSE | M496: CAREY | O496: PICKETT | Q496: RICH | R496: LENNOX
A498: YARRAVILLE | C498: 5 | D498: 2 | E498: =C498*6+D498 -> 32 | G498: 12 | H498: 10 | I498: =G498*6+H498 -> 82 | K498: 13 | L498: 11 | M498: =K498*6+L498 -> 89 | O498: 22 | P498: 19 | Q498: =O498*6+P498 -> 151 | S498: YARRAVILLE
A499: SUNSHINE | C499: 3 | D499: 3 | E499: =C499*6+D499 -> 21 | G499: 3 | H499: 4 | I499: =G499*6+H499 -> 22 | K499: 7 | L499: 7 | M499: =K499*6+L499 -> 49 | O499: 8 | P499: 8 | Q499: =O499*6+P499 -> 56 | S499: GRIFFITHS
A500: BEST PLAYERS
A501: YARRAVILLE | C501: McGHIE | F501: MARTIN | I501: LEITCH | L501: COOK | N501: SIMPSON | Q501: RICHARDS
A502: SUNSHINE | C502: G BROWN | F502: HUNT | I502: GROSSMAN | L502: DAVIS
A503: GOALKICKERS
A504: YARRAVILLE | C504: LEITCH 6 | F504: B SMITH 5 | I504: RICHARDS 4 | L504: FOTHERINGHAM 4 | P504: PHELAN | R504: SAMPSON | U504: MARTIN
A505: SUNSHINE | C505: CHATTERTON 2 | F505: MANEY 2 | I505: GROSSMAN | L505: WILLIAMS | N505: MENADUE | Q505: COCHIERELLI
A507: WAVERLEY | C507: 4 | D507: 1 | E507: =C507*6+D507 -> 25 | G507: 8 | H507: 3 | I507: =G507*6+H507 -> 51 | K507: 10 | L507: 4 | M507: =K507*6+L507 -> 64 | O507: 18 | P507: 8 | Q507: =O507*6+P507 -> 116 | S507: WAVERLEY
A508: NORTHCOTE | C508: 5 | D508: 3 | E508: =C508*6+D508 -> 33 | G508: 6 | H508: 5 | I508: =G508*6+H508 -> 41 | K508: 10 | L508: 8 | M508: =K508*6+L508 -> 68 | O508: 11 | P508: 10 | Q508: =O508*6+P508 -> 76 | S508: RYAN
A509: BEST PLAYERS
A510: WAVERLEY | C510: CLARKE | F510: VENVILLE | I510: HOWELL | L510: DAVIES | O510: CSOTI | R510: LOVELL
A511: NORTHCOTE | C511: PEART | F511: COURTS | I511: McINTYRE | L511: MEGNA | O511: DILORIO | R511: M RYAN
A512: GOALKICKERS
A513: WAVERLEY | C513: DAVIES 6 | E513: STYLES 3 | G513: LOVELL 2 | I513: WILLIAMS | K513: VENVILLE | M513: VEAR | O513: BEDDOE | Q513: HOWELL | S513: 2 SHORT
A514: NORTHCOTE | C514: HEPBURN 4 | F514: JURGENSTEIN 2 | I514: P RYAN 2 | K514: DILORIO | M514: M RYAN | O514: MEGNA
A516: WERRIBEE | C516: 5 | D516: 3 | E516: =C516*6+D516 -> 33 | G516: 9 | H516: 7 | I516: =G516*6+H516 -> 61 | K516: 18 | L516: 11 | M516: =K516*6+L516 -> 119 | O516: 23 | P516: 16 | Q516: =O516*6+P516 -> 154 | S516: WERRIBEE
A517: WILLIAMSTOWN | C517: 1 | D517: 3 | E517: =C517*6+D517 -> 9 | G517: 1 | H517: 4 | I517: =G517*6+H517 -> 10 | K517: 6 | L517: 8 | M517: =K517*6+L517 -> 44 | O517: 12 | P517: 11 | Q517: =O517*6+P517 -> 83 | S517: CASEY
A518: BEST PLAYERS
A519: WERRIBEE | C519: JACK | F519: REDENBACH | I519: GUDDE | K519: VOLKERING | N519: HUGHES | Q519: LEECE
A520: WILLIAMSTOWN | C520: TWEEDLY | F520: FAIRLEY | I520: SMITH | K520: BEBEND | N520: OWEN
A521: GOALKICKERS
A522: WERRIBEE | C522: LEECE 7 | E522: REDENBACH 4 | H522: PRICE 3 | J522: WILLIAMS 2 | M522: BREEN 2 | O522: MITCHELL 2 | R522: ASLING | T522: HUGHES | W522: WALSH
A523: WILLIAMSTOWN | C523: PHILPOTT 3 | F523: EUDEY 2 | H523: FAIRLEY | J523: KELLY | L523: TWEEDLY | N523: MONTEBRUNO | Q523: JOHN | R523: GILDAY | U523: JONES
A525: ROUND 12 | E525: 28TH JUNE | J525: WEATHER | S525: PLAYED AT
D526: 1ST QTR | H526: 2ND QTR | L526: 3RD QTR | P526: FINAL | S526: CAMBERWELL
A527: WAVERLEY | C527: 1 | D527: 3 | E527: =C527*6+D527 -> 9 | G527: 6 | H527: 10 | I527: =G527*6+H527 -> 46 | K527: 9 | L527: 13 | M527: =K527*6+L527 -> 67 | O527: 11 | P527: 21 | Q527: =O527*6+P527 -> 87 | S527: UMPIRE | X527: LADDER | AB527: ROUND | AD527: 12
A528: CAMBERWELL | C528: 4 | D528: 5 | E528: =C528*6+D528 -> 29 | G528: 5 | H528: 7 | I528: =G528*6+H528 -> 37 | K528: 9 | L528: 10 | M528: =K528*6+L528 -> 64 | O528: 11 | P528: 15 | Q528: =O528*6+P528 -> 81 | S528: FITZPATRICK
A529: BEST PLAYERS | W529: TEAM | X529: W | Y529: L | Z529: D | AA529: FOR | AB529: AGST | AC529: % | AD529: PTS
A530: WAVERLEY | C530: W McDONALD | F530: R KINNABURGH | J530: STYLES | L530: CARLSON | O530: K McDONALD | R530: DAVIES
A531: CAMBERWELL | C531: OLIVER | F531: COOK | I531: WRIGHT | K531: PHILLIPS | W531: WAVERLEY | X531: 9 | Y531: 3 | Z531: 0 | AA531: 1901 | AB531: 1043 | AC531: =(AA531*100)/AB531 -> 182.2627037392138 | AD531: =(X531*4)+(Z531*2) -> 36
A532: GOALKICKERS | W532: CAMBERWELL | X532: 9 | Y532: 3 | Z532: 0 | AA532: 1697 | AB532: 1085 | AC532: =(AA532*100)/AB532 -> 156.40552995391704 | AD532: =(X532*4)+(Z532*2) -> 36
A533: WAVERLEY | C533: ANGELIS 5 | F533: BEDDOE 2 | I533: K McDONALD | L533: STYLES | N533: CARLSON | Q533: DAVIDSON | W533: WERRIBEE | X533: 8 | Y533: 3 | Z533: 1 | AA533: 1626 | AB533: 1093 | AC533: =(AA533*100)/AB533 -> 148.76486733760294 | AD533: =(X533*4)+(Z533*2) -> 34
A534: CAMBERWELL | C534: STEVENSON 4 | F534: HOWARD 2 | I534: ROURKE 2 | K534: HIRST | M534: COOK | O534: HAMMOND | W534: OAKLEIGH | X534: 8 | Y534: 4 | Z534: 0 | AA534: 1683 | AB534: 1272 | AC534: =(AA534*100)/AB534 -> 132.31132075471697 | AD534: =(X534*4)+(Z534*2) -> 32
A536: OAKLEIGH | C536: 2 | D536: 2 | E536: =C536*6+D536 -> 14 | G536: 7 | H536: 9 | I536: =G536*6+H536 -> 51 | K536: 11 | L536: 12 | M536: =K536*6+L536 -> 78 | O536: 17 | P536: 20 | Q536: =O536*6+P536 -> 122 | S536: OAKLEIGH | W536: MORDIALLOC | X536: 8 | Y536: 4 | Z536: 0 | AA536: 1566 | AB536: 1190 | AC536: =(AA536*100)/AB536 -> 131.59663865546219 | AD536: =(X536*4)+(Z536*2) -> 32
A537: BOX HILL | C537: 1 | D537: 1 | E537: =C537*6+D537 -> 7 | G537: 3 | H537: 1 | I537: =G537*6+H537 -> 19 | K537: 7 | L537: 4 | M537: =K537*6+L537 -> 46 | O537: 10 | P537: 4 | Q537: =O537*6+P537 -> 64 | S537: GROOM | W537: NORTHCOTE | X537: 7 | Y537: 5 | Z537: 0 | AA537: 1368 | AB537: 1295 | AC537: =(AA537*100)/AB537 -> 105.63706563706563 | AD537: =(X537*4)+(Z537*2) -> 28
A538: BEST PLAYERS | W538: WILLIAMSTOWN | X538: 6 | Y538: 5 | Z538: 1 | AA538: 1494 | AB538: 1465 | AC538: =(AA538*100)/AB538 -> 101.97952218430034 | AD538: =(X538*4)+(Z538*2) -> 26
A539: OAKLEIGH | C539: WALSH | F539: TAYLOR | I539: FOTINIOTIS | L539: WENN | O539: McDONALD | W539: YARRAVILLE | X539: 3 | Y539: 9 | Z539: 0 | AA539: 1289 | AB539: 1593 | AC539: =(AA539*100)/AB539 -> 80.916509730069052 | AD539: =(X539*4)+(Z539*2) -> 12
A540: BOX HILL | C540: HALE | F540: DAVIS | I540: CRUSE | L540: HARPER | O540: RICH | R540: LENNOX | W540: BOX HILL | X540: 1 | Y540: 11 | Z540: 0 | AA540: 1040 | AB540: 1987 | AC540: =(AA540*100)/AB540 -> 52.340211373930551 | AD540: =(X540*4)+(Z540*2) -> 4
A541: GOALKICKERS | W541: SUNSHINE | X541: 0 | Y541: 12 | Z541: 0 | AA541: 786 | AB541: 2306 | AC541: =(AA541*100)/AB541 -> 34.084995663486559 | AD541: =(X541*4)+(Z541*2) -> 0
A542: OAKLEIGH | C542: McDONALD 5 | F542: WOOD 3 | H542: BRUERTON 2 | K542: CURTAIN 2 | N542: COLLINS 2 | P542: FOTINIOTIS | S542: WENN | U542: TAYLOR
A543: BOX HILL | C543: CRUSE 3 | E543: McCANN 2 | H543: WITHERS 2 | K543: CONNOLLY | N543: McNALLY | P543: DICKENSON
A545: NORTHCOTE | C545: 4 | D545: 5 | E545: =C545*6+D545 -> 29 | G545: 7 | H545: 10 | I545: =G545*6+H545 -> 52 | K545: 11 | L545: 14 | M545: =K545*6+L545 -> 80 | O545: 15 | P545: 18 | Q545: =O545*6+P545 -> 108 | S545: NORTHCOTE
A546: YARRAVILLE | C546: 1 | D546: 3 | E546: =C546*6+D546 -> 9 | G546: 4 | H546: 5 | I546: =G546*6+H546 -> 29 | K546: 5 | L546: 6 | M546: =K546*6+L546 -> 36 | O546: 6 | P546: 7 | Q546: =O546*6+P546 -> 43 | S546: WILSON
A547: BEST PLAYERS
A548: NORTHCOTE | C548: MEGNA | F548: EDWARDS | I548: PEART | L548: COURTS | P548: McINTYRE | S548: P RYAN
A549: YARRAVILLE | C549: L RYAN | F549: McGHIE | I549: LEITCH | L549: MARTIN | P549: SIMPSON | S549: GRAY
A550: GOALKICKERS
A551: NORTHCOTE | C551: PHILLIPE 5 | F551: M RYAN 3 | I551: P RYAN 2 | K551: HEPBURN 2 | M551: GRAHAM | O551: EWING | Q551: COURTS
A552: YARRAVILLE | C552: GRAY | E552: FOTHERINGHAM | I552: SAMPSON | L552: SMITH | N552: LEITCH | P552: MARTIN
A554: WILLIAMSTOWN | C554: 7 | D554: 6 | E554: =C554*6+D554 -> 48 | G554: 11 | H554: 10 | I554: =G554*6+H554 -> 76 | K554: 13 | L554: 19 | M554: =K554*6+L554 -> 97 | O554: 16 | P554: 20 | Q554: =O554*6+P554 -> 116 | S554: WILLIAMSTOWN
A555: MORDIALLOC | C555: 4 | D555: 2 | E555: =C555*6+D555 -> 26 | G555: 9 | H555: 4 | I555: =G555*6+H555 -> 58 | K555: 10 | L555: 7 | M555: =K555*6+L555 -> 67 | O555: 14 | P555: 9 | Q555: =O555*6+P555 -> 93 | S555: STEERE
A556: BEST PLAYERS
A557: WILLIAMSTOWN | C557: BEBEND | F557: EUDEY | I557: L TAYLOR | L557: KELLY | N557: SAVIGE | Q557: OWEN
A558: MORDIALLOC | C558: ROGERSON | F558: WALSH | I558: LANG | L558: PETER BARDOEL | P558: MARGHERITI
A559: GOALKICKERS
A560: WILLIAMSTOWN | C560: MONTEBRUNO 3 | F560: A PHILPOTT 2 | I560: CHAPMAN 2 | L560: S PHILPOTT 2 | O560: BEBEND 2 | Q560: TWEEDLY 2 | T560: EUDEY | V560: KELLY
A561: MORDIALLOC | C561: BOURNE 3 | F561: PAUL BARDOEL 3 | J561: PETER BARDOEL 2 | N561: WALSH 2 | P561: PAGNOCCOLO | S561: PETERS | U561: CRITCH | W561: McILWRAITH
A563: WERRIBEE | C563: 6 | D563: 7 | E563: =C563*6+D563 -> 43 | G563: 9 | H563: 14 | I563: =G563*6+H563 -> 68 | K563: 14 | L563: 23 | M563: =K563*6+L563 -> 107 | O563: 24 | P563: 29 | Q563: =O563*6+P563 -> 173 | S563: SUNSHINE
A564: SUNSHINE | C564: 2 | D564: 3 | E564: =C564*6+D564 -> 15 | G564: 4 | H564: 6 | I564: =G564*6+H564 -> 30 | K564: 5 | L564: 7 | M564: =K564*6+L564 -> 37 | O564: 7 | P564: 8 | Q564: =O564*6+P564 -> 50 | S564: COLOSIMO
A565: BEST PLAYERS
A566: WERRIBEE | C566: JACK | E566: REDENBACH | H566: WALSH | K566: DOUGLAS | N566: HUGHES | Q566: LANCASTER
A567: SUNSHINE | C567: GROSSMAN | F567: BENSON | H567: COCHIERELLA | K567: DELRE | N567: WILLIAMS | Q567: CLARKE
A568: GOALKICKERS
A569: WERRIBEE | C569: REDENBACH 5 | F569: LEECE 5 | H569: WALSH 4 | J569: BREEN 3 | L569: MERCURI 3 | O569: HUGHES 2 | R569: ASLING 2
A570: SUNSHINE | C570: MENADUE 2 | F570: MANEY 2 | I570: HUNT | K570: BROWN | M570: DELRE
A572: ROUND 13 | E572: 5TH JULY | J572: WEATHER | S572: PLAYED AT
D573: 1ST QTR | H573: 2ND QTR | L573: 3RD QTR | P573: FINAL | S573: WAVERLEY
A574: WAVERLEY | C574: 4 | D574: 5 | E574: =C574*6+D574 -> 29 | G574: 4 | H574: 11 | I574: =G574*6+H574 -> 35 | K574: 5 | L574: 13 | M574: =K574*6+L574 -> 43 | O574: 7 | P574: 15 | Q574: =O574*6+P574 -> 57 | S574: UMPIRE | X574: LADDER | AB574: ROUND | AD574: 13
A575: OAKLEIGH | C575: 0 | D575: 4 | E575: =C575*6+D575 -> 4 | G575: 1 | H575: 6 | I575: =G575*6+H575 -> 12 | K575: 3 | L575: 6 | M575: =K575*6+L575 -> 24 | O575: 5 | P575: 8 | Q575: =O575*6+P575 -> 38 | S575: VERGONA
A576: BEST PLAYERS | W576: TEAM | X576: W | Y576: L | Z576: D | AA576: FOR | AB576: AGST | AC576: % | AD576: PTS
A577: WAVERLEY | C577: VENVILLE | F577: KINNABURGH | I577: LOVELL | L577: HOLDSWORTH | O577: STYLES | Q577: CARLSON
A578: OAKLEIGH | C578: HARTLEY | F578: MATTHEY | I578: TAYLOR | L578: WENN | W578: WAVERLEY | X578: 10 | Y578: 3 | Z578: 0 | AA578: 1958 | AB578: 1081 | AC578: =(AA578*100)/AB578 -> 181.12858464384828 | AD578: =(X578*4)+(Z578*2) -> 40
A579: GOALKICKERS | W579: CAMBERWELL | X579: 10 | Y579: 3 | Z579: 0 | AA579: 1797 | AB579: 1128 | AC579: =(AA579*100)/AB579 -> 159.30851063829786 | AD579: =(X579*4)+(Z579*2) -> 40
A580: WAVERLEY | C580: STYLES 2 | F580: LOVELL 2 | I580: VENVILLE | L580: DAVIES | N580: CLARKE | W580: WERRIBEE | X580: 9 | Y580: 3 | Z580: 1 | AA580: 1702 | AB580: 1149 | AC580: =(AA580*100)/AB580 -> 148.12880765883378 | AD580: =(X580*4)+(Z580*2) -> 38
A581: OAKLEIGH | C581: COLLINS 3 | F581: LEMMONS | I581: FOTINIOTIS | W581: MORDIALLOC | X581: 9 | Y581: 4 | Z581: 0 | AA581: 1728 | AB581: 1215 | AC581: =(AA581*100)/AB581 -> 142.22222222222223 | AD581: =(X581*4)+(Z581*2) -> 36
A583: WILLIAMSTOWN | C583: 5 | D583: 5 | E583: =C583*6+D583 -> 35 | G583: 7 | H583: 9 | I583: =G583*6+H583 -> 51 | K583: 10 | L583: 12 | M583: =K583*6+L583 -> 72 | O583: 12 | P583: 18 | Q583: =O583*6+P583 -> 90 | S583: BOX HILL | W583: OAKLEIGH | X583: 8 | Y583: 5 | Z583: 0 | AA583: 1721 | AB583: 1329 | AC583: =(AA583*100)/AB583 -> 129.49586155003763 | AD583: =(X583*4)+(Z583*2) -> 32
A584: BOX HILL | C584: 3 | D584: 6 | E584: =C584*6+D584 -> 24 | G584: 7 | H584: 8 | I584: =G584*6+H584 -> 50 | K584: 11 | L584: 12 | M584: =K584*6+L584 -> 78 | O584: 12 | P584: 15 | Q584: =O584*6+P584 -> 87 | S584: STABB | W584: WILLIAMSTOWN | X584: 7 | Y584: 5 | Z584: 1 | AA584: 1584 | AB584: 1552 | AC584: =(AA584*100)/AB584 -> 102.0618556701031 | AD584: =(X584*4)+(Z584*2) -> 30
A585: BEST PLAYERS | W585: NORTHCOTE | X585: 7 | Y585: 6 | Z585: 0 | AA585: 1394 | AB585: 1371 | AC585: =(AA585*100)/AB585 -> 101.67760758570387 | AD585: =(X585*4)+(Z585*2) -> 28
A586: WILLIAMSTOWN | C586: TAYLOR | F586: BEBEND | I586: TWEEDLY | L586: EUDEY | O586: MILLER | R586: SELVIDGE | W586: YARRAVILLE | X586: 3 | Y586: 10 | Z586: 0 | AA586: 1332 | AB586: 1693 | AC586: =(AA586*100)/AB586 -> 78.676904902539874 | AD586: =(X586*4)+(Z586*2) -> 12
A587: BOX HILL | C587: CRUSE | F587: RICH | I587: HALE | L587: DICKENSON | O587: TAYLOR | R587: DAVIS | W587: BOX HILL | X587: 1 | Y587: 12 | Z587: 0 | AA587: 1127 | AB587: 2077 | AC587: =(AA587*100)/AB587 -> 54.260953298025996 | AD587: =(X587*4)+(Z587*2) -> 4
A588: GOALKICKERS | W588: SUNSHINE | X588: 0 | Y588: 13 | Z588: 0 | AA588: 811 | AB588: 2468 | AC588: =(AA588*100)/AB588 -> 32.860615883306323 | AD588: =(X588*4)+(Z588*2) -> 0
A589: WILLIAMSTOWN | C589: CHAPMAN 3 | F589: S PHILPOTT 2 | I589: BEBEND 2 | K589: TAYLOR 2 | N589: A PHILPOTT | Q589: JONES | S589: KELLY
A590: BOX HILL | C590: WITHERS 2 | F590: TAYLOR 2 | I590: CRUSE 2 | K590: RICH | M590: CONNOLLY | O590: PETTIGREW | R590: SUMMERS | T590: ROBINSON
P591: McNALLY
A592: WERRIBEE | C592: 2 | D592: 3 | E592: =C592*6+D592 -> 15 | G592: 3 | H592: 8 | I592: =G592*6+H592 -> 26 | K592: 7 | L592: 9 | M592: =K592*6+L592 -> 51 | O592: 11 | P592: 10 | Q592: =O592*6+P592 -> 76 | S592: WERRIBEE
A593: NORTHCOTE | C593: 3 | D593: 2 | E593: =C593*6+D593 -> 20 | G593: 4 | H593: 4 | I593: =G593*6+H593 -> 28 | K593: 5 | L593: 7 | M593: =K593*6+L593 -> 37 | O593: 8 | P593: 8 | Q593: =O593*6+P593 -> 56 | S593: OGSTON
A594: BEST PLAYERS
A595: WERRIBEE | C595: MERCURI | F595: SIDEROW | I595: LANCASTER | L595: DOUGLAS | O595: PRICE | R595: PARKES
A596: NORTHCOTE | C596: PEART | F596: MEGNA | I596: EDWARDS | L596: DILORIO | O596: McINTYRE | R596: BRAIN
A597: GOALKICKERS
A598: WERRIBEE | C598: LEECE 3 | E598: MERCURI 3 | H598: PRICE 2 | J598: ASLING | L598: WILLIAMS | N598: REDENBACH
A599: NORTHCOTE | C599: HEPBURN 2 | F599: RYAN 2 | H599: WATTS 2 | J599: GONSALVES | M599: EDWARDS
A601: MORDIALLOC | C601: 5 | D601: 7 | E601: =C601*6+D601 -> 37 | G601: 10 | H601: 12 | I601: =G601*6+H601 -> 72 | K601: 20 | L601: 16 | M601: =K601*6+L601 -> 136 | O601: 24 | P601: 18 | Q601: =O601*6+P601 -> 162 | S601: MORDIALLOC
A602: SUNSHINE | C602: 1 | D602: 1 | E602: =C602*6+D602 -> 7 | G602: 3 | H602: 2 | I602: =G602*6+H602 -> 20 | K602: 3 | L602: 3 | M602: =K602*6+L602 -> 21 | O602: 3 | P602: 7 | Q602: =O602*6+P602 -> 25 | S602: TORNEY
A603: BEST PLAYERS
A604: MORDIALLOC | C604: PARKER | E604: PETER BARDOEL | I604: PAUL BARDOEL | L604: MARGHERITI | O604: MOORE | Q604: LANG
A605: SUNSHINE | C605: GROSSMAN | F605: PRICE | I605: BENSON | L605: PATTERSON | O605: COCHIERELLA
A606: GOALKICKERS
A607: MORDIALLOC | C607: PAUL BARDOEL 7 | G607: BOURNE 5 | J607: BATTY 4 | L607: PETER BARDOEL 2 | P607: CRITCH | R607: PETERS | T607: GUY | W607: PAGNOCCOLO | X607: PARKER | Z607: ROGERSON
A608: SUNSHINE | C608: AXON 2 | F608: MENADUE
A610: CAMBERWELL | C610: 2 | D610: 5 | E610: =C610*6+D610 -> 17 | G610: 5 | H610: 8 | I610: =G610*6+H610 -> 38 | K610: 9 | L610: 11 | M610: =K610*6+L610 -> 65 | O610: 14 | P610: 16 | Q610: =O610*6+P610 -> 100 | S610: YARRAVILLE
A611: YARRAVILLE | C611: 2 | D611: 6 | E611: =C611*6+D611 -> 18 | G611: 4 | H611: 9 | I611: =G611*6+H611 -> 33 | K611: 5 | L611: 11 | M611: =K611*6+L611 -> 41 | O611: 5 | P611: 13 | Q611: =O611*6+P611 -> 43 | S611: OAKLEY
A612: BEST PLAYERS
A613: CAMBERWELL | C613: PHILLIPS | F613: HOWARD | I613: OLIVER | L613: RICE | O613: McFEE | R613: HIRST
A614: YARRAVILLE | C614: McGHIE | F614: SIMPSON | I614: RYAN | L614: MARTIN | O614: PAGE | R614: WARD
A615: GOALKICKERS
A616: CAMBERWELL | C616: STEVENSON 3 | F616: DAVIDSON 3 | I616: COWLEY 2 | K616: HOWARD 2 | N616: HIRST 2 | P616: JUDD | R616: CHAMBERLAIN
A617: YARRAVILLE | C617: RYAN | E617: FOTHERINGHAM | I617: SMITH | K617: GRAY | M617: LEITCH
A619: ROUND 14 | E619: 12TH JULY | J619: WEATHER | S619: PLAYED AT
D620: 1ST QTR | H620: 2ND QTR | L620: 3RD QTR | P620: FINAL | S620: CAMBERWELL
A621: CAMBERWELL | C621: 1 | D621: 2 | E621: =C621*6+D621 -> 8 | G621: 3 | H621: 5 | I621: =G621*6+H621 -> 23 | K621: 6 | L621: 7 | M621: =K621*6+L621 -> 43 | O621: 8 | P621: 10 | Q621: =O621*6+P621 -> 58 | S621: UMPIRE | X621: LADDER | AB621: ROUND | AD621: 14
A622: WERRIBEE | C622: 3 | D622: 4 | E622: =C622*6+D622 -> 22 | G622: 3 | H622: 7 | I622: =G622*6+H622 -> 25 | K622: 3 | L622: 11 | M622: =K622*6+L622 -> 29 | O622: 6 | P622: 12 | Q622: =O622*6+P622 -> 48 | S622: GROOM
A623: BEST PLAYERS | W623: TEAM | X623: W | Y623: L | Z623: D | AA623: FOR | AB623: AGST | AC623: % | AD623: PTS
A624: CAMBERWELL | C624: OLIVER | F624: SPITHILL | I624: DAVIDSON | L624: COOK | O624: CAHILL | R624: R McFEE
A625: WERRIBEE | C625: MENADUE | F625: HUGHES | I625: LYONS | L625: BARLOW | W625: WAVERLEY | X625: 11 | Y625: 3 | Z625: 0 | AA625: 2092 | AB625: 1112 | AC625: =(AA625*100)/AB625 -> 188.12949640287769 | AD625: =(X625*4)+(Z625*2) -> 44
A626: GOALKICKERS | W626: CAMBERWELL | X626: 11 | Y626: 3 | Z626: 0 | AA626: 1855 | AB626: 1176 | AC626: =(AA626*100)/AB626 -> 157.73809523809524 | AD626: =(X626*4)+(Z626*2) -> 44
A627: CAMBERWELL | C627: HAMMOND 3 | F627: ROURKE | I627: CHAMBERLAIN | L627: PEVITT | N627: COOK | P627: DAVIDSON | W627: MORDIALLOC | X627: 10 | Y627: 4 | Z627: 0 | AA627: 1764 | AB627: 1246 | AC627: =(AA627*100)/AB627 -> 141.57303370786516 | AD627: =(X627*4)+(Z627*2) -> 40
A628: WERRIBEE | C628: LYONS | E628: SIMMONS | H628: BARLOW | J628: PRICE | L628: LINEHAN | N628: WILLIAMS | W628: WERRIBEE | X628: 9 | Y628: 4 | Z628: 1 | AA628: 1750 | AB628: 1207 | AC628: =(AA628*100)/AB628 -> 144.98757249378625 | AD628: =(X628*4)+(Z628*2) -> 38
A630: WILLIAMSTOWN | C630: 4 | D630: 3 | E630: =C630*6+D630 -> 27 | G630: 8 | H630: 6 | I630: =G630*6+H630 -> 54 | K630: 9 | L630: 8 | M630: =K630*6+L630 -> 62 | O630: 13 | P630: 11 | Q630: =O630*6+P630 -> 89 | S630: WILLIAMSTOWN | W630: WILLIAMSTOWN | X630: 8 | Y630: 5 | Z630: 1 | AA630: 1673 | AB630: 1606 | AC630: =(AA630*100)/AB630 -> 104.17185554171856 | AD630: =(X630*4)+(Z630*2) -> 34
A631: OAKLEIGH | C631: 3 | D631: 3 | E631: =C631*6+D631 -> 21 | G631: 4 | H631: 4 | I631: =G631*6+H631 -> 28 | K631: 6 | L631: 6 | M631: =K631*6+L631 -> 42 | O631: 8 | P631: 6 | Q631: =O631*6+P631 -> 54 | S631: OAKLEY | W631: OAKLEIGH | X631: 8 | Y631: 6 | Z631: 0 | AA631: 1775 | AB631: 1418 | AC631: =(AA631*100)/AB631 -> 125.17630465444287 | AD631: =(X631*4)+(Z631*2) -> 32
A632: BEST PLAYERS | W632: NORTHCOTE | X632: 7 | Y632: 7 | Z632: 0 | AA632: 1425 | AB632: 1407 | AC632: =(AA632*100)/AB632 -> 101.27931769722815 | AD632: =(X632*4)+(Z632*2) -> 28
A633: WILLIAMSTOWN | C633: MILLER | F633: JOHN | I633: BEBEND | L633: RAUNIK | O633: SELVIDGE | R633: GILDAY | W633: YARRAVILLE | X633: 3 | Y633: 11 | Z633: 0 | AA633: 1363 | AB633: 1827 | AC633: =(AA633*100)/AB633 -> 74.603174603174608 | AD633: =(X633*4)+(Z633*2) -> 12
A634: OAKLEIGH | C634: OTT | F634: McDONALD | I634: GILL | L634: TAYLOR | O634: FOTINIOTIS | R634: MATTHEWS | W634: BOX HILL | X634: 2 | Y634: 12 | Z634: 0 | AA634: 1225 | AB634: 2133 | AC634: =(AA634*100)/AB634 -> 57.430848570089076 | AD634: =(X634*4)+(Z634*2) -> 8
A635: GOALKICKERS | W635: SUNSHINE | X635: 0 | Y635: 14 | Z635: 0 | AA635: 867 | AB635: 2566 | AC635: =(AA635*100)/AB635 -> 33.787996882307091 | AD635: =(X635*4)+(Z635*2) -> 0
A636: WILLIAMSTOWN | C636: JOHN 5 | F636: RAUNIK 3 | I636: GILDAY 2 | K636: CUTAJAR | N636: EUDEY | P636: JONES
A637: OAKLEIGH | C637: McDONALD 3 | F637: W MILLER | I637: CURTAIN | K637: TAYLOR | N637: OTT | P637: GILL
A639: MORDIALLOC | C639: 1 | D639: 6 | E639: =C639*6+D639 -> 12 | G639: 1 | H639: 10 | I639: =G639*6+H639 -> 16 | K639: 3 | L639: 12 | M639: =K639*6+L639 -> 30 | O639: 4 | P639: 12 | Q639: =O639*6+P639 -> 36 | S639: MORDIALLOC
A640: NORTHCOTE | C640: 2 | D640: 1 | E640: =C640*6+D640 -> 13 | G640: 3 | H640: 5 | I640: =G640*6+H640 -> 23 | K640: 4 | L640: 7 | M640: =K640*6+L640 -> 31 | O640: 4 | P640: 7 | Q640: =O640*6+P640 -> 31 | S640: TORNEY
A641: BEST PLAYERS
A642: MORDIALLOC | C642: PAGNOCCOLO | F642: BATTY | I642: O'HANLON | L642: ALVES | O642: DEATON | R642: PETER BARDOEL
A643: NORTHCOTE | C643: MEGNA | F643: HUTTON | I643: McQUINN | L643: MINNETT | O643: ARMSTRONG | R643: COURTS
A644: GOALKICKERS
A645: MORDIALLOC | C645: BOURNE 2 | F645: PETER BARDOEL 2
A646: NORTHCOTE | C646: RYAN | E646: McINTYRE | H646: WATTS | J646: GONSALVES
A648: WAVERLEY | C648: 5 | D648: 3 | E648: =C648*6+D648 -> 33 | G648: 10 | H648: 10 | I648: =G648*6+H648 -> 70 | K648: 12 | L648: 11 | M648: =K648*6+L648 -> 83 | O648: 19 | P648: 20 | Q648: =O648*6+P648 -> 134 | S648: WAVERLEY
A649: YARRAVILLE | C649: 0 | D649: 4 | E649: =C649*6+D649 -> 4 | G649: 3 | H649: 5 | I649: =G649*6+H649 -> 23 | K649: 4 | L649: 6 | M649: =K649*6+L649 -> 30 | O649: 4 | P649: 7 | Q649: =O649*6+P649 -> 31 | S649: RYAN
A650: BEST PLAYERS
A651: WAVERLEY | C651: W McDONALD | F651: DAVIES | I651: K McDONALD | L651: LOVELL | O651: KINNABURGH | R651: BEDDOE
A652: YARRAVILLE | C652: McMAHON | F652: ROGOWICZ | I652: PAGE | L652: ROGOZIC | O652: MARTIN | R652: PRIEST
A653: GOALKICKERS
A654: WAVERLEY | C654: VEAR 6 | F654: DAVIES 5 | I654: LOVELL 2 | K654: WILLIAMS 2 | N654: BEDDOE 2 | Q654: VENVILLE | S654: FISHER
A655: YARRAVILLE | C655: McMAHON | F655: LEITCH | I655: RYAN | K655: SIMPSON
A657: BOX HILL | C657: 4 | D657: 4 | E657: =C657*6+D657 -> 28 | G657: 5 | H657: 8 | I657: =G657*6+H657 -> 38 | K657: 9 | L657: 12 | M657: =K657*6+L657 -> 66 | O657: 14 | P657: 14 | Q657: =O657*6+P657 -> 98 | S657: SUNSHINE
A658: SUNSHINE | C658: 3 | D658: 2 | E658: =C658*6+D658 -> 20 | G658: 5 | H658: 5 | I658: =G658*6+H658 -> 35 | K658: 7 | L658: 6 | M658: =K658*6+L658 -> 48 | O658: 8 | P658: 8 | Q658: =O658*6+P658 -> 56 | S658: COLOSIMO
A659: BEST PLAYERS
A660: BOX HILL | C660: PETTIGREW | F660: SAUNDERS | I660: DAVIS | L660: LENNOX | O660: HALE | R660: DICKENSON
A661: SUNSHINE | C661: GROSSMAN | F661: BENSON | I661: PRICE | L661: MITCHELL | O661: S HUNT
A662: GOALKICKERS
A663: BOX HILL | C663: McNALLY 5 | F663: WITHERS 3 | I663: DAVIS 2 | K663: TAYLOR | M663: DICKENSON | P663: ROBINSON | R663: HALE
A664: SUNSHINE | C664: CHATTERTON 3 | F664: DAVIS 2 | I664: WILLIAMS | L664: MANEY | N664: DELRE
A666: ROUND 15 | E666: 19TH JULY | J666: WEATHER | S666: PLAYED AT
D667: 1ST QTR | H667: 2ND QTR | L667: 3RD QTR | P667: FINAL | S667: MORDIALLOC
A668: MORDIALLOC | C668: 3 | D668: 6 | E668: =C668*6+D668 -> 24 | G668: 9 | H668: 9 | I668: =G668*6+H668 -> 63 | K668: 12 | L668: 13 | M668: =K668*6+L668 -> 85 | O668: 14 | P668: 14 | Q668: =O668*6+P668 -> 98 | S668: UMPIRE | X668: LADDER | AB668: ROUND | AD668: 15
A669: CAMBERWELL | C669: 1 | D669: 1 | E669: =C669*6+D669 -> 7 | G669: 4 | H669: 4 | I669: =G669*6+H669 -> 28 | K669: 7 | L669: 7 | M669: =K669*6+L669 -> 49 | O669: 13 | P669: 16 | Q669: =O669*6+P669 -> 94 | S669: BLOOM/WILSON
A670: BEST PLAYERS | W670: TEAM | X670: W | Y670: L | Z670: D | AA670: FOR | AB670: AGST | AC670: % | AD670: PTS
A671: MORDIALLOC | C671: PARKER | E671: PETER BARDOEL | I671: BATTY | L671: DEATON | O671: ALVES | R671: MASON
A672: CAMBERWELL | C672: PEVITT | E672: NEILSON | I672: RICE | L672: SPITHILL | O672: HAMMOND | R672: COWLEY | W672: WAVERLEY | X672: 11 | Y672: 4 | Z672: 0 | AA672: 2198 | AB672: 1266 | AC672: =(AA672*100)/AB672 -> 173.61769352290679 | AD672: =(X672*4)+(Z672*2) -> 44
A673: GOALKICKERS | P673: ALVES | W673: CAMBERWELL | X673: 11 | Y673: 4 | Z673: 0 | AA673: 1949 | AB673: 1274 | AC673: =(AA673*100)/AB673 -> 152.98273155416013 | AD673: =(X673*4)+(Z673*2) -> 44
A674: MORDIALLOC | C674: BOURNE 4 | F674: DEATON 2 | H674: WALSH 2 | J674: GUY | K674: PETER BARDOEL | N674: PAGNOCCOLO | Q674: PARKER | S674: McILWRAITH | W674: MORDIALLOC | X674: 11 | Y674: 4 | Z674: 0 | AA674: 1862 | AB674: 1340 | AC674: =(AA674*100)/AB674 -> 138.955223880597 | AD674: =(X674*4)+(Z674*2) -> 44
A675: CAMBERWELL | C675: HAMMOND 5 | F675: COWLEY 4 | I675: HOWARD 2 | L675: WRIGHT | N675: TEAKEL | W675: WERRIBEE | X675: 10 | Y675: 4 | Z675: 1 | AA675: 1904 | AB675: 1313 | AC675: =(AA675*100)/AB675 -> 145.011424219345 | AD675: =(X675*4)+(Z675*2) -> 42
W676: WILLIAMSTOWN | X676: 9 | Y676: 5 | Z676: 1 | AA676: 1913 | AB676: 1682 | AC676: =(AA676*100)/AB676 -> 113.73365041617123 | AD676: =(X676*4)+(Z676*2) -> 38
A677: OAKLEIGH | C677: 8 | D677: 6 | E677: =C677*6+D677 -> 54 | G677: 12 | H677: 9 | I677: =G677*6+H677 -> 81 | K677: 16 | L677: 15 | M677: =K677*6+L677 -> 111 | O677: 23 | P677: 21 | Q677: =O677*6+P677 -> 159 | S677: OAKLEIGH | W677: OAKLEIGH | X677: 9 | Y677: 6 | Z677: 0 | AA677: 1934 | AB677: 1476 | AC677: =(AA677*100)/AB677 -> 131.02981029810297 | AD677: =(X677*4)+(Z677*2) -> 36
A678: YARRAVILLE | C678: 1 | D678: 3 | E678: =C678*6+D678 -> 9 | G678: 6 | H678: 5 | I678: =G678*6+H678 -> 41 | K678: 8 | L678: 7 | M678: =K678*6+L678 -> 55 | O678: 8 | P678: 10 | Q678: =O678*6+P678 -> 58 | W678: NORTHCOTE | X678: 8 | Y678: 7 | Z678: 0 | AA678: 1608 | AB678: 1544 | AC678: =(AA678*100)/AB678 -> 104.14507772020725 | AD678: =(X678*4)+(Z678*2) -> 32
A679: BEST PLAYERS | W679: YARRAVILLE | X679: 3 | Y679: 12 | Z679: 0 | AA679: 1421 | AB679: 1986 | AC679: =(AA679*100)/AB679 -> 71.550855991943607 | AD679: =(X679*4)+(Z679*2) -> 12
A680: OAKLEIGH | C680: BATTERSBY | F680: FOTINIOTIS | I680: ANSELL | L680: WOOD | O680: MATTHEY | R680: OTT | W680: BOX HILL | X680: 2 | Y680: 13 | Z680: 0 | AA680: 1362 | AB680: 2316 | AC680: =(AA680*100)/AB680 -> 58.808290155440417 | AD680: =(X680*4)+(Z680*2) -> 8
A681: YARRAVILLE | C681: COOK | F681: RYAN | I681: LEITCH | L681: McGHIE | O681: SIMPSON | R681: MARTIN | W681: SUNSHINE | X681: 0 | Y681: 15 | Z681: 0 | AA681: 943 | AB681: 2806 | AC681: =(AA681*100)/AB681 -> 33.606557377049178 | AD681: =(X681*4)+(Z681*2) -> 0
A682: GOALKICKERS | O682: LE GRECA
A683: OAKLEIGH | C683: THOMAS 6 | F683: McDONALD 4 | I683: WOOD 4 | K683: FOTINIOTIS 3 | N683: WALSH | P683: TAYLOR | R683: BATTERSBY | T683: COLLINS | V683: GILL
A684: YARRAVILLE | C684: LEITCH 3 | F684: RAE 2 | H684: ROGOWICZ | K684: BROWN | M684: PARKES
A686: WERRIBEE | C686: 3 | D686: 1 | E686: =C686*6+D686 -> 19 | G686: 10 | H686: 7 | I686: =G686*6+H686 -> 67 | K686: 16 | L686: 10 | M686: =K686*6+L686 -> 106 | O686: 23 | P686: 16 | Q686: =O686*6+P686 -> 154 | S686: WERRIBEE
A687: WAVERLEY | C687: 2 | D687: 5 | E687: =C687*6+D687 -> 17 | G687: 7 | H687: 7 | I687: =G687*6+H687 -> 49 | K687: 11 | L687: 12 | M687: =K687*6+L687 -> 78 | O687: 15 | P687: 16 | Q687: =O687*6+P687 -> 106 | S687: CASEY/BUDGE
A688: BEST PLAYERS
A689: WERRIBEE | C689: LEECE | F689: PRICE | I689: LANCASTER | L689: DOUGLAS | O689: BREEN | R689: MERCURI
A690: WAVERLEY | C690: VENVILLE | F690: W McDONALD | I690: VEAR | L690: STYLES | O690: HOWELL | R690: LOVELL
A691: GOALKICKERS
A692: WERRIBEE | C692: LEECE 10 | F692: PRICE 8 | H692: D SMITH 3 | K692: SIMMONS 3 | N692: MITCHELL
A693: WAVERLEY | C693: VEAR 8 | F693: VENVILLE 2 | I693: KINNABURGH 2 | L693: K McDONALD | O693: CSOTI | Q693: STYLES
A695: NORTHCOTE | C695: 7 | D695: 5 | E695: =C695*6+D695 -> 47 | G695: 12 | H695: 7 | I695: =G695*6+H695 -> 79 | K695: 21 | L695: 12 | M695: =K695*6+L695 -> 138 | O695: 28 | P695: 15 | Q695: =O695*6+P695 -> 183 | S695: BOX HILL
A696: BOX HILL | C696: 4 | D696: 0 | E696: =C696*6+D696 -> 24 | G696: 9 | H696: 4 | I696: =G696*6+H696 -> 58 | K696: 14 | L696: 8 | M696: =K696*6+L696 -> 92 | O696: 21 | P696: 11 | Q696: =O696*6+P696 -> 137
A697: BEST PLAYERS
A698: NORTHCOTE | C698: M RYAN | F698: MEGNA | I698: PEARCE | L698: JURGENSTEIN | O698: WATTS | R698: McINTYRE
A699: BOX HILL | C699: McNALLY | F699: DICKENSON | I699: HARPER | L699: HALE | O699: DAVIS
A700: GOALKICKERS
A701: NORTHCOTE | C701: HEPBURN 6 | F701: WATTS 5 | H701: PEARCE 4 | J701: CASTIAGNIN 3 | M701: M RYAN 2 | O701: JURGENSTEIN 2 | R701: WEIGHTMAN 2 | U701: EDWARDS 2 | X701: MEGNA | Z701: McQUINN | AB701: GONSALVES
A702: BOX HILL | C702: McNALLY 10 | F702: SUMMERS 3 | I702: DICKENSON 2 | L702: WITHERS 2 | O702: LAWTHER 2 | R702: KAINEY | T702: PETTIGREW
A704: WILLIAMSTOWN | C704: 8 | D704: 6 | E704: =C704*6+D704 -> 54 | G704: 18 | H704: 15 | I704: =G704*6+H704 -> 123 | K704: 25 | L704: 17 | M704: =K704*6+L704 -> 167 | O704: 36 | P704: 24 | Q704: =O704*6+P704 -> 240 | S704: WILLIAMSTOWN
A705: SUNSHINE | C705: 2 | D705: 2 | E705: =C705*6+D705 -> 14 | G705: 3 | H705: 5 | I705: =G705*6+H705 -> 23 | K705: 7 | L705: 10 | M705: =K705*6+L705 -> 52 | O705: 11 | P705: 10 | Q705: =O705*6+P705 -> 76 | S705: FITZPATRICK
A706: BEST PLAYERS
A707: WILLIAMSTOWN | C707: CUTAJAR | F707: JOHN | I707: BEBEND | L707: GOETZ | O707: FAIRLEY | R707: EUDEY
A708: SUNSHINE | C708: BROWN | F708: PRICE | I708: HUNT | L708: GROSSMAN | O708: AXON | R708: BENSON
A709: GOALKICKERS
A710: WILLIAMSTOWN | C710: JOHN 8 | E710: FAIRLEY 6 | G710: KELLY 4 | I710: S PHILPOTT 3 | L710: EUDEY 3 | N710: GILDAY 3 | P710: OWEN 3 | R710: CUTAJAR 2 | T710: TWEEDLY 2 | W710: GOETZ 2
A711: SUNSHINE | C711: AXON 3 | F711: GROSSMAN 2 | I711: DAVIS 2 | K711: PRICE 2 | M711: MENADUE | P711: GORE
A713: ROUND 16 | E713: 26TH JULY | J713: WEATHER | S713: PLAYED AT
D714: 1ST QTR | H714: 2ND QTR | L714: 3RD QTR | P714: FINAL | S714: WAVERLEY
A715: MORDIALLOC | C715: 3 | D715: 8 | E715: =C715*6+D715 -> 26 | G715: 6 | H715: 15 | I715: =G715*6+H715 -> 51 | K715: 8 | L715: 16 | M715: =K715*6+L715 -> 64 | O715: 12 | P715: 18 | Q715: =O715*6+P715 -> 90 | S715: UMPIRE | X715: LADDER | AB715: ROUND | AD715: 16
A716: WAVERLEY | C716: 1 | D716: 4 | E716: =C716*6+D716 -> 10 | G716: 4 | H716: 7 | I716: =G716*6+H716 -> 31 | K716: 5 | L716: 12 | M716: =K716*6+L716 -> 42 | O716: 6 | P716: 15 | Q716: =O716*6+P716 -> 51 | S716: STEERE/MORGAN
A717: BEST PLAYERS | W717: TEAM | X717: W | Y717: L | Z717: D | AA717: FOR | AB717: AGST | AC717: % | AD717: PTS
A718: MORDIALLOC | C718: BATTY | E718: MASON | H718: ALVES | K718: PARKER | N718: McILWRAITH | R718: PAGNOCCOLO
A719: WAVERLEY | C719: CARLSON | E719: HOLDSWORTH | H719: W McDONALD | K719: LOVELL | N719: HOWELL | R719: STYLES | W719: CAMBERWELL | X719: 12 | Y719: 4 | Z719: 0 | AA719: 2132 | AB719: 1369 | AC719: =(AA719*100)/AB719 -> 155.73411249086925 | AD719: =(X719*4)+(Z719*2) -> 48
A720: GOALKICKERS | W720: MORDIALLOC | X720: 12 | Y720: 4 | Z720: 0 | AA720: 1952 | AB720: 1391 | AC720: =(AA720*100)/AB720 -> 140.33069734004314 | AD720: =(X720*4)+(Z720*2) -> 48
A721: MORDIALLOC | C721: O'HANLON 3 | F721: McILWRAITH 3 | I721: BOURNE 2 | K721: PAGNOCCOLO | N721: PETER BARDOEL | Q721: PAUL BARDOEL | T721: ALVES | W721: WERRIBEE | X721: 11 | Y721: 4 | Z721: 1 | AA721: 2065 | AB721: 1453 | AC721: =(AA721*100)/AB721 -> 142.11975223675154 | AD721: =(X721*4)+(Z721*2) -> 46
A722: WAVERLEY | C722: ANGELIS 2 | F722: VENVILLE 2 | I722: LOVELL | K722: HOLDSWORTH | W722: WAVERLEY | X722: 11 | Y722: 5 | Z722: 0 | AA722: 2249 | AB722: 1356 | AC722: =(AA722*100)/AB722 -> 165.85545722713863 | AD722: =(X722*4)+(Z722*2) -> 44
A724: CAMBERWELL | C724: 7 | D724: 6 | E724: =C724*6+D724 -> 48 | G724: 14 | H724: 10 | I724: =G724*6+H724 -> 94 | K724: 22 | L724: 12 | M724: =K724*6+L724 -> 144 | O724: 28 | P724: 15 | Q724: =O724*6+P724 -> 183 | S724: CAMBERWELL | W724: OAKLEIGH | X724: 10 | Y724: 6 | Z724: 0 | AA724: 2083 | AB724: 1569 | AC724: =(AA724*100)/AB724 -> 132.75971956660294 | AD724: =(X724*4)+(Z724*2) -> 40
A725: BOX HILL | C725: 5 | D725: 0 | E725: =C725*6+D725 -> 30 | G725: 8 | H725: 3 | I725: =G725*6+H725 -> 51 | K725: 9 | L725: 5 | M725: =K725*6+L725 -> 59 | O725: 14 | P725: 11 | Q725: =O725*6+P725 -> 95 | S725: BRADSHAW/ | W725: WILLIAMSTOWN | X725: 9 | Y725: 6 | Z725: 1 | AA725: 1995 | AB725: 1808 | AC725: =(AA725*100)/AB725 -> 110.34292035398231 | AD725: =(X725*4)+(Z725*2) -> 38
A726: BEST PLAYERS | S726: COLOSIMO | W726: NORTHCOTE | X726: 9 | Y726: 7 | Z726: 0 | AA726: 1734 | AB726: 1626 | AC726: =(AA726*100)/AB726 -> 106.64206642066421 | AD726: =(X726*4)+(Z726*2) -> 36
A727: CAMBERWELL | C727: CAHILL | F727: HOWARD | I727: OLIVER | K727: TEAKEL | N727: HIPWORTH | Q727: PEVITT | W727: YARRAVILLE | X727: 3 | Y727: 13 | Z727: 0 | AA727: 1561 | AB727: 2147 | AC727: =(AA727*100)/AB727 -> 72.706101537028417 | AD727: =(X727*4)+(Z727*2) -> 12
A728: BOX HILL | C728: PETTIGREW | F728: DICKENSON | I728: HALE | K728: TAYLOR | N728: LAWTHER | Q728: DAVIS | W728: BOX HILL | X728: 2 | Y728: 14 | Z728: 0 | AA728: 1457 | AB728: 2499 | AC728: =(AA728*100)/AB728 -> 58.30332132853141 | AD728: =(X728*4)+(Z728*2) -> 8
A729: GOALKICKERS | K729: DAVIDSON | N729: RICE | P729: R McFEE | W729: SUNSHINE | X729: 0 | Y729: 16 | Z729: 0 | AA729: 1036 | AB729: 2955 | AC729: =(AA729*100)/AB729 -> 35.059221658206432 | AD729: =(X729*4)+(Z729*2) -> 0
A730: CAMBERWELL | C730: TEAKEL 6 | E730: NEILSON 3 | G730: OLIVER 2 | I730: CHAMBERLAIN 2 | L730: WRIGHT 2 | N730: JUDD 2 | P730: HIRST 2 | R730: STEVENSON 2 | U730: HOWARD
A731: BOX HILL | C731: TAYLOR 4 | E731: SUMMERS 3 | H731: LENNOX 2 | J731: CRUSE | L731: DAVIS | N731: RICH | P731: KAINEY | R731: WITHERS
A733: NORTHCOTE | C733: 6 | D733: 4 | E733: =C733*6+D733 -> 40 | G733: 7 | H733: 5 | I733: =G733*6+H733 -> 47 | K733: 17 | L733: 6 | M733: =K733*6+L733 -> 108 | O733: 19 | P733: 12 | Q733: =O733*6+P733 -> 126 | S733: NORTHCOTE
A734: WILLIAMSTOWN | C734: 1 | D734: 0 | E734: =C734*6+D734 -> 6 | G734: 7 | H734: 2 | I734: =G734*6+H734 -> 44 | K734: 9 | L734: 5 | M734: =K734*6+L734 -> 59 | O734: 12 | P734: 10 | Q734: =O734*6+P734 -> 82 | S734: BUDGE/BLOOM
A735: BEST PLAYERS
A736: NORTHCOTE | C736: GRAHAM | F736: ROULSTON | I736: P RYAN | K736: DILORIO | N736: HYDE | Q736: PEART
A737: WILLIAMSTOWN | C737: BEBEND | F737: KELLY | I737: FAIRLEY | K737: CUTAJAR
A738: GOALKICKERS
A739: NORTHCOTE | C739: P RYAN 5 | F739: PEART 3 | H739: WEIGHTMAN 2 | K739: HEPBURN 2 | N739: M RYAN | P739: MEGNA | R739: EDWARDS | T739: WATTS | W739: SAUNDERS | X739: MINNETT | Z739: DILORIO
A740: WILLIAMSTOWN | C740: FAIRLEY 4 | F740: TWEEDLY 2 | I740: RAUNIK 2 | K740: KELLY | M740: PHILPOTT | O740: MONTEBRUNO | R740: OWEN
A742: WERRIBEE | C742: 3 | D742: 6 | E742: =C742*6+D742 -> 24 | G742: 6 | H742: 12 | I742: =G742*6+H742 -> 48 | K742: 16 | L742: 22 | M742: =K742*6+L742 -> 118 | O742: 23 | P742: 23 | Q742: =O742*6+P742 -> 161 | S742: WERRIBEE
A743: YARRAVILLE | C743: 8 | D743: 3 | E743: =C743*6+D743 -> 51 | G743: 12 | H743: 8 | I743: =G743*6+H743 -> 80 | K743: 14 | L743: 11 | M743: =K743*6+L743 -> 95 | O743: 21 | P743: 14 | Q743: =O743*6+P743 -> 140 | S743: HUTCHISON/WILSON
A744: BEST PLAYERS
A745: WERRIBEE | C745: GUDDE | E745: SIDEROW | H745: PRICE | J745: LANCASTER | M745: SIMMONS | P745: MERCURI
A746: YARRAVILLE | C746: RYAN | E746: SQUIRE | H746: McGHIE | J746: MARTIN | M746: PHELAN | P746: FOTHERINGHAM
A747: GOALKICKERS
A748: WERRIBEE | C748: LEECE 4 | E748: PRICE 4 | G748: SIMMONS 4 | J748: LANCASTER 3 | M748: LYONS 2 | O748: TAYLOR 2 | Q748: WILLIAMS 2 | T748: HUGHES | V748: ASLING
A749: YARRAVILLE | C749: FOTHERINGHAM 5 | G749: RICHARDS 3 | J749: LEITCH 2 | L749: SMITH 2 | N749: MARTIN 2 | P749: RYAN 2 | R749: SQUIRE | T749: PRIEST | V749: BROWN | X749: GRAY | Y749: SIMPSON
A751: OAKLEIGH | C751: 7 | D751: 9 | E751: =C751*6+D751 -> 51 | G751: 10 | H751: 13 | I751: =G751*6+H751 -> 73 | K751: 17 | L751: 18 | M751: =K751*6+L751 -> 120 | O751: 21 | P751: 23 | Q751: =O751*6+P751 -> 149 | S751: SUNSHINE
A752: SUNSHINE | C752: 4 | D752: 3 | E752: =C752*6+D752 -> 27 | G752: 6 | H752: 9 | I752: =G752*6+H752 -> 45 | K752: 11 | L752: 10 | M752: =K752*6+L752 -> 76 | O752: 13 | P752: 15 | Q752: =O752*6+P752 -> 93 | S752: VERGONA/MAY
A753: BEST PLAYERS
A754: OAKLEIGH | C754: WENN | F754: WOOD | I754: BATTERSBY | L754: COLLINS | O754: TAYLOR | R754: McDONALD
A755: SUNSHINE | C755: BROWN | F755: AXON | I755: COCHIERELLA | L755: HUNT | O755: CHATTERTON | R755: BENSON
A756: GOALKICKERS
A757: OAKLEIGH | C757: WOOD 10 | F757: TAYLOR 3 | H757: McDONALD 3 | K757: THOMAS 2 | N757: WENN | P757: OTT | R757: BATTERSBY
A758: SUNSHINE | C758: MANEY 3 | F758: CHATTERTON 3 | I758: AXON 2 | K758: BENSON | M758: JONES | O758: CAMPBELL | R758: GROSSMAN | U758: COCHIERELLA
A760: ROUND 17 | E760: 2ND AUGUST | J760: WEATHER | S760: PLAYED AT
D761: 1ST QTR | H761: 2ND QTR | L761: 3RD QTR | P761: FINAL | S761: OAKLEIGH
A762: OAKLEIGH | C762: 6 | D762: 3 | E762: =C762*6+D762 -> 39 | G762: 11 | H762: 8 | I762: =G762*6+H762 -> 74 | K762: 14 | L762: 12 | M762: =K762*6+L762 -> 96 | O762: 18 | P762: 18 | Q762: =O762*6+P762 -> 126 | S762: UMPIRE | X762: LADDER | AB762: ROUND | AD762: 17
A763: WERRIBEE | C763: 1 | D763: 3 | E763: =C763*6+D763 -> 9 | G763: 6 | H763: 8 | I763: =G763*6+H763 -> 44 | K763: 8 | L763: 12 | M763: =K763*6+L763 -> 60 | O763: 11 | P763: 15 | Q763: =O763*6+P763 -> 81 | S763: COLOSIMO/MORGAN
A764: BEST PLAYERS | W764: TEAM | X764: W | Y764: L | Z764: D | AA764: FOR | AB764: AGST | AC764: % | AD764: PTS
A765: OAKLEIGH | C765: COLLINS | F765: OTT | H765: BATTERSBY | K765: WENN | N765: TAYLOR | Q765: WOOD
A766: WERRIBEE | C766: DOUGLAS | F766: REDENBACH | I766: MENADUE | K766: SIMMONS | W766: CAMBERWELL | X766: 13 | Y766: 4 | Z766: 0 | AA766: 2230 | AB766: 1464 | AC766: =(AA766*100)/AB766 -> 152.3224043715847 | AD766: =(X766*4)+(Z766*2) -> 52
A767: GOALKICKERS | W767: MORDIALLOC | X767: 13 | Y767: 4 | Z767: 0 | AA767: 2094 | AB767: 1441 | AC767: =(AA767*100)/AB767 -> 145.31575294934075 | AD767: =(X767*4)+(Z767*2) -> 52
A768: OAKLEIGH | C768: WOOD 4 | E768: THOMAS 3 | G768: TAYLOR 3 | J768: OTT 2 | K768: McDONALD 2 | N768: COLLINS 2 | P768: WENN | R768: GILL | W768: WAVERLEY | X768: 12 | Y768: 5 | Z768: 0 | AA768: 2445 | AB768: 1397 | AC768: =(AA768*100)/AB768 -> 175.01789549033643 | AD768: =(X768*4)+(Z768*2) -> 48
A769: WERRIBEE | C769: REDENBACH 4 | F769: SIMMONS 3 | I769: DOUGLAS 2 | L769: 2 SHORT | W769: WERRIBEE | X769: 11 | Y769: 5 | Z769: 1 | AA769: 2146 | AB769: 1579 | AC769: =(AA769*100)/AB769 -> 135.90880303989866 | AD769: =(X769*4)+(Z769*2) -> 46
A771: MORDIALLOC | C771: 5 | D771: 5 | E771: =C771*6+D771 -> 35 | G771: 6 | H771: 8 | I771: =G771*6+H771 -> 44 | K771: 15 | L771: 17 | M771: =K771*6+L771 -> 107 | O771: 20 | P771: 22 | Q771: =O771*6+P771 -> 142 | S771: MORDIALLOC | W771: OAKLEIGH | X771: 11 | Y771: 6 | Z771: 0 | AA771: 2209 | AB771: 1650 | AC771: =(AA771*100)/AB771 -> 133.87878787878788 | AD771: =(X771*4)+(Z771*2) -> 44
A772: YARRAVILLE | C772: 3 | D772: 1 | E772: =C772*6+D772 -> 19 | G772: 6 | H772: 4 | I772: =G772*6+H772 -> 40 | K772: 6 | L772: 5 | M772: =K772*6+L772 -> 41 | O772: 7 | P772: 8 | Q772: =O772*6+P772 -> 50 | S772: BUDGE/MAY | W772: NORTHCOTE | X772: 10 | Y772: 7 | Z772: 0 | AA772: 1933 | AB772: 1688 | AC772: =(AA772*100)/AB772 -> 114.51421800947867 | AD772: =(X772*4)+(Z772*2) -> 40
A773: BEST PLAYERS | W773: WILLIAMSTOWN | X773: 9 | Y773: 7 | Z773: 1 | AA773: 2090 | AB773: 1906 | AC773: =(AA773*100)/AB773 -> 109.65372507869884 | AD773: =(X773*4)+(Z773*2) -> 38
A774: MORDIALLOC | C774: DUNBAR | F774: WALSH | H774: MASON | K774: DEATON | N774: MOORE | Q774: LANG | W774: YARRAVILLE | X774: 3 | Y774: 14 | Z774: 0 | AA774: 1611 | AB774: 2289 | AC774: =(AA774*100)/AB774 -> 70.380078636959368 | AD774: =(X774*4)+(Z774*2) -> 12
A775: YARRAVILLE | C775: McGHIE | F775: SQUIRE | H775: LEITCH | K775: RYAN | N775: PHELAN | Q775: RICHARDS | W775: BOX HILL | X775: 2 | Y775: 15 | Z775: 0 | AA775: 1498 | AB775: 2695 | AC775: =(AA775*100)/AB775 -> 55.584415584415588 | AD775: =(X775*4)+(Z775*2) -> 8
A776: GOALKICKERS | Q776: PETER BARDOEL | W776: SUNSHINE | X776: 0 | Y776: 17 | Z776: 0 | AA776: 1098 | AB776: 3154 | AC776: =(AA776*100)/AB776 -> 34.812935954343693 | AD776: =(X776*4)+(Z776*2) -> 0
A777: MORDIALLOC | C777: BOURNE 7 | F777: DEATON 3 | H777: O'HANLON 2 | K777: GUY 2 | M777: PAGNOCCOLO 2 | P777: ROGERSON 2 | S777: WALSH
A778: YARRAVILLE | C778: SMITH 2 | F778: RICHARDS 2 | I778: BROWN | K778: SIMPSON | M778: LEITCH
A780: WAVERLEY | C780: 5 | D780: 1 | E780: =C780*6+D780 -> 31 | G780: 15 | H780: 5 | I780: =G780*6+H780 -> 95 | K780: 22 | L780: 7 | M780: =K780*6+L780 -> 139 | O780: 31 | P780: 10 | Q780: =O780*6+P780 -> 196 | S780: BOX HILL
A781: BOX HILL | C781: 1 | D781: 2 | E781: =C781*6+D781 -> 8 | G781: 2 | H781: 2 | I781: =G781*6+H781 -> 14 | K781: 4 | L781: 5 | M781: =K781*6+L781 -> 29 | O781: 6 | P781: 5 | Q781: =O781*6+P781 -> 41 | S781: BLOOM/THOMSON
A782: BEST PLAYERS
A783: WAVERLEY | C783: CLARKE | F783: McLURE | H783: STYLES | K783: LOVELL | N783: HOWELL | Q783: ALEXANDER
A784: BOX HILL | C784: PETTIGREW | F784: HALE | H784: A DICKENSON | K784: McCANN | N784: LENNOX
A785: GOALKICKERS
A786: WAVERLEY | C786: McLURE 8 | F786: ANGELIS 6 | H786: STYLES 5 | J786: LOVELL 4 | L786: McEWAN 2 | O786: VENVILLE 2 | R786: PRITCHETT 2 | U786: BEDDOE | W786: VEAR
A787: BOX HILL | C787: ROBINSON | F787: CRUSE | H787: A DICKENSON | K787: B DICKENSON | N787: TAYLOR | P787: LAWTHER
A789: CAMBERWELL | C789: 7 | D789: 3 | E789: =C789*6+D789 -> 45 | G789: 11 | H789: 4 | I789: =G789*6+H789 -> 70 | K789: 14 | L789: 4 | M789: =K789*6+L789 -> 88 | O789: 15 | P789: 8 | Q789: =O789*6+P789 -> 98 | S789: WILLIAMSTOWN
A790: WILLIAMSTOWN | C790: 4 | D790: 4 | E790: =C790*6+D790 -> 28 | G790: 6 | H790: 9 | I790: =G790*6+H790 -> 45 | K790: 7 | L790: 9 | M790: =K790*6+L790 -> 51 | O790: 14 | P790: 11 | Q790: =O790*6+P790 -> 95 | S790: HUTCHISON/GRIFFITH
A791: BEST PLAYERS
A792: CAMBERWELL | C792: RICE | F792: HOWARD | I792: PEVITT | K792: OLIVER | N792: HIPWORTH | Q792: SPITHILL
A793: WILLIAMSTOWN | C793: BEBEND | F793: TWEEDLY | I793: OWEN | K793: CUTAJAR | N793: KELLY | Q793: GOETZ
A794: GOALKICKERS
A795: CAMBERWELL | C795: RICE 4 | E795: HIRST 3 | G795: HAMMOND 3 | J795: STEVENSON 2 | M795: TEAKEL | O795: OLIVER | Q795: NEILSON
A796: WILLIAMSTOWN | C796: FAIRLEY 3 | E796: RAUNIK 3 | G796: OWEN 3 | I796: TWEEDLY 2 | L796: KELLY | N796: SMITH | P796: EUDEY
A798: NORTHCOTE | C798: 5 | D798: 8 | E798: =C798*6+D798 -> 38 | G798: 9 | H798: 14 | I798: =G798*6+H798 -> 68 | K798: 16 | L798: 24 | M798: =K798*6+L798 -> 120 | O798: 29 | P798: 25 | Q798: =O798*6+P798 -> 199 | S798: SUNSHINE
A799: SUNSHINE | C799: 2 | D799: 2 | E799: =C799*6+D799 -> 14 | G799: 7 | H799: 6 | I799: =G799*6+H799 -> 48 | K799: 7 | L799: 9 | M799: =K799*6+L799 -> 51 | O799: 8 | P799: 14 | Q799: =O799*6+P799 -> 62 | S799: BRADSHAW/STEERE
A800: BEST PLAYERS
A801: NORTHCOTE | C801: M RYAN | F801: P RYAN | I801: EDWARDS | K801: PEART | N801: WHITEMAN | Q801: HEPBURN
A802: SUNSHINE | C802: BENSON | F802: GROSSMAN | I802: JONES | K802: VELLA
A803: GOALKICKERS
A804: NORTHCOTE | C804: WATTS 6 | F804: P RYAN 6 | I804: HEPBURN 6 | L804: JURGENSTEIN 5 | O804: PEART 3 | Q804: WHITEMAN 2 | T804: EDWARDS
A805: SUNSHINE | C805: MENADUE 3 | F805: WILLIAMS 2 | I805: COCHIERELLA | L805: BROWN | N805: CHATTERTON
A807: ROUND 18 | E807: 9TH AUGUST | J807: WEATHER | S807: PLAYED AT
D808: 1ST QTR | H808: 2ND QTR | L808: 3RD QTR | P808: FINAL | S808: WERRIBEE
A809: WERRIBEE | C809: 0 | D809: 1 | E809: =C809*6+D809 -> 1 | G809: 4 | H809: 5 | I809: =G809*6+H809 -> 29 | K809: 5 | L809: 6 | M809: =K809*6+L809 -> 36 | O809: 9 | P809: 9 | Q809: =O809*6+P809 -> 63 | S809: UMPIRE | X809: LADDER | AB809: ROUND | AD809: 18
A810: MORDIALLOC | C810: 1 | D810: 3 | E810: =C810*6+D810 -> 9 | G810: 3 | H810: 6 | I810: =G810*6+H810 -> 24 | K810: 5 | L810: 8 | M810: =K810*6+L810 -> 38 | O810: 6 | P810: 9 | Q810: =O810*6+P810 -> 45 | S810: STEERE/RYAN
A811: BEST PLAYERS | W811: TEAM | X811: W | Y811: L | Z811: D | AA811: FOR | AB811: AGST | AC811: % | AD811: PTS
A812: WERRIBEE | C812: MERCURI | F812: MENADUE | I812: REDENBACH | L812: DOUGLAS | O812: SIDEROW | R812: LANCASTER
A813: MORDIALLOC | C813: GUY | F813: PAGNOCCOLO | I813: WARREN | L813: O'HANLON | O813: MOORE | R813: ROGERSON | W813: CAMBERWELL | X813: 14 | Y813: 4 | Z813: 0 | AA813: 2417 | AB813: 1504 | AC813: =(AA813*100)/AB813 -> 160.70478723404256 | AD813: =(X813*4)+(Z813*2) -> 56
A814: GOALKICKERS | W814: WAVERLEY | X814: 13 | Y814: 5 | Z814: 0 | AA814: 2556 | AB814: 1423 | AC814: =(AA814*100)/AB814 -> 179.62052002810964 | AD814: =(X814*4)+(Z814*2) -> 52
A815: WERRIBEE | C815: LYONS 2 | E815: BREEN 2 | G815: DOUGLAS | I815: SIDEROW | K815: MERCURI | M815: ASLING | O815: PRICE | W815: MORDIALLOC | X815: 13 | Y815: 5 | Z815: 0 | AA815: 2139 | AB815: 1504 | AC815: =(AA815*100)/AB815 -> 142.22074468085106 | AD815: =(X815*4)+(Z815*2) -> 52
A816: MORDIALLOC | C816: BOURNE 3 | F816: PAGNOCCOLO | I816: GUY | K816: McILWRAITH | W816: WERRIBEE | X816: 12 | Y816: 5 | Z816: 1 | AA816: 2199 | AB816: 1624 | AC816: =(AA816*100)/AB816 -> 135.40640394088669 | AD816: =(X816*4)+(Z816*2) -> 50
A818: NORTHCOTE | C818: 3 | D818: 0 | E818: =C818*6+D818 -> 18 | G818: 6 | H818: 6 | I818: =G818*6+H818 -> 42 | K818: 9 | L818: 8 | M818: =K818*6+L818 -> 62 | O818: 10 | P818: 16 | Q818: =O818*6+P818 -> 76 | S818: NORTHCOTE | W818: OAKLEIGH | X818: 11 | Y818: 7 | Z818: 0 | AA818: 2271 | AB818: 1726 | AC818: =(AA818*100)/AB818 -> 131.57589803012746 | AD818: =(X818*4)+(Z818*2) -> 44
A819: OAKLEIGH | C819: 2 | D819: 3 | E819: =C819*6+D819 -> 15 | G819: 3 | H819: 6 | I819: =G819*6+H819 -> 24 | K819: 7 | L819: 8 | M819: =K819*6+L819 -> 50 | O819: 9 | P819: 8 | Q819: =O819*6+P819 -> 62 | S819: WILSON/ | W819: NORTHCOTE | X819: 11 | Y819: 7 | Z819: 0 | AA819: 2009 | AB819: 1750 | AC819: =(AA819*100)/AB819 -> 114.8 | AD819: =(X819*4)+(Z819*2) -> 44
A820: BEST PLAYERS | S820: HUTCHISON | W820: WILLIAMSTOWN | X820: 9 | Y820: 8 | Z820: 1 | AA820: 2116 | AB820: 2017 | AC820: =(AA820*100)/AB820 -> 104.90827962320277 | AD820: =(X820*4)+(Z820*2) -> 38
A821: NORTHCOTE | C821: EDWARDS | F821: PEART | I821: ROULSTON | L821: McINTYRE | O821: HYDE | Q821: MEGNA | W821: YARRAVILLE | X821: 4 | Y821: 14 | Z821: 0 | AA821: 1688 | AB821: 2359 | AC821: =(AA821*100)/AB821 -> 71.555743959304792 | AD821: =(X821*4)+(Z821*2) -> 16
A822: OAKLEIGH | C822: WENN | F822: TAYLOR | I822: ANSELL | L822: COLLINS | O822: BATTERSBY | W822: BOX HILL | X822: 2 | Y822: 16 | Z822: 0 | AA822: 1568 | AB822: 2772 | AC822: =(AA822*100)/AB822 -> 56.565656565656568 | AD822: =(X822*4)+(Z822*2) -> 8
A823: GOALKICKERS | W823: SUNSHINE | X823: 0 | Y823: 18 | Z823: 0 | AA823: 1138 | AB823: 3341 | AC823: =(AA823*100)/AB823 -> 34.061658186171805 | AD823: =(X823*4)+(Z823*2) -> 0
A824: NORTHCOTE | C824: P RYAN 3 | F824: HEPBURN 2 | I824: G RYAN 2 | K824: MEGNA | M824: JURGENSTEIN | P824: EDWARDS
A825: OAKLEIGH | C825: WOOD 3 | F825: THOMAS 2 | I825: TAYLOR | K825: BATTERSBY | N825: COLLINS | P825: GILL
A827: WAVERLEY | C827: 4 | D827: 5 | E827: =C827*6+D827 -> 29 | G827: 6 | H827: 8 | I827: =G827*6+H827 -> 44 | K827: 10 | L827: 13 | M827: =K827*6+L827 -> 73 | O827: 16 | P827: 15 | Q827: =O827*6+P827 -> 111 | S827: WAVERLEY
A828: WILLIAMSTOWN | C828: 1 | D828: 1 | E828: =C828*6+D828 -> 7 | G828: 1 | H828: 3 | I828: =G828*6+H828 -> 9 | K828: 2 | L828: 7 | M828: =K828*6+L828 -> 19 | O828: 3 | P828: 8 | Q828: =O828*6+P828 -> 26 | S828: COLOSIMO/MAY
A829: BEST PLAYERS
A830: WAVERLEY | C830: K McDONALD | F830: BRICK | H830: VENVILLE | K830: CARLSON | N830: HOWELL | P830: BEDDOE
A831: WILLIAMSTOWN | C831: TAYLOR | F831: GOETZ | H831: RAUNIK | K831: EUDEY | N831: BEBEND | P831: TWEEDLY
A832: GOALKICKERS
A833: WAVERLEY | C833: VENVILLE 3 | F833: VEAR 3 | H833: K McDONALD 3 | K833: STYLES 2 | M833: McEWAN 2 | O833: McLURE | Q833: LOVELL | S833: BRICK
A834: WILLIAMSTOWN | C834: RAUNIK 2 | F834: TWEEDLY
A836: YARRAVILLE | C836: 5 | D836: 0 | E836: =C836*6+D836 -> 30 | G836: 6 | H836: 3 | I836: =G836*6+H836 -> 39 | K836: 7 | L836: 7 | M836: =K836*6+L836 -> 49 | O836: 11 | P836: 11 | Q836: =O836*6+P836 -> 77 | S836: YARRAVILLE
A837: BOX HILL | C837: 4 | D837: 4 | E837: =C837*6+D837 -> 28 | G837: 7 | H837: 7 | I837: =G837*6+H837 -> 49 | K837: 8 | L837: 13 | M837: =K837*6+L837 -> 61 | O837: 9 | P837: 16 | Q837: =O837*6+P837 -> 70 | S837: MORGAN/BRADSHAW
A838: BEST PLAYERS
A839: YARRAVILLE | C839: LEITCH | F839: McGHIE | H839: McMAHON | K839: FOTHERINGHAM | O839: SIMPSON | R839: BROWN
A840: BOX HILL | C840: A DICKENSON | F840: KAINEY | H840: B DICKENSON | K840: LENNOX | O840: HARPER | R840: CRUSE
A841: GOALKICKERS
A842: YARRAVILLE | C842: SMITH 3 | E842: RICHARDS 2 | H842: FOTHERINGHAM 2 | L842: SIMPSON 2 | O842: ROGOZIK | Q842: SQUIRE
A843: BOX HILL | C843: KAINEY 3 | F843: CRUSE 2 | H843: PETTIGREW | K843: TAYLOR | M843: A DICKENSON | P843: WITHERS
A845: CAMBERWELL | C845: 4 | D845: 5 | E845: =C845*6+D845 -> 29 | G845: 11 | H845: 14 | I845: =G845*6+H845 -> 80 | K845: 19 | L845: 20 | M845: =K845*6+L845 -> 134 | O845: 27 | P845: 25 | Q845: =O845*6+P845 -> 187 | S845: CAMBERWELL
A846: SUNSHINE | C846: 2 | D846: 1 | E846: =C846*6+D846 -> 13 | G846: 2 | H846: 2 | I846: =G846*6+H846 -> 14 | K846: 3 | L846: 2 | M846: =K846*6+L846 -> 20 | O846: 6 | P846: 4 | Q846: =O846*6+P846 -> 40 | S846: BLOOM/BUDGE
A847: BEST PLAYERS
A848: CAMBERWELL | C848: OLIVER | F848: HOWARD | I848: CAHILL | L848: STEVENSON | O848: JUDD | Q848: HAMMOND
A849: SUNSHINE | C849: MITCHELL | F849: JONES | I849: HUNT | L849: BROWN | O849: GORE | Q849: COCHIERELLA
A850: GOALKICKERS
A851: CAMBERWELL | C851: STEVENSON 10 | F851: HAMMOND 6 | I851: TEAKEL 3 | K851: HOWARD 2 | N851: OLIVER 2 | P851: DAVIDSON 2 | S851: HIPWORTH | V851: JUDD
A852: SUNSHINE | C852: HUNT 2 | E852: COCHIERELLA 2 | I852: CAMPBELL | L852: PATTERSON
A854: FINALS
A855: 1ST SEMI | E855: 16TH AUGUST | J855: WEATHER | S855: PLAYED AT
D856: 1ST QTR | H856: 2ND QTR | L856: 3RD QTR | P856: FINAL | S856: TOORAK PARK
A857: MORDIALLOC | C857: 5 | D857: 6 | E857: =C857*6+D857 -> 36 | G857: 9 | H857: 12 | I857: =G857*6+H857 -> 66 | K857: 15 | L857: 17 | M857: =K857*6+L857 -> 107 | O857: 16 | P857: 20 | Q857: =O857*6+P857 -> 116 | S857: UMPIRE
A858: WERRIBEE | C858: 1 | D858: 1 | E858: =C858*6+D858 -> 7 | G858: 5 | H858: 4 | I858: =G858*6+H858 -> 34 | K858: 6 | L858: 6 | M858: =K858*6+L858 -> 42 | O858: 13 | P858: 8 | Q858: =O858*6+P858 -> 86 | S858: VERGONA/FITZPATRICK
A859: BEST PLAYERS
A860: MORDIALLOC | C860: DEATON | F860: BATTY | I860: MASON | L860: GUY | O860: PARKER | R860: MARGHERITI
A861: WERRIBEE | C861: GUDDE | F861: MEMBREY | I861: MENADUE | L861: PARKES | O861: DOUGLAS | R861: TAYLOR
A862: GOALKICKERS
A863: MORDIALLOC | C863: BOURNE 6 | F863: BATTY 2 | H863: PARKER 2 | K863: ROGERSON 2 | N863: GUY | O863: DEATON | R863: PETER BARDOEL | U863: PAGNOCCOLO
A864: WERRIBEE | C864: LEECE 5 | F864: LYONS 2 | H864: HUGHES 2 | K864: PARKES | M864: TAYLOR | O864: GUDDE | Q864: SIMMONS
A866: 2ND SEMI | E866: 23RD AUGUST | J866: WEATHER
A867: CAMBERWELL | C867: 8 | D867: 4 | E867: =C867*6+D867 -> 52 | G867: 14 | H867: 8 | I867: =G867*6+H867 -> 92 | K867: 19 | L867: 12 | M867: =K867*6+L867 -> 126 | O867: 30 | P867: 15 | Q867: =O867*6+P867 -> 195 | S867: TOORAK PARK
A868: WAVERLEY | C868: 2 | D868: 2 | E868: =C868*6+D868 -> 14 | G868: 10 | H868: 5 | I868: =G868*6+H868 -> 65 | K868: 13 | L868: 10 | M868: =K868*6+L868 -> 88 | O868: 13 | P868: 13 | Q868: =O868*6+P868 -> 91
A869: BEST PLAYERS
A870: CAMBERWELL | C870: HIPWORTH | F870: NEILSON | I870: PEVITT | L870: OLIVER | O870: HIRST | R870: STEVENSON
A871: WAVERLEY | C871: HOWELL | F871: LOVEL | I871: STYLES | L871: WILLIAMS | O871: R KINNABURGH
A872: GOALKICKERS
A873: CAMBERWELL | C873: STEVENSON 8 | F873: HAMMOND 5 | I873: HIRST 5 | K873: NEILSON 2 | N873: CHAMBERLAIN 2 | R873: TEAKEL 2 | T873: DAVIDSON | W873: HOWARD | X873: HIPWORTH | Z873: McFEE | AA873: OLIVER | AB873: COOK
A874: WAVERLEY | C874: ANGELIS 5 | F874: STYLES 2 | H874: VENVILLE 2 | K874: BEDDOE 2 | N874: McCLURE | P874: LOVEL
A876: PRELIMINARY | E876: 30TH AUGUST | J876: WEATHER
A877: WAVERLEY | C877: 5 | D877: 3 | E877: =C877*6+D877 -> 33 | G877: 10 | H877: 7 | I877: =G877*6+H877 -> 67 | K877: 14 | L877: 14 | M877: =K877*6+L877 -> 98 | O877: 20 | P877: 13 | Q877: =O877*6+P877 -> 133 | S877: TOORAK PARK
A878: MORDIALLOC | C878: 7 | D878: 2 | E878: =C878*6+D878 -> 44 | G878: 8 | H878: 9 | I878: =G878*6+H878 -> 57 | K878: 11 | L878: 12 | M878: =K878*6+L878 -> 78 | O878: 13 | P878: 16 | Q878: =O878*6+P878 -> 94 | S878: TORNEY/OAKLEY
A879: BEST PLAYERS
A880: WAVERLEY | C880: BRICK | F880: ALEXANDER | I880: WILLIAMS | L880: W McDONALD | O880: DAVIES | R880: ANGELIS
A881: MORDIALLOC | C881: MASON | F881: DUNBAR | I881: MOORE | L881: GUY | O881: MARGHERITI
A882: GOALKICKERS
A883: WAVERLEY | C883: ANGELIS 7 | F883: DAVIES 6 | I883: BRICK 2 | K883: W McDONALD 2 | O883: BEDDOE 2 | R883: WILLIAMS
A884: MORDIALLOC | C884: GUY 3 | F884: DEATON 3 | I884: BOURNE 3 | K884: ALVES 2 | M884: PARKER | O884: WALSH
A886: GRAND | E886: 6TH SEPTEMBER | J886: WEATHER
A887: CAMBERWELL | C887: 2 | D887: 3 | E887: =C887*6+D887 -> 15 | G887: 7 | H887: 10 | I887: =G887*6+H887 -> 52 | K887: 12 | L887: 11 | M887: =K887*6+L887 -> 83 | O887: 15 | P887: 16 | Q887: =O887*6+P887 -> 106 | S887: TOORAK PK
A888: WAVERLEY | C888: 1 | D888: 3 | E888: =C888*6+D888 -> 9 | G888: 3 | H888: 4 | I888: =G888*6+H888 -> 22 | K888: 8 | L888: 7 | M888: =K888*6+L888 -> 55 | O888: 11 | P888: 8 | Q888: =O888*6+P888 -> 74 | S888: VERGONA/TORNEY
A889: BEST PLAYERS
A890: CAMBERWELL | C890: WRIGHT | F890: HAMMOND | I890: HIPWORTH | L890: CHAMBERLAIN | O890: CAHILL | R890: McFEE
A891: WAVERLEY | C891: STYLES | F891: HOWELL | I891: VENVILLE | L891: McEWAN | O891: CARLSON | R891: LOVELL
A892: GOALKICKERS
A893: CAMBERWELL | C893: STEVENSON 5 | F893: HAMMOND 4 | I893: OLIVER | K893: COOK | M893: CHAMBERLAIN | P893: DAVIDSON | R893: HIRST | S893: NEILSON
A894: WAVERLEY | C894: STYLES 2 | F894: ANGELIS 2 | I894: VENVILLE 2 | L894: DAVIES 2 | N894: BEDDOE | P894: PLUMMER | R894: BRICK