A1: Victorian Football Association
A2: Season 1982 - Division One
A3: © Copyright Wal Williams | F3: First created: 14 November 2015
A4: Contact: joywalwi at gmail dot com | F4: Last updated: 3 December 2016 | W4: VFA Results and tables - Link to the main index page
A5: You are free to copy this document in whole or part provided that proper acknowledgement is given to the author. All rights reserved.
A7: 1982 | C7: 1ST DIVISION
A8: ROUND 1 | D8: 4TH APRIL | I8: WEATHER | S8: VENUE: COBURG
D9: 1ST QTR | H9: 2ND QTR | L9: 3RD QTR | P9: FINAL | S9: UMPIRES
A10: COBURG | C10: 2 | D10: 5 | E10: 17 | G10: 9 | H10: 11 | I10: 65 | K10: 18 | L10: 17 | M10: 125 | O10: 22 | P10: 21 | Q10: 153 | S10: CROXFORD | X10: LADDER | AB10: ROUND | AD10: 1
A11: WAVERLEY | C11: 3 | D11: 2 | E11: 20 | G11: 4 | H11: 4 | I11: 28 | K11: 6 | L11: 6 | M11: 42 | O11: 10 | P11: 11 | Q11: 71 | S11: OGSTON
A12: BEST PLAYERS | W12: TEAM | X12: W | Y12: L | Z12: D | AA12: FOR | AB12: AGST | AC12: % | AD12: PTS
A13: COBURG | C13: EADE | F13: HALBERT | I13: SHELDON | L13: M HARBINSON | O13: CLEARY | R13: COLLINS
A14: WAVERLEY | C14: STYLES | F14: McEWAN | I14: FOWLER | L14: HOWELL | O14: ALEXANDER | R14: JONES | W14: PRESTON | X14: 1 | Y14: 0 | Z14: 0 | AA14: 164 | AB14: 135 | AC14: =(AA14/AB14)*100 -> 121.48148148148148 | AD14: =(X14*4)+(Z14*2) -> 4
A15: GOALKICKERS | N15: BURT | P15: COLLINS | R15: MILROY | W15: CAMBERWELL | X15: 1 | Y15: 0 | Z15: 0 | AA15: 161 | AB15: 127 | AC15: =(AA15/AB15)*100 -> 126.77165354330708 | AD15: =(X15*4)+(Z15*2) -> 4
A16: COBURG | C16: LAIDLER 4 | E16: M HARBINSON 4 | H16: CLEARY 3 | J16: HERBERT 3 | M16: HALBERT 2 | P16: ALLISON 2 | R16: FITZGERALD | W16: WERRIBEE | X16: 1 | Y16: 0 | Z16: 0 | AA16: 134 | AB16: 92 | AC16: =(AA16/AB16)*100 -> 145.65217391304347 | AD16: =(X16*4)+(Z16*2) -> 4
A17: WAVERLEY | C17: JONES 3 | F17: BRIGGS 2 | H17: VEAR 2 | J17: VENVILLE 2 | M17: McCORMACK | W17: FRANKSTON | X17: 1 | Y17: 0 | Z17: 0 | AA17: 164 | AB17: 112 | AC17: =(AA17/AB17)*100 -> 146.42857142857142 | AD17: =(X17*4)+(Z17*2) -> 4
S18: VENUE: GEELONG WEST
A19: GEELONG WEST | C19: 3 | D19: 5 | E19: 23 | G19: 8 | H19: 10 | I19: 58 | K19: 14 | L19: 15 | M19: 99 | O19: 21 | P19: 23 | Q19: 149 | S19: MORGAN | W19: COBURG | X19: 1 | Y19: 0 | Z19: 0 | AA19: 153 | AB19: 71 | AC19: =(AA19/AB19)*100 -> 215.49295774647885 | AD19: =(X19*4)+(Z19*2) -> 4
A20: DANDENONG | C20: 5 | D20: 3 | E20: 33 | G20: 6 | H20: 4 | I20: 40 | K20: 10 | L20: 6 | M20: 66 | O20: 10 | P20: 8 | Q20: 68 | S20: GRIFFITHS | W20: GEELONG WEST | X20: 1 | Y20: 0 | Z20: 0 | AA20: 149 | AB20: 68 | AC20: =(AA20/AB20)*100 -> 219.11764705882354 | AD20: =(X20*4)+(Z20*2) -> 4
A21: BEST PLAYERS | W21: DANDENONG | X21: 0 | Y21: 1 | Z21: 0 | AA21: 68 | AB21: 149 | AC21: =(AA21/AB21)*100 -> 45.63758389261745 | AD21: =(X21*4)+(Z21*2) -> 0
A22: GEELONG WEST | C22: TORNEY | F22: EDDY | I22: TAYLOR | L22: BROWNE | O22: GIBSON | R22: WILSON | W22: WAVERLEY | X22: 0 | Y22: 1 | Z22: 0 | AA22: 71 | AB22: 153 | AC22: =(AA22/AB22)*100 -> 46.405228758169933 | AD22: =(X22*4)+(Z22*2) -> 0
A23: DANDENONG | C23: POWLES | F23: LACEY | I23: P KNIGHT | L23: KAYE | O23: CROWLEY | R23: THOMPSON | W23: SANDRINGHAM | X23: 0 | Y23: 1 | Z23: 0 | AA23: 112 | AB23: 164 | AC23: =(AA23/AB23)*100 -> 68.292682926829272 | AD23: =(X23*4)+(Z23*2) -> 0
A24: GOALKICKERS | W24: PRAHRAN | X24: 0 | Y24: 1 | Z24: 0 | AA24: 92 | AB24: 134 | AC24: =(AA24/AB24)*100 -> 68.656716417910445 | AD24: =(X24*4)+(Z24*2) -> 0
A25: GEELONG WEST | C25: BROWNE 4 | E25: WOODARD 4 | H25: TODD 2 | J25: WILSON 2 | L25: EDDY 2 | N25: TAYLOR 2 | P25: MOTT 2 | R25: GIBSON 2 | T25: YATES | W25: WILLIAMSTOWN | X25: 0 | Y25: 1 | Z25: 0 | AA25: 127 | AB25: 161 | AC25: =(AA25/AB25)*100 -> 78.881987577639762 | AD25: =(X25*4)+(Z25*2) -> 0
A26: DANDENONG | C26: POWLES 4 | F26: HENWOOD 2 | I26: O'KEEFE | K26: MADDEN | M26: CROWLEY | O26: O'CONNELL | W26: PORT MELBOURNE | X26: 0 | Y26: 1 | Z26: 0 | AA26: 135 | AB26: 164 | AC26: =(AA26/AB26)*100 -> 82.317073170731703 | AD26: =(X26*4)+(Z26*2) -> 0
A28: WERRIBEE | C28: 3 | D28: 5 | E28: 23 | G28: 9 | H28: 6 | I28: 60 | K28: 14 | L28: 11 | M28: 95 | O28: 20 | P28: 14 | Q28: 134 | S28: VENUE: WERRIBEE
A29: PRAHRAN | C29: 2 | D29: 7 | E29: 19 | G29: 6 | H29: 10 | I29: 46 | K29: 7 | L29: 14 | M29: 56 | O29: 12 | P29: 20 | Q29: 92 | S29: FITZPATRICK :K QUINN
A30: BEST PLAYERS
A31: WERRIBEE | C31: GUDDE | F31: MENADUE | I31: JACK | K31: KING | N31: REDENBACH | Q31: SVORINICH
A32: PRAHRAN | C32: STONE | F32: McCORMACK | I32: MOIR | K32: TWOMEY | N32: WALLACE
A33: GOALKICKERS
A34: WERRIBEE | C34: KING 3 | E34: ALLEN 3 | G34: SIMMONS 2 | I34: LOWE 2 | K34: REDENBACH 2 | N34: VAN DER WARDE | R34: MORRIS | U34: MENADUE | X34: HUMMEL
A35: PRAHRAN | C35: SMITH 4 | E35: McCORMACK 2 | H35: DICKSON | J35: GOETZ | L35: KNIGHT | N35: YOUNG | P35: STONE | R35: HIBBS
A37: FRANKSTON | C37: 7 | D37: 4 | E37: 46 | G37: 10 | H37: 10 | I37: 70 | K37: 13 | L37: 14 | M37: 92 | O37: 25 | P37: 14 | Q37: 164 | S37: VENUE: FRANKSTON
A38: SANDRINGHAM | C38: 4 | D38: 3 | E38: 27 | G38: 7 | H38: 12 | I38: 54 | K38: 14 | L38: 13 | M38: 97 | O38: 16 | P38: 16 | Q38: 112 | S38: OAKLEY :ALLSOPP
A39: BEST PLAYERS
A40: FRANKSTON | C40: LANE | E40: BEATON | H40: CZARNECKI | K40: ROGERSON | N40: KENNEDY | Q40: SALA
A41: SANDRINGHAM | C41: ADAMS | E41: NANKERVIS | H41: O'BRIEN | K41: RICHARDS | N41: OSBORNE | Q41: DROSCHER
A42: GOALKICKERS
A43: FRANKSTON | C43: LANE 5 | E43: ROGERSON 4 | H43: BELL 3 | J43: KENNEDY 2 | M43: HUMPHREY 2 | P43: CLIFFORD 2 | R43: HAMILL 2 | U43: SALA | W43: LOCKWOOD | X43: BEATON | AA43: BOYD | AC43: HORLER
A44: SANDRINGHAM | C44: NANKERVIS 8 | F44: O'BRIEN 2 | H44: CATHCART 2 | K44: MAILING | M44: STEVENS | O44: RICHARDS | Q44: MANNIX
A46: CAMBERWELL | C46: 10 | D46: 8 | E46: 68 | G46: 15 | H46: 10 | I46: 100 | K46: 16 | L46: 16 | M46: 112 | O46: 24 | P46: 17 | Q46: 161 | S46: VENUE: CAMBERWELL
A47: WILLIAMSTOWN | C47: 3 | D47: 1 | E47: 19 | G47: 6 | H47: 5 | I47: 41 | K47: 9 | L47: 9 | M47: 63 | O47: 19 | P47: 13 | Q47: 127 | S47: VERGONA :TORNEY
A48: BEST PLAYERS
A49: CAMBERWELL | C49: McFEE | F49: HAMMOND | I49: ROURKE | L49: JUDD | O49: EVANS | Q49: FLOWER
A50: WILLIAMSTOWN | C50: SAMPSON | F50: GOETZ | I50: MATTHEWS | L50: RAUNIK | O50: McTAGGART
A51: GOALKICKERS
A52: CAMBERWELL | C52: HAMMOND 8 | F52: DAVIDSON 4 | I52: STEVENSON 4 | L52: HIRST 3 | N52: COWLEY 3 | Q52: EVANS | S52: JUDD
A53: WILLIAMSTOWN | C53: GOETZ 4 | F53: OBORNE 3 | I53: FOTHERINGHAM 3 | M53: KELLY 3 | O53: MATTHEWS 2 | R53: McTAGGART 2 | W53: HOLDER | Y53: BEBEND
A55: PRESTON | C55: 7 | D55: 0 | E55: 42 | G55: 14 | H55: 7 | I55: 91 | K55: 20 | L55: 14 | M55: 134 | O55: 24 | P55: 20 | Q55: 164 | S55: VENUE: PORT MELBOURNE
A56: PORT MELBOURNE | C56: 6 | D56: 6 | E56: 42 | G56: 9 | H56: 9 | I56: 63 | K56: 17 | L56: 11 | M56: 113 | O56: 20 | P56: 15 | Q56: 135 | S56: GROOM :FITZPATRICK
A57: BEST PLAYERS
A58: PRESTON | C58: AUSTIN | F58: SHAW | I58: WRIGHT | L58: McKEON | O58: HALAS | R58: WARREN
A59: PORT MELBOURNE | C59: RODDA | F59: WILKINSON | I59: DEMETRIOU | L59: COOK | O59: M GOSS | R59: BRADBURY
A60: GOALKICKERS
A61: PRESTON | C61: HALAS 6 | E61: WARREN 4 | G61: DINTINOSANTE 4 | J61: SHAW 3 | L61: BODEN 2 | N61: McGAW 2 | P61: KELLY | R61: McKEON | U61: McDONNELL
A62: PORT MELBOURNE | C62: COOK 7 | E62: ANDERSON 4 | H62: WILKINSON 3 | K62: EVANS 2 | M62: KAVANAGH 2 | P62: SWAN | R62: EBEYER
A64: ROUND 2 | D64: 11TH APRIL | I64: WEATHER | S64: VENUE: PRESTON
D65: 1ST QTR | H65: 2ND QTR | L65: 3RD QTR | P65: FINAL | S65: UMPIRES
A66: CAMBERWELL | C66: 3 | D66: 3 | E66: 21 | G66: 5 | H66: 5 | I66: 35 | K66: 14 | L66: 11 | M66: 95 | O66: 18 | P66: 13 | Q66: 121 | S66: OGSTON | X66: LADDER | AB66: ROUND | AD66: 2
A67: PRESTON | C67: 3 | D67: 2 | E67: 20 | G67: 12 | H67: 7 | I67: 79 | K67: 15 | L67: 10 | M67: 100 | O67: 17 | P67: 17 | Q67: 119 | S67: OAKLEY
A68: BEST PLAYERS | W68: TEAM | X68: W | Y68: L | Z68: D | AA68: FOR | AB68: AGST | AC68: % | AD68: PTS
A69: CAMBERWELL | C69: ROURKE | F69: EVANS | I69: CAHILL | L69: RICE | N69: FLOWER | Q69: NEILSON
A70: PRESTON | C70: AUSTEN | F70: McKEON | I70: BARTLETT | L70: SHAW | N70: TOWAN | Q70: KELLY | W70: COBURG | X70: 2 | Y70: 0 | Z70: 0 | AA70: 329 | AB70: 198 | AC70: =(AA70/AB70)*100 -> 166.16161616161617 | AD70: =(X70*4)+(Z70*2) -> 8
A71: GOALKICKERS | W71: CAMBERWELL | X71: 2 | Y71: 0 | Z71: 0 | AA71: 282 | AB71: 246 | AC71: =(AA71/AB71)*100 -> 114.63414634146341 | AD71: =(X71*4)+(Z71*2) -> 8
A72: CAMBERWELL | C72: EVANS 6 | F72: HAMMOND 4 | I72: STEVENSON 3 | L72: ROURKE 3 | N72: HIRST 2 | W72: PORT MELBOURNE | X72: 1 | Y72: 1 | Z72: 0 | AA72: 374 | AB72: 263 | AC72: =(AA72/AB72)*100 -> 142.20532319391634 | AD72: =(X72*4)+(Z72*2) -> 4
A73: PRESTON | C73: BARTLETT 4 | F73: HALAS 3 | H73: VANN 2 | J73: WARREN 2 | M73: SHAW 2 | O73: BODEN 2 | Q73: KELLY | W73: GEELONG WEST | X73: 1 | Y73: 1 | Z73: 0 | AA73: 273 | AB73: 241 | AC73: =(AA73/AB73)*100 -> 113.27800829875518 | AD73: =(X73*4)+(Z73*2) -> 4
P74: DINTINOSANTE | S74: VENUE: WILLIAMSTOWN
A75: WILLIAMSTOWN | C75: 4 | D75: 4 | E75: 28 | G75: 11 | H75: 9 | I75: 75 | K75: 15 | L75: 10 | M75: 100 | O75: 22 | P75: 13 | Q75: 145 | S75: GROOM | W75: PRESTON | X75: 1 | Y75: 1 | Z75: 0 | AA75: 283 | AB75: 256 | AC75: =(AA75/AB75)*100 -> 110.546875 | AD75: =(X75*4)+(Z75*2) -> 4
A76: FRANKSTON | C76: 4 | D76: 3 | E76: 27 | G76: 6 | H76: 5 | I76: 41 | K76: 13 | L76: 14 | M76: 92 | O76: 15 | P76: 16 | Q76: 106 | S76: CROXFORD | W76: SANDRINGHAM | X76: 1 | Y76: 1 | Z76: 0 | AA76: 271 | AB76: 255 | AC76: =(AA76/AB76)*100 -> 106.27450980392157 | AD76: =(X76*4)+(Z76*2) -> 4
A77: BEST PLAYERS | W77: FRANKSTON | X77: 1 | Y77: 1 | Z77: 0 | AA77: 270 | AB77: 257 | AC77: =(AA77/AB77)*100 -> 105.05836575875487 | AD77: =(X77*4)+(Z77*2) -> 4
A78: WILLIAMSTOWN | C78: FOSTER | E78: MAHER | H78: FOTHERINGHAM | K78: TWEEDLY | N78: GOETZ | Q78: RAUNIK | W78: PRAHRAN | X78: 1 | Y78: 1 | Z78: 0 | AA78: 265 | AB78: 258 | AC78: =(AA78/AB78)*100 -> 102.71317829457365 | AD78: =(X78*4)+(Z78*2) -> 4
A79: FRANKSTON | C79: LANE | E79: LYNN | H79: HORLER | K79: HAMILL | N79: ROGERSON | W79: WILLIAMSTOWN | X79: 1 | Y79: 1 | Z79: 0 | AA79: 272 | AB79: 267 | AC79: =(AA79/AB79)*100 -> 101.87265917602997 | AD79: =(X79*4)+(Z79*2) -> 4
A80: GOALKICKERS | W80: WERRIBEE | X80: 1 | Y80: 1 | Z80: 0 | AA80: 225 | AB80: 251 | AC80: =(AA80/AB80)*100 -> 89.641434262948209 | AD80: =(X80*4)+(Z80*2) -> 4
A81: WILLIAMSTOWN | C81: FOTHERINGHAM 7 | F81: SAIT 4 | H81: OBORNE 3 | J81: McRAE 3 | L81: TWEEDLY 2 | N81: KELLY | P81: BEBEND | R81: TAYLOR | W81: DANDENONG | X81: 0 | Y81: 2 | Z81: 0 | AA81: 195 | AB81: 325 | AC81: =(AA81/AB81)*100 -> 60 | AD81: =(X81*4)+(Z81*2) -> 0
A82: FRANKSTON | C82: LANE 5 | E82: SALA 3 | G82: KENNEDY 2 | I82: ROGERSON 2 | L82: CLIFFORD 2 | O82: GEDDES | W82: WAVERLEY | X82: 0 | Y82: 2 | Z82: 0 | AA82: 170 | AB82: 392 | AC82: =(AA82/AB82)*100 -> 43.367346938775512 | AD82: =(X82*4)+(Z82*2) -> 0
A84: PORT MELBOURNE | C84: 11 | D84: 5 | E84: 71 | G84: 15 | H84: 8 | I84: 98 | K84: 29 | L84: 10 | M84: 184 | O84: 37 | P84: 17 | Q84: 239 | S84: VENUE: WAVERLEY
A85: WAVERLEY | C85: 2 | D85: 4 | E85: 16 | G85: 6 | H85: 10 | I85: 46 | K85: 9 | L85: 14 | M85: 68 | O85: 13 | P85: 21 | Q85: 99 | S85: MORGAN :QUINN
A86: BEST PLAYERS
A87: PORT MELBOURNE | C87: EVANS | F87: COOK | I87: DAVIES | L87: JOHNSON | O87: SWAN | R87: ROBERTSON
A88: WAVERLEY | C88: VENVILLE | F88: FOWLER | I88: KINNABURGH | L88: BRICK | O88: McEWAN | R88: HOWELL
A89: GOALKICKERS
A90: PORT MELBOURNE | C90: COOK 10 | E90: EVANS 9 | G90: ANDERSON 6 | J90: KAVANAGH 3 | M90: SWAN 2 | O90: M GOSS 2 | Q90: EBEYER 2 | S90: DEMETRIOU | V90: WILKINSON | X90: RODDA
A91: WAVERLEY | C91: JONES 3 | E91: VENVILLE 3 | H91: McCORMACK 2 | K91: VEAR | M91: MILBURN | O91: FOWLER | Q91: CLARKE
A93: SANDRINGHAM | C93: 2 | D93: 2 | E93: 14 | G93: 9 | H93: 15 | I93: 69 | K93: 14 | L93: 17 | M93: 101 | O93: 23 | P93: 21 | Q93: 159 | S93: VENUE: BEACH ROAD
A94: WERRIBEE | C94: 6 | D94: 4 | E94: 40 | G94: 9 | H94: 6 | I94: 60 | K94: 11 | L94: 9 | M94: 75 | O94: 13 | P94: 13 | Q94: 91 | S94: FITZPATRICK :GRIFFITH
A95: BEST PLAYERS
A96: SANDRINGHAM | C96: MANNIX | F96: WILKINS | I96: ADAMS | L96: FITZPATRICK | O96: HAYES | Q96: SARAU
A97: WERRIBEE | C97: HUGHES | F97: REID | I97: SIMMONS | L97: MENADUE | O97: PARKES
A98: GOALKICKERS
A99: SANDRINGHAM | C99: NANKERVIS 4 | F99: MACLEOD 4 | I99: RICHARDS 4 | L99: O'BRIEN 3 | N99: MANNIX 2 | Q99: WAY 2 | S99: MAILING | W99: FITZPATRICK | X99: ADAMS | AA99: SARAU
A100: WERRIBEE | C100: RICHARDSON 3 | F100: VAN WARDEN 3 | I100: SIMMONS 2 | L100: MORRIS 2 | N100: REID | P100: ALLEN | R100: HUMMEL
A102: PRAHRAN | C102: 3 | D102: 6 | E102: 24 | G102: 10 | H102: 13 | I102: 73 | K102: 17 | L102: 17 | M102: 119 | O102: 26 | P102: 17 | Q102: 173 | S102: VENUE: TOORAK PARK
A103: GEELONG WEST | C103: 0 | D103: 4 | E103: 4 | G103: 6 | H103: 6 | I103: 42 | K103: 13 | L103: 12 | M103: 90 | O103: 18 | P103: 16 | Q103: 124 | S103: ALLSOPP :TORNEY
A104: BEST PLAYERS
A105: PRAHRAN | C105: MOIR | F105: C COONEY | I105: SMITH | L105: McCORMACK | O105: TAYLOR
A106: GEELONG WEST | C106: ROBINSON | F106: BROWNE | I106: WILSON | L106: GIBSON | O106: CURRAN | R106: FOOTT
A107: GOALKICKERS
A108: PRAHRAN | C108: SMITH 12 | F108: McCORMACK 6 | I108: TWOMEY 2 | L108: MOIR 2 | N108: WRIGHT | P108: COONEY | R108: TAYLOR | U108: STONE
A109: GEELONG WEST | C109: BROWNE 6 | F109: TAYLOR 5 | I109: MOTT 2 | K109: YATES 2 | M109: EDDY 2 | O109: WILSON
A111: COBURG | C111: 7 | D111: 6 | E111: 48 | G111: 15 | H111: 9 | I111: 99 | K111: 20 | L111: 13 | M111: 133 | O111: 27 | P111: 14 | Q111: 176 | S111: VENUE: DANDENONG
A112: DANDENONG | C112: 1 | D112: 3 | E112: 9 | G112: 6 | H112: 6 | I112: 42 | K112: 15 | L112: 10 | M112: 100 | O112: 19 | P112: 13 | Q112: 127 | S112: GOLLOP :VERGONA
A113: BEST PLAYERS
A114: COBURG | C114: COLLINS | F114: NIMMO | I114: HERBERT | L114: ALLISON | O114: CLEARY | R114: SHELDON
A115: DANDENONG | C115: WENN | F115: ORTON | I115: MADDEN | L115: WRIGHT | O115: HENWOOD | R115: LACEY
A116: GOALKICKERS | U116: SALTMARSH | X116: EADE
A117: COBURG | C117: ALLISON 6 | E117: HERBERT 4 | G117: FITZGERALD 3 | J117: M HARBINSON 3 | N117: LAIDLER 2 | Q117: CLEARY 2 | S117: NIMMO | V117: HALBERT | X117: HALSALL | AA117: BURT | AB117: COLLINS
A118: DANDENONG | C118: HENWOOD 5 | F118: WENN 4 | H118: CROWLEY 3 | K118: ROSS 2 | M118: WRIGHT 2 | O118: MADDEN 2 | Q118: LACEY
A120: ROUND 3 | D120: 18TH APRIL | I120: WEATHER | S120: VENUE: GEELONG WEST
D121: 1ST QTR | H121: 2ND QTR | L121: 3RD QTR | P121: FINAL | S121: UMPIRES
A122: GEELONG WEST | C122: 3 | D122: 6 | E122: 24 | G122: 7 | H122: 13 | I122: 55 | K122: 14 | L122: 18 | M122: 102 | O122: 22 | P122: 25 | Q122: 157 | S122: VERGONA | X122: LADDER | AB122: ROUND | AD122: 3
A123: SANDRINGHAM | C123: 2 | D123: 5 | E123: 17 | G123: 3 | H123: 6 | I123: 24 | K123: 7 | L123: 11 | M123: 53 | O123: 11 | P123: 13 | Q123: 79 | S123: QUINN
A124: BEST PLAYERS | W124: TEAM | X124: W | Y124: L | Z124: D | AA124: FOR | AB124: AGST | AC124: % | AD124: PTS
A125: GEELONG WEST | C125: CRICHTON | F125: TORNEY | I125: BROWNE | L125: DALIHAUS | O125: EDDY | Q125: WOODARD
A126: SANDRINGHAM | C126: SARAU | F126: HAYES | I126: MACLEOD | L126: MANNIX | O126: ADAMS | W126: COBURG | X126: 3 | Y126: 0 | Z126: 0 | AA126: 442 | AB126: 292 | AC126: =(AA126/AB126)*100 -> 151.36986301369865 | AD126: =(X126*4)+(Z126*2) -> 12
A127: GOALKICKERS | Q127: EDDY | W127: PORT MELBOURNE | X127: 2 | Y127: 1 | Z127: 0 | AA127: 512 | AB127: 368 | AC127: =(AA127/AB127)*100 -> 139.13043478260869 | AD127: =(X127*4)+(Z127*2) -> 8
A128: GEELONG WEST | C128: BROWNE 6 | E128: WOODARD 6 | H128: TAYLOR 3 | J128: YATES 2 | L128: GIBSON | N128: CURRAN | P128: M TODD | R128: DALIHAUS | W128: GEELONG WEST | X128: 2 | Y128: 1 | Z128: 0 | AA128: 430 | AB128: 320 | AC128: =(AA128/AB128)*100 -> 134.375 | AD128: =(X128*4)+(Z128*2) -> 8
A129: SANDRINGHAM | C129: O'BRIEN 3 | F129: MACLEOD 3 | I129: RICHARDS 2 | L129: NANKERVIS | O129: WAY | Q129: ADAMS | W129: PRESTON | X129: 2 | Y129: 1 | Z129: 0 | AA129: 419 | AB129: 344 | AC129: =(AA129/AB129)*100 -> 121.80232558139534 | AD129: =(X129*4)+(Z129*2) -> 8
S130: VENUE: WERRIBEE
A131: WERRIBEE | C131: 7 | D131: 3 | E131: 45 | G131: 14 | H131: 11 | I131: 95 | K131: 18 | L131: 16 | M131: 124 | O131: 26 | P131: 23 | Q131: 179 | S131: OAKLEY | W131: WERRIBEE | X131: 2 | Y131: 1 | Z131: 0 | AA131: 404 | AB131: 355 | AC131: =(AA131/AB131)*100 -> 113.80281690140845 | AD131: =(X131*4)+(Z131*2) -> 8
A132: WILLIAMSTOWN | C132: 2 | D132: 3 | E132: 15 | G132: 6 | H132: 7 | I132: 43 | K132: 9 | L132: 12 | M132: 66 | O132: 15 | P132: 14 | Q132: 104 | S132: OGSTON | W132: CAMBERWELL | X132: 2 | Y132: 1 | Z132: 0 | AA132: 387 | AB132: 384 | AC132: =(AA132/AB132)*100 -> 100.78125 | AD132: =(X132*4)+(Z132*2) -> 8
A133: BEST PLAYERS | W133: PRAHRAN | X133: 1 | Y133: 2 | Z133: 0 | AA133: 359 | AB133: 371 | AC133: =(AA133/AB133)*100 -> 96.7654986522911 | AD133: =(X133*4)+(Z133*2) -> 4
A134: WERRIBEE | C134: REID | F134: KING | I134: ALLEN | L134: HUMMEL | O134: GUDDE | W134: FRANKSTON | X134: 1 | Y134: 2 | Z134: 0 | AA134: 358 | AB134: 393 | AC134: =(AA134/AB134)*100 -> 91.094147582697204 | AD134: =(X134*4)+(Z134*2) -> 4
A135: WILLIAMSTOWN | C135: POWLEY | F135: MAHER | I135: RAUNIK | L135: P SINNOTT | O135: KELLY | W135: SANDRINGHAM | X135: 1 | Y135: 2 | Z135: 0 | AA135: 350 | AB135: 412 | AC135: =(AA135/AB135)*100 -> 84.951456310679603 | AD135: =(X135*4)+(Z135*2) -> 4
A136: GOALKICKERS | H136: SVORINICH 2 | K136: VAN DER WARDEN 2 | P136: FITZGERALD | S136: LOW | W136: WILLIAMSTOWN | X136: 1 | Y136: 2 | Z136: 0 | AA136: 376 | AB136: 446 | AC136: =(AA136/AB136)*100 -> 84.304932735426007 | AD136: =(X136*4)+(Z136*2) -> 4
A137: WERRIBEE | C137: RICHARDSON 4 | F137: CONN 3 | H137: REID 3 | J137: ALLEN 3 | L137: KING 3 | N137: HUMMEL 2 | Q137: SIMMONS 2 | W137: WAVERLEY | X137: 1 | Y137: 2 | Z137: 0 | AA137: 286 | AB137: 503 | AC137: =(AA137/AB137)*100 -> 56.858846918489071 | AD137: =(X137*4)+(Z137*2) -> 4
A138: WILLIAMSTOWN | C138: OBORNE 4 | E138: FOTHERINGHAM 4 | I138: G McRAE 2 | L138: KELLY | N138: SAMPSON | Q138: BEBEND | S138: MAHER | W138: DANDENONG | X138: 0 | Y138: 3 | Z138: 0 | AA138: 306 | AB138: 441 | AC138: =(AA138/AB138)*100 -> 69.387755102040813 | AD138: =(X138*4)+(Z138*2) -> 0
P139: CONSIDINE
A140: WAVERLEY | C140: 6 | D140: 3 | E140: 39 | G140: 10 | H140: 10 | I140: 70 | K140: 14 | L140: 13 | M140: 97 | O140: 16 | P140: 20 | Q140: 116 | S140: VENUE: DANDENONG
A141: DANDENONG | C141: 4 | D141: 6 | E141: 30 | G141: 8 | H141: 8 | I141: 56 | K141: 15 | L141: 11 | M141: 101 | O141: 16 | P141: 15 | Q141: 111 | S141: FITZPATRICK :GRIFFITH
A142: BEST PLAYERS
A143: WAVERLEY | C143: McEWAN | F143: STYLES | I143: FOWLER | L143: BRICK | O143: HOWELL | R143: WILLIAMS
A144: DANDENONG | C144: ORTON | F144: COUSINS | I144: MADDEN | L144: S KNIGHT | O144: POWLES | R144: McCONNELL
A145: GOALKICKERS
A146: WAVERLEY | C146: JONES 6 | E146: STYLES 3 | G146: BRICK 2 | I146: WILLIAMS 2 | L146: CLARKE | N146: CLEMENTS | Q146: FOWLER
A147: DANDENONG | C147: WRIGHT 4 | E147: HENWOOD 3 | H147: POWLES 2 | J147: MILLANE 2 | M147: CROWLEY | O147: TOWNSEND | Q147: WENN | S147: MCMILLAN
C148: 25TH APRIL | I148: WEATHER
A149: PORT MELBOURNE | C149: 6 | D149: 3 | E149: 39 | G149: 11 | H149: 4 | I149: 70 | K149: 16 | L149: 8 | M149: 104 | O149: 21 | P149: 12 | Q149: 138 | S149: VENUE: CAMBERWELL
A150: CAMBERWELL | C150: 7 | D150: 3 | E150: 45 | G150: 10 | H150: 4 | I150: 64 | K150: 12 | L150: 5 | M150: 77 | O150: 16 | P150: 9 | Q150: 105 | S150: VERGONA :GOLLOP
A151: BEST PLAYERS
A152: PORT MELBOURNE | C152: HALL | F152: DAVIES | I152: SWAN | L152: TANTSIS | O152: ANDERSON | R152: EBEYER
A153: CAMBERWELL | C153: WILKINSON | F153: CAHILL | I153: BROMBERG | L153: STEVENSON | O153: WRIGHT | R153: ROURKE
A154: GOALKICKERS
A155: PORT MELBOURNE | C155: ANDERSON 6 | F155: COOK 3 | H155: DOYLE 3 | J155: SWAN 2 | L155: M GOSS 2 | N155: EVANS 2 | P155: EBEYER 2 | R155: WILKINSON
A156: CAMBERWELL | C156: STEVENSON 5 | F156: WILKINSON 4 | I156: ROURKE 2 | K156: COWLEY 2 | M156: TEMPLETON 2 | P156: RICE
A158: PRESTON | C158: 6 | D158: 5 | E158: 41 | G158: 7 | H158: 12 | I158: 54 | K158: 14 | L158: 14 | M158: 98 | O158: 20 | P158: 16 | Q158: 136 | S158: VENUE: FRANKSTON
A159: FRANKSTON | C159: 0 | D159: 4 | E159: 4 | G159: 4 | H159: 3 | I159: 27 | K159: 11 | L159: 7 | M159: 73 | O159: 13 | P159: 10 | Q159: 88 | S159: QUINN :MORGAN
A160: BEST PLAYERS
A161: PRESTON | C161: MARCON | F161: TOWAN | I161: BARTLETT | L161: WIGHT | O161: SHAW | R161: WARREN
A162: FRANKSTON | C162: LANE | F162: LYNN | I162: BELL | L162: GEDDES | O162: CZARNECKI
A163: GOALKICKERS
A164: PRESTON | C164: HALAS 6 | E164: BARTLETT 3 | H164: MARCON 3 | J164: SHAW 2 | L164: FREEMANTLE 2 | O164: BODEN | Q164: KELLY | S164: McGAW | V164: DINTINOSANTE
A165: FRANKSTON | C165: HUMPHRIES 3 | F165: LANE 3 | H165: JOHNSON 2 | K165: SALA 2 | M165: LOCKWOOD | P165: MOULTON | R165: CZARNECKI
A167: COBURG | C167: 4 | D167: 3 | E167: 27 | G167: 10 | H167: 9 | I167: 69 | K167: 14 | L167: 11 | M167: 95 | O167: 16 | P167: 17 | Q167: 113 | S167: VENUE: COBURG
A168: PRAHRAN | C168: 3 | D168: 8 | E168: 26 | G168: 6 | H168: 11 | I168: 47 | K168: 8 | L168: 13 | M168: 61 | O168: 13 | P168: 16 | Q168: 94 | S168: OAKLEY :OGSTON
A169: BEST PLAYERS
A170: COBURG | C170: NIMMO | F170: BURT | I170: DOUGLAS | L170: ALLISON | O170: HERBERT | R170: FITZGERALD
A171: PRAHRAN | C171: FOLEY | F171: DICKSON | I171: TWOMEY | L171: STONE | O171: McCORMACK | R171: REED
A172: GOALKICKERS
A173: COBURG | C173: BURT 3 | E173: HERBERT 2 | G173: CLEARY 2 | I173: HALBERT 2 | L173: M HARBINSON | O173: DOUGLAS | Q173: FITZGERALD | T173: PITT | V173: LAIDLER | X173: ALLISON | AA173: GRAHAM
A174: PRAHRAN | C174: SOULOS 3 | F174: STONE 3 | H174: COONEY 2 | J174: WRIGHT 2 | M174: TWOMEY | O174: TORCASIO | Q174: TAYLOR
A176: ROUND 4 | D176: 2ND MAY | I176: WEATHER | S176: VENUE: PRESTON
D177: 1ST QTR | H177: 2ND QTR | L177: 3RD QTR | P177: FINAL | S177: UMPIRES
A178: PRESTON | C178: 2 | D178: 2 | E178: 14 | G178: 9 | H178: 8 | I178: 62 | K178: 12 | L178: 10 | M178: 82 | O178: 19 | P178: 18 | Q178: 132 | S178: VERGONA | X178: LADDER | AB178: ROUND | AD178: 4
A179: WERRIBEE | C179: 1 | D179: 13 | E179: 19 | G179: 4 | H179: 14 | I179: 38 | K179: 7 | L179: 20 | M179: 62 | O179: 9 | P179: 21 | Q179: 75 | S179: GOLLOP
A180: BEST PLAYERS | W180: TEAM | X180: W | Y180: L | Z180: D | AA180: FOR | AB180: AGST | AC180: % | AD180: PTS
A181: PRESTON | C181: DINTINOSANTE | F181: TOWAN | I181: PLOWMAN | L181: HALAS | O181: KELLY | Q181: WHITE
A182: WERRIBEE | C182: REDENBACH | F182: SCANLAN | I182: SIMMONS | L182: RICHARDSON | O182: KING | W182: PORT MELBOURNE | X182: 3 | Y182: 1 | Z182: 0 | AA182: 657 | AB182: 468 | AC182: =(AA182/AB182)*100 -> 140.38461538461539 | AD182: =(X182*4)+(Z182*2) -> 12
A183: GOALKICKERS | W183: PRESTON | X183: 3 | Y183: 1 | Z183: 0 | AA183: 551 | AB183: 419 | AC183: =(AA183/AB183)*100 -> 131.5035799522673 | AD183: =(X183*4)+(Z183*2) -> 12
A184: PRESTON | C184: HALAS 6 | E184: LORENZINI 4 | H184: BARTLETT 3 | J184: WHITE 2 | L184: KELLY | N184: SHAW | P184: McGAW | R184: DINTINOSANTE | W184: COBURG | X184: 3 | Y184: 1 | Z184: 0 | AA184: 545 | AB184: 424 | AC184: =(AA184/AB184)*100 -> 128.53773584905662 | AD184: =(X184*4)+(Z184*2) -> 12
A185: WERRIBEE | C185: RICHARDSON 2 | F185: DAY 2 | H185: REID | I185: ALLEN | K185: REDENBACH | N185: HUMMEL | P185: LOW | W185: GEELONG WEST | X185: 3 | Y185: 1 | Z185: 0 | AA185: 550 | AB185: 435 | AC185: =(AA185/AB185)*100 -> 126.43678160919541 | AD185: =(X185*4)+(Z185*2) -> 12
S186: VENUE: PORT MELBOURNE
A187: PORT MELBOURNE | C187: 3 | D187: 1 | E187: 19 | G187: 9 | H187: 10 | I187: 64 | K187: 15 | L187: 12 | M187: 102 | O187: 22 | P187: 13 | Q187: 145 | S187: GRIFFITHS | W187: PRAHRAN | X187: 2 | Y187: 2 | Z187: 0 | AA187: 505 | AB187: 491 | AC187: =(AA187/AB187)*100 -> 102.85132382892057 | AD187: =(X187*4)+(Z187*2) -> 8
A188: FRANKSTON | C188: 4 | D188: 1 | E188: 25 | G188: 8 | H188: 5 | I188: 53 | K188: 10 | L188: 10 | M188: 70 | O188: 14 | P188: 16 | Q188: 100 | S188: OAKLEY | W188: WERRIBEE | X188: 2 | Y188: 2 | Z188: 0 | AA188: 479 | AB188: 487 | AC188: =(AA188/AB188)*100 -> 98.357289527720738 | AD188: =(X188*4)+(Z188*2) -> 8
A189: BEST PLAYERS | W189: SANDRINGHAM | X189: 2 | Y189: 2 | Z189: 0 | AA189: 482 | AB189: 515 | AC189: =(AA189/AB189)*100 -> 93.592233009708735 | AD189: =(X189*4)+(Z189*2) -> 8
A190: PORT MELBOURNE | C190: ANDERSON | F190: ROBERTSON | I190: EBEYER | L190: THOMPSON | O190: DEMETRIOU | R190: RODDA | W190: CAMBERWELL | X190: 2 | Y190: 2 | Z190: 0 | AA190: 476 | AB190: 509 | AC190: =(AA190/AB190)*100 -> 93.516699410609036 | AD190: =(X190*4)+(Z190*2) -> 8
A191: FRANKSTON | C191: LANE | F191: LYNCH | I191: MACE | L191: GEDDES | W191: WAVERLEY | X191: 2 | Y191: 2 | Z191: 0 | AA191: 411 | AB191: 592 | AC191: =(AA191/AB191)*100 -> 69.425675675675677 | AD191: =(X191*4)+(Z191*2) -> 8
A192: GOALKICKERS | W192: WILLIAMSTOWN | X192: 1 | Y192: 3 | Z192: 0 | AA192: 491 | AB192: 566 | AC192: =(AA192/AB192)*100 -> 86.749116607773843 | AD192: =(X192*4)+(Z192*2) -> 4
A193: PORT MELBOURNE | C193: ANDERSON 8 | F193: COOK 6 | H193: EBEYER 2 | J193: KAVANAGH 2 | M193: SWAN 2 | O193: DOYLE | Q193: EVANS | W193: FRANKSTON | X193: 1 | Y193: 3 | Z193: 0 | AA193: 458 | AB193: 538 | AC193: =(AA193/AB193)*100 -> 85.130111524163567 | AD193: =(X193*4)+(Z193*2) -> 4
A194: FRANKSTON | C194: LOCKWOOD 4 | F194: GEDDES 2 | H194: LANE 2 | J194: JOHNSON | L194: ROGERSON | N194: HUMPHREY | Q194: LYNN | R194: MACE | W194: DANDENONG | X194: 0 | Y194: 4 | Z194: 0 | AA194: 426 | AB194: 587 | AC194: =(AA194/AB194)*100 -> 72.572402044293014 | AD194: =(X194*4)+(Z194*2) -> 0
Q195: GEDDES
A196: WAVERLEY | C196: 1 | D196: 6 | E196: 12 | G196: 3 | H196: 9 | I196: 27 | K196: 13 | L196: 15 | M196: 93 | O196: 17 | P196: 23 | Q196: 125 | S196: VENUE: WAVERLEY
A197: CAMBERWELL | C197: 0 | D197: 3 | E197: 3 | G197: 4 | H197: 7 | I197: 31 | K197: 8 | L197: 8 | M197: 56 | O197: 13 | P197: 11 | Q197: 89 | S197: GREEN :OGSTON
A198: BEST PLAYERS
A199: WAVERLEY | C199: CLARKE | F199: DICKSON | I199: HOWELL | L199: BRICK | O199: McDONALD | R199: FOWLER
A200: CAMBERWELL | C200: PEVITT | F200: WRIGHT | I200: McFEE | L200: FLOWER | O200: BROWN | R200: CAHILL
A201: GOALKICKERS
A202: WAVERLEY | C202: JONES 3 | E202: WILLIAMS 3 | H202: DICKSON 3 | K202: VENVILLE 2 | M202: STYLES 2 | O202: BRICK 2 | Q202: JAMES | S202: GOODMAN
A203: CAMBERWELL | C203: STEVENSON 3 | F203: EVANS 2 | H203: BROMBERG | J203: RICE | K203: McFEE | M203: ROURKE | O203: FLOWER | Q203: SPITHILL | S203: HAMMOND | W203: ZERBI
A205: PRAHRAN | C205: 4 | D205: 2 | E205: 26 | G205: 11 | H205: 6 | I205: 72 | K205: 15 | L205: 11 | M205: 101 | O205: 22 | P205: 14 | Q205: 146 | S205: VENUE: TOORAK PARK
A206: DANDENONG | C206: 3 | D206: 5 | E206: 23 | G206: 7 | H206: 5 | I206: 47 | K206: 11 | L206: 9 | M206: 75 | O206: 18 | P206: 12 | Q206: 120 | S206: QUINN :CROXFORD
A207: BEST PLAYERS
A208: PRAHRAN | C208: McCORMACK | F208: TWOMEY | I208: ELLETT | L208: FOLEY | O208: WRIGHT | R208: COBURN
A209: DANDENONG | C209: LACEY | F209: WENN | I209: CROWLEY | L209: ORTON | O209: MADDEN
A210: GOALKICKERS
A211: PRAHRAN | C211: McCORMACK 8 | F211: STONE 3 | H211: WRIGHT 2 | J211: SMITH 2 | L211: SOULOS | N211: TAYLOR | P211: COONEY | R211: DOW | T211: COBURN | W211: MOIR | X211: WEBBER
A212: DANDENONG | C212: MADDEN 3 | F212: MCMILLAN 2 | I212: WENN 2 | K212: HENWOOD 2 | N212: TOWNSEND 2 | Q212: CROWLEY 2 | T212: O'KEEFE | W212: COVENTRY | X212: LACEY | Z212: MILLANE
A214: GEELONG WEST | C214: 3 | D214: 6 | E214: 24 | G214: 5 | H214: 7 | I214: 37 | K214: 11 | L214: 17 | M214: 83 | O214: 16 | P214: 24 | Q214: 120 | S214: VENUE: WILLIAMSTOWN
A215: WILLIAMSTOWN | C215: 5 | D215: 1 | E215: 31 | G215: 12 | H215: 4 | I215: 76 | K215: 16 | L215: 11 | M215: 107 | O215: 17 | P215: 13 | Q215: 115 | S215: FITZPATRICK :ALLSOPP
A216: BEST PLAYERS
A217: GEELONG WEST | C217: EDDY | F217: DALIHAUS | I217: BURNETT | L217: TORNEY | O217: CRICHTON | R217: TODD
A218: WILLIAMSTOWN | C218: MATTHEWS | F218: BEBEND | I218: MAHER | L218: SINNOTT | O218: FAIRLEY | R218: TWEEDLY
A219: GOALKICKERS
A220: GEELONG WEST | C220: PHIPPS 3 | E220: TAYLOR 3 | G220: BROWNE 2 | I220: EDDY 2 | K220: TORNEY 2 | M220: YATES | O220: FOOTT | Q220: LEWIS | S220: WOODARD
A221: WILLIAMSTOWN | C221: SAIT 4 | E221: OBORNE 3 | G221: FOTHERINGHAM 3 | K221: FAIRLEY 2 | M221: KELLY 2 | O221: SAMPSON | Q221: BEBEND | S221: TAYLOR
A223: SANDRINGHAM | C223: 4 | D223: 0 | E223: 24 | G223: 10 | H223: 4 | I223: 64 | K223: 12 | L223: 5 | M223: 77 | O223: 22 | P223: 10 | Q223: 142 | S223: VENUE: BEACH ROAD
A224: COBURG | C224: 2 | D224: 6 | E224: 18 | G224: 2 | H224: 7 | I224: 19 | K224: 10 | L224: 15 | M224: 75 | O224: 14 | P224: 19 | Q224: 103 | S224: MORGAN :TORNEY
A225: BEST PLAYERS
A226: SANDRINGHAM | C226: BEUS | E226: HAYES | H226: CARROLL | K226: MERCER | N226: ADAMS | Q226: SCOTT
A227: COBURG | C227: PITT | E227: FITZGERALD | H227: BURT | K227: PENNINGTON | N227: ALLISON | Q227: LAIDLER
A228: GOALKICKERS
A229: SANDRINGHAM | C229: CARROLL 7 | E229: O'BRIEN 3 | G229: SIMS 3 | I229: MANNIX 2 | K229: WAY 2 | M229: MACLEOD | O229: FITZPATRICK | R229: RICHARDS | V229: SCOTT | X229: RAFFERTY
A230: COBURG | C230: LAIDLER 3 | E230: ALLISON 3 | H230: MILROY 2 | J230: M HARBINSON 2 | N230: FITZGERALD | Q230: BURT | S230: SALTMARSH | W230: GRAHAM
A232: ROUND 5 | D232: 9TH MAY | I232: WEATHER | S232: VENUE: GEELONG WEST
D233: 1ST QTR | H233: 2ND QTR | L233: 3RD QTR | P233: FINAL | S233: UMPIRES
A234: PRESTON | C234: 2 | D234: 4 | E234: 16 | G234: 7 | H234: 7 | I234: 49 | K234: 7 | L234: 7 | M234: 49 | O234: 16 | P234: 15 | Q234: 111 | S234: GROOM :CROXFORD | X234: LADDER | AB234: ROUND | AD234: 5
A235: GEELONG WEST | C235: 2 | D235: 4 | E235: 16 | G235: 7 | H235: 6 | I235: 48 | K235: 11 | L235: 12 | M235: 78 | O235: 14 | P235: 13 | Q235: 97 | S235: CROXFORD
A236: BEST PLAYERS | W236: TEAM | X236: W | Y236: L | Z236: D | AA236: FOR | AB236: AGST | AC236: % | AD236: PTS
A237: PRESTON | C237: MARCON | F237: BUX | I237: BRINE | L237: McGAW | O237: SHAW | R237: KELLY
A238: GEELONG WEST | C238: BROWNE | F238: CRICHTON | I238: DALIHAUS | L238: EDDY | O238: FOOTT | W238: COBURG | X238: 4 | Y238: 1 | Z238: 0 | AA238: 689 | AB238: 524 | AC238: =(AA238/AB238)*100 -> 131.4885496183206 | AD238: =(X238*4)+(Z238*2) -> 16
A239: GOALKICKERS | W239: PRESTON | X239: 4 | Y239: 1 | Z239: 0 | AA239: 662 | AB239: 516 | AC239: =(AA239/AB239)*100 -> 128.29457364341087 | AD239: =(X239*4)+(Z239*2) -> 16
A240: PRESTON | C240: KELLY 3 | E240: WHITE 3 | G240: MARCON 3 | I240: AUSTEN 2 | K240: McGAW | M240: SHAW | O240: BODEN | Q240: BARTLETT | T240: BRINE | W240: PORT MELBOURNE | X240: 3 | Y240: 2 | Z240: 0 | AA240: 807 | AB240: 619 | AC240: =(AA240/AB240)*100 -> 130.37156704361874 | AD240: =(X240*4)+(Z240*2) -> 12
A241: GEELONG WEST | C241: TAYLOR 4 | F241: M TODD 2 | I241: YATES 2 | K241: BURNETT | M241: GIBSON | O241: FOOTT | Q241: DALIHAUS | T241: PHIPPS | W241: GEELONG WEST | X241: 3 | Y241: 2 | Z241: 0 | AA241: 647 | AB241: 546 | AC241: =(AA241/AB241)*100 -> 118.4981684981685 | AD241: =(X241*4)+(Z241*2) -> 12
P242: EDDY | S242: VENUE: WERRIBEE
A243: WERRIBEE | C243: 6 | D243: 5 | E243: 41 | G243: 9 | H243: 10 | I243: 64 | K243: 19 | L243: 12 | M243: 126 | O243: 22 | P243: 19 | Q243: 151 | S243: OGSTON | W243: PRAHRAN | X243: 3 | Y243: 2 | Z243: 0 | AA243: 641 | AB243: 587 | AC243: =(AA243/AB243)*100 -> 109.1993185689949 | AD243: =(X243*4)+(Z243*2) -> 12
A244: PORT MELBOURNE | C244: 4 | D244: 5 | E244: 29 | G244: 10 | H244: 10 | I244: 70 | K244: 14 | L244: 15 | M244: 99 | O244: 22 | P244: 18 | Q244: 150 | S244: FITZPATRICK | W244: SANDRINGHAM | X244: 3 | Y244: 2 | Z244: 0 | AA244: 621 | AB244: 622 | AC244: =(AA244/AB244)*100 -> 99.839228295819936 | AD244: =(X244*4)+(Z244*2) -> 12
A245: BEST PLAYERS | W245: WERRIBEE | X245: 3 | Y245: 2 | Z245: 0 | AA245: 630 | AB245: 637 | AC245: =(AA245/AB245)*100 -> 98.901098901098905 | AD245: =(X245*4)+(Z245*2) -> 12
A246: WERRIBEE | C246: KING | F246: SIMMONS | I246: LOW | L246: McLEAN | O246: HUGHES | R246: JACK | W246: CAMBERWELL | X246: 3 | Y246: 2 | Z246: 0 | AA246: 607 | AB246: 629 | AC246: =(AA246/AB246)*100 -> 96.502384737678852 | AD246: =(X246*4)+(Z246*2) -> 12
A247: PORT MELBOURNE | C247: COOK | F247: SWAN | I247: DAVIES | L247: RODDA | O247: EBEYER | W247: WAVERLEY | X247: 2 | Y247: 3 | Z247: 0 | AA247: 507 | AB247: 728 | AC247: =(AA247/AB247)*100 -> 69.642857142857139 | AD247: =(X247*4)+(Z247*2) -> 8
A248: GOALKICKERS | W248: FRANKSTON | X248: 1 | Y248: 4 | Z248: 0 | AA248: 578 | AB248: 669 | AC248: =(AA248/AB248)*100 -> 86.397608370702542 | AD248: =(X248*4)+(Z248*2) -> 4
A249: WERRIBEE | C249: McLEAN 7 | F249: RICHARDSON 5 | I249: CONN 2 | K249: MORRIS 2 | M249: KING 2 | O249: LOW 2 | Q249: SMITH | S249: JAMES | W249: WILLIAMSTOWN | X249: 1 | Y249: 4 | Z249: 0 | AA249: 591 | AB249: 710 | AC249: =(AA249/AB249)*100 -> 83.239436619718305 | AD249: =(X249*4)+(Z249*2) -> 4
A250: PORT MELBOURNE | C250: COOK 7 | E250: KAVANAGH 4 | H250: DOYLE 3 | J250: EVANS 2 | L250: ANDERSON 2 | O250: EBEYER 2 | Q250: BRADBURY | T250: RODDA | W250: DANDENONG | X250: 0 | Y250: 5 | Z250: 0 | AA250: 533 | AB250: 726 | AC250: =(AA250/AB250)*100 -> 73.415977961432503 | AD250: =(X250*4)+(Z250*2) -> 0
A252: PRAHRAN | C252: 2 | D252: 3 | E252: 15 | G252: 8 | H252: 7 | I252: 55 | K252: 14 | L252: 9 | M252: 93 | O252: 20 | P252: 16 | Q252: 136 | S252: VENUE: TOORAK PARK
A253: WAVERLEY | C253: 5 | D253: 4 | E253: 34 | G253: 8 | H253: 7 | I253: 55 | K253: 12 | L253: 9 | M253: 81 | O253: 14 | P253: 12 | Q253: 96 | S253: VERGONA :MORGAN
A254: BEST PLAYERS
A255: PRAHRAN | C255: COBURN | F255: STONE | I255: SMITH | L255: TAYLOR | O255: ELLETT | R255: WRIGHT
A256: WAVERLEY | C256: VENVILLE | F256: FOWLER | I256: DICKSON | L256: BRICK
A257: GOALKICKERS
A258: PRAHRAN | C258: SMITH 9 | E258: WEBBER 3 | G258: McCORMACK 2 | J258: STONE 2 | L258: WRIGHT 2 | N258: DOW | P258: MOIR
A259: WAVERLEY | C259: VENVILLE 4 | F259: DICKSON 2 | I259: WILLIAMS 2 | L259: JONES 2 | N259: BRICK | P259: FRANETIC | R259: STYLES | T259: K McDONALD
A261: CAMBERWELL | C261: 8 | D261: 2 | E261: 50 | G261: 10 | H261: 7 | I261: 67 | K261: 13 | L261: 16 | M261: 94 | O261: 19 | P261: 17 | Q261: 131 | S261: VENUE: FRANKSTON
A262: FRANKSTON | C262: 5 | D262: 4 | E262: 34 | G262: 10 | H262: 11 | I262: 71 | K262: 13 | L262: 12 | M262: 90 | O262: 17 | P262: 18 | Q262: 120 | S262: CASEY :TORNEY
A263: BEST PLAYERS
A264: CAMBERWELL | C264: WILKINSON | F264: RICE | I264: ROURKE | L264: STEVENSON | O264: BROMBERG | R264: NIELSON
A265: FRANKSTON | C265: JOHNSON | F265: LANE | I265: LYNN | L265: SALA | O265: BOYD | R265: HAMILL
A266: GOALKICKERS
A267: CAMBERWELL | C267: STEVENSON 6 | F267: COWLEY 4 | I267: HAMMOND 3 | L267: DAVIDSON 2 | O267: ROURKE 2 | Q267: EVANS | S267: TEMPLETON
A268: FRANKSTON | C268: JOHNSON 8 | F268: HORTON 2 | I268: LOCKWOOD | L268: ROGERSON | O268: SALA | P268: GEDDES | R268: HORLER | U268: LANE | W268: HAMILL
A270: SANDRINGHAM | C270: 3 | D270: 3 | E270: 21 | G270: 5 | H270: 10 | I270: 40 | K270: 11 | L270: 10 | M270: 76 | O270: 19 | P270: 25 | Q270: 139 | S270: VENUE: DANDENONG
A271: DANDENONG | C271: 4 | D271: 5 | E271: 29 | G271: 7 | H271: 9 | I271: 51 | K271: 14 | L271: 15 | M271: 99 | O271: 16 | P271: 11 | Q271: 107 | S271: OAKLEY :STABB
A272: BEST PLAYERS
A273: SANDRINGHAM | C273: ADAMS | F273: STEVENS | I273: SIMS | L273: PLEDGER | O273: MACLEOD | R273: RICHARDS
A274: DANDENONG | C274: HENWOOD | F274: WENN | I274: TAYLOR | L274: MADDEN | O274: COVENTRY | R274: HOWER
A275: GOALKICKERS
A276: SANDRINGHAM | C276: CARROLL 5 | F276: PLEDGER 3 | I276: ADAMS 3 | K276: RICHARDS 3 | N276: SIMS 3 | P276: HAYES | R276: MERCER
A277: DANDENONG | C277: HENWOOD 6 | F277: TOWNSEND 4 | I277: COVENTRY 3 | L277: WRIGHT | N277: MADDEN | P277: MILLANE
A279: COBURG | C279: 5 | D279: 4 | E279: 34 | G279: 9 | H279: 9 | I279: 63 | K279: 15 | L279: 14 | M279: 104 | O279: 21 | P279: 18 | Q279: 144 | S279: VENUE: COBURG
A280: WILLIAMSTOWN | C280: 2 | D280: 2 | E280: 14 | G280: 7 | H280: 6 | I280: 48 | K280: 11 | L280: 7 | M280: 73 | O280: 15 | P280: 10 | Q280: 100 | S280: QUINN :GRIFFITHS
A281: BEST PLAYERS
A282: COBURG | C282: ADAMS | E282: SHELDON | I282: SMITH | L282: PITT | O282: CLEARY | R282: BURT
A283: WILLIAMSTOWN | C283: FAIRLEY | E283: FOTHERINGHAM | I283: McRAE | L283: OBORNE | O283: MATTHEWS | R283: KELLY
A284: GOALKICKERS
A285: COBURG | C285: SMITH 6 | E285: CLEARY 4 | G285: HERBERT 4 | I285: BURT 2 | K285: HALBERT | M285: LAIDLER | O285: ADAMS | Q285: ALLISON | S285: M HARBINSON
A286: WILLIAMSTOWN | C286: FOTHERINGHAM 5 | F286: OBORNE 3 | I286: EDWARDS 2 | K286: FAIRLEY | M286: KELLY | O286: MAHER | Q286: CONSIDINE | T286: KENNEDY
A288: ROUND 6 | D288: 16TH MAY | I288: WEATHER | S288: VENUE: PRESTON
D289: 1ST QTR | H289: 2ND QTR | L289: 3RD QTR | P289: FINAL | S289: UMPIRES
A290: COBURG | C290: 2 | D290: 10 | E290: 22 | G290: 4 | H290: 13 | I290: 37 | K290: 10 | L290: 18 | M290: 78 | O290: 13 | P290: 21 | Q290: 99 | S290: OAKLEY | X290: LADDER | AB290: ROUND | AD290: 6
A291: PRESTON | C291: 3 | D291: 3 | E291: 21 | G291: 6 | H291: 5 | I291: 41 | K291: 7 | L291: 6 | M291: 48 | O291: 12 | P291: 10 | Q291: 82 | S291: STABB
A292: BEST PLAYERS | W292: TEAM | X292: W | Y292: L | Z292: D | AA292: FOR | AB292: AGST | AC292: % | AD292: PTS
A293: COBURG | C293: PENNINGTON | F293: FITZGERALD | I293: CLEARY | L293: HERBERT | O293: SHELDON | R293: CANN
A294: PRESTON | C294: AUSTEN | F294: MARCON | I294: SHAW | L294: McKEON | O294: BUX | W294: COBURG | X294: 5 | Y294: 1 | Z294: 0 | AA294: 788 | AB294: 606 | AC294: =(AA294/AB294)*100 -> 130.03300330033002 | AD294: =(X294*4)+(Z294*2) -> 20
A295: GOALKICKERS | W295: PORT MELBOURNE | X295: 4 | Y295: 2 | Z295: 0 | AA295: 1000 | AB295: 686 | AC295: =(AA295/AB295)*100 -> 145.77259475218659 | AD295: =(X295*4)+(Z295*2) -> 16
A296: COBURG | C296: HERBERT 5 | F296: MILROY 3 | I296: ANDERSON 2 | L296: SMITH | N296: LAIDLER | P296: CLEARY | W296: PRESTON | X296: 4 | Y296: 2 | Z296: 0 | AA296: 744 | AB296: 615 | AC296: =(AA296/AB296)*100 -> 120.97560975609755 | AD296: =(X296*4)+(Z296*2) -> 16
A297: PRESTON | C297: MARCON 3 | F297: DINTINOSANTE 3 | J297: SHAW 2 | L297: HALAS 2 | N297: McGAW | P297: WHITE | W297: PRAHRAN | X297: 4 | Y297: 2 | Z297: 0 | AA297: 772 | AB297: 693 | AC297: =(AA297/AB297)*100 -> 111.39971139971141 | AD297: =(X297*4)+(Z297*2) -> 16
S298: VENUE: PORT MELBOURNE
A299: PORT MELBOURNE | C299: 7 | D299: 8 | E299: 50 | G299: 13 | H299: 10 | I299: 88 | K299: 22 | L299: 14 | M299: 146 | O299: 29 | P299: 19 | Q299: 193 | S299: BUDGE | W299: CAMBERWELL | X299: 4 | Y299: 2 | Z299: 0 | AA299: 780 | AB299: 773 | AC299: =(AA299/AB299)*100 -> 100.90556274256144 | AD299: =(X299*4)+(Z299*2) -> 16
A300: GEELONG WEST | C300: 4 | D300: 5 | E300: 29 | G300: 5 | H300: 8 | I300: 38 | K300: 6 | L300: 10 | M300: 46 | O300: 8 | P300: 19 | Q300: 67 | S300: CASEY | W300: GEELONG WEST | X300: 3 | Y300: 3 | Z300: 0 | AA300: 714 | AB300: 739 | AC300: =(AA300/AB300)*100 -> 96.617050067658994 | AD300: =(X300*4)+(Z300*2) -> 12
A301: BEST PLAYERS | W301: SANDRINGHAM | X301: 3 | Y301: 3 | Z301: 0 | AA301: 727 | AB301: 753 | AC301: =(AA301/AB301)*100 -> 96.547144754316065 | AD301: =(X301*4)+(Z301*2) -> 12
A302: PORT MELBOURNE | C302: EBEYER | F302: RODDA | I302: COOK | L302: HALL | N302: TANTSIS | Q302: DAVIES | W302: WERRIBEE | X302: 3 | Y302: 3 | Z302: 0 | AA302: 774 | AB302: 810 | AC302: =(AA302/AB302)*100 -> 95.555555555555557 | AD302: =(X302*4)+(Z302*2) -> 12
A303: GEELONG WEST | C303: GIBSON | F303: CRICHTON | I303: WOODARD | L303: TAYLOR | N303: EDDY | Q303: CANTWELL | W303: WILLIAMSTOWN | X303: 2 | Y303: 4 | Z303: 0 | AA303: 763 | AB303: 812 | AC303: =(AA303/AB303)*100 -> 93.965517241379317 | AD303: =(X303*4)+(Z303*2) -> 8
A304: GOALKICKERS | P304: SWAN | R304: DEMETRIOU | W304: FRANKSTON | X304: 2 | Y304: 4 | Z304: 0 | AA304: 702 | AB304: 771 | AC304: =(AA304/AB304)*100 -> 91.050583657587552 | AD304: =(X304*4)+(Z304*2) -> 8
A305: PORT MELBOURNE | C305: COOK 10 | E305: ANDERSON 4 | H305: EVANS 3 | J305: DOYLE 3 | L305: RODDA 2 | N305: KAVANAGH 2 | Q305: GOSS 2 | S305: BRICE | W305: WAVERLEY | X305: 2 | Y305: 4 | Z305: 0 | AA305: 609 | AB305: 852 | AC305: =(AA305/AB305)*100 -> 71.478873239436624 | AD305: =(X305*4)+(Z305*2) -> 8
A306: GEELONG WEST | C306: BROWNE 4 | F306: TAYLOR 3 | I306: McDOWELL | W306: DANDENONG | X306: 0 | Y306: 6 | Z306: 0 | AA306: 635 | AB306: 898 | AC306: =(AA306/AB306)*100 -> 70.712694877505569 | AD306: =(X306*4)+(Z306*2) -> 0
A308: PRAHRAN | C308: 3 | D308: 4 | E308: 22 | G308: 8 | H308: 7 | I308: 55 | K308: 11 | L308: 11 | M308: 77 | O308: 19 | P308: 17 | Q308: 131 | S308: VENUE: BEACH ROAD
A309: SANDRINGHAM | C309: 5 | D309: 2 | E309: 32 | G309: 5 | H309: 7 | I309: 37 | K309: 11 | L309: 12 | M309: 78 | O309: 15 | P309: 16 | Q309: 106 | S309: GROOM :OGSTON
A310: BEST PLAYERS
A311: PRAHRAN | C311: DICKSON | F311: STONE | I311: SMITH | L311: ELLETT | O311: COONEY | Q311: LESKE
A312: SANDRINGHAM | C312: HAYES | F312: ADAMS | I312: PLEDGER | L312: FITZPATRICK | O312: SARAU | Q312: SIMS
A313: GOALKICKERS
A314: PRAHRAN | C314: SMITH 5 | E314: COONEY 3 | H314: COBURN 2 | J314: MCDONALD 2 | M314: TAYLOR | O314: STEVENS | Q314: WEBBER | S314: STONE
A315: SANDRINGHAM | C315: SIMS 3 | E315: MACLEOD 2 | H315: ADAMS 2 | J315: WAY 2 | L315: CARROLL 2 | N315: PLEDGER | P315: FITZPATRICK | S315: RICHARDS | V315: WORKMAN
A317: CAMBERWELL | C317: 7 | D317: 0 | E317: 42 | G317: 15 | H317: 5 | I317: 95 | K317: 20 | L317: 8 | M317: 128 | O317: 27 | P317: 11 | Q317: 173 | S317: VENUE: CAMBERWELL
A318: WERRIBEE | C318: 5 | D318: 9 | E318: 39 | G318: 9 | H318: 14 | I318: 68 | K318: 15 | L318: 18 | M318: 108 | O318: 20 | P318: 24 | Q318: 144 | S318: QUINN :GRIFFITHS
A319: BEST PLAYERS
A320: CAMBERWELL | C320: McFEE | F320: STEVENSON | I320: HAMMOND | L320: WILKINSON | O320: BROWN | R320: BROMBERG
A321: WERRIBEE | C321: SIMMONS | F321: KING | I321: CONN | L321: REID | O321: HUGHES
A322: GOALKICKERS
A323: CAMBERWELL | C323: STEVENSON 9 | F323: HAMMOND 7 | I323: COWLEY 3 | K323: BROMBERG 3 | N323: DAVIDSON 2 | Q323: RICE | R323: WILKINSON | V323: ROURKE
A324: WERRIBEE | C324: SIMMONS 6 | F324: KING 4 | H324: MEMBREY 3 | K324: REID 2 | M324: RICHARDSON 2 | P324: MORRIS | R324: PARKES | U324: CONN
A326: FRANKSTON | C326: 3 | D326: 6 | E326: 24 | G326: 7 | H326: 9 | I326: 51 | K326: 13 | L326: 14 | M326: 92 | O326: 18 | P326: 16 | Q326: 124 | S326: VENUE: WAVERLEY
A327: WAVERLEY | C327: 4 | D327: 4 | E327: 28 | G327: 10 | H327: 7 | I327: 67 | K327: 11 | L327: 12 | M327: 78 | O327: 14 | P327: 18 | Q327: 102 | S327: FITZPATRICK :CROXFORD
A328: BEST PLAYERS
A329: FRANKSTON | C329: LANE | F329: LYNN | I329: HORTON | L329: HORLER | O329: GEDDES | R329: SALA
A330: WAVERLEY | C330: STYLES | F330: FOWLER | I330: GOODMAN | L330: BRICK | O330: HAMILTON | R330: MCCORMACK
A331: GOALKICKERS
A332: FRANKSTON | C332: HORTON 5 | F332: HUNTER 4 | I332: GEDDES 3 | K332: LANE 3 | M332: CZARNECKI 2 | P332: HORLER
A333: WAVERLEY | C333: JONES 6 | F333: FOWLER 2 | I333: BRICK 2 | K333: VENVILLE 2 | M333: FRANETIC | P333: BEDDOE
A335: WILLIAMSTOWN | C335: 6 | D335: 3 | E335: 39 | G335: 9 | H335: 6 | I335: 60 | K335: 19 | L335: 11 | M335: 125 | O335: 26 | P335: 16 | Q335: 172 | S335: VENUE: WILLIAMSTOWN
A336: DANDENONG | C336: 4 | D336: 5 | E336: 29 | G336: 10 | H336: 7 | I336: 67 | K336: 12 | L336: 12 | M336: 84 | O336: 15 | P336: 12 | Q336: 102 | S336: VERGONA :RILEY
A337: BEST PLAYERS
A338: WILLIAMSTOWN | C338: OBORNE | F338: FOTHERINGHAM | I338: SAIT | L338: MAHER | O338: FOSTER | R338: FAIRLEY
A339: DANDENONG | C339: LACEY | F339: WRIGHT | I339: TAYLOR | L339: WENN | O339: HOWER
A340: GOALKICKERS
A341: WILLIAMSTOWN | C341: FOTHERINGHAM 7 | F341: OBORNE 6 | I341: FAIRLEY 5 | K341: EDWARDS 5 | N341: KELLY | P341: SAIT | R341: RAUNIK
A342: DANDENONG | C342: WRIGHT 7 | F342: CROWLEY 3 | I342: MADDEN 3 | L342: LACEY | N342: KNIGHT
A344: ROUND 7 | D344: 23RD MAY | I344: WEATHER | S344: VENUE: COBURG
D345: 1ST QTR | H345: 2ND QTR | L345: 3RD QTR | P345: FINAL | S345: UMPIRES
A346: PORT MELBOURNE | C346: 0 | D346: 2 | E346: 2 | G346: 5 | H346: 5 | I346: 35 | K346: 9 | L346: 10 | M346: 64 | O346: 20 | P346: 12 | Q346: 132 | S346: VERGONA | X346: LADDER | AB346: ROUND | AD346: 7
A347: COBURG | C347: 6 | D347: 7 | E347: 43 | G347: 7 | H347: 12 | I347: 54 | K347: 12 | L347: 14 | M347: 86 | O347: 14 | P347: 16 | Q347: 100 | S347: GROOM
A348: BEST PLAYERS | W348: TEAM | X348: W | Y348: L | Z348: D | AA348: FOR | AB348: AGST | AC348: % | AD348: PTS
A349: PORT MELBOURNE | C349: CHADBAND | F349: ROBERTSON | I349: DOYLE | L349: SWAN | O349: HALL | Q349: EBEYER
A350: COBURG | C350: PENNINGTON | F350: ADAMS | I350: BURT | L350: HERBERT | O350: EADE | Q350: ANDERSON | W350: PORT MELBOURNE | X350: 5 | Y350: 2 | Z350: 0 | AA350: 1132 | AB350: 786 | AC350: =(AA350/AB350)*100 -> 144.02035623409671 | AD350: =(X350*4)+(Z350*2) -> 20
A351: GOALKICKERS | W351: PRESTON | X351: 5 | Y351: 2 | Z351: 0 | AA351: 872 | AB351: 723 | AC351: =(AA351/AB351)*100 -> 120.60857538035961 | AD351: =(X351*4)+(Z351*2) -> 20
A352: PORT MELBOURNE | C352: COOK 6 | E352: EBEYER 5 | G352: ANDERSON 3 | J352: M GOSS 2 | L352: EVANS 2 | N352: ROBERTSON | Q352: KAVANAGH | W352: COBURG | X352: 5 | Y352: 2 | Z352: 0 | AA352: 888 | AB352: 738 | AC352: =(AA352/AB352)*100 -> 120.32520325203254 | AD352: =(X352*4)+(Z352*2) -> 20
A353: COBURG | C353: HERBERT 4 | E353: LAIDLER 3 | G353: ANDERSON 2 | J353: HALBERT | L353: FITZGERALD | O353: ALLISON | Q353: CANN | S353: WEBSTER | W353: PRAHRAN | X353: 5 | Y353: 2 | Z353: 0 | AA353: 932 | AB353: 831 | AC353: =(AA353/AB353)*100 -> 112.15403128760531 | AD353: =(X353*4)+(Z353*2) -> 20
S354: VENUE: GEELONG WEST
A355: GEELONG WEST | C355: 6 | D355: 6 | E355: 42 | G355: 12 | H355: 11 | I355: 83 | K355: 15 | L355: 15 | M355: 105 | O355: 22 | P355: 16 | Q355: 148 | S355: OAKLEY | W355: WERRIBEE | X355: 4 | Y355: 3 | Z355: 0 | AA355: 991 | AB355: 939 | AC355: =(AA355/AB355)*100 -> 105.53780617678382 | AD355: =(X355*4)+(Z355*2) -> 16
A356: CAMBERWELL | C356: 3 | D356: 2 | E356: 20 | G356: 7 | H356: 6 | I356: 48 | K356: 13 | L356: 7 | M356: 85 | O356: 19 | P356: 10 | Q356: 124 | S356: RYAN | W356: SANDRINGHAM | X356: 4 | Y356: 3 | Z356: 0 | AA356: 879 | AB356: 843 | AC356: =(AA356/AB356)*100 -> 104.27046263345197 | AD356: =(X356*4)+(Z356*2) -> 16
A357: BEST PLAYERS | W357: GEELONG WEST | X357: 4 | Y357: 3 | Z357: 0 | AA357: 862 | AB357: 863 | AC357: =(AA357/AB357)*100 -> 99.884125144843566 | AD357: =(X357*4)+(Z357*2) -> 16
A358: GEELONG WEST | C358: CANTWELL | F358: YATES | I358: DALIHAUS | L358: EDDY | N358: GIBSON | Q358: SCOTT | W358: CAMBERWELL | X358: 4 | Y358: 3 | Z358: 0 | AA358: 904 | AB358: 921 | AC358: =(AA358/AB358)*100 -> 98.154180238870794 | AD358: =(X358*4)+(Z358*2) -> 16
A359: CAMBERWELL | C359: DANS | F359: WILKINSON | I359: NIELSON | L359: COWLEY | N359: McFEE | Q359: DAVIDSON | W359: WILLIAMSTOWN | X359: 2 | Y359: 5 | Z359: 0 | AA359: 901 | AB359: 972 | AC359: =(AA359/AB359)*100 -> 92.695473251028801 | AD359: =(X359*4)+(Z359*2) -> 8
A360: GOALKICKERS | W360: FRANKSTON | X360: 2 | Y360: 5 | Z360: 0 | AA360: 831 | AB360: 988 | AC360: =(AA360/AB360)*100 -> 84.109311740890689 | AD360: =(X360*4)+(Z360*2) -> 8
A361: GEELONG WEST | C361: GIBSON 5 | E361: TAYLOR 4 | G361: CANTWELL 3 | J361: SCOTT 3 | L361: BROWNE 2 | N361: EDDY 2 | P361: DALIHAUS 2 | S361: BURNETT | W361: WAVERLEY | X361: 2 | Y361: 5 | Z361: 0 | AA361: 699 | AB361: 995 | AC361: =(AA361/AB361)*100 -> 70.251256281407038 | AD361: =(X361*4)+(Z361*2) -> 8
A362: CAMBERWELL | C362: NEILSON 5 | E362: ROURKE 4 | H362: HAMMOND 3 | K362: DAVIDSON 2 | N362: STEVENSON 2 | Q362: COWLEY 2 | S362: BROMBERG | W362: DANDENONG | X362: 0 | Y362: 7 | Z362: 0 | AA362: 743 | AB362: 1026 | AC362: =(AA362/AB362)*100 -> 72.417153996101362 | AD362: =(X362*4)+(Z362*2) -> 0
A364: WERRIBEE | C364: 7 | D364: 1 | E364: 43 | G364: 13 | H364: 4 | I364: 82 | K364: 19 | L364: 10 | M364: 124 | O364: 34 | P364: 13 | Q364: 217 | S364: VENUE: WERRIBEE
A365: FRANKSTON | C365: 5 | D365: 0 | E365: 30 | G365: 13 | H365: 3 | I365: 81 | K365: 15 | L365: 11 | M365: 101 | O365: 19 | P365: 15 | Q365: 129 | S365: BUDGE :STABB
A366: BEST PLAYERS
A367: WERRIBEE | C367: SIMMONS | F367: DEMPSTER | I367: CONN | K367: SCANLAN | N367: ALLEN | Q367: SMITH
A368: FRANKSTON | C368: COLE | F368: SALA | I368: BELL | K368: LYNN | N368: LANE | Q368: BRADY
A369: GOALKICKERS
A370: WERRIBEE | C370: SIMMONS 8 | E370: CONN 6 | G370: ALLEN 5 | I370: MORRIS 3 | K370: KING 3 | M370: RICHARDSON 3 | P370: SMITH 3 | R370: REID 2 | T370: DEMPSTER
A371: FRANKSTON | C371: LANE 6 | E371: HORTON 3 | G371: GEDDES 2 | I371: BRADY 2 | K371: LOCKWOOD | M371: JOHNSON | O371: MACE | Q371: DUNSFORD | T371: LYNN | V371: KENNEDY
A373: PRAHRAN | C373: 4 | D373: 5 | E373: 29 | G373: 8 | H373: 8 | I373: 56 | K373: 16 | L373: 13 | M373: 109 | O373: 24 | P373: 16 | Q373: 160 | S373: VENUE: TOORAK PARK
A374: WILLIAMSTOWN | C374: 4 | D374: 5 | E374: 29 | G374: 8 | H374: 9 | I374: 57 | K374: 12 | L374: 14 | M374: 86 | O374: 18 | P374: 20 | Q374: 128 | S374: CROXFORD :FITZPATRICK
A375: BEST PLAYERS
A376: PRAHRAN | C376: K SMITH | F376: DICKSON | I376: REED | L376: COONEY | O376: WRIGHT | R376: TOOMEY
A377: WILLIAMSTOWN | C377: FOSTER | F377: MAHER | I377: CONSIDINE | L377: MATTHEWS | O377: FOTHERINGHAM | R377: SAIT
A378: GOALKICKERS
A379: PRAHRAN | C379: SMITH 8 | E379: WEBBER 3 | G379: STEVENS 2 | I379: COBURN 2 | K379: TWOMEY 2 | M379: McCORMACK 2 | P379: TOOMEY 2 | R379: COONEY 2 | U379: WRIGHT
A380: WILLIAMSTOWN | C380: OBORNE 5 | E380: FOTHERINGHAM 5 | I380: FAIRLEY 2 | K380: McRAE 2 | M380: HOLDER 2 | O380: KELLY | Q380: EDWARDS
A382: SANDRINGHAM | C382: 4 | D382: 4 | E382: 28 | G382: 9 | H382: 9 | I382: 63 | K382: 12 | L382: 10 | M382: 82 | O382: 21 | P382: 17 | Q382: 143 | S382: VENUE: BEACH ROAD
A383: WAVERLEY | C383: 5 | D383: 0 | E383: 30 | G383: 8 | H383: 6 | I383: 54 | K383: 12 | L383: 9 | M383: 81 | O383: 13 | P383: 12 | Q383: 90 | S383: CASEY :QUINN
A384: BEST PLAYERS
A385: SANDRINGHAM | C385: HAYES | E385: LYONS | H385: RAFFERTY | K385: RICHARDS | N385: CARROLL | Q385: WAY
A386: WAVERLEY | C386: BRICK | E386: FOWLER | H386: McCORMACK | K386: HAMILTON | N386: GOODMAN | Q386: WENBORNE
A387: GOALKICKERS
A388: SANDRINGHAM | C388: CARROLL 7 | E388: ADAMS 3 | G388: WORKMAN 3 | J388: WAY 2 | L388: NANKERVIS 2 | O388: WILKINS | Q388: PLEDGER | S388: MANNIX | V388: RAFFERTY
A389: WAVERLEY | C389: JONES 3 | E389: DIXON 3 | G389: PRITCHARD 3 | J389: BRICK 2 | L389: BEDDOE | N389: VENVILLE
A391: PRESTON | C391: 4 | D391: 4 | E391: 28 | G391: 7 | H391: 5 | I391: 47 | K391: 12 | L391: 7 | M391: 79 | O391: 19 | P391: 12 | Q391: 126 | S391: VENUE: DANDENONG
A392: DANDENONG | C392: 2 | D392: 3 | E392: 15 | G392: 8 | H392: 7 | I392: 55 | K392: 14 | L392: 10 | M392: 94 | O392: 16 | P392: 12 | Q392: 108 | S392: GRIFFITH :OGSTON
A393: BEST PLAYERS
A394: PRESTON | C394: KELLY | F394: PLOWMAN | I394: McKEON | L394: VANN | N394: BODEN | Q394: AUSTEN
A395: DANDENONG | C395: WENN | F395: TAYLOR | I395: ORTON | L395: LACEY | N395: WALLACE | Q395: WRIGHT
A396: GOALKICKERS
A397: PRESTON | C397: HALAS 6 | E397: MCKEON 3 | G397: BODEN 2 | I397: BEER | J397: OHLSEN | L397: AUSTEN | N397: FREEMANTLE | Q397: MCGAW | S397: DINTINOSANTE | W397: MARCON
A398: DANDENONG | C398: WRIGHT 6 | F398: TOWNSEND 3 | I398: CROWLEY 2 | L398: TAYLOR 2 | N398: MADDEN | P398: HORAZCKO | R398: LACEY | T398: BARTLETT
A400: ROUND 8 | D400: 6TH JUNE | I400: WEATHER | S400: VENUE: PRESTON
D401: 1ST QTR | H401: 2ND QTR | L401: 3RD QTR | P401: FINAL | S401: UMPIRES
A402: PRESTON | C402: 7 | D402: 7 | E402: 49 | G402: 10 | H402: 12 | I402: 72 | K402: 14 | L402: 16 | M402: 100 | O402: 16 | P402: 22 | Q402: 118 | S402: CASEY | X402: LADDER | AB402: ROUND | AD402: 8
A403: PRAHRAN | C403: 1 | D403: 2 | E403: 8 | G403: 3 | H403: 7 | I403: 25 | K403: 5 | L403: 11 | M403: 41 | O403: 8 | P403: 14 | Q403: 62 | S403: RYAN
A404: BEST PLAYERS | W404: TEAM | X404: W | Y404: L | Z404: D | AA404: FOR | AB404: AGST | AC404: % | AD404: PTS
A405: PRESTON | C405: SHAW | F405: BUX | I405: BODEN | L405: McKEON | O405: WARREN | Q405: VANN
A406: PRAHRAN | C406: WALLACE | F406: DICKSON | I406: FOLEY | L406: TWOMEY | O406: COONEY | Q406: WEBBER | W406: PORT MELBOURNE | X406: 6 | Y406: 2 | Z406: 0 | AA406: 1288 | AB406: 916 | AC406: =(AA406/AB406)*100 -> 140.6113537117904 | AD406: =(X406*4)+(Z406*2) -> 24
A407: GOALKICKERS | R407: MCCANN | W407: PRESTON | X407: 6 | Y407: 2 | Z407: 0 | AA407: 990 | AB407: 785 | AC407: =(AA407/AB407)*100 -> 126.11464968152866 | AD407: =(X407*4)+(Z407*2) -> 24
A408: PRESTON | C408: SHAW 3 | E408: VANN 3 | G408: HALAS 2 | I408: MARCON 2 | K408: OHLSEN | M408: KELLY | N408: DINTINOSANTE | Q408: BARTLET | S408: BEER | W408: COBURG | X408: 6 | Y408: 2 | Z408: 0 | AA408: 1007 | AB408: 834 | AC408: =(AA408/AB408)*100 -> 120.74340527577938 | AD408: =(X408*4)+(Z408*2) -> 24
A409: PRAHRAN | C409: WEBBER 3 | F409: WRIGHT | H409: SOULOS | J409: COBURN | L409: STEVENS | N409: SMITH | W409: WERRIBEE | X409: 5 | Y409: 3 | Z409: 0 | AA409: 1137 | AB409: 1039 | AC409: =(AA409/AB409)*100 -> 109.43214629451397 | AD409: =(X409*4)+(Z409*2) -> 20
S410: VENUE: CAMBERWELL
A411: COBURG | C411: 3 | D411: 5 | E411: 23 | G411: 4 | H411: 12 | I411: 36 | K411: 9 | L411: 14 | M411: 68 | O411: 17 | P411: 17 | Q411: 119 | S411: CROXFORD | W411: PRAHRAN | X411: 5 | Y411: 3 | Z411: 0 | AA411: 998 | AB411: 949 | AC411: =(AA411/AB411)*100 -> 105.16332982086408 | AD411: =(X411*4)+(Z411*2) -> 20
A412: CAMBERWELL | C412: 3 | D412: 4 | E412: 22 | G412: 9 | H412: 7 | I412: 61 | K412: 11 | L412: 9 | M412: 75 | O412: 14 | P412: 12 | Q412: 96 | S412: FITZPATRICK | W412: GEELONG WEST | X412: 5 | Y412: 3 | Z412: 0 | AA412: 992 | AB412: 988 | AC412: =(AA412/AB412)*100 -> 100.40485829959513 | AD412: =(X412*4)+(Z412*2) -> 20
A413: BEST PLAYERS | W413: SANDRINGHAM | X413: 4 | Y413: 4 | Z413: 0 | AA413: 1001 | AB413: 980 | AC413: =(AA413/AB413)*100 -> 102.14285714285714 | AD413: =(X413*4)+(Z413*2) -> 16
A414: COBURG | C414: BURT | F414: CLEARY | I414: SHELDON | L414: DWYER | O414: MILROY | Q414: EADE | W414: CAMBERWELL | X414: 4 | Y414: 4 | Z414: 0 | AA414: 1000 | AB414: 1040 | AC414: =(AA414/AB414)*100 -> 96.15384615384616 | AD414: =(X414*4)+(Z414*2) -> 16
A415: CAMBERWELL | C415: McFEE | F415: NEILSON | I415: CAHILL | L415: WILKINSON | O415: WRIGHT | Q415: ROURKE | W415: WILLIAMSTOWN | X415: 3 | Y415: 5 | Z415: 0 | AA415: 1038 | AB415: 1094 | AC415: =(AA415/AB415)*100 -> 94.881170018281537 | AD415: =(X415*4)+(Z415*2) -> 12
A416: GOALKICKERS | W416: FRANKSTON | X416: 2 | Y416: 6 | Z416: 0 | AA416: 956 | AB416: 1118 | AC416: =(AA416/AB416)*100 -> 85.509838998211094 | AD416: =(X416*4)+(Z416*2) -> 8
A417: COBURG | C417: DWYER 7 | F417: HERBERT 4 | I417: BURT 2 | K417: MILROY 2 | M417: HALSALL | O417: ANDERSON | W417: WAVERLEY | X417: 2 | Y417: 6 | Z417: 0 | AA417: 799 | AB417: 1141 | AC417: =(AA417/AB417)*100 -> 70.026292725679227 | AD417: =(X417*4)+(Z417*2) -> 8
A418: CAMBERWELL | C418: STEVENSON 6 | F418: COWLEY 4 | I418: WILKINSON 2 | L418: DAVIDSON | O418: ROURKE | W418: DANDENONG | X418: 0 | Y418: 8 | Z418: 0 | AA418: 873 | AB418: 1182 | AC418: =(AA418/AB418)*100 -> 73.857868020304579 | AD418: =(X418*4)+(Z418*2) -> 0
A420: WILLIAMSTOWN | C420: 5 | D420: 5 | E420: 35 | G420: 12 | H420: 7 | I420: 79 | K420: 16 | L420: 9 | M420: 105 | O420: 21 | P420: 11 | Q420: 137 | S420: VENUE: WILLIAMSTOWN
A421: SANDRINGHAM | C421: 5 | D421: 2 | E421: 32 | G421: 7 | H421: 7 | I421: 49 | K421: 13 | L421: 7 | M421: 85 | O421: 19 | P421: 8 | Q421: 122 | S421: OAKLEY ::BUDGE
A422: BEST PLAYERS
A423: WILLIAMSTOWN | C423: SAIT | F423: FOTHERINGHAM | I423: OBORNE | L423: FAIRLEY | N423: EDWARDS | Q423: POWLEY
A424: SANDRINGHAM | C424: HAYES | F424: ADAMS | I424: MACLEOD | L424: KELLY | N424: WAY
A425: GOALKICKERS
A426: WILLIAMSTOWN | C426: FOTHERINGHAM 9 | G426: OBORNE 7 | I426: SAIT 2 | K426: McRAE | M426: CONSIDINE | P426: POWLEY
A427: SANDRINGHAM | C427: ADAMS 6 | F427: CARROLL 4 | I427: MACLEOD 3 | L427: PLEDGER 2 | N427: KELLY 2 | P427: GALLAGHER | S427: WAY
A429: GEELONG WEST | C429: 7 | D429: 3 | E429: 45 | G429: 11 | H429: 5 | I429: 71 | K429: 15 | L429: 8 | M429: 98 | O429: 20 | P429: 10 | Q429: 130 | S429: VENUE: FRANKSTON
A430: FRANKSTON | C430: 4 | D430: 7 | E430: 31 | G430: 11 | H430: 14 | I430: 80 | K430: 16 | L430: 19 | M430: 115 | O430: 17 | P430: 23 | Q430: 125 | S430: VERGONA :GRIFFITHS
A431: BEST PLAYERS
A432: GEELONG WEST | C432: CURRAN | F432: BURNETT | I432: CRICHTON | L432: WILSON | N432: KRANJC | Q432: DALIHAUS
A433: FRANKSTON | C433: ROGERSON | F433: HUNTER | I433: SALA | L433: GEDDES | N433: CASEY | Q433: LYNN
A434: GOALKICKERS
A435: GEELONG WEST | C435: TAYLOR 4 | E435: RADOJEVIC 4 | H435: DALIHAUS 3 | J435: SCOTT 2 | L435: GIBSON 2 | N435: McCANCE 2 | Q435: BURNETT | S435: McDOWELL | V435: ROBINSON
A436: FRANKSTON | C436: LOCKWOOD 4 | F436: HUNTER 4 | I436: HORTON 3 | K436: LANE 2 | M436: JOHNSON | O436: JONES | Q436: LYNN | S436: BOYD
A438: WERRIBEE | C438: 3 | D438: 6 | E438: 24 | G438: 8 | H438: 11 | I438: 59 | K438: 16 | L438: 20 | M438: 116 | O438: 20 | P438: 26 | Q438: 146 | S438: VENUE: WERRIBEE
A439: WAVERLEY | C439: 4 | D439: 3 | E439: 27 | G439: 9 | H439: 4 | I439: 58 | K439: 11 | L439: 5 | M439: 71 | O439: 15 | P439: 10 | Q439: 100 | S439: OGSTON :GROOM
A440: BEST PLAYERS
A441: WERRIBEE | C441: CONN | F441: PARKES | I441: REDENBACH | L441: DEMPSTER | O441: MEMBEY | Q441: MORRIS
A442: WAVERLEY | C442: McCORMACK | F442: KING | I442: FOWLER | L442: VENVILLE | O442: STYLES | Q442: WENBORNE
A443: GOALKICKERS
A444: WERRIBEE | C444: DEMPSTER 4 | F444: REDENBACH 3 | I444: KING 3 | K444: JAMES 2 | M444: ALLEN 2 | O444: SIMMONS 2 | Q444: CONN | R444: MORRIS | U444: REID | W444: RICHARDSON
A445: WAVERLEY | C445: JONES 5 | E445: DICKSON 3 | G445: CLARKE 2 | I445: FOWLER 2 | K445: VENVILLE 2 | M445: STYLES
A447: PORT MELBOURNE | C447: 8 | D447: 4 | E447: 52 | G447: 16 | H447: 11 | I447: 107 | K447: 19 | L447: 13 | M447: 127 | O447: 23 | P447: 18 | Q447: 156 | S447: VENUE: PORT MELBOURNE
A448: DANDENONG | C448: 0 | D448: 4 | E448: 4 | G448: 2 | H448: 9 | I448: 21 | K448: 12 | L448: 16 | M448: 88 | O448: 18 | P448: 22 | Q448: 130 | S448: QUINN :STABB
A449: BEST PLAYERS
A450: PORT MELBOURNE | C450: EBEYER | F450: RODDA | I450: BRADBURY | L450: HALL | N450: KAVANAGH | Q450: ROBERTSON
A451: DANDENONG | C451: MADDEN | F451: KNIGHT | I451: J MILLANE | L451: ORTON | N451: WENN | Q451: LACEY
A452: GOALKICKERS
A453: PORT MELBOURNE | C453: COOK 5 | E453: ANDERSON 4 | H453: WILKINSON 3 | K453: RODDA 3 | M453: EBEYER 3 | O453: EVANS | Q453: SWAN | S453: HALL | U453: DOYLE | W453: KAVANAGH
A454: DANDENONG | C454: WRIGHT 5 | E454: TOWNSEND 4 | H454: MADDEN 3 | J454: D MILLANE 2 | M454: J MILLANE | P454: KNIGHT
A456: ROUND 9 | D456: 20TH JUNE | I456: WEATHER | S456: VENUE: TOORAK PARK
D457: 1ST QTR | H457: 2ND QTR | L457: 3RD QTR | P457: FINAL | S457: UMPIRES
A458: PORT MELBOURNE | C458: 6 | D458: 3 | E458: 39 | G458: 12 | H458: 7 | I458: 79 | K458: 19 | L458: 11 | M458: 125 | O458: 23 | P458: 14 | Q458: 152 | S458: CROXFORD | X458: LADDER | AB458: ROUND | AD458: 9
A459: PRAHRAN | C459: 2 | D459: 4 | E459: 16 | G459: 5 | H459: 8 | I459: 38 | K459: 9 | L459: 10 | M459: 64 | O459: 14 | P459: 17 | Q459: 101 | S459: OAKLEY
A460: BEST PLAYERS | W460: TEAM | X460: W | Y460: L | Z460: D | AA460: FOR | AB460: AGST | AC460: % | AD460: PTS
A461: PORT MELBOURNE | C461: SWAN | F461: CHADBAND | I461: ANDERSON | L461: EVANS | N461: BRADBURY | Q461: WILKINSON
A462: PRAHRAN | C462: JEFFREY | F462: FOLEY | I462: McCORMACK | L462: DICKSON | W462: PORT MELBOURNE | X462: 7 | Y462: 2 | Z462: 0 | AA462: 1440 | AB462: 1017 | AC462: =(AA462/AB462)*100 -> 141.59292035398229 | AD462: =(X462*4)+(Z462*2) -> 28
A463: GOALKICKERS | W463: PRESTON | X463: 7 | Y463: 2 | Z463: 0 | AA463: 1123 | AB463: 848 | AC463: =(AA463/AB463)*100 -> 132.42924528301887 | AD463: =(X463*4)+(Z463*2) -> 28
A464: PORT MELBOURNE | C464: ANDERSON 8 | F464: COOK 4 | H464: SWAN 3 | J464: WILKINSON 3 | M464: EBEYER 2 | O464: GOSS | Q464: RODDA | S464: KAVANAGH | W464: COBURG | X464: 7 | Y464: 2 | Z464: 0 | AA464: 1138 | AB464: 927 | AC464: =(AA464/AB464)*100 -> 122.76159654800432 | AD464: =(X464*4)+(Z464*2) -> 28
A465: PRAHRAN | C465: COONEY 4 | F465: McCORMACK 4 | I465: TOOMEY 3 | K465: DICKSON | M465: P McDONALD | P465: COBURN | W465: GEELONG WEST | X465: 6 | Y465: 3 | Z465: 0 | AA465: 1153 | AB465: 1104 | AC465: =(AA465/AB465)*100 -> 104.43840579710144 | AD465: =(X465*4)+(Z465*2) -> 24
S466: VENUE: GEELONG WEST
A467: GEELONG WEST | C467: 7 | D467: 3 | E467: 45 | G467: 10 | H467: 6 | I467: 66 | K467: 17 | L467: 12 | M467: 114 | O467: 24 | P467: 17 | Q467: 161 | S467: CASEY | W467: WERRIBEE | X467: 5 | Y467: 4 | Z467: 0 | AA467: 1253 | AB467: 1200 | AC467: =(AA467/AB467)*100 -> 104.41666666666667 | AD467: =(X467*4)+(Z467*2) -> 20
A468: WERRIBEE | C468: 8 | D468: 3 | E468: 51 | G468: 13 | H468: 7 | I468: 85 | K468: 15 | L468: 8 | M468: 98 | O468: 18 | P468: 8 | Q468: 116 | S468: RYAN | W468: PRAHRAN | X468: 5 | Y468: 4 | Z468: 0 | AA468: 1099 | AB468: 1101 | AC468: =(AA468/AB468)*100 -> 99.818346957311533 | AD468: =(X468*4)+(Z468*2) -> 20
A469: BEST PLAYERS | W469: SANDRINGHAM | X469: 4 | Y469: 5 | Z469: 0 | AA469: 1064 | AB469: 1113 | AC469: =(AA469/AB469)*100 -> 95.59748427672956 | AD469: =(X469*4)+(Z469*2) -> 16
A470: GEELONG WEST | C470: TAYLOR | F470: BURNETT | I470: DALIHAUS | L470: YATES | N470: KRANJC | Q470: CRICHTON | W470: CAMBERWELL | X470: 4 | Y470: 5 | Z470: 0 | AA470: 1063 | AB470: 1158 | AC470: =(AA470/AB470)*100 -> 91.796200345423145 | AD470: =(X470*4)+(Z470*2) -> 16
A471: WERRIBEE | C471: SIMMONS | F471: HUMMEL | I471: MORRIS | W471: WILLIAMSTOWN | X471: 3 | Y471: 6 | Z471: 0 | AA471: 1089 | AB471: 1172 | AC471: =(AA471/AB471)*100 -> 92.918088737201359 | AD471: =(X471*4)+(Z471*2) -> 12
A472: GOALKICKERS | W472: WAVERLEY | X472: 3 | Y472: 6 | Z472: 0 | AA472: 877 | AB472: 1192 | AC472: =(AA472/AB472)*100 -> 73.573825503355707 | AD472: =(X472*4)+(Z472*2) -> 12
A473: GEELONG WEST | C473: TAYLOR 9 | E473: BURNETT 5 | H473: GIBSON 4 | J473: TORNEY 2 | L473: BEDDOE 2 | N473: CANTWELL | Q473: McCANCE | W473: FRANKSTON | X473: 2 | Y473: 7 | Z473: 0 | AA473: 1049 | AB473: 1249 | AC473: =(AA473/AB473)*100 -> 83.987189751801438 | AD473: =(X473*4)+(Z473*2) -> 8
A474: WERRIBEE | C474: SIMMONS 5 | F474: RICHARDSON 4 | I474: JAMES 2 | K474: CONN 2 | M474: ALLEN 2 | O474: DEMPSTER | Q474: REID | R474: KING | W474: DANDENONG | X474: 1 | Y474: 8 | Z474: 0 | AA474: 981 | AB474: 1245 | AC474: =(AA474/AB474)*100 -> 78.795180722891573 | AD474: =(X474*4)+(Z474*2) -> 4
A476: PRESTON | C476: 5 | D476: 1 | E476: 31 | G476: 7 | H476: 6 | I476: 48 | K476: 14 | L476: 10 | M476: 94 | O476: 20 | P476: 13 | Q476: 133 | S476: VENUE: BEACH ROAD
A477: SANDRINGHAM | C477: 1 | D477: 2 | E477: 8 | G477: 4 | H477: 7 | I477: 31 | K477: 6 | L477: 10 | M477: 46 | O477: 8 | P477: 15 | Q477: 63 | S477: STEERE :ALLSOPP
A478: BEST PLAYERS
A479: PRESTON | C479: OHLSEN | F479: BODEN | I479: PLOWMAN | L479: BEER | O479: HALAS | Q479: VANN
A480: SANDRINGHAM | C480: WATTS | F480: HAYES | I480: FEBEN | L480: LYONS | O480: DURNAN | Q480: WAY
A481: GOALKICKERS
A482: PRESTON | C482: HALAS 4 | E482: OHLSEN 3 | G482: MARCON 3 | I482: SHAW 2 | K482: DINTINOSANTE 2 | N482: MEESE 2 | P482: BODEN | R482: BEER | T482: McCANN | W482: VANN
A483: SANDRINGHAM | C483: CARROLL 3 | F483: STEVENS | H483: GALLAGHER | K483: ADAMS | M483: LYONS | O483: NANKERVIS
A485: WAVERLEY | C485: 5 | D485: 5 | E485: 35 | G485: 8 | H485: 6 | I485: 54 | K485: 9 | L485: 10 | M485: 64 | O485: 11 | P485: 12 | Q485: 78 | S485: VENUE: WAVERLEY
A486: WILLIAMSTOWN | C486: 2 | D486: 2 | E486: 14 | G486: 5 | H486: 4 | I486: 34 | K486: 5 | L486: 7 | M486: 37 | O486: 7 | P486: 9 | Q486: 51 | S486: VERGONA :QUINN
A487: BEST PLAYERS
A488: WAVERLEY | C488: FOWLER | F488: BRICK | I488: WENBORNE | L488: JONES | N488: COSGROVE | Q488: W McDONALD
A489: WILLIAMSTOWN | C489: TAYLOR | F489: POWLEY | I489: OBORNE | L489: RAUNIK | N489: EDWARDS | Q489: MATTHEWS
A490: GOALKICKERS
A491: WAVERLEY | C491: JONES 5 | F491: WENBORN 2 | I491: COSGROVE 2 | L491: STYLES | N491: VENVILLE
A492: WILLIAMSTOWN | C492: OBORNE 2 | F492: FOTHERINGHAM 2 | J492: RAUNIK | L492: POWLEY | N492: MAHER
A494: DANDENONG | C494: 4 | D494: 5 | E494: 29 | G494: 9 | H494: 10 | I494: 64 | K494: 14 | L494: 12 | M494: 96 | O494: 17 | P494: 16 | Q494: 118 | S494: VENUE: DANDENONG
A495: CAMBERWELL | C495: 4 | D495: 2 | E495: 26 | G495: 8 | H495: 3 | I495: 51 | K495: 8 | L495: 6 | M495: 54 | O495: 9 | P495: 9 | Q495: 63 | S495: BUDGE :GROOM
A496: BEST PLAYERS
A497: DANDENONG | C497: TOWNSEND | F497: WENN | I497: MILLANE | L497: KNIGHT | N497: COUSINS | Q497: MORTON
A498: CAMBERWELL | C498: McFEE | F498: CAHILL | I498: ZERBI | L498: COOK
A499: GOALKICKERS
A500: DANDENONG | C500: TOWNSEND 7 | F500: FLAHERTY 3 | I500: MADDEN 2 | L500: MILLANE 2 | N500: WRIGHT | P500: CROWLEY | R500: LACEY
A501: CAMBERWELL | C501: STEVENSON 3 | F501: HAMMOND 2 | I501: COWLEY 2 | L501: DAVIDSON | N501: WRIGHT
A503: COBURG | C503: 5 | D503: 5 | E503: 35 | G503: 9 | H503: 12 | I503: 66 | K503: 14 | L503: 15 | M503: 99 | O503: 18 | P503: 23 | Q503: 131 | S503: VENUE: COBURG
A504: FRANKSTON | C504: 4 | D504: 3 | E504: 27 | G504: 9 | H504: 4 | I504: 58 | K504: 13 | L504: 7 | M504: 85 | O504: 14 | P504: 9 | Q504: 93 | S504: PHILLIPS :STABB
A505: BEST PLAYERS
A506: COBURG | C506: HALBERT | F506: MILROY | I506: ANDERSON | L506: HALSALL | N506: CLEARY | Q506: FITZGERALD
A507: FRANKSTON | C507: COLE | F507: ROGERSON | I507: SALA | L507: GEDDES | N507: CASEY | Q507: HORLER
A508: GOALKICKERS
A509: COBURG | C509: HALSALL 4 | F509: FITZGERALD 4 | I509: CLEARY 2 | K509: HALBERT 2 | M509: HERBERT 2 | P509: DWYER | R509: LAIDLER | U509: ANDERSON | X509: GRAHAM
A510: FRANKSTON | C510: KENNEDY 2 | F510: HORLER 2 | H510: JONES 2 | J510: SALA 2 | L510: BOYD 2 | N510: JOHNSON | P510: HUNTER | R510: CZARNECKI | V510: LANE
A512: ROUND 10 | D512: 27TH JUNE | I512: WEATHER | S512: VENUE: WERRIBEE
D513: 1ST QTR | H513: 2ND QTR | L513: 3RD QTR | P513: FINAL | S513: UMPIRES
A514: COBURG | C514: 6 | D514: 3 | E514: 39 | G514: 11 | H514: 5 | I514: 71 | K514: 15 | L514: 10 | M514: 100 | O514: 22 | P514: 10 | Q514: 142 | S514: BUDGE | X514: LADDER | AB514: ROUND | AD514: 10
A515: WERRIBEE | C515: 4 | D515: 1 | E515: 25 | G515: 11 | H515: 5 | I515: 71 | K515: 13 | L515: 7 | M515: 85 | O515: 18 | P515: 8 | Q515: 116 | S515: QUINN
A516: BEST PLAYERS | W516: TEAM | X516: W | Y516: L | Z516: D | AA516: FOR | AB516: AGST | AC516: % | AD516: PTS
A517: COBURG | C517: HERBERT | F517: DOUGLAS | I517: CLEARY | L517: MILROY | N517: BURT | Q517: COLLINS
A518: WERRIBEE | C518: RICHARDSON | F518: M FREEMAN | I518: PARKES | L518: CONN | N518: MORRIS | W518: PRESTON | X518: 8 | Y518: 2 | Z518: 0 | AA518: 1288 | AB518: 902 | AC518: =(AA518/AB518)*100 -> 142.7937915742794 | AD518: =(X518*4)+(Z518*2) -> 32
A519: GOALKICKERS | Q519: DWYER | W519: PORT MELBOURNE | X519: 8 | Y519: 2 | Z519: 0 | AA519: 1603 | AB519: 1160 | AC519: =(AA519/AB519)*100 -> 138.18965517241381 | AD519: =(X519*4)+(Z519*2) -> 32
A520: COBURG | C520: SERAFINI 7 | F520: HERBERT 5 | I520: COLLINS 3 | K520: ANDERSON 2 | N520: HALBERT 2 | P520: FITZGERALD | R520: CLEARY | W520: COBURG | X520: 8 | Y520: 2 | Z520: 0 | AA520: 1280 | AB520: 1043 | AC520: =(AA520/AB520)*100 -> 122.7229146692234 | AD520: =(X520*4)+(Z520*2) -> 32
A521: WERRIBEE | C521: RICHARDSON 9 | F521: ALLEN 2 | H521: CONN | J521: PARKES | L521: DEMPSTER | N521: KING | O521: HUMMEL | Q521: SIMMONS | T521: McLEAN | W521: GEELONG WEST | X521: 7 | Y521: 3 | Z521: 0 | AA521: 1296 | AB521: 1209 | AC521: =(AA521/AB521)*100 -> 107.19602977667493 | AD521: =(X521*4)+(Z521*2) -> 28
S522: VENUE: PORT MELBOURNE
A523: PORT MELBOURNE | C523: 10 | D523: 4 | E523: 64 | G523: 12 | H523: 9 | I523: 81 | K523: 20 | L523: 17 | M523: 137 | O523: 24 | P523: 19 | Q523: 163 | S523: VERGONA | W523: PRAHRAN | X523: 6 | Y523: 4 | Z523: 0 | AA523: 1240 | AB523: 1231 | AC523: =(AA523/AB523)*100 -> 100.73111291632819 | AD523: =(X523*4)+(Z523*2) -> 24
A524: SANDRINGHAM | C524: 3 | D524: 3 | E524: 21 | G524: 8 | H524: 3 | I524: 51 | K524: 11 | L524: 9 | M524: 75 | O524: 21 | P524: 17 | Q524: 143 | S524: RYAN | W524: WERRIBEE | X524: 5 | Y524: 5 | Z524: 0 | AA524: 1369 | AB524: 1342 | AC524: =(AA524/AB524)*100 -> 102.01192250372577 | AD524: =(X524*4)+(Z524*2) -> 20
A525: BEST PLAYERS | W525: SANDRINGHAM | X525: 4 | Y525: 6 | Z525: 0 | AA525: 1207 | AB525: 1276 | AC525: =(AA525/AB525)*100 -> 94.592476489028215 | AD525: =(X525*4)+(Z525*2) -> 16
A526: PORT MELBOURNE | C526: SWAN | F526: BRADBURY | I526: WILKINSON | L526: ROBERTSON | O526: CHADBAND | R526: KAVANAGH | W526: CAMBERWELL | X526: 4 | Y526: 6 | Z526: 0 | AA526: 1193 | AB526: 1299 | AC526: =(AA526/AB526)*100 -> 91.83987682832948 | AD526: =(X526*4)+(Z526*2) -> 16
A527: SANDRINGHAM | C527: DURNAN | F527: SIMS | I527: RICHARDS | L527: CARROLL | O527: MACLEOD | R527: LYONS | W527: WILLIAMSTOWN | X527: 3 | Y527: 7 | Z527: 0 | AA527: 1143 | AB527: 1337 | AC527: =(AA527/AB527)*100 -> 85.48990276738968 | AD527: =(X527*4)+(Z527*2) -> 12
A528: GOALKICKERS | R528: KAVANAGH 2 | W528: WAVERLEY | X528: 3 | Y528: 7 | Z528: 0 | AA528: 982 | AB528: 1335 | AC528: =(AA528/AB528)*100 -> 73.55805243445694 | AD528: =(X528*4)+(Z528*2) -> 12
A529: PORT MELBOURNE | C529: ANDERSON 5 | F529: SWAN 5 | H529: COOK 4 | J529: WILKINSON 2 | M529: HALL 2 | O529: EVANS 2 | Q529: EBEYER 2 | W529: FRANKSTON | X529: 2 | Y529: 8 | Z529: 0 | AA529: 1165 | AB529: 1372 | AC529: =(AA529/AB529)*100 -> 84.912536443148696 | AD529: =(X529*4)+(Z529*2) -> 8
A530: SANDRINGHAM | C530: MACLEOD 6 | F530: CARROLL 5 | I530: ADAMS 3 | K530: GALLAGHER 2 | N530: MANNIX 2 | Q530: HALL 2 | S530: PLEDGER | W530: DANDENONG | X530: 2 | Y530: 8 | Z530: 0 | AA530: 1104 | AB530: 1361 | AC530: =(AA530/AB530)*100 -> 81.116825863335791 | AD530: =(X530*4)+(Z530*2) -> 8
A532: PRAHRAN | C532: 5 | D532: 7 | E532: 37 | G532: 10 | H532: 11 | I532: 71 | K532: 15 | L532: 16 | M532: 106 | O532: 20 | P532: 21 | Q532: 141 | S532: VENUE: CAMBERWELL
A533: CAMBERWELL | C533: 3 | D533: 1 | E533: 19 | G533: 10 | H533: 7 | I533: 67 | K533: 15 | L533: 10 | M533: 100 | O533: 19 | P533: 16 | Q533: 130 | S533: STABB :ALLSOPP
A534: BEST PLAYERS
A535: PRAHRAN | C535: DICKSON | F535: FOLEY | I535: WALLACE | L535: MILLS | O535: McCORMACK | R535: STONE
A536: CAMBERWELL | C536: WILKINSON | F536: RICE | I536: McKENZIE | L536: DAVIDSON | O536: HAMMOND | R536: ROURKE
A537: GOALKICKERS
A538: PRAHRAN | C538: MILLS 6 | E538: WALLACE 4 | H538: STONE 3 | J538: TWOMEY 2 | M538: McDONALD | P538: COBURN | R538: MOIR | T538: ROSS | V538: WARBURTON
A539: CAMBERWELL | C539: NIELSON 8 | E539: ROURKE 3 | H539: WILKINSON 3 | K539: STEVENSON 3 | N539: HAMMOND 3 | Q539: ZERBI | S539: WRIGHT | V539: DAVIDSON
A541: DANDENONG | C541: 8 | D541: 5 | E541: 53 | G541: 14 | H541: 8 | I541: 92 | K541: 18 | L541: 15 | M541: 123 | O541: 18 | P541: 15 | Q541: 123 | S541: VENUE: FRANKSTON
A542: FRANKSTON | C542: 6 | D542: 4 | E542: 40 | G542: 11 | H542: 9 | I542: 75 | K542: 13 | L542: 11 | M542: 89 | O542: 17 | P542: 14 | Q542: 116 | S542: CASEY :FITZPATRICK
A543: BEST PLAYERS
A544: DANDENONG | C544: MADDEN | F544: KNIGHTS | I544: WENN | L544: COVENTRY | O544: TAYLOR | R544: FLAHERTY
A545: FRANKSTON | C545: COLE | F545: BREWER | I545: GEDDES | L545: CASEY | O545: CZARNECKI | R545: HAMILL
A546: GOALKICKERS
A547: DANDENONG | C547: MADDEN 4 | E547: COVENTRY 2 | H547: TOWNSEND 2 | K547: LACEY | M547: CROWLEY | O547: WENN | Q547: POWLES | S547: ORTON | U547: TAYLOR
A548: FRANKSTON | C548: HUNTER 4 | E548: JOHNSON 3 | H548: JONES 2 | J548: GEDDES 2 | L548: CZARNECKI 2 | O548: LOCKWOOD | R548: ROGERSON | U548: SALA | W548: BOYD
A550: GEELONG WEST | C550: 4 | D550: 2 | E550: 26 | G550: 9 | H550: 5 | I550: 59 | K550: 16 | L550: 9 | M550: 105 | O550: 22 | P550: 11 | Q550: 143 | S550: VENUE: GEELONG WEST
A551: WAVERLEY | C551: 5 | D551: 1 | E551: 31 | G551: 11 | H551: 6 | I551: 72 | K551: 11 | L551: 9 | M551: 75 | O551: 15 | P551: 15 | Q551: 105 | S551: CROXFORD :DARLEY
A552: BEST PLAYERS
A553: GEELONG WEST | C553: WILSON | F553: KRANJC | I553: McCANCE | L553: TORNEY | O553: EDDY | Q553: BEATON
A554: WAVERLEY | C554: COSGROVE | F554: McCORMACK | I554: STYLES | L554: FISHER
A555: GOALKICKERS
A556: GEELONG WEST | C556: BURNETT 4 | E556: TAYLOR 4 | G556: TORNEY 4 | I556: BROWNE 3 | L556: EDDY 2 | N556: SCOTT 2 | P556: CANTWELL | R556: McCANCE | U556: McDOWELL
A557: WAVERLEY | C557: JONES 5 | F557: COSGROVE 3 | I557: WENBORNE 3 | L557: CLARK | N557: HOWELL | P557: McDONALD | R557: W STYLES
A559: PRESTON | C559: 5 | D559: 7 | E559: 37 | G559: 12 | H559: 13 | I559: 85 | K559: 19 | L559: 18 | M559: 132 | O559: 24 | P559: 21 | Q559: 165 | S559: VENUE: PRESTON
A560: WILLIAMSTOWN | C560: 2 | D560: 2 | E560: 14 | G560: 3 | H560: 6 | I560: 24 | K560: 4 | L560: 12 | M560: 36 | O560: 6 | P560: 18 | Q560: 54 | S560: GROOM :PHILLIPS
A561: BEST PLAYERS
A562: PRESTON | C562: BEER | E562: HALAS | H562: BUX | K562: PLOWMAN | N562: KELLY | Q562: McKEON
A563: WILLIAMSTOWN | C563: OBORNE | E563: HUGHES | H563: KENNEDY | K563: MATTHEWS | N563: EDWARDS | Q563: BEBEND
A564: GOALKICKERS
A565: PRESTON | C565: BEER 8 | E565: HALAS 6 | G565: OHLSEN 2 | I565: DINTINOSANTE 2 | L565: AUSTEN | N565: McGAW | P565: McKEON | R565: BRINE | T565: BODEN | V565: McCANN
A566: WILLIAMSTOWN | C566: OBORNE 2 | F566: FAIRLEY | H566: SAIT | I566: SWANN | K566: FOTHERINGHAM
A568: ROUND 11 | D568: 4TH JULY | I568: WEATHER | S568: VENUE: COBURG
D569: 1ST QTR | H569: 2ND QTR | L569: 3RD QTR | P569: FINAL | S569: UMPIRES
A570: COBURG | C570: 4 | D570: 4 | E570: 28 | G570: 11 | H570: 10 | I570: 76 | K570: 15 | L570: 11 | M570: 101 | O570: 28 | P570: 18 | Q570: 186 | S570: VERGONA | X570: LADDER | AB570: ROUND | AD570: 11
A571: GEELONG WEST | C571: 3 | D571: 5 | E571: 23 | G571: 6 | H571: 7 | I571: 43 | K571: 14 | L571: 11 | M571: 95 | O571: 16 | P571: 14 | Q571: 110 | S571: ALLSOPP
A572: BEST PLAYERS | W572: TEAM | X572: W | Y572: L | Z572: D | AA572: FOR | AB572: AGST | AC572: % | AD572: PTS
A573: COBURG | C573: EADE | F573: HERBERT | I573: SERAFINI | L573: FITZGERALD | O573: DWYER | Q573: HERBERT
A574: GEELONG WEST | C574: CURRAN | F574: BROWNE | I574: CRICHTON | L574: WILSON | W574: PRESTON | X574: 9 | Y574: 2 | Z574: 0 | AA574: 1575 | AB574: 980 | AC574: =(AA574/AB574)*100 -> 160.71428571428572 | AD574: =(X574*4)+(Z574*2) -> 36
A575: GOALKICKERS | R575: DWYER | W575: PORT MELBOURNE | X575: 9 | Y575: 2 | Z575: 0 | AA575: 1775 | AB575: 1281 | AC575: =(AA575/AB575)*100 -> 138.56362217017954 | AD575: =(X575*4)+(Z575*2) -> 36
A576: COBURG | C576: SERAFINI 10 | F576: HERBERT 6 | I576: CLEARY 4 | K576: HALSALL 2 | M576: HALBERT 2 | P576: BURT | Q576: LAIDLER | S576: COLLINS | W576: COBURG | X576: 9 | Y576: 2 | Z576: 0 | AA576: 1466 | AB576: 1153 | AC576: =(AA576/AB576)*100 -> 127.14657415437989 | AD576: =(X576*4)+(Z576*2) -> 36
A577: GEELONG WEST | C577: TAYLOR 4 | F577: BURNETT 3 | I577: BROWNE 2 | K577: SCOTT 2 | M577: EDDY 2 | O577: McDOWELL | Q577: McCANCE | S577: CANTWELL | W577: PRAHRAN | X577: 7 | Y577: 4 | Z577: 0 | AA577: 1374 | AB577: 1331 | AC577: =(AA577/AB577)*100 -> 103.23065364387678 | AD577: =(X577*4)+(Z577*2) -> 28
S578: VENUE: BEACH ROAD
A579: SANDRINGHAM | C579: 3 | D579: 6 | E579: 24 | G579: 8 | H579: 9 | I579: 57 | K579: 14 | L579: 17 | M579: 101 | O579: 19 | P579: 24 | Q579: 138 | S579: QUINN | W579: GEELONG WEST | X579: 7 | Y579: 4 | Z579: 0 | AA579: 1406 | AB579: 1395 | AC579: =(AA579/AB579)*100 -> 100.78853046594982 | AD579: =(X579*4)+(Z579*2) -> 28
A580: CAMBERWELL | C580: 4 | D580: 5 | E580: 29 | G580: 10 | H580: 10 | I580: 70 | K580: 14 | L580: 12 | M580: 96 | O580: 18 | P580: 15 | Q580: 123 | S580: CROXFORD | W580: WERRIBEE | X580: 5 | Y580: 6 | Z580: 0 | AA580: 1468 | AB580: 1490 | AC580: =(AA580/AB580)*100 -> 98.523489932885909 | AD580: =(X580*4)+(Z580*2) -> 20
A581: BEST PLAYERS | W581: SANDRINGHAM | X581: 5 | Y581: 6 | Z581: 0 | AA581: 1345 | AB581: 1399 | AC581: =(AA581/AB581)*100 -> 96.140100071479623 | AD581: =(X581*4)+(Z581*2) -> 20
A582: SANDRINGHAM | C582: HAYES | F582: WILKINS | I582: ADAMS | L582: LYONS | N582: MANNIX | Q582: FEBEN | W582: CAMBERWELL | X582: 4 | Y582: 7 | Z582: 0 | AA582: 1316 | AB582: 1437 | AC582: =(AA582/AB582)*100 -> 91.579679888656926 | AD582: =(X582*4)+(Z582*2) -> 16
A583: CAMBERWELL | C583: STEVENSON | F583: C ROURKE | I583: S ROURKE | L583: CAHILL | W583: DANDENONG | X583: 3 | Y583: 8 | Z583: 0 | AA583: 1252 | AB583: 1460 | AC583: =(AA583/AB583)*100 -> 85.753424657534254 | AD583: =(X583*4)+(Z583*2) -> 12
A584: GOALKICKERS | Q584: DEAGAN | W584: WILLIAMSTOWN | X584: 3 | Y584: 8 | Z584: 0 | AA584: 1264 | AB584: 1509 | AC584: =(AA584/AB584)*100 -> 83.764082173624928 | AD584: =(X584*4)+(Z584*2) -> 12
A585: SANDRINGHAM | C585: HAYES 4 | E585: MACLEOD 3 | H585: CARROLL 3 | J585: SIMS 2 | L585: WAY 2 | N585: HALL 2 | P585: WILKINS | R585: ADAMS | W585: WAVERLEY | X585: 3 | Y585: 8 | Z585: 0 | AA585: 1060 | AB585: 1562 | AC585: =(AA585/AB585)*100 -> 67.861715749039703 | AD585: =(X585*4)+(Z585*2) -> 12
A586: CAMBERWELL | C586: SYEVENSON 8 | F586: S ROURKE 3 | I586: C ROURKE 2 | L586: NEILSON 2 | N586: DAVIDSON | Q586: WILKINSON | T586: WRIGHT | W586: FRANKSTON | X586: 2 | Y586: 9 | Z586: 0 | AA586: 1265 | AB586: 1506 | AC586: =(AA586/AB586)*100 -> 83.997343957503318 | AD586: =(X586*4)+(Z586*2) -> 8
A588: PRAHRAN | C588: 3 | D588: 1 | E588: 19 | G588: 8 | H588: 7 | I588: 55 | K588: 13 | L588: 10 | M588: 88 | O588: 20 | P588: 14 | Q588: 134 | S588: VENUE: TOORAK PARK
A589: FRANKSTON | C589: 4 | D589: 9 | E589: 33 | G589: 5 | H589: 12 | I589: 42 | K589: 10 | L589: 17 | M589: 77 | O589: 13 | P589: 22 | Q589: 100
A590: BEST PLAYERS
A591: PRAHRAN | C591: WRIGHT | F591: McKISSOCK | I591: STONE | L591: JEFFREY | O591: MOIR | Q591: ELLETT
A592: FRANKSTON | C592: JOHNSON | F592: COLE | I592: BRUIN | L592: GEDDES | O592: HORLER | Q592: LYNN
A593: GOALKICKERS
A594: PRAHRAN | C594: MOIR 4 | E594: STONE 3 | G594: SMITH 3 | I594: McCORMACK 3 | L594: E WRIGHT 2 | N594: MILLS 2 | P594: ROSS | Q594: WALLACE | T594: McKISSOCK
A595: FRANKSTON | C595: GEDDES 3 | E595: HAMILL 3 | G595: JOHNSON 2 | I595: HUNTER 2 | K595: COLE | M595: JONES | O595: BELL
A597: DANDENONG | C597: 5 | D597: 3 | E597: 33 | G597: 9 | H597: 5 | I597: 59 | K597: 15 | L597: 11 | M597: 101 | O597: 22 | P597: 16 | Q597: 148 | S597: VENUE: DANDENONG
A598: WERRIBEE | C598: 3 | D598: 4 | E598: 22 | G598: 8 | H598: 9 | I598: 57 | K598: 10 | L598: 11 | M598: 71 | O598: 14 | P598: 15 | Q598: 99 | S598: PHILLIPS :OAKLEY
A599: BEST PLAYERS
A600: DANDENONG | C600: MADDEN | F600: WENN | I600: FLAHERTY | L600: COVENTRY | O600: HORAZCKO | R600: TAYLOR
A601: WERRIBEE | C601: FREEMAN | F601: JACKS | I601: MORRIS | L601: ALLEN | O601: PARKES
A602: GOALKICKERS
A603: DANDENONG | C603: FLAHERTY 5 | F603: MADDEN 4 | I603: TOWNSEND 4 | L603: TAYLOR 2 | N603: WRIGHT 2 | Q603: LACEY 2 | S603: COVENTRY | V603: WENN | X603: McCONNELL
A604: WERRIBEE | C604: PARKES 5 | F604: ALLEN 4 | H604: KING 2 | J604: DEMPSTER | M604: RICHARDSON | P604: CATTANACH
A606: PORT MELBOURNE | C606: 6 | D606: 5 | E606: 41 | G606: 11 | H606: 15 | I606: 81 | K606: 23 | L606: 17 | M606: 155 | O606: 25 | P606: 22 | Q606: 172 | S606: VENUE: WILLIAMSTOWN
A607: WILLIAMSTOWN | C607: 4 | D607: 7 | E607: 31 | G607: 9 | H607: 8 | I607: 62 | K607: 13 | L607: 10 | M607: 88 | O607: 18 | P607: 13 | Q607: 121 | S607: FITZPATRICK :CASEY
A608: BEST PLAYERS
A609: PORT MELBOURNE | C609: SWAN | E609: BRADBURY | H609: WILKINSON | K609: COOK | O609: EBEYER | Q609: KAVANAGH
A610: WILLIAMSTOWN | C610: POWLEY | E610: TAYLOR | H610: BOTTAMS | K610: FOTHERINGHAM | O610: HUGHES | Q610: EDWARDS
A611: GOALKICKERS
A612: PORT MELBOURNE | C612: COOK 10 | F612: EVANS 5 | H612: EBEYER 4 | J612: KAVANAGH 3 | M612: SWAN | O612: ANDERSON | R612: WILKINSON
A613: WILLIAMSTOWN | C613: FOTHERINGHAM 6 | G613: FAIRLEY 2 | I613: SAIT 2 | K613: HOLDER 2 | M613: HUGHES 2 | O613: TWEEDLY | Q613: BEBEND | S613: SWAN | U613: POWLEY
A615: PRESTON | C615: 10 | D615: 4 | E615: 64 | G615: 19 | H615: 12 | I615: 126 | K615: 23 | L615: 18 | M615: 156 | O615: 34 | P615: 23 | Q615: 227 | S615: VENUE: WAVERLEY
A616: WAVERLEY | C616: 0 | D616: 4 | E616: 4 | G616: 4 | H616: 8 | I616: 32 | K616: 7 | L616: 11 | M616: 53 | O616: 11 | P616: 12 | Q616: 78 | S616: OGSTON :STABB
A617: BEST PLAYERS
A618: PRESTON | C618: WIGHT | F618: BRINE | I618: DINTINOSANTE | L618: BUX | O618: McCANN | R618: PLOWMAN
A619: WAVERLEY | C619: HOWELL | F619: WENBORNE | I619: FOWLER | L619: ALEXANDER | O619: JONES
A620: GOALKICKERS | W620: McKEON
A621: PRESTON | C621: BEER 6 | E621: OHLSEN 4 | G621: VANN 4 | I621: BODEN 4 | K621: McCANN 3 | M621: KELLY 3 | O621: ANDERSON 2 | R621: AUSTEN 2 | U621: DINTINOSANTE 2 | X621: SHAW | Z621: WIGHT | AB621: PLOWMAN
A622: WAVERLEY | C622: JONES 5 | F622: VENVILLE 2 | I622: HAMILTON | L622: BRICK | N622: KING | P622: PLUMMER
A624: ROUND 12 | D624: 11TH JULY | I624: WEATHER | S624: VENUE: PRESTON
D625: 1ST QTR | H625: 2ND QTR | L625: 3RD QTR | P625: FINAL | S625: UMPIRES
A626: PRESTON | C626: 9 | D626: 2 | E626: 56 | G626: 16 | H626: 5 | I626: 101 | K626: 19 | L626: 11 | M626: 125 | O626: 24 | P626: 14 | Q626: 158 | S626: ALLSOPP | X626: LADDER | AB626: ROUND | AD626: 12
A627: PORT MELBOURNE | C627: 0 | D627: 3 | E627: 3 | G627: 3 | H627: 7 | I627: 25 | K627: 7 | L627: 19 | M627: 61 | O627: 11 | P627: 20 | Q627: 86 | S627: OAKLEY
A628: BEST PLAYERS | W628: TEAM | X628: W | Y628: L | Z628: D | AA628: FOR | AB628: AGST | AC628: % | AD628: PTS
A629: PRESTON | C629: AUSTEN | F629: HALAS | I629: DINTINOSANTE | L629: KELLY | O629: SHAW | R629: WARREN
A630: PORT MELBOURNE | C630: BRADBURY | F630: EVANS | I630: JOHNSON | L630: WILKINSON | O630: ROBERTSON | R630: KAVANAGH | W630: PRESTON | X630: 10 | Y630: 2 | Z630: 0 | AA630: 1733 | AB630: 1066 | AC630: =(AA630/AB630)*100 -> 162.57035647279551 | AD630: =(X630*4)+(Z630*2) -> 40
A631: GOALKICKERS | W631: COBURG | X631: 10 | Y631: 2 | Z631: 0 | AA631: 1595 | AB631: 1213 | AC631: =(AA631/AB631)*100 -> 131.4921681780709 | AD631: =(X631*4)+(Z631*2) -> 40
A632: PRESTON | C632: HALAS 8 | E632: OHLSEN 3 | G632: DINTINOSANTE 3 | J632: SHAW 3 | L632: KELLY 2 | N632: BERRY 2 | P632: McCANN 2 | R632: BEER | W632: PORT MELBOURNE | X632: 9 | Y632: 3 | Z632: 0 | AA632: 1861 | AB632: 1439 | AC632: =(AA632/AB632)*100 -> 129.32592077831828 | AD632: =(X632*4)+(Z632*2) -> 36
A633: PORT MELBOURNE | C633: COOK 5 | E633: BRADBURY 2 | H633: SWAN 2 | J633: DOYLE | W633: GEELONG WEST | X633: 8 | Y633: 4 | Z633: 0 | AA633: 1514 | AB633: 1496 | AC633: =(AA633/AB633)*100 -> 101.20320855614973 | AD633: =(X633*4)+(Z633*2) -> 32
S634: VENUE: TOORAK PARK
A635: WERRIBEE | C635: 8 | D635: 3 | E635: 51 | G635: 15 | H635: 5 | I635: 95 | K635: 21 | L635: 7 | M635: 133 | O635: 24 | P635: 12 | Q635: 156 | S635: FITZPATRICK | W635: PRAHRAN | X635: 7 | Y635: 5 | Z635: 0 | AA635: 1521 | AB635: 1487 | AC635: =(AA635/AB635)*100 -> 102.28648285137862 | AD635: =(X635*4)+(Z635*2) -> 28
A636: PRAHRAN | C636: 1 | D636: 2 | E636: 8 | G636: 7 | H636: 8 | I636: 50 | K636: 14 | L636: 20 | M636: 104 | O636: 21 | P636: 21 | Q636: 147 | S636: RYAN | W636: WERRIBEE | X636: 6 | Y636: 6 | Z636: 0 | AA636: 1624 | AB636: 1637 | AC636: =(AA636/AB636)*100 -> 99.205864386072079 | AD636: =(X636*4)+(Z636*2) -> 24
A637: BEST PLAYERS | W637: SANDRINGHAM | X637: 5 | Y637: 7 | Z637: 0 | AA637: 1456 | AB637: 1541 | AC637: =(AA637/AB637)*100 -> 94.484101232965614 | AD637: =(X637*4)+(Z637*2) -> 20
A638: WERRIBEE | C638: ALLEN | F638: DEMPSTER | I638: HUMMEL | L638: FREEMAN | O638: REID | Q638: JACK | W638: CAMBERWELL | X638: 5 | Y638: 7 | Z638: 0 | AA638: 1478 | AB638: 1566 | AC638: =(AA638/AB638)*100 -> 94.380587484035757 | AD638: =(X638*4)+(Z638*2) -> 20
A639: PRAHRAN | C639: DICKSON | F639: JEFFREY | I639: GRAMBEAU | L639: P McDONALD | O639: STONE | Q639: TWOMEY | W639: FRANKSTON | X639: 3 | Y639: 9 | Z639: 0 | AA639: 1406 | AB639: 1617 | AC639: =(AA639/AB639)*100 -> 86.951144094001236 | AD639: =(X639*4)+(Z639*2) -> 12
A640: GOALKICKERS | O640: MORRIS | R640: PARKES | W640: DANDENONG | X640: 3 | Y640: 9 | Z640: 0 | AA640: 1353 | AB640: 1568 | AC640: =(AA640/AB640)*100 -> 86.28826530612244 | AD640: =(X640*4)+(Z640*2) -> 12
A641: WERRIBEE | C641: ALLAN 6 | E641: SIMMONS 4 | H641: HUGHES 3 | J641: HUMMEL 3 | M641: RICHARDSON 2 | P641: REID 2 | R641: KING 2 | W641: WILLIAMSTOWN | X641: 3 | Y641: 9 | Z641: 0 | AA641: 1393 | AB641: 1671 | AC641: =(AA641/AB641)*100 -> 83.363255535607422 | AD641: =(X641*4)+(Z641*2) -> 12
A642: PRAHRAN | C642: SMITH 7 | E642: P McDONALD 3 | H642: DICKSON 3 | J642: WALLACE 2 | M642: STONE 2 | O642: McCORMACK | R642: HINE | W642: WAVERLEY | X642: 3 | Y642: 9 | Z642: 0 | AA642: 1120 | AB642: 1691 | AC642: =(AA642/AB642)*100 -> 66.232998225901824 | AD642: =(X642*4)+(Z642*2) -> 12
O643: MOIR | Q643: TWOMEY
A644: GEELONG WEST | C644: 5 | D644: 3 | E644: 33 | G644: 9 | H644: 7 | I644: 61 | K644: 13 | L644: 12 | M644: 90 | O644: 16 | P644: 12 | Q644: 108 | S644: VENUE: DANDENONG
A645: DANDENONG | C645: 6 | D645: 5 | E645: 41 | G645: 9 | H645: 7 | I645: 61 | K645: 12 | L645: 8 | M645: 80 | O645: 14 | P645: 17 | Q645: 101 | S645: BUDGE :QUINN
A646: BEST PLAYERS
A647: GEELONG WEST | C647: BROWNE | F647: CURRAN | I647: YATES | K647: CRICHTON | N647: TORNEY | Q647: GIBSON
A648: DANDENONG | C648: WRIGHT | F648: ORTON | I648: WENN | K648: COVENTRY | N648: TAYLOR | Q648: MADDEN
A649: GOALKICKERS
A650: GEELONG WEST | C650: BROWNE 3 | F650: BURNETT 3 | I650: TAYLOR 3 | K650: TORNEY 3 | M650: CRICHTON 2 | O650: DALIHAUS | Q650: EDDY
A651: DANDENONG | C651: WRIGHT 7 | F651: TOWNSEND 4 | I651: MADDEN 2 | L651: WENN
A653: CAMBERWELL | C653: 7 | D653: 6 | E653: 48 | G653: 12 | H653: 9 | I653: 81 | K653: 20 | L653: 20 | M653: 140 | O653: 23 | P653: 24 | Q653: 162 | S653: VENUE: WILLIAMSTOWN
A654: WILLIAMSTOWN | C654: 1 | D654: 4 | E654: 10 | G654: 7 | H654: 7 | I654: 49 | K654: 9 | L654: 9 | M654: 63 | O654: 19 | P654: 15 | Q654: 129 | S654: VERGONA :RYAN
A655: BEST PLAYERS
A656: CAMBERWELL | C656: COWLEY | F656: C ROURKE | I656: NEILSON | L656: STEVENSON | O656: DANS | Q656: S ROURKE
A657: WILLIAMSTOWN | C657: FOTHERINGHAM | F657: TAYLOR | I657: OBORNE | L657: EDWARDS | O657: POWLEY | Q657: BEBEND
A658: GOALKICKERS
A659: CAMBERWELL | C659: STEVENSON 6 | F659: COWLEY 3 | I659: KING 3 | K659: DAVIDSON 3 | N659: DANS 2 | P659: NEILSON 2 | R659: McKENZIE | U659: S ROURKE | X659: C ROURKE | AA659: ASHTON
A660: WILLIAMSTOWN | C660: FOTHERINGHAM 8 | G660: OBORNE 5 | I660: FAIRLEY 2 | K660: EDWARDS 2 | N660: COATES | P660: CHAPMAN
A662: FRANKSTON | C662: 1 | D662: 1 | E662: 7 | G662: 9 | H662: 5 | I662: 59 | K662: 13 | L662: 10 | M662: 88 | O662: 21 | P662: 16 | Q662: 142 | S662: VENUE: BEACH ROAD
A663: SANDRINGHAM | C663: 5 | D663: 2 | E663: 32 | G663: 6 | H663: 4 | I663: 40 | K663: 12 | L663: 8 | M663: 80 | O663: 16 | P663: 15 | Q663: 111 | S663: OGSTON :STABB
A664: BEST PLAYERS
A665: FRANKSTON | C665: JOHNSON | F665: COLE | I665: BRUIN | K665: WILLIAMS | N665: GEDDES | Q665: CASEY
A666: SANDRINGHAM | C666: MAILING | F666: HAYES | I666: ADAMS
A667: GOALKICKERS
A668: FRANKSTON | C668: COLE 6 | E668: HUNTER 5 | G668: JOHNSON 2 | I668: SALA 2 | K668: GAMBLE 2 | M668: HAMILL 2 | O668: WILLIAMS | Q668: HALE
A669: SANDRINGHAM | C669: MAILING 4 | E669: CARROLL 2 | H669: MANNIX 2 | J669: HAYES 2 | L669: ADAMS | N669: SIMS | P669: DURNAN | R669: CATHCART
A671: COBURG | C671: 2 | D671: 7 | E671: 19 | G671: 7 | H671: 9 | I671: 51 | K671: 13 | L671: 11 | M671: 89 | O671: 19 | P671: 15 | Q671: 129 | S671: VENUE: WAVERLEY
A672: WAVERLEY | C672: 2 | D672: 2 | E672: 14 | G672: 4 | H672: 2 | I672: 26 | K672: 6 | L672: 3 | M672: 39 | O672: 9 | P672: 6 | Q672: 60 | S672: GROOM :GRIFFITHS
A673: BEST PLAYERS
A674: COBURG | C674: SHELDON | F674: DWYER | I674: EADE | L674: DOUGLAS | O674: HALBERT | R674: HARBINSON
A675: WAVERLEY | C675: FISHER | F675: ALEXANDER | I675: WENBORN | L675: FOWLER | O675: McEWAN
A676: GOALKICKERS
A677: COBURG | C677: SERAFINI 8 | F677: FITZGERALD 2 | I677: PENNINGTON 2 | L677: CLEARY 2 | N677: HALSALL 2 | P677: HALBERT | R677: HERBERT | U677: DWYER
A678: WAVERLEY | C678: JONES 5 | F678: LUKEY 2 | I678: KINNIBURGH | L678: DAVIES
A680: ROUND 13 | D680: 18TH JULY | I680: WEATHER | S680: VENUE: GEELONG WEST
D681: 1ST QTR | H681: 2ND QTR | L681: 3RD QTR | P681: FINAL | S681: UMPIRES
A682: GEELONG WEST | C682: 4 | D682: 5 | E682: 29 | G682: 8 | H682: 11 | I682: 59 | K682: 12 | L682: 13 | M682: 85 | O682: 18 | P682: 17 | Q682: 125 | S682: OGSTON | X682: LADDER | AB682: ROUND | AD682: 13
A683: PRAHRAN | C683: 3 | D683: 3 | E683: 21 | G683: 8 | H683: 6 | I683: 54 | K683: 11 | L683: 8 | M683: 74 | O683: 15 | P683: 11 | Q683: 101 | S683: GRIFFITHS
A684: BEST PLAYERS | W684: TEAM | X684: W | Y684: L | Z684: D | AA684: FOR | AB684: AGST | AC684: % | AD684: PTS
A685: GEELONG WEST | C685: EDDY | F685: BROWNE | I685: RADOJEVIC | L685: TORNEY | O685: FOOTE | Q685: McCANCE
A686: PRAHRAN | C686: GRAMBEAU | F686: DICKSON | I686: McDONALD | L686: RUSSELL | W686: PRESTON | X686: 11 | Y686: 2 | Z686: 0 | AA686: 1845 | AB686: 1152 | AC686: =(AA686/AB686)*100 -> 160.15625 | AD686: =(X686*4)+(Z686*2) -> 44
A687: GOALKICKERS | W687: COBURG | X687: 11 | Y687: 2 | Z687: 0 | AA687: 1745 | AB687: 1307 | AC687: =(AA687/AB687)*100 -> 133.51185921958682 | AD687: =(X687*4)+(Z687*2) -> 44
A688: GEELONG WEST | C688: RADOJEVIC 9 | F688: EDDY 5 | H688: CRICHTON | J688: WILSON | L688: McCANCE | N688: BROWNE | W688: PORT MELBOURNE | X688: 10 | Y688: 3 | Z688: 0 | AA688: 2011 | AB688: 1543 | AC688: =(AA688/AB688)*100 -> 130.33052495139339 | AD688: =(X688*4)+(Z688*2) -> 40
A689: PRAHRAN | C689: RUSSELL 6 | F689: SMITH 4 | H689: SOULOS | J689: EASY | L689: McDONALD | N689: WRIGHT | P689: McCORMACK | W689: GEELONG WEST | X689: 9 | Y689: 4 | Z689: 0 | AA689: 1639 | AB689: 1597 | AC689: =(AA689/AB689)*100 -> 102.62993112085159 | AD689: =(X689*4)+(Z689*2) -> 36
S690: VENUE: WERRIBEE
A691: WERRIBEE | C691: 7 | D691: 1 | E691: 43 | G691: 13 | H691: 3 | I691: 81 | K691: 18 | L691: 8 | M691: 116 | O691: 29 | P691: 11 | Q691: 185 | S691: GROOM | W691: WERRIBEE | X691: 7 | Y691: 6 | Z691: 0 | AA691: 1809 | AB691: 1743 | AC691: =(AA691/AB691)*100 -> 103.78657487091223 | AD691: =(X691*4)+(Z691*2) -> 28
A692: SANDRINGHAM | C692: 2 | D692: 3 | E692: 15 | G692: 9 | H692: 4 | I692: 58 | K692: 14 | L692: 7 | M692: 91 | O692: 16 | P692: 10 | Q692: 106 | S692: ALLSOPP | W692: PRAHRAN | X692: 7 | Y692: 6 | Z692: 0 | AA692: 1622 | AB692: 1614 | AC692: =(AA692/AB692)*100 -> 100.49566294919454 | AD692: =(X692*4)+(Z692*2) -> 28
A693: BEST PLAYERS | W693: CAMBERWELL | X693: 5 | Y693: 8 | Z693: 0 | AA693: 1564 | AB693: 1678 | AC693: =(AA693/AB693)*100 -> 93.206197854588808 | AD693: =(X693*4)+(Z693*2) -> 20
A694: WERRIBEE | C694: BREEN | F694: DEMPSTER | I694: RICHARDSON | L694: ALLAN | O694: REDENBACH | W694: SANDRINGHAM | X694: 5 | Y694: 8 | Z694: 0 | AA694: 1562 | AB694: 1726 | AC694: =(AA694/AB694)*100 -> 90.498261877172652 | AD694: =(X694*4)+(Z694*2) -> 20
A695: SANDRINGHAM | C695: ADAMS | F695: SIMS | I695: GALLAGHER | L695: NANKERVIS | O695: CARROLL | W695: WILLIAMSTOWN | X695: 4 | Y695: 9 | Z695: 0 | AA695: 1539 | AB695: 1798 | AC695: =(AA695/AB695)*100 -> 85.595105672969964 | AD695: =(X695*4)+(Z695*2) -> 16
A696: GOALKICKERS | Q696: DEMPSTER | W696: FRANKSTON | X696: 3 | Y696: 10 | Z696: 0 | AA696: 1527 | AB696: 1763 | AC696: =(AA696/AB696)*100 -> 86.6137266023823 | AD696: =(X696*4)+(Z696*2) -> 12
A697: WERRIBEE | C697: RICHARDSON 5 | F697: REDENBACH 5 | I697: KING 4 | K697: HUGHES 4 | M697: ALLAN 3 | O697: HUMMEL 3 | Q697: MORRIS 2 | S697: SIMMONS 2 | W697: DANDENONG | X697: 3 | Y697: 10 | Z697: 0 | AA697: 1447 | AB697: 1718 | AC697: =(AA697/AB697)*100 -> 84.22584400465658 | AD697: =(X697*4)+(Z697*2) -> 12
A698: SANDRINGHAM | C698: NANKERVIS 5 | F698: CARROLL 4 | I698: MAILING 3 | K698: GALLAGHER 3 | N698: SIMS | W698: WAVERLEY | X698: 3 | Y698: 10 | Z698: 0 | AA698: 1224 | AB698: 1841 | AC698: =(AA698/AB698)*100 -> 66.485605649103746 | AD698: =(X698*4)+(Z698*2) -> 12
A700: PRESTON | C700: 3 | D700: 4 | E700: 22 | G700: 11 | H700: 7 | I700: 73 | K700: 14 | L700: 11 | M700: 95 | O700: 15 | P700: 22 | Q700: 112 | S700: VENUE: CAMBERWELL
A701: CAMBERWELL | C701: 5 | D701: 6 | E701: 36 | G701: 8 | H701: 10 | I701: 58 | K701: 9 | L701: 11 | M701: 65 | O701: 12 | P701: 14 | Q701: 86 | S701: FITZPATRICK :BUDGE
A702: BEST PLAYERS
A703: PRESTON | C703: WIGHT | F703: McKEON | I703: TOWAN | L703: BUX | O703: BRINE | Q703: WARREN
A704: CAMBERWELL | C704: DAVIDSON | F704: C ROURKE | I704: CAHILL | L704: BROMBERG | O704: NEILSON | Q704: EVANS
A705: GOALKICKERS
A706: PRESTON | C706: HALAS 4 | E706: BEER 2 | G706: BERRY 2 | I706: McKEON 2 | K706: OHLSEN | M706: KELLY | O706: VANN | Q706: DINTINOSANTE | U706: BARTLETT
A707: CAMBERWELL | C707: STEVENSON 4 | F707: S ROURKE 2 | I707: C ROURKE | K707: COWLEY | M707: RICE | N707: DAVIDSON | Q707: BROMBERG | T707: WILKINSON
A709: WILLIAMSTOWN | C709: 4 | D709: 5 | E709: 29 | G709: 13 | H709: 10 | I709: 88 | K709: 16 | L709: 13 | M709: 109 | O709: 22 | P709: 14 | Q709: 146 | S709: VENUE: FRANKSTON
A710: FRANKSTON | C710: 6 | D710: 3 | E710: 39 | G710: 7 | H710: 7 | I710: 49 | K710: 15 | L710: 11 | M710: 101 | O710: 19 | P710: 13 | Q710: 127 | S710: OAKLEY :QUINN
A711: BEST PLAYERS
A712: WILLIAMSTOWN | C712: POWLEY | F712: OBORNE | I712: MATTHEWS | L712: BEBEND | O712: KELLY | Q712: TAYLOR
A713: FRANKSTON | C713: LOCKWOOD | F713: JOHNSON | I713: BRUIN | L713: HUNTER | O713: SALA | Q713: LYNN
A714: GOALKICKERS
A715: WILLIAMSTOWN | C715: OBORNE 6 | E715: FOTHERINGHAM 4 | I715: KELLY 3 | K715: TWEEDLY 2 | M715: BEBEND 2 | O715: POWLEY 2 | Q715: FAIRLEY | S715: McTAGGART | W715: EDWARDS
A716: FRANKSTON | C716: HORTON 4 | F716: SALA 4 | H716: LOCKWOOD 3 | K716: HUNTER 3 | M716: HAMILL 3 | O716: JOHNSON | Q716: GAMBLE
A718: COBURG | C718: 5 | D718: 7 | E718: 37 | G718: 9 | H718: 9 | I718: 63 | K718: 20 | L718: 17 | M718: 137 | O718: 22 | P718: 18 | Q718: 150 | S718: VENUE: COBURG
A719: DANDENONG | C719: 0 | D719: 0 | E719: 0 | G719: 2 | H719: 2 | I719: 14 | K719: 9 | L719: 3 | M719: 57 | O719: 14 | P719: 10 | Q719: 94 | S719: CROXFORD :STABB
A720: BEST PLAYERS
A721: COBURG | C721: SHELDON | F721: PENNINGTON | I721: MILROY | L721: BURT | N721: HALBERT | Q721: HALSALL
A722: DANDENONG | C722: MADDEN | F722: ORTON | I722: MILLANE | L722: WENN | N722: KNIGHT | Q722: LACEY
A723: GOALKICKERS
A724: COBURG | C724: SERAFINI 8 | E724: HALSALL 5 | H724: HERBERT 3 | J724: HALBERT 2 | M724: FITZGERALD 2 | P724: MILROY | R724: HARBINSON
A725: DANDENONG | C725: MADDEN 4 | F725: TOWNSEND 3 | I725: COVENTRY 2 | L725: WRIGHT 2 | N725: CROWLEY | Q725: MILLANE | S725: FINN
A727: PORT MELBOURNE | C727: 3 | D727: 5 | E727: 23 | G727: 7 | H727: 12 | I727: 54 | K727: 19 | L727: 16 | M727: 130 | O727: 22 | P727: 18 | Q727: 150 | S727: VENUE: PORT MELBOURNE
A728: WAVERLEY | C728: 2 | D728: 1 | E728: 13 | G728: 6 | H728: 4 | I728: 40 | K728: 10 | L728: 6 | M728: 66 | O728: 16 | P728: 8 | Q728: 104 | S728: VERGONA :RYAN
A729: BEST PLAYERS
A730: PORT MELBOURNE | C730: BRADBURY | F730: EVANS | I730: DAVIES | L730: BRICE
A731: WAVERLEY | C731: McEWAN | F731: ALEXANDER | I731: JONES | L731: WENBORN | O731: FISHER | R731: HOWELL
A732: GOALKICKERS
A733: PORT MELBOURNE | C733: COOK 8 | E733: EVANS 3 | G733: BRICE 3 | I733: ANDERSON 2 | L733: WILKINSON 2 | O733: S DOYLE 2 | Q733: KAVANAGH | T733: C DOYLE
A734: WAVERLEY | C734: JONES 7 | E734: HOWELL 2 | G734: DICKSON 2 | I734: SEEHUISON 2 | L734: HAMILTON 2 | O734: LUKEY
A736: ROUND 14 | D736: 25TH JULY | I736: WEATHER | S736: VENUE: TOORAK PARK
D737: 1ST QTR | H737: 2ND QTR | L737: 3RD QTR | P737: FINAL | S737: UMPIRES
A738: COBURG | C738: 4 | D738: 4 | E738: 28 | G738: 8 | H738: 11 | I738: 59 | K738: 11 | L738: 9 | M738: 75 | O738: 18 | P738: 12 | Q738: 120 | S738: VERGONA | X738: LADDER | AB738: ROUND | AD738: 14
A739: PRAHRAN | C739: 0 | D739: 3 | E739: 3 | G739: 1 | H739: 7 | I739: 13 | K739: 4 | L739: 9 | M739: 33 | O739: 8 | P739: 14 | Q739: 62 | S739: QUINN
A740: BEST PLAYERS | W740: TEAM | X740: W | Y740: L | Z740: D | AA740: FOR | AB740: AGST | AC740: % | AD740: PTS
A741: COBURG | C741: HALBERT | F741: CLEARY | I741: EADE | L741: MILROY | O741: ADAMS | Q741: FITZGERALD
A742: PRAHRAN | C742: FOLEY | F742: DICKSON | I742: COBURN | L742: GRAMBEAU | O742: WRIGHT | Q742: STONE | W742: PRESTON | X742: 12 | Y742: 2 | Z742: 0 | AA742: 2016 | AB742: 1245 | AC742: =(AA742/AB742)*100 -> 161.92771084337349 | AD742: =(X742*4)+(Z742*2) -> 48
A743: GOALKICKERS | W743: COBURG | X743: 12 | Y743: 2 | Z743: 0 | AA743: 1865 | AB743: 1369 | AC743: =(AA743/AB743)*100 -> 136.23082542001461 | AD743: =(X743*4)+(Z743*2) -> 48
A744: COBURG | C744: SERAFINI 4 | E744: HALBERT 4 | H744: FITZGERALD 2 | K744: HALSALL 2 | M744: CLEARY 2 | O744: MILROY 2 | Q744: BURT | R744: DWYER | W744: PORT MELBOURNE | X744: 11 | Y744: 3 | Z744: 0 | AA744: 2233 | AB744: 1669 | AC744: =(AA744/AB744)*100 -> 133.79269023367286 | AD744: =(X744*4)+(Z744*2) -> 44
A745: PRAHRAN | C745: SMITH 3 | E745: McCORMACK 2 | H745: DICKSON | J745: REED | L745: WRIGHT | W745: GEELONG WEST | X745: 9 | Y745: 5 | Z745: 0 | AA745: 1749 | AB745: 1753 | AC745: =(AA745/AB745)*100 -> 99.771819737592693 | AD745: =(X745*4)+(Z745*2) -> 36
S746: VENUE: PORT MELBOURNE
A747: PORT MELBOURNE | C747: 11 | D747: 3 | E747: 69 | G747: 17 | H747: 5 | I747: 107 | K747: 28 | L747: 8 | M747: 176 | O747: 35 | P747: 12 | Q747: 222 | S747: GALLOP | W747: WERRIBEE | X747: 8 | Y747: 6 | Z747: 0 | AA747: 1977 | AB747: 1891 | AC747: =(AA747/AB747)*100 -> 104.54785827604442 | AD747: =(X747*4)+(Z747*2) -> 32
A748: CAMBERWELL | C748: 6 | D748: 6 | E748: 42 | G748: 11 | H748: 9 | I748: 75 | K748: 13 | L748: 12 | M748: 90 | O748: 18 | P748: 18 | Q748: 126 | S748: GRIFFITH | W748: PRAHRAN | X748: 7 | Y748: 7 | Z748: 0 | AA748: 1684 | AB748: 1734 | AC748: =(AA748/AB748)*100 -> 97.116493656286039 | AD748: =(X748*4)+(Z748*2) -> 28
A749: BEST PLAYERS | W749: SANDRINGHAM | X749: 6 | Y749: 8 | Z749: 0 | AA749: 1718 | AB749: 1836 | AC749: =(AA749/AB749)*100 -> 93.57298474945533 | AD749: =(X749*4)+(Z749*2) -> 24
A750: PORT MELBOURNE | C750: ANDERSON | F750: S DOYLE | I750: CHADBAND | L750: COOK | O750: ROBERTSON | R750: TANTSIS | W750: CAMBERWELL | X750: 5 | Y750: 9 | Z750: 0 | AA750: 1690 | AB750: 1900 | AC750: =(AA750/AB750)*100 -> 88.94736842105263 | AD750: =(X750*4)+(Z750*2) -> 20
A751: CAMBERWELL | C751: EVANS | F751: NEILSON | I751: ROURKE | L751: STEVENSON | O751: BROWN | R751: HAMMOND | W751: DANDENONG | X751: 4 | Y751: 10 | Z751: 0 | AA751: 1544 | AB751: 1783 | AC751: =(AA751/AB751)*100 -> 86.595625350532814 | AD751: =(X751*4)+(Z751*2) -> 16
A752: GOALKICKERS | P752: BRICE | R752: C DOYLE | W752: WILLIAMSTOWN | X752: 4 | Y752: 10 | Z752: 0 | AA752: 1687 | AB752: 1966 | AC752: =(AA752/AB752)*100 -> 85.808748728382497 | AD752: =(X752*4)+(Z752*2) -> 16
A753: PORT MELBOURNE | C753: COOK 10 | E753: ANDERSON 9 | H753: EVANS 6 | J753: S DOYLE 4 | M753: KAVANAGH 2 | P753: RODDA | R753: WILKINSON | W753: FRANKSTON | X753: 3 | Y753: 11 | Z753: 0 | AA753: 1620 | AB753: 1934 | AC753: =(AA753/AB753)*100 -> 83.764219234746633 | AD753: =(X753*4)+(Z753*2) -> 12
A754: CAMBERWELL | C754: ROURKE 7 | F754: STEVENSON 6 | I754: HAMMOND | L754: WILKINSON | O754: NEILSON | Q754: DAVIDSON | T754: HIRST | W754: WAVERLEY | X754: 3 | Y754: 11 | Z754: 0 | AA754: 1289 | AB754: 1938 | AC754: =(AA754/AB754)*100 -> 66.511867905056761 | AD754: =(X754*4)+(Z754*2) -> 12
A756: SANDRINGHAM | C756: 6 | D756: 3 | E756: 39 | G756: 11 | H756: 9 | I756: 75 | K756: 19 | L756: 12 | M756: 126 | O756: 23 | P756: 18 | Q756: 156 | S756: VENUE: BEACH ROAD
A757: GEELONG WEST | C757: 6 | D757: 4 | E757: 40 | G757: 8 | H757: 8 | I757: 56 | K757: 10 | L757: 9 | M757: 69 | O757: 16 | P757: 14 | Q757: 110 | S757: OAKLEY :RYAN
A758: BEST PLAYERS
A759: SANDRINGHAM | C759: RICHARDS | F759: NANKERVIS | I759: MAILING | L759: GALLAGHER | O759: ADAMS | Q759: SIMS
A760: GEELONG WEST | C760: KRANJC | F760: TORNEY | I760: WILSON | L760: GIBSON | O760: ZELESCO
A761: GOALKICKERS
A762: SANDRINGHAM | C762: NANKERVIS 7 | F762: MAILING 7 | I762: GALLAGHER 2 | L762: WORKMAN 2 | O762: CARROLL 2 | Q762: WILKINS | S762: FITZPATRICK | W762: GILMORE
A763: GEELONG WEST | C763: TAYLOR 4 | F763: ZELESCO 3 | I763: BROWNE 2 | K763: RADOJEVIC 2 | N763: CRICHTON | Q763: GIBSON | S763: McCANCE | V763: TORNEY | X763: WILSON
A765: WERRIBEE | C765: 3 | D765: 6 | E765: 24 | G765: 10 | H765: 9 | I765: 69 | K765: 17 | L765: 9 | M765: 111 | O765: 25 | P765: 18 | Q765: 168 | S765: VENUE: WILLIAMSTOWN
A766: WILLIAMSTOWN | C766: 5 | D766: 5 | E766: 35 | G766: 9 | H766: 13 | I766: 67 | K766: 17 | L766: 16 | M766: 118 | O766: 22 | P766: 16 | Q766: 148 | S766: BUDGE :OGSTON
A767: BEST PLAYERS
A768: WERRIBEE | C768: JACK | F768: FREEMAN | I768: KING | K768: HUGHES | N768: REDENBACH | Q768: ALLAN
A769: WILLIAMSTOWN | C769: FAIRLEY | F769: MATTHEWS | I769: SAIT | K769: FOTHERINHAM | N769: SWAN | Q769: POWLEY
A770: GOALKICKERS
A771: WERRIBEE | C771: SIMMONS 5 | F771: REDENBACH 4 | I771: PARKES 4 | K771: HUGHES 3 | M771: RICHARDSON 3 | P771: ALLAN 2 | R771: DEMPSTER | U771: KING | W771: MORRIS | X771: REED
A772: WILLIAMSTOWN | C772: FOTHERINGHAM 7 | F772: SAIT 4 | H772: OBORNE 2 | J772: POWLEY 2 | M772: EDWARDS 2 | P772: FOSTER | R772: FAIRLEY | U772: McTAGGART | X772: SLEVISON | AA772: KELLY
A774: DANDENONG | C774: 2 | D774: 5 | E774: 17 | G774: 4 | H774: 8 | I774: 32 | K774: 9 | L774: 15 | M774: 69 | O774: 13 | P774: 19 | Q774: 97 | S774: VENUE: WAVERLEY
A775: WAVERLEY | C775: 1 | D775: 3 | E775: 9 | G775: 6 | H775: 5 | I775: 41 | K775: 7 | L775: 9 | M775: 51 | O775: 8 | P775: 17 | Q775: 65 | S775: FITZPATRICK :ALLSOPP
A776: BEST PLAYERS
A777: DANDENONG | C777: TAYLOR | F777: ORTON | I777: P KNIGHT | L777: HORAZCKO | O777: LACEY | Q777: J MILLANE
A778: WAVERLEY | C778: GREENE | F778: ALEXANDER | I778: GOODMAN
A779: GOALKICKERS
A780: DANDENONG | C780: WENN 3 | E780: LACEY 2 | G780: WRIGHT 2 | I780: POLLARD 2 | L780: FINN | M780: ORTON | O780: COVENTRY | Q780: ORSBORNE
A781: WAVERLEY | C781: GREENE 3 | F781: JONES 2 | H781: DICKSON | J781: DAVIES | L781: SEEHUSAN
A783: PRESTON | C783: 4 | D783: 4 | E783: 28 | G783: 9 | H783: 9 | I783: 63 | K783: 16 | L783: 17 | M783: 113 | O783: 25 | P783: 21 | Q783: 171 | S783: VENUE: PRESTON
A784: FRANKSTON | C784: 3 | D784: 7 | E784: 25 | G784: 5 | H784: 10 | I784: 40 | K784: 9 | L784: 13 | M784: 67 | O784: 13 | P784: 15 | Q784: 93 | S784: GROOM :CROXFORD
A785: BEST PLAYERS
A786: PRESTON | C786: BODEN | F786: DINTINOSANTE | I786: WARREN | L786: McCANN | O786: AUSTEN | Q786: BARTLETT
A787: FRANKSTON | C787: JOHNSON | F787: COLE | I787: BRUIN | L787: GEDDES | O787: LYNN | Q787: KENTER
A788: GOALKICKERS
A789: PRESTON | C789: BODEN 7 | E789: OHLSEN 3 | G789: McKEON 3 | I789: BARTLETT 3 | L789: KELLY 2 | N789: DINTINOSANTE 2 | R789: HALAS 2 | T789: VANN | V789: SHAW | X789: BEER
A790: FRANKSTON | C790: HORTON 3 | F790: HUNTER 3 | I790: ROGERSON 2 | L790: GEDDES 2 | N790: BELL 2 | P790: HALE
A792: ROUND 15 | D792: 1ST AUGUST | I792: WEATHER | S792: VENUE: WERRIBEE
D793: 1ST QTR | H793: 2ND QTR | L793: 3RD QTR | P793: FINAL | S793: UMPIRES
A794: PRESTON | C794: 4 | D794: 7 | E794: 31 | G794: 11 | H794: 12 | I794: 78 | K794: 19 | L794: 16 | M794: 130 | O794: 24 | P794: 21 | Q794: 165 | S794: VERGONA | X794: LADDER | AB794: ROUND | AD794: 15
A795: WERRIBEE | C795: 2 | D795: 6 | E795: 18 | G795: 4 | H795: 9 | I795: 33 | K795: 10 | L795: 13 | M795: 73 | O795: 18 | P795: 18 | Q795: 126 | S795: QUINN
A796: BEST PLAYERS | W796: TEAM | X796: W | Y796: L | Z796: D | AA796: FOR | AB796: AGST | AC796: % | AD796: PTS
A797: PRESTON | C797: KELLY | F797: McCANN | I797: BODEN | L797: WARREN | O797: BRINE | Q797: SHAW
A798: WERRIBEE | C798: JACK | F798: FREEMAN | I798: MORRIS | L798: KING | O798: REED | W798: PRESTON | X798: 13 | Y798: 2 | Z798: 0 | AA798: 2181 | AB798: 1371 | AC798: =(AA798/AB798)*100 -> 159.08096280087528 | AD798: =(X798*4)+(Z798*2) -> 52
A799: GOALKICKERS | Q799: SHAW | S799: BEER | W799: COBURG | X799: 13 | Y799: 2 | Z799: 0 | AA799: 2007 | AB799: 1459 | AC799: =(AA799/AB799)*100 -> 137.55997258396161 | AD799: =(X799*4)+(Z799*2) -> 52
A800: PRESTON | C800: McCANN 6 | E800: BODEN 5 | G800: HALAS 3 | I800: KELLY 2 | K800: DINTINOSANTE 2 | N800: OHLSEN | P800: BERRY | R800: VANN | T800: TOWAN | W800: PORT MELBOURNE | X800: 12 | Y800: 3 | Z800: 0 | AA800: 2399 | AB800: 1779 | AC800: =(AA800/AB800)*100 -> 134.85103991006184 | AD800: =(X800*4)+(Z800*2) -> 48
A801: WERRIBEE | C801: KING 4 | E801: RICHARDSON 3 | H801: CONN 2 | J801: HUGHES 2 | L801: MORRIS 2 | N801: FREEMAN 2 | Q801: ALLAN | S801: REED | W801: GEELONG WEST | X801: 10 | Y801: 5 | Z801: 0 | AA801: 1762 | AB801: 1886 | AC801: =(AA801/AB801)*100 -> 93.425238600212097 | AD801: =(X801*4)+(Z801*2) -> 40
P802: SIMMONS | S802: VENUE: COBURG
A803: COBURG | C803: 8 | D803: 1 | E803: 49 | G803: 10 | H803: 7 | I803: 67 | K803: 16 | L803: 13 | M803: 109 | O803: 21 | P803: 16 | Q803: 142 | S803: FITZPATRICK | W803: WERRIBEE | X803: 8 | Y803: 7 | Z803: 0 | AA803: 2103 | AB803: 2056 | AC803: =(AA803/AB803)*100 -> 102.28599221789882 | AD803: =(X803*4)+(Z803*2) -> 32
A804: SANDRINGHAM | C804: 2 | D804: 4 | E804: 16 | G804: 6 | H804: 4 | I804: 40 | K804: 12 | L804: 5 | M804: 77 | O804: 14 | P804: 6 | Q804: 90 | S804: GRIFFITH | W804: PRAHRAN | X804: 7 | Y804: 8 | Z804: 0 | AA804: 1765 | AB804: 1895 | AC804: =(AA804/AB804)*100 -> 93.139841688654357 | AD804: =(X804*4)+(Z804*2) -> 28
A805: BEST PLAYERS | W805: CAMBERWELL | X805: 6 | Y805: 9 | Z805: 0 | AA805: 1872 | AB805: 2001 | AC805: =(AA805/AB805)*100 -> 93.553223388305852 | AD805: =(X805*4)+(Z805*2) -> 24
A806: COBURG | C806: FITZGERALD | F806: MILROY | I806: EADE | L806: HARBINSON | O806: CLEARY | R806: SHELDON | W806: SANDRINGHAM | X806: 6 | Y806: 9 | Z806: 0 | AA806: 1808 | AB806: 1978 | AC806: =(AA806/AB806)*100 -> 91.405460060667338 | AD806: =(X806*4)+(Z806*2) -> 24
A807: SANDRINGHAM | C807: GALLAGHER | F807: WORKMAN | I807: RICHARDS | L807: NANKERVIS | O807: MANNIX | W807: DANDENONG | X807: 5 | Y807: 10 | Z807: 0 | AA807: 1705 | AB807: 1864 | AC807: =(AA807/AB807)*100 -> 91.469957081545061 | AD807: =(X807*4)+(Z807*2) -> 20
A808: GOALKICKERS | W808: WILLIAMSTOWN | X808: 4 | Y808: 11 | Z808: 0 | AA808: 1820 | AB808: 2105 | AC808: =(AA808/AB808)*100 -> 86.460807600950119 | AD808: =(X808*4)+(Z808*2) -> 16
A809: COBURG | C809: HERBERT 4 | E809: HALBERT 3 | H809: HALSALL 3 | J809: CLEARY 3 | L809: SERAFINI 2 | N809: FITZGERALD 2 | Q809: COLLINS 2 | S809: DWYER 2 | W809: FRANKSTON | X809: 3 | Y809: 12 | Z809: 0 | AA809: 1730 | AB809: 2100 | AC809: =(AA809/AB809)*100 -> 82.38095238095238 | AD809: =(X809*4)+(Z809*2) -> 12
A810: SANDRINGHAM | C810: NANKERVIS 5 | F810: GALLAGHER 2 | I810: WORKMAN 2 | L810: GILMORE 2 | N810: WILKINS | P810: MANNIX | R810: HALL | W810: WAVERLEY | X810: 3 | Y810: 12 | Z810: 0 | AA810: 1390 | AB810: 2120 | AC810: =(AA810/AB810)*100 -> 65.566037735849065 | AD810: =(X810*4)+(Z810*2) -> 12
A812: DANDENONG | C812: 4 | D812: 7 | E812: 31 | G812: 13 | H812: 11 | I812: 89 | K812: 19 | L812: 14 | M812: 128 | O812: 24 | P812: 17 | Q812: 161 | S812: VENUE: DANDENONG
A813: PRAHRAN | C813: 1 | D813: 4 | E813: 10 | G813: 4 | H813: 7 | I813: 31 | K813: 8 | L813: 9 | M813: 57 | O813: 11 | P813: 15 | Q813: 81 | S813: GROOM :RYAN
A814: BEST PLAYERS
A815: DANDENONG | C815: ORTON | F815: MADDEN | I815: COVENTRY | L815: P KNIGHT | O815: WENN | R815: HORAZCKO
A816: PRAHRAN | C816: FOLEY | F816: ELLETT | I816: DICKSON | L816: STONE | O816: WRIGHT
A817: GOALKICKERS
A818: DANDENONG | C818: COVENTRY 7 | F818: MADDEN 5 | I818: FLAHERTY 3 | L818: TOWNSEND 3 | O818: LACEY 2 | Q818: COUSINS 2 | S818: ORTON | U818: WRIGHT
A819: PRAHRAN | C819: WRIGHT 3 | F819: DICKSON 2 | I819: YOUNG 2 | K819: TWOMEY | M819: SMITH | O819: STONE | Q819: MOIR
A821: CAMBERWELL | C821: 5 | D821: 2 | E821: 32 | G821: 10 | H821: 4 | I821: 64 | K821: 20 | L821: 7 | M821: 127 | O821: 28 | P821: 14 | Q821: 182 | S821: VENUE: CAMBERWELL
A822: WAVERLEY | C822: 3 | D822: 1 | E822: 19 | G822: 6 | H822: 6 | I822: 42 | K822: 9 | L822: 7 | M822: 61 | O822: 15 | P822: 11 | Q822: 101 | S822: OAKLEY :OGSTON
A823: BEST PLAYERS
A824: CAMBERWELL | C824: WILKINSON | F824: DANS | I824: BROWN | L824: HAMMOND | O824: McFEE | Q824: DAVIDSON
A825: WAVERLEY | C825: SEEHUSON | F825: KINNIBURGH | I825: DICKSON | L825: CLARKE | O825: JONES | Q825: McEWAN
A826: GOALKICKERS
A827: CAMBERWELL | C827: HAMMOND 8 | F827: STEVENSON 4 | I827: S ROURKE 3 | L827: COWLEY 2 | N827: BROMBERG 2 | Q827: DODIG 2 | S827: C ROURKE 2 | W827: NEILSON 2 | X827: BROSCHE | AA827: DAVIDSON | AC827: BROWN
A828: WAVERLEY | C828: JONES 7 | F828: P KING | H828: GOODMAN | J828: FOWLER | L828: STYLES | N828: WENBORNE | Q828: HOWELL | S828: WARBURTON | W828: VENVILLE
A830: GEELONG WEST | C830: 9 | D830: 1 | E830: 55 | G830: 15 | H830: 6 | I830: 96 | K830: 19 | L830: 11 | M830: 125 | O830: 21 | P830: 13 | Q830: 139 | S830: VENUE: GEELONG WEST
A831: WILLIAMSTOWN | C831: 4 | D831: 1 | E831: 25 | G831: 9 | H831: 7 | I831: 61 | K831: 12 | L831: 10 | M831: 82 | O831: 20 | P831: 13 | Q831: 133 | S831: CROXFORD :GALLOP
A832: BEST PLAYERS
A833: GEELONG WEST | C833: WOODARD | F833: KOL | J833: KRANJC | L833: CURRAN | O833: TAYLOR | R833: BROWNE
A834: WILLIAMSTOWN | C834: EUDEY | F834: FOTHERINGHAM | J834: SWAN | L834: FAIRLEY | O834: MAHER | R834: DRYSDALE
A835: GOALKICKERS
A836: GEELONG WEST | C836: RADOJEVIC 6 | F836: TAYLOR 5 | I836: WILSON 4 | L836: BROWNE 2 | O836: CRICHTON 2 | R836: FOOTT
A837: WILLIAMSTOWN | C837: FOTHERINGHAM 8 | F837: OBORNE 2 | I837: FAIRLEY 2 | K837: EDWARDS 2 | N837: KELLY 2 | P837: McTAGGART | S837: SLEVISON | V837: POWLEY | X837: MAHER
A839: PORT MELBOURNE | C839: 6 | D839: 5 | E839: 41 | G839: 12 | H839: 8 | I839: 80 | K839: 19 | L839: 12 | M839: 126 | O839: 25 | P839: 16 | Q839: 166 | S839: VENUE: FRANKSTON
A840: FRANKSTON | C840: 5 | D840: 4 | E840: 34 | G840: 9 | H840: 12 | I840: 66 | K840: 13 | L840: 14 | M840: 92 | O840: 15 | P840: 20 | Q840: 110 | S840: ALLSOPP :PHILLIPS
A841: BEST PLAYERS
A842: PORT MELBOURNE | C842: BRADBURY | F842: ANDERSON | I842: RODDA | L842: KAVANAGH | O842: TANTSIS | R842: SWAN
A843: FRANKSTON | C843: GEDDES | F843: HORLER | I843: ROGERSON | L843: SALA | O843: BELL | R843: HUNTER
A844: GOALKICKERS
A845: PORT MELBOURNE | C845: COOK 8 | F845: KAVANAGH 5 | I845: ANDERSON 4 | L845: WILKINSON 4 | O845: EVANS 2 | Q845: BRICE 2 | S845: DOYLE
A846: FRANKSTON | C846: HUNTER 6 | F846: COLE 2 | H846: ROGERSON 2 | K846: BELL | L846: BRADY | N846: GEDDES | P846: KENNEDY | R846: LOCKWOOD
A848: ROUND 16 | D848: 8TH AUGUST | I848: WEATHER | S848: VENUE: PRESTON
D849: 1ST QTR | H849: 2ND QTR | L849: 3RD QTR | P849: FINAL | S849: UMPIRES
A850: PRESTON | C850: 2 | D850: 3 | E850: 15 | G850: 2 | H850: 11 | I850: 23 | K850: 8 | L850: 19 | M850: 67 | O850: 18 | P850: 25 | Q850: 133 | S850: ALLSOPP | X850: LADDER | AB850: ROUND | AD850: 16
A851: GEELONG WEST | C851: 2 | D851: 4 | E851: 16 | G851: 3 | H851: 5 | I851: 23 | K851: 4 | L851: 8 | M851: 32 | O851: 7 | P851: 8 | Q851: 50 | S851: OGSTON
A852: BEST PLAYERS | W852: TEAM | X852: W | Y852: L | Z852: D | AA852: FOR | AB852: AGST | AC852: % | AD852: PTS
A853: PRESTON | C853: BRINE | F853: WARREN | I853: SHAW | L853: TOWAN | N853: PLOWMAN | Q853: AUSTEN
A854: GEELONG WEST | C854: TORNEY | F854: KRANJC | I854: CURRAN | L854: KOL | N854: FOOTT | Q854: WOODARD | W854: PRESTON | X854: 14 | Y854: 2 | Z854: 0 | AA854: 2314 | AB854: 1421 | AC854: =(AA854/AB854)*100 -> 162.84306826178747 | AD854: =(X854*4)+(Z854*2) -> 56
A855: GOALKICKERS | O855: HALAS | Q855: McCANN | W855: COBURG | X855: 14 | Y855: 2 | Z855: 0 | AA855: 2144 | AB855: 1572 | AC855: =(AA855/AB855)*100 -> 136.38676844783714 | AD855: =(X855*4)+(Z855*2) -> 56
A856: PRESTON | C856: BEER 4 | E856: AUSTEN 2 | G856: McGAW 2 | I856: McKEON 2 | K856: DINTINOSANTE 2 | N856: KELLY | P856: BERRY | R856: WIGHT | T856: MOORE | W856: PORT MELBOURNE | X856: 13 | Y856: 3 | Z856: 0 | AA856: 2616 | AB856: 1857 | AC856: =(AA856/AB856)*100 -> 140.87237479806137 | AD856: =(X856*4)+(Z856*2) -> 52
A857: GEELONG WEST | C857: BROWNE 3 | F857: TOULMIN 2 | I857: BURNETT | K857: EDDY | W857: GEELONG WEST | X857: 10 | Y857: 6 | Z857: 0 | AA857: 1812 | AB857: 2019 | AC857: =(AA857/AB857)*100 -> 89.747399702823188 | AD857: =(X857*4)+(Z857*2) -> 40
S858: VENUE: PORT MELBOURNE
A859: PORT MELBOURNE | C859: 9 | D859: 10 | E859: 64 | G859: 14 | H859: 14 | I859: 98 | K859: 23 | L859: 22 | M859: 160 | O859: 32 | P859: 25 | Q859: 217 | S859: CASEY | W859: WERRIBEE | X859: 8 | Y859: 8 | Z859: 0 | AA859: 2181 | AB859: 2273 | AC859: =(AA859/AB859)*100 -> 95.952485701715801 | AD859: =(X859*4)+(Z859*2) -> 32
A860: WERRIBEE | C860: 2 | D860: 3 | E860: 15 | G860: 4 | H860: 5 | I860: 29 | K860: 6 | L860: 10 | M860: 46 | O860: 11 | P860: 12 | Q860: 78 | S860: FITZPATRICK | W860: PRAHRAN | X860: 8 | Y860: 8 | Z860: 0 | AA860: 1900 | AB860: 2026 | AC860: =(AA860/AB860)*100 -> 93.780848963474824 | AD860: =(X860*4)+(Z860*2) -> 32
A861: BEST PLAYERS | W861: CAMBERWELL | X861: 7 | Y861: 9 | Z861: 0 | AA861: 2017 | AB861: 2114 | AC861: =(AA861/AB861)*100 -> 95.411542100283825 | AD861: =(X861*4)+(Z861*2) -> 28
A862: PORT MELBOURNE | C862: SWAN | F862: WILKINSON | I862: DERMOTT | L862: HALL | N862: BRADBURY | Q862: DAVIES | W862: SANDRINGHAM | X862: 7 | Y862: 9 | Z862: 0 | AA862: 1892 | AB862: 2043 | AC862: =(AA862/AB862)*100 -> 92.608908467939315 | AD862: =(X862*4)+(Z862*2) -> 28
A863: WERRIBEE | C863: FREEMAN | F863: MORRIS | I863: BOURKE | L863: JACK | N863: GITTOS | W863: DANDENONG | X863: 5 | Y863: 11 | Z863: 0 | AA863: 1770 | AB863: 1948 | AC863: =(AA863/AB863)*100 -> 90.862422997946609 | AD863: =(X863*4)+(Z863*2) -> 20
A864: GOALKICKERS | N864: TANTSIS | P864: BONNETT | W864: WILLIAMSTOWN | X864: 4 | Y864: 12 | Z864: 0 | AA864: 1933 | AB864: 2242 | AC864: =(AA864/AB864)*100 -> 86.217662801070475 | AD864: =(X864*4)+(Z864*2) -> 16
A865: PORT MELBOURNE | C865: COOK 10 | E865: RODDA 5 | G865: BRADBURY 4 | J865: BRICE 3 | L865: WILKINSON 3 | O865: S DOYLE 3 | Q865: SWAN | S865: C DOYLE | W865: FRANKSTON | X865: 3 | Y865: 13 | Z865: 0 | AA865: 1843 | AB865: 2245 | AC865: =(AA865/AB865)*100 -> 82.093541202672611 | AD865: =(X865*4)+(Z865*2) -> 12
A866: WERRIBEE | C866: ALLAN 2 | E866: VAN DER WARDEN 2 | I866: CONN | J866: DEMPSTER | M866: MORRIS | O866: RICHARDSON | R866: D SMITH | W866: WAVERLEY | X866: 3 | Y866: 13 | Z866: 0 | AA866: 1521 | AB866: 2255 | AC866: =(AA866/AB866)*100 -> 67.450110864745014 | AD866: =(X866*4)+(Z866*2) -> 12
N867: SIMMONS | Q867: FREEMAN
A868: SANDRINGHAM | C868: 3 | D868: 4 | E868: 22 | G868: 8 | H868: 7 | I868: 55 | K868: 9 | L868: 10 | M868: 64 | O868: 12 | P868: 12 | Q868: 84 | S868: VENUE: BEACH ROAD
A869: DANDENONG | C869: 1 | D869: 9 | E869: 15 | G869: 1 | H869: 13 | I869: 19 | K869: 6 | L869: 22 | M869: 58 | O869: 7 | P869: 23 | Q869: 65 | S869: GOLLOP :QUINN
A870: BEST PLAYERS
A871: SANDRINGHAM | C871: M LYONS | F871: RICHARDS | I871: MERCER | L871: GALLAGHER | O871: ADAMS | R871: VAN DER HAYDEN
A872: DANDENONG | C872: WENN | F872: P KNIGHT | I872: LACEY | L872: McCONNELL | O872: COVENTRY | R872: HORAZCKO
A873: GOALKICKERS
A874: SANDRINGHAM | C874: MERCER 2 | F874: NANKERVIS 2 | I874: CARROLL 2 | L874: LYONS 2 | N874: GALLAGHER 2 | Q874: FITZPATRICK | T874: WORKMAN
A875: DANDENONG | C875: WENN 2 | F875: LACEY | H875: TOWNSEND | K875: MILLANE | M875: WRIGHT | O875: MADDEN
A877: CAMBERWELL | C877: 5 | D877: 7 | E877: 37 | G877: 8 | H877: 10 | I877: 58 | K877: 16 | L877: 16 | M877: 112 | O877: 21 | P877: 19 | Q877: 145 | S877: VENUE: CAMBERWELL
A878: FRANKSTON | C878: 2 | D878: 2 | E878: 14 | G878: 7 | H878: 10 | I878: 52 | K878: 11 | L878: 15 | M878: 81 | O878: 16 | P878: 17 | Q878: 113 | S878: VERGONA :RYAN
A879: BEST PLAYERS
A880: CAMBERWELL | C880: BROWN | F880: CAHILL | I880: WILKINSON | L880: BROMBERG | O880: McFEE | Q880: JUDD
A881: FRANKSTON | C881: JOHNSON | F881: HUNTER | I881: SALA | L881: HORLER | O881: LYNN | Q881: HAMILL
A882: GOALKICKERS
A883: CAMBERWELL | C883: HAMMOND 3 | F883: BROMBERG 3 | I883: NEILSON 3 | K883: HIRST 2 | M883: S ROURKE 2 | P883: DODIG 2 | R883: C ROURKE 2 | V883: GASTON | X883: DEVITT | Z883: McFEE | AB883: WILKINSON
A884: FRANKSTON | C884: HUNTER 6 | F884: RASMUSSEN 2 | I884: HAMILL 2 | K884: LOCKWOOD | N884: JOHNSON | P884: HORLER | R884: GEDDES | U884: LYNN | W884: BERRY
A886: PRAHRAN | C886: 7 | D886: 3 | E886: 45 | G886: 12 | H886: 5 | I886: 77 | K886: 18 | L886: 12 | M886: 120 | O886: 20 | P886: 15 | Q886: 135 | S886: VENUE: WAVERLEY
A887: WAVERLEY | C887: 1 | D887: 5 | E887: 11 | G887: 5 | H887: 6 | I887: 36 | K887: 11 | L887: 9 | M887: 75 | O887: 20 | P887: 11 | Q887: 131 | S887: STABB ;PHILLIPS
A888: BEST PLAYERS
A889: PRAHRAN | C889: DICKSON | F889: ELLETT | I889: YOUNG | L889: TWOMEY | O889: McKISSOCK | R889: WALLACE
A890: WAVERLEY | C890: FISHER | F890: JONES | I890: FOWLER | L890: CLARKE | O890: DICKSON | R890: HAMILTON
A891: GOALKICKERS
A892: PRAHRAN | C892: DICKSON 4 | E892: STONE 4 | G892: YEATS 3 | I892: YOUNG 2 | K892: WARBURTON 2 | N892: SMITH 2 | P892: GRAMBEAU | R892: TWOMEY | U892: McCORMACK
A893: WAVERLEY | C893: JONES 8 | F893: COSGROVE 4 | I893: VENVILLE 2 | L893: ALEXANDER 2 | O893: KINNIBURGH | R893: FOWLER | U893: GOODMAN | X893: KING
A895: COBURG | C895: 6 | D895: 7 | E895: 43 | G895: 8 | H895: 12 | I895: 60 | K895: 15 | L895: 21 | M895: 111 | O895: 19 | P895: 23 | Q895: 137 | S895: VENUE: WILLIAMSTOWN
A896: WILLIAMSTOWN | C896: 4 | D896: 1 | E896: 25 | G896: 7 | H896: 4 | I896: 46 | K896: 12 | L896: 6 | M896: 78 | O896: 17 | P896: 11 | Q896: 113 | S896: GROOM :OAKLEY
A897: BEST PLAYERS
A898: COBURG | C898: COLLINS | G898: HARBINSON | J898: BURT | L898: PENNINGTON | O898: MILROY | R898: DWYER
A899: WILLIAMSTOWN | C899: FOTHERINGHAM | G899: SWAN | J899: SAIT | L899: McTAGGART | O899: SLEVISON
A900: GOALKICKERS
A901: COBURG | C901: SERAFINI 6 | F901: HERBERT 5 | I901: COLLINS 3 | K901: HALBERT | M901: BURT | O901: PENNINGTON | R901: ANDERSON | U901: SHELDON
A902: WILLIAMSTOWN | C902: FOTHERINGHAM 8 | G902: OBORNE 3 | J902: EDWARDS 3 | M902: FAIRLEY 2 | O902: SAIT
A904: ROUND 17 | D904: 15TH AUGUST | I904: WEATHER
D905: 1ST QTR | H905: 2ND QTR | L905: 3RD QTR | P905: FINAL | S905: VENUE: COBURG
A906: PRESTON | C906: 4 | D906: 3 | E906: 27 | G906: 10 | H906: 10 | I906: 70 | K906: 16 | L906: 12 | M906: 108 | O906: 21 | P906: 20 | Q906: 146 | S906: UMPIRES | X906: LADDER | AB906: ROUND | AD906: 17
A907: COBURG | C907: 4 | D907: 4 | E907: 28 | G907: 7 | H907: 7 | I907: 49 | K907: 14 | L907: 10 | M907: 94 | O907: 18 | P907: 14 | Q907: 122
A908: BEST PLAYERS | W908: TEAM | X908: W | Y908: L | Z908: D | AA908: FOR | AB908: AGST | AC908: % | AD908: PTS
A909: PRESTON | C909: AUSTEN | F909: McCANN | I909: DINTINOSANTE | L909: KELLY | O909: WIGHT | R909: BUX
A910: COBURG | C910: BURT | F910: HERBERT | I910: DWYER | L910: FITZGERALD | O910: MILROY | W910: PRESTON | X910: 15 | Y910: 2 | Z910: 0 | AA910: 2460 | AB910: 1543 | AC910: =(AA910/AB910)*100 -> 159.42968243681142 | AD910: =(X910*4)+(Z910*2) -> 60
A911: GOALKICKERS | N911: SHAW | P911: BODEN | W911: COBURG | X911: 14 | Y911: 3 | Z911: 0 | AA911: 2266 | AB911: 1718 | AC911: =(AA911/AB911)*100 -> 131.89755529685681 | AD911: =(X911*4)+(Z911*2) -> 56
A912: PRESTON | C912: McCANN 6 | F912: HALAS 3 | H912: TULLY 2 | J912: McGAW 2 | M912: BERRY | O912: BRINE | Q912: VANN | S912: McKEON | W912: PORT MELBOURNE | X912: 13 | Y912: 4 | Z912: 0 | AA912: 2746 | AB912: 1987 | AC912: =(AA912/AB912)*100 -> 138.1982888777051 | AD912: =(X912*4)+(Z912*2) -> 52
A913: COBURG | C913: SERAFINI 5 | F913: HERBERT 4 | I913: DWYER 4 | K913: FITZGERALD | N913: BURT | P913: COLLINS | R913: CLEARY | W913: GEELONG WEST | X913: 11 | Y913: 6 | Z913: 0 | AA913: 1944 | AB913: 2149 | AC913: =(AA913/AB913)*100 -> 90.460679385760827 | AD913: =(X913*4)+(Z913*2) -> 44
O914: MILROY | S914: VENUE: GEELONG WEST
A915: GEELONG WEST | C915: 4 | D915: 5 | E915: 29 | G915: 9 | H915: 9 | I915: 63 | K915: 13 | L915: 11 | M915: 89 | O915: 20 | P915: 12 | Q915: 132 | S915: OAKLEY | W915: PRAHRAN | X915: 9 | Y915: 8 | Z915: 0 | AA915: 2038 | AB915: 2160 | AC915: =(AA915/AB915)*100 -> 94.351851851851848 | AD915: =(X915*4)+(Z915*2) -> 36
A916: PORT MELBOURNE | C916: 7 | D916: 2 | E916: 44 | G916: 10 | H916: 4 | I916: 64 | K916: 14 | L916: 9 | M916: 93 | O916: 20 | P916: 10 | Q916: 130 | S916: GROOM | W916: CAMBERWELL | X916: 8 | Y916: 9 | Z916: 0 | AA916: 2151 | AB916: 2219 | AC916: =(AA916/AB916)*100 -> 96.935556557007658 | AD916: =(X916*4)+(Z916*2) -> 32
A917: BEST PLAYERS | W917: WERRIBEE | X917: 8 | Y917: 9 | Z917: 0 | AA917: 2286 | AB917: 2407 | AC917: =(AA917/AB917)*100 -> 94.972995429995848 | AD917: =(X917*4)+(Z917*2) -> 32
A918: GEELONG WEST | C918: BROWNE | F918: EDDY | I918: TORNEY | L918: WOODARD | O918: KRANJC | R918: DALIHAUS | W918: SANDRINGHAM | X918: 7 | Y918: 10 | Z918: 0 | AA918: 2026 | AB918: 2181 | AC918: =(AA918/AB918)*100 -> 92.893168271435115 | AD918: =(X918*4)+(Z918*2) -> 28
A919: PORT MELBOURNE | C919: DAVIES | F919: COOK | I919: BRICE | L919: HALL | O919: BRADBURY | R919: DERMOTT | W919: DANDENONG | X919: 6 | Y919: 11 | Z919: 0 | AA919: 1965 | AB919: 2066 | AC919: =(AA919/AB919)*100 -> 95.111326234269129 | AD919: =(X919*4)+(Z919*2) -> 24
A920: GOALKICKERS | W920: FRANKSTON | X920: 4 | Y920: 13 | Z920: 0 | AA920: 1969 | AB920: 2339 | AC920: =(AA920/AB920)*100 -> 84.181274048738771 | AD920: =(X920*4)+(Z920*2) -> 16
A921: GEELONG WEST | C921: RADOJEVIC 5 | F921: BROWNE 5 | I921: EDDY 3 | K921: TODD 2 | M921: KING 2 | O921: BURNETT | Q921: CANTWELL | T921: WILSON | W921: WILLIAMSTOWN | X921: 4 | Y921: 13 | Z921: 0 | AA921: 2051 | AB921: 2437 | AC921: =(AA921/AB921)*100 -> 84.160853508411975 | AD921: =(X921*4)+(Z921*2) -> 16
A922: PORT MELBOURNE | C922: COOK 9 | F922: BRICE 6 | H922: EVANS 2 | J922: KAVANAGH | M922: WIKINSON | O922: RODDA | W922: WAVERLEY | X922: 3 | Y922: 14 | Z922: 0 | AA922: 1615 | AB922: 2381 | AC922: =(AA922/AB922)*100 -> 67.828643427131453 | AD922: =(X922*4)+(Z922*2) -> 12
A924: CAMBERWELL | C924: 3 | D924: 5 | E924: 23 | G924: 10 | H924: 10 | I924: 70 | K924: 16 | L924: 15 | M924: 111 | O924: 19 | P924: 20 | Q924: 134 | S924: VENUE: WERRIBEE
A925: WERRIBEE | C925: 6 | D925: 0 | E925: 36 | G925: 10 | H925: 1 | I925: 61 | K925: 14 | L925: 2 | M925: 86 | O925: 17 | P925: 3 | Q925: 105 | S925: STEERE :PHILLIPS
A926: BEST PLAYERS
A927: CAMBERWELL | C927: EVANS | F927: DAVIDSON | I927: JUDD | L927: STEVENSON | O927: HAMMOND | R927: NEILSON
A928: WERRIBEE | C928: RICHARDSON | F928: DEMPSTER | I928: SIMMONS | L928: ALLAN | O928: SVORINICH
A929: GOALKICKERS
A930: CAMBERWELL | C930: STEVENSON 8 | F930: HAMMOND 7 | I930: S ROURKE | K930: DAVIDSON | M930: C ROURKE | O930: BROMBERG
A931: WERRIBEE | C931: SIMMONS 5 | F931: ALLAN 3 | H931: BREEN 2 | J931: DEMPSTER 2 | M931: BREEN 2 | O931: KING 2 | Q931: CONN
A933: PRAHRAN | C933: 6 | D933: 6 | E933: 42 | G933: 9 | H933: 7 | I933: 61 | K933: 17 | L933: 9 | M933: 111 | O933: 21 | P933: 12 | Q933: 138 | S933: VENUE: TOORAK PARK
A934: SANDRINGHAM | C934: 3 | D934: 1 | E934: 19 | G934: 9 | H934: 5 | I934: 59 | K934: 14 | L934: 8 | M934: 92 | O934: 20 | P934: 14 | Q934: 134 | S934: STONE :CASEY
A935: BEST PLAYERS
A936: PRAHRAN | C936: GRAMBEAU | F936: FOLEY | I936: STONE | L936: JEFFREY | O936: DICKSON | R936: WRIGHT
A937: SANDRINGHAM | C937: LYONS | F937: SIMS | I937: HAYES | L937: MANNIX | O937: WILKINS | R937: STEVENS
A938: GOALKICKERS
A939: PRAHRAN | C939: SMITH 6 | E939: McCORMACK 4 | H939: McDONALD 4 | K939: DICKSON 3 | M939: STONE 2 | O939: WARBURTON | R939: TWOMEY
A940: SANDRINGHAM | C940: SIMS 4 | E940: LYONS 2 | G940: GILMORE 2 | I940: HAYES 2 | K940: SHAW 2 | M940: WILKINS 2 | O940: MANNIX 2 | Q940: FITZPATRICK | T940: WAY | V940: VAN DER HAYDEN | X940: NANKERVIS
A942: DANDENONG | C942: 8 | D942: 4 | E942: 52 | G942: 15 | H942: 6 | I942: 96 | K942: 20 | L942: 12 | M942: 132 | O942: 30 | P942: 15 | Q942: 195 | S942: VENUE: DANDENONG
A943: WILLIAMSTOWN | C943: 2 | D943: 3 | E943: 15 | G943: 11 | H943: 6 | I943: 72 | K943: 17 | L943: 8 | M943: 110 | O943: 18 | P943: 10 | Q943: 118 | S943: ALLSOPP :VERGONA
A944: BEST PLAYERS
A945: DANDENONG | C945: LACEY | F945: TOWNSEND | I945: FLAHERTY | L945: P KNIGHT | O945: MADDEN | R945: COVENTRY
A946: WILLIAMSTOWN | C946: FOTHERINGHAM | G946: LIVINGSTONE | J946: POWLEY
A947: GOALKICKERS
A948: DANDENONG | C948: TOWNSEND 6 | F948: FLAHERTY 6 | I948: MADDEN 4 | K948: LACEY 4 | M948: COVENTRY 3 | P948: CROWLEY 2 | R948: O'KEEFE 2 | U948: WENN | W948: McMILLAN | Y948: CROCKER
A949: WILLIAMSTOWN | C949: FOTHERINGHAM 6 | G949: SLEVISON 4 | I949: OBORNE 3 | K949: FAIRLEY 3 | M949: JOHN 2
A951: FRANKSTON | C951: 6 | D951: 2 | E951: 38 | G951: 9 | H951: 3 | I951: 57 | K951: 15 | L951: 6 | M951: 96 | O951: 19 | P951: 12 | Q951: 126 | S951: VENUE: FRANKSTON
A952: WAVERLEY | C952: 3 | D952: 5 | E952: 23 | G952: 10 | H952: 7 | I952: 67 | K952: 11 | L952: 8 | M952: 74 | O952: 14 | P952: 10 | Q952: 94 | S952: QUINN :FITZPATRICK
A953: BEST PLAYERS
A954: FRANKSTON | C954: SALA | F954: HUNTER | I954: CONNELL | L954: JONES | O954: LYNN | Q954: HORLER
A955: WAVERLEY | C955: CLARKE | F955: WENBORNE | I955: FOWLER | L955: GOODMAN
A956: GOALKICKERS
A957: FRANKSTON | C957: HUNTER 7 | E957: LOCKWOOD 2 | H957: KENNEDY | J957: JOHNSON | L957: RASMUSSEN | N957: SALA | P957: GEDDES | R957: BELL | T957: CASEY | V957: HORLER | X957: LYNN | Z957: HAMILL
A958: WAVERLEY | C958: JONES 5 | E958: BRICK 2 | G958: FOWLER 2 | I958: COSGROVE | L958: DICKSON | N958: FISHER | P958: P KING | R958: McDONALD
A960: ROUND 18 | D960: 22ND AUGUST | I960: WEATHER | S960: VENUE: PORT MELBOURNE
D961: 1ST QTR | H961: 2ND QTR | L961: 3RD QTR | P961: FINAL | S961: UMPIRES
A962: COBURG | C962: 5 | D962: 1 | E962: 31 | G962: 8 | H962: 5 | I962: 53 | K962: 14 | L962: 11 | M962: 95 | O962: 18 | P962: 14 | Q962: 122 | S962: ALLSOPP | X962: LADDER | AB962: ROUND | AD962: 18
A963: PORT MELBOURNE | C963: 6 | D963: 3 | E963: 39 | G963: 12 | H963: 10 | I963: 82 | K963: 13 | L963: 11 | M963: 89 | O963: 16 | P963: 19 | Q963: 115 | S963: OGSTON
A964: BEST PLAYERS | W964: TEAM | X964: W | Y964: L | Z964: D | AA964: FOR | AB964: AGST | AC964: % | AD964: PTS
A965: COBURG | C965: CLEARY | F965: SERAFINI | I965: HERBERT | L965: SHELDON | O965: HALSALL
A966: PORT MELBOURNE | C966: RODDA | F966: HALL | I966: COOK | L966: DAVIES | O966: SWAN | W966: PRESTON | X966: 16 | Y966: 2 | Z966: 0 | AA966: 2639 | AB966: 1654 | AC966: =(AA966/AB966)*100 -> 159.55259975816202 | AD966: =(X966*4)+(Z966*2) -> 64
A967: GOALKICKERS | W967: COBURG | X967: 15 | Y967: 3 | Z967: 0 | AA967: 2388 | AB967: 1833 | AC967: =(AA967/AB967)*100 -> 130.27823240589197 | AD967: =(X967*4)+(Z967*2) -> 60
A968: COBURG | C968: SERAFINI 7 | F968: HERBERT 6 | I968: HALSALL 2 | L968: LAIDLER 2 | N968: CLEARY | W968: PORT MELBOURNE | X968: 13 | Y968: 5 | Z968: 0 | AA968: 2861 | AB968: 2109 | AC968: =(AA968/AB968)*100 -> 135.65670934091986 | AD968: =(X968*4)+(Z968*2) -> 52
A969: PORT MELBOURNE | C969: COOK 6 | E969: ANDERSON 3 | H969: EBEYER 3 | J969: KAVANAGH 2 | M969: SWAN | O969: HALL | W969: GEELONG WEST | X969: 11 | Y969: 7 | Z969: 0 | AA969: 2080 | AB969: 2291 | AC969: =(AA969/AB969)*100 -> 90.790048013967692 | AD969: =(X969*4)+(Z969*2) -> 44
S970: VENUE: CAMBERWELL
A971: CAMBERWELL | C971: 4 | D971: 5 | E971: 29 | G971: 9 | H971: 7 | I971: 61 | K971: 13 | L971: 11 | M971: 89 | O971: 21 | P971: 16 | Q971: 142 | S971: CASEY | W971: CAMBERWELL | X971: 9 | Y971: 9 | Z971: 0 | AA971: 2293 | AB971: 2345 | AC971: =(AA971/AB971)*100 -> 97.782515991471215 | AD971: =(X971*4)+(Z971*2) -> 36
A972: GEELONG WEST | C972: 4 | D972: 3 | E972: 27 | G972: 10 | H972: 12 | I972: 72 | K972: 14 | L972: 15 | M972: 99 | O972: 18 | P972: 18 | Q972: 126 | S972: :STABB | W972: PRAHRAN | X972: 9 | Y972: 9 | Z972: 0 | AA972: 2133 | AB972: 2305 | AC972: =(AA972/AB972)*100 -> 92.537960954446845 | AD972: =(X972*4)+(Z972*2) -> 36
A973: BEST PLAYERS | W973: SANDRINGHAM | X973: 8 | Y973: 10 | Z973: 0 | AA973: 2190 | AB973: 2273 | AC973: =(AA973/AB973)*100 -> 96.3484381874175 | AD973: =(X973*4)+(Z973*2) -> 32
A974: CAMBERWELL | C974: CAHILL | F974: NEILSON | I974: JUDD | L974: BROMBERG | O974: EVANS | R974: STEVENSON | W974: WERRIBEE | X974: 8 | Y974: 10 | Z974: 0 | AA974: 2371 | AB974: 2574 | AC974: =(AA974/AB974)*100 -> 92.113442113442119 | AD974: =(X974*4)+(Z974*2) -> 32
A975: GEELONG WEST | C975: KRANJC | F975: BROWNE | I975: EDDY | L975: TODD | O975: DALIHAUS | R975: WOODARD | W975: DANDENONG | X975: 6 | Y975: 11 | Z975: 0 | AA975: 2076 | AB975: 2245 | AC975: =(AA975/AB975)*100 -> 92.472160356347445 | AD975: =(X975*4)+(Z975*2) -> 24
A976: GOALKICKERS | P976: HAMMOND | R976: BROMBERG | W976: FRANKSTON | X976: 5 | Y976: 13 | Z976: 0 | AA976: 2136 | AB976: 2424 | AC976: =(AA976/AB976)*100 -> 88.118811881188122 | AD976: =(X976*4)+(Z976*2) -> 20
A977: CAMBERWELL | C977: STEVENSON 7 | F977: GASTON 3 | I977: S ROURKE 3 | L977: DODIG 2 | N977: HIRST | P977: DAVIDSON | R977: JUDD | T977: WRIGHT | W977: WILLIAMSTOWN | X977: 5 | Y977: 13 | Z977: 0 | AA977: 2196 | AB977: 2532 | AC977: =(AA977/AB977)*100 -> 86.729857819905206 | AD977: =(X977*4)+(Z977*2) -> 20
A978: GEELONG WEST | C978: BROWNE 5 | F978: RADOJEVIC 4 | I978: BURNETT 2 | L978: CANTWELL 2 | O978: EDDY 2 | Q978: DALIHAUS | T978: TORNEY | W978: WAVERLEY | X978: 3 | Y978: 15 | Z978: 0 | AA978: 1700 | AB978: 2545 | AC978: =(AA978/AB978)*100 -> 66.797642436149303 | AD978: =(X978*4)+(Z978*2) -> 12
S979: KRANJC
A980: FRANKSTON | C980: 6 | D980: 3 | E980: 39 | G980: 15 | H980: 6 | I980: 96 | K980: 17 | L980: 8 | M980: 110 | O980: 26 | P980: 11 | Q980: 167 | S980: VENUE: FRANKSTON
A981: WERRIBEE | C981: 2 | D981: 7 | E981: 19 | G981: 6 | H981: 15 | I981: 51 | K981: 8 | L981: 20 | M981: 68 | O981: 10 | P981: 25 | Q981: 85 | S981: CROXFORD :BUDGE
A982: BEST PLAYERS
A983: FRANKSTON | C983: SALA | F983: HUNTER | I983: JONES | L983: COLE | O983: LYNN | Q983: CASEY
A984: WERRIBEE | C984: KING | F984: FREEMAN | I984: BREEN | L984: DEMPSTER
A985: GOALKICKERS
A986: FRANKSTON | C986: HUNTER 8 | E986: SALA 4 | G986: BOYD 4 | I986: KENNEDY 3 | L986: JONES 2 | N986: LOCKWOOD | Q986: ROGERSON | S986: BRADY | U986: HALE | W986: RASMUSSEN
A987: WERRIBEE | C987: KING 4 | E987: LOW 3 | G987: CONN | I987: HUGHES | K987: MORRIS
A989: SANDRINGHAM | C989: 6 | D989: 6 | E989: 42 | G989: 10 | H989: 12 | I989: 72 | K989: 17 | L989: 18 | M989: 120 | O989: 24 | P989: 20 | Q989: 164 | S989: VENUE: WAVERLEY
A990: WAVERLEY | C990: 1 | D990: 3 | E990: 9 | G990: 5 | H990: 8 | I990: 38 | K990: 6 | L990: 9 | M990: 45 | O990: 13 | P990: 14 | Q990: 92 | S990: GROOM :RYAN
A991: BEST PLAYERS
A992: SANDRINGHAM | C992: WAY | F992: WILKINS | I992: RICHARDS | L992: MANNIX | O992: LYONS | R992: HAYES
A993: WAVERLEY | C993: FOWLER | F993: WENBORNE | I993: GOODMAN | L993: McEWIN | O993: HAMILTON | R993: K McDONALD
A994: GOALKICKERS
A995: SANDRINGHAM | C995: CARROLL 6 | F995: WAY 6 | H995: SHAW 4 | J995: SIMS 2 | L995: PLEDGER 2 | O995: NANKERVIS 2 | R995: WORKMAN 2
A996: WAVERLEY | C996: STYLES 2 | E996: K McDOANALD 2 | H996: MURRAY 2 | J996: WENBORNE | L996: GOODMAN | N996: JONES | P996: P KING | R996: COSGROVE | U996: FOWLER | X996: HAMILTON
A998: WILLIAMSTOWN | C998: 7 | D998: 5 | E998: 47 | G998: 11 | H998: 11 | I998: 77 | K998: 15 | L998: 18 | M998: 108 | O998: 21 | P998: 19 | Q998: 145 | S998: VENUE: WILLIAMSTOWN
A999: PRAHRAN | C999: 2 | D999: 7 | E999: 19 | G999: 5 | H999: 9 | I999: 39 | K999: 7 | L999: 14 | M999: 56 | O999: 13 | P999: 17 | Q999: 95 | S999: STEERE :GRIFFITHS
A1000: BEST PLAYERS
A1001: WILLIAMSTOWN | C1001: TAYLOR | F1001: FAIRLEY | I1001: SAIT | L1001: KELLY | O1001: POWLEY | R1001: OBORNE
A1002: PRAHRAN | C1002: GRAMBEAU | F1002: FOLEY | I1002: SMITH | L1002: DICKSON | O1002: MOIR
A1003: GOALKICKERS
A1004: WILLIAMSTOWN | C1004: OBORNE 5 | E1004: FOTHERINGHAM 5 | I1004: KELLY 5 | K1004: FAIRLEY 2 | M1004: SAIT | O1004: GABRIEL | Q1004: POWLEY | S1004: JOHN
A1005: PRAHRAN | C1005: SMITH 7 | F1005: S YOUNG 3 | I1005: WRIGHT | K1005: WALLACE | M1005: S McDONALD
A1007: PRESTON | C1007: 4 | D1007: 5 | E1007: 29 | G1007: 8 | H1007: 8 | I1007: 56 | K1007: 18 | L1007: 14 | M1007: 122 | O1007: 27 | P1007: 17 | Q1007: 179 | S1007: VENUE: PRESTON
A1008: DANDENONG | C1008: 5 | D1008: 2 | E1008: 32 | G1008: 10 | H1008: 6 | I1008: 66 | K1008: 12 | L1008: 7 | M1008: 79 | O1008: 17 | P1008: 9 | Q1008: 111 | S1008: OAKLEY :PHILLIPS
A1009: BEST PLAYERS
A1010: PRESTON | C1010: WARREN | F1010: BOURKE | I1010: DINTINOSANTE | L1010: BRINE | O1010: BERRY | R1010: PLOWMAN
A1011: DANDENONG | C1011: CROWLEY | F1011: LACEY | I1011: MADDEN | L1011: WENN | O1011: COUSINS | R1011: MILLANE
A1012: GOALKICKERS
A1013: PRESTON | C1013: BOURKE 7 | E1013: BODEN 4 | G1013: OHLSEN 3 | I1013: DINTINOSANTE 3 | L1013: McCANN 3 | N1013: SHAW 2 | P1013: KELLY | R1013: VANN | T1013: McGAW | W1013: McKEON | X1013: MARCON
A1014: DANDENONG | C1014: WRIGHT 3 | E1014: MADDEN 3 | H1014: LACEY 2 | J1014: TOWNSEND 2 | M1014: O'KEEFE 2 | O1014: COUSINS | Q1014: CROWLEY | S1014: COVENTRY | V1014: MILLANE | X1014: FLAHERTY
A1016: FINALS
A1017: 1ST SEMI | D1017: 29TH AUGUST | I1017: WEATHER
D1018: 1ST QTR | H1018: 2ND QTR | L1018: 3RD QTR | P1018: FINAL | S1018: VENUE: JUNCTION OVAL
A1019: PORT MELBOURNE | C1019: 6 | D1019: 6 | E1019: 42 | G1019: 11 | H1019: 9 | I1019: 75 | K1019: 19 | L1019: 17 | M1019: 131 | O1019: 25 | P1019: 20 | Q1019: 170 | S1019: UMPIRES
A1020: GEELONG WEST | C1020: 3 | D1020: 2 | E1020: 20 | G1020: 8 | H1020: 5 | I1020: 53 | K1020: 10 | L1020: 9 | M1020: 69 | O1020: 16 | P1020: 12 | Q1020: 108 | S1020: OGSTON :ALLSOPP
A1021: BEST PLAYERS
A1022: PORT MELBOURNE | C1022: SWAN | F1022: HALL | I1022: THOMPSON | L1022: ROBERTSON | O1022: WILKINSON | R1022: ANDERSON
A1023: GEELONG WEST | C1023: GIBSON | F1023: TORNEY | I1023: CRICHTON | L1023: KRANJC | O1023: WOODARD | R1023: BROWNE
A1024: GOALKICKERS
A1025: PORT MELBOURNE | C1025: ANDERSON 5 | F1025: COOK 4 | H1025: DOYLE 4 | J1025: EBEYER 3 | L1025: SWAN | N1025: BRICE | P1025: JOHNSON | R1025: WILKINSON | U1025: HALL | W1025: KAVANAGH | X1025: EVANS | Z1025: ROBERTSON | AC1025: RODDA
A1026: GEELONG WEST | C1026: RADOJEVIC 4 | F1026: BROWNE 3 | I1026: CRICHTON 2 | L1026: GIBSON 2 | N1026: TORNEY 2 | Q1026: BURNETT | S1026: TODD | U1026: DALIHAUS
A1028: 2ND SEMI | D1028: 5TH SEPTEMBER
A1029: PRESTON | C1029: 4 | D1029: 5 | E1029: 29 | G1029: 10 | H1029: 8 | I1029: 68 | K1029: 13 | L1029: 11 | M1029: 89 | O1029: 17 | P1029: 18 | Q1029: 120 | S1029: VENUE: JUNCTION OVAL
A1030: COBURG | C1030: 3 | D1030: 1 | E1030: 19 | G1030: 6 | H1030: 3 | I1030: 39 | K1030: 10 | L1030: 8 | M1030: 68 | O1030: 10 | P1030: 12 | Q1030: 72 | S1030: QUINN :OAKLEY
A1031: BEST PLAYERS
A1032: PRESTON | C1032: TOWAN | F1032: PLOWMAN | I1032: WARREN | L1032: KELLY | O1032: DINTINOSANTE | R1032: HALAS
A1033: COBURG | C1033: DALGLEISH | F1033: FREEMAN | I1033: LAIDLER | L1033: FITZGERALD | O1033: EADE | R1033: BURT
A1034: GOALKICKERS
A1035: PRESTON | C1035: HALAS 7 | F1035: McCANN 2 | I1035: VANN 2 | K1035: OHLSEN | M1035: KELLY | N1035: WIGHT | P1035: McGAW | R1035: DINTINOSANTE | V1035: SHAW
A1036: COBURG | C1036: LAIDLER 3 | F1036: HERBERT 3 | I1036: CLEARY 2 | K1036: SERAFINI | M1036: FREEMAN
A1038: PRELIMINARY FINAL | E1038: 12TH SEPTEMBER
A1039: PORT MELBOURNE | C1039: 5 | D1039: 2 | E1039: 32 | G1039: 9 | H1039: 12 | I1039: 66 | K1039: 12 | L1039: 16 | M1039: 88 | O1039: 19 | P1039: 22 | Q1039: 136 | S1039: VENUE: JUNCTION OVAL
A1040: COBURG | C1040: 7 | D1040: 4 | E1040: 46 | G1040: 10 | H1040: 7 | I1040: 67 | K1040: 17 | L1040: 7 | M1040: 109 | O1040: 18 | P1040: 8 | Q1040: 116 | S1040: VERGONA :GROOM
A1041: BEST PLAYERS
A1042: PORT MELBOURNE | C1042: WILKINSON | F1042: KAVANAGH | I1042: ROBERTSON | L1042: SWAN | O1042: RODDA | Q1042: DERMOTT
A1043: COBURG | C1043: FITZGERALD | F1043: HARBINSON | I1043: SHELDON | L1043: EADE | O1043: BURT | Q1043: MILROY
A1044: GOALKICKERS
A1045: PORT MELBOURNE | C1045: COOK 3 | E1045: WILKINSON 3 | H1045: ANDERSON 3 | K1045: KAVANAGH 3 | N1045: RODDA 2 | P1045: BRICE | R1045: SWAN | T1045: EVANS | V1045: DOYLE | X1045: EBEYER
A1046: COBURG | C1046: LAIDLER 4 | F1046: DWYER 4 | H1046: HARBINSON 3 | K1046: HERBERT 2 | M1046: FITZGERALD | P1046: BURT | R1046: CLEARY | U1046: MILROY | X1046: FREEMAN
A1048: GRAND FINAL | D1048: 19TH SEPTEMBER
A1049: PORT MELBOURNE | C1049: 5 | D1049: 9 | E1049: 39 | G1049: 7 | H1049: 13 | I1049: 55 | K1049: 14 | L1049: 14 | M1049: 98 | O1049: 21 | P1049: 15 | Q1049: 141 | S1049: VENUE: JUNCTION OVAL
A1050: PRESTON | C1050: 3 | D1050: 3 | E1050: 21 | G1050: 8 | H1050: 6 | I1050: 54 | K1050: 12 | L1050: 9 | M1050: 81 | O1050: 20 | P1050: 14 | Q1050: 134 | S1050: OGSTON :VERGONA
A1051: BEST PLAYERS
A1052: PORT MELBOURNE | C1052: SWAN | F1052: KAVANAGH | I1052: ROBERTSON | L1052: CHADBAND | O1052: ANDERSON | R1052: EVANS
A1053: PRESTON | C1053: SHAW | F1053: WARREN | I1053: VANN | L1053: AUSTEN | O1053: BODEN | R1053: BUX
A1054: GOALKICKERS
A1055: PORT MELBOURNE | C1055: COOK 5 | E1055: ANDERSON 5 | H1055: DAVIES 2 | J1055: KAVANAGH 2 | M1055: EBEYER 2 | O1055: EVANS | Q1055: RODDA | S1055: WILKINSON | V1055: SWAN | X1055: TANTSIS
A1056: PRESTON | C1056: HALAS 5 | E1056: OHLSEN 2 | G1056: VANN 2 | I1056: DINTINOSANTE 2 | L1056: SHAW 2 | N1056: McGAW 2 | P1056: BODEN 2 | R1056: AUSTEN | U1056: McCANN | X1056: TOWAN
A1058: REPRESENTATIVE MATCH
A1059: V.F.A. | C1059: 5 | D1059: 10 | E1059: 40 | G1059: 10 | H1059: 12 | I1059: 72 | K1059: 18 | L1059: 21 | M1059: 129 | O1059: 27 | P1059: 33 | Q1059: 195
A1060: G.N.L. (TAS) | C1060: 0 | D1060: 3 | E1060: 3 | G1060: 5 | H1060: 4 | I1060: 34 | K1060: 7 | L1060: 5 | M1060: 47 | O1060: 9 | P1060: 9 | Q1060: 63
A1061: BEST PLAYERS
A1062: V.F.A. | C1062: STONE | E1062: AUSTEN | H1062: EBEYER | K1062: BURT | N1062: COOK | Q1062: D EVANS
A1063: G.N.L. (TAS) | C1063: LEE | E1063: BALDOCK | H1063: LYNCH | K1063: D'OLIVER | N1063: NEAL | Q1063: YOUNG
A1064: GOALKICKERS
A1065: V.F.A. | C1065: COOK 10 | E1065: EBEYER 3 | G1065: BROWNE 3 | I1065: LANE 3 | K1065: McCORMACK 2 | N1065: MANNIX 2 | Q1065: HERBERT | S1065: SWAN | U1065: CRICHTON | X1065: WILKINSON
A1066: G.N.L. (TAS) | C1066: SHEPHARD 2 | F1066: YOUNG | H1066: LEE | J1066: KORPERSHOCK | M1066: DELL | N1066: WILLIAMS | Q1066: REIMUTH | S1066: KNIGHT
A1068: V.A.F.A. | C1068: 4 | D1068: 6 | E1068: 30 | G1068: 10 | H1068: 6 | I1068: 66 | K1068: 13 | L1068: 10 | M1068: 88 | O1068: 21 | P1068: 13 | Q1068: 139 | T1068: VENUE: BEACH ROAD
A1069: V.F.A. | C1069: 3 | D1069: 5 | E1069: 23 | G1069: 11 | H1069: 10 | I1069: 76 | K1069: 14 | L1069: 15 | M1069: 99 | O1069: 19 | P1069: 17 | Q1069: 131 | T1069: QUINN V.F.A. MORGAN V.A.F.A.
A1070: BEST PLAYERS
A1071: V.A.F.A. | C1071: R BROWN | F1071: JENNINGS | I1071: COOPER | L1071: MURPHY | O1071: JONES | Q1071: DILLON
A1072: V.F.A. | C1072: COOK | F1072: CONN | I1072: DICKSON | L1072: SWAN | O1072: STONE | Q1072: ANDERSON
A1073: GOALKICKERS
A1074: V.A.F.A. | C1074: MURPHY 5 | E1074: DILLON 4 | G1074: JONES 4 | I1074: R BROWN 3 | L1074: JENNINGS 3 | N1074: CORDNER 2 | Q1074: YEOMAN | S1074: P BROWN
A1075: V.F.A. | C1075: COOK 6 | E1075: ANDERSON 3 | H1075: LANE 3 | J1075: CONN 2 | L1075: MANNIX 2 | N1075: EBEYER | P1075: STONE | R1075: G EVANS