A1: Victorian Football Association
A2: Season 1982 - Division Two
A3: © Copyright Wal Williams | F3: First created: 28 March 2016
A4: Contact: joywalwi at gmail dot com | F4: Last updated: 28 March 2016 | W4: VFA Results and tables - Link to the main index page
A5: You are free to copy this document in whole or part provided that proper acknowledgement is given to the author. All rights reserved.
A7: 1982 | C7: V.F.A. SEASON 2ND DIVISION
A8: ROUND 1 | E8: 4TH APRIL | J8: WEATHER | S8: PLAYED AT
D9: 1ST QTR | H9: 2ND QTR | L9: 3RD QTR | P9: FINAL | S9: BRUNSWICK
A10: BRUNSWICK | C10: 4 | D10: 5 | E10: =C10*6+D10 -> 29 | G10: 8 | H10: 11 | I10: =G10*6+H10 -> 59 | K10: 13 | L10: 11 | M10: =K10*6+L10 -> 89 | O10: 19 | P10: 14 | Q10: =O10*6+P10 -> 128 | S10: UMPIRE | X10: LADDER | AB10: ROUND | AD10: 1
A11: MORDIALLOC | C11: 3 | D11: 5 | E11: =C11*6+D11 -> 23 | G11: 9 | H11: 7 | I11: =G11*6+H11 -> 61 | K11: 11 | L11: 13 | M11: =K11*6+L11 -> 79 | O11: 17 | P11: 17 | Q11: =O11*6+P11 -> 119 | S11: RYAN/PHILLIPS
A12: BEST PLAYERS | W12: TEAM | X12: W | Y12: L | Z12: D | AA12: FOR | AB12: AGST | AC12: % | AD12: PTS
A13: BRUNSWICK | C13: NARDELLA | F13: TOY | I13: SAHLBERG | L13: CALLANDER | O13: CANNARD | R13: SCULLY
A14: MORDIALLOC | C14: BATTY | F14: ALVES | I14: LEWIS | L14: DUNBAR | O14: BOURNE | R14: PAGNOCCOLO | W14: SPRINGVALE | X14: 1 | Y14: 0 | Z14: 0 | AA14: 142 | AB14: 105 | AC14: =(AA14*100)/AB14 -> 135.23809523809524 | AD14: =(X14*4)+(Z14*2) -> 4
A15: GOALKICKERS | W15: NORTHCOTE | X15: 1 | Y15: 0 | Z15: 0 | AA15: 141 | AB15: 106 | AC15: =(AA15*100)/AB15 -> 133.01886792452831 | AD15: =(X15*4)+(Z15*2) -> 4
A16: BRUNSWICK | C16: JAKSIC 4 | F16: JUDGE 4 | H16: NARDELLA 3 | K16: CANNARD 2 | N16: SAHLBERG 2 | Q16: SAGGERS 2 | S16: TOY 2 | W16: OAKLEIGH | X16: 1 | Y16: 0 | Z16: 0 | AA16: 139 | AB16: 121 | AC16: =(AA16*100)/AB16 -> 114.87603305785125 | AD16: =(X16*4)+(Z16*2) -> 4
A17: MORDIALLOC | C17: O'HANLON 3 | F17: PAGNOCCOLO 3 | I17: McILWRAITH 3 | L17: PETER BARDOEL 2 | P17: WALSH 2 | R17: LEWIS 2 | W17: BRUNSWICK | X17: 1 | Y17: 0 | Z17: 0 | AA17: 128 | AB17: 119 | AC17: =(AA17*100)/AB17 -> 107.56302521008404 | AD17: =(X17*4)+(Z17*2) -> 4
K18: WATTERS | N18: PARKER
A19: OAKLEIGH | C19: 5 | D19: 5 | E19: =C19*6+D19 -> 35 | G19: 10 | H19: 12 | I19: =G19*6+H19 -> 72 | K19: 16 | L19: 16 | M19: =K19*6+L19 -> 112 | O19: 20 | P19: 19 | Q19: =O19*6+P19 -> 139 | S19: PRINCES PARK, CAULFIELD | W19: SUNSHINE | X19: 1 | Y19: 0 | Z19: 0 | AA19: 144 | AB19: 143 | AC19: =(AA19*100)/AB19 -> 100.69930069930069 | AD19: =(X19*4)+(Z19*2) -> 4
A20: CAULFIELD | C20: 3 | D20: 6 | E20: =C20*6+D20 -> 24 | G20: 6 | H20: 11 | I20: =G20*6+H20 -> 47 | K20: 11 | L20: 13 | M20: =K20*6+L20 -> 79 | O20: 17 | P20: 19 | Q20: =O20*6+P20 -> 121 | S20: BRADSHAW | W20: YARRAVILLE | X20: 0 | Y20: 1 | Z20: 0 | AA20: 143 | AB20: 144 | AC20: =(AA20*100)/AB20 -> 99.305555555555557 | AD20: =(X20*4)+(Z20*2) -> 0
A21: BEST PLAYERS | S21: BUDGE | W21: MORDIALLOC | X21: 0 | Y21: 1 | Z21: 0 | AA21: 119 | AB21: 128 | AC21: =(AA21*100)/AB21 -> 92.96875 | AD21: =(X21*4)+(Z21*2) -> 0
A22: OAKLEIGH | C22: GREENWOOD | F22: TODD | I22: ROACH | L22: CALLERY | O22: HARTLEY | W22: CAULFIELD | X22: 0 | Y22: 1 | Z22: 0 | AA22: 121 | AB22: 139 | AC22: =(AA22*100)/AB22 -> 87.050359712230218 | AD22: =(X22*4)+(Z22*2) -> 0
A23: CAULFIELD | C23: MORRISON | F23: FARINSKI | I23: BOOTH | L23: DUNCAN | O23: O'BRIEN | W23: KILSYTH | X23: 0 | Y23: 1 | Z23: 0 | AA23: 106 | AB23: 141 | AC23: =(AA23*100)/AB23 -> 75.177304964539005 | AD23: =(X23*4)+(Z23*2) -> 0
A24: GOALKICKERS | W24: BOX HILL | X24: 0 | Y24: 1 | Z24: 0 | AA24: 105 | AB24: 142 | AC24: =(AA24*100)/AB24 -> 73.943661971830991 | AD24: =(X24*4)+(Z24*2) -> 0
A25: OAKLEIGH | C25: WOOD 4 | E25: TODD 4 | G25: AERTSSEN 4 | J25: HARPER 3 | M25: McDONALD 3 | P25: ROACH | R25: WILSON
A26: CAULFIELD | C26: BOOTH 5 | E26: TAYLOR 4 | G26: MORRISON 2 | J26: PEARCE 2 | M26: DUNCAN 2 | P26: SKILTON | R26: VEALE
A28: SUNSHINE | C28: 5 | D28: 5 | E28: =C28*6+D28 -> 35 | G28: 12 | H28: 7 | I28: =G28*6+H28 -> 79 | K28: 18 | L28: 9 | M28: =K28*6+L28 -> 117 | O28: 22 | P28: 12 | Q28: =O28*6+P28 -> 144 | S28: YARRAVILLE
A29: YARRAVILLE | C29: 5 | D29: 2 | E29: =C29*6+D29 -> 32 | G29: 11 | H29: 5 | I29: =G29*6+H29 -> 71 | K29: 17 | L29: 9 | M29: =K29*6+L29 -> 111 | O29: 21 | P29: 17 | Q29: =O29*6+P29 -> 143 | S29: HUTCHINSON/PODESTA
A30: BEST PLAYERS
A31: SUNSHINE | C31: MITCHELL | F31: HUNT | I31: VADJNAL | L31: HOLDEN | O31: WILLIAMS | R31: CHATTERTON
A32: YARRAVILLE | C32: McGHIE | F32: SQUIRE | I32: SHARP | L32: COOKE | O32: WARD | R32: RYAN
A33: GOALKICKERS
A34: SUNSHINE | C34: HOLDEN 3 | F34: HUNT 3 | H34: N MENADUE 3 | K34: CHATTERTON 3 | N34: FOLEY 2 | P34: BARLOW 2 | R34: B MENADUE 2 | U34: HENLEY | W34: WAGLAND | X34: WILLIAMS | Z34: GORE
A35: YARRAVILLE | C35: RYAN 4 | E35: LEITCH 3 | G35: GRAY 3 | I35: DIMASI 3 | K35: SCOTT 3 | M35: PRIEST 2 | O35: SQUIRE | Q35: PHELAN | S35: MARTIN
A37: SPRINGVALE | C37: 5 | D37: 4 | E37: =C37*6+D37 -> 34 | G37: 13 | H37: 5 | I37: =G37*6+H37 -> 83 | K37: 17 | L37: 14 | M37: =K37*6+L37 -> 116 | O37: 21 | P37: 16 | Q37: =O37*6+P37 -> 142 | S37: NEWCOMEN RD
A38: BOX HILL | C38: 1 | D38: 5 | E38: =C38*6+D38 -> 11 | G38: 4 | H38: 7 | I38: =G38*6+H38 -> 31 | K38: 9 | L38: 12 | M38: =K38*6+L38 -> 66 | O38: 15 | P38: 15 | Q38: =O38*6+P38 -> 105 | S38: MAY/GOLLOP
A39: BEST PLAYERS
A40: SPRINGVALE | C40: FREEMAN | F40: WOODMAN | I40: ANDERSON | L40: TONKIN | O40: FOTINIOTIS | R40: NEWMAN
A41: BOX HILL | C41: TAYLOR | F41: CRUSE | I41: CONNOLLY | L41: RICH | O41: DEAN | R41: LAWTHER
A42: GOALKICKERS
A43: SPRINGVALE | C43: ANDERSON 5 | F43: CARROLL 5 | I43: COOKE 2 | K43: CADDAYE 2 | N43: FOTINIOTIS 2 | Q43: GOODINGHAM | T43: PINNELL | V43: WARNER | X43: SMITH | Z43: FREEMAN
A44: BOX HILL | C44: MOORE 5 | F44: DEAN 4 | I44: LAWTHER 2 | L44: STEWARD 2 | O44: DAY | Q44: WITNISH
A46: NORTHCOTE | C46: 10 | D46: 3 | E46: =C46*6+D46 -> 63 | G46: 14 | H46: 10 | I46: =G46*6+H46 -> 94 | K46: 19 | L46: 19 | M46: =K46*6+L46 -> 133 | O46: 21 | P46: 15 | Q46: =O46*6+P46 -> 141 | S46: KILSYTH
A47: KILSYTH | C47: 4 | D47: 5 | E47: =C47*6+D47 -> 29 | G47: 6 | H47: 7 | I47: =G47*6+H47 -> 43 | K47: 10 | L47: 8 | M47: =K47*6+L47 -> 68 | O47: 16 | P47: 10 | Q47: =O47*6+P47 -> 106 | S47: STEERE/PETRIE
A48: BEST PLAYERS
A49: NORTHCOTE | C49: DILORIO | F49: HEPBURN | I49: COURTS | L49: GRAHAM | O49: McQUINN | R49: BRAIN
A50: KILSYTH | C50: HODGES | F50: ELLIOTT | I50: SHEPPARD | L50: LINNELL | O50: LETTS | R50: HICKLETON
A51: GOALKICKERS
A52: NORTHCOTE | C52: BRAIN 5 | E52: ROULSTON 4 | H52: HEPBURN 3 | J52: JIM CHRISTOU 3 | N52: JURGENSTEIN 2 | Q52: COURTS | S52: McQUINN | V52: CEPPI
A53: KILSYTH | C53: HODGES 4 | F53: FINNIS 3 | H53: SCHUERMAN 3 | K53: ELLIOTT 3 | N53: SHEPPARD 2 | Q53: GINNICH
A55: ROUND 2 | E55: 11TH APRIL | J55: WEATHER | S55: PLAYED AT
D56: 1ST QTR | H56: 2ND QTR | L56: 3RD QTR | P56: FINAL | S56: OAKLEIGH
A57: OAKLEIGH | C57: 6 | D57: 7 | E57: =C57*6+D57 -> 43 | G57: 16 | H57: 13 | I57: =G57*6+H57 -> 109 | K57: 27 | L57: 19 | M57: =K57*6+L57 -> 181 | O57: 37 | P57: 21 | Q57: =O57*6+P57 -> 243 | S57: UMPIRE | X57: LADDER | AB57: ROUND | AD57: 2
A58: YARRAVILLE | C58: 2 | D58: 3 | E58: =C58*6+D58 -> 15 | G58: 5 | H58: 8 | I58: =G58*6+H58 -> 38 | K58: 6 | L58: 12 | M58: =K58*6+L58 -> 48 | O58: 9 | P58: 14 | Q58: =O58*6+P58 -> 68 | S58: STEERE/MAY
A59: BEST PLAYERS | W59: TEAM | X59: W | Y59: L | Z59: D | AA59: FOR | AB59: AGST | AC59: % | AD59: PTS
A60: OAKLEIGH | C60: AERTSSEN | F60: WOOD | I60: SPLATT | L60: HARPER | O60: ROBERTS | R60: FITZGERALD
A61: YARRAVILLE | C61: COOKE | F61: McGHIE | I61: SHARP | L61: PHELAN | O61: GRAY | W61: OAKLEIGH | X61: 2 | Y61: 0 | Z61: 0 | AA61: 382 | AB61: 189 | AC61: =(AA61*100)/AB61 -> 202.11640211640213 | AD61: =(X61*4)+(Z61*2) -> 8
A62: GOALKICKERS | Q62: MATTHEWS | W62: NORTHCOTE | X62: 2 | Y62: 0 | Z62: 0 | AA62: 314 | AB62: 188 | AC62: =(AA62*100)/AB62 -> 167.02127659574469 | AD62: =(X62*4)+(Z62*2) -> 8
A63: OAKLEIGH | C63: AERTSSEN 13 | F63: WOOD 10 | H63: COLLINS 4 | J63: HARPER 3 | L63: TODD 2 | N63: SPLATT | P63: CARTER | R63: McDONALD | T63: CALLERY | W63: SPRINGVALE | X63: 2 | Y63: 0 | Z63: 0 | AA63: 365 | AB63: 230 | AC63: =(AA63*100)/AB63 -> 158.69565217391303 | AD63: =(X63*4)+(Z63*2) -> 8
A64: YARRAVILLE | C64: McGHIE 3 | F64: PRIEST 2 | I64: SHARP | K64: RYAN | M64: SCOTT | O64: LOBAZZA | W64: BRUNSWICK | X64: 2 | Y64: 0 | Z64: 0 | AA64: 312 | AB64: 229 | AC64: =(AA64*100)/AB64 -> 136.24454148471617 | AD64: =(X64*4)+(Z64*2) -> 8
A66: BRUNSWICK | C66: 12 | D66: 2 | E66: =C66*6+D66 -> 74 | G66: 17 | H66: 6 | I66: =G66*6+H66 -> 108 | K66: 21 | L66: 12 | M66: =K66*6+L66 -> 138 | O66: 28 | P66: 16 | Q66: =O66*6+P66 -> 184 | S66: BOX HILL | W66: MORDIALLOC | X66: 1 | Y66: 1 | Z66: 0 | AA66: 259 | AB66: 254 | AC66: =(AA66*100)/AB66 -> 101.96850393700787 | AD66: =(X66*4)+(Z66*2) -> 4
A67: BOX HILL | C67: 3 | D67: 2 | E67: =C67*6+D67 -> 20 | G67: 12 | H67: 8 | I67: =G67*6+H67 -> 80 | K67: 16 | L67: 10 | M67: =K67*6+L67 -> 106 | O67: 16 | P67: 14 | Q67: =O67*6+P67 -> 110 | S67: HUTCHINSON | W67: SUNSHINE | X67: 1 | Y67: 1 | Z67: 0 | AA67: 269 | AB67: 366 | AC67: =(AA67*100)/AB67 -> 73.497267759562845 | AD67: =(X67*4)+(Z67*2) -> 4
A68: BEST PLAYERS | S68: PETRIE | W68: KILSYTH | X68: 0 | Y68: 2 | Z68: 0 | AA68: 232 | AB68: 281 | AC68: =(AA68*100)/AB68 -> 82.562277580071168 | AD68: =(X68*4)+(Z68*2) -> 0
A69: BRUNSWICK | C69: NOLAN | F69: CANNARD | I69: BROWN | L69: SCULLY | O69: CALLANDER | R69: SAGGERS | W69: BOX HILL | X69: 0 | Y69: 2 | Z69: 0 | AA69: 215 | AB69: 326 | AC69: =(AA69*100)/AB69 -> 65.950920245398777 | AD69: =(X69*4)+(Z69*2) -> 0
A70: BOX HILL | C70: CRUSE | F70: DICKENSON | I70: S WITNISH | L70: LAWTHER | O70: GOODEN | R70: MOORE | W70: CAULFIELD | X70: 0 | Y70: 2 | Z70: 0 | AA70: 285 | AB70: 491 | AC70: =(AA70*100)/AB70 -> 58.044806517311606 | AD70: =(X70*4)+(Z70*2) -> 0
A71: GOALKICKERS | E71: PARKER 2 | H71: HICKMAN | K71: JAKSIC | M71: LEAHY | O71: CALLANDER | R71: JONES | T71: CARTER | W71: YARRAVILLE | X71: 0 | Y71: 2 | Z71: 0 | AA71: 211 | AB71: 387 | AC71: =(AA71*100)/AB71 -> 54.521963824289408 | AD71: =(X71*4)+(Z71*2) -> 0
A72: BRUNSWICK | C72: ANDERSON 4 | F72: JUDGE 3 | H72: CANNARD 3 | K72: RALPH 2 | M72: SAGGERS 2 | O72: NARDELLA 2 | R72: SAHLBERG 2 | U72: NOLAN 2
A73: BOX HILL | C73: MOORE 5 | F73: GOODEN 5 | I73: RICH 3 | K73: LAWTHER | N73: DICKENSON | Q73: P WITNISH
A75: SPRINGVALE | C75: 9 | D75: 5 | E75: =C75*6+D75 -> 59 | G75: 16 | H75: 6 | I75: =G75*6+H75 -> 102 | K75: 27 | L75: 10 | M75: =K75*6+L75 -> 172 | O75: 35 | P75: 13 | Q75: =O75*6+P75 -> 223 | S75: SUNSHINE
A76: SUNSHINE | C76: 0 | D76: 1 | E76: =C76*6+D76 -> 1 | G76: 6 | H76: 14 | I76: =G76*6+H76 -> 50 | K76: 13 | L76: 14 | M76: =K76*6+L76 -> 92 | O76: 18 | P76: 17 | Q76: =O76*6+P76 -> 125 | S76: BUDGE/RYAN
A77: BEST PLAYERS
A78: SPRINGVALE | C78: CARROLL | F78: FOTINIOTIS | I78: CROXFORD | L78: ANDERSON | O78: GOODINGHAM
A79: SUNSHINE | C79: WILLIAMS | F79: RICHARDS | I79: BARLOW | L79: FOLEY | O79: HOLDEN | R79: N MENADUE
A80: GOALKICKERS
A81: SPRINGVALE | C81: CARROLL 12 | F81: ANDERSON 5 | I81: FOTINIOTIS 4 | K81: WARNER 3 | N81: PAXTON 2 | P81: COOK 2 | R81: GILES 2 | T81: CROXFORD 2 | W81: TONKIN | X81: SMITH | Z81: FREEMAN
A82: SUNSHINE | C82: N MENADUE 7 | F82: HOLDEN 5 | I82: AXON 2 | K82: CHATTERTON | N82: BARLOW | Q82: WAGLAND | T82: WILLIAMS
A84: NORTHCOTE | C84: 8 | D84: 4 | E84: =C84*6+D84 -> 52 | G84: 13 | H84: 6 | I84: =G84*6+H84 -> 84 | K84: 18 | L84: 11 | M84: =K84*6+L84 -> 119 | O84: 27 | P84: 14 | Q84: =O84*6+P84 -> 176 | S84: NORTHCOTE
A85: CAULFIELD | C85: 3 | D85: 3 | E85: =C85*6+D85 -> 21 | G85: 4 | H85: 8 | I85: =G85*6+H85 -> 32 | K85: 6 | L85: 13 | M85: =K85*6+L85 -> 49 | O85: 11 | P85: 16 | Q85: =O85*6+P85 -> 82 | S85: THOMSON/PHILLIPS
A86: BEST PLAYERS
A87: NORTHCOTE | C87: HEPBURN | F87: DILORIO | I87: JIM CHRISTOU | L87: ROULSTON | O87: COURTS | R87: TAIRI
A88: CAULFIELD | C88: HOGAN | F88: PEARCE | I88: GRIGG | L88: SKILTON
A89: GOALKICKERS
A90: NORTHCOTE | C90: JIM CHRISTOU 5 | G90: JURGENSREIN 5 | J90: BRAIN 4 | L90: P RYAN 4 | N90: HEPBURN 3 | P90: CEPPI 2 | R90: MEGNA 2 | T90: TAIRI | V90: ROULSTON
A91: CAULFIELD | C91: BLAKE 3 | F91: DUNCAN 3 | I91: TAYLOR 2 | K91: SKILTON | N91: PEARCE | P91: O'BRIEN
A93: MORDIALLOC | C93: 8 | D93: 2 | E93: =C93*6+D93 -> 50 | G93: 14 | H93: 4 | I93: =G93*6+H93 -> 88 | K93: 20 | L93: 6 | M93: =K93*6+L93 -> 126 | O93: 22 | P93: 8 | Q93: =O93*6+P93 -> 140 | S93: MORDIALLOC
A94: KILSYTH | C94: 5 | D94: 5 | E94: =C94*6+D94 -> 35 | G94: 11 | H94: 6 | I94: =G94*6+H94 -> 72 | K94: 13 | L94: 10 | M94: =K94*6+L94 -> 88 | O94: 19 | P94: 12 | Q94: =O94*6+P94 -> 126 | S94: BRADSHAW/PODESTA
A95: BEST PLAYERS
A96: MORDIALLOC | C96: ALVES | F96: BOURNE | I96: BALIK | L96: WATTERS | O96: WALSH | R96: DEATON
A97: KILSYTH | C97: BIANCO | F97: LETTS | I97: HODGES | L97: LINNELL | O97: BYRNE | R97: HICKLETON
A98: GOALKICKERS
A99: MORDIALLOC | C99: ALVES 9 | F99: BOURNE 4 | H99: PARKER 2 | J99: KILPATRICK | M99: PAGNOCCOLO | P99: WALSH | R99: P BARDOEL | T99: LEWIS | V99: WATTERS | X99: KERIN
A100: KILSYTH | C100: BIANCO 7 | F100: SCHUERMAN 4 | I100: HICKLETON 3 | L100: LINNELL 3 | N100: LETTS 2
A102: ROUND 3 | E102: 18TH APRIL | J102: WEATHER | S102: PLAYED AT
D103: 1ST QTR | H103: 2ND QTR | L103: 3RD QTR | P103: FINAL | S103: NEWCOMEN RD
A104: OAKLEIGH | C104: 6 | D104: 5 | E104: =C104*6+D104 -> 41 | G104: 9 | H104: 10 | I104: =G104*6+H104 -> 64 | K104: 18 | L104: 13 | M104: =K104*6+L104 -> 121 | O104: 23 | P104: 19 | Q104: =O104*6+P104 -> 157 | S104: UMPIRE | X104: LADDER | AB104: ROUND | AD104: 3
A105: SPRINGVALE | C105: 4 | D105: 4 | E105: =C105*6+D105 -> 28 | G105: 12 | H105: 8 | I105: =G105*6+H105 -> 80 | K105: 16 | L105: 10 | M105: =K105*6+L105 -> 106 | O105: 22 | P105: 12 | Q105: =O105*6+P105 -> 144 | S105: GROOM/ALLSOP
A106: BEST PLAYERS | W106: TEAM | X106: W | Y106: L | Z106: D | AA106: FOR | AB106: AGST | AC106: % | AD106: PTS
A107: OAKLEIGH | C107: ROBERTS | F107: ROACH | I107: C HEVERIN | L107: HARPER | O107: CALLERY | R107: NEARY
A108: SPRINGVALE | C108: BRAND | F108: WARNER | I108: GOODINGHAM | L108: WOODMAN | O108: ANDERSON | R108: PINNELL | W108: OAKLEIGH | X108: 3 | Y108: 0 | Z108: 0 | AA108: 539 | AB108: 162 | AC108: =(AA108*100)/AB108 -> 332.71604938271605 | AD108: =(X108*4)+(Z108*2) -> 12
A109: GOALKICKERS | O109: WOOD | Q109: GREENWOOD | W109: NORTHCOTE | X109: 3 | Y109: 0 | Z109: 0 | AA109: 495 | AB109: 294 | AC109: =(AA109*100)/AB109 -> 168.36734693877551 | AD109: =(X109*4)+(Z109*2) -> 12
A110: OAKLEIGH | C110: AERTSSEN 7 | F110: NEARY 4 | H110: HARPER 3 | J110: CARTER 2 | L110: MATTHEWS 2 | O110: ROACH | Q110: TODD | S110: McDONALD | W110: BRUNSWICK | X110: 3 | Y110: 0 | Z110: 0 | AA110: 489 | AB110: 323 | AC110: =(AA110*100)/AB110 -> 151.39318885448915 | AD110: =(X110*4)+(Z110*2) -> 12
A111: SPRINGVALE | C111: CARROLL 7 | F111: GILES 4 | H111: ANDERSON 3 | K111: FOTINIOTIS 3 | N111: WARNER | P111: SMITH | R111: FREEMAN | T111: PATTON | W111: SPRINGVALE | X111: 2 | Y111: 1 | Z111: 0 | AA111: 509 | AB111: 387 | AC111: =(AA111*100)/AB111 -> 131.52454780361757 | AD111: =(X111*4)+(Z111*2) -> 8
P112: JACOBS
A113: BRUNSWICK | C113: 5 | D113: 4 | E113: =C113*6+D113 -> 34 | G113: 11 | H113: 11 | I113: =G113*6+H113 -> 77 | K113: 16 | L113: 17 | M113: =K113*6+L113 -> 113 | O113: 26 | P113: 21 | Q113: =O113*6+P113 -> 177 | S113: BRUNSWICK | W113: MORDIALLOC | X113: 1 | Y113: 2 | Z113: 0 | AA113: 381 | AB113: 385 | AC113: =(AA113*100)/AB113 -> 98.961038961038966 | AD113: =(X113*4)+(Z113*2) -> 4
A114: SUNSHINE | C114: 3 | D114: 4 | E114: =C114*6+D114 -> 22 | G114: 5 | H114: 6 | I114: =G114*6+H114 -> 36 | K114: 10 | L114: 8 | M114: =K114*6+L114 -> 68 | O114: 14 | P114: 10 | Q114: =O114*6+P114 -> 94 | S114: STEERE | W114: BOX HILL | X114: 1 | Y114: 2 | Z114: 0 | AA114: 346 | AB114: 448 | AC114: =(AA114*100)/AB114 -> 77.232142857142861 | AD114: =(X114*4)+(Z114*2) -> 4
A115: BEST PLAYERS | S115: GOLLOP | W115: CAULFIELD | X115: 1 | Y115: 2 | Z115: 0 | AA115: 401 | AB115: 569 | AC115: =(AA115*100)/AB115 -> 70.474516695957817 | AD115: =(X115*4)+(Z115*2) -> 4
A116: BRUNSWICK | C116: ? | F116: ? | I116: SAHLBERG | L116: G SAGGERS | O116: JUDGE | W116: SUNSHINE | X116: 1 | Y116: 2 | Z116: 0 | AA116: 363 | AB116: 543 | AC116: =(AA116*100)/AB116 -> 66.850828729281773 | AD116: =(X116*4)+(Z116*2) -> 4
A117: SUNSHINE | C117: WAGLAND | F117: HOLLOW | I117: HOLDEN | L117: HUNT | O117: WILLIAMS | W117: KILSYTH | X117: 0 | Y117: 3 | Z117: 0 | AA117: 310 | AB117: 397 | AC117: =(AA117*100)/AB117 -> 78.085642317380348 | AD117: =(X117*4)+(Z117*2) -> 0
A118: GOALKICKERS | P118: LYNCH | W118: YARRAVILLE | X118: 0 | Y118: 3 | Z118: 0 | AA118: 317 | AB118: 568 | AC118: =(AA118*100)/AB118 -> 55.809859154929576 | AD118: =(X118*4)+(Z118*2) -> 0
A119: BRUNSWICK | C119: SAHLBERG 7 | F119: B SAGGERS 5 | I119: JUDGE 4 | K119: NARDELLA 4 | N119: ANDERSON 3 | Q119: CANNARD | S119: CALLANDER
A120: SUNSHINE | C120: B RICHARDS 3 | F120: HOLDEN 3 | I120: N MENADUE 3 | L120: CHATTERTON 2 | O120: GAY | P120: B MENADUE | S120: WAGLAND
A122: NORTHCOTE | C122: 5 | D122: 4 | E122: =C122*6+D122 -> 34 | G122: 14 | H122: 7 | I122: =G122*6+H122 -> 91 | K122: 19 | L122: 7 | M122: =K122*6+L122 -> 121 | O122: 28 | P122: 13 | Q122: =O122*6+P122 -> 181 | S122: YARRAVILLE
A123: YARRAVILLE | C123: 5 | D123: 4 | E123: =C123*6+D123 -> 34 | G123: 8 | H123: 9 | I123: =G123*6+H123 -> 57 | K123: 11 | L123: 14 | M123: =K123*6+L123 -> 80 | O123: 15 | P123: 16 | Q123: =O123*6+P123 -> 106 | S123: BUDGE/PODESTA
A124: BEST PLAYERS
A125: NORTHCOTE | C125: JIM CHRISTOU | F125: M RYAN | I125: P RYAN | L125: MEGNA | O125: GRAHAM | R125: HEPBURN
A126: YARRAVILLE | C126: McGHIE | F126: S LEITCH | I126: TUPPEN | L126: WARD | O126: GOTT | R126: SQUIRE
A127: GOALKICKERS
A128: NORTHCOTE | C128: JIM CHRISTOU 6 | N128: ? 4 | P128: COURTS | R128: MEGNA | U128: SPILLARD | X128: TAIRI
A129: YARRAVILLE | C129: DIMASI 5 | F129: GRAY 3 | H129: LOBAZZA 2 | K129: R LEITCH | N129: PHELAN | P129: McGHIE | R129: PRIEST | T129: SQUIRE
A131: CAULFIELD | C131: 3 | D131: 6 | E131: =C131*6+D131 -> 24 | G131: 9 | H131: 11 | I131: =G131*6+H131 -> 65 | K131: 11 | L131: 7 | M131: =K131*6+L131 -> 73 | O131: 16 | P131: 20 | Q131: =O131*6+P131 -> 116 | S131: PRINCES PARK, CAULFIELD
A132: KILSYTH | C132: 1 | D132: 4 | E132: =C132*6+D132 -> 10 | G132: 2 | H132: 12 | I132: =G132*6+H132 -> 24 | K132: 6 | L132: 17 | M132: =K132*6+L132 -> 53 | O132: 9 | P132: 24 | Q132: =O132*6+P132 -> 78 | S132: RYAN/MORGAN
A133: BEST PLAYERS
A134: CAULFIELD | C134: PEARCE | F134: HOGAN | I134: FARINSKI | L134: MORRISON | O134: TUCKWELL
A135: KILSYTH | C135: C ELLIOTT | F135: DOCKERY | I135: GIBB | L135: BIANCO | O135: PETERSON
A136: GOALKICKERS
A137: CAULFIELD | C137: PEARCE 5 | F137: BLAKE 4 | H137: DUNCAN 3 | J137: DAWSON | L137: O'BRIEN | N137: STAIT | P137: TUCKWELL
A138: KILSYTH | C138: SCHUERMAN 4 | F138: FINNIS 2 | H138: BIANCO | J138: HICKLETON | M138: LETTS
A140: BOX HILL | C140: 3 | D140: 4 | E140: =C140*6+D140 -> 22 | G140: 7 | H140: 9 | I140: =G140*6+H140 -> 51 | K140: 13 | L140: 14 | M140: =K140*6+L140 -> 92 | O140: 19 | P140: 17 | Q140: =O140*6+P140 -> 131 | S140: BOX HILL
A141: MORDIALLOC | C141: 6 | D141: 1 | E141: =C141*6+D141 -> 37 | G141: 11 | H141: 8 | I141: =G141*6+H141 -> 74 | K141: 13 | L141: 12 | M141: =K141*6+L141 -> 90 | O141: 18 | P141: 14 | Q141: =O141*6+P141 -> 122 | S141: CROXFORD/TORNEY
A142: BEST PLAYERS
A143: BOX HILL | C143: R WITNISH | F143: A DICKENSON | I143: S WITNISH | L143: McKECHNIE | O143: MOORE | R143: P WITNISH
A144: MORDIALLOC | C144: WALSH | F144: DEATON | I144: BOURNE | L144: WATTERS | O144: LANG | R144: MASON
A145: GOALKICKERS
A146: BOX HILL | C146: McKECHNIE 7 | F146: MOORE 3 | H146: S WITNISH 2 | K146: McKENZIE 2 | N146: McCANN | P146: CRUSE | R146: RICH | S146: GOODEN | U146: LAWTHER | W146: A DICKENSON
A147: MORDIALLOC | C147: BOURNE 5 | F147: DEATON 3 | I147: ALVES 2 | K147: McILWRAITH 2 | N147: WALSH 2 | Q147: PARKER 2 | S147: KERIN | U147: WATTERS
A149: ROUND 4 | E149: 25TH APRIL | J149: WEATHER | S149: PLAYED AT
D150: 1ST QTR | H150: 2ND QTR | L150: 3RD QTR | P150: FINAL | S150: OAKLEIGH
A151: OAKLEIGH | C151: 4 | D151: 5 | E151: =C151*6+D151 -> 29 | G151: 11 | H151: 9 | I151: =G151*6+H151 -> 75 | K151: 14 | L151: 11 | M151: =K151*6+L151 -> 95 | O151: 20 | P151: 15 | Q151: =O151*6+P151 -> 135 | S151: UMPIRE | X151: LADDER | AB151: ROUND | AD151: 4
A152: BRUNSWICK | C152: 5 | D152: 5 | E152: =C152*6+D152 -> 35 | G152: 11 | H152: 10 | I152: =G152*6+H152 -> 76 | K152: 15 | L152: 18 | M152: =K152*6+L152 -> 108 | O152: 19 | P152: 20 | Q152: =O152*6+P152 -> 134 | S152: PODESTA/RYAN
A153: BEST PLAYERS | W153: TEAM | X153: W | Y153: L | Z153: D | AA153: FOR | AB153: AGST | AC153: % | AD153: PTS
A154: OAKLEIGH | C154: COLLINS | F154: GREENWOOD | I154: S ROACH | L154: NEARY | O154: CALLERY | R154: MATTHEY
A155: BRUNSWICK | C155: CALLENDER | F155: SCULLY | I155: JUDGE | L155: TOY | O155: LYNCH | R155: ANDERSON | W155: OAKLEIGH | X155: 4 | Y155: 0 | Z155: 0 | AA155: 674 | AB155: 296 | AC155: =(AA155*100)/AB155 -> 227.70270270270271 | AD155: =(X155*4)+(Z155*2) -> 16
A156: GOALKICKERS | W156: NORTHCOTE | X156: 4 | Y156: 0 | Z156: 0 | AA156: 612 | AB156: 400 | AC156: =(AA156*100)/AB156 -> 153 | AD156: =(X156*4)+(Z156*2) -> 16
A157: OAKLEIGH | C157: NEARY 5 | E157: HIGGINS 3 | G157: MATTHEWS 3 | J157: AERTSSEN 3 | M157: COLLINS 2 | O157: CARTER 2 | R157: CALLERY | T157: MATTHEY | W157: BRUNSWICK | X157: 3 | Y157: 1 | Z157: 0 | AA157: 623 | AB157: 458 | AC157: =(AA157*100)/AB157 -> 136.02620087336246 | AD157: =(X157*4)+(Z157*2) -> 12
A158: BRUNSWICK | C158: ANDERSON 7 | F158: CANNARD 4 | I158: LEAHY 2 | K158: CALLENDER | N158: JUDGE | O158: LYNCH | Q158: NARDELLA | S158: SAGGERS | U158: TOY | W158: SPRINGVALE | X158: 2 | Y158: 2 | Z158: 0 | AA158: 615 | AB158: 504 | AC158: =(AA158*100)/AB158 -> 122.02380952380952 | AD158: =(X158*4)+(Z158*2) -> 8
A160: NORTHCOTE | C160: 5 | D160: 5 | E160: =C160*6+D160 -> 35 | G160: 9 | H160: 9 | I160: =G160*6+H160 -> 63 | K160: 12 | L160: 12 | M160: =K160*6+L160 -> 84 | O160: 17 | P160: 15 | Q160: =O160*6+P160 -> 117 | S160: NORTHCOTE | W160: MORDIALLOC | X160: 2 | Y160: 2 | Z160: 0 | AA160: 478 | AB160: 460 | AC160: =(AA160*100)/AB160 -> 103.91304347826087 | AD160: =(X160*4)+(Z160*2) -> 8
A161: SPRINGVALE | C161: 4 | D161: 2 | E161: =C161*6+D161 -> 26 | G161: 7 | H161: 4 | I161: =G161*6+H161 -> 46 | K161: 11 | L161: 6 | M161: =K161*6+L161 -> 72 | O161: 16 | P161: 10 | Q161: =O161*6+P161 -> 106 | S161: FITZPATRICK | W161: BOX HILL | X161: 2 | Y161: 2 | Z161: 0 | AA161: 461 | AB161: 549 | AC161: =(AA161*100)/AB161 -> 83.970856102003637 | AD161: =(X161*4)+(Z161*2) -> 8
A162: BEST PLAYERS | S162: CROXFORD | W162: KILSYTH | X162: 1 | Y162: 3 | Z162: 0 | AA162: 393 | AB162: 476 | AC162: =(AA162*100)/AB162 -> 82.563025210084035 | AD162: =(X162*4)+(Z162*2) -> 4
A163: NORTHCOTE | C163: DILORIO | F163: MEGNA | I163: McQUINN | L163: JIM CHRISTOU | O163: JOHN CHRISTOU | S163: M RYAN | W163: CAULFIELD | X163: 1 | Y163: 3 | Z163: 0 | AA163: 476 | AB163: 666 | AC163: =(AA163*100)/AB163 -> 71.471471471471475 | AD163: =(X163*4)+(Z163*2) -> 4
A164: SPRINGVALE | C164: BRAND | F164: FREEMAN | I164: PINNELL | L164: CARROLL | O164: GOODINGHAM | S164: HAY | W164: SUNSHINE | X164: 1 | Y164: 3 | Z164: 0 | AA164: 464 | AB164: 658 | AC164: =(AA164*100)/AB164 -> 70.516717325227958 | AD164: =(X164*4)+(Z164*2) -> 4
A165: GOALKICKERS | W165: YARRAVILLE | X165: 0 | Y165: 4 | Z165: 0 | AA165: 396 | AB165: 651 | AC165: =(AA165*100)/AB165 -> 60.829493087557601 | AD165: =(X165*4)+(Z165*2) -> 0
A166: NORTHCOTE | C166: JIM CHRISTOU 4 | F166: BRAIN 4 | H166: JURGENSTEIN 4 | K166: HEPBURN 3 | N166: P RYAN | P166: ROULSTON
A167: SPRINGVALE | C167: CARROLL 5 | F167: CADDAYE 3 | I167: FREEMAN 3 | K167: COOK | M167: ANDERSON | P167: GILES | R167: WARNER | U167: JACOB
A169: MORDIALLOC | C169: 4 | D169: 2 | E169: =C169*6+D169 -> 26 | G169: 7 | H169: 8 | I169: =G169*6+H169 -> 50 | K169: 7 | L169: 11 | M169: =K169*6+L169 -> 53 | O169: 14 | P169: 13 | Q169: =O169*6+P169 -> 97 | S169: MORDIALLOC
A170: CAULFIELD | C170: 4 | D170: 2 | E170: =C170*6+D170 -> 26 | G170: 7 | H170: 5 | I170: =G170*6+H170 -> 47 | K170: 9 | L170: 7 | M170: =K170*6+L170 -> 61 | O170: 11 | P170: 9 | Q170: =O170*6+P170 -> 75 | S170: BUDGE/STEERE
A171: BEST PLAYERS
A172: MORDIALLOC | C172: WALSH | F172: PETER BARDOEL | J172: PARKER | L172: LANG | O172: BALSANIRI
A173: CAULFIELD | C173: PEARCE | F173: MACLENNAN | J173: BOOTH | L173: O'BRIEN | O173: HOGAN
A174: GOALKICKERS
A175: MORDIALLOC | C175: PETER BARDOEL 4 | G175: PARKER 3 | I175: PAGNOCCOLO 2 | L175: O'HANLON | N175: McILWRAITH | Q175: WALSH | S175: BOURNE | V175: DEATON
A176: CAULFIELD | C176: BLAKE 2 | E176: AMBLER | G176: BOOTH | I176: DUNCAN | K176: MACLENNAN | N176: MORRISON | Q176: O'BRIEN | S176: PEARCE | V176: SAUNDERS | X176: SCOTT
A178: KILSYTH | C178: 5 | D178: 6 | E178: =C178*6+D178 -> 36 | G178: 6 | H178: 9 | I178: =G178*6+H178 -> 45 | K178: 10 | L178: 15 | M178: =K178*6+L178 -> 75 | O178: 11 | P178: 17 | Q178: =O178*6+P178 -> 83 | S178: KILSYTH
A179: YARRAVILLE | C179: 3 | D179: 3 | E179: =C179*6+D179 -> 21 | G179: 7 | H179: 5 | I179: =G179*6+H179 -> 47 | K179: 8 | L179: 7 | M179: =K179*6+L179 -> 55 | O179: 12 | P179: 7 | Q179: =O179*6+P179 -> 79 | S179: GROOM/TORNEY
A180: BEST PLAYERS
A181: KILSYTH | C181: BYRNE | F181: HICKLETON | I181: ELLIOTT | L181: ROHDE | O181: HODGES | R181: SHEPPARD
A182: YARRAVILLE | C182: COOKE | F182: McGHIE | I182: SHARP | L182: BROWN | O182: PHELAN | R182: GRAY
A183: GOALKICKERS
A184: KILSYTH | C184: HICKLETON 4 | F184: FINNIS | H184: HALBERT | J184: HODGES | L184: LETTS | N184: LINNELL | P184: ROHDE | R184: SHEPPARD
A185: YARRAVILLE | C185: GRAY 4 | F185: LEITCH 3 | H185: ROGOZIC 2 | J185: LOBAZZA | M185: McGHIE | O185: BRENNAN
A187: BOX HILL | C187: 5 | D187: 3 | E187: =C187*6+D187 -> 33 | G187: 7 | H187: 7 | I187: =G187*6+H187 -> 49 | K187: 12 | L187: 7 | M187: =K187*6+L187 -> 79 | O187: 17 | P187: 13 | Q187: =O187*6+P187 -> 115 | S187: SUNSHINE
A188: SUNSHINE | C188: 2 | D188: 3 | E188: =C188*6+D188 -> 15 | G188: 6 | H188: 9 | I188: =G188*6+H188 -> 45 | K188: 10 | L188: 14 | M188: =K188*6+L188 -> 74 | O188: 14 | P188: 17 | Q188: =O188*6+P188 -> 101 | S188: GRIFFITH/ALLSOP
A189: BEST PLAYERS
A190: BOX HILL | C190: RICH | F190: CRUSE | I190: WITNISH | L190: LAWTHER | O190: LENNOX | R190: DICKENSON
A191: SUNSHINE | C191: GAY | F191: BARLOW | I191: HOLLOW | L191: WILLIAMS | O191: HUNT
A192: GOALKICKERS
A193: BOX HILL | C193: McKECHNIE 4 | F193: DICKENSON 2 | I193: CRUSE 2 | K193: RICH 2 | M193: GOODEN 2 | O193: MOORE 2 | Q193: KAINEY | S193: McKENZIE | V193: CHARLES
A194: SUNSHINE | C194: WILLIAMS 5 | F194: WAGLAND 2 | I194: N MENADUE | L194: B MENADUE | O194: BARLOW | Q194: FOLEY | S194: RICHARDS | V194: HOLLOW | X194: GAY
A196: ROUND 5 | E196: 2ND MAY | J196: WEATHER | S196: PLAYED AT
D197: 1ST QTR | H197: 2ND QTR | L197: 3RD QTR | P197: FINAL | S197: BRUNSWICK
A198: NORTHCOTE | C198: 2 | D198: 6 | E198: =C198*6+D198 -> 18 | G198: 4 | H198: 11 | I198: =G198*6+H198 -> 35 | K198: 11 | L198: 17 | M198: =K198*6+L198 -> 83 | O198: 17 | P198: 20 | Q198: =O198*6+P198 -> 122 | S198: UMPIRE | X198: LADDER | AB198: ROUND | AD198: 5
A199: BRUNSWICK | C199: 2 | D199: 4 | E199: =C199*6+D199 -> 16 | G199: 6 | H199: 8 | I199: =G199*6+H199 -> 44 | K199: 9 | L199: 11 | M199: =K199*6+L199 -> 65 | O199: 13 | P199: 14 | Q199: =O199*6+P199 -> 92 | S199: CASEY/STABB
A200: BEST PLAYERS | W200: TEAM | X200: W | Y200: L | Z200: D | AA200: FOR | AB200: AGST | AC200: % | AD200: PTS
A201: NORTHCOTE | C201: McQUINN | F201: GRAHAM | I201: JIM CHRISTOU | L201: DILORIO | O201: REDENBACH | R201: LEE
A202: BRUNSWICK | C202: LYNCH | F202: LEAHY | I202: CALLENDER | L202: SCULLY | O202: JUDGE | W202: OAKLEIGH | X202: 5 | Y202: 0 | Z202: 0 | AA202: 827 | AB202: 402 | AC202: =(AA202*100)/AB202 -> 205.72139303482587 | AD202: =(X202*4)+(Z202*2) -> 20
A203: GOALKICKERS | W203: NORTHCOTE | X203: 5 | Y203: 0 | Z203: 0 | AA203: 734 | AB203: 492 | AC203: =(AA203*100)/AB203 -> 149.1869918699187 | AD203: =(X203*4)+(Z203*2) -> 20
A204: NORTHCOTE | C204: JIM CHRISTOU 5 | G204: P RYAN 4 | J204: BRAIN 3 | L204: HEPBURN 2 | N204: M RYAN | P204: JURGENSTEIN | S204: MEGNA | W204: MORDIALLOC | X204: 3 | Y204: 2 | Z204: 0 | AA204: 717 | AB204: 531 | AC204: =(AA204*100)/AB204 -> 135.02824858757063 | AD204: =(X204*4)+(Z204*2) -> 12
A205: BRUNSWICK | C205: SAGGERS 3 | E205: ANDERSON 3 | H205: JUDGE 2 | J205: LEAHY | L205: LYNCH | N205: NOLAN | P205: PASTRAS | R205: SAHLBERG | W205: SPRINGVALE | X205: 3 | Y205: 2 | Z205: 0 | AA205: 775 | AB205: 586 | AC205: =(AA205*100)/AB205 -> 132.25255972696246 | AD205: =(X205*4)+(Z205*2) -> 12
A207: OAKLEIGH | C207: 5 | D207: 2 | E207: =C207*6+D207 -> 32 | G207: 12 | H207: 4 | I207: =G207*6+H207 -> 76 | K207: 19 | L207: 7 | M207: =K207*6+L207 -> 121 | O207: 23 | P207: 15 | Q207: =O207*6+P207 -> 153 | S207: BOX HILL | W207: BRUNSWICK | X207: 3 | Y207: 2 | Z207: 0 | AA207: 715 | AB207: 580 | AC207: =(AA207*100)/AB207 -> 123.27586206896552 | AD207: =(X207*4)+(Z207*2) -> 12
A208: BOX HILL | C208: 5 | D208: 4 | E208: =C208*6+D208 -> 34 | G208: 8 | H208: 7 | I208: =G208*6+H208 -> 55 | K208: 11 | L208: 13 | M208: =K208*6+L208 -> 79 | O208: 15 | P208: 16 | Q208: =O208*6+P208 -> 106 | S208: PETRIE | W208: CAULFIELD | X208: 2 | Y208: 3 | Z208: 0 | AA208: 648 | AB208: 730 | AC208: =(AA208*100)/AB208 -> 88.767123287671239 | AD208: =(X208*4)+(Z208*2) -> 8
A209: BEST PLAYERS | S209: PHILLIPS | W209: BOX HILL | X209: 2 | Y209: 3 | Z209: 0 | AA209: 567 | AB209: 702 | AC209: =(AA209*100)/AB209 -> 80.769230769230774 | AD209: =(X209*4)+(Z209*2) -> 8
A210: OAKLEIGH | C210: HILLIARD | F210: NEARY | I210: COLLINS | L210: ROACH | O210: AERTSSEN | R210: GREENWOOD | W210: KILSYTH | X210: 1 | Y210: 4 | Z210: 0 | AA210: 475 | AB210: 636 | AC210: =(AA210*100)/AB210 -> 74.685534591194966 | AD210: =(X210*4)+(Z210*2) -> 4
A211: BOX HILL | C211: RICH | F211: A DICKENSON | I211: CRUSE | L211: KIKER | O211: P WITNISH | R211: MOORE | W211: SUNSHINE | X211: 1 | Y211: 4 | Z211: 0 | AA211: 599 | AB211: 1069 | AC211: =(AA211*100)/AB211 -> 56.033676333021518 | AD211: =(X211*4)+(Z211*2) -> 4
A212: GOALKICKERS | P212: COLLINS | W212: YARRAVILLE | X212: 0 | Y212: 5 | Z212: 0 | AA212: 460 | AB212: 823 | AC212: =(AA212*100)/AB212 -> 55.893074119076552 | AD212: =(X212*4)+(Z212*2) -> 0
A213: OAKLEIGH | C213: NEARY 7 | F213: HIGGINS 6 | I213: AERTTSEN 3 | L213: TODD 2 | N213: McDONALD 2 | Q213: CARTER | S213: CALLERY
A214: BOX HILL | C214: MOORE 5 | E214: RICH 3 | G214: CRUSE 2 | I214: A DICKENSON 2 | L214: CHARLES | N214: LAWTHER | Q214: SCHADE
A216: MORDIALLOC | C216: 5 | D216: 5 | E216: =C216*6+D216 -> 35 | G216: 22 | H216: 7 | I216: =G216*6+H216 -> 139 | K216: 27 | L216: 12 | M216: =K216*6+L216 -> 174 | O216: 37 | P216: 17 | Q216: =O216*6+P216 -> 239 | S216: MORDIALLOC
A217: SUNSHINE | C217: 5 | D217: 2 | E217: =C217*6+D217 -> 32 | G217: 6 | H217: 2 | I217: =G217*6+H217 -> 38 | K217: 9 | L217: 3 | M217: =K217*6+L217 -> 57 | O217: 11 | P217: 5 | Q217: =O217*6+P217 -> 71 | S217: RYAN/THOMSON
A218: BEST PLAYERS
A219: MORDIALLOC | C219: PAGNOCCOLO | F219: MASON | I219: PETER BARDOEL | L219: O'HANLON | O219: DEATON | R219: NICHOLAIDES
A220: SUNSHINE | C220: SIMPSON | F220: HUNT | I220: HOLLOW | L220: WAGLAND | O220: MENADUE
A221: GOALKICKERS
A222: MORDIALLOC | C222: PETER BARDOEL 14 | G222: O'HANLON 6 | J222: PAGNOCCOLO 4 | M222: NICHOLAIDES 4 | P222: WATTERS 3 | S222: BROMLEY 2 | V222: ENBOM 2 | X222: WALSH | Z222: PAUL BARDOEL
A223: SUNSHINE | C223: HOLDEN 2 | F223: AXON 2 | H223: WAGLAND | K223: JONES | M223: WILLIAMS | O223: RICHARDS | R223: LYON | T223: HOLLOW | V223: CHATTERTON
A225: CAULFIELD | C225: 7 | D225: 4 | E225: =C225*6+D225 -> 46 | G225: 12 | H225: 13 | I225: =G225*6+H225 -> 85 | K225: 22 | L225: 19 | M225: =K225*6+L225 -> 151 | O225: 25 | P225: 22 | Q225: =O225*6+P225 -> 172 | S225: YARRAVILLE
A226: YARRAVILLE | C226: 1 | D226: 1 | E226: =C226*6+D226 -> 7 | G226: 4 | H226: 4 | I226: =G226*6+H226 -> 28 | K226: 5 | L226: 4 | M226: =K226*6+L226 -> 34 | O226: 9 | P226: 10 | Q226: =O226*6+P226 -> 64 | S226: BRADSHAW/BLOOM
A227: BEST PLAYERS
A228: CAULFIELD | C228: BOOTH | F228: MORRISON | I228: O'BRIEN | L228: BLAKE | O228: PEARCE | R228: BAILEY
A229: YARRAVILLE | C229: McGHIE | F229: LEITCH | I229: PHELAN | L229: BROWN | O229: SCOTT | R229: RYAN
A230: GOALKICKERS
A231: CAULFIELD | C231: BLAKE 5 | F231: BOOTH 5 | H231: O'BRIEN 5 | J231: AMBLER 3 | L231: PEARCE 2 | N231: DUNCAN 2 | Q231: BAILEY | S231: MORRISON
A232: YARRAVILLE | C232: DIMASI 4 | F232: PHELAN 2 | I232: McGHIE | K232: RYAN | M232: BROWN
A234: SPRINGVALE | C234: 3 | D234: 3 | E234: =C234*6+D234 -> 21 | G234: 10 | H234: 10 | I234: =G234*6+H234 -> 70 | K234: 14 | L234: 16 | M234: =K234*6+L234 -> 100 | O234: 23 | P234: 22 | Q234: =O234*6+P234 -> 160 | S234: NEWCOMEN RD
A235: KILSYTH | C235: 3 | D235: 5 | E235: =C235*6+D235 -> 23 | G235: 5 | H235: 10 | I235: =G235*6+H235 -> 40 | K235: 8 | L235: 13 | M235: =K235*6+L235 -> 61 | O235: 11 | P235: 16 | Q235: =O235*6+P235 -> 82 | S235: STEERE/BUDGE
A236: BEST PLAYERS
A237: SPRINGVALE | C237: BRAND | F237: WOODMAN | I237: SMITH | L237: CADDAYE | O237: CARROLL | R237: FREEMAN
A238: KILSYTH | C238: LINNELL | F238: LETTS | I238: PETERSON | L238: HODGES | O238: SCHNEIDER | R238: BYRNE
A239: GOALKICKERS
A240: SPRINGVALE | C240: CARROLL 8 | F240: PINNELL 3 | H240: NEWMAN 2 | K240: ANDERSON 2 | N240: FOTINIOTIS 2 | Q240: FREEMAN 2 | S240: JACOBS 2 | V240: TONKIN | X240: CADDAYE
A241: KILSYTH | C241: LETTS 6 | F241: HICKLETON 2 | I241: BIANCO | K241: HODGES | M241: ROSSER
A243: ROUND 6 | E243: 9TH MAY | J243: WEATHER | S243: PLAYED AT
D244: 1ST QTR | H244: 2ND QTR | L244: 3RD QTR | P244: FINAL | S244: OAKLEIGH
A245: OAKLEIGH | C245: 11 | D245: 8 | E245: =C245*6+D245 -> 74 | G245: 24 | H245: 10 | I245: =G245*6+H245 -> 154 | K245: 35 | L245: 15 | M245: =K245*6+L245 -> 225 | O245: 40 | P245: 22 | Q245: =O245*6+P245 -> 262 | S245: UMPIRE | X245: LADDER | AB245: ROUND | AD245: 6
A246: SUNSHINE | C246: 0 | D246: 4 | E246: =C246*6+D246 -> 4 | G246: 1 | H246: 9 | I246: =G246*6+H246 -> 15 | K246: 5 | L246: 11 | M246: =K246*6+L246 -> 41 | O246: 10 | P246: 14 | Q246: =O246*6+P246 -> 74 | S246: BRADSHAW/STEERE
A247: BEST PLAYERS | W247: TEAM | X247: W | Y247: L | Z247: D | AA247: FOR | AB247: AGST | AC247: % | AD247: PTS
A248: OAKLEIGH | C248: C HEVERIN | F248: HIGGINS | I248: NEARY | L248: AERTSSEN | O248: COLLINS
A249: SUNSHINE | C249: GORE | F249: WILLIAMS | I249: HUNT | L249: VADJNAL | O249: SOPEOWZIS | W249: OAKLEIGH | X249: 6 | Y249: 0 | Z249: 0 | AA249: 1089 | AB249: 476 | AC249: =(AA249*100)/AB249 -> 228.78151260504202 | AD249: =(X249*4)+(Z249*2) -> 24
A250: GOALKICKERS | N250: HILLIARD | Q250: McDONALD | W250: NORTHCOTE | X250: 6 | Y250: 0 | Z250: 0 | AA250: 879 | AB250: 606 | AC250: =(AA250*100)/AB250 -> 145.04950495049505 | AD250: =(X250*4)+(Z250*2) -> 24
A251: OAKLEIGH | C251: AERTSSEN 9 | F251: HIGGINS 9 | H251: NEARY 7 | J251: COLLINS 5 | L251: ROACH 4 | N251: GREENWOOD | Q251: TODD | S251: CARTER | U251: HARPER | W251: MORDIALLOC | X251: 4 | Y251: 2 | Z251: 0 | AA251: 840 | AB251: 622 | AC251: =(AA251*100)/AB251 -> 135.04823151125402 | AD251: =(X251*4)+(Z251*2) -> 16
A252: SUNSHINE | C252: GAY 2 | E252: WILLIAMS 2 | H252: MITCHELL 2 | K252: BARLOW | M252: MENADUE | O252: HENLEY | Q252: CHATTERTTON | W252: SPRINGVALE | X252: 3 | Y252: 3 | Z252: 0 | AA252: 874 | AB252: 706 | AC252: =(AA252*100)/AB252 -> 123.79603399433428 | AD252: =(X252*4)+(Z252*2) -> 12
A254: NORTHCOTE | C254: 5 | D254: 5 | E254: =C254*6+D254 -> 35 | G254: 7 | H254: 9 | I254: =G254*6+H254 -> 51 | K254: 16 | L254: 16 | M254: =K254*6+L254 -> 112 | O254: 21 | P254: 19 | Q254: =O254*6+P254 -> 145 | S254: NORTHCOTE | W254: BRUNSWICK | X254: 3 | Y254: 3 | Z254: 0 | AA254: 823 | AB254: 712 | AC254: =(AA254*100)/AB254 -> 115.58988764044943 | AD254: =(X254*4)+(Z254*2) -> 12
A255: BOX HILL | C255: 2 | D255: 3 | E255: =C255*6+D255 -> 15 | G255: 8 | H255: 11 | I255: =G255*6+H255 -> 59 | K255: 12 | L255: 14 | M255: =K255*6+L255 -> 86 | O255: 16 | P255: 18 | Q255: =O255*6+P255 -> 114 | S255: BUDGE | W255: CAULFIELD | X255: 3 | Y255: 3 | Z255: 0 | AA255: 768 | AB255: 829 | AC255: =(AA255*100)/AB255 -> 92.641737032569367 | AD255: =(X255*4)+(Z255*2) -> 12
A256: BEST PLAYERS | S256: RYAN | W256: KILSYTH | X256: 2 | Y256: 4 | Z256: 0 | AA256: 607 | AB256: 744 | AC256: =(AA256*100)/AB256 -> 81.586021505376351 | AD256: =(X256*4)+(Z256*2) -> 8
A257: NORTHCOTE | C257: M RYAN | E257: JOHN CHRISTOU | I257: MEGNA | L257: HEPBURN | O257: GRAHAM | W257: BOX HILL | X257: 2 | Y257: 4 | Z257: 0 | AA257: 681 | AB257: 847 | AC257: =(AA257*100)/AB257 -> 80.401416765053128 | AD257: =(X257*4)+(Z257*2) -> 8
A258: BOX HILL | C258: WITNISH | F258: CONNOLLY | I258: KIKER | L258: MOORE | O258: GLEESON | R258: LAWTHER | W258: SUNSHINE | X258: 1 | Y258: 5 | Z258: 0 | AA258: 673 | AB258: 1331 | AC258: =(AA258*100)/AB258 -> 50.563486100676187 | AD258: =(X258*4)+(Z258*2) -> 4
A259: GOALKICKERS | W259: YARRAVILLE | X259: 0 | Y259: 6 | Z259: 0 | AA259: 551 | AB259: 946 | AC259: =(AA259*100)/AB259 -> 58.245243128964056 | AD259: =(X259*4)+(Z259*2) -> 0
A260: NORTHCOTE | C260: HEPBURN 7 | F260: JURGENSTEIN 3 | I260: JIM CHRISTOU 3 | L260: BRAIN 2 | N260: P RYAN 2 | P260: MEGNA 2 | R260: LEIGH | S260: KAIPAKIS
A261: BOX HILL | C261: MOORE 6 | F261: WITHERS 4 | I261: LAWTHER 2 | L261: SCHADE | N261: KELLY | P261: DICKENSON | S261: GLEESON
A263: KILSYTH | C263: 7 | D263: 2 | E263: =C263*6+D263 -> 44 | G263: 9 | H263: 6 | I263: =G263*6+H263 -> 60 | K263: 13 | L263: 11 | M263: =K263*6+L263 -> 89 | O263: 20 | P263: 12 | Q263: =O263*6+P263 -> 132 | S263: KILSYTH
A264: BRUNSWICK | C264: 2 | D264: 3 | E264: =C264*6+D264 -> 15 | G264: 5 | H264: 6 | I264: =G264*6+H264 -> 36 | K264: 9 | L264: 9 | M264: =K264*6+L264 -> 63 | O264: 16 | P264: 12 | Q264: =O264*6+P264 -> 108 | S264: PHILLIPS/MAY
A265: BEST PLAYERS
A266: KILSYTH | C266: HICKLETON | F266: HALBERT | I266: LINNELL | L266: CHIBLEY | O266: GIBB | S266: PETERSON
A267: BRUNSWICK | C267: LEAHY | F267: SCULLY | I267: JUDGE | L267: BROWN | O267: DOYLE | S267: SAHLBERG
A268: GOALKICKERS
A269: KILSYTH | C269: LETTS 5 | E269: HICKLETON 4 | H269: HALBERT 3 | J269: CHIBLEY 2 | M269: HODGES 2 | O269: ELLIOTT | Q269: GIBB | S269: PETERSON | V269: ROHDE
A270: BRUNSWICK | C270: BROWN 3 | E270: CANNARD 3 | H270: JUDGE 3 | J270: SAHLBERG 2 | M270: LYNCH | O270: LEAHY | Q270: NOLAN | S270: PATON | V270: RADCHENKO
A272: CAULFIELD | C272: 6 | D272: 2 | E272: =C272*6+D272 -> 38 | G272: 8 | H272: 8 | I272: =G272*6+H272 -> 56 | K272: 11 | L272: 10 | M272: =K272*6+L272 -> 76 | O272: 18 | P272: 12 | Q272: =O272*6+P272 -> 120 | S272: PRINCES PARK, CAULFIELD
A273: SPRINGVALE | C273: 3 | D273: 5 | E273: =C273*6+D273 -> 23 | G273: 4 | H273: 11 | I273: =G273*6+H273 -> 35 | K273: 10 | L273: 12 | M273: =K273*6+L273 -> 72 | O273: 14 | P273: 15 | Q273: =O273*6+P273 -> 99 | S273: PODESTA/THOMSON
A274: BEST PLAYERS
A275: CAULFIELD | C275: MORRISON | F275: TUCKWELL | I275: EINSEDEL | L275: AMBLER | O275: PEARCE
A276: SPRINGVALE | C276: BRAND | F276: WOODMAN | I276: SMITH | L276: GOODINGHAM | O276: McCOMB | R276: WARNER
A277: GOALKICKERS
A278: CAULFIELD | C278: PEARCE 5 | F278: BLAKE 4 | H278: BOOTH 4 | J278: GALLERIE 2 | M278: MORRISON | O278: O'BRIEN | Q278: McLENNAN
A279: SPRINGVALE | C279: CARROLL 4 | F279: SMITH 3 | H279: BRAND 2 | J279: ANDERSON | M279: PINNELL | O279: CADDAYE | R279: JACOBS
A281: MORDIALLOC | C281: 3 | D281: 3 | E281: =C281*6+D281 -> 21 | G281: 8 | H281: 5 | I281: =G281*6+H281 -> 53 | K281: 12 | L281: 11 | M281: =K281*6+L281 -> 83 | O281: 17 | P281: 21 | Q281: =O281*6+P281 -> 123 | S281: YARRAVILLE
A282: YARRAVILLE | C282: 5 | D282: 6 | E282: =C282*6+D282 -> 36 | G282: 9 | H282: 8 | I282: =G282*6+H282 -> 62 | K282: 12 | L282: 12 | M282: =K282*6+L282 -> 84 | O282: 13 | P282: 13 | Q282: =O282*6+P282 -> 91 | S282: GOLLOP/PETRIE
A283: BEST PLAYERS
A284: MORDIALLOC | C284: PAGNOCCOLO | F284: DUNBAR | I284: MASON | L284: DEATON | O284: BALSARINI | R284: BROMLEY
A285: YARRAVILLE | C285: PHELAN | F285: McGHIE | I285: LEITCH | L285: SQUIRE | O285: MARTIN | R285: COOKE
A286: GOALKICKERS
A287: MORDIALLOC | C287: PAGNOCCOLO 7 | F287: BATTY 2 | H287: LEWIS 2 | J287: WALSH 2 | L287: O'HANLON | O287: PETER BARDOEL | S287: DEATON | U287: PAUL BARDOEL
A288: YARRAVILLE | C288: McGHIE 3 | E288: DIMASI 2 | G288: MARTIN 2 | J288: ROGOTOWICZ 2 | M288: M PHELAN | O288: SQUIRE | Q288: BROWN | S288: HYLAND
A290: ROUND 7 | E290: 16TH MAY | J290: WEATHER | S290: PLAYED AT
D291: 1ST QTR | H291: 2ND QTR | L291: 3RD QTR | P291: FINAL | S291: MORDIALLOC
A292: OAKLEIGH | C292: 3 | D292: 5 | E292: =C292*6+D292 -> 23 | G292: 6 | H292: 8 | I292: =G292*6+H292 -> 44 | K292: 14 | L292: 11 | M292: =K292*6+L292 -> 95 | O292: 21 | P292: 17 | Q292: =O292*6+P292 -> 143 | S292: UMPIRE | X292: LADDER | AB292: ROUND | AD292: 7
A293: MORDIALLOC | C293: 5 | D293: 1 | E293: =C293*6+D293 -> 31 | G293: 6 | H293: 3 | I293: =G293*6+H293 -> 39 | K293: 7 | L293: 5 | M293: =K293*6+L293 -> 47 | O293: 12 | P293: 10 | Q293: =O293*6+P293 -> 82 | S293: BLOOM/DAY
A294: BEST PLAYERS | W294: TEAM | X294: W | Y294: L | Z294: D | AA294: FOR | AB294: AGST | AC294: % | AD294: PTS
A295: OAKLEIGH | C295: CARTER | F295: SPLATT | I295: AERTTSEN | L295: MATTHEY | O295: McDONALD | R295: ROURKE
A296: MORDIALLOC | C296: DUNBAR | F296: DEATON | I296: ENBOM | L296: BROMLEY | W296: OAKLEIGH | X296: 7 | Y296: 0 | Z296: 0 | AA296: 1232 | AB296: 558 | AC296: =(AA296*100)/AB296 -> 220.78853046594983 | AD296: =(X296*4)+(Z296*2) -> 28
A297: GOALKICKERS | P297: COLLINS | W297: NORTHCOTE | X297: 7 | Y297: 0 | Z297: 0 | AA297: 1071 | AB297: 661 | AC297: =(AA297*100)/AB297 -> 162.02723146747351 | AD297: =(X297*4)+(Z297*2) -> 28
A298: OAKLEIGH | C298: AERTSSEN 7 | F298: HIGGINS 3 | H298: McDONALD 3 | K298: CASAMENTO 2 | N298: HILLIARD 2 | P298: ROACH | R298: HARPER | T298: NEARY | W298: SPRINGVALE | X298: 4 | Y298: 3 | Z298: 0 | AA298: 1106 | AB298: 795 | AC298: =(AA298*100)/AB298 -> 139.11949685534591 | AD298: =(X298*4)+(Z298*2) -> 16
A299: MORDIALLOC | C299: PETER BARDOEL 3 | G299: PAUL BARDOEL 3 | K299: McILWRAITH 2 | N299: BATTY | P299: BOURNE | R299: PAGNOCCOLO | W299: MORDIALLOC | X299: 4 | Y299: 3 | Z299: 0 | AA299: 922 | AB299: 765 | AC299: =(AA299*100)/AB299 -> 120.52287581699346 | AD299: =(X299*4)+(Z299*2) -> 16
L300: WATTERS
A301: NORTHCOTE | C301: 8 | D301: 5 | E301: =C301*6+D301 -> 53 | G301: 12 | H301: 12 | I301: =G301*6+H301 -> 84 | K301: 18 | L301: 20 | M301: =K301*6+L301 -> 128 | O301: 28 | P301: 24 | Q301: =O301*6+P301 -> 192 | S301: SUNSHINE | W301: BRUNSWICK | X301: 4 | Y301: 3 | Z301: 0 | AA301: 905 | AB301: 786 | AC301: =(AA301*100)/AB301 -> 115.13994910941476 | AD301: =(X301*4)+(Z301*2) -> 16
A302: SUNSHINE | C302: 1 | D302: 2 | E302: =C302*6+D302 -> 8 | G302: 3 | H302: 6 | I302: =G302*6+H302 -> 24 | K302: 7 | L302: 11 | M302: =K302*6+L302 -> 53 | O302: 7 | P302: 13 | Q302: =O302*6+P302 -> 55 | S302: THOMSON | W302: CAULFIELD | X302: 3 | Y302: 4 | Z302: 0 | AA302: 842 | AB302: 911 | AC302: =(AA302*100)/AB302 -> 92.425905598243688 | AD302: =(X302*4)+(Z302*2) -> 12
A303: BEST PLAYERS | S303: PETRIE | W303: BOX HILL | X303: 3 | Y303: 4 | Z303: 0 | AA303: 811 | AB303: 962 | AC303: =(AA303*100)/AB303 -> 84.303534303534306 | AD303: =(X303*4)+(Z303*2) -> 12
A304: NORTHCOTE | C304: RYAN | F304: HEPBURN | I304: DILORIOI | L304: McQUINN | O304: REDENBACH | W304: KILSYTH | X304: 2 | Y304: 5 | Z304: 0 | AA304: 722 | AB304: 874 | AC304: =(AA304*100)/AB304 -> 82.608695652173907 | AD304: =(X304*4)+(Z304*2) -> 8
A305: SUNSHINE | C305: MITCHELL | F305: SAPTOUNAZIS | J305: SIMPSON | M305: WILLIAMS | W305: SUNSHINE | X305: 1 | Y305: 6 | Z305: 0 | AA305: 728 | AB305: 1523 | AC305: =(AA305*100)/AB305 -> 47.800393959290872 | AD305: =(X305*4)+(Z305*2) -> 4
A306: GOALKICKERS | N306: JIM CHRISTOU | Q306: ROULSTON | W306: YARRAVILLE | X306: 0 | Y306: 7 | Z306: 0 | AA306: 640 | AB306: 1178 | AC306: =(AA306*100)/AB306 -> 54.329371816638371 | AD306: =(X306*4)+(Z306*2) -> 0
A307: NORTHCOTE | C307: HEPBURN 9 | F307: RYAN 5 | H307: JURGENSTEIN 4 | K307: KALPAKIS 2 | N307: McQUINN 2 | Q307: DILORIO 2 | S307: JOHN CHRISTOU 2
A308: SUNSHINE | C308: FOLEY 4 | F308: GAY 2 | H308: WILLIAMS
A310: BRUNSWICK | C310: 1 | D310: 3 | E310: =C310*6+D310 -> 9 | G310: 4 | H310: 5 | I310: =G310*6+H310 -> 29 | K310: 8 | L310: 11 | M310: =K310*6+L310 -> 59 | O310: 11 | P310: 16 | Q310: =O310*6+P310 -> 82 | S310: BRUNSWICK
A311: CAULFIELD | C311: 0 | D311: 6 | E311: =C311*6+D311 -> 6 | G311: 4 | H311: 12 | I311: =G311*6+H311 -> 36 | K311: 5 | L311: 14 | M311: =K311*6+L311 -> 44 | O311: 9 | P311: 20 | Q311: =O311*6+P311 -> 74 | S311: STEERE/GOLLOP
A312: BEST PLAYERS
A313: BRUNSWICK | C313: SCULLY | F313: SAHLBERG | I313: BROWN | L313: RADCHENKO | O313: CALLENDER | R313: NARDELLA
A314: CAULFIELD | C314: McLEOD | F314: EINSEDEL | I314: FARINSKI | L314: MORRISON | O314: PEARCE
A315: GOALKICKERS
A316: BRUNSWICK | C316: RADCHENKO 4 | F316: HICKMAN 2 | I316: CANNARD | L316: CALLENDER | O316: LYNCH | Q316: NARDELLA | T316: SAGGERS
A317: CAULFIELD | C317: BLAKE 3 | F317: GRIGG 2 | I317: TAYLOR | L317: AMBLER | N317: BOOTH | P317: DUNCAN
A319: BOX HILL | C319: 5 | D319: 5 | E319: =C319*6+D319 -> 35 | G319: 10 | H319: 12 | I319: =G319*6+H319 -> 72 | K319: 15 | L319: 16 | M319: =K319*6+L319 -> 106 | O319: 18 | P319: 22 | Q319: =O319*6+P319 -> 130 | S319: BOX HILL
A320: KILSYTH | C320: 6 | D320: 5 | E320: =C320*6+D320 -> 41 | G320: 8 | H320: 6 | I320: =G320*6+H320 -> 54 | K320: 12 | L320: 11 | M320: =K320*6+L320 -> 83 | O320: 17 | P320: 13 | Q320: =O320*6+P320 -> 115 | S320: PODESTA/HUTCHINSON
A321: BEST PLAYERS
A322: BOX HILL | C322: S WITNISH | F322: R WITNISH | I322: P WITNISH | L322: KIKER | N322: SCHADE | Q322: LENNOX
A323: KILSYTH | C323: HODGES | F323: HICKLETON | I323: ELLIOTT | L323: GIBB | N323: LINNELL | Q323: LETTS
A324: GOALKICKERS
A325: BOX HILL | C325: SCHADE 4 | F325: CRUSE 4 | H325: A DICKENSON 3 | K325: WITHERS 2 | N325: RICH 2 | P325: LAWTHER 2 | S325: KYLE
A326: KILSYTH | C326: HICKLETON 7 | F326: GIBB 2 | H326: BIANCO | J326: BRYANT | L326: ELLIOTT | N326: HALBERT | P326: HODGES | R326: LETTS | T326: PETERSON | W326: CHIBLEY
A328: SPRINGVALE | C328: 7 | D328: 5 | E328: =C328*6+D328 -> 47 | G328: 15 | H328: 8 | I328: =G328*6+H328 -> 98 | K328: 23 | L328: 9 | M328: =K328*6+L328 -> 147 | O328: 37 | P328: 10 | Q328: =O328*6+P328 -> 232 | S328: NEWCOMEN RD
A329: YARRAVILLE | C329: 3 | D329: 2 | E329: =C329*6+D329 -> 20 | G329: 4 | H329: 8 | I329: =G329*6+H329 -> 32 | K329: 7 | L329: 12 | M329: =K329*6+L329 -> 54 | O329: 12 | P329: 17 | Q329: =O329*6+P329 -> 89 | S329: TORNEY/PHILLIPS
A330: BEST PLAYERS
A331: SPRINGVALE | C331: CARROLL | F331: FREEMAN | I331: SMITH | K331: BRAND | N331: MORRIS | Q331: CADDAYE
A332: YARRAVILLE | C332: MARTIN | F332: PHELAN | I332: McGHIE | K332: SQUIRE | N332: DAVIS | Q332: LEITCH
A333: GOALKICKERS
A334: SPRINGVALE | C334: CARROLL 14 | F334: SMITH 6 | H334: CADDAYE 6 | K334: FREEMAN 3 | N334: JACOBS 2 | P334: BRAND 2 | R334: ANDERSON 2 | U334: COOKE | W334: FOTINIOTIS
A335: YARRAVILLE | C335: SMITH 5 | F335: MARTIN 2 | I335: CAMPAGNA 2 | L335: TUPPON | N335: LEITCH | P335: SQUIRE
A337: ROUND 8 | E337: 23RD MAY | J337: WEATHER | S337: PLAYED AT
D338: 1ST QTR | H338: 2ND QTR | L338: 3RD QTR | P338: FINAL | S338: NORTHCOTE
A339: OAKLEIGH | C339: 2 | D339: 5 | E339: =C339*6+D339 -> 17 | G339: 3 | H339: 13 | I339: =G339*6+H339 -> 31 | K339: 11 | L339: 15 | M339: =K339*6+L339 -> 81 | O339: 20 | P339: 21 | Q339: =O339*6+P339 -> 141 | S339: UMPIRE | X339: LADDER | AB339: ROUND | AD339: 8
A340: NORTHCOTE | C340: 6 | D340: 8 | E340: =C340*6+D340 -> 44 | G340: 9 | H340: 11 | I340: =G340*6+H340 -> 65 | K340: 15 | L340: 15 | M340: =K340*6+L340 -> 105 | O340: 17 | P340: 18 | Q340: =O340*6+P340 -> 120 | S340: ALLSOP/GOLLOP
A341: BEST PLAYERS | W341: TEAM | X341: W | Y341: L | Z341: D | AA341: FOR | AB341: AGST | AC341: % | AD341: PTS
A342: OAKLEIGH | C342: SPLATT | F342: ROACH | I342: TODD | L342: GREENWOOD | O342: HARPER | R342: McDONALD
A343: NORTHCOTE | C343: M RYAN | F343: JOHN CHRISTOU | J343: JURGENSTEIN | M343: DILORIO | O343: BRAIN | R343: JIM CHRISTOU | W343: OAKLEIGH | X343: 8 | Y343: 0 | Z343: 0 | AA343: 1373 | AB343: 678 | AC343: =(AA343*100)/AB343 -> 202.50737463126845 | AD343: =(X343*4)+(Z343*2) -> 32
A344: GOALKICKERS | O344: NEARY | W344: NORTHCOTE | X344: 7 | Y344: 1 | Z344: 0 | AA344: 1191 | AB344: 802 | AC344: =(AA344*100)/AB344 -> 148.50374064837905 | AD344: =(X344*4)+(Z344*2) -> 28
A345: OAKLEIGH | C345: AERTSSEN 7 | F345: HIGGINS 2 | H345: GREENWOOD 2 | K345: McDONALD 2 | N345: MATTHEY 2 | Q345: COLLINS 2 | S345: HARPER | U345: TODD | W345: SPRINGVALE | X345: 5 | Y345: 3 | Z345: 0 | AA345: 1269 | AB345: 918 | AC345: =(AA345*100)/AB345 -> 138.23529411764707 | AD345: =(X345*4)+(Z345*2) -> 20
A346: NORTHCOTE | C346: JURGENSTEIN 7 | G346: BRAIN 4 | J346: JIM CHRISTOU 4 | N346: HEPBURN | P346: TAIRI | W346: BRUNSWICK | X346: 5 | Y346: 3 | Z346: 0 | AA346: 1124 | AB346: 830 | AC346: =(AA346*100)/AB346 -> 135.42168674698794 | AD346: =(X346*4)+(Z346*2) -> 20
A348: BRUNSWICK | C348: 8 | D348: 5 | E348: =C348*6+D348 -> 53 | G348: 18 | H348: 6 | I348: =G348*6+H348 -> 114 | K348: 25 | L348: 16 | M348: =K348*6+L348 -> 166 | O348: 33 | P348: 21 | Q348: =O348*6+P348 -> 219 | S348: YARRAVILLE | W348: MORDIALLOC | X348: 4 | Y348: 4 | Z348: 0 | AA348: 1045 | AB348: 928 | AC348: =(AA348*100)/AB348 -> 112.60775862068965 | AD348: =(X348*4)+(Z348*2) -> 16
A349: YARRAVILLE | C349: 2 | D349: 1 | E349: =C349*6+D349 -> 13 | G349: 4 | H349: 6 | I349: =G349*6+H349 -> 30 | K349: 5 | L349: 6 | M349: =K349*6+L349 -> 36 | O349: 6 | P349: 8 | Q349: =O349*6+P349 -> 44 | S349: THOMSON | W349: CAULFIELD | X349: 4 | Y349: 4 | Z349: 0 | AA349: 1005 | AB349: 1014 | AC349: =(AA349*100)/AB349 -> 99.112426035502963 | AD349: =(X349*4)+(Z349*2) -> 16
A350: BEST PLAYERS | S350: HUTCHINSON | W350: KILSYTH | X350: 3 | Y350: 5 | Z350: 0 | AA350: 883 | AB350: 960 | AC350: =(AA350*100)/AB350 -> 91.979166666666671 | AD350: =(X350*4)+(Z350*2) -> 12
A351: BRUNSWICK | C351: SAGGERS | F351: RADCHENKO | I351: LYNCH | L351: CALLENDER | O351: BAKER | R351: SAHLBERG | W351: BOX HILL | X351: 3 | Y351: 5 | Z351: 0 | AA351: 914 | AB351: 1125 | AC351: =(AA351*100)/AB351 -> 81.24444444444444 | AD351: =(X351*4)+(Z351*2) -> 12
A352: YARRAVILLE | C352: RYAN | F352: LEITCH | I352: WARD | L352: S McGHIE | O352: W McGHIE | W352: SUNSHINE | X352: 1 | Y352: 7 | Z352: 0 | AA352: 814 | AB352: 1684 | AC352: =(AA352*100)/AB352 -> 48.337292161520189 | AD352: =(X352*4)+(Z352*2) -> 4
A353: GOALKICKERS | L353: LEAHY 2 | N353: NOLAN 2 | P353: CALLENDER | S353: TOY | W353: YARRAVILLE | X353: 0 | Y353: 8 | Z353: 0 | AA353: 684 | AB353: 1397 | AC353: =(AA353*100)/AB353 -> 48.96206156048676 | AD353: =(X353*4)+(Z353*2) -> 0
A354: BRUNSWICK | C354: SAGGERS 7 | F354: HICKMAN 4 | I354: LYNCH 4 | K354: RADCHENKO 4 | N354: SAHLBERG 3 | Q354: NARDELLA 3 | S354: ANDERSON 2
A355: YARRAVILLE | C355: S SMITH 2 | F355: ROGOWICZ | I355: MARTIN | K355: LEITCH | M355: COLBERT
A357: KILSYTH | C357: 8 | D357: 7 | E357: =C357*6+D357 -> 55 | G357: 12 | H357: 10 | I357: =G357*6+H357 -> 82 | K357: 14 | L357: 13 | M357: =K357*6+L357 -> 97 | O357: 24 | P357: 17 | Q357: =O357*6+P357 -> 161 | S357: KILSYTH
A358: SUNSHINE | C358: 2 | D358: 1 | E358: =C358*6+D358 -> 13 | G358: 7 | H358: 3 | I358: =G358*6+H358 -> 45 | K358: 13 | L358: 3 | M358: =K358*6+L358 -> 81 | O358: 13 | P358: 8 | Q358: =O358*6+P358 -> 86 | S358: BLOOM/TORNEY
A359: BEST PLAYERS
A360: KILSYTH | C360: ELLIOTT | F360: GIBB | I360: HODGES | L360: ROHDE | O360: LETTS | R360: GINICH
A361: SUNSHINE | C361: BEDGOOD | F361: WILLIAMS | I361: FOLEY | L361: VELLA | O361: SIMPSON | R361: MENADUE
A362: GOALKICKERS
A363: KILSYTH | C363: HICKLETON 5 | F363: ELLIOTT 4 | H363: HALBERT 4 | K363: BIANCO 3 | M363: GIBB 3 | O363: HODGES 2 | R363: GINICH | T363: LETTS | V363: SCHNEIDER
A364: SUNSHINE | C364: GAY 4 | E364: WILLIAMS 3 | H364: FOLEY 2 | J364: AXON | L364: VELLA | N364: RICHARDS | Q364: HOLLOW
A366: CAULFIELD | C366: 8 | D366: 3 | E366: =C366*6+D366 -> 51 | G366: 15 | H366: 4 | I366: =G366*6+H366 -> 94 | K366: 18 | L366: 10 | M366: =K366*6+L366 -> 118 | O366: 25 | P366: 13 | Q366: =O366*6+P366 -> 163 | S366: PRINCES PARK, CAULFIELD
A367: BOX HILL | C367: 4 | D367: 2 | E367: =C367*6+D367 -> 26 | G367: 9 | H367: 5 | I367: =G367*6+H367 -> 59 | K367: 12 | L367: 10 | M367: =K367*6+L367 -> 82 | O367: 15 | P367: 13 | Q367: =O367*6+P367 -> 103 | S367: PHILLIPS/MAY
A368: BEST PLAYERS
A369: CAULFIELD | C369: EINSEDEL | F369: AMBLER | I369: TAYLOR | L369: TUCKWELL | O369: DUNCAN | R369: LENNOX
A370: BOX HILL | C370: S WITNISH | F370: GLEESON | I370: P WITNISH | L370: CRUSE | O370: P WITNISH | R370: KAINEY
A371: GOALKICKERS
A372: CAULFIELD | C372: TAYLOR 5 | F372: DUNCAN 5 | H372: PEARCE 4 | J372: AMBLER 3 | L372: BOOTH 3 | N372: BLAKE 2 | P372: LENNON | R372: McLENNAN | T372: MORRISON
A373: BOX HILL | C373: KELLY 4 | E373: S WITNISH 2 | H373: KAINEY 2 | J373: CRUSE 2 | L373: R WITNISH | N373: KYLE | O373: GLEESON | Q373: DICKENSON | S373: WITHERS
A375: SPRINGVALE | C375: 8 | D375: 3 | E375: =C375*6+D375 -> 51 | G375: 14 | H375: 11 | I375: =G375*6+H375 -> 95 | K375: 17 | L375: 17 | M375: =K375*6+L375 -> 119 | O375: 24 | P375: 19 | Q375: =O375*6+P375 -> 163 | S375: NEWCOMEN RD
A376: MORDIALLOC | C376: 4 | D376: 3 | E376: =C376*6+D376 -> 27 | G376: 6 | H376: 8 | I376: =G376*6+H376 -> 44 | K376: 12 | L376: 13 | M376: =K376*6+L376 -> 85 | O376: 18 | P376: 15 | Q376: =O376*6+P376 -> 123 | S376: PETRIE/STEERE
A377: BEST PLAYERS
A378: SPRINGVALE | C378: CARROLL | F378: CADDAYE | I378: PAXTON | L378: FOTINIOTIS | O378: ANDERSON
A379: MORDIALLOC | C379: ENBOM | F379: DEATON | I379: WALSH | L379: BARDOEL | O379: PETERS | R379: PAGNOCCOLO
A380: GOALKICKERS
A381: SPRINGVALE | C381: CARROLL 10 | F381: ANDERSON 4 | I381: CADDAYE 3 | L381: COOKE 2 | N381: PAXTON 2 | Q381: SMITH 2 | S381: FOTINIOTIS
A382: MORDIALLOC | C382: BARDOEL 4 | F382: PAGNOCCOLO 2 | I382: BOURNE 2 | K382: LANG 2 | M382: BROMLEY 2 | O382: WATTERS 2 | R382: DEATON | T382: WALSH
A384: ROUND 9 | E384: 6TH JUNE | J384: WEATHER | S384: PLAYED AT
D385: 1ST QTR | H385: 2ND QTR | L385: 3RD QTR | P385: FINAL | S385: BRUNSWICK
A386: BOX HILL | C386: 0 | D386: 0 | E386: =C386*6+D386 -> 0 | G386: 0 | H386: 0 | I386: =G386*6+H386 -> 0 | K386: 0 | L386: 0 | M386: =K386*6+L386 -> 0 | O386: 23 | P386: 17 | Q386: =O386*6+P386 -> 155 | S386: UMPIRE | X386: LADDER | AB386: ROUND | AD386: 9
A387: YARRAVILLE | C387: 0 | D387: 0 | E387: =C387*6+D387 -> 0 | G387: 0 | H387: 0 | I387: =G387*6+H387 -> 0 | K387: 0 | L387: 0 | M387: =K387*6+L387 -> 0 | O387: 13 | P387: 14 | Q387: =O387*6+P387 -> 92
A388: BEST PLAYERS | W388: TEAM | X388: W | Y388: L | Z388: D | AA388: FOR | AB388: AGST | AC388: % | AD388: PTS
A389: BOX HILL
A390: YARRAVILLE | W390: OAKLEIGH | X390: 9 | Y390: 0 | Z390: 0 | AA390: 1547 | AB390: 765 | AC390: =(AA390*100)/AB390 -> 202.22222222222223 | AD390: =(X390*4)+(Z390*2) -> 36
A391: GOALKICKERS | W391: NORTHCOTE | X391: 7 | Y391: 2 | Z391: 0 | AA391: 1273 | AB391: 909 | AC391: =(AA391*100)/AB391 -> 140.04400440044003 | AD391: =(X391*4)+(Z391*2) -> 28
A392: BOX HILL | W392: BRUNSWICK | X392: 6 | Y392: 3 | Z392: 0 | AA392: 1260 | AB392: 930 | AC392: =(AA392*100)/AB392 -> 135.48387096774192 | AD392: =(X392*4)+(Z392*2) -> 24
A393: YARRAVILLE | W393: SPRINGVALE | X393: 5 | Y393: 4 | Z393: 0 | AA393: 1369 | AB393: 1054 | AC393: =(AA393*100)/AB393 -> 129.88614800759012 | AD393: =(X393*4)+(Z393*2) -> 20
A395: BRUNSWICK | C395: 0 | D395: 0 | E395: =C395*6+D395 -> 0 | G395: 0 | H395: 0 | I395: =G395*6+H395 -> 0 | K395: 0 | L395: 0 | M395: =K395*6+L395 -> 0 | O395: 20 | P395: 16 | Q395: =O395*6+P395 -> 136 | S395: BRUNSWICK | W395: MORDIALLOC | X395: 5 | Y395: 4 | Z395: 0 | AA395: 1152 | AB395: 1010 | AC395: =(AA395*100)/AB395 -> 114.05940594059406 | AD395: =(X395*4)+(Z395*2) -> 20
A396: SPRINGVALE | C396: 0 | D396: 0 | E396: =C396*6+D396 -> 0 | G396: 0 | H396: 0 | I396: =G396*6+H396 -> 0 | K396: 0 | L396: 0 | M396: =K396*6+L396 -> 0 | O396: 15 | P396: 10 | Q396: =O396*6+P396 -> 100 | W396: CAULFIELD | X396: 5 | Y396: 4 | Z396: 0 | AA396: 1165 | AB396: 1075 | AC396: =(AA396*100)/AB396 -> 108.37209302325581 | AD396: =(X396*4)+(Z396*2) -> 20
A397: BEST PLAYERS | W397: BOX HILL | X397: 4 | Y397: 5 | Z397: 0 | AA397: 1069 | AB397: 1217 | AC397: =(AA397*100)/AB397 -> 87.838948233360725 | AD397: =(X397*4)+(Z397*2) -> 16
A398: BRUNSWICK | W398: KILSYTH | X398: 3 | Y398: 6 | Z398: 0 | AA398: 970 | AB398: 1134 | AC398: =(AA398*100)/AB398 -> 85.537918871252202 | AD398: =(X398*4)+(Z398*2) -> 12
A399: SPRINGVALE | W399: SUNSHINE | X399: 1 | Y399: 8 | Z399: 0 | AA399: 875 | AB399: 1844 | AC399: =(AA399*100)/AB399 -> 47.451193058568329 | AD399: =(X399*4)+(Z399*2) -> 4
A400: GOALKICKERS | W400: YARRAVILLE | X400: 0 | Y400: 9 | Z400: 0 | AA400: 776 | AB400: 1552 | AC400: =(AA400*100)/AB400 -> 50 | AD400: =(X400*4)+(Z400*2) -> 0
A401: BRUNSWICK
A402: SPRINGVALE
A404: CAULFIELD | C404: 0 | D404: 0 | E404: =C404*6+D404 -> 0 | G404: 0 | H404: 0 | I404: =G404*6+H404 -> 0 | K404: 0 | L404: 0 | M404: =K404*6+L404 -> 0 | O404: 28 | P404: 15 | Q404: =O404*6+P404 -> 183 | S404: SUNSHINE
A405: SUNSHINE | C405: 0 | D405: 0 | E405: =C405*6+D405 -> 0 | G405: 0 | H405: 0 | I405: =G405*6+H405 -> 0 | K405: 0 | L405: 0 | M405: =K405*6+L405 -> 0 | O405: 14 | P405: 10 | Q405: =O405*6+P405 -> 94
A406: BEST PLAYERS
A407: CAULFIELD
A408: SUNSHINE
A409: GOALKICKERS
A410: CAULFIELD
A411: SUNSHINE
A413: MORDIALLOC | C413: 0 | D413: 0 | E413: =C413*6+D413 -> 0 | G413: 0 | H413: 0 | I413: =G413*6+H413 -> 0 | K413: 0 | L413: 0 | M413: =K413*6+L413 -> 0 | O413: 16 | P413: 11 | Q413: =O413*6+P413 -> 107 | S413: MORDIALLOC
A414: NORTHCOTE | C414: 0 | D414: 0 | E414: =C414*6+D414 -> 0 | G414: 0 | H414: 0 | I414: =G414*6+H414 -> 0 | K414: 0 | L414: 0 | M414: =K414*6+L414 -> 0 | O414: 11 | P414: 16 | Q414: =O414*6+P414 -> 82
A415: BEST PLAYERS
A416: MORDIALLOC
A417: NORTHCOTE
A418: GOALKICKERS
A419: MORDIALLOC
A420: NORTHCOTE
A422: OAKLEIGH | C422: 0 | D422: 0 | E422: =C422*6+D422 -> 0 | G422: 0 | H422: 0 | I422: =G422*6+H422 -> 0 | K422: 0 | L422: 0 | M422: =K422*6+L422 -> 0 | O422: 26 | P422: 18 | Q422: =O422*6+P422 -> 174 | S422: OAKLEIGH
A423: KILSYTH | C423: 0 | D423: 0 | E423: =C423*6+D423 -> 0 | G423: 0 | H423: 0 | I423: =G423*6+H423 -> 0 | K423: 0 | L423: 0 | M423: =K423*6+L423 -> 0 | O423: 12 | P423: 15 | Q423: =O423*6+P423 -> 87
A424: BEST PLAYERS
A425: OAKLEIGH
A426: KILSYTH
A427: GOALKICKERS
A428: OAKLEIGH
A429: KILSYTH
A431: ROUND 10 | E431: 20TH JUNE | J431: WEATHER | S431: PLAYED AT
D432: 1ST QTR | H432: 2ND QTR | L432: 3RD QTR | P432: FINAL | S432: MORDIALLOC
A433: MORDIALLOC | C433: 4 | D433: 4 | E433: =C433*6+D433 -> 28 | G433: 7 | H433: 5 | I433: =G433*6+H433 -> 47 | K433: 8 | L433: 6 | M433: =K433*6+L433 -> 54 | O433: 13 | P433: 7 | Q433: =O433*6+P433 -> 85 | S433: UMPIRE | X433: LADDER | AB433: ROUND | AD433: 10
A434: BRUNSWICK | C434: 3 | D434: 2 | E434: =C434*6+D434 -> 20 | G434: 7 | H434: 6 | I434: =G434*6+H434 -> 48 | K434: 11 | L434: 9 | M434: =K434*6+L434 -> 75 | O434: 11 | P434: 15 | Q434: =O434*6+P434 -> 81 | S434: FITZPATRICK/GOLLOP
A435: BEST PLAYERS | W435: TEAM | X435: W | Y435: L | Z435: D | AA435: FOR | AB435: AGST | AC435: % | AD435: PTS
A436: MORDIALLOC | C436: WALSH | F436: McILWRAITH | I436: DUNBAR | L436: BROMLEY | O436: PETER BARDOEL | S436: DEATON
A437: BRUNSWICK | C437: NOLAN | F437: LEAHY | I437: CALLENDER | L437: SAHLBERG | O437: HAMILTON | R437: ANDERSON | W437: OAKLEIGH | X437: 10 | Y437: 0 | Z437: 0 | AA437: 1625 | AB437: 828 | AC437: =(AA437*100)/AB437 -> 196.25603864734299 | AD437: =(X437*4)+(Z437*2) -> 40
A438: GOALKICKERS | W438: NORTHCOTE | X438: 8 | Y438: 2 | Z438: 0 | AA438: 1412 | AB438: 1013 | AC438: =(AA438*100)/AB438 -> 139.38795656465942 | AD438: =(X438*4)+(Z438*2) -> 32
A439: MORDIALLOC | C439: PETER BARDOEL 4 | G439: DEATON 2 | J439: PAGNOCCOLO 2 | M439: BROMLEY 2 | O439: BOURNE | Q439: McILWRAITH | T439: WALSH | W439: BRUNSWICK | X439: 6 | Y439: 4 | Z439: 0 | AA439: 1341 | AB439: 1015 | AC439: =(AA439*100)/AB439 -> 132.11822660098522 | AD439: =(X439*4)+(Z439*2) -> 24
A440: BRUNSWICK | C440: ANDERSON 5 | F440: NARDELLA 2 | I440: CALLENDER 2 | L440: RADCHENKO 2 | W440: MORDIALLOC | X440: 6 | Y440: 4 | Z440: 0 | AA440: 1237 | AB440: 1091 | AC440: =(AA440*100)/AB440 -> 113.38221814848762 | AD440: =(X440*4)+(Z440*2) -> 24
A442: BOX HILL | C442: 4 | D442: 2 | E442: =C442*6+D442 -> 26 | G442: 5 | H442: 8 | I442: =G442*6+H442 -> 38 | K442: 9 | L442: 12 | M442: =K442*6+L442 -> 66 | O442: 13 | P442: 13 | Q442: =O442*6+P442 -> 91 | S442: BOX HILL | W442: SPRINGVALE | X442: 5 | Y442: 5 | Z442: 0 | AA442: 1450 | AB442: 1145 | AC442: =(AA442*100)/AB442 -> 126.63755458515284 | AD442: =(X442*4)+(Z442*2) -> 20
A443: SPRINGVALE | C443: 3 | D443: 1 | E443: =C443*6+D443 -> 19 | G443: 5 | H443: 3 | I443: =G443*6+H443 -> 33 | K443: 11 | L443: 5 | M443: =K443*6+L443 -> 71 | O443: 12 | P443: 10 | Q443: =O443*6+P443 -> 82 | S443: PETRIE | W443: CAULFIELD | X443: 5 | Y443: 5 | Z443: 0 | AA443: 1228 | AB443: 1153 | AC443: =(AA443*100)/AB443 -> 106.50477016478752 | AD443: =(X443*4)+(Z443*2) -> 20
A444: BEST PLAYERS | S444: STEERE | W444: BOX HILL | X444: 5 | Y444: 5 | Z444: 0 | AA444: 1160 | AB444: 1299 | AC444: =(AA444*100)/AB444 -> 89.299461123941498 | AD444: =(X444*4)+(Z444*2) -> 20
A445: BOX HILL | C445: SCHADE | F445: GLEESON | I445: CRUSE | L445: KAINEY | O445: B DICKENSON | R445: A DICKENSON | W445: KILSYTH | X445: 3 | Y445: 7 | Z445: 0 | AA445: 1074 | AB445: 1273 | AC445: =(AA445*100)/AB445 -> 84.367635506677146 | AD445: =(X445*4)+(Z445*2) -> 12
A446: SPRINGVALE | C446: GILES | F446: CADDAYE | I446: COOKE | L446: ANDERSON | O446: WATSON | R446: FREEMAN | W446: SUNSHINE | X446: 2 | Y446: 8 | Z446: 0 | AA446: 982 | AB446: 1916 | AC446: =(AA446*100)/AB446 -> 51.252609603340289 | AD446: =(X446*4)+(Z446*2) -> 8
A447: GOALKICKERS | W447: YARRAVILLE | X447: 0 | Y447: 10 | Z447: 0 | AA447: 848 | AB447: 1659 | AC447: =(AA447*100)/AB447 -> 51.115129596142253 | AD447: =(X447*4)+(Z447*2) -> 0
A448: BOX HILL | C448: CRUSE 3 | E448: McKECHNIE 2 | H448: LATHER 2 | J448: KAINEY 2 | L448: SCHADE 2 | N448: A DICKENSON | Q448: RICH
A449: SPRINGVALE | C449: ANDERSON 4 | F449: CARROLL 3 | I449: COOKE 2 | K449: McCOMB | M449: PAXTON | O449: SMITH
A451: SUNSHINE | C451: 3 | D451: 11 | E451: =C451*6+D451 -> 29 | G451: 6 | H451: 14 | I451: =G451*6+H451 -> 50 | K451: 10 | L451: 22 | M451: =K451*6+L451 -> 82 | O451: 14 | P451: 23 | Q451: =O451*6+P451 -> 107 | S451: SUNSHINE
A452: YARRAVILLE | C452: 1 | D452: 0 | E452: =C452*6+D452 -> 6 | G452: 6 | H452: 3 | I452: =G452*6+H452 -> 39 | K452: 7 | L452: 4 | M452: =K452*6+L452 -> 46 | O452: 11 | P452: 6 | Q452: =O452*6+P452 -> 72 | S452: PODESTA/OGSTON
A453: BEST PLAYERS
A454: SUNSHINE | C454: HOLLOW | F454: DAY | H454: GORE | K454: MENADUE | N454: CHATTERTON | Q454: VARDJNAL
A455: YARRAVILLE | C455: SHARP | F455: S McGHIE | I455: DIMASI | K455: MARTIN | N455: SQUIRE | Q455: TUPPEN
A456: GOALKICKERS
A457: SUNSHINE | C457: HOLLOW 6 | F457: DAY 3 | H457: BEDGOOD 2 | K457: VELLA | M457: WILLIAMS | P457: AXON
A458: YARRAVILLE | C458: SHARP 3 | F458: DIMASI 2 | H458: HODGES | J458: COLBERT | L458: DIMASI | N458: RYAN | P458: S McGHIE | R458: ROGOTOWICZ
A460: OAKLEIGH | C460: 4 | D460: 5 | E460: =C460*6+D460 -> 29 | G460: 7 | H460: 10 | I460: =G460*6+H460 -> 52 | K460: 7 | L460: 11 | M460: =K460*6+L460 -> 53 | O460: 10 | P460: 18 | Q460: =O460*6+P460 -> 78 | S460: OAKLEIGH
A461: CAULFIELD | C461: 2 | D461: 3 | E461: =C461*6+D461 -> 15 | G461: 4 | H461: 4 | I461: =G461*6+H461 -> 28 | K461: 7 | L461: 8 | M461: =K461*6+L461 -> 50 | O461: 9 | P461: 9 | Q461: =O461*6+P461 -> 63 | S461: TORNEY/BLOOM
A462: BEST PLAYERS
A463: OAKLEIGH | C463: CALLERY | F463: HEVERIN | I463: TODD | K463: NEARY | N463: ROACH | Q463: AERTSSEN
A464: CAULFIELD | C464: EINSEDEL | F464: MORRISON | I464: AMBLER | K464: BOOTH | N464: TAYLOR
A465: GOALKICKERS
A466: OAKLEIGH | C466: AERTSSEN 5 | F466: NEARY 2 | I466: CALLERY | L466: TODD | N466: HIGGINS
A467: CAULFIELD | C467: BLAKE 2 | E467: AMBLER 2 | G467: EINSEDEL | I467: BOOTH | K467: McLEOD | M467: DUNCAN | O467: STEWART
A469: NORTHCOTE | C469: 6 | D469: 5 | E469: =C469*6+D469 -> 41 | G469: 8 | H469: 10 | I469: =G469*6+H469 -> 58 | K469: 15 | L469: 16 | M469: =K469*6+L469 -> 106 | O469: 20 | P469: 19 | Q469: =O469*6+P469 -> 139 | S469: NORTHCOTE
A470: KILSYTH | C470: 4 | D470: 2 | E470: =C470*6+D470 -> 26 | G470: 8 | H470: 4 | I470: =G470*6+H470 -> 52 | K470: 11 | L470: 6 | M470: =K470*6+L470 -> 72 | O470: 16 | P470: 8 | Q470: =O470*6+P470 -> 104 | S470: MAY/HUTCHINSON
A471: BEST PLAYERS
A472: NORTHCOTE | C472: REDENBACH | F472: CEPPI | I472: M RYAN | K472: JURGENSTEIN | N472: MEGNA | Q472: DILORIO
A473: KILSYTH | C473: HODGES | F473: ELLIOTT | I473: BIANCO | K473: SHEPPARD | N473: PETERS
A474: GOALKICKERS
A475: NORTHCOTE | C475: JURGENSTEIN 6 | F475: P RYAN 4 | I475: JIM CHRISTOU 2 | L475: DILORIO 2 | N475: MEGNA 2 | P475: CEPPI 2 | R475: TAIRI | T475: McQUINN
A476: KILSYTH | C476: BIANCO 3 | F476: HICKLETON 3 | I476: HODGES 3 | K476: EDWARDS 2 | N476: ELLIOTT 2 | Q476: HALBERT 2 | T476: GIBB
A478: ROUND 11 | E478: 27TH JUNE | J478: WEATHER | S478: PLAYED AT
D479: 1ST QTR | H479: 2ND QTR | L479: 3RD QTR | P479: FINAL | S479: BRUNSWICK
A480: BRUNSWICK | C480: 4 | D480: 0 | E480: =C480*6+D480 -> 24 | G480: 7 | H480: 8 | I480: =G480*6+H480 -> 50 | K480: 9 | L480: 11 | M480: =K480*6+L480 -> 65 | O480: 14 | P480: 18 | Q480: =O480*6+P480 -> 102 | S480: UMPIRE | X480: LADDER | AB480: ROUND | AD480: 11
A481: BOX HILL | C481: 3 | D481: 6 | E481: =C481*6+D481 -> 24 | G481: 6 | H481: 8 | I481: =G481*6+H481 -> 44 | K481: 10 | L481: 10 | M481: =K481*6+L481 -> 70 | O481: 11 | P481: 12 | Q481: =O481*6+P481 -> 78 | S481: TORNEY/PODESTA
A482: BEST PLAYERS | W482: TEAM | X482: W | Y482: L | Z482: D | AA482: FOR | AB482: AGST | AC482: % | AD482: PTS
A483: BRUNSWICK | C483: TOY | E483: LEAHY | H483: NOLAN | K483: ANDERSON | N483: RADCHENKO | Q483: CALLENDER
A484: BOX HILL | C484: B DICKENSON | F484: GLEESON | H484: SCHADE | K484: WITNISH | N484: KAINEY | Q484: CRUSE | W484: OAKLEIGH | X484: 11 | Y484: 0 | Z484: 0 | AA484: 1780 | AB484: 918 | AC484: =(AA484*100)/AB484 -> 193.89978213507626 | AD484: =(X484*4)+(Z484*2) -> 44
A485: GOALKICKERS | W485: NORTHCOTE | X485: 8 | Y485: 3 | Z485: 0 | AA485: 1473 | AB485: 1172 | AC485: =(AA485*100)/AB485 -> 125.68259385665529 | AD485: =(X485*4)+(Z485*2) -> 32
A486: BRUNSWICK | C486: ANDERSON 5 | F486: RADCHENKO 3 | I486: NARDELLA 3 | L486: CALLENDER | O486: HAMILTON | R486: LEAHY | W486: BRUNSWICK | X486: 7 | Y486: 4 | Z486: 0 | AA486: 1443 | AB486: 1093 | AC486: =(AA486*100)/AB486 -> 132.02195791399816 | AD486: =(X486*4)+(Z486*2) -> 28
A487: BOX HILL | C487: RICH 4 | E487: KAINEY 3 | G487: MOORE 2 | J487: SCHADE 2 | W487: MORDIALLOC | X487: 7 | Y487: 4 | Z487: 0 | AA487: 1344 | AB487: 1177 | AC487: =(AA487*100)/AB487 -> 114.18861512319457 | AD487: =(X487*4)+(Z487*2) -> 28
A489: OAKLEIGH | C489: 8 | D489: 3 | E489: =C489*6+D489 -> 51 | G489: 12 | H489: 5 | I489: =G489*6+H489 -> 77 | K489: 19 | L489: 8 | M489: =K489*6+L489 -> 122 | O489: 24 | P489: 11 | Q489: =O489*6+P489 -> 155 | S489: YARRAVILLE | W489: SPRINGVALE | X489: 6 | Y489: 5 | Z489: 0 | AA489: 1667 | AB489: 1219 | AC489: =(AA489*100)/AB489 -> 136.75143560295325 | AD489: =(X489*4)+(Z489*2) -> 24
A490: YARRAVILLE | C490: 2 | D490: 8 | E490: =C490*6+D490 -> 20 | G490: 5 | H490: 11 | I490: =G490*6+H490 -> 41 | K490: 10 | L490: 14 | M490: =K490*6+L490 -> 74 | O490: 12 | P490: 18 | Q490: =O490*6+P490 -> 90 | S490: MAY | W490: CAULFIELD | X490: 6 | Y490: 5 | Z490: 0 | AA490: 1387 | AB490: 1214 | AC490: =(AA490*100)/AB490 -> 114.2504118616145 | AD490: =(X490*4)+(Z490*2) -> 24
A491: BEST PLAYERS | S491: PETRIE | W491: BOX HILL | X491: 5 | Y491: 6 | Z491: 0 | AA491: 1238 | AB491: 1401 | AC491: =(AA491*100)/AB491 -> 88.365453247680222 | AD491: =(X491*4)+(Z491*2) -> 20
A492: OAKLEIGH | C492: ROBERTS | F492: AERTSSEN | I492: BATTERSBY | L492: NEARY | N492: SPLATT | W492: KILSYTH | X492: 3 | Y492: 8 | Z492: 0 | AA492: 1160 | AB492: 1380 | AC492: =(AA492*100)/AB492 -> 84.05797101449275 | AD492: =(X492*4)+(Z492*2) -> 12
A493: YARRAVILLE | C493: SHARP | F493: RYAN | I493: COLBERT | L493: LEITCH | N493: SQUIRE | W493: SUNSHINE | X493: 2 | Y493: 9 | Z493: 0 | AA493: 1056 | AB493: 2133 | AC493: =(AA493*100)/AB493 -> 49.507735583684948 | AD493: =(X493*4)+(Z493*2) -> 8
A494: GOALKICKERS | W494: YARRAVILLE | X494: 0 | Y494: 11 | Z494: 0 | AA494: 938 | AB494: 1814 | AC494: =(AA494*100)/AB494 -> 51.708930540242555 | AD494: =(X494*4)+(Z494*2) -> 0
A495: OAKLEIGH | C495: AERTSSEN 11 | F495: NEARY 6 | H495: HARPER 2 | J495: CASSAMENTO 2 | N495: McDONALD 2 | Q495: COLLINS
A496: YARRAVILLE | C496: DENNIS 3 | F496: RYAN 3 | H496: McGHIE 2 | J496: ROGZIC 2 | M496: ROGTOWICZ | P496: SHARP
A498: CAULFIELD | C498: 6 | D498: 4 | E498: =C498*6+D498 -> 40 | G498: 12 | H498: 8 | I498: =G498*6+H498 -> 80 | K498: 18 | L498: 10 | M498: =K498*6+L498 -> 118 | O498: 24 | P498: 15 | Q498: =O498*6+P498 -> 159 | S498: PRINCES PARK, CAULFIELD
A499: NORTHCOTE | C499: 1 | D499: 1 | E499: =C499*6+D499 -> 7 | G499: 3 | H499: 2 | I499: =G499*6+H499 -> 20 | K499: 7 | L499: 6 | M499: =K499*6+L499 -> 48 | O499: 9 | P499: 7 | Q499: =O499*6+P499 -> 61 | S499: STEERE/GRIFFITH
A500: BEST PLAYERS
A501: CAULFIELD | C501: MORRISON | F501: BLAKE | I501: EINSEDEL | L501: SUTHERLAND | O501: BRASIER | R501: PEARCE
A502: NORTHCOTE | C502: ALEVA | F502: JOHN CHRISTOU | J502: COURTS | M502: McQUINN
A503: GOALKICKERS
A504: CAULFIELD | C504: BLAKE 8 | F504: PEARCE 6 | H504: DUNCAN 3 | K504: BOOTH 2 | M504: GUILLERI | O504: SUTHERLAND | R504: SUTTIE | T504: STEWART | W504: AMBLER
A505: NORTHCOTE | C505: JIM CHRISTOU 2 | F505: M RYAN 2 | I505: COURTS 2 | K505: SANDERS | N505: P RYAN | P505: ROULSTON
A507: MORDIALLOC | C507: 4 | D507: 4 | E507: =C507*6+D507 -> 28 | G507: 6 | H507: 8 | I507: =G507*6+H507 -> 44 | K507: 13 | L507: 9 | M507: =K507*6+L507 -> 87 | O507: 16 | P507: 11 | Q507: =O507*6+P507 -> 107 | S507: KILSYTH
A508: KILSYTH | C508: 4 | D508: 1 | E508: =C508*6+D508 -> 25 | G508: 7 | H508: 5 | I508: =G508*6+H508 -> 47 | K508: 10 | L508: 6 | M508: =K508*6+L508 -> 66 | O508: 13 | P508: 8 | Q508: =O508*6+P508 -> 86 | S508: BLOOM/OGSTON
A509: BEST PLAYERS
A510: MORDIALLOC | C510: ENBOM | F510: McILWRAITH | I510: BROMLEY | L510: PETERS | O510: PAGNOCCOLO | R510: BOURNE
A511: KILSYTH | C511: HODGES | F511: ROHDE | I511: D'ANGELO | L511: BYRNE | O511: PETERSON | R511: LETTS
A512: GOALKICKERS
A513: MORDIALLOC | C513: BOURNE 5 | F513: McILWRAITH 5 | I513: O'HANLON 4 | L513: PETER BARDOEL 2
A514: KILSYTH | C514: LETTS 5 | F514: GIBB 2 | H514: HODGES 2 | K514: BIANCO | M514: EDWARDS | O514: HALBERT | R514: LINNELL
A516: SPRINGVALE | C516: 8 | D516: 4 | E516: =C516*6+D516 -> 52 | G516: 15 | H516: 6 | I516: =G516*6+H516 -> 96 | K516: 24 | L516: 9 | M516: =K516*6+L516 -> 153 | O516: 34 | P516: 13 | Q516: =O516*6+P516 -> 217 | S516: NEWCOMEN RD
A517: SUNSHINE | C517: 5 | D517: 2 | E517: =C517*6+D517 -> 32 | G517: 7 | H517: 2 | I517: =G517*6+H517 -> 44 | K517: 11 | L517: 4 | M517: =K517*6+L517 -> 70 | O517: 11 | P517: 8 | Q517: =O517*6+P517 -> 74 | S517: HUTCHINSON/GOLLOP
A518: BEST PLAYERS
A519: SPRINGVALE | C519: COOKE | F519: ANDERSON | I519: WOODMAN | L519: CADDAYE | O519: PINNELL | R519: FREEMAN
A520: SUNSHINE | C520: CAMPBELL | F520: GORE | I520: VELLA | L520: BARLOW | O520: VADJNAL | R520: CHATTERTON
A521: GOALKICKERS
A522: SPRINGVALE | C522: CARROLL 8 | F522: COOKE 7 | H522: PAXTON 4 | J522: NEWMAN 3 | L522: ANDERSON 2 | O522: PINNELL 2 | Q522: CADDAYE 2 | S522: BLOOMFIELD 2 | W522: FOTINIOTIS | X522: WATSON | Z522: SMITH
A523: SUNSHINE | C523: WILLIAMS 3 | F523: WAGLAND 2 | I523: VELLA | K523: VADJNAL | N523: HUNT | P523: HOLLOW | R523: BEDGOOD | T523: DAY
A525: ROUND 12 | E525: 4TH JULY | J525: WEATHER | S525: PLAYED AT
D526: 1ST QTR | H526: 2ND QTR | L526: 3RD QTR | P526: FINAL | S526: OAKLEIGH
A527: OAKLEIGH | C527: 4 | D527: 5 | E527: =C527*6+D527 -> 29 | G527: 10 | H527: 11 | I527: =G527*6+H527 -> 71 | K527: 16 | L527: 15 | M527: =K527*6+L527 -> 111 | O527: 20 | P527: 19 | Q527: =O527*6+P527 -> 139 | S527: UMPIRE | X527: LADDER | AB527: ROUND | AD527: 12
A528: SPRINGVALE | C528: 3 | D528: 1 | E528: =C528*6+D528 -> 19 | G528: 6 | H528: 4 | I528: =G528*6+H528 -> 40 | K528: 11 | L528: 8 | M528: =K528*6+L528 -> 74 | O528: 16 | P528: 13 | Q528: =O528*6+P528 -> 109 | S528: STEERE/BUDGE
A529: BEST PLAYERS | W529: TEAM | X529: W | Y529: L | Z529: D | AA529: FOR | AB529: AGST | AC529: % | AD529: PTS
A530: OAKLEIGH | C530: METZNER | F530: SPLATT | I530: CARTER | L530: HARPER | O530: AERTSSEN | R530: MATTHEY
A531: SPRINGVALE | C531: COOKE | F531: FREEMAN | I531: SKILTON | L531: ANDERSON | O531: WATSON | R531: FOTINIOTIS | W531: OAKLEIGH | X531: 12 | Y531: 0 | Z531: 0 | AA531: 1919 | AB531: 1027 | AC531: =(AA531*100)/AB531 -> 186.85491723466407 | AD531: =(X531*4)+(Z531*2) -> 48
A532: GOALKICKERS | W532: NORTHCOTE | X532: 9 | Y532: 3 | Z532: 0 | AA532: 1594 | AB532: 1254 | AC532: =(AA532*100)/AB532 -> 127.11323763955343 | AD532: =(X532*4)+(Z532*2) -> 36
A533: OAKLEIGH | C533: AERTSSEN 7 | F533: HARPER 5 | I533: NEARY 3 | K533: TODD 2 | M533: McDONALD 2 | P533: OWEN | W533: BRUNSWICK | X533: 8 | Y533: 4 | Z533: 0 | AA533: 1613 | AB533: 1175 | AC533: =(AA533*100)/AB533 -> 137.27659574468086 | AD533: =(X533*4)+(Z533*2) -> 32
A534: SPRINGVALE | C534: ANDERSON 5 | F534: CARROLL 4 | I534: FOTINIOTIS 3 | L534: GOODINGHAM | O534: NEWMAN | Q534: PINNELL | S534: FREEMAN | W534: CAULFIELD | X534: 7 | Y534: 5 | Z534: 0 | AA534: 1509 | AB534: 1300 | AC534: =(AA534*100)/AB534 -> 116.07692307692308 | AD534: =(X534*4)+(Z534*2) -> 28
A536: BOX HILL | C536: 3 | D536: 2 | E536: =C536*6+D536 -> 20 | G536: 7 | H536: 10 | I536: =G536*6+H536 -> 52 | K536: 10 | L536: 12 | M536: =K536*6+L536 -> 72 | O536: 15 | P536: 21 | Q536: =O536*6+P536 -> 111 | S536: MORDIALLOC | W536: MORDIALLOC | X536: 7 | Y536: 5 | Z536: 0 | AA536: 1425 | AB536: 1288 | AC536: =(AA536*100)/AB536 -> 110.63664596273291 | AD536: =(X536*4)+(Z536*2) -> 28
A537: MORDIALLOC | C537: 1 | D537: 3 | E537: =C537*6+D537 -> 9 | G537: 5 | H537: 5 | I537: =G537*6+H537 -> 35 | K537: 9 | L537: 10 | M537: =K537*6+L537 -> 64 | O537: 11 | P537: 15 | Q537: =O537*6+P537 -> 81 | S537: GRIFFITH | W537: SPRINGVALE | X537: 6 | Y537: 6 | Z537: 0 | AA537: 1776 | AB537: 1358 | AC537: =(AA537*100)/AB537 -> 130.78055964653902 | AD537: =(X537*4)+(Z537*2) -> 24
A538: BEST PLAYERS | S538: HUTCHINSON | W538: BOX HILL | X538: 6 | Y538: 6 | Z538: 0 | AA538: 1349 | AB538: 1482 | AC538: =(AA538*100)/AB538 -> 91.025641025641022 | AD538: =(X538*4)+(Z538*2) -> 24
A539: BOX HILL | C539: S WITNISH | F539: GLEESON | I539: P WITNISH | L539: CRUSE | O539: SCHADE | R539: DICKENSON | W539: KILSYTH | X539: 3 | Y539: 9 | Z539: 0 | AA539: 1246 | AB539: 1502 | AC539: =(AA539*100)/AB539 -> 82.956058588548601 | AD539: =(X539*4)+(Z539*2) -> 12
A540: MORDIALLOC | C540: NEVILLE | F540: ENBOM | I540: MASON | L540: DUNBAR | O540: WALSH | R540: PAUL BARDOEL | W540: SUNSHINE | X540: 2 | Y540: 10 | Z540: 0 | AA540: 1138 | AB540: 2303 | AC540: =(AA540*100)/AB540 -> 49.413808076422058 | AD540: =(X540*4)+(Z540*2) -> 8
A541: GOALKICKERS | W541: YARRAVILLE | X541: 0 | Y541: 12 | Z541: 0 | AA541: 1020 | AB541: 2035 | AC541: =(AA541*100)/AB541 -> 50.122850122850124 | AD541: =(X541*4)+(Z541*2) -> 0
A542: BOX HILL | C542: CRUSE 4 | E542: SCHADE 2 | G542: KAINEY 2 | I542: RICH 2 | K542: GLEESON 2 | N542: TAYLOR | P542: KYLE | R542: GREENSMITH
A543: MORDIALLOC | C543: NEVILLE 5 | F543: O'HANLON | I543: DEATON | K543: WATTERS | N543: WALSH | P543: DUNBAR | R543: LEWIS
A545: CAULFIELD | C545: 3 | D545: 1 | E545: =C545*6+D545 -> 19 | G545: 7 | H545: 10 | I545: =G545*6+H545 -> 52 | K545: 12 | L545: 14 | M545: =K545*6+L545 -> 86 | O545: 17 | P545: 20 | Q545: =O545*6+P545 -> 122 | S545: KILSYTH
A546: KILSYTH | C546: 3 | D546: 3 | E546: =C546*6+D546 -> 21 | G546: 4 | H546: 6 | I546: =G546*6+H546 -> 30 | K546: 9 | L546: 10 | M546: =K546*6+L546 -> 64 | O546: 12 | P546: 14 | Q546: =O546*6+P546 -> 86
A547: BEST PLAYERS
A548: CAULFIELD | C548: SAUNDERS | F548: EINSEDEL | I548: AMBLER | L548: MORRISON | O548: BOOTH | R548: PEARCE
A549: KILSYTH | C549: EDWARDS | F549: PETERSON | I549: HODGES | L549: GIBB | O549: D'ANGELO | R549: DOCKERY
A550: GOALKICKERS
A551: CAULFIELD | C551: BOOTH 3 | F551: BLAKE 2 | H551: HOFERT 2 | J551: STEWART 2 | M551: PEARCE | O551: DUNCAN | Q551: AMBLER | S551: SAUNDERS | V551: LENNON | X551: HOGAN
A552: KILSYTH | C552: LINNELL 4 | F552: LETTS 3 | I552: SHEPPARD 3 | L552: GIBB | N552: NOY
A554: BRUNSWICK | C554: 4 | D554: 8 | E554: =C554*6+D554 -> 32 | G554: 11 | H554: 10 | I554: =G554*6+H554 -> 76 | K554: 20 | L554: 15 | M554: =K554*6+L554 -> 135 | O554: 25 | P554: 20 | Q554: =O554*6+P554 -> 170 | S554: SUNSHINE
A555: SUNSHINE | C555: 1 | D555: 1 | E555: =C555*6+D555 -> 7 | G555: 3 | H555: 3 | I555: =G555*6+H555 -> 21 | K555: 7 | L555: 5 | M555: =K555*6+L555 -> 47 | O555: 12 | P555: 10 | Q555: =O555*6+P555 -> 82 | S555: MAY/BLOOM
A556: BEST PLAYERS
A557: BRUNSWICK | C557: TOY | F557: LEAHY | I557: S BUCKLEY | L557: CALLENDER | O557: LYNCH | R557: HAMILTON
A558: SUNSHINE | C558: WILLIAMS | F558: MENADUE | I558: CHATTERTON | L558: BARLOW | O558: VADJNAL | R558: VELLA
A559: GOALKICKERS
A560: BRUNSWICK | C560: ANDERSON 7 | F560: SAGGERS 4 | I560: S BUCKLEY 3 | L560: LYNCH 3 | N560: YOUNG 3 | P560: LEAHY 2 | R560: P BUCKLEY | T560: CALLENDER | W560: SAHLBERG
A561: SUNSHINE | C561: WILLIAMS 5 | F561: S HUNT 2 | I561: DAY | K561: HOLLOW | M561: WHITNEY | O561: VELLA | Q561: VADJNAL
A563: NORTHCOTE | C563: 5 | D563: 6 | E563: =C563*6+D563 -> 36 | G563: 14 | H563: 8 | I563: =G563*6+H563 -> 92 | K563: 23 | L563: 14 | M563: =K563*6+L563 -> 152 | O563: 33 | P563: 23 | Q563: =O563*6+P563 -> 221 | S563: NORTHCOTE
A564: YARRAVILLE | C564: 4 | D564: 1 | E564: =C564*6+D564 -> 25 | G564: 6 | H564: 5 | I564: =G564*6+H564 -> 41 | K564: 9 | L564: 8 | M564: =K564*6+L564 -> 62 | O564: 12 | P564: 10 | Q564: =O564*6+P564 -> 82 | S564: TORNEY/GOLLOP
A565: BEST PLAYERS
A566: NORTHCOTE | C566: ROULSTON | F566: JOHN CHRISTOU | I566: P RYAN | L566: MINNETT | O566: REDENBACH | R566: JURGENSTEIN
A567: YARRAVILLE | C567: COOKE | F567: TUPPIN | I567: JENKINS | L567: COLBERT | O567: DAVIES
A568: GOALKICKERS
A569: NORTHCOTE | C569: JIM CHRISTOU 7 | F569: JURGENSTEIN 5 | I569: P RYAN 5 | K569: SMITH 5 | M569: BRAIN 4 | O569: MEGNA 2 | Q569: COURTS | S569: CEPPI | U569: MINNETT | W569: JOHN CHRISTOU | X569: M RYAN
A570: YARRAVILLE | C570: COOKE 4 | F570: MARTIN 3 | I570: SQUIRE 3 | K570: McGHIE | M570: L RYAN
A572: ROUND 13 | E572: 11TH JULY | J572: WEATHER | S572: PLAYED AT
D573: 1ST QTR | H573: 2ND QTR | L573: 3RD QTR | P573: FINAL | S573: BRUNSWICK
A574: BRUNSWICK | C574: 0 | D574: 0 | E574: =C574*6+D574 -> 0 | G574: 0 | H574: 0 | I574: =G574*6+H574 -> 0 | K574: 0 | L574: 0 | M574: =K574*6+L574 -> 0 | O574: 22 | P574: 20 | Q574: =O574*6+P574 -> 152 | S574: UMPIRE | X574: LADDER | AB574: ROUND | AD574: 13
A575: OAKLEIGH | C575: 0 | D575: 0 | E575: =C575*6+D575 -> 0 | G575: 0 | H575: 0 | I575: =G575*6+H575 -> 0 | K575: 0 | L575: 0 | M575: =K575*6+L575 -> 0 | O575: 16 | P575: 14 | Q575: =O575*6+P575 -> 110
A576: BEST PLAYERS | W576: TEAM | X576: W | Y576: L | Z576: D | AA576: FOR | AB576: AGST | AC576: % | AD576: PTS
A577: BRUNSWICK
A578: OAKLEIGH | W578: OAKLEIGH | X578: 12 | Y578: 1 | Z578: 0 | AA578: 2029 | AB578: 1182 | AC578: =(AA578*100)/AB578 -> 171.65820642978002 | AD578: =(X578*4)+(Z578*2) -> 48
A579: GOALKICKERS | W579: NORTHCOTE | X579: 10 | Y579: 3 | Z579: 0 | AA579: 1734 | AB579: 1354 | AC579: =(AA579*100)/AB579 -> 128.06499261447561 | AD579: =(X579*4)+(Z579*2) -> 40
A580: BRUNSWICK | W580: BRUNSWICK | X580: 9 | Y580: 4 | Z580: 0 | AA580: 1765 | AB580: 1285 | AC580: =(AA580*100)/AB580 -> 137.35408560311285 | AD580: =(X580*4)+(Z580*2) -> 36
A581: OAKLEIGH | W581: CAULFIELD | X581: 8 | Y581: 5 | Z581: 0 | AA581: 1636 | AB581: 1399 | AC581: =(AA581*100)/AB581 -> 116.94067190850608 | AD581: =(X581*4)+(Z581*2) -> 32
A583: CAULFIELD | C583: 0 | D583: 0 | E583: =C583*6+D583 -> 0 | G583: 0 | H583: 0 | I583: =G583*6+H583 -> 0 | K583: 0 | L583: 0 | M583: =K583*6+L583 -> 0 | O583: 19 | P583: 13 | Q583: =O583*6+P583 -> 127 | S583: PRINCES PARK, CAULFIELD | W583: MORDIALLOC | X583: 7 | Y583: 6 | Z583: 0 | AA583: 1524 | AB583: 1415 | AC583: =(AA583*100)/AB583 -> 107.70318021201413 | AD583: =(X583*4)+(Z583*2) -> 28
A584: MORDIALLOC | C584: 0 | D584: 0 | E584: =C584*6+D584 -> 0 | G584: 0 | H584: 0 | I584: =G584*6+H584 -> 0 | K584: 0 | L584: 0 | M584: =K584*6+L584 -> 0 | O584: 15 | P584: 9 | Q584: =O584*6+P584 -> 99 | W584: BOX HILL | X584: 7 | Y584: 6 | Z584: 0 | AA584: 1469 | AB584: 1565 | AC584: =(AA584*100)/AB584 -> 93.865814696485629 | AD584: =(X584*4)+(Z584*2) -> 28
A585: BEST PLAYERS | W585: SPRINGVALE | X585: 6 | Y585: 7 | Z585: 0 | AA585: 1876 | AB585: 1498 | AC585: =(AA585*100)/AB585 -> 125.23364485981308 | AD585: =(X585*4)+(Z585*2) -> 24
A586: CAULFIELD | W586: KILSYTH | X586: 3 | Y586: 10 | Z586: 0 | AA586: 1372 | AB586: 1647 | AC586: =(AA586*100)/AB586 -> 83.302975106253797 | AD586: =(X586*4)+(Z586*2) -> 12
A587: MORDIALLOC | W587: SUNSHINE | X587: 2 | Y587: 11 | Z587: 0 | AA587: 1221 | AB587: 2423 | AC587: =(AA587*100)/AB587 -> 50.392075938918694 | AD587: =(X587*4)+(Z587*2) -> 8
A588: GOALKICKERS | W588: YARRAVILLE | X588: 1 | Y588: 12 | Z588: 0 | AA588: 1165 | AB588: 2161 | AC588: =(AA588*100)/AB588 -> 53.910226746876447 | AD588: =(X588*4)+(Z588*2) -> 4
A589: CAULFIELD
A590: MORDIALLOC
A592: NORTHCOTE | C592: 0 | D592: 0 | E592: =C592*6+D592 -> 0 | G592: 0 | H592: 0 | I592: =G592*6+H592 -> 0 | K592: 0 | L592: 0 | M592: =K592*6+L592 -> 0 | O592: 21 | P592: 14 | Q592: =O592*6+P592 -> 140 | S592: NEWCOMEN RD
A593: SPRINGVALE | C593: 0 | D593: 0 | E593: =C593*6+D593 -> 0 | G593: 0 | H593: 0 | I593: =G593*6+H593 -> 0 | K593: 0 | L593: 0 | M593: =K593*6+L593 -> 0 | O593: 15 | P593: 10 | Q593: =O593*6+P593 -> 100
A594: BEST PLAYERS
A595: NORTHCOTE
A596: SPRINGVALE
A597: GOALKICKERS
A598: NORTHCOTE
A599: SPRINGVALE
A601: BOX HILL | C601: 0 | D601: 0 | E601: =C601*6+D601 -> 0 | G601: 0 | H601: 0 | I601: =G601*6+H601 -> 0 | K601: 0 | L601: 0 | M601: =K601*6+L601 -> 0 | O601: 17 | P601: 18 | Q601: =O601*6+P601 -> 120 | S601: BOX HILL
A602: SUNSHINE | C602: 0 | D602: 0 | E602: =C602*6+D602 -> 0 | G602: 0 | H602: 0 | I602: =G602*6+H602 -> 0 | K602: 0 | L602: 0 | M602: =K602*6+L602 -> 0 | O602: 11 | P602: 17 | Q602: =O602*6+P602 -> 83
A603: BEST PLAYERS
A604: BOX HILL
A605: SUNSHINE
A606: GOALKICKERS
A607: BOX HILL
A608: SUNSHINE
A610: YARRAVILLE | C610: 0 | D610: 0 | E610: =C610*6+D610 -> 0 | G610: 0 | H610: 0 | I610: =G610*6+H610 -> 0 | K610: 0 | L610: 0 | M610: =K610*6+L610 -> 0 | O610: 21 | P610: 19 | Q610: =O610*6+P610 -> 145 | S610: YARRAVILLE
A611: KILSYTH | C611: 0 | D611: 0 | E611: =C611*6+D611 -> 0 | G611: 0 | H611: 0 | I611: =G611*6+H611 -> 0 | K611: 0 | L611: 0 | M611: =K611*6+L611 -> 0 | O611: 18 | P611: 18 | Q611: =O611*6+P611 -> 126
A612: BEST PLAYERS
A613: YARRAVILLE
A614: KILSYTH
A615: GOALKICKERS
A616: YARRAVILLE
A617: KILSYTH
A619: ROUND 14 | E619: 18TH JULY | J619: WEATHER | S619: PLAYED AT
D620: 1ST QTR | H620: 2ND QTR | L620: 3RD QTR | P620: FINAL | S620: PRINCES PARK, CAULFIELD
A621: CAULFIELD | C621: 8 | D621: 2 | E621: =C621*6+D621 -> 50 | G621: 17 | H621: 13 | I621: =G621*6+H621 -> 115 | K621: 21 | L621: 17 | M621: =K621*6+L621 -> 143 | O621: 30 | P621: 24 | Q621: =O621*6+P621 -> 204 | S621: UMPIRE | X621: LADDER | AB621: ROUND | AD621: 14
A622: YARRAVILLE | C622: 2 | D622: 1 | E622: =C622*6+D622 -> 13 | G622: 2 | H622: 4 | I622: =G622*6+H622 -> 16 | K622: 5 | L622: 5 | M622: =K622*6+L622 -> 35 | O622: 8 | P622: 8 | Q622: =O622*6+P622 -> 56 | S622: HUTCHINSON/STEERE
A623: BEST PLAYERS | W623: TEAM | X623: W | Y623: L | Z623: D | AA623: FOR | AB623: AGST | AC623: % | AD623: PTS
A624: CAULFIELD | C624: DUNCAN | F624: McLEOD | I624: AMBLER | L624: SUTTIE | O624: EINSEDEL | R624: MORRISON
A625: YARRAVILLE | C625: COLBERT | F625: KING | I625: NORRIS | L625: S McGHIE | W625: OAKLEIGH | X625: 13 | Y625: 1 | Z625: 0 | AA625: 2173 | AB625: 1252 | AC625: =(AA625*100)/AB625 -> 173.56230031948883 | AD625: =(X625*4)+(Z625*2) -> 52
A626: GOALKICKERS | W626: NORTHCOTE | X626: 11 | Y626: 3 | Z626: 0 | AA626: 1883 | AB626: 1445 | AC626: =(AA626*100)/AB626 -> 130.31141868512111 | AD626: =(X626*4)+(Z626*2) -> 44
A627: CAULFIELD | C627: DUNCAN 12 | F627: BOOTH 4 | H627: SUTTIE 4 | J627: AMBLER 3 | L627: PEARCE 3 | N627: HOFFAT | P627: EINSEDEL | R627: BLAKE | T627: McLEOD | W627: BRUNSWICK | X627: 9 | Y627: 5 | Z627: 0 | AA627: 1856 | AB627: 1434 | AC627: =(AA627*100)/AB627 -> 129.4281729428173 | AD627: =(X627*4)+(Z627*2) -> 36
A628: YARRAVILLE | C628: S McGHIE 2 | F628: HYLAND 2 | I628: SQUIRE 2 | K628: CAMPAGNA | N628: DIMASI | W628: CAULFIELD | X628: 9 | Y628: 5 | Z628: 0 | AA628: 1840 | AB628: 1455 | AC628: =(AA628*100)/AB628 -> 126.46048109965636 | AD628: =(X628*4)+(Z628*2) -> 36
A630: SPRINGVALE | C630: 1 | D630: 5 | E630: =C630*6+D630 -> 11 | G630: 2 | H630: 7 | I630: =G630*6+H630 -> 19 | K630: 8 | L630: 9 | M630: =K630*6+L630 -> 57 | O630: 13 | P630: 11 | Q630: =O630*6+P630 -> 89 | S630: KILSYTH | W630: SPRINGVALE | X630: 7 | Y630: 7 | Z630: 0 | AA630: 1965 | AB630: 1577 | AC630: =(AA630*100)/AB630 -> 124.60367786937222 | AD630: =(X630*4)+(Z630*2) -> 28
A631: KILSYTH | C631: 5 | D631: 3 | E631: =C631*6+D631 -> 33 | G631: 6 | H631: 7 | I631: =G631*6+H631 -> 43 | K631: 9 | L631: 8 | M631: =K631*6+L631 -> 62 | O631: 11 | P631: 13 | Q631: =O631*6+P631 -> 79 | S631: TORNEY | W631: MORDIALLOC | X631: 7 | Y631: 7 | Z631: 0 | AA631: 1656 | AB631: 1573 | AC631: =(AA631*100)/AB631 -> 105.27654164017801 | AD631: =(X631*4)+(Z631*2) -> 28
A632: BEST PLAYERS | S632: McDONALD | W632: BOX HILL | X632: 7 | Y632: 7 | Z632: 0 | AA632: 1539 | AB632: 1709 | AC632: =(AA632*100)/AB632 -> 90.052662375658286 | AD632: =(X632*4)+(Z632*2) -> 28
A633: SPRINGVALE | C633: HOLDEN | F633: WATSON | I633: CROXFORD | L633: BRAND | N633: WOODMAN | Q633: CADDAYE | W633: KILSYTH | X633: 3 | Y633: 11 | Z633: 0 | AA633: 1451 | AB633: 1736 | AC633: =(AA633*100)/AB633 -> 83.582949308755758 | AD633: =(X633*4)+(Z633*2) -> 12
A634: KILSYTH | C634: BYRNE | F634: D'ANGELO | I634: HODGES | L634: GIBB | N634: LETTS | Q634: ROBBINS | W634: SUNSHINE | X634: 3 | Y634: 11 | Z634: 0 | AA634: 1379 | AB634: 2555 | AC634: =(AA634*100)/AB634 -> 53.972602739726028 | AD634: =(X634*4)+(Z634*2) -> 12
A635: GOALKICKERS | W635: YARRAVILLE | X635: 1 | Y635: 13 | Z635: 0 | AA635: 1221 | AB635: 2365 | AC635: =(AA635*100)/AB635 -> 51.627906976744185 | AD635: =(X635*4)+(Z635*2) -> 4
A636: SPRINGVALE | C636: CADDAYE 3 | F636: WARNER 2 | I636: CROXFORD 2 | L636: HOLDEN 2 | N636: SKILTON | P636: TONKIN | R636: SMITH | T636: FREEMAN
A637: KILSYTH | C637: LETTS 3 | E637: HICKLETON 3 | H637: LINNELL 2 | J637: HODGES 2 | M637: ROSSA
A639: OAKLEIGH | C639: 4 | D639: 9 | E639: =C639*6+D639 -> 33 | G639: 9 | H639: 13 | I639: =G639*6+H639 -> 67 | K639: 15 | L639: 19 | M639: =K639*6+L639 -> 109 | O639: 20 | P639: 24 | Q639: =O639*6+P639 -> 144 | S639: OAKLEIGH
A640: BOX HILL | C640: 1 | D640: 0 | E640: =C640*6+D640 -> 6 | G640: 3 | H640: 3 | I640: =G640*6+H640 -> 21 | K640: 6 | L640: 4 | M640: =K640*6+L640 -> 40 | O640: 10 | P640: 10 | Q640: =O640*6+P640 -> 70 | S640: MAY/BLOOM
A641: BEST PLAYERS
A642: OAKLEIGH | C642: BATTERSBY | F642: ROACH | I642: SPLATT | L642: WILLIAMS | O642: GREENWOOD | R642: HIGGINS
A643: BOX HILL | C643: GLEESON | F643: SCHADE | I643: R WITNISH | L643: P WITNISH | O643: WITHERS | R643: VAN DER PEET
A644: GOALKICKERS
A645: OAKLEIGH | C645: AERTSSEN 5 | F645: HIGGINS 5 | I645: ROACH 4 | K645: NEARY 3 | M645: TODD 2 | O645: MCDONALD
A646: BOX HILL | C646: SCHADE 4 | F646: VAN DER PEET 3 | J646: WITHERS | L646: A DICKENSON | O646: S WITNISH | R646: MOORE
A648: NORTHCOTE | C648: 6 | D648: 4 | E648: =C648*6+D648 -> 40 | G648: 11 | H648: 12 | I648: =G648*6+H648 -> 78 | K648: 15 | L648: 18 | M648: =K648*6+L648 -> 108 | O648: 21 | P648: 23 | Q648: =O648*6+P648 -> 149 | S648: NORTHCOTE
A649: BRUNSWICK | C649: 6 | D649: 2 | E649: =C649*6+D649 -> 38 | G649: 7 | H649: 4 | I649: =G649*6+H649 -> 46 | K649: 9 | L649: 10 | M649: =K649*6+L649 -> 64 | O649: 13 | P649: 13 | Q649: =O649*6+P649 -> 91 | S649: MORGAN/PHILLIPS
A650: BEST PLAYERS
A651: NORTHCOTE | C651: MEGNA | E651: JOHN CHRISTOU | I651: COURTS | L651: McQUINN | O651: JURGENSTEIN | R651: P RYAN
A652: BRUNSWICK | C652: ANDERSON | F652: TOY | I652: NOLAN | L652: HICKMAN | O652: BUCKLEY | R652: BAKER
A653: GOALKICKERS
A654: NORTHCOTE | C654: HEPBURN 5 | F654: JOHN CHRISTOU 3 | J654: JURGENSTEIN 2 | M654: BRAIN 2 | O654: P RYAN 2 | R654: COURTS 2 | T654: MEGNA | V654: ROULSTON | X654: McQUINN | Z654: SMITH | AA654: CEPPI
A655: BRUNSWICK | C655: ANDERSON 4 | F655: TOY 4 | H655: SAGGERS 2 | J655: PARKER | L655: PASTRAS | N655: SAHLBERG
A657: SUNSHINE | C657: 6 | D657: 5 | E657: =C657*6+D657 -> 41 | G657: 8 | H657: 6 | I657: =G657*6+H657 -> 54 | K657: 15 | L657: 11 | M657: =K657*6+L657 -> 101 | O657: 24 | P657: 14 | Q657: =O657*6+P657 -> 158 | S657: SUNSHINE
A658: MORDIALLOC | C658: 6 | D658: 3 | E658: =C658*6+D658 -> 39 | G658: 11 | H658: 6 | I658: =G658*6+H658 -> 72 | K658: 15 | L658: 6 | M658: =K658*6+L658 -> 96 | O658: 18 | P658: 24 | Q658: =O658*6+P658 -> 132 | S658: NEVIS/GOLLOP
A659: BEST PLAYERS
A660: SUNSHINE | C660: WILLIAMS | F660: FOLEY | I660: WAGLAND | L660: MENADUE | O660: DAY | Q660: HUNT
A661: MORDIALLOC | C661: NEVILLE | F661: ENBOM | I661: MASON | L661: BATTY | O661: SMITH | Q661: WALSH
A662: GOALKICKERS
A663: SUNSHINE | C663: DAY 8 | E663: WILLIAMS 4 | H663: AXON 3 | J663: HOLLOW 3 | M663: WAGLAND 2 | P663: FOLEY 2 | R663: WHITNEY 2
A664: MORDIALLOC | C664: NEVILLE 10 | F664: SMITH 2 | H664: DEATON 2 | J664: DAVIS 2 | L664: PARKER | N664: WALSH
A666: ROUND 15 | E666: 25TH JULY | J666: WEATHER | S666: PLAYED AT
D667: 1ST QTR | H667: 2ND QTR | L667: 3RD QTR | P667: FINAL | S667: SUNSHINE
A668: OAKLEIGH | C668: 6 | D668: 4 | E668: =C668*6+D668 -> 40 | G668: 10 | H668: 12 | I668: =G668*6+H668 -> 72 | K668: 22 | L668: 15 | M668: =K668*6+L668 -> 147 | O668: 33 | P668: 21 | Q668: =O668*6+P668 -> 219 | S668: UMPIRE | X668: LADDER | AB668: ROUND | AD668: 15
A669: SUNSHINE | C669: 6 | D669: 5 | E669: =C669*6+D669 -> 41 | G669: 11 | H669: 8 | I669: =G669*6+H669 -> 74 | K669: 14 | L669: 11 | M669: =K669*6+L669 -> 95 | O669: 16 | P669: 14 | Q669: =O669*6+P669 -> 110
A670: BEST PLAYERS | W670: TEAM | X670: W | Y670: L | Z670: D | AA670: FOR | AB670: AGST | AC670: % | AD670: PTS
A671: OAKLEIGH | C671: WILLIAMS | F671: ROACH | I671: COLLINS | L671: HEVERIN | O671: SPLATT | R671: HARPER
A672: SUNSHINE | C672: MENADUE | F672: HUNT | I672: WAGLAND | L672: FOLEY | W672: OAKLEIGH | X672: 14 | Y672: 1 | Z672: 0 | AA672: 2392 | AB672: 1362 | AC672: =(AA672*100)/AB672 -> 175.62408223201174 | AD672: =(X672*4)+(Z672*2) -> 56
A673: GOALKICKERS | N673: CARTER | Q673: HARPER | W673: NORTHCOTE | X673: 12 | Y673: 3 | Z673: 0 | AA673: 2027 | AB673: 1554 | AC673: =(AA673*100)/AB673 -> 130.43758043758044 | AD673: =(X673*4)+(Z673*2) -> 48
A674: OAKLEIGH | C674: AERTSSEN 8 | F674: HIGGINS 6 | H674: NEARY 6 | J674: COLLINS 3 | L674: McDONALD 3 | O674: TODD 2 | Q674: McDONNELL 2 | T674: ROACH | W674: BRUNSWICK | X674: 10 | Y674: 5 | Z674: 0 | AA674: 2040 | AB674: 1538 | AC674: =(AA674*100)/AB674 -> 132.63979193758126 | AD674: =(X674*4)+(Z674*2) -> 40
A675: SUNSHINE | C675: WILLIAMS 3 | F675: DAY 3 | H675: CHATTERTON 2 | K675: HOLLOW 2 | N675: MENADUE | P675: HENLEY | R675: WAGLAND | T675: VELLA | W675: CAULFIELD | X675: 10 | Y675: 5 | Z675: 0 | AA675: 1969 | AB675: 1566 | AC675: =(AA675*100)/AB675 -> 125.73435504469987 | AD675: =(X675*4)+(Z675*2) -> 40
M676: AXON | O676: GORE
A677: BRUNSWICK | C677: 5 | D677: 1 | E677: =C677*6+D677 -> 31 | G677: 12 | H677: 7 | I677: =G677*6+H677 -> 79 | K677: 20 | L677: 14 | M677: =K677*6+L677 -> 134 | O677: 27 | P677: 22 | Q677: =O677*6+P677 -> 184 | S677: BRUNSWICK | W677: MORDIALLOC | X677: 8 | Y677: 7 | Z677: 0 | AA677: 1802 | AB677: 1688 | AC677: =(AA677*100)/AB677 -> 106.75355450236967 | AD677: =(X677*4)+(Z677*2) -> 32
A678: KILSYTH | C678: 5 | D678: 4 | E678: =C678*6+D678 -> 34 | G678: 7 | H678: 7 | I678: =G678*6+H678 -> 49 | K678: 13 | L678: 7 | M678: =K678*6+L678 -> 85 | O678: 15 | P678: 14 | Q678: =O678*6+P678 -> 104 | S678: MAY/STEERE | W678: SPRINGVALE | X678: 7 | Y678: 8 | Z678: 0 | AA678: 2076 | AB678: 1706 | AC678: =(AA678*100)/AB678 -> 121.68815943728019 | AD678: =(X678*4)+(Z678*2) -> 28
A679: BEST PLAYERS | W679: BOX HILL | X679: 7 | Y679: 8 | Z679: 0 | AA679: 1647 | AB679: 1853 | AC679: =(AA679*100)/AB679 -> 88.882892606583923 | AD679: =(X679*4)+(Z679*2) -> 28
A680: BRUNSWICK | C680: LYNCH | F680: TOY | I680: BAKER | L680: RADCHENKO | O680: SAHLBERG | R680: HICKMAN | W680: KILSYTH | X680: 3 | Y680: 12 | Z680: 0 | AA680: 1555 | AB680: 1920 | AC680: =(AA680*100)/AB680 -> 80.989583333333329 | AD680: =(X680*4)+(Z680*2) -> 12
A681: KILSYTH | C681: D 'ANGELO | F681: LETTS | I681: CURRY | L681: BIANCO | O681: HICKLETON | R681: HODGES | W681: SUNSHINE | X681: 3 | Y681: 12 | Z681: 0 | AA681: 1489 | AB681: 2774 | AC681: =(AA681*100)/AB681 -> 53.67700072098053 | AD681: =(X681*4)+(Z681*2) -> 12
A682: GOALKICKERS | K682: TOY 2 | M682: YOUNG | O682: RADCHENKO | W682: YARRAVILLE | X682: 1 | Y682: 14 | Z682: 0 | AA682: 1336 | AB682: 2511 | AC682: =(AA682*100)/AB682 -> 53.205894066109117 | AD682: =(X682*4)+(Z682*2) -> 4
A683: BRUNSWICK | C683: SAGGERS 6 | F683: ANDERSON 4 | I683: LEAHY 4 | K683: S BUCKLEY 3 | N683: SAHLBERG 2 | Q683: LYNCH 2 | S683: CALLANDER 2
A684: KILSYTH | C684: LETTS 5 | E684: HICKLETON 3 | H684: HODGES 2 | J684: BIANCO | L684: CHIBLEY | N684: D'ANGELO | Q684: 2 SHORT
A686: NORTHCOTE | C686: 3 | D686: 4 | E686: =C686*6+D686 -> 22 | G686: 7 | H686: 7 | I686: =G686*6+H686 -> 49 | K686: 13 | L686: 10 | M686: =K686*6+L686 -> 88 | O686: 21 | P686: 18 | Q686: =O686*6+P686 -> 144 | S686: BOX HILL
A687: BOX HILL | C687: 4 | D687: 6 | E687: =C687*6+D687 -> 30 | G687: 7 | H687: 12 | I687: =G687*6+H687 -> 54 | K687: 12 | L687: 15 | M687: =K687*6+L687 -> 87 | O687: 15 | P687: 19 | Q687: =O687*6+P687 -> 109 | S687: STABB/HUTCHINSON
A688: BEST PLAYERS
A689: NORTHCOTE | C689: COURTS | F689: MINNETT | I689: JIM CHRISTOU | L689: HEPBURN | O689: ROULSTON | R689: McQUINN
A690: BOX HILL | C690: R WITNISH | F690: P WITNISH | I690: CHARLES | L690: GLEESON | O690: KYLE | R690: ROBINSON
A691: GOALKICKERS
A692: NORTHCOTE | C692: HEPBURN 7 | F692: SMITH 5 | H692: MEGNA 3 | J692: COURTS 2 | L692: JIM CHRISTOU | O692: JOHN CHRISTOU | R692: CEPPI | T692: P RYAN
A693: BOX HILL | C693: KERRY 4 | E693: P WITNISH 3 | H693: GLEESON 2 | J693: WITHERS 2 | M693: S WITNISH 2 | P693: CHARLES | R693: CRUSE
A695: MORDIALLOC | C695: 6 | D695: 6 | E695: =C695*6+D695 -> 42 | G695: 13 | H695: 7 | I695: =G695*6+H695 -> 85 | K695: 18 | L695: 11 | M695: =K695*6+L695 -> 119 | O695: 22 | P695: 14 | Q695: =O695*6+P695 -> 146 | S695: MORDIALLOC
A696: YARRAVILLE | C696: 3 | D696: 3 | E696: =C696*6+D696 -> 21 | G696: 5 | H696: 10 | I696: =G696*6+H696 -> 40 | K696: 5 | L696: 13 | M696: =K696*6+L696 -> 43 | O696: 16 | P696: 19 | Q696: =O696*6+P696 -> 115 | S696: BLOOM/MORGAN
A697: BEST PLAYERS
A698: MORDIALLOC | C698: MASON | F698: NEVILLE | I698: DEATON | L698: WALSH | O698: PAGNOCCOLO | R698: PAUL BARDOEL
A699: YARRAVILLE | C699: DIMASI | F699: McGHIE
A700: GOALKICKERS
A701: MORDIALLOC | C701: NEVILLE 11 | F701: PAUL BARDOEL 3 | J701: PAGNOCCOLO 2 | M701: LANG 2 | O701: BROMLEY 2 | R701: LEWIS | T701: O'HANLON
A702: YARRAVILLE | C702: DIMASI 6 | F702: McGHIE 2 | H702: SQUIRE 2 | J702: LOBAZZA | L702: NORRIS | N702: RYAN | P702: SPROULE | R702: MARTIN | T702: SHARP
A704: CAULFIELD | C704: 4 | D704: 5 | E704: =C704*6+D704 -> 29 | G704: 10 | H704: 10 | I704: =G704*6+H704 -> 70 | K704: 12 | L704: 14 | M704: =K704*6+L704 -> 86 | O704: 17 | P704: 27 | Q704: =O704*6+P704 -> 129 | S704: NEWCOMEN RD
A705: SPRINGVALE | C705: 9 | D705: 1 | E705: =C705*6+D705 -> 55 | G705: 11 | H705: 4 | I705: =G705*6+H705 -> 70 | K705: 14 | L705: 7 | M705: =K705*6+L705 -> 91 | O705: 17 | P705: 9 | Q705: =O705*6+P705 -> 111 | S705: NELIS/PHILLIPS
A706: BEST PLAYERS
A707: CAULFIELD | C707: MORRISON | F707: HOGAN | I707: BOOTH | L707: EINSEDEL | O707: AMBLER | R707: SAUNDERS
A708: SPRINGVALE | C708: CROXFORD | F708: CADDAYE | I708: ANDERSON | L708: NEWMAN | O708: SMITH | R708: WARNER
A709: GOALKICKERS
A710: CAULFIELD | C710: BLAKE 5 | E710: TAYLOR 3 | G710: BOOTH 3 | I710: DUNCAN 2 | K710: SUTHERLAND | N710: HOGAN | P710: LENNON | R710: STEWART
A711: SPRINGVALE | C711: CARROLL 6 | F711: ANDERSON 3 | I711: WARNER 3 | K711: PINNELL 2 | N711: CADDAYE | P711: FREEMAN | R711: CROXFORD
A713: ROUND 16 | E713: 1ST AUGUST | J713: WEATHER | S713: PLAYED AT
D714: 1ST QTR | H714: 2ND QTR | L714: 3RD QTR | P714: FINAL | S714: PRINCES PARK, CAULFIELD
A715: CAULFIELD | C715: 4 | D715: 3 | E715: =C715*6+D715 -> 27 | G715: 6 | H715: 8 | I715: =G715*6+H715 -> 44 | K715: 12 | L715: 13 | M715: =K715*6+L715 -> 85 | O715: 17 | P715: 20 | Q715: =O715*6+P715 -> 122 | S715: UMPIRE | X715: LADDER | AB715: ROUND | AD715: 16
A716: BRUNSWICK | C716: 4 | D716: 1 | E716: =C716*6+D716 -> 25 | G716: 7 | H716: 5 | I716: =G716*6+H716 -> 47 | K716: 0 | L716: 10 | M716: 13 | O716: 14 | P716: 15 | Q716: =O716*6+P716 -> 99 | S716: STABB/CASEY
A717: BEST PLAYERS | W717: TEAM | X717: W | Y717: L | Z717: D | AA717: FOR | AB717: AGST | AC717: % | AD717: PTS
A718: CAULFIELD | C718: BRASIER | F718: DUNCAN | I718: McLEOD | L718: EINSEDEL | O718: AMBLER | R718: BOOTH
A719: BRUNSWICK | C719: TOY | F719: SAHLBERG | I719: HAMILTON | L719: BAKER | O719: NOLAN | R719: HICKMAN | W719: OAKLEIGH | X719: 15 | Y719: 1 | Z719: 0 | AA719: 2589 | AB719: 1463 | AC719: =(AA719*100)/AB719 -> 176.96514012303487 | AD719: =(X719*4)+(Z719*2) -> 60
A720: GOALKICKERS | W720: NORTHCOTE | X720: 13 | Y720: 3 | Z720: 0 | AA720: 2291 | AB720: 1630 | AC720: =(AA720*100)/AB720 -> 140.5521472392638 | AD720: =(X720*4)+(Z720*2) -> 52
A721: CAULFIELD | C721: DUNCAN 5 | F721: BOOTH 4 | H721: BLAKE 3 | J721: PEARCE 2 | L721: AMBLER | N721: LENNON | P721: SUTHERLAND | W721: CAULFIELD | X721: 11 | Y721: 5 | Z721: 0 | AA721: 2091 | AB721: 1665 | AC721: =(AA721*100)/AB721 -> 125.58558558558559 | AD721: =(X721*4)+(Z721*2) -> 44
A722: BRUNSWICK | C722: ANDERSON 4 | F722: HAMILTON 2 | I722: LEAHY 2 | K722: SAHLBERG 2 | N722: CALLANDER | Q722: LYNCH | S722: SAGGERS | W722: BRUNSWICK | X722: 10 | Y722: 6 | Z722: 0 | AA722: 2139 | AB722: 1660 | AC722: =(AA722*100)/AB722 -> 128.85542168674698 | AD722: =(X722*4)+(Z722*2) -> 40
M723: TOY
A724: SPRINGVALE | C724: 6 | D724: 6 | E724: =C724*6+D724 -> 42 | G724: 10 | H724: 11 | I724: =G724*6+H724 -> 71 | K724: 21 | L724: 18 | M724: =K724*6+L724 -> 144 | O724: 31 | P724: 20 | Q724: =O724*6+P724 -> 206 | S724: YARRAVILLE | W724: SPRINGVALE | X724: 8 | Y724: 8 | Z724: 0 | AA724: 2282 | AB724: 1800 | AC724: =(AA724*100)/AB724 -> 126.77777777777777 | AD724: =(X724*4)+(Z724*2) -> 32
A725: YARRAVILLE | C725: 4 | D725: 3 | E725: =C725*6+D725 -> 27 | G725: 8 | H725: 5 | I725: =G725*6+H725 -> 53 | K725: 11 | L725: 7 | M725: =K725*6+L725 -> 73 | O725: 14 | P725: 10 | Q725: =O725*6+P725 -> 94 | S725: MAY | W725: MORDIALLOC | X725: 8 | Y725: 8 | Z725: 0 | AA725: 1903 | AB725: 1885 | AC725: =(AA725*100)/AB725 -> 100.95490716180372 | AD725: =(X725*4)+(Z725*2) -> 32
A726: BEST PLAYERS | S726: McDONALD | W726: BOX HILL | X726: 8 | Y726: 8 | Z726: 0 | AA726: 1772 | AB726: 1946 | AC726: =(AA726*100)/AB726 -> 91.05858170606372 | AD726: =(X726*4)+(Z726*2) -> 32
A727: SPRINGVALE | C727: CARROLL | F727: CADDAYE | I727: SMITH | L727: WATSON | O727: CROXFORD | R727: WOODMAN | W727: KILSYTH | X727: 3 | Y727: 13 | Z727: 0 | AA727: 1648 | AB727: 2045 | AC727: =(AA727*100)/AB727 -> 80.586797066014668 | AD727: =(X727*4)+(Z727*2) -> 12
A728: YARRAVILLE | C728: McGHIE | F728: LEITCH | I728: MALONEY | L728: LOBAZZA | O728: PHELAN | R728: MARTIN | W728: SUNSHINE | X728: 3 | Y728: 13 | Z728: 0 | AA728: 1565 | AB728: 3038 | AC728: =(AA728*100)/AB728 -> 51.514154048716257 | AD728: =(X728*4)+(Z728*2) -> 12
A729: GOALKICKERS | W729: YARRAVILLE | X729: 1 | Y729: 15 | Z729: 0 | AA729: 1506 | AB729: 2981 | AC729: =(AA729*100)/AB729 -> 50.519959745051999 | AD729: =(X729*4)+(Z729*2) -> 4
A730: SPRINGVALE | C730: CARROLL 18 | F730: PINNELL 4 | I730: CADDAYE 4 | L730: BRAND 2 | N730: GOODINGHAM | Q730: SKEWS | S730: WARNER
A731: YARRAVILLE | C731: LOBAZZA 4 | F731: McGHIE 4 | I731: SPROULE 3 | L731: MARTIN | N731: MALONEY | Q731: RYAN
A733: NORTHCOTE | C733: 10 | D733: 8 | E733: =C733*6+D733 -> 68 | G733: 18 | H733: 15 | I733: =G733*6+H733 -> 123 | K733: 29 | L733: 23 | M733: =K733*6+L733 -> 197 | O733: 39 | P733: 30 | Q733: =O733*6+P733 -> 264 | S733: NORTHCOTE
A734: SUNSHINE | C734: 1 | D734: 3 | E734: =C734*6+D734 -> 9 | G734: 4 | H734: 7 | I734: =G734*6+H734 -> 31 | K734: 6 | L734: 9 | M734: =K734*6+L734 -> 45 | O734: 10 | P734: 16 | Q734: =O734*6+P734 -> 76 | S734: STEERE/NELIS
A735: BEST PLAYERS
A736: NORTHCOTE | C736: P RYAN | F736: M RYAN | I736: JURGENSTEIN | L736: COURTS | O736: JIM CHRISTOU | R736: ROULSTON
A737: SUNSHINE | C737: CAMPBELL | F737: WILLIAMS | I737: GORE | L737: BARLOW | O737: WHITNEY | R737: FOLEY
A738: GOALKICKERS
A739: NORTHCOTE | C739: JURGENSTEIN 9 | F739: P RYAN 7 | H739: SMITH 5 | J739: JIM CHRISTOU 3 | M739: CEPPI 3 | O739: CASTIAGINI 3 | R739: COURTS 3 | T739: HOSKIN 2 | W739: TAIRI 2 | X739: JOHN CHRISTOU | AA739: HEPBURN
A740: SUNSHINE | C740: WILLIAMS 4 | F740: HOLLOW 2 | I740: WHITNEY 2 | L740: DAY | N740: AXON
A742: BOX HILL | C742: 5 | D742: 1 | E742: =C742*6+D742 -> 31 | G742: 11 | H742: 7 | I742: =G742*6+H742 -> 73 | K742: 14 | L742: 10 | M742: =K742*6+L742 -> 94 | O742: 18 | P742: 17 | Q742: =O742*6+P742 -> 125 | S742: KILSYTH
A743: KILSYTH | C743: 3 | D743: 4 | E743: =C743*6+D743 -> 22 | G743: 6 | H743: 9 | I743: =G743*6+H743 -> 45 | K743: 9 | L743: 13 | M743: =K743*6+L743 -> 67 | O743: 13 | P743: 15 | Q743: =O743*6+P743 -> 93 | S743: MORGAN/BLOOM
A744: BEST PLAYERS
A745: BOX HILL | C745: SCHADE | F745: S WITNISH | I745: LAWTHER | L745: R WITNISH | O745: KAINEY | Q745: VAN DER PEET
A746: KILSYTH | C746: SHAPPARD | F746: D'ANGELO | I746: LETTS | L746: HICKLETON | O746: GIBB | Q746: ROHDE
A747: GOALKICKERS
A748: BOX HILL | C748: SCHADE 4 | F748: LAWTHER 4 | I748: KAINEY 2 | K748: S WITNISH 2 | N748: CAREY | P748: CHARLES | R748: YOUNG | T748: CRUSE | V748: KYLE | W748: R WITNISH
A749: KILSYTH | C749: LINNELL 3 | F749: D'ANGELO 2 | I749: LETTS 2 | K749: PETERSON 2 | N749: BASS | P749: BIANCO | R749: GIBB | T749: HICKLEMAN
A751: OAKLEIGH | C751: 8 | D751: 3 | E751: =C751*6+D751 -> 51 | G751: 11 | H751: 4 | I751: =G751*6+H751 -> 70 | K751: 23 | L751: 6 | M751: =K751*6+L751 -> 144 | O751: 31 | P751: 11 | Q751: =O751*6+P751 -> 197 | S751: OAKLEIGH
A752: MORDIALLOC | C752: 4 | D752: 3 | E752: =C752*6+D752 -> 27 | G752: 8 | H752: 6 | I752: =G752*6+H752 -> 54 | K752: 13 | L752: 7 | M752: =K752*6+L752 -> 85 | O752: 15 | P752: 11 | Q752: =O752*6+P752 -> 101 | S752: HUTCHINSON/BUDGE
A753: BEST PLAYERS
A754: OAKLEIGH | C754: WILLIAMS | F754: NEARY | I754: ROACH | L754: HARTLEY | O754: SPLATT | R754: COLLINS
A755: MORDIALLOC | C755: LANG | F755: WALSH | I755: MASON | L755: DUNBAR | O755: PAGNOCCOLO | R755: NEVILLE
A756: GOALKICKERS
A757: OAKLEIGH | C757: NEARY 9 | F757: AERTSSEN 5 | I757: COLLINS 5 | K757: HIGGINS 3 | N757: HARPER 3 | P757: TODD 2 | R757: WILLIAMS 2 | U757: BATTERSBY | X757: CALLERY
A758: MORDIALLOC | C758: NEVILLE 6 | F758: PAGNOCCOLO 4 | I758: BOURNE 2 | K758: BROMLEY | N758: PAUL BARDOEL | Q758: CLIFFORD
A760: ROUND 17 | E760: 8TH AUGUST | J760: WEATHER | S760: PLAYED AT
D761: 1ST QTR | H761: 2ND QTR | L761: 3RD QTR | P761: FINAL | S761: OAKLEIGH
A762: OAKLEIGH | C762: 0 | D762: 0 | E762: =C762*6+D762 -> 0 | G762: 0 | H762: 0 | I762: =G762*6+H762 -> 0 | K762: 0 | L762: 0 | M762: =K762*6+L762 -> 0 | O762: 18 | P762: 16 | Q762: =O762*6+P762 -> 124 | S762: UMPIRE | X762: LADDER | AB762: ROUND | AD762: 17
A763: NORTHCOTE | C763: 0 | D763: 0 | E763: =C763*6+D763 -> 0 | G763: 0 | H763: 0 | I763: =G763*6+H763 -> 0 | K763: 0 | L763: 0 | M763: =K763*6+L763 -> 0 | O763: 18 | P763: 14 | Q763: =O763*6+P763 -> 122
A764: BEST PLAYERS | W764: TEAM | X764: W | Y764: L | Z764: D | AA764: FOR | AB764: AGST | AC764: % | AD764: PTS
A765: OAKLEIGH
A766: NORTHCOTE | W766: OAKLEIGH | X766: 16 | Y766: 1 | Z766: 0 | AA766: 2713 | AB766: 1585 | AC766: =(AA766*100)/AB766 -> 171.16719242902209 | AD766: =(X766*4)+(Z766*2) -> 64
A767: GOALKICKERS | W767: NORTHCOTE | X767: 13 | Y767: 4 | Z767: 0 | AA767: 2413 | AB767: 1754 | AC767: =(AA767*100)/AB767 -> 137.57126567844927 | AD767: =(X767*4)+(Z767*2) -> 52
A768: OAKLEIGH | W768: BRUNSWICK | X768: 11 | Y768: 6 | Z768: 0 | AA768: 2332 | AB768: 1749 | AC768: =(AA768*100)/AB768 -> 133.33333333333334 | AD768: =(X768*4)+(Z768*2) -> 44
A769: NORTHCOTE | W769: CAULFIELD | X769: 11 | Y769: 6 | Z769: 0 | AA769: 2181 | AB769: 1761 | AC769: =(AA769*100)/AB769 -> 123.85008517887564 | AD769: =(X769*4)+(Z769*2) -> 44
A771: BRUNSWICK | C771: 0 | D771: 0 | E771: =C771*6+D771 -> 0 | G771: 0 | H771: 0 | I771: =G771*6+H771 -> 0 | K771: 0 | L771: 0 | M771: =K771*6+L771 -> 0 | O771: 27 | P771: 31 | Q771: =O771*6+P771 -> 193 | S771: BRUNSWICK | W771: SPRINGVALE | X771: 9 | Y771: 8 | Z771: 0 | AA771: 2410 | AB771: 1923 | AC771: =(AA771*100)/AB771 -> 125.32501300052002 | AD771: =(X771*4)+(Z771*2) -> 36
A772: YARRAVILLE | C772: 0 | D772: 0 | E772: =C772*6+D772 -> 0 | G772: 0 | H772: 0 | I772: =G772*6+H772 -> 0 | K772: 0 | L772: 0 | M772: =K772*6+L772 -> 0 | O772: 13 | P772: 11 | Q772: =O772*6+P772 -> 89 | W772: BOX HILL | X772: 9 | Y772: 8 | Z772: 0 | AA772: 1868 | AB772: 2036 | AC772: =(AA772*100)/AB772 -> 91.748526522593323 | AD772: =(X772*4)+(Z772*2) -> 36
A773: BEST PLAYERS | W773: MORDIALLOC | X773: 8 | Y773: 9 | Z773: 0 | AA773: 2026 | AB773: 2013 | AC773: =(AA773*100)/AB773 -> 100.64580228514654 | AD773: =(X773*4)+(Z773*2) -> 32
A774: BRUNSWICK | W774: KILSYTH | X774: 4 | Y774: 13 | Z774: 0 | AA774: 1779 | AB774: 2117 | AC774: =(AA774*100)/AB774 -> 84.034010392064246 | AD774: =(X774*4)+(Z774*2) -> 16
A775: YARRAVILLE | W775: SUNSHINE | X775: 3 | Y775: 14 | Z775: 0 | AA775: 1637 | AB775: 3169 | AC775: =(AA775*100)/AB775 -> 51.656674029662355 | AD775: =(X775*4)+(Z775*2) -> 12
A776: GOALKICKERS | W776: YARRAVILLE | X776: 1 | Y776: 16 | Z776: 0 | AA776: 1595 | AB776: 3174 | AC776: =(AA776*100)/AB776 -> 50.252047889098925 | AD776: =(X776*4)+(Z776*2) -> 4
A777: BRUNSWICK
A778: YARRAVILLE
A780: BOX HILL | C780: 0 | D780: 0 | E780: =C780*6+D780 -> 0 | G780: 0 | H780: 0 | I780: =G780*6+H780 -> 0 | K780: 0 | L780: 0 | M780: =K780*6+L780 -> 0 | O780: 12 | P780: 24 | Q780: =O780*6+P780 -> 96 | S780: BOX HILL
A781: CAULFIELD | C781: 0 | D781: 0 | E781: =C781*6+D781 -> 0 | G781: 0 | H781: 0 | I781: =G781*6+H781 -> 0 | K781: 0 | L781: 0 | M781: =K781*6+L781 -> 0 | O781: 11 | P781: 24 | Q781: =O781*6+P781 -> 90
A782: BEST PLAYERS
A783: BOX HILL
A784: CAULFIELD
A785: GOALKICKERS
A786: BOX HILL
A787: CAULFIELD
A789: SPRINGVALE | C789: 0 | D789: 0 | E789: =C789*6+D789 -> 0 | G789: 0 | H789: 0 | I789: =G789*6+H789 -> 0 | K789: 0 | L789: 0 | M789: =K789*6+L789 -> 0 | O789: 19 | P789: 14 | Q789: =O789*6+P789 -> 128 | S789: MORDIALLOC
A790: MORDIALLOC | C790: 0 | D790: 0 | E790: =C790*6+D790 -> 0 | G790: 0 | H790: 0 | I790: =G790*6+H790 -> 0 | K790: 0 | L790: 0 | M790: =K790*6+L790 -> 0 | O790: 18 | P790: 15 | Q790: =O790*6+P790 -> 123
A791: BEST PLAYERS
A792: SPRINGVALE
A793: MORDIALLOC
A794: GOALKICKERS
A795: SPRINGVALE
A796: MORDIALLOC
A798: KILSYTH | C798: 0 | D798: 0 | E798: =C798*6+D798 -> 0 | G798: 0 | H798: 0 | I798: =G798*6+H798 -> 0 | K798: 0 | L798: 0 | M798: =K798*6+L798 -> 0 | O798: 19 | P798: 17 | Q798: =O798*6+P798 -> 131 | S798: SUNSHINE
A799: SUNSHINE | C799: 0 | D799: 0 | E799: =C799*6+D799 -> 0 | G799: 0 | H799: 0 | I799: =G799*6+H799 -> 0 | K799: 0 | L799: 0 | M799: =K799*6+L799 -> 0 | O799: 10 | P799: 12 | Q799: =O799*6+P799 -> 72
A800: BEST PLAYERS
A801: KILSYTH
A802: SUNSHINE
A803: GOALKICKERS
A804: KILSYTH
A805: SUNSHINE
A807: ROUND 18 | E807: 15TH AUGUST | J807: WEATHER | S807: PLAYED AT
D808: 1ST QTR | H808: 2ND QTR | L808: 3RD QTR | P808: FINAL | S808: KILSYTH
A809: OAKLEIGH | C809: 7 | D809: 3 | E809: =C809*6+D809 -> 45 | G809: 13 | H809: 9 | I809: =G809*6+H809 -> 87 | K809: 22 | L809: 13 | M809: =K809*6+L809 -> 145 | O809: 30 | P809: 17 | Q809: =O809*6+P809 -> 197 | S809: UMPIRE | X809: LADDER | AB809: ROUND | AD809: 18
A810: KILSYTH | C810: 3 | D810: 5 | E810: =C810*6+D810 -> 23 | G810: 6 | H810: 11 | I810: =G810*6+H810 -> 47 | K810: 7 | L810: 12 | M810: =K810*6+L810 -> 54 | O810: 12 | P810: 15 | Q810: =O810*6+P810 -> 87 | S810: NELIS/BRADSHAW
A811: BEST PLAYERS | W811: TEAM | X811: W | Y811: L | Z811: D | AA811: FOR | AB811: AGST | AC811: % | AD811: PTS
A812: OAKLEIGH | C812: NEARY | F812: HEVERIN | I812: COLLINS | L812: WILLIAMS | O812: HARPER | R812: ROACH
A813: KILSYTH | C813: BYRNE | F813: HICKLETON | I813: D'ANGELO | L813: LETTS | O813: ELLIOTT | R813: ROBBINS | W813: OAKLEIGH | X813: 17 | Y813: 1 | Z813: 0 | AA813: 2910 | AB813: 1672 | AC813: =(AA813*100)/AB813 -> 174.04306220095694 | AD813: =(X813*4)+(Z813*2) -> 68
A814: GOALKICKERS | L814: CARTER | N814: McDONALD | Q814: CALLERY | W814: NORTHCOTE | X814: 14 | Y814: 4 | Z814: 0 | AA814: 2560 | AB814: 1851 | AC814: =(AA814*100)/AB814 -> 138.30361966504591 | AD814: =(X814*4)+(Z814*2) -> 56
A815: OAKLEIGH | C815: NEARY 10 | F815: OWEN 4 | H815: HARPER 3 | J815: HIGGINS 3 | L815: COLLINS 3 | N815: C HEVERIN 2 | Q815: MATTHEY | S815: BATTERSBY | W815: BRUNSWICK | X815: 12 | Y815: 6 | Z815: 0 | AA815: 2480 | AB815: 1891 | AC815: =(AA815*100)/AB815 -> 131.14754098360655 | AD815: =(X815*4)+(Z815*2) -> 48
A816: KILSYTH | C816: ROHDE 4 | E816: BIANCO 3 | G816: D'ANGELO | J816: ELLIOTT | M816: GIBB | O816: HICKLETON | R816: LETTS | W816: CAULFIELD | X816: 12 | Y816: 6 | Z816: 0 | AA816: 2385 | AB816: 1837 | AC816: =(AA816*100)/AB816 -> 129.83124659771366 | AD816: =(X816*4)+(Z816*2) -> 48
A818: BRUNSWICK | C818: 5 | D818: 2 | E818: =C818*6+D818 -> 32 | G818: 9 | H818: 10 | I818: =G818*6+H818 -> 64 | K818: 16 | L818: 12 | M818: =K818*6+L818 -> 108 | O818: 22 | P818: 16 | Q818: =O818*6+P818 -> 148 | S818: NEWCOMEN RD | W818: BOX HILL | X818: 10 | Y818: 8 | Z818: 0 | AA818: 2036 | AB818: 2131 | AC818: =(AA818*100)/AB818 -> 95.54199906147349 | AD818: =(X818*4)+(Z818*2) -> 40
A819: SPRINGVALE | C819: 2 | D819: 5 | E819: =C819*6+D819 -> 17 | G819: 6 | H819: 7 | I819: =G819*6+H819 -> 43 | K819: 13 | L819: 12 | M819: =K819*6+L819 -> 90 | O819: 21 | P819: 16 | Q819: =O819*6+P819 -> 142 | S819: MORGAN | W819: SPRINGVALE | X819: 9 | Y819: 9 | Z819: 0 | AA819: 2552 | AB819: 2071 | AC819: =(AA819*100)/AB819 -> 123.22549492998552 | AD819: =(X819*4)+(Z819*2) -> 36
A820: BEST PLAYERS | S820: HUTCHINSON | W820: MORDIALLOC | X820: 8 | Y820: 10 | Z820: 0 | AA820: 2123 | AB820: 2160 | AC820: =(AA820*100)/AB820 -> 98.287037037037038 | AD820: =(X820*4)+(Z820*2) -> 32
A821: BRUNSWICK | C821: SAHLBERG | F821: TOY | I821: HAMILTON | L821: JUDGE | O821: HICKMAN | R821: S BUCKLEY | W821: KILSYTH | X821: 4 | Y821: 14 | Z821: 0 | AA821: 1866 | AB821: 2314 | AC821: =(AA821*100)/AB821 -> 80.639585133967159 | AD821: =(X821*4)+(Z821*2) -> 16
A822: SPRINGVALE | C822: CARROLL | F822: McCOMB | I822: ANDERSON | L822: CADDAYE | O822: BRAND | R822: FOTINIOTIS | W822: SUNSHINE | X822: 3 | Y822: 15 | Z822: 0 | AA822: 1713 | AB822: 3373 | AC822: =(AA822*100)/AB822 -> 50.785650756003555 | AD822: =(X822*4)+(Z822*2) -> 12
A823: GOALKICKERS | W823: YARRAVILLE | X823: 1 | Y823: 17 | Z823: 0 | AA823: 1690 | AB823: 3342 | AC823: =(AA823*100)/AB823 -> 50.568521843207662 | AD823: =(X823*4)+(Z823*2) -> 4
A824: BRUNSWICK | C824: JUDGE 6 | E824: HICKMAN 5 | G824: SAGGERS 4 | J824: SAHLBERG 2 | M824: PARKER 2 | O824: S BUCKLEY | R824: NARDELLA | T824: RADCHENKO
A825: SPRINGVALE | C825: SMITH 7 | E825: ANDERSON 4 | H825: CARROLL 3 | J825: COOKE 2 | L825: CADDAYE 2 | O825: FOTINIOTIS | R825: SKEWS | T825: CROXFORD
A827: BOX HILL | C827: 6 | D827: 4 | E827: =C827*6+D827 -> 40 | G827: 10 | H827: 7 | I827: =G827*6+H827 -> 67 | K827: 21 | L827: 10 | M827: =K827*6+L827 -> 136 | O827: 26 | P827: 12 | Q827: =O827*6+P827 -> 168 | S827: YARRAVILLE
A828: YARRAVILLE | C828: 4 | D828: 5 | E828: =C828*6+D828 -> 29 | G828: 8 | H828: 10 | I828: =G828*6+H828 -> 58 | K828: 8 | L828: 13 | M828: =K828*6+L828 -> 61 | O828: 13 | P828: 17 | Q828: =O828*6+P828 -> 95 | S828: GOLLOP/CROXFORD
A829: BEST PLAYERS
A830: BOX HILL | C830: SCHADE | F830: KAINEY | I830: R WITNISH | L830: S WITNISH | O830: GLEESON
A831: YARRAVILLE | C831: ROGOZIC | F831: McGHIE | I831: DIMASI | L831: LOBAZZA | O831: PHELAN
A832: GOALKICKERS
A833: BOX HILL | C833: SCHADE 6 | F833: KAINEY 5 | H833: S WITNISH 3 | K833: GLEESON 2 | N833: R WITNISH 2 | Q833: LAWTHER 2 | S833: WITHERS 2 | V833: CRUSE | X833: KYLE | Y833: McCANN | AA833: ROBERTS
A834: YARRAVILLE | C834: DIMASI 4 | F834: SPROULE 3 | I834: MARTIN 2 | K834: LEITCH 2 | N834: LOBAZZA | P834: MONOGHAN
A836: NORTHCOTE | C836: 4 | D836: 4 | E836: =C836*6+D836 -> 28 | G836: 13 | H836: 5 | I836: =G836*6+H836 -> 83 | K836: 16 | L836: 14 | M836: =K836*6+L836 -> 110 | O836: 21 | P836: 21 | Q836: =O836*6+P836 -> 147 | S836: NORTHCOTE
A837: MORDIALLOC | C837: 3 | D837: 2 | E837: =C837*6+D837 -> 20 | G837: 7 | H837: 5 | I837: =G837*6+H837 -> 47 | K837: 10 | L837: 7 | M837: =K837*6+L837 -> 67 | O837: 14 | P837: 13 | Q837: =O837*6+P837 -> 97 | S837: MAY/GRIFFITHS
A838: BEST PLAYERS
A839: NORTHCOTE | C839: P RYAN | F839: MEGNA | I839: REDENBACH | L839: JIM CHRISTOU | O839: COURTS | Q839: D ?
A840: MORDIALLOC | C840: DEATON | F840: WALSH | I840: DUNBAR | L840: PETER BARDOEL | O840: PAUL BARDOEL | R840: BATTY
A841: GOALKICKERS
A842: NORTHCOTE | C842: P RYAN 6 | F842: JURGENSTEIN 5 | I842: MEGNA 3 | K842: JIM CHRISTOU 3 | O842: HEPBURN 3 | R842: CASTIAGINI
A843: MORDIALLOC | C843: NEVILLE 4 | E843: BOURNE 3 | G843: PETER BARDOEL 2 | K843: PAUL BARDOEL 2 | O843: PARKER | Q843: EMBOM | S843: DUNBAR
A845: CAULFIELD | C845: 6 | D845: 5 | E845: =C845*6+D845 -> 41 | G845: 13 | H845: 11 | I845: =G845*6+H845 -> 89 | K845: 22 | L845: 19 | M845: =K845*6+L845 -> 151 | O845: 30 | P845: 24 | Q845: =O845*6+P845 -> 204 | S845: PRINCES PARK, CAULFIELD
A846: SUNSHINE | C846: 5 | D846: 6 | E846: =C846*6+D846 -> 36 | G846: 8 | H846: 7 | I846: =G846*6+H846 -> 55 | K846: 9 | L846: 13 | M846: =K846*6+L846 -> 67 | O846: 10 | P846: 16 | Q846: =O846*6+P846 -> 76 | S846: TORNEY/BUDGE
A847: BEST PLAYERS
A848: CAULFIELD | C848: AMBLER | F848: PEARCE | I848: FARINSKI | L848: DUNCAN | O848: McLEOD | R848: LENNON
A849: SUNSHINE | C849: MENADUE | F849: BARLOW | I849: WILLIAMS | L849: FOLEY | O849: SIMPSON
A850: GOALKICKERS
A851: CAULFIELD | C851: DUNCAN 8 | F851: BLAKE 5 | H851: BOOTH 5 | J851: PEARCE 4 | L851: MCLEOD 2 | N851: MORRISON | P851: GUILLERI | R851: AMBLER | T851: SUTHERLAND | W851: McLENNAN
A852: SUNSHINE | C852: MENADUE 3 | F852: SIMPSON 3 | I852: DAY 2 | K852: WHITNEY 2 | N852: WILLIAMS | P852: 1 OVER
A854: FINALS
A855: 1ST SEMI | E855: 22ND AUGUST | J855: WEATHER | S855: PLAYED AT
D856: 1ST QTR | H856: 2ND QTR | L856: 3RD QTR | P856: FINAL | S856: TOORAK PARK
A857: CAULFIELD | C857: 5 | D857: 2 | E857: =C857*6+D857 -> 32 | G857: 12 | H857: 5 | I857: =G857*6+H857 -> 77 | K857: 16 | L857: 8 | M857: =K857*6+L857 -> 104 | O857: 27 | P857: 14 | Q857: =O857*6+P857 -> 176 | S857: UMPIRE
A858: BRUNSWICK | C858: 4 | D858: 3 | E858: =C858*6+D858 -> 27 | G858: 7 | H858: 6 | I858: =G858*6+H858 -> 48 | K858: 12 | L858: 9 | M858: =K858*6+L858 -> 81 | O858: 15 | P858: 9 | Q858: =O858*6+P858 -> 99 | S858: QUINN/VERGONA
A859: BEST PLAYERS
A860: CAULFIELD | C860: AMBLER | F860: HOGAN | I860: PEARCE | L860: BOOTH | O860: LENNON | R860: SUTHERLAND
A861: BRUNSWICK | C861: HAMILTON | F861: RADCHENKO | I861: SCULLY | L861: BROWN | O861: S BUCKLEY | R861: HICKMAN
A862: GOALKICKERS
A863: CAULFIELD | C863: BOOTH 6 | E863: McLENNAN 4 | H863: McLEOD 4 | J863: AMBLER 3 | L863: PEARCE 3 | N863: GUILLERI 2 | P863: BLAKE | R863: MORRISON | T863: SUTHERLAND | W863: LENNON | X863: HOGAN
A864: BRUNSWICK | C864: HICKMAN 5 | F864: HAMILTON 3 | I864: RADCHENKO 2 | L864: ANDERSON | O864: CALLANDER | R864: LEAHY | T864: SAGGERS | V864: TOY
A866: 2ND SEMI | E866: 29TH AUGUST | J866: WEATHER
A867: NORTHCOTE | C867: 9 | D867: 5 | E867: =C867*6+D867 -> 59 | G867: 15 | H867: 10 | I867: =G867*6+H867 -> 100 | K867: 17 | L867: 13 | M867: =K867*6+L867 -> 115 | O867: 25 | P867: 20 | Q867: =O867*6+P867 -> 170 | S867: TOORAK PARK
A868: OAKLEIGH | C868: 2 | D868: 1 | E868: =C868*6+D868 -> 13 | G868: 9 | H868: 5 | I868: =G868*6+H868 -> 59 | K868: 16 | L868: 7 | M868: =K868*6+L868 -> 103 | O868: 23 | P868: 9 | Q868: =O868*6+P868 -> 147 | S868: GROOM/RYAN
A869: BEST PLAYERS
A870: NORTHCOTE | C870: McQUINN | F870: JIM CHRISTOU | I870: MEGNA | L870: MINNETT | O870: P RYAN | R870: M RYAN
A871: OAKLEIGH | C871: OWEN | F871: BATTERSBY | I871: McDONALD | L871: HARTLEY | O871: NEARY
A872: GOALKICKERS
A873: NORTHCOTE | C873: MEGNA 5 | F873: JIM CHRISTOU 4 | I873: HEPBURN 3 | K873: JURGENSTEIN 3 | N873: P RYAN 3 | P873: SMITH 2 | R873: ROULSTON 2 | U873: MINNETT | W873: McQUINN | X873: CASTIAGINI
A874: OAKLEIGH | C874: NEARY 7 | F874: OWEN 5 | H874: AERTSSEN 4 | K874: HARPER 3 | M874: MATTHEY | P874: TODD | R874: ROACH | U874: CALLERY
A876: PRELIMINARY | E876: 5TH SEPTEMBER | J876: WEATHER
A877: CAULFIELD | C877: 6 | D877: 3 | E877: =C877*6+D877 -> 39 | G877: 9 | H877: 6 | I877: =G877*6+H877 -> 60 | K877: 20 | L877: 9 | M877: =K877*6+L877 -> 129 | O877: 25 | P877: 15 | Q877: =O877*6+P877 -> 165 | S877: TOORAK PARK
A878: OAKLEIGH | C878: 5 | D878: 3 | E878: =C878*6+D878 -> 33 | G878: 14 | H878: 10 | I878: =G878*6+H878 -> 94 | K878: 20 | L878: 11 | M878: =K878*6+L878 -> 131 | O878: 21 | P878: 13 | Q878: =O878*6+P878 -> 139 | S878: OGSTON/FITZPATRICK
A879: BEST PLAYERS
A880: CAULFIELD | C880: HOGAN | F880: McLENNAN | I880: BOOTH | L880: SAUNDERS | O880: AMBLER | R880: HOCKING
A881: OAKLEIGH | C881: HARPER | F881: SPLATT | I881: HARTNEY | L881: COLLINS | O881: ROACH | R881: WILLIAMS
A882: GOALKICKERS
A883: CAULFIELD | C883: BOOTH 7 | F883: DUNCAN 6 | I883: McLENNAN 3 | L883: HOCKING 3 | O883: McLEOD 2 | R883: LENNON 2 | T883: AMBLER | V883: GRIGGS
A884: OAKLEIGH | C884: AERTSSEN 5 | F884: HIGGINS 4 | H884: NEARY 3 | J884: WILLIAMS 2 | M884: TODD 2 | O884: ROACH | Q884: McDONALD | S884: OWEN | U884: COLLINS | W884: HARPER
A886: GRAND | E886: 12TH SEPTEMBER | J886: WEATHER
A887: NORTHCOTE | C887: 0 | D887: 6 | E887: =C887*6+D887 -> 6 | G887: 2 | H887: 9 | I887: =G887*6+H887 -> 21 | K887: 9 | L887: 13 | M887: =K887*6+L887 -> 67 | O887: 12 | P887: 15 | Q887: =O887*6+P887 -> 87 | S887: TOORAK PARK
A888: CAULFIELD | C888: 4 | D888: 4 | E888: =C888*6+D888 -> 28 | G888: 7 | H888: 9 | I888: =G888*6+H888 -> 51 | K888: 9 | L888: 11 | M888: =K888*6+L888 -> 65 | O888: 11 | P888: 16 | Q888: =O888*6+P888 -> 82 | S888: QUINN/FITZPATRICK
A889: BEST PLAYERS
A890: NORTHCOTE | C890: MINNETT | F890: McQUINN | I890: ROULSTON | L890: JURGENSTEIN | O890: P RYAN | R890: DILORIO
A891: CAULFIELD | C891: EINSEDEL | F891: PEARCE | I891: MCLEOD | L891: FARINSKI | O891: McLENNAN | R891: BRASIER
A892: GOALKICKERS
A893: NORTHCOTE | C893: JURGENSTEIN 4 | F893: HEPBURN 3 | I893: JIM CHRISTOU 2 | L893: DILORIO | N893: SMITH | P893: MINNETT
A894: CAULFIELD | C894: McLENNAN 3 | F894: GUILLERI 2 | I894: HOCKING 2 | K894: MORRISON | N894: BOOTH | P894: LENNON | R894: STEWART