A1: Victorian Football Association
A2: Season 1983 - Division One
A3: © Copyright Wal Williams | F3: First created: 14 November 2015
A4: Contact: joywalwi at gmail dot com | F4: Last updated: 3 December 2016 | W4: VFA Results and tables - Link to the main index page
A5: You are free to copy this document in whole or part provided that proper acknowledgement is given to the author. All rights reserved.
A7: 1983 | C7: 1ST DIVISION
A8: ROUND 1 | D8: 3RD APRIL | I8: WEATHER | S8: PLAYED AT
D9: 1ST QTR | H9: 2ND QTR | L9: 3RD QTR | P9: FINAL | S9: PRESTON
A10: PORT MELBOURNE | C10: 4 | D10: 7 | E10: 31 | G10: 7 | H10: 9 | I10: 51 | K10: 17 | L10: 11 | M10: 113 | O10: 24 | P10: 14 | Q10: 158 | S10: UMPIRES | X10: LADDER | AB10: ROUND | AD10: 1
A11: PRESTON | C11: 4 | D11: 7 | E11: 31 | G11: 14 | H11: 9 | I11: 93 | K11: 17 | L11: 10 | M11: 112 | O11: 21 | P11: 12 | Q11: 138 | S11: GROOM :RYAN
A12: BEST PLAYERS | W12: TEAM | X12: W | Y12: L | Z12: D | AA12: FOR | AB12: AGST | AC12: % | AD12: PTS
A13: PORT MELBOURNE | C13: DOYLE | E13: ANDERSON | H13: SWAN | K13: ROBERTSON | N13: MILDENHALL | Q13: WILKINSON
A14: PRESTON | C14: SHAW | E14: AUSTEN | H14: McKEON | K14: BERRY | N14: BRINE | W14: DANDENONG | X14: 1 | Y14: 0 | Z14: 0 | AA14: 236 | AB14: 90 | AC14: =(AA14/AB14)*100 -> 262.22222222222223 | AD14: =(X14*4)+(Z14*2) -> 4
A15: GOALKICKERS | R15: EBEYER | W15: GEELONG WEST | X15: 1 | Y15: 0 | Z15: 0 | AA15: 154 | AB15: 69 | AC15: =(AA15/AB15)*100 -> 223.18840579710147 | AD15: =(X15*4)+(Z15*2) -> 4
A16: PORT MELBOURNE | C16: ANDERSON 8 | F16: COOK 4 | H16: HICKS 4 | J16: WILKINSON 3 | M16: SWAN | O16: BARKER | Q16: RODDA | S16: DOYLE | W16: WILLIAMSTOWN | X16: 1 | Y16: 0 | Z16: 0 | AA16: 198 | AB16: 101 | AC16: =(AA16/AB16)*100 -> 196.03960396039605 | AD16: =(X16*4)+(Z16*2) -> 4
A17: PRESTON | C17: BOURKE 6 | F17: SHAW 3 | H17: WARREN 2 | J17: VANN 2 | L17: TOWAN 2 | N17: FROST 2 | P17: BODEN 2 | R17: OHLSEN | W17: CAMBERWELL | X17: 1 | Y17: 0 | Z17: 0 | AA17: 178 | AB17: 101 | AC17: =(AA17/AB17)*100 -> 176.23762376237624 | AD17: =(X17*4)+(Z17*2) -> 4
P18: BRINE | S18: VENUE: BEACH ROAD
A19: SANDRINGHAM | C19: 8 | D19: 5 | E19: 53 | G19: 11 | H19: 9 | I19: 75 | K19: 16 | L19: 11 | M19: 107 | O19: 22 | P19: 14 | Q19: 146 | S19: ALLSOPP | W19: PORT MELBOURNE | X19: 1 | Y19: 0 | Z19: 0 | AA19: 158 | AB19: 136 | AC19: =(AA19/AB19)*100 -> 116.1764705882353 | AD19: =(X19*4)+(Z19*2) -> 4
A20: COBURG | C20: 3 | D20: 3 | E20: 21 | G20: 9 | H20: 6 | I20: 60 | K20: 11 | L20: 11 | M20: 77 | O20: 19 | P20: 16 | Q20: 130 | S20: FITZPATRICK | W20: SANDRINGHAM | X20: 1 | Y20: 0 | Z20: 0 | AA20: 146 | AB20: 130 | AC20: =(AA20/AB20)*100 -> 112.30769230769231 | AD20: =(X20*4)+(Z20*2) -> 4
A21: BEST PLAYERS | W21: COBURG | X21: 0 | Y21: 1 | Z21: 0 | AA21: 130 | AB21: 146 | AC21: =(AA21/AB21)*100 -> 89.041095890410958 | AD21: =(X21*4)+(Z21*2) -> 0
A22: SANDRINGHAM | C22: GALLAGHER | F22: SARAU | I22: MACLEOD | L22: PLEDGER | O22: ADAMS | Q22: HAYES | W22: PRESTON | X22: 0 | Y22: 1 | Z22: 0 | AA22: 136 | AB22: 158 | AC22: =(AA22/AB22)*100 -> 86.075949367088612 | AD22: =(X22*4)+(Z22*2) -> 0
A23: COBURG | C23: BROWN | F23: McGRATH | I23: CLEARY | L23: M FITZGERALD | O23: EADE | Q23: KEOGH | W23: PRAHRAN | X23: 0 | Y23: 1 | Z23: 0 | AA23: 101 | AB23: 178 | AC23: =(AA23/AB23)*100 -> 56.741573033707873 | AD23: =(X23*4)+(Z23*2) -> 0
A24: GOALKICKERS | P24: MANNIX | R24: SIMS | W24: WERRIBEE | X24: 0 | Y24: 1 | Z24: 0 | AA24: 101 | AB24: 198 | AC24: =(AA24/AB24)*100 -> 51.010101010101003 | AD24: =(X24*4)+(Z24*2) -> 0
A25: SANDRINGHAM | C25: GALLAGHER 5 | F25: MACLEOD 4 | I25: MORRISON 4 | L25: FREW 3 | N25: PLEDGER 2 | Q25: MULLER | S25: MAILING | W25: FRANKSTON | X25: 0 | Y25: 1 | Z25: 0 | AA25: 69 | AB25: 154 | AC25: =(AA25/AB25)*100 -> 44.805194805194802 | AD25: =(X25*4)+(Z25*2) -> 0
A26: COBURG | C26: BROWN 6 | E26: HERBERT 6 | H26: EZARD 2 | J26: M FITZGERALD 2 | N26: J FITZGERALD | Q26: KEOGH | S26: McGRATH | W26: WAVERLEY | X26: 0 | Y26: 1 | Z26: 0 | AA26: 90 | AB26: 236 | AC26: =(AA26/AB26)*100 -> 38.135593220338983 | AD26: =(X26*4)+(Z26*2) -> 0
A28: CAMBERWELL | C28: 5 | D28: 5 | E28: 35 | G28: 10 | H28: 6 | I28: 66 | K28: 23 | L28: 10 | M28: 148 | O28: 27 | P28: 16 | Q28: 178 | S28: VENUE: CAMBERWELL
A29: PRAHRAN | C29: 4 | D29: 2 | E29: 26 | G29: 8 | H29: 8 | I29: 56 | K29: 9 | L29: 10 | M29: 64 | O29: 14 | P29: 17 | Q29: 101 | S29: PHILLIPS :OGSTON
A30: BEST PLAYERS
A31: CAMBERWELL | C31: STEVENSON | F31: WILKINSON | I31: BURMEISTER | L31: DAVIDSON | O31: HICKEY | R31: McFEE
A32: PRAHRAN | C32: GILES | F32: FOLEY | I32: JEFFREY | L32: McNAMARA | O32: HARGREAVES
A33: GOALKICKERS
A34: CAMBERWELL | C34: STEVENSON 9 | F34: HAMMOND 5 | I34: HICKEY 4 | K34: DAVIDSON 2 | N34: WILKINSON 2 | Q34: EVANS 2 | S34: McCORMACK 2 | W34: PRETTO
A35: PRAHRAN | C35: BATHURST 5 | F35: MCNAMARA 2 | I35: HARGREAVES 2 | L35: COONEY | N35: WRIGHT | P35: GILES | R35: PARKER | T35: ELLETT
A37: GEELONG WEST | C37: 7 | D37: 0 | E37: 42 | G37: 12 | H37: 3 | I37: 75 | K37: 21 | L37: 6 | M37: 132 | O37: 24 | P37: 10 | Q37: 154 | S37: VENUE: GEELONG WEST
A38: FRANKSTON | C38: 1 | D38: 5 | E38: 11 | G38: 4 | H38: 11 | I38: 35 | K38: 6 | L38: 14 | M38: 50 | O38: 9 | P38: 15 | Q38: 69 | S38: STABB :VERGONA
A39: BEST PLAYERS
A40: GEELONG WEST | C40: GIBSON | F40: BROWNE | I40: TORNEY | L40: MURPHY | O40: McFADDEN | R40: TODD
A41: FRANKSTON | C41: BRUIN | F41: HUNTER | I41: LYNN | L41: BOYD
A42: GOALKICKERS
A43: GEELONG WEST | C43: RADOJEVIC 8 | F43: MURPHY 4 | I43: BOOTHROYD 3 | L43: TORNEY 3 | N43: SELLS 2 | P43: GIBSON 2 | R43: EDDY | T43: BROWNE
A44: FRANKSTON | C44: HUNTER 3 | F44: HORTON | H44: GEDDES | J44: FERGUSON | M44: BELL | O44: SCOTTER | Q44: BRADY
A46: DANDENONG | C46: 7 | D46: 4 | E46: 46 | G46: 18 | H46: 8 | I46: 116 | K46: 26 | L46: 9 | M46: 165 | O46: 37 | P46: 14 | Q46: 236 | S46: VENUE: DANDENONG
A47: WAVERLEY | C47: 3 | D47: 4 | E47: 22 | G47: 6 | H47: 5 | I47: 41 | K47: 10 | L47: 10 | M47: 70 | O47: 13 | P47: 12 | Q47: 90 | S47: STEERE :BUDGE
A48: BEST PLAYERS
A49: DANDENONG | C49: COVENTRY | F49: WRIGHT | I49: WOOD | L49: MILLANE | O49: WENN | Q49: O'KEEFE
A50: WAVERLEY | C50: WNBORN | F50: WILLIAMS | I50: VEAR
A51: GOALKICKERS
A52: DANDENONG | C52: WENN 11 | E52: WRIGHT 8 | G52: COVENTRY 6 | J52: DEAKIN 3 | L52: BOWLES 2 | N52: O'KEEFE 2 | P52: MILLANE | R52: FINN | T52: ORTON | V52: KNIGHT | X52: VILLANI
A53: WAVERLEY | C53: VEAR 5 | E53: WILLIAMS 2 | H53: COSGROVE 2 | K53: MURRAY | M53: GOODMAN | O53: NEWBOULD | Q53: WENBORNE
A55: WILLIAMSTOWN | C55: 6 | D55: 3 | E55: 39 | G55: 15 | H55: 9 | I55: 99 | K55: 24 | L55: 14 | M55: 158 | O55: 30 | P55: 18 | Q55: 198 | S55: VENUE: WILLIAMSTOWN
A56: WERRIBEE | C56: 2 | D56: 5 | E56: 17 | G56: 7 | H56: 7 | I56: 49 | K56: 9 | L56: 8 | M56: 62 | O56: 15 | P56: 11 | Q56: 101 | S56: MARCY :SERONG
A57: BEST PLAYERS
A58: WILLIAMSTOWN | C58: DULLARD | F58: FOTHERINGHAM | J58: FAIRLEY | L58: SAIT | O58: TOWNS
A59: WERRIBEE | C59: ALLEN | F59: PARKES | J59: KING | L59: SIMMONS | O59: CONN
A60: GOALKICKERS
A61: WILLIAMSTOWN | C61: FOTHERINGHAM 11 | G61: OBORNE 4 | I61: McCONNON 3 | L61: SAIT 3 | N61: McTAGGART 2 | Q61: TOWNS 2 | S61: MURPHY 2 | V61: SLEVISON
A62: WERRIBEE | C62: SIMMONS 5 | F62: ALLEN 3 | H62: KING 3 | J62: SMITH 2 | L62: DAY | M62: D CATTANACH
A64: ROUND 2 | D64: 10TH APRIL | I64: WEATHER | S64: VENUE: TOORAK PARK
D65: 1ST QTR | H65: 2ND QTR | L65: 3RD QTR | P65: FINAL | S65: UMPIRES
A66: PRESTON | C66: 6 | D66: 2 | E66: 38 | G66: 15 | H66: 4 | I66: 94 | K66: 18 | L66: 8 | M66: 116 | O66: 23 | P66: 16 | Q66: 154 | S66: STEERE | X66: LADDER | AB66: ROUND | AD66: 2
A67: PRAHRAN | C67: 3 | D67: 2 | E67: 20 | G67: 5 | H67: 4 | I67: 34 | K67: 9 | L67: 6 | M67: 60 | O67: 11 | P67: 9 | Q67: 75 | S67: FITZPATRICK
A68: BEST PLAYERS | W68: TEAM | X68: W | Y68: L | Z68: D | AA68: FOR | AB68: AGST | AC68: % | AD68: PTS
A69: PRESTON | C69: BERRY | F69: McKEON | I69: McCANN | L69: TOWAN | O69: McCONNELL | R69: COOPER
A70: PRAHRAN | C70: GILES | F70: JEFFREY | I70: WALLACE | L70: FOLEY | W70: PORT MELBOURNE | X70: 2 | Y70: 0 | Z70: 0 | AA70: 291 | AB70: 208 | AC70: =(AA70/AB70)*100 -> 139.90384615384613 | AD70: =(X70*4)+(Z70*2) -> 8
A71: GOALKICKERS | W71: SANDRINGHAM | X71: 2 | Y71: 0 | Z71: 0 | AA71: 297 | AB71: 227 | AC71: =(AA71/AB71)*100 -> 130.83700440528634 | AD71: =(X71*4)+(Z71*2) -> 8
A72: PRESTON | C72: COOPER 6 | F72: SHAW 3 | H72: DUNBAR 3 | J72: HALAS 3 | L72: BOURKE 3 | N72: WHITE 2 | P72: MERRYWEATHER 2 | S72: PLOWMAN | W72: WILLIAMSTOWN | X72: 1 | Y72: 1 | Z72: 0 | AA72: 308 | AB72: 213 | AC72: =(AA72/AB72)*100 -> 144.60093896713616 | AD72: =(X72*4)+(Z72*2) -> 4
A73: PRAHRAN | C73: McDONALD 3 | F73: ELLETT 2 | H73: McNAMARA | J73: BATHURST | M73: STONE | O73: COONEY | Q73: BICKFORD | S73: GRAMBEAU | W73: DANDENONG | X73: 1 | Y73: 1 | Z73: 0 | AA73: 308 | AB73: 223 | AC73: =(AA73/AB73)*100 -> 138.11659192825113 | AD73: =(X73*4)+(Z73*2) -> 4
S74: VENUE: FRANKSTON
A75: FRANKSTON | C75: 5 | D75: 6 | E75: 36 | G75: 9 | H75: 9 | I75: 63 | K75: 11 | L75: 15 | M75: 81 | O75: 16 | P75: 16 | Q75: 112 | S75: GROOM | W75: GEELONG WEST | X75: 1 | Y75: 1 | Z75: 0 | AA75: 252 | AB75: 189 | AC75: =(AA75/AB75)*100 -> 133.33333333333331 | AD75: =(X75*4)+(Z75*2) -> 4
A76: WILLIAMSTOWN | C76: 5 | D76: 1 | E76: 31 | G76: 12 | H76: 2 | I76: 74 | K76: 15 | L76: 5 | M76: 95 | O76: 17 | P76: 8 | Q76: 110 | S76: PHILLIPS | W76: PRESTON | X76: 1 | Y76: 1 | Z76: 0 | AA76: 290 | AB76: 233 | AC76: =(AA76/AB76)*100 -> 124.46351931330473 | AD76: =(X76*4)+(Z76*2) -> 4
A77: BEST PLAYERS | W77: CAMBERWELL | X77: 1 | Y77: 1 | Z77: 0 | AA77: 261 | AB77: 249 | AC77: =(AA77/AB77)*100 -> 104.81927710843372 | AD77: =(X77*4)+(Z77*2) -> 4
A78: FRANKSTON | C78: LYNN | F78: FERGUSON | I78: BELL | L78: DUNBAR | O78: ROGERSON | W78: COBURG | X78: 1 | Y78: 1 | Z78: 0 | AA78: 250 | AB78: 244 | AC78: =(AA78/AB78)*100 -> 102.45901639344261 | AD78: =(X78*4)+(Z78*2) -> 4
A79: WILLIAMSTOWN | C79: SLEVISON | F79: MURPHY | I79: DULLARD | L79: RAUNIK | O79: SAIT | R79: TAYLOR | W79: WERRIBEE | X79: 1 | Y79: 1 | Z79: 0 | AA79: 249 | AB79: 281 | AC79: =(AA79/AB79)*100 -> 88.612099644128122 | AD79: =(X79*4)+(Z79*2) -> 4
A80: GOALKICKERS | O80: LYNN | Q80: CZARNECKI | W80: FRANKSTON | X80: 1 | Y80: 1 | Z80: 0 | AA80: 181 | AB80: 264 | AC80: =(AA80/AB80)*100 -> 68.560606060606062 | AD80: =(X80*4)+(Z80*2) -> 4
A81: FRANKSTON | C81: HUNTER 4 | E81: VANDERMEER 2 | H81: BOYD 2 | J81: MARTIN 2 | L81: ROGERSON | N81: HORTON | P81: FERGUSON | R81: DUNBAR | W81: PRAHRAN | X81: 0 | Y81: 2 | Z81: 0 | AA81: 176 | AB81: 332 | AC81: =(AA81/AB81)*100 -> 53.01204819277109 | AD81: =(X81*4)+(Z81*2) -> 0
A82: WILLIAMSTOWN | C82: SLEVISON 4 | E82: FAIRLEY 3 | G82: FOTHERINGHAM 3 | J82: McCONNON 2 | M82: EUDEY | O82: BOTTAMS | Q82: TOWNS | S82: MURPHY | W82: WAVERLEY | X82: 0 | Y82: 2 | Z82: 0 | AA82: 187 | AB82: 387 | AC82: =(AA82/AB82)*100 -> 48.320413436692505 | AD82: =(X82*4)+(Z82*2) -> 0
R83: SAIT
A84: PORT MELBOURNE | C84: 6 | D84: 6 | E84: 42 | G84: 12 | H84: 10 | I84: 82 | K84: 16 | L84: 14 | M84: 110 | O84: 19 | P84: 19 | Q84: 133 | S84: VENUE: PORT MELBOURNE
A85: DANDENONG | C85: 1 | D85: 2 | E85: 8 | G85: 2 | H85: 3 | I85: 15 | K85: 7 | L85: 5 | M85: 47 | O85: 11 | P85: 6 | Q85: 72 | S85: OGSTON :VERGONA
A86: BEST PLAYERS
A87: PORT MELBOURNE | C87: DAVIES | F87: ROBERTSON | I87: SWAN | L87: WILKINSON | O87: EBEYER | Q87: TANTSIS
A88: DANDENONG | C88: COVENTRY | F88: MILLANE | I88: KAYE | L88: WOOD | O88: O'KEEFE | Q88: FINN
A89: GOALKICKERS
A90: PORT MELBOURNE | C90: EBEYER 6 | F90: COOK 4 | H90: HICKS 2 | J90: HOWE 2 | L90: SWAN | N90: MILDENHALL | Q90: RODDA | S90: DOYLE | U90: KAVANAGH
A91: DANDENONG | C91: DEAKIN 2 | F91: WRIGHT 2 | I91: WENN 2 | K91: FINN 2 | M91: MILANE | O91: O'KEEFE | Q91: COVENTRY
A93: COBURG | C93: 6 | D93: 2 | E93: 38 | G93: 6 | H93: 5 | I93: 41 | K93: 15 | L93: 9 | M93: 99 | O93: 18 | P93: 12 | Q93: 120 | S93: VENUE: COBURG
A94: GEELONG WEST | C94: 1 | D94: 2 | E94: 8 | G94: 7 | H94: 9 | I94: 51 | K94: 8 | L94: 10 | M94: 58 | O94: 14 | P94: 14 | Q94: 98 | S94: SERONG :RYAN
A95: BEST PLAYERS
A96: COBURG | C96: CLEARY | E96: HARBINSON | H96: COLLINS | K96: EZARD | N96: EADE | Q96: FREEMAN
A97: GEELONG WEST | C97: SELLS | E97: SMITH | H97: CRICHTON | K97: MURPHY | N97: DALIHAUS
A98: GOALKICKERS
A99: COBURG | C99: CLEARY 4 | F99: KEOGH 3 | H99: FREEMAN 3 | K99: M FITZGERALD | N99: EZARD | P99: P BROWN | R99: ALLISON
A100: GEELONG WEST | C100: SELLS 5 | F100: BROWNE 3 | I100: MURPHY 2 | K100: JOHNSON | M100: DALIHAUS | O100: BOOTHROYD | R100: RADOJEVIK
A102: WERRIBEE | C102: 8 | D102: 3 | E102: 51 | G102: 15 | H102: 8 | I102: 98 | K102: 19 | L102: 11 | M102: 125 | O102: 22 | P102: 16 | Q102: 148 | S102: VENUE: WERRIBEE
A103: CAMBERWELL | C103: 5 | D103: 11 | E103: 41 | G103: 6 | H103: 13 | I103: 49 | K103: 9 | L103: 17 | M103: 71 | O103: 9 | P103: 29 | Q103: 83 | S103: BUDGE :OAKLEY
A104: BEST PLAYERS
A105: WERRIBEE | C105: MENADUE | F105: KING | I105: WISE | K105: REDENBACH | N105: RICHARDSON | Q105: CONN
A106: CAMBERWELL | C106: WILKINSON | F106: DAVIDSON | I106: HICKEY | K106: ROURKE
A107: GOALKICKERS
A108: WERRIBEE | C108: REDENBACH 8 | F108: COOPER 3 | H108: SMITH 3 | J108: ALLAN 2 | L108: KING 2 | N108: LANCASTER 2 | Q108: McKENZIE | S108: RICHARDSON
A109: CAMBERWELL | C109: HAMMOND 2 | F109: DAVIDSON 2 | I109: HICKEY | K109: WILKINSON | N109: COWLEY | P109: TEAKEL | R109: STEVENSON
A111: SANDRINGHAM | C111: 8 | D111: 9 | E111: 57 | G111: 11 | H111: 11 | I111: 77 | K111: 15 | L111: 18 | M111: 108 | O111: 22 | P111: 19 | Q111: 151 | S111: VENUE: WAVERLEY
A112: WAVERLEY | C112: 3 | D112: 3 | E112: 21 | G112: 7 | H112: 5 | I112: 47 | K112: 9 | L112: 8 | M112: 62 | O112: 14 | P112: 13 | Q112: 97 | S112: GOLLOP :MARCY
A113: BEST PLAYERS
A114: SANDRINGHAM | C114: GALLAGHER | F114: SIMS | I114: SARAU | L114: WILKINS | O114: MULLER | R114: PLEDGER
A115: WAVERLEY | C115: VEAR | F115: WILLIAMS | I115: McEWIN | L115: POWELL | O115: ANGELIS | R115: CLARKE
A116: GOALKICKERS
A117: SANDRINGHAM | C117: SIMS 4 | E117: FREW 4 | G117: GALLAGHER 4 | J117: MORRISON 4 | M117: GILMORE | O117: HAYES | Q117: HETHERINGTON | U117: LYONS | W117: MACLEOD | Y117: WILKINS
A118: WAVERLEY | C118: ANGELIS 4 | F118: WILLIAMS 4 | I118: GOODWIN 2 | L118: DAVIS | N118: KAYE | P118: McEWIN | R118: WENBORNE
A120: ROUND 3 | D120: 17TH APRIL | I120: WEATHER | S120: VENUE: PRESTON
D121: 1ST QTR | H121: 2ND QTR | L121: 3RD QTR | P121: FINAL | S121: UMPIRES
A122: PRESTON | C122: 1 | D122: 0 | E122: 6 | G122: 9 | H122: 5 | I122: 59 | K122: 15 | L122: 9 | M122: 99 | O122: 27 | P122: 16 | Q122: 178 | S122: VERGONA | X122: LADDER | AB122: ROUND | AD122: 3
A123: WERRIBEE | C123: 3 | D123: 7 | E123: 25 | G123: 5 | H123: 10 | I123: 40 | K123: 9 | L123: 14 | M123: 68 | O123: 10 | P123: 16 | Q123: 76 | S123: STEERE
A124: BEST PLAYERS | W124: TEAM | X124: W | Y124: L | Z124: D | AA124: FOR | AB124: AGST | AC124: % | AD124: PTS
A125: PRESTON | C125: McCONNELL | F125: BERRY | I125: HALAS | L125: BOURKE | O125: SHAW | R125: McKEON
A126: WERRIBEE | C126: CONN | F126: MENADUE | I126: SCANLON | L126: COOPER | O126: LANCASTER | R126: ALLAN | W126: PORT MELBOURNE | X126: 3 | Y126: 0 | Z126: 0 | AA126: 415 | AB126: 327 | AC126: =(AA126/AB126)*100 -> 126.91131498470949 | AD126: =(X126*4)+(Z126*2) -> 12
A127: GOALKICKERS | O127: DUNBAR | R127: HACKNEY | W127: PRESTON | X127: 2 | Y127: 1 | Z127: 0 | AA127: 468 | AB127: 309 | AC127: =(AA127/AB127)*100 -> 151.45631067961165 | AD127: =(X127*4)+(Z127*2) -> 8
A128: PRESTON | C128: HALAS 8 | E128: SHAW 5 | G128: MERRYWEATHER 5 | J128: COOPER 2 | L128: VANN 2 | N128: AUSTEN | P128: McGAW | R128: BOURKE | W128: GEELONG WEST | X128: 2 | Y128: 1 | Z128: 0 | AA128: 382 | AB128: 304 | AC128: =(AA128/AB128)*100 -> 125.6578947368421 | AD128: =(X128*4)+(Z128*2) -> 8
A129: WERRIBEE | C129: PARKES 3 | F129: BOND 2 | H129: CONN | J129: ALLAN | L129: DAY | M129: KING | N129: CATTANACH | W129: COBURG | X129: 2 | Y129: 1 | Z129: 0 | AA129: 418 | AB129: 345 | AC129: =(AA129/AB129)*100 -> 121.15942028985506 | AD129: =(X129*4)+(Z129*2) -> 8
S130: VENUE: BEACH ROAD
A131: PORT MELBOURNE | C131: 7 | D131: 4 | E131: 46 | G131: 10 | H131: 6 | I131: 66 | K131: 15 | L131: 14 | M131: 104 | O131: 18 | P131: 16 | Q131: 124 | S131: STEERE | W131: SANDRINGHAM | X131: 2 | Y131: 1 | Z131: 0 | AA131: 416 | AB131: 351 | AC131: =(AA131/AB131)*100 -> 118.5185185185185 | AD131: =(X131*4)+(Z131*2) -> 8
A132: SANDRINGHAM | C132: 3 | D132: 1 | E132: 19 | G132: 7 | H132: 9 | I132: 51 | K132: 11 | L132: 12 | M132: 78 | O132: 17 | P132: 17 | Q132: 119 | S132: PHILLIPS | W132: FRANKSTON | X132: 2 | Y132: 1 | Z132: 0 | AA132: 334 | AB132: 378 | AC132: =(AA132/AB132)*100 -> 88.359788359788354 | AD132: =(X132*4)+(Z132*2) -> 8
A133: BEST PLAYERS | W133: WILLIAMSTOWN | X133: 1 | Y133: 2 | Z133: 0 | AA133: 423 | AB133: 343 | AC133: =(AA133/AB133)*100 -> 123.32361516034986 | AD133: =(X133*4)+(Z133*2) -> 4
A134: PORT MELBOURNE | C134: SWAN | F134: TANTSIS | I134: KAVANAGH | L134: ANDERSON | O134: RODDA | Q134: WILKINSON | W134: DANDENONG | X134: 1 | Y134: 2 | Z134: 0 | AA134: 403 | AB134: 340 | AC134: =(AA134/AB134)*100 -> 118.52941176470588 | AD134: =(X134*4)+(Z134*2) -> 4
A135: SANDRINGHAM | C135: GALLAGHER | F135: MACLEOD | I135: MULLER | L135: ADAMS | O135: SARAU | Q135: MAILING | W135: CAMBERWELL | X135: 1 | Y135: 2 | Z135: 0 | AA135: 375 | AB135: 402 | AC135: =(AA135/AB135)*100 -> 93.28358208955224 | AD135: =(X135*4)+(Z135*2) -> 4
A136: GOALKICKERS | W136: WERRIBEE | X136: 1 | Y136: 2 | Z136: 0 | AA136: 325 | AB136: 459 | AC136: =(AA136/AB136)*100 -> 70.806100217864923 | AD136: =(X136*4)+(Z136*2) -> 4
A137: PORT MELBOURNE | C137: ANDERSON 6 | F137: COOK 4 | H137: EBEYER 3 | J137: HICKS | L137: SWAN | N137: HOWE | P137: DOYLE | W137: PRAHRAN | X137: 1 | Y137: 2 | Z137: 0 | AA137: 293 | AB137: 427 | AC137: =(AA137/AB137)*100 -> 68.618266978922719 | AD137: =(X137*4)+(Z137*2) -> 4
A138: SANDRINGHAM | C138: MAILING 5 | F138: MACLEOD 3 | I138: SIMS 3 | K138: FREW 2 | M138: MORRISON 2 | O138: GALLAGHER | R138: PLEDGER | W138: WAVERLEY | X138: 0 | Y138: 3 | Z138: 0 | AA138: 288 | AB138: 555 | AC138: =(AA138/AB138)*100 -> 51.891891891891895 | AD138: =(X138*4)+(Z138*2) -> 0
A140: FRANKSTON | C140: 4 | D140: 3 | E140: 27 | G140: 12 | H140: 4 | I140: 76 | K140: 19 | L140: 6 | M140: 120 | O140: 24 | P140: 9 | Q140: 153 | S140: VENUE: CAMBERWELL
A141: CAMBERWELL | C141: 3 | D141: 2 | E141: 20 | G141: 10 | H141: 6 | I141: 66 | K141: 11 | L141: 8 | M141: 74 | O141: 16 | P141: 18 | Q141: 114 | S141: RYAN :SERONG
A142: BEST PLAYERS
A143: FRANKSTON | C143: LOCKWOOD | F143: VANDERMEER | I143: HUNTER | L143: HOWE | N143: BELL | Q143: LYNN
A144: CAMBERWELL | C144: WILKINSON | F144: CAHILL | I144: EVANS
A145: GOALKICKERS
A146: FRANKSTON | C146: HUNTER 6 | F146: LOCKWOOD 5 | I146: HORTON 3 | K146: ROGERSON 2 | N146: VANDERMEER 2 | Q146: O'BRIEN 2 | S146: SALA | U146: BELL | W146: FERGUSON | X146: HOWE
A147: CAMBERWELL | C147: STEVENSON 3 | F147: M HIPWORTH 2 | I147: McCORMACK 2 | L147: NEILSON 2 | N147: HAMMOND 2 | Q147: HICKEY | S147: WILKINSON | W147: S ROURKE | X147: DAVIDSON | AA147: BURMEISTER
A149: COBURG | C149: 10 | D149: 7 | E149: 67 | G149: 15 | H149: 10 | I149: 100 | K149: 21 | L149: 17 | M149: 143 | O149: 24 | P149: 24 | Q149: 168 | S149: VENUE: WAVERLEY
A150: WAVERLEY | C150: 3 | D150: 3 | E150: 21 | G150: 9 | H150: 11 | I150: 65 | K150: 11 | L150: 11 | M150: 77 | O150: 14 | P150: 17 | Q150: 101 | S150: GROOM :OGSTON
A151: BEST PLAYERS
A152: COBURG | C152: EZARD | E152: J FITZGERALD | H152: FREEMAN | K152: COLLINS | N152: McCARTHY | Q152: MILROY
A153: WAVERLEY | C153: CSOTI | E153: CLARKE | H153: JORGENSEN | K153: WENBORNE | N153: McEWAN | Q153: WILLIAMS
A154: GOALKICKERS
A155: COBURG | C155: J FITZGERALD 7 | F155: SERAFINI 6 | I155: EZARD 2 | K155: HERBERT 2 | M155: McGRATH 2 | P155: KEOGH | R155: CLEARY | U155: MILROY | W155: FREEMAN | X155: M FITZGERALD
A156: WAVERLEY | C156: ANGELIS 4 | F156: GOODMAN 2 | I156: DAVIES 2 | K156: NEWBOULD 2 | N156: WENBORNE | Q156: LUKEY | S156: McEWAN | V156: COSGROVE
A158: PRAHRAN | C158: 4 | D158: 4 | E158: 28 | G158: 9 | H158: 10 | I158: 64 | K158: 10 | L158: 14 | M158: 74 | O158: 17 | P158: 15 | Q158: 117 | S158: VENUE: DANDENONG
A159: DANDENONG | C159: 2 | D159: 7 | E159: 19 | G159: 4 | H159: 11 | I159: 35 | K159: 8 | L159: 15 | M159: 63 | O159: 13 | P159: 17 | Q159: 95 | S159: ALLSOPP :GOLLOP
A160: BEST PLAYERS
A161: PRAHRAN | C161: GILES | F161: WRIGHT | I161: WALLACE | L161: HART | O161: TWOMEY | R161: BATT
A162: DANDENONG | C162: KAYE | F162: MILLANE | I162: COVENTRY
A163: GOALKICKERS
A164: PRAHRAN | C164: McDONALD 3 | F164: WALLACE 3 | I164: DICKSON 2 | K164: SOULOS 2 | M164: HARGREAVES 2 | P164: BICKFORD 2 | R164: BATHURST | U164: WRIGHT | W164: COONEY
A165: DANDENONG | C165: DEAKIN 3 | F165: WRIGHT 3 | I165: MILLANE 2 | L165: COVENTRY 2 | N165: FINN | P165: WENN | R165: VILLANI
A167: GEELONG WEST | C167: 6 | D167: 6 | E167: 42 | G167: 10 | H167: 11 | I167: 71 | K167: 17 | L167: 15 | M167: 117 | O167: 19 | P167: 16 | Q167: 130 | S167: VENUE: WILLIAMSTOWN
A168: WILLIAMSTOWN | C168: 3 | D168: 8 | E168: 26 | G168: 9 | H168: 14 | I168: 68 | K168: 12 | L168: 16 | M168: 88 | O168: 16 | P168: 19 | Q168: 115 | S168: OAKLEY :FITZPATRICK
A169: BEST PLAYERS
A170: GEELONG WEST | C170: EDDY | F170: SELLS | I170: BEATON | L170: JOHNSON | O170: WIASAK | R170: DALIHAUS
A171: WILLIAMSTOWN | C171: MURPHY | F171: DULLARD | I171: RAUNIK | L171: SAIT | O171: McCONNON
A172: GOALKICKERS
A173: GEELONG WEST | C173: EDDY 4 | E173: RADOJEVIC 3 | H173: SELLS 3 | J173: MURPHY 2 | M173: BOOTHROYD | P173: GIBSON | R173: WIESAK | U173: SMITH | W173: DALIHAUS | Y173: McKENZIE
A174: WILLIAMSTOWN | C174: FOTHERINGHAM 4 | F174: FAIRLEY 3 | I174: HUGHES 3 | K174: SAIT 2 | M174: B McTAGGART | P174: OBORNE | R174: SLEVISON | U174: TOWNS | W174: JOHNSON
A176: ROUND 4 | D176: 24TH APRIL | I176: WEATHER | S176: VENUE: COBURG
D177: 1ST QTR | H177: 2ND QTR | L177: 3RD QTR | P177: FINAL | S177: UMPIRES
A178: COBURG | C178: 10 | D178: 5 | E178: 65 | G178: 17 | H178: 9 | I178: 111 | K178: 25 | L178: 12 | M178: 162 | O178: 30 | P178: 14 | Q178: 194 | S178: MARCY | X178: LADDER | AB178: ROUND | AD178: 4
A179: WILLIAMSTOWN | C179: 2 | D179: 1 | E179: 13 | G179: 7 | H179: 3 | I179: 45 | K179: 13 | L179: 6 | M179: 84 | O179: 18 | P179: 13 | Q179: 121 | S179: BUDGE
A180: BEST PLAYERS | W180: TEAM | X180: W | Y180: L | Z180: D | AA180: FOR | AB180: AGST | AC180: % | AD180: PTS
A181: COBURG | C181: FREEMAN | F181: BROWN | I181: SERAFINI | L181: EZARD | O181: McCARTHY | R181: KEOGH
A182: WILLIAMSTOWN | C182: KERSHAW | F182: BARLOW | I182: FOTHERINGHAM | L182: BOTTAMS | O182: DULLARD | W182: PORT MELBOURNE | X182: 4 | Y182: 0 | Z182: 0 | AA182: 575 | AB182: 415 | AC182: =(AA182/AB182)*100 -> 138.55421686746988 | AD182: =(X182*4)+(Z182*2) -> 16
A183: GOALKICKERS | R183: McGRATH | W183: PRESTON | X183: 3 | Y183: 1 | Z183: 0 | AA183: 645 | AB183: 377 | AC183: =(AA183/AB183)*100 -> 171.08753315649867 | AD183: =(X183*4)+(Z183*2) -> 12
A184: COBURG | C184: SERAFINI 12 | F184: FREEMAN 5 | I184: BROWN 4 | K184: LAIDLER 2 | M184: KEOGH 2 | O184: HERBERT 2 | Q184: J FITZGERALD | T184: EZARD | W184: GEELONG WEST | X184: 3 | Y184: 1 | Z184: 0 | AA184: 503 | AB184: 381 | AC184: =(AA184/AB184)*100 -> 132.02099737532808 | AD184: =(X184*4)+(Z184*2) -> 12
A185: WILLIAMSTOWN | C185: FOTHERINGHAM 8 | F185: OBORNE 2 | H185: BARLOW 2 | J185: BARRETT | L185: HUGHES | N185: DULLARD | P185: SANDALLS | R185: McCONNON | W185: COBURG | X185: 3 | Y185: 1 | Z185: 0 | AA185: 612 | AB185: 466 | AC185: =(AA185/AB185)*100 -> 131.33047210300427 | AD185: =(X185*4)+(Z185*2) -> 12
O186: McTAGGART | S186: VENUE: GEELONG WEST
A187: GEELONG WEST | C187: 3 | D187: 4 | E187: 22 | G187: 9 | H187: 5 | I187: 59 | K187: 15 | L187: 6 | M187: 96 | O187: 18 | P187: 13 | Q187: 121 | S187: GROOM | W187: SANDRINGHAM | X187: 3 | Y187: 1 | Z187: 0 | AA187: 530 | AB187: 444 | AC187: =(AA187/AB187)*100 -> 119.36936936936937 | AD187: =(X187*4)+(Z187*2) -> 12
A188: CAMBERWELL | C188: 7 | D188: 2 | E188: 44 | G188: 9 | H188: 3 | I188: 57 | K188: 9 | L188: 7 | M188: 61 | O188: 11 | P188: 11 | Q188: 77 | S188: ALLSOPP | W188: WERRIBEE | X188: 2 | Y188: 2 | Z188: 0 | AA188: 446 | AB188: 569 | AC188: =(AA188/AB188)*100 -> 78.383128295254835 | AD188: =(X188*4)+(Z188*2) -> 8
A189: BEST PLAYERS | W189: FRANKSTON | X189: 2 | Y189: 2 | Z189: 0 | AA189: 402 | AB189: 555 | AC189: =(AA189/AB189)*100 -> 72.432432432432435 | AD189: =(X189*4)+(Z189*2) -> 8
A190: GEELONG WEST | C190: BROWNE | F190: WATT | I190: KRANJC | L190: BOOTHROYD | O190: TORNEY | W190: DANDENONG | X190: 1 | Y190: 3 | Z190: 0 | AA190: 513 | AB190: 461 | AC190: =(AA190/AB190)*100 -> 111.27982646420824 | AD190: =(X190*4)+(Z190*2) -> 4
A191: CAMBERWELL | C191: WILKINSON | F191: CUFF | I191: CAHILL | W191: WILLIAMSTOWN | X191: 1 | Y191: 3 | Z191: 0 | AA191: 544 | AB191: 537 | AC191: =(AA191/AB191)*100 -> 101.30353817504655 | AD191: =(X191*4)+(Z191*2) -> 4
A192: GOALKICKERS | W192: CAMBERWELL | X192: 1 | Y192: 3 | Z192: 0 | AA192: 452 | AB192: 523 | AC192: =(AA192/AB192)*100 -> 86.424474187380497 | AD192: =(X192*4)+(Z192*2) -> 4
A193: GEELONG WEST | C193: BROWNE 7 | F193: RADOJEVIC 5 | I193: EDDY 3 | K193: GIBSON 2 | M193: BOOTHROYD | W193: PRAHRAN | X193: 1 | Y193: 3 | Z193: 0 | AA193: 386 | AB193: 541 | AC193: =(AA193/AB193)*100 -> 71.349353049907577 | AD193: =(X193*4)+(Z193*2) -> 4
A194: CAMBERWELL | C194: STEVENSON 3 | F194: WILKINSON 2 | I194: HIPWORTH 2 | K194: HICKEY | M194: NEILSON | O194: CUFF | Q194: DANS | W194: WAVERLEY | X194: 0 | Y194: 4 | Z194: 0 | AA194: 376 | AB194: 715 | AC194: =(AA194/AB194)*100 -> 52.587412587412587 | AD194: =(X194*4)+(Z194*2) -> 0
A196: SANDRINGHAM | C196: 3 | D196: 8 | E196: 26 | G196: 9 | H196: 11 | I196: 65 | K196: 14 | L196: 17 | M196: 101 | O196: 15 | P196: 24 | Q196: 114 | S196: VENUE: TOORAK PARK
A197: PRAHRAN | C197: 6 | D197: 3 | E197: 39 | G197: 9 | H197: 6 | I197: 60 | K197: 11 | L197: 9 | M197: 75 | O197: 13 | P197: 15 | Q197: 93 | S197: VERGONA :OGSTON
A198: BEST PLAYERS
A199: SANDRINGHAM | C199: MULLER | F199: SCOTT | I199: MACLEOD | L199: GALLAGHER | O199: LYONS | Q199: SARAU
A200: PRAHRAN | C200: McDONALD | F200: WRIGHT | I200: ELLETT | L200: McNAMARA | O200: GILES | Q200: JEFFREY
A201: GOALKICKERS
A202: SANDRINGHAM | C202: MORRISON 4 | F202: MACLEOD 3 | I202: MAILING 3 | K202: MULLER 2 | M202: SIMS 2 | O202: MANNIX
A203: PRAHRAN | C203: McNAMARA 5 | F203: COONEY 2 | I203: WALLACE | K203: DICKSON | M203: RUSSELL | O203: SOULOS | Q203: PARKER | S203: BATT
D204: 1ST MAY
A205: PRESTON | C205: 2 | D205: 5 | E205: 17 | G205: 10 | H205: 8 | I205: 68 | K205: 18 | L205: 13 | M205: 121 | O205: 26 | P205: 21 | Q205: 177 | S205: VENUE: FRANKSTON
A206: FRANKSTON | C206: 5 | D206: 2 | E206: 32 | G206: 6 | H206: 2 | I206: 38 | K206: 10 | L206: 6 | M206: 66 | O206: 10 | P206: 8 | Q206: 68 | S206: GALLOP :OAKLEY
A207: BEST PLAYERS
A208: PRESTON | C208: McCONNELL | F208: BRINE | I208: PLOWMAN | L208: BERRY | O208: MERRYWEATHER | S208: McKEOWN
A209: FRANKSTON | C209: VANDERMEER | F209: HUNTER | I209: HORLER | L209: LYNN
A210: GOALKICKERS
A211: PRESTON | C211: MERRYWEATHER 6 | F211: HALAS 4 | H211: McEWAN 3 | J211: SHAW 3 | L211: SALVADORE 2 | O211: COOPER 2 | Q211: MARCON 2 | T211: OHLSEN | W211: BERRY | X211: AUSTEN | AA211: McCANN
A212: FRANKSTON | C212: HUNTER 6 | F212: VANDERMEER | I212: SALA | K212: GEDDES | M212: LYNN
A214: PORT MELBOURNE | C214: 5 | D214: 2 | E214: 32 | G214: 9 | H214: 6 | I214: 60 | K214: 16 | L214: 7 | M214: 103 | O214: 25 | P214: 10 | Q214: 160 | S214: VENUE: PORT MELBOURNE
A215: WAVERLEY | C215: 1 | D215: 4 | E215: 10 | G215: 4 | H215: 7 | I215: 31 | K215: 9 | L215: 11 | M215: 65 | O215: 12 | P215: 16 | Q215: 88 | S215: STEERE :SERONG
A216: BEST PLAYERS
A217: PORT MELBOURNE | C217: ANDERSON | F217: HOWE | I217: DAVIES | L217: THOMPSON | O217: EBEYER | R217: RODDA
A218: WAVERLEY | C218: WENBORNE | F218: CLARKE | I218: ANGELIS | L218: CSOTI | O218: CARGHILL
A219: GOALKICKERS
A220: PORT MELBOURNE | C220: ANDERSON 13 | F220: EBEYER 5 | I220: COOK 4 | K220: WILKINSON 2 | N220: FREYER
A221: WAVERLEY | C221: ANGELIS 9 | F221: DAVIES | H221: JORGENSEN | K221: WENBORNE
A223: WERRIBEE | C223: 5 | D223: 3 | E223: 33 | G223: 7 | H223: 8 | I223: 50 | K223: 11 | L223: 10 | M223: 76 | O223: 18 | P223: 13 | Q223: 121 | S223: VENUE: WERRIBEE
A224: DANDENONG | C224: 5 | D224: 1 | E224: 31 | G224: 11 | H224: 2 | I224: 68 | K224: 13 | L224: 8 | M224: 86 | O224: 16 | P224: 14 | Q224: 110 | S224: PHILLIPS :FITZPATRICK
A225: BEST PLAYERS
A226: WERRIBEE | C226: MENADUE | F226: MURPHY | I226: BREEN | L226: PARKES | O226: ALLAN
A227: DANDENONG | C227: COVENTRY | F227: WENN | I227: KNIGHT | L227: O'KEEFE | O227: WESTCOTT
A228: GOALKICKERS
A229: WERRIBEE | C229: DAY 5 | E229: KING 4 | G229: SIMMONS 2 | J229: BOND 2 | L229: COOPER 2 | N229: REDENBACH | Q229: BREEN | S229: CONN
A230: DANDENONG | C230: WEST 4 | E230: COVENTRY 3 | H230: WENN 3 | J230: KNIGHT | L230: O'KEEFE | N230: FINN | P230: DEAKIN | R230: MILLANE
A232: ROUND 5 | D232: 8TH MAY | I232: WEATHER | S232: PLAYED VENUE: WAVERLEY
D233: 1ST QTR | H233: 2ND QTR | L233: 3RD QTR | P233: FINAL | S233: UMPIRES
A234: PRAHRAN | C234: 2 | D234: 5 | E234: 17 | G234: 11 | H234: 8 | I234: 74 | K234: 16 | L234: 12 | M234: 108 | O234: 21 | P234: 14 | Q234: 140 | S234: BUDGE | X234: LADDER | AB234: ROUND | AD234: 5
A235: WAVERLEY | C235: 1 | D235: 6 | E235: 12 | G235: 3 | H235: 7 | I235: 25 | K235: 7 | L235: 14 | M235: 56 | O235: 10 | P235: 20 | Q235: 80 | S235: OAKLEY
A236: BEST PLAYERS | W236: TEAM | X236: W | Y236: L | Z236: D | AA236: FOR | AB236: AGST | AC236: % | AD236: PTS
A237: PRAHRAN | C237: McDONALD | F237: ELLETT | I237: WRIGHT | L237: GRAMBEAU | O237: SOULOS | Q237: FOLEY
A238: WAVERLEY | C238: WENBORNE | F238: ALEXANDER | I238: KING | L238: VEAR | O238: McEWAN | Q238: CHERNEY | W238: PORT MELBOURNE | X238: 4 | Y238: 0 | Z238: 1 | AA238: 698 | AB238: 538 | AC238: =(AA238/AB238)*100 -> 129.73977695167287 | AD238: =(X238*4)+(Z238*2) -> 18
A239: GOALKICKERS | Q239: GILES | W239: PRESTON | X239: 4 | Y239: 1 | Z239: 0 | AA239: 777 | AB239: 485 | AC239: =(AA239/AB239)*100 -> 160.20618556701032 | AD239: =(X239*4)+(Z239*2) -> 16
A240: PRAHRAN | C240: SOULOS 8 | E240: McNAMARA 4 | H240: COONEY 2 | J240: RUSSELL 2 | M240: McDONALD 2 | P240: DICKSON | R240: PARKER | W240: COBURG | X240: 3 | Y240: 1 | Z240: 1 | AA240: 735 | AB240: 589 | AC240: =(AA240/AB240)*100 -> 124.78777589134124 | AD240: =(X240*4)+(Z240*2) -> 14
A241: WAVERLEY | C241: PRITCHARD 3 | F241: DAVIES 2 | H241: ANGELIS | J241: FERGUSON | M241: CHERNEY | O241: MULLENS | Q241: CLARKE | W241: GEELONG WEST | X241: 3 | Y241: 2 | Z241: 0 | AA241: 611 | AB241: 513 | AC241: =(AA241/AB241)*100 -> 119.10331384015595 | AD241: =(X241*4)+(Z241*2) -> 12
S242: VENUE: BEACH ROAD
A243: WERRIBEE | C243: 5 | D243: 5 | E243: 35 | G243: 9 | H243: 10 | I243: 64 | K243: 22 | L243: 14 | M243: 146 | O243: 25 | P243: 17 | Q243: 167 | S243: ALLSOPP | W243: SANDRINGHAM | X243: 3 | Y243: 2 | Z243: 0 | AA243: 666 | AB243: 611 | AC243: =(AA243/AB243)*100 -> 109.00163666121112 | AD243: =(X243*4)+(Z243*2) -> 12
A244: SANDRINGHAM | C244: 1 | D244: 2 | E244: 8 | G244: 5 | H244: 6 | I244: 36 | K244: 9 | L244: 10 | M244: 64 | O244: 20 | P244: 16 | Q244: 136 | S244: SERONG | W244: WERRIBEE | X244: 3 | Y244: 2 | Z244: 0 | AA244: 613 | AB244: 705 | AC244: =(AA244/AB244)*100 -> 86.950354609929079 | AD244: =(X244*4)+(Z244*2) -> 12
A245: BEST PLAYERS | W245: FRANKSTON | X245: 3 | Y245: 2 | Z245: 0 | AA245: 528 | AB245: 680 | AC245: =(AA245/AB245)*100 -> 77.64705882352942 | AD245: =(X245*4)+(Z245*2) -> 12
A246: WERRIBEE | C246: CONN | E246: KING | H246: MARSDEN | K246: PARKES | N246: MEMBREY | Q246: SIMMONS | W246: WILLIAMSTOWN | X246: 2 | Y246: 3 | Z246: 0 | AA246: 734 | AB246: 645 | AC246: =(AA246/AB246)*100 -> 113.7984496124031 | AD246: =(X246*4)+(Z246*2) -> 8
A247: SANDRINGHAM | C247: LYONS | E247: GALLAGHER | H247: MAILING | K247: FREW | N247: SIMS | Q247: ADAMS | W247: PRAHRAN | X247: 2 | Y247: 3 | Z247: 0 | AA247: 526 | AB247: 621 | AC247: =(AA247/AB247)*100 -> 84.702093397745571 | AD247: =(X247*4)+(Z247*2) -> 8
A248: GOALKICKERS | R248: RICHARDSON | W248: DANDENONG | X248: 1 | Y248: 4 | Z248: 0 | AA248: 638 | AB248: 587 | AC248: =(AA248/AB248)*100 -> 108.68824531516184 | AD248: =(X248*4)+(Z248*2) -> 4
A249: WERRIBEE | C249: KING 7 | E249: SIMMONS 6 | H249: DAY 3 | J249: BOND 3 | L249: REDENBACH 2 | O249: ALLAN | Q249: BREEN | S249: LANCASTER | W249: CAMBERWELL | X249: 1 | Y249: 4 | Z249: 0 | AA249: 560 | AB249: 713 | AC249: =(AA249/AB249)*100 -> 78.541374474053299 | AD249: =(X249*4)+(Z249*2) -> 4
A250: SANDRINGHAM | C250: MAILING 5 | E250: ADAMS 3 | G250: MORRISON 2 | J250: MACLEOD 2 | M250: FREW 2 | O250: HART 2 | Q250: WILKINS | S250: SIMS | W250: WAVERLEY | X250: 0 | Y250: 5 | Z250: 0 | AA250: 456 | AB250: 855 | AC250: =(AA250/AB250)*100 -> 53.333333333333336 | AD250: =(X250*4)+(Z250*2) -> 0
P251: PLEDGER | R251: GALLAGHER
A252: FRANKSTON | C252: 2 | D252: 1 | E252: 13 | G252: 10 | H252: 7 | I252: 67 | K252: 13 | L252: 8 | M252: 86 | O252: 19 | P252: 12 | Q252: 126 | S252: VENUE: DANDENONG
A253: DANDENONG | C253: 5 | D253: 2 | E253: 32 | G253: 6 | H253: 4 | I253: 40 | K253: 13 | L253: 8 | M253: 86 | O253: 19 | P253: 11 | Q253: 125 | S253: STABB :STEERE
A254: BEST PLAYERS
A255: FRANKSTON | C255: BARDOEL | F255: VANDERMEER | I255: HUNTER | L255: FERGUSON | O255: HOWE | R255: BELL
A256: DANDENONG | C256: DEAKIN | F256: COVENTRY | I256: O'KEEFE | L256: TREMBATH | O256: ORTON | R256: WENN
A257: GOALKICKERS
A258: FRANKSTON | C258: BOYD 5 | E258: HUNTER 5 | G258: LOCKWOOD 3 | J258: BARDOEL 2 | M258: HORTON 2 | O258: BELL | P258: VANDERMEER
A259: DANDENONG | C259: WESTCOTT 6 | F259: COVENTRY 4 | I259: WOOD 2 | K259: FINN 2 | M259: O'KEEFE 2 | O259: CASHMAN | Q259: LACEY | S259: WENN
A261: PRESTON | C261: 6 | D261: 3 | E261: 39 | G261: 13 | H261: 7 | I261: 85 | K261: 17 | L261: 9 | M261: 111 | O261: 20 | P261: 12 | Q261: 132 | S261: VENUE: PRESTON
A262: GEELONG WEST | C262: 7 | D262: 1 | E262: 43 | G262: 9 | H262: 4 | I262: 58 | K262: 11 | L262: 5 | M262: 71 | O262: 16 | P262: 12 | Q262: 108 | S262: MARCY :OGSTON
A263: BEST PLAYERS
A264: PRESTON | C264: BERRY | F264: SHAW | I264: AUSTEN | L264: SALVADORE | O264: COOPER | R264: MARCON
A265: GEELONG WEST | C265: MURPHY | F265: EDDY | I265: DALIHAUS | L265: SELLS | O265: SMITH
A266: GOALKICKERS
A267: PRESTON | C267: HALAS 6 | E267: OHLSEN 2 | G267: SALVADORE 2 | J267: AUSTEN 2 | L267: BOURKE 2 | N267: MARCON 2 | Q267: SHAW | R267: BERRY | T267: VEALE | V267: MERRYWEATHER
A268: GEELONG WEST | C268: BOOTHROYD 3 | F268: SELLS 3 | H268: MURPHY 3 | J268: EDDY 2 | L268: DALIHAUS 2 | O268: HIGGINS | Q268: ROBINSON | S268: RADOJEVIC
A270: WILLIAMSTOWN | C270: 3 | D270: 4 | E270: 22 | G270: 8 | H270: 8 | I270: 56 | K270: 17 | L270: 9 | M270: 111 | O270: 29 | P270: 16 | Q270: 190 | S270: VENUE: CAMBERWELL
A271: CAMBERWELL | C271: 6 | D271: 3 | E271: 39 | G271: 9 | H271: 5 | I271: 59 | K271: 15 | L271: 9 | M271: 99 | O271: 16 | P271: 12 | Q271: 108 | S271: GOLLOP :PHILLIPS
A272: BEST PLAYERS
A273: WILLIAMSTOWN | C273: KERSHAW | F273: FOTHERINGHAM | J273: MURPHY | M273: BOTTAMS | P273: DULLARD | R273: SINNOTT
A274: CAMBERWELL | C274: BURMEISTER | F274: STEVENSON | J274: MCCORMACK | M274: McFEE
A275: GOALKICKERS
A276: WILLIAMSTOWN | C276: FOTHERINGHAM 13 | G276: OBORNE 5 | I276: SLEVISON 3 | L276: McTAGGART 2 | O276: MURPHY 2 | Q276: SAIT 2 | S276: BARLOW | V276: SWANN
A277: CAMBERWELL | C277: STEVENSON 6 | F277: DODIG 3 | H277: McCORMACK 3 | K277: HIRST | M277: WILKINSON | P277: ANGUS | R277: S ROURKE
A279: PORT MELBOURNE | C279: 5 | D279: 5 | E279: 35 | G279: 7 | H279: 6 | I279: 48 | K279: 14 | L279: 8 | M279: 92 | O279: 19 | P279: 9 | Q279: 123 | S279: VENUE: PORT MELBOURNE
A280: COBURG | C280: 3 | D280: 4 | E280: 22 | G280: 6 | H280: 11 | I280: 47 | K280: 11 | L280: 15 | M280: 81 | O280: 17 | P280: 21 | Q280: 123 | S280: FITZPATRICK :J RYAN
A281: BEST PLAYERS
A282: PORT MELBOURNE | C282: DAVIES | F282: DERMOTT | I282: ROBERTSON | L282: RODDA | O282: WILKINSON | R282: KAVANAGH
A283: COBURG | C283: ALLISON | F283: MILROY | I283: DALGLEISH | L283: HARBINSON | O283: EADE | R283: COLLINS
A284: GOALKICKERS
A285: PORT MELBOURNE | C285: ANDERSON 5 | F285: COOK 4 | H285: EBEYER 3 | J285: WILKINSON 2 | M285: KAVANAGH 2 | P285: BARKER | R285: EVANS | T285: FREYER
A286: COBURG | C286: SERAFINI 4 | F286: EZARD 3 | H286: HERBERT 3 | J286: MILROY 2 | L286: KEOGH 2 | N286: BROWN | P286: FITZGERALD | S286: FREEMAN
A288: ROUND 6 | D288: 15TH MAY | I288: WEATHER | S288: VENUE: WILLIAMSTOWN
D289: 1ST QTR | H289: 2ND QTR | L289: 3RD QTR | P289: FINAL | S289: UMPIRES
A290: PRESTON | C290: 6 | D290: 2 | E290: 38 | G290: 13 | H290: 3 | I290: 81 | K290: 16 | L290: 4 | M290: 100 | O290: 19 | P290: 8 | Q290: 122 | S290: ALLSOPP | X290: LADDER | AB290: ROUND | AD290: 6
A291: WILLIAMSTOWN | C291: 3 | D291: 2 | E291: 20 | G291: 7 | H291: 5 | I291: 47 | K291: 9 | L291: 7 | M291: 61 | O291: 12 | P291: 8 | Q291: 80 | S291: SERONG
A292: BEST PLAYERS | W292: TEAM | X292: W | Y292: L | Z292: D | AA292: FOR | AB292: AGST | AC292: % | AD292: PTS
A293: PRESTON | C293: MARCON | F293: AUSTEN | I293: BRINE | L293: PLOWMAN | O293: COOPER | R293: BOLGER
A294: WILLIAMSTOWN | C294: SLEVISON | F294: BOTTAMS | I294: HUGHES | L294: SAMPSON | O294: P SINNOTT | W294: PORT MELBOURNE | X294: 5 | Y294: 0 | Z294: 1 | AA294: 800 | AB294: 627 | AC294: =(AA294/AB294)*100 -> 127.59170653907496 | AD294: =(X294*4)+(Z294*2) -> 22
A295: GOALKICKERS | W295: PRESTON | X295: 5 | Y295: 1 | Z295: 0 | AA295: 899 | AB295: 565 | AC295: =(AA295/AB295)*100 -> 159.11504424778761 | AD295: =(X295*4)+(Z295*2) -> 20
A296: PRESTON | C296: WHITE 5 | E296: MERRYWEATHER 4 | I296: MARCON 3 | K296: BOURKE 2 | M296: SALVADORE 2 | P296: COOPER 2 | R296: BOLGER | W296: GEELONG WEST | X296: 4 | Y296: 2 | Z296: 0 | AA296: 731 | AB296: 607 | AC296: =(AA296/AB296)*100 -> 120.42833607907744 | AD296: =(X296*4)+(Z296*2) -> 16
A297: WILLIAMSTOWN | C297: FOTHERINGHAM 3 | F297: HUGHES 2 | H297: SLEVISON 2 | K297: McCONNON 2 | N297: DULLARD | P297: BARLOW | R297: B McTAGGART | W297: WERRIBEE | X297: 4 | Y297: 2 | Z297: 0 | AA297: 758 | AB297: 799 | AC297: =(AA297/AB297)*100 -> 94.868585732165215 | AD297: =(X297*4)+(Z297*2) -> 16
S298: VENUE: GEELONG WEST
A299: GEELONG WEST | C299: 7 | D299: 4 | E299: 46 | G299: 12 | H299: 8 | I299: 80 | K299: 14 | L299: 9 | M299: 93 | O299: 18 | P299: 12 | Q299: 120 | S299: BUDGE | W299: FRANKSTON | X299: 4 | Y299: 2 | Z299: 0 | AA299: 628 | AB299: 764 | AC299: =(AA299/AB299)*100 -> 82.198952879581157 | AD299: =(X299*4)+(Z299*2) -> 16
A300: DANDENONG | C300: 3 | D300: 2 | E300: 20 | G300: 7 | H300: 5 | I300: 47 | K300: 12 | L300: 8 | M300: 80 | O300: 14 | P300: 10 | Q300: 94 | S300: VERGONA | W300: COBURG | X300: 3 | Y300: 2 | Z300: 1 | AA300: 844 | AB300: 725 | AC300: =(AA300/AB300)*100 -> 116.41379310344828 | AD300: =(X300*4)+(Z300*2) -> 14
A301: BEST PLAYERS | W301: SANDRINGHAM | X301: 3 | Y301: 3 | Z301: 0 | AA301: 750 | AB301: 711 | AC301: =(AA301/AB301)*100 -> 105.48523206751055 | AD301: =(X301*4)+(Z301*2) -> 12
A302: GEELONG WEST | C302: DALIHAUS | F302: EDDY | I302: GIBSON | L302: TORNEY | O302: WIESAK | R302: KRANJC | W302: WILLIAMSTOWN | X302: 2 | Y302: 4 | Z302: 0 | AA302: 814 | AB302: 767 | AC302: =(AA302/AB302)*100 -> 106.12777053455021 | AD302: =(X302*4)+(Z302*2) -> 8
A303: DANDENONG | C303: DEACON | F303: COVENTRY | I303: TREMBATH | L303: LACEY | O303: WRIGHT | W303: PRAHRAN | X303: 2 | Y303: 4 | Z303: 0 | AA303: 615 | AB303: 723 | AC303: =(AA303/AB303)*100 -> 85.062240663900411 | AD303: =(X303*4)+(Z303*2) -> 8
A304: GOALKICKERS | W304: CAMBERWELL | X304: 2 | Y304: 4 | Z304: 0 | AA304: 696 | AB304: 822 | AC304: =(AA304/AB304)*100 -> 84.671532846715323 | AD304: =(X304*4)+(Z304*2) -> 8
A305: GEELONG WEST | C305: SELLS 5 | E305: EDDY 4 | G305: BROWNE 3 | I305: MURPHY 2 | L305: BOOTHROYD | O305: DALIHAUS | Q305: JOHNSTON | S305: TORNEY | W305: DANDENONG | X305: 1 | Y305: 5 | Z305: 0 | AA305: 732 | AB305: 707 | AC305: =(AA305/AB305)*100 -> 103.53606789250354 | AD305: =(X305*4)+(Z305*2) -> 4
A306: DANDENONG | C306: WRIGHT 6 | F306: COVENTRY 4 | I306: MILLANE | K306: WOOD | M306: DEACON | O306: TREMBATH | W306: WAVERLEY | X306: 0 | Y306: 6 | Z306: 0 | AA306: 550 | AB306: 1000 | AC306: =(AA306/AB306)*100 -> 55 | AD306: =(X306*4)+(Z306*2) -> 0
A308: PORT MELBOURNE | C308: 4 | D308: 4 | E308: 28 | G308: 10 | H308: 5 | I308: 65 | K308: 13 | L308: 8 | M308: 86 | O308: 15 | P308: 12 | Q308: 102 | S308: VENUE: TOORAK PARK
A309: PRAHRAN | C309: 3 | D309: 5 | E309: 23 | G309: 7 | H309: 9 | I309: 51 | K309: 9 | L309: 15 | M309: 69 | O309: 12 | P309: 17 | Q309: 89 | S309: GROOM :CASEY
A310: BEST PLAYERS
A311: PORT MELBOURNE | C311: EVANS | F311: ROBERTSON | I311: CHADBAND | L311: WILKINSON | O311: RODDA | R311: DERMOTT
A312: PRAHRAN | C312: PARKER | F312: WRIGHT | I312: WALLACE | L312: BATT | O312: GRAMBEAU | R312: GILES
A313: GOALKICKERS
A314: PORT MELBOURNE | C314: COOK 4 | E314: EVANS 4 | G314: WILKINSON 3 | J314: CHADBAND | M314: BARKER | O314: DOYLE | Q314: ANDERSON
A315: PRAHRAN | C315: HART 4 | E315: WALLACE 3 | H315: SOULOS 2 | J315: BICKFORD | M315: PARKER | O315: WRIGHT
A317: FRANKSTON | C317: 7 | D317: 5 | E317: 47 | G317: 10 | H317: 9 | I317: 69 | K317: 12 | L317: 14 | M317: 86 | O317: 14 | P317: 16 | Q317: 100 | S317: VENUE: FRANKSTON
A318: SANDRINGHAM | C318: 2 | D318: 1 | E318: 13 | G318: 7 | H318: 6 | I318: 48 | K318: 8 | L318: 6 | M318: 54 | O318: 12 | P318: 12 | Q318: 84 | S318: MARCY :PHILLIPS
A319: BEST PLAYERS
A320: FRANKSTON | C320: HORTON | F320: BRUIN | I320: HORLER | L320: GEDDES | O320: FERGUSON | R320: DUNBAR
A321: SANDRINGHAM | C321: MAILING | F321: GALLAGHER | I321: MANNIX | L321: LYONS | O321: MULLER
A322: GOALKICKERS
A323: FRANKSTON | C323: HUNTER 4 | F323: BARDOEL 3 | I323: FERGUSON 3 | L323: KENNEDY 2 | O323: VANDERMEER | R323: DUNBAR
A324: SANDRINGHAM | C324: GALLAGHER 2 | F324: NANKERVIS 2 | I324: MORRISON 2 | L324: ADAMS | N324: BARKLY | P324: FREW | R324: MAILING | U324: PLEDGER | X324: WORKMAN
A326: CAMBERWELL | C326: 6 | D326: 3 | E326: 39 | G326: 9 | H326: 7 | I326: 61 | K326: 19 | L326: 9 | M326: 123 | O326: 21 | P326: 10 | Q326: 136 | S326: VENUE: COBURG
A327: COBURG | C327: 5 | D327: 3 | E327: 33 | G327: 8 | H327: 11 | I327: 59 | K327: 10 | L327: 13 | M327: 73 | O327: 15 | P327: 19 | Q327: 109 | S327: OAKLEY :STEERE
A328: BEST PLAYERS
A329: CAMBERWELL | C329: McFEE | F329: EVANS | I329: BURMEISTER | L329: C ROURKE | O329: DAVIDSON | R329: NEILSON
A330: COBURG | C330: KEOGH | F330: ZANON | I330: ALLISON
A331: GOALKICKERS
A332: CAMBERWELL | C332: B EVANS 5 | F332: STEVENSON 4 | I332: DODIG 4 | K332: McCORMACK 4 | N332: HIRST 2 | P332: CUFF | R332: DEGOEY
A333: COBURG | C333: HERBERT 4 | F333: SERAFINI 3 | I333: KEOGH 3 | K333: J FITZGERALD | N333: MILROY | P333: ZANON | R333: DALGLEISH
A335: WERRIBEE | C335: 5 | D335: 4 | E335: 34 | G335: 13 | H335: 4 | I335: 82 | K335: 16 | L335: 7 | M335: 103 | O335: 22 | P335: 13 | Q335: 145 | S335: VENUE: WERRIBEE
A336: WAVERLEY | C336: 2 | D336: 2 | E336: 14 | G336: 2 | H336: 8 | I336: 20 | K336: 8 | L336: 12 | M336: 60 | O336: 13 | P336: 16 | Q336: 94 | S336: RYAN ;STABB
A337: BEST PLAYERS
A338: WERRIBEE | C338: RICHARDSON | F338: CONN | I338: PARKES | L338: MARSDEN | O338: REDENBACH
A339: WAVERLEY | C339: WILLIAMS | F339: WENBORNE | I339: MULLENS | L339: CARGHILL | O339: ALEXANDER
A340: GOALKICKERS
A341: WERRIBEE | C341: KING 7 | E341: BREEN 3 | G341: REDENBACH 3 | J341: SIMMONS 2 | M341: DAY 2 | O341: ALLAN 2 | Q341: SMITH | S341: BOND | U341: MURPHY
A342: WAVERLEY | C342: ANGELIS 3 | F342: DAVIES 3 | H342: GOODMAN 3 | K342: ALEXANDER 2 | N342: HOWELL | P342: WILLIAMS
A344: ROUND 7 | D344: 29TH MAY | I344: WEATHER | S344: PLAYED VENUE: WAVERLEY
D345: 1ST QTR | H345: 2ND QTR | L345: 3RD QTR | P345: FINAL | S345: UMPIRES
A346: FRANKSTON | C346: 6 | D346: 5 | E346: 41 | G346: 11 | H346: 8 | I346: 74 | K346: 18 | L346: 11 | M346: 119 | O346: 22 | P346: 12 | Q346: 144 | S346: FITZPATRICK | X346: LADDER | AB346: ROUND | AD346: 7
A347: WAVERLEY | C347: 6 | D347: 1 | E347: 37 | G347: 12 | H347: 3 | I347: 75 | K347: 13 | L347: 6 | M347: 84 | O347: 13 | P347: 8 | Q347: 86 | S347: ALLSOPP
A348: BEST PLAYERS | W348: TEAM | X348: W | Y348: L | Z348: D | AA348: FOR | AB348: AGST | AC348: % | AD348: PTS
A349: FRANKSTON | C349: BARDOEL | F349: HORTON | I349: VANDERMEER | L349: DUNBAR | O349: BELL | R349: HORLER
A350: WAVERLEY | C350: VEAR | F350: WILLIAMS | I350: MULLENS | L350: ANGELIS | O350: PRITCHARD | R350: WENBORNE | W350: PORT MELBOURNE | X350: 6 | Y350: 0 | Z350: 1 | AA350: 923 | AB350: 707 | AC350: =(AA350/AB350)*100 -> 130.55162659123053 | AD350: =(X350*4)+(Z350*2) -> 26
A351: GOALKICKERS | P351: LYNN | W351: PRESTON | X351: 6 | Y351: 1 | Z351: 0 | AA351: 1042 | AB351: 622 | AC351: =(AA351/AB351)*100 -> 167.52411575562701 | AD351: =(X351*4)+(Z351*2) -> 24
A352: FRANKSTON | C352: BARDOEL 7 | F352: HORTON 4 | I352: HUNTER 3 | K352: VANDERMEER 2 | N352: BEATON 2 | Q352: DUNBAR 2 | S352: FERGUSON | W352: GEELONG WEST | X352: 5 | Y352: 2 | Z352: 0 | AA352: 864 | AB352: 668 | AC352: =(AA352/AB352)*100 -> 129.34131736526945 | AD352: =(X352*4)+(Z352*2) -> 20
A353: WAVERLEY | C353: ANGELIS 7 | F353: GOODMAN 2 | I353: PRITCHARD 2 | L353: CHERNEY | N353: KAYE | W353: FRANKSTON | X353: 5 | Y353: 2 | Z353: 0 | AA353: 772 | AB353: 850 | AC353: =(AA353/AB353)*100 -> 90.823529411764696 | AD353: =(X353*4)+(Z353*2) -> 20
S354: VENUE: DANDENONG
A355: DANDENONG | C355: 1 | D355: 1 | E355: 7 | G355: 3 | H355: 5 | I355: 23 | K355: 4 | L355: 7 | M355: 31 | O355: 9 | P355: 12 | Q355: 66 | S355: MORGAN | W355: COBURG | X355: 4 | Y355: 2 | Z355: 1 | AA355: 967 | AB355: 781 | AC355: =(AA355/AB355)*100 -> 123.8156209987196 | AD355: =(X355*4)+(Z355*2) -> 18
A356: WILLIAMSTOWN | C356: 2 | D356: 2 | E356: 14 | G356: 3 | H356: 5 | I356: 23 | K356: 6 | L356: 6 | M356: 42 | O356: 7 | P356: 8 | Q356: 50 | S356: OGSTON | W356: WERRIBEE | X356: 4 | Y356: 3 | Z356: 0 | AA356: 838 | AB356: 922 | AC356: =(AA356/AB356)*100 -> 90.889370932754872 | AD356: =(X356*4)+(Z356*2) -> 16
A357: BEST PLAYERS | W357: SANDRINGHAM | X357: 3 | Y357: 4 | Z357: 0 | AA357: 811 | AB357: 844 | AC357: =(AA357/AB357)*100 -> 96.090047393364927 | AD357: =(X357*4)+(Z357*2) -> 12
A358: DANDENONG | C358: DE KONNING | F358: COVENTRY | I358: SHINNERS | L358: DEAKIN | N358: S KNIGHT | Q358: P KNIGHT | W358: DANDENONG | X358: 2 | Y358: 5 | Z358: 0 | AA358: 798 | AB358: 757 | AC358: =(AA358/AB358)*100 -> 105.41611624834874 | AD358: =(X358*4)+(Z358*2) -> 8
A359: WILLIAMSTOWN | C359: MURPHY | F359: SAMPSON | I359: SLEVISON | L359: PLATT | N359: TURLEY | W359: WILLIAMSTOWN | X359: 2 | Y359: 5 | Z359: 0 | AA359: 864 | AB359: 833 | AC359: =(AA359/AB359)*100 -> 103.72148859543817 | AD359: =(X359*4)+(Z359*2) -> 8
A360: GOALKICKERS | W360: PRAHRAN | X360: 2 | Y360: 5 | Z360: 0 | AA360: 671 | AB360: 846 | AC360: =(AA360/AB360)*100 -> 79.314420803782497 | AD360: =(X360*4)+(Z360*2) -> 8
A361: DANDENONG | C361: WOOD 2 | F361: WENN 2 | H361: DEAKIN | J361: SHINNERS | M361: COVENTRY | O361: WRIGHT | Q361: DE KONNING | W361: CAMBERWELL | X361: 2 | Y361: 5 | Z361: 0 | AA361: 753 | AB361: 965 | AC361: =(AA361/AB361)*100 -> 78.031088082901562 | AD361: =(X361*4)+(Z361*2) -> 8
A362: WILLIAMSTOWN | C362: FOTHERINGHAM 3 | G362: TURLEY 2 | J362: MURPHY | L362: RAUNIK | W362: WAVERLEY | X362: 0 | Y362: 7 | Z362: 0 | AA362: 636 | AB362: 1144 | AC362: =(AA362/AB362)*100 -> 55.594405594405593 | AD362: =(X362*4)+(Z362*2) -> 0
A364: PRESTON | C364: 5 | D364: 4 | E364: 34 | G364: 12 | H364: 7 | I364: 79 | K364: 19 | L364: 10 | M364: 124 | O364: 21 | P364: 17 | Q364: 143 | S364: VENUE: PRESTON
A365: CAMBERWELL | C365: 2 | D365: 5 | E365: 17 | G365: 4 | H365: 6 | I365: 30 | K365: 6 | L365: 9 | M365: 45 | O365: 7 | P365: 15 | Q365: 57 | S365: RYAN :GROOM
A366: BEST PLAYERS
A367: PRESTON | C367: MARCON | F367: McKEON | I367: SALVADORE | L367: BERRY | O367: BUX | Q367: BRINE
A368: CAMBERWELL | C368: BURMEISTER | F368: WILKINSON | I368: C ROURKE | L368: D EVANS | O368: HICKEY
A369: GOALKICKERS
A370: PRESTON | C370: OHLSEN 4 | E370: MARCON 4 | H370: SALVADORE 4 | K370: BEER 3 | M370: McKEON 2 | O370: SHAW | Q370: AUSTEN | S370: BERRY | U370: DYSON
A371: CAMBERWELL | C371: HICKEY 3 | F371: B EVANS | H371: S ROURKE | K371: McCORMACK | N371: DODIG
A373: PORT MELBOURNE | C373: 4 | D373: 1 | E373: 25 | G373: 5 | H373: 4 | I373: 34 | K373: 11 | L373: 8 | M373: 74 | O373: 18 | P373: 15 | Q373: 123 | S373: VENUE: PORT MELBOURNE
A374: WERRIBEE | C374: 7 | D374: 1 | E374: 43 | G374: 9 | H374: 5 | I374: 59 | K374: 10 | L374: 8 | M374: 68 | O374: 12 | P374: 8 | Q374: 80 | S374: VERGONA :MARCY
A375: BEST PLAYERS
A376: PORT MELBOURNE | C376: CHADBAND | F376: ANDERSON | I376: THOMPSON | L376: DERMOTT | O376: EBEYER | R376: FEHRING
A377: WERRIBEE | C377: BREEN | F377: MURPHY | I377: RICHARDSON | L377: KING | O377: MARSDEN
A378: GOALKICKERS
A379: PORT MELBOURNE | C379: ANDERSON 7 | F379: EBEYER 6 | I379: COOK 3 | K379: KAVANAGH 2
A380: WERRIBEE | C380: KING 3 | E380: SIMMONS 3 | H380: MURPHY 2 | K380: BREEN 2 | M380: ALLAN | O380: MARSDEN
A382: COBURG | C382: 7 | D382: 4 | E382: 46 | G382: 8 | H382: 5 | I382: 53 | K382: 14 | L382: 7 | M382: 91 | O382: 19 | P382: 9 | Q382: 123 | S382: VENUE: TOORAK PARK
A383: PRAHRAN | C383: 1 | D383: 1 | E383: 7 | G383: 1 | H383: 6 | I383: 12 | K383: 4 | L383: 9 | M383: 33 | O383: 7 | P383: 14 | Q383: 56 | S383: STABB :PHILLIPS
A384: BEST PLAYERS
A385: COBURG | C385: MILROY | F385: J FITZGERALD | I385: M FITZGERALD | L385: HERBERT | O385: DALGLEISH | R385: ALLISON
A386: PRAHRAN | C386: PARKER | F386: McKISSOCK | I386: BICKFORD | L386: McDONALD
A387: GOALKICKERS
A388: COBURG | C388: SERAFINI 6 | F388: J FITZGERALD 4 | I388: FREEMAN 4 | L388: HERBERT 2 | O388: BROWN | Q388: EZARD | S388: COLLINS
A389: PRAHRAN | C389: BICKFORD | F389: WRIGHT | H389: ELLETT | J389: PARKER | L389: McNAMARA | O389: FOLEY | Q389: DICKSON
A391: GEELONG WEST | C391: 4 | D391: 2 | E391: 26 | G391: 7 | H391: 7 | I391: 49 | K391: 13 | L391: 13 | M391: 91 | O391: 19 | P391: 19 | Q391: 133 | S391: VENUE: BEACH ROAD
A392: SANDRINGHAM | C392: 1 | D392: 2 | E392: 8 | G392: 5 | H392: 5 | I392: 35 | K392: 6 | L392: 9 | M392: 45 | O392: 8 | P392: 13 | Q392: 61 | S392: CASEY ;GOLLOP
A393: BEST PLAYERS
A394: GEELONG WEST | C394: DALIHAUS | F394: EDDY | I394: RUUNDE | L394: McFADDEN | O394: HIGGINS | Q394: DODDS
A395: SANDRINGHAM | C395: BENNETT | F395: MANSFIELD | I395: MACLEOD | L395: SCOTT
A396: GOALKICKERS
A397: GEELONG WEST | C397: MURPHY 3 | F397: SELLS 3 | H397: TORNEY 3 | J397: HIGGINS 2 | L397: DODDS 2 | N397: BURNETT | P397: GIBSON | R397: BOOTHROYD | V397: DALIHAUS | X397: EDDY | Z397: MACKENZIE
A398: SANDRINGHAM | C398: MAILING 3 | F398: MACLEOD 2 | I398: GALLAGHER 2 | L398: MULLER
A400: ROUND 8 | D400: 5TH JUNE | I400: WEATHER | S400: VENUE: GEELONG WEST
D401: 1ST QTR | H401: 2ND QTR | L401: 3RD QTR | P401: FINAL | S401: UMPIRES
A402: GEELONG WEST | C402: 6 | D402: 4 | E402: 40 | G402: 14 | H402: 12 | I402: 96 | K402: 29 | L402: 18 | M402: 192 | O402: 37 | P402: 27 | Q402: 249 | S402: MORGAN | X402: LADDER | AB402: ROUND | AD402: 8
A403: WAVERLEY | C403: 1 | D403: 4 | E403: 10 | G403: 1 | H403: 4 | I403: 10 | K403: 3 | L403: 7 | M403: 25 | O403: 6 | P403: 9 | Q403: 45 | S403: RYAN
A404: BEST PLAYERS | W404: TEAM | X404: W | Y404: L | Z404: D | AA404: FOR | AB404: AGST | AC404: % | AD404: PTS
A405: GEELONG WEST | C405: WATT | F405: HIGGINS | I405: McFADDEN | L405: EDDY | N405: MURPHY | Q405: SELLS
A406: WAVERLEY | C406: CLARKE | F406: MURRAY | I406: WARBURTON | L406: KING | N406: ALLEN | Q406: MIER | W406: PORT MELBOURNE | X406: 7 | Y406: 0 | Z406: 1 | AA406: 1120 | AB406: 841 | AC406: =(AA406/AB406)*100 -> 133.17479191438764 | AD406: =(X406*4)+(Z406*2) -> 30
A407: GOALKICKERS | J407: DALIHAUS 2 | M407: TOULMIN | O407: DODDS | Q407: BURNETT | W407: PRESTON | X407: 7 | Y407: 1 | Z407: 0 | AA407: 1155 | AB407: 727 | AC407: =(AA407/AB407)*100 -> 158.87207702888583 | AD407: =(X407*4)+(Z407*2) -> 28
A408: GEELONG WEST | C408: RADOJEVIC 9 | F408: EDDY 6 | H408: MURPHY 5 | J408: SELLS 4 | L408: WATT 2 | N408: HIGGINS 2 | P408: BROWNE 2 | R408: GIBSON 2 | W408: GEELONG WEST | X408: 6 | Y408: 2 | Z408: 0 | AA408: 1113 | AB408: 713 | AC408: =(AA408/AB408)*100 -> 156.10098176718091 | AD408: =(X408*4)+(Z408*2) -> 24
A409: WAVERLEY | C409: ALLEN 2 | F409: MURRAY | H409: PRITCHETT | J409: MULLENS | L409: KING | W409: WERRIBEE | X409: 5 | Y409: 3 | Z409: 0 | AA409: 944 | AB409: 1018 | AC409: =(AA409/AB409)*100 -> 92.73084479371316 | AD409: =(X409*4)+(Z409*2) -> 20
S410: VENUE: WERRIBEE
A411: WERRIBEE | C411: 5 | D411: 5 | E411: 35 | G411: 13 | H411: 7 | I411: 85 | K411: 15 | L411: 10 | M411: 100 | O411: 15 | P411: 16 | Q411: 106 | S411: BLOOM | W411: FRANKSTON | X411: 5 | Y411: 3 | Z411: 0 | AA411: 906 | AB411: 1047 | AC411: =(AA411/AB411)*100 -> 86.532951289398284 | AD411: =(X411*4)+(Z411*2) -> 20
A412: PRAHRAN | C412: 2 | D412: 3 | E412: 15 | G412: 5 | H412: 7 | I412: 37 | K412: 9 | L412: 12 | M412: 66 | O412: 14 | P412: 12 | Q412: 96 | S412: GOLLOP | W412: COBURG | X412: 4 | Y412: 3 | Z412: 1 | AA412: 1072 | AB412: 894 | AC412: =(AA412/AB412)*100 -> 119.91051454138702 | AD412: =(X412*4)+(Z412*2) -> 18
A413: BEST PLAYERS | W413: SANDRINGHAM | X413: 4 | Y413: 4 | Z413: 0 | AA413: 940 | AB413: 929 | AC413: =(AA413/AB413)*100 -> 101.18406889128096 | AD413: =(X413*4)+(Z413*2) -> 16
A414: WERRIBEE | C414: MEMBREY | F414: BREEN | I414: PARKES | L414: ALLAN | N414: FREEMAN | Q414: LANCASTER | W414: CAMBERWELL | X414: 3 | Y414: 5 | Z414: 0 | AA414: 887 | AB414: 1081 | AC414: =(AA414/AB414)*100 -> 82.053654024051809 | AD414: =(X414*4)+(Z414*2) -> 12
A415: PRAHRAN | C415: McKISSOCK | F415: DICKSON | I415: BATT | L415: GILES | N415: ELLETT | Q415: FRANCE | W415: DANDENONG | X415: 2 | Y415: 6 | Z415: 0 | AA415: 914 | AB415: 891 | AC415: =(AA415/AB415)*100 -> 102.58136924803591 | AD415: =(X415*4)+(Z415*2) -> 8
A416: GOALKICKERS | W416: WILLIAMSTOWN | X416: 2 | Y416: 6 | Z416: 0 | AA416: 949 | AB416: 962 | AC416: =(AA416/AB416)*100 -> 98.648648648648646 | AD416: =(X416*4)+(Z416*2) -> 8
A417: WERRIBEE | C417: SIMMONS 6 | F417: REDENBACH 3 | I417: ALLAN 2 | K417: BREEN 2 | M417: KING | O417: SMITH | W417: PRAHRAN | X417: 2 | Y417: 6 | Z417: 0 | AA417: 767 | AB417: 952 | AC417: =(AA417/AB417)*100 -> 80.567226890756302 | AD417: =(X417*4)+(Z417*2) -> 8
A418: PRAHRAN | C418: FRANCE 6 | F418: DICKSON 2 | I418: HARGREAVES 2 | L418: WALLACE 2 | N418: BICKFORD | Q418: McDONALD | W418: WAVERLEY | X418: 0 | Y418: 8 | Z418: 0 | AA418: 681 | AB418: 1393 | AC418: =(AA418/AB418)*100 -> 48.887293610911705 | AD418: =(X418*4)+(Z418*2) -> 0
A420: PRESTON | C420: 4 | D420: 4 | E420: 28 | G420: 11 | H420: 6 | I420: 72 | K420: 14 | L420: 7 | M420: 91 | O420: 17 | P420: 11 | Q420: 113 | S420: VENUE: PRESTON
A421: COBURG | C421: 3 | D421: 5 | E421: 23 | G421: 5 | H421: 6 | I421: 36 | K421: 12 | L421: 14 | M421: 86 | O421: 15 | P421: 15 | Q421: 105 | S421: CASEY ;VERGONA
A422: BEST PLAYERS
A423: PRESTON | C423: WARREN | F423: BERRY | I423: BOLGER | L423: AUSTEN | O423: BODEN | Q423: BUX
A424: COBURG | C424: EZARD | F424: DALGLEISH | I424: HERBERT | L424: EADE | O424: ALLISON | Q424: HARBINSON
A425: GOALKICKERS
A426: PRESTON | C426: BODEN 4 | E426: BEER 4 | G426: OHLSEN 2 | J426: MERRYWEATHER 2 | N426: SHAW 2 | P426: BOLGER | R426: AUSTEN | U426: BOURKE
A427: COBURG | C427: SERAFINI 4 | F427: FREEMAN 3 | I427: J FITZGERALD 2 | L427: EZARD 2 | N427: HERBERT 2 | Q427: MILROY | S427: KEOGH
A429: PORT MELBOURNE | C429: 6 | D429: 4 | E429: 40 | G429: 14 | H429: 6 | I429: 90 | K429: 22 | L429: 9 | M429: 141 | O429: 30 | P429: 17 | Q429: 197 | S429: VENUE: FRANKSTON
A430: FRANKSTON | C430: 4 | D430: 4 | E430: 28 | G430: 12 | H430: 6 | I430: 78 | K430: 17 | L430: 11 | M430: 113 | O430: 20 | P430: 14 | Q430: 134 | S430: OGSTON :BUDGE
A431: BEST PLAYERS
A432: PORT MELBOURNE | C432: CHADBAND | F432: ANDERSON | I432: WILKINSON | L432: DERMOTT | O432: EVANS | Q432: COOK
A433: FRANKSTON | C433: COLE | F433: DUNBAR | I433: BELL | L433: CASEY | O433: LYNN
A434: GOALKICKERS
A435: PORT MELBOURNE | C435: COOK 7 | E435: ANDERSON 7 | H435: EVANS 6 | J435: KAVANAGH 4 | M435: EBEYER 2 | O435: SWAN | Q435: WILKINSON | T435: FEHRING | W435: RODDA
A436: FRANKSTON | C436: COLE 5 | E436: HUNTER 4 | G436: LYNN 3 | I436: ROGERSON 2 | L436: BARDOEL | N436: VANDERMEER | Q436: GEDDES | S436: FERGUSON | V436: DUNBAR | X436: BOYD
A438: CAMBERWELL | C438: 4 | D438: 3 | E438: 27 | G438: 12 | H438: 5 | I438: 77 | K438: 16 | L438: 10 | M438: 106 | O438: 20 | P438: 14 | Q438: 134 | S438: VENUE: CAMBERWELL
A439: DANDENONG | C439: 5 | D439: 6 | E439: 36 | G439: 10 | H439: 6 | I439: 66 | K439: 16 | L439: 7 | M439: 103 | O439: 18 | P439: 8 | Q439: 116 | S439: STABB :FITZPATRICK
A440: BEST PLAYERS
A441: CAMBERWELL | C441: C ROURKE | F441: WILKINSON | I441: NEILSON | L441: DANS | O441: COLLINS | R441: BURMEISTER
A442: DANDENONG | C442: WRIGHT | F442: TREMBATH | I442: COVENTRY | L442: DE KONNING | O442: WESTCOTT
A443: GOALKICKERS
A444: CAMBERWELL | C444: COLLINS 6 | F444: STEVENSON 6 | I444: SKETCHLEY 2 | L444: B EVANS | N444: BURMEISTER | Q444: DAVIDSON | S444: C ROURKE | V444: NEILSON | X444: HIRST
A445: DANDENONG | C445: WRIGHT 10 | F445: RHODE 2 | H445: FINN 2 | J445: COVENTRY 2 | M445: WENN | O445: WOOD
A447: SANDRINGHAM | C447: 4 | D447: 4 | E447: 28 | G447: 11 | H447: 6 | I447: 72 | K447: 17 | L447: 10 | M447: 112 | O447: 19 | P447: 15 | Q447: 129 | S447: VENUE: WILLIAMSTOWN
A448: WILLIAMSTOWN | C448: 4 | D448: 4 | E448: 28 | G448: 7 | H448: 6 | I448: 48 | K448: 8 | L448: 9 | M448: 57 | O448: 12 | P448: 13 | Q448: 85 | S448: OAKLEY :GROOM
A449: BEST PLAYERS
A450: SANDRINGHAM | C450: BLAIR | F450: MERCER | I450: LYONS | L450: MACLEOD | O450: MANSFIELD | R450: MULLER
A451: WILLIAMSTOWN | C451: KERSHAW | F451: SAMPSON | I451: MURRAY | L451: RAUNIK | O451: SAIT | R451: P SINNOTT
A452: GOALKICKERS
A453: SANDRINGHAM | C453: GALLAGHER 5 | F453: BENNETT 5 | I453: MACLEOD 3 | L453: LYONS 2 | N453: MAILING | P453: MANSFIELD | S453: MANNIX | V453: HAYES
A454: WILLIAMSTOWN | C454: DULLARD 2 | F454: PLATT 2 | H454: FOTHERINGHAM 2 | L454: SAIT 2 | N454: MURPHY | P454: RAUNIK | R454: TURLEY | U454: P SINNOTT
A456: ROUND 9 | D456: 12TH JUNE | I456: WEATHER | S456: VENUE: BEACH ROAD
D457: 1ST QTR | H457: 2ND QTR | L457: 3RD QTR | P457: FINAL | S457: UMPIRES
A458: SANDRINGHAM | C458: 4 | D458: 2 | E458: 26 | G458: 7 | H458: 5 | I458: 47 | K458: 12 | L458: 11 | M458: 83 | O458: 20 | P458: 11 | Q458: 131 | S458: BLOOM | X458: LADDER | AB458: ROUND | AD458: 9
A459: CAMBERWELL | C459: 0 | D459: 7 | E459: 7 | G459: 5 | H459: 7 | I459: 37 | K459: 9 | L459: 9 | M459: 63 | O459: 14 | P459: 13 | Q459: 97 | S459: MARCY
A460: BEST PLAYERS | W460: TEAM | X460: W | Y460: L | Z460: D | AA460: FOR | AB460: AGST | AC460: % | AD460: PTS
A461: SANDRINGHAM | C461: MAILING | F461: HAYES | I461: MULLER | L461: MERCER | O461: LYONS | Q461: WILKINS
A462: CAMBERWELL | C462: HICKEY | F462: DANS | I462: NEILSON | L462: C ROURKE | W462: PORT MELBOURNE | X462: 8 | Y462: 0 | Z462: 1 | AA462: 1276 | AB462: 945 | AC462: =(AA462/AB462)*100 -> 135.02645502645504 | AD462: =(X462*4)+(Z462*2) -> 34
A463: GOALKICKERS | W463: PRESTON | X463: 8 | Y463: 1 | Z463: 0 | AA463: 1317 | AB463: 819 | AC463: =(AA463/AB463)*100 -> 160.80586080586082 | AD463: =(X463*4)+(Z463*2) -> 32
A464: SANDRINGHAM | C464: MACLEOD 5 | F464: BENNETT 5 | I464: MAILING 4 | K464: MANNIX 2 | M464: LYONS 2 | O464: SIMS | Q464: ADAMS | W464: GEELONG WEST | X464: 6 | Y464: 3 | Z464: 0 | AA464: 1217 | AB464: 869 | AC464: =(AA464/AB464)*100 -> 140.04602991944765 | AD464: =(X464*4)+(Z464*2) -> 24
A465: CAMBERWELL | C465: EVANS 3 | F465: GASTON 3 | I465: PRETTO 2 | K465: STEVENSON 2 | N465: BURMEISTER 2 | Q465: COLLINS | S465: S ROURKE | W465: COBURG | X465: 5 | Y465: 3 | Z465: 1 | AA465: 1232 | AB465: 973 | AC465: =(AA465/AB465)*100 -> 126.61870503597122 | AD465: =(X465*4)+(Z465*2) -> 22
S466: VENUE: PORT MELBOURNE
A467: PORT MELBOURNE | C467: 4 | D467: 3 | E467: 27 | G467: 12 | H467: 11 | I467: 83 | K467: 19 | L467: 13 | M467: 127 | O467: 23 | P467: 18 | Q467: 156 | S467: PHILLIPS | W467: FRANKSTON | X467: 5 | Y467: 3 | Z467: 1 | AA467: 1037 | AB467: 1178 | AC467: =(AA467/AB467)*100 -> 88.030560271646863 | AD467: =(X467*4)+(Z467*2) -> 22
A468: GEELONG WEST | C468: 2 | D468: 4 | E468: 16 | G468: 3 | H468: 5 | I468: 23 | K468: 10 | L468: 8 | M468: 68 | O468: 16 | P468: 8 | Q468: 104 | S468: OAKLEY | W468: SANDRINGHAM | X468: 5 | Y468: 4 | Z468: 0 | AA468: 1071 | AB468: 1026 | AC468: =(AA468/AB468)*100 -> 104.3859649122807 | AD468: =(X468*4)+(Z468*2) -> 20
A469: BEST PLAYERS | W469: WERRIBEE | X469: 5 | Y469: 4 | Z469: 0 | AA469: 1023 | AB469: 1178 | AC469: =(AA469/AB469)*100 -> 86.842105263157904 | AD469: =(X469*4)+(Z469*2) -> 20
A470: PORT MELBOURNE | C470: DERMOTT | F470: KAVANAGH | I470: EBEYER | L470: ROBERTSON | O470: SWAN | Q470: EVANS | W470: WILLIAMSTOWN | X470: 3 | Y470: 6 | Z470: 0 | AA470: 1107 | AB470: 1030 | AC470: =(AA470/AB470)*100 -> 107.47572815533981 | AD470: =(X470*4)+(Z470*2) -> 12
A471: GEELONG WEST | C471: BROWNE | F471: WELSH | I471: SMITH | L471: TORNEY | W471: CAMBERWELL | X471: 3 | Y471: 6 | Z471: 0 | AA471: 984 | AB471: 1212 | AC471: =(AA471/AB471)*100 -> 81.188118811881196 | AD471: =(X471*4)+(Z471*2) -> 12
A472: GOALKICKERS | W472: PRAHRAN | X472: 2 | Y472: 6 | Z472: 1 | AA472: 898 | AB472: 1083 | AC472: =(AA472/AB472)*100 -> 82.917820867959364 | AD472: =(X472*4)+(Z472*2) -> 10
A473: PORT MELBOURNE | C473: EVANS 5 | F473: ANDERSON 5 | I473: EBEYER 4 | K473: COOK 3 | M473: SWAN 2 | O473: RODDA 2 | Q473: GOSS 2 | W473: DANDENONG | X473: 2 | Y473: 7 | Z473: 0 | AA473: 1006 | AB473: 1053 | AC473: =(AA473/AB473)*100 -> 95.536562203228868 | AD473: =(X473*4)+(Z473*2) -> 8
A474: GEELONG WEST | C474: WELSH 7 | F474: EDDY 3 | H474: HIGGINS 2 | J474: GIBSON | L474: MURPHY | N474: BROWNE | P474: RADOJEVIC | W474: WAVERLEY | X474: 0 | Y474: 9 | Z474: 0 | AA474: 749 | AB474: 1551 | AC474: =(AA474/AB474)*100 -> 48.291424887169569 | AD474: =(X474*4)+(Z474*2) -> 0
A476: COBURG | C476: 8 | D476: 4 | E476: 52 | G476: 11 | H476: 5 | I476: 71 | K476: 19 | L476: 10 | M476: 124 | O476: 24 | P476: 16 | Q476: 160 | S476: VENUE: COBURG
A477: WERRIBEE | C477: 1 | D477: 2 | E477: 8 | G477: 3 | H477: 5 | I477: 23 | K477: 5 | L477: 5 | M477: 35 | O477: 11 | P477: 13 | Q477: 79 | S477: ALLSOPP ;BUDGE
A478: BEST PLAYERS
A479: COBURG | C479: HERBERT | F479: COLLINS | I479: ZANON | L479: MILROY | O479: ALLISON | R479: DOHNT
A480: WERRIBEE | C480: RICHARDSON | F480: MARSDEN | I480: LANCASTER | L480: LE DEUX | O480: SCANLON
A481: GOALKICKERS
A482: COBURG | C482: HERBERT 8 | F482: SERAFINI 5 | I482: J FITZGERALD 5 | L482: BURT 2 | N482: EZARD | P482: COLLINS | R482: M FITZGERALD | V482: FREEMAN
A483: WERRIBEE | C483: SIMMONS 4 | F483: REDENBACH 2 | I483: SMITH 2 | K483: ALLAN | M483: RICHARDSON | P483: KING
D484: 19TH JUNE
A485: PRESTON | C485: 3 | D485: 3 | E485: 21 | G485: 9 | H485: 7 | I485: 61 | K485: 16 | L485: 12 | M485: 108 | O485: 24 | P485: 18 | Q485: 162 | S485: VENUE: DANDENONG
A486: DANDENONG | C486: 4 | D486: 2 | E486: 26 | G486: 8 | H486: 7 | I486: 55 | K486: 10 | L486: 7 | M486: 67 | O486: 14 | P486: 8 | Q486: 92 | S486: VERGONA :RYAN
A487: BEST PLAYERS
A488: PRESTON | C488: AUSTEN | F488: BRINE | I488: BERRY | L488: WARREN | O488: OHLSEN | R488: PLOWMAN
A489: DANDENONG | C489: FINN | F489: WESTCOTT | I489: SHINNERS | L489: P KNIGHT | O489: COVENTRY
A490: GOALKICKERS
A491: PRESTON | C491: BEER 6 | E491: OHLSEN 5 | H491: BODEN 4 | J491: DYSON 3 | L491: MOORE 3 | N491: WARREN 2 | Q491: MARCON
A492: DANDENONG | C492: WRIGHT 4 | E492: ORTON 2 | G492: RHODE 2 | I492: DE KONNING | L492: TREMBATH | O492: SHINNERS | Q492: DEAKIN | T492: D MILLANE | W492: J MILLANE
A494: PRAHRAN | C494: 6 | D494: 5 | E494: 41 | G494: 12 | H494: 7 | I494: 79 | K494: 17 | L494: 11 | M494: 113 | O494: 19 | P494: 17 | Q494: 131 | S494: VENUE: TOORAK PARK
A495: FRANKSTON | C495: 5 | D495: 2 | E495: 32 | G495: 9 | H495: 2 | I495: 56 | K495: 16 | L495: 4 | M495: 100 | O495: 21 | P495: 5 | Q495: 131 | S495: GROOM :FITZPATRICK
A496: BEST PLAYERS
A497: PRAHRAN | C497: BATT | F497: WRIGHT | I497: PARKER | L497: FRANCE | O497: GRAMBEAU
A498: FRANKSTON | C498: GAMBLE | F498: COLE | I498: ROGERSON | L498: VANDERMEER | O498: DUNBAR | R498: BARDOEL
A499: GOALKICKERS
A500: PRAHRAN | C500: FRANCE 8 | F500: McNAMARA 4 | I500: DICKSON 3 | K500: WALLACE 2 | N500: BICKFORD 2
A501: FRANKSTON | C501: COLE 6 | E501: BARDOEL 4 | H501: HUNTER 3 | J501: JONES 2 | L501: VANDERMEER 2 | O501: LOCKWOOD | Q501: FERGUSON | S501: DUNBAR | V501: BOYD
A503: WILLIAMSTOWN | C503: 3 | D503: 6 | E503: 24 | G503: 9 | H503: 12 | I503: 66 | K503: 19 | L503: 16 | M503: 130 | O503: 23 | P503: 20 | Q503: 158 | S503: VENUE: WAVERLEY
A504: WAVERLEY | C504: 5 | D504: 7 | E504: 37 | G504: 6 | H504: 9 | I504: 45 | K504: 7 | L504: 11 | M504: 53 | O504: 9 | P504: 14 | Q504: 68 | S504: STABB :GOLLOP
A505: BEST PLAYERS
A506: WILLIAMSTOWN | C506: BARNETT | F506: SAMPSON | I506: TAYLOR | L506: MATTHEWS | O506: RAUNIK | R506: KERSHAW
A507: WAVERLEY | C507: VEAR | F507: COSGROVE | I507: CLARKE | L507: ALLEN | O507: CSOTI | R507: WENBORNE
A508: GOALKICKERS
A509: WILLIAMSTOWN | C509: FOTHERINGHAM 8 | G509: EUDEY 4 | I509: McCONNON 3 | L509: SLEVISON 2 | O509: MURPHY 2 | Q509: BARNETT | S509: SAMPSON | V509: SAIT
A510: WAVERLEY | C510: CLARKE 2 | E510: DAVIES | G510: BURMEISTER | J510: COSGROVE | M510: GOODMAN | P510: STICKLAND | R510: WARBURTON | V510: CHERNEY
A512: ROUND 10 | D512: 26TH JUNE | I512: WEATHER | S512: VENUE: WILLIAMSTOWN
D513: 1ST QTR | H513: 2ND QTR | L513: 3RD QTR | P513: FINAL | S513: UMPIRES
A514: PORT MELBOURNE | C514: 9 | D514: 5 | E514: 59 | G514: 10 | H514: 7 | I514: 67 | K514: 15 | L514: 12 | M514: 102 | O514: 17 | P514: 15 | Q514: 117 | S514: STEERE | X514: LADDER | AB514: ROUND | AD514: 10
A515: WILLIAMSTOWN | C515: 2 | D515: 3 | E515: 15 | G515: 8 | H515: 7 | I515: 55 | K515: 12 | L515: 9 | M515: 81 | O515: 17 | P515: 10 | Q515: 112 | S515: VERGONA
A516: BEST PLAYERS | W516: TEAM | X516: W | Y516: L | Z516: D | AA516: FOR | AB516: AGST | AC516: % | AD516: PTS
A517: PORT MELBOURNE | C517: COOK | F517: DERMOTT | I517: THOMPSON | L517: KAVANAGH | O517: FEHRING | R517: DAVIES
A518: WILLIAMSTOWN | C518: SAMPSON | F518: SAIT | I518: SWANN | L518: KERSHAW | O518: BARNETT | R518: McCONNON | W518: PORT MELBOURNE | X518: 9 | Y518: 0 | Z518: 1 | AA518: 1393 | AB518: 1057 | AC518: =(AA518/AB518)*100 -> 131.78807947019868 | AD518: =(X518*4)+(Z518*2) -> 38
A519: GOALKICKERS | W519: PRESTON | X519: 8 | Y519: 2 | Z519: 0 | AA519: 1406 | AB519: 940 | AC519: =(AA519/AB519)*100 -> 149.57446808510639 | AD519: =(X519*4)+(Z519*2) -> 32
A520: PORT MELBOURNE | C520: COOK 7 | E520: SWAN 3 | G520: FEHRING 2 | I520: MILDENHALL | L520: WILKINSON | N520: RODDA | P520: EBEYER | R520: KAVANAGH | W520: GEELONG WEST | X520: 7 | Y520: 3 | Z520: 0 | AA520: 1379 | AB520: 943 | AC520: =(AA520/AB520)*100 -> 146.23541887592788 | AD520: =(X520*4)+(Z520*2) -> 28
A521: WILLIAMSTOWN | C521: FOTHERINGHAM 6 | G521: DULLARD 4 | J521: SAIT 3 | L521: SAMPSON 2 | O521: B McTAGGART | R521: MURPHY | W521: FRANKSTON | X521: 6 | Y521: 3 | Z521: 1 | AA521: 1135 | AB521: 1260 | AC521: =(AA521/AB521)*100 -> 90.079365079365076 | AD521: =(X521*4)+(Z521*2) -> 26
S522: VENUE: PRESTON
A523: SANDRINGHAM | C523: 2 | D523: 5 | E523: 17 | G523: 4 | H523: 11 | I523: 35 | K523: 9 | L523: 12 | M523: 66 | O523: 17 | P523: 19 | Q523: 121 | S523: PHILLIPS | W523: SANDRINGHAM | X523: 6 | Y523: 4 | Z523: 0 | AA523: 1198 | AB523: 1115 | AC523: =(AA523/AB523)*100 -> 107.44394618834082 | AD523: =(X523*4)+(Z523*2) -> 24
A524: PRESTON | C524: 4 | D524: 4 | E524: 28 | G524: 7 | H524: 8 | I524: 50 | K524: 10 | L524: 14 | M524: 74 | O524: 12 | P524: 17 | Q524: 89 | S524: STABB | W524: COBURG | X524: 5 | Y524: 4 | Z524: 1 | AA524: 1293 | AB524: 1057 | AC524: =(AA524/AB524)*100 -> 122.32734153263955 | AD524: =(X524*4)+(Z524*2) -> 22
A525: BEST PLAYERS | W525: WERRIBEE | X525: 5 | Y525: 5 | Z525: 0 | AA525: 1105 | AB525: 1276 | AC525: =(AA525/AB525)*100 -> 86.598746081504714 | AD525: =(X525*4)+(Z525*2) -> 20
A526: SANDRINGHAM | C526: SIMS | E526: MANSFIELD | H526: MACLEOD | K526: GALLAGHER | N526: WILKINS | Q526: SARAU | W526: CAMBERWELL | X526: 4 | Y526: 6 | Z526: 0 | AA526: 1147 | AB526: 1292 | AC526: =(AA526/AB526)*100 -> 88.777089783281738 | AD526: =(X526*4)+(Z526*2) -> 16
A527: PRESTON | C527: BRINE | E527: BOLGER | H527: DUNBAR | K527: BUX | N527: PLOWMAN | Q527: WARREN | W527: WILLIAMSTOWN | X527: 3 | Y527: 7 | Z527: 0 | AA527: 1219 | AB527: 1147 | AC527: =(AA527/AB527)*100 -> 106.27724498692241 | AD527: =(X527*4)+(Z527*2) -> 12
A528: GOALKICKERS | Q528: LYONS | W528: DANDENONG | X528: 3 | Y528: 7 | Z528: 0 | AA528: 1090 | AB528: 1114 | AC528: =(AA528/AB528)*100 -> 97.84560143626571 | AD528: =(X528*4)+(Z528*2) -> 12
A529: SANDRINGHAM | C529: BENNETT 6 | E529: MAILING 3 | H529: MACLEOD 2 | K529: GALLAGHER 2 | N529: ADAMS | P529: BARKLY | R529: CHAPMAN | W529: PRAHRAN | X529: 2 | Y529: 7 | Z529: 1 | AA529: 972 | AB529: 1245 | AC529: =(AA529/AB529)*100 -> 78.07228915662651 | AD529: =(X529*4)+(Z529*2) -> 10
A530: PRESTON | C530: BOLGER 2 | E530: BODEN 2 | G530: WARREN | I530: OHLSEN | K530: MOORE | M530: McKEON | O530: DUNBAR | Q530: BEER | R530: MARCON | W530: WAVERLEY | X530: 0 | Y530: 10 | Z530: 0 | AA530: 829 | AB530: 1714 | AC530: =(AA530/AB530)*100 -> 48.366394399066508 | AD530: =(X530*4)+(Z530*2) -> 0
P531: BOURKE
A532: DANDENONG | C532: 7 | D532: 2 | E532: 44 | G532: 9 | H532: 4 | I532: 58 | K532: 10 | L532: 9 | M532: 69 | O532: 12 | P532: 12 | Q532: 84 | S532: VENUE: DANDENONG
A533: COBURG | C533: 4 | D533: 3 | E533: 27 | G533: 4 | H533: 5 | I533: 29 | K533: 7 | L533: 9 | M533: 51 | O533: 8 | P533: 13 | Q533: 61 | S533: GROOM :GOLLOP
A534: BEST PLAYERS
A535: DANDENONG | C535: SHINNERS | F535: P KNIGHT | I535: COVENTRY | L535: DE KONNING | O535: WESTCOTT | R535: WOOD
A536: COBURG | C536: HARBINSON | F536: ALLISON | I536: EADE | L536: HERBERT
A537: GOALKICKERS
A538: DANDENONG | C538: COVENTRY 5 | F538: WRIGHT 3 | I538: WOOD 2 | K538: SHINNERS | M538: WENN
A539: COBURG | C539: HERBERT 3 | F539: J FITZGERALD 2 | I539: SERAFINI 2 | L539: BURT
A541: CAMBERWELL | C541: 4 | D541: 8 | E541: 32 | G541: 11 | H541: 13 | I541: 79 | K541: 18 | L541: 15 | M541: 123 | O541: 24 | P541: 19 | Q541: 163 | S541: VENUE: CAMBERWELL
A542: WAVERLEY | C542: 2 | D542: 0 | E542: 12 | G542: 6 | H542: 0 | I542: 36 | K542: 11 | L542: 0 | M542: 66 | O542: 13 | P542: 2 | Q542: 80 | S542: CASEY :BUDGE
A543: BEST PLAYERS
A544: CAMBERWELL | C544: C ROURKE | F544: BURMEISTER | I544: NEILSON | L544: HICKEY | O544: DAVIDSON
A545: WAVERLEY | C545: JORGENSEN | F545: BURMEISTER | I545: DAVIES | L545: ANGELIS | O545: ALEXANDER | R545: WENBORNE
A546: GOALKICKERS
A547: CAMBERWELL | C547: STEVENSON 6 | F547: B EVANS 6 | I547: WEATHERALD 5 | L547: GASTON 2 | N547: DAVIDSON 2 | Q547: BURMEISTER | T547: COLLINS | W547: S ROURKE
A548: WAVERLEY | C548: ANGELIS 6 | F548: COSGROVE 2 | I548: ALEXANDER | L548: CHERNEY | N548: MULLINS | P548: WARBURTON | S548: WENBORNE
A550: GEELONG WEST | C550: 6 | D550: 5 | E550: 41 | G550: 10 | H550: 10 | I550: 70 | K550: 17 | L550: 15 | M550: 117 | O550: 24 | P550: 18 | Q550: 162 | S550: VENUE: GEELONG WEST
A551: PRAHRAN | C551: 2 | D551: 1 | E551: 13 | G551: 5 | H551: 4 | I551: 34 | K551: 8 | L551: 5 | M551: 53 | O551: 11 | P551: 8 | Q551: 74 | S551: OGSTON :MARCY
A552: BEST PLAYERS
A553: GEELONG WEST | C553: KRANJC | F553: WELSH | I553: DALIHAUS | L553: MURPHY | O553: TORNEY | R553: WATT
A554: PRAHRAN | C554: ELLETT | F554: FOLEY | I554: FRANCE
A555: GOALKICKERS
A556: GEELONG WEST | C556: BROWNE 7 | F556: RADOJEVIC 6 | I556: HIGGINS 3 | K556: WELSH 3 | M556: SELLS | O556: WATT | Q556: TORNEY | S556: EDDY | U556: MURPHY
A557: PRAHRAN | C557: FRANCE 5 | F557: DICKSON | H557: WRIGHT | J557: TAYLOR | L557: BICKFORD | O557: HINE | Q557: PARKER
A559: FRANKSTON | C559: 5 | D559: 1 | E559: 31 | G559: 9 | H559: 3 | I559: 57 | K559: 10 | L559: 8 | M559: 68 | O559: 14 | P559: 14 | Q559: 98 | S559: VENUE: FRANKSTON
A560: WERRIBEE | C560: 4 | D560: 5 | E560: 29 | G560: 7 | H560: 9 | I560: 51 | K560: 9 | L560: 13 | M560: 67 | O560: 11 | P560: 16 | Q560: 82 | S560: OAKLEY :SERONG
A561: BEST PLAYERS
A562: FRANKSTON | C562: ROGERSON | F562: VANDERMEER | I562: BEATON | L562: BOYD | O562: GAMBLE | R562: MACE
A563: WERRIBEE | C563: REDENBACH | F563: MENADUE | I563: DOUGLAS | L563: BREEN | O563: SMITH
A564: GOALKICKERS
A565: FRANKSTON | C565: FERGUSON 3 | F565: HOUSDEN 3 | I565: BOYD 2 | K565: HUNTER 2 | M565: BEATON | O565: HORTON | Q565: ROGERSON | S565: VANDERMEER
A566: WERRIBEE | C566: REDENBACH 2 | F566: LANCASTER 2 | I566: RICHARDSON 2 | L566: SIMMONS 2 | O566: DAY | Q566: BREEN | S566: ALLAN
A568: ROUND 11 | D568: 3RD JULY | I568: WEATHER | S568: VENUE: COBURG
D569: 1ST QTR | H569: 2ND QTR | L569: 3RD QTR | P569: FINAL | S569: UMPIRES
A570: COBURG | C570: 4 | D570: 2 | E570: 26 | G570: 10 | H570: 6 | I570: 66 | K570: 16 | L570: 8 | M570: 104 | O570: 27 | P570: 15 | Q570: 177 | S570: MARCY | X570: LADDER | AB570: ROUND | AD570: 11
A571: FRANKSTON | C571: 3 | D571: 3 | E571: 21 | G571: 5 | H571: 4 | I571: 34 | K571: 7 | L571: 6 | M571: 48 | O571: 9 | P571: 6 | Q571: 60 | S571: PHILLIPS
A572: BEST PLAYERS | W572: TEAM | X572: W | Y572: L | Z572: D | AA572: FOR | AB572: AGST | AC572: % | AD572: PTS
A573: COBURG | C573: A HARBINSON | F573: BURT | I573: CLEARY | L573: LAIDLER | O573: SERAFINI | R573: MILROY
A574: FRANKSTON | C574: BATEMAN | F574: BEATON | I574: MACE | L574: ROGERSON | O574: HAMILL | W574: PORT MELBOURNE | X574: 10 | Y574: 0 | Z574: 1 | AA574: 1514 | AB574: 1177 | AC574: =(AA574/AB574)*100 -> 128.63211554800341 | AD574: =(X574*4)+(Z574*2) -> 42
A575: GOALKICKERS | W575: PRESTON | X575: 9 | Y575: 2 | Z575: 0 | AA575: 1529 | AB575: 975 | AC575: =(AA575/AB575)*100 -> 156.82051282051282 | AD575: =(X575*4)+(Z575*2) -> 36
A576: COBURG | C576: SERAFINI 9 | E576: HERBERT 4 | G576: P BROWN 4 | I576: CLEARY 3 | K576: WEBSTER 3 | M576: COLLINS 2 | O576: DOHNT | Q576: V BROWN | W576: GEELONG WEST | X576: 8 | Y576: 3 | Z576: 0 | AA576: 1477 | AB576: 1007 | AC576: =(AA576/AB576)*100 -> 146.67328699106258 | AD576: =(X576*4)+(Z576*2) -> 32
A577: FRANKSTON | C577: COLE 2 | E577: KENTER 2 | G577: BATEMAN | I577: BEATON | K577: DUNBAR | M577: HOLDEN | O577: SALA | W577: SANDRINGHAM | X577: 7 | Y577: 4 | Z577: 0 | AA577: 1341 | AB577: 1231 | AC577: =(AA577/AB577)*100 -> 108.93582453290007 | AD577: =(X577*4)+(Z577*2) -> 28
S578: VENUE: PORT MELBOURNE
A579: PORT MELBOURNE | C579: 3 | D579: 4 | E579: 22 | G579: 11 | H579: 5 | I579: 71 | K579: 16 | L579: 8 | M579: 104 | O579: 18 | P579: 13 | Q579: 121 | S579: SERONG | W579: COBURG | X579: 6 | Y579: 4 | Z579: 1 | AA579: 1470 | AB579: 1117 | AC579: =(AA579/AB579)*100 -> 131.60250671441361 | AD579: =(X579*4)+(Z579*2) -> 26
A580: CAMBERWELL | C580: 4 | D580: 4 | E580: 28 | G580: 7 | H580: 6 | I580: 48 | K580: 10 | L580: 13 | M580: 73 | O580: 17 | P580: 18 | Q580: 120 | S580: GOLLOP | W580: FRANKSTON | X580: 6 | Y580: 4 | Z580: 1 | AA580: 1195 | AB580: 1437 | AC580: =(AA580/AB580)*100 -> 83.159359777313853 | AD580: =(X580*4)+(Z580*2) -> 26
A581: BEST PLAYERS | W581: WERRIBEE | X581: 5 | Y581: 6 | Z581: 0 | AA581: 1169 | AB581: 1374 | AC581: =(AA581/AB581)*100 -> 85.080058224163025 | AD581: =(X581*4)+(Z581*2) -> 20
A582: PORT MELBOURNE | C582: KAVANAGH | F582: DERMOTT | I582: FEHRING | L582: WILKINSON | O582: DAVIES | W582: CAMBERWELL | X582: 4 | Y582: 7 | Z582: 0 | AA582: 1267 | AB582: 1413 | AC582: =(AA582/AB582)*100 -> 89.667374380750175 | AD582: =(X582*4)+(Z582*2) -> 16
A583: CAMBERWELL | C583: BURMEISTER | F583: WILKINSON | I583: HICKEY | L583: C ROURKE | O583: EVANS | W583: PRAHRAN | X583: 3 | Y583: 7 | Z583: 1 | AA583: 1079 | AB583: 1336 | AC583: =(AA583/AB583)*100 -> 80.763473053892227 | AD583: =(X583*4)+(Z583*2) -> 14
A584: GOALKICKERS | W584: WILLIAMSTOWN | X584: 3 | Y584: 8 | Z584: 0 | AA584: 1310 | AB584: 1254 | AC584: =(AA584/AB584)*100 -> 104.46570972886762 | AD584: =(X584*4)+(Z584*2) -> 12
A585: PORT MELBOURNE | C585: ANDERSON 4 | F585: EBEYER 4 | H585: PERKINS 3 | J585: COOK 3 | L585: KAVANAGH 2 | O585: FEHRING 2 | W585: DANDENONG | X585: 3 | Y585: 8 | Z585: 0 | AA585: 1206 | AB585: 1257 | AC585: =(AA585/AB585)*100 -> 95.942720763723159 | AD585: =(X585*4)+(Z585*2) -> 12
A586: CAMBERWELL | C586: STEVENSON 4 | F586: GASTON 4 | I586: WEATHERALD 3 | L586: DAVIDSON 2 | O586: C ROURKE 2 | R586: McCORMACK | W586: WAVERLEY | X586: 0 | Y586: 11 | Z586: 0 | AA586: 864 | AB586: 1837 | AC586: =(AA586/AB586)*100 -> 47.033206314643436 | AD586: =(X586*4)+(Z586*2) -> 0
O587: COLLINS
A588: GEELONG WEST | C588: 8 | D588: 3 | E588: 51 | G588: 11 | H588: 8 | I588: 74 | K588: 11 | L588: 11 | M588: 77 | O588: 14 | P588: 14 | Q588: 98 | S588: VENUE: WERRIBEE
A589: WERRIBEE | C589: 0 | D589: 3 | E589: 3 | G589: 5 | H589: 9 | I589: 39 | K589: 8 | L589: 10 | M589: 58 | O589: 8 | P589: 16 | Q589: 64 | S589: CASEY :FITZPATRICK
A590: BEST PLAYERS
A591: GEELONG WEST | C591: EVANS | F591: WATT | I591: HIGGINS | L591: BEATON | O591: TORNEY | R591: DALIHAUS
A592: WERRIBEE | C592: SCANLON | F592: CONN | I592: DOUGLAS | L592: R SMITH | O592: SIMMONS | R592: RICHARDSON
A593: GOALKICKERS
A594: GEELONG WEST | C594: EDDY 3 | E594: WELSH 2 | G594: MURPHY 2 | I594: SMITH 2 | K594: HIGGINS | M594: GIESON | O594: SELLS | Q594: McFADDEN | T594: RADOJEVIC
A595: WERRIBEE | C595: DAY 4 | E595: RICARDSON 2 | H595: KING | J595: BREEN
A597: PRESTON | C597: 7 | D597: 7 | E597: 49 | G597: 8 | H597: 14 | I597: 62 | K597: 12 | L597: 23 | M597: 95 | O597: 15 | P597: 33 | Q597: 123 | S597: VENUE: WAVERLEY
A598: WAVERLEY | C598: 0 | D598: 1 | E598: 1 | G598: 2 | H598: 3 | I598: 15 | K598: 5 | L598: 3 | M598: 33 | O598: 5 | P598: 5 | Q598: 35 | S598: OGSTON ;STEERE
A599: BEST PLAYERS
A600: PRESTON | C600: McEWAN | F600: DUNBAR | I600: BERRY | L600: BOLGER | O600: BRINE | Q600: PLOWMAN
A601: WAVERLEY | C601: JORGENSEN | F601: ALEXANDER | I601: WILLIAMS | L601: DAVIES | O601: CSOTI
A602: GOALKICKERS
A603: PRESTON | C603: BODEN 4 | F603: OHLSEN 3 | I603: VEAR 3 | K603: BOURKE 3 | N603: BERRY 2
A604: WAVERLEY | C604: ANGELIS | F604: ELLIN | H604: GOODMAN | K604: PRITCHARD | N604: WARBURTON
A606: PRAHRAN | C606: 4 | D606: 4 | E606: 28 | G606: 11 | H606: 7 | I606: 73 | K606: 13 | L606: 9 | M606: 87 | O606: 15 | P606: 17 | Q606: 107 | S606: VENUE: TOORAK PARK
A607: WILLIAMSTOWN | C607: 5 | D607: 6 | E607: 36 | G607: 8 | H607: 9 | I607: 57 | K607: 10 | L607: 12 | M607: 72 | O607: 13 | P607: 13 | Q607: 91 | S607: ALLSOPP :RYAN
A608: BEST PLAYERS
A609: PRAHRAN | C609: TEAM EFFORT
A610: WILLIAMSTOWN | C610: DULLARD | F610: MATTHEWS | I610: BOTTAMS | L610: SWANN | O610: SAIT | Q610: RAUNIK
A611: GOALKICKERS
A612: PRAHRAN | C612: McDONALD 5 | F612: McNAMARA 3 | I612: TAYLOR 3 | K612: SOULOS 2 | N612: PARKER 2
A613: WILLIAMSTOWN | C613: FOTHERINGHAM 5 | G613: DULLARD 4 | J613: SAIT 2 | L613: TURLEY | N613: TOWNS
A615: SANDRINGHAM | C615: 7 | D615: 6 | E615: 48 | G615: 10 | H615: 11 | I615: 71 | K615: 15 | L615: 15 | M615: 105 | O615: 21 | P615: 17 | Q615: 143 | S615: VENUE: BEACH ROAD
A616: DANDENONG | C616: 3 | D616: 5 | E616: 23 | G616: 6 | H616: 13 | I616: 49 | K616: 9 | L616: 15 | M616: 69 | O616: 16 | P616: 20 | Q616: 116 | S616: BUDGE :OAKLEY
A617: BEST PLAYERS
A618: SANDRINGHAM | C618: MACLEOD | F618: RICHARDS | I618: CHAPMAN | L618: ADAMS | N618: BARCLAY | Q618: SIMS
A619: DANDENONG | C619: LACEY | F619: D MILLANE | I619: SHINNERS | L619: WENN | N619: J MILLANE | Q619: ORSBORNE
A620: GOALKICKERS
A621: SANDRINGHAM | C621: BENNETT 6 | F621: MAILING 4 | I621: MACLEOD 3 | L621: BARCLAY 3 | O621: GALLAGHER | R621: MANSFIELD | U621: LYONS | W621: SIMS | X621: CHAPMAN
A622: DANDENONG | C622: WRIGHT 4 | F622: J MILLANE 3 | I622: WENN 2 | K622: D MILLANE 2 | N622: RHODE | P622: SHINNERS | R622: TREMBATH | V622: DE KONNING | X622: ORSBORNE
A624: ROUND 12 | D624: 10TH JULY | I624: WEATHER | S624: VENUE: TOORAK PARK
D625: 1ST QTR | H625: 2ND QTR | L625: 3RD QTR | P625: FINAL | S625: UMPIRES
A626: PRAHRAN | C626: 1 | D626: 2 | E626: 8 | G626: 8 | H626: 7 | I626: 55 | K626: 12 | L626: 11 | M626: 83 | O626: 15 | P626: 21 | Q626: 111 | S626: VERGONA | X626: LADDER | AB626: ROUND | AD626: 12
A627: CAMBERWELL | C627: 5 | D627: 6 | E627: 36 | G627: 8 | H627: 7 | I627: 55 | K627: 13 | L627: 10 | M627: 88 | O627: 15 | P627: 10 | Q627: 100 | S627: STEERE
A628: BEST PLAYERS | W628: TEAM | X628: W | Y628: L | Z628: D | AA628: FOR | AB628: AGST | AC628: % | AD628: PTS
A629: PRAHRAN | C629: HINE | E629: ELLETT | H629: FOLEY | K629: PARKER | N629: P McDONALD | Q629: BICKFORD
A630: CAMBERWELL | C630: DANS | E630: GASTON | H630: WILKINSON | W630: PORT MELBOURNE | X630: 10 | Y630: 1 | Z630: 1 | AA630: 1592 | AB630: 1289 | AC630: =(AA630/AB630)*100 -> 123.50659425911559 | AD630: =(X630*4)+(Z630*2) -> 42
A631: GOALKICKERS | W631: PRESTON | X631: 10 | Y631: 2 | Z631: 0 | AA631: 1641 | AB631: 1053 | AC631: =(AA631/AB631)*100 -> 155.84045584045586 | AD631: =(X631*4)+(Z631*2) -> 40
A632: PRAHRAN | C632: FRANCE 5 | F632: TAYLOR 3 | I632: McNAMARA 3 | L632: HINE 2 | N632: P McDONALD | Q632: McKISSOCK | W632: GEELONG WEST | X632: 9 | Y632: 3 | Z632: 0 | AA632: 1604 | AB632: 1132 | AC632: =(AA632/AB632)*100 -> 141.69611307420496 | AD632: =(X632*4)+(Z632*2) -> 36
A633: CAMBERWELL | C633: GASTON 4 | F633: WEATHERALD 3 | I633: McCORMACK 3 | L633: STEVENSON 2 | O633: DAVIDSON | Q633: C ROURKE | W633: COBURG | X633: 7 | Y633: 4 | Z633: 1 | AA633: 1543 | AB633: 1183 | AC633: =(AA633/AB633)*100 -> 130.43110735418429 | AD633: =(X633*4)+(Z633*2) -> 30
N634: COLLINS | S634: VENUE: PORT MELBOURNE
A635: PRESTON | C635: 3 | D635: 2 | E635: 20 | G635: 7 | H635: 6 | I635: 48 | K635: 10 | L635: 10 | M635: 70 | O635: 16 | P635: 16 | Q635: 112 | S635: OAKLEY | W635: SANDRINGHAM | X635: 7 | Y635: 5 | Z635: 0 | AA635: 1407 | AB635: 1304 | AC635: =(AA635/AB635)*100 -> 107.89877300613497 | AD635: =(X635*4)+(Z635*2) -> 28
A636: PORT MELBOURNE | C636: 4 | D636: 3 | E636: 27 | G636: 4 | H636: 5 | I636: 29 | K636: 10 | L636: 6 | M636: 66 | O636: 12 | P636: 6 | Q636: 78 | S636: GROOM | W636: FRANKSTON | X636: 6 | Y636: 5 | Z636: 1 | AA636: 1320 | AB636: 1564 | AC636: =(AA636/AB636)*100 -> 84.398976982097182 | AD636: =(X636*4)+(Z636*2) -> 26
A637: BEST PLAYERS | W637: WERRIBEE | X637: 6 | Y637: 6 | Z637: 0 | AA637: 1324 | AB637: 1466 | AC637: =(AA637/AB637)*100 -> 90.313778990450203 | AD637: =(X637*4)+(Z637*2) -> 24
A638: PRESTON | C638: AUSTEN | F638: BODEN | I638: SHAW | L638: McKEON | O638: DUNBAR | R638: BOURKE | W638: PRAHRAN | X638: 4 | Y638: 7 | Z638: 1 | AA638: 1190 | AB638: 1436 | AC638: =(AA638/AB638)*100 -> 82.869080779944298 | AD638: =(X638*4)+(Z638*2) -> 18
A639: PORT MELBOURNE | C639: DERMOTT | F639: WILKINSON | I639: THOMPSON | L639: SWAN | O639: CHADBAND | W639: DANDENONG | X639: 4 | Y639: 8 | Z639: 0 | AA639: 1342 | AB639: 1313 | AC639: =(AA639/AB639)*100 -> 102.2086824067022 | AD639: =(X639*4)+(Z639*2) -> 16
A640: GOALKICKERS | W640: CAMBERWELL | X640: 4 | Y640: 8 | Z640: 0 | AA640: 1367 | AB640: 1524 | AC640: =(AA640/AB640)*100 -> 89.69816272965879 | AD640: =(X640*4)+(Z640*2) -> 16
A641: PRESTON | C641: MCEWAN 3 | E641: BOURKE 3 | G641: VEAL 3 | I641: BODEN 3 | K641: OHLSEN | M641: DUNBAR | O641: AUSTEN | Q641: BERRY | W641: WILLIAMSTOWN | X641: 3 | Y641: 9 | Z641: 0 | AA641: 1402 | AB641: 1409 | AC641: =(AA641/AB641)*100 -> 99.50319375443577 | AD641: =(X641*4)+(Z641*2) -> 12
A642: PORT MELBOURNE | C642: COOK 2 | E642: FEHRING 2 | G642: EBEYER 2 | I642: PERKINS | K642: SWAN | M642: WILKINSON | P642: KAVANAGH | S642: C DOYLE | W642: WAVERLEY | X642: 0 | Y642: 12 | Z642: 0 | AA642: 920 | AB642: 1973 | AC642: =(AA642/AB642)*100 -> 46.629498226051695 | AD642: =(X642*4)+(Z642*2) -> 0
Q643: ANDERSON
A644: GEELONG WEST | C644: 8 | D644: 2 | E644: 50 | G644: 11 | H644: 8 | I644: 74 | K644: 16 | L644: 11 | M644: 107 | O644: 19 | P644: 13 | Q644: 127 | S644: VENUE: FRANKSTON
A645: FRANKSTON | C645: 3 | D645: 4 | E645: 22 | G645: 11 | H645: 10 | I645: 76 | K645: 12 | L645: 11 | M645: 83 | O645: 18 | P645: 17 | Q645: 125 | S645: BUDGE :TORNEY
A646: BEST PLAYERS
A647: GEELONG WEST | C647: DALIHAUS | F647: SMITH | I647: TORNEY | L647: WATT | O647: EDDY | R647: WALSH
A648: FRANKSTON | C648: BARDOEL | F648: BEATON | I648: HORLER | L648: WORTHINGTON | O648: ROGERSON | R648: BATEMAN
A649: GOALKICKERS
A650: GEELONG WEST | C650: SELLS 6 | E650: WELSH 5 | G650: EDDY 4 | I650: MCCANCE | K650: WATT | M650: JOHNSTON | O650: DALIHAUS
A651: FRANKSTON | C651: BARDOEL 4 | F651: SALA 3 | H651: LYNN 3 | J651: BATEMAN 2 | M651: BEATON 2 | O651: O'BRIEN 2 | Q651: CZARNECKI | T651: HAMILL
A653: WERRIBEE | C653: 5 | D653: 2 | E653: 32 | G653: 10 | H653: 5 | I653: 65 | K653: 18 | L653: 8 | M653: 116 | O653: 24 | P653: 11 | Q653: 155 | S653: VENUE: WERRIBEE
A654: WILLIAMSTOWN | C654: 3 | D654: 1 | E654: 19 | G654: 8 | H654: 3 | I654: 51 | K654: 10 | L654: 4 | M654: 64 | O654: 14 | P654: 8 | Q654: 92 | S654: MARCY :STABB
A655: BEST PLAYERS
A656: WERRIBEE | C656: PARKES | F656: MEMBREY | I656: BREEN | L656: WISE | N656: ALLAN | Q656: REDENBACH
A657: WILLIAMSTOWN | C657: KERSHAW | F657: SWANN | I657: SAIT
A658: GOALKICKERS
A659: WERRIBEE | C659: DAY 6 | E659: BREEN 5 | G659: ALLAN 4 | I659: REDENBACH 4 | L659: SIMMONS 3 | N659: RICHARDSON | Q659: GORDON
A660: WILLIAMSTOWN | C660: FOTHERINGHAM 5 | G660: DYER 3 | I660: MURPHY 2 | K660: SAIT 2 | M660: McTAGGART | P660: TAYLOR
A662: COBURG | C662: 4 | D662: 8 | E662: 32 | G662: 4 | H662: 9 | I662: 33 | K662: 8 | L662: 15 | M662: 63 | O662: 9 | P662: 19 | Q662: 73 | S662: VENUE: COBURG
A663: SANDRINGHAM | C663: 1 | D663: 0 | E663: 6 | G663: 6 | H663: 8 | I663: 44 | K663: 7 | L663: 8 | M663: 50 | O663: 9 | P663: 12 | Q663: 66 | S663: OGSTON :RYAN
A664: BEST PLAYERS
A665: COBURG | C665: FREEMAN | F665: MILROY | I665: DOHNT | L665: EADE | O665: LAIDLER | R665: CLEARY
A666: SANDRINGHAM | C666: LYONS | F666: HAYES | I666: MACLEOD | L666: SARAU | O666: RICHARDS | R666: SIMS
A667: GOALKICKERS
A668: COBURG | C668: FREEMAN 3 | F668: CLEARY 2 | I668: SERAFINI | K668: P BROWN | M668: ZANON | O668: HERBERT
A669: SANDRINGHAM | C669: BENNETT 4 | F669: MACLEOD 3 | I669: LYONS | K669: MANSFIELD
A671: DANDENONG | C671: 0 | D671: 1 | E671: 1 | G671: 5 | H671: 3 | I671: 33 | K671: 17 | L671: 5 | M671: 107 | O671: 21 | P671: 10 | Q671: 136 | S671: VENUE: WAVERLEY
A672: WAVERLEY | C672: 6 | D672: 4 | E672: 40 | G672: 6 | H672: 4 | I672: 40 | K672: 7 | L672: 7 | M672: 49 | O672: 8 | P672: 8 | Q672: 56 | S672: FITZPATRICK :SERONG
A673: BEST PLAYERS
A674: DANDENONG | C674: SHINNERS | F674: FINN | I674: ORSBORNE | L674: DE KONNING | O674: LACEY | Q674: J MILLANE
A675: WAVERLEY | C675: WILLIAMS | F675: ALEXANDER | I675: WENBORNE | L675: KING | O675: COSGROVE
A676: GOALKICKERS | U676: WRIGHT
A677: DANDENONG | C677: ORSBORNE 5 | F677: LACEY 3 | H677: WOOD 2 | J677: D MILLANE 2 | M677: CASHMAN 2 | P677: J MILLANE | R677: KAYE | T677: POWELL | W677: SHINNERS | Y677: WESTCOTT | AB677: KNIGHT
A678: WAVERLEY | C678: WENBORNE 3 | F678: ANGELIS 2 | I678: NEWBOULD 2 | L678: COSGROVE
A680: ROUND 13 | D680: 17TH JULY | I680: WEATHER | S680: VENUE: DANDENONG
D681: 1ST QTR | H681: 2ND QTR | L681: 3RD QTR | P681: FINAL | S681: UMPIRES
A682: DANDENONG | C682: 2 | D682: 3 | E682: 15 | G682: 9 | H682: 7 | I682: 61 | K682: 15 | L682: 12 | M682: 102 | O682: 20 | P682: 18 | Q682: 138 | S682: CASEY | X682: LADDER | AB682: ROUND | AD682: 13
A683: PORT MELBOURNE | C683: 7 | D683: 4 | E683: 46 | G683: 10 | H683: 8 | I683: 68 | K683: 14 | L683: 14 | M683: 98 | O683: 15 | P683: 15 | Q683: 105 | S683: G RYAN
A684: BEST PLAYERS | W684: TEAM | X684: W | Y684: L | Z684: D | AA684: FOR | AB684: AGST | AC684: % | AD684: PTS
A685: DANDENONG | C685: J MILLANE | F685: ORTON | I685: SHINNERS | L685: DE KONNING | O685: WRIGHT | R685: ORSBORNE
A686: PORT MELBOURNE | C686: ROBERTSON | F686: MILDENHALL | I686: CHADBAND | L686: SWAN | W686: PRESTON | X686: 11 | Y686: 2 | Z686: 0 | AA686: 1831 | AB686: 1125 | AC686: =(AA686/AB686)*100 -> 162.75555555555556 | AD686: =(X686*4)+(Z686*2) -> 44
A687: GOALKICKERS | N687: SHINNERS | Q687: TREMBATH | W687: PORT MELBOURNE | X687: 10 | Y687: 2 | Z687: 1 | AA687: 1697 | AB687: 1427 | AC687: =(AA687/AB687)*100 -> 118.9208128941836 | AD687: =(X687*4)+(Z687*2) -> 42
A688: DANDENONG | C688: WOOD 4 | E688: WRIGHT 3 | G688: COVENTRY 3 | J688: LACEY 2 | L688: D MILLANE 2 | O688: ORSBORNE 2 | R688: DE KONNING 2 | W688: GEELONG WEST | X688: 10 | Y688: 3 | Z688: 0 | AA688: 1703 | AB688: 1217 | AC688: =(AA688/AB688)*100 -> 139.93426458504518 | AD688: =(X688*4)+(Z688*2) -> 40
A689: PORT MELBOURNE | C689: ANDERSON 4 | F689: EASTON 3 | I689: COOK 3 | K689: WILKINSON 2 | N689: KAVANAGH | Q689: SWAN | S689: EVANS | W689: SANDRINGHAM | X689: 8 | Y689: 5 | Z689: 0 | AA689: 1628 | AB689: 1398 | AC689: =(AA689/AB689)*100 -> 116.45207439198855 | AD689: =(X689*4)+(Z689*2) -> 32
S690: VENUE: CAMBERWELL
A691: WERRIBEE | C691: 5 | D691: 8 | E691: 38 | G691: 10 | H691: 11 | I691: 71 | K691: 15 | L691: 15 | M691: 105 | O691: 21 | P691: 17 | Q691: 143 | S691: GROOM | W691: COBURG | X691: 7 | Y691: 5 | Z691: 1 | AA691: 1628 | AB691: 1282 | AC691: =(AA691/AB691)*100 -> 126.98907956318253 | AD691: =(X691*4)+(Z691*2) -> 30
A692: CAMBERWELL | C692: 2 | D692: 0 | E692: 12 | G692: 8 | H692: 2 | I692: 50 | K692: 13 | L692: 5 | M692: 83 | O692: 20 | P692: 10 | Q692: 130 | S692: PHILLIPS | W692: FRANKSTON | X692: 7 | Y692: 5 | Z692: 1 | AA692: 1433 | AB692: 1656 | AC692: =(AA692/AB692)*100 -> 86.533816425120762 | AD692: =(X692*4)+(Z692*2) -> 30
A693: BEST PLAYERS | W693: WERRIBEE | X693: 7 | Y693: 6 | Z693: 0 | AA693: 1467 | AB693: 1596 | AC693: =(AA693/AB693)*100 -> 91.917293233082702 | AD693: =(X693*4)+(Z693*2) -> 28
A694: WERRIBEE | C694: MEMBREY | F694: PARKES | I694: REDENBACH | L694: SCANLON | O694: MENADUE | R694: GORDON | W694: DANDENONG | X694: 5 | Y694: 8 | Z694: 0 | AA694: 1480 | AB694: 1418 | AC694: =(AA694/AB694)*100 -> 104.37235543018335 | AD694: =(X694*4)+(Z694*2) -> 20
A695: CAMBERWELL | C695: WILKINSON | F695: BURMEISTER | I695: PEVITT | L695: C ROURKE | W695: PRAHRAN | X695: 4 | Y695: 8 | Z695: 1 | AA695: 1262 | AB695: 1626 | AC695: =(AA695/AB695)*100 -> 77.613776137761377 | AD695: =(X695*4)+(Z695*2) -> 18
A696: GOALKICKERS | N696: MARSDEN | Q696: DAY | W696: CAMBERWELL | X696: 4 | Y696: 9 | Z696: 0 | AA696: 1497 | AB696: 1667 | AC696: =(AA696/AB696)*100 -> 89.802039592081584 | AD696: =(X696*4)+(Z696*2) -> 16
A697: WERRIBEE | C697: REDENBACH 5 | F697: SIMMONS 4 | I697: GORDON 4 | K697: RICHARDSON 3 | N697: PARKES | P697: ALLAN | R697: BREEN | W697: WILLIAMSTOWN | X697: 3 | Y697: 10 | Z697: 0 | AA697: 1494 | AB697: 1522 | AC697: =(AA697/AB697)*100 -> 98.160315374507221 | AD697: =(X697*4)+(Z697*2) -> 12
A698: CAMBERWELL | C698: STEVENSON 5 | F698: WEATHERALD 4 | I698: COLLINS 3 | K698: GASTON 2 | M698: BURMEISTER 2 | P698: DAVIDSON 2 | S698: EVANS | W698: WAVERLEY | X698: 0 | Y698: 13 | Z698: 0 | AA698: 1014 | AB698: 2194 | AC698: =(AA698/AB698)*100 -> 46.216955332725618 | AD698: =(X698*4)+(Z698*2) -> 0
R699: BANKS
A700: FRANKSTON | C700: 4 | D700: 5 | E700: 29 | G700: 7 | H700: 7 | I700: 49 | K700: 12 | L700: 8 | M700: 80 | O700: 17 | P700: 11 | Q700: 113 | S700: VENUE: WILLIAMSTOWN
A701: WILLIAMSTOWN | C701: 2 | D701: 2 | E701: 14 | G701: 7 | H701: 7 | I701: 49 | K701: 9 | L701: 10 | M701: 64 | O701: 13 | P701: 14 | Q701: 92 | S701: MAY :OGSTON
A702: BEST PLAYERS
A703: FRANKSTON | C703: BEATON | F703: KENTER | I703: ROGERSON | L703: WORTHINGTON | O703: DUNBAR | R703: CASEY
A704: WILLIAMSTOWN | C704: B McTAGGART | F704: HUGHES | I704: SWANN | L704: McCONNON | O704: SAIT
A705: GOALKICKERS
A706: FRANKSTON | C706: KENTER 4 | E706: DUNBAR 3 | G706: BEATON 2 | I706: LYNN 2 | K706: BARDOEL | M706: BATEMAN | O706: VANDERMEER | R706: HAMILL | U706: CZARNECKI | X706: O'BRIEN
A707: WILLIAMSTOWN | C707: FOTHERINGHAM 5 | G707: SAIT 4 | I707: MURPHY 2 | K707: HUGHES | M707: TAYLOR
A709: SANDRINGHAM | C709: 4 | D709: 6 | E709: 30 | G709: 16 | H709: 10 | I709: 106 | K709: 20 | L709: 18 | M709: 138 | O709: 33 | P709: 23 | Q709: 221 | S709: VENUE: BEACH ROAD
A710: WAVERLEY | C710: 4 | D710: 4 | E710: 28 | G710: 6 | H710: 8 | I710: 44 | K710: 11 | L710: 8 | M710: 74 | O710: 14 | P710: 10 | Q710: 94 | S710: VERGONA :ALLSOPP
A711: BEST PLAYERS
A712: SANDRINGHAM | C712: MORRISON | F712: WILKINS | I712: MERCER | L712: BENNETT | O712: SCOTT | Q712: MANNIX
A713: WAVERLEY | C713: VEAR | F713: WILLIAMS | I713: ANGELIS | L713: WARBURTON | O713: CSOTI | Q713: GREEN
A714: GOALKICKERS
A715: SANDRINGHAM | C715: MORRISON 13 | F715: MAILING 6 | I715: BENNETT 5 | K715: LYONS 3 | M715: MANNIX 2 | O715: MANSFIELD 2 | R715: HAYES | T715: PLEDGER
A716: WAVERLEY | C716: ANGELIS 6 | F716: WARBURTON 4 | I716: WILLIAMS | K716: TAYLOR | M716: JORGENSEN | P716: CSOTI
A718: PRESTON | C718: 5 | D718: 2 | E718: 32 | G718: 11 | H718: 11 | I718: 77 | K718: 16 | L718: 15 | M718: 111 | O718: 28 | P718: 22 | Q718: 190 | S718: VENUE: PRESTON
A719: PRAHRAN | C719: 1 | D719: 6 | E719: 12 | G719: 6 | H719: 7 | I719: 43 | K719: 8 | L719: 10 | M719: 58 | O719: 10 | P719: 12 | Q719: 72 | S719: TORNEY :GOLLOP
A720: BEST PLAYERS
A721: PRESTON | C721: BRINE | F721: McEWAN | I721: BOLGER | L721: OSBORNE | O721: TOWAN | Q721: BUX
A722: PRAHRAN | C722: FOLEY | F722: GRAMBEAU | I722: TAYLOR | L722: ELLETT | O722: REED
A723: GOALKICKERS
A724: PRESTON | C724: BERRY 5 | E724: OSBORNE 5 | H724: FROST 3 | J724: BOURKE 3 | L724: VEAL 2 | N724: BOLGER 2 | P724: DUNBAR 2 | R724: SHAW 2 | U724: BODEN 2 | W724: McEWAN | Y724: TOWAN
A725: PRAHRAN | C725: SOULOS 4 | F725: McNAMARA 3 | I725: P McDONALD | L725: HART | N725: YOUNG
A727: GEELONG WEST | C727: 4 | D727: 9 | E727: 33 | G727: 6 | H727: 14 | I727: 50 | K727: 9 | L727: 15 | M727: 69 | O727: 14 | P727: 15 | Q727: 99 | S727: VENUE: GEELONG WEST
A728: COBURG | C728: 3 | D728: 2 | E728: 20 | G728: 6 | H728: 4 | I728: 40 | K728: 10 | L728: 10 | M728: 70 | O728: 12 | P728: 13 | Q728: 85 | S728: STABB :STEERE
A729: BEST PLAYERS
A730: GEELONG WEST | C730: HIGGINS | F730: GIBSON | I730: TORNEY | L730: McFADDEN | O730: EDDY | Q730: KRANJC
A731: COBURG | C731: DOHNT | F731: DALGLEISH | I731: FREEMAN | L731: EADE
A732: GOALKICKERS
A733: GEELONG WEST | C733: TOULMIN 4 | F733: WELSH 3 | H733: GIBSON 2 | J733: HIGGINS 2 | L733: ROBINSON | N733: NIVEN | P733: SELLS
A734: COBURG | C734: P BROWN 3 | F734: FREEMAN 3 | I734: PENNINGTON 2 | L734: DOHNT | N734: MILROY | P734: HARBINSON | S734: BROWN
A736: ROUND 14 | D736: 24TH JULY | I736: WEATHER | S736: VENUE: WERRIBEE
D737: 1ST QTR | H737: 2ND QTR | L737: 3RD QTR | P737: FINAL | S737: UMPIRES
A738: PRESTON | C738: 3 | D738: 4 | E738: 22 | G738: 11 | H738: 13 | I738: 79 | K738: 15 | L738: 15 | M738: 105 | O738: 20 | P738: 18 | Q738: 138 | S738: ALLSOPP | X738: LADDER | AB738: ROUND | AD738: 14
A739: WERRIBEE | C739: 3 | D739: 3 | E739: 21 | G739: 5 | H739: 6 | I739: 36 | K739: 7 | L739: 7 | M739: 49 | O739: 8 | P739: 8 | Q739: 56 | S739: VERGONA
A740: BEST PLAYERS | W740: TEAM | X740: W | Y740: L | Z740: D | AA740: FOR | AB740: AGST | AC740: % | AD740: PTS
A741: PRESTON | C741: BRINE | F741: AUSTEN | I741: McEWAN | L741: BUX | N741: VEAL | Q741: MCKEON
A742: WERRIBEE | C742: PARKES | F742: GORDON | I742: MEMBREY | L742: ALLAN | N742: FREEMAN | W742: PRESTON | X742: 12 | Y742: 2 | Z742: 0 | AA742: 1969 | AB742: 1181 | AC742: =(AA742/AB742)*100 -> 166.72311600338696 | AD742: =(X742*4)+(Z742*2) -> 48
A743: GOALKICKERS | P743: AUSTEN | W743: GEELONG WEST | X743: 11 | Y743: 3 | Z743: 0 | AA743: 1807 | AB743: 1304 | AC743: =(AA743/AB743)*100 -> 138.57361963190183 | AD743: =(X743*4)+(Z743*2) -> 44
A744: PRESTON | C744: VEAL 5 | E744: BOURKE 4 | G744: OHLSEN 2 | I744: BOLGER 2 | K744: McEWAN 2 | M744: BODEN | O744: BRINE | Q744: McKEON | S744: SHAW | W744: PORT MELBOURNE | X744: 10 | Y744: 3 | Z744: 1 | AA744: 1805 | AB744: 1595 | AC744: =(AA744/AB744)*100 -> 113.16614420062696 | AD744: =(X744*4)+(Z744*2) -> 42
A745: WERRIBEE | C745: GORDON 4 | F745: SIMMONS | I745: PARKES | K745: GREEN | M745: DAY | W745: SANDRINGHAM | X745: 9 | Y745: 5 | Z745: 0 | AA745: 1796 | AB745: 1506 | AC745: =(AA745/AB745)*100 -> 119.25630810092962 | AD745: =(X745*4)+(Z745*2) -> 36
S746: VENUE: FRANKSTON
A747: FRANKSTON | C747: 1 | D747: 3 | E747: 9 | G747: 5 | H747: 6 | I747: 36 | K747: 10 | L747: 11 | M747: 71 | O747: 13 | P747: 17 | Q747: 95 | S747: CASEY | W747: COBURG | X747: 8 | Y747: 5 | Z747: 1 | AA747: 1877 | AB747: 1327 | AC747: =(AA747/AB747)*100 -> 141.44687264506405 | AD747: =(X747*4)+(Z747*2) -> 34
A748: CAMBERWELL | C748: 4 | D748: 3 | E748: 27 | G748: 5 | H748: 5 | I748: 35 | K748: 10 | L748: 8 | M748: 68 | O748: 13 | P748: 9 | Q748: 87 | S748: FITZPATRICK | W748: FRANKSTON | X748: 8 | Y748: 5 | Z748: 1 | AA748: 1528 | AB748: 1743 | AC748: =(AA748/AB748)*100 -> 87.664945496270803 | AD748: =(X748*4)+(Z748*2) -> 34
A749: BEST PLAYERS | W749: WERRIBEE | X749: 7 | Y749: 7 | Z749: 0 | AA749: 1523 | AB749: 1734 | AC749: =(AA749/AB749)*100 -> 87.831603229527104 | AD749: =(X749*4)+(Z749*2) -> 28
A750: FRANKSTON | C750: ROGERSON | F750: VANDERMEER | I750: BEATON | L750: GEDDES | N750: GAMBLE | Q750: DUNBAR | W750: PRAHRAN | X750: 5 | Y750: 8 | Z750: 1 | AA750: 1377 | AB750: 1714 | AC750: =(AA750/AB750)*100 -> 80.338389731621945 | AD750: =(X750*4)+(Z750*2) -> 22
A751: CAMBERWELL | C751: BURMEISTER | F751: PEVITT | I751: DANS | L751: ROURKE | N751: HICKEY | Q751: McFEE | W751: DANDENONG | X751: 5 | Y751: 9 | Z751: 0 | AA751: 1568 | AB751: 1543 | AC751: =(AA751/AB751)*100 -> 101.62022034996761 | AD751: =(X751*4)+(Z751*2) -> 20
A752: GOALKICKERS | W752: CAMBERWELL | X752: 4 | Y752: 10 | Z752: 0 | AA752: 1584 | AB752: 1762 | AC752: =(AA752/AB752)*100 -> 89.897843359818381 | AD752: =(X752*4)+(Z752*2) -> 16
A753: FRANKSTON | C753: BARDOEL 3 | F753: DUNBAR 3 | I753: GEDDES 2 | L753: O'BRIEN 2 | O753: KENTER 2 | Q753: BATEMAN | W753: WILLIAMSTOWN | X753: 3 | Y753: 11 | Z753: 0 | AA753: 1581 | AB753: 1626 | AC753: =(AA753/AB753)*100 -> 97.232472324723247 | AD753: =(X753*4)+(Z753*2) -> 12
A754: CAMBERWELL | C754: GASTON 5 | F754: STEVENSON 4 | I754: COLLINS | K754: ROURKE | M754: BURMEISTER | P754: CAHILL | W754: WAVERLEY | X754: 0 | Y754: 14 | Z754: 0 | AA754: 1059 | AB754: 2443 | AC754: =(AA754/AB754)*100 -> 43.348342202210397 | AD754: =(X754*4)+(Z754*2) -> 0
A756: SANDRINGHAM | C756: 5 | D756: 4 | E756: 34 | G756: 9 | H756: 7 | I756: 61 | K756: 18 | L756: 15 | M756: 123 | O756: 25 | P756: 18 | Q756: 168 | S756: VENUE: PORT MELBOURNE
A757: PORT MELBOURNE | C757: 2 | D757: 4 | E757: 16 | G757: 5 | H757: 8 | I757: 38 | K757: 8 | L757: 9 | M757: 57 | O757: 16 | P757: 12 | Q757: 108 | S757: STABB :MARCY
A758: BEST PLAYERS
A759: SANDRINGHAM | C759: MANSFIELD | F759: MANNIX | I759: MACLEOD | L759: CHAPMAN | O759: SIMS | Q759: MAILING
A760: PORT MELBOURNE | C760: ANDERSON | F760: RODDA
A761: GOALKICKERS
A762: SANDRINGHAM | C762: MANNIX 6 | F762: MAILING 4 | I762: MANSFIELD 4 | L762: MORRISON 4 | O762: BENNETT 3 | Q762: PLEDGER 2 | T762: CHAPMAN | W762: MACLEOD
A763: PORT MELBOURNE | C763: ANDERSON 8 | F763: COOK 2 | H763: SWAN 2 | J763: EBEYER 2 | M763: CHADBAND | P763: WILKINSON
A765: GEELONG WEST | C765: 5 | D765: 4 | E765: 34 | G765: 9 | H765: 7 | I765: 61 | K765: 13 | L765: 10 | M765: 88 | O765: 15 | P765: 14 | Q765: 104 | S765: VENUE: GEELONG WEST
A766: WILLIAMSTOWN | C766: 3 | D766: 4 | E766: 22 | G766: 5 | H766: 11 | I766: 41 | K766: 10 | L766: 14 | M766: 74 | O766: 12 | P766: 15 | Q766: 87 | S766: GOLLOP :SERONG
A767: BEST PLAYERS
A768: GEELONG WEST | C768: JOHNSTON | F768: WELSH | I768: WATT | L768: HIGGINS | O768: EDDY | R768: TORNEY
A769: WILLIAMSTOWN | C769: SAMPSON | F769: SAIT | I769: TAYLOR | L769: KERSHAW | O769: HUGHES | R769: MURPHY
A770: GOALKICKERS
A771: GEELONG WEST | C771: JOHNSTON 3 | F771: TOULMIN 3 | I771: WELSH 2 | K771: HIGGINS 2 | M771: RADOJEVIC 2 | P771: EDDY | R771: SELLS | T771: MURPHY
A772: WILLIAMSTOWN | C772: FOTHERINGHAM 5 | G772: DULLARD 2 | J772: TAYLOR 2 | M772: SAIT | N772: BOTTAMS | P772: TOWNS
A774: COBURG | C774: 3 | D774: 5 | E774: 23 | G774: 15 | H774: 10 | I774: 100 | K774: 27 | L774: 18 | M774: 180 | O774: 37 | P774: 27 | Q774: 249 | S774: VENUE: COBURG
A775: WAVERLEY | C775: 5 | D775: 2 | E775: 32 | G775: 6 | H775: 2 | I775: 38 | K775: 6 | L775: 2 | M775: 38 | O775: 7 | P775: 3 | Q775: 45 | S775: TORNEY :MAY
A776: BEST PLAYERS
A777: COBURG | C777: EADE | E777: CLEARY | H777: COLLINS | K777: BURT | N777: FREEMAN | Q777: DALGLEISH
A778: WAVERLEY | C778: VEAR | E778: WENBORNE | H778: WILSON | K778: NEWBOULD | N778: MULLENS | Q778: CLARKE
A779: GOALKICKERS
A780: COBURG | C780: P BROWN 6 | E780: FITZGERALD 6 | H780: EADE 5 | J780: MILROY 5 | L780: BURT 4 | N780: FREEMAN 3 | Q780: B BROWN 3 | T780: RAINES 2 | W780: ZANON | X780: M FITZGERALD | AB780: CLEARY
A781: WAVERLEY | C781: ANGELIS 2 | E781: WILLIAMS | H781: JORGENSEN | J781: MULLENS | L781: NEWBOULD | O781: GOODMAN
A783: PRAHRAN | C783: 2 | D783: 7 | E783: 19 | G783: 6 | H783: 8 | I783: 44 | K783: 11 | L783: 9 | M783: 75 | O783: 17 | P783: 13 | Q783: 115 | S783: VENUE: TOORAK PARK
A784: DANDENONG | C784: 3 | D784: 3 | E784: 21 | G784: 7 | H784: 7 | I784: 49 | K784: 10 | L784: 10 | M784: 70 | O784: 13 | P784: 10 | Q784: 88 | S784: OAKLEY :BUDGE
A785: BEST PLAYERS
A786: PRAHRAN | C786: P McDONALD | F786: ELLETT | I786: FOLEY | L786: WRIGHT | O786: ROBINSON
A787: DANDENONG | C787: SHINNERS | F787: ORTON | I787: WOOD | L787: WRIGHT
A788: GOALKICKERS
A789: PRAHRAN | C789: DICKSON 5 | F789: SOULOS 3 | H789: P McDONALD 2 | K789: GRAMBEAU 2 | N789: PARKER 2 | P789: TAYLOR | R789: McKISSOCK | V789: McNAMARA
A790: DANDENONG | C790: WRIGHT 4 | F790: WOOD 4 | H790: MILLANE | J790: SHINNERS | M790: ORSBORNE | O790: COVENTRY | Q790: WENN
A792: ROUND 15 | D792: 31ST JULY | I792: WEATHER | S792: VENUE: BEACH ROAD
D793: 1ST QTR | H793: 2ND QTR | L793: 3RD QTR | P793: FINAL | S793: UMPIRES
A794: SANDRINGHAM | C794: 5 | D794: 9 | E794: 39 | G794: 6 | H794: 12 | I794: 48 | K794: 10 | L794: 18 | M794: 78 | O794: 18 | P794: 18 | Q794: 126 | S794: PHILLIPS | X794: LADDER | AB794: ROUND | AD794: 15
A795: PRAHRAN | C795: 1 | D795: 1 | E795: 7 | G795: 11 | H795: 5 | I795: 71 | K795: 11 | L795: 8 | M795: 74 | O795: 14 | P795: 15 | Q795: 99 | S795: CASEY
A796: BEST PLAYERS | W796: TEAM | X796: W | Y796: L | Z796: D | AA796: FOR | AB796: AGST | AC796: % | AD796: PTS
A797: SANDRINGHAM | C797: HAYES | F797: RICHARDS | I797: ADAMS | L797: MANSFIELD | O797: SIMS | R797: MAILING
A798: PRAHRAN | C798: GRAMBEAU | F798: McDONALD | I798: FOLEY | L798: MCDONALD | O798: McNAMARA | W798: PRESTON | X798: 13 | Y798: 2 | Z798: 0 | AA798: 2102 | AB798: 1280 | AC798: =(AA798/AB798)*100 -> 164.21875 | AD798: =(X798*4)+(Z798*2) -> 52
A799: GOALKICKERS | P799: GALLAGHER | S799: MANNIX | W799: GEELONG WEST | X799: 12 | Y799: 3 | Z799: 0 | AA799: 1957 | AB799: 1401 | AC799: =(AA799/AB799)*100 -> 139.68593861527481 | AD799: =(X799*4)+(Z799*2) -> 48
A800: SANDRINGHAM | C800: MAILING 4 | F800: CHAPMAN 4 | I800: BENNETT 3 | K800: MACLEOD 2 | N800: MANSFIELD 2 | Q800: MORRISON | W800: PORT MELBOURNE | X800: 11 | Y800: 3 | Z800: 1 | AA800: 2032 | AB800: 1660 | AC800: =(AA800/AB800)*100 -> 122.40963855421687 | AD800: =(X800*4)+(Z800*2) -> 46
A801: PRAHRAN | C801: DICKSON 3 | F801: McNAMARA 2 | I801: FRANCE 2 | K801: SOULOS 2 | M801: McDONALD 2 | P801: PARKER | R801: WRIGHT | W801: SANDRINGHAM | X801: 10 | Y801: 5 | Z801: 0 | AA801: 1922 | AB801: 1605 | AC801: =(AA801/AB801)*100 -> 119.75077881619937 | AD801: =(X801*4)+(Z801*2) -> 40
O802: GRAMBEAU | S802: VENUE: WAVERLEY
A803: PORT MELBOURNE | C803: 5 | D803: 2 | E803: 32 | G803: 12 | H803: 8 | I803: 80 | K803: 20 | L803: 14 | M803: 134 | O803: 35 | P803: 17 | Q803: 227 | S803: OGSTON | W803: COBURG | X803: 9 | Y803: 5 | Z803: 1 | AA803: 2040 | AB803: 1408 | AC803: =(AA803/AB803)*100 -> 144.88636363636365 | AD803: =(X803*4)+(Z803*2) -> 38
A804: WAVERLEY | C804: 7 | D804: 0 | E804: 42 | G804: 8 | H804: 3 | I804: 51 | K804: 10 | L804: 3 | M804: 63 | O804: 10 | P804: 5 | Q804: 65 | S804: BUDGE | W804: FRANKSTON | X804: 8 | Y804: 6 | Z804: 1 | AA804: 1627 | AB804: 1876 | AC804: =(AA804/AB804)*100 -> 86.727078891257989 | AD804: =(X804*4)+(Z804*2) -> 34
A805: BEST PLAYERS | W805: WERRIBEE | X805: 7 | Y805: 8 | Z805: 0 | AA805: 1597 | AB805: 1816 | AC805: =(AA805/AB805)*100 -> 87.940528634361243 | AD805: =(X805*4)+(Z805*2) -> 28
A806: PORT MELBOURNE | C806: KAVANAGH | F806: FITZPATRICK | I806: CAMPBELL | L806: EVANS | O806: ROBERTSON | R806: SWAN | W806: DANDENONG | X806: 6 | Y806: 9 | Z806: 0 | AA806: 1650 | AB806: 1617 | AC806: =(AA806/AB806)*100 -> 102.04081632653062 | AD806: =(X806*4)+(Z806*2) -> 24
A807: WAVERLEY | C807: VEAR | F807: WILLIAMS | I807: POWER | L807: CSOTI | O807: CLARKE | W807: PRAHRAN | X807: 5 | Y807: 9 | Z807: 1 | AA807: 1476 | AB807: 1840 | AC807: =(AA807/AB807)*100 -> 80.217391304347828 | AD807: =(X807*4)+(Z807*2) -> 22
A808: GOALKICKERS | P808: DERMOTT | R808: KAVANAGH | W808: CAMBERWELL | X808: 4 | Y808: 11 | Z808: 0 | AA808: 1681 | AB808: 1912 | AC808: =(AA808/AB808)*100 -> 87.918410041841 | AD808: =(X808*4)+(Z808*2) -> 16
A809: PORT MELBOURNE | C809: FITZPATRICK 8 | F809: COOK 7 | H809: EVANS 7 | J809: ANDERSON 5 | M809: BOOTH 3 | O809: CHADBAND | Q809: SWAN | R809: CAMPBELL | W809: WILLIAMSTOWN | X809: 3 | Y809: 12 | Z809: 0 | AA809: 1662 | AB809: 1789 | AC809: =(AA809/AB809)*100 -> 92.901062045835658 | AD809: =(X809*4)+(Z809*2) -> 12
A810: WAVERLEY | C810: ANGELIS 3 | F810: MULLENS 3 | I810: BUCK | K810: KAYE | M810: MURRAY | O810: WILLIAMS | W810: WAVERLEY | X810: 0 | Y810: 15 | Z810: 0 | AA810: 1124 | AB810: 2670 | AC810: =(AA810/AB810)*100 -> 42.09737827715356 | AD810: =(X810*4)+(Z810*2) -> 0
A812: GEELONG WEST | C812: 7 | D812: 7 | E812: 49 | G812: 14 | H812: 8 | I812: 92 | K812: 18 | L812: 10 | M812: 118 | O812: 23 | P812: 12 | Q812: 150 | S812: VENUE: CAMBERWELL
A813: CAMBERWELL | C813: 4 | D813: 3 | E813: 27 | G813: 9 | H813: 5 | I813: 59 | K813: 13 | L813: 8 | M813: 86 | O813: 14 | P813: 13 | Q813: 97 | S813: ALLSOPP :RYAN
A814: BEST PLAYERS
A815: GEELONG WEST | C815: JOHNSTON | F815: MURPHY | I815: KRANJC | L815: TORNEY | O815: WATT | Q815: McDOWELL
A816: CAMBERWELL | C816: EVANS | F816: WILKINSON | I816: HICKEY | L816: BURMEISTER
A817: GOALKICKERS
A818: GEELONG WEST | C818: MURPHY 5 | E818: WESLH 3 | G818: SELLS 2 | I818: ROBINSON 2 | L818: TOULMIN 2 | N818: McDOWELL 2 | Q818: WATT 2 | S818: DALIHAUS 2 | W818: JOHNSTON 2 | Y818: VICKER
A819: CAMBERWELL | C819: NEILSON 3 | E819: WEATHERALD 2 | H819: COWLEY 2 | J819: STEVENSON 2 | M819: S ROURKE | O819: C ROURKE | Q819: BURMEISTER | T819: WILKINSON | W819: DAVIDSON
A821: PRESTON | C821: 5 | D821: 5 | E821: 35 | G821: 10 | H821: 10 | I821: 70 | K821: 14 | L821: 11 | M821: 95 | O821: 19 | P821: 19 | Q821: 133 | S821: VENUE: FRANKSTON
A822: FRANKSTON | C822: 5 | D822: 1 | E822: 31 | G822: 7 | H822: 7 | I822: 49 | K822: 13 | L822: 12 | M822: 90 | O822: 14 | P822: 15 | Q822: 99 | S822: MARCY :GROOM
A823: BEST PLAYERS
A824: PRESTON | C824: BOLGER | F824: DUNBAR | I824: VEAL | L824: WARREN | O824: OHLSEN | R824: McKEON
A825: FRANKSTON | C825: BEATON | F825: ROGERSON | I825: HUNTER | L825: HAMILL | O825: DUNBAR | R825: GAMBLE
A826: GOALKICKERS
A827: PRESTON | C827: BOURKE 6 | F827: VEAL 3 | H827: McEWAN 3 | J827: OSBORNE 3 | M827: BODEN 2 | O827: OHLSEN | Q827: DUNBAR
A828: FRANKSTON | C828: BARDOEL 3 | F828: VANDERMEER 2 | I828: O'BRIEN 2 | K828: LONGHAM 2 | N828: LOCKWOOD | Q828: BEATON | S828: GEDDES | V828: DUNBAR | X828: KENTER
A830: DANDENONG | C830: 2 | D830: 5 | E830: 17 | G830: 6 | H830: 9 | I830: 45 | K830: 9 | L830: 12 | M830: 66 | O830: 11 | P830: 16 | Q830: 82 | S830: VENUE: DANDENONG
A831: WERRIBEE | C831: 3 | D831: 3 | E831: 21 | G831: 5 | H831: 7 | I831: 37 | K831: 9 | L831: 10 | M831: 64 | O831: 10 | P831: 14 | Q831: 74 | S831: GOLLOP :MAY
A832: BEST PLAYERS
A833: DANDENONG | C833: SHINNERS | F833: DE KONNING | I833: D MILLANE | L833: ORTON | O833: WOOD | R833: LACEY
A834: WERRIBEE | C834: CONN | F834: R SMITH | I834: DOUGLAS | L834: FREEMAN | O834: ALLAN | R834: MEMBREY
A835: GOALKICKERS
A836: DANDENONG | C836: WOOD 4 | F836: BROWN 2 | H836: SHINNERS 2 | K836: LACEY | M836: WRIGHT | O836: DE KONNING
A837: WERRIBEE | C837: GORDON 4 | F837: REDENBACH | I837: ALLAN | K837: DOUGLAS | M837: SIMMONS | O837: VAN DER WARDEN | S837: FREEMAN
A839: COBURG | C839: 4 | D839: 5 | E839: 29 | G839: 10 | H839: 8 | I839: 68 | K839: 17 | L839: 9 | M839: 111 | O839: 25 | P839: 13 | Q839: 163 | S839: VENUE: WILLIAMSTOWN
A840: WILLIAMSTOWN | C840: 4 | D840: 2 | E840: 26 | G840: 6 | H840: 6 | I840: 42 | K840: 9 | L840: 10 | M840: 64 | O840: 11 | P840: 15 | Q840: 81 | S840: FITZPATRICK :OAKLEY
A841: BEST PLAYERS
A842: COBURG | C842: BURT | F842: EADE | I842: COLLINS | L842: CLEARY | O842: ZANON | R842: MILROY
A843: WILLIAMSTOWN | C843: SWANN | F843: SAIT | I843: KERSHAW | L843: GREAVE | O843: BOTTAMS
A844: GOALKICKERS
A845: COBURG | C845: CLEARY 5 | E845: P BROWN 4 | H845: EADE 4 | J845: FREEMAN 4 | M845: BURT 2 | O845: HERBERT 2 | Q845: MILROY 2 | S845: J FITZGERALD | W845: PENNINGTON
A846: WILLIAMSTOWN | C846: FOTHERINGHAM 4 | G846: TOWNS 2 | I846: GREAVE | K846: WEIDERSTEIN | N846: HUGHES | P846: TAYLOR | R846: BROOK
A848: ROUND 16 | D848: 7TH AUGUST | I848: WEATHER | S848: VENUE: FRANKSTON
D849: 1ST QTR | H849: 2ND QTR | L849: 3RD QTR | P849: FINAL | S849: UMPIRES
A850: FRANKSTON | C850: 9 | D850: 5 | E850: 59 | G850: 16 | H850: 8 | I850: 104 | K850: 21 | L850: 15 | M850: 141 | O850: 28 | P850: 22 | Q850: 190 | S850: ALLSOPP | X850: LADDER | AB850: ROUND | AD850: 16
A851: DANDENONG | C851: 1 | D851: 0 | E851: 6 | G851: 12 | H851: 4 | I851: 76 | K851: 14 | L851: 8 | M851: 92 | O851: 15 | P851: 14 | Q851: 104 | S851: RYAN
A852: BEST PLAYERS | W852: TEAM | X852: W | Y852: L | Z852: D | AA852: FOR | AB852: AGST | AC852: % | AD852: PTS
A853: FRANKSTON | C853: ROGERSON | F853: HAMILL | I853: LONGHAM | L853: BEATON | O853: O'BRIEN | Q853: HUNTER
A854: DANDENONG | C854: BROWN | F854: SHINNERS | I854: CROCKER | L854: WRIGHT | O854: MILLANE | Q854: LACEY | W854: PRESTON | X854: 14 | Y854: 2 | Z854: 0 | AA854: 2204 | AB854: 1380 | AC854: =(AA854/AB854)*100 -> 159.71014492753625 | AD854: =(X854*4)+(Z854*2) -> 56
A855: GOALKICKERS | W855: GEELONG WEST | X855: 12 | Y855: 4 | Z855: 0 | AA855: 2057 | AB855: 1503 | AC855: =(AA855/AB855)*100 -> 136.85961410512309 | AD855: =(X855*4)+(Z855*2) -> 48
A856: FRANKSTON | C856: BARDOEL 6 | F856: LONGHAM 6 | I856: HAMILL 4 | K856: KENTER 4 | M856: GEDDES 3 | O856: O'BRIEN 3 | Q856: BEATON | S856: DUNBAR | W856: PORT MELBOURNE | X856: 11 | Y856: 4 | Z856: 1 | AA856: 2108 | AB856: 1774 | AC856: =(AA856/AB856)*100 -> 118.82750845546788 | AD856: =(X856*4)+(Z856*2) -> 46
A857: DANDENONG | C857: BROWN 5 | F857: WRIGHT 2 | I857: FINN 2 | K857: ORSBORNE 2 | N857: LACEY 2 | P857: WOOD | R857: TREMBATH | W857: SANDRINGHAM | X857: 11 | Y857: 5 | Z857: 0 | AA857: 2072 | AB857: 1725 | AC857: =(AA857/AB857)*100 -> 120.1159420289855 | AD857: =(X857*4)+(Z857*2) -> 44
S858: VENUE: COBURG
A859: COBURG | C859: 3 | D859: 2 | E859: 20 | G859: 5 | H859: 4 | I859: 34 | K859: 9 | L859: 7 | M859: 61 | O859: 17 | P859: 12 | Q859: 114 | S859: VERGONA | W859: COBURG | X859: 10 | Y859: 5 | Z859: 1 | AA859: 2154 | AB859: 1484 | AC859: =(AA859/AB859)*100 -> 145.14824797843667 | AD859: =(X859*4)+(Z859*2) -> 42
A860: PORT MELBOURNE | C860: 3 | D860: 6 | E860: 24 | G860: 7 | H860: 11 | I860: 53 | K860: 9 | L860: 15 | M860: 69 | O860: 10 | P860: 16 | Q860: 76 | S860: BLOOMFIELD | W860: FRANKSTON | X860: 9 | Y860: 6 | Z860: 1 | AA860: 1817 | AB860: 1980 | AC860: =(AA860/AB860)*100 -> 91.767676767676761 | AD860: =(X860*4)+(Z860*2) -> 38
A861: BEST PLAYERS | W861: WERRIBEE | X861: 7 | Y861: 9 | Z861: 0 | AA861: 1717 | AB861: 1966 | AC861: =(AA861/AB861)*100 -> 87.33468972533062 | AD861: =(X861*4)+(Z861*2) -> 28
A862: COBURG | C862: EADE | F862: A HARBINSON | I862: DALGLEISH | L862: B BROWN | N862: P BROWN | Q862: BURT | W862: PRAHRAN | X862: 6 | Y862: 9 | Z862: 1 | AA862: 1655 | AB862: 1935 | AC862: =(AA862/AB862)*100 -> 85.529715762273909 | AD862: =(X862*4)+(Z862*2) -> 26
A863: PORT MELBOURNE | C863: DAVIES | F863: CHADBAND | I863: G EVANS | L863: COOK | W863: DANDENONG | X863: 6 | Y863: 10 | Z863: 0 | AA863: 1754 | AB863: 1807 | AC863: =(AA863/AB863)*100 -> 97.066961815163253 | AD863: =(X863*4)+(Z863*2) -> 24
A864: GOALKICKERS | M864: A HARBINSON | P864: DALGLEISH | R864: B BROWN | W864: CAMBERWELL | X864: 5 | Y864: 11 | Z864: 0 | AA864: 1793 | AB864: 2005 | AC864: =(AA864/AB864)*100 -> 89.426433915211973 | AD864: =(X864*4)+(Z864*2) -> 20
A865: COBURG | C865: P BROWN 5 | E865: MILROY 3 | G865: FREEMAN 2 | I865: PENNINGTON | L865: HERBERT | N865: M FITZGERALD | Q865: CLEARY | W865: WILLIAMSTOWN | X865: 3 | Y865: 13 | Z865: 0 | AA865: 1755 | AB865: 1901 | AC865: =(AA865/AB865)*100 -> 92.319831667543397 | AD865: =(X865*4)+(Z865*2) -> 12
A866: PORT MELBOURNE | C866: COOK 6 | F866: G EVANS 2 | I866: FITZPATRICK | L866: KAVANAGH | W866: WAVERLEY | X866: 0 | Y866: 16 | Z866: 0 | AA866: 1219 | AB866: 2849 | AC866: =(AA866/AB866)*100 -> 42.786942786942788 | AD866: =(X866*4)+(Z866*2) -> 0
A868: PRAHRAN | C868: 1 | D868: 4 | E868: 10 | G868: 10 | H868: 13 | I868: 73 | K868: 15 | L868: 19 | M868: 109 | O868: 25 | P868: 29 | Q868: 179 | S868: VENUE: TOORAK PARK
A869: WAVERLEY | C869: 4 | D869: 2 | E869: 26 | G869: 6 | H869: 3 | I869: 39 | K869: 12 | L869: 4 | M869: 76 | O869: 15 | P869: 5 | Q869: 95 | S869: GOLLOP :MARCY
A870: BEST PLAYERS
A871: PRAHRAN | C871: GRAMBEAU | F871: TAYLOR | I871: McNAMARA | L871: S McDONALD | O871: JEFFREY
A872: WAVERLEY | C872: WILLIAMS | F872: MIER | I872: GEURANS | L872: BUCK | O872: GOODMAN | R872: CSOTI
A873: GOALKICKERS
A874: PRAHRAN | C874: FRANCE 8 | E874: SOULOS 3 | G874: McDONALD 3 | J874: GRAMBEAU 2 | M874: McNAMARA 2 | P874: DICKSON 2 | R874: WRIGHT 2 | U874: GILES 2 | W874: JEFFREY
A875: WAVERLEY | C875: BUCK 4 | E875: ANGELIS 4 | G875: VEAR 3 | I875: JORGENSEN | L875: MULLENS | N875: CLARKE | P875: CSOTI
A877: PRESTON | C877: 1 | D877: 5 | E877: 11 | G877: 7 | H877: 11 | I877: 53 | K877: 9 | L877: 15 | M877: 69 | O877: 14 | P877: 18 | Q877: 102 | S877: VENUE: GEELONG WEST
A878: GEELONG WEST | C878: 5 | D878: 2 | E878: 32 | G878: 6 | H878: 5 | I878: 41 | K878: 11 | L878: 9 | M878: 75 | O878: 14 | P878: 16 | Q878: 100 | S878: FITZPATRICK :PHILLIPS
A879: BEST PLAYERS
A880: PRESTON | C880: AUSTEN | F880: DUNBAR | I880: TOWAN | L880: BRINE | O880: WARREN | R880: BOURKE
A881: GEELONG WEST | C881: MURPHY | F881: EDDY | I881: SMITH | L881: SELLS | O881: McFADDEN
A882: GOALKICKERS
A883: PRESTON | C883: BOURKE 4 | F883: BODEN 3 | H883: OHLSEN 2 | J883: McKEON 2 | M883: VEAL | N883: SALVADORE | Q883: OSBORNE
A884: GEELONG WEST | C884: EDDY 3 | F884: TOULMIN 3 | I884: MURPHY 2 | K884: EVANS 2 | M884: SELLS | O884: McDOWELL | Q884: HIGGINS | S884: VARKER
A886: SANDRINGHAM | C886: 11 | D886: 3 | E886: 69 | G886: 16 | H886: 7 | I886: 103 | K886: 20 | L886: 12 | M886: 132 | O886: 22 | P886: 18 | Q886: 150 | S886: VENUE: WERRIBEE
A887: WERRIBEE | C887: 4 | D887: 2 | E887: 26 | G887: 9 | H887: 7 | I887: 61 | K887: 12 | L887: 11 | M887: 83 | O887: 17 | P887: 18 | Q887: 120 | S887: OAKLEY :OGSTON
A888: BEST PLAYERS
A889: SANDRINGHAM | C889: HAYES | F889: MANNIX | I889: RICHARDS | L889: MORRISON | O889: BENNETT | Q889: WILKINS
A890: WERRIBEE | C890: SMITH | F890: CONN | I890: FREEMAN | L890: REDENBACH | O890: LE DEUX | Q890: PARKES
A891: GOALKICKERS
A892: SANDRINGHAM | C892: MORRISON 8 | F892: BENNETT 3 | I892: WILKINS 3 | K892: MACLEOD 2 | M892: CHAPMAN | O892: GALLAGHER | Q892: MAILING | S892: MANNIX | V892: MANSFIELD | X892: PLEDGER
A893: WERRIBEE | C893: SIMMONS 5 | F893: ALLAN 3 | H893: REDENBACH 2 | K893: BREEN 2 | M893: KING 2 | O893: GORDON | Q893: LE DEUX | S893: MARSDEN
A895: CAMBERWELL | C895: 6 | D895: 5 | E895: 41 | G895: 11 | H895: 8 | I895: 74 | K895: 11 | L895: 11 | M895: 77 | O895: 16 | P895: 16 | Q895: 112 | S895: VENUE: WILLIAMSTOWN
A896: WILLIAMSTOWN | C896: 2 | D896: 5 | E896: 17 | G896: 4 | H896: 7 | I896: 31 | K896: 10 | L896: 9 | M896: 69 | O896: 14 | P896: 9 | Q896: 93 | S896: TORNEY :STABB
A897: BEST PLAYERS
A898: CAMBERWELL | C898: DANS | F898: BURMEISTER | I898: STEVENSON | L898: PEVITT | O898: McFEE
A899: WILLIAMSTOWN | C899: B McTAGGART | F899: BOTTAMS | I899: KERSHAW | L899: SANDELLS | O899: BARNETT
A900: GOALKICKERS
A901: CAMBERWELL | C901: STEVENSON 7 | F901: COWLEY 2 | I901: S ROURKE 2 | L901: WEATHERALD 2 | O901: DODIG 2 | Q901: McFEE
A902: WILLIAMSTOWN | C902: FOTHERINGHAM 4 | G902: WEIDENSTEIN 4 | J902: TAYLOR 3 | M902: MURPHY 2 | O902: B McTAGGART | R902: SAIT
A904: ROUND 17 | D904: 14TH AUGUST | I904: WEATHER | S904: PLAYED VENUE: WAVERLEY
D905: 1ST QTR | H905: 2ND QTR | L905: 3RD QTR | P905: FINAL | S905: UMPIRES
A906: WERRIBEE | C906: 10 | D906: 6 | E906: 66 | G906: 15 | H906: 13 | I906: 103 | K906: 24 | L906: 21 | M906: 165 | O906: 29 | P906: 25 | Q906: 199 | S906: STABB | X906: LADDER | AB906: ROUND | AD906: 17
A907: WAVERLEY | C907: 5 | D907: 1 | E907: 31 | G907: 11 | H907: 7 | I907: 73 | K907: 15 | L907: 8 | M907: 98 | O907: 22 | P907: 14 | Q907: 146 | S907: CASEY
A908: BEST PLAYERS | W908: TEAM | X908: W | Y908: L | Z908: D | AA908: FOR | AB908: AGST | AC908: % | AD908: PTS
A909: WERRIBEE | C909: REDENBACH | F909: PARKES | I909: MEMBREY | L909: LE DEUX | O909: GORDON | R909: MARSDEN
A910: WAVERLEY | C910: CLARKE | F910: WILLIAMS | I910: MIER | L910: ALEXANDER | O910: GUERDAN | R910: CSOTI | W910: PRESTON | X910: 15 | Y910: 2 | Z910: 0 | AA910: 2377 | AB910: 1475 | AC910: =(AA910/AB910)*100 -> 161.15254237288136 | AD910: =(X910*4)+(Z910*2) -> 60
A911: GOALKICKERS | M911: MARSDEN | O911: MENADUE | Q911: MEMBREY | W911: GEELONG WEST | X911: 13 | Y911: 4 | Z911: 0 | AA911: 2202 | AB911: 1605 | AC911: =(AA911/AB911)*100 -> 137.196261682243 | AD911: =(X911*4)+(Z911*2) -> 52
A912: WERRIBEE | C912: GORDON 6 | E912: KING 6 | G912: SIMMONS 4 | I912: ALLAN 3 | K912: FREEMAN 2 | M912: PARKES 2 | O912: BREEN 2 | Q912: REDENBACH | W912: PORT MELBOURNE | X912: 12 | Y912: 4 | Z912: 1 | AA912: 2250 | AB912: 1859 | AC912: =(AA912/AB912)*100 -> 121.03281334050564 | AD912: =(X912*4)+(Z912*2) -> 50
A913: WAVERLEY | C913: ANGELIS 6 | E913: CLARKE 4 | G913: MURRAY 3 | I913: JORGENSEN 2 | L913: VEAR 2 | N913: WILLIAMS 2 | Q913: MIER | R913: NEWBOULD | W913: SANDRINGHAM | X913: 12 | Y913: 5 | Z913: 0 | AA913: 2233 | AB913: 1838 | AC913: =(AA913/AB913)*100 -> 121.49075081610445 | AD913: =(X913*4)+(Z913*2) -> 48
O914: GUERDAN | S914: VENUE: BEACH ROAD
A915: SANDRINGHAM | C915: 9 | D915: 2 | E915: 56 | G915: 10 | H915: 3 | I915: 63 | K915: 20 | L915: 8 | M915: 128 | O915: 25 | P915: 11 | Q915: 161 | S915: TORNEY | W915: COBURG | X915: 10 | Y915: 6 | Z915: 1 | AA915: 2274 | AB915: 1611 | AC915: =(AA915/AB915)*100 -> 141.15456238361267 | AD915: =(X915*4)+(Z915*2) -> 42
A916: FRANKSTON | C916: 4 | D916: 2 | E916: 26 | G916: 8 | H916: 11 | I916: 59 | K916: 11 | L916: 13 | M916: 79 | O916: 16 | P916: 17 | Q916: 113 | S916: VERGONA | W916: FRANKSTON | X916: 9 | Y916: 7 | Z916: 1 | AA916: 1930 | AB916: 2141 | AC916: =(AA916/AB916)*100 -> 90.144792153199433 | AD916: =(X916*4)+(Z916*2) -> 38
A917: BEST PLAYERS | W917: WERRIBEE | X917: 8 | Y917: 9 | Z917: 0 | AA917: 1916 | AB917: 2112 | AC917: =(AA917/AB917)*100 -> 90.719696969696969 | AD917: =(X917*4)+(Z917*2) -> 32
A918: SANDRINGHAM | C918: MACLEOD | F918: HAYES | I918: RICHARDS | L918: MORRISON | O918: BENNETT | R918: BARNETT | W918: PRAHRAN | X918: 6 | Y918: 10 | Z918: 1 | AA918: 1740 | AB918: 2077 | AC918: =(AA918/AB918)*100 -> 83.774675012036596 | AD918: =(X918*4)+(Z918*2) -> 26
A919: FRANKSTON | C919: BEATON | F919: ROGERSON | I919: HOWE | L919: GEDDES | O919: HAMILL | W919: DANDENONG | X919: 6 | Y919: 11 | Z919: 0 | AA919: 1856 | AB919: 1952 | AC919: =(AA919/AB919)*100 -> 95.081967213114751 | AD919: =(X919*4)+(Z919*2) -> 24
A920: GOALKICKERS | Q920: MANSFIELD | W920: CAMBERWELL | X920: 6 | Y920: 11 | Z920: 0 | AA920: 1920 | AB920: 2125 | AC920: =(AA920/AB920)*100 -> 90.352941176470594 | AD920: =(X920*4)+(Z920*2) -> 24
A921: SANDRINGHAM | C921: BENNETT 8 | E921: MORRISON 6 | H921: MACLEOD 3 | J921: GALLAGHER 2 | M921: MANNIX 2 | O921: CHAPMAN 2 | R921: MAILING | W921: WILLIAMSTOWN | X921: 3 | Y921: 14 | Z921: 0 | AA921: 1850 | AB921: 2074 | AC921: =(AA921/AB921)*100 -> 89.199614271938287 | AD921: =(X921*4)+(Z921*2) -> 12
A922: FRANKSTON | C922: BARDOEL 3 | E922: LONGHAM 3 | H922: DUNBAR 2 | J922: KENTER 2 | L922: ROGERSON | N922: BEATON | P922: WILLIAMS | R922: GEDDES | W922: WAVERLEY | X922: 0 | Y922: 17 | Z922: 0 | AA922: 1365 | AB922: 3048 | AC922: =(AA922/AB922)*100 -> 44.783464566929133 | AD922: =(X922*4)+(Z922*2) -> 0
O923: O'BRIEN | Q923: HAMILL
A924: CAMBERWELL | C924: 5 | D924: 4 | E924: 34 | G924: 11 | H924: 7 | I924: 73 | K924: 14 | L924: 12 | M924: 96 | O924: 19 | P924: 13 | Q924: 127 | S924: VENUE: CAMBERWELL
A925: COBURG | C925: 2 | D925: 2 | E925: 14 | G925: 6 | H925: 9 | I925: 45 | K925: 11 | L925: 13 | M925: 79 | O925: 17 | P925: 18 | Q925: 120 | S925: BUDGE :PHILLIPS
A926: BEST PLAYERS
A927: CAMBERWELL | C927: DAVIDSON | F927: C ROURKE | I927: EVANS | L927: NEILSON | O927: WEATHERALD
A928: COBURG | C928: PENNINGTON | F928: FREEMAN | I928: BROWN | L928: HERBERT | O928: ALLISON | R928: LAIDLER
A929: GOALKICKERS
A930: CAMBERWELL | C930: WEATHERALD 6 | F930: STEVENSON 4 | I930: DAVIDSON 3 | L930: DODIG 2 | N930: McFEE | P930: S ROURKE | R930: PEVITT | T930: C ROURKE
A931: COBURG | C931: SERAFINI 4 | F931: BROWN 2 | H931: KEOGH 2 | J931: LAIDLER 2 | M931: HERBERT 2 | O931: EADE 2 | Q931: FREEMAN 2 | T931: PENNINGTON
A933: PRESTON | C933: 2 | D933: 3 | E933: 15 | G933: 12 | H933: 9 | I933: 81 | K933: 18 | L933: 13 | M933: 121 | O933: 26 | P933: 17 | Q933: 173 | S933: VENUE: PRESTON
A934: WILLIAMSTOWN | C934: 4 | D934: 6 | E934: 30 | G934: 7 | H934: 8 | I934: 50 | K934: 10 | L934: 9 | M934: 69 | O934: 14 | P934: 11 | Q934: 95 | S934: RYAN :OGSTON
A935: BEST PLAYERS
A936: PRESTON | C936: BRINE | F936: BUX | I936: TOWAN | L936: AUSTEN | O936: HALAS | R936: BODEN
A937: WILLIAMSTOWN | C937: B McTAGGART | F937: P SINNOTT | I937: McCONNON | L937: SANDELLS | O937: BOTTAMS | R937: KERSHAW
A938: GOALKICKERS
A939: PRESTON | C939: HALAS 8 | E939: McEWAN 4 | H939: BODEN 4 | J939: BOURKE 3 | L939: BRINE 2 | N939: WARREN | P939: OHLSEN | R939: McKEON | U939: MARCON | X939: BOLGER
A940: WILLIAMSTOWN | C940: FOTHERINGHAM 6 | G940: WEIDENSTEIN 3 | K940: P SINNOTT 2 | N940: TAYLOR
A942: PORT MELBOURNE | C942: 6 | D942: 4 | E942: 40 | G942: 11 | H942: 11 | I942: 77 | K942: 13 | L942: 14 | M942: 92 | O942: 20 | P942: 22 | Q942: 142 | S942: VENUE: PORT MELBOURNE
A943: PRAHRAN | C943: 0 | D943: 0 | E943: 0 | G943: 1 | H943: 2 | I943: 8 | K943: 7 | L943: 5 | M943: 47 | O943: 13 | P943: 7 | Q943: 85 | S943: FITZPATRICK :'OAKLEY
A944: BEST PLAYERS
A945: PORT MELBOURNE | C945: ROBERTSON | F945: CHADBAND | I945: ANDERSON | L945: EVANS | O945: DERMOTT | R945: BOOTH
A946: PRAHRAN | C946: MCDONALD | F946: GRAMBEAU | I946: BICKFORD | L946: FOLEY | O946: MCNAMARA
A947: GOALKICKERS
A948: PORT MELBOURNE | C948: ANDERSON 6 | F948: EVANS 4 | H948: FITZPATRICK 3 | K948: KAVANAGH 3 | N948: HOY 2 | P948: BOOTH | R948: SWAN
A949: PRAHRAN | C949: P McDONALD 3 | F949: WRIGHT 3 | H949: FRANCE | J949: McKISSOCK | M949: TAYLOR | O949: MCNAMARA | R949: BICKFORD | U949: SOULOS | W949: S McDONALD
A951: GEELONG WEST | C951: 5 | D951: 5 | E951: 35 | G951: 9 | H951: 7 | I951: 61 | K951: 16 | L951: 12 | M951: 108 | O951: 22 | P951: 13 | Q951: 145 | S951: VENUE: DANDENONG
A952: DANDENONG | C952: 6 | D952: 2 | E952: 38 | G952: 6 | H952: 7 | I952: 43 | K952: 8 | L952: 11 | M952: 59 | O952: 15 | P952: 12 | Q952: 102 | S952: MARCY :GROOM
A953: BEST PLAYERS
A954: GEELONG WEST | C954: HIGGINS | F954: MURPHY | I954: EDDY | L954: JOHNSTON | O954: TORNEY
A955: DANDENONG | C955: DE KONNING | F955: COVENTRY | I955: SHINNERS | L955: WRIGHT | O955: McGUINNESS | R955: D MILLANE
A956: GOALKICKERS
A957: GEELONG WEST | C957: SELLS 6 | F957: TOULMIN 5 | I957: MURPHY 4 | K957: EDDY 3 | M957: VARKER | O957: WATT | Q957: EVANS | S957: JOHNSTON
A958: DANDENONG | C958: COVENTRY 5 | F958: WRIGHT 3 | I958: McGUINNESS 3 | L958: ORTON | N958: SHINNERS | P958: ORSBORNE | R958: BROWN
A960: ROUND 18 | D960: 21ST AUGUST | I960: WEATHER | S960: VENUE: COBURG
D961: 1ST QTR | H961: 2ND QTR | L961: 3RD QTR | P961: FINAL | S961: UMPIRES
A962: PRAHRAN | C962: 1 | D962: 2 | E962: 8 | G962: 9 | H962: 8 | I962: 62 | K962: 13 | L962: 9 | M962: 87 | O962: 19 | P962: 14 | Q962: 128 | S962: TORNEY | X962: LADDER | AB962: ROUND | AD962: 18
A963: COBURG | C963: 6 | D963: 7 | E963: 43 | G963: 7 | H963: 11 | I963: 53 | K963: 15 | L963: 17 | M963: 107 | O963: 16 | P963: 18 | Q963: 114 | S963: RYAN
A964: BEST PLAYERS | W964: TEAM | X964: W | Y964: L | Z964: D | AA964: FOR | AB964: AGST | AC964: % | AD964: PTS
A965: PRAHRAN | C965: TAYLOR | F965: McNAMARA | I965: S McDONALD | L965: REED | O965: FRANCE | Q965: WRIGHT
A966: COBURG | C966: EADE | F966: DALGLEISH | I966: FREEMAN | L966: ZANON | O966: PITT | W966: PRESTON | X966: 15 | Y966: 3 | Z966: 0 | AA966: 2477 | AB966: 1584 | AC966: =(AA966/AB966)*100 -> 156.37626262626264 | AD966: =(X966*4)+(Z966*2) -> 60
A967: GOALKICKERS | W967: GEELONG WEST | X967: 14 | Y967: 4 | Z967: 0 | AA967: 2332 | AB967: 1670 | AC967: =(AA967/AB967)*100 -> 139.64071856287427 | AD967: =(X967*4)+(Z967*2) -> 56
A968: PRAHRAN | C968: FRANCE 8 | F968: McNAMARA 3 | I968: S McDONALD 2 | L968: WRIGHT 2 | N968: SOULOS 2 | P968: McKISSOCK | R968: P McDONALD | W968: PORT MELBOURNE | X968: 13 | Y968: 4 | Z968: 1 | AA968: 2411 | AB968: 1978 | AC968: =(AA968/AB968)*100 -> 121.89079878665319 | AD968: =(X968*4)+(Z968*2) -> 54
A969: COBURG | C969: J FITZGERALD 4 | F969: HERBERT 3 | I969: SERAFINI 2 | K969: M FITZGERALD 2 | N969: CRONIN 2 | P969: BURT | Q969: EADE | R969: B BROWN | W969: SANDRINGHAM | X969: 12 | Y969: 6 | Z969: 0 | AA969: 2298 | AB969: 1968 | AC969: =(AA969/AB969)*100 -> 116.76829268292683 | AD969: =(X969*4)+(Z969*2) -> 48
S970: VENUE: FRANKSTON
A971: FRANKSTON | C971: 11 | D971: 8 | E971: 74 | G971: 16 | H971: 12 | I971: 108 | K971: 25 | L971: 17 | M971: 167 | O971: 36 | P971: 18 | Q971: 234 | S971: FITZPATRICK | W971: COBURG | X971: 10 | Y971: 7 | Z971: 1 | AA971: 2388 | AB971: 1739 | AC971: =(AA971/AB971)*100 -> 137.3202990224267 | AD971: =(X971*4)+(Z971*2) -> 42
A972: WAVERLEY | C972: 2 | D972: 3 | E972: 15 | G972: 8 | H972: 8 | I972: 56 | K972: 11 | L972: 10 | M972: 76 | O972: 17 | P972: 12 | Q972: 114 | S972: HUTCHINGS | W972: FRANKSTON | X972: 10 | Y972: 7 | Z972: 1 | AA972: 2164 | AB972: 2255 | AC972: =(AA972/AB972)*100 -> 95.964523281596442 | AD972: =(X972*4)+(Z972*2) -> 42
A973: BEST PLAYERS | W973: WERRIBEE | X973: 8 | Y973: 10 | Z973: 0 | AA973: 2035 | AB973: 2273 | AC973: =(AA973/AB973)*100 -> 89.529256489221297 | AD973: =(X973*4)+(Z973*2) -> 32
A974: FRANKSTON | C974: BARDOEL | F974: VANDERMEER | I974: BEATON | L974: GEDDES | N974: GAMBLE | Q974: LONGHAM | W974: PRAHRAN | X974: 7 | Y974: 10 | Z974: 1 | AA974: 1968 | AB974: 2191 | AC974: =(AA974/AB974)*100 -> 89.821999087174802 | AD974: =(X974*4)+(Z974*2) -> 30
A975: WAVERLEY | C975: MURRAY | F975: WILLIAMS | I975: COSGROVE | L975: KING | N975: GOODMAN | Q975: WENBORNE | W975: CAMBERWELL | X975: 7 | Y975: 11 | Z975: 0 | AA975: 2029 | AB975: 2225 | AC975: =(AA975/AB975)*100 -> 91.19101123595506 | AD975: =(X975*4)+(Z975*2) -> 28
A976: GOALKICKERS | J976: WILLIAMS 2 | M976: DUNSFORD 2 | P976: VANDERMEER | S976: MARTIN | W976: DANDENONG | X976: 6 | Y976: 12 | Z976: 0 | AA976: 1938 | AB976: 2062 | AC976: =(AA976/AB976)*100 -> 93.986420950533471 | AD976: =(X976*4)+(Z976*2) -> 24
A977: FRANKSTON | C977: LONGHAM 10 | F977: FERGUSON 5 | I977: BATEMAN 4 | L977: BEATON 3 | N977: O'BRIEN 3 | P977: KENTER 3 | R977: BARDOEL 2 | W977: WILLIAMSTOWN | X977: 4 | Y977: 14 | Z977: 0 | AA977: 1960 | AB977: 2156 | AC977: =(AA977/AB977)*100 -> 90.909090909090907 | AD977: =(X977*4)+(Z977*2) -> 16
A978: WAVERLEY | C978: MURRAY 6 | F978: ANGELIS 4 | I978: COSGROVE 2 | L978: MIER 2 | N978: BUCK | P978: KING | R978: NEWBOULD | W978: WAVERLEY | X978: 0 | Y978: 18 | Z978: 0 | AA978: 1479 | AB978: 3282 | AC978: =(AA978/AB978)*100 -> 45.063985374771484 | AD978: =(X978*4)+(Z978*2) -> 0
A980: GEELONG WEST | C980: 3 | D980: 6 | E980: 24 | G980: 12 | H980: 8 | I980: 80 | K980: 14 | L980: 13 | M980: 97 | O980: 19 | P980: 16 | Q980: 130 | S980: VENUE: GEELONG WEST
A981: SANDRINGHAM | C981: 2 | D981: 1 | E981: 13 | G981: 3 | H981: 2 | I981: 20 | K981: 6 | L981: 8 | M981: 44 | O981: 9 | P981: 11 | Q981: 65 | S981: ALLSOPP :STABB
A982: BEST PLAYERS
A983: GEELONG WEST | C983: SMITH | F983: VARKER | I983: McFADDEN | L983: TORNEY | O983: KRANJC | R983: EDDY
A984: SANDRINGHAM | C984: HAYES | F984: MACLEOD | I984: MANNIX | L984: SIMS
A985: GOALKICKERS
A986: GEELONG WEST | C986: EVANS 3 | E986: EDDY 3 | G986: MURPHY 3 | I986: TOULMIN 3 | L986: SELLS 3 | N986: HIGGINS 2 | Q986: JOHNSTON 2
A987: SANDRINGHAM | C987: CHAPMAN 3 | F987: MORRISON 2 | I987: BENNETT | K987: MACLEOD | M987: MAILING | O987: NANKERVIS
A989: WILLIAMSTOWN | C989: 2 | D989: 2 | E989: 14 | G989: 7 | H989: 6 | I989: 48 | K989: 9 | L989: 11 | M989: 65 | O989: 16 | P989: 14 | Q989: 110 | S989: VENUE: WILLIAMSTOWN
A990: DANDENONG | C990: 3 | D990: 6 | E990: 24 | G990: 4 | H990: 12 | I990: 36 | K990: 6 | L990: 14 | M990: 50 | O990: 11 | P990: 16 | Q990: 82 | S990: VERGONA :MORGAN
A991: BEST PLAYERS
A992: WILLIAMSTOWN | C992: DULLARD | F992: WEIDERSTEIN | I992: SANDELLS | L992: TAYLOR | O992: FOTHERINGHAM | R992: GREAVES
A993: DANDENONG | C993: D MILLANE | F993: FINN | I993: McGUINNESS | L993: J MILLANE | O993: COVENTRY
A994: GOALKICKERS
A995: WILLIAMSTOWN | C995: FOTHERINGHAM 8 | G995: WEIDERSTEIN 4 | J995: McCONNON 2 | M995: DULLARD | O995: TAYLOR
A996: DANDENONG | C996: ORSBORNE 2 | F996: McGUINNESS 2 | I996: WRIGHT 2 | K996: POWLES 2 | M996: WOOD 2 | O996: LACEY
A998: CAMBERWELL | C998: 4 | D998: 1 | E998: 25 | G998: 8 | H998: 6 | I998: 54 | K998: 11 | L998: 12 | M998: 78 | O998: 15 | P998: 19 | Q998: 109 | S998: VENUE: CAMBERWELL
A999: PRESTON | C999: 6 | D999: 6 | E999: 42 | G999: 7 | H999: 9 | I999: 51 | K999: 13 | L999: 11 | M999: 89 | O999: 14 | P999: 16 | Q999: 100 | S999: GROOM :GOLLOP
A1000: BEST PLAYERS
A1001: CAMBERWELL | C1001: WILKINSON | F1001: C ROURKE | I1001: DANS | L1001: CAHILL | O1001: EVANS
A1002: PRESTON | C1002: BRINE | F1002: AUSTEN | I1002: McCANN | L1002: TOWAN | O1002: VEAL | Q1002: McKEON
A1003: GOALKICKERS
A1004: CAMBERWELL | C1004: WEATHERALD 4 | F1004: CAHILL 3 | H1004: COWLEY 2 | J1004: HICKEY | L1004: EVANS | N1004: DAVIDSON | Q1004: STEVENSON | T1004: DODIG | V1004: McCORMACK
A1005: PRESTON | C1005: VEAL 3 | E1005: BRINE 3 | G1005: McEWAN 2 | I1005: BODEN 2 | K1005: DUNBAR 2 | M1005: HALAS | O1005: MARCON
A1007: PORT MELBOURNE | C1007: 3 | D1007: 7 | E1007: 25 | G1007: 5 | H1007: 13 | I1007: 43 | K1007: 14 | L1007: 19 | M1007: 103 | O1007: 23 | P1007: 23 | Q1007: 161 | S1007: VENUE: WERRIBEE
A1008: WERRIBEE | C1008: 3 | D1008: 3 | E1008: 21 | G1008: 9 | H1008: 8 | I1008: 62 | K1008: 13 | L1008: 13 | M1008: 91 | O1008: 17 | P1008: 17 | Q1008: 119 | S1008: MARCY :STEERE
A1009: BEST PLAYERS
A1010: PORT MELBOURNE | C1010: EVANS | F1010: SWAN | I1010: COOK | L1010: FITZPATRICK | O1010: HOY | R1010: EBEYER
A1011: WERRIBEE | C1011: REDENBACH | F1011: MARSDEN | I1011: RICHARDSON | L1011: KING | O1011: MEMBREY | R1011: CONN
A1012: GOALKICKERS
A1013: PORT MELBOURNE | C1013: FITZPATRICK 6 | F1013: HOY 4 | H1013: ANDERSON 4 | K1013: EVANS 3 | M1013: HICKS 2 | O1013: COOK | Q1013: SWAN | S1013: DOYLE | U1013: EBEYER
A1014: WERRIBEE | C1014: KING 5 | E1014: BREEN 3 | G1014: REDENBACH 2 | J1014: SIMMONS 2 | L1014: ALLAN | N1014: MARSDEN | Q1014: DOUGLAS | S1014: GORDON | V1014: JAMES
A1016: FINALS
A1017: 1ST SEMI | D1017: 28TH AUGUST | I1017: WEATHER | S1017: PLAYED AT
D1018: 1ST QTR | H1018: 2ND QTR | L1018: 3RD QTR | P1018: FINAL | S1018: JUNCTION OVAL
A1019: PORT MELBOURNE | C1019: 11 | D1019: 3 | E1019: 69 | G1019: 16 | H1019: 8 | I1019: 104 | K1019: 22 | L1019: 11 | M1019: 143 | O1019: 28 | P1019: 12 | Q1019: 180 | S1019: UMPIRES
A1020: SANDRINGHAM | C1020: 4 | D1020: 1 | E1020: 25 | G1020: 8 | H1020: 3 | I1020: 51 | K1020: 13 | L1020: 12 | M1020: 90 | O1020: 20 | P1020: 14 | Q1020: 134 | S1020: RYAN ;FITZPATRICK
A1021: BEST PLAYERS
A1022: PORT MELBOURNE | C1022: ANDERSON | F1022: SWAN | I1022: EBEYER | L1022: CHADBAND | O1022: FEHRING | R1022: KAVANAGH
A1023: SANDRINGHAM | C1023: MACLEOD | F1023: MANNIX | I1023: ADAMS | L1023: MANSFIELD | O1023: CHAPMAN | R1023: LYONS
A1024: GOALKICKERS
A1025: PORT MELBOURNE | C1025: ANDERSON 8 | F1025: FITZPATRICK 7 | I1025: COOK 4 | K1025: SWAN 2 | M1025: EASTON 2 | O1025: HOY | P1025: TANTSIS | R1025: EVANS | T1025: EBEYER | W1025: KAVANAGH
A1026: SANDRINGHAM | C1026: GALLAGHER 4 | F1026: MORRISON 3 | I1026: BENNETT 3 | K1026: MAILING 3 | M1026: CHAPMAN 2 | P1026: MULLER 2 | R1026: PLEDGER | U1026: LYONS | W1026: MANNIX
A1028: 2ND SEMI | D1028: 4TH SEPTEMBER
A1029: PRESTON | C1029: 2 | D1029: 4 | E1029: 16 | G1029: 6 | H1029: 8 | I1029: 44 | K1029: 10 | L1029: 11 | M1029: 71 | O1029: 18 | P1029: 15 | Q1029: 123 | S1029: VENUE: JUNCTION OVAL
A1030: GEELONG WEST | C1030: 6 | D1030: 6 | E1030: 42 | G1030: 10 | H1030: 9 | I1030: 69 | K1030: 12 | L1030: 12 | M1030: 84 | O1030: 15 | P1030: 14 | Q1030: 104 | S1030: MARCY STABB
A1031: BEST PLAYERS
A1032: PRESTON | C1032: McEWAN | F1032: AUSTEN | I1032: McCANN | L1032: OHLSEN | O1032: BRINE | R1032: WARREN
A1033: GEELONG WEST | C1033: MURPHY | F1033: SELLS | I1033: KRANJC | L1033: WATT | O1033: HIGGINS
A1034: GOALKICKERS
A1035: PRESTON | C1035: OHLSEN 4 | E1035: BOURKE 3 | G1035: HALAS 2 | I1035: VEAL 2 | K1035: BRINE 2 | M1035: WARREN | O1035: BOLGER | Q1035: McCANN | S1035: BODEN | U1035: MARCON
A1036: GEELONG WEST | C1036: RADOJEVIC 5 | F1036: SELLS 3 | H1036: MURPHY 3 | J1036: WELSH 2 | L1036: GIESON | N1036: VARKER
A1038: PRELIMINARY FINAL | E1038: 11TH SEPTEMBER
A1039: GEELONG WEST | C1039: 4 | D1039: 5 | E1039: 29 | G1039: 8 | H1039: 8 | I1039: 56 | K1039: 10 | L1039: 10 | M1039: 70 | O1039: 14 | P1039: 12 | Q1039: 96 | S1039: VENUE: JUNCTION OVAL
A1040: PORT MELBOURNE | C1040: 1 | D1040: 6 | E1040: 12 | G1040: 2 | H1040: 7 | I1040: 19 | K1040: 6 | L1040: 8 | M1040: 44 | O1040: 6 | P1040: 11 | Q1040: 47 | S1040: GROOM :VERGONA
A1041: BEST PLAYERS
A1042: GEELONG WEST | C1042: BEATON | F1042: SMITH | I1042: EDDY | L1042: MURPHY | O1042: MCKENZIE | R1042: WATT
A1043: PORT MELBOURNE | C1043: COOK | F1043: ROBERTSON | I1043: KAVANAGH | L1043: EVANS | O1043: EBEYER | R1043: WILKINSON
A1044: GOALKICKERS
A1045: GEELONG WEST | C1045: SELLS 4 | E1045: EDDY 3 | G1045: WELSH 2 | I1045: RADOJEVIC 2 | L1045: BEATON | N1045: JOHNSTON | Q1045: DALIHAUS
A1046: PORT MELBOURNE | C1046: COOK 4 | F1046: FITZPATRICK | I1046: HOY
A1048: GRAND FINAL | D1048: 18TH SEPTEMBER
A1049: PRESTON | C1049: 3 | D1049: 4 | E1049: 22 | G1049: 6 | H1049: 7 | I1049: 43 | K1049: 12 | L1049: 8 | M1049: 80 | O1049: 14 | P1049: 10 | Q1049: 94 | S1049: VENUE: JUNCTION OVAL
A1050: GEELONG WEST | C1050: 2 | D1050: 6 | E1050: 18 | G1050: 5 | H1050: 10 | I1050: 40 | K1050: 9 | L1050: 11 | M1050: 65 | O1050: 12 | P1050: 15 | Q1050: 87 | S1050: STABB :VERGONA
A1051: BEST PLAYERS
A1052: PRESTON | C1052: AUSTEN | F1052: HALAS | I1052: BOURKE | L1052: BUX | O1052: BODEN | R1052: BOLGER
A1053: GEELONG WEST | C1053: HIGGINS | F1053: WATT | I1053: RADOJEVIC | L1053: SMITH | O1053: KRANJC | R1053: BEATON
A1054: GOALKICKERS
A1055: PRESTON | C1055: BOURKE 6 | F1055: HALAS 3 | H1055: MARCON 2 | J1055: BRINE | L1055: DYSON | N1055: BODEN
A1056: GEELONG WEST | C1056: RADOJEVIC 5 | F1056: MURPHY 2 | I1056: GIBSON | K1056: SELLS | M1056: McDOWELL | P1056: WATT | R1056: EDDY
A1058: REPRESENTATIVE MATCH
A1059: V.A.F.A. | C1059: 4 | D1059: 8 | E1059: 32 | G1059: 7 | H1059: 11 | I1059: 53 | K1059: 12 | L1059: 14 | M1059: 86 | O1059: 18 | P1059: 16 | Q1059: 124 | S1059: VENUE: BEACH ROAD
A1060: V.F.A. | C1060: 3 | D1060: 2 | E1060: 20 | G1060: 9 | H1060: 9 | I1060: 63 | K1060: 12 | L1060: 18 | M1060: 90 | O1060: 16 | P1060: 17 | Q1060: 113 | S1060: VERGONA :HARWOOD
A1061: BEST PLAYERS
A1062: V.A.F.A. | C1062: STONE | F1062: BOURKE | I1062: CURTAIN | L1062: J BENNETT | O1062: BROWN | R1062: MURPHY
A1063: V.F.A. | C1063: AUSTEN | F1063: KAVANAGH | I1063: FOTHERINHAM | L1063: DOYLE | O1063: ROBERTSON | R1063: BRINE
A1064: GOALKICKERS
A1065: V.A.F.A. | C1065: MATTHEWS 5 | F1065: J BENNETT 2 | I1065: DAFF 2 | K1065: SHERWIN 2 | M1065: MURPHY 2 | O1065: STONE 2 | Q1065: JONES | S1065: JENNINGS | V1065: SIMONETTI
A1066: V.F.A. | C1066: FOTHERINGHAM 8 | G1066: MAILING 3 | I1066: BROWNE 2 | K1066: KAVANAGH 2 | N1066: ROBERTSON
A1068: 2ND DIVISION
A1069: V.F.A. | C1069: 3 | D1069: 5 | E1069: 23 | G1069: 7 | H1069: 11 | I1069: 53 | K1069: 9 | L1069: 13 | M1069: 67 | O1069: 17 | P1069: 19 | Q1069: 121 | S1069: VENUE: BEACH ROAD
A1070: S.A.F.A. | C1070: 1 | D1070: 4 | E1070: 10 | G1070: 4 | H1070: 7 | I1070: 31 | K1070: 5 | L1070: 10 | M1070: 40 | O1070: 8 | P1070: 14 | Q1070: 62 | S1070: ALLSOPP :STABB
A1071: BEST PLAYERS
A1072: V.F.A. | C1072: CADDAYE | F1072: PLUMB | I1072: WALSH | L1072: JIM CHRISTOU | O1072: SCULLY | R1072: MATTHEY
A1073: S.A.F.A. | C1073: GATOUDIS | F1073: McKAY | I1073: MUNN | L1073: DREW | O1073: GOBBIE | R1073: COLEMAN
A1074: GOALKICKERS
A1075: V.F.A. | C1075: CADDAYE 5 | F1075: WALSH 3 | H1075: NEARY 3 | J1075: JIM CHRISTOU | M1075: SAHLBERG | O1075: CONSTANTINOU | R1075: HIGGINS | U1075: BOLTON | X1075: PLUMB
A1076: S.A.F.A. | C1076: ECKBOLD 3 | F1076: MCLAY 2 | H1076: DREW | J1076: MARTIN | L1076: CAIRNS