A2: Victorian Football Association
A3: Season 1983 - Division Two
A4: © Copyright Wal Williams | F4: First created: 28 March 2016
A5: Contact: joywalwi at gmail dot com | F5: Last updated: 28 March 2016 | W5: VFA Results and tables - Link to the main index page
A6: You are free to copy this document in whole or part provided that proper acknowledgement is given to the author. All rights reserved.
A8: 1983 | C8: V.F.A. SEASON 2ND DIVISION
A9: ROUND 1 | E9: 3RD APRIL | J9: WEATHER | S9: PLAYED AT
D10: 1ST QTR | H10: 2ND QTR | L10: 3RD QTR | P10: FINAL | S10: OAKLEIGH
A11: OAKLEIGH | C11: 3 | D11: 3 | E11: =C10*6+D10 -> 21 | G11: 8 | H11: 8 | I11: =G10*6+H10 -> 56 | K11: 14 | L11: 17 | M11: =K10*6+L10 -> 101 | O11: 22 | P11: 18 | Q11: =O10*6+P10 -> 150 | S11: UMPIRE | X11: LADDER | AB11: ROUND | AD11: 1
A12: MORDIALLOC | C12: 6 | D12: 2 | E12: =C11*6+D11 -> 38 | G12: 10 | H12: 6 | I12: =G11*6+H11 -> 66 | K12: 12 | L12: 8 | M12: =K11*6+L11 -> 80 | O12: 18 | P12: 16 | Q12: =O11*6+P11 -> 124 | S12: TORNEY/GOLLOP
A13: BEST PLAYERS | W13: TEAM | X13: W | Y13: L | Z13: D | AA13: FOR | AB13: AGST | AC13: % | AD13: PTS
A14: OAKLEIGH | C14: ALLISEY | F14: MATTHEY | I14: CARTER | L14: LOWE | N14: McDONALD | Q14: ANSELL
A15: MORDIALLOC | C15: CLIFFORD | F15: DEATON | I15: WALSH | L15: MARGHERETI | W15: SPRINGVALE | X15: 1 | Y15: 0 | Z15: 0 | AA15: 260 | AB15: 67 | AC15: =(AA14*100)/AB14 -> 388.05970149253733 | AD15: =(X14*4)+(Z14*2) -> 4
A16: GOALKICKERS | W16: CAULFIELD | X16: 1 | Y16: 0 | Z16: 0 | AA16: 214 | AB16: 76 | AC16: =(AA15*100)/AB15 -> 281.57894736842104 | AD16: =(X15*4)+(Z15*2) -> 4
A17: OAKLEIGH | C17: NEARY 6 | F17: LOWE 5 | H17: CARTER 4 | J17: TODD 2 | L17: HARTLEY | N17: DILLON | P17: HARPER | R17: OWEN | S17: ANSELL | W17: BOX HILL | X17: 1 | Y17: 0 | Z17: 0 | AA17: 202 | AB17: 77 | AC17: =(AA16*100)/AB16 -> 262.33766233766232 | AD17: =(X16*4)+(Z16*2) -> 4
A18: MORDIALLOC | C18: NEVILLE 10 | F18: MARSHALL 3 | I18: O'HANLON 2 | L18: WALSH | N18: BROMLEY | Q18: PAGNOCCOLO | W18: BRUNSWICK | X18: 1 | Y18: 0 | Z18: 0 | AA18: 187 | AB18: 90 | AC18: =(AA17*100)/AB17 -> 207.77777777777777 | AD18: =(X17*4)+(Z17*2) -> 4
A20: NORTHCOTE | C20: 1 | D20: 1 | E20: =C19*6+D19 -> 7 | G20: 11 | H20: 3 | I20: =G19*6+H19 -> 69 | K20: 20 | L20: 6 | M20: =K19*6+L19 -> 126 | O20: 27 | P20: 12 | Q20: =O19*6+P19 -> 174 | S20: NORTHCOTE | W20: NORTHCOTE | X20: 1 | Y20: 0 | Z20: 0 | AA20: 174 | AB20: 136 | AC20: =(AA19*100)/AB19 -> 127.94117647058823 | AD20: =(X19*4)+(Z19*2) -> 4
A21: MOORABBIN | C21: 7 | D21: 3 | E21: =C20*6+D20 -> 45 | G21: 14 | H21: 4 | I21: =G20*6+H20 -> 88 | K21: 15 | L21: 8 | M21: =K20*6+L20 -> 98 | O21: 20 | P21: 16 | Q21: =O20*6+P20 -> 136 | S21: BLOOM | W21: OAKLEIGH | X21: 1 | Y21: 0 | Z21: 0 | AA21: 150 | AB21: 124 | AC21: =(AA20*100)/AB20 -> 120.96774193548387 | AD21: =(X20*4)+(Z20*2) -> 4
A22: BEST PLAYERS | S22: PHAIR | W22: MORDIALLOC | X22: 0 | Y22: 1 | Z22: 0 | AA22: 124 | AB22: 150 | AC22: =(AA21*100)/AB21 -> 82.666666666666671 | AD22: =(X21*4)+(Z21*2) -> 0
A23: NORTHCOTE | C23: ROULSTON | F23: JOHN CHRISTOU | J23: WALSH | L23: JIM CHRISTOU | O23: JURGENSTEIN | R23: COSMA | W23: MOORABBIN | X23: 0 | Y23: 1 | Z23: 0 | AA23: 136 | AB23: 174 | AC23: =(AA22*100)/AB22 -> 78.160919540229884 | AD23: =(X22*4)+(Z22*2) -> 0
A24: MOORABBIN | C24: D CATHCART | F24: JONES | I24: ATHERTON | L24: WELLS | N24: WILSON | W24: SUNSHINE | X24: 0 | Y24: 1 | Z24: 0 | AA24: 90 | AB24: 187 | AC24: =(AA23*100)/AB23 -> 48.128342245989302 | AD24: =(X23*4)+(Z23*2) -> 0
A25: GOALKICKERS | K25: GREGURIK | N25: MULQUEEN | Q25: ROULSTON | W25: BERWICK | X25: 0 | Y25: 1 | Z25: 0 | AA25: 77 | AB25: 202 | AC25: =(AA24*100)/AB24 -> 38.118811881188115 | AD25: =(X24*4)+(Z24*2) -> 0
A26: NORTHCOTE | C26: JIM CHRISTOU 6 | F26: WALSH 6 | H26: CEPPI 5 | J26: DUFF 2 | L26: JURGENSTEIN 2 | O26: COURTS | Q26: HARLAND | S26: MEGNA | W26: KILSYTH | X26: 0 | Y26: 1 | Z26: 0 | AA26: 76 | AB26: 214 | AC26: =(AA25*100)/AB25 -> 35.514018691588788 | AD26: =(X25*4)+(Z25*2) -> 0
A27: MOORABBIN | C27: WELLS 5 | E27: ATHERTON 4 | H27: COATES 2 | J27: HOLT 2 | L27: CAMERON | N27: MERCOULIA | Q27: CONSTANTINOU | T27: MARSHALL | W27: YARRAVILLE | X27: 0 | Y27: 1 | Z27: 0 | AA27: 67 | AB27: 260 | AC27: =(AA26*100)/AB26 -> 25.76923076923077 | AD27: =(X26*4)+(Z26*2) -> 0
L28: JONES | N28: POLLOCK | Q28: WILSON
A29: BRUNSWICK | C29: 7 | D29: 8 | E29: =C28*6+D28 -> 50 | G29: 13 | H29: 14 | I29: =G28*6+H28 -> 92 | K29: 22 | L29: 20 | M29: =K28*6+L28 -> 152 | O29: 27 | P29: 25 | Q29: =O28*6+P28 -> 187 | S29: SUNSHINE
A30: SUNSHINE | C30: 4 | D30: 2 | E30: =C29*6+D29 -> 26 | G30: 7 | H30: 4 | I30: =G29*6+H29 -> 46 | K30: 10 | L30: 5 | M30: =K29*6+L29 -> 65 | O30: 14 | P30: 6 | Q30: =O29*6+P29 -> 90 | S30: OAKLEY/MORGAN
A31: BEST PLAYERS
A32: BRUNSWICK | C32: SAHLBERG | F32: LYNCH | I32: BAKER | L32: CANNARD | O32: JUDGE | R32: M BROWN
A33: SUNSHINE | C33: B MENADUE | F33: N MENADUE | I33: HUNT | L33: WHITNEY | O33: WAGLAND
A34: GOALKICKERS
A35: BRUNSWICK | C35: M BROWN 8 | F35: LYNCH 4 | H35: CANNARD 4 | K35: SAHLBERG 3 | N35: LEAHY 3 | P35: NOLAN 2 | R35: SAGGERS 2 | T35: TOY
A36: SUNSHINE | C36: N MENADUE 5 | F36: WAGLAND 3 | I36: HUNT | K36: FOLEY | M36: CROSBIE | O36: PLANT | Q36: WILLIAMS
A38: BOX HILL | C38: 6 | D38: 6 | E38: =C37*6+D37 -> 42 | G38: 12 | H38: 10 | I38: =G37*6+H37 -> 82 | K38: 20 | L38: 13 | M38: =K37*6+L37 -> 133 | O38: 31 | P38: 16 | Q38: =O37*6+P37 -> 202 | S38: BOX HILL
A39: BERWICK | C39: 2 | D39: 2 | E39: =C38*6+D38 -> 14 | G39: 6 | H39: 4 | I39: =G38*6+H38 -> 40 | K39: 11 | L39: 8 | M39: =K38*6+L38 -> 74 | O39: 11 | P39: 11 | Q39: =O38*6+P38 -> 77 | S39: BREWER/HUTCHISON
A40: BEST PLAYERS
A41: BOX HILL | C41: DODD | E41: LAWTHER | H41: TOVEY | K41: S WITNISH | N41: DICKENSON | Q41: P WITNISH
A42: BERWICK | C42: ALLEN | E42: TRIGG | H42: SHEARS | K42: VENVILLE | N42: JOHNSON | Q42: LAITY
A43: GOALKICKERS
A44: BOX HILL | C44: LAWTHER 6 | F44: BOLTON 6 | H44: PARK 3 | J44: DICKENSON 3 | M44: KAINEY 3 | O44: TOVEY 2 | Q44: VARNEY 2 | S44: GLEESON 2 | V44: TAYLOR | X44: R WITNISH
A45: BERWICK | C45: ALLEN 3 | E45: JOHNSON 2 | H45: McGREAL | J45: McGILL | L45: CREBBIN | N45: BARNES | P45: MANNENS | R45: SMITH
A47: SPRINGVALE | C47: 8 | D47: 9 | E47: =C46*6+D46 -> 57 | G47: 13 | H47: 16 | I47: =G46*6+H46 -> 94 | K47: 22 | L47: 23 | M47: =K46*6+L46 -> 155 | O47: 39 | P47: 26 | Q47: =O46*6+P46 -> 260 | S47: NEWCOMEN RD
A48: YARRAVILLE | C48: 3 | D48: 0 | E48: =C47*6+D47 -> 18 | G48: 6 | H48: 7 | I48: =G47*6+H47 -> 43 | K48: 7 | L48: 11 | M48: =K47*6+L47 -> 53 | O48: 9 | P48: 13 | Q48: =O47*6+P47 -> 67 | S48: MAY/MARSHALL
A49: BEST PLAYERS
A50: SPRINGVALE | C50: GRAY | F50: COOKE | H50: T FOWLER | K50: DEMPSTER | N50: L FOWLER | Q50: ANDERSON
A51: YARRAVILLE | C51: MOLONEY | F51: TUPPEN | H51: ROGOTOWICZ | K51: WALSH
A52: GOALKICKERS
A53: SPRINGVALE | C53: MORRIS 9 | F53: COOKE 8 | H53: CADDAYE 5 | K53: T FOWLER 4 | N53: GRAY 3 | P53: ANDERSON 3 | S53: HOLDEN 2 | V53: L FOWLER 2 | X53: BLOOMFIELD | Z53: FOTINIOTIS | AB53: DICKSON
A54: YARRAVILLE | C54: HOUGH 3 | F54: WARD | H54: COUSINS | J54: DIMASI | L54: LOBAZZA | N54: WALSH | P54: ROGOTOWICZ
A56: CAULFIELD | C56: 6 | D56: 6 | E56: =C55*6+D55 -> 42 | G56: 17 | H56: 9 | I56: =G55*6+H55 -> 111 | K56: 21 | L56: 13 | M56: =K55*6+L55 -> 139 | O56: 33 | P56: 16 | Q56: =O55*6+P55 -> 214 | S56: PRINCES PARK, CAULFIELD
A57: KILSYTH | C57: 0 | D57: 4 | E57: =C56*6+D56 -> 4 | G57: 0 | H57: 7 | I57: =G56*6+H56 -> 7 | K57: 5 | L57: 12 | M57: =K56*6+L56 -> 42 | O57: 10 | P57: 16 | Q57: =O56*6+P56 -> 76 | S57: BRADSHAW/ELSUM
A58: BEST PLAYERS
A59: CAULFIELD | C59: BRASIER | F59: CROCKER | I59: CROOK | L59: SUTHERLAND | O59: HOFERT | R59: MORRISON
A60: KILSYTH | C60: BIANCO | F60: HODGES | I60: D'ANGELO | L60: TAPSCOTT | O60: JONES | R60: McELAINE
A61: GOALKICKERS
A62: CAULFIELD | C62: CROOK 7 | E62: DOYLE 5 | G62: BOOTH 4 | I62: SUTHERLAND 4 | L62: GLAZEBROOK 4 | O62: STEWART 3 | R62: HOFERT 2 | T62: SLOMIRN 2 | W62: CROCKER | X62: AMBLER
A63: KILSYTH | C63: JONES 2 | E63: CARPI 2 | G63: McELAINE | I63: LETTS | K63: SCHUERMAN | N63: PRICE | P63: HALBERT | R63: SCHNEIDER
A65: ROUND 2 | E65: 10TH APRIL | J65: WEATHER | S65: PLAYED AT
D66: 1ST QTR | H66: 2ND QTR | L66: 3RD QTR | P66: FINAL | S66: BENTLEIGH
A67: SPRINGVALE | C67: 6 | D67: 2 | E67: =C67*6+D67 -> 38 | G67: 9 | H67: 4 | I67: =G67*6+H67 -> 58 | K67: 12 | L67: 13 | M67: =K67*6+L67 -> 85 | O67: 15 | P67: 15 | Q67: =O67*6+P67 -> 105 | S67: UMPIRE | X67: LADDER | AB67: ROUND | AD67: 2
A68: MOORABBIN | C68: 5 | D68: 2 | E68: =C68*6+D68 -> 32 | G68: 7 | H68: 5 | I68: =G68*6+H68 -> 47 | K68: 9 | L68: 5 | M68: =K68*6+L68 -> 59 | O68: 14 | P68: 9 | Q68: =O68*6+P68 -> 93 | S68: CASEY/BREWER
A69: BEST PLAYERS | W69: TEAM | X69: W | Y69: L | Z69: D | AA69: FOR | AB69: AGST | AC69: % | AD69: PTS
A70: SPRINGVALE | C70: DEMPSTER | F70: CADDAYE | I70: SMITH | L70: STEEL | O70: HOLDEN | R70: DICKSON
A71: MOORABBIN | C71: WELLS | F71: CONSTSNTINOU | I71: WILSON | L71: MERCOULIA | O71: STEWART | R71: JONES | W71: BOX HILL | X71: 2 | Y71: 0 | Z71: 0 | AA71: 347 | AB71: 101 | AC71: =(AA71*100)/AB71 -> 343.56435643564356 | AD71: =(X71*4)+(Z71*2) -> 8
A72: GOALKICKERS | W72: SPRINGVALE | X72: 2 | Y72: 0 | Z72: 0 | AA72: 365 | AB72: 160 | AC72: =(AA72*100)/AB72 -> 228.125 | AD72: =(X72*4)+(Z72*2) -> 8
A73: SPRINGVALE | C73: CADDAYE 6 | F73: STEEL 4 | H73: ANDERSON 2 | K73: MORRIS | M73: L FOWLER | O73: T FOWLER | W73: OAKLEIGH | X73: 2 | Y73: 0 | Z73: 0 | AA73: 290 | AB73: 174 | AC73: =(AA73*100)/AB73 -> 166.66666666666666 | AD73: =(X73*4)+(Z73*2) -> 8
A74: MOORABBIN | C74: WELLS 4 | E74: CONSTANTINOU 3 | I74: B CATHCART 3 | L74: ATHERTON | N74: D CATHCART | Q74: WILSON | S74: O'FARRELL | W74: BRUNSWICK | X74: 2 | Y74: 0 | Z74: 0 | AA74: 308 | AB74: 192 | AC74: =(AA74*100)/AB74 -> 160.41666666666666 | AD74: =(X74*4)+(Z74*2) -> 8
A76: BRUNSWICK | C76: 4 | D76: 6 | E76: =C76*6+D76 -> 30 | G76: 9 | H76: 10 | I76: =G76*6+H76 -> 64 | K76: 17 | L76: 14 | M76: =K76*6+L76 -> 116 | O76: 17 | P76: 19 | Q76: =O76*6+P76 -> 121 | S76: BRUNSWICK | W76: MORDIALLOC | X76: 1 | Y76: 1 | Z76: 0 | AA76: 343 | AB76: 189 | AC76: =(AA76*100)/AB76 -> 181.4814814814815 | AD76: =(X76*4)+(Z76*2) -> 4
A77: CAULFIELD | C77: 3 | D77: 3 | E77: =C77*6+D77 -> 21 | G77: 9 | H77: 6 | I77: =G77*6+H77 -> 60 | K77: 11 | L77: 9 | M77: =K77*6+L77 -> 75 | O77: 15 | P77: 12 | Q77: =O77*6+P77 -> 102 | S77: TORNEY | W77: CAULFIELD | X77: 1 | Y77: 1 | Z77: 0 | AA77: 316 | AB77: 197 | AC77: =(AA77*100)/AB77 -> 160.40609137055839 | AD77: =(X77*4)+(Z77*2) -> 4
A78: BEST PLAYERS | S78: ALLSOP | W78: NORTHCOTE | X78: 1 | Y78: 1 | Z78: 0 | AA78: 268 | AB78: 255 | AC78: =(AA78*100)/AB78 -> 105.09803921568627 | AD78: =(X78*4)+(Z78*2) -> 4
A79: BRUNSWICK | C79: SAHLBERG | F79: BAKER | I79: LAWSON | L79: BROWN | N79: LEAHY | Q79: SCULLY | W79: KILSYTH | X79: 1 | Y79: 1 | Z79: 0 | AA79: 195 | AB79: 308 | AC79: =(AA79*100)/AB79 -> 63.311688311688314 | AD79: =(X79*4)+(Z79*2) -> 4
A80: CAULFIELD | C80: EINSEDEL | F80: HOGAN | I80: TUCKWELL | L80: BRASIER | N80: FARINSKI | Q80: CROCKER | W80: MOORABBIN | X80: 0 | Y80: 2 | Z80: 0 | AA80: 229 | AB80: 279 | AC80: =(AA80*100)/AB80 -> 82.078853046594986 | AD80: =(X80*4)+(Z80*2) -> 0
A81: GOALKICKERS | P81: B SAGGERS | W81: BERWICK | X81: 0 | Y81: 2 | Z81: 0 | AA81: 127 | AB81: 342 | AC81: =(AA81*100)/AB81 -> 37.134502923976605 | AD81: =(X81*4)+(Z81*2) -> 0
A82: BRUNSWICK | C82: HICKMAN 3 | F82: LEAHY 3 | H82: JUDGE 3 | J82: SAHLBERG 2 | M82: LYNCH 2 | O82: LAWSON 2 | R82: HAMILTON | W82: SUNSHINE | X82: 0 | Y82: 2 | Z82: 0 | AA82: 129 | AB82: 406 | AC82: =(AA82*100)/AB82 -> 31.773399014778324 | AD82: =(X82*4)+(Z82*2) -> 0
A83: CAULFIELD | C83: CROCKER 5 | F83: STEWART 5 | I83: GLAZEBROOK 3 | L83: BOOTH | N83: HOFERT | W83: YARRAVILLE | X83: 0 | Y83: 2 | Z83: 0 | AA83: 91 | AB83: 405 | AC83: =(AA83*100)/AB83 -> 22.469135802469136 | AD83: =(X83*4)+(Z83*2) -> 0
A85: BOX HILL | C85: 3 | D85: 3 | E85: =C85*6+D85 -> 21 | G85: 11 | H85: 12 | I85: =G85*6+H85 -> 78 | K85: 14 | L85: 16 | M85: =K85*6+L85 -> 100 | O85: 20 | P85: 25 | Q85: =O85*6+P85 -> 145 | S85: YARRAVILLE
A86: YARRAVILLE | C86: 1 | D86: 2 | E86: =C86*6+D86 -> 8 | G86: 1 | H86: 2 | I86: =G86*6+H86 -> 8 | K86: 3 | L86: 4 | M86: =K86*6+L86 -> 22 | O86: 3 | P86: 6 | Q86: =O86*6+P86 -> 24 | S86: BLOOM/MORGAN
A87: BEST PLAYERS
A88: BOX HILL
A89: YARRAVILLE | C89: WARD | F89: MOON | I89: HOUGH | L89: COUSINS | O89: ROGOZIK | R89: MARTIN
A90: GOALKICKERS
A91: BOX HILL | C91: BOLTON 9 | F91: CRUSE 2 | H91: KAINEY 2 | J91: SCHADE 2 | L91: GLEESON | N91: LAWTHER | P91: PARK | R91: VARNEY | T91: R WITNISH
A92: YARRAVILLE | C92: HOUGH 2 | F92: SPROULE
A94: KILSYTH | C94: 6 | D94: 4 | E94: =C94*6+D94 -> 40 | G94: 10 | H94: 6 | I94: =G94*6+H94 -> 66 | K94: 15 | L94: 14 | M94: =K94*6+L94 -> 104 | O94: 17 | P94: 17 | Q94: =O94*6+P94 -> 119 | S94: KILSYTH
A95: NORTHCOTE | C95: 3 | D95: 2 | E95: =C95*6+D95 -> 20 | G95: 6 | H95: 5 | I95: =G95*6+H95 -> 41 | K95: 7 | L95: 9 | M95: =K95*6+L95 -> 51 | O95: 14 | P95: 10 | Q95: =O95*6+P95 -> 94 | S95: HUTCHISON/MARSHALL
A96: BEST PLAYERS
A97: KILSYTH | C97: BIANCO | F97: WILSON | I97: CARROLL | L97: TAPSCOTT | O97: LETTS | R97: HODGES
A98: NORTHCOTE | C98: HYDE | F98: CUFF | I98: JOHN CHRISTOU | L98: JIM CHRISTOU | O98: JURGENSTEIN
A99: GOALKICKERS
A100: KILSYTH | C100: CARROLL 5 | F100: CEPPI 4 | H100: GIBB 3 | J100: LETTS 2 | L100: JONES | N100: BIANCO | P100: HODGES
A101: NORTHCOTE | C101: JURGENSTEIN 4 | F101: JIM CHRISTOU 4 | J101: HYDE 2 | L101: JOHN CHRISTOU | O101: LETTS | Q101: CUFF | S101: GREGURIC
A103: MORDIALLOC | C103: 9 | D103: 5 | E103: =C103*6+D103 -> 59 | G103: 16 | H103: 10 | I103: =G103*6+H103 -> 106 | K103: 24 | L103: 13 | M103: =K103*6+L103 -> 157 | O103: 33 | P103: 21 | Q103: =O103*6+P103 -> 219 | S103: MORDIALLOC
A104: SUNSHINE | C104: 2 | D104: 0 | E104: =C104*6+D104 -> 12 | G104: 3 | H104: 2 | I104: =G104*6+H104 -> 20 | K104: 6 | L104: 3 | M104: =K104*6+L104 -> 39 | O104: 6 | P104: 3 | Q104: =O104*6+P104 -> 39 | S104: STEERE/THOMSON
A105: BEST PLAYERS
A106: MORDIALLOC | C106: NEVILLE | F106: BROMLEY | I106: CLIFFORD | L106: PRENTIS | O106: SUMMERIN
A107: SUNSHINE | C107: MENADUE | F107: WHITNEY | I107: CAMPBELL | L107: WILLIAMS | O107: HUNT
A108: GOALKICKERS
A109: MORDIALLOC | C109: NEVILLE 11 | F109: O'HANLON 4 | I109: DE MUNK 4 | K109: BROMLEY 4 | N109: PAGNOCCOLO 3 | Q109: DEATON 2 | S109: PRENTICE | U109: MASON | W109: MARSHALL | X109: JEFFS | Y109: HANCOCK
A110: SUNSHINE | C110: MENADUE 2 | F110: WILGERS | I110: WILLIAMS | L110: HUNT | N110: FOLEY
A112: OAKLEIGH | C112: 4 | D112: 5 | E112: =C112*6+D112 -> 29 | G112: 10 | H112: 10 | I112: =G112*6+H112 -> 70 | K112: 14 | L112: 12 | M112: =K112*6+L112 -> 96 | O112: 20 | P112: 20 | Q112: =O112*6+P112 -> 140 | S112: BERWICK
A113: BERWICK | C113: 0 | D113: 3 | E113: =C113*6+D113 -> 3 | G113: 2 | H113: 4 | I113: =G113*6+H113 -> 16 | K113: 3 | L113: 12 | M113: =K113*6+L113 -> 30 | O113: 6 | P113: 14 | Q113: =O113*6+P113 -> 50 | S113: BRADSHAW/MAY
A114: BEST PLAYERS
A115: OAKLEIGH
A116: BERWICK | C116: JOHNSON | F116: VENVILLE | I116: WARD | K116: SHEARS | N116: TRIGG | P116: CARVERY
A117: GOALKICKERS
A118: OAKLEIGH | C118: ? 5 | F118: OWEN 5 | H118: LOWE 2 | J118: COLLINS 2 | M118: AERTSSEN 2 | P118: GREENWOOD | S118: ?? | U118: HARPER | W118: NEARY
A119: BERWICK | C119: VENVILLE 2 | F119: TRIGG | H119: Mc? | J119: ?? | M119: CARVERY
A121: ROUND 3 | E121: 17TH APRIL | J121: WEATHER | S121: PLAYED AT
D122: 1ST QTR | H122: 2ND QTR | L122: 3RD QTR | P122: FINAL | S122: PRINCES PARK, CAULFIELD
A123: CAULFIELD | C123: 0 | D123: 0 | E123: =C123*6+D123 -> 0 | G123: 0 | H123: 0 | I123: =G123*6+H123 -> 0 | K123: 0 | L123: 0 | M123: =K123*6+L123 -> 0 | O123: 23 | P123: 16 | Q123: =O123*6+P123 -> 154 | S123: UMPIRE | X123: LADDER | AB123: ROUND | AD123: 3
A124: MORDIALLOC | C124: 2 | D124: 0 | E124: =C124*6+D124 -> 12 | G124: 0 | H124: 0 | I124: =G124*6+H124 -> 0 | K124: 0 | L124: 0 | M124: =K124*6+L124 -> 0 | O124: 13 | P124: 20 | Q124: =O124*6+P124 -> 98
A125: BEST PLAYERS | W125: TEAM | X125: W | Y125: L | Z125: D | AA125: FOR | AB125: AGST | AC125: % | AD125: PTS
A126: CAULFIELD
A127: MORDIALLOC | W127: BOX HILL | X127: 3 | Y127: 0 | Z127: 0 | AA127: 503 | AB127: 177 | AC127: =(AA127*100)/AB127 -> 284.18079096045199 | AD127: =(X127*4)+(Z127*2) -> 12
A128: GOALKICKERS | W128: BRUNSWICK | X128: 3 | Y128: 0 | Z128: 0 | AA128: 506 | AB128: 258 | AC128: =(AA128*100)/AB128 -> 196.12403100775194 | AD128: =(X128*4)+(Z128*2) -> 12
A129: CAULFIELD | W129: OAKLEIGH | X129: 3 | Y129: 0 | Z129: 0 | AA129: 476 | AB129: 245 | AC129: =(AA129*100)/AB129 -> 194.28571428571428 | AD129: =(X129*4)+(Z129*2) -> 12
A130: MORDIALLOC | W130: SPRINGVALE | X130: 3 | Y130: 0 | Z130: 0 | AA130: 508 | AB130: 286 | AC130: =(AA130*100)/AB130 -> 177.62237762237763 | AD130: =(X130*4)+(Z130*2) -> 12
A132: BOX HILL | C132: 0 | D132: 0 | E132: =C132*6+D132 -> 0 | G132: 0 | H132: 0 | I132: =G132*6+H132 -> 0 | K132: 0 | L132: 0 | M132: =K132*6+L132 -> 0 | O132: 22 | P132: 24 | Q132: =O132*6+P132 -> 156 | S132: BOX HILL | W132: CAULFIELD | X132: 2 | Y132: 1 | Z132: 0 | AA132: 470 | AB132: 295 | AC132: =(AA132*100)/AB132 -> 159.32203389830508 | AD132: =(X132*4)+(Z132*2) -> 8
A133: MOORABBIN | C133: 0 | D133: 0 | E133: =C133*6+D133 -> 0 | G133: 0 | H133: 0 | I133: =G133*6+H133 -> 0 | K133: 0 | L133: 0 | M133: =K133*6+L133 -> 0 | O133: 11 | P133: 10 | Q133: =O133*6+P133 -> 76 | W133: MORDIALLOC | X133: 1 | Y133: 2 | Z133: 0 | AA133: 441 | AB133: 343 | AC133: =(AA133*100)/AB133 -> 128.57142857142858 | AD133: =(X133*4)+(Z133*2) -> 4
A134: BEST PLAYERS | W134: NORTHCOTE | X134: 1 | Y134: 2 | Z134: 0 | AA134: 396 | AB134: 398 | AC134: =(AA134*100)/AB134 -> 99.497487437185924 | AD134: =(X134*4)+(Z134*2) -> 4
A135: BOX HILL | W135: KILSYTH | X135: 1 | Y135: 2 | Z135: 0 | AA135: 261 | AB135: 506 | AC135: =(AA135*100)/AB135 -> 51.581027667984188 | AD135: =(X135*4)+(Z135*2) -> 4
A136: MOORABBIN | W136: SUNSHINE | X136: 1 | Y136: 2 | Z136: 0 | AA136: 245 | AB136: 504 | AC136: =(AA136*100)/AB136 -> 48.611111111111114 | AD136: =(X136*4)+(Z136*2) -> 4
A137: GOALKICKERS | W137: MOORABBIN | X137: 0 | Y137: 3 | Z137: 0 | AA137: 305 | AB137: 435 | AC137: =(AA137*100)/AB137 -> 70.114942528735625 | AD137: =(X137*4)+(Z137*2) -> 0
A138: BOX HILL | W138: BERWICK | X138: 0 | Y138: 3 | Z138: 0 | AA138: 225 | AB138: 458 | AC138: =(AA138*100)/AB138 -> 49.126637554585152 | AD138: =(X138*4)+(Z138*2) -> 0
A139: MOORABBIN | W139: YARRAVILLE | X139: 0 | Y139: 3 | Z139: 0 | AA139: 162 | AB139: 591 | AC139: =(AA139*100)/AB139 -> 27.411167512690355 | AD139: =(X139*4)+(Z139*2) -> 0
A141: SUNSHINE | C141: 0 | D141: 0 | E141: =C141*6+D141 -> 0 | G141: 0 | H141: 0 | I141: =G141*6+H141 -> 0 | K141: 0 | L141: 0 | M141: =K141*6+L141 -> 0 | O141: 17 | P141: 14 | Q141: =O141*6+P141 -> 116 | S141: SUNSHINE
A142: BERWICK | C142: 0 | D142: 0 | E142: =C142*6+D142 -> 0 | G142: 0 | H142: 0 | I142: =G142*6+H142 -> 0 | K142: 0 | L142: 0 | M142: =K142*6+L142 -> 0 | O142: 15 | P142: 8 | Q142: =O142*6+P142 -> 98
A143: BEST PLAYERS
A144: SUNSHINE
A145: BERWICK
A146: GOALKICKERS
A147: SUNSHINE
A148: BERWICK
A150: SPRINGVALE | C150: 0 | D150: 0 | E150: =C150*6+D150 -> 0 | G150: 0 | H150: 0 | I150: =G150*6+H150 -> 0 | K150: 0 | L150: 0 | M150: =K150*6+L150 -> 0 | O150: 22 | P150: 11 | Q150: =O150*6+P150 -> 143 | S150: NEWCOMEN RD
A151: NORTHCOTE | C151: 0 | D151: 0 | E151: =C151*6+D151 -> 0 | G151: 0 | H151: 0 | I151: =G151*6+H151 -> 0 | K151: 0 | L151: 0 | M151: =K151*6+L151 -> 0 | O151: 18 | P151: 18 | Q151: =O151*6+P151 -> 126
A152: BEST PLAYERS
A153: SPRINGVALE
A154: NORTHCOTE
A155: GOALKICKERS
A156: SPRINGVALE
A157: NORTHCOTE
A159: OAKLEIGH | C159: 0 | D159: 0 | E159: =C159*6+D159 -> 0 | G159: 0 | H159: 0 | I159: =G159*6+H159 -> 0 | K159: 0 | L159: 0 | M159: =K159*6+L159 -> 0 | O159: 26 | P159: 30 | Q159: =O159*6+P159 -> 186 | S159: OAKLEIGH
A160: YARRAVILLE | C160: 0 | D160: 0 | E160: =C160*6+D160 -> 0 | G160: 0 | H160: 0 | I160: =G160*6+H160 -> 0 | K160: 0 | L160: 0 | M160: =K160*6+L160 -> 0 | O160: 10 | P160: 11 | Q160: =O160*6+P160 -> 71
A161: BEST PLAYERS
A162: OAKLEIGH
A163: YARRAVILLE
A164: GOALKICKERS
A165: OAKLEIGH
A166: YARRAVILLE
A168: BRUNSWICK | C168: 0 | D168: 0 | E168: =C168*6+D168 -> 0 | G168: 0 | H168: 0 | I168: =G168*6+H168 -> 0 | K168: 0 | L168: 0 | M168: =K168*6+L168 -> 0 | O168: 31 | P168: 12 | Q168: =O168*6+P168 -> 198 | S168: BRUNSWICK
A169: KILSYTH | C169: 0 | D169: 0 | E169: =C169*6+D169 -> 0 | G169: 0 | H169: 0 | I169: =G169*6+H169 -> 0 | K169: 0 | L169: 0 | M169: =K169*6+L169 -> 0 | O169: 9 | P169: 12 | Q169: =O169*6+P169 -> 66
A170: BEST PLAYERS
A171: BRUNSWICK
A172: KILSYTH
A173: GOALKICKERS
A174: BRUNSWICK
A175: KILSYTH
A177: ROUND 4 | E177: 24TH APRIL | J177: WEATHER | S177: PLAYED AT
D178: 1ST QTR | H178: 2ND QTR | L178: 3RD QTR | P178: FINAL | S178: BENTLEIGH
A179: MOORABBIN | C179: 3 | D179: 1 | E179: =C179*6+D179 -> 19 | G179: 13 | H179: 5 | I179: =G179*6+H179 -> 83 | K179: 20 | L179: 7 | M179: =K179*6+L179 -> 127 | O179: 23 | P179: 11 | Q179: =O179*6+P179 -> 149 | S179: UMPIRE | X179: LADDER | AB179: ROUND | AD179: 4
A180: OAKLEIGH | C180: 4 | D180: 4 | E180: =C180*6+D180 -> 28 | G180: 6 | H180: 9 | I180: =G180*6+H180 -> 45 | K180: 11 | L180: 13 | M180: =K180*6+L180 -> 79 | O180: 15 | P180: 17 | Q180: =O180*6+P180 -> 107 | S180: STABB/FITZPATRICK
A181: BEST PLAYERS | W181: TEAM | X181: W | Y181: L | Z181: D | AA181: FOR | AB181: AGST | AC181: % | AD181: PTS
A182: MOORABBIN | C182: STEWART | F182: WELLS | I182: KNIGHT | L182: LAZZARO | O182: HARDEMAN | R182: ATHERTON
A183: OAKLEIGH | C183: NEARY | F183: BATTERSBY | I183: MATTHEY | L183: SPLATT | O183: McDONALD | W183: SPRINGVALE | X183: 4 | Y183: 0 | Z183: 0 | AA183: 689 | AB183: 387 | AC183: =(AA183*100)/AB183 -> 178.03617571059431 | AD183: =(X183*4)+(Z183*2) -> 16
A184: GOALKICKERS | P184: O'KEEFE | W184: BOX HILL | X184: 3 | Y184: 1 | Z184: 0 | AA184: 608 | AB184: 298 | AC184: =(AA184*100)/AB184 -> 204.0268456375839 | AD184: =(X184*4)+(Z184*2) -> 12
A185: MOORABBIN | C185: KNIGHT 6 | F185: MARSHALL 5 | I185: O'FARRELL 4 | K185: WELLS 2 | M185: STEWART 2 | O185: ATHERTON | R185: WILSON | T185: DERRICK | W185: BRUNSWICK | X185: 3 | Y185: 1 | Z185: 0 | AA185: 613 | AB185: 376 | AC185: =(AA185*100)/AB185 -> 163.03191489361703 | AD185: =(X185*4)+(Z185*2) -> 12
A186: OAKLEIGH | C186: NEARY 6 | F186: LOWE 2 | H186: OWEN 2 | J186: MATTHEY | L186: TODD | N186: CARTER | P186: ANSELL | R186: ROACH | W186: CAULFIELD | X186: 3 | Y186: 1 | Z186: 0 | AA186: 569 | AB186: 377 | AC186: =(AA186*100)/AB186 -> 150.92838196286473 | AD186: =(X186*4)+(Z186*2) -> 12
A188: CAULFIELD | C188: 6 | D188: 3 | E188: =C188*6+D188 -> 39 | G188: 9 | H188: 8 | I188: =G188*6+H188 -> 62 | K188: 13 | L188: 14 | M188: =K188*6+L188 -> 92 | O188: 14 | P188: 15 | Q188: =O188*6+P188 -> 99 | S188: PRINCES PARK, CAULFIELD | W188: OAKLEIGH | X188: 3 | Y188: 1 | Z188: 0 | AA188: 583 | AB188: 394 | AC188: =(AA188*100)/AB188 -> 147.96954314720813 | AD188: =(X188*4)+(Z188*2) -> 12
A189: BERWICK | C189: 2 | D189: 3 | E189: =C189*6+D189 -> 15 | G189: 5 | H189: 4 | I189: =G189*6+H189 -> 34 | K189: 6 | L189: 7 | M189: =K189*6+L189 -> 43 | O189: 11 | P189: 16 | Q189: =O189*6+P189 -> 82 | S189: STEERE | W189: MORDIALLOC | X189: 2 | Y189: 2 | Z189: 0 | AA189: 559 | AB189: 450 | AC189: =(AA189*100)/AB189 -> 124.22222222222223 | AD189: =(X189*4)+(Z189*2) -> 8
A190: BEST PLAYERS | S190: OAKLEY | W190: NORTHCOTE | X190: 2 | Y190: 2 | Z190: 0 | AA190: 517 | AB190: 503 | AC190: =(AA190*100)/AB190 -> 102.78330019880715 | AD190: =(X190*4)+(Z190*2) -> 8
A191: CAULFIELD | C191: EINSEDEL | F191: DAWSON | I191: MCLEOD | L191: FAWCETT | O191: STEWART | R191: FARINSKI | W191: SUNSHINE | X191: 2 | Y191: 2 | Z191: 0 | AA191: 402 | AB191: 575 | AC191: =(AA191*100)/AB191 -> 69.913043478260875 | AD191: =(X191*4)+(Z191*2) -> 8
A192: BERWICK | C192: JOHNSON | F192: SHEARS | I192: ALLEN | L192: CREBBIN | O192: GAMBETTA | R192: LUXFORD | W192: MOORABBIN | X192: 1 | Y192: 3 | Z192: 0 | AA192: 454 | AB192: 542 | AC192: =(AA192*100)/AB192 -> 83.763837638376387 | AD192: =(X192*4)+(Z192*2) -> 4
A193: GOALKICKERS | W193: KILSYTH | X193: 1 | Y193: 3 | Z193: 0 | AA193: 362 | AB193: 687 | AC193: =(AA193*100)/AB193 -> 52.692867540029113 | AD193: =(X193*4)+(Z193*2) -> 4
A194: CAULFIELD | C194: McLEOD 5 | F194: BOOTH 3 | H194: STEWART 3 | K194: GLAZEBROOK | N194: CROCKER | P194: FITCHETT | W194: BERWICK | X194: 0 | Y194: 4 | Z194: 0 | AA194: 307 | AB194: 557 | AC194: =(AA194*100)/AB194 -> 55.11669658886894 | AD194: =(X194*4)+(Z194*2) -> 0
A195: BERWICK | C195: ALGERS 3 | F195: HODDER 3 | I195: McGILL 2 | K195: CREBBIN | M195: ALLEN | O195: SMITH | W195: YARRAVILLE | X195: 0 | Y195: 4 | Z195: 0 | AA195: 233 | AB195: 748 | AC195: =(AA195*100)/AB195 -> 31.149732620320854 | AD195: =(X195*4)+(Z195*2) -> 0
A197: SUNSHINE | C197: 5 | D197: 3 | E197: =C197*6+D197 -> 33 | G197: 12 | H197: 4 | I197: =G197*6+H197 -> 76 | K197: 20 | L197: 4 | M197: =K197*6+L197 -> 124 | O197: 25 | P197: 7 | Q197: =O197*6+P197 -> 157 | S197: SUNSHINE
A198: YARRAVILLE | C198: 3 | D198: 1 | E198: =C198*6+D198 -> 19 | G198: 5 | H198: 4 | I198: =G198*6+H198 -> 34 | K198: 8 | L198: 7 | M198: =K198*6+L198 -> 55 | O198: 10 | P198: 11 | Q198: =O198*6+P198 -> 71 | S198: RYAN/GOLLOP
A199: BEST PLAYERS
A200: SUNSHINE | C200: WHITNEY | F200: CROSBIE | I200: BARLOW | L200: HALL | N200: M WILLIAMS | Q200: WAGLAND
A201: YARRAVILLE | C201: WARD | F201: MOON | I201: KING | L201: MOONEY | N201: DIMASI | Q201: MARTIN
A202: GOALKICKERS
A203: SUNSHINE | C203: CROSBIE 7 | F203: WAGLAND 6 | I203: N MENADUE 4 | L203: BARLOW 2 | N203: VADJANAL 2 | Q203: M WILLIAMS | T203: MULLENGER | W203: HALL
A204: YARRAVILLE | C204: HOUGH 3 | F204: DIMASI 3 | I204: ROGOTOWICZ | L204: FENNELL | N204: O'DONNELL | Q204: TUPPEN
E205: 1ST MAY | J205: WEATHER
A206: NORTHCOTE | C206: 4 | D206: 3 | E206: =C206*6+D206 -> 27 | G206: 8 | H206: 7 | I206: =G206*6+H206 -> 55 | K206: 13 | L206: 14 | M206: =K206*6+L206 -> 92 | O206: 17 | P206: 19 | Q206: =O206*6+P206 -> 121 | S206: NORTHCOTE
A207: BOX HILL | C207: 6 | D207: 4 | E207: =C207*6+D207 -> 40 | G207: 11 | H207: 6 | I207: =G207*6+H207 -> 72 | K207: 14 | L207: 8 | M207: =K207*6+L207 -> 92 | O207: 15 | P207: 15 | Q207: =O207*6+P207 -> 105 | S207: GROOM/OGSTON
A208: BEST PLAYERS
A209: NORTHCOTE | C209: McQUINN | F209: MINNETT | I209: COSMA | L209: HARLAND | O209: JOHN CHRISTOU | S209: RYAN
A210: BOX HILL | C210: S WITNISH | F210: DODD | I210: R WITNISH | L210: HEDGER | O210: TOVEY | S210: CHARLES
A211: GOALKICKERS | Q211: CEPPI | S211: ROULSTON
A212: NORTHCOTE | C212: MEGNA 2 | E212: WALSH 2 | G212: MULQUEEN 2 | J212: JURGENSTEIN 2 | M212: MINETT | O212: ARMSTRONG | R212: HARLAND | T212: JIM CHRISTOU | W212: McQUINN | X212: CASTAGNINI | Z212: SMITH
A213: BOX HILL | C213: BOLTON 4 | F213: HEDGER 3 | H213: KAINEY 2 | J213: SCHADE 2 | L213: GLEESON | N213: CRUSE | P213: NICHOLSON | S213: PARK
A215: MORDIALLOC | C215: 3 | D215: 5 | E215: =C215*6+D215 -> 23 | G215: 6 | H215: 9 | I215: =G215*6+H215 -> 45 | K215: 13 | L215: 11 | M215: =K215*6+L215 -> 89 | O215: 17 | P215: 16 | Q215: =O215*6+P215 -> 118 | S215: MORDIALLOC
A216: BRUNSWICK | C216: 5 | D216: 6 | E216: =C216*6+D216 -> 36 | G216: 7 | H216: 12 | I216: =G216*6+H216 -> 54 | K216: 11 | L216: 16 | M216: =K216*6+L216 -> 82 | O216: 14 | P216: 23 | Q216: =O216*6+P216 -> 107 | S216: MARCY/VERGONA
A217: BEST PLAYERS
A218: MORDIALLOC | C218: DEATON | F218: CLIFFORD | I218: PRENTIS | L218: NORMAN | O218: NEVILLE
A219: BRUNSWICK | C219: LEAHY | F219: McGHIE | I219: SCULLY | L219: SAGGERS | O219: SAHLBERG | R219: NOLAN
A220: GOALKICKERS
A221: MORDIALLOC | C221: NEVILLE 6 | F221: DEATON 5 | I221: MARSHALL 3 | L221: NORMAN 2 | O221: O'HANLON
A222: BRUNSWICK | C222: LEAHY 5 | F222: JUDGE 3 | H222: GUMBLETON 2 | K222: SAHLBERG 2 | N222: TOY | P222: LYNCH
A224: SPRINGVALE | C224: 5 | D224: 1 | E224: =C224*6+D224 -> 31 | G224: 10 | H224: 5 | I224: =G224*6+H224 -> 65 | K224: 18 | L224: 12 | M224: =K224*6+L224 -> 120 | O224: 27 | P224: 19 | Q224: =O224*6+P224 -> 181 | S224: KILSYTH
A225: KILSYTH | C225: 3 | D225: 4 | E225: =C225*6+D225 -> 22 | G225: 7 | H225: 6 | I225: =G225*6+H225 -> 48 | K225: 8 | L225: 9 | M225: =K225*6+L225 -> 57 | O225: 15 | P225: 11 | Q225: =O225*6+P225 -> 101 | S225: BUDGE/ALLSOP
A226: BEST PLAYERS
A227: SPRINGVALE | C227: JOB | E227: STEEL | G227: HOLDEN | I227: BLOOMFIELD | L227: COLLINS | O227: SMITH
A228: KILSYTH | C228: CARROLL | F228: BONAFIDINI | I228: SCHNEIDER | L228: HALBERT | O228: D'ANGELO | R228: JONES
A229: GOALKICKERS
A230: SPRINGVALE | C230: STEEL 7 | E230: CADDAYE 4 | G230: HOLDEN 4 | I230: ANDERSON 3 | L230: GRAY 3 | N230: FOWLER 2 | P230: COOKE | R230: SKEWS | T230: BLOOMFIELD | W230: DICKSON
A231: KILSYTH | C231: CARROLL 5 | F231: LETTS 3 | H231: CEPPI 2 | J231: WARD 2 | L231: D'ANGELO | N231: BASS | P231: TAYLOR
A233: ROUND 5 | E233: 8TH MAY | J233: WEATHER | S233: PLAYED AT
D234: 1ST QTR | H234: 2ND QTR | L234: 3RD QTR | P234: FINAL | S234: OAKLEIGH
A235: OAKLEIGH | C235: 8 | D235: 5 | E235: =C235*6+D235 -> 53 | G235: 13 | H235: 10 | I235: =G235*6+H235 -> 88 | K235: 16 | L235: 12 | M235: =K235*6+L235 -> 108 | O235: 25 | P235: 18 | Q235: =O235*6+P235 -> 168 | S235: UMPIRE | X235: LADDER | AB235: ROUND | AD235: 5
A236: NORTHCOTE | C236: 3 | D236: 2 | E236: =C236*6+D236 -> 20 | G236: 7 | H236: 3 | I236: =G236*6+H236 -> 45 | K236: 13 | L236: 4 | M236: =K236*6+L236 -> 82 | O236: 14 | P236: 5 | Q236: =O236*6+P236 -> 89 | S236: VERGONA/CASEY
A237: BEST PLAYERS | W237: TEAM | X237: W | Y237: L | Z237: D | AA237: FOR | AB237: AGST | AC237: % | AD237: PTS
A238: OAKLEIGH | C238: PLUMB | F238: TODD | I238: HIGGINS | K238: CARTER | N238: HARPER | Q238: McDONALD
A239: NORTHCOTE | C239: MINNETT | F239: GRAHAM | I239: HYDE | K239: ROULSTON | N239: JIM CHRISTOU | Q239: COSMA | W239: BOX HILL | X239: 4 | Y239: 1 | Z239: 0 | AA239: 789 | AB239: 428 | AC239: =(AA239*100)/AB239 -> 184.34579439252337 | AD239: =(X239*4)+(Z239*2) -> 16
A240: GOALKICKERS | W240: BRUNSWICK | X240: 4 | Y240: 1 | Z240: 0 | AA240: 798 | AB240: 444 | AC240: =(AA240*100)/AB240 -> 179.72972972972974 | AD240: =(X240*4)+(Z240*2) -> 16
A241: OAKLEIGH | C241: HIGGINS 8 | F241: LOWE 7 | H241: OWEN 3 | J241: ROACH 2 | L241: NEARY 2 | N241: GREENWOOD | Q241: HARPER | S241: CARTER | W241: CAULFIELD | X241: 4 | Y241: 1 | Z241: 0 | AA241: 787 | AB241: 471 | AC241: =(AA241*100)/AB241 -> 167.09129511677281 | AD241: =(X241*4)+(Z241*2) -> 16
A242: NORTHCOTE | C242: BRAIN 3 | E242: JIM CHRISTOU 2 | H242: JURGENSTEIN 2 | K242: MULQUEEN 2 | N242: JOHN CHRISTOU | Q242: HARLAND | S242: ARMSTRONG | W242: OAKLEIGH | X242: 4 | Y242: 1 | Z242: 0 | AA242: 751 | AB242: 483 | AC242: =(AA242*100)/AB242 -> 155.4865424430642 | AD242: =(X242*4)+(Z242*2) -> 16
N243: CEPPI | P243: M RYAN
A244: BOX HILL | C244: 5 | D244: 0 | E244: =C244*6+D244 -> 30 | G244: 13 | H244: 5 | I244: =G244*6+H244 -> 83 | K244: 23 | L244: 9 | M244: =K244*6+L244 -> 147 | O244: 28 | P244: 13 | Q244: =O244*6+P244 -> 181 | S244: BOX HILL | W244: SPRINGVALE | X244: 4 | Y244: 1 | Z244: 0 | AA244: 819 | AB244: 568 | AC244: =(AA244*100)/AB244 -> 144.19014084507043 | AD244: =(X244*4)+(Z244*2) -> 16
A245: SPRINGVALE | C245: 10 | D245: 6 | E245: =C245*6+D245 -> 66 | G245: 13 | H245: 7 | I245: =G245*6+H245 -> 85 | K245: 17 | L245: 8 | M245: =K245*6+L245 -> 110 | O245: 20 | P245: 10 | Q245: =O245*6+P245 -> 130 | S245: TORNEY | W245: MORDIALLOC | X245: 3 | Y245: 2 | Z245: 0 | AA245: 793 | AB245: 533 | AC245: =(AA245*100)/AB245 -> 148.78048780487805 | AD245: =(X245*4)+(Z245*2) -> 12
A246: BEST PLAYERS | S246: MORGAN | W246: MOORABBIN | X246: 2 | Y246: 3 | Z246: 0 | AA246: 667 | AB246: 627 | AC246: =(AA246*100)/AB246 -> 106.37958532695374 | AD246: =(X246*4)+(Z246*2) -> 8
A247: BOX HILL | C247: S WITNISH | F247: CHARLES | I247: DICKENSON | L247: R WITNISH | O247: NICHOLSON | R247: DICKENSON | W247: NORTHCOTE | X247: 2 | Y247: 3 | Z247: 0 | AA247: 606 | AB247: 671 | AC247: =(AA247*100)/AB247 -> 90.312965722801792 | AD247: =(X247*4)+(Z247*2) -> 8
A248: SPRINGVALE | C248: L FOWLER | F248: GRAY | I248: SMITH | L248: STEEL | O248: ANDERSON | W248: SUNSHINE | X248: 2 | Y248: 3 | Z248: 0 | AA248: 487 | AB248: 788 | AC248: =(AA248*100)/AB248 -> 61.802030456852791 | AD248: =(X248*4)+(Z248*2) -> 8
A249: GOALKICKERS | P249: CHARLES | W249: KILSYTH | X249: 1 | Y249: 4 | Z249: 0 | AA249: 445 | AB249: 921 | AC249: =(AA249*100)/AB249 -> 48.317046688382192 | AD249: =(X249*4)+(Z249*2) -> 4
A250: BOX HILL | C250: BOLTON 7 | F250: KAINEY 5 | H250: NICHOLSON 4 | K250: DICKENSON 3 | N250: CRUSE 3 | P250: HEDGER 2 | R250: SCHADE 2 | T250: R WITNISH | W250: BERWICK | X250: 0 | Y250: 5 | Z250: 0 | AA250: 375 | AB250: 742 | AC250: =(AA250*100)/AB250 -> 50.539083557951486 | AD250: =(X250*4)+(Z250*2) -> 0
A251: SPRINGVALE | C251: STEEL 7 | E251: SMITH 3 | G251: ANDERSON 2 | J251: L FOWLER 2 | M251: HOLDEN 2 | O251: COOKE | Q251: T FOWLER | S251: GRAY | W251: YARRAVILLE | X251: 0 | Y251: 5 | Z251: 0 | AA251: 327 | AB251: 966 | AC251: =(AA251*100)/AB251 -> 33.850931677018636 | AD251: =(X251*4)+(Z251*2) -> 0
P252: DICKSON
A253: CAULFIELD | C253: 5 | D253: 4 | E253: =C253*6+D253 -> 34 | G253: 13 | H253: 13 | I253: =G253*6+H253 -> 91 | K253: 22 | L253: 20 | M253: =K253*6+L253 -> 152 | O253: 32 | P253: 26 | Q253: =O253*6+P253 -> 218 | S253: PRINCES PARK, CAULFIELD
A254: YARRAVILLE | C254: 8 | D254: 1 | E254: =C254*6+D254 -> 49 | G254: 9 | H254: 1 | I254: =G254*6+H254 -> 55 | K254: 11 | L254: 2 | M254: =K254*6+L254 -> 68 | O254: 15 | P254: 4 | Q254: =O254*6+P254 -> 94 | S254: HUTCHISON/PHAIR
A255: BEST PLAYERS
A256: CAULFIELD | C256: DAWSON | F256: DOYLE | I256: HILL | L256: SHERIDAN | O256: EINSEDEL | R256: SUTHERLAND
A257: YARRAVILLE | C257: LOBAZZA | F257: SCOTT | I257: MARTIN | L257: HOUGH | O257: SANDERSON | R257: TUPPEN
A258: GOALKICKERS
A259: CAULFIELD | C259: DOYLE 8 | E259: CROCKER 5 | G259: BOOTH 5 | I259: SHERIDAN 4 | K259: DAWSON 3 | N259: FITCHETT 2 | Q259: MORRISON | S259: AMBLER | U259: SUTHERLAND | X259: FOX | Y259: HILL
A260: YARRAVILLE | C260: LOBAZZA 5 | F260: SPROULE 4 | I260: HOUGH 2 | K260: ROGOZIK 2 | N260: ROGOTOWICZ 2
A262: MOORABBIN | C262: 10 | D262: 5 | E262: =C262*6+D262 -> 65 | G262: 17 | H262: 12 | I262: =G262*6+H262 -> 114 | K262: 26 | L262: 17 | M262: =K262*6+L262 -> 173 | O262: 32 | P262: 21 | Q262: =O262*6+P262 -> 213 | S262: SUNSHINE
A263: SUNSHINE | C263: 4 | D263: 2 | E263: =C263*6+D263 -> 26 | G263: 6 | H263: 5 | I263: =G263*6+H263 -> 41 | K263: 10 | L263: 8 | M263: =K263*6+L263 -> 68 | O263: 12 | P263: 13 | Q263: =O263*6+P263 -> 85 | S263: BLOOM/GLEESON
A264: BEST PLAYERS
A265: MOORABBIN | C265: ATHERTON | F265: CAMERON | I265: STEWART | L265: WELLS | O265: KNIGHT | R265: HALE
A266: SUNSHINE | C266: VADJNAL | F266: WILLIAMS | I266: BARLOW
A267: GOALKICKERS
A268: MOORABBIN | C268: ATHERTON 8 | F268: HALE 5 | H268: O'FARRELL 5 | K268: JONES 4 | M268: WELLS 3 | O268: STEWART 3 | R268: MARSHALL 2 | U268: KNIGHT | W268: HARDEMAN
A269: SUNSHINE | C269: GRAY 2 | E269: HALL 2 | G269: N MENADUE 2 | J269: PLANT 2 | L269: WILLIAMS 2 | O269: SIMPSON | R269: CAMPBELL
A271: MORDIALLOC | C271: 9 | D271: 4 | E271: =C271*6+D271 -> 58 | G271: 19 | H271: 8 | I271: =G271*6+H271 -> 122 | K271: 30 | L271: 11 | M271: =K271*6+L271 -> 191 | O271: 37 | P271: 12 | Q271: =O271*6+P271 -> 234 | S271: MORDIALLOC
A272: KILSYTH | C272: 2 | D272: 3 | E272: =C272*6+D272 -> 15 | G272: 3 | H272: 4 | I272: =G272*6+H272 -> 22 | K272: 7 | L272: 6 | M272: =K272*6+L272 -> 48 | O272: 12 | P272: 11 | Q272: =O272*6+P272 -> 83 | S272: BLOOM/MAY
A273: BEST PLAYERS
A274: MORDIALLOC | C274: NEVILLE | F274: DEATON | I274: WALSH | L274: WHITTAKER | O274: DE MUNK | R274: NORMAN
A275: KILSYTH | C275: ROBINS | F275: DEAGAN | I275: HODGES | L275: TAYLOR | O275: CARPI | R275: JONES
A276: GOALKICKERS
A277: MORDIALLOC | C277: NEVILLE 15 | F277: DEATON 10 | I277: BROMLEY 4 | K277: DE MUNK 3 | N277: WHITTAKER 2 | Q277: ENBOM 2 | S277: NORMAN
A278: KILSYTH | C278: CARROLL 4 | F278: DEAGAN 2 | I278: FRASER | K278: LETTS | M278: SCHUERMAN | P278: CARPI | R278: D'ANGELO | T278: JANSZ
A280: BRUNSWICK | C280: 4 | D280: 3 | E280: =C280*6+D280 -> 27 | G280: 11 | H280: 5 | I280: =G280*6+H280 -> 71 | K280: 19 | L280: 9 | M280: =K280*6+L280 -> 123 | O280: 29 | P280: 11 | Q280: =O280*6+P280 -> 185 | S280: BRUNSWICK
A281: BERWICK | C281: 1 | D281: 1 | E281: =C281*6+D281 -> 7 | G281: 3 | H281: 7 | I281: =G281*6+H281 -> 25 | K281: 7 | L281: 9 | M281: =K281*6+L281 -> 51 | O281: 9 | P281: 14 | Q281: =O281*6+P281 -> 68 | S281: THOMSON/ELSUM
A282: BEST PLAYERS
A283: BRUNSWICK | C283: BROWN | F283: JUDGE | I283: THORNTON | L283: LAWSON | O283: GUMBLETON | R283: McGHIE
A284: BERWICK | C284: JOHNSON | F284: GAMBETTA | I284: TRIGG | L284: LAITY | O284: SHEARS | R284: HUGHES
A285: GOALKICKERS
A286: BRUNSWICK | C286: GUMBLETON 7 | F286: SAHLBERG 6 | I286: HAMILTON 3 | L286: WEST 3 | N286: DAWSON 3 | P286: SMYTHE 3 | R286: LEAHY | T286: LYNCH | V286: McGHIE | X286: THORNTON
A287: BERWICK | C287: TRIGG 3 | F287: CHANDLER 2 | I287: CREBBIN | K287: LAITY | M287: McGILL | O287: VENVILLE
A289: ROUND 6 | E289: 15TH MAY | J289: WEATHER | S289: PLAYED AT
D290: 1ST QTR | H290: 2ND QTR | L290: 3RD QTR | P290: FINAL | S290: NEWCOMEN RD
A291: OAKLEIGH | C291: 2 | D291: 2 | E291: =C291*6+D291 -> 14 | G291: 6 | H291: 6 | I291: =G291*6+H291 -> 42 | K291: 8 | L291: 9 | M291: =K291*6+L291 -> 57 | O291: 14 | P291: 15 | Q291: =O291*6+P291 -> 99 | S291: UMPIRE | X291: LADDER | AB291: ROUND | AD291: 6
A292: SPRINGVALE | C292: 5 | D292: 2 | E292: =C292*6+D292 -> 32 | G292: 5 | H292: 4 | I292: =G292*6+H292 -> 34 | K292: 8 | L292: 7 | M292: =K292*6+L292 -> 55 | O292: 9 | P292: 11 | Q292: =O292*6+P292 -> 65
A293: BEST PLAYERS | W293: TEAM | X293: W | Y293: L | Z293: D | AA293: FOR | AB293: AGST | AC293: % | AD293: PTS
A294: OAKLEIGH
A295: SPRINGVALE | W295: BOX HILL | X295: 5 | Y295: 1 | Z295: 0 | AA295: 966 | AB295: 473 | AC295: =(AA295*100)/AB295 -> 204.22832980972515 | AD295: =(X295*4)+(Z295*2) -> 20
A296: GOALKICKERS | W296: BRUNSWICK | X296: 5 | Y296: 1 | Z296: 0 | AA296: 968 | AB296: 508 | AC296: =(AA296*100)/AB296 -> 190.55118110236219 | AD296: =(X296*4)+(Z296*2) -> 20
A297: OAKLEIGH | W297: OAKLEIGH | X297: 5 | Y297: 1 | Z297: 0 | AA297: 850 | AB297: 548 | AC297: =(AA297*100)/AB297 -> 155.1094890510949 | AD297: =(X297*4)+(Z297*2) -> 20
A298: SPRINGVALE | W298: MORDIALLOC | X298: 4 | Y298: 2 | Z298: 0 | AA298: 930 | AB298: 603 | AC298: =(AA298*100)/AB298 -> 154.22885572139305 | AD298: =(X298*4)+(Z298*2) -> 16
A300: NORTHCOTE | C300: 11 | D300: 6 | E300: =C300*6+D300 -> 72 | G300: 14 | H300: 17 | I300: =G300*6+H300 -> 101 | K300: 25 | L300: 26 | M300: =K300*6+L300 -> 176 | O300: 35 | P300: 32 | Q300: =O300*6+P300 -> 242 | S300: NORTHCOTE | W300: CAULFIELD | X300: 4 | Y300: 2 | Z300: 0 | AA300: 871 | AB300: 577 | AC300: =(AA300*100)/AB300 -> 150.95320623916811 | AD300: =(X300*4)+(Z300*2) -> 16
A301: SUNSHINE | C301: 1 | D301: 0 | E301: =C301*6+D301 -> 6 | G301: 4 | H301: 4 | I301: =G301*6+H301 -> 28 | K301: 7 | L301: 5 | M301: =K301*6+L301 -> 47 | O301: 8 | P301: 5 | Q301: =O301*6+P301 -> 53 | W301: SPRINGVALE | X301: 4 | Y301: 2 | Z301: 0 | AA301: 884 | AB301: 667 | AC301: =(AA301*100)/AB301 -> 132.53373313343329 | AD301: =(X301*4)+(Z301*2) -> 16
A302: BEST PLAYERS | W302: NORTHCOTE | X302: 3 | Y302: 3 | Z302: 0 | AA302: 848 | AB302: 724 | AC302: =(AA302*100)/AB302 -> 117.12707182320442 | AD302: =(X302*4)+(Z302*2) -> 12
A303: NORTHCOTE | W303: MOORABBIN | X303: 3 | Y303: 3 | Z303: 0 | AA303: 773 | AB303: 711 | AC303: =(AA303*100)/AB303 -> 108.72011251758087 | AD303: =(X303*4)+(Z303*2) -> 12
A304: SUNSHINE | W304: SUNSHINE | X304: 2 | Y304: 4 | Z304: 0 | AA304: 540 | AB304: 1030 | AC304: =(AA304*100)/AB304 -> 52.427184466019419 | AD304: =(X304*4)+(Z304*2) -> 8
A305: GOALKICKERS | W305: KILSYTH | X305: 1 | Y305: 5 | Z305: 0 | AA305: 490 | AB305: 1098 | AC305: =(AA305*100)/AB305 -> 44.626593806921676 | AD305: =(X305*4)+(Z305*2) -> 4
A306: NORTHCOTE | W306: BERWICK | X306: 0 | Y306: 6 | Z306: 0 | AA306: 445 | AB306: 879 | AC306: =(AA306*100)/AB306 -> 50.625711035267351 | AD306: =(X306*4)+(Z306*2) -> 0
A307: SUNSHINE | W307: YARRAVILLE | X307: 0 | Y307: 6 | Z307: 0 | AA307: 391 | AB307: 1136 | AC307: =(AA307*100)/AB307 -> 34.41901408450704 | AD307: =(X307*4)+(Z307*2) -> 0
A309: MOORABBIN | C309: 1 | D309: 3 | E309: =C309*6+D309 -> 9 | G309: 5 | H309: 6 | I309: =G309*6+H309 -> 36 | K309: 10 | L309: 10 | M309: =K309*6+L309 -> 70 | O309: 16 | P309: 10 | Q309: =O309*6+P309 -> 106 | S309: BENTLEIGH
A310: CAULFIELD | C310: 6 | D310: 4 | E310: =C310*6+D310 -> 40 | G310: 7 | H310: 7 | I310: =G310*6+H310 -> 49 | K310: 9 | L310: 9 | M310: =K310*6+L310 -> 63 | O310: 12 | P310: 12 | Q310: =O310*6+P310 -> 84
A311: BEST PLAYERS
A312: MOORABBIN
A313: CAULFIELD
A314: GOALKICKERS
A315: MOORABBIN
A316: CAULFIELD
A318: BRUNSWICK | C318: 4 | D318: 7 | E318: =C318*6+D318 -> 31 | G318: 12 | H318: 12 | I318: =G318*6+H318 -> 84 | K318: 21 | L318: 18 | M318: =K318*6+L318 -> 144 | O318: 24 | P318: 26 | Q318: =O318*6+P318 -> 170 | S318: YARRAVILLE
A319: YARRAVILLE | C319: 3 | D319: 2 | E319: =C319*6+D319 -> 20 | G319: 7 | H319: 4 | I319: =G319*6+H319 -> 46 | K319: 7 | L319: 4 | M319: =K319*6+L319 -> 46 | O319: 10 | P319: 4 | Q319: =O319*6+P319 -> 64
A320: BEST PLAYERS
A321: BRUNSWICK
A322: YARRAVILLE
A323: GOALKICKERS
A324: BRUNSWICK
A325: YARRAVILLE
A327: MORDIALLOC | C327: 4 | D327: 3 | E327: =C327*6+D327 -> 27 | G327: 7 | H327: 10 | I327: =G327*6+H327 -> 52 | K327: 13 | L327: 12 | M327: =K327*6+L327 -> 90 | O327: 20 | P327: 17 | Q327: =O327*6+P327 -> 137 | S327: BERWICK
A328: BERWICK | C328: 4 | D328: 4 | E328: =C328*6+D328 -> 28 | G328: 8 | H328: 5 | I328: =G328*6+H328 -> 53 | K328: 8 | L328: 9 | M328: =K328*6+L328 -> 57 | O328: 10 | P328: 10 | Q328: =O328*6+P328 -> 70
A329: BEST PLAYERS
A330: MORDIALLOC
A331: BERWICK
A332: GOALKICKERS
A333: MORDIALLOC
A334: BERWICK
A336: BOX HILL | C336: 9 | D336: 3 | E336: =C336*6+D336 -> 57 | G336: 15 | H336: 11 | I336: =G336*6+H336 -> 101 | K336: 22 | L336: 16 | M336: =K336*6+L336 -> 148 | O336: 26 | P336: 21 | Q336: =O336*6+P336 -> 177 | S336: KILSYTH
A337: KILSYTH | C337: 2 | D337: 0 | E337: =C337*6+D337 -> 12 | G337: 4 | H337: 1 | I337: =G337*6+H337 -> 25 | K337: 5 | L337: 1 | M337: =K337*6+L337 -> 31 | O337: 7 | P337: 3 | Q337: =O337*6+P337 -> 45
A338: BEST PLAYERS
A339: BOX HILL
A340: KILSYTH
A341: GOALKICKERS
A342: BOX HILL
A343: KILSYTH
A345: ROUND 7 | E345: 29TH MAY | J345: WEATHER | S345: PLAYED AT
D346: 1ST QTR | H346: 2ND QTR | L346: 3RD QTR | P346: FINAL | S346: OAKLEIGH
A347: OAKLEIGH | C347: 2 | D347: 2 | E347: =C347*6+D347 -> 14 | G347: 9 | H347: 3 | I347: =G347*6+H347 -> 57 | K347: 9 | L347: 6 | M347: =K347*6+L347 -> 60 | O347: 12 | P347: 8 | Q347: =O347*6+P347 -> 80 | S347: UMPIRE | X347: LADDER | AB347: ROUND | AD347: 7
A348: BOX HILL | C348: 1 | D348: 4 | E348: =C348*6+D348 -> 10 | G348: 6 | H348: 7 | I348: =G348*6+H348 -> 43 | K348: 11 | L348: 10 | M348: =K348*6+L348 -> 76 | O348: 11 | P348: 12 | Q348: =O348*6+P348 -> 78 | S348: BUDGE/BLOOM
A349: BEST PLAYERS | W349: TEAM | X349: W | Y349: L | Z349: D | AA349: FOR | AB349: AGST | AC349: % | AD349: PTS
A350: OAKLEIGH | C350: GOODMAN | F350: TODD | I350: MCDONALD | L350: HARPER | O350: S ROACH | R350: SPLATT
A351: BOX HILL | C351: CHARLES | F351: WITHERS | I351: S WITNISH | L351: SCHADE | O351: NICHOLSON | R351: TOVEY | W351: BRUNSWICK | X351: 6 | Y351: 1 | Z351: 0 | AA351: 1081 | AB351: 579 | AC351: =(AA351*100)/AB351 -> 186.70120898100171 | AD351: =(X351*4)+(Z351*2) -> 24
A352: GOALKICKERS | W352: OAKLEIGH | X352: 6 | Y352: 1 | Z352: 0 | AA352: 930 | AB352: 626 | AC352: =(AA352*100)/AB352 -> 148.56230031948883 | AD352: =(X352*4)+(Z352*2) -> 24
A353: OAKLEIGH | C353: HIGGINS 4 | F353: OWEN 3 | H353: LOWE 2 | J353: S ROACH | M353: HARPER | O353: ANSELL | W353: BOX HILL | X353: 5 | Y353: 2 | Z353: 0 | AA353: 1044 | AB353: 553 | AC353: =(AA353*100)/AB353 -> 188.78842676311029 | AD353: =(X353*4)+(Z353*2) -> 20
A354: BOX HILL | C354: WOODMAN 2 | F354: HEDGER 2 | H354: NICHOLSON 2 | K354: BOLTON | M354: SCHADE | O354: LAWTHER | R354: CRUSE | T354: GARTH | W354: MORDIALLOC | X354: 5 | Y354: 2 | Z354: 0 | AA354: 1059 | AB354: 663 | AC354: =(AA354*100)/AB354 -> 159.7285067873303 | AD354: =(X354*4)+(Z354*2) -> 20
A356: NORTHCOTE | C356: 5 | D356: 3 | E356: =C356*6+D356 -> 33 | G356: 7 | H356: 4 | I356: =G356*6+H356 -> 46 | K356: 12 | L356: 9 | M356: =K356*6+L356 -> 81 | O356: 18 | P356: 12 | Q356: =O356*6+P356 -> 120 | S356: PRINCES PARK, CAULFIELD | W356: SPRINGVALE | X356: 5 | Y356: 2 | Z356: 0 | AA356: 1044 | AB356: 721 | AC356: =(AA356*100)/AB356 -> 144.79889042995839 | AD356: =(X356*4)+(Z356*2) -> 20
A357: CAULFIELD | C357: 4 | D357: 1 | E357: =C357*6+D357 -> 25 | G357: 7 | H357: 9 | I357: =G357*6+H357 -> 51 | K357: 9 | L357: 9 | M357: =K357*6+L357 -> 63 | O357: 11 | P357: 15 | Q357: =O357*6+P357 -> 81 | S357: ELSUM | W357: CAULFIELD | X357: 4 | Y357: 3 | Z357: 0 | AA357: 952 | AB357: 697 | AC357: =(AA357*100)/AB357 -> 136.58536585365854 | AD357: =(X357*4)+(Z357*2) -> 16
A358: BEST PLAYERS | S358: GLEESON | W358: NORTHCOTE | X358: 4 | Y358: 3 | Z358: 0 | AA358: 968 | AB358: 805 | AC358: =(AA358*100)/AB358 -> 120.24844720496894 | AD358: =(X358*4)+(Z358*2) -> 16
A359: NORTHCOTE | C359: MULQUEEN | F359: CUFF | I359: HARLAND | L359: RYAN | O359: McQUINN | R359: ARMSTRONG | W359: MOORABBIN | X359: 3 | Y359: 4 | Z359: 0 | AA359: 844 | AB359: 824 | AC359: =(AA359*100)/AB359 -> 102.42718446601941 | AD359: =(X359*4)+(Z359*2) -> 12
A360: CAULFIELD | C360: EINSEDEL | F360: MADDAFERI | I360: HILL | W360: SUNSHINE | X360: 2 | Y360: 5 | Z360: 0 | AA360: 594 | AB360: 1190 | AC360: =(AA360*100)/AB360 -> 49.915966386554622 | AD360: =(X360*4)+(Z360*2) -> 8
A361: GOALKICKERS | O361: ASTBURY | W361: BERWICK | X361: 1 | Y361: 6 | Z361: 0 | AA361: 530 | AB361: 940 | AC361: =(AA361*100)/AB361 -> 56.382978723404257 | AD361: =(X361*4)+(Z361*2) -> 4
A362: NORTHCOTE | C362: JURGENSTEIN 5 | F362: MULQUEEN 3 | I362: CUFF 3 | K362: HARLAND 3 | N362: JIM CHRISTOU | Q362: BRAIN | S362: STAIOS | W362: KILSYTH | X362: 1 | Y362: 6 | Z362: 0 | AA362: 551 | AB362: 1183 | AC362: =(AA362*100)/AB362 -> 46.57650042265427 | AD362: =(X362*4)+(Z362*2) -> 4
A363: CAULFIELD | C363: BOOTH 3 | E363: SHERIDAN 2 | H363: MORRISON 2 | J363: EINSEDEL | L363: CROCKER | N363: HOFERT | P363: DOYLE | W363: YARRAVILLE | X363: 0 | Y363: 7 | Z363: 0 | AA363: 451 | AB363: 1265 | AC363: =(AA363*100)/AB363 -> 35.652173913043477 | AD363: =(X363*4)+(Z363*2) -> 0
A365: SPRINGVALE | C365: 4 | D365: 3 | E365: =C365*6+D365 -> 27 | G365: 15 | H365: 8 | I365: =G365*6+H365 -> 98 | K365: 19 | L365: 9 | M365: =K365*6+L365 -> 123 | O365: 24 | P365: 16 | Q365: =O365*6+P365 -> 160 | S365: SUNSHINE
A366: SUNSHINE | C366: 2 | D366: 3 | E366: =C366*6+D366 -> 15 | G366: 4 | H366: 4 | I366: =G366*6+H366 -> 28 | K366: 5 | L366: 8 | M366: =K366*6+L366 -> 38 | O366: 7 | P366: 12 | Q366: =O366*6+P366 -> 54 | S366: OAKLEY/BRADSHAW
A367: BEST PLAYERS
A368: SPRINGVALE | C368: ROSSER | F368: TONKIN | I368: SKEWS | L368: SMITH | N368: ANDERSON | Q368: McCOMB
A369: SUNSHINE | C369: WILLIAMS | F369: CAMPBELL | I369: SIMPSON | L369: GRAY | N369: FOLRY | Q369: WHITNEY
A370: GOALKICKERS
A371: SPRINGVALE | C371: CARROLL 5 | E371: CADDAYE 5 | H371: ANDERSON 4 | K371: SMITH 4 | M371: HOLDEN 3 | O371: GRAY 2 | Q371: ROSSER
A372: SUNSHINE | C372: CHANDLER 2 | F372: WILLIAMS 2 | I372: CROSBIE | K372: KOMPES | M372: GORE
A374: BERWICK | C374: 5 | D374: 4 | E374: =C374*6+D374 -> 34 | G374: 9 | H374: 5 | I374: =G374*6+H374 -> 59 | K374: 11 | L374: 6 | M374: =K374*6+L374 -> 72 | O374: 13 | P374: 7 | Q374: =O374*6+P374 -> 85 | S374: BERWICK
A375: KILSYTH | C375: 2 | D375: 1 | E375: =C375*6+D375 -> 13 | G375: 3 | H375: 8 | I375: =G375*6+H375 -> 26 | K375: 5 | L375: 9 | M375: =K375*6+L375 -> 39 | O375: 8 | P375: 13 | Q375: =O375*6+P375 -> 61 | S375: HUTCHISON/MAY
A376: BEST PLAYERS
A377: BERWICK | C377: VENVILLE | F377: SHEARS | I377: CREBBIN | L377: TRIGG | O377: ALLEN
A378: KILSYTH | C378: D'ANGELO | F378: FRASER | I378: WATERS | L378: BRADBURY | O378: BIANCO
A379: GOALKICKERS
A380: BERWICK | C380: VENVILLE 5 | F380: TRIGG 2 | H380: McGILL 2 | J380: ALLEN 2 | L380: CREBBIN | N380: SHEARS
A381: KILSYTH | C381: LETTS 2 | F381: DEAGAN 2 | I381: CARPI 2 | K381: EDWARDS | N381: CARROLL
A383: MORDIALLOC | C383: 6 | D383: 7 | E383: =C383*6+D383 -> 43 | G383: 12 | H383: 11 | I383: =G383*6+H383 -> 83 | K383: 15 | L383: 14 | M383: =K383*6+L383 -> 104 | O383: 18 | P383: 21 | Q383: =O383*6+P383 -> 129 | S383: MORDIALLOC
A384: YARRAVILLE | C384: 3 | D384: 0 | E384: =C384*6+D384 -> 18 | G384: 4 | H384: 1 | I384: =G384*6+H384 -> 25 | K384: 8 | L384: 5 | M384: =K384*6+L384 -> 53 | O384: 9 | P384: 6 | Q384: =O384*6+P384 -> 60 | S384: KENNEDY/STEERE
A385: BEST PLAYERS
A386: MORDIALLOC | C386: WHITTAKER | F386: KERIN | I386: NEVILLE | L386: WARREN | O386: NORMAN | R386: DEATON
A387: YARRAVILLE | C387: WARD | F387: HOUGH | I387: FABRETTI | L387: DIMASI | O387: SCOTT | R387: MOON
A388: GOALKICKERS
A389: MORDIALLOC | C389: NEVILLE 8 | F389: NORMAN 5 | I389: DEATON 2 | K389: BROMLEY | M389: DAVIS | O389: ENBOM
A390: YARRAVILLE | C390: TUPPEN 2 | E390: DIDOLAS 2 | H390: ROGOTOWICZ | K390: LUNT | M390: MOLONEY | O390: RICHARDS | R390: SPROULE
A392: BRUNSWICK | C392: 3 | D392: 2 | E392: =C392*6+D392 -> 20 | G392: 11 | H392: 4 | I392: =G392*6+H392 -> 70 | K392: 15 | L392: 13 | M392: =K392*6+L392 -> 103 | O392: 16 | P392: 17 | Q392: =O392*6+P392 -> 113 | S392: BRUNSWICK
A393: MOORABBIN | C393: 1 | D393: 2 | E393: =C393*6+D393 -> 8 | G393: 5 | H393: 4 | I393: =G393*6+H393 -> 34 | K393: 6 | L393: 4 | M393: =K393*6+L393 -> 40 | O393: 10 | P393: 11 | Q393: =O393*6+P393 -> 71
A394: BEST PLAYERS
A395: BRUNSWICK | C395: DOYLE | E395: TOY | G395: LAWSON | J395: JUDGE | M395: BAKER | O395: NOLAN
A396: MOORABBIN | C396: JONES | E396: WELLS | G396: WILSON | J396: ATHERTON | M396: LAZZARO | O396: KNIGHT
A397: GOALKICKERS
A398: BRUNSWICK | C398: GUMBLETON 4 | F398: JUDGE 4 | H398: WEST 3 | J398: LEAHY 2 | L398: NOLAN | N398: THORNTON | Q398: SAHLBERG
A399: MOORABBIN | C399: WELLS 3 | E399: MARSHALL 3 | H399: ATHERTON | K399: MERCOULIA | N399: CONSTANTUNOU | Q399: KNIGHT
A401: ROUND 8 | E401: 5TH JUNE | J401: WEATHER | S401: PLAYED AT
D402: 1ST QTR | H402: 2ND QTR | L402: 3RD QTR | P402: FINAL | S402: OAKLEIGH
A403: OAKLEIGH | C403: 5 | D403: 3 | E403: =C403*6+D403 -> 33 | G403: 12 | H403: 5 | I403: =G403*6+H403 -> 77 | K403: 20 | L403: 8 | M403: =K403*6+L403 -> 128 | O403: 27 | P403: 14 | Q403: =O403*6+P403 -> 176 | S403: UMPIRE | X403: LADDER | AB403: ROUND | AD403: 8
A404: KILSYTH | C404: 1 | D404: 2 | E404: =C404*6+D404 -> 8 | G404: 4 | H404: 4 | I404: =G404*6+H404 -> 28 | K404: 8 | L404: 5 | M404: =K404*6+L404 -> 53 | O404: 10 | P404: 9 | Q404: =O404*6+P404 -> 69 | S404: BRADSHAW/GLEESON
A405: BEST PLAYERS | W405: TEAM | X405: W | Y405: L | Z405: D | AA405: FOR | AB405: AGST | AC405: % | AD405: PTS
A406: OAKLEIGH | C406: FITZGERALD | F406: HARPER
A407: KILSYTH | C407: DEAGAN | F407: N TAYLOR | I407: LETTS | L407: EDWARDS | O407: BIANCO | Q407: D'ANGELO | W407: BRUNSWICK | X407: 7 | Y407: 1 | Z407: 0 | AA407: 1223 | AB407: 704 | AC407: =(AA407*100)/AB407 -> 173.72159090909091 | AD407: =(X407*4)+(Z407*2) -> 28
A408: GOALKICKERS | M408: GOODMAN | P408: ANSELL | R408: S ROACH | W408: OAKLEIGH | X408: 7 | Y408: 1 | Z408: 0 | AA408: 1106 | AB408: 695 | AC408: =(AA408*100)/AB408 -> 159.13669064748203 | AD408: =(X408*4)+(Z408*2) -> 28
A409: OAKLEIGH | C409: HIGGINS 7 | F409: OWEN 5 | H409: M ROACH 3 | K409: BUTCHER 3 | N409: ALLISEY 2 | P409: HILLIARD 2 | S409: HARPER 2 | W409: BOX HILL | X409: 6 | Y409: 2 | Z409: 0 | AA409: 1330 | AB409: 601 | AC409: =(AA409*100)/AB409 -> 221.29783693843595 | AD409: =(X409*4)+(Z409*2) -> 24
A410: KILSYTH | C410: CARROLL 3 | F410: DEAGAN 3 | I410: TAPSCOTT | L410: CARPI | N410: R TAYLOR | Q410: JONES | W410: MORDIALLOC | X410: 6 | Y410: 2 | Z410: 0 | AA410: 1201 | AB410: 727 | AC410: =(AA410*100)/AB410 -> 165.19944979367261 | AD410: =(X410*4)+(Z410*2) -> 24
A412: BOX HILL | C412: 12 | D412: 5 | E412: =C412*6+D412 -> 77 | G412: 25 | H412: 10 | I412: =G412*6+H412 -> 160 | K412: 36 | L412: 16 | M412: =K412*6+L412 -> 232 | O412: 44 | P412: 22 | Q412: =O412*6+P412 -> 286 | S412: BOX HILL | W412: SPRINGVALE | X412: 5 | Y412: 3 | Z412: 0 | AA412: 1149 | AB412: 837 | AC412: =(AA412*100)/AB412 -> 137.27598566308242 | AD412: =(X412*4)+(Z412*2) -> 20
A413: SUNSHINE | C413: 3 | D413: 6 | E413: =C413*6+D413 -> 24 | G413: 3 | H413: 8 | I413: =G413*6+H413 -> 26 | K413: 5 | L413: 11 | M413: =K413*6+L413 -> 41 | O413: 6 | P413: 12 | Q413: =O413*6+P413 -> 48 | S413: KENNEDY | W413: CAULFIELD | X413: 5 | Y413: 3 | Z413: 0 | AA413: 1068 | AB413: 802 | AC413: =(AA413*100)/AB413 -> 133.16708229426433 | AD413: =(X413*4)+(Z413*2) -> 20
A414: BEST PLAYERS | S414: STEERE | W414: NORTHCOTE | X414: 4 | Y414: 4 | Z414: 0 | AA414: 1093 | AB414: 947 | AC414: =(AA414*100)/AB414 -> 115.41710665258712 | AD414: =(X414*4)+(Z414*2) -> 16
A415: BOX HILL | C415: KAINEY | F415: NICHOLSON | I415: P WITNISH | L415: SCHADE | O415: HEDGER | R415: BOLTON | W415: MOORABBIN | X415: 3 | Y415: 5 | Z415: 0 | AA415: 908 | AB415: 966 | AC415: =(AA415*100)/AB415 -> 93.995859213250512 | AD415: =(X415*4)+(Z415*2) -> 12
A416: SUNSHINE | C416: WILLIAMS | F416: WAGLAND | I416: GRAY | L416: CHANDLER | O416: B MENADUE | W416: BERWICK | X416: 2 | Y416: 6 | Z416: 0 | AA416: 647 | AB416: 1033 | AC416: =(AA416*100)/AB416 -> 62.633107454017427 | AD416: =(X416*4)+(Z416*2) -> 8
A417: GOALKICKERS | E417: HEDGER 3 | G417: R WITNISH 2 | J417: CRUSE | L417: WITHERS | N417: GLEESON | Q417: DICKENSON | W417: SUNSHINE | X417: 2 | Y417: 6 | Z417: 0 | AA417: 642 | AB417: 1476 | AC417: =(AA417*100)/AB417 -> 43.49593495934959 | AD417: =(X417*4)+(Z417*2) -> 8
A418: BOX HILL | C418: KAINEY 11 | F418: LAWTHER 5 | I418: BOLTON 4 | K418: SCHADE 4 | N418: GARTH 4 | P418: NICHOLSON 4 | S418: P WITNISH 3 | W418: KILSYTH | X418: 1 | Y418: 7 | Z418: 0 | AA418: 620 | AB418: 1359 | AC418: =(AA418*100)/AB418 -> 45.621780721118469 | AD418: =(X418*4)+(Z418*2) -> 4
A419: SUNSHINE | C419: AXON 2 | F419: GORE | G419: SIMPSON | J419: GRAY | L419: CROSBIE | W419: YARRAVILLE | X419: 0 | Y419: 8 | Z419: 0 | AA419: 544 | AB419: 1382 | AC419: =(AA419*100)/AB419 -> 39.363241678726482 | AD419: =(X419*4)+(Z419*2) -> 0
A421: CAULFIELD | C421: 3 | D421: 10 | E421: =C421*6+D421 -> 28 | G421: 7 | H421: 11 | I421: =G421*6+H421 -> 53 | K421: 13 | L421: 17 | M421: =K421*6+L421 -> 95 | O421: 16 | P421: 20 | Q421: =O421*6+P421 -> 116 | S421: NEWCOMEN RD
A422: SPRINGVALE | C422: 2 | D422: 1 | E422: =C422*6+D422 -> 13 | G422: 7 | H422: 4 | I422: =G422*6+H422 -> 46 | K422: 12 | L422: 11 | M422: =K422*6+L422 -> 83 | O422: 15 | P422: 15 | Q422: =O422*6+P422 -> 105 | S422: PHILLIPS/SERONG
A423: BEST PLAYERS
A424: CAULFIELD | C424: HILL | F424: MORRISON | I424: CROCKER | L424: CROOK | O424: MADDAFERI | R424: PEARCE
A425: SPRINGVALE | C425: ANDERSON | F425: SKEWS | I425: CADDAYE | L425: SMITH | O425: FOWLER | R425: COOKE
A426: GOALKICKERS
A427: CAULFIELD | C427: BLAKE 3 | E427: CROCKER 2 | G427: CROOK 2 | I427: MITCHELL 2 | K427: PEARCE 2 | M427: HILL 2 | O427: DAWSON | Q427: HOGAN | S427: SHERIDAN
A428: SPRINGVALE | C428: CADDAYE 6 | F428: CARROLL 5 | I428: COOKE | K428: NEWMAN | N428: SMITH | P428: HOLDEN
A430: BRUNSWICK | C430: 4 | D430: 4 | E430: =C430*6+D430 -> 28 | G430: 12 | H430: 7 | I430: =G430*6+H430 -> 79 | K430: 16 | L430: 10 | M430: =K430*6+L430 -> 106 | O430: 21 | P430: 16 | Q430: =O430*6+P430 -> 142 | S430: NORTHCOTE
A431: NORTHCOTE | C431: 1 | D431: 8 | E431: =C431*6+D431 -> 14 | G431: 6 | H431: 11 | I431: =G431*6+H431 -> 47 | K431: 13 | L431: 17 | M431: =K431*6+L431 -> 95 | O431: 17 | P431: 23 | Q431: =O431*6+P431 -> 125 | S431: MAY/MARCY
A432: BEST PLAYERS
A433: BRUNSWICK | C433: WEST | F433: NOLAN | I433: LAWSON | L433: McGHIE | N433: TOY | P433: DOYLE
A434: NORTHCOTE | C434: JIM CHRISTOU | F434: MULQUEEN | I434: JOHN CHRISTOU | L434: RYAN | N434: BRAIN | P434: MINNETT
A435: GOALKICKERS
A436: BRUNSWICK | C436: GUMBLETON 4 | F436: SAHLBERG 3 | I436: LEAHY 3 | K436: LAWSON 3 | N436: WEST 3 | P436: ROBERTSON 2 | S436: SMITH | U436: TOY | W436: LYNCH
A437: NORTHCOTE | C437: CUFF 3 | E437: JIM CHRISTOU 3 | H437: BRAIN 3 | J437: CEPPI 3 | L437: HARLAND | N437: MINNETT | Q437: MEGNA | S437: JURGENSTEIN | W437: M RYAN
A439: MORDIALLOC | C439: 4 | D439: 8 | E439: =C439*6+D439 -> 32 | G439: 10 | H439: 11 | I439: =G439*6+H439 -> 71 | K439: 14 | L439: 15 | M439: =K439*6+L439 -> 99 | O439: 20 | P439: 22 | Q439: =O439*6+P439 -> 142 | S439: BENTLEIGH
A440: MOORABBIN | C440: 2 | D440: 1 | E440: =C440*6+D440 -> 13 | G440: 6 | H440: 5 | I440: =G440*6+H440 -> 41 | K440: 7 | L440: 8 | M440: =K440*6+L440 -> 50 | O440: 9 | P440: 10 | Q440: =O440*6+P440 -> 64 | S440: HUTCHISON/TORNEY
A441: BEST PLAYERS
A442: MORDIALLOC | C442: EMBERSON | F442: WALSH | I442: PRENTICE | L442: DEATON | O442: CLIFFORD | R442: WARREN
A443: MOORABBIN | C443: O'FARRELL | F443: JONES | I443: WELLS | L443: B CATHCART
A444: GOALKICKERS
A445: MORDIALLOC | C445: NEVILLE 7 | F445: DEATON 6 | I445: NORMAN 2 | L445: O'HALLORAN | O445: KERIN | Q445: BROMLEY | S445: PRENTIS | U445: M HALE
A446: MOORABBIN | C446: MILL? 3 | F446: WELLS 2 | I446: POLLOCK 2 | L446: HALE | N446: MARSHALL
A448: BERWICK | C448: 4 | D448: 3 | E448: =C448*6+D448 -> 27 | G448: 8 | H448: 7 | I448: =G448*6+H448 -> 55 | K448: 12 | L448: 11 | M448: =K448*6+L448 -> 83 | O448: 17 | P448: 15 | Q448: =O448*6+P448 -> 117 | S448: YARRAVILLE
A449: YARRAVILLE | C449: 5 | D449: 4 | E449: =C449*6+D449 -> 34 | G449: 7 | H449: 4 | I449: =G449*6+H449 -> 46 | K449: 11 | L449: 5 | M449: =K449*6+L449 -> 71 | O449: 14 | P449: 9 | Q449: =O449*6+P449 -> 93 | S449: ALLSOP/THOMSON
A450: BEST PLAYERS
A451: BERWICK | C451: TRIGG | F451: VENVILLE | I451: ALLEN | L451: HUGHES | O451: CHANDLER
A452: YARRAVILLE | C452: HOUGH | F452: MOON | I452: WARD | L452: SANDERSON
A453: GOALKICKERS
A454: BERWICK | C454: VENVILLE 4 | F454: TRIGG 4 | H454: CHANDLER 3 | K454: MENNENS 2 | N454: PEARCE 2 | P454: McGREAL | R454: McGILL
A455: YARRAVILLE | C455: SPROULE 5 | F455: SANDERSON 3 | I455: DENNIS 2 | K455: LUNT 2 | M455: MARTIN | O455: MOON
A457: ROUND 9 | E457: 12TH JUNE | J457: WEATHER | S457: PLAYED AT
D458: 1ST QTR | H458: 2ND QTR | L458: 3RD QTR | P458: FINAL | S458: PRINCES PARK, CAULFIELD
A459: BOX HILL | C459: 4 | D459: 7 | E459: =C459*6+D459 -> 31 | G459: 6 | H459: 11 | I459: =G459*6+H459 -> 47 | K459: 9 | L459: 15 | M459: =K459*6+L459 -> 69 | O459: 13 | P459: 17 | Q459: =O459*6+P459 -> 95 | S459: UMPIRE | X459: LADDER | AB459: ROUND | AD459: 9
A460: CAULFIELD | C460: 1 | D460: 1 | E460: =C460*6+D460 -> 7 | G460: 5 | H460: 7 | I460: =G460*6+H460 -> 37 | K460: 6 | L460: 10 | M460: =K460*6+L460 -> 46 | O460: 10 | P460: 14 | Q460: =O460*6+P460 -> 74 | S460: CASEY/MAY
A461: BEST PLAYERS | W461: TEAM | X461: W | Y461: L | Z461: D | AA461: FOR | AB461: AGST | AC461: % | AD461: PTS
A462: BOX HILL | C462: HEDGER | F462: NICHOLSON | I462: GARTH | L462: GLEESON | O462: WITHERS | R462: CONNOLLY
A463: CAULFIELD | C463: EINSEDEL | F463: BRASIER | I463: DAWSON | L463: BOOTH | O463: CROOK | W463: OAKLEIGH | X463: 8 | Y463: 1 | Z463: 0 | AA463: 1213 | AB463: 743 | AC463: =(AA463*100)/AB463 -> 163.257065948856 | AD463: =(X463*4)+(Z463*2) -> 32
A464: GOALKICKERS | W464: BOX HILL | X464: 7 | Y464: 2 | Z464: 0 | AA464: 1425 | AB464: 675 | AC464: =(AA464*100)/AB464 -> 211.11111111111111 | AD464: =(X464*4)+(Z464*2) -> 28
A465: BOX HILL | C465: HEDGER 4 | F465: BOLTON 2 | I465: KAINEY 2 | K465: NICHOLSON 2 | N465: GARTH 2 | P465: P WITNISH | W465: BRUNSWICK | X465: 7 | Y465: 2 | Z465: 0 | AA465: 1278 | AB465: 782 | AC465: =(AA465*100)/AB465 -> 163.42710997442455 | AD465: =(X465*4)+(Z465*2) -> 28
A466: CAULFIELD | C466: BLAKE 3 | F466: BOOTH 2 | I466: DAWSON 2 | L466: CROCKER | N466: CROOK | P466: HILL | W466: MORDIALLOC | X466: 7 | Y466: 2 | Z466: 0 | AA466: 1267 | AB466: 784 | AC466: =(AA466*100)/AB466 -> 161.60714285714286 | AD466: =(X466*4)+(Z466*2) -> 28
A468: OAKLEIGH | C468: 4 | D468: 3 | E468: =C468*6+D468 -> 27 | G468: 9 | H468: 6 | I468: =G468*6+H468 -> 60 | K468: 13 | L468: 9 | M468: =K468*6+L468 -> 87 | O468: 16 | P468: 11 | Q468: =O468*6+P468 -> 107 | S468: SUNSHINE | W468: SPRINGVALE | X468: 6 | Y468: 3 | Z468: 0 | AA468: 1227 | AB468: 892 | AC468: =(AA468*100)/AB468 -> 137.55605381165918 | AD468: =(X468*4)+(Z468*2) -> 24
A469: SUNSHINE | C469: 1 | D469: 0 | E469: =C469*6+D469 -> 6 | G469: 2 | H469: 4 | I469: =G469*6+H469 -> 16 | K469: 3 | L469: 6 | M469: =K469*6+L469 -> 24 | O469: 7 | P469: 6 | Q469: =O469*6+P469 -> 48 | S469: MORGAN | W469: CAULFIELD | X469: 5 | Y469: 4 | Z469: 0 | AA469: 1142 | AB469: 897 | AC469: =(AA469*100)/AB469 -> 127.31326644370122 | AD469: =(X469*4)+(Z469*2) -> 20
A470: BEST PLAYERS | S470: SERONG | W470: NORTHCOTE | X470: 4 | Y470: 5 | Z470: 0 | AA470: 1150 | AB470: 1013 | AC470: =(AA470*100)/AB470 -> 113.52418558736426 | AD470: =(X470*4)+(Z470*2) -> 16
A471: OAKLEIGH | C471: CARTER | F471: HARPER | I471: GOODMAN | L471: COLLINS | N471: ROACH | W471: MOORABBIN | X471: 3 | Y471: 6 | Z471: 0 | AA471: 979 | AB471: 1066 | AC471: =(AA471*100)/AB471 -> 91.838649155722322 | AD471: =(X471*4)+(Z471*2) -> 12
A472: SUNSHINE | C472: N/A | W472: BERWICK | X472: 3 | Y472: 6 | Z472: 0 | AA472: 747 | AB472: 1104 | AC472: =(AA472*100)/AB472 -> 67.663043478260875 | AD472: =(X472*4)+(Z472*2) -> 12
A473: GOALKICKERS | W473: KILSYTH | X473: 2 | Y473: 7 | Z473: 0 | AA473: 757 | AB473: 1451 | AC473: =(AA473*100)/AB473 -> 52.170916609235007 | AD473: =(X473*4)+(Z473*2) -> 8
A474: OAKLEIGH | C474: HIGGINS 7 | F474: NEALY 5 | H474: S OWEN 2 | K474: COLLINS | M474: GOODMAN | W474: SUNSHINE | X474: 2 | Y474: 7 | Z474: 0 | AA474: 690 | AB474: 1583 | AC474: =(AA474*100)/AB474 -> 43.588123815540115 | AD474: =(X474*4)+(Z474*2) -> 8
A475: SUNSHINE | C475: WILLIAMS 2 | F475: CAMPBELL 2 | I475: WAGLAND 2 | L475: MITVALSKY | W475: YARRAVILLE | X475: 0 | Y475: 9 | Z475: 0 | AA475: 636 | AB475: 1519 | AC475: =(AA475*100)/AB475 -> 41.86965108624095 | AD475: =(X475*4)+(Z475*2) -> 0
A477: MORDIALLOC | C477: 4 | D477: 2 | E477: =C477*6+D477 -> 26 | G477: 6 | H477: 2 | I477: =G477*6+H477 -> 38 | K477: 9 | L477: 4 | M477: =K477*6+L477 -> 58 | O477: 10 | P477: 6 | Q477: =O477*6+P477 -> 66 | S477: MORDIALLOC
A478: NORTHCOTE | C478: 1 | D478: 4 | E478: =C478*6+D478 -> 10 | G478: 3 | H478: 9 | I478: =G478*6+H478 -> 27 | K478: 6 | L478: 13 | M478: =K478*6+L478 -> 49 | O478: 7 | P478: 15 | Q478: =O478*6+P478 -> 57 | S478: SERONG/FITZGERALD
A479: BEST PLAYERS
A480: MORDIALLOC | C480: EMBERSON | F480: WHITTAKER | I480: WARREN | L480: SUMMERON | O480: O'HANLON | R480: BROMLEY
A481: NORTHCOTE | C481: ROULSTON | F481: JIM CHRISTOU | I481: MULQUEEN | L481: JOHN CHRISTOU | O481: HYDE | R481: RYAN
A482: GOALKICKERS
A483: MORDIALLOC | C483: NEVILLE 3 | F483: O'HANLON | H483: DEATON | J483: PAGNOCCOLO | M483: EMBERSON | O483: BROMLEY | R483: PRENTIS | T483: NORMAN
A484: NORTHCOTE | C484: JIM CHRISTOU 3 | G484: BRAIN | I484: CEPPI | K484: CUFF | M484: MINNETT
A486: BERWICK | C486: 3 | D486: 7 | E486: =C486*6+D486 -> 25 | G486: 4 | H486: 8 | I486: =G486*6+H486 -> 32 | K486: 11 | L486: 12 | M486: =K486*6+L486 -> 78 | O486: 14 | P486: 16 | Q486: =O486*6+P486 -> 100 | S486: BERWICK
A487: MOORABBIN | C487: 1 | D487: 1 | E487: =C487*6+D487 -> 7 | G487: 4 | H487: 4 | I487: =G487*6+H487 -> 28 | K487: 7 | L487: 5 | M487: =K487*6+L487 -> 47 | O487: 11 | P487: 5 | Q487: =O487*6+P487 -> 71 | S487: RYAN/STABB
A488: BEST PLAYERS
A489: BERWICK | C489: CREBBIN | F489: WARD | I489: GAMBETTA | L489: ALLEN | O489: JOHNSON
A490: MOORABBIN | C490: CAMERON | F490: KNIGHT | I490: B CATHCART | L490: HATTAM | O490: WILSON
A491: GOALKICKERS
A492: BERWICK | C492: WARD 4 | E492: TRIGG 2 | G492: SMITH 2 | I492: JOHNSON | K492: LUXFORD | M492: McGILL | O492: VENVILLE | Q492: MANNENS | T492: ALLEN
A493: MOORABBIN | C493: KNIGHT 4 | E493: WELLS 3 | G493: GOSS | I493: MILLS | K493: JONES | M493: HALE
A495: SPRINGVALE | C495: 4 | D495: 4 | E495: =C495*6+D495 -> 28 | G495: 6 | H495: 6 | I495: =G495*6+H495 -> 42 | K495: 8 | L495: 16 | M495: =K495*6+L495 -> 64 | O495: 10 | P495: 18 | Q495: =O495*6+P495 -> 78 | S495: BRUNSWICK
A496: BRUNSWICK | C496: 1 | D496: 4 | E496: =C496*6+D496 -> 10 | G496: 4 | H496: 8 | I496: =G496*6+H496 -> 32 | K496: 5 | L496: 13 | M496: =K496*6+L496 -> 43 | O496: 6 | P496: 19 | Q496: =O496*6+P496 -> 55 | S496: VERGONA/STEERE
A497: BEST PLAYERS
A498: SPRINGVALE | C498: McCOMB | F498: FOWLER | I498: GRAY | L498: DICKSON | O498: CADDAYE | R498: SMITH
A499: BRUNSWICK | C499: NOLAN | F499: LAWSON | I499: SCULLY | L499: SAHLBERG | O499: BAKER | R499: WEST
A500: GOALKICKERS
A501: SPRINGVALE | C501: CADDAYE 3 | F501: GRAY 2 | H501: COOKE | J501: ANDERSON | M501: WOODMAN | P501: CARROLL | R501: LEGGATT
A502: BRUNSWICK | C502: SCULLY 2 | F502: WEST | H502: SAHLBERG | K502: RADCHENKO | N502: McGHIE
A504: KILSYTH | C504: 3 | D504: 3 | E504: =C504*6+D504 -> 21 | G504: 10 | H504: 5 | I504: =G504*6+H504 -> 65 | K504: 12 | L504: 10 | M504: =K504*6+L504 -> 82 | O504: 20 | P504: 17 | Q504: =O504*6+P504 -> 137 | S504: KILSYTH
A505: YARRAVILLE | C505: 6 | D505: 5 | E505: =C505*6+D505 -> 41 | G505: 8 | H505: 10 | I505: =G505*6+H505 -> 58 | K505: 10 | L505: 13 | M505: =K505*6+L505 -> 73 | O505: 13 | P505: 14 | Q505: =O505*6+P505 -> 92 | S505: GOLLOP/TORNEY
A506: BEST PLAYERS
A507: KILSYTH | C507: LETTS | F507: DEAGAN | I507: EDWARDS | L507: SCHOLETER | O507: WATERS | R507: JONES
A508: YARRAVILLE | C508: SPROULE | F508: MARTIN | I508: HOUGH | L508: COOKE
A509: GOALKICKERS
A510: KILSYTH | C510: DEAGAN 6 | F510: CARROLL 5 | I510: N TAYLOR 2 | L510: PRICE 2 | N510: R TAYLOR | Q510: BASS | S510: D'ANGELO
A511: YARRAVILLE | C511: SPROULE 4 | F511: MARTIN 3 | I511: LUNT 2 | K511: MOON | M511: HOUGH | O511: ARTHUR | Q511: LEGGATT
A513: ROUND 10 | E513: 19TH JUNE | J513: WEATHER | S513: PLAYED AT
D514: 1ST QTR | H514: 2ND QTR | L514: 3RD QTR | P514: FINAL | S514: OAKLEIGH
A515: CAULFIELD | C515: 7 | D515: 1 | E515: =C515*6+D515 -> 43 | G515: 12 | H515: 7 | I515: =G515*6+H515 -> 79 | K515: 15 | L515: 11 | M515: =K515*6+L515 -> 101 | O515: 21 | P515: 12 | Q515: =O515*6+P515 -> 138 | S515: UMPIRE | X515: LADDER | AB515: ROUND | AD515: 10
A516: OAKLEIGH | C516: 2 | D516: 3 | E516: =C516*6+D516 -> 15 | G516: 5 | H516: 4 | I516: =G516*6+H516 -> 34 | K516: 9 | L516: 3 | M516: =K516*6+L516 -> 57 | O516: 11 | P516: 10 | Q516: =O516*6+P516 -> 76 | S516: MARCY/HUTCHISON
A517: BEST PLAYERS | W517: TEAM | X517: W | Y517: L | Z517: D | AA517: FOR | AB517: AGST | AC517: % | AD517: PTS
A518: CAULFIELD | C518: BOOTH | F518: HILL | H518: DAWSON | K518: BLAKE | N518: DUNCAN | Q518: SUTHERLAND
A519: OAKLEIGH | C519: SPLATT | F519: TODD | H519: HIGGINS | K519: GREENWOOD | N519: McDONALD | Q519: CARTER | W519: BOX HILL | X519: 8 | Y519: 2 | Z519: 0 | AA519: 1586 | AB519: 796 | AC519: =(AA519*100)/AB519 -> 199.2462311557789 | AD519: =(X519*4)+(Z519*2) -> 32
A520: GOALKICKERS | W520: MORDIALLOC | X520: 8 | Y520: 2 | Z520: 0 | AA520: 1396 | AB520: 911 | AC520: =(AA520*100)/AB520 -> 153.23819978046103 | AD520: =(X520*4)+(Z520*2) -> 32
A521: CAULFIELD | C521: BLAKE 7 | F521: BOOTH 4 | H521: FOOTE 2 | J521: PEARCE 2 | L521: CRANNY 2 | N521: DAWSON 2 | Q521: HILL | R521: MCLEOD | W521: OAKLEIGH | X521: 8 | Y521: 2 | Z521: 0 | AA521: 1289 | AB521: 881 | AC521: =(AA521*100)/AB521 -> 146.31101021566403 | AD521: =(X521*4)+(Z521*2) -> 32
A522: OAKLEIGH | C522: HIGGINS 7 | F522: HEVERIN | I522: LOWE | K522: NEARY | M522: COLLINS | W522: BRUNSWICK | X522: 7 | Y522: 3 | Z522: 0 | AA522: 1399 | AB522: 943 | AC522: =(AA522*100)/AB522 -> 148.35630965005302 | AD522: =(X522*4)+(Z522*2) -> 28
A524: BOX HILL | C524: 5 | D524: 2 | E524: =C524*6+D524 -> 32 | G524: 13 | H524: 3 | I524: =G524*6+H524 -> 81 | K524: 20 | L524: 6 | M524: =K524*6+L524 -> 126 | O524: 25 | P524: 11 | Q524: =O524*6+P524 -> 161 | S524: BOX HILL | W524: SPRINGVALE | X524: 6 | Y524: 4 | Z524: 0 | AA524: 1354 | AB524: 1021 | AC524: =(AA524*100)/AB524 -> 132.615083251714 | AD524: =(X524*4)+(Z524*2) -> 24
A525: BRUNSWICK | C525: 4 | D525: 5 | E525: =C525*6+D525 -> 29 | G525: 9 | H525: 10 | I525: =G525*6+H525 -> 64 | K525: 16 | L525: 12 | M525: =K525*6+L525 -> 108 | O525: 17 | P525: 19 | Q525: =O525*6+P525 -> 121 | S525: OGSTON | W525: CAULFIELD | X525: 6 | Y525: 4 | Z525: 0 | AA525: 1280 | AB525: 973 | AC525: =(AA525*100)/AB525 -> 131.551901336074 | AD525: =(X525*4)+(Z525*2) -> 24
A526: BEST PLAYERS | S526: OAKLEY | W526: NORTHCOTE | X526: 5 | Y526: 5 | Z526: 0 | AA526: 1284 | AB526: 1091 | AC526: =(AA526*100)/AB526 -> 117.69019248395966 | AD526: =(X526*4)+(Z526*2) -> 20
A527: BOX HILL | C527: NICHOLSON | F527: GLEESON | I527: GARTH | K527: R WITNISH | N527: HEDGER | Q527: DICKENSON | W527: MOORABBIN | X527: 4 | Y527: 6 | Z527: 0 | AA527: 1187 | AB527: 1128 | AC527: =(AA527*100)/AB527 -> 105.23049645390071 | AD527: =(X527*4)+(Z527*2) -> 16
A528: BRUNSWICK | C528: SCULLY | F528: GUMBLETON | I528: WEST | K528: BAKER | N528: SAHLBERG | Q528: THORNTON | W528: BERWICK | X528: 3 | Y528: 7 | Z528: 0 | AA528: 825 | AB528: 1238 | AC528: =(AA528*100)/AB528 -> 66.639741518578347 | AD528: =(X528*4)+(Z528*2) -> 12
A529: GOALKICKERS | E529: HEDGER 2 | H529: VARNEY | J529: WITHERS | M529: BOLTON | O529: CRUSE | W529: KILSYTH | X529: 3 | Y529: 7 | Z529: 0 | AA529: 889 | AB529: 1560 | AC529: =(AA529*100)/AB529 -> 56.987179487179489 | AD529: =(X529*4)+(Z529*2) -> 12
A530: BOX HILL | C530: GARTH 4 | E530: NICHOLSON 3 | H530: KAINEY 3 | J530: DICKENSON 3 | M530: R WITNISH 2 | P530: P WITNISH 2 | S530: SCHADE 2 | W530: SUNSHINE | X530: 2 | Y530: 8 | Z530: 0 | AA530: 799 | AB530: 1715 | AC530: =(AA530*100)/AB530 -> 46.588921282798836 | AD530: =(X530*4)+(Z530*2) -> 8
A531: BRUNSWICK | C531: SAHLBERG 3 | F531: GUMBLETON 2 | I531: NOLAN 2 | K531: RADCHENKO 2 | N531: ROBERTSON 2 | Q531: SAGGERS 2 | S531: WEST 2 | W531: YARRAVILLE | X531: 0 | Y531: 10 | Z531: 0 | AA531: 698 | AB531: 1727 | AC531: =(AA531*100)/AB531 -> 40.416907932831499 | AD531: =(X531*4)+(Z531*2) -> 0
N532: JARMAN | Q532: TOY
A533: KILSYTH | C533: 7 | D533: 4 | E533: =C533*6+D533 -> 46 | G533: 13 | H533: 11 | I533: =G533*6+H533 -> 89 | K533: 17 | L533: 12 | M533: =K533*6+L533 -> 114 | O533: 20 | P533: 12 | Q533: =O533*6+P533 -> 132 | S533: SUNSHINE
A534: SUNSHINE | C534: 2 | D534: 4 | E534: =C534*6+D534 -> 16 | G534: 4 | H534: 7 | I534: =G534*6+H534 -> 31 | K534: 12 | L534: 10 | M534: =K534*6+L534 -> 82 | O534: 16 | P534: 13 | Q534: =O534*6+P534 -> 109 | S534: PHILLIPS/THOMSON
A535: BEST PLAYERS
A536: KILSYTH | C536: SCHNEIDER | F536: EDWARDS | I536: ROBINS | L536: TAYLOR | O536: CARROLL | R536: JONES
A537: SUNSHINE | C537: WAGLAND | F537: GORE | I537: HUNT | L537: B MENADUE | O537: LOVELL | R537: WILLIAMS
A538: GOALKICKERS
A539: KILSYTH | C539: CARROLL 8 | F539: BASS 3 | H539: MUIR 3 | J539: D'ANGELO 2 | M539: JONES 2 | O539: DEAGAN 2
A540: SUNSHINE | C540: GORE 6 | E540: CHANDLER 3 | H540: LOVELL 2 | J540: VADJNAL 2 | M540: WAGLAND | P540: WILLIAMS
A542: MORDIALLOC | C542: 8 | D542: 4 | E542: =C542*6+D542 -> 52 | G542: 11 | H542: 7 | I542: =G542*6+H542 -> 73 | K542: 15 | L542: 11 | M542: =K542*6+L542 -> 101 | O542: 19 | P542: 15 | Q542: =O542*6+P542 -> 129 | S542: NEWCOMEN RD
A543: SPRINGVALE | C543: 4 | D543: 2 | E543: =C543*6+D543 -> 26 | G543: 10 | H543: 7 | I543: =G543*6+H543 -> 67 | K543: 13 | L543: 12 | M543: =K543*6+L543 -> 90 | O543: 19 | P543: 13 | Q543: =O543*6+P543 -> 127 | S543: ALLSOP/BLOOM
A544: BEST PLAYERS
A545: MORDIALLOC | C545: N/A
A546: SPRINGVALE | C546: ANDERSON | F546: WOODMAN | I546: CARROLL | L546: FOTINIOTIS | O546: DEMPSTER | R546: PADULA
A547: GOALKICKERS
A548: MORDIALLOC | C548: NEVILLE 9 | F548: DEATON 4 | I548: DE MUNK 2 | L548: KERIN | N548: WALSH | P548: BROMLEY | R548: HALE
A549: SPRINGVALE | C549: COOKE 3 | E549: ANDERSON 3 | H549: SMITH 3 | J549: DEMPSTER 2 | M549: CARROLL 2 | O549: FOTINIOTIS 2 | R549: PADULA 2 | T549: NEWMAN | W549: CADDAYE
A551: NORTHCOTE | C551: 3 | D551: 5 | E551: =C551*6+D551 -> 23 | G551: 7 | H551: 8 | I551: =G551*6+H551 -> 50 | K551: 11 | L551: 11 | M551: =K551*6+L551 -> 77 | O551: 20 | P551: 14 | Q551: =O551*6+P551 -> 134 | S551: NORTHCOTE
A552: BERWICK | C552: 2 | D552: 4 | E552: =C552*6+D552 -> 16 | G552: 6 | H552: 8 | I552: =G552*6+H552 -> 44 | K552: 10 | L552: 11 | M552: =K552*6+L552 -> 71 | O552: 11 | P552: 12 | Q552: =O552*6+P552 -> 78 | S552: STEERE/MORGAN
A553: BEST PLAYERS
A554: NORTHCOTE | C554: RYAN | F554: JIM CHRISTOU | I554: ARMSTRONG | L554: MULQUEEN | O554: JURGENSTEIN | R554: JOHN CHRISTOU
A555: BERWICK | C555: JOHNSON | F555: CHANDLER | I555: TRIGG | L555: ALLEN | O555: HUGHES
A556: GOALKICKERS
A557: NORTHCOTE | C557: JURGENSTEIN 6 | F557: JIM CHRISTOU 4 | I557: ARMSTRONG 2 | L557: CEPPI 2 | N557: CUFF 2 | P557: ARMSTRONG? 2 | S557: HARLAND | V557: MULQUEEN
A558: BERWICK | C558: CHANDLER 3 | F558: MANNENS 2 | I558: SMITH 2 | K558: VENVILLE 2 | N558: LUXFORD | P558: McGILL
A560: MOORABBIN | C560: 7 | D560: 7 | E560: =C560*6+D560 -> 49 | G560: 13 | H560: 13 | I560: =G560*6+H560 -> 91 | K560: 19 | L560: 19 | M560: =K560*6+L560 -> 133 | O560: 30 | P560: 28 | Q560: =O560*6+P560 -> 208 | S560: BENTLEIGH
A561: YARRAVILLE | C561: 1 | D561: 5 | E561: =C561*6+D561 -> 11 | G561: 3 | H561: 6 | I561: =G561*6+H561 -> 24 | K561: 6 | L561: 9 | M561: =K561*6+L561 -> 45 | O561: 8 | P561: 14 | Q561: =O561*6+P561 -> 62 | S561: BUDGE/CASEY
A562: BEST PLAYERS
A563: MOORABBIN | C563: CAMERON | F563: JONES | I563: ANGWIN | L563: STEWART | O563: KNIGHT | R563: GOSS
A564: YARRAVILLE | C564: COOKE | F564: DIMASI | I564: FENNELL | L564: HOUGH | O564: MARTIN | R564: MOLONEY
A565: GOALKICKERS
A566: MOORABBIN | C566: CAMERON 7 | F566: ATHERTON 6 | I566: STEWART 4 | K566: HALE 3 | M566: CONSTANTINOU 2 | Q566: MARSHALL 2 | T566: WILSON 2 | W566: GOSS 2 | X566: ANGWIN 2
A567: YARRAVILLE | C567: LUNT 4 | F567: SPROULE 2 | I567: DIMASI | K567: DALTON
A569: ROUND 11 | E569: 26TH JUNE | J569: WEATHER | S569: PLAYED AT
D570: 1ST QTR | H570: 2ND QTR | L570: 3RD QTR | P570: FINAL | S570: BRUNSWICK
A571: BRUNSWICK | C571: 3 | D571: 3 | E571: =C571*6+D571 -> 21 | G571: 8 | H571: 9 | I571: =G571*6+H571 -> 57 | K571: 11 | L571: 9 | M571: =K571*6+L571 -> 75 | O571: 15 | P571: 16 | Q571: =O571*6+P571 -> 106 | S571: UMPIRE | X571: LADDER | AB571: ROUND | AD571: 11
A572: OAKLEIGH | C572: 5 | D572: 3 | E572: =C572*6+D572 -> 33 | G572: 8 | H572: 4 | I572: =G572*6+H572 -> 52 | K572: 11 | L572: 8 | M572: =K572*6+L572 -> 74 | O572: 12 | P572: 9 | Q572: =O572*6+P572 -> 81 | S572: FITZPATRICK/TORNEY
A573: BEST PLAYERS | W573: TEAM | X573: W | Y573: L | Z573: D | AA573: FOR | AB573: AGST | AC573: % | AD573: PTS
A574: BRUNSWICK | C574: SCULLY | F574: GUMBLETON | I574: DOYLE | L574: BAKER | O574: B SAGGERS | R574: A SAGGERS
A575: OAKLEIGH | C575: HARPER | F575: CARTER | I575: SPLATT | L575: HEVERIN | O575: TODD | R575: GREENWOOD | W575: BOX HILL | X575: 8 | Y575: 2 | Z575: 1 | AA575: 1640 | AB575: 850 | AC575: =(AA575*100)/AB575 -> 192.94117647058823 | AD575: =(X575*4)+(Z575*2) -> 34
A576: GOALKICKERS | R576: WEST | W576: MORDIALLOC | X576: 8 | Y576: 2 | Z576: 1 | AA576: 1450 | AB576: 965 | AC576: =(AA576*100)/AB576 -> 150.25906735751295 | AD576: =(X576*4)+(Z576*2) -> 34
A577: BRUNSWICK | C577: B SAGGERS 3 | F577: RADCHENKO 3 | I577: HICKMAN 2 | K577: ROBERTSON 2 | N577: LAWSON | P577: LEAHY | R577: NOLAN | T577: SAHLBERG | W577: BRUNSWICK | X577: 8 | Y577: 3 | Z577: 0 | AA577: 1505 | AB577: 1024 | AC577: =(AA577*100)/AB577 -> 146.97265625 | AD577: =(X577*4)+(Z577*2) -> 32
A578: OAKLEIGH | C578: HIGGINS 3 | F578: LOWE 3 | I578: BRYDON 3 | L578: HARPER 3 | W578: OAKLEIGH | X578: 8 | Y578: 3 | Z578: 0 | AA578: 1370 | AB578: 987 | AC578: =(AA578*100)/AB578 -> 138.80445795339412 | AD578: =(X578*4)+(Z578*2) -> 32
A580: MORDIALLOC | C580: 3 | D580: 1 | E580: =C580*6+D580 -> 19 | G580: 5 | H580: 5 | I580: =G580*6+H580 -> 35 | K580: 7 | L580: 6 | M580: =K580*6+L580 -> 48 | O580: 8 | P580: 6 | Q580: =O580*6+P580 -> 54 | S580: MORDIALLOC | W580: CAULFIELD | X580: 7 | Y580: 4 | Z580: 0 | AA580: 1418 | AB580: 1030 | AC580: =(AA580*100)/AB580 -> 137.66990291262135 | AD580: =(X580*4)+(Z580*2) -> 28
A581: BOX HILL | C581: 2 | D581: 5 | E581: =C581*6+D581 -> 17 | G581: 4 | H581: 11 | I581: =G581*6+H581 -> 35 | K581: 5 | L581: 12 | M581: =K581*6+L581 -> 42 | O581: 6 | P581: 18 | Q581: =O581*6+P581 -> 54 | S581: MORGAN | W581: SPRINGVALE | X581: 7 | Y581: 4 | Z581: 0 | AA581: 1408 | AB581: 1058 | AC581: =(AA581*100)/AB581 -> 133.0812854442344 | AD581: =(X581*4)+(Z581*2) -> 28
A582: BEST PLAYERS | S582: RYAN | W582: NORTHCOTE | X582: 6 | Y582: 5 | Z582: 0 | AA582: 1436 | AB582: 1146 | AC582: =(AA582*100)/AB582 -> 125.30541012216405 | AD582: =(X582*4)+(Z582*2) -> 24
A583: MORDIALLOC | C583: O'HANLON | F583: SUMMERIN | I583: EMBERSON | L583: LANG | W583: MOORABBIN | X583: 5 | Y583: 6 | Z583: 0 | AA583: 1282 | AB583: 1208 | AC583: =(AA583*100)/AB583 -> 106.12582781456953 | AD583: =(X583*4)+(Z583*2) -> 20
A584: BOX HILL | C584: NICHOLSON | F584: R WITNISH | I584: A DICKENSON | L584: SCHADE | N584: P WITNISH | Q584: CHARLES | W584: BERWICK | X584: 3 | Y584: 8 | Z584: 0 | AA584: 862 | AB584: 1292 | AC584: =(AA584*100)/AB584 -> 66.71826625386997 | AD584: =(X584*4)+(Z584*2) -> 12
A585: GOALKICKERS | W585: KILSYTH | X585: 3 | Y585: 8 | Z585: 0 | AA585: 969 | AB585: 1655 | AC585: =(AA585*100)/AB585 -> 58.549848942598189 | AD585: =(X585*4)+(Z585*2) -> 12
A586: MORDIALLOC | C586: NEVILLE 3 | F586: DEATON 3 | I586: EMBERSON | L586: WHITTAKER | W586: SUNSHINE | X586: 2 | Y586: 9 | Z586: 0 | AA586: 856 | AB586: 1873 | AC586: =(AA586*100)/AB586 -> 45.702082221035774 | AD586: =(X586*4)+(Z586*2) -> 8
A587: BOX HILL | C587: NICHOLSON 2 | F587: KAINEY | I587: A DICKENSON | L587: DODD | N587: SCHADE | W587: YARRAVILLE | X587: 0 | Y587: 11 | Z587: 0 | AA587: 753 | AB587: 1879 | AC587: =(AA587*100)/AB587 -> 40.074507716870677 | AD587: =(X587*4)+(Z587*2) -> 0
A589: SPRINGVALE | C589: 3 | D589: 5 | E589: =C589*6+D589 -> 23 | G589: 4 | H589: 11 | I589: =G589*6+H589 -> 35 | K589: 5 | L589: 15 | M589: =K589*6+L589 -> 45 | O589: 6 | P589: 18 | Q589: =O589*6+P589 -> 54 | S589: BERWICK
A590: BERWICK | C590: 1 | D590: 2 | E590: =C590*6+D590 -> 8 | G590: 2 | H590: 5 | I590: =G590*6+H590 -> 17 | K590: 3 | L590: 7 | M590: =K590*6+L590 -> 25 | O590: 5 | P590: 7 | Q590: =O590*6+P590 -> 37 | S590: MAY/PHAIR
A591: BEST PLAYERS
A592: SPRINGVALE | C592: FOWLER | F592: WOODMAN | I592: GRAY | K592: SMITH | N592: JOB | P592: DEMPSTER
A593: BERWICK | C593: JOHNSON | F593: HUGHES | I593: ALLEN | K593: SHEARS | N593: GAMBETTA
A594: GOALKICKERS
A595: SPRINGVALE | C595: ANDERSON 2 | F595: COOKE | H595: WOODMAN | K595: CADDAYE | N595: GRAY
A596: BERWICK | C596: SYMONS | F596: WARD | H596: VENVILLE | K596: CHANDLER | N596: SMITH
A598: CAULFIELD | C598: 4 | D598: 2 | E598: =C598*6+D598 -> 26 | G598: 14 | H598: 6 | I598: =G598*6+H598 -> 90 | K598: 21 | L598: 13 | M598: =K598*6+L598 -> 139 | O598: 23 | P598: 20 | Q598: =O598*6+P598 -> 158 | S598: PRINCES PARK, CAULFIELD
A599: SUNSHINE | C599: 4 | D599: 4 | E599: =C599*6+D599 -> 28 | G599: 4 | H599: 4 | I599: =G599*6+H599 -> 28 | K599: 6 | L599: 4 | M599: =K599*6+L599 -> 40 | O599: 8 | P599: 9 | Q599: =O599*6+P599 -> 57 | S599: ELSUM/BRADSHAW
A600: BEST PLAYERS
A601: CAULFIELD | C601: DUNCAN | F601: DAWSON | I601: BOOTH | K601: CROCKER | N601: McLEOD | P601: CRANNY
A602: SUNSHINE | C602: CAMPBELL | F602: WAGLAND | I602: GRAY | K602: WHITNEY | N602: CROSBIE | P602: HUNT
A603: GOALKICKERS
A604: CAULFIELD | C604: BLAKE 6 | E604: MCLEOD 4 | G604: PEARCE 3 | I604: HILL 3 | K604: BOOTH 3 | M604: CROCKER | O604: CROOK | Q604: DAWSON | S604: CRANNY
A605: SUNSHINE | C605: GORE 2 | E605: CAMPBELL | G605: WAGLAND | J605: WILLIAMS | M605: WHITNEY | O605: BIANCO | Q605: CHANDLER
A607: MOORABBIN | C607: 4 | D607: 4 | E607: =C607*6+D607 -> 28 | G607: 9 | H607: 7 | I607: =G607*6+H607 -> 61 | K607: 11 | L607: 10 | M607: =K607*6+L607 -> 76 | O607: 14 | P607: 11 | Q607: =O607*6+P607 -> 95 | S607: KILSYTH
A608: KILSYTH | C608: 1 | D608: 4 | E608: =C608*6+D608 -> 10 | G608: 5 | H608: 8 | I608: =G608*6+H608 -> 38 | K608: 8 | L608: 11 | M608: =K608*6+L608 -> 59 | O608: 11 | P608: 14 | Q608: =O608*6+P608 -> 80 | S608: ALLSOP/KENNEDY
A609: BEST PLAYERS
A610: MOORABBIN | C610: WILSON | F610: KNIGHT | I610: ANGWIN | K610: CAMERON | N610: TONKS | Q610: HARDEMAN
A611: KILSYTH | C611: ROBINS | F611: EDWARDS | I611: DEAGAN | K611: D'ANGELO | N611: N TAYLOR | Q611: LINNELL
A612: GOALKICKERS
A613: MOORABBIN | C613: HARDEMAN 6 | F613: MARSHALL 3 | I613: ANGWIN 2 | K613: STEWART 2 | N613: WILSON
A614: KILSYTH | C614: CARROLL 5 | F614: DEAGAN 2 | I614: HALBERT 2 | L614: N TAYLOR | O614: LETTS
A616: NORTHCOTE | C616: 7 | D616: 4 | E616: =C616*6+D616 -> 46 | G616: 11 | H616: 12 | I616: =G616*6+H616 -> 78 | K616: 16 | L616: 18 | M616: =K616*6+L616 -> 114 | O616: 22 | P616: 20 | Q616: =O616*6+P616 -> 152 | S616: YARRAVILLE
A617: YARRAVILLE | C617: 4 | D617: 3 | E617: =C617*6+D617 -> 27 | G617: 5 | H617: 6 | I617: =G617*6+H617 -> 36 | K617: 7 | L617: 6 | M617: =K617*6+L617 -> 48 | O617: 8 | P617: 7 | Q617: =O617*6+P617 -> 55 | S617: BLOOM/HUTCHISON
A618: BEST PLAYERS
A619: NORTHCOTE | C619: JIM CHRISTOU | F619: ROULSTON | I619: ARMSTRONG | L619: RYAN | O619: HYDE | R619: MINNETT
A620: YARRAVILLE | C620: COOKE | F620: MOON | I620: LOBAZZA | L620: FENNELL | O620: SANDERSON | R620: DIDOLIS
A621: GOALKICKERS
A622: NORTHCOTE | C622: JIM CHRISTOU 7 | G622: HARLAND 4 | J622: JURGENSTEIN 3 | M622: ARMSTRONG 3 | P622: DURANT 2 | S622: MULQUEEN | V622: STAOIS | X622: ASTBURY
A623: YARRAVILLE | C623: DIDOLIS 2 | F623: MOON 2 | I623: SANDERSON 2 | L623: HOUGH 2
A625: ROUND 12 | E625: 3RD JULY | J625: WEATHER | S625: PLAYED AT
D626: 1ST QTR | H626: 2ND QTR | L626: 3RD QTR | P626: FINAL | S626: MORDIALLOC
A627: MORDIALLOC | C627: 5 | D627: 5 | E627: =C627*6+D627 -> 35 | G627: 10 | H627: 6 | I627: =G627*6+H627 -> 66 | K627: 14 | L627: 8 | M627: =K627*6+L627 -> 92 | O627: 16 | P627: 9 | Q627: =O627*6+P627 -> 105 | S627: UMPIRE | X627: LADDER | AB627: ROUND | AD627: 12
A628: OAKLEIGH | C628: 1 | D628: 1 | E628: =C628*6+D628 -> 7 | G628: 6 | H628: 4 | I628: =G628*6+H628 -> 40 | K628: 8 | L628: 6 | M628: =K628*6+L628 -> 54 | O628: 10 | P628: 10 | Q628: =O628*6+P628 -> 70
A629: BEST PLAYERS | W629: TEAM | X629: W | Y629: L | Z629: D | AA629: FOR | AB629: AGST | AC629: % | AD629: PTS
A630: MORDIALLOC
A631: OAKLEIGH | W631: BOX HILL | X631: 9 | Y631: 2 | Z631: 1 | AA631: 1740 | AB631: 898 | AC631: =(AA631*100)/AB631 -> 193.76391982182628 | AD631: =(X631*4)+(Z631*2) -> 38
A632: GOALKICKERS | W632: MORDIALLOC | X632: 9 | Y632: 2 | Z632: 1 | AA632: 1555 | AB632: 1035 | AC632: =(AA632*100)/AB632 -> 150.2415458937198 | AD632: =(X632*4)+(Z632*2) -> 38
A633: MORDIALLOC | W633: BRUNSWICK | X633: 9 | Y633: 3 | Z633: 0 | AA633: 1812 | AB633: 1056 | AC633: =(AA633*100)/AB633 -> 171.59090909090909 | AD633: =(X633*4)+(Z633*2) -> 36
A634: OAKLEIGH | W634: SPRINGVALE | X634: 8 | Y634: 4 | Z634: 0 | AA634: 1641 | AB634: 1142 | AC634: =(AA634*100)/AB634 -> 143.69527145359018 | AD634: =(X634*4)+(Z634*2) -> 32
A636: NORTHCOTE | C636: 5 | D636: 3 | E636: =C636*6+D636 -> 33 | G636: 7 | H636: 5 | I636: =G636*6+H636 -> 47 | K636: 7 | L636: 8 | M636: =K636*6+L636 -> 50 | O636: 10 | P636: 13 | Q636: =O636*6+P636 -> 73 | S636: BENTLEIGH | W636: CAULFIELD | X636: 8 | Y636: 4 | Z636: 0 | AA636: 1498 | AB636: 1046 | AC636: =(AA636*100)/AB636 -> 143.21223709369025 | AD636: =(X636*4)+(Z636*2) -> 32
A637: MOORABBIN | C637: 1 | D637: 1 | E637: =C637*6+D637 -> 7 | G637: 4 | H637: 4 | I637: =G637*6+H637 -> 28 | K637: 6 | L637: 10 | M637: =K637*6+L637 -> 46 | O637: 6 | P637: 12 | Q637: =O637*6+P637 -> 48 | W637: OAKLEIGH | X637: 8 | Y637: 4 | Z637: 0 | AA637: 1440 | AB637: 1092 | AC637: =(AA637*100)/AB637 -> 131.86813186813185 | AD637: =(X637*4)+(Z637*2) -> 32
A638: BEST PLAYERS | W638: NORTHCOTE | X638: 7 | Y638: 5 | Z638: 0 | AA638: 1509 | AB638: 1194 | AC638: =(AA638*100)/AB638 -> 126.38190954773869 | AD638: =(X638*4)+(Z638*2) -> 28
A639: NORTHCOTE | W639: MOORABBIN | X639: 5 | Y639: 7 | Z639: 0 | AA639: 1330 | AB639: 1281 | AC639: =(AA639*100)/AB639 -> 103.82513661202186 | AD639: =(X639*4)+(Z639*2) -> 20
A640: MOORABBIN | W640: BERWICK | X640: 3 | Y640: 9 | Z640: 0 | AA640: 910 | AB640: 1392 | AC640: =(AA640*100)/AB640 -> 65.3735632183908 | AD640: =(X640*4)+(Z640*2) -> 12
A641: GOALKICKERS | W641: KILSYTH | X641: 3 | Y641: 9 | Z641: 0 | AA641: 985 | AB641: 1735 | AC641: =(AA641*100)/AB641 -> 56.772334293948127 | AD641: =(X641*4)+(Z641*2) -> 12
A642: NORTHCOTE | W642: SUNSHINE | X642: 2 | Y642: 10 | Z642: 0 | AA642: 888 | AB642: 2180 | AC642: =(AA642*100)/AB642 -> 40.73394495412844 | AD642: =(X642*4)+(Z642*2) -> 8
A643: MOORABBIN | W643: YARRAVILLE | X643: 0 | Y643: 12 | Z643: 0 | AA643: 837 | AB643: 2112 | AC643: =(AA643*100)/AB643 -> 39.63068181818182 | AD643: =(X643*4)+(Z643*2) -> 0
A645: SPRINGVALE | C645: 11 | D645: 3 | E645: =C645*6+D645 -> 69 | G645: 22 | H645: 5 | I645: =G645*6+H645 -> 137 | K645: 26 | L645: 14 | M645: =K645*6+L645 -> 170 | O645: 36 | P645: 17 | Q645: =O645*6+P645 -> 233 | S645: YARRAVILLE
A646: YARRAVILLE | C646: 3 | D646: 1 | E646: =C646*6+D646 -> 19 | G646: 6 | H646: 3 | I646: =G646*6+H646 -> 39 | K646: 8 | L646: 5 | M646: =K646*6+L646 -> 53 | O646: 13 | P646: 6 | Q646: =O646*6+P646 -> 84
A647: BEST PLAYERS
A648: SPRINGVALE
A649: YARRAVILLE
A650: GOALKICKERS
A651: SPRINGVALE
A652: YARRAVILLE
A654: BOX HILL | C654: 3 | D654: 8 | E654: =C654*6+D654 -> 26 | G654: 7 | H654: 12 | I654: =G654*6+H654 -> 54 | K654: 12 | L654: 18 | M654: =K654*6+L654 -> 90 | O654: 13 | P654: 22 | Q654: =O654*6+P654 -> 100 | S654: BERWICK
A655: BERWICK | C655: 1 | D655: 2 | E655: =C655*6+D655 -> 8 | G655: 3 | H655: 4 | I655: =G655*6+H655 -> 22 | K655: 7 | L655: 4 | M655: =K655*6+L655 -> 46 | O655: 7 | P655: 6 | Q655: =O655*6+P655 -> 48
A656: BEST PLAYERS
A657: BOX HILL
A658: BERWICK
A659: GOALKICKERS
A660: BOX HILL
A661: BERWICK
A663: CAULFIELD | C663: 3 | D663: 5 | E663: =C663*6+D663 -> 23 | G663: 6 | H663: 9 | I663: =G663*6+H663 -> 45 | K663: 9 | L663: 11 | M663: =K663*6+L663 -> 65 | O663: 11 | P663: 14 | Q663: =O663*6+P663 -> 80 | S663: KILSYTH
A664: KILSYTH | C664: 1 | D664: 0 | E664: =C664*6+D664 -> 6 | G664: 2 | H664: 1 | I664: =G664*6+H664 -> 13 | K664: 2 | L664: 1 | M664: =K664*6+L664 -> 13 | O664: 2 | P664: 4 | Q664: =O664*6+P664 -> 16
A665: BEST PLAYERS
A666: CAULFIELD
A667: KILSYTH
A668: GOALKICKERS
A669: CAULFIELD
A670: KILSYTH
A672: BRUNSWICK | C672: 16 | D672: 3 | E672: =C672*6+D672 -> 99 | G672: 26 | H672: 9 | I672: =G672*6+H672 -> 165 | K672: 40 | L672: 19 | M672: =K672*6+L672 -> 259 | O672: 46 | P672: 31 | Q672: =O672*6+P672 -> 307 | S672: BRUNSWICK
A673: SUNSHINE | C673: 1 | D673: 0 | E673: =C673*6+D673 -> 6 | G673: 3 | H673: 1 | I673: =G673*6+H673 -> 19 | K673: 4 | L673: 1 | M673: =K673*6+L673 -> 25 | O673: 5 | P673: 2 | Q673: =O673*6+P673 -> 32
A674: BEST PLAYERS
A675: BRUNSWICK
A676: SUNSHINE
A677: GOALKICKERS
A678: BRUNSWICK
A679: SUNSHINE
A681: ROUND 13 | E681: 10TH JULY | J681: WEATHER | S681: PLAYED AT
D682: 1ST QTR | H682: 2ND QTR | L682: 3RD QTR | P682: FINAL | S682: BRUNSWICK
A683: BRUNSWICK | C683: 2 | D683: 3 | E683: =C683*6+D683 -> 15 | G683: 8 | H683: 10 | I683: =G683*6+H683 -> 58 | K683: 11 | L683: 13 | M683: =K683*6+L683 -> 79 | O683: 16 | P683: 18 | Q683: =O683*6+P683 -> 114 | S683: UMPIRE | X683: LADDER | AB683: ROUND | AD683: 13
A684: CAULFIELD | C684: 4 | D684: 4 | E684: =C684*6+D684 -> 28 | G684: 6 | H684: 7 | I684: =G684*6+H684 -> 43 | K684: 9 | L684: 10 | M684: =K684*6+L684 -> 64 | O684: 11 | P684: 13 | Q684: =O684*6+P684 -> 79
A685: BEST PLAYERS | W685: TEAM | X685: W | Y685: L | Z685: D | AA685: FOR | AB685: AGST | AC685: % | AD685: PTS
A686: BRUNSWICK
A687: CAULFIELD | W687: BOX HILL | X687: 10 | Y687: 2 | Z687: 1 | AA687: 1878 | AB687: 990 | AC687: =(AA687*100)/AB687 -> 189.69696969696969 | AD687: =(X687*4)+(Z687*2) -> 42
A688: GOALKICKERS | W688: MORDIALLOC | X688: 10 | Y688: 2 | Z688: 1 | AA688: 1653 | AB688: 1054 | AC688: =(AA688*100)/AB688 -> 156.83111954459204 | AD688: =(X688*4)+(Z688*2) -> 42
A689: BRUNSWICK | W689: BRUNSWICK | X689: 10 | Y689: 3 | Z689: 0 | AA689: 1926 | AB689: 1135 | AC689: =(AA689*100)/AB689 -> 169.69162995594715 | AD689: =(X689*4)+(Z689*2) -> 40
A690: CAULFIELD | W690: SPRINGVALE | X690: 9 | Y690: 4 | Z690: 0 | AA690: 1780 | AB690: 1239 | AC690: =(AA690*100)/AB690 -> 143.66424535916062 | AD690: =(X690*4)+(Z690*2) -> 36
A692: SPRINGVALE | C692: 7 | D692: 1 | E692: =C692*6+D692 -> 43 | G692: 12 | H692: 6 | I692: =G692*6+H692 -> 78 | K692: 14 | L692: 11 | M692: =K692*6+L692 -> 95 | O692: 21 | P692: 13 | Q692: =O692*6+P692 -> 139 | S692: NEWCOMEN RD | W692: OAKLEIGH | X692: 9 | Y692: 4 | Z692: 0 | AA692: 1581 | AB692: 1140 | AC692: =(AA692*100)/AB692 -> 138.68421052631578 | AD692: =(X692*4)+(Z692*2) -> 36
A693: MOORABBIN | C693: 5 | D693: 1 | E693: =C693*6+D693 -> 31 | G693: 6 | H693: 6 | I693: =G693*6+H693 -> 42 | K693: 10 | L693: 10 | M693: =K693*6+L693 -> 70 | O693: 14 | P693: 13 | Q693: =O693*6+P693 -> 97 | W693: CAULFIELD | X693: 8 | Y693: 5 | Z693: 0 | AA693: 1547 | AB693: 1160 | AC693: =(AA693*100)/AB693 -> 133.36206896551724 | AD693: =(X693*4)+(Z693*2) -> 32
A694: BEST PLAYERS | W694: NORTHCOTE | X694: 8 | Y694: 5 | Z694: 0 | AA694: 1660 | AB694: 1268 | AC694: =(AA694*100)/AB694 -> 130.91482649842271 | AD694: =(X694*4)+(Z694*2) -> 32
A695: SPRINGVALE | W695: MOORABBIN | X695: 5 | Y695: 8 | Z695: 0 | AA695: 1427 | AB695: 1420 | AC695: =(AA695*100)/AB695 -> 100.49295774647888 | AD695: =(X695*4)+(Z695*2) -> 20
A696: MOORABBIN | W696: BERWICK | X696: 3 | Y696: 10 | Z696: 0 | AA696: 958 | AB696: 1533 | AC696: =(AA696*100)/AB696 -> 62.491846053489887 | AD696: =(X696*4)+(Z696*2) -> 12
A697: GOALKICKERS | W697: KILSYTH | X697: 3 | Y697: 10 | Z697: 0 | AA697: 1059 | AB697: 1886 | AC697: =(AA697*100)/AB697 -> 56.150583244962881 | AD697: =(X697*4)+(Z697*2) -> 12
A698: SPRINGVALE | W698: SUNSHINE | X698: 2 | Y698: 11 | Z698: 0 | AA698: 909 | AB698: 2278 | AC698: =(AA698*100)/AB698 -> 39.903424056189642 | AD698: =(X698*4)+(Z698*2) -> 8
A699: MOORABBIN | W699: YARRAVILLE | X699: 0 | Y699: 13 | Z699: 0 | AA699: 929 | AB699: 2250 | AC699: =(AA699*100)/AB699 -> 41.288888888888891 | AD699: =(X699*4)+(Z699*2) -> 0
A701: MORDIALLOC | C701: 3 | D701: 6 | E701: =C701*6+D701 -> 24 | G701: 5 | H701: 7 | I701: =G701*6+H701 -> 37 | K701: 8 | L701: 9 | M701: =K701*6+L701 -> 57 | O701: 14 | P701: 14 | Q701: =O701*6+P701 -> 98 | S701: MORDIALLOC
A702: SUNSHINE | C702: 1 | D702: 1 | E702: =C702*6+D702 -> 7 | G702: 1 | H702: 1 | I702: =G702*6+H702 -> 7 | K702: 2 | L702: 3 | M702: =K702*6+L702 -> 15 | O702: 3 | P702: 3 | Q702: =O702*6+P702 -> 21
A703: BEST PLAYERS
A704: MORDIALLOC
A705: SUNSHINE
A706: GOALKICKERS
A707: MORDIALLOC
A708: SUNSHINE
A710: BOX HILL | C710: 5 | D710: 8 | E710: =C710*6+D710 -> 38 | G710: 9 | H710: 12 | I710: =G710*6+H710 -> 66 | K710: 17 | L710: 18 | M710: =K710*6+L710 -> 120 | O710: 19 | P710: 24 | Q710: =O710*6+P710 -> 138 | S710: BOX HILL
A711: YARRAVILLE | C711: 1 | D711: 3 | E711: =C711*6+D711 -> 9 | G711: 10 | H711: 4 | I711: =G711*6+H711 -> 64 | K711: 10 | L711: 6 | M711: =K711*6+L711 -> 66 | O711: 14 | P711: 8 | Q711: =O711*6+P711 -> 92
A712: BEST PLAYERS
A713: BOX HILL
A714: YARRAVILLE
A715: GOALKICKERS
A716: BOX HILL
A717: YARRAVILLE
A719: OAKLEIGH | C719: 7 | D719: 2 | E719: =C719*6+D719 -> 44 | G719: 10 | H719: 4 | I719: =G719*6+H719 -> 64 | K719: 17 | L719: 8 | M719: =K719*6+L719 -> 110 | O719: 21 | P719: 15 | Q719: =O719*6+P719 -> 141 | S719: OAKLEIGH
A720: BERWICK | C720: 1 | D720: 3 | E720: =C720*6+D720 -> 9 | G720: 3 | H720: 8 | I720: =G720*6+H720 -> 26 | K720: 5 | L720: 10 | M720: =K720*6+L720 -> 40 | O720: 6 | P720: 12 | Q720: =O720*6+P720 -> 48
A721: BEST PLAYERS
A722: OAKLEIGH
A723: BERWICK
A724: GOALKICKERS
A725: OAKLEIGH
A726: BERWICK
A728: NORTHCOTE | C728: 6 | D728: 3 | E728: =C728*6+D728 -> 39 | G728: 12 | H728: 6 | I728: =G728*6+H728 -> 78 | K728: 17 | L728: 10 | M728: =K728*6+L728 -> 112 | O728: 23 | P728: 13 | Q728: =O728*6+P728 -> 151 | S728: NORTHCOTE
A729: KILSYTH | C729: 0 | D729: 4 | E729: =C729*6+D729 -> 4 | G729: 5 | H729: 6 | I729: =G729*6+H729 -> 36 | K729: 8 | L729: 8 | M729: =K729*6+L729 -> 56 | O729: 10 | P729: 14 | Q729: =O729*6+P729 -> 74
A730: BEST PLAYERS
A731: NORTHCOTE
A732: KILSYTH
A733: GOALKICKERS
A734: NORTHCOTE
A735: KILSYTH
A737: ROUND 14 | E737: 17TH JULY | J737: WEATHER | S737: PLAYED AT
D738: 1ST QTR | H738: 2ND QTR | L738: 3RD QTR | P738: FINAL | S738: BRUNSWICK
A739: BRUNSWICK | C739: 5 | D739: 3 | E739: =C739*6+D739 -> 33 | G739: 13 | H739: 7 | I739: =G739*6+H739 -> 85 | K739: 28 | L739: 13 | M739: =K739*6+L739 -> 181 | O739: 44 | P739: 19 | Q739: =O739*6+P739 -> 283 | S739: UMPIRE | X739: LADDER | AB739: ROUND | AD739: 14
A740: KILSYTH | C740: 4 | D740: 2 | E740: =C740*6+D740 -> 26 | G740: 7 | H740: 4 | I740: =G740*6+H740 -> 46 | K740: 8 | L740: 7 | M740: =K740*6+L740 -> 55 | O740: 9 | P740: 10 | Q740: =O740*6+P740 -> 64 | S740: SERONG/J RYAN
A741: BEST PLAYERS | W741: TEAM | X741: W | Y741: L | Z741: D | AA741: FOR | AB741: AGST | AC741: % | AD741: PTS
A742: BRUNSWICK | C742: SAHLBERG | F742: THORNTON | I742: LEAHY | L742: ROBERTSON | O742: LAWSON | R742: JAKSIC
A743: KILSYTH | C743: EDWARDS | F743: BIANCO | I743: SCHNEIDER | L743: ROBINS | W743: MORDIALLOC | X743: 11 | Y743: 2 | Z743: 1 | AA743: 1754 | AB743: 1116 | AC743: =(AA743*100)/AB743 -> 157.16845878136201 | AD743: =(X743*4)+(Z743*2) -> 46
A744: GOALKICKERS | G744: CALLANDER 2 | J744: LAWSON 2 | M744: ROBERTSON 2 | P744: A SAGGERS | W744: BRUNSWICK | X744: 11 | Y744: 3 | Z744: 0 | AA744: 2209 | AB744: 1199 | AC744: =(AA744*100)/AB744 -> 184.23686405337781 | AD744: =(X744*4)+(Z744*2) -> 44
A745: BRUNSWICK | C745: JAKSIC 10 | F745: SAHLBERG 7 | I745: THORNTON 5 | L745: JUDGE 4 | N745: RADCHENKO 4 | Q745: TOY 4 | S745: B SAGGERS 3 | W745: BOX HILL | X745: 10 | Y745: 3 | Z745: 1 | AA745: 1979 | AB745: 1142 | AC745: =(AA745*100)/AB745 -> 173.29246935201402 | AD745: =(X745*4)+(Z745*2) -> 42
A746: KILSYTH | C746: DEAGAN 3 | F746: CARROLL 2 | I746: N TAYLOR | L746: TORCASSIO | O746: CARPI | Q746: HALBERT | W746: OAKLEIGH | X746: 10 | Y746: 4 | Z746: 0 | AA746: 1838 | AB746: 1179 | AC746: =(AA746*100)/AB746 -> 155.89482612383375 | AD746: =(X746*4)+(Z746*2) -> 40
A748: BERWICK | C748: 4 | D748: 9 | E748: =C748*6+D748 -> 33 | G748: 11 | H748: 10 | I748: =G748*6+H748 -> 76 | K748: 21 | L748: 17 | M748: =K748*6+L748 -> 143 | O748: 26 | P748: 23 | Q748: =O748*6+P748 -> 179 | S748: BERWICK | W748: SPRINGVALE | X748: 9 | Y748: 5 | Z748: 0 | AA748: 1891 | AB748: 1380 | AC748: =(AA748*100)/AB748 -> 137.02898550724638 | AD748: =(X748*4)+(Z748*2) -> 36
A749: SUNSHINE | C749: 3 | D749: 2 | E749: =C749*6+D749 -> 20 | G749: 8 | H749: 4 | I749: =G749*6+H749 -> 52 | K749: 8 | L749: 5 | M749: =K749*6+L749 -> 53 | O749: 10 | P749: 9 | Q749: =O749*6+P749 -> 69 | S749: BLAKE | W749: NORTHCOTE | X749: 9 | Y749: 5 | Z749: 0 | AA749: 1801 | AB749: 1379 | AC749: =(AA749*100)/AB749 -> 130.60188542422046 | AD749: =(X749*4)+(Z749*2) -> 36
A750: BEST PLAYERS | S750: OAKLEY | W750: CAULFIELD | X750: 8 | Y750: 6 | Z750: 0 | AA750: 1609 | AB750: 1261 | AC750: =(AA750*100)/AB750 -> 127.59714512291832 | AD750: =(X750*4)+(Z750*2) -> 32
A751: BERWICK | W751: MOORABBIN | X751: 6 | Y751: 8 | Z751: 0 | AA751: 1579 | AB751: 1521 | AC751: =(AA751*100)/AB751 -> 103.81328073635765 | AD751: =(X751*4)+(Z751*2) -> 24
A752: SUNSHINE | W752: BERWICK | X752: 4 | Y752: 10 | Z752: 0 | AA752: 1137 | AB752: 1602 | AC752: =(AA752*100)/AB752 -> 70.973782771535582 | AD752: =(X752*4)+(Z752*2) -> 16
A753: GOALKICKERS | N753: McDONALD | Q753: HUGHES | S753: CHANDLER | W753: KILSYTH | X753: 3 | Y753: 11 | Z753: 0 | AA753: 1123 | AB753: 2169 | AC753: =(AA753*100)/AB753 -> 51.775011526048871 | AD753: =(X753*4)+(Z753*2) -> 12
A754: BERWICK | C754: TRIGG 8 | E754: WARD 3 | G754: GAMBETTA 3 | J754: VAN STEENSIL 2 | M754: VENVILLE 2 | O754: LAITY 2 | Q754: MANNENS | S754: CREBBIN | U754: SMITH | W754: SUNSHINE | X754: 2 | Y754: 12 | Z754: 0 | AA754: 978 | AB754: 2454 | AC754: =(AA754*100)/AB754 -> 39.853300733496333 | AD754: =(X754*4)+(Z754*2) -> 8
A755: SUNSHINE | C755: AXON 3 | E755: GORE 2 | G755: BENSON 2 | J755: WILLIAMS | L755: BEDGOOD | N755: CHARMAN | W755: YARRAVILLE | X755: 0 | Y755: 14 | Z755: 0 | AA755: 968 | AB755: 2507 | AC755: =(AA755*100)/AB755 -> 38.611886717191865 | AD755: =(X755*4)+(Z755*2) -> 0
A757: OAKLEIGH | C757: 6 | D757: 5 | E757: =C757*6+D757 -> 41 | G757: 17 | H757: 16 | I757: =G757*6+H757 -> 118 | K757: 26 | L757: 22 | M757: =K757*6+L757 -> 178 | O757: 38 | P757: 29 | Q757: =O757*6+P757 -> 257 | S757: OAKLEIGH
A758: YARRAVILLE | C758: 2 | D758: 4 | E758: =C758*6+D758 -> 16 | G758: 3 | H758: 7 | I758: =G758*6+H758 -> 25 | K758: 4 | L758: 8 | M758: =K758*6+L758 -> 32 | O758: 5 | P758: 9 | Q758: =O758*6+P758 -> 39 | S758: MORGAN/BREWER
A759: BEST PLAYERS
A760: OAKLEIGH
A761: YARRAVILLE
A762: GOALKICKERS
A763: OAKLEIGH | C763: LOWE 11 | E763: NEARY 11 | G763: GOODMAN 4 | J763: HARPER 3 | M763: OWEN 3 | O763: M ROACH 3 | R763: ANSELL 2 | U763: SUTHERLAND
A764: YARRAVILLE | C764: KALLERICK | F764: ROGOTOWICZ | I764: COOKE | K764: MOLONEY | N764: ARTHUR
A766: MOORABBIN | C766: 4 | D766: 4 | E766: =C766*6+D766 -> 28 | G766: 13 | H766: 6 | I766: =G766*6+H766 -> 84 | K766: 18 | L766: 9 | M766: =K766*6+L766 -> 117 | O766: 23 | P766: 14 | Q766: =O766*6+P766 -> 152 | S766: BENTLEIGH
A767: BOX HILL | C767: 4 | D767: 1 | E767: =C767*6+D767 -> 25 | G767: 4 | H767: 5 | I767: =G767*6+H767 -> 29 | K767: 11 | L767: 11 | M767: =K767*6+L767 -> 77 | O767: 14 | P767: 17 | Q767: =O767*6+P767 -> 101 | S767: BRADSHAW/FITZPATRICK
A768: BEST PLAYERS
A769: MOORABBIN | C769: O'FARRELL | F769: COATES | I769: WILSON | K769: B CATHCART | N769: CONSTANTINOU | R769: CAMERON
A770: BOX HILL | C770: HEDGER | F770: A DICKENSON | I770: P WITNISH | L770: SCHADE | N770: GLEESON | R770: S WITNISH
A771: GOALKICKERS
A772: MOORABBIN | C772: O'FARRELL 9 | F772: B CATHCART 3 | I772: KNIGHT 3 | K772: WELLS 2 | M772: STEWART 2 | P772: POLLOCK 2 | S772: HALE | U772: CONSTANTINOU
A773: BOX HILL | C773: HEDGER 4 | F773: SCHADE 2 | I773: BYRON 2 | K773: A DICKENSON 2 | O773: P WITNISH | R773: KAINEY | T773: GARTH | V773: CRUSE
A775: MORDIALLOC | C775: 4 | D775: 2 | E775: =C775*6+D775 -> 26 | G775: 7 | H775: 6 | I775: =G775*6+H775 -> 48 | K775: 10 | L775: 7 | M775: =K775*6+L775 -> 67 | O775: 15 | P775: 11 | Q775: =O775*6+P775 -> 101 | S775: MORDIALLOC
A776: CAULFIELD | C776: 2 | D776: 5 | E776: =C776*6+D776 -> 17 | G776: 4 | H776: 10 | I776: =G776*6+H776 -> 34 | K776: 6 | L776: 12 | M776: =K776*6+L776 -> 48 | O776: 7 | P776: 20 | Q776: =O776*6+P776 -> 62 | S776: MARCY/HUTCHISON
A777: BEST PLAYERS
A778: MORDIALLOC
A779: CAULFIELD
A780: GOALKICKERS
A781: MORDIALLOC | C781: NEVILLE 10 | F781: DEATON 2 | I781: NORMAN 2 | L781: HALE
A782: CAULFIELD | C782: HILL 2 | E782: HOGAN | G782: DAWSON | J782: BOOTH | L782: CRANNY | N782: BLAKE
A784: NORTHCOTE | C784: 5 | D784: 7 | E784: =C784*6+D784 -> 37 | G784: 10 | H784: 9 | I784: =G784*6+H784 -> 69 | K784: 15 | L784: 15 | M784: =K784*6+L784 -> 105 | O784: 20 | P784: 21 | Q784: =O784*6+P784 -> 141 | S784: NORTHCOTE
A785: SPRINGVALE | C785: 1 | D785: 5 | E785: =C785*6+D785 -> 11 | G785: 8 | H785: 12 | I785: =G785*6+H785 -> 60 | K785: 12 | L785: 15 | M785: =K785*6+L785 -> 87 | O785: 15 | P785: 21 | Q785: =O785*6+P785 -> 111 | S785: BUDGE/BLOOM
A786: BEST PLAYERS
A787: NORTHCOTE | C787: MULQUEEN | F787: MINNETT | I787: PEART | K787: RYAN | N787: HYDE | P787: ROULSTON
A788: SPRINGVALE | C788: DEMPSTER | F788: T FOWLER | I788: GRAY | K788: L FOWLER | N788: HOLDEN | P788: FREEMAN
A789: GOALKICKERS
A790: NORTHCOTE | C790: MULQUEEN 4 | F790: BRAIN 4 | H790: JURGENSTEIN 3 | K790: SMITH 3 | M790: JIM CHRISTOU 2 | P790: PEART 2 | R790: STAIOS | T790: BRYAN
A791: SPRINGVALE | C791: CADDAYE 5 | F791: CARROLL 3 | I791: HOLDEN 3 | K791: GRAY 2 | M791: WOODMAN | P791: T FOWLER
A793: ROUND 15 | E793: 11TH APRIL | J793: WEATHER | S793: PLAYED AT
D794: 1ST QTR | H794: 2ND QTR | L794: 3RD QTR | P794: FINAL | S794: OAKLEIGH
A795: OAKLEIGH | C795: 5 | D795: 6 | E795: =C795*6+D795 -> 36 | G795: 11 | H795: 8 | I795: =G795*6+H795 -> 74 | K795: 17 | L795: 13 | M795: =K795*6+L795 -> 115 | O795: 24 | P795: 19 | Q795: =O795*6+P795 -> 163 | S795: UMPIRE | X795: LADDER | AB795: ROUND | AD795: 15
A796: MOORABBIN | C796: 3 | D796: 1 | E796: =C796*6+D796 -> 19 | G796: 8 | H796: 3 | I796: =G796*6+H796 -> 51 | K796: 9 | L796: 9 | M796: =K796*6+L796 -> 63 | O796: 15 | P796: 12 | Q796: =O796*6+P796 -> 102 | S796: BLAKE/HUTCHISON
A797: BEST PLAYERS | W797: TEAM | X797: W | Y797: L | Z797: D | AA797: FOR | AB797: AGST | AC797: % | AD797: PTS
A798: OAKLEIGH | C798: NEARY | F798: OWEN | I798: HIGGINS | L798: CARTER | O798: PLUMB | R798: LOWE
A799: MOORABBIN | C799: WELLS | F799: JONES | I799: COATES | L799: STEWART | O799: WILSON | W799: BRUNSWICK | X799: 12 | Y799: 3 | Z799: 0 | AA799: 2334 | AB799: 1289 | AC799: =(AA799*100)/AB799 -> 181.07059736229635 | AD799: =(X799*4)+(Z799*2) -> 48
A800: GOALKICKERS | W800: MORDIALLOC | X800: 11 | Y800: 3 | Z800: 1 | AA800: 1844 | AB800: 1241 | AC800: =(AA800*100)/AB800 -> 148.58984689766316 | AD800: =(X800*4)+(Z800*2) -> 46
A801: OAKLEIGH | C801: HIGGINS 8 | F801: LOWE 6 | H801: NEARY 4 | J801: M ROACH 2 | M801: HARPER 2 | O801: OWEN 2 | W801: OAKLEIGH | X801: 11 | Y801: 4 | Z801: 0 | AA801: 2001 | AB801: 1281 | AC801: =(AA801*100)/AB801 -> 156.20608899297423 | AD801: =(X801*4)+(Z801*2) -> 44
A802: MOORABBIN | C802: O'FARRELL 3 | F802: ANGWIN 3 | H802: MARSHALL 2 | K802: CONSTANTINOU | N802: STEWART | P802: KNIGHT | R802: POLLOCK | T802: WILSON | W802: BOX HILL | X802: 10 | Y802: 4 | Z802: 1 | AA802: 2077 | AB802: 1303 | AC802: =(AA802*100)/AB802 -> 159.40138142747506 | AD802: =(X802*4)+(Z802*2) -> 42
M803: WELLS | O803: HARDEMAN
A804: BRUNSWICK | C804: 5 | D804: 0 | E804: =C804*6+D804 -> 30 | G804: 9 | H804: 3 | I804: =G804*6+H804 -> 57 | K804: 15 | L804: 7 | M804: =K804*6+L804 -> 97 | O804: 19 | P804: 11 | Q804: =O804*6+P804 -> 125 | S804: BRUNSWICK | W804: SPRINGVALE | X804: 10 | Y804: 5 | Z804: 0 | AA804: 2097 | AB804: 1485 | AC804: =(AA804*100)/AB804 -> 141.21212121212122 | AD804: =(X804*4)+(Z804*2) -> 40
A805: MORDIALLOC | C805: 3 | D805: 3 | E805: =C805*6+D805 -> 21 | G805: 7 | H805: 5 | I805: =G805*6+H805 -> 47 | K805: 9 | L805: 7 | M805: =K805*6+L805 -> 61 | O805: 13 | P805: 12 | Q805: =O805*6+P805 -> 90 | S805: OGSTON | W805: NORTHCOTE | X805: 10 | Y805: 5 | Z805: 0 | AA805: 1962 | AB805: 1477 | AC805: =(AA805*100)/AB805 -> 132.83683141503047 | AD805: =(X805*4)+(Z805*2) -> 40
A806: BEST PLAYERS | S806: PHILLIPS | W806: CAULFIELD | X806: 9 | Y806: 6 | Z806: 0 | AA806: 1739 | AB806: 1336 | AC806: =(AA806*100)/AB806 -> 130.16467065868264 | AD806: =(X806*4)+(Z806*2) -> 36
A807: BRUNSWICK | C807: SAHLBERG | F807: McGHIE | I807: DOYLE | L807: THORNTON | O807: NOLAN | R807: ROBERTSON | W807: MOORABBIN | X807: 6 | Y807: 9 | Z807: 0 | AA807: 1681 | AB807: 1684 | AC807: =(AA807*100)/AB807 -> 99.821852731591449 | AD807: =(X807*4)+(Z807*2) -> 24
A808: MORDIALLOC | C808: CLIFFORD | F808: SUMMERIN | I808: WHITTAKER | L808: WARREN | O808: BROMLEY | R808: DE MUNK | W808: BERWICK | X808: 4 | Y808: 11 | Z808: 0 | AA808: 1212 | AB808: 1732 | AC808: =(AA808*100)/AB808 -> 69.976905311778296 | AD808: =(X808*4)+(Z808*2) -> 16
A809: GOALKICKERS | G809: LEAHY | I809: RADCHENKO | L809: SAHLBERG | O809: TOY | W809: KILSYTH | X809: 3 | Y809: 12 | Z809: 0 | AA809: 1228 | AB809: 2377 | AC809: =(AA809*100)/AB809 -> 51.661758519141777 | AD809: =(X809*4)+(Z809*2) -> 12
A810: BRUNSWICK | C810: JAKSIC 4 | E810: GUMBLETON 2 | H810: NOLAN 2 | J810: ROBERTSON 2 | M810: THORNTON 2 | P810: CALLANDER | S810: HAMILTON | W810: SUNSHINE | X810: 2 | Y810: 13 | Z810: 0 | AA810: 1068 | AB810: 2561 | AC810: =(AA810*100)/AB810 -> 41.702459976571653 | AD810: =(X810*4)+(Z810*2) -> 8
A811: MORDIALLOC | C811: NEVILLE 6 | F811: BROMLEY 2 | I811: EMBERSON | L811: WHITTAKER | O811: WALSH | Q811: NORMAN | S811: MASON | W811: YARRAVILLE | X811: 1 | Y811: 14 | Z811: 0 | AA811: 1075 | AB811: 2597 | AC811: =(AA811*100)/AB811 -> 41.393916056988836 | AD811: =(X811*4)+(Z811*2) -> 4
A813: NORTHCOTE | C813: 2 | D813: 4 | E813: =C813*6+D813 -> 16 | G813: 10 | H813: 11 | I813: =G813*6+H813 -> 71 | K813: 19 | L813: 13 | M813: =K813*6+L813 -> 127 | O813: 23 | P813: 23 | Q813: =O813*6+P813 -> 161 | S813: BOX HILL
A814: BOX HILL | C814: 2 | D814: 5 | E814: =C814*6+D814 -> 17 | G814: 5 | H814: 5 | I814: =G814*6+H814 -> 35 | K814: 10 | L814: 10 | M814: =K814*6+L814 -> 70 | O814: 14 | P814: 14 | Q814: =O814*6+P814 -> 98 | S814: GROOM/STEERE
A815: BEST PLAYERS
A816: NORTHCOTE | C816: HARLAND | F816: MINNETT | I816: ROULSTON | L816: ARMSTRONG | O816: JIM CHRISTOU | R816: M RYAN
A817: BOX HILL | C817: A DICKENSON | F817: GLEESON | I817: SCHADE | L817: HEDGER | O817: NICHOLSON | R817: CRUSE
A818: GOALKICKERS
A819: NORTHCOTE | C819: JURGENSTEIN 5 | F819: HARLAND 4 | I819: SMITH N 3 | K819: JIM CHRISTOU 3 | O819: MULQUEEN 3 | R819: BRAIN 2 | T819: CUFF 2 | V819: JOHN CHRISTOU
A820: BOX HILL | C820: CRUSE 3 | E820: GLEESON 3 | G820: MOORE 2 | I820: NICHOLSON 2 | L820: R WITNISH | O820: GREGORY | Q820: HEDGER | S820: GIBB
A822: CAULFIELD | C822: 6 | D822: 3 | E822: =C822*6+D822 -> 39 | G822: 11 | H822: 9 | I822: =G822*6+H822 -> 75 | K822: 15 | L822: 15 | M822: =K822*6+L822 -> 105 | O822: 19 | P822: 16 | Q822: =O822*6+P822 -> 130 | S822: PRINCES PARK, CAULFIELD
A823: BERWICK | C823: 0 | D823: 1 | E823: =C823*6+D823 -> 1 | G823: 5 | H823: 2 | I823: =G823*6+H823 -> 32 | K823: 5 | L823: 7 | M823: =K823*6+L823 -> 37 | O823: 11 | P823: 9 | Q823: =O823*6+P823 -> 75 | S823: BRADSHAW/PHAIR
A824: BEST PLAYERS
A825: CAULFIELD | C825: RUSSELL | F825: MADDAFERI | I825: FARINSKI | L825: SUTHERLAND | O825: DOYLE
A826: BERWICK | C826: WARD | F826: JOHNSON | I826: VAN STEESEL | L826: SMITH | O826: ALLEN
A827: GOALKICKERS
A828: CAULFIELD | C828: PEARCE 5 | E828: CRANNY 4 | G828: SUTHERLAND 3 | J828: FITCHETT 2 | M828: O'BRIEN 2 | O828: CROOK 2 | Q828: CROCKER
A829: BERWICK | C829: McGILL 3 | E829: TRIGG 2 | G829: VENVILLE 2 | J829: LAITY 2 | L829: HUGHES | N829: MANNENS
A831: YARRAVILLE | C831: 2 | D831: 3 | E831: =C831*6+D831 -> 15 | G831: 6 | H831: 6 | I831: =G831*6+H831 -> 42 | K831: 10 | L831: 14 | M831: =K831*6+L831 -> 74 | O831: 15 | P831: 17 | Q831: =O831*6+P831 -> 107 | S831: SUNSHINE
A832: SUNSHINE | C832: 4 | D832: 5 | E832: =C832*6+D832 -> 29 | G832: 8 | H832: 7 | I832: =G832*6+H832 -> 55 | K832: 9 | L832: 10 | M832: =K832*6+L832 -> 64 | O832: 12 | P832: 18 | Q832: =O832*6+P832 -> 90 | S832: J W RYAN/J F RYAN
A833: BEST PLAYERS
A834: YARRAVILLE | C834: MARTIN | F834: MOLONEY | I834: SPROULE | L834: COOKE | N834: KING | P834: WARD
A835: SUNSHINE | C835: HUNT | F835: MENADUE | I835: WILLIAMS | L835: MILES | N835: CAMPBELL
A836: GOALKICKERS
A837: YARRAVILLE | C837: SPROULE 5 | F837: MARTIN 4 | I837: ROGOTOWICZ 2 | L837: LUNT | N837: MOLONEY | P837: TUPPEN | R837: WARD
A838: SUNSHINE | C838: CONLIN 3 | E838: WILLIAMS 3 | H838: WAGLAND 2 | K838: BARBA | M838: GRAY | O838: AXON | Q838: CROSBIE
A840: SPRINGVALE | C840: 9 | D840: 2 | E840: =C840*6+D840 -> 56 | G840: 17 | H840: 8 | I840: =G840*6+H840 -> 110 | K840: 27 | L840: 11 | M840: =K840*6+L840 -> 173 | O840: 32 | P840: 16 | Q840: =O840*6+P840 -> 208 | S840: NEWCOMEN RD
A841: KILSYTH | C841: 5 | D841: 2 | E841: =C841*6+D841 -> 32 | G841: 9 | H841: 4 | I841: =G841*6+H841 -> 58 | K841: 15 | L841: 6 | M841: =K841*6+L841 -> 96 | O841: 16 | P841: 9 | Q841: =O841*6+P841 -> 105 | S841: MORGAN/WALKER
A842: BEST PLAYERS
A843: SPRINGVALE | C843: DEMPSTER | F843: SKEWS | I843: HOLDEN | L843: BLOOMFIELD | O843: GRAY | R843: T FOWLER
A844: KILSYTH | C844: DEAGAN | F844: D'ANGELO | I844: TAYLOR | L844: BIANCO | O844: CARROLL
A845: GOALKICKERS
A846: SPRINGVALE | C846: DEMPSTER 7 | F846: CARROLL 6 | H846: FOWLER 5 | J846: BLOOMFIELD 4 | M846: GRAY 3 | O846: FOTINIOTIS 2 | R846: CADDAYE 2 | T846: SKEWS | V846: WOODMAN | X846: HOLDEN
A847: KILSYTH | C847: CARROLL 6 | F847: DEAGAN 4 | I847: HALBERT 2 | L847: LETTS 2 | N847: TAYLOR | P847: BIANCO
A849: ROUND 16 | E849: 31ST JULY | J849: WEATHER | S849: PLAYED AT
D850: 1ST QTR | H850: 2ND QTR | L850: 3RD QTR | P850: FINAL | S850: NORTHCOTE
A851: OAKLEIGH | C851: 2 | D851: 2 | E851: =C851*6+D851 -> 14 | G851: 9 | H851: 4 | I851: =G851*6+H851 -> 58 | K851: 12 | L851: 5 | M851: =K851*6+L851 -> 77 | O851: 16 | P851: 7 | Q851: =O851*6+P851 -> 103 | S851: UMPIRE | X851: LADDER | AB851: ROUND | AD851: 16
A852: NORTHCOTE | C852: 3 | D852: 8 | E852: =C852*6+D852 -> 26 | G852: 7 | H852: 11 | I852: =G852*6+H852 -> 53 | K852: 10 | L852: 16 | M852: =K852*6+L852 -> 76 | O852: 12 | P852: 20 | Q852: =O852*6+P852 -> 92 | S852: VERGONA/TORNEY
A853: BEST PLAYERS | W853: TEAM | X853: W | Y853: L | Z853: D | AA853: FOR | AB853: AGST | AC853: % | AD853: PTS
A854: OAKLEIGH | C854: HARPER | F854: TODD | H854: PLUMB | K854: MATTHEY | N854: NEARY | Q854: CARTER
A855: NORTHCOTE | C855: COSTA | F855: HYDE | H855: JOHN CHRISTOU | K855: MINNETT | N855: DURANTE | Q855: HARLAND | W855: BRUNSWICK | X855: 13 | Y855: 3 | Z855: 0 | AA855: 2476 | AB855: 1363 | AC855: =(AA855*100)/AB855 -> 181.65810711665443 | AD855: =(X855*4)+(Z855*2) -> 52
A856: GOALKICKERS | W856: MORDIALLOC | X856: 12 | Y856: 3 | Z856: 1 | AA856: 1922 | AB856: 1274 | AC856: =(AA856*100)/AB856 -> 150.86342229199371 | AD856: =(X856*4)+(Z856*2) -> 50
A857: OAKLEIGH | C857: NEARY 5 | F857: LOWE 4 | H857: HIGGINS 3 | J857: OWEN 3 | L857: CALLERY | W857: OAKLEIGH | X857: 12 | Y857: 4 | Z857: 0 | AA857: 2104 | AB857: 1373 | AC857: =(AA857*100)/AB857 -> 153.24107793153678 | AD857: =(X857*4)+(Z857*2) -> 48
A858: NORTHCOTE | C858: JIM CHRISTOU 3 | G858: JURGENSTEIN 2 | J858: CUFF 2 | L858: PHELAN 2 | N858: BRAIN | P858: ARMSTRONG | S858: ROULSTON | W858: SPRINGVALE | X858: 11 | Y858: 5 | Z858: 0 | AA858: 2223 | AB858: 1552 | AC858: =(AA858*100)/AB858 -> 143.23453608247422 | AD858: =(X858*4)+(Z858*2) -> 44
A860: SPRINGVALE | C860: 8 | D860: 4 | E860: =C860*6+D860 -> 52 | G860: 12 | H860: 5 | I860: =G860*6+H860 -> 77 | K860: 18 | L860: 7 | M860: =K860*6+L860 -> 115 | O860: 19 | P860: 12 | Q860: =O860*6+P860 -> 126 | S860: NEWCOMEN RD | W860: BOX HILL | X860: 10 | Y860: 5 | Z860: 1 | AA860: 2144 | AB860: 1429 | AC860: =(AA860*100)/AB860 -> 150.03498950314906 | AD860: =(X860*4)+(Z860*2) -> 42
A861: BOX HILL | C861: 3 | D861: 2 | E861: =C861*6+D861 -> 20 | G861: 7 | H861: 5 | I861: =G861*6+H861 -> 47 | K861: 7 | L861: 9 | M861: =K861*6+L861 -> 51 | O861: 9 | P861: 13 | Q861: =O861*6+P861 -> 67 | S861: SERONG | W861: CAULFIELD | X861: 10 | Y861: 6 | Z861: 0 | AA861: 1953 | AB861: 1411 | AC861: =(AA861*100)/AB861 -> 138.41247342310419 | AD861: =(X861*4)+(Z861*2) -> 40
A862: BEST PLAYERS | S862: STABB | W862: NORTHCOTE | X862: 10 | Y862: 6 | Z862: 0 | AA862: 2054 | AB862: 1580 | AC862: =(AA862*100)/AB862 -> 130 | AD862: =(X862*4)+(Z862*2) -> 40
A863: SPRINGVALE | C863: WOODMAN | F863: SKEWS | I863: TONKIN | L863: GRAY | O863: McCOMB | R863: BLOOMFIELD | W863: MOORABBIN | X863: 7 | Y863: 9 | Z863: 0 | AA863: 1864 | AB863: 1736 | AC863: =(AA863*100)/AB863 -> 107.37327188940093 | AD863: =(X863*4)+(Z863*2) -> 28
A864: BOX HILL | C864: WITNISH | F864: GLEESON | I864: TRESIDER | L864: SCHADE | O864: WITHERS | R864: ROBINSON | W864: BERWICK | X864: 4 | Y864: 12 | Z864: 0 | AA864: 1286 | AB864: 1874 | AC864: =(AA864*100)/AB864 -> 68.623265741728929 | AD864: =(X864*4)+(Z864*2) -> 16
A865: GOALKICKERS | M865: CADDAYE | P865: BLOOMFIELD | W865: KILSYTH | X865: 3 | Y865: 13 | Z865: 0 | AA865: 1261 | AB865: 2455 | AC865: =(AA865*100)/AB865 -> 51.364562118126273 | AD865: =(X865*4)+(Z865*2) -> 12
A866: SPRINGVALE | C866: ANDERSON 4 | F866: WOODMAN 3 | I866: GRAY 3 | K866: DEMPSTER 2 | N866: STEEL 2 | P866: FOTINIOTIS 2 | S866: CARROLL | W866: SUNSHINE | X866: 2 | Y866: 14 | Z866: 0 | AA866: 1120 | AB866: 2744 | AC866: =(AA866*100)/AB866 -> 40.816326530612244 | AD866: =(X866*4)+(Z866*2) -> 8
A867: BOX HILL | C867: MOORE 4 | F867: TRESIDER 2 | I867: DICKENSON | L867: GARTH | N867: HEDGER | W867: YARRAVILLE | X867: 1 | Y867: 15 | Z867: 0 | AA867: 1150 | AB867: 2811 | AC867: =(AA867*100)/AB867 -> 40.910707933119888 | AD867: =(X867*4)+(Z867*2) -> 4
A869: MOORABBIN | C869: 3 | D869: 5 | E869: =C869*6+D869 -> 23 | G869: 13 | H869: 13 | I869: =G869*6+H869 -> 91 | K869: 20 | L869: 17 | M869: =K869*6+L869 -> 137 | O869: 27 | P869: 21 | Q869: =O869*6+P869 -> 183 | S869: BENTLEIGH
A870: SUNSHINE | C870: 4 | D870: 1 | E870: =C870*6+D870 -> 25 | G870: 5 | H870: 1 | I870: =G870*6+H870 -> 31 | K870: 6 | L870: 4 | M870: =K870*6+L870 -> 40 | O870: 8 | P870: 4 | Q870: =O870*6+P870 -> 52 | S870: MORGAN/PHAIR
A871: BEST PLAYERS
A872: MOORABBIN | C872: WILSON | F872: McGAW | I872: CONSTANTINOU | L872: STEWART | O872: MERCOULIA | R872: KNIGHT
A873: SUNSHINE | C873: WHITNEY | F873: BENSON | I873: JOHNSON | L873: GRAY | O873: BIANCO | R873: HARVEY
A874: GOALKICKERS
A875: MOORABBIN | C875: KNIGHT 7 | F875: B CATHCART 6 | I875: POLLOCK 4 | K875: O'FARRELL 3 | N875: WILSON 2 | P875: STEWART 2 | S875: CONSTANTINOU | W875: BEATTIE | X875: ANGWIN
A876: SUNSHINE | C876: JOHNSON 2 | F876: CROSBIE 2 | I876: WILLIAMS | L876: HENLEY | N876: BIANCO | P876: MENADUE
A878: CAULFIELD | C878: 8 | D878: 7 | E878: =C878*6+D878 -> 55 | G878: 15 | H878: 17 | I878: =G878*6+H878 -> 107 | K878: 22 | L878: 17 | M878: =K878*6+L878 -> 149 | O878: 32 | P878: 22 | Q878: =O878*6+P878 -> 214 | S878: YARRAVILLE
A879: YARRAVILLE | C879: 5 | D879: 2 | E879: =C879*6+D879 -> 32 | G879: 7 | H879: 3 | I879: =G879*6+H879 -> 45 | K879: 10 | L879: 7 | M879: =K879*6+L879 -> 67 | O879: 11 | P879: 9 | Q879: =O879*6+P879 -> 75 | S879: WALKER/STEERE
A880: BEST PLAYERS
A881: CAULFIELD | C881: BOOTH | F881: DUNCAN | I881: CROOK | L881: MADDAFERI | O881: HILL | R881: BLAKE
A882: YARRAVILLE | C882: FENNELL | F882: LUNT | I882: MOON | L882: FABRETTI | O882: ROGOTOWICZ | R882: MARTIN
A883: GOALKICKERS
A884: CAULFIELD | C884: BLAKE 9 | E884: BOOTH 7 | G884: PEARCE 4 | J884: HILL 2 | L884: DUNCAN 2 | O884: STAIT 2 | Q884: EINSEDEL | S884: CROCKER | U884: CRANNY | W884: CROOK | X884: BRASIER | Z884: O'BRIEN
A885: YARRAVILLE | C885: LUNT 5 | E885: ROGOTOWICZ 2 | H885: MOLONEY | J885: KOTONIK | M885: HOUGH | O885: MOON
A887: BRUNSWICK | C887: 7 | D887: 3 | E887: =C887*6+D887 -> 45 | G887: 12 | H887: 6 | I887: =G887*6+H887 -> 78 | K887: 19 | L887: 6 | M887: =K887*6+L887 -> 120 | O887: 22 | P887: 10 | Q887: =O887*6+P887 -> 142 | S887: BERWICK
A888: BERWICK | C888: 4 | D888: 3 | E888: =C888*6+D888 -> 27 | G888: 6 | H888: 5 | I888: =G888*6+H888 -> 41 | K888: 7 | L888: 10 | M888: =K888*6+L888 -> 52 | O888: 10 | P888: 14 | Q888: =O888*6+P888 -> 74 | S888: J R RYAN/HUTCHISON
A889: BEST PLAYERS
A890: BRUNSWICK | C890: TOY | F890: NOLAN | I890: SAHLBERG | L890: McGHIE | O890: LAWSON | R890: CALLANDER
A891: BERWICK | C891: SHEARS | F891: CREBBIN | I891: WARD | L891: ALLEN | O891: CALLERY
A892: GOALKICKERS
A893: BRUNSWICK | C893: JAKSIC 7 | E893: JUDGE 4 | G893: WEST 3 | I893: LAWSON | K893: SAHLBERG | N893: LEAHY | P893: ROBINSON | R893: GUMBLETON | U893: TOY | W893: CALLANDER | X893: THORNTON
A894: BERWICK | C894: TRIGG 2 | E894: CALLERTY 2 | H894: M JOHNSON 2 | K894: MENNENS | N894: VENVILLE | P894: McGILL | R894: ALLEN
A896: MORDIALLOC | C896: 2 | D896: 7 | E896: =C896*6+D896 -> 19 | G896: 6 | H896: 12 | I896: =G896*6+H896 -> 48 | K896: 7 | L896: 18 | M896: =K896*6+L896 -> 60 | O896: 9 | P896: 24 | Q896: =O896*6+P896 -> 78 | S896: KILSYTH
A897: KILSYTH | C897: 2 | D897: 2 | E897: =C897*6+D897 -> 14 | G897: 2 | H897: 6 | I897: =G897*6+H897 -> 18 | K897: 3 | L897: 7 | M897: =K897*6+L897 -> 25 | O897: 4 | P897: 9 | Q897: =O897*6+P897 -> 33 | S897: BRADSHAW/BLOOM
A898: BEST PLAYERS
A899: MORDIALLOC | C899: NORMAN | E899: WALSH | H899: CLIFFORD | K899: DEATON | N899: EMBERSON | Q899: BROMLEY
A900: KILSYTH | C900: PRICE | E900: BIANCO | H900: JONES | K900: LETTS | N900: TORCASSIO | Q900: N TAYLOR
A901: GOALKICKERS
A902: MORDIALLOC | C902: EMBERSON 2 | F902: DEATON 2 | I902: ELLUL 2 | K902: NORMAN 2 | N902: WATERS
A903: KILSYTH | C903: HALBERT 2 | F903: DEAGAN | I903: PRICE
A905: ROUND 17 | E905: 7TH AUGUST | J905: WEATHER | S905: PLAYED AT
D906: 1ST QTR | H906: 2ND QTR | L906: 3RD QTR | P906: FINAL | S906: OAKLEIGH
A907: SPRINGVALE | C907: 4 | D907: 2 | E907: =C907*6+D907 -> 26 | G907: 9 | H907: 5 | I907: =G907*6+H907 -> 59 | K907: 14 | L907: 7 | M907: =K907*6+L907 -> 91 | O907: 17 | P907: 12 | Q907: =O907*6+P907 -> 114 | S907: UMPIRE | X907: LADDER | AB907: ROUND | AD907: 17
A908: OAKLEIGH | C908: 1 | D908: 5 | E908: =C908*6+D908 -> 11 | G908: 4 | H908: 9 | I908: =G908*6+H908 -> 33 | K908: 8 | L908: 11 | M908: =K908*6+L908 -> 59 | O908: 11 | P908: 17 | Q908: =O908*6+P908 -> 83 | S908: CASEY/STEERE
A909: BEST PLAYERS | W909: TEAM | X909: W | Y909: L | Z909: D | AA909: FOR | AB909: AGST | AC909: % | AD909: PTS
A910: SPRINGVALE | C910: N/A
A911: OAKLEIGH | C911: PLUMB | F911: TODD | H911: MATTHEY | K911: COLLINS | M911: CARTER | P911: ALLISEY | W911: BRUNSWICK | X911: 14 | Y911: 3 | Z911: 0 | AA911: 2748 | AB911: 1407 | AC911: =(AA911*100)/AB911 -> 195.30916844349682 | AD911: =(X911*4)+(Z911*2) -> 56
A912: GOALKICKERS | W912: MORDIALLOC | X912: 13 | Y912: 3 | Z912: 1 | AA912: 2069 | AB912: 1358 | AC912: =(AA912*100)/AB912 -> 152.35640648011781 | AD912: =(X912*4)+(Z912*2) -> 54
A913: SPRINGVALE | C913: ANDERSON 5 | F913: CARROLL 5 | H913: DEMPSTER | J913: FOWLER | L913: STEEL | N913: BLOOMFIELD | Q913: FOTINIOTIS | S913: HOLDEN | U913: GRAY | W913: OAKLEIGH | X913: 12 | Y913: 5 | Z913: 0 | AA913: 2187 | AB913: 1487 | AC913: =(AA913*100)/AB913 -> 147.07464694014794 | AD913: =(X913*4)+(Z913*2) -> 48
A914: OAKLEIGH | C914: NEARY 3 | E914: HIGGINS 2 | G914: OWEN 2 | I914: MATTHEY | L914: HARPER | N914: COLLINS | P914: ANSELL | W914: SPRINGVALE | X914: 12 | Y914: 5 | Z914: 0 | AA914: 2337 | AB914: 1635 | AC914: =(AA914*100)/AB914 -> 142.93577981651376 | AD914: =(X914*4)+(Z914*2) -> 48
A916: BOX HILL | C916: 9 | D916: 4 | E916: =C916*6+D916 -> 58 | G916: 15 | H916: 5 | I916: =G916*6+H916 -> 95 | K916: 23 | L916: 8 | M916: =K916*6+L916 -> 146 | O916: 28 | P916: 13 | Q916: =O916*6+P916 -> 181 | S916: BOX HILL | W916: BOX HILL | X916: 11 | Y916: 5 | Z916: 1 | AA916: 2325 | AB916: 1525 | AC916: =(AA916*100)/AB916 -> 152.45901639344262 | AD916: =(X916*4)+(Z916*2) -> 46
A917: KILSYTH | C917: 0 | D917: 2 | E917: =C917*6+D917 -> 2 | G917: 6 | H917: 7 | I917: =G917*6+H917 -> 43 | K917: 8 | L917: 9 | M917: =K917*6+L917 -> 57 | O917: 14 | P917: 12 | Q917: =O917*6+P917 -> 96 | S917: MAY | W917: CAULFIELD | X917: 11 | Y917: 6 | Z917: 0 | AA917: 2122 | AB917: 1497 | AC917: =(AA917*100)/AB917 -> 141.750167000668 | AD917: =(X917*4)+(Z917*2) -> 44
A918: BEST PLAYERS | S918: BUDGE | W918: NORTHCOTE | X918: 11 | Y918: 6 | Z918: 0 | AA918: 2262 | AB918: 1640 | AC918: =(AA918*100)/AB918 -> 137.92682926829269 | AD918: =(X918*4)+(Z918*2) -> 44
A919: BOX HILL | C919: TEAKEL | F919: WITHERS | I919: VARNEY | L919: NICHOLSON | O919: TRESIDER | R919: DICKENSON | W919: MOORABBIN | X919: 7 | Y919: 10 | Z919: 0 | AA919: 1950 | AB919: 1905 | AC919: =(AA919*100)/AB919 -> 102.36220472440945 | AD919: =(X919*4)+(Z919*2) -> 28
A920: KILSYTH | C920: D'ANGELO | F920: N TAYLOR | I920: SHEPPARD | L920: JONES | W920: BERWICK | X920: 4 | Y920: 13 | Z920: 0 | AA920: 1370 | AB920: 2021 | AC920: =(AA920*100)/AB920 -> 67.788223651657589 | AD920: =(X920*4)+(Z920*2) -> 16
A921: GOALKICKERS | W921: KILSYTH | X921: 3 | Y921: 14 | Z921: 0 | AA921: 1357 | AB921: 2636 | AC921: =(AA921*100)/AB921 -> 51.479514415781487 | AD921: =(X921*4)+(Z921*2) -> 12
A922: BOX HILL | C922: BYRON 6 | E922: TRESIDER 6 | G922: HEDGER 5 | I922: WITHERS 5 | K922: NICHOLSON 3 | N922: DICKENSON 2 | Q922: CRUSE | W922: SUNSHINE | X922: 2 | Y922: 15 | Z922: 0 | AA922: 1180 | AB922: 2952 | AC922: =(AA922*100)/AB922 -> 39.972899728997291 | AD922: =(X922*4)+(Z922*2) -> 8
A923: KILSYTH | C923: CARROLL 4 | F923: PRICE 3 | H923: JONES 2 | J923: LETTS 2 | L923: SHEPPARD | N923: N TAYLOR | Q923: CARPI | W923: YARRAVILLE | X923: 1 | Y923: 16 | Z923: 0 | AA923: 1194 | AB923: 3083 | AC923: =(AA923*100)/AB923 -> 38.728511190398962 | AD923: =(X923*4)+(Z923*2) -> 4
A925: NORTHCOTE | C925: 7 | D925: 6 | E925: =C925*6+D925 -> 48 | G925: 17 | H925: 12 | I925: =G925*6+H925 -> 114 | K925: 25 | L925: 16 | M925: =K925*6+L925 -> 166 | O925: 31 | P925: 22 | Q925: =O925*6+P925 -> 208 | S925: SUNSHINE
A926: SUNSHINE | C926: 2 | D926: 1 | E926: =C926*6+D926 -> 13 | G926: 6 | H926: 2 | I926: =G926*6+H926 -> 38 | K926: 9 | L926: 3 | M926: =K926*6+L926 -> 57 | O926: 9 | P926: 6 | Q926: =O926*6+P926 -> 60 | S926: HUTCHISON/KENNEDY
A927: BEST PLAYERS
A928: NORTHCOTE | C928: ARMSTRONG | F928: MINNETT | I928: CUFF | L928: PHILLIPE | O928: RYAN | R928: PEART
A929: SUNSHINE | C929: WHITNEY | F929: CUFF | I929: MENADUE | L929: WILLIAMS | O929: WAGLAND
A930: GOALKICKERS
A931: NORTHCOTE | C931: PHILLIPE 10 | F931: JURGENSTEIN 8 | I931: CUFF 6 | K931: JIM CHRISTOU 3 | N931: PEART 2 | P931: JOHN CHRISTOU | S931: G ARMSTRONG
A932: SUNSHINE | C932: CROSBIE 3 | F932: MENADUE 2 | I932: WILLIAMS 2 | L932: WHITNEY | N932: BENSON
A934: CAULFIELD | C934: 2 | D934: 7 | E934: =C934*6+D934 -> 19 | G934: 11 | H934: 10 | I934: =G934*6+H934 -> 76 | K934: 14 | L934: 11 | M934: =K934*6+L934 -> 95 | O934: 25 | P934: 19 | Q934: =O934*6+P934 -> 169 | S934: PRINCES PARK, CAULFIELD
A935: MOORABBIN | C935: 5 | D935: 3 | E935: =C935*6+D935 -> 33 | G935: 6 | H935: 8 | I935: =G935*6+H935 -> 44 | K935: 10 | L935: 12 | M935: =K935*6+L935 -> 72 | O935: 12 | P935: 14 | Q935: =O935*6+P935 -> 86 | S935: SERONG/BLOOM
A936: BEST PLAYERS
A937: CAULFIELD | C937: DUNCAN | F937: BOOTH | I937: CROCKER | L937: EINSEDEL | O937: BRASIER | R937: FARINSKI
A938: MOORABBIN | C938: JONES | F938: STEWART | I938: B CAHCART | L938: CONSTSNTINOU | O938: O'FARRELL
A939: GOALKICKERS
A940: CAULFIELD | C940: BOOTH 8 | E940: CROCKER 4 | G940: EINSEDEL 2 | J940: SUTHERLAND 2 | M940: HILL 2 | O940: CRANNY 2 | R940: BLAKE 2 | T940: PEARCE | W940: CROOK | X940: TAYLOR
A941: MOORABBIN | C941: O'FARRELL 5 | F941: B CATHCART 3 | J941: STEWART | M941: POLLOCK | O941: P LAZZARO | R941: HARDEMAN
A943: BRUNSWICK | C943: 9 | D943: 9 | E943: =C943*6+D943 -> 63 | G943: 19 | H943: 14 | I943: =G943*6+H943 -> 128 | K943: 27 | L943: 22 | M943: =K943*6+L943 -> 184 | O943: 41 | P943: 26 | Q943: =O943*6+P943 -> 272 | S943: BRUNSWICK
A944: YARRAVILLE | C944: 2 | D944: 0 | E944: =C944*6+D944 -> 12 | G944: 4 | H944: 2 | I944: =G944*6+H944 -> 26 | K944: 5 | L944: 2 | M944: =K944*6+L944 -> 32 | O944: 7 | P944: 2 | Q944: =O944*6+P944 -> 44 | S944: BLAKE/PHAIR
A945: BEST PLAYERS
A946: BRUNSWICK | C946: TOY | E946: JUDGE | H946: NOLAN | K946: SAHLBERG | N946: SCULLY | Q946: WEST
A947: YARRAVILLE | C947: KING | E947: SPROULE | H947: ARTHUR | K947: FABRETTI | N947: TUPPEN
A948: GOALKICKERS
A949: BRUNSWICK | C949: JAKSIC 6 | F949: TOY 6 | G949: JUDGE 6 | I949: LAWSON 4 | K949: RADCHENKO 4 | N949: SAHLBERG 4 | Q949: WEST 3 | S949: CANNARD 3 | V949: CALLANDER 3 | X949: GUMBLETON | AA949: NOLAN
A950: YARRAVILLE | C950: MARTIN 2 | F950: ROGOTOWICZ 2 | J950: HOUGH | L950: SQUIRE | N950: MOON
A952: MORDIALLOC | C952: 4 | D952: 5 | E952: =C952*6+D952 -> 29 | G952: 12 | H952: 9 | I952: =G952*6+H952 -> 81 | K952: 14 | L952: 11 | M952: =K952*6+L952 -> 95 | O952: 22 | P952: 15 | Q952: =O952*6+P952 -> 147 | S952: MORDIALLOC
A953: BERWICK | C953: 4 | D953: 1 | E953: =C953*6+D953 -> 25 | G953: 5 | H953: 3 | I953: =G953*6+H953 -> 33 | K953: 11 | L953: 8 | M953: =K953*6+L953 -> 74 | O953: 12 | P953: 12 | Q953: =O953*6+P953 -> 84 | S953: MORGAN/WALKER
A954: BEST PLAYERS
A955: MORDIALLOC | C955: NEVILLE | F955: LANG | I955: WARREN | K955: WALSH | N955: HALE | P955: WHITTAKER
A956: BERWICK | C956: M JOHNSON | F956: VENVILLE | I956: TRIGG | K956: WARD | N956: PEARCE
A957: GOALKICKERS
A958: MORDIALLOC | C958: NEVILLE 10 | F958: DE MUNK 3 | I958: HALE 3 | K958: BROMLEY 2 | N958: EMBERSON | P958: CLIFFORD | R958: KERIN | S958: NORMAN
A959: BERWICK | C959: VENVILLE 3 | F959: TRIGG 2 | H959: PEARCE 2 | J959: McGILL 2 | L959: MANNENS | N959: B ALLEN | P959: GAMBETTA
A961: ROUND 18 | E961: 14TH AUGUST | J961: WEATHER | S961: PLAYED AT
D962: 1ST QTR | H962: 2ND QTR | L962: 3RD QTR | P962: FINAL | S962: BOX HILL
A963: OAKLEIGH | C963: 7 | D963: 0 | E963: =C963*6+D963 -> 42 | G963: 15 | H963: 4 | I963: =G963*6+H963 -> 94 | K963: 18 | L963: 9 | M963: =K963*6+L963 -> 117 | O963: 26 | P963: 14 | Q963: =O963*6+P963 -> 170 | S963: UMPIRE | X963: LADDER | AB963: ROUND | AD963: 18
A964: BOX HILL | C964: 7 | D964: 3 | E964: =C964*6+D964 -> 45 | G964: 10 | H964: 6 | I964: =G964*6+H964 -> 66 | K964: 16 | L964: 12 | M964: =K964*6+L964 -> 108 | O964: 20 | P964: 12 | Q964: =O964*6+P964 -> 132 | S964: ALLSOP/PHAIR
A965: BEST PLAYERS | W965: TEAM | X965: W | Y965: L | Z965: D | AA965: FOR | AB965: AGST | AC965: % | AD965: PTS
A966: OAKLEIGH | C966: COLLINS | F966: GREENWOOD | I966: TODD | L966: NEARY | O966: McDONALD | R966: PLUMB
A967: BOX HILL | C967: NICHOLSON | F967: GLEESON | I967: DICKENSON | L967: TRESIDER | O967: VARNEY | R967: S WITNISH | W967: BRUNSWICK | X967: 15 | Y967: 3 | Z967: 0 | AA967: 2898 | AB967: 1498 | AC967: =(AA967*100)/AB967 -> 193.45794392523365 | AD967: =(X967*4)+(Z967*2) -> 60
A968: GOALKICKERS | W968: MORDIALLOC | X968: 14 | Y968: 3 | Z968: 1 | AA968: 2270 | AB968: 1414 | AC968: =(AA968*100)/AB968 -> 160.53748231966054 | AD968: =(X968*4)+(Z968*2) -> 58
A969: OAKLEIGH | C969: HIGGINS 6 | F969: LOWE 5 | H969: NEARY 5 | J969: ROACH 2 | L969: COLLINS 2 | N969: ANSELL 2 | P969: HARPER 2 | R969: GOODMAN | T969: CALLERY | W969: SPRINGVALE | X969: 13 | Y969: 5 | Z969: 0 | AA969: 2646 | AB969: 1716 | AC969: =(AA969*100)/AB969 -> 154.19580419580419 | AD969: =(X969*4)+(Z969*2) -> 52
A970: BOX HILL | C970: TRESIDER 4 | F970: NICHOLSON 4 | I970: HEDGER 4 | K970: CRUSE 2 | M970: DICKENSON 2 | P970: S WITNISH | R970: R WITNISH | W970: OAKLEIGH | X970: 13 | Y970: 5 | Z970: 0 | AA970: 2357 | AB970: 1619 | AC970: =(AA970*100)/AB970 -> 145.58369363804817 | AD970: =(X970*4)+(Z970*2) -> 52
K971: WITHERS | M971: GARTH
A972: NORTHCOTE | C972: 4 | D972: 2 | E972: =C972*6+D972 -> 26 | G972: 8 | H972: 8 | I972: =G972*6+H972 -> 56 | K972: 11 | L972: 11 | M972: =K972*6+L972 -> 77 | O972: 18 | P972: 12 | Q972: =O972*6+P972 -> 120 | S972: NORTHCOTE | W972: BOX HILL | X972: 11 | Y972: 6 | Z972: 1 | AA972: 2457 | AB972: 1695 | AC972: =(AA972*100)/AB972 -> 144.95575221238937 | AD972: =(X972*4)+(Z972*2) -> 46
A973: CAULFIELD | C973: 9 | D973: 4 | E973: =C973*6+D973 -> 58 | G973: 13 | H973: 7 | I973: =G973*6+H973 -> 85 | K973: 15 | L973: 8 | M973: =K973*6+L973 -> 98 | O973: 18 | P973: 12 | Q973: =O973*6+P973 -> 120 | S973: MAY | W973: CAULFIELD | X973: 11 | Y973: 6 | Z973: 1 | AA973: 2242 | AB973: 1617 | AC973: =(AA973*100)/AB973 -> 138.65182436611008 | AD973: =(X973*4)+(Z973*2) -> 46
A974: BEST PLAYERS | S974: MORGAN | W974: NORTHCOTE | X974: 11 | Y974: 6 | Z974: 1 | AA974: 2382 | AB974: 1860 | AC974: =(AA974*100)/AB974 -> 128.06451612903226 | AD974: =(X974*4)+(Z974*2) -> 46
A975: NORTHCOTE | C975: HYDE | F975: GRAHAM | I975: PHILLIPE | L975: RYAN | N975: MINNETT | Q975: JIM CHRISTOU | W975: MOORABBIN | X975: 7 | Y975: 11 | Z975: 0 | AA975: 2041 | AB975: 2055 | AC975: =(AA975*100)/AB975 -> 99.318734793187346 | AD975: =(X975*4)+(Z975*2) -> 28
A976: CAULFIELD | C976: CROOK | F976: EINSEDEL | I976: BRASIER | L976: HOGAN | N976: MADDAFERI | Q976: FARINSKI | W976: BERWICK | X976: 5 | Y976: 13 | Z976: 0 | AA976: 1477 | AB976: 2088 | AC976: =(AA976*100)/AB976 -> 70.737547892720301 | AD976: =(X976*4)+(Z976*2) -> 20
A977: GOALKICKERS | W977: KILSYTH | X977: 3 | Y977: 15 | Z977: 0 | AA977: 1424 | AB977: 2743 | AC977: =(AA977*100)/AB977 -> 51.913962814436751 | AD977: =(X977*4)+(Z977*2) -> 12
A978: NORTHCOTE | C978: PHILLIPE 7 | F978: JURGENSTEIN 4 | I978: JIM CHRISTOU 4 | L978: JOHN CHRISTOU | O978: HARLAND | R978: BRAIN | W978: SUNSHINE | X978: 2 | Y978: 16 | Z978: 0 | AA978: 1261 | AB978: 3261 | AC978: =(AA978*100)/AB978 -> 38.669119901870594 | AD978: =(X978*4)+(Z978*2) -> 8
A979: CAULFIELD | C979: BLAKE 4 | E979: BOOTH 3 | G979: CROCKER 3 | J979: EINSEDEL 2 | L979: CROOK | N979: PEARCE | P979: O'BRIEN | R979: FITCHETT | T979: CRANNY | W979: YARRAVILLE | X979: 1 | Y979: 17 | Z979: 0 | AA979: 1250 | AB979: 3284 | AC979: =(AA979*100)/AB979 -> 38.063337393422657 | AD979: =(X979*4)+(Z979*2) -> 4
O980: DUNCAN
A981: SPRINGVALE | C981: 17 | D981: 4 | E981: =C981*6+D981 -> 106 | G981: 28 | H981: 10 | I981: =G981*6+H981 -> 178 | K981: 39 | L981: 13 | M981: =K981*6+L981 -> 247 | O981: 48 | P981: 21 | Q981: =O981*6+P981 -> 309 | S981: NEWCOMEN RD
A982: SUNSHINE | C982: 2 | D982: 1 | E982: =C982*6+D982 -> 13 | G982: 8 | H982: 5 | I982: =G982*6+H982 -> 53 | K982: 11 | L982: 6 | M982: =K982*6+L982 -> 72 | O982: 12 | P982: 9 | Q982: =O982*6+P982 -> 81 | S982: BLOOM/J RYAN
A983: BEST PLAYERS
A984: SPRINGVALE | C984: CARROLL | F984: HOLDEN | I984: WOODMAN | L984: TONKIN | O984: ANDERSON | R984: FREEMAN
A985: SUNSHINE | C985: BENSON | F985: WILLIAMS | I985: MENADUE | L985: VADJNAL | O985: WAGLAND | R985: BIANCO
A986: GOALKICKERS
A987: SPRINGVALE | C987: CARROLL 18 | F987: ANDERSON 4 | I987: STEEL 4 | K987: CADDAYE 4 | N987: HOLDEN 4 | P987: FOTINIOTIS 3 | S987: GRAY 3 | U987: DEMPSTER 2 | X987: PADULA 2 | Z987: FREEMAN 2 | AB987: WOODMAN 2
A988: SUNSHINE | C988: GORE 3 | E988: BIANCO 2 | G988: CONLIN 2 | I988: WILLIAMS 2 | L988: KEARNEY | N988: VADJNAL | Q988: HENLEY
A990: BRUNSWICK | C990: 5 | D990: 7 | E990: =C990*6+D990 -> 37 | G990: 10 | H990: 11 | I990: =G990*6+H990 -> 71 | K990: 14 | L990: 22 | M990: =K990*6+L990 -> 106 | O990: 21 | P990: 24 | Q990: =O990*6+P990 -> 150 | S990: BENTLEIGH
A991: MOORABBIN | C991: 2 | D991: 0 | E991: =C991*6+D991 -> 12 | G991: 9 | H991: 5 | I991: =G991*6+H991 -> 59 | K991: 9 | L991: 9 | M991: =K991*6+L991 -> 63 | O991: 13 | P991: 13 | Q991: =O991*6+P991 -> 91 | S991: STEERE/SERONG
A992: BEST PLAYERS
A993: BRUNSWICK | C993: THORNTON | F993: DOYLE | I993: SAHLBERG | L993: LAWSON | O993: BAKER | R993: McGHIE
A994: MOORABBIN | C994: WELLS | F994: WILSON | I994: CONSTANTINOU | L994: STEWART | O994: COATES | R994: HARDEMAN
A995: GOALKICKERS
A996: BRUNSWICK | C996: SAHLBERG 3 | F996: GUMBLETON 3 | I996: HAMILTON 2 | L996: CALLANDER 2 | O996: JUDGE 2 | Q996: WEST 2 | S996: TOY 2 | U996: LAWSON 2 | X996: RADCHENKO 2 | AA996: THORNTON
A997: MOORABBIN | C997: WILSON 4 | F997: HARDEMAN 3 | I997: STEWART 3 | L997: CRESSIA | N997: CONSTANTINOU | Q997: POLLOCK | S997: BEATTIE
A999: MORDIALLOC | C999: 6 | D999: 5 | E999: =C999*6+D999 -> 41 | G999: 17 | H999: 9 | I999: =G999*6+H999 -> 111 | K999: 21 | L999: 12 | M999: =K999*6+L999 -> 138 | O999: 31 | P999: 15 | Q999: =O999*6+P999 -> 201 | S999: YARRAVILLE
A1000: YARRAVILLE | C1000: 3 | D1000: 2 | E1000: =C1000*6+D1000 -> 20 | G1000: 4 | H1000: 3 | I1000: =G1000*6+H1000 -> 27 | K1000: 5 | L1000: 8 | M1000: =K1000*6+L1000 -> 38 | O1000: 8 | P1000: 8 | Q1000: =O1000*6+P1000 -> 56 | S1000: HUTCHISON/BLACK
A1001: BEST PLAYERS
A1002: MORDIALLOC | C1002: WARREN | F1002: CLIFFORD | I1002: EMBERSON | L1002: HALE | N1002: BROMLEY | Q1002: KERIN
A1003: YARRAVILLE | C1003: DIDOLIS | F1003: KING | I1003: ROGOTOWICZ | L1003: MOON | N1003: ROGOZIK | Q1003: WARD
A1004: GOALKICKERS
A1005: MORDIALLOC | C1005: NEVILLE 9 | F1005: DEATON 4 | H1005: DAVIS 4 | J1005: CLIFFORD 4 | M1005: EMBERSON 3 | O1005: HALE 2 | Q1005: BROMLEY 2 | S1005: NORMAN 2 | V1005: NANGONI
A1006: YARRAVILLE | C1006: DIDOLIS 2 | F1006: TUPPEN | H1006: WARD | J1006: LUNT | L1006: SPROULE | N1006: HOUGH | P1006: ROGOTOWICZ
A1008: BERWICK | C1008: 5 | D1008: 5 | E1008: =C1008*6+D1008 -> 35 | G1008: 10 | H1008: 8 | I1008: =G1008*6+H1008 -> 68 | K1008: 12 | L1008: 10 | M1008: =K1008*6+L1008 -> 82 | O1008: 16 | P1008: 11 | Q1008: =O1008*6+P1008 -> 107 | S1008: KILSYTH
A1009: KILSYTH | C1009: 2 | D1009: 1 | E1009: =C1009*6+D1009 -> 13 | G1009: 4 | H1009: 3 | I1009: =G1009*6+H1009 -> 27 | K1009: 7 | L1009: 11 | M1009: =K1009*6+L1009 -> 53 | O1009: 9 | P1009: 13 | Q1009: =O1009*6+P1009 -> 67 | S1009: GOLLOP/GLEESON
A1010: BEST PLAYERS
A1011: BERWICK | C1011: SHEARS | F1011: CREBBIN | I1011: VENVILLE | L1011: VAN STEENSIL | O1011: M JOHNSON | R1011: TRIGG
A1012: KILSYTH | C1012: WATERS | F1012: EDWARDS | I1012: SCHNEIDER | L1012: DEAGAN | O1012: LETTS | R1012: D'ANGELO
A1013: GOALKICKERS
A1014: BERWICK | C1014: VENVILLE 5 | F1014: McGILL 3 | H1014: TRIGG 3 | J1014: PEARCE 2 | L1014: ALLEN | N1014: LUXFORD | Q1014: CALLERY
A1015: KILSYTH | C1015: DEAGAN 3 | F1015: N TAYLOR | I1015: HALBERT | L1015: GIBB | N1015: LETTS | P1015: CARPI | R1015: PRICE
A1017: FINALS
A1018: 1ST SEMI | E1018: 21ST AUGUST | J1018: WEATHER | S1018: PLAYED AT
D1019: 1ST QTR | H1019: 2ND QTR | L1019: 3RD QTR | P1019: FINAL | S1019: TOORAK PARK
A1020: SPRINGVALE | C1020: 5 | D1020: 2 | E1020: =C1020*6+D1020 -> 32 | G1020: 14 | H1020: 9 | I1020: =G1020*6+H1020 -> 93 | K1020: 16 | L1020: 9 | M1020: =K1020*6+L1020 -> 105 | O1020: 20 | P1020: 13 | Q1020: =O1020*6+P1020 -> 133 | S1020: UMPIRE
A1021: OAKLEIGH | C1021: 6 | D1021: 2 | E1021: =C1021*6+D1021 -> 38 | G1021: 7 | H1021: 2 | I1021: =G1021*6+H1021 -> 44 | K1021: 14 | L1021: 8 | M1021: =K1021*6+L1021 -> 92 | O1021: 18 | P1021: 10 | Q1021: =O1021*6+P1021 -> 118 | S1021: OGSTON/OAKLEY
A1022: BEST PLAYERS
A1023: SPRINGVALE | C1023: L FOWLER | F1023: CARROLL | I1023: TONKIN | L1023: SMITH | O1023: HOLDEN | R1023: BLOOMFIELD
A1024: OAKLEIGH | C1024: S ROACH | F1024: LOWE | I1024: McDONALD | L1024: MATTHEY | O1024: PLUMB
A1025: GOALKICKERS
A1026: SPRINGVALE | C1026: CARROLL 8 | F1026: ANDERSON 3 | I1026: BLOOMFIELD 2 | L1026: CADDAYE 2 | O1026: DICKSON 2 | R1026: STEEL | T1026: WOODMAN | W1026: HOLDEN
A1027: OAKLEIGH | C1027: LOWE 7 | F1027: HIGGINS 3 | I1027: HARPER 3 | K1027: HEVERIN 2 | N1027: CARTER | P1027: OWEN | R1027: COLLINS
A1029: 2ND SEMI | E1029: 28TH AUGUST | J1029: WEATHER
A1030: BRUNSWICK | C1030: 5 | D1030: 2 | E1030: =C1030*6+D1030 -> 32 | G1030: 13 | H1030: 6 | I1030: =G1030*6+H1030 -> 84 | K1030: 19 | L1030: 12 | M1030: =K1030*6+L1030 -> 126 | O1030: 25 | P1030: 15 | Q1030: =O1030*6+P1030 -> 165 | S1030: TOORAK PARK
A1031: MORDIALLOC | C1031: 3 | D1031: 1 | E1031: =C1031*6+D1031 -> 19 | G1031: 6 | H1031: 3 | I1031: =G1031*6+H1031 -> 39 | K1031: 10 | L1031: 5 | M1031: =K1031*6+L1031 -> 65 | O1031: 12 | P1031: 15 | Q1031: =O1031*6+P1031 -> 87 | S1031: VERGONA/PHILLIPS
A1032: BEST PLAYERS
A1033: BRUNSWICK | C1033: LAWSON | F1033: McGHIE | I1033: NOLAN | L1033: GUMBLETON | O1033: SAHLBERG | R1033: A SAGGERS
A1034: MORDIALLOC | C1034: WALSH | F1034: DEATON | I1034: MARGHERITI | L1034: KERIN
A1035: GOALKICKERS
A1036: BRUNSWICK | C1036: TOY 6 | E1036: SAHLBERG 3 | G1036: GUMBLETON 3 | J1036: HAMILTON 2 | M1036: LAWSON 2 | O1036: NOLAN 2 | Q1036: ROBERTSON 2 | T1036: CALLANDER | W1036: RADCHENKO | X1036: WEST | Y1036: LEAHY | AA1036: THORNTON
A1037: MORDIALLOC | C1037: NEVILLE 3 | F1037: NORMAN 3 | I1037: DEATON 3 | L1037: EMBERSON | O1037: CLIFFORD | R1037: KERIN
A1039: PRELIMINARY | E1039: 4TH SEPTEMBER | J1039: WEATHER
A1040: SPRINGVALE | C1040: 7 | D1040: 3 | E1040: =C1040*6+D1040 -> 45 | G1040: 14 | H1040: 6 | I1040: =G1040*6+H1040 -> 90 | K1040: 19 | L1040: 8 | M1040: =K1040*6+L1040 -> 122 | O1040: 29 | P1040: 14 | Q1040: =O1040*6+P1040 -> 188 | S1040: TOORAK PARK
A1041: MORDIALLOC | C1041: 5 | D1041: 5 | E1041: =C1041*6+D1041 -> 35 | G1041: 7 | H1041: 6 | I1041: =G1041*6+H1041 -> 48 | K1041: 11 | L1041: 8 | M1041: =K1041*6+L1041 -> 74 | O1041: 12 | P1041: 15 | Q1041: =O1041*6+P1041 -> 87 | S1041: GROOM/ALLSOP
A1042: BEST PLAYERS
A1043: SPRINGVALE | C1043: CARROLL | F1043: BRAND | I1043: DEMPSTER | L1043: WOODMAN | O1043: L FOWLER | R1043: HOLDEN
A1044: MORDIALLOC | C1044: BROM;EY | F1044: WALSH | I1044: EMBERSON | L1044: NORMAN | O1044: NEVILLE
A1045: GOALKICKERS
A1046: SPRINGVALE | C1046: CARROLL 11 | F1046: ANDERSON 4 | I1046: DEMPSTER 3 | K1046: DICKSON 3 | N1046: STEEL 2 | P1046: WOODMAN 2 | S1046: CADDAYE | V1046: BLOOMFIELD | X1046: HOLDEN | Z1046: FOTINIOTIS
A1047: MORDIALLOC | C1047: NEVILLE 3 | F1047: DE MUNK 2 | I1047: DEATON 2 | K1047: NORMAN | M1047: PAGNOCCOLO | P1047: BROMLEY | S1047: PRENTIS | V1047: WHITTAKER
A1049: GRAND | E1049: 11TH SEPTEMBER | J1049: WEATHER
A1050: SPRINGVALE | C1050: 5 | D1050: 3 | E1050: =C1050*6+D1050 -> 33 | G1050: 10 | H1050: 4 | I1050: =G1050*6+H1050 -> 64 | K1050: 15 | L1050: 6 | M1050: =K1050*6+L1050 -> 96 | O1050: 17 | P1050: 9 | Q1050: =O1050*6+P1050 -> 111 | S1050: TOORAK PARK
A1051: BRUNSWICK | C1051: 5 | D1051: 3 | E1051: =C1051*6+D1051 -> 33 | G1051: 6 | H1051: 7 | I1051: =G1051*6+H1051 -> 43 | K1051: 11 | L1051: 9 | M1051: =K1051*6+L1051 -> 75 | O1051: 13 | P1051: 16 | Q1051: =O1051*6+P1051 -> 94 | S1051: PHILLIPS/STABB
A1052: BEST PLAYERS
A1053: SPRINGVALE | C1053: L FOWLER | F1053: ANDERSON | I1053: McCOMB | L1053: HOLDEN | O1053: WOODMAN | R1053: R SMITH
A1054: BRUNSWICK | C1054: McGHIE | F1054: DOYLE | I1054: NOLAN | L1054: LYNCH | O1054: LAWSON | R1054: RADCHENKO
A1055: GOALKICKERS
A1056: SPRINGVALE | C1056: CARROLL 4 | F1056: ANDERSON 3 | I1056: HOLDEN 3 | K1056: WOODMAN 2 | N1056: FOTINOITIS 2 | Q1056: DEMPSTER | S1056: BRAND | U1056: DICKSON
A1057: BRUNSWICK | C1057: GUMBLETON 2 | F1057: LAWSON 2 | H1057: RADCHENKO 2 | K1057: TOY 2 | M1057: THORNTON 2 | P1057: SAHLBERG | S1057: NOLAN | U1057: JUDGE