A1: Victorian Football Association
A2: Season 1984 - Division Two
A3: © Copyright Wal Williams | F3: First created: 28 March 2016
A4: Contact: joywalwi at gmail dot com | F4: Last updated: 28 March 2016 | W4: VFA Results and tables - Link to the main index page
A5: You are free to copy this document in whole or part provided that proper acknowledgement is given to the author. All rights reserved.
A7: 1984 | C7: V.F.A. SEASON 2ND DIVISION
A8: ROUND 1 | E8: 8RD APRIL | J8: WEATHER | S8: PLAYED AT
D9: 1ST QTR | H9: 2ND QTR | L9: 3RD QTR | P9: FINAL | S9: MORDIALLOC
A10: BOX HILL | C10: 1 | D10: 1 | E10: =C10*6+D10 -> 7 | G10: 8 | H10: 6 | I10: =G10*6+H10 -> 54 | K10: 11 | L10: 10 | M10: =K10*6+L10 -> 76 | O10: 18 | P10: 15 | Q10: =O10*6+P10 -> 123 | S10: UMPIRE | X10: LADDER | AC10: ROUND | AE10: 1
A11: MORDIALLOC | C11: 4 | D11: 5 | E11: =C11*6+D11 -> 29 | G11: 5 | H11: 6 | I11: =G11*6+H11 -> 36 | K11: 7 | L11: 9 | M11: =K11*6+L11 -> 51 | O11: 10 | P11: 12 | Q11: =O11*6+P11 -> 72 | S11: GROOM/PHILLIPS
A12: BEST PLAYERS | W12: TEAM | X12: W | Y12: L | Z12: D | AA12: B | AB12: FOR | AC12: AGST | AD12: % | AE12: PTS
A13: BOX HILL | C13: JOHNSON | F13: TOVEY | I13: CARROLL | L13: SCHADE | O13: S WITNISH | R13: KAINEY
A14: MORDIALLOC | C14: KERIN | F14: WALSH | I14: NEVILLE | L14: DEATON | W14: BERWICK | X14: 1 | Y14: 0 | Z14: 0 | AB14: 187 | AC14: 64 | AD14: =(AB14*100)/AC14 -> 292.1875 | AE14: 4
A15: GOALKICKERS | W15: CAULFIELD | X15: 1 | Y15: 0 | Z15: 0 | AB15: 169 | AC15: 61 | AD15: =(AB15*100)/AC15 -> 277.04918032786884 | AE15: 4
A16: BOX HILL | C16: CARROLL 6 | F16: KAINEY 3 | I16: NICHOLSON 3 | L16: JOBSON 2 | N16: BYRON | P16: GIBB | R16: HEDGER | T16: TOVEY | W16: BOX HILL | X16: 1 | Y16: 0 | Z16: 0 | AB16: 123 | AC16: 72 | AD16: =(AB16*100)/AC16 -> 170.83333333333334 | AE16: 4
A17: MORDIALLOC | C17: NEVILLE 6 | F17: NORMAN 3 | I17: MANNING | W17: BRUNSWICK | X17: 1 | Y17: 0 | Z17: 0 | AB17: 133 | AC17: 107 | AD17: =(AB17*100)/AC17 -> 124.29906542056075 | AE17: 4
A19: CAULFIELD | C19: 7 | D19: 6 | E19: =C19*6+D19 -> 48 | G19: 12 | H19: 11 | I19: =G19*6+H19 -> 83 | K19: 17 | L19: 17 | M19: =K19*6+L19 -> 119 | O19: 24 | P19: 25 | Q19: =O19*6+P19 -> 169 | S19: KILSYTH | W19: OAKLEIGH | X19: 1 | Y19: 0 | Z19: 0 | AB19: 0 | AC19: 0 | AE19: 4
A20: KILSYTH | C20: 4 | D20: 1 | E20: =C20*6+D20 -> 25 | G20: 6 | H20: 1 | I20: =G20*6+H20 -> 37 | K20: 8 | L20: 6 | M20: =K20*6+L20 -> 54 | O20: 9 | P20: 7 | Q20: =O20*6+P20 -> 61 | S20: STEERE | W20: WAVERLEY | X20: 0 | Y20: 0 | Z20: 1 | AB20: 133 | AC20: 133 | AD20: =(AB20*100)/AC20 -> 100 | AE20: 2
A21: BEST PLAYERS | S21: CASEY | W21: MOORABBIN | X21: 0 | Y21: 0 | Z21: 1 | AB21: 133 | AC21: 133 | AD21: =(AB21*100)/AC21 -> 100 | AE21: 2
A22: CAULFIELD | C22: SHERIDAN | F22: EINSEDEL | I22: DAWSON | L22: HITCHCOCK | O22: RYAN | R22: GAYFER | W22: NORTHCOTE | X22: 0 | Y22: 1 | Z22: 0 | AB22: 107 | AC22: 133 | AD22: =(AB22*100)/AC22 -> 80.451127819548873 | AE22: 0
A23: KILSYTH | C23: O'KEEFE | F23: ROBINS | I23: GEORGE | L23: McKINNON | O23: FRASER | R23: SCHNEIDER | W23: MORDIALLOC | X23: 0 | Y23: 1 | Z23: 0 | AB23: 72 | AC23: 123 | AD23: =(AB23*100)/AC23 -> 58.536585365853661 | AE23: 0
A24: GOALKICKERS | L24: RYAN | N24: SHERIDAN | Q24: DOYLE | W24: KILSYTH | X24: 0 | Y24: 1 | Z24: 0 | AB24: 61 | AC24: 169 | AD24: =(AB24*100)/AC24 -> 36.094674556213015 | AE24: 0
A25: CAULFIELD | C25: DAWSON 5 | F25: HITCHCOCK 5 | I25: BLAKE 4 | K25: EINSEDEL 2 | N25: BLACK | P25: CROOK | R25: FARINSKI | T25: HOGAN | W25: SUNSHINE | X25: 0 | Y25: 1 | Z25: 0 | AB25: 64 | AC25: 187 | AD25: =(AB25*100)/AC25 -> 34.224598930481285 | AE25: 0
A26: KILSYTH | C26: BUTCHER 2 | F26: BASS 2 | H26: GIBB 2 | J26: TAYLOR 2 | M26: SCHNEIDER
A28: BERWICK | C28: 3 | D28: 6 | E28: =C28*6+D28 -> 24 | G28: 10 | H28: 9 | I28: =G28*6+H28 -> 69 | K28: 21 | L28: 15 | M28: =K28*6+L28 -> 141 | O28: 28 | P28: 19 | Q28: =O28*6+P28 -> 187 | S28: BERWICK
A29: SUNSHINE | C29: 0 | D29: 0 | E29: =C29*6+D29 -> 0 | G29: 3 | H29: 5 | I29: =G29*6+H29 -> 23 | K29: 6 | L29: 6 | M29: =K29*6+L29 -> 42 | O29: 9 | P29: 10 | Q29: =O29*6+P29 -> 64 | S29: OAKLEY/SMITH
A30: BEST PLAYERS
A31: BERWICK | C31: DILLON | F31: M JOHNSON | I31: POWLES | L31: WARD | N31: CALLERY | Q31: SMITH
A32: SUNSHINE | C32: WHITNEY | F32: N MENADUE | I32: P MENADUE | L32: BELL | N32: FOLEY | Q32: BENSON
A33: GOALKICKERS
A34: BERWICK | C34: DILLON 8 | F34: SMITH 6 | H34: POWLES 5 | J34: BROWN 3 | L34: VENVILLE 2 | O34: CREBBIN | Q34: ALLEN | S34: LUXFORD | V34: PARK
A35: SUNSHINE | C35: BELL 2 | E35: P MENADUE | H35: WAGLAND | J35: CATTANACH | M35: WILLIAMS | O35: FARRUGIA | R35: PARKER | T35: N MENADUE
A37: BRUNSWICK | C37: 6 | D37: 7 | E37: =C37*6+D37 -> 43 | G37: 11 | H37: 11 | I37: =G37*6+H37 -> 77 | K37: 13 | L37: 19 | M37: =K37*6+L37 -> 97 | O37: 18 | P37: 25 | Q37: =O37*6+P37 -> 133 | S37: BRUNSWICK
A38: NORTHCOTE | C38: 3 | D38: 3 | E38: =C38*6+D38 -> 21 | G38: 11 | H38: 5 | I38: =G38*6+H38 -> 71 | K38: 13 | L38: 5 | M38: =K38*6+L38 -> 83 | O38: 16 | P38: 11 | Q38: =O38*6+P38 -> 107 | S38: HUTCHISON/VERGONA
A39: BEST PLAYERS
A40: BRUNSWICK | C40: CALLANDER | G40: LAWSON | J40: TOY | M40: BUCKLEY | P40: GIBSON | S40: SCULLY
A41: NORTHCOTE | C41: JIM CHRISTOU | G41: MITCHELL | J41: ROULSTON | M41: MINNETT | P41: STRANGWICK | S41: ELMS
A42: GOALKICKERS
A43: BRUNSWICK | C43: TOY 4 | E43: WHILLAS 3 | G43: LAWSON 3 | J43: BUCKLEY 2 | L43: SAHLBERG 2 | O43: SCULLY | Q43: GIBSON | S43: EDWARDS | V43: DAHOUD
A44: NORTHCOTE | C44: JIM CHRISTOU 3 | G44: MITCHELL 3 | J44: MINNETT 2 | M44: MALLETT 2 | O44: STRANGWICK 2 | R44: BRAIN 2 | T44: GLOBBIN 2
A46: MOORABBIN | C46: 7 | D46: 6 | E46: =C46*6+D46 -> 48 | G46: 11 | H46: 6 | I46: =G46*6+H46 -> 72 | K46: 18 | L46: 10 | M46: =K46*6+L46 -> 118 | O46: 20 | P46: 13 | Q46: =O46*6+P46 -> 133 | S46: BENTLEIGH
A47: WAVERLEY | C47: 2 | D47: 1 | E47: =C47*6+D47 -> 13 | G47: 12 | H47: 3 | I47: =G47*6+H47 -> 75 | K47: 15 | L47: 9 | M47: =K47*6+L47 -> 99 | O47: 19 | P47: 19 | Q47: =O47*6+P47 -> 133 | S47: MARSHALL/FITZPATRICK
A48: BEST PLAYERS
A49: MOORABBIN | C49: B CATHCART | F49: PAPPON | I49: R POLLOCK | L49: ATHERTON | O49: D CATHCART | R49: MARSHALL
A50: WAVERLEY | C50: WILLIAMS | F50: VEAR | I50: THOMAS | L50: GREENE | O50: CARGHILL | R50: WENBORNE
A51: GOALKICKERS
A52: MOORABBIN | C52: B CATHCART 5 | F52: ATHERTON 4 | I52: HALE 2 | K52: MORRIS 2 | M52: WHITE 2 | O52: BOYLE | Q52: R POLLOCK | S52: HOWES | U52: PAPPON | W52: PAPPAS
A53: WAVERLEY | C53: WILLIAMS 5 | F53: THOMAS 4 | I53: COSTELLO 2 | L53: GREENE 2 | N53: ZAKARIN 2 | Q53: VEAR | S53: SCHADE | V53: JOYCE
A55: BYE | C55: OAKLEIGH
A57: ROUND 2 | E57: 15TH APRIL | J57: WEATHER | S57: PLAYED AT
D58: 1ST QTR | H58: 2ND QTR | L58: 3RD QTR | P58: FINAL | S58: WAVERLEY
A59: BRUNSWICK | C59: 9 | D59: 4 | E59: =C59*6+D59 -> 58 | G59: 11 | H59: 5 | I59: =G59*6+H59 -> 71 | K59: 17 | L59: 11 | M59: =K59*6+L59 -> 113 | O59: 27 | P59: 15 | Q59: =O59*6+P59 -> 177 | S59: UMPIRE | X59: LADDER | AC59: ROUND | AE59: 2
A60: WAVERLEY | C60: 1 | D60: 4 | E60: =C60*6+D60 -> 10 | G60: 11 | H60: 12 | I60: =G60*6+H60 -> 78 | K60: 13 | L60: 14 | M60: =K60*6+L60 -> 92 | O60: 17 | P60: 15 | Q60: =O60*6+P60 -> 117 | S60: BLAKE/TOOLONGS
A61: BEST PLAYERS | W61: TEAM | X61: W | Y61: L | Z61: D | AA61: B | AB61: FOR | AC61: AGST | AD61: % | AE61: PTS
A62: BRUNSWICK | C62: BROWN | F62: LAWSON | I62: TOY | K62: HICKMAN | N62: CALLANDER | Q62: LEAHY
A63: WAVERLEY | C63: WILLIAMS | F63: KINNABURGH | I63: CARGHILL | K63: COSTELLO | N63: GREENE | Q63: INTERLEGI | W63: CAULFIELD | X63: 2 | Y63: 0 | Z63: 0 | AB63: 317 | AC63: 138 | AD63: =(AB63*100)/AC63 -> 229.71014492753622 | AE63: 8
A64: GOALKICKERS | N64: CALLANDER | Q64: EDWARDS | W64: BOX HILL | X64: 2 | Y64: 0 | Z64: 0 | AB64: 365 | AC64: 160 | AD64: =(AB64*100)/AC64 -> 228.125 | AE64: 8
A65: BRUNSWICK | C65: LAWSON 8 | F65: TOY 5 | H65: HICKMAN 4 | K65: FLOWER 3 | N65: GIBSON 2 | P65: SCULLY | R65: SAHLBERG | T65: DAHOUD | W65: OAKLEIGH | X65: 2 | Y65: 0 | Z65: 0 | AB65: 212 | AC65: 106 | AD65: =(AB65*100)/AC65 -> 200 | AE65: 8
A66: WAVERLEY | C66: WILLIAMS 4 | F66: ZAKARIN 4 | I66: NEWBOULD 3 | L66: THOMAS 2 | O66: GUERINS | Q66: GREENE | S66: WENBORNE | W66: BRUNSWICK | X66: 2 | Y66: 0 | Z66: 0 | AB66: 310 | AC66: 224 | AD66: =(AB66*100)/AC66 -> 138.39285714285714 | AE66: 8
A68: OAKLEIGH | C68: 8 | D68: 1 | E68: =C68*6+D68 -> 49 | G68: 15 | H68: 10 | I68: =G68*6+H68 -> 100 | K68: 24 | L68: 12 | M68: =K68*6+L68 -> 156 | O68: 33 | P68: 14 | Q68: =O68*6+P68 -> 212 | S68: OAKLEIGH | W68: BERWICK | X68: 1 | Y68: 1 | Z68: 0 | AB68: 293 | AC68: 276 | AD68: =(AB68*100)/AC68 -> 106.15942028985508 | AE68: 4
A69: BERWICK | C69: 4 | D69: 5 | E69: =C69*6+D69 -> 29 | G69: 6 | H69: 6 | I69: =G69*6+H69 -> 42 | K69: 11 | L69: 8 | M69: =K69*6+L69 -> 74 | O69: 16 | P69: 10 | Q69: =O69*6+P69 -> 106 | S69: G BREWER | W69: NORTHCOTE | X69: 1 | Y69: 1 | Z69: 0 | AB69: 107 | AC69: 133 | AD69: =(AB69*100)/AC69 -> 80.451127819548873 | AE69: 4
A70: BEST PLAYERS | S70: GLEESON | W70: KILSYTH | X70: 1 | Y70: 1 | Z70: 0 | AB70: 173 | AC70: 259 | AD70: =(AB70*100)/AC70 -> 66.795366795366789 | AE70: 4
A71: OAKLEIGH | C71: McDONALD | F71: HARPER | I71: PLUMB | K71: SWANN | N71: MATTHEY | Q71: BATTERSBY | W71: WAVERLEY | X71: 0 | Y71: 1 | Z71: 1 | AB71: 250 | AC71: 310 | AD71: =(AB71*100)/AC71 -> 80.645161290322577 | AE71: 2
A72: BERWICK | C72: ALLEN | F72: CROOK | I72: BROWN | K72: SCOTT | N72: JOHNSON | W72: MOORABBIN | X72: 0 | Y72: 1 | Z72: 1 | AB72: 221 | AC72: 375 | AD72: =(AB72*100)/AC72 -> 58.93333333333333 | AE72: 2
A73: GOALKICKERS | L73: SAMIOS | N73: ROACH | P73: MATTHEY | W73: MORDIALLOC | X73: 0 | Y73: 2 | Z73: 0 | AB73: 149 | AC73: 271 | AD73: =(AB73*100)/AC73 -> 54.981549815498155 | AE73: 0
A74: OAKLEIGH | C74: SWANN 6 | F74: LAURITZ 5 | H74: BRYDEN 5 | J74: OWEN 4 | L74: WILLIAMS 3 | O74: HARPER 3 | Q74: BROWN 2 | S74: FLINN 2 | W74: SUNSHINE | X74: 0 | Y74: 2 | Z74: 0 | AB74: 154 | AC74: 299 | AD74: =(AB74*100)/AC74 -> 51.50501672240803 | AE74: 0
A75: BERWICK | C75: BROWN 6 | F75: ALLEN 4 | H75: VENVILLE 2 | K75: WARD | M75: SMITH | O75: LUXFORD | R75: PARK
A77: BOX HILL | C77: 8 | D77: 6 | E77: =C77*6+D77 -> 54 | G77: 16 | H77: 12 | I77: =G77*6+H77 -> 108 | K77: 26 | L77: 15 | M77: =K77*6+L77 -> 171 | O77: 37 | P77: 20 | Q77: =O77*6+P77 -> 242 | S77: BOX HILL
A78: MOORABBIN | C78: 2 | D78: 3 | E78: =C78*6+D78 -> 15 | G78: 4 | H78: 5 | I78: =G78*6+H78 -> 29 | K78: 10 | L78: 8 | M78: =K78*6+L78 -> 68 | O78: 13 | P78: 10 | Q78: =O78*6+P78 -> 88 | S78: GOLLOP/WALKER
A79: BEST PLAYERS
A80: BOX HILL | C80: KAINEY | F80: NICHOLSON | I80: S WITNISH | L80: BYRON | N80: CARROLL | Q80: O'SHEA
A81: MOORABBIN | C81: BEATTIE | F81: PAPPON | I81: R POLLOCK | L81: MARSHALL
A82: GOALKICKERS
A83: BOX HILL | C83: NICHOLSON 9 | F83: CARROLL 8 | H83: BYRON 5 | J83: KAINEY 5 | L83: O'SHEA 2 | N83: JOBSON 2 | P83: HEDGER 2 | R83: DICKENSON | T83: CHARLES | V83: GIBSON | AA83: GLEESON
A84: MOORABBIN | C84: PAPPON 3 | F84: LETT 3 | H84: PAPPAS 2 | J84: ATHERTON | M84: R POLLOCK | O84: LONIE | Q84: BUNTZ | S84: MARSHALL
A86: CAULFIELD | C86: 3 | D86: 2 | E86: =C86*6+D86 -> 20 | G86: 7 | H86: 5 | I86: =G86*6+H86 -> 47 | K86: 12 | L86: 8 | M86: =K86*6+L86 -> 80 | O86: 22 | P86: 16 | Q86: =O86*6+P86 -> 148 | S86: PRINCES PARK, CAULFIELD
A87: MORDIALLOC | C87: 3 | D87: 2 | E87: =C87*6+D87 -> 20 | G87: 6 | H87: 5 | I87: =G87*6+H87 -> 41 | K87: 10 | L87: 9 | M87: =K87*6+L87 -> 69 | O87: 11 | P87: 11 | Q87: =O87*6+P87 -> 77 | S87: BLOOM/MAY
A88: BEST PLAYERS
A89: CAULFIELD | C89: DAWSON | F89: FARINSKI | I89: BRASIER | L89: EINSEDEL | O89: REED | R89: MADDAFERI
A90: MORDIALLOC | C90: PRENTIS | F90: BROMLEY | I90: SHEPPARD | L90: DEATON | O90: WARREN | R90: BENCRAFT
A91: GOALKICKERS
A92: CAULFIELD | C92: BLACK 4 | F92: DAWSON 4 | I92: HITCHCOCK 4 | L92: BARRY 2 | N92: EINSEDEL 2 | Q92: FARINSKI 2 | S92: BLAKE | U92: DOYLE | W92: O'BRIEN | X92: SHERIDAN
A93: MORDIALLOC | C93: DEATON 3 | F93: FANNING 3 | I93: CLIFFORD 2 | L93: NEVILLE | N93: NORMAN | Q93: McILWRAITH
A95: KILSYTH | C95: 3 | D95: 4 | E95: =C95*6+D95 -> 22 | G95: 10 | H95: 9 | I95: =G95*6+H95 -> 69 | K95: 11 | L95: 12 | M95: =K95*6+L95 -> 78 | O95: 16 | P95: 16 | Q95: =O95*6+P95 -> 112 | S95: SUNSHINE
A96: SUNSHINE | C96: 5 | D96: 2 | E96: =C96*6+D96 -> 32 | G96: 9 | H96: 3 | I96: =G96*6+H96 -> 57 | K96: 10 | L96: 5 | M96: =K96*6+L96 -> 65 | O96: 13 | P96: 12 | Q96: =O96*6+P96 -> 90 | S96: BRADSHAW/BLACK
A97: BEST PLAYERS
A98: KILSYTH | C98: BIANCO | F98: KENT | H98: GIBB | J98: O'KEEFE | M98: IRELAND | P98: SCHNEIDER
A99: SUNSHINE | C99: B MENADUE | F99: GORE | H99: N MENADUE | K99: P MENADUE | N99: BENSON | P99: TURLEY
A100: GOALKICKERS
A101: KILSYTH | C101: SCHNEIDER 4 | F101: JOHNSON 4 | I101: GIBB 2 | K101: MUIR 2 | M101: CRISP 2 | O101: BIANCO | Q101: BUTCHER
A102: SUNSHINE | C102: WILLIAMS 3 | F102: CATTANACH 2 | I102: TURLEY 2 | K102: N MENADUE 2 | N102: FOLEY | P102: HILL | R102: P MENADUE
A104: BYE | C104: NORTHCOTE
A106: ROUND 3 | E106: 22ND APRIL | J106: WEATHER | S106: PLAYED AT
D107: 1ST QTR | H107: 2ND QTR | L107: 3RD QTR | P107: FINAL | S107: BRUNSWICK
A108: BRUNSWICK | C108: 4 | D108: 6 | E108: =C108*6+D108 -> 30 | G108: 10 | H108: 12 | I108: =G108*6+H108 -> 72 | K108: 11 | L108: 12 | M108: =K108*6+L108 -> 78 | O108: 18 | P108: 15 | Q108: =O108*6+P108 -> 123 | S108: UMPIRE | X108: LADDER | AC108: ROUND | AE108: 3
A109: MOORABBIN | C109: 0 | D109: 4 | E109: =C109*6+D109 -> 4 | G109: 4 | H109: 8 | I109: =G109*6+H109 -> 32 | K109: 7 | L109: 10 | M109: =K109*6+L109 -> 52 | O109: 10 | P109: 14 | Q109: =O109*6+P109 -> 74
A110: BEST PLAYERS | W110: TEAM | X110: W | Y110: L | Z110: D | AA110: B | AB110: FOR | AC110: AGST | AD110: % | AE110: PTS
A111: BRUNSWICK
A112: MOORABBIN | W112: OAKLEIGH | X112: 3 | Y112: 0 | Z112: 0 | AB112: 455 | AC112: 146 | AD112: =(AB112*100)/AC112 -> 311.64383561643837 | AE112: 12
A113: GOALKICKERS | W113: BOX HILL | X113: 3 | Y113: 0 | Z113: 0 | AB113: 487 | AC113: 235 | AD113: =(AB113*100)/AC113 -> 207.2340425531915 | AE113: 12
A114: BRUNSWICK | W114: BRUNSWICK | X114: 3 | Y114: 0 | Z114: 0 | AB114: 433 | AC114: 298 | AD114: =(AB114*100)/AC114 -> 145.30201342281879 | AE114: 12
A115: MOORABBIN | W115: CAULFIELD | X115: 2 | Y115: 1 | Z115: 0 | AB115: 392 | AC115: 260 | AD115: =(AB115*100)/AC115 -> 150.76923076923077 | AE115: 8
A117: BOX HILL | C117: 8 | D117: 7 | E117: =C117*6+D117 -> 55 | G117: 10 | H117: 9 | I117: =G117*6+H117 -> 69 | K117: 15 | L117: 18 | M117: =K117*6+L117 -> 108 | O117: 17 | P117: 20 | Q117: =O117*6+P117 -> 122 | S117: PRINCES PARK, CAULFIELD | W117: BERWICK | X117: 2 | Y117: 1 | Z117: 0 | AB117: 403 | AC117: 365 | AD117: =(AB117*100)/AC117 -> 110.41095890410959 | AE117: 8
A118: CAULFIELD | C118: 0 | D118: 1 | E118: =C118*6+D118 -> 1 | G118: 4 | H118: 7 | I118: =G118*6+H118 -> 31 | K118: 7 | L118: 10 | M118: =K118*6+L118 -> 52 | O118: 10 | P118: 15 | Q118: =O118*6+P118 -> 75 | W118: WAVERLEY | X118: 1 | Y118: 1 | Z118: 1 | AB118: 250 | AC118: 310 | AD118: =(AB118*100)/AC118 -> 80.645161290322577 | AE118: 6
A119: BEST PLAYERS | W119: MORDIALLOC | X119: 1 | Y119: 2 | Z119: 0 | AB119: 310 | AC119: 354 | AD119: =(AB119*100)/AC119 -> 87.570621468926561 | AE119: 4
A120: BOX HILL | W120: NORTHCOTE | X120: 1 | Y120: 2 | Z120: 0 | AB120: 196 | AC120: 243 | AD120: =(AB120*100)/AC120 -> 80.658436213991763 | AE120: 4
A121: CAULFIELD | W121: KILSYTH | X121: 1 | Y121: 2 | Z121: 0 | AB121: 213 | AC121: 502 | AD121: =(AB121*100)/AC121 -> 42.430278884462155 | AE121: 4
A122: GOALKICKERS | W122: MOORABBIN | X122: 0 | Y122: 2 | Z122: 1 | AB122: 370 | AC122: 620 | AD122: =(AB122*100)/AC122 -> 59.677419354838712 | AE122: 2
A123: BOX HILL | W123: SUNSHINE | X123: 0 | Y123: 3 | Z123: 0 | AB123: 237 | AC123: 460 | AD123: =(AB123*100)/AC123 -> 51.521739130434781 | AE123: 0
A124: CAULFIELD
A126: OAKLEIGH | C126: 11 | D126: 11 | E126: =C126*6+D126 -> 77 | G126: 18 | H126: 12 | I126: =G126*6+H126 -> 120 | K126: 30 | L126: 16 | M126: =K126*6+L126 -> 196 | O126: 37 | P126: 21 | Q126: =O126*6+P126 -> 243 | S126: KILSYTH
A127: KILSYTH | C127: 1 | D127: 1 | E127: =C127*6+D127 -> 7 | G127: 3 | H127: 5 | I127: =G127*6+H127 -> 23 | K127: 3 | L127: 6 | M127: =K127*6+L127 -> 24 | O127: 5 | P127: 10 | Q127: =O127*6+P127 -> 40
A128: BEST PLAYERS
A129: OAKLEIGH
A130: KILSYTH
A131: GOALKICKERS
A132: OAKLEIGH
A133: KILSYTH
A135: BERWICK | C135: 3 | D135: 3 | E135: =C135*6+D135 -> 21 | G135: 10 | H135: 11 | I135: =G135*6+H135 -> 71 | K135: 12 | L135: 13 | M135: =K135*6+L135 -> 85 | O135: 15 | P135: 20 | Q135: =O135*6+P135 -> 110 | S135: BERWICK
A136: NORTHCOTE | C136: 6 | D136: 8 | E136: =C136*6+D136 -> 44 | G136: 8 | H136: 10 | I136: =G136*6+H136 -> 58 | K136: 12 | L136: 15 | M136: =K136*6+L136 -> 87 | O136: 12 | P136: 17 | Q136: =O136*6+P136 -> 89
A137: BEST PLAYERS
A138: BERWICK
A139: NORTHCOTE
A140: GOALKICKERS
A141: BERWICK
A142: NORTHCOTE
A144: MOEDIALLOC | C144: 3 | D144: 2 | E144: =C144*6+D144 -> 20 | G144: 10 | H144: 8 | I144: =G144*6+H144 -> 68 | K144: 17 | L144: 10 | M144: =K144*6+L144 -> 112 | O144: 23 | P144: 23 | Q144: =O144*6+P144 -> 161 | S144: MORDIALLOC
A145: SUNSHINE | C145: 5 | D145: 4 | E145: =C145*6+D145 -> 34 | G145: 8 | H145: 9 | I145: =G145*6+H145 -> 57 | K145: 11 | L145: 11 | M145: =K145*6+L145 -> 77 | O145: 12 | P145: 11 | Q145: =O145*6+P145 -> 83
A146: BEST PLAYERS
A147: MOEDIALLOC
A148: SUNSHINE
A149: GOALKICKERS
A150: MOEDIALLOC
A151: SUNSHINE
A153: BYE | C153: WAVERLEY
A155: ROUND 4 | E155: 29TH APRIL | J155: WEATHER | S155: PLAYED AT
D156: 1ST QTR | H156: 2ND QTR | L156: 3RD QTR | P156: FINAL | S156: PRINCES PARK, CAULFIELD
A157: CAULFIELD | C157: 10 | D157: 3 | E157: =C157*6+D157 -> 63 | G157: 16 | H157: 5 | I157: =G157*6+H157 -> 101 | K157: 22 | L157: 6 | M157: =K157*6+L157 -> 138 | O157: 25 | P157: 8 | Q157: =O157*6+P157 -> 158 | S157: UMPIRE | X157: LADDER | AC157: ROUND | AE157: 4
A158: SUNSHINE | C158: 1 | D158: 2 | E158: =C158*6+D158 -> 8 | G158: 7 | H158: 3 | I158: =G158*6+H158 -> 45 | K158: 9 | L158: 6 | M158: =K158*6+L158 -> 60 | O158: 14 | P158: 10 | Q158: =O158*6+P158 -> 94
A159: BEST PLAYERS | W159: TEAM | X159: W | Y159: L | Z159: D | AA159: B | AB159: FOR | AC159: AGST | AD159: % | AE159: PTS
A160: CAULFIELD
A161: SUNSHINE | W161: OAKLEIGH | X161: 4 | Y161: 0 | Z161: 0 | AB161: 595 | AC161: 251 | AD161: =(AB161*100)/AC161 -> 237.05179282868525 | AE161: 16
A162: GOALKICKERS | W162: BRUNSWICK | X162: 4 | Y162: 0 | Z162: 0 | AB162: 584 | AC162: 419 | AD162: =(AB162*100)/AC162 -> 139.37947494033412 | AE162: 16
A163: CAULFIELD | W163: BOX HILL | X163: 3 | Y163: 1 | Z163: 0 | AB163: 608 | AC163: 386 | AD163: =(AB163*100)/AC163 -> 157.51295336787564 | AE163: 12
A164: SUNSHINE | W164: CAULFIELD | X164: 3 | Y164: 1 | Z164: 0 | AB164: 550 | AC164: 354 | AD164: =(AB164*100)/AC164 -> 155.36723163841808 | AE164: 12
A166: OAKLEIGH | C166: 7 | D166: 6 | E166: =C166*6+D166 -> 48 | G166: 11 | H166: 10 | I166: =G166*6+H166 -> 76 | K166: 14 | L166: 11 | M166: =K166*6+L166 -> 95 | O166: 20 | P166: 20 | Q166: =O166*6+P166 -> 140 | S166: OAKLEIGH | W166: WAVERLEY | X166: 2 | Y166: 1 | Z166: 1 | AB166: 401 | AC166: 423 | AD166: =(AB166*100)/AC166 -> 94.799054373522452 | AE166: 10
A167: MORDIALLOC | C167: 4 | D167: 2 | E167: =C167*6+D167 -> 26 | G167: 12 | H167: 2 | I167: =G167*6+H167 -> 74 | K167: 16 | L167: 3 | M167: =K167*6+L167 -> 99 | O167: 17 | P167: 3 | Q167: =O167*6+P167 -> 105 | W167: NORTHCOTE | X167: 2 | Y167: 2 | Z167: 0 | AB167: 356 | AC167: 346 | AD167: =(AB167*100)/AC167 -> 102.89017341040463 | AE167: 8
A168: BEST PLAYERS | W168: BERWICK | X168: 2 | Y168: 2 | Z168: 0 | AB168: 516 | AC168: 516 | AD168: =(AB168*100)/AC168 -> 100 | AE168: 8
A169: OAKLEIGH | W169: MOORABBIN | X169: 1 | Y169: 2 | Z169: 1 | AB169: 370 | AC169: 620 | AD169: =(AB169*100)/AC169 -> 59.677419354838712 | AE169: 6
A170: MORDIALLOC | W170: MORDIALLOC | X170: 1 | Y170: 3 | Z170: 0 | AB170: 415 | AC170: 494 | AD170: =(AB170*100)/AC170 -> 84.008097165991899 | AE170: 4
A171: GOALKICKERS | W171: KILSYTH | X171: 1 | Y171: 3 | Z171: 0 | AB171: 316 | AC171: 662 | AD171: =(AB171*100)/AC171 -> 47.734138972809667 | AE171: 4
A172: OAKLEIGH | W172: SUNSHINE | X172: 0 | Y172: 4 | Z172: 0 | AB172: 331 | AC172: 618 | AD172: =(AB172*100)/AC172 -> 53.559870550161811 | AE172: 0
A173: MORDIALLOC
A175: NORTHCOTE | C175: 6 | D175: 4 | E175: =C175*6+D175 -> 40 | G175: 12 | H175: 6 | I175: =G175*6+H175 -> 78 | K175: 20 | L175: 9 | M175: =K175*6+L175 -> 129 | O175: 24 | P175: 16 | Q175: =O175*6+P175 -> 160 | S175: NORTHCOTE
A176: KILSYTH | C176: 2 | D176: 5 | E176: =C176*6+D176 -> 17 | G176: 4 | H176: 11 | I176: =G176*6+H176 -> 35 | K176: 7 | L176: 15 | M176: =K176*6+L176 -> 57 | O176: 14 | P176: 19 | Q176: =O176*6+P176 -> 103
A177: BEST PLAYERS
A178: NORTHCOTE
A179: KILSYTH
A180: GOALKICKERS
A181: NORTHCOTE
A182: KILSYTH
A184: WAVERLEY | C184: 4 | D184: 4 | E184: =C184*6+D184 -> 28 | G184: 12 | H184: 7 | I184: =G184*6+H184 -> 79 | K184: 15 | L184: 10 | M184: =K184*6+L184 -> 100 | O184: 23 | P184: 13 | Q184: =O184*6+P184 -> 151 | S184: WAVERLEY
A185: BERWICK | C185: 5 | D185: 7 | E185: =C185*6+D185 -> 37 | G185: 9 | H185: 10 | I185: =G185*6+H185 -> 64 | K185: 11 | L185: 14 | M185: =K185*6+L185 -> 80 | O185: 16 | P185: 17 | Q185: =O185*6+P185 -> 113
A186: BEST PLAYERS
A187: WAVERLEY
A188: BERWICK
A189: GOALKICKERS
A190: WAVERLEY
A191: BERWICK
A193: BRUNSWICK | C193: 4 | D193: 2 | E193: =C193*6+D193 -> 26 | G193: 12 | H193: 8 | I193: =G193*6+H193 -> 80 | K193: 15 | L193: 12 | M193: =K193*6+L193 -> 102 | O193: 22 | P193: 19 | Q193: =O193*6+P193 -> 151 | S193: BRUNSWICK
A194: BOX HILL | C194: 5 | D194: 5 | E194: =C194*6+D194 -> 35 | G194: 10 | H194: 8 | I194: =G194*6+H194 -> 68 | K194: 13 | L194: 12 | M194: =K194*6+L194 -> 90 | O194: 17 | P194: 19 | Q194: =O194*6+P194 -> 121
A195: BEST PLAYERS
A196: BRUNSWICK
A197: BOX HILL
A198: GOALKICKERS
A199: BRUNSWICK
A200: BOX HILL
A202: BYE | C202: MOORABBIN
A204: ROUND 5 | E204: 6TH MAY | J204: WEATHER | S204: PLAYED AT
D205: 1ST QTR | H205: 2ND QTR | L205: 3RD QTR | P205: FINAL | S205: BOX HILL
A206: BOX HILL | C206: 3 | D206: 5 | E206: =C206*6+D206 -> 23 | G206: 11 | H206: 8 | I206: =G206*6+H206 -> 74 | K206: 24 | L206: 11 | M206: =K206*6+L206 -> 155 | O206: 34 | P206: 17 | Q206: =O206*6+P206 -> 221 | S206: UMPIRE | X206: LADDER | AC206: ROUND | AE206: 5
A207: SUNSHINE | C207: 3 | D207: 0 | E207: =C207*6+D207 -> 18 | G207: 6 | H207: 5 | I207: =G207*6+H207 -> 41 | K207: 9 | L207: 7 | M207: =K207*6+L207 -> 61 | O207: 11 | P207: 7 | Q207: =O207*6+P207 -> 73 | S207: HUTCHISON/McCARTHY
A208: BEST PLAYERS | W208: TEAM | X208: W | Y208: L | Z208: D | AA208: B | AB208: FOR | AC208: AGST | AD208: % | AE208: PTS
A209: BOX HILL | C209: CARROLL | F209: O'SHEA | I209: DICKENSON | L209: SCHADE | O209: P WITNISH | R209: TOVEY
A210: SUNSHINE | C210: B MENADUE | F210: COOKE | I210: WILLIAMS | L210: CATTANACH | O210: FOLEY | R210: WAGLAND | W210: BRUNSWICK | X210: 5 | Y210: 0 | Z210: 0 | AB210: 584 | AC210: 419 | AD210: =(AB210*100)/AC210 -> 139.37947494033412 | AE210: 20
A211: GOALKICKERS | I211: O'SHEA 2 | L211: CHARLES | N211: CASEY | P211: RAYMOND | R211: P WITNISH | W211: OAKLEIGH | X211: 4 | Y211: 1 | Z211: 0 | AB211: 695 | AC211: 368 | AD211: =(AB211*100)/AC211 -> 188.85869565217391 | AE211: 16
A212: BOX HILL | C212: CARROLL 8 | F212: CRUSE 6 | H212: DICKENSON 5 | K212: NICHOLSON 3 | N212: R WILSON 2 | Q212: SCHADE 2 | S212: KAINEY 2 | W212: BOX HILL | X212: 4 | Y212: 1 | Z212: 0 | AB212: 829 | AC212: 459 | AD212: =(AB212*100)/AC212 -> 180.61002178649238 | AE212: 16
A213: SUNSHINE | C213: COOKE 5 | F213: AXON 3 | H213: WILLIAMS | K213: CATTANACH | N213: N MENADUE | W213: CAULFIELD | X213: 4 | Y213: 1 | Z213: 0 | AB213: 667 | AC213: 454 | AD213: =(AB213*100)/AC213 -> 146.91629955947135 | AE213: 16
A215: MORDIALLOC | C215: 3 | D215: 2 | E215: =C215*6+D215 -> 20 | G215: 10 | H215: 7 | I215: =G215*6+H215 -> 67 | K215: 19 | L215: 10 | M215: =K215*6+L215 -> 124 | O215: 22 | P215: 16 | Q215: =O215*6+P215 -> 148 | S215: MORDIALLOC | W215: WAVERLEY | X215: 3 | Y215: 1 | Z215: 1 | AB215: 539 | AC215: 489 | AD215: =(AB215*100)/AC215 -> 110.22494887525562 | AE215: 14
A216: NORTHCOTE | C216: 4 | D216: 3 | E216: =C216*6+D216 -> 27 | G216: 5 | H216: 5 | I216: =G216*6+H216 -> 35 | K216: 13 | L216: 6 | M216: =K216*6+L216 -> 84 | O216: 16 | P216: 12 | Q216: =O216*6+P216 -> 108 | S216: GLEESON | W216: BERWICK | X216: 3 | Y216: 2 | Z216: 0 | AB216: 668 | AC216: 615 | AD216: =(AB216*100)/AC216 -> 108.6178861788618 | AE216: 12
A217: BEST PLAYERS | S217: BLACK | W217: NORTHCOTE | X217: 2 | Y217: 3 | Z217: 0 | AB217: 464 | AC217: 494 | AD217: =(AB217*100)/AC217 -> 93.927125506072869 | AE217: 8
A218: MORDIALLOC | C218: FANNING | F218: WHITTAKER | I218: CLIFFORD | L218: DEATON | O218: WALSH | R218: NEVILLE | W218: MORDIALLOC | X218: 2 | Y218: 3 | Z218: 0 | AB218: 563 | AC218: 602 | AD218: =(AB218*100)/AC218 -> 93.521594684385377 | AE218: 8
A219: NORTHCOTE | C219: STRANGWICK | F219: MINNETT | I219: SPAGNOTO | L219: BRAIN | O219: GLOBBIN | R219: ROULSTON | W219: MOORABBIN | X219: 1 | Y219: 3 | Z219: 1 | AB219: 469 | AC219: 772 | AD219: =(AB219*100)/AC219 -> 60.751295336787564 | AE219: 6
A220: GOALKICKERS | N220: PRENTIS | W220: KILSYTH | X220: 1 | Y220: 4 | Z220: 0 | AB220: 382 | AC220: 800 | AD220: =(AB220*100)/AC220 -> 47.75 | AE220: 4
A221: MORDIALLOC | C221: NEVILLE 7 | F221: FANNING 6 | H221: BOURNE 2 | J221: DEATON | L221: KRILEST | N221: BENCRAFT | P221: SARAU | R221: McILWRAITH | U221: HERMAN | W221: SUNSHINE | X221: 0 | Y221: 5 | Z221: 0 | AB221: 404 | AC221: 839 | AD221: =(AB221*100)/AC221 -> 48.152562574493444 | AE221: 0
A222: NORTHCOTE | C222: GLOBBIN 5 | F222: MITCHELL 2 | I222: BRAIN 2 | K222: MINNETT 2 | N222: BOOTH 2 | P222: STRANGWICK | S222: EWING
A224: BERWICK | C224: 3 | D224: 6 | E224: =C224*6+D224 -> 24 | G224: 11 | H224: 9 | I224: =G224*6+H224 -> 75 | K224: 16 | L224: 12 | M224: =K224*6+L224 -> 108 | O224: 23 | P224: 14 | Q224: =O224*6+P224 -> 152 | S224: BERWICK
A225: MOORABBIN | C225: 5 | D225: 3 | E225: =C225*6+D225 -> 33 | G225: 10 | H225: 7 | I225: =G225*6+H225 -> 67 | K225: 13 | L225: 10 | M225: =K225*6+L225 -> 88 | O225: 14 | P225: 15 | Q225: =O225*6+P225 -> 99 | S225: BLAKE/TOOLONGS
A226: BEST PLAYERS
A227: BERWICK | C227: SCOTT | F227: ALLEN | I227: DILLON | L227: CROOK | N227: M JOHNSON | Q227: OWEN
A228: MOORABBIN | C228: PAPPAS | F228: STEWART | I228: ATHERTON
A229: GOALKICKERS
A230: BERWICK | C230: OWEN 7 | E230: DILLON 6 | G230: SMITH 2 | I230: ALLEN 2 | K230: VENVILLE 2 | N230: McGREAL | P230: TRIGG | R230: WARD | T230: LUXFORD
A231: MOORABBIN | C231: LETT 3 | E231: PAPPAS 3 | G231: B CATHCART 3 | J231: D CATHCART 2 | M231: MERCOULIA 2 | P231: WHITE
A233: CAULFIELD | C233: 5 | D233: 3 | E233: =C233*6+D233 -> 33 | G233: 12 | H233: 5 | I233: =G233*6+H233 -> 77 | K233: 14 | L233: 7 | M233: =K233*6+L233 -> 91 | O233: 18 | P233: 9 | Q233: =O233*6+P233 -> 117 | S233: PRINCES PARK, CAULFIELD
A234: OAKLEIGH | C234: 3 | D234: 3 | E234: =C234*6+D234 -> 21 | G234: 7 | H234: 6 | I234: =G234*6+H234 -> 48 | K234: 10 | L234: 10 | M234: =K234*6+L234 -> 70 | O234: 14 | P234: 16 | Q234: =O234*6+P234 -> 100 | S234: GROOM/WALKER
A235: BEST PLAYERS
A236: CAULFIELD | C236: EINSEDEL | F236: FARINSKI | I236: HOGAN | L236: SHERIDAN | O236: JONES | Q236: RYAN
A237: OAKLEIGH | C237: TODD | F237: ROACH | I237: HARPER | L237: MATTHEY | O237: PLUMB
A238: GOALKICKERS
A239: CAULFIELD | C239: HITCHCOCK 6 | F239: BARRY 4 | H239: McLELLAN 3 | K239: DOYLE | M239: EINSEDEL | O239: GAYFER | Q239: HOGAN | S239: JONES
A240: OAKLEIGH | C240: SUTHERLAND 3 | F240: NIXON 2 | H240: WILLIAMS 2 | K240: HARPER 2 | N240: OWEN 2 | P240: SWANN | R240: RAWLYK | T240: McDONALD
A242: WAVERLEY | C242: 5 | D242: 6 | E242: =C242*6+D242 -> 36 | G242: 10 | H242: 15 | I242: =G242*6+H242 -> 75 | K242: 15 | L242: 19 | M242: =K242*6+L242 -> 109 | O242: 19 | P242: 24 | Q242: =O242*6+P242 -> 138 | S242: WAVERLEY
A243: KILSYTH | C243: 1 | D243: 6 | E243: =C243*6+D243 -> 12 | G243: 2 | H243: 6 | I243: =G243*6+H243 -> 18 | K243: 5 | L243: 10 | M243: =K243*6+L243 -> 40 | O243: 9 | P243: 12 | Q243: =O243*6+P243 -> 66 | S243: BRADSHAW/GOLLOP
A244: BEST PLAYERS
A245: WAVERLEY | C245: CSOTI | F245: COSTELLO | I245: WILLIAMS | L245: PALOTTA | O245: VEAR | Q245: BARNES
A246: KILSYTH | C246: FRASER | F246: BASS | I246: McKINNON | L246: ROBINS | O246: DOYLE | Q246: GIBB
A247: GOALKICKERS
A248: WAVERLEY | C248: PALOTTA 5 | F248: BURKE 3 | H248: ELLIA 3 | J248: NEWBOULD 2 | M248: WILSON 2 | O248: GUERINS | Q248: ROBERTS | S248: WENBORNE | V248: WILLIAMS
A249: KILSYTH | C249: BUTCHER 3 | F249: ROBBINS 2 | I249: EDWARDS | L249: GIBB | N249: KELAND | P249: KENT
A251: BYE | C251: BRUNSWICK
A253: ROUND 6 | E253: 13TH MAY | J253: WEATHER | S253: PLAYED AT
D254: 1ST QTR | H254: 2ND QTR | L254: 3RD QTR | P254: FINAL | S254: WAVERLEY
A255: WAVERLEY | C255: 5 | D255: 7 | E255: =C255*6+D255 -> 37 | G255: 8 | H255: 9 | I255: =G255*6+H255 -> 57 | K255: 14 | L255: 15 | M255: =K255*6+L255 -> 99 | O255: 20 | P255: 19 | Q255: =O255*6+P255 -> 139 | S255: UMPIRE | X255: LADDER | AC255: ROUND | AE255: 6
A256: MORDIALLOC | C256: 3 | D256: 3 | E256: =C256*6+D256 -> 21 | G256: 9 | H256: 8 | I256: =G256*6+H256 -> 62 | K256: 11 | L256: 11 | M256: =K256*6+L256 -> 77 | O256: 17 | P256: 12 | Q256: =O256*6+P256 -> 114
A257: BEST PLAYERS | W257: TEAM | X257: W | Y257: L | Z257: D | AA257: B | AB257: FOR | AC257: AGST | AD257: % | AE257: PTS
A258: WAVERLEY
A259: MORDIALLOC | W259: BRUNSWICK | X259: 6 | Y259: 0 | Z259: 0 | AB259: 937 | AC259: 527 | AD259: =(AB259*100)/AC259 -> 177.79886148007591 | AE259: 24
A260: GOALKICKERS | W260: OAKLEIGH | X260: 5 | Y260: 1 | Z260: 0 | AB260: 957 | AC260: 455 | AD260: =(AB260*100)/AC260 -> 210.32967032967034 | AE260: 20
A261: WAVERLEY | W261: BOX HILL | X261: 5 | Y261: 1 | Z261: 0 | AB261: 829 | AC261: 459 | AD261: =(AB261*100)/AC261 -> 180.61002178649238 | AE261: 20
A262: MORDIALLOC | W262: CAULFIELD | X262: 5 | Y262: 1 | Z262: 0 | AB262: 776 | AC262: 561 | AD262: =(AB262*100)/AC262 -> 138.32442067736184 | AE262: 20
A264: MOORABBIN | C264: 8 | D264: 4 | E264: =C264*6+D264 -> 52 | G264: 13 | H264: 7 | I264: =G264*6+H264 -> 85 | K264: 19 | L264: 8 | M264: =K264*6+L264 -> 122 | O264: 22 | P264: 13 | Q264: =O264*6+P264 -> 145 | S264: BENTLEIGH | W264: WAVERLEY | X264: 4 | Y264: 1 | Z264: 1 | AB264: 678 | AC264: 603 | AD264: =(AB264*100)/AC264 -> 112.43781094527363 | AE264: 18
A265: KILSYTH | C265: 2 | D265: 3 | E265: =C265*6+D265 -> 15 | G265: 2 | H265: 5 | I265: =G265*6+H265 -> 17 | K265: 5 | L265: 8 | M265: =K265*6+L265 -> 38 | O265: 12 | P265: 11 | Q265: =O265*6+P265 -> 83 | W265: BERWICK | X265: 3 | Y265: 3 | Z265: 0 | AB265: 776 | AC265: 768 | AD265: =(AB265*100)/AC265 -> 101.04166666666667 | AE265: 12
A266: BEST PLAYERS | W266: MOORABBIN | X266: 2 | Y266: 3 | Z266: 1 | AB266: 614 | AC266: 855 | AD266: =(AB266*100)/AC266 -> 71.812865497076018 | AE266: 10
A267: MOORABBIN | W267: NORTHCOTE | X267: 2 | Y267: 4 | Z267: 0 | AB267: 571 | AC267: 603 | AD267: =(AB267*100)/AC267 -> 94.693200663349913 | AE267: 8
A268: KILSYTH | W268: MORDIALLOC | X268: 2 | Y268: 4 | Z268: 0 | AB268: 677 | AC268: 741 | AD268: =(AB268*100)/AC268 -> 91.363022941970314 | AE268: 8
A269: GOALKICKERS | W269: KILSYTH | X269: 1 | Y269: 5 | Z269: 0 | AB269: 465 | AC269: 945 | AD269: =(AB269*100)/AC269 -> 49.206349206349209 | AE269: 4
A270: MOORABBIN | W270: SUNSHINE | X270: 0 | Y270: 6 | Z270: 0 | AB270: 491 | AC270: 1101 | AD270: =(AB270*100)/AC270 -> 44.595821980018165 | AE270: 0
A271: KILSYTH
A273: OAKLEIGH | C273: 13 | D273: 7 | E273: =C273*6+D273 -> 85 | G273: 23 | H273: 10 | I273: =G273*6+H273 -> 148 | K273: 29 | L273: 16 | M273: =K273*6+L273 -> 190 | O273: 40 | P273: 22 | Q273: =O273*6+P273 -> 262 | S273: OAK
A274: SUNSHINE | C274: 2 | D274: 2 | E274: =C274*6+D274 -> 14 | G274: 6 | H274: 4 | I274: =G274*6+H274 -> 40 | K274: 9 | L274: 8 | M274: =K274*6+L274 -> 62 | O274: 13 | P274: 9 | Q274: =O274*6+P274 -> 87
A275: BEST PLAYERS
A276: OAKLEIGH
A277: SUNSHINE
A278: GOALKICKERS
A279: OAKLEIGH
A280: SUNSHINE
A282: CAULFIELD | C282: 7 | D282: 4 | E282: =C282*6+D282 -> 46 | G282: 11 | H282: 10 | I282: =G282*6+H282 -> 76 | K282: 12 | L282: 12 | M282: =K282*6+L282 -> 84 | O282: 16 | P282: 13 | Q282: =O282*6+P282 -> 109 | S282: PRINCES PARK, CAULFIELD
A283: NORTHCOTE | C283: 2 | D283: 3 | E283: =C283*6+D283 -> 15 | G283: 4 | H283: 6 | I283: =G283*6+H283 -> 30 | K283: 13 | L283: 13 | M283: =K283*6+L283 -> 91 | O283: 15 | P283: 17 | Q283: =O283*6+P283 -> 107
A284: BEST PLAYERS
A285: CAULFIELD
A286: NORTHCOTE
A287: GOALKICKERS
A288: CAULFIELD
A289: NORTHCOTE
A291: BRUNSWICK | C291: 1 | D291: 5 | E291: =C291*6+D291 -> 11 | G291: 5 | H291: 11 | I291: =G291*6+H291 -> 41 | K291: 13 | L291: 18 | M291: =K291*6+L291 -> 96 | O291: 22 | P291: 21 | Q291: =O291*6+P291 -> 153 | S291: BRUNSWICK
A292: BERWICK | C292: 5 | D292: 2 | E292: =C292*6+D292 -> 32 | G292: 11 | H292: 5 | I292: =G292*6+H292 -> 71 | K292: 11 | L292: 7 | M292: =K292*6+L292 -> 73 | O292: 16 | P292: 12 | Q292: =O292*6+P292 -> 108
A293: BEST PLAYERS
A294: BRUNSWICK
A295: BERWICK
A296: GOALKICKERS
A297: BRUNSWICK
A298: BERWICK
A300: BYE | C300: BOX HILL
A302: ROUND 7 | E302: 20TH MAY | J302: WEATHER | S302: PLAYED AT
D303: 1ST QTR | H303: 2ND QTR | L303: 3RD QTR | P303: FINAL | S303: SUNSHINE
A304: SUNSHINE | C304: 5 | D304: 3 | E304: =C304*6+D304 -> 33 | G304: 11 | H304: 8 | I304: =G304*6+H304 -> 74 | K304: 16 | L304: 16 | M304: =K304*6+L304 -> 112 | O304: 21 | P304: 19 | Q304: =O304*6+P304 -> 145 | S304: UMPIRE | X304: LADDER | AC304: ROUND | AE304: 7
A305: NORTHCOTE | C305: 4 | D305: 9 | E305: =C305*6+D305 -> 33 | G305: 10 | H305: 14 | I305: =G305*6+H305 -> 74 | K305: 14 | L305: 17 | M305: =K305*6+L305 -> 101 | O305: 20 | P305: 19 | Q305: =O305*6+P305 -> 139
A306: BEST PLAYERS | W306: TEAM | X306: W | Y306: L | Z306: D | AA306: B | AB306: FOR | AC306: AGST | AD306: % | AE306: PTS
A307: SUNSHINE
A308: NORTHCOTE | W308: BRUNSWICK | X308: 7 | Y308: 0 | Z308: 0 | AB308: 1151 | AC308: 589 | AD308: =(AB308*100)/AC308 -> 195.41595925297113 | AE308: 28
A309: GOALKICKERS | W309: BOX HILL | X309: 6 | Y309: 1 | Z309: 0 | AB309: 953 | AC309: 556 | AD309: =(AB309*100)/AC309 -> 171.40287769784172 | AE309: 24
A310: SUNSHINE | W310: CAULFIELD | X310: 6 | Y310: 1 | Z310: 0 | AB310: 930 | AC310: 634 | AD310: =(AB310*100)/AC310 -> 146.68769716088329 | AE310: 24
A311: NORTHCOTE | W311: OAKLEIGH | X311: 5 | Y311: 2 | Z311: 0 | AB311: 1054 | AC311: 579 | AD311: =(AB311*100)/AC311 -> 182.03799654576858 | AE311: 20
A313: BRUNSWICK | C313: 9 | D313: 5 | E313: =C313*6+D313 -> 59 | G313: 18 | H313: 11 | I313: =G313*6+H313 -> 119 | K313: 28 | L313: 16 | M313: =K313*6+L313 -> 184 | O313: 32 | P313: 22 | Q313: =O313*6+P313 -> 214 | S313: BRUNSWICK | W313: WAVERLEY | X313: 4 | Y313: 2 | Z313: 1 | AB313: 751 | AC313: 757 | AD313: =(AB313*100)/AC313 -> 99.207397622192872 | AE313: 18
A314: KILSYTH | C314: 2 | D314: 2 | E314: =C314*6+D314 -> 14 | G314: 5 | H314: 5 | I314: =G314*6+H314 -> 35 | K314: 6 | L314: 7 | M314: =K314*6+L314 -> 43 | O314: 8 | P314: 14 | Q314: =O314*6+P314 -> 62 | W314: BERWICK | X314: 4 | Y314: 3 | Z314: 0 | AB314: 776 | AC314: 768 | AD314: =(AB314*100)/AC314 -> 101.04166666666667 | AE314: 16
A315: BEST PLAYERS | W315: MORDIALLOC | X315: 3 | Y315: 4 | Z315: 0 | AB315: 803 | AC315: 837 | AD315: =(AB315*100)/AC315 -> 95.937873357228199 | AE315: 12
A316: BRUNSWICK | W316: MOORABBIN | X316: 2 | Y316: 4 | Z316: 1 | AB316: 710 | AC316: 981 | AD316: =(AB316*100)/AC316 -> 72.375127420998979 | AE316: 10
A317: KILSYTH | W317: NORTHCOTE | X317: 2 | Y317: 5 | Z317: 0 | AB317: 710 | AC317: 748 | AD317: =(AB317*100)/AC317 -> 94.919786096256686 | AE317: 8
A318: GOALKICKERS | W318: SUNSHINE | X318: 1 | Y318: 6 | Z318: 0 | AB318: 636 | AC318: 1240 | AD318: =(AB318*100)/AC318 -> 51.29032258064516 | AE318: 4
A319: BRUNSWICK | W319: KILSYTH | X319: 1 | Y319: 6 | Z319: 0 | AB319: 527 | AC319: 1159 | AD319: =(AB319*100)/AC319 -> 45.470232959447799 | AE319: 4
A320: KILSYTH
A322: CAULFIELD | C322: 4 | D322: 7 | E322: =C322*6+D322 -> 31 | G322: 11 | H322: 8 | I322: =G322*6+H322 -> 74 | K322: 16 | L322: 11 | M322: =K322*6+L322 -> 107 | O322: 23 | P322: 16 | Q322: =O322*6+P322 -> 154 | S322: PRINCES PARK, CAULFIELD
A323: WAVERLEY | C323: 2 | D323: 8 | E323: =C323*6+D323 -> 20 | G323: 3 | H323: 12 | I323: =G323*6+H323 -> 30 | K323: 4 | L323: 17 | M323: =K323*6+L323 -> 41 | O323: 9 | P323: 19 | Q323: =O323*6+P323 -> 73
A324: BEST PLAYERS
A325: BRUNSWICK
A326: SUNSHINE
A327: GOALKICKERS
A328: BRUNSWICK
A329: SUNSHINE
A331: MORDIALLOC | C331: 5 | D331: 2 | E331: =C331*6+D331 -> 32 | G331: 13 | H331: 2 | I331: =G331*6+H331 -> 80 | K331: 15 | L331: 3 | M331: =K331*6+L331 -> 93 | O331: 20 | P331: 6 | Q331: =O331*6+P331 -> 126 | S331: MORDIALLOC
A332: MOORABBIN | C332: 4 | D332: 3 | E332: =C332*6+D332 -> 27 | G332: 7 | H332: 7 | I332: =G332*6+H332 -> 49 | K332: 11 | L332: 9 | M332: =K332*6+L332 -> 75 | O332: 14 | P332: 12 | Q332: =O332*6+P332 -> 96
A333: BEST PLAYERS
A334: MORDIALLOC
A335: MOORABBIN
A336: GOALKICKERS
A337: MORDIALLOC
A338: MOORABBIN
A340: BOX HILL | C340: 4 | D340: 5 | E340: =C340*6+D340 -> 29 | G340: 8 | H340: 12 | I340: =G340*6+H340 -> 60 | K340: 13 | L340: 14 | M340: =K340*6+L340 -> 92 | O340: 17 | P340: 22 | Q340: =O340*6+P340 -> 124 | S340: BOX HILL
A341: OAKLEIGH | C341: 4 | D341: 3 | E341: =C341*6+D341 -> 27 | G341: 6 | H341: 8 | I341: =G341*6+H341 -> 44 | K341: 10 | L341: 12 | M341: =K341*6+L341 -> 72 | O341: 14 | P341: 13 | Q341: =O341*6+P341 -> 97
A342: BEST PLAYERS
A343: BOX HILL
A344: OAKLEIGH
A345: GOALKICKERS
A346: BOX HILL
A347: OAKLEIGH
A349: BYE | C349: BERWICK
A351: ROUND 8 | E351: 3RD JUNE | J351: WEATHER | S351: PLAYED AT
D352: 1ST QTR | H352: 2ND QTR | L352: 3RD QTR | P352: FINAL | S352: OAKLEIGH
A353: OAKLEIGH | C353: 5 | D353: 4 | E353: =C353*6+D353 -> 34 | G353: 7 | H353: 6 | I353: =G353*6+H353 -> 48 | K353: 14 | L353: 7 | M353: =K353*6+L353 -> 91 | O353: 21 | P353: 11 | Q353: =O353*6+P353 -> 137 | S353: UMPIRE | X353: LADDER | AC353: ROUND | AE353: 8
A354: NORTHCOTE | C354: 4 | D354: 1 | E354: =C354*6+D354 -> 25 | G354: 9 | H354: 5 | I354: =G354*6+H354 -> 59 | K354: 13 | L354: 11 | M354: =K354*6+L354 -> 89 | O354: 15 | P354: 14 | Q354: =O354*6+P354 -> 104 | S354: BREWER/CASEY
A355: BEST PLAYERS | W355: TEAM | X355: W | Y355: L | Z355: D | AA355: B | AB355: FOR | AC355: AGST | AD355: % | AE355: PTS
A356: OAKLEIGH | C356: MATTHEY | F356: LAURITZ | I356: HARPER | L356: PRETTO | O356: BROWN | R356: S ROACH
A357: NORTHCOTE | C357: JOHN CHRISTOU | F357: F COURTS | I357: STRANGWICK | L357: ROULSTON | O357: JIM CHRISTOU | R357: PANARI | W357: BRUNSWICK | X357: 8 | Y357: 0 | Z357: 0 | AB357: 1350 | AC357: 690 | AD357: =(AB357*100)/AC357 -> 195.65217391304347 | AE357: 32
A358: GOALKICKERS | L358: S ROACH | N358: CARTER | Q358: PLUMB | W358: BOX HILL | X358: 7 | Y358: 1 | Z358: 0 | AB358: 1112 | AC358: 682 | AD358: =(AB358*100)/AC358 -> 163.04985337243403 | AE358: 28
A359: OAKLEIGH | C359: PRETTO 6 | F359: M ROACH 3 | I359: SAMIOS 2 | K359: HARPER 2 | N359: OWEN 2 | P359: SUTHERLAND 2 | S359: BROWN | W359: CAULFIELD | X359: 7 | Y359: 1 | Z359: 0 | AB359: 1083 | AC359: 759 | AD359: =(AB359*100)/AC359 -> 142.68774703557312 | AE359: 28
A360: NORTHCOTE | C360: STRANGWICK 6 | F360: EWING 3 | H360: JIM CHRISTOU 2 | K360: BRAIN 2 | M360: MEGNA | O360: J COURTS | W360: OAKLEIGH | X360: 6 | Y360: 2 | Z360: 0 | AB360: 1191 | AC360: 683 | AD360: =(AB360*100)/AC360 -> 174.37774524158127 | AE360: 24
A362: BRUNSWICK | C362: 5 | D362: 7 | E362: =C362*6+D362 -> 37 | G362: 13 | H362: 11 | I362: =G362*6+H362 -> 89 | K362: 22 | L362: 16 | M362: =K362*6+L362 -> 148 | O362: 30 | P362: 19 | Q362: =O362*6+P362 -> 199 | S362: BRUNSWICK | W362: WAVERLEY | X362: 5 | Y362: 2 | Z362: 1 | AB362: 934 | AC362: 852 | AD362: =(AB362*100)/AC362 -> 109.6244131455399 | AE362: 22
A363: MORDIALLOC | C363: 5 | D363: 3 | E363: =C363*6+D363 -> 33 | G363: 11 | H363: 6 | I363: =G363*6+H363 -> 72 | K363: 13 | L363: 12 | M363: =K363*6+L363 -> 90 | O363: 14 | P363: 17 | Q363: =O363*6+P363 -> 101 | S363: BRADSHAW | W363: BERWICK | X363: 4 | Y363: 4 | Z363: 0 | AB363: 902 | AC363: 917 | AD363: =(AB363*100)/AC363 -> 98.364231188658664 | AE363: 16
A364: BEST PLAYERS | S364: MIHENZ | W364: MORDIALLOC | X364: 3 | Y364: 5 | Z364: 0 | AB364: 904 | AC364: 1036 | AD364: =(AB364*100)/AC364 -> 87.25868725868726 | AE364: 12
A365: BRUNSWICK | C365: TOY | E365: LEAHY | H365: CALLANDER | K365: BAKER | N365: EDWARDS | Q365: ROBERTSON | W365: MOORABBIN | X365: 2 | Y365: 5 | Z365: 1 | AB365: 835 | AC365: 1134 | AD365: =(AB365*100)/AC365 -> 73.633156966490304 | AE365: 10
A366: MORDIALLOC | C366: BROMLEY | E366: NORMAN | H366: WALSH | K366: CLIFFORD | N366: DE MUNK | Q366: MACE | W366: NORTHCOTE | X366: 2 | Y366: 6 | Z366: 0 | AB366: 814 | AC366: 885 | AD366: =(AB366*100)/AC366 -> 91.977401129943502 | AE366: 8
A367: GOALKICKERS | K367: GIBSON | M367: HICKMAN | P367: ROBERTSON | W367: KILSYTH | X367: 2 | Y367: 6 | Z367: 0 | AB367: 527 | AC367: 1159 | AD367: =(AB367*100)/AC367 -> 45.470232959447799 | AE367: 8
A368: BRUNSWICK | C368: CALLANDER 5 | F368: FLOWER 5 | H368: SAHLBERG 5 | K368: LAWSON 4 | N368: EDWARDS 3 | Q368: LEAHY 3 | S368: WHILLAS 2 | W368: SUNSHINE | X368: 1 | Y368: 7 | Z368: 0 | AB368: 731 | AC368: 1423 | AD368: =(AB368*100)/AC368 -> 51.370344342937457 | AE368: 4
A369: MORDIALLOC | C369: NORMAN 7 | F369: DE MUNK 3 | I369: BROMLEY 3 | L369: ROGERSON
A371: WAVERLEY | C371: 9 | D371: 1 | E371: =C371*6+D371 -> 55 | G371: 14 | H371: 4 | I371: =G371*6+H371 -> 88 | K371: 21 | L371: 8 | M371: =K371*6+L371 -> 134 | O371: 28 | P371: 15 | Q371: =O371*6+P371 -> 183 | S371: WAVERLEY
A372: SUNSHINE | C372: 9 | D372: 3 | E372: =C372*6+D372 -> 57 | G372: 10 | H372: 6 | I372: =G372*6+H372 -> 66 | K372: 13 | L372: 10 | M372: =K372*6+L372 -> 88 | O372: 14 | P372: 11 | Q372: =O372*6+P372 -> 95 | S372: TOOLONGS/GLEESON
A373: BEST PLAYERS
A374: WAVERLEY | C374: WILLIAMS | F374: KINNABURGH | I374: MURRAY | L374: VEAR | O374: COSTELLO | R374: ZAKARIN
A375: SUNSHINE | C375: HILL | F375: WHELAN | I375: WILLIAMS | L375: WHITNEY | O375: GORE | R375: KENNEDY
A376: GOALKICKERS
A377: WAVERLEY | C377: ZAKARIN 9 | F377: VEAR 6 | H377: WILLIAMS 3 | K377: FISHER 2 | M377: WENBORNE 2 | P377: HOWELL 2 | S377: BURCH | U377: GUERENS | W377: KINNABURGH | X377: WARBURTON
A378: SUNSHINE | C378: WILLIAMS 4 | F378: WHITNEY 4 | I378: AXON 2 | K378: CATTANACH | N378: BELL | P378: JOHNSTONE | S378: COOKE
A380: BOX HILL | C380: 7 | D380: 4 | E380: =C380*6+D380 -> 46 | G380: 16 | H380: 5 | I380: =G380*6+H380 -> 101 | K380: 21 | L380: 7 | M380: =K380*6+L380 -> 133 | O380: 23 | P380: 11 | Q380: =O380*6+P380 -> 149 | S380: BOX HILL
A381: BERWICK | C381: 3 | D381: 1 | E381: =C381*6+D381 -> 19 | G381: 7 | H381: 1 | I381: =G381*6+H381 -> 43 | K381: 13 | L381: 4 | M381: =K381*6+L381 -> 82 | O381: 20 | P381: 6 | Q381: =O381*6+P381 -> 126 | S381: MORGAN/GOLLOP
A382: BEST PLAYERS
A383: BOX HILL | C383: TEAKEL | F383: GLEESON | I383: TOVEY | L383: CARROLL | O383: JOHNSON | R383: S WITNISH
A384: BERWICK | C384: WARD | F384: G SCOTT | I384: M JOHNSON | L384: LUXFORD | O384: CROOK
A385: GOALKICKERS
A386: BOX HILL | C386: CARROLL 9 | F386: TEAKEL 4 | H386: HEDGER 3 | J386: DICKENSON 2 | M386: S WITNISH 2 | P386: NICHOLSON | S386: SCHADE | U386: GLEESON
A387: BERWICK | C387: LUXFORD 6 | F387: TRIGG 4 | H387: CROOK 3 | J387: OWEN 3 | L387: WARD 2 | N387: CREBBIN | P387: SCOTT
A389: CAULFIELD | C389: 7 | D389: 4 | E389: =C389*6+D389 -> 46 | G389: 14 | H389: 10 | I389: =G389*6+H389 -> 94 | K389: 18 | L389: 14 | M389: =K389*6+L389 -> 122 | O389: 23 | P389: 15 | Q389: =O389*6+P389 -> 153 | S389: PRINCES PARK, CAULFIELD
A390: MOORABBIN | C390: 4 | D390: 4 | E390: =C390*6+D390 -> 28 | G390: 10 | H390: 8 | I390: =G390*6+H390 -> 68 | K390: 14 | L390: 12 | M390: =K390*6+L390 -> 96 | O390: 18 | P390: 17 | Q390: =O390*6+P390 -> 125 | S390: FOGARTY/OAKLEY
A391: BEST PLAYERS
A392: CAULFIELD | C392: RYAN | F392: STEWART | I392: JONES | K392: EINSEDEL | N392: BRASIER
A393: MOORABBIN | C393: B CATHCART | F393: STEWART | I393: POLLOCK | K393: PAPPAS | N393: WHITE | Q393: DIMATTINA
A394: GOALKICKERS
A395: CAULFIELD | C395: STEWART 11 | F395: DAWSON 3 | I395: HITCHCOCK 3 | L395: HOGAN 2 | N395: RYAN 2 | P395: JONES | R395: HALABI
A396: MOORABBIN | C396: B CATHCART 5 | F396: WHITE 4 | H396: LETTS 3 | J396: PAPPON 2 | L396: DIMATTINA | O396: STEWART | R396: ALAGIOZIDIS | U396: O'TOOLE
A398: BYE | C398: KILSYTH
A400: ROUND 9 | E400: 10TH JUNE | J400: WEATHER | S400: PLAYED AT
D401: 1ST QTR | H401: 2ND QTR | L401: 3RD QTR | P401: FINAL | S401: BERWICK
A402: BERWICK | C402: 11 | D402: 6 | E402: =C402*6+D402 -> 72 | G402: 14 | H402: 8 | I402: =G402*6+H402 -> 92 | K402: 23 | L402: 12 | M402: =K402*6+L402 -> 150 | O402: 31 | P402: 15 | Q402: =O402*6+P402 -> 201 | S402: UMPIRE | X402: LADDER | AC402: ROUND | AE402: 9
A403: KILSYTH | C403: 1 | D403: 1 | E403: =C403*6+D403 -> 7 | G403: 7 | H403: 8 | I403: =G403*6+H403 -> 50 | K403: 10 | L403: 11 | M403: =K403*6+L403 -> 71 | O403: 12 | P403: 15 | Q403: =O403*6+P403 -> 87
A404: BEST PLAYERS | W404: TEAM | X404: W | Y404: L | Z404: D | AA404: B | AB404: FOR | AC404: AGST | AD404: % | AE404: PTS
A405: BERWICK
A406: KILSYTH | W406: BRUNSWICK | X406: 8 | Y406: 0 | Z406: 1 | AB406: 1452 | AC406: 792 | AD406: =(AB406*100)/AC406 -> 183.33333333333334 | AE406: 34
A407: GOALKICKERS | W407: BOX HILL | X407: 8 | Y407: 1 | Z407: 0 | AB407: 1349 | AC407: 738 | AD407: =(AB407*100)/AC407 -> 182.79132791327913 | AE407: 32
A408: BERWICK | W408: CAULFIELD | X408: 7 | Y408: 1 | Z408: 1 | AB408: 1185 | AC408: 861 | AD408: =(AB408*100)/AC408 -> 137.63066202090593 | AE408: 30
A409: KILSYTH | W409: OAKLEIGH | X409: 7 | Y409: 2 | Z409: 0 | AB409: 1327 | AC409: 752 | AD409: =(AB409*100)/AC409 -> 176.46276595744681 | AE409: 28
A411: CAULFIELD | C411: 3 | D411: 2 | E411: =C411*6+D411 -> 20 | G411: 8 | H411: 7 | I411: =G411*6+H411 -> 55 | K411: 11 | L411: 11 | M411: =K411*6+L411 -> 77 | O411: 15 | P411: 12 | Q411: =O411*6+P411 -> 102 | S411: PRINCES PARK, CAULFIELD | W411: WAVERLEY | X411: 5 | Y411: 3 | Z411: 1 | AB411: 1003 | AC411: 988 | AD411: =(AB411*100)/AC411 -> 101.51821862348179 | AE411: 22
A412: BRUNSWICK | C412: 7 | D412: 4 | E412: =C412*6+D412 -> 46 | G412: 11 | H412: 5 | I412: =G412*6+H412 -> 71 | K412: 12 | L412: 10 | M412: =K412*6+L412 -> 82 | O412: 15 | P412: 12 | Q412: =O412*6+P412 -> 102 | W412: BERWICK | X412: 5 | Y412: 4 | Z412: 0 | AB412: 1103 | AC412: 1004 | AD412: =(AB412*100)/AC412 -> 109.86055776892431 | AE412: 20
A413: BEST PLAYERS | W413: MORDIALLOC | X413: 4 | Y413: 5 | Z413: 0 | AB413: 904 | AC413: 1036 | AD413: =(AB413*100)/AC413 -> 87.25868725868726 | AE413: 16
A414: CAULFIELD | W414: MOORABBIN | X414: 3 | Y414: 5 | Z414: 1 | AB414: 996 | AC414: 1201 | AD414: =(AB414*100)/AC414 -> 82.930890924229814 | AE414: 14
A415: BRUNSWICK | W415: NORTHCOTE | X415: 2 | Y415: 7 | Z415: 0 | AB415: 870 | AC415: 1122 | AD415: =(AB415*100)/AC415 -> 77.540106951871664 | AE415: 8
A416: GOALKICKERS | W416: KILSYTH | X416: 2 | Y416: 7 | Z416: 0 | AB416: 614 | AC416: 1360 | AD416: =(AB416*100)/AC416 -> 45.147058823529413 | AE416: 8
A417: CAULFIELD | W417: SUNSHINE | X417: 1 | Y417: 8 | Z417: 0 | AB417: 798 | AC417: 1584 | AD417: =(AB417*100)/AC417 -> 50.378787878787875 | AE417: 4
A418: BRUNSWICK
A420: OAKLEIGH | C420: 5 | D420: 0 | E420: =C420*6+D420 -> 30 | G420: 7 | H420: 4 | I420: =G420*6+H420 -> 46 | K420: 13 | L420: 10 | M420: =K420*6+L420 -> 88 | O420: 20 | P420: 16 | Q420: =O420*6+P420 -> 136 | S420: OAKLEIGH
A421: WAVERLEY | C421: 2 | D421: 5 | E421: =C421*6+D421 -> 17 | G421: 4 | H421: 10 | I421: =G421*6+H421 -> 34 | K421: 5 | L421: 16 | M421: =K421*6+L421 -> 46 | O421: 8 | P421: 21 | Q421: =O421*6+P421 -> 69
A422: BEST PLAYERS
A423: OAKLEIGH
A424: WAVERLEY
A425: GOALKICKERS
A426: OAKLEIGH
A427: WAVERLEY
A429: BOX HILL | C429: 8 | D429: 4 | E429: =C429*6+D429 -> 52 | G429: 19 | H429: 12 | I429: =G429*6+H429 -> 126 | K429: 27 | L429: 16 | M429: =K429*6+L429 -> 178 | O429: 36 | P429: 21 | Q429: =O429*6+P429 -> 237 | S429: BOX HILL
A430: NORTHCOTE | C430: 2 | D430: 2 | E430: =C430*6+D430 -> 14 | G430: 4 | H430: 4 | I430: =G430*6+H430 -> 28 | K430: 5 | L430: 7 | M430: =K430*6+L430 -> 37 | O430: 8 | P430: 8 | Q430: =O430*6+P430 -> 56
A431: BEST PLAYERS
A432: BOX HILL
A433: NORTHCOTE
A434: GOALKICKERS
A435: BOX HILL
A436: NORTHCOTE
A438: MOORABBIN | C438: 9 | D438: 3 | E438: =C438*6+D438 -> 57 | G438: 11 | H438: 7 | I438: =G438*6+H438 -> 73 | K438: 21 | L438: 12 | M438: =K438*6+L438 -> 138 | O438: 24 | P438: 17 | Q438: =O438*6+P438 -> 161 | S438: BENTLEIGH
A439: SUNSHINE | C439: 0 | D439: 5 | E439: =C439*6+D439 -> 5 | G439: 6 | H439: 10 | I439: =G439*6+H439 -> 46 | K439: 8 | L439: 12 | M439: =K439*6+L439 -> 60 | O439: 9 | P439: 13 | Q439: =O439*6+P439 -> 67
A440: BEST PLAYERS
A441: MOORABBIN
A442: SUNSHINE
A443: GOALKICKERS
A444: MOORABBIN
A445: SUNSHINE
A447: BYE | C447: MORDIALLOC
A449: ROUND 10 | E449: 17TH JUNE | J449: WEATHER | S449: PLAYED AT
D450: 1ST QTR | H450: 2ND QTR | L450: 3RD QTR | P450: FINAL | S450: BENTLEIGH
A451: MOORABBIN | C451: 8 | D451: 3 | E451: =C451*6+D451 -> 51 | G451: 12 | H451: 10 | I451: =G451*6+H451 -> 82 | K451: 16 | L451: 17 | M451: =K451*6+L451 -> 113 | O451: 20 | P451: 21 | Q451: =O451*6+P451 -> 141 | S451: UMPIRE | X451: LADDER | AC451: ROUND | AE451: 10
A452: OAKLEIGH | C452: 2 | D452: 3 | E452: =C452*6+D452 -> 15 | G452: 10 | H452: 6 | I452: =G452*6+H452 -> 66 | K452: 14 | L452: 8 | M452: =K452*6+L452 -> 92 | O452: 20 | P452: 9 | Q452: =O452*6+P452 -> 129
A453: BEST PLAYERS | W453: TEAM | X453: W | Y453: L | Z453: D | AA453: B | AB453: FOR | AC453: AGST | AD453: % | AE453: PTS
A454: MOORABBIN
A455: OAKLEIGH | W455: BRUNSWICK | X455: 9 | Y455: 0 | Z455: 1 | AB455: 1655 | AC455: 867 | AD455: =(AB455*100)/AC455 -> 190.88811995386391 | AE455: 38
A456: GOALKICKERS | W456: BOX HILL | X456: 9 | Y456: 1 | Z456: 0 | AB456: 1582 | AC456: 818 | AD456: =(AB456*100)/AC456 -> 193.39853300733498 | AE456: 36
A457: MOORABBIN | W457: CAULFIELD | X457: 8 | Y457: 1 | Z457: 1 | AB457: 1185 | AC457: 861 | AD457: =(AB457*100)/AC457 -> 137.63066202090593 | AE457: 34
A458: OAKLEIGH | W458: OAKLEIGH | X458: 7 | Y458: 3 | Z458: 0 | AB458: 1456 | AC458: 893 | AD458: =(AB458*100)/AC458 -> 163.04591265397536 | AE458: 28
A460: WAVERLEY | C460: 3 | D460: 5 | E460: =C460*6+D460 -> 23 | G460: 15 | H460: 6 | I460: =G460*6+H460 -> 96 | K460: 22 | L460: 10 | M460: =K460*6+L460 -> 142 | O460: 30 | P460: 14 | Q460: =O460*6+P460 -> 194 | S460: WAVERLEY | W460: WAVERLEY | X460: 6 | Y460: 3 | Z460: 1 | AB460: 1197 | AC460: 1050 | AD460: =(AB460*100)/AC460 -> 114 | AE460: 26
A461: NORTHCOTE | C461: 3 | D461: 4 | E461: =C461*6+D461 -> 22 | G461: 4 | H461: 4 | I461: =G461*6+H461 -> 28 | K461: 5 | L461: 7 | M461: =K461*6+L461 -> 37 | O461: 9 | P461: 8 | Q461: =O461*6+P461 -> 62 | W461: BERWICK | X461: 6 | Y461: 4 | Z461: 0 | AB461: 1256 | AC461: 1115 | AD461: =(AB461*100)/AC461 -> 112.64573991031391 | AE461: 24
A462: BEST PLAYERS | W462: MOORABBIN | X462: 4 | Y462: 5 | Z462: 1 | AB462: 1137 | AC462: 1330 | AD462: =(AB462*100)/AC462 -> 85.488721804511272 | AE462: 18
A463: WAVERLEY | W463: MORDIALLOC | X463: 4 | Y463: 6 | Z463: 0 | AB463: 1015 | AC463: 1189 | AD463: =(AB463*100)/AC463 -> 85.365853658536579 | AE463: 16
A464: NORTHCOTE | W464: NORTHCOTE | X464: 2 | Y464: 8 | Z464: 0 | AB464: 932 | AC464: 1316 | AD464: =(AB464*100)/AC464 -> 70.820668693009125 | AE464: 8
A465: GOALKICKERS | W465: KILSYTH | X465: 2 | Y465: 8 | Z465: 0 | AB465: 694 | AC465: 1593 | AD465: =(AB465*100)/AC465 -> 43.565599497802886 | AE465: 8
A466: WAVERLEY | W466: SUNSHINE | X466: 1 | Y466: 9 | Z466: 0 | AB466: 873 | AC466: 1787 | AD466: =(AB466*100)/AC466 -> 48.85282596530498 | AE466: 4
A467: NORTHCOTE
A469: BOX HILL | C469: 10 | D469: 4 | E469: =C469*6+D469 -> 64 | G469: 17 | H469: 6 | I469: =G469*6+H469 -> 108 | K469: 26 | L469: 11 | M469: =K469*6+L469 -> 167 | O469: 36 | P469: 17 | Q469: =O469*6+P469 -> 233 | S469: BOX HILL
A470: KILSYTH | C470: 2 | D470: 3 | E470: =C470*6+D470 -> 15 | G470: 5 | H470: 5 | I470: =G470*6+H470 -> 35 | K470: 5 | L470: 7 | M470: =K470*6+L470 -> 37 | O470: 12 | P470: 8 | Q470: =O470*6+P470 -> 80
A471: BEST PLAYERS
A472: BOX HILL
A473: KILSYTH
A474: GOALKICKERS
A475: BOX HILL
A476: KILSYTH
A478: BERWICK | C478: 6 | D478: 4 | E478: =C478*6+D478 -> 40 | G478: 14 | H478: 8 | I478: =G478*6+H478 -> 92 | K478: 20 | L478: 11 | M478: =K478*6+L478 -> 131 | O478: 23 | P478: 15 | Q478: =O478*6+P478 -> 153 | S478: BERWICK
A479: MORDIALLOC | C479: 7 | D479: 1 | E479: =C479*6+D479 -> 43 | G479: 10 | H479: 3 | I479: =G479*6+H479 -> 63 | K479: 15 | L479: 5 | M479: =K479*6+L479 -> 95 | O479: 17 | P479: 9 | Q479: =O479*6+P479 -> 111
A480: BEST PLAYERS
A481: BERWICK
A482: MORDIALLOC
A483: GOALKICKERS
A484: BERWICK
A485: MORDIALLOC
A487: BRUNSWICK | C487: 6 | D487: 7 | E487: =C487*6+D487 -> 43 | G487: 14 | H487: 18 | I487: =G487*6+H487 -> 102 | K487: 21 | L487: 21 | M487: =K487*6+L487 -> 147 | O487: 30 | P487: 23 | Q487: =O487*6+P487 -> 203 | S487: BRUNSWICK
A488: SUNSHINE | C488: 3 | D488: 2 | E488: =C488*6+D488 -> 20 | G488: 5 | H488: 5 | I488: =G488*6+H488 -> 35 | K488: 6 | L488: 8 | M488: =K488*6+L488 -> 44 | O488: 11 | P488: 9 | Q488: =O488*6+P488 -> 75
A489: BEST PLAYERS
A490: BRUNSWICK
A491: SUNSHINE
A492: GOALKICKERS
A493: BRUNSWICK
A494: SUNSHINE
A496: BYE | C496: CAULFIELD
A498: ROUND 11 | E498: 1ST JULY | J498: WEATHER | S498: PLAYED AT
D499: 1ST QTR | H499: 2ND QTR | L499: 3RD QTR | P499: FINAL | S499: BOX HILL
A500: BOX HILL | C500: 6 | D500: 3 | E500: =C500*6+D500 -> 39 | G500: 7 | H500: 8 | I500: =G500*6+H500 -> 50 | K500: 15 | L500: 18 | M500: =K500*6+L500 -> 108 | O500: 17 | P500: 22 | Q500: =O500*6+P500 -> 124 | S500: UMPIRE | X500: LADDER | AC500: ROUND | AE500: 11
A501: WAVERLEY | C501: 3 | D501: 2 | E501: =C501*6+D501 -> 20 | G501: 10 | H501: 6 | I501: =G501*6+H501 -> 66 | K501: 11 | L501: 7 | M501: =K501*6+L501 -> 73 | O501: 15 | P501: 11 | Q501: =O501*6+P501 -> 101 | S501: FITZPATRICK/WALKER
A502: BEST PLAYERS | W502: TEAM | X502: W | Y502: L | Z502: D | AA502: B | AB502: FOR | AC502: AGST | AD502: % | AE502: PTS
A503: BOX HILL | C503: R WITNISH | F503: O'SHEA | I503: S WITNISH | L503: JOHNSON | O503: GLEESON
A504: WAVERLEY | C504: CARGHILL | F504: COSTELLO | I504: WILLIAMS | L504: VEAR | O504: GREENE | Q504: ZAKARIN | W504: BOX HILL | X504: 10 | Y504: 1 | Z504: 0 | AB504: 1706 | AC504: 919 | AD504: =(AB504*100)/AC504 -> 185.63656147986941 | AE504: 40
A505: GOALKICKERS | W505: BRUNSWICK | X505: 9 | Y505: 1 | Z505: 1 | AB505: 1729 | AC505: 959 | AD505: =(AB505*100)/AC505 -> 180.29197080291971 | AE505: 38
A506: BOX HILL | C506: CARROLL 4 | F506: R WITNISH 2 | I506: TEAKEL 2 | K506: NICHOLSON 2 | N506: GLEESON 2 | P506: JOHNSON 2 | R506: O'SHEA 2 | T506: S WITNISH | W506: CAULFIELD | X506: 9 | Y506: 1 | Z506: 1 | AB506: 1295 | AC506: 967 | AD506: =(AB506*100)/AC506 -> 133.91933815925543 | AE506: 38
A507: WAVERLEY | C507: ZAKARIN 7 | F507: WILLIAMS 3 | I507: ANDERSON | L507: BARNES | N507: VEAR | P507: KINNABURGH | S507: PALOTTA | W507: OAKLEIGH | X507: 8 | Y507: 3 | Z507: 0 | AB507: 1548 | AC507: 967 | AD507: =(AB507*100)/AC507 -> 160.08273009307135 | AE507: 32
A509: OAKLEIGH | C509: 2 | D509: 6 | E509: =C509*6+D509 -> 18 | G509: 5 | H509: 11 | I509: =G509*6+H509 -> 41 | K509: 10 | L509: 13 | M509: =K509*6+L509 -> 73 | O509: 13 | P509: 14 | Q509: =O509*6+P509 -> 92 | S509: OAKLEIGH | W509: WAVERLEY | X509: 6 | Y509: 4 | Z509: 1 | AB509: 1298 | AC509: 1174 | AD509: =(AB509*100)/AC509 -> 110.56218057921636 | AE509: 26
A510: BRUNSWICK | C510: 3 | D510: 4 | E510: =C510*6+D510 -> 22 | G510: 3 | H510: 5 | I510: =G510*6+H510 -> 23 | K510: 6 | L510: 6 | M510: =K510*6+L510 -> 42 | O510: 10 | P510: 14 | Q510: =O510*6+P510 -> 74 | S510: BREWER | W510: BERWICK | X510: 6 | Y510: 5 | Z510: 0 | AB510: 1362 | AC510: 1225 | AD510: =(AB510*100)/AC510 -> 111.18367346938776 | AE510: 24
A511: BEST PLAYERS | S511: MARSHALL | W511: MOORABBIN | X511: 5 | Y511: 5 | Z511: 1 | AB511: 1262 | AC511: 1419 | AD511: =(AB511*100)/AC511 -> 88.935870331219164 | AE511: 22
A512: OAKLEIGH | C512: BATTERSBY | F512: WALSH | I512: S ROACH | L512: PLUMB | O512: HARPER | R512: BROWN | W512: MORDIALLOC | X512: 5 | Y512: 6 | Z512: 0 | AB512: 1172 | AC512: 1275 | AD512: =(AB512*100)/AC512 -> 91.921568627450981 | AE512: 20
A513: BRUNSWICK | C513: McGHIE | F513: RYAN | I513: LEAHY | L513: DOYLE | O513: JAKSIC | R513: SAHLBERG | W513: NORTHCOTE | X513: 2 | Y513: 9 | Z513: 0 | AB513: 1021 | AC513: 1441 | AD513: =(AB513*100)/AC513 -> 70.853573907009022 | AE513: 8
A514: GOALKICKERS | W514: SUNSHINE | X514: 2 | Y514: 9 | Z514: 0 | AB514: 873 | AC514: 1787 | AD514: =(AB514*100)/AC514 -> 48.85282596530498 | AE514: 8
A515: OAKLEIGH | C515: BROWN 3 | F515: NEARY 3 | H515: PRETTO 2 | J515: ANSELL 2 | L515: HARPER | N515: OWEN | P515: LAMBLEY | W515: KILSYTH | X515: 2 | Y515: 9 | Z515: 0 | AB515: 780 | AC515: 1750 | AD515: =(AB515*100)/AC515 -> 44.571428571428569 | AE515: 8
A516: BRUNSWICK | C516: SAHLBERG 3 | F516: SAGGERS 2 | I516: FLOWER 2 | K516: RYAN | M516: ROULSTON | P516: TOY
A518: MORDIALLOC | C518: 4 | D518: 2 | E518: =C518*6+D518 -> 26 | G518: 10 | H518: 6 | I518: =G518*6+H518 -> 66 | K518: 14 | L518: 9 | M518: =K518*6+L518 -> 93 | O518: 24 | P518: 13 | Q518: =O518*6+P518 -> 157 | S518: MORDIALLOC
A519: KILSYTH | C519: 5 | D519: 4 | E519: =C519*6+D519 -> 34 | G519: 7 | H519: 5 | I519: =G519*6+H519 -> 47 | K519: 11 | L519: 13 | M519: =K519*6+L519 -> 79 | O519: 12 | P519: 14 | Q519: =O519*6+P519 -> 86 | S519: GOLLOP/GLEESON
A520: BEST PLAYERS
A521: MORDIALLOC | C521: SARAU | F521: DEATON | I521: DAVIDSON | L521: BROMLEY | O521: BENCRAFT | R521: PRENTIS
A522: KILSYTH | C522: GEORGE | F522: GIBB | I522: McKINNON | L522: DOYLE | O522: McGINTY | R522: HORVARTH
A523: GOALKICKERS
A524: MORDIALLOC | C524: DEATON 4 | F524: AUGUSTINSKI 3 | I524: ROGERSON 3 | K524: ELMER 3 | M524: BENCRAFT 3 | O524: PADULA 2 | R524: KERIN 2 | T524: HANDLEY | W524: PRENTIS | X524: SERENA | AA524: DIXON
A525: KILSYTH | C525: PRICE 4 | E525: REPALUST 3 | H525: KENT 2 | J525: GIBB | L525: DOYLE | N525: MUIR
A527: CAULFIELD | C527: 6 | D527: 3 | E527: =C527*6+D527 -> 39 | G527: 9 | H527: 4 | I527: =G527*6+H527 -> 58 | K527: 13 | L527: 5 | M527: =K527*6+L527 -> 83 | O527: 17 | P527: 8 | Q527: =O527*6+P527 -> 110 | S527: PRINCES PARK, CAULFIELD
A528: BERWICK | C528: 4 | D528: 4 | E528: =C528*6+D528 -> 28 | G528: 7 | H528: 6 | I528: =G528*6+H528 -> 48 | K528: 12 | L528: 10 | M528: =K528*6+L528 -> 82 | O528: 15 | P528: 16 | Q528: =O528*6+P528 -> 106 | S528: BLACK/BRADSHAW
A529: BEST PLAYERS
A530: CAULFIELD | C530: FARINSKI | F530: DOYLE | I530: GAYFER | L530: DAWSON | N530: MOON
A531: BERWICK | C531: JOHNSON | F531: WARD | I531: CREBBIN | L531: POWLES | N531: ORSBORN
A532: GOALKICKERS
A533: CAULFIELD | C533: MOON 5 | E533: REID 3 | G533: HOGAN 2 | I533: JENKINS 2 | K533: BARRY | M533: DAWSON | O533: GAYFER | Q533: MADDAFERI | T533: PEARCE
A534: BERWICK | C534: OWEN 6 | E534: TRIGG 3 | G534: DILLON 2 | I534: ORSBORN | K534: VENVILLE | M534: CROOK | O534: ALLEN
A536: MOORABBIN | C536: 3 | D536: 0 | E536: =C536*6+D536 -> 18 | G536: 10 | H536: 5 | I536: =G536*6+H536 -> 65 | K536: 12 | L536: 9 | M536: =K536*6+L536 -> 81 | O536: 19 | P536: 11 | Q536: =O536*6+P536 -> 125 | S536: BENTLEIGH
A537: NORTHCOTE | C537: 4 | D537: 6 | E537: =C537*6+D537 -> 30 | G537: 7 | H537: 8 | I537: =G537*6+H537 -> 50 | K537: 10 | L537: 9 | M537: =K537*6+L537 -> 69 | O537: 13 | P537: 11 | Q537: =O537*6+P537 -> 89 | S537: GLEESON/McCARTHY
A538: BEST PLAYERS
A539: MOORABBIN | C539: MERCOULIA | F539: STEWART | I539: B CATHCART | L539: MARSHALL | O539: POLLOCK | R539: PAPPON
A540: NORTHCOTE | C540: JOHN CHRISTOU | F540: ADAMSON | I540: BOOTH | L540: MEGNA | O540: SANDERS | R540: JIM CHRISTOU
A541: GOALKICKERS
A542: MOORABBIN | C542: B CATHCART 7 | F542: BARBER 5 | I542: ATHERTON 5 | L542: LETT | N542: POLLOCK
A543: NORTHCOTE | C543: BRAIN 3 | F543: JIM CHRISTOU 3 | J543: MEGNA 2 | L543: KRITIKOS 2 | O543: COSMA | Q543: BEATTIE | S543: STRANGWICK
A545: BYE | C545: SUNSHINE
A547: ROUND 12 | E547: 8TH JULY | J547: WEATHER | S547: PLAYED AT
D548: 1ST QTR | H548: 2ND QTR | L548: 3RD QTR | P548: FINAL | S548: WAVERLEY
A549: WAVERLEY | C549: 5 | D549: 5 | E549: =C549*6+D549 -> 35 | G549: 9 | H549: 13 | I549: =G549*6+H549 -> 67 | K549: 10 | L549: 14 | M549: =K549*6+L549 -> 74 | O549: 16 | P549: 18 | Q549: =O549*6+P549 -> 114 | S549: UMPIRE | X549: LADDER | AC549: ROUND | AE549: 12
A550: MOORABBIN | C550: 3 | D550: 4 | E550: =C550*6+D550 -> 22 | G550: 4 | H550: 5 | I550: =G550*6+H550 -> 29 | K550: 11 | L550: 9 | M550: =K550*6+L550 -> 75 | O550: 13 | P550: 11 | Q550: =O550*6+P550 -> 89
A551: BEST PLAYERS | W551: TEAM | X551: W | Y551: L | Z551: D | AA551: B | AB551: FOR | AC551: AGST | AD551: % | AE551: PTS
A552: WAVERLEY
A553: MOORABBIN | W553: BOX HILL | X553: 11 | Y553: 1 | Z553: 0 | AB553: 1876 | AC553: 1022 | AD553: =(AB553*100)/AC553 -> 183.56164383561645 | AE553: 44
A554: GOALKICKERS | W554: BRUNSWICK | X554: 10 | Y554: 1 | Z554: 1 | AB554: 1906 | AC554: 1025 | AD554: =(AB554*100)/AC554 -> 185.95121951219511 | AE554: 42
A555: WAVERLEY | W555: CAULFIELD | X555: 10 | Y555: 1 | Z555: 1 | AB555: 1525 | AC555: 995 | AD555: =(AB555*100)/AC555 -> 153.26633165829145 | AE555: 42
A556: MOORABBIN | W556: OAKLEIGH | X556: 9 | Y556: 3 | Z556: 0 | AB556: 1548 | AC556: 967 | AD556: =(AB556*100)/AC556 -> 160.08273009307135 | AE556: 36
A558: BRUNSWICK | C558: 7 | D558: 3 | E558: =C558*6+D558 -> 45 | G558: 12 | H558: 4 | I558: =G558*6+H558 -> 76 | K558: 16 | L558: 11 | M558: =K558*6+L558 -> 107 | O558: 27 | P558: 15 | Q558: =O558*6+P558 -> 177 | S558: NORTHCOTE | W558: WAVERLEY | X558: 7 | Y558: 4 | Z558: 1 | AB558: 1412 | AC558: 1263 | AD558: =(AB558*100)/AC558 -> 111.79730799683294 | AE558: 30
A559: NORTHCOTE | C559: 3 | D559: 2 | E559: =C559*6+D559 -> 20 | G559: 4 | H559: 7 | I559: =G559*6+H559 -> 31 | K559: 8 | L559: 11 | M559: =K559*6+L559 -> 59 | O559: 9 | P559: 12 | Q559: =O559*6+P559 -> 66 | W559: BERWICK | X559: 7 | Y559: 5 | Z559: 0 | AB559: 1571 | AC559: 1338 | AD559: =(AB559*100)/AC559 -> 117.41405082212258 | AE559: 28
A560: BEST PLAYERS | W560: MOORABBIN | X560: 5 | Y560: 6 | Z560: 1 | AB560: 1351 | AC560: 1533 | AD560: =(AB560*100)/AC560 -> 88.12785388127854 | AE560: 22
A561: BRUNSWICK | W561: MORDIALLOC | X561: 5 | Y561: 7 | Z561: 0 | AB561: 1275 | AC561: 1445 | AD561: =(AB561*100)/AC561 -> 88.235294117647058 | AE561: 20
A562: NORTHCOTE | W562: NORTHCOTE | X562: 2 | Y562: 10 | Z562: 0 | AB562: 1087 | AC562: 1618 | AD562: =(AB562*100)/AC562 -> 67.181705809641528 | AE562: 8
A563: GOALKICKERS | W563: SUNSHINE | X563: 2 | Y563: 10 | Z563: 0 | AB563: 986 | AC563: 1996 | AD563: =(AB563*100)/AC563 -> 49.398797595190381 | AE563: 8
A564: BRUNSWICK | W564: KILSYTH | X564: 2 | Y564: 10 | Z564: 0 | AB564: 808 | AC564: 1980 | AD564: =(AB564*100)/AC564 -> 40.80808080808081 | AE564: 8
A565: NORTHCOTE
A567: BERWICK | C567: 5 | D567: 6 | E567: =C567*6+D567 -> 36 | G567: 15 | H567: 10 | I567: =G567*6+H567 -> 100 | K567: 21 | L567: 14 | M567: =K567*6+L567 -> 140 | O567: 31 | P567: 23 | Q567: =O567*6+P567 -> 209 | S567: SUNSHINE
A568: SUNSHINE | C568: 4 | D568: 3 | E568: =C568*6+D568 -> 27 | G568: 7 | H568: 5 | I568: =G568*6+H568 -> 47 | K568: 13 | L568: 9 | M568: =K568*6+L568 -> 87 | O568: 17 | P568: 11 | Q568: =O568*6+P568 -> 113
A569: BEST PLAYERS
A570: BERWICK
A571: SUNSHINE
A572: GOALKICKERS
A573: BERWICK
A574: SUNSHINE
A576: CAULFIELD | C576: 5 | D576: 9 | E576: =C576*6+D576 -> 39 | G576: 15 | H576: 16 | I576: =G576*6+H576 -> 106 | K576: 25 | L576: 17 | M576: =K576*6+L576 -> 167 | O576: 34 | P576: 26 | Q576: =O576*6+P576 -> 230 | S576: PRINCES PARK, CAULFIELD
A577: KILSYTH | C577: 2 | D577: 5 | E577: =C577*6+D577 -> 17 | G577: 2 | H577: 7 | I577: =G577*6+H577 -> 19 | K577: 3 | L577: 8 | M577: =K577*6+L577 -> 26 | O577: 3 | P577: 10 | Q577: =O577*6+P577 -> 28
A578: BEST PLAYERS
A579: CAULFIELD
A580: KILSYTH
A581: GOALKICKERS
A582: CAULFIELD
A583: KILSYTH
A585: BOX HILL | C585: 5 | D585: 3 | E585: =C585*6+D585 -> 33 | G585: 10 | H585: 5 | I585: =G585*6+H585 -> 65 | K585: 16 | L585: 8 | M585: =K585*6+L585 -> 104 | O585: 26 | P585: 14 | Q585: =O585*6+P585 -> 170 | S585: BOX HILL
A586: MORDIALLOC | C586: 2 | D586: 6 | E586: =C586*6+D586 -> 18 | G586: 6 | H586: 9 | I586: =G586*6+H586 -> 45 | K586: 13 | L586: 13 | M586: =K586*6+L586 -> 91 | O586: 15 | P586: 13 | Q586: =O586*6+P586 -> 103
A587: BEST PLAYERS
A588: BOX HILL
A589: MORDIALLOC
A590: GOALKICKERS
A591: BOX HILL
A592: MORDIALLOC
A594: BYE | C594: OAKLEIGH
A596: ROUND 13 | E596: 15TH JULY | J596: WEATHER | S596: PLAYED AT
D597: 1ST QTR | H597: 2ND QTR | L597: 3RD QTR | P597: FINAL | S597: OAKLEIGH
A598: OAKLEIGH | C598: 6 | D598: 2 | E598: =C598*6+D598 -> 38 | G598: 9 | H598: 3 | I598: =G598*6+H598 -> 57 | K598: 13 | L598: 9 | M598: =K598*6+L598 -> 87 | O598: 17 | P598: 11 | Q598: =O598*6+P598 -> 113 | S598: UMPIRE | X598: LADDER | AC598: ROUND | AE598: 13
A599: BERWICK | C599: 3 | D599: 2 | E599: =C599*6+D599 -> 20 | G599: 8 | H599: 4 | I599: =G599*6+H599 -> 52 | K599: 13 | L599: 11 | M599: =K599*6+L599 -> 89 | O599: 16 | P599: 15 | Q599: =O599*6+P599 -> 111 | S599: BUDGE/MIHEVC
A600: BEST PLAYERS | W600: TEAM | X600: W | Y600: L | Z600: D | AA600: B | AB600: FOR | AC600: AGST | AD600: % | AE600: PTS
A601: OAKLEIGH | C601: TODD | F601: S ROACH | I601: BATTERSBY | L601: ALLISEY
A602: BERWICK | C602: DILLON | F602: M JOHNSON | I602: CREBBIN | L602: ALLEN | N602: SCOTT | W602: BOX HILL | X602: 12 | Y602: 1 | Z602: 0 | AB602: 2050 | AC602: 1153 | AD602: =(AB602*100)/AC602 -> 177.79705117085862 | AE602: 48
A603: GOALKICKERS | W603: CAULFIELD | X603: 11 | Y603: 1 | Z603: 1 | AB603: 1622 | AC603: 1083 | AD603: =(AB603*100)/AC603 -> 149.76915974145891 | AE603: 46
A604: OAKLEIGH | C604: PRETTO 4 | F604: OWEN 4 | H604: NEARY 3 | J604: WILLIAMS 2 | M604: BROWN | O604: RAWLYK | Q604: M ROACH | S604: SUTHERLAND | W604: BRUNSWICK | X604: 10 | Y604: 2 | Z604: 1 | AB604: 2015 | AC604: 1141 | AD604: =(AB604*100)/AC604 -> 176.59947414548643 | AE604: 42
A605: BERWICK | C605: DILLON 6 | F605: OWEN 3 | H605: ALLEN 3 | J605: VENVILLE | L605: ORSBORN | N605: TRIGG | P605: McGREAL | W605: OAKLEIGH | X605: 10 | Y605: 3 | Z605: 0 | AB605: 1661 | AC605: 1078 | AD605: =(AB605*100)/AC605 -> 154.08163265306123 | AE605: 40
A607: BOX HILL | C607: 4 | D607: 5 | E607: =C607*6+D607 -> 29 | G607: 13 | H607: 12 | I607: =G607*6+H607 -> 90 | K607: 17 | L607: 17 | M607: =K607*6+L607 -> 119 | O607: 26 | P607: 18 | Q607: =O607*6+P607 -> 174 | S607: BOX HILL | W607: WAVERLEY | X607: 8 | Y607: 4 | Z607: 1 | AB607: 1528 | AC607: 1372 | AD607: =(AB607*100)/AC607 -> 111.37026239067055 | AE607: 34
A608: MOORABBIN | C608: 5 | D608: 3 | E608: =C608*6+D608 -> 33 | G608: 9 | H608: 5 | I608: =G608*6+H608 -> 59 | K608: 15 | L608: 7 | M608: =K608*6+L608 -> 97 | O608: 20 | P608: 11 | Q608: =O608*6+P608 -> 131 | S608: MAY | W608: BERWICK | X608: 7 | Y608: 6 | Z608: 0 | AB608: 1682 | AC608: 1451 | AD608: =(AB608*100)/AC608 -> 115.92005513439008 | AE608: 28
A609: BEST PLAYERS | S609: HERMAN | W609: MOORABBIN | X609: 5 | Y609: 7 | Z609: 1 | AB609: 1482 | AC609: 1707 | AD609: =(AB609*100)/AC609 -> 86.818980667838318 | AE609: 22
A610: BOX HILL | C610: CASEY | F610: CARROLL | I610: NICHOLSON | L610: GLEESON | O610: O'SHEA | R610: CONNOLLY | W610: MORDIALLOC | X610: 5 | Y610: 8 | Z610: 0 | AB610: 1363 | AC610: 1542 | AD610: =(AB610*100)/AC610 -> 88.391699092088203 | AE610: 20
A611: MOORABBIN | C611: PAPPAS | F611: PAPPON | I611: STEWART | L611: MERCOULIA | O611: PEET | R611: MARSHALL | W611: NORTHCOTE | X611: 3 | Y611: 10 | Z611: 0 | AB611: 1087 | AC611: 1618 | AD611: =(AB611*100)/AC611 -> 67.181705809641528 | AE611: 12
A612: GOALKICKERS | M612: CONNOLLY | W612: KILSYTH | X612: 3 | Y612: 10 | Z612: 0 | AB612: 933 | AC612: 2044 | AD612: =(AB612*100)/AC612 -> 45.645792563600786 | AE612: 12
A613: BOX HILL | C613: CARROLL 9 | F613: NICHOLSON 4 | I613: TEAKEL 3 | K613: SLACIK 2 | M613: DICKENSON 2 | P613: O'SHEA 2 | R613: SCHADE 2 | T613: R WITNISH | W613: SUNSHINE | X613: 2 | Y613: 11 | Z613: 0 | AB613: 1050 | AC613: 2121 | AD613: =(AB613*100)/AC613 -> 49.504950495049506 | AE613: 8
A614: MOORABBIN | C614: BEATTIE 5 | F614: PEET 4 | H614: PAPPON 3 | J614: ATHERTON 3 | M614: McNAMARA 2 | P614: PAPPAS | R614: BARBER | T614: WHITE
A616: KILSYTH | C616: 5 | D616: 8 | E616: =C616*6+D616 -> 38 | G616: 8 | H616: 10 | I616: =G616*6+H616 -> 58 | K616: 10 | L616: 13 | M616: =K616*6+L616 -> 73 | O616: 18 | P616: 17 | Q616: =O616*6+P616 -> 125 | S616: KILSYTH
A617: SUNSHINE | C617: 2 | D617: 1 | E617: =C617*6+D617 -> 13 | G617: 3 | H617: 5 | I617: =G617*6+H617 -> 23 | K617: 6 | L617: 5 | M617: =K617*6+L617 -> 41 | O617: 9 | P617: 10 | Q617: =O617*6+P617 -> 64 | S617: BLACK/CASEY
A618: BEST PLAYERS
A619: KILSYTH | C619: ROBBINS | F619: TAYLOR | I619: HORVARTH | L619: McKINNON | O619: MUIR | Q619: GEORGE
A620: SUNSHINE | C620: WHITNEY | F620: KENNEDY | I620: J FARRUGIA | L620: B MENADUE | O620: WILLIAMS
A621: GOALKICKERS
A622: KILSYTH | C622: PRICE 5 | E622: TAYLOR 4 | G622: KENT 3 | I622: McKINNON 2 | L622: ROBBINS | N622: MATHOULIS | Q622: GIBB | R622: MUIR
A623: SUNSHINE | C623: KENNEDY 3 | F623: WHITNEY 2 | I623: PLANT 2 | K623: WILLIAMS | N623: COOKE
A625: WAVERLEY | C625: 7 | D625: 4 | E625: =C625*6+D625 -> 46 | G625: 9 | H625: 7 | I625: =G625*6+H625 -> 61 | K625: 9 | L625: 9 | M625: =K625*6+L625 -> 63 | O625: 17 | P625: 14 | Q625: =O625*6+P625 -> 116 | S625: WAVERLEY
A626: BRUNSWICK | C626: 3 | D626: 4 | E626: =C626*6+D626 -> 22 | G626: 8 | H626: 11 | I626: =G626*6+H626 -> 59 | K626: 14 | L626: 17 | M626: =K626*6+L626 -> 101 | O626: 15 | P626: 19 | Q626: =O626*6+P626 -> 109 | S626: CASEY/McCARTHY
A627: BEST PLAYERS
A628: WAVERLEY | C628: BARNES | F628: WILLIAMS | I628: INTERLIGI | L628: COSTELLO | O628: KINNABURGH | R628: GREEN
A629: BRUNSWICK | C629: LEAHY | F629: TOY | I629: WHILLAS | L629: SAHLBERG
A630: GOALKICKERS
A631: WAVERLEY | C631: EVANS 3 | E631: FISHER 3 | G631: ZAKARIN 3 | I631: BARNES 2 | K631: PALLOTTA 2 | N631: GREEN | P631: WILLIAMS | S631: McILWRAITH | V631: WENBORNE
A632: BRUNSWICK | C632: JAKSIC 3 | E632: LEAHY 3 | G632: RYAN 2 | I632: EDWARDS | L632: ROULSTON | N632: SMYTHE | P632: TOY | Q632: ROBERTSON
A634: CAULFIELD | C634: 4 | D634: 2 | E634: =C634*6+D634 -> 26 | G634: 8 | H634: 5 | I634: =G634*6+H634 -> 53 | K634: 12 | L634: 10 | M634: =K634*6+L634 -> 82 | O634: 14 | P634: 13 | Q634: =O634*6+P634 -> 97 | S634: PRINCES PARK, CAULFIELD
A635: MORDIALLOC | C635: 5 | D635: 1 | E635: =C635*6+D635 -> 31 | G635: 9 | H635: 2 | I635: =G635*6+H635 -> 56 | K635: 11 | L635: 5 | M635: =K635*6+L635 -> 71 | O635: 13 | P635: 10 | Q635: =O635*6+P635 -> 88 | S635: BREWER/WALKER
A636: BEST PLAYERS
A637: CAULFIELD | C637: SHERIDAN | F637: DAWSON | I637: EINSEDEL | L637: JONES | N637: PEART | P637: GAYFER
A638: MORDIALLOC | C638: WHITTAKER | F638: PRENTIS | I638: SUMMERIN | L638: SARAU | N638: DAVIDSON | Q638: SHEPPARD
A639: GOALKICKERS
A640: CAULFIELD | C640: JONES 3 | E640: HITCHCOCK 2 | H640: KING 2 | J640: RYAN 2 | L640: SHERIDAN 2 | N640: HALABI | P640: HOGAN | R640: JENKINS
A641: MORDIALLOC | C641: ROGERSON 3 | F641: SERENA 3 | H641: DEATON 2 | K641: BOURNE | M641: WHITTAKER | P641: BROMLEY | R641: DIXON | T641: SHEPPARD
A643: BYE | C643: NORTHCOTE
A645: ROUND 14 | E645: 22ND JULY | J645: WEATHER | S645: PLAYED AT
D646: 1ST QTR | H646: 2ND QTR | L646: 3RD QTR | P646: FINAL | S646: BENTLEIGH
A647: BRUNSWICK | C647: 3 | D647: 9 | E647: =C647*6+D647 -> 27 | G647: 7 | H647: 16 | I647: =G647*6+H647 -> 58 | K647: 13 | L647: 18 | M647: =K647*6+L647 -> 96 | O647: 14 | P647: 20 | Q647: =O647*6+P647 -> 104 | S647: UMPIRE | X647: LADDER | AC647: ROUND | AE647: 14
A648: MOORABBIN | C648: 2 | D648: 1 | E648: =C648*6+D648 -> 13 | G648: 4 | H648: 4 | I648: =G648*6+H648 -> 28 | K648: 9 | L648: 9 | M648: =K648*6+L648 -> 63 | O648: 13 | P648: 14 | Q648: =O648*6+P648 -> 92 | S648: CASEY/MIHEVC
A649: BEST PLAYERS | W649: TEAM | X649: W | Y649: L | Z649: D | AA649: B | AB649: FOR | AC649: AGST | AD649: % | AE649: PTS
A650: BRUNSWICK | C650: WHILLAS | F650: CALLANDER | I650: SAHLBERG | L650: McDONALD | O650: SCULLY | R650: BROWN
A651: MOORABBIN | C651: STEWART | F651: ATHERTON | I651: B CATHCART | L651: HALE | O651: MERCOULIA | R651: POLLOCK | W651: BOX HILL | X651: 13 | Y651: 1 | Z651: 0 | AB651: 2209 | AC651: 1228 | AD651: =(AB651*100)/AC651 -> 179.88599348534203 | AE651: 52
A652: GOALKICKERS | W652: BRUNSWICK | X652: 11 | Y652: 2 | Z652: 1 | AB652: 2119 | AC652: 1233 | AD652: =(AB652*100)/AC652 -> 171.85725871857258 | AE652: 46
A653: BRUNSWICK | C653: WHILLAS 6 | F653: PULVRENTI 2 | I653: SMYTHE 2 | K653: CALLANDER | N653: LEAHY | P653: RYAN | R653: SAHLBERG | W653: CAULFIELD | X653: 11 | Y653: 2 | Z653: 1 | AB653: 1697 | AC653: 1242 | AD653: =(AB653*100)/AC653 -> 136.63446054750403 | AE653: 46
A654: MOORABBIN | C654: ATHERTON 4 | F654: LONIE 3 | H654: WHITE 2 | J654: HALE | L654: BARBER | N654: PEET | P654: LAZZARO | W654: OAKLEIGH | X654: 11 | Y654: 3 | Z654: 0 | AB654: 1856 | AC654: 1132 | AD654: =(AB654*100)/AC654 -> 163.95759717314488 | AE654: 44
A656: BERWICK | C656: 2 | D656: 1 | E656: =C656*6+D656 -> 13 | G656: 10 | H656: 5 | I656: =G656*6+H656 -> 65 | K656: 10 | L656: 10 | M656: =K656*6+L656 -> 70 | O656: 15 | P656: 14 | Q656: =O656*6+P656 -> 104 | S656: NORTHCOTE | W656: WAVERLEY | X656: 9 | Y656: 4 | Z656: 1 | AB656: 1528 | AC656: 1372 | AD656: =(AB656*100)/AC656 -> 111.37026239067055 | AE656: 38
A657: NORTHCOTE | C657: 4 | D657: 3 | E657: =C657*6+D657 -> 27 | G657: 6 | H657: 3 | I657: =G657*6+H657 -> 39 | K657: 10 | L657: 5 | M657: =K657*6+L657 -> 65 | O657: 12 | P657: 7 | Q657: =O657*6+P657 -> 79 | S657: GOLLOP | W657: BERWICK | X657: 8 | Y657: 6 | Z657: 0 | AB657: 1786 | AC657: 1530 | AD657: =(AB657*100)/AC657 -> 116.73202614379085 | AE657: 32
A658: BEST PLAYERS | S658: PHILLIPS | W658: MORDIALLOC | X658: 6 | Y658: 8 | Z658: 0 | AB658: 1542 | AC658: 1616 | AD658: =(AB658*100)/AC658 -> 95.420792079207928 | AE658: 24
A659: BERWICK | C659: McMASTER | F659: WARD | I659: PARK | K659: VENVILLE | N659: CREBBIN | W659: MOORABBIN | X659: 5 | Y659: 8 | Z659: 1 | AB659: 1574 | AC659: 1811 | AD659: =(AB659*100)/AC659 -> 86.913307564881279 | AE659: 22
A660: NORTHCOTE | C660: J COURTS | F660: MEGNA | I660: JIM CHRISTOU | L660: SPAGNOCCOLO | O660: SPROAT | R660: COSMA | W660: NORTHCOTE | X660: 3 | Y660: 11 | Z660: 0 | AB660: 1166 | AC660: 1722 | AD660: =(AB660*100)/AC660 -> 67.711962833914058 | AE660: 12
A661: GOALKICKERS | P661: J JOHNSON | S661: WARD | W661: KILSYTH | X661: 3 | Y661: 11 | Z661: 0 | AB661: 987 | AC661: 2239 | AD661: =(AB661*100)/AC661 -> 44.082179544439484 | AE661: 12
A662: BERWICK | C662: DILLON 4 | F662: CREBBIN 2 | H662: McGREAL 2 | K662: PARK | M662: ALLEN | O662: ORSBORNE | R662: LUXFORD | T662: VENVILLE | W662: SUNSHINE | X662: 2 | Y662: 12 | Z662: 0 | AB662: 1124 | AC662: 2300 | AD662: =(AB662*100)/AC662 -> 48.869565217391305 | AE662: 8
A663: NORTHCOTE | C663: BRAIN 3 | E663: JIM CHRISTOU 2 | H663: STRANGWICK 2 | K663: J COURTS | N663: JOHN CHRISTOU | Q663: GLOBBIN | S663: ADAMSON
L664: DAHOUD
A665: OAKLEIGH | C665: 7 | D665: 8 | E665: =C665*6+D665 -> 50 | G665: 12 | H665: 16 | I665: =G665*6+H665 -> 88 | K665: 20 | L665: 25 | M665: =K665*6+L665 -> 145 | O665: 28 | P665: 27 | Q665: =O665*6+P665 -> 195 | S665: OAKLEIGH
A666: KILSYTH | C666: 0 | D666: 1 | E666: =C666*6+D666 -> 1 | G666: 1 | H666: 4 | I666: =G666*6+H666 -> 10 | K666: 4 | L666: 6 | M666: =K666*6+L666 -> 30 | O666: 8 | P666: 6 | Q666: =O666*6+P666 -> 54 | S666: COOKE/MORGAN
A667: BEST PLAYERS
A668: OAKLEIGH | C668: PRETTO | F668: S ROACH | I668: TODD | L668: HARPER | O668: WALSH | R668: SUMMERIN
A669: KILSYTH | C669: EDWARDS | F669: JAMES | I669: BASS | L669: GEORGE | O669: FRASER | R669: TAYLOR
A670: GOALKICKERS
A671: OAKLEIGH | C671: PRETTO 9 | F671: HARPER 7 | H671: S ROACH 4 | K671: OWEN 3 | M671: NEARY 2 | O671: WILLIAMS | R671: M ROACH | T671: SUTHERLAND
A672: KILSYTH | C672: EDWARDS 2 | F672: BASS 2 | H672: GIBB | J672: PRICE | L672: WALLACE | O672: REPALUST
A674: MORDIALLOC | C674: 3 | D674: 6 | E674: =C674*6+D674 -> 24 | G674: 9 | H674: 14 | I674: =G674*6+H674 -> 68 | K674: 17 | L674: 18 | M674: =K674*6+L674 -> 120 | O674: 26 | P674: 23 | Q674: =O674*6+P674 -> 179 | S674: SUNSHINE
A675: SUNSHINE | C675: 3 | D675: 3 | E675: =C675*6+D675 -> 21 | G675: 5 | H675: 4 | I675: =G675*6+H675 -> 34 | K675: 9 | L675: 5 | M675: =K675*6+L675 -> 59 | O675: 11 | P675: 8 | Q675: =O675*6+P675 -> 74 | S675: BRADSHAW/BLOOM
A676: BEST PLAYERS
A677: MORDIALLOC | C677: WHITTAKER | F677: BROMLEY | I677: PADULA | L677: PRENTICE | O677: SERENA | R677: MACE
A678: SUNSHINE | C678: J FARRUGIA | F678: AXON | I678: BENSON | L678: B MENADUE | O678: WHITNEY | R678: KENNEDY
A679: GOALKICKERS
A680: MORDIALLOC | C680: PRENTIS 5 | F680: BROMLEY 4 | I680: BENSON 4 | K680: SERENA 4 | N680: BOURNE 2 | P680: SHEPPARD 2 | S680: PADULA 2 | V680: DEATON | X680: MACE | AA680: DAVIDSON
A681: SUNSHINE | C681: AXON 3 | E681: PLANT | G681: N MENADUE | J681: WILLIAMS | L681: CATTANACH | O681: WELLS | Q681: BENSON | S681: KENNEDY | V681: COOKE
A683: BOX HILL | C683: 8 | D683: 4 | E683: =C683*6+D683 -> 52 | G683: 13 | H683: 8 | I683: =G683*6+H683 -> 86 | K683: 17 | L683: 13 | M683: =K683*6+L683 -> 115 | O683: 24 | P683: 15 | Q683: =O683*6+P683 -> 159 | S683: BOX HILL
A684: CAULFIELD | C684: 2 | D684: 1 | E684: =C684*6+D684 -> 13 | G684: 4 | H684: 5 | I684: =G684*6+H684 -> 29 | K684: 10 | L684: 7 | M684: =K684*6+L684 -> 67 | O684: 11 | P684: 9 | Q684: =O684*6+P684 -> 75 | S684: NLAKE/VERGONA
A685: BEST PLAYERS
A686: BOX HILL | C686: S WITNISH | F686: GLEESON | I686: NICHOLSON | L686: TOVEY | O686: SCHADE | R686: O'SHEA
A687: CAULFIELD | C687: EINSEDEL | F687: BARRY | I687: REID | L687: DAWSON | O687: SHERIDAN
A688: GOALKICKERS
A689: BOX HILL | C689: CARROLL 6 | F689: NICHOLSON 5 | I689: HEDGER 4 | K689: TEAKEL 3 | N689: GLEESON 3 | P689: TOVEY | R689: SCHADE | T689: GARTH
A690: CAULFIELD | C690: DOYLE 3 | E690: McLEOD 3 | G690: BARRY | I690: DAWSON | K690: GAYFER | M690: HITCHCOCK | P690: REID
A692: BYE | C692: WAVERLEY
A694: ROUND 15 | E694: 29TH JULY | J694: WEATHER | S694: PLAYED AT
D695: 1ST QTR | H695: 2ND QTR | L695: 3RD QTR | P695: FINAL | S695: OAKLEIGH
A696: OAKLEIGH | C696: 4 | D696: 8 | E696: =C696*6+D696 -> 32 | G696: 8 | H696: 16 | I696: =G696*6+H696 -> 64 | K696: 15 | L696: 20 | M696: =K696*6+L696 -> 110 | O696: 20 | P696: 22 | Q696: =O696*6+P696 -> 142 | S696: UMPIRE | X696: LADDER | AC696: ROUND | AE696: 15
A697: MORDIALLOC | C697: 1 | D697: 0 | E697: =C697*6+D697 -> 6 | G697: 2 | H697: 2 | I697: =G697*6+H697 -> 14 | K697: 4 | L697: 2 | M697: =K697*6+L697 -> 26 | O697: 5 | P697: 5 | Q697: =O697*6+P697 -> 35 | S697: BRADSHAW/MARCY
A698: BEST PLAYERS | W698: TEAM | X698: W | Y698: L | Z698: D | AA698: B | AB698: FOR | AC698: AGST | AD698: % | AE698: PTS
A699: OAKLEIGH | C699: ROACH | F699: TODD | I699: BROWN | L699: SUMMERIN | O699: NEARY
A700: MORDIALLOC | C700: PRENTIS | F700: SERENA | I700: WHITTAKER | L700: MACE | W700: BOX HILL | X700: 13 | Y700: 2 | Z700: 0 | AB700: 2274 | AC700: 1338 | AD700: =(AB700*100)/AC700 -> 169.95515695067266 | AE700: 52
A701: GOALKICKERS | W701: BRUNSWICK | X701: 12 | Y701: 2 | Z701: 1 | AB701: 2229 | AC701: 1298 | AD701: =(AB701*100)/AC701 -> 171.72573189522342 | AE701: 50
A702: OAKLEIGH | C702: EVANS 5 | F702: HARPER 4 | H702: OWEN 4 | J702: TODD 2 | L702: ? 2 | N702: ? 2 | P702: BARTON | W702: CAULFIELD | X702: 12 | Y702: 2 | Z702: 1 | AB702: 1867 | AC702: 1271 | AD702: =(AB702*100)/AC702 -> 146.89221085759246 | AE702: 50
A703: MORDIALLOC | C703: PRENTIS 3 | F703: BROMLEY | I703: AUGUSTINSKI | W703: OAKLEIGH | X703: 12 | Y703: 3 | Z703: 0 | AB703: 1998 | AC703: 1167 | AD703: =(AB703*100)/AC703 -> 171.20822622107968 | AE703: 48
A705: NORTHCOTE | C705: 3 | D705: 5 | E705: =C705*6+D705 -> 23 | G705: 5 | H705: 10 | I705: =G705*6+H705 -> 40 | K705: 6 | L705: 14 | M705: =K705*6+L705 -> 50 | O705: 6 | P705: 16 | Q705: =O705*6+P705 -> 52 | S705: KILSYTH | W705: WAVERLEY | X705: 10 | Y705: 4 | Z705: 1 | AB705: 1591 | AC705: 1412 | AD705: =(AB705*100)/AC705 -> 112.6770538243626 | AE705: 42
A706: KILSYTH | C706: 1 | D706: 2 | E706: =C706*6+D706 -> 8 | G706: 1 | H706: 4 | I706: =G706*6+H706 -> 10 | K706: 1 | L706: 11 | M706: =K706*6+L706 -> 17 | O706: 4 | P706: 12 | Q706: =O706*6+P706 -> 36 | S706: BUSE | W706: BERWICK | X706: 8 | Y706: 7 | Z706: 0 | AB706: 1826 | AC706: 1593 | AD706: =(AB706*100)/AC706 -> 114.62649089767734 | AE706: 32
A707: BEST PLAYERS | S707: MAY | W707: MOORABBIN | X707: 6 | Y707: 8 | Z707: 1 | AB707: 1574 | AC707: 1811 | AD707: =(AB707*100)/AC707 -> 86.913307564881279 | AE707: 26
A708: NORTHCOTE | C708: MINNETT | F708: GUEREN | I708: JIM CHRISTOU | L708: BRAIN | P708: STRANGWICK | W708: MORDIALLOC | X708: 6 | Y708: 9 | Z708: 0 | AB708: 1577 | AC708: 1758 | AD708: =(AB708*100)/AC708 -> 89.70420932878271 | AE708: 24
A709: KILSYTH | C709: BASS | F709: ROBBINS | I709: GIBB | L709: EDWARDS | N709: D | P709: L ? | W709: NORTHCOTE | X709: 4 | Y709: 11 | Z709: 0 | AB709: 1218 | AC709: 1758 | AD709: =(AB709*100)/AC709 -> 69.283276450511948 | AE709: 16
A710: GOALKICKERS | W710: KILSYTH | X710: 3 | Y710: 12 | Z710: 0 | AB710: 1023 | AC710: 2291 | AD710: =(AB710*100)/AC710 -> 44.652989960715843 | AE710: 12
A711: NORTHCOTE | C711: BRAIN 3 | F711: STRANGWICK 2 | J711: GLOBBIN | W711: SUNSHINE | X711: 2 | Y711: 13 | Z711: 0 | AB711: 1153 | AC711: 2470 | AD711: =(AB711*100)/AC711 -> 46.680161943319838 | AE711: 8
A712: KILSYTH | C712: MUIR | E712: PRICE | G712: TAYLOR | I712: JAMES
A714: WAVERLEY | C714: 3 | D714: 3 | E714: =C714*6+D714 -> 21 | G714: 4 | H714: 11 | I714: =G714*6+H714 -> 35 | K714: 6 | L714: 12 | M714: =K714*6+L714 -> 48 | O714: 8 | P714: 15 | Q714: =O714*6+P714 -> 63 | S714: BERWICK
A715: BERWICK | C715: 2 | D715: 4 | E715: =C715*6+D715 -> 16 | G715: 3 | H715: 6 | I715: =G715*6+H715 -> 24 | K715: 4 | L715: 7 | M715: =K715*6+L715 -> 31 | O715: 5 | P715: 10 | Q715: =O715*6+P715 -> 40 | S715: BLOOM/CASEY
A716: BEST PLAYERS
A717: WAVERLEY | C717: VEAR | E717: WILLIAMS | H717: FISHER | K717: McILWRAITH | N717: KINNABURGH | Q717: COSTELLO
A718: BERWICK | C718: M JOHNSON | F718: WARD | H718: McMASTER | K718: CREBBIN | N718: VENVILLE
A719: GOALKICKERS
A720: WAVERLEY | C720: FISHER 4 | F720: ZAKARIN 2 | I720: WENBORNE | L720: EVANS
A721: BERWICK | C721: VENVILLE | F721: ORSBORNE | I721: HEFF? | L721: DILLON | N721: McGREAL
A723: BRUNSWICK | C723: 1 | D723: 1 | E723: =C723*6+D723 -> 7 | G723: 2 | H723: 7 | I723: =G723*6+H723 -> 19 | K723: 6 | L723: 9 | M723: =K723*6+L723 -> 45 | O723: 16 | P723: 14 | Q723: =O723*6+P723 -> 110 | S723: BRUNSWICK
A724: BOX HILL | C724: 5 | D724: 4 | E724: =C724*6+D724 -> 34 | G724: 6 | H724: 6 | I724: =G724*6+H724 -> 42 | K724: 9 | L724: 10 | M724: =K724*6+L724 -> 64 | O724: 9 | P724: 11 | Q724: =O724*6+P724 -> 65 | S724: BUCK/MARCY
A725: BEST PLAYERS
A726: BRUNSWICK | C726: PULVRENTI | F726: ROULSTON | I726: SAHLBERG | L726: GIBSON
A727: BOX HILL | C727: GLEESON | F727: O'SHEA | I727: SLACIK | L727: P WITNISH | O727: NICHOLSON | R727: CHARLES
A728: GOALKICKERS
A729: BRUNSWICK | C729: PULVRENTI 4 | F729: GIBSON 2 | H729: LAWSON 2 | K729: ? 2 | M729: SAHLBERG 2 | P729: ROULSTON 2 | S729: FLOWER | U729: CALLANDER
A730: BOX HILL | C730: NICHOLSON 3 | F730: SLACIK 2 | I730: CARROLL 2 | L730: O'SHEA | N730: R WITNISH
A732: CAULFIELD | C732: 8 | D732: 9 | E732: =C732*6+D732 -> 57 | G732: 13 | H732: 14 | I732: =G732*6+H732 -> 92 | K732: 22 | L732: 23 | M732: =K732*6+L732 -> 155 | O732: 24 | P732: 26 | Q732: =O732*6+P732 -> 170 | S732: PRINCES PARK, CAULFIELD
A733: SUNSHINE | C733: 1 | D733: 3 | E733: =C733*6+D733 -> 9 | G733: 2 | H733: 5 | I733: =G733*6+H733 -> 17 | K733: 4 | L733: 5 | M733: =K733*6+L733 -> 29 | O733: 4 | P733: 5 | Q733: =O733*6+P733 -> 29 | S733: GERSCH/COOKE
A734: BEST PLAYERS
A735: CAULFIELD | C735: SHERIDAN | F735: EINSEDEL | I735: DOYLE | L735: SULLIVAN | O735: FARINSKI | R735: MADDAFERI
A736: SUNSHINE | C736: B MENADUE | F736: COOKE | I736: N MENADUE | L736: PALERNO | O736: DERAAD
A737: GOALKICKERS
A738: CAULFIELD | C738: DOYLE 10 | F738: KING 5 | H738: SHERIDAN 3 | K738: STEWART 2 | N738: BARRY | P738: DAWSON | R738: EINSEDEL | T738: REID
A739: SUNSHINE | C739: N MENADUE | F739: GORE | H739: PALERNO | K739: KENNEDY
A741: BYE | C741: MOORABBIN
A743: ROUND 16 | E743: 5TH AUGUST | J743: WEATHER | S743: PLAYED AT
D744: 1ST QTR | H744: 2ND QTR | L744: 3RD QTR | P744: FINAL | S744: BENTLEIGH
A745: MOORABBIN | C745: 9 | D745: 3 | E745: =C745*6+D745 -> 57 | G745: 10 | H745: 6 | I745: =G745*6+H745 -> 66 | K745: 14 | L745: 7 | M745: =K745*6+L745 -> 91 | O745: 17 | P745: 10 | Q745: =O745*6+P745 -> 112 | S745: UMPIRE | X745: LADDER | AC745: ROUND | AE745: 16
A746: BERWICK | C746: 2 | D746: 2 | E746: =C746*6+D746 -> 14 | G746: 8 | H746: 4 | I746: =G746*6+H746 -> 52 | K746: 11 | L746: 5 | M746: =K746*6+L746 -> 71 | O746: 13 | P746: 7 | Q746: =O746*6+P746 -> 85 | S746: GLEESON/BUCK
A747: BEST PLAYERS | W747: TEAM | X747: W | Y747: L | Z747: D | AA747: B | AB747: FOR | AC747: AGST | AD747: % | AE747: PTS
A748: MOORABBIN | C748: POLLOCK | F748: BARBER | I748: STEWART | L748: LONIE | N748: WHITE
A749: BERWICK | C749: WARD | F749: ALLEN | I749: M JOHNSON | L749: PARK | N749: TESSO | Q749: CREBBIN | W749: BOX HILL | X749: 14 | Y749: 2 | Z749: 0 | AB749: 2541 | AC749: 1351 | AD749: =(AB749*100)/AC749 -> 188.08290155440415 | AE749: 56
A750: GOALKICKERS | W750: BRUNSWICK | X750: 13 | Y750: 2 | Z750: 1 | AB750: 2229 | AC750: 1298 | AD750: =(AB750*100)/AC750 -> 171.72573189522342 | AE750: 54
A751: MOORABBIN | C751: LONIE 4 | E751: POLLOCK 3 | G751: ATHERTON 2 | J751: BARBER 2 | L751: BOYLE 2 | N751: STEWART 2 | P751: B CATHCART | S751: WHITE | W751: OAKLEIGH | X751: 13 | Y751: 3 | Z751: 0 | AB751: 2124 | AC751: 1224 | AD751: =(AB751*100)/AC751 -> 173.52941176470588 | AE751: 52
A752: BERWICK | C752: ALLEN 2 | E752: CREBBIN 2 | G752: McGREAL 2 | J752: OWEN 2 | L752: VENVILLE | N752: WARD | P752: ORSBORNE | S752: HARRISON | W752: CAULFIELD | X752: 12 | Y752: 3 | Z752: 1 | AB752: 1924 | AC752: 1397 | AD752: =(AB752*100)/AC752 -> 137.72369362920543 | AE752: 50
P753: LUXFORD
A754: WAVERLEY | C754: 6 | D754: 8 | E754: =C754*6+D754 -> 44 | G754: 12 | H754: 13 | I754: =G754*6+H754 -> 85 | K754: 16 | L754: 18 | M754: =K754*6+L754 -> 114 | O754: 22 | P754: 24 | Q754: =O754*6+P754 -> 156 | S754: WAVERLEY | W754: WAVERLEY | X754: 11 | Y754: 4 | Z754: 1 | AB754: 1747 | AC754: 1427 | AD754: =(AB754*100)/AC754 -> 122.42466713384724 | AE754: 46
A755: KILSYTH | C755: 1 | D755: 0 | E755: =C755*6+D755 -> 6 | G755: 1 | H755: 0 | I755: =G755*6+H755 -> 6 | K755: 2 | L755: 1 | M755: =K755*6+L755 -> 13 | O755: 2 | P755: 3 | Q755: =O755*6+P755 -> 15 | S755: BRADSHAW | W755: BERWICK | X755: 8 | Y755: 8 | Z755: 0 | AB755: 1911 | AC755: 1705 | AD755: =(AB755*100)/AC755 -> 112.08211143695014 | AE755: 32
A756: BEST PLAYERS | S756: TORNEY | W756: MOORABBIN | X756: 7 | Y756: 8 | Z756: 1 | AB756: 1686 | AC756: 1896 | AD756: =(AB756*100)/AC756 -> 88.924050632911388 | AE756: 30
A757: WAVERLEY | C757: KINNABURGH | F757: McILWRAITH | I757: WILLIAMS | L757: GREENE | O757: MARSHALL | R757: WENBORNE | W757: MORDIALLOC | X757: 6 | Y757: 10 | Z757: 0 | AB757: 1656 | AC757: 1857 | AD757: =(AB757*100)/AC757 -> 89.176090468497577 | AE757: 24
A758: KILSYTH | C758: TAPSCOTT | F758: DOYLE | I758: McGINTY | L758: HOWARTH | O758: EDWARDS | W758: NORTHCOTE | X758: 5 | Y758: 11 | Z758: 0 | AB758: 1317 | AC758: 1837 | AD758: =(AB758*100)/AC758 -> 71.692977681001636 | AE758: 20
A759: GOALKICKERS | M759: GREENE | O759: McILWRAITH | R759: PALLOTTA | T759: VEAR | W759: KILSYTH | X759: 3 | Y759: 13 | Z759: 0 | AB759: 1038 | AC759: 2447 | AD759: =(AB759*100)/AC759 -> 42.419288925214552 | AE759: 12
A760: WAVERLEY | C760: ZAKARIN 6 | F760: WILLIAMS 3 | I760: ROBERTS 3 | K760: KINAABURGH 2 | N760: WENBORNE 2 | Q760: BARNES | S760: COSTELLO | W760: SUNSHINE | X760: 2 | Y760: 14 | Z760: 0 | AB760: 1166 | AC760: 2737 | AD760: =(AB760*100)/AC760 -> 42.601388381439534 | AE760: 8
A761: KILSYTH | C761: PRICE 2
A763: NORTHCOTE | C763: 3 | D763: 5 | E763: =C763*6+D763 -> 23 | G763: 6 | H763: 9 | I763: =G763*6+H763 -> 45 | K763: 9 | L763: 13 | M763: =K763*6+L763 -> 67 | O763: 14 | P763: 15 | Q763: =O763*6+P763 -> 99 | S763: NORTHCOTE
A764: MORDIALLOC | C764: 5 | D764: 4 | E764: =C764*6+D764 -> 34 | G764: 9 | H764: 6 | I764: =G764*6+H764 -> 60 | K764: 10 | L764: 11 | M764: =K764*6+L764 -> 71 | O764: 11 | P764: 13 | Q764: =O764*6+P764 -> 79 | S764: CASEY/COOKE
A765: BEST PLAYERS
A766: NORTHCOTE | C766: J COURTS | F766: JIM CHRISTOU | I766: SANDERS | L766: STRANGWICK | O766: MINNETT | R766: SPROUT
A767: MORDIALLOC | C767: WHITTAKER | F767: BENCRAFT | I767: DEATON | L767: CLIFFORD | O767: SARAU | R767: BOURNE
A768: GOALKICKERS
A769: NORTHCOTE | C769: STRANGWICK 4 | G769: JIM CHRISTOU 3 | K769: SANDERS 2 | N769: GRIBBEN 2 | P769: BRAIN | R769: JOHN CHRISTOU | U769: SPROUT
A770: MORDIALLOC | C770: BOURNE 5 | F770: ROGERSON 2 | I770: DEATON | K770: BENCRAFT | N770: BROMLEY | P770: PRENTIS
A772: OAKLEIGH | C772: 4 | D772: 5 | E772: =C772*6+D772 -> 29 | G772: 11 | H772: 7 | I772: =G772*6+H772 -> 73 | K772: 14 | L772: 12 | M772: =K772*6+L772 -> 96 | O772: 18 | P772: 18 | Q772: =O772*6+P772 -> 126 | S772: OAKLEIGH
A773: CAULFIELD | C773: 3 | D773: 1 | E773: =C773*6+D773 -> 19 | G773: 5 | H773: 5 | I773: =G773*6+H773 -> 35 | K773: 6 | L773: 6 | M773: =K773*6+L773 -> 42 | O773: 8 | P773: 9 | Q773: =O773*6+P773 -> 57 | S773: BLOOM/BLAKE
A774: BEST PLAYERS
A775: OAKLEIGH | C775: BATTERSBY | F775: RAWLYK | I775: TODD | K775: S ROACH | N775: OWEN | P775: SUTHERLAND
A776: CAULFIELD | C776: EINSEDEL | F776: DAWSON | I776: FAWCETT | L776: JONES
A777: GOALKICKERS
A778: OAKLEIGH | C778: PRETTO 6 | F778: SUTHERLAND 3 | I778: LAMBLEY 3 | K778: TODD 2 | M778: HILLIARD | O778: HARPER | Q778: S ROACH | S778: OWEN
A779: CAULFIELD | C779: DOYLE 4 | F779: DAWSON | I779: JONES | K779: McLEOD | M779: SHERIDAN
A781: BOX HILL | C781: 9 | D781: 8 | E781: =C781*6+D781 -> 62 | G781: 17 | H781: 17 | I781: =G781*6+H781 -> 119 | K781: 29 | L781: 26 | M781: =K781*6+L781 -> 200 | O781: 39 | P781: 33 | Q781: =O781*6+P781 -> 267 | S781: BOX HILL
A782: SUNSHINE | C782: 0 | D782: 1 | E782: =C782*6+D782 -> 1 | G782: 1 | H782: 1 | I782: =G782*6+H782 -> 7 | K782: 1 | L782: 1 | M782: =K782*6+L782 -> 7 | O782: 2 | P782: 1 | Q782: =O782*6+P782 -> 13 | S782: HERMAN/McCARTHY
A783: BEST PLAYERS
A784: BOX HILL | C784: DICKENSON | F784: GLEESON | I784: NICHOLSON | L784: BOLTON | N784: BROWN | Q784: CHARLES
A785: SUNSHINE | C785: WHITNEY | F785: B MENADUE | I785: HOBBS
A786: GOALKICKERS
A787: BOX HILL | C787: BOLTON 10 | F787: NICHOLSON 9 | I787: SLACIK 5 | K787: WITHERS 3 | N787: DICKENSON 3 | Q787: CARROLL 3 | S787: GLEESON 3 | V787: O'SHEA 2 | X787: BROWN
A788: SUNSHINE | C788: N MENADUE 2
A790: BYE | C790: BRUNSWICK
A792: ROUND 17 | E792: 12TH AUGUST | J792: WEATHER | S792: PLAYED AT
D793: 1ST QTR | H793: 2ND QTR | L793: 3RD QTR | P793: FINAL | S793: MORDIALLOC
A794: WAVERLEY | C794: 5 | D794: 3 | E794: =C794*6+D794 -> 33 | G794: 7 | H794: 4 | I794: =G794*6+H794 -> 46 | K794: 11 | L794: 7 | M794: =K794*6+L794 -> 73 | O794: 16 | P794: 8 | Q794: =O794*6+P794 -> 104 | S794: UMPIRE | X794: LADDER | AC794: ROUND | AE794: 17
A795: MORDIALLOC | C795: 2 | D795: 7 | E795: =C795*6+D795 -> 19 | G795: 5 | H795: 9 | I795: =G795*6+H795 -> 39 | K795: 7 | L795: 11 | M795: =K795*6+L795 -> 53 | O795: 11 | P795: 11 | Q795: =O795*6+P795 -> 77
A796: BEST PLAYERS | W796: TEAM | X796: W | Y796: L | Z796: D | AA796: B | AB796: FOR | AC796: AGST | AD796: % | AE796: PTS
A797: WAVERLEY
A798: MORDIALLOC | W798: BOX HILL | X798: 15 | Y798: 2 | Z798: 0 | AB798: 2541 | AC798: 1351 | AD798: =(AB798*100)/AC798 -> 188.08290155440415 | AE798: 60
A799: GOALKICKERS | W799: BRUNSWICK | X799: 14 | Y799: 2 | Z799: 1 | AB799: 2368 | AC799: 1375 | AD799: =(AB799*100)/AC799 -> 172.21818181818182 | AE799: 58
A800: WAVERLEY | W800: OAKLEIGH | X800: 14 | Y800: 3 | Z800: 0 | AB800: 2300 | AC800: 1275 | AD800: =(AB800*100)/AC800 -> 180.39215686274511 | AE800: 56
A801: MORDIALLOC | W801: CAULFIELD | X801: 13 | Y801: 3 | Z801: 1 | AB801: 1997 | AC801: 1463 | AD801: =(AB801*100)/AC801 -> 136.50034176349965 | AE801: 54
A803: MOORABBIN | C803: 4 | D803: 4 | E803: =C803*6+D803 -> 28 | G803: 6 | H803: 6 | I803: =G803*6+H803 -> 42 | K803: 6 | L803: 6 | M803: =K803*6+L803 -> 42 | O803: 9 | P803: 10 | Q803: =O803*6+P803 -> 64 | S803: KILSYTH | W803: WAVERLEY | X803: 12 | Y803: 4 | Z803: 1 | AB803: 1851 | AC803: 1504 | AD803: =(AB803*100)/AC803 -> 123.07180851063829 | AE803: 50
A804: KILSYTH | C804: 2 | D804: 5 | E804: =C804*6+D804 -> 17 | G804: 3 | H804: 7 | I804: =G804*6+H804 -> 25 | K804: 7 | L804: 10 | M804: =K804*6+L804 -> 52 | O804: 8 | P804: 10 | Q804: =O804*6+P804 -> 58 | W804: MOORABBIN | X804: 8 | Y804: 8 | Z804: 1 | AB804: 1750 | AC804: 1954 | AD804: =(AB804*100)/AC804 -> 89.559877175025591 | AE804: 34
A805: BEST PLAYERS | W805: BERWICK | X805: 8 | Y805: 9 | Z805: 0 | AB805: 1988 | AC805: 1844 | AD805: =(AB805*100)/AC805 -> 107.80911062906725 | AE805: 32
A806: MOORABBIN | W806: MORDIALLOC | X806: 6 | Y806: 11 | Z806: 0 | AB806: 1733 | AC806: 1961 | AD806: =(AB806*100)/AC806 -> 88.373278939316677 | AE806: 24
A807: KILSYTH | W807: NORTHCOTE | X807: 5 | Y807: 12 | Z807: 0 | AB807: 1383 | AC807: 1910 | AD807: =(AB807*100)/AC807 -> 72.40837696335079 | AE807: 20
A808: GOALKICKERS | W808: KILSYTH | X808: 3 | Y808: 14 | Z808: 0 | AB808: 1096 | AC808: 2511 | AD808: =(AB808*100)/AC808 -> 43.647949024293112 | AE808: 12
A809: MOORABBIN | W809: SUNSHINE | X809: 2 | Y809: 15 | Z809: 0 | AB809: 1217 | AC809: 2913 | AD809: =(AB809*100)/AC809 -> 41.778235496052183 | AE809: 8
A810: KILSYTH
A812: BRUNSWICK | C812: 7 | D812: 3 | E812: =C812*6+D812 -> 45 | G812: 10 | H812: 10 | I812: =G812*6+H812 -> 70 | K812: 17 | L812: 15 | M812: =K812*6+L812 -> 117 | O812: 20 | P812: 19 | Q812: =O812*6+P812 -> 139 | S812: BERWICK
A813: BERWICK | C813: 2 | D813: 5 | E813: =C813*6+D813 -> 17 | G813: 3 | H813: 9 | I813: =G813*6+H813 -> 27 | K813: 6 | L813: 11 | M813: =K813*6+L813 -> 47 | O813: 10 | P813: 17 | Q813: =O813*6+P813 -> 77
A814: BEST PLAYERS
A815: BRUNSWICK
A816: BERWICK
A817: GOALKICKERS
A818: BRUNSWICK
A819: BERWICK
A821: OAKLEIGH | C821: 7 | D821: 4 | E821: =C821*6+D821 -> 46 | G821: 11 | H821: 6 | I821: =G821*6+H821 -> 72 | K821: 20 | L821: 10 | M821: =K821*6+L821 -> 130 | O821: 27 | P821: 14 | Q821: =O821*6+P821 -> 176 | S821: SUNSHINE
A822: SUNSHINE | C822: 0 | D822: 1 | E822: =C822*6+D822 -> 1 | G822: 4 | H822: 7 | I822: =G822*6+H822 -> 31 | K822: 4 | L822: 7 | M822: =K822*6+L822 -> 31 | O822: 7 | P822: 9 | Q822: =O822*6+P822 -> 51
A823: BEST PLAYERS
A824: OAKLEIGH
A825: SUNSHINE
A826: GOALKICKERS
A827: OAKLEIGH
A828: SUNSHINE
A830: CAULFIELD | C830: 2 | D830: 2 | E830: =C830*6+D830 -> 14 | G830: 7 | H830: 4 | I830: =G830*6+H830 -> 46 | K830: 7 | L830: 5 | M830: =K830*6+L830 -> 47 | O830: 10 | P830: 13 | Q830: =O830*6+P830 -> 73 | S830: PRINCES PARK, CAULFIELD
A831: NORTHCOTE | C831: 5 | D831: 3 | E831: =C831*6+D831 -> 33 | G831: 6 | H831: 7 | I831: =G831*6+H831 -> 43 | K831: 9 | L831: 12 | M831: =K831*6+L831 -> 66 | O831: 9 | P831: 12 | Q831: =O831*6+P831 -> 66
A832: BEST PLAYERS
A833: CAULFIELD
A834: NORTHCOTE
A835: GOALKICKERS
A836: CAULFIELD
A837: NORTHCOTE
A839: BYE | C839: BOX HILL
A841: ROUND 18 | E841: 19TH AUGUST | J841: WEATHER | S841: PLAYED AT
D842: 1ST QTR | H842: 2ND QTR | L842: 3RD QTR | P842: FINAL | S842: BRUNSWICK
A843: BRUNSWICK | C843: 8 | D843: 6 | E843: =C843*6+D843 -> 54 | G843: 19 | H843: 16 | I843: =G843*6+H843 -> 130 | K843: 31 | L843: 26 | M843: =K843*6+L843 -> 212 | O843: 39 | P843: 34 | Q843: =O843*6+P843 -> 268 | S843: UMPIRE | X843: LADDER | AC843: ROUND | AE843: 18
A844: KILSYTH | C844: 1 | D844: 0 | E844: =C844*6+D844 -> 6 | G844: 2 | H844: 2 | I844: =G844*6+H844 -> 14 | K844: 2 | L844: 2 | M844: =K844*6+L844 -> 14 | O844: 3 | P844: 4 | Q844: =O844*6+P844 -> 22 | S844: CASEY/GLEESON
A845: BEST PLAYERS | W845: TEAM | X845: W | Y845: L | Z845: D | AA845: B | AB845: FOR | AC845: AGST | AD845: % | AE845: PTS
A846: BRUNSWICK | C846: WHILLAS | F846: LAWSON | I846: LEAHY | K846: BUCKLEY | N846: EDWARDS | Q846: M SCULLY
A847: KILSYTH | C847: GEORGE | F847: JAMES | I847: ROBBINS | K847: McKINNON | N847: FRASER | Q847: EDWARDS | W847: BOX HILL | X847: 16 | Y847: 2 | Z847: 0 | AA847: 2 | AB847: 2637 | AC847: 1415 | AD847: =(AB847*100)/AC847 -> 186.36042402826854 | AE847: 64
A848: GOALKICKERS | I848: SAHLBERG 2 | L848: EDWARDS 2 | O848: DOYLE | Q848: FLOWER | S848: LEAHY | W848: BRUNSWICK | X848: 15 | Y848: 2 | Z848: 1 | AA848: 2 | AB848: 2636 | AC848: 1397 | AD848: =(AB848*100)/AC848 -> 188.69005010737294 | AE848: 62
A849: BRUNSWICK | C849: WHILLAS 12 | F849: BUCKLEY 4 | H849: CALLANDER 3 | K849: GIBSON 3 | M849: LAWSON 3 | O849: PULVRENTI 3 | R849: BROWN 2 | T849: NOLAN 2 | W849: OAKLEIGH | X849: 14 | Y849: 4 | Z849: 0 | AA849: 2 | AB849: 2364 | AC849: 1371 | AD849: =(AB849*100)/AC849 -> 172.4288840262582 | AE849: 56
A850: KILSYTH | C850: PRICE | F850: REPALUST | I850: GEORGE | W850: CAULFIELD | X850: 13 | Y850: 4 | Z850: 1 | AA850: 1 | AB850: 2084 | AC850: 1579 | AD850: =(AB850*100)/AC850 -> 131.98226725775808 | AE850: 54
A852: BOX HILL | C852: 5 | D852: 4 | E852: =C852*6+D852 -> 34 | G852: 7 | H852: 8 | I852: =G852*6+H852 -> 50 | K852: 10 | L852: 13 | M852: =K852*6+L852 -> 73 | O852: 13 | P852: 18 | Q852: =O852*6+P852 -> 96 | S852: BOX HILL | W852: WAVERLEY | X852: 13 | Y852: 4 | Z852: 1 | AA852: 2 | AB852: 1967 | AC852: 1591 | AD852: =(AB852*100)/AC852 -> 123.63293526084223 | AE852: 54
A853: OAKLEIGH | C853: 2 | D853: 4 | E853: =C853*6+D853 -> 16 | G853: 4 | H853: 9 | I853: =G853*6+H853 -> 33 | K853: 8 | L853: 9 | M853: =K853*6+L853 -> 57 | O853: 9 | P853: 10 | Q853: =O853*6+P853 -> 64 | S853: WALKER | W853: MOORABBIN | X853: 9 | Y853: 8 | Z853: 1 | AA853: 2 | AB853: 1877 | AC853: 2043 | AD853: =(AB853*100)/AC853 -> 91.874694077337253 | AE853: 38
A854: BEST PLAYERS | S854: COOKE | W854: BERWICK | X854: 9 | Y854: 9 | Z854: 0 | AA854: 2 | AB854: 1988 | AC854: 1844 | AD854: =(AB854*100)/AC854 -> 107.80911062906725 | AE854: 36
A855: BOX HILL | C855: NICHOLSON | F855: CARROLL | I855: BOLTON | L855: WITHERS | O855: GLEESON | W855: MORDIALLOC | X855: 6 | Y855: 12 | Z855: 0 | AA855: 1 | AB855: 1822 | AC855: 2088 | AD855: =(AB855*100)/AC855 -> 87.260536398467437 | AE855: 24
A856: OAKLEIGH | C856: TODD | F856: S ROACH | I856: WALSH | W856: NORTHCOTE | X856: 6 | Y856: 12 | Z856: 0 | AA856: 2 | AB856: 1581 | AC856: 1968 | AD856: =(AB856*100)/AC856 -> 80.33536585365853 | AE856: 24
A857: GOALKICKERS | W857: KILSYTH | X857: 3 | Y857: 15 | Z857: 0 | AA857: 1 | AB857: 1118 | AC857: 2779 | AD857: =(AB857*100)/AC857 -> 40.230298668585824 | AE857: 12
A858: BOX HILL | C858: NICHOLSON 3 | F858: BOLTON 3 | H858: CARROLL 2 | K858: SLACIK 2 | M858: TEAKEL | O858: WITHERS | Q858: GLEESON | W858: SUNSHINE | X858: 2 | Y858: 16 | Z858: 0 | AA858: 1 | AB858: 1275 | AC858: 3111 | AD858: =(AB858*100)/AC858 -> 40.983606557377051 | AE858: 8
A859: OAKLEIGH | C859: PRETTO 3 | F859: HARPER 2 | I859: HOLDEN | K859: BROWN | M859: HILLIARD | P859: OWEN
A861: WAVERLEY | C861: 2 | D861: 1 | E861: =C861*6+D861 -> 13 | G861: 11 | H861: 5 | I861: =G861*6+H861 -> 71 | K861: 12 | L861: 10 | M861: =K861*6+L861 -> 82 | O861: 17 | P861: 14 | Q861: =O861*6+P861 -> 116 | S861: WAVERLEY
A862: CAULFIELD | C862: 3 | D862: 2 | E862: =C862*6+D862 -> 20 | G862: 8 | H862: 4 | I862: =G862*6+H862 -> 52 | K862: 10 | L862: 5 | M862: =K862*6+L862 -> 65 | O862: 13 | P862: 9 | Q862: =O862*6+P862 -> 87 | S862: BLAKE/HERMAN
A863: BEST PLAYERS
A864: WAVERLEY | C864: GREENE | F864: KINNABURGH | I864: WILLIAMS | L864: EVANS | O864: McILWRAITH | R864: CARGHILL
A865: CAULFIELD | C865: EINSEDEL | F865: JONES | I865: CRANNY | L865: DAWSON | O865: MOON
A866: GOALKICKERS
A867: WAVERLEY | C867: EVANS 4 | F867: BARNES 3 | H867: GREENE 3 | J867: PALOTTA 3 | M867: ZAKARIN 3 | O867: FISHER
A868: CAULFIELD | C868: HITCHCOCK 3 | F868: MOON 3 | H868: CRANNY 2 | J868: STEWART 2 | M868: DAWSON | O868: KING | Q868: REID
A870: NORTHCOTE | C870: 6 | D870: 8 | E870: =C870*6+D870 -> 44 | G870: 14 | H870: 8 | I870: =G870*6+H870 -> 92 | K870: 25 | L870: 14 | M870: =K870*6+L870 -> 164 | O870: 30 | P870: 18 | Q870: =O870*6+P870 -> 198 | S870: NORTHCOTE
A871: SUNSHINE | C871: 1 | D871: 3 | E871: =C871*6+D871 -> 9 | G871: 2 | H871: 5 | I871: =G871*6+H871 -> 17 | K871: 3 | L871: 8 | M871: =K871*6+L871 -> 26 | O871: 8 | P871: 10 | Q871: =O871*6+P871 -> 58 | S871: BLOOM/McCARTHY
A872: BEST PLAYERS
A873: NORTHCOTE | C873: JIM CHRISTOU | F873: JOHN CHRISTOU | J873: MEGNA | L873: STRANGWICK | O873: MINNETT | R873: BRAIN
A874: SUNSHINE | C874: HOBBS | F874: FIDDES | I874: BENSON | L874: CHURI | N874: N MENADUE
A875: GOALKICKERS
A876: NORTHCOTE | C876: STRANGWICK 10 | G876: BRAIN 9 | I876: JIM CHRISTOU 4 | L876: EWING 2 | N876: MEGNA 2 | P876: SANDERS 2 | S876: GLOBBIN
A877: SUNSHINE | C877: BENSON 3 | F877: N MENADUE 2 | I877: AXON | K877: WILLIAMS | N877: FIDDES
A879: MOORABBIN | C879: 2 | D879: 3 | E879: =C879*6+D879 -> 15 | G879: 6 | H879: 6 | I879: =G879*6+H879 -> 42 | K879: 13 | L879: 15 | M879: =K879*6+L879 -> 93 | O879: 18 | P879: 19 | Q879: =O879*6+P879 -> 127 | S879: BENTLEIGH
A880: MORDIALLOC | C880: 2 | D880: 5 | E880: =C880*6+D880 -> 17 | G880: 5 | H880: 7 | I880: =G880*6+H880 -> 37 | K880: 8 | L880: 10 | M880: =K880*6+L880 -> 58 | O880: 13 | P880: 11 | Q880: =O880*6+P880 -> 89 | S880: BLACK/MIHEVC
A881: BEST PLAYERS
A882: MOORABBIN | C882: PEET | F882: MERCOULIA | I882: D CATHCART | L882: STEWART | O882: PAPPAS | R882: POLLOCK
A883: MORDIALLOC | C883: DEATON | F883: WHITTAKER | I883: PRENTIS | L883: SARAU | O883: MACE | R883: SUMMERIN
A884: GOALKICKERS
A885: MOORABBIN | C885: B CATHCART 4 | F885: ATHERTON 3 | I885: STEWART 2 | K885: BARBER 2 | M885: LETT 2 | O885: BOYLE | Q885: PAPPAS | S885: POLLOCK | U885: WHITE | W885: WHALEBONE
A886: MORDIALLOC | C886: DEATON 5 | F886: BOURNE 3 | I886: WHITTAKER 2 | L886: AUGUSTINSKI | O886: BENCRAFT | R886: SUMMERIN
A888: BYE | C888: BERWICK
A890: FINALS
A891: 1ST SEMI | E891: 26TH AUGUST | J891: WEATHER | S891: PLAYED AT
D892: 1ST QTR | H892: 2ND QTR | L892: 3RD QTR | P892: FINAL | S892: TOORAK PARK
A893: OAKLEIGH | C893: 0 | D893: 2 | E893: =C893*6+D893 -> 2 | G893: 3 | H893: 4 | I893: =G893*6+H893 -> 22 | K893: 9 | L893: 6 | M893: =K893*6+L893 -> 60 | O893: 11 | P893: 9 | Q893: =O893*6+P893 -> 75 | S893: UMPIRE
A894: CAULFIELD | C894: 2 | D894: 8 | E894: =C894*6+D894 -> 20 | G894: 5 | H894: 15 | I894: =G894*6+H894 -> 45 | K894: 6 | L894: 17 | M894: =K894*6+L894 -> 53 | O894: 7 | P894: 20 | Q894: =O894*6+P894 -> 62 | S894: GROOM/R CASEY
A895: BEST PLAYERS
A896: OAKLEIGH | C896: TODD | F896: ALLISEY | I896: WALSH | L896: M ROACH | O896: ANSELL | R896: LAURITZ
A897: CAULFIELD | C897: EINSEDEL | F897: BRASIER | I897: DOYLE | L897: REED | O897: GAYFER | R897: KING
A898: GOALKICKERS
A899: OAKLEIGH | C899: TODD 4 | E899: PRETTO 3 | G899: SUTHERLAND 3 | J899: ANSELL 2 | L899: WALL | N899: HARPER | P899: OWEN
A900: CAULFIELD | C900: KING 3 | E900: I BARRY 2 | G900: STEWART 2 | J900: BRASIER 2 | L900: CRANNY 2 | N900: MOON 2 | P900: GAYFER | R900: MADDAFERI
A902: 2ND SEMI | E902: 2ND SEPTEMBER | J902: WEATHER
A903: BOX HILL | C903: 4 | D903: 4 | E903: =C903*6+D903 -> 28 | G903: 8 | H903: 10 | I903: =G903*6+H903 -> 58 | K903: 11 | L903: 15 | M903: =K903*6+L903 -> 81 | O903: 19 | P903: 19 | Q903: =O903*6+P903 -> 133 | S903: TOORAK PARK
A904: BRUNSWICK | C904: 5 | D904: 2 | E904: =C904*6+D904 -> 32 | G904: 10 | H904: 3 | I904: =G904*6+H904 -> 63 | K904: 11 | L904: 4 | M904: =K904*6+L904 -> 70 | O904: 13 | P904: 6 | Q904: =O904*6+P904 -> 84 | S904: FITZPATRICK/MARSHALL
A905: BEST PLAYERS
A906: BOX HILL | C906: SCHADE | F906: GLEESON | I906: NICHOLSON | L906: SLACIK | O906: S WITNISH | R906: BOLTON
A907: BRUNSWICK | C907: LEAHY | F907: DOYLE | I907: EDWARDS | L907: LAWSON | O907: M SCULLY | R907: J SCULLY
A908: GOALKICKERS
A909: BOX HILL | C909: BOLTON 7 | F909: CARROLL 4 | I909: SLACIK 2 | K909: SCHADE | M909: BROWN | O909: NICHOLSON | R909: TEAKEL | T909: WITHERS | V909: DICKENSON
A910: BRUNSWICK | C910: WHILLAS 5 | F910: GIBSON 2 | H910: LEAHY | J910: EDWARDS | L910: LAWSON | N910: ROULSTON | Q910: S BUCKLEY | T910: TOY
A912: PRELIMINARY | E912: 9TH SEPTEMBER | J912: WEATHER
A913: OAKLEIGH | C913: 7 | D913: 4 | E913: =C913*6+D913 -> 46 | G913: 11 | H913: 7 | I913: =G913*6+H913 -> 73 | K913: 15 | L913: 9 | M913: =K913*6+L913 -> 99 | O913: 26 | P913: 15 | Q913: =O913*6+P913 -> 171 | S913: TOORAK PARK
A914: BRUNSWICK | C914: 3 | D914: 5 | E914: =C914*6+D914 -> 23 | G914: 9 | H914: 12 | I914: =G914*6+H914 -> 66 | K914: 13 | L914: 17 | M914: =K914*6+L914 -> 95 | O914: 16 | P914: 18 | Q914: =O914*6+P914 -> 114 | S914: BUDGEE/VERGONA
A915: BEST PLAYERS
A916: OAKLEIGH | C916: BROWN | F916: TODD | I916: HOLDEN | L916: LAURITZ | O916: WALSH | R916: PRETTO
A917: BRUNSWICK | C917: LAWSON | F917: McDONALD | I917: M SCULLY | L917: GIBSON
A918: GOALKICKERS
A919: OAKLEIGH | C919: PRETTO 7 | F919: OWEN 4 | H919: HARPER 3 | J919: HOLDEN 2 | L919: BROWN 2 | N919: TODD 2 | P919: S ROACH 2 | S919: M ROACH 2 | V919: LAURITZ | X919: LAMBLEY
A920: BRUNSWICK | C920: GIBSON 4 | F920: LAWSON 4 | I920: WHILLAS 3 | K920: FLOWER 2 | N920: SAHLBERG | Q920: CALLANDER | T920: JUDGE
A922: GRAND | E922: 16TH SEPTEMBER | J922: WEATHER
A923: BOX HILL | C923: 6 | D923: 9 | E923: =C923*6+D923 -> 45 | G923: 12 | H923: 11 | I923: =G923*6+H923 -> 83 | K923: 21 | L923: 18 | M923: =K923*6+L923 -> 144 | O923: 32 | P923: 23 | Q923: =O923*6+P923 -> 215 | S923: TOORAK PARK
A924: OAKLEIGH | C924: 3 | D924: 2 | E924: =C924*6+D924 -> 20 | G924: 3 | H924: 7 | I924: =G924*6+H924 -> 25 | K924: 10 | L924: 11 | M924: =K924*6+L924 -> 71 | O924: 11 | P924: 14 | Q924: =O924*6+P924 -> 80 | S924: VERGONA/CASEY
A925: BEST PLAYERS
A926: BOX HILL | C926: O'SHEA | F926: CONNOLLY | I926: CHARLES | L926: CARROLL | O926: TOVEY | R926: BROWN
A927: OAKLEIGH | C927: M ROACH | F927: WALSH | I927: ALLISEY | L927: McDONALD | O927: LAURITZ | R927: HARPER
A928: GOALKICKERS
A929: BOX HILL | C929: CARROLL 10 | F929: NICHOLSON 5 | I929: A DICKENSON 3 | L929: BOLTON 3 | N929: R WITNISH 2 | Q929: SLACIK 2 | S929: BROWN 2 | U929: WITHERS | W929: O'SHEA | X929: TEAKEL | AA929: GLEESON
A930: OAKLEIGH | C930: PRETTO 3 | F930: M ROACH 2 | I930: S ROACH 2 | K930: SUTHERLAND | N930: McDONALD | Q930: HARPER | S930: BRYDEN