A1: Victorian Football Association
A2: Season 1984 - Division One
A3: © Copyright Wal Williams | F3: First created: 14 November 2015
A4: Contact: joywalwi at gmail dot com | F4: Last updated: 14 November 2015 | W4: VFA Results and tables - Link to the main index page
A5: You are free to copy this document in whole or part provided that proper acknowledgement is given to the author. All rights reserved.
A7: 1984 | C7: 1ST DIVISION
A8: ROUND 1 | D8: 15TH APRIL | I8: WEATHER
D9: 1ST QTR | H9: 2ND QTR | L9: 3RD QTR | P9: FINAL | S9: VENUE: TOORAK PARK
A10: PRAHRAN | C10: 6 | D10: 3 | E10: 39 | G10: 16 | H10: 7 | I10: 103 | K10: 22 | L10: 9 | M10: 141 | O10: 25 | P10: 13 | Q10: 163 | S10: UMPIRES | X10: LADDER | AB10: ROUND | AD10: 1
A11: DANDENONG | C11: 7 | D11: 2 | E11: 44 | G11: 7 | H11: 4 | I11: 46 | K11: 12 | L11: 9 | M11: 81 | O11: 19 | P11: 11 | Q11: 125 | S11: BUDGE :MORGAN
A12: BEST PLAYERS | W12: TEAM | X12: W | Y12: L | Z12: D | AA12: FOR | AB12: AGST | AC12: % | AD12: PTS
A13: PRAHRAN | C13: WALLACE | F13: YOUNG | I13: GRAMBEAU | L13: WRIGHT | N13: SOULOS | Q13: STONE
A14: DANDENONG | C14: HAMILTON | F14: BASS | I14: HALL | L14: POLA | N14: McINTOSH | Q14: HICKEY | W14: CAMBERWELL | X14: 1 | Y14: 0 | Z14: 0 | AA14: 184 | AB14: 43 | AC14: =(AA14/AB14)*100 -> 427.90697674418601 | AD14: =(X14*4)+(Z14*2) -> 4
A15: GOALKICKERS | W15: SANDRINGHAM | X15: 1 | Y15: 0 | Z15: 0 | AA15: 211 | AB15: 119 | AC15: =(AA15/AB15)*100 -> 177.31092436974788 | AD15: =(X15*4)+(Z15*2) -> 4
A16: PRAHRAN | C16: YOUNG 9 | E16: SOULOS 5 | G16: STONE 4 | I16: GASTON 2 | K16: DAVIDSON 2 | N16: CATTOGGIO | Q16: RAYNER | S16: GILES | W16: WILLIAMSTOWN | X16: 1 | Y16: 0 | Z16: 0 | AA16: 157 | AB16: 96 | AC16: =(AA16/AB16)*100 -> 163.54166666666669 | AD16: =(X16*4)+(Z16*2) -> 4
A17: DANDENONG | C17: HALL 4 | E17: CROOK 4 | G17: POLA 2 | I17: ORSBORNE 2 | L17: KNIGHT 2 | N17: HAMILTON 2 | Q17: GOODEY 2 | S17: McINTOSH | W17: PRAHRAN | X17: 1 | Y17: 0 | Z17: 0 | AA17: 183 | AB17: 125 | AC17: =(AA17/AB17)*100 -> 146.4 | AD17: =(X17*4)+(Z17*2) -> 4
S18: VENUE: PORT MELBOURNE
A19: GEELONG WEST | C19: 3 | D19: 3 | E19: 21 | G19: 10 | H19: 6 | I19: 66 | K19: 14 | L19: 10 | M19: 94 | O19: 20 | P19: 12 | Q19: 132 | S19: FITZPATRICK | W19: COBURG | X19: 1 | Y19: 0 | Z19: 0 | AA19: 118 | AB19: 108 | AC19: =(AA19/AB19)*100 -> 109.25925925925925 | AD19: =(X19*4)+(Z19*2) -> 4
A20: PORT MELBOURNE | C20: 7 | D20: 2 | E20: 44 | G20: 7 | H20: 8 | I20: 50 | K20: 11 | L20: 14 | M20: 80 | O20: 18 | P20: 20 | Q20: 128 | S20: GROOM | W20: GEELONG WEST | X20: 1 | Y20: 0 | Z20: 0 | AA20: 132 | AB20: 128 | AC20: =(AA20/AB20)*100 -> 103.125 | AD20: =(X20*4)+(Z20*2) -> 4
A21: BEST PLAYERS | W21: PORT MELBOURNE | X21: 0 | Y21: 1 | Z21: 0 | AA21: 128 | AB21: 132 | AC21: =(AA21/AB21)*100 -> 96.969696969696969 | AD21: =(X21*4)+(Z21*2) -> 0
A22: GEELONG WEST | C22: TORNEY | F22: BROWNE | I22: KING | L22: DALIHAUS | O22: BERRY | Q22: EVANS | W22: PRESTON | X22: 0 | Y22: 1 | Z22: 0 | AA22: 108 | AB22: 118 | AC22: =(AA22/AB22)*100 -> 91.525423728813564 | AD22: =(X22*4)+(Z22*2) -> 0
A23: PORT MELBOURNE | C23: DERMOTT | F23: CARTER | I23: FEHRING | L23: GOS | O23: O'RILEY | Q23: THOMPSON | W23: DANDENONG | X23: 0 | Y23: 1 | Z23: 0 | AA23: 125 | AB23: 163 | AC23: =(AA23/AB23)*100 -> 76.687116564417181 | AD23: =(X23*4)+(Z23*2) -> 0
A24: GOALKICKERS | W24: FRANKSTON | X24: 0 | Y24: 1 | Z24: 0 | AA24: 96 | AB24: 157 | AC24: =(AA24/AB24)*100 -> 61.146496815286625 | AD24: =(X24*4)+(Z24*2) -> 0
A25: GEELONG WEST | C25: RADOJEVIC 5 | F25: KING 4 | H25: EDDY 3 | J25: BROWNE 2 | M25: RICHARDSON 2 | P25: BERRY 2 | R25: GIBSON 2 | W25: SPRINGVALE | X25: 0 | Y25: 1 | Z25: 0 | AA25: 119 | AB25: 211 | AC25: =(AA25/AB25)*100 -> 56.39810426540285 | AD25: =(X25*4)+(Z25*2) -> 0
A26: PORT MELBOURNE | C26: COOK 5 | F26: O'RILEY 4 | H26: SWAN 3 | J26: COLLINS 2 | M26: ANDERSON 2 | P26: DERMOTT | R26: CARTER | W26: WERRIBEE | X26: 0 | Y26: 1 | Z26: 0 | AA26: 43 | AB26: 184 | AC26: =(AA26/AB26)*100 -> 23.369565217391305 | AD26: =(X26*4)+(Z26*2) -> 0
A28: WILLIAMSTOWN | C28: 3 | D28: 4 | E28: 22 | G28: 8 | H28: 8 | I28: 56 | K28: 16 | L28: 12 | M28: 108 | O28: 24 | P28: 13 | Q28: 157 | S28: VENUE: FRANKSTON
A29: FRANKSTON | C29: 3 | D29: 3 | E29: 21 | G29: 5 | H29: 7 | I29: 37 | K29: 8 | L29: 9 | M29: 57 | O29: 14 | P29: 12 | Q29: 96 | S29: OAKLEY :TORNEY
A30: BEST PLAYERS
A31: WILLIAMSTOWN | C31: KERSHAW | F31: SAIT | I31: FOTHERINGHAM | L31: WHEELER | O31: TOWNS | Q31: DULLARD
A32: FRANKSTON | C32: GEDDES | F32: HALL | I32: HORLER | L32: MARTIN
A33: GOALKICKERS
A34: WILLIAMSTOWN | C34: FOTHERINGHAM 12 | G34: SLEVISON 3 | I34: DULLARD 2 | L34: OWEN 2 | N34: ROSS 2 | P34: WHEELER | R34: SIMMONS | U34: DAVIS
A35: FRANKSTON | C35: BARDOEL 2 | F35: COLE 2 | H35: GEDDES 2 | J35: HOWARTH 2 | M35: HAMILL | O35: HALL | Q35: BELL | R35: HOEST | T35: CZARNECKI | W35: MARTIN
A37: COBURG | C37: 4 | D37: 5 | E37: 29 | G37: 8 | H37: 8 | I37: 56 | K37: 15 | L37: 11 | M37: 101 | O37: 17 | P37: 16 | Q37: 118 | S37: VENUE: COBURG
A38: PRESTON | C38: 4 | D38: 1 | E38: 25 | G38: 10 | H38: 4 | I38: 64 | K38: 11 | L38: 9 | M38: 75 | O38: 16 | P38: 12 | Q38: 108 | S38: VERGONA :MARSHALL
A39: BEST PLAYERS
A40: COBURG | C40: ZANON | F40: COLLINS | I40: RUTTY | L40: FREEMAN | O40: DALGLEISH | R40: ROBERTSON
A41: PRESTON | C41: McKEON | F41: McEWAN | I41: OHLSEN | L41: BRINE | O41: ATKIN
A42: GOALKICKERS
A43: COBURG | C43: HALBERT 3 | E43: KEOGH 3 | G43: PENNINGTON 2 | J43: FREEMAN 2 | M43: DALGLEISH 2 | P43: ALEXANDER | R43: FITZGERALD | V43: RUTTY | X43: EVANS | Z43: DOHNT
A44: PRESTON | C44: OHLSEN 6 | F44: HALAS 3 | H44: McEWAN 2 | J44: VEAL 2 | L44: MARCON | N44: BEER | P44: DUNBAR
A46: CAMBERWELL | C46: 6 | D46: 4 | E46: 40 | G46: 16 | H46: 8 | I46: 104 | K46: 23 | L46: 12 | M46: 150 | O46: 28 | P46: 16 | Q46: 184 | S46: VENUE: WERRIBEE
A47: WERRIBEE | C47: 1 | D47: 2 | E47: 8 | G47: 3 | H47: 3 | I47: 21 | K47: 4 | L47: 6 | M47: 30 | O47: 6 | P47: 7 | Q47: 43 | S47: CASEY :HUTCHINSON
A48: BEST PLAYERS
A49: CAMBERWELL | C49: DAVIDSON | F49: PAGE | I49: CONSTANTINOU | L49: BOTTAMS | O49: STEVENSON | R49: SIDE
A50: WERRIBEE | C50: SIDEROW | F50: RICHARDSON | I50: BARNETT | L50: BROWN | O50: FEDKE | R50: CHRISTIANSEN
A51: GOALKICKERS
A52: CAMBERWELL | C52: STEVENSON 11 | F52: BARNES 7 | H52: ROURKE 3 | J52: GILMORE 2 | M52: SIDE | N52: HICKS | P52: DAVIDSON | R52: PEVITT | T52: CONSTANTINOU
A53: WERRIBEE | C53: DAY 3 | F53: CHRISTIANSEN 2 | J53: BROWN
A55: SANDRINGHAM | C55: 9 | D55: 2 | E55: 56 | G55: 17 | H55: 8 | I55: 110 | K55: 28 | L55: 10 | M55: 178 | O55: 33 | P55: 13 | Q55: 211 | S55: VENUE: SPRINGVALE
A56: SPRINGVALE | C56: 1 | D56: 4 | E56: 10 | G56: 8 | H56: 6 | I56: 54 | K56: 13 | L56: 7 | M56: 85 | O56: 18 | P56: 11 | Q56: 119 | S56: PHILLIPS :STEERE
A57: BEST PLAYERS
A58: SANDRINGHAM | C58: BREWER | F58: MORRISON | I58: BARNETT | L58: HAYES | O58: RICHARDS
A59: SPRINGVALE | C59: ANDERSON | F59: FOWLER | I59: KEAYS | L59: HOWELL | O59: GRAY
A60: GOALKICKERS
A61: SANDRINGHAM | C61: BREWER 10 | F61: MORRISON 10 | I61: BINGHAM 3 | L61: GALLAGHER 3 | O61: FREW 2 | Q61: PEARSON 2 | T61: SIMS | V61: MACLEOD | X61: HETHERINGTON
A62: SPRINGVALE | C62: ANDERSON 7 | F62: STEEL 3 | H62: WOODMAN 2 | K62: GRAY 2 | M62: DUNCAN 2 | P62: HERBERT | R62: CHAPMAN
A64: ROUND 2 | D64: 22ND APRIL | I64: WEATHER | S64: VENUE: GEELONG WEST
D65: 1ST QTR | H65: 2ND QTR | L65: 3RD QTR | P65: FINAL | S65: UMPIRES
A66: GEELONG WEST | C66: 8 | D66: 6 | E66: 54 | G66: 13 | H66: 7 | I66: 85 | K66: 17 | L66: 12 | M66: 114 | O66: 27 | P66: 15 | Q66: 177 | S66: OAKLEY | X66: LADDER | AB66: ROUND | AD66: 2
A67: PRAHRAN | C67: 1 | D67: 0 | E67: 6 | G67: 4 | H67: 7 | I67: 31 | K67: 5 | L67: 7 | M67: 37 | O67: 9 | P67: 8 | Q67: 62 | S67: HUTCHINSON
A68: BEST PLAYERS | W68: TEAM | X68: W | Y68: L | Z68: D | AA68: FOR | AB68: AGST | AC68: % | AD68: PTS
A69: GEELONG WEST | C69: KING | F69: RADOJEVIC | I69: DALIHAUS | L69: GIBSON | O69: BERRY | Q69: NICHOLS
A70: PRAHRAN | C70: GRAMBEAU | F70: PETERING | I70: BICKFORD | W70: CAMBERWELL | X70: 2 | Y70: 0 | Z70: 0 | AA70: 344 | AB70: 117 | AC70: =(AA70/AB70)*100 -> 294.01709401709405 | AD70: =(X70*4)+(Z70*2) -> 8
A71: GOALKICKERS | K71: FARQUARHARSON | N71: GIBSON | P71: RICHARDSON | S71: BERRY | W71: SANDRINGHAM | X71: 2 | Y71: 0 | Z71: 0 | AA71: 393 | AB71: 239 | AC71: =(AA71/AB71)*100 -> 164.43514644351464 | AD71: =(X71*4)+(Z71*2) -> 8
A72: GEELONG WEST | C72: RADOJEVIC 9 | F72: NICHOLS 4 | I72: DOYLE 2 | K72: KING 2 | M72: BROWNE 2 | O72: HIGGINS 2 | Q72: EDDY 2 | W72: GEELONG WEST | X72: 2 | Y72: 0 | Z72: 0 | AA72: 309 | AB72: 190 | AC72: =(AA72/AB72)*100 -> 162.63157894736841 | AD72: =(X72*4)+(Z72*2) -> 8
A73: PRAHRAN | C73: YOUNG 4 | F73: CATTOGGIO 2 | I73: SOULOS | K73: RAYNER | M73: McDONALD | W73: WILLIAMSTOWN | X73: 2 | Y73: 0 | Z73: 0 | AA73: 266 | AB73: 187 | AC73: =(AA73/AB73)*100 -> 142.24598930481284 | AD73: =(X73*4)+(Z73*2) -> 8
A75: SANDRINGHAM | C75: 7 | D75: 4 | E75: 46 | G75: 14 | H75: 7 | I75: 91 | K75: 21 | L75: 14 | M75: 140 | O75: 27 | P75: 20 | Q75: 182 | S75: VENUE: BEACH ROAD | W75: PRESTON | X75: 1 | Y75: 1 | Z75: 0 | AA75: 226 | AB75: 196 | AC75: =(AA75/AB75)*100 -> 115.30612244897959 | AD75: =(X75*4)+(Z75*2) -> 4
A76: PORT MELBOURNE | C76: 0 | D76: 0 | E76: 0 | G76: 8 | H76: 4 | I76: 52 | K76: 10 | L76: 7 | M76: 67 | O76: 18 | P76: 12 | Q76: 120 | W76: COBURG | X76: 1 | Y76: 1 | Z76: 0 | AA76: 209 | AB76: 217 | AC76: =(AA76/AB76)*100 -> 96.313364055299544 | AD76: =(X76*4)+(Z76*2) -> 4
A77: BEST PLAYERS | W77: DANDENONG | X77: 1 | Y77: 1 | Z77: 0 | AA77: 220 | AB77: 230 | AC77: =(AA77/AB77)*100 -> 95.652173913043484 | AD77: =(X77*4)+(Z77*2) -> 4
A78: SANDRINGHAM | C78: BREWER | F78: RICHARDS | I78: BARNETT | L78: SIMS | O78: HAYES | W78: PRAHRAN | X78: 1 | Y78: 1 | Z78: 0 | AA78: 245 | AB78: 302 | AC78: =(AA78/AB78)*100 -> 81.125827814569533 | AD78: =(X78*4)+(Z78*2) -> 4
A79: PORT MELBOURNE | C79: COOPER | F79: CHADBAND | I79: COLLINS | L79: CARTER | O79: COOK | W79: PORT MELBOURNE | X79: 0 | Y79: 2 | Z79: 0 | AA79: 248 | AB79: 314 | AC79: =(AA79/AB79)*100 -> 78.98089171974523 | AD79: =(X79*4)+(Z79*2) -> 0
A80: GOALKICKERS | O80: CONSIDINE | Q80: BINGHAM | W80: SPRINGVALE | X80: 0 | Y80: 2 | Z80: 0 | AA80: 197 | AB80: 329 | AC80: =(AA80/AB80)*100 -> 59.878419452887542 | AD80: =(X80*4)+(Z80*2) -> 0
A81: SANDRINGHAM | C81: BREWER 8 | E81: FREW 4 | G81: MORRISON 3 | J81: GALLAGHER 3 | M81: FITZPATRICK 3 | P81: PEARSON 2 | R81: MACLEOD 2 | W81: FRANKSTON | X81: 0 | Y81: 2 | Z81: 0 | AA81: 170 | AB81: 317 | AC81: =(AA81/AB81)*100 -> 53.627760252365931 | AD81: =(X81*4)+(Z81*2) -> 0
A82: PORT MELBOURNE | C82: COOK 6 | E82: HOY 3 | G82: LOVE 2 | I82: CARTER 2 | K82: HARKINS 2 | M82: BOOTH | O82: O'RILEY | Q82: ANDERSON | W82: WERRIBEE | X82: 0 | Y82: 2 | Z82: 0 | AA82: 110 | AB82: 279 | AC82: =(AA82/AB82)*100 -> 39.426523297491038 | AD82: =(X82*4)+(Z82*2) -> 0
A84: PRESTON | C84: 1 | D84: 0 | E84: 6 | G84: 5 | H84: 3 | I84: 33 | K84: 9 | L84: 8 | M84: 62 | O84: 17 | P84: 16 | Q84: 118 | S84: VENUE: PRESTON
A85: SPRINGVALE | C85: 4 | D85: 5 | E85: 29 | G85: 6 | H85: 6 | I85: 42 | K85: 10 | L85: 11 | M85: 71 | O85: 11 | P85: 12 | Q85: 78 | S85: CASEY :FITZPATRICK
A86: BEST PLAYERS
A87: PRESTON | C87: SALVADORE | F87: WIGHT | I87: ATKIN | L87: SHAW | O87: McKEON | R87: BRINE
A88: SPRINGVALE | C88: KING | F88: DEMPSTER | I88: STEEL | L88: HERBERT | O88: FOWLER
A89: GOALKICKERS
A90: PRESTON | C90: JORDAN 4 | F90: OHLSEN 2 | H90: SALVADORE 2 | K90: VEAL 2 | M90: FROST 2 | O90: BRINE | Q90: SHAW | R90: DUNBAR | U90: ANDERSON | X90: MARCON
A91: SPRINGVALE | C91: CARROLL 3 | F91: CADDAYE 2 | I91: HOLDEN 2 | K91: CHAPMAN | M91: ANDERSON | P91: DUNCAN | R91: HERBERT
A93: DANDENONG | C93: 5 | D93: 7 | E93: 37 | G93: 8 | H93: 10 | I93: 58 | K93: 12 | L93: 16 | M93: 88 | O93: 13 | P93: 17 | Q93: 95 | S93: VENUE: DANDENONG
A94: WERRIBEE | C94: 0 | D94: 0 | E94: 0 | G94: 4 | H94: 10 | I94: 34 | K94: 4 | L94: 11 | M94: 35 | O94: 8 | P94: 19 | Q94: 67 | S94: GROOM :STEERE
A95: BEST PLAYERS
A96: DANDENONG | C96: KNIGHT | F96: DE KONNING | I96: BASS | L96: MILLANE | O96: HALL
A97: WERRIBEE | C97: HOPKIN | F97: SIDEROW | I97: CORDY | L97: BROWN | O97: FREEMAN
A98: GOALKICKERS
A99: DANDENONG | C99: ORSBORNE 2 | F99: KNIGHT 2 | H99: GOODEY 2 | J99: HALL | L99: POLA | N99: CROOK | P99: McINTOSH | R99: KEE | T99: WRIGHT | W99: HAMILTON
A100: WERRIBEE | C100: GOODWIN 3 | F100: BROWN 2 | I100: CHRISTIANSEN 2 | M100: BURNETT
A102: WILLIAMSTOWN | C102: 4 | D102: 5 | E102: 29 | G102: 7 | H102: 9 | I102: 51 | K102: 13 | L102: 17 | M102: 95 | O102: 15 | P102: 19 | Q102: 109 | S102: VENUE: WILLIAMSTOWN
A103: COBURG | C103: 1 | D103: 3 | E103: 9 | G103: 6 | H103: 6 | I103: 42 | K103: 8 | L103: 8 | M103: 56 | O103: 13 | P103: 13 | Q103: 91 | S103: BUDGE :MAY
A104: BEST PLAYERS
A105: WILLIAMSTOWN | C105: KERSHAW | F105: DULLARD | I105: SINNOTT | L105: SAIT | O105: SWANN
A106: COBURG | C106: DALGLEISH | F106: COLLINS | I106: ROBERTSON | L106: DOHNT | O106: ZANON | R106: ALLISON
A107: GOALKICKERS
A108: WILLIAMSTOWN | C108: FOTHERINGHAM 5 | G108: SIMMONS 5 | J108: SAIT 2 | L108: DULLARD | N108: ROSS | P108: SLEVISON
A109: COBURG | C109: KEOGH 2 | E109: DOHNT 2 | G109: TULLOCH 2 | I109: HALBERT | K109: COLLINS | M109: PENNINGTON | P109: EVANS | R109: HARBINSON | V109: FREEMAN | X109: ROBERTSON
A111: CAMBERWELL | C111: 5 | D111: 1 | E111: 31 | G111: 11 | H111: 8 | I111: 74 | K111: 12 | L111: 13 | M111: 85 | O111: 23 | P111: 22 | Q111: 160 | S111: VENUE: CAMBERWELL
A112: FRANKSTON | C112: 4 | D112: 5 | E112: 29 | G112: 8 | H112: 6 | I112: 54 | K112: 10 | L112: 8 | M112: 68 | O112: 11 | P112: 8 | Q112: 74 | S112: MORGAN ;PHILLIPS
A113: BEST PLAYERS
A114: CAMBERWELL | C114: PEVITT | F114: DANS | I114: WILKINSON | L114: BOTTOMS | O114: ROURKE
A115: FRANKSTON | C115: HORLER | F115: BELL
A116: GOALKICKERS
A117: CAMBERWELL | C117: DANS 4 | E117: HICKS 3 | G117: BARNES 3 | I117: TURNER 2 | K117: STEVENSON 2 | N117: WILKINSON 2 | Q117: SIDE 2 | R117: DAVIDSON | U117: CONSTANTINOU | X117: DAWSON | AA117: ROURKE | AC117: TOVAG
A118: FRANKSTON | C118: JONES 3 | F118: CALLAGHAN 3 | I118: DUNBAR | K118: HALL | M118: BELL | N118: DALGLEISH | Q118: MARTIN
A120: ROUND 3 | D120: 29TH APRIL | I120: WEATHER | S120: VENUE: PORT MELBOURNE
D121: 1ST QTR | H121: 2ND QTR | L121: 3RD QTR | P121: FINAL | S121: UMPIRES
A122: PRESTON | C122: 3 | D122: 4 | E122: 22 | G122: 9 | H122: 9 | I122: 63 | K122: 13 | L122: 13 | M122: 91 | O122: 15 | P122: 14 | Q122: 104 | S122: OAKLEY | X122: LADDER | AB122: ROUND | AD122: 3
A123: PORT MELBOURNE | C123: 5 | D123: 3 | E123: 33 | G123: 7 | H123: 8 | I123: 50 | K123: 9 | L123: 11 | M123: 65 | O123: 14 | P123: 14 | Q123: 98 | S123: PHILLIPS
A124: BEST PLAYERS | W124: TEAM | X124: W | Y124: L | Z124: D | AA124: FOR | AB124: AGST | AC124: % | AD124: PTS
A125: PRESTON | C125: WIGHT | F125: WARREN | I125: BRINE | L125: SHAW | N125: SALVADORE | R125: BUX
A126: PORT MELBOURNE | C126: CHADBAND | F126: CARTER | I126: RODDA | L126: HARKINS | N126: CARLILE | W126: CAMBERWELL | X126: 3 | Y126: 0 | Z126: 0 | AA126: 479 | AB126: 215 | AC126: =(AA126/AB126)*100 -> 222.7906976744186 | AD126: =(X126*4)+(Z126*2) -> 12
A127: GOALKICKERS | Q127: WIGHT | W127: GEELONG WEST | X127: 3 | Y127: 0 | Z127: 0 | AA127: 505 | AB127: 269 | AC127: =(AA127/AB127)*100 -> 187.73234200743494 | AD127: =(X127*4)+(Z127*2) -> 12
A128: PRESTON | C128: McEWAN 3 | E128: WARREN 2 | G128: ATKIN 2 | I128: BEER 2 | K128: SALVADORE 2 | N128: OHLSEN | P128: SHAW | R128: JORDAN | W128: SANDRINGHAM | X128: 3 | Y128: 0 | Z128: 0 | AA128: 567 | AB128: 340 | AC128: =(AA128/AB128)*100 -> 166.76470588235296 | AD128: =(X128*4)+(Z128*2) -> 12
A129: PORT MELBOURNE | C129: COOK 3 | E129: LOVE 3 | G129: HOY 2 | I129: RODDA 2 | K129: HARKINS 2 | M129: IRWIN | O129: CHADBAND | W129: WILLIAMSTOWN | X129: 3 | Y129: 0 | Z129: 0 | AA129: 434 | AB129: 306 | AC129: =(AA129/AB129)*100 -> 141.83006535947712 | AD129: =(X129*4)+(Z129*2) -> 12
S130: VENUE: FRANKSTON
A131: FRANKSTON | C131: 5 | D131: 2 | E131: 32 | G131: 9 | H131: 10 | I131: 64 | K131: 19 | L131: 16 | M131: 130 | O131: 26 | P131: 21 | Q131: 177 | S131: BUDGE | W131: PRESTON | X131: 2 | Y131: 1 | Z131: 0 | AA131: 330 | AB131: 294 | AC131: =(AA131/AB131)*100 -> 112.24489795918366 | AD131: =(X131*4)+(Z131*2) -> 8
A132: WERRIBEE | C132: 6 | D132: 1 | E132: 37 | G132: 8 | H132: 5 | I132: 53 | K132: 11 | L132: 5 | M132: 71 | O132: 13 | P132: 7 | Q132: 85 | S132: VERGONA | W132: COBURG | X132: 1 | Y132: 2 | Z132: 0 | AA132: 307 | AB132: 352 | AC132: =(AA132/AB132)*100 -> 87.215909090909093 | AD132: =(X132*4)+(Z132*2) -> 4
A133: BEST PLAYERS | W133: FRANKSTON | X133: 1 | Y133: 2 | Z133: 0 | AA133: 347 | AB133: 402 | AC133: =(AA133/AB133)*100 -> 86.318407960199011 | AD133: =(X133*4)+(Z133*2) -> 4
A134: FRANKSTON | C134: GEDDES | F134: JONES | I134: CZARNECKI | L134: THOMAS | O134: BOYD | Q134: BELL | W134: PRAHRAN | X134: 1 | Y134: 2 | Z134: 0 | AA134: 346 | AB134: 476 | AC134: =(AA134/AB134)*100 -> 72.689075630252091 | AD134: =(X134*4)+(Z134*2) -> 4
A135: WERRIBEE | C135: BURNETT | F135: BROWN | I135: REDENBACH | L135: CHRISTIANSEN | W135: DANDENONG | X135: 1 | Y135: 2 | Z135: 0 | AA135: 299 | AB135: 426 | AC135: =(AA135/AB135)*100 -> 70.187793427230048 | AD135: =(X135*4)+(Z135*2) -> 4
A136: GOALKICKERS | P136: HALL | R136: BOYD | W136: PORT MELBOURNE | X136: 0 | Y136: 3 | Z136: 0 | AA136: 346 | AB136: 418 | AC136: =(AA136/AB136)*100 -> 82.775119617224874 | AD136: =(X136*4)+(Z136*2) -> 0
A137: FRANKSTON | C137: JONES 9 | E137: ROGERSON 5 | H137: BARDOEL 3 | J137: MEMBREY 2 | M137: THOMAS 2 | O137: CALLAGHAN 2 | R137: DUNBAR | W137: SPRINGVALE | X137: 0 | Y137: 3 | Z137: 0 | AA137: 316 | AB137: 497 | AC137: =(AA137/AB137)*100 -> 63.581488933601605 | AD137: =(X137*4)+(Z137*2) -> 0
A138: WERRIBEE | C138: BROWN 4 | E138: P SMITH 3 | H138: BURNETT 2 | K138: CHRISTIANSEN | N138: BREEN | P138: FREEMAN | S138: BONAT | W138: WERRIBEE | X138: 0 | Y138: 3 | Z138: 0 | AA138: 195 | AB138: 456 | AC138: =(AA138/AB138)*100 -> 42.763157894736842 | AD138: =(X138*4)+(Z138*2) -> 0
A140: WILLIAMSTOWN | C140: 7 | D140: 5 | E140: 47 | G140: 13 | H140: 8 | I140: 86 | K140: 20 | L140: 12 | M140: 132 | O140: 25 | P140: 18 | Q140: 168 | S140: VENUE: SPRINGVALE
A141: SPRINGVALE | C141: 3 | D141: 3 | E141: 21 | G141: 9 | H141: 7 | I141: 61 | K141: 15 | L141: 10 | M141: 100 | O141: 18 | P141: 11 | Q141: 119 | S141: GROOM :HUTCHINSON
A142: BEST PLAYERS
A143: WILLIAMSTOWN | C143: DULLARD | F143: KERSHAW | I143: FOTHERINGHAM | L143: DAVIS | O143: McTAGGART | R143: WHEELER
A144: SPRINGVALE | C144: HOLDEN | F144: SMITH | I144: CARROLL | L144: DEMPSTER | O144: BRAND
A145: GOALKICKERS
A146: WILLIAMSTOWN | C146: FOTHERINGHAM 8 | F146: DULLARD 6 | I146: ROSS 3 | K146: DAVIS 2 | M146: SAIT 2 | O146: SIMMONS 2 | Q146: HUMMEL | S146: WHEELER
A147: SPRINGVALE | C147: CARROLL 6 | F147: CHAPMAN 2 | I147: ANDERSON 2 | L147: STEEL 2 | N147: HOLDEN 2 | Q147: HERBERT | S147: SMITH | U147: HOWELL | X147: GRAY
A149: GEELONG WEST | C149: 6 | D149: 6 | E149: 42 | G149: 11 | H149: 16 | I149: 82 | K149: 23 | L149: 19 | M149: 157 | O149: 29 | P149: 22 | Q149: 196 | S149: VENUE: GEELONG WEST
A150: DANDENONG | C150: 1 | D150: 3 | E150: 9 | G150: 2 | H150: 6 | I150: 18 | K150: 3 | L150: 12 | M150: 30 | O150: 11 | P150: 13 | Q150: 79 | S150: CASEY :MORGAN
A151: BEST PLAYERS
A152: GEELONG WEST | C152: BROWNE | F152: HIGGINS | I152: EDDY | L152: WATSON | O152: NICHOLS | Q152: DALIHAUS
A153: DANDENONG | C153: HICKEY | F153: McGUINNESS | I153: KNIGHT | L153: DE KONNING | O153: HALL | Q153: BASS
A154: GOALKICKERS
A155: GEELONG WEST | C155: BROWNE 10 | F155: NICHOLS 6 | I155: EDDY 5 | K155: RICHARDSON 4 | N155: RADOJEVIC | Q155: WILSON | S155: EVANS | U155: BERRY
A156: DANDENONG | C156: HALL 5 | F156: CROOK 2 | H156: WRIGHT 2 | J156: POLA | L156: HENWOOD
A158: SANDRINGHAM | C158: 9 | D158: 1 | E158: 55 | G158: 12 | H158: 5 | I158: 77 | K158: 16 | L158: 11 | M158: 107 | O158: 27 | P158: 12 | Q158: 174 | S158: VENUE: TOORAK PARK
A159: PRAHRAN | C159: 7 | D159: 2 | E159: 44 | G159: 9 | H159: 3 | I159: 57 | K159: 13 | L159: 5 | M159: 83 | O159: 15 | P159: 11 | Q159: 101 | S159: MAY :FITZPATRICK
A160: BEST PLAYERS
A161: SANDRINGHAM | C161: MORRISON | F161: CONSIDINE | I161: HART | L161: LYONS | O161: HAYES
A162: PRAHRAN | C162: WRIGHT | F162: McNAMARA | I162: REED
A163: GOALKICKERS
A164: SANDRINGHAM | C164: MORRISON 11 | F164: BINGHAM 5 | I164: GALLAGHER 3 | L164: MACLEOD 2 | N164: FREW 2 | P164: RICHARDS | R164: FITZPATRICK | V164: HETHERINGTON | X164: HART
A165: PRAHRAN | C165: SOULOS 2 | F165: STONE 2 | H165: CATTOGGIO 2 | K165: McNAMARA 2 | N165: YOUNG 2 | P165: TAYLOR 2 | R165: GRAMBEAU | V165: GASTON | X165: CAVANOUGH
A167: CAMBERWELL | C167: 4 | D167: 7 | E167: 31 | G167: 9 | H167: 12 | I167: 66 | K167: 14 | L167: 14 | M167: 98 | O167: 20 | P167: 15 | Q167: 135 | S167: VENUE: COBURG
A168: COBURG | C168: 4 | D168: 4 | E168: 28 | G168: 5 | H168: 5 | I168: 35 | K168: 10 | L168: 10 | M168: 70 | O168: 14 | P168: 14 | Q168: 98 | S168: MARCY :TORNEY
A169: BEST PLAYERS
A170: CAMBERWELL | C170: DAVIDSON | F170: CONSTANTINOU | I170: FARMER | L170: PEVITT | O170: EVANS | Q170: TURNER
A171: COBURG | C171: EVANS | F171: ZANON | I171: LAIDLER | L171: DOHNT | O171: KEOGH | Q171: DALGLEISH
A172: GOALKICKERS
A173: CAMBERWELL | C173: HICKS 3 | E173: TURNER 3 | G173: BARNES 3 | I173: STEVENSON 2 | L173: DAVIDSON 2 | O173: DODIG 2 | Q173: MAILING 2 | T173: SIDE | W173: CONSTANTINOU
A174: COBURG | C174: EVANS 3 | E174: CLEARY 2 | G174: ALEXANDER | J174: ALLISON | L174: ZANON | N174: COLLINS | P174: KEOGH | R174: PENNINGTON | W174: FITZGERALD | X174: FREEMAN | AA174: TULLOCH
A176: ROUND 4 | D176: 6TH MAY | I176: WEATHER | S176: VENUE: DANDENONG
D177: 1ST QTR | H177: 2ND QTR | L177: 3RD QTR | P177: FINAL | S177: UMPIRES
A178: FRANKSTON | C178: 4 | D178: 6 | E178: 30 | G178: 11 | H178: 8 | I178: 74 | K178: 17 | L178: 11 | M178: 113 | O178: 20 | P178: 17 | Q178: 137 | S178: MAY | X178: LADDER | AB178: ROUND | AD178: 4
A179: DANDENONG | C179: 1 | D179: 2 | E179: 8 | G179: 4 | H179: 5 | I179: 29 | K179: 8 | L179: 7 | M179: 55 | O179: 10 | P179: 11 | Q179: 71 | S179: MARSHALL
A180: BEST PLAYERS | W180: TEAM | X180: W | Y180: L | Z180: D | AA180: FOR | AB180: AGST | AC180: % | AD180: PTS
A181: FRANKSTON | C181: MEMBREY | F181: GEDDES | I181: GAMBLE | L181: HORLER | O181: BEATON | Q181: FRANCIS
A182: DANDENONG | C182: BASS | F182: HALL | I182: KNIGHT | W182: CAMBERWELL | X182: 4 | Y182: 0 | Z182: 0 | AA182: 635 | AB182: 327 | AC182: =(AA182/AB182)*100 -> 194.18960244648318 | AD182: =(X182*4)+(Z182*2) -> 16
A183: GOALKICKERS | W183: GEELONG WEST | X183: 4 | Y183: 0 | Z183: 0 | AA183: 647 | AB183: 377 | AC183: =(AA183/AB183)*100 -> 171.61803713527851 | AD183: =(X183*4)+(Z183*2) -> 16
A184: FRANKSTON | C184: JONES 7 | E184: LONGHAM 3 | H184: MEMBREY 3 | J184: GEDDES 2 | L184: BELL | M184: BARDOEL | O184: ROGERSON | Q184: BEATON | S184: DUNBAR | W184: SANDRINGHAM | X184: 3 | Y184: 1 | Z184: 0 | AA184: 675 | AB184: 482 | AC184: =(AA184/AB184)*100 -> 140.04149377593359 | AD184: =(X184*4)+(Z184*2) -> 12
A185: DANDENONG | C185: CROOK 4 | F185: WRIGHT 2 | I185: KNIGHT 2 | K185: HICKEY | M185: HALL | W185: PRESTON | X185: 3 | Y185: 1 | Z185: 0 | AA185: 449 | AB185: 382 | AC185: =(AA185/AB185)*100 -> 117.5392670157068 | AD185: =(X185*4)+(Z185*2) -> 12
S186: VENUE: WERRIBEE
A187: COBURG | C187: 4 | D187: 8 | E187: 32 | G187: 9 | H187: 15 | I187: 69 | K187: 11 | L187: 25 | M187: 91 | O187: 16 | P187: 32 | Q187: 128 | S187: CASEY | W187: WILLIAMSTOWN | X187: 3 | Y187: 1 | Z187: 0 | AA187: 563 | AB187: 485 | AC187: =(AA187/AB187)*100 -> 116.08247422680414 | AD187: =(X187*4)+(Z187*2) -> 12
A188: WERRIBEE | C188: 1 | D188: 3 | E188: 9 | G188: 5 | H188: 8 | I188: 38 | K188: 9 | L188: 10 | M188: 64 | O188: 12 | P188: 13 | Q188: 85 | S188: FITZPATRICK | W188: FRANKSTON | X188: 2 | Y188: 2 | Z188: 0 | AA188: 484 | AB188: 473 | AC188: =(AA188/AB188)*100 -> 102.32558139534885 | AD188: =(X188*4)+(Z188*2) -> 8
A189: BEST PLAYERS | W189: COBURG | X189: 2 | Y189: 2 | Z189: 0 | AA189: 435 | AB189: 437 | AC189: =(AA189/AB189)*100 -> 99.54233409610984 | AD189: =(X189*4)+(Z189*2) -> 8
A190: COBURG | C190: HERBERT | F190: HARBINSON | I190: PEARCE | L190: TULLOCH | O190: ALLISON | Q190: ALEXANDER | W190: PORT MELBOURNE | X190: 1 | Y190: 3 | Z190: 0 | AA190: 525 | AB190: 547 | AC190: =(AA190/AB190)*100 -> 95.978062157221217 | AD190: =(X190*4)+(Z190*2) -> 4
A191: WERRIBEE | C191: CORDY | F191: BROWN | I191: BONAT | L191: REDENBACH | O191: HOPKINS | W191: PRAHRAN | X191: 1 | Y191: 3 | Z191: 0 | AA191: 434 | AB191: 595 | AC191: =(AA191/AB191)*100 -> 72.941176470588232 | AD191: =(X191*4)+(Z191*2) -> 4
A192: GOALKICKERS | W192: DANDENONG | X192: 1 | Y192: 3 | Z192: 0 | AA192: 370 | AB192: 563 | AC192: =(AA192/AB192)*100 -> 65.719360568383649 | AD192: =(X192*4)+(Z192*2) -> 4
A193: COBURG | C193: PEARCE 4 | F193: ZANON 3 | H193: COLLINS 2 | J193: DALGLEISH 2 | M193: TULLOCH 2 | O193: ALLISON | Q193: FITZGERALD | T193: EVANS | W193: SPRINGVALE | X193: 0 | Y193: 4 | Z193: 0 | AA193: 428 | AB193: 653 | AC193: =(AA193/AB193)*100 -> 65.543644716692199 | AD193: =(X193*4)+(Z193*2) -> 0
A194: WERRIBEE | C194: BROWN 4 | F194: SMITH 2 | H194: GUDDE 2 | J194: DAY 2 | L194: COOPER | N194: RICHARDSON | W194: WERRIBEE | X194: 0 | Y194: 4 | Z194: 0 | AA194: 280 | AB194: 584 | AC194: =(AA194/AB194)*100 -> 47.945205479452049 | AD194: =(X194*4)+(Z194*2) -> 0
A196: CAMBERWELL | C196: 2 | D196: 3 | E196: 15 | G196: 10 | H196: 12 | I196: 72 | K196: 13 | L196: 15 | M196: 93 | O196: 23 | P196: 18 | Q196: 156 | S196: VENUE: CAMBERWELL
A197: SPRINGVALE | C197: 5 | D197: 7 | E197: 37 | G197: 9 | H197: 7 | I197: 61 | K197: 13 | L197: 15 | M197: 93 | O197: 16 | P197: 16 | Q197: 112 | S197: PHILLIPS ;OAKLEY
A198: BEST PLAYERS
A199: CAMBERWELL | C199: WILKINSON | F199: ROURKE | I199: TURNER | L199: EVANS | O199: HICKS | Q199: BURMEISTER
A200: SPRINGVALE | C200: DEMPSTER | F200: ANDERSON | I200: FOWLER | L200: HOLDEN | O200: BRAND | Q200: KING
A201: GOALKICKERS
A202: CAMBERWELL | C202: STEVENSON 5 | F202: DANS 4 | H202: MAILING 3 | J202: BARNES 2 | L202: ROURKE 2 | N202: TURNER 2 | P202: WILKINSON | R202: DAVIDSON | U202: HICKS | W202: DODIG | X202: YOUNG
A203: SPRINGVALE | C203: CADDAYE 4 | F203: ANSON 3 | H203: STEEL 2 | J203: CARROLL 2 | L203: CHAPMAN | N203: NEWMAN | P203: SMITH | R203: HOLDEN | U203: BRAND
A205: PORT MELBOURNE | C205: 12 | D205: 8 | E205: 80 | G205: 14 | H205: 12 | I205: 96 | K205: 22 | L205: 18 | M205: 150 | O205: 26 | P205: 23 | Q205: 179 | S205: VENUE: WILLIAMSTOWN
A206: WILLIAMSTOWN | C206: 2 | D206: 1 | E206: 13 | G206: 11 | H206: 7 | I206: 73 | K206: 17 | L206: 11 | M206: 113 | O206: 19 | P206: 15 | Q206: 129 | S206: TORNEY :VERGONA
A207: BEST PLAYERS
A208: PORT MELBOURNE | C208: FEHRING | F208: SWAN | I208: COLLINS | L208: CARTER | O208: CLARKE | Q208: O'RILEY
A209: WILLIAMSTOWN | C209: SIMMONS | F209: KERSHAW | I209: McTAGGART | L209: SAIT | O209: ROSS
A210: GOALKICKERS
A211: PORT MELBOURNE | C211: O'RILEY 4 | E211: COOK 4 | G211: LOVE 4 | I211: GOSS 4 | K211: HARKINS 4 | M211: SWAN 2 | O211: RODDA 2 | Q211: ANDERSON 2
A212: WILLIAMSTOWN | C212: FOTHERINGHAM 7 | G212: HUMMEL 5 | I212: SIMMONS 3 | L212: ROSS | N212: DULLARD | P212: SAIT | R212: PERCY
A214: PRESTON | C214: 1 | D214: 3 | E214: 9 | G214: 6 | H214: 6 | I214: 42 | K214: 11 | L214: 9 | M214: 75 | O214: 18 | P214: 11 | Q214: 119 | S214: VENUE: PRESTON
A215: PRAHRAN | C215: 2 | D215: 3 | E215: 15 | G215: 8 | H215: 4 | I215: 52 | K215: 11 | L215: 7 | M215: 73 | O215: 13 | P215: 10 | Q215: 88 | S215: STEERE :MORGAN
A216: BEST PLAYERS
A217: PRESTON | C217: BRINE | F217: ATKIN | I217: SALVADORE | L217: DUNBAR | O217: WARREN | R217: McKEON
A218: PRAHRAN | C218: PARKER | F218: WRIGHT | I218: JEFFREY | L218: BICKFORD
A219: GOALKICKERS
A220: PRESTON | C220: HALAS 5 | F220: DUNBAR 3 | I220: DWYER 3 | K220: WARREN 2 | M220: SALVADORE 2 | P220: OHLSEN | R220: McEWAN | U220: SHAW
A221: PRAHRAN | C221: McNAMARA 2 | F221: CATTOGGIO 2 | I221: STEPHENS 2 | L221: CAVANOUGH 2 | O221: GRAMBEAU | Q221: SOULOS | S221: WRIGHT | V221: GILES | X221: BORELLO
A223: GEELONG WEST | C223: 3 | D223: 1 | E223: 19 | G223: 11 | H223: 4 | I223: 70 | K223: 16 | L223: 9 | M223: 105 | O223: 21 | P223: 16 | Q223: 142 | S223: VENUE: BEACH ROAD
A224: SANDRINGHAM | C224: 5 | D224: 2 | E224: 32 | G224: 8 | H224: 6 | I224: 54 | K224: 13 | L224: 9 | M224: 87 | O224: 16 | P224: 12 | Q224: 108 | S224: BUDGE :MARCY
A225: BEST PLAYERS
A226: GEELONG WEST | C226: KRANJC | F226: GIBSON | I226: DALIHAUS | L226: WATSON | O226: BROWNE | R226: EDDY
A227: SANDRINGHAM | C227: BINGHAM | F227: GALLAGHER | I227: RICHARDS | L227: BEUS | O227: HAYES
A228: GOALKICKERS
A229: GEELONG WEST | C229: BROWNE 4 | F229: RICHARDSON 4 | I229: EDDY 4 | K229: NICHOLS 3 | M229: KING 2 | O229: TOULMIN 2 | Q229: HIGGINS | S229: TORNEY
A230: SANDRINGHAM | C230: BREWER 5 | F230: GALLAGHER 3 | I230: MACLEOD 2 | L230: MANNIX 2 | N230: BINGHAM | Q230: MORRISON | S230: HART | U230: SIMS
A232: ROUND 5 | D232: 20TH MAY | I232: WEATHER | S232: VENUE: SPRINGVALE
D233: 1ST QTR | H233: 2ND QTR | L233: 3RD QTR | P233: FINAL | S233: UMPIRES
A234: SPRINGVALE | C234: 4 | D234: 3 | E234: 27 | G234: 9 | H234: 6 | I234: 60 | K234: 14 | L234: 9 | M234: 93 | O234: 25 | P234: 14 | Q234: 164 | S234: MAY | X234: LADDER | AB234: ROUND | AD234: 5
A235: WERRIBEE | C235: 5 | D235: 4 | E235: 34 | G235: 8 | H235: 4 | I235: 52 | K235: 10 | L235: 6 | M235: 66 | O235: 12 | P235: 7 | Q235: 79 | S235: TORNEY
A236: BEST PLAYERS | W236: TEAM | X236: W | Y236: L | Z236: D | AA236: FOR | AB236: AGST | AC236: % | AD236: PTS
A237: SPRINGVALE | C237: HOLDEN | F237: GRAY | I237: TONKIN | L237: NEWMAN | O237: DEMPSTER | R237: SMITH
A238: WERRIBEE | C238: GRAY | F238: BURNETT | I238: BONAT | L238: HOPKINS | O238: GUDDE | R238: PARKES | W238: GEELONG WEST | X238: 5 | Y238: 0 | Z238: 0 | AA238: 790 | AB238: 508 | AC238: =(AA238/AB238)*100 -> 155.51181102362204 | AD238: =(X238*4)+(Z238*2) -> 20
A239: GOALKICKERS | W239: SANDRINGHAM | X239: 4 | Y239: 1 | Z239: 0 | AA239: 959 | AB239: 601 | AC239: =(AA239/AB239)*100 -> 159.56738768718802 | AD239: =(X239*4)+(Z239*2) -> 16
A240: SPRINGVALE | C240: CARROLL 7 | F240: NEWMAN 4 | I240: SMITH 4 | K240: GRAY 4 | M240: HERBERT 2 | O240: WALTER 2 | Q240: CADDAYE | S240: FOWLER | W240: CAMBERWELL | X240: 4 | Y240: 1 | Z240: 0 | AA240: 745 | AB240: 493 | AC240: =(AA240/AB240)*100 -> 151.1156186612576 | AD240: =(X240*4)+(Z240*2) -> 16
A241: WERRIBEE | C241: BURNETT 4 | F241: CHRISTIANSEN 2 | J241: CORDY 2 | L241: REDENBACH | O241: BROWN | Q241: DAY | R241: GUDDE | W241: WILLIAMSTOWN | X241: 4 | Y241: 1 | Z241: 0 | AA241: 777 | AB241: 642 | AC241: =(AA241/AB241)*100 -> 121.02803738317758 | AD241: =(X241*4)+(Z241*2) -> 16
S242: VENUE: BEACH ROAD
A243: SANDRINGHAM | C243: 8 | D243: 5 | E243: 53 | G243: 18 | H243: 9 | I243: 117 | K243: 28 | L243: 16 | M243: 184 | O243: 44 | P243: 20 | Q243: 284 | S243: TORNEY | W243: FRANKSTON | X243: 3 | Y243: 2 | Z243: 0 | AA243: 635 | AB243: 567 | AC243: =(AA243/AB243)*100 -> 111.99294532627866 | AD243: =(X243*4)+(Z243*2) -> 12
A244: DANDENONG | C244: 5 | D244: 3 | E244: 33 | G244: 11 | H244: 6 | I244: 72 | K244: 14 | L244: 6 | M244: 90 | O244: 17 | P244: 7 | Q244: 119 | S244: STEERE | W244: PRESTON | X244: 3 | Y244: 2 | Z244: 0 | AA244: 580 | AB244: 525 | AC244: =(AA244/AB244)*100 -> 110.47619047619048 | AD244: =(X244*4)+(Z244*2) -> 12
A245: BEST PLAYERS | W245: PORT MELBOURNE | X245: 2 | Y245: 3 | Z245: 0 | AA245: 691 | AB245: 657 | AC245: =(AA245/AB245)*100 -> 105.17503805175039 | AD245: =(X245*4)+(Z245*2) -> 8
A246: SANDRINGHAM | C246: BREWER | F246: MORRISON | I246: MACLEOD | L246: MANNIX | O246: PEARSON | R246: SMITH | W246: COBURG | X246: 2 | Y246: 3 | Z246: 0 | AA246: 529 | AB246: 578 | AC246: =(AA246/AB246)*100 -> 91.522491349480973 | AD246: =(X246*4)+(Z246*2) -> 8
A247: DANDENONG | C247: VAN DER BEEK | F247: ALDRIDGE | I247: P KNIGHT | L247: WESTCOTT | W247: PRAHRAN | X247: 1 | Y247: 4 | Z247: 0 | AA247: 591 | AB247: 709 | AC247: =(AA247/AB247)*100 -> 83.356840620592394 | AD247: =(X247*4)+(Z247*2) -> 4
A248: GOALKICKERS | M248: HETHERINGTON 2 | P248: PEARSON | R248: SMITH | T248: BERGMAN | W248: SPRINGVALE | X248: 1 | Y248: 4 | Z248: 0 | AA248: 592 | AB248: 732 | AC248: =(AA248/AB248)*100 -> 80.874316939890718 | AD248: =(X248*4)+(Z248*2) -> 4
A249: SANDRINGHAM | C249: BREWER 15 | F249: MORRISON 12 | I249: GALLAGHER 4 | L249: MACLEOD 3 | N249: MANNIX 3 | Q249: WEST 2 | W249: DANDENONG | X249: 1 | Y249: 4 | Z249: 0 | AA249: 489 | AB249: 847 | AC249: =(AA249/AB249)*100 -> 57.733175914994092 | AD249: =(X249*4)+(Z249*2) -> 4
A250: DANDENONG | C250: ALDRODGE 5 | F250: POLA 3 | H250: HENWOOD 2 | K250: DE KONNING 2 | N250: VAN DER BEEK 2 | R250: WESTCOTT | U250: HALL | W250: WERRIBEE | X250: 0 | Y250: 5 | Z250: 0 | AA250: 359 | AB250: 748 | AC250: =(AA250/AB250)*100 -> 47.99465240641711 | AD250: =(X250*4)+(Z250*2) -> 0
Q251: P KNIGHT | S251: ORSBORNE
A252: PORT MELBOURNE | C252: 4 | D252: 2 | E252: 26 | G252: 15 | H252: 2 | I252: 92 | K252: 22 | L252: 6 | M252: 138 | O252: 26 | P252: 10 | Q252: 166 | S252: VENUE: PORT MELBOURNE
A253: CAMBERWELL | C253: 6 | D253: 8 | E253: 44 | G253: 10 | H253: 10 | I253: 70 | K253: 14 | L253: 15 | M253: 99 | O253: 15 | P253: 20 | Q253: 110 | S253: CASEY :MORGAN
A254: BEST PLAYERS
A255: PORT MELBOURNE | C255: FEHRING | F255: RODDA | I255: ROBERTSON | L255: SWAN | O255: CARTER | Q255: TANTSIS
A256: CAMBERWELL | C256: EVANS | F256: CAHILL | I256: DAVIDSON | L256: BURMEISTER
A257: GOALKICKERS
A258: PORT MELBOURNE | C258: ANDERSON 6 | F258: RODDA 5 | H258: LOVE 4 | J258: COOK 3 | L258: SWAN 3 | N258: GOSS 2 | P258: CARTER 2 | R258: O'RILEY
A259: CAMBERWELL | C259: CAHILL 3 | E259: MAILING 3 | G259: DANS 2 | I259: WILKINSON 2 | L259: BURMEISTER | O259: SIDE | P259: BARNES | R259: CONSTANTINOU | V259: TURNER
A261: FRANKSTON | C261: 5 | D261: 3 | E261: 33 | G261: 9 | H261: 5 | I261: 59 | K261: 16 | L261: 5 | M261: 101 | O261: 22 | P261: 9 | Q261: 141 | S261: VENUE: COBURG
A262: COBURG | C262: 2 | D262: 2 | E262: 14 | G262: 5 | H262: 4 | I262: 34 | K262: 7 | L262: 10 | M262: 52 | O262: 13 | P262: 16 | Q262: 94 | S262: PHILLIPS :HUTCHINSON
A263: BEST PLAYERS
A264: FRANKSTON | C264: CZARNECKI | F264: JONES | I264: GAMBLE | L264: GEDDES | O264: HORLER | R264: BRUIN
A265: COBURG | C265: HALBERT | F265: LAIDLER | I265: COLLINS | L265: RUTTY | O265: HARBINSON
A266: GOALKICKERS
A267: FRANKSTON | C267: S JONES 8 | F267: GEDDES 4 | H267: B JONES 3 | J267: CZARNECKI 2 | M267: LOCKWOOD | P267: BEATON | R267: HOWARTH | U267: MEMBREY | X267: BARDOEL
A268: COBURG | C268: FREEMAN 3 | F268: COLLINS 2 | I268: EVANS 2 | K268: TULLOCH 2 | N268: ALLISON | P268: ZANON | R268: DALGLEISH | U268: PEARCE
A270: GEELONG WEST | C270: 9 | D270: 3 | E270: 57 | G270: 15 | H270: 5 | I270: 95 | K270: 17 | L270: 8 | M270: 110 | O270: 22 | P270: 11 | Q270: 143 | S270: VENUE: GEELONG WEST
A271: PRESTON | C271: 4 | D271: 5 | E271: 29 | G271: 9 | H271: 9 | I271: 63 | K271: 17 | L271: 11 | M271: 113 | O271: 19 | P271: 17 | Q271: 131 | S271: GROOM :MARSHALL
A272: BEST PLAYERS
A273: GEELONG WEST | C273: NICHOLS | F273: KRANJC | I273: JOHNSON | L273: BROWNE | O273: GIBSON | R273: DALIHAUS
A274: PRESTON | C274: HALAS | F274: SALVADORE | I274: WARREN | L274: ATKIN | O274: FROST | R274: BRINE
A275: GOALKICKERS
A276: GEELONG WEST | C276: NICHOLS 6 | F276: RICHARDSON 3 | I276: WELSH 2 | K276: KING 2 | M276: TORNEY 2 | O276: EDDY 2 | Q276: JOHNSON 2 | T276: HIGGINS 2 | W276: SMITH
A277: PRESTON | C277: HALAS 5 | F277: SALVADORE 3 | I277: BRINE 3 | K277: SHAW 3 | M277: COCKATOO 2 | P277: McEWAN | R277: DWYER | T277: DOYLE
A279: WILLIAMSTOWN | C279: 10 | D279: 5 | E279: 65 | G279: 19 | H279: 7 | I279: 121 | K279: 28 | L279: 9 | M279: 177 | O279: 33 | P279: 16 | Q279: 214 | S279: VENUE: TOORAK PARK
A280: PRAHRAN | C280: 5 | D280: 3 | E280: 33 | G280: 10 | H280: 7 | I280: 67 | K280: 20 | L280: 11 | M280: 131 | O280: 24 | P280: 13 | Q280: 157 | S280: BUDGE :MARCY
A281: BEST PLAYERS
A282: WILLIAMSTOWN | C282: FOTHERINGHAM | F282: SAIT | I282: HUMMEL | L282: BARNETT | O282: DAVIDSON | R282: WHEELER
A283: PRAHRAN | C283: CATTOGGIO | F283: T McCORMACK | I283: MILLS | L283: I McCORMACK
A284: GOALKICKERS
A285: WILLIAMSTOWN | C285: FOTHERINGHAM 13 | G285: SIMMONS 5 | I285: HUMMEL 4 | L285: SAIT 3 | N285: MURPHY 2 | Q285: DULLARD 2 | T285: ROSS | V285: DAVIDSON | X285: McCONNON | AA285: BRIEERTY
A286: PRAHRAN | C286: MILLS 8 | E286: STEPHENS 5 | H286: P McDONALD 3 | K286: CATTOGGIO 3 | N286: T McCORMACK 2 | R286: BERELLO 2 | U286: TAYLOR
A288: ROUND 6 | D288: 27TH MAY | I288: WEATHER | S288: VENUE: PRESTON
D289: 1ST QTR | H289: 2ND QTR | L289: 3RD QTR | P289: FINAL | S289: UMPIRES
A290: PRESTON | C290: 6 | D290: 7 | E290: 43 | G290: 19 | H290: 8 | I290: 122 | K290: 24 | L290: 14 | M290: 158 | O290: 31 | P290: 17 | Q290: 203 | S290: VERGONA | X290: LADDER | AB290: ROUND | AD290: 6
A291: SANDRINGHAM | C291: 6 | D291: 2 | E291: 38 | G291: 9 | H291: 5 | I291: 59 | K291: 17 | L291: 6 | M291: 108 | O291: 26 | P291: 8 | Q291: 164 | S291: PHILLIPS
A292: BEST PLAYERS | W292: TEAM | X292: W | Y292: L | Z292: D | AA292: FOR | AB292: AGST | AC292: % | AD292: PTS
A293: PRESTON | C293: WARREN | F293: DUNBAR | I293: AITKEN | L293: BRINE | O293: HALAS | R293: OHLSEN
A294: SANDRINGHAM | C294: GALLAGHER | F294: SIMS | I294: BEUS | L294: RIGGS | O294: MANNIX | W294: GEELONG WEST | X294: 6 | Y294: 0 | Z294: 0 | AA294: 917 | AB294: 610 | AC294: =(AA294/AB294)*100 -> 150.32786885245901 | AD294: =(X294*4)+(Z294*2) -> 24
A295: GOALKICKERS | O295: FROST | Q295: BRINE | W295: CAMBERWELL | X295: 5 | Y295: 1 | Z295: 0 | AA295: 907 | AB295: 590 | AC295: =(AA295/AB295)*100 -> 153.72881355932205 | AD295: =(X295*4)+(Z295*2) -> 20
A296: PRESTON | C296: OHLSEN 5 | E296: WARREN 4 | G296: HALAS 4 | I296: FYFFE 3 | K296: SALVADORE 3 | N296: DOYLE 3 | P296: BUNBAR 2 | R296: BEER | W296: SANDRINGHAM | X296: 4 | Y296: 2 | Z296: 0 | AA296: 1123 | AB296: 804 | AC296: =(AA296/AB296)*100 -> 139.67661691542287 | AD296: =(X296*4)+(Z296*2) -> 16
A297: SANDRINGHAM | C297: BREWER 5 | E297: MANNIX 5 | G297: PEARSON 3 | I297: RIGGS 3 | K297: HETHERINGTON 2 | N297: BINGHAM | Q297: MORRISON | S297: HART | W297: WILLIAMSTOWN | X297: 4 | Y297: 2 | Z297: 0 | AA297: 879 | AB297: 769 | AC297: =(AA297/AB297)*100 -> 114.30429128738622 | AD297: =(X297*4)+(Z297*2) -> 16
O298: FITZPATRICK | S298: VENUE: FRANKSTON
A299: SPRINGVALE | C299: 6 | D299: 2 | E299: 38 | G299: 8 | H299: 8 | I299: 56 | K299: 16 | L299: 12 | M299: 108 | O299: 19 | P299: 13 | Q299: 127 | S299: GROOM | W299: PRESTON | X299: 4 | Y299: 2 | Z299: 0 | AA299: 783 | AB299: 689 | AC299: =(AA299/AB299)*100 -> 113.64296081277215 | AD299: =(X299*4)+(Z299*2) -> 16
A300: FRANKSTON | C300: 2 | D300: 3 | E300: 15 | G300: 7 | H300: 9 | I300: 51 | K300: 12 | L300: 11 | M300: 83 | O300: 17 | P300: 18 | Q300: 120 | S300: MORGAN | W300: PORT MELBOURNE | X300: 3 | Y300: 3 | Z300: 0 | AA300: 848 | AB300: 748 | AC300: =(AA300/AB300)*100 -> 113.36898395721926 | AD300: =(X300*4)+(Z300*2) -> 12
A301: BEST PLAYERS | W301: FRANKSTON | X301: 3 | Y301: 3 | Z301: 0 | AA301: 755 | AB301: 694 | AC301: =(AA301/AB301)*100 -> 108.78962536023056 | AD301: =(X301*4)+(Z301*2) -> 12
A302: SPRINGVALE | C302: DEMPSTER | F302: STEEL | I302: BRAND | L302: GRAY | N302: McCOMB | Q302: CARROLL | W302: COBURG | X302: 3 | Y302: 3 | Z302: 0 | AA302: 733 | AB302: 689 | AC302: =(AA302/AB302)*100 -> 106.38606676342526 | AD302: =(X302*4)+(Z302*2) -> 12
A303: FRANKSTON | C303: GEDDES | F303: GAMBLE | I303: HORLER | L303: HILTON | W303: SPRINGVALE | X303: 2 | Y303: 4 | Z303: 0 | AA303: 719 | AB303: 852 | AC303: =(AA303/AB303)*100 -> 84.389671361502351 | AD303: =(X303*4)+(Z303*2) -> 8
A304: GOALKICKERS | Q304: BRAND | W304: PRAHRAN | X304: 1 | Y304: 5 | Z304: 0 | AA304: 688 | AB304: 871 | AC304: =(AA304/AB304)*100 -> 78.989667049368535 | AD304: =(X304*4)+(Z304*2) -> 4
A305: SPRINGVALE | C305: CARROLL 5 | F305: STEEL 4 | H305: GRAY 2 | J305: SMITH 2 | L305: DUNCAN 2 | N305: HERBERT | P305: HOLDEN | R305: CADDAYE | W305: DANDENONG | X305: 1 | Y305: 5 | Z305: 0 | AA305: 600 | AB305: 1051 | AC305: =(AA305/AB305)*100 -> 57.088487155090398 | AD305: =(X305*4)+(Z305*2) -> 4
A306: FRANKSTON | C306: GEDDES 5 | F306: S JONES 4 | I306: B JONES 4 | K306: LOCKWOOD | M306: COLE | N306: CZARNECKI | Q306: BOYD | W306: WERRIBEE | X306: 0 | Y306: 6 | Z306: 0 | AA306: 450 | AB306: 905 | AC306: =(AA306/AB306)*100 -> 49.723756906077348 | AD306: =(X306*4)+(Z306*2) -> 0
A308: CAMBERWELL | C308: 3 | D308: 3 | E308: 21 | G308: 9 | H308: 11 | I308: 65 | K308: 11 | L308: 15 | M308: 81 | O308: 24 | P308: 18 | Q308: 162 | S308: VENUE: CAMBERWELL
A309: PRAHRAN | C309: 6 | D309: 2 | E309: 38 | G309: 8 | H309: 4 | I309: 52 | K309: 11 | L309: 6 | M309: 72 | O309: 15 | P309: 7 | Q309: 97 | S309: MARSHALL :BLAIR
A310: BEST PLAYERS
A311: CAMBERWELL | C311: DODIG | F311: EVANS | I311: STEVENSON | L311: CAHILL
A312: PRAHRAN | C312: BICKFORD | F312: WALLACE | I312: I McCORMACK | L312: P McCORMACK | O312: JEFFREY
A313: GOALKICKERS
A314: CAMBERWELL | C314: STEVENSON 8 | F314: SIDE 3 | H314: WEIGHTMAN 2 | K314: BARNES 2 | M314: O'KANE 2 | O314: DANS 2 | Q314: MAILING | S314: EVANS | U314: CONSTANTINOU | X314: DAVIDSON | AA314: DE GOEY
A315: PRAHRAN | C315: STEPHENS 4 | F315: I McCORMACK 3 | J315: CATTOGGIO 2 | M315: MILLS 2 | O315: RAYNER | Q315: PAUL McDONALD | U315: PETER McDONALD | X315: CAVANOUGH
A317: GEELONG WEST | C317: 8 | D317: 2 | E317: 50 | G317: 10 | H317: 2 | I317: 62 | K317: 14 | L317: 4 | M317: 88 | O317: 20 | P317: 7 | Q317: 127 | S317: VENUE: WILLIAMSTOWN
A318: WILLIAMSTOWN | C318: 0 | D318: 5 | E318: 5 | G318: 8 | H318: 16 | I318: 64 | K318: 12 | L318: 23 | M318: 95 | O318: 13 | P318: 24 | Q318: 102 | S318: OAKLEY :FITZPATRICK
A319: BEST PLAYERS
A320: GEELONG WEST | C320: BROWNE | F320: MACKENZIE | I320: KRANJC | L320: GIBSON | O320: NICHOLS | R320: JOHNSTONE
A321: WILLIAMSTOWN | C321: SAIT | F321: SIMMONS | I321: WHEELER | L321: KERSHAW | O321: MURPHY | R321: McTAGGART
A322: GOALKICKERS
A323: GEELONG WEST | C323: BROWNE 7 | F323: RADOJEVIC 5 | I323: NICHOLS 3 | K323: KING 2 | M323: WELSH | O323: HIGGINS | Q323: JOHNSTON
A324: WILLIAMSTOWN | C324: MURPHY 4 | F324: DELL 2 | H324: SAIT 2 | J324: DAVIDSON | M324: HUMMEL | O324: SIMMONS | Q324: DULLARD | S324: TOWNS
A326: PORT MELBOURNE | C326: 9 | D326: 3 | E326: 57 | G326: 12 | H326: 6 | I326: 78 | K326: 15 | L326: 13 | M326: 103 | O326: 23 | P326: 19 | Q326: 157 | S326: VENUE: WERRIBEE
A327: WERRIBEE | C327: 3 | D327: 1 | E327: 19 | G327: 9 | H327: 5 | I327: 59 | K327: 11 | L327: 6 | M327: 72 | O327: 14 | P327: 7 | Q327: 91 | S327: HUTCHINSON :STEERE
A328: BEST PLAYERS
A329: PORT MELBOURNE | C329: CHADBAND | F329: THOMPSON | I329: CARTER | L329: CARLILE | O329: O'RILEY | R329: IRWIN
A330: WERRIBEE | C330: CHRISTIANSEN | F330: DOYLE | I330: BURNETT | L330: RICHARDSON | O330: FREEMAN | R330: HOPKINS
A331: GOALKICKERS
A332: PORT MELBOURNE | C332: O'RILEY 7 | F332: CARTER 5 | I332: COOK 4 | K332: LOVE 3 | M332: ANDERSON 2 | P332: SWAN 2
A333: WERRIBEE | C333: RYAN 5 | F333: P SMITH 3 | I333: MEMBREY 2 | L333: CHRISTIANSEN | O333: REDENBACH | R333: BURNETT | U333: RICHARDSON
A335: COBURG | C335: 7 | D335: 2 | E335: 44 | G335: 13 | H335: 6 | I335: 84 | K335: 21 | L335: 10 | M335: 136 | O335: 32 | P335: 12 | Q335: 204 | S335: VENUE: DANDENONG
A336: DANDENONG | C336: 2 | D336: 4 | E336: 16 | G336: 3 | H336: 9 | I336: 27 | K336: 9 | L336: 12 | M336: 66 | O336: 16 | P336: 15 | Q336: 111 | S336: BLAKE :MARCY
A337: BEST PLAYERS
A338: COBURG | C338: HALBERT | F338: LAIDLER | I338: COLLINS | L338: CLEARY | O338: RUTTY | Q338: DOHNT
A339: DANDENONG | C339: WENN | F339: FINN | I339: HAMILTON | L339: DE KONNING | O339: POLA
A340: GOALKICKERS
A341: COBURG | C341: LAIDLER 7 | F341: PEARCE 6 | H341: HALBERT 5 | J341: FREEMAN 4 | M341: CLEARY 3 | O341: DOHNT 2 | Q341: BEATTIE 2 | S341: TULLOCH | V341: ROBERTSON | X341: ZANON
A342: DANDENONG | C342: HALL 5 | E342: POLA 4 | G342: ORSBORNE 3 | J342: WESTCOTT | M342: WENN | O342: SCULLY | Q342: HAMILTON
A344: ROUND 7 | D344: 3RD JUNE | I344: WEATHER | S344: VENUE: SPRINGVALE
D345: 1ST QTR | H345: 2ND QTR | L345: 3RD QTR | P345: FINAL | S345: UMPIRES
A346: COBURG | C346: 5 | D346: 8 | E346: 38 | G346: 9 | H346: 9 | I346: 63 | K346: 19 | L346: 11 | M346: 125 | O346: 25 | P346: 11 | Q346: 161 | S346: STEERE | X346: LADDER | AB346: ROUND | AD346: 7
A347: SPRINGVALE | C347: 5 | D347: 3 | E347: 33 | G347: 12 | H347: 11 | I347: 83 | K347: 14 | L347: 15 | M347: 99 | O347: 18 | P347: 18 | Q347: 126 | S347: PHILLIPS
A348: BEST PLAYERS | W348: TEAM | X348: W | Y348: L | Z348: D | AA348: FOR | AB348: AGST | AC348: % | AD348: PTS
A349: COBURG | C349: FREEMAN | F349: ROBERTSON | I349: PENNINGTON | L349: M ZANON | O349: DOHNT | Q349: A HARBINSON
A350: SPRINGVALE | C350: HOWELL | F350: DEMPSTER | I350: McCOMB | L350: GRAY | O350: HERBERT | Q350: JENKIN | W350: GEELONG WEST | X350: 7 | Y350: 0 | Z350: 0 | AA350: 1049 | AB350: 725 | AC350: =(AA350/AB350)*100 -> 144.68965517241378 | AD350: =(X350*4)+(Z350*2) -> 28
A351: GOALKICKERS | L351: M ZANON | N351: PENNINGTON | Q351: EVANS | S351: DOHNT | W351: CAMBERWELL | X351: 5 | Y351: 2 | Z351: 0 | AA351: 1022 | AB351: 722 | AC351: =(AA351/AB351)*100 -> 141.55124653739614 | AD351: =(X351*4)+(Z351*2) -> 20
A352: COBURG | C352: LAIDLER 4 | E352: FREEMAN 4 | H352: BEATTIE 4 | J352: R ZANON 3 | M352: ROBERTSON 3 | P352: CLEARY 2 | R352: HALBERT | W352: SANDRINGHAM | X352: 5 | Y352: 2 | Z352: 0 | AA352: 1307 | AB352: 964 | AC352: =(AA352/AB352)*100 -> 135.58091286307055 | AD352: =(X352*4)+(Z352*2) -> 20
A353: SPRINGVALE | C353: CARROLL 4 | F353: SMITH 3 | H353: DEMPSTER 2 | K353: NEWMAN 2 | M353: DUNCAN 2 | P353: HERBERT | R353: STEEL | T353: TONKIN | W353: PRESTON | X353: 5 | Y353: 2 | Z353: 0 | AA353: 999 | AB353: 788 | AC353: =(AA353/AB353)*100 -> 126.77664974619289 | AD353: =(X353*4)+(Z353*2) -> 20
S354: VENUE: BEACH ROAD
A355: SANDRINGHAM | C355: 6 | D355: 4 | E355: 40 | G355: 18 | H355: 6 | I355: 114 | K355: 24 | L355: 8 | M355: 152 | O355: 29 | P355: 10 | Q355: 184 | S355: GROOM | W355: PORT MELBOURNE | X355: 4 | Y355: 3 | Z355: 0 | AA355: 1051 | AB355: 880 | AC355: =(AA355/AB355)*100 -> 119.43181818181819 | AD355: =(X355*4)+(Z355*2) -> 16
A356: WILLIAMSTOWN | C356: 8 | D356: 2 | E356: 50 | G356: 14 | H356: 7 | I356: 91 | K356: 20 | L356: 14 | M356: 134 | O356: 24 | P356: 16 | Q356: 160 | S356: MARSHALL | W356: COBURG | X356: 4 | Y356: 3 | Z356: 0 | AA356: 894 | AB356: 815 | AC356: =(AA356/AB356)*100 -> 109.69325153374234 | AD356: =(X356*4)+(Z356*2) -> 16
A357: BEST PLAYERS | W357: WILLIAMSTOWN | X357: 4 | Y357: 3 | Z357: 0 | AA357: 1039 | AB357: 953 | AC357: =(AA357/AB357)*100 -> 109.02413431269676 | AD357: =(X357*4)+(Z357*2) -> 16
A358: SANDRINGHAM | C358: GALLAGHER | F358: MACLEOD | I358: HART | L358: MULLER | O358: HAYES | R358: MANNIX | W358: FRANKSTON | X358: 3 | Y358: 4 | Z358: 0 | AA358: 887 | AB358: 897 | AC358: =(AA358/AB358)*100 -> 98.885172798216274 | AD358: =(X358*4)+(Z358*2) -> 12
A359: WILLIAMSTOWN | C359: OWEN | F359: FOTHERINGHAM | I359: SIMMONS | L359: HUMMEL | O359: KERSHAW | W359: SPRINGVALE | X359: 2 | Y359: 5 | Z359: 0 | AA359: 845 | AB359: 1013 | AC359: =(AA359/AB359)*100 -> 83.415597235932864 | AD359: =(X359*4)+(Z359*2) -> 8
A360: GOALKICKERS | N360: GALLAGHER | Q360: BINGHAM | S360: MANSFIELD | W360: PRAHRAN | X360: 1 | Y360: 6 | Z360: 0 | AA360: 818 | AB360: 1068 | AC360: =(AA360/AB360)*100 -> 76.591760299625463 | AD360: =(X360*4)+(Z360*2) -> 4
A361: SANDRINGHAM | C361: BREWER 9 | E361: MORRISON 6 | H361: HART 5 | J361: MACLEOD 3 | M361: HETHERINGTON 2 | P361: DIPIERDOMENICO | W361: WERRIBEE | X361: 1 | Y361: 6 | Z361: 0 | AA361: 647 | AB361: 1035 | AC361: =(AA361/AB361)*100 -> 62.512077294685987 | AD361: =(X361*4)+(Z361*2) -> 4
A362: WILLIAMSTOWN | C362: FOTHERINGHAM 9 | G362: SIMMONS 4 | I362: DULLARD 3 | L362: HUMMEL 2 | N362: PLATT 2 | P362: SLEVISON | R362: DAVIDSON | W362: DANDENONG | X362: 1 | Y362: 6 | Z362: 0 | AA362: 699 | AB362: 1267 | AC362: =(AA362/AB362)*100 -> 55.169692186266772 | AD362: =(X362*4)+(Z362*2) -> 4
Q363: MURPHY | S363: DAVIS
A364: PORT MELBOURNE | C364: 4 | D364: 2 | E364: 26 | G364: 14 | H364: 7 | I364: 91 | K364: 23 | L364: 9 | M364: 147 | O364: 32 | P364: 11 | Q364: 203 | S364: VENUE: PORT MELBOURNE
A365: FRANKSTON | C365: 8 | D365: 6 | E365: 54 | G365: 11 | H365: 9 | I365: 75 | K365: 14 | L365: 14 | M365: 98 | O365: 19 | P365: 18 | Q365: 132 | S365: BLACK :BUDGE
A366: BEST PLAYERS
A367: PORT MELBOURNE | C367: FEHRING | F367: SWAN | I367: CARTER | L367: CHADBAND | O367: COOK | R367: ROSS
A368: FRANKSTON | C368: GEDDES | F368: CZARNECKI | I368: GAMBLE | L368: HILTON
A369: GOALKICKERS
A370: PORT MELBOURNE | C370: COOK 10 | F370: LOVE 4 | H370: EBEYER 3 | J370: ANDERSON 3 | M370: CARTER 3 | O370: O'RILEY 3 | Q370: IRWIN 2 | S370: ROSS 2 | U370: SWAN | W370: HOY
A371: FRANKSTON | C371: ROGERSON 4 | F371: COLE 4 | H371: HUNTER 2 | J371: CZARNECKI 2 | M371: THOMAS 2 | O371: BOYD 2 | Q371: HILTON | S371: GAMBLE | V371: HAMILL
A373: WERRIBEE | C373: 8 | D373: 1 | E373: 49 | G373: 12 | H373: 6 | I373: 78 | K373: 23 | L373: 10 | M373: 148 | O373: 31 | P373: 11 | Q373: 197 | S373: VENUE: TOORAK PARK
A374: PRAHRAN | C374: 3 | D374: 4 | E374: 22 | G374: 8 | H374: 10 | I374: 58 | K374: 12 | L374: 11 | M374: 83 | O374: 19 | P374: 16 | Q374: 130 | S374: BLAKE :MARCY
A375: BEST PLAYERS
A376: WERRIBEE | C376: CHRISTIANSEN | F376: HUGHES | J376: BROWN | L376: HOPKINS | O376: BURNETT | R376: MEMBREY
A377: PRAHRAN | C377: I McORMACK | F377: PAUL McDONALD | J377: TAYLOR | L377: McKISSOCK | O377: DICKSON | R377: BATT
A378: GOALKICKERS | T378: PARKES | V378: RICHARDSON
A379: WERRIBEE | C379: GRAY 5 | E379: RYAN 5 | G379: BROWN 4 | I379: CHRISTIANSEN 4 | L379: BURNETT 2 | N379: DOYLE 2 | P379: REDENBACH 2 | S379: SMITH 2 | V379: BREEN | X379: COOPER | Z379: CORDY
A380: PRAHRAN | C380: I McCORMACK 5 | F380: MILLS 5 | H380: CATTOGGIO 3 | K380: WRIGHT 2 | M380: PETER McDONALD 2 | Q380: PAUL McDONALD | V380: GRAMBEAU
A382: PRESTON | C382: 4 | D382: 2 | E382: 26 | G382: 11 | H382: 8 | I382: 74 | K382: 20 | L382: 14 | M382: 134 | O382: 32 | P382: 24 | Q382: 216 | S382: VENUE: DANDENONG
A383: DANDENONG | C383: 7 | D383: 9 | E383: 51 | G383: 8 | H383: 15 | I383: 63 | K383: 9 | L383: 18 | M383: 72 | O383: 13 | P383: 21 | Q383: 99 | S383: CASEY :FITZPATRICK
A384: BEST PLAYERS
A385: PRESTON | C385: HALAS | F385: BRINE | I385: BEER | L385: DUNBAR | O385: BOURKE | R385: HACKNEY
A386: DANDENONG | C386: VAN DER BEEK | F386: WRIGHT | I386: WENN | L386: K FINN
A387: GOALKICKERS
A388: PRESTON | C388: BOURKE 8 | E388: OHLSEN 6 | G388: HALAS 5 | I388: SALVADORE 4 | L388: HACKNEY 2 | N388: BRINE 2 | P388: JORDAN 2 | R388: ZERELLA 2 | U388: DUNBAR
A389: DANDENONG | C389: WULF 3 | F389: ALDRIDGE 3 | I389: HAMILTON 2 | L389: HALL 2 | N389: POLA | P389: DE KONNING | S389: WOOD
A391: GEELONG WEST | C391: 7 | D391: 3 | E391: 45 | G391: 11 | H391: 5 | I391: 71 | K391: 13 | L391: 5 | M391: 83 | O391: 21 | P391: 6 | Q391: 132 | S391: VENUE: GEELONG WEST
A392: CAMBERWELL | C392: 1 | D392: 2 | E392: 8 | G392: 7 | H392: 2 | I392: 44 | K392: 15 | L392: 4 | M392: 94 | O392: 18 | P392: 7 | Q392: 115 | S392: VERGONA :HUTCHESON
A393: BEST PLAYERS
A394: GEELONG WEST | C394: KRANJC | F394: JOHNSTON | I394: GIBSON | L394: RADOJEVIC | O394: NICHOLS | R394: BERRY
A395: CAMBERWELL | C395: EVANS | F395: DE GOEY | I395: BOTTAMS | L395: DAVIDSON | O395: CONSTANTINOU
A396: GOALKICKERS
A397: GEELONG WEST | C397: RADOJEVIC 7 | F397: NICHOLS 4 | I397: BROWNE 3 | K397: JOHNSTON 3 | N397: BERRY 2 | P397: TOULMIN | R397: TORNEY
A398: CAMBERWELL | C398: STEVENSON 5 | F398: DAVIDSON 5 | I398: DE GOEY 2 | K398: CONSTANTINOU 2 | N398: WEATHERALD | Q398: PEVITT | S398: SIDE | U398: HIPWORTH
A400: ROUND 8 | D400: 10TH JUNE | I400: WEATHER | S400: VENUE: SPRINGVALE
D401: 1ST QTR | H401: 2ND QTR | L401: 3RD QTR | P401: FINAL | S401: UMPIRES
A402: SPRINGVALE | C402: 3 | D402: 4 | E402: 22 | G402: 11 | H402: 8 | I402: 74 | K402: 21 | L402: 13 | M402: 139 | O402: 28 | P402: 16 | Q402: 184 | S402: BUDGE | X402: LADDER | AB402: ROUND | AD402: 8
A403: DANDENONG | C403: 4 | D403: 3 | E403: 27 | G403: 5 | H403: 6 | I403: 36 | K403: 8 | L403: 8 | M403: 56 | O403: 12 | P403: 12 | Q403: 84 | S403: VERGONA
A404: BEST PLAYERS | W404: TEAM | X404: W | Y404: L | Z404: D | AA404: FOR | AB404: AGST | AC404: % | AD404: PTS
A405: SPRINGVALE | C405: CHAPMAN | F405: STEEL | I405: HERBERT | L405: GRAY | O405: TONKIN | R405: DUNCAN
A406: DANDENONG | C406: MILLANE | F406: KEE | I406: WOOD | L406: SCULLY | O406: VAN DER BEEK | W406: GEELONG WEST | X406: 8 | Y406: 0 | Z406: 0 | AA406: 1179 | AB406: 825 | AC406: =(AA406/AB406)*100 -> 142.90909090909091 | AD406: =(X406*4)+(Z406*2) -> 32
A407: GOALKICKERS | O407: HOLDEN 2 | Q407: TONKIN | S407: SMITH | W407: SANDRINGHAM | X407: 6 | Y407: 2 | Z407: 0 | AA407: 1478 | AB407: 1066 | AC407: =(AA407/AB407)*100 -> 138.64915572232647 | AD407: =(X407*4)+(Z407*2) -> 24
A408: SPRINGVALE | C408: DUNCAN 5 | E408: HERBERT 5 | G408: CHAPMAN 4 | J408: STEEL 3 | L408: GRAY 3 | N408: CARROLL 2 | Q408: ANDERSON 2 | W408: PRESTON | X408: 6 | Y408: 2 | Z408: 0 | AA408: 1179 | AB408: 911 | AC408: =(AA408/AB408)*100 -> 129.41822173435784 | AD408: =(X408*4)+(Z408*2) -> 24
A409: DANDENONG | C409: WRIGHT 4 | F409: HALL 2 | H409: WOOD 2 | J409: ALDRIDGE 2 | M409: WENN | O409: WESTCOTT | W409: CAMBERWELL | X409: 5 | Y409: 3 | Z409: 0 | AA409: 1124 | AB409: 893 | AC409: =(AA409/AB409)*100 -> 125.86786114221724 | AD409: =(X409*4)+(Z409*2) -> 20
S410: VENUE: COBURG
A411: PORT MELBOURNE | C411: 4 | D411: 5 | E411: 29 | G411: 9 | H411: 9 | I411: 63 | K411: 15 | L411: 10 | M411: 100 | O411: 19 | P411: 12 | Q411: 126 | S411: GROOM | W411: PORT MELBOURNE | X411: 5 | Y411: 3 | Z411: 0 | AA411: 1177 | AB411: 992 | AC411: =(AA411/AB411)*100 -> 118.6491935483871 | AD411: =(X411*4)+(Z411*2) -> 20
A412: COBURG | C412: 6 | D412: 2 | E412: 38 | G412: 7 | H412: 5 | I412: 47 | K412: 13 | L412: 8 | M412: 86 | O412: 16 | P412: 16 | Q412: 112 | S412: MARSHALL | W412: COBURG | X412: 4 | Y412: 4 | Z412: 0 | AA412: 1006 | AB412: 951 | AC412: =(AA412/AB412)*100 -> 105.78338590956888 | AD412: =(X412*4)+(Z412*2) -> 16
A413: BEST PLAYERS | W413: FRANKSTON | X413: 4 | Y413: 4 | Z413: 0 | AA413: 1030 | AB413: 987 | AC413: =(AA413/AB413)*100 -> 104.35663627152989 | AD413: =(X413*4)+(Z413*2) -> 16
A414: PORT MELBOURNE | C414: DERMOTT | F414: LOVE | I414: ROSS | L414: FEHRING | O414: TANTSIS | W414: WILLIAMSTOWN | X414: 4 | Y414: 4 | Z414: 0 | AA414: 1162 | AB414: 1133 | AC414: =(AA414/AB414)*100 -> 102.55957634598411 | AD414: =(X414*4)+(Z414*2) -> 16
A415: COBURG | C415: CLEARY | F415: HARBINSON | I415: ALEXANDER | L415: HALBERT | O415: LAIDLER | R415: M ZANON | W415: SPRINGVALE | X415: 3 | Y415: 5 | Z415: 0 | AA415: 1029 | AB415: 1097 | AC415: =(AA415/AB415)*100 -> 93.801276207839564 | AD415: =(X415*4)+(Z415*2) -> 12
A416: GOALKICKERS | Q416: EBEYER | W416: PRAHRAN | X416: 1 | Y416: 7 | Z416: 0 | AA416: 908 | AB416: 1211 | AC416: =(AA416/AB416)*100 -> 74.979355904211403 | AD416: =(X416*4)+(Z416*2) -> 4
A417: PORT MELBOURNE | C417: O'RILEY 4 | F417: COOK 4 | H417: LOVE 4 | J417: HOY 2 | L417: IRWIN | N417: SWAN | P417: STEWART | R417: CARTER | W417: WERRIBEE | X417: 1 | Y417: 7 | Z417: 0 | AA417: 747 | AB417: 1165 | AC417: =(AA417/AB417)*100 -> 64.120171673819755 | AD417: =(X417*4)+(Z417*2) -> 4
A418: COBURG | C418: LAIDLER 7 | F418: HALBERT 4 | I418: BEATTIE 2 | K418: EVANS | M418: HARBINSON | P418: FREEMAN | W418: DANDENONG | X418: 1 | Y418: 7 | Z418: 0 | AA418: 783 | AB418: 1451 | AC418: =(AA418/AB418)*100 -> 53.962784286698827 | AD418: =(X418*4)+(Z418*2) -> 4
A420: PRESTON | C420: 7 | D420: 1 | E420: 43 | G420: 11 | H420: 8 | I420: 74 | K420: 18 | L420: 9 | M420: 117 | O420: 27 | P420: 18 | Q420: 180 | S420: VENUE: WILLIAMSTOWN
A421: WILLIAMSTOWN | C421: 3 | D421: 1 | E421: 19 | G421: 9 | H421: 4 | I421: 58 | K421: 16 | L421: 6 | M421: 102 | O421: 19 | P421: 9 | Q421: 123 | S421: MARCY ;MAY
A422: BEST PLAYERS
A423: PRESTON | C423: BRINE | F423: JORDAN | I423: DUNBAR | L423: FYFFE | O423: HACKNEY | R423: BEER
A424: WILLIAMSTOWN | C424: OWEN | F424: McTAGGART | I424: MURPHY | L424: DAVIS | O424: HUMMEL
A425: GOALKICKERS
A426: PRESTON | C426: FYFFE 5 | E426: OHLSEN 4 | G426: DUNBAR 4 | I426: HALAS 3 | K426: BOURKE 3 | M426: SALVADORE 2 | P426: BRINE 2 | R426: MCKEON | U426: ANDERSON | X426: HACKNEY | AA426: JORDAN
A427: WILLIAMSTOWN | C427: FOTHERINGHAM 4 | G427: HUMMEL 3 | I427: DULLARD 3 | L427: DAVIS 3 | N427: MURPHY 3 | Q427: DAVIDSON | S427: PLATT | U427: ROSS
A429: SANDRINGHAM | C429: 6 | D429: 4 | E429: 40 | G429: 8 | H429: 4 | I429: 52 | K429: 15 | L429: 7 | M429: 97 | O429: 27 | P429: 9 | Q429: 171 | S429: VENUE: CAMBERWELL
A430: CAMBERWELL | C430: 4 | D430: 3 | E430: 27 | G430: 9 | H430: 10 | I430: 64 | K430: 12 | L430: 18 | M430: 90 | O430: 14 | P430: 18 | Q430: 102 | S430: FITZPATRICK :OAKLEY
A431: BEST PLAYERS
A432: SANDRINGHAM | C432: BEUS | F432: GALLAGHER | I432: RIGGS | L432: DUURSMA | O432: SIMS | Q432: MORRISON
A433: CAMBERWELL | C433: CONSTANTINOU | F433: PEVITT | I433: BURMEISTER
A434: GOALKICKERS
A435: SANDRINGHAM | C435: BREWER 7 | E435: MORRISON 5 | H435: HETHERINGTON 4 | K435: MACLEOD 3 | M435: HART 2 | O435: GALLAGHER 2 | R435: DIPIERDOMENICO 2 | W435: BINGHAM | X435: RIGGS
A436: CAMBERWELL | C436: SIDE 4 | E436: STEVENSON 4 | H436: YOUNG | J436: CONSTANTINO | M436: DAVIDSON | O436: DODIG | Q436: ANGUS | S436: BURMEISTER
A438: FRANKSTON | C438: 4 | D438: 5 | E438: 29 | G438: 8 | H438: 8 | I438: 56 | K438: 12 | L438: 15 | M438: 87 | O438: 21 | P438: 17 | Q438: 143 | S438: VENUE: FRANKSTON
A439: PRAHRAN | C439: 6 | D439: 1 | E439: 37 | G439: 8 | H439: 3 | I439: 51 | K439: 10 | L439: 4 | M439: 64 | O439: 14 | P439: 6 | Q439: 90 | S439: CASEY :TORNEY
A440: BEST PLAYERS
A441: FRANKSTON | C441: GAMBLE | F441: BEATON | I441: BELL | L441: BALDWIN | O441: GEDDES | R441: HILTON
A442: PRAHRAN | C442: WRIGHT | F442: P McCORMACK | I442: GRAMBEAU | L442: S McDONALD | O442: STRACHAN
A443: GOALKICKERS
A444: FRANKSTON | C444: GEDDES 6 | E444: COLE 4 | G444: ROGERSON 3 | J444: GAMBLE 2 | M444: CALLAGHAN 2 | P444: S JONES | R444: BEATON | U444: CZARNECKI | X444: THOMAS | AA444: BOYD
A445: PRAHRAN | C445: MILLS 6 | F445: BORELLO 2 | I445: WRIGHT | K445: TAYLOR | M445: P McDONALD | P445: CATTOGGIO | R445: I McCORMACK | W445: P McCORMACK
A447: GEELONG WEST | C447: 5 | D447: 2 | E447: 32 | G447: 9 | H447: 6 | I447: 60 | K447: 15 | L447: 7 | M447: 97 | O447: 20 | P447: 10 | Q447: 130 | S447: VENUE: WERRIBEE
A448: WERRIBEE | C448: 2 | D448: 2 | E448: 14 | G448: 5 | H448: 4 | I448: 34 | K448: 7 | L448: 4 | M448: 46 | O448: 15 | P448: 10 | Q448: 100 | S448: MORGAN :PHILLIPS
A449: BEST PLAYERS
A450: GEELONG WEST | C450: DOYLE | F450: GIBSON | I450: McMAHON | L450: NICHOLS | O450: TORNEY | R450: SMITH
A451: WERRIBEE | C451: DOYLE | F451: CHRISTIANSEN | I451: HUGHES | L451: HOPKINS | O451: RICHARDSON | R451: REDENBACH
A452: GOALKICKERS
A453: GEELONG WEST | C453: NICHOLS 5 | F453: RADOJEVIC 4 | I453: DOYLE 4 | K453: TORNEY 3 | M453: BERRY 2 | O453: ANDERSON | R453: GIBSON
A454: WERRIBEE | C454: BROWN 3 | F454: MEMBREY 3 | I454: BURNETT 2 | K454: GRAY 2 | M454: CHRISTIANSEN | P454: DOYLE | R454: REDENBACH | V454: RYAN | X454: SMITH
A456: ROUND 9 | D456: 24TH JUNE | I456: WEATHER | S456: VENUE: GEELONG WEST
D457: 1ST QTR | H457: 2ND QTR | L457: 3RD QTR | P457: FINAL | S457: UMPIRES
A458: GEELONG WEST | C458: 5 | D458: 6 | E458: 36 | G458: 7 | H458: 13 | I458: 55 | K458: 11 | L458: 17 | M458: 83 | O458: 11 | P458: 23 | Q458: 89 | S458: MARSHALL | X458: LADDER | AB458: ROUND | AD458: 9
A459: FRANKSTON | C459: 1 | D459: 5 | E459: 11 | G459: 2 | H459: 11 | I459: 23 | K459: 4 | L459: 11 | M459: 35 | O459: 5 | P459: 16 | Q459: 46 | S459: STEERE
A460: BEST PLAYERS | W460: TEAM | X460: W | Y460: L | Z460: D | AA460: FOR | AB460: AGST | AC460: % | AD460: PTS
A461: GEELONG WEST | C461: KRANJC | F461: SMITH | I461: TORNEY | L461: GIBSON | O461: EVANS | R461: WATSON
A462: FRANKSTON | C462: BALDWIN | F462: GAMBLE | I462: BARDOEL | L462: CROWDER | O462: BRUIN | W462: GEELONG WEST | X462: 9 | Y462: 0 | Z462: 0 | AA462: 1268 | AB462: 871 | AC462: =(AA462/AB462)*100 -> 145.57979334098735 | AD462: =(X462*4)+(Z462*2) -> 36
A463: GOALKICKERS | W463: SANDRINGHAM | X463: 7 | Y463: 2 | Z463: 0 | AA463: 1666 | AB463: 1179 | AC463: =(AA463/AB463)*100 -> 141.30619168787109 | AD463: =(X463*4)+(Z463*2) -> 28
A464: GEELONG WEST | C464: NICHOLS 3 | F464: BROWNE 3 | I464: KING 2 | K464: DOYLE | M464: TORNEY | O464: JOHNSTON | W464: PRESTON | X464: 7 | Y464: 2 | Z464: 0 | AA464: 1297 | AB464: 1009 | AC464: =(AA464/AB464)*100 -> 128.54311199207135 | AD464: =(X464*4)+(Z464*2) -> 28
A465: FRANKSTON | C465: BARDOEL | F465: ROGERSON | I465: JONES | K465: THOMAS | M465: CALLAGHAN | W465: PORT MELBOURNE | X465: 6 | Y465: 3 | Z465: 0 | AA465: 1331 | AB465: 1102 | AC465: =(AA465/AB465)*100 -> 120.78039927404718 | AD465: =(X465*4)+(Z465*2) -> 24
S466: VENUE: TOORAK PARK
A467: PRAHRAN | C467: 3 | D467: 3 | E467: 21 | G467: 5 | H467: 5 | I467: 35 | K467: 10 | L467: 8 | M467: 68 | O467: 16 | P467: 10 | Q467: 106 | S467: OAKLEY | W467: CAMBERWELL | X467: 5 | Y467: 4 | Z467: 0 | AA467: 1222 | AB467: 1011 | AC467: =(AA467/AB467)*100 -> 120.8704253214639 | AD467: =(X467*4)+(Z467*2) -> 20
A468: COBURG | C468: 5 | D468: 3 | E468: 33 | G468: 10 | H468: 3 | I468: 63 | K468: 13 | L468: 4 | M468: 82 | O468: 15 | P468: 7 | Q468: 97 | S468: FITZPATRICK | W468: WILLIAMSTOWN | X468: 5 | Y468: 4 | Z468: 0 | AA468: 1314 | AB468: 1194 | AC468: =(AA468/AB468)*100 -> 110.0502512562814 | AD468: =(X468*4)+(Z468*2) -> 20
A469: BEST PLAYERS | W469: COBURG | X469: 4 | Y469: 5 | Z469: 0 | AA469: 1103 | AB469: 1057 | AC469: =(AA469/AB469)*100 -> 104.3519394512772 | AD469: =(X469*4)+(Z469*2) -> 16
A470: PRAHRAN | C470: REED | F470: P McCORMACK | I470: CATTOGGIO | L470: C YOUNG | O470: GRAMBEAU | R470: S McDONALD | W470: FRANKSTON | X470: 4 | Y470: 5 | Z470: 0 | AA470: 1076 | AB470: 1076 | AC470: =(AA470/AB470)*100 -> 100 | AD470: =(X470*4)+(Z470*2) -> 16
A471: COBURG | C471: COLLINS | F471: HARBINSON | I471: DALGLEISH | L471: HALBERT | W471: SPRINGVALE | X471: 3 | Y471: 6 | Z471: 0 | AA471: 1139 | AB471: 1251 | AC471: =(AA471/AB471)*100 -> 91.047162270183861 | AD471: =(X471*4)+(Z471*2) -> 12
A472: GOALKICKERS | W472: PRAHRAN | X472: 2 | Y472: 7 | Z472: 0 | AA472: 1014 | AB472: 1308 | AC472: =(AA472/AB472)*100 -> 77.522935779816521 | AD472: =(X472*4)+(Z472*2) -> 8
A473: PRAHRAN | C473: C YOUNG 5 | F473: GILES 5 | H473: I McCORMACK 2 | K473: CATTOGGIO | M473: S McDONALD | P473: RAYNER | R473: STEPHENS | W473: WERRIBEE | X473: 1 | Y473: 8 | Z473: 0 | AA473: 860 | AB473: 1353 | AC473: =(AA473/AB473)*100 -> 63.562453806356245 | AD473: =(X473*4)+(Z473*2) -> 4
A474: COBURG | C474: HALBERT 5 | F474: LAIDLER 3 | I474: BINALE 3 | K474: TULLOCH | M474: HARBINSON | P474: DALGLEISH | S474: BEATTIE | W474: DANDENONG | X474: 1 | Y474: 8 | Z474: 0 | AA474: 844 | AB474: 1603 | AC474: =(AA474/AB474)*100 -> 52.651278852152217 | AD474: =(X474*4)+(Z474*2) -> 4
A476: PRESTON | C476: 4 | D476: 1 | E476: 25 | G476: 9 | H476: 7 | I476: 61 | K476: 12 | L476: 7 | M476: 79 | O476: 18 | P476: 10 | Q476: 118 | S476: VENUE: PRESTON
A477: CAMBERWELL | C477: 4 | D477: 5 | E477: 29 | G477: 5 | H477: 8 | I477: 38 | K477: 11 | L477: 10 | M477: 76 | O477: 14 | P477: 14 | Q477: 98 | S477: BUDGE :GROOM
A478: BEST PLAYERS
A479: PRESTON | C479: HACKNEY | F479: HALAS | I479: JORDAN | L479: SHAW | O479: FROST | R479: BRINE
A480: CAMBERWELL | C480: HIPWORTH | F480: PEVITT | I480: TURNER | L480: DANS
A481: GOALKICKERS
A482: PRESTON | C482: HALAS 10 | F482: HACKNEY 3 | I482: BRINE 2 | K482: JORDAN | M482: BOURKE | O482: DOYLE
A483: CAMBERWELL | C483: STEVENSON 3 | F483: O'KANE 2 | H483: DAVIDSON 2 | K483: BURMEISTER 2 | N483: DODIG | P483: BARNES | R483: HIPWORTH | U483: TURNER | X483: CONSTANTINOU
A485: WILLIAMSTOWN | C485: 6 | D485: 5 | E485: 41 | G485: 11 | H485: 6 | I485: 72 | K485: 17 | L485: 8 | M485: 110 | O485: 22 | P485: 20 | Q485: 152 | S485: VENUE: DANDENONG
A486: DANDENONG | C486: 1 | D486: 2 | E486: 8 | G486: 1 | H486: 10 | I486: 16 | K486: 4 | L486: 11 | M486: 35 | O486: 8 | P486: 13 | Q486: 61 | S486: HUTCHINSON :MORGAN
A487: BEST PLAYERS
A488: WILLIAMSTOWN | C488: GOETZ | F488: DULLARD | I488: SAIT | L488: ROSS
A489: DANDENONG | C489: J FINN | F489: DICKSON | I489: MILLANE | L489: VAN DER BEEK
A490: GOALKICKERS
A491: WILLIAMSTOWN | C491: FOTHERINGHAM 5 | F491: DULLARD 3 | I491: SIMMONS 3 | L491: DAVIS 3 | N491: SAIT 2 | P491: KERSHAW | R491: PLATT | T491: HUMMEL | W491: McTAGGART | X491: WHEELER | AA491: MURPHY
A492: DANDENONG | C492: WESTCOT 3 | F492: HALL 2 | H492: CONROY | J492: METE | L492: SLATTERY
A494: SANDRINGHAM | C494: 8 | D494: 5 | E494: 53 | G494: 16 | H494: 12 | I494: 108 | K494: 22 | L494: 15 | M494: 147 | O494: 28 | P494: 20 | Q494: 188 | S494: VENUE: BEACH ROAD
A495: WERRIBEE | C495: 1 | D495: 4 | E495: 10 | G495: 4 | H495: 7 | I495: 31 | K495: 8 | L495: 8 | M495: 56 | O495: 17 | P495: 11 | Q495: 113 | S495: VERGONA :TORNEY
A496: BEST PLAYERS
A497: SANDRINGHAM | C497: RIGGS | F497: MORRISON | I497: GALLAGHER | L497: MULLER | N497: DUURSMA | Q497: MANNIX
A498: WERRIBEE | C498: BURNETT | F498: MEMBREY | I498: BROWN | L498: REDENBACH | O498: FEDKR | Q498: RYAN
A499: GOALKICKERS
A500: SANDRINGHAM | C500: MORRISON 10 | F500: BREWER 4 | I500: GALLAGHER 4 | L500: HART 3 | N500: RIGGS 3 | P500: MANNIX 2 | R500: MACLEOD | U500: PEARSON
A501: WERRIBEE | C501: RYAN 5 | E501: BURNETT 4 | H501: BROWN 3 | J501: REDENBACH 2 | M501: SMITH | O501: GRAY | Q501: CHRISTIANSEN
A503: PORT MELBOURNE | C503: 5 | D503: 2 | E503: 32 | G503: 12 | H503: 5 | I503: 77 | K503: 16 | L503: 9 | M503: 105 | O503: 24 | P503: 10 | Q503: 154 | S503: VENUE: PORT MELBOURNE
A504: SPRINGVALE | C504: 4 | D504: 2 | E504: 26 | G504: 7 | H504: 4 | I504: 46 | K504: 10 | L504: 7 | M504: 67 | O504: 16 | P504: 14 | Q504: 110 | S504: MAY :CASEY
A505: BEST PLAYERS
A506: PORT MELBOURNE | C506: LOVE | F506: FEHRING | I506: DERMOTT | L506: CARTER
A507: SPRINGVALE | C507: DEMPSTER | F507: HERBERT | I507: CARROLL | L507: LETTS | O507: KING
A508: GOALKICKERS
A509: PORT MELBOURNE | C509: COOK 7 | E509: LOVE 6 | G509: HARKINS 3 | I509: O'RILEY 2 | K509: BRIEDIS 2 | M509: EBEYER 2 | O509: GOSS | Q509: FEHRING
A510: SPRINGVALE | C510: CARROLL 7 | F510: HERBERT 3 | I510: ANDERSON 3 | L510: CHAPMAN | N510: DEMPSTER | Q510: HOLDEN
A512: ROUND 10 | D512: 1ST JULY | I512: WEATHER | S512: VENUE: PORT MELBOURNE
D513: 1ST QTR | H513: 2ND QTR | L513: 3RD QTR | P513: FINAL | S513: UMPIRES
A514: PORT MELBOURNE | C514: 12 | D514: 6 | E514: 78 | G514: 19 | H514: 16 | I514: 130 | K514: 31 | L514: 20 | M514: 206 | O514: 40 | P514: 27 | Q514: 267 | S514: MARCY | X514: LADDER | AB514: ROUND | AD514: 10
A515: DANDENONG | C515: 1 | D515: 3 | E515: 9 | G515: 3 | H515: 4 | I515: 22 | K515: 5 | L515: 8 | M515: 38 | O515: 11 | P515: 10 | Q515: 76 | S515: TORNEY
A516: BEST PLAYERS | W516: TEAM | X516: W | Y516: L | Z516: D | AA516: FOR | AB516: AGST | AC516: % | AD516: PTS
A517: PORT MELBOURNE | C517: SWAN | F517: THOMPSON | I517: BRIEDIS | L517: EBEYER | O517: ROSS | R517: HARKINS
A518: DANDENONG | C518: DE KONNING | F518: WOOD | I518: HENWOOD | L518: HAMILTON | W518: GEELONG WEST | X518: 9 | Y518: 1 | Z518: 0 | AA518: 1330 | AB518: 974 | AC518: =(AA518/AB518)*100 -> 136.55030800821356 | AD518: =(X518*4)+(Z518*2) -> 36
A519: GOALKICKERS | N519: HARKINS 3 | Q519: HOY 2 | W519: PRESTON | X519: 8 | Y519: 2 | Z519: 0 | AA519: 1490 | AB519: 1067 | AC519: =(AA519/AB519)*100 -> 139.64386129334582 | AD519: =(X519*4)+(Z519*2) -> 32
A520: PORT MELBOURNE | C520: COOK 6 | E520: SWAN 6 | G520: O'RILEY 5 | I520: EBEYER 4 | K520: ANDERSON 4 | N520: GOSS 4 | P520: BRIEDIS 3 | R520: CARTER 3 | W520: SANDRINGHAM | X520: 7 | Y520: 3 | Z520: 0 | AA520: 1774 | AB520: 1342 | AC520: =(AA520/AB520)*100 -> 132.19076005961253 | AD520: =(X520*4)+(Z520*2) -> 28
A521: DANDENONG | C521: HALL 4 | E521: HENWOOD 2 | H521: HAMILTON | J521: SCULLY | L521: WOOD | N521: GRUMMISCH | W521: PORT MELBOURNE | X521: 7 | Y521: 3 | Z521: 0 | AA521: 1358 | AB521: 1178 | AC521: =(AA521/AB521)*100 -> 115.28013582342955 | AD521: =(X521*4)+(Z521*2) -> 28
S522: VENUE: FRANKSTON
A523: FRANKSTON | C523: 6 | D523: 6 | E523: 42 | G523: 11 | H523: 9 | I523: 75 | K523: 16 | L523: 15 | M523: 111 | O523: 24 | P523: 19 | Q523: 163 | S523: GOLLOP | W523: CAMBERWELL | X523: 6 | Y523: 4 | Z523: 0 | AA523: 1387 | AB523: 1107 | AC523: =(AA523/AB523)*100 -> 125.29358626919603 | AD523: =(X523*4)+(Z523*2) -> 24
A524: SANDRINGHAM | C524: 3 | D524: 5 | E524: 23 | G524: 8 | H524: 11 | I524: 59 | K524: 9 | L524: 14 | M524: 68 | O524: 15 | P524: 18 | Q524: 108 | S524: MORGAN | W524: COBURG | X524: 5 | Y524: 5 | Z524: 0 | AA524: 1206 | AB524: 1119 | AC524: =(AA524/AB524)*100 -> 107.77479892761394 | AD524: =(X524*4)+(Z524*2) -> 20
A525: BEST PLAYERS | W525: FRANKSTON | X525: 5 | Y525: 5 | Z525: 0 | AA525: 1239 | AB525: 1184 | AC525: =(AA525/AB525)*100 -> 104.64527027027026 | AD525: =(X525*4)+(Z525*2) -> 20
A526: FRANKSTON | C526: GEDDES | F526: JONES | I526: CZARNECKI | L526: BARDOEL | O526: KANE | R526: ROGERSON | W526: WILLIAMSTOWN | X526: 5 | Y526: 5 | Z526: 0 | AA526: 1410 | AB526: 1359 | AC526: =(AA526/AB526)*100 -> 103.75275938189846 | AD526: =(X526*4)+(Z526*2) -> 20
A527: SANDRINGHAM | C527: DUURSMA | F527: RIGGS | I527: MACLEOD | L527: HAYES | O527: MANNIX | R527: MORRISON | W527: SPRINGVALE | X527: 4 | Y527: 6 | Z527: 0 | AA527: 1269 | AB527: 1353 | AC527: =(AA527/AB527)*100 -> 93.791574279379148 | AD527: =(X527*4)+(Z527*2) -> 16
A528: GOALKICKERS | O528: HORTON | Q528: R KANE | T528: WALSH | W528: PRAHRAN | X528: 2 | Y528: 8 | Z528: 0 | AA528: 1116 | AB528: 1438 | AC528: =(AA528/AB528)*100 -> 77.607788595271217 | AD528: =(X528*4)+(Z528*2) -> 8
A529: FRANKSTON | C529: JONES 4 | E529: COLE 3 | G529: GEDDES 3 | I529: HILTON 3 | K529: BARDOEL 2 | M529: ROGERSON 2 | P529: BEATON 2 | R529: CZARNECKI 2 | W529: WERRIBEE | X529: 1 | Y529: 9 | Z529: 0 | AA529: 918 | AB529: 1546 | AC529: =(AA529/AB529)*100 -> 59.379042690815012 | AD529: =(X529*4)+(Z529*2) -> 4
A530: SANDRINGHAM | C530: MORRISON 5 | F530: HART 2 | H530: BREWER 2 | K530: GALLAGHER 2 | N530: MANSFIELD | Q530: PEARSON | S530: FITZPATRICK | W530: DANDENONG | X530: 1 | Y530: 9 | Z530: 0 | AA530: 920 | AB530: 1870 | AC530: =(AA530/AB530)*100 -> 49.19786096256685 | AD530: =(X530*4)+(Z530*2) -> 4
P531: DUURSMA
A532: COBURG | C532: 6 | D532: 6 | E532: 42 | G532: 7 | H532: 9 | I532: 51 | K532: 12 | L532: 16 | M532: 88 | O532: 14 | P532: 19 | Q532: 103 | S532: VENUE: COBURG
A533: GEELONG WEST | C533: 0 | D533: 4 | E533: 4 | G533: 3 | H533: 13 | I533: 31 | K533: 3 | L533: 15 | M533: 33 | O533: 7 | P533: 20 | Q533: 62 | S533: BUDGE :MAY
A534: BEST PLAYERS
A535: COBURG | C535: COLLINS | F535: HARBINSON | I535: FREEMAN | L535: BEATTIE | O535: M ZANON | R535: ROBERTSON
A536: GEELONG WEST | C536: DALIHAUS | F536: SMITH | I536: KRANJC | L536: GIBSON | O536: EDDY
A537: GOALKICKERS
A538: COBURG | C538: LAIDLER 4 | F538: HERBERT 3 | I538: BEATTIE 3 | K538: FREEMAN 2 | N538: WEBSTER 2
A539: GEELONG WEST | C539: RADOJEVIC 2 | F539: DOYLE | H539: WATSON | J539: NICHOLS | L539: JOHNSTON | N539: BERRY
A541: CAMBERWELL | C541: 2 | D541: 6 | E541: 18 | G541: 8 | H541: 12 | I541: 60 | K541: 14 | L541: 16 | M541: 100 | O541: 24 | P541: 21 | Q541: 165 | S541: VENUE: CAMBERWELL
A542: WILLIAMSTOWN | C542: 3 | D542: 2 | E542: 20 | G542: 7 | H542: 5 | I542: 47 | K542: 11 | L542: 9 | M542: 75 | O542: 14 | P542: 12 | Q542: 96 | S542: PHILLIPS :CASEY
A543: BEST PLAYERS
A544: CAMBERWELL | C544: CAHILL | F544: PEVITT | I544: TURNER | L544: HIPWORTH | O544: EVERETT | Q544: HUTCHINSON
A545: WILLIAMSTOWN | C545: WHEELER | F545: WALKER | I545: MURPHY | L545: SANDELLS
A546: GOALKICKERS
A547: CAMBERWELL | C547: STEVENSON 6 | F547: BARNES 4 | H547: HIPWORTH 3 | K547: O'KANE 2 | M547: EVERETT 2 | O547: DAVIDSON | Q547: GILMORE | S547: DODIG | U547: DANS | W547: DAWSON | X547: CONSTANTINOU | AB547: SHULTZ
A548: WILLIAMSTOWN | C548: FOTHERINGHAM 4 | F548: HUMMEL 4 | I548: PLATT 2 | K548: DAVIDSON | M548: ROSS | O548: SAIT | Q548: DULLARD
A550: SPRINGVALE | C550: 4 | D550: 4 | E550: 28 | G550: 9 | H550: 8 | I550: 62 | K550: 15 | L550: 12 | M550: 102 | O550: 19 | P550: 16 | Q550: 130 | S550: VENUE: SPRINGVALE
A551: PRAHRAN | C551: 1 | D551: 3 | E551: 9 | G551: 5 | H551: 12 | I551: 42 | K551: 10 | L551: 14 | M551: 74 | O551: 14 | P551: 18 | Q551: 102 | S551: VERGONA :GROOM
A552: BEST PLAYERS
A553: SPRINGVALE | C553: NEWMAN | F553: FOWLER | I553: LETTS | L553: HERBERT | O553: BRAND | R553: WALTER
A554: PRAHRAN | C554: CAVANOUGH | F554: McCORMACK | I554: GRAMBEAU | L554: McDONALD
A555: GOALKICKERS
A556: SPRINGVALE | C556: NEWMAN 6 | F556: CARROLL 5 | I556: ANDERSON 3 | L556: DUNCAN 2 | N556: HERBERT | P556: CHAPMAN | R556: FOWLER
A557: PRAHRAN | C557: STEPHENS 3 | F557: GILES 3 | H557: CATTOGGIO 2 | K557: GRAMBEAU 2 | N557: MCCORMACK | Q557: TAYLOR | S557: GASTON | V557: RAYNER
A559: PRESTON | C559: 6 | D559: 5 | E559: 41 | G559: 14 | H559: 8 | I559: 92 | K559: 18 | L559: 10 | M559: 118 | O559: 29 | P559: 19 | Q559: 193 | S559: VENUE: WERRIBEE
A560: WERRIBEE | C560: 2 | D560: 0 | E560: 12 | G560: 4 | H560: 5 | I560: 29 | K560: 6 | L560: 9 | M560: 45 | O560: 8 | P560: 10 | Q560: 58 | S560: OAKLEY :STEERE
A561: BEST PLAYERS
A562: PRESTON | C562: JORDAN | F562: HACKNEY | I562: RUSSELL | L562: BEER | O562: HALAS | R562: FROST
A563: WERRIBEE | C563: REDENBACH | F563: CHRISTIANSEN | I563: FREEMAN | L563: GUDDE | O563: PERKINS
A564: GOALKICKERS
A565: PRESTON | C565: RUSSELL 10 | F565: HACKNEY 4 | I565: SALVADORE 4 | L565: HALAS 3 | N565: JORDAN 3 | Q565: OHLSEN 2 | S565: BOURKE | V565: BRINE | X565: SHAW
A566: WERRIBEE | C566: FREEMAN 2 | F566: RYAN 2 | H566: GRAY | J566: HUGHES | L566: REDENBACH | O566: RICHARDSON
A568: ROUND 11 | D568: 8TH JULY | I568: WEATHER | S568: VENUE: GEELONG WEST
D569: 1ST QTR | H569: 2ND QTR | L569: 3RD QTR | P569: FINAL | S569: UMPIRES
A570: GEELONG WEST | C570: 6 | D570: 4 | E570: 40 | G570: 8 | H570: 9 | I570: 57 | K570: 12 | L570: 16 | M570: 88 | O570: 18 | P570: 18 | Q570: 126 | S570: OAKLEY | X570: LADDER | AB570: ROUND | AD570: 11
A571: SPRINGVALE | C571: 2 | D571: 4 | E571: 16 | G571: 6 | H571: 11 | I571: 47 | K571: 6 | L571: 12 | M571: 48 | O571: 9 | P571: 16 | Q571: 70 | S571: MARCY
A572: BEST PLAYERS | W572: TEAM | X572: W | Y572: L | Z572: D | AA572: FOR | AB572: AGST | AC572: % | AD572: PTS
A573: GEELONG WEST | C573: SMITH | F573: JOHNSTON | I573: GIBSON | L573: TORNEY | O573: KRANJC | R573: EDDY
A574: SPRINGVALE | C574: KING | F574: CHAPMAN | I574: LETTS | L574: TONKIN | O574: WALTER | R574: ANDERSON | W574: GEELONG WEST | X574: 10 | Y574: 1 | Z574: 0 | AA574: 1456 | AB574: 1044 | AC574: =(AA574/AB574)*100 -> 139.46360153256705 | AD574: =(X574*4)+(Z574*2) -> 40
A575: GOALKICKERS | W575: PRESTON | X575: 9 | Y575: 2 | Z575: 0 | AA575: 1641 | AB575: 1170 | AC575: =(AA575/AB575)*100 -> 140.25641025641025 | AD575: =(X575*4)+(Z575*2) -> 36
A576: GEELONG WEST | C576: NICHOLS 5 | E576: BROWNE 3 | H576: TORNEY 2 | J576: EDDY 2 | L576: JOHNSTON 2 | O576: RADOJEVIC 2 | R576: GIBSON | T576: WELSH | W576: SANDRINGHAM | X576: 8 | Y576: 3 | Z576: 0 | AA576: 1964 | AB576: 1455 | AC576: =(AA576/AB576)*100 -> 134.98281786941581 | AD576: =(X576*4)+(Z576*2) -> 32
A577: SPRINGVALE | C577: STEEL 3 | F577: HERBERT 2 | I577: ANDERSON | L577: TONKIN | N577: SMITH | P577: GRAY | W577: CAMBERWELL | X577: 7 | Y577: 4 | Z577: 0 | AA577: 1538 | AB577: 1204 | AC577: =(AA577/AB577)*100 -> 127.74086378737542 | AD577: =(X577*4)+(Z577*2) -> 28
S578: VENUE: WILLIAMSTOWN
A579: WILLIAMSTOWN | C579: 1 | D579: 5 | E579: 11 | G579: 6 | H579: 8 | I579: 44 | K579: 7 | L579: 10 | M579: 52 | O579: 15 | P579: 16 | Q579: 106 | S579: BUDGE | W579: PORT MELBOURNE | X579: 7 | Y579: 4 | Z579: 0 | AA579: 1462 | AB579: 1296 | AC579: =(AA579/AB579)*100 -> 112.80864197530865 | AD579: =(X579*4)+(Z579*2) -> 28
A580: WERRIBEE | C580: 3 | D580: 6 | E580: 24 | G580: 8 | H580: 9 | I580: 57 | K580: 13 | L580: 10 | M580: 88 | O580: 13 | P580: 10 | Q580: 88 | S580: FITZPATRICK | W580: WILLIAMSTOWN | X580: 6 | Y580: 5 | Z580: 0 | AA580: 1516 | AB580: 1447 | AC580: =(AA580/AB580)*100 -> 104.76848652384243 | AD580: =(X580*4)+(Z580*2) -> 24
A581: BEST PLAYERS | W581: COBURG | X581: 5 | Y581: 6 | Z581: 0 | AA581: 1319 | AB581: 1309 | AC581: =(AA581/AB581)*100 -> 100.76394194041254 | AD581: =(X581*4)+(Z581*2) -> 20
A582: WILLIAMSTOWN | C582: KERSHAW | F582: DULLARD | I582: SLEVISON | L582: WHEELER | O582: ROSS | R582: DAVIDSON | W582: FRANKSTON | X582: 5 | Y582: 6 | Z582: 0 | AA582: 1342 | AB582: 1335 | AC582: =(AA582/AB582)*100 -> 100.52434456928839 | AD582: =(X582*4)+(Z582*2) -> 20
A583: WERRIBEE | C583: McCANCE | F583: CHRISTIANSEN | I583: PERKINS | L583: FEDKE | O583: RICHARDSON | R583: HUGHES | W583: SPRINGVALE | X583: 4 | Y583: 7 | Z583: 0 | AA583: 1339 | AB583: 1479 | AC583: =(AA583/AB583)*100 -> 90.534144692359703 | AD583: =(X583*4)+(Z583*2) -> 16
A584: GOALKICKERS | W584: PRAHRAN | X584: 3 | Y584: 8 | Z584: 0 | AA584: 1234 | AB584: 1542 | AC584: =(AA584/AB584)*100 -> 80.025940337224384 | AD584: =(X584*4)+(Z584*2) -> 12
A585: WILLIAMSTOWN | C585: FOTHERINGHAM 6 | G585: MURPHY 2 | I585: DULLARD 2 | L585: SIMMONS 2 | O585: SINNOTT | Q585: BRIERTY | S585: HUMMEL | W585: WERRIBEE | X585: 1 | Y585: 10 | Z585: 0 | AA585: 1006 | AB585: 1652 | AC585: =(AA585/AB585)*100 -> 60.89588377723971 | AD585: =(X585*4)+(Z585*2) -> 4
A586: WERRIBEE | C586: CHRISTIANSEN 4 | F586: PERKINS 2 | I586: RYAN 2 | K586: DOYLE | M586: GUDDE | O586: RICHARDSON | R586: CORDY | T586: ABBOTT | W586: DANDENONG | X586: 1 | Y586: 10 | Z586: 0 | AA586: 1017 | AB586: 2021 | AC586: =(AA586/AB586)*100 -> 50.321622958931222 | AD586: =(X586*4)+(Z586*2) -> 4
A588: PRAHRAN | C588: 4 | D588: 3 | E588: 27 | G588: 8 | H588: 6 | I588: 54 | K588: 13 | L588: 8 | M588: 86 | O588: 18 | P588: 10 | Q588: 118 | S588: VENUE: TOORAK PARK
A589: PORT MELBOURNE | C589: 7 | D589: 3 | E589: 45 | G589: 9 | H589: 8 | I589: 62 | K589: 11 | L589: 11 | M589: 77 | O589: 15 | P589: 14 | Q589: 104 | S589: MORGAN :STEERE
A590: BEST PLAYERS
A591: PRAHRAN | C591: WRIGHT | F591: P McDONALD | I591: P McCORMACK | L591: BUTCHER | O591: STRACHAN | R591: YOUNG
A592: PORT MELBOURNE | C592: BRIEDIS | F592: HOY | I592: K GOSS
A593: GOALKICKERS
A594: PRAHRAN | C594: MCNAMARA 4 | F594: CLARKE 4 | H594: I McCORMACK 3 | K594: P McDONALD 2 | N594: WRIGHT | P594: P McCORMACK | S594: STEPHENS | V594: CAVANOUGH | X594: HALL
A595: PORT MELBOURNE | C595: BRIEDIS 4 | F595: HOY 4 | H595: O'RILEY 3 | J595: HARKINS 2 | L595: COOK | N595: FEHRING
A597: CAMBERWELL | C597: 3 | D597: 4 | E597: 22 | G597: 9 | H597: 7 | I597: 61 | K597: 15 | L597: 10 | M597: 100 | O597: 23 | P597: 13 | Q597: 151 | S597: VENUE: DANDENONG
A598: DANDENONG | C598: 5 | D598: 5 | E598: 35 | G598: 9 | H598: 5 | I598: 59 | K598: 10 | L598: 8 | M598: 68 | O598: 14 | P598: 13 | Q598: 97 | S598: GOLLOP :MAY
A599: BEST PLAYERS
A600: CAMBERWELL | C600: HOWARTH | F600: PEVITT | I600: CONSTANTINOU | L600: DAWSON | O600: BARNES
A601: DANDENONG | C601: SLATTERY | F601: J FINN | I601: WRIGHT | L601: DE KONNING | O601: SCULLY
A602: GOALKICKERS
A603: CAMBERWELL | C603: STEVENSON 4 | F603: DI STEFANO 4 | I603: SHULTZ 3 | K603: DE GOEY 3 | M603: DAVIDSON 3 | P603: PEVITT 2 | R603: HIPWORTH 2 | V603: CONSTANTINOU | X603: BARNES
A604: DANDENONG | C604: WRIGHT 6 | F604: HALL 3 | H604: HENWOOD 2 | K604: WOOD | M604: WEST | O604: GRUMMISCH
A606: SANDRINGHAM | C606: 3 | D606: 5 | E606: 23 | G606: 13 | H606: 6 | I606: 84 | K606: 18 | L606: 9 | M606: 117 | O606: 29 | P606: 16 | Q606: 190 | S606: VENUE: BEACH ROAD
A607: COBURG | C607: 3 | D607: 6 | E607: 24 | G607: 7 | H607: 11 | I607: 53 | K607: 14 | L607: 15 | M607: 99 | O607: 16 | P607: 17 | Q607: 113 | S607: MARSHALL :CASEY
A608: BEST PLAYERS
A609: SANDRINGHAM | C609: PEARSON | F609: BREWER | I609: LYONS | L609: DUURSMA | O609: SIMS | R609: HAYES
A610: COBURG | C610: HARBINSON | F610: DALGLEISH | I610: FREEMAN | L610: COLLINS | O610: NOLAN
A611: GOALKICKERS
A612: SANDRINGHAM | C612: BREWER 12 | F612: MORRISON 7 | I612: BERGMAN 3 | L612: GALLAGHER 2 | O612: MANSFIELD | Q612: MACLEOD | S612: WEST | U612: MANNIX | X612: DIPIERDOMENICO
A613: COBURG | C613: LAIDLER 4 | F613: CLEARY 2 | I613: WEBSTER 2 | L613: R ZANON 2 | N613: BEATTIE 2 | Q613: COLLINS | S613: HARBINSON | W613: FREEMAN | X613: ROBERTSON
A615: PRESTON | C615: 4 | D615: 3 | E615: 27 | G615: 13 | H615: 8 | I615: 86 | K615: 15 | L615: 13 | M615: 103 | O615: 22 | P615: 19 | Q615: 151 | S615: VENUE: PRESTON
A616: FRANKSTON | C616: 5 | D616: 7 | E616: 37 | G616: 7 | H616: 9 | I616: 51 | K616: 12 | L616: 17 | M616: 89 | O616: 14 | P616: 19 | Q616: 103 | S616: VERGONA :PHILLIPS
A617: BEST PLAYERS
A618: PRESTON | C618: PLOWMAN | F618: BROWN | I618: HACKNEY | L618: McKEON | O618: BRINE | R618: HALAS
A619: FRANKSTON | C619: WALSH | F619: R KANE | I619: G KANE | L619: BRUIN | O619: ROGERSON
A620: GOALKICKERS
A621: PRESTON | C621: RUSSELL 6 | F621: HALAS 5 | H621: HACKNEY 2 | J621: BRINE 2 | L621: JORDAN 2 | N621: SALVADORE 2 | Q621: FYFFE | S621: FROST | U621: OHLSEN
A622: FRANKSTON | C622: ROGERSON 3 | F622: THOMAS 3 | I622: JONES 2 | K622: HILTON 2 | M622: BARDOEL | O622: GEDDES | Q622: R KANE | S622: WALSH
A624: ROUND 12 | D624: 15TH JULY | I624: WEATHER | S624: VENUE: GEELONG WEST
D625: 1ST QTR | H625: 2ND QTR | L625: 3RD QTR | P625: FINAL | S625: UMPIRES
A626: GEELONG WEST | C626: 3 | D626: 3 | E626: 21 | G626: 8 | H626: 5 | I626: 53 | K626: 11 | L626: 9 | M626: 75 | O626: 17 | P626: 13 | Q626: 115 | S626: VERGONA | X626: LADDER | AB626: ROUND | AD626: 12
A627: PORT MELBOURNE | C627: 5 | D627: 4 | E627: 34 | G627: 7 | H627: 8 | I627: 50 | K627: 14 | L627: 13 | M627: 97 | O627: 15 | P627: 15 | Q627: 105 | S627: FITZPATRICK
A628: BEST PLAYERS | W628: TEAM | X628: W | Y628: L | Z628: D | AA628: FOR | AB628: AGST | AC628: % | AD628: PTS
A629: GEELONG WEST | C629: TORNEY | F629: JOHNSTON | I629: EDDY | L629: KRANJC | O629: SODOMACO | R629: BENNETT
A630: PORT MELBOURNE | C630: ROSS | F630: THOMPSON | I630: DERMOTT | L630: BRIEDIS | O630: GOSS | R630: LOVE | W630: GEELONG WEST | X630: 11 | Y630: 1 | Z630: 0 | AA630: 1571 | AB630: 1149 | AC630: =(AA630/AB630)*100 -> 136.72758920800698 | AD630: =(X630*4)+(Z630*2) -> 44
A631: GOALKICKERS | W631: PRESTON | X631: 10 | Y631: 2 | Z631: 0 | AA631: 1779 | AB631: 1258 | AC631: =(AA631/AB631)*100 -> 141.41494435612083 | AD631: =(X631*4)+(Z631*2) -> 40
A632: GEELONG WEST | C632: NICHOLS 3 | E632: SODOMACO 3 | H632: EDDY 3 | J632: KING 2 | L632: RADOJEVIC 2 | O632: BERRY 2 | Q632: TORNEY | S632: JOHNSTON | W632: SANDRINGHAM | X632: 9 | Y632: 3 | Z632: 0 | AA632: 2167 | AB632: 1608 | AC632: =(AA632/AB632)*100 -> 134.7636815920398 | AD632: =(X632*4)+(Z632*2) -> 36
A633: PORT MELBOURNE | C633: COOK 5 | E633: LOVE 5 | G633: ANDERSON 3 | J633: BRIEDIS | L633: CARTER | W633: CAMBERWELL | X633: 8 | Y633: 4 | Z633: 0 | AA633: 1744 | AB633: 1288 | AC633: =(AA633/AB633)*100 -> 135.40372670807452 | AD633: =(X633*4)+(Z633*2) -> 32
S634: VENUE: BEACH ROAD
A635: SANDRINGHAM | C635: 11 | D635: 4 | E635: 70 | G635: 21 | H635: 6 | I635: 132 | K635: 24 | L635: 9 | M635: 153 | O635: 32 | P635: 11 | Q635: 203 | S635: HUTCHINSON | W635: PORT MELBOURNE | X635: 7 | Y635: 5 | Z635: 0 | AA635: 1567 | AB635: 1411 | AC635: =(AA635/AB635)*100 -> 111.05598866052443 | AD635: =(X635*4)+(Z635*2) -> 28
A636: SPRINGVALE | C636: 2 | D636: 0 | E636: 12 | G636: 6 | H636: 3 | I636: 39 | K636: 17 | L636: 9 | M636: 111 | O636: 24 | P636: 9 | Q636: 153 | S636: STEERE | W636: FRANKSTON | X636: 6 | Y636: 6 | Z636: 0 | AA636: 1527 | AB636: 1459 | AC636: =(AA636/AB636)*100 -> 104.66072652501714 | AD636: =(X636*4)+(Z636*2) -> 24
A637: BEST PLAYERS | R637: BLAKE FOR STEERE | W637: WILLIAMSTOWN | X637: 6 | Y637: 6 | Z637: 0 | AA637: 1640 | AB637: 1632 | AC637: =(AA637/AB637)*100 -> 100.49019607843137 | AD637: =(X637*4)+(Z637*2) -> 24
A638: SANDRINGHAM | C638: MACLEOD | F638: DUURSMA | I638: MORRISON | L638: PEARSON | O638: ADAMS | W638: COBURG | X638: 5 | Y638: 7 | Z638: 0 | AA638: 1407 | AB638: 1447 | AC638: =(AA638/AB638)*100 -> 97.235659986178305 | AD638: =(X638*4)+(Z638*2) -> 20
A639: SPRINGVALE | C639: HERBERT | F639: DEMPSTER | I639: ANDERSON | L639: FREEMAN | O639: WALTER | R639: GRAY | W639: SPRINGVALE | X639: 4 | Y639: 8 | Z639: 0 | AA639: 1492 | AB639: 1682 | AC639: =(AA639/AB639)*100 -> 88.703923900118909 | AD639: =(X639*4)+(Z639*2) -> 16
A640: GOALKICKERS | M640: PEARSON | O640: GALLAGHER | Q640: ADAMS | S640: LYONS | W640: PRAHRAN | X640: 4 | Y640: 8 | Z640: 0 | AA640: 1344 | AB640: 1647 | AC640: =(AA640/AB640)*100 -> 81.602914389799636 | AD640: =(X640*4)+(Z640*2) -> 16
A641: SANDRINGHAM | C641: MORRISON 12 | F641: MACLEOD 5 | I641: DUURSMA 3 | L641: CHAPMAN 2 | O641: HART 2 | Q641: BREWER 2 | S641: MANNIX 2 | W641: WERRIBEE | X641: 1 | Y641: 11 | Z641: 0 | AA641: 1090 | AB641: 1858 | AC641: =(AA641/AB641)*100 -> 58.665231431646937 | AD641: =(X641*4)+(Z641*2) -> 4
A642: SPRINGVALE | C642: ANDERSON 6 | F642: HERBERT 5 | I642: CARROLL 5 | L642: BRAND 2 | N642: McCOMB 2 | Q642: SMITH | S642: GRAY | W642: DANDENONG | X642: 1 | Y642: 11 | Z642: 0 | AA642: 1122 | AB642: 2131 | AC642: =(AA642/AB642)*100 -> 52.651337400281562 | AD642: =(X642*4)+(Z642*2) -> 4
P643: WALTER | R643: FOTINIOTIS
A644: CAMBERWELL | C644: 5 | D644: 3 | E644: 33 | G644: 11 | H644: 9 | I644: 75 | K644: 23 | L644: 12 | M644: 150 | O644: 32 | P644: 14 | Q644: 206 | S644: VENUE: CAMBERWELL
A645: WERRIBEE | C645: 2 | D645: 3 | E645: 15 | G645: 7 | H645: 5 | I645: 47 | K645: 10 | L645: 8 | M645: 68 | O645: 12 | P645: 12 | Q645: 84 | S645: OAKLEY :MARCY
A646: BEST PLAYERS
A647: CAMBERWELL | C647: CONSTANTINOU | F647: LOVE | I647: SHULTZ | L647: HIPWORTH | O647: CAHILL
A648: WERRIBEE | C648: HOPKINS | F648: RICHARDSON | I648: SIDEROW | L648: GUDDE
A649: GOALKICKERS | R649: HIPWORTH | U649: DI STEFANO
A650: CAMBERWELL | C650: STEVENSON 6 | F650: SCHULTZ 5 | I650: LOVE 4 | K650: DAVIDSON 3 | N650: HUTCHINSON 3 | Q650: CONSTANTINOU 3 | U650: ROURKE 3 | X650: BARNES 2 | AA650: DODIG
A651: WERRIBEE | C651: RICHARDSON 4 | F651: CHRISTIANSEN 2 | J651: BONNETT 2 | M651: DOYLE | O651: PERKINS | Q651: MAPLESON | T651: ABBOTT
A653: PRESTON | C653: 7 | D653: 3 | E653: 45 | G653: 13 | H653: 7 | I653: 85 | K653: 17 | L653: 12 | M653: 114 | O653: 20 | P653: 18 | Q653: 138 | S653: VENUE: PRESTON
A654: COBURG | C654: 3 | D654: 4 | E654: 22 | G654: 6 | H654: 9 | I654: 45 | K654: 9 | L654: 15 | M654: 69 | O654: 11 | P654: 22 | Q654: 88 | S654: GOLLOP :MORGAN
A655: BEST PLAYERS
A656: PRESTON | C656: BOURKE | F656: FROST | I656: PLOWMAN | L656: HALAS | O656: McKEON | R656: SALVADORE
A657: COBURG | C657: A HARBINSON | F657: ALEXANDER | I657: LAIDLER | L657: NOLAN | O657: ROBERTSON
A658: GOALKICKERS
A659: PRESTON | C659: HALAS 6 | F659: RUSSELL 4 | I659: FYFFE 2 | K659: SALVADORE 2 | N659: HACKNEY 2 | Q659: BRINE | R659: SHAW | T659: JORDAN | W659: DUNBAR
A660: COBURG | C660: LAIDLER 3 | F660: FREEMAN 2 | I660: TULLOCH 2 | L660: COLLINS | N660: DOHNT | P660: HALBERT | R660: WEBSTER
A662: PRAHRAN | C662: 6 | D662: 2 | E662: 38 | G662: 9 | H662: 7 | I662: 61 | K662: 15 | L662: 10 | M662: 100 | O662: 16 | P662: 14 | Q662: 110 | S662: VENUE: DANDENONG
A663: DANDENONG | C663: 0 | D663: 8 | E663: 8 | G663: 3 | H663: 11 | I663: 29 | K663: 11 | L663: 14 | M663: 80 | O663: 15 | P663: 15 | Q663: 105 | S663: PHILLIPS :MARSHALL
A664: BEST PLAYERS
A665: PRAHRAN | C665: P McDONALD | F665: STEPHENS | I665: BICKFORD
A666: DANDENONG | C666: WRIGHT | F666: HALL | I666: HENWOOD | L666: WEST | O666: WESTCOTT
A667: GOALKICKERS
A668: PRAHRAN | C668: STEPHENS 4 | F668: P MCDONALD 3 | I668: I McCORMACK 2 | L668: McNAMARA 2 | O668: GRAMBEAU 2 | R668: WRIGHT 2 | U668: CLARKE
A669: DANDENONG | C669: WRIGHT 5 | F669: HENWOOD 3 | I669: WESTCOTT 2 | L669: KANNOURAKIS 2 | O669: HALL 2 | Q669: WEST
A671: FRANKSTON | C671: 4 | D671: 9 | E671: 33 | G671: 11 | H671: 11 | I671: 77 | K671: 19 | L671: 17 | M671: 131 | O671: 27 | P671: 23 | Q671: 185 | S671: VENUE: WILLIAMSTOWN
A672: WILLIAMSTOWN | C672: 4 | D672: 2 | E672: 26 | G672: 11 | H672: 4 | I672: 70 | K672: 14 | L672: 7 | M672: 91 | O672: 19 | P672: 10 | Q672: 124 | S672: GROOM :TORNEY
A673: BEST PLAYERS
A674: FRANKSTON | C674: R KANE | F674: BARDOEL | I674: WALSH | L674: ROGERSON | O674: GEDDES | R674: HORLER
A675: WILLIAMSTOWN | C675: CANNON | F675: WHEELER | I675: HUMMEL | L675: WALKER | O675: HODGES | R675: KERSHAW
A676: GOALKICKERS
A677: FRANKSTON | C677: BARDOEL 7 | F677: GEDDES 4 | H677: BELL 3 | J677: ROGERSON 3 | M677: HILTON 3 | O677: R KANE 3 | Q677: GAMBLE | S677: CZARNECKI | V677: CROWDER | X677: G KANE
A678: WILLIAMSTOWN | C678: FOTHERINGHAM 6 | G678: BRIERTY 3 | I678: WALKER 2 | K678: SIMMONS 2 | N678: SLEVISON 2 | Q678: DULLARD | S678: HODGES P SINNOTT | V678: P SINNOTT | X678: HUMMEL
A680: ROUND 13 | D680: 22ND JULY | I680: WEATHER | S680: VENUE: TOORAK PARK
D681: 1ST QTR | H681: 2ND QTR | L681: 3RD QTR | P681: FINAL | S681: UMPIRES
A682: PRAHRAN | C682: 7 | D682: 3 | E682: 45 | G682: 9 | H682: 4 | I682: 58 | K682: 12 | L682: 9 | M682: 81 | O682: 16 | P682: 12 | Q682: 108 | S682: TORNEY | X682: LADDER | AB682: ROUND | AD682: 13
A683: GEELONG WEST | C683: 2 | D683: 4 | E683: 16 | G683: 9 | H683: 7 | I683: 61 | K683: 12 | L683: 10 | M683: 82 | O683: 14 | P683: 10 | Q683: 94 | S683: HUTCHINSON
A684: BEST PLAYERS | W684: TEAM | X684: W | Y684: L | Z684: D | AA684: FOR | AB684: AGST | AC684: % | AD684: PTS
A685: PRAHRAN | C685: PAGE | F685: WRIGHT | I685: McDONALD | L685: P McCORMACK | O685: I McCORMACK | R685: STEPHENS
A686: GEELONG WEST | C686: KRANJC | F686: RADOJEVIC | I686: EVANS | L686: TORNEY | W686: PRESTON | X686: 11 | Y686: 2 | Z686: 0 | AA686: 1925 | AB686: 1327 | AC686: =(AA686/AB686)*100 -> 145.06405425772419 | AD686: =(X686*4)+(Z686*2) -> 44
A687: GOALKICKERS | R687: DAVIDSON | W687: GEELONG WEST | X687: 11 | Y687: 2 | Z687: 0 | AA687: 1665 | AB687: 1257 | AC687: =(AA687/AB687)*100 -> 132.45823389021481 | AD687: =(X687*4)+(Z687*2) -> 44
A688: PRAHRAN | C688: MCNAMARA 5 | F688: GILES 3 | H688: STEPHENS 2 | J688: I McCORMACK | M688: WRIGHT | O688: WALLACE | Q688: McDONALD | T688: TAPPING | W688: SANDRINGHAM | X688: 9 | Y688: 4 | Z688: 0 | AA688: 2277 | AB688: 1776 | AC688: =(AA688/AB688)*100 -> 128.20945945945945 | AD688: =(X688*4)+(Z688*2) -> 36
A689: GEELONG WEST | C689: RADOJEVIC 6 | F689: EVANS 4 | H689: CLARKE | J689: SODOMACO | M689: TORNEY | O689: EDDY | W689: CAMBERWELL | X689: 8 | Y689: 5 | Z689: 0 | AA689: 1868 | AB689: 1421 | AC689: =(AA689/AB689)*100 -> 131.45672061928221 | AD689: =(X689*4)+(Z689*2) -> 32
S690: VENUE: PORT MELBOURNE
A691: PORT MELBOURNE | C691: 6 | D691: 5 | E691: 41 | G691: 13 | H691: 6 | I691: 84 | K691: 19 | L691: 8 | M691: 122 | O691: 24 | P691: 14 | Q691: 168 | S691: BUDGE | W691: PORT MELBOURNE | X691: 8 | Y691: 5 | Z691: 0 | AA691: 1735 | AB691: 1521 | AC691: =(AA691/AB691)*100 -> 114.06969099276792 | AD691: =(X691*4)+(Z691*2) -> 32
A692: SANDRINGHAM | C692: 2 | D692: 4 | E692: 16 | G692: 5 | H692: 6 | I692: 36 | K692: 8 | L692: 11 | M692: 59 | O692: 16 | P692: 14 | Q692: 110 | S692: OAKLEY | W692: FRANKSTON | X692: 7 | Y692: 6 | Z692: 0 | AA692: 1660 | AB692: 1583 | AC692: =(AA692/AB692)*100 -> 104.86418193303852 | AD692: =(X692*4)+(Z692*2) -> 28
A693: BEST PLAYERS | W693: WILLIAMSTOWN | X693: 7 | Y693: 6 | Z693: 0 | AA693: 1763 | AB693: 1718 | AC693: =(AA693/AB693)*100 -> 102.61932479627474 | AD693: =(X693*4)+(Z693*2) -> 28
A694: PORT MELBOURNE | C694: DERMOTT | F694: COOPER | I694: ANDERSON | L694: GOSS | O694: CLARK | R694: O'RILEY | W694: COBURG | X694: 5 | Y694: 8 | Z694: 0 | AA694: 1493 | AB694: 1570 | AC694: =(AA694/AB694)*100 -> 95.095541401273891 | AD694: =(X694*4)+(Z694*2) -> 20
A695: SANDRINGHAM | C695: PEARSON | F695: MANNIX | I695: BERGMAN | L695: ADAMS | O695: DIPIERDOMENICO | R695: DUURSMA | W695: PRAHRAN | X695: 5 | Y695: 8 | Z695: 0 | AA695: 1452 | AB695: 1741 | AC695: =(AA695/AB695)*100 -> 83.400344629523261 | AD695: =(X695*4)+(Z695*2) -> 20
A696: GOALKICKERS | W696: SPRINGVALE | X696: 4 | Y696: 9 | Z696: 0 | AA696: 1561 | AB696: 1828 | AC696: =(AA696/AB696)*100 -> 85.393873085339166 | AD696: =(X696*4)+(Z696*2) -> 16
A697: PORT MELBOURNE | C697: ANDERSON 7 | F697: LOVE 5 | H697: COOK 3 | J697: BRIEDIS 3 | M697: EBEYER 3 | O697: O'RILEY 2 | Q697: SWAN | W697: WERRIBEE | X697: 2 | Y697: 11 | Z697: 0 | AA697: 1225 | AB697: 1959 | AC697: =(AA697/AB697)*100 -> 62.531904032669729 | AD697: =(X697*4)+(Z697*2) -> 8
A698: SANDRINGHAM | C698: DIPIERDOMENICO 4 | G698: BREWER 3 | I698: DUURSMA 2 | L698: BINGHAM 2 | N698: RAFFERTY 2 | Q698: GALLAGHER | T698: ADAMS | W698: DANDENONG | X698: 1 | Y698: 12 | Z698: 0 | AA698: 1223 | AB698: 2266 | AC698: =(AA698/AB698)*100 -> 53.971756398940862 | AD698: =(X698*4)+(Z698*2) -> 4
P699: SIMS
A700: WILLIAMSTOWN | C700: 2 | D700: 3 | E700: 15 | G700: 9 | H700: 5 | I700: 59 | K700: 14 | L700: 7 | M700: 91 | O700: 19 | P700: 9 | Q700: 123 | S700: VENUE: COBURG
A701: COBURG | C701: 4 | D701: 4 | E701: 28 | G701: 6 | H701: 7 | I701: 43 | K701: 9 | L701: 9 | M701: 63 | O701: 12 | P701: 14 | Q701: 86 | S701: MARCY ;WALKER
A702: BEST PLAYERS
A703: WILLIAMSTOWN | C703: MURPHY | F703: TOWNS | I703: FOTHERINGHAM | L703: KERSHAW | O703: DAVIDSON | R703: WHEELER
A704: COBURG | C704: LITTLER | F704: CLEARY | I704: ROBERTSON | L704: NOLAN | O704: HALBERT | R704: ALEXANDER
A705: GOALKICKERS
A706: WILLIAMSTOWN | C706: FOTHERINGHAM 8 | G706: TOWNS 4 | I706: SIMMONS 3 | L706: HUMMEL 2 | O706: WALKER | Q706: HODGES
A707: COBURG | C707: LAIDLER 4 | E707: TULLOCH 2 | G707: ALEXANDER | I707: COLLINS | K707: CLEARY | M707: DOHNT | O707: FREEMAN | Q707: LITTLER
A709: WERRIBEE | C709: 10 | D709: 2 | E709: 62 | G709: 12 | H709: 6 | I709: 78 | K709: 15 | L709: 9 | M709: 99 | O709: 20 | P709: 15 | Q709: 135 | S709: VENUE: WERRIBEE
A710: DANDENONG | C710: 1 | D710: 4 | E710: 10 | G710: 3 | H710: 9 | I710: 27 | K710: 10 | L710: 11 | M710: 71 | O710: 15 | P710: 11 | Q710: 101 | S710: GROOM ;BREWER
A711: BEST PLAYERS
A712: WERRIBEE | C712: HOPKINS | F712: REDENBACH | I712: CHRISTIANSEN | L712: RICHARDSON | O712: BURNETT | R712: BONAT
A713: DANDENONG | C713: BASS | F713: WRIGHT | I713: FINN | L713: DE KONNING | O713: HENWOOD
A714: GOALKICKERS
A715: WERRIBEE | C715: RICHARDSON 4 | F715: BONAT 3 | H715: BURNETT 3 | J715: CHRISTIANSEN 3 | N715: PERKINS 3 | Q715: REDENBACH 2 | T715: ROGERZIK 2
A716: DANDENONG | C716: WRIGHT 7 | F716: HALL 4 | H716: KANNOURAKIS 2 | K716: WOOD | M716: HENWOOD
A718: FRANKSTON | C718: 4 | D718: 13 | E718: 37 | G718: 8 | H718: 16 | I718: 64 | K718: 11 | L718: 23 | M718: 89 | O718: 18 | P718: 25 | Q718: 133 | S718: VENUE: FRANKSTON
A719: CAMBERWELL | C719: 2 | D719: 1 | E719: 13 | G719: 4 | H719: 6 | I719: 30 | K719: 9 | L719: 10 | M719: 64 | O719: 18 | P719: 16 | Q719: 124 | S719: MAY :MARSHALL
A720: BEST PLAYERS
A721: FRANKSTON | C721: R KANE | F721: G KANE | I721: BRUIN | L721: GEDDES
A722: CAMBERWELL | C722: CONSTANTINOU | F722: HIPWORTH | I722: DAVIDSON | L722: TURNER
A723: GOALKICKERS
A724: FRANKSTON | C724: HILTON 4 | E724: BELL 3 | G724: R KANE 3 | I724: COLE 2 | K724: DUNBAR 2 | M724: ROGERSON 2 | P724: G KANE | R724: GEDDES
A725: CAMBERWELL | C725: STEVENSON 5 | F725: CONSTANTINOU 5 | J725: DAVIDSON 3 | M725: HIPWORTH 2 | P725: BARNES 2 | S725: PALMER
A727: PRESTON | C727: 2 | D727: 6 | E727: 18 | G727: 6 | H727: 10 | I727: 46 | K727: 15 | L727: 14 | M727: 104 | O727: 21 | P727: 20 | Q727: 146 | S727: VENUE: SPRINGVALE
A728: SPRINGVALE | C728: 5 | D728: 1 | E728: 31 | G728: 7 | H728: 4 | I728: 46 | K728: 9 | L728: 9 | M728: 63 | O728: 10 | P728: 9 | Q728: 69 | S728: CASEY :FITZPATRICK
A729: BEST PLAYERS
A730: PRESTON | C730: BOURKE | F730: FROST | I730: SALVADORE | L730: FYFFE | O730: MARCON | R730: McKEON
A731: SPRINGVALE | C731: KING | F731: GRAY | I731: SKILTON | L731: HERBERT | O731: DEMPSTER
A732: GOALKICKERS
A733: PRESTON | C733: BOURKE 5 | F733: HALAS 3 | H733: RUSSELL 3 | J733: SALVADORE 3 | M733: JORDAN 3 | O733: FYFFE 2 | Q733: BRINE | S733: FROST
A734: SPRINGVALE | C734: HERBERT 2 | F734: WALTER 2 | I734: CHAPMAN | K734: DEMPSTER | M734: CARROLL | O734: GRAY | Q734: PAXTON | S734: FOTINIOTIS
A736: ROUND 14 | D736: 29TH JULY | I736: WEATHER | S736: VENUE: BEACH ROAD
D737: 1ST QTR | H737: 2ND QTR | L737: 3RD QTR | P737: FINAL | S737: UMPIRES
A738: SANDRINGHAM | C738: 6 | D738: 2 | E738: 38 | G738: 14 | H738: 6 | I738: 90 | K738: 18 | L738: 11 | M738: 119 | O738: 22 | P738: 15 | Q738: 147 | S738: GROOM | X738: LADDER | AB738: ROUND | AD738: 14
A739: PRAHRAN | C739: 2 | D739: 3 | E739: 15 | G739: 3 | H739: 7 | I739: 25 | K739: 6 | L739: 8 | M739: 44 | O739: 8 | P739: 12 | Q739: 60 | S739: VERGONA
A740: BEST PLAYERS | W740: TEAM | X740: W | Y740: L | Z740: D | AA740: FOR | AB740: AGST | AC740: % | AD740: PTS
A741: SANDRINGHAM | C741: MACLEOD | F741: LYONS | I741: MANSFIELD | L741: ADAMS | O741: HART | R741: MANNIX
A742: PRAHRAN | C742: P McDONALD | F742: S McDONALD | I742: P McCORMACK | L742: WALLACE | O742: PARKER | W742: PRESTON | X742: 12 | Y742: 2 | Z742: 0 | AA742: 2006 | AB742: 1387 | AC742: =(AA742/AB742)*100 -> 144.62869502523432 | AD742: =(X742*4)+(Z742*2) -> 48
A743: GOALKICKERS | Q743: MACLEOD | S743: ASHKAR | W743: GEELONG WEST | X743: 12 | Y743: 2 | Z743: 0 | AA743: 1764 | AB743: 1293 | AC743: =(AA743/AB743)*100 -> 136.42691415313226 | AD743: =(X743*4)+(Z743*2) -> 48
A744: SANDRINGHAM | C744: BINGHAM 5 | F744: HART 4 | H744: MANNIX 3 | J744: MANSFIELD 2 | M744: DUURSMA 2 | P744: FREW 2 | R744: WOOLFE 2 | W744: SANDRINGHAM | X744: 10 | Y744: 4 | Z744: 0 | AA744: 2424 | AB744: 1836 | AC744: =(AA744/AB744)*100 -> 132.02614379084966 | AD744: =(X744*4)+(Z744*2) -> 40
A745: PRAHRAN | C745: PARKER 4 | F745: McNAMARA 2 | I745: P McCORMACK | L745: STEPHENS | W745: CAMBERWELL | X745: 8 | Y745: 6 | Z745: 0 | AA745: 1974 | AB745: 1558 | AC745: =(AA745/AB745)*100 -> 126.70089858793325 | AD745: =(X745*4)+(Z745*2) -> 32
S746: VENUE: WERRIBEE
A747: FRANKSTON | C747: 5 | D747: 7 | E747: 37 | G747: 10 | H747: 12 | I747: 72 | K747: 14 | L747: 15 | M747: 99 | O747: 18 | P747: 17 | Q747: 125 | S747: BUDGE | W747: PORT MELBOURNE | X747: 8 | Y747: 6 | Z747: 0 | AA747: 1795 | AB747: 1602 | AC747: =(AA747/AB747)*100 -> 112.04744069912608 | AD747: =(X747*4)+(Z747*2) -> 32
A748: WERRIBEE | C748: 3 | D748: 7 | E748: 25 | G748: 4 | H748: 7 | I748: 31 | K748: 9 | L748: 11 | M748: 65 | O748: 15 | P748: 12 | Q748: 102 | S748: WALKER | W748: FRANKSTON | X748: 8 | Y748: 6 | Z748: 0 | AA748: 1785 | AB748: 1685 | AC748: =(AA748/AB748)*100 -> 105.93471810089021 | AD748: =(X748*4)+(Z748*2) -> 32
A749: BEST PLAYERS | W749: WILLIAMSTOWN | X749: 8 | Y749: 6 | Z749: 0 | AA749: 1881 | AB749: 1809 | AC749: =(AA749/AB749)*100 -> 103.98009950248756 | AD749: =(X749*4)+(Z749*2) -> 32
A750: FRANKSTON | C750: ROGERSON | F750: HORLER | I750: GEDDES | L750: COLE | O750: BARDOEL | R750: CROWDER | W750: COBURG | X750: 6 | Y750: 8 | Z750: 0 | AA750: 1630 | AB750: 1676 | AC750: =(AA750/AB750)*100 -> 97.255369928400953 | AD750: =(X750*4)+(Z750*2) -> 24
A751: WERRIBEE | C751: DOYLE | F751: REDENBACH | I751: PARKES | L751: BURNETT | O751: BONAT | R751: FEDKE | W751: PRAHRAN | X751: 5 | Y751: 9 | Z751: 0 | AA751: 1512 | AB751: 1888 | AC751: =(AA751/AB751)*100 -> 80.084745762711862 | AD751: =(X751*4)+(Z751*2) -> 20
A752: GOALKICKERS | Q752: DUNBAR | W752: SPRINGVALE | X752: 4 | Y752: 10 | Z752: 0 | AA752: 1652 | AB752: 1946 | AC752: =(AA752/AB752)*100 -> 84.892086330935257 | AD752: =(X752*4)+(Z752*2) -> 16
A753: FRANKSTON | C753: ROGERSON 5 | F753: CZARNECKI 3 | I753: BARDOEL 2 | L753: COLE 2 | N753: HILTON 2 | P753: R KANE 2 | R753: GEDDES | W753: WERRIBEE | X753: 2 | Y753: 12 | Z753: 0 | AA753: 1327 | AB753: 2084 | AC753: =(AA753/AB753)*100 -> 63.675623800383875 | AD753: =(X753*4)+(Z753*2) -> 8
A754: WERRIBEE | C754: CHRISTIANSEN 4 | F754: BURNETT 2 | I754: GOODWIN 2 | L754: REDENBACH 2 | O754: ROGERZIK 2 | Q754: FEDKE | R754: PARKES | W754: DANDENONG | X754: 1 | Y754: 13 | Z754: 0 | AA754: 1259 | AB754: 2365 | AC754: =(AA754/AB754)*100 -> 53.234672304439748 | AD754: =(X754*4)+(Z754*2) -> 4
P755: PERKINS
A756: COBURG | C756: 3 | D756: 2 | E756: 20 | G756: 11 | H756: 5 | I756: 71 | K756: 18 | L756: 8 | M756: 116 | O756: 21 | P756: 11 | Q756: 137 | S756: VENUE: CAMBERWELL
A757: CAMBERWELL | C757: 7 | D757: 6 | E757: 48 | G757: 10 | H757: 6 | I757: 66 | K757: 12 | L757: 9 | M757: 81 | O757: 15 | P757: 16 | Q757: 106 | S757: TORNEY :HUTCHINSON
A758: BEST PLAYERS
A759: COBURG | C759: ALEXANDER | F759: HALBERT | I759: HARBINSON | L759: LAIDLER | O759: WEBSTER | R759: BEATTIE
A760: CAMBERWELL | C760: DANS
A761: GOALKICKERS
A762: COBURG | C762: BEATTIE 10 | F762: HARBINSON 2 | I762: WEST 2 | K762: TULLOCH | M762: MAGRO | O762: NOLAN | Q762: CLEARY | S762: FREEMAN | V762: ROBERTSON
A763: CAMBERWELL | C763: STEVENSON 6 | F763: SCHULTZ 4 | I763: HIPWORTH 3 | L763: DANS | N763: CONSTANTINOU
A765: GEELONG WEST | C765: 6 | D765: 4 | E765: 40 | G765: 9 | H765: 7 | I765: 61 | K765: 13 | L765: 11 | M765: 89 | O765: 14 | P765: 15 | Q765: 99 | S765: VENUE: DANDENONG
A766: DANDENONG | C766: 0 | D766: 4 | E766: 4 | G766: 1 | H766: 5 | I766: 11 | K766: 2 | L766: 7 | M766: 19 | O766: 4 | P766: 12 | Q766: 36 | S766: CASEY :MORGAN
A767: BEST PLAYERS
A768: GEELONG WEST | C768: DALIHAUS | F768: KING | I768: EDDY | L768: KRANJC | O768: DOYLE | Q768: GIBSON
A769: DANDENONG | C769: DE KONNING | F769: BASS | I769: J FINN | L769: DICKSON
A770: GOALKICKERS
A771: GEELONG WEST | C771: RADOJEVIC 3 | F771: RICHARDSON 3 | I771: EVANS 2 | K771: EDDY 2 | M771: BERRY | O771: McMAHON | Q771: NICHOLS | S771: WATSON
A772: DANDENONG | C772: WESTCOTT 2 | F772: WRIGHT | H772: BASTINAC
A774: WILLIAMSTOWN | C774: 2 | D774: 3 | E774: 15 | G774: 11 | H774: 9 | I774: 75 | K774: 11 | L774: 10 | M774: 76 | O774: 17 | P774: 16 | Q774: 118 | S774: VENUE: WILLIAMSTOWN
A775: SPRINGVALE | C775: 4 | D775: 7 | E775: 31 | G775: 4 | H775: 8 | I775: 32 | K775: 10 | L775: 11 | M775: 71 | O775: 13 | P775: 13 | Q775: 91 | S775: BREWER ;PHILLIPS
A776: BEST PLAYERS
A777: WILLIAMSTOWN | C777: SWANN | F777: DAVIDSON | I777: SAIT | L777: OWEN | O777: TOWNS | R777: MURPHY
A778: SPRINGVALE | C778: TONKIN | F778: GRAY | I778: FOWLER | L778: PAXTON | O778: HERBERT | R778: SKILTON
A779: GOALKICKERS
A780: WILLIAMSTOWN | C780: TOWNS 4 | E780: MCCONNON 3 | H780: FOTHERINGHAM 3 | L780: SIMMONS 3 | O780: HUMMEL 2 | Q780: WALKER | T780: SAIT
A781: SPRINGVALE | C781: TONKIN 3 | E781: HERBERT 2 | G781: CARROLL 2 | I781: PAXTON 2 | L781: CHAPMAN | N781: GRAY | P781: WALTER | R781: WILLIAMS
A783: PRESTON | C783: 3 | D783: 1 | E783: 19 | G783: 9 | H783: 2 | I783: 56 | K783: 11 | L783: 8 | M783: 74 | O783: 12 | P783: 9 | Q783: 81 | S783: VENUE: PRESTON
A784: PORT MELBOURNE | C784: 4 | D784: 2 | E784: 26 | G784: 4 | H784: 5 | I784: 29 | K784: 5 | L784: 10 | M784: 40 | O784: 8 | P784: 12 | Q784: 60 | S784: MARSHALL :FITZPATRICK
A785: BEST PLAYERS
A786: PRESTON | C786: WIGHT | F786: FYFFE | I786: PLOWMAN | L786: DOYLE | O786: BROWN | Q786: ATKIN
A787: PORT MELBOURNE | C787: IRWIN | F787: SWAN | I787: FEHRING | L787: CARTER | O787: DERMOTT | Q787: COOPER
A788: GOALKICKERS
A789: PRESTON | C789: FYFFE 3 | E789: DINTINOSANTE 3 | H789: JORDAN 2 | K789: HALAS | M789: MARCON | O789: RUSSELL | Q789: BOURKE
A790: PORT MELBOURNE | C790: BRIEDIS 2 | F790: SWAN 2 | H790: COOK | J790: LOVE | L790: RODDA | N790: FEHRING
A792: ROUND 15 | D792: 5TH AUGUST | I792: WEATHER | S792: VENUE: SPRINGVALE
D793: 1ST QTR | H793: 2ND QTR | L793: 3RD QTR | P793: FINAL | S793: UMPIRES
A794: CAMBERWELL | C794: 3 | D794: 3 | E794: 21 | G794: 6 | H794: 7 | I794: 43 | K794: 11 | L794: 10 | M794: 76 | O794: 17 | P794: 12 | Q794: 114 | S794: GROOM | X794: LADDER | AB794: ROUND | AD794: 15
A795: SPRINGVALE | C795: 2 | D795: 5 | E795: 17 | G795: 5 | H795: 9 | I795: 39 | K795: 5 | L795: 11 | M795: 41 | O795: 6 | P795: 12 | Q795: 48 | S795: WALKER
A796: BEST PLAYERS | W796: TEAM | X796: W | Y796: L | Z796: D | AA796: FOR | AB796: AGST | AC796: % | AD796: PTS
A797: CAMBERWELL | C797: TURNER | F797: BURMEISTER | I797: DAVIDSON | L797: PEVITT | O797: CONSTANTINOU | R797: BOTTAMS
A798: SPRINGVALE | C798: TONKIN | F798: ANDERSON | I798: BRAND | L798: PAXTON | O798: HERBERT | W798: PRESTON | X798: 13 | Y798: 2 | Z798: 0 | AA798: 2140 | AB798: 1439 | AC798: =(AA798/AB798)*100 -> 148.7143849895761 | AD798: =(X798*4)+(Z798*2) -> 52
A799: GOALKICKERS | P799: WILKINSON | R799: DI STEFANO | W799: GEELONG WEST | X799: 13 | Y799: 2 | Z799: 0 | AA799: 1854 | AB799: 1356 | AC799: =(AA799/AB799)*100 -> 136.72566371681415 | AD799: =(X799*4)+(Z799*2) -> 52
A800: CAMBERWELL | C800: STEVENSON 3 | F800: DAVIDSON 3 | I800: CONSTANTINOU 2 | M800: SCHULTZ 2 | O800: ROURKE 2 | Q800: HIPWORTH 2 | T800: DODIG | W800: SANDRINGHAM | X800: 10 | Y800: 5 | Z800: 0 | AA800: 2487 | AB800: 1926 | AC800: =(AA800/AB800)*100 -> 129.12772585669782 | AD800: =(X800*4)+(Z800*2) -> 40
A801: SPRINGVALE | C801: ANDERSON 4 | F801: CARROLL 2 | W801: CAMBERWELL | X801: 9 | Y801: 6 | Z801: 0 | AA801: 2088 | AB801: 1606 | AC801: =(AA801/AB801)*100 -> 130.01245330012455 | AD801: =(X801*4)+(Z801*2) -> 36
S802: VENUE: GEELONG WEST
A803: GEELONG WEST | C803: 7 | D803: 2 | E803: 44 | G803: 7 | H803: 5 | I803: 47 | K803: 10 | L803: 8 | M803: 68 | O803: 13 | P803: 12 | Q803: 90 | S803: MARCY | W803: PORT MELBOURNE | X803: 9 | Y803: 6 | Z803: 0 | AA803: 1957 | AB803: 1704 | AC803: =(AA803/AB803)*100 -> 114.84741784037557 | AD803: =(X803*4)+(Z803*2) -> 36
A804: SANDRINGHAM | C804: 4 | D804: 1 | E804: 25 | G804: 5 | H804: 1 | I804: 31 | K804: 9 | L804: 2 | M804: 56 | O804: 10 | P804: 3 | Q804: 63 | S804: PHILLIPS | W804: FRANKSTON | X804: 9 | Y804: 6 | Z804: 0 | AA804: 1924 | AB804: 1765 | AC804: =(AA804/AB804)*100 -> 109.00849858356941 | AD804: =(X804*4)+(Z804*2) -> 36
A805: BEST PLAYERS | W805: WILLIAMSTOWN | X805: 8 | Y805: 7 | Z805: 0 | AA805: 1983 | AB805: 1971 | AC805: =(AA805/AB805)*100 -> 100.60882800608827 | AD805: =(X805*4)+(Z805*2) -> 32
A806: GEELONG WEST | C806: KRANJC | F806: EDDY | I806: SMITH | L806: WATSON | O806: DALIHAUS | R806: BERRY | W806: COBURG | X806: 7 | Y806: 8 | Z806: 0 | AA806: 1785 | AB806: 1752 | AC806: =(AA806/AB806)*100 -> 101.88356164383561 | AD806: =(X806*4)+(Z806*2) -> 28
A807: SANDRINGHAM | C807: RAFFERTY | F807: MACLEOD | I807: LYONS | L807: FITZPATRICK | O807: MANSFIELD | R807: HAYES | W807: PRAHRAN | X807: 5 | Y807: 10 | Z807: 0 | AA807: 1564 | AB807: 2022 | AC807: =(AA807/AB807)*100 -> 77.349159248269046 | AD807: =(X807*4)+(Z807*2) -> 20
A808: GOALKICKERS | W808: SPRINGVALE | X808: 4 | Y808: 11 | Z808: 0 | AA808: 1700 | AB808: 2060 | AC808: =(AA808/AB808)*100 -> 82.524271844660191 | AD808: =(X808*4)+(Z808*2) -> 16
A809: GEELONG WEST | C809: KING 2 | E809: NICHOLS 2 | G809: RADOJEVIC 2 | J809: EVANS 2 | L809: BERRY 2 | N809: EDDY | P809: RICHARDSON | S809: TORNEY | W809: WERRIBEE | X809: 2 | Y809: 13 | Z809: 0 | AA809: 1403 | AB809: 2239 | AC809: =(AA809/AB809)*100 -> 62.661902635104958 | AD809: =(X809*4)+(Z809*2) -> 8
A810: SANDRINGHAM | C810: HAYES 4 | F810: MANNIX 2 | I810: PEARSON | K810: FITZPATRICK | N810: FREW | P810: WOOLFE | W810: DANDENONG | X810: 1 | Y810: 14 | Z810: 0 | AA810: 1339 | AB810: 2504 | AC810: =(AA810/AB810)*100 -> 53.474440894568687 | AD810: =(X810*4)+(Z810*2) -> 4
A812: PRESTON | C812: 6 | D812: 3 | E812: 39 | G812: 8 | H812: 9 | I812: 57 | K812: 13 | L812: 14 | M812: 92 | O812: 19 | P812: 20 | Q812: 134 | S812: VENUE: TOORAK PARK
A813: PRAHRAN | C813: 1 | D813: 1 | E813: 7 | G813: 2 | H813: 2 | I813: 14 | K813: 5 | L813: 3 | M813: 33 | O813: 8 | P813: 4 | Q813: 52 | S813: BROWN :BUDGE
A814: BEST PLAYERS
A815: PRESTON | C815: FYFFE | F815: BOURKE | I815: JORDAN | L815: BRINE | O815: PLOWMAN | R815: MARCON
A816: PRAHRAN | C816: P McDONALD | F816: S McDONALD | I816: PARKER
A817: GOALKICKERS
A818: PRESTON | C818: BOURKE 5 | F818: FYFFE 3 | H818: RUSSELL 3 | J818: SALVADOR 2 | M818: HALAS | O818: WIGHT | Q818: ZERELLA | S818: BRINE | U818: SHAW | W818: MARCON
A819: PRAHRAN | C819: WRIGHT 2 | F819: P McCORMACK 2 | J819: REED | L819: CATTOGGIO | O819: STEPHENS | R819: S McDONALD
A821: COBURG | C821: 2 | D821: 4 | E821: 16 | G821: 7 | H821: 7 | I821: 49 | K821: 16 | L821: 12 | M821: 108 | O821: 23 | P821: 17 | Q821: 155 | S821: VENUE: COBURG
A822: WERRIBEE | C822: 2 | D822: 2 | E822: 14 | G822: 4 | H822: 3 | I822: 27 | K822: 7 | L822: 5 | M822: 47 | O822: 11 | P822: 10 | Q822: 76 | S822: CASEY :MARSHALL
A823: BEST PLAYERS
A824: COBURG | C824: WEBSTER | F824: DOHNT | I824: CLEARY | L824: ALEXANDER | O824: COLLINS | R824: ROBERTSON
A825: WERRIBEE | C825: HUGHES | F825: DOYLE | I825: BONAT | L825: FEDKE | O825: GOODWIN | R825: REDENBACH
A826: GOALKICKERS
A827: COBURG | C827: WEBSTER 6 | E827: BEATTIE 4 | G827: FREEMAN 2 | I827: TULLOCH 2 | L827: HALBERT | N827: LAIDLER | P827: MAGRO | R827: COLLINS | U827: CLEARY | W827: ROBERTSON | X827: EVANS | Z827: LITTLER | AB827: FREEMANTLE
A828: WERRIBEE | C828: PERKINS 4 | F828: GOODWIN 3 | I828: BONAT 2 | K828: REDENBACH | N828: CHRISTIANSEN
A830: PORT MELBOURNE | C830: 5 | D830: 4 | E830: 34 | G830: 14 | H830: 7 | I830: 91 | K830: 17 | L830: 17 | M830: 119 | O830: 23 | P830: 24 | Q830: 162 | S830: VENUE: PORT MELBOURNE
A831: WILLIAMSTOWN | C831: 3 | D831: 4 | E831: 22 | G831: 6 | H831: 6 | I831: 42 | K831: 10 | L831: 8 | M831: 68 | O831: 15 | P831: 12 | Q831: 102 | S831: VERGONA :MORGAN
A832: BEST PLAYERS
A833: PORT MELBOURNE | C833: BRIEDIS | F833: ROBERTSON | I833: HOY | L833: IRWIN | O833: THOMPSON | R833: GOSS
A834: WILLIAMSTOWN | C834: SLEVISON | F834: OWEN | I834: NANKERVIS | L834: FOTHERINGHAM | O834: EATHER | R834: DAVIDSON
A835: GOALKICKERS
A836: PORT MELBOURNE | C836: LOVE 6 | E836: HOY 5 | G836: O'RILEY 4 | I836: ANDERSON 4 | L836: SWAN 2 | N836: BRIEDIS | P836: EBEYER
A837: WILLIAMSTOWN | C837: FOTHERINGHAM 7 | G837: DAVIDSON 2 | J837: DULLARD | L837: GOETZ | N837: SLEVISON | P837: TOWNS | R837: OWEN | T837: SAIT
A839: FRANKSTON | C839: 5 | D839: 5 | E839: 35 | G839: 10 | H839: 17 | I839: 77 | K839: 15 | L839: 19 | M839: 109 | O839: 19 | P839: 25 | Q839: 139 | S839: VENUE: FRANKSTON
A840: DANDENONG | C840: 4 | D840: 2 | E840: 26 | G840: 5 | H840: 3 | I840: 33 | K840: 9 | L840: 6 | M840: 60 | O840: 12 | P840: 8 | Q840: 80 | S840: FITZPATRICK :HUTCHINSON
A841: BEST PLAYERS
A842: FRANKSTON | C842: BARDOEL | F842: GEDDES | I842: HORLER | L842: CZARNECKI
A843: DANDENONG | C843: WOOD | F843: HENWOOD | I843: METE | L843: WRIGHT | O843: DE KONNING
A844: GOALKICKERS
A845: FRANKSTON | C845: COLE 4 | E845: GEDDES 4 | G845: BARDOEL 3 | I845: BELL | K845: ROGERSON | M845: R KANE | O845: GAMBLE | Q845: CZARNECKI | T845: THOMAS | W845: CROWDER | X845: WALSH
A846: DANDENONG | C846: WRIGHT 5 | F846: HENWOOD 3 | I846: SCULLY 2 | K846: WESTCOTT | M846: METE
A848: ROUND 16 | D848: 12TH AUGUST | I848: WEATHER | S848: VENUE: CAMBERWELL
D849: 1ST QTR | H849: 2ND QTR | L849: 3RD QTR | P849: FINAL | S849: UMPIRES
A850: CAMBERWELL | C850: 6 | D850: 1 | E850: 37 | G850: 8 | H850: 2 | I850: 50 | K850: 13 | L850: 8 | M850: 86 | O850: 13 | P850: 12 | Q850: 90 | S850: BUDGE | X850: LADDER | AB850: ROUND | AD850: 16
A851: PORT MELBOURNE | C851: 2 | D851: 3 | E851: 15 | G851: 8 | H851: 7 | I851: 55 | K851: 12 | L851: 7 | M851: 79 | O851: 13 | P851: 9 | Q851: 87 | S851: PHILLIPS
A852: BEST PLAYERS | W852: TEAM | X852: W | Y852: L | Z852: D | AA852: FOR | AB852: AGST | AC852: % | AD852: PTS
A853: CAMBERWELL | C853: TEAM EFFORT
A854: PORT MELBOURNE | C854: THOMPSON | F854: CHADBAND | I854: SWAN | K854: GOSS | M854: ROBERTSON | Q854: EBEYER | W854: PRESTON | X854: 14 | Y854: 2 | Z854: 0 | AA854: 2266 | AB854: 1518 | AC854: =(AA854/AB854)*100 -> 149.27536231884056 | AD854: =(X854*4)+(Z854*2) -> 56
A855: GOALKICKERS | W855: GEELONG WEST | X855: 13 | Y855: 3 | Z855: 0 | AA855: 1933 | AB855: 1482 | AC855: =(AA855/AB855)*100 -> 130.43184885290148 | AD855: =(X855*4)+(Z855*2) -> 52
A856: CAMBERWELL | C856: STEVENSON 5 | F856: HIPWORTH 2 | I856: WEATHERALD 2 | L856: TURNER | N856: LOVE | P856: DAVIDSON | R856: MAILING | W856: SANDRINGHAM | X856: 11 | Y856: 5 | Z856: 0 | AA856: 2599 | AB856: 1990 | AC856: =(AA856/AB856)*100 -> 130.60301507537687 | AD856: =(X856*4)+(Z856*2) -> 44
A857: PORT MELBOURNE | C857: ANDERSON 4 | F857: LOVE 2 | H857: BRIEDIS 2 | J857: IRWIN | L857: O'RILEY | N857: SWAN | P857: HOY | R857: EBEYER | W857: CAMBERWELL | X857: 10 | Y857: 6 | Z857: 0 | AA857: 2178 | AB857: 1693 | AC857: =(AA857/AB857)*100 -> 128.64737152982869 | AD857: =(X857*4)+(Z857*2) -> 40
S858: VENUE: DANDENONG
A859: SANDRINGHAM | C859: 4 | D859: 2 | E859: 26 | G859: 11 | H859: 6 | I859: 72 | K859: 15 | L859: 6 | M859: 96 | O859: 17 | P859: 10 | Q859: 112 | S859: MARSHALL | W859: FRANKSTON | X859: 10 | Y859: 6 | Z859: 0 | AA859: 2045 | AB859: 1867 | AC859: =(AA859/AB859)*100 -> 109.53401178361007 | AD859: =(X859*4)+(Z859*2) -> 40
A860: DANDENONG | C860: 3 | D860: 3 | E860: 21 | G860: 7 | H860: 4 | I860: 46 | K860: 9 | L860: 6 | M860: 60 | O860: 9 | P860: 10 | Q860: 64 | S860: WALKER | W860: PORT MELBOURNE | X860: 9 | Y860: 7 | Z860: 0 | AA860: 2044 | AB860: 1794 | AC860: =(AA860/AB860)*100 -> 113.93534002229654 | AD860: =(X860*4)+(Z860*2) -> 36
A861: BEST PLAYERS | W861: WILLIAMSTOWN | X861: 9 | Y861: 7 | Z861: 0 | AA861: 2077 | AB861: 2040 | AC861: =(AA861/AB861)*100 -> 101.81372549019608 | AD861: =(X861*4)+(Z861*2) -> 36
A862: SANDRINGHAM | C862: MANSFIELD | F862: MANNIX | I862: ADAMS | L862: BEUS | N862: HETHERINGTON | W862: COBURG | X862: 7 | Y862: 9 | Z862: 0 | AA862: 1887 | AB862: 1873 | AC862: =(AA862/AB862)*100 -> 100.74746396155901 | AD862: =(X862*4)+(Z862*2) -> 28
A863: DANDENONG | C863: HENWOOD | F863: WOOD | I863: CASTRICUM | L863: BASS | N863: DE KONNING | W863: SPRINGVALE | X863: 5 | Y863: 11 | Z863: 0 | AA863: 1812 | AB863: 2159 | AC863: =(AA863/AB863)*100 -> 83.927744326076891 | AD863: =(X863*4)+(Z863*2) -> 20
A864: GOALKICKERS | M864: HETHERINGTON | Q864: MANNIX | W864: PRAHRAN | X864: 5 | Y864: 11 | Z864: 0 | AA864: 1633 | AB864: 2116 | AC864: =(AA864/AB864)*100 -> 77.173913043478265 | AD864: =(X864*4)+(Z864*2) -> 20
A865: SANDRINGHAM | C865: MORRISON 5 | F865: MANSFIELD 2 | I865: MACLEOD 2 | L865: ADAMS 2 | N865: BREWER 2 | Q865: LYONS 2 | W865: WERRIBEE | X865: 2 | Y865: 14 | Z865: 0 | AA865: 1502 | AB865: 2351 | AC865: =(AA865/AB865)*100 -> 63.887707358570822 | AD865: =(X865*4)+(Z865*2) -> 8
A866: DANDENONG | C866: WRIGHT 4 | F866: HALL 2 | H866: WESTCOTT 2 | K866: WEST | W866: DANDENONG | X866: 1 | Y866: 15 | Z866: 0 | AA866: 1403 | AB866: 2616 | AC866: =(AA866/AB866)*100 -> 53.631498470948017 | AD866: =(X866*4)+(Z866*2) -> 4
A868: FRANKSTON | C868: 4 | D868: 5 | E868: 29 | G868: 7 | H868: 13 | I868: 55 | K868: 10 | L868: 18 | M868: 78 | O868: 16 | P868: 25 | Q868: 121 | S868: VENUE: FRANKSTON
A869: COBURG | C869: 4 | D869: 2 | E869: 26 | G869: 10 | H869: 6 | I869: 66 | K869: 14 | L869: 10 | M869: 94 | O869: 15 | P869: 12 | Q869: 102 | S869: MARCY :MORGAN
A870: BEST PLAYERS
A871: FRANKSTON | C871: HORLER | F871: WALSH | I871: THOMAS | L871: GEDDES | O871: BALDWIN | R871: CZARNECKI
A872: COBURG | C872: DOHNT | F872: COLLINS | I872: ROBERTSON | L872: CLEARY
A873: GOALKICKERS
A874: FRANKSTON | C874: THOMAS 4 | F874: WALSH 3 | H874: BARDOEL 2 | J874: ROGERSON 2 | M874: GEDDES 2 | O874: BEATON | Q874: CZARNECKI | T874: G KANE
A875: COBURG | C875: FREEMAN 2 | F875: TULLOCH 2 | I875: HARBINSON 2 | L875: HALBERT 2 | N875: PITT 2 | P875: WEBSTER 2 | S875: FREMANTLE | W875: ROBERTSON | X875: BEATTIE
A877: PRESTON | C877: 3 | D877: 4 | E877: 22 | G877: 8 | H877: 9 | I877: 57 | K877: 12 | L877: 9 | M877: 81 | O877: 19 | P877: 12 | Q877: 126 | S877: VENUE: PRESTON
A878: GEELONG WEST | C878: 5 | D878: 2 | E878: 32 | G878: 7 | H878: 2 | I878: 44 | K878: 9 | L878: 5 | M878: 59 | O878: 12 | P878: 7 | Q878: 79 | S878: VERGONA :GROOM
A879: BEST PLAYERS
A880: PRESTON | C880: BRINE | F880: SALVADORE | I880: McKEON | L880: MARCON | O880: JORDAN | R880: WIGHT
A881: GEELONG WEST | C881: DALIHAUS | F881: RADOJEVIC | I881: NICHOLS | L881: KRANJC | O881: SMITH | R881: EVANS
A882: GOALKICKERS
A883: PRESTON | C883: JORDAN 4 | F883: BRINE 4 | H883: BOURKE 3 | J883: RUSSELL 3 | M883: FYFFE 2 | O883: BEER | Q883: SALVADORE | T883: HACKNEY
A884: GEELONG WEST | C884: RADOJEVIC 6 | F884: McMAHON | I884: CHAMBERS | L884: EDDY | N884: KRANJC | P884: KING | R884: NICHOLS
A886: SPRINGVALE | C886: 2 | D886: 1 | E886: 13 | G886: 8 | H886: 4 | I886: 52 | K886: 12 | L886: 6 | M886: 78 | O886: 17 | P886: 10 | Q886: 112 | S886: VENUE: WERRIBEE
A887: WERRIBEE | C887: 7 | D887: 8 | E887: 50 | G887: 9 | H887: 8 | I887: 62 | K887: 12 | L887: 14 | M887: 86 | O887: 14 | P887: 15 | Q887: 99 | S887: HUTCHINSON :FITZGERALD
A888: BEST PLAYERS
A889: SPRINGVALE | C889: WALTER | F889: McCOMB | I889: STEEL | L889: ANDERSON | O889: SMITH
A890: WERRIBEE | C890: BONAT | F890: BURNETT | I890: HOPKINS | L890: MEMBREY
A891: GOALKICKERS
A892: SPRINGVALE | C892: ANDERSON 4 | F892: STEEL 4 | H892: CARROLL 4 | K892: BRAND | M892: SMITH | O892: FOTINIOTIS | Q892: GRAY | S892: ALEXANDER
A893: WERRIBEE | C893: BURNETT 5 | F893: CHRISTIANSEN 2 | I893: BONAT 2 | K893: GOODWIN 2 | N893: REDENBACH | Q893: FREEMAN | S893: MEMBREY
A895: WILLIAMSTOWN | C895: 4 | D895: 5 | E895: 29 | G895: 7 | H895: 7 | I895: 49 | K895: 13 | L895: 12 | M895: 90 | O895: 13 | P895: 16 | Q895: 94 | S895: VENUE: WILLIAMSTOWN
A896: PRAHRAN | C896: 0 | D896: 1 | E896: 1 | G896: 3 | H896: 6 | I896: 24 | K896: 3 | L896: 6 | M896: 24 | O896: 9 | P896: 15 | Q896: 69 | S896: TORNEY :CASEY
A897: BEST PLAYERS
A898: WILLIAMSTOWN | C898: EATHER | F898: WHEELER | I898: DAVIDSON | L898: MURPHY | O898: SWANN | R898: HODGES
A899: PRAHRAN | C899: P McDONALD | F899: STEPHENS | I899: P McCORMACK | L899: PARKER
A900: GOALKICKERS
A901: WILLIAMSTOWN | C901: FOTHERINGHAM 5 | G901: SLEVISON 2 | I901: HODGES | K901: WALKER | M901: DAVIS | O901: TOWNS | Q901: HUMMEL | T901: JOHN
A902: PRAHRAN | C902: REED 2 | F902: P McDONALD 2 | I902: TORCASIO 2 | L902: BICKFORD | N902: WALLACE | Q902: P McDONALD
A904: ROUND 17 | D904: 19TH AUGUST | I904: WEATHER | S904: VENUE: SPRINGVALE
D905: 1ST QTR | H905: 2ND QTR | L905: 3RD QTR | P905: FINAL | S905: UMPIRES
A906: FRANKSTON | C906: 6 | D906: 2 | E906: 38 | G906: 11 | H906: 6 | I906: 72 | K906: 16 | L906: 8 | M906: 104 | O906: 23 | P906: 12 | Q906: 150 | S906: PHILLIPS | X906: LADDER | AB906: ROUND | AD906: 17
A907: SPRINGVALE | C907: 2 | D907: 4 | E907: 16 | G907: 5 | H907: 6 | I907: 36 | K907: 6 | L907: 9 | M907: 45 | O907: 8 | P907: 13 | Q907: 61 | S907: TORNEY
A908: BEST PLAYERS | W908: TEAM | X908: W | Y908: L | Z908: D | AA908: FOR | AB908: AGST | AC908: % | AD908: PTS
A909: FRANKSTON | C909: TEAM EFFORT
A910: SPRINGVALE | C910: FOWLER | F910: ANDERSON | I910: FOTINIOTIS | L910: GRAY | N910: DEMPSTER | W910: PRESTON | X910: 15 | Y910: 2 | Z910: 0 | AA910: 2495 | AB910: 1597 | AC910: =(AA910/AB910)*100 -> 156.23043206011272 | AD910: =(X910*4)+(Z910*2) -> 60
A911: GOALKICKERS | Q911: CROWDER | S911: WALSH | W911: GEELONG WEST | X911: 14 | Y911: 3 | Z911: 0 | AA911: 2050 | AB911: 1560 | AC911: =(AA911/AB911)*100 -> 131.41025641025641 | AD911: =(X911*4)+(Z911*2) -> 56
A912: FRANKSTON | C912: ROGERSON 5 | F912: HILTON 5 | H912: COLE 4 | J912: BARDOEL 2 | M912: THOMAS 2 | O912: R KANE | Q912: GEDDES | S912: CZARNECKI | W912: CAMBERWELL | X912: 11 | Y912: 6 | Z912: 0 | AA912: 2293 | AB912: 1792 | AC912: =(AA912/AB912)*100 -> 127.95758928571428 | AD912: =(X912*4)+(Z912*2) -> 44
A913: SPRINGVALE | C913: ANDERSON 4 | F913: GRAY 2 | H913: CARROLL | J913: FOTINIOTIS | W913: SANDRINGHAM | X913: 11 | Y913: 6 | Z913: 0 | AA913: 2678 | AB913: 2219 | AC913: =(AA913/AB913)*100 -> 120.68499324019828 | AD913: =(X913*4)+(Z913*2) -> 44
S914: VENUE: BEACH ROAD
A915: PRESTON | C915: 6 | D915: 2 | E915: 38 | G915: 15 | H915: 10 | I915: 100 | K915: 22 | L915: 15 | M915: 147 | O915: 35 | P915: 19 | Q915: 229 | S915: MORGAN | W915: FRANKSTON | X915: 11 | Y915: 6 | Z915: 0 | AA915: 2195 | AB915: 1928 | AC915: =(AA915/AB915)*100 -> 113.84854771784232 | AD915: =(X915*4)+(Z915*2) -> 44
A916: SANDRINGHAM | C916: 2 | D916: 4 | E916: 16 | G916: 5 | H916: 6 | I916: 36 | K916: 9 | L916: 7 | M916: 61 | O916: 12 | P916: 7 | Q916: 79 | S916: CASEY | W916: PORT MELBOURNE | X916: 10 | Y916: 7 | Z916: 0 | AA916: 2232 | AB916: 1905 | AC916: =(AA916/AB916)*100 -> 117.16535433070867 | AD916: =(X916*4)+(Z916*2) -> 40
A917: BEST PLAYERS | W917: WILLIAMSTOWN | X917: 9 | Y917: 8 | Z917: 0 | AA917: 2155 | AB917: 2157 | AC917: =(AA917/AB917)*100 -> 99.907278627723699 | AD917: =(X917*4)+(Z917*2) -> 36
A918: PRESTON | C918: HACKNEY | F918: BRINE | I918: MARCON | L918: RUSSELL | O918: ATKIN | Q918: BOURKE | W918: COBURG | X918: 8 | Y918: 9 | Z918: 0 | AA918: 2076 | AB918: 1925 | AC918: =(AA918/AB918)*100 -> 107.84415584415585 | AD918: =(X918*4)+(Z918*2) -> 32
A919: SANDRINGHAM | C919: MANNIX | F919: RAFFERTY | I919: LYONS | L919: BREWER | W919: SPRINGVALE | X919: 5 | Y919: 12 | Z919: 0 | AA919: 1873 | AB919: 2309 | AC919: =(AA919/AB919)*100 -> 81.117366825465567 | AD919: =(X919*4)+(Z919*2) -> 20
A920: GOALKICKERS | Q920: MARCON | W920: PRAHRAN | X920: 5 | Y920: 12 | Z920: 0 | AA920: 1732 | AB920: 2231 | AC920: =(AA920/AB920)*100 -> 77.633348274316447 | AD920: =(X920*4)+(Z920*2) -> 20
A921: PRESTON | C921: RUSSELL 9 | E921: BOURKE 6 | G921: HACKNEY 6 | I921: BRINE 5 | K921: JORDAN 3 | M921: BEER 3 | O921: SALVADORE | R921: McKEON | W921: WERRIBEE | X921: 2 | Y921: 15 | Z921: 0 | AA921: 1613 | AB921: 2539 | AC921: =(AA921/AB921)*100 -> 63.528948404883813 | AD921: =(X921*4)+(Z921*2) -> 8
A922: SANDRINGHAM | C922: BREWER 5 | F922: MANSFIELD 2 | I922: HAYES 2 | K922: MORRISON | N922: MANNIX | P922: FREW | W922: DANDENONG | X922: 1 | Y922: 16 | Z922: 0 | AA922: 1455 | AB922: 2805 | AC922: =(AA922/AB922)*100 -> 51.871657754010691 | AD922: =(X922*4)+(Z922*2) -> 4
A924: COBURG | C924: 6 | D924: 5 | E924: 41 | G924: 14 | H924: 11 | I924: 95 | K924: 23 | L924: 14 | M924: 152 | O924: 28 | P924: 21 | Q924: 189 | S924: VENUE: COBURG
A925: DANDENONG | C925: 0 | D925: 2 | E925: 2 | G925: 3 | H925: 6 | I925: 24 | K925: 6 | L925: 9 | M925: 45 | O925: 7 | P925: 10 | Q925: 52 | S925: BREWER :BUDGE
A926: BEST PLAYERS
A927: COBURG | C927: EVANS | F927: TULLOCH | I927: FREEMAN | L927: PITT | O927: HARBINSON
A928: DANDENONG | C928: VILLANI | F928: CASTRICUM | I928: HENWOOD | L928: FINN
A929: GOALKICKERS
A930: COBURG | C930: PITT 7 | E930: TULLOCH 7 | H930: MAGRO 3 | J930: FREEMAN 3 | M930: COLLINS 2 | O930: PICKERING 2 | R930: CLEARY | U930: HARBINSON | X930: BUCKLEY
A931: DANDENONG | C931: HALL 4 | E931: DE KONNING | H931: SCULLY | J931: HENWOOD
A933: PORT MELBOURNE | C933: 4 | D933: 7 | E933: 31 | G933: 12 | H933: 14 | I933: 86 | K933: 17 | L933: 20 | M933: 122 | O933: 27 | P933: 26 | Q933: 188 | S933: VENUE: PORT MELBOURNE
A934: WERRIBEE | C934: 4 | D934: 1 | E934: 25 | G934: 11 | H934: 2 | I934: 68 | K934: 13 | L934: 2 | M934: 80 | O934: 18 | P934: 3 | Q934: 111 | S934: VERGONA :GROOM
A935: BEST PLAYERS
A936: PORT MELBOURNE | C936: ROBERTSON | F936: RODDA | I936: O'RILEY | L936: GOSS | O936: CHADBAND | R936: DERMOTT
A937: WERRIBEE | C937: HOPKINS | F937: FREEMAN | I937: BONAT | L937: RICHARDSON | O937: BURNETT | R937: GOODWIN
A938: GOALKICKERS
A939: PORT MELBOURNE | C939: O'RILEY 5 | F939: LOVE 5 | H939: HOY 4 | J939: STEWART 3 | M939: IRWIN 2 | O939: SWAN 2 | Q939: GOSS 2 | S939: S HARKINS 2 | W939: EBEYER | X939: ANDERSON
A940: WERRIBEE | C940: GOODWIN 6 | F940: FEDKE 2 | H940: RICHARDSON 2 | K940: MEMBREY 2 | N940: PERKINS 2 | Q940: ABBOTT | S940: BURNETT | V940: REDENBACH | X940: BATEMAN
A942: GEELONG WEST | C942: 6 | D942: 3 | E942: 39 | G942: 9 | H942: 7 | I942: 61 | K942: 12 | L942: 9 | M942: 81 | O942: 17 | P942: 15 | Q942: 117 | S942: VENUE: GEELONG WEST
A943: WILLIAMSTOWN | C943: 3 | D943: 0 | E943: 18 | G943: 7 | H943: 6 | I943: 48 | K943: 9 | L943: 9 | M943: 63 | O943: 11 | P943: 12 | Q943: 78 | S943: MARSHALL :HUTCHINSON
A944: BEST PLAYERS
A945: GEELONG WEST | C945: EDDY | F945: DALIHAUS | I945: KRANJC | L945: SMITH | O945: NICHOLS | R945: EVANS
A946: WILLIAMSTOWN | C946: GREAVE | F946: WALKER | I946: SLEVISON | L946: SWANN | O946: SAIT | R946: NANKERVIS
A947: GOALKICKERS
A948: GEELONG WEST | C948: EDDY 5 | E948: RADOJEVIC 4 | H948: NICHOLS 2 | J948: KING | L948: TORNEY | N948: HIGGINS | P948: RICHARDSON | S948: CHAMBERS | W948: DALIHAUS
A949: WILLIAMSTOWN | C949: WALKER 4 | F949: FOTHERINGHAM 2 | J949: SAIT 2 | L949: HUMMEL | N949: HODGES | P949: SLEVISON
A951: CAMBERWELL | C951: 3 | D951: 4 | E951: 22 | G951: 6 | H951: 8 | I951: 44 | K951: 10 | L951: 10 | M951: 70 | O951: 17 | P951: 13 | Q951: 115 | S951: VENUE: TOORAK PARK
A952: PRAHRAN | C952: 5 | D952: 4 | E952: 34 | G952: 8 | H952: 10 | I952: 58 | K952: 11 | L952: 17 | M952: 83 | O952: 13 | P952: 21 | Q952: 99 | S952: MARCY :FITZPATRICK
A953: BEST PLAYERS
A954: CAMBERWELL | C954: TURNER | F954: PEVITT | I954: ROURKE | L954: STEVENSON
A955: PRAHRAN | C955: I McCORMACK | F955: PARKER | I955: P McDONALD | L955: REED
A956: GOALKICKERS
A957: CAMBERWELL | C957: STEVENSON 5 | F957: ROURKE 3 | I957: LOVE 2 | K957: WEATHERALD 2 | N957: DAVIDSON | Q957: DODIG | S957: TURNER | V957: HIPWORTH | X957: MAILING
A958: PRAHRAN | C958: I McCORMACK 6 | F958: WALLACE 2 | I958: STEPHENS 2 | L958: TAYLOR | N958: GRAMBEAU | Q958: P McCORMACK
A960: ROUND 18 | D960: 26TH AUGUST | I960: WEATHER | S960: VENUE: CAMBERWELL
D961: 1ST QTR | H961: 2ND QTR | L961: 3RD QTR | P961: FINAL | S961: UMPIRES
A962: GEELONG WEST | C962: 4 | D962: 2 | E962: 26 | G962: 5 | H962: 6 | I962: 36 | K962: 11 | L962: 10 | M962: 76 | O962: 15 | P962: 16 | Q962: 106 | S962: BUDGE | X962: LADDER | AB962: ROUND | AD962: 18
A963: CAMBERWELL | C963: 7 | D963: 2 | E963: 44 | G963: 10 | H963: 7 | I963: 67 | K963: 13 | L963: 10 | M963: 88 | O963: 13 | P963: 13 | Q963: 91 | S963: WALKER
A964: BEST PLAYERS | W964: TEAM | X964: W | Y964: L | Z964: D | AA964: FOR | AB964: AGST | AC964: % | AD964: PTS
A965: GEELONG WEST | C965: EDDY | F965: SMITH | I965: NICHOLS | L965: KING | N965: BERRY | Q965: DALIHAUS
A966: CAMBERWELL | C966: DODIG | F966: PEVITT | I966: DANS | L966: CAHILL | N966: BURMEISTER | W966: PRESTON | X966: 16 | Y966: 2 | Z966: 0 | AA966: 2659 | AB966: 1626 | AC966: =(AA966/AB966)*100 -> 163.530135301353 | AD966: =(X966*4)+(Z966*2) -> 64
A967: COBURG | W967: GEELONG WEST | X967: 15 | Y967: 3 | Z967: 0 | AA967: 2156 | AB967: 1651 | AC967: =(AA967/AB967)*100 -> 130.58752271350698 | AD967: =(X967*4)+(Z967*2) -> 60
A968: GEELONG WEST | C968: EDDY 5 | E968: NICHOLS 3 | G968: EVANS 2 | I968: BERRY 2 | K968: TORNEY | M968: KING | N968: McKENZIE | W968: FRANKSTON | X968: 12 | Y968: 6 | Z968: 0 | AA968: 2322 | AB968: 1998 | AC968: =(AA968/AB968)*100 -> 116.21621621621621 | AD968: =(X968*4)+(Z968*2) -> 48
A969: CAMBERWELL | C969: CONSTANTINOU 2 | G969: STEVENSON 2 | J969: HIPWORTH 2 | M969: DAVIDSON 2 | P969: ROURKE 2 | R969: WEATHERALD | W969: CAMBERWELL | X969: 11 | Y969: 7 | Z969: 0 | AA969: 2384 | AB969: 1898 | AC969: =(AA969/AB969)*100 -> 125.6059009483667 | AD969: =(X969*4)+(Z969*2) -> 44
M970: WILKINSON | P970: DODIG | S970: VENUE: COBURG
A971: COBURG | C971: 1 | D971: 2 | E971: 8 | G971: 4 | H971: 7 | I971: 31 | K971: 8 | L971: 9 | M971: 57 | O971: 15 | P971: 20 | Q971: 110 | S971: BLACK | W971: SANDRINGHAM | X971: 11 | Y971: 7 | Z971: 0 | AA971: 2775 | AB971: 2392 | AC971: =(AA971/AB971)*100 -> 116.01170568561874 | AD971: =(X971*4)+(Z971*2) -> 44
A972: SPRINGVALE | C972: 3 | D972: 8 | E972: 26 | G972: 4 | H972: 9 | I972: 33 | K972: 8 | L972: 14 | M972: 62 | O972: 10 | P972: 15 | Q972: 75 | S972: HUTCHINSON | W972: PORT MELBOURNE | X972: 10 | Y972: 8 | Z972: 0 | AA972: 2302 | AB972: 2032 | AC972: =(AA972/AB972)*100 -> 113.28740157480314 | AD972: =(X972*4)+(Z972*2) -> 40
A973: BEST PLAYERS | W973: WILLIAMSTOWN | X973: 10 | Y973: 8 | Z973: 0 | AA973: 2328 | AB973: 2254 | AC973: =(AA973/AB973)*100 -> 103.28305235137533 | AD973: =(X973*4)+(Z973*2) -> 40
A974: COBURG | C974: COLLINS | F974: EVANS | I974: ROBERTSON | L974: DOHNT | N974: FREEMAN | Q974: DALGLEISH | W974: COBURG | X974: 9 | Y974: 9 | Z974: 0 | AA974: 2186 | AB974: 2000 | AC974: =(AA974/AB974)*100 -> 109.3 | AD974: =(X974*4)+(Z974*2) -> 36
A975: SPRINGVALE | C975: PAXTON | F975: WALTER | I975: FOTINIOTIS | L975: FOWLER | N975: FREEMAN | W975: SPRINGVALE | X975: 5 | Y975: 13 | Z975: 0 | AA975: 1948 | AB975: 2419 | AC975: =(AA975/AB975)*100 -> 80.529144274493589 | AD975: =(X975*4)+(Z975*2) -> 20
A976: GOALKICKERS | W976: PRAHRAN | X976: 5 | Y976: 13 | Z976: 0 | AA976: 1816 | AB976: 2325 | AC976: =(AA976/AB976)*100 -> 78.107526881720432 | AD976: =(X976*4)+(Z976*2) -> 20
A977: COBURG | C977: PITT 4 | E977: COLLINS 4 | H977: BUCKLEY 3 | K977: FREEMAN 2 | N977: HALBERT | P977: TULLOCH | W977: WERRIBEE | X977: 3 | Y977: 15 | Z977: 0 | AA977: 1707 | AB977: 2623 | AC977: =(AA977/AB977)*100 -> 65.078154784597785 | AD977: =(X977*4)+(Z977*2) -> 12
A978: SPRINGVALE | C978: ANDERSON 3 | F978: WALTER 3 | I978: FOTINIOTIS 2 | L978: CADDAYE | N978: WEBSTER | W978: DANDENONG | X978: 1 | Y978: 17 | Z978: 0 | AA978: 1484 | AB978: 2969 | AC978: =(AA978/AB978)*100 -> 49.983159312899964 | AD978: =(X978*4)+(Z978*2) -> 4
A980: FRANKSTON | C980: 7 | D980: 2 | E980: 44 | G980: 9 | H980: 4 | I980: 58 | K980: 16 | L980: 5 | M980: 101 | O980: 19 | P980: 13 | Q980: 127 | S980: VENUE: FRANKSTON
A981: PORT MELBOURNE | C981: 5 | D981: 2 | E981: 32 | G981: 7 | H981: 5 | I981: 47 | K981: 9 | L981: 7 | M981: 61 | O981: 10 | P981: 10 | Q981: 70 | S981: MARCY :MARSHALL
A982: BEST PLAYERS
A983: FRANKSTON | C983: G KANE | F983: WALSH | I983: GAMBLE | L983: BEATON | N983: HORLER | Q983: BRUIN
A984: PORT MELBOURNE | C984: COOPER | F984: FEHRING | I984: EBEYER | L984: SWAN | N984: ROSS | Q984: GOSS
A985: GOALKICKERS
A986: FRANKSTON | C986: ROGERSON 4 | F986: R KANE 3 | I986: COLE 2 | K986: B JONES SNR 2 | N986: THOMAS 2 | Q986: HILTON 2 | S986: BARDOEL | V986: BEATON | X986: BOYD | Z986: WALSH
A987: PORT MELBOURNE | C987: FEHRING 3 | F987: EBEYER 3 | I987: LOVE 2 | K987: O'RILEY 2
A989: PRESTON | C989: 4 | D989: 7 | E989: 31 | G989: 16 | H989: 14 | I989: 110 | K989: 18 | L989: 18 | M989: 126 | O989: 23 | P989: 26 | Q989: 164 | S989: VENUE: PRESTON
A990: DANDENONG | C990: 2 | D990: 3 | E990: 15 | G990: 2 | H990: 4 | I990: 16 | K990: 3 | L990: 8 | M990: 26 | O990: 3 | P990: 11 | Q990: 29 | S990: BLOOM ;BLAKE
A991: BEST PLAYERS
A992: PRESTON | C992: FROST | F992: DOYLE | I992: FYFFE | L992: McKEON | O992: PLOWMAN | R992: MARCON
A993: DANDENONG | C993: HENWOOD | F993: FINN | I993: VILLANI | L993: MYNOTT
A994: GOALKICKERS
A995: PRESTON | C995: BOURKE 7 | F995: RUSSELL 5 | I995: HACKNEY 3 | L995: JORDAN 2 | N995: DUNBAR 2 | Q995: MARCON 2 | S995: HALAS | U995: SHAW
A996: DANDENONG | C996: WRIGHT | F996: WESTCOTT | I996: METE
A998: WERRIBEE | C998: 5 | D998: 4 | E998: 34 | G998: 8 | H998: 4 | I998: 52 | K998: 10 | L998: 6 | M998: 66 | O998: 14 | P998: 10 | Q998: 94 | S998: VENUE: WERRIBEE
A999: PRAHRAN | C999: 1 | D999: 0 | E999: 6 | G999: 5 | H999: 7 | I999: 37 | K999: 6 | L999: 10 | M999: 46 | O999: 12 | P999: 12 | Q999: 84 | S999: BREWER :MORGAN
A1000: BEST PLAYERS
A1001: WERRIBEE | C1001: GUDDE | F1001: CHRISTIANSEN | I1001: HOPKINS | L1001: McCANCE | O1001: FEDKE | R1001: DOYLE
A1002: PRAHRAN | C1002: S McDONALD | F1002: PARKER | I1002: P McDONALD | L1002: P McCORMACK | O1002: TAPPING
A1003: GOALKICKERS
A1004: WERRIBEE | C1004: BONAT 2 | E1004: FEDKE 2 | G1004: MEMBREY 2 | J1004: GOODWIN 2 | M1004: RICHARDSON 2 | P1004: REDENBACH | S1004: BURNETT | V1004: PERKINS | X1004: ABBOTT
A1005: PRAHRAN | C1005: P McDONALD 3 | F1005: P McCORMACK 2 | J1005: TAPPING 2 | M1005: GRAMBEAU | P1005: GILES | R1005: ROBERTSON | V1005: STRACHAN | X1005: TORCASIO
A1007: WILLIAMSTOWN | C1007: 7 | D1007: 0 | E1007: 42 | G1007: 15 | H1007: 3 | I1007: 93 | K1007: 17 | L1007: 7 | M1007: 109 | O1007: 27 | P1007: 11 | Q1007: 173 | S1007: VENUE: WILLIAMSTOWN
A1008: SANDRINGHAM | C1008: 6 | D1008: 0 | E1008: 36 | G1008: 10 | H1008: 6 | I1008: 66 | K1008: 11 | L1008: 10 | M1008: 76 | O1008: 14 | P1008: 13 | Q1008: 97 | S1008: VERGONA :FITZPATRICK
A1009: BEST PLAYERS
A1010: WILLIAMSTOWN | C1010: DAVIDSON | F1010: FOTHERINGHAM | J1010: EATHER | L1010: SWANN | O1010: WALKER | R1010: TOWNS
A1011: SANDRINGHAM | C1011: VISSER | F1011: GALLAGHER | J1011: HAYES | L1011: SIMS
A1012: GOALKICKERS
A1013: WILLIAMSTOWN | C1013: FOTHERINGHAM 10 | G1013: SIMMONS 6 | J1013: WALKER 4 | M1013: SAIT 4 | O1013: HUMMEL 2 | Q1013: GREAVES | S1013: TOWNS
A1014: SANDRINGHAM | C1014: BREWER 5 | F1014: ADAMS 3 | I1014: GALLAGHER 2 | L1014: MACLEOD | N1014: HETHERINGTON | Q1014: RAFFERTY | S1014: VISSER
A1016: FINALS
A1017: 1ST SEMI | D1017: 2ND SEPTEMBER | I1017: WEATHER
D1018: 1ST QTR | H1018: 2ND QTR | L1018: 3RD QTR | P1018: FINAL | S1018: VENUE: JUNCTION OVAL
A1019: FRANKSTON | C1019: 7 | D1019: 3 | E1019: 45 | G1019: 8 | H1019: 6 | I1019: 54 | K1019: 14 | L1019: 14 | M1019: 98 | O1019: 18 | P1019: 16 | Q1019: 124 | S1019: UMPIRES
A1020: CAMBERWELL | C1020: 1 | D1020: 3 | E1020: 9 | G1020: 4 | H1020: 9 | I1020: 33 | K1020: 6 | L1020: 11 | M1020: 47 | O1020: 9 | P1020: 16 | Q1020: 70 | S1020: VERGONA :PHILLIPS
A1021: BEST PLAYERS
A1022: FRANKSTON | C1022: HORLER | F1022: GAMBLE | I1022: KANE | L1022: BRUIN | O1022: WALSH | R1022: BARDOEL
A1023: CAMBERWELL | C1023: BATTAMS | F1023: CAHILL | I1023: WILKINSON | L1023: DE GOEY
A1024: GOALKICKERS
A1025: FRANKSTON | C1025: BARDOEL 4 | F1025: KANE 4 | H1025: THOMAS 3 | J1025: ROGERSON 3 | M1025: CZARNECKI 2 | P1025: JONES 2
A1026: CAMBERWELL | C1026: STEVENSON 4 | F1026: ROURKE | H1026: DODIG | J1026: BURMEISTER | M1026: YOUNG | O1026: MAILING
A1028: 2ND SEMI | D1028: 9TH SEPTEMBER
A1029: PRESTON | C1029: 1 | D1029: 6 | E1029: 12 | G1029: 11 | H1029: 11 | I1029: 77 | K1029: 12 | L1029: 13 | M1029: 85 | O1029: 17 | P1029: 19 | Q1029: 121 | S1029: VENUE: JUNCTION OVAL
A1030: GEELONG WEST | C1030: 3 | D1030: 6 | E1030: 24 | G1030: 7 | H1030: 10 | I1030: 52 | K1030: 9 | L1030: 20 | M1030: 74 | O1030: 10 | P1030: 26 | Q1030: 86 | S1030: CASEY ;GROOM
A1031: BEST PLAYERS
A1032: PRESTON | C1032: RUSSELL | F1032: FYFFE | I1032: BOURKE | L1032: SALVADORE | O1032: BRINE | Q1032: DOYLE
A1033: GEELONG WEST | C1033: BERRY | F1033: DOYLE | I1033: NICHOLS | L1033: WATSON | O1033: TORNEY | Q1033: DALIHAUS
A1034: GOALKICKERS
A1035: PRESTON | C1035: RUSSELL 10 | F1035: HALAS 2 | H1035: BOURKE 2 | J1035: SALVADORE | M1035: JORDAN | O1035: MARCON
A1036: GEELONG WEST | C1036: RADOJEVIC 3 | F1036: BERRY 3 | H1036: NICHOLS 2 | J1036: EVANS | L1036: TOULMIN
A1038: PRELIMINARY FINAL | F1038: 16TH SEPTEMBER
A1039: FRANKSTON | C1039: 6 | D1039: 3 | E1039: 39 | G1039: 11 | H1039: 6 | I1039: 72 | K1039: 13 | L1039: 9 | M1039: 87 | O1039: 16 | P1039: 11 | Q1039: 107 | S1039: VENUE: JUNCTION OVAL
A1040: GEELONG WEST | C1040: 1 | D1040: 4 | E1040: 10 | G1040: 5 | H1040: 6 | I1040: 36 | K1040: 6 | L1040: 12 | M1040: 48 | O1040: 9 | P1040: 18 | Q1040: 72 | S1040: MARCY :MARSHALL
A1041: BEST PLAYERS
A1042: FRANKSTON | C1042: BARDOEL | F1042: WALSH | I1042: GEDDES | L1042: CZARNECKI | O1042: JONES | R1042: BRUIN
A1043: GEELONG WEST | C1043: BERRY | F1043: DALIHAUS | I1043: KING | L1043: TOULMIN | O1043: GIBSON
A1044: GOALKICKERS
A1045: FRANKSTON | C1045: BOYD 4 | E1045: JONES 3 | G1045: MEMBREY 3 | J1045: GAMBLE 2 | M1045: BARDOEL | O1045: ROGERSON | R1045: GEDDES | T1045: CZARNECKI
A1046: GEELONG WEST | C1046: KING 3 | E1046: NICHOLS | G1046: DAVIE | I1046: TORNEY | K1046: BERRY | M1046: EDDY | O1046: TOULMIN
A1048: GRAND FINAL | D1048: 23RD SEPTEMBER
A1049: PRESTON | C1049: 6 | D1049: 7 | E1049: 43 | G1049: 9 | H1049: 15 | I1049: 69 | K1049: 14 | L1049: 15 | M1049: 99 | O1049: 19 | P1049: 21 | Q1049: 135 | S1049: VENUE: JUNCTION OVAL
A1050: FRANKSTON | C1050: 5 | D1050: 0 | E1050: 30 | G1050: 5 | H1050: 2 | I1050: 32 | K1050: 9 | L1050: 7 | M1050: 61 | O1050: 12 | P1050: 9 | Q1050: 81 | S1050: MARCY :PHILLIPS
A1051: BEST PLAYERS
A1052: PRESTON | C1052: JORDAN | F1052: SHAW | I1052: McKEON | L1052: FYFFE | O1052: DOYLE | Q1052: BRINE
A1053: FRANKSTON | C1053: BRUIN | F1053: BEATON | I1053: GAMBLE | L1053: BOYD | O1053: WALSH | Q1053: GEDDES
A1054: GOALKICKERS
A1055: PRESTON | C1055: BOURKE 5 | F1055: SALVADOR 3 | I1055: ATKIN 2 | K1055: HALAS 2 | M1055: HACKNEY 2 | P1055: BRINE 2 | R1055: JORDAN 2 | U1055: FYFFE
A1056: FRANKSTON | C1056: BOYD 5 | F1056: BALDWIN 2 | I1056: THOMAS 2 | K1056: WALSH 2 | M1056: MEMBREY
A1058: REPRESENTATIVE MATCH | G1058: 17TH JUNE
A1059: V.F.A. | C1059: 6 | D1059: 7 | E1059: 43 | G1059: 11 | H1059: 10 | I1059: 76 | K1059: 15 | L1059: 14 | M1059: 104 | O1059: 22 | P1059: 14 | Q1059: 146 | S1059: ELSTERNWICK PARK
A1060: V.A.F.A. | C1060: 3 | D1060: 2 | E1060: 20 | G1060: 9 | H1060: 6 | I1060: 60 | K1060: 12 | L1060: 9 | M1060: 81 | O1060: 14 | P1060: 11 | Q1060: 95 | S1060: GOODMAN :OAKLEY
A1061: BEST PLAYERS
A1062: V.F.A. | C1062: KERSHAW | F1062: SHAW | I1062: McTAGGART | L1062: NICHOLS | O1062: FOTHERINGHAM | R1062: SWAN
A1063: V.A.F.A. | C1063: WILTON | F1063: MURPHY | I1063: SMYTHE | L1063: SENIOR | O1063: DEVESON | R1063: P BROWN
A1064: GOALKICKERS
A1065: V.F.A. | C1065: FOTHERINGHAM 8 | G1065: NICHOLS 4 | I1065: GEDDES 3 | L1065: SWAN 2 | N1065: GALLAGHER 2 | Q1065: O'RILEY | S1065: BRINE | U1065: SAIT
A1066: V.A.F.A. | C1066: MURPHY 5 | F1066: S CURTAIN 3 | I1066: JONES 2 | K1066: YEO 2 | M1066: R BROWN | O1066: MARKS