A1: Victorian Football Association
A2: Season 1985 - Division Two
A3: © Copyright Wal Williams | F3: First created: 28 March 2016
A4: Contact: joywalwi at gmail dot com | F4: Last updated: 28 March 2016 | W4: VFA Results and tables - Link to the main index page
A5: You are free to copy this document in whole or part provided that proper acknowledgement is given to the author. All rights reserved.
A7: 1985 | C7: V.F.A. SEASON 2ND DIVISION
A8: ROUND 1 | E8: 14TH APRIL | J8: WEATHER | S8: PLAYED AT
D9: 1ST QTR | H9: 2ND QTR | L9: 3RD QTR | P9: FINAL | S9: SUNSHINE
A10: SUNSHINE | C10: 3 | D10: 2 | E10: =C10*6+D10 -> 20 | G10: 7 | H10: 10 | I10: =G10*6+H10 -> 52 | K10: 12 | L10: 15 | M10: =K10*6+L10 -> 87 | O10: 16 | P10: 24 | Q10: =O10*6+P10 -> 120 | S10: UMPIRE | X10: LADDER | AB10: ROUND | AD10: 1
A11: NORTHCOTE | C11: 1 | D11: 8 | E11: =C11*6+D11 -> 14 | G11: 2 | H11: 12 | I11: =G11*6+H11 -> 24 | K11: 2 | L11: 14 | M11: =K11*6+L11 -> 26 | O11: 4 | P11: 16 | Q11: =O11*6+P11 -> 40
A12: BEST PLAYERS | W12: TEAM | X12: W | Y12: L | Z12: D | AA12: FOR | AB12: AGST | AC12: % | AD12: PTS
A13: SUNSHINE
A14: NORTHCOTE | W14: CAULFIELD | X14: 1 | Y14: 0 | Z14: 0 | AA14: 189 | AB14: 60 | AC14: =(AA14*100)/AB14 -> 315 | AD14: =(X14*4)+(Z14*2) -> 4
A15: GOALKICKERS | W15: SUNSHINE | X15: 1 | Y15: 0 | Z15: 0 | AA15: 120 | AB15: 40 | AC15: =(AA15*100)/AB15 -> 300 | AD15: =(X15*4)+(Z15*2) -> 4
A16: SUNSHINE | W16: MOORABBIN | X16: 1 | Y16: 0 | Z16: 0 | AA16: 208 | AB16: 101 | AC16: =(AA16*100)/AB16 -> 205.94059405940595 | AD16: =(X16*4)+(Z16*2) -> 4
A17: NORTHCOTE | W17: WAVERLEY | X17: 1 | Y17: 0 | Z17: 0 | AA17: 136 | AB17: 98 | AC17: =(AA17*100)/AB17 -> 138.77551020408163 | AD17: =(X17*4)+(Z17*2) -> 4
A19: OAKLEIGH | C19: 8 | D19: 4 | E19: =C19*6+D19 -> 52 | G19: 15 | H19: 7 | I19: =G19*6+H19 -> 97 | K19: 19 | L19: 8 | M19: =K19*6+L19 -> 122 | O19: 25 | P19: 13 | Q19: =O19*6+P19 -> 163 | S19: OAKLEIGH | W19: OAKLEIGH | X19: 1 | Y19: 0 | Z19: 0 | AA19: 163 | AB19: 135 | AC19: =(AA19*100)/AB19 -> 120.74074074074075 | AD19: =(X19*4)+(Z19*2) -> 4
A20: BRUNSWICK | C20: 4 | D20: 5 | E20: =C20*6+D20 -> 29 | G20: 8 | H20: 6 | I20: =G20*6+H20 -> 54 | K20: 17 | L20: 8 | M20: =K20*6+L20 -> 110 | O20: 21 | P20: 9 | Q20: =O20*6+P20 -> 135 | W20: BRUNSWICK | X20: 0 | Y20: 1 | Z20: 0 | AA20: 135 | AB20: 163 | AC20: =(AA20*100)/AB20 -> 82.822085889570559 | AD20: =(X20*4)+(Z20*2) -> 0
A21: BEST PLAYERS | W21: BERWICK | X21: 0 | Y21: 1 | Z21: 0 | AA21: 98 | AB21: 136 | AC21: =(AA21*100)/AB21 -> 72.058823529411768 | AD21: =(X21*4)+(Z21*2) -> 0
A22: OAKLEIGH | W22: DANDENONG | X22: 0 | Y22: 1 | Z22: 0 | AA22: 101 | AB22: 208 | AC22: =(AA22*100)/AB22 -> 48.557692307692307 | AD22: =(X22*4)+(Z22*2) -> 0
A23: BRUNSWICK | W23: NORTHCOTE | X23: 0 | Y23: 1 | Z23: 0 | AA23: 40 | AB23: 120 | AC23: =(AA23*100)/AB23 -> 33.333333333333336 | AD23: =(X23*4)+(Z23*2) -> 0
A24: GOALKICKERS | W24: MORDIALLOC | X24: 0 | Y24: 1 | Z24: 0 | AA24: 60 | AB24: 189 | AC24: =(AA24*100)/AB24 -> 31.746031746031747 | AD24: =(X24*4)+(Z24*2) -> 0
A25: OAKLEIGH
A26: BRUNSWICK
A28: WAVERLEY | C28: 5 | D28: 3 | E28: =C28*6+D28 -> 33 | G28: 9 | H28: 6 | I28: =G28*6+H28 -> 60 | K28: 13 | L28: 11 | M28: =K28*6+L28 -> 89 | O28: 20 | P28: 16 | Q28: =O28*6+P28 -> 136 | S28: WAVERLEY
A29: BERWICK | C29: 3 | D29: 3 | E29: =C29*6+D29 -> 21 | G29: 6 | H29: 9 | I29: =G29*6+H29 -> 45 | K29: 13 | L29: 11 | M29: =K29*6+L29 -> 89 | O29: 14 | P29: 14 | Q29: =O29*6+P29 -> 98
A30: BEST PLAYERS
A31: WAVERLEY
A32: BERWICK
A33: GOALKICKERS
A34: WAVERLEY
A35: BERWICK
A37: MOORABBIN | C37: 4 | D37: 3 | E37: =C37*6+D37 -> 27 | G37: 18 | H37: 5 | I37: =G37*6+H37 -> 113 | K37: 24 | L37: 14 | M37: =K37*6+L37 -> 158 | O37: 31 | P37: 22 | Q37: =O37*6+P37 -> 208 | S37: BENTLEIGH
A38: DANDENONG | C38: 9 | D38: 4 | E38: =C38*6+D38 -> 58 | G38: 12 | H38: 9 | I38: =G38*6+H38 -> 81 | K38: 14 | L38: 10 | M38: =K38*6+L38 -> 94 | O38: 15 | P38: 11 | Q38: =O38*6+P38 -> 101
A39: BEST PLAYERS
A40: MOORABBIN
A41: DANDENONG
A42: GOALKICKERS
A43: MOORABBIN
A44: DANDENONG
A46: CAULFIELD | C46: 9 | D46: 3 | E46: =C46*6+D46 -> 57 | G46: 13 | H46: 9 | I46: =G46*6+H46 -> 87 | K46: 22 | L46: 19 | M46: =K46*6+L46 -> 151 | O46: 28 | P46: 21 | Q46: =O46*6+P46 -> 189 | S46: PRINCES PARK, CAULFIELD
A47: MORDIALLOC | C47: 5 | D47: 3 | E47: =C47*6+D47 -> 33 | G47: 7 | H47: 5 | I47: =G47*6+H47 -> 47 | K47: 8 | L47: 5 | M47: =K47*6+L47 -> 53 | O47: 9 | P47: 6 | Q47: =O47*6+P47 -> 60
A48: BEST PLAYERS
A49: CAULFIELD
A50: MORDIALLOC
A51: GOALKICKERS
A52: CAULFIELD
A53: MORDIALLOC
A55: ROUND 2 | E55: 21ST APRIL | J55: WEATHER | S55: PLAYED AT
D56: 1ST QTR | H56: 2ND QTR | L56: 3RD QTR | P56: FINAL | S56: MORDIALLOC
A57: MOORABBIN | C57: 7 | D57: 4 | E57: =C57*6+D57 -> 46 | G57: 11 | H57: 8 | I57: =G57*6+H57 -> 74 | K57: 18 | L57: 8 | M57: =K57*6+L57 -> 116 | O57: 19 | P57: 8 | Q57: =O57*6+P57 -> 122 | S57: UMPIRE | X57: LADDER | AB57: ROUND | AD57: 2
A58: MORDIALLOC | C58: 3 | D58: 1 | E58: =C58*6+D58 -> 19 | G58: 6 | H58: 4 | I58: =G58*6+H58 -> 40 | K58: 14 | L58: 5 | M58: =K58*6+L58 -> 89 | O58: 18 | P58: 8 | Q58: =O58*6+P58 -> 116 | S58: KENNEDY/HUTCHINGS
A59: BEST PLAYERS | W59: TEAM | X59: W | Y59: L | Z59: D | AA59: FOR | AB59: AGST | AC59: % | AD59: PTS
A60: MOORABBIN | C60: MERCOULIA | F60: B CATHCART | J60: COOK | L60: STEWART | O60: POLLOCK
A61: MORDIALLOC | C61: ? | F61: ? | J61: BAKER | L61: ? | O61: BROMLEY | W61: CAULFIELD | X61: 2 | Y61: 0 | Z61: 0 | AA61: 311 | AB61: 119 | AC61: =(AA61*100)/AB61 -> 261.34453781512605 | AD61: =(X61*4)+(Z61*2) -> 8
A62: GOALKICKERS | W62: MOORABBIN | X62: 2 | Y62: 0 | Z62: 0 | AA62: 330 | AB62: 217 | AC62: =(AA62*100)/AB62 -> 152.07373271889401 | AD62: =(X62*4)+(Z62*2) -> 8
A63: MOORABBIN | C63: COOK 7 | E63: STEWART 3 | H63: LETT 2 | J63: BOYLE 2 | L63: B CATHCART 2 | O63: ATHERTON | R63: PAPPAS | T63: HALE | W63: WAVERLEY | X63: 2 | Y63: 0 | Z63: 0 | AA63: 249 | AB63: 173 | AC63: =(AA63*100)/AB63 -> 143.93063583815029 | AD63: =(X63*4)+(Z63*2) -> 8
A64: MORDIALLOC | C64: BAKER 5 | E64: DEATON 3 | G64: NEVILLE 2 | J64: ? 2 | K64: ? 2 | L64: MORRIS | N64: ? 1 | P64: HALE | R64: BROMLEY | W64: OAKLEIGH | X64: 2 | Y64: 0 | Z64: 0 | AA64: 326 | AB64: 287 | AC64: =(AA64*100)/AB64 -> 113.58885017421603 | AD64: =(X64*4)+(Z64*2) -> 8
A66: OAKLEIGH | C66: 4 | D66: 1 | E66: =C66*6+D66 -> 25 | G66: 9 | H66: 3 | I66: =G66*6+H66 -> 57 | K66: 18 | L66: 6 | M66: =K66*6+L66 -> 114 | O66: 26 | P66: 7 | Q66: =O66*6+P66 -> 163 | S66: DANDENONG | W66: SUNSHINE | X66: 1 | Y66: 1 | Z66: 0 | AA66: 193 | AB66: 149 | AC66: =(AA66*100)/AB66 -> 129.53020134228188 | AD66: =(X66*4)+(Z66*2) -> 4
A67: DANDENONG | C67: 6 | D67: 2 | E67: =C67*6+D67 -> 38 | G67: 16 | H67: 2 | I67: =G67*6+H67 -> 98 | K67: 20 | L67: 4 | M67: =K67*6+L67 -> 124 | O67: 24 | P67: 8 | Q67: =O67*6+P67 -> 152 | S67: FITZPATRICK | W67: BRUNSWICK | X67: 1 | Y67: 1 | Z67: 0 | AA67: 244 | AB67: 236 | AC67: =(AA67*100)/AB67 -> 103.38983050847457 | AD67: =(X67*4)+(Z67*2) -> 4
A68: BEST PLAYERS | S68: LLOYD | W68: DANDENONG | X68: 0 | Y68: 2 | Z68: 0 | AA68: 253 | AB68: 371 | AC68: =(AA68*100)/AB68 -> 68.194070080862531 | AD68: =(X68*4)+(Z68*2) -> 0
A69: OAKLEIGH | C69: ALDRIDGE | F69: NIXON | I69: PRETTO | L69: BROWN | O69: M ROACH | R69: OWEN | W69: BERWICK | X69: 0 | Y69: 2 | Z69: 0 | AA69: 157 | AB69: 258 | AC69: =(AA69*100)/AB69 -> 60.852713178294572 | AD69: =(X69*4)+(Z69*2) -> 0
A70: DANDENONG | C70: KAYE | F70: McINTOSH | I70: LEMMON | L70: HALL | O70: WOOD | R70: KANNOURAKIS | W70: MORDIALLOC | X70: 0 | Y70: 2 | Z70: 0 | AA70: 176 | AB70: 311 | AC70: =(AA70*100)/AB70 -> 56.59163987138264 | AD70: =(X70*4)+(Z70*2) -> 0
A71: GOALKICKERS | W71: NORTHCOTE | X71: 0 | Y71: 2 | Z71: 0 | AA71: 115 | AB71: 233 | AC71: =(AA71*100)/AB71 -> 49.356223175965667 | AD71: =(X71*4)+(Z71*2) -> 0
A72: OAKLEIGH | C72: PRETTO 14 | F72: ALDRIDGE 5 | I72: M ROACH 3 | L72: OWEN 2 | N72: BROWN | P72: S ROACH
A73: DANDENONG | C73: KAYE 11 | F73: HAMILTON 3 | I73: KNIGHT 3 | K73: HALL 2 | M73: TREMBATH 2 | P73: LEMMON | R73: KANNOURAKIS | U73: VILLANI
A75: WAVERLEY | C75: 3 | D75: 4 | E75: =C75*6+D75 -> 22 | G75: 7 | H75: 5 | I75: =G75*6+H75 -> 47 | K75: 12 | L75: 9 | M75: =K75*6+L75 -> 81 | O75: 17 | P75: 11 | Q75: =O75*6+P75 -> 113 | S75: NORTHCOTE
A76: NORTHCOTE | C76: 2 | D76: 2 | E76: =C76*6+D76 -> 14 | G76: 4 | H76: 5 | I76: =G76*6+H76 -> 29 | K76: 8 | L76: 8 | M76: =K76*6+L76 -> 56 | O76: 11 | P76: 9 | Q76: =O76*6+P76 -> 75 | S76: PRICE/TORNEY
A77: BEST PLAYERS
A78: WAVERLEY | C78: FISHER | F78: ANGELIS | I78: KINNABURGH | L78: BROWN | O78: KENNY | R78: NEWBOULD
A79: NORTHCOTE | C79: ARMSTRONG | F79: MINNETT | I79: PANJARI | L79: J COURTS | O79: SANDERS | R79: MITCHELL
A80: GOALKICKERS
A81: WAVERLEY | C81: ANGELIS 8 | F81: THOMAS 3 | I81: PALLOTTA 3 | L81: ?1 | N81: KINNABURGH | Q81: GREENE
A82: NORTHCOTE | C82: PENNY 3 | E82: EWING 2 | G82: GLEN SMITH 2 | J82: MITCHELL | M82: J COURTS | O82: SANDERS | Q82: MITCHELL
A84: BRUNSWICK | C84: 3 | D84: 1 | E84: =C84*6+D84 -> 19 | G84: 7 | H84: 6 | I84: =G84*6+H84 -> 48 | K84: 8 | L84: 7 | M84: =K84*6+L84 -> 55 | O84: 16 | P84: 13 | Q84: =O84*6+P84 -> 109 | S84: BRUNSWICK
A85: SUNSHINE | C85: 3 | D85: 5 | E85: =C85*6+D85 -> 23 | G85: 4 | H85: 9 | I85: =G85*6+H85 -> 33 | K85: 10 | L85: 11 | M85: =K85*6+L85 -> 71 | O85: 10 | P85: 13 | Q85: =O85*6+P85 -> 73 | S85: BRADSHAW/BLOOM
A86: BEST PLAYERS
A87: BRUNSWICK | C87: MADDAFERI | F87: CALLANDER | I87: NOLAN | L87: J McDONALD | O87: WHILLAS | R87: S McGHIE
A88: SUNSHINE | C88: GIBB | F88: DOWLING | I88: VADJNAL | L88: HYSOLI | O88: WAGLAND | R88: DORGAN
A89: GOALKICKERS
A90: BRUNSWICK | C90: LEAHY 4 | F90: CATTOGGIO 3 | I90: WHILLAS 2 | L90: GIBSON 2 | N90: EDWARDS | P90: FLOWER | R90: JUDGE | T90: TOY | V90: McDONALD
A91: SUNSHINE | C91: LITCHFIELD 5 | F91: HYSOLI | H91: WILLIAMS | K91: McVEIGH | M91: VADJNAL | O91: MITROVSKI
A93: CAULFIELD | C93: 7 | D93: 1 | E93: =C93*6+D93 -> 43 | G93: 9 | H93: 4 | I93: =G93*6+H93 -> 58 | K93: 16 | L93: 4 | M93: =K93*6+L93 -> 100 | O93: 19 | P93: 8 | Q93: =O93*6+P93 -> 122 | S93: BERWICK
A94: BERWICK | C94: 1 | D94: 3 | E94: =C94*6+D94 -> 9 | G94: 7 | H94: 5 | I94: =G94*6+H94 -> 47 | K94: 7 | L94: 8 | M94: =K94*6+L94 -> 50 | O94: 8 | P94: 11 | Q94: =O94*6+P94 -> 59 | S94: FOGARTY/BLAKE
A95: BEST PLAYERS
A96: CAULFIELD | C96: FARINSKI | F96: MOON | I96: McCORMACK | L96: PACKHAM | O96: DAWSON | R96: BARRY
A97: BERWICK | C97: JOHNSON | F97: CREBBIN | I97: MANNENS | L97: M BREEN | O97: ORSBORNE
A98: GOALKICKERS
A99: CAULFIELD | C99: MITCHELL 5 | F99: THOMPSON 4 | I99: FIELD 3 | K99: DAWSON 2 | N99: McCORMACK 2 | Q99: GODAU | S99: JENKINS | U99: O'BRIEN
A100: BERWICK | C100: CASHEN 2 | F100: S JOHNSON 2 | I100: CREBBIN | K100: MANNENS | N100: McGREAL | P100: HARRISON
A102: ROUND 3 | E102: 28TH APRIL | J102: WEATHER | S102: PLAYED AT
D103: 1ST QTR | H103: 2ND QTR | L103: 3RD QTR | P103: FINAL | S103: PRINCES PARK, CAULFIELD
A104: CAULFIELD | C104: 4 | D104: 8 | E104: =C104*6+D104 -> 32 | G104: 9 | H104: 15 | I104: =G104*6+H104 -> 69 | K104: 18 | L104: 17 | M104: =K104*6+L104 -> 125 | O104: 18 | P104: 20 | Q104: =O104*6+P104 -> 128 | S104: UMPIRE | X104: LADDER | AB104: ROUND | AD104: 3
A105: NORTHCOTE | C105: 4 | D105: 1 | E105: =C105*6+D105 -> 25 | G105: 5 | H105: 2 | I105: =G105*6+H105 -> 32 | K105: 6 | L105: 4 | M105: =K105*6+L105 -> 40 | O105: 12 | P105: 6 | Q105: =O105*6+P105 -> 78
A106: BEST PLAYERS | W106: TEAM | X106: W | Y106: L | Z106: D | AA106: FOR | AB106: AGST | AC106: % | AD106: PTS
A107: CAULFIELD
A108: NORTHCOTE | W108: CAULFIELD | X108: 3 | Y108: 0 | Z108: 0 | AA108: 439 | AB108: 197 | AC108: =(AA108*100)/AB108 -> 222.84263959390864 | AD108: =(X108*4)+(Z108*2) -> 12
A109: GOALKICKERS | W109: MOORABBIN | X109: 3 | Y109: 0 | Z109: 0 | AA109: 442 | AB109: 319 | AC109: =(AA109*100)/AB109 -> 138.55799373040753 | AD109: =(X109*4)+(Z109*2) -> 12
A110: CAULFIELD | W110: WAVERLEY | X110: 2 | Y110: 1 | Z110: 0 | AA110: 387 | AB110: 313 | AC110: =(AA110*100)/AB110 -> 123.64217252396166 | AD110: =(X110*4)+(Z110*2) -> 8
A111: NORTHCOTE | W111: SUNSHINE | X111: 2 | Y111: 1 | Z111: 0 | AA111: 325 | AB111: 267 | AC111: =(AA111*100)/AB111 -> 121.72284644194757 | AD111: =(X111*4)+(Z111*2) -> 8
A113: BRUNSWICK | C113: 10 | D113: 4 | E113: =C113*6+D113 -> 64 | G113: 15 | H113: 6 | I113: =G113*6+H113 -> 96 | K113: 18 | L113: 10 | M113: =K113*6+L113 -> 118 | O113: 21 | P113: 14 | Q113: =O113*6+P113 -> 140 | S113: WAVERLEY | W113: OAKLEIGH | X113: 2 | Y113: 1 | Z113: 0 | AA113: 428 | AB113: 399 | AC113: =(AA113*100)/AB113 -> 107.26817042606517 | AD113: =(X113*4)+(Z113*2) -> 8
A114: WAVERLEY | C114: 4 | D114: 0 | E114: =C114*6+D114 -> 24 | G114: 11 | H114: 2 | I114: =G114*6+H114 -> 68 | K114: 18 | L114: 6 | M114: =K114*6+L114 -> 114 | O114: 21 | P114: 12 | Q114: =O114*6+P114 -> 138 | W114: BRUNSWICK | X114: 2 | Y114: 1 | Z114: 0 | AA114: 384 | AB114: 374 | AC114: =(AA114*100)/AB114 -> 102.67379679144385 | AD114: =(X114*4)+(Z114*2) -> 8
A115: BEST PLAYERS | W115: BERWICK | X115: 1 | Y115: 2 | Z115: 0 | AA115: 301 | AB115: 361 | AC115: =(AA115*100)/AB115 -> 83.37950138504155 | AD115: =(X115*4)+(Z115*2) -> 4
A116: BRUNSWICK | W116: DANDENONG | X116: 0 | Y116: 3 | Z116: 0 | AA116: 371 | AB116: 503 | AC116: =(AA116*100)/AB116 -> 73.757455268389663 | AD116: =(X116*4)+(Z116*2) -> 0
A117: WAVERLEY | W117: MORDIALLOC | X117: 0 | Y117: 3 | Z117: 0 | AA117: 279 | AB117: 455 | AC117: =(AA117*100)/AB117 -> 61.318681318681321 | AD117: =(X117*4)+(Z117*2) -> 0
A118: GOALKICKERS | W118: NORTHCOTE | X118: 0 | Y118: 3 | Z118: 0 | AA118: 193 | AB118: 361 | AC118: =(AA118*100)/AB118 -> 53.46260387811634 | AD118: =(X118*4)+(Z118*2) -> 0
A119: BRUNSWICK
A120: WAVERLEY
A122: SUNSHINE | C122: 8 | D122: 7 | E122: =C122*6+D122 -> 55 | G122: 14 | H122: 12 | I122: =G122*6+H122 -> 96 | K122: 16 | L122: 19 | M122: =K122*6+L122 -> 115 | O122: 18 | P122: 24 | Q122: =O122*6+P122 -> 132 | S122: SUNSHINE
A123: DANDENONG | C123: 3 | D123: 2 | E123: =C123*6+D123 -> 20 | G123: 6 | H123: 4 | I123: =G123*6+H123 -> 40 | K123: 11 | L123: 9 | M123: =K123*6+L123 -> 75 | O123: 18 | P123: 10 | Q123: =O123*6+P123 -> 118
A124: BEST PLAYERS
A125: SUNSHINE
A126: DANDENONG
A127: GOALKICKERS
A128: SUNSHINE
A129: DANDENONG
A131: MOORABBIN | C131: 3 | D131: 3 | E131: =C131*6+D131 -> 21 | G131: 8 | H131: 5 | I131: =G131*6+H131 -> 53 | K131: 15 | L131: 9 | M131: =K131*6+L131 -> 99 | O131: 17 | P131: 10 | Q131: =O131*6+P131 -> 112 | S131: OAKLEIGH
A132: OAKLEIGH | C132: 5 | D132: 2 | E132: =C132*6+D132 -> 32 | G132: 8 | H132: 7 | I132: =G132*6+H132 -> 55 | K132: 13 | L132: 8 | M132: =K132*6+L132 -> 86 | O132: 15 | P132: 12 | Q132: =O132*6+P132 -> 102
A133: BEST PLAYERS
A134: MOORABBIN
A135: OAKLEIGH
A136: GOALKICKERS
A137: MOORABBIN
A138: OAKLEIGH
A140: BERWICK | C140: 6 | D140: 8 | E140: =C140*6+D140 -> 44 | G140: 10 | H140: 12 | I140: =G140*6+H140 -> 72 | K140: 17 | L140: 14 | M140: =K140*6+L140 -> 116 | O140: 21 | P140: 18 | Q140: =O140*6+P140 -> 144 | S140: BERWICK
A141: MORDIALLOC | C141: 2 | D141: 3 | E141: =C141*6+D141 -> 15 | G141: 6 | H141: 7 | I141: =G141*6+H141 -> 43 | K141: 9 | L141: 11 | M141: =K141*6+L141 -> 65 | O141: 15 | P141: 13 | Q141: =O141*6+P141 -> 103
A142: BEST PLAYERS
A143: BERWICK
A144: MORDIALLOC
A145: GOALKICKERS
A146: BERWICK
A147: MORDIALLOC
A149: ROUND 4 | E149: 5TH MAY | J149: WEATHER | S149: PLAYED AT
D150: 1ST QTR | H150: 2ND QTR | L150: 3RD QTR | P150: FINAL | S150: DANDENONG
A151: DANDENONG | C151: 3 | D151: 1 | E151: =C151*6+D151 -> 19 | G151: 10 | H151: 8 | I151: =G151*6+H151 -> 68 | K151: 13 | L151: 12 | M151: =K151*6+L151 -> 90 | O151: 20 | P151: 13 | Q151: =O151*6+P151 -> 133 | S151: UMPIRE | X151: LADDER | AB151: ROUND | AD151: 4
A152: WAVERLEY | C152: 10 | D152: 8 | E152: =C152*6+D152 -> 68 | G152: 10 | H152: 10 | I152: =G152*6+H152 -> 70 | K152: 17 | L152: 14 | M152: =K152*6+L152 -> 116 | O152: 19 | P152: 17 | Q152: =O152*6+P152 -> 131
A153: BEST PLAYERS | W153: TEAM | X153: W | Y153: L | Z153: D | AA153: FOR | AB153: AGST | AC153: % | AD153: PTS
A154: DANDENONG
A155: WAVERLEY | W155: MOORABBIN | X155: 4 | Y155: 0 | Z155: 0 | AA155: 578 | AB155: 430 | AC155: =(AA155*100)/AB155 -> 134.41860465116278 | AD155: =(X155*4)+(Z155*2) -> 16
A156: GOALKICKERS | W156: CAULFIELD | X156: 3 | Y156: 1 | Z156: 0 | AA156: 555 | AB156: 336 | AC156: =(AA156*100)/AB156 -> 165.17857142857142 | AD156: =(X156*4)+(Z156*2) -> 12
A157: DANDENONG | W157: OAKLEIGH | X157: 3 | Y157: 1 | Z157: 0 | AA157: 575 | AB157: 468 | AC157: =(AA157*100)/AB157 -> 122.86324786324786 | AD157: =(X157*4)+(Z157*2) -> 12
A158: WAVERLEY | W158: BRUNSWICK | X158: 3 | Y158: 1 | Z158: 0 | AA158: 523 | AB158: 490 | AC158: =(AA158*100)/AB158 -> 106.73469387755102 | AD158: =(X158*4)+(Z158*2) -> 12
A160: MOORABBIN | C160: 7 | D160: 4 | E160: =C160*6+D160 -> 46 | G160: 10 | H160: 7 | I160: =G160*6+H160 -> 67 | K160: 18 | L160: 9 | M160: =K160*6+L160 -> 117 | O160: 20 | P160: 16 | Q160: =O160*6+P160 -> 136 | S160: BENTLEIGH | W160: WAVERLEY | X160: 2 | Y160: 2 | Z160: 0 | AA160: 518 | AB160: 446 | AC160: =(AA160*100)/AB160 -> 116.14349775784753 | AD160: =(X160*4)+(Z160*2) -> 8
A161: SUNSHINE | C161: 3 | D161: 1 | E161: =C161*6+D161 -> 19 | G161: 8 | H161: 3 | I161: =G161*6+H161 -> 51 | K161: 14 | L161: 8 | M161: =K161*6+L161 -> 92 | O161: 17 | P161: 9 | Q161: =O161*6+P161 -> 111 | W161: SUNSHINE | X161: 2 | Y161: 2 | Z161: 0 | AA161: 436 | AB161: 403 | AC161: =(AA161*100)/AB161 -> 108.18858560794045 | AD161: =(X161*4)+(Z161*2) -> 8
A162: BEST PLAYERS | W162: BERWICK | X162: 1 | Y162: 3 | Z162: 0 | AA162: 387 | AB162: 451 | AC162: =(AA162*100)/AB162 -> 85.809312638580934 | AD162: =(X162*4)+(Z162*2) -> 4
A163: MOORABBIN | W163: DANDENONG | X163: 1 | Y163: 3 | Z163: 0 | AA163: 504 | AB163: 634 | AC163: =(AA163*100)/AB163 -> 79.495268138801265 | AD163: =(X163*4)+(Z163*2) -> 4
A164: SUNSHINE | W164: NORTHCOTE | X164: 1 | Y164: 3 | Z164: 0 | AA164: 283 | AB164: 447 | AC164: =(AA164*100)/AB164 -> 63.31096196868009 | AD164: =(X164*4)+(Z164*2) -> 4
A165: GOALKICKERS | W165: MORDIALLOC | X165: 0 | Y165: 4 | Z165: 0 | AA165: 348 | AB165: 602 | AC165: =(AA165*100)/AB165 -> 57.807308970099669 | AD165: =(X165*4)+(Z165*2) -> 0
A166: MOORABBIN
A167: SUNSHINE
E168: 12TH MAY | J168: WEATHER
A169: BRUNSWICK | C169: 6 | D169: 4 | E169: =C169*6+D169 -> 40 | G169: 12 | H169: 9 | I169: =G169*6+H169 -> 81 | K169: 15 | L169: 12 | M169: =K169*6+L169 -> 102 | O169: 21 | P169: 13 | Q169: =O169*6+P169 -> 139 | S169: BRUNSWICK
A170: CAULFIELD | C170: 3 | D170: 3 | E170: =C170*6+D170 -> 21 | G170: 7 | H170: 6 | I170: =G170*6+H170 -> 48 | K170: 11 | L170: 10 | M170: =K170*6+L170 -> 76 | O170: 17 | P170: 14 | Q170: =O170*6+P170 -> 116
A171: BEST PLAYERS
A172: BRUNSWICK | C172: GIBSON | F172: ROMANIN | I172: NOLAN | L172: CALLANDER | O172: LAWSON | R172: McGHIE
A173: CAULFIELD | C173: PACKHAM | F173: EINSEDEL | I173: FARINSKI | L173: REID | O173: DAWSON
A174: GOALKICKERS
A175: BRUNSWICK | C175: GIBSON 6 | F175: LAWSON 3 | I175: LEAHY 2 | K175: EDWARDS 2 | N175: WHILLAS 2 | Q175: CATTOGGIO 2 | T175: PARSONS 2 | W175: CALLANDER | X175: JUDGE
A176: CAULFIELD | C176: HITCHCOCK 4 | F176: PACKHAM 4 | I176: THOMPSON 4 | L176: MITCHELL 2 | O176: DAWSON | R176: FAWCETT | T176: GODAU
A178: OAKLEIGH | C178: 5 | D178: 4 | E178: =C178*6+D178 -> 34 | G178: 12 | H178: 7 | I178: =G178*6+H178 -> 79 | K178: 14 | L178: 12 | M178: =K178*6+L178 -> 96 | O178: 21 | P178: 21 | Q178: =O178*6+P178 -> 147 | S178: MORDIALLOC
A179: MORDIALLOC | C179: 3 | D179: 1 | E179: =C179*6+D179 -> 19 | G179: 5 | H179: 3 | I179: =G179*6+H179 -> 33 | K179: 11 | L179: 3 | M179: =K179*6+L179 -> 69 | O179: 11 | P179: 3 | Q179: =O179*6+P179 -> 69 | S179: OAKLEY/FLOWER
A180: BEST PLAYERS
A181: OAKLEIGH | C181: RAWLYK | F181: WALL | I181: NIXON | L181: BATTERSBY | O181: BROWN | R181: PRETTO
A182: MORDIALLOC | C182: MORRIS | F182: SARAU | I182: MAZAREK | L182: PADULA | O182: CASSON | R182: CLIFFORD
A183: GOALKICKERS
A184: OAKLEIGH | C184: PRETTO 10 | F184: ROACH 4 | H184: JOHNSON 3 | K184: BROWN | M184: RAWLYK | O184: ALDRIDGE | R184: OWEN
A185: MORDIALLOC | C185: HALE 3 | E185: MORRIS 2 | G185: GARDNER 2 | J185: MANGONI | L185: COOMBS | N185: BROMLEY | P185: LEWIS
A187: NORTHCOTE | C187: 5 | D187: 4 | E187: =C187*6+D187 -> 34 | G187: 7 | H187: 7 | I187: =G187*6+H187 -> 49 | K187: 11 | L187: 12 | M187: =K187*6+L187 -> 78 | O187: 12 | P187: 18 | Q187: =O187*6+P187 -> 90 | S187: NORTHCOTE
A188: BERWICK | C188: 3 | D188: 1 | E188: =C188*6+D188 -> 19 | G188: 6 | H188: 4 | I188: =G188*6+H188 -> 40 | K188: 7 | L188: 10 | M188: =K188*6+L188 -> 52 | O188: 12 | P188: 14 | Q188: =O188*6+P188 -> 86 | S188: BREWER/FITZPATRICK
A189: BEST PLAYERS
A190: NORTHCOTE | C190: ARMSTRONG | F190: J COURTS | I190: PANJARI | L190: SPAGNOLO | O190: CALLEJA | R190: EWING
A191: BERWICK | C191: M JOHNSON | F191: MANNENS | I191: BREEN | L191: S JOHNSON | O191: VENVILLE | R191: CREBBIN
A192: GOALKICKERS
A193: NORTHCOTE | C193: WENCOWSKI 4 | F193: D SMITH 2 | I193: J COURTS 2 | L193: N MITCHELL | O193: PANJARI | Q193: SPROAT | S193: CALLEJA
A194: BERWICK | C194: ALLEN 3 | E194: NANCARROW 2 | H194: McGREAL 2 | K194: M JOHNSON 2 | N194: S JOHNSON | Q194: ORSBORNE | S194: WARD
A196: ROUND 5 | E196: 19TH MAY | J196: WEATHER | S196: PLAYED AT
D197: 1ST QTR | H197: 2ND QTR | L197: 3RD QTR | P197: FINAL | S197: PRINCES PARK, CAULFIELD
A198: CAULFIELD | C198: 2 | D198: 0 | E198: =C198*6+D198 -> 12 | G198: 5 | H198: 3 | I198: =G198*6+H198 -> 33 | K198: 9 | L198: 5 | M198: =K198*6+L198 -> 59 | O198: 13 | P198: 10 | Q198: =O198*6+P198 -> 88 | S198: UMPIRE | X198: LADDER | AB198: ROUND | AD198: 5
A199: DANDENONG | C199: 6 | D199: 2 | E199: =C199*6+D199 -> 38 | G199: 7 | H199: 8 | I199: =G199*6+H199 -> 50 | K199: 8 | L199: 11 | M199: =K199*6+L199 -> 59 | O199: 12 | P199: 11 | Q199: =O199*6+P199 -> 83 | S199: BRADSHAW/
A200: BEST PLAYERS | W200: TEAM | X200: W | Y200: L | Z200: D | AA200: FOR | AB200: AGST | AC200: % | AD200: PTS
A201: CAULFIELD
A202: DANDENONG | W202: CAULFIELD | X202: 4 | Y202: 1 | Z202: 0 | AA202: 643 | AB202: 419 | AC202: =(AA202*100)/AB202 -> 153.46062052505965 | AD202: =(X202*4)+(Z202*2) -> 16
A203: GOALKICKERS | W203: OAKLEIGH | X203: 4 | Y203: 1 | Z203: 0 | AA203: 687 | AB203: 518 | AC203: =(AA203*100)/AB203 -> 132.62548262548262 | AD203: =(X203*4)+(Z203*2) -> 16
A204: CAULFIELD | W204: MOORABBIN | X204: 4 | Y204: 1 | Z204: 0 | AA204: 637 | AB204: 536 | AC204: =(AA204*100)/AB204 -> 118.84328358208955 | AD204: =(X204*4)+(Z204*2) -> 16
A205: DANDENONG | W205: BRUNSWICK | X205: 4 | Y205: 1 | Z205: 0 | AA205: 661 | AB205: 606 | AC205: =(AA205*100)/AB205 -> 109.07590759075907 | AD205: =(X205*4)+(Z205*2) -> 16
A207: WAVERLEY | C207: 4 | D207: 6 | E207: =C207*6+D207 -> 30 | G207: 9 | H207: 10 | I207: =G207*6+H207 -> 64 | K207: 10 | L207: 12 | M207: =K207*6+L207 -> 72 | O207: 15 | P207: 16 | Q207: =O207*6+P207 -> 106 | S207: OAKLEIGH | W207: WAVERLEY | X207: 3 | Y207: 2 | Z207: 0 | AA207: 624 | AB207: 505 | AC207: =(AA207*100)/AB207 -> 123.56435643564356 | AD207: =(X207*4)+(Z207*2) -> 12
A208: MOORABBIN | C208: 1 | D208: 2 | E208: =C208*6+D208 -> 8 | G208: 4 | H208: 4 | I208: =G208*6+H208 -> 28 | K208: 6 | L208: 7 | M208: =K208*6+L208 -> 43 | O208: 8 | P208: 11 | Q208: =O208*6+P208 -> 59 | S208: G BREWER | W208: SUNSHINE | X208: 2 | Y208: 3 | Z208: 0 | AA208: 486 | AB208: 515 | AC208: =(AA208*100)/AB208 -> 94.368932038834956 | AD208: =(X208*4)+(Z208*2) -> 8
A209: BEST PLAYERS | S209: McCARTHY | W209: BERWICK | X209: 1 | Y209: 4 | Z209: 0 | AA209: 503 | AB209: 589 | AC209: =(AA209*100)/AB209 -> 85.398981324278438 | AD209: =(X209*4)+(Z209*2) -> 4
A210: WAVERLEY | W210: DANDENONG | X210: 1 | Y210: 4 | Z210: 0 | AA210: 587 | AB210: 722 | AC210: =(AA210*100)/AB210 -> 81.30193905817174 | AD210: =(X210*4)+(Z210*2) -> 4
A211: MOORABBIN | W211: MORDIALLOC | X211: 1 | Y211: 4 | Z211: 0 | AA211: 495 | AB211: 656 | AC211: =(AA211*100)/AB211 -> 75.457317073170728 | AD211: =(X211*4)+(Z211*2) -> 4
A212: GOALKICKERS | W212: NORTHCOTE | X212: 1 | Y212: 4 | Z212: 0 | AA212: 337 | AB212: 594 | AC212: =(AA212*100)/AB212 -> 56.734006734006734 | AD212: =(X212*4)+(Z212*2) -> 4
A213: WAVERLEY
A214: MOORABBIN
A216: OAKLEIGH | C216: 3 | D216: 5 | E216: =C216*6+D216 -> 23 | G216: 7 | H216: 9 | I216: =G216*6+H216 -> 51 | K216: 9 | L216: 10 | M216: =K216*6+L216 -> 64 | O216: 16 | P216: 16 | Q216: =O216*6+P216 -> 112 | S216: SUNSHINE
A217: SUNSHINE | C217: 1 | D217: 3 | E217: =C217*6+D217 -> 9 | G217: 1 | H217: 4 | I217: =G217*6+H217 -> 10 | K217: 5 | L217: 6 | M217: =K217*6+L217 -> 36 | O217: 7 | P217: 8 | Q217: =O217*6+P217 -> 50 | S217: MAY/BLOOM
A218: BEST PLAYERS
A219: OAKLEIGH
A220: SUNSHINE
A221: GOALKICKERS
A222: OAKLEIGH
A223: SUNSHINE
A225: BRUNSWICK | C225: 4 | D225: 3 | E225: =C225*6+D225 -> 27 | G225: 11 | H225: 4 | I225: =G225*6+H225 -> 70 | K225: 15 | L225: 9 | M225: =K225*6+L225 -> 99 | O225: 21 | P225: 12 | Q225: =O225*6+P225 -> 138 | S225: BERWICK
A226: BERWICK | C226: 6 | D226: 4 | E226: =C226*6+D226 -> 40 | G226: 12 | H226: 9 | I226: =G226*6+H226 -> 81 | K226: 14 | L226: 11 | M226: =K226*6+L226 -> 95 | O226: 17 | P226: 14 | Q226: =O226*6+P226 -> 116 | S226: ?/PRICE
A227: BEST PLAYERS
A228: BRUNSWICK
A229: BERWICK
A230: GOALKICKERS
A231: BRUNSWICK
A232: BERWICK
A234: MORDIALLOC | C234: 2 | D234: 3 | E234: =C234*6+D234 -> 15 | G234: 7 | H234: 6 | I234: =G234*6+H234 -> 48 | K234: 18 | L234: 11 | M234: =K234*6+L234 -> 119 | O234: 23 | P234: 9 | Q234: =O234*6+P234 -> 147 | S234: MORDIALLOC
A235: NORTHCOTE | C235: 3 | D235: 3 | E235: =C235*6+D235 -> 21 | G235: 6 | H235: 5 | I235: =G235*6+H235 -> 41 | K235: 6 | L235: 5 | M235: =K235*6+L235 -> 41 | O235: 7 | P235: 12 | Q235: =O235*6+P235 -> 54
A236: BEST PLAYERS
A237: MORDIALLOC
A238: NORTHCOTE
A239: GOALKICKERS
A240: MORDIALLOC
A241: NORTHCOTE
A243: ROUND 6 | E243: 26TH MAY | J243: WEATHER | S243: PLAYED AT
D244: 1ST QTR | H244: 2ND QTR | L244: 3RD QTR | P244: FINAL | S244: SUNSHINE
A245: SUNSHINE | C245: 3 | D245: 11 | E245: =C245*6+D245 -> 29 | G245: 8 | H245: 16 | I245: =G245*6+H245 -> 64 | K245: 17 | L245: 18 | M245: =K245*6+L245 -> 120 | O245: 30 | P245: 24 | Q245: =O245*6+P245 -> 204 | S245: UMPIRE | X245: LADDER | AB245: ROUND | AD245: 6
A246: MORDIALLOC | C246: 5 | D246: 3 | E246: =C246*6+D246 -> 33 | G246: 6 | H246: 6 | I246: =G246*6+H246 -> 42 | K246: 8 | L246: 10 | M246: =K246*6+L246 -> 58 | O246: 9 | P246: 12 | Q246: =O246*6+P246 -> 66
A247: BEST PLAYERS | W247: TEAM | X247: W | Y247: L | Z247: D | AA247: FOR | AB247: AGST | AC247: % | AD247: PTS
A248: SUNSHINE
A249: MORDIALLOC | W249: OAKLEIGH | X249: 5 | Y249: 1 | Z249: 0 | AA249: 804 | AB249: 578 | AC249: =(AA249*100)/AB249 -> 139.10034602076124 | AD249: =(X249*4)+(Z249*2) -> 20
A250: GOALKICKERS | W250: BRUNSWICK | X250: 5 | Y250: 1 | Z250: 0 | AA250: 842 | AB250: 664 | AC250: =(AA250*100)/AB250 -> 126.80722891566265 | AD250: =(X250*4)+(Z250*2) -> 20
A251: SUNSHINE | W251: MOORABBIN | X251: 5 | Y251: 1 | Z251: 0 | AA251: 757 | AB251: 652 | AC251: =(AA251*100)/AB251 -> 116.10429447852761 | AD251: =(X251*4)+(Z251*2) -> 20
A252: MORDIALLOC | W252: CAULFIELD | X252: 4 | Y252: 2 | Z252: 0 | AA252: 759 | AB252: 539 | AC252: =(AA252*100)/AB252 -> 140.81632653061226 | AD252: =(X252*4)+(Z252*2) -> 16
A254: BERWICK | C254: 4 | D254: 6 | E254: =C254*6+D254 -> 30 | G254: 9 | H254: 8 | I254: =G254*6+H254 -> 62 | K254: 13 | L254: 14 | M254: =K254*6+L254 -> 92 | O254: 19 | P254: 18 | Q254: =O254*6+P254 -> 132 | S254: DANDENONG | W254: SUNSHINE | X254: 3 | Y254: 3 | Z254: 0 | AA254: 690 | AB254: 581 | AC254: =(AA254*100)/AB254 -> 118.76075731497419 | AD254: =(X254*4)+(Z254*2) -> 12
A255: DANDENONG | C255: 2 | D255: 5 | E255: =C255*6+D255 -> 17 | G255: 6 | H255: 11 | I255: =G255*6+H255 -> 47 | K255: 12 | L255: 14 | M255: =K255*6+L255 -> 86 | O255: 17 | P255: 18 | Q255: =O255*6+P255 -> 120 | W255: WAVERLEY | X255: 3 | Y255: 3 | Z255: 0 | AA255: 684 | AB255: 622 | AC255: =(AA255*100)/AB255 -> 109.96784565916398 | AD255: =(X255*4)+(Z255*2) -> 12
A256: BEST PLAYERS | W256: BERWICK | X256: 2 | Y256: 4 | Z256: 0 | AA256: 635 | AB256: 709 | AC256: =(AA256*100)/AB256 -> 89.562764456981668 | AD256: =(X256*4)+(Z256*2) -> 8
A257: BERWICK | W257: DANDENONG | X257: 1 | Y257: 5 | Z257: 0 | AA257: 707 | AB257: 854 | AC257: =(AA257*100)/AB257 -> 82.786885245901644 | AD257: =(X257*4)+(Z257*2) -> 4
A258: DANDENONG | W258: MORDIALLOC | X258: 1 | Y258: 5 | Z258: 0 | AA258: 561 | AB258: 860 | AC258: =(AA258*100)/AB258 -> 65.232558139534888 | AD258: =(X258*4)+(Z258*2) -> 4
A259: GOALKICKERS | W259: NORTHCOTE | X259: 1 | Y259: 5 | Z259: 0 | AA259: 395 | AB259: 775 | AC259: =(AA259*100)/AB259 -> 50.967741935483872 | AD259: =(X259*4)+(Z259*2) -> 4
A260: BERWICK
A261: DANDENONG
A263: OAKLEIGH | C263: 1 | D263: 4 | E263: =C263*6+D263 -> 10 | G263: 5 | H263: 8 | I263: =G263*6+H263 -> 38 | K263: 10 | L263: 12 | M263: =K263*6+L263 -> 72 | O263: 17 | P263: 15 | Q263: =O263*6+P263 -> 117 | S263: OAKLEIGH
A264: WAVERLEY | C264: 3 | D264: 0 | E264: =C264*6+D264 -> 18 | G264: 4 | H264: 3 | I264: =G264*6+H264 -> 27 | K264: 7 | L264: 6 | M264: =K264*6+L264 -> 48 | O264: 9 | P264: 6 | Q264: =O264*6+P264 -> 60
A265: BEST PLAYERS
A266: OAKLEIGH
A267: WAVERLEY
A268: GOALKICKERS
A269: OAKLEIGH
A270: WAVERLEY
A272: BRUNSWICK | C272: 7 | D272: 4 | E272: =C272*6+D272 -> 46 | G272: 16 | H272: 10 | I272: =G272*6+H272 -> 106 | K272: 21 | L272: 18 | M272: =K272*6+L272 -> 144 | O272: 26 | P272: 25 | Q272: =O272*6+P272 -> 181 | S272: BRUNSWICK
A273: NORTHCOTE | C273: 2 | D273: 1 | E273: =C273*6+D273 -> 13 | G273: 3 | H273: 4 | I273: =G273*6+H273 -> 22 | K273: 6 | L273: 5 | M273: =K273*6+L273 -> 41 | O273: 8 | P273: 10 | Q273: =O273*6+P273 -> 58
A274: BEST PLAYERS
A275: BRUNSWICK
A276: NORTHCOTE
A277: GOALKICKERS
A278: BRUNSWICK
A279: NORTHCOTE
A281: MOORABBIN | C281: 2 | D281: 2 | E281: =C281*6+D281 -> 14 | G281: 8 | H281: 5 | I281: =G281*6+H281 -> 53 | K281: 15 | L281: 7 | M281: =K281*6+L281 -> 97 | O281: 18 | P281: 12 | Q281: =O281*6+P281 -> 120 | S281: BENTLEIGH
A282: CAULFIELD | C282: 4 | D282: 5 | E282: =C282*6+D282 -> 29 | G282: 8 | H282: 7 | I282: =G282*6+H282 -> 55 | K282: 11 | L282: 11 | M282: =K282*6+L282 -> 77 | O282: 17 | P282: 14 | Q282: =O282*6+P282 -> 116
A283: BEST PLAYERS
A284: MOORABBIN
A285: CAULFIELD
A286: GOALKICKERS
A287: MOORABBIN
A288: CAULFIELD
A290: ROUND 7 | E290: 2ND JUNE | J290: WEATHER | S290: PLAYED AT
D291: 1ST QTR | H291: 2ND QTR | L291: 3RD QTR | P291: FINAL | S291: PRINCES PARK, CAULFIELD
A292: OAKLEIGH | C292: 7 | D292: 6 | E292: =C292*6+D292 -> 48 | G292: 11 | H292: 10 | I292: =G292*6+H292 -> 76 | K292: 13 | L292: 15 | M292: =K292*6+L292 -> 93 | O292: 16 | P292: 17 | Q292: =O292*6+P292 -> 113 | S292: UMPIRE | X292: LADDER | AB292: ROUND | AD292: 7
A293: CAULFIELD | C293: 3 | D293: 2 | E293: =C293*6+D293 -> 20 | G293: 7 | H293: 4 | I293: =G293*6+H293 -> 46 | K293: 10 | L293: 9 | M293: =K293*6+L293 -> 69 | O293: 15 | P293: 11 | Q293: =O293*6+P293 -> 101
A294: BEST PLAYERS | W294: TEAM | X294: W | Y294: L | Z294: D | AA294: FOR | AB294: AGST | AC294: % | AD294: PTS
A295: OAKLEIGH
A296: CAULFIELD | W296: OAKLEIGH | X296: 6 | Y296: 1 | Z296: 0 | AA296: 917 | AB296: 679 | AC296: =(AA296*100)/AB296 -> 135.05154639175257 | AD296: =(X296*4)+(Z296*2) -> 24
A297: GOALKICKERS | W297: BRUNSWICK | X297: 6 | Y297: 1 | Z297: 0 | AA297: 965 | AB297: 750 | AC297: =(AA297*100)/AB297 -> 128.66666666666666 | AD297: =(X297*4)+(Z297*2) -> 24
A298: OAKLEIGH | W298: MOORABBIN | X298: 6 | Y298: 1 | Z298: 0 | AA298: 845 | AB298: 678 | AC298: =(AA298*100)/AB298 -> 124.63126843657817 | AD298: =(X298*4)+(Z298*2) -> 24
A299: CAULFIELD | W299: CAULFIELD | X299: 4 | Y299: 3 | Z299: 0 | AA299: 860 | AB299: 652 | AC299: =(AA299*100)/AB299 -> 131.90184049079755 | AD299: =(X299*4)+(Z299*2) -> 16
A301: MOORABBIN | C301: 4 | D301: 8 | E301: =C301*6+D301 -> 32 | G301: 7 | H301: 10 | I301: =G301*6+H301 -> 52 | K301: 10 | L301: 11 | M301: =K301*6+L301 -> 71 | O301: 12 | P301: 16 | Q301: =O301*6+P301 -> 88 | S301: BERWICK | W301: WAVERLEY | X301: 4 | Y301: 3 | Z301: 0 | AA301: 791 | AB301: 718 | AC301: =(AA301*100)/AB301 -> 110.16713091922006 | AD301: =(X301*4)+(Z301*2) -> 16
A302: BERWICK | C302: 1 | D302: 1 | E302: =C302*6+D302 -> 7 | G302: 2 | H302: 4 | I302: =G302*6+H302 -> 16 | K302: 2 | L302: 6 | M302: =K302*6+L302 -> 18 | O302: 3 | P302: 8 | Q302: =O302*6+P302 -> 26 | W302: SUNSHINE | X302: 3 | Y302: 4 | Z302: 0 | AA302: 786 | AB302: 688 | AC302: =(AA302*100)/AB302 -> 114.24418604651163 | AD302: =(X302*4)+(Z302*2) -> 12
A303: BEST PLAYERS | W303: DANDENONG | X303: 2 | Y303: 5 | Z303: 0 | AA303: 846 | AB303: 907 | AC303: =(AA303*100)/AB303 -> 93.274531422271224 | AD303: =(X303*4)+(Z303*2) -> 8
A304: MOORABBIN | W304: BERWICK | X304: 2 | Y304: 5 | Z304: 0 | AA304: 661 | AB304: 797 | AC304: =(AA304*100)/AB304 -> 82.936010037641154 | AD304: =(X304*4)+(Z304*2) -> 8
A305: BERWICK | W305: MORDIALLOC | X305: 1 | Y305: 6 | Z305: 0 | AA305: 647 | AB305: 983 | AC305: =(AA305*100)/AB305 -> 65.818921668362151 | AD305: =(X305*4)+(Z305*2) -> 4
A306: GOALKICKERS | W306: NORTHCOTE | X306: 1 | Y306: 6 | Z306: 0 | AA306: 448 | AB306: 914 | AC306: =(AA306*100)/AB306 -> 49.015317286652078 | AD306: =(X306*4)+(Z306*2) -> 4
A307: MOORABBIN
A308: BERWICK
A310: WAVERLEY | C310: 3 | D310: 1 | E310: =C310*6+D310 -> 19 | G310: 8 | H310: 1 | I310: =G310*6+H310 -> 49 | K310: 9 | L310: 6 | M310: =K310*6+L310 -> 60 | O310: 16 | P310: 11 | Q310: =O310*6+P310 -> 107 | S310: WAVERLEY
A311: SUNSHINE | C311: 6 | D311: 5 | E311: =C311*6+D311 -> 41 | G311: 7 | H311: 8 | I311: =G311*6+H311 -> 50 | K311: 12 | L311: 14 | M311: =K311*6+L311 -> 86 | O311: 13 | P311: 18 | Q311: =O311*6+P311 -> 96
A312: BEST PLAYERS
A313: WAVERLEY
A314: SUNSHINE
A315: GOALKICKERS
A316: WAVERLEY
A317: SUNSHINE
A319: BRUNSWICK | C319: 4 | D319: 5 | E319: =C319*6+D319 -> 29 | G319: 10 | H319: 8 | I319: =G319*6+H319 -> 68 | K319: 16 | L319: 12 | M319: =K319*6+L319 -> 108 | O319: 18 | P319: 15 | Q319: =O319*6+P319 -> 123 | S319: MORDIALLOC
A320: MORDIALLOC | C320: 4 | D320: 3 | E320: =C320*6+D320 -> 27 | G320: 6 | H320: 4 | I320: =G320*6+H320 -> 40 | K320: 8 | L320: 8 | M320: =K320*6+L320 -> 56 | O320: 12 | P320: 14 | Q320: =O320*6+P320 -> 86
A321: BEST PLAYERS
A322: BRUNSWICK
A323: MORDIALLOC
A324: GOALKICKERS
A325: BRUNSWICK
A326: MORDIALLOC
A328: DANDENONG | C328: 7 | D328: 4 | E328: =C328*6+D328 -> 46 | G328: 12 | H328: 11 | I328: =G328*6+H328 -> 83 | K328: 14 | L328: 15 | M328: =K328*6+L328 -> 99 | O328: 20 | P328: 19 | Q328: =O328*6+P328 -> 139 | S328: NORTHCOTE
A329: NORTHCOTE | C329: 3 | D329: 4 | E329: =C329*6+D329 -> 22 | G329: 4 | H329: 6 | I329: =G329*6+H329 -> 30 | K329: 7 | L329: 9 | M329: =K329*6+L329 -> 51 | O329: 7 | P329: 11 | Q329: =O329*6+P329 -> 53
A330: BEST PLAYERS
A331: DANDENONG
A332: NORTHCOTE
A333: GOALKICKERS
A334: DANDENONG
A335: NORTHCOTE
A337: ROUND 8 | E337: 16TH JUNE | J337: WEATHER | S337: PLAYED AT
D338: 1ST QTR | H338: 2ND QTR | L338: 3RD QTR | P338: FINAL | S338: WAVERLEY
A339: WAVERLEY | C339: 5 | D339: 1 | E339: =C339*6+D339 -> 31 | G339: 7 | H339: 9 | I339: =G339*6+H339 -> 51 | K339: 13 | L339: 10 | M339: =K339*6+L339 -> 88 | O339: 18 | P339: 13 | Q339: =O339*6+P339 -> 121 | S339: UMPIRE | X339: LADDER | AB339: ROUND | AD339: 8
A340: MORDIALLOC | C340: 5 | D340: 5 | E340: =C340*6+D340 -> 35 | G340: 5 | H340: 8 | I340: =G340*6+H340 -> 38 | K340: 7 | L340: 11 | M340: =K340*6+L340 -> 53 | O340: 13 | P340: 14 | Q340: =O340*6+P340 -> 92 | S340: BLOOM/SANDFORD
A341: BEST PLAYERS | W341: TEAM | X341: W | Y341: L | Z341: D | AA341: FOR | AB341: AGST | AC341: % | AD341: PTS
A342: WAVERLEY | C342: CASTILLO | F342: KINNABURGH | I342: EVANS | L342: JOYCE | O342: CARGHILL | R342: MIER
A343: MORDIALLOC | C343: SARAU | F343: CARTY | I343: DE MUNK | L343: COOMBES | O343: GARDNER | R343: BAKER | W343: OAKLEIGH | X343: 7 | Y343: 1 | Z343: 0 | AA343: 1087 | AB343: 789 | AC343: =(AA343*100)/AB343 -> 137.76932826362483 | AD343: =(X343*4)+(Z343*2) -> 28
A344: GOALKICKERS | M344: McILWRAITH | W344: MOORABBIN | X344: 7 | Y344: 1 | Z344: 0 | AA344: 1037 | AB344: 768 | AC344: =(AA344*100)/AB344 -> 135.02604166666666 | AD344: =(X344*4)+(Z344*2) -> 28
A345: WAVERLEY | C345: EVANS 4 | E345: ANGELIS 3 | G345: MIER 3 | I345: CASTILLO 2 | K345: THOMAS 2 | N345: HARRISON | Q345: KINNABURGH | T345: PALLOTTA | W345: BRUNSWICK | X345: 7 | Y345: 1 | Z345: 0 | AA345: 1131 | AB345: 859 | AC345: =(AA345*100)/AB345 -> 131.66472642607684 | AD345: =(X345*4)+(Z345*2) -> 28
A346: MORDIALLOC | C346: NEVILLE 5 | F346: DE MUNK 3 | I346: COOMBS 2 | L346: HALE | N346: CASSON | P346: PADULA | W346: WAVERLEY | X346: 5 | Y346: 3 | Z346: 0 | AA346: 912 | AB346: 810 | AC346: =(AA346*100)/AB346 -> 112.5925925925926 | AD346: =(X346*4)+(Z346*2) -> 20
A348: MOORABBIN | C348: 8 | D348: 7 | E348: =C348*6+D348 -> 55 | G348: 18 | H348: 11 | I348: =G348*6+H348 -> 119 | K348: 26 | L348: 15 | M348: =K348*6+L348 -> 171 | O348: 29 | P348: 18 | Q348: =O348*6+P348 -> 192 | S348: BENTLEIGH | W348: CAULFIELD | X348: 4 | Y348: 4 | Z348: 0 | AA348: 957 | AB348: 756 | AC348: =(AA348*100)/AB348 -> 126.58730158730158 | AD348: =(X348*4)+(Z348*2) -> 16
A349: NORTHCOTE | C349: 2 | D349: 1 | E349: =C349*6+D349 -> 13 | G349: 3 | H349: 2 | I349: =G349*6+H349 -> 20 | K349: 7 | L349: 6 | M349: =K349*6+L349 -> 48 | O349: 14 | P349: 6 | Q349: =O349*6+P349 -> 90 | S349: BRADSHAW | W349: SUNSHINE | X349: 4 | Y349: 4 | Z349: 0 | AA349: 890 | AB349: 785 | AC349: =(AA349*100)/AB349 -> 113.37579617834395 | AD349: =(X349*4)+(Z349*2) -> 16
A350: BEST PLAYERS | S350: LLOYD | W350: DANDENONG | X350: 2 | Y350: 6 | Z350: 0 | AA350: 955 | AB350: 1073 | AC350: =(AA350*100)/AB350 -> 89.002795899347618 | AD350: =(X350*4)+(Z350*2) -> 8
A351: MOORABBIN | C351: B CATHCART | F351: STEWART | I351: COOK | L351: O'TOOLE | O351: D CATHCART | W351: BERWICK | X351: 2 | Y351: 6 | Z351: 0 | AA351: 771 | AB351: 967 | AC351: =(AA351*100)/AB351 -> 79.731127197518092 | AD351: =(X351*4)+(Z351*2) -> 8
A352: NORTHCOTE | C352: WENCOWSKI | F352: ALLEVA | I352: ADAMSON | L352: MINNETT | O352: INGLES | R352: GLOBBIN | W352: MORDIALLOC | X352: 1 | Y352: 7 | Z352: 0 | AA352: 739 | AB352: 1104 | AC352: =(AA352*100)/AB352 -> 66.938405797101453 | AD352: =(X352*4)+(Z352*2) -> 4
A353: GOALKICKERS | O353: PAPPON | W353: NORTHCOTE | X353: 1 | Y353: 7 | Z353: 0 | AA353: 538 | AB353: 1106 | AC353: =(AA353*100)/AB353 -> 48.643761301989151 | AD353: =(X353*4)+(Z353*2) -> 4
A354: MOORABBIN | C354: COOK 10 | F354: B CATHCART 5 | I354: ATHERTON 4 | L354: O'TOOLE 4 | N354: POLLOCK 2 | Q354: BOYLE | S354: PAPPAS | U354: HALE
A355: NORTHCOTE | C355: GLOBBIN 7 | F355: TRATINEK 4 | I355: EWING 2 | K355: ELMS
A357: SUNSHINE | C357: 2 | D357: 5 | E357: =C357*6+D357 -> 17 | G357: 7 | H357: 8 | I357: =G357*6+H357 -> 50 | K357: 12 | L357: 12 | M357: =K357*6+L357 -> 84 | O357: 15 | P357: 14 | Q357: =O357*6+P357 -> 104 | S357: SUNSHINE
A358: CAULFIELD | C358: 2 | D358: 3 | E358: =C358*6+D358 -> 15 | G358: 6 | H358: 6 | I358: =G358*6+H358 -> 42 | K358: 9 | L358: 8 | M358: =K358*6+L358 -> 62 | O358: 14 | P358: 13 | Q358: =O358*6+P358 -> 97 | S358: PRICE/TORNEY
A359: BEST PLAYERS
A360: SUNSHINE | C360: MITROVSKI | F360: SCANLAN | I360: LITCHFIELD | L360: McQUALTER | O360: HYSOLI | Q360: BROWN
A361: CAULFIELD | C361: GAYFER | F361: FARINSKI | I361: EINSEDEL
A362: GOALKICKERS
A363: SUNSHINE | C363: LITCHFIELD 7 | F363: MITROVSKI 2 | I363: NELSON 2 | K363: COOKE | M363: DAY | O363: FORBES | Q363: POLLEY
A364: CAULFIELD | C364: BARRY 3 | E364: CRANNY 3 | G364: PACKHAM 3 | J364: DAWSON 2 | M364: CROOK | O364: REID | Q364: THOMPSON
A366: BRUNSWICK | C366: 5 | D366: 7 | E366: =C366*6+D366 -> 37 | G366: 12 | H366: 9 | I366: =G366*6+H366 -> 81 | K366: 20 | L366: 11 | M366: =K366*6+L366 -> 131 | O366: 25 | P366: 16 | Q366: =O366*6+P366 -> 166 | S366: DANDENONG
A367: DANDENONG | C367: 4 | D367: 3 | E367: =C367*6+D367 -> 27 | G367: 9 | H367: 10 | I367: =G367*6+H367 -> 64 | K367: 12 | L367: 15 | M367: =K367*6+L367 -> 87 | O367: 15 | P367: 19 | Q367: =O367*6+P367 -> 109 | S367: BLACK/KENNEDY
A368: BEST PLAYERS
A369: BRUNSWICK | C369: DOYLE | F369: THORNTON | I369: TOY | L369: LAWSON | O369: McGHIE | R369: CATTOGGIO
A370: DANDENONG | C370: S KNIGHT | F370: HICKEY | I370: KEE | L370: McINTOSH | O370: TREMBATH | R370: BASTINAC
A371: GOALKICKERS
A372: BRUNSWICK | C372: CATTOGGIO 5 | F372: FLOWER 5 | I372: GIBSON 5 | K372: LAWSON 5 | N372: THORNTON 4 | Q372: SMYTHE
A373: DANDENONG | C373: METE 5 | E373: HALL 3 | G373: TUFO 3 | I373: WOOD 2 | K373: WESTCOTT | N373: McINTOSH
A375: OAKLEIGH | C375: 2 | D375: 1 | E375: =C375*6+D375 -> 13 | G375: 11 | H375: 7 | I375: =G375*6+H375 -> 73 | K375: 18 | L375: 9 | M375: =K375*6+L375 -> 117 | O375: 26 | P375: 14 | Q375: =O375*6+P375 -> 170 | S375: OAKLEIGH
A376: BERWICK | C376: 5 | D376: 2 | E376: =C376*6+D376 -> 32 | G376: 7 | H376: 6 | I376: =G376*6+H376 -> 48 | K376: 13 | L376: 6 | M376: =K376*6+L376 -> 84 | O376: 17 | P376: 8 | Q376: =O376*6+P376 -> 110 | S376: HUTCHINSON/McDONALD
A377: BEST PLAYERS
A378: OAKLEIGH | C378: TODD | F378: BATTERSBY | I378: PRETTO | L378: BROWN | O378: POLA | Q378: FRANCOIS
A379: BERWICK | C379: HIPWORTH | F379: JOHNSON | I379: McMASTER | L379: PARKE | O379: BREEN
A380: GOALKICKERS
A381: OAKLEIGH | C381: PRETTO 8 | F381: BROWN 4 | H381: OWEN 4 | J381: ROSS 2 | L381: RAWLYK 2 | O381: ALDRIDGE 2 | R381: JOHNSON 2 | U381: TODD | W381: FRANCOIS
A382: BERWICK | C382: WARD 5 | F382: HIPWORTH 4 | I382: PARKE 3 | K382: McGREAL 2 | N382: BROWN 2 | Q382: LUXFORD
A384: ROUND 9 | E384: 23RD JUNE | J384: WEATHER | S384: PLAYED AT
D385: 1ST QTR | H385: 2ND QTR | L385: 3RD QTR | P385: FINAL | S385: PRINCES PARK, CAULFIELD
A386: WAVERLEY | C386: 5 | D386: 6 | E386: =C386*6+D386 -> 36 | G386: 9 | H386: 8 | I386: =G386*6+H386 -> 62 | K386: 16 | L386: 13 | M386: =K386*6+L386 -> 109 | O386: 19 | P386: 16 | Q386: =O386*6+P386 -> 130 | S386: UMPIRE | X386: LADDER | AB386: ROUND | AD386: 9
A387: CAULFIELD | C387: 2 | D387: 1 | E387: =C387*6+D387 -> 13 | G387: 7 | H387: 8 | I387: =G387*6+H387 -> 50 | K387: 9 | L387: 11 | M387: =K387*6+L387 -> 65 | O387: 14 | P387: 13 | Q387: =O387*6+P387 -> 97 | S387: BRADSHAW/MORGAN
A388: BEST PLAYERS | W388: TEAM | X388: W | Y388: L | Z388: D | AA388: FOR | AB388: AGST | AC388: % | AD388: PTS
A389: WAVERLEY | C389: EVANS | F389: DE WIT | I389: KENDALL | L389: WENBVORNE | O389: KINNABURGH
A390: CAULFIELD | C390: FARINSKI | F390: DAWSON | I390: NAG? | W390: OAKLEIGH | X390: 8 | Y390: 1 | Z390: 0 | AA390: 1280 | AB390: 874 | AC390: =(AA390*100)/AB390 -> 146.45308924485127 | AD390: =(X390*4)+(Z390*2) -> 32
A391: GOALKICKERS | W391: BRUNSWICK | X391: 8 | Y391: 1 | Z391: 0 | AA391: 1261 | AB391: 925 | AC391: =(AA391*100)/AB391 -> 136.32432432432432 | AD391: =(X391*4)+(Z391*2) -> 32
A392: WAVERLEY | C392: ANGELIS 5 | F392: EVANS 4 | H392: BARNES 3 | J392: FISHER 2 | L392: McILWRAITH 2 | O392: HARRISON 2 | R392: WENBORNE | W392: MOORABBIN | X392: 7 | Y392: 2 | Z392: 0 | AA392: 1103 | AB392: 898 | AC392: =(AA392*100)/AB392 -> 122.82850779510022 | AD392: =(X392*4)+(Z392*2) -> 28
A393: CAULFIELD | C393: DAWSON 3 | F393: CROOK 2 | H393: REID 2 | J393: BARRY | L393: CEANNY | N393: GODAU | P393: JENKINS | R393: McLENNAN | T393: M RYAN | W393: WAVERLEY | X393: 6 | Y393: 3 | Z393: 0 | AA393: 1042 | AB393: 907 | AC393: =(AA393*100)/AB393 -> 114.88423373759647 | AD393: =(X393*4)+(Z393*2) -> 24
A395: BRUNSWICK | C395: 4 | D395: 3 | E395: =C395*6+D395 -> 27 | G395: 9 | H395: 6 | I395: =G395*6+H395 -> 60 | K395: 14 | L395: 7 | M395: =K395*6+L395 -> 91 | O395: 20 | P395: 10 | Q395: =O395*6+P395 -> 130 | S395: BRUNSWICK | W395: SUNSHINE | X395: 5 | Y395: 4 | Z395: 0 | AA395: 979 | AB395: 853 | AC395: =(AA395*100)/AB395 -> 114.77139507620164 | AD395: =(X395*4)+(Z395*2) -> 20
A396: MOORABBIN | C396: 1 | D396: 5 | E396: =C396*6+D396 -> 11 | G396: 3 | H396: 7 | I396: =G396*6+H396 -> 25 | K396: 4 | L396: 13 | M396: =K396*6+L396 -> 37 | O396: 8 | P396: 18 | Q396: =O396*6+P396 -> 66 | S396: TORNEY | W396: CAULFIELD | X396: 4 | Y396: 5 | Z396: 0 | AA396: 1054 | AB396: 886 | AC396: =(AA396*100)/AB396 -> 118.96162528216705 | AD396: =(X396*4)+(Z396*2) -> 16
A397: BEST PLAYERS | S397: FITZPATRICK | W397: DANDENONG | X397: 3 | Y397: 6 | Z397: 0 | AA397: 1102 | AB397: 1193 | AC397: =(AA397*100)/AB397 -> 92.372170997485327 | AD397: =(X397*4)+(Z397*2) -> 12
A398: BRUNSWICK | C398: LEAHY | F398: McGHIE | I398: ROMANIN | L398: MADDAFERI | O398: NOLAN | Q398: DOYLE | W398: BERWICK | X398: 2 | Y398: 7 | Z398: 0 | AA398: 839 | AB398: 1056 | AC398: =(AA398*100)/AB398 -> 79.450757575757578 | AD398: =(X398*4)+(Z398*2) -> 8
A399: MOORABBIN | C399: B CATHCART | F399: POLLOCK | I399: MERCOULIA | W399: MORDIALLOC | X399: 1 | Y399: 8 | Z399: 0 | AA399: 859 | AB399: 1251 | AC399: =(AA399*100)/AB399 -> 68.665067945643486 | AD399: =(X399*4)+(Z399*2) -> 4
A400: GOALKICKERS | W400: NORTHCOTE | X400: 1 | Y400: 8 | Z400: 0 | AA400: 623 | AB400: 1299 | AC400: =(AA400*100)/AB400 -> 47.959969207082374 | AD400: =(X400*4)+(Z400*2) -> 4
A401: BRUNSWICK | C401: CATTOGGIO 4 | F401: GIBSON 4 | H401: FLOWER 3 | J401: WEST 2 | L401: WHILLAS 2 | O401: SMYTHE 2 | R401: PARSONS | T401: TOY | U401: JUDGE
A402: MOORABBIN | C402: B CATHCART 2 | G402: PAPPON 2 | J402: ATHERTON | M402: STEWART | O402: POLLOCK | R402: HACK
A404: OAKLEIGH | C404: 7 | D404: 5 | E404: =C404*6+D404 -> 47 | G404: 15 | H404: 12 | I404: =G404*6+H404 -> 102 | K404: 22 | L404: 15 | M404: =K404*6+L404 -> 147 | O404: 29 | P404: 19 | Q404: =O404*6+P404 -> 193 | S404: NORTHCOTE
A405: NORTHCOTE | C405: 2 | D405: 3 | E405: =C405*6+D405 -> 15 | G405: 5 | H405: 3 | I405: =G405*6+H405 -> 33 | K405: 11 | L405: 6 | M405: =K405*6+L405 -> 72 | O405: 13 | P405: 7 | Q405: =O405*6+P405 -> 85
A406: BEST PLAYERS
A407: OAKLEIGH
A408: NORTHCOTE
A409: GOALKICKERS
A410: OAKLEIGH
A411: NORTHCOTE
A413: SUNSHINE | C413: 3 | D413: 4 | E413: =C413*6+D413 -> 22 | G413: 5 | H413: 11 | I413: =G413*6+H413 -> 41 | K413: 8 | L413: 14 | M413: =K413*6+L413 -> 62 | O413: 12 | P413: 17 | Q413: =O413*6+P413 -> 89 | S413: BERWICK
A414: BERWICK | C414: 4 | D414: 5 | E414: =C414*6+D414 -> 29 | G414: 5 | H414: 5 | I414: =G414*6+H414 -> 35 | K414: 9 | L414: 7 | M414: =K414*6+L414 -> 61 | O414: 10 | P414: 8 | Q414: =O414*6+P414 -> 68 | S414: CHAPMAN/BLAKE
A415: BEST PLAYERS
A416: SUNSHINE | C416: BROWN | F416: SCANLAN | I416: HYSOLI | L416: FORBES | O416: WHITNEY | R416: MITROVSKI
A417: BERWICK | C417: ALLEN | F417: MANNENS | I417: GAMBETTA | L417: JOHNSON | O417: McMASTER
A418: GOALKICKERS
A419: SUNSHINE | C419: HYSOLI 3 | F419: LITCHFIELD 2 | I419: McQUALTER 2 | L419: FORBES 2 | N419: PAULL | P419: POLLEY | R419: NELSON
A420: BERWICK | C420: ALLEN 3 | F420: WARD 2 | H420: McGREAL 2 | K420: HIPWORTH | N420: BREEN | P420: McMASTER
A422: DANDENONG | C422: 4 | D422: 3 | E422: =C422*6+D422 -> 27 | G422: 12 | H422: 10 | I422: =G422*6+H422 -> 82 | K422: 16 | L422: 10 | M422: =K422*6+L422 -> 106 | O422: 22 | P422: 15 | Q422: =O422*6+P422 -> 147 | S422: MORDIALLOC
A423: MORDIALLOC | C423: 7 | D423: 5 | E423: =C423*6+D423 -> 47 | G423: 9 | H423: 6 | I423: =G423*6+H423 -> 60 | K423: 15 | L423: 9 | M423: =K423*6+L423 -> 99 | O423: 18 | P423: 12 | Q423: =O423*6+P423 -> 120 | S423: STEERE/McCARTHY
A424: BEST PLAYERS
A425: DANDENONG | C425: WRIGHT | F425: HALL | I425: ? | L425: TUFO | N425: KNIGHT
A426: MORDIALLOC | C426: DE MUNK | F426: CARTY | I426: COOMBS | L426: SPROAT | N426: BAKER
A427: GOALKICKERS
A428: DANDENONG | C428: HALL 5 | E428: KNIGHT 4 | G428: BRADLEY 3 | J428: ? 3 | L428: WARD 2 | N428: WESTCOTT 2 | Q428: HAMILTON | S428: METE | U428: ? 1
A429: MORDIALLOC | C429: DE MUNK 6 | F429: BROMLEY 3 | I429: ? 3 | J429: DEATON 2 | M429: ? 1 | N429: DIXON | P429: COOMBS | R429: ? 1
A431: ROUND 10 | E431: 30TH JUNE | J431: WEATHER | S431: PLAYED AT
D432: 1ST QTR | H432: 2ND QTR | L432: 3RD QTR | P432: FINAL | S432: DANDENONG
A433: DANDENONG | C433: 2 | D433: 1 | E433: =C433*6+D433 -> 13 | G433: 8 | H433: 4 | I433: =G433*6+H433 -> 52 | K433: 9 | L433: 8 | M433: =K433*6+L433 -> 62 | O433: 14 | P433: 13 | Q433: =O433*6+P433 -> 97 | S433: UMPIRE | X433: LADDER | AB433: ROUND | AD433: 10
A434: MOORABBIN | C434: 5 | D434: 2 | E434: =C434*6+D434 -> 32 | G434: 5 | H434: 3 | I434: =G434*6+H434 -> 33 | K434: 10 | L434: 4 | M434: =K434*6+L434 -> 64 | O434: 12 | P434: 5 | Q434: =O434*6+P434 -> 77 | S434: VERGONA/SANDFORD
A435: BEST PLAYERS | W435: TEAM | X435: W | Y435: L | Z435: D | AA435: FOR | AB435: AGST | AC435: % | AD435: PTS
A436: DANDENONG | C436: HALL | F436: KEE | I436: S KNIGHT | L436: HICKEY | O436: WOOD | R436: MYNOTT
A437: MOORABBIN | C437: POLLOCK | F437: FALCONER | I437: ATHERTON | L437: MERCOULIA | O437: STEWART | R437: MORRIS | W437: BRUNSWICK | X437: 9 | Y437: 1 | Z437: 0 | AA437: 1363 | AB437: 1022 | AC437: =(AA437*100)/AB437 -> 133.36594911937377 | AD437: =(X437*4)+(Z437*2) -> 36
A438: GOALKICKERS | M438: MYNOTT | O438: KANNOURAKIS | W438: OAKLEIGH | X438: 8 | Y438: 2 | Z438: 0 | AA438: 1377 | AB438: 976 | AC438: =(AA438*100)/AB438 -> 141.0860655737705 | AD438: =(X438*4)+(Z438*2) -> 32
A439: DANDENONG | C439: HALL 3 | E439: TREMBATH 2 | H439: BRADLEY 2 | K439: WOOD | M439: WESTCOTT | O439: METE | Q439: S KNIGHT | S439: P KNIGHT | W439: MOORABBIN | X439: 7 | Y439: 3 | Z439: 0 | AA439: 1180 | AB439: 995 | AC439: =(AA439*100)/AB439 -> 118.5929648241206 | AD439: =(X439*4)+(Z439*2) -> 28
A440: MOORABBIN | C440: ATHERTON 4 | F440: HACK 2 | H440: STEWART 2 | K440: COOK | M440: POLLOCK | O440: PAPPON | Q440: WHITE | W440: SUNSHINE | X440: 6 | Y440: 4 | Z440: 0 | AA440: 1109 | AB440: 925 | AC440: =(AA440*100)/AB440 -> 119.89189189189189 | AD440: =(X440*4)+(Z440*2) -> 24
A442: BRUNSWICK | C442: 2 | D442: 3 | E442: =C442*6+D442 -> 15 | G442: 4 | H442: 7 | I442: =G442*6+H442 -> 31 | K442: 11 | L442: 12 | M442: =K442*6+L442 -> 78 | O442: 15 | P442: 12 | Q442: =O442*6+P442 -> 102 | S442: BRUNSWICK | W442: WAVERLEY | X442: 6 | Y442: 4 | Z442: 0 | AA442: 1132 | AB442: 1018 | AC442: =(AA442*100)/AB442 -> 111.1984282907662 | AD442: =(X442*4)+(Z442*2) -> 24
A443: OAKLEIGH | C443: 3 | D443: 3 | E443: =C443*6+D443 -> 21 | G443: 7 | H443: 7 | I443: =G443*6+H443 -> 49 | K443: 10 | L443: 8 | M443: =K443*6+L443 -> 68 | O443: 14 | P443: 13 | Q443: =O443*6+P443 -> 97 | S443: BRADSHAW | W443: CAULFIELD | X443: 4 | Y443: 6 | Z443: 0 | AA443: 1147 | AB443: 1024 | AC443: =(AA443*100)/AB443 -> 112.01171875 | AD443: =(X443*4)+(Z443*2) -> 16
A444: BEST PLAYERS | S444: OAKLEY | W444: DANDENONG | X444: 4 | Y444: 6 | Z444: 0 | AA444: 1199 | AB444: 1270 | AC444: =(AA444*100)/AB444 -> 94.409448818897644 | AD444: =(X444*4)+(Z444*2) -> 16
A445: BRUNSWICK | C445: EDWARDS | F445: LAWSON | I445: JUDGE | L445: WHILLAS | O445: DOYLE | R445: McGHIE | W445: BERWICK | X445: 3 | Y445: 7 | Z445: 0 | AA445: 950 | AB445: 1146 | AC445: =(AA445*100)/AB445 -> 82.897033158813258 | AD445: =(X445*4)+(Z445*2) -> 12
A446: OAKLEIGH | C446: FOOTT | F446: BATTERSBY | I446: M ROACH | L446: OWEN | O446: RAWLYK | R446: PRETTO | W446: MORDIALLOC | X446: 2 | Y446: 8 | Z446: 0 | AA446: 997 | AB446: 1344 | AC446: =(AA446*100)/AB446 -> 74.18154761904762 | AD446: =(X446*4)+(Z446*2) -> 8
A447: GOALKICKERS | W447: NORTHCOTE | X447: 1 | Y447: 9 | Z447: 0 | AA447: 695 | AB447: 1429 | AC447: =(AA447*100)/AB447 -> 48.635409377186846 | AD447: =(X447*4)+(Z447*2) -> 4
A448: BRUNSWICK | C448: GIBSON 6 | F448: LAWSON 3 | I448: WHILLAS 2 | L448: JUDGE 2 | N448: WEST | P448: McDONALD
A449: OAKLEIGH | C449: PRETTO 6 | F449: ROSS 2 | H449: OWEN 2 | J449: WALL | L449: ELDRIDGE | N449: BATTERSBY | Q449: JOHNSON
A451: SUNSHINE | C451: 4 | D451: 3 | E451: =C451*6+D451 -> 27 | G451: 7 | H451: 9 | I451: =G451*6+H451 -> 51 | K451: 10 | L451: 11 | M451: =K451*6+L451 -> 71 | O451: 19 | P451: 16 | Q451: =O451*6+P451 -> 130 | S451: NORTHCOTE
A452: NORTHCOTE | C452: 2 | D452: 2 | E452: =C452*6+D452 -> 14 | G452: 4 | H452: 5 | I452: =G452*6+H452 -> 29 | K452: 9 | L452: 9 | M452: =K452*6+L452 -> 63 | O452: 10 | P452: 12 | Q452: =O452*6+P452 -> 72 | S452: SMITH/TORNEY
A453: BEST PLAYERS
A454: SUNSHINE | C454: SCANLON | F454: DAY | I454: MITROVSKI | L454: WHITNEY | O454: GIBB | R454: McQUALTER
A455: NORTHCOTE | C455: ADAMSON | F455: INGLIS | I455: ARMSTRONG | L455: ALLEVA | O455: MINNETT | R455: SPAGNOLO
A456: GOALKICKERS
A457: SUNSHINE | C457: COOKE 5 | F457: DAY 3 | H457: NELSON 3 | J457: McQUALTER 2 | M457: MITROVSKI 2 | P457: CALDWELL | S457: SCANLON | U457: HYSOLI | W457: BROWN
A458: NORTHCOTE | C458: GLOBBIN 4 | F458: EWING 2 | H458: ARMSTRONG 2 | K458: CUTLER | M458: SMITH
A460: BERWICK | C460: 5 | D460: 5 | E460: =C460*6+D460 -> 35 | G460: 8 | H460: 6 | I460: =G460*6+H460 -> 54 | K460: 13 | L460: 11 | M460: =K460*6+L460 -> 89 | O460: 16 | P460: 15 | Q460: =O460*6+P460 -> 111 | S460: BERWICK
A461: WAVERLEY | C461: 6 | D461: 6 | E461: =C461*6+D461 -> 42 | G461: 8 | H461: 7 | I461: =G461*6+H461 -> 55 | K461: 9 | L461: 10 | M461: =K461*6+L461 -> 64 | O461: 13 | P461: 12 | Q461: =O461*6+P461 -> 90 | S461: BLOOM/PRICE
A462: BEST PLAYERS
A463: BERWICK | C463: MANNENS | F463: M JOHNSON | I463: McMASTER | L463: ALLEN
A464: WAVERLEY | C464: ANGELIS | F464: KENDALL | I464: NEWBOULD | L464: INTERLIGI | O464: DE WIT
A465: GOALKICKERS
A466: BERWICK | C466: WARD 3 | E466: PARK 3 | G466: McGREAL 3 | J466: BROWN 3 | L466: KENNY 2 | N466: BREEN | P466: CASHEN
A467: WAVERLEY | C467: ANGELIS 6 | F467: KENDALL 2 | I467: McILWRAITH | L467: MURRAY | N467: WENBORNE | Q467: EVANS | S467: NEWBOULD
A469: MORDIALLOC | C469: 8 | D469: 4 | E469: =C469*6+D469 -> 52 | G469: 10 | H469: 5 | I469: =G469*6+H469 -> 65 | K469: 16 | L469: 10 | M469: =K469*6+L469 -> 106 | O469: 21 | P469: 12 | Q469: =O469*6+P469 -> 138 | S469: MORDIALLOC
A470: CAULFIELD | C470: 1 | D470: 0 | E470: =C470*6+D470 -> 6 | G470: 6 | H470: 11 | I470: =G470*6+H470 -> 47 | K470: 8 | L470: 11 | M470: =K470*6+L470 -> 59 | O470: 13 | P470: 15 | Q470: =O470*6+P470 -> 93 | S470: CHAPMAN/PHILLIPS
A471: BEST PLAYERS
A472: MORDIALLOC | C472: WATTERS | F472: REVERE | I472: HALE | K472: SARAU | M472: PADULA | P472: DE MUNK
A473: CAULFIELD | C473: PACKHAM | F473: EINSEDEL
A474: GOALKICKERS
A475: MORDIALLOC | C475: HALE 5 | E475: PADULA 4 | G475: DEATON 4 | J475: DIXON 4 | L475: DE MUNK 2 | O475: CARTY | Q475: POLLOCK
A476: CAULFIELD | C476: McLENNAN 3 | F476: CRANNY 2 | I476: GODAU 2 | K476: REID 2 | M476: THOMPSON 2 | P476: HITCHCOCK | S476: MOON
A478: ROUND 11 | E478: 7TH JULY | J478: WEATHER | S478: PLAYED AT
D479: 1ST QTR | H479: 2ND QTR | L479: 3RD QTR | P479: FINAL | S479: PRINCES PARK, CAULFIELD
A480: CAULFIELD | C480: 1 | D480: 6 | E480: =C480*6+D480 -> 12 | G480: 6 | H480: 12 | I480: =G480*6+H480 -> 48 | K480: 8 | L480: 18 | M480: =K480*6+L480 -> 66 | O480: 10 | P480: 25 | Q480: =O480*6+P480 -> 85 | S480: UMPIRE | X480: LADDER | AB480: ROUND | AD480: 11
A481: BERWICK | C481: 4 | D481: 1 | E481: =C481*6+D481 -> 25 | G481: 6 | H481: 1 | I481: =G481*6+H481 -> 37 | K481: 7 | L481: 4 | M481: =K481*6+L481 -> 46 | O481: 9 | P481: 11 | Q481: =O481*6+P481 -> 65
A482: BEST PLAYERS | W482: TEAM | X482: W | Y482: L | Z482: D | AA482: FOR | AB482: AGST | AC482: % | AD482: PTS
A483: CAULFIELD
A484: BERWICK | W484: OAKLEIGH | X484: 9 | Y484: 2 | Z484: 0 | AA484: 1511 | AB484: 1086 | AC484: =(AA484*100)/AB484 -> 139.13443830570901 | AD484: =(X484*4)+(Z484*2) -> 36
A485: GOALKICKERS | W485: BRUNSWICK | X485: 9 | Y485: 2 | Z485: 0 | AA485: 1448 | AB485: 1157 | AC485: =(AA485*100)/AB485 -> 125.15125324114088 | AD485: =(X485*4)+(Z485*2) -> 36
A486: CAULFIELD | W486: MOORABBIN | X486: 8 | Y486: 3 | Z486: 0 | AA486: 1276 | AB486: 1061 | AC486: =(AA486*100)/AB486 -> 120.26390197926484 | AD486: =(X486*4)+(Z486*2) -> 32
A487: BERWICK | W487: SUNSHINE | X487: 7 | Y487: 4 | Z487: 0 | AA487: 1244 | AB487: 1010 | AC487: =(AA487*100)/AB487 -> 123.16831683168317 | AD487: =(X487*4)+(Z487*2) -> 28
A489: NORTHCOTE | C489: 2 | D489: 3 | E489: =C489*6+D489 -> 15 | G489: 3 | H489: 8 | I489: =G489*6+H489 -> 26 | K489: 9 | L489: 11 | M489: =K489*6+L489 -> 65 | O489: 12 | P489: 15 | Q489: =O489*6+P489 -> 87 | S489: WAVERLEY | W489: WAVERLEY | X489: 6 | Y489: 5 | Z489: 0 | AA489: 1205 | AB489: 1105 | AC489: =(AA489*100)/AB489 -> 109.0497737556561 | AD489: =(X489*4)+(Z489*2) -> 24
A490: WAVERLEY | C490: 3 | D490: 5 | E490: =C490*6+D490 -> 23 | G490: 5 | H490: 11 | I490: =G490*6+H490 -> 41 | K490: 8 | L490: 13 | M490: =K490*6+L490 -> 61 | O490: 10 | P490: 13 | Q490: =O490*6+P490 -> 73 | W490: CAULFIELD | X490: 5 | Y490: 6 | Z490: 0 | AA490: 1232 | AB490: 1089 | AC490: =(AA490*100)/AB490 -> 113.13131313131314 | AD490: =(X490*4)+(Z490*2) -> 20
A491: BEST PLAYERS | W491: DANDENONG | X491: 4 | Y491: 7 | Z491: 0 | AA491: 1309 | AB491: 1404 | AC491: =(AA491*100)/AB491 -> 93.23361823361823 | AD491: =(X491*4)+(Z491*2) -> 16
A492: NORTHCOTE | W492: BERWICK | X492: 3 | Y492: 8 | Z492: 0 | AA492: 1015 | AB492: 1231 | AC492: =(AA492*100)/AB492 -> 82.453290008123474 | AD492: =(X492*4)+(Z492*2) -> 12
A493: WAVERLEY | W493: MORDIALLOC | X493: 2 | Y493: 9 | Z493: 0 | AA493: 1063 | AB493: 1440 | AC493: =(AA493*100)/AB493 -> 73.819444444444443 | AD493: =(X493*4)+(Z493*2) -> 8
A494: GOALKICKERS | W494: NORTHCOTE | X494: 2 | Y494: 9 | Z494: 0 | AA494: 782 | AB494: 1502 | AC494: =(AA494*100)/AB494 -> 52.06391478029294 | AD494: =(X494*4)+(Z494*2) -> 8
A495: NORTHCOTE
A496: WAVERLEY
A498: SUNSHINE | C498: 2 | D498: 2 | E498: =C498*6+D498 -> 14 | G498: 9 | H498: 3 | I498: =G498*6+H498 -> 57 | K498: 15 | L498: 5 | M498: =K498*6+L498 -> 95 | O498: 21 | P498: 9 | Q498: =O498*6+P498 -> 135 | S498: SUNSHINE
A499: BRUNSWICK | C499: 3 | D499: 4 | E499: =C499*6+D499 -> 22 | G499: 6 | H499: 10 | I499: =G499*6+H499 -> 46 | K499: 9 | L499: 11 | M499: =K499*6+L499 -> 65 | O499: 12 | P499: 13 | Q499: =O499*6+P499 -> 85
A500: BEST PLAYERS
A501: SUNSHINE
A502: BRUNSWICK
A503: GOALKICKERS
A504: SUNSHINE
A505: BRUNSWICK
A507: OAKLEIGH | C507: 5 | D507: 4 | E507: =C507*6+D507 -> 34 | G507: 11 | H507: 10 | I507: =G507*6+H507 -> 76 | K507: 15 | L507: 12 | M507: =K507*6+L507 -> 102 | O507: 20 | P507: 14 | Q507: =O507*6+P507 -> 134 | S507: OAKLEIGH
A508: DANDENONG | C508: 5 | D508: 2 | E508: =C508*6+D508 -> 32 | G508: 8 | H508: 3 | I508: =G508*6+H508 -> 51 | K508: 11 | L508: 6 | M508: =K508*6+L508 -> 72 | O508: 17 | P508: 8 | Q508: =O508*6+P508 -> 110
A509: BEST PLAYERS
A510: OAKLEIGH
A511: DANDENONG
A512: GOALKICKERS
A513: OAKLEIGH
A514: DANDENONG
A516: MOORABBIN | C516: 4 | D516: 3 | E516: =C516*6+D516 -> 27 | G516: 5 | H516: 6 | I516: =G516*6+H516 -> 36 | K516: 10 | L516: 11 | M516: =K516*6+L516 -> 71 | O516: 13 | P516: 18 | Q516: =O516*6+P516 -> 96 | S516: BENTLEIGH
A517: MORDIALLOC | C517: 1 | D517: 3 | E517: =C517*6+D517 -> 9 | G517: 3 | H517: 7 | I517: =G517*6+H517 -> 25 | K517: 5 | L517: 7 | M517: =K517*6+L517 -> 37 | O517: 9 | P517: 12 | Q517: =O517*6+P517 -> 66
A518: BEST PLAYERS
A519: MOORABBIN
A520: MORDIALLOC
A521: GOALKICKERS
A522: MOORABBIN
A523: MORDIALLOC
A525: ROUND 12 | E525: 14TH JULY | J525: WEATHER | S525: PLAYED AT
D526: 1ST QTR | H526: 2ND QTR | L526: 3RD QTR | P526: FINAL | S526: BENTLEIGH
A527: OAKLEIGH | C527: 6 | D527: 2 | E527: =C527*6+D527 -> 38 | G527: 10 | H527: 8 | I527: =G527*6+H527 -> 68 | K527: 13 | L527: 13 | M527: =K527*6+L527 -> 91 | O527: 22 | P527: 17 | Q527: =O527*6+P527 -> 149 | S527: UMPIRE | X527: LADDER | AB527: ROUND | AD527: 12
A528: MOORABBIN | C528: 1 | D528: 6 | E528: =C528*6+D528 -> 12 | G528: 4 | H528: 8 | I528: =G528*6+H528 -> 32 | K528: 8 | L528: 12 | M528: =K528*6+L528 -> 60 | O528: 9 | P528: 15 | Q528: =O528*6+P528 -> 69
A529: BEST PLAYERS | W529: TEAM | X529: W | Y529: L | Z529: D | AA529: FOR | AB529: AGST | AC529: % | AD529: PTS
A530: OAKLEIGH
A531: MOORABBIN | W531: OAKLEIGH | X531: 10 | Y531: 2 | Z531: 0 | AA531: 1660 | AB531: 1155 | AC531: =(AA531*100)/AB531 -> 143.72294372294371 | AD531: =(X531*4)+(Z531*2) -> 40
A532: GOALKICKERS | W532: BRUNSWICK | X532: 10 | Y532: 2 | Z532: 0 | AA532: 1598 | AB532: 1248 | AC532: =(AA532*100)/AB532 -> 128.0448717948718 | AD532: =(X532*4)+(Z532*2) -> 40
A533: OAKLEIGH | W533: SUNSHINE | X533: 8 | Y533: 4 | Z533: 0 | AA533: 1358 | AB533: 1093 | AC533: =(AA533*100)/AB533 -> 124.2451967063129 | AD533: =(X533*4)+(Z533*2) -> 32
A534: MOORABBIN | W534: MOORABBIN | X534: 8 | Y534: 4 | Z534: 0 | AA534: 1345 | AB534: 1210 | AC534: =(AA534*100)/AB534 -> 111.15702479338843 | AD534: =(X534*4)+(Z534*2) -> 32
A536: CAULFIELD | C536: 3 | D536: 4 | E536: =C536*6+D536 -> 22 | G536: 11 | H536: 6 | I536: =G536*6+H536 -> 72 | K536: 13 | L536: 12 | M536: =K536*6+L536 -> 90 | O536: 19 | P536: 19 | Q536: =O536*6+P536 -> 133 | S536: NORTHCOTE | W536: CAULFIELD | X536: 6 | Y536: 6 | Z536: 0 | AA536: 1365 | AB536: 1139 | AC536: =(AA536*100)/AB536 -> 119.84196663740123 | AD536: =(X536*4)+(Z536*2) -> 24
A537: NORTHCOTE | C537: 2 | D537: 0 | E537: =C537*6+D537 -> 12 | G537: 4 | H537: 0 | I537: =G537*6+H537 -> 24 | K537: 6 | L537: 6 | M537: =K537*6+L537 -> 42 | O537: 7 | P537: 8 | Q537: =O537*6+P537 -> 50 | W537: WAVERLEY | X537: 6 | Y537: 6 | Z537: 0 | AA537: 1296 | AB537: 1255 | AC537: =(AA537*100)/AB537 -> 103.26693227091633 | AD537: =(X537*4)+(Z537*2) -> 24
A538: BEST PLAYERS | W538: DANDENONG | X538: 4 | Y538: 8 | Z538: 0 | AA538: 1392 | AB538: 1514 | AC538: =(AA538*100)/AB538 -> 91.941875825627477 | AD538: =(X538*4)+(Z538*2) -> 16
A539: CAULFIELD | W539: BERWICK | X539: 3 | Y539: 9 | Z539: 0 | AA539: 1133 | AB539: 1378 | AC539: =(AA539*100)/AB539 -> 82.220609579100142 | AD539: =(X539*4)+(Z539*2) -> 12
A540: NORTHCOTE | W540: MORDIALLOC | X540: 3 | Y540: 9 | Z540: 0 | AA540: 1210 | AB540: 1558 | AC540: =(AA540*100)/AB540 -> 77.663671373555843 | AD540: =(X540*4)+(Z540*2) -> 12
A541: GOALKICKERS | W541: NORTHCOTE | X541: 2 | Y541: 10 | Z541: 0 | AA541: 832 | AB541: 1635 | AC541: =(AA541*100)/AB541 -> 50.886850152905197 | AD541: =(X541*4)+(Z541*2) -> 8
A542: CAULFIELD
A543: NORTHCOTE
A545: SUNSHINE | C545: 5 | D545: 10 | E545: =C545*6+D545 -> 40 | G545: 8 | H545: 13 | I545: =G545*6+H545 -> 61 | K545: 14 | L545: 17 | M545: =K545*6+L545 -> 101 | O545: 16 | P545: 18 | Q545: =O545*6+P545 -> 114 | S545: DANDENONG
A546: DANDENONG | C546: 2 | D546: 1 | E546: =C546*6+D546 -> 13 | G546: 4 | H546: 9 | I546: =G546*6+H546 -> 33 | K546: 6 | L546: 11 | M546: =K546*6+L546 -> 47 | O546: 11 | P546: 17 | Q546: =O546*6+P546 -> 83
A547: BEST PLAYERS
A548: SUNSHINE
A549: DANDENONG
A550: GOALKICKERS
A551: SUNSHINE
A552: DANDENONG
A554: MORDIALLOC | C554: 2 | D554: 4 | E554: =C554*6+D554 -> 16 | G554: 7 | H554: 9 | I554: =G554*6+H554 -> 51 | K554: 11 | L554: 10 | M554: =K554*6+L554 -> 76 | O554: 22 | P554: 15 | Q554: =O554*6+P554 -> 147 | S554: MORDIALLOC
A555: BERWICK | C555: 6 | D555: 7 | E555: =C555*6+D555 -> 43 | G555: 9 | H555: 9 | I555: =G555*6+H555 -> 63 | K555: 16 | L555: 15 | M555: =K555*6+L555 -> 111 | O555: 17 | P555: 16 | Q555: =O555*6+P555 -> 118
A556: BEST PLAYERS
A557: MORDIALLOC
A558: BERWICK
A559: GOALKICKERS
A560: MORDIALLOC
A561: BERWICK
A563: BRUNSWICK | C563: 8 | D563: 6 | E563: =C563*6+D563 -> 54 | G563: 12 | H563: 12 | I563: =G563*6+H563 -> 84 | K563: 14 | L563: 20 | M563: =K563*6+L563 -> 104 | O563: 21 | P563: 24 | Q563: =O563*6+P563 -> 150 | S563: BRUNSWICK
A564: WAVERLEY | C564: 3 | D564: 2 | E564: =C564*6+D564 -> 20 | G564: 7 | H564: 4 | I564: =G564*6+H564 -> 46 | K564: 11 | L564: 6 | M564: =K564*6+L564 -> 72 | O564: 14 | P564: 7 | Q564: =O564*6+P564 -> 91
A565: BEST PLAYERS
A566: BRUNSWICK
A567: WAVERLEY
A568: GOALKICKERS
A569: BRUNSWICK
A570: WAVERLEY
A572: ROUND 13 | E572: 21ST JULY | J572: WEATHER | S572: PLAYED AT
D573: 1ST QTR | H573: 2ND QTR | L573: 3RD QTR | P573: FINAL | S573: PRINCES PARK, CAULFIELD
A574: CAULFIELD | C574: 5 | D574: 5 | E574: =C574*6+D574 -> 35 | G574: 12 | H574: 10 | I574: =G574*6+H574 -> 82 | K574: 16 | L574: 14 | M574: =K574*6+L574 -> 110 | O574: 19 | P574: 18 | Q574: =O574*6+P574 -> 132 | S574: UMPIRE | X574: LADDER | AB574: ROUND | AD574: 13
A575: BRUNSWICK | C575: 4 | D575: 3 | E575: =C575*6+D575 -> 27 | G575: 6 | H575: 7 | I575: =G575*6+H575 -> 43 | K575: 9 | L575: 9 | M575: =K575*6+L575 -> 63 | O575: 12 | P575: 11 | Q575: =O575*6+P575 -> 83 | S575: BROOKS/CASEY
A576: BEST PLAYERS | W576: TEAM | X576: W | Y576: L | Z576: D | AA576: FOR | AB576: AGST | AC576: % | AD576: PTS
A577: CAULFIELD | C577: BARRY | F577: EINSEDEL | I577: FARINSKI | L577: GAYFER | O577: McCORMACK | R577: MOON
A578: BRUNSWICK | C578: WEST | F578: THORNTON | I578: EDWARDS | L578: WHILLAS | W578: OAKLEIGH | X578: 11 | Y578: 2 | Z578: 0 | AA578: 1856 | AB578: 1208 | AC578: =(AA578*100)/AB578 -> 153.64238410596028 | AD578: =(X578*4)+(Z578*2) -> 44
A579: GOALKICKERS | W579: BRUNSWICK | X579: 10 | Y579: 3 | Z579: 0 | AA579: 1681 | AB579: 1380 | AC579: =(AA579*100)/AB579 -> 121.81159420289855 | AD579: =(X579*4)+(Z579*2) -> 40
A580: CAULFIELD | C580: MOON 5 | E580: CRANNY 3 | G580: WALTON 3 | I580: DAWSON 2 | K580: PACKHAM 2 | N580: BARRY | P580: CROOK | R580: REID | S580: RYAN | W580: SUNSHINE | X580: 9 | Y580: 4 | Z580: 0 | AA580: 1462 | AB580: 1173 | AC580: =(AA580*100)/AB580 -> 124.6376811594203 | AD580: =(X580*4)+(Z580*2) -> 36
A581: BRUNSWICK | C581: THORNTON 3 | F581: GIBSON 2 | H581: LAWSON | J581: McGHIE | L581: SAHLBERG | N581: SMYTHE | P581: TOY | Q581: WEST | R581: WHILLAS | W581: MOORABBIN | X581: 8 | Y581: 5 | Z581: 0 | AA581: 1425 | AB581: 1314 | AC581: =(AA581*100)/AB581 -> 108.44748858447488 | AD581: =(X581*4)+(Z581*2) -> 32
A583: OAKLEIGH | C583: 9 | D583: 5 | E583: =C583*6+D583 -> 59 | G583: 15 | H583: 11 | I583: =G583*6+H583 -> 101 | K583: 22 | L583: 14 | M583: =K583*6+L583 -> 146 | O583: 30 | P583: 16 | Q583: =O583*6+P583 -> 196 | S583: OAKLEIGH | W583: CAULFIELD | X583: 7 | Y583: 6 | Z583: 0 | AA583: 1497 | AB583: 1222 | AC583: =(AA583*100)/AB583 -> 122.50409165302783 | AD583: =(X583*4)+(Z583*2) -> 28
A584: MORDIALLOC | C584: 4 | D584: 0 | E584: =C584*6+D584 -> 24 | G584: 6 | H584: 6 | I584: =G584*6+H584 -> 42 | K584: 6 | L584: 8 | M584: =K584*6+L584 -> 44 | O584: 7 | P584: 11 | Q584: =O584*6+P584 -> 53 | S584: BLOOM | W584: WAVERLEY | X584: 6 | Y584: 7 | Z584: 0 | AA584: 1353 | AB584: 1317 | AC584: =(AA584*100)/AB584 -> 102.73348519362187 | AD584: =(X584*4)+(Z584*2) -> 24
A585: BEST PLAYERS | S585: HUTCHINSON | W585: DANDENONG | X585: 5 | Y585: 8 | Z585: 0 | AA585: 1456 | AB585: 1571 | AC585: =(AA585*100)/AB585 -> 92.679821769573522 | AD585: =(X585*4)+(Z585*2) -> 20
A586: OAKLEIGH | C586: HILLIARD | F586: OWEN | I586: ALDRIDGE | L586: S ROACH | O586: ROSS | Q586: TODD | W586: BERWICK | X586: 3 | Y586: 10 | Z586: 0 | AA586: 1176 | AB586: 1435 | AC586: =(AA586*100)/AB586 -> 81.951219512195124 | AD586: =(X586*4)+(Z586*2) -> 12
A587: MORDIALLOC | C587: HALE | F587: POLLOCK | I587: DEATON | L587: CARTY | W587: MORDIALLOC | X587: 3 | Y587: 10 | Z587: 0 | AA587: 1263 | AB587: 1754 | AC587: =(AA587*100)/AB587 -> 72.006841505131135 | AD587: =(X587*4)+(Z587*2) -> 12
A588: GOALKICKERS | W588: NORTHCOTE | X588: 3 | Y588: 10 | Z588: 0 | AA588: 889 | AB588: 1678 | AC588: =(AA588*100)/AB588 -> 52.979737783075088 | AD588: =(X588*4)+(Z588*2) -> 12
A589: OAKLEIGH | C589: PRETTO 9 | F589: OWEN 8 | H589: ALDRIDGE 5 | K589: JOHNSON 4 | N589: M ROACH 2 | Q589: TODD | S589: SUTHERLAND
A590: MORDIALLOC | C590: HALE 3 | E590: CARTY | G590: BROMLEY | J590: BENSON | L590: POLLOCK
A592: DANDENONG | C592: 1 | D592: 2 | E592: =C592*6+D592 -> 8 | G592: 3 | H592: 7 | I592: =G592*6+H592 -> 25 | K592: 6 | L592: 9 | M592: =K592*6+L592 -> 45 | O592: 8 | P592: 14 | Q592: =O592*6+P592 -> 62 | S592: WAVERLEY
A593: WAVERLEY | C593: 3 | D593: 6 | E593: =C593*6+D593 -> 24 | G593: 5 | H593: 10 | I593: =G593*6+H593 -> 40 | K593: 7 | L593: 14 | M593: =K593*6+L593 -> 56 | O593: 7 | P593: 15 | Q593: =O593*6+P593 -> 57 | S593: SMITH/TORNEY
A594: BEST PLAYERS
A595: DANDENONG | C595: HALL | E595: VILLANI | H595: FINN | K595: KEE | N595: WESTCOTT | Q595: TREMBATH
A596: WAVERLEY | C596: CASTILLO | E596: CSOTI | H596: EVANS | K596: FISHER | N596: KENDALL | Q596: KINNABURGH
A597: GOALKICKERS
A598: DANDENONG | C598: WESTCOTT 2 | F598: MYNOTT 2 | I598: KAYE | K598: HALL | M598: FINN | O598: WOOD
A599: WAVERLEY | C599: EVANS 5 | F599: ANGELIS | I599: MIER
A601: NORTHCOTE | C601: 4 | D601: 1 | E601: =C601*6+D601 -> 25 | G601: 6 | H601: 6 | I601: =G601*6+H601 -> 42 | K601: 7 | L601: 9 | M601: =K601*6+L601 -> 51 | O601: 8 | P601: 9 | Q601: =O601*6+P601 -> 57 | S601: BERWICK
A602: BERWICK | C602: 2 | D602: 2 | E602: =C602*6+D602 -> 14 | G602: 3 | H602: 5 | I602: =G602*6+H602 -> 23 | K602: 5 | L602: 7 | M602: =K602*6+L602 -> 37 | O602: 5 | P602: 13 | Q602: =O602*6+P602 -> 43 | S602: CHAPMAN/McDONALD
A603: BEST PLAYERS
A604: NORTHCOTE | C604: WENBORNE | F604: INGLIS | I604: SPAGNOLO | L604: ALLEVA | O604: SPROAT | R604: ADAMSON
A605: BERWICK | C605: M JOHNSON | F605: ORSBORNE | I605: LUXFORD | L605: GAMBETTA | O605: S JOHNSON
A606: GOALKICKERS
A607: NORTHCOTE | C607: GLOBBIN 3 | F607: CUTLER 2 | I607: SMITH 2 | K607: REDENBACH
A608: BERWICK | C608: WARD | E608: BREEN | G608: ALLEN | I608: BROWN | K608: PARK
A610: SUNSHINE | C610: 3 | D610: 8 | E610: =C610*6+D610 -> 26 | G610: 6 | H610: 11 | I610: =G610*6+H610 -> 47 | K610: 9 | L610: 17 | M610: =K610*6+L610 -> 71 | O610: 13 | P610: 26 | Q610: =O610*6+P610 -> 104 | S610: SUNSHINE
A611: MOORABBIN | C611: 5 | D611: 0 | E611: =C611*6+D611 -> 30 | G611: 8 | H611: 2 | I611: =G611*6+H611 -> 50 | K611: 9 | L611: 3 | M611: =K611*6+L611 -> 57 | O611: 12 | P611: 8 | Q611: =O611*6+P611 -> 80 | S611: R CASEY/MARSHALL
A612: BEST PLAYERS
A613: SUNSHINE | C613: NELSON | F613: MITROVSKI | I613: SCANLON | L613: BROWN | N613: WAGLAND | Q613: LITCHFIELD
A614: MOORABBIN | C614: PAPPAS | F614: B CATHCART | I614: FALCONER | L614: REVERE | N614: POLLOCK
A615: GOALKICKERS
A616: SUNSHINE | C616: LITCHFIELD 3 | F616: HYSOLI 3 | H616: DAY 2 | J616: COOKE | L616: McQUALTER | O616: SCICCHATATO | R616: LAWLER | U616: MITROVSKI
A617: MOORABBIN | C617: O'TOOLE 4 | F617: ATHERTON 2 | I617: COOK 2 | K617: STEWART | N617: GILMORE | P617: POLLOCK | R617: BEATTIE
A619: ROUND 14 | E619: 28TH JULY | J619: WEATHER | S619: PLAYED AT
D620: 1ST QTR | H620: 2ND QTR | L620: 3RD QTR | P620: FINAL | S620: OAKLEIGH
A621: OAKLEIGH | C621: 4 | D621: 5 | E621: =C621*6+D621 -> 29 | G621: 9 | H621: 7 | I621: =G621*6+H621 -> 61 | K621: 9 | L621: 10 | M621: =K621*6+L621 -> 64 | O621: 16 | P621: 13 | Q621: =O621*6+P621 -> 109 | S621: UMPIRE | X621: LADDER | AB621: ROUND | AD621: 14
A622: SUNSHINE | C622: 4 | D622: 1 | E622: =C622*6+D622 -> 25 | G622: 8 | H622: 9 | I622: =G622*6+H622 -> 57 | K622: 13 | L622: 17 | M622: =K622*6+L622 -> 95 | O622: 15 | P622: 18 | Q622: =O622*6+P622 -> 108 | S622: MARCY/TORNRY
A623: BEST PLAYERS | W623: TEAM | X623: W | Y623: L | Z623: D | AA623: FOR | AB623: AGST | AC623: % | AD623: PTS
A624: OAKLEIGH | C624: JOHNSON | F624: POLA | I624: McDONALD | L624: PRETTO | O624: ROSS | R624: BROWN
A625: SUNSHINE | C625: BROWN | F625: MITROVSKI | I625: SCANLON | L625: LITCHFIELD | O625: McQUALTER | R625: HOBBS | W625: OAKLEIGH | X625: 12 | Y625: 2 | Z625: 0 | AA625: 1965 | AB625: 1316 | AC625: =(AA625*100)/AB625 -> 149.31610942249239 | AD625: =(X625*4)+(Z625*2) -> 48
A626: GOALKICKERS | W626: BRUNSWICK | X626: 11 | Y626: 3 | Z626: 0 | AA626: 1824 | AB626: 1416 | AC626: =(AA626*100)/AB626 -> 128.81355932203391 | AD626: =(X626*4)+(Z626*2) -> 44
A627: OAKLEIGH | C627: PRETTO 7 | F627: BROWN 4 | I627: M ROACH 2 | L627: ROSS | N627: OWEN | P627: MCDONALD | W627: SUNSHINE | X627: 9 | Y627: 5 | Z627: 0 | AA627: 1570 | AB627: 1282 | AC627: =(AA627*100)/AB627 -> 122.46489859594384 | AD627: =(X627*4)+(Z627*2) -> 36
A628: SUNSHINE | C628: LITCHFIELD 8 | F628: DAY 3 | H628: BROWN | J628: HYSOLI | L628: NELSON | N628: McQUALTER | W628: MOORABBIN | X628: 9 | Y628: 5 | Z628: 0 | AA628: 1525 | AB628: 1413 | AC628: =(AA628*100)/AB628 -> 107.92639773531494 | AD628: =(X628*4)+(Z628*2) -> 36
A630: MOORABBIN | C630: 1 | D630: 2 | E630: =C630*6+D630 -> 8 | G630: 7 | H630: 7 | I630: =G630*6+H630 -> 49 | K630: 10 | L630: 8 | M630: =K630*6+L630 -> 68 | O630: 15 | P630: 10 | Q630: =O630*6+P630 -> 100 | S630: BENTLEIGH | W630: CAULFIELD | X630: 8 | Y630: 6 | Z630: 0 | AA630: 1596 | AB630: 1316 | AC630: =(AA630*100)/AB630 -> 121.27659574468085 | AD630: =(X630*4)+(Z630*2) -> 32
A631: WAVERLEY | C631: 7 | D631: 7 | E631: =C631*6+D631 -> 49 | G631: 8 | H631: 8 | I631: =G631*6+H631 -> 56 | K631: 12 | L631: 13 | M631: =K631*6+L631 -> 85 | O631: 14 | P631: 15 | Q631: =O631*6+P631 -> 99 | S631: BLACK | W631: WAVERLEY | X631: 6 | Y631: 8 | Z631: 0 | AA631: 1452 | AB631: 1417 | AC631: =(AA631*100)/AB631 -> 102.47000705716302 | AD631: =(X631*4)+(Z631*2) -> 24
A632: BEST PLAYERS | S632: McDONALD | W632: DANDENONG | X632: 5 | Y632: 9 | Z632: 0 | AA632: 1550 | AB632: 1670 | AC632: =(AA632*100)/AB632 -> 92.814371257485035 | AD632: =(X632*4)+(Z632*2) -> 20
A633: MOORABBIN | C633: MERCOULIA | F633: GILMORE | I633: POLLOCK | L633: ATHERTON | O633: REVERE | R633: STEWART | W633: NORTHCOTE | X633: 4 | Y633: 10 | Z633: 0 | AA633: 981 | AB633: 1743 | AC633: =(AA633*100)/AB633 -> 56.282271944922549 | AD633: =(X633*4)+(Z633*2) -> 16
A634: WAVERLEY | C634: ANDERSON | F634: JOYCE | I634: CASTILLO | L634: CSOTI | O634: FISHER | R634: WILLIAMS | W634: BERWICK | X634: 3 | Y634: 11 | Z634: 0 | AA634: 1212 | AB634: 1578 | AC634: =(AA634*100)/AB634 -> 76.806083650190118 | AD634: =(X634*4)+(Z634*2) -> 12
A635: GOALKICKERS | W635: MORDIALLOC | X635: 3 | Y635: 11 | Z635: 0 | AA635: 1328 | AB635: 1846 | AC635: =(AA635*100)/AB635 -> 71.939328277356452 | AD635: =(X635*4)+(Z635*2) -> 12
A636: MOORABBIN | C636: COOK 5 | E636: POLLOCK 4 | H636: P LAZZARO 2 | K636: DIMATTINA 2 | N636: GILMORE | Q636: PERSSONS
A637: WAVERLEY | C637: ANGELIS 5 | F637: FISHER 3 | H637: HARRISON 2 | K637: EVANS | M637: McILWRAITH | P637: KENDALL | R637: PALLOTTA
A639: CAULFIELD | C639: 7 | D639: 2 | E639: =C639*6+D639 -> 44 | G639: 7 | H639: 2 | I639: =G639*6+H639 -> 44 | K639: 10 | L639: 7 | M639: =K639*6+L639 -> 67 | O639: 15 | P639: 9 | Q639: =O639*6+P639 -> 99 | S639: DANDENONG
A640: DANDENONG | C640: 1 | D640: 3 | E640: =C640*6+D640 -> 9 | G640: 8 | H640: 10 | I640: =G640*6+H640 -> 58 | K640: 8 | L640: 12 | M640: =K640*6+L640 -> 60 | O640: 13 | P640: 16 | Q640: =O640*6+P640 -> 94 | S640: MORGAN/PRICE
A641: BEST PLAYERS
A642: CAULFIELD | C642: FARINSKI | F642: EINSEDEL | I642: BARRY | L642: GAYFER | O642: WALTON
A643: DANDENONG | C643: TUFO | F643: HALL | I643: WRIGHT | L643: WESTCOTT | O643: P KNIGHT | R643: TREMBATH
A644: GOALKICKERS
A645: CAULFIELD | C645: CRANNY 6 | F645: MOON 3 | H645: CROOK | J645: DAWSON | L645: EINSEDEL | N645: FARINSKI | P645: REID | R645: WALTON
A646: DANDENONG | C646: WESTCOTT 5 | F646: TREMBATH 3 | I646: P KNIGHT 2 | L646: WOOD 2 | N646: HALL
A648: BRUNSWICK | C648: 4 | D648: 4 | E648: =C648*6+D648 -> 28 | G648: 9 | H648: 12 | I648: =G648*6+H648 -> 66 | K648: 16 | L648: 21 | M648: =K648*6+L648 -> 117 | O648: 20 | P648: 23 | Q648: =O648*6+P648 -> 143 | S648: BRUNSWICK
A649: BERWICK | C649: 1 | D649: 3 | E649: =C649*6+D649 -> 9 | G649: 2 | H649: 4 | I649: =G649*6+H649 -> 16 | K649: 2 | L649: 4 | M649: =K649*6+L649 -> 16 | O649: 5 | P649: 6 | Q649: =O649*6+P649 -> 36 | S649: HUTCHINSON/KENNEDY
A650: BEST PLAYERS
A651: BRUNSWICK | C651: THORNTON | F651: WEST | I651: WHILLAS | L651: NOLAN | O651: JUDGE | Q651: RAYNER
A652: BERWICK | C652: M JOHNSON | F652: GAMBETTA | I652: ORSBORNE | L652: MANNENS | O652: ALLEN | Q652: S JOHNSON
A653: GOALKICKERS
A654: BRUNSWICK | C654: GIBSON 6 | F654: LAWSON 4 | I654: PARSONS 2 | K654: NOLAN 2 | M654: JUDGE | O654: HERBERT | Q654: EDWARDS | S654: PULVRENTI | V654: TOY | W654: SAHLBERG
A655: BERWICK | C655: ORSBORNE 2 | F655: LUXFORD | I655: WRIGHT | K655: WARD
A657: NORTHCOTE | C657: 1 | D657: 3 | E657: =C657*6+D657 -> 9 | G657: 7 | H657: 11 | I657: =G657*6+H657 -> 53 | K657: 11 | L657: 13 | M657: =K657*6+L657 -> 79 | O657: 13 | P657: 14 | Q657: =O657*6+P657 -> 92 | S657: NORTHCOTE
A658: MORDIALLOC | C658: 2 | D658: 7 | E658: =C658*6+D658 -> 19 | G658: 4 | H658: 10 | I658: =G658*6+H658 -> 34 | K658: 6 | L658: 14 | M658: =K658*6+L658 -> 50 | O658: 8 | P658: 17 | Q658: =O658*6+P658 -> 65 | S658: BRADSHAW/SMITH
A659: BEST PLAYERS
A660: NORTHCOTE | C660: MINETT | F660: INGLIS | I660: MALLETT | L660: ADAMSON | O660: COURTS | Q660: GARDNER
A661: MORDIALLOC | C661: DAVIDSON | F661: HALE | I661: REVERE | L661: MAZAREK
A662: GOALKICKERS
A663: NORTHCOTE | C663: EWING 3 | F663: GLOBBIN 3 | I663: PANION 3 | K663: BEATTIE 2 | N663: MINNETT | Q663: SMITH
A664: MORDIALLOC | C664: HALE 2 | F664: MAZAREK 2 | I664: CARTY | K664: BAKER | M664: DEATON | O664: BROMLEY
A666: ROUND 15 | E666: 4TH AUGUST | J666: WEATHER | S666: PLAYED AT
D667: 1ST QTR | H667: 2ND QTR | L667: 3RD QTR | P667: FINAL | S667: PRINCES PARK, CAULFIELD
A668: CAULFIELD | C668: 1 | D668: 3 | E668: =C668*6+D668 -> 9 | G668: 5 | H668: 11 | I668: =G668*6+H668 -> 41 | K668: 10 | L668: 11 | M668: =K668*6+L668 -> 71 | O668: 15 | P668: 20 | Q668: =O668*6+P668 -> 110 | S668: UMPIRE | X668: LADDER | AB668: ROUND | AD668: 15
A669: MOORABBIN | C669: 4 | D669: 5 | E669: =C669*6+D669 -> 29 | G669: 5 | H669: 7 | I669: =G669*6+H669 -> 37 | K669: 9 | L669: 11 | M669: =K669*6+L669 -> 65 | O669: 11 | P669: 11 | Q669: =O669*6+P669 -> 77
A670: BEST PLAYERS | W670: TEAM | X670: W | Y670: L | Z670: D | AA670: FOR | AB670: AGST | AC670: % | AD670: PTS
A671: CAULFIELD
A672: MOORABBIN | W672: OAKLEIGH | X672: 13 | Y672: 2 | Z672: 0 | AA672: 2127 | AB672: 1412 | AC672: =(AA672*100)/AB672 -> 150.63739376770539 | AD672: =(X672*4)+(Z672*2) -> 52
A673: GOALKICKERS | W673: BRUNSWICK | X673: 12 | Y673: 3 | Z673: 0 | AA673: 1939 | AB673: 1474 | AC673: =(AA673*100)/AB673 -> 131.54681139755766 | AD673: =(X673*4)+(Z673*2) -> 48
A674: CAULFIELD | W674: SUNSHINE | X674: 10 | Y674: 5 | Z674: 0 | AA674: 1722 | AB674: 1337 | AC674: =(AA674*100)/AB674 -> 128.7958115183246 | AD674: =(X674*4)+(Z674*2) -> 40
A675: MOORABBIN | W675: CAULFIELD | X675: 9 | Y675: 6 | Z675: 0 | AA675: 1706 | AB675: 1393 | AC675: =(AA675*100)/AB675 -> 122.46949030868629 | AD675: =(X675*4)+(Z675*2) -> 36
A677: OAKLEIGH | C677: 2 | D677: 4 | E677: =C677*6+D677 -> 16 | G677: 13 | H677: 6 | I677: =G677*6+H677 -> 84 | K677: 20 | L677: 9 | M677: =K677*6+L677 -> 129 | O677: 25 | P677: 12 | Q677: =O677*6+P677 -> 162 | S677: WAVERLEY | W677: MOORABBIN | X677: 9 | Y677: 6 | Z677: 0 | AA677: 1602 | AB677: 1523 | AC677: =(AA677*100)/AB677 -> 105.18713066316481 | AD677: =(X677*4)+(Z677*2) -> 36
A678: WAVERLEY | C678: 6 | D678: 5 | E678: =C678*6+D678 -> 41 | G678: 7 | H678: 6 | I678: =G678*6+H678 -> 48 | K678: 10 | L678: 9 | M678: =K678*6+L678 -> 69 | O678: 14 | P678: 12 | Q678: =O678*6+P678 -> 96 | W678: WAVERLEY | X678: 6 | Y678: 9 | Z678: 0 | AA678: 1548 | AB678: 1579 | AC678: =(AA678*100)/AB678 -> 98.036732108929698 | AD678: =(X678*4)+(Z678*2) -> 24
A679: BEST PLAYERS | W679: DANDENONG | X679: 5 | Y679: 10 | Z679: 0 | AA679: 1605 | AB679: 1769 | AC679: =(AA679*100)/AB679 -> 90.729225551158848 | AD679: =(X679*4)+(Z679*2) -> 20
A680: OAKLEIGH | W680: BERWICK | X680: 4 | Y680: 11 | Z680: 0 | AA680: 1311 | AB680: 1633 | AC680: =(AA680*100)/AB680 -> 80.281690140845072 | AD680: =(X680*4)+(Z680*2) -> 16
A681: WAVERLEY | W681: NORTHCOTE | X681: 4 | Y681: 11 | Z681: 0 | AA681: 1039 | AB681: 1858 | AC681: =(AA681*100)/AB681 -> 55.920344456404735 | AD681: =(X681*4)+(Z681*2) -> 16
A682: GOALKICKERS | W682: MORDIALLOC | X682: 3 | Y682: 12 | Z682: 0 | AA682: 1383 | AB682: 1998 | AC682: =(AA682*100)/AB682 -> 69.219219219219212 | AD682: =(X682*4)+(Z682*2) -> 12
A683: OAKLEIGH
A684: WAVERLEY
A686: BRUNSWICK | C686: 4 | D686: 4 | E686: =C686*6+D686 -> 28 | G686: 6 | H686: 15 | I686: =G686*6+H686 -> 51 | K686: 12 | L686: 20 | M686: =K686*6+L686 -> 92 | O686: 15 | P686: 25 | Q686: =O686*6+P686 -> 115 | S686: NORTHCOTE
A687: NORTHCOTE | C687: 2 | D687: 3 | E687: =C687*6+D687 -> 15 | G687: 3 | H687: 6 | I687: =G687*6+H687 -> 24 | K687: 6 | L687: 9 | M687: =K687*6+L687 -> 45 | O687: 8 | P687: 10 | Q687: =O687*6+P687 -> 58
A688: BEST PLAYERS
A689: BRUNSWICK
A690: NORTHCOTE
A691: GOALKICKERS
A692: BRUNSWICK
A693: NORTHCOTE
A695: BERWICK | C695: 2 | D695: 0 | E695: =C695*6+D695 -> 12 | G695: 8 | H695: 7 | I695: =G695*6+H695 -> 55 | K695: 10 | L695: 8 | M695: =K695*6+L695 -> 68 | O695: 14 | P695: 15 | Q695: =O695*6+P695 -> 99 | S695: BERWICK
A696: DANDENONG | C696: 5 | D696: 4 | E696: =C696*6+D696 -> 34 | G696: 5 | H696: 4 | I696: =G696*6+H696 -> 34 | K696: 8 | L696: 5 | M696: =K696*6+L696 -> 53 | O696: 8 | P696: 7 | Q696: =O696*6+P696 -> 55
A697: BEST PLAYERS
A698: BERWICK
A699: DANDENONG
A700: GOALKICKERS
A701: BERWICK
A702: DANDENONG
A704: SUNSHINE | C704: 4 | D704: 2 | E704: =C704*6+D704 -> 26 | G704: 9 | H704: 9 | I704: =G704*6+H704 -> 63 | K704: 15 | L704: 16 | M704: =K704*6+L704 -> 106 | O704: 22 | P704: 20 | Q704: =O704*6+P704 -> 152 | S704: MORDIALLOC
A705: MORDIALLOC | C705: 2 | D705: 6 | E705: =C705*6+D705 -> 18 | G705: 5 | H705: 9 | I705: =G705*6+H705 -> 39 | K705: 7 | L705: 9 | M705: =K705*6+L705 -> 51 | O705: 7 | P705: 13 | Q705: =O705*6+P705 -> 55
A706: BEST PLAYERS
A707: SUNSHINE
A708: MORDIALLOC
A709: GOALKICKERS
A710: SUNSHINE
A711: MORDIALLOC
A713: ROUND 16 | E713: 11TH AUGUST | J713: WEATHER | S713: PLAYED AT
D714: 1ST QTR | H714: 2ND QTR | L714: 3RD QTR | P714: FINAL | S714: SUNSHINE
A715: SUNSHINE | C715: 3 | D715: 3 | E715: =C715*6+D715 -> 21 | G715: 9 | H715: 9 | I715: =G715*6+H715 -> 63 | K715: 11 | L715: 11 | M715: =K715*6+L715 -> 77 | O715: 18 | P715: 13 | Q715: =O715*6+P715 -> 121 | S715: UMPIRE | X715: LADDER | AB715: ROUND | AD715: 16
A716: WAVERLEY | C716: 4 | D716: 2 | E716: =C716*6+D716 -> 26 | G716: 4 | H716: 5 | I716: =G716*6+H716 -> 29 | K716: 6 | L716: 8 | M716: =K716*6+L716 -> 44 | O716: 9 | P716: 13 | Q716: =O716*6+P716 -> 67 | S716: BRADSHAW/PRICE
A717: BEST PLAYERS | W717: TEAM | X717: W | Y717: L | Z717: D | AA717: FOR | AB717: AGST | AC717: % | AD717: PTS
A718: SUNSHINE | C718: MITROVSKI | F718: GIBB | I718: CALDWELL | L718: LAWLER | O718: WAGLAND | R718: HYSOLI
A719: WAVERLEY | C719: KENDALL | F719: WILLIAMS | I719: McILWRAITH | L719: DE WIT | O719: WENBORNE | R719: CSOTI | W719: OAKLEIGH | X719: 14 | Y719: 2 | Z719: 0 | AA719: 2245 | AB719: 1501 | AC719: =(AA719*100)/AB719 -> 149.56695536309127 | AD719: =(X719*4)+(Z719*2) -> 56
A720: GOALKICKERS | W720: BRUNSWICK | X720: 13 | Y720: 3 | Z720: 0 | AA720: 2099 | AB720: 1573 | AC720: =(AA720*100)/AB720 -> 133.43928798474252 | AD720: =(X720*4)+(Z720*2) -> 52
A721: SUNSHINE | C721: DAY 6 | E721: LITCHFIELD 6 | H721: McQUALTER 2 | K721: NELSON 2 | N721: BROWN | P721: HYSOLI | W721: SUNSHINE | X721: 11 | Y721: 5 | Z721: 0 | AA721: 1843 | AB721: 1404 | AC721: =(AA721*100)/AB721 -> 131.26780626780626 | AD721: =(X721*4)+(Z721*2) -> 44
A722: WAVERLEY | C722: ANGELIS 4 | F722: MIER 2 | H722: WENBORNE | K722: HARRISON | N722: PALLOTTA | W722: MOORABBIN | X722: 10 | Y722: 6 | Z722: 0 | AA722: 1728 | AB722: 1567 | AC722: =(AA722*100)/AB722 -> 110.27440970006381 | AD722: =(X722*4)+(Z722*2) -> 40
A724: DANDENONG | C724: 7 | D724: 6 | E724: =C724*6+D724 -> 48 | G724: 13 | H724: 11 | I724: =G724*6+H724 -> 89 | K724: 21 | L724: 18 | M724: =K724*6+L724 -> 144 | O724: 27 | P724: 22 | Q724: =O724*6+P724 -> 184 | S724: DANDENONG | W724: CAULFIELD | X724: 9 | Y724: 7 | Z724: 0 | AA724: 1795 | AB724: 1511 | AC724: =(AA724*100)/AB724 -> 118.79549966909332 | AD724: =(X724*4)+(Z724*2) -> 36
A725: NORTHCOTE | C725: 5 | D725: 4 | E725: =C725*6+D725 -> 34 | G725: 10 | H725: 8 | I725: =G725*6+H725 -> 68 | K725: 11 | L725: 11 | M725: =K725*6+L725 -> 77 | O725: 17 | P725: 14 | Q725: =O725*6+P725 -> 116 | S725: TORNEY | W725: WAVERLEY | X725: 6 | Y725: 10 | Z725: 0 | AA725: 1615 | AB725: 1700 | AC725: =(AA725*100)/AB725 -> 95 | AD725: =(X725*4)+(Z725*2) -> 24
A726: BEST PLAYERS | S726: BOYD | W726: DANDENONG | X726: 6 | Y726: 10 | Z726: 0 | AA726: 1789 | AB726: 1885 | AC726: =(AA726*100)/AB726 -> 94.907161803713521 | AD726: =(X726*4)+(Z726*2) -> 24
A727: DANDENONG | C727: KANNOURAKIS | G727: S KNIGHT | J727: HALL | M727: K FINN | O727: LAMBERT | R727: TUFO | W727: BERWICK | X727: 4 | Y727: 12 | Z727: 0 | AA727: 1355 | AB727: 1759 | AC727: =(AA727*100)/AB727 -> 77.032404775440597 | AD727: =(X727*4)+(Z727*2) -> 16
A728: NORTHCOTE | C728: ALLEVA | G728: COURTS | J728: SPROAT | M728: INGLES | O728: GARDNER | R728: ARMSTRONG | W728: NORTHCOTE | X728: 4 | Y728: 12 | Z728: 0 | AA728: 1155 | AB728: 2042 | AC728: =(AA728*100)/AB728 -> 56.562193927522038 | AD728: =(X728*4)+(Z728*2) -> 16
A729: GOALKICKERS | K729: BRADLEY | N729: LAMBERT | Q729: WEIGHTMAN | W729: MORDIALLOC | X729: 3 | Y729: 13 | Z729: 0 | AA729: 1482 | AB729: 2158 | AC729: =(AA729*100)/AB729 -> 68.674698795180717 | AD729: =(X729*4)+(Z729*2) -> 12
A730: DANDENONG | C730: WESTCOTT 6 | F730: KANNOURAKIS 4 | I730: TREMBATH 4 | L730: HALL 4 | N730: TUFO 2 | P730: P KNIGHT 2 | S730: ELIADIS | U730: K FINN
A731: NORTHCOTE | C731: GLOBBIN 6 | F731: EWING 4 | H731: REDENBACH 2 | K731: SPROAT | M731: COURTS | O731: MITCHELL | R731: ARMSTRONG | U731: GARNER
A733: OAKLEIGH | C733: 7 | D733: 4 | E733: =C733*6+D733 -> 46 | G733: 11 | H733: 6 | I733: =G733*6+H733 -> 72 | K733: 13 | L733: 9 | M733: =K733*6+L733 -> 87 | O733: 18 | P733: 10 | Q733: =O733*6+P733 -> 118 | S733: OAKLEIGH
A734: CAULFIELD | C734: 2 | D734: 2 | E734: =C734*6+D734 -> 14 | G734: 7 | H734: 3 | I734: =G734*6+H734 -> 45 | K734: 11 | L734: 4 | M734: =K734*6+L734 -> 70 | O734: 14 | P734: 5 | Q734: =O734*6+P734 -> 89 | S734: BLAKE/OAKLEY
A735: BEST PLAYERS
A736: OAKLEIGH | C736: WALSH | F736: FOOTT | I736: POLA | L736: WALL | N736: M ROACH | Q736: PRETTO
A737: CAULFIELD | C737: EINSEDEL | F737: DAWSON | I737: GAYFER | L737: BARRY | N737: FIELD
A738: GOALKICKERS
A739: OAKLEIGH | C739: PRETTO 10 | F739: RAWLYK 2 | I739: JOHNSON 2 | L739: BROWN | N739: WALL | P739: BARRY | R739: OWEN
A740: CAULFIELD | C740: CROOK 3 | F740: EINSEDEL 2 | I740: McLENNAN 2 | L740: PACKHAM 2 | O740: RYAN 2 | Q740: CRANNY | S740: DAWSON | V740: JENKINS
A742: BRUNSWICK | C742: 4 | D742: 9 | E742: =C742*6+D742 -> 33 | G742: 11 | H742: 14 | I742: =G742*6+H742 -> 80 | K742: 17 | L742: 22 | M742: =K742*6+L742 -> 124 | O742: 22 | P742: 28 | Q742: =O742*6+P742 -> 160 | S742: BRUNSWICK
A743: MORDIALLOC | C743: 3 | D743: 5 | E743: =C743*6+D743 -> 23 | G743: 9 | H743: 8 | I743: =G743*6+H743 -> 62 | K743: 11 | L743: 13 | M743: =K743*6+L743 -> 79 | O743: 14 | P743: 15 | Q743: =O743*6+P743 -> 99 | S743: BOYD/McDONALD
A744: BEST PLAYERS
A745: BRUNSWICK | C745: WEST | F745: WHILLAS | I745: EDWARDS | L745: PARSONS | O745: FLOWER | R745: SAHLBERG
A746: MORDIALLOC | C746: BAKER | F746: MARGHERITI | I746: CARTY | L746: MAZAREK | O746: DEATON | R746: NEVILLE
A747: GOALKICKERS
A748: BRUNSWICK | C748: FLOWER 5 | F748: GIBSON 4 | H748: SAHLBERG 4 | K748: LAWSON 3 | N748: WEST 2 | P748: PARSONS | R748: EDWARDS | T748: PULVRENTI | W748: HERBERT
A749: MORDIALLOC | C749: NEVILLE 7 | F749: MAZAREK 3 | I749: CARTY 2 | K749: DEATON | M749: PA?
A751: MOORABBIN | C751: 4 | D751: 5 | E751: =C751*6+D751 -> 29 | G751: 10 | H751: 9 | I751: =G751*6+H751 -> 69 | K751: 12 | L751: 16 | M751: =K751*6+L751 -> 88 | O751: 17 | P751: 24 | Q751: =O751*6+P751 -> 126 | S751: BENTLEIGH
A752: BERWICK | C752: 3 | D752: 3 | E752: =C752*6+D752 -> 21 | G752: 3 | H752: 7 | I752: =G752*6+H752 -> 25 | K752: 5 | L752: 8 | M752: =K752*6+L752 -> 38 | O752: 6 | P752: 8 | Q752: =O752*6+P752 -> 44 | S752: BLOOM/STEERE
A753: BEST PLAYERS
A754: MOORABBIN | C754: MERCOULIA | F754: ATHERTON | I754: GILMORE | L754: POLLOCK | O754: D CATHCART | R754: STEWART
A755: BERWICK | C755: GAMBETTA | F755: McMASTER | I755: LUXFORD | L755: JOHNSON | O755: BREEN | R755: MANNENS
A756: GOALKICKERS
A757: MOORABBIN | C757: STEWART 5 | F757: HACK 3 | H757: SHULTZ 2 | J757: D CATHCART 2 | M757: GILMORE 2 | P757: COOK 2 | R757: POLLOCK
A758: BERWICK | C758: ALLEN 2 | F758: PARK | H758: GAMBETTA | K758: BREEN | M758: WARD
A760: ROUND 17 | E760: 18TH AUGUST | J760: WEATHER | S760: PLAYED AT
D761: 1ST QTR | H761: 2ND QTR | L761: 3RD QTR | P761: FINAL | S761: PRINCES PARK, CAULFIELD
A762: CAULFIELD | C762: 2 | D762: 4 | E762: =C762*6+D762 -> 16 | G762: 6 | H762: 9 | I762: =G762*6+H762 -> 45 | K762: 9 | L762: 13 | M762: =K762*6+L762 -> 67 | O762: 14 | P762: 20 | Q762: =O762*6+P762 -> 104 | S762: UMPIRE | X762: LADDER | AB762: ROUND | AD762: 17
A763: SUNSHINE | C763: 4 | D763: 2 | E763: =C763*6+D763 -> 26 | G763: 5 | H763: 4 | I763: =G763*6+H763 -> 34 | K763: 10 | L763: 6 | M763: =K763*6+L763 -> 66 | O763: 13 | P763: 9 | Q763: =O763*6+P763 -> 87 | S763: LLOYD/WALKER
A764: BEST PLAYERS | W764: TEAM | X764: W | Y764: L | Z764: D | AA764: FOR | AB764: AGST | AC764: % | AD764: PTS
A765: CAULFIELD | C765: GAYFER | F765: JENKINS | I765: CROOK | L765: WALTON | O765: BARRY | R765: FIELD
A766: SUNSHINE | C766: LITCHFIELD | F766: BROWN | I766: GIBB | L766: NELSON | O766: VADJNAL | W766: OAKLEIGH | X766: 15 | Y766: 2 | Z766: 0 | AA766: 2329 | AB766: 1533 | AC766: =(AA766*100)/AB766 -> 151.92433137638616 | AD766: =(X766*4)+(Z766*2) -> 60
A767: GOALKICKERS | W767: BRUNSWICK | X767: 14 | Y767: 3 | Z767: 0 | AA767: 2179 | AB767: 1643 | AC767: =(AA767*100)/AB767 -> 132.62325015216069 | AD767: =(X767*4)+(Z767*2) -> 56
A768: CAULFIELD | C768: CROOK 4 | F768: JENKINS 4 | H768: BARRY | J768: BLACK | L768: CRANNY | N768: McCORMACK | Q768: MOON | S768: SHERIDAN | W768: SUNSHINE | X768: 11 | Y768: 6 | Z768: 0 | AA768: 1920 | AB768: 1508 | AC768: =(AA768*100)/AB768 -> 127.32095490716181 | AD768: =(X768*4)+(Z768*2) -> 44
A769: SUNSHINE | C769: LITCHFIELD 10 | G769: BROWN | J769: LAWLER | L769: McQUALTER | W769: CAULFIELD | X769: 10 | Y769: 7 | Z769: 0 | AA769: 1899 | AB769: 1598 | AC769: =(AA769*100)/AB769 -> 118.8360450563204 | AD769: =(X769*4)+(Z769*2) -> 40
A771: BRUNSWICK | C771: 4 | D771: 5 | E771: =C771*6+D771 -> 29 | G771: 6 | H771: 6 | I771: =G771*6+H771 -> 42 | K771: 9 | L771: 9 | M771: =K771*6+L771 -> 63 | O771: 11 | P771: 14 | Q771: =O771*6+P771 -> 80 | S771: BRUNSWICK | W771: MOORABBIN | X771: 10 | Y771: 7 | Z771: 0 | AA771: 1789 | AB771: 1637 | AC771: =(AA771*100)/AB771 -> 109.28527794746488 | AD771: =(X771*4)+(Z771*2) -> 40
A772: DANDENONG | C772: 2 | D772: 4 | E772: =C772*6+D772 -> 16 | G772: 8 | H772: 11 | I772: =G772*6+H772 -> 59 | K772: 8 | L772: 14 | M772: =K772*6+L772 -> 62 | O772: 9 | P772: 16 | Q772: =O772*6+P772 -> 70 | S772: BREWER | W772: WAVERLEY | X772: 7 | Y772: 10 | Z772: 0 | AA772: 1751 | AB772: 1755 | AC772: =(AA772*100)/AB772 -> 99.772079772079778 | AD772: =(X772*4)+(Z772*2) -> 28
A773: BEST PLAYERS | S773: SMITH | W773: DANDENONG | X773: 6 | Y773: 11 | Z773: 0 | AA773: 1859 | AB773: 1965 | AC773: =(AA773*100)/AB773 -> 94.605597964376585 | AD773: =(X773*4)+(Z773*2) -> 24
A774: BRUNSWICK | C774: PARSONS | F774: HERBERT | I774: GIBSON | L774: McDONALD | O774: FLOWER | W774: NORTHCOTE | X774: 5 | Y774: 12 | Z774: 0 | AA774: 1225 | AB774: 2103 | AC774: =(AA774*100)/AB774 -> 58.250118877793625 | AD774: =(X774*4)+(Z774*2) -> 20
A775: DANDENONG | C775: KAYE | F775: HICKEY | I775: P KNIGHT | L775: HALL | O775: LAMBERT | R775: WRIGHT | W775: BERWICK | X775: 4 | Y775: 13 | Z775: 0 | AA775: 1387 | AB775: 1843 | AC775: =(AA775*100)/AB775 -> 75.257731958762889 | AD775: =(X775*4)+(Z775*2) -> 16
A776: GOALKICKERS | W776: MORDIALLOC | X776: 3 | Y776: 14 | Z776: 0 | AA776: 1537 | AB776: 2294 | AC776: =(AA776*100)/AB776 -> 67.000871839581521 | AD776: =(X776*4)+(Z776*2) -> 12
A777: BRUNSWICK | C777: FLOWER 5 | F777: LAWSON 3 | I777: GIBSON 2 | K777: PULVRENTI
A778: DANDENONG | C778: HALL 4 | F778: WESTCOTT 3 | I778: KANNOURAKIS | L778: ELLIADAS
A780: NORTHCOTE | C780: 2 | D780: 2 | E780: =C780*6+D780 -> 14 | G780: 8 | H780: 7 | I780: =G780*6+H780 -> 55 | K780: 9 | L780: 7 | M780: =K780*6+L780 -> 61 | O780: 10 | P780: 10 | Q780: =O780*6+P780 -> 70 | S780: NORTHCOTE
A781: MOORABBIN | C781: 2 | D781: 3 | E781: =C781*6+D781 -> 15 | G781: 2 | H781: 5 | I781: =G781*6+H781 -> 17 | K781: 3 | L781: 11 | M781: =K781*6+L781 -> 29 | O781: 8 | P781: 13 | Q781: =O781*6+P781 -> 61 | S781: KENNEDY/McDONALD
A782: BEST PLAYERS
A783: NORTHCOTE | C783: MALLETT | F783: ARMSTRONG | I783: GARNER | L783: INGLIS | O783: REDENBACH | R783: MITCHELL
A784: MOORABBIN | C784: MERCOULIA | F784: POLLOCK | I784: B CATHCART | L784: ATHERTON | O784: KNIGHT | R784: FALCONER
A785: GOALKICKERS
A786: NORTHCOTE | C786: EWING 2 | F786: REDENBACH 2 | I786: GLOBBIN 2 | K786: CUTLER 2 | N786: SPROAT | P786: BEATTIE
A787: MOORABBIN | C787: B CATHCART 2 | G787: D CATHCART | J787: HACK | L787: STEWART | N787: COOK | P787: ATHERTON
A789: OAKLEIGH | C789: 5 | D789: 6 | E789: =C789*6+D789 -> 36 | G789: 8 | H789: 8 | I789: =G789*6+H789 -> 56 | K789: 10 | L789: 10 | M789: =K789*6+L789 -> 70 | O789: 12 | P789: 12 | Q789: =O789*6+P789 -> 84 | S789: BERWICK
A790: BERWICK | C790: 2 | D790: 1 | E790: =C790*6+D790 -> 13 | G790: 3 | H790: 5 | I790: =G790*6+H790 -> 23 | K790: 4 | L790: 7 | M790: =K790*6+L790 -> 31 | O790: 4 | P790: 8 | Q790: =O790*6+P790 -> 32 | S790: GLEESON/WARD
A791: BEST PLAYERS
A792: OAKLEIGH | C792: G McDONALD | F792: TODD | I792: WALSH | L792: S ROACH | N792: FLYNN | Q792: HILLIARD
A793: BERWICK | C793: LUXFORD | F793: McMASTER | I793: GAMBETTA | L793: BROWN | N793: PARK | Q793: BREEN
A794: GOALKICKERS
A795: OAKLEIGH | C795: PRETTO 4 | F795: WALL 2 | H795: M ROACH 2 | K795: OWEN 2 | M795: McDONALD | P795: JOHNSON
A796: BERWICK | C796: McGREAL 3 | F796: KENNY
A798: WAVERLEY | C798: 3 | D798: 2 | E798: =C798*6+D798 -> 20 | G798: 5 | H798: 5 | I798: =G798*6+H798 -> 35 | K798: 15 | L798: 11 | M798: =K798*6+L798 -> 101 | O798: 20 | P798: 16 | Q798: =O798*6+P798 -> 136 | S798: MORDIALLOC
A799: MORDIALLOC | C799: 4 | D799: 2 | E799: =C799*6+D799 -> 26 | G799: 5 | H799: 5 | I799: =G799*6+H799 -> 35 | K799: 7 | L799: 6 | M799: =K799*6+L799 -> 48 | O799: 8 | P799: 7 | Q799: =O799*6+P799 -> 55 | S799: TORNEY/BLOOM
A800: BEST PLAYERS
A801: WAVERLEY | C801: KENDALL | F801: KINNABURGH | I801: C BUCK | L801: FISHER | N801: DE WIT | Q801: HARRISON
A802: MORDIALLOC | C802: BAKER | F802: LEWIS | I802: WATTERS | L802: DEATON
A803: GOALKICKERS
A804: WAVERLEY | C804: ANGELIS 6 | F804: KENDALL 4 | I804: C BUCK 3 | K804: McILWRAITH 2 | N804: MIER 2 | P804: WENBORNE 2 | S804: FISHER | V804: PALLOTTA
A805: MORDIALLOC | C805: NEVILLE 3 | F805: MAZAREK 3 | I805: BENSON | K805: POLLOCK
A807: ROUND 18 | E807: 25TH AUGUST | J807: WEATHER | S807: PLAYED AT
D808: 1ST QTR | H808: 2ND QTR | L808: 3RD QTR | P808: FINAL | S808: WAVERLEY
A809: CAULFIELD | C809: 7 | D809: 2 | E809: =C809*6+D809 -> 44 | G809: 8 | H809: 7 | I809: =G809*6+H809 -> 55 | K809: 14 | L809: 10 | M809: =K809*6+L809 -> 94 | O809: 15 | P809: 11 | Q809: =O809*6+P809 -> 101 | S809: UMPIRE | X809: LADDER | AB809: ROUND | AD809: 18
A810: WAVERLEY | C810: 4 | D810: 1 | E810: =C810*6+D810 -> 25 | G810: 8 | H810: 5 | I810: =G810*6+H810 -> 53 | K810: 8 | L810: 6 | M810: =K810*6+L810 -> 54 | O810: 11 | P810: 8 | Q810: =O810*6+P810 -> 74
A811: BEST PLAYERS | W811: TEAM | X811: W | Y811: L | Z811: D | AA811: FOR | AB811: AGST | AC811: % | AD811: PTS
A812: CAULFIELD
A813: WAVERLEY | W813: OAKLEIGH | X813: 16 | Y813: 2 | Z813: 0 | AA813: 2443 | AB813: 1595 | AC813: =(AA813*100)/AB813 -> 153.16614420062695 | AD813: =(X813*4)+(Z813*2) -> 64
A814: GOALKICKERS | W814: BRUNSWICK | X814: 14 | Y814: 4 | Z814: 0 | AA814: 2224 | AB814: 1712 | AC814: =(AA814*100)/AB814 -> 129.90654205607476 | AD814: =(X814*4)+(Z814*2) -> 56
A815: CAULFIELD | W815: SUNSHINE | X815: 12 | Y815: 6 | Z815: 0 | AA815: 2031 | AB815: 1533 | AC815: =(AA815*100)/AB815 -> 132.48532289628179 | AD815: =(X815*4)+(Z815*2) -> 48
A816: WAVERLEY | W816: CAULFIELD | X816: 11 | Y816: 7 | Z816: 0 | AA816: 2000 | AB816: 1672 | AC816: =(AA816*100)/AB816 -> 119.61722488038278 | AD816: =(X816*4)+(Z816*2) -> 44
A818: SUNSHINE | C818: 3 | D818: 6 | E818: =C818*6+D818 -> 24 | G818: 6 | H818: 7 | I818: =G818*6+H818 -> 43 | K818: 14 | L818: 12 | M818: =K818*6+L818 -> 96 | O818: 16 | P818: 15 | Q818: =O818*6+P818 -> 111 | S818: SUNSHINE | W818: MOORABBIN | X818: 11 | Y818: 7 | Z818: 0 | AA818: 1858 | AB818: 1682 | AC818: =(AA818*100)/AB818 -> 110.46373365041617 | AD818: =(X818*4)+(Z818*2) -> 44
A819: BERWICK | C819: 0 | D819: 1 | E819: =C819*6+D819 -> 1 | G819: 1 | H819: 2 | I819: =G819*6+H819 -> 8 | K819: 1 | L819: 2 | M819: =K819*6+L819 -> 8 | O819: 3 | P819: 7 | Q819: =O819*6+P819 -> 25 | W819: DANDENONG | X819: 7 | Y819: 11 | Z819: 0 | AA819: 2063 | AB819: 1998 | AC819: =(AA819*100)/AB819 -> 103.25325325325325 | AD819: =(X819*4)+(Z819*2) -> 28
A820: BEST PLAYERS | W820: WAVERLEY | X820: 7 | Y820: 11 | Z820: 0 | AA820: 1825 | AB820: 1856 | AC820: =(AA820*100)/AB820 -> 98.329741379310349 | AD820: =(X820*4)+(Z820*2) -> 28
A821: SUNSHINE | W821: NORTHCOTE | X821: 5 | Y821: 13 | Z821: 0 | AA821: 1287 | AB821: 2217 | AC821: =(AA821*100)/AB821 -> 58.05142083897158 | AD821: =(X821*4)+(Z821*2) -> 20
A822: BERWICK | W822: BERWICK | X822: 4 | Y822: 14 | Z822: 0 | AA822: 1412 | AB822: 1954 | AC822: =(AA822*100)/AB822 -> 72.26202661207779 | AD822: =(X822*4)+(Z822*2) -> 16
A823: GOALKICKERS | W823: MORDIALLOC | X823: 3 | Y823: 15 | Z823: 0 | AA823: 1570 | AB823: 2498 | AC823: =(AA823*100)/AB823 -> 62.850280224179343 | AD823: =(X823*4)+(Z823*2) -> 12
A824: SUNSHINE
A825: BERWICK
A827: OAKLEIGH | C827: 2 | D827: 9 | E827: =C827*6+D827 -> 21 | G827: 7 | H827: 12 | I827: =G827*6+H827 -> 54 | K827: 10 | L827: 13 | M827: =K827*6+L827 -> 73 | O827: 16 | P827: 18 | Q827: =O827*6+P827 -> 114 | S827: OAKLEIGH
A828: NORTHCOTE | C828: 4 | D828: 3 | E828: =C828*6+D828 -> 27 | G828: 7 | H828: 5 | I828: =G828*6+H828 -> 47 | K828: 8 | L828: 8 | M828: =K828*6+L828 -> 56 | O828: 9 | P828: 8 | Q828: =O828*6+P828 -> 62
A829: BEST PLAYERS
A830: OAKLEIGH
A831: NORTHCOTE
A832: GOALKICKERS
A833: OAKLEIGH
A834: NORTHCOTE
A836: MOORABBIN | C836: 1 | D836: 5 | E836: =C836*6+D836 -> 11 | G836: 5 | H836: 8 | I836: =G836*6+H836 -> 38 | K836: 8 | L836: 14 | M836: =K836*6+L836 -> 62 | O836: 9 | P836: 15 | Q836: =O836*6+P836 -> 69 | S836: BENTLEIGH
A837: BRUNSWICK | C837: 4 | D837: 3 | E837: =C837*6+D837 -> 27 | G837: 5 | H837: 5 | I837: =G837*6+H837 -> 35 | K837: 5 | L837: 6 | M837: =K837*6+L837 -> 36 | O837: 6 | P837: 9 | Q837: =O837*6+P837 -> 45
A838: BEST PLAYERS
A839: MOORABBIN
A840: BRUNSWICK
A841: GOALKICKERS
A842: MOORABBIN
A843: BRUNSWICK
A845: DANDENONG | C845: 6 | D845: 3 | E845: =C845*6+D845 -> 39 | G845: 19 | H845: 7 | I845: =G845*6+H845 -> 121 | K845: 22 | L845: 12 | M845: =K845*6+L845 -> 144 | O845: 31 | P845: 18 | Q845: =O845*6+P845 -> 204 | S845: DANDENONG
A846: MORDIALLOC | C846: 3 | D846: 6 | E846: =C846*6+D846 -> 24 | G846: 3 | H846: 6 | I846: =G846*6+H846 -> 24 | K846: 4 | L846: 7 | M846: =K846*6+L846 -> 31 | O846: 4 | P846: 9 | Q846: =O846*6+P846 -> 33
A847: BEST PLAYERS
A848: DANDENONG
A849: MORDIALLOC
A850: GOALKICKERS
A851: DANDENONG
A852: MORDIALLOC
A854: FINALS
A855: 1ST SEMI | E855: 1ST SEPTEMBER | J855: WEATHER | S855: PLAYED AT
D856: 1ST QTR | H856: 2ND QTR | L856: 3RD QTR | P856: FINAL | S856: JUNCTION OVAL
A857: SUNSHINE | C857: 3 | D857: 3 | E857: =C857*6+D857 -> 21 | G857: 5 | H857: 4 | I857: =G857*6+H857 -> 34 | K857: 8 | L857: 7 | M857: =K857*6+L857 -> 55 | O857: 15 | P857: 11 | Q857: =O857*6+P857 -> 101 | S857: UMPIRE
A858: CAULFIELD | C858: 1 | D858: 4 | E858: =C858*6+D858 -> 10 | G858: 3 | H858: 8 | I858: =G858*6+H858 -> 26 | K858: 7 | L858: 15 | M858: =K858*6+L858 -> 57 | O858: 10 | P858: 17 | Q858: =O858*6+P858 -> 77 | S858: VERGONA/WALKER
A859: BEST PLAYERS
A860: SUNSHINE | C860: NELSON | F860: CALDWELL | I860: DAY | L860: WAGLAND | O860: MITROVSKI | R860: CATTANACH
A861: CAULFIELD | C861: PACKHAM | F861: RYAN | I861: EINSEDEL | L861: GAYFER | O861: BARRY
A862: GOALKICKERS
A863: SUNSHINE | C863: DAY 6 | E863: NELSON 2 | G863: McQUALTER 2 | J863: LITCHFIELD 2 | M863: FORBES | O863: McVEIGH | Q863: MITROVSKI
A864: CAULFIELD | C864: CROOK 4 | F864: MOON 3 | I864: JENKINS | K864: PACKHAM | N864: REID
A866: 2ND SEMI | E866: 8TH SEPTEMBER | J866: WEATHER
A867: BRUNSWICK | C867: 4 | D867: 8 | E867: =C867*6+D867 -> 32 | G867: 13 | H867: 11 | I867: =G867*6+H867 -> 89 | K867: 18 | L867: 15 | M867: =K867*6+L867 -> 123 | O867: 25 | P867: 18 | Q867: =O867*6+P867 -> 168 | S867: JUNCTION OVAL
A868: OAKLEIGH | C868: 3 | D868: 1 | E868: =C868*6+D868 -> 19 | G868: 8 | H868: 4 | I868: =G868*6+H868 -> 52 | K868: 12 | L868: 6 | M868: =K868*6+L868 -> 78 | O868: 16 | P868: 12 | Q868: =O868*6+P868 -> 108 | S868: G BREWER/CASEY
A869: BEST PLAYERS
A870: BRUNSWICK | C870: WEST | F870: CALLANDER | I870: FLOWER | L870: THORNTON | O870: HERBERT | R870: LEAHY
A871: OAKLEIGH | C871: HUMPHREYS | F871: ALDRIDGE | I871: TODD | L871: JOHNSON
A872: GOALKICKERS
A873: BRUNSWICK | C873: FLOWER 9 | F873: SMYTHE 4 | H873: JUDGE 3 | J873: GIBSON 3 | L873: WEST 2 | N873: LAWSON | P873: PARSONS | R873: CALLANDER | U873: HERBERT
A874: OAKLEIGH | C874: PRETTO 5 | F874: OWEN 5 | H874: ROSS 2 | J874: ALDRIDGE 2 | M874: HUMPHREYS | P874: JOHNSON
A876: PRELIMINARY | E876: 15TH SEPTEMBER | J876: WEATHER
A877: OAKLEIGH | C877: 4 | D877: 3 | E877: =C877*6+D877 -> 27 | G877: 7 | H877: 7 | I877: =G877*6+H877 -> 49 | K877: 14 | L877: 12 | M877: =K877*6+L877 -> 96 | O877: 17 | P877: 16 | Q877: =O877*6+P877 -> 118 | S877: JUNCTION OVAL
A878: SUNSHINE | C878: 5 | D878: 3 | E878: =C878*6+D878 -> 33 | G878: 10 | H878: 3 | I878: =G878*6+H878 -> 63 | K878: 13 | L878: 5 | M878: =K878*6+L878 -> 83 | O878: 17 | P878: 6 | Q878: =O878*6+P878 -> 108 | S878: BLACK/FITZPATRICK
A879: BEST PLAYERS
A880: OAKLEIGH | C880: FOOTT | F880: OWEN | I880: HUMPHREYS | L880: TODD | O880: JOHNSON | R880: HOLDEN
A881: SUNSHINE | C881: FORBES | F881: CALDWELL | I881: NELSON | L881: MITROVSKI | O881: LITCHFIELD | R881: WAGLAND
A882: GOALKICKERS
A883: OAKLEIGH | C883: HOLDEN 4 | F883: PRETTO 4 | I883: OWEN 4 | K883: TODD 3 | N883: ROACH | P883: HUMPHREYS
A884: SUNSHINE | C884: LITCHFIELD 9 | F884: BROWN 3 | I884: DAY 2 | K884: MITROVSKI 2 | N884: WAGLAND
A886: GRAND | E886: 22ND SEPTEMBER | J886: WEATHER
A887: BRUNSWICK | C887: 8 | D887: 6 | E887: =C887*6+D887 -> 54 | G887: 13 | H887: 8 | I887: =G887*6+H887 -> 86 | K887: 23 | L887: 13 | M887: =K887*6+L887 -> 151 | O887: 25 | P887: 18 | Q887: =O887*6+P887 -> 168 | S887: JUNCTION OVAL
A888: OAKLEIGH | C888: 3 | D888: 3 | E888: =C888*6+D888 -> 21 | G888: 9 | H888: 5 | I888: =G888*6+H888 -> 59 | K888: 11 | L888: 10 | M888: =K888*6+L888 -> 76 | O888: 22 | P888: 12 | Q888: =O888*6+P888 -> 144 | S888: BLOOM/MAY
A889: BEST PLAYERS
A890: BRUNSWICK
A891: OAKLEIGH
A892: GOALKICKERS
A893: BRUNSWICK
A894: OAKLEIGH