A1: Victorian Football Association
A2: Season 1985 - Division One
A3: © Copyright Wal Williams | F3: First created: 14 November 2015
A4: Contact: joywalwi at gmail dot com | F4: Last updated: 3 December 2016 | W4: VFA Results and tables - Link to the main index page
A5: You are free to copy this document in whole or part provided that proper acknowledgement is given to the author. All rights reserved.
A7: 1985 | C7: 1ST DIVISION
A8: ROUND 1 | D8: 14TH APRIL | I8: WEATHER | S8: VENUE: WILLIAMSTOWN
D9: 1ST QTR | H9: 2ND QTR | L9: 3RD QTR | P9: FINAL | S9: UMPIRES
A10: PORT MELBOURNE | C10: 4 | D10: 9 | E10: 33 | G10: 6 | H10: 10 | I10: 46 | K10: 13 | L10: 13 | M10: 91 | O10: 21 | P10: 15 | Q10: 141 | S10: FITZPATRICK | X10: LADDER | AB10: ROUND | AD10: 1
A11: WILLIAMSTOWN | C11: 3 | D11: 1 | E11: 19 | G11: 9 | H11: 4 | I11: 58 | K11: 12 | L11: 11 | M11: 83 | O11: 14 | P11: 14 | Q11: 98 | S11: MARSHALL
A12: BEST PLAYERS | W12: TEAM | X12: W | Y12: L | Z12: D | AA12: FOR | AB12: AGST | AC12: % | AD12: PTS
A13: PORT MELBOURNE | C13: ROSS | E13: COOPER | H13: COLLINS | K13: JOHNSON | N13: CHADBAND | Q13: O'RILEY
A14: WILLIAMSTOWN | C14: OWEN | E14: SWANN | H14: DIMMARTINO | K14: SAIT | N14: MURPHY | Q14: RICKMAN | W14: SANDRINGHAM | X14: 1 | Y14: 0 | Z14: 0 | AA14: 158 | AB14: 105 | AC14: =(AA14/AB14)*100 -> 150.47619047619048 | AD14: =(X14*4)+(Z14*2) -> 4
A15: GOALKICKERS | W15: COBURG | X15: 1 | Y15: 0 | Z15: 0 | AA15: 172 | AB15: 117 | AC15: =(AA15/AB15)*100 -> 147.00854700854703 | AD15: =(X15*4)+(Z15*2) -> 4
A16: PORT MELBOURNE | C16: O'RILEY 6 | E16: JOHNSON 3 | H16: BRIEDIS 3 | J16: RODDA 3 | L16: BOOTH 2 | N16: YEOMANS 2 | Q16: CARTER 2 | W16: PORT MELBOURNE | X16: 1 | Y16: 0 | Z16: 0 | AA16: 141 | AB16: 98 | AC16: =(AA16/AB16)*100 -> 143.87755102040816 | AD16: =(X16*4)+(Z16*2) -> 4
A17: WILLIAMSTOWN | C17: FOTHERINGHAM 5 | F17: DAVIDSON 2 | I17: MURPHY 2 | L17: RICKMAN 2 | O17: SEMMONS | Q17: SAIT | R17: NANKERVIS | W17: GEELONG WEST | X17: 1 | Y17: 0 | Z17: 0 | AA17: 121 | AB17: 86 | AC17: =(AA17/AB17)*100 -> 140.69767441860466 | AD17: =(X17*4)+(Z17*2) -> 4
S18: VENUE: PRESTON
A19: PRESTON | C19: 6 | D19: 6 | E19: 42 | G19: 13 | H19: 6 | I19: 84 | K19: 16 | L19: 12 | M19: 108 | O19: 20 | P19: 19 | Q19: 139 | S19: MARCY | W19: PRESTON | X19: 1 | Y19: 0 | Z19: 0 | AA19: 139 | AB19: 102 | AC19: =(AA19/AB19)*100 -> 136.27450980392157 | AD19: =(X19*4)+(Z19*2) -> 4
A20: PRAHRAN | C20: 1 | D20: 3 | E20: 9 | G20: 6 | H20: 10 | I20: 46 | K20: 11 | L20: 12 | M20: 78 | O20: 14 | P20: 18 | Q20: 102 | S20: PHILLIPS | W20: CAMBERWELL | X20: 1 | Y20: 0 | Z20: 0 | AA20: 133 | AB20: 118 | AC20: =(AA20/AB20)*100 -> 112.71186440677967 | AD20: =(X20*4)+(Z20*2) -> 4
A21: BEST PLAYERS | W21: WERRIBEE | X21: 0 | Y21: 1 | Z21: 0 | AA21: 118 | AB21: 133 | AC21: =(AA21/AB21)*100 -> 88.721804511278194 | AD21: =(X21*4)+(Z21*2) -> 0
A22: PRESTON | C22: FYFFE | E22: DINTINOSANTE | H22: WARREN | K22: BRINE | N22: ANDERSON | Q22: LUMICISI | W22: PRAHRAN | X22: 0 | Y22: 1 | Z22: 0 | AA22: 102 | AB22: 139 | AC22: =(AA22/AB22)*100 -> 73.381294964028783 | AD22: =(X22*4)+(Z22*2) -> 0
A23: PRAHRAN | C23: TORCASIO | E23: BARNARD | H23: CASHMAN | K23: WALLACE | N23: GILES | W23: SPRINGVALE | X23: 0 | Y23: 1 | Z23: 0 | AA23: 86 | AB23: 121 | AC23: =(AA23/AB23)*100 -> 71.074380165289256 | AD23: =(X23*4)+(Z23*2) -> 0
A24: GOALKICKERS | W24: WILLIAMSTOWN | X24: 0 | Y24: 1 | Z24: 0 | AA24: 98 | AB24: 141 | AC24: =(AA24/AB24)*100 -> 69.503546099290787 | AD24: =(X24*4)+(Z24*2) -> 0
A25: PRESTON | C25: KEENAN 5 | E25: ZERELLA 3 | G25: BRINE 3 | I25: OHLSEN 2 | K25: LUMICISI 2 | M25: SHAW 2 | O25: WIGHT | Q25: FULLER | S25: JORDAN | W25: BOX HILL | X25: 0 | Y25: 1 | Z25: 0 | AA25: 117 | AB25: 172 | AC25: =(AA25/AB25)*100 -> 68.023255813953483 | AD25: =(X25*4)+(Z25*2) -> 0
A26: PRAHRAN | C26: GAULT 3 | E26: McDONALD 3 | H26: GILES 2 | J26: McCORMACK 2 | M26: SOULOS | O26: HANLEY | Q26: WALLACE | S26: DICKSON | W26: FRANKSTON | X26: 0 | Y26: 1 | Z26: 0 | AA26: 105 | AB26: 158 | AC26: =(AA26/AB26)*100 -> 66.455696202531641 | AD26: =(X26*4)+(Z26*2) -> 0
A28: SANDRINGHAM | C28: 4 | D28: 10 | E28: 34 | G28: 12 | H28: 19 | I28: 91 | K28: 18 | L28: 26 | M28: 134 | O28: 21 | P28: 32 | Q28: 158 | S28: VENUE: BEACH ROAD
A29: FRANKSTON | C29: 5 | D29: 3 | E29: 33 | G29: 8 | H29: 3 | I29: 51 | K29: 13 | L29: 7 | M29: 85 | O29: 16 | P29: 9 | Q29: 105 | S29: BREWER :MORGAN
A30: BEST PLAYERS
A31: SANDRINGHAM | C31: HETHERINGTON | F31: PRATT | I31: COLLINS | L31: MACLEOD | O31: BEILBY | Q31: JOHNSON
A32: FRANKSTON | C32: O'BRIEN | F32: BEATON | I32: MOORE | L32: CALLAGHAN
A33: GOALKICKERS
A34: SANDRINGHAM | C34: MORRISON 5 | F34: GORIZIDIS 3 | I34: JOHNSON 3 | K34: MACLEOD 2 | M34: GALLAGHER 2 | P34: COLLINS | R34: BREWER | T34: SMITH | V34: MANNIX | X34: PHILBEY | AA34: EAVES
A35: FRANKSTON | C35: CALLAGHAN 5 | F35: O'BRIEN 5 | H35: RAVEN 2 | J35: KANE 2 | L35: BELL | N35: LONGHAM
A37: COBURG | C37: 7 | D37: 3 | E37: 45 | G37: 13 | H37: 4 | I37: 82 | K37: 17 | L37: 6 | M37: 108 | O37: 27 | P37: 10 | Q37: 172 | S37: VENUE: BOX HILL
A38: BOX HILL | C38: 7 | D38: 2 | E38: 44 | G38: 11 | H38: 8 | I38: 74 | K38: 15 | L38: 12 | M38: 102 | O38: 16 | P38: 21 | Q38: 117 | S38: CASEY :VERGONA
A39: BEST PLAYERS
A40: COBURG | C40: BRIEDIS | F40: MANSFIELD | I40: FISHER | L40: FREEMANTLE | O40: EVANS | R40: NIMMO
A41: BOX HILL | C41: HOWARTH | F41: BROWN | I41: WITHERS | L41: GARTH | O41: SHALLVEY | R41: McGHIE
A42: GOALKICKERS
A43: COBURG | C43: SCARPINO 5 | F43: COLLINS 4 | I43: FISHER 4 | K43: CLEARY 3 | M43: LAIDLER 3 | O43: TARANTO 3 | R43: MANSFIELD | T43: HALBERT | W43: HARBINSON | X43: TULLOCH | AA43: ZANON
A44: BOX HILL | C44: BOLTON 5 | F44: WITHERS 5 | I44: TEAKEL 3 | K44: TRESEDER 2 | N44: HOWARTH
A46: GEELONG WEST | C46: 8 | D46: 7 | E46: 55 | G46: 10 | H46: 13 | I46: 73 | K46: 10 | L46: 16 | M46: 76 | O46: 17 | P46: 19 | Q46: 121 | S46: VENUE: GEELONG WEST
A47: SPRINGVALE | C47: 2 | D47: 2 | E47: 14 | G47: 6 | H47: 2 | I47: 38 | K47: 12 | L47: 4 | M47: 76 | O47: 13 | P47: 8 | Q47: 86 | S47: CASEY :HUTCHINSON
A48: BEST PLAYERS
A49: GEELONG WEST | C49: PERKINS | F49: HEWITT | I49: KRANJC | L49: DALIHAUS | O49: GIBSON | R49: HADDOCK
A50: SPRINGVALE | C50: GRAY | F50: SMITH | I50: MEADE | L50: KING | O50: DEMPSTER
A51: GOALKICKERS
A52: GEELONG WEST | C52: HADDOCK 4 | F52: TUDOR 3 | H52: NICHOLSON 2 | K52: GIBSON 2 | M52: ALFORD 2 | O52: HEWITT 2 | Q52: WELSH | S52: PERKINS
A53: SPRINGVALE | C53: STEEL 3 | E53: SMITH 2 | G53: HOLDEN 2 | I53: ANDERSON 2 | L53: HERBERT | N53: CARROLL | P53: WILLIAMS | R53: CLARKE
A55: CAMBERWELL | C55: 6 | D55: 1 | E55: 37 | G55: 11 | H55: 4 | I55: 70 | K55: 14 | L55: 5 | M55: 89 | O55: 21 | P55: 7 | Q55: 133 | S55: VENUE: CAMBERWELL
A56: WERRIBEE | C56: 4 | D56: 5 | E56: 29 | G56: 8 | H56: 11 | I56: 59 | K56: 15 | L56: 13 | M56: 103 | O56: 17 | P56: 16 | Q56: 118 | S56: GLEESON :WALKER
A57: BEST PLAYERS
A58: CAMBERWELL | C58: WEATHERALD | F58: ROURKE | I58: WILKINSON | L58: SIDE | O58: McKENZIE | R58: JUDD
A59: WERRIBEE | C59: RICHARDSON | F59: ROGERS | I59: MOLONEY | L59: FREEMAN | O59: WALPOLE | R59: HOPKINS
A60: GOALKICKERS
A61: CAMBERWELL | C61: WEATHERALD 8 | F61: STEVENSON 3 | I61: BUDGE 3 | K61: ROURKE 3 | M61: SIDE | N61: BURMEISTER | Q61: DAVIDSON | S61: TURNER
A62: WERRIBEE | C62: RICHARDSON 8 | F62: WALPOLE 2 | I62: BURNETT 2 | L62: REDENBACH | O62: CORDY | Q62: CHRISTIANSEN | T62: GOSS | V62: FREEMAN
A64: ROUND 2 | D64: 21ST APRIL | I64: WEATHER | S64: VENUE: WERRIBEE
D65: 1ST QTR | H65: 2ND QTR | L65: 3RD QTR | P65: FINAL | S65: UMPIRES
A66: WERRIBEE | C66: 8 | D66: 6 | E66: 54 | G66: 15 | H66: 9 | I66: 99 | K66: 18 | L66: 13 | M66: 121 | O66: 26 | P66: 17 | Q66: 173 | S66: CASEY | X66: LADDER | AB66: ROUND | AD66: 2
A67: BOX HILL | C67: 6 | D67: 2 | E67: 38 | G67: 5 | H67: 9 | I67: 39 | K67: 13 | L67: 12 | M67: 90 | O67: 15 | P67: 13 | Q67: 103 | S67: MORGAN
A68: BEST PLAYERS | W68: TEAM | X68: W | Y68: L | Z68: D | AA68: FOR | AB68: AGST | AC68: % | AD68: PTS
A69: WERRIBEE | C69: REDENBACH | F69: ROGERS | I69: GUINTA | L69: FEDKE | N69: RICHARDSON | Q69: BURNETT
A70: BOX HILL | C70: BROWN | F70: TEAKEL | I70: HOOGSTRA | L70: GARTH | N70: O'SHEA | Q70: WALES | W70: COBURG | X70: 2 | Y70: 0 | Z70: 0 | AA70: 340 | AB70: 221 | AC70: =(AA70/AB70)*100 -> 153.84615384615387 | AD70: =(X70*4)+(Z70*2) -> 8
A71: GOALKICKERS | I71: ROGERS | K71: BONAT | M71: DOYLE | O71: REDENBACH | R71: D FREEMAN | W71: SANDRINGHAM | X71: 2 | Y71: 0 | Z71: 0 | AA71: 307 | AB71: 211 | AC71: =(AA71/AB71)*100 -> 145.49763033175356 | AD71: =(X71*4)+(Z71*2) -> 8
A72: WERRIBEE | C72: RICHARDSON 7 | F72: BURNETT 4 | I72: CORDY 3 | K72: GORDON 2 | M72: WALPOLE 2 | P72: CHRISTIANSEN 2 | S72: PERKINS | W72: PRESTON | X72: 2 | Y72: 0 | Z72: 0 | AA72: 281 | AB72: 218 | AC72: =(AA72/AB72)*100 -> 128.89908256880733 | AD72: =(X72*4)+(Z72*2) -> 8
A73: BOX HILL | C73: CARROLL 5 | F73: GARTH 2 | H73: CHARLES 2 | J73: SHALLVEY 2 | M73: HOOGSTRA | P73: HOWARTH | R73: BROWN | T73: O'SHEA | W73: FRANKSTON | X73: 1 | Y73: 1 | Z73: 0 | AA73: 331 | AB73: 255 | AC73: =(AA73/AB73)*100 -> 129.80392156862746 | AD73: =(X73*4)+(Z73*2) -> 4
S74: VENUE: PORT MELBOURNE
A75: PRESTON | C75: 5 | D75: 3 | E75: 33 | G75: 11 | H75: 5 | I75: 71 | K75: 17 | L75: 9 | M75: 111 | O75: 22 | P75: 10 | Q75: 142 | S75: CASEY | W75: WERRIBEE | X75: 1 | Y75: 1 | Z75: 0 | AA75: 291 | AB75: 236 | AC75: =(AA75/AB75)*100 -> 123.30508474576271 | AD75: =(X75*4)+(Z75*2) -> 4
A76: PORT MELBOURNE | C76: 4 | D76: 4 | E76: 28 | G76: 9 | H76: 8 | I76: 62 | K76: 12 | L76: 11 | M76: 83 | O76: 17 | P76: 14 | Q76: 116 | S76: MORGAN | W76: PORT MELBOURNE | X76: 1 | Y76: 1 | Z76: 0 | AA76: 257 | AB76: 240 | AC76: =(AA76/AB76)*100 -> 107.08333333333333 | AD76: =(X76*4)+(Z76*2) -> 4
A77: BEST PLAYERS | W77: SPRINGVALE | X77: 1 | Y77: 1 | Z77: 0 | AA77: 198 | AB77: 220 | AC77: =(AA77/AB77)*100 -> 90 | AD77: =(X77*4)+(Z77*2) -> 4
A78: PRESTON | C78: WATT | F78: FYFFE | I78: SHAW | L78: ZERELLA | O78: ANDERSON | R78: BRINE | W78: GEELONG WEST | X78: 1 | Y78: 1 | Z78: 0 | AA78: 225 | AB78: 254 | AC78: =(AA78/AB78)*100 -> 88.582677165354326 | AD78: =(X78*4)+(Z78*2) -> 4
A79: PORT MELBOURNE | C79: CARTER | F79: O'RILEY | I79: FEHRING | L79: JOYCEY | O79: DERMOTT | W79: CAMBERWELL | X79: 1 | Y79: 1 | Z79: 0 | AA79: 230 | AB79: 344 | AC79: =(AA79/AB79)*100 -> 66.860465116279073 | AD79: =(X79*4)+(Z79*2) -> 4
A80: GOALKICKERS | W80: WILLIAMSTOWN | X80: 0 | Y80: 2 | Z80: 0 | AA80: 197 | AB80: 253 | AC80: =(AA80/AB80)*100 -> 77.865612648221344 | AD80: =(X80*4)+(Z80*2) -> 0
A81: PRESTON | C81: SHAW 9 | E81: ZERELLA 5 | G81: MARCON 2 | I81: OHLSEN | K81: HACKNEY | M81: WATT | O81: FULLER | Q81: LUMICISI | S81: WATT | W81: PRAHRAN | X81: 0 | Y81: 2 | Z81: 0 | AA81: 208 | AB81: 288 | AC81: =(AA81/AB81)*100 -> 72.222222222222214 | AD81: =(X81*4)+(Z81*2) -> 0
A82: PORT MELBOURNE | C82: O'RILEY 6 | F82: JOHNSON 3 | I82: BRIEDIS 2 | K82: CARTER 2 | M82: CHADBAND 2 | P82: CARLILE | R82: YEOMAN | W82: BOX HILL | X82: 0 | Y82: 2 | Z82: 0 | AA82: 220 | AB82: 345 | AC82: =(AA82/AB82)*100 -> 63.768115942028977 | AD82: =(X82*4)+(Z82*2) -> 0
A84: SANDRINGHAM | C84: 4 | D84: 3 | E84: 27 | G84: 9 | H84: 7 | I84: 61 | K84: 14 | L84: 12 | M84: 96 | O84: 22 | P84: 17 | Q84: 149 | S84: VENUE: TOORAK PARK
A85: PRAHRAN | C85: 4 | D85: 2 | E85: 26 | G85: 8 | H85: 6 | I85: 54 | K85: 14 | L85: 9 | M85: 93 | O85: 16 | P85: 10 | Q85: 106 | S85: GLEESON :MARSHALL
A86: BEST PLAYERS
A87: SANDRINGHAM | C87: GORIZIDIS | F87: COLLINS | I87: PHILBEY | L87: GALLAGHER | O87: MORRISON | R87: HETHERINGTON
A88: PRAHRAN | C88: PETERSON | F88: ELLETT | I88: WALDER | L88: DICKSON
A89: GOALKICKERS
A90: SANDRINGHAM | C90: MORRISON 7 | F90: BREWER 5 | I90: GALLAGHER 3 | L90: EAVES 2 | N90: PHILBEY | P90: JOHNSON | R90: SMITH | T90: COLLINS | V90: DIPIERDOMENICO
A91: PRAHRAN | C91: DICKSON 5 | F91: McDONALD 2 | I91: WALDER 2 | K91: SOULOS 2 | M91: HANLEY | O91: TAYLOR | Q91: McCORMACK | T91: STRACHAN | W91: WALES
A93: SPRINGVALE | C93: 6 | D93: 1 | E93: 37 | G93: 10 | H93: 7 | I93: 67 | K93: 14 | L93: 13 | M93: 97 | O93: 16 | P93: 16 | Q93: 112 | S93: VENUE: SPRINGVALE
A94: WILLIAMSTOWN | C94: 3 | D94: 7 | E94: 25 | G94: 5 | H94: 13 | I94: 43 | K94: 8 | L94: 17 | M94: 65 | O94: 13 | P94: 21 | Q94: 99 | S94: OAKLEY :PHILLIPS
A95: BEST PLAYERS
A96: SPRINGVALE | C96: CLARKE | F96: HOWELL | I96: MEADE | L96: KEAYS | O96: GRAY | R96: HOLDEN
A97: WILLIAMSTOWN | C97: WEIR | F97: SAIT | I97: WHEELER | L97: SLEVISON | O97: DAVIDSON
A98: GOALKICKERS
A99: SPRINGVALE | C99: CARROLL 3 | F99: SMITH 3 | H99: HERBERT 2 | J99: DEMPSTER 2 | M99: WALTER 2 | O99: ANDERSON | Q99: KEAYS | S99: MAGRO | U99: GRAY
A100: WILLIAMSTOWN | C100: FOTHERINGHAM 8 | G100: BRATBY 2 | I100: GOETZ 2 | K100: SAIT | M100: RICKMAN | O100: MURPHY
A102: FRANKSTON | C102: 11 | D102: 2 | E102: 68 | G102: 19 | H102: 3 | I102: 117 | K102: 31 | L102: 8 | M102: 194 | O102: 36 | P102: 10 | Q102: 226 | S102: VENUE: FRANKSTON
A103: CAMBERWELL | C103: 1 | D103: 2 | E103: 8 | G103: 5 | H103: 4 | I103: 34 | K103: 9 | L103: 5 | M103: 59 | O103: 15 | P103: 7 | Q103: 97 | S103: VERGONA :BLACK
A104: BEST PLAYERS
A105: FRANKSTON | C105: RAVEN | F105: BOYD | I105: GEDDES
A106: CAMBERWELL | C106: DE KONNING | F106: BUDGE | I106: WEATHERALD | L106: SIDE | O106: BURMEISTER
A107: GOALKICKERS
A108: FRANKSTON | C108: RAVEN 9 | E108: BOYD 6 | G108: BARDOEL 4 | I108: ROGERSON 4 | L108: GEDDES 3 | N108: COUSINS 3 | Q108: MOORE 2 | S108: BEATON 2 | V108: T O'BRIEN | X108: LOCKWOOD | AB108: THOMAS
A109: CAMBERWELL | C109: STEVENSON 5 | F109: WEATHERALD 3 | J109: SIDE 3 | L109: SCOTT 3 | N109: HICKLETON
A111: COBURG | C111: 10 | D111: 1 | E111: 61 | G111: 17 | H111: 4 | I111: 106 | K111: 20 | L111: 7 | M111: 127 | O111: 26 | P111: 12 | Q111: 168 | S111: VENUE: COBURG
A112: GEELONG WEST | C112: 6 | D112: 2 | E112: 38 | G112: 8 | H112: 3 | I112: 51 | K112: 12 | L112: 4 | M112: 76 | O112: 16 | P112: 8 | Q112: 104 | S112: BREWER :MARCY
A113: BEST PLAYERS
A114: COBURG | C114: FISHER | F114: DOHNT | I114: BRIEDIS | L114: COLLINS | O114: NIMMO | R114: TARANTO
A115: GEELONG WEST | C115: W PERKINS | F115: BERRY | I115: WELSH | L115: EVANS | O115: McFARLANE | R115: HAMMOND
A116: GOALKICKERS
A117: COBURG | C117: LAIDLER 9 | F117: FISHER 6 | H117: TULLOCH 3 | J117: HALBERT 2 | M117: SCARPINO 2 | P117: DOHNT | R117: GIBB | T117: CLEARY | V117: M ZANON
A118: GEELONG WEST | C118: BERRY 3 | F118: TUDOR 3 | H118: DOYLE 3 | J118: TOULMIN 2 | L118: SODOMACO | O118: GIBSON | Q118: ALFORD | S118: McFARLANE | V118: HEWITT
A120: ROUND 3 | D120: 28TH APRIL | I120: WEATHER | S120: VENUE: BOX HILL
D121: 1ST QTR | H121: 2ND QTR | L121: 3RD QTR | P121: FINAL | S121: UMPIRES
A122: CAMBERWELL | C122: 5 | D122: 7 | E122: 37 | G122: 10 | H122: 9 | I122: 69 | K122: 21 | L122: 20 | M122: 146 | O122: 27 | P122: 25 | Q122: 187 | S122: MARSHALL | X122: LADDER | AB122: ROUND | AD122: 3
A123: BOX HILL | C123: 5 | D123: 3 | E123: 33 | G123: 12 | H123: 7 | I123: 79 | K123: 14 | L123: 9 | M123: 93 | O123: 18 | P123: 14 | Q123: 122 | S123: PHILLIPS
A124: BEST PLAYERS | W124: TEAM | X124: W | Y124: L | Z124: D | AA124: FOR | AB124: AGST | AC124: % | AD124: PTS
A125: CAMBERWELL | C125: WEATHERALD | F125: WILKINSON | I125: HIPWORTH | L125: BUDGE | O125: S ROURKE | R125: JUDD
A126: BOX HILL | C126: BROWN | F126: REEVES | I126: TEAKEL | L126: O'SHEA | O126: CARROLL | R126: WALES | W126: SANDRINGHAM | X126: 3 | Y126: 0 | Z126: 0 | AA126: 469 | AB126: 313 | AC126: =(AA126/AB126)*100 -> 149.84025559105433 | AD126: =(X126*4)+(Z126*2) -> 12
A127: GOALKICKERS | W127: COBURG | X127: 3 | Y127: 0 | Z127: 0 | AA127: 482 | AB127: 323 | AC127: =(AA127/AB127)*100 -> 149.22600619195046 | AD127: =(X127*4)+(Z127*2) -> 12
A128: CAMBERWELL | C128: WEATHERALD 10 | F128: STEVENSON 4 | I128: HIPWORTH 3 | L128: SCHADE 3 | N128: BUDGE 3 | P128: JUDD | Q128: S ROURKE | S128: SIDE | T128: CONLON | W128: PRESTON | X128: 3 | Y128: 0 | Z128: 0 | AA128: 435 | AB128: 310 | AC128: =(AA128/AB128)*100 -> 140.32258064516131 | AD128: =(X128*4)+(Z128*2) -> 12
A129: BOX HILL | C129: CARROLL 7 | F129: BROWN 3 | H129: GARTH 3 | J129: HEDGER 2 | L129: WITHERS | N129: BOLTON | P129: RAYMENT | W129: FRANKSTON | X129: 2 | Y129: 1 | Z129: 0 | AA129: 525 | AB129: 377 | AC129: =(AA129/AB129)*100 -> 139.25729442970822 | AD129: =(X129*4)+(Z129*2) -> 8
S130: VENUE: GEELONG WEST
A131: GEELONG WEST | C131: 3 | D131: 7 | E131: 25 | G131: 8 | H131: 11 | I131: 59 | K131: 15 | L131: 17 | M131: 107 | O131: 20 | P131: 24 | Q131: 144 | S131: OAKLEY | W131: GEELONG WEST | X131: 2 | Y131: 1 | Z131: 0 | AA131: 369 | AB131: 325 | AC131: =(AA131/AB131)*100 -> 113.53846153846155 | AD131: =(X131*4)+(Z131*2) -> 8
A132: WERIBEE | C132: 2 | D132: 2 | E132: 14 | G132: 3 | H132: 4 | I132: 22 | K132: 8 | L132: 5 | M132: 53 | O132: 10 | P132: 11 | Q132: 71 | S132: BLACK | W132: CAMBERWELL | X132: 2 | Y132: 1 | Z132: 0 | AA132: 417 | AB132: 466 | AC132: =(AA132/AB132)*100 -> 89.484978540772531 | AD132: =(X132*4)+(Z132*2) -> 8
A133: BEST PLAYERS | W133: WERRIBEE | X133: 1 | Y133: 2 | Z133: 0 | AA133: 362 | AB133: 380 | AC133: =(AA133/AB133)*100 -> 95.263157894736835 | AD133: =(X133*4)+(Z133*2) -> 4
A134: GEELONG WEST | C134: PERKINS | F134: WELSH | I134: HEWITT | L134: O'DWYER | O134: DOYLE | R134: HAMMOND | W134: PORT MELBOURNE | X134: 1 | Y134: 2 | Z134: 0 | AA134: 359 | AB134: 402 | AC134: =(AA134/AB134)*100 -> 89.303482587064678 | AD134: =(X134*4)+(Z134*2) -> 4
A135: WERIBEE | C135: MOLONEY | F135: McCANCE | I135: WALPOLE | L135: CHRISTIANSEN | O135: FEDKE | R135: BURNETT | W135: SPRINGVALE | X135: 1 | Y135: 2 | Z135: 0 | AA135: 290 | AB135: 374 | AC135: =(AA135/AB135)*100 -> 77.54010695187165 | AD135: =(X135*4)+(Z135*2) -> 4
A136: GOALKICKERS | P136: TUDOR | W136: WILLIAMSTOWN | X136: 0 | Y136: 3 | Z136: 0 | AA136: 299 | AB136: 395 | AC136: =(AA136/AB136)*100 -> 75.696202531645568 | AD136: =(X136*4)+(Z136*2) -> 0
A137: GEELONG WEST | C137: DOYLE 5 | E137: HADDOCK 4 | H137: CONNOLY 3 | K137: WELSH 2 | M137: BERRY 2 | O137: PERKINS | Q137: BEWS | S137: HEWITT | W137: PRAHRAN | X137: 0 | Y137: 3 | Z137: 0 | AA137: 330 | AB137: 482 | AC137: =(AA137/AB137)*100 -> 68.46473029045643 | AD137: =(X137*4)+(Z137*2) -> 0
A138: WERIBEE | C138: WALPOLE 3 | F138: CHRISTIANSEN 2 | J138: BURNETT 2 | M138: CORDY | O138: GORDON | Q138: PERKINS | W138: BOX HILL | X138: 0 | Y138: 3 | Z138: 0 | AA138: 342 | AB138: 532 | AC138: =(AA138/AB138)*100 -> 64.285714285714292 | AD138: =(X138*4)+(Z138*2) -> 0
A140: PRESTON | C140: 8 | D140: 5 | E140: 53 | G140: 11 | H140: 10 | I140: 76 | K140: 19 | L140: 11 | M140: 125 | O140: 23 | P140: 16 | Q140: 154 | S140: VENUE: PRESTON
A141: SPRINGVALE | C141: 0 | D141: 3 | E141: 3 | G141: 2 | H141: 7 | I141: 19 | K141: 4 | L141: 8 | M141: 32 | O141: 13 | P141: 14 | Q141: 92 | S141: BREWER :GLEESON
A142: BEST PLAYERS
A143: PRESTON | C143: MARCON | F143: ZERELLA | I143: BRINE | L143: WIGHT | O143: FYFFE | R143: ANDERSON
A144: SPRINGVALE | C144: MALONI | F144: CLARKE | I144: GRAY | L144: MEADE | O144: HOLDEN
A145: GOALKICKERS
A146: PRESTON | C146: SHAW 5 | E146: MARCON 5 | G146: ZERELLA 4 | J146: OHLSEN 2 | L146: WARREN | N146: WIGHT | P146: BRINE | R146: JORDAN | T146: BEER | V146: LUMICISI | X146: WATT
A147: SPRINGVALE | C147: SMITH 3 | E147: CLARKE 2 | G147: ANDERSON 2 | J147: DEMPSTER 2 | M147: MALONI 2 | O147: KEAYS | Q147: HOLDEN
A149: COBURG | C149: 3 | D149: 5 | E149: 23 | G149: 10 | H149: 11 | I149: 71 | K149: 16 | L149: 14 | M149: 110 | O149: 21 | P149: 16 | Q149: 142 | S149: VENUE: WILLIAMSTOWN
A150: WILLIAMSTOWN | C150: 3 | D150: 3 | E150: 21 | G150: 6 | H150: 4 | I150: 40 | K150: 8 | L150: 9 | M150: 57 | O150: 15 | P150: 12 | Q150: 102 | S150: MORGAN :WALKER
A151: BEST PLAYERS
A152: COBURG | C152: EVANS | F152: HALBERT | I152: M ZANON | L152: A HARBINSON | O152: FREEMANTLE | R152: TARRANT
A153: WILLIAMSTOWN | C153: DULLARD | F153: SAIT | I153: MURPHY | L153: SMITH | O153: HORTON
A154: GOALKICKERS
A155: COBURG | C155: CLEARY 5 | E155: COLLINS 4 | G155: HALBERT 3 | I155: DOHNT 2 | K155: FISHER | M155: FREEMANTLE | P155: GIBB | Q155: TARANTO | S155: HARBINSON | V155: TULLOCH | X155: SCARPINO
A156: WILLIAMSTOWN | C156: RICKMAN 5 | F156: SMITH 3 | H156: SAIT 3 | J156: SIMMONS 2 | M156: SEMMONS 2
A158: SANDRINGHAM | C158: 4 | D158: 5 | E158: 29 | G158: 11 | H158: 7 | I158: 73 | K158: 17 | L158: 19 | M158: 121 | O158: 23 | P158: 24 | Q158: 162 | S158: VENUE: BEACH ROAD
A159: PORT MELBOURNE | C159: 4 | D159: 4 | E159: 28 | G159: 9 | H159: 7 | I159: 61 | K159: 13 | L159: 8 | M159: 86 | O159: 15 | P159: 12 | Q159: 102 | S159: MARCY ;HUTCHINSON
A160: BEST PLAYERS
A161: SANDRINGHAM | C161: MERCER | F161: GORIZIDIS | I161: HETHERINGTON | L161: DIPIERDOMENICO | O161: COLLINS | R161: MORRISON
A162: PORT MELBOURNE | C162: FEHRING | F162: COOPER | I162: ROSS | L162: RODDA | O162: PROTETTO
A163: GOALKICKERS
A164: SANDRINGHAM | C164: MORRISON 7 | F164: MACLEOD 6 | I164: JOHNSON 2 | L164: DIPIERDOMENICO 2 | P164: GORIZIDIS | R164: BINGHAM | T164: COLLINS | V164: BREWER | X164: MANNIX | AA164: FITZPATRICK
A165: PORT MELBOURNE | C165: FITZPATRICK 5 | F165: RODDA 3 | H165: HOY 3 | J165: BRIEDIS 2 | L165: HUNTINGTON 2 | O165: JOHNSON | Q165: CHADBAND | S165: YEOMAN
A167: FRANKSTON | C167: 7 | D167: 7 | E167: 49 | G167: 13 | H167: 12 | I167: 90 | K167: 23 | L167: 17 | M167: 155 | O167: 29 | P167: 20 | Q167: 194 | S167: VENUE: TOORAK PARK
A168: PRAHRAN | C168: 5 | D168: 3 | E168: 33 | G168: 9 | H168: 7 | I168: 61 | K168: 13 | L168: 10 | M168: 88 | O168: 18 | P168: 14 | Q168: 122 | S168: G CASEY :FITZPATRICK
A169: BEST PLAYERS
A170: FRANKSTON | C170: WALSH | F170: O'BRIEN | I170: CALLAGHAN | L170: RAVEN | O170: BELL | R170: TROTT
A171: PRAHRAN | C171: ELLETT | F171: WALDER | I171: TAYLOR | L171: DICKSON | O171: CHRISTIE
A172: GOALKICKERS
A173: FRANKSTON | C173: CALLAGHAN 7 | F173: ROGERSON 4 | I173: RAVEN 4 | K173: O'BRIEN 3 | M173: COLE 3 | O173: TROTT 3 | Q173: LANE | R173: GEDDES | T173: COUSINS | V173: BELL | X173: THOMAS
A174: PRAHRAN | C174: DICKSON 5 | F174: GAULT 3 | H174: T McDONALD 2 | K174: WALDER 2 | N174: TORCASIO 2 | Q174: ELLETT | S174: WALES | U174: HANLEY | X174: CHRISTIE
A176: ROUND 4 | D176: 5TH MAY | I176: WEATHER | S176: VENUE: WERRIBEE
D177: 1ST QTR | H177: 2ND QTR | L177: 3RD QTR | P177: FINAL | S177: UMPIRES
A178: PRESTON | C178: 5 | D178: 6 | E178: 36 | G178: 9 | H178: 12 | I178: 66 | K178: 15 | L178: 14 | M178: 104 | O178: 25 | P178: 22 | Q178: 172 | S178: OAKLEY | X178: LADDER | AB178: ROUND | AD178: 4
A179: COBURG | C179: 6 | D179: 6 | E179: 42 | G179: 9 | H179: 7 | I179: 61 | K179: 9 | L179: 11 | M179: 65 | O179: 12 | P179: 15 | Q179: 87 | S179: FITZPATRICK
A180: BEST PLAYERS | W180: TEAM | X180: W | Y180: L | Z180: D | AA180: FOR | AB180: AGST | AC180: % | AD180: PTS
A181: PRESTON | C181: WATT | F181: JORDAN | I181: MARCON | L181: FYFFE | O181: BRINE | R181: BEER
A182: COBURG | C182: BRIEDIS | F182: TULLOCH | I182: CLEARY | L182: HALBERT | W182: PRESTON | X182: 4 | Y182: 0 | Z182: 0 | AA182: 607 | AB182: 397 | AC182: =(AA182/AB182)*100 -> 152.89672544080602 | AD182: =(X182*4)+(Z182*2) -> 16
A183: GOALKICKERS | W183: SANDRINGHAM | X183: 4 | Y183: 0 | Z183: 0 | AA183: 606 | AB183: 412 | AC183: =(AA183/AB183)*100 -> 147.08737864077671 | AD183: =(X183*4)+(Z183*2) -> 16
A184: PRESTON | C184: SHAW 7 | E184: SALVADOR 6 | H184: BEER 4 | J184: DUNBAR 3 | M184: OHLSEN | O184: MARCON | Q184: BRINE | R184: LUMICISI | T184: WATT | W184: FRANKSTON | X184: 3 | Y184: 1 | Z184: 0 | AA184: 750 | AB184: 500 | AC184: =(AA184/AB184)*100 -> 150 | AD184: =(X184*4)+(Z184*2) -> 12
A185: COBURG | C185: LAIDLER 5 | E185: FISHER 2 | G185: HALBERT | I185: GIBB | K185: CLEARY | M185: TULLOCH | O185: BEATTIE | W185: COBURG | X185: 3 | Y185: 1 | Z185: 0 | AA185: 569 | AB185: 495 | AC185: =(AA185/AB185)*100 -> 114.94949494949496 | AD185: =(X185*4)+(Z185*2) -> 12
S186: VENUE: PORT MELBOURNE
A187: PORT MELBOURNE | C187: 4 | D187: 10 | E187: 34 | G187: 10 | H187: 12 | I187: 72 | K187: 24 | L187: 14 | M187: 158 | O187: 32 | P187: 20 | Q187: 212 | S187: VERGONA | W187: GEELONG WEST | X187: 3 | Y187: 1 | Z187: 0 | AA187: 487 | AB187: 426 | AC187: =(AA187/AB187)*100 -> 114.31924882629107 | AD187: =(X187*4)+(Z187*2) -> 12
A188: PRAHRAN | C188: 3 | D188: 2 | E188: 20 | G188: 8 | H188: 5 | I188: 53 | K188: 9 | L188: 11 | M188: 65 | O188: 11 | P188: 15 | Q188: 81 | S188: BREWER | W188: PORT MELBOURNE | X188: 2 | Y188: 2 | Z188: 0 | AA188: 571 | AB188: 483 | AC188: =(AA188/AB188)*100 -> 118.21946169772258 | AD188: =(X188*4)+(Z188*2) -> 8
A189: BEST PLAYERS | W189: CAMBERWELL | X189: 2 | Y189: 2 | Z189: 0 | AA189: 518 | AB189: 584 | AC189: =(AA189/AB189)*100 -> 88.698630136986296 | AD189: =(X189*4)+(Z189*2) -> 8
A190: PORT MELBOURNE | C190: JOHNSON | F190: COOPER | I190: HOY | L190: O'RILEY | O190: FEHRING | R190: RODDA | W190: WILLIAMSTOWN | X190: 1 | Y190: 3 | Z190: 0 | AA190: 473 | AB190: 496 | AC190: =(AA190/AB190)*100 -> 95.362903225806448 | AD190: =(X190*4)+(Z190*2) -> 4
A191: PRAHRAN | C191: GRAMBEAU | F191: McDONALD | I191: WALDER | W191: WERRIBEE | X191: 1 | Y191: 3 | Z191: 0 | AA191: 463 | AB191: 554 | AC191: =(AA191/AB191)*100 -> 83.5740072202166 | AD191: =(X191*4)+(Z191*2) -> 4
A192: GOALKICKERS | W192: SPRINGVALE | X192: 1 | Y192: 3 | Z192: 0 | AA192: 389 | AB192: 511 | AC192: =(AA192/AB192)*100 -> 76.1252446183953 | AD192: =(X192*4)+(Z192*2) -> 4
A193: PORT MELBOURNE | C193: O'RILEY 7 | F193: JOHNSON 7 | I193: FITZPATRICK 6 | L193: BRIEDIS 6 | N193: RODDA 3 | P193: SWAN | R193: HOY | S193: PETRAGLIA | W193: BOX HILL | X193: 0 | Y193: 4 | Z193: 0 | AA193: 465 | AB193: 757 | AC193: =(AA193/AB193)*100 -> 61.426684280052847 | AD193: =(X193*4)+(Z193*2) -> 0
A194: PRAHRAN | C194: GAULT 3 | F194: ROSS 2 | H194: McCORMACK 2 | K194: PULVERENTI 2 | N194: GRAMBEAU | Q194: TAYLOR | W194: PRAHRAN | X194: 0 | Y194: 4 | Z194: 0 | AA194: 411 | AB194: 694 | AC194: =(AA194/AB194)*100 -> 59.221902017291065 | AD194: =(X194*4)+(Z194*2) -> 0
A196: FRANKSTON | C196: 12 | D196: 1 | E196: 73 | G196: 21 | H196: 2 | I196: 128 | K196: 29 | L196: 7 | M196: 181 | O196: 36 | P196: 9 | Q196: 225 | S196: VENUE: FRANKSTON
A197: BOX HILL | C197: 3 | D197: 4 | E197: 22 | G197: 7 | H197: 8 | I197: 50 | K197: 9 | L197: 12 | M197: 66 | O197: 17 | P197: 21 | Q197: 123 | S197: HUTCHINSON ;MORGAN
A198: BEST PLAYERS
A199: FRANKSTON | C199: R KANE | F199: ROGERSON | I199: MOORE | L199: HORLER | O199: BEATON | R199: CALLAGHAN
A200: BOX HILL | C200: BROWN | F200: HEDGER | I200: TEAKEL | L200: BOLTON
A201: GOALKICKERS
A202: FRANKSTON | C202: R KANE 7 | E202: CALLAGHAN 5 | H202: ROGERSON 4 | K202: BOYD 4 | M202: RAVEN 3 | O202: BARDOEL 3 | Q202: O'BRIEN 3 | S202: MOORE 3 | U202: COUSINS 2 | X202: GEDDES | AA202: BELL
A203: BOX HILL | C203: NICHOLSON 5 | F203: HEDGER 4 | I203: BOLTON 2 | K203: HOWARTH 2 | N203: CARROLL 2 | P203: WITHERS | R203: CASEY
D204: 12TH MAY
A205: GEELONG WEST | C205: 3 | D205: 7 | E205: 25 | G205: 7 | H205: 9 | I205: 51 | K205: 12 | L205: 12 | M205: 84 | O205: 17 | P205: 16 | Q205: 118 | S205: VENUE: CAMBERWELL
A206: CAMBERWELL | C206: 3 | D206: 2 | E206: 20 | G206: 5 | H206: 3 | I206: 33 | K206: 9 | L206: 6 | M206: 60 | O206: 15 | P206: 11 | Q206: 101 | S206: MARCY ;CASEY
A207: BEST PLAYERS
A208: GEELONG WEST | C208: DALIHAUS | F208: GIBSON | I208: KRANJC | L208: WELSH | O208: EVANS | R208: BEWS
A209: CAMBERWELL | C209: WILKINSON | F209: C ROURKE | I209: HOWARTH | L209: BANKS | O209: BURMEISTER | R209: JUDD
A210: GOALKICKERS
A211: GEELONG WEST | C211: DOYLE 6 | F211: TOULMIN 3 | I211: BEWS 2 | K211: HADDOCK 2 | N211: GIBSON | P211: WELSH | R211: REDHEAD | T211: BERRY
A212: CAMBERWELL | C212: STEVENSON 6 | F212: WEATHERALD 5 | I212: BURMEISTER 2 | L212: HIPWORTH | N212: TURNER
A214: SANDRINGHAM | C214: 8 | D214: 2 | E214: 50 | G214: 11 | H214: 4 | I214: 70 | K214: 16 | L214: 11 | M214: 107 | O214: 21 | P214: 11 | Q214: 137 | S214: VENUE: SPRINGVALE
A215: SPRINGVALE | C215: 2 | D215: 4 | E215: 16 | G215: 4 | H215: 10 | I215: 34 | K215: 8 | L215: 12 | M215: 60 | O215: 14 | P215: 15 | Q215: 99 | S215: BLACK ;PHILLIPS
A216: BEST PLAYERS
A217: SANDRINGHAM | C217: BEILBY | F217: EAVES | I217: FITZPATRICK | L217: MACLEOD | O217: LYONS | R217: ADAMS
A218: SPRINGVALE | C218: GRAY | F218: SMITH | I218: HOLDEN | L218: MALONI | O218: CLARKE | R218: KEYS
A219: GOALKICKERS
A220: SANDRINGHAM | C220: GORIZIDIS 4 | F220: MACLEOD 4 | I220: MORRISON 3 | L220: GALLAGHER 3 | O220: BINGHAM 2 | Q220: MANNIX 2 | S220: LYONS | U220: DIPIERDOMENICO | X220: ADAMS
A221: SPRINGVALE | C221: WALTER 3 | F221: CARROLL 3 | I221: MALONI 2 | K221: SMITH 2 | M221: DEMPSTER | O221: STIRLING | Q221: HOWELL | S221: GULET
A223: WILLIAMSTOWN | C223: 7 | D223: 2 | E223: 44 | G223: 14 | H223: 7 | I223: 91 | K223: 20 | L223: 11 | M223: 131 | O223: 27 | P223: 12 | Q223: 174 | S223: UMPIRES
A224: WERRIBEE | C224: 7 | D224: 0 | E224: 42 | G224: 8 | H224: 3 | I224: 51 | K224: 13 | L224: 5 | M224: 83 | O224: 16 | P224: 5 | Q224: 101 | S224: VERGONA :MARSHALL
A225: BEST PLAYERS
A226: WILLIAMSTOWN | C226: RICKMAN | F226: ROSS | I226: HOLDER | L226: CAHILL | O226: SWANN | R226: MURPHY
A227: WERRIBEE | C227: FEDKE | F227: REDENBACH | I227: WALPOLE | L227: B MOLONEY | O227: PERKINS
A228: GOALKICKERS
A229: WILLIAMSTOWN | C229: RICKMAN 13 | F229: HOLDER 5 | H229: CAHILL 4 | J229: BRIERTY 2 | M229: DULLARD | O229: SAIT | P229: SLEVISON
A230: WERRIBEE | C230: GOSS 4 | E230: B MOLONEY 3 | H230: BONAT 2 | J230: WALPOLE 2 | M230: BURNETT | O230: BUCKINGHAM | R230: CORDY | T230: R MOLONEY | W230: RICHARDSON
A232: ROUND 5 | D232: 19TH MAY | I232: WEATHER | S232: VENUE: WILLIAMSTOWN
D233: 1ST QTR | H233: 2ND QTR | L233: 3RD QTR | P233: FINAL | S233: UMPIRES
A234: WILLIAMSTOWN | C234: 4 | D234: 5 | E234: 29 | G234: 12 | H234: 8 | I234: 80 | K234: 19 | L234: 13 | M234: 127 | O234: 26 | P234: 19 | Q234: 175 | S234: STEERE | X234: LADDER | AB234: ROUND | AD234: 5
A235: CAMBERWELL | C235: 2 | D235: 3 | E235: 15 | G235: 2 | H235: 9 | I235: 21 | K235: 4 | L235: 10 | M235: 34 | O235: 9 | P235: 15 | Q235: 69 | S235: BLACK
A236: BEST PLAYERS | W236: TEAM | X236: W | Y236: L | Z236: D | AA236: FOR | AB236: AGST | AC236: % | AD236: PTS
A237: WILLIAMSTOWN | C237: KERSHAW | F237: SAIT | I237: SLEVISON | L237: DIMARTINO | O237: DAVIDSON | R237: CAHILL
A238: CAMBERWELL | C238: JUDD | F238: WILKINSON | I238: BOTTAMS | L238: BURMEISTER | W238: PRESTON | X238: 5 | Y238: 0 | Z238: 0 | AA238: 783 | AB238: 434 | AC238: =(AA238/AB238)*100 -> 180.41474654377879 | AD238: =(X238*4)+(Z238*2) -> 20
A239: GOALKICKERS | O239: DAVIDSON | Q239: SLEVISON | W239: SANDRINGHAM | X239: 5 | Y239: 0 | Z239: 0 | AA239: 736 | AB239: 504 | AC239: =(AA239/AB239)*100 -> 146.03174603174602 | AD239: =(X239*4)+(Z239*2) -> 20
A240: WILLIAMSTOWN | C240: FOTHERINGHAM 10 | G240: HUGHES 3 | I240: SAIT 3 | K240: SIMMONS 3 | M240: RICKMAN 3 | P240: KERSHAW | R240: SEMMONS | W240: GEELONG WEST | X240: 4 | Y240: 1 | Z240: 0 | AA240: 656 | AB240: 525 | AC240: =(AA240/AB240)*100 -> 124.95238095238095 | AD240: =(X240*4)+(Z240*2) -> 16
A241: CAMBERWELL | C241: WEATHERALD 2 | F241: C ROURKE 2 | I241: BURMEISTER | L241: GRAY | N241: DE KONNING | Q241: HIPWORTH | S241: TURNER | W241: FRANKSTON | X241: 3 | Y241: 2 | Z241: 0 | AA241: 818 | AB241: 627 | AC241: =(AA241/AB241)*100 -> 130.46251993620416 | AD241: =(X241*4)+(Z241*2) -> 12
R242: VENUE: TOORAK PARK
A243: SPRINGVALE | C243: 7 | D243: 5 | E243: 47 | G243: 10 | H243: 7 | I243: 67 | K243: 13 | L243: 11 | M243: 89 | O243: 15 | P243: 14 | Q243: 104 | S243: MARCY | W243: PORT MELBOURNE | X243: 3 | Y243: 2 | Z243: 0 | AA243: 698 | AB243: 551 | AC243: =(AA243/AB243)*100 -> 126.67876588021778 | AD243: =(X243*4)+(Z243*2) -> 12
A244: PRAHRAN | C244: 1 | D244: 2 | E244: 8 | G244: 5 | H244: 4 | I244: 34 | K244: 8 | L244: 5 | M244: 53 | O244: 12 | P244: 7 | Q244: 79 | S244: FITZPATRICK | W244: COBURG | X244: 3 | Y244: 2 | Z244: 0 | AA244: 661 | AB244: 625 | AC244: =(AA244/AB244)*100 -> 105.76 | AD244: =(X244*4)+(Z244*2) -> 12
A245: BEST PLAYERS | W245: WILLIAMSTOWN | X245: 2 | Y245: 3 | Z245: 0 | AA245: 648 | AB245: 565 | AC245: =(AA245/AB245)*100 -> 114.69026548672568 | AD245: =(X245*4)+(Z245*2) -> 8
A246: SPRINGVALE | C246: ANDERSON | F246: HOLDEN | I246: SMITH | L246: CARROLL | O246: GULEY | W246: SPRINGVALE | X246: 2 | Y246: 3 | Z246: 0 | AA246: 493 | AB246: 590 | AC246: =(AA246/AB246)*100 -> 83.559322033898312 | AD246: =(X246*4)+(Z246*2) -> 8
A247: PRAHRAN | C247: GRAMBEAU | F247: I McCORMACK | I247: P McDONALD | L247: CHRISTIE | W247: CAMBERWELL | X247: 2 | Y247: 3 | Z247: 0 | AA247: 587 | AB247: 759 | AC247: =(AA247/AB247)*100 -> 77.338603425559953 | AD247: =(X247*4)+(Z247*2) -> 8
A248: GOALKICKERS | W248: WERRIBEE | X248: 1 | Y248: 4 | Z248: 0 | AA248: 500 | AB248: 730 | AC248: =(AA248/AB248)*100 -> 68.493150684931507 | AD248: =(X248*4)+(Z248*2) -> 4
A249: SPRINGVALE | C249: SMITH 5 | F249: HOLDEN 3 | I249: ANDERSON 3 | L249: CARROLL 2 | O249: STIRLING | Q249: GRAY | W249: PRAHRAN | X249: 0 | Y249: 5 | Z249: 0 | AA249: 490 | AB249: 798 | AC249: =(AA249/AB249)*100 -> 61.403508771929829 | AD249: =(X249*4)+(Z249*2) -> 0
A250: PRAHRAN | C250: I McCORMACK 5 | F250: HARVEY 2 | I250: CHRISTIE | K250: P McDONALD | N250: WALDER | P250: S GILES | R250: G GILES | W250: BOX HILL | X250: 0 | Y250: 5 | Z250: 0 | AA250: 564 | AB250: 926 | AC250: =(AA250/AB250)*100 -> 60.90712742980562 | AD250: =(X250*4)+(Z250*2) -> 0
A252: GEELONG WEST | C252: 4 | D252: 4 | E252: 28 | G252: 17 | H252: 8 | I252: 110 | K252: 20 | L252: 11 | M252: 131 | O252: 26 | P252: 13 | Q252: 169 | S252: VENUE: GEELONG WEST
A253: BOX HILL | C253: 3 | D253: 6 | E253: 24 | G253: 5 | H253: 6 | I253: 36 | K253: 9 | L253: 9 | M253: 63 | O253: 15 | P253: 9 | Q253: 99 | S253: VERGONA ;BLAKE
A254: BEST PLAYERS
A255: GEELONG WEST | C255: PERKINS | F255: WELSH | I255: DALIHAUS | L255: BERRY | O255: HAMMOND | R255: EVANS
A256: BOX HILL | C256: GIBB | F256: HEDGER | I256: REEVES | L256: BOLTON | O256: NICHOLSON | R256: MCGHIE
A257: GOALKICKERS
A258: GEELONG WEST | C258: BERRY 6 | E258: NICHOLS 4 | G258: TOULMIN 3 | I258: REDHEAD 3 | L258: WELSH 2 | N258: BEWS 2 | P258: HADDOCK 2 | R258: GIBSON | T258: HEWITT | V258: HAMMOND | X258: CONELLY
A259: BOX HILL | C259: NICHOLSON 7 | F259: HEDGER 3 | I259: GARTH 3 | K259: WITHERS | M259: DODD
A261: PRESTON | C261: 5 | D261: 9 | E261: 39 | G261: 14 | H261: 16 | I261: 100 | K261: 20 | L261: 23 | M261: 143 | O261: 25 | P261: 26 | Q261: 176 | S261: VENUE: PRESTON
A262: WERRIBEE | C262: 2 | D262: 1 | E262: 13 | G262: 3 | H262: 4 | I262: 22 | K262: 3 | L262: 5 | M262: 23 | O262: 5 | P262: 7 | Q262: 37 | S262: HUTCHINSON :WALKER
A263: BEST PLAYERS
A264: PRESTON | C264: JORDAN | F264: MARCON | I264: BRINE | L264: WATT | O264: WHITE | R264: DINTINOSANTE
A265: WERRIBEE | C265: B MOLONEY | F265: PERKINS | I265: BLAKE | L265: BUCKINGHAM | O265: FREEMAN
A266: GOALKICKERS
A267: PRESTON | C267: SHAW 6 | F267: ZERELLA 4 | I267: SALVADOR 3 | L267: LUMICISI 3 | N267: JORDAN 3 | Q267: BRINE 2 | S267: BEER 2 | U267: PERKINS | X267: MARCON
A268: WERRIBEE | C268: RICHARDSON 2 | F268: BONAT | H268: GORDAN | J268: GRAY
A270: SANDRINGHAM | C270: 4 | D270: 1 | E270: 25 | G270: 7 | H270: 5 | I270: 47 | K270: 13 | L270: 5 | M270: 83 | O270: 20 | P270: 10 | Q270: 130 | S270: VENUE: BEACH ROAD
A271: COBURG | C271: 5 | D271: 3 | E271: 33 | G271: 10 | H271: 5 | I271: 65 | K271: 13 | L271: 6 | M271: 84 | O271: 14 | P271: 8 | Q271: 92 | S271: MARSHALL :MORGAN
A272: BEST PLAYERS
A273: SANDRINGHAM | C273: MACLEOD | F273: LYONS | I273: HETHERINGTON | L273: ADAMS | O273: BEILBY | R273: GALLAGHER
A274: COBURG | C274: EVANS | F274: EDWARDS | I274: HALBERT | L274: HARBINSON | O274: GIBB
A275: GOALKICKERS
A276: SANDRINGHAM | C276: MORRISON 6 | F276: MACLEOD 5 | I276: BREWER 3 | K276: GOROZIDIS 2 | N276: GALLAGHER 2 | Q276: ADAMS | S276: DIPIERDOMENICO
A277: COBURG | C277: EDWARDS 4 | F277: CLEARY 2 | I277: TULLOCH 2 | L277: HALBERT 2 | O277: BRIEDIS 2 | Q277: HOLT | S277: HARBINSON
A279: PORT MELBOURNE | C279: 4 | D279: 4 | E279: 28 | G279: 8 | H279: 6 | I279: 54 | K279: 16 | L279: 8 | M279: 104 | O279: 19 | P279: 13 | Q279: 127 | S279: VENUE: PORT MELBOURNE
A280: FRANKSTON | C280: 3 | D280: 4 | E280: 22 | G280: 4 | H280: 4 | I280: 28 | K280: 6 | L280: 6 | M280: 42 | O280: 10 | P280: 8 | Q280: 68 | S280: OAKLEY :PHILLIPS
A281: BEST PLAYERS
A282: PORT MELBOURNE | C282: CHADBAND | F282: PETRAGLIA | I282: JENNINGS | L282: HOY | N282: SWAN | Q282: DERMOTT
A283: FRANKSTON | C283: BEATON | F283: GEDDES | I283: THOMAS
A284: GOALKICKERS
A285: PORT MELBOURNE | C285: PETRAGLIA 5 | F285: FITZPATRICK 5 | I285: O'RILEY 4 | K285: JENNINGS 4 | N285: HARKINS
A286: FRANKSTON | C286: BOYD 5 | F286: CALLAGHAN 3 | I286: BEATON | K286: BELL
A288: ROUND 6 | D288: 26TH MAY | I288: WEATHER | S288: VENUE: COBURG
D289: 1ST QTR | H289: 2ND QTR | L289: 3RD QTR | P289: FINAL | S289: UMPIRES
A290: COBURG | C290: 7 | D290: 4 | E290: 46 | G290: 13 | H290: 10 | I290: 88 | K290: 18 | L290: 14 | M290: 122 | O290: 24 | P290: 17 | Q290: 161 | S290: BLACK | X290: LADDER | AB290: ROUND | AD290: 6
A291: PRAHRAN | C291: 4 | D291: 2 | E291: 26 | G291: 6 | H291: 4 | I291: 40 | K291: 11 | L291: 8 | M291: 74 | O291: 14 | P291: 13 | Q291: 97 | S291: HUTCHINSON
A292: BEST PLAYERS | W292: TEAM | X292: W | Y292: L | Z292: D | AA292: FOR | AB292: AGST | AC292: % | AD292: PTS
A293: COBURG | C293: TULLOCH | F293: EVANS | I293: CLEARY | L293: FREEMAN | O293: HALBERT | R293: GIBB
A294: PRAHRAN | C294: GILES | F294: P McDONALD | I294: I McCORMACK | L294: BUTCHER | O294: WALDER | R294: TORCASIO | W294: PRESTON | X294: 6 | Y294: 0 | Z294: 0 | AA294: 971 | AB294: 568 | AC294: =(AA294/AB294)*100 -> 170.95070422535213 | AD294: =(X294*4)+(Z294*2) -> 24
A295: GOALKICKERS | P295: EDWARDS | R295: GIBB | W295: SANDRINGHAM | X295: 6 | Y295: 0 | Z295: 0 | AA295: 929 | AB295: 594 | AC295: =(AA295/AB295)*100 -> 156.39730639730641 | AD295: =(X295*4)+(Z295*2) -> 24
A296: COBURG | C296: MANSFIELD 4 | F296: CLEARY 4 | H296: TULLOCH 4 | J296: FREEMAN 3 | M296: HALBERT 2 | O296: ALLISON 2 | Q296: FISHER 2 | S296: M ZANON | W296: GEELONG WEST | X296: 5 | Y296: 1 | Z296: 0 | AA296: 768 | AB296: 633 | AC296: =(AA296/AB296)*100 -> 121.32701421800948 | AD296: =(X296*4)+(Z296*2) -> 20
A297: PRAHRAN | C297: CHRISTIE 2 | E297: I McCORMACK 2 | H297: P McCORMACK 2 | K297: GILES 2 | M297: PAGE | N297: HARVEY | P297: WALDER | R297: GRAMBEAU | W297: PORT MELBOURNE | X297: 4 | Y297: 2 | Z297: 0 | AA297: 853 | AB297: 656 | AC297: =(AA297/AB297)*100 -> 130.03048780487805 | AD297: =(X297*4)+(Z297*2) -> 16
M298: McDONALD | P298: TAYLOR | S298: VENUE: FRANKSTON
A299: GEELONG WEST | C299: 4 | D299: 3 | E299: 27 | G299: 4 | H299: 8 | I299: 32 | K299: 10 | L299: 13 | M299: 73 | O299: 16 | P299: 16 | Q299: 112 | S299: WALKER | W299: COBURG | X299: 4 | Y299: 2 | Z299: 0 | AA299: 822 | AB299: 722 | AC299: =(AA299/AB299)*100 -> 113.85041551246537 | AD299: =(X299*4)+(Z299*2) -> 16
A300: FRANKSTON | C300: 4 | D300: 4 | E300: 28 | G300: 6 | H300: 9 | I300: 45 | K300: 13 | L300: 11 | M300: 89 | O300: 16 | P300: 12 | Q300: 108 | S300: GIBSON | W300: WILLIAMSTOWN | X300: 3 | Y300: 3 | Z300: 0 | AA300: 918 | AB300: 659 | AC300: =(AA300/AB300)*100 -> 139.3019726858877 | AD300: =(X300*4)+(Z300*2) -> 12
A301: BEST PLAYERS | W301: FRANKSTON | X301: 3 | Y301: 3 | Z301: 0 | AA301: 926 | AB301: 739 | AC301: =(AA301/AB301)*100 -> 125.3044654939107 | AD301: =(X301*4)+(Z301*2) -> 12
A302: GEELONG WEST | C302: REDHEAD | F302: DALIHAUS | I302: EVANS | L302: DOYLE | O302: HAMMOND | R302: NORTH | W302: SPRINGVALE | X302: 2 | Y302: 4 | Z302: 0 | AA302: 598 | AB302: 745 | AC302: =(AA302/AB302)*100 -> 80.268456375838923 | AD302: =(X302*4)+(Z302*2) -> 8
A303: FRANKSTON | C303: BELL | F303: WALSH | I303: CZARNECKI | L303: BEATON | O303: GEDDES | R303: O'BRIEN | W303: CAMBERWELL | X303: 2 | Y303: 4 | Z303: 0 | AA303: 721 | AB303: 947 | AC303: =(AA303/AB303)*100 -> 76.13516367476241 | AD303: =(X303*4)+(Z303*2) -> 8
A304: GOALKICKERS | W304: WERRIBEE | X304: 1 | Y304: 5 | Z304: 0 | AA304: 590 | AB304: 923 | AC304: =(AA304/AB304)*100 -> 63.921993499458281 | AD304: =(X304*4)+(Z304*2) -> 4
A305: GEELONG WEST | C305: DOYLE 7 | F305: HADDOCK 3 | I305: WELSH | K305: HADDOCK | M305: TOULMIN | O305: DALIHAUS | Q305: BERRY | W305: PRAHRAN | X305: 0 | Y305: 6 | Z305: 0 | AA305: 587 | AB305: 959 | AC305: =(AA305/AB305)*100 -> 61.209593326381651 | AD305: =(X305*4)+(Z305*2) -> 0
A306: FRANKSTON | C306: CZARNECKI 4 | F306: BOYD 3 | H306: BELL 2 | J306: BARDOEL 2 | M306: T O'BRIEN 2 | P306: MOORE | R306: BEATON | T306: GEDDES | W306: BOX HILL | X306: 0 | Y306: 6 | Z306: 0 | AA306: 658 | AB306: 1196 | AC306: =(AA306/AB306)*100 -> 55.016722408026752 | AD306: =(X306*4)+(Z306*2) -> 0
A308: PORT MELBOURNE | C308: 3 | D308: 8 | E308: 26 | G308: 9 | H308: 15 | I308: 69 | K308: 13 | L308: 18 | M308: 96 | O308: 22 | P308: 23 | Q308: 155 | S308: VENUE: SPRINGVALE
A309: SPRINGVALE | C309: 1 | D309: 3 | E309: 9 | G309: 8 | H309: 4 | I309: 52 | K309: 9 | L309: 7 | M309: 61 | O309: 16 | P309: 9 | Q309: 105 | S309: BLAKE :VERGONA
A310: BEST PLAYERS
A311: PORT MELBOURNE | C311: CHADBAND | F311: DERMOTT | I311: SWAN | L311: JENNINGS | O311: PETRAGLIA | R311: ROSS
A312: SPRINGVALE | C312: MALONI | F312: CLARKE | I312: NANFRA | L312: MEADE | O312: HOLDEN
A313: GOALKICKERS
A314: PORT MELBOURNE | C314: FITZPATRICK 5 | F314: JENNINGS 5 | I314: O'RILEY 3 | K314: ROSS 2 | M314: YEOMAN 2 | O314: CARTER 2 | Q314: PETRAGLIA 2 | T314: HOY
A315: SPRINGVALE | C315: CLARKE 5 | F315: ANDERSON 3 | I315: STIRLING 2 | K315: DUNCAN 2 | M315: HOLDEN 2 | O315: CARROLL | Q315: GULEY
A317: PRESTON | C317: 7 | D317: 8 | E317: 50 | G317: 14 | H317: 10 | I317: 94 | K317: 23 | L317: 15 | M317: 153 | O317: 28 | P317: 20 | Q317: 188 | S317: VENUE: CAMBERWELL
A318: CAMBERWELL | C318: 1 | D318: 5 | E318: 11 | G318: 10 | H318: 11 | I318: 71 | K318: 14 | L318: 13 | M318: 97 | O318: 19 | P318: 20 | Q318: 134 | S318: MORGAN ;PHILLIPS
A319: BEST PLAYERS
A320: PRESTON | C320: DINTINOSANTE | F320: SALVADORE | I320: WHITE | L320: JORDAN | O320: SHAW | R320: MARCON
A321: CAMBERWELL | C321: WILKINSON | F321: DAVIDSON | I321: BOTTAMS | L321: C ROURKE | O321: GRAY
A322: GOALKICKERS
A323: PRESTON | C323: SHAW 7 | E323: KEENAN 5 | G323: MARCON 4 | I323: BEER 4 | K323: HACKNEY 2 | M323: LUMICISI | O323: JORDAN | Q323: BRINE | S323: SALVADORE | V323: DINTINOSANTE | X323: ZERELLA
A324: CAMBERWELL | C324: SIDE 4 | E324: STEVENSON 3 | H324: SCOTT 3 | J324: WILKINSON 2 | M324: DAVIDSON 2 | O324: YOUNG | Q324: HIPWORTH | S324: TURNER | U324: S ROURKE
A326: SANDRINGHAM | C326: 6 | D326: 1 | E326: 37 | G326: 10 | H326: 5 | I326: 65 | K326: 25 | L326: 9 | M326: 159 | O326: 30 | P326: 13 | Q326: 193 | S326: VENUE: WERRIBEE
A327: WERRIBEE | C327: 5 | D327: 4 | E327: 34 | G327: 9 | H327: 8 | I327: 62 | K327: 11 | L327: 9 | M327: 75 | O327: 13 | P327: 12 | Q327: 90 | S327: STEERE :FITZPATRICK
A328: BEST PLAYERS
A329: SANDRINGHAM | C329: ADAMS | F329: EAVES | I329: JOHNSON | L329: COLLINS | O329: SIMS | Q329: HETHERINGTON
A330: WERRIBEE | C330: BUCKINGHAM | F330: S MOLONEY | I330: GORDAN | L330: MCCANCE | O330: BLAKE | Q330: CHRISTIANSEN
A331: GOALKICKERS
A332: SANDRINGHAM | C332: ADAMS 10 | F332: MORRISON 6 | I332: BREWER 5 | K332: PEARSON 2 | M332: MACLEOD | O332: JOHNSON | Q332: LYONS
A333: WERRIBEE | C333: SPIERINGS 4 | F333: CHRISTIANSEN 3 | J333: GORDON 2 | M333: ABBOTT | O333: BLAKE | Q333: BUCKINGHAM | T333: GUINTA
A335: WILLIAMSTOWN | C335: 9 | D335: 8 | E335: 62 | G335: 22 | H335: 10 | I335: 142 | K335: 32 | L335: 14 | M335: 206 | O335: 42 | P335: 18 | Q335: 270 | S335: VENUE: BOX HILL
A336: BOX HILL | C336: 3 | D336: 5 | E336: 23 | G336: 8 | H336: 8 | I336: 56 | K336: 10 | L336: 15 | M336: 75 | O336: 13 | P336: 16 | Q336: 94 | S336: BREWER :OAKLEY
A337: BEST PLAYERS
A338: WILLIAMSTOWN | C338: HUGHES | F338: MURPHY | I338: RICKMAN | L338: FOTHERINGHAM | O338: CAHILL | Q338: SEMMONS
A339: BOX HILL | C339: TEAKEL | F339: GIBB | I339: McGHIE
A340: GOALKICKERS
A341: WILLIAMSTOWN | C341: FOTHERINGHAM 12 | F341: RICKMAN 10 | I341: CAHILL 5 | K341: HOLDER 3 | M341: TAYLOR 2 | O341: HUGHES 2 | Q341: SLEVISON 2 | S341: SAIT 2 | T341: SIMMONS 2 | V341: MURPHY | X341: ROSS
A342: BOX HILL | C342: BOLTON 4 | F342: SLACIK 3 | H342: NICHOLSON | J342: WITHERS | L342: HOWARTH | N342: McGHIE | P342: GARTH | R342: CASEY
A344: ROUND 7 | D344: 2ND JUNE | I344: WEATHER | S344: VENUE: PRESTON
D345: 1ST QTR | H345: 2ND QTR | L345: 3RD QTR | P345: FINAL | S345: UMPIRES
A346: PRESTON | C346: 5 | D346: 8 | E346: 38 | G346: 10 | H346: 14 | I346: 74 | K346: 16 | L346: 18 | M346: 114 | O346: 24 | P346: 23 | Q346: 167 | S346: MARSHALL | X346: LADDER | AB346: ROUND | AD346: 7
A347: BOX HILL | C347: 2 | D347: 1 | E347: 13 | G347: 6 | H347: 3 | I347: 39 | K347: 8 | L347: 3 | M347: 51 | O347: 10 | P347: 7 | Q347: 67 | S347: STEERE
A348: BEST PLAYERS | W348: TEAM | X348: W | Y348: L | Z348: D | AA348: FOR | AB348: AGST | AC348: % | AD348: PTS
A349: PRESTON | C349: DINTINOSANTE | F349: JORDAN | I349: BRINE | L349: WARREN | O349: SALVADORE | R349: ANDERSON
A350: BOX HILL | C350: TEAKEL | F350: CUFF | I350: DODD | L350: LONGHAM | O350: GARTH | W350: PRESTON | X350: 7 | Y350: 0 | Z350: 0 | AA350: 1138 | AB350: 635 | AC350: =(AA350/AB350)*100 -> 179.21259842519686 | AD350: =(X350*4)+(Z350*2) -> 28
A351: GOALKICKERS | P351: SALVADORE | R351: PERKINS | W351: SANDRINGHAM | X351: 7 | Y351: 0 | Z351: 0 | AA351: 1045 | AB351: 654 | AC351: =(AA351/AB351)*100 -> 159.78593272171253 | AD351: =(X351*4)+(Z351*2) -> 28
A352: PRESTON | C352: SHAW 4 | E352: JORDAN 4 | G352: BRINE 3 | I352: KEENAN 2 | K352: HACKNEY 2 | M352: ZERELLA 2 | O352: FULLER 2 | Q352: MARCON 2 | S352: WARREN | W352: COBURG | X352: 5 | Y352: 2 | Z352: 0 | AA352: 917 | AB352: 790 | AC352: =(AA352/AB352)*100 -> 116.07594936708861 | AD352: =(X352*4)+(Z352*2) -> 20
A353: BOX HILL | C353: LONGHAM 3 | F353: HOWARTH 3 | I353: GIBB 2 | K353: GARTH 2 | W353: GEELONG WEST | X353: 5 | Y353: 2 | Z353: 0 | AA353: 808 | AB353: 751 | AC353: =(AA353/AB353)*100 -> 107.58988015978694 | AD353: =(X353*4)+(Z353*2) -> 20
S354: VENUE: TOORAK PARK
A355: PRAHRAN | C355: 7 | D355: 6 | E355: 48 | G355: 14 | H355: 7 | I355: 91 | K355: 18 | L355: 11 | M355: 119 | O355: 21 | P355: 14 | Q355: 140 | S355: BLAKE | W355: WILLIAMSTOWN | X355: 4 | Y355: 3 | Z355: 0 | AA355: 1036 | AB355: 699 | AC355: =(AA355/AB355)*100 -> 148.21173104434905 | AD355: =(X355*4)+(Z355*2) -> 16
A356: WERRIBEE | C356: 4 | D356: 2 | E356: 26 | G356: 7 | H356: 4 | I356: 46 | K356: 9 | L356: 7 | M356: 61 | O356: 16 | P356: 9 | Q356: 105 | S356: OAKLEY | W356: PORT MELBOURNE | X356: 4 | Y356: 3 | Z356: 0 | AA356: 921 | AB356: 751 | AC356: =(AA356/AB356)*100 -> 122.63648468708388 | AD356: =(X356*4)+(Z356*2) -> 16
A357: BEST PLAYERS | W357: FRANKSTON | X357: 3 | Y357: 4 | Z357: 0 | AA357: 1005 | AB357: 826 | AC357: =(AA357/AB357)*100 -> 121.67070217917674 | AD357: =(X357*4)+(Z357*2) -> 12
A358: PRAHRAN | C358: WALDER | F358: P McDONALD | I358: HINE | L358: I McCORMACK | O358: P McCORMACK | R358: SOULOS | W358: SPRINGVALE | X358: 3 | Y358: 4 | Z358: 0 | AA358: 685 | AB358: 824 | AC358: =(AA358/AB358)*100 -> 83.131067961165044 | AD358: =(X358*4)+(Z358*2) -> 12
A359: WERRIBEE | C359: RICHARDSON | F359: PERKINS | I359: FREEMAN | L359: BUCKINGHAM | O359: FEDKE | W359: CAMBERWELL | X359: 2 | Y359: 5 | Z359: 0 | AA359: 781 | AB359: 1063 | AC359: =(AA359/AB359)*100 -> 73.471307619943559 | AD359: =(X359*4)+(Z359*2) -> 8
A360: GOALKICKERS | W360: PRAHRAN | X360: 1 | Y360: 6 | Z360: 0 | AA360: 727 | AB360: 1064 | AC360: =(AA360/AB360)*100 -> 68.327067669172934 | AD360: =(X360*4)+(Z360*2) -> 4
A361: PRAHRAN | C361: GALT 6 | E361: SOULOS 4 | G361: WALLACE 4 | J361: TAPPING 3 | M361: I McCORMACK 2 | P361: CHRISTIE | R361: MITTEL | W361: WERRIBEE | X361: 1 | Y361: 6 | Z361: 0 | AA361: 695 | AB361: 1063 | AC361: =(AA361/AB361)*100 -> 65.38099717779869 | AD361: =(X361*4)+(Z361*2) -> 4
A362: WERRIBEE | C362: RICHARDSON 6 | F362: BUCKINGHAM 3 | I362: FEDKE 2 | K362: GUINTA 2 | M362: CHRISTIANSEN | P362: B MOLONEY | S362: WALPOLE | W362: BOX HILL | X362: 0 | Y362: 7 | Z362: 0 | AA362: 725 | AB362: 1363 | AC362: =(AA362/AB362)*100 -> 53.191489361702125 | AD362: =(X362*4)+(Z362*2) -> 0
A364: COBURG | C364: 7 | D364: 8 | E364: 50 | G364: 8 | H364: 9 | I364: 57 | K364: 11 | L364: 15 | M364: 81 | O364: 13 | P364: 17 | Q364: 95 | S364: VENUE: PORT MELBOURNE
A365: PORT MELBOURNE | C365: 1 | D365: 3 | E365: 9 | G365: 5 | H365: 4 | I365: 34 | K365: 6 | L365: 8 | M365: 44 | O365: 9 | P365: 14 | Q365: 68 | S365: MARCY :WALKER
A366: BEST PLAYERS
A367: COBURG | C367: MANSFIELD | F367: DOHNT | I367: HARRISON | L367: FREEMAN | O367: HALBERT | R367: GIBB
A368: PORT MELBOURNE | C368: CHADBAND | F368: COOPER | I368: ROSS | L368: ROBERTSON | O368: JENNINGS
A369: GOALKICKERS
A370: COBURG | C370: FREEMAN 4 | F370: HALBERT 2 | I370: ZANON | K370: MANSFIELD | M370: GIBB | O370: CLEARY | Q370: FITZPATRICK | T370: EDWARDS | W370: GRAHAM
A371: PORT MELBOURNE | C371: FITZPATRICK 2 | F371: EBEYER 2 | I371: O'RILEY | K371: JOHNSON | M371: SWAN | O371: PETRAGLIA | R371: JENNINGS
A373: SPRINGVALE | C373: 3 | D373: 1 | E373: 19 | G373: 6 | H373: 1 | I373: 37 | K373: 10 | L373: 4 | M373: 64 | O373: 13 | P373: 9 | Q373: 87 | S373: VENUE: SPRINGVALE
A374: FRANKSTON | C374: 2 | D374: 4 | E374: 16 | G374: 8 | H374: 6 | I374: 54 | K374: 11 | L374: 9 | M374: 75 | O374: 11 | P374: 13 | Q374: 79 | S374: BREWER :HUTCHINSON
A375: BEST PLAYERS
A376: SPRINGVALE | C376: WALTER | F376: GRAY | I376: NANFRA | L376: HOLDEN | O376: MENDE | R376: SMITH
A377: FRANKSTON | C377: HORLER | F377: BEATON | I377: COUSINS | L377: WALSH | O377: GEDDES | R377: KANE
A378: GOALKICKERS
A379: SPRINGVALE | C379: SMITH 4 | F379: MAGRO 3 | I379: HERBERT 3 | L379: ANDERSON | O379: BLOOMFIELD | R379: HOLDEN
A380: FRANKSTON | C380: GEDDES 3 | F380: HILTON 3 | I380: BARDOEL | K380: COUSINS | M380: KANE | O380: ROGERSON | R380: WALSH
A382: SANDRINGHAM | C382: 3 | D382: 3 | E382: 21 | G382: 5 | H382: 5 | I382: 35 | K382: 11 | L382: 7 | M382: 73 | O382: 17 | P382: 14 | Q382: 116 | S382: VENUE: BEACH ROAD
A383: CAMBERWELL | C383: 2 | D383: 3 | E383: 15 | G383: 6 | H383: 6 | I383: 42 | K383: 7 | L383: 10 | M383: 52 | O383: 8 | P383: 12 | Q383: 60 | S383: GLEESON :VERGONA
A384: BEST PLAYERS
A385: SANDRINGHAM | C385: MERCER | F385: HETHERINGTON | I385: MANNIX | L385: BINGHAM | O385: FITZPATRICK | R385: EAVES
A386: CAMBERWELL | C386: DE KONNING | F386: TURNER | I386: BUDGE | L386: DANS | O386: BOTTAMS
A387: GOALKICKERS
A388: SANDRINGHAM | C388: BINGHAM 5 | F388: MORRISON 4 | I388: BREWER 4 | L388: MACLEOD 2 | O388: GALLAGHER 2
A389: CAMBERWELL | C389: STEVENSON | F389: SIDE | H389: BURMEISTER | K389: MAILING | M389: ROURKE | O389: SCOTT | Q389: BANKS | S389: CONSTANTINOU
A391: WILLIAMSTOWN | C391: 1 | D391: 4 | E391: 10 | G391: 9 | H391: 7 | I391: 61 | K391: 12 | L391: 8 | M391: 80 | O391: 17 | P391: 16 | Q391: 118 | S391: VENUE: WILLIAMSTOWN
A392: GEELONG WEST | C392: 0 | D392: 2 | E392: 2 | G392: 1 | H392: 6 | I392: 12 | K392: 4 | L392: 8 | M392: 32 | O392: 5 | P392: 10 | Q392: 40 | S392: FITZPATRICK :PHILLIPS
A393: BEST PLAYERS
A394: WILLIAMSTOWN | C394: KERSHAW | F394: CAHILL | I394: DIMARTINO | L394: HUGHES | O394: OWEN | R394: MURPHY
A395: GEELONG WEST | C395: WELSH | F395: GIBSON | I395: SIZER | L395: EVANS
A396: GOALKICKERS
A397: WILLIAMSTOWN | C397: RICKMAN 6 | F397: FOTHERINGHAM 5 | J397: CAHILL 3 | M397: TAYLOR | O397: HUGHES | Q397: SAIT
A398: GEELONG WEST | C398: DOYLE | E398: GIBSON | G398: PERKINS | I398: HADDOCK | K398: TOULMIN
A400: ROUND 8 | D400: 16TH JUNE | I400: WEATHER | S400: VENUE: WERRIBEE
D401: 1ST QTR | H401: 2ND QTR | L401: 3RD QTR | P401: FINAL | S401: UMPIRES
A402: PORT MELBOURNE | C402: 7 | D402: 3 | E402: 45 | G402: 13 | H402: 6 | I402: 84 | K402: 25 | L402: 8 | M402: 158 | O402: 36 | P402: 10 | Q402: 226 | S402: GLEESON | X402: LADDER | AB402: ROUND | AD402: 8
A403: WERRIBEE | C403: 4 | D403: 1 | E403: 25 | G403: 6 | H403: 4 | I403: 40 | K403: 8 | L403: 6 | M403: 54 | O403: 11 | P403: 8 | Q403: 74 | S403: PHILLIPS
A404: BEST PLAYERS | W404: TEAM | X404: W | Y404: L | Z404: D | AA404: FOR | AB404: AGST | AC404: % | AD404: PTS
A405: PORT MELBOURNE | C405: S HARKINS | F405: ROSS | I405: FITZPATRICK | L405: EBEYER | O405: DERMOTT | R405: PETRAGLIA
A406: WERRIBEE | C406: FEDKE | F406: PERKINS | I406: FREEMAN | L406: S MOLONEY | O406: RICHARDSON | R406: MONTGOMERY | W406: PRESTON | X406: 8 | Y406: 0 | Z406: 0 | AA406: 1277 | AB406: 746 | AC406: =(AA406/AB406)*100 -> 171.17962466487936 | AD406: =(X406*4)+(Z406*2) -> 32
A407: GOALKICKERS | Q407: RODDA | W407: SANDRINGHAM | X407: 8 | Y407: 0 | Z407: 0 | AA407: 1169 | AB407: 755 | AC407: =(AA407/AB407)*100 -> 154.83443708609272 | AD407: =(X407*4)+(Z407*2) -> 32
A408: PORT MELBOURNE | C408: FITZPATRICK 11 | F408: O'RILEY 7 | H408: S HARKINS 6 | K408: EBEYER 5 | M408: SCURRAH 3 | P408: ROSS 2 | R408: PETRAGLIA | W408: COBURG | X408: 6 | Y408: 2 | Z408: 0 | AA408: 1086 | AB408: 887 | AC408: =(AA408/AB408)*100 -> 122.43517474633596 | AD408: =(X408*4)+(Z408*2) -> 24
A409: WERRIBEE | C409: RICHARDSON 5 | F409: WALPOLE 2 | I409: DUNSATN | K409: FREEMAN | M409: GUINTA | O409: REDENBACH | W409: WILLIAMSTOWN | X409: 5 | Y409: 3 | Z409: 0 | AA409: 1175 | AB409: 824 | AC409: =(AA409/AB409)*100 -> 142.59708737864079 | AD409: =(X409*4)+(Z409*2) -> 20
S410: VENUE: BOX HILL
A411: SANDRINGHAM | C411: 6 | D411: 5 | E411: 41 | G411: 11 | H411: 9 | I411: 75 | K411: 14 | L411: 12 | M411: 96 | O411: 18 | P411: 16 | Q411: 124 | S411: CASEY | W411: PORT MELBOURNE | X411: 5 | Y411: 3 | Z411: 0 | AA411: 1147 | AB411: 825 | AC411: =(AA411/AB411)*100 -> 139.03030303030303 | AD411: =(X411*4)+(Z411*2) -> 20
A412: BOX HILL | C412: 4 | D412: 0 | E412: 24 | G412: 6 | H412: 2 | I412: 38 | K412: 9 | L412: 5 | M412: 59 | O412: 16 | P412: 5 | Q412: 101 | S412: WALKER | W412: GEELONG WEST | X412: 5 | Y412: 3 | Z412: 0 | AA412: 919 | AB412: 890 | AC412: =(AA412/AB412)*100 -> 103.25842696629212 | AD412: =(X412*4)+(Z412*2) -> 20
A413: BEST PLAYERS | W413: FRANKSTON | X413: 3 | Y413: 5 | Z413: 0 | AA413: 1130 | AB413: 965 | AC413: =(AA413/AB413)*100 -> 117.09844559585491 | AD413: =(X413*4)+(Z413*2) -> 12
A414: SANDRINGHAM | C414: COLLINS | F414: KRISTENSEN | I414: FITZPATRICK | L414: MACLEOD | O414: MORRISON | W414: SPRINGVALE | X414: 3 | Y414: 5 | Z414: 0 | AA414: 782 | AB414: 993 | AC414: =(AA414/AB414)*100 -> 78.751258811681765 | AD414: =(X414*4)+(Z414*2) -> 12
A415: BOX HILL | C415: GARTH | F415: TEAKEL | I415: BROWN | L415: ROCHOW | O415: CUFF | Q415: LEMON | W415: CAMBERWELL | X415: 2 | Y415: 6 | Z415: 0 | AA415: 917 | AB415: 1199 | AC415: =(AA415/AB415)*100 -> 76.480400333611342 | AD415: =(X415*4)+(Z415*2) -> 8
A416: GOALKICKERS | Q416: KRISTENSEN | W416: PRAHRAN | X416: 2 | Y416: 6 | Z416: 0 | AA416: 882 | AB416: 1200 | AC416: =(AA416/AB416)*100 -> 73.5 | AD416: =(X416*4)+(Z416*2) -> 8
A417: SANDRINGHAM | C417: MORRISON 5 | F417: BINGHAM 4 | I417: BREWER 3 | K417: DIPIERDOMENICO 2 | O417: PEARSON | Q417: MANNIX | S417: FITZPATRICK | W417: WERRIBEE | X417: 1 | Y417: 7 | Z417: 0 | AA417: 769 | AB417: 1389 | AC417: =(AA417/AB417)*100 -> 55.363570914326857 | AD417: =(X417*4)+(Z417*2) -> 4
A418: BOX HILL | C418: SLACIK 3 | E418: LEMON 3 | G418: NICHOLSON 2 | J418: TEAKEL 2 | L418: GARTH 2 | N418: ROCHOW | P418: WITHERS | R418: BROWN | W418: BOX HILL | X418: 0 | Y418: 8 | Z418: 0 | AA418: 826 | AB418: 1487 | AC418: =(AA418/AB418)*100 -> 55.548083389374582 | AD418: =(X418*4)+(Z418*2) -> 0
O419: HOWARTH
A420: PRESTON | C420: 4 | D420: 0 | E420: 24 | G420: 5 | H420: 4 | I420: 34 | K420: 10 | L420: 9 | M420: 69 | O420: 21 | P420: 13 | Q420: 139 | S420: VENUE: GEELONG WEST
A421: GEELONG WEST | C421: 5 | D421: 3 | E421: 33 | G421: 8 | H421: 9 | I421: 57 | K421: 12 | L421: 12 | M421: 84 | O421: 16 | P421: 15 | Q421: 111 | S421: BREWER :MARCY
A422: BEST PLAYERS
A423: PRESTON | C423: BEER | F423: SALVADOR | I423: KEENAN | L423: JORDAN | O423: DINTINOSANTE | R423: ZERELLA
A424: GEELONG WEST | C424: HAMMOND | F424: WELSH | I424: KRANJC | L424: PERKINS | O424: GIBSON | R424: DALIHAUS
A425: GOALKICKERS
A426: PRESTON | C426: SHAW 6 | E426: KEENAN 6 | H426: LUMICISI 3 | J426: BEER 2 | L426: SALVADORE | O426: HACKNEY | Q426: ZERELLA | S426: MARCON
A427: GEELONG WEST | C427: WESLH 4 | E427: DOYLE 2 | G427: HADDOCK 2 | J427: RICHARDSON 2 | M427: NICHOLSON 2 | P427: GIBSON | R427: McDOWELL | U427: DALIHAUS | X427: WATT
A429: COBURG | C429: 6 | D429: 1 | E429: 37 | G429: 14 | H429: 9 | I429: 93 | K429: 21 | L429: 12 | M429: 138 | O429: 25 | P429: 19 | Q429: 169 | S429: VENUE: COBURG
A430: SPRINGVALE | C430: 5 | D430: 4 | E430: 34 | G430: 7 | H430: 6 | I430: 48 | K430: 11 | L430: 10 | M430: 76 | O430: 14 | P430: 13 | Q430: 97 | S430: OAKLEY :FITZPATRICK
A431: BEST PLAYERS
A432: COBURG | C432: FREMANTLE | F432: MANSFIELD | I432: FREEMAN | L432: HALBERT | O432: TULLOCH
A433: SPRINGVALE | C433: WALTER | F433: CLARKE | I433: HOLDEN | L433: MEADE | O433: DEMPSTER
A434: GOALKICKERS
A435: COBURG | C435: MANSFIELD 5 | F435: TULLOCH 4 | I435: WEBSTER 4 | L435: FISHER 3 | N435: CLEARY 2 | P435: FREEMAN 2 | R435: FITZPATRICK 2 | U435: HALBERT | X435: M ZANON | AA435: GIBB
A436: SPRINGVALE | C436: CLARKE 4 | F436: SMITH 2 | H436: ANDERSON 2 | K436: HOWELL 2 | M436: DEMPSTER | P436: BLOOMFIELD | S436: MAGRO | U436: MALONI
A438: WILLIAMSTOWN | C438: 5 | D438: 2 | E438: 32 | G438: 10 | H438: 3 | I438: 63 | K438: 18 | L438: 6 | M438: 114 | O438: 22 | P438: 7 | Q438: 139 | S438: VENUE: WILLIAMSTOWN
A439: FRANKSTON | C439: 3 | D439: 2 | E439: 20 | G439: 8 | H439: 9 | I439: 57 | K439: 12 | L439: 10 | M439: 82 | O439: 18 | P439: 17 | Q439: 125 | S439: MORGAN :VERGONA
A440: BEST PLAYERS
A441: WILLIAMSTOWN | C441: HUGHES | F441: KERSHAW | I441: LOWDEN | L441: SIMMONS | O441: SEMMONS | R441: SWANN
A442: FRANKSTON | C442: CASPAR | F442: BRIESE | I442: MOORE | L442: CALLAGHAN | O442: GILBERT | R442: BOLAND
A443: GOALKICKERS
A444: WILLIAMSTOWN | C444: SIMMONS 4 | F444: RICKMAN 4 | I444: HUGHES 3 | K444: TAYLOR 3 | M444: FOTHERINGHAM 3 | Q444: SLEVISON 3 | T444: LOWDEN | V444: CAHILL
A445: FRANKSTON | C445: BARDOEL 4 | F445: CALLAGHAN 4 | I445: GILBERT 3 | K445: RAVEN 3 | M445: BELL | O445: KANE | Q445: O'BRIEN | S445: WALSH
A447: PRAHRAN | C447: 5 | D447: 1 | E447: 31 | G447: 9 | H447: 4 | I447: 58 | K447: 17 | L447: 4 | M447: 106 | O447: 25 | P447: 5 | Q447: 155 | S447: VENUE: CAMBERWELL
A448: CAMBERWELL | C448: 2 | D448: 6 | E448: 18 | G448: 9 | H448: 10 | I448: 64 | K448: 14 | L448: 12 | M448: 96 | O448: 20 | P448: 16 | Q448: 136 | S448: MARSHALL :STEERE
A449: BEST PLAYERS
A450: PRAHRAN | C450: GALT | F450: I McCORMACK | I450: WALLACE | L450: WALDER | O450: P McDONALD
A451: CAMBERWELL | C451: JUDD | F451: TURNER | I451: BOTTAMS | L451: CALLENDER | O451: DE KONNING | R451: BURMEISTER
A452: GOALKICKERS
A453: PRAHRAN | C453: GALT 9 | E453: P McDONALD 3 | H453: I McCORMACK 3 | K453: SOULOS 2 | M453: WALDER 2 | P453: WALLACE 2 | R453: MITTEL 2 | T453: TORCASIO | W453: TAPPING
A454: CAMBERWELL | C454: CALLENDER 8 | F454: STEVENSON 4 | I454: SCOTT 2 | K454: WILKINSON 2 | N454: FREW | P454: TURNER | R454: GRAY | T454: JUDD
A456: ROUND 9 | D456: 23RD JUNE | I456: WEATHER | S456: VENUE: BEACH ROAD
D457: 1ST QTR | H457: 2ND QTR | L457: 3RD QTR | P457: FINAL | S457: UMPIRES
A458: SANDRINGHAM | C458: 4 | D458: 2 | E458: 25 | G458: 7 | H458: 7 | I458: 49 | K458: 10 | L458: 11 | M458: 71 | O458: 16 | P458: 14 | Q458: 110 | S458: VERGONA | X458: LADDER | AB458: ROUND | AD458: 9
A459: GEELONG WEST | C459: 4 | D459: 3 | E459: 27 | G459: 7 | H459: 3 | I459: 45 | K459: 10 | L459: 8 | M459: 68 | O459: 12 | P459: 8 | Q459: 80 | S459: HUTCHINSON
A460: BEST PLAYERS | W460: TEAM | X460: W | Y460: L | Z460: D | AA460: FOR | AB460: AGST | AC460: % | AD460: PTS
A461: SANDRINGHAM | C461: FITZPATRICK | F461: KRISTENSEN | I461: BREWER | L461: BEILBY | O461: COLLINS | R461: MERCER
A462: GEELONG WEST | C462: DALIHAUS | F462: GIBSON | I462: HAMMOND | L462: PERKINS | O462: WELSH | R462: BERRY | W462: SANDRINGHAM | X462: 9 | Y462: 0 | Z462: 0 | AA462: 1279 | AB462: 835 | AC462: =(AA462/AB462)*100 -> 153.17365269461078 | AD462: =(X462*4)+(Z462*2) -> 36
A463: GOALKICKERS | W463: PRESTON | X463: 8 | Y463: 1 | Z463: 0 | AA463: 1381 | AB463: 857 | AC463: =(AA463/AB463)*100 -> 161.14352392065345 | AD463: =(X463*4)+(Z463*2) -> 32
A464: SANDRINGHAM | C464: MORRISON 7 | F464: BREWER 3 | I464: KRISTENSEN 2 | L464: MACLEOD 2 | O464: COLLINS | Q464: BINGHAM | W464: COBURG | X464: 7 | Y464: 2 | Z464: 0 | AA464: 1207 | AB464: 974 | AC464: =(AA464/AB464)*100 -> 123.92197125256675 | AD464: =(X464*4)+(Z464*2) -> 28
A465: GEELONG WEST | C465: DOYLE 4 | F465: BERRY 3 | H465: WELSH 2 | J465: HADDOCK | M465: NICHOLSON | P465: McDOWELL | W465: PORT MELBOURNE | X465: 6 | Y465: 3 | Z465: 0 | AA465: 1315 | AB465: 941 | AC465: =(AA465/AB465)*100 -> 139.74495217853345 | AD465: =(X465*4)+(Z465*2) -> 24
S466: VENUE: PRESTON
A467: WILLIAMSTOWN | C467: 0 | D467: 4 | E467: 4 | G467: 7 | H467: 6 | I467: 48 | K467: 13 | L467: 8 | M467: 86 | O467: 17 | P467: 11 | Q467: 113 | S467: OAKLEY | W467: WILLIAMSTOWN | X467: 6 | Y467: 3 | Z467: 0 | AA467: 1288 | AB467: 928 | AC467: =(AA467/AB467)*100 -> 138.79310344827587 | AD467: =(X467*4)+(Z467*2) -> 24
A468: PRESTON | C468: 4 | D468: 4 | E468: 28 | G468: 7 | H468: 9 | I468: 51 | K468: 13 | L468: 12 | M468: 90 | O468: 15 | P468: 14 | Q468: 104 | S468: CASEY | W468: GEELONG WEST | X468: 5 | Y468: 4 | Z468: 0 | AA468: 999 | AB468: 1000 | AC468: =(AA468/AB468)*100 -> 99.9 | AD468: =(X468*4)+(Z468*2) -> 20
A469: BEST PLAYERS | W469: SPRINGVALE | X469: 4 | Y469: 5 | Z469: 0 | AA469: 876 | AB469: 1077 | AC469: =(AA469/AB469)*100 -> 81.337047353760454 | AD469: =(X469*4)+(Z469*2) -> 16
A470: WILLIAMSTOWN | C470: SEMMONS | F470: KERSHAW | I470: HUGHES | L470: CAHILL | O470: SWANN | Q470: FOTHERINGHAM | W470: FRANKSTON | X470: 3 | Y470: 6 | Z470: 0 | AA470: 1138 | AB470: 1086 | AC470: =(AA470/AB470)*100 -> 104.78821362799265 | AD470: =(X470*4)+(Z470*2) -> 12
A471: PRESTON | C471: SALVADORE | F471: BRINE | I471: BEER | L471: ZERELLA | W471: PRAHRAN | X471: 2 | Y471: 6 | Z471: 1 | AA471: 968 | AB471: 1286 | AC471: =(AA471/AB471)*100 -> 75.272161741835149 | AD471: =(X471*4)+(Z471*2) -> 10
A472: GOALKICKERS | W472: CAMBERWELL | X472: 2 | Y472: 7 | Z472: 0 | AA472: 1033 | AB472: 1367 | AC472: =(AA472/AB472)*100 -> 75.566934893928305 | AD472: =(X472*4)+(Z472*2) -> 8
A473: WILLIAMSTOWN | C473: FOTHERINGHAM 8 | G473: RICKMAN 3 | J473: CAHILL 3 | M473: TAYLOR | O473: SEMMONS | Q473: HOLDER | W473: WERRIBEE | X473: 1 | Y473: 8 | Z473: 0 | AA473: 853 | AB473: 1483 | AC473: =(AA473/AB473)*100 -> 57.518543492919761 | AD473: =(X473*4)+(Z473*2) -> 4
A474: PRESTON | C474: SHAW 2 | E474: KEENAN 2 | G474: SALVADORE 2 | J474: ZERELLA 2 | M474: WARREN | O474: HACKNEY | Q474: BRINE | S474: JORDAN | W474: BOX HILL | X474: 0 | Y474: 8 | Z474: 1 | AA474: 912 | AB474: 1573 | AC474: =(AA474/AB474)*100 -> 57.97838525111252 | AD474: =(X474*4)+(Z474*2) -> 2
L475: LUMICISI | O475: DUNBAR | R475: FYFFE
A476: SPRINGVALE | C476: 4 | D476: 5 | E476: 29 | G476: 6 | H476: 9 | I476: 45 | K476: 10 | L476: 11 | M476: 71 | O476: 13 | P476: 16 | Q476: 94 | S476: VENUE: SPRINGVALE
A477: WERRIBEE | C477: 2 | D477: 8 | E477: 20 | G477: 5 | H477: 8 | I477: 38 | K477: 9 | L477: 9 | M477: 63 | O477: 12 | P477: 12 | Q477: 84 | S477: MARCY :WALKER
A478: BEST PLAYERS
A479: SPRINGVALE | C479: DUDLEY | F479: MENDE | I479: DEMPSTER | L479: MEADE | O479: KING | R479: CLARKE
A480: WERRIBEE | C480: REDENBACH | F480: WALPOLE | I480: DUNSTAN | L480: FEDKE | O480: FREEMAN
A481: GOALKICKERS
A482: SPRINGVALE | C482: CLARKE 5 | F482: SMITH 2 | H482: HOLDEN 2 | J482: COFFEY 2 | L482: GRAY | N482: NANFRA
A483: WERRIBEE | C483: CHRISTIANSEN 3 | G483: FREEMAN 3 | J483: BONAT 2 | L483: DUNSTAN 2 | N483: RICHARDSON 2
A485: COBURG | C485: 6 | D485: 1 | E485: 37 | G485: 9 | H485: 5 | I485: 59 | K485: 13 | L485: 10 | M485: 88 | O485: 18 | P485: 13 | Q485: 121 | S485: VENUE: FRANKSTON
A486: FRANKSTON | C486: 5 | D486: 1 | E486: 31 | G486: 7 | H486: 4 | I486: 46 | K486: 10 | L486: 9 | M486: 69 | O486: 12 | P486: 15 | Q486: 87 | S486: MARSHALL :PHILLIPS
A487: BEST PLAYERS
A488: COBURG | C488: MANSFIELD | F488: TULLOCH | I488: WEBSTER | L488: HARBINSON | O488: FISHER | R488: LITTLER
A489: FRANKSTON | C489: HORLER | F489: MOORE | I489: BEATON | L489: BRIESE
A490: GOALKICKERS
A491: COBURG | C491: WEBSTER 6 | F491: TULLOCH 3 | I491: FISHER 2 | K491: GIBB 2 | M491: HALBERT | O491: XANON | Q491: MANSFIELD | S491: FREEMAN | U491: LITTLER
A492: FRANKSTON | C492: CALLAGHAN 4 | F492: ROGERSON 3 | I492: HILTON 2 | K492: BELL | M492: MOORE | O492: R KANE
A494: PORT MELBOURNE | C494: 7 | D494: 6 | E494: 48 | G494: 13 | H494: 9 | I494: 87 | K494: 18 | L494: 15 | M494: 123 | O494: 25 | P494: 18 | Q494: 168 | S494: VENUE: PORT MELBOURNE
A495: CAMBERWELL | C495: 4 | D495: 0 | E495: 24 | G495: 9 | H495: 2 | I495: 56 | K495: 12 | L495: 8 | M495: 80 | O495: 18 | P495: 8 | Q495: 116 | S495: MORGAN :BREWER
A496: BEST PLAYERS
A497: PORT MELBOURNE | C497: FITZPATRICK | F497: COOPER | I497: PETRAGLIA | L497: JOHNSON | O497: CHADBAND
A498: CAMBERWELL | C498: JUDD | F498: CONSTANTINOU | I498: DANS | L498: DAVIDSON | O498: DE KONNING | R498: BANKS
A499: GOALKICKERS
A500: PORT MELBOURNE | C500: FITZPATRICK 12 | F500: BOYD 5 | H500: EBEYER 2 | J500: BRIEDIS 2 | M500: HARKINS | O500: PETRAGLIA | Q500: BEVILAQUA | S500: SWAN
A501: CAMBERWELL | C501: FREW 4 | E501: HIPWORTH 3 | H501: ROURKE 3 | J501: DAVIDSON 2 | M501: SCOTT 2 | O501: CALLENDER | Q501: GRAY | R501: BURMEISTER | U501: CONSTANTINOU
A503: PRAHRAN | C503: 1 | D503: 1 | E503: 7 | G503: 6 | H503: 5 | I503: 41 | K503: 10 | L503: 12 | M503: 72 | O503: 12 | P503: 14 | Q503: 86 | S503: VENUE: TOORAK PARK
A504: BOX HILL | C504: 4 | D504: 4 | E504: 28 | G504: 8 | H504: 8 | I504: 56 | K504: 8 | L504: 11 | M504: 59 | O504: 11 | P504: 20 | Q504: 86 | S504: GLEESON :BLACK
A505: BEST PLAYERS
A506: PRAHRAN | C506: GILES | F506: GALT | I506: WALDER
A507: BOX HILL | C507: McGHIE | F507: ROCHOW | I507: TEAKEL | L507: GARTH | N507: GLEESON | Q507: NICHOLSON
A508: GOALKICKERS
A509: PRAHRAN | C509: GALT 8 | E509: TAPPING 2 | H509: T McDONALD | K509: CHRISTIE
A510: BOX HILL | C510: LONGHAM 2 | F510: HOWARTH 2 | I510: NICHOLSON 2 | L510: DODD 2 | N510: GARTH | P510: ROCHOW | R510: McGHIE
A512: ROUND 10 | D512: 30TH JUNE | I512: WEATHER | S512: VENUE: CAMBERWELL
D513: 1ST QTR | H513: 2ND QTR | L513: 3RD QTR | P513: FINAL | S513: UMPIRES
A514: CAMBERWELL | C514: 8 | D514: 3 | E514: 51 | G514: 10 | H514: 6 | I514: 66 | K514: 16 | L514: 13 | M514: 109 | O514: 16 | P514: 14 | Q514: 110 | S514: BLACK | X514: LADDER | AB514: ROUND | AD514: 10
A515: SPRINGVALE | C515: 5 | D515: 2 | E515: 32 | G515: 7 | H515: 7 | I515: 49 | K515: 7 | L515: 7 | M515: 49 | O515: 13 | P515: 14 | Q515: 92 | S515: GLEESON
A516: BEST PLAYERS | W516: TEAM | X516: W | Y516: L | Z516: D | AA516: FOR | AB516: AGST | AC516: % | AD516: PTS
A517: CAMBERWELL | C517: PEVITT | F517: DE KONNING | I517: BUDGE | L517: S ROURKE | O517: CONSTANTINOU | R517: GRAY
A518: SPRINGVALE | C518: DEMPSTER | F518: CLARKE | I518: SMITH | W518: PRESTON | X518: 9 | Y518: 1 | Z518: 0 | AA518: 1498 | AB518: 963 | AC518: =(AA518/AB518)*100 -> 155.55555555555557 | AD518: =(X518*4)+(Z518*2) -> 36
A519: GOALKICKERS | Q519: S ROURKE | W519: SANDRINGHAM | X519: 9 | Y519: 1 | Z519: 0 | AA519: 1384 | AB519: 948 | AC519: =(AA519/AB519)*100 -> 145.99156118143461 | AD519: =(X519*4)+(Z519*2) -> 36
A520: CAMBERWELL | C520: WEATHERALD 5 | F520: DAVIDSON 3 | I520: MAILING 2 | K520: CONSTANTINOU 2 | N520: ANGUS | P520: FREW | R520: GRAY | W520: COBURG | X520: 8 | Y520: 2 | Z520: 0 | AA520: 1329 | AB520: 1058 | AC520: =(AA520/AB520)*100 -> 125.61436672967862 | AD520: =(X520*4)+(Z520*2) -> 32
A521: SPRINGVALE | C521: SMITH 3 | E521: CLARKE 3 | G521: COFFEY 2 | I521: HOWELL | K521: LETTS | M521: HOLDEN | O521: MALONI | Q521: GRAY | W521: PORT MELBOURNE | X521: 7 | Y521: 3 | Z521: 0 | AA521: 1426 | AB521: 997 | AC521: =(AA521/AB521)*100 -> 143.02908726178535 | AD521: =(X521*4)+(Z521*2) -> 28
S522: VENUE: BOX HILL
A523: PORT MELBOURNE | C523: 3 | D523: 3 | E523: 21 | G523: 7 | H523: 6 | I523: 48 | K523: 13 | L523: 14 | M523: 92 | O523: 16 | P523: 15 | Q523: 111 | S523: STEERE | W523: WILLIAMSTOWN | X523: 7 | Y523: 3 | Z523: 0 | AA523: 1401 | AB523: 1033 | AC523: =(AA523/AB523)*100 -> 135.6243949661181 | AD523: =(X523*4)+(Z523*2) -> 28
A524: BOX HILL | C524: 2 | D524: 5 | E524: 17 | G524: 2 | H524: 9 | I524: 21 | K524: 5 | L524: 12 | M524: 42 | O524: 7 | P524: 14 | Q524: 56 | S524: HUTCHINSON | W524: GEELONG WEST | X524: 6 | Y524: 4 | Z524: 0 | AA524: 1161 | AB524: 1102 | AC524: =(AA524/AB524)*100 -> 105.35390199637023 | AD524: =(X524*4)+(Z524*2) -> 24
A525: BEST PLAYERS | W525: SPRINGVALE | X525: 4 | Y525: 6 | Z525: 0 | AA525: 968 | AB525: 1187 | AC525: =(AA525/AB525)*100 -> 81.550126368997482 | AD525: =(X525*4)+(Z525*2) -> 16
A526: PORT MELBOURNE | C526: SWAN | F526: COOPER | I526: THOMPSON | L526: ROBERTSON | O526: HARKINS | R526: JOHNSON | W526: FRANKSTON | X526: 3 | Y526: 7 | Z526: 0 | AA526: 1244 | AB526: 1203 | AC526: =(AA526/AB526)*100 -> 103.40814630091437 | AD526: =(X526*4)+(Z526*2) -> 12
A527: BOX HILL | C527: ROCHOW | F527: WITNISH | I527: GLEESON | L527: BOLTON | O527: BROWN | W527: CAMBERWELL | X527: 3 | Y527: 7 | Z527: 0 | AA527: 1143 | AB527: 1459 | AC527: =(AA527/AB527)*100 -> 78.341329677861552 | AD527: =(X527*4)+(Z527*2) -> 12
A528: GOALKICKERS | W528: PRAHRAN | X528: 2 | Y528: 7 | Z528: 1 | AA528: 1070 | AB528: 1448 | AC528: =(AA528/AB528)*100 -> 73.895027624309392 | AD528: =(X528*4)+(Z528*2) -> 10
A529: PORT MELBOURNE | C529: SWAN 4 | F529: FITZPATRICK 3 | I529: BOYD 2 | K529: HARKINS 2 | M529: JOHNSON 2 | P529: RODDA | Q529: GOSS | R529: McBROOM | W529: WERRIBEE | X529: 1 | Y529: 9 | Z529: 0 | AA529: 937 | AB529: 1605 | AC529: =(AA529/AB529)*100 -> 58.380062305295951 | AD529: =(X529*4)+(Z529*2) -> 4
A530: BOX HILL | C530: BOLTON 3 | F530: LONGHAM 2 | I530: HOWARTH | L530: ROCHOW | W530: BOX HILL | X530: 0 | Y530: 9 | Z530: 1 | AA530: 968 | AB530: 1684 | AC530: =(AA530/AB530)*100 -> 57.482185273159146 | AD530: =(X530*4)+(Z530*2) -> 2
A532: GEELONG WEST | C532: 7 | D532: 3 | E532: 45 | G532: 14 | H532: 4 | I532: 88 | K532: 18 | L532: 9 | M532: 117 | O532: 25 | P532: 12 | Q532: 162 | S532: VENUE: GEELONG WEST
A533: PRAHRAN | C533: 4 | D533: 3 | E533: 27 | G533: 6 | H533: 6 | I533: 42 | K533: 8 | L533: 9 | M533: 57 | O533: 15 | P533: 12 | Q533: 102 | S533: FITZPATRICK :MORGAN
A534: BEST PLAYERS
A535: GEELONG WEST | C535: DALIHAUS | F535: WATT | I535: KRANJC | L535: McDOWELL | O535: DOYLE
A536: PRAHRAN | C536: ELLIOTT | F536: McDONALD
A537: GOALKICKERS
A538: GEELONG WEST | C538: DOYLE 8 | F538: CONNELLY 5 | I538: McDOWELL 4 | L538: TOULMIN 3 | N538: AUSTIN 3 | P538: WELSH | R538: BERRY
A539: PRAHRAN | C539: GALT 4 | F539: MILLS 3 | H539: McDONALD 3 | K539: SOULOS 2 | N539: GRAMBEAU | Q539: TORCASIO | S539: BERRY
A541: PRESTON | C541: 3 | D541: 2 | E541: 20 | G541: 7 | H541: 6 | I541: 48 | K541: 11 | L541: 7 | M541: 73 | O541: 17 | P541: 15 | Q541: 117 | S541: VENUE: PRESTON
A542: FRANKSTON | C542: 2 | D542: 4 | E542: 16 | G542: 4 | H542: 5 | I542: 29 | K542: 12 | L542: 9 | M542: 81 | O542: 16 | P542: 10 | Q542: 106 | S542: MARCY ;BLAKE
A543: BEST PLAYERS
A544: PRESTON | C544: KEENAN | F544: HACKNEY | I544: SALVADORE | L544: SHAW | O544: BRINE | R544: JORDAN
A545: FRANKSTON | C545: SANDFORD | F545: BELL | I545: BOLAND | L545: BARDOEL | O545: WALSH | R545: CALLAGHAN
A546: GOALKICKERS
A547: PRESTON | C547: SHAW 8 | F547: SALVADOR 5 | I547: LUMICISI 2 | L547: McCANN | N547: FYFFE
A548: FRANKSTON | C548: BARDOEL 5 | F548: BOYD 5 | H548: BELL 3 | J548: CALLAGHAN | M548: GILBERT | O548: R KANE
A550: COBURG | C550: 3 | D550: 3 | E550: 21 | G550: 4 | H550: 7 | I550: 31 | K550: 11 | L550: 9 | M550: 75 | O550: 18 | P550: 14 | Q550: 122 | S550: VENUE: WERRIBEE
A551: WERRIBEE | C551: 4 | D551: 2 | E551: 26 | G551: 8 | H551: 6 | I551: 54 | K551: 9 | L551: 8 | M551: 62 | O551: 12 | P551: 12 | Q551: 84 | S551: BREWER :CASEY
A552: BEST PLAYERS
A553: COBURG | C553: NIMMO | F553: EVANS | I553: WEBSTER | L553: SHELDON | O553: CLEARY | R553: LITTLER
A554: WERRIBEE | C554: FEDKE | F554: REDENBACH | I554: S MOLONEY | L554: DUNSTAN | O554: CORDY | R554: FRAZER
A555: GOALKICKERS
A556: COBURG | C556: WEBSTER 6 | F556: MANSFIELD 3 | I556: FREEMAN 3 | L556: NIMMO 2 | N556: EDWARDS 2 | Q556: FISHER | S556: FITZPATRICK
A557: WERRIBEE | C557: CORDY 3 | F557: RICHARDSON 3 | I557: REDENBACH 2 | L557: DUNSTAN | N557: FRAZER | P557: FREEMAN | R557: GUINTA
A559: WILLIAMSTOWN | C559: 3 | D559: 2 | E559: 20 | G559: 11 | H559: 7 | I559: 73 | K559: 12 | L559: 7 | M559: 79 | O559: 17 | P559: 11 | Q559: 113 | S559: VENUE: WILLIAMSTOWN
A560: SANDRINGHAM | C560: 2 | D560: 5 | E560: 17 | G560: 4 | H560: 10 | I560: 34 | K560: 12 | L560: 13 | M560: 85 | O560: 15 | P560: 15 | Q560: 105 | S560: MARSHALL :WALKER
A561: BEST PLAYERS
A562: WILLIAMSTOWN | C562: DAVIDSON | F562: HUGHES | I562: MURPHY | L562: KERSHAW | O562: FOTHERINGHAM | R562: WHEELER
A563: SANDRINGHAM | C563: BEILBY | F563: FITZPATRICK | I563: MACLEOD | L563: PRATT | O563: EAVES
A564: GOALKICKERS
A565: WILLIAMSTOWN | C565: FOTHERINGHAM 7 | G565: DAVIDSON 2 | J565: HOLDER 2 | M565: HUGHES 2 | O565: WEIR 2 | Q565: SIMMONS | S565: RICKMAN
A566: SANDRINGHAM | C566: MORRISON 3 | F566: BREWER 3 | I566: MACLEOD | K566: EAVES | M566: BRIAN SAID | P566: BINGHAM | R566: ADAMS
A568: ROUND 11 | D568: 7TH JULY | I568: WEATHER | S568: VENUE: FRANKSTON
D569: 1ST QTR | H569: 2ND QTR | L569: 3RD QTR | P569: FINAL | S569: UMPIRES
A570: FRANKSTON | C570: 3 | D570: 5 | E570: 23 | G570: 4 | H570: 7 | I570: 31 | K570: 10 | L570: 9 | M570: 69 | O570: 14 | P570: 12 | Q570: 96 | S570: OAKLEY | X570: LADDER | AB570: ROUND | AD570: 11
A571: WERRIBEE | C571: 3 | D571: 4 | E571: 22 | G571: 6 | H571: 9 | I571: 45 | K571: 10 | L571: 11 | M571: 71 | O571: 12 | P571: 13 | Q571: 85 | S571: GLEESON
A572: BEST PLAYERS | W572: TEAM | X572: W | Y572: L | Z572: D | AA572: FOR | AB572: AGST | AC572: % | AD572: PTS
A573: FRANKSTON | C573: COUSINS | F573: BELL | I573: BEATON | L573: SANDFORD | O573: BOLAND | R573: MOORE
A574: WERRIBEE | C574: RICHARDSON | F574: CHRISTIANSEN | I574: REDENBACH | L574: KEIGHRAN | O574: PERKINS | R574: DUNSTAN | W574: SANDRINGHAM | X574: 10 | Y574: 1 | Z574: 0 | AA574: 1507 | AB574: 1059 | AC574: =(AA574/AB574)*100 -> 142.30406043437205 | AD574: =(X574*4)+(Z574*2) -> 40
A575: GOALKICKERS | W575: PRESTON | X575: 9 | Y575: 2 | Z575: 0 | AA575: 1609 | AB575: 1086 | AC575: =(AA575/AB575)*100 -> 148.15837937384899 | AD575: =(X575*4)+(Z575*2) -> 36
A576: FRANKSTON | C576: BOYD 5 | F576: BARDOEL 3 | I576: CALLAGHAN 2 | L576: BELL | M576: BEATON | O576: COUSINS | Q576: CROWDER | W576: COBURG | X576: 9 | Y576: 2 | Z576: 0 | AA576: 1485 | AB576: 1148 | AC576: =(AA576/AB576)*100 -> 129.35540069686411 | AD576: =(X576*4)+(Z576*2) -> 36
A577: WERRIBEE | C577: GOODE 4 | F577: KEIGHRAN 3 | I577: FREEMAN 2 | L577: REDENBACH | O577: FRAZER | Q577: RICHARDSON | W577: PORT MELBOURNE | X577: 8 | Y577: 3 | Z577: 0 | AA577: 1526 | AB577: 1068 | AC577: =(AA577/AB577)*100 -> 142.88389513108615 | AD577: =(X577*4)+(Z577*2) -> 32
S578: VENUE: COBURG
A579: COBURG | C579: 5 | D579: 1 | E579: 31 | G579: 9 | H579: 7 | I579: 61 | K579: 15 | L579: 10 | M579: 100 | O579: 23 | P579: 18 | Q579: 156 | S579: BLAKE | W579: WILLIAMSTOWN | X579: 8 | Y579: 3 | Z579: 0 | AA579: 1527 | AB579: 1135 | AC579: =(AA579/AB579)*100 -> 134.53744493392071 | AD579: =(X579*4)+(Z579*2) -> 32
A580: CAMBERWELL | C580: 4 | D580: 4 | E580: 28 | G580: 6 | H580: 5 | I580: 41 | K580: 9 | L580: 9 | M580: 63 | O580: 13 | P580: 12 | Q580: 90 | S580: VERGONA | W580: GEELONG WEST | X580: 6 | Y580: 5 | Z580: 0 | AA580: 1232 | AB580: 1202 | AC580: =(AA580/AB580)*100 -> 102.49584026622296 | AD580: =(X580*4)+(Z580*2) -> 24
A581: BEST PLAYERS | W581: FRANKSTON | X581: 4 | Y581: 7 | Z581: 0 | AA581: 1340 | AB581: 1288 | AC581: =(AA581/AB581)*100 -> 104.03726708074534 | AD581: =(X581*4)+(Z581*2) -> 16
A582: COBURG | C582: HARBINSON | F582: CLEARY | I582: TULLOCH | L582: FREEMAN | O582: NIMMO | W582: SPRINGVALE | X582: 4 | Y582: 7 | Z582: 0 | AA582: 1057 | AB582: 1312 | AC582: =(AA582/AB582)*100 -> 80.564024390243901 | AD582: =(X582*4)+(Z582*2) -> 16
A583: CAMBERWELL | C583: BUDGE | F583: FREW | I583: WEATHERALD | L583: CONSTANTINOU | O583: DE KONNING | R583: PEVITT | W583: CAMBERWELL | X583: 3 | Y583: 8 | Z583: 0 | AA583: 1233 | AB583: 1615 | AC583: =(AA583/AB583)*100 -> 76.346749226006196 | AD583: =(X583*4)+(Z583*2) -> 12
A584: GOALKICKERS | N584: NIMMO | P584: HARBINSON | R584: SCARPINO | W584: PRAHRAN | X584: 2 | Y584: 8 | Z584: 1 | AA584: 1172 | AB584: 1574 | AC584: =(AA584/AB584)*100 -> 74.459974587039397 | AD584: =(X584*4)+(Z584*2) -> 10
A585: COBURG | C585: FISHER 3 | E585: MANSFIELD 3 | H585: CLEARY 3 | J585: FREEMAN 3 | M585: HALBERT 2 | O585: SHELDON 2 | Q585: TULLOCH 2 | S585: WEBSTER 2 | W585: BOX HILL | X585: 1 | Y585: 9 | Z585: 1 | AA585: 1093 | AB585: 1773 | AC585: =(AA585/AB585)*100 -> 61.646926113931187 | AD585: =(X585*4)+(Z585*2) -> 6
A586: CAMBERWELL | C586: WEATHERALD 8 | F586: FREW 2 | H586: DREW | J586: CONSTANTINOU | N586: C ROURKE | W586: WERRIBEE | X586: 1 | Y586: 10 | Z586: 0 | AA586: 1022 | AB586: 1701 | AC586: =(AA586/AB586)*100 -> 60.082304526748977 | AD586: =(X586*4)+(Z586*2) -> 4
A588: WILLIAMSTOWN | C588: 3 | D588: 7 | E588: 25 | G588: 4 | H588: 10 | I588: 34 | K588: 10 | L588: 15 | M588: 75 | O588: 18 | P588: 18 | Q588: 126 | S588: VENUE: TOORAK PARK
A589: PRAHRAN | C589: 2 | D589: 4 | E589: 16 | G589: 6 | H589: 8 | I589: 44 | K589: 9 | L589: 10 | M589: 64 | O589: 15 | P589: 12 | Q589: 102 | S589: BREWER :MARCY
A590: BEST PLAYERS
A591: WILLIAMSTOWN | C591: MURPHY | F591: SLEVISON | I591: HORTON | L591: TAYLOR | O591: FOTHERINGHAM | R591: HUGHES
A592: PRAHRAN | C592: BARNARD | F592: GILES | I592: McCORMACK | L592: REED | O592: P McDONALD
A593: GOALKICKERS
A594: WILLIAMSTOWN | C594: FOTHERINGHAM 8 | G594: DIMARTINO 3 | J594: TAYLOR 2 | M594: HUGHES | O594: BARNETT | Q594: SLEVISON | S594: SIMMONS | U594: WEIR
A595: PRAHRAN | C595: MILLS 4 | E595: SOULOS 3 | G595: GALT 3 | I595: TORCASIO 2 | L595: P McDONALD | O595: WALLACE | Q595: P TAYLOR
A597: PORT MELBOURNE | C597: 2 | D597: 6 | E597: 18 | G597: 5 | H597: 9 | I597: 39 | K597: 11 | L597: 14 | M597: 80 | O597: 14 | P597: 16 | Q597: 100 | S597: VENUE: PORT MELBOURNE
A598: GEELONG WEST | C598: 0 | D598: 2 | E598: 2 | G598: 5 | H598: 6 | I598: 36 | K598: 5 | L598: 9 | M598: 39 | O598: 10 | P598: 11 | Q598: 71 | S598: MARSHALL :G CASEY
A599: BEST PLAYERS
A600: PORT MELBOURNE | C600: CHADBAND | F600: COOPER | I600: GOSS | L600: HARKINS | O600: ROBERTSON | R600: ROSS
A601: GEELONG WEST | C601: DALIHAUS | F601: WATT | I601: GIBSON | L601: REDHEAD
A602: GOALKICKERS
A603: PORT MELBOURNE | C603: FITZPATRICK 3 | F603: HARKINS 3 | I603: JOHNSON 2 | L603: EBEYER 2 | N603: GOSS | P603: BOYD | R603: McBROOM | U603: SWAN
A604: GEELONG WEST | C604: DOYLE 2 | F604: WELSH 2 | H604: NORTH 2 | J604: DALIHAUS | M604: HEWITT | O604: HAMMOND | Q604: WATT
A606: BOX HILL | C606: 4 | D606: 5 | E606: 29 | G606: 10 | H606: 11 | I606: 71 | K606: 13 | L606: 14 | M606: 92 | O606: 18 | P606: 17 | Q606: 125 | S606: VENUE: SPRINGVALE
A607: SPRINGVALE | C607: 2 | D607: 6 | E607: 18 | G607: 7 | H607: 11 | I607: 53 | K607: 8 | L607: 14 | M607: 62 | O607: 12 | P607: 17 | Q607: 89 | S607: MORGAN :PHILLIPS
A608: BEST PLAYERS
A609: BOX HILL | C609: TEAKEL | F609: CUFF | I609: McGHEE | L609: GOODWIN | O609: GARTH | Q609: GLEESON
A610: SPRINGVALE | C610: MENDE | F610: MEADE | I610: CLARKE | L610: MALONI
A611: GOALKICKERS
A612: BOX HILL | C612: GARTH 4 | E612: TEAKEL 4 | G612: NICHOLSON 3 | J612: BOLTON 3 | M612: LONGHAM 2 | O612: LEMON | Q612: CUFF
A613: SPRINGVALE | C613: CLARKE 2 | E613: McCOMB 2 | G613: DUDLEY | I613: SMITH | K613: MEADE | M613: HOLDEN | O613: SUTHERLAND | R613: COSGROVE | U613: COFFEY | W613: MALONI
A615: SANDRINGHAM | C615: 5 | D615: 10 | E615: 40 | G615: 5 | H615: 13 | I615: 43 | K615: 11 | L615: 17 | M615: 83 | O615: 17 | P615: 21 | Q615: 123 | S615: VENUE: BEACH ROAD
A616: PRESTON | C616: 2 | D616: 1 | E616: 13 | G616: 5 | H616: 2 | I616: 32 | K616: 12 | L616: 5 | M616: 77 | O616: 17 | P616: 9 | Q616: 111 | S616: BLAKE :FITZPATRICK
A617: BEST PLAYERS
A618: SANDRINGHAM | C618: BEILBY | F618: MACLEOD | I618: COLLINS | L618: GALLAGHER | O618: MERCER | R618: KRISTENSEN
A619: PRESTON | C619: SHAW | F619: DINTINOSANTE | I619: SALVADORE | L619: HACKNEY | O619: BEER | R619: WIGHT
A620: GOALKICKERS
A621: SANDRINGHAM | C621: BREWER 5 | F621: MORRISON 4 | I621: MACLEOD 3 | L621: KRISTENSEN 2 | O621: COLLINS | Q621: GALLAGHER | T621: BRIAN SAID
A622: PRESTON | C622: SHAW 4 | F622: KEENAN 3 | I622: SALVADORE 3 | L622: JORDAN 2 | N622: LUMICISI 2 | Q622: FYFFE | S622: HACKNEY | V622: WIGHT
A624: ROUND 12 | D624: 14TH JULY | I624: WEATHER | S624: VENUE: FRANKSTON
D625: 1ST QTR | H625: 2ND QTR | L625: 3RD QTR | P625: FINAL | S625: UMPIRES
A626: SANDRINGHAM | C626: 1 | D626: 4 | E626: 10 | G626: 3 | H626: 7 | I626: 25 | K626: 3 | L626: 12 | M626: 30 | O626: 15 | P626: 15 | Q626: 105 | S626: MORGAN | X626: LADDER | AB626: ROUND | AD626: 12
A627: FRANKSTON | C627: 3 | D627: 2 | E627: 20 | G627: 4 | H627: 4 | I627: 28 | K627: 5 | L627: 8 | M627: 38 | O627: 6 | P627: 8 | Q627: 44 | S627: G CASEY
A628: BEST PLAYERS | W628: TEAM | X628: W | Y628: L | Z628: D | AA628: FOR | AB628: AGST | AC628: % | AD628: PTS
A629: SANDRINGHAM | C629: MERCER | F629: PRATT | I629: ADAMS | L629: MANNIX | O629: BEILBY | R629: MACLEOD
A630: FRANKSTON | C630: RAVEN | F630: BEATON | I630: MOORE | L630: BOLAND | W630: SANDRINGHAM | X630: 11 | Y630: 1 | Z630: 0 | AA630: 1612 | AB630: 1102 | AC630: =(AA630/AB630)*100 -> 146.27949183303087 | AD630: =(X630*4)+(Z630*2) -> 44
A631: GOALKICKERS | W631: PRESTON | X631: 10 | Y631: 2 | Z631: 0 | AA631: 1724 | AB631: 1172 | AC631: =(AA631/AB631)*100 -> 147.09897610921502 | AD631: =(X631*4)+(Z631*2) -> 40
A632: SANDRINGHAM | C632: MORRISON 6 | F632: DIPIERDOMENICO 3 | J632: EAVES 2 | L632: MANNIX | N632: KRISTENSEN | Q632: MACLEOD | S632: COLLINS | W632: COBURG | X632: 10 | Y632: 2 | Z632: 0 | AA632: 1678 | AB632: 1229 | AC632: =(AA632/AB632)*100 -> 136.53376729048006 | AD632: =(X632*4)+(Z632*2) -> 40
A633: FRANKSTON | C633: BOYD 2 | F633: ROGERSON 2 | I633: KANE | K633: LANE | W633: PORT MELBOURNE | X633: 9 | Y633: 3 | Z633: 0 | AA633: 1617 | AB633: 1120 | AC633: =(AA633/AB633)*100 -> 144.375 | AD633: =(X633*4)+(Z633*2) -> 36
S634: VENUE: TOORAK PARK
A635: PRESTON | C635: 6 | D635: 9 | E635: 45 | G635: 7 | H635: 13 | I635: 55 | K635: 14 | L635: 21 | M635: 105 | O635: 15 | P635: 25 | Q635: 115 | S635: WALKER | W635: WILLIAMSTOWN | X635: 8 | Y635: 4 | Z635: 0 | AA635: 1579 | AB635: 1226 | AC635: =(AA635/AB635)*100 -> 128.79282218597064 | AD635: =(X635*4)+(Z635*2) -> 32
A636: PRAHRAN | C636: 3 | D636: 1 | E636: 19 | G636: 6 | H636: 4 | I636: 40 | K636: 7 | L636: 5 | M636: 47 | O636: 13 | P636: 8 | Q636: 86 | S636: PHILLIPS | W636: GEELONG WEST | X636: 6 | Y636: 6 | Z636: 0 | AA636: 1302 | AB636: 1298 | AC636: =(AA636/AB636)*100 -> 100.30816640986133 | AD636: =(X636*4)+(Z636*2) -> 24
A637: BEST PLAYERS | W637: SPRINGVALE | X637: 5 | Y637: 7 | Z637: 0 | AA637: 1153 | AB637: 1382 | AC637: =(AA637/AB637)*100 -> 83.429811866859623 | AD637: =(X637*4)+(Z637*2) -> 20
A638: PRESTON | C638: SALVADORE | F638: JORDAN | I638: FYFFE | L638: WIGHT | O638: GOUGH | R638: HACKNEY | W638: FRANKSTON | X638: 4 | Y638: 8 | Z638: 0 | AA638: 1384 | AB638: 1393 | AC638: =(AA638/AB638)*100 -> 99.353912419239052 | AD638: =(X638*4)+(Z638*2) -> 16
A639: PRAHRAN | C639: MILLS | F639: GILES | I639: McCORMACK | L639: ELLETT | O639: P McDONALD | W639: CAMBERWELL | X639: 4 | Y639: 8 | Z639: 0 | AA639: 1360 | AB639: 1712 | AC639: =(AA639/AB639)*100 -> 79.43925233644859 | AD639: =(X639*4)+(Z639*2) -> 16
A640: GOALKICKERS | W640: PRAHRAN | X640: 2 | Y640: 9 | Z640: 1 | AA640: 1258 | AB640: 1689 | AC640: =(AA640/AB640)*100 -> 74.481941977501478 | AD640: =(X640*4)+(Z640*2) -> 10
A641: PRESTON | C641: SHAW 6 | F641: SALVADORE 5 | I641: JORDAN 2 | K641: BEER | M641: HACKNEY | W641: BOX HILL | X641: 1 | Y641: 10 | Z641: 1 | AA641: 1174 | AB641: 1965 | AC641: =(AA641/AB641)*100 -> 59.74554707379135 | AD641: =(X641*4)+(Z641*2) -> 6
A642: PRAHRAN | C642: MILLS 8 | F642: GILES 2 | I642: TAPPING | K642: CHRISTIE | M642: GALT | W642: WERRIBEE | X642: 1 | Y642: 11 | Z642: 0 | AA642: 1119 | AB642: 1828 | AC642: =(AA642/AB642)*100 -> 61.214442013129101 | AD642: =(X642*4)+(Z642*2) -> 4
A644: SPRINGVALE | C644: 4 | D644: 5 | E644: 29 | G644: 5 | H644: 7 | I644: 37 | K644: 10 | L644: 11 | M644: 71 | O644: 14 | P644: 12 | Q644: 96 | S644: VENUE: SPRINGVALE
A645: GEELONG WEST | C645: 3 | D645: 1 | E645: 19 | G645: 7 | H645: 8 | I645: 50 | K645: 8 | L645: 10 | M645: 58 | O645: 9 | P645: 16 | Q645: 70 | S645: BLAKE :STEERE
A646: BEST PLAYERS
A647: SPRINGVALE | C647: CADDAYE | F647: STANLEY | I647: DEMPSTER | L647: MALONI
A648: GEELONG WEST | C648: DALIHAUS | F648: WELSH | I648: BERRY | L648: PERKINS | O648: GIBSON
A649: GOALKICKERS
A650: SPRINGVALE | C650: CADDAYE 4 | F650: HOLDEN 2 | I650: STANLEY 2 | L650: JESS 2 | N650: GRAY | P650: TONKIN | R650: DEMPSTER | U650: MALONI
A651: GEELONG WEST | C651: WELSH 2 | F651: NORTH 2 | H651: HEWITT 2 | J651: MCDOWELL | M651: BERRY | O651: DOYLE
A653: PORT MELBOURNE | C653: 5 | D653: 0 | E653: 30 | G653: 8 | H653: 2 | I653: 50 | K653: 12 | L653: 8 | M653: 80 | O653: 13 | P653: 13 | Q653: 91 | S653: VENUE: PORT MELBOURNE
A654: WILLIAMSTOWN | C654: 3 | D654: 1 | E654: 19 | G654: 4 | H654: 3 | I654: 27 | K654: 5 | L654: 5 | M654: 35 | O654: 7 | P654: 10 | Q654: 52 | S654: VERGONA :OAKLEY
A655: BEST PLAYERS
A656: PORT MELBOURNE | C656: COOPER | F656: CHADBAND | I656: DERMOTT | L656: ROBERTSON | O656: JENNINGS | R656: HARKINS
A657: WILLIAMSTOWN | C657: SEMMONS | F657: MURPHY | I657: WHEELER
A658: GOALKICKERS
A659: PORT MELBOURNE | C659: FITZPATRICK 3 | F659: SWAN 2 | H659: JENNINGS 2 | K659: GOSS 2 | M659: McBROOM | O659: HOWE | Q659: HARKINS
A660: WILLIAMSTOWN | C660: FOTHERINGHAM 3 | G660: SIMMONS | I660: RICKMAN | K660: SAIT | M660: SLEVISON
A662: COBURG | C662: 9 | D662: 4 | E662: 58 | G662: 15 | H662: 5 | I662: 95 | K662: 26 | L662: 11 | M662: 167 | O662: 30 | P662: 12 | Q662: 192 | S662: VENUE: COBURG
A663: BOX HILL | C663: 0 | D663: 1 | E663: 1 | G663: 4 | H663: 8 | I663: 32 | K663: 4 | L663: 9 | M663: 33 | O663: 11 | P663: 15 | Q663: 81 | S663: MARCY :BLAKE
A664: BEST PLAYERS
A665: COBURG | C665: SHELDON | F665: ANGWIN | I665: CLEARY | L665: EDWARDS | O665: MANSFIELD | R665: FREEMAN
A666: BOX HILL | C666: McGHEE | F666: BOLTON | I666: CUFF | L666: BROWN | O666: GLEESON | R666: WITNISH
A667: GOALKICKERS
A668: COBURG | C668: WEBSTER 5 | E668: CLEARY 4 | G668: EDWARDS 4 | J668: TULLOCH 4 | M668: DOHNT 3 | O668: HALBERT 3 | Q668: MANSFIELD 3 | T668: FREEMAN 3 | W668: ZANON
A669: BOX HILL | C669: NICHOLSON 2 | F669: BOLTON 2 | I669: LONGHAM 2 | L669: GLEESON | N669: TEAKEL | P669: GARTH | R669: HOWARTH
A671: CAMBERWELL | C671: 5 | D671: 5 | E671: 35 | G671: 7 | H671: 10 | I671: 52 | K671: 9 | L671: 16 | M671: 70 | O671: 18 | P671: 19 | Q671: 127 | S671: VENUE: WERRIBEE
A672: WERRIBEE | C672: 5 | D672: 4 | E672: 34 | G672: 7 | H672: 8 | I672: 50 | K672: 11 | L672: 11 | M672: 77 | O672: 14 | P672: 13 | Q672: 97 | S672: MARSHALL :FITZPATRICK
A673: BEST PLAYERS
A674: CAMBERWELL | C674: WEATHERALD | F674: MAILING | I674: PEVITT | L674: DAVIDSON | O674: SCOTT
A675: WERRIBEE | C675: S MOLONEY | F675: DUNSTAN | I675: REDENBACH | L675: CHRISTIANSEN
A676: GOALKICKERS
A677: CAMBERWELL | C677: WEATHERALD 9 | F677: DAVIDSON 2 | I677: MAILING 2 | L677: PEVITT 2 | N677: SCOTT | P677: C ROURKE | S677: HAYES
A678: WERRIBEE | C678: MONTGOMERY 3 | F678: KEIGHRAN 3 | I678: S MOLONEY 2 | L678: GOOD 2 | N678: REDENBACH | Q678: DUNSTAN | S678: FREEMAN | V678: GRAY
A680: ROUND 13 | D680: 21ST JULY | I680: WEATHER | S680: VENUE: GEELONG WEST
D681: 1ST QTR | H681: 2ND QTR | L681: 3RD QTR | P681: FINAL | S681: UMPIRES
A682: COBURG | C682: 1 | D682: 8 | E682: 14 | G682: 4 | H682: 11 | I682: 35 | K682: 7 | L682: 15 | M682: 57 | O682: 11 | P682: 20 | Q682: 86 | S682: OAKLEY | X682: LADDER | AB682: ROUND | AD682: 13
A683: GEELONG WEST | C683: 2 | D683: 1 | E683: 13 | G683: 3 | H683: 6 | I683: 24 | K683: 6 | L683: 7 | M683: 43 | O683: 8 | P683: 10 | Q683: 58 | S683: GLEESON
A684: BEST PLAYERS | W684: TEAM | X684: W | Y684: L | Z684: D | AA684: FOR | AB684: AGST | AC684: % | AD684: PTS
A685: COBURG | C685: FREMANTLE | F685: EVANS | I685: ANGWIN | L685: MANSFIELD | O685: NIMMO | R685: SHELDON
A686: GEELONG WEST | C686: WATT | F686: NORTH | I686: McDOWELL | L686: GIBSON | O686: DALIHAUS | W686: SANDRINGHAM | X686: 12 | Y686: 1 | Z686: 0 | AA686: 1808 | AB686: 1212 | AC686: =(AA686/AB686)*100 -> 149.17491749174917 | AD686: =(X686*4)+(Z686*2) -> 48
A687: GOALKICKERS | W687: COBURG | X687: 11 | Y687: 2 | Z687: 0 | AA687: 1764 | AB687: 1287 | AC687: =(AA687/AB687)*100 -> 137.06293706293707 | AD687: =(X687*4)+(Z687*2) -> 44
A688: COBURG | C688: HALBERT 2 | F688: CLEARY 2 | I688: GRAHAM 2 | L688: EDWARDS 2 | N688: ZANON | P688: MANSFIELD | S688: LITTLER | W688: PORT MELBOURNE | X688: 10 | Y688: 3 | Z688: 0 | AA688: 1725 | AB688: 1196 | AC688: =(AA688/AB688)*100 -> 144.23076923076923 | AD688: =(X688*4)+(Z688*2) -> 40
A689: GEELONG WEST | C689: HADDOCK 2 | F689: HAMILTON | I689: GIBSON | K689: WELSH | M689: SIZE | O689: WATT | Q689: EVANS | W689: PRESTON | X689: 10 | Y689: 3 | Z689: 0 | AA689: 1800 | AB689: 1280 | AC689: =(AA689/AB689)*100 -> 140.625 | AD689: =(X689*4)+(Z689*2) -> 40
S690: VENUE: CAMBERWELL
A691: FRANKSTON | C691: 2 | D691: 4 | E691: 16 | G691: 7 | H691: 11 | I691: 53 | K691: 8 | L691: 12 | M691: 60 | O691: 15 | P691: 16 | Q691: 106 | S691: BREWER | W691: WILLIAMSTOWN | X691: 9 | Y691: 4 | Z691: 0 | AA691: 1711 | AB691: 1278 | AC691: =(AA691/AB691)*100 -> 133.88106416275429 | AD691: =(X691*4)+(Z691*2) -> 36
A692: CAMBERWELL | C692: 3 | D692: 3 | E692: 21 | G692: 5 | H692: 5 | I692: 35 | K692: 11 | L692: 8 | M692: 74 | O692: 12 | P692: 10 | Q692: 82 | S692: PHILLIPS | W692: GEELONG WEST | X692: 6 | Y692: 7 | Z692: 0 | AA692: 1360 | AB692: 1384 | AC692: =(AA692/AB692)*100 -> 98.265895953757223 | AD692: =(X692*4)+(Z692*2) -> 24
A693: BEST PLAYERS | W693: FRANKSTON | X693: 5 | Y693: 8 | Z693: 0 | AA693: 1490 | AB693: 1475 | AC693: =(AA693/AB693)*100 -> 101.01694915254238 | AD693: =(X693*4)+(Z693*2) -> 20
A694: FRANKSTON | C694: CZARNECKI | F694: BEATON | I694: LANE | L694: COLE | N694: RAVEN | Q694: RICHARDSON | W694: SPRINGVALE | X694: 5 | Y694: 8 | Z694: 0 | AA694: 1205 | AB694: 1514 | AC694: =(AA694/AB694)*100 -> 79.590488771466312 | AD694: =(X694*4)+(Z694*2) -> 20
A695: CAMBERWELL | C695: FREW | F695: GRAY | I695: MERCER | L695: DREW | N695: DE KONNING | Q695: CONSTANTINOU | W695: CAMBERWELL | X695: 4 | Y695: 9 | Z695: 0 | AA695: 1442 | AB695: 1818 | AC695: =(AA695/AB695)*100 -> 79.317931793179326 | AD695: =(X695*4)+(Z695*2) -> 16
A696: GOALKICKERS | Q696: CROWDER | W696: PRAHRAN | X696: 2 | Y696: 10 | Z696: 1 | AA696: 1368 | AB696: 1885 | AC696: =(AA696/AB696)*100 -> 72.57294429708223 | AD696: =(X696*4)+(Z696*2) -> 10
A697: FRANKSTON | C697: LANE 3 | E697: ROGERSON 3 | H697: CALLAGHAN 3 | K697: T O'BRIEN 2 | N697: BELL | P697: MOORE | R697: GILBERT | W697: BOX HILL | X697: 2 | Y697: 10 | Z697: 1 | AA697: 1275 | AB697: 2053 | AC697: =(AA697/AB697)*100 -> 62.104237700925481 | AD697: =(X697*4)+(Z697*2) -> 10
A698: CAMBERWELL | C698: MAILING 4 | F698: G DYSON 2 | I698: PEVITT 2 | K698: WEATHERALD | N698: SCOTT | P698: S ROURKE | W698: WERRIBEE | X698: 1 | Y698: 12 | Z698: 0 | AA698: 1207 | AB698: 1929 | AC698: =(AA698/AB698)*100 -> 62.57128045619492 | AD698: =(X698*4)+(Z698*2) -> 4
A700: BOX HILL | C700: 6 | D700: 2 | E700: 38 | G700: 9 | H700: 3 | I700: 57 | K700: 11 | L700: 3 | M700: 69 | O700: 16 | P700: 5 | Q700: 101 | S700: VENUE: BOX HILL
A701: WERRIBEE | C701: 3 | D701: 2 | E701: 20 | G701: 6 | H701: 7 | I701: 43 | K701: 10 | L701: 14 | M701: 74 | O701: 12 | P701: 16 | Q701: 88 | S701: WALKER :VERGONA
A702: BEST PLAYERS
A703: BOX HILL | C703: McGHEE | F703: GARTH | I703: NICHOLSON | L703: CUFF | O703: BROWN | R703: WITNISH
A704: WERRIBEE | C704: SPIERINGS | F704: MONTGOMERY | I704: OPIE | L704: RICHARDSON | O704: DUNSTAN | R704: WALPOLE
A705: GOALKICKERS
A706: BOX HILL | C706: LONGHAM 4 | F706: P BOLTON 3 | I706: GARTH 3 | K706: L BOLTON 2 | N706: ROCHOW | P706: GLEESON | R706: WITHERS | T706: McGHEE
A707: WERRIBEE | C707: GOOD 3 | F707: MONTGOMERY 3 | J707: RICHARDSON 3 | M707: BUCKINGHAM | P707: DUNSTAN | R707: GORDON
A709: SANDRINGHAM | C709: 9 | D709: 2 | E709: 56 | G709: 14 | H709: 5 | I709: 89 | K709: 25 | L709: 8 | M709: 158 | O709: 31 | P709: 10 | Q709: 196 | S709: VENUE: BEACH ROAD
A710: PRAHRAN | C710: 2 | D710: 2 | E710: 14 | G710: 9 | H710: 6 | I710: 60 | K710: 11 | L710: 10 | M710: 76 | O710: 16 | P710: 14 | Q710: 110 | S710: BLAKE :STEERE
A711: BEST PLAYERS
A712: SANDRINGHAM | C712: MORRISON | F712: BREWER | I712: COLLINS | L712: LYONS | O712: FITZPATRICK | R712: PRATT
A713: PRAHRAN | C713: T McDONALD | F713: CHRISTIE | I713: MILLS | L713: BARNARD
A714: GOALKICKERS
A715: SANDRINGHAM | C715: MORRISON 10 | F715: GORIZIDIS 4 | I715: BREWER 4 | K715: JOHNSON 4 | M715: MACLEOD 3 | P715: MANNIX 2 | R715: GALLAGHER | U715: KRISTENSEN | X715: BEILBY | Z715: FITZPATRICK
A716: PRAHRAN | C716: MILLS 5 | E716: GALT 3 | G716: BARNARD 2 | J716: RAMAGE 2 | M716: G GILES | O716: CHRISTIE | Q716: T McDONALD | T716: TAPPING
A718: WILLIAMSTOWN | C718: 4 | D718: 7 | E718: 31 | G718: 7 | H718: 15 | I718: 57 | K718: 12 | L718: 19 | M718: 91 | O718: 18 | P718: 24 | Q718: 132 | S718: VENUE: WILLIAMSTOWN
A719: SPRINGVALE | C719: 3 | D719: 0 | E719: 18 | G719: 3 | H719: 3 | I719: 21 | K719: 5 | L719: 7 | M719: 37 | O719: 7 | P719: 10 | Q719: 52 | S719: FITZPATRICK :BLACK
A720: BEST PLAYERS
A721: WILLIAMSTOWN | C721: DAVIDSON | F721: KERSHAW | I721: MURPHY | L721: SWANN | O721: WEIR | R721: CAHILL
A722: SPRINGVALE | C722: BLOOMFIELD | F722: DUDLEY | I722: MENDE | L722: RAY | O722: MALONI
A723: GOALKICKERS
A724: WILLIAMSTOWN | C724: FOTHERINGHAM 7 | G724: HORTON 2 | I724: WEIR 2 | K724: SIMMONS 2 | N724: SLEVISON | P724: BRIERTY | R724: RICKMAN | T724: CAHILL | V724: SAIT
A725: SPRINGVALE | C725: DUDLEY 4 | F725: MENDE 2 | I725: MALONI
A727: PORT MELBOURNE | C727: 3 | D727: 2 | E727: 20 | G727: 6 | H727: 7 | I727: 43 | K727: 9 | L727: 10 | M727: 64 | O727: 16 | P727: 12 | Q727: 108 | S727: VENUE: PRESTON
A728: PRESTON | C728: 1 | D728: 2 | E728: 8 | G728: 2 | H728: 3 | I728: 15 | K728: 6 | L728: 8 | M728: 44 | O728: 11 | P728: 10 | Q728: 76 | S728: MARCY :MORGAN
A729: BEST PLAYERS
A730: PORT MELBOURNE | C730: CHADBAND | F730: JENNINGS | I730: ROBERTSON | L730: HARKINS | O730: BRIEDIS | R730: DERMOTT
A731: PRESTON | C731: WHITE | F731: HACKNEY | I731: FYFFE
A732: GOALKICKERS
A733: PORT MELBOURNE | C733: HARKINS 4 | F733: EBEYER 2 | H733: GOSS 2 | J733: JENNINGS 2 | M733: BRIEDIS 2 | O733: HOWE 2 | Q733: McBROOM | S733: FITZPATRICK
A734: PRESTON | C734: SHAW 4 | F734: WHITE 2 | H734: SALVADORE 2 | K734: KEENAN | M734: HACKNEY | O734: WATT
A736: ROUND 14 | D736: 28TH JULY | I736: WEATHER | S736: VENUE: CAMBERWELL
D737: 1ST QTR | H737: 2ND QTR | L737: 3RD QTR | P737: FINAL | S737: UMPIRES
A738: CAMBERWELL | C738: 3 | D738: 3 | E738: 21 | G738: 7 | H738: 7 | I738: 49 | K738: 11 | L738: 9 | M738: 75 | O738: 19 | P738: 11 | Q738: 125 | S738: STEERE | X738: LADDER | AB738: ROUND | AD738: 14
A739: BOX HILL | C739: 5 | D739: 3 | E739: 33 | G739: 7 | H739: 4 | I739: 46 | K739: 10 | L739: 7 | M739: 67 | O739: 11 | P739: 12 | Q739: 78 | S739: OAKLEY
A740: BEST PLAYERS | W740: TEAM | X740: W | Y740: L | Z740: D | AA740: FOR | AB740: AGST | AC740: % | AD740: PTS
A741: CAMBERWELL | C741: DAVIDSON | F741: MERCER | I741: CONSTANTINOU | L741: GRAY | O741: S ROURKE | R741: DE KONNING
A742: BOX HILL | C742: HOWARTH | F742: CUFF | I742: VELONA | L742: GLEESON | O742: LONGHAM | W742: SANDRINGHAM | X742: 13 | Y742: 1 | Z742: 0 | AA742: 1933 | AB742: 1351 | AC742: =(AA742/AB742)*100 -> 143.07920059215397 | AD742: =(X742*4)+(Z742*2) -> 52
A743: GOALKICKERS | W743: COBURG | X743: 12 | Y743: 2 | Z743: 0 | AA743: 1858 | AB743: 1354 | AC743: =(AA743/AB743)*100 -> 137.22304283604137 | AD743: =(X743*4)+(Z743*2) -> 48
A744: CAMBERWELL | C744: WEATHERALD 6 | F744: MAILING 6 | I744: DAVIDSON 3 | L744: S ROURKE 2 | O744: DE KONNING | R744: HAYES | W744: PRESTON | X744: 11 | Y744: 3 | Z744: 0 | AA744: 1909 | AB744: 1372 | AC744: =(AA744/AB744)*100 -> 139.1399416909621 | AD744: =(X744*4)+(Z744*2) -> 44
A745: BOX HILL | C745: LONGHAM 4 | F745: NICHOLSON 3 | I745: McGHEE | K745: GARTH | M745: L BOLTON | O745: P BOLTON | W745: PORT MELBOURNE | X745: 10 | Y745: 4 | Z745: 0 | AA745: 1764 | AB745: 1321 | AC745: =(AA745/AB745)*100 -> 133.53520060560183 | AD745: =(X745*4)+(Z745*2) -> 40
S746: VENUE: PORT MELBOURNE
A747: SANDRINGHAM | C747: 3 | D747: 2 | E747: 20 | G747: 6 | H747: 10 | I747: 46 | K747: 9 | L747: 13 | M747: 67 | O747: 18 | P747: 17 | Q747: 125 | S747: PHILLIPS | W747: WILLIAMSTOWN | X747: 9 | Y747: 5 | Z747: 0 | AA747: 1778 | AB747: 1372 | AC747: =(AA747/AB747)*100 -> 129.59183673469389 | AD747: =(X747*4)+(Z747*2) -> 36
A748: PORT MELBOURNE | C748: 1 | D748: 5 | E748: 11 | G748: 2 | H748: 8 | I748: 20 | K748: 4 | L748: 9 | M748: 33 | O748: 5 | P748: 9 | Q748: 39 | S748: BREWER | W748: GEELONG WEST | X748: 7 | Y748: 7 | Z748: 0 | AA748: 1482 | AB748: 1491 | AC748: =(AA748/AB748)*100 -> 99.396378269617699 | AD748: =(X748*4)+(Z748*2) -> 28
A749: BEST PLAYERS | W749: FRANKSTON | X749: 6 | Y749: 8 | Z749: 0 | AA749: 1590 | AB749: 1533 | AC749: =(AA749/AB749)*100 -> 103.71819960861058 | AD749: =(X749*4)+(Z749*2) -> 24
A750: SANDRINGHAM | C750: FITZPATRICK | F750: LYONS | I750: COLLINS | L750: HETHERINGTON | O750: MACLEOD | R750: PEARSON | W750: CAMBERWELL | X750: 5 | Y750: 9 | Z750: 0 | AA750: 1567 | AB750: 1896 | AC750: =(AA750/AB750)*100 -> 82.647679324894511 | AD750: =(X750*4)+(Z750*2) -> 20
A751: PORT MELBOURNE | C751: JENNINGS | F751: CHADBAND | I751: ROSS | L751: DERMOTT | O751: ROBERTSON | W751: SPRINGVALE | X751: 5 | Y751: 9 | Z751: 0 | AA751: 1297 | AB751: 1623 | AC751: =(AA751/AB751)*100 -> 79.913739987677147 | AD751: =(X751*4)+(Z751*2) -> 20
A752: GOALKICKERS | Q752: FITZPATRICK | W752: PRAHRAN | X752: 2 | Y752: 11 | Z752: 1 | AA752: 1426 | AB752: 1985 | AC752: =(AA752/AB752)*100 -> 71.838790931989934 | AD752: =(X752*4)+(Z752*2) -> 10
A753: SANDRINGHAM | C753: BREWER 4 | F753: COLLINS 4 | I753: MACLEOD 3 | L753: GORIZIDIS 2 | O753: GALLAGHER 2 | R753: JOHNSON 2 | W753: BOX HILL | X753: 2 | Y753: 11 | Z753: 1 | AA753: 1353 | AB753: 2178 | AC753: =(AA753/AB753)*100 -> 62.121212121212125 | AD753: =(X753*4)+(Z753*2) -> 10
A754: PORT MELBOURNE | C754: BRIEDIS 2 | F754: HOWE | H754: RODDA | J754: HARKINS | W754: WERRIBEE | X754: 1 | Y754: 13 | Z754: 0 | AA754: 1314 | AB754: 2051 | AC754: =(AA754/AB754)*100 -> 64.066309117503664 | AD754: =(X754*4)+(Z754*2) -> 4
A756: FRANKSTON | C756: 3 | D756: 4 | E756: 22 | G756: 6 | H756: 7 | I756: 43 | K756: 10 | L756: 14 | M756: 74 | O756: 14 | P756: 16 | Q756: 100 | S756: VENUE: FRANKSTON
A757: PRAHRAN | C757: 4 | D757: 0 | E757: 24 | G757: 7 | H757: 5 | I757: 47 | K757: 8 | L757: 8 | M757: 56 | O757: 8 | P757: 10 | Q757: 58 | S757: VERGONA :FITZPATRICK
A758: BEST PLAYERS
A759: FRANKSTON | C759: RAVEN | F759: CZARNECKI | I759: SECCULL | L759: BRIESE | O759: MOORE | R759: THOMAS
A760: PRAHRAN | C760: GALT | F760: TAYLOR | I760: MILLS
A761: GOALKICKERS
A762: FRANKSTON | C762: MOORE 4 | F762: O'BRIEN 3 | I762: BEATON | K762: BELL | L762: COLE | N762: COUSINS | P762: LANE | R762: SECCULL | T762: THOMAS
A763: PRAHRAN | C763: MILLS 3 | F763: WALDER 2 | I763: SOULOS | K763: ROBERTSON | N763: TAPPING
A765: PRESTON | C765: 3 | D765: 2 | E765: 20 | G765: 8 | H765: 5 | I765: 53 | K765: 12 | L765: 7 | M765: 79 | O765: 16 | P765: 13 | Q765: 109 | S765: VENUE: SPRINGVALE
A766: SPRINGVALE | C766: 4 | D766: 5 | E766: 29 | G766: 9 | H766: 6 | I766: 60 | K766: 13 | L766: 6 | M766: 84 | O766: 14 | P766: 8 | Q766: 92 | S766: GLEESON :WALKER
A767: BEST PLAYERS
A768: PRESTON | C768: YEOMANS | F768: WATT | I768: ZERELLA | L768: DINTINOSANTE | O768: McCANN | R768: KEENAN
A769: SPRINGVALE | C769: MALONI | F769: DUDLEY | I769: HOWELL | L769: KEAYS | O769: BLOOMFIELD | R769: LETTS
A770: GOALKICKERS
A771: PRESTON | C771: SHAW 5 | F771: YEOMANS 3 | I771: ZERELLA 3 | L771: FYFFE | N771: WHITE | P771: ROSS
A772: SPRINGVALE | C772: DUDLEY 5 | F772: CLARKE 3 | I772: MENDE 2 | K772: GRAY | M772: HOLDEN | O772: MALONI | Q772: ANDERSON
A774: COBURG | C774: 1 | D774: 2 | E774: 8 | G774: 4 | H774: 10 | I774: 34 | K774: 8 | L774: 11 | M774: 59 | O774: 13 | P774: 16 | Q774: 94 | S774: VENUE: COBURG
A775: WILLIAMSTOWN | C775: 2 | D775: 2 | E775: 14 | G775: 2 | H775: 4 | I775: 16 | K775: 8 | L775: 11 | M775: 59 | O775: 9 | P775: 13 | Q775: 67 | S775: MARSHALL :G CASEY
A776: BEST PLAYERS
A777: COBURG | C777: HALBERT | F777: DOHNT | I777: M ZANON | L777: ANGWIN | O777: NIMMO | R777: SHELDON
A778: WILLIAMSTOWN | C778: KERSHAW | F778: MURPHY | I778: HORTON | L778: SLEVISON | O778: WHEELER
A779: GOALKICKERS
A780: COBURG | C780: DOHNT 2 | E780: HALBERT 2 | H780: FISHER 2 | J780: ANGWIN 2 | M780: WEBSTER 2 | P780: M ZANON | R780: SHELDON | T780: LITTLER
A781: WILLIAMSTOWN | C781: FOTHERINGHAM 4 | G781: SEMMONS | I781: DAVIDSON | L781: ROSS | N781: WEIR | P781: RICKMAN
A783: GEELONG WEST | C783: 6 | D783: 4 | E783: 40 | G783: 10 | H783: 12 | I783: 72 | K783: 14 | L783: 18 | M783: 102 | O783: 17 | P783: 20 | Q783: 122 | S783: VENUE: WERRIBEE
A784: WERRIBEE | C784: 3 | D784: 6 | E784: 24 | G784: 7 | H784: 7 | I784: 49 | K784: 13 | L784: 12 | M784: 90 | O784: 15 | P784: 17 | Q784: 107 | S784: CASEY :BLAKE
A785: BEST PLAYERS
A786: GEELONG WEST | C786: WATT | F786: BERRY | I786: STACK | L786: HAMILTON | O786: WELSH
A787: WERRIBEE | C787: MOLONEY | F787: FEDKE | I787: SPIERINGS | L787: WALPOLE | O787: RICHARDSON | R787: BURNETT
A788: GOALKICKERS
A789: GEELONG WEST | C789: BERRY 7 | F789: STACK 3 | H789: JUKAWICS 2 | K789: WELSH | M789: HAMILTON | O789: McDOWELL | R789: EVANS | T789: DALIHAUS
A790: WERRIBEE | C790: SPIERINGS 4 | F790: BURNETT 2 | I790: BUCKINGHAM 2 | L790: GRAY 2 | N790: MONTGOMERY 2 | Q790: CHRISTIANSEN | T790: DUNSTAN | V790: RICHARDSON
A792: ROUND 15 | D792: 4TH AUGUST | I792: WEATHER | S792: VENUE: GEELONG WEST
D793: 1ST QTR | H793: 2ND QTR | L793: 3RD QTR | P793: FINAL | S793: UMPIRES
A794: GEELONG WEST | C794: 3 | D794: 6 | E794: 24 | G794: 4 | H794: 6 | I794: 30 | K794: 5 | L794: 14 | M794: 44 | O794: 9 | P794: 15 | Q794: 69 | S794: WALKER | X794: LADDER | AB794: ROUND | AD794: 15
A795: FRANKSTON | C795: 1 | D795: 3 | E795: 9 | G795: 4 | H795: 5 | I795: 29 | K795: 5 | L795: 6 | M795: 36 | O795: 6 | P795: 11 | Q795: 47 | S795: MARSHALL
A796: BEST PLAYERS | W796: TEAM | X796: W | Y796: L | Z796: D | AA796: FOR | AB796: AGST | AC796: % | AD796: PTS
A797: GEELONG WEST | C797: DOYLE | F797: DALIHAUS | I797: WATT | L797: BERRY | O797: ALFORD
A798: FRANKSTON | C798: BEATON | F798: BOLAND | I798: BRIESE | L798: RAVEN | O798: BELL | R798: MOORE | W798: SANDRINGHAM | X798: 14 | Y798: 1 | Z798: 0 | AA798: 2139 | AB798: 1440 | AC798: =(AA798/AB798)*100 -> 148.54166666666666 | AD798: =(X798*4)+(Z798*2) -> 56
A799: GOALKICKERS | W799: COBURG | X799: 13 | Y799: 2 | Z799: 0 | AA799: 2039 | AB799: 1468 | AC799: =(AA799/AB799)*100 -> 138.89645776566758 | AD799: =(X799*4)+(Z799*2) -> 52
A800: GEELONG WEST | C800: BERRY 3 | F800: WELSH 3 | I800: GIBSON | K800: HAMILTON | N800: REDHEAD | W800: PRESTON | X800: 12 | Y800: 3 | Z800: 0 | AA800: 2099 | AB800: 1452 | AC800: =(AA800/AB800)*100 -> 144.55922865013775 | AD800: =(X800*4)+(Z800*2) -> 48
A801: FRANKSTON | C801: O'BRIEN 3 | F801: LANE | H801: MOORE | J801: BEATON | W801: PORT MELBOURNE | X801: 11 | Y801: 4 | Z801: 0 | AA801: 1954 | AB801: 1386 | AC801: =(AA801/AB801)*100 -> 140.98124098124097 | AD801: =(X801*4)+(Z801*2) -> 44
S802: VENUE: WILLIAMSTOWN
A803: WILLIAMSTOWN | C803: 5 | D803: 4 | E803: 34 | G803: 14 | H803: 7 | I803: 91 | K803: 22 | L803: 9 | M803: 141 | O803: 26 | P803: 17 | Q803: 173 | S803: MORGAN | W803: WILLIAMSTOWN | X803: 10 | Y803: 5 | Z803: 0 | AA803: 1951 | AB803: 1438 | AC803: =(AA803/AB803)*100 -> 135.67454798331016 | AD803: =(X803*4)+(Z803*2) -> 40
A804: BOX HILL | C804: 3 | D804: 5 | E804: 23 | G804: 6 | H804: 9 | I804: 45 | K804: 7 | L804: 16 | M804: 58 | O804: 8 | P804: 18 | Q804: 66 | S804: GLEESON | W804: GEELONG WEST | X804: 8 | Y804: 7 | Z804: 0 | AA804: 1551 | AB804: 1538 | AC804: =(AA804/AB804)*100 -> 100.84525357607281 | AD804: =(X804*4)+(Z804*2) -> 32
A805: BEST PLAYERS | W805: FRANKSTON | X805: 6 | Y805: 9 | Z805: 0 | AA805: 1637 | AB805: 1602 | AC805: =(AA805/AB805)*100 -> 102.18476903870162 | AD805: =(X805*4)+(Z805*2) -> 24
A806: WILLIAMSTOWN | C806: HORTON | F806: SLEVISON | I806: HUGHES | L806: SAIT | O806: SEMMONS | R806: SIMMONS | W806: CAMBERWELL | X806: 5 | Y806: 10 | Z806: 0 | AA806: 1647 | AB806: 2086 | AC806: =(AA806/AB806)*100 -> 78.954937679769898 | AD806: =(X806*4)+(Z806*2) -> 20
A807: BOX HILL | C807: TEAKEL | F807: NICHOLSON | I807: WITNISH | L807: McGHEE | W807: SPRINGVALE | X807: 5 | Y807: 10 | Z807: 0 | AA807: 1362 | AB807: 1813 | AC807: =(AA807/AB807)*100 -> 75.124103695532256 | AD807: =(X807*4)+(Z807*2) -> 20
A808: GOALKICKERS | N808: SLEVISON | Q808: MUSCHIALLI | W808: PRAHRAN | X808: 2 | Y808: 12 | Z808: 1 | AA808: 1540 | AB808: 2166 | AC808: =(AA808/AB808)*100 -> 71.098799630655591 | AD808: =(X808*4)+(Z808*2) -> 10
A809: WILLIAMSTOWN | C809: RICKMAN 8 | F809: SIMMONS 7 | I809: CAHILL 2 | K809: HUGHES 2 | M809: SAIT 2 | O809: HORTON | Q809: SEMMONS | S809: DAVIDSON | W809: BOX HILL | X809: 2 | Y809: 12 | Z809: 1 | AA809: 1419 | AB809: 2351 | AC809: =(AA809/AB809)*100 -> 60.357294768183756 | AD809: =(X809*4)+(Z809*2) -> 10
A810: BOX HILL | C810: GARTH 2 | F810: NICHOLSON 2 | I810: SLACIK | K810: GLEESON | M810: LONGHAM | O810: McGHEE | W810: WERRIBEE | X810: 1 | Y810: 14 | Z810: 0 | AA810: 1403 | AB810: 2257 | AC810: =(AA810/AB810)*100 -> 62.162162162162161 | AD810: =(X810*4)+(Z810*2) -> 4
A812: SANDRINGHAM | C812: 9 | D812: 6 | E812: 60 | G812: 15 | H812: 9 | I812: 99 | K812: 25 | L812: 14 | M812: 164 | O812: 32 | P812: 14 | Q812: 206 | S812: VENUE: BEACH ROAD
A813: WERRIBEE | C813: 0 | D813: 2 | E813: 2 | G813: 3 | H813: 6 | I813: 24 | K813: 7 | L813: 7 | M813: 49 | O813: 13 | P813: 11 | Q813: 89 | S813: BLACK :MARCY
A814: BEST PLAYERS
A815: SANDRINGHAM | C815: GALLAGHER | F815: MANNIX | I815: BREWER | L815: PEARSON | O815: PRATT | R815: HETHERINGTON
A816: WERRIBEE | C816: CHRISTIANSEN | F816: MONTGOMERY | I816: BURNETT | L816: DUNSTAN
A817: GOALKICKERS
A818: SANDRINGHAM | C818: BREWER 8 | F818: GALLAGHER 8 | I818: MORRISON 7 | L818: GORIZIDIS 3 | N818: DIPIERDOMENICO 3 | R818: SAID 2 | T818: COLLINS
A819: WERRIBEE | C819: CHRISTIANSEN 2 | F819: BURNETT 2 | I819: DUNSTAN 2 | L819: CORDY 2 | N819: WALPOLE | Q819: BUCKINGHAM | T819: GRAY | V819: MONTGOMERY | X819: SPIERINGS
A821: PRESTON | C821: 9 | D821: 5 | E821: 59 | G821: 13 | H821: 9 | I821: 87 | K821: 24 | L821: 12 | M821: 156 | O821: 29 | P821: 16 | Q821: 190 | S821: VENUE: PRESTON
A822: CAMBERWELL | C822: 1 | D822: 1 | E822: 7 | G822: 6 | H822: 6 | I822: 42 | K822: 9 | L822: 9 | M822: 63 | O822: 11 | P822: 14 | Q822: 80 | S822: VERGONA :HUTCHINSON
A823: BEST PLAYERS
A824: PRESTON | C824: LUMICISI | F824: ZERELLA | I824: DINTINOSANTE | L824: McKEOWN | O824: SALVADORE | R824: SHAW
A825: CAMBERWELL | C825: DAVIDSON | F825: CONSTANTINOU | I825: S ROURKE | L825: DE KONNING | O825: C ROURKE | R825: PEVITT
A826: GOALKICKERS
A827: PRESTON | C827: SHAW 9 | F827: ZERELLA 4 | I827: SALVADORE 4 | L827: WATT 3 | N827: YEOMANS 3 | Q827: JORDAN | S827: LUMICISI | U827: McKEOWN | X827: FYFFE
A828: CAMBERWELL | C828: DANS 3 | F828: WEATHERALD 2 | I828: MAILING 2 | K828: S ROURKE 2 | N828: DAVIDSON | Q828: CONSTANTINOU
A830: COBURG | C830: 3 | D830: 4 | E830: 22 | G830: 9 | H830: 12 | I830: 66 | K830: 14 | L830: 15 | M830: 99 | O830: 27 | P830: 19 | Q830: 181 | S830: VENUE: TOORAK PARK
A831: PRAHRAN | C831: 6 | D831: 4 | E831: 40 | G831: 10 | H831: 5 | I831: 65 | K831: 17 | L831: 8 | M831: 110 | O831: 17 | P831: 12 | Q831: 114 | S831: R CASEY :G BREWER
A832: BEST PLAYERS
A833: COBURG | C833: SHELDON | F833: FREEMAN | I833: NIMMO | L833: LITTLER | O833: CLEARY
A834: PRAHRAN | C834: TAYLOR | F834: GRAMBEAU | I834: BARNARD | L834: CUTLER
A835: GOALKICKERS
A836: COBURG | C836: WEBSTER 5 | F836: MANSFIELD 4 | I836: TULLOCH 4 | L836: HERBERT 3 | O836: LITTLER 3 | Q836: EDWARDS 3 | T836: CLEARY 2 | W836: FREEMAN 2 | X836: FREMANTLE
A837: PRAHRAN | C837: GALT 4 | E837: G GILES 3 | G837: CUTLER 2 | I837: P McCORMACK 2 | L837: P McDONALD 2 | O837: TAYLOR | Q837: S GILES | S837: WARBURTON | V837: BARNARD
A839: PORT MELBOURNE | C839: 7 | D839: 2 | E839: 44 | G839: 12 | H839: 8 | I839: 80 | K839: 20 | L839: 12 | M839: 132 | O839: 29 | P839: 16 | Q839: 190 | S839: VENUE: PORT MELBOURNE
A840: SPRINGVALE | C840: 1 | D840: 2 | E840: 8 | G840: 5 | H840: 6 | I840: 36 | K840: 7 | L840: 8 | M840: 50 | O840: 9 | P840: 11 | Q840: 65 | S840: CASEY :OAKLEY
A841: BEST PLAYERS
A842: PORT MELBOURNE | C842: EBEYER | F842: JENNINGS | I842: CARTER | L842: ROSS | O842: ROBERTSON | R842: CHADBAND
A843: SPRINGVALE | C843: DEMPSTER | F843: BLOOMFIELD | I843: CLARKE | L843: ANDERSON | O843: DUDLEY
A844: GOALKICKERS
A845: PORT MELBOURNE | C845: FITZPATRICK 7 | F845: EBEYER 7 | H845: HARKINS 4 | K845: McBROOM 3 | N845: ROSS 2 | P845: BRIEDIS 2 | R845: HOWE 2 | T845: JENNINGS | V845: SWAN
A846: SPRINGVALE | C846: ANDERSON 3 | F846: CLARKE 3 | I846: DUDLEY | K846: SMITH | M846: GRAY
A848: ROUND 16 | D848: 11TH AUGUST | I848: WEATHER | S848: VENUE: WERRIBEE
D849: 1ST QTR | H849: 2ND QTR | L849: 3RD QTR | P849: FINAL | S849: UMPIRES
A850: PRESTON | C850: 5 | D850: 1 | E850: 31 | G850: 14 | H850: 2 | I850: 86 | K850: 22 | L850: 7 | M850: 139 | O850: 29 | P850: 9 | Q850: 183 | S850: WALKER | X850: LADDER | AB850: ROUND | AD850: 16
A851: WERRIBEE | C851: 5 | D851: 3 | E851: 33 | G851: 13 | H851: 4 | I851: 82 | K851: 16 | L851: 10 | M851: 106 | O851: 21 | P851: 14 | Q851: 140 | S851: PHILLIPS
A852: BEST PLAYERS | W852: TEAM | X852: W | Y852: L | Z852: D | AA852: FOR | AB852: AGST | AC852: % | AD852: PTS
A853: PRESTON | C853: McKEON | F853: ROSS | I853: FYFFE | L853: SHAW | O853: KEENAN
A854: WERRIBEE | C854: GORDON | F854: DUNSTAN | I854: WALPOLE | L854: CHRISTIANSEN | O854: OPIE | Q854: FEDKE | W854: SANDRINGHAM | X854: 14 | Y854: 2 | Z854: 0 | AA854: 2237 | AB854: 1540 | AC854: =(AA854/AB854)*100 -> 145.25974025974025 | AD854: =(X854*4)+(Z854*2) -> 56
A855: GOALKICKERS | O855: LUMICISI | Q855: ROSS | S855: YEOMANS | W855: COBURG | X855: 14 | Y855: 2 | Z855: 0 | AA855: 2139 | AB855: 1566 | AC855: =(AA855/AB855)*100 -> 136.59003831417624 | AD855: =(X855*4)+(Z855*2) -> 56
A856: PRESTON | C856: SHAW 7 | E856: ZERELLA 5 | G856: KEENAN 4 | I856: SALVADORE 3 | L856: JORDAN 3 | N856: WARREN 2 | Q856: FYFFE | R856: HARTE | W856: PRESTON | X856: 13 | Y856: 3 | Z856: 0 | AA856: 2282 | AB856: 1592 | AC856: =(AA856/AB856)*100 -> 143.34170854271358 | AD856: =(X856*4)+(Z856*2) -> 52
A857: WERRIBEE | C857: GORDON 5 | E857: FRASER 4 | G857: DUNSTAN 4 | I857: CHRISTIANSEN 3 | L857: BURNETT | N857: BUCKINGHAM | Q857: GREY | R857: MONTGOMERY | W857: PORT MELBOURNE | X857: 11 | Y857: 5 | Z857: 0 | AA857: 2056 | AB857: 1506 | AC857: =(AA857/AB857)*100 -> 136.52058432934925 | AD857: =(X857*4)+(Z857*2) -> 44
M858: SPIERINGS | S858: VENUE: BOX HILL
A859: GEELONG WEST | C859: 3 | D859: 2 | E859: 20 | G859: 4 | H859: 2 | I859: 26 | K859: 8 | L859: 3 | M859: 51 | O859: 9 | P859: 4 | Q859: 58 | S859: CASEY | W859: WILLIAMSTOWN | X859: 10 | Y859: 6 | Z859: 0 | AA859: 2045 | AB859: 1537 | AC859: =(AA859/AB859)*100 -> 133.05139882888744 | AD859: =(X859*4)+(Z859*2) -> 40
A860: BOX HILL | C860: 1 | D860: 0 | E860: 6 | G860: 4 | H860: 3 | I860: 27 | K860: 4 | L860: 5 | M860: 29 | O860: 7 | P860: 6 | Q860: 48 | S860: FITZPATRICK | W860: GEELONG WEST | X860: 9 | Y860: 7 | Z860: 0 | AA860: 1607 | AB860: 1586 | AC860: =(AA860/AB860)*100 -> 101.32408575031526 | AD860: =(X860*4)+(Z860*2) -> 36
A861: BEST PLAYERS | W861: FRANKSTON | X861: 7 | Y861: 9 | Z861: 0 | AA861: 1757 | AB861: 1704 | AC861: =(AA861/AB861)*100 -> 103.11032863849765 | AD861: =(X861*4)+(Z861*2) -> 28
A862: GEELONG WEST | C862: PERKINS | F862: GIBSON | I862: DOYLE | L862: WELSH | O862: SIZER | W862: CAMBERWELL | X862: 6 | Y862: 10 | Z862: 0 | AA862: 1746 | AB862: 2180 | AC862: =(AA862/AB862)*100 -> 80.091743119266056 | AD862: =(X862*4)+(Z862*2) -> 24
A863: BOX HILL | C863: P BOLTON | F863: TEAKEL | I863: GARTH | L863: ROCHOW | O863: DYER | W863: SPRINGVALE | X863: 5 | Y863: 11 | Z863: 0 | AA863: 1431 | AB863: 1933 | AC863: =(AA863/AB863)*100 -> 74.030005173305753 | AD863: =(X863*4)+(Z863*2) -> 20
A864: GOALKICKERS | W864: PRAHRAN | X864: 3 | Y864: 12 | Z864: 1 | AA864: 1660 | AB864: 2235 | AC864: =(AA864/AB864)*100 -> 74.272930648769574 | AD864: =(X864*4)+(Z864*2) -> 14
A865: GEELONG WEST | C865: WELSH 4 | F865: GIBSON 3 | I865: HAMILTON | W865: BOX HILL | X865: 2 | Y865: 13 | Z865: 1 | AA865: 1467 | AB865: 2407 | AC865: =(AA865/AB865)*100 -> 60.94723722476111 | AD865: =(X865*4)+(Z865*2) -> 10
A866: BOX HILL | C866: RAYMOND 3 | F866: McGHEE 2 | I866: L BOLTON | L866: NICHOLSON | W866: WERRIBEE | X866: 1 | Y866: 15 | Z866: 0 | AA866: 1543 | AB866: 2440 | AC866: =(AA866/AB866)*100 -> 63.23770491803279 | AD866: =(X866*4)+(Z866*2) -> 4
A868: CAMBERWELL | C868: 4 | D868: 3 | E868: 27 | G868: 8 | H868: 7 | I868: 55 | K868: 11 | L868: 11 | M868: 77 | O868: 14 | P868: 15 | Q868: 99 | S868: VENUE: CAMBERWELL
A869: WILLIAMSTOWN | C869: 5 | D869: 4 | E869: 34 | G869: 9 | H869: 7 | I869: 61 | K869: 12 | L869: 13 | M869: 85 | O869: 13 | P869: 16 | Q869: 94 | S869: MARCY :R CASEY
A870: BEST PLAYERS
A871: CAMBERWELL | C871: DAVIDSON | F871: EVANS | I871: S ROURKE | L871: CONSTANTINOU | O871: C ROURKE | R871: DE KONNING
A872: WILLIAMSTOWN | C872: MUSCHIALLI | F872: WHEELER | I872: DAVIDSON | L872: SLEVISON | O872: SIMMONS
A873: GOALKICKERS
A874: CAMBERWELL | C874: WEATHERALD 3 | F874: MAILING 3 | I874: PEVITT 3 | K874: S ROURKE 2 | N874: GRAY | P874: CONSTANTINOU | S874: BUDGE
A875: WILLIAMSTOWN | C875: FOTHERINGHAM 6 | G875: SEMMONS 2 | J875: SIMMONS 2 | M875: SAIT | O875: MUSCHIALLI | R875: DAVIDSON
A877: COBURG | C877: 3 | D877: 3 | E877: 21 | G877: 7 | H877: 7 | I877: 49 | K877: 13 | L877: 10 | M877: 88 | O877: 14 | P877: 16 | Q877: 100 | S877: VENUE: COBURG
A878: SANDRINGHAM | C878: 4 | D878: 2 | E878: 26 | G878: 7 | H878: 5 | I878: 47 | K878: 13 | L878: 6 | M878: 84 | O878: 15 | P878: 8 | Q878: 98 | S878: MORGAN :VERGONA
A879: BEST PLAYERS
A880: COBURG | C880: SHELDON | F880: WEBSTER | I880: HALBERT | L880: M ZANON | O880: FREEMAN | R880: NIMMO
A881: SANDRINGHAM | C881: GOROZIDIS | F881: COLLINS | I881: EAVES | L881: LYONS | O881: MORRISON
A882: GOALKICKERS
A883: COBURG | C883: WEBSTER 8 | F883: FREEMAN 2 | I883: HALBERT | K883: LAIDLER | M883: MANSFIELD | P883: GRAHAM
A884: SANDRINGHAM | C884: MORRISON 6 | F884: HETHERINGTON 3 | J884: GALLAGHER 2 | M884: JOHNSON 2 | P884: COLLINS | R884: MACLEOD
A886: FRANKSTON | C886: 5 | D886: 3 | E886: 33 | G886: 8 | H886: 4 | I886: 52 | K886: 11 | L886: 9 | M886: 75 | O886: 18 | P886: 12 | Q886: 120 | S886: VENUE: FRANKSTON
A887: PORT MELBOURNE | C887: 5 | D887: 4 | E887: 34 | G887: 10 | H887: 9 | I887: 69 | K887: 11 | L887: 9 | M887: 75 | O887: 15 | P887: 12 | Q887: 102 | S887: BLACK :GLEESON
A888: BEST PLAYERS
A889: FRANKSTON | C889: RAVEN | F889: MOORE | I889: BEATON | L889: GEDDES | O889: DUNBAR | R889: CZARNECKI
A890: PORT MELBOURNE | C890: FITZPATRICK | F890: CARTER | I890: CHADBAND | L890: ROSS | O890: JENNINGS
A891: GOALKICKERS
A892: FRANKSTON | C892: DUNBAR 6 | F892: GEDDES 4 | H892: MOORE 2 | J892: T O'BRIEN 2 | M892: SECCULL 2 | O892: CZARNECKI | R892: HILTON
A893: PORT MELBOURNE | C893: FITZPATRICK 7 | F893: EBEYER 3 | I893: HOWE 2 | K893: S HARKINS | N893: SWAN | P893: CARTER
A895: PRAHRAN | C895: 1 | D895: 4 | E895: 10 | G895: 6 | H895: 6 | I895: 42 | K895: 12 | L895: 13 | M895: 85 | O895: 16 | P895: 24 | Q895: 120 | S895: VENUE: SPRINGVALE
A896: SPRINGVALE | C896: 2 | D896: 3 | E896: 15 | G896: 4 | H896: 5 | I896: 29 | K896: 6 | L896: 8 | M896: 44 | O896: 10 | P896: 9 | Q896: 69 | S896: HUTCHINSON :MARSHALL
A897: BEST PLAYERS
A898: PRAHRAN | C898: WALES | F898: ELLETT | I898: G GILES | L898: GRAMBEAU | O898: WALLACE | R898: WALDER
A899: SPRINGVALE | C899: HOWELL | F899: DEMPSTER | I899: STEWART | L899: HOLDEN
A900: GOALKICKERS
A901: PRAHRAN | C901: CUTLER 3 | F901: SOULOS 3 | H901: WALDER 2 | J901: WARBURTON 2 | M901: BARNARD | O901: WALES | Q901: G GILES | S901: P McCORMACK | W901: WALLACE | X901: CHRISTIE
A902: SPRINGVALE | C902: STEWART 3 | F902: COLLINS 2 | I902: CLARKE 2 | K902: KEAYS | M902: CARROLL | O902: HOLDEN
A904: ROUND 17 | D904: 18TH AUGUST | I904: WEATHER | S904: VENUE: GEELONG WEST
D905: 1ST QTR | H905: 2ND QTR | L905: 3RD QTR | P905: FINAL | S905: UMPIRES
A906: GEELONG WEST | C906: 5 | D906: 6 | E906: 36 | G906: 8 | H906: 14 | I906: 62 | K906: 10 | L906: 18 | M906: 78 | O906: 13 | P906: 21 | Q906: 99 | S906: PHILLIPS | X906: LADDER | AB906: ROUND | AD906: 17
A907: CAMBERWELL | C907: 4 | D907: 1 | E907: 25 | G907: 6 | H907: 1 | I907: 37 | K907: 7 | L907: 3 | M907: 45 | O907: 10 | P907: 3 | Q907: 63 | S907: PRICE
A908: BEST PLAYERS | W908: TEAM | X908: W | Y908: L | Z908: D | AA908: FOR | AB908: AGST | AC908: % | AD908: PTS
A909: GEELONG WEST | C909: PERKINS | F909: BERRY | I909: ALFORD | L909: SIZER | O909: McDOWELL | R909: WELSH
A910: CAMBERWELL | C910: McKENZIE | F910: CONSTANTINOU | I910: SCOTT | L910: DE KONNING | O910: DAVIDSON | R910: S ROURKE | W910: SANDRINGHAM | X910: 15 | Y910: 2 | Z910: 0 | AA910: 2406 | AB910: 1592 | AC910: =(AA910/AB910)*100 -> 151.13065326633165 | AD910: =(X910*4)+(Z910*2) -> 60
A911: GOALKICKERS | W911: COBURG | X911: 15 | Y911: 2 | Z911: 0 | AA911: 2263 | AB911: 1629 | AC911: =(AA911/AB911)*100 -> 138.91958256599139 | AD911: =(X911*4)+(Z911*2) -> 60
A912: GEELONG WEST | C912: WELSH 3 | F912: BERRY 3 | H912: CONNELLY 2 | K912: EVANS 2 | M912: McDOWELL 2 | P912: WATT | W912: PRESTON | X912: 13 | Y912: 4 | Z912: 0 | AA912: 2345 | AB912: 1716 | AC912: =(AA912/AB912)*100 -> 136.65501165501166 | AD912: =(X912*4)+(Z912*2) -> 52
A913: CAMBERWELL | C913: MAILING 4 | F913: WEATHERALD 3 | J913: HAYES | L913: DANS | N913: CONSTANTINOU | W913: PORT MELBOURNE | X913: 12 | Y913: 5 | Z913: 0 | AA913: 2196 | AB913: 1570 | AC913: =(AA913/AB913)*100 -> 139.87261146496814 | AD913: =(X913*4)+(Z913*2) -> 48
S914: VENUE: WILLIAMSTOWN
A915: WILLIAMSTOWN | C915: 2 | D915: 4 | E915: 16 | G915: 6 | H915: 8 | I915: 44 | K915: 10 | L915: 13 | M915: 73 | O915: 12 | P915: 19 | Q915: 91 | S915: HUTCHINSON | W915: WILLIAMSTOWN | X915: 11 | Y915: 6 | Z915: 0 | AA915: 2136 | AB915: 1606 | AC915: =(AA915/AB915)*100 -> 133.00124533001247 | AD915: =(X915*4)+(Z915*2) -> 44
A916: WERRIBEE | C916: 4 | D916: 5 | E916: 29 | G916: 5 | H916: 5 | I916: 35 | K916: 7 | L916: 8 | M916: 50 | O916: 10 | P916: 9 | Q916: 69 | S916: G CASEY | W916: GEELONG WEST | X916: 10 | Y916: 7 | Z916: 0 | AA916: 1706 | AB916: 1649 | AC916: =(AA916/AB916)*100 -> 103.45664038811402 | AD916: =(X916*4)+(Z916*2) -> 40
A917: BEST PLAYERS | W917: FRANKSTON | X917: 7 | Y917: 10 | Z917: 0 | AA917: 1808 | AB917: 1772 | AC917: =(AA917/AB917)*100 -> 102.0316027088036 | AD917: =(X917*4)+(Z917*2) -> 28
A918: WILLIAMSTOWN | C918: SAIT | F918: CAHILL | I918: KERSHAW | L918: WHEELER | O918: DAVIDSON | W918: CAMBERWELL | X918: 6 | Y918: 11 | Z918: 0 | AA918: 1809 | AB918: 2279 | AC918: =(AA918/AB918)*100 -> 79.376919701623521 | AD918: =(X918*4)+(Z918*2) -> 24
A919: WERRIBEE | C919: CHRISTIANSEN | F919: KATTENSTEINER | I919: MONRGOMERY | L919: REDENBACH | O919: S MOLONEY | W919: SPRINGVALE | X919: 5 | Y919: 12 | Z919: 0 | AA919: 1483 | AB919: 2102 | AC919: =(AA919/AB919)*100 -> 70.551855375832545 | AD919: =(X919*4)+(Z919*2) -> 20
A920: GOALKICKERS | W920: BOX HILL | X920: 3 | Y920: 13 | Z920: 1 | AA920: 1535 | AB920: 2458 | AC920: =(AA920/AB920)*100 -> 62.449145646867379 | AD920: =(X920*4)+(Z920*2) -> 14
A921: WILLIAMSTOWN | C921: FOTHERINGHAM 4 | G921: SIMMONS 2 | J921: CAHILL 2 | L921: HUGHES | N921: MUSCHIALLI | Q921: BRIERTY | S921: SAIT | W921: PRAHRAN | X921: 3 | Y921: 13 | Z921: 1 | AA921: 1724 | AB921: 2375 | AC921: =(AA921/AB921)*100 -> 72.589473684210532 | AD921: =(X921*4)+(Z921*2) -> 14
A922: WERRIBEE | C922: GORDON 3 | F922: REDENBACH 3 | I922: BUCKINGHAM 2 | L922: CHRISTIANSEN | O922: FRAZER | W922: WERRIBEE | X922: 1 | Y922: 16 | Z922: 0 | AA922: 1612 | AB922: 2531 | AC922: =(AA922/AB922)*100 -> 63.690241011457928 | AD922: =(X922*4)+(Z922*2) -> 4
A924: COBURG | C924: 6 | D924: 4 | E924: 40 | G924: 13 | H924: 8 | I924: 86 | K924: 16 | L924: 12 | M924: 108 | O924: 18 | P924: 16 | Q924: 124 | S924: VENUE: PRESTON
A925: PRESTON | C925: 5 | D925: 2 | E925: 32 | G925: 6 | H925: 5 | I925: 41 | K925: 6 | L925: 9 | M925: 45 | O925: 9 | P925: 9 | Q925: 63 | S925: OAKLEY ;BLACK
A926: BEST PLAYERS
A927: COBURG | C927: FITZPATRICK | F927: HALBERT | I927: ALLISON | L927: ANGWIN | O927: NIMMO | R927: HARBINSON
A928: PRESTON | C928: YEOMANS | F928: SHAW | I928: JORDAN | L928: WATT
A929: GOALKICKERS
A930: COBURG | C930: LAIDLER 5 | F930: FITZPATRICK 3 | I930: TULLOCH 3 | L930: WEBSTER 3 | O930: ALLISON 2 | R930: HALBERT | T930: LITTLER
A931: PRESTON | C931: SHAW 5 | F931: SALVADORE 2 | I931: WATT | K931: YEOMANS
A933: SANDRINGHAM | C933: 8 | D933: 5 | E933: 53 | G933: 13 | H933: 10 | I933: 88 | K933: 18 | L933: 14 | M933: 122 | O933: 25 | P933: 19 | Q933: 169 | S933: VENUE: BEACH ROAD
A934: SPRINGVALE | C934: 2 | D934: 1 | E934: 13 | G934: 2 | H934: 3 | I934: 15 | K934: 3 | L934: 9 | M934: 27 | O934: 7 | P934: 10 | Q934: 52 | S934: CASEY :FITZPATRICK
A935: BEST PLAYERS
A936: SANDRINGHAM | C936: PRATT | F936: GALLAGHER | I936: COLLINS | K936: FITZPATRICK | N936: BEILBY | Q936: MACLEOD
A937: SPRINGVALE | C937: DUDLEY | F937: DEMPSTER | I937: QUINN | K937: KEAYS | N937: MENDE | Q937: LETTS
A938: GOALKICKERS
A939: SANDRINGHAM | C939: MORRISON 8 | F939: MACLEOD 4 | I939: SAID 4 | K939: GORIZIDIS 4 | N939: BREWER 2 | Q939: GALLAGHER | S939: KRISTENSEN | V939: MANNIX
A940: SPRINGVALE | C940: JURY 2 | F940: CLARKE | H940: HERBERT | J940: ANDERSON | M940: CADDAYE | O940: JESS
A942: BOX HILL | C942: 3 | D942: 4 | E942: 22 | G942: 5 | H942: 4 | I942: 34 | K942: 6 | L942: 6 | M942: 42 | O942: 10 | P942: 8 | Q942: 68 | S942: VENUE: BOX HILL
A943: FRANKSTON | C943: 2 | D943: 1 | E943: 13 | G943: 2 | H943: 6 | I943: 18 | K943: 5 | L943: 9 | M943: 39 | O943: 7 | P943: 9 | Q943: 51 | S943: MARCY ;MARSHALL
A944: BEST PLAYERS
A945: BOX HILL | C945: NICHOLSON | F945: L BOLTON | I945: DYER | L945: McGHEE | O945: GOODWIN | R945: VELONA
A946: FRANKSTON | C946: RAVEN | F946: GEDDES | I946: BEATON | L946: MOORE | O946: CZARNECKI
A947: GOALKICKERS
A948: BOX HILL | C948: NICHOLSON 3 | F948: RAYMOND 3 | I948: DYER 2 | K948: GARTH | M948: LEMON
A949: FRANKSTON | C949: MOORE 2 | F949: GEDDES 2 | I949: LANE | K949: HILTON | M949: SECCULL
A951: PORT MELBOURNE | C951: 4 | D951: 1 | E951: 25 | G951: 9 | H951: 7 | I951: 61 | K951: 16 | L951: 10 | M951: 106 | O951: 20 | P951: 20 | Q951: 140 | S951: VENUE: TOORAK PARK
A952: PRAHRAN | C952: 4 | D952: 2 | E952: 26 | G952: 6 | H952: 4 | I952: 40 | K952: 7 | L952: 6 | M952: 48 | O952: 9 | P952: 10 | Q952: 64 | S952: VERGONA ;MORGAN
A953: BEST PLAYERS
A954: PORT MELBOURNE | C954: CARTER | F954: ROSS | I954: THOMPSON | L954: SWAN | O954: FITZPATRICK | R954: HOWE
A955: PRAHRAN | C955: WALLACE | F955: G GILES | I955: GALT | L955: ELLETT
A956: GOALKICKERS
A957: PORT MELBOURNE | C957: FITZPATRICK 7 | F957: HOWE 4 | H957: HOY 2 | J957: ROSS 2 | L957: EBEYER 2 | N957: SWAN | P957: BRIEDIS | R957: JENNINGS
A958: PRAHRAN | C958: P MCCORMACK 2 | G958: WADE | I958: WALES | K958: I MCCORMACK | N958: CUTLER | P958: GALT | R958: WARBURTON | U958: G GILES
A960: ROUND 18 | D960: 25TH AUGUST | I960: WEATHER | S960: VENUE: FRANKSTON
D961: 1ST QTR | H961: 2ND QTR | L961: 3RD QTR | P961: FINAL | S961: UMPIRES
A962: FRANKSTON | C962: 2 | D962: 5 | E962: 17 | G962: 4 | H962: 7 | I962: 31 | K962: 6 | L962: 14 | M962: 50 | O962: 11 | P962: 17 | Q962: 83 | S962: WALKER | X962: LADDER | AB962: ROUND | AD962: 18
A963: SPRINGVALE | C963: 2 | D963: 0 | E963: 12 | G963: 3 | H963: 10 | I963: 28 | K963: 3 | L963: 12 | M963: 30 | O963: 6 | P963: 13 | Q963: 49 | S963: PRICE
A964: BEST PLAYERS | W964: TEAM | X964: W | Y964: L | Z964: D | AA964: FOR | AB964: AGST | AC964: % | AD964: PTS
A965: FRANKSTON | C965: LANE | F965: COLE | I965: RAVEN | L965: MITCHELL | O965: BOLAND | R965: G KANE
A966: SPRINGVALE | C966: HOWELL | F966: KEAYS | I966: QUINN | L966: DUDLEY | O966: DEMPSTER | R966: MENDE | W966: SANDRINGHAM | X966: 16 | Y966: 2 | Z966: 0 | AA966: 2556 | AB966: 1661 | AC966: =(AA966/AB966)*100 -> 153.88320288982541 | AD966: =(X966*4)+(Z966*2) -> 64
A967: GOALKICKERS | W967: COBURG | X967: 16 | Y967: 2 | Z967: 0 | AA967: 2404 | AB967: 1668 | AC967: =(AA967/AB967)*100 -> 144.12470023980813 | AD967: =(X967*4)+(Z967*2) -> 64
A968: FRANKSTON | C968: LANE 4 | F968: COUSINS 2 | I968: GEDDES 2 | K968: BELL | M968: COLE | O968: DUNBAR | W968: PRESTON | X968: 14 | Y968: 4 | Z968: 0 | AA968: 2451 | AB968: 1797 | AC968: =(AA968/AB968)*100 -> 136.39398998330552 | AD968: =(X968*4)+(Z968*2) -> 56
A969: SPRINGVALE | C969: CADDAYE | F969: STEWART | I969: McCOMB | K969: JESS | M969: REECE | O969: MENDE | W969: WILLIAMSTOWN | X969: 12 | Y969: 6 | Z969: 0 | AA969: 2236 | AB969: 1664 | AC969: =(AA969/AB969)*100 -> 134.375 | AD969: =(X969*4)+(Z969*2) -> 48
S970: VENUE: GEELONG WEST
A971: WILLIAMSTOWN | C971: 2 | D971: 2 | E971: 14 | G971: 7 | H971: 11 | I971: 53 | K971: 7 | L971: 13 | M971: 55 | O971: 14 | P971: 16 | Q971: 100 | S971: MORGAN | W971: PORT MELBOURNE | X971: 12 | Y971: 6 | Z971: 0 | AA971: 2235 | AB971: 1711 | AC971: =(AA971/AB971)*100 -> 130.62536528345996 | AD971: =(X971*4)+(Z971*2) -> 48
A972: GEELONG WEST | C972: 5 | D972: 2 | E972: 32 | G972: 5 | H972: 2 | I972: 32 | K972: 6 | L972: 8 | M972: 44 | O972: 8 | P972: 10 | Q972: 58 | S972: BLACK | W972: GEELONG WEST | X972: 10 | Y972: 8 | Z972: 0 | AA972: 1764 | AB972: 1749 | AC972: =(AA972/AB972)*100 -> 100.85763293310464 | AD972: =(X972*4)+(Z972*2) -> 40
A973: BEST PLAYERS | W973: FRANKSTON | X973: 8 | Y973: 10 | Z973: 0 | AA973: 1891 | AB973: 1819 | AC973: =(AA973/AB973)*100 -> 103.9582188015393 | AD973: =(X973*4)+(Z973*2) -> 32
A974: WILLIAMSTOWN | C974: KERSHAW | F974: SEMMONS | I974: CAHILL | L974: OWEN | O974: RICKMAN | R974: DAVIDSON | W974: CAMBERWELL | X974: 6 | Y974: 12 | Z974: 0 | AA974: 1878 | AB974: 2431 | AC974: =(AA974/AB974)*100 -> 77.252159605100772 | AD974: =(X974*4)+(Z974*2) -> 24
A975: GEELONG WEST | C975: BERRY | F975: STACK | I975: REDHEAD | L975: HAMMOND | O975: WATT | W975: SPRINGVALE | X975: 5 | Y975: 13 | Z975: 0 | AA975: 1532 | AB975: 2185 | AC975: =(AA975/AB975)*100 -> 70.114416475972547 | AD975: =(X975*4)+(Z975*2) -> 20
A976: GOALKICKERS | W976: BOX HILL | X976: 3 | Y976: 14 | Z976: 1 | AA976: 1616 | AB976: 2564 | AC976: =(AA976/AB976)*100 -> 63.026521060842434 | AD976: =(X976*4)+(Z976*2) -> 14
A977: WILLIAMSTOWN | C977: RICKMAN 6 | F977: FOTHERINGHAM 4 | J977: CAHILL 2 | L977: L TAYLOR | O977: SAIT | W977: PRAHRAN | X977: 2 | Y977: 15 | Z977: 1 | AA977: 1791 | AB977: 2524 | AC977: =(AA977/AB977)*100 -> 70.95879556259905 | AD977: =(X977*4)+(Z977*2) -> 10
A978: GEELONG WEST | C978: BERRY 3 | F978: NORTH 2 | I978: McDOWELL | L978: GIBSON | N978: REDHEAD | W978: WERRIBEE | X978: 2 | Y978: 16 | Z978: 0 | AA978: 1761 | AB978: 2598 | AC978: =(AA978/AB978)*100 -> 67.782909930715945 | AD978: =(X978*4)+(Z978*2) -> 8
A980: WERRIBEE | C980: 5 | D980: 10 | E980: 40 | G980: 12 | H980: 11 | I980: 83 | K980: 18 | L980: 14 | M980: 122 | O980: 22 | P980: 17 | Q980: 149 | S980: VENUE: WERRIBEE
A981: PRAHRAN | C981: 2 | D981: 3 | E981: 15 | G981: 4 | H981: 7 | I981: 31 | K981: 7 | L981: 10 | M981: 52 | O981: 9 | P981: 13 | Q981: 67 | S981: OAKLEY :BREWER
A982: BEST PLAYERS
A983: WERRIBEE | C983: MONTGOMERY | F983: S MOLONEY | I983: CHRISTIANSEN | L983: BUCKINGHAM | O983: BURNETT | R983: FEDKE
A984: PRAHRAN | C984: GILES | F984: ELLETT | I984: BARNARD
A985: GOALKICKERS
A986: WERRIBEE | C986: CHRISTIANSEN 5 | F986: GORDON 5 | I986: BURNETT 3 | L986: FRAZER 3 | N986: BUCKINGHAM 2 | Q986: FREEMAN 2 | S986: KATTENSTEINER | W986: REDENBACH
A987: PRAHRAN | C987: MILLS 3 | F987: P McDONALD 2 | I987: MITTELL | K987: WARBURTON | N987: WALES | P987: CUTLER
A989: SANDRINGHAM | C989: 11 | D989: 6 | E989: 72 | G989: 16 | H989: 9 | I989: 105 | K989: 19 | L989: 13 | M989: 127 | O989: 22 | P989: 20 | Q989: 152 | S989: VENUE: CAMBERWELL
A990: CAMBERWELL | C990: 1 | D990: 5 | E990: 11 | G990: 4 | H990: 11 | I990: 35 | K990: 7 | L990: 15 | M990: 57 | O990: 8 | P990: 21 | Q990: 69 | S990: G CASEY ; P MARSHALL
A991: BEST PLAYERS
A992: SANDRINGHAM | C992: MORRISON | F992: GOROZIDIS | I992: FITZPATRICK | L992: SIMMS | O992: SAID | R992: HETHERINGTON
A993: CAMBERWELL | C993: CONSTANTINOU | F993: BUDGE | I993: FREW | L993: ANGUS | O993: DE KONNING | R993: C ROURKE
A994: GOALKICKERS
A995: SANDRINGHAM | C995: MORRISON 11 | F995: GOROZIDIS 5 | I995: SAID 3 | K995: BINGHAM | M995: ADAMS | O995: FITZPATRICK
A996: CAMBERWELL | C996: MAILING 3 | F996: WEATHERALD 2 | I996: S ROURKE 2 | L996: SCOTT
A998: PRESTON | C998: 6 | D998: 4 | E998: 40 | G998: 9 | H998: 10 | I998: 64 | K998: 10 | L998: 10 | M998: 70 | O998: 15 | P998: 16 | Q998: 106 | S998: VENUE: BOX HILL
A999: BOX HILL | C999: 4 | D999: 1 | E999: 25 | G999: 6 | H999: 4 | I999: 40 | K999: 12 | L999: 9 | M999: 81 | O999: 12 | P999: 9 | Q999: 81 | S999: GLEESON ;McDONALD
A1000: BEST PLAYERS
A1001: PRESTON | C1001: SALVADORE | F1001: WHITE | I1001: TOWAN | L1001: LUMICISI | O1001: McKEON | R1001: YEOMANS
A1002: BOX HILL | C1002: DYER | F1002: ROCHOW | I1002: McGHEE | L1002: TEAKEL | O1002: P BOLTON
A1003: GOALKICKERS
A1004: PRESTON | C1004: SALVADORE 6 | F1004: SHAW 4 | H1004: WHITE 2 | J1004: MCKEON | L1004: ZERELLA | N1004: YEOMANS
A1005: BOX HILL | C1005: RAYMOND 3 | F1005: NICHOLSON 2 | I1005: DYER 2 | K1005: McGHEE | M1005: L BOLTON | O1005: GLEESON | Q1005: GARTH | S1005: P BOLTON
A1007: COBURG | C1007: 7 | D1007: 6 | E1007: 48 | G1007: 12 | H1007: 6 | I1007: 78 | K1007: 18 | L1007: 12 | M1007: 120 | O1007: 21 | P1007: 15 | Q1007: 141 | S1007: VENUE: COBURG
A1008: PORT MELBOURNE | C1008: 1 | D1008: 2 | E1008: 8 | G1008: 3 | H1008: 8 | I1008: 26 | K1008: 3 | L1008: 8 | M1008: 26 | O1008: 5 | P1008: 9 | Q1008: 39 | S1008: PHILLIPS ;FITZPATRICK
A1009: BEST PLAYERS
A1010: COBURG | C1010: EVANS | F1010: GIBB | I1010: MANSFIELD | L1010: ALLISON | O1010: SHELDON | Q1010: NIMMO
A1011: PORT MELBOURNE | C1011: JENNINGS | F1011: DERMOTT | I1011: CARTER | L1011: THOMPSON | O1011: ROSS | Q1011: SWAN
A1012: GOALKICKERS
A1013: COBURG | C1013: GIBB 4 | E1013: HALBERT 2 | H1013: ALLISON 2 | J1013: LAIDLER 2 | M1013: FREEMAN 2 | P1013: WEBSTER 2 | R1013: EDWARDS 2 | U1013: DOHNT | W1013: FITZPATRICK | X1013: EVANS | Z1013: ANGWIN | AB1013: HARBINSON
A1014: PORT MELBOURNE | C1014: SWAN | E1014: BRIEDIS | G1014: HOWE | I1014: JENNINGS | K1014: CARTER
A1016: FINALS
A1017: 1ST SEMI | D1017: 1ST SEPTEMBER | I1017: WEATHER
D1018: 1ST QTR | H1018: 2ND QTR | L1018: 3RD QTR | P1018: FINAL | S1018: VENUE: JUNCTION OVAL
A1019: WILLIAMSTOWN | C1019: 6 | D1019: 4 | E1019: 40 | G1019: 8 | H1019: 5 | I1019: 53 | K1019: 12 | L1019: 5 | M1019: 77 | O1019: 16 | P1019: 8 | Q1019: 104 | S1019: UMPIRES
A1020: PRESTON | C1020: 0 | D1020: 4 | E1020: 4 | G1020: 7 | H1020: 8 | I1020: 50 | K1020: 10 | L1020: 12 | M1020: 72 | O1020: 13 | P1020: 15 | Q1020: 93 | S1020: FITZPATRICK :MARSHALL
A1021: BEST PLAYERS
A1022: WILLIAMSTOWN | C1022: SLEVISON | F1022: SAIT | I1022: KERSHAW | L1022: CAHILL | O1022: DAVIDSON | R1022: SWANN
A1023: PRESTON | C1023: JORDAN | F1023: McKEOWN | I1023: HACKNEY | L1023: LUMICISI | O1023: FYFFE | R1023: SHAW
A1024: GOALKICKERS
A1025: WILLIAMSTOWN | C1025: FOTHERINGHAM 5 | F1025: SLEVISON 3 | I1025: SIMMONS 2 | L1025: CAHILL 2 | N1025: DAVIDSON 2 | Q1025: RICKMAN | S1025: SAIT
A1026: PRESTON | C1026: SHAW 6 | F1026: HACKNEY 2 | I1026: SALVADORE | L1026: WHITE | N1026: TOWAN | P1026: LUMICISI | R1026: YEOMANS
A1028: 2ND SEMI | D1028: 8TH SEPTEMBER
A1029: SANDRINGHAM | C1029: 9 | D1029: 3 | E1029: 57 | G1029: 17 | H1029: 9 | I1029: 111 | K1029: 22 | L1029: 13 | M1029: 145 | O1029: 32 | P1029: 16 | Q1029: 208 | S1029: VENUE: JUNCTION OVAL
A1030: COBURG | C1030: 4 | D1030: 6 | E1030: 30 | G1030: 8 | H1030: 7 | I1030: 55 | K1030: 12 | L1030: 12 | M1030: 84 | O1030: 19 | P1030: 14 | Q1030: 128 | S1030: MARCY ;PHILLIPS
A1031: BEST PLAYERS
A1032: SANDRINGHAM | C1032: GALLAGHER | F1032: COLLINS | I1032: MACLEOD | L1032: BEILBY | O1032: BREWER | R1032: HETHERINGTON
A1033: COBURG | C1033: EVANS | F1033: HARBINSON | I1033: LITTLER | L1033: DOHNT
A1034: GOALKICKERS | S1034: KRISTENSEN | V1034: FITZPATRICK
A1035: SANDRINGHAM | C1035: MACLEOD 5 | F1035: GALLAGHER 5 | I1035: BREWER 5 | K1035: BRIAN SAID 5 | N1035: BRENDON SAID 3 | R1035: GOROZIDIS 2 | U1035: MORRISON 2 | X1035: EAVES 2 | AA1035: PEARSON
A1036: COBURG | C1036: EDWARDS 4 | F1036: DOHNT 3 | H1036: FREEMAN 3 | K1036: LAIDLER 2 | M1036: CLEARY 2 | O1036: WEBSTER 2 | Q1036: HALBERT | S1036: SHELDON | V1036: NIMMO
A1038: PRELIMINARY FINAL | E1038: 15TH SEPTEMBER
A1039: WILLIAMSTOWN | C1039: 3 | D1039: 2 | E1039: 20 | G1039: 11 | H1039: 5 | I1039: 71 | K1039: 12 | L1039: 12 | M1039: 84 | O1039: 18 | P1039: 13 | Q1039: 121 | S1039: VENUE: JUNCTION OVAL
A1040: COBURG | C1040: 7 | D1040: 5 | E1040: 47 | G1040: 10 | H1040: 8 | I1040: 68 | K1040: 13 | L1040: 9 | M1040: 87 | O1040: 17 | P1040: 16 | Q1040: 118 | S1040: VERGONA :WALKER
A1041: BEST PLAYERS
A1042: WILLIAMSTOWN | C1042: SAIT | F1042: DIMARTINO | I1042: SWANN | L1042: KERSHAW | O1042: SIMMONS | R1042: CAHILL
A1043: COBURG | C1043: NIMMO | F1043: ALLISON | I1043: HARBINSON | L1043: FREEMAN | O1043: LITTLER
A1044: GOALKICKERS
A1045: WILLIAMSTOWN | C1045: FOTHERINGHAM 4 | G1045: SIMMONS 2 | J1045: TAYLOR 2 | M1045: MUSCHIALLI 2 | P1045: RICKMAN 2 | S1045: SLEVISON 2 | V1045: BRIERTY 2 | X1045: SAIT | Z1045: CAHILL
A1046: COBURG | C1046: HALBERT 3 | F1046: FITZPATRICK 3 | I1046: DOHNT 2 | K1046: GIBB 2 | M1046: FREEMAN 2 | P1046: ZANON | R1046: SHELDON | T1046: NIMMO | V1046: CLEARY | X1046: TULLOCH
A1048: GRAND FINAL | D1048: 22ND SEPTEMBER
A1049: SANDRINGHAM | C1049: 4 | D1049: 3 | E1049: 27 | G1049: 8 | H1049: 6 | I1049: 54 | K1049: 11 | L1049: 13 | M1049: 79 | O1049: 14 | P1049: 16 | Q1049: 100 | S1049: VENUE: JUNCTION OVAL
A1050: WILLIAMSTOWN | C1050: 4 | D1050: 4 | E1050: 28 | G1050: 8 | H1050: 6 | I1050: 54 | K1050: 10 | L1050: 10 | M1050: 70 | O1050: 13 | P1050: 16 | Q1050: 94 | S1050: FITZPATRICK :PHILLIPS
A1051: BEST PLAYERS
A1052: SANDRINGHAM | C1052: EAVES | F1052: COLLINS | I1052: MACLEOD | L1052: BEILBY | O1052: MANNIX | R1052: BRIAN SAID
A1053: WILLIAMSTOWN | C1053: CAHILL | F1053: SAIT | I1053: DAVIDSON | L1053: SIMMONS | O1053: RICKMAN | R1053: WHEELER
A1054: GOALKICKERS
A1055: SANDRINGHAM | C1055: EAVES 5 | F1055: BRIAN SAID 3 | I1055: MANNIX 2 | K1055: KRISTENSEN | N1055: GALLAGHER | Q1055: BREWER | S1055: MORRISON
A1056: WILLIAMSTOWN | C1056: FOTHERINGHAM 5 | G1056: RICKMAN 3 | J1056: BRIERTY 2 | M1056: SAIT | O1056: DAVIDSON | R1056: MUSCHIALLI
A1058: REPRESENTATIVE MATCH | H1058: 12TH JUNE
A1059: V.F.A. | C1059: 7 | D1059: 5 | E1059: 47 | G1059: 9 | H1059: 8 | I1059: 62 | K1059: 10 | L1059: 9 | M1059: 69 | O1059: 14 | P1059: 13 | Q1059: 97
A1060: V.A.F.A. | C1060: 4 | D1060: 1 | E1060: 25 | G1060: 9 | H1060: 8 | I1060: 62 | K1060: 12 | L1060: 10 | M1060: 82 | O1060: 13 | P1060: 10 | Q1060: 88
A1061: BEST PLAYERS
A1062: V.F.A. | C1062: KRANJC | F1062: FYFFE | I1062: O'RILEY | L1062: HALBERT | O1062: MARCON | R1062: CHADBAND
A1063: V.A.F.A. | C1063: EISHOLD | F1063: BROWN | I1063: SMYTHE | L1063: MCDONALD | O1063: RITCHIE | R1063: WILSON
A1064: GOALKICKERS
A1065: V.F.A. | C1065: O'RILEY 4 | F1065: MARCON 3 | I1065: FOTHERINGHAM | L1065: RICKMAN | N1065: GALLAGHER | Q1065: ANDERSON | S1065: SALVADOR | V1065: FYFFE | X1065: LUMICISI
A1066: V.A.F.A. | C1066: GARDE 3 | F1066: EISHOLD 3 | I1066: McDONALD 2 | L1066: MURPHY 2 | O1066: KANIS | Q1066: BOURKE | S1066: CONSIDINE