A1: Victorian Football Association
A2: Season 1986 - Division Two
A3: © Copyright Wal Williams | F3: First created: 28 March 2016
A4: Contact: joywalwi at gmail dot com | F4: Last updated: 28 March 2016 | W4: VFA Results and tables - Link to the main index page
A5: You are free to copy this document in whole or part provided that proper acknowledgement is given to the author. All rights reserved.
A7: 1986 | C7: V.F.A. SEASON 2ND DIVISION
A8: ROUND 1 | E8: 13TH APRIL | J8: WEATHER | S8: PLAYED AT
D9: 1ST QTR | H9: 2ND QTR | L9: 3RD QTR | P9: FINAL | S9: TOORAK PARK
A10: SUNSHINE | C10: 2 | D10: 0 | E10: =C10*6+D10 -> 12 | G10: 8 | H10: 7 | I10: =G10*6+H10 -> 55 | K10: 10 | L10: 10 | M10: =K10*6+L10 -> 70 | O10: 15 | P10: 14 | Q10: =O10*6+P10 -> 104 | S10: UMPIRE | X10: LADDER | AB10: ROUND | AD10: 1
A11: PRAHRAN | C11: 4 | D11: 8 | E11: =C11*6+D11 -> 32 | G11: 7 | H11: 9 | I11: =G11*6+H11 -> 51 | K11: 13 | L11: 14 | M11: =K11*6+L11 -> 92 | O11: 14 | P11: 17 | Q11: =O11*6+P11 -> 101 | S11: TORNEY/McDONALD
A12: BEST PLAYERS | W12: TEAM | X12: W | Y12: L | Z12: D | AA12: FOR | AB12: AGST | AC12: % | AD12: PTS
A13: SUNSHINE | C13: SCANLON | F13: PROTETTO | I13: WALSH | L13: McQUALTER | O13: WAGLAND | R13: MENADUE
A14: PRAHRAN | C14: HUTCHISON | F14: WALLACE | I14: MAZUREK | L14: WALDER | W14: WAVERLEY | X14: 1 | Y14: 0 | Z14: 0 | AA14: 246 | AB14: 65 | AC14: =(AA14*100)/AB14 -> 378.46153846153845 | AD14: =(X14*4)+(Z14*2) -> 4
A15: GOALKICKERS | Q15: WALSH | W15: BOX HILL | X15: 1 | Y15: 0 | Z15: 0 | AA15: 164 | AB15: 93 | AC15: =(AA15*100)/AB15 -> 176.34408602150538 | AD15: =(X15*4)+(Z15*2) -> 4
A16: SUNSHINE | C16: SCANLON 3 | F16: McQUALTER 3 | I16: DAY 2 | K16: GIBB 2 | M16: NELSON | O16: WALKER | Q16: SCICCITATO | S16: D CADDAYE | W16: MOORABBIN | X16: 1 | Y16: 0 | Z16: 0 | AA16: 176 | AB16: 108 | AC16: =(AA16*100)/AB16 -> 162.96296296296296 | AD16: =(X16*4)+(Z16*2) -> 4
A17: PRAHRAN | C17: MILLS 4 | E17: ANDERSON 3 | H17: HUTCHISON 2 | K17: SOULOS 2 | N17: LARKINS | P17: TAYLOR | R17: TAPPING | W17: CAULFIELD | X17: 1 | Y17: 0 | Z17: 0 | AA17: 185 | AB17: 117 | AC17: =(AA17*100)/AB17 -> 158.11965811965811 | AD17: =(X17*4)+(Z17*2) -> 4
A19: OAKLEIGH | C19: 6 | D19: 3 | E19: =C19*6+D19 -> 39 | G19: 6 | H19: 5 | I19: =G19*6+H19 -> 41 | K19: 9 | L19: 8 | M19: =K19*6+L19 -> 62 | O19: 15 | P19: 14 | Q19: =O19*6+P19 -> 104 | S19: WERRIBEE | W19: OAKLEIGH | X19: 1 | Y19: 0 | Z19: 0 | AA19: 104 | AB19: 69 | AC19: =(AA19*100)/AB19 -> 150.72463768115941 | AD19: =(X19*4)+(Z19*2) -> 4
A20: WERRIBEE | C20: 2 | D20: 4 | E20: =C20*6+D20 -> 16 | G20: 4 | H20: 6 | I20: =G20*6+H20 -> 30 | K20: 7 | L20: 7 | M20: =K20*6+L20 -> 49 | O20: 10 | P20: 9 | Q20: =O20*6+P20 -> 69 | S20: MORGAN | W20: SUNSHINE | X20: 1 | Y20: 0 | Z20: 0 | AA20: 104 | AB20: 101 | AC20: =(AA20*100)/AB20 -> 102.97029702970298 | AD20: =(X20*4)+(Z20*2) -> 4
A21: BEST PLAYERS | S21: GLEESON | W21: PRAHRAN | X21: 0 | Y21: 1 | Z21: 0 | AA21: 101 | AB21: 104 | AC21: =(AA21*100)/AB21 -> 97.115384615384613 | AD21: =(X21*4)+(Z21*2) -> 0
A22: OAKLEIGH | C22: BATTERSBY | F22: M ROACH | I22: S ROURKE | L22: McDONALD | O22: C ROURKE | R22: BAIN | W22: WERRIBEE | X22: 0 | Y22: 1 | Z22: 0 | AA22: 69 | AB22: 104 | AC22: =(AA22*100)/AB22 -> 66.34615384615384 | AD22: =(X22*4)+(Z22*2) -> 0
A23: WERRIBEE | C23: BONAT | F23: DOYLE | I23: FARRELLY | L23: BEAUMLER | O23: MILIK | R23: S MOLONEY | W23: BERWICK | X23: 0 | Y23: 1 | Z23: 0 | AA23: 117 | AB23: 185 | AC23: =(AA23*100)/AB23 -> 63.243243243243242 | AD23: =(X23*4)+(Z23*2) -> 0
A24: GOALKICKERS | W24: NORTHCOTE | X24: 0 | Y24: 1 | Z24: 0 | AA24: 108 | AB24: 176 | AC24: =(AA24*100)/AB24 -> 61.363636363636367 | AD24: =(X24*4)+(Z24*2) -> 0
A25: OAKLEIGH | C25: PRETTO 6 | F25: S ROACH 3 | I25: C ROURKE 2 | L25: M ROACH 2 | O25: OLEKSYN | Q25: BARRY | W25: DANDENONG | X25: 0 | Y25: 1 | Z25: 0 | AA25: 93 | AB25: 164 | AC25: =(AA25*100)/AB25 -> 56.707317073170735 | AD25: =(X25*4)+(Z25*2) -> 0
A26: WERRIBEE | C26: MILIK 3 | E26: DOYLE 2 | G26: DUNSTAN | J26: WALPOLE | L26: WILLIAMS | O26: GUINTA | Q26: RICHARDSON | W26: MORDIALLOC | X26: 0 | Y26: 1 | Z26: 0 | AA26: 65 | AB26: 246 | AC26: =(AA26*100)/AB26 -> 26.422764227642276 | AD26: =(X26*4)+(Z26*2) -> 0
A28: WAVERLEY | C28: 9 | D28: 4 | E28: =C28*6+D28 -> 58 | G28: 13 | H28: 11 | I28: =G28*6+H28 -> 89 | K28: 25 | L28: 15 | M28: =K28*6+L28 -> 165 | O28: 37 | P28: 24 | Q28: =O28*6+P28 -> 246 | S28: MORDIALLOC
A29: MORDIALLOC | C29: 1 | D29: 4 | E29: =C29*6+D29 -> 10 | G29: 8 | H29: 8 | I29: =G29*6+H29 -> 56 | K29: 9 | L29: 11 | M29: =K29*6+L29 -> 65 | O29: 9 | P29: 11 | Q29: =O29*6+P29 -> 65 | S29: COOK/SMITH
A30: BEST PLAYERS
A31: WAVERLEY | C31: HARRISON | F31: CASTILLO | I31: FEATHERSTON | L31: BRIGGS | O31: VEAR | R31: KENDALL
A32: MORDIALLOC | C32: MASON | F32: ELMER | I32: CAMPAGNA | L32: BROMLEY | O32: NICHOLAIDES
A33: GOALKICKERS
A34: WAVERLEY | C34: ANGELIS 12 | F34: POLA 10 | H34: BREWER 4 | J34: BRIGGS 3 | L34: HARRISON 3 | O34: VEAR 2 | Q34: ANDERSON | S34: FEATHERSTON | W34: KINNABURGH
A35: MORDIALLOC | C35: CAMPAGNA 3 | F35: NICHOLAIDES 3 | I35: BROMLEY 2 | L35: DEATON
A37: CAULFIELD | C37: 9 | D37: 1 | E37: =C37*6+D37 -> 55 | G37: 13 | H37: 4 | I37: =G37*6+H37 -> 82 | K37: 22 | L37: 7 | M37: =K37*6+L37 -> 139 | O37: 29 | P37: 11 | Q37: =O37*6+P37 -> 185 | S37: BERWICK
A38: BERWICK | C38: 4 | D38: 4 | E38: =C38*6+D38 -> 28 | G38: 7 | H38: 7 | I38: =G38*6+H38 -> 49 | K38: 8 | L38: 12 | M38: =K38*6+L38 -> 60 | O38: 17 | P38: 15 | Q38: =O38*6+P38 -> 117 | S38: KENNEDY/BRADSHAW
A39: BEST PLAYERS
A40: CAULFIELD | C40: HARTSON | F40: FIELD | I40: FARINSKI | L40: ROWBURY | O40: HEMSTRON | R40: MUNROE
A41: BERWICK | C41: JOHNSON | F41: MANNENS | I41: CASHEN | L41: VENVILLE | O41: PARK
A42: GOALKICKERS
A43: CAULFIELD | C43: FIELD 10 | F43: HARTSON 7 | I43: DAWSON 2 | K43: MILLS 2 | M43: MUNROE 2 | O43: HAIDAMOUS 2 | R43: BLACK | T43: HEMSTRON | W43: LEWIS | X43: A BARRY
A44: BERWICK | C44: CASHEN 3 | E44: KENNY 3 | G44: McGREAL 2 | J44: JOHNSON 2 | L44: HIPWORTH 2 | O44: BREEN 2 | Q44: ORSBORNE 2 | T44: PARK
A46: BOX HILL | C46: 6 | D46: 6 | E46: =C46*6+D46 -> 42 | G46: 13 | H46: 11 | I46: =G46*6+H46 -> 89 | K46: 17 | L46: 17 | M46: =K46*6+L46 -> 119 | O46: 24 | P46: 20 | Q46: =O46*6+P46 -> 164 | S46: DANDENONG
A47: DANDENONG | C47: 1 | D47: 5 | E47: =C47*6+D47 -> 11 | G47: 5 | H47: 8 | I47: =G47*6+H47 -> 38 | K47: 9 | L47: 9 | M47: =K47*6+L47 -> 63 | O47: 13 | P47: 15 | Q47: =O47*6+P47 -> 93 | S47: CHAPMAN/LLOYD
A48: BEST PLAYERS
A49: BOX HILL | C49: BOURKE | F49: CUFF | I49: BOLTON | L49: BROWN | O49: GIBSON
A50: DANDENONG | C50: DARREN HALL | F50: J FINN | I50: ENGSTROM | L50: HICKEY | O50: COUSINS | R50: KEE
A51: GOALKICKERS
A52: BOX HILL | C52: BOLTON 7 | F52: FIMCH 5 | H52: NICHOLSON 4 | K52: GARTH 2 | M52: O'SHEA 2 | O52: TEAKEL 2 | R52: ROBERTSON | U52: HEDGER
A53: DANDENONG | C53: WRIGHT 3 | F53: TREMBATH 2 | I53: DARREN HALL 2 | L53: KANNOURAKIS 2 | O53: LAMBERT | R53: ENGSTROM | U53: KEE | W53: HAMILTON
A55: MOORABBIN | C55: 7 | D55: 2 | E55: =C55*6+D55 -> 44 | G55: 10 | H55: 7 | I55: =G55*6+H55 -> 67 | K55: 18 | L55: 10 | M55: =K55*6+L55 -> 118 | O55: 27 | P55: 14 | Q55: =O55*6+P55 -> 176 | S55: NORTHCOTE
A56: NORTHCOTE | C56: 6 | D56: 1 | E56: =C56*6+D56 -> 37 | G56: 12 | H56: 4 | I56: =G56*6+H56 -> 76 | K56: 14 | L56: 6 | M56: =K56*6+L56 -> 90 | O56: 16 | P56: 12 | Q56: =O56*6+P56 -> 108 | S56: BROOKS/CASEY
A57: BEST PLAYERS
A58: MOORABBIN | C58: B CATHCART | F58: GILMORE | I58: STEWART | L58: BAKER | O58: D CATHCART
A59: NORTHCOTE | C59: CASTAGINI | F59: INGLIS | I59: GARNER | L59: MITCHELL | O59: SMITH
A60: GOALKICKERS
A61: MOORABBIN | C61: BEATTIE 5 | F61: BAKER 5 | H61: CLIFFORD 4 | K61: B CATHCART 4 | N61: GILMORE 3 | P61: BARSHUR 3 | S61: STEWART 2 | V61: PHILLIPS
A62: NORTHCOTE | C62: CASTAGINI 5 | F62: MITCHELL 5 | I62: EWING 3 | K62: ARMSTRONG 2 | N62: GARNER
A64: ROUND 2 | E64: 20TH APRIL | J64: WEATHER | S64: PLAYED AT
D65: 1ST QTR | H65: 2ND QTR | L65: 3RD QTR | P65: FINAL | S65: BOX HILL
A66: BOX HILL | C66: 5 | D66: 3 | E66: =C66*6+D66 -> 33 | G66: 11 | H66: 4 | I66: =G66*6+H66 -> 70 | K66: 15 | L66: 24 | M66: =K66*6+L66 -> 114 | O66: 20 | P66: 26 | Q66: =O66*6+P66 -> 146 | S66: UMPIRE | X66: LADDER | AB66: ROUND | AD66: 2
A67: NORTHCOTE | C67: 4 | D67: 5 | E67: =C67*6+D67 -> 29 | G67: 4 | H67: 5 | I67: =G67*6+H67 -> 29 | K67: 8 | L67: 8 | M67: =K67*6+L67 -> 56 | O67: 13 | P67: 10 | Q67: =O67*6+P67 -> 88
A68: BEST PLAYERS | W68: TEAM | X68: W | Y68: L | Z68: D | AA68: FOR | AB68: AGST | AC68: % | AD68: PTS
A69: BOX HILL
A70: NORTHCOTE | W70: OAKLEIGH | X70: 2 | Y70: 0 | Z70: 0 | AA70: 352 | AB70: 126 | AC70: =(AA70*100)/AB70 -> 279.36507936507934 | AD70: =(X70*4)+(Z70*2) -> 8
A71: GOALKICKERS | W71: MOORABBIN | X71: 2 | Y71: 0 | Z71: 0 | AA71: 360 | AB71: 197 | AC71: =(AA71*100)/AB71 -> 182.74111675126903 | AD71: =(X71*4)+(Z71*2) -> 8
A72: BOX HILL | W72: BOX HILL | X72: 2 | Y72: 0 | Z72: 0 | AA72: 310 | AB72: 181 | AC72: =(AA72*100)/AB72 -> 171.2707182320442 | AD72: =(X72*4)+(Z72*2) -> 8
A73: NORTHCOTE | W73: SUNSHINE | X73: 2 | Y73: 0 | Z73: 0 | AA73: 226 | AB73: 188 | AC73: =(AA73*100)/AB73 -> 120.21276595744681 | AD73: =(X73*4)+(Z73*2) -> 8
A75: MOORABBIN | C75: 6 | D75: 5 | E75: =C75*6+D75 -> 41 | G75: 17 | H75: 8 | I75: =G75*6+H75 -> 110 | K75: 22 | L75: 14 | M75: =K75*6+L75 -> 146 | O75: 27 | P75: 22 | Q75: =O75*6+P75 -> 184 | S75: BENTLEIGH | W75: WAVERLEY | X75: 1 | Y75: 1 | Z75: 0 | AA75: 315 | AB75: 184 | AC75: =(AA75*100)/AB75 -> 171.19565217391303 | AD75: =(X75*4)+(Z75*2) -> 4
A76: BERWICK | C76: 3 | D76: 2 | E76: =C76*6+D76 -> 20 | G76: 6 | H76: 2 | I76: =G76*6+H76 -> 38 | K76: 12 | L76: 4 | M76: =K76*6+L76 -> 76 | O76: 14 | P76: 5 | Q76: =O76*6+P76 -> 89 | W76: PRAHRAN | X76: 1 | Y76: 1 | Z76: 0 | AA76: 249 | AB76: 204 | AC76: =(AA76*100)/AB76 -> 122.05882352941177 | AD76: =(X76*4)+(Z76*2) -> 4
A77: BEST PLAYERS | W77: CAULFIELD | X77: 1 | Y77: 1 | Z77: 0 | AA77: 285 | AB77: 265 | AC77: =(AA77*100)/AB77 -> 107.54716981132076 | AD77: =(X77*4)+(Z77*2) -> 4
A78: MOORABBIN | W78: DANDENONG | X78: 1 | Y78: 1 | Z78: 0 | AA78: 212 | AB78: 233 | AC78: =(AA78*100)/AB78 -> 90.987124463519308 | AD78: =(X78*4)+(Z78*2) -> 4
A79: BERWICK | W79: WERRIBEE | X79: 0 | Y79: 2 | Z79: 0 | AA79: 146 | AB79: 226 | AC79: =(AA79*100)/AB79 -> 64.601769911504419 | AD79: =(X79*4)+(Z79*2) -> 0
A80: GOALKICKERS | W80: NORTHCOTE | X80: 0 | Y80: 2 | Z80: 0 | AA80: 196 | AB80: 322 | AC80: =(AA80*100)/AB80 -> 60.869565217391305 | AD80: =(X80*4)+(Z80*2) -> 0
A81: MOORABBIN | W81: BERWICK | X81: 0 | Y81: 2 | Z81: 0 | AA81: 206 | AB81: 369 | AC81: =(AA81*100)/AB81 -> 55.826558265582655 | AD81: =(X81*4)+(Z81*2) -> 0
A82: BERWICK | W82: MORDIALLOC | X82: 0 | Y82: 2 | Z82: 0 | AA82: 122 | AB82: 494 | AC82: =(AA82*100)/AB82 -> 24.696356275303643 | AD82: =(X82*4)+(Z82*2) -> 0
A84: PRAHRAN | C84: 5 | D84: 5 | E84: =C84*6+D84 -> 35 | G84: 12 | H84: 6 | I84: =G84*6+H84 -> 78 | K84: 17 | L84: 6 | M84: =K84*6+L84 -> 108 | O84: 23 | P84: 10 | Q84: =O84*6+P84 -> 148 | S84: PRINCES PARK, CAULFIELD
A85: CAULFIELD | C85: 3 | D85: 0 | E85: =C85*6+D85 -> 18 | G85: 5 | H85: 7 | I85: =G85*6+H85 -> 37 | K85: 10 | L85: 9 | M85: =K85*6+L85 -> 69 | O85: 15 | P85: 10 | Q85: =O85*6+P85 -> 100
A86: BEST PLAYERS
A87: PRAHRAN
A88: CAULFIELD
A89: GOALKICKERS
A90: PRAHRAN
A91: CAULFIELD
A93: SUNSHINE | C93: 5 | D93: 2 | E93: =C93*6+D93 -> 32 | G93: 10 | H93: 9 | I93: =G93*6+H93 -> 69 | K93: 12 | L93: 12 | M93: =K93*6+L93 -> 84 | O93: 18 | P93: 14 | Q93: =O93*6+P93 -> 122 | S93: SUNSHINE
A94: WERRIBEE | C94: 4 | D94: 1 | E94: =C94*6+D94 -> 25 | G94: 7 | H94: 7 | I94: =G94*6+H94 -> 49 | K94: 9 | L94: 12 | M94: =K94*6+L94 -> 66 | O94: 12 | P94: 15 | Q94: =O94*6+P94 -> 87
A95: BEST PLAYERS
A96: SUNSHINE
A97: WERRIBEE
A98: GOALKICKERS
A99: SUNSHINE
A100: WERRIBEE
A102: OAKLEIGH | C102: 12 | D102: 6 | E102: =C102*6+D102 -> 78 | G102: 19 | H102: 8 | I102: =G102*6+H102 -> 122 | K102: 26 | L102: 12 | M102: =K102*6+L102 -> 168 | O102: 39 | P102: 14 | Q102: =O102*6+P102 -> 248 | S102: OAKLEIGH
A103: MORDIALLOC | C103: 0 | D103: 2 | E103: =C103*6+D103 -> 2 | G103: 3 | H103: 2 | I103: =G103*6+H103 -> 20 | K103: 4 | L103: 3 | M103: =K103*6+L103 -> 27 | O103: 8 | P103: 9 | Q103: =O103*6+P103 -> 57
A104: BEST PLAYERS
A105: OAKLEIGH
A106: MORDIALLOC
A107: GOALKICKERS
A108: OAKLEIGH
A109: MORDIALLOC
A111: DANDENONG | C111: 5 | D111: 3 | E111: =C111*6+D111 -> 33 | G111: 8 | H111: 7 | I111: =G111*6+H111 -> 55 | K111: 9 | L111: 15 | M111: =K111*6+L111 -> 69 | O111: 17 | P111: 17 | Q111: =O111*6+P111 -> 119 | S111: WAVERLEY
A112: WAVERLEY | C112: 1 | D112: 1 | E112: =C112*6+D112 -> 7 | G112: 3 | H112: 6 | I112: =G112*6+H112 -> 24 | K112: 8 | L112: 8 | M112: =K112*6+L112 -> 56 | O112: 10 | P112: 9 | Q112: =O112*6+P112 -> 69
A113: BEST PLAYERS
A114: DANDENONG
A115: WAVERLEY
A116: GOALKICKERS
A117: DANDENONG
A118: WAVERLEY
A120: ROUND 3 | E120: 27TH APRIL | J120: WEATHER | S120: PLAYED AT
D121: 1ST QTR | H121: 2ND QTR | L121: 3RD QTR | P121: FINAL | S121: MORDIALLOC
A122: SUNSHINE | C122: 7 | D122: 2 | E122: =C122*6+D122 -> 44 | G122: 16 | H122: 7 | I122: =G122*6+H122 -> 103 | K122: 19 | L122: 11 | M122: =K122*6+L122 -> 125 | O122: 24 | P122: 16 | Q122: =O122*6+P122 -> 160 | S122: UMPIRE | X122: LADDER | AB122: ROUND | AD122: 3
A123: MORDIALLOC | C123: 0 | D123: 2 | E123: =C123*6+D123 -> 2 | G123: 0 | H123: 2 | I123: =G123*6+H123 -> 2 | K123: 3 | L123: 6 | M123: =K123*6+L123 -> 24 | O123: 4 | P123: 6 | Q123: =O123*6+P123 -> 30
A124: BEST PLAYERS | W124: TEAM | X124: W | Y124: L | Z124: D | AA124: FOR | AB124: AGST | AC124: % | AD124: PTS
A125: SUNSHINE
A126: MORDIALLOC | W126: OAKLEIGH | X126: 3 | Y126: 0 | Z126: 0 | AA126: 490 | AB126: 219 | AC126: =(AA126*100)/AB126 -> 223.74429223744292 | AD126: =(X126*4)+(Z126*2) -> 12
A127: GOALKICKERS | W127: BOX HILL | X127: 3 | Y127: 0 | Z127: 0 | AA127: 422 | AB127: 237 | AC127: =(AA127*100)/AB127 -> 178.05907172995779 | AD127: =(X127*4)+(Z127*2) -> 12
A128: SUNSHINE | W128: SUNSHINE | X128: 3 | Y128: 0 | Z128: 0 | AA128: 386 | AB128: 218 | AC128: =(AA128*100)/AB128 -> 177.06422018348624 | AD128: =(X128*4)+(Z128*2) -> 12
A129: MORDIALLOC | W129: PRAHRAN | X129: 2 | Y129: 1 | Z129: 0 | AA129: 404 | AB129: 256 | AC129: =(AA129*100)/AB129 -> 157.8125 | AD129: =(X129*4)+(Z129*2) -> 8
A131: WERRIBEE | C131: 9 | D131: 4 | E131: =C131*6+D131 -> 58 | G131: 14 | H131: 7 | I131: =G131*6+H131 -> 91 | K131: 18 | L131: 16 | M131: =K131*6+L131 -> 124 | O131: 24 | P131: 19 | Q131: =O131*6+P131 -> 163 | S131: WERRIBEE | W131: MOORABBIN | X131: 2 | Y131: 1 | Z131: 0 | AA131: 412 | AB131: 352 | AC131: =(AA131*100)/AB131 -> 117.04545454545455 | AD131: =(X131*4)+(Z131*2) -> 8
A132: CAULFIELD | C132: 3 | D132: 1 | E132: =C132*6+D132 -> 19 | G132: 6 | H132: 4 | I132: =G132*6+H132 -> 40 | K132: 8 | L132: 8 | M132: =K132*6+L132 -> 56 | O132: 13 | P132: 10 | Q132: =O132*6+P132 -> 88 | W132: DANDENONG | X132: 2 | Y132: 1 | Z132: 0 | AA132: 308 | AB132: 318 | AC132: =(AA132*100)/AB132 -> 96.855345911949684 | AD132: =(X132*4)+(Z132*2) -> 8
A133: BEST PLAYERS | W133: WAVERLEY | X133: 1 | Y133: 2 | Z133: 0 | AA133: 408 | AB133: 322 | AC133: =(AA133*100)/AB133 -> 126.7080745341615 | AD133: =(X133*4)+(Z133*2) -> 4
A134: WERRIBEE | W134: WERRIBEE | X134: 1 | Y134: 2 | Z134: 0 | AA134: 309 | AB134: 314 | AC134: =(AA134*100)/AB134 -> 98.407643312101911 | AD134: =(X134*4)+(Z134*2) -> 4
A135: CAULFIELD | W135: CAULFIELD | X135: 1 | Y135: 2 | Z135: 0 | AA135: 373 | AB135: 428 | AC135: =(AA135*100)/AB135 -> 87.149532710280369 | AD135: =(X135*4)+(Z135*2) -> 4
A136: GOALKICKERS | W136: NORTHCOTE | X136: 0 | Y136: 3 | Z136: 0 | AA136: 281 | AB136: 418 | AC136: =(AA136*100)/AB136 -> 67.224880382775126 | AD136: =(X136*4)+(Z136*2) -> 0
A137: WERRIBEE | W137: BERWICK | X137: 0 | Y137: 3 | Z137: 0 | AA137: 262 | AB137: 481 | AC137: =(AA137*100)/AB137 -> 54.469854469854468 | AD137: =(X137*4)+(Z137*2) -> 0
A138: CAULFIELD | W138: MORDIALLOC | X138: 0 | Y138: 3 | Z138: 0 | AA138: 152 | AB138: 654 | AC138: =(AA138*100)/AB138 -> 23.24159021406728 | AD138: =(X138*4)+(Z138*2) -> 0
A140: PRAHRAN | C140: 7 | D140: 0 | E140: =C140*6+D140 -> 42 | G140: 14 | H140: 7 | I140: =G140*6+H140 -> 91 | K140: 16 | L140: 15 | M140: =K140*6+L140 -> 111 | O140: 22 | P140: 23 | Q140: =O140*6+P140 -> 155 | S140: TOORAK PARK
A141: MOORABBIN | C141: 2 | D141: 5 | E141: =C141*6+D141 -> 17 | G141: 2 | H141: 8 | I141: =G141*6+H141 -> 20 | K141: 5 | L141: 11 | M141: =K141*6+L141 -> 41 | O141: 6 | P141: 16 | Q141: =O141*6+P141 -> 52
A142: BEST PLAYERS
A143: PRAHRAN
A144: MOORABBIN
A145: GOALKICKERS
A146: PRAHRAN
A147: MOORABBIN
A149: BOX HILL | C149: 1 | D149: 7 | E149: =C149*6+D149 -> 13 | G149: 4 | H149: 13 | I149: =G149*6+H149 -> 37 | K149: 12 | L149: 15 | M149: =K149*6+L149 -> 87 | O149: 15 | P149: 22 | Q149: =O149*6+P149 -> 112 | S149: BERWICK
A150: BERWICK | C150: 1 | D150: 4 | E150: =C150*6+D150 -> 10 | G150: 4 | H150: 6 | I150: =G150*6+H150 -> 30 | K150: 6 | L150: 10 | M150: =K150*6+L150 -> 46 | O150: 7 | P150: 14 | Q150: =O150*6+P150 -> 56
A151: BEST PLAYERS
A152: BOX HILL
A153: BERWICK
A154: GOALKICKERS
A155: BOX HILL
A156: BERWICK
A158: DANDENONG | C158: 3 | D158: 4 | E158: =C158*6+D158 -> 22 | G158: 6 | H158: 7 | I158: =G158*6+H158 -> 43 | K158: 9 | L158: 8 | M158: =K158*6+L158 -> 62 | O158: 14 | P158: 12 | Q158: =O158*6+P158 -> 96 | S158: NORTHCOTE
A159: NORTHCOTE | C159: 6 | D159: 2 | E159: =C159*6+D159 -> 38 | G159: 9 | H159: 2 | I159: =G159*6+H159 -> 56 | K159: 13 | L159: 4 | M159: =K159*6+L159 -> 82 | O159: 13 | P159: 7 | Q159: =O159*6+P159 -> 85
A160: BEST PLAYERS
A161: DANDENONG
A162: NORTHCOTE
A163: GOALKICKERS
A164: DANDENONG
A165: NORTHCOTE
A167: OAKLEIGH | C167: 6 | D167: 1 | E167: =C167*6+D167 -> 37 | G167: 10 | H167: 9 | I167: =G167*6+H167 -> 69 | K167: 15 | L167: 13 | M167: =K167*6+L167 -> 103 | O167: 19 | P167: 24 | Q167: =O167*6+P167 -> 138 | S167: OAKLEIGH
A168: WAVERLEY | C168: 6 | D168: 4 | E168: =C168*6+D168 -> 40 | G168: 8 | H168: 4 | I168: =G168*6+H168 -> 52 | K168: 11 | L168: 6 | M168: =K168*6+L168 -> 72 | O168: 14 | P168: 9 | Q168: =O168*6+P168 -> 93
A169: BEST PLAYERS
A170: OAKLEIGH
A171: WAVERLEY
A172: GOALKICKERS
A173: OAKLEIGH
A174: WAVERLEY
A176: ROUND 4 | E176: 4TH MAY | J176: WEATHER | S176: PLAYED AT
D177: 1ST QTR | H177: 2ND QTR | L177: 3RD QTR | P177: FINAL | S177: DANDENONG
A178: DANDENONG | C178: 6 | D178: 4 | E178: =C178*6+D178 -> 40 | G178: 17 | H178: 8 | I178: =G178*6+H178 -> 110 | K178: 19 | L178: 9 | M178: =K178*6+L178 -> 123 | O178: 25 | P178: 27 | Q178: =O178*6+P178 -> 177 | S178: UMPIRE | X178: LADDER | AB178: ROUND | AD178: 4
A179: BERWICK | C179: 3 | D179: 1 | E179: =C179*6+D179 -> 19 | G179: 4 | H179: 4 | I179: =G179*6+H179 -> 28 | K179: 6 | L179: 10 | M179: =K179*6+L179 -> 46 | O179: 9 | P179: 12 | Q179: =O179*6+P179 -> 66 | S179: COOKE/RYAN
A180: BEST PLAYERS | W180: TEAM | X180: W | Y180: L | Z180: D | AA180: FOR | AB180: AGST | AC180: % | AD180: PTS
A181: DANDENONG | C181: P KNIGHT | F181: ENGSTROM | I181: K FINN | L181: PALLANT | O181: DARREN HALL | R181: LEEMON
A182: BERWICK | C182: MANNENS | F182: M JOHNSON | I182: S JOHNSON | L182: TRAIL | W182: BOX HILL | X182: 4 | Y182: 0 | Z182: 0 | AA182: 578 | AB182: 315 | AC182: =(AA182*100)/AB182 -> 183.49206349206349 | AD182: =(X182*4)+(Z182*2) -> 16
A183: GOALKICKERS | W183: SUNSHINE | X183: 4 | Y183: 0 | Z183: 0 | AA183: 503 | AB183: 332 | AC183: =(AA183*100)/AB183 -> 151.50602409638554 | AD183: =(X183*4)+(Z183*2) -> 16
A184: DANDENONG | C184: LEEMON 9 | F184: ENGSTROM 4 | I184: DARREN HALL 3 | L184: SLATTERY 3 | O184: LAMBERT 3 | R184: WRIGHT 2 | T184: PALLANT | W184: OAKLEIGH | X184: 3 | Y184: 1 | Z184: 0 | AA184: 604 | AB184: 336 | AC184: =(AA184*100)/AB184 -> 179.76190476190476 | AD184: =(X184*4)+(Z184*2) -> 12
A185: BERWICK | C185: PARK 2 | E185: S JOHNSON 2 | H185: HIPWORTH | K185: WRIGHT | M185: ORSBORN | O185: McGREAL | R185: TRIGG | W185: DANDENONG | X185: 3 | Y185: 1 | Z185: 0 | AA185: 485 | AB185: 384 | AC185: =(AA185*100)/AB185 -> 126.30208333333333 | AD185: =(X185*4)+(Z185*2) -> 12
A187: BOX HILL | C187: 4 | D187: 8 | E187: =C187*6+D187 -> 32 | G187: 11 | H187: 9 | I187: =G187*6+H187 -> 75 | K187: 13 | L187: 13 | M187: =K187*6+L187 -> 91 | O187: 23 | P187: 18 | Q187: =O187*6+P187 -> 156 | S187: BOX HILL | W187: WAVERLEY | X187: 2 | Y187: 2 | Z187: 0 | AA187: 587 | AB187: 415 | AC187: =(AA187*100)/AB187 -> 141.44578313253012 | AD187: =(X187*4)+(Z187*2) -> 8
A188: PRAHRAN | C188: 2 | D188: 3 | E188: =C188*6+D188 -> 15 | G188: 5 | H188: 3 | I188: =G188*6+H188 -> 33 | K188: 11 | L188: 6 | M188: =K188*6+L188 -> 72 | O188: 12 | P188: 6 | Q188: =O188*6+P188 -> 78 | W188: PRAHRAN | X188: 2 | Y188: 2 | Z188: 0 | AA188: 482 | AB188: 412 | AC188: =(AA188*100)/AB188 -> 116.99029126213593 | AD188: =(X188*4)+(Z188*2) -> 8
A189: BEST PLAYERS | W189: MOORABBIN | X189: 2 | Y189: 2 | Z189: 0 | AA189: 496 | AB189: 462 | AC189: =(AA189*100)/AB189 -> 107.35930735930737 | AD189: =(X189*4)+(Z189*2) -> 8
A190: BOX HILL | C190: TRESSIDER | F190: METZNER | I190: GARTH | L190: BOURKE | N190: TEAKEL | Q190: COLLINS | W190: WERRIBEE | X190: 2 | Y190: 2 | Z190: 0 | AA190: 419 | AB190: 398 | AC190: =(AA190*100)/AB190 -> 105.27638190954774 | AD190: =(X190*4)+(Z190*2) -> 8
A191: PRAHRAN | C191: EASON | F191: REED | I191: BATT | W191: CAULFIELD | X191: 2 | Y191: 2 | Z191: 0 | AA191: 537 | AB191: 516 | AC191: =(AA191*100)/AB191 -> 104.06976744186046 | AD191: =(X191*4)+(Z191*2) -> 8
A192: GOALKICKERS | K192: GARTH 2 | N192: TEAKEL | P192: O'SHEA | W192: NORTHCOTE | X192: 0 | Y192: 4 | Z192: 0 | AA192: 374 | AB192: 597 | AC192: =(AA192*100)/AB192 -> 62.646566164154102 | AD192: =(X192*4)+(Z192*2) -> 0
A193: BOX HILL | C193: TRESSIDER 5 | F193: L BOLTON 4 | I193: NICHOLSON 2 | L193: DWYER 2 | N193: ROBERTSON 2 | Q193: GLEESON 2 | S193: FINCH 2 | W193: BERWICK | X193: 0 | Y193: 4 | Z193: 0 | AA193: 328 | AB193: 658 | AC193: =(AA193*100)/AB193 -> 49.848024316109424 | AD193: =(X193*4)+(Z193*2) -> 0
A194: PRAHRAN | C194: WALDER 4 | F194: DURNAN 2 | I194: SOULOS 2 | K194: G GILES 2 | N194: TAYLOR | P194: O'BREE | W194: MORDIALLOC | X194: 0 | Y194: 4 | Z194: 0 | AA194: 240 | AB194: 818 | AC194: =(AA194*100)/AB194 -> 29.339853300733495 | AD194: =(X194*4)+(Z194*2) -> 0
A196: CAULFIELD | C196: 5 | D196: 9 | E196: =C196*6+D196 -> 39 | G196: 8 | H196: 11 | I196: =G196*6+H196 -> 59 | K196: 15 | L196: 13 | M196: =K196*6+L196 -> 103 | O196: 24 | P196: 20 | Q196: =O196*6+P196 -> 164 | S196: PRINCES PARK, CAULFIELD
A197: MORDIALLOC | C197: 3 | D197: 1 | E197: =C197*6+D197 -> 19 | G197: 8 | H197: 9 | I197: =G197*6+H197 -> 57 | K197: 11 | L197: 10 | M197: =K197*6+L197 -> 76 | O197: 13 | P197: 10 | Q197: =O197*6+P197 -> 88 | S197: HUTCHINSON/PHILLIPS
A198: BEST PLAYERS
A199: CAULFIELD | C199: HARTSON | F199: MONROE | I199: PAVEY | L199: BLACK | N199: FIELD | Q199: GODAU
A200: MORDIALLOC | C200: PARKER | F200: ELMER
A201: GOALKICKERS
A202: CAULFIELD | C202: FIELD 7 | E202: HARTSON 5 | H202: DAWSON 3 | K202: BROUGHILL 2 | N202: EINSEDEL 2 | Q202: LARKIN 2 | S202: GODAU | U202: LEWIS | W202: STEWART
A203: MORDIALLOC | C203: PARKER 5 | F203: ELMER 3 | H203: O'HALLORAN 2 | K203: DAVIDSON | N203: DIXON | P203: CASTLES
A205: WERRIBEE | C205: 5 | D205: 3 | E205: =C205*6+D205 -> 33 | G205: 7 | H205: 8 | I205: =G205*6+H205 -> 50 | K205: 10 | L205: 12 | M205: =K205*6+L205 -> 72 | O205: 16 | P205: 14 | Q205: =O205*6+P205 -> 110 | S205: BENTLEIGH
A206: MOORABBIN | C206: 3 | D206: 4 | E206: =C206*6+D206 -> 22 | G206: 5 | H206: 8 | I206: =G206*6+H206 -> 38 | K206: 9 | L206: 11 | M206: =K206*6+L206 -> 65 | O206: 12 | P206: 12 | Q206: =O206*6+P206 -> 84 | S206: R CASEY/G CASEY
A207: BEST PLAYERS
A208: WERRIBEE | C208: RICHARDSON | F208: BAEUMLER | I208: COMBEN | L208: PERKINS | O208: WILLIAMS | R208: DUNSTAN
A209: MOORABBIN | C209: McGUINNESS | F209: POLLOCK | I209: BAKER | L209: BOUKER | O209: SCHULTZ
A210: GOALKICKERS
A211: WERRIBEE | C211: KELLY 6 | E211: RICHARDSON 3 | H211: SPIERINGS 3 | K211: PERKINS 2 | N211: WILLIAMS | Q211: WALPOLE
A212: MOORABBIN | C212: BOUKER 5 | F212: D CATHCART 2 | I212: BEATTIE 2 | K212: PAPPAS | M212: STEWART | O212: P LAZZARO
A214: SUNSHINE | C214: 3 | D214: 4 | E214: =C214*6+D214 -> 22 | G214: 9 | H214: 6 | I214: =G214*6+H214 -> 60 | K214: 13 | L214: 7 | M214: =K214*6+L214 -> 85 | O214: 18 | P214: 9 | Q214: =O214*6+P214 -> 117 | S214: SUNSHINE
A215: OAKLEIGH | C215: 5 | D215: 1 | E215: =C215*6+D215 -> 31 | G215: 8 | H215: 2 | I215: =G215*6+H215 -> 50 | K215: 13 | L215: 4 | M215: =K215*6+L215 -> 82 | O215: 18 | P215: 6 | Q215: =O215*6+P215 -> 114 | S215: MARCY/MARSHALL
A216: BEST PLAYERS
A217: SUNSHINE | C217: MENADUE | F217: WALSH | I217: LITCHFIELD | L217: LAWLER | O217: D CADDAYE | R217: SCANLON
A218: OAKLEIGH | C218: SUTHERLAND | F218: BAIN | I218: TODD | L218: MARSHALL | O218: MACDONALD | R218: BATTERSBY
A219: GOALKICKERS
A220: SUNSHINE | C220: LITCHFIELD 9 | F220: DAY 3 | H220: FORBES 2 | J220: D CADDAYE | M220: D BROWN | O220: SCANLON | Q220: SCHICCITANO
A221: OAKLEIGH | C221: PRETTO 5 | F221: SUTHERLAND 4 | I221: JOHNSTON 2 | K221: M OWEN 2 | N221: ROACH | P221: NEARY | R221: ATHERTON | U221: ROURKE
A223: WAVERLEY | C223: 10 | D223: 5 | E223: =C223*6+D223 -> 65 | G223: 13 | H223: 10 | I223: =G223*6+H223 -> 88 | K223: 22 | L223: 15 | M223: =K223*6+L223 -> 147 | O223: 27 | P223: 17 | Q223: =O223*6+P223 -> 179 | S223: WAVERLEY
A224: NORTHCOTE | C224: 1 | D224: 1 | E224: =C224*6+D224 -> 7 | G224: 4 | H224: 4 | I224: =G224*6+H224 -> 28 | K224: 8 | L224: 6 | M224: =K224*6+L224 -> 54 | O224: 14 | P224: 9 | Q224: =O224*6+P224 -> 93 | S224: McDONALD/NOLAN
A225: BEST PLAYERS
A226: WAVERLEY | C226: DE WIT | F226: KENDALL | I226: CSOTI | L226: ANGELIS | O226: ANDERSON | R226: PALLOTTA
A227: NORTHCOTE | C227: MINNETT | F227: COURTS | I227: MALLETT | L227: CASTAGINI | O227: INGLIS
A228: GOALKICKERS
A229: WAVERLEY | C229: ANGELIS 11 | F229: ANDERSON 3 | I229: VEAR 3 | K229: FEATHERSTON 2 | O229: DE WIT 2 | Q229: BRIGGS 2 | S229: BUCK 2 | U229: CASTILLO | W229: KENDALL
A230: NORTHCOTE | C230: STRANGWICK 4 | F230: MALLESON 2 | I230: ARMSTRONG | L230: SPAGNOLO | N230: SMITH | P230: MITCHELL | R230: CASTAGINI | T230: INGLIS | V230: SPROAT | X230: GARNER
A232: ROUND 5 | E232: 18TH MAY | J232: WEATHER | S232: PLAYED AT
D233: 1ST QTR | H233: 2ND QTR | L233: 3RD QTR | P233: FINAL | S233: MORDIALLOC
A234: MOORABBIN | C234: 6 | D234: 1 | E234: =C234*6+D234 -> 37 | G234: 13 | H234: 7 | I234: =G234*6+H234 -> 85 | K234: 16 | L234: 9 | M234: =K234*6+L234 -> 105 | O234: 23 | P234: 12 | Q234: =O234*6+P234 -> 150 | S234: UMPIRE | X234: LADDER | AB234: ROUND | AD234: 5
A235: MORDIALLOC | C235: 4 | D235: 6 | E235: =C235*6+D235 -> 30 | G235: 6 | H235: 7 | I235: =G235*6+H235 -> 43 | K235: 8 | L235: 11 | M235: =K235*6+L235 -> 59 | O235: 10 | P235: 12 | Q235: =O235*6+P235 -> 72 | S235: TORNEY/WARD
A236: BEST PLAYERS | W236: TEAM | X236: W | Y236: L | Z236: D | AA236: FOR | AB236: AGST | AC236: % | AD236: PTS
A237: MOORABBIN | C237: MERCOULIA | F237: POLLOCK | I237: PHILLIPS | L237: GILMORE | O237: B LAZZARO
A238: MORDIALLOC | C238: TURNBULL | F238: DIXON | I238: MANGONI | L238: SUETLOIK | O238: CULLINAN | R238: T EVANS | W238: BOX HILL | X238: 5 | Y238: 0 | Z238: 0 | AA238: 686 | AB238: 388 | AC238: =(AA238*100)/AB238 -> 176.8041237113402 | AD238: =(X238*4)+(Z238*2) -> 20
A239: GOALKICKERS | I239: POLLOCK | L239: BEATTIE | N239: MERCOULIA | Q239: SCHULTZ | S239: LOBECCA | W239: SUNSHINE | X239: 5 | Y239: 0 | Z239: 0 | AA239: 641 | AB239: 384 | AC239: =(AA239*100)/AB239 -> 166.92708333333334 | AD239: =(X239*4)+(Z239*2) -> 20
A240: MOORABBIN | C240: GILMORE 5 | F240: STEWART 3 | I240: BOUKER 3 | K240: D CATHCART 2 | N240: B LAZZARO 2 | Q240: DIMATTINA 2 | T240: PAPPAS | W240: OAKLEIGH | X240: 4 | Y240: 1 | Z240: 0 | AA240: 770 | AB240: 401 | AC240: =(AA240*100)/AB240 -> 192.01995012468828 | AD240: =(X240*4)+(Z240*2) -> 16
A241: MORDIALLOC | C241: CULLINAN 2 | F241: TURNBULL 2 | I241: MANGONI | K241: BENSON | M241: ZUCCIO | O241: P EVANS | Q241: McGREGOR | T241: FOX | W241: DANDENONG | X241: 3 | Y241: 2 | Z241: 0 | AA241: 547 | AB241: 451 | AC241: =(AA241*100)/AB241 -> 121.2860310421286 | AD241: =(X241*4)+(Z241*2) -> 12
A243: BOX HILL | C243: 4 | D243: 4 | E243: =C243*6+D243 -> 28 | G243: 8 | H243: 8 | I243: =G243*6+H243 -> 56 | K243: 10 | L243: 14 | M243: =K243*6+L243 -> 74 | O243: 15 | P243: 18 | Q243: =O243*6+P243 -> 108 | S243: WERRIBEE | W243: MOORABBIN | X243: 3 | Y243: 2 | Z243: 0 | AA243: 646 | AB243: 534 | AC243: =(AA243*100)/AB243 -> 120.97378277153558 | AD243: =(X243*4)+(Z243*2) -> 12
A244: WERRIBEE | C244: 2 | D244: 4 | E244: =C244*6+D244 -> 16 | G244: 3 | H244: 7 | I244: =G244*6+H244 -> 25 | K244: 7 | L244: 10 | M244: =K244*6+L244 -> 52 | O244: 10 | P244: 13 | Q244: =O244*6+P244 -> 73 | S244: BRADY | W244: PRAHRAN | X244: 3 | Y244: 2 | Z244: 0 | AA244: 549 | AB244: 474 | AC244: =(AA244*100)/AB244 -> 115.82278481012658 | AD244: =(X244*4)+(Z244*2) -> 12
A245: BEST PLAYERS | S245: BROOKS | W245: WAVERLEY | X245: 2 | Y245: 3 | Z245: 0 | AA245: 639 | AB245: 553 | AC245: =(AA245*100)/AB245 -> 115.55153707052442 | AD245: =(X245*4)+(Z245*2) -> 8
A246: BOX HILL | C246: BOURKE | F246: METZNER | I246: COLLINS | L246: CUFF | N246: TEAKEL | W246: WERRIBEE | X246: 2 | Y246: 3 | Z246: 0 | AA246: 492 | AB246: 506 | AC246: =(AA246*100)/AB246 -> 97.233201581027672 | AD246: =(X246*4)+(Z246*2) -> 8
A247: WERRIBEE | C247: MOLONEY | F247: DUNSTAN | I247: HOPKINS | L247: RICHARDSON | O247: WILLIAMS | R247: DOYLE | W247: CAULFIELD | X247: 2 | Y247: 3 | Z247: 0 | AA247: 603 | AB247: 672 | AC247: =(AA247*100)/AB247 -> 89.732142857142861 | AD247: =(X247*4)+(Z247*2) -> 8
A248: GOALKICKERS | W248: BERWICK | X248: 1 | Y248: 4 | Z248: 0 | AA248: 457 | AB248: 774 | AC248: =(AA248*100)/AB248 -> 59.043927648578808 | AD248: =(X248*4)+(Z248*2) -> 4
A249: BOX HILL | C249: DWYER 5 | E249: BOLTON 4 | G249: NICHOLSON 2 | J249: TEAKEL 2 | L249: GLEESON | N249: SHERIDAN | W249: NORTHCOTE | X249: 0 | Y249: 5 | Z249: 0 | AA249: 490 | AB249: 726 | AC249: =(AA249*100)/AB249 -> 67.493112947658403 | AD249: =(X249*4)+(Z249*2) -> 0
A250: WERRIBEE | C250: KELLY 2 | E250: DOYLE 2 | G250: RICHARDSON 2 | J250: COMBEN | L250: PERKINS | N250: SPIERINGS | Q250: FRASER | W250: MORDIALLOC | X250: 0 | Y250: 5 | Z250: 0 | AA250: 312 | AB250: 968 | AC250: =(AA250*100)/AB250 -> 32.231404958677686 | AD250: =(X250*4)+(Z250*2) -> 0
A252: PRAHRAN | C252: 1 | D252: 6 | E252: =C252*6+D252 -> 12 | G252: 3 | H252: 9 | I252: =G252*6+H252 -> 27 | K252: 6 | L252: 11 | M252: =K252*6+L252 -> 47 | O252: 8 | P252: 19 | Q252: =O252*6+P252 -> 67 | S252: TOORAK PARK
A253: DANDENONG | C253: 4 | D253: 3 | E253: =C253*6+D253 -> 27 | G253: 6 | H253: 6 | I253: =G253*6+H253 -> 42 | K253: 7 | L253: 11 | M253: =K253*6+L253 -> 53 | O253: 8 | P253: 14 | Q253: =O253*6+P253 -> 62 | S253: CASEY/HULM
A254: BEST PLAYERS
A255: PRAHRAN | C255: REED | E255: COOK | H255: HERMANN | K255: TAPPING | N255: FIELDING | Q255: HULJACK
A256: DANDENONG | C256: KAYE | E256: McGUINNESS | H256: KNIGHT | K256: FINN | N256: SLATTERY | Q256: PALLANT
A257: GOALKICKERS
A258: PRAHRAN | C258: BINGHAM 3 | F258: TAYLOR | I258: WALDER | K258: COOK | M258: TAPPING | O258: GILES
A259: DANDENONG | C259: PALLANT | E259: WRIGHT | G259: KANNOURAKIS | J259: ENGSTROM | M259: DARREN HALL | P259: LEEMON | R259: SLATTERY | U259: KNIGHT
A261: BERWICK | C261: 5 | D261: 7 | E261: =C261*6+D261 -> 37 | G261: 11 | H261: 10 | I261: =G261*6+H261 -> 76 | K261: 17 | L261: 12 | M261: =K261*6+L261 -> 114 | O261: 19 | P261: 15 | Q261: =O261*6+P261 -> 129 | S261: BERWICK
A262: NORTHCOTE | C262: 2 | D262: 3 | E262: =C262*6+D262 -> 15 | G262: 4 | H262: 9 | I262: =G262*6+H262 -> 33 | K262: 8 | L262: 12 | M262: =K262*6+L262 -> 60 | O262: 17 | P262: 14 | Q262: =O262*6+P262 -> 116 | S262: LLOYD/CURRAN
A263: BEST PLAYERS
A264: BERWICK | C264: HIPWORTH | F264: M JOHNSON | I264: PARK | K264: CASHEN | N264: TRIGG | P264: MANNENS
A265: NORTHCOTE | C265: MINNETT | F265: ARMSTRONG | I265: INGLIS
A266: GOALKICKERS
A267: BERWICK | C267: TRIGG 5 | E267: M JOHNSON 5 | H267: ORSBORN 2 | K267: PARK 2 | M267: KENNY 2 | O267: WRIGHT | Q267: HIPWORTH
A268: NORTHCOTE | C268: ARMSTRONG 5 | F268: INGLIS 2 | H268: SPROAT 2 | J268: MALLESON 2 | M268: MITCHELL | O268: VARVITSIOTIS | R268: G STRANGWICK | V268: A STRANGWICK | X268: COURTS | Z268: TILBERI
A270: SUNSHINE | C270: 5 | D270: 5 | E270: =C270*6+D270 -> 35 | G270: 9 | H270: 7 | I270: =G270*6+H270 -> 61 | K270: 13 | L270: 7 | M270: =K270*6+L270 -> 85 | O270: 21 | P270: 12 | Q270: =O270*6+P270 -> 138 | S270: SUNSHINE
A271: WAVERLEY | C271: 2 | D271: 5 | E271: =C271*6+D271 -> 17 | G271: 3 | H271: 7 | I271: =G271*6+H271 -> 25 | K271: 6 | L271: 9 | M271: =K271*6+L271 -> 45 | O271: 7 | P271: 10 | Q271: =O271*6+P271 -> 52 | S271: BREWER/GLEESON
A272: BEST PLAYERS
A273: SUNSHINE | C273: LITCHFIELD | F273: PROTETTO | I273: CALDWELL | L273: MITROVSKI | O273: WALSH | R273: MENADUE
A274: WAVERLEY | C274: ANDERSON | F274: POLA | I274: GREEN | L274: VEAR | O274: HARRISON
A275: GOALKICKERS
A276: SUNSHINE | C276: LITCHFIELD 13 | F276: DAY 4 | H276: WAGLAND 2 | K276: WALSH | M276: McQUALTER
A277: WAVERLEY | C277: ANGELIS 3 | F277: EVANS 2 | I277: CSOTI | K277: HUNT
A279: OAKLEIGH | C279: 5 | D279: 4 | E279: =C279*6+D279 -> 34 | G279: 9 | H279: 5 | I279: =G279*6+H279 -> 59 | K279: 15 | L279: 8 | M279: =K279*6+L279 -> 98 | O279: 26 | P279: 10 | Q279: =O279*6+P279 -> 166 | S279: OAKLEIGH
A280: CAULFIELD | C280: 1 | D280: 0 | E280: =C280*6+D280 -> 6 | G280: 3 | H280: 4 | I280: =G280*6+H280 -> 22 | K280: 6 | L280: 8 | M280: =K280*6+L280 -> 44 | O280: 9 | P280: 11 | Q280: =O280*6+P280 -> 65 | S280: COOKE/SMITH
A281: BEST PLAYERS
A282: OAKLEIGH | C282: McDONALD | F282: C ROURKE | I282: S ROURKE | L282: M ROACH | O282: CUNNINGHAM | R282: PRETTO
A283: CAULFIELD | C283: MUNROE | F283: LARKIN | I283: LEWIS
A284: GOALKICKERS
A285: OAKLEIGH | C285: PRETTO 11 | F285: M ROACH 6 | I285: TODD 5 | K285: ROURKE 2 | N285: SUTHERLAND 2 | Q285: ATHERTON | S285: ALLRN | U285: OWEN
A286: CAULFIELD | C286: GODAU 3 | F286: FIELD 2 | H286: LARKIN 2 | K286: HAIDAMOUS | N286: MILLS
A288: ROUND 6 | E288: 25TH MAY | J288: WEATHER | S288: PLAYED AT
D289: 1ST QTR | H289: 2ND QTR | L289: 3RD QTR | P289: FINAL | S289: NORTHCOTE
A290: PRAHRAN | C290: 12 | D290: 4 | E290: =C290*6+D290 -> 76 | G290: 22 | H290: 9 | I290: =G290*6+H290 -> 141 | K290: 25 | L290: 14 | M290: =K290*6+L290 -> 164 | O290: 32 | P290: 18 | Q290: =O290*6+P290 -> 210 | S290: UMPIRE | X290: LADDER | AB290: ROUND | AD290: 6
A291: NORTHCOTE | C291: 2 | D291: 1 | E291: =C291*6+D291 -> 13 | G291: 3 | H291: 4 | I291: =G291*6+H291 -> 22 | K291: 4 | L291: 5 | M291: =K291*6+L291 -> 29 | O291: 7 | P291: 6 | Q291: =O291*6+P291 -> 48
A292: BEST PLAYERS | W292: TEAM | X292: W | Y292: L | Z292: D | AA292: FOR | AB292: AGST | AC292: % | AD292: PTS
A293: PRAHRAN
A294: NORTHCOTE | W294: BOX HILL | X294: 6 | Y294: 0 | Z294: 0 | AA294: 920 | AB294: 452 | AC294: =(AA294*100)/AB294 -> 203.53982300884957 | AD294: =(X294*4)+(Z294*2) -> 24
A295: GOALKICKERS | W295: SUNSHINE | X295: 6 | Y295: 0 | Z295: 0 | AA295: 771 | AB295: 482 | AC295: =(AA295*100)/AB295 -> 159.95850622406638 | AD295: =(X295*4)+(Z295*2) -> 24
A296: PRAHRAN | W296: OAKLEIGH | X296: 4 | Y296: 2 | Z296: 0 | AA296: 833 | AB296: 467 | AC296: =(AA296*100)/AB296 -> 178.37259100642399 | AD296: =(X296*4)+(Z296*2) -> 16
A297: NORTHCOTE | W297: PRAHRAN | X297: 4 | Y297: 2 | Z297: 0 | AA297: 759 | AB297: 522 | AC297: =(AA297*100)/AB297 -> 145.40229885057471 | AD297: =(X297*4)+(Z297*2) -> 16
A299: DANDENONG | C299: 4 | D299: 3 | E299: =C299*6+D299 -> 27 | G299: 6 | H299: 6 | I299: =G299*6+H299 -> 42 | K299: 9 | L299: 7 | M299: =K299*6+L299 -> 61 | O299: 13 | P299: 9 | Q299: =O299*6+P299 -> 87 | S299: DANDENONG | W299: DANDENONG | X299: 4 | Y299: 2 | Z299: 0 | AA299: 634 | AB299: 488 | AC299: =(AA299*100)/AB299 -> 129.91803278688525 | AD299: =(X299*4)+(Z299*2) -> 16
A300: WERRIBEE | C300: 2 | D300: 2 | E300: =C300*6+D300 -> 14 | G300: 3 | H300: 3 | I300: =G300*6+H300 -> 21 | K300: 3 | L300: 6 | M300: =K300*6+L300 -> 24 | O300: 5 | P300: 7 | Q300: =O300*6+P300 -> 37 | W300: MOORABBIN | X300: 4 | Y300: 2 | Z300: 0 | AA300: 712 | AB300: 597 | AC300: =(AA300*100)/AB300 -> 119.26298157453937 | AD300: =(X300*4)+(Z300*2) -> 16
A301: BEST PLAYERS | W301: WAVERLEY | X301: 3 | Y301: 3 | Z301: 0 | AA301: 781 | AB301: 647 | AC301: =(AA301*100)/AB301 -> 120.71097372488408 | AD301: =(X301*4)+(Z301*2) -> 12
A302: DANDENONG | W302: WERRIBEE | X302: 2 | Y302: 4 | Z302: 0 | AA302: 529 | AB302: 593 | AC302: =(AA302*100)/AB302 -> 89.207419898819566 | AD302: =(X302*4)+(Z302*2) -> 8
A303: WERRIBEE | W303: CAULFIELD | X303: 2 | Y303: 4 | Z303: 0 | AA303: 701 | AB303: 802 | AC303: =(AA303*100)/AB303 -> 87.406483790523694 | AD303: =(X303*4)+(Z303*2) -> 8
A304: GOALKICKERS | W304: BERWICK | X304: 1 | Y304: 5 | Z304: 0 | AA304: 547 | AB304: 916 | AC304: =(AA304*100)/AB304 -> 59.716157205240172 | AD304: =(X304*4)+(Z304*2) -> 4
A305: DANDENONG | W305: NORTHCOTE | X305: 0 | Y305: 6 | Z305: 0 | AA305: 538 | AB305: 936 | AC305: =(AA305*100)/AB305 -> 57.478632478632477 | AD305: =(X305*4)+(Z305*2) -> 0
A306: WERRIBEE | W306: MORDIALLOC | X306: 0 | Y306: 6 | Z306: 0 | AA306: 376 | AB306: 1202 | AC306: =(AA306*100)/AB306 -> 31.281198003327788 | AD306: =(X306*4)+(Z306*2) -> 0
A308: BOX HILL | C308: 9 | D308: 2 | E308: =C308*6+D308 -> 56 | G308: 16 | H308: 7 | I308: =G308*6+H308 -> 103 | K308: 27 | L308: 14 | M308: =K308*6+L308 -> 176 | O308: 36 | P308: 18 | Q308: =O308*6+P308 -> 234 | S308: BOX HILL
A309: MORDIALLOC | C309: 3 | D309: 3 | E309: =C309*6+D309 -> 21 | G309: 8 | H309: 3 | I309: =G309*6+H309 -> 51 | K309: 8 | L309: 3 | M309: =K309*6+L309 -> 51 | O309: 10 | P309: 4 | Q309: =O309*6+P309 -> 64
A310: BEST PLAYERS
A311: BOX HILL
A312: MORDIALLOC
A313: GOALKICKERS
A314: BOX HILL
A315: MORDIALLOC
A317: MOORABBIN | C317: 1 | D317: 3 | E317: =C317*6+D317 -> 9 | G317: 4 | H317: 5 | I317: =G317*6+H317 -> 29 | K317: 8 | L317: 6 | M317: =K317*6+L317 -> 54 | O317: 10 | P317: 6 | Q317: =O317*6+P317 -> 66 | S317: BENTLEIGH
A318: OAKLEIGH | C318: 1 | D318: 5 | E318: =C318*6+D318 -> 11 | G318: 3 | H318: 7 | I318: =G318*6+H318 -> 25 | K318: 5 | L318: 10 | M318: =K318*6+L318 -> 40 | O318: 8 | P318: 15 | Q318: =O318*6+P318 -> 63
A319: BEST PLAYERS
A320: MOORABBIN
A321: OAKLEIGH
A322: GOALKICKERS
A323: MOORABBIN
A324: OAKLEIGH
A326: SUNSHINE | C326: 5 | D326: 6 | E326: =C326*6+D326 -> 36 | G326: 10 | H326: 12 | I326: =G326*6+H326 -> 72 | K326: 14 | L326: 13 | M326: =K326*6+L326 -> 97 | O326: 19 | P326: 16 | Q326: =O326*6+P326 -> 130 | S326: PRINCES PARK, CAULFIELD
A327: CAULFIELD | C327: 4 | D327: 4 | E327: =C327*6+D327 -> 28 | G327: 8 | H327: 4 | I327: =G327*6+H327 -> 52 | K327: 11 | L327: 6 | M327: =K327*6+L327 -> 72 | O327: 15 | P327: 8 | Q327: =O327*6+P327 -> 98
A328: BEST PLAYERS
A329: SUNSHINE
A330: CAULFIELD
A331: GOALKICKERS
A332: SUNSHINE
A333: CAULFIELD
A335: WAVERLEY | C335: 5 | D335: 5 | E335: =C335*6+D335 -> 35 | G335: 12 | H335: 7 | I335: =G335*6+H335 -> 79 | K335: 16 | L335: 7 | M335: =K335*6+L335 -> 103 | O335: 22 | P335: 10 | Q335: =O335*6+P335 -> 142 | S335: WAVERLEY
A336: BERWICK | C336: 2 | D336: 2 | E336: =C336*6+D336 -> 14 | G336: 4 | H336: 5 | I336: =G336*6+H336 -> 29 | K336: 8 | L336: 9 | M336: =K336*6+L336 -> 57 | O336: 14 | P336: 10 | Q336: =O336*6+P336 -> 94
A337: BEST PLAYERS
A338: WAVERLEY
A339: BERWICK
A340: GOALKICKERS
A341: WAVERLEY
A342: BERWICK
A344: ROUND 7 | E344: 1ST JUNE | J344: WEATHER | S344: PLAYED AT
D345: 1ST QTR | H345: 2ND QTR | L345: 3RD QTR | P345: FINAL | S345: MORDIALLOC
A346: DANDENONG | C346: 0 | D346: 3 | E346: =C346*6+D346 -> 3 | G346: 2 | H346: 9 | I346: =G346*6+H346 -> 21 | K346: 5 | L346: 16 | M346: =K346*6+L346 -> 46 | O346: 11 | P346: 17 | Q346: =O346*6+P346 -> 83 | S346: UMPIRE | X346: LADDER | AB346: ROUND | AD346: 7
A347: MORDIALLOC | C347: 3 | D347: 3 | E347: =C347*6+D347 -> 21 | G347: 5 | H347: 6 | I347: =G347*6+H347 -> 36 | K347: 6 | L347: 7 | M347: =K347*6+L347 -> 43 | O347: 8 | P347: 11 | Q347: =O347*6+P347 -> 59
A348: BEST PLAYERS | W348: TEAM | X348: W | Y348: L | Z348: D | AA348: FOR | AB348: AGST | AC348: % | AD348: PTS
A349: DANDENONG
A350: MORDIALLOC | W350: SUNSHINE | X350: 7 | Y350: 0 | Z350: 0 | AA350: 924 | AB350: 576 | AC350: =(AA350*100)/AB350 -> 160.41666666666666 | AD350: =(X350*4)+(Z350*2) -> 28
A351: GOALKICKERS | W351: BOX HILL | X351: 6 | Y351: 1 | Z351: 0 | AA351: 1008 | AB351: 545 | AC351: =(AA351*100)/AB351 -> 184.95412844036699 | AD351: =(X351*4)+(Z351*2) -> 24
A352: DANDENONG | W352: OAKLEIGH | X352: 5 | Y352: 2 | Z352: 0 | AA352: 926 | AB352: 555 | AC352: =(AA352*100)/AB352 -> 166.84684684684686 | AD352: =(X352*4)+(Z352*2) -> 20
A353: MORDIALLOC | W353: PRAHRAN | X353: 5 | Y353: 2 | Z353: 0 | AA353: 929 | AB353: 609 | AC353: =(AA353*100)/AB353 -> 152.54515599343185 | AD353: =(X353*4)+(Z353*2) -> 20
A355: WERRIBEE | C355: 8 | D355: 3 | E355: =C355*6+D355 -> 51 | G355: 13 | H355: 6 | I355: =G355*6+H355 -> 84 | K355: 17 | L355: 9 | M355: =K355*6+L355 -> 111 | O355: 21 | P355: 15 | Q355: =O355*6+P355 -> 141 | S355: WERRIBEE | W355: DANDENONG | X355: 5 | Y355: 2 | Z355: 0 | AA355: 717 | AB355: 547 | AC355: =(AA355*100)/AB355 -> 131.07861060329068 | AD355: =(X355*4)+(Z355*2) -> 20
A356: NORTHCOTE | C356: 4 | D356: 2 | E356: =C356*6+D356 -> 26 | G356: 10 | H356: 7 | I356: =G356*6+H356 -> 67 | K356: 13 | L356: 8 | M356: =K356*6+L356 -> 86 | O356: 19 | P356: 11 | Q356: =O356*6+P356 -> 125 | W356: WAVERLEY | X356: 4 | Y356: 3 | Z356: 0 | AA356: 951 | AB356: 728 | AC356: =(AA356*100)/AB356 -> 130.63186813186815 | AD356: =(X356*4)+(Z356*2) -> 16
A357: BEST PLAYERS | W357: MOORABBIN | X357: 4 | Y357: 3 | Z357: 0 | AA357: 806 | AB357: 750 | AC357: =(AA357*100)/AB357 -> 107.46666666666667 | AD357: =(X357*4)+(Z357*2) -> 16
A358: WERRIBEE | W358: WERRIBEE | X358: 3 | Y358: 4 | Z358: 0 | AA358: 670 | AB358: 718 | AC358: =(AA358*100)/AB358 -> 93.314763231197773 | AD358: =(X358*4)+(Z358*2) -> 12
A359: NORTHCOTE | W359: CAULFIELD | X359: 2 | Y359: 5 | Z359: 0 | AA359: 782 | AB359: 972 | AC359: =(AA359*100)/AB359 -> 80.452674897119337 | AD359: =(X359*4)+(Z359*2) -> 8
A360: GOALKICKERS | W360: BERWICK | X360: 1 | Y360: 6 | Z360: 0 | AA360: 634 | AB360: 1086 | AC360: =(AA360*100)/AB360 -> 58.379373848987107 | AD360: =(X360*4)+(Z360*2) -> 4
A361: WERRIBEE | W361: NORTHCOTE | X361: 0 | Y361: 7 | Z361: 0 | AA361: 663 | AB361: 1077 | AC361: =(AA361*100)/AB361 -> 61.559888579387184 | AD361: =(X361*4)+(Z361*2) -> 0
A362: NORTHCOTE | W362: MORDIALLOC | X362: 0 | Y362: 7 | Z362: 0 | AA362: 435 | AB362: 1285 | AC362: =(AA362*100)/AB362 -> 33.852140077821012 | AD362: =(X362*4)+(Z362*2) -> 0
A364: PRAHRAN | C364: 7 | D364: 4 | E364: =C364*6+D364 -> 46 | G364: 12 | H364: 6 | I364: =G364*6+H364 -> 78 | K364: 17 | L364: 9 | M364: =K364*6+L364 -> 111 | O364: 26 | P364: 14 | Q364: =O364*6+P364 -> 170 | S364: TOORAK PARK
A365: BERWICK | C365: 2 | D365: 3 | E365: =C365*6+D365 -> 15 | G365: 3 | H365: 3 | I365: =G365*6+H365 -> 21 | K365: 10 | L365: 6 | M365: =K365*6+L365 -> 66 | O365: 13 | P365: 9 | Q365: =O365*6+P365 -> 87
A366: BEST PLAYERS
A367: PRAHRAN
A368: BERWICK
A369: GOALKICKERS
A370: PRAHRAN
A371: BERWICK
A373: WAVERLEY | C373: 7 | D373: 4 | E373: =C373*6+D373 -> 46 | G373: 13 | H373: 8 | I373: =G373*6+H373 -> 86 | K373: 16 | L373: 12 | M373: =K373*6+L373 -> 108 | O373: 25 | P373: 20 | Q373: =O373*6+P373 -> 170 | S373: PRINCES PARK, CAULFIELD
A374: CAULFIELD | C374: 3 | D374: 4 | E374: =C374*6+D374 -> 22 | G374: 5 | H374: 6 | I374: =G374*6+H374 -> 36 | K374: 8 | L374: 11 | M374: =K374*6+L374 -> 59 | O374: 11 | P374: 15 | Q374: =O374*6+P374 -> 81
A375: BEST PLAYERS
A376: WAVERLEY
A377: CAULFIELD
A378: GOALKICKERS
A379: WAVERLEY
A380: CAULFIELD
A382: SUNSHINE | C382: 4 | D382: 7 | E382: =C382*6+D382 -> 31 | G382: 9 | H382: 10 | I382: =G382*6+H382 -> 64 | K382: 19 | L382: 17 | M382: =K382*6+L382 -> 131 | O382: 22 | P382: 21 | Q382: =O382*6+P382 -> 153 | S382: SUNSHINE
A383: MOORABBIN | C383: 3 | D383: 1 | E383: =C383*6+D383 -> 19 | G383: 5 | H383: 4 | I383: =G383*6+H383 -> 34 | K383: 7 | L383: 6 | M383: =K383*6+L383 -> 48 | O383: 14 | P383: 10 | Q383: =O383*6+P383 -> 94
A384: BEST PLAYERS
A385: SUNSHINE
A386: MOORABBIN
A387: GOALKICKERS
A388: SUNSHINE
A389: MOORABBIN
A391: OAKLEIGH | C391: 1 | D391: 2 | E391: =C391*6+D391 -> 8 | G391: 6 | H391: 6 | I391: =G391*6+H391 -> 42 | K391: 12 | L391: 13 | M391: =K391*6+L391 -> 85 | O391: 13 | P391: 15 | Q391: =O391*6+P391 -> 93 | S391: OAKLEIGH
A392: BOX HILL | C392: 6 | D392: 3 | E392: =C392*6+D392 -> 39 | G392: 8 | H392: 4 | I392: =G392*6+H392 -> 52 | K392: 9 | L392: 5 | M392: =K392*6+L392 -> 59 | O392: 13 | P392: 10 | Q392: =O392*6+P392 -> 88
A393: BEST PLAYERS
A394: OAKLEIGH
A395: BOX HILL
A396: GOALKICKERS
A397: OAKLEIGH
A398: BOX HILL
A400: ROUND 8 | E400: 15TH JUNE | J400: WEATHER | S400: PLAYED AT
D401: 1ST QTR | H401: 2ND QTR | L401: 3RD QTR | P401: FINAL | S401: TOORAK PARK
A402: PRAHRAN | C402: 5 | D402: 5 | E402: =C402*6+D402 -> 35 | G402: 13 | H402: 9 | I402: =G402*6+H402 -> 87 | K402: 20 | L402: 12 | M402: =K402*6+L402 -> 132 | O402: 26 | P402: 14 | Q402: =O402*6+P402 -> 170 | S402: UMPIRE | X402: LADDER | AB402: ROUND | AD402: 8
A403: WAVERLEY | C403: 5 | D403: 1 | E403: =C403*6+D403 -> 31 | G403: 7 | H403: 4 | I403: =G403*6+H403 -> 46 | K403: 12 | L403: 7 | M403: =K403*6+L403 -> 79 | O403: 18 | P403: 9 | Q403: =O403*6+P403 -> 117 | S403: VERGONA/BRADY
A404: BEST PLAYERS | W404: TEAM | X404: W | Y404: L | Z404: D | AA404: FOR | AB404: AGST | AC404: % | AD404: PTS
A405: PRAHRAN | C405: TAYLOR | F405: TAPPING | I405: COOK | L405: LOWE | O405: DURNAN
A406: WAVERLEY | C406: POLA | F406: SCOTT | I406: KENDALL | L406: CASTILLO | O406: DE WIT | R406: ANDERSON | W406: BOX HILL | X406: 7 | Y406: 1 | Z406: 0 | AA406: 1149 | AB406: 683 | AC406: =(AA406*100)/AB406 -> 168.22840409956075 | AD406: =(X406*4)+(Z406*2) -> 28
A407: GOALKICKERS | W407: SUNSHINE | X407: 7 | Y407: 1 | Z407: 0 | AA407: 1062 | AB407: 717 | AC407: =(AA407*100)/AB407 -> 148.11715481171549 | AD407: =(X407*4)+(Z407*2) -> 28
A408: PRAHRAN | C408: LOWE 9 | E408: BINGHAM 6 | H408: HANLEY 3 | J408: COOK 3 | L408: TAYLOR 2 | N408: EASON 2 | P408: WALDER | W408: OAKLEIGH | X408: 6 | Y408: 2 | Z408: 0 | AA408: 1055 | AB408: 646 | AC408: =(AA408*100)/AB408 -> 163.31269349845201 | AD408: =(X408*4)+(Z408*2) -> 24
A409: WAVERLEY | C409: ANGELIS 4 | F409: POLA 3 | H409: KENDALL 3 | J409: ANDERSON 2 | M409: CSOTI | O409: FEATHERSTON | R409: NANSCAWEN | U409: VEAR | W409: PRAHRAN | X409: 6 | Y409: 2 | Z409: 0 | AA409: 1099 | AB409: 726 | AC409: =(AA409*100)/AB409 -> 151.37741046831957 | AD409: =(X409*4)+(Z409*2) -> 24
K410: KINNABURGH | N410: SHERLOCK
A411: WERRIBEE | C411: 5 | D411: 3 | E411: =C411*6+D411 -> 33 | G411: 10 | H411: 6 | I411: =G411*6+H411 -> 66 | K411: 17 | L411: 13 | M411: =K411*6+L411 -> 115 | O411: 22 | P411: 14 | Q411: =O411*6+P411 -> 146 | S411: BERWICK | W411: DANDENONG | X411: 5 | Y411: 3 | Z411: 0 | AA411: 808 | AB411: 676 | AC411: =(AA411*100)/AB411 -> 119.52662721893491 | AD411: =(X411*4)+(Z411*2) -> 20
A412: BERWICK | C412: 4 | D412: 4 | E412: =C412*6+D412 -> 28 | G412: 6 | H412: 10 | I412: =G412*6+H412 -> 46 | K412: 9 | L412: 10 | M412: =K412*6+L412 -> 64 | O412: 13 | P412: 12 | Q412: =O412*6+P412 -> 90 | S412: WILLIAMS | W412: MOORABBIN | X412: 5 | Y412: 3 | Z412: 0 | AA412: 917 | AB412: 848 | AC412: =(AA412*100)/AB412 -> 108.13679245283019 | AD412: =(X412*4)+(Z412*2) -> 20
A413: BEST PLAYERS | S413: BREWER | W413: WAVERLEY | X413: 4 | Y413: 4 | Z413: 0 | AA413: 1068 | AB413: 898 | AC413: =(AA413*100)/AB413 -> 118.93095768374165 | AD413: =(X413*4)+(Z413*2) -> 16
A414: WERRIBEE | C414: MEMBREY | F414: MOLONEY | I414: ROGOZIK | L414: MONTGOMERY | O414: FRASER | R414: BAUEMLER | W414: WERRIBEE | X414: 4 | Y414: 4 | Z414: 0 | AA414: 816 | AB414: 808 | AC414: =(AA414*100)/AB414 -> 100.99009900990099 | AD414: =(X414*4)+(Z414*2) -> 16
A415: BERWICK | C415: TRIGG | F415: PARK | I415: S JOHNSON | L415: VENVILLE | O415: ORSBORNE | R415: MANNENS | W415: CAULFIELD | X415: 2 | Y415: 6 | Z415: 0 | AA415: 880 | AB415: 1083 | AC415: =(AA415*100)/AB415 -> 81.255771006463533 | AD415: =(X415*4)+(Z415*2) -> 8
A416: GOALKICKERS | L416: MOLONEY | O416: GREY | Q416: MENADUE | W416: NORTHCOTE | X416: 1 | Y416: 7 | Z416: 0 | AA416: 842 | AB416: 1137 | AC416: =(AA416*100)/AB416 -> 74.054529463500444 | AD416: =(X416*4)+(Z416*2) -> 4
A417: WERRIBEE | C417: MILIC 4 | E417: WILLIAMS 4 | G417: COMBEN 3 | J417: DUNSTAN 2 | M417: FRASER 2 | O417: JACKSON 2 | R417: MONTGOMERY 2 | W417: BERWICK | X417: 1 | Y417: 7 | Z417: 0 | AA417: 724 | AB417: 1232 | AC417: =(AA417*100)/AB417 -> 58.766233766233768 | AD417: =(X417*4)+(Z417*2) -> 4
A418: BERWICK | C418: TRIGG 5 | E418: McGREAL 2 | H418: PARK | J418: KENNY | L418: HIPWORTH | O418: BREEN | Q418: VERSHUUR | S418: McGILL | W418: MORDIALLOC | X418: 0 | Y418: 8 | Z418: 0 | AA418: 495 | AB418: 1464 | AC418: =(AA418*100)/AB418 -> 33.811475409836063 | AD418: =(X418*4)+(Z418*2) -> 0
A420: NORTHCOTE | C420: 5 | D420: 3 | E420: =C420*6+D420 -> 33 | G420: 11 | H420: 6 | I420: =G420*6+H420 -> 72 | K420: 18 | L420: 11 | M420: =K420*6+L420 -> 119 | O420: 27 | P420: 17 | Q420: =O420*6+P420 -> 179 | S420: NORTHCOTE
A421: MORDIALLOC | C421: 2 | D421: 5 | E421: =C421*6+D421 -> 17 | G421: 3 | H421: 9 | I421: =G421*6+H421 -> 27 | K421: 6 | L421: 9 | M421: =K421*6+L421 -> 45 | O421: 8 | P421: 12 | Q421: =O421*6+P421 -> 60 | S421: HULM/MITCHELL
A422: BEST PLAYERS
A423: NORTHCOTE | C423: SPAGNOLO | F423: MITCHELL | I423: COURTS | L423: ARMSTRONG | O423: STRANGWICK | R423: EWING
A424: MORDIALLOC | C424: BROMLEY | F424: MASON | I424: WALSH | L424: DIXON | O424: MANGONI | R424: DEATON
A425: GOALKICKERS
A426: NORTHCOTE | C426: ARMSTRONG 6 | F426: STRANGWICK 6 | I426: EWING 4 | K426: BAGNARA 4 | N426: SANDONI 2 | Q426: LITTLE 2 | S426: COURTS | U426: SPROAT | W426: PENNANT
A427: MORDIALLOC | C427: BROMLEY 2 | F427: PARKER 2 | I427: DEATON | K427: BENSON | M427: WALSH | O427: ROSEWARNE
A429: OAKLEIGH | C429: 4 | D429: 5 | E429: =C429*6+D429 -> 29 | G429: 7 | H429: 7 | I429: =G429*6+H429 -> 49 | K429: 11 | L429: 11 | M429: =K429*6+L429 -> 77 | O429: 19 | P429: 15 | Q429: =O429*6+P429 -> 129 | S429: DANDENONG
A430: DANDENONG | C430: 3 | D430: 4 | E430: =C430*6+D430 -> 22 | G430: 6 | H430: 7 | I430: =G430*6+H430 -> 43 | K430: 10 | L430: 10 | M430: =K430*6+L430 -> 70 | O430: 13 | P430: 13 | Q430: =O430*6+P430 -> 91 | S430: BROOKS/HUTCHINSON
A431: BEST PLAYERS
A432: OAKLEIGH | C432: SIMPSON | F432: ATHERTON | I432: THOMPSON | L432: OWEN | O432: CUNNINGHAM | R432: PRETTO
A433: DANDENONG | C433: LAMBERT | F433: HICKEY | I433: BASTINAAC | L433: McGUINNESS | O433: DARREN HALL | R433: LINDSAY
A434: GOALKICKERS
A435: OAKLEIGH | C435: PRETTO 8 | F435: SIMPSON 5 | I435: ATHERTON 3 | L435: WILLIAMS | O435: M ROACH | R435: McDONALD
A436: DANDENONG | C436: DARREN HALL 3 | G436: WRIGHT 3 | J436: CROCKER 2 | M436: LAMBERT 2 | O436: P KNIGHT | R436: KANNOURAKIS | U436: SLATTERY
A438: BOX HILL | C438: 6 | D438: 4 | E438: =C438*6+D438 -> 40 | G438: 11 | H438: 5 | I438: =G438*6+H438 -> 71 | K438: 18 | L438: 6 | M438: =K438*6+L438 -> 114 | O438: 22 | P438: 9 | Q438: =O438*6+P438 -> 141 | S438: BOX HILL
A439: SUNSHINE | C439: 4 | D439: 3 | E439: =C439*6+D439 -> 27 | G439: 13 | H439: 6 | I439: =G439*6+H439 -> 84 | K439: 14 | L439: 8 | M439: =K439*6+L439 -> 92 | O439: 21 | P439: 12 | Q439: =O439*6+P439 -> 138 | S439: RYAN/SMITH
A440: BEST PLAYERS
A441: BOX HILL | C441: ROCHOW | F441: L BOLTON | I441: CUFF | L441: TRESSIDER | O441: P BOLTON
A442: SUNSHINE | C442: CALDWELL | F442: DAY | I442: BROWN | L442: PROTETTO | O442: MITROVSKI | R442: LITCHFIELD
A443: GOALKICKERS
A444: BOX HILL | C444: P BOLTON 8 | F444: L BOLTON 4 | I444: TRESSIDER 4 | L444: GARTH 2 | N444: DWYER 2 | P444: HEDGER | R444: TEAKEL
A445: SUNSHINE | C445: LITCHFIELD 9 | F445: WALSH 3 | I445: NELSON 3 | K445: HODGES 3 | N445: DAY | P445: PROTETTO | R445: D CADDAYE
A447: MOORABBIN | C447: 3 | D447: 2 | E447: =C447*6+D447 -> 20 | G447: 8 | H447: 6 | I447: =G447*6+H447 -> 54 | K447: 11 | L447: 10 | M447: =K447*6+L447 -> 76 | O447: 16 | P447: 15 | Q447: =O447*6+P447 -> 111 | S447: BENTLEIGH
A448: CAULFIELD | C448: 5 | D448: 4 | E448: =C448*6+D448 -> 34 | G448: 8 | H448: 7 | I448: =G448*6+H448 -> 55 | K448: 12 | L448: 11 | M448: =K448*6+L448 -> 83 | O448: 14 | P448: 14 | Q448: =O448*6+P448 -> 98 | S448: BLACK/OKEY
A449: BEST PLAYERS
A450: MOORABBIN | C450: LETT | E450: KNIGHT | H450: MERCOULIA | K450: POLLOCK | N450: BEATTIE
A451: CAULFIELD | C451: O'KEEFE | E451: MUNROE | H451: KENDALL | K451: LEWIS | N451: FARINSKI | Q451: LARKIN
A452: GOALKICKERS
A453: MOORABBIN | C453: BEATTIE 5 | F453: BOUKER 5 | I453: B CATHCART 2 | L453: POLLOCK | N453: PAPPAS | P453: STEWART | R453: GILMORE
A454: CAULFIELD | C454: O'KEEFE 3 | F454: KENDALL 3 | I454: FARINSKI 2 | L454: HEMSTRON 2 | O454: HARTSON | R454: LAFFIN | T454: MILLS | V454: MUNROE
A456: ROUND 9 | E456: 22ND JUNE | J456: WEATHER | S456: PLAYED AT
D457: 1ST QTR | H457: 2ND QTR | L457: 3RD QTR | P457: FINAL | S457: MORDIALLOC
A458: BERWICK | C458: 6 | D458: 3 | E458: =C458*6+D458 -> 39 | G458: 9 | H458: 6 | I458: =G458*6+H458 -> 60 | K458: 14 | L458: 9 | M458: =K458*6+L458 -> 93 | O458: 20 | P458: 15 | Q458: =O458*6+P458 -> 135 | S458: UMPIRE | X458: LADDER | AB458: ROUND | AD458: 9
A459: MORDIALLOC | C459: 3 | D459: 3 | E459: =C459*6+D459 -> 21 | G459: 9 | H459: 6 | I459: =G459*6+H459 -> 60 | K459: 11 | L459: 9 | M459: =K459*6+L459 -> 75 | O459: 11 | P459: 10 | Q459: =O459*6+P459 -> 76 | S459: BROOKS/OAKLEY
A460: BEST PLAYERS | W460: TEAM | X460: W | Y460: L | Z460: D | AA460: FOR | AB460: AGST | AC460: % | AD460: PTS
A461: BERWICK | C461: HIPWORTH | F461: JOHNSON | I461: MANNENS | L461: PARK | O461: ORSBORN | R461: TRIGG
A462: MORDIALLOC | C462: DEATON | F462: HOFFMAN | I462: BROOKING | L462: P EVANS | O462: ELMER | W462: SUNSHINE | X462: 8 | Y462: 1 | Z462: 0 | AA462: 1152 | AB462: 771 | AC462: =(AA462*100)/AB462 -> 149.41634241245137 | AD462: =(X462*4)+(Z462*2) -> 32
A463: GOALKICKERS | W463: OAKLEIGH | X463: 7 | Y463: 2 | Z463: 0 | AA463: 1243 | AB463: 698 | AC463: =(AA463*100)/AB463 -> 178.08022922636104 | AD463: =(X463*4)+(Z463*2) -> 28
A464: BERWICK | C464: JOHNSON 8 | F464: McNEIL 4 | H464: KENNY 2 | J464: HIPWORTH 2 | M464: ORSBORNE | P464: WRIGHT | R464: McGREGOR | T464: TRIGG | W464: BOX HILL | X464: 7 | Y464: 2 | Z464: 0 | AA464: 1224 | AB464: 774 | AC464: =(AA464*100)/AB464 -> 158.13953488372093 | AD464: =(X464*4)+(Z464*2) -> 28
A465: MORDIALLOC | C465: HOFFMAN 3 | F465: P EVANS 3 | I465: MARGHERTI 2 | L465: BROMLEY | N465: ROSEWARNE | Q465: ELMER | W465: PRAHRAN | X465: 7 | Y465: 2 | Z465: 0 | AA465: 1220 | AB465: 817 | AC465: =(AA465*100)/AB465 -> 149.32680538555692 | AD465: =(X465*4)+(Z465*2) -> 28
A467: PRAHRAN | C467: 4 | D467: 0 | E467: =C467*6+D467 -> 24 | G467: 10 | H467: 7 | I467: =G467*6+H467 -> 67 | K467: 14 | L467: 10 | M467: =K467*6+L467 -> 94 | O467: 18 | P467: 13 | Q467: =O467*6+P467 -> 121 | S467: WERRIBEE | W467: WAVERLEY | X467: 5 | Y467: 4 | Z467: 0 | AA467: 1151 | AB467: 933 | AC467: =(AA467*100)/AB467 -> 123.36548767416934 | AD467: =(X467*4)+(Z467*2) -> 20
A468: WERRIBEE | C468: 2 | D468: 2 | E468: =C468*6+D468 -> 14 | G468: 3 | H468: 3 | I468: =G468*6+H468 -> 21 | K468: 11 | L468: 5 | M468: =K468*6+L468 -> 71 | O468: 14 | P468: 7 | Q468: =O468*6+P468 -> 91 | S468: MITCHELL | W468: DANDENONG | X468: 5 | Y468: 4 | Z468: 0 | AA468: 862 | AB468: 756 | AC468: =(AA468*100)/AB468 -> 114.02116402116403 | AD468: =(X468*4)+(Z468*2) -> 20
A469: BEST PLAYERS | S469: SMITH | W469: MOORABBIN | X469: 5 | Y469: 4 | Z469: 0 | AA469: 952 | AB469: 931 | AC469: =(AA469*100)/AB469 -> 102.25563909774436 | AD469: =(X469*4)+(Z469*2) -> 20
A470: PRAHRAN | C470: GILES | F470: FIELDING | I470: COOK | L470: DURNAN | O470: WALDER | R470: STRACHAN | W470: WERRIBEE | X470: 4 | Y470: 5 | Z470: 0 | AA470: 907 | AB470: 929 | AC470: =(AA470*100)/AB470 -> 97.631862217438112 | AD470: =(X470*4)+(Z470*2) -> 16
A471: WERRIBEE | C471: MEMBREY | F471: BAUEMLER | I471: S MOLONEY | L471: COMBEN | O471: FRASER | R471: DUNSTAN | W471: CAULFIELD | X471: 3 | Y471: 6 | Z471: 0 | AA471: 971 | AB471: 1158 | AC471: =(AA471*100)/AB471 -> 83.851468048359237 | AD471: =(X471*4)+(Z471*2) -> 12
A472: GOALKICKERS | W472: BERWICK | X472: 2 | Y472: 7 | Z472: 0 | AA472: 859 | AB472: 1308 | AC472: =(AA472*100)/AB472 -> 65.672782874617738 | AD472: =(X472*4)+(Z472*2) -> 8
A473: PRAHRAN | C473: EASON 4 | F473: WALDER 3 | H473: LOWE 3 | J473: COOK 3 | L473: MILLS 2 | N473: STRACHAN | P473: TAYLOR | R473: BINGHAM | W473: NORTHCOTE | X473: 1 | Y473: 8 | Z473: 0 | AA473: 894 | AB473: 1325 | AC473: =(AA473*100)/AB473 -> 67.471698113207552 | AD473: =(X473*4)+(Z473*2) -> 4
A474: WERRIBEE | C474: RICHARDSON 4 | F474: DUNSTAN 2 | I474: B MOLONEY 2 | L474: MILIC 2 | N474: KELLY | P474: COMBEN | R474: FRASER | T474: GREY | W474: MORDIALLOC | X474: 0 | Y474: 9 | Z474: 0 | AA474: 571 | AB474: 1599 | AC474: =(AA474*100)/AB474 -> 35.709818636647903 | AD474: =(X474*4)+(Z474*2) -> 0
A476: CAULFIELD | C476: 2 | D476: 4 | E476: =C476*6+D476 -> 16 | G476: 5 | H476: 8 | I476: =G476*6+H476 -> 38 | K476: 9 | L476: 11 | M476: =K476*6+L476 -> 65 | O476: 13 | P476: 13 | Q476: =O476*6+P476 -> 91 | S476: PRINCES PARK, CAULFIELD
A477: BOX HILL | C477: 3 | D477: 5 | E477: =C477*6+D477 -> 23 | G477: 5 | H477: 8 | I477: =G477*6+H477 -> 38 | K477: 6 | L477: 10 | M477: =K477*6+L477 -> 46 | O477: 10 | P477: 15 | Q477: =O477*6+P477 -> 75 | S477: BRADY/HUTCHINSON
A478: BEST PLAYERS
A479: CAULFIELD | C479: EINSEDEL | F479: FARINSKI | I479: FAWCETT | L479: LEWIS | N479: MUNROE
A480: BOX HILL | C480: BOURKE | F480: SHERIDAN | I480: TEAKEL
A481: GOALKICKERS
A482: CAULFIELD | C482: RENDELL 3 | F482: FARINSKI 2 | I482: GODAU 2 | K482: O'BRIEN 2 | N482: O'KEEFE 2 | P482: REED
A483: BOX HILL | C483: TRESSIDER 3 | F483: O'SHEA 2 | I483: BOURKE 2 | K483: BOLTON | M483: GARTH | O483: SHALLVEY
A485: SUNSHINE | C485: 0 | D485: 1 | E485: =C485*6+D485 -> 1 | G485: 7 | H485: 11 | I485: =G485*6+H485 -> 53 | K485: 8 | L485: 12 | M485: =K485*6+L485 -> 60 | O485: 12 | P485: 18 | Q485: =O485*6+P485 -> 90 | S485: SUNSHINE
A486: DANDENONG | C486: 3 | D486: 7 | E486: =C486*6+D486 -> 25 | G486: 4 | H486: 7 | I486: =G486*6+H486 -> 31 | K486: 5 | L486: 16 | M486: =K486*6+L486 -> 46 | O486: 6 | P486: 18 | Q486: =O486*6+P486 -> 54 | S486: NOLAN/WARD
A487: BEST PLAYERS
A488: SUNSHINE | C488: PROTETTO | F488: DAY | I488: LAWLER | L488: L CADDAYE | O488: MITROVSKI | R488: KING
A489: DANDENONG | C489: DARREN HALL | F489: K FINN | I489: J FINN | L489: LAMBERT | O489: P KNIGHT | R489: S KNIGHT
A490: GOALKICKERS
A491: SUNSHINE | C491: WALSH 4 | F491: ? 4 | H491: NELSON | J491: MOSS | L491: HODGES | N491: MITROVSKI
A492: DANDENONG | C492: WRIGHT 2 | F492: LAMBERT | I492: DARREN HALL | L492: GRUMMISCH | O492: KAYE
A494: OAKLEIGH | C494: 8 | D494: 10 | E494: =C494*6+D494 -> 58 | G494: 11 | H494: 17 | I494: =G494*6+H494 -> 83 | K494: 20 | L494: 21 | M494: =K494*6+L494 -> 141 | O494: 27 | P494: 26 | Q494: =O494*6+P494 -> 188 | S494: OAKLEIGH
A495: NORTHCOTE | C495: 0 | D495: 2 | E495: =C495*6+D495 -> 2 | G495: 4 | H495: 5 | I495: =G495*6+H495 -> 29 | K495: 4 | L495: 5 | M495: =K495*6+L495 -> 29 | O495: 7 | P495: 10 | Q495: =O495*6+P495 -> 52 | S495: BLACK/CURRAN
A496: BEST PLAYERS
A497: OAKLEIGH | C497: C ROURKE | F497: TODD | I497: MacDONALD | L497: S ROURKE | O497: THOMPSON | R497: BATTERSBY
A498: NORTHCOTE | C498: SPROAT | F498: CASTIGINI | I498: GARNER | L498: SPAGNOLO
A499: GOALKICKERS
A500: OAKLEIGH | C500: PRETTO 9 | F500: ATHERTON 4 | I500: BATTRSBY 3 | L500: OWEN 3 | N500: SIMPSON 2 | P500: HOWE 2 | R500: MacDONALD | U500: S ROURKE | W500: JOHNSON | X500: SUTHERLAND
A501: NORTHCOTE | C501: ARMSTRONG 2 | F501: CASTAGINI 2 | I501: INGLIS | K501: STRANGWICK | N501: SINDONI
A503: WAVERLEY | C503: 4 | D503: 5 | E503: =C503*6+D503 -> 29 | G503: 5 | H503: 10 | I503: =G503*6+H503 -> 40 | K503: 8 | L503: 12 | M503: =K503*6+L503 -> 60 | O503: 11 | P503: 17 | Q503: =O503*6+P503 -> 83 | S503: WAVERLEY
A504: MOORABBIN | C504: 1 | D504: 0 | E504: =C504*6+D504 -> 6 | G504: 1 | H504: 3 | I504: =G504*6+H504 -> 9 | K504: 2 | L504: 5 | M504: =K504*6+L504 -> 17 | O504: 5 | P504: 5 | Q504: =O504*6+P504 -> 35 | S504: CASEY/WILLIAMS
A505: BEST PLAYERS
A506: WAVERLEY | C506: KINNABURGH | F506: RYAN | I506: HARRISON | L506: SCOTT | N506: THOMAS | Q506: CSOTI
A507: MOORABBIN | C507: POLLOCK | F507: BAKER | I507: LETT | L507: D CATHCART
A508: GOALKICKERS
A509: WAVERLEY | C509: ANGELIS 5 | F509: CSOTI 2 | H509: VEAR | J509: KENDALL | M509: POLA | O509: THOMAS
A510: MOORABBIN | C510: STEWART | F510: KNIGHT | I510: BEATTIE | L510: HILL | N510: B CATHCART
A512: ROUND 10 | E512: 29TH JUNE | J512: WEATHER | S512: PLAYED AT
D513: 1ST QTR | H513: 2ND QTR | L513: 3RD QTR | P513: FINAL | S513: WERRIBEE
A514: WAVERLEY | C514: 4 | D514: 3 | E514: =C514*6+D514 -> 27 | G514: 7 | H514: 4 | I514: =G514*6+H514 -> 46 | K514: 11 | L514: 8 | M514: =K514*6+L514 -> 74 | O514: 16 | P514: 12 | Q514: =O514*6+P514 -> 108 | S514: UMPIRE | X514: LADDER | AB514: ROUND | AD514: 10
A515: WERRIBEE | C515: 1 | D515: 8 | E515: =C515*6+D515 -> 14 | G515: 6 | H515: 12 | I515: =G515*6+H515 -> 48 | K515: 12 | L515: 13 | M515: =K515*6+L515 -> 85 | O515: 15 | P515: 15 | Q515: =O515*6+P515 -> 105 | S515: BLACK/CARUSO
A516: BEST PLAYERS | W516: TEAM | X516: W | Y516: L | Z516: D | AA516: FOR | AB516: AGST | AC516: % | AD516: PTS
A517: WAVERLEY | C517: SHAW | E517: KINNABURGH | H517: POLA | J517: DE WIT | M517: PEARSON | P517: CASTILLO
A518: WERRIBEE | C518: FRASER | E518: SMITH | H518: MONTGOMERY | K518: RICHARDSON | N518: WILLIAMS | W518: SUNSHINE | X518: 9 | Y518: 1 | Z518: 0 | AA518: 1338 | AB518: 815 | AC518: =(AA518*100)/AB518 -> 164.17177914110428 | AD518: =(X518*4)+(Z518*2) -> 36
A519: GOALKICKERS | W519: OAKLEIGH | X519: 8 | Y519: 2 | Z519: 0 | AA519: 1406 | AB519: 755 | AC519: =(AA519*100)/AB519 -> 186.2251655629139 | AD519: =(X519*4)+(Z519*2) -> 32
A520: WAVERLEY | C520: POLA 5 | E520: ANGELIS 3 | G520: HOWELL 3 | J520: VEAR | K520: PEARSON | N520: CASTILLO | P520: GREEN | R520: McCORKELL | W520: BOX HILL | X520: 8 | Y520: 2 | Z520: 0 | AA520: 1374 | AB520: 805 | AC520: =(AA520*100)/AB520 -> 170.68322981366461 | AD520: =(X520*4)+(Z520*2) -> 32
A521: WERRIBEE | C521: RICHARDSON 4 | F521: WILLIAMS 3 | I521: KELLY 3 | K521: DUNSTAN | N521: WALPOLE | P521: FRASER | R521: MILIC | S521: HOY | W521: PRAHRAN | X521: 8 | Y521: 2 | Z521: 0 | AA521: 1381 | AB521: 881 | AC521: =(AA521*100)/AB521 -> 156.75368898978434 | AD521: =(X521*4)+(Z521*2) -> 32
A523: PRAHRAN | C523: 7 | D523: 5 | E523: =C523*6+D523 -> 47 | G523: 14 | H523: 10 | I523: =G523*6+H523 -> 94 | K523: 19 | L523: 15 | M523: =K523*6+L523 -> 129 | O523: 23 | P523: 23 | Q523: =O523*6+P523 -> 161 | S523: TOORAK PARK | W523: WAVERLEY | X523: 6 | Y523: 4 | Z523: 0 | AA523: 1259 | AB523: 1038 | AC523: =(AA523*100)/AB523 -> 121.29094412331406 | AD523: =(X523*4)+(Z523*2) -> 24
A524: MORDIALLOC | C524: 2 | D524: 1 | E524: =C524*6+D524 -> 13 | G524: 5 | H524: 1 | I524: =G524*6+H524 -> 31 | K524: 8 | L524: 2 | M524: =K524*6+L524 -> 50 | O524: 10 | P524: 4 | Q524: =O524*6+P524 -> 64 | S524: HUTCHINSON | W524: DANDENONG | X524: 6 | Y524: 4 | Z524: 0 | AA524: 936 | AB524: 812 | AC524: =(AA524*100)/AB524 -> 115.27093596059113 | AD524: =(X524*4)+(Z524*2) -> 24
A525: BEST PLAYERS | S525: CURREN | W525: MOORABBIN | X525: 5 | Y525: 5 | Z525: 0 | AA525: 983 | AB525: 1081 | AC525: =(AA525*100)/AB525 -> 90.934320074005555 | AD525: =(X525*4)+(Z525*2) -> 20
A526: PRAHRAN | C526: HUTCHISON | F526: DURNAN | I526: HERMANN | L526: WALLACE | O526: McDONALD | W526: WERRIBEE | X526: 4 | Y526: 6 | Z526: 0 | AA526: 1012 | AB526: 1037 | AC526: =(AA526*100)/AB526 -> 97.589199614271934 | AD526: =(X526*4)+(Z526*2) -> 16
A527: MORDIALLOC | C527: DEATON | F527: JONES | I527: MAHONEY | L527: MASON | O527: DIXON | R527: WATTERS | W527: CAULFIELD | X527: 3 | Y527: 7 | Z527: 0 | AA527: 1027 | AB527: 1232 | AC527: =(AA527*100)/AB527 -> 83.360389610389603 | AD527: =(X527*4)+(Z527*2) -> 12
A528: GOALKICKERS | M528: DURNAN | P528: WALLACE | W528: BERWICK | X528: 2 | Y528: 8 | Z528: 0 | AA528: 916 | AB528: 1471 | AC528: =(AA528*100)/AB528 -> 62.270564242012235 | AD528: =(X528*4)+(Z528*2) -> 8
A529: PRAHRAN | C529: HANDLEY 4 | F529: HUTCHISON 4 | I529: MILLS 4 | K529: EASON 3 | M529: TAYLOR 2 | O529: BINGHAM 2 | R529: TAPPING | T529: G GILES | W529: NORTHCOTE | X529: 1 | Y529: 9 | Z529: 0 | AA529: 938 | AB529: 1511 | AC529: =(AA529*100)/AB529 -> 62.078093977498348 | AD529: =(X529*4)+(Z529*2) -> 4
A530: MORDIALLOC | C530: ELMER 3 | E530: WHYTE 2 | G530: JONES 2 | I530: MANGAN | K530: CULLINAN | N530: DEATON | W530: MORDIALLOC | X530: 0 | Y530: 10 | Z530: 0 | AA530: 635 | AB530: 1760 | AC530: =(AA530*100)/AB530 -> 36.079545454545453 | AD530: =(X530*4)+(Z530*2) -> 0
A532: OAKLEIGH | C532: 3 | D532: 7 | E532: =C532*6+D532 -> 25 | G532: 8 | H532: 11 | I532: =G532*6+H532 -> 59 | K532: 17 | L532: 13 | M532: =K532*6+L532 -> 115 | O532: 24 | P532: 19 | Q532: =O532*6+P532 -> 163 | S532: BERWICK
A533: BERWICK | C533: 0 | D533: 2 | E533: =C533*6+D533 -> 2 | G533: 5 | H533: 5 | I533: =G533*6+H533 -> 35 | K533: 7 | L533: 7 | M533: =K533*6+L533 -> 49 | O533: 8 | P533: 9 | Q533: =O533*6+P533 -> 57 | S533: MORGAN/SMITH
A534: BEST PLAYERS
A535: OAKLEIGH | C535: HOWE | E535: THOMPSON | H535: C ROURKE | K535: SUTHERLAND | N535: TODD | P535: BAIN
A536: BERWICK | C536: S JOHNSON | F536: ORSBORNE | I536: M JOHNSON | L536: WRIGHT | N536: HIPWORTH
A537: GOALKICKERS
A538: OAKLEIGH | C538: PRETTO 7 | F538: HILLIARD 5 | I538: HOWE 4 | K538: S ROURKE 3 | N538: SIMPSON 2 | P538: SUTHERLAND 2 | S538: OWEN
A539: BERWICK | C539: HIPWORTH 3 | F539: PARK 2 | I539: TRIGG | K539: FRASER | M539: WRIGHT
A541: SUNSHINE | C541: 7 | D541: 3 | E541: =C541*6+D541 -> 45 | G541: 11 | H541: 9 | I541: =G541*6+H541 -> 75 | K541: 17 | L541: 14 | M541: =K541*6+L541 -> 116 | O541: 28 | P541: 18 | Q541: =O541*6+P541 -> 186 | S541: NORTHCOTE
A542: NORTHCOTE | C542: 2 | D542: 1 | E542: =C542*6+D542 -> 13 | G542: 4 | H542: 1 | I542: =G542*6+H542 -> 25 | K542: 5 | L542: 4 | M542: =K542*6+L542 -> 34 | O542: 6 | P542: 8 | Q542: =O542*6+P542 -> 44 | S542: BRADY/OKEY
A543: BEST PLAYERS
A544: SUNSHINE | C544: LAWLER | F544: BROWN | I544: DAY | K544: D CADDAYE | N544: MENADUE | Q544: WALSH
A545: NORTHCOTE | C545: SCOTT | F545: CASTAGINI | I545: GARNER | L545: STRANGWICK
A546: GOALKICKERS
A547: SUNSHINE | C547: LITCHFIELD 9 | F547: SHEPPERBOTTOM 5 | J547: DAY 3 | L547: WALSH 3 | N547: D CADDAYE 2 | Q547: KING 2 | S547: HODGES 2 | V547: CALDWELL | X547: PROTETTO
A548: NORTHCOTE | C548: LITTLE 2 | F548: CASTAGINI 2 | I548: SPROAT | K548: STRANGWICK
A550: DANDENONG | C550: 4 | D550: 1 | E550: =C550*6+D550 -> 25 | G550: 5 | H550: 5 | I550: =G550*6+H550 -> 35 | K550: 8 | L550: 6 | M550: =K550*6+L550 -> 54 | O550: 11 | P550: 8 | Q550: =O550*6+P550 -> 74 | S550: DANDENONG
A551: CAULFIELD | C551: 3 | D551: 3 | E551: =C551*6+D551 -> 21 | G551: 5 | H551: 3 | I551: =G551*6+H551 -> 33 | K551: 8 | L551: 5 | M551: =K551*6+L551 -> 53 | O551: 8 | P551: 8 | Q551: =O551*6+P551 -> 56 | S551: CASEY/WILLIAMS
A552: BEST PLAYERS
A553: DANDENONG | C553: PALLANT | F553: LAMBERT | I553: DARREN HALL | L553: DAVID HALL | O553: COUSINS | R553: P KNIGHT
A554: CAULFIELD | C554: LEWIS | F554: HARRISON | I554: LARKIN | L554: MUNROE | O554: EINSEDEL | R554: RENDELL
A555: GOALKICKERS
A556: DANDENONG | C556: WRIGHT 3 | F556: LEEMIN 3 | I556: CROCKER | K556: DARREN HALL | N556: DAVID HALL | Q556: COUSINS | S556: PALLANT
A557: CAULFIELD | C557: O'KEEFE 3 | F557: GODAU 2 | I557: HALABI | K557: REED | M557: RENDELL
A559: BOX HILL | C559: 6 | D559: 1 | E559: =C559*6+D559 -> 37 | G559: 14 | H559: 11 | I559: =G559*6+H559 -> 95 | K559: 19 | L559: 14 | M559: =K559*6+L559 -> 128 | O559: 22 | P559: 18 | Q559: =O559*6+P559 -> 150 | S559: BOX HILL
A560: MOORABBIN | C560: 2 | D560: 3 | E560: =C560*6+D560 -> 15 | G560: 1 | H560: 2 | I560: =G560*6+H560 -> 8 | K560: 2 | L560: 5 | M560: =K560*6+L560 -> 17 | O560: 4 | P560: 7 | Q560: =O560*6+P560 -> 31 | S560: PHILLIPS/WARD
A561: BEST PLAYERS
A562: BOX HILL | C562: P BOLTON | F562: NICHOLSON | I562: BROWN | L562: ROCHOW | O562: SHERIDAN | R562: WITHERS
A563: MOORABBIN | C563: MERCOULIA | F563: REVERE | I563: LETT | L563: GILMORE
A564: GOALKICKERS
A565: BOX HILL | C565: P BOLTON 10 | F565: TRESSIDER 4 | I565: WITHERS 2 | K565: NICHOLSON 2 | N565: L BOLTON | P565: GARTH | R565: HEDGER | T565: ROCHOW
A566: MOORABBIN | C566: PAPPAS | F566: KNIGHT | I566: GILMORE | L566: HALE
A568: ROUND 11 | E568: 6TH JULY | J568: WEATHER | S568: PLAYED AT
D569: 1ST QTR | H569: 2ND QTR | L569: 3RD QTR | P569: FINAL | S569: MORDIALLOC
A570: WERRIBEE | C570: 3 | D570: 1 | E570: =C570*6+D570 -> 19 | G570: 12 | H570: 4 | I570: =G570*6+H570 -> 76 | K570: 15 | L570: 5 | M570: =K570*6+L570 -> 95 | O570: 22 | P570: 8 | Q570: =O570*6+P570 -> 140 | S570: UMPIRE | X570: LADDER | AB570: ROUND | AD570: 11
A571: MORDIALLOC | C571: 2 | D571: 8 | E571: =C571*6+D571 -> 20 | G571: 4 | H571: 9 | I571: =G571*6+H571 -> 33 | K571: 6 | L571: 10 | M571: =K571*6+L571 -> 46 | O571: 7 | P571: 11 | Q571: =O571*6+P571 -> 53 | S571: ANASTASIO/WARD
A572: BEST PLAYERS | W572: TEAM | X572: W | Y572: L | Z572: D | AA572: FOR | AB572: AGST | AC572: % | AD572: PTS
A573: WERRIBEE | C573: SMITH | F573: FRASER | I573: WALPOLE | L573: GREY | N573: BUCKINGHAM | Q573: WILLIAMS
A574: MORDIALLOC | C574: DIXON | F574: BROMLEY | I574: MASON | L574: ELMER | N574: MAHONEY | W574: SUNSHINE | X574: 10 | Y574: 1 | Z574: 0 | AA574: 1469 | AB574: 847 | AC574: =(AA574*100)/AB574 -> 173.43565525383707 | AD574: =(X574*4)+(Z574*2) -> 40
A575: GOALKICKERS | R575: MEE | W575: BOX HILL | X575: 9 | Y575: 2 | Z575: 0 | AA575: 1487 | AB575: 855 | AC575: =(AA575*100)/AB575 -> 173.91812865497076 | AD575: =(X575*4)+(Z575*2) -> 36
A576: WERRIBEE | C576: WILLIAMS 7 | F576: FRASER 4 | H576: KELLY 2 | J576: WALLACE 2 | M576: JACKSON 2 | O576: HOY 2 | Q576: DUNSTAN | S576: BUCKINGHAM | W576: PRAHRAN | X576: 9 | Y576: 2 | Z576: 0 | AA576: 1476 | AB576: 959 | AC576: =(AA576*100)/AB576 -> 153.91032325338895 | AD576: =(X576*4)+(Z576*2) -> 36
A577: MORDIALLOC | C577: BROMLEY 4 | F577: DEATON | I577: P EVANS | K577: WATTERS | W577: OAKLEIGH | X577: 8 | Y577: 3 | Z577: 0 | AA577: 1484 | AB577: 850 | AC577: =(AA577*100)/AB577 -> 174.58823529411765 | AD577: =(X577*4)+(Z577*2) -> 32
A579: DANDENONG | C579: 0 | D579: 3 | E579: =C579*6+D579 -> 3 | G579: 7 | H579: 7 | I579: =G579*6+H579 -> 49 | K579: 9 | L579: 9 | M579: =K579*6+L579 -> 63 | O579: 15 | P579: 11 | Q579: =O579*6+P579 -> 101 | S579: BENTLEIGH | W579: DANDENONG | X579: 7 | Y579: 4 | Z579: 0 | AA579: 1037 | AB579: 894 | AC579: =(AA579*100)/AB579 -> 115.99552572706935 | AD579: =(X579*4)+(Z579*2) -> 28
A580: MOORABBIN | C580: 5 | D580: 2 | E580: =C580*6+D580 -> 32 | G580: 7 | H580: 3 | I580: =G580*6+H580 -> 45 | K580: 9 | L580: 9 | M580: =K580*6+L580 -> 63 | O580: 12 | P580: 10 | Q580: =O580*6+P580 -> 82 | S580: OKEY | W580: WAVERLEY | X580: 6 | Y580: 5 | Z580: 0 | AA580: 1309 | AB580: 1151 | AC580: =(AA580*100)/AB580 -> 113.72719374456995 | AD580: =(X580*4)+(Z580*2) -> 24
A581: BEST PLAYERS | S581: MORGAN | W581: WERRIBEE | X581: 5 | Y581: 6 | Z581: 0 | AA581: 1152 | AB581: 1090 | AC581: =(AA581*100)/AB581 -> 105.68807339449542 | AD581: =(X581*4)+(Z581*2) -> 20
A582: DANDENONG | C582: DARREN HALL | G582: HICKEY | J582: P KNIGHT | M582: McGUINNESS | P582: FINN | W582: MOORABBIN | X582: 5 | Y582: 6 | Z582: 0 | AA582: 1065 | AB582: 1182 | AC582: =(AA582*100)/AB582 -> 90.101522842639596 | AD582: =(X582*4)+(Z582*2) -> 20
A583: MOORABBIN | C583: MERCOULIA | G583: D CATHCART | J583: B CATHCART | M583: McGUINNESS | P583: POLLOCK | W583: CAULFIELD | X583: 4 | Y583: 7 | Z583: 0 | AA583: 1136 | AB583: 1308 | AC583: =(AA583*100)/AB583 -> 86.850152905198783 | AD583: =(X583*4)+(Z583*2) -> 16
A584: GOALKICKERS | W584: BERWICK | X584: 2 | Y584: 9 | Z584: 0 | AA584: 948 | AB584: 1602 | AC584: =(AA584*100)/AB584 -> 59.176029962546814 | AD584: =(X584*4)+(Z584*2) -> 8
A585: DANDENONG | C585: DARREN HALL 6 | G585: P KNIGHT 5 | J585: LAMBERT | L585: WRIGHT | N585: S KNIGHT | P585: MANGAN | W585: NORTHCOTE | X585: 1 | Y585: 10 | Z585: 0 | AA585: 1014 | AB585: 1620 | AC585: =(AA585*100)/AB585 -> 62.592592592592595 | AD585: =(X585*4)+(Z585*2) -> 4
A586: MOORABBIN | C586: POLLOCK 3 | F586: KNIGHT 2 | H586: STEWART 2 | K586: SCHULTZ 2 | N586: MERCOULIA | Q586: HALE | S586: O'TOOLE | W586: MORDIALLOC | X586: 0 | Y586: 11 | Z586: 0 | AA586: 688 | AB586: 1900 | AC586: =(AA586*100)/AB586 -> 36.210526315789473 | AD586: =(X586*4)+(Z586*2) -> 0
A588: CAULFIELD | C588: 3 | D588: 0 | E588: =C588*6+D588 -> 18 | G588: 8 | H588: 5 | I588: =G588*6+H588 -> 53 | K588: 10 | L588: 10 | M588: =K588*6+L588 -> 70 | O588: 15 | P588: 19 | Q588: =O588*6+P588 -> 109 | S588: PRINCES PARK, CAULFIELD
A589: NORTHCOTE | C589: 3 | D589: 7 | E589: =C589*6+D589 -> 25 | G589: 4 | H589: 9 | I589: =G589*6+H589 -> 33 | K589: 9 | L589: 14 | M589: =K589*6+L589 -> 68 | O589: 10 | P589: 16 | Q589: =O589*6+P589 -> 76 | S589: MITCHELL/SMITH
A590: BEST PLAYERS
A591: CAULFIELD | C591: EINSEDEL | F591: GODAU | I591: MUNROE | L591: HEMSTRON | O591: FARINSKI | R591: LARKIN
A592: NORTHCOTE | C592: ARMSTRONG | F592: CASTAGINI | I592: GARB\NER | L592: SPAGNOLO | O592: SCOTT | R592: STRANGWICK
A593: GOALKICKERS
A594: CAULFIELD | C594: RENDELL 4 | F594: GODAU 3 | H594: HARTSON 3 | K594: HEMSTRON 2 | N594: BROUGH | P594: DAWSON | S594: MILLS
A595: NORTHCOTE | C595: EWING 3 | F595: ARMSTRONG | I595: BAIRD | K595: CASTAGINI | N595: MITCHELL | Q595: SMITH | S595: ? 1 | U595: SPROAT
A597: SUNSHINE | C597: 3 | D597: 10 | E597: =C597*6+D597 -> 28 | G597: 10 | H597: 13 | I597: =G597*6+H597 -> 73 | K597: 16 | L597: 18 | M597: =K597*6+L597 -> 114 | O597: 18 | P597: 23 | Q597: =O597*6+P597 -> 131 | S597: SUNSHINE
A598: BERWICK | C598: 0 | D598: 1 | E598: =C598*6+D598 -> 1 | G598: 1 | H598: 2 | I598: =G598*6+H598 -> 8 | K598: 2 | L598: 4 | M598: =K598*6+L598 -> 16 | O598: 4 | P598: 8 | Q598: =O598*6+P598 -> 32 | S598: CARUSO/VERGONA
A599: BEST PLAYERS
A600: SUNSHINE | C600: NELSON | F600: MITROVSKI | I600: MENADUE | L600: DAY | O600: D BROWN | R600: PROTETTO
A601: BERWICK | C601: SCOTT | F601: ORSBORNE | I601: WRIGHT | L601: JOHNSON | O601: PARK
A602: GOALKICKERS
A603: SUNSHINE | C603: MITROVSKI 5 | F603: LITCHFIELD 4 | I603: NELSON 3 | K603: D CADDAYE 3 | N603: LAWLER | P603: MOSS | R603: MENADUE
A604: BERWICK | C604: PARK 2 | E604: WRIGHT | G604: TRIGG
A606: PRAHRAN | C606: 1 | D606: 2 | E606: =C606*6+D606 -> 8 | G606: 8 | H606: 6 | I606: =G606*6+H606 -> 54 | K606: 11 | L606: 9 | M606: =K606*6+L606 -> 75 | O606: 14 | P606: 11 | Q606: =O606*6+P606 -> 95 | S606: OAKLEIGH
A607: OAKLEIGH | C607: 2 | D607: 0 | E607: =C607*6+D607 -> 12 | G607: 5 | H607: 2 | I607: =G607*6+H607 -> 32 | K607: 10 | L607: 5 | M607: =K607*6+L607 -> 65 | O607: 12 | P607: 6 | Q607: =O607*6+P607 -> 78 | S607: BRADY/MARSHALL
A608: BEST PLAYERS
A609: PRAHRAN | C609: McNAMARA | F609: WALDER | I609: BINGHAM | L609: COOK | N609: SOULOS
A610: OAKLEIGH | C610: BATTERSBY | F610: S ROACH | I610: THOMPSON | L610: SUTHERLAND | O610: BAIN | Q610: McDONALD
A611: GOALKICKERS
A612: PRAHRAN | C612: McNAMARA 5 | F612: WALDER 4 | I612: BINGHAM 2 | L612: COOK 2 | N612: SOULOS
A613: OAKLEIGH | C613: PRETTO 5 | F613: BAIN 2 | H613: BATTERSBY 2 | K613: S ROURKE | N613: SUTHERLAND | Q613: OWEN
A615: BOX HILL | C615: 1 | D615: 1 | E615: =C615*6+D615 -> 7 | G615: 7 | H615: 3 | I615: =G615*6+H615 -> 45 | K615: 13 | L615: 6 | M615: =K615*6+L615 -> 84 | O615: 17 | P615: 11 | Q615: =O615*6+P615 -> 113 | S615: WAVERLEY
A616: WAVERLEY | C616: 4 | D616: 4 | E616: =C616*6+D616 -> 28 | G616: 5 | H616: 5 | I616: =G616*6+H616 -> 35 | K616: 7 | L616: 7 | M616: =K616*6+L616 -> 49 | O616: 7 | P616: 8 | Q616: =O616*6+P616 -> 50 | S616: CURRAN/NOLAN
A617: BEST PLAYERS
A618: BOX HILL | C618: ROCHOW | F618: DYER | I618: BROWN | L618: GARTH | N618: NICHOLSON | Q618: P BOLTON
A619: WAVERLEY | C619: PEARSON | F619: SHAW | I619: KINNABURGH | L619: CSOTI | N619: McCORKELL | Q619: DE WIT
A620: GOALKICKERS
A621: BOX HILL | C621: P BOLTON 7 | F621: WITHERS 3 | I621: L BOLTON 2 | L621: GARTH 2 | N621: TRESSIDER | Q621: O'SHEA | S621: NICHOLSON
A622: WAVERLEY | C622: ANGELIS 3 | F622: HARRISON 2 | I622: POLA | K622: VEAR
A624: ROUND 12 | E624: 13TH JULY | J624: WEATHER | S624: PLAYED AT
D625: 1ST QTR | H625: 2ND QTR | L625: 3RD QTR | P625: FINAL | S625: BOX HILL
A626: BOX HILL | C626: 5 | D626: 0 | E626: =C626*6+D626 -> 30 | G626: 10 | H626: 2 | I626: =G626*6+H626 -> 62 | K626: 12 | L626: 3 | M626: =K626*6+L626 -> 75 | O626: 19 | P626: 4 | Q626: =O626*6+P626 -> 118 | S626: UMPIRE | X626: LADDER | AB626: ROUND | AD626: 12
A627: DANDENONG | C627: 4 | D627: 4 | E627: =C627*6+D627 -> 28 | G627: 4 | H627: 4 | I627: =G627*6+H627 -> 28 | K627: 8 | L627: 9 | M627: =K627*6+L627 -> 57 | O627: 9 | P627: 9 | Q627: =O627*6+P627 -> 63 | S627: SMITH/VERGONA
A628: BEST PLAYERS | W628: TEAM | X628: W | Y628: L | Z628: D | AA628: FOR | AB628: AGST | AC628: % | AD628: PTS
A629: BOX HILL | C629: TRESSIDER | F629: DYER | I629: O'SHEA | L629: BROWN | O629: P BOLTON | R629: DWYER
A630: DANDENONG | C630: FINN | F630: LINDSAY | I630: COUSINS | L630: DARREN HALL | O630: McGUINNESS | R630: LAMBERT | W630: SUNSHINE | X630: 11 | Y630: 1 | Z630: 0 | AA630: 1587 | AB630: 894 | AC630: =(AA630*100)/AB630 -> 177.51677852348993 | AD630: =(X630*4)+(Z630*2) -> 44
A631: GOALKICKERS | W631: BOX HILL | X631: 10 | Y631: 2 | Z631: 0 | AA631: 1605 | AB631: 918 | AC631: =(AA631*100)/AB631 -> 174.83660130718954 | AD631: =(X631*4)+(Z631*2) -> 40
A632: BOX HILL | C632: TRESSIDER 6 | F632: P BOLTON 5 | I632: L BOLTON 2 | L632: GARTH 2 | N632: NICHOLSON 2 | Q632: GLEESON | S632: WITHERS | W632: OAKLEIGH | X632: 9 | Y632: 3 | Z632: 0 | AA632: 1572 | AB632: 931 | AC632: =(AA632*100)/AB632 -> 168.85069817400645 | AD632: =(X632*4)+(Z632*2) -> 36
A633: DANDENONG | C633: DARREN HALL 2 | G633: LEEMON 2 | J633: MILLIGAN | M633: LINDSAY | O633: MYNOTT | Q633: P KNIGHT | S633: COUSINS | W633: PRAHRAN | X633: 9 | Y633: 3 | Z633: 0 | AA633: 1523 | AB633: 1077 | AC633: =(AA633*100)/AB633 -> 141.4113277623027 | AD633: =(X633*4)+(Z633*2) -> 36
A635: MOORABBIN | C635: 3 | D635: 4 | E635: =C635*6+D635 -> 22 | G635: 7 | H635: 7 | I635: =G635*6+H635 -> 49 | K635: 11 | L635: 11 | M635: =K635*6+L635 -> 77 | O635: 14 | P635: 13 | Q635: =O635*6+P635 -> 97 | S635: BENTLEIGH | W635: WAVERLEY | X635: 7 | Y635: 5 | Z635: 0 | AA635: 1438 | AB635: 1164 | AC635: =(AA635*100)/AB635 -> 123.53951890034364 | AD635: =(X635*4)+(Z635*2) -> 28
A636: NORTHCOTE | C636: 3 | D636: 5 | E636: =C636*6+D636 -> 23 | G636: 5 | H636: 6 | I636: =G636*6+H636 -> 36 | K636: 7 | L636: 8 | M636: =K636*6+L636 -> 50 | O636: 12 | P636: 13 | Q636: =O636*6+P636 -> 85 | S636: ANASTASIO | W636: DANDENONG | X636: 7 | Y636: 5 | Z636: 0 | AA636: 1100 | AB636: 1012 | AC636: =(AA636*100)/AB636 -> 108.69565217391305 | AD636: =(X636*4)+(Z636*2) -> 28
A637: BEST PLAYERS | S637: BLACK | W637: MOORABBIN | X637: 6 | Y637: 6 | Z637: 0 | AA637: 1162 | AB637: 1267 | AC637: =(AA637*100)/AB637 -> 91.712707182320443 | AD637: =(X637*4)+(Z637*2) -> 24
A638: MOORABBIN | C638: POLLOCK | F638: LETT | I638: O'TOOLE | L638: D CATHCART | O638: BAKER | W638: WERRIBEE | X638: 5 | Y638: 7 | Z638: 0 | AA638: 1233 | AB638: 1178 | AC638: =(AA638*100)/AB638 -> 104.66893039049236 | AD638: =(X638*4)+(Z638*2) -> 20
A639: NORTHCOTE | C639: SCOTT | F639: CASTAGINI | I639: VENABLES | L639: MINNETT | O639: COURTS | R639: REED | W639: CAULFIELD | X639: 5 | Y639: 7 | Z639: 0 | AA639: 1269 | AB639: 1416 | AC639: =(AA639*100)/AB639 -> 89.618644067796609 | AD639: =(X639*4)+(Z639*2) -> 20
A640: GOALKICKERS | P640: B CATHCART | W640: BERWICK | X640: 2 | Y640: 10 | Z640: 0 | AA640: 1056 | AB640: 1735 | AC640: =(AA640*100)/AB640 -> 60.864553314121039 | AD640: =(X640*4)+(Z640*2) -> 8
A641: MOORABBIN | C641: O'TOOLE 3 | F641: GILMORE 2 | H641: SCHULTZ 2 | J641: B CATHCART 2 | M641: STEWART | O641: POLLOCK | Q641: MORRIS | S641: BARBER | W641: NORTHCOTE | X641: 1 | Y641: 11 | Z641: 0 | AA641: 1099 | AB641: 1717 | AC641: =(AA641*100)/AB641 -> 64.006988934187532 | AD641: =(X641*4)+(Z641*2) -> 4
A642: NORTHCOTE | C642: MITCHELL 4 | F642: STRANGWICK 3 | I642: SPROAT | K642: COURTS | M642: REED | O642: SMITH | Q642: SCOTT | W642: MORDIALLOC | X642: 0 | Y642: 12 | Z642: 0 | AA642: 701 | AB642: 2029 | AC642: =(AA642*100)/AB642 -> 34.549038935436172 | AD642: =(X642*4)+(Z642*2) -> 0
A644: CAULFIELD | C644: 4 | D644: 8 | E644: =C644*6+D644 -> 32 | G644: 10 | H644: 11 | I644: =G644*6+H644 -> 71 | K644: 16 | L644: 16 | M644: =K644*6+L644 -> 112 | O644: 19 | P644: 19 | Q644: =O644*6+P644 -> 133 | S644: PRINCES PARK, CAULFIELD
A645: BERWICK | C645: 3 | D645: 1 | E645: =C645*6+D645 -> 19 | G645: 4 | H645: 5 | I645: =G645*6+H645 -> 29 | K645: 9 | L645: 7 | M645: =K645*6+L645 -> 61 | O645: 16 | P645: 12 | Q645: =O645*6+P645 -> 108 | S645: CURRAN/WARD
A646: BEST PLAYERS
A647: CAULFIELD | C647: DAWSON | F647: FARINSKI | I647: FAWCETT | L647: HAIDIMOUS | O647: HARTSON | R647: HEMSTRON
A648: BERWICK | C648: PARK | F648: M JOHNSON | I648: DEVINE | L648: MANNENS | O648: McGILL | R648: HIPWORTH
A649: GOALKICKERS
A650: CAULFIELD | C650: GODAU 5 | E650: RENDELL 5 | G650: DAWSON 3 | J650: HARTSON 2 | M650: EINSEDEL | O650: FARINSKI | R650: HAIDIMOUS | U650: LEWIS
A651: BERWICK | C651: PARK 4 | E651: McGILL 4 | G651: HIPWORTH 3 | J651: M JOHNSON | M651: S JOHNSON | P651: SALIBA | R651: KENNY | T651: PEARCE
A653: SUNSHINE | C653: 2 | D653: 3 | E653: =C653*6+D653 -> 15 | G653: 5 | H653: 5 | I653: =G653*6+H653 -> 35 | K653: 9 | L653: 8 | M653: =K653*6+L653 -> 62 | O653: 18 | P653: 10 | Q653: =O653*6+P653 -> 118 | S653: SUNSHINE
A654: PRAHRAN | C654: 2 | D654: 1 | E654: =C654*6+D654 -> 13 | G654: 2 | H654: 4 | I654: =G654*6+H654 -> 16 | K654: 3 | L654: 8 | M654: =K654*6+L654 -> 26 | O654: 6 | P654: 11 | Q654: =O654*6+P654 -> 47 | S654: R CASEY/MORGAN
A655: BEST PLAYERS
A656: SUNSHINE | C656: MITROVSKI | F656: DAY | I656: LAWLER | L656: CALDWELL | O656: D BROWN | R656: NELSON
A657: PRAHRAN | C657: SURNAN | F657: GILES | I657: STYNES | L657: WALDER
A658: GOALKICKERS
A659: SUNSHINE | C659: LITCHFIELD 6 | F659: WALSH 3 | H659: DORGAN 2 | K659: SHEPPERBOTTOM 2 | O659: NELSON | Q659: MOSS | S659: MITROVSKI | V659: SCHICCITANO | X659: D CADDAYE
A660: PRAHRAN | C660: WALDER 3 | F660: HANDLEY 2 | I660: McNAMARA
A662: OAKLEIGH | C662: 4 | D662: 1 | E662: =C662*6+D662 -> 25 | G662: 8 | H662: 3 | I662: =G662*6+H662 -> 51 | K662: 12 | L662: 3 | M662: =K662*6+L662 -> 75 | O662: 14 | P662: 4 | Q662: =O662*6+P662 -> 88 | S662: OAKLEIGH
A663: WERRIBEE | C663: 0 | D663: 4 | E663: =C663*6+D663 -> 4 | G663: 3 | H663: 4 | I663: =G663*6+H663 -> 22 | K663: 8 | L663: 7 | M663: =K663*6+L663 -> 55 | O663: 11 | P663: 15 | Q663: =O663*6+P663 -> 81 | S663: BRADSHAW/GLEESON
A664: BEST PLAYERS
A665: OAKLEIGH | C665: TODD | F665: THOMPSON | I665: S ROACH | L665: CUNNINGHAM | O665: C ROURKE | R665: SUTHERLAND
A666: WERRIBEE | C666: DUNSTAN | F666: MONTGOMERY | I666: MOLONEY | L666: BONAT | O666: GREY | R666: BUCKINGHAM
A667: GOALKICKERS
A668: OAKLEIGH | C668: PRETTO 5 | F668: ALDRIDGE 2 | I668: OWEN 2 | K668: ATHERTON | N668: TODD | P668: S ROURKE | R668: JOHNSON | T668: HOWE
A669: WERRIBEE | C669: DUNSTAN 5 | F669: MONTGOMERY 2 | J669: KELLY 2 | L669: WILLIAMS | O669: MOLONEY
A671: WAVERLEY | C671: 5 | D671: 2 | E671: =C671*6+D671 -> 32 | G671: 10 | H671: 8 | I671: =G671*6+H671 -> 68 | K671: 13 | L671: 15 | M671: =K671*6+L671 -> 93 | O671: 18 | P671: 21 | Q671: =O671*6+P671 -> 129 | S671: WAVERLEY
A672: MORDIALLOC | C672: 1 | D672: 2 | E672: =C672*6+D672 -> 8 | G672: 1 | H672: 3 | I672: =G672*6+H672 -> 9 | K672: 1 | L672: 5 | M672: =K672*6+L672 -> 11 | O672: 1 | P672: 7 | Q672: =O672*6+P672 -> 13 | S672: BRADY/MITCHELL
A673: BEST PLAYERS
A674: WAVERLEY | C674: KINNABURGH | G674: HARRISON | J674: SCOTT | M674: PEARSON | P674: POLA | R674: LE PAIRE
A675: MORDIALLOC | C675: BROMLEY | G675: PEVANS | J675: HARRISON
A676: GOALKICKERS
A677: WAVERLEY | C677: POLA 7 | E677: EVANS 5 | G677: VEAR 2 | I677: DE WIT | K677: KINNABURGH | N677: PEARSON | Q677: SHAW
A678: MORDIALLOC | C678: P EVANS
A680: ROUND 13 | E680: 20TH JULY | J680: WEATHER | S680: PLAYED AT
D681: 1ST QTR | H681: 2ND QTR | L681: 3RD QTR | P681: FINAL | S681: MORDIALLOC
A682: OAKLEIGH | C682: 6 | D682: 5 | E682: =C682*6+D682 -> 41 | G682: 11 | H682: 11 | I682: =G682*6+H682 -> 77 | K682: 20 | L682: 15 | M682: =K682*6+L682 -> 135 | O682: 31 | P682: 19 | Q682: =O682*6+P682 -> 205 | S682: UMPIRE | X682: LADDER | AB682: ROUND | AD682: 13
A683: MORDIALLOC | C683: 1 | D683: 1 | E683: =C683*6+D683 -> 7 | G683: 5 | H683: 2 | I683: =G683*6+H683 -> 32 | K683: 6 | L683: 4 | M683: =K683*6+L683 -> 40 | O683: 8 | P683: 6 | Q683: =O683*6+P683 -> 54 | S683: SMITH/BROOKS
A684: BEST PLAYERS | W684: TEAM | X684: W | Y684: L | Z684: D | AA684: FOR | AB684: AGST | AC684: % | AD684: PTS
A685: OAKLEIGH | C685: PRETTO | F685: S ROACH | I685: SUTHERLAND | L685: S ROURKE | O685: CUNNINGHAM | R685: BAIN
A686: MORDIALLOC | C686: DIXON | F686: DEATON | I686: MASON | L686: P EVANS | O686: HOFFMAN | R686: DAVIDSON | W686: SUNSHINE | X686: 12 | Y686: 1 | Z686: 0 | AA686: 1675 | AB686: 948 | AC686: =(AA686*100)/AB686 -> 176.68776371308016 | AD686: =(X686*4)+(Z686*2) -> 48
A687: GOALKICKERS | W687: BOX HILL | X687: 11 | Y687: 2 | Z687: 0 | AA687: 1819 | AB687: 970 | AC687: =(AA687*100)/AB687 -> 187.5257731958763 | AD687: =(X687*4)+(Z687*2) -> 44
A688: OAKLEIGH | C688: PRETTO 18 | F688: SIMPSON 6 | I688: OWEN 4 | K688: BAIN | M688: ROSS | O688: S ROURKE | W688: OAKLEIGH | X688: 10 | Y688: 3 | Z688: 0 | AA688: 1777 | AB688: 985 | AC688: =(AA688*100)/AB688 -> 180.40609137055839 | AD688: =(X688*4)+(Z688*2) -> 40
A689: MORDIALLOC | C689: WATTERS 2 | F689: BROMLEY 2 | I689: DEATON | K689: DIXON | M689: DAVIDSON | P689: HOFFMAN | W689: PRAHRAN | X689: 10 | Y689: 3 | Z689: 0 | AA689: 1675 | AB689: 1201 | AC689: =(AA689*100)/AB689 -> 139.46711074104911 | AD689: =(X689*4)+(Z689*2) -> 40
A691: SUNSHINE | C691: 3 | D691: 3 | E691: =C691*6+D691 -> 21 | G691: 7 | H691: 4 | I691: =G691*6+H691 -> 46 | K691: 11 | L691: 6 | M691: =K691*6+L691 -> 72 | O691: 13 | P691: 10 | Q691: =O691*6+P691 -> 88 | S691: WERRIBEE | W691: DANDENONG | X691: 8 | Y691: 5 | Z691: 0 | AA691: 1205 | AB691: 1067 | AC691: =(AA691*100)/AB691 -> 112.93345829428304 | AD691: =(X691*4)+(Z691*2) -> 32
A692: WERRIBEE | C692: 4 | D692: 3 | E692: =C692*6+D692 -> 27 | G692: 4 | H692: 4 | I692: =G692*6+H692 -> 28 | K692: 6 | L692: 7 | M692: =K692*6+L692 -> 43 | O692: 8 | P692: 10 | Q692: =O692*6+P692 -> 58 | S692: HUTCHINSON | W692: WAVERLEY | X692: 7 | Y692: 6 | Z692: 0 | AA692: 1493 | AB692: 1269 | AC692: =(AA692*100)/AB692 -> 117.65169424743893 | AD692: =(X692*4)+(Z692*2) -> 28
A693: BEST PLAYERS | S693: OAKLEY | W693: MOORABBIN | X693: 7 | Y693: 6 | Z693: 0 | AA693: 1240 | AB693: 1283 | AC693: =(AA693*100)/AB693 -> 96.648480124707717 | AD693: =(X693*4)+(Z693*2) -> 28
A694: SUNSHINE | C694: D CADDAYE | F694: LAWLER | I694: MENADUE | L694: MITROVSKI | O694: QUINN | R694: WALSH | W694: WERRIBEE | X694: 5 | Y694: 8 | Z694: 0 | AA694: 1291 | AB694: 1266 | AC694: =(AA694*100)/AB694 -> 101.97472353870458 | AD694: =(X694*4)+(Z694*2) -> 20
A695: WERRIBEE | C695: GREY | F695: MONTGOMERY | I695: BUCKINGHAM | L695: DUNSTAN | O695: MEMBREY | R695: B MOLONEY | W695: CAULFIELD | X695: 5 | Y695: 8 | Z695: 0 | AA695: 1393 | AB695: 1568 | AC695: =(AA695*100)/AB695 -> 88.839285714285708 | AD695: =(X695*4)+(Z695*2) -> 20
A696: GOALKICKERS | W696: BERWICK | X696: 2 | Y696: 11 | Z696: 0 | AA696: 1072 | AB696: 1813 | AC696: =(AA696*100)/AB696 -> 59.128516271373414 | AD696: =(X696*4)+(Z696*2) -> 8
A697: SUNSHINE | C697: LITCHFIELD 7 | F697: WALKER 2 | I697: DAY | J697: DORGAN | L697: GIBB | N697: WALSH | W697: NORTHCOTE | X697: 1 | Y697: 12 | Z697: 0 | AA697: 1151 | AB697: 1931 | AC697: =(AA697*100)/AB697 -> 59.606421543241844 | AD697: =(X697*4)+(Z697*2) -> 4
A698: WERRIBEE | C698: KELLY 3 | F698: DUNSTAN | I698: BUCKINGHAM | L698: B MOLONEY | O698: S MOLONEY | R698: MONTGOMERY | W698: MORDIALLOC | X698: 0 | Y698: 13 | Z698: 0 | AA698: 755 | AB698: 2234 | AC698: =(AA698*100)/AB698 -> 33.795881826320503 | AD698: =(X698*4)+(Z698*2) -> 0
A700: PRAHRAN | C700: 7 | D700: 6 | E700: =C700*6+D700 -> 48 | G700: 15 | H700: 12 | I700: =G700*6+H700 -> 102 | K700: 17 | L700: 17 | M700: =K700*6+L700 -> 119 | O700: 22 | P700: 20 | Q700: =O700*6+P700 -> 152 | S700: TOORAK PARK
A701: CAULFIELD | C701: 1 | D701: 1 | E701: =C701*6+D701 -> 7 | G701: 3 | H701: 3 | I701: =G701*6+H701 -> 21 | K701: 9 | L701: 6 | M701: =K701*6+L701 -> 60 | O701: 19 | P701: 10 | Q701: =O701*6+P701 -> 124 | S701: BLACK/COOKE
A702: BEST PLAYERS
A703: PRAHRAN | C703: BATT | F703: STYNES | I703: ELLETT | K703: LOWE | N703: DURNAN | Q703: PHILLIPS
A704: CAULFIELD | C704: LARKIN | F704: EINSEDEL | I704: HEMSTRON | K704: DAWSON | N704: REID | Q704: FARINSKI
A705: GOALKICKERS
A706: PRAHRAN | C706: LOWE 8 | E706: COOK 3 | G706: STYNES 2 | I706: PHILLIPS 2 | K706: SOULOS | M706: HUTCHISON | O706: WALLACE | R706: GILES | S706: BINGHAM | V706: TAPPING | X706: McDONALD
A707: CAULFIELD | C707: HARTSON 4 | F707: LEWIS 4 | H707: MUNROE 3 | K707: GODAU 2 | M707: DAWSON 2 | O707: REID 2 | Q707: MILLS | S707: O'KEEFE
A709: MOORABBIN | C709: 5 | D709: 3 | E709: =C709*6+D709 -> 33 | G709: 7 | H709: 9 | I709: =G709*6+H709 -> 51 | K709: 8 | L709: 10 | M709: =K709*6+L709 -> 58 | O709: 11 | P709: 12 | Q709: =O709*6+P709 -> 78 | S709: BERWICK
A710: BERWICK | C710: 0 | D710: 0 | E710: =C710*6+D710 -> 0 | G710: 0 | H710: 2 | I710: =G710*6+H710 -> 2 | K710: 1 | L710: 4 | M710: =K710*6+L710 -> 10 | O710: 2 | P710: 4 | Q710: =O710*6+P710 -> 16 | S710: McDONALD/MITCHELL
A711: BEST PLAYERS
A712: MOORABBIN | C712: P LAZZARO | F712: D CATHCART | J712: LETT | L712: B CATHCART | O712: POLLOCK
A713: BERWICK | C713: DEVINE | F713: M JOHNSON | J713: HIPWORTH | M713: SCOTT | O713: PARK | Q713: LUXFORD
A714: GOALKICKERS
A715: MOORABBIN | C715: B CATHCART 3 | F715: P LAZZARO 3 | I715: STEWART | L715: B LAZZARO | O715: SCHULTZ | R715: O'TOOLE | T715: GILMORE
A716: BERWICK | C716: HIPWORTH | F716: McGILL
A718: BOX HILL | C718: 5 | D718: 5 | E718: =C718*6+D718 -> 35 | G718: 12 | H718: 8 | I718: =G718*6+H718 -> 80 | K718: 19 | L718: 11 | M718: =K718*6+L718 -> 125 | O718: 33 | P718: 16 | Q718: =O718*6+P718 -> 214 | S718: NORTHCOTE
A719: NORTHCOTE | C719: 2 | D719: 2 | E719: =C719*6+D719 -> 14 | G719: 5 | H719: 2 | I719: =G719*6+H719 -> 32 | K719: 7 | L719: 2 | M719: =K719*6+L719 -> 44 | O719: 8 | P719: 4 | Q719: =O719*6+P719 -> 52 | S719: BRADSHAW/MORGAN
A720: BEST PLAYERS
A721: BOX HILL | C721: P BOLTON | F721: DYER | I721: CUFF | K721: WITHERS | N721: SHALLVEY | Q721: SHERIDAN
A722: NORTHCOTE | C722: SCOTT | F722: COURTS | I722: CASTAGINI | K722: SPROAT | N722: GARNER | Q722: MINNETT
A723: GOALKICKERS
A724: BOX HILL | C724: P BOLTON 12 | F724: WITHERS 8 | H724: GARTH 3 | J724: NICHOLSON 2 | M724: O'SHEA 2 | O724: SHALLVEY 2 | R724: SHERIDAN 2 | U724: TRESSIDER | W724: GLEESON
A725: NORTHCOTE | C725: MITCHELL 2 | F725: SCOTT 2 | I725: SMITH 2 | K725: REED | M725: HIGGINS
A727: DANDENONG | C727: 7 | D727: 4 | E727: =C727*6+D727 -> 46 | G727: 9 | H727: 6 | I727: =G727*6+H727 -> 60 | K727: 11 | L727: 11 | M727: =K727*6+L727 -> 77 | O727: 15 | P727: 15 | Q727: =O727*6+P727 -> 105 | S727: DANDENONG
A728: WAVERLEY | C728: 2 | D728: 4 | E728: =C728*6+D728 -> 16 | G728: 4 | H728: 5 | I728: =G728*6+H728 -> 29 | K728: 7 | L728: 6 | M728: =K728*6+L728 -> 48 | O728: 8 | P728: 7 | Q728: =O728*6+P728 -> 55 | S728: ARMSTRONG/WARD
A729: BEST PLAYERS
A730: DANDENONG | C730: FINN | E730: DARREN HALL | I730: HICKEY | L730: HAMILTON | O730: COUSINS | R730: LINDSAY
A731: WAVERLEY | C731: ANDERSON | E731: KINNABURGH | I731: EVANS | L731: BRIGGS | O731: PEARSON
A732: GOALKICKERS
A733: DANDENONG | C733: HICKEY 3 | F733: KNIGHT 3 | H733: LEEMON 3 | J733: TUFO 2 | L733: PALLANT | N733: DARREN HALL | Q733: COUSINS | S733: HAMILTON
A734: WAVERLEY | C734: ANGELIS 4 | F734: KINNABURGH | I734: SHAW | K734: EVANS | M734: HARRISON
A736: ROUND 14 | E736: 27TH JULY | J736: WEATHER | S736: PLAYED AT
D737: 1ST QTR | H737: 2ND QTR | L737: 3RD QTR | P737: FINAL | S737: DANDENONG
A738: DANDENONG | C738: 2 | D738: 6 | E738: =C738*6+D738 -> 18 | G738: 6 | H738: 9 | I738: =G738*6+H738 -> 45 | K738: 11 | L738: 15 | M738: =K738*6+L738 -> 81 | O738: 13 | P738: 19 | Q738: =O738*6+P738 -> 97 | S738: UMPIRE | X738: LADDER | AB738: ROUND | AD738: 14
A739: NORTHCOTE | C739: 0 | D739: 3 | E739: =C739*6+D739 -> 3 | G739: 2 | H739: 3 | I739: =G739*6+H739 -> 15 | K739: 4 | L739: 3 | M739: =K739*6+L739 -> 27 | O739: 5 | P739: 4 | Q739: =O739*6+P739 -> 34 | S739: CARUSO/PHILLIPS
A740: BEST PLAYERS | W740: TEAM | X740: W | Y740: L | Z740: D | AA740: FOR | AB740: AGST | AC740: % | AD740: PTS
A741: DANDENONG | C741: PALLANT | F741: McGUINNESS | I741: HAMILTON | L741: MERRIGAN | O741: DARREN HALL | R741: LINDSAY
A742: NORTHCOTE | C742: SCOTT | F742: COURTS | I742: SPROAT | L742: HUGGINS | O742: STRANGWICK | R742: MINNETT | W742: SUNSHINE | X742: 13 | Y742: 1 | Z742: 0 | AA742: 1887 | AB742: 997 | AC742: =(AA742*100)/AB742 -> 189.2678034102307 | AD742: =(X742*4)+(Z742*2) -> 52
A743: GOALKICKERS | W743: BOX HILL | X743: 12 | Y743: 2 | Z743: 0 | AA743: 2055 | AB743: 984 | AC743: =(AA743*100)/AB743 -> 208.84146341463415 | AD743: =(X743*4)+(Z743*2) -> 48
A744: DANDENONG | C744: WRIGHT 3 | F744: PALLANT 3 | H744: TUFO 2 | J744: HICKEY 2 | L744: DARREN HALL | O744: HAMILTON | R744: LAMBERT | W744: OAKLEIGH | X744: 11 | Y744: 3 | Z744: 0 | AA744: 1863 | AB744: 1014 | AC744: =(AA744*100)/AB744 -> 183.72781065088756 | AD744: =(X744*4)+(Z744*2) -> 44
A745: NORTHCOTE | C745: STRANGWICK 2 | G745: SPROAT | J745: ARMSTRONG | M745: GARNER | W745: PRAHRAN | X745: 11 | Y745: 3 | Z745: 0 | AA745: 1745 | AB745: 1233 | AC745: =(AA745*100)/AB745 -> 141.52473641524736 | AD745: =(X745*4)+(Z745*2) -> 44
A747: BOX HILL | C747: 8 | D747: 9 | E747: =C747*6+D747 -> 57 | G747: 16 | H747: 15 | I747: =G747*6+H747 -> 111 | K747: 27 | L747: 24 | M747: =K747*6+L747 -> 186 | O747: 34 | P747: 32 | Q747: =O747*6+P747 -> 236 | S747: BOX HILL | W747: DANDENONG | X747: 9 | Y747: 5 | Z747: 0 | AA747: 1302 | AB747: 1101 | AC747: =(AA747*100)/AB747 -> 118.25613079019074 | AD747: =(X747*4)+(Z747*2) -> 36
A748: BERWICK | C748: 0 | D748: 2 | E748: =C748*6+D748 -> 2 | G748: 0 | H748: 2 | I748: =G748*6+H748 -> 2 | K748: 1 | L748: 2 | M748: =K748*6+L748 -> 8 | O748: 2 | P748: 2 | Q748: =O748*6+P748 -> 14 | S748: ANASTASI | W748: WAVERLEY | X748: 7 | Y748: 7 | Z748: 0 | AA748: 1522 | AB748: 1355 | AC748: =(AA748*100)/AB748 -> 112.32472324723247 | AD748: =(X748*4)+(Z748*2) -> 28
A749: BEST PLAYERS | S749: HUTCHINSON | W749: MOORABBIN | X749: 7 | Y749: 7 | Z749: 0 | AA749: 1272 | AB749: 1353 | AC749: =(AA749*100)/AB749 -> 94.013303769401332 | AD749: =(X749*4)+(Z749*2) -> 28
A750: BOX HILL | C750: SHERIDAN | F750: TRESSIDER | I750: BOURKE | L750: DWYER | O750: WITHERS | R750: TEAKEL | W750: CAULFIELD | X750: 6 | Y750: 8 | Z750: 0 | AA750: 1508 | AB750: 1632 | AC750: =(AA750*100)/AB750 -> 92.401960784313729 | AD750: =(X750*4)+(Z750*2) -> 24
A751: BERWICK | C751: VENVILLE | F751: HIPWORTH | I751: MANNENS | L751: S JOHNSON | W751: WERRIBEE | X751: 5 | Y751: 9 | Z751: 0 | AA751: 1355 | AB751: 1381 | AC751: =(AA751*100)/AB751 -> 98.117306299782769 | AD751: =(X751*4)+(Z751*2) -> 20
A752: GOALKICKERS | P752: TURNER | W752: BERWICK | X752: 2 | Y752: 12 | Z752: 0 | AA752: 1086 | AB752: 2039 | AC752: =(AA752*100)/AB752 -> 53.261402648357041 | AD752: =(X752*4)+(Z752*2) -> 8
A753: BOX HILL | C753: P BOLTON 9 | F753: TRESSIDER 7 | I753: WITHERS 6 | K753: NICHOLSON 4 | N753: SHERIDAN 4 | Q753: GARTH | S753: O'SHEA | U753: TEAKEL | W753: NORTHCOTE | X753: 1 | Y753: 13 | Z753: 0 | AA753: 1185 | AB753: 2028 | AC753: =(AA753*100)/AB753 -> 58.431952662721891 | AD753: =(X753*4)+(Z753*2) -> 4
A754: BERWICK | C754: McGILL | F754: KENNY | W754: MORDIALLOC | X754: 0 | Y754: 14 | Z754: 0 | AA754: 804 | AB754: 2446 | AC754: =(AA754*100)/AB754 -> 32.869991823385121 | AD754: =(X754*4)+(Z754*2) -> 0
A756: PRAHRAN | C756: 3 | D756: 2 | E756: =C756*6+D756 -> 20 | G756: 5 | H756: 7 | I756: =G756*6+H756 -> 37 | K756: 7 | L756: 9 | M756: =K756*6+L756 -> 51 | O756: 10 | P756: 10 | Q756: =O756*6+P756 -> 70 | S756: BENTLEIGH
A757: MOORABBIN | C757: 2 | D757: 4 | E757: =C757*6+D757 -> 16 | G757: 3 | H757: 6 | I757: =G757*6+H757 -> 24 | K757: 4 | L757: 6 | M757: =K757*6+L757 -> 30 | O757: 4 | P757: 8 | Q757: =O757*6+P757 -> 32 | S757: MITCHELL/BRADSHAW
A758: BEST PLAYERS
A759: PRAHRAN | C759: GILES | F759: FIELDING | I759: DURNAN | L759: STYNES | O759: PHILLIPS | R759: HUTCHISON
A760: MOORABBIN | C760: GILMORE | F760: LETT | I760: POLLOCK | L760: KNIGHT | O760: REVERE
A761: GOALKICKERS
A762: PRAHRAN | C762: LOWE 4 | E762: STYNES 2 | G762: SOULOS | I762: McNAMARA | L762: BINGHAM | O762: WALLACE
A763: MOORABBIN | C763: McGUINNESS | F763: STEWART | I763: BAKER | K763: O'TOOLE
A765: CAULFIELD | C765: 7 | D765: 3 | E765: =C765*6+D765 -> 45 | G765: 9 | H765: 10 | I765: =G765*6+H765 -> 64 | K765: 12 | L765: 13 | M765: =K765*6+L765 -> 85 | O765: 16 | P765: 19 | Q765: =O765*6+P765 -> 115 | S765: PRINCES PARK, CAULFIELD
A766: WERRIBEE | C766: 2 | D766: 0 | E766: =C766*6+D766 -> 12 | G766: 5 | H766: 4 | I766: =G766*6+H766 -> 34 | K766: 6 | L766: 9 | M766: =K766*6+L766 -> 45 | O766: 9 | P766: 10 | Q766: =O766*6+P766 -> 64 | S766: BREWER/MARCY
A767: BEST PLAYERS
A768: CAULFIELD | C768: MUNROE | F768: DAWSON | I768: FAWCETT | L768: REID | O768: ROEBURY | R768: LARKIN
A769: WERRIBEE | C769: GREY | F769: WALPOLE | I769: MEMBREY | L769: DUNSTAN | O769: S MOLONEY | R769: FARRELLY
A770: GOALKICKERS
A771: CAULFIELD | C771: GODAU 3 | F771: HEMSTRON 3 | I771: DAWSON 2 | K771: HARTSON 2 | N771: FARINSKI | P771: MILLS | R771: O'BRIEN | T771: O'KEEFE | V771: REID | W771: RENDELL
A772: WERRIBEE | C772: WILLIAMS 3 | F772: KELLY 2 | H772: DUNSTAN | J772: MEMBREY | M772: ROGOZIK | O772: B MOLONEY
A774: SUNSHINE | C774: 9 | D774: 3 | E774: =C774*6+D774 -> 57 | G774: 16 | H774: 6 | I774: =G774*6+H774 -> 102 | K774: 23 | L774: 9 | M774: =K774*6+L774 -> 147 | O774: 33 | P774: 14 | Q774: =O774*6+P774 -> 212 | S774: SUNSHINE
A775: MORDIALLOC | C775: 1 | D775: 1 | E775: =C775*6+D775 -> 7 | G775: 2 | H775: 6 | I775: =G775*6+H775 -> 18 | K775: 6 | L775: 7 | M775: =K775*6+L775 -> 43 | O775: 7 | P775: 7 | Q775: =O775*6+P775 -> 49 | S775: BLACK/WARD
A776: BEST PLAYERS
A777: SUNSHINE | C777: LITCHFIELD | F777: WALSH | I777: BROWN | L777: LAWLER | O777: MITROVSKI | R777: NELSON
A778: MORDIALLOC | C778: HOFFMAN | F778: MAHONEY | I778: CULLINAN | L778: ELMER | O778: DEATON | R778: NIXON
A779: GOALKICKERS
A780: SUNSHINE | C780: LITCHFIELD 20 | F780: WALSH 4 | H780: SCANLON 2 | K780: SHEPPERBOTTOM 2 | O780: QUINN 2 | Q780: HODGES | S780: D CADDAYE | V780: MITROVSKI
A781: MORDIALLOC | C781: WATTERS 4 | F781: EVANS 2 | I781: ELMER
A783: OAKLEIGH | C783: 3 | D783: 6 | E783: =C783*6+D783 -> 24 | G783: 6 | H783: 8 | I783: =G783*6+H783 -> 44 | K783: 11 | L783: 11 | M783: =K783*6+L783 -> 77 | O783: 12 | P783: 14 | Q783: =O783*6+P783 -> 86 | S783: WAVERLEY
A784: WAVERLEY | C784: 0 | D784: 0 | E784: =C784*6+D784 -> 0 | G784: 0 | H784: 2 | I784: =G784*6+H784 -> 2 | K784: 0 | L784: 5 | M784: =K784*6+L784 -> 5 | O784: 4 | P784: 5 | Q784: =O784*6+P784 -> 29 | S784: CUUREN/HULM
A785: BEST PLAYERS
A786: OAKLEIGH | C786: McDONALD | F786: TODD | I786: CUNNINGHAM | L786: OWEN | N786: SIMPSON | Q786: BAIN
A787: WAVERLEY | C787: McCORKELL | F787: HARRISON | I787: PEARSON | L787: KINNABURGH | O787: VEAR | Q787: LYNCH
A788: GOALKICKERS
A789: OAKLEIGH | C789: PRETTO 6 | F789: OWEN 3 | I789: CUNNINGHAM | L789: SIMPSON | N789: ALDRIDGE
A790: WAVERLEY | C790: CASTILLO 2 | F790: VEAR | I790: LYNCH
A792: ROUND 15 | E792: 3RD AUGUST | J792: WEATHER | S792: PLAYED AT
D793: 1ST QTR | H793: 2ND QTR | L793: 3RD QTR | P793: FINAL | S793: MORDIALLOC
A794: CAULFIELD | C794: 5 | D794: 5 | E794: =C794*6+D794 -> 35 | G794: 10 | H794: 8 | I794: =G794*6+H794 -> 68 | K794: 18 | L794: 15 | M794: =K794*6+L794 -> 123 | O794: 25 | P794: 19 | Q794: =O794*6+P794 -> 169 | S794: UMPIRE | X794: LADDER | AB794: ROUND | AD794: 15
A795: MORDIALLOC | C795: 1 | D795: 3 | E795: =C795*6+D795 -> 9 | G795: 5 | H795: 9 | I795: =G795*6+H795 -> 39 | K795: 8 | L795: 10 | M795: =K795*6+L795 -> 58 | O795: 12 | P795: 12 | Q795: =O795*6+P795 -> 84 | S795: HUTCHINSON/MORGAN
A796: BEST PLAYERS | W796: TEAM | X796: W | Y796: L | Z796: D | AA796: FOR | AB796: AGST | AC796: % | AD796: PTS
A797: CAULFIELD | C797: HAIDIMOUS | F797: HARRISON | I797: GODAU | L797: MILLS | N797: LARKIN | Q797: LEWIS
A798: MORDIALLOC | C798: M DEATON | F798: EVANS | I798: MALONEY | L798: ELMER | N798: DIXON | W798: SUNSHINE | X798: 13 | Y798: 2 | Z798: 0 | AA798: 1966 | AB798: 1097 | AC798: =(AA798*100)/AB798 -> 179.21604375569737 | AD798: =(X798*4)+(Z798*2) -> 52
A799: GOALKICKERS | W799: BOX HILL | X799: 12 | Y799: 3 | Z799: 0 | AA799: 2126 | AB799: 1125 | AC799: =(AA799*100)/AB799 -> 188.97777777777779 | AD799: =(X799*4)+(Z799*2) -> 48
A800: CAULFIELD | C800: GODAU 6 | F800: HARTSON 6 | I800: RENDELL 5 | K800: MILLS 4 | M800: O'KEEFE 2 | O800: HEMSTRON | R800: SANDERS | W800: OAKLEIGH | X800: 12 | Y800: 3 | Z800: 0 | AA800: 1963 | AB800: 1093 | AC800: =(AA800*100)/AB800 -> 179.59743824336687 | AD800: =(X800*4)+(Z800*2) -> 48
A801: MORDIALLOC | C801: M DEATON 4 | F801: WATTERS 2 | I801: WATSON | K801: COOMBS | M801: K EVANS | O801: P EVANS | Q801: ROSEWARNE | T801: ELMER | W801: PRAHRAN | X801: 12 | Y801: 3 | Z801: 0 | AA801: 1886 | AB801: 1304 | AC801: =(AA801*100)/AB801 -> 144.6319018404908 | AD801: =(X801*4)+(Z801*2) -> 48
A803: WERRIBEE | C803: 4 | D803: 3 | E803: =C803*6+D803 -> 27 | G803: 8 | H803: 6 | I803: =G803*6+H803 -> 54 | K803: 10 | L803: 8 | M803: =K803*6+L803 -> 68 | O803: 11 | P803: 11 | Q803: =O803*6+P803 -> 77 | S803: WERRIBEE | W803: DANDENONG | X803: 10 | Y803: 5 | Z803: 0 | AA803: 1446 | AB803: 1163 | AC803: =(AA803*100)/AB803 -> 124.33361994840929 | AD803: =(X803*4)+(Z803*2) -> 40
A804: MOORABBIN | C804: 0 | D804: 5 | E804: =C804*6+D804 -> 5 | G804: 3 | H804: 8 | I804: =G804*6+H804 -> 26 | K804: 4 | L804: 11 | M804: =K804*6+L804 -> 35 | O804: 9 | P804: 13 | Q804: =O804*6+P804 -> 67 | S804: CARUSO | W804: WAVERLEY | X804: 8 | Y804: 7 | Z804: 0 | AA804: 1683 | AB804: 1435 | AC804: =(AA804*100)/AB804 -> 117.28222996515679 | AD804: =(X804*4)+(Z804*2) -> 32
A805: BEST PLAYERS | S805: CHEERY | W805: CAULFIELD | X805: 7 | Y805: 8 | Z805: 0 | AA805: 1677 | AB805: 1714 | AC805: =(AA805*100)/AB805 -> 97.841306884480744 | AD805: =(X805*4)+(Z805*2) -> 28
A806: WERRIBEE | C806: DUNSTAN | F806: GREY | I806: SMITH | L806: BONAT | N806: ROGOZIK | Q806: HOPKINS | W806: MOORABBIN | X806: 7 | Y806: 8 | Z806: 0 | AA806: 1339 | AB806: 1430 | AC806: =(AA806*100)/AB806 -> 93.63636363636364 | AD806: =(X806*4)+(Z806*2) -> 28
A807: MOORABBIN | C807: HALE | F807: BROOKS | I807: LETT | L807: B CATHCART | O807: BOUKER | W807: WERRIBEE | X807: 6 | Y807: 9 | Z807: 0 | AA807: 1432 | AB807: 1448 | AC807: =(AA807*100)/AB807 -> 98.895027624309392 | AD807: =(X807*4)+(Z807*2) -> 24
A808: GOALKICKERS | W808: BERWICK | X808: 2 | Y808: 13 | Z808: 0 | AA808: 1148 | AB808: 2183 | AC808: =(AA808*100)/AB808 -> 52.588181401740727 | AD808: =(X808*4)+(Z808*2) -> 8
A809: WERRIBEE | C809: B MOLONEY 4 | F809: DUNSTAN 3 | I809: HOPKINS 3 | L809: BONAT | W809: NORTHCOTE | X809: 1 | Y809: 14 | Z809: 0 | AA809: 1265 | AB809: 2189 | AC809: =(AA809*100)/AB809 -> 57.788944723618087 | AD809: =(X809*4)+(Z809*2) -> 4
A810: MOORABBIN | C810: B CATHCART 2 | F810: BOUKER | H810: KNIGHT | J810: LONIE | L810: D CATHCART | O810: MERCOULIA | R810: O'TOOLE | T810: BROOKS | W810: MORDIALLOC | X810: 0 | Y810: 15 | Z810: 0 | AA810: 888 | AB810: 2615 | AC810: =(AA810*100)/AB810 -> 33.957934990439767 | AD810: =(X810*4)+(Z810*2) -> 0
A812: PRAHRAN | C812: 5 | D812: 2 | E812: =C812*6+D812 -> 32 | G812: 11 | H812: 4 | I812: =G812*6+H812 -> 70 | K812: 14 | L812: 8 | M812: =K812*6+L812 -> 92 | O812: 21 | P812: 15 | Q812: =O812*6+P812 -> 141 | S812: TOORAK PARK
A813: BOX HILL | C813: 3 | D813: 8 | E813: =C813*6+D813 -> 26 | G813: 4 | H813: 13 | I813: =G813*6+H813 -> 37 | K813: 8 | L813: 15 | M813: =K813*6+L813 -> 63 | O813: 9 | P813: 17 | Q813: =O813*6+P813 -> 71 | S813: BREWER/RYAN
A814: BEST PLAYERS
A815: PRAHRAN | C815: DURNAN | F815: BATT | I815: EASON | L815: GILES | N815: STYNES | Q815: HUTCHISON
A816: BOX HILL | C816: CUFF | F816: MURRIE | I816: SHERIDAN | L816: BOURKE | N816: DWYER | Q816: BROWN
A817: GOALKICKERS
A818: PRAHRAN | C818: BINGHAM 6 | F818: STYNES 4 | I818: COOK 3 | K818: LOWE 3 | M818: HUTCHISON 2 | P818: GILES | R818: WALDER | U818: PHILLIPS
A819: BOX HILL | C819: DWYER 3 | F819: WITHERS 3 | I819: P BOLTON 2 | L819: TRESSIDER
A821: DANDENONG | C821: 5 | D821: 5 | E821: =C821*6+D821 -> 35 | G821: 9 | H821: 7 | I821: =G821*6+H821 -> 61 | K821: 18 | L821: 10 | M821: =K821*6+L821 -> 118 | O821: 22 | P821: 12 | Q821: =O821*6+P821 -> 144 | S821: BERWICK
A822: BERWICK | C822: 3 | D822: 1 | E822: =C822*6+D822 -> 19 | G822: 7 | H822: 2 | I822: =G822*6+H822 -> 44 | K822: 7 | L822: 4 | M822: =K822*6+L822 -> 46 | O822: 9 | P822: 8 | Q822: =O822*6+P822 -> 62 | S822: NOLAN/CURREN
A823: BEST PLAYERS
A824: DANDENONG | C824: DARREN HALL | F824: MERRIGAN | I824: TUFO | L824: COUSINS | O824: FINN | R824: LINDSAY
A825: BERWICK | C825: SCOTT | F825: MANNENS | I825: T DEVINE | L825: S JOHNSON | O825: M JOHNSON | R825: LUXFORD
A826: GOALKICKERS
A827: DANDENONG | C827: DARREN HALL 7 | G827: WRIGHT 6 | J827: CROCKER 4 | L827: BRADLEY 2 | N827: HICKEY 2 | P827: KNIGHT | R827: TUFO
A828: BERWICK | C828: PARK 3 | E828: M JOHNSON 2 | H828: KENNY 2 | J828: HARRISON | L828: VERSHUUR
A830: WAVERLEY | C830: 8 | D830: 6 | E830: =C830*6+D830 -> 54 | G830: 13 | H830: 13 | I830: =G830*6+H830 -> 91 | K830: 19 | L830: 14 | M830: =K830*6+L830 -> 128 | O830: 23 | P830: 23 | Q830: =O830*6+P830 -> 161 | S830: NORTHCOTE
A831: NORTHCOTE | C831: 6 | D831: 0 | E831: =C831*6+D831 -> 36 | G831: 8 | H831: 1 | I831: =G831*6+H831 -> 49 | K831: 10 | L831: 4 | M831: =K831*6+L831 -> 64 | O831: 12 | P831: 8 | Q831: =O831*6+P831 -> 80 | S831: BELL/SMITH
A832: BEST PLAYERS
A833: WAVERLEY | C833: ANDERSON | F833: HARRISON | I833: PEARSON | L833: KINNABURGH | O833: PALLOTTA | R833: EVANS
A834: NORTHCOTE | C834: SPAGNOLO | F834: ARMSTRONG | I834: SPROAT | L834: COURTS | O834: VENABLES | R834: VARVITSIOSIS
A835: GOALKICKERS
A836: WAVERLEY | C836: EVANS 6 | E836: ANDERSON 4 | H836: HARRISON 4 | K836: COLLA 3 | M836: SHAW 2 | O836: CSOTI | Q836: KINNABURGH | T836: PEARSON | W836: VEAR
A837: NORTHCOTE | C837: ARMSTRONG 5 | F837: COURTS 2 | I837: SMITH 2 | K837: CUTLER 2 | N837: CASTAGINI
A839: OAKLEIGH | C839: 2 | D839: 2 | E839: =C839*6+D839 -> 14 | G839: 6 | H839: 6 | I839: =G839*6+H839 -> 42 | K839: 9 | L839: 7 | M839: =K839*6+L839 -> 61 | O839: 15 | P839: 10 | Q839: =O839*6+P839 -> 100 | S839: OAKLEIGH
A840: SUNSHINE | C840: 4 | D840: 3 | E840: =C840*6+D840 -> 27 | G840: 7 | H840: 5 | I840: =G840*6+H840 -> 47 | K840: 9 | L840: 9 | M840: =K840*6+L840 -> 63 | O840: 11 | P840: 13 | Q840: =O840*6+P840 -> 79 | S840: BRADSHAW/PHILLIPS
A841: BEST PLAYERS
A842: OAKLEIGH | C842: CUNNINGHAM | F842: S ROACH | I842: CASPAR | L842: PRETTO | O842: McDONALD | R842: SUTHERLAND
A843: SUNSHINE | C843: CALDWELL | F843: MOSS | I843: BROWN | L843: MITROVSKI | O843: PROTETTO
A844: GOALKICKERS
A845: OAKLEIGH | C845: PRETTO 6 | F845: SUTHERLAND 3 | I845: C ROURKE | K845: SIMPSON | M845: EBEYER | O845: OWEN | Q845: JOHNSON | S845: HOWE
A846: SUNSHINE | C846: LITCHFIELD 3 | F846: MITROVSKI 2 | I846: BROWN 2 | K846: SCHICCITANO 2 | N846: QUINN | P846: HODGES
A848: ROUND 16 | E848: 10TH AUGUST | J848: WEATHER | S848: PLAYED AT
D849: 1ST QTR | H849: 2ND QTR | L849: 3RD QTR | P849: FINAL | S849: NORTHCOTE
A850: NORTHCOTE | C850: 5 | D850: 5 | E850: =C850*6+D850 -> 35 | G850: 11 | H850: 6 | I850: =G850*6+H850 -> 72 | K850: 12 | L850: 7 | M850: =K850*6+L850 -> 79 | O850: 19 | P850: 11 | Q850: =O850*6+P850 -> 125 | S850: UMPIRE | X850: LADDER | AB850: ROUND | AD850: 16
A851: BERWICK | C851: 3 | D851: 7 | E851: =C851*6+D851 -> 25 | G851: 8 | H851: 10 | I851: =G851*6+H851 -> 58 | K851: 11 | L851: 15 | M851: =K851*6+L851 -> 81 | O851: 16 | P851: 16 | Q851: =O851*6+P851 -> 112
A852: BEST PLAYERS | W852: TEAM | X852: W | Y852: L | Z852: D | AA852: FOR | AB852: AGST | AC852: % | AD852: PTS
A853: NORTHCOTE
A854: BERWICK | W854: SUNSHINE | X854: 14 | Y854: 2 | Z854: 0 | AA854: 2101 | AB854: 1202 | AC854: =(AA854*100)/AB854 -> 174.79201331114808 | AD854: =(X854*4)+(Z854*2) -> 56
A855: GOALKICKERS | W855: BOX HILL | X855: 13 | Y855: 3 | Z855: 0 | AA855: 2263 | AB855: 1204 | AC855: =(AA855*100)/AB855 -> 187.95681063122925 | AD855: =(X855*4)+(Z855*2) -> 52
A856: NORTHCOTE | W856: OAKLEIGH | X856: 13 | Y856: 3 | Z856: 0 | AA856: 2150 | AB856: 1185 | AC856: =(AA856*100)/AB856 -> 181.43459915611814 | AD856: =(X856*4)+(Z856*2) -> 52
A857: BERWICK | W857: PRAHRAN | X857: 13 | Y857: 3 | Z857: 0 | AA857: 2032 | AB857: 1381 | AC857: =(AA857*100)/AB857 -> 147.13975380159306 | AD857: =(X857*4)+(Z857*2) -> 52
A859: PRAHRAN | C859: 5 | D859: 2 | E859: =C859*6+D859 -> 32 | G859: 10 | H859: 6 | I859: =G859*6+H859 -> 66 | K859: 18 | L859: 12 | M859: =K859*6+L859 -> 120 | O859: 21 | P859: 20 | Q859: =O859*6+P859 -> 146 | S859: DANDENONG | W859: DANDENONG | X859: 10 | Y859: 6 | Z859: 0 | AA859: 1523 | AB859: 1309 | AC859: =(AA859*100)/AB859 -> 116.34835752482812 | AD859: =(X859*4)+(Z859*2) -> 40
A860: DANDENONG | C860: 2 | D860: 5 | E860: =C860*6+D860 -> 17 | G860: 5 | H860: 6 | I860: =G860*6+H860 -> 36 | K860: 8 | L860: 6 | M860: =K860*6+L860 -> 54 | O860: 11 | P860: 11 | Q860: =O860*6+P860 -> 77 | W860: WAVERLEY | X860: 8 | Y860: 8 | Z860: 0 | AA860: 1788 | AB860: 1570 | AC860: =(AA860*100)/AB860 -> 113.88535031847134 | AD860: =(X860*4)+(Z860*2) -> 32
A861: BEST PLAYERS | W861: MOORABBIN | X861: 8 | Y861: 8 | Z861: 0 | AA861: 1499 | AB861: 1532 | AC861: =(AA861*100)/AB861 -> 97.845953002610969 | AD861: =(X861*4)+(Z861*2) -> 32
A862: PRAHRAN | W862: CAULFIELD | X862: 7 | Y862: 9 | Z862: 0 | AA862: 1769 | AB862: 1901 | AC862: =(AA862*100)/AB862 -> 93.056286165176218 | AD862: =(X862*4)+(Z862*2) -> 28
A863: DANDENONG | W863: WERRIBEE | X863: 6 | Y863: 10 | Z863: 0 | AA863: 1511 | AB863: 1585 | AC863: =(AA863*100)/AB863 -> 95.331230283911665 | AD863: =(X863*4)+(Z863*2) -> 24
A864: GOALKICKERS | W864: NORTHCOTE | X864: 2 | Y864: 14 | Z864: 0 | AA864: 1390 | AB864: 2301 | AC864: =(AA864*100)/AB864 -> 60.408518035636682 | AD864: =(X864*4)+(Z864*2) -> 8
A865: PRAHRAN | W865: BERWICK | X865: 2 | Y865: 14 | Z865: 0 | AA865: 1260 | AB865: 2308 | AC865: =(AA865*100)/AB865 -> 54.592720970537265 | AD865: =(X865*4)+(Z865*2) -> 8
A866: DANDENONG | W866: MORDIALLOC | X866: 0 | Y866: 16 | Z866: 0 | AA866: 990 | AB866: 2775 | AC866: =(AA866*100)/AB866 -> 35.675675675675677 | AD866: =(X866*4)+(Z866*2) -> 0
A868: BOX HILL | C868: 6 | D868: 4 | E868: =C868*6+D868 -> 40 | G868: 8 | H868: 4 | I868: =G868*6+H868 -> 52 | K868: 14 | L868: 12 | M868: =K868*6+L868 -> 96 | O868: 20 | P868: 17 | Q868: =O868*6+P868 -> 137 | S868: BOX HILL
A869: WERRIBEE | C869: 3 | D869: 5 | E869: =C869*6+D869 -> 23 | G869: 6 | H869: 8 | I869: =G869*6+H869 -> 44 | K869: 7 | L869: 10 | M869: =K869*6+L869 -> 52 | O869: 11 | P869: 13 | Q869: =O869*6+P869 -> 79
A870: BEST PLAYERS
A871: BOX HILL
A872: WERRIBEE
A873: GOALKICKERS
A874: BOX HILL
A875: WERRIBEE
A877: MOORABBIN | C877: 4 | D877: 9 | E877: =C877*6+D877 -> 33 | G877: 11 | H877: 11 | I877: =G877*6+H877 -> 77 | K877: 20 | L877: 15 | M877: =K877*6+L877 -> 135 | O877: 23 | P877: 22 | Q877: =O877*6+P877 -> 160 | S877: BENTLEIGH
A878: MORDIALLOC | C878: 4 | D878: 3 | E878: =C878*6+D878 -> 27 | G878: 11 | H878: 8 | I878: =G878*6+H878 -> 74 | K878: 11 | L878: 12 | M878: =K878*6+L878 -> 78 | O878: 14 | P878: 18 | Q878: =O878*6+P878 -> 102
A879: BEST PLAYERS
A880: MOORABBIN
A881: MORDIALLOC
A882: GOALKICKERS
A883: MOORABBIN
A884: MORDIALLOC
A886: OAKLEIGH | C886: 6 | D886: 4 | E886: =C886*6+D886 -> 40 | G886: 12 | H886: 9 | I886: =G886*6+H886 -> 81 | K886: 22 | L886: 11 | M886: =K886*6+L886 -> 143 | O886: 29 | P886: 13 | Q886: =O886*6+P886 -> 187 | S886: PRINCES PARK, CAULFIELD
A887: CAULFIELD | C887: 6 | D887: 2 | E887: =C887*6+D887 -> 38 | G887: 8 | H887: 4 | I887: =G887*6+H887 -> 52 | K887: 11 | L887: 10 | M887: =K887*6+L887 -> 76 | O887: 13 | P887: 14 | Q887: =O887*6+P887 -> 92
A888: BEST PLAYERS
A889: OAKLEIGH
A890: CAULFIELD
A891: GOALKICKERS
A892: OAKLEIGH
A893: CAULFIELD
A895: SUNSHINE | C895: 5 | D895: 3 | E895: =C895*6+D895 -> 33 | G895: 8 | H895: 8 | I895: =G895*6+H895 -> 56 | K895: 15 | L895: 13 | M895: =K895*6+L895 -> 103 | O895: 19 | P895: 21 | Q895: =O895*6+P895 -> 135 | S895: WAVERLEY
A896: WAVERLEY | C896: 6 | D896: 0 | E896: =C896*6+D896 -> 36 | G896: 10 | H896: 3 | I896: =G896*6+H896 -> 63 | K896: 12 | L896: 7 | M896: =K896*6+L896 -> 79 | O896: 16 | P896: 9 | Q896: =O896*6+P896 -> 105
A897: BEST PLAYERS
A898: SUNSHINE
A899: WAVERLEY
A900: GOALKICKERS
A901: SUNSHINE
A902: WAVERLEY
A904: ROUND 17 | E904: 17TH AUGUST | J904: WEATHER | S904: PLAYED AT
D905: 1ST QTR | H905: 2ND QTR | L905: 3RD QTR | P905: FINAL | S905: MORDIALLOC
A906: BOX HILL | C906: 10 | D906: 2 | E906: =C906*6+D906 -> 62 | G906: 18 | H906: 5 | I906: =G906*6+H906 -> 113 | K906: 26 | L906: 7 | M906: =K906*6+L906 -> 163 | O906: 33 | P906: 12 | Q906: =O906*6+P906 -> 210 | S906: UMPIRE | X906: LADDER | AB906: ROUND | AD906: 17
A907: MORDIALLOC | C907: 0 | D907: 3 | E907: =C907*6+D907 -> 3 | G907: 3 | H907: 4 | I907: =G907*6+H907 -> 22 | K907: 3 | L907: 5 | M907: =K907*6+L907 -> 23 | O907: 4 | P907: 7 | Q907: =O907*6+P907 -> 31
A908: BEST PLAYERS | W908: TEAM | X908: W | Y908: L | Z908: D | AA908: FOR | AB908: AGST | AC908: % | AD908: PTS
A909: BOX HILL
A910: MORDIALLOC | W910: SUNSHINE | X910: 15 | Y910: 2 | Z910: 0 | AA910: 2235 | AB910: 1256 | AC910: =(AA910*100)/AB910 -> 177.94585987261146 | AD910: =(X910*4)+(Z910*2) -> 60
A911: GOALKICKERS | W911: BOX HILL | X911: 14 | Y911: 3 | Z911: 0 | AA911: 2473 | AB911: 1235 | AC911: =(AA911*100)/AB911 -> 200.24291497975707 | AD911: =(X911*4)+(Z911*2) -> 56
A912: BOX HILL | W912: OAKLEIGH | X912: 14 | Y912: 3 | Z912: 0 | AA912: 2311 | AB912: 1238 | AC912: =(AA912*100)/AB912 -> 186.67205169628434 | AD912: =(X912*4)+(Z912*2) -> 56
A913: MORDIALLOC | W913: PRAHRAN | X913: 14 | Y913: 3 | Z913: 0 | AA913: 2270 | AB913: 1392 | AC913: =(AA913*100)/AB913 -> 163.07471264367817 | AD913: =(X913*4)+(Z913*2) -> 56
A915: WERRIBEE | C915: 2 | D915: 4 | E915: =C915*6+D915 -> 16 | G915: 6 | H915: 8 | I915: =G915*6+H915 -> 44 | K915: 6 | L915: 9 | M915: =K915*6+L915 -> 45 | O915: 7 | P915: 11 | Q915: =O915*6+P915 -> 53 | S915: WERRIBEE | W915: DANDENONG | X915: 10 | Y915: 7 | Z915: 0 | AA915: 1568 | AB915: 1362 | AC915: =(AA915*100)/AB915 -> 115.12481644640235 | AD915: =(X915*4)+(Z915*2) -> 40
A916: DANDENONG | C916: 3 | D916: 4 | E916: =C916*6+D916 -> 22 | G916: 5 | H916: 6 | I916: =G916*6+H916 -> 36 | K916: 6 | L916: 6 | M916: =K916*6+L916 -> 42 | O916: 6 | P916: 9 | Q916: =O916*6+P916 -> 45 | W916: WAVERLEY | X916: 9 | Y916: 8 | Z916: 0 | AA916: 1933 | AB916: 1601 | AC916: =(AA916*100)/AB916 -> 120.73703935040599 | AD916: =(X916*4)+(Z916*2) -> 36
A917: BEST PLAYERS | W917: MOORABBIN | X917: 8 | Y917: 9 | Z917: 0 | AA917: 1552 | AB917: 1693 | AC917: =(AA917*100)/AB917 -> 91.671588895451862 | AD917: =(X917*4)+(Z917*2) -> 32
A918: WERRIBEE | W918: WERRIBEE | X918: 7 | Y918: 10 | Z918: 0 | AA918: 1564 | AB918: 1630 | AC918: =(AA918*100)/AB918 -> 95.950920245398777 | AD918: =(X918*4)+(Z918*2) -> 28
A919: DANDENONG | W919: CAULFIELD | X919: 7 | Y919: 10 | Z919: 0 | AA919: 1823 | AB919: 2046 | AC919: =(AA919*100)/AB919 -> 89.100684261974578 | AD919: =(X919*4)+(Z919*2) -> 28
A920: GOALKICKERS | W920: NORTHCOTE | X920: 2 | Y920: 15 | Z920: 0 | AA920: 1401 | AB920: 2539 | AC920: =(AA920*100)/AB920 -> 55.179204411185509 | AD920: =(X920*4)+(Z920*2) -> 8
A921: WERRIBEE | W921: BERWICK | X921: 2 | Y921: 15 | Z921: 0 | AA921: 1291 | AB921: 2453 | AC921: =(AA921*100)/AB921 -> 52.629433346922134 | AD921: =(X921*4)+(Z921*2) -> 8
A922: DANDENONG | W922: MORDIALLOC | X922: 0 | Y922: 17 | Z922: 0 | AA922: 1021 | AB922: 2985 | AC922: =(AA922*100)/AB922 -> 34.204355108877721 | AD922: =(X922*4)+(Z922*2) -> 0
A924: PRAHRAN | C924: 14 | D924: 4 | E924: =C924*6+D924 -> 88 | G924: 21 | H924: 12 | I924: =G924*6+H924 -> 138 | K924: 29 | L924: 18 | M924: =K924*6+L924 -> 192 | O924: 36 | P924: 22 | Q924: =O924*6+P924 -> 238 | S924: TOORAK PARK
A925: NORTHCOTE | C925: 0 | D925: 0 | E925: =C925*6+D925 -> 0 | G925: 0 | H925: 3 | I925: =G925*6+H925 -> 3 | K925: 1 | L925: 5 | M925: =K925*6+L925 -> 11 | O925: 1 | P925: 5 | Q925: =O925*6+P925 -> 11
A926: BEST PLAYERS
A927: PRAHRAN
A928: NORTHCOTE
A929: GOALKICKERS
A930: PRAHRAN
A931: NORTHCOTE
A933: WAVERLEY | C933: 7 | D933: 2 | E933: =C933*6+D933 -> 44 | G933: 13 | H933: 7 | I933: =G933*6+H933 -> 85 | K933: 16 | L933: 8 | M933: =K933*6+L933 -> 104 | O933: 22 | P933: 13 | Q933: =O933*6+P933 -> 145 | S933: BERWICK
A934: BERWICK | C934: 0 | D934: 0 | E934: =C934*6+D934 -> 0 | G934: 0 | H934: 4 | I934: =G934*6+H934 -> 4 | K934: 3 | L934: 6 | M934: =K934*6+L934 -> 24 | O934: 4 | P934: 7 | Q934: =O934*6+P934 -> 31
A935: BEST PLAYERS
A936: WAVERLEY
A937: BERWICK
A938: GOALKICKERS
A939: WAVERLEY
A940: BERWICK
A942: SUNSHINE | C942: 0 | D942: 4 | E942: =C942*6+D942 -> 4 | G942: 5 | H942: 5 | I942: =G942*6+H942 -> 35 | K942: 7 | L942: 10 | M942: =K942*6+L942 -> 52 | O942: 20 | P942: 14 | Q942: =O942*6+P942 -> 134 | S942: SUNSHINE
A943: CAULFIELD | C943: 2 | D943: 6 | E943: =C943*6+D943 -> 18 | G943: 4 | H943: 9 | I943: =G943*6+H943 -> 33 | K943: 6 | L943: 12 | M943: =K943*6+L943 -> 48 | O943: 7 | P943: 12 | Q943: =O943*6+P943 -> 54
A944: BEST PLAYERS
A945: SUNSHINE
A946: CAULFIELD
A947: GOALKICKERS
A948: SUNSHINE
A949: CAULFIELD
A951: OAKLEIGH | C951: 5 | D951: 3 | E951: =C951*6+D951 -> 33 | G951: 9 | H951: 8 | I951: =G951*6+H951 -> 62 | K951: 19 | L951: 12 | M951: =K951*6+L951 -> 126 | O951: 24 | P951: 17 | Q951: =O951*6+P951 -> 161 | S951: OAKLEIGH
A952: MOORABBIN | C952: 5 | D952: 2 | E952: =C952*6+D952 -> 32 | G952: 7 | H952: 4 | I952: =G952*6+H952 -> 46 | K952: 8 | L952: 4 | M952: =K952*6+L952 -> 52 | O952: 8 | P952: 5 | Q952: =O952*6+P952 -> 53
A953: BEST PLAYERS
A954: OAKLEIGH
A955: MOORABBIN
A956: GOALKICKERS
A957: OAKLEIGH
A958: MOORABBIN
A960: ROUND 18 | E960: 24TH AUGUST | J960: WEATHER | S960: PLAYED AT
D961: 1ST QTR | H961: 2ND QTR | L961: 3RD QTR | P961: FINAL | S961: BERWICK
A962: PRAHRAN | C962: 8 | D962: 1 | E962: =C962*6+D962 -> 49 | G962: 10 | H962: 4 | I962: =G962*6+H962 -> 64 | K962: 19 | L962: 14 | M962: =K962*6+L962 -> 128 | O962: 19 | P962: 18 | Q962: =O962*6+P962 -> 132 | S962: UMPIRE | X962: LADDER | AB962: ROUND | AD962: 18
A963: BERWICK | C963: 0 | D963: 3 | E963: =C963*6+D963 -> 3 | G963: 2 | H963: 8 | I963: =G963*6+H963 -> 20 | K963: 2 | L963: 8 | M963: =K963*6+L963 -> 20 | O963: 4 | P963: 11 | Q963: =O963*6+P963 -> 35 | S963: BULLOCK/BRADSHAW
A964: BEST PLAYERS | W964: TEAM | X964: W | Y964: L | Z964: D | AA964: FOR | AB964: AGST | AC964: % | AD964: PTS
A965: PRAHRAN | C965: LOWE | F965: ELLETT | I965: PHILLIPS | L965: WALLACE | O965: BATT | Q965: HUTCHISON
A966: BERWICK | C966: DEVINE | F966: SCOTT | I966: HIPWORTH | L966: ORSBORNE | O966: MANNENS | W966: SUNSHINE | X966: 16 | Y966: 2 | Z966: 0 | AA966: 2281 | AB966: 1298 | AC966: =(AA966*100)/AB966 -> 175.73189522342065 | AD966: =(X966*4)+(Z966*2) -> 64
A967: GOALKICKERS | W967: BOX HILL | X967: 15 | Y967: 3 | Z967: 0 | AA967: 2543 | AB967: 1302 | AC967: =(AA967*100)/AB967 -> 195.31490015360984 | AD967: =(X967*4)+(Z967*2) -> 60
A968: PRAHRAN | C968: LOWE 7 | E968: GILES 2 | G968: BINGHAM 2 | J968: TAYLOR 2 | L968: COOK 2 | N968: ELLIS | P968: HINES | R968: PHILLIPS | T968: MILLS | W968: OAKLEIGH | X968: 14 | Y968: 4 | Z968: 0 | AA968: 2378 | AB968: 1308 | AC968: =(AA968*100)/AB968 -> 181.80428134556576 | AD968: =(X968*4)+(Z968*2) -> 56
A969: BERWICK | C969: TRIGG 2 | F969: HIPWORTH | I969: PARK | W969: PRAHRAN | X969: 15 | Y969: 3 | Z969: 0 | AA969: 2402 | AB969: 1427 | AC969: =(AA969*100)/AB969 -> 168.3251576734408 | AD969: =(X969*4)+(Z969*2) -> 60
W970: DANDENONG | X970: 11 | Y970: 7 | Z970: 0 | AA970: 1718 | AB970: 1407 | AC970: =(AA970*100)/AB970 -> 122.10376687988628 | AD970: =(X970*4)+(Z970*2) -> 44
A971: WERRIBEE | C971: 3 | D971: 7 | E971: =C971*6+D971 -> 25 | G971: 6 | H971: 9 | I971: =G971*6+H971 -> 45 | K971: 7 | L971: 11 | M971: =K971*6+L971 -> 53 | O971: 9 | P971: 12 | Q971: =O971*6+P971 -> 66 | S971: NORTHCOTE | W971: WAVERLEY | X971: 10 | Y971: 8 | Z971: 0 | AA971: 2077 | AB971: 1639 | AC971: =(AA971*100)/AB971 -> 126.72361195851128 | AD971: =(X971*4)+(Z971*2) -> 40
A972: NORTHCOTE | C972: 1 | D972: 3 | E972: =C972*6+D972 -> 9 | G972: 2 | H972: 6 | I972: =G972*6+H972 -> 18 | K972: 5 | L972: 8 | M972: =K972*6+L972 -> 38 | O972: 9 | P972: 11 | Q972: =O972*6+P972 -> 65 | S972: TORNEY | W972: MOORABBIN | X972: 8 | Y972: 10 | Z972: 0 | AA972: 1594 | AB972: 1739 | AC972: =(AA972*100)/AB972 -> 91.661874640598043 | AD972: =(X972*4)+(Z972*2) -> 32
A973: BEST PLAYERS | S973: GLEESON | W973: WERRIBEE | X973: 8 | Y973: 10 | Z973: 0 | AA973: 1630 | AB973: 1695 | AC973: =(AA973*100)/AB973 -> 96.165191740412979 | AD973: =(X973*4)+(Z973*2) -> 32
A974: WERRIBEE | C974: WALPOLE | G974: HOPKINS | J974: BONAT | L974: SMITH | N974: ROGOZIK | Q974: BUCKINGHAM | W974: CAULFIELD | X974: 7 | Y974: 11 | Z974: 0 | AA974: 1861 | AB974: 2190 | AC974: =(AA974*100)/AB974 -> 84.977168949771695 | AD974: =(X974*4)+(Z974*2) -> 28
A975: NORTHCOTE | C975: ARMSTRONG | G975: STRANGWICK | J975: SPROAT | W975: NORTHCOTE | X975: 2 | Y975: 16 | Z975: 0 | AA975: 1466 | AB975: 2605 | AC975: =(AA975*100)/AB975 -> 56.276391554702492 | AD975: =(X975*4)+(Z975*2) -> 8
A976: GOALKICKERS | W976: BERWICK | X976: 2 | Y976: 16 | Z976: 0 | AA976: 1326 | AB976: 2585 | AC976: =(AA976*100)/AB976 -> 51.295938104448744 | AD976: =(X976*4)+(Z976*2) -> 8
A977: WERRIBEE | C977: B MOLONEY 3 | F977: HOPKINS 2 | I977: GIBB | J977: WALPOLE | L977: BUCKINGHAM | O977: BONAT | W977: MORDIALLOC | X977: 0 | Y977: 18 | Z977: 0 | AA977: 1066 | AB977: 3135 | AC977: =(AA977*100)/AB977 -> 34.003189792663477 | AD977: =(X977*4)+(Z977*2) -> 0
A978: NORTHCOTE | C978: STRANGWICK 3 | F978: ARMSTRONG 2 | I978: VARVUTSIOSIS | L978: SALEM | N978: SMITH | P978: SCOTT
A980: DANDENONG | C980: 5 | D980: 3 | E980: =C980*6+D980 -> 33 | G980: 12 | H980: 8 | I980: =G980*6+H980 -> 80 | K980: 14 | L980: 13 | M980: =K980*6+L980 -> 97 | O980: 22 | P980: 18 | Q980: =O980*6+P980 -> 150 | S980: DANDENONG
A981: MORDIALLOC | C981: 2 | D981: 4 | E981: =C981*6+D981 -> 16 | G981: 4 | H981: 6 | I981: =G981*6+H981 -> 30 | K981: 6 | L981: 7 | M981: =K981*6+L981 -> 43 | O981: 6 | P981: 9 | Q981: =O981*6+P981 -> 45 | S981: ANASTASI/COOKE
A982: BEST PLAYERS
A983: DANDENONG | C983: LAMBERT | F983: PALLANT | I983: LINDSAY | L983: WRIGHT | O983: OMAN | R983: TUFO
A984: MORDIALLOC | C984: WALSH | F984: DEATON | I984: MASON | L984: HOFFMAN | O984: CULLINAN | R984: P EVANS
A985: GOALKICKERS
A986: DANDENONG | C986: WRIGHT 10 | F986: DARREN HALL 4 | I986: OMAN 2 | K986: PALLANT 2 | N986: LINDSAY | P986: HICKEY | R986: FINN | S986: TUFO
A987: MORDIALLOC | C987: HOFFMAN 2 | F987: DEATON | I987: P EVANS | K987: T EVANS | N987: BROMLEY
A989: BOX HILL | C989: 3 | D989: 4 | E989: =C989*6+D989 -> 22 | G989: 6 | H989: 5 | I989: =G989*6+H989 -> 41 | K989: 6 | L989: 9 | M989: =K989*6+L989 -> 45 | O989: 10 | P989: 10 | Q989: =O989*6+P989 -> 70 | S989: BOX HILL
A990: OAKLEIGH | C990: 3 | D990: 1 | E990: =C990*6+D990 -> 19 | G990: 6 | H990: 5 | I990: =G990*6+H990 -> 41 | K990: 8 | L990: 5 | M990: =K990*6+L990 -> 53 | O990: 10 | P990: 7 | Q990: =O990*6+P990 -> 67 | S990: BLACK/COOK
A991: BEST PLAYERS
A992: BOX HILL | C992: COLLINS | F992: O'SHEA | I992: MURNE | L992: WITNISH | O992: SHERIDAN | R992: BOURKE
A993: OAKLEIGH | C993: THOMPSON | F993: OWEN | I993: S ROACH | L993: TODD | O993: CASPAR | R993: BAIN
A994: GOALKICKERS
A995: BOX HILL | C995: NICHOLSON 3 | F995: GLEESON 2 | I995: DWYER | K995: McGHEE | M995: RAYMOND | P995: SHERIDAN | R995: WITHERS
A996: OAKLEIGH | C996: PRETTO 5 | F996: S ROACH | I996: ATHERTON | L996: OWEN | N996: SIMPSON | Q996: SULLIVAN
A998: SUNSHINE | C998: 1 | D998: 3 | E998: =C998*6+D998 -> 9 | G998: 4 | H998: 7 | I998: =G998*6+H998 -> 31 | K998: 6 | L998: 9 | M998: =K998*6+L998 -> 45 | O998: 6 | P998: 10 | Q998: =O998*6+P998 -> 46 | S998: BENTLEIGH
A999: MOORABBIN | C999: 0 | D999: 5 | E999: =C999*6+D999 -> 5 | G999: 1 | H999: 9 | I999: =G999*6+H999 -> 15 | K999: 3 | L999: 12 | M999: =K999*6+L999 -> 30 | O999: 5 | P999: 12 | Q999: =O999*6+P999 -> 42 | S999: BREWER/WARD
A1000: BEST PLAYERS
A1001: SUNSHINE | C1001: MENADUE | F1001: SHEPPERBOTTOM | J1001: D CADDAYE | M1001: MOSS | O1001: CALDWELL | R1001: QUINN
A1002: MOORABBIN | C1002: REVERE | F1002: B CATHCART | J1002: POLLOCK | M1002: GILMORE | O1002: STEWART | R1002: BAKER
A1003: GOALKICKERS
A1004: SUNSHINE | C1004: SCHICCITANO 2 | G1004: LITCHFIELD 2 | J1004: PROTETTO | M1004: WALSH
A1005: MOORABBIN | C1005: B CATHCART 2 | G1005: STEWART | J1005: O'TOOLE | L1005: LETT
A1007: WAVERLEY | C1007: 3 | D1007: 3 | E1007: =C1007*6+D1007 -> 21 | G1007: 7 | H1007: 9 | I1007: =G1007*6+H1007 -> 51 | K1007: 17 | L1007: 13 | M1007: =K1007*6+L1007 -> 115 | O1007: 21 | P1007: 18 | Q1007: =O1007*6+P1007 -> 144 | S1007: WAVERLEY
A1008: CAULFIELD | C1008: 0 | D1008: 3 | E1008: =C1008*6+D1008 -> 3 | G1008: 3 | H1008: 3 | I1008: =G1008*6+H1008 -> 21 | K1008: 3 | L1008: 4 | M1008: =K1008*6+L1008 -> 22 | O1008: 5 | P1008: 8 | Q1008: =O1008*6+P1008 -> 38 | S1008: GLEESON/MORGAN
A1009: BEST PLAYERS
A1010: WAVERLEY | C1010: KINNABURGH | F1010: SHAW | I1010: PEARSON | L1010: PALLOTTA | O1010: LE PAIR | R1010: HARRISON
A1011: CAULFIELD | C1011: FAWCETT | F1011: EINSEDEL | I1011: HARTSON | L1011: REID | O1011: FARINSKI
A1012: GOALKICKERS
A1013: WAVERLEY | C1013: HOWELL 4 | F1013: GREEN 3 | H1013: HARRISON 3 | K1013: HOGAN 2 | M1013: KINNABURGH 2 | P1013: VEAR 2 | R1013: EVANS 2 | T1013: NEWBOULD | W1013: PEARSON | X1013: POLA
A1014: CAULFIELD | C1014: REID 2 | E1014: FARINSKI | H1014: GODAU | J1014: BYRDEN
A1016: FINALS
A1017: 1ST SEMI | E1017: 31ST AUGUST | J1017: WEATHER | S1017: PLAYED AT
D1018: 1ST QTR | H1018: 2ND QTR | L1018: 3RD QTR | P1018: FINAL | S1018: JUNCTION OVAL
A1019: PRAHRAN | C1019: 5 | D1019: 3 | E1019: =C1019*6+D1019 -> 33 | G1019: 10 | H1019: 7 | I1019: =G1019*6+H1019 -> 67 | K1019: 17 | L1019: 10 | M1019: =K1019*6+L1019 -> 112 | O1019: 21 | P1019: 14 | Q1019: =O1019*6+P1019 -> 140 | S1019: UMPIRE
A1020: OAKLEIGH | C1020: 1 | D1020: 5 | E1020: =C1020*6+D1020 -> 11 | G1020: 7 | H1020: 8 | I1020: =G1020*6+H1020 -> 50 | K1020: 7 | L1020: 13 | M1020: =K1020*6+L1020 -> 55 | O1020: 13 | P1020: 18 | Q1020: =O1020*6+P1020 -> 96 | S1020: CASEY/NOLAN | W1020: CASEY REPLACED BY RYAN 1/4 TIME
A1021: BEST PLAYERS
A1022: PRAHRAN | C1022: STYNES | F1022: TAPPING | I1022: DURNAN | L1022: FIELDING | O1022: TAYLOR | R1022: BATT
A1023: OAKLEIGH | C1023: McDONALD | F1023: THOMPSON | I1023: WALSH | L1023: ROACH | O1023: SIMPSON | R1023: ATHERTON
A1024: GOALKICKERS
A1025: PRAHRAN | C1025: COOK 3 | E1025: GILES 3 | G1025: BINGHAM 2 | J1025: TAYLOR 2 | L1025: WALLACE 2 | O1025: MILLS 2 | Q1025: LOWE 2 | S1025: TAPPING 2 | V1025: PHILLIPS 2 | X1025: WALDER | Z1025: EASON
A1026: OAKLEIGH | C1026: PRETTO 5 | F1026: BROWN 2 | H1026: SIMPSON 2 | K1026: HOWE 2 | M1026: TODD | O1026: SUTHERLAND
A1028: 2ND SEMI | E1028: 2ND SEPTEMBER | J1028: WEATHER
A1029: BOX HILL | C1029: 6 | D1029: 3 | E1029: =C1029*6+D1029 -> 39 | G1029: 8 | H1029: 7 | I1029: =G1029*6+H1029 -> 55 | K1029: 12 | L1029: 11 | M1029: =K1029*6+L1029 -> 83 | O1029: 14 | P1029: 17 | Q1029: =O1029*6+P1029 -> 101 | S1029: JUNCTION OVAL
A1030: SUNSHINE | C1030: 1 | D1030: 3 | E1030: =C1030*6+D1030 -> 9 | G1030: 4 | H1030: 5 | I1030: =G1030*6+H1030 -> 29 | K1030: 7 | L1030: 8 | M1030: =K1030*6+L1030 -> 50 | O1030: 9 | P1030: 13 | Q1030: =O1030*6+P1030 -> 67 | S1030: MCDONALD/COOKE
A1031: BEST PLAYERS
A1032: BOX HILL | C1032: MURRIE | G1032: NICHOLSON | J1032: BOURKE | M1032: CUFF | O1032: O'SHEA | R1032: P WITNISH
A1033: SUNSHINE | C1033: SHEPPERBOTTOM | G1033: MENADUE | J1033: MITROVSKI | M1033: BROWN | O1033: McQUALTER
A1034: GOALKICKERS
A1035: BOX HILL | C1035: GARTH 4 | F1035: WITHERS 3 | I1035: L BOLTON 2 | L1035: NICHOLSON 2 | O1035: DWYER | Q1035: CUFF | S1035: O'SHEA
A1036: SUNSHINE | C1036: LITCHFIELD 3 | F1036: SHAPPERBOTTOM 2 | J1036: MITROVSKI | M1036: McQUALTER | P1036: MOSS | R1036: WALSH
A1038: PRELIMINARY | E1038: 9TH SEPTEMBER | J1038: WEATHER
A1039: SUNSHINE | C1039: 1 | D1039: 5 | E1039: =C1039*6+D1039 -> 11 | G1039: 6 | H1039: 12 | I1039: =G1039*6+H1039 -> 48 | K1039: 12 | L1039: 13 | M1039: =K1039*6+L1039 -> 85 | O1039: 16 | P1039: 16 | Q1039: =O1039*6+P1039 -> 112 | S1039: JUNCTION OVAL
A1040: PRAHRAN | C1040: 5 | D1040: 1 | E1040: =C1040*6+D1040 -> 31 | G1040: 11 | H1040: 4 | I1040: =G1040*6+H1040 -> 70 | K1040: 13 | L1040: 5 | M1040: =K1040*6+L1040 -> 83 | O1040: 17 | P1040: 7 | Q1040: =O1040*6+P1040 -> 109 | S1040: MARCY/RYAN
A1041: BEST PLAYERS
A1042: SUNSHINE | C1042: PROTETTO | F1042: WAGLAND | I1042: MOSS | L1042: QUINN | N1042: LITCHFIELD | Q1042: NELSON
A1043: PRAHRAN | C1043: STYNES | F1043: COOK | I1043: WALLACE | L1043: EASON | N1043: BATT | Q1043: TAYLOR
A1044: GOALKICKERS
A1045: SUNSHINE | C1045: LITCHFIELD 6 | F1045: SCANLON 4 | I1045: NELSON 3 | K1045: PROTETTO | N1045: MITROVSKI | Q1045: BROWN
A1046: PRAHRAN | C1046: COOK 4 | E1046: LOWE 4 | G1046: BINGHAM 3 | J1046: TAYLOR 2 | M1046: WALLACE | O1046: ELLETT | Q1046: McDONALD | S1046: WALDER
A1048: GRAND | E1048: 16TH SEPTEMBER | J1048: WEATHER
A1049: BOX HILL | C1049: 4 | D1049: 6 | E1049: =C1049*6+D1049 -> 30 | G1049: 8 | H1049: 9 | I1049: =G1049*6+H1049 -> 57 | K1049: 11 | L1049: 11 | M1049: =K1049*6+L1049 -> 77 | O1049: 14 | P1049: 14 | Q1049: =O1049*6+P1049 -> 98 | S1049: JUNCTION OVAL
A1050: SUNSHINE | C1050: 2 | D1050: 4 | E1050: =C1050*6+D1050 -> 16 | G1050: 4 | H1050: 7 | I1050: =G1050*6+H1050 -> 31 | K1050: 9 | L1050: 11 | M1050: =K1050*6+L1050 -> 65 | O1050: 11 | P1050: 14 | Q1050: =O1050*6+P1050 -> 80 | S1050: CASEY/MARSHALL
A1051: BEST PLAYERS
A1052: BOX HILL | C1052: MURRIE | F1052: GLEESON | I1052: L BOLTON | L1052: DWYER | N1052: COLLINS
A1053: SUNSHINE | C1053: MENADUE | F1053: CALDWELL | I1053: PROTETTO | L1053: QUINN | N1053: LAWLER | Q1053: MOSS
A1054: GOALKICKERS
A1055: BOX HILL | C1055: WITHERS 3 | F1055: L BOLTON 3 | I1055: DWYER 2 | K1055: NICHOLSON | N1055: BROWN | P1055: BOURKE | R1055: TEAKEL | T1055: GARTH | V1055: 1 SHORT
A1056: SUNSHINE | C1056: LITCHFIELD 4 | F1056: SHEPPERBOTTOM 3 | J1056: SCANLON 2 | M1056: NELSON | O1056: BROWN