A1: Victorian Football Association
A2: Season 1986 - Division One
A3: © Copyright Wal Williams | F3: First created: 14 November 2015
A4: Contact: joywalwi at gmail dot com | F4: Last updated: 14 November 2015 | W4: VFA Results and tables - Link to the main index page
A5: You are free to copy this document in whole or part provided that proper acknowledgement is given to the author. All rights reserved.
A7: 1986 | C7: 1ST DIVISION
A8: ROUND 1 | D8: 13TH APRIL | I8: WEATHER | S8: VENUE: BRUNSWICK
D9: 1ST QTR | H9: 2ND QTR | L9: 3RD QTR | P9: FINAL | S9: UMPIRES
A10: WILLIAMSTOWN | C10: 5 | D10: 1 | E10: 31 | G10: 9 | H10: 5 | I10: 59 | K10: 12 | L10: 7 | M10: 79 | O10: 20 | P10: 12 | Q10: 132 | S10: MARCY | X10: LADDER | AB10: ROUND | AD10: 1
A11: BRUNSWICK | C11: 8 | D11: 2 | E11: 50 | G11: 14 | H11: 4 | I11: 88 | K11: 18 | L11: 9 | M11: 117 | O11: 20 | P11: 10 | Q11: 130 | S11: HUTCHINSON
A12: BEST PLAYERS | W12: TEAM | X12: W | Y12: L | Z12: D | AA12: FOR | AB12: AGST | AC12: % | AD12: PTS
A13: WILLIAMSTOWN | C13: LANE | F13: ROUND | I13: SMITH | L13: SAIT | O13: RICKMAN | R13: OWEN
A14: BRUNSWICK | C14: JUDGE | F14: SIMS | I14: EDWARDS | L14: LEAHY | O14: WHILLAS | R14: SMITH | W14: PORT MELBOURNE | X14: 1 | Y14: 0 | Z14: 0 | AA14: 272 | AB14: 74 | AC14: =(AA14/AB14)*100 -> 367.56756756756761 | AD14: =(X14*4)+(Z14*2) -> 4
A15: GOALKICKERS | P15: WEIR | R15: ROUND | W15: GEELONG WEST | X15: 1 | Y15: 0 | Z15: 0 | AA15: 177 | AB15: 109 | AC15: =(AA15/AB15)*100 -> 162.38532110091742 | AD15: =(X15*4)+(Z15*2) -> 4
A16: WILLIAMSTOWN | C16: FOTHERINGHAM 5 | F16: RICKMAN 4 | I16: SAIT 3 | K16: R DIMARTINO 3 | N16: JAMES | P16: CAHILL | R16: PASTORE | W16: COBURG | X16: 1 | Y16: 0 | Z16: 0 | AA16: 150 | AB16: 106 | AC16: =(AA16/AB16)*100 -> 141.50943396226415 | AD16: =(X16*4)+(Z16*2) -> 4
A17: BRUNSWICK | C17: GIBSON 4 | E17: JUDGE 3 | G17: SMYTHE 3 | I17: SMITH 2 | K17: EDWARDS 2 | N17: CATTOGGIO 2 | Q17: CALLANDER | T17: LEAHY | W17: FRANKSTON | X17: 1 | Y17: 0 | Z17: 0 | AA17: 110 | AB17: 106 | AC17: =(AA17/AB17)*100 -> 103.77358490566037 | AD17: =(X17*4)+(Z17*2) -> 4
M18: McALLESTER | P18: TREBILCOCK | S18: VENUE: PORT MELBOURNE
A19: PORT MELBOURNE | C19: 8 | D19: 6 | E19: 54 | G19: 20 | H19: 12 | I19: 132 | K19: 29 | L19: 16 | M19: 190 | O19: 42 | P19: 20 | Q19: 272 | S19: NOLAN | W19: WILLIAMSTOWN | X19: 1 | Y19: 0 | Z19: 0 | AA19: 132 | AB19: 130 | AC19: =(AA19/AB19)*100 -> 101.53846153846153 | AD19: =(X19*4)+(Z19*2) -> 4
A20: CAMBERWELL | C20: 1 | D20: 1 | E20: 7 | G20: 3 | H20: 1 | I20: 19 | K20: 7 | L20: 1 | M20: 43 | O20: 12 | P20: 2 | Q20: 74 | S20: PRICE | W20: BRUNSWICK | X20: 0 | Y20: 1 | Z20: 0 | AA20: 130 | AB20: 132 | AC20: =(AA20/AB20)*100 -> 98.484848484848484 | AD20: =(X20*4)+(Z20*2) -> 0
A21: BEST PLAYERS | W21: PRESTON | X21: 0 | Y21: 1 | Z21: 0 | AA21: 106 | AB21: 110 | AC21: =(AA21/AB21)*100 -> 96.36363636363636 | AD21: =(X21*4)+(Z21*2) -> 0
A22: PORT MELBOURNE | C22: JOHNSON | F22: HARKINS | I22: BAILLIE | L22: SWAN | N22: FEHRING | Q22: MUTIMER | W22: SANDRINGHAM | X22: 0 | Y22: 1 | Z22: 0 | AA22: 106 | AB22: 150 | AC22: =(AA22/AB22)*100 -> 70.666666666666671 | AD22: =(X22*4)+(Z22*2) -> 0
A23: CAMBERWELL | C23: BINGLEY | F23: McKENZIE | I23: DEAN | L23: DREW | N23: SCOTT | Q23: DE KONNING | W23: SPRINGVALE | X23: 0 | Y23: 1 | Z23: 0 | AA23: 109 | AB23: 177 | AC23: =(AA23/AB23)*100 -> 61.581920903954803 | AD23: =(X23*4)+(Z23*2) -> 0
A24: GOALKICKERS | L24: CONLAN | N24: SWAN | P24: BAILLIE | R24: ALLENDER | W24: CAMBERWELL | X24: 0 | Y24: 1 | Z24: 0 | AA24: 74 | AB24: 272 | AC24: =(AA24/AB24)*100 -> 27.205882352941174 | AD24: =(X24*4)+(Z24*2) -> 0
A25: PORT MELBOURNE | C25: JOHNSON 9 | E25: McDONALD 6 | H25: DOHERTY 6 | J25: BROWN 6 | L25: KAVANAGH 4 | O25: MUTIMER 3 | Q25: HICKS 2 | S25: HARKINS 2
A26: CAMBERWELL | C26: MAILING 3 | F26: SCOTT 3 | H26: BINGLEY 2 | J26: DREW | L26: HOWE | N26: JAKOBI | P26: DE KONNING
A28: GEELONG WEST | C28: 5 | D28: 4 | E28: 34 | G28: 10 | H28: 5 | I28: 65 | K28: 18 | L28: 10 | M28: 118 | O28: 27 | P28: 15 | Q28: 177 | S28: VENUE: SPRINGVALE
A29: SPRINGVALE | C29: 4 | D29: 2 | E29: 26 | G29: 10 | H29: 4 | I29: 64 | K29: 15 | L29: 6 | M29: 96 | O29: 17 | P29: 7 | Q29: 109 | S29: CASEY :RYAN
A30: BEST PLAYERS
A31: GEELONG WEST | C31: WATT | F31: ALFORD | I31: PERKINS | L31: JUKAWICS | O31: DOYLR | R31: AUSTEN
A32: SPRINGVALE | C32: MENDE | F32: DEMPSTER | I32: CLARKE
A33: GOALKICKERS
A34: GEELONG WEST | C34: DOYLE 6 | E34: WATT 5 | G34: ALFORD 5 | I34: HAMILTON 3 | L34: BERRY 2 | N34: JUKAWICS 2 | Q34: CONNELLY | T34: WILSON | W34: SODAMARCO | Y34: GIBSON
A35: SPRINGVALE | C35: DUDLEY 4 | F35: CLARKE 3 | I35: ROBINSON 3 | L35: NICOL 2 | N35: HIPWORTH 2 | Q35: MEADE | S35: MORGAN | V35: GLASCOTT
A37: FRANKSTON | C37: 4 | D37: 2 | E37: 26 | G37: 8 | H37: 8 | I37: 56 | K37: 12 | L37: 13 | M37: 85 | O37: 16 | P37: 14 | Q37: 110 | S37: VENUE: FRANKSTON
A38: PRESTON | C38: 3 | D38: 4 | E38: 22 | G38: 7 | H38: 9 | I38: 51 | K38: 9 | L38: 9 | M38: 63 | O38: 16 | P38: 10 | Q38: 106 | S38: PHILLIPS :VERGONA
A39: BEST PLAYERS
A40: FRANKSTON | C40: WHITFIELD | F40: BELL | I40: HUTCHINSON | L40: McLEISH | O40: McCARTY | R40: GEDDES
A41: PRESTON | C41: BROWN | F41: WATT | I41: ROSS | L41: SALVADORE | O41: PLOWMAN | R41: JORDAN
A42: GOALKICKERS
A43: FRANKSTON | C43: McCARTY 8 | F43: WHITFIELD 4 | I43: PAYNTER | K43: MOORE | M43: O'RILEY | O43: O'BRIEN
A44: PRESTON | C44: SHAW 3 | E44: SALVADORE 2 | H44: HACKNEY 2 | J44: BRADDY | L44: WATT | N44: BRINE | P44: FROST | R44: FULLER | U44: ROSS | W44: LUMICISI | X44: JORDAN | AA44: TURNER
A46: COBURG | C46: 7 | D46: 3 | E46: 45 | G46: 13 | H46: 8 | I46: 86 | K46: 18 | L46: 13 | M46: 121 | O46: 22 | P46: 18 | Q46: 150 | S46: VENUE: COBURG
A47: SANDRINGHAM | C47: 3 | D47: 2 | E47: 20 | G47: 9 | H47: 4 | I47: 58 | K47: 11 | L47: 7 | M47: 73 | O47: 16 | P47: 10 | Q47: 106 | S47: G CASEY :MARSHALL
A48: BEST PLAYERS
A49: COBURG | C49: EADE | F49: HALBERT | I49: CHRISTIANSEN | L49: TULLOCH | O49: ALLISON | R49: MANSFIELD
A50: SANDRINGHAM | C50: KRAJOUER | F50: HOWELL | I50: HENDERSON | L50: COLLINS | O50: ALLEN | R50: PRATT
A51: GOALKICKERS | S51: ZANON
A52: COBURG | C52: WEATHERALD 5 | F52: M HARBINSON 3 | J52: HALBERT 2 | M52: EADE 2 | O52: FITZPATRICK 2 | R52: CLEARY 2 | U52: INGRAM 2 | X52: CHRITIANSEN 2 | AB52: LAIDLER
A53: SANDRINGHAM | C53: MORRISON 3 | F53: COLLINS 2 | I53: BEILBY 2 | K53: PHILBEY 2 | M53: SAID 2 | O53: KRAKOUER | Q53: ALLEN | S53: MANNIX | V53: HETHERINGTON | X53: GISLINGHAM
A55: ROUND 2 | D55: 20TH APRIL | I55: WEATHER | S55: VENUE: BEACH ROAD
D56: 1ST QTR | H56: 2ND QTR | L56: 3RD QTR | P56: FINAL | S56: UMPIRES
A57: SANDRINGHAM | C57: 4 | D57: 3 | E57: 27 | G57: 10 | H57: 8 | I57: 68 | K57: 16 | L57: 13 | M57: 109 | O57: 22 | P57: 17 | Q57: 149 | S57: MARCY | X57: LADDER | AB57: ROUND | AD57: 2
A58: PORT MELBOURNE | C58: 6 | D58: 3 | E58: 39 | G58: 10 | H58: 6 | I58: 66 | K58: 12 | L58: 11 | M58: 83 | O58: 17 | P58: 15 | Q58: 117 | S58: PHILLIPS
A59: BEST PLAYERS | W59: TEAM | X59: W | Y59: L | Z59: D | AA59: FOR | AB59: AGST | AC59: % | AD59: PTS
A60: SANDRINGHAM | C60: ALLEN | F60: HOWELL | I60: BRIAN SAID | L60: HENDERSON | O60: MANNIX | R60: BONNEY
A61: PORT MELBOURNE | C61: CHADBAND | F61: MUTIMER | I61: HARKINS | L61: McDONALD | O61: ALLENDER | W61: COBURG | X61: 2 | Y61: 0 | Z61: 0 | AA61: 284 | AB61: 203 | AC61: =(AA61/AB61)*100 -> 139.90147783251231 | AD61: =(X61*4)+(Z61*2) -> 8
A62: GOALKICKERS | P62: BRIAN SAID | W62: FRANKSTON | X62: 2 | Y62: 0 | Z62: 0 | AA62: 237 | AB62: 176 | AC62: =(AA62/AB62)*100 -> 134.65909090909091 | AD62: =(X62*4)+(Z62*2) -> 8
A63: SANDRINGHAM | C63: HOWELL 5 | E63: MORRISON 5 | H63: JOHNSON 4 | J63: HENDERSON 2 | M63: MANNIX 2 | O63: KRAKOUER | Q63: PRATT | S63: DUURSMA | W63: PORT MELBOURNE | X63: 1 | Y63: 1 | Z63: 0 | AA63: 389 | AB63: 223 | AC63: =(AA63/AB63)*100 -> 174.43946188340806 | AD63: =(X63*4)+(Z63*2) -> 4
A64: PORT MELBOURNE | C64: HARKINS 4 | F64: MCDONALD 4 | I64: ALLENDER 3 | L64: CARTER | N64: HOWARD | P64: JOHNSON | R64: KAVANAGH | W64: SPRINGVALE | X64: 1 | Y64: 1 | Z64: 0 | AA64: 304 | AB64: 232 | AC64: =(AA64/AB64)*100 -> 131.0344827586207 | AD64: =(X64*4)+(Z64*2) -> 4
M65: RODDA | O65: SWAN | S65: VENUE: PRESTON
A66: BRUNSWICK | C66: 2 | D66: 2 | E66: 14 | G66: 9 | H66: 5 | I66: 59 | K66: 13 | L66: 9 | M66: 87 | O66: 18 | P66: 10 | Q66: 118 | S66: MARSHALL | W66: BRUNSWICK | X66: 1 | Y66: 1 | Z66: 0 | AA66: 248 | AB66: 233 | AC66: =(AA66/AB66)*100 -> 106.43776824034335 | AD66: =(X66*4)+(Z66*2) -> 4
A67: PRESTON | C67: 3 | D67: 6 | E67: 24 | G67: 3 | H67: 7 | I67: 25 | K67: 8 | L67: 12 | M67: 60 | O67: 14 | P67: 17 | Q67: 101 | S67: PRICE | W67: GEELONG WEST | X67: 1 | Y67: 1 | Z67: 0 | AA67: 247 | AB67: 236 | AC67: =(AA67/AB67)*100 -> 104.66101694915255 | AD67: =(X67*4)+(Z67*2) -> 4
A68: BEST PLAYERS | W68: SANDRINGHAM | X68: 1 | Y68: 1 | Z68: 0 | AA68: 255 | AB68: 267 | AC68: =(AA68/AB68)*100 -> 95.50561797752809 | AD68: =(X68*4)+(Z68*2) -> 4
A69: BRUNSWICK | C69: McDONALD | F69: SMITH | I69: SIMS | L69: EDWARDS | O69: LEAHY | R69: WHITTLE | W69: WILLIAMSTOWN | X69: 1 | Y69: 1 | Z69: 0 | AA69: 229 | AB69: 264 | AC69: =(AA69/AB69)*100 -> 86.742424242424249 | AD69: =(X69*4)+(Z69*2) -> 4
A70: PRESTON | C70: SHAW | F70: BYRNE | I70: TOWAN | W70: PRESTON | X70: 0 | Y70: 2 | Z70: 0 | AA70: 207 | AB70: 228 | AC70: =(AA70/AB70)*100 -> 90.789473684210535 | AD70: =(X70*4)+(Z70*2) -> 0
A71: GOALKICKERS | Q71: SMYTHE | W71: CAMBERWELL | X71: 0 | Y71: 2 | Z71: 0 | AA71: 129 | AB71: 467 | AC71: =(AA71/AB71)*100 -> 27.623126338329762 | AD71: =(X71*4)+(Z71*2) -> 0
A72: BRUNSWICK | C72: McALLESTER 5 | F72: EDWARDS 3 | I72: TREBILCOCK 3 | L72: LOVETT 2 | N72: SMITH 2 | P72: GIBSON | R72: ROULSTON
A73: PRESTON | C73: SHAW 8 | F73: SALVADORE 2 | I73: BRADDY | K73: YEOMANS | M73: ANDERSON | P73: SMART
A75: FRANKSTON | C75: 2 | D75: 3 | E75: 15 | G75: 7 | H75: 9 | I75: 51 | K75: 11 | L75: 14 | M75: 80 | O75: 18 | P75: 19 | Q75: 127 | S75: VENUE: GEELONG WEST
A76: GEELONG WEST | C76: 3 | D76: 2 | E76: 20 | G76: 4 | H76: 8 | I76: 32 | K76: 8 | L76: 14 | M76: 62 | O76: 9 | P76: 16 | Q76: 70 | S76: HUTCHINSON :?
A77: BEST PLAYERS
A78: FRANKSTON | C78: HUTCHINSON | F78: BELL | I78: VANDERMEER | L78: O'BRIEN | O78: SANDFORD
A79: GEELONG WEST | C79: REDHEAD | F79: WATT | I79: NORTH | L79: LYNCH
A80: GOALKICKERS
A81: FRANKSTON | C81: McCARTY 5 | F81: O'BRIEN 4 | I81: GEDDES 3 | K81: WHITFIELD 2 | N81: SARAU | P81: LONG | R81: O'RILEY | T81: MOORE
A82: GEELONG WEST | C82: DOYLE 4 | F82: JUKAWICS 2 | I82: LYNCH 2 | K82: JORDAN
A84: SPRINGVALE | C84: 6 | D84: 7 | E84: 43 | G84: 11 | H84: 10 | I84: 76 | K84: 22 | L84: 15 | M84: 147 | O84: 29 | P84: 21 | Q84: 195 | S84: VENUE: CAMBERWELL
A85: CAMBERWELL | C85: 1 | D85: 1 | E85: 7 | G85: 5 | H85: 3 | I85: 33 | K85: 6 | L85: 5 | M85: 41 | O85: 8 | P85: 7 | Q85: 55 | S85: McDONALD :VERGONA
A86: BEST PLAYERS
A87: SPRINGVALE | C87: ROBINSON | F87: MENDE | I87: VERNON | L87: BURKE | O87: HIPWORTH
A88: CAMBERWELL | C88: DREW | F88: ANGUS | I88: JACKSON | L88: DE KONNING | O88: CONSTANTINOU | S88: GREY
A89: GOALKICKERS
A90: SPRINGVALE | C90: ROBINSON 9 | F90: BURKE 5 | H90: NICOL 4 | J90: MORGAN 3 | M90: DUDLEY 2 | O90: HIPWORTH 2 | R90: FISHER | T90: CLARKE | W90: ROSS | X90: GLASCOTT
A91: CAMBERWELL | C91: AYLEN 2 | E91: SCOTT | G91: BINGLEY | I91: BOYCE | K91: GREY | M91: WILGAR
A93: COBURG | C93: 4 | D93: 7 | E93: 31 | G93: 7 | H93: 13 | I93: 55 | K93: 11 | L93: 13 | M93: 79 | O93: 19 | P93: 20 | Q93: 134 | S93: VENUE: WILLIAMSTOWN
A94: WILLIAMSTOWN | C94: 4 | D94: 1 | E94: 25 | G94: 8 | H94: 6 | I94: 54 | K94: 10 | L94: 16 | M94: 76 | O94: 13 | P94: 19 | Q94: 97 | S94: CASEY :RYAN
A95: BEST PLAYERS
A96: COBURG | C96: EADE | E96: MANSFIELD | H96: LAIDLER | K96: HARBINSON | N96: CHRISTIANSEN | R96: RIENIETS
A97: WILLIAMSTOWN | C97: SAIT | E97: KERSHAW | H97: MURPHY | K97: BRIERTY | N97: HUGHES | R97: McTAGGART
A98: GOALKICKERS
A99: COBURG | C99: WEATHERALD 7 | F99: CHRISTIANSEN 3 | J99: FITZPATRICK 2 | M99: TULLOCH 2 | P99: RIENIETTS 2 | S99: EADE | U99: ZANON | X99: INGRAM
A100: WILLIAMSTOWN | C100: SAIT 3 | E100: SMITH 3 | G100: DULLARD 2 | J100: LANE | L100: JAMES | N100: MCTAGGART | Q100: FOTHERINGHAM | U100: WEIR
A102: ROUND 3 | D102: 27TH APRIL | I102: WEATHER | S102: VENUE: BRUNSWICK
D103: 1ST QTR | H103: 2ND QTR | L103: 3RD QTR | P103: FINAL | S103: UMPIRES
A104: BRUNSWICK | C104: 8 | D104: 4 | E104: 52 | G104: 11 | H104: 6 | I104: 72 | K104: 13 | L104: 7 | M104: 85 | O104: 16 | P104: 10 | Q104: 106 | S104: McDONALD | X104: LADDER | AB104: ROUND | AD104: 3
A105: GEELONG WEST | C105: 3 | D105: 7 | E105: 25 | G105: 7 | H105: 8 | I105: 50 | K105: 9 | L105: 14 | M105: 68 | O105: 11 | P105: 19 | Q105: 85 | S105: PHILLIPS
A106: BEST PLAYERS | W106: TEAM | X106: W | Y106: L | Z106: D | AA106: FOR | AB106: AGST | AC106: % | AD106: PTS
A107: BRUNSWICK | C107: McGHIE | F107: THOROGOOD | J107: A SMITH | M107: LEYDIN | O107: LOVETT | R107: SIMS
A108: GEELONG WEST | C108: AUSTIN | F108: PERKINS | J108: ALFORD | M108: BERRY | O108: JUKAWICS | W108: FRANKSTON | X108: 3 | Y108: 0 | Z108: 0 | AA108: 430 | AB108: 273 | AC108: =(AA108/AB108)*100 -> 157.50915750915752 | AD108: =(X108*4)+(Z108*2) -> 12
A109: GOALKICKERS | P109: ROULSTON | R109: SIMS | W109: COBURG | X109: 3 | Y109: 0 | Z109: 0 | AA109: 463 | AB109: 296 | AC109: =(AA109/AB109)*100 -> 156.41891891891893 | AD109: =(X109*4)+(Z109*2) -> 12
A110: BRUNSWICK | C110: GIBSON 3 | E110: TREBILCOCK 3 | H110: FLOWER 2 | J110: McALLESTER 2 | M110: A SMITH 2 | O110: GREGG | Q110: PULVARENTI | W110: BRUNSWICK | X110: 2 | Y110: 1 | Z110: 0 | AA110: 354 | AB110: 318 | AC110: =(AA110/AB110)*100 -> 111.32075471698113 | AD110: =(X110*4)+(Z110*2) -> 8
A111: GEELONG WEST | C111: ALFORD 2 | E111: JUKAWICS 2 | H111: GIBSON | J111: WATT | L111: HAMILTON | N111: LYNCH | P111: REDHEAD | R111: TOULMIN | W111: SANDRINGHAM | X111: 2 | Y111: 1 | Z111: 0 | AA111: 416 | AB111: 383 | AC111: =(AA111/AB111)*100 -> 108.61618798955615 | AD111: =(X111*4)+(Z111*2) -> 8
O112: BERRY | S112: VENUE: PORT MELBOURNE
A113: COBURG | C113: 6 | D113: 3 | E113: 39 | G113: 9 | H113: 6 | I113: 60 | K113: 18 | L113: 13 | M113: 121 | O113: 27 | P113: 17 | Q113: 179 | S113: VERGONA | W113: PORT MELBOURNE | X113: 1 | Y113: 2 | Z113: 0 | AA113: 482 | AB113: 402 | AC113: =(AA113/AB113)*100 -> 119.90049751243781 | AD113: =(X113*4)+(Z113*2) -> 4
A114: PORT MELBOURNE | C114: 1 | D114: 2 | E114: 8 | G114: 3 | H114: 4 | I114: 22 | K114: 9 | L114: 8 | M114: 62 | O114: 13 | P114: 15 | Q114: 93 | S114: HUTCHINSON | W114: PRESTON | X114: 1 | Y114: 2 | Z114: 0 | AA114: 344 | AB114: 304 | AC114: =(AA114/AB114)*100 -> 113.1578947368421 | AD114: =(X114*4)+(Z114*2) -> 4
A115: BEST PLAYERS | W115: SPRINGVALE | X115: 1 | Y115: 2 | Z115: 0 | AA115: 420 | AB115: 393 | AC115: =(AA115/AB115)*100 -> 106.87022900763358 | AD115: =(X115*4)+(Z115*2) -> 4
A116: COBURG | C116: LITTLER | F116: EADE | I116: WEATHERALD | L116: TULLOCH | N116: FITZPATRICK | Q116: MANSFIELD | W116: GEELONG WEST | X116: 1 | Y116: 2 | Z116: 0 | AA116: 332 | AB116: 342 | AC116: =(AA116/AB116)*100 -> 97.076023391812853 | AD116: =(X116*4)+(Z116*2) -> 4
A117: PORT MELBOURNE | C117: HOWARD | F117: CHADBAND | W117: WILLIAMSTOWN | X117: 1 | Y117: 2 | Z117: 0 | AA117: 305 | AB117: 401 | AC117: =(AA117/AB117)*100 -> 76.059850374064837 | AD117: =(X117*4)+(Z117*2) -> 4
A118: GOALKICKERS | L118: HALBERT 2 | O118: INGRAM 2 | Q118: EADE | R118: TULLOCH | W118: CAMBERWELL | X118: 0 | Y118: 3 | Z118: 0 | AA118: 226 | AB118: 660 | AC118: =(AA118/AB118)*100 -> 34.242424242424242 | AD118: =(X118*4)+(Z118*2) -> 0
A119: COBURG | C119: WEATHERALD 10 | F119: FITZPATRICK 3 | I119: LITTLER 2 | K119: MANSFIELD 2 | N119: EDWARDS 2 | Q119: DALGLEISH 2
A120: PORT MELBOURNE | C120: BAILEY 2 | E120: HOWARD 2 | H120: JOHNSON 2 | J120: KING 2 | L120: CHADBAND | O120: DOHERTY | Q120: HARKINS | S120: McDONALD
N121: SWAN
A122: SANDRINGHAM | C122: 7 | D122: 8 | E122: 50 | G122: 11 | H122: 10 | I122: 76 | K122: 18 | L122: 14 | M122: 122 | O122: 24 | P122: 17 | Q122: 161 | S122: VENUE: SPRINGVALE
A123: SPRINGVALE | C123: 2 | D123: 6 | E123: 18 | G123: 5 | H123: 9 | I123: 39 | K123: 9 | L123: 11 | M123: 65 | O123: 17 | P123: 14 | Q123: 116 | S123: MARSHALL :RYAN
A124: BEST PLAYERS
A125: SANDRINGHAM | C125: JOHNSON | F125: KRAKOUER | I125: HOWELL | L125: BEILBY | O125: COLLINS | R125: PRATT
A126: SPRINGVALE | C126: HERBERT | F126: MENDE | I126: MALONI | L126: DEMPSTER
A127: GOALKICKERS
A128: SANDRINGHAM | C128: JOHNSON 5 | F128: BRIAN SAID 4 | I128: BEILBY 3 | K128: BONNEY 3 | M128: HOWELL 3 | O128: KRISTENSEN 2 | R128: COLLINS 2 | U128: MORRISON | X128: KRAKOUER
A129: SPRINGVALE | C129: ROBINSON 3 | F129: NICOL 3 | H129: MENDE 3 | J129: DEMPSTER 2 | M129: HERBERT | O129: DUDLEY | Q129: ANDERSON | T129: HIPWORTH | W129: LARSON | Y129: MORGAN
A131: FRANKSTON | C131: 3 | D131: 6 | E131: 24 | G131: 13 | H131: 9 | I131: 87 | K131: 23 | L131: 17 | M131: 155 | O131: 28 | P131: 25 | Q131: 193 | S131: VENUE: FRANKSTON
A132: CAMBERWELL | C132: 3 | D132: 9 | E132: 27 | G132: 7 | H132: 11 | I132: 53 | K132: 11 | L132: 11 | M132: 77 | O132: 14 | P132: 13 | Q132: 97 | S132: MARCY :PRICE
A133: BEST PLAYERS
A134: FRANKSTON | C134: GEDDES | F134: HUTCHINSON | I134: SANDFORD | L134: FOYSTER | O134: BEATON | R134: SARAU
A135: CAMBERWELL | C135: FREW | F135: AYLING | I135: SCOTT | L135: McKENZIE | O135: CONSTANTINOU | R135: DREW
A136: GOALKICKERS
A137: FRANKSTON | C137: GEDDES 6 | E137: McCARTY 4 | H137: HUTCHINSON 4 | K137: LONG 4 | M137: WHITFIELD 3 | P137: FOYSTER 2 | R137: O'BRIEN 2 | U137: MOORE | X137: BOLAND | AA137: O'RILEY
A138: CAMBERWELL | C138: AYLING 7 | F138: BINGLEY 3 | I138: MAILING | K138: SCOTT | M138: BARKLY | O138: JACKSON
A140: PRESTON | C140: 2 | D140: 4 | E140: 16 | G140: 8 | H140: 9 | I140: 57 | K140: 17 | L140: 11 | M140: 113 | O140: 21 | P140: 11 | Q140: 137 | S140: VENUE: PRESTON
A141: WILLIAMSTOWN | C141: 2 | D141: 4 | E141: 16 | G141: 4 | H141: 5 | I141: 29 | K141: 6 | L141: 7 | M141: 43 | O141: 11 | P141: 10 | Q141: 76 | S141: NOLAN :CASEY
A142: BEST PLAYERS
A143: PRESTON | C143: JORDAN | F143: BROWN | I143: RAYMENT | L143: SHAW | O143: DUNBAR | Q143: HUNT
A144: WILLIAMSTOWN | C144: OWEN | F144: SAIT | I144: KERSHAW | L144: WHEELER
A145: GOALKICKERS
A146: PRESTON | C146: SHAW 10 | F146: ROSS 3 | H146: FULLER 3 | J146: WATT 2 | L146: BRADDY 2 | O146: YEOMANS
A147: WILLIAMSTOWN | C147: RICKMAN 4 | F147: HUGHES 3 | I147: ROUND | K147: SMITH | M147: BRIERTY | O147: GIBSON
A149: ROUND 4 | D149: 4TH MAY | I149: WEATHER | S149: VENUE: COBURG
D150: 1ST QTR | H150: 2ND QTR | L150: 3RD QTR | P150: FINAL | S150: UMPIRES
A151: COBURG | C151: 7 | D151: 6 | E151: 48 | G151: 9 | H151: 8 | I151: 62 | K151: 14 | L151: 13 | M151: 97 | O151: 22 | P151: 16 | Q151: 148 | S151: CASEY | X151: LADDER | AB151: ROUND | AD151: 4
A152: SPRINGVALE | C152: 4 | D152: 0 | E152: 24 | G152: 11 | H152: 4 | I152: 70 | K152: 16 | L152: 6 | M152: 102 | O152: 19 | P152: 10 | Q152: 124 | S152: MARCY
A153: BEST PLAYERS | W153: TEAM | X153: W | Y153: L | Z153: D | AA153: FOR | AB153: AGST | AC153: % | AD153: PTS
A154: COBURG | C154: HALBERT | F154: LITTLER | I154: M HARBINSON | M154: FITZPATRICK | P154: TULLOCH | S154: ZANON
A155: SPRINGVALE | C155: HIPWORTH | F155: KING | I155: LARSON | M155: KEAYS | P155: ANDERSON | S155: HERBERT | W155: COBURG | X155: 4 | Y155: 0 | Z155: 0 | AA155: 611 | AB155: 420 | AC155: =(AA155/AB155)*100 -> 145.47619047619048 | AD155: =(X155*4)+(Z155*2) -> 16
A156: GOALKICKERS | M156: TULLOCH | P156: LITTLER | R156: NIMMO | W156: FRANKSTON | X156: 3 | Y156: 1 | Z156: 0 | AA156: 526 | AB156: 399 | AC156: =(AA156/AB156)*100 -> 131.8295739348371 | AD156: =(X156*4)+(Z156*2) -> 12
A157: COBURG | C157: M HARBINSON 4 | F157: FITZPATRICK 4 | I157: WEATHERALD 4 | L157: MANSFIELD 3 | O157: HALBERT 2 | Q157: CHRISTIANSEN | T157: LAIDLER | W157: BRUNSWICK | X157: 3 | Y157: 1 | Z157: 0 | AA157: 514 | AB157: 434 | AC157: =(AA157/AB157)*100 -> 118.43317972350232 | AD157: =(X157*4)+(Z157*2) -> 12
A158: SPRINGVALE | C158: CLARKE 4 | E158: ROBINSON 4 | H158: ANDERSON 3 | K158: NEWMAN 3 | M158: HERBERT 2 | P158: MEADE | R158: MORGAN | W158: SANDRINGHAM | X158: 3 | Y158: 1 | Z158: 0 | AA158: 542 | AB158: 479 | AC158: =(AA158/AB158)*100 -> 113.15240083507308 | AD158: =(X158*4)+(Z158*2) -> 12
M159: FISHER | S159: VENUE: CAMBERWELL
A160: BRUNSWICK | C160: 4 | D160: 7 | E160: 31 | G160: 11 | H160: 11 | I160: 77 | K160: 14 | L160: 15 | M160: 99 | O160: 23 | P160: 22 | Q160: 160 | S160: HUTCHINSON | W160: GEELONG WEST | X160: 2 | Y160: 2 | Z160: 0 | AA160: 457 | AB160: 429 | AC160: =(AA160/AB160)*100 -> 106.52680652680652 | AD160: =(X160*4)+(Z160*2) -> 8
A161: CAMBERWELL | C161: 9 | D161: 4 | E161: 58 | G161: 14 | H161: 8 | I161: 92 | K161: 16 | L161: 11 | M161: 107 | O161: 17 | P161: 14 | Q161: 116 | S161: PHILLIPS | W161: WILLIAMSTOWN | X161: 2 | Y161: 2 | Z161: 0 | AA161: 470 | AB161: 517 | AC161: =(AA161/AB161)*100 -> 90.909090909090907 | AD161: =(X161*4)+(Z161*2) -> 8
A162: BEST PLAYERS | W162: PORT MELBOURNE | X162: 1 | Y162: 3 | Z162: 0 | AA162: 598 | AB162: 567 | AC162: =(AA162/AB162)*100 -> 105.46737213403881 | AD162: =(X162*4)+(Z162*2) -> 4
A163: BRUNSWICK | C163: LOVETT | F163: EDWARDS | I163: THOROGOOD | M163: SIMS | P163: SMITH | S163: FLOWER | W163: SPRINGVALE | X163: 1 | Y163: 3 | Z163: 0 | AA163: 544 | AB163: 541 | AC163: =(AA163/AB163)*100 -> 100.55452865064696 | AD163: =(X163*4)+(Z163*2) -> 4
A164: CAMBERWELL | C164: DREW | F164: ANGUS | I164: FREW | M164: BINGLEY | P164: MCKENZIE | S164: WILGAR | W164: PRESTON | X164: 1 | Y164: 3 | Z164: 0 | AA164: 431 | AB164: 429 | AC164: =(AA164/AB164)*100 -> 100.46620046620048 | AD164: =(X164*4)+(Z164*2) -> 4
A165: GOALKICKERS | P165: JUDGE | R165: TREBILCOCK | W165: CAMBERWELL | X165: 0 | Y165: 4 | Z165: 0 | AA165: 342 | AB165: 820 | AC165: =(AA165/AB165)*100 -> 41.707317073170728 | AD165: =(X165*4)+(Z165*2) -> 0
A166: BRUNSWICK | C166: FLOWER 6 | E166: McALLESTER 4 | H166: LOVETT 4 | J166: SMITH 2 | L166: GIBSON 2 | N166: CALLANDER | Q166: DUGDALE | S166: EDWARDS
A167: CAMBERWELL | C167: BINGLEY 8 | E167: CONSTANTINOU | H167: WEST | I167: ANGUS | K167: SCOT | M167: DE KONNING | P167: MAILING | R167: DREW | T167: WILGAR
S168: GALWAY
A169: WILLIAMSTOWN | C169: 5 | D169: 1 | E169: 31 | G169: 11 | H169: 4 | I169: 70 | K169: 18 | L169: 7 | M169: 115 | O169: 26 | P169: 9 | Q169: 165 | S169: VENUE: WILLIAMSTOWN
A170: PORT MELBOURNE | C170: 3 | D170: 2 | E170: 20 | G170: 7 | H170: 3 | I170: 45 | K170: 14 | L170: 5 | M170: 89 | O170: 18 | P170: 8 | Q170: 116
A171: BEST PLAYERS
A172: WILLIAMSTOWN | C172: FOTHERINGHAM | F172: SAIT | I172: NILSEN | K172: MORRISON | N172: LANE | Q172: SMITH
A173: PORT MELBOURNE | C173: CHADBAND | F173: SWAN | I173: HOY | K173: FITZPATRICK | N173: CRUTCHFIELD | Q173: CARTER
A174: GOALKICKERS
A175: WILLIAMSTOWN | C175: FOTHERINGHAM 14 | G175: RICKMAN 5 | J175: SAIT 2 | L175: HUGHES 2 | N175: McTAGGART | Q175: CAHILL | S175: SMITH
A176: PORT MELBOURNE | C176: FITZPATRICK 5 | F176: ALEXANDER 2 | I176: DOHERTY 2 | L176: HARKINS 2 | N176: MCDONALD 2 | Q176: MOURNEY 2 | T176: HICKS | V176: BAILLIE | X176: SWAN
A178: SANDRINGHAM | C178: 4 | D178: 4 | E178: 28 | G178: 7 | H178: 11 | I178: 53 | K178: 11 | L178: 19 | M178: 85 | O178: 17 | P178: 24 | Q178: 126 | S178: VENUE: BEACH ROAD
A179: FRANKSTON | C179: 1 | D179: 9 | E179: 15 | G179: 7 | H179: 12 | I179: 54 | K179: 10 | L179: 15 | M179: 75 | O179: 13 | P179: 18 | Q179: 96 | S179: NOLAN :CASEY
A180: BEST PLAYERS
A181: SANDRINGHAM | C181: HETHERINGTON | F181: BEILBY | I181: KRAKOUER | L181: HENDERSON | O181: HOWELL | R181: BRIAN SAID
A182: FRANKSTON | C182: WHITFIELD | F182: BELL | I182: THOMAS | L182: BOLAND
A183: GOALKICKERS
A184: SANDRINGHAM | C184: ALLEN 4 | E184: JOHNSON 4 | H184: MORRISON 3 | K184: HETHERINGTON | N184: KRISTENSEN | Q184: BEILBY | S184: BONNEY | V184: HOWELL | X184: BRIAN SAID
A185: FRANKSTON | C185: WHITFIELD 3 | F185: MOORE 2 | H185: McCARTY 2 | J185: BELL | L185: DUNNE | N185: BEATON | P185: BOLAND | R185: SARAU | T185: THOMAS
A187: GEELONG WEST | C187: 5 | D187: 5 | E187: 35 | G187: 9 | H187: 7 | I187: 61 | K187: 14 | L187: 10 | M187: 94 | O187: 18 | P187: 17 | Q187: 125 | S187: VENUE: GEELONG WEST
A188: PRESTON | C188: 5 | D188: 3 | E188: 33 | G188: 8 | H188: 7 | I188: 55 | K188: 11 | L188: 13 | M188: 79 | O188: 12 | P188: 15 | Q188: 87 | S188: RYAN :BRADSHAW
A189: BEST PLAYERS
A190: GEELONG WEST | C190: ALFORD | F190: PERKINS | I190: DALIHAUS | L190: RICHARDSON | O190: AUSTIN | R190: WATT
A191: PRESTON | C191: DUNBAR | F191: ROSS | I191: LUMICISI | L191: SHAW
A192: GOALKICKERS
A193: GEELONG WEST | C193: RICHARDSON 7 | F193: HADDOCK 4 | I193: ALFORD 2 | K193: S BERRY 2 | M193: WATT | O193: WILSON | Q193: EVANS
A194: PRESTON | C194: SHAW 6 | F194: BRADDY 3 | I194: ROSS 2 | K194: LUMICISI
A196: ROUND 5 | D196: 18TH MAY | I196: WEATHER | S196: VENUE: BRUNSWICK
D197: 1ST QTR | H197: 2ND QTR | L197: 3RD QTR | P197: FINAL | S197: UMPIRES
A198: SANDRINGHAM | C198: 4 | D198: 3 | E198: 27 | G198: 8 | H198: 7 | I198: 55 | K198: 15 | L198: 11 | M198: 101 | O198: 19 | P198: 18 | Q198: 132 | S198: VERGONA | X198: LADDER | AB198: ROUND | AD198: 5
A199: BRUNSWICK | C199: 5 | D199: 4 | E199: 34 | G199: 7 | H199: 8 | I199: 50 | K199: 9 | L199: 12 | M199: 66 | O199: 14 | P199: 13 | Q199: 97 | S199: RYAN
A200: BEST PLAYERS | W200: TEAM | X200: W | Y200: L | Z200: D | AA200: FOR | AB200: AGST | AC200: % | AD200: PTS
A201: SANDRINGHAM | C201: SAID | F201: PRATT | I201: COLLINS | L201: HETHERINGTON | O201: HOWELL | R201: JOHNSON
A202: BRUNSWICK | C202: WHILLAS | F202: JACKSON | I202: WEST | L202: LOVETT | W202: FRANKSTON | X202: 4 | Y202: 1 | Z202: 0 | AA202: 649 | AB202: 492 | AC202: =(AA202/AB202)*100 -> 131.91056910569105 | AD202: =(X202*4)+(Z202*2) -> 16
A203: GOALKICKERS | W203: COBURG | X203: 4 | Y203: 1 | Z203: 0 | AA203: 704 | AB203: 543 | AC203: =(AA203/AB203)*100 -> 129.65009208103132 | AD203: =(X203*4)+(Z203*2) -> 16
A204: SANDRINGHAM | C204: JOHNSON 5 | F204: ALLEN 4 | H204: BRIAN SAID 4 | K204: BEILBY 2 | M204: HOWELL 2 | O204: FITZPATRICK | R204: BONNEY | W204: SANDRINGHAM | X204: 4 | Y204: 1 | Z204: 0 | AA204: 674 | AB204: 576 | AC204: =(AA204/AB204)*100 -> 117.01388888888889 | AD204: =(X204*4)+(Z204*2) -> 16
A205: BRUNSWICK | C205: JACKSON 5 | F205: LOVETT 2 | I205: SMITH 2 | K205: CALLANDER | N205: GIBSON | P205: JUDGE | R205: LEAHY | T205: WEST | W205: BRUNSWICK | X205: 3 | Y205: 2 | Z205: 0 | AA205: 611 | AB205: 566 | AC205: =(AA205/AB205)*100 -> 107.95053003533567 | AD205: =(X205*4)+(Z205*2) -> 12
S206: VENUE: PRESTON
A207: PRESTON | C207: 7 | D207: 3 | E207: 45 | G207: 20 | H207: 10 | I207: 130 | K207: 28 | L207: 12 | M207: 180 | O207: 36 | P207: 18 | Q207: 234 | S207: NOLAN | W207: WILLIAMSTOWN | X207: 3 | Y207: 2 | Z207: 0 | AA207: 585 | AB207: 601 | AC207: =(AA207/AB207)*100 -> 97.33777038269551 | AD207: =(X207*4)+(Z207*2) -> 12
A208: CAMBERWELL | C208: 1 | D208: 2 | E208: 8 | G208: 1 | H208: 2 | I208: 8 | K208: 3 | L208: 6 | M208: 24 | O208: 4 | P208: 8 | Q208: 32 | S208: McDONALD | W208: PRESTON | X208: 2 | Y208: 3 | Z208: 0 | AA208: 665 | AB208: 461 | AC208: =(AA208/AB208)*100 -> 144.2516268980477 | AD208: =(X208*4)+(Z208*2) -> 8
A209: BEST PLAYERS | W209: PORT MELBOURNE | X209: 2 | Y209: 3 | Z209: 0 | AA209: 737 | AB209: 691 | AC209: =(AA209/AB209)*100 -> 106.65701881331404 | AD209: =(X209*4)+(Z209*2) -> 8
A210: PRESTON | C210: DUNBAR | F210: BRINE | I210: SHAW | L210: JORDAN | O210: WATT | R210: HUNT | W210: GEELONG WEST | X210: 2 | Y210: 3 | Z210: 0 | AA210: 541 | AB210: 544 | AC210: =(AA210/AB210)*100 -> 99.44852941176471 | AD210: =(X210*4)+(Z210*2) -> 8
A211: CAMBERWELL | C211: DE KONNING | F211: CONSTANTINOU | W211: SPRINGVALE | X211: 1 | Y211: 4 | Z211: 0 | AA211: 668 | AB211: 680 | AC211: =(AA211/AB211)*100 -> 98.235294117647058 | AD211: =(X211*4)+(Z211*2) -> 4
A212: GOALKICKERS | O212: FROST | Q212: LUMICISI | W212: CAMBERWELL | X212: 0 | Y212: 5 | Z212: 0 | AA212: 374 | AB212: 1054 | AC212: =(AA212/AB212)*100 -> 35.483870967741936 | AD212: =(X212*4)+(Z212*2) -> 0
A213: PRESTON | C213: SHAW 13 | E213: SALVADORE 4 | H213: DUNBAR 4 | J213: BRINE 3 | L213: FULLER 3 | N213: JORDAN 3 | Q213: WATT 2 | S213: ROSS 2
A214: CAMBERWELL | C214: DE KONNING | F214: CONSTANTINOU | I214: FREW | K214: WILGAR
A216: PORT MELBOURNE | C216: 4 | D216: 2 | E216: 26 | G216: 10 | H216: 7 | I216: 67 | K216: 13 | L216: 11 | M216: 89 | O216: 20 | P216: 19 | Q216: 139 | S216: VENUE: SPRINGVALE
A217: SPRINGVALE | C217: 6 | D217: 3 | E217: 39 | G217: 11 | H217: 3 | I217: 69 | K217: 16 | L217: 3 | M217: 99 | O217: 20 | P217: 4 | Q217: 124 | S217: CASEY :BULLUSS
A218: BEST PLAYERS
A219: PORT MELBOURNE | C219: BAILLIE | F219: SWAN | I219: CHADBAND | L219: McDONALD | O219: CARTER | R219: WALL
A220: SPRINGVALE | C220: ROBINSON | F220: KEAYS | I220: HOLDEN | L220: MENDE | O220: VERNON
A221: GOALKICKERS
A222: PORT MELBOURNE | C222: BAILLIE 4 | E222: P JOHNSON 4 | H222: DOHERTY 3 | J222: MCDONALD 3 | M222: HOWARD 2 | P222: HOY | Q222: M JOHNSON | T222: MOURNEY | W222: SWAN
A223: SPRINGVALE | C223: ROBINSON 9 | F223: ANDERSON 2 | I223: BOURKE 2 | K223: CLARKE | M223: HERBERT | O223: VERNON | Q223: ROSS | R223: HOLDEN | U223: LARSON | X223: NEWMAN
A225: FRANKSTON | C225: 7 | D225: 1 | E225: 43 | G225: 12 | H225: 6 | I225: 78 | K225: 15 | L225: 6 | M225: 96 | O225: 19 | P225: 9 | Q225: 123 | S225: VENUE: FRANKSTON
A226: COBURG | C226: 1 | D226: 2 | E226: 8 | G226: 4 | H226: 3 | I226: 27 | K226: 9 | L226: 11 | M226: 65 | O226: 13 | P226: 15 | Q226: 93 | S226: BRADSHAW :PHILLIPS
A227: BEST PLAYERS
A228: FRANKSTON | C228: BELL | F228: McLEISH | I228: BRIESE | L228: BEATON | O228: MCCARTY | R228: FAVIER
A229: COBURG | C229: LITTLER | F229: MANSFIELD | I229: FITZPATRICK | L229: SHELDON | O229: GUMLEY
A230: GOALKICKERS
A231: FRANKSTON | C231: MCCARTY 8 | F231: HUTCHINSON 2 | I231: WHITE 2 | K231: BOLAND 2 | M231: RAVEN 2 | O231: LANE | Q231: BEATON | S231: GEDDES
A232: COBURG | C232: HARBINSON 2 | F232: MANSFIELD 2 | I232: ALLISON | K232: CHRISTIANSEN | N232: CLEARY | P232: FITZPATRICK | S232: GUMLEY | V232: HALBERT | X232: INGRAM | AA232: WEATHERALD
Z233: TULLOCH
A234: WILLIAMSTOWN | C234: 3 | D234: 1 | E234: 19 | G234: 4 | H234: 5 | I234: 29 | K234: 11 | L234: 7 | M234: 73 | O234: 17 | P234: 13 | Q234: 115 | S234: VENUE: WILLIAMSTOWN
A235: GEELONG WEST | C235: 2 | D235: 4 | E235: 16 | G235: 7 | H235: 9 | I235: 51 | K235: 8 | L235: 10 | M235: 58 | O235: 12 | P235: 12 | Q235: 84 | S235: MARCY :HUTCHINSON
A236: BEST PLAYERS
A237: WILLIAMSTOWN | C237: BRIERTY | F237: MORRISON | I237: McTAGGART | L237: HUGHES | O237: SAIT | R237: ROUND
A238: GEELONG WEST | C238: AUSTIN | F238: DOYLE | I238: EVANS | L238: BERRY | O238: PERKINS
A239: GOALKICKERS
A240: WILLIAMSTOWN | C240: FOTHERINGHAM 4 | G240: HUGHES 4 | I240: RICKMAN 2 | L240: DIMARTINO 2 | O240: SIMMONS 2 | R240: SAIT | T240: OWEN | W240: ROUND
A241: GEELONG WEST | C241: RICHARDSON 4 | G241: HADDOCK 3 | J241: WILSON 2 | M241: BERRY | O241: REDHEAD | Q241: JUKAWICS
A243: ROUND 6 | D243: 25TH MAY | I243: WEATHER | S243: VENUE: SPRINGVALE
D244: 1ST QTR | H244: 2ND QTR | L244: 3RD QTR | P244: FINAL | S244: UMPIRES
A245: WILLIAMSTOWN | C245: 4 | D245: 3 | E245: 27 | G245: 6 | H245: 9 | I245: 45 | K245: 11 | L245: 10 | M245: 76 | O245: 21 | P245: 14 | Q245: 140 | S245: VERGONA | X245: LADDER | AB245: ROUND | AD245: 6
A246: SPRINGVALE | C246: 3 | D246: 3 | E246: 21 | G246: 5 | H246: 3 | I246: 33 | K246: 7 | L246: 4 | M246: 46 | O246: 8 | P246: 4 | Q246: 52 | S246: PHILLIPS
A247: BEST PLAYERS | W247: TEAM | X247: W | Y247: L | Z247: D | AA247: FOR | AB247: AGST | AC247: % | AD247: PTS
A248: WILLIAMSTOWN | C248: SAIT | F248: MORRISON | I248: RICKMAN | L248: KERSHAW | O248: LANE | R248: PASTORE
A249: SPRINGVALE | C249: DEMPSTER | F249: HERBERT | W249: COBURG | X249: 5 | Y249: 1 | Z249: 0 | AA249: 886 | AB249: 582 | AC249: =(AA249/AB249)*100 -> 152.233676975945 | AD249: =(X249*4)+(Z249*2) -> 20
A250: GOALKICKERS | W250: FRANKSTON | X250: 5 | Y250: 1 | Z250: 0 | AA250: 787 | AB250: 613 | AC250: =(AA250/AB250)*100 -> 128.38499184339315 | AD250: =(X250*4)+(Z250*2) -> 20
A251: WILLIAMSTOWN | C251: RICKMAN 8 | F251: FOTHERINGHAM 7 | J251: SAIT 2 | L251: ROUND 2 | N251: HUGHES | P251: JAMES | W251: SANDRINGHAM | X251: 4 | Y251: 2 | Z251: 0 | AA251: 799 | AB251: 702 | AC251: =(AA251/AB251)*100 -> 113.81766381766383 | AD251: =(X251*4)+(Z251*2) -> 16
A252: SPRINGVALE | C252: VERNON 2 | F252: DUDLEY | H252: ANDERSON | J252: BOURKE | L252: ROBINSON | N252: NEWMAN | P252: GLASCOTT | W252: WILLIAMSTOWN | X252: 4 | Y252: 2 | Z252: 0 | AA252: 725 | AB252: 653 | AC252: =(AA252/AB252)*100 -> 111.02603369065851 | AD252: =(X252*4)+(Z252*2) -> 16
S253: VENUE: BEACH ROAD
A254: PRESTON | C254: 6 | D254: 5 | E254: 41 | G254: 10 | H254: 12 | I254: 72 | K254: 13 | L254: 16 | M254: 94 | O254: 18 | P254: 18 | Q254: 126 | S254: HUTCHINSON | W254: PRESTON | X254: 3 | Y254: 3 | Z254: 0 | AA254: 791 | AB254: 586 | AC254: =(AA254/AB254)*100 -> 134.98293515358361 | AD254: =(X254*4)+(Z254*2) -> 12
A255: SANDRINGHAM | C255: 6 | D255: 3 | E255: 39 | G255: 11 | H255: 7 | I255: 73 | K255: 16 | L255: 9 | M255: 105 | O255: 18 | P255: 17 | Q255: 125 | S255: CASEY | W255: GEELONG WEST | X255: 3 | Y255: 3 | Z255: 0 | AA255: 689 | AB255: 610 | AC255: =(AA255/AB255)*100 -> 112.95081967213115 | AD255: =(X255*4)+(Z255*2) -> 12
A256: BEST PLAYERS | W256: BRUNSWICK | X256: 3 | Y256: 3 | Z256: 0 | AA256: 650 | AB256: 748 | AC256: =(AA256/AB256)*100 -> 86.898395721925141 | AD256: =(X256*4)+(Z256*2) -> 12
A257: PRESTON | C257: SHAW | F257: FULLER | I257: BRINE | L257: SALVADORE | O257: ROSS | W257: PORT MELBOURNE | X257: 2 | Y257: 4 | Z257: 0 | AA257: 858 | AB257: 829 | AC257: =(AA257/AB257)*100 -> 103.49819059107359 | AD257: =(X257*4)+(Z257*2) -> 8
A258: SANDRINGHAM | C258: KRAKOUER | F258: PEARSON | I258: BEILBY | L258: JOHNSON | O258: PRATT | W258: SPRINGVALE | X258: 1 | Y258: 5 | Z258: 0 | AA258: 720 | AB258: 820 | AC258: =(AA258/AB258)*100 -> 87.804878048780495 | AD258: =(X258*4)+(Z258*2) -> 4
A259: GOALKICKERS | W259: CAMBERWELL | X259: 0 | Y259: 6 | Z259: 0 | AA259: 440 | AB259: 1202 | AC259: =(AA259/AB259)*100 -> 36.605657237936775 | AD259: =(X259*4)+(Z259*2) -> 0
A260: PRESTON | C260: SHAW 9 | F260: SALVADORE 3 | I260: FULLER 2 | K260: BRINE | M260: JORDAN | O260: LUMICISI | Q260: ROSS
A261: SANDRINGHAM | C261: JOHNSON 5 | E261: HOWELL 3 | G261: KRAKOUER 2 | J261: BONNEY 2 | M261: BRIAN SAID 2 | P261: PEARSON | R261: ALLEN
N262: MANNIX | Q262: DIPIERDOMENICO
A263: COBURG | C263: 7 | D263: 2 | E263: 44 | G263: 15 | H263: 7 | I263: 97 | K263: 20 | L263: 11 | M263: 131 | O263: 28 | P263: 14 | Q263: 182 | S263: VENUE: COBURG
A264: BRUNSWICK | C264: 2 | D264: 0 | E264: 12 | G264: 3 | H264: 4 | I264: 22 | K264: 3 | L264: 8 | M264: 26 | O264: 5 | P264: 9 | Q264: 39 | S264: NOLAN :McDONALD
A265: BEST PLAYERS
A266: COBURG | C266: EVANS | F266: GRAHAM | I266: ALLISON | L266: A HARBINSON | O266: SHELDON | Q266: CHRISTIANSEN
A267: BRUNSWICK | C267: BARRY | F267: McGHIE | I267: McDONALD
A268: GOALKICKERS
A269: COBURG | C269: GRAHAM 7 | F269: WEATHERALD 6 | I269: CHRISTIANSEN 5 | L269: M HARBINSON 3 | O269: HALBERT 2 | Q269: MANSFIELD 2 | T269: ALLISON | W269: FITZPATRICK | X269: TULLOCH
A270: BRUNSWICK | C270: JACKSON 3 | F270: LOVETT | I270: CALLANDER
A272: FRANKSTON | C272: 4 | D272: 2 | E272: 26 | G272: 8 | H272: 4 | I272: 52 | K272: 13 | L272: 5 | M272: 83 | O272: 22 | P272: 6 | Q272: 138 | S272: VENUE: PORT MELBOURNE
A273: PORT MELBOURNE | C273: 4 | D273: 5 | E273: 29 | G273: 9 | H273: 9 | I273: 63 | K273: 14 | L273: 12 | M273: 96 | O273: 18 | P273: 13 | Q273: 121 | S273: CASEY :RYAN
A274: BEST PLAYERS
A275: FRANKSTON | C275: SARAU | F275: McCARTY | I275: McLEISH | L275: BEATON | O275: BRIESE | R275: O'RILEY
A276: PORT MELBOURNE | C276: ALLENDER | F276: DOHERTY | I276: HARKINS | L276: HOWARD | O276: SWAN | R276: MUTIMER
A277: GOALKICKERS
A278: FRANKSTON | C278: McCARTY 11 | F278: BOLAND 3 | I278: O'RILEY 2 | K278: RAVEN 2 | M278: AMOORE | O278: FAVIER | Q278: GEDDES | S278: WHITFIELD
A279: PORT MELBOURNE | C279: DOHERTY 6 | F279: JOHNSON 3 | I279: MOURNEY 2 | L279: BAILLIE | N279: HOWARD | P279: CHADBAND | R279: CRUTCHFIELD | V279: HARKINS | X279: McDONALD | AB279: MUTIMER
A281: GEELONG WEST | C281: 5 | D281: 8 | E281: 38 | G281: 11 | H281: 12 | I281: 78 | K281: 13 | L281: 17 | M281: 95 | O281: 21 | P281: 22 | Q281: 148 | S281: VENUE: CAMBERWELL
A282: CAMBERWELL | C282: 2 | D282: 1 | E282: 13 | G282: 5 | H282: 2 | I282: 32 | K282: 8 | L282: 4 | M282: 52 | O282: 10 | P282: 6 | Q282: 66 | S282: BRADSHAW :CASEY
A283: BEST PLAYERS
A284: GEELONG WEST | C284: KRANJC | F284: AUSTIN | I284: EVANS | L284: McDOWELL | O284: DALIHAUS
A285: CAMBERWELL | C285: CONSTANTINOU | F285: FREW | I285: SCOTT | L285: ANGUS | O285: BINGLEY | R285: RAFFERTY
A286: GOALKICKERS
A287: GEELONG WEST | C287: RICHARDSON 5 | F287: JUKAWICS 3 | I287: GIBSON 3 | K287: PERKINS 2 | M287: ALFORD 2 | O287: WATT 2 | Q287: SIZER | R287: BERRY | T287: DALIHAUS | W287: TOULMIN
A288: CAMBERWELL | C288: AYLING 4 | F288: BINGLEY 3 | I288: CONSTANTINOU | L288: McKILLOP | N288: GRAY
A290: ROUND 7 | D290: 1ST JUNE | I290: WEATHER | S290: VENUE: BRUNSWICK
D291: 1ST QTR | H291: 2ND QTR | L291: 3RD QTR | P291: FINAL | S291: UMPIRES
A292: PORT MELBOURNE | C292: 3 | D292: 6 | E292: 24 | G292: 9 | H292: 14 | I292: 68 | K292: 17 | L292: 20 | M292: 122 | O292: 20 | P292: 26 | Q292: 146 | S292: MARCY | X292: LADDER | AB292: ROUND | AD292: 7
A293: BRUNSWICK | C293: 6 | D293: 4 | E293: 40 | G293: 9 | H293: 7 | I293: 61 | K293: 13 | L293: 8 | M293: 86 | O293: 17 | P293: 10 | Q293: 112 | S293: PHILLIPS
A294: BEST PLAYERS | W294: TEAM | X294: W | Y294: L | Z294: D | AA294: FOR | AB294: AGST | AC294: % | AD294: PTS
A295: PORT MELBOURNE | C295: SWAN | F295: ALLENDER | I295: MOURNEY | L295: WALL | N295: TAYLOR | Q295: RODDA
A296: BRUNSWICK | C296: JACKSON | F296: McGHIE | I296: WRIGHT | W296: COBURG | X296: 6 | Y296: 1 | Z296: 0 | AA296: 1018 | AB296: 647 | AC296: =(AA296/AB296)*100 -> 157.34157650695516 | AD296: =(X296*4)+(Z296*2) -> 24
A297: GOALKICKERS | R297: MUTIMER | W297: WILLIAMSTOWN | X297: 5 | Y297: 2 | Z297: 0 | AA297: 977 | AB297: 716 | AC297: =(AA297/AB297)*100 -> 136.45251396648044 | AD297: =(X297*4)+(Z297*2) -> 20
A298: PORT MELBOURNE | C298: MOURNEY 5 | F298: BAILLIE 4 | H298: JOHNSON 3 | J298: MCDONALD 2 | M298: SWAN 2 | O298: DOHERTY | Q298: HARKINS | S298: HOY | W298: SANDRINGHAM | X298: 5 | Y298: 2 | Z298: 0 | AA298: 953 | AB298: 784 | AC298: =(AA298/AB298)*100 -> 121.55612244897959 | AD298: =(X298*4)+(Z298*2) -> 20
A299: BRUNSWICK | C299: JACKSON 8 | F299: CALLANDER 2 | I299: CATTOGGIO 2 | L299: JUDGE 2 | N299: LOVETT | P299: WHILLAS | R299: WRIGHT | W299: FRANKSTON | X299: 5 | Y299: 2 | Z299: 0 | AA299: 893 | AB299: 745 | AC299: =(AA299/AB299)*100 -> 119.86577181208054 | AD299: =(X299*4)+(Z299*2) -> 20
S300: VENUE: PRESTON
A301: COBURG | C301: 4 | D301: 5 | E301: 29 | G301: 9 | H301: 11 | I301: 65 | K301: 13 | L301: 15 | M301: 93 | O301: 19 | P301: 18 | Q301: 132 | S301: CASEY | W301: PRESTON | X301: 3 | Y301: 4 | Z301: 0 | AA301: 856 | AB301: 718 | AC301: =(AA301/AB301)*100 -> 119.22005571030641 | AD301: =(X301*4)+(Z301*2) -> 12
A302: PRESTON | C302: 2 | D302: 2 | E302: 14 | G302: 4 | H302: 6 | I302: 30 | K302: 7 | L302: 7 | M302: 49 | O302: 9 | P302: 11 | Q302: 65 | S302: VERGONA | W302: PORT MELBOURNE | X302: 3 | Y302: 4 | Z302: 0 | AA302: 1004 | AB302: 941 | AC302: =(AA302/AB302)*100 -> 106.69500531349627 | AD302: =(X302*4)+(Z302*2) -> 12
A303: BEST PLAYERS | W303: GEELONG WEST | X303: 3 | Y303: 4 | Z303: 0 | AA303: 771 | AB303: 764 | AC303: =(AA303/AB303)*100 -> 100.91623036649216 | AD303: =(X303*4)+(Z303*2) -> 12
A304: COBURG | C304: EVANS | F304: ALLISON | I304: TULLOCH | L304: FITZPATRICK | O304: A HARBINSON | R304: GUMLEY | W304: BRUNSWICK | X304: 3 | Y304: 4 | Z304: 0 | AA304: 762 | AB304: 894 | AC304: =(AA304/AB304)*100 -> 85.234899328859058 | AD304: =(X304*4)+(Z304*2) -> 12
A305: PRESTON | C305: LUMICISI | F305: WATT | I305: BRADDY | L305: FROST | O305: PLOWMAN | W305: SPRINGVALE | X305: 2 | Y305: 5 | Z305: 0 | AA305: 852 | AB305: 926 | AC305: =(AA305/AB305)*100 -> 92.008639308855294 | AD305: =(X305*4)+(Z305*2) -> 8
A306: GOALKICKERS | P306: CLEARY | R306: GRAHAM | W306: CAMBERWELL | X306: 0 | Y306: 7 | Z306: 0 | AA306: 503 | AB306: 1454 | AC306: =(AA306/AB306)*100 -> 34.59422283356259 | AD306: =(X306*4)+(Z306*2) -> 0
A307: COBURG | C307: WEATHERALD 6 | F307: GUMLEY 4 | I307: CHRISTIANSEN 2 | L307: HALBERT 2 | N307: FITZPATRICK | Q307: MANSFIELD
A308: PRESTON | C308: SHAW 3 | F308: SALVADORE 2 | I308: YEOMANS | K308: WATT | M308: FULLER | O308: LUMICISI
A310: SANDRINGHAM | C310: 5 | D310: 3 | E310: 33 | G310: 9 | H310: 7 | I310: 61 | K310: 16 | L310: 12 | M310: 108 | O310: 23 | P310: 16 | Q310: 154 | S310: VENUE: GEELONG WEST
A311: GEELONG WEST | C311: 4 | D311: 3 | E311: 27 | G311: 7 | H311: 7 | I311: 49 | K311: 8 | L311: 9 | M311: 57 | O311: 12 | P311: 10 | Q311: 82 | S311: NOLAN :CASEY
A312: BEST PLAYERS
A313: SANDRINGHAM | C313: HOWELL | F313: HENDERSON | I313: GOROZIDIS | L313: HETHERINGTON | O313: PRATT | Q313: KRAKOUER
A314: GEELONG WEST | C314: KRANJC | F314: AUSTEN | I314: McDOWELL | L314: ALTON | O314: PERKINS
A315: GOALKICKERS
A316: SANDRINGHAM | C316: GOROZIDIS 10 | F316: KRAKOUER 3 | I316: JOHNSON 3 | L316: HOWELL 2 | N316: SAID | P316: PEARSON | R316: MACLEOD | U316: ALLEN | W316: MANNIX
A317: GEELONG WEST | C317: JUKAWICZ 3 | F317: BERRY 2 | H317: WATT 2 | J317: GIBSON | L317: SHEA | N317: RICHARDSON | Q317: McDOWELL | T317: ALTON | V317: PERKINS
A319: SPRINGVALE | C319: 3 | D319: 2 | E319: 20 | G319: 7 | H319: 4 | I319: 46 | K319: 11 | L319: 8 | M319: 74 | O319: 20 | P319: 12 | Q319: 132 | S319: VENUE: FRANKSTON
A320: FRANKSTON | C320: 2 | D320: 2 | E320: 14 | G320: 7 | H320: 7 | I320: 49 | K320: 12 | L320: 11 | M320: 83 | O320: 15 | P320: 16 | Q320: 106 | S320: GLEESON :HUTCHINSON
A321: BEST PLAYERS
A322: SPRINGVALE | C322: ANDERSON | F322: DUDLEY | I322: ROBINSON | L322: LARSON | O322: HERBERT
A323: FRANKSTON | C323: SARAU | F323: HUTCHINSON | I323: GEDDES | L323: COUGHLAN
A324: GOALKICKERS
A325: SPRINGVALE | C325: ANDERSON 4 | F325: ROBINSON 4 | I325: DUDLEY 3 | K325: BOURKE 2 | M325: HOLDEN 2 | O325: HERBERT | Q325: NICOL | R325: LARSON | U325: HOGAN | X325: LE POIDEVAN
A326: FRANKSTON | C326: COUGHLAN 3 | F326: O'RILEY 2 | H326: WHITFIELD 2 | K326: BEATON | M326: BOLAND | O326: COLE | Q326: GEDDES | S326: HUTCHINSON | W326: McCARTY | X326: SANFORD | AA326: SARAU
A328: WILLIAMSTOWN | C328: 9 | D328: 5 | E328: 59 | G328: 20 | H328: 11 | I328: 131 | K328: 30 | L328: 19 | M328: 199 | O328: 38 | P328: 24 | Q328: 252 | S328: VENUE: WILLIAMSTOWN
A329: CAMBERWELL | C329: 3 | D329: 2 | E329: 20 | G329: 4 | H329: 4 | I329: 28 | K329: 7 | L329: 6 | M329: 48 | O329: 9 | P329: 9 | Q329: 63 | S329: RYAN :MITCHELL
A330: BEST PLAYERS
A331: WILLIAMSTOWN | C331: PASTORE | F331: HUGHES | I331: KERSHAW | L331: McTAGGART | O331: SUMMERS | R331: ROUND
A332: CAMBERWELL | C332: McKENZIE | F332: MAILING | I332: DREW | L332: FREW | O332: CONSTANTINOU | R332: McFEE
A333: GOALKICKERS | Q333: SAIT | S333: WEIR
A334: WILLIAMSTOWN | C334: SEMMONS 9 | F334: FOTHERINGHAM 7 | J334: RICKMAN 5 | M334: ROUND 4 | O334: HUGHES 4 | Q334: SLEVISON 2 | T334: LANE | V334: McTAGGART | X334: KERSHAW | AA334: BRIERTY | AC334: MORRISON
A335: CAMBERWELL | C335: AYLING 4 | F335: BINGLEY 2 | I335: WILGAR | K335: McKENZIE | M335: STAFFERI
A337: ROUND 8 | D337: 15TH JUNE | I337: WEATHER | S337: VENUE: FRANKSTON
D338: 1ST QTR | H338: 2ND QTR | L338: 3RD QTR | P338: FINAL | S338: UMPIRES
A339: FRANKSTON | C339: 3 | D339: 3 | E339: 21 | G339: 6 | H339: 4 | I339: 40 | K339: 12 | L339: 9 | M339: 81 | O339: 15 | P339: 12 | Q339: 102 | S339: CASEY | X339: LADDER | AB339: ROUND | AD339: 8
A340: WILLIAMSTOWN | C340: 3 | D340: 2 | E340: 20 | G340: 7 | H340: 4 | I340: 46 | K340: 7 | L340: 6 | M340: 48 | O340: 13 | P340: 10 | Q340: 88 | S340: PHILLIPS
A341: BEST PLAYERS | W341: TEAM | X341: W | Y341: L | Z341: D | AA341: FOR | AB341: AGST | AC341: % | AD341: PTS
A342: FRANKSTON | C342: RAVEN | F342: BRIESE | I342: BELL | K342: BEATON | N342: GEDDES | Q342: HUTCHINSON
A343: WILLIAMSTOWN | C343: DIMARTINO | F343: McTAGGART | I343: LANE | K343: PASTORE | N343: KERSHAW | W343: COBURG | X343: 7 | Y343: 1 | Z343: 0 | AA343: 1150 | AB343: 734 | AC343: =(AA343/AB343)*100 -> 156.67574931880108 | AD343: =(X343*4)+(Z343*2) -> 28
A344: GOALKICKERS | W344: SANDRINGHAM | X344: 6 | Y344: 2 | Z344: 0 | AA344: 1077 | AB344: 878 | AC344: =(AA344/AB344)*100 -> 122.66514806378133 | AD344: =(X344*4)+(Z344*2) -> 24
A345: FRANKSTON | C345: McCARTY 6 | F345: BELL 2 | H345: GEDDES 2 | J345: WHITFIELD 2 | M345: BEATON | O345: HUTCHINSON | R345: SARAU | W345: FRANKSTON | X345: 6 | Y345: 2 | Z345: 0 | AA345: 995 | AB345: 833 | AC345: =(AA345/AB345)*100 -> 119.44777911164466 | AD345: =(X345*4)+(Z345*2) -> 24
A346: WILLIAMSTOWN | C346: FOTHERINGHAM 5 | G346: ROUND 2 | I346: RICKMAN | K346: SLEVISON | M346: HUGHES | O346: WEIR | Q346: SMITH | S346: GIBSON | W346: WILLIAMSTOWN | X346: 5 | Y346: 3 | Z346: 0 | AA346: 1065 | AB346: 818 | AC346: =(AA346/AB346)*100 -> 130.19559902200487 | AD346: =(X346*4)+(Z346*2) -> 20
S347: VENUE: COBURG
A348: COBURG | C348: 4 | D348: 4 | E348: 28 | G348: 6 | H348: 10 | I348: 46 | K348: 14 | L348: 16 | M348: 100 | O348: 19 | P348: 18 | Q348: 132 | S348: GLEESON | W348: PORT MELBOURNE | X348: 4 | Y348: 4 | Z348: 0 | AA348: 1133 | AB348: 1051 | AC348: =(AA348/AB348)*100 -> 107.80209324452903 | AD348: =(X348*4)+(Z348*2) -> 16
A349: GEELONG WEST | C349: 2 | D349: 4 | E349: 16 | G349: 6 | H349: 10 | I349: 46 | K349: 8 | L349: 11 | M349: 59 | O349: 12 | P349: 15 | Q349: 87 | S349: MARCY | W349: BRUNSWICK | X349: 4 | Y349: 4 | Z349: 0 | AA349: 893 | AB349: 999 | AC349: =(AA349/AB349)*100 -> 89.389389389389379 | AD349: =(X349*4)+(Z349*2) -> 16
A350: BEST PLAYERS | W350: PRESTON | X350: 3 | Y350: 5 | Z350: 0 | AA350: 966 | AB350: 847 | AC350: =(AA350/AB350)*100 -> 114.0495867768595 | AD350: =(X350*4)+(Z350*2) -> 12
A351: COBURG | C351: ALLISON | F351: SHELDON | I351: NIMMO | L351: HALBERT | O351: CHRISTIANSEN | R351: EVANS | W351: GEELONG WEST | X351: 3 | Y351: 5 | Z351: 0 | AA351: 858 | AB351: 896 | AC351: =(AA351/AB351)*100 -> 95.758928571428569 | AD351: =(X351*4)+(Z351*2) -> 12
A352: GEELONG WEST | C352: WATT | F352: McDOWELL | I352: DOYLE | L352: BERRY | O352: THIELE | W352: SPRINGVALE | X352: 2 | Y352: 6 | Z352: 0 | AA352: 957 | AB352: 1057 | AC352: =(AA352/AB352)*100 -> 90.539262062440869 | AD352: =(X352*4)+(Z352*2) -> 8
A353: GOALKICKERS | I353: WEATHERALD | L353: FITZPATRICK | O353: MANSFIELD | Q353: SHELDON | W353: CAMBERWELL | X353: 0 | Y353: 8 | Z353: 0 | AA353: 597 | AB353: 1578 | AC353: =(AA353/AB353)*100 -> 37.832699619771866 | AD353: =(X353*4)+(Z353*2) -> 0
A354: COBURG | C354: GRAHAM 5 | E354: HALBERT 3 | G354: CHRISTIANSEN 2 | J354: EADE | L354: ALLISON | N354: A HARBINSON | Q354: M HARBINSON | T354: GUMLEY
A355: GEELONG WEST | C355: ALFORD 3 | F355: BERRY 3 | H355: WATT | J355: HADDOCK | M355: RICHARDSON | P355: McDOWELL | S355: THIELE
O356: ALEXANDER
A357: PORT MELBOURNE | C357: 2 | D357: 3 | E357: 15 | G357: 6 | H357: 6 | I357: 42 | K357: 14 | L357: 16 | M357: 100 | O357: 18 | P357: 21 | Q357: 129 | S357: VENUE: PORT MELBOURNE
A358: PRESTON | C358: 6 | D358: 7 | E358: 43 | G358: 9 | H358: 14 | I358: 68 | K358: 12 | L358: 16 | M358: 88 | O358: 15 | P358: 20 | Q358: 110 | S358: MARSHALL :NOLAN
A359: BEST PLAYERS
A360: PORT MELBOURNE | C360: RODDA | F360: CHADBAND | I360: WALL | L360: McDONALD | O360: ROSS | Q360: P JOHNSON
A361: PRESTON | C361: BRINE | F361: DUNBAR | I361: SHAW | L361: BROWN
A362: GOALKICKERS
A363: PORT MELBOURNE | C363: COOPER 4 | F363: McDONALD 4 | I363: BAILLIE 2 | K363: DOHERTY 2 | M363: P JOHNSON 2 | P363: CARTER | R363: JENNINGS | U363: MOURNEY | X363: WALL
A364: PRESTON | C364: SHAW 8 | F364: JORDAN 3 | I364: FROST | K364: TURNER | M364: CARLSON | O364: SALVADORE
A366: BRUNSWICK | C366: 7 | D366: 3 | E366: 45 | G366: 12 | H366: 7 | I366: 79 | K366: 16 | L366: 12 | M366: 108 | O366: 19 | P366: 17 | Q366: 131 | S366: VENUE: SPRINGVALE
A367: SPRINGVALE | C367: 4 | D367: 3 | E367: 27 | G367: 7 | H367: 7 | I367: 49 | K367: 12 | L367: 11 | M367: 83 | O367: 15 | P367: 15 | Q367: 105 | S367: BRADSHAW :CASEY
A368: BEST PLAYERS
A369: BRUNSWICK | C369: WRIGHT | F369: DOYLE | I369: BARRY | L369: McGHIE | O369: DUGDALE | R369: WHILLAS
A370: SPRINGVALE | C370: MALONI | F370: DEMPSTER | I370: HERBERT | L370: MORGAN | O370: LETTS
A371: GOALKICKERS
A372: BRUNSWICK | C372: JACKSON 5 | F372: WHILLAS 3 | I372: CATTOGGIO 3 | L372: WEST 2 | N372: GIBSON 2 | P372: PARSONS 2 | S372: JUDGE | U372: WRIGHT
A373: SPRINGVALE | C373: ROBINSON 4 | F373: ANDERSON 3 | I373: BOURKE 3 | K373: MORGAN 3 | N373: DUDLEY | P373: HIPWORTH
A375: SANDRINGHAM | C375: 3 | D375: 5 | E375: 23 | G375: 9 | H375: 12 | I375: 66 | K375: 13 | L375: 15 | M375: 93 | O375: 17 | P375: 22 | Q375: 124 | S375: VENUE: BEACH ROAD
A376: CAMBERWELL | C376: 3 | D376: 5 | E376: 23 | G376: 7 | H376: 9 | I376: 51 | K376: 12 | L376: 14 | M376: 86 | O376: 13 | P376: 16 | Q376: 94 | S376: MCDONALD :COOK
A377: BEST PLAYERS
A378: SANDRINGHAM | C378: BRENDAN SAID | F378: HOWELL | I378: MACLEOD | L378: MANNIX | O378: BEILBY
A379: CAMBERWELL | C379: AYLEN | F379: BINGLEY | I379: WEST | L379: MAILING
A380: GOALKICKERS
A381: SANDRINGHAM | C381: HOWELL 6 | F381: MACLEOD 3 | I381: GOROZIDIS 2 | L381: JOHNSON 2 | O381: ALLEN | Q381: PRATT | S381: EAVES | U381: BRIAN SAID
A382: CAMBERWELL | C382: AYLEN 5 | F382: BINGLEY 3 | I382: WEST 2 | K382: MAILING 2 | N382: JAKOBI
A384: ROUND 9 | D384: 22ND JUNE | I384: WEATHER | S384: VENUE: BRUNSWICK
D385: 1ST QTR | H385: 2ND QTR | L385: 3RD QTR | P385: FINAL | S385: UMPIRES
A386: FRANKSTON | C386: 5 | D386: 6 | E386: 36 | G386: 7 | H386: 10 | I386: 52 | K386: 16 | L386: 17 | M386: 113 | O386: 17 | P386: 21 | Q386: 123 | S386: VERGONA | X386: LADDER | AB386: ROUND | AD386: 9
A387: BRUNSWICK | C387: 1 | D387: 2 | E387: 8 | G387: 3 | H387: 2 | I387: 20 | K387: 4 | L387: 2 | M387: 26 | O387: 9 | P387: 5 | Q387: 59 | S387: MARSHALL
A388: BEST PLAYERS | W388: TEAM | X388: W | Y388: L | Z388: D | AA388: FOR | AB388: AGST | AC388: % | AD388: PTS
A389: FRANKSTON | C389: McCARTY | F389: HUTCHINSON | I389: RAVEN | L389: MOORE | O389: BEATON | R389: O'RILEY
A390: BRUNSWICK | C390: BARRY | F390: EDWARDS | I390: WEST | L390: DUGDALE | O390: BAKER | W390: COBURG | X390: 8 | Y390: 1 | Z390: 0 | AA390: 1388 | AB390: 772 | AC390: =(AA390/AB390)*100 -> 179.79274611398964 | AD390: =(X390*4)+(Z390*2) -> 32
A391: GOALKICKERS | W391: FRANKSTON | X391: 7 | Y391: 2 | Z391: 0 | AA391: 1118 | AB391: 892 | AC391: =(AA391/AB391)*100 -> 125.33632286995515 | AD391: =(X391*4)+(Z391*2) -> 28
A392: FRANKSTON | C392: McCARTY 10 | F392: MOORE 4 | I392: LANE | K392: WHITFIELD | N392: DAFF | W392: WILLIAMSTOWN | X392: 6 | Y392: 3 | Z392: 0 | AA392: 1156 | AB392: 899 | AC392: =(AA392/AB392)*100 -> 128.58731924360401 | AD392: =(X392*4)+(Z392*2) -> 24
A393: BRUNSWICK | C393: WEST 2 | E393: SIMS | F393: JACKSON | H393: BICKLEY | J393: EDWARDS | M393: CALLANDER | P393: FLOWER | R393: BARRY | W393: SANDRINGHAM | X393: 6 | Y393: 3 | Z393: 0 | AA393: 1158 | AB393: 969 | AC393: =(AA393/AB393)*100 -> 119.50464396284831 | AD393: =(X393*4)+(Z393*2) -> 24
S394: VENUE: PRESTON
A395: PRESTON | C395: 6 | D395: 5 | E395: 41 | G395: 13 | H395: 8 | I395: 86 | K395: 22 | L395: 11 | M395: 143 | O395: 31 | P395: 13 | Q395: 199 | S395: McDONALD | W395: PORT MELBOURNE | X395: 5 | Y395: 4 | Z395: 0 | AA395: 1276 | AB395: 1132 | AC395: =(AA395/AB395)*100 -> 112.72084805653711 | AD395: =(X395*4)+(Z395*2) -> 20
A396: SPRINGVALE | C396: 4 | D396: 1 | E396: 25 | G396: 6 | H396: 2 | I396: 38 | K396: 7 | L396: 4 | M396: 46 | O396: 10 | P396: 5 | Q396: 65 | S396: RYAN | W396: PRESTON | X396: 4 | Y396: 5 | Z396: 0 | AA396: 1165 | AB396: 912 | AC396: =(AA396/AB396)*100 -> 127.74122807017542 | AD396: =(X396*4)+(Z396*2) -> 16
A397: BEST PLAYERS | W397: BRUNSWICK | X397: 4 | Y397: 5 | Z397: 0 | AA397: 952 | AB397: 1122 | AC397: =(AA397/AB397)*100 -> 84.848484848484844 | AD397: =(X397*4)+(Z397*2) -> 16
A398: PRESTON | C398: FROST | F398: HUNT | I398: DUNBAR | L398: SHAW | O398: LUMICISI | R398: BRINE | W398: GEELONG WEST | X398: 3 | Y398: 6 | Z398: 0 | AA398: 939 | AB398: 1039 | AC398: =(AA398/AB398)*100 -> 90.37536092396536 | AD398: =(X398*4)+(Z398*2) -> 12
A399: SPRINGVALE | C399: NICOL | F399: KEAYS | I399: BOURKE | L399: ANDERSON | W399: SPRINGVALE | X399: 2 | Y399: 7 | Z399: 0 | AA399: 1022 | AB399: 1256 | AC399: =(AA399/AB399)*100 -> 81.369426751592357 | AD399: =(X399*4)+(Z399*2) -> 8
A400: GOALKICKERS | O400: JORDAN | R400: PRIDEAUX | W400: CAMBERWELL | X400: 0 | Y400: 9 | Z400: 0 | AA400: 635 | AB400: 1816 | AC400: =(AA400/AB400)*100 -> 34.966960352422909 | AD400: =(X400*4)+(Z400*2) -> 0
A401: PRESTON | C401: SHAW 13 | F401: CARLSON 4 | I401: LUMICISI 4 | K401: DUNBAR 4 | M401: FROST 2 | O401: SALVADORE | R401: HUNT
A402: SPRINGVALE | C402: DUDLEY 2 | F402: ANDERSON 2 | I402: MALONI 2 | K402: CLARKE 2 | N402: ROBINSON | Q402: MATTINGLY
A404: PORT MELBOURNE | C404: 3 | D404: 4 | E404: 22 | G404: 7 | H404: 13 | I404: 55 | K404: 9 | L404: 19 | M404: 73 | O404: 20 | P404: 23 | Q404: 143 | S404: VENUE: GEELONG WEST
A405: GEELONG WEST | C405: 2 | D405: 6 | E405: 18 | G405: 4 | H405: 9 | I405: 33 | K405: 6 | L405: 11 | M405: 47 | O405: 11 | P405: 15 | Q405: 81 | S405: COOPE :PHILLIPS
A406: BEST PLAYERS
A407: PORT MELBOURNE | C407: WALL | F407: CARTER | I407: MOURNEY | L407: JENNINGS | O407: JOHNSON | R407: HARKINS
A408: GEELONG WEST | C408: REDHEAD | F408: DOYLE | I408: MORRISSEY | L408: PERKINS | O408: EVANS
A409: GOALKICKERS
A410: PORT MELBOURNE | C410: MOURNEY 6 | F410: JOHNSON 3 | I410: HOWARD 3 | L410: MCDONALD 2 | O410: JENNINGS 2 | Q410: HARKINS 2 | T410: CARTER | W410: METCALFE
A411: GEELONG WEST | C411: THIELE 3 | E411: ALFORD 2 | G411: MORRISSEY 2 | J411: PETHO | L411: RICHARDSON | O411: HADDOCK | Q411: MCDOWELL
A413: COBURG | C413: 2 | D413: 7 | E413: 19 | G413: 11 | H413: 13 | I413: 79 | K413: 23 | L413: 19 | M413: 157 | O413: 36 | P413: 22 | Q413: 238 | S413: VENUE: CAMBERWELL
A414: CAMBERWELL | C414: 1 | D414: 3 | E414: 9 | G414: 3 | H414: 4 | I414: 22 | K414: 3 | L414: 5 | M414: 23 | O414: 5 | P414: 8 | Q414: 38
A415: BEST PLAYERS
A416: COBURG | C416: CHRISTIANSEN | F416: SHELDON | I416: CLEARY | L416: EADE | O416: GRAHAM | R416: LAIDLER
A417: CAMBERWELL | C417: CONSTANTINOU | F417: WILGAR | I417: ANGUS | L417: STAFFERI | O417: DE KONNING
A418: GOALKICKERS
A419: COBURG | C419: WEATHERALD 10 | G419: CHRISTIANSEN 6 | J419: CLEARY 5 | L419: GRAHAM 5 | N419: M HARBINSON 3 | R419: HALBERT 2 | U419: LAIDLER 2 | X419: MANSFIELD | AA419: ALLISON | AC419: GIBB
A420: CAMBERWELL | C420: AYLEN 2 | F420: BINGLEY 2 | I420: DYSON
A422: WILLIAMSTOWN | C422: 5 | D422: 5 | E422: 35 | G422: 5 | H422: 8 | I422: 38 | K422: 9 | L422: 13 | M422: 67 | O422: 13 | P422: 13 | Q422: 91 | S422: VENUE: WILLIAMSTOWN
A423: SANDRINGHAM | C423: 2 | D423: 0 | E423: 12 | G423: 7 | H423: 8 | I423: 50 | K423: 8 | L423: 11 | M423: 59 | O423: 11 | P423: 15 | Q423: 81 | S423: MARCY :GLEESON
A424: BEST PLAYERS
A425: WILLIAMSTOWN | C425: DIMARTINO | F425: PASTORE | I425: MURPHY | L425: GIBSON | O425: ROUND | Q425: McTAGGART
A426: SANDRINGHAM | C426: KRISTENSEN | F426: HENDERSON | I426: BEILBY | L426: PRATT
A427: GOALKICKERS
A428: WILLIAMSTOWN | C428: ROUND 3 | F428: COOPER 2 | I428: FOTHERINGHAM 2 | M428: GIBSON 2 | O428: LANE | Q428: SIMMONS | S428: SLEVISON | V428: SMITH
A429: SANDRINGHAM | C429: EAVES 3 | F429: HOWELL 2 | I429: KRAKOUER 2 | L429: MACLEOD | N429: GOROZIDIS | Q429: BONNEY | S429: KRISTENSEN
A431: ROUND 10 | D431: 29TH JUNE | I431: WEATHER | S431: VENUE: BEACH ROAD
D432: 1ST QTR | H432: 2ND QTR | L432: 3RD QTR | P432: FINAL | S432: UMPIRES
A433: COBURG | C433: 3 | D433: 6 | E433: 24 | G433: 7 | H433: 7 | I433: 49 | K433: 14 | L433: 9 | M433: 93 | O433: 17 | P433: 16 | Q433: 118 | S433: RYAN | X433: LADDER | AB433: ROUND | AD433: 10
A434: SANDRINGHAM | C434: 3 | D434: 4 | E434: 22 | G434: 7 | H434: 10 | I434: 52 | K434: 11 | L434: 13 | M434: 79 | O434: 17 | P434: 15 | Q434: 117 | S434: MARSHALL
A435: BEST PLAYERS | W435: TEAM | X435: W | Y435: L | Z435: D | AA435: FOR | AB435: AGST | AC435: % | AD435: PTS
A436: COBURG | C436: CHRISTIANSEN | F436: CLEARY | I436: TULLOCH | L436: A HARBINSON | O436: HALBERT | R436: COLLINS
A437: SANDRINGHAM | C437: KRISTENSEN | F437: BEILBY | I437: HENDERSON | L437: HETHERINGTON | O437: MERCER | R437: BONNEY | W437: COBURG | X437: 9 | Y437: 1 | Z437: 0 | AA437: 1506 | AB437: 889 | AC437: =(AA437/AB437)*100 -> 169.40382452193475 | AD437: =(X437*4)+(Z437*2) -> 36
A438: GOALKICKERS | W438: WILLIAMSTOWN | X438: 7 | Y438: 3 | Z438: 0 | AA438: 1291 | AB438: 997 | AC438: =(AA438/AB438)*100 -> 129.48846539618856 | AD438: =(X438*4)+(Z438*2) -> 28
A439: COBURG | C439: CHRISTIANSEN 4 | F439: WEATHERALD 4 | I439: HALBERT 2 | L439: M HARBINSON 2 | O439: CLEARY 2 | Q439: GRAHAM 2 | S439: MANSFIELD | W439: FRANKSTON | X439: 7 | Y439: 3 | Z439: 0 | AA439: 1221 | AB439: 1036 | AC439: =(AA439/AB439)*100 -> 117.85714285714286 | AD439: =(X439*4)+(Z439*2) -> 28
A440: SANDRINGHAM | C440: HETHERINGTON 5 | F440: MONCRIEFF 4 | I440: ALLEN 2 | K440: SAID | L440: KRISTENSEN | O440: MANNIX | Q440: EAVES | S440: BERGMAN | W440: PORT MELBOURNE | X440: 6 | Y440: 4 | Z440: 0 | AA440: 1468 | AB440: 1232 | AC440: =(AA440/AB440)*100 -> 119.15584415584415 | AD440: =(X440*4)+(Z440*2) -> 24
S441: VENUE: PRESTON
A442: PRESTON | C442: 8 | D442: 4 | E442: 52 | G442: 14 | H442: 7 | I442: 91 | K442: 17 | L442: 12 | M442: 114 | O442: 21 | P442: 18 | Q442: 144 | S442: MARCY | W442: SANDRINGHAM | X442: 6 | Y442: 4 | Z442: 0 | AA442: 1275 | AB442: 1087 | AC442: =(AA442/AB442)*100 -> 117.29530818767249 | AD442: =(X442*4)+(Z442*2) -> 24
A443: FRANKSTON | C443: 1 | D443: 1 | E443: 7 | G443: 3 | H443: 3 | I443: 21 | K443: 11 | L443: 9 | M443: 75 | O443: 15 | P443: 13 | Q443: 103 | S443: BRADSHAW | W443: PRESTON | X443: 5 | Y443: 5 | Z443: 0 | AA443: 1309 | AB443: 1015 | AC443: =(AA443/AB443)*100 -> 128.9655172413793 | AD443: =(X443*4)+(Z443*2) -> 20
A444: BEST PLAYERS | W444: BRUNSWICK | X444: 4 | Y444: 6 | Z444: 0 | AA444: 1050 | AB444: 1257 | AC444: =(AA444/AB444)*100 -> 83.532219570405729 | AD444: =(X444*4)+(Z444*2) -> 16
A445: PRESTON | C445: SALVADORE | F445: JORDAN | I445: BRINE | L445: SHAW | O445: DUNBAR | R445: HUNT | W445: GEELONG WEST | X445: 3 | Y445: 7 | Z445: 0 | AA445: 1024 | AB445: 1126 | AC445: =(AA445/AB445)*100 -> 90.941385435168741 | AD445: =(X445*4)+(Z445*2) -> 12
A446: FRANKSTON | C446: BEATON | F446: WHITFIELD | I446: O'RILEY | L446: MCCARTY | W446: SPRINGVALE | X446: 3 | Y446: 7 | Z446: 0 | AA446: 1109 | AB446: 1341 | AC446: =(AA446/AB446)*100 -> 82.699478001491428 | AD446: =(X446*4)+(Z446*2) -> 12
A447: GOALKICKERS | W447: CAMBERWELL | X447: 0 | Y447: 10 | Z447: 0 | AA447: 735 | AB447: 2008 | AC447: =(AA447/AB447)*100 -> 36.603585657370516 | AD447: =(X447*4)+(Z447*2) -> 0
A448: PRESTON | C448: SHAW 10 | F448: CARLSON 4 | I448: PLOWMAN 3 | L448: SALVADORE 2 | O448: BRINE | Q448: FROST
A449: FRANKSTON | C449: McCARTY 7 | F449: DAFF 3 | H449: LANE | J449: BEATON | L449: BOLAND | N449: PAYNTER | Q449: SARAU
A451: SPRINGVALE | C451: 6 | D451: 4 | E451: 40 | G451: 7 | H451: 6 | I451: 48 | K451: 12 | L451: 10 | M451: 82 | O451: 12 | P451: 15 | Q451: 87 | S451: VENUE: GEELONG WEST
A452: GEELONG WEST | C452: 2 | D452: 3 | E452: 15 | G452: 4 | H452: 5 | I452: 29 | K452: 9 | L452: 6 | M452: 60 | O452: 12 | P452: 13 | Q452: 85 | S452: CASEY ;NOLAN
A453: BEST PLAYERS
A454: SPRINGVALE | C454: LETTS | F454: HERBERT | I454: KEAYS | L454: MALONI | O454: MEADE | R454: ROBINSON
A455: GEELONG WEST | C455: KRANJC | F455: WATT | I455: DALIHAUS | L455: REDHEAD | O455: NORTH | R455: McDOWELL
A456: GOALKICKERS
A457: SPRINGVALE | C457: ROBINSON 4 | F457: WARD 2 | H457: DEMPSTER | K457: MEADE | M457: HIPWORTH | O457: MATTINGLY | R457: MORGAN | U457: JEFFS
A458: GEELONG WEST | C458: MCDOWELL 4 | F458: MORRISSEY 2 | I458: REDHEAD 2 | L458: HADDOCK | N458: GIBSON | P458: WEST | R458: THIELE
A460: PORT MELBOURNE | C460: 4 | D460: 4 | E460: 28 | G460: 10 | H460: 8 | I460: 68 | K460: 18 | L460: 14 | M460: 122 | O460: 29 | P460: 18 | Q460: 192 | S460: VENUE: CAMBERWELL
A461: CAMBERWELL | C461: 5 | D461: 7 | E461: 37 | G461: 8 | H461: 11 | I461: 59 | K461: 10 | L461: 18 | M461: 78 | O461: 13 | P461: 22 | Q461: 100 | S461: GLEESON :HULM
A462: BEST PLAYERS
A463: PORT MELBOURNE | C463: ROSS | F463: CARTER | I463: HARKINS | L463: HICKS | O463: CHADBAND | R463: MCDONALD
A464: CAMBERWELL | C464: FREW | F464: DREW | I464: ANGUS | L464: CONSTANTINOU | O464: MAILING | R464: WEST
A465: GOALKICKERS
A466: PORT MELBOURNE | C466: HICKS 6 | E466: MCDONALD 6 | H466: HARKINS 5 | K466: DOHERTY 4 | M466: HOWARD 3 | P466: METCALFE 3 | S466: CARTER | V466: MUTIMER
A467: CAMBERWELL | C467: AYLING 4 | F467: WEST 3 | H467: MAILING 3 | K467: FREW | M467: BINGLEY | O467: RAFFERTY
A469: WILLIAMSTOWN | C469: 6 | D469: 4 | E469: 40 | G469: 8 | H469: 6 | I469: 54 | K469: 14 | L469: 11 | M469: 95 | O469: 20 | P469: 15 | Q469: 135 | S469: VENUE: WILLIAMSTOWN
A470: BRUNSWICK | C470: 6 | D470: 2 | E470: 38 | G470: 9 | H470: 7 | I470: 61 | K470: 10 | L470: 11 | M470: 71 | O470: 14 | P470: 14 | Q470: 98 | S470: COOKE :MCDONALD
A471: BEST PLAYERS
A472: WILLIAMSTOWN | C472: MURPHY | F472: SLEVISON | I472: PASTORE | L472: McTAGGART | O472: KERSHAW
A473: BRUNSWICK | C473: POTTER | F473: DUGDALE | I473: THOROGOOD | L473: WEST | O473: EDWARDS
A474: GOALKICKERS
A475: WILLIAMSTOWN | C475: FOTHERINGHAM 7 | G475: SIMMONS 3 | I475: ROUND 2 | K475: SMITH 2 | M475: MCTAGGART | P475: LANE | Q475: COOPER | S475: SLEVISON | V475: MUSCIALLI | X475: GIBSON
A476: BRUNSWICK | C476: POTTER 4 | F476: REID 2 | H476: EDWARDS 2 | K476: BAKER | M476: GIBSON | O476: HERBERT | Q476: LEAHY | S476: PARSONS | V476: WHILLAS
A478: ROUND 11 | D478: 6TH JULY | I478: WEATHER | S478: VENUE: BRUNSWICK
D479: 1ST QTR | H479: 2ND QTR | L479: 3RD QTR | P479: FINAL | S479: UMPIRES
A480: PRESTON | C480: 3 | D480: 0 | E480: 18 | G480: 6 | H480: 4 | I480: 40 | K480: 12 | L480: 6 | M480: 78 | O480: 14 | P480: 11 | Q480: 95 | S480: GLEESON | X480: LADDER | AB480: ROUND | AD480: 11
A481: BRUNSWICK | C481: 4 | D481: 3 | E481: 27 | G481: 8 | H481: 5 | I481: 53 | K481: 12 | L481: 9 | M481: 81 | O481: 12 | P481: 17 | Q481: 89 | S481: RYAN
A482: BEST PLAYERS | W482: TEAM | X482: W | Y482: L | Z482: D | AA482: FOR | AB482: AGST | AC482: % | AD482: PTS
A483: PRESTON | C483: SALVADORE | F483: JORDAN | I483: TOWAN | L483: FROST | O483: DUNBAR | R483: PRIDEAUX
A484: BRUNSWICK | C484: SMITH | F484: THOROGOOD | I484: DUGDALE | L484: LEYDIN | O484: REID | R484: POTTER | W484: COBURG | X484: 10 | Y484: 1 | Z484: 0 | AA484: 1633 | AB484: 1009 | AC484: =(AA484/AB484)*100 -> 161.84340931615461 | AD484: =(X484*4)+(Z484*2) -> 40
A485: GOALKICKERS | W485: FRANKSTON | X485: 8 | Y485: 3 | Z485: 0 | AA485: 1364 | AB485: 1129 | AC485: =(AA485/AB485)*100 -> 120.814880425155 | AD485: =(X485*4)+(Z485*2) -> 32
A486: PRESTON | C486: SHAW 5 | F486: CARLSON 2 | I486: COOPER 2 | K486: FROST 2 | M486: SALVADORE 2 | P486: JORDAN | W486: WILLIAMSTOWN | X486: 7 | Y486: 4 | Z486: 0 | AA486: 1411 | AB486: 1124 | AC486: =(AA486/AB486)*100 -> 125.53380782918148 | AD486: =(X486*4)+(Z486*2) -> 28
A487: BRUNSWICK | C487: POTTER 5 | F487: WRIGHT 2 | I487: EDWARDS | L487: LEAHY | N487: PARSONS | P487: JACKSON | R487: REID | W487: PORT MELBOURNE | X487: 7 | Y487: 4 | Z487: 0 | AA487: 1577 | AB487: 1316 | AC487: =(AA487/AB487)*100 -> 119.83282674772036 | AD487: =(X487*4)+(Z487*2) -> 28
S488: VENUE: PORT MELBOURNE
A489: PORT MELBOURNE | C489: 3 | D489: 3 | E489: 21 | G489: 8 | H489: 7 | I489: 55 | K489: 12 | L489: 12 | M489: 84 | O489: 16 | P489: 13 | Q489: 109 | S489: CASEY | W489: PRESTON | X489: 6 | Y489: 5 | Z489: 0 | AA489: 1404 | AB489: 1104 | AC489: =(AA489/AB489)*100 -> 127.17391304347827 | AD489: =(X489*4)+(Z489*2) -> 24
A490: SANDRINGHAM | C490: 3 | D490: 2 | E490: 20 | G490: 8 | H490: 2 | I490: 50 | K490: 10 | L490: 4 | M490: 64 | O490: 13 | P490: 6 | Q490: 84 | S490: BRADSHAW | W490: SANDRINGHAM | X490: 6 | Y490: 5 | Z490: 0 | AA490: 1359 | AB490: 1196 | AC490: =(AA490/AB490)*100 -> 113.62876254180603 | AD490: =(X490*4)+(Z490*2) -> 24
A491: BEST PLAYERS | W491: SPRINGVALE | X491: 4 | Y491: 7 | Z491: 0 | AA491: 1229 | AB491: 1369 | AC491: =(AA491/AB491)*100 -> 89.773557341124913 | AD491: =(X491*4)+(Z491*2) -> 16
A492: PORT MELBOURNE | C492: TAYLOR | F492: SWAN | I492: RODDA | L492: JENNINGS | O492: McDONALD | R492: CHADBAND | W492: BRUNSWICK | X492: 4 | Y492: 7 | Z492: 0 | AA492: 1139 | AB492: 1352 | AC492: =(AA492/AB492)*100 -> 84.245562130177504 | AD492: =(X492*4)+(Z492*2) -> 16
A493: SANDRINGHAM | C493: HALL | F493: BENNETT | I493: FITZPATRICK | L493: KRISTENSEN | W493: GEELONG WEST | X493: 3 | Y493: 8 | Z493: 0 | AA493: 1117 | AB493: 1269 | AC493: =(AA493/AB493)*100 -> 88.022064617809306 | AD493: =(X493*4)+(Z493*2) -> 12
A494: GOALKICKERS | W494: CAMBERWELL | X494: 0 | Y494: 11 | Z494: 0 | AA494: 763 | AB494: 2128 | AC494: =(AA494/AB494)*100 -> 35.855263157894733 | AD494: =(X494*4)+(Z494*2) -> 0
A495: PORT MELBOURNE | C495: McDONALD 7 | F495: HICKS 2 | H495: CARTER 2 | J495: HOWARD 2 | M495: MOURNEY | O495: JENNINGS | Q495: HARKINS
A496: SANDRINGHAM | C496: MACLEOD 2 | F496: WALL 2 | H496: MONCRIEFF 2 | K496: EAVES 2 | M496: BENNETT | O496: GOROZIDIS | Q496: KRAKOUER
N497: ALLEN | P497: HETHERINGTON
A498: SPRINGVALE | C498: 5 | D498: 3 | E498: 33 | G498: 6 | H498: 8 | I498: 44 | K498: 12 | L498: 12 | M498: 84 | O498: 17 | P498: 18 | Q498: 120 | S498: VENUE: SPRINGVALE
A499: CAMBERWELL | C499: 0 | D499: 2 | E499: 2 | G499: 3 | H499: 3 | I499: 21 | K499: 3 | L499: 3 | M499: 21 | O499: 4 | P499: 4 | Q499: 28 | S499: COOKE :HUTCHINSON
A500: BEST PLAYERS
A501: SPRINGVALE | C501: HERBERT | F501: WARD | I501: KING | L501: MENDE | O501: LETTS | R501: DEMPSTER
A502: CAMBERWELL | C502: CONSTANTINOU | F502: ANGUS | I502: FREW | L502: STAFFERI | O502: McFEE
A503: GOALKICKERS
A504: SPRINGVALE | C504: LE POIDEVAN 4 | F504: MATTINGLY 3 | I504: DWYER 2 | K504: MENDE 2 | M504: DEMPSTER | O504: VERNON | Q504: WARD | R504: NICOL | T504: MEADE | V504: HIPWORTH
A505: CAMBERWELL | C505: AYLEN | E505: BINGLEY | G505: STAFFERI | J505: CONSTANTINOU
A507: FRANKSTON | C507: 5 | D507: 3 | E507: 33 | G507: 10 | H507: 6 | I507: 66 | K507: 16 | L507: 7 | M507: 103 | O507: 22 | P507: 11 | Q507: 143 | S507: VENUE: FRANKSTON
A508: GEELONG WEST | C508: 3 | D508: 4 | E508: 22 | G508: 9 | H508: 7 | I508: 61 | K508: 11 | L508: 8 | M508: 74 | O508: 14 | P508: 9 | Q508: 93 | S508: McDONALD :HULM
A509: BEST PLAYERS
A510: FRANKSTON | C510: BROWN | F510: RAVEN | I510: MOORE | L510: BEATON | O510: DUNBAR | R510: SARAU
A511: GEELONG WEST | C511: KRANJC | F511: DALIHAUS | I511: MORRISSEY
A512: GOALKICKERS
A513: FRANKSTON | C513: MCCARTY 4 | F513: SARAU 4 | H513: BROWN 4 | J513: MOORE 3 | L513: O'RILEY 2 | N513: BELL | P513: HUTCHINSON | S513: BEATON | V513: WHITFIELD | X513: DUNBAR
A514: GEELONG WEST | C514: STACK 3 | F514: BERRY 2 | H514: NICHOLSON 2 | K514: MORRISSEY 2 | N514: EVANS | P514: MCDOWELL | R514: REDHEAD | U514: DALIHAUS | X514: ALFORD
A516: COBURG | C516: 6 | D516: 3 | E516: 39 | G516: 9 | H516: 3 | I516: 57 | K516: 17 | L516: 7 | M516: 109 | O516: 20 | P516: 7 | Q516: 127 | S516: VENUE: COBURG
A517: WILLIAMSTOWN | C517: 0 | D517: 3 | E517: 3 | G517: 8 | H517: 12 | I517: 60 | K517: 10 | L517: 13 | M517: 73 | O517: 17 | P517: 18 | Q517: 120 | S517: MARCY :PHILLIPS
A518: BEST PLAYERS
A519: COBURG | C519: A HARBINSON | F519: EADE | I519: HALBERT | L519: CLEARY | O519: LAIDLER | R519: COLLINS
A520: WILLIAMSTOWN | C520: MCTAGGART | F520: CAHILL | I520: SMITH | L520: SLEVISON | O520: MURPHY | R520: DIMARTINO
A521: GOALKICKERS | P521: SHELDON | S521: CLEARY | U521: TARANTO
A522: COBURG | C522: HERBERT 3 | F522: EADE 3 | H522: WEATHERALD 3 | K522: GRAHAM 3 | N522: MANSFIELD 2 | Q522: ALLISON | S522: M HARBINSON | V522: LAIDLER
A523: WILLIAMSTOWN | C523: CAHILL 5 | F523: FOTHERINGHAM 4 | J523: ROUND 2 | L523: MUSCHIALLI 2 | O523: S KNIGHT | Q523: JAMES | S523: OWEN | U523: SMITH
A525: ROUND 12 | D525: 13TH JULY | I525: WEATHER | S525: VENUE: COBURG
D526: 1ST QTR | H526: 2ND QTR | L526: 3RD QTR | P526: FINAL | S526: UMPIRES
A527: PORT MELBOURNE | C527: 5 | D527: 6 | E527: 36 | G527: 7 | H527: 7 | I527: 49 | K527: 10 | L527: 15 | M527: 75 | O527: 11 | P527: 15 | Q527: 81 | S527: MARSHALL | X527: LADDER | AB527: ROUND | AD527: 12
A528: COBURG | C528: 2 | D528: 1 | E528: 13 | G528: 4 | H528: 5 | I528: 29 | K528: 6 | L528: 8 | M528: 44 | O528: 9 | P528: 13 | Q528: 67 | S528: McDONALD
A529: BEST PLAYERS | W529: TEAM | X529: W | Y529: L | Z529: D | AA529: FOR | AB529: AGST | AC529: % | AD529: PTS
A530: PORT MELBOURNE | C530: CHADBAND | F530: CRUTCHFIELD | I530: ALLENDER | L530: SWAN | O530: MUTIMER | R530: MCDONALD
A531: COBURG | C531: MANSFIELD | F531: EADE | I531: M HARBINSON | L531: ALLISON | O531: LAIDLER | R531: CLEARY | W531: COBURG | X531: 10 | Y531: 2 | Z531: 0 | AA531: 1700 | AB531: 1090 | AC531: =(AA531/AB531)*100 -> 155.96330275229357 | AD531: =(X531*4)+(Z531*2) -> 40
A532: GOALKICKERS | W532: FRANKSTON | X532: 9 | Y532: 3 | Z532: 0 | AA532: 1537 | AB532: 1180 | AC532: =(AA532/AB532)*100 -> 130.25423728813558 | AD532: =(X532*4)+(Z532*2) -> 36
A533: PORT MELBOURNE | C533: MCDONALD 3 | F533: COOPER 2 | I533: BAILLIE | K533: DOHERTY | M533: HARKINS | O533: HICKS | Q533: HOWARD | S533: SWAN | W533: PORT MELBOURNE | X533: 8 | Y533: 4 | Z533: 0 | AA533: 1658 | AB533: 1383 | AC533: =(AA533/AB533)*100 -> 119.88430947216197 | AD533: =(X533*4)+(Z533*2) -> 32
A534: COBURG | C534: CHRISTIANSEN 2 | G534: GIBB 2 | I534: ALLISON | K534: MANSFIELD | N534: GRAHAM | P534: WEBSTER | S534: KAAKOUR | W534: PRESTON | X534: 7 | Y534: 5 | Z534: 0 | AA534: 1502 | AB534: 1163 | AC534: =(AA534/AB534)*100 -> 129.14875322441961 | AD534: =(X534*4)+(Z534*2) -> 28
S535: VENUE: GEELONG WEST
A536: GEELONG WEST | C536: 3 | D536: 6 | E536: 24 | G536: 10 | H536: 9 | I536: 69 | K536: 15 | L536: 11 | M536: 101 | O536: 21 | P536: 14 | Q536: 140 | S536: MARCY | W536: WILLIAMSTOWN | X536: 7 | Y536: 5 | Z536: 0 | AA536: 1470 | AB536: 1222 | AC536: =(AA536/AB536)*100 -> 120.29459901800328 | AD536: =(X536*4)+(Z536*2) -> 28
A537: BRUNSWICK | C537: 4 | D537: 4 | E537: 28 | G537: 5 | H537: 7 | I537: 37 | K537: 9 | L537: 9 | M537: 63 | O537: 9 | P537: 9 | Q537: 63 | S537: HUTCHINSON | W537: SANDRINGHAM | X537: 7 | Y537: 5 | Z537: 0 | AA537: 1473 | AB537: 1294 | AC537: =(AA537/AB537)*100 -> 113.83307573415765 | AD537: =(X537*4)+(Z537*2) -> 28
A538: BEST PLAYERS | W538: GEELONG WEST | X538: 4 | Y538: 8 | Z538: 0 | AA538: 1257 | AB538: 1332 | AC538: =(AA538/AB538)*100 -> 94.369369369369366 | AD538: =(X538*4)+(Z538*2) -> 16
A539: GEELONG WEST | C539: NORTH | F539: MORRISSEY | I539: PERKINS | L539: RICHARDSON | O539: DALIHAUS | R539: REDHEAD | W539: SPRINGVALE | X539: 4 | Y539: 8 | Z539: 0 | AA539: 1327 | AB539: 1483 | AC539: =(AA539/AB539)*100 -> 89.4807821982468 | AD539: =(X539*4)+(Z539*2) -> 16
A540: BRUNSWICK | C540: EDWARDS | F540: THOROGOOD | I540: MCGHIE | W540: BRUNSWICK | X540: 4 | Y540: 8 | Z540: 0 | AA540: 1202 | AB540: 1492 | AC540: =(AA540/AB540)*100 -> 80.563002680965141 | AD540: =(X540*4)+(Z540*2) -> 16
A541: GOALKICKERS | Q541: DALIHAUS | W541: CAMBERWELL | X541: 0 | Y541: 12 | Z541: 0 | AA541: 814 | AB541: 2301 | AC541: =(AA541/AB541)*100 -> 35.375923511516731 | AD541: =(X541*4)+(Z541*2) -> 0
A542: GEELONG WEST | C542: RICHARDSON 8 | F542: MORRISSEY 5 | I542: REDHEAD 2 | L542: KRANJC 2 | N542: MCDOWELL | Q542: BERRY | R542: WATT
A543: BRUNSWICK | C543: CATTOGGIO 3 | F543: SMITH 2 | H543: EDWARDS | K543: POTTER | M543: REID | O543: WRIGHT
A545: FRANKSTON | C545: 4 | D545: 3 | E545: 27 | G545: 11 | H545: 7 | I545: 73 | K545: 17 | L545: 12 | M545: 114 | O545: 26 | P545: 17 | Q545: 173 | S545: VENUE: CAMBERWELL
A546: CAMBERWELL | C546: 3 | D546: 1 | E546: 19 | G546: 4 | H546: 1 | I546: 25 | K546: 7 | L546: 2 | M546: 44 | O546: 8 | P546: 3 | Q546: 51 | S546: NOLAN :PHILLIPS
A547: BEST PLAYERS
A548: FRANKSTON | C548: BARDOEL | F548: RAVEN | I548: BRIESE | L548: BEATON | O548: MCCARTY | R548: GEDDES
A549: CAMBERWELL | C549: FREW | F549: DREW | I549: CONSTANTINOU | L549: ANGUS | O549: McFEE | R549: HOWE
A550: GOALKICKERS
A551: FRANKSTON | C551: MCCARTY 10 | F551: O'RILEY 5 | H551: BEATON 3 | J551: MOORE 2 | L551: LANE | N551: HUTCHINSON | Q551: GEDDES | S551: DUNBAR | V551: CZARNECKI | X551: LANE
A552: CAMBERWELL | C552: AYLEN 2 | F552: MAILING 2 | I552: BOYCE | K552: CONSTANTINOU | N552: ANGUS | P552: GRAY
A554: SANDRINGHAM | C554: 1 | D554: 3 | E554: 9 | G554: 8 | H554: 5 | I554: 53 | K554: 11 | L554: 7 | M554: 73 | O554: 17 | P554: 12 | Q554: 114 | S554: VENUE: BEACH ROAD
A555: SPRINGVALE | C555: 8 | D555: 3 | E555: 51 | G555: 10 | H555: 4 | I555: 64 | K555: 13 | L555: 7 | M555: 85 | O555: 15 | P555: 8 | Q555: 98 | S555: RYAN :HULM
A556: BEST PLAYERS
A557: SANDRINGHAM | C557: BERGMAN | F557: KRISTENSEN | I557: FITZPATRICK | L557: ALLEN | O557: KRAKOUER | R557: BENNETT
A558: SPRINGVALE | C558: DEMPSTER | F558: MALONI | I558: KEAYS | L558: HERBERT | O558: MEADE
A559: GOALKICKERS
A560: SANDRINGHAM | C560: MONCRIEFF 6 | F560: KRISTENSEN 3 | I560: ALLEN 3 | K560: WALL 2 | M560: BRENDAN SAID | P560: EAVES | R560: DIPIERDOMENICO
A561: SPRINGVALE | C561: REECE 6 | F561: JEFFS 3 | H561: COLE 2 | J561: WARD 2 | L561: MENDE | N561: NICOL
A563: PRESTON | C563: 3 | D563: 4 | E563: 22 | G563: 7 | H563: 4 | I563: 46 | K563: 9 | L563: 10 | M563: 64 | O563: 14 | P563: 14 | Q563: 98 | S563: VENUE: WILLIAMSTOWN
A564: WILLIAMSTOWN | C564: 1 | D564: 3 | E564: 9 | G564: 3 | H564: 10 | I564: 28 | K564: 6 | L564: 12 | M564: 48 | O564: 7 | P564: 17 | Q564: 59 | S564: COOK :CASEY
A565: BEST PLAYERS
A566: PRESTON | C566: SALVADORE | F566: JORDAN | I566: WATT | L566: DUNBAR | O566: TOWAN | R566: BRADDY
A567: WILLIAMSTOWN | C567: PASTORE | F567: OWEN | I567: MURPHY | L567: KNIGHT | O567: MCTAGGART
A568: GOALKICKERS
A569: PRESTON | C569: SHAW 8 | F569: PERRY 3 | I569: CARLSON 2 | L569: LUMICISI
A570: WILLIAMSTOWN | C570: KNIGHT 4 | F570: ROUND 2 | I570: JAMES
A572: ROUND 13 | D572: 20TH JULY | I572: WEATHER | S572: VENUE: M.C.G.
D573: 1ST QTR | H573: 2ND QTR | L573: 3RD QTR | P573: FINAL | S573: UMPIRES
A574: SANDRINGHAM | C574: 6 | D574: 2 | E574: 38 | G574: 12 | H574: 2 | I574: 74 | K574: 18 | L574: 6 | M574: 114 | O574: 26 | P574: 8 | Q574: 164 | S574: CASEY | X574: LADDER | AB574: ROUND | AD574: 13
A575: BRUNSWICK | C575: 3 | D575: 4 | E575: 22 | G575: 10 | H575: 6 | I575: 66 | K575: 12 | L575: 7 | M575: 79 | O575: 19 | P575: 13 | Q575: 127 | S575: MARSHALL
A576: BEST PLAYERS | W576: TEAM | X576: W | Y576: L | Z576: D | AA576: FOR | AB576: AGST | AC576: % | AD576: PTS
A577: SANDRINGHAM | C577: BEILBY | F577: KRISTENSEN | I577: BERGMAN | L577: WALL | O577: FITZPATRICK | R577: BENNETT
A578: BRUNSWICK | C578: WEST | F578: CATTOGGIO | I578: WRIGHT | L578: POTTER | O578: SMITH | W578: COBURG | X578: 11 | Y578: 2 | Z578: 0 | AA578: 1840 | AB578: 1101 | AC578: =(AA578/AB578)*100 -> 167.12079927338783 | AD578: =(X578*4)+(Z578*2) -> 44
A579: GOALKICKERS | G579: MONCRIEFF 2 | J579: CARTY 2 | L579: BRENDAN SAID | O579: BONNEY | Q579: DIPIERDOMENICO | W579: FRANKSTON | X579: 9 | Y579: 4 | Z579: 0 | AA579: 1658 | AB579: 1320 | AC579: =(AA579/AB579)*100 -> 125.60606060606061 | AD579: =(X579*4)+(Z579*2) -> 36
A580: SANDRINGHAM | C580: WALL 4 | E580: KRISTENSEN 4 | H580: BENNETT 3 | J580: FITZPATRICK 3 | M580: KRAKOUER 3 | P580: BRIAN SAID 2 | W580: PORT MELBOURNE | X580: 9 | Y580: 4 | Z580: 0 | AA580: 1817 | AB580: 1525 | AC580: =(AA580/AB580)*100 -> 119.14754098360656 | AD580: =(X580*4)+(Z580*2) -> 36
A581: BRUNSWICK | C581: CATTOGGIO 5 | F581: WEST 3 | H581: POTTER 3 | J581: WRIGHT 2 | M581: REID 2 | O581: SMITH | Q581: BARRY | S581: GREGG | W581: PRESTON | X581: 8 | Y581: 5 | Z581: 0 | AA581: 1751 | AB581: 1208 | AC581: =(AA581/AB581)*100 -> 144.95033112582783 | AD581: =(X581*4)+(Z581*2) -> 32
S582: VENUE: CAMBERWELL
A583: PRESTON | C583: 9 | D583: 5 | E583: 59 | G583: 21 | H583: 8 | I583: 134 | K583: 32 | L583: 16 | M583: 208 | O583: 38 | P583: 21 | Q583: 249 | S583: HULM | W583: WILLIAMSTOWN | X583: 8 | Y583: 5 | Z583: 0 | AA583: 1605 | AB583: 1323 | AC583: =(AA583/AB583)*100 -> 121.31519274376417 | AD583: =(X583*4)+(Z583*2) -> 32
A584: CAMBERWELL | C584: 3 | D584: 1 | E584: 19 | G584: 4 | H584: 3 | I584: 27 | K584: 4 | L584: 4 | M584: 28 | O584: 6 | P584: 9 | Q584: 45 | S584: WESTGARTH | W584: SANDRINGHAM | X584: 8 | Y584: 5 | Z584: 0 | AA584: 1637 | AB584: 1421 | AC584: =(AA584/AB584)*100 -> 115.20056298381422 | AD584: =(X584*4)+(Z584*2) -> 32
A585: BEST PLAYERS | W585: GEELONG WEST | X585: 4 | Y585: 9 | Z585: 0 | AA585: 1358 | AB585: 1467 | AC585: =(AA585/AB585)*100 -> 92.569870483980907 | AD585: =(X585*4)+(Z585*2) -> 16
A586: PRESTON | C586: SHAW | F586: DUNBAR | I586: SALVADORE | L586: LUMICISI | O586: HUNT | Q586: JORDAN | W586: SPRINGVALE | X586: 4 | Y586: 9 | Z586: 0 | AA586: 1469 | AB586: 1642 | AC586: =(AA586/AB586)*100 -> 89.46406820950061 | AD586: =(X586*4)+(Z586*2) -> 16
A587: CAMBERWELL | C587: FREW | F587: DREW | I587: ANGUS | W587: BRUNSWICK | X587: 4 | Y587: 9 | Z587: 0 | AA587: 1329 | AB587: 1656 | AC587: =(AA587/AB587)*100 -> 80.253623188405797 | AD587: =(X587*4)+(Z587*2) -> 16
A588: GOALKICKERS | K588: JACKSON | M588: FROST | O588: LUMICISI | Q588: PRIDEAUX | W588: CAMBERWELL | X588: 0 | Y588: 13 | Z588: 0 | AA588: 859 | AB588: 2550 | AC588: =(AA588/AB588)*100 -> 33.686274509803923 | AD588: =(X588*4)+(Z588*2) -> 0
A589: PRESTON | C589: SHAW 18 | E589: CARLSON 4 | H589: PERRY 3 | J589: SALVADORE 3 | M589: COOPER 2 | O589: DUNBAR 2 | Q589: WATT | R589: RAYMENT
A590: CAMBERWELL | C590: MAILING 2 | F590: BINGLEY | I590: CONSTANTINOU | L590: AYLEN | N590: WEST
A592: PORT MELBOURNE | C592: 7 | D592: 3 | E592: 45 | G592: 13 | H592: 8 | I592: 86 | K592: 21 | L592: 13 | M592: 139 | O592: 23 | P592: 21 | Q592: 159 | S592: VENUE: PORT MELBOURNE
A593: SPRINGVALE | C593: 8 | D593: 2 | E593: 50 | G593: 12 | H593: 3 | I593: 75 | K593: 14 | L593: 8 | M593: 92 | O593: 21 | P593: 16 | Q593: 142 | S593: NOLAN :PHILLIPS
A594: BEST PLAYERS
A595: PORT MELBOURNE | C595: CHADBAND | F595: METCALFE | I595: DOHERTY | L595: MCDONALD | O595: HARKINS | R595: SWAN
A596: SPRINGVALE | C596: MALONI | F596: ROBINSON | I596: HERBERT | L596: HIPWORTH | O596: NICOL | R596: MEADE
A597: GOALKICKERS
A598: PORT MELBOURNE | C598: McDONALD 7 | F598: HARKINS 3 | I598: HOWARD 3 | L598: MUTIMER 3 | N598: ALLENDER 2 | Q598: ROSS | R598: SWAN | T598: DOHERTY | W598: CRUTCHFIELD | Z598: HICKS
A599: SPRINGVALE | C599: ROBINSON 9 | F599: NICOL 4 | H599: MORGAN 3 | J599: JEFFS 2 | L599: HERBERT | N599: DUDLEY | P599: REECE
A601: COBURG | C601: 3 | D601: 5 | E601: 23 | G601: 8 | H601: 8 | I601: 56 | K601: 14 | L601: 11 | M601: 95 | O601: 20 | P601: 20 | Q601: 140 | S601: VENUE: M.C.G.
A602: FRANKSTON | C602: 2 | D602: 7 | E602: 19 | G602: 10 | H602: 10 | I602: 70 | K602: 16 | L602: 11 | M602: 107 | O602: 18 | P602: 13 | Q602: 121 | S602: MARCY :RYAN
A603: BEST PLAYERS
A604: COBURG | C604: ALLISON | F604: CHRISTIANSEN | I604: SHELDON | L604: EADE | O604: NIMMO | R604: A HARBINSON
A605: FRANKSTON | C605: McCARTY | F605: GEDDES | I605: BARDOEL | L605: HUTCHINSON | O605: O'RILEY | R605: RAVEN
A606: GOALKICKERS | O606: LAIDLER | Q606: EADE | S606: CLEARY
A607: COBURG | C607: CHRISTIANSEN 3 | F607: HALBERT 3 | I607: COLLINS 2 | K607: WEATHERALD 2 | N607: FITZPATRICK 2 | Q607: ZANON | S607: ALLISON | W607: MANSFIELD | X607: SHELDON | AA607: A HARBINSON
A608: FRANKSTON | C608: MCCARTY 8 | F608: WHITFIELD 2 | I608: PAYNTER 2 | L608: SARAU 2 | N608: GEDDES | P608: DUNBAR | R608: O'RILEY | U608: A MOORE
A610: WILLIAMSTOWN | C610: 2 | D610: 4 | E610: 16 | G610: 6 | H610: 8 | I610: 44 | K610: 12 | L610: 10 | M610: 82 | O610: 20 | P610: 15 | Q610: 135 | S610: VENUE: GEELONG WEST
A611: GEELONG WEST | C611: 3 | D611: 7 | E611: 25 | G611: 9 | H611: 9 | I611: 63 | K611: 12 | L611: 10 | M611: 82 | O611: 15 | P611: 11 | Q611: 101 | S611: GLEESON :VERGONA
A612: BEST PLAYERS
A613: WILLIAMSTOWN | C613: KERSHAW | F613: SLEVISON | I613: OWEN | L613: ROUND | O613: PASTORE | R613: KNIGHT
A614: GEELONG WEST | C614: NORTH | F614: BERRY | I614: PERKINS | L614: MCDOWELL | O614: KRANJC | R614: HEWITT
A615: GOALKICKERS
A616: WILLIAMSTOWN | C616: KNIGHT 4 | F616: FOTHERINGHAM 4 | J616: ROUND 4 | L616: DULLARD 2 | N616: SAIT 2 | P616: HUGHES 2 | R616: CAHILL | T616: SLEVISON
A617: GEELONG WEST | C617: RICHARDSON 5 | F617: MORRISSEY 3 | I617: BERRY 2 | K617: MCDOWELL 2 | N617: WATT | P617: HEWITT | R617: NICHOLSON
A619: ROUND 14 | D619: 27TH JULY | I619: WEATHER | S619: VENUE: BRUNSWICK
D620: 1ST QTR | H620: 2ND QTR | L620: 3RD QTR | P620: FINAL | S620: UMPIRES
A621: BRUNSWICK | C621: 5 | D621: 7 | E621: 37 | G621: 11 | H621: 8 | I621: 74 | K621: 19 | L621: 12 | M621: 126 | O621: 27 | P621: 14 | Q621: 176 | S621: BRADY | X621: LADDER | AB621: ROUND | AD621: 14
A622: CAMBERWELL | C622: 5 | D622: 2 | E622: 32 | G622: 6 | H622: 4 | I622: 40 | K622: 6 | L622: 5 | M622: 41 | O622: 9 | P622: 5 | Q622: 59 | S622: McDONALD
A623: BEST PLAYERS | W623: TEAM | X623: W | Y623: L | Z623: D | AA623: FOR | AB623: AGST | AC623: % | AD623: PTS
A624: BRUNSWICK | C624: WRIGHT | F624: CONNELL | I624: DUGDALE | L624: POTTER | O624: REID | Q624: GIBSON
A625: CAMBERWELL | C625: WILGAR | F625: WEST | I625: FREW | L625: McFEE | O625: DE KONNING | W625: COBURG | X625: 12 | Y625: 2 | Z625: 0 | AA625: 1948 | AB625: 1181 | AC625: =(AA625/AB625)*100 -> 164.94496189669772 | AD625: =(X625*4)+(Z625*2) -> 48
A626: GOALKICKERS | R626: THOROGOOD | W626: FRANKSTON | X626: 10 | Y626: 4 | Z626: 0 | AA626: 1811 | AB626: 1457 | AC626: =(AA626/AB626)*100 -> 124.2964996568291 | AD626: =(X626*4)+(Z626*2) -> 40
A627: BRUNSWICK | C627: GIBSON 8 | E627: REID 4 | G627: CATTOGGIO 4 | J627: WRIGHT 3 | L627: BICKLEY 2 | N627: HEATHER 2 | Q627: POTTER 2 | S627: TAYLOR | W627: PRESTON | X627: 9 | Y627: 5 | Z627: 0 | AA627: 1817 | AB627: 1252 | AC627: =(AA627/AB627)*100 -> 145.12779552715656 | AD627: =(X627*4)+(Z627*2) -> 36
A628: CAMBERWELL | C628: BINGLEY 3 | F628: SPITHILL | H628: BOYCE | J628: AYLEN | L628: WEST | N628: DYSON | P628: DE KONNING | W628: WILLIAMSTOWN | X628: 9 | Y628: 5 | Z628: 0 | AA628: 1775 | AB628: 1427 | AC628: =(AA628/AB628)*100 -> 124.38682550805886 | AD628: =(X628*4)+(Z628*2) -> 36
S629: VENUE: PORT MELBOURNE
A630: WILLIAMSTOWN | C630: 5 | D630: 3 | E630: 33 | G630: 11 | H630: 9 | I630: 75 | K630: 16 | L630: 11 | M630: 107 | O630: 26 | P630: 14 | Q630: 170 | S630: RYAN | W630: PORT MELBOURNE | X630: 9 | Y630: 5 | Z630: 0 | AA630: 1921 | AB630: 1695 | AC630: =(AA630/AB630)*100 -> 113.33333333333333 | AD630: =(X630*4)+(Z630*2) -> 36
A631: PORT MELBOURNE | C631: 4 | D631: 4 | E631: 28 | G631: 6 | H631: 6 | I631: 42 | K631: 8 | L631: 11 | M631: 59 | O631: 15 | P631: 14 | Q631: 104 | S631: COOKE | W631: SANDRINGHAM | X631: 8 | Y631: 6 | Z631: 0 | AA631: 1774 | AB631: 1574 | AC631: =(AA631/AB631)*100 -> 112.70648030495553 | AD631: =(X631*4)+(Z631*2) -> 32
A632: BEST PLAYERS | W632: BRUNSWICK | X632: 5 | Y632: 9 | Z632: 0 | AA632: 1505 | AB632: 1715 | AC632: =(AA632/AB632)*100 -> 87.755102040816325 | AD632: =(X632*4)+(Z632*2) -> 20
A633: WILLIAMSTOWN | C633: KERSHAW | F633: HUGHES | I633: MUSCHIALLI | L633: MURPHY | O633: OWEN | Q633: PASTORE | W633: GEELONG WEST | X633: 4 | Y633: 10 | Z633: 0 | AA633: 1402 | AB633: 1533 | AC633: =(AA633/AB633)*100 -> 91.454664057403775 | AD633: =(X633*4)+(Z633*2) -> 16
A634: PORT MELBOURNE | C634: ALLENDER | F634: COOPER | I634: CRUTCHFIELD | W634: SPRINGVALE | X634: 4 | Y634: 10 | Z634: 0 | AA634: 1549 | AB634: 1750 | AC634: =(AA634/AB634)*100 -> 88.514285714285705 | AD634: =(X634*4)+(Z634*2) -> 16
A635: GOALKICKERS | M635: OWEN | O635: SLEVISON | Q635: HUGHES | S635: SMITH | W635: CAMBERWELL | X635: 0 | Y635: 14 | Z635: 0 | AA635: 918 | AB635: 2726 | AC635: =(AA635/AB635)*100 -> 33.675715333822446 | AD635: =(X635*4)+(Z635*2) -> 0
A636: WILLIAMSTOWN | C636: MUSCHIALLI 6 | F636: ROUND 4 | H636: RICKMAN 3 | J636: SAIT 3 | L636: KNIGHT 2 | N636: GIBSON 2 | P636: CAHILL | R636: KERSHAW
A637: PORT MELBOURNE | C637: MCDONALD 5 | F637: BAILEY 3 | H637: HICKS 3 | J637: CARTER | L637: MUTIMER | N637: ROSS | P637: TAYLOR
A639: COBURG | C639: 3 | D639: 3 | E639: 21 | G639: 7 | H639: 6 | I639: 48 | K639: 14 | L639: 7 | M639: 91 | O639: 16 | P639: 12 | Q639: 108 | S639: VENUE: SPRINGVALE
A640: SPRINGVALE | C640: 3 | D640: 4 | E640: 22 | G640: 5 | H640: 5 | I640: 35 | K640: 9 | L640: 7 | M640: 61 | O640: 12 | P640: 8 | Q640: 80 | S640: CASEY ;GIBSON
A641: BEST PLAYERS
A642: COBURG | C642: CHRISTIANSEN | F642: FREEMAN | I642: ALLISON | L642: COLLINS | O642: A HARBINSON | R642: M HARBINSON
A643: SPRINGVALE | C643: McCARTHY | F643: MORGAN | I643: HIPWORTH | L643: MENDE | O643: HERBERT | R643: WARD
A644: GOALKICKERS
A645: COBURG | C645: INGRAM 5 | F645: HALBERT 4 | I645: CHRISTIANSEN 3 | L645: ALLISON 3 | N645: GIBB
A646: SPRINGVALE | C646: ROBINSON 4 | F646: WARD 2 | H646: DUDLEY | J646: COLLINS | L646: NICOL | N646: HOLDEN | P646: KING | R646: REECE
A648: FRANKSTON | C648: 6 | D648: 5 | E648: 41 | G648: 13 | H648: 9 | I648: 87 | K648: 18 | L648: 13 | M648: 121 | O648: 23 | P648: 15 | Q648: 153 | S648: VENUE: FRANKSTON
A649: SANDRINGHAM | C649: 8 | D649: 2 | E649: 50 | G649: 11 | H649: 6 | I649: 72 | K649: 15 | L649: 12 | M649: 102 | O649: 20 | P649: 17 | Q649: 137 | S649: VERGONA :CHILDS
A650: BEST PLAYERS
A651: FRANKSTON | C651: RAVEN | F651: MOORE | I651: MCCARTY | L651: O'RILEY | O651: DUNBAR | R651: PAYNTER
A652: SANDRINGHAM | C652: BEILBY | F652: PRATT | I652: FITZPATRICK | L652: MERCER | O652: ALLEN | R652: EAVES
A653: GOALKICKERS
A654: FRANKSTON | C654: McCARTY 8 | F654: O'RILEY 4 | H654: DUNBAR 4 | J654: PAYNTER 3 | M654: MOORE 2 | O654: O'BRIEN | Q654: CZARNECKI
A655: SANDRINGHAM | C655: FITZPATRICK 3 | F655: BENNETT 3 | I655: ALLEN 3 | K655: MORRISON 2 | N655: KRISTENSEN 2 | Q655: HENDERSON 2 | T655: B SAID | V655: DIPIERDOMENICO | X655: PRATT | Z655: EAVES | AB655: HOWELL
A657: PRESTON | C657: 1 | D657: 8 | E657: 14 | G657: 3 | H657: 11 | I657: 29 | K657: 6 | L657: 12 | M657: 48 | O657: 9 | P657: 12 | Q657: 66 | S657: VENUE: PRESTON
A658: GEELONG WEST | C658: 2 | D658: 2 | E658: 14 | G658: 2 | H658: 3 | I658: 15 | K658: 4 | L658: 5 | M658: 29 | O658: 6 | P658: 8 | Q658: 44 | S658: NOLAN :MARSHALL
A659: BEST PLAYERS
A660: PRESTON | C660: SALVADOR | F660: WATT | I660: TOWAN | L660: FROST | N660: PRIDEAUX | Q660: LUMICISI
A661: GEELONG WEST | C661: KRANJC | F661: DALIHAUS | I661: EVANS | L661: WATT | N661: McDOWELL
A662: GOALKICKERS
A663: PRESTON | C663: CARLSON 5 | F663: BRADDY | I663: SALVADOR | L663: WATT | N663: SHAW
A664: GEELONG WEST | C664: WATT 2 | F664: REDHEAD | I664: MORRISSEY | L664: GIBSON | N664: AFFORD
A666: ROUND 15 | D666: 3RD AUGUST | I666: WEATHER | S666: VENUE: BRUNSWICK
D667: 1ST QTR | H667: 2ND QTR | L667: 3RD QTR | P667: FINAL | S667: UMPIRES
A668: COBURG | C668: 5 | D668: 4 | E668: 34 | G668: 10 | H668: 8 | I668: 68 | K668: 19 | L668: 15 | M668: 129 | O668: 23 | P668: 20 | Q668: 158 | S668: VERGONA | X668: LADDER | AB668: ROUND | AD668: 15
A669: BRUNSWICK | C669: 3 | D669: 3 | E669: 21 | G669: 7 | H669: 5 | I669: 47 | K669: 9 | L669: 8 | M669: 62 | O669: 13 | P669: 13 | Q669: 91 | S669: MYLES
A670: BEST PLAYERS | W670: TEAM | X670: W | Y670: L | Z670: D | AA670: FOR | AB670: AGST | AC670: % | AD670: PTS
A671: COBURG | C671: CHRISTIANSEN | F671: NIMMO | I671: EADE | L671: M HARBINSON | O671: A HARBINSON | R671: ALLISON
A672: BRUNSWICK | C672: THOROGOOD | F672: CONNELL | I672: POTTER | L672: DUGDALE | O672: WRIGHT | R672: CATTOGGIO | W672: COBURG | X672: 13 | Y672: 2 | Z672: 0 | AA672: 2106 | AB672: 1272 | AC672: =(AA672/AB672)*100 -> 165.56603773584905 | AD672: =(X672*4)+(Z672*2) -> 52
A673: GOALKICKERS | K673: EADE | M673: FIYZPATRICK | P673: NIMMO | R673: TARANTO | W673: FRANKSTON | X673: 11 | Y673: 4 | Z673: 0 | AA673: 1925 | AB673: 1560 | AC673: =(AA673/AB673)*100 -> 123.3974358974359 | AD673: =(X673*4)+(Z673*2) -> 44
A674: COBURG | C674: CHRISTIANSEN 4 | F674: COLLINS 4 | I674: HALBERT 3 | K674: ALLISON 2 | M674: M HARBINSON 2 | P674: FREEMAN 2 | R674: INGRAM 2 | W674: PRESTON | X674: 10 | Y674: 5 | Z674: 0 | AA674: 1946 | AB674: 1340 | AC674: =(AA674/AB674)*100 -> 145.22388059701493 | AD674: =(X674*4)+(Z674*2) -> 40
A675: BRUNSWICK | C675: FLOWER 4 | F675: CATTOGGIO 3 | I675: GIBSON 3 | K675: POTTER 2 | M675: EDWARDS | W675: WILLIAMSTOWN | X675: 10 | Y675: 5 | Z675: 0 | AA675: 1934 | AB675: 1470 | AC675: =(AA675/AB675)*100 -> 131.56462585034015 | AD675: =(X675*4)+(Z675*2) -> 40
S676: VENUE: PRESTON
A677: PRESTON | C677: 3 | D677: 5 | E677: 23 | G677: 9 | H677: 12 | I677: 66 | K677: 9 | L677: 17 | M677: 71 | O677: 18 | P677: 21 | Q677: 129 | S677: MARCY | W677: PORT MELBOURNE | X677: 9 | Y677: 6 | Z677: 0 | AA677: 2024 | AB677: 1809 | AC677: =(AA677/AB677)*100 -> 111.88501934770592 | AD677: =(X677*4)+(Z677*2) -> 36
A678: SANDRINGHAM | C678: 3 | D678: 5 | E678: 23 | G678: 7 | H678: 7 | I678: 49 | K678: 9 | L678: 14 | M678: 68 | O678: 12 | P678: 16 | Q678: 88 | S678: MCDONALD | W678: SANDRINGHAM | X678: 8 | Y678: 7 | Z678: 0 | AA678: 1862 | AB678: 1703 | AC678: =(AA678/AB678)*100 -> 109.3364650616559 | AD678: =(X678*4)+(Z678*2) -> 32
A679: BEST PLAYERS | W679: GEELONG WEST | X679: 5 | Y679: 10 | Z679: 0 | AA679: 1603 | AB679: 1567 | AC679: =(AA679/AB679)*100 -> 102.29738353541799 | AD679: =(X679*4)+(Z679*2) -> 20
A680: PRESTON | C680: WATT | F680: FROST | I680: JORDAN | L680: HUNT | O680: PLOWMAN | R680: PRIDEAUX | W680: BRUNSWICK | X680: 5 | Y680: 10 | Z680: 0 | AA680: 1596 | AB680: 1873 | AC680: =(AA680/AB680)*100 -> 85.210891617725565 | AD680: =(X680*4)+(Z680*2) -> 20
A681: SANDRINGHAM | C681: BRENDAN SAID | F681: EAVES | I681: PRATT | L681: BERGMAN | O681: HOWELL | R681: FITZPATRICK | W681: SPRINGVALE | X681: 4 | Y681: 11 | Z681: 0 | AA681: 1592 | AB681: 1909 | AC681: =(AA681/AB681)*100 -> 83.394447354635943 | AD681: =(X681*4)+(Z681*2) -> 16
A682: GOALKICKERS | P682: LUMICISI | R682: DUNBAR | W682: CAMBERWELL | X682: 0 | Y682: 15 | Z682: 0 | AA682: 952 | AB682: 2927 | AC682: =(AA682/AB682)*100 -> 32.524769388452341 | AD682: =(X682*4)+(Z682*2) -> 0
A683: PRESTON | C683: SHAW 3 | E683: WATT 3 | G683: PERRY 2 | I683: SALVADOR 2 | L683: PERRY 2 | N683: HUNT 2 | P683: CARLSON | R683: FROST
A684: SANDRINGHAM | C684: BERGMAN 6 | F684: BRENDAN SAID 2 | J684: BENNETT | M684: BEILBY | O684: ANTONIO | Q684: HENDERSON
A686: GEELONG WEST | C686: 10 | D686: 8 | E686: 68 | G686: 13 | H686: 12 | I686: 90 | K686: 22 | L686: 22 | M686: 154 | O686: 29 | P686: 27 | Q686: 201 | S686: VENUE: GEELONG WEST
A687: CAMBERWELL | C687: 0 | D687: 0 | E687: 0 | G687: 2 | H687: 3 | I687: 15 | K687: 3 | L687: 4 | M687: 22 | O687: 5 | P687: 4 | Q687: 34 | S687: CASEY ;COOKE
A688: BEST PLAYERS
A689: GEELONG WEST | C689: NORTH | E689: MORRISSEY | H689: WATT | K689: REDHEAD | N689: MCDOWELL | Q689: AUSTIN
A690: CAMBERWELL | C690: FREW | E690: DREW | H690: WILGAR | K690: AYLEN | N690: CONSTANTINOU | Q690: McFEE
A691: GOALKICKERS
A692: GEELONG WEST | C692: MORRISSEY 11 | F692: WATT 5 | H692: DOYLE 2 | J692: McDOWELL 2 | M692: HEWITT 2 | O692: BERRY 2 | Q692: ALEXANDER 2 | T692: AUSTIN | W692: RICHARDSON | X692: FAZIO
A693: CAMBERWELL | C693: SPITHALL | F693: WILGAR | H693: MCFEE | J693: CONSTANTINOU | N693: MAILING
A695: FRANKSTON | C695: 3 | D695: 1 | E695: 19 | G695: 7 | H695: 9 | I695: 51 | K695: 12 | L695: 11 | M695: 83 | O695: 16 | P695: 18 | Q695: 114 | S695: VENUE: FRANKSTON
A696: PORT MELBOURNE | C696: 5 | D696: 6 | E696: 36 | G696: 7 | H696: 8 | I696: 50 | K696: 12 | L696: 11 | M696: 83 | O696: 15 | P696: 13 | Q696: 103 | S696: GLEESON ;MARSHALL
A697: BEST PLAYERS
A698: FRANKSTON | C698: BELL | F698: BROWN | I698: RAVEN | L698: MOORE | O698: GEDDES | R698: O'BRIEN
A699: PORT MELBOURNE | C699: COOPER | F699: ROSS | I699: MUTIMER | L699: JENNINGS | O699: CRUTCHFIELD
A700: GOALKICKERS
A701: FRANKSTON | C701: MCCARTY 3 | F701: PAYNTER 3 | I701: BARDOEL 2 | L701: CZARNECKI 2 | O701: JONES 2 | Q701: MOORE | S701: BEATON | V701: O'RILEY | X701: O'BRIEN
A702: PORT MELBOURNE | C702: HICKS 2 | E702: McDONALD 2 | H702: MOURNEY 2 | K702: SWAN 2 | M702: BAILLIE | O702: CRUTCHFIELD | R702: DOHERTY | U702: HOY | W702: JENNINGS | X702: METCALFE | AA702: MUTIMER
A704: WILLIAMSTOWN | C704: 4 | D704: 3 | E704: 27 | G704: 9 | H704: 9 | I704: 63 | K704: 16 | L704: 11 | M704: 107 | O704: 24 | P704: 15 | Q704: 159 | S704: VENUE: WILLIAMSTOWN
A705: SPRINGVALE | C705: 3 | D705: 1 | E705: 19 | G705: 3 | H705: 3 | I705: 21 | K705: 4 | L705: 6 | M705: 30 | O705: 6 | P705: 7 | Q705: 43 | S705: BRADDY :CHILDS
A706: BEST PLAYERS
A707: WILLIAMSTOWN | C707: HUGHES | F707: GIBSON | I707: MURPHY | L707: ROUND | O707: McTAGGART | R707: SAIT
A708: SPRINGVALE | C708: MALONI | F708: MENDE | I708: COLE | L708: VERNON
A709: GOALKICKERS
A710: WILLIAMSTOWN | C710: GIBSON 10 | F710: CAHILL 6 | I710: KNIGHT 2 | K710: SAIT 2 | M710: DULLARD | O710: RICKMAN | Q710: PASTORE | S710: SLEVISON
A711: SPRINGVALE | C711: McCARTHY 3 | F711: MENDE 2 | I711: HIPWORTH
A713: ROUND 16 | D713: 10TH AUGUST | I713: WEATHER | S713: VENUE: SPRINGVALE
D714: 1ST QTR | H714: 2ND QTR | L714: 3RD QTR | P714: FINAL | S714: UMPIRES
A715: FRANKSTON | C715: 3 | D715: 2 | E715: 20 | G715: 7 | H715: 2 | I715: 44 | K715: 11 | L715: 7 | M715: 73 | O715: 17 | P715: 11 | Q715: 113 | S715: COOKE | X715: LADDER | AB715: ROUND | AD715: 16
A716: SPRINGVALE | C716: 3 | D716: 4 | E716: 22 | G716: 8 | H716: 8 | I716: 56 | K716: 12 | L716: 9 | M716: 81 | O716: 13 | P716: 14 | Q716: 92 | S716: HULM
A717: BEST PLAYERS | W717: TEAM | X717: W | Y717: L | Z717: D | AA717: FOR | AB717: AGST | AC717: % | AD717: PTS
A718: FRANKSTON | C718: BROWN | F718: RAVEN | I718: BEATON | L718: O'RILEY | O718: PAYNTER
A719: SPRINGVALE | C719: McCARTHY | F719: MALONI | I719: MORGAN | L719: KING | O719: HERBERT | R719: COLE | W719: COBURG | X719: 14 | Y719: 2 | Z719: 0 | AA719: 2252 | AB719: 1373 | AC719: =(AA719/AB719)*100 -> 164.02039329934451 | AD719: =(X719*4)+(Z719*2) -> 56
A720: GOALKICKERS | Q720: SARAU | S720: JONES | W720: FRANKSTON | X720: 12 | Y720: 4 | Z720: 0 | AA720: 2038 | AB720: 1652 | AC720: =(AA720/AB720)*100 -> 123.36561743341406 | AD720: =(X720*4)+(Z720*2) -> 48
A721: FRANKSTON | C721: O'RILEY 3 | E721: PAYNTER 3 | H721: BROWN 2 | J721: MOORE 2 | L721: O'BRIEN 2 | N721: BELL | P721: GEDDES | R721: DUNBAR | W721: WILLIAMSTOWN | X721: 11 | Y721: 5 | Z721: 0 | AA721: 2281 | AB721: 1502 | AC721: =(AA721/AB721)*100 -> 151.8641810918775 | AD721: =(X721*4)+(Z721*2) -> 44
A722: SPRINGVALE | C722: HERBERT 3 | E722: MALONI 2 | G722: MATTINGLY 2 | J722: HIPWORTH 2 | M722: MENDE | O722: ANDERSON | Q722: WARD | S722: MORGAN | W722: PRESTON | X722: 10 | Y722: 6 | Z722: 0 | AA722: 2047 | AB722: 1486 | AC722: =(AA722/AB722)*100 -> 137.75235531628533 | AD722: =(X722*4)+(Z722*2) -> 40
S723: VENUE: BEACH ROAD
A724: SANDRINGHAM | C724: 3 | D724: 7 | E724: 25 | G724: 8 | H724: 11 | I724: 59 | K724: 16 | L724: 15 | M724: 111 | O724: 17 | P724: 20 | Q724: 122 | S724: GLEESON | W724: PORT MELBOURNE | X724: 10 | Y724: 6 | Z724: 0 | AA724: 2220 | AB724: 1908 | AC724: =(AA724/AB724)*100 -> 116.35220125786164 | AD724: =(X724*4)+(Z724*2) -> 40
A725: GEELONG WEST | C725: 5 | D725: 1 | E725: 31 | G725: 6 | H725: 9 | I725: 45 | K725: 6 | L725: 10 | M725: 46 | O725: 11 | P725: 16 | Q725: 82 | S725: RYAN | W725: SANDRINGHAM | X725: 9 | Y725: 7 | Z725: 0 | AA725: 1984 | AB725: 1785 | AC725: =(AA725/AB725)*100 -> 111.1484593837535 | AD725: =(X725*4)+(Z725*2) -> 36
A726: BEST PLAYERS | W726: GEELONG WEST | X726: 5 | Y726: 11 | Z726: 0 | AA726: 1685 | AB726: 1589 | AC726: =(AA726/AB726)*100 -> 106.04153555695406 | AD726: =(X726*4)+(Z726*2) -> 20
A727: SANDRINGHAM | C727: BONNEY | F727: ALLEN | I727: PRATT | L727: BEILBY | O727: MERCER | R727: HOWELL | W727: BRUNSWICK | X727: 5 | Y727: 11 | Z727: 0 | AA727: 1695 | AB727: 2069 | AC727: =(AA727/AB727)*100 -> 81.923634606089905 | AD727: =(X727*4)+(Z727*2) -> 20
A728: GEELONG WEST | C728: EVANS | F728: DALIHAUS | I728: KRANJC | L728: WATT | O728: ALFORD | W728: SPRINGVALE | X728: 4 | Y728: 12 | Z728: 0 | AA728: 1684 | AB728: 2022 | AC728: =(AA728/AB728)*100 -> 83.283877349159255 | AD728: =(X728*4)+(Z728*2) -> 16
A729: GOALKICKERS | W729: CAMBERWELL | X729: 0 | Y729: 16 | Z729: 0 | AA729: 984 | AB729: 3274 | AC729: =(AA729/AB729)*100 -> 30.054978619425775 | AD729: =(X729*4)+(Z729*2) -> 0
A730: SANDRINGHAM | C730: BERGMAN 5 | F730: BENNETT 4 | I730: BRENDAN SAID 3 | M730: EAVES 3 | O730: ALLEN | Q730: BONNEY
A731: GEELONG WEST | C731: WATT 3 | F731: HEWITT 3 | I731: BERRY 2 | K731: DOYLE | M731: FAZIO | O731: MORRISSEY
A733: COBURG | C733: 6 | D733: 7 | E733: 43 | G733: 12 | H733: 13 | I733: 85 | K733: 19 | L733: 14 | M733: 128 | O733: 21 | P733: 20 | Q733: 146 | S733: VENUE: COBURG
A734: PRESTON | C734: 3 | D734: 1 | E734: 19 | G734: 4 | H734: 6 | I734: 30 | K734: 10 | L734: 10 | M734: 70 | O734: 15 | P734: 11 | Q734: 101 | S734: G CASEY :R CASEY
A735: BEST PLAYERS
A736: COBURG | C736: M HARBINSON | F736: EADE | I736: CHRISTIANSEN | L736: SHELDON | O736: NIMMO
A737: PRESTON | C737: WATT | F737: TOWAN | I737: FROST | L737: SHAW
A738: GOALKICKERS
A739: COBURG | C739: M HARBINSON 5 | F739: CHRISTIANSEN 3 | J739: HALBERT 2 | M739: EADE 2 | O739: FITZPATRICK 2 | R739: MANSFIELD 2 | V739: FREMANTLE 2 | Y739: TARANTO 2 | AB739: LAIDLER
A740: PRESTON | C740: SHAW 6 | F740: BRADDY 2 | I740: CARLSON | K740: PERRY | M740: WHITE | O740: BRINE | Q740: FROST | S740: LUMICISI | V740: PRIDEAUX
A742: PORT MELBOURNE | C742: 9 | D742: 6 | E742: 60 | G742: 15 | H742: 12 | I742: 102 | K742: 22 | L742: 18 | M742: 150 | O742: 28 | P742: 28 | Q742: 196 | S742: VENUE: PORT MELBOURNE
A743: BRUNSWICK | C743: 3 | D743: 1 | E743: 19 | G743: 5 | H743: 5 | I743: 35 | K743: 10 | L743: 11 | M743: 71 | O743: 14 | P743: 15 | Q743: 99 | S743: NOLAN :SMITH
A744: BEST PLAYERS
A745: PORT MELBOURNE | C745: JENNINGS | F745: CRUTCHFIELD | I745: CHADBAND | L745: MCDONALD | O745: SWAN | R745: RODDA
A746: BRUNSWICK | C746: LEAHY | F746: THOROGOOD | I746: CARROLL | L746: BAKER | O746: WHILLAS | R746: POTTER
A747: GOALKICKERS
A748: PORT MELBOURNE | C748: McDONALD 7 | F748: DOHERTY 5 | I748: HARKINS 4 | L748: JENNINGS 3 | N748: JOHNSON 3 | Q748: BAILLIE 2 | S748: HOWARD 2 | V748: CRUTCHFIELD | Y748: ROSS
A749: BRUNSWICK | C749: POTTER 3 | F749: CATTOGGIO 2 | I749: REID 2 | K749: EDWARDS 2 | N749: HEATHER 2 | P749: LEAHY | R749: FLOWER | U749: BAKER
A751: WILLIAMSTOWN | C751: 12 | D751: 2 | E751: 74 | G751: 28 | H751: 6 | I751: 174 | K751: 40 | L751: 15 | M751: 255 | O751: 55 | P751: 17 | Q751: 347 | S751: VENUE: CAMBERWELL
A752: CAMBERWELL | C752: 2 | D752: 5 | E752: 17 | G752: 3 | H752: 6 | I752: 24 | K752: 3 | L752: 6 | M752: 24 | O752: 4 | P752: 8 | Q752: 32 | S752: McDONALD :VERGONA
A753: BEST PLAYERS
A754: WILLIAMSTOWN | C754: HUGHES | F754: OWEN | I754: GIBSON | L754: SLEVISON | O754: ROUND | Q754: McTAGGART
A755: CAMBERWELL | C755: FREW | F755: MAILING | I755: DYSON | L755: GRAY
A756: GOALKICKERS | Q756: OWEN | T756: HUGHES
A757: WILLIAMSTOWN | C757: GIBSON 22 | E757: ROUND 7 | G757: KNIGHT 5 | I757: SAIT 4 | K757: CAHILL 4 | M757: RICKMAN 3 | P757: SLEVISON 3 | R757: MUSCHIALLI 2 | V757: KERSHAW | X757: McTAGGART | AB757: PASTORE
A758: CAMBERWELL | C758: DYSON | E758: O'CONNER | G758: AYLEN | I758: MAILING
A760: ROUND 17 | D760: 17TH AUGUST | I760: WEATHER | S760: VENUE: BRUNSWICK
D761: 1ST QTR | H761: 2ND QTR | L761: 3RD QTR | P761: FINAL | S761: UMPIRES
A762: BRUNSWICK | C762: 9 | D762: 5 | E762: 59 | G762: 11 | H762: 5 | I762: 71 | K762: 14 | L762: 6 | M762: 90 | O762: 22 | P762: 8 | Q762: 140 | S762: CASEY | X762: LADDER | AB762: ROUND | AD762: 17
A763: SPRINGVALE | C763: 2 | D763: 1 | E763: 13 | G763: 5 | H763: 6 | I763: 36 | K763: 8 | L763: 8 | M763: 56 | O763: 11 | P763: 14 | Q763: 80 | S763: GLEESON
A764: BEST PLAYERS | W764: TEAM | X764: W | Y764: L | Z764: D | AA764: FOR | AB764: AGST | AC764: % | AD764: PTS
A765: BRUNSWICK | C765: WEST | F765: DUGDALE | I765: WRIGHT | L765: BICKLEY | O765: CONNELL | R765: GIBSON
A766: SPRINGVALE | C766: KEAYS | F766: HERBERT | I766: MEADE | L766: DEMPSTER | O766: KING | W766: COBURG | X766: 14 | Y766: 3 | Z766: 0 | AA766: 2360 | AB766: 1504 | AC766: =(AA766/AB766)*100 -> 156.91489361702128 | AD766: =(X766*4)+(Z766*2) -> 56
A767: GOALKICKERS | P767: LOVETT | R767: EDWARDS | W767: FRANKSTON | X767: 13 | Y767: 4 | Z767: 0 | AA767: 2137 | AB767: 1746 | AC767: =(AA767/AB767)*100 -> 122.39404352806416 | AD767: =(X767*4)+(Z767*2) -> 52
A768: BRUNSWICK | C768: BAKER 4 | F768: REID 4 | H768: FLOWER 3 | J768: HEATHER 2 | M768: POTTER 2 | O768: SMITH 2 | Q768: WRIGHT 2 | S768: WEST | W768: WILLIAMSTOWN | X768: 11 | Y768: 6 | Z768: 0 | AA768: 2375 | AB768: 1601 | AC768: =(AA768/AB768)*100 -> 148.34478450968146 | AD768: =(X768*4)+(Z768*2) -> 44
A769: SPRINGVALE | C769: ANDERSON 3 | F769: NICOL 3 | H769: DUDLEY 2 | J769: MALONI | L769: ROBINSON | N769: JEFFS | W769: PRESTON | X769: 11 | Y769: 6 | Z769: 0 | AA769: 2139 | AB769: 1575 | AC769: =(AA769/AB769)*100 -> 135.8095238095238 | AD769: =(X769*4)+(Z769*2) -> 44
S770: VENUE: PRESTON
A771: PRESTON | C771: 5 | D771: 4 | E771: 34 | G771: 8 | H771: 8 | I771: 56 | K771: 13 | L771: 11 | M771: 89 | O771: 13 | P771: 14 | Q771: 92 | S771: VERGONA | W771: PORT MELBOURNE | X771: 10 | Y771: 7 | Z771: 0 | AA771: 2309 | AB771: 2000 | AC771: =(AA771/AB771)*100 -> 115.45 | AD771: =(X771*4)+(Z771*2) -> 40
A772: PORT MELBOURNE | C772: 5 | D772: 1 | E772: 31 | G772: 6 | H772: 2 | I772: 38 | K772: 10 | L772: 3 | M772: 63 | O772: 14 | P772: 5 | Q772: 89 | S772: COOKE | W772: SANDRINGHAM | X772: 10 | Y772: 7 | Z772: 0 | AA772: 2129 | AB772: 1848 | AC772: =(AA772/AB772)*100 -> 115.20562770562771 | AD772: =(X772*4)+(Z772*2) -> 40
A773: BEST PLAYERS | W773: GEELONG WEST | X773: 6 | Y773: 11 | Z773: 0 | AA773: 1816 | AB773: 1697 | AC773: =(AA773/AB773)*100 -> 107.01237477902181 | AD773: =(X773*4)+(Z773*2) -> 24
A774: PRESTON | C774: DUNBAR | F774: JORDAN | I774: CHARISOU | L774: BRINE | O774: HUNT | R774: WHITE | W774: BRUNSWICK | X774: 6 | Y774: 11 | Z774: 0 | AA774: 1835 | AB774: 2149 | AC774: =(AA774/AB774)*100 -> 85.388552815262912 | AD774: =(X774*4)+(Z774*2) -> 24
A775: PORT MELBOURNE | C775: RODDA | F775: SWAN | I775: HARKINS | L775: AHEARN | O775: STROOPER | R775: COOPER | W775: SPRINGVALE | X775: 4 | Y775: 13 | Z775: 0 | AA775: 1724 | AB775: 2162 | AC775: =(AA775/AB775)*100 -> 79.740980573543013 | AD775: =(X775*4)+(Z775*2) -> 16
A776: GOALKICKERS | W776: CAMBERWELL | X776: 0 | Y776: 17 | Z776: 0 | AA776: 1047 | AB776: 3419 | AC776: =(AA776/AB776)*100 -> 30.622989178122257 | AD776: =(X776*4)+(Z776*2) -> 0
A777: PRESTON | C777: SHAW 6 | F777: FROST 2 | I777: PLOWMAN 2 | L777: BRADDY 2 | O777: CARLSON
A778: PORT MELBOURNE | C778: McDONALD 5 | F778: DOHERTY 4 | I778: TAYLOR 2 | K778: JOHNSON | M778: RODDA | O778: SWAN
A780: GEELONG WEST | C780: 7 | D780: 4 | E780: 46 | G780: 12 | H780: 9 | I780: 81 | K780: 15 | L780: 13 | M780: 103 | O780: 19 | P780: 17 | Q780: 131 | S780: VENUE: GEELONG WEST
A781: COBURG | C781: 2 | D781: 3 | E781: 15 | G781: 10 | H781: 7 | I781: 67 | K781: 14 | L781: 10 | M781: 94 | O781: 16 | P781: 12 | Q781: 108 | S781: MARSHALL :McMAHON
A782: BEST PLAYERS
A783: GEELONG WEST | C783: McDOWELL | F783: NICHOLSON | I783: FAZIO | L783: DALIHAUS | O783: WATT | R783: ALFORD
A784: COBURG | C784: CHRISTIANSEN | F784: EADE | I784: TARANTO | L784: MANSFIELD
A785: GOALKICKERS
A786: GEELONG WEST | C786: WATT 3 | E786: FAZIO 3 | G786: BERRY 2 | I786: EVANS 2 | K786: REDHEAD 2 | M786: DOYLE 2 | O786: NICHOLSON | R786: GIBSON | U786: HADDOCK
A787: COBURG | C787: CHRISTIANSEN 4 | G787: HALBERT 3 | I787: MANSFIELD 3 | L787: FREMANTLE 2 | O787: ALLISON | Q787: HARBINSON | T787: NIMMO | W787: FITZPATRICK
A789: SANDRINGHAM | C789: 7 | D789: 1 | E789: 43 | G789: 11 | H789: 6 | I789: 72 | K789: 15 | L789: 8 | M789: 98 | O789: 22 | P789: 13 | Q789: 145 | S789: VENUE: CAMBERWELL
A790: CAMBERWELL | C790: 6 | D790: 1 | E790: 37 | G790: 6 | H790: 3 | I790: 39 | K790: 8 | L790: 6 | M790: 54 | O790: 9 | P790: 9 | Q790: 63 | S790: HULM :SMITH
A791: BEST PLAYERS
A792: SANDRINGHAM | C792: HOWELL | F792: JOHNSON | I792: BONNEY | L792: CARTY | O792: BENNETT | R792: HENDERSON
A793: CAMBERWELL | C793: ANGUS | F793: FREW | I793: McFEE | L793: JAKOBI | O793: RAFFERTY | R793: DE KONNING
A794: GOALKICKERS
A795: SANDRINGHAM | C795: BENNETT 8 | F795: MONCRIEFF 7 | I795: KRAKOUER | L795: WALL | N795: PRATT | P795: EAVES | R795: BERGMAN | U795: BONNEY | X795: SAID
A796: CAMBERWELL | C796: AYLEN 3 | F796: MAILING 2 | I796: JAKOBI | K796: DYSON | M796: FREW | O796: RAZUMS
A798: FRANKSTON | C798: 9 | D798: 1 | E798: 55 | G798: 10 | H798: 1 | I798: 61 | K798: 16 | L798: 3 | M798: 99 | O798: 16 | P798: 3 | Q798: 99 | S798: VENUE: WILLIAMSTOWN
A799: WILLIAMSTOWN | C799: 3 | D799: 1 | E799: 19 | G799: 9 | H799: 7 | I799: 61 | K799: 10 | L799: 11 | M799: 71 | O799: 13 | P799: 16 | Q799: 94 | S799: RYAN ;NOLAN
A800: BEST PLAYERS
A801: FRANKSTON | C801: RAVEN | F801: GEDDES | I801: O'RILEY | L801: O'BRIEN | O801: CZARNECKI | R801: SARAU
A802: WILLIAMSTOWN | C802: SLEVISON | F802: KNIGHT | I802: MURPHY | L802: WHEELER | O802: OWEN | R802: SMITH
A803: GOALKICKERS
A804: FRANKSTON | C804: McCARTY 6 | F804: O'BRIEN 3 | I804: BROWN 2 | K804: MOORE 2 | M804: BARDOEL | O804: GEDDES | Q804: CZARNECKI
A805: WILLIAMSTOWN | C805: KNIGHT 7 | F805: GIBSON 3 | I805: ROUND | K805: HUGHES | M805: SMITH
A807: ROUND 18 | D807: 24TH AUGUST | I807: WEATHER | S807: VENUE: FRANKSTON
D808: 1ST QTR | H808: 2ND QTR | L808: 3RD QTR | P808: FINAL | S808: UMPIRES
A809: BRUNSWICK | C809: 6 | D809: 2 | E809: 38 | G809: 13 | H809: 4 | I809: 82 | K809: 22 | L809: 7 | M809: 139 | O809: 24 | P809: 9 | Q809: 153 | S809: MARSHALL | X809: LADDER | AB809: ROUND | AD809: 18
A810: FRANKSTON | C810: 2 | D810: 4 | E810: 16 | G810: 4 | H810: 9 | I810: 33 | K810: 7 | L810: 12 | M810: 54 | O810: 8 | P810: 18 | Q810: 66 | S810: VERGONA
A811: BEST PLAYERS | W811: TEAM | X811: W | Y811: L | Z811: D | AA811: FOR | AB811: AGST | AC811: % | AD811: PTS
A812: BRUNSWICK | C812: BAKER | F812: DUGDALE | I812: CONNELL | L812: FLOWER | O812: THOROGOOD | R812: SMITH
A813: FRANKSTON | C813: RAVEN | F813: O'BRIEN | I813: CZARNECKI | W813: COBURG | X813: 15 | Y813: 3 | Z813: 0 | AA813: 2560 | AB813: 1548 | AC813: =(AA813/AB813)*100 -> 165.37467700258398 | AD813: =(X813*4)+(Z813*2) -> 60
A814: GOALKICKERS | W814: FRANKSTON | X814: 13 | Y814: 5 | Z814: 0 | AA814: 2203 | AB814: 1899 | AC814: =(AA814/AB814)*100 -> 116.00842548709846 | AD814: =(X814*4)+(Z814*2) -> 52
A815: BRUNSWICK | C815: FLOWER 8 | F815: SAKER 5 | I815: HEATHER 4 | L815: LOVETT 2 | N815: POTTER 2 | Q815: REID 2 | S815: LEYDIN | W815: WILLIAMSTOWN | X815: 12 | Y815: 6 | Z815: 0 | AA815: 2540 | AB815: 1718 | AC815: =(AA815/AB815)*100 -> 147.84633294528521 | AD815: =(X815*4)+(Z815*2) -> 48
A816: FRANKSTON | C816: O'BRIEN 3 | F816: BOLAND 2 | I816: BRIESE | K816: MOORE | M816: WHITFIELD | W816: PRESTON | X816: 12 | Y816: 6 | Z816: 0 | AA816: 2222 | AB816: 1646 | AC816: =(AA816/AB816)*100 -> 134.99392466585661 | AD816: =(X816*4)+(Z816*2) -> 48
S817: VENUE: COBURG
A818: COBURG | C818: 6 | D818: 3 | E818: 39 | G818: 15 | H818: 10 | I818: 100 | K818: 22 | L818: 16 | M818: 148 | O818: 30 | P818: 20 | Q818: 200 | S818: BRADY | W818: PORT MELBOURNE | X818: 10 | Y818: 8 | Z818: 0 | AA818: 2382 | AB818: 2106 | AC818: =(AA818/AB818)*100 -> 113.10541310541311 | AD818: =(X818*4)+(Z818*2) -> 40
A819: CAMBERWELL | C819: 4 | D819: 6 | E819: 30 | G819: 4 | H819: 7 | I819: 31 | K819: 4 | L819: 7 | M819: 31 | O819: 6 | P819: 8 | Q819: 44 | S819: NOLAN | W819: SANDRINGHAM | X819: 10 | Y819: 8 | Z819: 0 | AA819: 2246 | AB819: 2013 | AC819: =(AA819/AB819)*100 -> 111.57476403378044 | AD819: =(X819*4)+(Z819*2) -> 40
A820: BEST PLAYERS | W820: GEELONG WEST | X820: 7 | Y820: 11 | Z820: 0 | AA820: 1922 | AB820: 1770 | AC820: =(AA820/AB820)*100 -> 108.58757062146893 | AD820: =(X820*4)+(Z820*2) -> 28
A821: COBURG | C821: SHELDON | F821: M HARBINSON | I821: CHRISTIANSEN | L821: MANSFIELD | O821: FREEMAN | R821: INGRAM | W821: BRUNSWICK | X821: 7 | Y821: 11 | Z821: 0 | AA821: 1988 | AB821: 2215 | AC821: =(AA821/AB821)*100 -> 89.75169300225734 | AD821: =(X821*4)+(Z821*2) -> 28
A822: CAMBERWELL | C822: FREW | F822: ANGUS | I822: CONSTANTINOU | L822: McFEE | O822: MAILING | R822: GRAY | W822: SPRINGVALE | X822: 4 | Y822: 13 | Z822: 0 | AA822: 1724 | AB822: 2162 | AC822: =(AA822/AB822)*100 -> 79.740980573543013 | AD822: =(X822*4)+(Z822*2) -> 16
A823: GOALKICKERS | M823: EADE | N823: HALBERT | P823: SHELDON | S823: WEIDEMAN | W823: CAMBERWELL | X823: 0 | Y823: 18 | Z823: 0 | AA823: 1091 | AB823: 3619 | AC823: =(AA823/AB823)*100 -> 30.146449295385462 | AD823: =(X823*4)+(Z823*2) -> 0
A824: COBURG | C824: INGRAM 8 | E824: M HARBINSON 7 | H824: CHRISTIANSEN 4 | K824: ALLISON 2 | M824: FREEMAN 2 | P824: MANSFIELD 2 | S824: CLEARY
A825: CAMBERWELL | C825: AYLEN 2 | F825: CONSTANTINOU 2 | J825: BOYCE | L825: GRAY
A827: GEELONG WEST | C827: 6 | D827: 6 | E827: 42 | G827: 10 | H827: 11 | I827: 71 | K827: 14 | L827: 13 | M827: 97 | O827: 15 | P827: 16 | Q827: 106 | S827: VENUE: PORT MELBOURNE
A828: PORT MELBOURNE | C828: 2 | D828: 4 | E828: 16 | G828: 3 | H828: 9 | I828: 27 | K828: 7 | L828: 12 | M828: 54 | O828: 10 | P828: 13 | Q828: 73 | S828: CASEY ;HULM
A829: BEST PLAYERS
A830: GEELONG WEST | C830: KRANJC | F830: DALIHAUS | I830: REDHEAD | L830: NICHOLSON | O830: FAZIO
A831: PORT MELBOURNE | C831: COOPER | F831: DOHERTY | I831: SWAN
A832: GOALKICKERS
A833: GEELONG WEST | C833: DOYLE 4 | F833: BERRY 3 | H833: FAZIO 2 | J833: McDOWELL 2 | M833: MORRISSEY | P833: NICHOLSON | S833: PERKINS | V833: WATT
A834: PORT MELBOURNE | C834: DOHERTY 3 | F834: MCDONALD 2 | I834: SWAN 2 | K834: AHEARN | M834: FREYER | O834: HICKS
A836: PRESTON | C836: 4 | D836: 2 | E836: 26 | G836: 6 | H836: 3 | I836: 39 | K836: 10 | L836: 6 | M836: 66 | O836: 12 | P836: 11 | Q836: 83 | S836: VENUE: SPRINGVALE
A837: SPRINGVALE | C837: 5 | D837: 0 | E837: 30 | G837: 8 | H837: 2 | I837: 50 | K837: 10 | L837: 3 | M837: 63 | O837: 11 | P837: 5 | Q837: 71 | S837: SMITH :RYAN
A838: BEST PLAYERS
A839: PRESTON | C839: CHARISOU | F839: FROST | I839: DUNBAR | L839: SALVADORE | O839: LUMICISI | R839: BRINE
A840: SPRINGVALE | C840: KEAYS | F840: LETTS | I840: ANDERSON | L840: MEADE | O840: COLLINS | R840: MENDE
A841: GOALKICKERS
A842: PRESTON | C842: SHAW 5 | F842: FROST 3 | H842: BRADDY | J842: HUNT | L842: LUMICISI | N842: DUNBAR
A843: SPRINGVALE | C843: ANDERSON 3 | F843: ROBINSON 3 | I843: DUDLEY 2 | K843: MENDE 2 | M843: MALONI
A845: WILLIAMSTOWN | C845: 7 | D845: 4 | E845: 46 | G845: 14 | H845: 9 | I845: 93 | K845: 16 | L845: 18 | M845: 114 | O845: 24 | P845: 21 | Q845: 165 | S845: VENUE: BEACH ROAD
A846: SANDRINGHAM | C846: 6 | D846: 1 | E846: 37 | G846: 12 | H846: 3 | I846: 75 | K846: 14 | L846: 4 | M846: 88 | O846: 18 | P846: 9 | Q846: 117 | S846: McDONALD :MARCY
A847: BEST PLAYERS
A848: WILLIAMSTOWN | C848: MURPHY | F848: SMITH | I848: SLEVISON | L848: KERSHAW | O848: OWEN | R848: MCTAGGART
A849: SANDRINGHAM | C849: BONNEY | F849: BERGMAN | I849: PRATT | L849: WALL | O849: FITZPATRICK
A850: GOALKICKERS
A851: WILLIAMSTOWN | C851: GIBSON 6 | E851: RICKMAN 3 | H851: SLEVISON 3 | J851: FOTHERINGHAM 3 | N851: S KNIGHT 2 | Q851: SAIT 2 | S851: OWEN 2 | V851: JAMES | X851: ROUND | Z851: SMITH
A852: SANDRINGHAM | C852: BERGMAN 5 | F852: EAVES 3 | H852: BENNETT 2 | J852: KRAKOUER 2 | M852: KRISTENSEN 2 | P852: ALLEN | R852: WALL | T852: PRATT | V852: BEILBY
A854: FINALS
A855: 1ST SEMI | D855: 31ST AUGUST | I855: WEATHER
D856: 1ST QTR | H856: 2ND QTR | L856: 3RD QTR | P856: FINAL | S856: VENUE: JUNCTION OVAL
A857: WILLIAMSTOWN | C857: 4 | D857: 3 | E857: 27 | G857: 8 | H857: 5 | I857: 53 | K857: 15 | L857: 7 | M857: 97 | O857: 19 | P857: 10 | Q857: 124 | S857: UMPIRES
A858: PRESTON | C858: 5 | D858: 2 | E858: 32 | G858: 9 | H858: 4 | I858: 58 | K858: 14 | L858: 6 | M858: 90 | O858: 18 | P858: 6 | Q858: 114 | S858: MARCY ;CASEY
A859: BEST PLAYERS
A860: WILLIAMSTOWN | C860: ROUND | F860: KERSHAW | I860: SLEVISON | L860: SAIT | O860: FOTHERINGHAM | R860: SMITH
A861: PRESTON | C861: SHAW | F861: LUMICISI | I861: CARLSON | L861: JORDAN
A862: GOALKICKERS
A863: WILLIAMSTOWN | C863: FOTHERINGHAM 7 | F863: RICKMAN 3 | I863: SAIT 3 | K863: SMITH 3 | M863: KNIGHT | O863: ROUND | Q863: SLEVISON
A864: PRESTON | C864: SHAW 10 | F864: LUMICISI 4 | I864: SALVADOR 2 | L864: BRINE | N864: JORDAN
A866: 2ND SEMI | D866: 7TH SEPTEMBER | I866: WEATHER
A867: COBURG | C867: 3 | D867: 4 | E867: 22 | G867: 10 | H867: 12 | I867: 72 | K867: 16 | L867: 13 | M867: 109 | O867: 25 | P867: 19 | Q867: 169 | S867: VENUE: JUNCTION OVAL
A868: FRANKSTON | C868: 7 | D868: 2 | E868: 44 | G868: 11 | H868: 2 | I868: 68 | K868: 15 | L868: 3 | M868: 93 | O868: 17 | P868: 5 | Q868: 107 | S868: RYAN :MARSHALL
A869: BEST PLAYERS
A870: COBURG | C870: A HARBINSON | F870: M HARBINSON | I870: WEIDEMAN | L870: SHELDON | O870: NIMMO | R870: ALLISON
A871: FRANKSTON | C871: FAVIER | F871: MCCARTY | I871: RAVEN | L871: PAYNTER
A872: GOALKICKERS
A873: COBURG | C873: LAIDLER 5 | E873: CHRISTIANSEN 3 | I873: M HARBINSON 3 | L873: FREEMAN 3 | O873: GUMLEY 2 | Q873: CLEARY 2 | S873: TARANTO 2 | W873: INGRAM 2
A874: FRANKSTON | C874: MCCARTY 7 | F874: BROWN 3 | I874: HUTCHINSON 2 | L874: PAYNTER 2 | O874: BOLAND | Q874: FAVIER | S874: JONES
A876: PRELIMINARY FINAL | F876: 14TH SEPTEMBER
A877: WILLIAMSTOWN | C877: 6 | D877: 6 | E877: 42 | G877: 9 | H877: 9 | I877: 63 | K877: 15 | L877: 15 | M877: 105 | O877: 19 | P877: 19 | Q877: 133 | S877: VENUE: JUNCTION OVAL
A878: FRANKSTON | C878: 2 | D878: 2 | E878: 14 | G878: 5 | H878: 6 | I878: 36 | K878: 7 | L878: 12 | M878: 54 | O878: 12 | P878: 17 | Q878: 89 | S878: CASEY ;NOLAN
A879: BEST PLAYERS
A880: WILLIAMSTOWN | C880: JAMES | F880: MURPHY | I880: WHEELER | L880: SLEVISON | O880: OWEN | R880: McTAGGART
A881: FRANKSTON | C881: FAVIER | F881: GEDDES | I881: RAVEN | L881: BROWN | O881: HUTCHINSON | R881: O'BRIEN
A882: GOALKICKERS
A883: WILLIAMSTOWN | C883: FOTHERINGHAM 4 | G883: JAMES 4 | I883: GIBSON 4 | K883: CAHILL 3 | M883: OWEN 2 | O883: SMITH 2
A884: FRANKSTON | C884: MCCARTY 4 | F884: GEDDES 3 | I884: BROWN 2 | K884: BELL | M884: HUTCHINSON | P884: O'BRIEN
A886: GRAND FINAL | D886: 21ST SEPTEMBER
A887: WILLIAMSTOWN | C887: 2 | D887: 3 | E887: 15 | G887: 6 | H887: 4 | I887: 40 | K887: 14 | L887: 6 | M887: 90 | O887: 17 | P887: 9 | Q887: 111 | S887: VENUE: JUNCTION OVAL
A888: COBURG | C888: 1 | D888: 3 | E888: 9 | G888: 5 | H888: 6 | I888: 36 | K888: 6 | L888: 9 | M888: 45 | O888: 14 | P888: 14 | Q888: 98 | S888: MARCY :RYAN
A889: BEST PLAYERS
A890: WILLIAMSTOWN | C890: PASTORE | F890: MURPHY | I890: JAMES | L890: WHEELER | O890: SAIT | R890: SLEVISON
A891: COBURG | C891: RIENIETS | F891: SHELDON | I891: LAIDLER | L891: NIMMO | O891: WEIDEMAN | R891: GUMLEY
A892: GOALKICKERS
A893: WILLIAMSTOWN | C893: FOTHERINGHAM 5 | G893: CAHILL 4 | I893: SMITH 3 | K893: SIMMONS 2 | N893: SAIT | P893: ROUND | R893: OWEN
A894: COBURG | C894: LAIDLER 5 | F894: M HARBINSON 2 | J894: CHRISTIANSEN | M894: ALLISON | O894: GUMLEY | Q894: COLLIINS | S894: SHELDON | V894: TARANTO | X894: INGRAM
A896: REPRESENTATIVE MATCH | F896: 7TH JUNE
A897: V.F.A. | O897: 14 | P897: 13 | Q897: 97
A898: V.A.F.A. | O898: 10 | P898: 8 | Q898: 68
A899: BEST PLAYERS
A900: V.F.A. | C900: ALLEN | F900: SARAU | I900: EVANS | L900: HETHERINGTON | O900: CARTER | R900: McTAGGART
A901: V.A.F.A. | C901: SMYTHE | F901: FULLER | I901: MEEHAN | L901: SCHOBER | O901: WITTZ | R901: CONSIDINE
A902: GOALKICKERS
A903: V.F.A. | C903: SHAW 4 | F903: SALVADORE 2 | I903: ALLEN 2 | K903: HARBINSON 2 | N903: SHELDON | P903: ALLISON | R903: RICKMAN | U903: CHRISTIANSEN
A904: V.A.F.A. | C904: CAPIRON 2 | F904: HERMAN 2 | I904: DEVESON | K904: MEEHAN | M904: SPILLANE | O904: BERZINS | Q904: WRIGHT | S904: TREGEAR