A1: Victorian Football Association
A2: Season 1987 - Division One
A3: © Copyright Wal Williams | F3: First created: 14 November 2015
A4: Contact: joywalwi at gmail dot com | F4: Last updated: 3 December 2016 | W4: VFA Results and tables - Link to the main index page
A5: You are free to copy this document in whole or part provided that proper acknowledgement is given to the author. All rights reserved.
A7: 1987 | C7: 1ST DIVISION
A8: ROUND 1 | D8: 12TH APRIL | I8: WEATHER | S8: VENUE: PRESTON
D9: 1ST QTR | H9: 2ND QTR | L9: 3RD QTR | P9: FINAL | S9: UMPIRES
A10: PRESTON | C10: 1 | D10: 2 | E10: 8 | G10: 7 | H10: 8 | I10: 50 | K10: 8 | L10: 13 | M10: 61 | O10: 16 | P10: 20 | Q10: 116 | S10: N McDONALD | X10: LADDER | AB10: ROUND | AD10: 1
A11: BRUNSWICK | C11: 3 | D11: 6 | E11: 24 | G11: 5 | H11: 12 | I11: 42 | K11: 13 | L11: 19 | M11: 97 | O11: 15 | P11: 21 | Q11: 111 | S11: VERGONA
A12: BEST PLAYERS | W12: TEAM | X12: W | Y12: L | Z12: D | AA12: FOR | AB12: AGST | AC12: % | AD12: PTS
A13: PRESTON | C13: PERRY | F13: MURPHY | I13: BRINE | L13: HALAS | N13: MARCON | Q13: PRIDEAUX
A14: BRUNSWICK | C14: CONNELL | F14: DUGDALE | I14: GRIFFITHS | L14: HISLOP | N14: LOVETT | Q14: SMITH | W14: FRANKSTON | X14: 1 | Y14: 0 | Z14: 0 | AA14: 145 | AB14: 71 | AC14: =(AA14/AB14)*100 -> 204.22535211267606 | AD14: =(X14*4)+(Z14*2) -> 4
A15: GOALKICKERS | W15: SPRINGVALE | X15: 1 | Y15: 0 | Z15: 0 | AA15: 153 | AB15: 77 | AC15: =(AA15/AB15)*100 -> 198.70129870129873 | AD15: =(X15*4)+(Z15*2) -> 4
A16: PRESTON | C16: HALAS 5 | E16: MURPHY 4 | G16: FULLER 2 | I16: DUNBAR 2 | K16: M LAWSON | N16: RAYMENT | Q16: MARCON | W16: PORT MELBOURNE | X16: 1 | Y16: 0 | Z16: 0 | AA16: 143 | AB16: 104 | AC16: =(AA16/AB16)*100 -> 137.5 | AD16: =(X16*4)+(Z16*2) -> 4
A17: BRUNSWICK | C17: BAKER 4 | E17: WRIGHT 3 | G17: LOVETT 2 | I17: SMITH 2 | K17: CALLANDER | N17: GRIFFITHS | Q17: KELLY | S17: LEAHY | W17: COBURG | X17: 1 | Y17: 0 | Z17: 0 | AA17: 113 | AB17: 99 | AC17: =(AA17/AB17)*100 -> 114.14141414141415 | AD17: =(X17*4)+(Z17*2) -> 4
S18: VENUE: BOX HILL
A19: PORT MELBOURNE | C19: 6 | D19: 7 | E19: 43 | G19: 9 | H19: 13 | I19: 67 | K19: 17 | L19: 19 | M19: 121 | O19: 20 | P19: 23 | Q19: 143 | S19: CASEY | W19: PRESTON | X19: 1 | Y19: 0 | Z19: 0 | AA19: 116 | AB19: 111 | AC19: =(AA19/AB19)*100 -> 104.5045045045045 | AD19: =(X19*4)+(Z19*2) -> 4
A20: BOX HILL | C20: 2 | D20: 3 | E20: 15 | G20: 8 | H20: 6 | I20: 54 | K20: 10 | L20: 9 | M20: 69 | O20: 15 | P20: 14 | Q20: 104 | S20: MARSHALL | W20: BRUNSWICK | X20: 0 | Y20: 1 | Z20: 0 | AA20: 111 | AB20: 116 | AC20: =(AA20/AB20)*100 -> 95.689655172413794 | AD20: =(X20*4)+(Z20*2) -> 0
A21: BEST PLAYERS | W21: WILLIAMSTOWN | X21: 0 | Y21: 1 | Z21: 0 | AA21: 99 | AB21: 113 | AC21: =(AA21/AB21)*100 -> 87.610619469026545 | AD21: =(X21*4)+(Z21*2) -> 0
A22: PORT MELBOURNE | C22: MOURNEY | F22: WALL | I22: CHADBAND | L22: HICKS | O22: CARTER | R22: RAINSFORD | W22: BOX HILL | X22: 0 | Y22: 1 | Z22: 0 | AA22: 104 | AB22: 143 | AC22: =(AA22/AB22)*100 -> 72.727272727272734 | AD22: =(X22*4)+(Z22*2) -> 0
A23: BOX HILL | C23: GLEESON | F23: CUFF | I23: HALBERT | L23: NICHOLSON | O23: GERADTS | R23: DODIG | W23: SANDRINGHAM | X23: 0 | Y23: 1 | Z23: 0 | AA23: 77 | AB23: 153 | AC23: =(AA23/AB23)*100 -> 50.326797385620914 | AD23: =(X23*4)+(Z23*2) -> 0
A24: GOALKICKERS | N24: JENNINGS | Q24: WALL | R24: WHITZELL | W24: GEELONG WEST | X24: 0 | Y24: 1 | Z24: 0 | AA24: 71 | AB24: 145 | AC24: =(AA24/AB24)*100 -> 48.96551724137931 | AD24: =(X24*4)+(Z24*2) -> 0
A25: PORT MELBOURNE | C25: MOURNEY 9 | F25: ALLENDER 2 | I25: SNEDDON 2 | L25: CARTER | N25: DOHERTY | P25: EVANS | R25: HICKS
A26: BOX HILL | C26: BOLTON 5 | F26: HALBERT 3 | I26: WILSON 2 | K26: BURKE | M26: GARTH | O26: G LAKE | Q26: NICHOLSON | T26: TURNER
A28: SPRINGVALE | C28: 3 | D28: 8 | E28: 26 | G28: 8 | H28: 9 | I28: 57 | K28: 17 | L28: 19 | M28: 121 | O28: 22 | P28: 21 | Q28: 153 | S28: VENUE: BEACH ROAD
A29: SANDRINGHAM | C29: 1 | D29: 2 | E29: 8 | G29: 5 | H29: 4 | I29: 34 | K29: 7 | L29: 7 | M29: 49 | O29: 11 | P29: 11 | Q29: 77 | S29: HUTCHINSON :MORROW
A30: BEST PLAYERS
A31: SPRINGVALE | C31: TEAM EFFORT
A32: SANDRINGHAM | C32: HENDERSON | F32: MANNIX | I32: HOWELL
A33: GOALKICKERS
A34: SPRINGVALE | C34: ANDERSON 7 | F34: NICOL 4 | H34: VERNON 3 | J34: STEWART 3 | M34: MAYLIN 2 | O34: WARD | Q34: ROBINSON | S34: FOY
A35: SANDRINGHAM | C35: BERGMAN 4 | F35: RYAN | H35: EAVES | J35: JOHNSON | L35: DE KONNING | O35: KRAKOUER | Q35: DIPIERDOMENICO | U35: HOWELL
A37: FRANKSTON | C37: 1 | D37: 4 | E37: 10 | G37: 7 | H37: 11 | I37: 53 | K37: 13 | L37: 15 | M37: 93 | O37: 21 | P37: 19 | Q37: 145 | S37: VENUE: GEELONG WEST
A38: GEELONG WEST | C38: 2 | D38: 7 | E38: 19 | G38: 3 | H38: 8 | I38: 26 | K38: 7 | L38: 13 | M38: 55 | O38: 9 | P38: 17 | Q38: 71 | S38: GLEESON ;CARUSO
A39: BEST PLAYERS
A40: FRANKSTON | C40: SARAU | F40: MARTIN | I40: FAVIER | L40: CZARNECKI | O40: BROWN
A41: GEELONG WEST | C41: WALPOLE | F41: BERRY | I41: WINTER | L41: REDHEAD | O41: AUSTIN
A42: GOALKICKERS
A43: FRANKSTON | C43: O'RILEY 6 | E43: WHITFORD 3 | H43: BOLAND 2 | J43: FAVIER 2 | L43: CZARNECKI 2 | O43: PAYNE 2 | Q43: BELL | R43: BRIESE | U43: DAFF | W43: MELLEHAN
A44: GEELONG WEST | C44: RICHARDSON 2 | F44: KELLY 2 | H44: SHEA | J44: McMASTER | M44: MORRISSEY | P44: NICHOLSON | S44: DOYLE
A46: COBURG | C46: 2 | D46: 3 | E46: 15 | G46: 7 | H46: 7 | I46: 49 | K46: 8 | L46: 10 | M46: 58 | O46: 16 | P46: 17 | Q46: 113 | S46: VENUE: WILLIAMSTOWN
A47: WILLIAMSTOWN | C47: 6 | D47: 4 | E47: 40 | G47: 6 | H47: 6 | I47: 42 | K47: 12 | L47: 15 | M47: 87 | O47: 13 | P47: 21 | Q47: 99 | S47: NOLAN ;RYAN
A48: BEST PLAYERS
A49: COBURG | C49: NIMMO | F49: WEIDEMAN | I49: SHELDON | L49: CLEARY | O49: FITZPATRICK | R49: ATAARTA
A50: WILLIAMSTOWN | C50: KERSHAW | F50: McTAGGART | I50: CAHILL | L50: SAIT | O50: MURPHY | R50: LANE
A51: GOALKICKERS
A52: COBURG | C52: WEATHERALD 5 | F52: FITZPATRICK 3 | I52: EDWARDS 2 | L52: TARANTO 2 | O52: FREEMAN 2 | R52: WILLIAMS 2
A53: WILLIAMSTOWN | C53: S KNIGHT 3 | F53: SIMMONS 3 | I53: McTAGGART 2 | L53: GIBSON 2 | N53: SAIT | P53: CAHILL | R53: KERSHAW
A55: ROUND 2 | D55: 19TH APRIL | I55: WEATHER | S55: VENUE: COBURG
D56: 1ST QTR | H56: 2ND QTR | L56: 3RD QTR | P56: FINAL | S56: UMPIRES
A57: COBURG | C57: 7 | D57: 4 | E57: 46 | G57: 7 | H57: 7 | I57: 49 | K57: 10 | L57: 12 | M57: 72 | O57: 14 | P57: 17 | Q57: 101 | S57: GLEESON | X57: LADDER | AB57: ROUND | AD57: 2
A58: BOX HILL | C58: 0 | D58: 1 | E58: 1 | G58: 4 | H58: 5 | I58: 29 | K58: 7 | L58: 7 | M58: 49 | O58: 8 | P58: 9 | Q58: 57 | S58: HUTCHINSON
A59: BEST PLAYERS | W59: TEAM | X59: W | Y59: L | Z59: D | AA59: FOR | AB59: AGST | AC59: % | AD59: PTS
A60: COBURG | C60: WEIDEMAN | F60: NIMMO | I60: ZOCCALI | L60: SHELDON | O60: FREEMAN | R60: RIENIETS
A61: BOX HILL | C61: COLLINS | F61: McGOWAN | I61: GERADTS | L61: DWYER | O61: GOODWIN | R61: NICHOLSON | W61: SPRINGVALE | X61: 2 | Y61: 0 | Z61: 0 | AA61: 287 | AB61: 107 | AC61: =(AA61/AB61)*100 -> 268.22429906542055 | AD61: =(X61*4)+(Z61*2) -> 8
A62: GOALKICKERS | W62: FRANKSTON | X62: 2 | Y62: 0 | Z62: 0 | AA62: 220 | AB62: 133 | AC62: =(AA62/AB62)*100 -> 165.41353383458645 | AD62: =(X62*4)+(Z62*2) -> 8
A63: COBURG | C63: WEATHERALD 5 | F63: INGRAM 3 | I63: FREEMAN 2 | L63: WEIDEMAN | O63: ZOCCALI | Q63: SHELDON | S63: EDWARDS | W63: PORT MELBOURNE | X63: 2 | Y63: 0 | Z63: 0 | AA63: 277 | AB63: 184 | AC63: =(AA63/AB63)*100 -> 150.54347826086956 | AD63: =(X63*4)+(Z63*2) -> 8
A64: BOX HILL | C64: BOLTON 2 | F64: GERADTS 2 | I64: WILSON | K64: ROACH | M64: GARTH | O64: O'SHEA | W64: COBURG | X64: 2 | Y64: 0 | Z64: 0 | AA64: 214 | AB64: 156 | AC64: =(AA64/AB64)*100 -> 137.17948717948718 | AD64: =(X64*4)+(Z64*2) -> 8
S65: VENUE: FRANKSTON
A66: FRANKSTON | C66: 3 | D66: 4 | E66: 22 | G66: 5 | H66: 8 | I66: 38 | K66: 8 | L66: 9 | M66: 57 | O66: 10 | P66: 15 | Q66: 75 | S66: RYAN | W66: BRUNSWICK | X66: 1 | Y66: 1 | Z66: 0 | AA66: 207 | AB66: 164 | AC66: =(AA66/AB66)*100 -> 126.21951219512195 | AD66: =(X66*4)+(Z66*2) -> 4
A67: PRESTON | C67: 2 | D67: 4 | E67: 16 | G67: 5 | H67: 6 | I67: 36 | K67: 8 | L67: 12 | M67: 60 | O67: 8 | P67: 14 | Q67: 62 | S67: MARSHALL | W67: PRESTON | X67: 1 | Y67: 1 | Z67: 0 | AA67: 178 | AB67: 186 | AC67: =(AA67/AB67)*100 -> 95.6989247311828 | AD67: =(X67*4)+(Z67*2) -> 4
A68: BEST PLAYERS | W68: WILLIAMSTOWN | X68: 0 | Y68: 2 | Z68: 0 | AA68: 147 | AB68: 209 | AC68: =(AA68/AB68)*100 -> 70.334928229665067 | AD68: =(X68*4)+(Z68*2) -> 0
A69: FRANKSTON | C69: MEEHAN | F69: FAVIER | I69: BROWN | L69: MARTIN | O69: PAYNE | Q69: GEDDES | W69: BOX HILL | X69: 0 | Y69: 2 | Z69: 0 | AA69: 161 | AB69: 244 | AC69: =(AA69/AB69)*100 -> 65.983606557377044 | AD69: =(X69*4)+(Z69*2) -> 0
A70: PRESTON | C70: JORDAN | F70: BRINE | I70: PLOWMAN | L70: MARCON | O70: AITKEN | Q70: FROST | W70: SANDRINGHAM | X70: 0 | Y70: 2 | Z70: 0 | AA70: 157 | AB70: 287 | AC70: =(AA70/AB70)*100 -> 54.703832752613238 | AD70: =(X70*4)+(Z70*2) -> 0
A71: GOALKICKERS | W71: GEELONG WEST | X71: 0 | Y71: 2 | Z71: 0 | AA71: 101 | AB71: 279 | AC71: =(AA71/AB71)*100 -> 36.200716845878134 | AD71: =(X71*4)+(Z71*2) -> 0
A72: FRANKSTON | C72: O'RILEY 2 | E72: O'BRIEN 2 | H72: CZARNECKI | K72: DUNBAR | M72: FAVIER | O72: HAMILL | Q72: PAYNE | S72: WHITFIELD
A73: PRESTON | C73: SUTTERBY 3 | F73: BRINE 2 | H73: HALAS | J73: FULLER | L73: LUMICISI
A75: SPRINGVALE | C75: 5 | D75: 4 | E75: 34 | G75: 9 | H75: 7 | I75: 61 | K75: 14 | L75: 11 | M75: 95 | O75: 20 | P75: 14 | Q75: 134 | S75: VENUE: SPRINGVALE
A76: GEELONG WEST | C76: 1 | D76: 4 | E76: 10 | G76: 3 | H76: 4 | I76: 22 | K76: 3 | L76: 4 | M76: 22 | O76: 4 | P76: 6 | Q76: 30 | S76: G CASEY :McDONALD
A77: BEST PLAYERS
A78: SPRINGVALE | C78: NICOL | F78: MENDE | I78: D QUINN | L78: WARD | O78: DUNNE | R78: MALONI
A79: GEELONG WEST | C79: BERRY | F79: HILL | I79: WALPOLE | L79: EVANS | O79: McCLARE
A80: GOALKICKERS
A81: SPRINGVALE | C81: WARD 5 | E81: ROBINSON 3 | H81: ANDERSON 3 | K81: MENDE 2 | M81: DUNNE 2 | O81: MAYLIN 2 | Q81: NANFRA 2 | T81: VERNON
A82: GEELONG WEST | C82: RUSSELL | E82: BERRY | G82: KELLY | I82: LYNCH
A84: PORT MELBOURNE | C84: 4 | D84: 5 | E84: 29 | G84: 10 | H84: 9 | I84: 69 | K84: 15 | L84: 13 | M84: 103 | O84: 20 | P84: 14 | Q84: 134 | S84: VENUE: PORT MELBOURNE
A85: SANDRINGHAM | C85: 2 | D85: 5 | E85: 17 | G85: 4 | H85: 11 | I85: 35 | K85: 7 | L85: 14 | M85: 56 | O85: 11 | P85: 14 | Q85: 80 | S85: NOLAN :VERGONA
A86: BEST PLAYERS
A87: PORT MELBOURNE | C87: WHITZELL | F87: WALL | I87: JENNINGS | L87: CHADBAND | O87: MOURNEY | R87: FOLEY
A88: SANDRINGHAM | C88: BEILBY | F88: ADAMS | I88: PARK | L88: BERGMAN | O88: WALL
A89: GOALKICKERS
A90: PORT MELBOURNE | C90: MOURNEY 5 | F90: WHITZELL 4 | I90: HICKS 4 | K90: SNEDDON 3 | N90: AHEARN 2 | Q90: DOHERTY | S90: FOLEY
A91: SANDRINGHAM | C91: BERGMAN 4 | F91: WALL 3 | H91: ERWIN | J91: CARTY | L91: HOWELL | N91: MERSON
A93: BRUNSWICK | C93: 2 | D93: 1 | E93: 13 | G93: 7 | H93: 5 | I93: 47 | K93: 9 | L93: 9 | M93: 63 | O93: 14 | P93: 12 | Q93: 96 | S93: VENUE: BRUNSWICK
A94: WILLIAMSTOWN | C94: 3 | D94: 5 | E94: 23 | G94: 3 | H94: 8 | I94: 26 | K94: 4 | L94: 12 | M94: 36 | O94: 5 | P94: 18 | Q94: 48 | S94: CARUSO :MORROW
A95: BEST PLAYERS
A96: BRUNSWICK | C96: BAKER | F96: CONNELL | I96: DUGDALE | L96: WEST | O96: HISLOP | R96: LOVETT
A97: WILLIAMSTOWN | C97: McTAGGART | F97: MUSCHIALLI | I97: MURPHY | L97: KENNEDY | O97: WHEELER
A98: GOALKICKERS
A99: BRUNSWICK | C99: POTTER 4 | F99: LOVETT 2 | I99: SMITH 2 | K99: WRIGHT 2 | M99: GIBSON 2 | O99: BAKER | Q99: WEST
A100: WILLIAMSTOWN | C100: FOTHERINGHAM 2 | G100: WHEELER | I100: GIBSON | K100: McTAGGART
A102: ROUND 3 | D102: 26TH APRIL | I102: WEATHER | S102: VENUE: PRESTON
D103: 1ST QTR | H103: 2ND QTR | L103: 3RD QTR | P103: FINAL | S103: UMPIRES
A104: SPRINGVALE | C104: 11 | D104: 0 | E104: 66 | G104: 16 | H104: 1 | I104: 97 | K104: 23 | L104: 9 | M104: 147 | O104: 24 | P104: 13 | Q104: 157 | S104: NOLAN | X104: LADDER | AB104: ROUND | AD104: 3
A105: PRESTON | C105: 3 | D105: 3 | E105: 21 | G105: 8 | H105: 9 | I105: 57 | K105: 11 | L105: 10 | M105: 76 | O105: 15 | P105: 13 | Q105: 103 | S105: GLEESON
A106: BEST PLAYERS | W106: TEAM | X106: W | Y106: L | Z106: D | AA106: FOR | AB106: AGST | AC106: % | AD106: PTS
A107: SPRINGVALE | C107: TEAM EFFORT
A108: PRESTON | C108: MARCON | W108: SPRINGVALE | X108: 3 | Y108: 0 | Z108: 0 | AA108: 444 | AB108: 210 | AC108: =(AA108/AB108)*100 -> 211.42857142857144 | AD108: =(X108*4)+(Z108*2) -> 12
A109: GOALKICKERS | Q109: FOY | W109: PORT MELBOURNE | X109: 3 | Y109: 0 | Z109: 0 | AA109: 436 | AB109: 240 | AC109: =(AA109/AB109)*100 -> 181.66666666666666 | AD109: =(X109*4)+(Z109*2) -> 12
A110: SPRINGVALE | C110: WARD 6 | E110: DUNNE 4 | G110: ROBINSON 4 | J110: STEWART 3 | M110: VERNON 2 | O110: ANDERSON 2 | R110: NANFRA 2 | W110: FRANKSTON | X110: 3 | Y110: 0 | Z110: 0 | AA110: 404 | AB110: 240 | AC110: =(AA110/AB110)*100 -> 168.33333333333334 | AD110: =(X110*4)+(Z110*2) -> 12
A111: PRESTON | C111: BRADDY 2 | E111: JORDAN 2 | G111: LUMICISI 2 | I111: JACKSON 2 | K111: PERRY | M111: PRIDEAUX | O111: PLOWMAN | Q111: BROWN | S111: MURPHY | W111: COBURG | X111: 2 | Y111: 1 | Z111: 0 | AA111: 336 | AB111: 279 | AC111: =(AA111/AB111)*100 -> 120.43010752688173 | AD111: =(X111*4)+(Z111*2) -> 8
M112: SUTTERBY | P112: MARCON | S112: VENUE: GEELONG WEST
A113: PORT MELBOURNE | C113: 4 | D113: 7 | E113: 31 | G113: 10 | H113: 9 | I113: 69 | K113: 19 | L113: 16 | M113: 130 | O113: 23 | P113: 21 | Q113: 159 | S113: MORROW | W113: WILLIAMSTOWN | X113: 1 | Y113: 2 | Z113: 0 | AA113: 266 | AB113: 279 | AC113: =(AA113/AB113)*100 -> 95.340501792114694 | AD113: =(X113*4)+(Z113*2) -> 4
A114: GEELONG WEST | C114: 2 | D114: 7 | E114: 19 | G114: 3 | H114: 14 | I114: 32 | K114: 4 | L114: 17 | M114: 41 | O114: 6 | P114: 20 | Q114: 56 | S114: J RYAN | W114: BRUNSWICK | X114: 1 | Y114: 2 | Z114: 0 | AA114: 314 | AB114: 348 | AC114: =(AA114/AB114)*100 -> 90.229885057471265 | AD114: =(X114*4)+(Z114*2) -> 4
A115: BEST PLAYERS | W115: PRESTON | X115: 1 | Y115: 2 | Z115: 0 | AA115: 281 | AB115: 343 | AC115: =(AA115/AB115)*100 -> 81.924198250728864 | AD115: =(X115*4)+(Z115*2) -> 4
A116: PORT MELBOURNE | C116: WALL | F116: GOSS | I116: ALLENDER | L116: WHITZELL | O116: RAINSFORD | R116: MCCORMACK | W116: SANDRINGHAM | X116: 1 | Y116: 2 | Z116: 0 | AA116: 280 | AB116: 409 | AC116: =(AA116/AB116)*100 -> 68.459657701711492 | AD116: =(X116*4)+(Z116*2) -> 4
A117: GEELONG WEST | C117: EVANS | F117: GIBSON | I117: BERRY | L117: SHEA | O117: McCLARE | W117: BOX HILL | X117: 0 | Y117: 3 | Z117: 0 | AA117: 231 | AB117: 363 | AC117: =(AA117/AB117)*100 -> 63.636363636363633 | AD117: =(X117*4)+(Z117*2) -> 0
A118: GOALKICKERS | P118: JENNINGS | R118: SNEDDON | W118: GEELONG WEST | X118: 0 | Y118: 3 | Z118: 0 | AA118: 157 | AB118: 438 | AC118: =(AA118/AB118)*100 -> 35.844748858447488 | AD118: =(X118*4)+(Z118*2) -> 0
A119: PORT MELBOURNE | C119: MOURNEY 6 | F119: HARKINS 4 | I119: WHITZELL 4 | L119: HICKS 3 | N119: DOHERTY 2 | P119: AHEARN | R119: CRUTCHFIELD
A120: GEELONG WEST | C120: DOYLE 3 | F120: THIELE 2 | I120: BERRY
A122: WILLIAMSTOWN | C122: 6 | D122: 8 | E122: 44 | G122: 7 | H122: 9 | I122: 51 | K122: 12 | L122: 13 | M122: 85 | O122: 17 | P122: 17 | Q122: 119 | S122: VENUE: BOX HILL
A123: BOX HILL | C123: 1 | D123: 3 | E123: 9 | G123: 4 | H123: 7 | I123: 31 | K123: 9 | L123: 9 | M123: 63 | O123: 10 | P123: 10 | Q123: 70 | S123: McDONALD :VERGONA
A124: BEST PLAYERS
A125: WILLIAMSTOWN | C125: ROUND | F125: CAHILL | I125: MURPHY | L125: KENNEDY | O125: COLENSO | R125: MUSCHIALLI
A126: BOX HILL | C126: NICHOLSON | F126: GOODWIN | I126: BOLTON | L126: COLLINS | O126: CUFFE
A127: GOALKICKERS
A128: WILLIAMSTOWN | C128: FOTHERINGHAM 5 | G128: CAHILL 5 | I128: V DIMARTINO 2 | L128: GIBSON | N128: ROUND | P128: NANKERVIS | S128: COLENSO | V128: SLEVISON
A129: BOX HILL | C129: BOLTON 5 | F129: I WILSON 2 | I129: D GARTH | K129: HALBERT | M129: NICHOLSON
A131: SANDRINGHAM | C131: 7 | D131: 3 | E131: 45 | G131: 11 | H131: 7 | I131: 73 | K131: 14 | L131: 12 | M131: 96 | O131: 18 | P131: 15 | Q131: 123 | S131: VENUE: BEACH ROAD
A132: COBURG | C132: 2 | D132: 1 | E132: 13 | G132: 6 | H132: 5 | I132: 41 | K132: 11 | L132: 7 | M132: 73 | O132: 18 | P132: 14 | Q132: 122 | S132: CARUSO :MARSHALL
A133: BEST PLAYERS
A134: SANDRINGHAM | C134: BERGMAN | F134: ADAMS | I134: ERWIN | L134: PARK | O134: HAMILTON | R134: BENNETT
A135: COBURG | C135: ZOCCALI | F135: WEIDEMAN | I135: ANGWIN | L135: SHELDON | O135: EADE | R135: DARBY
A136: GOALKICKERS
A137: SANDRINGHAM | C137: BENNETT 5 | F137: FITZPATRICK 4 | I137: BERGMAN 4 | L137: KRISTENSEN 2 | O137: MANNIX | Q137: ERWIN | S137: KRAKOUER
A138: COBURG | C138: WEATHERALD 7 | F138: ZOCCALI 2 | I138: SHELDON 2 | L138: NIMMO 2 | N138: FREEMAN 2 | Q138: ALLISON | S138: MANSFIELD | W138: CLEARY
A140: FRANKSTON | C140: 3 | D140: 7 | E140: 25 | G140: 8 | H140: 16 | I140: 64 | K140: 11 | L140: 23 | M140: 89 | O140: 26 | P140: 28 | Q140: 184 | S140: VENUE: FRANKSTON
A141: BRUNSWICK | C141: 0 | D141: 7 | E141: 7 | G141: 5 | H141: 10 | I141: 40 | K141: 12 | L141: 15 | M141: 87 | O141: 15 | P141: 17 | Q141: 107 | S141: CASEY ;HUTCHINSON
A142: BEST PLAYERS
A143: FRANKSTON | C143: MEEHAN | F143: CROSS | I143: MARTIN | L143: WHITFIELD | O143: G BROWN | R143: GEDDES
A144: BRUNSWICK | C144: DUGDALE | F144: CONNELL | I144: LOVETT | L144: BAKER | O144: GRIFFITHS
A145: GOALKICKERS | S145: O'RILEY | V145: DALGLEISH
A146: FRANKSTON | C146: WHITFIELD 5 | F146: PAYNE 4 | H146: O'BRIEN 2 | J146: CROSS 2 | L146: FAVIER 2 | N146: HAMILL 2 | Q146: MARTIN 2 | S146: MEEHAN 2 | V146: AMOORE | X146: G BROWN | AA146: CZARNECKI
A147: BRUNSWICK | C147: SCULLY 4 | F147: GRIFFITHS 4 | I147: SMITH 2 | K147: THOROGOOD 2 | N147: WRIGHT 2 | Q147: JUDGE
A149: ROUND 4 | D149: 3RD MAY | I149: WEATHER | S149: VENUE: WILLIAMSTOWN
D150: 1ST QTR | H150: 2ND QTR | L150: 3RD QTR | P150: FINAL | S150: UMPIRES
A151: WILLIAMSTOWN | C151: 7 | D151: 3 | E151: 45 | G151: 12 | H151: 10 | I151: 82 | K151: 17 | L151: 14 | M151: 116 | O151: 21 | P151: 16 | Q151: 142 | S151: HUTCHINSON | X151: LADDER | AB151: ROUND | AD151: 4
A152: SANDRINGHAM | C152: 1 | D152: 1 | E152: 7 | G152: 6 | H152: 4 | I152: 40 | K152: 8 | L152: 7 | M152: 55 | O152: 10 | P152: 10 | Q152: 70 | S152: RYAN
A153: BEST PLAYERS | W153: TEAM | X153: W | Y153: L | Z153: D | AA153: FOR | AB153: AGST | AC153: % | AD153: PTS
A154: WILLIAMSTOWN | C154: McTAGGART | F154: COLENSO | I154: ROUND | L154: R DIMARTINO | O154: SAIT | Q154: WHEELER
A155: SANDRINGHAM | C155: HOWELL | F155: BENNETT | I155: MANNIX | L155: BERGMAN | W155: PORT MELBOURNE | X155: 4 | Y155: 0 | Z155: 0 | AA155: 558 | AB155: 329 | AC155: =(AA155/AB155)*100 -> 169.6048632218845 | AD155: =(X155*4)+(Z155*2) -> 16
A156: GOALKICKERS | W156: FRANKSTON | X156: 4 | Y156: 0 | Z156: 0 | AA156: 546 | AB156: 329 | AC156: =(AA156/AB156)*100 -> 165.95744680851064 | AD156: =(X156*4)+(Z156*2) -> 16
A157: WILLIAMSTOWN | C157: FOTHERINGHAM 6 | F157: V DIMARTINO 5 | I157: MUSCHIALLI 4 | L157: COLENSO 3 | N157: CAHILL 2 | P157: KENNEDY | W157: SPRINGVALE | X157: 3 | Y157: 1 | Z157: 0 | AA157: 535 | AB157: 352 | AC157: =(AA157/AB157)*100 -> 151.98863636363635 | AD157: =(X157*4)+(Z157*2) -> 12
A158: SANDRINGHAM | C158: BENNETT 5 | F158: WALL 2 | H158: DOBSON | J158: BERGMAN | M158: EAVES | W158: COBURG | X158: 3 | Y158: 1 | Z158: 0 | AA158: 493 | AB158: 369 | AC158: =(AA158/AB158)*100 -> 133.60433604336043 | AD158: =(X158*4)+(Z158*2) -> 12
S159: VENUE: SPRINGVALE
A160: FRANKSTON | C160: 4 | D160: 6 | E160: 30 | G160: 10 | H160: 6 | I160: 66 | K160: 16 | L160: 12 | M160: 108 | O160: 21 | P160: 16 | Q160: 142 | S160: MORROW | W160: WILLIAMSTOWN | X160: 2 | Y160: 2 | Z160: 0 | AA160: 408 | AB160: 349 | AC160: =(AA160/AB160)*100 -> 116.90544412607451 | AD160: =(X160*4)+(Z160*2) -> 8
A161: SPRINGVALE | C161: 5 | D161: 7 | E161: 37 | G161: 7 | H161: 11 | I161: 53 | K161: 9 | L161: 15 | M161: 69 | O161: 12 | P161: 17 | Q161: 89 | S161: VERGONA | W161: BRUNSWICK | X161: 2 | Y161: 2 | Z161: 0 | AA161: 420 | AB161: 423 | AC161: =(AA161/AB161)*100 -> 99.290780141843967 | AD161: =(X161*4)+(Z161*2) -> 8
A162: BEST PLAYERS | W162: PRESTON | X162: 1 | Y162: 3 | Z162: 0 | AA162: 370 | AB162: 465 | AC162: =(AA162/AB162)*100 -> 79.569892473118273 | AD162: =(X162*4)+(Z162*2) -> 4
A163: FRANKSTON | C163: FAVIER | F163: WHITFIELD | I163: CZRNECKI | L163: CROSS | O163: BARDOEL | W163: SANDRINGHAM | X163: 1 | Y163: 3 | Z163: 0 | AA163: 350 | AB163: 551 | AC163: =(AA163/AB163)*100 -> 63.520871143375679 | AD163: =(X163*4)+(Z163*2) -> 4
A164: SPRINGVALE | C164: DUDLEY | F164: MENDE | I164: DUNNE | L164: MALONI | O164: FOY | R164: VERNON | W164: BOX HILL | X164: 0 | Y164: 4 | Z164: 0 | AA164: 306 | AB164: 469 | AC164: =(AA164/AB164)*100 -> 65.245202558635398 | AD164: =(X164*4)+(Z164*2) -> 0
A165: GOALKICKERS | P165: PAYNE | W165: GEELONG WEST | X165: 0 | Y165: 4 | Z165: 0 | AA165: 247 | AB165: 595 | AC165: =(AA165/AB165)*100 -> 41.512605042016808 | AD165: =(X165*4)+(Z165*2) -> 0
A166: FRANKSTON | C166: WHITFIELD 6 | F166: O'RILEY 4 | H166: MEEHAN 3 | J166: BOLAND 2 | M166: HAMILL 2 | O166: CROSS | Q166: HORNER | S166: MARTIN
A167: SPRINGVALE | C167: WARD 3 | F167: ROBINSON 2 | I167: STEWART 2 | L167: ANDERSON 2 | O167: CLARKE | Q167: VERNON | S167: MENDE
A169: PORT MELBOURNE | C169: 3 | D169: 4 | E169: 22 | G169: 7 | H169: 6 | I169: 48 | K169: 11 | L169: 9 | M169: 75 | O169: 18 | P169: 14 | Q169: 122 | S169: VENUE: PORT MELBOURNE
A170: PRESTON | C170: 1 | D170: 8 | E170: 14 | G170: 5 | H170: 14 | I170: 50 | K170: 10 | L170: 20 | M170: 80 | O170: 11 | P170: 23 | Q170: 89 | S170: CASEY :McDONALD
A171: BEST PLAYERS
A172: PORT MELBOURNE | C172: RAINSFORD | F172: FOLEY | I172: MOURNEY | L172: JENNINGS | O172: DERMOTT | R172: HICKS
A173: PRESTON | C173: BROWN | F173: RAYMENT | I173: HUNT | L173: REDI | O173: BRINE | R173: DUNBAR
A174: GOALKICKERS
A175: PORT MELBOURNE | C175: MOURNEY 5 | F175: HICKS 4 | H175: JENNINGS 2 | K175: WHITZELL 2 | N175: AHERN | P175: ALLENDER | R175: GOSS | T175: SNEDDON | W175: MUTIMER
A176: PRESTON | C176: JACKSON 4 | F176: REID 2 | H176: LUMICISI 2 | K176: BRADDY | M176: PLOWMAN | P176: RAYMENT
A178: COBURG | C178: 10 | D178: 1 | E178: 61 | G178: 14 | H178: 4 | I178: 88 | K178: 20 | L178: 8 | M178: 128 | O178: 24 | P178: 13 | Q178: 157 | S178: VENUE: COBURG
A179: GEELONG WEST | C179: 5 | D179: 1 | E179: 31 | G179: 8 | H179: 2 | I179: 50 | K179: 10 | L179: 7 | M179: 67 | O179: 13 | P179: 12 | Q179: 90 | S179: CURRAN :NOLAN
A180: BEST PLAYERS
A181: COBURG | C181: ANGWIN | F181: RIENIETS | I181: FREEMAN | L181: DARBY | O181: FITZPATRICK | R181: EADE
A182: GEELONG WEST | C182: DOYLE | F182: BERRY | I182: HILL | L182: EVANS | O182: ALEXANDER
A183: GOALKICKERS
A184: COBURG | C184: WEATHERALD 7 | F184: KAAKOUR 4 | I184: EDWARDS 3 | L184: EADE 2 | N184: FITZPATRICK 2 | Q184: DARBY 2 | S184: ALLISON | V184: ZOCCALI | X184: SHELDON | AA184: FREEMAN
A185: GEELONG WEST | C185: DOYLE 7 | F185: MORRISSEY 3 | I185: McCLARE | K185: BERRY | M185: WALPOLE
A187: BRUNSWICK | C187: 0 | D187: 3 | E187: 3 | G187: 6 | H187: 9 | I187: 45 | K187: 8 | L187: 13 | M187: 61 | O187: 15 | P187: 16 | Q187: 106 | S187: VENUE: BRUNSWICK
A188: BOX HILL | C188: 1 | D188: 7 | E188: 13 | G188: 3 | H188: 10 | I188: 28 | K188: 8 | L188: 14 | M188: 62 | O188: 10 | P188: 15 | Q188: 75 | S188: BRADY :MARSHALL
A189: BEST PLAYERS
A190: BRUNSWICK | C190: DUGDALE | F190: WRIGHT | I190: CONNELL | L190: HYSLOP | O190: McGHIE | R190: LOVETT
A191: BOX HILL | C191: DODIG | F191: DWYER | I191: TURNER | L191: CUFFE | O191: COLLINS | R191: NICHOLSON
A192: GOALKICKERS
A193: BRUNSWICK | C193: GRIFFITHS 4 | F193: CALLANDER 2 | I193: McINERNEY 2 | L193: JUDGE 2 | N193: McGHIE | P193: POTTER | R193: SMITH | T193: SCULLY | W193: WRIGHT | X193: WEST
A194: BOX HILL | C194: NICHOLSON 4 | F194: KALNOY 2 | I194: P BOLTON 2 | L194: GERADTS | N194: L BOLTON
A196: ROUND 5 | D196: 17TH MAY | I196: WEATHER | S196: VENUE: PRESTON
D197: 1ST QTR | H197: 2ND QTR | L197: 3RD QTR | P197: FINAL | S197: UMPIRES
A198: PRESTON | C198: 2 | D198: 1 | E198: 13 | G198: 8 | H198: 4 | I198: 52 | K198: 13 | L198: 7 | M198: 85 | O198: 14 | P198: 10 | Q198: 94 | S198: VERGONA | X198: LADDER | AB198: ROUND | AD198: 5
A199: COBURG | C199: 2 | D199: 8 | E199: 20 | G199: 5 | H199: 12 | I199: 42 | K199: 6 | L199: 15 | M199: 51 | O199: 8 | P199: 21 | Q199: 69 | S199: :HUTCHINSON
A200: BEST PLAYERS | W200: TEAM | X200: W | Y200: L | Z200: D | AA200: FOR | AB200: AGST | AC200: % | AD200: PTS
A201: PRESTON | C201: HUNT | F201: REEVES | I201: JORDAN | L201: HALAS | O201: BRINE | Q201: PERRY
A202: COBURG | C202: ANGWIN | F202: FREEMAN | I202: WEIDEMAN | L202: FITZPATRICK | O202: EADE | W202: FRANKSTON | X202: 5 | Y202: 0 | Z202: 0 | AA202: 708 | AB202: 395 | AC202: =(AA202/AB202)*100 -> 179.24050632911391 | AD202: =(X202*4)+(Z202*2) -> 20
A203: GOALKICKERS | W203: PORT MELBOURNE | X203: 4 | Y203: 1 | Z203: 0 | AA203: 624 | AB203: 491 | AC203: =(AA203/AB203)*100 -> 127.08757637474541 | AD203: =(X203*4)+(Z203*2) -> 16
A204: PRESTON | C204: HALAS 3 | F204: PERRY 3 | I204: FROST 3 | K204: DINTINOSANTE 3 | O204: LUMICISI 2 | W204: SPRINGVALE | X204: 3 | Y204: 2 | Z204: 0 | AA204: 625 | AB204: 449 | AC204: =(AA204/AB204)*100 -> 139.19821826280622 | AD204: =(X204*4)+(Z204*2) -> 12
A205: COBURG | C205: WEATHERALD 4 | G205: ALLISON | I205: CLEARY | K205: FREEMAN | N205: EADE | W205: WILLIAMSTOWN | X205: 3 | Y205: 2 | Z205: 0 | AA205: 588 | AB205: 428 | AC205: =(AA205/AB205)*100 -> 137.38317757009347 | AD205: =(X205*4)+(Z205*2) -> 12
S206: VENUE: FRANKSTON
A207: FRANKSTON | C207: 5 | D207: 4 | E207: 34 | G207: 9 | H207: 10 | I207: 64 | K207: 12 | L207: 17 | M207: 89 | O207: 23 | P207: 24 | Q207: 162 | S207: NOLAN | W207: COBURG | X207: 3 | Y207: 2 | Z207: 0 | AA207: 562 | AB207: 463 | AC207: =(AA207/AB207)*100 -> 121.38228941684666 | AD207: =(X207*4)+(Z207*2) -> 12
A208: PORT MELBOURNE | C208: 6 | D208: 5 | E208: 41 | G208: 6 | H208: 6 | I208: 42 | K208: 9 | L208: 9 | M208: 63 | O208: 9 | P208: 12 | Q208: 66 | S208: MARSHALL | W208: BRUNSWICK | X208: 3 | Y208: 2 | Z208: 0 | AA208: 517 | AB208: 513 | AC208: =(AA208/AB208)*100 -> 100.77972709551656 | AD208: =(X208*4)+(Z208*2) -> 12
A209: BEST PLAYERS | W209: PRESTON | X209: 2 | Y209: 3 | Z209: 0 | AA209: 464 | AB209: 534 | AC209: =(AA209/AB209)*100 -> 86.891385767790268 | AD209: =(X209*4)+(Z209*2) -> 8
A210: FRANKSTON | C210: BOLAND | F210: MARTIN | I210: BARDOEL | L210: McLEISH | O210: O'BRIEN | Q210: FAVIER | W210: SANDRINGHAM | X210: 2 | Y210: 3 | Z210: 0 | AA210: 469 | AB210: 640 | AC210: =(AA210/AB210)*100 -> 73.28125 | AD210: =(X210*4)+(Z210*2) -> 8
A211: PORT MELBOURNE | C211: WALL | F211: CHADBAND | I211: SWAN | L211: JENNINGS | W211: BOX HILL | X211: 0 | Y211: 5 | Z211: 0 | AA211: 395 | AB211: 588 | AC211: =(AA211/AB211)*100 -> 67.176870748299322 | AD211: =(X211*4)+(Z211*2) -> 0
A212: GOALKICKERS | W212: GEELONG WEST | X212: 0 | Y212: 5 | Z212: 0 | AA212: 326 | AB212: 775 | AC212: =(AA212/AB212)*100 -> 42.064516129032256 | AD212: =(X212*4)+(Z212*2) -> 0
A213: FRANKSTON | C213: BOLAND 9 | F213: WHITFIELD 5 | I213: MEEHAN 3 | K213: PAYNE 2 | M213: CROSS | O213: HORNER | Q213: MARTIN | S213: O'RILEY
A214: PORT MELBOURNE | C214: JENNINGS 2 | F214: WHITZELL 2 | I214: HARKINS | K214: HICKS | M214: AHERN | O214: SNEDDON | Q214: WALL
A216: SANDRINGHAM | C216: 4 | D216: 6 | E216: 30 | G216: 6 | H216: 9 | I216: 45 | K216: 13 | L216: 13 | M216: 91 | O216: 17 | P216: 17 | Q216: 119 | S216: VENUE: BEACH ROAD
A217: BOX HILL | C217: 4 | D217: 4 | E217: 28 | G217: 10 | H217: 9 | I217: 69 | K217: 10 | L217: 14 | M217: 74 | O217: 12 | P217: 17 | Q217: 89 | S217: CURRAN :MORROW
A218: BEST PLAYERS
A219: SANDRINGHAM | C219: HOWELL | F219: FITZPATRICK | I219: ENDERS | L219: BENNETT | O219: HENDERSON | R219: JOHNSON
A220: BOX HILL | C220: COOPER | F220: TURNER | I220: HALBERT | L220: CUFFE
A221: GOALKICKERS
A222: SANDRINGHAM | C222: BENNETT 6 | F222: BERGMAN 6 | I222: ENDERS 2 | L222: KRISTENSEN 2 | O222: JOHNSON
A223: BOX HILL | C223: COOPER 3 | F223: GLEESON 3 | I223: KAINEY 2 | L223: BOLTON 2 | O223: GLARE | Q223: McGOWAN
A225: WILLIAMSTOWN | C225: 11 | D225: 5 | E225: 71 | G225: 11 | H225: 11 | I225: 77 | K225: 22 | L225: 16 | M225: 148 | O225: 27 | P225: 18 | Q225: 180 | S225: VENUE: GEELONG WEST
A226: GEELONG WEST | C226: 1 | D226: 0 | E226: 6 | G226: 6 | H226: 5 | I226: 41 | K226: 6 | L226: 6 | M226: 42 | O226: 12 | P226: 7 | Q226: 79 | S226: CASEY :BRADY
A227: BEST PLAYERS
A228: WILLIAMSTOWN | C228: ROUND | F228: MUSCHIALLI | I228: OWEN | L228: HUGHES | O228: FOTHERINGHAM | R228: SLEVISON
A229: GEELONG WEST | C229: EVANS | F229: PERRY | I229: REDHEAD | L229: NORTH | O229: HILL
A230: GOALKICKERS | S230: MUSCHIALLI
A231: WILLIAMSTOWN | C231: FOTHERINGHAM 10 | F231: SLEVISON 3 | I231: HUGHES 2 | K231: WHILLAS 2 | M231: COLENSO 2 | O231: NANKERVIS | Q231: LANE | R231: CAHILL | T231: KENNEDY | W231: R DIMARTINO | X231: V DIMARTINO | AB231: TAYLOR
A232: GEELONG WEST | C232: DOYLE 4 | F232: BERRY 3 | H232: WALPOLE 2 | K232: MORRISSEY 2 | N232: HAMILTON
A234: BRUNSWICK | C234: 3 | D234: 1 | E234: 19 | G234: 7 | H234: 2 | I234: 44 | K234: 12 | L234: 4 | M234: 76 | O234: 15 | P234: 7 | Q234: 97 | S234: VENUE: BRUNSWICK
A235: SPRINGVALE | C235: 2 | D235: 7 | E235: 19 | G235: 5 | H235: 10 | I235: 46 | K235: 9 | L235: 13 | M235: 67 | O235: 12 | P235: 18 | Q235: 90 | S235: McDONALD :RYAN
A236: BEST PLAYERS
A237: BRUNSWICK | C237: CONNELL | F237: McALLESTER | I237: G DUGDALE | L237: WEST | O237: LOVETT | R237: HYSLOP
A238: SPRINGVALE | C238: DUDLEY | F238: LETTS | I238: DUNNE | L238: NICOL | O238: MENDE | R238: CLARKE
A239: GOALKICKERS
A240: BRUNSWICK | C240: HERBERT 3 | F240: JUDGE 3 | H240: WRIGHT 3 | J240: CALLANDER 2 | M240: McALLESTER 2 | P240: GIBSON | R240: POTTER
A241: SPRINGVALE | C241: ROBINSON 3 | F241: NANFRA 3 | I241: CLARKE 2 | K241: NICOL 2 | M241: MENDE | O241: DUNNE
A243: ROUND 6 | D243: 24TH MAY | I243: WEATHER | S243: PLAYED VENUE: BOX HILL
D244: 1ST QTR | H244: 2ND QTR | L244: 3RD QTR | P244: FINAL | S244: UMPIRES
A245: BOX HILL | C245: 8 | D245: 4 | E245: 52 | G245: 12 | H245: 6 | I245: 78 | K245: 18 | L245: 14 | M245: 122 | O245: 23 | P245: 17 | Q245: 155 | S245: BLACK | X245: LADDER | AB245: ROUND | AD245: 6
A246: GEELONG WEST | C246: 2 | D246: 2 | E246: 14 | G246: 3 | H246: 6 | I246: 24 | K246: 9 | L246: 6 | M246: 60 | O246: 11 | P246: 13 | Q246: 79 | S246: PRICE
A247: BEST PLAYERS | W247: TEAM | X247: W | Y247: L | Z247: D | AA247: FOR | AB247: AGST | AC247: % | AD247: PTS
A248: BOX HILL | C248: HALBERT | F248: O'SHEA | I248: GLARE | L248: L BOLTON | O248: NICHOLSON | R248: DODIG
A249: GEELONG WEST | C249: McMASTER | F249: BERRY | I249: GIBSON | L249: REDHEAD | O249: WALPOLE | W249: FRANKSTON | X249: 5 | Y249: 1 | Z249: 0 | AA249: 778 | AB249: 570 | AC249: =(AA249/AB249)*100 -> 136.49122807017545 | AD249: =(X249*4)+(Z249*2) -> 20
A250: GOALKICKERS | P250: McGEE | R250: L BOLTON | W250: PORT MELBOURNE | X250: 5 | Y250: 1 | Z250: 0 | AA250: 755 | AB250: 589 | AC250: =(AA250/AB250)*100 -> 128.18336162988115 | AD250: =(X250*4)+(Z250*2) -> 20
A251: BOX HILL | C251: P BOLTON 6 | F251: NICHOLSON 5 | I251: KAINEY 4 | K251: O'SHEA 2 | M251: COOPER | O251: DODIG | Q251: GLEESON | S251: GARTH | W251: COBURG | X251: 4 | Y251: 2 | Z251: 0 | AA251: 737 | AB251: 533 | AC251: =(AA251/AB251)*100 -> 138.27392120075046 | AD251: =(X251*4)+(Z251*2) -> 16
A252: GEELONG WEST | C252: DOYLE 4 | F252: MORRISSEY 2 | I252: SHEA 2 | K252: McMASTER 2 | N252: RICHARDSON | W252: WILLIAMSTOWN | X252: 4 | Y252: 2 | Z252: 0 | AA252: 734 | AB252: 564 | AC252: =(AA252/AB252)*100 -> 130.1418439716312 | AD252: =(X252*4)+(Z252*2) -> 16
D253: 6TH JUNE | I253: WEATHER | S253: VENUE: PORT MELBOURNE
A254: PORT MELBOURNE | C254: 3 | D254: 3 | E254: 21 | G254: 9 | H254: 9 | I254: 63 | K254: 15 | L254: 17 | M254: 107 | O254: 18 | P254: 23 | Q254: 131 | S254: MARSHALL | W254: SPRINGVALE | X254: 3 | Y254: 3 | Z254: 0 | AA254: 723 | AB254: 580 | AC254: =(AA254/AB254)*100 -> 124.65517241379311 | AD254: =(X254*4)+(Z254*2) -> 12
A255: SPRINGVALE | C255: 1 | D255: 6 | E255: 12 | G255: 4 | H255: 9 | I255: 33 | K255: 10 | L255: 10 | M255: 70 | O255: 14 | P255: 14 | Q255: 98 | S255: BLACK | W255: SANDRINGHAM | X255: 3 | Y255: 3 | Z255: 0 | AA255: 662 | AB255: 740 | AC255: =(AA255/AB255)*100 -> 89.459459459459453 | AD255: =(X255*4)+(Z255*2) -> 12
A256: BEST PLAYERS | W256: BRUNSWICK | X256: 3 | Y256: 3 | Z256: 0 | AA256: 617 | AB256: 706 | AC256: =(AA256/AB256)*100 -> 87.393767705382444 | AD256: =(X256*4)+(Z256*2) -> 12
A257: PORT MELBOURNE | C257: JENNINGS | F257: WALL | I257: ALLENDER | L257: McCORMACK | O257: WHITZELL | R257: COOTTEE | W257: PRESTON | X257: 2 | Y257: 4 | Z257: 0 | AA257: 600 | AB257: 680 | AC257: =(AA257/AB257)*100 -> 88.235294117647058 | AD257: =(X257*4)+(Z257*2) -> 8
A258: SPRINGVALE | C258: DUDLEY | F258: FOY | I258: DUNNE | L258: MAYLIN | O258: MALONI | R258: McCORMACK | W258: BOX HILL | X258: 1 | Y258: 5 | Z258: 0 | AA258: 550 | AB258: 667 | AC258: =(AA258/AB258)*100 -> 82.458770614692654 | AD258: =(X258*4)+(Z258*2) -> 4
A259: GOALKICKERS | N259: HARKINS | Q259: FOLEY | W259: GEELONG WEST | X259: 0 | Y259: 6 | Z259: 0 | AA259: 405 | AB259: 930 | AC259: =(AA259/AB259)*100 -> 43.548387096774192 | AD259: =(X259*4)+(Z259*2) -> 0
A260: PORT MELBOURNE | C260: McCORMACK 4 | F260: WHITZELL 4 | I260: SNRDDON 3 | L260: JENNINGS 2 | O260: CHADBAND | Q260: COOPER | S260: HICKS
A261: SPRINGVALE | C261: ROBINSON 4 | F261: ANDERSON 2 | I261: DAVIES 2 | K261: CLARKE | M261: DUDLEY | O261: DEMPSTER | R261: PROSSER
L262: MAYLIN | O262: NANFRA
A263: SANDRINGHAM | C263: 8 | D263: 5 | E263: 53 | G263: 13 | H263: 7 | I263: 85 | K263: 21 | L263: 15 | M263: 141 | O263: 29 | P263: 19 | Q263: 193 | S263: VENUE: BEACH ROAD
A264: BRUNSWICK | C264: 2 | D264: 3 | E264: 15 | G264: 4 | H264: 11 | I264: 35 | K264: 8 | L264: 14 | M264: 62 | O264: 14 | P264: 16 | Q264: 100 | S264: BRADY :PRICE
A265: BEST PLAYERS
A266: SANDRINGHAM | C266: FITZPATRICK | F266: BERGMAN | I266: ERWIN | L266: KRISTENSEN | O266: EAVES | R266: FITZGERALD
A267: BRUNSWICK | C267: HYSLOP | F267: DUGDALE | I267: WRIGHT | L267: THOROGOOD | O267: McALLESTER
A268: GOALKICKERS
A269: SANDRINGHAM | C269: BERGMAN 6 | F269: BENNETT 6 | I269: JOHNSON 4 | L269: MANNIX 2 | N269: FITZPATRICK 2 | Q269: ERWIN 2 | S269: EAVES 2 | V269: BONNEY 2 | X269: KRISTENSEN 2 | AB269: DIPIERDOMENICO
A270: BRUNSWICK | C270: WRIGHT 6 | F270: SMITH 2 | H270: SCULLY 2 | J270: McALLESTER 2 | M270: HERBERT | O270: POTTER
A272: COBURG | C272: 1 | D272: 3 | E272: 9 | G272: 11 | H272: 6 | I272: 72 | K272: 16 | L272: 9 | M272: 105 | O272: 27 | P272: 13 | Q272: 175 | S272: VENUE: COBURG
A273: FRANKSTON | C273: 2 | D273: 2 | E273: 14 | G273: 4 | H273: 3 | I273: 27 | K273: 10 | L273: 4 | M273: 64 | O273: 11 | P273: 4 | Q273: 70 | S273: VERGONA :NOLAN
A274: BEST PLAYERS
A275: COBURG | C275: FITZPATRICK | F275: WEIDEMAN | I275: CLEARY | L275: INGRAM | O275: EADE | Q275: ATAARTA
A276: FRANKSTON | C276: O'BRIEN | F276: BOLAND | I276: BRIESE | L276: G BROWN | O276: CASPAR
A277: GOALKICKERS
A278: COBURG | C278: EADE 6 | E278: WEIDEMAN 4 | H278: WILLIAMS 4 | J278: FITZPATRICK 3 | M278: CLEARY 2 | O278: ALLISON 2 | Q278: SHELDON 2 | T278: LAIDLER | W278: RIENIETS | X278: ZANON | Z278: ZOCCALI
A279: FRANKSTON | C279: WHITFIELD 3 | F279: BARDOEL 2 | I279: BOLAND | K279: BRIESE | M279: P BROWN | O279: COGHLAN | Q279: HAMILL | S279: O'BRIEN
A281: WILLIAMSTOWN | C281: 4 | D281: 1 | E281: 25 | G281: 10 | H281: 2 | I281: 62 | K281: 17 | L281: 8 | M281: 110 | O281: 23 | P281: 10 | Q281: 148 | S281: VENUE: WILLIAMSTOWN
A282: PRESTON | C282: 6 | D282: 7 | E282: 43 | G282: 10 | H282: 10 | I282: 70 | K282: 15 | L282: 13 | M282: 103 | O282: 20 | P282: 16 | Q282: 136 | S282: McDONALD :CURRAN
A283: BEST PLAYERS
A284: WILLIAMSTOWN | C284: RICKMAN | F284: HUGHES | I284: MUSCHIALLI | L284: WHEELER | O284: SLEVISON | R284: ROUND
A285: PRESTON | C285: REEVES | F285: BARCLAY | I285: AITKEN | L285: HALAS | O285: LAWSON | R285: PLOWMAN
A286: GOALKICKERS
A287: WILLIAMSTOWN | C287: FOTHERINGHAM 6 | G287: RICKMAN 6 | J287: SLEVISON 5 | M287: COLENSO 2 | O287: TAYLOR 2 | Q287: WHILLAS | T287: ARGUS
A288: PRESTON | C288: HALAS 5 | E288: FROST 3 | G288: BRADDY 2 | I288: AITKEN 2 | K288: JORDAN 2 | M288: PRIDEAUX 2 | P288: BRINE | R288: MURPHY | V288: HUNT | X288: LUMICISI
A290: ROUND 7 | D290: 31ST MAY | I290: WEATHER | S290: VENUE: PRESTON
D291: 1ST QTR | H291: 2ND QTR | L291: 3RD QTR | P291: FINAL | S291: UMPIRES
A292: PRESTON | C292: 1 | D292: 5 | E292: 11 | G292: 4 | H292: 9 | I292: 33 | K292: 12 | L292: 12 | M292: 84 | O292: 18 | P292: 18 | Q292: 126 | S292: MARSHALL | X292: LADDER | AB292: ROUND | AD292: 7
A293: BOX HILL | C293: 5 | D293: 6 | E293: 36 | G293: 9 | H293: 13 | I293: 67 | K293: 12 | L293: 18 | M293: 90 | O293: 13 | P293: 24 | Q293: 102 | S293: NOLAN
A294: BEST PLAYERS | W294: TEAM | X294: W | Y294: L | Z294: D | AA294: FOR | AB294: AGST | AC294: % | AD294: PTS
A295: PRESTON | C295: HALAS | F295: PLOWMAN | I295: REEVES | L295: BARCLAY | O295: PRIDEAUX | R295: LAWSON
A296: BOX HILL | C296: L BOLTON | F296: P BOLTON | I296: HALBERT | L296: GLARE | O296: COLLINS | R296: COOPER | W296: WILLIAMSTOWN | X296: 5 | Y296: 2 | Z296: 0 | AA296: 888 | AB296: 669 | AC296: =(AA296/AB296)*100 -> 132.7354260089686 | AD296: =(X296*4)+(Z296*2) -> 20
A297: GOALKICKERS | W297: FRANKSTON | X297: 5 | Y297: 2 | Z297: 0 | AA297: 883 | AB297: 724 | AC297: =(AA297/AB297)*100 -> 121.96132596685084 | AD297: =(X297*4)+(Z297*2) -> 20
A298: PRESTON | C298: PRIDEAUX 4 | F298: MURPHY 4 | I298: HALAS 3 | K298: BRINE 3 | M298: FROST 2 | O298: LUMICISI | Q298: VALKANIS | W298: PORT MELBOURNE | X298: 5 | Y298: 2 | Z298: 0 | AA298: 857 | AB298: 717 | AC298: =(AA298/AB298)*100 -> 119.5258019525802 | AD298: =(X298*4)+(Z298*2) -> 20
A299: BOX HILL | C299: P BOLTON 7 | F299: P BOURKE 3 | I299: COOPER | K299: HALBERT | M299: GERADTS | W299: COBURG | X299: 4 | Y299: 3 | Z299: 0 | AA299: 810 | AB299: 626 | AC299: =(AA299/AB299)*100 -> 129.3929712460064 | AD299: =(X299*4)+(Z299*2) -> 16
S300: VENUE: BRUNSWICK
A301: BRUNSWICK | C301: 2 | D301: 4 | E301: 16 | G301: 4 | H301: 7 | I301: 31 | K301: 12 | L301: 9 | M301: 81 | O301: 19 | P301: 14 | Q301: 128 | S301: MORROW | W301: SPRINGVALE | X301: 4 | Y301: 3 | Z301: 0 | AA301: 816 | AB301: 653 | AC301: =(AA301/AB301)*100 -> 124.96171516079633 | AD301: =(X301*4)+(Z301*2) -> 16
A302: PORT MELBOURNE | C302: 6 | D302: 3 | E302: 39 | G302: 11 | H302: 5 | I302: 71 | K302: 13 | L302: 8 | M302: 86 | O302: 15 | P302: 12 | Q302: 102 | S302: CASEY | W302: SANDRINGHAM | X302: 4 | Y302: 3 | Z302: 0 | AA302: 817 | AB302: 807 | AC302: =(AA302/AB302)*100 -> 101.23915737298637 | AD302: =(X302*4)+(Z302*2) -> 16
A303: BEST PLAYERS | W303: BRUNSWICK | X303: 4 | Y303: 3 | Z303: 0 | AA303: 745 | AB303: 808 | AC303: =(AA303/AB303)*100 -> 92.202970297029708 | AD303: =(X303*4)+(Z303*2) -> 16
A304: BRUNSWICK | C304: CALLANDER | F304: DUGDALE | I304: BAKER | L304: THOROGOOD | O304: LOVETT | R304: WRIGHT | W304: PRESTON | X304: 3 | Y304: 4 | Z304: 0 | AA304: 726 | AB304: 782 | AC304: =(AA304/AB304)*100 -> 92.838874680306901 | AD304: =(X304*4)+(Z304*2) -> 12
A305: PORT MELBOURNE | C305: DERMOTT | F305: ALLENDER | I305: COOPER | L305: SWAN | W305: BOX HILL | X305: 1 | Y305: 6 | Z305: 0 | AA305: 652 | AB305: 793 | AC305: =(AA305/AB305)*100 -> 82.219419924337956 | AD305: =(X305*4)+(Z305*2) -> 4
A306: GOALKICKERS | Q306: JUDGE | S306: McGHIE | W306: GEELONG WEST | X306: 0 | Y306: 7 | Z306: 0 | AA306: 501 | AB306: 1055 | AC306: =(AA306/AB306)*100 -> 47.488151658767777 | AD306: =(X306*4)+(Z306*2) -> 0
A307: BRUNSWICK | C307: BAKER 4 | E307: GRIFFITHS 3 | H307: WRIGHT 3 | J307: SMITH 2 | L307: WEST 2 | N307: CALLANDER | Q307: EDWARDS | S307: HERBERT
A308: PORT MELBOURNE | C308: COOPER 4 | F308: DOHERTY 3 | I308: HARKINS 2 | L308: HICKS 2 | N308: SWAN 2 | P308: JENNINGS | R308: SNEDDON
A310: WILLIAMSOWN | C310: 3 | D310: 4 | E310: 22 | G310: 6 | H310: 10 | I310: 46 | K310: 16 | L310: 13 | M310: 109 | O310: 23 | P310: 16 | Q310: 154 | S310: VENUE: FRANKSTON
A311: FRANKSTON | C311: 3 | D311: 2 | E311: 20 | G311: 6 | H311: 8 | I311: 44 | K311: 10 | L311: 13 | M311: 73 | O311: 15 | P311: 15 | Q311: 105 | S311: BLACK :PRICE
A312: BEST PLAYERS
A313: WILLIAMSOWN | C313: COLENSO | F313: CAHILL | I313: ROUND | L313: McTAGGART | O313: DIMARTINO | R313: MURPHY
A314: FRANKSTON | C314: O'BRIEN | F314: BARDOEL | I314: McLEISH | L314: HAMILL | O314: G BROWN | R314: MEEHAN
A315: GOALKICKERS
A316: WILLIAMSOWN | C316: COLENSO 6 | E316: FOTHERINGHAM 5 | I316: RICKMAN 3 | L316: SLEVISON 2 | N316: KNIGHT 2 | P316: SAIT 2 | R316: DIMARTINO | U316: CAHILL | W316: MUSCHIALLI
A317: FRANKSTON | C317: HAMILL 3 | E317: O'RILEY 3 | G317: GEDDES 2 | I317: McLEISH 2 | L317: BELL | M317: P BROWN | O317: MEEHAN | Q317: O'BRIEN | S317: WHITFORD
A319: SPRINGVALE | C319: 4 | D319: 3 | E319: 27 | G319: 7 | H319: 8 | I319: 50 | K319: 10 | L319: 12 | M319: 72 | O319: 13 | P319: 15 | Q319: 93 | S319: VENUE: SPRINGVALE
A320: COBURG | C320: 0 | D320: 2 | E320: 2 | G320: 4 | H320: 3 | I320: 27 | K320: 6 | L320: 4 | M320: 40 | O320: 11 | P320: 7 | Q320: 73 | S320: BRADY ;CURRAN
A321: BEST PLAYERS
A322: SPRINGVALE | C322: LETTS | F322: DUNNE | I322: FOY | L322: MALONI | O322: ANDERSON | R322: DUDLEY
A323: COBURG | C323: ANGWIN | F323: EADE | I323: EVANS | L323: FREEMAN | O323: ALLISON | R323: MANSFIELD
A324: GOALKICKERS
A325: SPRINGVALE | C325: PROSSER 3 | F325: CLARKE 2 | I325: ANDERSON 2 | L325: ROBINSON 2 | O325: NICOL 2 | Q325: MALONI | S325: NEWMAN
A326: COBURG | C326: EADE 2 | E326: FREEMAN 2 | H326: SCARPINO 2 | K326: ALLISON | M326: WEATHERALD | P326: MANSFIELD | S326: EVANS | U326: ANGWIN
A328: GEELONG WEST | C328: FORFEITED | F328: TO | J328: SCORES AWARDED | O328: 96 | Q328: 125
A329: SANDRINGHAM | O329: 155 | Q329: 67
A331: ROUND 8 | D331: 14TH JUNE | I331: WEATHER | S331: VENUE: BEACH ROAD
D332: 1ST QTR | H332: 2ND QTR | L332: 3RD QTR | P332: FINAL | S332: UMPIRES
A333: PRESTON | C333: 4 | D333: 1 | E333: 25 | G333: 8 | H333: 6 | I333: 54 | K333: 17 | L333: 11 | M333: 113 | O333: 26 | P333: 17 | Q333: 173 | S333: MARSHALL | X333: LADDER | AB333: ROUND | AD333: 8
A334: SANDRINGHAM | C334: 3 | D334: 4 | E334: 22 | G334: 8 | H334: 7 | I334: 55 | K334: 14 | L334: 12 | M334: 96 | O334: 19 | P334: 13 | Q334: 127 | S334: CASEY
A335: BEST PLAYERS | W335: TEAM | X335: W | Y335: L | Z335: D | AA335: FOR | AB335: AGST | AC335: % | AD335: PTS
A336: PRESTON | C336: MURPHY | F336: LAWSON | I336: AITKEN | L336: PERRY | O336: JORDAN | R336: MARCON
A337: SANDRINGHAM | C337: BENNETT | F337: BONNEY | I337: MANNIX | L337: ERWIN | O337: FITZGERALD | W337: WILLIAMSTOWN | X337: 6 | Y337: 2 | Z337: 0 | AA337: 1023 | AB337: 778 | AC337: =(AA337/AB337)*100 -> 131.49100257069409 | AD337: =(X337*4)+(Z337*2) -> 24
A338: GOALKICKERS | Q338: BRINE | W338: PORT MELBOURNE | X338: 6 | Y338: 2 | Z338: 0 | AA338: 1033 | AB338: 842 | AC338: =(AA338/AB338)*100 -> 122.68408551068883 | AD338: =(X338*4)+(Z338*2) -> 24
A339: PRESTON | C339: MURPHY 12 | E339: HALAS 2 | G339: LAWSON 2 | I339: LUMICISI 2 | K339: HUNT 2 | M339: BRADDY | O339: ATKIN | Q339: WATT | R339: FROST | T339: JORDAN | W339: FRANKSTON | X339: 5 | Y339: 3 | Z339: 0 | AA339: 991 | AB339: 871 | AC339: =(AA339/AB339)*100 -> 113.77726750861079 | AD339: =(X339*4)+(Z339*2) -> 20
A340: SANDRINGHAM | C340: BENNETT 9 | E340: ERWIN 3 | G340: FITZGERALD | J340: EAVES | L340: RYAN | M340: MANNIX | O340: BERGMAN | Q340: BONNEY | S340: KRISTENSEN | W340: BRUNSWICK | X340: 5 | Y340: 3 | Z340: 0 | AA340: 900 | AB340: 875 | AC340: =(AA340/AB340)*100 -> 102.85714285714285 | AD340: =(X340*4)+(Z340*2) -> 20
S341: VENUE: COBURG
A342: PORT MELBOURNE | C342: 9 | D342: 3 | E342: 57 | G342: 12 | H342: 7 | I342: 79 | K342: 18 | L342: 18 | M342: 126 | O342: 25 | P342: 26 | Q342: 176 | S342: McDONALD | W342: SPRINGVALE | X342: 4 | Y342: 4 | Z342: 0 | AA342: 925 | AB342: 788 | AC342: =(AA342/AB342)*100 -> 117.38578680203047 | AD342: =(X342*4)+(Z342*2) -> 16
A343: COBURG | C343: 5 | D343: 1 | E343: 31 | G343: 11 | H343: 5 | I343: 71 | K343: 14 | L343: 8 | M343: 92 | O343: 19 | P343: 11 | Q343: 125 | S343: PRICE | W343: COBURG | X343: 4 | Y343: 4 | Z343: 0 | AA343: 935 | AB343: 802 | AC343: =(AA343/AB343)*100 -> 116.58354114713217 | AD343: =(X343*4)+(Z343*2) -> 16
A344: BEST PLAYERS | W344: PRESTON | X344: 4 | Y344: 4 | Z344: 0 | AA344: 899 | AB344: 909 | AC344: =(AA344/AB344)*100 -> 98.899889988998908 | AD344: =(X344*4)+(Z344*2) -> 16
A345: PORT MELBOURNE | C345: SNEDDON | F345: JENNINGS | I345: WALL | L345: SWAN | O345: CHADBAND | R345: MCCORMACK | W345: SANDRINGHAM | X345: 4 | Y345: 4 | Z345: 0 | AA345: 944 | AB345: 980 | AC345: =(AA345/AB345)*100 -> 96.326530612244895 | AD345: =(X345*4)+(Z345*2) -> 16
A346: COBURG | C346: RIENIETS | F346: TARANTO | I346: FREEMAN | L346: SHELDON | O346: ZOCCALI | W346: BOX HILL | X346: 2 | Y346: 6 | Z346: 0 | AA346: 799 | AB346: 901 | AC346: =(AA346/AB346)*100 -> 88.679245283018872 | AD346: =(X346*4)+(Z346*2) -> 8
A347: GOALKICKERS | I347: JENNINGS | K347: MCCORMACK | N347: SWAN | P347: WALL | R347: WHITZELL | W347: GEELONG WEST | X347: 0 | Y347: 8 | Z347: 0 | AA347: 618 | AB347: 1213 | AC347: =(AA347/AB347)*100 -> 50.94806265457543 | AD347: =(X347*4)+(Z347*2) -> 0
A348: PORT MELBOURNE | C348: SNEDDON 7 | E348: SCURRAH 3 | H348: COOPER 2 | J348: COOTTEE 2 | M348: HICKS 2 | O348: MUTIMER 2 | Q348: B HARKINS | S348: S HARKINS
A349: COBURG | C349: EADE 4 | E349: WILLIAMS 4 | H349: RIENIETS 3 | J349: FREEMAN 3 | M349: ALLISON 2 | O349: ZOCCALI 2 | Q349: EDWARDS
A351: WILLIAMSTOWN | C351: 5 | D351: 2 | E351: 32 | G351: 7 | H351: 10 | I351: 52 | K351: 14 | L351: 13 | M351: 97 | O351: 20 | P351: 15 | Q351: 135 | S351: VENUE: WILLIAMSTOWN
A352: SPRINGVALE | C352: 5 | D352: 3 | E352: 33 | G352: 10 | H352: 7 | I352: 67 | K352: 13 | L352: 10 | M352: 88 | O352: 16 | P352: 13 | Q352: 109 | S352: VERGONA :MORROW
A353: BEST PLAYERS
A354: WILLIAMSTOWN | C354: MUSCHIALLI | F354: SAIT | I354: ROUND | L354: CAHILL | O354: SLEVISON | R354: McTAGGART
A355: SPRINGVALE | C355: ANDERSON | F355: DUDLEY | I355: LETTS | L355: McCORMACK | O355: DEMPSTER
A356: GOALKICKERS
A357: WILLIAMSTOWN | C357: S KNIGHT 6 | F357: FOTHERINGHAM 4 | J357: SLEVISON 2 | M357: SAIT 2 | O357: CAHILL 2 | Q357: BRIERTY 2 | S357: RICKMAN | V357: MUSCHIALLI
A358: SPRINGVALE | C358: DUDLEY 3 | F358: ANDERSON 3 | I358: WARD 3 | K358: CLARKE 2 | M358: ROBINSON 2 | P358: MALONI | R358: DAVIES | T358: REEVES
A360: BOX HILL | C360: 4 | D360: 5 | E360: 29 | G360: 10 | H360: 7 | I360: 67 | K360: 13 | L360: 13 | M360: 91 | O360: 22 | P360: 15 | Q360: 147 | S360: VENUE: BOX HILL
A361: FRANKSTON | C361: 1 | D361: 3 | E361: 9 | G361: 5 | H361: 5 | I361: 35 | K361: 8 | L361: 9 | M361: 57 | O361: 16 | P361: 12 | Q361: 108 | S361: BRADY :CURRAN
A362: BEST PLAYERS
A363: BOX HILL | C363: TEAM EFFORT
A364: FRANKSTON | C364: WHITFIELD | F364: GILBERT | I364: BARDOEL | L364: RAVEN | O364: MEEHAN
A365: GOALKICKERS
A366: BOX HILL | C366: P BOLTON 12 | F366: B GARTH 3 | I366: P BOURKE 2 | L366: HALBERT | N366: PRESTON | P366: O'SHEA | R366: NICHOLSON | V366: GLARE
A367: FRANKSTON | C367: WHITFIELD 7 | F367: O'RILEY 3 | I367: P BROWN 2 | L367: MEEHAN 2 | O367: BOLAND | Q367: CROSS
A369: GEELONG WEST | C369: FORFEITED TO | J369: SCORES AWARDED | O369: 117 | Q369: 158
A370: BRUNSWICK | O370: 155 | Q370: 67
A372: ROUND 9 | D372: 21ST JUNE | I372: WEATHER | S372: VENUE: PORT MELBOURNE
D373: 1ST QTR | H373: 2ND QTR | L373: 3RD QTR | P373: FINAL | S373: UMPIRES
A374: PORT MELBOURNE | C374: 5 | D374: 6 | E374: 36 | G374: 13 | H374: 9 | I374: 87 | K374: 18 | L374: 10 | M374: 118 | O374: 28 | P374: 11 | Q374: 179 | S374: CASEY | X374: LADDER | AB374: ROUND | AD374: 9
A375: WILLIAMSTOWN | C375: 3 | D375: 2 | E375: 20 | G375: 6 | H375: 6 | I375: 42 | K375: 9 | L375: 10 | M375: 64 | O375: 11 | P375: 13 | Q375: 79 | S375: MARSHALL
A376: BEST PLAYERS | W376: TEAM | X376: W | Y376: L | Z376: D | AA376: FOR | AB376: AGST | AC376: % | AD376: PTS
A377: PORT MELBOURNE | C377: HETHERTON | F377: HICKS | I377: WALL | K377: MUTIMER | N377: JENNINGS | Q377: ALLENDER
A378: WILLIAMSTOWN | C378: ROUND | F378: SLEVISON | I378: SAIT | K378: McTAGGART | N378: R DIMARTINO | W378: PORT MELBOURNE | X378: 7 | Y378: 2 | Z378: 0 | AA378: 1212 | AB378: 921 | AC378: =(AA378/AB378)*100 -> 131.59609120521171 | AD378: =(X378*4)+(Z378*2) -> 28
A379: GOALKICKERS | N379: RODDA | P379: SCURRAH | R379: WALL | W379: FRANKSTON | X379: 6 | Y379: 3 | Z379: 0 | AA379: 1141 | AB379: 982 | AC379: =(AA379/AB379)*100 -> 116.19144602851324 | AD379: =(X379*4)+(Z379*2) -> 24
A380: PORT MELBOURNE | C380: SNEDDON 7 | E380: HICKS 5 | G380: JENNINGS 3 | I380: WHITZELL 3 | L380: COOPER 3 | N380: SWAN 2 | P380: DERMOTT | R380: MUTIMER | W380: WILLIAMSTOWN | X380: 6 | Y380: 3 | Z380: 0 | AA380: 1102 | AB380: 957 | AC380: =(AA380/AB380)*100 -> 115.15151515151516 | AD380: =(X380*4)+(Z380*2) -> 24
A381: WILLIAMSTOWN | C381: FOTHERINGHAM 2 | G381: RICKMAN 2 | J381: SLEVISON 2 | M381: KNIGHT | O381: SAIT | P381: COLENSO | R381: CAHILL | W381: BRUNSWICK | X381: 6 | Y381: 3 | Z381: 0 | AA381: 1037 | AB381: 993 | AC381: =(AA381/AB381)*100 -> 104.43101711983887 | AD381: =(X381*4)+(Z381*2) -> 24
N382: KENNEDY | S382: VENUE: BRUNSWICK
A383: BRUNSWICK | C383: 4 | D383: 5 | E383: 29 | G383: 8 | H383: 6 | I383: 54 | K383: 13 | L383: 10 | M383: 88 | O383: 21 | P383: 11 | Q383: 137 | S383: HARVEY | W383: PRESTON | X383: 5 | Y383: 4 | Z383: 0 | AA383: 1054 | AB383: 976 | AC383: =(AA383/AB383)*100 -> 107.99180327868851 | AD383: =(X383*4)+(Z383*2) -> 20
A384: COBURG | C384: 3 | D384: 3 | E384: 21 | G384: 9 | H384: 5 | I384: 59 | K384: 14 | L384: 7 | M384: 91 | O384: 18 | P384: 10 | Q384: 118 | S384: MARSHALL | W384: SPRINGVALE | X384: 4 | Y384: 5 | Z384: 0 | AA384: 989 | AB384: 865 | AC384: =(AA384/AB384)*100 -> 114.33526011560693 | AD384: =(X384*4)+(Z384*2) -> 16
A385: BEST PLAYERS | W385: COBURG | X385: 4 | Y385: 5 | Z385: 0 | AA385: 1053 | AB385: 939 | AC385: =(AA385/AB385)*100 -> 112.14057507987221 | AD385: =(X385*4)+(Z385*2) -> 16
A386: BRUNSWICK | C386: WEST | F386: McALLESTER | I386: A SMITH | K386: THOROGOOD | N386: LOVETT | Q386: WRIGHT | W386: SANDRINGHAM | X386: 4 | Y386: 5 | Z386: 0 | AA386: 1062 | AB386: 1130 | AC386: =(AA386/AB386)*100 -> 93.982300884955748 | AD386: =(X386*4)+(Z386*2) -> 16
A387: COBURG | C387: SHELDON | F387: TARANTO | I387: ALLISON | K387: FREEMAN | N387: INGRAM | W387: BOX HILL | X387: 3 | Y387: 6 | Z387: 0 | AA387: 876 | AB387: 965 | AC387: =(AA387/AB387)*100 -> 90.77720207253887 | AD387: =(X387*4)+(Z387*2) -> 12
A388: GOALKICKERS | P388: McGHIE | R388: A SMITH | W388: GEELONG WEST | X388: 0 | Y388: 9 | Z388: 0 | AA388: 691 | AB388: 1349 | AC388: =(AA388/AB388)*100 -> 51.223128243143066 | AD388: =(X388*4)+(Z388*2) -> 0
A389: BRUNSWICK | C389: LEAHY 5 | E389: McALLESTER 3 | H389: WEST 3 | J389: WRIGHT 3 | M389: HERBERT 2 | O389: POTTER 2 | Q389: CALLANDER
A390: COBURG | C390: WEATHERALD 4 | F390: ALLISON 3 | I390: ATAARTA 3 | L390: WILLIAMS 2 | N390: CLEARY | P390: FREEMAN | R390: GUMLEY
L391: ZOCCALI | O391: SHELDON | Q391: SUTHERLAND
A392: FRANKSTON | C392: 11 | D392: 4 | E392: 70 | G392: 15 | H392: 6 | I392: 96 | K392: 19 | L392: 11 | M392: 125 | O392: 23 | P392: 12 | Q392: 150 | S392: VENUE: FRANKSTON
A393: SANDRINGHAM | C393: 3 | D393: 4 | E393: 22 | G393: 9 | H393: 8 | I393: 62 | K393: 12 | L393: 14 | M393: 86 | O393: 16 | P393: 15 | Q393: 111 | S393: MORROW :HARVEY
A394: BEST PLAYERS
A395: FRANKSTON | C395: BARDOEL | F395: BROWN | I395: SARAU | K395: WHITFIELD | N395: BRIESE
A396: SANDRINGHAM | C396: ERWIN | F396: RYAN | I396: HOWELL | K396: FITZGERALD | N396: DOBSON
A397: GOALKICKERS
A398: FRANKSTON | C398: WHITFIELD 7 | F398: BARDOEL 3 | I398: BINGLEY 3 | K398: FAVIER 3 | M398: HORNER 2 | O398: BOLAND | Q398: GILBERT | S398: HAMILL | V398: MEEHAN | X398: O'BRIEN
A399: SANDRINGHAM | C399: ERWIN 6 | F399: BERGMAN 3 | I399: JOHNSON 2 | L399: BENNETT | N399: ENDERS | P399: BONNEY | R399: DOBSON | U399: MERCER
A401: BOX HILL | C401: 1 | D401: 3 | E401: 9 | G401: 3 | H401: 4 | I401: 22 | K401: 7 | L401: 7 | M401: 49 | O401: 11 | P401: 11 | Q401: 77 | S401: VENUE: SPRINGVALE
A402: SPRINGVALE | C402: 4 | D402: 5 | E402: 29 | G402: 5 | H402: 8 | I402: 38 | K402: 9 | L402: 9 | M402: 63 | O402: 9 | P402: 10 | Q402: 64 | S402: MCDONALD :PRICE
A403: BEST PLAYERS
A404: BOX HILL | C404: COOPER | F404: O'SHEA | I404: GARTH | K404: GLEESON | N404: NICHOLSON | Q404: P BOLTON
A405: SPRINGVALE | C405: DEMPSTER | F405: STEWART | I405: JEFFS
A406: GOALKICKERS
A407: BOX HILL | C407: P BOLTON 3 | F407: BOURKE 2 | I407: COOPER 2 | K407: GARTH | M407: L BOLTON | O407: HALBERT | Q407: McGOWAN
A408: SPRINGVALE | C408: NICOL 2 | E408: REECE 2 | G408: CLARKE | I408: VERNON | K408: WARD | M408: STEWART | O408: FOY
A410: PRESTON | O410: 155 | Q410: 67
A411: GEELONG WEST | C411: FORFEITED | F411: TO | J411: SCORES AWARDED | O411: 93 | Q411: 136
A413: ROUND 10 | D413: 28TH JUNE | I413: WEATHER | S413: VENUE: COBURG
D414: 1ST QTR | H414: 2ND QTR | L414: 3RD QTR | P414: FINAL | S414: UMPIRES
A415: COBURG | C415: 3 | D415: 6 | E415: 24 | G415: 9 | H415: 10 | I415: 64 | K415: 13 | L415: 13 | M415: 91 | O415: 17 | P415: 15 | Q415: 117 | S415: N McDONALD | X415: LADDER | AB415: ROUND | AD415: 10
A416: WILLIAMSTOWN | C416: 3 | D416: 2 | E416: 20 | G416: 4 | H416: 9 | I416: 33 | K416: 7 | L416: 16 | M416: 58 | O416: 10 | P416: 22 | Q416: 82 | S416: :MORROW
A417: BEST PLAYERS | W417: TEAM | X417: W | Y417: L | Z417: D | AA417: FOR | AB417: AGST | AC417: % | AD417: PTS
A418: COBURG | C418: WEIDEMAN | F418: RIENIETS | I418: FREEMAN | L418: ALLISON | O418: ANGWIN | R418: EVANS
A419: WILLIAMSTOWN | C419: MUSCHIALLI | F419: HUGHES | I419: SLEVISON | L419: McTAGGART | O419: WHILLAS | R419: SAIT | W419: PORT MELBOURNE | X419: 8 | Y419: 2 | Z419: 0 | AA419: 1362 | AB419: 1026 | AC419: =(AA419/AB419)*100 -> 132.7485380116959 | AD419: =(X419*4)+(Z419*2) -> 32
A420: GOALKICKERS | P420: SUTHERLAND | R420: INGRAM | W420: BRUNSWICK | X420: 7 | Y420: 3 | Z420: 0 | AA420: 1137 | AB420: 1072 | AC420: =(AA420/AB420)*100 -> 106.06343283582089 | AD420: =(X420*4)+(Z420*2) -> 28
A421: COBURG | C421: EADE 4 | E421: ALLISON 3 | G421: FREEMAN 2 | I421: GUMLEY | K421: ATAARTA | M421: DARBY | O421: CLEARY | Q421: EDWARDS | S421: TARANTO | W421: FRANKSTON | X421: 6 | Y421: 3 | Z421: 1 | AA421: 1239 | AB421: 1080 | AC421: =(AA421/AB421)*100 -> 114.72222222222221 | AD421: =(X421*4)+(Z421*2) -> 26
A422: WILLIAMSTOWN | C422: MUSCHIALLI 3 | F422: RICKMAN 2 | I422: NILSSEN | K422: COLENSO | M422: FOTHERINGHAM | P422: McTAGGART | S422: S KNIGHT | W422: WILLIAMSTOWN | X422: 6 | Y422: 4 | Z422: 0 | AA422: 1184 | AB422: 1074 | AC422: =(AA422/AB422)*100 -> 110.24208566108007 | AD422: =(X422*4)+(Z422*2) -> 24
S423: VENUE: FRANKSTON
A424: FRANKSTON | C424: 6 | D424: 8 | E424: 44 | G424: 8 | H424: 8 | I424: 56 | K424: 12 | L424: 12 | M424: 84 | O424: 14 | P424: 14 | Q424: 98 | S424: BLACK | W424: SPRINGVALE | X424: 5 | Y424: 5 | Z424: 0 | AA424: 1112 | AB424: 894 | AC424: =(AA424/AB424)*100 -> 124.38478747203578 | AD424: =(X424*4)+(Z424*2) -> 20
A425: GEELONG WEST | C425: 3 | D425: 5 | E425: 23 | G425: 5 | H425: 12 | I425: 42 | K425: 10 | L425: 14 | M425: 74 | O425: 13 | P425: 20 | Q425: 98 | S425: PRICE | W425: COBURG | X425: 5 | Y425: 5 | Z425: 0 | AA425: 1170 | AB425: 1021 | AC425: =(AA425/AB425)*100 -> 114.59353574926543 | AD425: =(X425*4)+(Z425*2) -> 20
A426: BEST PLAYERS | W426: PRESTON | X426: 5 | Y426: 5 | Z426: 0 | AA426: 1133 | AB426: 1076 | AC426: =(AA426/AB426)*100 -> 105.29739776951672 | AD426: =(X426*4)+(Z426*2) -> 20
A427: FRANKSTON | C427: BROWN | F427: BOLAND | I427: CROSS | L427: PAYNE | O427: RAVEN | W427: SANDRINGHAM | X427: 4 | Y427: 6 | Z427: 0 | AA427: 1091 | AB427: 1253 | AC427: =(AA427/AB427)*100 -> 87.071029529130087 | AD427: =(X427*4)+(Z427*2) -> 16
A428: GEELONG WEST | C428: CRUTCHFIELD | F428: SHEA | I428: TODD | L428: HIGGINS | O428: WINTER | W428: BOX HILL | X428: 3 | Y428: 7 | Z428: 0 | AA428: 981 | AB428: 1115 | AC428: =(AA428/AB428)*100 -> 87.982062780269061 | AD428: =(X428*4)+(Z428*2) -> 12
A429: GOALKICKERS | W429: GEELONG WEST | X429: 0 | Y429: 9 | Z429: 1 | AA429: 789 | AB429: 1447 | AC429: =(AA429/AB429)*100 -> 54.526606772633038 | AD429: =(X429*4)+(Z429*2) -> 2
A430: FRANKSTON | C430: WHITFIELD 4 | F430: HAMILL 3 | H430: BARDOEL 2 | K430: BINGLEY 2 | N430: CROSS | P430: BARTON | R430: PAYNE
A431: GEELONG WEST | C431: SHEA 3 | E431: HIGGINS 3 | G431: RADOJEVIC 2 | J431: MORRISSEY | M431: BERRY | O431: WIASAKYE | Q431: McMASTER
N432: CRUTCHFIELD
A433: SPRINGVALE | C433: 3 | D433: 1 | E433: 19 | G433: 9 | H433: 5 | I433: 59 | K433: 13 | L433: 9 | M433: 87 | O433: 18 | P433: 15 | Q433: 123 | S433: VENUE: SPRINGVALE
A434: SANDRINGHAM | C434: 3 | D434: 2 | E434: 20 | G434: 4 | H434: 3 | I434: 27 | K434: 4 | L434: 5 | M434: 29 | O434: 4 | P434: 5 | Q434: 29 | S434: G CASEY ;CURRAN
A435: BEST PLAYERS
A436: SPRINGVALE | C436: NICOL | F436: MALONI | I436: CLARKE | L436: MAYLIN | O436: G ROBINSON | R436: DUDLEY
A437: SANDRINGHAM | C437: MERCER | F437: EAVES | I437: HOWELL
A438: GOALKICKERS
A439: SPRINGVALE | C439: NICOL 5 | E439: MAYLIN 3 | G439: MENDE 3 | I439: DUDLEY | K439: DEMPSTER | M439: WARD | O439: STEWART | Q439: SHANNON | T439: McCORMACK | X439: G ROBINSON
A440: SANDRINGHAM | C440: BERGMAN 2 | F440: ERWIN | H440: BONNEY
A442: PORT MELBOURNE | C442: 6 | D442: 6 | E442: 42 | G442: 12 | H442: 8 | I442: 80 | K442: 21 | L442: 10 | M442: 136 | O442: 23 | P442: 12 | Q442: 150 | S442: VENUE: PORT MELBOURNE
A443: BOX HILL | C443: 5 | D443: 2 | E443: 32 | G443: 10 | H443: 5 | I443: 65 | K443: 12 | L443: 6 | M443: 78 | O443: 15 | P443: 15 | Q443: 105 | S443: VERGONA :WALKER
A444: BEST PLAYERS
A445: PORT MELBOURNE | C445: JENNINGS | F445: RAINSFORD | I445: S HARKINS | L445: COOTTEE | O445: WHITZELL | R445: COOPER
A446: BOX HILL | C446: NICOLSON | F446: DWYER | I446: DODIG | L446: COOPER | O446: GLEESON | R446: GLARE
A447: GOALKICKERS
A448: PORT MELBOURNE | C448: S HARKINS 5 | F448: JENNINGS 3 | I448: McCORMACK 2 | L448: SWAN 2 | N448: SCURRAH 2 | Q448: MUTIMER 2 | T448: HICKS 2 | W448: WALL | X448: WHITZELL | AA448: B HARKINS
A449: BOX HILL | C449: COOPER 2 | F449: NICHOLSON 2 | I449: L BOLTON 2 | L449: P BOLTON 2 | O449: GERADTS 2 | Q449: HALBERT 2 | T449: GLARE | W449: BOURKE | X449: GARTH
A451: BRUNSWICK | C451: 4 | D451: 4 | E451: 28 | G451: 7 | H451: 8 | I451: 50 | K451: 12 | L451: 14 | M451: 86 | O451: 14 | P451: 16 | Q451: 100 | S451: VENUE: BRUNSWICK
A452: PRESTON | C452: 1 | D452: 4 | E452: 10 | G452: 6 | H452: 10 | I452: 46 | K452: 7 | L452: 12 | M452: 54 | O452: 10 | P452: 19 | Q452: 79 | S452: HARVEY :MARSHALL
A453: BEST PLAYERS
A454: BRUNSWICK | C454: LOVETT | F454: DUGDALE | I454: GRIFFITHS | L454: WRIGHT | O454: McALLESTER | R454: HYSLOP
A455: PRESTON | C455: REEVES | F455: MARCON | I455: BARCLAY | L455: HUNT
A456: GOALKICKERS
A457: BRUNSWICK | C457: WRIGHT 3 | F457: GRIFFITHS 3 | I457: A SMITH 2 | L457: THOROGOOD | O457: REID | P457: McALLESTER | S457: LEAHY | U457: HYSLOP | W457: GREGG
A458: PRESTON | C458: JORDAN 3 | F458: HALAS 2 | H458: BRADDY | J458: LAESON | L458: ATKIN | N458: PRIDEAUX | Q458: WATT
A460: ROUND 11 | D460: 5TH JULY | I460: WEATHER | S460: VENUE: PRESTON
D461: 1ST QTR | H461: 2ND QTR | L461: 3RD QTR | P461: FINAL | S461: UMPIRES
A462: FRANKSTON | C462: 3 | D462: 3 | E462: 21 | G462: 7 | H462: 10 | I462: 52 | K462: 14 | L462: 11 | M462: 95 | O462: 18 | P462: 16 | Q462: 124 | S462: VERGONA | X462: LADDER | AB462: ROUND | AD462: 11
A463: PRESTON | C463: 1 | D463: 5 | E463: 11 | G463: 4 | H463: 9 | I463: 33 | K463: 7 | L463: 11 | M463: 53 | O463: 13 | P463: 14 | Q463: 92 | S463: MORROW
A464: BEST PLAYERS | W464: TEAM | X464: W | Y464: L | Z464: D | AA464: FOR | AB464: AGST | AC464: % | AD464: PTS
A465: FRANKSTON | C465: PAYNE | F465: SARAU | I465: BROWN | L465: CROSS | O465: MARTIN | R465: O'BRIEN
A466: PRESTON | C466: REEVES | F466: BRINE | I466: FROST | L466: PLOWMAN | W466: PORT MELBOURNE | X466: 9 | Y466: 2 | Z466: 0 | AA466: 1522 | AB466: 1139 | AC466: =(AA466/AB466)*100 -> 133.62598770851625 | AD466: =(X466*4)+(Z466*2) -> 36
A467: GOALKICKERS | W467: FRANKSTON | X467: 7 | Y467: 3 | Z467: 1 | AA467: 1363 | AB467: 1182 | AC467: =(AA467/AB467)*100 -> 115.31302876480542 | AD467: =(X467*4)+(Z467*2) -> 30
A468: FRANKSTON | C468: WHITFIELD 6 | F468: PAYNE 4 | H468: GEDDES 3 | J468: BOLAND 2 | M468: CZARNECKI | P468: RAVEN | W468: WILLIAMSTOWN | X468: 7 | Y468: 4 | Z468: 0 | AA468: 1329 | AB468: 1164 | AC468: =(AA468/AB468)*100 -> 114.17525773195875 | AD468: =(X468*4)+(Z468*2) -> 28
A469: PRESTON | C469: HUNT 3 | E469: HALAS 2 | G469: JORDAN 2 | I469: LAWSON | K469: PERRY | M469: WATT | O469: FROST | Q469: MURPHY | S469: LUMICISI | W469: BRUNSWICK | X469: 7 | Y469: 4 | Z469: 0 | AA469: 1227 | AB469: 1217 | AC469: =(AA469/AB469)*100 -> 100.82169268693508 | AD469: =(X469*4)+(Z469*2) -> 28
S470: VENUE: BOX HILL
A471: COBURG | C471: 5 | D471: 5 | E471: 35 | G471: 12 | H471: 6 | I471: 78 | K471: 17 | L471: 8 | M471: 110 | O471: 18 | P471: 13 | Q471: 121 | S471: MARSHALL | W471: SPRINGVALE | X471: 6 | Y471: 5 | Z471: 0 | AA471: 1264 | AB471: 973 | AC471: =(AA471/AB471)*100 -> 129.90750256937307 | AD471: =(X471*4)+(Z471*2) -> 24
A472: BOX HILL | C472: 4 | D472: 1 | E472: 25 | G472: 6 | H472: 4 | I472: 40 | K472: 14 | L472: 6 | M472: 90 | O472: 16 | P472: 8 | Q472: 104 | S472: MITCHELL | W472: COBURG | X472: 6 | Y472: 5 | Z472: 0 | AA472: 1291 | AB472: 1125 | AC472: =(AA472/AB472)*100 -> 114.75555555555556 | AD472: =(X472*4)+(Z472*2) -> 24
A473: BEST PLAYERS | W473: PRESTON | X473: 5 | Y473: 6 | Z473: 0 | AA473: 1125 | AB473: 1200 | AC473: =(AA473/AB473)*100 -> 93.75 | AD473: =(X473*4)+(Z473*2) -> 20
A474: COBURG | C474: ALLISON | F474: GUMLEY | I474: INGRAM | L474: FREEMAN | O474: RIENIETS | R474: CLEARY | W474: SANDRINGHAM | X474: 4 | Y474: 7 | Z474: 0 | AA474: 1195 | AB474: 1413 | AC474: =(AA474/AB474)*100 -> 84.571832979476298 | AD474: =(X474*4)+(Z474*2) -> 16
A475: BOX HILL | C475: GLEESON | F475: DWYER | I475: O'SHEA | L475: D BOURKE | O475: L BOLTON | R475: GARTH | W475: BOX HILL | X475: 3 | Y475: 8 | Z475: 0 | AA475: 1085 | AB475: 1236 | AC475: =(AA475/AB475)*100 -> 87.783171521035598 | AD475: =(X475*4)+(Z475*2) -> 12
A476: GOALKICKERS | P476: SUTHERLAND | W476: GEELONG WEST | X476: 0 | Y476: 10 | Z476: 1 | AA476: 868 | AB476: 1599 | AC476: =(AA476/AB476)*100 -> 54.283927454659164 | AD476: =(X476*4)+(Z476*2) -> 2
A477: COBURG | C477: DARBY 4 | E477: EADE 3 | G477: WILLIAMS 3 | J477: FREEMAN 3 | M477: CLEARY 2 | O477: RIENIETS | Q477: GUMLEY
A478: BOX HILL | C478: D BOURKE 6 | F478: GARTH 3 | H478: P BOLTON 2 | K478: L BOLTON | M478: HALBERT | O478: PRESTON | Q478: O'SHEA | S478: WILSON
A480: PORT MELBOURNE | C480: 6 | D480: 3 | E480: 39 | G480: 12 | H480: 8 | I480: 80 | K480: 18 | L480: 15 | M480: 123 | O480: 23 | P480: 22 | Q480: 160 | S480: VENUE: BEACH ROAD
A481: SANDRINGHAM | C481: 6 | D481: 2 | E481: 38 | G481: 9 | H481: 7 | I481: 61 | K481: 15 | L481: 11 | M481: 101 | O481: 17 | P481: 11 | Q481: 113 | S481: McDONALD :BLACK
A482: BEST PLAYERS
A483: PORT MELBOURNE | C483: SWAN | F483: HETHERTON | I483: ALLENDER | L483: RAINSFORD | O483: SNEDDON | R483: S HARKINS
A484: SANDRINGHAM | C484: HOWELL | F484: BENNETT | I484: ERWIN | L484: MERCER | O484: FITZPATRICK | R484: FITZGERALD
A485: GOALKICKERS | Q485: HETHERTON | U485: P McCORMACK
A486: PORT MELBOURNE | C486: HICKS 4 | E486: MUTIMER 3 | H486: SCURRAH 3 | J486: EVANS 2 | L486: JENNINGS 2 | N486: SWAN 2 | P486: WHITZELL 2 | R486: ALLENDER | U486: B HARKINS | X486: S HARKINS
A487: SANDRINGHAM | C487: BENNETT 7 | F487: RIGGS 2 | H487: JOHNSON 2 | J487: ERWIN 2 | L487: BERGMAN 2 | O487: BONNEY | Q487: PARK
A489: SPRINGVALE | C489: 4 | D489: 5 | E489: 29 | G489: 11 | H489: 10 | I489: 76 | K489: 15 | L489: 16 | M489: 106 | O489: 22 | P489: 20 | Q489: 152 | S489: VENUE: GEELONG WEST
A490: GEELONG WEST | C490: 5 | D490: 6 | E490: 36 | G490: 6 | H490: 10 | I490: 46 | K490: 8 | L490: 12 | M490: 60 | O490: 11 | P490: 13 | Q490: 79 | S490: HARVEY :WALKER
A491: BEST PLAYERS
A492: SPRINGVALE | C492: DEMPSTER | F492: FOY | I492: STEWART | L492: MENDE | O492: NICOL | R492: MEADE
A493: GEELONG WEST | C493: NORTH | F493: CRUTCHFIELD | I493: BERRY | L493: SHEA | O493: WEBER
A494: GOALKICKERS
A495: SPRINGVALE | C495: NICOL 5 | E495: STEWART 5 | H495: VERNON 3 | J495: DUDLEY 3 | M495: MENDE 3 | O495: ROBINSON 2 | R495: NANFRA
A496: GEELONG WEST | C496: HIGGINS 2 | E496: TODD 2 | G496: MORRISSEY 2 | J496: CLINGIN | L496: RADOJEVIC | N496: BERRY | P496: SHEA | R496: WEBER
A498: WILLIAMSTOWN | C498: 5 | D498: 3 | E498: 33 | G498: 13 | H498: 7 | I498: 85 | K498: 16 | L498: 11 | M498: 107 | O498: 21 | P498: 19 | Q498: 145 | S498: VENUE: WILLIAMSTOWN
A499: BRUNSWICK | C499: 4 | D499: 6 | E499: 30 | G499: 5 | H499: 7 | I499: 37 | K499: 9 | L499: 11 | M499: 65 | O499: 13 | P499: 12 | Q499: 90 | S499: CASEY :PRICE
A500: BEST PLAYERS
A501: WILLIAMSTOWN | C501: HUGHES | F501: ROUND | I501: SAIT | L501: OWEN | O501: SLEVISON | R501: MUSCHIALLI
A502: BRUNSWICK | C502: McALLESTER | F502: HYSLOP | I502: WEST | L502: CONNELL | O502: EDWARDS | R502: THOROGOOD
A503: GOALKICKERS
A504: WILLIAMSTOWN | C504: FOTHERINGHAM 6 | G504: SIMMONS 5 | J504: SAIT 3 | L504: G SMITH 2 | N504: MUSCHIALLI 2 | Q504: HUGHES | S504: OWEN | U504: R KNIGHT
A505: BRUNSWICK | C505: GRIFFITHS 3 | F505: HYSLOP 3 | I505: SMITH 2 | K505: CONNELL | M505: LOVETT | O505: JUDGE | Q505: ROULSTON | T505: McALLESTER
A507: ROUND 12 | D507: 12TH JULY | I507: WEATHER | S507: VENUE: WILLIAMSTOWN
D508: 1ST QTR | H508: 2ND QTR | L508: 3RD QTR | P508: FINAL | S508: UMPIRES
A509: WILLIAMSTOWN | C509: 3 | D509: 5 | E509: 23 | G509: 8 | H509: 8 | I509: 56 | K509: 13 | L509: 19 | M509: 97 | O509: 19 | P509: 24 | Q509: 138 | S509: HARVEY | X509: LADDER | AB509: ROUND | AD509: 12
A510: BOX HILL | C510: 4 | D510: 4 | E510: 28 | G510: 9 | H510: 8 | I510: 62 | K510: 14 | L510: 9 | M510: 93 | O510: 20 | P510: 11 | Q510: 131 | S510: BLACK
A511: BEST PLAYERS | W511: TEAM | X511: W | Y511: L | Z511: D | AA511: FOR | AB511: AGST | AC511: % | AD511: PTS
A512: WILLIAMSTOWN | C512: McTAGGART | F512: SLEVISON | I512: FOTHERINGHAM | L512: ROUND | O512: CAHILL | R512: NILSSEN
A513: BOX HILL | C513: P BOLTON | F513: WILSON | I513: HALBERT | L513: NICHOLSON | O513: L BOLTON | R513: FULLER | W513: PORT MELBOURNE | X513: 10 | Y513: 2 | Z513: 0 | AA513: 1717 | AB513: 1247 | AC513: =(AA513/AB513)*100 -> 137.69045709703286 | AD513: =(X513*4)+(Z513*2) -> 40
A514: GOALKICKERS | W514: FRANKSTON | X514: 8 | Y514: 3 | Z514: 1 | AA514: 1498 | AB514: 1263 | AC514: =(AA514/AB514)*100 -> 118.60649247822646 | AD514: =(X514*4)+(Z514*2) -> 34
A515: WILLIAMSTOWN | C515: FOTHERINGHAM 10 | G515: SMITH 3 | I515: V DIMARTINO 2 | L515: CAHILL 2 | N515: NILSSEN | P515: R KNIGHT | W515: WILLIAMSTOWN | X515: 8 | Y515: 4 | Z515: 0 | AA515: 1467 | AB515: 1295 | AC515: =(AA515/AB515)*100 -> 113.28185328185327 | AD515: =(X515*4)+(Z515*2) -> 32
A516: BOX HILL | C516: FULLER 6 | E516: GERADTS 4 | H516: WILSON 3 | J516: HALBERT 3 | M516: McCONNON | P516: NICHOLSON | R516: BOURKE | W516: SPRINGVALE | X516: 7 | Y516: 5 | Z516: 0 | AA516: 1396 | AB516: 1016 | AC516: =(AA516/AB516)*100 -> 137.4015748031496 | AD516: =(X516*4)+(Z516*2) -> 28
O517: GARTH | S517: VENUE: SPRINGVALE
A518: SPRINGVALE | C518: 8 | D518: 2 | E518: 50 | G518: 12 | H518: 8 | I518: 80 | K518: 14 | L518: 10 | M518: 94 | O518: 20 | P518: 12 | Q518: 132 | S518: BRADY | W518: COBURG | X518: 7 | Y518: 5 | Z518: 0 | AA518: 1415 | AB518: 1179 | AC518: =(AA518/AB518)*100 -> 120.01696352841391 | AD518: =(X518*4)+(Z518*2) -> 28
A519: PRESTON | C519: 2 | D519: 1 | E519: 13 | G519: 2 | H519: 1 | I519: 13 | K519: 3 | L519: 10 | M519: 28 | O519: 5 | P519: 13 | Q519: 43 | S519: CASEY | W519: BRUNSWICK | X519: 7 | Y519: 5 | Z519: 0 | AA519: 1308 | AB519: 1352 | AC519: =(AA519/AB519)*100 -> 96.745562130177504 | AD519: =(X519*4)+(Z519*2) -> 28
A520: BEST PLAYERS | W520: PRESTON | X520: 5 | Y520: 7 | Z520: 0 | AA520: 1168 | AB520: 1332 | AC520: =(AA520/AB520)*100 -> 87.687687687687685 | AD520: =(X520*4)+(Z520*2) -> 20
A521: SPRINGVALE | C521: MALONI | F521: FOY | I521: VERNON | L521: JEFFS | N521: NICOL | Q521: G ROBINSON | W521: SANDRINGHAM | X521: 4 | Y521: 8 | Z521: 0 | AA521: 1249 | AB521: 1537 | AC521: =(AA521/AB521)*100 -> 81.262199089134683 | AD521: =(X521*4)+(Z521*2) -> 16
A522: PRESTON | C522: BRINE | F522: REEVES | I522: WATT | L522: FROST | W522: BOX HILL | X522: 3 | Y522: 9 | Z522: 0 | AA522: 1216 | AB522: 1374 | AC522: =(AA522/AB522)*100 -> 88.500727802037844 | AD522: =(X522*4)+(Z522*2) -> 12
A523: GOALKICKERS | P523: MENDE | W523: GEELONG WEST | X523: 0 | Y523: 11 | Z523: 1 | AA523: 976 | AB523: 1794 | AC523: =(AA523/AB523)*100 -> 54.40356744704571 | AD523: =(X523*4)+(Z523*2) -> 2
A524: SPRINGVALE | C524: NICOL 6 | E524: G ROBINSON 3 | H524: VERNON 2 | J524: DUDLEY 2 | L524: MAYLIN 2 | N524: STEWART 2 | Q524: SHANNON | S524: JEFFS
A525: PRESTON | C525: HALAS 2 | F525: JORDAN 2 | I525: BRINE
A527: PORT MELBOURNE | C527: 9 | D527: 9 | E527: 63 | G527: 13 | H527: 14 | I527: 92 | K527: 20 | L527: 22 | M527: 142 | O527: 28 | P527: 27 | Q527: 195 | S527: VENUE: PORT MELBOURNE
A528: GEELONG WEST | C528: 4 | D528: 6 | E528: 30 | G528: 8 | H528: 8 | I528: 56 | K528: 11 | L528: 10 | M528: 76 | O528: 16 | P528: 12 | Q528: 108 | S528: NOLAN ;GLEESON
A529: BEST PLAYERS
A530: PORT MELBOURNE | C530: JENNINGS | F530: COOPER | I530: WHITZELL | L530: McCORMACK | O530: WALL | Q530: S HARKINS
A531: GEELONG WEST | C531: DILLON | F531: McMASTER | I531: BERRY | L531: NORTH | O531: BISSETT
A532: GOALKICKERS
A533: PORT MELBOURNE | C533: COOPER 6 | F533: SNEDDON 5 | I533: MUTIMER 4 | L533: SWAN 3 | N533: HICKS 3 | P533: McCORMACK 2 | S533: SCURRAH 2 | W533: S HARKINS 2 | X533: JENNINGS
A534: GEELONG WEST | C534: BISSETT 6 | F534: BERRY 3 | H534: HAMILTON 2 | K534: MORISSEY 2 | N534: DILLON | P534: McMASTER | R534: WIGHT
A536: COBURG | C536: 4 | D536: 8 | E536: 32 | G536: 7 | H536: 10 | I536: 52 | K536: 11 | L536: 13 | M536: 79 | O536: 18 | P536: 16 | Q536: 124 | S536: VENUE: COBURG
A537: SANDRINGHAM | C537: 0 | D537: 1 | E537: 1 | G537: 3 | H537: 5 | I537: 23 | K537: 6 | L537: 8 | M537: 44 | O537: 7 | P537: 12 | Q537: 54 | S537: PRICE :VERGONA
A538: BEST PLAYERS
A539: COBURG | C539: EVANS | F539: ALLISON | I539: WILLIAMS | L539: GUMLEY | O539: SHELDON | R539: INGRAM
A540: SANDRINGHAM | C540: PARK | F540: DOBSON | I540: HENDERSON | L540: WALL | O540: BENNETT
A541: GOALKICKERS
A542: COBURG | C542: WEATHERALD 4 | F542: SUTHERLAND 3 | I542: RIENIETS 2 | K542: ZANON 2 | M542: WILLIAMS 2 | O542: EADE | Q542: ALLISON | S542: GUMLEY | V542: SHELDON | X542: LAKEY
A543: SANDRINGHAM | C543: BENNETT 5 | F543: MANNIX | I543: EAVES
A545: FRANKSTON | C545: 3 | D545: 4 | E545: 22 | G545: 8 | H545: 6 | I545: 54 | K545: 16 | L545: 10 | M545: 106 | O545: 20 | P545: 15 | Q545: 135 | S545: VENUE: BRUNSWICK
A546: BRUNSWICK | C546: 4 | D546: 1 | E546: 25 | G546: 7 | H546: 4 | I546: 46 | K546: 8 | L546: 7 | M546: 55 | O546: 12 | P546: 9 | Q546: 81 | S546: MARSHALL :WALKER
A547: BEST PLAYERS
A548: FRANKSTON | C548: O'BRIEN | F548: BROWN | I548: MARTIN | L548: CROSS | O548: FAVIER | R548: SARAU
A549: BRUNSWICK | C549: BEALE | F549: WEST | I549: THOROGOOD | L549: CONNELL | O549: LEAHY | R549: HYSLOP
A550: GOALKICKERS
A551: FRANKSTON | C551: WHITFIELD 4 | F551: BOLAND 4 | I551: O'RILEY 3 | K551: MARTIN 2 | M551: O'BRIEN 2 | O551: YOUNG 2 | Q551: BROWN | S551: CZARNECKI | W551: FAVIER
A552: BRUNSWICK | C552: WRIGHT 4 | F552: SMITH 3 | H552: McGHIE 2 | J552: McALLESTER | M552: HYSLOP | O552: GRIFFITHS
A554: ROUND 13 | D554: 19TH JULY | I554: WEATHER | S554: VENUE: PRESTON
D555: 1ST QTR | H555: 2ND QTR | L555: 3RD QTR | P555: FINAL | S555: UMPIRES
A556: PRESTON | C556: 5 | D556: 4 | E556: 34 | G556: 15 | H556: 7 | I556: 97 | K556: 19 | L556: 12 | M556: 126 | O556: 21 | P556: 13 | Q556: 139 | S556: HARVEY | X556: LADDER | AB556: ROUND | AD556: 13
A557: PORT MELBOURNE | C557: 4 | D557: 5 | E557: 29 | G557: 8 | H557: 6 | I557: 54 | K557: 10 | L557: 7 | M557: 67 | O557: 19 | P557: 11 | Q557: 125 | S557: WALKER
A558: BEST PLAYERS | W558: TEAM | X558: W | Y558: L | Z558: D | AA558: FOR | AB558: AGST | AC558: % | AD558: PTS
A559: PRESTON | C559: REEVES | F559: WATT | I559: ANDERSON | L559: ATKIN | O559: HALAS | R559: PLOWMAN
A560: PORT MELBOURNE | C560: HETHERTON | F560: S HARKINS | I560: WALL | L560: McCORMACK | O560: RAINSFORD | R560: JENNINGS | W560: PORT MELBOURNE | X560: 10 | Y560: 3 | Z560: 0 | AA560: 1842 | AB560: 1386 | AC560: =(AA560/AB560)*100 -> 132.90043290043289 | AD560: =(X560*4)+(Z560*2) -> 40
A561: GOALKICKERS | P561: JACKSON | R561: REEVES | W561: FRANKSTON | X561: 8 | Y561: 4 | Z561: 1 | AA561: 1556 | AB561: 1385 | AC561: =(AA561/AB561)*100 -> 112.34657039711192 | AD561: =(X561*4)+(Z561*2) -> 34
A562: PRESTON | C562: HALAS 5 | E562: LAWSON 3 | G562: PERRY 2 | I562: ATKIN 2 | K562: WATT 2 | M562: LUMICISI 2 | O562: DINTINOSANTE 2 | R562: FROST | W562: SPRINGVALE | X562: 8 | Y562: 5 | Z562: 0 | AA562: 1518 | AB562: 1074 | AC562: =(AA562/AB562)*100 -> 141.34078212290501 | AD562: =(X562*4)+(Z562*2) -> 32
A563: PORT MELBOURNE | C563: S HARKINS 4 | F563: WALL 4 | H563: JENNINGS 2 | J563: McCORMACK 2 | M563: SCURRAH 2 | P563: COOPER | R563: FITZPATRICK | W563: COBURG | X563: 8 | Y563: 5 | Z563: 0 | AA563: 1536 | AB563: 1285 | AC563: =(AA563/AB563)*100 -> 119.53307392996109 | AD563: =(X563*4)+(Z563*2) -> 32
I564: MUTIMER | L564: SNEDDON | O564: HETHERTON | S564: VENUE: BOX HILL
A565: BRUNSWICK | C565: 5 | D565: 2 | E565: 32 | G565: 7 | H565: 3 | I565: 45 | K565: 9 | L565: 5 | M565: 59 | O565: 10 | P565: 9 | Q565: 69 | S565: GLEESON | W565: WILLIAMSTOWN | X565: 8 | Y565: 5 | Z565: 0 | AA565: 1546 | AB565: 1410 | AC565: =(AA565/AB565)*100 -> 109.64539007092198 | AD565: =(X565*4)+(Z565*2) -> 32
A566: BOX HILL | C566: 4 | D566: 3 | E566: 27 | G566: 4 | H566: 7 | I566: 31 | K566: 6 | L566: 8 | M566: 44 | O566: 7 | P566: 11 | Q566: 53 | S566: VERGONA | W566: BRUNSWICK | X566: 8 | Y566: 5 | Z566: 0 | AA566: 1377 | AB566: 1405 | AC566: =(AA566/AB566)*100 -> 98.007117437722428 | AD566: =(X566*4)+(Z566*2) -> 32
A567: BEST PLAYERS | W567: PRESTON | X567: 6 | Y567: 7 | Z567: 0 | AA567: 1307 | AB567: 1457 | AC567: =(AA567/AB567)*100 -> 89.704873026767331 | AD567: =(X567*4)+(Z567*2) -> 24
A568: BRUNSWICK | C568: WEST | F568: POTTER | I568: BEALE | L568: THOROGOOD | O568: CONNELL | R568: LEAHY | W568: SANDRINGHAM | X568: 5 | Y568: 8 | Z568: 0 | AA568: 1364 | AB568: 1616 | AC568: =(AA568/AB568)*100 -> 84.405940594059402 | AD568: =(X568*4)+(Z568*2) -> 20
A569: BOX HILL | C569: P BOLTON | F569: COOPER | I569: NICHOLSON | L569: GLEESON | O569: O'SHEA | R569: ROBERTSON | W569: BOX HILL | X569: 3 | Y569: 10 | Z569: 0 | AA569: 1269 | AB569: 1443 | AC569: =(AA569/AB569)*100 -> 87.941787941787936 | AD569: =(X569*4)+(Z569*2) -> 12
A570: GOALKICKERS | W570: GEELONG WEST | X570: 0 | Y570: 12 | Z570: 1 | AA570: 1082 | AB570: 1915 | AC570: =(AA570/AB570)*100 -> 56.501305483028716 | AD570: =(X570*4)+(Z570*2) -> 2
A571: BRUNSWICK | C571: CALLANDER 2 | F571: GRIFFITHS 2 | I571: McINERNEY 2 | L571: BEALE | N571: McGHIE | P571: POTTER | R571: WEST
A572: BOX HILL | C572: D BOURKE 2 | F572: HALBERT 2 | I572: COOPER | K572: P BOLTON | N572: GARTH
A574: SANDRINGHAM | C574: 3 | D574: 4 | E574: 22 | G574: 5 | H574: 7 | I574: 37 | K574: 11 | L574: 9 | M574: 75 | O574: 17 | P574: 13 | Q574: 115 | S574: VENUE: BEACH ROAD
A575: WILLIAMSTOWN | C575: 1 | D575: 3 | E575: 9 | G575: 2 | H575: 9 | I575: 21 | K575: 7 | L575: 10 | M575: 52 | O575: 11 | P575: 13 | Q575: 79 | S575: BRADY :NOLAN
A576: BEST PLAYERS
A577: SANDRINGHAM | C577: BERGMAN | F577: ERWIN | I577: BENNETT | L577: HOWELL | O577: EAVES | R577: RYAN
A578: WILLIAMSTOWN | C578: ROUND | F578: McTAGGART | I578: WHEELER | L578: RICKMAN
A579: GOALKICKERS
A580: SANDRINGHAM | C580: BERGMAN 6 | F580: BENNETT 5 | I580: ERWIN 3 | K580: GORIZIDIS 2 | N580: RIGGS
A581: WILLIAMSTOWN | C581: DIMARTINO 3 | F581: FOTHERINGHAM 2 | J581: CAHILL 2 | L581: RICKMAN | N581: SIMMONS | P581: SMITH | R581: NILSSEN
A583: COBURG | C583: 6 | D583: 3 | E583: 39 | G583: 8 | H583: 7 | I583: 55 | K583: 13 | L583: 16 | M583: 94 | O583: 17 | P583: 19 | Q583: 121 | S583: VENUE: GEELONG WEST
A584: GEELONG WEST | C584: 3 | D584: 3 | E584: 21 | G584: 7 | H584: 6 | I584: 48 | K584: 11 | L584: 10 | M584: 76 | O584: 15 | P584: 16 | Q584: 106 | S584: HUTCHINSON :K MARSHALL
A585: BEST PLAYERS
A586: COBURG | C586: EADE | E586: SUTHERLAND | H586: RIENIETS | K586: FREEMAN | N586: ANGWIN | Q586: SHELDON
A587: GEELONG WEST | C587: TODD | E587: MORRISSEY | H587: MCMASTER | K587: BERRY | N587: WINTER
A588: GOALKICKERS
A589: COBURG | C589: WEATHERALD 5 | F589: RIENIETS 2 | I589: EADE 2 | K589: WILLIAMS 2 | N589: FREEMAN 2 | Q589: SUTHERLAND 2 | U589: DARBY | W589: FITZPATRICK
A590: GEELONG WEST | C590: CRUTCHFIELD 4 | F590: McMASTER 3 | I590: BISSET 3 | K590: MORRISSEY 2 | N590: DOYLE 2 | P590: BERRY
A592: SPRINGVALE | C592: 3 | D592: 7 | E592: 25 | G592: 10 | H592: 10 | I592: 70 | K592: 12 | L592: 17 | M592: 89 | O592: 17 | P592: 20 | Q592: 122 | S592: VENUE: FRANKSTON
A593: FRANKSTON | C593: 2 | D593: 1 | E593: 13 | G593: 4 | H593: 4 | I593: 28 | K593: 8 | L593: 8 | M593: 56 | O593: 8 | P593: 10 | Q593: 58 | S593: MORROW :PRICE
A594: BEST PLAYERS
A595: SPRINGVALE | C595: CLARKE | F595: DEMPSTER | I595: MENDE | L595: MEADE | O595: MAYLIN | Q595: DUDLEY
A596: FRANKSTON | C596: BROWN | F596: MARTIN | I596: O'BRIEN | L596: BOLAND | O596: CROSS
A597: GOALKICKERS
A598: SPRINGVALE | C598: DUDLEY 4 | F598: VERNON 2 | I598: PROSSER 2 | K598: NICOL 2 | M598: CLARKE | O598: MEADE | Q598: MAYLIN | S598: DUDLEY | V598: JEFFS
A599: FRANKSTON | C599: BINGLEY 2 | F599: CROSS 2 | H599: NIKAKIS 2 | J599: FAVIER | L599: O'RILEY
A601: ROUND 14 | D601: 26TH JULY | I601: WEATHER | S601: VENUE: BOX HILL
D602: 1ST QTR | H602: 2ND QTR | L602: 3RD QTR | P602: FINAL | S602: UMPIRES
A603: SANDRINGHAM | C603: 5 | D603: 4 | E603: 34 | G603: 9 | H603: 5 | I603: 59 | K603: 14 | L603: 14 | M603: 98 | O603: 18 | P603: 15 | Q603: 123 | S603: HUTCHINSON | X603: LADDER | AB603: ROUND | AD603: 14
A604: BOX HILL | C604: 1 | D604: 5 | E604: 11 | G604: 4 | H604: 6 | I604: 30 | K604: 5 | L604: 9 | M604: 39 | O604: 8 | P604: 15 | Q604: 63 | S604: WALKER
A605: BEST PLAYERS | W605: TEAM | X605: W | Y605: L | Z605: D | AA605: FOR | AB605: AGST | AC605: % | AD605: PTS
A606: SANDRINGHAM | C606: BONNEY | F606: DOBSON | I606: FITZPATRICK | L606: KRISTENSEN | O606: HOWELL | Q606: ERWIN
A607: BOX HILL | C607: DWYER | F607: ROBINSON | I607: HALBERT | L607: GERADTS | W607: PORT MELBOURNE | X607: 10 | Y607: 4 | Z607: 0 | AA607: 1910 | AB607: 1515 | AC607: =(AA607/AB607)*100 -> 126.07260726072607 | AD607: =(X607*4)+(Z607*2) -> 40
A608: GOALKICKERS | P608: KRISTENSEN | R608: HOWELL | W608: FRANKSTON | X608: 9 | Y608: 4 | Z608: 1 | AA608: 1685 | AB608: 1453 | AC608: =(AA608/AB608)*100 -> 115.96696490020646 | AD608: =(X608*4)+(Z608*2) -> 38
A609: SANDRINGHAM | C609: BENNETT 6 | F609: GOROZIDIS 3 | I609: JOHNSON 2 | L609: BONNEY 2 | N609: BERGMAN 2 | Q609: RIGGS | W609: SPRINGVALE | X609: 9 | Y609: 5 | Z609: 0 | AA609: 1658 | AB609: 1187 | AC609: =(AA609/AB609)*100 -> 139.6798652064027 | AD609: =(X609*4)+(Z609*2) -> 36
A610: BOX HILL | C610: P BOLTON 4 | F610: HALBERT 2 | I610: GARTH | K610: O'SHEA | W610: COBURG | X610: 9 | Y610: 5 | Z610: 0 | AA610: 1708 | AB610: 1376 | AC610: =(AA610/AB610)*100 -> 124.12790697674419 | AD610: =(X610*4)+(Z610*2) -> 36
S611: VENUE: PORT MELBOURNE
A612: FRANKSTON | C612: 4 | D612: 6 | E612: 30 | G612: 7 | H612: 10 | I612: 52 | K612: 13 | L612: 13 | M612: 91 | O612: 19 | P612: 15 | Q612: 129 | S612: BRADY | W612: WILLIAMSTOWN | X612: 9 | Y612: 5 | Z612: 0 | AA612: 1735 | AB612: 1503 | AC612: =(AA612/AB612)*100 -> 115.43579507651364 | AD612: =(X612*4)+(Z612*2) -> 36
A613: PORT MELBOURNE | C613: 3 | D613: 6 | E613: 24 | G613: 5 | H613: 7 | I613: 37 | K613: 7 | L613: 10 | M613: 52 | O613: 9 | P613: 14 | Q613: 68 | S613: CASEY | W613: BRUNSWICK | X613: 8 | Y613: 6 | Z613: 0 | AA613: 1490 | AB613: 1545 | AC613: =(AA613/AB613)*100 -> 96.440129449838182 | AD613: =(X613*4)+(Z613*2) -> 32
A614: BEST PLAYERS | W614: SANDRINGHAM | X614: 6 | Y614: 8 | Z614: 0 | AA614: 1487 | AB614: 1679 | AC614: =(AA614/AB614)*100 -> 88.564621798689686 | AD614: =(X614*4)+(Z614*2) -> 24
A615: FRANKSTON | C615: O'RILEY | F615: FAVIER | I615: PAYNE | L615: O'BRIEN | N615: BROWN | Q615: SARAU | W615: PRESTON | X615: 6 | Y615: 8 | Z615: 0 | AA615: 1398 | AB615: 1629 | AC615: =(AA615/AB615)*100 -> 85.819521178637203 | AD615: =(X615*4)+(Z615*2) -> 24
A616: PORT MELBOURNE | C616: JENNINGS | F616: SNEDDON | I616: SWAN | W616: BOX HILL | X616: 3 | Y616: 11 | Z616: 0 | AA616: 1332 | AB616: 1566 | AC616: =(AA616/AB616)*100 -> 85.057471264367805 | AD616: =(X616*4)+(Z616*2) -> 12
A617: GOALKICKERS | W617: GEELONG WEST | X617: 0 | Y617: 13 | Z617: 1 | AA617: 1175 | AB617: 2104 | AC617: =(AA617/AB617)*100 -> 55.846007604562743 | AD617: =(X617*4)+(Z617*2) -> 2
A618: FRANKSTON | C618: O'RILEY 5 | E618: HORNER 4 | G618: CROSS 3 | I618: FAVIER 2 | K618: YOUNG 2 | M618: HAMILL | O618: NIKAKIS | Q618: O'BRIEN
A619: PORT MELBOURNE | C619: SNEDDON 4 | F619: WALL 2 | H619: DERMOTT | J619: JENNINGS | M619: WHITZELL
A621: COBURG | C621: 6 | D621: 10 | E621: 46 | G621: 11 | H621: 14 | I621: 80 | K621: 15 | L621: 22 | M621: 112 | O621: 24 | P621: 28 | Q621: 172 | S621: VENUE: COBURG
A622: PRESTON | C622: 1 | D622: 1 | E622: 7 | G622: 6 | H622: 4 | I622: 40 | K622: 9 | L622: 10 | M622: 64 | O622: 13 | P622: 13 | Q622: 91 | S622: MORROW :GLEESON
A623: BEST PLAYERS
A624: COBURG | C624: WEIDEMAN | F624: RIENIETS | I624: WEATHERALD | L624: TARANTO | N624: INGRAM | Q624: ALLISON
A625: PRESTON | C625: PERRY | F625: HUNT | I625: AITKEN | L625: LUMICISI
A626: GOALKICKERS
A627: COBURG | C627: WEATHERALD 8 | F627: WILLIAMS 5 | I627: FITZPATRICK 3 | L627: ALLISON 2 | N627: CLEARY 2 | P627: EADE | Q627: ATAARTA | S627: GUMLEY | V627: FREEMAN
A628: PRESTON | C628: JACKSON 3 | F628: HALAS 2 | H628: LUMICISI 2 | J628: PERRY | L628: HUNT | N628: AITKEN | P628: PLOWMAN | R628: BRINE | T628: DINTINOSANTE
A630: WILLIAMSTOWN | C630: 6 | D630: 9 | E630: 45 | G630: 10 | H630: 12 | I630: 72 | K630: 21 | L630: 17 | M630: 143 | O630: 28 | P630: 21 | Q630: 189 | S630: VENUE: WILLIAMSTOWN
A631: GEELONG WEST | C631: 1 | D631: 1 | E631: 7 | G631: 8 | H631: 1 | I631: 49 | K631: 11 | L631: 2 | M631: 68 | O631: 15 | P631: 3 | Q631: 93 | S631: VERGONA :PRICE
A632: BEST PLAYERS
A633: WILLIAMSTOWN | C633: KENNEDY | F633: ROUND | I633: McTAGGART | L633: RICKMAN | O633: WHILLAS | R633: DELRE
A634: GEELONG WEST | C634: GIBSON | F634: BERRY | I634: MORRISSEY | L634: KRANJC | O634: REDHEAD
A635: GOALKICKERS
A636: WILLIAMSTOWN | C636: FOTHERINGHAM 6 | F636: SIMMONS 5 | I636: RICKMAN 4 | L636: LANE 3 | N636: R KNIGHT 3 | Q636: V DIMARTINO 3 | U636: SAIT | W636: WHEELER | X636: WHILLAS | AA636: MURPHY
A637: GEELONG WEST | C637: BERRY 4 | F637: SHEA 3 | H637: MORRISSEY 3 | K637: DOYLE 3 | M637: KELLY | O637: PODBURY
A639: SPRINGVALE | C639: 6 | D639: 2 | E639: 38 | G639: 12 | H639: 7 | I639: 79 | K639: 15 | L639: 13 | M639: 103 | O639: 20 | P639: 20 | Q639: 140 | S639: VENUE: SPRINGVALE
A640: BRUNSWICK | C640: 8 | D640: 5 | E640: 53 | G640: 11 | H640: 9 | I640: 75 | K640: 15 | L640: 11 | M640: 101 | O640: 17 | P640: 11 | Q640: 113 | S640: HARVEY :NOLAN
A641: BEST PLAYERS
A642: SPRINGVALE | C642: FOY | E642: MAYLIN | H642: DUDLEY | K642: PROSSER | N642: KING | Q642: CLARKE
A643: BRUNSWICK | C643: LEAHY | E643: WEST | H643: CALLANDER | K643: McGHIE | N643: BAKER | Q643: HYSLOP
A644: GOALKICKERS
A645: SPRINGVALE | C645: DUDLEY 5 | E645: STEWART 5 | H645: PROSSER 3 | J645: DUNNE 2 | L645: CLARKE | N645: WARD | P645: NICOL | R645: SHANNON | U645: G ROBINSON
A646: BRUNSWICK | C646: CALLANDER 4 | F646: WEST 3 | H646: McINERNEY 3 | K646: GIBSON 2 | M646: McGHIE 2 | O646: GRIFFITHS | Q646: SMITH | S646: POTTER
A648: ROUND 15 | D648: 2ND AUGUST | I648: WEATHER | S648: VENUE: PRESTON
D649: 1ST QTR | H649: 2ND QTR | L649: 3RD QTR | P649: FINAL | S649: UMPIRES
A650: WILLIAMSTOWN | C650: 7 | D650: 2 | E650: 44 | G650: 17 | H650: 3 | I650: 105 | K650: 24 | L650: 4 | M650: 148 | O650: 32 | P650: 7 | Q650: 199 | S650: CASEY | X650: LADDER | AB650: ROUND | AD650: 15
A651: PRESTON | C651: 4 | D651: 0 | E651: 24 | G651: 6 | H651: 3 | I651: 39 | K651: 9 | L651: 4 | M651: 58 | O651: 12 | P651: 6 | Q651: 78 | S651: HUTCHINSON
A652: BEST PLAYERS | W652: TEAM | X652: W | Y652: L | Z652: D | AA652: FOR | AB652: AGST | AC652: % | AD652: PTS
A653: WILLIAMSTOWN | C653: SLEVISON | F653: ROUND | I653: V DIMSRTINO | L653: KENNEDY | O653: RICKMAN | R653: LANE
A654: PRESTON | C654: LAWSON | F654: JORDAN | I654: AITKEN | W654: PORT MELBOURNE | X654: 11 | Y654: 4 | Z654: 0 | AA654: 1993 | AB654: 1570 | AC654: =(AA654/AB654)*100 -> 126.94267515923568 | AD654: =(X654*4)+(Z654*2) -> 44
A655: GOALKICKERS | P655: SLEVISON | R655: NILSSEN | W655: FRANKSTON | X655: 10 | Y655: 4 | Z655: 1 | AA655: 1819 | AB655: 1546 | AC655: =(AA655/AB655)*100 -> 117.65847347994824 | AD655: =(X655*4)+(Z655*2) -> 42
A656: WILLIAMSTOWN | C656: RICKMAN 8 | E656: V DIMARTINO 8 | H656: SAIT 5 | J656: KENNEDY 3 | M656: SIMMONS 3 | P656: S KNIGHT 2 | R656: McTAGGART | W656: WILLIAMSTOWN | X656: 10 | Y656: 5 | Z656: 0 | AA656: 1934 | AB656: 1581 | AC656: =(AA656/AB656)*100 -> 122.32764073371285 | AD656: =(X656*4)+(Z656*2) -> 40
A657: PRESTON | C657: LAWSON 2 | E657: PERRY 2 | G657: AITKEN 2 | I657: LUMICISI 2 | L657: ANDERSON | N657: JACKSON | P657: NOBLE | R657: GALAFARO | W657: SPRINGVALE | X657: 9 | Y657: 6 | Z657: 0 | AA657: 1713 | AB657: 1270 | AC657: =(AA657/AB657)*100 -> 134.88188976377953 | AD657: =(X657*4)+(Z657*2) -> 36
S658: VENUE: FRANKSTON
A659: FRANKSTON | C659: 4 | D659: 5 | E659: 29 | G659: 10 | H659: 6 | I659: 66 | K659: 15 | L659: 8 | M659: 98 | O659: 20 | P659: 14 | Q659: 134 | S659: HARVEY | W659: COBURG | X659: 9 | Y659: 6 | Z659: 0 | AA659: 1801 | AB659: 1510 | AC659: =(AA659/AB659)*100 -> 119.27152317880794 | AD659: =(X659*4)+(Z659*2) -> 36
A660: COBURG | C660: 2 | D660: 2 | E660: 14 | G660: 6 | H660: 5 | I660: 41 | K660: 9 | L660: 7 | M660: 61 | O660: 14 | P660: 9 | Q660: 93 | S660: WALKER | W660: BRUNSWICK | X660: 8 | Y660: 7 | Z660: 0 | AA660: 1580 | AB660: 1648 | AC660: =(AA660/AB660)*100 -> 95.873786407766985 | AD660: =(X660*4)+(Z660*2) -> 32
A661: BEST PLAYERS | W661: SANDRINGHAM | X661: 7 | Y661: 8 | Z661: 0 | AA661: 1590 | AB661: 1769 | AC661: =(AA661/AB661)*100 -> 89.881288863764837 | AD661: =(X661*4)+(Z661*2) -> 28
A662: FRANKSTON | C662: O'BRIEN | F662: BARDOEL | I662: PAYNE | L662: NIKAKIS | O662: KENTER | Q662: SARAU | W662: PRESTON | X662: 6 | Y662: 9 | Z662: 0 | AA662: 1476 | AB662: 1828 | AC662: =(AA662/AB662)*100 -> 80.743982494529547 | AD662: =(X662*4)+(Z662*2) -> 24
A663: COBURG | C663: WEATHERALD | F663: EADE | I663: SHELDON | L663: INGRAM | O663: DARBY | W663: BOX HILL | X663: 3 | Y663: 12 | Z663: 0 | AA663: 1400 | AB663: 1668 | AC663: =(AA663/AB663)*100 -> 83.932853717026376 | AD663: =(X663*4)+(Z663*2) -> 12
A664: GOALKICKERS | W664: GEELONG WEST | X664: 1 | Y664: 13 | Z664: 1 | AA664: 1277 | AB664: 2172 | AC664: =(AA664/AB664)*100 -> 58.793738489871082 | AD664: =(X664*4)+(Z664*2) -> 6
A665: FRANKSTON | C665: O'BRIEN 6 | E665: NIKAKIS 4 | H665: HORNER 3 | J665: O'RILEY 3 | L665: CROSS | N665: CZARNECKI | Q665: FAVIER | S665: HAMILL
A666: COBURG | C666: WEATHERALD 7 | F666: DARBY 2 | I666: CLEARY 2 | K666: INGRAM 2 | M666: SHELDON
A668: PORT MELBOURNE | C668: 3 | D668: 7 | E668: 25 | G668: 6 | H668: 7 | I668: 43 | K668: 7 | L668: 10 | M668: 52 | O668: 12 | P668: 11 | Q668: 83 | S668: VENUE: SPRINGVALE
A669: SPRINGVALE | C669: 2 | D669: 0 | E669: 12 | G669: 4 | H669: 4 | I669: 28 | K669: 5 | L669: 8 | M669: 38 | O669: 7 | P669: 13 | Q669: 55 | S669: VERGONA :MARSHALL
A670: BEST PLAYERS
A671: PORT MELBOURNE | C671: HETHERTON | F671: JENNINGS | I671: WALL | L671: SNEDDON | O671: DERMOTT | R671: COOTTEE
A672: SPRINGVALE | C672: FOY | F672: MAYLIN | I672: CLARKE | L672: MALONI | O672: MEADE
A673: GOALKICKERS
A674: PORT MELBOURNE | C674: GOSS 2 | E674: HETHERTON 2 | H674: MUTIMER 2 | J674: WHITZELL 2 | M674: FOLEY | O674: JENNINGS | Q674: McCORMACK | T674: SWAN
A675: SPRINGVALE | C675: DUDLEY 2 | F675: K ROBINSON 2 | I675: MENDE | K675: SHANNON | N675: WARNER
A677: GEELONG WEST | C677: 4 | D677: 4 | E677: 28 | G677: 8 | H677: 4 | I677: 52 | K677: 9 | L677: 5 | M677: 59 | O677: 15 | P677: 12 | Q677: 102 | S677: VENUE: GEELONG WEST
A678: BOX HILL | C678: 4 | D678: 2 | E678: 26 | G678: 7 | H678: 5 | I678: 47 | K678: 10 | L678: 7 | M678: 67 | O678: 10 | P678: 8 | Q678: 68 | S678: MORROW :BRADY
A679: BEST PLAYERS
A680: GEELONG WEST | C680: BERRY | F680: FIRMAN | I680: EVANS | L680: KRANJC | O680: TODD
A681: BOX HILL | C681: N/A
A682: GOALKICKERS
A683: GEELONG WEST | C683: BERRY 4 | E683: TODD 3 | G683: BISSETT 3 | I683: MORRISSEY 2 | L683: DILLON | N683: SHEA | P683: CRUTCHFIELD
A684: BOX HILL | C684: P BOLTON 4 | F684: L BOLTON | I684: GERADTS | K684: WILSON | M684: KAVANAGH | P684: GARTH | R684: BOURKE
A686: SANDRINGHAM | C686: 4 | D686: 5 | E686: 29 | G686: 8 | H686: 8 | I686: 56 | K686: 10 | L686: 10 | M686: 70 | O686: 15 | P686: 13 | Q686: 103 | S686: VENUE: BRUNSWICK
A687: BRUNSWICK | C687: 2 | D687: 3 | E687: 15 | G687: 7 | H687: 3 | I687: 45 | K687: 10 | L687: 9 | M687: 69 | O687: 13 | P687: 12 | Q687: 90 | S687: GLEESON :PRICE
A688: BEST PLAYERS
A689: SANDRINGHAM | C689: EAVES | F689: RYAN | I689: MANNIX | L689: MERCER | O689: HOWELL | Q689: FITZPATRICK
A690: BRUNSWICK | C690: WEST | F690: GRIFFITHS | I690: CONNELL | L690: POTTER | O690: LEAHY
A691: GOALKICKERS
A692: SANDRINGHAM | C692: GOROZIDIS 3 | F692: BERGMAN 3 | I692: ERWIN 2 | K692: PARK 2 | M692: BONNEY | O692: KRISTENSEN | R692: BENNETT | U692: MANNIX | X692: FITZPATRICK
A693: BRUNSWICK | C693: GRIFFITHS 3 | F693: CALLANDER 2 | I693: BAKER 2 | K693: WEST 2 | M693: LEAHY | O693: POTTER | Q693: McINERNEY | T693: GIBSON
A695: ROUND 16 | D695: 9TH AUGUST | I695: WEATHER | S695: VENUE: BEACH ROAD
D696: 1ST QTR | H696: 2ND QTR | L696: 3RD QTR | P696: FINAL | S696: UMPIRES
A697: SANDRINGHAM | C697: 3 | D697: 7 | E697: 25 | G697: 4 | H697: 12 | I697: 36 | K697: 11 | L697: 18 | M697: 84 | O697: 15 | P697: 24 | Q697: 114 | S697: MARSHALL | X697: LADDER | AB697: ROUND | AD697: 16
A698: GEEL WEST | C698: 4 | D698: 0 | E698: 24 | G698: 8 | H698: 8 | I698: 56 | K698: 12 | L698: 8 | M698: 80 | O698: 14 | P698: 12 | Q698: 96 | S698: BROOKS
A699: BEST PLAYERS | W699: TEAM | X699: W | Y699: L | Z699: D | AA699: FOR | AB699: AGST | AC699: % | AD699: PTS
A700: SANDRINGHAM | C700: GOROZIDIS | F700: FITZPATRICK | I700: KRISTENSEN | L700: ERWIN | O700: EAVES | R700: HOWELL
A701: GEEL WEST | C701: GIBSON | F701: KRANJC | I701: DILLON | L701: DOYLE | O701: FIRMAN | W701: PORT MELBOURNE | X701: 12 | Y701: 4 | Z701: 0 | AA701: 2123 | AB701: 1685 | AC701: =(AA701/AB701)*100 -> 125.99406528189911 | AD701: =(X701*4)+(Z701*2) -> 48
A702: GOALKICKERS | O702: BERGMAN | Q702: DOBSON | W702: WILLIAMSTOWN | X702: 11 | Y702: 5 | Z702: 0 | AA702: 2009 | AB702: 1650 | AC702: =(AA702/AB702)*100 -> 121.75757575757575 | AD702: =(X702*4)+(Z702*2) -> 44
A703: SANDRINGHAM | C703: GOROZIDIS 4 | F703: BENNETT 3 | I703: RIGGS 2 | K703: JOHNSON | M703: KRISTENSEN | P703: MANNIX | R703: FITZPATRICK | W703: FRANKSTON | X703: 10 | Y703: 5 | Z703: 1 | AA703: 1888 | AB703: 1621 | AC703: =(AA703/AB703)*100 -> 116.47131400370141 | AD703: =(X703*4)+(Z703*2) -> 42
A704: GEEL WEST | C704: MORRISSEY 3 | F704: DILLON 2 | H704: HAMILTON 2 | K704: SHEA 2 | M704: BERRY | O704: GIBSON | Q704: BISSETT | S704: FIRMAN | W704: SPRINGVALE | X704: 10 | Y704: 6 | Z704: 0 | AA704: 1827 | AB704: 1377 | AC704: =(AA704/AB704)*100 -> 132.6797385620915 | AD704: =(X704*4)+(Z704*2) -> 40
N705: COOK | S705: VENUE: COBURG
A706: SPRINGVALE | C706: 2 | D706: 3 | E706: 15 | G706: 8 | H706: 5 | I706: 53 | K706: 11 | L706: 7 | M706: 73 | O706: 17 | P706: 12 | Q706: 114 | S706: G CASEY | W706: COBURG | X706: 9 | Y706: 7 | Z706: 0 | AA706: 1908 | AB706: 1624 | AC706: =(AA706/AB706)*100 -> 117.48768472906403 | AD706: =(X706*4)+(Z706*2) -> 36
A707: COBURG | C707: 6 | D707: 5 | E707: 41 | G707: 6 | H707: 9 | I707: 45 | K707: 12 | L707: 13 | M707: 85 | O707: 15 | P707: 17 | Q707: 107 | S707: BRADY | W707: BRUNSWICK | X707: 8 | Y707: 8 | Z707: 0 | AA707: 1695 | AB707: 1778 | AC707: =(AA707/AB707)*100 -> 95.331833520809894 | AD707: =(X707*4)+(Z707*2) -> 32
A708: BEST PLAYERS | W708: SANDRINGHAM | X708: 8 | Y708: 8 | Z708: 0 | AA708: 1704 | AB708: 1865 | AC708: =(AA708/AB708)*100 -> 91.367292225201069 | AD708: =(X708*4)+(Z708*2) -> 32
A709: SPRINGVALE | C709: FOY | F709: MALONI | I709: VERNON | L709: PROSSER | W709: PRESTON | X709: 6 | Y709: 9 | Z709: 1 | AA709: 1552 | AB709: 1904 | AC709: =(AA709/AB709)*100 -> 81.512605042016801 | AD709: =(X709*4)+(Z709*2) -> 26
A710: COBURG | C710: RIENIETS | F710: TARANTO | I710: GUMLEY | L710: DARBY | O710: EADE | W710: BOX HILL | X710: 3 | Y710: 12 | Z710: 1 | AA710: 1476 | AB710: 1744 | AC710: =(AA710/AB710)*100 -> 84.633027522935777 | AD710: =(X710*4)+(Z710*2) -> 14
A711: GOALKICKERS | Q711: NANFRA | W711: GEELONG WEST | X711: 1 | Y711: 14 | Z711: 1 | AA711: 1373 | AB711: 2286 | AC711: =(AA711/AB711)*100 -> 60.061242344706912 | AD711: =(X711*4)+(Z711*2) -> 6
A712: SPRINGVALE | C712: PROSSER 5 | E712: VERNON 2 | G712: WARD 2 | I712: ROBINSON 2 | L712: NICOL 2 | N712: CLARKE | P712: DUDLEY | R712: MALONI
A713: COBURG | C713: DARBY 7 | F713: WEATHERALD 6 | K713: RIENIETS | M713: GUMLEY
A715: WILLIAMSTOWN | C715: 1 | D715: 5 | E715: 11 | G715: 5 | H715: 7 | I715: 37 | K715: 8 | L715: 14 | M715: 62 | O715: 10 | P715: 15 | Q715: 75 | S715: VENUE: WILLIAMSTOWN
A716: FRANKSTON | C716: 4 | D716: 3 | E716: 27 | G716: 5 | H716: 6 | I716: 36 | K716: 6 | L716: 10 | M716: 46 | O716: 9 | P716: 15 | Q716: 69 | S716: MORROW :GLEESON
A717: BEST PLAYERS
A718: WILLIAMSTOWN | C718: McTAGGART | F718: LANE | I718: DELRE | L718: SAIT | O718: RICKMAN | R718: HUGHES
A719: FRANKSTON | C719: BARDOEL | F719: McLEISH | I719: MARTIN | L719: O'BRIEN | O719: BROWN | R719: RAVEN
A720: GOALKICKERS
A721: WILLIAMSTOWN | C721: HUGHES 3 | F721: S KNIGHT 2 | I721: V DIMARTINO 2 | L721: RICKMAN | N721: SAIT | P721: ROUND
A722: FRANKSTON | C722: NIKAKIS 3 | F722: O'BRIEN 3 | I722: HAMILL | K722: MARTIN | M722: PAYNE
A724: BOX HILL | C724: 3 | D724: 4 | E724: 22 | G724: 3 | H724: 5 | I724: 23 | K724: 7 | L724: 7 | M724: 49 | O724: 11 | P724: 10 | Q724: 76 | S724: VENUE: BOX HILL
A725: PRESTON | C725: 3 | D725: 3 | E725: 21 | G725: 8 | H725: 6 | I725: 54 | K725: 10 | L725: 8 | M725: 68 | O725: 11 | P725: 10 | Q725: 76 | S725: HARVEY :PRICE
A726: BEST PLAYERS
A727: BOX HILL | C727: B ROBERTSON | F727: HALBERT | I727: GRAHAM | L727: DWYER | O727: NICHOLSON | R727: CUFFE
A728: PRESTON | C728: DUNBAR | F728: HUNT | I728: MARCON
A729: GOALKICKERS
A730: BOX HILL | C730: HALBERT 3 | F730: P BOURKE 2 | I730: GRAHAM 2 | L730: GARTH | N730: NICHOLSON | Q730: P BOLTON | S730: FULLER
A731: PRESTON | C731: ATKINSON 3 | F731: GALAFARO 2 | I731: PRIDEAUX | K731: WATT | M731: BRINE | O731: FROST | Q731: DUNBAR | S731: NOBLE
A733: PORT MELBOURNE | C733: 6 | D733: 1 | E733: 37 | G733: 10 | H733: 6 | I733: 66 | K733: 14 | L733: 11 | M733: 95 | O733: 18 | P733: 22 | Q733: 130 | S733: AT P,M,
A734: BRUNSWICK | C734: 4 | D734: 3 | E734: 27 | G734: 8 | H734: 6 | I734: 54 | K734: 12 | L734: 11 | M734: 83 | O734: 17 | P734: 13 | Q734: 115 | S734: NOLAN :WALKER
A735: BEST PLAYERS
A736: PORT MELBOURNE | C736: SWAN | F736: JENNINGS | I736: S HARKINS | L736: PIRRIE | O736: WHITZELL
A737: BRUNSWICK | C737: LEAHY | F737: CONNELL | I737: THOROGOOD | L737: G DUGDALE | O737: WRIGHT | R737: WEST
A738: GOALKICKERS
A739: PORT MELBOURNE | C739: PIRRIE 7 | E739: GOSS 2 | G739: S HARKINS 2 | J739: JENNINGS 2 | M739: FOLEY | O739: HETHERTON | R739: McCORMACK | V739: MUTIMER | X739: WHITZELL
A740: BRUNSWICK | C740: SCULLY 4 | F740: CALLANDER 3 | I740: GRIFFITHS 3 | L740: MAVORELIS 3 | O740: GIBSON 2 | Q740: POTTER | S740: WRIGHT
A742: ROUND 17 | D742: 16TH AUGUST | I742: WEATHER | S742: VENUE: PRESTON
D743: 1ST QTR | H743: 2ND QTR | L743: 3RD QTR | P743: FINAL | S743: UMPIRES
A744: PRESTON | C744: 5 | D744: 1 | E744: 31 | G744: 11 | H744: 10 | I744: 76 | K744: 16 | L744: 12 | M744: 108 | O744: 19 | P744: 13 | Q744: 127 | S744: VERGONA | X744: LADDER | AB744: ROUND | AD744: 17
A745: SANDRINGHAM | C745: 2 | D745: 1 | E745: 13 | G745: 4 | H745: 1 | I745: 25 | K745: 8 | L745: 5 | M745: 53 | O745: 14 | P745: 10 | Q745: 94 | S745: BRADY
A746: BEST PLAYERS | W746: TEAM | X746: W | Y746: L | Z746: D | AA746: FOR | AB746: AGST | AC746: % | AD746: PTS
A747: PRESTON | C747: DUNBAR | F747: HUNT | I747: FROST | L747: ANDERSON | O747: BRINE | Q747: GALAFARO
A748: SANDRINGHAM | C748: EAVES | F748: MANNIX | I748: MERCER | L748: WALL | O748: ERWIN | Q748: DOBSON | W748: PORT MELBOURNE | X748: 13 | Y748: 4 | Z748: 0 | AA748: 2296 | AB748: 1786 | AC748: =(AA748/AB748)*100 -> 128.55543113101905 | AD748: =(X748*4)+(Z748*2) -> 52
A749: GOALKICKERS | P749: VALKANIS | W749: SPRINGVALE | X749: 11 | Y749: 6 | Z749: 0 | AA749: 1892 | AB749: 1439 | AC749: =(AA749/AB749)*100 -> 131.48019457956914 | AD749: =(X749*4)+(Z749*2) -> 44
A750: PRESTON | C750: PLOWMAN 4 | F750: WATT 3 | H750: HUNT 2 | J750: BRINE 2 | L750: MURPHY 2 | N750: GALAFARO 2 | Q750: DUNBAR 2 | S750: SMART | W750: WILLIAMSTOWN | X750: 11 | Y750: 6 | Z750: 0 | AA750: 2071 | AB750: 1715 | AC750: =(AA750/AB750)*100 -> 120.75801749271137 | AD750: =(X750*4)+(Z750*2) -> 44
A751: SANDRINGHAM | C751: BERGMAN 5 | F751: BENNETT 3 | I751: ERWIN 3 | K751: GOROZIDIS 2 | N751: HENDERSON | W751: FRANKSTON | X751: 10 | Y751: 6 | Z751: 1 | AA751: 1978 | AB751: 1745 | AC751: =(AA751/AB751)*100 -> 113.35243553008596 | AD751: =(X751*4)+(Z751*2) -> 42
S752: VENUE: FRANKSTON
A753: BOX HILL | C753: 2 | D753: 3 | E753: 15 | G753: 8 | H753: 6 | I753: 54 | K753: 15 | L753: 10 | M753: 100 | O753: 19 | P753: 10 | Q753: 124 | S753: BROOKS | W753: COBURG | X753: 9 | Y753: 8 | Z753: 0 | AA753: 2009 | AB753: 1797 | AC753: =(AA753/AB753)*100 -> 111.79744017807455 | AD753: =(X753*4)+(Z753*2) -> 36
A754: FRANKSTON | C754: 1 | D754: 4 | E754: 10 | G754: 4 | H754: 8 | I754: 32 | K754: 8 | L754: 9 | M754: 57 | O754: 12 | P754: 18 | Q754: 90 | S754: MARSHALL | W754: BRUNSWICK | X754: 9 | Y754: 8 | Z754: 0 | AA754: 1839 | AB754: 1867 | AC754: =(AA754/AB754)*100 -> 98.500267809319766 | AD754: =(X754*4)+(Z754*2) -> 36
A755: BEST PLAYERS | W755: SANDRINGHAM | X755: 8 | Y755: 9 | Z755: 0 | AA755: 1798 | AB755: 1992 | AC755: =(AA755/AB755)*100 -> 90.261044176706832 | AD755: =(X755*4)+(Z755*2) -> 32
A756: BOX HILL | C756: N/A | W756: PRESTON | X756: 7 | Y756: 9 | Z756: 1 | AA756: 1679 | AB756: 1998 | AC756: =(AA756/AB756)*100 -> 84.034034034034036 | AD756: =(X756*4)+(Z756*2) -> 30
A757: FRANKSTON | C757: BROWN | F757: McLEISH | I757: MARTIN | L757: MEEHAN | W757: BOX HILL | X757: 4 | Y757: 12 | Z757: 1 | AA757: 1600 | AB757: 1834 | AC757: =(AA757/AB757)*100 -> 87.241003271537622 | AD757: =(X757*4)+(Z757*2) -> 18
A758: GOALKICKERS | Q758: L BOLTON | W758: GEELONG WEST | X758: 1 | Y758: 15 | Z758: 1 | AA758: 1462 | AB758: 2430 | AC758: =(AA758/AB758)*100 -> 60.164609053497941 | AD758: =(X758*4)+(Z758*2) -> 6
A759: BOX HILL | C759: P BOLTON 6 | F759: NICHOLSON 4 | I759: HALBERT 3 | L759: GARTH 2 | N759: BOURKE | P759: THORNLEY | R759: GLEESON
A760: FRANKSTON | C760: BROWN 3 | F760: MEEHAN 3 | I760: CROSS 2 | K760: MARTIN 2 | M760: BINGLEY | O760: CZARNECKI
A762: SPRINGVALE | C762: 1 | D762: 4 | E762: 10 | G762: 5 | H762: 8 | I762: 38 | K762: 8 | L762: 11 | M762: 59 | O762: 9 | P762: 11 | Q762: 65 | S762: VENUE: SPRINGVALE
A763: WILLIAMSTOWN | C763: 2 | D763: 0 | E763: 12 | G763: 4 | H763: 2 | I763: 26 | K763: 6 | L763: 5 | M763: 41 | O763: 9 | P763: 8 | Q763: 62 | S763: WALKER :NOLAN
A764: BEST PLAYERS
A765: SPRINGVALE | C765: SHANNON | F765: MEADE | I765: MALONI | L765: McCORMACK | O765: CLARKE | Q765: MAYLIN
A766: WILLIAMSTOWN | C766: ROUND | F766: SLEVISON | I766: NILSSEN | L766: R KNIGHT | O766: OWEN | Q766: HUGHES
A767: GOALKICKERS
A768: SPRINGVALE | C768: McCORMACK 3 | F768: K ROBINSON 2 | I768: PROSSER 2 | L768: CLARKE | N768: DUDLEY
A769: WILLIAMSTOWN | C769: HUGHES 3 | F769: V DIMARTINO 2 | J769: KNIGHT | L769: ROUND | N769: RICKMAN | P769: SAIT
A771: PORT MELBOURNE | C771: 9 | D771: 5 | E771: 59 | G771: 20 | H771: 10 | I771: 130 | K771: 24 | L771: 13 | M771: 157 | O771: 26 | P771: 17 | Q771: 173 | S771: VENUE: PORT MELBOURNE
A772: COBURG | C772: 4 | D772: 3 | E772: 27 | G772: 6 | H772: 7 | I772: 43 | K772: 10 | L772: 11 | M772: 71 | O772: 14 | P772: 17 | Q772: 101 | S772: PRICE :MORROW
A773: BEST PLAYERS
A774: PORT MELBOURNE | C774: COOTTEE | F774: SWAN | I774: DERMOTT | L774: GOSS | O774: S HARKINS | R774: CHADBAND
A775: COBURG | C775: TARANTO | F775: NIMMO | I775: EADE | L775: GUMLEY | O775: SHELDON
A776: GOALKICKERS | AA776: SHOLL
A777: PORT MELBOURNE | C777: GOSS 6 | E777: FOLEY 4 | G777: SNEDDON 3 | I777: HETHERTON 2 | L777: WHITZELL 2 | N777: MUTIMER 2 | Q777: McCORMACK | T777: S HARKINS | W777: JENNINGS | X777: RODDA | Z777: PIRRIE | AB777: SWAN
A778: COBURG | C778: WEATHERALD 4 | F778: LAIDLER 2 | I778: DARBY 2 | K778: SHELDON 2 | M778: EADE | O778: GUMLEY | Q778: TARANTO | T778: LAKEY
A780: BRUNSWICK | C780: 7 | D780: 7 | E780: 49 | G780: 9 | H780: 9 | I780: 63 | K780: 14 | L780: 12 | M780: 96 | O780: 21 | P780: 18 | Q780: 144 | S780: VENUE: BRUNSWICK
A781: GEELONG WEST | C781: 2 | D781: 6 | E781: 18 | G781: 4 | H781: 11 | I781: 35 | K781: 7 | L781: 15 | M781: 57 | O781: 12 | P781: 17 | Q781: 89 | S781: CASEY ;MITCHELL
A782: BEST PLAYERS
A783: BRUNSWICK | C783: CONNELL | F783: WRIGHT | I783: D DUGDALE | L783: EDWARDS | O783: WEST | Q783: G DUGDALE
A784: GEELONG WEST | C784: DILLON | F784: NORTH | I784: YATES | L784: McFADDEN | O784: KRANJC
A785: GOALKICKERS
A786: BRUNSWICK | C786: WRIGHT 6 | F786: GRIFFITHS 5 | I786: SCULLY 4 | K786: MADROVELIS 3 | N786: BEALE | P786: CALLANDER | S786: LOVETT
A787: GEELONG WEST | C787: RICHARDSON 4 | F787: DILLON 2 | I787: GIBSON 2 | K787: COOK | M787: MORRISSEY | P787: REDHEAD | R787: SHEA
A789: ROUND 18 | D789: 23RD AUGUST | I789: WEATHER | S789: VENUE: GEELONG WEST
D790: 1ST QTR | H790: 2ND QTR | L790: 3RD QTR | P790: FINAL | S790: UMPIRES
A791: PRESTON | C791: 4 | D791: 6 | E791: 30 | G791: 10 | H791: 7 | I791: 67 | K791: 14 | L791: 14 | M791: 98 | O791: 14 | P791: 15 | Q791: 99 | S791: WALKER | X791: LADDER | AB791: ROUND | AD791: 18
A792: GEELONG WEST | C792: 1 | D792: 3 | E792: 9 | G792: 4 | H792: 6 | I792: 30 | K792: 5 | L792: 11 | M792: 41 | O792: 8 | P792: 17 | Q792: 65 | S792: NOLAN
A793: BEST PLAYERS | W793: TEAM | X793: W | Y793: L | Z793: D | AA793: FOR | AB793: AGST | AC793: % | AD793: PTS
A794: PRESTON | C794: PRIDEAUX | F794: BRUIHER | I794: HUNT | L794: MARCON | O794: WATT | Q794: BRINE
A795: GEELONG WEST | C795: DILLON | F795: HAMILTON | I795: REDHEAD | L795: WALPOLE | O795: GIBSON | W795: PORT MELBOURNE | X795: 14 | Y795: 4 | Z795: 0 | AA795: 2414 | AB795: 1854 | AC795: =(AA795/AB795)*100 -> 130.20496224379718 | AD795: =(X795*4)+(Z795*2) -> 56
A796: GOALKICKERS | W796: SPRINGVALE | X796: 12 | Y796: 6 | Z796: 0 | AA796: 2026 | AB796: 1511 | AC796: =(AA796/AB796)*100 -> 134.0833884844474 | AD796: =(X796*4)+(Z796*2) -> 48
A797: PRESTON | C797: MURPHY 6 | F797: PLOWMAN 3 | I797: WATT 2 | K797: FROST 2 | M797: SMART | W797: WILLIAMSTOWN | X797: 11 | Y797: 7 | Z797: 0 | AA797: 2139 | AB797: 1833 | AC797: =(AA797/AB797)*100 -> 116.69394435351883 | AD797: =(X797*4)+(Z797*2) -> 44
A798: GEELONG WEST | C798: HAMILTON 3 | F798: MORRISSEY 3 | I798: SHEA 2 | W798: FRANKSTON | X798: 10 | Y798: 7 | Z798: 1 | AA798: 2033 | AB798: 1820 | AC798: =(AA798/AB798)*100 -> 111.7032967032967 | AD798: =(X798*4)+(Z798*2) -> 42
S799: VENUE: WILLIAMSTOWN
A800: PORT MELBOURNE | C800: 3 | D800: 3 | E800: 21 | G800: 6 | H800: 3 | I800: 39 | K800: 14 | L800: 12 | M800: 96 | O800: 17 | P800: 16 | Q800: 118 | S800: VERGONA | W800: COBURG | X800: 10 | Y800: 8 | Z800: 0 | AA800: 2183 | AB800: 1852 | AC800: =(AA800/AB800)*100 -> 117.87257019438444 | AD800: =(X800*4)+(Z800*2) -> 40
A801: WILLIAMSTOWN | C801: 2 | D801: 2 | E801: 14 | G801: 3 | H801: 3 | I801: 21 | K801: 4 | L801: 5 | M801: 29 | O801: 10 | P801: 8 | Q801: 68 | S801: P MARSHALL | W801: BRUNSWICK | X801: 9 | Y801: 9 | Z801: 0 | AA801: 1894 | AB801: 2041 | AC801: =(AA801/AB801)*100 -> 92.797648211660956 | AD801: =(X801*4)+(Z801*2) -> 36
A802: BEST PLAYERS | W802: SANDRINGHAM | X802: 9 | Y802: 9 | Z802: 0 | AA802: 1873 | AB802: 2047 | AC802: =(AA802/AB802)*100 -> 91.499755740107474 | AD802: =(X802*4)+(Z802*2) -> 36
A803: PORT MELBOURNE | C803: WHITZELL | F803: SWAN | I803: HETHERTON | L803: WALL | N803: CHADBAND | Q803: JENNINGS | W803: PRESTON | X803: 8 | Y803: 9 | Z803: 1 | AA803: 1778 | AB803: 2063 | AC803: =(AA803/AB803)*100 -> 86.185167232186132 | AD803: =(X803*4)+(Z803*2) -> 34
A804: WILLIAMSTOWN | C804: ROUND | F804: NILSSEN | I804: BRIERTY | L804: LANE | N804: WHEELER | W804: BOX HILL | X804: 4 | Y804: 13 | Z804: 1 | AA804: 1672 | AB804: 1968 | AC804: =(AA804/AB804)*100 -> 84.959349593495944 | AD804: =(X804*4)+(Z804*2) -> 18
A805: GOALKICKERS | P805: SWAN | W805: GEELONG WEST | X805: 1 | Y805: 16 | Z805: 1 | AA805: 1525 | AB805: 2529 | AC805: =(AA805/AB805)*100 -> 60.300514037168838 | AD805: =(X805*4)+(Z805*2) -> 6
A806: PORT MELBOURNE | C806: SNEDDON 5 | F806: McCORMACK 3 | I806: WHITZELL 3 | L806: GOSS 2 | N806: HARKINS | P806: RAINSFORD | R806: RODDA
A807: WILLIAMSTOWN | C807: S KNIGHT 3 | F807: SAIT 2 | H807: SIMMONS 2 | K807: ROUND 2 | M807: SEMMONS
A809: SPRINGVALE | C809: 5 | D809: 6 | E809: 36 | G809: 7 | H809: 11 | I809: 53 | K809: 13 | L809: 18 | M809: 96 | O809: 18 | P809: 26 | Q809: 134 | S809: VENUE: BOX HILL
A810: BOX HILL | C810: 1 | D810: 3 | E810: 9 | G810: 4 | H810: 9 | I810: 33 | K810: 5 | L810: 10 | M810: 40 | O810: 10 | P810: 12 | Q810: 72 | S810: MITCHELL :MORROW
A811: BEST PLAYERS
A812: SPRINGVALE | C812: PROSSER | F812: ROBINSON | I812: DUNNE | L812: CLARKE | O812: MALONI | R812: DUDLEY
A813: BOX HILL | C813: O'SHEA | F813: COOPER | I813: BROWN | L813: P BOLTON | O813: O'BRIEN | R813: TURNER
A814: GOALKICKERS
A815: SPRINGVALE | C815: DUNNE 8 | F815: DUDLEY 4 | I815: CLARKE 2 | K815: ROBINSON 2 | N815: MENDE | P815: WARNER
A816: BOX HILL | C816: P BOLTON 5 | F816: GARTH | H816: GLEESON | J816: HALBERT | L816: P BOURKE | N816: COOPER
A818: SANDRINGHAM | C818: 4 | D818: 4 | E818: 28 | G818: 5 | H818: 4 | I818: 34 | K818: 10 | L818: 9 | M818: 69 | O818: 11 | P818: 9 | Q818: 75 | S818: VENUE: BEACH ROAD
A819: FRANKSTON | C819: 0 | D819: 2 | E819: 2 | G819: 4 | H819: 7 | I819: 31 | K819: 5 | L819: 10 | M819: 40 | O819: 7 | P819: 13 | Q819: 55 | S819: HARVEY :CASEY
A820: BEST PLAYERS
A821: SANDRINGHAM | C821: WALL | F821: HOWELL | I821: DOBSON | L821: EAVES | O821: RYAN | R821: GOROZIDIS
A822: FRANKSTON | C822: MARTIN | F822: SARAU | I822: KENTER | L822: RAVEN | O822: CZARNECKI
A823: GOALKICKERS
A824: SANDRINGHAM | C824: GOROZIDIS 2 | F824: BENNETT 2 | I824: KRISTENSEN 2 | L824: ERWIN 2 | N824: BERGMAN 2 | Q824: PRATT
A825: FRANKSTON | C825: BROWN 2 | F825: BINGLEY | H825: CZARNECKI | K825: MEEHAN | M825: O'BRIEN | O825: PAYNE
A827: COBURG | C827: 2 | D827: 3 | E827: 15 | G827: 10 | H827: 14 | I827: 74 | K827: 17 | L827: 14 | M827: 116 | O827: 26 | P827: 18 | Q827: 174 | S827: VENUE: COBURG
A828: BRUNSWICK | C828: 1 | D828: 6 | E828: 12 | G828: 1 | H828: 7 | I828: 13 | K828: 5 | L828: 12 | M828: 42 | O828: 7 | P828: 13 | Q828: 55 | S828: BROOKS :GLEESON
A829: BEST PLAYERS
A830: COBURG | C830: EADE | F830: RIENIETS | I830: WEIDEMAN | L830: TARANTO | O830: SHELDON | Q830: INGRAM
A831: BRUNSWICK | C831: CONNELL | F831: LEAHY | I831: GIBSON
A832: GOALKICKERS
A833: COBURG | C833: WEATHERALD 6 | F833: EADE 4 | H833: FREEMAN 3 | K833: KAAKOUR 3 | N833: LAIDLER 2 | Q833: MONACO 2 | T833: RIENIETS 2 | W833: DARBY | X833: EVANS | AA833: GUMLEY | AC833: INGRAM
A834: BRUNSWICK | C834: GIBSON 2 | F834: CONNELL | H834: GRIFFITHS | K834: POTTER | M834: THOROGOOD | P834: WRIGHT
A836: FINALS
A837: 1ST SEMI | D837: 3OTH AUGUST | I837: WEATHER
D838: 1ST QTR | H838: 2ND QTR | L838: 3RD QTR | P838: FINAL | S838: VENUE: JUNCTION OVAL
A839: WILLIAMSTOWN | C839: 0 | D839: 2 | E839: 2 | G839: 4 | H839: 7 | I839: 31 | K839: 9 | L839: 11 | M839: 65 | O839: 19 | P839: 15 | Q839: 129 | S839: UMPIRES
A840: FRANKSTON | C840: 6 | D840: 9 | E840: 45 | G840: 9 | H840: 10 | I840: 64 | K840: 13 | L840: 13 | M840: 91 | O840: 14 | P840: 14 | Q840: 98 | S840: MORROW :VERGONA
A841: BEST PLAYERS
A842: WILLIAMSTOWN | C842: MUSCHIALLI | F842: RICKMAN | I842: SIMMONS | L842: WHILLAS | O842: S KNIGHT | R842: BRIERTY
A843: FRANKSTON | C843: YOUNG | F843: SARAU | I843: C O'BRIEN | L843: MEEHAN | O843: FAVIER
A844: GOALKICKERS
A845: WILLIAMSTOWN | C845: RICKMAN 6 | F845: S KNIGHT 5 | I845: ROUND 3 | K845: SIMMONS 2 | N845: SAIT | P845: CAHILL | R845: SMITH
A846: FRANKSTON | C846: O'RILEY 3 | E846: WHITFORD 2 | H846: O'BRIEN 2 | J846: BINGLEY | L846: CROSS | N846: McLEISH | P846: SARAU | R846: ECKLUND | U846: FAVIER | W846: MEEHAN
A848: 2ND SEMI | D848: 6TH SEPTEMBER | I848: WEATHER
A849: SPRINGVALE | C849: 3 | D849: 0 | E849: 18 | G849: 4 | H849: 4 | I849: 28 | K849: 8 | L849: 6 | M849: 54 | O849: 15 | P849: 12 | Q849: 102 | S849: VENUE: JUNCTION OVAL
A850: PORT MELBOURNE | C850: 2 | D850: 4 | E850: 16 | G850: 6 | H850: 7 | I850: 43 | K850: 9 | L850: 8 | M850: 62 | O850: 12 | P850: 9 | Q850: 81 | S850: CASEY ;MARSHALL
A851: BEST PLAYERS
A852: SPRINGVALE | C852: MALONI | F852: MAYLIN | I852: McCORMACK | L852: DUDLEY | N852: STEWART | Q852: FOY
A853: PORT MELBOURNE | C853: JENNINGS | F853: ALLENDER | I853: HETHERTON | L853: RODDA
A854: GOALKICKERS
A855: SPRINGVALE | C855: ANDERSON 3 | F855: MAYLIN 2 | I855: ROBINSON 2 | L855: NICOL 2 | N855: VERNON | P855: MENDE | R855: PROSSER | U855: STEWART | X855: FOY
A856: PORT MELBOURNE | C856: HICKS 2 | E856: McCORMACK 2 | H856: MUTIMER 2 | J856: FOLEY | L856: JENNINGS | N856: RODDA | P856: SHOLL | R856: SNEDDON | U856: SWAN | W856: KING
A858: PRELIMINARY FINAL | E858: 13TH SEPTEMBER
A859: PORT MELBOURNE | C859: 5 | D859: 5 | E859: 35 | G859: 7 | H859: 9 | I859: 51 | K859: 12 | L859: 17 | M859: 89 | O859: 16 | P859: 20 | Q859: 116 | S859: VENUE: JUNCTION OVAL
A860: WILLIAMSTOWN | C860: 2 | D860: 4 | E860: 16 | G860: 6 | H860: 8 | I860: 44 | K860: 8 | L860: 9 | M860: 57 | O860: 14 | P860: 12 | Q860: 96 | S860: HARVEY :WALKER
A861: BEST PLAYERS
A862: PORT MELBOURNE | C862: HARKINS | F862: SWAN | I862: RODDA | L862: MUTIMER | O862: HICKS | Q862: HETHERTON
A863: WILLIAMSTOWN | C863: HUGHES | F863: RICKMAN | I863: WHEELER | L863: CAHILL | O863: NILSSEN | Q863: SLEVISON
A864: GOALKICKERS
A865: PORT MELBOURNE | C865: MUTIMER 5 | F865: HICKS 5 | H865: WHITZELL 2 | K865: HARKINS | M865: SWAN | O865: FITZPATRICK | R865: HETHERTON
A866: WILLIAMSTOWN | C866: SLEVISON 3 | F866: WHILLAS 2 | I866: HUGHES 2 | K866: KNIGHT | M866: RICKMAN | O866: SAIT | P866: KERSHAW | R866: SIMMONS | U866: ROUND | W866: MUSCHIALLI
A868: GRAND FINAL | D868: 20TH SEPTEMBER
A869: SPRINGVALE | C869: 3 | D869: 3 | E869: 21 | G869: 9 | H869: 8 | I869: 62 | K869: 10 | L869: 10 | M869: 70 | O869: 14 | P869: 16 | Q869: 100 | S869: VENUE: JUNCTION OVAL
A870: PORT MELBOURNE | C870: 2 | D870: 5 | E870: 17 | G870: 4 | H870: 8 | I870: 32 | K870: 7 | L870: 15 | M870: 57 | O870: 7 | P870: 20 | Q870: 62 | S870: CASEY ;MORROW
A871: BEST PLAYERS
A872: SPRINGVALE | C872: VERNON | F872: DUNNE | I872: MAYLIN | L872: MALONI | O872: MENDE | R872: NICOL
A873: PORT MELBOURNE | C873: WHITZELL | F873: ALLENDER | I873: RAINSFORD | L873: FOLEY | O873: HETHERTON | R873: FITZPATRICK
A874: GOALKICKERS
A875: SPRINGVALE | C875: VERNON 3 | F875: DUDLEY 3 | I875: MENDE 2 | K875: PROSSER 2 | M875: NICOL 2 | O875: ANDERSON | Q875: DUNNE
A876: PORT MELBOURNE | C876: HICKS 2 | F876: SNEDDON 2 | I876: COOPER | K876: HARKINS | M876: MUTIMER