A1: Victorian Football Association
A2: Season 1987 - Division Two
A3: © Copyright Wal Williams | F3: First created: 28 March 2016
A4: Contact: joywalwi at gmail dot com | F4: Last updated: 28 March 2016 | W4: VFA Results and tables - Link to the main index page
A5: You are free to copy this document in whole or part provided that proper acknowledgement is given to the author. All rights reserved.
A7: 1987 | C7: V.F.A. SEASON 2ND DIVISION
A8: ROUND 1 | E8: 12TH APRIL | J8: WEATHER | S8: PLAYED AT
D9: 1ST QTR | H9: 2ND QTR | L9: 3RD QTR | P9: FINAL | S9: CAMBERWELL
A10: WERRIBEE | C10: 7 | D10: 6 | E10: =C10*6+D10 -> 48 | G10: 9 | H10: 10 | I10: =G10*6+H10 -> 64 | K10: 15 | L10: 16 | M10: =K10*6+L10 -> 106 | O10: 19 | P10: 18 | Q10: =O10*6+P10 -> 132 | S10: UMPIRE | X10: LADDER | AB10: ROUND | AD10: 1
A11: CAMBERWELL | C11: 1 | D11: 5 | E11: =C11*6+D11 -> 11 | G11: 5 | H11: 6 | I11: =G11*6+H11 -> 36 | K11: 10 | L11: 7 | M11: =K11*6+L11 -> 67 | O11: 16 | P11: 11 | Q11: =O11*6+P11 -> 107 | S11: WILLIAMS/HULM
A12: BEST PLAYERS | W12: TEAM | X12: W | Y12: L | Z12: D | AA12: FOR | AB12: AGST | AC12: % | AD12: PTS
A13: WERRIBEE | C13: MONTGOMERY | G13: CUNNINGHAM | J13: TAYLOR | M13: LESIPUTY | O13: HOPKINS | R13: KIRKHAM
A14: CAMBERWELL | C14: GIBBS | G14: FRASER | J14: WHALEN | M14: GRAY | O14: WILDE | R14: CONSTANTINOU | W14: WAVERLEY | X14: 1 | Y14: 0 | Z14: 0 | AA14: 194 | AB14: 67 | AC14: =(AA14*100)/AB14 -> 289.55223880597015 | AD14: =(X14*4)+(Z14*2) -> 4
A15: GOALKICKERS | W15: SUNSHINE | X15: 1 | Y15: 0 | Z15: 0 | AA15: 143 | AB15: 104 | AC15: =(AA15*100)/AB15 -> 137.5 | AD15: =(X15*4)+(Z15*2) -> 4
A16: WERRIBEE | C16: DUNSTAN 5 | F16: BONAT 4 | H16: LESIPUTY 2 | K16: FREEMAN 2 | N16: BROWN 2 | P16: KIRKHAM 2 | S16: MONTGOMERY 2 | W16: OAKLEIGH | X16: 1 | Y16: 0 | Z16: 0 | AA16: 110 | AB16: 85 | AC16: =(AA16*100)/AB16 -> 129.41176470588235 | AD16: =(X16*4)+(Z16*2) -> 4
A17: CAMBERWELL | C17: FRASER 7 | F17: WHALEN 2 | I17: JAKOBI 2 | K17: BAIN | M17: CONSTANTINOU | P17: MAILING | R17: WILDE | T17: GIBBS | W17: WERRIBEE | X17: 1 | Y17: 0 | Z17: 0 | AA17: 132 | AB17: 107 | AC17: =(AA17*100)/AB17 -> 123.36448598130841 | AD17: =(X17*4)+(Z17*2) -> 4
A19: WAVERLEY | C19: 5 | D19: 3 | E19: =C19*6+D19 -> 33 | G19: 14 | H19: 7 | I19: =G19*6+H19 -> 91 | K19: 20 | L19: 11 | M19: =K19*6+L19 -> 131 | O19: 29 | P19: 20 | Q19: =O19*6+P19 -> 194 | S19: WAVERLEY | W19: MORDIALLOC | X19: 1 | Y19: 0 | Z19: 0 | AA19: 146 | AB19: 145 | AC19: =(AA19*100)/AB19 -> 100.68965517241379 | AD19: =(X19*4)+(Z19*2) -> 4
A20: BERWICK | C20: 3 | D20: 5 | E20: =C20*6+D20 -> 23 | G20: 5 | H20: 6 | I20: =G20*6+H20 -> 36 | K20: 6 | L20: 10 | M20: =K20*6+L20 -> 46 | O20: 9 | P20: 13 | Q20: =O20*6+P20 -> 67 | S20: KENNEDY | W20: DANDENONG | X20: 1 | Y20: 0 | Z20: 0 | AA20: 0 | AB20: 0 | AD20: =(X20*4)+(Z20*2) -> 4
A21: BEST PLAYERS | S21: BRADSHAW | W21: CAULFIELD | X21: 0 | Y21: 1 | Z21: 0 | AA21: 145 | AB21: 146 | AC21: =(AA21*100)/AB21 -> 99.31506849315069 | AD21: =(X21*4)+(Z21*2) -> 0
A22: WAVERLEY | C22: EVANS | F22: MARSHALL | I22: DE WIT | L22: BURNS | O22: CSOTI | Q22: HUNT | W22: CAMBERWELL | X22: 0 | Y22: 1 | Z22: 0 | AA22: 107 | AB22: 132 | AC22: =(AA22*100)/AB22 -> 81.060606060606062 | AD22: =(X22*4)+(Z22*2) -> 0
A23: BERWICK | C23: ORSBORNE | F23: JOHNSON | I23: VERSHUUR | L23: G GAMBETTA | O23: RYAN | Q23: SCOTT | W23: PRAHRAN | X23: 0 | Y23: 1 | Z23: 0 | AA23: 85 | AB23: 110 | AC23: =(AA23*100)/AB23 -> 77.272727272727266 | AD23: =(X23*4)+(Z23*2) -> 0
A24: GOALKICKERS | R24: ANDERSON | W24: NORTHCOTE | X24: 0 | Y24: 1 | Z24: 0 | AA24: 104 | AB24: 143 | AC24: =(AA24*100)/AB24 -> 72.727272727272734 | AD24: =(X24*4)+(Z24*2) -> 0
A25: WAVERLEY | C25: EVANS 10 | F25: BREWER 5 | H25: COLE 4 | J25: CSOTI 2 | L25: VEAR 2 | N25: STUART 2 | P25: PEARSON | R25: SHAW | S25: KINNABURGH | W25: BERWICK | X25: 0 | Y25: 1 | Z25: 0 | AA25: 67 | AB25: 194 | AC25: =(AA25*100)/AB25 -> 34.536082474226802 | AD25: =(X25*4)+(Z25*2) -> 0
A26: BERWICK | C26: RYAN 2 | E26: McGILL 2 | G26: McKENNA | J26: G GAMBETTA | M26: ORSBORNE | O26: GREEN | Q26: D GAMBETTA
A28: MORDIALLOC | C28: 7 | D28: 4 | E28: =C28*6+D28 -> 46 | G28: 10 | H28: 6 | I28: =G28*6+H28 -> 66 | K28: 19 | L28: 12 | M28: =K28*6+L28 -> 126 | O28: 22 | P28: 14 | Q28: =O28*6+P28 -> 146 | S28: PRINCES PARK, CAULFIELD
A29: CAULFIELD | C29: 5 | D29: 7 | E29: =C29*6+D29 -> 37 | G29: 11 | H29: 15 | I29: =G29*6+H29 -> 81 | K29: 16 | L29: 17 | M29: =K29*6+L29 -> 113 | O29: 20 | P29: 25 | Q29: =O29*6+P29 -> 145 | S29: BRADY/CURRAN
A30: BEST PLAYERS
A31: MORDIALLOC | C31: BROOKING | F31: COFFEY | I31: DIXON | L31: JONES | N31: NICHOLAIDES | Q31: POLA
A32: CAULFIELD | C32: D'ANGELO | F32: HAIDAMOUS | I32: T VITACCA | L32: R VITACCA | O32: O'KEEFE
A33: GOALKICKERS
A34: MORDIALLOC | C34: COFFEY 9 | F34: NICHOLAIDES 5 | I34: POLA 5 | K34: ROSS | M34: BURLEY | O34: WATSON
A35: CAULFIELD | C35: CIRO 5 | E35: FIELD 4 | G35: HAIDAMOUS 4 | J35: GODAU 2 | L35: T VITACCA 2 | O35: LARKIN | Q35: LO'PO | S35: D'ANGELO
A37: SUNSHINE | C37: 4 | D37: 2 | E37: =C37*6+D37 -> 26 | G37: 9 | H37: 5 | I37: =G37*6+H37 -> 59 | K37: 16 | L37: 8 | M37: =K37*6+L37 -> 104 | O37: 22 | P37: 11 | Q37: =O37*6+P37 -> 143 | S37: SUNSHINE
A38: NORTHCOTE | C38: 5 | D38: 3 | E38: =C38*6+D38 -> 33 | G38: 5 | H38: 5 | I38: =G38*6+H38 -> 35 | K38: 9 | L38: 5 | M38: =K38*6+L38 -> 59 | O38: 16 | P38: 8 | Q38: =O38*6+P38 -> 104 | S38: PRICE/MORGAN
A39: BEST PLAYERS
A40: SUNSHINE | C40: CLEGG | F40: CUTAJAR | I40: MOSS | L40: McQUALTER | O40: TAYLOR | R40: CADDAYE
A41: NORTHCOTE | C41: EWING | F41: MINNETT | I41: FAURE | L41: MITCHELL | O41: VENABLES | R41: ZAPPONE
A42: GOALKICKERS
A43: SUNSHINE | C43: CADDAYE 8 | F43: SHEPPERBOTTOM 5 | J43: COOKE 3 | L43: CUTAJAR 2 | O43: ROBINSON 2 | R43: BROWN | T43: SCANLON
A44: NORTHCOTE | C44: ARMSTRONG 4 | F44: SMITH 3 | H44: PANJANI 2 | K44: REARDON 2 | N44: TURNER | P44: COURTS | R44: MINNETT | T44: MITCHELL | W44: D'ARTI
A46: OAKLEIGH | C46: 4 | D46: 4 | E46: =C46*6+D46 -> 28 | G46: 7 | H46: 8 | I46: =G46*6+H46 -> 50 | K46: 11 | L46: 12 | M46: =K46*6+L46 -> 78 | O46: 16 | P46: 14 | Q46: =O46*6+P46 -> 110 | S46: OAKLEIGH
A47: PRAHRAN | C47: 0 | D47: 5 | E47: =C47*6+D47 -> 5 | G47: 3 | H47: 9 | I47: =G47*6+H47 -> 27 | K47: 7 | L47: 14 | M47: =K47*6+L47 -> 56 | O47: 11 | P47: 19 | Q47: =O47*6+P47 -> 85 | S47: BLACK/BULLOCK
A48: BEST PLAYERS
A49: OAKLEIGH | C49: SIMPSON | F49: BATTERSBY | I49: ATHERTON | L49: PRETTO | O49: C ROURKE | R49: HUMPHREYS
A50: PRAHRAN | C50: TAPPING | F50: DURNAN | I50: SOULOS | L50: MAZUREK | O50: GILES | R50: ELLETT
A51: GOALKICKERS
A52: OAKLEIGH | C52: PRETTO 6 | F52: RYAN 3 | H52: ROACH 2 | J52: SIMPSON 2 | M52: WALL | O52: HOWE | Q52: BATTERSBY
A53: PRAHRAN | C53: COOK 2 | E53: GILES 2 | G53: WALDER 2 | J53: BINGHAM | L53: DURNAN | N53: TAPPING | P53: TAYLOR | R53: ROHDE
A55: BYE | C55: DANDENONG
A57: DANDENONG | C57: 7 | D57: 0 | E57: =C57*6+D57 -> 42 | G57: 9 | H57: 5 | I57: =G57*6+H57 -> 59 | K57: 16 | L57: 11 | M57: =K57*6+L57 -> 107 | O57: 25 | P57: 22 | Q57: =O57*6+P57 -> 172 | S57: BENTLEIGH
A58: MOORABBIN | C58: 5 | D58: 1 | E58: =C58*6+D58 -> 31 | G58: 9 | H58: 4 | I58: =G58*6+H58 -> 58 | K58: 13 | L58: 6 | M58: =K58*6+L58 -> 84 | O58: 17 | P58: 6 | Q58: =O58*6+P58 -> 108 | S58: BROOKES/MITCHELL
A59: BEST PLAYERS
A60: DANDENONG | C60: METE | F60: D'ARCY | H60: APPLETON | K60: LINDSAY | N60: MILLANE | Q60: FORSYTHE
A61: MOORABBIN | C61: CRAWFORD | F61: BEATTIE | H61: STEWART | K61: HILLIARD | N61: PHILLIPS | Q61: CLIFFORD
A62: GOALKICKERS
A63: DANDENONG | C63: WRIGHT 4 | F63: LACKO 4 | H63: PALLANT 4 | K63: BROWN 4 | M63: MILLANE 3 | O63: TUFO 2 | Q63: MILLIGAN | S63: METE | U63: BRUNNEN | W63: FORSYTHE
A64: MOORABBIN | C64: FALCONER 5 | F64: CRAWFORD 4 | I64: CLIFFORD 2 | K64: PHILLIPS 2 | N64: STEWART | P64: ZAPPA | R64: POLLOCK | T64: STREKER
A66: ROUND 2 | E66: 19TH APRIL | J66: WEATHER | S66: PLAYED AT
D67: 1ST QTR | H67: 2ND QTR | L67: 3RD QTR | P67: FINAL | S67: DANDENONG
A68: DANDENONG | C68: 4 | D68: 1 | E68: =C68*6+D68 -> 25 | G68: 7 | H68: 5 | I68: =G68*6+H68 -> 47 | K68: 13 | L68: 8 | M68: =K68*6+L68 -> 86 | O68: 17 | P68: 9 | Q68: =O68*6+P68 -> 111 | S68: UMPIRE | X68: LADDER | AB68: ROUND | AD68: 2
A69: OAKLEIGH | C69: 3 | D69: 3 | E69: =C69*6+D69 -> 21 | G69: 4 | H69: 6 | I69: =G69*6+H69 -> 30 | K69: 5 | L69: 7 | M69: =K69*6+L69 -> 37 | O69: 9 | P69: 13 | Q69: =O69*6+P69 -> 67 | S69: KENNEDY/PRICE
A70: BEST PLAYERS | W70: TEAM | X70: W | Y70: L | Z70: D | AA70: FOR | AB70: AGST | AC70: % | AD70: PTS
A71: DANDENONG | C71: LINDSAY | F71: KNIGHT | I71: D'ARCY | L71: HAMILTON | O71: TUFO | R71: PALLANT
A72: OAKLEIGH | C72: WALSH | F72: JOHNSON | I72: ATHERTON | L72: ROACH | O72: S ROURKE | R72: SCOTT | W72: WAVERLEY | X72: 2 | Y72: 0 | Z72: 0 | AA72: 317 | AB72: 105 | AC72: =(AA72*100)/AB72 -> 301.90476190476193 | AD72: =(X72*4)+(Z72*2) -> 8
A73: GOALKICKERS | W73: DANDENONG | X73: 2 | Y73: 0 | Z73: 0 | AA73: 111 | AB73: 67 | AC73: =(AA73*100)/AB73 -> 165.67164179104478 | AD73: =(X73*4)+(Z73*2) -> 8
A74: DANDENONG | C74: WRIGHT 4 | F74: FORSYTHE | H74: PALLANT | J74: TUFO | K74: BASTINAC | N74: BRUNNEN | P74: D'ARCY | R74: LACKO | T74: 6 SHORT | W74: SUNSHINE | X74: 2 | Y74: 0 | Z74: 0 | AA74: 233 | AB74: 160 | AC74: =(AA74*100)/AB74 -> 145.625 | AD74: =(X74*4)+(Z74*2) -> 8
A75: OAKLEIGH | C75: PRETTO 5 | F75: ROACH 2 | I75: CARAFA | K75: SCOTT | W75: WERRIBEE | X75: 2 | Y75: 0 | Z75: 0 | AA75: 132 | AB75: 107 | AC75: =(AA75*100)/AB75 -> 123.36448598130841 | AD75: =(X75*4)+(Z75*2) -> 8
A77: SUNSHINE | C77: 7 | D77: 4 | E77: =C77*6+D77 -> 46 | G77: 11 | H77: 7 | I77: =G77*6+H77 -> 73 | K77: 12 | L77: 9 | M77: =K77*6+L77 -> 81 | O77: 13 | P77: 12 | Q77: =O77*6+P77 -> 90 | S77: TOORAK PARK | W77: NORTHCOTE | X77: 1 | Y77: 1 | Z77: 0 | AA77: 200 | AB77: 183 | AC77: =(AA77*100)/AB77 -> 109.2896174863388 | AD77: =(X77*4)+(Z77*2) -> 4
A78: PRAHRAN | C78: 2 | D78: 3 | E78: =C78*6+D78 -> 15 | G78: 6 | H78: 6 | I78: =G78*6+H78 -> 42 | K78: 6 | L78: 11 | M78: =K78*6+L78 -> 47 | O78: 7 | P78: 14 | Q78: =O78*6+P78 -> 56 | S78: BRADY | W78: CAMBERWELL | X78: 1 | Y78: 1 | Z78: 0 | AA78: 250 | AB78: 241 | AC78: =(AA78*100)/AB78 -> 103.7344398340249 | AD78: =(X78*4)+(Z78*2) -> 4
A79: BEST PLAYERS | S79: CURRAN | W79: OAKLEIGH | X79: 1 | Y79: 1 | Z79: 0 | AA79: 177 | AB79: 196 | AC79: =(AA79*100)/AB79 -> 90.306122448979593 | AD79: =(X79*4)+(Z79*2) -> 4
A80: SUNSHINE | C80: MOSS | F80: MITROVSKI | I80: CUTAJAR | L80: SCHICCITANO | O80: BROWN | R80: TAYLOR | W80: MORDIALLOC | X80: 1 | Y80: 1 | Z80: 0 | AA80: 184 | AB80: 268 | AC80: =(AA80*100)/AB80 -> 68.656716417910445 | AD80: =(X80*4)+(Z80*2) -> 4
A81: PRAHRAN | C81: ELLETT | F81: McNAMARA | I81: MAJUREK | L81: HUTCHISON | O81: P GILES | W81: CAULFIELD | X81: 0 | Y81: 2 | Z81: 0 | AA81: 185 | AB81: 242 | AC81: =(AA81*100)/AB81 -> 76.446280991735534 | AD81: =(X81*4)+(Z81*2) -> 0
A82: GOALKICKERS | P82: BROWN | W82: PRAHRAN | X82: 0 | Y82: 2 | Z82: 0 | AA82: 141 | AB82: 200 | AC82: =(AA82*100)/AB82 -> 70.5 | AD82: =(X82*4)+(Z82*2) -> 0
A83: SUNSHINE | C83: CUTAJAR 4 | F83: CADDAYE 3 | I83: SHEPPERBOTTOM | L83: MITROVSKI | O83: CATALDO | R83: JOHNSON | T83: SCANLON | W83: BERWICK | X83: 0 | Y83: 2 | Z83: 0 | AA83: 176 | AB83: 337 | AC83: =(AA83*100)/AB83 -> 52.225519287833826 | AD83: =(X83*4)+(Z83*2) -> 0
A84: PRAHRAN | C84: PUTAMORSI 2 | F84: G GILES 2 | I84: McNAMARA | L84: COOK | N84: WALDER
A86: NORTHCOTE | C86: 6 | D86: 4 | E86: =C86*6+D86 -> 40 | G86: 8 | H86: 9 | I86: =G86*6+H86 -> 57 | K86: 9 | L86: 12 | M86: =K86*6+L86 -> 66 | O86: 13 | P86: 18 | Q86: =O86*6+P86 -> 96 | S86: NORTHCOTE
A87: CAULFIELD | C87: 1 | D87: 3 | E87: =C87*6+D87 -> 9 | G87: 3 | H87: 6 | I87: =G87*6+H87 -> 24 | K87: 3 | L87: 9 | M87: =K87*6+L87 -> 27 | O87: 4 | P87: 16 | Q87: =O87*6+P87 -> 40 | S87: BRADSHAW/BULLOCK
A88: BEST PLAYERS
A89: NORTHCOTE | C89: MINNETT | F89: G FAURE | I89: COURTS | L89: VENABLES | O89: DONOVAN
A90: CAULFIELD | C90: EINSEDEL | F90: LARKIN | I90: CIRO | L90: O'KEEFE | O90: BROUGHILL
A91: GOALKICKERS
A92: NORTHCOTE | C92: STRANGWICK 4 | G92: G FAURE 3 | J92: ARMSTRONG 2 | M92: TURNER 2 | O92: PANJANI | Q92: ZAPPONE
A93: CAULFIELD | C93: FIELD | E93: HAIDAMOUS | H93: O'BRIEN | J93: VITACCA
A95: WAVERLEY | C95: 6 | D95: 6 | E95: =C95*6+D95 -> 42 | G95: 9 | H95: 8 | I95: =G95*6+H95 -> 62 | K95: 14 | L95: 16 | M95: =K95*6+L95 -> 100 | O95: 17 | P95: 21 | Q95: =O95*6+P95 -> 123 | S95: MORDIALLOC
A96: MORDIALLOC | C96: 2 | D96: 0 | E96: =C96*6+D96 -> 12 | G96: 3 | H96: 2 | I96: =G96*6+H96 -> 20 | K96: 4 | L96: 2 | M96: =K96*6+L96 -> 26 | O96: 6 | P96: 2 | Q96: =O96*6+P96 -> 38 | S96: BROOKS/WILLIAMS
A97: BEST PLAYERS
A98: WAVERLEY | C98: STUART | F98: PEARSON | I98: HARRISON | L98: DE WITT | O98: KINNABURGH | R98: PALLOTTA
A99: MORDIALLOC | C99: JONES | F99: ALDRIDGE | I99: WATTERS | L99: POLA | O99: ROSS
A100: GOALKICKERS
A101: WAVERLEY | C101: HUNT 4 | E101: HARRISON 3 | H101: COLE 3 | J101: EVANS 2 | L101: CSOTI 2 | N101: STUART | P101: SHAW | R101: CASTILLO
A102: MORDIALLOC | C102: POLA 2 | E102: ALDRIDGE | H102: WATSON | J102: SVETLIK
A104: CAMBERWELL | C104: 11 | D104: 5 | E104: =C104*6+D104 -> 71 | G104: 18 | H104: 7 | I104: =G104*6+H104 -> 115 | K104: 19 | L104: 10 | M104: =K104*6+L104 -> 124 | O104: 22 | P104: 11 | Q104: =O104*6+P104 -> 143 | S104: BERWICK
A105: BERWICK | C105: 0 | D105: 1 | E105: =C105*6+D105 -> 1 | G105: 5 | H105: 1 | I105: =G105*6+H105 -> 31 | K105: 10 | L105: 6 | M105: =K105*6+L105 -> 66 | O105: 17 | P105: 7 | Q105: =O105*6+P105 -> 109 | S105: OKEY/MITCHELL
A106: BEST PLAYERS
A107: CAMBERWELL | C107: GRAY | F107: GIBBS | H107: CONSTANTINOU | L107: BOWLER | O107: FRASER
A108: BERWICK | C108: M JOHNSON | F108: ORSBORNE | I108: RYAN | L108: HARRISON | O108: WRIGHT | R108: TRIGG
A109: GOALKICKERS
A110: CAMBERWELL | C110: FRASER 9 | F110: WHALEN | H110: D WILLIAMS | K110: GARLAND | N110: GIBBS | O110: BOWLER | Q110: SINCLAIR | S110: BAIN | U110: 6 SHORT
A111: BERWICK | C111: HARRISON 7 | F111: TRIGG 6 | I111: HUDSON | K111: ORSBORNE | N111: SCOTT | P111: RYAN
A113: BYE | C113: WERRIBEE
A115: WERRIBEE | C115: 5 | D115: 3 | E115: =C115*6+D115 -> 33 | G115: 8 | H115: 7 | I115: =G115*6+H115 -> 55 | K115: 11 | L115: 12 | M115: =K115*6+L115 -> 78 | O115: 17 | P115: 14 | Q115: =O115*6+P115 -> 116 | S115: WERRIBEE
A116: MOORABBIN | C116: 1 | D116: 1 | E116: =C116*6+D116 -> 7 | G116: 3 | H116: 4 | I116: =G116*6+H116 -> 22 | K116: 4 | L116: 9 | M116: =K116*6+L116 -> 33 | O116: 5 | P116: 11 | Q116: =O116*6+P116 -> 41
A117: BEST PLAYERS
A118: WERRIBEE | C118: SMITH | F118: KIRKHAM | I118: TAYLOR | K118: BONAT | N118: B MOLONEY | Q118: S MOLONEY
A119: MOORABBIN | C119: POLLOCK | F119: FALCONER | I119: PHILLIPS
A120: GOALKICKERS
A121: WERRIBEE | C121: S MOLONEY 5 | F121: KIRKHAM 3 | I121: B MOLONEY 3 | L121: TAYLOR 3 | O121: FREEMAN | R121: BROWN | T121: HOPKINS
A122: MOORABBIN | C122: CLIFFORD 2 | F122: PHILLIPS | I122: POLLOCK | K122: CRAWFORD
A124: ROUND 3 | E124: 26TH APRIL | J124: WEATHER | S124: PLAYED AT
D125: 1ST QTR | H125: 2ND QTR | L125: 3RD QTR | P125: FINAL | S125: PRINCES PARK, CAULFIELD
A126: PRAHRAN | C126: 8 | D126: 3 | E126: =C126*6+D126 -> 51 | G126: 22 | H126: 7 | I126: =G126*6+H126 -> 139 | K126: 29 | L126: 9 | M126: =K126*6+L126 -> 183 | O126: 39 | P126: 10 | Q126: =O126*6+P126 -> 244 | S126: UMPIRE | X126: LADDER | AB126: ROUND | AD126: 3
A127: CAULFIELD | C127: 1 | D127: 2 | E127: =C127*6+D127 -> 8 | G127: 5 | H127: 6 | I127: =G127*6+H127 -> 36 | K127: 12 | L127: 8 | M127: =K127*6+L127 -> 80 | O127: 13 | P127: 11 | Q127: =O127*6+P127 -> 89 | S127: HARVEY/MORGAN
A128: BEST PLAYERS | W128: TEAM | X128: W | Y128: L | Z128: D | AA128: FOR | AB128: AGST | AC128: % | AD128: PTS
A129: PRAHRAN | C129: COOK | F129: CUTLER | I129: G GILES | L129: DURNAN | O129: TAPPING | R129: WALDER
A130: CAULFIELD | C130: EINSEDEL | F130: T VITACCA | I130: R VITACCA | L130: CIRO | O130: VENUNO | W130: WAVERLEY | X130: 3 | Y130: 0 | Z130: 0 | AA130: 532 | AB130: 192 | AC130: =(AA130*100)/AB130 -> 277.08333333333331 | AD130: =(X130*4)+(Z130*2) -> 12
A131: GOALKICKERS | E131: DURNAN 2 | H131: HAMILTON 2 | K131: S GILES | M131: TAPPING | O131: G GILES | Q131: JACKSON | S131: TAYLOR | W131: WERRIBEE | X131: 3 | Y131: 0 | Z131: 0 | AA131: 304 | AB131: 180 | AC131: =(AA131*100)/AB131 -> 168.88888888888889 | AD131: =(X131*4)+(Z131*2) -> 12
A132: PRAHRAN | C132: COOK 9 | E132: CUTLER 6 | G132: BINGHAM 4 | J132: SOULOS 3 | L132: McNAMARA 3 | O132: WALDER 3 | R132: HUTCHISON 2 | W132: SUNSHINE | X132: 3 | Y132: 0 | Z132: 0 | AA132: 369 | AB132: 263 | AC132: =(AA132*100)/AB132 -> 140.30418250950569 | AD132: =(X132*4)+(Z132*2) -> 12
A133: CAULFIELD | C133: YOUNG 4 | F133: R VITACCA 3 | I133: T VITACCA 2 | L133: GODAU 2 | N133: SANDERSON | Q133: CIRO | W133: CAMBERWELL | X133: 2 | Y133: 1 | Z133: 0 | AA133: 495 | AB133: 298 | AC133: =(AA133*100)/AB133 -> 166.10738255033556 | AD133: =(X133*4)+(Z133*2) -> 8
A135: SUNSHINE | C135: 9 | D135: 9 | E135: =C135*6+D135 -> 63 | G135: 9 | H135: 9 | I135: =G135*6+H135 -> 63 | K135: 13 | L135: 14 | M135: =K135*6+L135 -> 92 | O135: 20 | P135: 16 | Q135: =O135*6+P135 -> 136 | S135: SUNSHINE | W135: DANDENONG | X135: 2 | Y135: 1 | Z135: 0 | AA135: 214 | AB135: 203 | AC135: =(AA135*100)/AB135 -> 105.41871921182266 | AD135: =(X135*4)+(Z135*2) -> 8
A136: DANDENONG | C136: 2 | D136: 2 | E136: =C136*6+D136 -> 14 | G136: 4 | H136: 9 | I136: =G136*6+H136 -> 33 | K136: 8 | L136: 16 | M136: =K136*6+L136 -> 64 | O136: 14 | P136: 19 | Q136: =O136*6+P136 -> 103 | S136: BUCK/HULM | W136: OAKLEIGH | X136: 2 | Y136: 1 | Z136: 0 | AA136: 177 | AB136: 196 | AC136: =(AA136*100)/AB136 -> 90.306122448979593 | AD136: =(X136*4)+(Z136*2) -> 8
A137: BEST PLAYERS | W137: PRAHRAN | X137: 1 | Y137: 2 | Z137: 0 | AA137: 385 | AB137: 289 | AC137: =(AA137*100)/AB137 -> 133.21799307958477 | AD137: =(X137*4)+(Z137*2) -> 4
A138: SUNSHINE | C138: TAYLOR | F138: MOSS | H138: MITROVSKI | K138: SHEPPERBOTTOM | O138: PROTETTO | R138: CUTAJAR | W138: MORDIALLOC | X138: 1 | Y138: 2 | Z138: 0 | AA138: 241 | AB138: 268 | AC138: =(AA138*100)/AB138 -> 89.925373134328353 | AD138: =(X138*4)+(Z138*2) -> 4
A139: DANDENONG | C139: PALLANT | F139: LACKO | H139: MILLANE | K139: BRUNNEN | O139: COLLARD | R139: WRIGHT | W139: NORTHCOTE | X139: 1 | Y139: 2 | Z139: 0 | AA139: 287 | AB139: 643 | AC139: =(AA139*100)/AB139 -> 44.634525660964229 | AD139: =(X139*4)+(Z139*2) -> 4
A140: GOALKICKERS | M140: McQUALTER | P140: BROWN | R140: SCANLON | W140: CAULFIELD | X140: 0 | Y140: 3 | Z140: 0 | AA140: 274 | AB140: 486 | AC140: =(AA140*100)/AB140 -> 56.378600823045268 | AD140: =(X140*4)+(Z140*2) -> 0
A141: SUNSHINE | C141: CADDAYE 4 | F141: SHEPPERBOTTOM 4 | J141: SCHICCITANO 3 | M141: MITROVSKI 2 | P141: MOSS 2 | R141: ROBERTSON | U141: MAY | W141: BERWICK | X141: 0 | Y141: 3 | Z141: 0 | AA141: 249 | AB141: 509 | AC141: =(AA141*100)/AB141 -> 48.919449901768175 | AD141: =(X141*4)+(Z141*2) -> 0
A142: DANDENONG | C142: PALLANT 6 | F142: MILLANE 3 | I142: GRAHAM 2 | L142: LACKO | N142: METE | P142: KNIGHT
A144: WERRIBEE | C144: 10 | D144: 6 | E144: =C144*6+D144 -> 66 | G144: 16 | H144: 9 | I144: =G144*6+H144 -> 105 | K144: 20 | L144: 15 | M144: =K144*6+L144 -> 135 | O144: 25 | P144: 22 | Q144: =O144*6+P144 -> 172 | S144: BERWICK
A145: BERWICK | C145: 1 | D145: 1 | E145: =C145*6+D145 -> 7 | G145: 7 | H145: 4 | I145: =G145*6+H145 -> 46 | K145: 8 | L145: 7 | M145: =K145*6+L145 -> 55 | O145: 10 | P145: 13 | Q145: =O145*6+P145 -> 73 | S145: BROOKS/BULLOCK
A146: BEST PLAYERS
A147: WERRIBEE | C147: BONAT | F147: VASILOU | H147: FREEMAN | K147: TAYLOR | N147: HOPKINS | Q147: MOLONEY
A148: BERWICK | C148: WRIGHT | F148: McGILL | H148: HARRISON | K148: JOHNSON | N148: ORSBORNE
A149: GOALKICKERS
A150: WERRIBEE | C150: FREEMAN 5 | F150: VASILOU 4 | H150: DUNSTAN 3 | K150: BONAT 3 | M150: TAYLOR 3 | O150: KIRKHAM 2 | R150: MORRIS | T150: B MOLONEY | W150: LESIPUTY | X150: S MOLONEY | Z150: HOPKINS
A151: BERWICK | C151: McGREAL 2 | F151: DEVINE 2 | I151: McGILL 2 | K151: JOHNSON 2 | N151: HARRISON | Q151: McDONALD
A153: CAMBERWELL | C153: 6 | D153: 5 | E153: =C153*6+D153 -> 41 | G153: 17 | H153: 12 | I153: =G153*6+H153 -> 114 | K153: 25 | L153: 14 | M153: =K153*6+L153 -> 164 | O153: 37 | P153: 23 | Q153: =O153*6+P153 -> 245 | S153: CAMBERWELL
A154: MORDIALLOC | C154: 3 | D154: 4 | E154: =C154*6+D154 -> 22 | G154: 4 | H154: 8 | I154: =G154*6+H154 -> 32 | K154: 5 | L154: 13 | M154: =K154*6+L154 -> 43 | O154: 7 | P154: 15 | Q154: =O154*6+P154 -> 57 | S154: ANASASIO/PRICE
A155: BEST PLAYERS
A156: CAMBERWELL | C156: GIBBS | F156: FRASER | I156: SINCLAIR | L156: GARLAND | O156: WHALEN | R156: CONSTANTINOU
A157: MORDIALLOC | C157: ROSS | F157: BULLEY | I157: HESS | L157: MATTHEWS | O157: JONES | R157: POLA
A158: GOALKICKERS
A159: CAMBERWELL | C159: FRASER 11 | F159: GARLAND 7 | I159: CONSTANTINOU 6 | M159: SINCLAIR 4 | O159: WHALEN 3 | R159: A SAMIOS 2 | U159: WHYLDE | W159: WILLIAMS | X159: GIBBS | Z159: STEINER
A160: MORDIALLOC | C160: CASTLES 2 | F160: POLA | H160: CASSON | J160: WATSON | M160: JAMIESON | P160: D COFFEY
A162: WAVERLEY | C162: 8 | D162: 6 | E162: =C162*6+D162 -> 54 | G162: 16 | H162: 14 | I162: =G162*6+H162 -> 110 | K162: 22 | L162: 21 | M162: =K162*6+L162 -> 153 | O162: 32 | P162: 23 | Q162: =O162*6+P162 -> 215 | S162: WAVERLEY
A163: NORTHCOTE | C163: 4 | D163: 2 | E163: =C163*6+D163 -> 26 | G163: 6 | H163: 4 | I163: =G163*6+H163 -> 40 | K163: 7 | L163: 7 | M163: =K163*6+L163 -> 49 | O163: 13 | P163: 9 | Q163: =O163*6+P163 -> 87 | S163: MATTHEWS/CURREN
A164: BEST PLAYERS
A165: WAVERLEY | C165: KINNABURGH | G165: EVANS | J165: PEARSON | M165: PALLOTTA | P165: VEAR | R165: CASTILLO
A166: NORTHCOTE | C166: NOT SUPPLIED
A167: GOALKICKERS
A168: WAVERLEY | C168: EVANS 11 | F168: BREWER 7 | H168: ANDERSON 5 | K168: KINNABURGH 2 | N168: COLE 2 | P168: CASTILLO 2 | S168: STUART 2 | V168: VEAR
A169: NORTHCOTE | C169: FAURE 3 | F169: MITCHELL 3 | I169: MINNETT 2 | K169: REARDON 2 | N169: SMITH | P169: BERTOLLO | R169: ARMSTRONG
A171: BYE | C171: OAKLEIGH
A173: ROUND 4 | E173: 3RD MAY | J173: WEATHER | S173: PLAYED AT
D174: 1ST QTR | H174: 2ND QTR | L174: 3RD QTR | P174: FINAL | S174: DANDENONG
A175: DANDENONG | C175: 0 | D175: 0 | E175: =C175*6+D175 -> 0 | G175: 0 | H175: 0 | I175: =G175*6+H175 -> 0 | K175: 0 | L175: 0 | M175: =K175*6+L175 -> 0 | O175: 22 | P175: 30 | Q175: =O175*6+P175 -> 162 | S175: UMPIRE | X175: LADDER | AB175: ROUND | AD175: 4
A176: CAULFIELD | C176: 0 | D176: 0 | E176: =C176*6+D176 -> 0 | G176: 0 | H176: 0 | I176: =G176*6+H176 -> 0 | K176: 0 | L176: 0 | M176: =K176*6+L176 -> 0 | O176: 3 | P176: 4 | Q176: =O176*6+P176 -> 22
A177: BEST PLAYERS | W177: TEAM | X177: W | Y177: L | Z177: D | AA177: FOR | AB177: AGST | AC177: % | AD177: PTS
A178: DANDENONG
A179: CAULFIELD | W179: WAVERLEY | X179: 4 | Y179: 0 | Z179: 0 | AA179: 665 | AB179: 312 | AC179: =(AA179*100)/AB179 -> 213.14102564102564 | AD179: =(X179*4)+(Z179*2) -> 16
A180: GOALKICKERS | W180: WERRIBEE | X180: 4 | Y180: 0 | Z180: 0 | AA180: 429 | AB180: 298 | AC180: =(AA180*100)/AB180 -> 143.95973154362417 | AD180: =(X180*4)+(Z180*2) -> 16
A181: DANDENONG | W181: SUNSHINE | X181: 4 | Y181: 0 | Z181: 0 | AA181: 369 | AB181: 263 | AC181: =(AA181*100)/AB181 -> 140.30418250950569 | AD181: =(X181*4)+(Z181*2) -> 16
A182: CAULFIELD | W182: CAMBERWELL | X182: 3 | Y182: 1 | Z182: 0 | AA182: 676 | AB182: 392 | AC182: =(AA182*100)/AB182 -> 172.44897959183675 | AD182: =(X182*4)+(Z182*2) -> 12
A184: CAMBERWELL | C184: 0 | D184: 0 | E184: =C184*6+D184 -> 0 | G184: 0 | H184: 0 | I184: =G184*6+H184 -> 0 | K184: 0 | L184: 0 | M184: =K184*6+L184 -> 0 | O184: 27 | P184: 19 | Q184: =O184*6+P184 -> 181 | S184: NORTHCOTE | W184: DANDENONG | X184: 3 | Y184: 1 | Z184: 0 | AA184: 376 | AB184: 225 | AC184: =(AA184*100)/AB184 -> 167.11111111111111 | AD184: =(X184*4)+(Z184*2) -> 12
A185: NORTHCOTE | C185: 0 | D185: 0 | E185: =C185*6+D185 -> 0 | G185: 0 | H185: 0 | I185: =G185*6+H185 -> 0 | K185: 0 | L185: 0 | M185: =K185*6+L185 -> 0 | O185: 13 | P185: 16 | Q185: =O185*6+P185 -> 94 | W185: OAKLEIGH | X185: 2 | Y185: 2 | Z185: 0 | AA185: 295 | AB185: 321 | AC185: =(AA185*100)/AB185 -> 91.900311526479754 | AD185: =(X185*4)+(Z185*2) -> 8
A186: BEST PLAYERS | W186: PRAHRAN | X186: 1 | Y186: 3 | Z186: 0 | AA186: 505 | AB186: 422 | AC186: =(AA186*100)/AB186 -> 119.66824644549763 | AD186: =(X186*4)+(Z186*2) -> 4
A187: CAMBERWELL | W187: MORDIALLOC | X187: 1 | Y187: 3 | Z187: 0 | AA187: 401 | AB187: 429 | AC187: =(AA187*100)/AB187 -> 93.473193473193476 | AD187: =(X187*4)+(Z187*2) -> 4
A188: NORTHCOTE | W188: BERWICK | X188: 1 | Y188: 3 | Z188: 0 | AA188: 410 | AB188: 669 | AC188: =(AA188*100)/AB188 -> 61.285500747384155 | AD188: =(X188*4)+(Z188*2) -> 4
A189: GOALKICKERS | W189: NORTHCOTE | X189: 1 | Y189: 3 | Z189: 0 | AA189: 381 | AB189: 824 | AC189: =(AA189*100)/AB189 -> 46.237864077669904 | AD189: =(X189*4)+(Z189*2) -> 4
A190: CAMBERWELL | W190: CAULFIELD | X190: 0 | Y190: 4 | Z190: 0 | AA190: 296 | AB190: 648 | AC190: =(AA190*100)/AB190 -> 45.679012345679013 | AD190: =(X190*4)+(Z190*2) -> 0
A191: NORTHCOTE
E192: 10TH MAY | J192: WEATHER
A193: WAVERLEY | C193: 6 | D193: 5 | E193: =C193*6+D193 -> 41 | G193: 12 | H193: 8 | I193: =G193*6+H193 -> 80 | K193: 15 | L193: 9 | M193: =K193*6+L193 -> 99 | O193: 20 | P193: 13 | Q193: =O193*6+P193 -> 133 | S193: TOORAK PARK
A194: PRAHRAN | C194: 3 | D194: 3 | E194: =C194*6+D194 -> 21 | G194: 6 | H194: 6 | I194: =G194*6+H194 -> 42 | K194: 12 | L194: 11 | M194: =K194*6+L194 -> 83 | O194: 18 | P194: 12 | Q194: =O194*6+P194 -> 120 | S194: HULM/PRICE
A195: BEST PLAYERS
A196: WAVERLEY | C196: VEAR | F196: PALLOTTA | I196: COLE | L196: HUNT | O196: ROGERSON | R196: PEARSON
A197: PRAHRAN | C197: TAYLOR | F197: SQUIRES | I197: COOK | L197: JACKSON | O197: KANE
A198: GOALKICKERS
A199: WAVERLEY | C199: HUNT 6 | E199: EVANS 5 | G199: COLE 3 | I199: STUART 2 | K199: PALLOTTA | N199: BREWER | P199: SHAW | R199: ROGERSON
A200: PRAHRAN | C200: SOULOS 4 | F200: COOK 3 | H200: G GILES 3 | J200: KANE 3 | L200: McNAMARA 2 | O200: TAPPING | R200: TAYLOR | T200: HUTCHISON
A202: WERRIBEE | C202: 6 | D202: 5 | E202: =C202*6+D202 -> 41 | G202: 9 | H202: 8 | I202: =G202*6+H202 -> 62 | K202: 13 | L202: 14 | M202: =K202*6+L202 -> 92 | O202: 18 | P202: 17 | Q202: =O202*6+P202 -> 125 | S202: WERRIBEE
A203: OAKLEIGH | C203: 5 | D203: 0 | E203: =C203*6+D203 -> 30 | G203: 9 | H203: 5 | I203: =G203*6+H203 -> 59 | K203: 11 | L203: 6 | M203: =K203*6+L203 -> 72 | O203: 18 | P203: 10 | Q203: =O203*6+P203 -> 118 | S203: GLEESON/MITCHELL
A204: BEST PLAYERS
A205: WERRIBEE | C205: VASILOU | F205: CUNNINGHAM | I205: TAYLOR | L205: V GUINTA | O205: DUNSTAN | R205: HOPKINS
A206: OAKLEIGH | C206: CUNNINGHAM | F206: WALL | I206: C ROURKE | L206: CARAFA | O206: SCOTT | R206: SIMPSON
A207: GOALKICKERS
A208: WERRIBEE | C208: TAYLOR 7 | F208: DUNSTAN 5 | I208: KIRKHAM 2 | K208: BONAT | M208: B MOLONEY | P208: GREY | R208: HOPKINS
A209: OAKLEIGH | C209: SCOTT 6 | F209: ROACH 2 | H209: BARRY 2 | J209: OWEN 2 | L209: SIMPSON | N209: CARAFA | P209: THOMPSON | S209: S ROURKE | V209: HOWE | X209: MARCHESANI
A211: BERWICK | C211: 8 | D211: 2 | E211: =C211*6+D211 -> 50 | G211: 11 | H211: 7 | I211: =G211*6+H211 -> 73 | K211: 19 | L211: 10 | M211: =K211*6+L211 -> 124 | O211: 25 | P211: 11 | Q211: =O211*6+P211 -> 161 | S211: MORDIALLOC
A212: MORDIALLOC | C212: 8 | D212: 3 | E212: =C212*6+D212 -> 51 | G212: 16 | H212: 3 | I212: =G212*6+H212 -> 99 | K212: 23 | L212: 4 | M212: =K212*6+L212 -> 142 | O212: 25 | P212: 10 | Q212: =O212*6+P212 -> 160 | S212: CARUSO/HARVEY
A213: BEST PLAYERS
A214: BERWICK | C214: SCOTT | F214: MANNENS | I214: WRIGHT | L214: McGREAL | O214: McGILL
A215: MORDIALLOC | C215: ROSS | F215: ALDRIDGE | I215: A COFFEY | L215: JAMIESON | O215: POLA | Q215: NICHOLAIDES
A216: GOALKICKERS
A217: BERWICK | C217: McGREAL 5 | F217: McGILL 4 | H217: WRIGHT 4 | J217: McDONALD 3 | M217: HARRISON 2 | O217: SCOTT 2 | Q217: ORSBORNE 2 | T217: BREEN 2 | W217: DEVINE
A218: MORDIALLOC | C218: A COFFEY 7 | F218: ALDRIDGE 5 | I218: NICHOLAIDES 5 | L218: POLA 4 | N218: WATSON | P218: BROMLEY | R218: D COFFEY | T218: JAMIESON
A220: BYE | C220: SUNSHINE
A222: ROUND 5 | E222: 16TH MAY | J222: WEATHER | S222: PLAYED AT
D223: 1ST QTR | H223: 2ND QTR | L223: 3RD QTR | P223: FINAL | S223: MORDIALLOC
A224: WERRIBEE | C224: 5 | D224: 7 | E224: =C224*6+D224 -> 37 | G224: 8 | H224: 10 | I224: =G224*6+H224 -> 58 | K224: 13 | L224: 18 | M224: =K224*6+L224 -> 96 | O224: 18 | P224: 20 | Q224: =O224*6+P224 -> 128 | S224: UMPIRE | X224: LADDER | AB224: ROUND | AD224: 5
A225: MORDIALLOC | C225: 4 | D225: 2 | E225: =C225*6+D225 -> 26 | G225: 5 | H225: 7 | I225: =G225*6+H225 -> 37 | K225: 7 | L225: 9 | M225: =K225*6+L225 -> 51 | O225: 9 | P225: 14 | Q225: =O225*6+P225 -> 68 | S225: BLACK/BULLOCK
A226: BEST PLAYERS | W226: TEAM | X226: W | Y226: L | Z226: D | AA226: FOR | AB226: AGST | AC226: % | AD226: PTS
A227: WERRIBEE | C227: GUDDE | F227: SMITH | I227: BONAT | L227: S MOLONEY | O227: BROWN | R227: CUNNINGHAM
A228: MORDIALLOC | C228: ROSS | F228: ALDRIDGE | I228: POLA | L228: HESS | O228: JONES | R228: CASTLES | W228: WERRIBEE | X228: 5 | Y228: 0 | Z228: 0 | AA228: 557 | AB228: 366 | AC228: =(AA228*100)/AB228 -> 152.18579234972677 | AD228: =(X228*4)+(Z228*2) -> 20
A229: GOALKICKERS | P229: HOPKINS | W229: SUNSHINE | X229: 5 | Y229: 0 | Z229: 0 | AA229: 463 | AB229: 351 | AC229: =(AA229*100)/AB229 -> 131.9088319088319 | AD229: =(X229*4)+(Z229*2) -> 20
A230: WERRIBEE | C230: DUNSTAN 3 | F230: TAYLOR 3 | H230: GUINTA 3 | J230: S MOLONEY 3 | M230: NASH 2 | O230: BONAT | Q230: CUNNINGHAM | T230: KIRKHAM | W230: DANDENONG | X230: 4 | Y230: 1 | Z230: 0 | AA230: 508 | AB230: 296 | AC230: =(AA230*100)/AB230 -> 171.62162162162161 | AD230: =(X230*4)+(Z230*2) -> 16
A231: MORDIALLOC | C231: CRAWFORD 3 | F231: NICHOLAIDES 2 | I231: ALDRIDGE 2 | K231: A COFFEY | N231: JONES | W231: WAVERLEY | X231: 4 | Y231: 1 | Z231: 0 | AA231: 736 | AB231: 444 | AC231: =(AA231*100)/AB231 -> 165.76576576576576 | AD231: =(X231*4)+(Z231*2) -> 16
E232: 17TH MAY | J232: WEATHER
A233: PRAHRAN | C233: 6 | D233: 6 | E233: =C233*6+D233 -> 42 | G233: 9 | H233: 7 | I233: =G233*6+H233 -> 61 | K233: 12 | L233: 12 | M233: =K233*6+L233 -> 84 | O233: 16 | P233: 17 | Q233: =O233*6+P233 -> 113 | S233: CAMBERWELL | W233: CAMBERWELL | X233: 3 | Y233: 2 | Z233: 0 | AA233: 776 | AB233: 505 | AC233: =(AA233*100)/AB233 -> 153.66336633663366 | AD233: =(X233*4)+(Z233*2) -> 12
A234: CAMBERWELL | C234: 2 | D234: 1 | E234: =C234*6+D234 -> 13 | G234: 5 | H234: 4 | I234: =G234*6+H234 -> 34 | K234: 8 | L234: 7 | M234: =K234*6+L234 -> 55 | O234: 15 | P234: 10 | Q234: =O234*6+P234 -> 100 | W234: PRAHRAN | X234: 2 | Y234: 3 | Z234: 0 | AA234: 618 | AB234: 522 | AC234: =(AA234*100)/AB234 -> 118.39080459770115 | AD234: =(X234*4)+(Z234*2) -> 8
A235: BEST PLAYERS | W235: OAKLEIGH | X235: 2 | Y235: 3 | Z235: 0 | AA235: 383 | AB235: 415 | AC235: =(AA235*100)/AB235 -> 92.289156626506028 | AD235: =(X235*4)+(Z235*2) -> 8
A236: PRAHRAN | C236: HAMILTON | F236: TAYLOR | I236: BENNETT | L236: TORCASIO | O236: FIELDING | R236: SOULOS | W236: NORTHCOTE | X236: 2 | Y236: 3 | Z236: 0 | AA236: 475 | AB236: 903 | AC236: =(AA236*100)/AB236 -> 52.602436323366554 | AD236: =(X236*4)+(Z236*2) -> 8
A237: CAMBERWELL | C237: FREW | F237: STEINER | I237: GIBBS | L237: GREY | N237: CONSTANTINOU | R237: DE KONNING | W237: MORDIALLOC | X237: 1 | Y237: 4 | Z237: 0 | AA237: 469 | AB237: 557 | AC237: =(AA237*100)/AB237 -> 84.201077199281869 | AD237: =(X237*4)+(Z237*2) -> 4
A238: GOALKICKERS | W238: BERWICK | X238: 1 | Y238: 4 | Z238: 0 | AA238: 489 | AB238: 763 | AC238: =(AA238*100)/AB238 -> 64.089121887287021 | AD238: =(X238*4)+(Z238*2) -> 4
A239: PRAHRAN | C239: BINGHAM 4 | F239: SOULOS 4 | I239: TAYLOR 3 | K239: McNAMARA 2 | N239: McLEOD | P239: HIPWORTH | S239: TAPPING | W239: CAULFIELD | X239: 1 | Y239: 4 | Z239: 0 | AA239: 296 | AB239: 648 | AC239: =(AA239*100)/AB239 -> 45.679012345679013 | AD239: =(X239*4)+(Z239*2) -> 4
A240: CAMBERWELL | C240: GIBBS 5 | E240: FRASER 4 | G240: O'NEILL 2 | J240: GARLAND | L240: BOWLER | N240: P SAMIOS | P240: CONSTANTINOU
A242: DANDENONG | C242: 2 | D242: 6 | E242: =C242*6+D242 -> 18 | G242: 5 | H242: 8 | I242: =G242*6+H242 -> 38 | K242: 12 | L242: 12 | M242: =K242*6+L242 -> 84 | O242: 19 | P242: 18 | Q242: =O242*6+P242 -> 132 | S242: WAVERLEY
A243: WAVERLEY | C243: 0 | D243: 4 | E243: =C243*6+D243 -> 4 | G243: 4 | H243: 11 | I243: =G243*6+H243 -> 35 | K243: 5 | L243: 12 | M243: =K243*6+L243 -> 42 | O243: 9 | P243: 17 | Q243: =O243*6+P243 -> 71 | S243: CARUSO/GLEESON
A244: BEST PLAYERS
A245: DANDENONG | C245: HOLDEN | F245: LINDSAY | I245: D'ARCY | L245: BRUNNEN | O245: MILLANE | R245: HICKEY
A246: WAVERLEY | C246: DE WITT | F246: MARSHALL | I246: VEAR
A247: GOALKICKERS
A248: DANDENONG | C248: HOLDEN 4 | F248: METE 3 | H248: MILLANE 3 | K248: TUFO 2 | M248: WRIGHT 2 | O248: BRUNNEN 2 | R248: KNIGHT 2 | T248: PALLANT
A249: WAVERLEY | C249: EVANS 3 | F249: BREWER 2 | H249: KENDALL 2 | K249: CASTILLO | N249: STUART
A251: SUNSHINE | C251: 1 | D251: 3 | E251: =C251*6+D251 -> 9 | G251: 8 | H251: 7 | I251: =G251*6+H251 -> 55 | K251: 10 | L251: 11 | M251: =K251*6+L251 -> 71 | O251: 13 | P251: 16 | Q251: =O251*6+P251 -> 94 | S251: SUNSHINE
A252: OAKLEIGH | C252: 3 | D252: 4 | E252: =C252*6+D252 -> 22 | G252: 6 | H252: 4 | I252: =G252*6+H252 -> 40 | K252: 10 | L252: 9 | M252: =K252*6+L252 -> 69 | O252: 13 | P252: 10 | Q252: =O252*6+P252 -> 88 | S252: MORGAN/HARVEY
A253: BEST PLAYERS
A254: SUNSHINE | C254: MOSS | F254: MITROVSKI | I254: SCANLON | L254: MENADUE | O254: CUTAJAR | R254: SCHICCITANO
A255: OAKLEIGH | C255: CARAFA | F255: CUNNINGHAM | I255: C ROURKE | L255: HILLIARD | O255: ATHERTON | R255: OWEN
A256: GOALKICKERS
A257: SUNSHINE | C257: LITCHFIELD 5 | F257: MITROVSKI 2 | I257: PROTETTO 2 | L257: SHEPPERBOTTOM 2 | P257: CLEGG | R257: ROBINSON
A258: OAKLEIGH | C258: PRETTO 5 | F258: BARRY 2 | I258: OWEN 2 | K258: FINN | M258: THOMPSON | P258: SCOTT | R258: HOWE
A260: NORTHCOTE | C260: 1 | D260: 2 | E260: =C260*6+D260 -> 8 | G260: 2 | H260: 5 | I260: =G260*6+H260 -> 17 | K260: 9 | L260: 6 | M260: =K260*6+L260 -> 60 | O260: 14 | P260: 10 | Q260: =O260*6+P260 -> 94 | S260: BERWICK
A261: BERWICK | C261: 6 | D261: 6 | E261: =C261*6+D261 -> 42 | G261: 8 | H261: 9 | I261: =G261*6+H261 -> 57 | K261: 9 | L261: 12 | M261: =K261*6+L261 -> 66 | O261: 11 | P261: 13 | Q261: =O261*6+P261 -> 79 | S261: BRADSHAW/PRICE
A262: BEST PLAYERS
A263: NORTHCOTE | C263: NOT SUPPLIED
A264: BERWICK | C264: SCOTT | F264: LUXFORD | I264: BREEN | L264: JOHNSON | O264: WRIGHT
A265: GOALKICKERS
A266: NORTHCOTE | C266: PANTARI 5 | F266: LITTLE 3 | H266: BERTOLLO | J266: SINDEN | L266: COURTS | N266: MITCHELL | Q266: ARMSTRONG | U266: REARDON
A267: BERWICK | C267: JOHNSON 5 | F267: BREEN 2 | H267: MCGILL 2 | J267: SCOTT
A269: BYE | C269: CAULFIELD
A271: ROUND 6 | E271: 24TH MAY | J271: WEATHER | S271: PLAYED AT
D272: 1ST QTR | H272: 2ND QTR | L272: 3RD QTR | P272: FINAL | S272: OAKLEIGH
A273: OAKLEIGH | C273: 0 | D273: 0 | E273: =C273*6+D273 -> 0 | G273: 0 | H273: 0 | I273: =G273*6+H273 -> 0 | K273: 0 | L273: 0 | M273: =K273*6+L273 -> 0 | O273: 19 | P273: 21 | Q273: =O273*6+P273 -> 135 | S273: UMPIRE | X273: LADDER | AB273: ROUND | AD273: 6
A274: CAULFIELD | C274: 0 | D274: 0 | E274: =C274*6+D274 -> 0 | G274: 0 | H274: 0 | I274: =G274*6+H274 -> 0 | K274: 0 | L274: 0 | M274: =K274*6+L274 -> 0 | O274: 8 | P274: 5 | Q274: =O274*6+P274 -> 53
A275: BEST PLAYERS | W275: TEAM | X275: W | Y275: L | Z275: D | AA275: FOR | AB275: AGST | AC275: % | AD275: PTS
A276: OAKLEIGH
A277: CAULFIELD | W277: WERRIBEE | X277: 6 | Y277: 0 | Z277: 0 | AA277: 682 | AB277: 469 | AC277: =(AA277*100)/AB277 -> 145.41577825159914 | AD277: =(X277*4)+(Z277*2) -> 24
A278: GOALKICKERS | W278: WAVERLEY | X278: 5 | Y278: 1 | Z278: 0 | AA278: 736 | AB278: 444 | AC278: =(AA278*100)/AB278 -> 165.76576576576576 | AD278: =(X278*4)+(Z278*2) -> 20
A279: OAKLEIGH | W279: SUNSHINE | X279: 5 | Y279: 1 | Z279: 0 | AA279: 566 | AB279: 476 | AC279: =(AA279*100)/AB279 -> 118.90756302521008 | AD279: =(X279*4)+(Z279*2) -> 20
A280: CAULFIELD | W280: CAMBERWELL | X280: 4 | Y280: 2 | Z280: 0 | AA280: 911 | AB280: 623 | AC280: =(AA280*100)/AB280 -> 146.2279293739968 | AD280: =(X280*4)+(Z280*2) -> 16
A282: PRAHRAN | C282: 0 | D282: 0 | E282: =C282*6+D282 -> 0 | G282: 0 | H282: 0 | I282: =G282*6+H282 -> 0 | K282: 0 | L282: 0 | M282: =K282*6+L282 -> 0 | O282: 19 | P282: 25 | Q282: =O282*6+P282 -> 139 | S282: TOORAK PARK | W282: DANDENONG | X282: 4 | Y282: 2 | Z282: 0 | AA282: 626 | AB282: 431 | AC282: =(AA282*100)/AB282 -> 145.24361948955917 | AD282: =(X282*4)+(Z282*2) -> 16
A283: BERWICK | C283: 0 | D283: 0 | E283: =C283*6+D283 -> 0 | G283: 0 | H283: 0 | I283: =G283*6+H283 -> 0 | K283: 0 | L283: 0 | M283: =K283*6+L283 -> 0 | O283: 13 | P283: 7 | Q283: =O283*6+P283 -> 85 | W283: PRAHRAN | X283: 3 | Y283: 3 | Z283: 0 | AA283: 757 | AB283: 607 | AC283: =(AA283*100)/AB283 -> 124.71169686985174 | AD283: =(X283*4)+(Z283*2) -> 12
A284: BEST PLAYERS | W284: OAKLEIGH | X284: 3 | Y284: 3 | Z284: 0 | AA284: 518 | AB284: 468 | AC284: =(AA284*100)/AB284 -> 110.68376068376068 | AD284: =(X284*4)+(Z284*2) -> 12
A285: PRAHRAN | W285: MORDIALLOC | X285: 2 | Y285: 4 | Z285: 0 | AA285: 573 | AB285: 649 | AC285: =(AA285*100)/AB285 -> 88.289676425269647 | AD285: =(X285*4)+(Z285*2) -> 8
A286: BERWICK | W286: NORTHCOTE | X286: 2 | Y286: 4 | Z286: 0 | AA286: 567 | AB286: 1007 | AC286: =(AA286*100)/AB286 -> 56.305858987090367 | AD286: =(X286*4)+(Z286*2) -> 8
A287: GOALKICKERS | W287: BERWICK | X287: 1 | Y287: 5 | Z287: 0 | AA287: 574 | AB287: 903 | AC287: =(AA287*100)/AB287 -> 63.565891472868216 | AD287: =(X287*4)+(Z287*2) -> 4
A288: PRAHRAN | W288: CAULFIELD | X288: 1 | Y288: 5 | Z288: 0 | AA288: 349 | AB288: 783 | AC288: =(AA288*100)/AB288 -> 44.572158365261814 | AD288: =(X288*4)+(Z288*2) -> 4
A289: BERWICK
A291: CAMBERWELL | C291: 0 | D291: 0 | E291: =C291*6+D291 -> 0 | G291: 0 | H291: 0 | I291: =G291*6+H291 -> 0 | K291: 0 | L291: 0 | M291: =K291*6+L291 -> 0 | O291: 20 | P291: 15 | Q291: =O291*6+P291 -> 135 | S291: DANDENONG
A292: DANDENONG | C292: 0 | D292: 0 | E292: =C292*6+D292 -> 0 | G292: 0 | H292: 0 | I292: =G292*6+H292 -> 0 | K292: 0 | L292: 0 | M292: =K292*6+L292 -> 0 | O292: 17 | P292: 16 | Q292: =O292*6+P292 -> 118
A293: BEST PLAYERS
A294: CAMBERWELL
A295: DANDENONG
A296: GOALKICKERS
A297: CAMBERWELL
A298: DANDENONG
A300: MORDIALLOC | C300: 0 | D300: 0 | E300: =C300*6+D300 -> 0 | G300: 0 | H300: 0 | I300: =G300*6+H300 -> 0 | K300: 0 | L300: 0 | M300: =K300*6+L300 -> 0 | O300: 15 | P300: 14 | Q300: =O300*6+P300 -> 104 | S300: NORTHCOTE
A301: NORTHCOTE | C301: 0 | D301: 0 | E301: =C301*6+D301 -> 0 | G301: 0 | H301: 0 | I301: =G301*6+H301 -> 0 | K301: 0 | L301: 0 | M301: =K301*6+L301 -> 0 | O301: 12 | P301: 20 | Q301: =O301*6+P301 -> 92
A302: BEST PLAYERS
A303: MORDIALLOC
A304: NORTHCOTE
A305: GOALKICKERS
A306: MORDIALLOC
A307: NORTHCOTE
A309: WERRIBEE | C309: 0 | D309: 0 | E309: =C309*6+D309 -> 0 | G309: 0 | H309: 0 | I309: =G309*6+H309 -> 0 | K309: 0 | L309: 0 | M309: =K309*6+L309 -> 0 | O309: 18 | P309: 17 | Q309: =O309*6+P309 -> 125 | S309: WERRIBEE
A310: SUNSHINE | C310: 0 | D310: 0 | E310: =C310*6+D310 -> 0 | G310: 0 | H310: 0 | I310: =G310*6+H310 -> 0 | K310: 0 | L310: 0 | M310: =K310*6+L310 -> 0 | O310: 15 | P310: 13 | Q310: =O310*6+P310 -> 103
A311: BEST PLAYERS
A312: WERRIBEE
A313: SUNSHINE
A314: GOALKICKERS
A315: WERRIBEE
A316: SUNSHINE
A318: BYE | C318: WAVERLEY
A320: ROUND 7 | E320: 31ST MAY | J320: WEATHER | S320: PLAYED AT
D321: 1ST QTR | H321: 2ND QTR | L321: 3RD QTR | P321: FINAL | S321: MORDIALLOC
A322: PRAHRAN | C322: 10 | D322: 4 | E322: =C322*6+D322 -> 64 | G322: 18 | H322: 8 | I322: =G322*6+H322 -> 116 | K322: 26 | L322: 9 | M322: =K322*6+L322 -> 165 | O322: 30 | P322: 13 | Q322: =O322*6+P322 -> 193 | S322: UMPIRE | X322: LADDER | AB322: ROUND | AD322: 7
A323: MORDIALLOC | C323: 3 | D323: 2 | E323: =C323*6+D323 -> 20 | G323: 3 | H323: 7 | I323: =G323*6+H323 -> 25 | K323: 5 | L323: 7 | M323: =K323*6+L323 -> 37 | O323: 7 | P323: 11 | Q323: =O323*6+P323 -> 53 | S323: BRADSHAW/HARVEY
A324: BEST PLAYERS | W324: TEAM | X324: W | Y324: L | Z324: D | AA324: FOR | AB324: AGST | AC324: % | AD324: PTS
A325: PRAHRAN | C325: BINGHAM | F325: MAZUREK | I325: TAPPING | L325: HIPWORTH | O325: ELLETT | R325: SOULOS
A326: MORDIALLOC | C326: HESS | F326: JONES | I326: ALDRIDGE | L326: BROOKING | O326: NICHOLAIDES | R326: DAVIDSON | W326: WERRIBEE | X326: 7 | Y326: 0 | Z326: 0 | AA326: 868 | AB326: 545 | AC326: =(AA326*100)/AB326 -> 159.26605504587155 | AD326: =(X326*4)+(Z326*2) -> 28
A327: GOALKICKERS | P327: TORCASIO | R327: FIELDING | W327: WAVERLEY | X327: 6 | Y327: 1 | Z327: 0 | AA327: 844 | AB327: 523 | AC327: =(AA327*100)/AB327 -> 161.37667304015295 | AD327: =(X327*4)+(Z327*2) -> 24
A328: PRAHRAN | C328: HIPWORTH 7 | F328: SOULOS 6 | H328: BINGHAM 6 | K328: TAPPING 4 | N328: BENHAM 2 | P328: TAYLOR | R328: CUTLER | T328: MAZUREK | W328: SUNSHINE | X328: 6 | Y328: 1 | Z328: 0 | AA328: 814 | AB328: 544 | AC328: =(AA328*100)/AB328 -> 149.63235294117646 | AD328: =(X328*4)+(Z328*2) -> 24
A329: MORDIALLOC | C329: POLA 2 | E329: A COFFEY 2 | H329: P EVANS | J329: ALDRIDGE | M329: CRAWFORD | W329: DANDENONG | X329: 5 | Y329: 2 | Z329: 0 | AA329: 751 | AB329: 509 | AC329: =(AA329*100)/AB329 -> 147.54420432220039 | AD329: =(X329*4)+(Z329*2) -> 20
A331: SUNSHINE | C331: 10 | D331: 9 | E331: =C331*6+D331 -> 69 | G331: 15 | H331: 13 | I331: =G331*6+H331 -> 103 | K331: 27 | L331: 18 | M331: =K331*6+L331 -> 180 | O331: 37 | P331: 26 | Q331: =O331*6+P331 -> 248 | S331: PRINCES PARK, CAULFIELD | W331: CAMBERWELL | X331: 5 | Y331: 2 | Z331: 0 | AA331: 911 | AB331: 623 | AC331: =(AA331*100)/AB331 -> 146.2279293739968 | AD331: =(X331*4)+(Z331*2) -> 20
A332: CAULFIELD | C332: 1 | D332: 4 | E332: =C332*6+D332 -> 10 | G332: 5 | H332: 6 | I332: =G332*6+H332 -> 36 | K332: 7 | L332: 11 | M332: =K332*6+L332 -> 53 | O332: 9 | P332: 14 | Q332: =O332*6+P332 -> 68 | S332: GLEESON | W332: PRAHRAN | X332: 4 | Y332: 3 | Z332: 0 | AA332: 950 | AB332: 660 | AC332: =(AA332*100)/AB332 -> 143.93939393939394 | AD332: =(X332*4)+(Z332*2) -> 16
A333: BEST PLAYERS | S333: OKEY | W333: OAKLEIGH | X333: 3 | Y333: 4 | Z333: 0 | AA333: 597 | AB333: 576 | AC333: =(AA333*100)/AB333 -> 103.64583333333333 | AD333: =(X333*4)+(Z333*2) -> 12
A334: SUNSHINE | C334: BROWN | F334: MITOVSKI | I334: PROTETTO | L334: SHEPPERBOTTOM | P334: COOKE | R334: SCHICCATANO | W334: MORDIALLOC | X334: 2 | Y334: 5 | Z334: 0 | AA334: 626 | AB334: 842 | AC334: =(AA334*100)/AB334 -> 74.346793349168649 | AD334: =(X334*4)+(Z334*2) -> 8
A335: CAULFIELD | C335: T VITACCA | F335: R VITACCA | I335: O'KEEFE | L335: D'ANGELO | P335: VENUTO | R335: CIRO | W335: NORTHCOTE | X335: 2 | Y335: 5 | Z335: 0 | AA335: 643 | AB335: 1193 | AC335: =(AA335*100)/AB335 -> 53.897736797988266 | AD335: =(X335*4)+(Z335*2) -> 8
A336: GOALKICKERS | K336: MENADUE | N336: ROBERTSON | Q336: PROTETTO | W336: BERWICK | X336: 1 | Y336: 6 | Z336: 0 | AA336: 652 | AB336: 1028 | AC336: =(AA336*100)/AB336 -> 63.424124513618679 | AD336: =(X336*4)+(Z336*2) -> 4
A337: SUNSHINE | C337: COOKE 10 | F337: SHEPPERBOTTOM 8 | J337: SCANLON 6 | M337: CUTAJAR 4 | O337: MITROVSKI 3 | R337: D JOHNSON 2 | U337: MAY | W337: CAULFIELD | X337: 1 | Y337: 6 | Z337: 0 | AA337: 417 | AB337: 1031 | AC337: =(AA337*100)/AB337 -> 40.446168768186226 | AD337: =(X337*4)+(Z337*2) -> 4
A338: CAULFIELD | C338: T VITACCA 5 | F338: R VITACCA 2 | I338: FIELD | K338: HOGAN
A340: DANDENONG | C340: 3 | D340: 5 | E340: =C340*6+D340 -> 23 | G340: 8 | H340: 8 | I340: =G340*6+H340 -> 56 | K340: 13 | L340: 13 | M340: =K340*6+L340 -> 91 | O340: 18 | P340: 17 | Q340: =O340*6+P340 -> 125 | S340: BERWICK
A341: BERWICK | C341: 3 | D341: 2 | E341: =C341*6+D341 -> 20 | G341: 4 | H341: 5 | I341: =G341*6+H341 -> 29 | K341: 8 | L341: 6 | M341: =K341*6+L341 -> 54 | O341: 11 | P341: 12 | Q341: =O341*6+P341 -> 78 | S341: BROOKE/WARD
A342: BEST PLAYERS
A343: DANDENONG | C343: FINN | F343: COLLARD | I343: MILLANE | L343: MARSHALL | O343: WRIGHT | R343: TUFO
A344: BERWICK | C344: ORSBORNE | F344: DEVINE | I344: SCOTT | L344: CROCKER | O344: MANNENS | R344: WRIGHT
A345: GOALKICKERS
A346: DANDENONG | C346: WRIGHT 6 | F346: HALL 2 | H346: TUFO 2 | J346: LACKO 2 | L346: BRUNNEN | N346: D'ARCY | P346: HOLDEN | R346: MILLIGAN | T346: MILLANE | W346: COLLARD
A347: BERWICK | C347: DAVIS 2 | F347: HUDSON | H347: CROCKER | J347: JOHNSON | L347: BREEN | N347: MANNENS | P347: DEVINE | R347: McGREAL | T347: SCOTT | V347: WRIGHT
A349: WERRIBEE | C349: 4 | D349: 5 | E349: =C349*6+D349 -> 29 | G349: 10 | H349: 11 | I349: =G349*6+H349 -> 71 | K349: 22 | L349: 15 | M349: =K349*6+L349 -> 147 | O349: 28 | P349: 18 | Q349: =O349*6+P349 -> 186 | S349: NORTHCOTE
A350: NORTHCOTE | C350: 2 | D350: 3 | E350: =C350*6+D350 -> 15 | G350: 5 | H350: 5 | I350: =G350*6+H350 -> 35 | K350: 7 | L350: 6 | M350: =K350*6+L350 -> 48 | O350: 11 | P350: 10 | Q350: =O350*6+P350 -> 76 | S350: HUTCHINSON/McEWAN
A351: BEST PLAYERS
A352: WERRIBEE | C352: D GRAY | F352: BROWN | I352: SMITH | L352: SINNOTT | O352: TAYLOR | R352: GUINTA
A353: NORTHCOTE | C353: BERTOLLO | F353: VENABLES | I353: COOK | L353: MITCHELL | O353: CANDY
A354: GOALKICKERS
A355: WERRIBEE | C355: TAYLOR 12 | F355: DUNSTON 3 | I355: GUINTA 3 | K355: FREEMAN 3 | N355: BROWN 3 | P355: MOLONEY 2 | S355: VASILOU 2 | V355: FRAZER
A356: NORTHCOTE | C356: MITCHELL 3 | F356: REARDON 2 | I356: LITTLE 2 | K356: BERTOLLO 2 | N356: STRANGWICK | Q356: EWING
A358: WAVERLEY | C358: 5 | D358: 0 | E358: =C358*6+D358 -> 30 | G358: 11 | H358: 5 | I358: =G358*6+H358 -> 71 | K358: 14 | L358: 7 | M358: =K358*6+L358 -> 91 | O358: 16 | P358: 12 | Q358: =O358*6+P358 -> 108 | S358: WAVERLEY
A359: OAKLEIGH | C359: 6 | D359: 4 | E359: =C359*6+D359 -> 40 | G359: 7 | H359: 5 | I359: =G359*6+H359 -> 47 | K359: 8 | L359: 10 | M359: =K359*6+L359 -> 58 | O359: 11 | P359: 13 | Q359: =O359*6+P359 -> 79 | S359: MITCHELL/WALKER
A360: BEST PLAYERS
A361: WAVERLEY | C361: CASTILLO | F361: KINNABURGH | I361: DE WITT | L361: ROGERSON | O361: McCORKELL | R361: PEARSON
A362: OAKLEIGH | C362: OWEN | F362: BATTERSBY | I362: ATHERTON | L362: CARAFA | O362: MARSHALL | R362: HILLIARD
A363: GOALKICKERS
A364: WAVERLEY | C364: COLE 4 | E364: BREWER 4 | G364: VEAR 2 | I364: BROOKS 2 | K364: STUART 2 | N364: TREMBATH | Q364: PEARSON
A365: OAKLEIGH | C365: PRETTO 4 | F365: BROWN 2 | H365: OWEN 2 | J365: CARAFA | L365: GARBUIO | N365: JOHNSON
A367: BYE | C367: CAMBERWELL
A369: ROUND 8 | E369: 14TH JUNE | J369: WEATHER | S369: PLAYED AT
D370: 1ST QTR | H370: 2ND QTR | L370: 3RD QTR | P370: FINAL | S370: PRINCES PARK, CAULFIELD
A371: WERRIBEE | C371: 4 | D371: 4 | E371: =C371*6+D371 -> 28 | G371: 14 | H371: 5 | I371: =G371*6+H371 -> 89 | K371: 19 | L371: 8 | M371: =K371*6+L371 -> 122 | O371: 23 | P371: 12 | Q371: =O371*6+P371 -> 150 | S371: UMPIRE | X371: LADDER | AB371: ROUND | AD371: 8
A372: CAULFIELD | C372: 4 | D372: 6 | E372: =C372*6+D372 -> 30 | G372: 9 | H372: 10 | I372: =G372*6+H372 -> 64 | K372: 19 | L372: 13 | M372: =K372*6+L372 -> 127 | O372: 21 | P372: 18 | Q372: =O372*6+P372 -> 144
A373: BEST PLAYERS | W373: TEAM | X373: W | Y373: L | Z373: D | AA373: FOR | AB373: AGST | AC373: % | AD373: PTS
A374: WERRIBEE
A375: CAULFIELD | W375: WERRIBEE | X375: 8 | Y375: 0 | Z375: 0 | AA375: 1018 | AB375: 689 | AC375: =(AA375*100)/AB375 -> 147.75036284470247 | AD375: =(X375*4)+(Z375*2) -> 32
A376: GOALKICKERS | W376: SUNSHINE | X376: 7 | Y376: 1 | Z376: 0 | AA376: 924 | AB376: 644 | AC376: =(AA376*100)/AB376 -> 143.47826086956522 | AD376: =(X376*4)+(Z376*2) -> 28
A377: WERRIBEE | W377: DANDENONG | X377: 6 | Y377: 2 | Z377: 0 | AA377: 1008 | AB377: 593 | AC377: =(AA377*100)/AB377 -> 169.98313659359189 | AD377: =(X377*4)+(Z377*2) -> 24
A378: CAULFIELD | W378: WAVERLEY | X378: 6 | Y378: 2 | Z378: 0 | AA378: 944 | AB378: 633 | AC378: =(AA378*100)/AB378 -> 149.13112164296999 | AD378: =(X378*4)+(Z378*2) -> 24
A380: SUNSHINE | C380: 4 | D380: 2 | E380: =C380*6+D380 -> 26 | G380: 6 | H380: 7 | I380: =G380*6+H380 -> 43 | K380: 11 | L380: 12 | M380: =K380*6+L380 -> 78 | O380: 16 | P380: 14 | Q380: =O380*6+P380 -> 110 | S380: SUNSHINE | W380: PRAHRAN | X380: 5 | Y380: 3 | Z380: 0 | AA380: 1184 | AB380: 723 | AC380: =(AA380*100)/AB380 -> 163.76210235131396 | AD380: =(X380*4)+(Z380*2) -> 20
A381: WAVERLEY | C381: 3 | D381: 3 | E381: =C381*6+D381 -> 21 | G381: 8 | H381: 8 | I381: =G381*6+H381 -> 56 | K381: 11 | L381: 11 | M381: =K381*6+L381 -> 77 | O381: 14 | P381: 16 | Q381: =O381*6+P381 -> 100 | W381: CAMBERWELL | X381: 5 | Y381: 3 | Z381: 0 | AA381: 1036 | AB381: 787 | AC381: =(AA381*100)/AB381 -> 131.63913595933926 | AD381: =(X381*4)+(Z381*2) -> 20
A382: BEST PLAYERS | W382: OAKLEIGH | X382: 4 | Y382: 4 | Z382: 0 | AA382: 761 | AB382: 701 | AC382: =(AA382*100)/AB382 -> 108.55920114122682 | AD382: =(X382*4)+(Z382*2) -> 16
A383: SUNSHINE | W383: MORDIALLOC | X383: 2 | Y383: 6 | Z383: 0 | AA383: 710 | AB383: 1099 | AC383: =(AA383*100)/AB383 -> 64.604185623293901 | AD383: =(X383*4)+(Z383*2) -> 8
A384: WAVERLEY | W384: BERWICK | X384: 2 | Y384: 6 | Z384: 0 | AA384: 652 | AB384: 1028 | AC384: =(AA384*100)/AB384 -> 63.424124513618679 | AD384: =(X384*4)+(Z384*2) -> 8
A385: GOALKICKERS | W385: NORTHCOTE | X385: 2 | Y385: 6 | Z385: 0 | AA385: 706 | AB385: 1427 | AC385: =(AA385*100)/AB385 -> 49.474421864050456 | AD385: =(X385*4)+(Z385*2) -> 8
A386: SUNSHINE | W386: CAULFIELD | X386: 1 | Y386: 7 | Z386: 0 | AA386: 561 | AB386: 1181 | AC386: =(AA386*100)/AB386 -> 47.50211685012701 | AD386: =(X386*4)+(Z386*2) -> 4
A387: WAVERLEY
A389: OAKLEIGH | C389: 6 | D389: 6 | E389: =C389*6+D389 -> 42 | G389: 11 | H389: 8 | I389: =G389*6+H389 -> 74 | K389: 16 | L389: 11 | M389: =K389*6+L389 -> 107 | O389: 25 | P389: 14 | Q389: =O389*6+P389 -> 164 | S389: OAKLEIGH
A390: CAMBERWELL | C390: 6 | D390: 0 | E390: =C390*6+D390 -> 36 | G390: 11 | H390: 6 | I390: =G390*6+H390 -> 72 | K390: 17 | L390: 8 | M390: =K390*6+L390 -> 110 | O390: 19 | P390: 11 | Q390: =O390*6+P390 -> 125
A391: BEST PLAYERS
A392: OAKLEIGH
A393: CAMBERWELL
A394: GOALKICKERS
A395: OAKLEIGH
A396: CAMBERWELL
A398: DANDENONG | C398: 7 | D398: 5 | E398: =C398*6+D398 -> 47 | G398: 11 | H398: 10 | I398: =G398*6+H398 -> 76 | K398: 26 | L398: 14 | M398: =K398*6+L398 -> 170 | O398: 40 | P398: 17 | Q398: =O398*6+P398 -> 257 | S398: DANDENONG
A399: MORDIALLOC | C399: 2 | D399: 4 | E399: =C399*6+D399 -> 16 | G399: 7 | H399: 9 | I399: =G399*6+H399 -> 51 | K399: 11 | L399: 10 | M399: =K399*6+L399 -> 76 | O399: 12 | P399: 12 | Q399: =O399*6+P399 -> 84
A400: BEST PLAYERS
A401: DANDENONG
A402: MORDIALLOC
A403: GOALKICKERS
A404: DANDENONG
A405: MORDIALLOC
A407: PRAHRAN | C407: 4 | D407: 8 | E407: =C407*6+D407 -> 32 | G407: 14 | H407: 15 | I407: =G407*6+H407 -> 99 | K407: 22 | L407: 18 | M407: =K407*6+L407 -> 150 | O407: 36 | P407: 18 | Q407: =O407*6+P407 -> 234 | S407: TOORAK PARK
A408: NORTHCOTE | C408: 3 | D408: 2 | E408: =C408*6+D408 -> 20 | G408: 6 | H408: 3 | I408: =G408*6+H408 -> 39 | K408: 8 | L408: 7 | M408: =K408*6+L408 -> 55 | O408: 9 | P408: 9 | Q408: =O408*6+P408 -> 63
A409: BEST PLAYERS
A410: PRAHRAN
A411: NORTHCOTE
A412: GOALKICKERS
A413: PRAHRAN
A414: NORTHCOTE
A416: BYE | C416: BERWICK
A418: ROUND 9 | E418: 21ST JUNE | J418: WEATHER | S418: PLAYED AT
D419: 1ST QTR | H419: 2ND QTR | L419: 3RD QTR | P419: FINAL | S419: CAMBERWELL
A420: CAMBERWELL | C420: 4 | D420: 4 | E420: =C420*6+D420 -> 28 | G420: 8 | H420: 9 | I420: =G420*6+H420 -> 57 | K420: 16 | L420: 17 | M420: =K420*6+L420 -> 113 | O420: 21 | P420: 19 | Q420: =O420*6+P420 -> 145 | S420: UMPIRE | X420: LADDER | AB420: ROUND | AD420: 9
A421: SUNSHINE | C421: 6 | D421: 4 | E421: =C421*6+D421 -> 40 | G421: 10 | H421: 10 | I421: =G421*6+H421 -> 70 | K421: 15 | L421: 12 | M421: =K421*6+L421 -> 102 | O421: 20 | P421: 18 | Q421: =O421*6+P421 -> 138 | S421: TURNER/NOLAN
A422: BEST PLAYERS | W422: TEAM | X422: W | Y422: L | Z422: D | AA422: FOR | AB422: AGST | AC422: % | AD422: PTS
A423: CAMBERWELL | C423: CONSTANTINOU | F423: WHALEN | I423: FREW | L423: J WILLIAMS | O423: MAILING | R423: JAKOBI
A424: SUNSHINE | C424: MOSS | F424: TAYLOR | I424: MENADUE | L424: CADDAYE | O424: BROWN | R424: MITROVSKI | W424: WERRIBEE | X424: 8 | Y424: 1 | Z424: 0 | AA424: 1102 | AB424: 775 | AC424: =(AA424*100)/AB424 -> 142.19354838709677 | AD424: =(X424*4)+(Z424*2) -> 32
A425: GOALKICKERS | Q425: MULLENS | W425: DANDENONG | X425: 7 | Y425: 2 | Z425: 0 | AA425: 1165 | AB425: 671 | AC425: =(AA425*100)/AB425 -> 173.6214605067064 | AD425: =(X425*4)+(Z425*2) -> 28
A426: CAMBERWELL | C426: FRAZER 5 | F426: JAKOBI 5 | H426: WHALEN 4 | K426: J WILLIAMS 2 | N426: CONSTANTINOU 2 | R426: FREW | T426: A SAMIOS | W426: WAVERLEY | X426: 7 | Y426: 2 | Z426: 0 | AA426: 1174 | AB426: 706 | AC426: =(AA426*100)/AB426 -> 166.28895184135976 | AD426: =(X426*4)+(Z426*2) -> 28
A427: SUNSHINE | C427: CADDAYE 7 | F427: SHEPPERBOTTOM 4 | J427: JOHNSON 2 | L427: PROTETTO 2 | O427: CLEGG | Q427: CUTAJAR | S427: COOKE | U427: TAYLOR | W427: SUNSHINE | X427: 7 | Y427: 2 | Z427: 0 | AA427: 1062 | AB427: 789 | AC427: =(AA427*100)/AB427 -> 134.60076045627378 | AD427: =(X427*4)+(Z427*2) -> 28
Q428: SCANLON
A429: WAVERLEY | C429: 3 | D429: 7 | E429: =C429*6+D429 -> 25 | G429: 20 | H429: 10 | I429: =G429*6+H429 -> 130 | K429: 26 | L429: 16 | M429: =K429*6+L429 -> 172 | O429: 35 | P429: 20 | Q429: =O429*6+P429 -> 230 | S429: PRINCES PARK, CAULFIELD | W429: PRAHRAN | X429: 6 | Y429: 3 | Z429: 0 | AA429: 1270 | AB429: 807 | AC429: =(AA429*100)/AB429 -> 157.37298636926889 | AD429: =(X429*4)+(Z429*2) -> 24
A430: CAULFIELD | C430: 4 | D430: 5 | E430: =C430*6+D430 -> 29 | G430: 6 | H430: 7 | I430: =G430*6+H430 -> 43 | K430: 9 | L430: 7 | M430: =K430*6+L430 -> 61 | O430: 10 | P430: 13 | Q430: =O430*6+P430 -> 73 | S430: ANASTASI | W430: CAMBERWELL | X430: 6 | Y430: 3 | Z430: 0 | AA430: 1181 | AB430: 925 | AC430: =(AA430*100)/AB430 -> 127.67567567567568 | AD430: =(X430*4)+(Z430*2) -> 24
A431: BEST PLAYERS | S431: BRADY | W431: OAKLEIGH | X431: 5 | Y431: 4 | Z431: 0 | AA431: 935 | AB431: 785 | AC431: =(AA431*100)/AB431 -> 119.10828025477707 | AD431: =(X431*4)+(Z431*2) -> 20
A432: WAVERLEY | C432: ROGERSON | F432: CASTILLO | I432: PEARSON | L432: BREWER | O432: KENDALL | R432: COLE | W432: MORDIALLOC | X432: 3 | Y432: 6 | Z432: 0 | AA432: 710 | AB432: 1099 | AC432: =(AA432*100)/AB432 -> 64.604185623293901 | AD432: =(X432*4)+(Z432*2) -> 12
A433: CAULFIELD | C433: NOT SUPPLIED | W433: BERWICK | X433: 2 | Y433: 7 | Z433: 0 | AA433: 736 | AB433: 1202 | AC433: =(AA433*100)/AB433 -> 61.23128119800333 | AD433: =(X433*4)+(Z433*2) -> 8
A434: GOALKICKERS | L434: SCHLIEGER 2 | N434: KINNABURGH | Q434: SHAW | W434: NORTHCOTE | X434: 2 | Y434: 7 | Z434: 0 | AA434: 784 | AB434: 1584 | AC434: =(AA434*100)/AB434 -> 49.494949494949495 | AD434: =(X434*4)+(Z434*2) -> 8
A435: WAVERLEY | C435: BREWER 8 | F435: COLE 7 | H435: CSOTI 5 | J435: DE WITT 4 | M435: HUNT 3 | O435: PEARSON 2 | Q435: WHALEN 2 | W435: CAULFIELD | X435: 1 | Y435: 8 | Z435: 0 | AA435: 634 | AB435: 1411 | AC435: =(AA435*100)/AB435 -> 44.932671863926295 | AD435: =(X435*4)+(Z435*2) -> 4
A436: CAULFIELD | C436: LOGAN 2 | E436: T VITACCA 2 | H436: O'KEEFE | J436: HOGAN | L436: MILLS | N436: YOUNG | P436: GODAU | R436: ALMATRAH
A438: DANDENONG | C438: 2 | D438: 3 | E438: =C438*6+D438 -> 15 | G438: 9 | H438: 6 | I438: =G438*6+H438 -> 60 | K438: 13 | L438: 14 | M438: =K438*6+L438 -> 92 | O438: 23 | P438: 19 | Q438: =O438*6+P438 -> 157 | S438: NORTHCOTE
A439: NORTHCOTE | C439: 4 | D439: 5 | E439: =C439*6+D439 -> 29 | G439: 7 | H439: 6 | I439: =G439*6+H439 -> 48 | K439: 9 | L439: 9 | M439: =K439*6+L439 -> 63 | O439: 11 | P439: 12 | Q439: =O439*6+P439 -> 78 | S439: BRADY/MITCHELL
A440: BEST PLAYERS
A441: DANDENONG | C441: MARSHALL | F441: TUFO | I441: WRIGHT | L441: HOLDEN | O441: GRAHAM | R441: HALL
A442: NORTHCOTE | C442: VENABLES | F442: COURTS | I442: REARDON | L442: SPROAT | O442: EWING | R442: HUME
A443: GOALKICKERS
A444: DANDENONG | C444: WRIGHT 10 | F444: TUFO 5 | H444: GRAHAM 3 | K444: HALL 2 | M444: BRUNNEN | O444: HOLDEN | Q444: PALLANT
A445: NORTHCOTE | C445: REARDON 3 | F445: D'ATN 2 | H445: HUME | J445: SPROAT | L445: MITCHELL | N445: CANDY | P445: BERTOLLO | S445: DEVLIN
A447: OAKLEIGH | C447: 3 | D447: 0 | E447: =C447*6+D447 -> 18 | G447: 12 | H447: 1 | I447: =G447*6+H447 -> 73 | K447: 17 | L447: 12 | M447: =K447*6+L447 -> 114 | O447: 26 | P447: 18 | Q447: =O447*6+P447 -> 174 | S447: BERWICK
A448: BERWICK | C448: 7 | D448: 3 | E448: =C448*6+D448 -> 45 | G448: 9 | H448: 5 | I448: =G448*6+H448 -> 59 | K448: 11 | L448: 6 | M448: =K448*6+L448 -> 72 | O448: 13 | P448: 6 | Q448: =O448*6+P448 -> 84 | S448: BLACK/G HUTCHINSON
A449: BEST PLAYERS
A450: OAKLEIGH | C450: ROURKE | F450: CUNNINGHAM | I450: OWEN | L450: GARBUIO | P450: HILLIARD | S450: SCOTT
A451: BERWICK | C451: VERSHUUR | F451: M JOHNSON | I451: DEVINE | L451: ORSBORNE | P451: S JOHNSON
A452: GOALKICKERS
A453: OAKLEIGH | C453: PRETTO 7 | F453: OWEN 4 | H453: GARBUIO 3 | K453: HILLIARD 3 | N453: ROURKE 2 | P453: VERBEEK 2 | S453: JOHNSON 2 | V453: SIMPSON | X453: WALL | Z453: RYAN
A454: BERWICK | C454: VERSHUUR 4 | F454: DAVIS 3 | H454: TRIGG | J454: CROCKER | M454: WRIGHT | O454: DEVINE | Q454: BREEN | S454: ORSBORNE
A456: PRAHRAN | C456: 2 | D456: 5 | E456: =C456*6+D456 -> 17 | G456: 2 | H456: 11 | I456: =G456*6+H456 -> 23 | K456: 8 | L456: 12 | M456: =K456*6+L456 -> 60 | O456: 12 | P456: 14 | Q456: =O456*6+P456 -> 86 | S456: WERRIBEE
A457: WERRIBEE | C457: 3 | D457: 2 | E457: =C457*6+D457 -> 20 | G457: 9 | H457: 6 | I457: =G457*6+H457 -> 60 | K457: 10 | L457: 11 | M457: =K457*6+L457 -> 71 | O457: 12 | P457: 12 | Q457: =O457*6+P457 -> 84 | S457: CARUSO/GLEESON
A458: BEST PLAYERS
A459: PRAHRAN | C459: WALDER | F459: G GILES | I459: TORCASIO | L459: TAYLOR | O459: TAPPING | R459: SOULOS
A460: WERRIBEE | C460: WALPOLE | F460: FREEMAN | I460: VASILOU | L460: SINNOTT | O460: GREY
A461: GOALKICKERS
A462: PRAHRAN | C462: BINGHAM 3 | F462: WALFORD 2 | I462: SOULOS | K462: MAZUREK | N462: TAPPING | P462: TORCASIO | R462: WALDER | T462: TAYLOR | V462: S GILES
A463: WERRIBEE | C463: GREY 3 | E463: GUINTA 2 | G463: VASILOU 2 | J463: S MOLONEY 2 | M463: FREEMAN | O463: DUNSTON | R463: JACKSON
A465: BYE | C465: MORDIALLOC
A467: ROUND 10 | E467: 28TH JUNE | J467: WEATHER | S467: PLAYED AT
D468: 1ST QTR | H468: 2ND QTR | L468: 3RD QTR | P468: FINAL | S468: WAVERLEY
A469: WAVERLEY | C469: 6 | D469: 7 | E469: =C469*6+D469 -> 43 | G469: 8 | H469: 11 | I469: =G469*6+H469 -> 59 | K469: 10 | L469: 15 | M469: =K469*6+L469 -> 75 | O469: 13 | P469: 18 | Q469: =O469*6+P469 -> 96 | S469: UMPIRE | X469: LADDER | AB469: ROUND | AD469: 10
A470: WERRIBEE | C470: 2 | D470: 1 | E470: =C470*6+D470 -> 13 | G470: 2 | H470: 2 | I470: =G470*6+H470 -> 14 | K470: 3 | L470: 3 | M470: =K470*6+L470 -> 21 | O470: 5 | P470: 6 | Q470: =O470*6+P470 -> 36 | S470: MITCHELL/NOLAN
A471: BEST PLAYERS | W471: TEAM | X471: W | Y471: L | Z471: D | AA471: FOR | AB471: AGST | AC471: % | AD471: PTS
A472: WAVERLEY | C472: SHAW | F472: KINNABURGH | I472: ROGERSON | L472: PEARSON | O472: COLE | R472: VEAR
A473: WERRIBEE | C473: BROWN | F473: SINNOTT | I473: B MOLONEY | L473: SLATTERY | O473: MORRIS | R473: BONAT | W473: WAVERLEY | X473: 8 | Y473: 2 | Z473: 0 | AA473: 1270 | AB473: 742 | AC473: =(AA473*100)/AB473 -> 171.15902964959568 | AD473: =(X473*4)+(Z473*2) -> 32
A474: GOALKICKERS | W474: SUNSHINE | X474: 8 | Y474: 2 | Z474: 0 | AA474: 1271 | AB474: 846 | AC474: =(AA474*100)/AB474 -> 150.23640661938535 | AD474: =(X474*4)+(Z474*2) -> 32
A475: WAVERLEY | C475: COLE 3 | E475: BREWER 2 | G475: CSOTI 2 | I475: KINNABURGH 2 | L475: SCHLIEGER | N475: KENDALL | P475: PEARSON | R475: HUNT | W475: WERRIBEE | X475: 8 | Y475: 2 | Z475: 0 | AA475: 1138 | AB475: 871 | AC475: =(AA475*100)/AB475 -> 130.65442020665901 | AD475: =(X475*4)+(Z475*2) -> 32
A476: WERRIBEE | C476: SLATTERY 2 | F476: JACKSON | I476: FREEMAN | L476: BROWN | W476: DANDENONG | X476: 7 | Y476: 3 | Z476: 0 | AA476: 1246 | AB476: 770 | AC476: =(AA476*100)/AB476 -> 161.81818181818181 | AD476: =(X476*4)+(Z476*2) -> 28
A478: CAMBERWELL | C478: 2 | D478: 4 | E478: =C478*6+D478 -> 16 | G478: 6 | H478: 9 | I478: =G478*6+H478 -> 45 | K478: 9 | L478: 17 | M478: =K478*6+L478 -> 71 | O478: 12 | P478: 22 | Q478: =O478*6+P478 -> 94 | S478: PRINCES PARK, CAULFIELD | W478: PRAHRAN | X478: 7 | Y478: 3 | Z478: 0 | AA478: 1369 | AB478: 888 | AC478: =(AA478*100)/AB478 -> 154.16666666666666 | AD478: =(X478*4)+(Z478*2) -> 28
A479: CAULFIELD | C479: 4 | D479: 1 | E479: =C479*6+D479 -> 25 | G479: 5 | H479: 3 | I479: =G479*6+H479 -> 33 | K479: 11 | L479: 4 | M479: =K479*6+L479 -> 70 | O479: 13 | P479: 7 | Q479: =O479*6+P479 -> 85 | S479: ANASTASI | W479: CAMBERWELL | X479: 7 | Y479: 3 | Z479: 0 | AA479: 1275 | AB479: 1010 | AC479: =(AA479*100)/AB479 -> 126.23762376237623 | AD479: =(X479*4)+(Z479*2) -> 28
A480: BEST PLAYERS | S480: BRADY | W480: OAKLEIGH | X480: 6 | Y480: 4 | Z480: 0 | AA480: 1123 | AB480: 837 | AC480: =(AA480*100)/AB480 -> 134.16965352449225 | AD480: =(X480*4)+(Z480*2) -> 24
A481: CAMBERWELL | C481: BOWLER | F481: WHALEN | I481: FREW | K481: ANGUS | N481: CONSTANTINOU | R481: SIMMONS | W481: MORDIALLOC | X481: 3 | Y481: 7 | Z481: 0 | AA481: 762 | AB481: 1287 | AC481: =(AA481*100)/AB481 -> 59.207459207459209 | AD481: =(X481*4)+(Z481*2) -> 12
A482: CAULFIELD | C482: EINSEDEL | F482: BROUGHILL | I482: MILLS | K482: CORBETT | N482: VENUTO | R482: HOGAN | W482: NORTHCOTE | X482: 3 | Y482: 7 | Z482: 0 | AA482: 784 | AB482: 1584 | AC482: =(AA482*100)/AB482 -> 49.494949494949495 | AD482: =(X482*4)+(Z482*2) -> 12
A483: GOALKICKERS | W483: BERWICK | X483: 2 | Y483: 8 | Z483: 0 | AA483: 793 | AB483: 1411 | AC483: =(AA483*100)/AB483 -> 56.201275690999289 | AD483: =(X483*4)+(Z483*2) -> 8
A484: CAMBERWELL | C484: FREW 4 | F484: FRAZER 2 | H484: WHALEN 2 | K484: ANGUS 2 | N484: J WILLIAMS | Q484: STEINER | W484: CAULFIELD | X484: 1 | Y484: 9 | Z484: 0 | AA484: 719 | AB484: 1505 | AC484: =(AA484*100)/AB484 -> 47.774086378737543 | AD484: =(X484*4)+(Z484*2) -> 4
A485: CAULFIELD | C485: FIELD 4 | F485: CIRO 2 | H485: HOGAN 2 | J485: O'KEEFE 2 | L485: GODAU 2 | N485: R VITACCA
A487: SUNSHINE | C487: 11 | D487: 7 | E487: =C487*6+D487 -> 73 | G487: 17 | H487: 12 | I487: =G487*6+H487 -> 114 | K487: 27 | L487: 19 | M487: =K487*6+L487 -> 181 | O487: 31 | P487: 23 | Q487: =O487*6+P487 -> 209 | S487: SUNSHINE
A488: BERWICK | C488: 1 | D488: 1 | E488: =C488*6+D488 -> 7 | G488: 3 | H488: 3 | I488: =G488*6+H488 -> 21 | K488: 4 | L488: 5 | M488: =K488*6+L488 -> 29 | O488: 8 | P488: 9 | Q488: =O488*6+P488 -> 57 | S488: CARUSO/GLEESON
A489: BEST PLAYERS
A490: SUNSHINE | C490: CUTAJAR | F490: CADDAYE | I490: GIBB | K490: WAGLAND | N490: MENADUE | Q490: TAYLOR
A491: BERWICK | C491: McDONALD | F491: TRIGG | I491: ORSBORNE | L491: DAVIS | N491: CROCKER | Q491: PRICE
A492: GOALKICKERS | S492: CUTAJAR | V492: BROWN
A493: SUNSHINE | C493: LITCHFIELD 8 | F493: WAGLAND 5 | I493: CADDAYE 4 | K493: CLEGG 2 | M493: TAYLOR 2 | O493: SHEPPERBOTTOM 2 | S493: JOHNSON 2 | V493: McQUALTER | X493: PROTETTO | Z493: MITROVSKI | AB493: SCANLON
A494: BERWICK | C494: TRIGG 2 | E494: CROCKER 2 | G494: TRAIT | I494: SCOTT | K494: MANNENS | N494: DAVIS
A496: OAKLEIGH | C496: 8 | D496: 1 | E496: =C496*6+D496 -> 49 | G496: 15 | H496: 7 | I496: =G496*6+H496 -> 97 | K496: 23 | L496: 8 | M496: =K496*6+L496 -> 146 | O496: 29 | P496: 14 | Q496: =O496*6+P496 -> 188 | S496: OAKLEIGH
A497: MORDIALLOC | C497: 3 | D497: 2 | E497: =C497*6+D497 -> 20 | G497: 4 | H497: 2 | I497: =G497*6+H497 -> 26 | K497: 7 | L497: 4 | M497: =K497*6+L497 -> 46 | O497: 8 | P497: 4 | Q497: =O497*6+P497 -> 52 | S497: WARD/RIDDIFORD
A498: BEST PLAYERS
A499: OAKLEIGH | C499: OWEN | F499: VERBEEK | I499: CUNNINGHAM | L499: ROURKE | O499: WALSH | R499: SUTHERLAND
A500: MORDIALLOC | C500: ZAPPA | F500: ROSS | I500: ALDRIDGE | L500: POLA | O500: EVANS | R500: CASTLES
A501: GOALKICKERS
A502: OAKLEIGH | C502: OWEN 10 | F502: PRETTO 7 | H502: SIMPSON 4 | K502: WALL 2 | M502: GARBUIO 2 | O502: SUTHERLAND 2 | R502: ROURKE | T502: HILLIARD
A503: MORDIALLOC | C503: ALDRIDGE 3 | F503: COFFEY 2 | I503: EVANS | K503: MARGHERITI | N503: CRAWFORD
A505: PRAHRAN | C505: 7 | D505: 4 | E505: =C505*6+D505 -> 46 | G505: 9 | H505: 5 | I505: =G505*6+H505 -> 59 | K505: 10 | L505: 11 | M505: =K505*6+L505 -> 71 | O505: 14 | P505: 15 | Q505: =O505*6+P505 -> 99 | S505: DANDENONG
A506: DANDENONG | C506: 3 | D506: 1 | E506: =C506*6+D506 -> 19 | G506: 5 | H506: 4 | I506: =G506*6+H506 -> 34 | K506: 9 | L506: 11 | M506: =K506*6+L506 -> 65 | O506: 11 | P506: 15 | Q506: =O506*6+P506 -> 81 | S506: BROOKS/HUTCHINSON
A507: BEST PLAYERS
A508: PRAHRAN | C508: WALDER | F508: SOULOS | I508: HUTCHISON | L508: S GILES | O508: ELLETT | R508: REYNOLDS
A509: DANDENONG | C509: MERRIGAN | F509: TUFO | I509: HALL | L509: LINDSAY | O509: WRIGHT | R509: KAYE
A510: GOALKICKERS
A511: PRAHRAN | C511: BINGHAM 3 | F511: SOULOS 3 | H511: REYNOLDS 2 | K511: CUTLER 2 | N511: G GILES | P511: WALDER | R511: HAMILTON | T511: HUTCHISON
A512: DANDENONG | C512: METE 5 | F512: TUFO 3 | I512: LINDSAY | L512: LACKO | N512: HOLDEN
A514: BYE | C514: NORTHCOTE
A516: ROUND 11 | E516: 5TH JULY | J516: WEATHER | S516: PLAYED AT
D517: 1ST QTR | H517: 2ND QTR | L517: 3RD QTR | P517: FINAL | S517: CAMBERWELL
A518: WAVERLEY | C518: 4 | D518: 4 | E518: =C518*6+D518 -> 28 | G518: 14 | H518: 9 | I518: =G518*6+H518 -> 93 | K518: 22 | L518: 9 | M518: =K518*6+L518 -> 141 | O518: 28 | P518: 13 | Q518: =O518*6+P518 -> 181 | S518: UMPIRE | X518: LADDER | AB518: ROUND | AD518: 11
A519: CAMBERWELL | C519: 4 | D519: 2 | E519: =C519*6+D519 -> 26 | G519: 7 | H519: 4 | I519: =G519*6+H519 -> 46 | K519: 11 | L519: 5 | M519: =K519*6+L519 -> 71 | O519: 16 | P519: 7 | Q519: =O519*6+P519 -> 103 | S519: GLEESON/HUTCHISON
A520: BEST PLAYERS | W520: TEAM | X520: W | Y520: L | Z520: D | AA520: FOR | AB520: AGST | AC520: % | AD520: PTS
A521: WAVERLEY | C521: DE WITT | F521: ROGERSON | I521: PEARSON | L521: BREWER | O521: TREMBATH | R521: PALLOTTA
A522: CAMBERWELL | C522: SIMMONS | F522: CONDON | I522: MAILING | L522: BOWLER | O522: CONSTANTINOU | W522: WAVERLEY | X522: 9 | Y522: 2 | Z522: 0 | AA522: 1451 | AB522: 845 | AC522: =(AA522*100)/AB522 -> 171.71597633136093 | AD522: =(X522*4)+(Z522*2) -> 36
A523: GOALKICKERS | W523: SUNSHINE | X523: 9 | Y523: 2 | Z523: 0 | AA523: 1410 | AB523: 959 | AC523: =(AA523*100)/AB523 -> 147.0281543274244 | AD523: =(X523*4)+(Z523*2) -> 36
A524: WAVERLEY | C524: BREWER 10 | F524: COLE 5 | H524: HUNT 4 | J524: CSOTI 3 | L524: KENDALL 2 | O524: SCHLIEGER | R524: TREMBATH | T524: HARRISON | W524: WERRIBEE | X524: 9 | Y524: 2 | Z524: 0 | AA524: 1262 | AB524: 981 | AC524: =(AA524*100)/AB524 -> 128.64424057084608 | AD524: =(X524*4)+(Z524*2) -> 36
A525: CAMBERWELL | C525: FRAZER 3 | F525: BAIN 3 | H525: JAKOBI 3 | J525: CONDON 2 | L525: STEINER 2 | N525: P SAMIOS | P525: A SAMIOS | R525: CONSTANTINOU | W525: PRAHRAN | X525: 8 | Y525: 3 | Z525: 0 | AA525: 1369 | AB525: 888 | AC525: =(AA525*100)/AB525 -> 154.16666666666666 | AD525: =(X525*4)+(Z525*2) -> 32
A527: OAKLEIGH | C527: 9 | D527: 5 | E527: =C527*6+D527 -> 59 | G527: 17 | H527: 10 | I527: =G527*6+H527 -> 112 | K527: 28 | L527: 14 | M527: =K527*6+L527 -> 182 | O527: 37 | P527: 21 | Q527: =O527*6+P527 -> 243 | S527: NORTHCOTE | W527: OAKLEIGH | X527: 7 | Y527: 4 | Z527: 0 | AA527: 1366 | AB527: 878 | AC527: =(AA527*100)/AB527 -> 155.58086560364464 | AD527: =(X527*4)+(Z527*2) -> 28
A528: NORTHCOTE | C528: 0 | D528: 5 | E528: =C528*6+D528 -> 5 | G528: 3 | H528: 8 | I528: =G528*6+H528 -> 26 | K528: 4 | L528: 10 | M528: =K528*6+L528 -> 34 | O528: 5 | P528: 11 | Q528: =O528*6+P528 -> 41 | S528: CARUSO | W528: DANDENONG | X528: 7 | Y528: 4 | Z528: 0 | AA528: 1356 | AB528: 894 | AC528: =(AA528*100)/AB528 -> 151.6778523489933 | AD528: =(X528*4)+(Z528*2) -> 28
A529: BEST PLAYERS | S529: BROOKS | W529: CAMBERWELL | X529: 7 | Y529: 4 | Z529: 0 | AA529: 1378 | AB529: 1191 | AC529: =(AA529*100)/AB529 -> 115.70109151973132 | AD529: =(X529*4)+(Z529*2) -> 28
A530: OAKLEIGH | C530: ATHERTON | F530: PRETTO | I530: CUNNINGHAM | L530: VERBEEK | O530: ROURKE | R530: WALSH | W530: MORDIALLOC | X530: 3 | Y530: 8 | Z530: 0 | AA530: 875 | AB530: 1426 | AC530: =(AA530*100)/AB530 -> 61.360448807854141 | AD530: =(X530*4)+(Z530*2) -> 12
A531: NORTHCOTE | C531: TILBER | F531: REARDON | I531: SPROAT | L531: ELMS | O531: PIERCE | R531: COURTS | W531: BERWICK | X531: 3 | Y531: 8 | Z531: 0 | AA531: 916 | AB531: 1493 | AC531: =(AA531*100)/AB531 -> 61.35298057602143 | AD531: =(X531*4)+(Z531*2) -> 12
A532: GOALKICKERS | P532: JOHNSON | W532: NORTHCOTE | X532: 3 | Y532: 8 | Z532: 0 | AA532: 825 | AB532: 1827 | AC532: =(AA532*100)/AB532 -> 45.155993431855499 | AD532: =(X532*4)+(Z532*2) -> 12
A533: OAKLEIGH | C533: PRETTO 15 | F533: SIMPSON 11 | I533: VERBEEK 3 | K533: HILLIARD 2 | N533: OWEN 2 | P533: WALL | R533: MARSHALL | T533: GARBUIO | W533: CAULFIELD | X533: 1 | Y533: 10 | Z533: 0 | AA533: 801 | AB533: 1628 | AC533: =(AA533*100)/AB533 -> 49.201474201474198 | AD533: =(X533*4)+(Z533*2) -> 4
A534: NORTHCOTE | C534: DEVLIN 3 | F534: PANJARI | I534: REARDON
A536: SUNSHINE | C536: 1 | D536: 7 | E536: =C536*6+D536 -> 13 | G536: 8 | H536: 10 | I536: =G536*6+H536 -> 58 | K536: 13 | L536: 11 | M536: =K536*6+L536 -> 89 | O536: 20 | P536: 19 | Q536: =O536*6+P536 -> 139 | S536: MORDIALLOC
A537: MORDIALLOC | C537: 3 | D537: 3 | E537: =C537*6+D537 -> 21 | G537: 7 | H537: 5 | I537: =G537*6+H537 -> 47 | K537: 16 | L537: 7 | M537: =K537*6+L537 -> 103 | O537: 17 | P537: 11 | Q537: =O537*6+P537 -> 113 | S537: ANASTASI/CURREN
A538: BEST PLAYERS
A539: SUNSHINE | C539: JOHNSON | F539: McQUALTER | I539: CALDWELL | L539: BROWN | O539: PROTETTO | R539: SHEPPERBOTTOM
A540: MORDIALLOC | C540: P EVANS | F540: POLA | I540: NICHOLAIDES | L540: ZAPPA | O540: ALDRIDGE | R540: ROSENBROCK
A541: GOALKICKERS
A542: SUNSHINE | C542: SHEPPERBOTTOM 7 | G542: BROWN 3 | I542: SCANLON 2 | K542: COOKE 2 | M542: CATARNO 2 | O542: FORBES 2 | Q542: MOSS | S542: PROTETTO
A543: MORDIALLOC | C543: POLA 6 | E543: M GARDINER 3 | H543: P EVANS 2 | K543: ALDRIDGE | N543: WHYTE | P543: ZAPPA | R543: BROMLEY | T543: NICHOLAIDES | W543: HESS
A545: BERWICK | C545: 5 | D545: 8 | E545: =C545*6+D545 -> 38 | G545: 9 | H545: 10 | I545: =G545*6+H545 -> 64 | K545: 11 | L545: 14 | M545: =K545*6+L545 -> 80 | O545: 17 | P545: 21 | Q545: =O545*6+P545 -> 123 | S545: BERWICK
A546: CAULFIELD | C546: 3 | D546: 3 | E546: =C546*6+D546 -> 21 | G546: 6 | H546: 7 | I546: =G546*6+H546 -> 43 | K546: 10 | L546: 8 | M546: =K546*6+L546 -> 68 | O546: 12 | P546: 10 | Q546: =O546*6+P546 -> 82 | S546: NOLAN/RIDDIFORD
A547: BEST PLAYERS
A548: BERWICK | C548: TRIGG | F548: BREEN | I548: WRIGHT | L548: CROCKER | O548: McGREAL
A549: CAULFIELD | C549: BROUGHILL | F549: EINSEDEL | I549: HOGAN | L549: ALMATRAH | O549: LARKIN
A550: GOALKICKERS
A551: BERWICK | C551: BREEN 4 | E551: McGILL 3 | G551: McGREAL 3 | I551: RUNDELL 2 | K551: CROCKER 2 | N551: DEVINE | P551: TRIGG | R551: VERSHUUR
A552: CAULFIELD | C552: R VITACCA 2 | F552: T VITACCA 2 | I552: HOGAN 2 | K552: S WHITE | M552: ALMATRAH | P552: BROUGHILL | S552: FIELD | U552: NOLAN | W552: O'KEEFE
A554: WERRIBEE | C554: 6 | D554: 3 | E554: =C554*6+D554 -> 39 | G554: 10 | H554: 4 | I554: =G554*6+H554 -> 64 | K554: 17 | L554: 7 | M554: =K554*6+L554 -> 109 | O554: 19 | P554: 10 | Q554: =O554*6+P554 -> 124 | S554: WERRIBEE
A555: DANDENONG | C555: 3 | D555: 4 | E555: =C555*6+D555 -> 22 | G555: 6 | H555: 11 | I555: =G555*6+H555 -> 47 | K555: 10 | L555: 16 | M555: =K555*6+L555 -> 76 | O555: 15 | P555: 20 | Q555: =O555*6+P555 -> 110 | S555: BRADY/WARD
A556: BEST PLAYERS
A557: WERRIBEE | C557: WALPOLE | G557: S MOLONEY | J557: CUNNINGHAM | M557: BROWN | P557: B MOLONEY | S557: SMITH
A558: DANDENONG | C558: KANNOURAKIS | G558: SHINNERS | J558: HOLDEN | M558: FINN | P558: MERRIGAN | S558: TUFO
A559: GOALKICKERS
A560: WERRIBEE | C560: B MOLONEY 4 | F560: DUNSTAN 3 | I560: WILLIAMS 2 | K560: BROWN 2 | M560: JONES 2 | O560: WOODFORD 2 | R560: BONAT | T560: SLATTERY | W560: FREEMAN | X560: GREY
A561: DANDENONG | C561: BRUNNEN 3 | F561: METE 3 | H561: WRIGHT 2 | J561: SHINNERS 2 | M561: KAYE 2 | O561: HOLDEN | Q561: HALL | S561: GRAHAM
A563: BYE | C563: PRAHRAN
A565: ROUND 12 | E565: 12TH JULY | J565: WEATHER | S565: PLAYED AT
D566: 1ST QTR | H566: 2ND QTR | L566: 3RD QTR | P566: FINAL | S566: TOORAK PARK
A567: PRAHRAN | C567: 5 | D567: 2 | E567: =C567*6+D567 -> 32 | G567: 8 | H567: 3 | I567: =G567*6+H567 -> 51 | K567: 14 | L567: 3 | M567: =K567*6+L567 -> 87 | O567: 21 | P567: 6 | Q567: =O567*6+P567 -> 132 | S567: UMPIRE | X567: LADDER | AB567: ROUND | AD567: 12
A568: OAKLEIGH | C568: 4 | D568: 2 | E568: =C568*6+D568 -> 26 | G568: 7 | H568: 8 | I568: =G568*6+H568 -> 50 | K568: 9 | L568: 13 | M568: =K568*6+L568 -> 67 | O568: 15 | P568: 17 | Q568: =O568*6+P568 -> 107 | S568: CURRAN/MORROW
A569: BEST PLAYERS | W569: TEAM | X569: W | Y569: L | Z569: D | AA569: FOR | AB569: AGST | AC569: % | AD569: PTS
A570: PRAHRAN | C570: WALDER | F570: TORCASIO | I570: G GILES | L570: TAPPING | O570: S GILES | R570: HUTCHISON
A571: OAKLEIGH | C571: ATHERTON | F571: VERBEEK | I571: CUNNINGHAM | L571: WALL | O571: HILLIARD | R571: ROURKE | W571: WAVERLEY | X571: 10 | Y571: 2 | Z571: 0 | AA571: 1584 | AB571: 908 | AC571: =(AA571*100)/AB571 -> 174.44933920704847 | AD571: =(X571*4)+(Z571*2) -> 40
A572: GOALKICKERS | N572: MAZUREK | Q572: S GILES | W572: SUNSHINE | X572: 10 | Y572: 2 | Z572: 0 | AA572: 1577 | AB572: 1071 | AC572: =(AA572*100)/AB572 -> 147.24556489262372 | AD572: =(X572*4)+(Z572*2) -> 40
A573: PRAHRAN | C573: G GILES 5 | F573: BINGHAM 4 | I573: REYNOLDS 4 | K573: HUTCHISON 2 | N573: DURNAN | P573: SOULOS | R573: WALLACE | T573: CUTLER | W573: WERRIBEE | X573: 10 | Y573: 2 | Z573: 0 | AA573: 1382 | AB573: 1081 | AC573: =(AA573*100)/AB573 -> 127.84458834412581 | AD573: =(X573*4)+(Z573*2) -> 40
A574: OAKLEIGH | C574: PRETTO 3 | F574: ROURKE 2 | H574: SUTHERLAND 2 | K574: SIMPSON 2 | N574: VERBEEK 2 | P574: SMITH | R574: FINN | S574: M? | W574: PRAHRAN | X574: 9 | Y574: 3 | Z574: 0 | AA574: 1501 | AB574: 995 | AC574: =(AA574*100)/AB574 -> 150.85427135678393 | AD574: =(X574*4)+(Z574*2) -> 36
L575: OWEN
A576: SUNSHINE | C576: 6 | D576: 5 | E576: =C576*6+D576 -> 41 | G576: 14 | H576: 11 | I576: =G576*6+H576 -> 95 | K576: 19 | L576: 18 | M576: =K576*6+L576 -> 132 | O576: 24 | P576: 23 | Q576: =O576*6+P576 -> 167 | S576: NORTHCOTE | W576: DANDENONG | X576: 8 | Y576: 4 | Z576: 0 | AA576: 1356 | AB576: 894 | AC576: =(AA576*100)/AB576 -> 151.6778523489933 | AD576: =(X576*4)+(Z576*2) -> 32
A577: NORTHCOTE | C577: 4 | D577: 4 | E577: =C577*6+D577 -> 28 | G577: 9 | H577: 5 | I577: =G577*6+H577 -> 59 | K577: 11 | L577: 13 | M577: =K577*6+L577 -> 79 | O577: 16 | P577: 16 | Q577: =O577*6+P577 -> 112 | S577: MCDONALD | W577: OAKLEIGH | X577: 7 | Y577: 5 | Z577: 0 | AA577: 1473 | AB577: 1010 | AC577: =(AA577*100)/AB577 -> 145.84158415841586 | AD577: =(X577*4)+(Z577*2) -> 28
A578: BEST PLAYERS | S578: RIDDIFORD | W578: CAMBERWELL | X578: 7 | Y578: 5 | Z578: 0 | AA578: 1478 | AB578: 1311 | AC578: =(AA578*100)/AB578 -> 112.73836765827612 | AD578: =(X578*4)+(Z578*2) -> 28
A579: SUNSHINE | C579: BROWN | E579: CADDAYE | H579: SHEPPERBOTTOM | L579: JOHNSON | O579: PROTETTO | R579: LITCHFIELD | W579: MORDIALLOC | X579: 3 | Y579: 9 | Z579: 0 | AA579: 970 | AB579: 1587 | AC579: =(AA579*100)/AB579 -> 61.12161310649023 | AD579: =(X579*4)+(Z579*2) -> 12
A580: NORTHCOTE | C580: DONOVAN | E580: D'ATRI | H580: REARDON | L580: PIERCE | O580: EWING | R580: HOSKING | W580: BERWICK | X580: 3 | Y580: 9 | Z580: 0 | AA580: 979 | AB580: 1626 | AC580: =(AA580*100)/AB580 -> 60.20910209102091 | AD580: =(X580*4)+(Z580*2) -> 12
A581: GOALKICKERS | P581: FORBES | R581: PROTETTO | W581: NORTHCOTE | X581: 3 | Y581: 9 | Z581: 0 | AA581: 937 | AB581: 1994 | AC581: =(AA581*100)/AB581 -> 46.99097291875627 | AD581: =(X581*4)+(Z581*2) -> 12
A582: SUNSHINE | C582: LITCHFIELD 7 | F582: CADDAYE 4 | I582: CUTAJAR 3 | K582: SHEPPERBOTTOM 3 | O582: BROWN 2 | Q582: McQUALTER 2 | T582: WAGLAND | W582: CAULFIELD | X582: 2 | Y582: 10 | Z582: 0 | AA582: 962 | AB582: 1723 | AC582: =(AA582*100)/AB582 -> 55.832849680789323 | AD582: =(X582*4)+(Z582*2) -> 8
A583: NORTHCOTE | C583: HOSKING 6 | F583: D'ATRI 3 | H583: PIERCE 2 | J583: SPROAT | L583: COURTS | N583: SMITH | P583: MINETT | R583: BERTOLLO
A585: CAULFIELD | C585: 3 | D585: 7 | E585: =C585*6+D585 -> 25 | G585: 12 | H585: 11 | I585: =G585*6+H585 -> 83 | K585: 19 | L585: 12 | M585: =K585*6+L585 -> 126 | O585: 24 | P585: 17 | Q585: =O585*6+P585 -> 161 | S585: MORDIALLOC
A586: MORDIALLOC | C586: 3 | D586: 5 | E586: =C586*6+D586 -> 23 | G586: 3 | H586: 5 | I586: =G586*6+H586 -> 23 | K586: 7 | L586: 7 | M586: =K586*6+L586 -> 49 | O586: 14 | P586: 11 | Q586: =O586*6+P586 -> 95 | S586: HUTCHISON/BLACK
A587: BEST PLAYERS
A588: CAULFIELD | C588: REID | F588: O'KEEFE | I588: HOGAN | L588: R VITACCA | O588: LOGAN | R588: SAYERS
A589: MORDIALLOC | C589: CASSON | F589: POLA | I589: ALDRIDGE | L589: EVANS | O589: STEPHENS
A590: GOALKICKERS
A591: CAULFIELD | C591: LOGAN 6 | F591: SAYERS 5 | H591: R VITACCA 4 | K591: O'KEEFE 4 | N591: GODAU | P591: HOGAN | R591: VERUNO | T591: ALMATRAH | W591: BROUGHILL
A592: MORDIALLOC | C592: STEPHENS 3 | F592: ALDRIDGE 3 | I592: POLA 3 | K592: HESS 2 | M592: NICHOLAIDES 2 | P592: JONES
A594: WAVERLEY | C594: 7 | D594: 3 | E594: =C594*6+D594 -> 45 | G594: 12 | H594: 6 | I594: =G594*6+H594 -> 78 | K594: 16 | L594: 10 | M594: =K594*6+L594 -> 106 | O594: 20 | P594: 13 | Q594: =O594*6+P594 -> 133 | S594: BERWICK
A595: BERWICK | C595: 2 | D595: 2 | E595: =C595*6+D595 -> 14 | G595: 6 | H595: 7 | I595: =G595*6+H595 -> 43 | K595: 6 | L595: 9 | M595: =K595*6+L595 -> 45 | O595: 9 | P595: 9 | Q595: =O595*6+P595 -> 63 | S595: ANDERSON/WARD
A596: BEST PLAYERS
A597: WAVERLEY | C597: McCORKELL | F597: ROGERSON | I597: HARRISON | L597: KENDALL | O597: SHERLOCK | R597: TREMBATH
A598: BERWICK | C598: SCOTT | F598: TRIGG | I598: CROCKER | L598: MANNENS | O598: WRIGHT
A599: GOALKICKERS
A600: WAVERLEY | C600: BREWER 7 | F600: HARRISON 6 | I600: CASTILLO 3 | L600: WINNEN 2 | O600: TREMBATH | R600: KENDALL
A601: BERWICK | C601: TRIGG 2 | F601: SCOTT 2 | H601: CROCKER | J601: McGILL | L601: McGREAL | N601: ORSBORNE | Q601: WRIGHT
A603: WERRIBEE | C603: 3 | D603: 5 | E603: =C603*6+D603 -> 23 | G603: 10 | H603: 7 | I603: =G603*6+H603 -> 67 | K603: 13 | L603: 9 | M603: =K603*6+L603 -> 87 | O603: 18 | P603: 12 | Q603: =O603*6+P603 -> 120 | S603: WERRIBEE
A604: CAMBERWELL | C604: 5 | D604: 2 | E604: =C604*6+D604 -> 32 | G604: 8 | H604: 4 | I604: =G604*6+H604 -> 52 | K604: 10 | L604: 8 | M604: =K604*6+L604 -> 68 | O604: 15 | P604: 10 | Q604: =O604*6+P604 -> 100 | S604: BROOKS/CARUSO
A605: BEST PLAYERS
A606: WERRIBEE | C606: CUNNINGHAM | F606: DUNSTAN | I606: GUDDE | L606: VASILOU | O606: FREEMAN | R606: WALPOLE
A607: CAMBERWELL | C607: STEINER | F607: O'NEILL | I607: McGHEE | L607: DE KONNING | O607: J WILLIAMS | R607: JACKSON
A608: GOALKICKERS
A609: WERRIBEE | C609: DUNSTAN 3 | F609: TAYLOR 3 | I609: S MOLONEY 2 | L609: FREEMAN 2 | O609: BROWN 2 | Q609: VASILOU 2 | T609: GREY 2 | W609: B MOLONEY | X609: WILLIAMS
A610: CAMBERWELL | C610: DE KONNING 6 | F610: A SAMIOS 2 | I610: O'NEILL 2 | K610: JAKOBI | M610: J WILLIAMS | O610: JACKSON | Q610: HAINTZ | S610: MAILING
A612: BYE | C612: DANDENONG
A614: ROUND 13 | E614: 19TH JULY | J614: WEATHER | S614: PLAYED AT
D615: 1ST QTR | H615: 2ND QTR | L615: 3RD QTR | P615: FINAL | S615: CAMBERWELL
A616: CAMBERWELL | C616: 5 | D616: 4 | E616: =C616*6+D616 -> 34 | G616: 8 | H616: 11 | I616: =G616*6+H616 -> 59 | K616: 15 | L616: 17 | M616: =K616*6+L616 -> 107 | O616: 23 | P616: 22 | Q616: =O616*6+P616 -> 160 | S616: UMPIRE | X616: LADDER | AB616: ROUND | AD616: 13
A617: BERWICK | C617: 2 | D617: 3 | E617: =C617*6+D617 -> 15 | G617: 6 | H617: 5 | I617: =G617*6+H617 -> 41 | K617: 9 | L617: 8 | M617: =K617*6+L617 -> 62 | O617: 9 | P617: 11 | Q617: =O617*6+P617 -> 65 | S617: OKEY/BRADSHAW
A618: BEST PLAYERS | W618: TEAM | X618: W | Y618: L | Z618: D | AA618: FOR | AB618: AGST | AC618: % | AD618: PTS
A619: CAMBERWELL | C619: CONDON | F619: SIMMONS | I619: McGHEE | L619: P SAMIOS | O619: O'NEILL | R619: STEIGER
A620: BERWICK | C620: R TRIGG | F620: SCOTT | I620: WRIGHT | L620: TRAIL | O620: McKENNA | W620: WAVERLEY | X620: 11 | Y620: 2 | Z620: 0 | AA620: 1718 | AB620: 960 | AC620: =(AA620*100)/AB620 -> 178.95833333333334 | AD620: =(X620*4)+(Z620*2) -> 44
A621: GOALKICKERS | M621: McGHEE | O621: STEIGER | Q621: P SAMIOS | W621: SUNSHINE | X621: 11 | Y621: 2 | Z621: 0 | AA621: 1702 | AB621: 1129 | AC621: =(AA621*100)/AB621 -> 150.75287865367582 | AD621: =(X621*4)+(Z621*2) -> 44
A622: CAMBERWELL | C622: DE KONNING 4 | F622: JAKOBI 2 | H622: MAILING 2 | J622: GARAVIVO 2 | M622: CONSTANTINOU 2 | P622: WILLIAMS 2 | S622: WHALEN 2 | W622: WERRIBEE | X622: 11 | Y622: 2 | Z622: 0 | AA622: 1382 | AB622: 1081 | AC622: =(AA622*100)/AB622 -> 127.84458834412581 | AD622: =(X622*4)+(Z622*2) -> 44
A623: BERWICK | C623: R TRIGG 5 | F623: WRIGHT 2 | I623: RUNDELL | K623: ORSBORNE | N623: VERSHUUR | Q623: McGILL | S623: VINEY | W623: DANDENONG | X623: 9 | Y623: 4 | Z623: 0 | AA623: 1472 | AB623: 967 | AC623: =(AA623*100)/AB623 -> 152.22337125129266 | AD623: =(X623*4)+(Z623*2) -> 36
A625: WAVERLEY | C625: 4 | D625: 3 | E625: =C625*6+D625 -> 27 | G625: 10 | H625: 10 | I625: =G625*6+H625 -> 70 | K625: 16 | L625: 10 | M625: =K625*6+L625 -> 106 | O625: 20 | P625: 14 | Q625: =O625*6+P625 -> 134 | S625: WAVERLEY | W625: PRAHRAN | X625: 9 | Y625: 4 | Z625: 0 | AA625: 1559 | AB625: 1120 | AC625: =(AA625*100)/AB625 -> 139.19642857142858 | AD625: =(X625*4)+(Z625*2) -> 36
A626: MORDIALLOC | C626: 2 | D626: 3 | E626: =C626*6+D626 -> 15 | G626: 4 | H626: 5 | I626: =G626*6+H626 -> 29 | K626: 7 | L626: 10 | M626: =K626*6+L626 -> 52 | O626: 7 | P626: 10 | Q626: =O626*6+P626 -> 52 | S626: BROOKES | W626: CAMBERWELL | X626: 8 | Y626: 5 | Z626: 0 | AA626: 1638 | AB626: 1376 | AC626: =(AA626*100)/AB626 -> 119.04069767441861 | AD626: =(X626*4)+(Z626*2) -> 32
A627: BEST PLAYERS | S627: MITCHELL | W627: OAKLEIGH | X627: 7 | Y627: 6 | Z627: 0 | AA627: 1546 | AB627: 1126 | AC627: =(AA627*100)/AB627 -> 137.30017761989342 | AD627: =(X627*4)+(Z627*2) -> 28
A628: WAVERLEY | C628: CASTILLO | F628: ROGERSON | I628: KENDALL | L628: MARSHALL | O628: TREMBATH | R628: HUNT | W628: MORDIALLOC | X628: 3 | Y628: 10 | Z628: 0 | AA628: 1022 | AB628: 1721 | AC628: =(AA628*100)/AB628 -> 59.384079023823361 | AD628: =(X628*4)+(Z628*2) -> 12
A629: MORDIALLOC | C629: CASSON | F629: BROMLEY | I629: P EVANS | L629: T EVANS | O629: MATTHEWS | R629: JONES | W629: BERWICK | X629: 3 | Y629: 10 | Z629: 0 | AA629: 1044 | AB629: 1786 | AC629: =(AA629*100)/AB629 -> 58.454647256438967 | AD629: =(X629*4)+(Z629*2) -> 12
A630: GOALKICKERS | N630: CSOTI | P630: PEARSON | W630: CAULFIELD | X630: 3 | Y630: 10 | Z630: 0 | AA630: 1039 | AB630: 1798 | AC630: =(AA630*100)/AB630 -> 57.786429365962178 | AD630: =(X630*4)+(Z630*2) -> 12
A631: WAVERLEY | C631: BREWER 4 | F631: CASTILLO 3 | I631: COLE 3 | K631: HUNT 2 | M631: HARRISON 2 | O631: SHERLOCK 2 | R631: SCHLEIGER | T631: BURNS | W631: NORTHCOTE | X631: 3 | Y631: 10 | Z631: 0 | AA631: 1012 | AB631: 2071 | AC631: =(AA631*100)/AB631 -> 48.865282472235634 | AD631: =(X631*4)+(Z631*2) -> 12
A632: MORDIALLOC | C632: POLA 3 | F632: P EVANS | I632: A COFFEY | L632: D COFFEY | O632: CLARKE
A634: CAULFIELD | C634: 4 | D634: 2 | E634: =C634*6+D634 -> 26 | G634: 6 | H634: 8 | I634: =G634*6+H634 -> 44 | K634: 7 | L634: 9 | M634: =K634*6+L634 -> 51 | O634: 11 | P634: 11 | Q634: =O634*6+P634 -> 77 | S634: PRINCES PK
A635: NORTHCOTE | C635: 2 | D635: 3 | E635: =C635*6+D635 -> 15 | G635: 4 | H635: 7 | I635: =G635*6+H635 -> 31 | K635: 9 | L635: 13 | M635: =K635*6+L635 -> 67 | O635: 10 | P635: 15 | Q635: =O635*6+P635 -> 75 | S635: ANASTASI/CURREN
A636: BEST PLAYERS
A637: CAULFIELD | C637: MILLS | F637: CIRO | I637: R VITACCA | L637: EINSEDEL | O637: REED | R637: LARKIN
A638: NORTHCOTE | C638: EWING | F638: CSOTI | I638: MINNETT | L638: PIERCE | O638: ZAPPONE | R638: RITOH
A639: GOALKICKERS
A640: CAULFIELD | C640: O'KEEFE 2 | F640: HOGAN 2 | H640: R VITACCA | K640: MILLS | M640: LARKIN | O640: COX | Q640: GODAU | S640: BROUGHILL
A641: NORTHCOTE | C641: BERTOLLO 3 | F641: D'ATRI 2 | H641: SMITH | J641: ZAPPONE | M641: PIERCS | O641: REARDON | R641: TINIAN
A643: SUNSHINE | C643: 6 | D643: 6 | E643: =C643*6+D643 -> 42 | G643: 9 | H643: 8 | I643: =G643*6+H643 -> 62 | K643: 15 | L643: 12 | M643: =K643*6+L643 -> 102 | O643: 18 | P643: 17 | Q643: =O643*6+P643 -> 125 | S643: SUNSHINE
A644: PRAHRAN | C644: 1 | D644: 1 | E644: =C644*6+D644 -> 7 | G644: 4 | H644: 8 | I644: =G644*6+H644 -> 32 | K644: 4 | L644: 11 | M644: =K644*6+L644 -> 35 | O644: 7 | P644: 16 | Q644: =O644*6+P644 -> 58 | S644: D BRADSHAW/CARUSO
A645: BEST PLAYERS
A646: SUNSHINE | C646: JOHNSON | F646: MOSS | I646: BROWN | L646: MENADUE | O646: CALDWELL | R646: SCANLON
A647: PRAHRAN | C647: WALDER | F647: ELLETT | I647: TAPPING | L647: TORCASIO | O647: DURNAN
A648: GOALKICKERS
A649: SUNSHINE | C649: LITCHFIELD 5 | F649: JOHNSON 4 | I649: SHEPPERBOTTOM 3 | M649: CADDAYE 2 | P649: CUTAJAR 2 | S649: McQUALTER 2
A650: PRAHRAN | C650: TAPPING 2 | F650: REYNOLDS | I650: SOULOS | K650: WALDER
A652: DANDENONG | C652: 3 | D652: 1 | E652: =C652*6+D652 -> 19 | G652: 9 | H652: 3 | I652: =G652*6+H652 -> 57 | K652: 12 | L652: 6 | M652: =K652*6+L652 -> 78 | O652: 18 | P652: 8 | Q652: =O652*6+P652 -> 116 | S652: OAKLEIGH
A653: OAKLEIGH | C653: 5 | D653: 4 | E653: =C653*6+D653 -> 34 | G653: 5 | H653: 7 | I653: =G653*6+H653 -> 37 | K653: 9 | L653: 11 | M653: =K653*6+L653 -> 65 | O653: 10 | P653: 13 | Q653: =O653*6+P653 -> 73 | S653: CASEY/BLACK
A654: BEST PLAYERS
A655: DANDENONG | C655: WRIGHT | F655: MERRIGAN | I655: BRUNNEN | L655: MARSHALL | O655: LACKO | R655: FINN
A656: OAKLEIGH | C656: HILLIARD | F656: WALL | I656: CUNNINGHAM | L656: ROURKE | O656: ATHERTON | R656: SULLIVAN
A657: GOALKICKERS
A658: DANDENONG | C658: WRIGHT 7 | F658: PALLANT 4 | I658: HOLDEN 2 | K658: KANNOURAKIS | N658: LACKO | P658: LINDSAY | R658: METE | T658: BROWN
A659: OAKLEIGH | C659: PRETTO 4 | F659: ROURKE | I659: CUNNINGHAM | L659: SIMPSON | N659: HILLIARD | Q659: SULLIVAN | S659: MIKSONIECIC
A661: BYE | C661: WERRIBEE
A663: ROUND 14 | E663: 26TH JULY | J663: WEATHER | S663: PLAYED AT
D664: 1ST QTR | H664: 2ND QTR | L664: 3RD QTR | P664: FINAL | S664: DANDENONG
A665: SUNSHINE | C665: 0 | D665: 0 | E665: =C665*6+D665 -> 0 | G665: 0 | H665: 0 | I665: =G665*6+H665 -> 0 | K665: 0 | L665: 0 | M665: =K665*6+L665 -> 0 | O665: 18 | P665: 14 | Q665: =O665*6+P665 -> 122 | S665: UMPIRE | X665: LADDER | AB665: ROUND | AD665: 14
A666: DANDENONG | C666: 0 | D666: 0 | E666: =C666*6+D666 -> 0 | G666: 0 | H666: 0 | I666: =G666*6+H666 -> 0 | K666: 0 | L666: 0 | M666: =K666*6+L666 -> 0 | O666: 13 | P666: 12 | Q666: =O666*6+P666 -> 90
A667: BEST PLAYERS | W667: TEAM | X667: W | Y667: L | Z667: D | AA667: FOR | AB667: AGST | AC667: % | AD667: PTS
A668: SUNSHINE
A669: DANDENONG | W669: WAVERLEY | X669: 12 | Y669: 2 | Z669: 0 | AA669: 1873 | AB669: 1048 | AC669: =(AA669*100)/AB669 -> 178.72137404580153 | AD669: =(X669*4)+(Z669*2) -> 48
A670: GOALKICKERS | W670: SUNSHINE | X670: 12 | Y670: 2 | Z670: 0 | AA670: 1824 | AB670: 1219 | AC670: =(AA670*100)/AB670 -> 149.63084495488104 | AD670: =(X670*4)+(Z670*2) -> 48
A671: SUNSHINE | W671: WERRIBEE | X671: 12 | Y671: 2 | Z671: 0 | AA671: 1558 | AB671: 1141 | AC671: =(AA671*100)/AB671 -> 136.54688869412797 | AD671: =(X671*4)+(Z671*2) -> 48
A672: DANDENONG | W672: PRAHRAN | X672: 10 | Y672: 4 | Z672: 0 | AA672: 1753 | AB672: 1198 | AC672: =(AA672*100)/AB672 -> 146.32721202003339 | AD672: =(X672*4)+(Z672*2) -> 40
A674: PRAHRAN | C674: 0 | D674: 0 | E674: =C674*6+D674 -> 0 | G674: 0 | H674: 0 | I674: =G674*6+H674 -> 0 | K674: 0 | L674: 0 | M674: =K674*6+L674 -> 0 | O674: 29 | P674: 20 | Q674: =O674*6+P674 -> 194 | S674: TOORAK PARK | W674: DANDENONG | X674: 9 | Y674: 5 | Z674: 0 | AA674: 1562 | AB674: 1089 | AC674: =(AA674*100)/AB674 -> 143.43434343434345 | AD674: =(X674*4)+(Z674*2) -> 36
A675: CAULFIELD | C675: 0 | D675: 0 | E675: =C675*6+D675 -> 0 | G675: 0 | H675: 0 | I675: =G675*6+H675 -> 0 | K675: 0 | L675: 0 | M675: =K675*6+L675 -> 0 | O675: 10 | P675: 18 | Q675: =O675*6+P675 -> 78 | W675: CAMBERWELL | X675: 9 | Y675: 5 | Z675: 0 | AA675: 1808 | AB675: 1482 | AC675: =(AA675*100)/AB675 -> 121.99730094466936 | AD675: =(X675*4)+(Z675*2) -> 36
A676: BEST PLAYERS | W676: OAKLEIGH | X676: 8 | Y676: 6 | Z676: 0 | AA676: 1546 | AB676: 1126 | AC676: =(AA676*100)/AB676 -> 137.30017761989342 | AD676: =(X676*4)+(Z676*2) -> 32
A677: PRAHRAN | W677: MORDIALLOC | X677: 3 | Y677: 11 | Z677: 0 | AA677: 1128 | AB677: 1891 | AC677: =(AA677*100)/AB677 -> 59.650978318350077 | AD677: =(X677*4)+(Z677*2) -> 12
A678: CAULFIELD | W678: BERWICK | X678: 3 | Y678: 11 | Z678: 0 | AA678: 1104 | AB678: 1962 | AC678: =(AA678*100)/AB678 -> 56.269113149847094 | AD678: =(X678*4)+(Z678*2) -> 12
A679: GOALKICKERS | W679: CAULFIELD | X679: 3 | Y679: 11 | Z679: 0 | AA679: 1117 | AB679: 1992 | AC679: =(AA679*100)/AB679 -> 56.074297188755018 | AD679: =(X679*4)+(Z679*2) -> 12
A680: PRAHRAN | W680: NORTHCOTE | X680: 3 | Y680: 11 | Z680: 0 | AA680: 1100 | AB680: 2223 | AC680: =(AA680*100)/AB680 -> 49.482681061628433 | AD680: =(X680*4)+(Z680*2) -> 12
A681: CAULFIELD
A683: WAVERLEY | C683: 0 | D683: 0 | E683: =C683*6+D683 -> 0 | G683: 0 | H683: 0 | I683: =G683*6+H683 -> 0 | K683: 0 | L683: 0 | M683: =K683*6+L683 -> 0 | O683: 23 | P683: 15 | Q683: =O683*6+P683 -> 153 | S683: NORTHCOTE
A684: NORTHCOTE | C684: 0 | D684: 0 | E684: =C684*6+D684 -> 0 | G684: 0 | H684: 0 | I684: =G684*6+H684 -> 0 | K684: 0 | L684: 0 | M684: =K684*6+L684 -> 0 | O684: 13 | P684: 10 | Q684: =O684*6+P684 -> 88
A685: BEST PLAYERS
A686: WAVERLEY
A687: NORTHCOTE
A688: GOALKICKERS
A689: WAVERLEY
A690: NORTHCOTE
A692: CAMBERWELL | C692: 0 | D692: 0 | E692: =C692*6+D692 -> 0 | G692: 0 | H692: 0 | I692: =G692*6+H692 -> 0 | K692: 0 | L692: 0 | M692: =K692*6+L692 -> 0 | O692: 26 | P692: 14 | Q692: =O692*6+P692 -> 170 | S692: MORDIALLOC
A693: MORDIALLOC | C693: 0 | D693: 0 | E693: =C693*6+D693 -> 0 | G693: 0 | H693: 0 | I693: =G693*6+H693 -> 0 | K693: 0 | L693: 0 | M693: =K693*6+L693 -> 0 | O693: 16 | P693: 10 | Q693: =O693*6+P693 -> 106
A694: BEST PLAYERS
A695: CAMBERWELL
A696: MORDIALLOC
A697: GOALKICKERS
A698: CAMBERWELL
A699: MORDIALLOC
A701: WERRIBEE | C701: 0 | D701: 0 | E701: =C701*6+D701 -> 0 | G701: 0 | H701: 0 | I701: =G701*6+H701 -> 0 | K701: 0 | L701: 0 | M701: =K701*6+L701 -> 0 | O701: 25 | P701: 26 | Q701: =O701*6+P701 -> 176 | S701: WERRIBEE
A702: BERWICK | C702: 0 | D702: 0 | E702: =C702*6+D702 -> 0 | G702: 0 | H702: 0 | I702: =G702*6+H702 -> 0 | K702: 0 | L702: 0 | M702: =K702*6+L702 -> 0 | O702: 9 | P702: 6 | Q702: =O702*6+P702 -> 60
A703: BEST PLAYERS
A704: WERRIBEE
A705: BERWICK
A706: GOALKICKERS
A707: WERRIBEE
A708: BERWICK
A710: BYE | C710: OAKLEIGH
A712: ROUND 15 | E712: 2ND AUGUST | J712: WEATHER | S712: PLAYED AT
D713: 1ST QTR | H713: 2ND QTR | L713: 3RD QTR | P713: FINAL | S713: CAMBERWELL
A714: CAMBERWELL | C714: 11 | D714: 7 | E714: =C714*6+D714 -> 73 | G714: 19 | H714: 11 | I714: =G714*6+H714 -> 125 | K714: 25 | L714: 15 | M714: =K714*6+L714 -> 165 | O714: 34 | P714: 24 | Q714: =O714*6+P714 -> 228 | S714: UMPIRE | X714: LADDER | AB714: ROUND | AD714: 15
A715: NORTHCOTE | C715: 0 | D715: 3 | E715: =C715*6+D715 -> 3 | G715: 6 | H715: 6 | I715: =G715*6+H715 -> 42 | K715: 9 | L715: 7 | M715: =K715*6+L715 -> 61 | O715: 13 | P715: 9 | Q715: =O715*6+P715 -> 87
A716: BEST PLAYERS | W716: TEAM | X716: W | Y716: L | Z716: D | AA716: FOR | AB716: AGST | AC716: % | AD716: PTS
A717: CAMBERWELL
A718: NORTHCOTE | W718: SUNSHINE | X718: 13 | Y718: 2 | Z718: 0 | AA718: 1824 | AB718: 1219 | AC718: =(AA718*100)/AB718 -> 149.63084495488104 | AD718: =(X718*4)+(Z718*2) -> 52
A719: GOALKICKERS | W719: WAVERLEY | X719: 12 | Y719: 3 | Z719: 0 | AA719: 1932 | AB719: 1114 | AC719: =(AA719*100)/AB719 -> 173.42908438061042 | AD719: =(X719*4)+(Z719*2) -> 48
A720: CAMBERWELL | W720: WERRIBEE | X720: 12 | Y720: 3 | Z720: 0 | AA720: 1605 | AB720: 1203 | AC720: =(AA720*100)/AB720 -> 133.41645885286783 | AD720: =(X720*4)+(Z720*2) -> 48
A721: NORTHCOTE | W721: PRAHRAN | X721: 11 | Y721: 4 | Z721: 0 | AA721: 1819 | AB721: 1257 | AC721: =(AA721*100)/AB721 -> 144.70962609387431 | AD721: =(X721*4)+(Z721*2) -> 44
A723: PRAHRAN | C723: 2 | D723: 6 | E723: =C723*6+D723 -> 18 | G723: 4 | H723: 8 | I723: =G723*6+H723 -> 32 | K723: 6 | L723: 10 | M723: =K723*6+L723 -> 46 | O723: 9 | P723: 12 | Q723: =O723*6+P723 -> 66 | S723: WAVERLEY | W723: DANDENONG | X723: 10 | Y723: 5 | Z723: 0 | AA723: 1739 | AB723: 1153 | AC723: =(AA723*100)/AB723 -> 150.82393755420642 | AD723: =(X723*4)+(Z723*2) -> 40
A724: WAVERLEY | C724: 4 | D724: 3 | E724: =C724*6+D724 -> 27 | G724: 6 | H724: 8 | I724: =G724*6+H724 -> 44 | K724: 6 | L724: 10 | M724: =K724*6+L724 -> 46 | O724: 8 | P724: 11 | Q724: =O724*6+P724 -> 59 | W724: CAMBERWELL | X724: 10 | Y724: 5 | Z724: 0 | AA724: 2036 | AB724: 1569 | AC724: =(AA724*100)/AB724 -> 129.76418100701085 | AD724: =(X724*4)+(Z724*2) -> 40
A725: BEST PLAYERS | W725: OAKLEIGH | X725: 9 | Y725: 6 | Z725: 0 | AA725: 1608 | AB725: 1173 | AC725: =(AA725*100)/AB725 -> 137.0843989769821 | AD725: =(X725*4)+(Z725*2) -> 36
A726: PRAHRAN | W726: BERWICK | X726: 4 | Y726: 11 | Z726: 0 | AA726: 1221 | AB726: 2014 | AC726: =(AA726*100)/AB726 -> 60.625620655412114 | AD726: =(X726*4)+(Z726*2) -> 16
A727: WAVERLEY | W727: MORDIALLOC | X727: 3 | Y727: 12 | Z727: 0 | AA727: 1180 | AB727: 2008 | AC727: =(AA727*100)/AB727 -> 58.764940239043824 | AD727: =(X727*4)+(Z727*2) -> 12
A728: GOALKICKERS | W728: CAULFIELD | X728: 3 | Y728: 12 | Z728: 0 | AA728: 1181 | AB728: 2169 | AC728: =(AA728*100)/AB728 -> 54.449054863992622 | AD728: =(X728*4)+(Z728*2) -> 12
A729: PRAHRAN | W729: NORTHCOTE | X729: 3 | Y729: 12 | Z729: 0 | AA729: 1187 | AB729: 2451 | AC729: =(AA729*100)/AB729 -> 48.429212566299469 | AD729: =(X729*4)+(Z729*2) -> 12
A730: WAVERLEY
A732: DANDENONG | C732: 8 | D732: 4 | E732: =C732*6+D732 -> 52 | G732: 12 | H732: 9 | I732: =G732*6+H732 -> 81 | K732: 18 | L732: 14 | M732: =K732*6+L732 -> 122 | O732: 26 | P732: 21 | Q732: =O732*6+P732 -> 177 | S732: PRINCES PARK, CAULFIELD
A733: CAULFIELD | C733: 0 | D733: 3 | E733: =C733*6+D733 -> 3 | G733: 3 | H733: 6 | I733: =G733*6+H733 -> 24 | K733: 4 | L733: 8 | M733: =K733*6+L733 -> 32 | O733: 9 | P733: 10 | Q733: =O733*6+P733 -> 64
A734: BEST PLAYERS
A735: DANDENONG
A736: CAULFIELD
A737: GOALKICKERS
A738: DANDENONG
A739: CAULFIELD
A741: OAKLEIGH | C741: 1 | D741: 6 | E741: =C741*6+D741 -> 12 | G741: 4 | H741: 8 | I741: =G741*6+H741 -> 32 | K741: 6 | L741: 12 | M741: =K741*6+L741 -> 48 | O741: 8 | P741: 14 | Q741: =O741*6+P741 -> 62 | S741: OAKLEIGH
A742: WERRIBEE | C742: 0 | D742: 0 | E742: =C742*6+D742 -> 0 | G742: 3 | H742: 3 | I742: =G742*6+H742 -> 21 | K742: 5 | L742: 3 | M742: =K742*6+L742 -> 33 | O742: 7 | P742: 5 | Q742: =O742*6+P742 -> 47
A743: BEST PLAYERS
A744: OAKLEIGH
A745: WERRIBEE
A746: GOALKICKERS
A747: OAKLEIGH
A748: WERRIBEE
A750: BERWICK | C750: 3 | D750: 1 | E750: =C750*6+D750 -> 19 | G750: 11 | H750: 9 | I750: =G750*6+H750 -> 75 | K750: 12 | L750: 12 | M750: =K750*6+L750 -> 84 | O750: 16 | P750: 21 | Q750: =O750*6+P750 -> 117 | S750: BERWICK
A751: MORDIALLOC | C751: 3 | D751: 2 | E751: =C751*6+D751 -> 20 | G751: 4 | H751: 2 | I751: =G751*6+H751 -> 26 | K751: 8 | L751: 3 | M751: =K751*6+L751 -> 51 | O751: 8 | P751: 4 | Q751: =O751*6+P751 -> 52
A752: BEST PLAYERS
A753: BERWICK
A754: MORDIALLOC
A755: GOALKICKERS
A756: BERWICK
A757: MORDIALLOC
A759: BYE | C759: SUNSHINE
A761: ROUND 16 | E761: 13TH APRIL | J761: WEATHER | S761: PLAYED AT
D762: 1ST QTR | H762: 2ND QTR | L762: 3RD QTR | P762: FINAL | S762: OAKLEIGH
A763: OAKLEIGH | C763: 3 | D763: 5 | E763: =C763*6+D763 -> 23 | G763: 9 | H763: 9 | I763: =G763*6+H763 -> 63 | K763: 12 | L763: 15 | M763: =K763*6+L763 -> 87 | O763: 16 | P763: 16 | Q763: =O763*6+P763 -> 112 | S763: UMPIRE | X763: LADDER | AB763: ROUND | AD763: 16
A764: SUNSHINE | C764: 3 | D764: 3 | E764: =C764*6+D764 -> 21 | G764: 4 | H764: 5 | I764: =G764*6+H764 -> 29 | K764: 7 | L764: 8 | M764: =K764*6+L764 -> 50 | O764: 11 | P764: 10 | Q764: =O764*6+P764 -> 76
A765: BEST PLAYERS | W765: TEAM | X765: W | Y765: L | Z765: D | AA765: FOR | AB765: AGST | AC765: % | AD765: PTS
A766: OAKLEIGH
A767: SUNSHINE | W767: WAVERLEY | X767: 13 | Y767: 3 | Z767: 0 | AA767: 2050 | AB767: 1202 | AC767: =(AA767*100)/AB767 -> 170.54908485856905 | AD767: =(X767*4)+(Z767*2) -> 52
A768: GOALKICKERS | W768: WERRIBEE | X768: 13 | Y768: 3 | Z768: 0 | AA768: 1852 | AB768: 1245 | AC768: =(AA768*100)/AB768 -> 148.75502008032129 | AD768: =(X768*4)+(Z768*2) -> 52
A769: OAKLEIGH | W769: SUNSHINE | X769: 13 | Y769: 3 | Z769: 0 | AA769: 1900 | AB769: 1331 | AC769: =(AA769*100)/AB769 -> 142.74981217129977 | AD769: =(X769*4)+(Z769*2) -> 52
A770: SUNSHINE | W770: PRAHRAN | X770: 12 | Y770: 4 | Z770: 0 | AA770: 2015 | AB770: 1355 | AC770: =(AA770*100)/AB770 -> 148.70848708487085 | AD770: =(X770*4)+(Z770*2) -> 48
A772: WAVERLEY | C772: 1 | D772: 2 | E772: =C772*6+D772 -> 8 | G772: 8 | H772: 5 | I772: =G772*6+H772 -> 53 | K772: 11 | L772: 7 | M772: =K772*6+L772 -> 73 | O772: 18 | P772: 10 | Q772: =O772*6+P772 -> 118 | S772: DANDENONG | W772: DANDENONG | X772: 10 | Y772: 6 | Z772: 0 | AA772: 1827 | AB772: 1271 | AC772: =(AA772*100)/AB772 -> 143.74508261211645 | AD772: =(X772*4)+(Z772*2) -> 40
A773: DANDENONG | C773: 3 | D773: 3 | E773: =C773*6+D773 -> 21 | G773: 6 | H773: 3 | I773: =G773*6+H773 -> 39 | K773: 10 | L773: 8 | M773: =K773*6+L773 -> 68 | O773: 13 | P773: 10 | Q773: =O773*6+P773 -> 88 | W773: OAKLEIGH | X773: 10 | Y773: 6 | Z773: 0 | AA773: 1720 | AB773: 1249 | AC773: =(AA773*100)/AB773 -> 137.7101681345076 | AD773: =(X773*4)+(Z773*2) -> 40
A774: BEST PLAYERS | W774: CAMBERWELL | X774: 10 | Y774: 6 | Z774: 0 | AA774: 2134 | AB774: 1765 | AC774: =(AA774*100)/AB774 -> 120.90651558073654 | AD774: =(X774*4)+(Z774*2) -> 40
A775: WAVERLEY | W775: BERWICK | X775: 5 | Y775: 11 | Z775: 0 | AA775: 1327 | AB775: 2115 | AC775: =(AA775*100)/AB775 -> 62.742316784869978 | AD775: =(X775*4)+(Z775*2) -> 20
A776: DANDENONG | W776: CAULFIELD | X776: 4 | Y776: 12 | Z776: 0 | AA776: 1181 | AB776: 2169 | AC776: =(AA776*100)/AB776 -> 54.449054863992622 | AD776: =(X776*4)+(Z776*2) -> 16
A777: GOALKICKERS | W777: MORDIALLOC | X777: 3 | Y777: 13 | Z777: 0 | AA777: 1222 | AB777: 2255 | AC777: =(AA777*100)/AB777 -> 54.190687361419066 | AD777: =(X777*4)+(Z777*2) -> 12
A778: WAVERLEY | W778: NORTHCOTE | X778: 3 | Y778: 13 | Z778: 0 | AA778: 1288 | AB778: 2558 | AC778: =(AA778*100)/AB778 -> 50.351837372947614 | AD778: =(X778*4)+(Z778*2) -> 12
A779: DANDENONG
A781: PRAHRAN | C781: 8 | D781: 3 | E781: =C781*6+D781 -> 51 | G781: 14 | H781: 8 | I781: =G781*6+H781 -> 92 | K781: 25 | L781: 11 | M781: =K781*6+L781 -> 161 | O781: 30 | P781: 16 | Q781: =O781*6+P781 -> 196 | S781: TOORAK PARK
A782: CAMBERWELL | C782: 3 | D782: 1 | E782: =C782*6+D782 -> 19 | G782: 5 | H782: 4 | I782: =G782*6+H782 -> 34 | K782: 8 | L782: 8 | M782: =K782*6+L782 -> 56 | O782: 15 | P782: 8 | Q782: =O782*6+P782 -> 98
A783: BEST PLAYERS
A784: PRAHRAN
A785: CAMBERWELL
A786: GOALKICKERS
A787: PRAHRAN
A788: CAMBERWELL
A790: BERWICK | C790: 5 | D790: 6 | E790: =C790*6+D790 -> 36 | G790: 9 | H790: 13 | I790: =G790*6+H790 -> 67 | K790: 10 | L790: 19 | M790: =K790*6+L790 -> 79 | O790: 14 | P790: 23 | Q790: =O790*6+P790 -> 107 | S790: NORTHCOTE
A791: NORTHCOTE | C791: 3 | D791: 2 | E791: =C791*6+D791 -> 20 | G791: 4 | H791: 4 | I791: =G791*6+H791 -> 28 | K791: 12 | L791: 8 | M791: =K791*6+L791 -> 80 | O791: 15 | P791: 11 | Q791: =O791*6+P791 -> 101
A792: BEST PLAYERS
A793: BERWICK
A794: NORTHCOTE
A795: GOALKICKERS
A796: BERWICK
A797: NORTHCOTE
A799: WERRIBEE | C799: 6 | D799: 4 | E799: =C799*6+D799 -> 40 | G799: 16 | H799: 9 | I799: =G799*6+H799 -> 105 | K799: 28 | L799: 14 | M799: =K799*6+L799 -> 182 | O799: 38 | P799: 19 | Q799: =O799*6+P799 -> 247 | S799: WERRIBEE
A800: MORDIALLOC | C800: 2 | D800: 3 | E800: =C800*6+D800 -> 15 | G800: 3 | H800: 4 | I800: =G800*6+H800 -> 22 | K800: 4 | L800: 5 | M800: =K800*6+L800 -> 29 | O800: 6 | P800: 6 | Q800: =O800*6+P800 -> 42
A801: BEST PLAYERS
A802: WERRIBEE
A803: MORDIALLOC
A804: GOALKICKERS
A805: WERRIBEE
A806: MORDIALLOC
A808: BYE | C808: CAULFIELD
A810: ROUND 17 | E810: 16TH AUGUST | J810: WEATHER | S810: PLAYED AT
D811: 1ST QTR | H811: 2ND QTR | L811: 3RD QTR | P811: FINAL | S811: CAMBERWELL
A812: DANDENONG | C812: 2 | D812: 5 | E812: =C812*6+D812 -> 17 | G812: 12 | H812: 7 | I812: =G812*6+H812 -> 79 | K812: 19 | L812: 10 | M812: =K812*6+L812 -> 124 | O812: 24 | P812: 15 | Q812: =O812*6+P812 -> 159 | S812: UMPIRE | X812: LADDER | AB812: ROUND | AD812: 17
A813: CAMBERWELL | C813: 3 | D813: 5 | E813: =C813*6+D813 -> 23 | G813: 4 | H813: 8 | I813: =G813*6+H813 -> 32 | K813: 5 | L813: 15 | M813: =K813*6+L813 -> 45 | O813: 11 | P813: 18 | Q813: =O813*6+P813 -> 84 | S813: BLACK/McDONALD
A814: BEST PLAYERS | W814: TEAM | X814: W | Y814: L | Z814: D | AA814: FOR | AB814: AGST | AC814: % | AD814: PTS
A815: DANDENONG | C815: PALLANT | F815: KAYE | I815: BRUNNEN | L815: MYNOTT | O815: SHINNERS | R815: TUFO
A816: CAMBERWELL | C816: SAMIOS | F816: JAKOBI | I816: SIMMONS | L816: CONSTANTINOU | W816: WAVERLEY | X816: 14 | Y816: 3 | Z816: 0 | AA816: 2050 | AB816: 1202 | AC816: =(AA816*100)/AB816 -> 170.54908485856905 | AD816: =(X816*4)+(Z816*2) -> 56
A817: GOALKICKERS | I817: D'ATRI | K817: FORSYTH | N817: ZIEMAN | P817: 3 SHORT | W817: WERRIBEE | X817: 14 | Y817: 3 | Z817: 0 | AA817: 1976 | AB817: 1332 | AC817: =(AA817*100)/AB817 -> 148.34834834834834 | AD817: =(X817*4)+(Z817*2) -> 56
A818: DANDENONG | C818: TUFO 4 | E818: PALLANT 3 | G818: LACKO 3 | I818: BRUNNEN 3 | K818: MILLIGAN | N818: SHINNERS | P818: WRIGHT | R818: D HALL | T818: KAYE | W818: PRAHRAN | X818: 13 | Y818: 4 | Z818: 0 | AA818: 2151 | AB818: 1414 | AC818: =(AA818*100)/AB818 -> 152.12164073550213 | AD818: =(X818*4)+(Z818*2) -> 52
A819: CAMBERWELL | C819: MAILING 4 | F819: FRAZER 3 | I819: CONSTANTINOU 2 | M819: BOWLER | O819: JACKSON | W819: SUNSHINE | X819: 13 | Y819: 4 | Z819: 0 | AA819: 1987 | AB819: 1455 | AC819: =(AA819*100)/AB819 -> 136.56357388316152 | AD819: =(X819*4)+(Z819*2) -> 52
A821: OAKLEIGH | C821: 4 | D821: 6 | E821: =C821*6+D821 -> 30 | G821: 11 | H821: 11 | I821: =G821*6+H821 -> 77 | K821: 20 | L821: 17 | M821: =K821*6+L821 -> 137 | O821: 27 | P821: 22 | Q821: =O821*6+P821 -> 184 | S821: PRINCES PARK, CAULFIELD | W821: OAKLEIGH | X821: 11 | Y821: 6 | Z821: 0 | AA821: 1904 | AB821: 1278 | AC821: =(AA821*100)/AB821 -> 148.98278560250392 | AD821: =(X821*4)+(Z821*2) -> 44
A822: CAULFIELD | C822: 1 | D822: 3 | E822: =C822*6+D822 -> 9 | G822: 1 | H822: 7 | I822: =G822*6+H822 -> 13 | K822: 1 | L822: 8 | M822: =K822*6+L822 -> 14 | O822: 3 | P822: 11 | Q822: =O822*6+P822 -> 29 | W822: DANDENONG | X822: 11 | Y822: 6 | Z822: 0 | AA822: 1986 | AB822: 1355 | AC822: =(AA822*100)/AB822 -> 146.56826568265683 | AD822: =(X822*4)+(Z822*2) -> 44
A823: BEST PLAYERS | W823: CAMBERWELL | X823: 10 | Y823: 7 | Z823: 0 | AA823: 2218 | AB823: 1924 | AC823: =(AA823*100)/AB823 -> 115.28066528066527 | AD823: =(X823*4)+(Z823*2) -> 40
A824: OAKLEIGH | C824: BATTERSBY | F824: ROURKE | I824: CUNNINGHAM | L824: WALSH | O824: PRETTO | R824: VERBEEK | W824: BERWICK | X824: 5 | Y824: 12 | Z824: 0 | AA824: 1386 | AB824: 2251 | AC824: =(AA824*100)/AB824 -> 61.572634384717901 | AD824: =(X824*4)+(Z824*2) -> 20
A825: CAULFIELD | C825: CORBETT | F825: BROUGHILL | I825: EINSEDEL | L825: FIELD | O825: R VITACCA | R825: COX | W825: MORDIALLOC | X825: 4 | Y825: 13 | Z825: 0 | AA825: 1372 | AB825: 2356 | AC825: =(AA825*100)/AB825 -> 58.234295415959252 | AD825: =(X825*4)+(Z825*2) -> 16
A826: GOALKICKERS | W826: CAULFIELD | X826: 4 | Y826: 13 | Z826: 0 | AA826: 1210 | AB826: 2353 | AC826: =(AA826*100)/AB826 -> 51.423714407139819 | AD826: =(X826*4)+(Z826*2) -> 16
A827: OAKLEIGH | C827: PRETTO 9 | F827: GARBUIO 4 | H827: ROACH 4 | J827: VERBEEK 3 | L827: ROURKE 2 | N827: OWEN 2 | P827: MILUDGEVIC | S827: SUTHERLAND | W827: NORTHCOTE | X827: 3 | Y827: 14 | Z827: 0 | AA827: 1389 | AB827: 2708 | AC827: =(AA827*100)/AB827 -> 51.292466765140325 | AD827: =(X827*4)+(Z827*2) -> 12
A828: CAULFIELD | C828: LOGAN 2 | F828: HOGAN
A830: WERRIBEE | C830: 5 | D830: 6 | E830: =C830*6+D830 -> 36 | G830: 9 | H830: 9 | I830: =G830*6+H830 -> 63 | K830: 13 | L830: 11 | M830: =K830*6+L830 -> 89 | O830: 18 | P830: 16 | Q830: =O830*6+P830 -> 124 | S830: SUNSHINE
A831: SUNSHINE | C831: 1 | D831: 1 | E831: =C831*6+D831 -> 7 | G831: 5 | H831: 4 | I831: =G831*6+H831 -> 34 | K831: 9 | L831: 8 | M831: =K831*6+L831 -> 62 | O831: 13 | P831: 9 | Q831: =O831*6+P831 -> 87 | S831: GLEESON/HARVEY
A832: BEST PLAYERS
A833: WERRIBEE | C833: VASILOU | F833: DUNSTAN | I833: BROWN | L833: WALPOLE | O833: SMITH | R833: B MOLONEY
A834: SUNSHINE | C834: BLAKE | F834: MOSS | I834: BROWN | L834: SCANLON | O834: COOKE | R834: CALDWELL
A835: GOALKICKERS
A836: WERRIBEE | C836: TAYLOR 5 | F836: B MOLONEY 3 | I836: DUNSTAN 2 | K836: BROWN 2 | M836: HOPKINS 2 | O836: BONAT | Q836: VASILOU | S836: S MOLONEY | V836: GREY
A837: SUNSHINE | C837: SCANLON 2 | F837: COOKE 2 | H837: SHEPPERBOTTOM 2 | L837: MITROVSKI | N837: MOSS | P837: McQUALTER | S837: BROWN | V837: WAGLAND
A839: MORDIALLOC | C839: 6 | D839: 2 | E839: =C839*6+D839 -> 38 | G839: 11 | H839: 6 | I839: =G839*6+H839 -> 72 | K839: 16 | L839: 9 | M839: =K839*6+L839 -> 105 | O839: 23 | P839: 12 | Q839: =O839*6+P839 -> 150 | S839: MORDIALLOC
A840: NORTHCOTE | C840: 4 | D840: 2 | E840: =C840*6+D840 -> 26 | G840: 8 | H840: 3 | I840: =G840*6+H840 -> 51 | K840: 13 | L840: 8 | M840: =K840*6+L840 -> 86 | O840: 15 | P840: 11 | Q840: =O840*6+P840 -> 101 | S840: BRADSHAW/NEWMAN
A841: BEST PLAYERS
A842: MORDIALLOC | C842: NOT SUPPLIED
A843: NORTHCOTE | C843: SPROAT | F843: BERTOLLO | I843: EWING
A844: GOALKICKERS
A845: MORDIALLOC | C845: NICHOLAIDES 6 | F845: POLA 6 | H845: D COFFEY 3 | K845: ZAPPA 2 | M845: P EVANS 2 | O845: DINGLE 2 | Q845: YOUNG | S845: ALDRIDGE
A846: NORTHCOTE | C846: BERTOLLO 3 | F846: COURTS 3 | I846: PANJANI 2 | L846: FOX 2 | N846: PIERCE 2 | P846: REARDON | S846: SPROAT | U846: EWING
A848: PRAHRAN | C848: 8 | D848: 1 | E848: =C848*6+D848 -> 49 | G848: 12 | H848: 5 | I848: =G848*6+H848 -> 77 | K848: 18 | L848: 8 | M848: =K848*6+L848 -> 116 | O848: 21 | P848: 10 | Q848: =O848*6+P848 -> 136 | S848: BERWICK
A849: BERWICK | C849: 2 | D849: 1 | E849: =C849*6+D849 -> 13 | G849: 2 | H849: 3 | I849: =G849*6+H849 -> 15 | K849: 4 | L849: 3 | M849: =K849*6+L849 -> 27 | O849: 9 | P849: 5 | Q849: =O849*6+P849 -> 59 | S849: WARD/WILLIAMS
A850: BEST PLAYERS
A851: PRAHRAN | C851: FIELDING | F851: W WALFORD | I851: HAMILTON | L851: C WALFORD | O851: G GILES | R851: ELLETT
A852: BERWICK | C852: DEVINE | F852: SCOTT | I852: TRIGG | L852: S JOHNSON | O852: WRIGHT
A853: GOALKICKERS
A854: PRAHRAN | C854: HAMILTON 5 | F854: G GILES 5 | H854: REYNOLDS 2 | K854: WALDER 2 | N854: WALLACE 2 | Q854: TORCASIO | S854: TAYLOR | U854: S GILES | W854: MAZUREK | X854: SOULOS
A855: BERWICK | C855: MARTIN 3 | F855: WRIGHT 2 | I855: McGILL | K855: SCOTT | M855: ROGERS | O855: DAVIS
A857: BYE | C857: WAVERLEY
A859: ROUND 18 | E859: 23RD AUGUST | J859: WEATHER | S859: PLAYED AT
D860: 1ST QTR | H860: 2ND QTR | L860: 3RD QTR | P860: FINAL | S860: SUNSHINE
A861: SUNSHINE | C861: 0 | D861: 0 | E861: =C861*6+D861 -> 0 | G861: 0 | H861: 0 | I861: =G861*6+H861 -> 0 | K861: 0 | L861: 0 | M861: =K861*6+L861 -> 0 | O861: 0 | P861: 0 | Q861: =O861*6+P861 -> 0 | S861: UMPIRE | X861: LADDER | AB861: ROUND | AD861: 18
A862: CAULFIELD | C862: 0 | D862: 0 | E862: =C862*6+D862 -> 0 | G862: 0 | H862: 0 | I862: =G862*6+H862 -> 0 | K862: 0 | L862: 0 | M862: =K862*6+L862 -> 0 | O862: 0 | P862: 0 | Q862: =O862*6+P862 -> 0
A863: BEST PLAYERS | W863: TEAM | X863: W | Y863: L | Z863: D | AA863: FOR | AB863: AGST | AC863: % | AD863: PTS
A864: SUNSHINE
A865: CAULFIELD | D865: WALKOVER TO | W865: WERRIBEE | X865: 15 | Y865: 3 | Z865: 0 | AA865: 2110 | AB865: 1385 | AC865: =(AA865*100)/AB865 -> 152.34657039711192 | AD865: =(X865*4)+(Z865*2) -> 60
A866: GOALKICKERS | W866: WAVERLEY | X866: 14 | Y866: 4 | Z866: 0 | AA866: 2103 | AB866: 1302 | AC866: =(AA866*100)/AB866 -> 161.52073732718895 | AD866: =(X866*4)+(Z866*2) -> 56
A867: SUNSHINE | W867: PRAHRAN | X867: 14 | Y867: 4 | Z867: 0 | AA867: 2348 | AB867: 1466 | AC867: =(AA867*100)/AB867 -> 160.16371077762619 | AD867: =(X867*4)+(Z867*2) -> 56
A868: CAULFIELD | W868: SUNSHINE | X868: 14 | Y868: 4 | Z868: 0 | AA868: 1987 | AB868: 1455 | AC868: =(AA868*100)/AB868 -> 136.56357388316152 | AD868: =(X868*4)+(Z868*2) -> 56
W869: DANDENONG | X869: 12 | Y869: 6 | Z869: 0 | AA869: 2189 | AB869: 1439 | AC869: =(AA869*100)/AB869 -> 152.11952744961778 | AD869: =(X869*4)+(Z869*2) -> 48
A870: OAKLEIGH | C870: 4 | D870: 4 | E870: =C870*6+D870 -> 28 | G870: 8 | H870: 7 | I870: =G870*6+H870 -> 55 | K870: 12 | L870: 8 | M870: =K870*6+L870 -> 80 | O870: 15 | P870: 10 | Q870: =O870*6+P870 -> 100 | S870: OAKLEIGH | W870: OAKLEIGH | X870: 12 | Y870: 6 | Z870: 0 | AA870: 2004 | AB870: 1331 | AC870: =(AA870*100)/AB870 -> 150.56348610067619 | AD870: =(X870*4)+(Z870*2) -> 48
A871: WAVERLEY | C871: 2 | D871: 3 | E871: =C871*6+D871 -> 15 | G871: 2 | H871: 5 | I871: =G871*6+H871 -> 17 | K871: 4 | L871: 10 | M871: =K871*6+L871 -> 34 | O871: 6 | P871: 17 | Q871: =O871*6+P871 -> 53 | W871: CAMBERWELL | X871: 11 | Y871: 7 | Z871: 0 | AA871: 2218 | AB871: 1924 | AC871: =(AA871*100)/AB871 -> 115.28066528066527 | AD871: =(X871*4)+(Z871*2) -> 44
A872: BEST PLAYERS | W872: BERWICK | X872: 5 | Y872: 13 | Z872: 0 | AA872: 1470 | AB872: 2454 | AC872: =(AA872*100)/AB872 -> 59.902200488997558 | AD872: =(X872*4)+(Z872*2) -> 20
A873: OAKLEIGH | W873: MORDIALLOC | X873: 4 | Y873: 14 | Z873: 0 | AA873: 1424 | AB873: 2553 | AC873: =(AA873*100)/AB873 -> 55.777516647081868 | AD873: =(X873*4)+(Z873*2) -> 16
A874: WAVERLEY | W874: CAULFIELD | X874: 4 | Y874: 14 | Z874: 0 | AA874: 1210 | AB874: 2353 | AC874: =(AA874*100)/AB874 -> 51.423714407139819 | AD874: =(X874*4)+(Z874*2) -> 16
A875: GOALKICKERS | W875: NORTHCOTE | X875: 3 | Y875: 15 | Z875: 0 | AA875: 1442 | AB875: 2842 | AC875: =(AA875*100)/AB875 -> 50.738916256157637 | AD875: =(X875*4)+(Z875*2) -> 12
A876: OAKLEIGH
A877: WAVERLEY
A879: DANDENONG | C879: 7 | D879: 8 | E879: =C879*6+D879 -> 50 | G879: 13 | H879: 9 | I879: =G879*6+H879 -> 87 | K879: 26 | L879: 16 | M879: =K879*6+L879 -> 172 | O879: 31 | P879: 17 | Q879: =O879*6+P879 -> 203 | S879: DANDENONG
A880: BERWICK | C880: 2 | D880: 2 | E880: =C880*6+D880 -> 14 | G880: 6 | H880: 10 | I880: =G880*6+H880 -> 46 | K880: 7 | L880: 13 | M880: =K880*6+L880 -> 55 | O880: 11 | P880: 18 | Q880: =O880*6+P880 -> 84
A881: BEST PLAYERS
A882: DANDENONG
A883: BERWICK
A884: GOALKICKERS
A885: DANDENONG
A886: BERWICK
A888: PRAHRAN | C888: 12 | D888: 11 | E888: =C888*6+D888 -> 83 | G888: 17 | H888: 13 | I888: =G888*6+H888 -> 115 | K888: 22 | L888: 18 | M888: =K888*6+L888 -> 150 | O888: 29 | P888: 23 | Q888: =O888*6+P888 -> 197 | S888: TOORAK PARK
A889: MORDIALLOC | C889: 2 | D889: 1 | E889: =C889*6+D889 -> 13 | G889: 6 | H889: 5 | I889: =G889*6+H889 -> 41 | K889: 6 | L889: 8 | M889: =K889*6+L889 -> 44 | O889: 7 | P889: 10 | Q889: =O889*6+P889 -> 52
A890: BEST PLAYERS
A891: PRAHRAN
A892: MORDIALLOC
A893: GOALKICKERS
A894: PRAHRAN
A895: MORDIALLOC
A897: WERRIBEE | C897: 5 | D897: 1 | E897: =C897*6+D897 -> 31 | G897: 9 | H897: 5 | I897: =G897*6+H897 -> 59 | K897: 17 | L897: 5 | M897: =K897*6+L897 -> 107 | O897: 21 | P897: 8 | Q897: =O897*6+P897 -> 134 | S897: WERRIBEE
A898: NORTHCOTE | C898: 2 | D898: 4 | E898: =C898*6+D898 -> 16 | G898: 4 | H898: 6 | I898: =G898*6+H898 -> 30 | K898: 5 | L898: 9 | M898: =K898*6+L898 -> 39 | O898: 7 | P898: 11 | Q898: =O898*6+P898 -> 53
A899: BEST PLAYERS
A900: WERRIBEE
A901: NORTHCOTE
A902: GOALKICKERS
A903: WERRIBEE
A904: NORTHCOTE
A906: BYE | C906: CAMBERWELL
A908: FINALS
A909: 1ST SEMI | E909: 30TH AUGUST | J909: WEATHER | S909: PLAYED AT
D910: 1ST QTR | H910: 2ND QTR | L910: 3RD QTR | P910: FINAL | S910: JUNCTION OVAL
A911: PRAHRAN | C911: 2 | D911: 6 | E911: =C911*6+D911 -> 18 | G911: 9 | H911: 9 | I911: =G911*6+H911 -> 63 | K911: 14 | L911: 12 | M911: =K911*6+L911 -> 96 | O911: 19 | P911: 18 | Q911: =O911*6+P911 -> 132 | S911: UMPIRE
A912: SUNSHINE | C912: 5 | D912: 2 | E912: =C912*6+D912 -> 32 | G912: 8 | H912: 5 | I912: =G912*6+H912 -> 53 | K912: 12 | L912: 11 | M912: =K912*6+L912 -> 83 | O912: 15 | P912: 14 | Q912: =O912*6+P912 -> 104 | S912: HARVEY/WALKER
A913: BEST PLAYERS
A914: PRAHRAN | C914: WALDER | F914: G GILES | I914: ELLETT | L914: WALLACE | O914: BARNARD | R914: S GILES
A915: SUNSHINE | C915: PROTETTO | F915: CALDWELL | I915: LITCHFIELD | L915: BROWN | O915: MITROVSKI | R915: CATTANACH
A916: GOALKICKERS
A917: PRAHRAN | C917: G GILES 5 | F917: TAPPING 3 | H917: HAMILTON 3 | K917: CUTLER 2 | N917: REYNOLDS 2 | Q917: SOULOS | S917: WALDER | U917: WALLACE | W917: S GILES
A918: SUNSHINE | C918: LITCHFIELD 6 | F918: SHEPPERBOTTOM 3 | J918: CADDAYE 2 | M918: CUTAJAR | O918: JOHNSON | R918: MITROVSKI | U918: PROTETTO
A920: 2ND SEMI | E920: 6TH SEPTEMBER | J920: WEATHER
A921: WAVERLEY | C921: 4 | D921: 1 | E921: =C921*6+D921 -> 25 | G921: 10 | H921: 4 | I921: =G921*6+H921 -> 64 | K921: 14 | L921: 4 | M921: =K921*6+L921 -> 88 | O921: 19 | P921: 11 | Q921: =O921*6+P921 -> 125 | S921: JUNCTION OVAL
A922: WERRIBEE | C922: 4 | D922: 8 | E922: =C922*6+D922 -> 32 | G922: 4 | H922: 8 | I922: =G922*6+H922 -> 32 | K922: 12 | L922: 12 | M922: =K922*6+L922 -> 84 | O922: 16 | P922: 12 | Q922: =O922*6+P922 -> 108 | S922: BRADY/NOLAN
A923: BEST PLAYERS
A924: WAVERLEY | C924: BREWER | F924: ROGERSON | I924: KENDALL | L924: PEARSON | O924: KINNABURGH | R924: CASTILLO
A925: WERRIBEE | C925: HOPKINS | F925: SINNOTT | I925: GUINTA | L925: GORDON | O925: SMITH | R925: WALPOLE
A926: GOALKICKERS
A927: WAVERLEY | C927: BREWER 11 | F927: HUNT 2 | H927: COLE 2 | J927: KINNABURGH 2 | M927: CASTILLO | O927: BROOKS
A928: WERRIBEE | C928: GORDON 4 | F928: MONTGOMERY 3 | I928: TAYLOR 2 | K928: VASILOU 2 | N928: HOPKINS 2 | Q928: MOLONEY | S928: BROWN | U928: FREEMAN
A930: PRELIMINARY | E930: 13TH SEPTEMBER | J930: WEATHER
A931: PRAHRAN | C931: 5 | D931: 2 | E931: =C931*6+D931 -> 32 | G931: 9 | H931: 4 | I931: =G931*6+H931 -> 58 | K931: 12 | L931: 6 | M931: =K931*6+L931 -> 78 | O931: 19 | P931: 11 | Q931: =O931*6+P931 -> 125 | S931: JUNCTION OVAL
A932: WERRIBEE | C932: 3 | D932: 3 | E932: =C932*6+D932 -> 21 | G932: 8 | H932: 5 | I932: =G932*6+H932 -> 53 | K932: 12 | L932: 8 | M932: =K932*6+L932 -> 80 | O932: 14 | P932: 10 | Q932: =O932*6+P932 -> 94 | S932: CASEY/MORROW
A933: BEST PLAYERS
A934: PRAHRAN | C934: MAZUREK | F934: BARNARD | I934: TAPPING | L934: CUTLER | O934: REYNOLDS | R934: WALLACE
A935: WERRIBEE | C935: GUDDE | F935: B MOLONEY | I935: WALPOLE | L935: GORDON | O935: SMITH | R935: BONAT
A936: GOALKICKERS
A937: PRAHRAN | C937: G GILES 4 | F937: REYNOLDS 3 | I937: CUTLER 3 | K937: HAMILTON 2 | N937: TAPPING 2 | P937: BINGHAM | R937: SOULOS | T937: TORCASIO | W937: BARNARD | X937: MAZUREK
A938: WERRIBEE | C938: B MOLONEY 4 | F938: GORDON 3 | I938: FREEMAN 2 | L938: DUNSTAN | N938: BROWN | P938: JONES | R938: MONTGOMERY | V938: FRASER
A940: GRAND | E940: 20TH SEPTEMBER | J940: WEATHER
A941: PRAHRAN | C941: 7 | D941: 5 | E941: =C941*6+D941 -> 47 | G941: 8 | H941: 6 | I941: =G941*6+H941 -> 54 | K941: 15 | L941: 8 | M941: =K941*6+L941 -> 98 | O941: 18 | P941: 9 | Q941: =O941*6+P941 -> 117 | S941: JUNCTION OVAL
A942: WAVERLEY | C942: 2 | D942: 0 | E942: =C942*6+D942 -> 12 | G942: 7 | H942: 4 | I942: =G942*6+H942 -> 46 | K942: 9 | L942: 7 | M942: =K942*6+L942 -> 61 | O942: 14 | P942: 14 | Q942: =O942*6+P942 -> 98 | S942: MARSHALL/VERGONA
A943: BEST PLAYERS
A944: PRAHRAN | C944: TAPPING | F944: WALDER | I944: WALLACE | L944: HUTCISON | O944: ELLETT | R944: BINGHAM
A945: WAVERLEY | C945: CASTILLO | F945: BREWER | I945: SHAW | L945: VEAR | O945: BROOKES
A946: GOALKICKERS
A947: PRAHRAN | C947: G GILES 3 | F947: BINGHAM 2 | I947: SOULOS 2 | K947: REYNOLDS 2 | N947: HUTCHISON 2 | Q947: CUTLER 2 | S947: HAMILTON | V947: TAPPING | X947: WALDER | Z947: ELLETT | AB947: TAYLOR
A948: WAVERLEY | C948: CASTILLO 3 | F948: BREWER 3 | I948: BROOKES 3 | L948: HUNT | N948: BURNS | P948: VEAR | R948: ROGERSON | U948: PEARSON