A1: Victorian Football Association
A2: Season 1988 - Division One
A3: © Copyright Wal Williams | F3: First created: 14 November 2015
A4: Contact: joywalwi at gmail dot com | F4: Last updated: 3 December 2016 | W4: VFA Results and tables - Link to the main index page
A5: You are free to copy this document in whole or part provided that proper acknowledgement is given to the author. All rights reserved.
A7: 1988 | C7: 1ST DIVISION
A8: ROUND 1 | D8: 10TH APRIL | I8: WEATHER | S8: VENUE: BRUNSWICK
D9: 1ST QTR | H9: 2ND QTR | L9: 3RD QTR | P9: FINAL | S9: UMPIRES
A10: BRUNSWICK | C10: 5 | D10: 3 | E10: 33 | G10: 9 | H10: 8 | I10: 62 | K10: 13 | L10: 10 | M10: 88 | O10: 16 | P10: 17 | Q10: 113 | S10: BRADY | X10: LADDER | AB10: ROUND | AD10: 1
A11: PRESTON | C11: 6 | D11: 1 | E11: 37 | G11: 7 | H11: 5 | I11: 47 | K11: 10 | L11: 9 | M11: 69 | O11: 13 | P11: 11 | Q11: 89 | S11: GLEESON
A12: BEST PLAYERS | W12: TEAM | X12: W | Y12: L | Z12: D | AA12: FOR | AB12: AGST | AC12: % | AD12: PTS
A13: BRUNSWICK | C13: W SMITH | F13: WRIGHT | I13: PERRY | L13: DUGDALE | O13: POTTER | R13: HENDERSON
A14: PRESTON | C14: ANDERSON | F14: NICOLAOU | I14: SENNO | L14: DUNBAR | O14: MARCON | W14: COBURG | X14: 1 | Y14: 0 | Z14: 0 | AA14: 123 | AB14: 61 | AC14: =(AA14/AB14)*100 -> 201.63934426229505 | AD14: =(X14*4)+(Z14*2) -> 4
A15: GOALKICKERS | Q15: THOROGOOD | W15: PORT MELBOURNE | X15: 1 | Y15: 0 | Z15: 0 | AA15: 171 | AB15: 88 | AC15: =(AA15/AB15)*100 -> 194.31818181818181 | AD15: =(X15*4)+(Z15*2) -> 4
A16: BRUNSWICK | C16: PERRY 6 | E16: POTTER 2 | G16: BERTOLLO 2 | J16: HYSLOP | L16: HENDERSON | O16: WRIGHT | Q16: A SMITH | S16: THORNTON | W16: SPRINGVALE | X16: 1 | Y16: 0 | Z16: 0 | AA16: 132 | AB16: 93 | AC16: =(AA16/AB16)*100 -> 141.93548387096774 | AD16: =(X16*4)+(Z16*2) -> 4
A17: PRESTON | C17: LUMICISI 4 | F17: NICOLAOU 3 | I17: HALAS 3 | K17: PLOWMAN 2 | N17: SENNO | W17: FRANKSTON | X17: 1 | Y17: 0 | Z17: 0 | AA17: 128 | AB17: 97 | AC17: =(AA17/AB17)*100 -> 131.95876288659792 | AD17: =(X17*4)+(Z17*2) -> 4
S18: VENUE: FRANKSTON
A19: FRANKSTON | C19: 6 | D19: 5 | E19: 41 | G19: 10 | H19: 9 | I19: 69 | K19: 16 | L19: 12 | M19: 108 | O19: 18 | P19: 20 | Q19: 128 | S19: BLACK | W19: BRUNSWICK | X19: 1 | Y19: 0 | Z19: 0 | AA19: 113 | AB19: 89 | AC19: =(AA19/AB19)*100 -> 126.96629213483146 | AD19: =(X19*4)+(Z19*2) -> 4
A20: BOX HILL | C20: 2 | D20: 1 | E20: 13 | G20: 6 | H20: 3 | I20: 39 | K20: 8 | L20: 5 | M20: 53 | O20: 15 | P20: 7 | Q20: 97 | S20: NOLAN | W20: PRESTON | X20: 0 | Y20: 1 | Z20: 0 | AA20: 89 | AB20: 113 | AC20: =(AA20/AB20)*100 -> 78.761061946902657 | AD20: =(X20*4)+(Z20*2) -> 0
A21: BEST PLAYERS | W21: BOX HILL | X21: 0 | Y21: 1 | Z21: 0 | AA21: 97 | AB21: 128 | AC21: =(AA21/AB21)*100 -> 75.78125 | AD21: =(X21*4)+(Z21*2) -> 0
A22: FRANKSTON | C22: ATKINS | F22: MEEHAN | I22: MARTIN | L22: SARAU | O22: LANE | R22: GARDNER | W22: SANDRINGHAM | X22: 0 | Y22: 1 | Z22: 0 | AA22: 93 | AB22: 132 | AC22: =(AA22/AB22)*100 -> 70.454545454545453 | AD22: =(X22*4)+(Z22*2) -> 0
A23: BOX HILL | C23: PEVITT | F23: MORRISON | I23: COLLINS | L23: ROBERTSON | O23: GARTH | W23: PRAHRAN | X23: 0 | Y23: 1 | Z23: 0 | AA23: 88 | AB23: 171 | AC23: =(AA23/AB23)*100 -> 51.461988304093566 | AD23: =(X23*4)+(Z23*2) -> 0
A24: GOALKICKERS | W24: WILLIAMSTOWN | X24: 0 | Y24: 1 | Z24: 0 | AA24: 61 | AB24: 123 | AC24: =(AA24/AB24)*100 -> 49.59349593495935 | AD24: =(X24*4)+(Z24*2) -> 0
A25: FRANKSTON | C25: WHITFIELD 5 | F25: LANE 4 | H25: CROSS 2 | J25: GARDNER 2 | M25: MEEHAN 2 | O25: SARAU | Q25: P MARTIN | S25: HAMILL
A26: BOX HILL | C26: GARTH 3 | F26: HOCKING 3 | I26: HOGAN 2 | K26: NICHOLSON 2 | N26: BOLTON 2 | Q26: P BOURKE | S26: D BOURKE
A28: PORT MELBOURNE | C28: 6 | D28: 6 | E28: 42 | G28: 10 | H28: 8 | I28: 68 | K28: 20 | L28: 11 | M28: 131 | O28: 26 | P28: 15 | Q28: 171 | S28: VENUE: PORT MELBOURNE
A29: PRAHRAN | C29: 7 | D29: 0 | E29: 42 | G29: 10 | H29: 3 | I29: 63 | K29: 12 | L29: 3 | M29: 75 | O29: 13 | P29: 10 | Q29: 88 | S29: HARVEY :WALKER
A30: BEST PLAYERS
A31: PORT MELBOURNE | C31: CHADBAND | F31: WHITZELL | I31: BRADBURY | L31: SNEDDON | O31: DERMOTT | R31: RAMSAY
A32: PRAHRAN | C32: GILES | F32: WALDRON | I32: FRANCIS | L32: HUTCHISON | O32: HIPWORTH
A33: GOALKICKERS
A34: PORT MELBOURNE | C34: HICKS 6 | E34: SNEDDON 5 | H34: SAGGERS 5 | J34: HETHERTON 3 | M34: McCORMACK 2 | P34: WHITZELL 2 | R34: RAMSAY | U34: MUTIMER | X34: RICE
A35: PRAHRAN | C35: FRANCIS 3 | F35: HEWITSON 2 | I35: HUTCHISON 2 | L35: HUNT 2 | N35: HAMILTTON | Q35: HIPWORTH | T35: WALDER | W35: CUTLER
A37: SPRINGVALE | C37: 3 | D37: 4 | E37: 22 | G37: 7 | H37: 7 | I37: 49 | K37: 15 | L37: 15 | M37: 105 | O37: 19 | P37: 18 | Q37: 132 | S37: VENUE: SPRINGVALE
A38: SANDRINGHAM | C38: 3 | D38: 4 | E38: 22 | G38: 7 | H38: 8 | I38: 50 | K38: 9 | L38: 10 | M38: 64 | O38: 13 | P38: 15 | Q38: 93 | S38: G CASEY :MORROW
A39: BEST PLAYERS
A40: SPRINGVALE | C40: DEMPSTER | F40: WARNER | I40: MENDE | L40: NORMAN | O40: REECE | Q40: NEWMAN
A41: SANDRINGHAM | C41: FITZGERALD | F41: RYAN | I41: BEILBY | L41: MACLEOD | O41: IRWIN | Q41: ERWIN
A42: GOALKICKERS
A43: SPRINGVALE | C43: VERNON 4 | F43: STEWART 4 | I43: REECE 3 | K43: DUDLEY 3 | M43: MALONEY | O43: JACKSON | Q43: HUNTER | S43: NEWMAN | V43: WARD
A44: SANDRINGHAM | C44: HOWELL 4 | F44: MACLEOD 3 | I44: IRWIN 2 | K44: BEILBY | M44: EAVES | O44: BERGMAN | Q44: KERRISON
D45: 9TH APRIL
A46: COBURG | C46: 3 | D46: 6 | E46: 24 | G46: 4 | H46: 7 | I46: 31 | K46: 8 | L46: 18 | M46: 66 | O46: 17 | P46: 21 | Q46: 123 | S46: VENUE: PORT MELBOURNE
A47: WILLIAMSTOWN | C47: 0 | D47: 0 | E47: 0 | G47: 2 | H47: 6 | I47: 18 | K47: 5 | L47: 8 | M47: 38 | O47: 8 | P47: 13 | Q47: 61 | S47: MARSHALL :VERGONA
A48: BEST PLAYERS
A49: COBURG | C49: SHELDON | F49: INGRAM | I49: NIMMO | L49: HARBINSON | O49: EADE | Q49: TARANTO
A50: WILLIAMSTOWN | C50: ROUND | F50: SLEVISON | I50: KENNEDY | L50: TAYLOR | O50: CAHILL
A51: GOALKICKERS
A52: COBURG | C52: INGRAM 6 | F52: KAAKOUR 4 | I52: DARBY 3 | K52: EADE | M52: WILLIAMS | O52: TARANTO | Q52: ANGWIN
A53: WILLIAMSTOWN | C53: WHILLAS 3 | F53: BROOKS 2 | I53: CAHILL 2 | L53: ROUND
A55: ROUND 2 | D55: 16TH APRIL | I55: WEATHER | S55: VENUE: PORT MELBOURNE
D56: 1ST QTR | H56: 2ND QTR | L56: 3RD QTR | P56: FINAL | S56: UMPIRES
A57: SANDRINGHAM | C57: 7 | D57: 4 | E57: 46 | G57: 8 | H57: 8 | I57: 56 | K57: 12 | L57: 14 | M57: 86 | O57: 16 | P57: 19 | Q57: 115 | S57: BLACK | X57: LADDER | AB57: ROUND | AD57: 2
A58: BRUNSWICK | C58: 3 | D58: 2 | E58: 20 | G58: 8 | H58: 6 | I58: 54 | K58: 11 | L58: 9 | M58: 75 | O58: 15 | P58: 11 | Q58: 101 | S58: NOLAN
A59: BEST PLAYERS | W59: TEAM | X59: W | Y59: L | Z59: D | AA59: FOR | AB59: AGST | AC59: % | AD59: PTS
A60: SANDRINGHAM | C60: RYAN | F60: MACLEOD | I60: BENNETT | L60: EAVES
A61: BRUNSWICK | C61: DUGDALE | F61: LOVETT | I61: HOLMES | L61: CALLANDER | O61: POTTER | R61: McALLESTER | W61: SPRINGVALE | X61: 2 | Y61: 0 | Z61: 0 | AA61: 246 | AB61: 141 | AC61: =(AA61/AB61)*100 -> 174.468085106383 | AD61: =(X61*4)+(Z61*2) -> 8
A62: GOALKICKERS | W62: PORT MELBOURNE | X62: 2 | Y62: 0 | Z62: 0 | AA62: 322 | AB62: 198 | AC62: =(AA62/AB62)*100 -> 162.62626262626264 | AD62: =(X62*4)+(Z62*2) -> 8
A63: SANDRINGHAM | C63: BENNETT 7 | F63: KRISTENSEN 3 | I63: IRWIN 2 | K63: HOWELL | M63: EAVES | O63: BERGMAN | R63: ALLEN | W63: COBURG | X63: 1 | Y63: 1 | Z63: 0 | AA63: 228 | AB63: 187 | AC63: =(AA63/AB63)*100 -> 121.92513368983957 | AD63: =(X63*4)+(Z63*2) -> 4
A64: BRUNSWICK | C64: BERTOLLO 4 | F64: McALLESTER 3 | I64: CALLANDER 2 | L64: PERRY | N64: POTTER | P64: WRIGHT | R64: THORNTON | W64: WILLIAMSTOWN | X64: 1 | Y64: 1 | Z64: 0 | AA64: 195 | AB64: 180 | AC64: =(AA64/AB64)*100 -> 108.33333333333333 | AD64: =(X64*4)+(Z64*2) -> 4
D65: 17TH APRIL | N65: LEAHY | Q65: LOVETT | S65: VENUE: WILLIAMSTOWN
A66: WILLIAMSTOWN | C66: 3 | D66: 0 | E66: 18 | G66: 8 | H66: 4 | I66: 52 | K66: 11 | L66: 7 | M66: 73 | O66: 20 | P66: 14 | Q66: 134 | S66: CARUSO | W66: BRUNSWICK | X66: 1 | Y66: 1 | Z66: 0 | AA66: 214 | AB66: 204 | AC66: =(AA66/AB66)*100 -> 104.90196078431373 | AD66: =(X66*4)+(Z66*2) -> 4
A67: FRANKSTON | C67: 2 | D67: 2 | E67: 14 | G67: 2 | H67: 7 | I67: 19 | K67: 7 | L67: 12 | M67: 54 | O67: 7 | P67: 15 | Q67: 57 | S67: MORROW | W67: PRESTON | X67: 1 | Y67: 1 | Z67: 0 | AA67: 215 | AB67: 228 | AC67: =(AA67/AB67)*100 -> 94.298245614035096 | AD67: =(X67*4)+(Z67*2) -> 4
A68: BEST PLAYERS | W68: SANDRINGHAM | X68: 1 | Y68: 1 | Z68: 0 | AA68: 208 | AB68: 233 | AC68: =(AA68/AB68)*100 -> 89.27038626609442 | AD68: =(X68*4)+(Z68*2) -> 4
A69: WILLIAMSTOWN | C69: KENNEDY | F69: McTAGGART | I69: SLEVISON | L69: CAHILL | O69: DELRE | Q69: DUGGAN | W69: FRANKSTON | X69: 1 | Y69: 1 | Z69: 0 | AA69: 185 | AB69: 231 | AC69: =(AA69/AB69)*100 -> 80.086580086580085 | AD69: =(X69*4)+(Z69*2) -> 4
A70: FRANKSTON | C70: SARAU | F70: ATKINS | I70: BEATON | L70: RAVEN | O70: PAYNE | Q70: S HAMILL | W70: BOX HILL | X70: 0 | Y70: 2 | Z70: 0 | AA70: 207 | AB70: 279 | AC70: =(AA70/AB70)*100 -> 74.193548387096769 | AD70: =(X70*4)+(Z70*2) -> 0
A71: GOALKICKERS | M71: WEBSTER | P71: V DIMARTINO | S71: SLEVISON | W71: PRAHRAN | X71: 0 | Y71: 2 | Z71: 0 | AA71: 136 | AB71: 285 | AC71: =(AA71/AB71)*100 -> 47.719298245614034 | AD71: =(X71*4)+(Z71*2) -> 0
A72: WILLIAMSTOWN | C72: McKAY 4 | E72: BROOKS 2 | G72: CAHILL 2 | I72: McTAGGART 2 | L72: ROBERTSON 2 | O72: RAEBURN 2 | Q72: NILSSEN 2 | S72: KENNEDY
A73: FRANKSTON | C73: WHITFIELD 3 | F73: BINGLEY 2 | I73: O'BRIEN | K73: PAYNE
A75: PORT MELBOURNE | C75: 3 | D75: 2 | E75: 20 | G75: 7 | H75: 8 | I75: 50 | K75: 16 | L75: 11 | M75: 107 | O75: 23 | P75: 13 | Q75: 151 | S75: VENUE: BOX HILL
A76: BOX HILL | C76: 1 | D76: 5 | E76: 11 | G76: 8 | H76: 9 | I76: 57 | K76: 10 | L76: 11 | M76: 71 | O76: 16 | P76: 14 | Q76: 110 | S76: BRADY :GLEESON
A77: BEST PLAYERS
A78: PORT MELBOURNE | C78: STROOPER | F78: WHITZELL | I78: HETHERTON | L78: ALLENDER | O78: SNEDDON | R78: CHADBAND
A79: BOX HILL | C79: P BOURKE | F79: HOCKING | I79: PEVITT | L79: BROWN | O79: GERADTS | R79: COLLINS
A80: GOALKICKERS
A81: PORT MELBOURNE | C81: WHITZELL 5 | F81: SNEDDON 3 | I81: HETHERTON 3 | L81: S SCURRAH 3 | O81: McCORMACK 2 | R81: FOLEY 2 | U81: SHOLL 2 | X81: SAGGERS | AA81: RICE | AB81: SWAN
A82: BOX HILL | C82: HOCKING 5 | F82: BOLTON 2 | I82: P BOURKE 2 | L82: GLARE 2 | N82: DONOGHUE 2 | Q82: GARTH | S82: BROWN | V82: COOPER
A84: SPRINGVALE | C84: 1 | D84: 4 | E84: 10 | G84: 4 | H84: 10 | I84: 34 | K84: 10 | L84: 10 | M84: 70 | O84: 16 | P84: 18 | Q84: 114 | S84: VENUE: TOORAK PARK
A85: PRAHRAN | C85: 2 | D85: 5 | E85: 17 | G85: 3 | H85: 8 | I85: 26 | K85: 3 | L85: 11 | M85: 29 | O85: 6 | P85: 12 | Q85: 48 | S85: VERGONA ;MARSHALL
A86: BEST PLAYERS
A87: SPRINGVALE | C87: KING | F87: WARNER | I87: RICHARDS | L87: MALONI | O87: REECE | R87: NEWMAN
A88: PRAHRAN | C88: HIPWORTH | F88: MCCARTY | I88: S GILES | L88: G GILES | O88: CARTLEDGE
A89: GOALKICKERS
A90: SPRINGVALE | C90: ROBINSON 4 | F90: REECE 3 | H90: VERNON 2 | J90: DUDLEY 2 | M90: PROSSER | O90: NORMAN | Q90: STEWART | S90: ROBERTSON | W90: KING
A91: PRAHRAN | C91: G GILES 2 | F91: HEWITSON | I91: HUTCHISON | L91: HUNT | N91: WALDER
A93: PRESTON | C93: 5 | D93: 8 | E93: 38 | G93: 7 | H93: 11 | I93: 53 | K93: 16 | L93: 14 | M93: 110 | O93: 18 | P93: 18 | Q93: 126 | S93: VENUE: PRESTON
A94: COBURG | C94: 2 | D94: 2 | E94: 14 | G94: 11 | H94: 9 | I94: 75 | K94: 14 | L94: 12 | M94: 97 | O94: 16 | P94: 19 | Q94: 115 | S94: HARVEY ;WALKER
A95: BEST PLAYERS
A96: PRESTON | C96: DUNBAR | F96: MARCON | I96: VALKANIS | L96: ANDERSON | O96: JORDAN | R96: LUMICISI
A97: COBURG | C97: REYNOLDSON | F97: DARBY | I97: SHELDON | L97: HARBINSON
A98: GOALKICKERS
A99: PRESTON | C99: JORDAN 6 | F99: LUMICISI 3 | I99: HALAS 3 | K99: PLOWMAN 2 | N99: SENNO 2 | P99: LAWSON | R99: CHARISIOU
A100: COBURG | C100: DARBY 5 | F100: WILLIAMS 5 | I100: EADE 2 | K100: INGRAM | M100: KAAKOUR | P100: TARANTO | R100: WEIDEMAN
A102: ROUND 3 | D102: 24TH APRIL | I102: WEATHER | S102: VENUE: BRUNSWICK
D103: 1ST QTR | H103: 2ND QTR | L103: 3RD QTR | P103: FINAL | S103: UMPIRES
A104: BRUNSWICK | C104: 3 | D104: 2 | E104: 20 | G104: 7 | H104: 4 | I104: 46 | K104: 14 | L104: 8 | M104: 92 | O104: 18 | P104: 14 | Q104: 122 | S104: BRADY | X104: LADDER | AB104: ROUND | AD104: 3
A105: PRAHRAN | C105: 2 | D105: 2 | E105: 14 | G105: 4 | H105: 5 | I105: 29 | K105: 10 | L105: 9 | M105: 69 | O105: 13 | P105: 12 | Q105: 90 | S105: MORROW
A106: BEST PLAYERS | W106: TEAM | X106: W | Y106: L | Z106: D | AA106: FOR | AB106: AGST | AC106: % | AD106: PTS
A107: BRUNSWICK | C107: MCALLESTER | F107: THOROGOOD | I107: FITZPATRICK | L107: DUGDALE | O107: LOVETT | R107: CALLANDER
A108: PRAHRAN | C108: GILES | F108: KILEY | I108: PAGE | L108: CARTLEDGE | O108: McCARTY | R108: MAZUREK | W108: SPRINGVALE | X108: 3 | Y108: 0 | Z108: 0 | AA108: 443 | AB108: 237 | AC108: =(AA108/AB108)*100 -> 186.91983122362871 | AD108: =(X108*4)+(Z108*2) -> 12
A109: GOALKICKERS | M109: McALLESTER | P109: LEAHY | R109: SMITH | W109: PORT MELBOURNE | X109: 3 | Y109: 0 | Z109: 0 | AA109: 462 | AB109: 325 | AC109: =(AA109/AB109)*100 -> 142.15384615384616 | AD109: =(X109*4)+(Z109*2) -> 12
A110: BRUNSWICK | C110: WRIGHT 4 | E110: FITZPATRICK 3 | H110: POTTER 2 | J110: REID 2 | L110: HOLMES 2 | N110: THORNTON | Q110: BERTOLLO | W110: COBURG | X110: 2 | Y110: 1 | Z110: 0 | AA110: 374 | AB110: 278 | AC110: =(AA110/AB110)*100 -> 134.53237410071944 | AD110: =(X110*4)+(Z110*2) -> 8
A111: PRAHRAN | C111: G GILES 4 | F111: SOULOS 4 | I111: REYNOLDS 2 | L111: KILEY 2 | N111: TAPPING | W111: BRUNSWICK | X111: 2 | Y111: 1 | Z111: 0 | AA111: 336 | AB111: 294 | AC111: =(AA111/AB111)*100 -> 114.28571428571428 | AD111: =(X111*4)+(Z111*2) -> 8
S112: VENUE: FRANKSTON
A113: COBURG | C113: 5 | D113: 3 | E113: 33 | G113: 10 | H113: 6 | I113: 66 | K113: 19 | L113: 11 | M113: 125 | O113: 22 | P113: 14 | Q113: 146 | S113: MARSHALL | W113: PRESTON | X113: 2 | Y113: 1 | Z113: 0 | AA113: 328 | AB113: 328 | AC113: =(AA113/AB113)*100 -> 100 | AD113: =(X113*4)+(Z113*2) -> 8
A114: FRANKSTON | C114: 3 | D114: 2 | E114: 20 | G114: 6 | H114: 5 | I114: 41 | K114: 9 | L114: 5 | M114: 59 | O114: 14 | P114: 7 | Q114: 91 | S114: GLEESON | W114: WILLIAMSTOWN | X114: 1 | Y114: 2 | Z114: 0 | AA114: 322 | AB114: 320 | AC114: =(AA114/AB114)*100 -> 100.625 | AD114: =(X114*4)+(Z114*2) -> 4
A115: BEST PLAYERS | W115: SANDRINGHAM | X115: 1 | Y115: 2 | Z115: 0 | AA115: 318 | AB115: 326 | AC115: =(AA115/AB115)*100 -> 97.546012269938657 | AD115: =(X115*4)+(Z115*2) -> 4
A116: COBURG | C116: RACOVOLIS | F116: HARBINSON | I116: TARANTO | L116: WILLIAMS | O116: REYNOLDSON | W116: FRANKSTON | X116: 1 | Y116: 2 | Z116: 0 | AA116: 276 | AB116: 377 | AC116: =(AA116/AB116)*100 -> 73.209549071618042 | AD116: =(X116*4)+(Z116*2) -> 4
A117: FRANKSTON | C117: SARAU | F117: PAYNE | I117: ATKINS | L117: RAVEN | O117: THOMAS | W117: BOX HILL | X117: 0 | Y117: 3 | Z117: 0 | AA117: 303 | AB117: 476 | AC117: =(AA117/AB117)*100 -> 63.655462184873947 | AD117: =(X117*4)+(Z117*2) -> 0
A118: GOALKICKERS | N118: WAIN 2 | P118: EADE | R118: ALLISON | W118: PRAHRAN | X118: 0 | Y118: 3 | Z118: 0 | AA118: 226 | AB118: 407 | AC118: =(AA118/AB118)*100 -> 55.528255528255535 | AD118: =(X118*4)+(Z118*2) -> 0
A119: COBURG | C119: WILLIAMS 5 | F119: REYNOLDSON 4 | I119: DARBY 3 | K119: KAAKOUR 2 | N119: FREEMAN 2 | Q119: RACOVOLIS 2
A120: FRANKSTON | C120: BINGLEY 4 | E120: WHITFIELD 3 | H120: LANE | J120: S HAMILL | L120: O'BRIEN | N120: AMOORE | P120: BARDOEL
A122: SPRINGVALE | C122: 6 | D122: 4 | E122: 40 | G122: 12 | H122: 10 | I122: 82 | K122: 18 | L122: 11 | M122: 119 | O122: 30 | P122: 17 | Q122: 197 | S122: VENUE: SPRINGVALE
A123: BOX HILL | C123: 3 | D123: 5 | E123: 23 | G123: 6 | H123: 7 | I123: 43 | K123: 11 | L123: 10 | M123: 76 | O123: 14 | P123: 12 | Q123: 96 | S123: BLACK :N McDONALD
A124: BEST PLAYERS
A125: SPRINGVALE | C125: HUNTER | F125: K ROBINSON | I125: DEMPSTER | L125: WARD | O125: RICHARDS | R125: MENDE
A126: BOX HILL | C126: D BOURKE | F126: GERADTS | I126: PEVITT | L126: TURNER | O126: HOGAN
A127: GOALKICKERS
A128: SPRINGVALE | C128: K ROBINSON 7 | F128: MALONI 5 | I128: VERNON 4 | K128: PROSSER 3 | M128: DUDLEY 2 | O128: HUNTER 2 | Q128: STEWART 2 | T128: WARD | W128: NORMAN | Y128: MENDE | AA128: MEADE | AC128: McCORMACK
A129: BOX HILL | C129: HOGAN 5 | F129: PEVITT 3 | I129: NICHOLSON 2 | L129: D BOURKE 2 | O129: P BOURKE | Q129: HOCKING
A131: PRESTON | C131: 7 | D131: 1 | E131: 43 | G131: 9 | H131: 8 | I131: 62 | K131: 12 | L131: 14 | M131: 86 | O131: 16 | P131: 17 | Q131: 113 | S131: VENUE: BEACH ROAD
A132: SANDRINGHAM | C132: 2 | D132: 5 | E132: 17 | G132: 8 | H132: 8 | I132: 56 | K132: 14 | L132: 10 | M132: 94 | O132: 16 | P132: 14 | Q132: 110 | S132: VERGONA :CARUSO
A133: BEST PLAYERS
A134: PRESTON | C134: MARCON | F134: DUNBAR | I134: BROWN | L134: HALAS | O134: SENNO | R134: NICOLAOU
A135: SANDRINGHAM | C135: PHILBEY | F135: HOWELL | I135: FITZGERALD | L135: BEILBY | O135: IRWIN
A136: GOALKICKERS
A137: PRESTON | C137: HALAS 4 | F137: SALVADOR 4 | I137: LUMICISI 2 | K137: SENNO 2 | M137: PRIDEAUX 2 | P137: JORDAN | R137: CHARISOU
A138: SANDRINGHAM | C138: EAVES 4 | F138: HOWELL 3 | I138: IRWIN 3 | K138: BENNETT 3 | M138: BERGMAN | P138: ERWIN | R138: BONNEY
D139: 23RD APRIL | M139: BROWN | O139: O'RILEY
A140: PORT MELBOURNE | C140: 4 | D140: 6 | E140: 30 | G140: 7 | H140: 12 | I140: 54 | K140: 16 | L140: 17 | M140: 113 | O140: 20 | P140: 20 | Q140: 140 | S140: VENUE: PORT MELBOURNE
A141: WILLIAMSTOWN | C141: 0 | D141: 6 | E141: 6 | G141: 5 | H141: 6 | I141: 36 | K141: 13 | L141: 6 | M141: 84 | O141: 20 | P141: 7 | Q141: 127 | S141: WALKER :HARVEY
A142: BEST PLAYERS
A143: PORT MELBOURNE | C143: CHADBAND | F143: MCCORMACK | I143: SCHOLL | L143: SWAN | O143: ALLENDER | R143: RICE
A144: WILLIAMSTOWN | C144: McTAGGART | F144: ROUND | I144: CAHILL | L144: DUGGAN | O144: KENNEDY | R144: TAYLOR
A145: GOALKICKERS
A146: PORT MELBOURNE | C146: McCORMACK 4 | F146: SAGGERS 3 | I146: HETHERTON 3 | L146: SCHOLL 3 | N146: RICE 2 | P146: MISITI 2 | R146: FOLEY | T146: SWAN | V146: ALLENDER
A147: WILLIAMSTOWN | C147: ROBERTSON 6 | F147: McTAGGART 4 | I147: CAHILL 3 | K147: NILSSEN 3 | M147: KENNEDY | O147: DUGGAN | Q147: SLEVISON | S147: DELRE
A149: ROUND 4 | D149: 30TH APRIL | I149: WEATHER | S149: VENUE: FRANKSTON
D150: 1ST QTR | H150: 2ND QTR | L150: 3RD QTR | P150: FINAL | S150: UMPIRES
A151: PRESTON | C151: 4 | D151: 3 | E151: 27 | G151: 8 | H151: 5 | I151: 53 | K151: 11 | L151: 10 | M151: 76 | O151: 20 | P151: 17 | Q151: 137 | S151: MORROW | X151: LADDER | AB151: ROUND | AD151: 4
A152: FRANKSTON | C152: 5 | D152: 3 | E152: 33 | G152: 8 | H152: 6 | I152: 54 | K152: 10 | L152: 14 | M152: 74 | O152: 11 | P152: 15 | Q152: 81 | S152: BRADY
A153: BEST PLAYERS | W153: TEAM | X153: W | Y153: L | Z153: D | AA153: FOR | AB153: AGST | AC153: % | AD153: PTS
A154: PRESTON | C154: MARCON | F154: BURROWS | I154: PRIDEAUX | L154: BROWN | N154: VALKANIS | Q154: JORDAN
A155: FRANKSTON | C155: S HAMILL | F155: PAYNE | I155: CASPAR | L155: ATKINS | W155: SPRINGVALE | X155: 3 | Y155: 1 | Z155: 0 | AA155: 532 | AB155: 326 | AC155: =(AA155/AB155)*100 -> 163.19018404907973 | AD155: =(X155*4)+(Z155*2) -> 12
A156: GOALKICKERS | W156: COBURG | X156: 3 | Y156: 1 | Z156: 0 | AA156: 532 | AB156: 380 | AC156: =(AA156/AB156)*100 -> 140 | AD156: =(X156*4)+(Z156*2) -> 12
A157: PRESTON | C157: SHAW 5 | E157: LUMICISI 3 | H157: HALAS 3 | J157: DUNBAR 3 | M157: JORDAN 2 | O157: SALVADOR 2 | R157: PRIDEAUX 2 | W157: PORT MELBOURNE | X157: 3 | Y157: 1 | Z157: 0 | AA157: 564 | AB157: 483 | AC157: =(AA157/AB157)*100 -> 116.77018633540372 | AD157: =(X157*4)+(Z157*2) -> 12
A158: FRANKSTON | C158: WHITFIELD 3 | F158: CROSS 3 | H158: MEEHAN 2 | J158: BINGLEY | L158: BROWN | N158: NIKAKIS | W158: PRESTON | X158: 3 | Y158: 1 | Z158: 0 | AA158: 465 | AB158: 407 | AC158: =(AA158/AB158)*100 -> 114.25061425061425 | AD158: =(X158*4)+(Z158*2) -> 12
D159: 1ST MAY | S159: VENUE: TOORAK PARK
A160: SANDRINGHAM | C160: 4 | D160: 3 | E160: 27 | G160: 7 | H160: 7 | I160: 49 | K160: 14 | L160: 15 | M160: 99 | O160: 19 | P160: 19 | Q160: 133 | S160: McDONALD | W160: BRUNSWICK | X160: 2 | Y160: 2 | Z160: 0 | AA160: 459 | AB160: 437 | AC160: =(AA160/AB160)*100 -> 105.03432494279177 | AD160: =(X160*4)+(Z160*2) -> 8
A161: PRAHRAN | C161: 4 | D161: 5 | E161: 29 | G161: 12 | H161: 7 | I161: 79 | K161: 13 | L161: 12 | M161: 90 | O161: 17 | P161: 15 | Q161: 117 | S161: WALKER | W161: WILLIAMSTOWN | X161: 2 | Y161: 2 | Z161: 0 | AA161: 411 | AB161: 403 | AC161: =(AA161/AB161)*100 -> 101.98511166253101 | AD161: =(X161*4)+(Z161*2) -> 8
A162: BEST PLAYERS | W162: SANDRINGHAM | X162: 2 | Y162: 2 | Z162: 0 | AA162: 451 | AB162: 443 | AC162: =(AA162/AB162)*100 -> 101.80586907449209 | AD162: =(X162*4)+(Z162*2) -> 8
A163: SANDRINGHAM | C163: BEILBY | F163: FITZGERALD | I163: PRATT | L163: BONNEY | O163: KRISTENSEN | R163: FITZPATRICK | W163: BOX HILL | X163: 1 | Y163: 3 | Z163: 0 | AA163: 446 | AB163: 599 | AC163: =(AA163/AB163)*100 -> 74.457429048414028 | AD163: =(X163*4)+(Z163*2) -> 4
A164: PRAHRAN | C164: McCARTY | F164: WHITE | I164: KILEY | L164: REYNOLDS | O164: WALDER | R164: G GILES | W164: FRANKSTON | X164: 1 | Y164: 3 | Z164: 0 | AA164: 357 | AB164: 514 | AC164: =(AA164/AB164)*100 -> 69.45525291828794 | AD164: =(X164*4)+(Z164*2) -> 4
A165: GOALKICKERS | W165: PRAHRAN | X165: 0 | Y165: 4 | Z165: 0 | AA165: 343 | AB165: 540 | AC165: =(AA165/AB165)*100 -> 63.518518518518519 | AD165: =(X165*4)+(Z165*2) -> 0
A166: SANDRINGHAM | C166: BENNETT 5 | E166: KRISTENSEN 4 | H166: BERGMAN 3 | K166: EAVES 2 | M166: FITZGERALD 2 | P166: MACLEOD | R166: IRWIN | T166: ERWIN
A167: PRAHRAN | C167: REYNOLDS 6 | F167: P GILES 4 | I167: HEWITSON 3 | L167: G GILES 3 | N167: TAPPING
A169: COBURG | C169: 8 | D169: 5 | E169: 53 | G169: 10 | H169: 12 | I169: 72 | K169: 16 | L169: 15 | M169: 111 | O169: 23 | P169: 20 | Q169: 158 | S169: VENUE: COBURG
A170: PORT MELBOURNE | C170: 3 | D170: 4 | E170: 22 | G170: 5 | H170: 10 | I170: 40 | K170: 8 | L170: 14 | M170: 62 | O170: 14 | P170: 18 | Q170: 102 | S170: VERGONA :BLACK
A171: BEST PLAYERS
A172: COBURG | C172: RACOVOLIS | F172: EADE | I172: DARBY | L172: NIMMO | O172: HARBINSON | R172: SHELDON
A173: PORT MELBOURNE | C173: SAGGERS | F173: WHITZELL | I173: CHADBAND | L173: HETHERTON | O173: FOLEY
A174: GOALKICKERS
A175: COBURG | C175: DARBY 5 | E175: WILLIAMS 5 | H175: EADE 3 | J175: WAIN 3 | L175: KAAKOUR | N175: REYNOLDSON | Q175: FREEMAN | S175: RACOVOLIS | V175: ALLISON | X175: GUMLEY | AA175: SHELDON
A176: PORT MELBOURNE | C176: SAGGERS 7 | F176: HICKS 2 | H176: RICE 2 | J176: ALLENDER 2 | M176: WHITZELL
A178: BOX HILL | C178: 2 | D178: 5 | E178: 17 | G178: 11 | H178: 9 | I178: 75 | K178: 13 | L178: 13 | M178: 91 | O178: 21 | P178: 17 | Q178: 143 | S178: VENUE: BOX HILL
A179: BRUNSWICK | C179: 7 | D179: 4 | E179: 46 | G179: 11 | H179: 7 | I179: 73 | K179: 14 | L179: 14 | M179: 98 | O179: 18 | P179: 15 | Q179: 123 | S179: MARSHALL :HARVEY
A180: BEST PLAYERS
A181: BOX HILL | C181: NICHOLSON | F181: COOPER | I181: MORRISON | L181: PEVITT | O181: D BOURKE | R181: BROWN
A182: BRUNSWICK | C182: THOROGOOD | F182: LOVETT | I182: HERBERT | L182: HYSLOP | O182: WRIGHT
A183: GOALKICKERS
A184: BOX HILL | C184: NICHOLSON 5 | F184: D BOURKE 5 | I184: GARTH 2 | K184: P BOURKE 2 | N184: BROWN 2 | Q184: DONOGHUE | T184: PEVITT | V184: GERADTS | X184: WOLFF | Z184: PRESTON
A185: BRUNSWICK | C185: HENDERSON 4 | F185: WRIGHT 4 | I185: POTTER 2 | K185: HERBERT 2 | M185: FITZPATRICK 2 | P185: THORNTON | R185: THOROGOOD | V185: HOLMES | X185: BAKER
D186: 7TH MAY
A187: WILLIAMSTOWN | C187: 4 | D187: 3 | E187: 27 | G187: 5 | H187: 8 | I187: 38 | K187: 8 | L187: 10 | M187: 58 | O187: 13 | P187: 11 | Q187: 89 | S187: VENUE: WILLIAMSTOWN
A188: SPRINGVALE | C188: 1 | D188: 4 | E188: 10 | G188: 3 | H188: 7 | I188: 25 | K188: 8 | L188: 13 | M188: 61 | O188: 11 | P188: 17 | Q188: 83 | S188: VERGONA :WALKER
A189: BEST PLAYERS
A190: WILLIAMSTOWN | C190: SLEVISON | F190: CAHILL | I190: RUSSELL | L190: KENNEDY | O190: TAYLOR | Q190: N DIMARTINO
A191: SPRINGVALE | C191: WARD | F191: RICHARDS | I191: HUNTER | L191: WARNER | O191: MENDE | Q191: REECE
A192: GOALKICKERS
A193: WILLIAMSTOWN | C193: ROWSELL 3 | E193: McTAGGART 2 | H193: V DIMARTINO 2 | K193: CAHILL | M193: ROBERTSON | P193: KENNEDY | R193: SLEVISON | U193: TAYLOR | X193: COOPER
A194: SPRINGVALE | C194: WARD 2 | F194: MENDE 2 | H194: REECE 2 | J194: VERNON | L194: DUDLEY | N194: MALONI | P194: ROBINSON | R194: STEWART
A196: ROUND 5 | D196: 7TH MAY | I196: WEATHER | S196: VENUE: BEACH ROAD
D197: 1ST QTR | H197: 2ND QTR | L197: 3RD QTR | P197: FINAL | S197: UMPIRES
A198: BOX HILL | C198: 3 | D198: 2 | E198: 20 | G198: 8 | H198: 4 | I198: 52 | K198: 10 | L198: 8 | M198: 68 | O198: 13 | P198: 17 | Q198: 95 | S198: GLEESON | X198: LADDER | AB198: ROUND | AD198: 5
A199: SANDRINGHAM | C199: 4 | D199: 5 | E199: 29 | G199: 6 | H199: 7 | I199: 43 | K199: 10 | L199: 11 | M199: 71 | O199: 12 | P199: 14 | Q199: 86 | S199: MORROW
A200: BEST PLAYERS | W200: TEAM | X200: W | Y200: L | Z200: D | AA200: FOR | AB200: AGST | AC200: % | AD200: PTS
A201: BOX HILL | C201: PEVITT | F201: HOCKING | I201: COOPER | L201: COLLINS | O201: P BOURKE | R201: NICHOLSON
A202: SANDRINGHAM | C202: EAVES | F202: ERWIN | I202: DALRYMPLE | L202: FITZGERALD | O202: FITZPATRICK | W202: COBURG | X202: 4 | Y202: 1 | Z202: 0 | AA202: 613 | AB202: 443 | AC202: =(AA202/AB202)*100 -> 138.37471783295712 | AD202: =(X202*4)+(Z202*2) -> 16
A203: GOALKICKERS | W203: PRESTON | X203: 4 | Y203: 1 | Z203: 0 | AA203: 607 | AB203: 499 | AC203: =(AA203/AB203)*100 -> 121.6432865731463 | AD203: =(X203*4)+(Z203*2) -> 16
A204: BOX HILL | C204: D BOURKE 4 | F204: NICHOLSON 3 | I204: BROWN 2 | K204: HOGAN | M204: P BOURKE | P204: GLARE | R204: COOPER | W204: PORT MELBOURNE | X204: 4 | Y204: 1 | Z204: 0 | AA204: 677 | AB204: 564 | AC204: =(AA204/AB204)*100 -> 120.0354609929078 | AD204: =(X204*4)+(Z204*2) -> 16
A205: SANDRINGHAM | C205: BENNETT 4 | F205: FITZPATRICK 2 | I205: PHILBEY 2 | K205: MACLEOD | M205: KRISTENSEN | P205: FITZGERALD | S205: ALGERI | W205: SPRINGVALE | X205: 3 | Y205: 2 | Z205: 0 | AA205: 595 | AB205: 407 | AC205: =(AA205/AB205)*100 -> 146.19164619164619 | AD205: =(X205*4)+(Z205*2) -> 12
D206: 14TH MAY | S206: VENUE: PORT MELBOURNE
A207: WILLIAMSTOWN | C207: 5 | D207: 3 | E207: 33 | G207: 9 | H207: 10 | I207: 64 | K207: 14 | L207: 16 | M207: 100 | O207: 19 | P207: 23 | Q207: 137 | S207: MORROW | W207: WILLIAMSTOWN | X207: 3 | Y207: 2 | Z207: 0 | AA207: 548 | AB207: 484 | AC207: =(AA207/AB207)*100 -> 113.22314049586777 | AD207: =(X207*4)+(Z207*2) -> 12
A208: BRUNSWICK | C208: 6 | D208: 2 | E208: 38 | G208: 7 | H208: 4 | I208: 46 | K208: 8 | L208: 7 | M208: 55 | O208: 12 | P208: 9 | Q208: 81 | S208: BLACK | W208: SANDRINGHAM | X208: 2 | Y208: 3 | Z208: 0 | AA208: 537 | AB208: 538 | AC208: =(AA208/AB208)*100 -> 99.814126394052053 | AD208: =(X208*4)+(Z208*2) -> 8
A209: BEST PLAYERS | W209: BRUNSWICK | X209: 2 | Y209: 3 | Z209: 0 | AA209: 540 | AB209: 574 | AC209: =(AA209/AB209)*100 -> 94.076655052264812 | AD209: =(X209*4)+(Z209*2) -> 8
A210: WILLIAMSTOWN | C210: KENNEDY | F210: ROUND | I210: CAHILL | L210: JOHNSON | O210: SLEVISON | R210: MURPHY | W210: BOX HILL | X210: 2 | Y210: 3 | Z210: 0 | AA210: 541 | AB210: 685 | AC210: =(AA210/AB210)*100 -> 78.978102189781012 | AD210: =(X210*4)+(Z210*2) -> 8
A211: BRUNSWICK | C211: G DUGDALE | F211: WEST | I211: LOVETT | L211: THOROGOOD | O211: LEAHY | W211: FRANKSTON | X211: 1 | Y211: 4 | Z211: 0 | AA211: 438 | AB211: 627 | AC211: =(AA211/AB211)*100 -> 69.856459330143537 | AD211: =(X211*4)+(Z211*2) -> 4
A212: GOALKICKERS | M212: KERSHAW | P212: JOHNSON | S212: PASTORE | W212: PRAHRAN | X212: 0 | Y212: 5 | Z212: 0 | AA212: 435 | AB212: 682 | AC212: =(AA212/AB212)*100 -> 63.782991202346039 | AD212: =(X212*4)+(Z212*2) -> 0
A213: WILLIAMSTOWN | C213: COOPER 4 | E213: CAHILL 3 | G213: V DIMARTINO 3 | J213: KENNEDY 2 | M213: MURPHY 2 | P213: ROBERTSON | R213: ROWSELL
A214: BRUNSWICK | C214: HERBERT 3 | E214: HOLMES 2 | H214: FITZPATRICK 2 | K214: KNIGHT 2 | M214: PERRY | O214: POTTER | Q214: McALLESTER
D215: 15TH MAY
A216: PORT MELBOURNE | C216: 4 | D216: 8 | E216: 32 | G216: 9 | H216: 10 | I216: 64 | K216: 15 | L216: 11 | M216: 101 | O216: 17 | P216: 11 | Q216: 113 | S216: VENUE: PORT MELBOURNE
A217: FRANKSTON | C217: 3 | D217: 5 | E217: 23 | G217: 5 | H217: 9 | I217: 39 | K217: 7 | L217: 15 | M217: 57 | O217: 10 | P217: 21 | Q217: 81 | S217: CARUSO :McDONALD
A218: BEST PLAYERS
A219: PORT MELBOURNE | C219: FOLEY | F219: STROOPER | I219: RICE | L219: CHADBAND | O219: ZOCCALI
A220: FRANKSTON | C220: RAVEN | F220: S HAMILL | I220: MEEHAN | L220: SARAU | O220: MARTIN | R220: BROWN
A221: GOALKICKERS
A222: PORT MELBOURNE | C222: SNEDDON 4 | F222: McCORMACK 4 | I222: HICKS 3 | K222: SAGGERS 2 | M222: BRADBURY 2 | P222: WHITZELL | R222: RICE
A223: FRANKSTON | C223: BROWN 6 | F223: AMOORE 2 | I223: CROSS | K223: NIKAKIS
A225: PRESTON | C225: 6 | D225: 3 | E225: 39 | G225: 10 | H225: 10 | I225: 70 | K225: 13 | L225: 15 | M225: 93 | O225: 21 | P225: 16 | Q225: 142 | S225: VENUE: PRESTON
A226: PRAHRAN | C226: 4 | D226: 4 | E226: 28 | G226: 8 | H226: 5 | I226: 53 | K226: 13 | L226: 7 | M226: 85 | O226: 14 | P226: 8 | Q226: 92 | S226: CARUSO :HARVEY
A227: BEST PLAYERS
A228: PRESTON | C228: HALAS | F228: BROWN | I228: HUNT | L228: JACKSON | O228: SHAW | R228: BRINE
A229: PRAHRAN | C229: KILEY | F229: WALLACE | I229: EVANS | L229: TAPPING | O229: SOULOS | R229: WHITE
A230: GOALKICKERS
A231: PRESTON | C231: SHAW 10 | F231: JORDAN 3 | I231: SALVADORE 3 | L231: LUMICISI | N231: HALAS | P231: SENNO | R231: HUNT | T231: PRIDEAUX
A232: PRAHRAN | C232: SOULOS 3 | F232: REYNOLDS 3 | I232: HEWITSON | K232: WALDER | M232: TAPPING | O232: CARTLEDGE | R232: KITTO | T232: McCARTY | W232: EVANS | X232: McNAMARA
A234: COBURG | C234: 4 | D234: 2 | E234: 26 | G234: 7 | H234: 2 | I234: 44 | K234: 9 | L234: 6 | M234: 60 | O234: 12 | P234: 9 | Q234: 81 | S234: VENUE: SPRINGVALE
A235: SPRINGVALE | C235: 1 | D235: 6 | E235: 12 | G235: 5 | H235: 10 | I235: 40 | K235: 7 | L235: 12 | M235: 54 | O235: 8 | P235: 15 | Q235: 63 | S235: GLEESON :NOLAN
A236: BEST PLAYERS
A237: COBURG | C237: GUMLEY | F237: WEIDEMAN | I237: EADE | L237: ALLISON | O237: DARBY | Q237: SHELDON
A238: SPRINGVALE | C238: REECE | F238: WARNER | I238: McCORMACK | L238: MENDE
A239: GOALKICKERS
A240: COBURG | C240: DARBY 4 | F240: WILLIAMS 3 | I240: EADE | K240: WAIN | M240: ALLISON | O240: GUMLEY | Q240: WEATHERALD
A241: SPRINGVALE | C241: VERNON 2 | F241: DUDLEY 2 | I241: MATHIESON 2 | L241: NEWMAN | N241: WARD
A243: ROUND 6 | D243: 22ND MAY | I243: WEATHER | S243: VENUE: COBURG
D244: 1ST QTR | H244: 2ND QTR | L244: 3RD QTR | P244: FINAL | S244: UMPIRES
A245: COBURG | C245: 8 | D245: 6 | E245: 54 | G245: 9 | H245: 12 | I245: 66 | K245: 13 | L245: 16 | M245: 94 | O245: 22 | P245: 18 | Q245: 150 | S245: HOLT | X245: LADDER | AB245: ROUND | AD245: 6
A246: BRUNSWICK | C246: 0 | D246: 0 | E246: 0 | G246: 4 | H246: 4 | I246: 28 | K246: 7 | L246: 5 | M246: 47 | O246: 12 | P246: 7 | Q246: 79 | S246: WALKER
A247: BEST PLAYERS | W247: TEAM | X247: W | Y247: L | Z247: D | AA247: FOR | AB247: AGST | AC247: % | AD247: PTS
A248: COBURG | C248: EADE | F248: INGRAM | I248: FREEMAN | L248: WEIDEMAN | O248: ALLISON
A249: BRUNSWICK | C249: THOROGOOD | F249: HYSLOP | I249: FITZPATRICK | L249: LOVETT | O249: McALLESTER | R249: BERTOLLO | W249: COBURG | X249: 5 | Y249: 1 | Z249: 0 | AA249: 763 | AB249: 526 | AC249: =(AA249/AB249)*100 -> 145.0570342205323 | AD249: =(X249*4)+(Z249*2) -> 20
A250: GOALKICKERS | L250: RACOVOLIS | N250: WAIN | P250: ALLISON | R250: GUMLEY | W250: PRESTON | X250: 5 | Y250: 1 | Z250: 0 | AA250: 774 | AB250: 601 | AC250: =(AA250/AB250)*100 -> 128.78535773710482 | AD250: =(X250*4)+(Z250*2) -> 20
A251: COBURG | C251: WILLIAMS 5 | F251: EADE 4 | H251: FREEMAN 3 | J251: DARBY 2 | L251: WEATHERALD 2 | O251: INGRAM | Q251: REYNOLDSON | W251: WILLIAMSTOWN | X251: 4 | Y251: 2 | Z251: 0 | AA251: 703 | AB251: 589 | AC251: =(AA251/AB251)*100 -> 119.35483870967742 | AD251: =(X251*4)+(Z251*2) -> 16
A252: BRUNSWICK | C252: KNIGHT 3 | F252: LEAHY 2 | H252: CONNELL 2 | J252: HYSLOP | L252: HENDERSON | O252: LOVETT | Q252: FITZPATRICK | T252: WEST | W252: PORT MELBOURNE | X252: 4 | Y252: 2 | Z252: 0 | AA252: 779 | AB252: 731 | AC252: =(AA252/AB252)*100 -> 106.56634746922025 | AD252: =(X252*4)+(Z252*2) -> 16
S253: VENUE: WILLIAMSTOWN
A254: WILLIAMSTOWN | C254: 4 | D254: 8 | E254: 32 | G254: 8 | H254: 9 | I254: 57 | K254: 13 | L254: 14 | M254: 92 | O254: 23 | P254: 17 | Q254: 155 | S254: McDONALD | W254: SPRINGVALE | X254: 3 | Y254: 3 | Z254: 0 | AA254: 692 | AB254: 531 | AC254: =(AA254/AB254)*100 -> 130.3201506591337 | AD254: =(X254*4)+(Z254*2) -> 12
A255: SANDRINGHAM | C255: 5 | D255: 4 | E255: 34 | G255: 11 | H255: 8 | I255: 74 | K255: 11 | L255: 12 | M255: 78 | O255: 15 | P255: 15 | Q255: 105 | S255: HARVEY | W255: BOX HILL | X255: 3 | Y255: 3 | Z255: 0 | AA255: 679 | AB255: 768 | AC255: =(AA255/AB255)*100 -> 88.411458333333343 | AD255: =(X255*4)+(Z255*2) -> 12
A256: BEST PLAYERS | W256: SANDRINGHAM | X256: 2 | Y256: 4 | Z256: 0 | AA256: 642 | AB256: 693 | AC256: =(AA256/AB256)*100 -> 92.640692640692649 | AD256: =(X256*4)+(Z256*2) -> 8
A257: WILLIAMSTOWN | C257: WHEELER | F257: R DIMARTINO | I257: ROUND | L257: SLEVISON | O257: JOHNSON | R257: McTAGGART | W257: BRUNSWICK | X257: 2 | Y257: 4 | Z257: 0 | AA257: 623 | AB257: 724 | AC257: =(AA257/AB257)*100 -> 86.049723756906076 | AD257: =(X257*4)+(Z257*2) -> 8
A258: SANDRINGHAM | C258: BENNET | F258: PHILBEY | I258: F RUGOLO | W258: FRANKSTON | X258: 2 | Y258: 4 | Z258: 0 | AA258: 562 | AB258: 724 | AC258: =(AA258/AB258)*100 -> 77.624309392265189 | AD258: =(X258*4)+(Z258*2) -> 8
A259: GOALKICKERS | M259: ROUND | P259: McTAGGART | S259: KERSHAW | W259: PRAHRAN | X259: 0 | Y259: 6 | Z259: 0 | AA259: 518 | AB259: 820 | AC259: =(AA259/AB259)*100 -> 63.170731707317074 | AD259: =(X259*4)+(Z259*2) -> 0
A260: WILLIAMSTOWN | C260: MOURNEY 5 | F260: JOHNSON 4 | I260: DELRE 3 | K260: CAHILL 2 | M260: V DIMARTINO 2 | P260: ROWSELL 2 | R260: COOPER 2
A261: SANDRINGHAM | C261: BENNETT 6 | F261: PHILBEY 4 | I261: BEILBY | K261: EAVES | M261: ALLEN | O261: FITZPATRICK | R261: J RUGOLO
A263: PRESTON | C263: 6 | D263: 3 | E263: 39 | G263: 12 | H263: 7 | I263: 79 | K263: 20 | L263: 12 | M263: 132 | O263: 25 | P263: 17 | Q263: 167 | S263: VENUE: PORT MELBOURNE
A264: PORT MELBOURNE | C264: 5 | D264: 3 | E264: 33 | G264: 8 | H264: 8 | I264: 56 | K264: 13 | L264: 9 | M264: 87 | O264: 15 | P264: 12 | Q264: 102 | S264: GLEESON ;NOLAN
A265: BEST PLAYERS
A266: PRESTON | C266: LUMICISI | F266: NICOLAOU | I266: ANDERSON | L266: BRINE | N266: DUNBAR | Q266: JACKSON
A267: PORT MELBOURNE | C267: BRADBURY | F267: FOLEY | I267: SWAN | L267: SMITH
A268: GOALKICKERS
A269: PRESTON | C269: SHAW 9 | F269: NICOLAOU 4 | I269: LUMICISI 3 | L269: SENNO 3 | N269: SALVADORE 3 | Q269: HALAS 2 | S269: LAWSON
A270: PORT MELBOURNE | C270: SNEDDON 3 | F270: SAGGERS 3 | I270: McCORMACK 3 | L270: HICKS 2 | N270: RICE | P270: FOLEY | R270: SWAN | T270: SMITH
A272: FRANKSTON | C272: 5 | D272: 3 | E272: 33 | G272: 11 | H272: 4 | I272: 70 | K272: 16 | L272: 9 | M272: 105 | O272: 19 | P272: 10 | Q272: 124 | S272: VENUE: FRANKSTON
A273: SPRINGVALE | C273: 3 | D273: 0 | E273: 18 | G273: 8 | H273: 3 | I273: 51 | K273: 11 | L273: 4 | M273: 70 | O273: 15 | P273: 7 | Q273: 97 | S273: BLACK ;MORROW
A274: BEST PLAYERS
A275: FRANKSTON | C275: TEAM EFFORT
A276: SPRINGVALE | C276: WARNER | F276: MENDE | I276: RICHARDS
A277: GOALKICKERS
A278: FRANKSTON | C278: DUNBAR 7 | F278: S HAMILL 6 | I278: MEEHAN 2 | L278: AMOORE 2 | N278: LANE | P278: NIKAKIS
A279: SPRINGVALE | C279: VERNON 4 | F279: PROSSER 4 | I279: HUNTER 2 | L279: WARNER 2 | N279: REECE | P279: WARD | R279: WALSH
A281: BOX HILL | C281: 5 | D281: 4 | E281: 34 | G281: 11 | H281: 6 | I281: 72 | K281: 14 | L281: 9 | M281: 93 | O281: 20 | P281: 18 | Q281: 138 | S281: VENUE: BOX HILL
A282: PRAHARAN | C282: 3 | D282: 5 | E282: 23 | G282: 6 | H282: 8 | I282: 44 | K282: 9 | L282: 9 | M282: 63 | O282: 12 | P282: 11 | Q282: 83 | S282: VERGONA :CARUSO
A283: BEST PLAYERS
A284: BOX HILL | C284: HOCKING | F284: BROWN | I284: PEVITT | L284: P BOURKE | O284: TURNER | Q284: WOLFF
A285: PRAHARAN | C285: S GILES | F285: WHITE | I285: SOULOS | L285: HUTCHISON | O285: EVANS | Q285: G GILES
A286: GOALKICKERS
A287: BOX HILL | C287: BROWN 4 | F287: HOGAN 3 | I287: BOLTON 3 | K287: D BOURKE 3 | N287: P BOURKE 2 | Q287: PEVITT 2 | S287: WOLFF 2 | U287: NICHOLSON
A288: PRAHARAN | C288: SOULOS 3 | F288: HUTCHISON 2 | I288: G GILES 2 | K288: P GILES 2 | M288: WALDER | O288: EVANS | Q288: WALLACE
A290: ROUND 7 | D290: 29TH MAY | I290: WEATHER | S290: VENUE: BRUNSWICK
D291: 1ST QTR | H291: 2ND QTR | L291: 3RD QTR | P291: FINAL | S291: UMPIRES
A292: BRUNSWICK | C292: 3 | D292: 3 | E292: 21 | G292: 8 | H292: 4 | I292: 52 | K292: 11 | L292: 5 | M292: 71 | O292: 17 | P292: 10 | Q292: 112 | S292: VERGONA | X292: LADDER | AB292: ROUND | AD292: 7
A293: FRANKSTON | C293: 5 | D293: 3 | E293: 33 | G293: 10 | H293: 8 | I293: 68 | K293: 13 | L293: 11 | M293: 89 | O293: 15 | P293: 15 | Q293: 105 | S293: GLEESON
A294: BEST PLAYERS | W294: TEAM | X294: W | Y294: L | Z294: D | AA294: FOR | AB294: AGST | AC294: % | AD294: PTS
A295: BRUNSWICK | C295: DUGDALE | F295: WEST | I295: HERBERT | L295: GREGG | N295: THOROGOOD | Q295: CONNELL
A296: FRANKSTON | C296: SARAU | F296: AMOORE | I296: MARTIN | L296: ATKINS | N296: MEEHAN | Q296: BROWN | W296: COBURG | X296: 6 | Y296: 1 | Z296: 0 | AA296: 868 | AB296: 615 | AC296: =(AA296/AB296)*100 -> 141.13821138211381 | AD296: =(X296*4)+(Z296*2) -> 24
A297: GOALKICKERS | W297: PRESTON | X297: 5 | Y297: 2 | Z297: 0 | AA297: 889 | AB297: 738 | AC297: =(AA297/AB297)*100 -> 120.46070460704608 | AD297: =(X297*4)+(Z297*2) -> 20
A298: BRUNSWICK | C298: McALLESTER 6 | F298: HERBERT 3 | I298: CONNELL 3 | K298: THOROGOOD 2 | N298: POTTER | P298: WRIGHT | R298: BERTOLLO | W298: SPRINGVALE | X298: 4 | Y298: 3 | Z298: 0 | AA298: 785 | AB298: 616 | AC298: =(AA298/AB298)*100 -> 127.43506493506493 | AD298: =(X298*4)+(Z298*2) -> 16
A299: FRANKSTON | C299: WHITFIELD 4 | F299: BINGLEY 4 | I299: DUNBAR 3 | L299: MEEHAN | N299: BROWN | P299: NIKAKIS | R299: RAVEN | W299: WILLIAMSTOWN | X299: 4 | Y299: 3 | Z299: 0 | AA299: 782 | AB299: 685 | AC299: =(AA299/AB299)*100 -> 114.16058394160584 | AD299: =(X299*4)+(Z299*2) -> 16
S300: VENUE: PRESTON
A301: BOX HILL | C301: 2 | D301: 2 | E301: 14 | G301: 4 | H301: 7 | I301: 31 | K301: 11 | L301: 8 | M301: 74 | O301: 21 | P301: 11 | Q301: 137 | S301: HOLT | W301: PORT MELBOURNE | X301: 4 | Y301: 3 | Z301: 0 | AA301: 864 | AB301: 824 | AC301: =(AA301/AB301)*100 -> 104.85436893203884 | AD301: =(X301*4)+(Z301*2) -> 16
A302: PRESTON | C302: 7 | D302: 4 | E302: 46 | G302: 12 | H302: 5 | I302: 77 | K302: 17 | L302: 9 | M302: 111 | O302: 17 | P302: 13 | Q302: 115 | S302: WALKER | W302: BOX HILL | X302: 4 | Y302: 3 | Z302: 0 | AA302: 816 | AB302: 883 | AC302: =(AA302/AB302)*100 -> 92.412231030577573 | AD302: =(X302*4)+(Z302*2) -> 16
A303: BEST PLAYERS | W303: BRUNSWICK | X303: 3 | Y303: 4 | Z303: 0 | AA303: 735 | AB303: 829 | AC303: =(AA303/AB303)*100 -> 88.661037394451142 | AD303: =(X303*4)+(Z303*2) -> 12
A304: BOX HILL | C304: HOCKING | F304: PEVITT | I304: BOLTON | W304: SANDRINGHAM | X304: 2 | Y304: 5 | Z304: 0 | AA304: 731 | AB304: 798 | AC304: =(AA304/AB304)*100 -> 91.604010025062649 | AD304: =(X304*4)+(Z304*2) -> 8
A305: PRESTON | C305: HUNT | F305: BROWN | I305: BRINE | L305: BURROWS | W305: FRANKSTON | X305: 2 | Y305: 5 | Z305: 0 | AA305: 667 | AB305: 836 | AC305: =(AA305/AB305)*100 -> 79.784688995215319 | AD305: =(X305*4)+(Z305*2) -> 8
A306: GOALKICKERS | W306: PRAHRAN | X306: 1 | Y306: 6 | Z306: 0 | AA306: 614 | AB306: 899 | AC306: =(AA306/AB306)*100 -> 68.298109010011117 | AD306: =(X306*4)+(Z306*2) -> 4
A307: BOX HILL | C307: BOLTON 7 | E307: PRESTON 4 | H307: D BOURKE 3 | J307: BROWN 3 | L307: NICHOLSON | O307: P BOURKE | Q307: COOPER | S307: WOOLF
A308: PRESTON | C308: SHAW 4 | E308: HALAS 3 | G308: JORDAN 3 | I308: LUMICISI 2 | L308: NICHOLAOU | N308: LAWSON | P308: SALVADORE | R308: PRIDEAUX
M309: DUNBAR
A310: COBURG | C310: 6 | D310: 6 | E310: 42 | G310: 9 | H310: 8 | I310: 62 | K310: 12 | L310: 12 | M310: 84 | O310: 15 | P310: 15 | Q310: 105 | S310: VENUE: BEACH ROAD
A311: SANDRINGHAM | C311: 1 | D311: 4 | E311: 10 | G311: 7 | H311: 8 | I311: 50 | K311: 10 | L311: 14 | M311: 74 | O311: 12 | P311: 17 | Q311: 89 | S311: BLACK :CARUSO
A312: BEST PLAYERS
A313: COBURG | C313: EVANS | E313: SHELDON | H313: GUMLEY | K313: REYNOLDSON | N313: WEATHERALD | Q313: TARANTO
A314: SANDRINGHAM | C314: PRATT | E314: BONNEY | H314: EAVES | K314: J RUGOLO | N314: ALLEN | Q314: KRISTENSEN
A315: GOALKICKERS
A316: COBURG | C316: WEATHERALD 6 | F316: EADE 3 | H316: WILLIAMS 3 | K316: DARBY | M316: WEIDEMAN | P316: FREEMAN
A317: SANDRINGHAM | C317: BENNETT 3 | F317: EAVES 2 | H317: PHILBEY 2 | J317: MACLEOD | M317: FITZGERALD | P317: J RUGOLO | R317: F RUGOLO | U317: ALLEN
A319: SPRINGVALE | C319: 3 | D319: 0 | E319: 18 | G319: 5 | H319: 5 | I319: 35 | K319: 10 | L319: 7 | M319: 67 | O319: 14 | P319: 9 | Q319: 93 | S319: VENUE: SPRINGVALE
A320: PORT MELBOURNE | C320: 3 | D320: 3 | E320: 21 | G320: 5 | H320: 7 | I320: 37 | K320: 7 | L320: 10 | M320: 52 | O320: 12 | P320: 13 | Q320: 85 | S320: McDONALD :HARVEY
A321: BEST PLAYERS
A322: SPRINGVALE | C322: TEAM EFFORT
A323: PORT MELBOURNE | C323: McCORMACK | F323: WHITZELL | I323: RICE | K323: FOLEY | N323: CHADBAND | Q323: SMITH
A324: GOALKICKERS
A325: SPRINGVALE | C325: ROBINSON 3 | F325: NORMAN 2 | I325: ANDERSON 2 | L325: RICHARDS 2 | O325: SECCULL 2 | Q325: DEMPSTER | T325: SHANNON | W325: MORGAN
A326: PORT MELBOURNE | C326: HICKS 4 | F326: SAGGERS 2 | I326: McCORMACK 2 | L326: FOLEY 2 | N326: SWAN | P326: CHADBAND
A328: PRAHRAN | C328: 6 | D328: 2 | E328: 38 | G328: 9 | H328: 8 | I328: 62 | K328: 13 | L328: 10 | M328: 88 | O328: 14 | P328: 12 | Q328: 96 | S328: VENUE: TOORAK PARK
A329: WILLIAMSTOWN | C329: 4 | D329: 2 | E329: 26 | G329: 6 | H329: 4 | I329: 40 | K329: 7 | L329: 6 | M329: 48 | O329: 12 | P329: 7 | Q329: 79 | S329: NOLAN :P MARSHALL
A330: BEST PLAYERS
A331: PRAHRAN | C331: KILEY | F331: MCCARTY | I331: P GILES | L331: SOULOS | O331: EVANS | Q331: CARTLEDGE
A332: WILLIAMSTOWN | C332: NILSSEN | F332: KENNEDY | I332: ROUND | L332: PASTORE | O332: CAHILL
A333: GOALKICKERS
A334: PRAHRAN | C334: G GILES 3 | F334: HEWITSON 2 | I334: SOULOS 2 | K334: WALDER 2 | M334: P GILES 2 | O334: HUTCHISON | Q334: HAMILTON | T334: S GILES
A335: WILLIAMSTOWN | C335: MOURNEY 3 | F335: CAHILL | H335: ROUND | J335: KENNEDY | M335: V DIMARTINO | P335: DELRE | R335: ROWSELL | U335: COOPER | X335: JOHNSON
A337: ROUND 8 | D337: 5TH JUNE | I337: WEATHER | S337: VENUE: PORT MELBOURNE
D338: 1ST QTR | H338: 2ND QTR | L338: 3RD QTR | P338: FINAL | S338: UMPIRES
A339: BRUNSWICK | C339: 2 | D339: 7 | E339: 19 | G339: 2 | H339: 10 | I339: 22 | K339: 6 | L339: 18 | M339: 54 | O339: 9 | P339: 21 | Q339: 75 | S339: MORROW | X339: LADDER | AB339: ROUND | AD339: 8
A340: PORT MELBOURNE | C340: 2 | D340: 2 | E340: 14 | G340: 8 | H340: 3 | I340: 51 | K340: 8 | L340: 3 | M340: 51 | O340: 10 | P340: 9 | Q340: 69 | S340: BLACK
A341: BEST PLAYERS | W341: TEAM | X341: W | Y341: L | Z341: D | AA341: FOR | AB341: AGST | AC341: % | AD341: PTS
A342: BRUNSWICK | C342: LEAHY | F342: WEST | I342: HYSLOP | L342: FITZPATRICK | O342: McALLESTER | R342: GREGG
A343: PORT MELBOURNE | C343: SMITH | F343: SWAN | I343: MUTIMER | L343: S HARKINS | W343: COBURG | X343: 7 | Y343: 1 | Z343: 0 | AA343: 1026 | AB343: 687 | AC343: =(AA343/AB343)*100 -> 149.34497816593887 | AD343: =(X343*4)+(Z343*2) -> 28
A344: GOALKICKERS | W344: SPRINGVALE | X344: 5 | Y344: 3 | Z344: 0 | AA344: 904 | AB344: 722 | AC344: =(AA344/AB344)*100 -> 125.20775623268699 | AD344: =(X344*4)+(Z344*2) -> 20
A345: BRUNSWICK | C345: HOLMES 2 | F345: KNIGHT 2 | I345: POTTER | K345: BERTOLLO | M345: HERBERT | O345: FITZPATRICK | R345: WEST | W345: WILLIAMSTOWN | X345: 5 | Y345: 3 | Z345: 0 | AA345: 942 | AB345: 757 | AC345: =(AA345/AB345)*100 -> 124.43857331571995 | AD345: =(X345*4)+(Z345*2) -> 20
A346: PORT MELBOURNE | C346: HICKS 2 | F346: HARKINS 2 | I346: McCORMACK | L346: RAMSAY | N346: MUTIMER | Q346: SWAN | S346: STROOPER | W346: PRESTON | X346: 5 | Y346: 3 | Z346: 0 | AA346: 995 | AB346: 857 | AC346: =(AA346/AB346)*100 -> 116.10268378063012 | AD346: =(X346*4)+(Z346*2) -> 20
S347: VENUE: WILLIAMSTOWN
A348: WILLIAMSTOWN | C348: 4 | D348: 3 | E348: 27 | G348: 9 | H348: 6 | I348: 60 | K348: 18 | L348: 9 | M348: 117 | O348: 25 | P348: 10 | Q348: 160 | S348: VERGONA | W348: PORT MELBOURNE | X348: 4 | Y348: 4 | Z348: 0 | AA348: 933 | AB348: 899 | AC348: =(AA348/AB348)*100 -> 103.78197997775307 | AD348: =(X348*4)+(Z348*2) -> 16
A349: BOX HILL | C349: 2 | D349: 1 | E349: 13 | G349: 4 | H349: 5 | I349: 29 | K349: 5 | L349: 6 | M349: 36 | O349: 10 | P349: 12 | Q349: 72 | S349: HARVEY | W349: BRUNSWICK | X349: 4 | Y349: 4 | Z349: 0 | AA349: 810 | AB349: 898 | AC349: =(AA349/AB349)*100 -> 90.200445434298445 | AD349: =(X349*4)+(Z349*2) -> 16
A350: BEST PLAYERS | W350: BOX HILL | X350: 4 | Y350: 4 | Z350: 0 | AA350: 888 | AB350: 1043 | AC350: =(AA350/AB350)*100 -> 85.139022051773722 | AD350: =(X350*4)+(Z350*2) -> 16
A351: WILLIAMSTOWN | C351: NILSSEN | F351: ROUND | I351: ROWSELL | L351: TAYLOR | O351: ROBERTSON | R351: JOHNSON | W351: SANDRINGHAM | X351: 3 | Y351: 5 | Z351: 0 | AA351: 873 | AB351: 878 | AC351: =(AA351/AB351)*100 -> 99.430523917995444 | AD351: =(X351*4)+(Z351*2) -> 12
A352: BOX HILL | C352: P BOURKE | F352: GLARE | I352: O'BRIEN | W352: FRANKSTON | X352: 2 | Y352: 6 | Z352: 0 | AA352: 747 | AB352: 978 | AC352: =(AA352/AB352)*100 -> 76.380368098159508 | AD352: =(X352*4)+(Z352*2) -> 8
A353: GOALKICKERS | I353: ROWSELL | L353: McTAGGART | O353: TAYLOR | Q353: COOPER | S353: WHEELER | W353: PRAHRAN | X353: 1 | Y353: 7 | Z353: 0 | AA353: 686 | AB353: 1057 | AC353: =(AA353/AB353)*100 -> 64.900662251655632 | AD353: =(X353*4)+(Z353*2) -> 4
A354: WILLIAMSTOWN | C354: ROUND 5 | E354: V DIMARTINO 5 | H354: ROBERTSON 3 | K354: RAEBURN 2 | M354: JOHNSON 2 | O354: CAHILL | Q354: KENNEDY | S354: NILSSEN
A355: BOX HILL | C355: GARTH 3 | F355: BOLTON 2 | I355: WOLFF 2 | K355: HOGAN | M355: P BOURKE | P355: GLARE
A357: SANDRINGHAM | C357: 5 | D357: 1 | E357: 31 | G357: 8 | H357: 8 | I357: 56 | K357: 13 | L357: 10 | M357: 88 | O357: 21 | P357: 16 | Q357: 142 | S357: VENUE: FRANKSTON
A358: FRANKSTON | C358: 7 | D358: 5 | E358: 47 | G358: 9 | H358: 10 | I358: 64 | K358: 11 | L358: 13 | M358: 79 | O358: 11 | P358: 14 | Q358: 80 | S358: HOLT :N McDONALD
A359: BEST PLAYERS
A360: SANDRINGHAM | C360: J RUGOLO | F360: PHILBEY | I360: BONNEY | L360: KRISTENSEN | O360: PRATT | Q360: ALLEN
A361: FRANKSTON | C361: N/A
A362: GOALKICKERS
A363: SANDRINGHAM | C363: PHILBEY 6 | E363: F RUGOLO 4 | H363: EAVES 2 | J363: ERWIN 2 | L363: McGANNON 2 | O363: BERGMAN | Q363: KRISTENSEN | T363: J RUGOLO | W363: ENDERS | X363: PRATT
A364: FRANKSTON | C364: CROSS 3 | F364: DUNBAR 3 | I364: ROGERSON 3 | L364: S HAMILL 2
A366: SPRINGVALE | C366: 5 | D366: 6 | E366: 36 | G366: 7 | H366: 12 | I366: 54 | K366: 12 | L366: 17 | M366: 89 | O366: 16 | P366: 23 | Q366: 119 | S366: VENUE: SPRINGVALE
A367: PRESTON | C367: 2 | D367: 4 | E367: 16 | G367: 9 | H367: 8 | I367: 62 | K367: 14 | L367: 9 | M367: 93 | O367: 16 | P367: 10 | Q367: 106 | S367: CARUSO ;MARSHALL
A368: BEST PLAYERS
A369: SPRINGVALE | C369: K ROBINSON | F369: WARNER | I369: FOY | L369: REECE | O369: ANDERSON | R369: MENDE
A370: PRESTON | C370: DUNBAR | F370: LUMICISI | I370: BURROWS | L370: BRINE | O370: HUNT | R370: JORDAN
A371: GOALKICKERS
A372: SPRINGVALE | C372: K ROBINSON 6 | F372: WARNER 4 | I372: ANDERSON 3 | L372: VERNON | N372: MENDE | P372: MORGAN
A373: PRESTON | C373: JORDAN 5 | F373: LUMICISI 3 | I373: HALAS | K373: SENNO | M373: LAWSON | O373: PRIDEAUX | Q373: DUNBAR | S373: HUNT | U373: BRINE | W373: JACKSON
A375: COBURG | C375: 8 | D375: 6 | E375: 54 | G375: 14 | H375: 11 | I375: 95 | K375: 21 | L375: 18 | M375: 144 | O375: 23 | P375: 20 | Q375: 158 | S375: VENUE: COBURG
A376: PRAHRAN | C376: 0 | D376: 1 | E376: 1 | G376: 3 | H376: 3 | I376: 21 | K376: 5 | L376: 5 | M376: 35 | O376: 10 | P376: 12 | Q376: 72 | S376: BROOKS :GLEESON
A377: BEST PLAYERS
A378: COBURG | C378: INGRAM | F378: TARANTO | I378: ALLISON | L378: WEIDEMAN | O378: EADE | Q378: GUMLEY
A379: PRAHRAN | C379: PAGE | F379: G GILES | I379: SOULOS | L379: JACKSON | O379: EVANS | Q379: ELKINGTON
A380: GOALKICKERS
A381: COBURG | C381: RIENIETS 4 | E381: KAAKOUR 3 | H381: DARBY 3 | J381: EVANS 3 | L381: ALLISON 3 | N381: WILLIAMS 2 | Q381: EADE | S381: RACOVOLIS | W381: GUMLEY | X381: INGRAM
A382: PRAHRAN | C382: SOULOS 3 | F382: P GILES 2 | I382: EVANS 2 | K382: HEWITSON | M382: WALDER | O382: ELKINGTON
A384: ROUND 9 | D384: 19TH JUNE | I384: WEATHER | S384: VENUE: BRUNSWICK
D385: 1ST QTR | H385: 2ND QTR | L385: 3RD QTR | P385: FINAL | S385: UMPIRES
A386: BRUNSWICK | C386: 4 | D386: 7 | E386: 31 | G386: 6 | H386: 9 | I386: 45 | K386: 12 | L386: 11 | M386: 83 | O386: 16 | P386: 14 | Q386: 110 | S386: HARVEY | X386: LADDER | AB386: ROUND | AD386: 9
A387: SPRINGVALE | C387: 3 | D387: 4 | E387: 22 | G387: 7 | H387: 8 | I387: 50 | K387: 11 | L387: 10 | M387: 76 | O387: 13 | P387: 14 | Q387: 92 | S387: HOLT
A388: BEST PLAYERS | W388: TEAM | X388: W | Y388: L | Z388: D | AA388: FOR | AB388: AGST | AC388: % | AD388: PTS
A389: BRUNSWICK | C389: G DUGDALE | F389: HERBERT | I389: MCALLESTER | L389: WEST | O389: CLARKE | R389: POTTER
A390: SPRINGVALE | C390: DEMPSTER | F390: REECE | I390: WARD | L390: KING | W390: COBURG | X390: 8 | Y390: 1 | Z390: 0 | AA390: 1156 | AB390: 741 | AC390: =(AA390/AB390)*100 -> 156.00539811066128 | AD390: =(X390*4)+(Z390*2) -> 32
A391: GOALKICKERS | W391: WILLIAMSTOWN | X391: 6 | Y391: 3 | Z391: 0 | AA391: 1050 | AB391: 854 | AC391: =(AA391/AB391)*100 -> 122.95081967213115 | AD391: =(X391*4)+(Z391*2) -> 24
A392: BRUNSWICK | C392: WRIGHT 3 | E392: KNIGHT 3 | G392: HYSLOP 2 | I392: McALLESTER 2 | L392: HERBERT 2 | N392: WEST 2 | P392: THOROGOOD | S392: BERTOLLO | W392: SPRINGVALE | X392: 5 | Y392: 4 | Z392: 0 | AA392: 996 | AB392: 832 | AC392: =(AA392/AB392)*100 -> 119.71153846153845 | AD392: =(X392*4)+(Z392*2) -> 20
A393: SPRINGVALE | C393: ANDERSON 4 | F393: ROBINSON 3 | I393: CLARKE 2 | K393: VERNON | M393: WARD | O393: NORMAN | Q393: MORGAN | W393: PRESTON | X393: 5 | Y393: 4 | Z393: 0 | AA393: 1092 | AB393: 965 | AC393: =(AA393/AB393)*100 -> 113.16062176165802 | AD393: =(X393*4)+(Z393*2) -> 20
S394: VENUE: PRESTON
A395: WILLIAMSTOWN | C395: 7 | D395: 2 | E395: 44 | G395: 12 | H395: 9 | I395: 81 | K395: 14 | L395: 11 | M395: 95 | O395: 15 | P395: 18 | Q395: 108 | S395: CARUSO | W395: PORT MELBOURNE | X395: 5 | Y395: 4 | Z395: 0 | AA395: 1053 | AB395: 968 | AC395: =(AA395/AB395)*100 -> 108.78099173553719 | AD395: =(X395*4)+(Z395*2) -> 20
A396: PRESTON | C396: 4 | D396: 6 | E396: 30 | G396: 6 | H396: 9 | I396: 45 | K396: 11 | L396: 17 | M396: 83 | O396: 13 | P396: 19 | Q396: 97 | S396: GLEESON | W396: BRUNSWICK | X396: 5 | Y396: 4 | Z396: 0 | AA396: 920 | AB396: 990 | AC396: =(AA396/AB396)*100 -> 92.929292929292927 | AD396: =(X396*4)+(Z396*2) -> 20
A397: BEST PLAYERS | W397: BOX HILL | X397: 4 | Y397: 5 | Z397: 0 | AA397: 942 | AB397: 1173 | AC397: =(AA397/AB397)*100 -> 80.306905370843992 | AD397: =(X397*4)+(Z397*2) -> 16
A398: WILLIAMSTOWN | C398: ROUND | F398: CAHILL | I398: RAEBURN | L398: PASTORE | O398: NILSSEN | Q398: TAYLOR | W398: SANDRINGHAM | X398: 3 | Y398: 6 | Z398: 0 | AA398: 942 | AB398: 998 | AC398: =(AA398/AB398)*100 -> 94.388777555110224 | AD398: =(X398*4)+(Z398*2) -> 12
A399: PRESTON | C399: NICOLAOU | F399: RAYMENT | I399: BRINE | L399: SHAW | W399: FRANKSTON | X399: 2 | Y399: 7 | Z399: 0 | AA399: 797 | AB399: 1049 | AC399: =(AA399/AB399)*100 -> 75.977121067683512 | AD399: =(X399*4)+(Z399*2) -> 8
A400: GOALKICKERS | W400: PRAHRAN | X400: 2 | Y400: 7 | Z400: 0 | AA400: 757 | AB400: 1107 | AC400: =(AA400/AB400)*100 -> 68.383017163504974 | AD400: =(X400*4)+(Z400*2) -> 8
A401: WILLIAMSTOWN | C401: ROUND 7 | F401: RICKMAN 3 | I401: ROWSELL 2 | L401: CAHILL | N401: KENNEDY | Q401: NILSSEN
A402: PRESTON | C402: SHAW 5 | F402: NICOLAOU 3 | I402: HALAS 2 | K402: PLOWMAN | N402: SENNO | Q402: RAYMENT
A404: PRAHRAN | C404: 4 | D404: 1 | E404: 25 | G404: 5 | H404: 3 | I404: 33 | K404: 6 | L404: 8 | M404: 44 | O404: 10 | P404: 11 | Q404: 71 | S404: VENUE: TOORAK PARK
A405: FRANKSTON | C405: 2 | D405: 4 | E405: 16 | G405: 5 | H405: 6 | I405: 36 | K405: 6 | L405: 7 | M405: 43 | O405: 7 | P405: 8 | Q405: 50 | S405: BLACK :MORROW
A406: BEST PLAYERS
A407: PRAHRAN | C407: WALDER | F407: McCARTY | I407: EVANS | L407: PAGE | O407: CUTLER | Q407: P GILES
A408: FRANKSTON | C408: SHIELDS | F408: PAYNE | I408: RAVEN | L408: P MARTIN | O408: BROWN | Q408: O'BRIEN
A409: GOALKICKERS
A410: PRAHRAN | C410: P GILES 3 | F410: EVANS 3 | I410: CUTLER | K410: G GILES | M410: SOULOS | O410: WALLACE
A411: FRANKSTON | C411: SARAU 2 | F411: BINGLEY 2 | I411: S HAMILL | K411: O'BRIEN | M411: SHIELDS
A413: PORT MELBOURNE | C413: 2 | D413: 3 | E413: 15 | G413: 13 | H413: 3 | I413: 81 | K413: 15 | L413: 8 | M413: 98 | O413: 18 | P413: 12 | Q413: 120 | S413: VENUE: BEACH ROAD
A414: SANDRINGHAM | C414: 4 | D414: 3 | E414: 27 | G414: 4 | H414: 3 | I414: 27 | K414: 5 | L414: 7 | M414: 37 | O414: 10 | P414: 9 | Q414: 69 | S414: BROOKS :P MARSHALL
A415: BEST PLAYERS
A416: PORT MELBOURNE | C416: BRADBURY | F416: HARKINS | I416: SWAN | L416: CHADBAND | O416: WHITZELL | R416: FOLEY
A417: SANDRINGHAM | C417: PRATT | F417: ALLEN | I417: PHILBEY | L417: ERWIN
A418: GOALKICKERS
A419: PORT MELBOURNE | C419: McCORMACK 6 | F419: HARKINS 6 | I419: WHITZELL 2 | L419: FOLEY 2 | N419: STROOPER | Q419: CHRIMES
A420: SANDRINGHAM | C420: BENNETT 4 | F420: F RUGOLO 4 | I420: EAVES | K420: ERWIN
A422: COBURG | C422: 5 | D422: 4 | E422: 34 | G422: 9 | H422: 9 | I422: 63 | K422: 12 | L422: 12 | M422: 84 | O422: 19 | P422: 16 | Q422: 130 | S422: VENUE: BOX HILL
A423: BOX HILL | C423: 3 | D423: 2 | E423: 20 | G423: 6 | H423: 4 | I423: 40 | K423: 7 | L423: 5 | M423: 47 | O423: 8 | P423: 6 | Q423: 54 | S423: McDONALD :WALKER
A424: BEST PLAYERS
A425: COBURG | C425: WEIDEMAN | F425: ALLISON | I425: WILLIAMS | L425: SHELDON | O425: INGRAM | R425: TARANTO
A426: BOX HILL | C426: TURNER | F426: COOPER | I426: HOCKING | L426: WOOLF | O426: D BOURKE | R426: PRESTON
A427: GOALKICKERS
A428: COBURG | C428: WILLIAMS 6 | F428: INGRAM 3 | I428: LANGAN 3 | K428: KAAKOUR 2 | N428: ALLISON 2 | Q428: DARBY | S428: EADE | U428: RIENIETS
A429: BOX HILL | C429: WOOLF 3 | F429: BOLTON 2 | I429: BROWN 2 | K429: NICHOLSON
A431: ROUND 10 | D431: 26TH JUNE | I431: WEATHER | S431: VENUE: PRESTON
D432: 1ST QTR | H432: 2ND QTR | L432: 3RD QTR | P432: FINAL | S432: UMPIRES
A433: BRUNSWICK | C433: 3 | D433: 10 | E433: 28 | G433: 6 | H433: 12 | I433: 48 | K433: 13 | L433: 16 | M433: 94 | O433: 17 | P433: 18 | Q433: 120 | S433: MARSHALL | X433: LADDER | AB433: ROUND | AD433: 10
A434: PRESTON | C434: 3 | D434: 4 | E434: 22 | G434: 6 | H434: 10 | I434: 46 | K434: 8 | L434: 14 | M434: 62 | O434: 14 | P434: 16 | Q434: 100 | S434: VERGONA
A435: BEST PLAYERS | W435: TEAM | X435: W | Y435: L | Z435: D | AA435: FOR | AB435: AGST | AC435: % | AD435: PTS
A436: BRUNSWICK | C436: LEAHY | F436: CALLANDER | I436: WEST | L436: WRIGHT | O436: McALLESTER | R436: GRIFFITHS
A437: PRESTON | C437: NICOLAOU | F437: MARCON | I437: BROWN | L437: VALKANIS | O437: HUNT | R437: DUNBAR | W437: COBURG | X437: 8 | Y437: 2 | Z437: 0 | AA437: 1243 | AB437: 850 | AC437: =(AA437/AB437)*100 -> 146.23529411764707 | AD437: =(X437*4)+(Z437*2) -> 32
A438: GOALKICKERS | W438: WILLIAMSTOWN | X438: 7 | Y438: 3 | Z438: 0 | AA438: 1159 | AB438: 941 | AC438: =(AA438/AB438)*100 -> 123.16684378320934 | AD438: =(X438*4)+(Z438*2) -> 28
A439: BRUNSWICK | C439: GRIFFITHS 7 | F439: POTTER 2 | I439: WEST 2 | K439: CLARKE 2 | M439: WRIGHT | O439: BEALE | Q439: LEAHY | S439: HERBERT | W439: PORT MELBOURNE | X439: 6 | Y439: 4 | Z439: 0 | AA439: 1200 | AB439: 1042 | AC439: =(AA439/AB439)*100 -> 115.16314779270633 | AD439: =(X439*4)+(Z439*2) -> 24
A440: PRESTON | C440: SHAW 5 | F440: NICOLAOU 2 | I440: HALAS 2 | K440: RAYMENT 2 | N440: LUMICISI | P440: PLOWMAN | S440: PRIDEAUX | W440: BRUNSWICK | X440: 6 | Y440: 4 | Z440: 0 | AA440: 1040 | AB440: 1090 | AC440: =(AA440/AB440)*100 -> 95.412844036697251 | AD440: =(X440*4)+(Z440*2) -> 24
S441: VENUE: BOX HILL
A442: BOX HILL | C442: 2 | D442: 4 | E442: 16 | G442: 5 | H442: 6 | I442: 36 | K442: 7 | L442: 12 | M442: 54 | O442: 12 | P442: 18 | Q442: 90 | S442: CASEY | W442: SPRINGVALE | X442: 5 | Y442: 5 | Z442: 0 | AA442: 1047 | AB442: 952 | AC442: =(AA442/AB442)*100 -> 109.97899159663866 | AD442: =(X442*4)+(Z442*2) -> 20
A443: FRANKSTON | C443: 4 | D443: 2 | E443: 26 | G443: 9 | H443: 5 | I443: 59 | K443: 9 | L443: 7 | M443: 61 | O443: 12 | P443: 11 | Q443: 83 | S443: BROOKS | W443: PRESTON | X443: 5 | Y443: 5 | Z443: 0 | AA443: 1192 | AB443: 1085 | AC443: =(AA443/AB443)*100 -> 109.86175115207372 | AD443: =(X443*4)+(Z443*2) -> 20
A444: BEST PLAYERS | W444: BOX HILL | X444: 5 | Y444: 5 | Z444: 0 | AA444: 1032 | AB444: 1256 | AC444: =(AA444/AB444)*100 -> 82.165605095541409 | AD444: =(X444*4)+(Z444*2) -> 20
A445: BOX HILL | C445: PEVITT | F445: HOCKING | I445: PRESTON | L445: MORRISON | O445: NICHOLSON | R445: McMAHON | W445: SANDRINGHAM | X445: 4 | Y445: 6 | Z445: 0 | AA445: 1062 | AB445: 1049 | AC445: =(AA445/AB445)*100 -> 101.23927550047665 | AD445: =(X445*4)+(Z445*2) -> 16
A446: FRANKSTON | C446: O'BRIEN | F446: SARAU | I446: SHIELDS | L446: MARTIN | O446: BROWN | R446: GILBERT | W446: FRANKSTON | X446: 2 | Y446: 8 | Z446: 0 | AA446: 880 | AB446: 1139 | AC446: =(AA446/AB446)*100 -> 77.260755048287976 | AD446: =(X446*4)+(Z446*2) -> 8
A447: GOALKICKERS | W447: PRAHRAN | X447: 2 | Y447: 8 | Z447: 0 | AA447: 831 | AB447: 1254 | AC447: =(AA447/AB447)*100 -> 66.267942583732051 | AD447: =(X447*4)+(Z447*2) -> 8
A448: BOX HILL | C448: BOLTON 5 | F448: PRESTON 3 | I448: NICHOLSON | L448: D BOURKE | O448: FITZGERALD | R448: McMAHON
A449: FRANKSTON | C449: BINGLEY 2 | E449: AMOORE 2 | H449: ROGERSON 2 | K449: WHITFIELD | M449: LANE | O449: P MARTIN | Q449: O'BRIEN | S449: HORNER
P450: RYAN
A451: PORT MELBOURNE | C451: 9 | D451: 9 | E451: 63 | G451: 10 | H451: 12 | I451: 72 | K451: 16 | L451: 16 | M451: 112 | O451: 21 | P451: 21 | Q451: 147 | S451: VENUE: TOORAK PARK
A452: PRAHRAN | C452: 1 | D452: 0 | E452: 6 | G452: 5 | H452: 6 | I452: 36 | K452: 8 | L452: 9 | M452: 57 | O452: 10 | P452: 14 | Q452: 74 | S452: McDONALD :PHILLIPS
A453: BEST PLAYERS
A454: PORT MELBOURNE | C454: STROOPER | F454: CHADBAND | I454: BRADBURY | L454: A HICKS | O454: HARKINS | R454: CHRIMES
A455: PRAHRAN | C455: EVANS | F455: WALDER
A456: GOALKICKERS
A457: PORT MELBOURNE | C457: A HICKS 5 | F457: McCORMACK 5 | I457: HETHERTON 3 | L457: CHRIMES 3 | N457: MUTIMER 2 | Q457: SWAN | S457: HARKINS | V457: STROOPER
A458: PRAHRAN | C458: EVANS 4 | F458: P GILES 2 | I458: HEWITSON | L458: CUTLER | N458: REYNOLDS | Q458: CARTLEDGE
A460: SANDRINGHAM | C460: 5 | D460: 4 | E460: 34 | G460: 8 | H460: 9 | I460: 57 | K460: 15 | L460: 17 | M460: 107 | O460: 17 | P460: 18 | Q460: 120 | S460: VENUE: BEACH ROAD
A461: SPRINGVALE | C461: 2 | D461: 1 | E461: 13 | G461: 3 | H461: 6 | I461: 24 | K461: 3 | L461: 8 | M461: 26 | O461: 6 | P461: 15 | Q461: 51 | S461: GLEESON :WALKER
A462: BEST PLAYERS
A463: SANDRINGHAM | C463: PRATT | F463: PHILBEY | I463: DALRYMPLE | L463: BENNETT | O463: DOBSON | R463: BONNEY
A464: SPRINGVALE | C464: DEMPSTER | F464: ANDERSON | I464: WARNER | L464: FOY
A465: GOALKICKERS
A466: SANDRINGHAM | C466: BENNETT 9 | F466: KRISTENSEN 2 | I466: J RUGOLO 2 | L466: F RUGOLO 2 | O466: PHILBEY | Q466: ANTONIO
A467: SPRINGVALE | C467: NORMAN | F467: ROBINSON | I467: MATHIESON | L467: WARNER | N467: ANDERSON | Q467: FOY
A469: WILLIAMSTOWN | C469: 5 | D469: 4 | E469: 34 | G469: 9 | H469: 5 | I469: 59 | K469: 13 | L469: 11 | M469: 89 | O469: 16 | P469: 13 | Q469: 109 | S469: VENUE: WILLIAMSTOWN
A470: COBURG | C470: 1 | D470: 1 | E470: 7 | G470: 5 | H470: 5 | I470: 35 | K470: 6 | L470: 6 | M470: 42 | O470: 12 | P470: 15 | Q470: 87 | S470: MORROW :HOLT
A471: BEST PLAYERS
A472: WILLIAMSTOWN | C472: RAEBURN | F472: NILSSEN | I472: TAYLOR | L472: R DIMARTINO | O472: ROUND | Q472: McTAGGART
A473: COBURG | C473: WAIN | F473: RACOVOLIS | I473: BOURKE | L473: WEIDEMAN
A474: GOALKICKERS
A475: WILLIAMSTOWN | C475: MOURNEY 3 | F475: RAEBURN 2 | I475: NILSSEN 2 | K475: TAYLOR 2 | M475: RICKMAN 2 | P475: CAHILL | R475: McTAGGART | V475: ROBERTSON | Y475: PASTORE
A476: COBURG | C476: INGRAM 3 | F476: WAIN 2 | H476: LANGAN 2 | J476: KAAKOUR | M476: WEIDEMAN | P476: REYNOLDSON | S476: RACOVOLIS | V476: BOURKE
A478: ROUND 11 | D478: 3RD JULY | I478: WEATHER | S478: VENUE: BRUNSWICK
D479: 1ST QTR | H479: 2ND QTR | L479: 3RD QTR | P479: FINAL | S479: UMPIRES
A480: SANDRINGHAM | C480: 5 | D480: 7 | E480: 37 | G480: 9 | H480: 13 | I480: 67 | K480: 12 | L480: 14 | M480: 86 | O480: 13 | P480: 18 | Q480: 96 | S480: MORROW | X480: LADDER | AB480: ROUND | AD480: 11
A481: BRUNSWICK | C481: 4 | D481: 6 | E481: 30 | G481: 6 | H481: 9 | I481: 45 | K481: 10 | L481: 15 | M481: 75 | O481: 13 | P481: 17 | Q481: 95 | S481: BROOKS
A482: BEST PLAYERS | W482: TEAM | X482: W | Y482: L | Z482: D | AA482: FOR | AB482: AGST | AC482: % | AD482: PTS
A483: SANDRINGHAM | C483: J RUGOLO | F483: BONNEY | I483: KRISTENSEN | L483: DOBSON | O483: GOODCHILD | R483: BEILBY
A484: BRUNSWICK | C484: HYSLOP | F484: LEAHY | I484: THOROGOOD | L484: CONNELL | O484: PERRY | W484: COBURG | X484: 8 | Y484: 3 | Z484: 0 | AA484: 1349 | AB484: 972 | AC484: =(AA484/AB484)*100 -> 138.78600823045269 | AD484: =(X484*4)+(Z484*2) -> 32
A485: GOALKICKERS | W485: PORT MELBOURNE | X485: 7 | Y485: 4 | Z485: 0 | AA485: 1348 | AB485: 1129 | AC485: =(AA485/AB485)*100 -> 119.39769707705933 | AD485: =(X485*4)+(Z485*2) -> 28
A486: SANDRINGHAM | C486: BENNETT 4 | F486: J RUGOLO 4 | I486: ANTONIO 3 | L486: F RUGOLO | O486: DALRYMPLE | W486: WILLIAMSTOWN | X486: 7 | Y486: 4 | Z486: 0 | AA486: 1286 | AB486: 1096 | AC486: =(AA486/AB486)*100 -> 117.33576642335765 | AD486: =(X486*4)+(Z486*2) -> 28
A487: BRUNSWICK | C487: PERRY 5 | F487: BEALE 2 | H487: HERBERT 2 | K487: CALLANDER | N487: HOLMES | P487: BAKER | R487: WEST | W487: PRESTON | X487: 6 | Y487: 5 | Z487: 0 | AA487: 1314 | AB487: 1191 | AC487: =(AA487/AB487)*100 -> 110.32745591939546 | AD487: =(X487*4)+(Z487*2) -> 24
S488: VENUE: FRANKSTON
A489: FRANKSTON | C489: 0 | D489: 5 | E489: 5 | G489: 5 | H489: 8 | I489: 38 | K489: 18 | L489: 9 | M489: 117 | O489: 24 | P489: 11 | Q489: 155 | S489: MARSHALL | W489: BRUNSWICK | X489: 6 | Y489: 5 | Z489: 0 | AA489: 1135 | AB489: 1186 | AC489: =(AA489/AB489)*100 -> 95.699831365935921 | AD489: =(X489*4)+(Z489*2) -> 24
A490: WILLIAMSTOWN | C490: 4 | D490: 3 | E490: 27 | G490: 10 | H490: 7 | I490: 67 | K490: 16 | L490: 8 | M490: 104 | O490: 19 | P490: 13 | Q490: 127 | S490: HARVEY | W490: SPRINGVALE | X490: 5 | Y490: 6 | Z490: 0 | AA490: 1087 | AB490: 1009 | AC490: =(AA490/AB490)*100 -> 107.73042616451933 | AD490: =(X490*4)+(Z490*2) -> 20
A491: BEST PLAYERS | W491: SANDRINGHAM | X491: 5 | Y491: 6 | Z491: 0 | AA491: 1158 | AB491: 1144 | AC491: =(AA491/AB491)*100 -> 101.22377622377623 | AD491: =(X491*4)+(Z491*2) -> 20
A492: FRANKSTON | C492: BROWN | F492: AMOORE | I492: ATKINS | L492: GARDNER | O492: STAGG | Q492: WATSON | W492: BOX HILL | X492: 5 | Y492: 6 | Z492: 0 | AA492: 1119 | AB492: 1404 | AC492: =(AA492/AB492)*100 -> 79.700854700854705 | AD492: =(X492*4)+(Z492*2) -> 20
A493: WILLIAMSTOWN | C493: RICKMAN | F493: NILSSEN | I493: MCGOWAN | W493: FRANKSTON | X493: 3 | Y493: 8 | Z493: 0 | AA493: 1035 | AB493: 1266 | AC493: =(AA493/AB493)*100 -> 81.753554502369667 | AD493: =(X493*4)+(Z493*2) -> 12
A494: GOALKICKERS | N494: SHIELDS | W494: PRAHRAN | X494: 3 | Y494: 8 | Z494: 0 | AA494: 888 | AB494: 1294 | AC494: =(AA494/AB494)*100 -> 68.624420401854707 | AD494: =(X494*4)+(Z494*2) -> 12
A495: FRANKSTON | C495: BROWN 8 | E495: WHITFIELD 5 | H495: GARDNER 4 | J495: AMOORE 2 | M495: MEEHAN | O495: BINGLEY | Q495: O'BRIEN | S495: ROGERSON
A496: WILLIAMSTOWN | C496: RICKMAN 5 | E496: WHILLAS 3 | H496: McGOWAN 3 | K496: V DIMARTINO 2 | N496: NILSSEN 2 | Q496: SIMMONS 2 | T496: MURPHY
M497: N DIMARTINO
A498: PORT MELBOURNE | C498: 4 | D498: 8 | E498: 32 | G498: 10 | H498: 12 | I498: 72 | K498: 16 | L498: 17 | M498: 113 | O498: 21 | P498: 22 | Q498: 148 | S498: VENUE: PORT MELBOURNE
A499: BOX HILL | C499: 3 | D499: 2 | E499: 20 | G499: 6 | H499: 6 | I499: 42 | K499: 9 | L499: 9 | M499: 63 | O499: 12 | P499: 15 | Q499: 87 | S499: GLEESON :WALKER
A500: BEST PLAYERS
A501: PORT MELBOURNE | C501: FOLEY | F501: STROOPER | I501: QUINN | L501: McCORMACK | O501: ALLENDER | R501: HETHERTON
A502: BOX HILL | C502: PEVITT | F502: PRESTON | I502: HOCKING | L502: GERADTS | O502: GLEESON
A503: GOALKICKERS
A504: PORT MELBOURNE | C504: COOPER 5 | F504: McCORMACK 4 | I504: MUTIMER 4 | L504: FOLEY 2 | N504: QUINN 2 | P504: WHITZELL | R504: SWAN | T504: STROOPER | W504: LARKIN
A505: BOX HILL | C505: FITZGERALD 4 | F505: WOLFF 2 | H505: NICHOLSON | K505: BROWN | M505: PEVITT | O505: PRESTON | Q505: ROBERTSON | T505: GLEESON
A507: PRAHRAN | C507: 2 | D507: 0 | E507: 12 | G507: 5 | H507: 1 | I507: 31 | K507: 6 | L507: 6 | M507: 42 | O507: 8 | P507: 9 | Q507: 57 | S507: VENUE: SPRINGVALE
A508: SPRINGVALE | C508: 1 | D508: 3 | E508: 9 | G508: 4 | H508: 5 | I508: 29 | K508: 4 | L508: 8 | M508: 32 | O508: 5 | P508: 10 | Q508: 40 | S508: VERGONA :HOLT
A509: BEST PLAYERS
A510: PRAHRAN | C510: ELLETT | F510: HIPWORTH | I510: HERMANN | L510: PAGE | O510: HUTCHISON | R510: FIELDING
A511: SPRINGVALE | C511: WARD | F511: DEMPSTER | I511: DUDLEY | L511: REECE | O511: WARNER
A512: GOALKICKERS
A513: PRAHRAN | C513: P GILES 3 | F513: HUTCHISON 2 | I513: FRANCIS | K513: HEWITSON | N513: EVANS
A514: SPRINGVALE | C514: WALSH 2 | F514: WARD | H514: PROSSER | K514: MORGAN
A516: PRESTON | C516: 4 | D516: 2 | E516: 26 | G516: 8 | H516: 5 | I516: 53 | K516: 15 | L516: 7 | M516: 97 | O516: 19 | P516: 8 | Q516: 122 | S516: VENUE: COBURG
A517: COBURG | C517: 5 | D517: 2 | E517: 32 | G517: 8 | H517: 6 | I517: 54 | K517: 11 | L517: 8 | M517: 74 | O517: 15 | P517: 16 | Q517: 106 | S517: PHILLIPS :G CASEY
A518: BEST PLAYERS
A519: PRESTON | C519: VALKANIS | F519: DUNBAR | I519: SHAW | L519: JACKSON | O519: PLOWMAN | R519: ELLIS
A520: COBURG | C520: HARBINSON | F520: REYNOLDSON | I520: RACOVOLIS | L520: ANGWIN | O520: BOURKE
A521: GOALKICKERS
A522: PRESTON | C522: SHAW 8 | F522: JORDAN 4 | I522: LUMICISI 3 | K522: HALAS | M522: SENNO | O522: PRIDEAUX | R522: HUNT
A523: COBURG | C523: WEATHERALD 5 | G523: KAAKOUR 2 | J523: RACOVOLIS 2 | M523: LAWSON 2 | P523: BOURKE 2 | R523: REYNOLDSON | V523: MONACO
A525: ROUND 12 | D525: 10TH JULY | I525: WEATHER | S525: VENUE: TOORAK PARK
D526: 1ST QTR | H526: 2ND QTR | L526: 3RD QTR | P526: FINAL | S526: UMPIRES
A527: PRAHRAN | C527: 5 | D527: 8 | E527: 38 | G527: 6 | H527: 11 | I527: 47 | K527: 11 | L527: 17 | M527: 83 | O527: 15 | P527: 22 | Q527: 112 | S527: CASEY | X527: LADDER | AB527: ROUND | AD527: 12
A528: BRUNSWICK | C528: 1 | D528: 0 | E528: 6 | G528: 3 | H528: 2 | I528: 20 | K528: 4 | L528: 3 | M528: 27 | O528: 7 | P528: 5 | Q528: 47 | S528: MARSHALL
A529: BEST PLAYERS | W529: TEAM | X529: W | Y529: L | Z529: D | AA529: FOR | AB529: AGST | AC529: % | AD529: PTS
A530: PRAHRAN | C530: HERMANN | F530: McCARTY | I530: KILEY | L530: EVANS | O530: JACKSON | R530: HAMILTON
A531: BRUNSWICK | C531: McALLESTER | F531: CLARKE | I531: LEAHY | L531: LOVETT | W531: COBURG | X531: 9 | Y531: 3 | Z531: 0 | AA531: 1451 | AB531: 1050 | AC531: =(AA531/AB531)*100 -> 138.1904761904762 | AD531: =(X531*4)+(Z531*2) -> 36
A532: GOALKICKERS | W532: PORT MELBOURNE | X532: 8 | Y532: 4 | Z532: 0 | AA532: 1440 | AB532: 1217 | AC532: =(AA532/AB532)*100 -> 118.32374691865242 | AD532: =(X532*4)+(Z532*2) -> 32
A533: PRAHRAN | C533: HUTCHISON 4 | F533: P GILES 4 | I533: EVANS 3 | K533: HEWITSON | N533: HIPWORTH | Q533: SOULOS | S533: CARTLEDGE | W533: WILLIAMSTOWN | X533: 7 | Y533: 5 | Z533: 0 | AA533: 1374 | AB533: 1188 | AC533: =(AA533/AB533)*100 -> 115.65656565656566 | AD533: =(X533*4)+(Z533*2) -> 28
A534: BRUNSWICK | C534: BAKER 3 | F534: THOROGOOD | I534: HERBERT | K534: CONNELL | N534: SALVADORE | W534: PRESTON | X534: 7 | Y534: 5 | Z534: 0 | AA534: 1435 | AB534: 1279 | AC534: =(AA534/AB534)*100 -> 112.19702892885066 | AD534: =(X534*4)+(Z534*2) -> 28
S535: VENUE: COBURG
A536: COBURG | C536: 5 | D536: 3 | E536: 33 | G536: 9 | H536: 4 | I536: 58 | K536: 12 | L536: 8 | M536: 80 | O536: 15 | P536: 12 | Q536: 102 | S536: PRICE | W536: SPRINGVALE | X536: 6 | Y536: 6 | Z536: 0 | AA536: 1138 | AB536: 1044 | AC536: =(AA536/AB536)*100 -> 109.00383141762453 | AD536: =(X536*4)+(Z536*2) -> 24
A537: FRANKSTON | C537: 2 | D537: 2 | E537: 14 | G537: 4 | H537: 5 | I537: 29 | K537: 5 | L537: 7 | M537: 37 | O537: 11 | P537: 12 | Q537: 78 | S537: WALKER | W537: BRUNSWICK | X537: 6 | Y537: 6 | Z537: 0 | AA537: 1182 | AB537: 1298 | AC537: =(AA537/AB537)*100 -> 91.063174114021578 | AD537: =(X537*4)+(Z537*2) -> 24
A538: BEST PLAYERS | W538: SANDRINGHAM | X538: 5 | Y538: 7 | Z538: 0 | AA538: 1246 | AB538: 1265 | AC538: =(AA538/AB538)*100 -> 98.498023715415016 | AD538: =(X538*4)+(Z538*2) -> 20
A539: COBURG | C539: BOURKE | F539: SHELDON | I539: ALLISON | L539: DARBY | O539: ANGWIN | W539: BOX HILL | X539: 5 | Y539: 7 | Z539: 0 | AA539: 1154 | AB539: 1458 | AC539: =(AA539/AB539)*100 -> 79.149519890260635 | AD539: =(X539*4)+(Z539*2) -> 20
A540: FRANKSTON | C540: PAYNE | F540: GILBERT | I540: ATKINS | L540: MARTIN | W540: PRAHRAN | X540: 4 | Y540: 8 | Z540: 0 | AA540: 1000 | AB540: 1341 | AC540: =(AA540/AB540)*100 -> 74.571215510812834 | AD540: =(X540*4)+(Z540*2) -> 16
A541: GOALKICKERS | W541: FRANKSTON | X541: 3 | Y541: 9 | Z541: 0 | AA541: 1113 | AB541: 1368 | AC541: =(AA541/AB541)*100 -> 81.359649122807014 | AD541: =(X541*4)+(Z541*2) -> 12
A542: COBURG | C542: WEATHERALD 4 | F542: DARBY 3 | H542: LANGAN 2 | K542: BOURKE 2 | M542: KAAKOUR | P542: TARANTO | R542: EVANS | T542: BOOTH
A543: FRANKSTON | C543: BROWN 4 | F543: WHITFIELD 2 | I543: GARDNER | K543: MEEHAN | M543: AMOORE | O543: S HAMILL | Q543: SHIELDS
A545: PORT MELBOURNE | C545: 2 | D545: 4 | E545: 16 | G545: 3 | H545: 9 | I545: 27 | K545: 8 | L545: 15 | M545: 63 | O545: 12 | P545: 20 | Q545: 92 | S545: VENUE: WILLIAMSTOWN
A546: WILLIAMSTOWN | C546: 3 | D546: 7 | E546: 25 | G546: 7 | H546: 13 | I546: 55 | K546: 9 | L546: 15 | M546: 69 | O546: 12 | P546: 16 | Q546: 88 | S546: VERGONA :PHILLIPS
A547: BEST PLAYERS
A548: PORT MELBOURNE | C548: SWAN | F548: HARKINS | I548: RAMSAY | L548: CHADBAND | O548: CHRIMES | R548: HETHERTON
A549: WILLIAMSTOWN | C549: MOURNEY | F549: RAEBURN | I549: ROUND | L549: CAHILL | O549: WHEELER | R549: WHILLAS
A550: GOALKICKERS
A551: PORT MELBOURNE | C551: MUTIMER 2 | F551: SMITH 2 | H551: HARKINS 2 | J551: COOPER 2 | M551: HICKS | O551: HETHERTON | R551: SWAN | T551: BRADBURY
A552: WILLIAMSTOWN | C552: WHILLAS 3 | F552: RAEBURN 3 | I552: MOURNEY 3 | L552: RICKMAN | N552: McGOWAN | Q552: SMITH
A554: SPRINGVALE | C554: 1 | D554: 2 | E554: 8 | G554: 3 | H554: 10 | I554: 28 | K554: 4 | L554: 12 | M554: 36 | O554: 5 | P554: 21 | Q554: 51 | S554: VENUE: BOX HILL
A555: BOX HILL | C555: 4 | D555: 2 | E555: 26 | G555: 4 | H555: 5 | I555: 29 | K555: 4 | L555: 5 | M555: 29 | O555: 5 | P555: 5 | Q555: 35 | S555: BROOKS ;MORROW
A556: BEST PLAYERS
A557: SPRINGVALE | C557: TEAM EFFORT
A558: BOX HILL | C558: COLLINS | F558: HOCKING | I558: BOLTON | L558: GLEESON | O558: GERADTS | R558: MORRISON
A559: GOALKICKERS
A560: SPRINGVALE | C560: SAVAGE 3 | F560: DEMPSTER | I560: DUDLEY
A561: BOX HILL | C561: FITZGERALD 2 | F561: NICHOLSON | I561: GLEESON | L561: MORRIS
A563: PRESTON | C563: 6 | D563: 7 | E563: 43 | G563: 11 | H563: 10 | I563: 76 | K563: 16 | L563: 10 | M563: 106 | O563: 18 | P563: 13 | Q563: 121 | S563: VENUE: PRESTON
A564: SANDRINGHAM | C564: 1 | D564: 1 | E564: 7 | G564: 6 | H564: 5 | I564: 41 | K564: 8 | L564: 8 | M564: 56 | O564: 12 | P564: 16 | Q564: 88
A565: BEST PLAYERS
A566: PRESTON
A567: SANDRINGHAM
A568: GOALKICKERS
A569: PRESTON | C569: SHAW 5 | E569: DINTINOSANTE 4 | H569: HALAS 3 | J569: BRINE 2 | L569: LUMICISI | N569: NICOLAOU | Q569: JACKSON | S569: RAYMENT
A570: SANDRINGHAM | C570: J RUGOLO 4 | F570: IRWIN 2 | H570: ALLEN 2 | J570: BENNETT | M570: ERWIN | O570: F RUGOLO | Q570: MERSON
A572: ROUND 13 | D572: 17TH JULY | I572: WEATHER | S572: VENUE: BRUNSWICK
D573: 1ST QTR | H573: 2ND QTR | L573: 3RD QTR | P573: FINAL | S573: UMPIRES
A574: BOX HILL | C574: 2 | D574: 3 | E574: 15 | G574: 7 | H574: 7 | I574: 49 | K574: 10 | L574: 9 | M574: 69 | O574: 12 | P574: 14 | Q574: 86 | S574: PHILLIPS | X574: LADDER | AB574: ROUND | AD574: 13
A575: BRUNSWICK | C575: 3 | D575: 4 | E575: 22 | G575: 3 | H575: 6 | I575: 24 | K575: 7 | L575: 7 | M575: 49 | O575: 11 | P575: 13 | Q575: 79 | S575: VERGONA
A576: BEST PLAYERS | W576: TEAM | X576: W | Y576: L | Z576: D | AA576: FOR | AB576: AGST | AC576: % | AD576: PTS
A577: BOX HILL | C577: GLEESON | F577: WOLFF | I577: PRESTON | L577: HOGAN | N577: HOCKING | Q577: TURNER
A578: BRUNSWICK | C578: CLARKE | F578: COOPER | I578: HARRINGTON | L578: HERBERT | N578: DUGDALE | Q578: GRIFFITH | W578: COBURG | X578: 9 | Y578: 4 | Z578: 0 | AA578: 1556 | AB578: 1214 | AC578: =(AA578/AB578)*100 -> 128.17133443163098 | AD578: =(X578*4)+(Z578*2) -> 36
A579: GOALKICKERS | W579: PORT MELBOURNE | X579: 9 | Y579: 4 | Z579: 0 | AA579: 1604 | AB579: 1322 | AC579: =(AA579/AB579)*100 -> 121.33131618759457 | AD579: =(X579*4)+(Z579*2) -> 36
A580: BOX HILL | C580: HOGAN 6 | F580: BROWN 2 | I580: WOLFF 2 | L580: HOCKING | N580: GLEESON | W580: PRESTON | X580: 8 | Y580: 5 | Z580: 0 | AA580: 1574 | AB580: 1349 | AC580: =(AA580/AB580)*100 -> 116.67902149740547 | AD580: =(X580*4)+(Z580*2) -> 32
A581: BRUNSWICK | C581: GRIFFITH 6 | F581: PERRY 2 | I581: CALANDER | L581: HERBERT | N581: COOPER | W581: WILLIAMSTOWN | X581: 7 | Y581: 6 | Z581: 0 | AA581: 1422 | AB581: 1266 | AC581: =(AA581/AB581)*100 -> 112.32227488151658 | AD581: =(X581*4)+(Z581*2) -> 28
S582: VENUE: FRANKSTON
A583: PRESTON | C583: 3 | D583: 3 | E583: 21 | G583: 10 | H583: 7 | I583: 67 | K583: 16 | L583: 10 | M583: 106 | O583: 21 | P583: 13 | Q583: 139 | S583: GLEESON | W583: SPRINGVALE | X583: 7 | Y583: 6 | Z583: 0 | AA583: 1216 | AB583: 1092 | AC583: =(AA583/AB583)*100 -> 111.35531135531136 | AD583: =(X583*4)+(Z583*2) -> 28
A584: FRANKSTON | C584: 4 | D584: 4 | E584: 28 | G584: 4 | H584: 6 | I584: 30 | K584: 5 | L584: 8 | M584: 38 | O584: 10 | P584: 10 | Q584: 70 | S584: MARSHALL | W584: SANDRINGHAM | X584: 6 | Y584: 7 | Z584: 0 | AA584: 1382 | AB584: 1380 | AC584: =(AA584/AB584)*100 -> 100.14492753623188 | AD584: =(X584*4)+(Z584*2) -> 24
A585: BEST PLAYERS | W585: BRUNSWICK | X585: 6 | Y585: 7 | Z585: 0 | AA585: 1261 | AB585: 1384 | AC585: =(AA585/AB585)*100 -> 91.112716763005778 | AD585: =(X585*4)+(Z585*2) -> 24
A586: PRESTON | C586: DUNBAR | F586: SHAW | I586: LUMICISI | L586: DINTINOSANTE | O586: JACKSON | W586: BOX HILL | X586: 6 | Y586: 7 | Z586: 0 | AA586: 1240 | AB586: 1537 | AC586: =(AA586/AB586)*100 -> 80.676642810670145 | AD586: =(X586*4)+(Z586*2) -> 24
A587: FRANKSTON | C587: NIKAKIS | F587: PAYNE | I587: FOYSTER | L587: MARTIN | O587: AMOORE | W587: PRAHRAN | X587: 4 | Y587: 9 | Z587: 0 | AA587: 1115 | AB587: 1477 | AC587: =(AA587/AB587)*100 -> 75.490859851049436 | AD587: =(X587*4)+(Z587*2) -> 16
A588: GOALKICKERS | W588: FRANKSTON | X588: 3 | Y588: 10 | Z588: 0 | AA588: 1183 | AB588: 1507 | AC588: =(AA588/AB588)*100 -> 78.500331785003326 | AD588: =(X588*4)+(Z588*2) -> 12
A589: PRESTON | C589: SHAW 15 | F589: LUMICISI | H589: NICOLAOU | K589: DUNBAR | M589: HUNT | O589: DINTINOSANTE | R589: ANDERSON
A590: FRANKSTON | C590: WHITFIELD 4 | F590: AMOORE 2 | I590: GARDNER | K590: BINGLEY | M590: PAYNE | O590: SHIELDS
A592: PORT MELBOURNE | C592: 4 | D592: 2 | E592: 26 | G592: 13 | H592: 8 | I592: 86 | K592: 16 | L592: 11 | M592: 107 | O592: 25 | P592: 14 | Q592: 164 | S592: VENUE: PORT MELBOURNE
A593: COBURG | C593: 2 | D593: 4 | E593: 16 | G593: 7 | H593: 9 | I593: 51 | K593: 11 | L593: 12 | M593: 78 | O593: 15 | P593: 15 | Q593: 105 | S593: BROOKS :MORROW
A594: BEST PLAYERS
A595: PORT MELBOURNE | C595: BRADBURY | F595: HICKS | I595: RAMSAY | L595: WHITZELL | O595: SWAN | Q595: HARKINS
A596: COBURG | C596: ALLISON | F596: ZANON | I596: ANGWIN | L596: KAAKOUR
A597: GOALKICKERS
A598: PORT MELBOURNE | C598: HICKS 6 | E598: COOPER 5 | G598: HARKINS 4 | I598: FOLEY 3 | K598: BRADBURY 3 | N598: HETHERTON | Q598: McCORMACK | T598: MUTIMER | W598: ALLENDER
A599: COBURG | C599: KAAKOUR 3 | F599: EADE 2 | H599: WILLIAMS 2 | K599: ALLISON 2 | M599: ZANON 2 | O599: ANGWIN | Q599: WEATHERALD | T599: BOOTH | W599: NIMMO
A601: SPRINGVALE | C601: 1 | D601: 6 | E601: 12 | G601: 2 | H601: 8 | I601: 20 | K601: 6 | L601: 8 | M601: 44 | O601: 11 | P601: 12 | Q601: 78 | S601: VENUE: SPRINGVALE
A602: WILLIAMSTOWN | C602: 1 | D602: 1 | E602: 7 | G602: 5 | H602: 6 | I602: 36 | K602: 7 | L602: 6 | M602: 48 | O602: 7 | P602: 6 | Q602: 48 | S602: CASEY :HARVEY
A603: BEST PLAYERS
A604: SPRINGVALE | C604: MORGAN | F604: VERNON | I604: DEMPSTER | L604: REECE | N604: MEADE | Q604: WARD
A605: WILLIAMSTOWN | C605: ROUND | F605: SMITH | I605: MURPHY | L605: TAYLOR
A606: GOALKICKERS
A607: SPRINGVALE | C607: SAVAGE 3 | F607: DEMPSTER 2 | I607: ANDERSON 2 | L607: ROBINSON | N607: MENDE | P607: DWYER | R607: NANFRA
A608: WILLIAMSTOWN | C608: RICKMAN 3 | F608: SLEVISON | I608: DELRE | K608: MOURNEY | N608: MCGOWAN
A610: SANDRINGHAM | C610: 4 | D610: 7 | E610: 31 | G610: 9 | H610: 11 | I610: 65 | K610: 15 | L610: 14 | M610: 104 | O610: 20 | P610: 16 | Q610: 136 | S610: VENUE: BEACH ROAD
A611: PRAHRAN | C611: 3 | D611: 1 | E611: 19 | G611: 5 | H611: 5 | I611: 35 | K611: 11 | L611: 7 | M611: 73 | O611: 17 | P611: 13 | Q611: 115 | S611: PRICE :WALKER
A612: BEST PLAYERS
A613: SANDRINGHAM | C613: FITZPATRICK | F613: PHILBEY | I613: ERWIN | L613: KRISTENSEN | O613: BERGMAN | R613: BONNEY
A614: PRAHRAN | C614: PAGE | F614: KILEY | I614: HEWITSON | L614: EVANS | O614: D HIBBERT
A615: GOALKICKERS
A616: SANDRINGHAM | C616: BERGMAN 6 | F616: ERWIN 4 | H616: IRWIN 3 | J616: EAVES 3 | L616: KRISTENSEN 2 | O616: ALLEN | Q616: WEST
A617: PRAHRAN | C617: HEWITSON 5 | F617: EVANS 4 | H617: FRANCIS | J617: CUTLER | L617: SOULOS | N617: ELKINGTON | Q617: HERMANN | S617: PAGE
A619: ROUND 14 | D619: 24TH JULY | I619: WEATHER | S619: VENUE: WILLIAMSTOWN
D620: 1ST QTR | H620: 2ND QTR | L620: 3RD QTR | P620: FINAL | S620: UMPIRES
A621: BRUNSWICK | C621: 4 | D621: 0 | E621: 24 | G621: 6 | H621: 3 | I621: 39 | K621: 6 | L621: 4 | M621: 40 | O621: 7 | P621: 5 | Q621: 47 | S621: GLEESON | X621: LADDER | AB621: ROUND | AD621: 14
A622: WILLIAMSTOWN | C622: 2 | D622: 3 | E622: 15 | G622: 2 | H622: 3 | I622: 15 | K622: 4 | L622: 6 | M622: 30 | O622: 4 | P622: 7 | Q622: 31 | S622: MORROW
A623: BEST PLAYERS | W623: TEAM | X623: W | Y623: L | Z623: D | AA623: FOR | AB623: AGST | AC623: % | AD623: PTS
A624: BRUNSWICK | C624: HERBERT | F624: CLARKE | I624: LOVETT | L624: BERTOLLO | O624: COOPER | R624: CONNELL
A625: WILLIAMSTOWN | C625: ROUND | F625: MURPHY | I625: SMITH | L625: RICKMAN | O625: R DIMARTINO | R625: McTAGGART | W625: COBURG | X625: 10 | Y625: 4 | Z625: 0 | AA625: 1690 | AB625: 1278 | AC625: =(AA625/AB625)*100 -> 132.2378716744914 | AD625: =(X625*4)+(Z625*2) -> 40
A626: GOALKICKERS | W626: PRESTON | X626: 9 | Y626: 5 | Z626: 0 | AA626: 1645 | AB626: 1375 | AC626: =(AA626/AB626)*100 -> 119.63636363636363 | AD626: =(X626*4)+(Z626*2) -> 36
A627: BRUNSWICK | C627: HERBERT 3 | F627: GRIFFITH 2 | I627: BERTOLLO | L627: McALLESTER | W627: PORT MELBOURNE | X627: 9 | Y627: 5 | Z627: 0 | AA627: 1677 | AB627: 1438 | AC627: =(AA627/AB627)*100 -> 116.6203059805285 | AD627: =(X627*4)+(Z627*2) -> 36
A628: WILLIAMSTOWN | C628: SIMMONS 3 | F628: RICKMAN | W628: WILLIAMSTOWN | X628: 7 | Y628: 7 | Z628: 0 | AA628: 1453 | AB628: 1313 | AC628: =(AA628/AB628)*100 -> 110.66260472201066 | AD628: =(X628*4)+(Z628*2) -> 28
S629: VENUE: BOX HILL
A630: BOX HILL | C630: 1 | D630: 3 | E630: 9 | G630: 7 | H630: 8 | I630: 50 | K630: 8 | L630: 11 | M630: 59 | O630: 12 | P630: 18 | Q630: 90 | S630: BLACK | W630: SPRINGVALE | X630: 7 | Y630: 7 | Z630: 0 | AA630: 1280 | AB630: 1226 | AC630: =(AA630/AB630)*100 -> 104.40456769983686 | AD630: =(X630*4)+(Z630*2) -> 28
A631: SANDRINGHAM | C631: 2 | D631: 4 | E631: 16 | G631: 2 | H631: 5 | I631: 17 | K631: 5 | L631: 9 | M631: 39 | O631: 5 | P631: 9 | Q631: 39 | S631: MARSHALL | W631: BRUNSWICK | X631: 7 | Y631: 7 | Z631: 0 | AA631: 1308 | AB631: 1415 | AC631: =(AA631/AB631)*100 -> 92.438162544169614 | AD631: =(X631*4)+(Z631*2) -> 28
A632: BEST PLAYERS | W632: BOX HILL | X632: 7 | Y632: 7 | Z632: 0 | AA632: 1330 | AB632: 1576 | AC632: =(AA632/AB632)*100 -> 84.390862944162436 | AD632: =(X632*4)+(Z632*2) -> 28
A633: BOX HILL | C633: BROWN | F633: PEVITT | I633: TURNER | L633: COLLINS | O633: PRESTON | R633: GARTH | W633: SANDRINGHAM | X633: 6 | Y633: 8 | Z633: 0 | AA633: 1421 | AB633: 1470 | AC633: =(AA633/AB633)*100 -> 96.666666666666671 | AD633: =(X633*4)+(Z633*2) -> 24
A634: SANDRINGHAM | C634: FITZGERALD | F634: MERSON | I634: DOBSON | L634: EAVES | O634: BONNEY | W634: FRANKSTON | X634: 4 | Y634: 10 | Z634: 0 | AA634: 1299 | AB634: 1580 | AC634: =(AA634/AB634)*100 -> 82.215189873417728 | AD634: =(X634*4)+(Z634*2) -> 16
A635: GOALKICKERS | W635: PRAHRAN | X635: 4 | Y635: 10 | Z635: 0 | AA635: 1141 | AB635: 1548 | AC635: =(AA635/AB635)*100 -> 73.708010335917322 | AD635: =(X635*4)+(Z635*2) -> 16
A636: BOX HILL | C636: PRESTON 3 | F636: GARTH 2 | H636: WOLFF 2 | J636: HOGAN 2 | L636: GLARE | N636: TURNER | P636: BROWN
A637: SANDRINGHAM | C637: ALLEN 2 | F637: ERWIN | H637: FRAANJE | K637: CARTY
A639: FRANKSTON | C639: 5 | D639: 4 | E639: 34 | G639: 7 | H639: 6 | I639: 48 | K639: 15 | L639: 7 | M639: 97 | O639: 18 | P639: 8 | Q639: 116 | S639: VENUE: FRANKSTON
A640: PORT MELBOURNE | C640: 1 | D640: 6 | E640: 12 | G640: 4 | H640: 8 | I640: 32 | K640: 7 | L640: 10 | M640: 52 | O640: 10 | P640: 13 | Q640: 73 | S640: CASEY :HARVEY
A641: BEST PLAYERS
A642: FRANKSTON | C642: TEAM EFFORT
A643: PORT MELBOURNE | C643: DERMOTT | F643: COOPER | I643: FOLEY | L643: CHRIMES
A644: GOALKICKERS
A645: FRANKSTON | C645: BINGLEY 7 | F645: WHITFIELD 4 | I645: MEEHAN 2 | L645: P MARTIN 2 | N645: O'BRIEN | P645: NIKAKIS | R645: SHIELDS
A646: PORT MELBOURNE | C646: COOPER 5 | F646: HICKS 3 | I646: BRADBURY | L646: CHRIMES
A648: COBURG | C648: 2 | D648: 5 | E648: 17 | G648: 4 | H648: 7 | I648: 31 | K648: 15 | L648: 9 | M648: 99 | O648: 20 | P648: 14 | Q648: 134 | S648: VENUE: COBURG
A649: SPRINGVALE | C649: 1 | D649: 1 | E649: 7 | G649: 5 | H649: 7 | I649: 37 | K649: 5 | L649: 11 | M649: 41 | O649: 8 | P649: 16 | Q649: 64 | S649: PRICE :WALKER
A650: BEST PLAYERS
A651: COBURG | C651: LITTLER | F651: SHELDON | I651: LAKEY | L651: RIENIETS | O651: EADE | Q651: DARBY
A652: SPRINGVALE | C652: WARD | F652: FOY | I652: WARNER | L652: NANFRA
A653: GOALKICKERS
A654: COBURG | C654: WILLIAMS 6 | F654: DARBY 3 | H654: WEATHERALD 3 | K654: NIMMO 3 | M654: BOURKE 2 | P654: EADE | R654: ALLISON | U654: LAKEY
A655: SPRINGVALE | C655: DWYER 2 | F655: VERNON | H655: ROBINSON | K655: ANDERSON | N655: MORGAN | P655: SAVAGE | R655: NANFRA
A657: PRESTON | C657: 2 | D657: 6 | E657: 18 | G657: 4 | H657: 6 | I657: 30 | K657: 8 | L657: 11 | M657: 59 | O657: 10 | P657: 11 | Q657: 71 | S657: VENUE: TOORAK PARK
A658: PRAHRAN | C658: 0 | D658: 1 | E658: 1 | G658: 2 | H658: 4 | I658: 16 | K658: 3 | L658: 4 | M658: 22 | O658: 3 | P658: 8 | Q658: 26 | S658: BRADY ;HOLT
A659: BEST PLAYERS
A660: PRESTON | C660: DUNBAR | F660: HALAS | I660: HUNT | K660: JACKSON | N660: MARCON | Q660: PLOWMAN
A661: PRAHRAN | C661: EVANS | F661: PAGE | I661: HERMANN
A662: GOALKICKERS
A663: PRESTON | C663: HALAS 5 | F663: SHAW 4 | I663: DINTINOSANTE
A664: PRAHRAN | C664: EVANS 2 | F664: FRANCIS
A666: ROUND 15 | D666: 31ST JULY | I666: WEATHER | S666: VENUE: BRUNSWICK
D667: 1ST QTR | H667: 2ND QTR | L667: 3RD QTR | P667: FINAL | S667: UMPIRES
A668: COBURG | C668: 3 | D668: 0 | E668: 18 | G668: 4 | H668: 3 | I668: 27 | K668: 7 | L668: 6 | M668: 48 | O668: 12 | P668: 8 | Q668: 80 | S668: BRADY | X668: LADDER | AB668: ROUND | AD668: 15
A669: BRUNSWICK | C669: 1 | D669: 2 | E669: 8 | G669: 1 | H669: 5 | I669: 11 | K669: 4 | L669: 8 | M669: 32 | O669: 8 | P669: 8 | Q669: 56 | S669: MARSHALL
A670: BEST PLAYERS | W670: TEAM | X670: W | Y670: L | Z670: D | AA670: FOR | AB670: AGST | AC670: % | AD670: PTS
A671: COBURG | C671: RIENIETS | F671: SHELDON | I671: LANGAN | L671: LAKEY | O671: ZANON | R671: HARBINSON
A672: BRUNSWICK | C672: CONNELL | F672: THOROGOOD | I672: LOVETT | L672: CALLANDER | O672: HARRINGTON | W672: COBURG | X672: 11 | Y672: 4 | Z672: 0 | AA672: 1770 | AB672: 1334 | AC672: =(AA672/AB672)*100 -> 132.68365817091455 | AD672: =(X672*4)+(Z672*2) -> 44
A673: GOALKICKERS | W673: PRESTON | X673: 10 | Y673: 5 | Z673: 0 | AA673: 1773 | AB673: 1454 | AC673: =(AA673/AB673)*100 -> 121.93947730398899 | AD673: =(X673*4)+(Z673*2) -> 40
A674: COBURG | C674: WILLIAMS 4 | F674: LANGAN 2 | I674: TULLOCH 2 | L674: KAAKOUR | N674: DARBY | P674: ZANON | R674: NIMMO | W674: PORT MELBOURNE | X674: 9 | Y674: 6 | Z674: 0 | AA674: 1756 | AB674: 1566 | AC674: =(AA674/AB674)*100 -> 112.13282247765007 | AD674: =(X674*4)+(Z674*2) -> 36
A675: BRUNSWICK | C675: HOLMES 2 | F675: WRIGHT | H675: CALLANDER | K675: McALLESTER | N675: GRIFFITH | P675: CLARKE | R675: SALVADORE | W675: WILLIAMSTOWN | X675: 8 | Y675: 7 | Z675: 0 | AA675: 1593 | AB675: 1423 | AC675: =(AA675/AB675)*100 -> 111.94659170765988 | AD675: =(X675*4)+(Z675*2) -> 32
S676: VENUE: BEACH ROAD
A677: WILLIAMSTOWN | C677: 5 | D677: 5 | E677: 35 | G677: 10 | H677: 10 | I677: 70 | K677: 13 | L677: 14 | M677: 92 | O677: 20 | P677: 20 | Q677: 140 | S677: CASEY | W677: SPRINGVALE | X677: 8 | Y677: 7 | Z677: 0 | AA677: 1375 | AB677: 1299 | AC677: =(AA677/AB677)*100 -> 105.85065434949961 | AD677: =(X677*4)+(Z677*2) -> 32
A678: SANDRINGHAM | C678: 4 | D678: 3 | E678: 27 | G678: 8 | H678: 5 | I678: 53 | K678: 13 | L678: 11 | M678: 89 | O678: 16 | P678: 14 | Q678: 110 | S678: VERGONA | W678: BOX HILL | X678: 8 | Y678: 7 | Z678: 0 | AA678: 1413 | AB678: 1611 | AC678: =(AA678/AB678)*100 -> 87.709497206703915 | AD678: =(X678*4)+(Z678*2) -> 32
A679: BEST PLAYERS | W679: BRUNSWICK | X679: 7 | Y679: 8 | Z679: 0 | AA679: 1364 | AB679: 1495 | AC679: =(AA679/AB679)*100 -> 91.237458193979933 | AD679: =(X679*4)+(Z679*2) -> 28
A680: WILLIAMSTOWN | C680: SMITH | F680: RICKMAN | I680: MURPHY | L680: ROUND | O680: CAHILL | R680: COOPER | W680: SANDRINGHAM | X680: 6 | Y680: 9 | Z680: 0 | AA680: 1531 | AB680: 1610 | AC680: =(AA680/AB680)*100 -> 95.093167701863351 | AD680: =(X680*4)+(Z680*2) -> 24
A681: SANDRINGHAM | C681: MERSON | F681: DOBSON | I681: SAID | L681: PHILBEY | O681: FITZGERALD | W681: FRANKSTON | X681: 4 | Y681: 11 | Z681: 0 | AA681: 1372 | AB681: 1675 | AC681: =(AA681/AB681)*100 -> 81.910447761194021 | AD681: =(X681*4)+(Z681*2) -> 16
A682: GOALKICKERS | R682: SMITH | W682: PRAHRAN | X682: 4 | Y682: 11 | Z682: 0 | AA682: 1176 | AB682: 1631 | AC682: =(AA682/AB682)*100 -> 72.103004291845494 | AD682: =(X682*4)+(Z682*2) -> 16
A683: WILLIAMSTOWN | C683: RICKMAN 5 | F683: DELRE 3 | H683: MORRISSEY 3 | K683: RAEBURN 2 | M683: TAYLOR 2 | O683: COOPER 2 | Q683: CAHILL | S683: NILSSEN
A684: SANDRINGHAM | C684: BENNETT 5 | F684: IRWIN 4 | H684: PHILBEY 3 | K684: J RUGOLO 2 | N684: ERWIN | P684: FITZGERALD
A686: PRESTON | C686: 5 | D686: 2 | E686: 32 | G686: 11 | H686: 7 | I686: 73 | K686: 15 | L686: 15 | M686: 105 | O686: 18 | P686: 20 | Q686: 128 | S686: VENUE: PRESTON
A687: PORT MELBOURNE | C687: 5 | D687: 3 | E687: 33 | G687: 8 | H687: 5 | I687: 53 | K687: 11 | L687: 6 | M687: 72 | O687: 12 | P687: 7 | Q687: 79 | S687: BLACK :WALKER
A688: BEST PLAYERS
A689: PRESTON | C689: DUNBAR | F689: HALAS | I689: SHAW | L689: WATT | N689: NICOLAOU | Q689: BROWN
A690: PORT MELBOURNE | C690: ALLENDER | F690: FOLEY | I690: COOTTEE | L690: DERMOTT
A691: GOALKICKERS
A692: PRESTON | C692: SHAW 7 | F692: HALAS 4 | I692: WATT 2 | K692: LUMICISI | M692: NICOLAOU | O692: DUNBAR | Q692: DINTINOSANTE | U692: VALKANIS
A693: PORT MELBOURNE | C693: HICKS 4 | F693: HARKINS 2 | I693: COOPER 2 | K693: FOLEY | M693: BRADBURY | P693: SMITH | R693: QUINN
A695: SPRINGVALE | C695: 5 | D695: 7 | E695: 37 | G695: 5 | H695: 8 | I695: 38 | K695: 11 | L695: 10 | M695: 76 | O695: 14 | P695: 11 | Q695: 95 | S695: VENUE: SPRINGVALE
A696: FRANKSTON | C696: 0 | D696: 2 | E696: 2 | G696: 2 | H696: 3 | I696: 15 | K696: 5 | L696: 4 | M696: 34 | O696: 11 | P696: 7 | Q696: 73 | S696: MORROW :HOLT
A697: BEST PLAYERS
A698: SPRINGVALE | C698: REECE | F698: FOY | I698: MALONI | L698: MENDE | O698: SAVAGE | Q698: MAYLIN
A699: FRANKSTON | C699: SARAU | F699: PAYNE | I699: AMOORE | L699: MARTIN | O699: ATKINS | Q699: FOYSTER
A700: GOALKICKERS
A701: SPRINGVALE | C701: SAVAGE 4 | F701: ROBINSON 3 | I701: VERNON 2 | K701: MENDE 2 | M701: JEFFS 2 | O701: DEMPSTER
A702: FRANKSTON | C702: WHITFIELD 4 | F702: BROWN 2 | I702: NIKAKIS 2 | K702: MEEHAN | M702: BINGLEY | O702: SHIELDS
A704: BOX HILL | C704: 2 | D704: 1 | E704: 13 | G704: 3 | H704: 2 | I704: 20 | K704: 7 | L704: 7 | M704: 49 | O704: 12 | P704: 11 | Q704: 83 | S704: VENUE: TOORAK PARK
A705: PRAHRAN | C705: 5 | D705: 1 | E705: 31 | G705: 5 | H705: 2 | I705: 32 | K705: 5 | L705: 4 | M705: 34 | O705: 5 | P705: 5 | Q705: 35 | S705: BROOKS :GLEESON
A706: BEST PLAYERS
A707: BOX HILL | C707: PEVITT | F707: GARTH | I707: HOCKING | L707: BOLTON | N707: TURNER | Q707: GLEESON
A708: PRAHRAN | C708: HAMILTON | F708: ELKINGTON | I708: KILEY | L708: EVANS | N708: SHERLOCK
A709: GOALKICKERS
A710: BOX HILL | C710: HOCKING 3 | F710: WOLFF 2 | H710: PRESTON 2 | J710: HOGAN | L710: BOLTON | N710: GLARE | P710: GERADTS | R710: MORRISON
A711: PRAHRAN | C711: EVANS 2 | F711: FRANCIS | H711: SOULOS | J711: KILEY
A713: ROUND 16 | D713: 7TH AUGUST | I713: WEATHER | S713: VENUE: FRANKSTON
D714: 1ST QTR | H714: 2ND QTR | L714: 3RD QTR | P714: FINAL | S714: UMPIRES
A715: FRANKSTON | C715: 1 | D715: 6 | E715: 12 | G715: 5 | H715: 8 | I715: 38 | K715: 10 | L715: 13 | M715: 73 | O715: 15 | P715: 18 | Q715: 108 | S715: BLACK | X715: LADDER | AB715: ROUND | AD715: 16
A716: BRUNSWICK | C716: 4 | D716: 1 | E716: 25 | G716: 7 | H716: 3 | I716: 45 | K716: 10 | L716: 7 | M716: 67 | O716: 13 | P716: 10 | Q716: 88 | S716: VERGONA
A717: BEST PLAYERS | W717: TEAM | X717: W | Y717: L | Z717: D | AA717: FOR | AB717: AGST | AC717: % | AD717: PTS
A718: FRANKSTON | C718: FOYSTER | F718: PAYNE | I718: SARAU | L718: SHIELDS | O718: MARTIN | Q718: O'BRIEN
A719: BRUNSWICK | C719: HERBERT | F719: LOVETT | I719: BERTOLLO | L719: CALLANDER | O719: BEALE | Q719: THOROGOOD | W719: COBURG | X719: 12 | Y719: 4 | Z719: 0 | AA719: 1892 | AB719: 1389 | AC719: =(AA719/AB719)*100 -> 136.21310295176386 | AD719: =(X719*4)+(Z719*2) -> 48
A720: GOALKICKERS | P720: P MARTIN | W720: PRESTON | X720: 11 | Y720: 5 | Z720: 0 | AA720: 1915 | AB720: 1548 | AC720: =(AA720/AB720)*100 -> 123.70801033591732 | AD720: =(X720*4)+(Z720*2) -> 44
A721: FRANKSTON | C721: GARDNER 2 | E721: PAYNE 2 | G721: BROWN 2 | I721: SHIELDS 2 | K721: FOYSTER 2 | M721: O;BRIEN | O721: AMOORE | Q721: WHITFIELD | S721: LANE | W721: WILLIAMSTOWN | X721: 9 | Y721: 7 | Z721: 0 | AA721: 1696 | AB721: 1465 | AC721: =(AA721/AB721)*100 -> 115.7679180887372 | AD721: =(X721*4)+(Z721*2) -> 36
A722: BRUNSWICK | C722: BEALE 4 | E722: CALLANDER 2 | H722: SALVADORE 2 | K722: BERTOLLO | M722: McALLESTER | P722: LEAHY | R722: HERBERT | W722: PORT MELBOURNE | X722: 9 | Y722: 7 | Z722: 0 | AA722: 1787 | AB722: 1612 | AC722: =(AA722/AB722)*100 -> 110.85607940446651 | AD722: =(X722*4)+(Z722*2) -> 36
O723: HARRINGTON | S723: VENUE: BOX HILL
A724: PRESTON | C724: 5 | D724: 2 | E724: 38 | G724: 10 | H724: 7 | I724: 67 | K724: 17 | L724: 12 | M724: 114 | O724: 21 | P724: 16 | Q724: 142 | S724: MARSHALL | W724: SPRINGVALE | X724: 9 | Y724: 7 | Z724: 0 | AA724: 1421 | AB724: 1330 | AC724: =(AA724/AB724)*100 -> 106.84210526315789 | AD724: =(X724*4)+(Z724*2) -> 36
A725: BOX HILL | C725: 4 | D725: 4 | E725: 28 | G725: 5 | H725: 5 | I725: 35 | K725: 7 | L725: 6 | M725: 48 | O725: 14 | P725: 10 | Q725: 94 | S725: HARVEY | W725: BOX HILL | X725: 8 | Y725: 8 | Z725: 0 | AA725: 1507 | AB725: 1753 | AC725: =(AA725/AB725)*100 -> 85.966913861950943 | AD725: =(X725*4)+(Z725*2) -> 32
A726: BEST PLAYERS | W726: BRUNSWICK | X726: 7 | Y726: 9 | Z726: 0 | AA726: 1452 | AB726: 1603 | AC726: =(AA726/AB726)*100 -> 90.580162195882721 | AD726: =(X726*4)+(Z726*2) -> 28
A727: PRESTON | C727: DUNBAR | F727: SHAW | I727: VALKANIS | L727: MARCON | N727: HALAS | Q727: BURROWS | W727: SANDRINGHAM | X727: 6 | Y727: 10 | Z727: 0 | AA727: 1586 | AB727: 1732 | AC727: =(AA727/AB727)*100 -> 91.570438799076214 | AD727: =(X727*4)+(Z727*2) -> 24
A728: BOX HILL | C728: HOCKING | F728: GERADTS | I728: BOLTON | L728: GLARE | N728: COLLINS | Q728: MORRISON | W728: FRANKSTON | X728: 5 | Y728: 11 | Z728: 0 | AA728: 1480 | AB728: 1763 | AC728: =(AA728/AB728)*100 -> 83.947816222348266 | AD728: =(X728*4)+(Z728*2) -> 20
A729: GOALKICKERS | W729: PRAHRAN | X729: 4 | Y729: 12 | Z729: 0 | AA729: 1218 | AB729: 1734 | AC729: =(AA729/AB729)*100 -> 70.242214532871969 | AD729: =(X729*4)+(Z729*2) -> 16
A730: PRESTON | C730: SHAW 12 | F730: NICOLAOU 4 | I730: WATT 2 | K730: BRINE 2 | M730: HUNT
A731: BOX HILL | C731: BOLTON 4 | E731: GARTH 2 | G731: HOGAN | I731: NICHOLSON | L731: BROWN | N731: WOLFF | P731: PRESTON | R731: ROBERTSON
A733: COBURG | C733: 8 | D733: 6 | E733: 54 | G733: 10 | H733: 11 | I733: 71 | K733: 15 | L733: 15 | M733: 105 | O733: 17 | P733: 20 | Q733: 122 | S733: VENUE: COBURG
A734: SANDRINGHAM | C734: 1 | D734: 1 | E734: 7 | G734: 3 | H734: 6 | I734: 24 | K734: 4 | L734: 9 | M734: 33 | O734: 7 | P734: 13 | Q734: 55 | S734: HOLT :MORROW
A735: BEST PLAYERS
A736: COBURG | C736: LITTLER | F736: WILLIAMS | I736: HOTCHKIN | L736: ANGWIN | O736: FREEMAN | R736: KAAKOUR
A737: SANDRINGHAM | C737: FITZGERALD | F737: F RUGOLO | I737: IRWIN | L737: PRATT | O737: DOBSON
A738: GOALKICKERS
A739: COBURG | C739: WILLIAMS 6 | F739: KAAKOUR 3 | I739: NIMMO 3 | K739: EADE 2 | M739: TULLOCH 2 | P739: RIENIETS
A740: SANDRINGHAM | C740: IRWIN 2 | F740: BRIAN SAID 2 | I740: FITZGERALD | L740: FRAANJE | N740: CARTY
A742: SPRINGVALE | C742: 2 | D742: 1 | E742: 13 | G742: 3 | H742: 5 | I742: 23 | K742: 5 | L742: 6 | M742: 36 | O742: 6 | P742: 10 | Q742: 46 | S742: VENUE: PORT MELBOURNE
A743: PORT MELBOURNE | C743: 2 | D743: 0 | E743: 12 | G743: 3 | H743: 0 | I743: 18 | K743: 5 | L743: 0 | M743: 30 | O743: 5 | P743: 1 | Q743: 31 | S743: CASEY :BRADY
A744: BEST PLAYERS
A745: SPRINGVALE | C745: MEADE | F745: REECE | I745: MALONI | L745: NANFRA | O745: DEMPSTER | R745: MAYLIN
A746: PORT MELBOURNE | C746: ALLENDER | F746: SMITH | I746: HETHERTON | L746: S HARKINS
A747: GOALKICKERS
A748: SPRINGVALE | C748: WARD 2 | F748: MENDE | H748: WARNER | K748: NANFRA | N748: QUINN
A749: PORT MELBOURNE | C749: COOPER 2 | F749: MCCORMACK | I749: BRADBURY | L749: HARKINS
A751: WILLIAMSTOWN | C751: 5 | D751: 5 | E751: 35 | G751: 7 | H751: 8 | I751: 50 | K751: 14 | L751: 11 | M751: 95 | O751: 15 | P751: 13 | Q751: 103 | S751: VENUE: WILLIAMSTOWN
A752: PRAHRAN | C752: 0 | D752: 2 | E752: 2 | G752: 3 | H752: 8 | I752: 26 | K752: 4 | L752: 9 | M752: 33 | O752: 4 | P752: 18 | Q752: 42 | S752: WALKER :PRICE
A753: BEST PLAYERS
A754: WILLIAMSTOWN | C754: MURPHY | F754: R DIMARTINO | I754: SMITH | L754: NILSSEN | N754: ROUND | Q754: CAHILL
A755: PRAHRAN | C755: WALFORD | F755: R PUTAMORSI | I755: HAMILTON | L755: EVANS | N755: McCARTY
A756: GOALKICKERS
A757: WILLIAMSTOWN | C757: CAHILL 2 | F757: McTAGGART 2 | I757: V DIMARTINO 2 | L757: NILSSEN 2 | N757: ROWSELL 2 | Q757: RICKMAN 2 | T757: ROUND | V757: KENNEDY | X757: MORRISSEY
A758: PRAHRAN | C758: HEWITSON 2 | F758: EVANS | H758: WHITE
A760: ROUND 17 | D760: 14TH AUGUST | I760: WEATHER | S760: VENUE: BRUNSWICK
D761: 1ST QTR | H761: 2ND QTR | L761: 3RD QTR | P761: FINAL | S761: UMPIRES
A762: BRUNSWICK | C762: 5 | D762: 2 | E762: 32 | G762: 8 | H762: 4 | I762: 52 | K762: 14 | L762: 6 | M762: 90 | O762: 16 | P762: 12 | Q762: 108 | S762: HARVEY | X762: LADDER | AB762: ROUND | AD762: 17
A763: PORT MELBOURNE | C763: 2 | D763: 2 | E763: 14 | G763: 9 | H763: 8 | I763: 62 | K763: 10 | L763: 13 | M763: 73 | O763: 12 | P763: 17 | Q763: 89 | S763: MARSHALL
A764: BEST PLAYERS | W764: TEAM | X764: W | Y764: L | Z764: D | AA764: FOR | AB764: AGST | AC764: % | AD764: PTS
A765: BRUNSWICK | C765: CALLANDER | F765: HYSLOP | I765: BERTOLLO | L765: HARRINGTON | O765: WRIGHT | Q765: LOVETT
A766: PORT MELBOURNE | C766: RAMSAY | F766: WALL | I766: ALLENDER | L766: HETHERTON | O766: HARKINS | W766: COBURG | X766: 12 | Y766: 5 | Z766: 0 | AA766: 1983 | AB766: 1482 | AC766: =(AA766/AB766)*100 -> 133.80566801619435 | AD766: =(X766*4)+(Z766*2) -> 48
A767: GOALKICKERS | N767: COOPER | W767: PRESTON | X767: 12 | Y767: 5 | Z767: 0 | AA767: 2010 | AB767: 1633 | AC767: =(AA767/AB767)*100 -> 123.08634415186772 | AD767: =(X767*4)+(Z767*2) -> 48
A768: BRUNSWICK | C768: HERBERT 4 | E768: McALLESTER 3 | H768: BERTOLLO 2 | J768: DAVIDSON 2 | M768: PERRY | O768: HYSLOP | Q768: CALLANDER | T768: BEALE | W768: WILLIAMSTOWN | X768: 10 | Y768: 7 | Z768: 0 | AA768: 1848 | AB768: 1503 | AC768: =(AA768/AB768)*100 -> 122.95409181636727 | AD768: =(X768*4)+(Z768*2) -> 40
A769: PORT MELBOURNE | C769: HICKS 4 | F769: McCORMACK 2 | I769: HARKINS 2 | K769: WHITZELL | M769: SCHOLL | O769: ALLENDER | Q769: COOPER | W769: PORT MELBOURNE | X769: 9 | Y769: 8 | Z769: 0 | AA769: 1876 | AB769: 1720 | AC769: =(AA769/AB769)*100 -> 109.06976744186045 | AD769: =(X769*4)+(Z769*2) -> 36
S770: VENUE: BOX HILL
A771: WILLIAMSTOWN | C771: 4 | D771: 2 | E771: 26 | G771: 14 | H771: 3 | I771: 87 | K771: 19 | L771: 5 | M771: 119 | O771: 24 | P771: 8 | Q771: 152 | S771: MORROW | W771: SPRINGVALE | X771: 9 | Y771: 8 | Z771: 0 | AA771: 1506 | AB771: 1425 | AC771: =(AA771/AB771)*100 -> 105.68421052631578 | AD771: =(X771*4)+(Z771*2) -> 36
A772: BOX HILL | C772: 2 | D772: 0 | E772: 12 | G772: 3 | H772: 0 | I772: 18 | K772: 5 | L772: 1 | M772: 31 | O772: 6 | P772: 2 | Q772: 38 | S772: CASEY | W772: BRUNSWICK | X772: 8 | Y772: 9 | Z772: 0 | AA772: 1560 | AB772: 1692 | AC772: =(AA772/AB772)*100 -> 92.198581560283685 | AD772: =(X772*4)+(Z772*2) -> 32
A773: BEST PLAYERS | W773: BOX HILL | X773: 8 | Y773: 9 | Z773: 0 | AA773: 1545 | AB773: 1905 | AC773: =(AA773/AB773)*100 -> 81.102362204724415 | AD773: =(X773*4)+(Z773*2) -> 32
A774: WILLIAMSTOWN | C774: PASTORE | F774: McTAGGART | I774: SMITH | L774: CAHILL | N774: RICKMAN | Q774: ROUND | W774: SANDRINGHAM | X774: 6 | Y774: 11 | Z774: 0 | AA774: 1693 | AB774: 1874 | AC774: =(AA774/AB774)*100 -> 90.341515474919959 | AD774: =(X774*4)+(Z774*2) -> 24
A775: BOX HILL | C775: GLARE | F775: MORRISON | W775: FRANKSTON | X775: 6 | Y775: 11 | Z775: 0 | AA775: 1622 | AB775: 1870 | AC775: =(AA775/AB775)*100 -> 86.737967914438514 | AD775: =(X775*4)+(Z775*2) -> 24
A776: GOALKICKERS | L776: R DIMARTINO | O776: ROWSELL | Q776: SMITH | W776: PRAHRAN | X776: 5 | Y776: 12 | Z776: 0 | AA776: 1311 | AB776: 1825 | AC776: =(AA776/AB776)*100 -> 71.835616438356169 | AD776: =(X776*4)+(Z776*2) -> 20
A777: WILLIAMSTOWN | C777: RICKMAN 7 | E777: ROUND 3 | G777: DELRE 3 | I777: CAHILL 2 | K777: V DIMARTINO 2 | N777: SIMMONS 2 | Q777: RAEBURN | S777: NILSSEN
A778: BOX HILL | C778: HOGAN | F778: NICHOLSON | I778: BOLTON | K778: HOCKING | M778: GLARE | O778: JEFFRIES
A780: FRANKSTON | C780: 8 | D780: 6 | E780: 54 | G780: 10 | H780: 7 | I780: 67 | K780: 16 | L780: 11 | M780: 107 | O780: 21 | P780: 16 | Q780: 142 | S780: VENUE: BEACH ROAD
A781: SANDRINGHAM | C781: 0 | D781: 2 | E781: 2 | G781: 7 | H781: 10 | I781: 52 | K781: 9 | L781: 13 | M781: 67 | O781: 15 | P781: 17 | Q781: 107 | S781: BROOKS :PRICE
A782: BEST PLAYERS
A783: FRANKSTON | C783: SARAU | E783: O'BRIEN | H783: FOYSTER | K783: S HAMILL | N783: GILBERT | Q783: AMOORE
A784: SANDRINGHAM | C784: IRWIN
A785: GOALKICKERS
A786: FRANKSTON | C786: BROWN 6 | E786: O'BRIEN 3 | G786: LANE 2 | I786: AMOORE 2 | L786: P MARTIN 2 | N786: SHIELDS 2 | Q786: GARDNER | S786: S HAMILL | W786: DUNBAR | X786: GILBERT
A787: SANDRINGHAM | C787: IRWIN 6 | F787: EAVES 3 | H787: J RUGOLO 2 | K787: McGANNON 2 | N787: FRAANJE | P787: BRIAN SAID
A789: PRESTON | C789: 1 | D789: 3 | E789: 9 | G789: 7 | H789: 5 | I789: 47 | K789: 11 | L789: 7 | M789: 73 | O789: 14 | P789: 11 | Q789: 95 | S789: VENUE: PRESTON
A790: SPRINGVALE | C790: 4 | D790: 7 | E790: 31 | G790: 6 | H790: 9 | I790: 45 | K790: 10 | L790: 14 | M790: 74 | O790: 11 | P790: 19 | Q790: 85 | S790: VERGONA :WALKER
A791: BEST PLAYERS
A792: PRESTON | C792: HALAS | F792: WATT | I792: BURROWS | L792: BRINE | N792: HUNT | Q792: DUNBAR
A793: SPRINGVALE | C793: MEADE | F793: WARD | I793: DEMPSTER | L793: FOY | N793: KING
A794: GOALKICKERS
A795: PRESTON | C795: NICOLAOU 3 | F795: DUNBAR 3 | I795: LUMICISI 2 | K795: HALAS 2 | M795: SENNO | O795: SHAW | Q795: BRINE | S795: WATT
A796: SPRINGVALE | C796: ROBINSON 3 | F796: WARD 2 | H796: MORGAN 2 | K796: VERNON | M796: DEMPSTER | P796: SHANNON | R796: FOY
A798: PRAHRAN | C798: 3 | D798: 7 | E798: 25 | G798: 7 | H798: 8 | I798: 50 | K798: 11 | L798: 14 | M798: 80 | O798: 13 | P798: 15 | Q798: 93 | S798: VENUE: TOORAK PARK
A799: COBURG | C799: 1 | D799: 3 | E799: 9 | G799: 5 | H799: 7 | I799: 37 | K799: 8 | L799: 10 | M799: 58 | O799: 13 | P799: 13 | Q799: 91 | S799: HOLT :BRADY
A800: BEST PLAYERS
A801: PRAHRAN | C801: MCCARTY | F801: WALKER | I801: EVANS | L801: JACKSON | O801: ELLETT | Q801: KILEY
A802: COBURG | C802: HOTCHKIN | F802: FREEMAN | I802: RIENIETS | L802: HARBINSON
A803: GOALKICKERS
A804: PRAHRAN | C804: SOULOS 3 | F804: P GILES 3 | I804: KILEY 2 | K804: EVANS 2 | M804: HUTCHINSON | P804: WALKER | R804: G GILES
A805: COBURG | C805: WILLIAMS 3 | F805: FREEMAN 3 | I805: LAIDLER 3 | K805: EVANS | M805: ZANON | O805: LAKEY
A807: ROUND 18 | D807: 21ST AUGUST | I807: WEATHER | S807: VENUE: SPRINGVALE
D808: 1ST QTR | H808: 2ND QTR | L808: 3RD QTR | P808: FINAL | S808: UMPIRES
A809: SPRINGVALE | C809: 2 | D809: 3 | E809: 15 | G809: 2 | H809: 7 | I809: 19 | K809: 5 | L809: 10 | M809: 40 | O809: 6 | P809: 14 | Q809: 50 | S809: G CASEY | X809: LADDER | AB809: ROUND | AD809: 18
A810: BRUNSWICK | C810: 1 | D810: 2 | E810: 8 | G810: 3 | H810: 4 | I810: 22 | K810: 3 | L810: 4 | M810: 22 | O810: 3 | P810: 4 | Q810: 22 | S810: MORROW
A811: BEST PLAYERS | W811: TEAM | X811: W | Y811: L | Z811: D | AA811: FOR | AB811: AGST | AC811: % | AD811: PTS
A812: SPRINGVALE | C812: MAYLIN | F812: DEMPSTER | I812: FOY | L812: MORGAN | O812: MCCORMACK | R812: JEFFS
A813: BRUNSWICK | C813: CONNELL | F813: WRIGHT | I813: CLARKE | L813: LEAHY | O813: THOROGOOD | R813: HERBERT | W813: COBURG | X813: 13 | Y813: 5 | Z813: 0 | AA813: 2092 | AB813: 1553 | AC813: =(AA813/AB813)*100 -> 134.70701867353509 | AD813: =(X813*4)+(Z813*2) -> 52
A814: GOALKICKERS | W814: PRESTON | X814: 12 | Y814: 6 | Z814: 0 | AA814: 2114 | AB814: 1765 | AC814: =(AA814/AB814)*100 -> 119.77337110481588 | AD814: =(X814*4)+(Z814*2) -> 48
A815: SPRINGVALE | C815: ROBINSON 2 | F815: VERNON | H815: PROSSER | J815: DEMPSTER | M815: MORGAN | W815: WILLIAMSTOWN | X815: 11 | Y815: 7 | Z815: 0 | AA815: 1980 | AB815: 1607 | AC815: =(AA815/AB815)*100 -> 123.21095208462975 | AD815: =(X815*4)+(Z815*2) -> 44
A816: BRUNSWICK | C816: BERTOLLO 2 | F816: HERBERT | W816: PORT MELBOURNE | X816: 10 | Y816: 8 | Z816: 0 | AA816: 2056 | AB816: 1818 | AC816: =(AA816/AB816)*100 -> 113.0913091309131 | AD816: =(X816*4)+(Z816*2) -> 40
S817: VENUE: WILLIAMSTOWN
A818: WILLIAMSTOWN | C818: 8 | D818: 4 | E818: 52 | G818: 9 | H818: 6 | I818: 60 | K818: 12 | L818: 11 | M818: 83 | O818: 19 | P818: 18 | Q818: 132 | S818: MARSHALL | W818: SPRINGVALE | X818: 10 | Y818: 8 | Z818: 0 | AA818: 1556 | AB818: 1447 | AC818: =(AA818/AB818)*100 -> 107.53282653766414 | AD818: =(X818*4)+(Z818*2) -> 40
A819: PRESTON | C819: 4 | D819: 2 | E819: 26 | G819: 6 | H819: 9 | I819: 45 | K819: 13 | L819: 11 | M819: 89 | O819: 15 | P819: 14 | Q819: 104 | S819: HARVEY | W819: BRUNSWICK | X819: 8 | Y819: 10 | Z819: 0 | AA819: 1582 | AB819: 1742 | AC819: =(AA819/AB819)*100 -> 90.815154994259473 | AD819: =(X819*4)+(Z819*2) -> 32
A820: BEST PLAYERS | W820: BOX HILL | X820: 8 | Y820: 10 | Z820: 0 | AA820: 1616 | AB820: 2014 | AC820: =(AA820/AB820)*100 -> 80.238331678252237 | AD820: =(X820*4)+(Z820*2) -> 32
A821: WILLIAMSTOWN | C821: RICKMAN | F821: RAEBURN | I821: DELRE | L821: TAYLOR | O821: ROUND | Q821: KERSHAW | W821: FRANKSTON | X821: 7 | Y821: 11 | Z821: 0 | AA821: 1721 | AB821: 1909 | AC821: =(AA821/AB821)*100 -> 90.151911995809314 | AD821: =(X821*4)+(Z821*2) -> 28
A822: PRESTON | C822: HALAS | F822: SHAW | I822: ANDERSON | L822: HUNT | O822: WATT | W822: SANDRINGHAM | X822: 6 | Y822: 12 | Z822: 0 | AA822: 1791 | AB822: 2054 | AC822: =(AA822/AB822)*100 -> 87.195715676728341 | AD822: =(X822*4)+(Z822*2) -> 24
A823: GOALKICKERS | W823: PRAHRAN | X823: 5 | Y823: 13 | Z823: 0 | AA823: 1350 | AB823: 1924 | AC823: =(AA823/AB823)*100 -> 70.166320166320162 | AD823: =(X823*4)+(Z823*2) -> 20
A824: WILLIAMSTOWN | C824: RICKMAN 6 | F824: ROUND 3 | H824: V DIMARTINO 3 | K824: CAHILL 2 | M824: SMITH 2 | O824: RAEBURN | Q824: TAYLOR | S824: PASTORE
A825: PRESTON | C825: SHAW 9 | F825: LUMICISI 2 | I825: SENNO 2 | L825: HALAS | N825: DUNBAR
A827: FRANKSTON | C827: 3 | D827: 9 | E827: 27 | G827: 7 | H827: 15 | I827: 57 | K827: 9 | L827: 19 | M827: 73 | O827: 13 | P827: 21 | Q827: 99 | S827: VENUE: FRANKSTON
A828: PRAHRAN | C828: 2 | D828: 1 | E828: 13 | G828: 3 | H828: 1 | I828: 19 | K828: 5 | L828: 4 | M828: 34 | O828: 5 | P828: 9 | Q828: 39 | S828: BLACK :BRADY
A829: BEST PLAYERS
A830: FRANKSTON | C830: FOYSTER | F830: ATKINS | I830: SARAU | L830: LANE | N830: BRENNAN | Q830: NIKAKIS
A831: PRAHRAN | C831: McCARTY | F831: WHITE | I831: HUTCHISON
A832: GOALKICKERS
A833: FRANKSTON | C833: SHIELDS 4 | F833: P MARTIN 2 | I833: DUNBAR 2 | L833: LANE | N833: S HAMILL | Q833: O'BRIEN | S833: PAYNE | U833: BROWN
A834: PRAHRAN | C834: SOULOS 2 | F834: EVANS 2 | I834: KANE
A836: PORT MELBOURNE | C836: 8 | D836: 2 | E836: 50 | G836: 14 | H836: 7 | I836: 91 | K836: 21 | L836: 11 | M836: 137 | O836: 27 | P836: 18 | Q836: 180 | S836: VENUE: PORT MELBOURNE
A837: SANDRINGHAM | C837: 4 | D837: 2 | E837: 26 | G837: 7 | H837: 4 | I837: 46 | K837: 10 | L837: 6 | M837: 66 | O837: 15 | P837: 8 | Q837: 98 | S837: VERGONA :WALKER
A838: BEST PLAYERS
A839: PORT MELBOURNE | C839: FOLEY | F839: WHITZELL | I839: HICKS | L839: SWAN | O839: BRADBURY | R839: STROOPER
A840: SANDRINGHAM | C840: BONNEY | F840: IRWIN | I840: FITZPATRICK | L840: B McGANNON | O840: FRAANJE | R840: G McGANNON
A841: GOALKICKERS
A842: PORT MELBOURNE | C842: HICKS 8 | F842: WHITZELL 6 | I842: HETHERTON 3 | L842: FOLEY 3 | N842: HARKINS 3 | Q842: SMITH 2 | S842: BRADBURY | V842: RODDA
A843: SANDRINGHAM | C843: BENNETT 6 | F843: IRWIN 2 | H843: B McGANNON 2 | K843: EAVES | M843: BERGMAN | O843: WEST | Q843: BRIAN SAID | T843: DOBSON
A845: COBURG | C845: 4 | D845: 8 | E845: 32 | G845: 7 | H845: 13 | I845: 55 | K845: 12 | L845: 19 | M845: 91 | O845: 14 | P845: 25 | Q845: 109 | S845: VENUE: COBURG
A846: BOX HILL | C846: 0 | D846: 5 | E846: 5 | G846: 5 | H846: 8 | I846: 38 | K846: 6 | L846: 9 | M846: 45 | O846: 10 | P846: 11 | Q846: 71 | S846: PRICE :GLEESON
A847: BEST PLAYERS
A848: COBURG | C848: RIENIETS | F848: LANGAN | I848: RACOVOLIS | L848: REYNOLDSON | O848: EADE | Q848: INGRAM
A849: BOX HILL | C849: O'BRIEN | F849: BANFIELD | I849: JEFFRIES | L849: BOLTON | O849: HOCKING | Q849: GARTH
A850: GOALKICKERS
A851: COBURG | C851: EADE 4 | F851: WILLIAMS 4 | I851: WEATHERALD 3 | L851: RIENIETS 2 | O851: REYNOLDSON
A852: BOX HILL | C852: BOLTON 3 | F852: GARTH 2 | I852: NICHOLSON | L852: GLARE | N852: DONOGHUE | Q852: JEFFREIES | S852: HOCKING
A854: FINALS
A855: 1ST SEMI | D855: 27TH AUGUST | I855: WEATHER
D856: 1ST QTR | H856: 2ND QTR | L856: 3RD QTR | P856: FINAL | S856: VENUE: PORT MELBOURNE
A857: WILLIAMSTOWN | C857: 5 | D857: 0 | E857: 30 | G857: 8 | H857: 1 | I857: 49 | K857: 15 | L857: 6 | M857: 96 | O857: 24 | P857: 15 | Q857: 159 | S857: UMPIRES
A858: PORT MELBOURNE | C858: 7 | D858: 8 | E858: 50 | G858: 9 | H858: 16 | I858: 70 | K858: 13 | L858: 21 | M858: 99 | O858: 14 | P858: 24 | Q858: 108 | S858: HARVEY ;MARSHALL
A859: BEST PLAYERS
A860: WILLIAMSTOWN | C860: SMITH | F860: RICKMAN | I860: SLEVISON | L860: MURPHY | O860: ROUND | R860: DELRE
A861: PORT MELBOURNE | C861: RAINSFORD | F861: HETHERTON | I861: HARKINS | L861: STROOPER | O861: BRADBURY | R861: HICKS
A862: GOALKICKERS
A863: WILLIAMSTOWN | C863: RICKMAN 9 | F863: V DIMARTINO 3 | I863: DELRE 3 | K863: SMITH 3 | M863: CAHILL 2 | O863: SLEVISON 2 | Q863: NILSSEN | S863: RUSSELL
A864: PORT MELBOURNE | C864: HETHERTON 5 | F864: HICKS 4 | H864: RAMSAY 2 | K864: HARKINS 2 | N864: BRADBURY
A866: 2ND SEMI | D866: 3RD SEPTEMBER | I866: WEATHER
A867: COBURG | C867: 7 | D867: 2 | E867: 44 | G867: 13 | H867: 5 | I867: 83 | K867: 19 | L867: 10 | M867: 124 | O867: 22 | P867: 14 | Q867: 146 | S867: VENUE: PORT MELBOURNE
A868: PRESTON | C868: 0 | D868: 1 | E868: 1 | G868: 2 | H868: 5 | I868: 17 | K868: 4 | L868: 9 | M868: 33 | O868: 7 | P868: 11 | Q868: 53 | S868: VERGONA ;WALKER
A869: BEST PLAYERS
A870: COBURG | C870: WEIDEMAN | F870: RIENIETS | I870: ANGWIN | L870: REYNOLDSON | O870: LITTLER | Q870: ALLISON
A871: PRESTON | C871: MARCON | F871: HALAS | I871: JACKSON | L871: DUNBAR
A872: GOALKICKERS
A873: COBURG | C873: WILLIAMS 6 | F873: WEATHERALD 6 | J873: KAAKOUR 2 | M873: ALLISON 2 | P873: RIENIETS 2 | R873: LANGAN 2 | U873: REYNOLDSON | X873: BOURKE
A874: PRESTON | C874: SHAW 3 | F874: HALAS 2 | I874: BRINE 2
A876: PRELIMINARY FINAL | E876: 10TH SEPTEMBER
A877: WILLIAMSTOWN | C877: 0 | D877: 6 | E877: 6 | G877: 9 | H877: 9 | I877: 63 | K877: 13 | L877: 13 | M877: 91 | O877: 18 | P877: 17 | Q877: 125 | S877: VENUE: PORT MELBOURNE
A878: PRESTON | C878: 3 | D878: 3 | E878: 21 | G878: 4 | H878: 6 | I878: 30 | K878: 8 | L878: 7 | M878: 55 | O878: 11 | P878: 9 | Q878: 75 | S878: MORROW :G CASEY
A879: BEST PLAYERS
A880: WILLIAMSTOWN | C880: MURPHY | F880: KERSHAW | I880: RAEBURN | L880: CAHILL | O880: ROUND | Q880: R DIMARTINO
A881: PRESTON | C881: BRINE | F881: JORDAN | I881: MARCON | L881: PRITCHARD | O881: WATT | Q881: PLOWMAN
A882: GOALKICKERS
A883: WILLIAMSTOWN | C883: ROUND 6 | F883: CAHILL 4 | I883: TAYLOR 2 | K883: RICKMAN 2 | N883: RAEBURN | Q883: MURPHY | S883: PASTORE | V883: SMITH
A884: PRESTON | C884: SHAW 3 | F884: JORDAN 2 | I884: LAWSON 2 | L884: DINTINOSANTE 2 | P884: HALAS | R884: WATT
A886: GRAND FINAL | D886: 18TH SEPTEMBER
A887: COBURG | C887: 6 | D887: 3 | E887: 39 | G887: 7 | H887: 9 | I887: 51 | K887: 14 | L887: 15 | M887: 99 | O887: 16 | P887: 18 | Q887: 114 | S887: VENUE: WINDY HILL
A888: WILLIAMSTOWN | C888: 3 | D888: 5 | E888: 23 | G888: 6 | H888: 7 | I888: 43 | K888: 7 | L888: 10 | M888: 52 | O888: 12 | P888: 15 | Q888: 87 | S888: HARVEY :WALKER
A889: BEST PLAYERS
A890: COBURG | C890: RIENIETS | F890: WEIDEMAN | I890: ALLISON | L890: NIMMO | O890: RACOVOLIS | R890: SHELDON
A891: WILLIAMSTOWN | C891: WHEELER | F891: CAHILL | I891: RICKMAN | L891: McTAGGART | O891: MURPHY
A892: GOALKICKERS
A893: COBURG | C893: REYNOLDSON 3 | F893: RACOVOLIS 3 | I893: WEATHERALD 3 | L893: RIENIETS 3 | O893: WILLIAMS | Q893: TARANTO | S893: ANGWIN | V893: ALLISON
A894: WILLIAMSTOWN | C894: RICKMAN 3 | F894: CAHILL 2 | I894: ROUND | K894: RAEBURN | M894: KENNEDY | O894: V DIMARTINO | R894: NILSSEN | U894: ROWSELL | X894: KERSHAW
A896: REP MATCH
A897: TASMANIA | C897: 2 | D897: 3 | E897: 15 | G897: 5 | H897: 5 | I897: 35 | K897: 8 | L897: 9 | M897: 57 | O897: 11 | P897: 12 | Q897: 78
A898: V.F.A. | C898: 2 | D898: 1 | E898: 13 | G898: 2 | H898: 10 | I898: 22 | K898: 5 | L898: 12 | M898: 42 | O898: 7 | P898: 16 | Q898: 58
A899: BEST PLAYERS
A900: TASMANIA | C900: CHRISTENSEN | F900: DELL | I900: WADE | L900: WILLIAMSON | O900: PATON | R900: MATTHEWSON
A901: V.F.A. | C901: VERNON | F901: McTAGGART | I901: MARCON | L901: McALLESTER | O901: BRADBURY | R901: ALLENDER
A902: GOALKICKERS
A903: TASMANIA | C903: REYNOLDS 4 | F903: KREMERSKOTHAN 3 | J903: WILLIAMSON 2 | M903: CODE | O903: PERRY
A904: V.F.A. | C904: K ROBINSON 2 | F904: VERNON 2 | I904: ROUND | K904: WRIGHT | M904: PASTORE