A1: Victorian Football Association
A2: Season 1988 - Division Two
A3: © Copyright Wal Williams | F3: First created: 28 March 2016
A4: Contact: joywalwi at gmail dot com | F4: Last updated: 28 March 2016 | W4: VFA Results and tables - Link to the main index page
A5: You are free to copy this document in whole or part provided that proper acknowledgement is given to the author. All rights reserved.
A7: 1988 | D7: 2ND DIVISION
A8: ROUND 1 | E8: 10TH APRIL | I8: WEATHER | S8: PLAYED AT
D9: 1ST QTR | H9: 2ND QTR | L9: 3RD QTR | P9: FINAL | S9: WERRIBEE
A10: SUNSHINE | C10: 5 | D10: 3 | E10: =C10*6+D10 -> 33 | G10: 7 | H10: 9 | I10: =G10*6+H10 -> 51 | K10: 10 | L10: 12 | M10: =K10*6+L10 -> 72 | O10: 14 | P10: 14 | Q10: =O10*6+P10 -> 98 | S10: UMPIRE | X10: LADDER | AB10: ROUND | AD10: 1
A11: WERRIBEE | C11: 3 | D11: 5 | E11: =C11*6+D11 -> 23 | G11: 6 | H11: 9 | I11: =G11*6+H11 -> 45 | K11: 8 | L11: 13 | M11: =K11*6+L11 -> 61 | O11: 10 | P11: 15 | Q11: =O11*6+P11 -> 75 | S11: BROOKS/CARUSO
A12: BEST PLAYERS | W12: TEAM | X12: W | Y12: L | Z12: D | AA12: FOR | AB12: AGST | AC12: % | AD12: PTS
A13: SUNSHINE | C13: GLEESON | F13: LAWLER | I13: BEERS | L13: JOHNSON | O13: WRIGHT | R13: MITROVSKI
A14: WERRIBEE | C14: S MOLONEY | F14: HITCH | I14: BONAT | L14: SMITH | O14: GUDDE | R14: WALPOLE | W14: CAMBERWELL | X14: 1 | Y14: 0 | Z14: 0 | AA14: 188 | AB14: 104 | AC14: =(AA14*100)/AB14 -> 180.76923076923077 | AD14: =(X14*4)+(Z14*2) -> 4
A15: GOALKICKERS | W15: OAKLEIGH | X15: 1 | Y15: 0 | Z15: 0 | AA15: 132 | AB15: 91 | AC15: =(AA15*100)/AB15 -> 145.05494505494505 | AD15: =(X15*4)+(Z15*2) -> 4
A16: SUNSHINE | C16: LITCHFIELD 3 | F16: WALLIS 3 | H16: McQUALTER 3 | K16: EDWARDS 2 | M16: JOHNSON | O16: MITROVSKI | R16: PROTETTO | W16: SUNSHINE | X16: 1 | Y16: 0 | Z16: 0 | AA16: 98 | AB16: 75 | AC16: =(AA16*100)/AB16 -> 130.66666666666666 | AD16: =(X16*4)+(Z16*2) -> 4
A17: WERRIBEE | C17: TAYLOR 2 | F17: SMITH | H17: BONAT | J17: B MOLONEY | M17: HITCH | O17: BROWN | Q17: SELLS | R17: GREY | S17: MONTGOMERY | W17: WERRIBEE | X17: 0 | Y17: 1 | Z17: 0 | AA17: 75 | AB17: 98 | AC17: =(AA17*100)/AB17 -> 76.530612244897952 | AD17: =(X17*4)+(Z17*2) -> 0
A19: CAMBERWELL | C19: 5 | D19: 2 | E19: =C19*6+D19 -> 32 | G19: 9 | H19: 5 | I19: =G19*6+H19 -> 59 | K19: 17 | L19: 11 | M19: =K19*6+L19 -> 113 | O19: 29 | P19: 14 | Q19: =O19*6+P19 -> 188 | S19: DANDENONG | W19: GEELONG WEST | X19: 0 | Y19: 1 | Z19: 0 | AA19: 91 | AB19: 132 | AC19: =(AA19*100)/AB19 -> 68.939393939393938 | AD19: =(X19*4)+(Z19*2) -> 0
A20: DANDENONG | C20: 4 | D20: 7 | E20: =C20*6+D20 -> 31 | G20: 11 | H20: 11 | I20: =G20*6+H20 -> 77 | K20: 12 | L20: 17 | M20: =K20*6+L20 -> 89 | O20: 14 | P20: 20 | Q20: =O20*6+P20 -> 104 | S20: BULLOCK/DUNNE | W20: DANDENONG | X20: 0 | Y20: 1 | Z20: 0 | AA20: 104 | AB20: 188 | AC20: =(AA20*100)/AB20 -> 55.319148936170215 | AD20: =(X20*4)+(Z20*2) -> 0
A21: BEST PLAYERS
A22: CAMBERWELL | C22: GRAY | E22: GIBBS | G22: DIPIERDOMENICO | K22: MODICA | N22: GEURTS | Q22: BUDGE
A23: DANDENONG | C23: KAYE | E23: PALLANT | G23: MERRIGAN | K23: ARGOON | N23: HICKEY | Q23: HALL
A24: GOALKICKERS
A25: CAMBERWELL | C25: MODICA 8 | F25: KINK 7 | H25: SPASSOPOULOS 6 | K25: WHALEN 2 | N25: T VITACCA | P25: GREIG | R25: JAKOBI | T25: GRAY | V25: FREW | X25: BUDGE
A26: DANDENONG | C26: HALL 3 | E26: WRIGHT 3 | H26: HICKEY 2 | J26: ARGOON 2 | M26: D'ARCY 2 | O26: BRUNNEN | Q26: PALLANT
A28: OAKLEIGH | C28: 6 | D28: 3 | E28: =C28*6+D28 -> 39 | G28: 10 | H28: 9 | I28: =G28*6+H28 -> 69 | K28: 14 | L28: 10 | M28: =K28*6+L28 -> 94 | O28: 19 | P28: 18 | Q28: =O28*6+P28 -> 132 | S28: GEELONG WEST
A29: GEELONG WEST | C29: 3 | D29: 5 | E29: =C29*6+D29 -> 23 | G29: 5 | H29: 12 | I29: =G29*6+H29 -> 42 | K29: 9 | L29: 16 | M29: =K29*6+L29 -> 70 | O29: 12 | P29: 19 | Q29: =O29*6+P29 -> 91 | S29: RIDDIFORD/McDONALD
A30: BEST PLAYERS
A31: OAKLEIGH | C31: BATTERSBY | F31: ANSELL | I31: OWEN | L31: ROURKE | O31: MARSHALL | R31: PRETTO
A32: GEELONG WEST | C32: MITCHELL | F32: JEFFERIES | I32: FAZIO | L32: MALARKY | O32: RISELY | R32: WATT
A33: GOALKICKERS
A34: OAKLEIGH | C34: PRETTO 9 | F34: VERBEEK 3 | I34: OWEN 3 | K34: HOWE 2 | M34: MESLEY | O34: BROOKS
A35: GEELONG WEST | C35: MALARKY 5 | F35: JEFFERIES 4 | I35: COOK | K35: WATT | M35: RISELEY
A37: ROUND 2 | E37: 17TH APRIL | I37: WEATHER | S37: PLAYED AT
D38: 1ST QTR | H38: 2ND QTR | L38: 3RD QTR | P38: FINAL | S38: CAMBERWELL
A39: CAMBERWELL | C39: 10 | D39: 8 | E39: =C39*6+D39 -> 68 | G39: 15 | H39: 9 | I39: =G39*6+H39 -> 99 | K39: 20 | L39: 12 | M39: =K39*6+L39 -> 132 | O39: 27 | P39: 15 | Q39: =O39*6+P39 -> 177 | S39: UMPIRE | X39: LADDER | AB39: ROUND | AD39: 2
A40: GEELONG WEST | C40: 5 | D40: 2 | E40: =C40*6+D40 -> 32 | G40: 7 | H40: 7 | I40: =G40*6+H40 -> 49 | K40: 16 | L40: 10 | M40: =K40*6+L40 -> 106 | O40: 24 | P40: 15 | Q40: =O40*6+P40 -> 159
A41: BEST PLAYERS | W41: TEAM | X41: W | Y41: L | Z41: D | AA41: FOR | AB41: AGST | AC41: % | AD41: PTS
A42: CAMBERWELL
A43: GEELONG WEST | W43: CAMBERWELL | X43: 2 | Y43: 0 | Z43: 0 | AA43: 365 | AB43: 263 | AC43: =(AA43*100)/AB43 -> 138.7832699619772 | AD43: =(X43*4)+(Z43*2) -> 8
A44: GOALKICKERS | W44: OAKLEIGH | X44: 2 | Y44: 0 | Z44: 0 | AA44: 276 | AB44: 220 | AC44: =(AA44*100)/AB44 -> 125.45454545454545 | AD44: =(X44*4)+(Z44*2) -> 8
A45: CAMBERWELL | W45: SUNSHINE | X45: 1 | Y45: 0 | Z45: 0 | AA45: 98 | AB45: 75 | AC45: =(AA45*100)/AB45 -> 130.66666666666666 | AD45: =(X45*4)+(Z45*2) -> 4
A46: GEELONG WEST | W46: WERRIBEE | X46: 0 | Y46: 2 | Z46: 0 | AA46: 204 | AB46: 242 | AC46: =(AA46*100)/AB46 -> 84.297520661157023 | AD46: =(X46*4)+(Z46*2) -> 0
A48: OAKLEIGH | C48: 5 | D48: 8 | E48: =C48*6+D48 -> 38 | G48: 11 | H48: 9 | I48: =G48*6+H48 -> 75 | K48: 14 | L48: 20 | M48: =K48*6+L48 -> 104 | O48: 20 | P48: 24 | Q48: =O48*6+P48 -> 144 | S48: OAKLEIGH | W48: GEELONG WEST | X48: 0 | Y48: 2 | Z48: 0 | AA48: 250 | AB48: 309 | AC48: =(AA48*100)/AB48 -> 80.906148867313917 | AD48: =(X48*4)+(Z48*2) -> 0
A49: WERRIBEE | C49: 4 | D49: 1 | E49: =C49*6+D49 -> 25 | G49: 11 | H49: 6 | I49: =G49*6+H49 -> 72 | K49: 15 | L49: 11 | M49: =K49*6+L49 -> 101 | O49: 19 | P49: 15 | Q49: =O49*6+P49 -> 129 | W49: DANDENONG | X49: 0 | Y49: 1 | Z49: 0 | AA49: 104 | AB49: 188 | AC49: =(AA49*100)/AB49 -> 55.319148936170215 | AD49: =(X49*4)+(Z49*2) -> 0
A50: BEST PLAYERS
A51: OAKLEIGH
A52: WERRIBEE
A53: GOALKICKERS
A54: OAKLEIGH
A55: WERRIBEE
E57: =C57*6+D57 -> 0 | I57: =G57*6+H57 -> 0 | M57: =K57*6+L57 -> 0 | O57: 0 | P57: 0 | Q57: =O57*6+P57 -> 0 | S57: PRESTON
E58: =C58*6+D58 -> 0 | I58: =G58*6+H58 -> 0 | M58: =K58*6+L58 -> 0 | O58: 0 | P58: 0 | Q58: =O58*6+P58 -> 0
A59: BEST PLAYERS
A62: GOALKICKERS
A66: ROUND 3 | E66: 24TH APRIL | I66: WEATHER | S66: PLAYED AT
D67: 1ST QTR | H67: 2ND QTR | L67: 3RD QTR | P67: FINAL | S67: WERRIBEE
A68: GEELONG WEST | C68: 5 | D68: 3 | E68: =C68*6+D68 -> 33 | G68: 9 | H68: 4 | I68: =G68*6+H68 -> 58 | K68: 12 | L68: 9 | M68: =K68*6+L68 -> 81 | O68: 22 | P68: 10 | Q68: =O68*6+P68 -> 142 | S68: UMPIRE | X68: LADDER | AB68: ROUND | AD68: 3
A69: WERRIBEE | C69: 2 | D69: 2 | E69: =C69*6+D69 -> 14 | G69: 8 | H69: 7 | I69: =G69*6+H69 -> 55 | K69: 10 | L69: 9 | M69: =K69*6+L69 -> 69 | O69: 16 | P69: 13 | Q69: =O69*6+P69 -> 109 | S69: S McDONALD/RIDDIFORD
A70: BEST PLAYERS | W70: TEAM | X70: W | Y70: L | Z70: D | AA70: FOR | AB70: AGST | AC70: % | AD70: PTS
A71: GEELONG WEST | C71: FAZIO | F71: BERRY | H71: WATT | K71: MACHAR | O71: DILLON | R71: YATES
A72: WERRIBEE | C72: SELLS | F72: GREY | H72: MONTGOMERY | K72: S MOLONEY | W72: CAMBERWELL | X72: 3 | Y72: 0 | Z72: 0 | AA72: 511 | AB72: 327 | AC72: =(AA72*100)/AB72 -> 156.2691131498471 | AD72: =(X72*4)+(Z72*2) -> 12
A73: GOALKICKERS | W73: OAKLEIGH | X73: 2 | Y73: 0 | Z73: 0 | AA73: 276 | AB73: 220 | AC73: =(AA73*100)/AB73 -> 125.45454545454545 | AD73: =(X73*4)+(Z73*2) -> 8
A74: GEELONG WEST | C74: MALARKY 5 | F74: MITCHELL 5 | I74: MORRISSEY 5 | L74: BERRY 2 | N74: FRASER 2 | P74: REDHEAD | R74: KOL | S74: THIELE | W74: GEELONG WEST | X74: 1 | Y74: 2 | Z74: 0 | AA74: 392 | AB74: 418 | AC74: =(AA74*100)/AB74 -> 93.779904306220089 | AD74: =(X74*4)+(Z74*2) -> 4
A75: WERRIBEE | C75: SELLS 4 | E75: BROWN 3 | G75: TAYLOR 2 | J75: JOHNSON 2 | L75: B MOLONEY 2 | O75: VASILOU | Q75: MONTGOMERY | T75: McMASTER | W75: SUNSHINE | X75: 1 | Y75: 1 | Z75: 0 | AA75: 162 | AB75: 221 | AC75: =(AA75*100)/AB75 -> 73.303167420814475 | AD75: =(X75*4)+(Z75*2) -> 4
A77: CAMBERWELL | C77: 6 | D77: 3 | E77: =C77*6+D77 -> 39 | G77: 13 | H77: 11 | I77: =G77*6+H77 -> 89 | K77: 16 | L77: 13 | M77: =K77*6+L77 -> 109 | O77: 21 | P77: 20 | Q77: =O77*6+P77 -> 146 | S77: SUNSHINE | W77: WERRIBEE | X77: 0 | Y77: 3 | Z77: 0 | AA77: 313 | AB77: 384 | AC77: =(AA77*100)/AB77 -> 81.510416666666671 | AD77: =(X77*4)+(Z77*2) -> 0
A78: SUNSHINE | C78: 2 | D78: 9 | E78: =C78*6+D78 -> 21 | G78: 6 | H78: 9 | I78: =G78*6+H78 -> 45 | K78: 10 | L78: 14 | M78: =K78*6+L78 -> 74 | O78: 8 | P78: 16 | Q78: =O78*6+P78 -> 64 | S78: DUNNE/PHILLIPS | W78: DANDENONG | X78: 0 | Y78: 1 | Z78: 0 | AA78: 104 | AB78: 188 | AC78: =(AA78*100)/AB78 -> 55.319148936170215 | AD78: =(X78*4)+(Z78*2) -> 0
A79: BEST PLAYERS
A80: CAMBERWELL | C80: VITACCA | F80: BUDGE | I80: GEURTS | L80: GIBBS | N80: GRAY | P80: DIPIERDOMENICO
A81: SUNSHINE | C81: PROTETTO | F81: JOHNSON | I81: BLAKE | L81: WRIGHT | N81: LITCHFIELD
A82: GOALKICKERS
A83: CAMBERWELL | C83: VITACCA 5 | F83: MODICA 4 | H83: GIBBS 2 | J83: KINK 2 | L83: FREW 2 | N83: WARREN | P83: GRAY | R83: CONDON | T83: BOWLER | V83: O'NEILL | X83: WILLIAMS
A84: SUNSHINE | C84: LITCHFIELD 7 | F84: WALLIS 2 | H84: SHEPPERBOTTOM 2 | L84: EDWARDS 2 | O84: BROWN | Q84: SCANLON | S84: CADDAYE | V84: JOHNSON | X84: McQUALTER
D86: NOT FOR MATCH PTS MORDIALLOC WITHDREW AFTER RD 3
A87: DANDENONG | C87: 5 | D87: 6 | E87: =C87*6+D87 -> 36 | G87: 11 | H87: 14 | I87: =G87*6+H87 -> 80 | K87: 25 | L87: 20 | M87: =K87*6+L87 -> 170 | O87: 35 | P87: 27 | Q87: =O87*6+P87 -> 237 | S87: DANDENONG
A88: MORDIALLOC | C88: 4 | D88: 4 | E88: =C88*6+D88 -> 28 | G88: 9 | H88: 8 | I88: =G88*6+H88 -> 62 | K88: 9 | L88: 11 | M88: =K88*6+L88 -> 65 | O88: 12 | P88: 13 | Q88: =O88*6+P88 -> 85 | S88: BROOKS/HOLT
A89: BEST PLAYERS
A90: DANDENONG | C90: KANNOURAKIS | F90: BRUNNEN | I90: MYNOTT | L90: LINDSAY | O90: HAMILTON | R90: S PALLANT
A91: MORDIALLOC | C91: HEWITT | F91: TODD | I91: JONES | L91: BROOKING | O91: SMITH | R91: ALDRIDGE
A92: GOALKICKERS
A93: DANDENONG | C93: S PALLANT 7 | F93: WRIGHT 6 | H93: BRUNNEN 6 | K93: MYNOTT 5 | N93: LACKO 4 | P93: ARGOON 3 | R93: D PALLANT 2 | U93: D'ARCY | W93: MILLANE
A94: MORDIALLOC | C94: POLA 5 | E94: DEMONIC 4 | H94: COLE | J94: ALDRIDGE | M94: P EVANS
A96: ROUND 4 | E96: 1ST MAY | I96: WEATHER | S96: PLAYED AT
D97: 1ST QTR | H97: 2ND QTR | L97: 3RD QTR | P97: FINAL | S97: OAKLEIGH
A98: OAKLEIGH | C98: 4 | D98: 6 | E98: =C98*6+D98 -> 30 | G98: 6 | H98: 12 | I98: =G98*6+H98 -> 48 | K98: 13 | L98: 20 | M98: =K98*6+L98 -> 98 | O98: 21 | P98: 23 | Q98: =O98*6+P98 -> 149 | S98: UMPIRE | X98: LADDER | AB98: ROUND | AD98: 4
A99: SUNSHINE | C99: 7 | D99: 2 | E99: =C99*6+D99 -> 44 | G99: 11 | H99: 5 | I99: =G99*6+H99 -> 71 | K99: 13 | L99: 8 | M99: =K99*6+L99 -> 86 | O99: 18 | P99: 10 | Q99: =O99*6+P99 -> 118
A100: BEST PLAYERS | W100: TEAM | X100: W | Y100: L | Z100: D | AA100: FOR | AB100: AGST | AC100: % | AD100: PTS
A101: OAKLEIGH
A102: SUNSHINE | W102: CAMBERWELL | X102: 3 | Y102: 0 | Z102: 0 | AA102: 511 | AB102: 327 | AC102: =(AA102*100)/AB102 -> 156.2691131498471 | AD102: =(X102*4)+(Z102*2) -> 12
A103: GOALKICKERS | W103: OAKLEIGH | X103: 3 | Y103: 1 | Z103: 0 | AA103: 499 | AB103: 446 | AC103: =(AA103*100)/AB103 -> 111.88340807174887 | AD103: =(X103*4)+(Z103*2) -> 12
A104: OAKLEIGH | W104: GEELONG WEST | X104: 1 | Y104: 2 | Z104: 0 | AA104: 392 | AB104: 418 | AC104: =(AA104*100)/AB104 -> 93.779904306220089 | AD104: =(X104*4)+(Z104*2) -> 4
A105: SUNSHINE | W105: WERRIBEE | X105: 1 | Y105: 3 | Z105: 0 | AA105: 443 | AB105: 502 | AC105: =(AA105*100)/AB105 -> 88.24701195219123 | AD105: =(X105*4)+(Z105*2) -> 4
A107: WERRIBEE | C107: 6 | D107: 6 | E107: =C107*6+D107 -> 42 | G107: 12 | H107: 9 | I107: =G107*6+H107 -> 81 | K107: 17 | L107: 12 | M107: =K107*6+L107 -> 114 | O107: 19 | P107: 16 | Q107: =O107*6+P107 -> 130 | S107: DANDENONG | W107: DANDENONG | X107: 1 | Y107: 2 | Z107: 0 | AA107: 330 | AB107: 392 | AC107: =(AA107*100)/AB107 -> 84.183673469387756 | AD107: =(X107*4)+(Z107*2) -> 4
A108: DANDENONG | C108: 3 | D108: 6 | E108: =C108*6+D108 -> 24 | G108: 7 | H108: 9 | I108: =G108*6+H108 -> 51 | K108: 10 | L108: 11 | M108: =K108*6+L108 -> 71 | O108: 17 | P108: 16 | Q108: =O108*6+P108 -> 118 | W108: SUNSHINE | X108: 1 | Y108: 2 | Z108: 0 | AA108: 280 | AB108: 370 | AC108: =(AA108*100)/AB108 -> 75.675675675675677 | AD108: =(X108*4)+(Z108*2) -> 4
A109: BEST PLAYERS
A110: WERRIBEE
A111: DANDENONG
A112: GOALKICKERS
A113: WERRIBEE
A114: DANDENONG
E115: 8TH MAY | I115: WEATHER
A116: DANDENONG | C116: 5 | D116: 0 | E116: =C116*6+D116 -> 30 | G116: 11 | H116: 2 | I116: =G116*6+H116 -> 68 | K116: 14 | L116: 4 | M116: =K116*6+L116 -> 88 | O116: 17 | P116: 6 | Q116: =O116*6+P116 -> 108 | S116: DANDENONG
A117: OAKLEIGH | C117: 2 | D117: 5 | E117: =C117*6+D117 -> 17 | G117: 4 | H117: 5 | I117: =G117*6+H117 -> 29 | K117: 8 | L117: 6 | M117: =K117*6+L117 -> 54 | O117: 11 | P117: 8 | Q117: =O117*6+P117 -> 74
A118: BEST PLAYERS
A119: DANDENONG
A120: OAKLEIGH
A121: GOALKICKERS
A122: DANDENONG
A123: OAKLEIGH
A125: ROUND 5 | E125: 15TH MAY | I125: WEATHER | S125: PLAYED AT
D126: 1ST QTR | H126: 2ND QTR | L126: 3RD QTR | P126: FINAL | S126: CAMBERWELL
A127: CAMBERWELL | C127: 2 | D127: 6 | E127: =C127*6+D127 -> 18 | G127: 9 | H127: 7 | I127: =G127*6+H127 -> 61 | K127: 13 | L127: 10 | M127: =K127*6+L127 -> 88 | O127: 17 | P127: 12 | Q127: =O127*6+P127 -> 114 | S127: UMPIRE | X127: LADDER | AB127: ROUND | AD127: 5
A128: OAKLEIGH | C128: 6 | D128: 2 | E128: =C128*6+D128 -> 38 | G128: 9 | H128: 4 | I128: =G128*6+H128 -> 58 | K128: 11 | L128: 9 | M128: =K128*6+L128 -> 75 | O128: 13 | P128: 13 | Q128: =O128*6+P128 -> 91
A129: BEST PLAYERS | W129: TEAM | X129: W | Y129: L | Z129: D | AA129: FOR | AB129: AGST | AC129: % | AD129: PTS
A130: CAMBERWELL | C130: GREIG | F130: GREY | H130: VITACCA | K130: FREW | N130: GEURTS | P130: DIPIERDOMENICO
A131: OAKLEIGH | C131: CUNNINGHAM | F131: TODD | H131: ROURKE | K131: BATTERSBY | N131: COWLED | Q131: VERBEEK | W131: CAMBERWELL | X131: 4 | Y131: 0 | Z131: 0 | AA131: 625 | AB131: 418 | AC131: =(AA131*100)/AB131 -> 149.52153110047846 | AD131: =(X131*4)+(Z131*2) -> 16
A132: GOALKICKERS | W132: OAKLEIGH | X132: 3 | Y132: 2 | Z132: 0 | AA132: 590 | AB132: 560 | AC132: =(AA132*100)/AB132 -> 105.35714285714286 | AD132: =(X132*4)+(Z132*2) -> 12
A133: CAMBERWELL | C133: FREW 6 | E133: CONDON 4 | G133: WHALEN 3 | J133: VITACCA | M133: GREIG | O133: JAKOBI | Q133: KINK | W133: WERRIBEE | X133: 2 | Y133: 3 | Z133: 0 | AA133: 567 | AB133: 559 | AC133: =(AA133*100)/AB133 -> 101.43112701252237 | AD133: =(X133*4)+(Z133*2) -> 8
A134: OAKLEIGH | C134: PRETTO 3 | F134: HOWE 2 | H134: SIMPSON 2 | K134: ATHERTON | N134: OLEKSYN | P134: VERBEEK | R134: O'KANE | T134: GARBUIO | W134: GEELONG WEST | X134: 2 | Y134: 2 | Z134: 0 | AA134: 507 | AB134: 520 | AC134: =(AA134*100)/AB134 -> 97.5 | AD134: =(X134*4)+(Z134*2) -> 8
M135: OWEN
A136: GEELONG WEST | C136: 7 | D136: 1 | E136: =C136*6+D136 -> 43 | G136: 9 | H136: 3 | I136: =G136*6+H136 -> 57 | K136: 17 | L136: 4 | M136: =K136*6+L136 -> 106 | O136: 18 | P136: 7 | Q136: =O136*6+P136 -> 115 | S136: GEELONG WEST | W136: SUNSHINE | X136: 1 | Y136: 3 | Z136: 0 | AA136: 382 | AB136: 485 | AC136: =(AA136*100)/AB136 -> 78.762886597938149 | AD136: =(X136*4)+(Z136*2) -> 4
A137: SUNSHINE | C137: 3 | D137: 4 | E137: =C137*6+D137 -> 22 | G137: 9 | H137: 9 | I137: =G137*6+H137 -> 63 | K137: 11 | L137: 11 | M137: =K137*6+L137 -> 77 | O137: 15 | P137: 12 | Q137: =O137*6+P137 -> 102 | S137: BROOKES | W137: DANDENONG | X137: 1 | Y137: 3 | Z137: 0 | AA137: 387 | AB137: 516 | AC137: =(AA137*100)/AB137 -> 75 | AD137: =(X137*4)+(Z137*2) -> 4
A138: BEST PLAYERS | S138: PHILLIPS
A139: GEELONG WEST | C139: SIMPSON | G139: CHAPMAN | J139: WATT | M139: FAZIO | O139: FROST | R139: WALPOLE
A140: SUNSHINE | C140: McQUALTER | G140: BROWN | J140: EDWARDS | M140: PROTETTO | O140: WRIGHT | R140: MITROVSKI
A141: GOALKICKERS
A142: GEELONG WEST | C142: FAZIO 4 | E142: MORRISSEY 4 | H142: BERRY 2 | J142: MALARKY 2 | M142: KOL 2 | O142: FROST | Q142: MACHAR | S142: LUKE | U142: CHAPMAN
A143: SUNSHINE | C143: LITCHFIELD 5 | F143: McQUALTER 4 | I143: WALLIS 2 | K143: MITROVSKI | N143: SHEPPERBOTTOM | R143: NELSON | T143: CUTAJAR
A145: WERRIBEE | C145: 6 | D145: 1 | E145: =C145*6+D145 -> 37 | G145: 8 | H145: 6 | I145: =G145*6+H145 -> 54 | K145: 13 | L145: 7 | M145: =K145*6+L145 -> 85 | O145: 19 | P145: 10 | Q145: =O145*6+P145 -> 124 | S145: WERRIBEE
A146: DANDENONG | C146: 4 | D146: 3 | E146: =C146*6+D146 -> 27 | G146: 6 | H146: 3 | I146: =G146*6+H146 -> 39 | K146: 8 | L146: 5 | M146: =K146*6+L146 -> 53 | O146: 8 | P146: 9 | Q146: =O146*6+P146 -> 57 | S146: McDONALD/WALKER
A147: BEST PLAYERS
A148: WERRIBEE | C148: HITCH | F148: SELLS | I148: MONTGOMERY | L148: GUDDE | O148: McMASTER | R148: BROWN
A149: DANDENONG | C149: MILLANE | F149: COLLARD | I149: HILL | L149: MERRIGAN | O149: HALL | R149: ARGOON
A150: GOALKICKERS
A151: WERRIBEE | C151: MONTGOMERY 4 | G151: VASILOU 4 | J151: BROWN 3 | L151: BONAT 2 | N151: GREY 2 | P151: SINNOTT | R151: WATERSON | T151: McMASTER | W151: SELLS
A152: DANDENONG | C152: ARGOON 4 | F152: PALLANT 2 | I152: BRUNNEN | L152: COLLARD
A154: ROUND 6 | E154: 22ND MAY | I154: WEATHER | S154: PLAYED AT
D155: 1ST QTR | H155: 2ND QTR | L155: 3RD QTR | P155: FINAL | S155: GEELONG WEST
A156: GEELONG WEST | C156: 6 | D156: 2 | E156: =C156*6+D156 -> 38 | G156: 8 | H156: 7 | I156: =G156*6+H156 -> 55 | K156: 16 | L156: 17 | M156: =K156*6+L156 -> 113 | O156: 18 | P156: 19 | Q156: =O156*6+P156 -> 127 | S156: UMPIRE | X156: LADDER | AB156: ROUND | AD156: 6
A157: CAMBERWELL | C157: 6 | D157: 5 | E157: =C157*6+D157 -> 41 | G157: 8 | H157: 9 | I157: =G157*6+H157 -> 57 | K157: 9 | L157: 11 | M157: =K157*6+L157 -> 65 | O157: 12 | P157: 17 | Q157: =O157*6+P157 -> 89 | S157: McDONALD/RIDDIFORD
A158: BEST PLAYERS | W158: TEAM | X158: W | Y158: L | Z158: D | AA158: FOR | AB158: AGST | AC158: % | AD158: PTS
A159: GEELONG WEST | C159: FROST | F159: DILLON | I159: YATES | L159: REDHEAD | O159: CHRISTENSEN | R159: FAZIO
A160: CAMBERWELL | C160: GEURTS | F160: CONDON | I160: GREIG | L160: BUDGE | W160: CAMBERWELL | X160: 4 | Y160: 1 | Z160: 0 | AA160: 714 | AB160: 545 | AC160: =(AA160*100)/AB160 -> 131.00917431192661 | AD160: =(X160*4)+(Z160*2) -> 16
A161: GOALKICKERS | W161: WERRIBEE | X161: 3 | Y161: 3 | Z161: 0 | AA161: 717 | AB161: 651 | AC161: =(AA161*100)/AB161 -> 110.13824884792626 | AD161: =(X161*4)+(Z161*2) -> 12
A162: GEELONG WEST | C162: MITCHELL 5 | F162: BERRY 3 | H162: KOL 3 | J162: THISTLE 2 | M162: CHAPMAN 2 | P162: FROST 2 | R162: JEFFRIES | W162: GEELONG WEST | X162: 3 | Y162: 2 | Z162: 0 | AA162: 634 | AB162: 609 | AC162: =(AA162*100)/AB162 -> 104.10509031198687 | AD162: =(X162*4)+(Z162*2) -> 12
A163: CAMBERWELL | C163: CONDON 5 | F163: KINK 2 | H163: MODICA | J163: JAKOBI | L163: GIBBS | N163: BUDGE | P163: WHALEN | W163: OAKLEIGH | X163: 3 | Y163: 3 | Z163: 0 | AA163: 682 | AB163: 710 | AC163: =(AA163*100)/AB163 -> 96.056338028169009 | AD163: =(X163*4)+(Z163*2) -> 12
A165: DANDENONG | C165: 8 | D165: 2 | E165: =C165*6+D165 -> 50 | G165: 15 | H165: 6 | I165: =G165*6+H165 -> 96 | K165: 17 | L165: 7 | M165: =K165*6+L165 -> 109 | O165: 23 | P165: 12 | Q165: =O165*6+P165 -> 150 | S165: DANDENONG | W165: DANDENONG | X165: 2 | Y165: 3 | Z165: 0 | AA165: 537 | AB165: 595 | AC165: =(AA165*100)/AB165 -> 90.252100840336141 | AD165: =(X165*4)+(Z165*2) -> 8
A166: SUNSHINE | C166: 2 | D166: 3 | E166: =C166*6+D166 -> 15 | G166: 4 | H166: 6 | I166: =G166*6+H166 -> 30 | K166: 8 | L166: 11 | M166: =K166*6+L166 -> 59 | O166: 11 | P166: 13 | Q166: =O166*6+P166 -> 79 | S166: DUNNE/PRICE | W166: SUNSHINE | X166: 1 | Y166: 4 | Z166: 0 | AA166: 461 | AB166: 635 | AC166: =(AA166*100)/AB166 -> 72.5984251968504 | AD166: =(X166*4)+(Z166*2) -> 4
A167: BEST PLAYERS
A168: DANDENONG | C168: MILLIGAN | F168: POLA | I168: HALL | L168: GOOD | O168: BRUNNEN | R168: McCOLL
A169: SUNSHINE | C169: PROTETTO | F169: WAGLAND | I169: BROWN | L169: L WRIGHT | O169: BEER | R169: LAWLER
A170: GOALKICKERS
A171: DANDENONG | C171: POLA 11 | E171: MYNOTT 4 | G171: HALL 2 | I171: BRUNNEN 2 | L171: D'ARCY 2 | N171: ARGOON | P171: MILLIGAN
A172: SUNSHINE | C172: CADDAYE 3 | F172: SHEPPERBOTTOM 2 | J172: L WRIGHT 2 | M172: BROWN | O172: CUTAJAR | R172: PROTETTO | T172: SCANLON
A174: WERRIBEE | C174: 8 | D174: 4 | E174: =C174*6+D174 -> 52 | G174: 11 | H174: 7 | I174: =G174*6+H174 -> 73 | K174: 18 | L174: 10 | M174: =K174*6+L174 -> 118 | O174: 23 | P174: 12 | Q174: =O174*6+P174 -> 150 | S174: WERRIBEE
A175: OAKLEIGH | C175: 2 | D175: 3 | E175: =C175*6+D175 -> 15 | G175: 7 | H175: 9 | I175: =G175*6+H175 -> 51 | K175: 9 | L175: 10 | M175: =K175*6+L175 -> 64 | O175: 13 | P175: 14 | Q175: =O175*6+P175 -> 92 | S175: BROOKS/PHILLIPS
A176: BEST PLAYERS
A177: WERRIBEE | C177: MONTGOMERY | G177: HITCH | J177: SELLS | M177: GREY | O177: GUINTA | R177: MADIGAN
A178: OAKLEIGH | C178: TODD | G178: SMITH | J178: BATTERSBY | M178: PRETTO
A179: GOALKICKERS
A180: WERRIBEE | C180: SELLS 5 | E180: GREY 3 | G180: MONTGOMERY 3 | K180: GORDON 3 | N180: BRIERTY 3 | P180: BROWN 2 | R180: MCMASTER 2 | U180: SINNOTT | W180: VASILOU
A181: OAKLEIGH | C181: PRETTO 7 | F181: HOWE 2 | H181: SUTHERLAND 2 | L181: OWEN | N181: COWLED
A183: ROUND 7 | E183: 29TH MAY | I183: WEATHER | S183: PLAYED AT
D184: 1ST QTR | H184: 2ND QTR | L184: 3RD QTR | P184: FINAL | S184: DANDENONG
A185: DANDENONG | C185: 5 | D185: 2 | E185: =C185*6+D185 -> 32 | G185: 8 | H185: 4 | I185: =G185*6+H185 -> 52 | K185: 12 | L185: 7 | M185: =K185*6+L185 -> 79 | O185: 15 | P185: 8 | Q185: =O185*6+P185 -> 98 | S185: UMPIRE | X185: LADDER | AB185: ROUND | AD185: 7
A186: GEELONG WEST | C186: 2 | D186: 3 | E186: =C186*6+D186 -> 15 | G186: 5 | H186: 3 | I186: =G186*6+H186 -> 33 | K186: 5 | L186: 6 | M186: =K186*6+L186 -> 36 | O186: 8 | P186: 10 | Q186: =O186*6+P186 -> 58 | S186: BROOKS/RIDDIFORD
A187: BEST PLAYERS | W187: TEAM | X187: W | Y187: L | Z187: D | AA187: FOR | AB187: AGST | AC187: % | AD187: PTS
A188: DANDENONG | C188: LINDSAY | F188: MERRIGAN | I188: HALL | K188: COLLARD | N188: PALLANT
A189: GEELONG WEST | C189: JEFFERIES | F189: MACHAR | I189: FAZIO | K189: REDHEAD | N189: CHRISTENSEN | W189: CAMBERWELL | X189: 4 | Y189: 2 | Z189: 0 | AA189: 828 | AB189: 675 | AC189: =(AA189*100)/AB189 -> 122.66666666666667 | AD189: =(X189*4)+(Z189*2) -> 16
A190: GOALKICKERS | W190: OAKLEIGH | X190: 4 | Y190: 3 | Z190: 0 | AA190: 812 | AB190: 824 | AC190: =(AA190*100)/AB190 -> 98.543689320388353 | AD190: =(X190*4)+(Z190*2) -> 16
A191: DANDENONG | C191: POLA 5 | E191: ARGOON 3 | G191: PALLANT 3 | J191: GOOD 2 | L191: HALL | N191: MYNOTT | W191: WERRIBEE | X191: 3 | Y191: 4 | Z191: 0 | AA191: 795 | AB191: 783 | AC191: =(AA191*100)/AB191 -> 101.53256704980843 | AD191: =(X191*4)+(Z191*2) -> 12
A192: GEELONG WEST | C192: MITCHELL 2 | F192: MORRISSEY 2 | I192: REDHEAD | K192: FROST | M192: McCAFFREY | P192: CHAPMAN | W192: GEELONG WEST | X192: 3 | Y192: 3 | Z192: 0 | AA192: 692 | AB192: 707 | AC192: =(AA192*100)/AB192 -> 97.878359264497874 | AD192: =(X192*4)+(Z192*2) -> 12
A194: OAKLEIGH | C194: 2 | D194: 3 | E194: =C194*6+D194 -> 15 | G194: 9 | H194: 6 | I194: =G194*6+H194 -> 60 | K194: 15 | L194: 8 | M194: =K194*6+L194 -> 98 | O194: 20 | P194: 10 | Q194: =O194*6+P194 -> 130 | S194: OAKLEIGH | W194: DANDENONG | X194: 3 | Y194: 3 | Z194: 0 | AA194: 635 | AB194: 653 | AC194: =(AA194*100)/AB194 -> 97.243491577335377 | AD194: =(X194*4)+(Z194*2) -> 12
A195: CAMBERWELL | C195: 4 | D195: 5 | E195: =C195*6+D195 -> 29 | G195: 7 | H195: 9 | I195: =G195*6+H195 -> 51 | K195: 11 | L195: 11 | M195: =K195*6+L195 -> 77 | O195: 17 | P195: 12 | Q195: =O195*6+P195 -> 114 | S195: BULLOCK | W195: SUNSHINE | X195: 2 | Y195: 4 | Z195: 0 | AA195: 593 | AB195: 713 | AC195: =(AA195*100)/AB195 -> 83.169705469845724 | AD195: =(X195*4)+(Z195*2) -> 8
A196: BEST PLAYERS
A197: OAKLEIGH | C197: TODD | F197: SUTHERLAND | I197: BATTERSBY | L197: MARSHALL | O197: VERBEEK | R197: WALL
A198: CAMBERWELL | C198: GEURTS | F198: BUDGE | I198: FORD | L198: CONDON
A199: GOALKICKERS
A200: OAKLEIGH | C200: PRETTO 5 | F200: HOWE 5 | H200: SUTHERLAND 4 | K200: HODGSON 2 | N200: COWLED 2 | Q200: WALL | S200: OWEN
A201: CAMBERWELL | C201: CONDON 6 | F201: FREW 2 | H201: SPASSOUPULOS 2 | K201: GRAY 2 | M201: GIBBS 2 | O201: JAKOBI | Q201: MITCHELL | S201: VITACCA
A203: SUNSHINE | C203: 2 | D203: 3 | E203: =C203*6+D203 -> 15 | G203: 7 | H203: 6 | I203: =G203*6+H203 -> 48 | K203: 12 | L203: 10 | M203: =K203*6+L203 -> 82 | O203: 20 | P203: 12 | Q203: =O203*6+P203 -> 132 | S203: SUNSHINE
A204: WERRIBEE | C204: 4 | D204: 4 | E204: =C204*6+D204 -> 28 | G204: 7 | H204: 4 | I204: =G204*6+H204 -> 46 | K204: 9 | L204: 11 | M204: =K204*6+L204 -> 65 | O204: 11 | P204: 12 | Q204: =O204*6+P204 -> 78 | S204: McDONALD/PHILLIPS
A205: BEST PLAYERS
A206: SUNSHINE | C206: PROTETTO | F206: L WRIGHT | I206: WAGLAND | L206: SCANLON | O206: BROWN | R206: KING
A207: WERRIBEE | C207: D BROWN | F207: SMITH | I207: HITCH | L207: BRIERTY
A208: GOALKICKERS
A209: SUNSHINE | C209: LITCHFIELD 8 | F209: SHEPPERBOTTOM 3 | J209: CADDAYE 2 | M209: JOHNSON 2 | O209: CUTAJAR | Q209: EDWARDS | S209: PROTETTO | V209: WAGLAND | X209: BEER
A210: WERRIBEE | C210: SELLS 3 | E210: D BROWN 2 | H210: MONTGOMERY 2 | L210: BONAT | N210: GORDON | P210: BRIERTY | R210: GREY
A212: ROUND 8 | E212: 5TH JUNE | I212: WEATHER | S212: PLAYED AT
D213: 1ST QTR | H213: 2ND QTR | L213: 3RD QTR | P213: FINAL | S213: DANDENONG
A214: DANDENONG | C214: 6 | D214: 1 | E214: =C214*6+D214 -> 37 | G214: 8 | H214: 7 | I214: =G214*6+H214 -> 55 | K214: 12 | L214: 9 | M214: =K214*6+L214 -> 81 | O214: 13 | P214: 11 | Q214: =O214*6+P214 -> 89 | S214: UMPIRE | X214: LADDER | AB214: ROUND | AD214: 8
A215: SUNSHINE | C215: 0 | D215: 1 | E215: =C215*6+D215 -> 1 | G215: 0 | H215: 6 | I215: =G215*6+H215 -> 6 | K215: 4 | L215: 9 | M215: =K215*6+L215 -> 33 | O215: 9 | P215: 11 | Q215: =O215*6+P215 -> 65
A216: BEST PLAYERS | W216: TEAM | X216: W | Y216: L | Z216: D | AA216: FOR | AB216: AGST | AC216: % | AD216: PTS
A217: DANDENONG
A218: SUNSHINE | W218: OAKLEIGH | X218: 5 | Y218: 3 | Z218: 0 | AA218: 896 | AB218: 902 | AC218: =(AA218*100)/AB218 -> 99.334811529933475 | AD218: =(X218*4)+(Z218*2) -> 20
A219: GOALKICKERS | W219: CAMBERWELL | X219: 4 | Y219: 3 | Z219: 0 | AA219: 889 | AB219: 768 | AC219: =(AA219*100)/AB219 -> 115.75520833333333 | AD219: =(X219*4)+(Z219*2) -> 16
A220: DANDENONG | W220: WERRIBEE | X220: 4 | Y220: 4 | Z220: 0 | AA220: 888 | AB220: 844 | AC220: =(AA220*100)/AB220 -> 105.21327014218009 | AD220: =(X220*4)+(Z220*2) -> 16
A221: SUNSHINE | W221: DANDENONG | X221: 4 | Y221: 3 | Z221: 0 | AA221: 724 | AB221: 718 | AC221: =(AA221*100)/AB221 -> 100.83565459610028 | AD221: =(X221*4)+(Z221*2) -> 16
A223: OAKLEIGH | C223: 7 | D223: 3 | E223: =C223*6+D223 -> 45 | G223: 8 | H223: 4 | I223: =G223*6+H223 -> 52 | K223: 10 | L223: 8 | M223: =K223*6+L223 -> 68 | O223: 12 | P223: 12 | Q223: =O223*6+P223 -> 84 | S223: OAKLEIGH | W223: GEELONG WEST | X223: 3 | Y223: 4 | Z223: 0 | AA223: 770 | AB223: 791 | AC223: =(AA223*100)/AB223 -> 97.345132743362825 | AD223: =(X223*4)+(Z223*2) -> 12
A224: GEELONG WEST | C224: 2 | D224: 3 | E224: =C224*6+D224 -> 15 | G224: 2 | H224: 6 | I224: =G224*6+H224 -> 18 | K224: 5 | L224: 8 | M224: =K224*6+L224 -> 38 | O224: 11 | P224: 12 | Q224: =O224*6+P224 -> 78 | W224: SUNSHINE | X224: 2 | Y224: 5 | Z224: 0 | AA224: 658 | AB224: 802 | AC224: =(AA224*100)/AB224 -> 82.044887780548635 | AD224: =(X224*4)+(Z224*2) -> 8
A225: BEST PLAYERS
A226: OAKLEIGH
A227: GEELONG WEST
A228: GOALKICKERS
A229: OAKLEIGH
A230: GEELONG WEST
A232: WERRIBEE | C232: 4 | D232: 4 | E232: =C232*6+D232 -> 28 | G232: 8 | H232: 14 | I232: =G232*6+H232 -> 62 | K232: 10 | L232: 17 | M232: =K232*6+L232 -> 77 | O232: 12 | P232: 21 | Q232: =O232*6+P232 -> 93 | S232: WERRIBEE
A233: CAMBERWELL | C233: 1 | D233: 4 | E233: =C233*6+D233 -> 10 | G233: 2 | H233: 5 | I233: =G233*6+H233 -> 17 | K233: 5 | L233: 13 | M233: =K233*6+L233 -> 43 | O233: 7 | P233: 19 | Q233: =O233*6+P233 -> 61
A234: BEST PLAYERS
A235: WERRIBEE
A236: CAMBERWELL
A237: GOALKICKERS
A238: WERRIBEE
A239: CAMBERWELL
A241: ROUND 9 | E241: 12TH JUNE | I241: WEATHER | S241: PLAYED AT
D242: 1ST QTR | H242: 2ND QTR | L242: 3RD QTR | P242: FINAL | S242: SUNSHINE
A243: SUNSHINE | C243: 5 | D243: 2 | E243: =C243*6+D243 -> 32 | G243: 10 | H243: 5 | I243: =G243*6+H243 -> 65 | K243: 13 | L243: 10 | M243: =K243*6+L243 -> 88 | O243: 19 | P243: 13 | Q243: =O243*6+P243 -> 127 | S243: UMPIRE | X243: LADDER | AB243: ROUND | AD243: 9
A244: CAMBERWELL | C244: 2 | D244: 2 | E244: =C244*6+D244 -> 14 | G244: 5 | H244: 5 | I244: =G244*6+H244 -> 35 | K244: 8 | L244: 6 | M244: =K244*6+L244 -> 54 | O244: 12 | P244: 9 | Q244: =O244*6+P244 -> 81
A245: BEST PLAYERS | W245: TEAM | X245: W | Y245: L | Z245: D | AA245: FOR | AB245: AGST | AC245: % | AD245: PTS
A246: SUNSHINE
A247: CAMBERWELL | W247: DANDENONG | X247: 5 | Y247: 3 | Z247: 0 | AA247: 862 | AB247: 775 | AC247: =(AA247*100)/AB247 -> 111.2258064516129 | AD247: =(X247*4)+(Z247*2) -> 20
A248: GOALKICKERS | W248: OAKLEIGH | X248: 5 | Y248: 3 | Z248: 0 | AA248: 896 | AB248: 902 | AC248: =(AA248*100)/AB248 -> 99.334811529933475 | AD248: =(X248*4)+(Z248*2) -> 20
A249: SUNSHINE | W249: CAMBERWELL | X249: 4 | Y249: 4 | Z249: 0 | AA249: 970 | AB249: 895 | AC249: =(AA249*100)/AB249 -> 108.37988826815642 | AD249: =(X249*4)+(Z249*2) -> 16
A250: CAMBERWELL | W250: WERRIBEE | X250: 4 | Y250: 4 | Z250: 0 | AA250: 888 | AB250: 844 | AC250: =(AA250*100)/AB250 -> 105.21327014218009 | AD250: =(X250*4)+(Z250*2) -> 16
A252: DANDENONG | C252: 6 | D252: 2 | E252: =C252*6+D252 -> 38 | G252: 10 | H252: 4 | I252: =G252*6+H252 -> 64 | K252: 14 | L252: 10 | M252: =K252*6+L252 -> 94 | O252: 21 | P252: 12 | Q252: =O252*6+P252 -> 138 | S252: GEELONG WEST | W252: GEELONG WEST | X252: 3 | Y252: 5 | Z252: 0 | AA252: 827 | AB252: 929 | AC252: =(AA252*100)/AB252 -> 89.020452099031218 | AD252: =(X252*4)+(Z252*2) -> 12
A253: GEELONG WEST | C253: 2 | D253: 3 | E253: =C253*6+D253 -> 15 | G253: 6 | H253: 11 | I253: =G253*6+H253 -> 47 | K253: 7 | L253: 13 | M253: =K253*6+L253 -> 55 | O253: 7 | P253: 15 | Q253: =O253*6+P253 -> 57 | W253: SUNSHINE | X253: 3 | Y253: 5 | Z253: 0 | AA253: 785 | AB253: 883 | AC253: =(AA253*100)/AB253 -> 88.901472253680637 | AD253: =(X253*4)+(Z253*2) -> 12
A254: BEST PLAYERS
A255: DANDENONG
A256: GEELONG WEST
A257: GOALKICKERS
A258: DANDENONG
A259: GEELONG WEST
A261: ROUND 10 | E261: 19TH JUNE | I261: WEATHER | S261: PLAYED AT
D262: 1ST QTR | H262: 2ND QTR | L262: 3RD QTR | P262: FINAL | S262: SUNSHINE
A263: SUNSHINE | C263: 7 | D263: 1 | E263: =C263*6+D263 -> 43 | G263: 8 | H263: 6 | I263: =G263*6+H263 -> 54 | K263: 12 | L263: 9 | M263: =K263*6+L263 -> 81 | O263: 16 | P263: 15 | Q263: =O263*6+P263 -> 111 | S263: UMPIRE | X263: LADDER | AB263: ROUND | AD263: 10
A264: WERRIBEE | C264: 1 | D264: 0 | E264: =C264*6+D264 -> 6 | G264: 3 | H264: 4 | I264: =G264*6+H264 -> 22 | K264: 6 | L264: 5 | M264: =K264*6+L264 -> 41 | O264: 12 | P264: 8 | Q264: =O264*6+P264 -> 80
A265: BEST PLAYERS | W265: TEAM | X265: W | Y265: L | Z265: D | AA265: FOR | AB265: AGST | AC265: % | AD265: PTS
A266: SUNSHINE
A267: WERRIBEE | W267: OAKLEIGH | X267: 6 | Y267: 3 | Z267: 0 | AA267: 970 | AB267: 961 | AC267: =(AA267*100)/AB267 -> 100.93652445369406 | AD267: =(X267*4)+(Z267*2) -> 24
A268: GOALKICKERS | W268: CAMBERWELL | X268: 5 | Y268: 4 | Z268: 0 | AA268: 1066 | AB268: 980 | AC268: =(AA268*100)/AB268 -> 108.77551020408163 | AD268: =(X268*4)+(Z268*2) -> 20
A269: SUNSHINE | W269: DANDENONG | X269: 5 | Y269: 4 | Z269: 0 | AA269: 947 | AB269: 871 | AC269: =(AA269*100)/AB269 -> 108.72560275545351 | AD269: =(X269*4)+(Z269*2) -> 20
A270: WERRIBEE | W270: WERRIBEE | X270: 4 | Y270: 5 | Z270: 0 | AA270: 968 | AB270: 955 | AC270: =(AA270*100)/AB270 -> 101.36125654450262 | AD270: =(X270*4)+(Z270*2) -> 16
A272: CAMBERWELL | C272: 3 | D272: 3 | E272: =C272*6+D272 -> 21 | G272: 8 | H272: 5 | I272: =G272*6+H272 -> 53 | K272: 13 | L272: 9 | M272: =K272*6+L272 -> 87 | O272: 14 | P272: 12 | Q272: =O272*6+P272 -> 96 | S272: CAMBERWELL | W272: SUNSHINE | X272: 4 | Y272: 5 | Z272: 0 | AA272: 896 | AB272: 963 | AC272: =(AA272*100)/AB272 -> 93.042575285565945 | AD272: =(X272*4)+(Z272*2) -> 16
A273: DANDENONG | C273: 5 | D273: 2 | E273: =C273*6+D273 -> 32 | G273: 7 | H273: 5 | I273: =G273*6+H273 -> 47 | K273: 10 | L273: 5 | M273: =K273*6+L273 -> 65 | O273: 13 | P273: 7 | Q273: =O273*6+P273 -> 85 | W273: GEELONG WEST | X273: 3 | Y273: 6 | Z273: 0 | AA273: 886 | AB273: 1003 | AC273: =(AA273*100)/AB273 -> 88.33499501495514 | AD273: =(X273*4)+(Z273*2) -> 12
A274: BEST PLAYERS
A275: CAMBERWELL
A276: DANDENONG
A277: GOALKICKERS
A278: CAMBERWELL
A279: DANDENONG
A281: OAKLEIGH | C281: 1 | D281: 3 | E281: =C281*6+D281 -> 9 | G281: 4 | H281: 7 | I281: =G281*6+H281 -> 31 | K281: 6 | L281: 12 | M281: =K281*6+L281 -> 48 | O281: 10 | P281: 14 | Q281: =O281*6+P281 -> 74 | S281: OAKLEIGH
A282: GEELONG WEST | C282: 4 | D282: 1 | E282: =C282*6+D282 -> 25 | G282: 6 | H282: 2 | I282: =G282*6+H282 -> 38 | K282: 7 | L282: 4 | M282: =K282*6+L282 -> 46 | O282: 9 | P282: 5 | Q282: =O282*6+P282 -> 59
A283: BEST PLAYERS
A284: OAKLEIGH
A285: GEELONG WEST
A286: GOALKICKERS
A287: OAKLEIGH
A288: GEELONG WEST
A290: ROUND 11 | E290: 26TH JUNE | I290: WEATHER | S290: PLAYED AT
D291: 1ST QTR | H291: 2ND QTR | L291: 3RD QTR | P291: FINAL | S291: GEELONG WEST
A292: GEELONG WEST | C292: 4 | D292: 4 | E292: =C292*6+D292 -> 28 | G292: 6 | H292: 8 | I292: =G292*6+H292 -> 44 | K292: 9 | L292: 13 | M292: =K292*6+L292 -> 67 | O292: 11 | P292: 17 | Q292: =O292*6+P292 -> 83 | S292: UMPIRE | X292: LADDER | AB292: ROUND | AD292: 11
A293: CAMBERWELL | C293: 6 | D293: 3 | E293: =C293*6+D293 -> 39 | G293: 8 | H293: 5 | I293: =G293*6+H293 -> 53 | K293: 9 | L293: 5 | M293: =K293*6+L293 -> 59 | O293: 12 | P293: 6 | Q293: =O293*6+P293 -> 78 | S293: NEWMAN/BRADY
A294: BEST PLAYERS | W294: TEAM | X294: W | Y294: L | Z294: D | AA294: FOR | AB294: AGST | AC294: % | AD294: PTS
A295: GEELONG WEST | C295: REDHEAD | F295: WATT | I295: CHAPMAN | L295: DILLON | N295: WALPOLE
A296: CAMBERWELL | C296: GEURTS | F296: CONDON | I296: GREGG | L296: CONSTANTINOU | P296: FREW | W296: OAKLEIGH | X296: 7 | Y296: 3 | Z296: 0 | AA296: 1142 | AB296: 1036 | AC296: =(AA296*100)/AB296 -> 110.23166023166023 | AD296: =(X296*4)+(Z296*2) -> 28
A297: GOALKICKERS | W297: DANDENONG | X297: 6 | Y297: 4 | Z297: 0 | AA297: 1091 | AB297: 941 | AC297: =(AA297*100)/AB297 -> 115.94048884165781 | AD297: =(X297*4)+(Z297*2) -> 24
A298: GEELONG WEST | C298: LUKE 4 | F298: KOL 2 | H298: SIZER 2 | J298: YATES | L298: THIELE | N298: CHAPMAN | W298: CAMBERWELL | X298: 5 | Y298: 5 | Z298: 0 | AA298: 1144 | AB298: 1063 | AC298: =(AA298*100)/AB298 -> 107.61994355597366 | AD298: =(X298*4)+(Z298*2) -> 20
A299: CAMBERWELL | C299: CONDON 5 | F299: CONSTANTINOU 3 | J299: FREW 2 | L299: VITACCA | N299: KINK | W299: WERRIBEE | X299: 4 | Y299: 6 | Z299: 0 | AA299: 1043 | AB299: 1127 | AC299: =(AA299*100)/AB299 -> 92.546583850931682 | AD299: =(X299*4)+(Z299*2) -> 16
A301: OAKLEIGH | C301: 5 | D301: 5 | E301: =C301*6+D301 -> 35 | G301: 13 | H301: 7 | I301: =G301*6+H301 -> 85 | K301: 23 | L301: 13 | M301: =K301*6+L301 -> 151 | O301: 26 | P301: 16 | Q301: =O301*6+P301 -> 172 | S301: WERRIBEE | W301: GEELONG WEST | X301: 4 | Y301: 6 | Z301: 0 | AA301: 969 | AB301: 1081 | AC301: =(AA301*100)/AB301 -> 89.639222941720632 | AD301: =(X301*4)+(Z301*2) -> 16
A302: WERRIBEE | C302: 1 | D302: 0 | E302: =C302*6+D302 -> 6 | G302: 4 | H302: 1 | I302: =G302*6+H302 -> 25 | K302: 6 | L302: 2 | M302: =K302*6+L302 -> 38 | O302: 12 | P302: 3 | Q302: =O302*6+P302 -> 75 | S302: PRICE | W302: SUNSHINE | X302: 4 | Y302: 6 | Z302: 0 | AA302: 966 | AB302: 1107 | AC302: =(AA302*100)/AB302 -> 87.262872628726285 | AD302: =(X302*4)+(Z302*2) -> 16
A303: BEST PLAYERS | S303: RIDDIFORD
A304: OAKLEIGH | C304: SMITH | F304: VERBEEK | I304: CUNNINGHAM | L304: HILLIARD | O304: COWLED | R304: PRETTO
A305: WERRIBEE | C305: BONAT | F305: MORRIS | I305: HITCH | L305: GUINTA
A306: GOALKICKERS
A307: OAKLEIGH | C307: PRETTO 8 | F307: VERBEEK 6 | I307: COWLED 3 | K307: GARBUIO 2 | N307: SUTHERLAND 2 | Q307: SIMPSON | S307: MARSHALL | V307: HOWE
A308: WERRIBEE | C308: SELLS 5 | F308: TAYLOR 2 | I308: WATTERSON 2 | L308: BONAT | N308: GREY | P308: GORDON
A310: DANDENONG | C310: 2 | D310: 0 | E310: =C310*6+D310 -> 12 | G310: 12 | H310: 4 | I310: =G310*6+H310 -> 76 | K310: 14 | L310: 7 | M310: =K310*6+L310 -> 91 | O310: 21 | P310: 18 | Q310: =O310*6+P310 -> 144 | S310: DANDENONG
A311: SUNSHINE | C311: 4 | D311: 7 | E311: =C311*6+D311 -> 31 | G311: 4 | H311: 7 | I311: =G311*6+H311 -> 31 | K311: 9 | L311: 10 | M311: =K311*6+L311 -> 64 | O311: 10 | P311: 10 | Q311: =O311*6+P311 -> 70 | S311: CARUSO/McDONALD
A312: BEST PLAYERS
A313: DANDENONG | C313: MILLIGAN | F313: LACKO | I313: LINDSAY | L313: HALL | N313: BRUNNEN | Q313: McCOLL
A314: SUNSHINE | C314: SCHICCITANO | F314: V PROTETTO | I314: EDWARDS | L314: SCANLON
A315: GOALKICKERS
A316: DANDENONG | C316: POLA 5 | E316: D'ARCY 3 | G316: GOOD 3 | I316: BRUNNEN 2 | K316: D PALLANT 2 | N316: WRIGHT 2 | P316: MILLIGAN | S316: NICHOLAS
A317: SUNSHINE | C317: SHEPPERBOTTOM 3 | G317: BROWN 2 | J317: MITROVSKI 2 | M317: LITCHFIELD | P317: EDWARDS | R317: NELSON
A319: ROUND 12 | E319: 3RD JULY | I319: WEATHER | S319: PLAYED AT
D320: 1ST QTR | H320: 2ND QTR | L320: 3RD QTR | P320: FINAL | S320: WERRIBEE
A321: WERRIBEE | C321: 3 | D321: 6 | E321: =C321*6+D321 -> 24 | G321: 8 | H321: 8 | I321: =G321*6+H321 -> 56 | K321: 11 | L321: 13 | M321: =K321*6+L321 -> 79 | O321: 13 | P321: 14 | Q321: =O321*6+P321 -> 92 | S321: UMPIRE | X321: LADDER | AB321: ROUND | AD321: 12
A322: GEELONG WEST | C322: 4 | D322: 2 | E322: =C322*6+D322 -> 26 | G322: 5 | H322: 3 | I322: =G322*6+H322 -> 33 | K322: 7 | L322: 6 | M322: =K322*6+L322 -> 48 | O322: 11 | P322: 10 | Q322: =O322*6+P322 -> 76
A323: BEST PLAYERS | W323: TEAM | X323: W | Y323: L | Z323: D | AA323: FOR | AB323: AGST | AC323: % | AD323: PTS
A324: WERRIBEE
A325: GEELONG WEST | W325: OAKLEIGH | X325: 8 | Y325: 3 | Z325: 0 | AA325: 1258 | AB325: 1113 | AC325: =(AA325*100)/AB325 -> 113.02785265049415 | AD325: =(X325*4)+(Z325*2) -> 32
A326: GOALKICKERS | W326: DANDENONG | X326: 6 | Y326: 5 | Z326: 0 | AA326: 1168 | AB326: 1057 | AC326: =(AA326*100)/AB326 -> 110.50141911069063 | AD326: =(X326*4)+(Z326*2) -> 24
A327: WERRIBEE | W327: CAMBERWELL | X327: 5 | Y327: 6 | Z327: 0 | AA327: 1217 | AB327: 1185 | AC327: =(AA327*100)/AB327 -> 102.70042194092827 | AD327: =(X327*4)+(Z327*2) -> 20
A328: GEELONG WEST | W328: WERRIBEE | X328: 5 | Y328: 6 | Z328: 0 | AA328: 1135 | AB328: 1203 | AC328: =(AA328*100)/AB328 -> 94.347464671654194 | AD328: =(X328*4)+(Z328*2) -> 20
A330: OAKLEIGH | C330: 2 | D330: 6 | E330: =C330*6+D330 -> 18 | G330: 4 | H330: 15 | I330: =G330*6+H330 -> 39 | K330: 9 | L330: 21 | M330: =K330*6+L330 -> 75 | O330: 15 | P330: 26 | Q330: =O330*6+P330 -> 116 | S330: OAKLEIGH | W330: SUNSHINE | X330: 5 | Y330: 6 | Z330: 0 | AA330: 1088 | AB330: 1180 | AC330: =(AA330*100)/AB330 -> 92.20338983050847 | AD330: =(X330*4)+(Z330*2) -> 20
A331: DANDENONG | C331: 6 | D331: 5 | E331: =C331*6+D331 -> 41 | G331: 8 | H331: 6 | I331: =G331*6+H331 -> 54 | K331: 9 | L331: 9 | M331: =K331*6+L331 -> 63 | O331: 11 | P331: 11 | Q331: =O331*6+P331 -> 77 | W331: GEELONG WEST | X331: 4 | Y331: 7 | Z331: 0 | AA331: 1045 | AB331: 1173 | AC331: =(AA331*100)/AB331 -> 89.087809036658143 | AD331: =(X331*4)+(Z331*2) -> 16
A332: BEST PLAYERS
A333: OAKLEIGH
A334: DANDENONG
A335: GOALKICKERS
A336: OAKLEIGH
A337: DANDENONG
A339: SUNSHINE | C339: 4 | D339: 2 | E339: =C339*6+D339 -> 26 | G339: 10 | H339: 4 | I339: =G339*6+H339 -> 64 | K339: 14 | L339: 6 | M339: =K339*6+L339 -> 90 | O339: 19 | P339: 8 | Q339: =O339*6+P339 -> 122 | S339: SUNSHINE
A340: CAMBERWELL | C340: 2 | D340: 4 | E340: =C340*6+D340 -> 16 | G340: 3 | H340: 7 | I340: =G340*6+H340 -> 25 | K340: 5 | L340: 8 | M340: =K340*6+L340 -> 38 | O340: 10 | P340: 13 | Q340: =O340*6+P340 -> 73
A341: BEST PLAYERS
A342: SUNSHINE
A343: CAMBERWELL
A344: GOALKICKERS
A345: SUNSHINE
A346: CAMBERWELL
A348: ROUND 13 | E348: 10TH JULY | I348: WEATHER | S348: PLAYED AT
D349: 1ST QTR | H349: 2ND QTR | L349: 3RD QTR | P349: FINAL | S349: WERRIBEE
A350: WERRIBEE | C350: 6 | D350: 0 | E350: =C350*6+D350 -> 36 | G350: 10 | H350: 7 | I350: =G350*6+H350 -> 67 | K350: 17 | L350: 14 | M350: =K350*6+L350 -> 116 | O350: 27 | P350: 16 | Q350: =O350*6+P350 -> 178 | S350: UMPIRE | X350: LADDER | AB350: ROUND | AD350: 13
A351: CAMBERWELL | C351: 2 | D351: 3 | E351: =C351*6+D351 -> 15 | G351: 3 | H351: 4 | I351: =G351*6+H351 -> 22 | K351: 5 | L351: 5 | M351: =K351*6+L351 -> 35 | O351: 5 | P351: 6 | Q351: =O351*6+P351 -> 36
A352: BEST PLAYERS | W352: TEAM | X352: W | Y352: L | Z352: D | AA352: FOR | AB352: AGST | AC352: % | AD352: PTS
A353: WERRIBEE
A354: CAMBERWELL | W354: OAKLEIGH | X354: 9 | Y354: 3 | Z354: 0 | AA354: 1375 | AB354: 1146 | AC354: =(AA354*100)/AB354 -> 119.9825479930192 | AD354: =(X354*4)+(Z354*2) -> 36
A355: GOALKICKERS | W355: DANDENONG | X355: 6 | Y355: 5 | Z355: 1 | AA355: 1215 | AB355: 1104 | AC355: =(AA355*100)/AB355 -> 110.05434782608695 | AD355: =(X355*4)+(Z355*2) -> 26
A356: WERRIBEE | W356: WERRIBEE | X356: 6 | Y356: 6 | Z356: 0 | AA356: 1313 | AB356: 1239 | AC356: =(AA356*100)/AB356 -> 105.97255851493139 | AD356: =(X356*4)+(Z356*2) -> 24
A357: CAMBERWELL | W357: CAMBERWELL | X357: 5 | Y357: 7 | Z357: 0 | AA357: 1253 | AB357: 1363 | AC357: =(AA357*100)/AB357 -> 91.929567131327957 | AD357: =(X357*4)+(Z357*2) -> 20
A359: OAKLEIGH | C359: 3 | D359: 3 | E359: =C359*6+D359 -> 21 | G359: 7 | H359: 4 | I359: =G359*6+H359 -> 46 | K359: 11 | L359: 5 | M359: =K359*6+L359 -> 71 | O359: 18 | P359: 9 | Q359: =O359*6+P359 -> 117 | S359: OAKLEIGH | W359: SUNSHINE | X359: 5 | Y359: 7 | Z359: 0 | AA359: 1121 | AB359: 1297 | AC359: =(AA359*100)/AB359 -> 86.430223592906714 | AD359: =(X359*4)+(Z359*2) -> 20
A360: SUNSHINE | C360: 0 | D360: 1 | E360: =C360*6+D360 -> 1 | G360: 1 | H360: 4 | I360: =G360*6+H360 -> 10 | K360: 2 | L360: 7 | M360: =K360*6+L360 -> 19 | O360: 4 | P360: 9 | Q360: =O360*6+P360 -> 33 | W360: GEELONG WEST | X360: 4 | Y360: 7 | Z360: 1 | AA360: 1092 | AB360: 1220 | AC360: =(AA360*100)/AB360 -> 89.508196721311478 | AD360: =(X360*4)+(Z360*2) -> 18
A361: BEST PLAYERS
A362: OAKLEIGH
A363: SUNSHINE
A364: GOALKICKERS
A365: OAKLEIGH
A366: SUNSHINE
A368: DANDENONG | C368: 3 | D368: 2 | E368: =C368*6+D368 -> 20 | G368: 4 | H368: 4 | I368: =G368*6+H368 -> 28 | K368: 5 | L368: 10 | M368: =K368*6+L368 -> 40 | O368: 6 | P368: 11 | Q368: =O368*6+P368 -> 47 | S368: DANDENONG
A369: GEELONG WEST | C369: 0 | D369: 1 | E369: =C369*6+D369 -> 1 | G369: 5 | H369: 4 | I369: =G369*6+H369 -> 34 | K369: 7 | L369: 5 | M369: =K369*6+L369 -> 47 | O369: 7 | P369: 5 | Q369: =O369*6+P369 -> 47
A370: BEST PLAYERS
A371: DANDENONG
A372: GEELONG WEST
A373: GOALKICKERS
A374: DANDENONG
A375: GEELONG WEST
A377: ROUND 14 | E377: 17TH JULY | I377: WEATHER | S377: PLAYED AT
D378: 1ST QTR | H378: 2ND QTR | L378: 3RD QTR | P378: FINAL | S378: CAMBERWELL
A379: CAMBERWELL | C379: 8 | D379: 1 | E379: =C379*6+D379 -> 49 | G379: 10 | H379: 1 | I379: =G379*6+H379 -> 61 | K379: 12 | L379: 10 | M379: =K379*6+L379 -> 82 | O379: 13 | P379: 10 | Q379: =O379*6+P379 -> 88 | S379: UMPIRE | X379: LADDER | AB379: ROUND | AD379: 14
A380: OAKLEIGH | C380: 1 | D380: 2 | E380: =C380*6+D380 -> 8 | G380: 6 | H380: 5 | I380: =G380*6+H380 -> 41 | K380: 10 | L380: 7 | M380: =K380*6+L380 -> 67 | O380: 11 | P380: 10 | Q380: =O380*6+P380 -> 76
A381: BEST PLAYERS | W381: TEAM | X381: W | Y381: L | Z381: D | AA381: FOR | AB381: AGST | AC381: % | AD381: PTS
A382: CAMBERWELL
A383: OAKLEIGH | W383: OAKLEIGH | X383: 9 | Y383: 4 | Z383: 0 | AA383: 1451 | AB383: 1234 | AC383: =(AA383*100)/AB383 -> 117.58508914100486 | AD383: =(X383*4)+(Z383*2) -> 36
A384: GOALKICKERS | W384: WERRIBEE | X384: 7 | Y384: 6 | Z384: 0 | AA384: 1387 | AB384: 1292 | AC384: =(AA384*100)/AB384 -> 107.35294117647059 | AD384: =(X384*4)+(Z384*2) -> 28
A385: CAMBERWELL | W385: DANDENONG | X385: 6 | Y385: 6 | Z385: 1 | AA385: 1268 | AB385: 1178 | AC385: =(AA385*100)/AB385 -> 107.64006791171477 | AD385: =(X385*4)+(Z385*2) -> 26
A386: OAKLEIGH | W386: CAMBERWELL | X386: 6 | Y386: 7 | Z386: 0 | AA386: 1341 | AB386: 1439 | AC386: =(AA386*100)/AB386 -> 93.18971507991661 | AD386: =(X386*4)+(Z386*2) -> 24
A388: WERRIBEE | C388: 6 | D388: 2 | E388: =C388*6+D388 -> 38 | G388: 8 | H388: 2 | I388: =G388*6+H388 -> 50 | K388: 10 | L388: 6 | M388: =K388*6+L388 -> 66 | O388: 11 | P388: 8 | Q388: =O388*6+P388 -> 74 | S388: WERRIBEE | W388: SUNSHINE | X388: 6 | Y388: 7 | Z388: 0 | AA388: 1203 | AB388: 1370 | AC388: =(AA388*100)/AB388 -> 87.810218978102185 | AD388: =(X388*4)+(Z388*2) -> 24
A389: DANDENONG | C389: 1 | D389: 3 | E389: =C389*6+D389 -> 9 | G389: 2 | H389: 8 | I389: =G389*6+H389 -> 20 | K389: 5 | L389: 10 | M389: =K389*6+L389 -> 40 | O389: 7 | P389: 11 | Q389: =O389*6+P389 -> 53 | W389: GEELONG WEST | X389: 4 | Y389: 8 | Z389: 1 | AA389: 1165 | AB389: 1302 | AC389: =(AA389*100)/AB389 -> 89.477726574500764 | AD389: =(X389*4)+(Z389*2) -> 18
A390: BEST PLAYERS
A391: WERRIBEE
A392: DANDENONG
A393: GOALKICKERS
A394: WERRIBEE
A395: DANDENONG
A397: SUNSHINE | C397: 1 | D397: 2 | E397: =C397*6+D397 -> 8 | G397: 3 | H397: 4 | I397: =G397*6+H397 -> 22 | K397: 7 | L397: 7 | M397: =K397*6+L397 -> 49 | O397: 12 | P397: 10 | Q397: =O397*6+P397 -> 82 | S397: SUNSHINE
A398: GEELONG WEST | C398: 2 | D398: 2 | E398: =C398*6+D398 -> 14 | G398: 3 | H398: 4 | I398: =G398*6+H398 -> 22 | K398: 7 | L398: 9 | M398: =K398*6+L398 -> 51 | O398: 10 | P398: 13 | Q398: =O398*6+P398 -> 73
A399: BEST PLAYERS
A400: SUNSHINE
A401: GEELONG WEST
A402: GOALKICKERS
A403: SUNSHINE
A404: GEELONG WEST
A406: ROUND 15 | E406: 24TH JULY | I406: WEATHER | S406: PLAYED AT
D407: 1ST QTR | H407: 2ND QTR | L407: 3RD QTR | P407: FINAL | S407: GEELONG WEST
A408: GEELONG WEST | C408: 2 | D408: 5 | E408: =C408*6+D408 -> 17 | G408: 8 | H408: 7 | I408: =G408*6+H408 -> 55 | K408: 10 | L408: 10 | M408: =K408*6+L408 -> 70 | O408: 13 | P408: 12 | Q408: =O408*6+P408 -> 90 | S408: UMPIRE | X408: LADDER | AB408: ROUND | AD408: 15
A409: CAMBERWELL | C409: 0 | D409: 2 | E409: =C409*6+D409 -> 2 | G409: 1 | H409: 5 | I409: =G409*6+H409 -> 11 | K409: 3 | L409: 7 | M409: =K409*6+L409 -> 25 | O409: 4 | P409: 10 | Q409: =O409*6+P409 -> 34
A410: BEST PLAYERS | W410: TEAM | X410: W | Y410: L | Z410: D | AA410: FOR | AB410: AGST | AC410: % | AD410: PTS
A411: GEELONG WEST
A412: CAMBERWELL | W412: OAKLEIGH | X412: 10 | Y412: 4 | Z412: 0 | AA412: 1503 | AB412: 1256 | AC412: =(AA412*100)/AB412 -> 119.66560509554139 | AD412: =(X412*4)+(Z412*2) -> 40
A413: GOALKICKERS | W413: WERRIBEE | X413: 7 | Y413: 7 | Z413: 0 | AA413: 1409 | AB413: 1344 | AC413: =(AA413*100)/AB413 -> 104.83630952380952 | AD413: =(X413*4)+(Z413*2) -> 28
A414: GEELONG WEST | W414: SUNSHINE | X414: 7 | Y414: 7 | Z414: 0 | AA414: 1293 | AB414: 1393 | AC414: =(AA414*100)/AB414 -> 92.821249102656139 | AD414: =(X414*4)+(Z414*2) -> 28
A415: CAMBERWELL | W415: DANDENONG | X415: 6 | Y415: 7 | Z415: 1 | AA415: 1291 | AB415: 1268 | AC415: =(AA415*100)/AB415 -> 101.81388012618297 | AD415: =(X415*4)+(Z415*2) -> 26
A417: OAKLEIGH | C417: 4 | D417: 1 | E417: =C417*6+D417 -> 25 | G417: 4 | H417: 4 | I417: =G417*6+H417 -> 28 | K417: 5 | L417: 7 | M417: =K417*6+L417 -> 37 | O417: 7 | P417: 10 | Q417: =O417*6+P417 -> 52 | S417: OAKLEIGH | W417: CAMBERWELL | X417: 6 | Y417: 8 | Z417: 0 | AA417: 1375 | AB417: 1529 | AC417: =(AA417*100)/AB417 -> 89.928057553956833 | AD417: =(X417*4)+(Z417*2) -> 24
A418: WERRIBEE | C418: 3 | D418: 2 | E418: =C418*6+D418 -> 20 | G418: 3 | H418: 3 | I418: =G418*6+H418 -> 21 | K418: 3 | L418: 3 | M418: =K418*6+L418 -> 21 | O418: 3 | P418: 4 | Q418: =O418*6+P418 -> 22 | W418: GEELONG WEST | X418: 5 | Y418: 8 | Z418: 1 | AA418: 1255 | AB418: 1336 | AC418: =(AA418*100)/AB418 -> 93.937125748502993 | AD418: =(X418*4)+(Z418*2) -> 22
A419: BEST PLAYERS
A420: OAKLEIGH
A421: WERRIBEE
A422: GOALKICKERS
A423: OAKLEIGH
A424: WERRIBEE
A426: SUNSHINE | C426: 2 | D426: 4 | E426: =C426*6+D426 -> 16 | G426: 7 | H426: 7 | I426: =G426*6+H426 -> 49 | K426: 10 | L426: 10 | M426: =K426*6+L426 -> 70 | O426: 13 | P426: 12 | Q426: =O426*6+P426 -> 90 | S426: SUNSHINE
A427: DANDENONG | C427: 0 | D427: 0 | E427: =C427*6+D427 -> 0 | G427: 0 | H427: 0 | I427: =G427*6+H427 -> 0 | K427: 2 | L427: 1 | M427: =K427*6+L427 -> 13 | O427: 3 | P427: 5 | Q427: =O427*6+P427 -> 23
A428: BEST PLAYERS
A429: SUNSHINE
A430: DANDENONG
A431: GOALKICKERS
A432: SUNSHINE
A433: DANDENONG
A435: ROUND 16 | E435: 31ST JULY | I435: WEATHER | S435: PLAYED AT
D436: 1ST QTR | H436: 2ND QTR | L436: 3RD QTR | P436: FINAL | S436: OAKLEIGH
A437: OAKLEIGH | C437: 3 | D437: 1 | E437: =C437*6+D437 -> 19 | G437: 6 | H437: 2 | I437: =G437*6+H437 -> 38 | K437: 9 | L437: 9 | M437: =K437*6+L437 -> 63 | O437: 15 | P437: 14 | Q437: =O437*6+P437 -> 104 | S437: UMPIRE | X437: LADDER | AB437: ROUND | AD437: 16
A438: GEELONG WEST | C438: 1 | D438: 3 | E438: =C438*6+D438 -> 9 | G438: 3 | H438: 5 | I438: =G438*6+H438 -> 23 | K438: 8 | L438: 7 | M438: =K438*6+L438 -> 55 | O438: 11 | P438: 12 | Q438: =O438*6+P438 -> 78 | S438: FINDLAY/PRICE
A439: BEST PLAYERS | W439: TEAM | X439: W | Y439: L | Z439: D | AA439: FOR | AB439: AGST | AC439: % | AD439: PTS
A440: OAKLEIGH | C440: SUTHERLAND | G440: TODD | J440: BRIGGS | M440: OWEN | O440: VERBEEK | R440: CUNNINGHAM
A441: GEELONG WEST | C441: CHAPMAN | G441: TUCKER | J441: SIMPSON | M441: SIZER | O441: BERRY | W441: OAKLEIGH | X441: 11 | Y441: 4 | Z441: 0 | AA441: 1607 | AB441: 1334 | AC441: =(AA441*100)/AB441 -> 120.46476761619191 | AD441: =(X441*4)+(Z441*2) -> 44
A442: GOALKICKERS | W442: WERRIBEE | X442: 8 | Y442: 7 | Z442: 0 | AA442: 1548 | AB442: 1381 | AC442: =(AA442*100)/AB442 -> 112.09268645908762 | AD442: =(X442*4)+(Z442*2) -> 32
A443: OAKLEIGH | C443: PRETTO 4 | F443: SUTHERLAND 3 | I443: OWEN 3 | K443: ROURKE 2 | N443: VERBEEK | P443: BATTERSBY | S443: COWLED | W443: DANDENONG | X443: 7 | Y443: 7 | Z443: 1 | AA443: 1386 | AB443: 1337 | AC443: =(AA443*100)/AB443 -> 103.66492146596859 | AD443: =(X443*4)+(Z443*2) -> 30
A444: GEELONG WEST | C444: SIZER 5 | F444: DILLON | H444: PARKER | J444: FRASER | L444: WATT | N444: CHRISTENSEN | Q444: McCAFFEREY | W444: SUNSHINE | X444: 7 | Y444: 8 | Z444: 0 | AA444: 1330 | AB444: 1532 | AC444: =(AA444*100)/AB444 -> 86.814621409921671 | AD444: =(X444*4)+(Z444*2) -> 28
A446: DANDENONG | C446: 1 | D446: 4 | E446: =C446*6+D446 -> 10 | G446: 6 | H446: 6 | I446: =G446*6+H446 -> 42 | K446: 8 | L446: 8 | M446: =K446*6+L446 -> 56 | O446: 14 | P446: 11 | Q446: =O446*6+P446 -> 95 | S446: DANDENONG | W446: CAMBERWELL | X446: 6 | Y446: 9 | Z446: 0 | AA446: 1444 | AB446: 1624 | AC446: =(AA446*100)/AB446 -> 88.916256157635473 | AD446: =(X446*4)+(Z446*2) -> 24
A447: CAMBERWELL | C447: 2 | D447: 2 | E447: =C447*6+D447 -> 14 | G447: 3 | H447: 3 | I447: =G447*6+H447 -> 21 | K447: 5 | L447: 5 | M447: =K447*6+L447 -> 35 | O447: 10 | P447: 9 | Q447: =O447*6+P447 -> 69 | S447: PHILLIPS | W447: GEELONG WEST | X447: 5 | Y447: 9 | Z447: 1 | AA447: 1333 | AB447: 1440 | AC447: =(AA447*100)/AB447 -> 92.569444444444443 | AD447: =(X447*4)+(Z447*2) -> 22
A448: BEST PLAYERS | S448: RIDDIFORD
A449: DANDENONG | C449: TUFO | F449: LACKO | I449: LINDSAY | L449: WRIGHT | N449: NICHOLAS | Q449: BRUNNEN
A450: CAMBERWELL | C450: CONSTANTINOU | G450: GEURTS | I450: GREIG | L450: BUDGE
A451: GOALKICKERS
A452: DANDENONG | C452: WRIGHT 4 | F452: MARRA 4 | H452: COUSINS 2 | K452: NICHOLAS | N452: S PALLANT | Q452: BRUNNEN | S452: TUFO
A453: CAMBERWELL | C453: CONDON 3 | F453: CONSTANTINOU 2 | J453: GREIG 2 | L453: MODICA | N453: BINGLEY | P453: RAZUMS
A455: WERRIBEE | C455: 8 | D455: 3 | E455: =C455*6+D455 -> 51 | G455: 11 | H455: 3 | I455: =G455*6+H455 -> 69 | K455: 16 | L455: 4 | M455: =K455*6+L455 -> 100 | O455: 22 | P455: 7 | Q455: =O455*6+P455 -> 139 | S455: WERRIBEE
A456: SUNSHINE | C456: 1 | D456: 1 | E456: =C456*6+D456 -> 7 | G456: 2 | H456: 2 | I456: =G456*6+H456 -> 14 | K456: 5 | L456: 3 | M456: =K456*6+L456 -> 33 | O456: 5 | P456: 7 | Q456: =O456*6+P456 -> 37 | S456: HARVEY/DUNNE
A457: BEST PLAYERS
A458: WERRIBEE | C458: VASILOU | F458: HITCH | I458: McMASTER | L458: BONAT | N458: V GUINTA | Q458: GREY
A459: SUNSHINE | C459: NELSON | F459: LAWLER | I459: WRIGHT | L459: CUTAJAR
A460: GOALKICKERS
A461: WERRIBEE | C461: TAYLOR 7 | F461: SELLS 6 | H461: V GUINTA 2 | K461: GREY 2 | M461: HITCH | O461: GORDON | Q461: GUDDE | S461: ZUCCALI | U461: JACKSON
A462: SUNSHINE | C462: NELSON | E462: SHEPPERBOTTOM | I462: MITROVSKI | L462: WRIGHT | N462: CUTAJAR
A464: ROUND 17 | E464: 7TH AUGUST | I464: WEATHER | S464: PLAYED AT
D465: 1ST QTR | H465: 2ND QTR | L465: 3RD QTR | P465: FINAL | S465: WERRIBEE
A466: WERRIBEE | C466: 5 | D466: 4 | E466: =C466*6+D466 -> 34 | G466: 7 | H466: 9 | I466: =G466*6+H466 -> 51 | K466: 10 | L466: 18 | M466: =K466*6+L466 -> 78 | O466: 13 | P466: 20 | Q466: =O466*6+P466 -> 98 | S466: UMPIRE | X466: LADDER | AB466: ROUND | AD466: 17
A467: GEELONG WEST | C467: 2 | D467: 2 | E467: =C467*6+D467 -> 14 | G467: 4 | H467: 5 | I467: =G467*6+H467 -> 29 | K467: 5 | L467: 8 | M467: =K467*6+L467 -> 38 | O467: 7 | P467: 12 | Q467: =O467*6+P467 -> 54 | S467: GLEESON/PHILLIPS
A468: BEST PLAYERS | W468: TEAM | X468: W | Y468: L | Z468: D | AA468: FOR | AB468: AGST | AC468: % | AD468: PTS
A469: WERRIBEE | C469: VASILOU | F469: McMASTER | I469: S MOLONEY | L469: MONTGOMERY | O469: A GUINTA | R469: SELLS
A470: GEELONG WEST | C470: WATT | F470: SIMPSON | I470: BERY | L470: CHRISTENSEN | O470: FROST | W470: OAKLEIGH | X470: 12 | Y470: 4 | Z470: 0 | AA470: 1692 | AB470: 1389 | AC470: =(AA470*100)/AB470 -> 121.81425485961122 | AD470: =(X470*4)+(Z470*2) -> 48
A471: GOALKICKERS | W471: WERRIBEE | X471: 9 | Y471: 7 | Z471: 0 | AA471: 1646 | AB471: 1435 | AC471: =(AA471*100)/AB471 -> 114.70383275261324 | AD471: =(X471*4)+(Z471*2) -> 36
A472: WERRIBEE | C472: TAYLOR 3 | F472: BONAT 2 | H472: VASILOU 2 | J472: SELLS 2 | L472: MONTGOMERY 2 | O472: GORDON | Q472: ZOCCALI | W472: SUNSHINE | X472: 8 | Y472: 8 | Z472: 0 | AA472: 1449 | AB472: 1602 | AC472: =(AA472*100)/AB472 -> 90.449438202247194 | AD472: =(X472*4)+(Z472*2) -> 32
A473: GEELONG WEST | C473: WATT 3 | F473: TUCKER | I473: JEFFERIES | K473: McCAFFERY | N473: CHRISTENSEN | W473: DANDENONG | X473: 7 | Y473: 8 | Z473: 1 | AA473: 1441 | AB473: 1422 | AC473: =(AA473*100)/AB473 -> 101.33614627285513 | AD473: =(X473*4)+(Z473*2) -> 30
A475: SUNSHINE | C475: 2 | D475: 7 | E475: =C475*6+D475 -> 19 | G475: 7 | H475: 10 | I475: =G475*6+H475 -> 52 | K475: 13 | L475: 16 | M475: =K475*6+L475 -> 94 | O475: 17 | P475: 17 | Q475: =O475*6+P475 -> 119 | S475: SUNSHINE | W475: CAMBERWELL | X475: 6 | Y475: 10 | Z475: 0 | AA475: 1514 | AB475: 1743 | AC475: =(AA475*100)/AB475 -> 86.861732644865171 | AD475: =(X475*4)+(Z475*2) -> 24
A476: CAMBERWELL | C476: 1 | D476: 1 | E476: =C476*6+D476 -> 7 | G476: 6 | H476: 7 | I476: =G476*6+H476 -> 43 | K476: 8 | L476: 8 | M476: =K476*6+L476 -> 56 | O476: 10 | P476: 10 | Q476: =O476*6+P476 -> 70 | S476: FINLAY | W476: GEELONG WEST | X476: 5 | Y476: 10 | Z476: 1 | AA476: 1387 | AB476: 1538 | AC476: =(AA476*100)/AB476 -> 90.182054616384917 | AD476: =(X476*4)+(Z476*2) -> 22
A477: BEST PLAYERS
A478: SUNSHINE | C478: PROTETTO | F478: JOHNSON | I478: NELSON | L478: CUTAJAR | O478: SCANLON | R478: MITROVSKI
A479: CAMBERWELL | C479: GEURTS | F479: CONDON | I479: ANDERSON | L479: GREIG
A480: GOALKICKERS
A481: SUNSHINE | C481: NELSON 4 | F481: SCANLON 3 | I481: McQUALTER 2 | L481: MITROVSKI 2 | O481: WRIGHT | Q481: ROACH | S481: BUCK | U481: CADDAYE | W481: JOHNSON | X481: PROTETTO
A482: CAMBERWELL | C482: CONDON 6 | F482: VITACCO | I482: SAMIOS | K482: FREW | M482: DIPIERDOMENICO
A484: OAKLEIGH | C484: 5 | D484: 1 | E484: =C484*6+D484 -> 31 | G484: 6 | H484: 5 | I484: =G484*6+H484 -> 41 | K484: 10 | L484: 6 | M484: =K484*6+L484 -> 66 | O484: 12 | P484: 13 | Q484: =O484*6+P484 -> 85 | S484: OAKLEIGH
A485: DANDENONG | C485: 4 | D485: 1 | E485: =C485*6+D485 -> 25 | G485: 5 | H485: 3 | I485: =G485*6+H485 -> 33 | K485: 6 | L485: 5 | M485: =K485*6+L485 -> 41 | O485: 8 | P485: 7 | Q485: =O485*6+P485 -> 55 | S485: BROOKES/DUNNE
A486: BEST PLAYERS
A487: OAKLEIGH | C487: WALSH | F487: OWEN | H487: SUTHERLAND | K487: SMITH | M487: TODD | O487: BATTERSBY
A488: DANDENONG | C488: LACKO | F488: MERRIGAN | I488: LINDSAY | K488: HALL | M488: BRUNNEN | O488: KANNOURAKIS
A489: GOALKICKERS
A490: OAKLEIGH | C490: OWEN 3 | E490: ATHERTON 2 | H490: PRETTO 2 | J490: SIMPSON | M490: RYAN | O490: GARBUIO | R490: JOHNSON | T490: VERBEEK
A491: DANDENONG | C491: TUFO 3 | E491: BRUNNEN | H491: COUSINS | J491: LACKO | L491: NICHOLAS | O491: WRIGHT
A493: ROUND 18 | E493: 14TH AUGUST | I493: WEATHER | S493: PLAYED AT
D494: 1ST QTR | H494: 2ND QTR | L494: 3RD QTR | P494: FINAL | S494: OAKLEIGH
A495: OAKLEIGH | C495: 5 | D495: 2 | E495: =C495*6+D495 -> 32 | G495: 7 | H495: 5 | I495: =G495*6+H495 -> 47 | K495: 9 | L495: 11 | M495: =K495*6+L495 -> 65 | O495: 16 | P495: 15 | Q495: =O495*6+P495 -> 111 | S495: UMPIRE | X495: LADDER | AB495: ROUND | AD495: 18
A496: SUNSHINE | C496: 2 | D496: 3 | E496: =C496*6+D496 -> 15 | G496: 3 | H496: 7 | I496: =G496*6+H496 -> 25 | K496: 7 | L496: 10 | M496: =K496*6+L496 -> 52 | O496: 11 | P496: 12 | Q496: =O496*6+P496 -> 78 | S496: BLACK/GLEESON
A497: BEST PLAYERS | W497: TEAM | X497: W | Y497: L | Z497: D | AA497: FOR | AB497: AGST | AC497: % | AD497: PTS
A498: OAKLEIGH | C498: TODD | E498: VERBEEK | H498: OWEN | K498: ATHERTON | N498: PRETTO | Q498: SMITH
A499: SUNSHINE | C499: PROTETTO | E499: JOHNSON | H499: WRIGHT | K499: SCANLON | N499: KING | Q499: CADDAYE | W499: OAKLEIGH | X499: 13 | Y499: 4 | Z499: 0 | AA499: 1803 | AB499: 1467 | AC499: =(AA499*100)/AB499 -> 122.9038854805726 | AD499: =(X499*4)+(Z499*2) -> 52
A500: GOALKICKERS | W500: WERRIBEE | X500: 10 | Y500: 7 | Z500: 0 | AA500: 1729 | AB500: 1516 | AC500: =(AA500*100)/AB500 -> 114.05013192612137 | AD500: =(X500*4)+(Z500*2) -> 40
A501: OAKLEIGH | C501: PRETTO 7 | E501: ATHERTON 5 | H501: GARBUIO 2 | K501: SIMPSON | M501: COWLED | W501: SUNSHINE | X501: 8 | Y501: 9 | Z501: 0 | AA501: 1527 | AB501: 1713 | AC501: =(AA501*100)/AB501 -> 89.141856392294216 | AD501: =(X501*4)+(Z501*2) -> 32
A502: SUNSHINE | C502: CADDAYE 2 | F502: GREGSON 2 | I502: SCANLON 2 | L502: JOHNSON 2 | O502: WRIGHT | Q502: BEER | S502: McQUALTER | W502: DANDENONG | X502: 7 | Y502: 9 | Z502: 1 | AA502: 1563 | AB502: 1574 | AC502: =(AA502*100)/AB502 -> 99.301143583227443 | AD502: =(X502*4)+(Z502*2) -> 30
W503: GEELONG WEST | X503: 6 | Y503: 10 | Z503: 1 | AA503: 1539 | AB503: 1660 | AC503: =(AA503*100)/AB503 -> 92.710843373493972 | AD503: =(X503*4)+(Z503*2) -> 26
A504: GEELONG WEST | C504: 5 | D504: 5 | E504: =C504*6+D504 -> 35 | G504: 6 | H504: 13 | I504: =G504*6+H504 -> 49 | K504: 13 | L504: 18 | M504: =K504*6+L504 -> 96 | O504: 22 | P504: 20 | Q504: =O504*6+P504 -> 152 | S504: GEELONG WEST | W504: CAMBERWELL | X504: 6 | Y504: 11 | Z504: 0 | AA504: 1595 | AB504: 1826 | AC504: =(AA504*100)/AB504 -> 87.349397590361448 | AD504: =(X504*4)+(Z504*2) -> 24
A505: DANDENONG | C505: 6 | D505: 4 | E505: =C505*6+D505 -> 40 | G505: 10 | H505: 6 | I505: =G505*6+H505 -> 66 | K505: 16 | L505: 10 | M505: =K505*6+L505 -> 106 | O505: 18 | P505: 14 | Q505: =O505*6+P505 -> 122 | S505: S McDONALD
A506: BEST PLAYERS | S506: N McDONALD
A507: GEELONG WEST | C507: CHAPMAN | F507: CHRISTENSEN | I507: TUCKER | L507: YATES | N507: GIBBONS | Q507: WATT
A508: DANDENONG | C508: MILLIGAN | F508: LINDSAY | I508: MILLANE | L508: LACKO | N508: BRUNNEN | Q508: HALL
A509: GOALKICKERS
A510: GEELONG WEST | C510: SIZER 4 | E510: JEFFERIES 4 | H510: WATT 3 | J510: DILLON 2 | L510: FAZIO 2 | N510: FROST 2 | P510: TUCKER | R510: FRASER | U510: WEBSTER | X510: CHRISTENSEN | AA510: YATES
A511: DANDENONG | C511: MILLANE 5 | F511: LACKO 4 | H511: HALL 3 | J511: WRIGHT 2 | M511: BRUNNEN | P511: MILLIGAN | R511: TUFO | T511: ?1
A513: WERRIBEE | C513: 0 | D513: 6 | E513: =C513*6+D513 -> 6 | G513: 5 | H513: 13 | I513: =G513*6+H513 -> 43 | K513: 7 | L513: 14 | M513: =K513*6+L513 -> 56 | O513: 11 | P513: 17 | Q513: =O513*6+P513 -> 83 | S513: WERRIBEE
A514: CAMBERWELL | C514: 4 | D514: 5 | E514: =C514*6+D514 -> 29 | G514: 6 | H514: 8 | I514: =G514*6+H514 -> 44 | K514: 9 | L514: 15 | M514: =K514*6+L514 -> 69 | O514: 11 | P514: 15 | Q514: =O514*6+P514 -> 81 | S514: CARUSO/RIDDIFORD
A515: BEST PLAYERS
A516: WERRIBEE | C516: BURKE | F516: D MONTGOMERY | J516: VASILOU | M516: MADIGAN | P516: A GUINTA | S516: TAYLOR
A517: CAMBERWELL | C517: GEURTS | F517: GREIG | J517: ANDERSON | M517: FREW | P517: BUDGE | S517: GRAY
A518: GOALKICKERS
A519: WERRIBEE | C519: TAYLOR 2 | F519: V GUINTA 2 | I519: RADCLIFFE 2 | L519: JACKSON | N519: SINNOTT | Q519: SELLS | S519: GREY | U519: D MONTGOMERY
A520: CAMBERWELL | C520: GREIG 3 | E520: KINK 2 | G520: CONDON | I520: McCULLOCH | L520: McGHEE | N520: MULLINS | Q520: T VTACCA | T520: GLAZEBROOK
A522: ROUND 19 | E522: 21ST AUGUST | I522: WEATHER | S522: PLAYED AT
D523: 1ST QTR | H523: 2ND QTR | L523: 3RD QTR | P523: FINAL | S523: OAKLEIGH
A524: OAKLEIGH | C524: 3 | D524: 3 | E524: =C524*6+D524 -> 21 | G524: 3 | H524: 8 | I524: =G524*6+H524 -> 26 | K524: 6 | L524: 9 | M524: =K524*6+L524 -> 45 | O524: 7 | P524: 10 | Q524: =O524*6+P524 -> 52 | S524: UMPIRE | X524: LADDER | AB524: ROUND | AD524: 19
A525: CAMBERWELL | C525: 3 | D525: 0 | E525: =C525*6+D525 -> 18 | G525: 5 | H525: 4 | I525: =G525*6+H525 -> 34 | K525: 6 | L525: 5 | M525: =K525*6+L525 -> 41 | O525: 6 | P525: 5 | Q525: =O525*6+P525 -> 41 | S525: DUNNE/RIDDIFORD
A526: BEST PLAYERS | W526: TEAM | X526: W | Y526: L | Z526: D | AA526: FOR | AB526: AGST | AC526: % | AD526: PTS
A527: OAKLEIGH | C527: SMITH | E527: VERBEEK | H527: OWEN | K527: BATTERSBY | N527: WALSH | Q527: MARSHALL
A528: CAMBERWELL | C528: FREW | E528: CONSTANTINOU | H528: CONDON | K528: BUDGE | N528: GREIG | Q528: GEURTS | W528: OAKLEIGH | X528: 14 | Y528: 4 | Z528: 0 | AA528: 1855 | AB528: 1508 | AC528: =(AA528*100)/AB528 -> 123.0106100795756 | AD528: =(X528*4)+(Z528*2) -> 56
A529: GOALKICKERS | W529: WERRIBEE | X529: 10 | Y529: 8 | Z529: 0 | AA529: 1763 | AB529: 1631 | AC529: =(AA529*100)/AB529 -> 108.09319435928877 | AD529: =(X529*4)+(Z529*2) -> 40
A530: OAKLEIGH | C530: TODD 3 | F530: VERBEEK 2 | I530: ATHERTON | L530: COWLED | W530: DANDENONG | X530: 8 | Y530: 9 | Z530: 1 | AA530: 1678 | AB530: 1608 | AC530: =(AA530*100)/AB530 -> 104.35323383084577 | AD530: =(X530*4)+(Z530*2) -> 34
A531: CAMBERWELL | C531: CONDON 4 | F531: MITCHELL | I531: GREIG | W531: SUNSHINE | X531: 8 | Y531: 10 | Z531: 0 | AA531: 1598 | AB531: 1785 | AC531: =(AA531*100)/AB531 -> 89.523809523809518 | AD531: =(X531*4)+(Z531*2) -> 32
A533: DANDENONG | C533: 3 | D533: 0 | E533: =C533*6+D533 -> 18 | G533: 10 | H533: 5 | I533: =G533*6+H533 -> 65 | K533: 13 | L533: 9 | M533: =K533*6+L533 -> 87 | O533: 17 | P533: 13 | Q533: =O533*6+P533 -> 115 | S533: DANDENONG | W533: GEELONG WEST | X533: 7 | Y533: 10 | Z533: 1 | AA533: 1611 | AB533: 1731 | AC533: =(AA533*100)/AB533 -> 93.067590987868286 | AD533: =(X533*4)+(Z533*2) -> 30
A534: WERRIBEE | C534: 3 | D534: 1 | E534: =C534*6+D534 -> 19 | G534: 4 | H534: 2 | I534: =G534*6+H534 -> 26 | K534: 5 | L534: 4 | M534: =K534*6+L534 -> 34 | O534: 5 | P534: 4 | Q534: =O534*6+P534 -> 34 | S534: BROOKES/HOLT | W534: CAMBERWELL | X534: 6 | Y534: 12 | Z534: 0 | AA534: 1636 | AB534: 1878 | AC534: =(AA534*100)/AB534 -> 87.11395101171459 | AD534: =(X534*4)+(Z534*2) -> 24
A535: BEST PLAYERS
A536: DANDENONG | C536: POLA | E536: HALL | H536: LINDSAY | K536: MARRA | M536: BRUNNEN | P536: HILL
A537: WERRIBEE | C537: McMASTER | F537: GREY | H537: ZOCCALI
A538: GOALKICKERS
A539: DANDENONG | C539: WRIGHT 4 | E539: POLA 3 | G539: MARRA 3 | I539: BRUNNEN 3 | L539: LINDSAY | N539: MILLANE | P539: MILLIGAN | R539: WESTCOTT
A540: WERRIBEE | C540: TAYLOR 2 | F540: WALPOLE | I540: GREY | K540: GORDON
A542: GEELONG WEST | C542: 4 | D542: 4 | E542: =C542*6+D542 -> 28 | G542: 6 | H542: 5 | I542: =G542*6+H542 -> 41 | K542: 7 | L542: 10 | M542: =K542*6+L542 -> 52 | O542: 10 | P542: 12 | Q542: =O542*6+P542 -> 72 | S542: GEELONG WEST
A543: SUNSHINE | C543: 0 | D543: 2 | E543: =C543*6+D543 -> 2 | G543: 4 | H543: 7 | I543: =G543*6+H543 -> 31 | K543: 6 | L543: 9 | M543: =K543*6+L543 -> 45 | O543: 9 | P543: 17 | Q543: =O543*6+P543 -> 71 | S543: CARUSO/McDONALD
A544: BEST PLAYERS
A545: GEELONG WEST | C545: KOL | E545: CHAPMAN | H545: SIZER | K545: FRASER | M545: GIBBONS
A546: SUNSHINE | C546: CUTAJAR | E546: GREGSON | H546: McQUALTER | K546: WRIGHT
A547: GOALKICKERS
A548: GEELONG WEST | C548: SIZER 2 | E548: MACHAR 2 | H548: McCAFFEREY 2 | K548: FAZIO | M548: FRASER | O548: KOL | Q548: WATT
A549: SUNSHINE | C549: BROWN 2 | F549: LITCHFIELD 2 | I549: SHEPPERBOTTOM 2 | M549: JOHNSON | O549: McQUALTER | R549: PROTETTO
A551: FINALS
A552: 1ST SEMI | E552: 28TH AUGUST | I552: WEATHER | S552: PLAYED AT
D553: 1ST QTR | H553: 2ND QTR | L553: 3RD QTR | P553: FINAL
A554: SUNSHINE | C554: 1 | D554: 3 | E554: =C554*6+D554 -> 9 | G554: 2 | H554: 5 | I554: =G554*6+H554 -> 17 | K554: 8 | L554: 9 | M554: =K554*6+L554 -> 57 | O554: 15 | P554: 10 | Q554: =O554*6+P554 -> 100 | S554: UMPIRE
A555: DANDENONG | C555: 5 | D555: 3 | E555: =C555*6+D555 -> 33 | G555: 9 | H555: 9 | I555: =G555*6+H555 -> 63 | K555: 10 | L555: 13 | M555: =K555*6+L555 -> 73 | O555: 11 | P555: 13 | Q555: =O555*6+P555 -> 79
A556: BEST PLAYERS
A557: SUNSHINE
A558: DANDENONG
A559: GOALKICKERS
A560: SUNSHINE
A561: DANDENONG
A563: 2ND SEMI | E563: 4TH SEPTEMBER | I563: WEATHER
A564: OAKLEIGH | C564: 2 | D564: 4 | E564: =C564*6+D564 -> 16 | G564: 6 | H564: 10 | I564: =G564*6+H564 -> 46 | K564: 8 | L564: 16 | M564: =K564*6+L564 -> 64 | O564: 14 | P564: 18 | Q564: =O564*6+P564 -> 102
A565: WERRIBEE | C565: 2 | D565: 2 | E565: =C565*6+D565 -> 14 | G565: 4 | H565: 5 | I565: =G565*6+H565 -> 29 | K565: 5 | L565: 6 | M565: =K565*6+L565 -> 36 | O565: 7 | P565: 7 | Q565: =O565*6+P565 -> 49
A566: BEST PLAYERS
A567: OAKLEIGH
A568: WERRIBEE
A569: GOALKICKERS
A570: OAKLEIGH
A571: WERRIBEE
A573: PRELIMINARY | E573: 11TH SEPTEMBER | I573: WEATHER
A574: SUNSHINE | C574: 2 | D574: 2 | E574: =C574*6+D574 -> 14 | G574: 11 | H574: 5 | I574: =G574*6+H574 -> 71 | K574: 14 | L574: 7 | M574: =K574*6+L574 -> 91 | O574: 15 | P574: 8 | Q574: =O574*6+P574 -> 98 | S574: WERRIBEE
A575: WERRIBEE | C575: 3 | D575: 3 | E575: =C575*6+D575 -> 21 | G575: 4 | H575: 6 | I575: =G575*6+H575 -> 30 | K575: 9 | L575: 13 | M575: =K575*6+L575 -> 67 | O575: 13 | P575: 16 | Q575: =O575*6+P575 -> 94 | S575: MARSHALL/HARVEY
A576: BEST PLAYERS
A577: SUNSHINE | C577: PROTETTO | F577: NELSON | I577: CADDAYE | L577: SCANLON | O577: LAWLER | Q577: CUTAJAR
A578: WERRIBEE | C578: GREY | F578: A GUINTA | I578: V GUINTA | L578: MOLONEY | O578: MONTGOMERY | R578: SELLS
A579: GOALKICKERS
A580: SUNSHINE | C580: NELSON 5 | F580: BUCK 3 | H580: SHEPPERBOTTOM 2 | L580: GREGSON 2 | N580: McQUALTER | Q580: LITCHFIELD | T580: PROTETTO
A581: WERRIBEE | C581: SELLS 3 | E581: MONTGOMERY 3 | I581: TAYLOR 2 | L581: JACKSON 2 | N581: VASILOU | Q581: GREY | S581: GORDON
A583: GRAND | E583: 18TH SEPTEMBER | I583: WEATHER
A584: OAKLEIGH | C584: 4 | D584: 4 | E584: =C585*6+D585 -> 28 | G584: 11 | H584: 5 | I584: =G585*6+H585 -> 71 | K584: 18 | L584: 14 | M584: =K585*6+L585 -> 122 | O584: 22 | P584: 17 | Q584: =O585*6+P585 -> 149
A585: SUNSHINE | C585: 1 | D585: 3 | E585: =C586*6+D586 -> 9 | G585: 6 | H585: 6 | I585: =G586*6+H586 -> 42 | K585: 11 | L585: 6 | M585: =K586*6+L586 -> 72 | O585: 15 | P585: 9 | Q585: =O586*6+P586 -> 99
A586: BEST PLAYERS
A587: OAKLEIGH
A588: SUNSHINE
A589: GOALKICKERS
A590: OAKLEIGH
A591: SUNSHINE