A1: Victorian Football Association
A2: Season 1989 - Division One
A3: © Copyright Wal Williams | F3: First created: 14 November 2015
A4: Contact: joywalwi at gmail dot com | F4: Last updated: 13 June 2016 | W4: VFA Results and tables - Link to the main index page
A5: You are free to copy this document in whole or part provided that proper acknowledgement is given to the author. All rights reserved.
A7: 1989 | C7: 1ST DIVISION
A8: ROUND 1 | D8: 8TH/9TH APRIL | I8: WEATHER | S8: VENUE: DANDENONG
D9: 1ST QTR | H9: 2ND QTR | L9: 3RD QTR | P9: FINAL | S9: UMPIRES
A10: SPRINGVALE | C10: 7 | D10: 5 | E10: 47 | G10: 17 | H10: 10 | I10: 112 | K10: 25 | L10: 18 | M10: 168 | O10: 32 | P10: 25 | Q10: 217 | S10: KHAN | Y10: LADDER | AC10: ROUND | AE10: 1
A11: DANDENONG | C11: 2 | D11: 1 | E11: 13 | G11: 3 | H11: 3 | I11: 21 | K11: 4 | L11: 5 | M11: 29 | O11: 7 | P11: 8 | Q11: 50 | S11: LAWLOR
A12: BEST PLAYERS | W12: TEAM | X12: P | Y12: W | Z12: L | AA12: D | AB12: FOR | AC12: AGST | AD12: % | AE12: PTS
A13: SPRINGVALE | C13: MAYLIN | F13: DUDLEY | I13: CLARK | L13: PALM | O13: STEWART | R13: ROBINSON
A14: DANDENONG | C14: LINDSAY | F14: LACKO | I14: ATKINSON | L14: J MARRA | O14: G MARRA | W14: SPRINGVALE | X14: 1 | Y14: 1 | Z14: 0 | AA14: 0 | AB14: 217 | AC14: 50 | AD14: =(AB14/AC14)*100 -> 434 | AE14: =(Y14*4)+(AA14*2) -> 4
A15: GOALKICKERS | K15: MORGAN 2 | M15: JEFFS 2 | O15: NORMAN 2 | Q15: PALM | W15: COBURG | X15: 1 | Y15: 1 | Z15: 0 | AA15: 0 | AB15: 167 | AC15: 66 | AD15: =(AB15/AC15)*100 -> 253.03030303030303 | AE15: =(Y15*4)+(AA15*2) -> 4
A16: SPRINGVALE | C16: STEWART 4 | F16: ROBINSON 4 | I16: SECCULL 4 | K16: ANDERSON 3 | N16: MAYLIN 3 | P16: PROSSER 3 | R16: CLARKE 2 | W16: WILLIAMSTOWN | X16: 1 | Y16: 1 | Z16: 0 | AA16: 0 | AB16: 197 | AC16: 114 | AD16: =(AB16/AC16)*100 -> 172.80701754385964 | AE16: =(Y16*4)+(AA16*2) -> 4
A17: DANDENONG | C17: G MARRA 3 | F17: COLLARD 2 | I17: LACKO | K17: ARGOON | W17: WERRIBEE | X17: 1 | Y17: 1 | Z17: 0 | AA17: 0 | AB17: 173 | AC17: 111 | AD17: =(AB17/AC17)*100 -> 155.85585585585585 | AE17: =(Y17*4)+(AA17*2) -> 4
S18: VENUE: OAKLEIGH | W18: BOX HILL | X18: 1 | Y18: 1 | Z18: 0 | AA18: 0 | AB18: 139 | AC18: 110 | AD18: =(AB18/AC18)*100 -> 126.36363636363637 | AE18: =(Y18*4)+(AA18*2) -> 4
A19: WILLIAMSTOWN | C19: 7 | D19: 6 | E19: 48 | G19: 15 | H19: 9 | I19: 99 | K19: 24 | L19: 11 | M19: 155 | O19: 30 | P19: 17 | Q19: 197 | S19: McDONALD
A20: OAKLEIGH | C20: 4 | D20: 6 | E20: 30 | G20: 8 | H20: 10 | I20: 58 | K20: 13 | L20: 10 | M20: 88 | O20: 17 | P20: 12 | Q20: 114 | S20: HOLT | W20: FRANKSTON | X20: 1 | Y20: 1 | Z20: 0 | AA20: 0 | AB20: 123 | AC20: 119 | AD20: =(AB20/AC20)*100 -> 103.36134453781514 | AE20: =(Y20*4)+(AA20*2) -> 4
A21: BEST PLAYERS | W21: BRUNSWICK | X21: 0 | Y21: 0 | Z21: 0 | AA21: 0 | AB21: 0 | AC21: 0 | AE21: =(Y21*4)+(AA21*2) -> 0
A22: WILLIAMSTOWN | C22: ROUND | F22: WHILLAS | I22: KENNY | L22: DELRE | O22: McTAGGART | W22: CAMBERWELL | X22: 0 | Y22: 0 | Z22: 0 | AA22: 0 | AB22: 0 | AC22: 0 | AE22: =(Y22*4)+(AA22*2) -> 0
A23: OAKLEIGH | C23: BRIGGS | F23: PRETTO | I23: TODD | L23: OWEN | O23: MITCHELSON | R23: GARBUIO | W23: PRAHRAN | X23: 1 | Y23: 0 | Z23: 1 | AA23: 0 | AB23: 119 | AC23: 123 | AD23: =(AB23/AC23)*100 -> 96.747967479674799 | AE23: =(Y23*4)+(AA23*2) -> 0
A24: GOALKICKERS | K24: PASTORE | M24: SWAN | O24: MORRISSEY | Q24: McTAGGART | W24: PRESTON | X24: 1 | Y24: 0 | Z24: 1 | AA24: 0 | AB24: 110 | AC24: 139 | AD24: =(AB24/AC24)*100 -> 79.136690647482013 | AE24: =(Y24*4)+(AA24*2) -> 0
A25: WILLIAMSTOWN | C25: KENNY 9 | E25: ROUND 4 | G25: SMITH 4 | I25: GHAZI 3 | K25: RICKMAN 2 | M25: GROENEWEGAN 2 | Q25: RAEBURN 2 | W25: SANDRINGHAM | X25: 1 | Y25: 0 | Z25: 1 | AA25: 0 | AB25: 111 | AC25: 173 | AD25: =(AB25/AC25)*100 -> 64.161849710982651 | AE25: =(Y25*4)+(AA25*2) -> 0
A26: OAKLEIGH | C26: PRETTO 9 | F26: ROACH 2 | H26: OWEN 2 | J26: GARBUIO | L26: HANKS | N26: SUTHERLAND | W26: OAKLEIGH | X26: 1 | Y26: 0 | Z26: 1 | AA26: 0 | AB26: 114 | AC26: 197 | AD26: =(AB26/AC26)*100 -> 57.868020304568525 | AE26: =(Y26*4)+(AA26*2) -> 0
S27: VENUE: PORT MELBOURNE | W27: PORT MELBOURNE | X27: 1 | Y27: 0 | Z27: 1 | AA27: 0 | AB27: 66 | AC27: 167 | AD27: =(AB27/AC27)*100 -> 39.520958083832333 | AE27: =(Y27*4)+(AA27*2) -> 0
A28: COBURG | C28: 5 | D28: 5 | E28: 35 | G28: 8 | H28: 8 | I28: 56 | K28: 16 | L28: 12 | M28: 108 | O28: 25 | P28: 17 | Q28: 167 | S28: VERGONA | W28: DANDEN0NG | X28: 1 | Y28: 0 | Z28: 1 | AA28: 0 | AB28: 50 | AC28: 217 | AD28: =(AB28/AC28)*100 -> 23.041474654377879 | AE28: =(Y28*4)+(AA28*2) -> 0
A29: PORT MELBOURNE | C29: 1 | D29: 2 | E29: 8 | G29: 4 | H29: 5 | I29: 29 | K29: 6 | L29: 5 | M29: 41 | O29: 10 | P29: 6 | Q29: 66 | S29: MORROW
A30: BEST PLAYERS
A31: COBURG | C31: RIENIETS | F31: ALLISON | I31: GUMLEY | L31: SHELDON | O31: ANGWIN
A32: PORT MELBOURNE | C32: PRITCHARD | F32: YORGEY | I32: RAINSFORD | L32: CARIS | O32: WHITZELL
A33: GOALKICKERS | K33: EADE | L33: LITTLER | N33: ANGWIN | P33: MONACO | R33: REYNOLDSON
A34: COBURG | C34: WILLIAMS 5 | F34: ALLISON 3 | I34: BASSETT 3 | L34: RIENIETS 2 | N34: DARBY 2 | P34: KAAKOUR 2 | R34: GUMLEY 2
A35: PORT MELBOURNE | C35: STREMPEL 3 | F35: MUTIMER 2 | I35: RICHARDS 2 | L35: RAINSFORD | O35: RICE | Q35: WHITZELL
A37: FRANKSTON | C37: 3 | D37: 7 | E37: 25 | G37: 7 | H37: 10 | I37: 52 | K37: 14 | L37: 13 | M37: 97 | O37: 18 | P37: 15 | Q37: 123 | S37: VENUE: TOORAK PARK
A38: PRAHRAN | C38: 2 | D38: 3 | E38: 15 | G38: 9 | H38: 5 | I38: 59 | K38: 14 | L38: 8 | M38: 92 | O38: 18 | P38: 11 | Q38: 119 | S38: P MARSHALL :DORE
A39: BEST PLAYERS
A40: FRANKSTON | C40: MARTIN | F40: SARAU | I40: VANDERMEER | L40: WATSON | O40: BROWN | Q40: GAMBLE
A41: PRAHRAN | C41: HAMILTON | F41: ELKINGTON | I41: KILEY | L41: McNICHOL | O41: FERGUS | Q41: W WALFORD
A42: GOALKICKERS
A43: FRANKSTON | C43: BROWN 7 | F43: BINGLEY 4 | I43: DUNBAR 2 | K43: P MARTIN 2 | N43: SARAU | P43: CROSS | R43: NIKAKIS
A44: PRAHRAN | C44: McNICHOLL 5 | F44: RYAN 4 | H44: FERGUS 4 | J44: EVANS 2 | L44: SOULOS 2 | N44: BENNETT
A46: BOX HILL | C46: 8 | D46: 1 | E46: 49 | G46: 13 | H46: 1 | I46: 79 | K46: 17 | L46: 6 | M46: 108 | O46: 22 | P46: 7 | Q46: 139 | S46: VENUE: PRESTON
A47: PRESTON | C47: 4 | D47: 2 | E47: 26 | G47: 7 | H47: 6 | I47: 48 | K47: 13 | L47: 10 | M47: 88 | O47: 16 | P47: 14 | Q47: 110 | S47: CHILDS :HOWLETT
A48: BEST PLAYERS
A49: BOX HILL | C49: LAWRIE | F49: BOLTON | I49: BANFIELD | L49: S HOGAN | O49: DWYER | R49: JOHNS
A50: PRESTON | C50: JORDAN | F50: BROWN | I50: HALAS | L50: PERCY | O50: DUNBAR | R50: OWEN
A51: GOALKICKERS
A52: BOX HILL | C52: BOLTON 6 | E52: S HOGAN 5 | H52: DONOHUE 2 | J52: JOHNS 2 | L52: NICHOLSON | N52: ZARAFA | P52: BUTTIFANT | R52: HOCKING | U52: LAWRIE | X52: GLEESON | AA52: SOLOMON
A53: PRESTON | C53: SHAW 6 | F53: JORDAN 4 | I53: HALAS 2 | K53: LUMICISI 2 | N53: BURROWS | Q53: PRITCHARD
A55: WERRIBEE | C55: 2 | D55: 2 | E55: 14 | G55: 9 | H55: 8 | I55: 62 | K55: 15 | L55: 13 | M55: 103 | O55: 26 | P55: 17 | Q55: 173 | S55: VENUE: BEACH ROAD
A56: SANDRINGHAM | C56: 1 | D56: 8 | E56: 14 | G56: 3 | H56: 10 | I56: 28 | K56: 13 | L56: 12 | M56: 90 | O56: 16 | P56: 15 | Q56: 111 | S56: SAWERS :TREZISE
A57: BEST PLAYERS
A58: WERRIBEE | C58: CHRISTIANSEN | F58: CHAPMAN | I58: HIGGINS | L58: SELLS | N58: MONTGOMERY | Q58: DOMBERG
A59: SANDRINGHAM | C59: McLEAN | F59: PRATT | I59: DALRYMPLE | L59: EAVES | N59: FISCHER | Q59: ERWIN
A60: GOALKICKERS
A61: WERRIBEE | C61: SELLS 9 | F61: TYQUIN 5 | I61: MONTGOMERY 5 | L61: VASILOU 3 | O61: LAMB 2 | Q61: HIGGINS | S61: WALSH
A62: SANDRINGHAM | C62: EAVES 4 | F62: E FISCHER 3 | I62: BERGMAN 3 | L62: WEST 2 | N62: DWYER | P62: HOWARD | R62: ERWIN | T62: ROSSBOROUGH
A64: BYES | D64: BRUNSWICK | H64: CAMBERWELL
A66: ROUND 2 | D66: 15TH/16TH APRIL | I66: WEATHER | S66: VENUE: COBURG
D67: 1ST QTR | H67: 2ND QTR | L67: 3RD QTR | P67: FINAL | S67: UMPIRES
A68: COBURG | C68: 7 | D68: 1 | E68: 43 | G68: 11 | H68: 7 | I68: 73 | K68: 19 | L68: 10 | M68: 124 | O68: 27 | P68: 19 | Q68: 181 | S68: KENNEDY | Y68: LADDER | AC68: ROUND | AE68: 2
A69: SANDRINGHAM | C69: 6 | D69: 3 | E69: 39 | G69: 8 | H69: 4 | I69: 52 | K69: 12 | L69: 10 | M69: 82 | O69: 13 | P69: 10 | Q69: 88 | S69: HOWLETT
A70: BEST PLAYERS | W70: TEAM | X70: P | Y70: W | Z70: L | AA70: D | AB70: FOR | AC70: AGST | AD70: % | AE70: PTS
A71: COBURG | C71: LANGAN | F71: RIENIETS | I71: WILLIAMS | L71: KAAKOUR | O71: ANGWIN
A72: SANDRINGHAM | C72: McCARTHY | F72: ALLEN | I72: WEST | L72: RUGOLO | O72: FISCHER | R72: BONNEY | W72: SPRINGVALE | X72: 2 | Y72: 2 | Z72: 0 | AA72: 0 | AB72: 422 | AC72: 131 | AD72: =(AB72/AC72)*100 -> 322.13740458015263 | AE72: =(Y72*4)+(AA72*2) -> 8
A73: GOALKICKERS | K73: GUMLEY 2 | M73: ALLISON | O73: EADE | P73: MONACO | W73: COBURG | X73: 2 | Y73: 2 | Z73: 0 | AA73: 0 | AB73: 348 | AC73: 154 | AD73: =(AB73/AC73)*100 -> 225.97402597402598 | AE73: =(Y73*4)+(AA73*2) -> 8
A74: COBURG | C74: WILLIAMS 7 | F74: KAAKOUR 4 | I74: REYNOLDSON 4 | L74: LANGAN 3 | N74: RIENIETS 2 | Q74: DARBY 2 | W74: WILLIAMSTOWN | X74: 2 | Y74: 2 | Z74: 0 | AA74: 0 | AB74: 312 | AC74: 172 | AD74: =(AB74/AC74)*100 -> 181.3953488372093 | AE74: =(Y74*4)+(AA74*2) -> 8
A75: SANDRINGHAM | C75: EAVES 2 | E75: E FISCHER 2 | H75: BERGMAN 2 | J75: J RUGOLO 2 | M75: BRIAN SAID | P75: BENNETT | W75: FRANKSTON | X75: 2 | Y75: 2 | Z75: 0 | AA75: 0 | AB75: 334 | AC75: 194 | AD75: =(AB75/AC75)*100 -> 172.16494845360825 | AE75: =(Y75*4)+(AA75*2) -> 8
N76: ALLEN | P76: DALRYMPLE | S76: VENUE: BOX HILL | W76: BOX HILL | X76: 2 | Y76: 2 | Z76: 0 | AA76: 0 | AB76: 281 | AC76: 216 | AD76: =(AB76/AC76)*100 -> 130.09259259259258 | AE76: =(Y76*4)+(AA76*2) -> 8
A77: BOX HILL | C77: 3 | D77: 5 | E77: 23 | G77: 7 | H77: 11 | I77: 53 | K77: 15 | L77: 16 | M77: 106 | O77: 20 | P77: 22 | Q77: 142 | S77: HOLT
A78: DANDENONG | C78: 6 | D78: 4 | E78: 40 | G78: 11 | H78: 9 | I78: 75 | K78: 11 | L78: 11 | M78: 77 | O78: 17 | P78: 14 | Q78: 116 | S78: COATES | W78: BRUNSWICK | X78: 1 | Y78: 1 | Z78: 0 | AA78: 0 | AB78: 131 | AC78: 93 | AD78: =(AB78/AC78)*100 -> 140.86021505376345 | AE78: =(Y78*4)+(AA78*2) -> 4
A79: BEST PLAYERS | W79: WERRIBEE | X79: 2 | Y79: 1 | Z79: 1 | AA79: 0 | AB79: 299 | AC79: 243 | AD79: =(AB79/AC79)*100 -> 123.04526748971195 | AE79: =(Y79*4)+(AA79*2) -> 4
A80: BOX HILL | C80: ZARAFA | F80: HICKS | I80: NICHOLSON | L80: LAWRIE | O80: HOCKING | W80: PORT MELBOURNE | X80: 2 | Y80: 1 | Z80: 1 | AA80: 0 | AB80: 198 | AC80: 293 | AD80: =(AB80/AC80)*100 -> 67.576791808873722 | AE80: =(Y80*4)+(AA80*2) -> 4
A81: DANDENONG | C81: LACKO | F81: HILL | I81: ATKINSON | L81: MILLANE | O81: G MARRA | R81: MERRIGAN | W81: PRESTON | X81: 2 | Y81: 0 | Z81: 2 | AA81: 0 | AB81: 168 | AC81: 254 | AD81: =(AB81/AC81)*100 -> 66.141732283464577 | AE81: =(Y81*4)+(AA81*2) -> 0
A82: GOALKICKERS | O82: McMAHON | Q82: HICKS | R82: REEVES | W82: OAKLEIGH | X82: 2 | Y82: 0 | Z82: 2 | AA82: 0 | AB82: 207 | AC82: 328 | AD82: =(AB82/AC82)*100 -> 63.109756097560975 | AE82: =(Y82*4)+(AA82*2) -> 0
A83: BOX HILL | C83: ZARAFA 6 | E83: DONOHUE 3 | H83: BOLTON 2 | J83: BUTTIFANT 2 | M83: LAWRIE 2 | O83: HOGAN | Q83: GLEESON | W83: PRAHRAN | X83: 2 | Y83: 0 | Z83: 2 | AA83: 0 | AB83: 200 | AC83: 328 | AD83: =(AB83/AC83)*100 -> 60.975609756097562 | AE83: =(Y83*4)+(AA83*2) -> 0
A84: DANDENONG | C84: HILL 5 | E84: G MARRA 4 | H84: COLLARD 2 | K84: MYNOTT 2 | M84: LACKO | O84: ARGOON | Q84: TURNER | W84: SANDRINGHAM | X84: 2 | Y84: 0 | Z84: 2 | AA84: 0 | AB84: 199 | AC84: 354 | AD84: =(AB84/AC84)*100 -> 56.21468926553672 | AE84: =(Y84*4)+(AA84*2) -> 0
O85: KANNOURAKIS | S85: VENUE: FRANKSTON | W85: DANDEN0NG | X85: 2 | Y85: 0 | Z85: 2 | AA85: 0 | AB85: 166 | AC85: 359 | AD85: =(AB85/AC85)*100 -> 46.239554317548745 | AE85: =(Y85*4)+(AA85*2) -> 0
A86: FRANKSTON | C86: 7 | D86: 4 | E86: 46 | G86: 16 | H86: 9 | I86: 105 | K86: 24 | L86: 11 | M86: 155 | O86: 32 | P86: 19 | Q86: 211 | S86: LAWLOR | W86: CAMBERWELL | X86: 1 | Y86: 0 | Z86: 1 | AA86: 0 | AB86: 75 | AC86: 211 | AD86: =(AB86/AC86)*100 -> 35.545023696682463 | AE86: =(Y86*4)+(AA86*2) -> 0
A87: CAMBERWELL | C87: 3 | D87: 2 | E87: 20 | G87: 5 | H87: 4 | I87: 34 | K87: 8 | L87: 8 | M87: 56 | O87: 11 | P87: 9 | Q87: 75 | S87: ANTHONY
A88: BEST PLAYERS
A89: FRANKSTON | C89: MARTIN | F89: FOYSTER | I89: D O'BRIEN | L89: BINGLEY | O89: LOUTTIT
A90: CAMBERWELL | C90: BUDGE | F90: SULLIVAN | I90: DIPIERDOMENICO | L90: VITACCA | O90: JONES
A91: GOALKICKERS | N91: HORNER | P91: VANDERMEER | S91: GAHAN
A92: FRANKSTON | C92: NIKAKIS 7 | E92: TYRELL 4 | G92: MACE 4 | I92: BINGLEY 4 | K92: P MARTIN 3 | N92: FOYSTER 3 | Q92: BROWN 2 | S92: SMITH 2
A93: CAMBERWELL | C93: SULLIVAN 3 | F93: O'SULLIVAN 2 | I93: T VITACCA | L93: STAMP | N93: H MITCHELL | Q93: TORPY | S93: GREIG | U93: GLAZEBROOK
A95: WILLIAMSTOWN | C95: 4 | D95: 1 | E95: 25 | G95: 8 | H95: 4 | I95: 52 | K95: 10 | L95: 5 | M95: 65 | O95: 17 | P95: 13 | Q95: 115 | S95: VENUE: WILLIAMSTOWN
A96: PRESTON | C96: 2 | D96: 1 | E96: 13 | G96: 4 | H96: 2 | I96: 26 | K96: 8 | L96: 7 | M96: 55 | O96: 8 | P96: 10 | Q96: 58 | S96: MORROW :VERGONA
A97: BEST PLAYERS
A98: WILLIAMSTOWN | C98: WHILLAS | F98: McTAGGART | I98: DELRE | L98: SLEVISON | O98: ROUND | Q98: NILSSEN
A99: PRESTON | C99: HUNT | F99: WATT | I99: NICOLAOU | L99: PLOWMAN | O99: LAWSON | Q99: BROWN
A100: GOALKICKERS
A101: WILLIAMSTOWN | C101: RICKMAN 5 | F101: GHAZI 2 | H101: McTAGGART 2 | K101: AZIZ 2 | M101: McGOWAN 2 | P101: ROUND | R101: GROENEWEGAN | W101: RAEBURN | Y101: MORRISSEY
A102: PRESTON | C102: LUMICIOSI 4 | F102: SHAW | H102: HUNT | J102: DUNBAR | M102: NICOLAOU
A104: BRUNSWICK | C104: 2 | D104: 7 | E104: 19 | G104: 10 | H104: 9 | I104: 69 | K104: 14 | L104: 14 | M104: 98 | O104: 19 | P104: 17 | Q104: 131 | S104: VENUE: BRUNSWICK
A105: OAKLEIGH | C105: 2 | D105: 6 | E105: 18 | G105: 5 | H105: 8 | I105: 38 | K105: 8 | L105: 10 | M105: 58 | O105: 13 | P105: 15 | Q105: 93 | S105: CHILDS :FALLETT
A106: BEST PLAYERS
A107: BRUNSWICK | C107: CONNELL | F107: THOROGOOD | I107: WRIGHT | L107: SALVADORE | O107: JONES | R107: GRIFFITHS
A108: OAKLEIGH | C108: BULTE | F108: TODD | I108: OWEN | L108: KLIBINGAITIS | O108: MITCHELSON | R108: ATHERTON
A109: GOALKICKERS
A110: BRUNSWICK | C110: GRIFFITHS 7 | F110: JONES 4 | H110: BONE 2 | J110: HERBERT | L110: WRIGHT | N110: CALLANDER | Q110: CLARKE | S110: HYSLOP | U110: SALVADORE
A111: OAKLEIGH | C111: PRETTO 3 | F111: ROACH 2 | H111: SUTHERLAND 2 | K111: KLIBINGAITIS 2 | N111: MITCHELSON 2 | Q111: OWEN | S111: HANKS
A113: PORT MELBOURNE | C113: 4 | D113: 5 | E113: 29 | G113: 8 | H113: 8 | I113: 56 | K113: 14 | L113: 13 | M113: 97 | O113: 19 | P113: 18 | Q113: 132 | S113: VENUE: WERRIBEE
A114: WERRIBEE | C114: 3 | D114: 5 | E114: 23 | G114: 9 | H114: 8 | I114: 62 | K114: 12 | L114: 8 | M114: 80 | O114: 19 | P114: 12 | Q114: 126 | S114: KHAN :BEDFORD
A115: BEST PLAYERS
A116: PORT MELBOURNE | C116: PRITCHARD | F116: MUTIMER | I116: YORGEY | L116: HICKS | O116: STROOPER | R116: RAINSFORD
A117: WERRIBEE | C117: HIGGINS | F117: GUDDE | I117: MONTGOMERY | L117: CHAPMAN | O117: JUKAWICS | R117: SELLS
A118: GOALKICKERS
A119: PORT MELBOURNE | C119: HICKS 5 | E119: COOPER 4 | G119: MUTIMER 2 | J119: PRITCHARD 2 | M119: YORGEY 2 | O119: RICHARDS | Q119: BAILEY | S119: QUINN | U119: VARI
A120: WERRIBEE | C120: SELLS 5 | E120: TYQUIN 4 | G120: HIGGINS 4 | I120: MONTGOMERY 2 | L120: BURKE 2 | N120: VASILOU | P120: WALSH
A122: SPRINGVALE | C122: 9 | D122: 4 | E122: 58 | G122: 16 | H122: 7 | I122: 103 | K122: 23 | L122: 11 | M122: 149 | O122: 31 | P122: 19 | Q122: 205 | S122: VENUE: SPRINGVALE
A123: PRAHRAN | C123: 4 | D123: 4 | E123: 28 | G123: 7 | H123: 5 | I123: 47 | K123: 11 | L123: 6 | M123: 72 | O123: 12 | P123: 9 | Q123: 81 | S123: SAWERS :TREZISE
A124: BEST PLAYERS
A125: SPRINGVALE | C125: CLARK | F125: ROBINSON | I125: DUDLEY | L125: MAYLIN | O125: PALM | R125: WARNER
A126: PRAHRAN | C126: EVANS | F126: KILEY | I126: WHITE | L126: HAMILTON | O126: W WALFORD | R126: S GILES
A127: GOALKICKERS
A128: SPRINGVALE | C128: ROBINSON 12 | F128: STEWART 3 | I128: SECCULL 3 | K128: MORGAN 3 | M128: ANDERSON 2 | P128: DUDLEY 2 | R128: PROSSER 2 | U128: PALM 2 | X128: FOY | Z128: ELLIOTT
A129: PRAHRAN | C129: RYAN 3 | F129: WALFORD 3 | I129: EVANS 2 | K129: BENNETT 2 | M129: McNICHOL | P129: KILEY
A131: ROUND 3 | D131: 22ND/23RD APRIL | I131: WEATHER | S131: VENUE: OAKLEIGH
D132: 1ST QTR | H132: 2ND QTR | L132: 3RD QTR | P132: FINAL | S132: UMPIRES
A133: COBURG | C133: 4 | D133: 3 | E133: 27 | G133: 10 | H133: 7 | I133: 67 | K133: 15 | L133: 15 | M133: 105 | O133: 23 | P133: 20 | Q133: 158 | S133: MORROW | Y133: LADDER | AC133: ROUND | AE133: 3
A134: OAKLEIGH | C134: 5 | D134: 3 | E134: 33 | G134: 9 | H134: 6 | I134: 60 | K134: 14 | L134: 10 | M134: 94 | O134: 16 | P134: 11 | Q134: 107 | S134: BULLUSS
A135: BEST PLAYERS | W135: TEAM | X135: P | Y135: W | Z135: L | AA135: D | AB135: FOR | AC135: AGST | AD135: % | AE135: PTS
A136: COBURG | C136: SHELDON | F136: INGRAM | I136: ALLISON | L136: ANGWIN | O136: KAAKOUR
A137: OAKLEIGH | C137: PRETTO | F137: GARBUIO | I137: HANKS | L137: ATHERTON | O137: DYSON | R137: OLEKSYN | W137: SPRINGVALE | X137: 3 | Y137: 3 | Z137: 0 | AA137: 0 | AB137: 584 | AC137: 222 | AD137: =(AB137/AC137)*100 -> 263.06306306306311 | AE137: =(Y137*4)+(AA137*2) -> 12
A138: GOALKICKERS | Q138: TARANTO | W138: WILLIAMSTOWN | X138: 3 | Y138: 3 | Z138: 0 | AA138: 0 | AB138: 496 | AC138: 229 | AD138: =(AB138/AC138)*100 -> 216.59388646288212 | AE138: =(Y138*4)+(AA138*2) -> 12
A139: COBURG | C139: KAAKOUR 5 | F139: EADE 4 | H139: INGRAM 4 | J139: ALLISON 3 | M139: DARBY 3 | O139: WILLIAMS 2 | R139: RIENIETS | W139: COBURG | X139: 3 | Y139: 3 | Z139: 0 | AA139: 0 | AB139: 506 | AC139: 261 | AD139: =(AB139/AC139)*100 -> 193.86973180076629 | AE139: =(Y139*4)+(AA139*2) -> 12
A140: OAKLEIGH | C140: PRETTO 8 | F140: HANKS 2 | H140: GARBUIO | J140: CUNNINGHAM | M140: DESSENT | O140: LOWE | Q140: ALLAN | S140: DYSON | W140: BOX HILL | X140: 3 | Y140: 3 | Z140: 0 | AA140: 0 | AB140: 409 | AC140: 342 | AD140: =(AB140/AC140)*100 -> 119.5906432748538 | AE140: =(Y140*4)+(AA140*2) -> 12
S141: VENUE: DANDENONG | W141: FRANKSTON | X141: 2 | Y141: 2 | Z141: 0 | AA141: 0 | AB141: 334 | AC141: 194 | AD141: =(AB141/AC141)*100 -> 172.16494845360825 | AE141: =(Y141*4)+(AA141*2) -> 8
A142: WERRIBEE | C142: 8 | D142: 8 | E142: 56 | G142: 13 | H142: 12 | I142: 90 | K142: 21 | L142: 19 | M142: 145 | O142: 25 | P142: 29 | Q142: 179 | S142: ANTHONY
A143: DANDENONG | C143: 3 | D143: 0 | E143: 18 | G143: 6 | H143: 4 | I143: 40 | K143: 7 | L143: 5 | M143: 47 | O143: 10 | P143: 10 | Q143: 70 | S143: VERGONA | W143: WERRIBEE | X143: 3 | Y143: 2 | Z143: 1 | AA143: 0 | AB143: 478 | AC143: 313 | AD143: =(AB143/AC143)*100 -> 152.71565495207668 | AE143: =(Y143*4)+(AA143*2) -> 8
A144: BEST PLAYERS | W144: BRUNSWICK | X144: 2 | Y144: 2 | Z144: 0 | AA144: 0 | AB144: 293 | AC144: 216 | AD144: =(AB144/AC144)*100 -> 135.64814814814815 | AE144: =(Y144*4)+(AA144*2) -> 8
A145: WERRIBEE | C145: DOMBERG | F145: MORRIS | I145: McMASTER | L145: WALSH | O145: SELLS | Q145: VASILOU | W145: PORT MELBOURNE | X145: 3 | Y145: 1 | Z145: 2 | AA145: 0 | AB145: 324 | AC145: 421 | AD145: =(AB145/AC145)*100 -> 76.959619952494066 | AE145: =(Y145*4)+(AA145*2) -> 4
A146: DANDENONG | C146: TURNER | F146: MERRIGAN | I146: J MARRA | L146: ATKINSON | O146: LACKO | Q146: LINDSAY | W146: PRAHRAN | X146: 3 | Y146: 0 | Z146: 3 | AA146: 0 | AB146: 323 | AC146: 490 | AD146: =(AB146/AC146)*100 -> 65.91836734693878 | AE146: =(Y146*4)+(AA146*2) -> 0
A147: GOALKICKERS | R147: NcMASTER | W147: OAKLEIGH | X147: 3 | Y147: 0 | Z147: 3 | AA147: 0 | AB147: 314 | AC147: 486 | AD147: =(AB147/AC147)*100 -> 64.609053497942384 | AE147: =(Y147*4)+(AA147*2) -> 0
A148: WERRIBEE | C148: SELLS 7 | E148: WALSH 4 | G148: FLEMING 4 | I148: TYQUIN 2 | K148: VASILOU 2 | M148: GUDDE 2 | O148: DOMBERG | Q148: FENTON | S148: FREEMAN | W148: PRESTON | X148: 3 | Y148: 0 | Z148: 3 | AA148: 0 | AB148: 259 | AC148: 416 | AD148: =(AB148/AC148)*100 -> 62.259615384615387 | AE148: =(Y148*4)+(AA148*2) -> 0
A149: DANDENONG | C149: HILL 2 | E149: ATKINSON 2 | G149: G MARRA | I149: TURNER | K149: CARTER | M149: DODDS | O149: LINDSAY | Q149: J MARRA | W149: SANDRINGHAM | X149: 3 | Y149: 0 | Z149: 3 | AA149: 0 | AB149: 256 | AC149: 538 | AD149: =(AB149/AC149)*100 -> 47.583643122676577 | AE149: =(Y149*4)+(AA149*2) -> 0
S150: VENUE: PRESTON | W150: DANDEN0NG | X150: 3 | Y150: 0 | Z150: 3 | AA150: 0 | AB150: 236 | AC150: 538 | AD150: =(AB150/AC150)*100 -> 43.866171003717476 | AE150: =(Y150*4)+(AA150*2) -> 0
A151: SPRINGVALE | C151: 5 | D151: 4 | E151: 34 | G151: 8 | H151: 9 | I151: 57 | K151: 16 | L151: 13 | M151: 109 | O151: 24 | P151: 18 | Q151: 162 | S151: HOLT | W151: CAMBERWELL | X151: 1 | Y151: 0 | Z151: 1 | AA151: 0 | AB151: 75 | AC151: 211 | AD151: =(AB151/AC151)*100 -> 35.545023696682463 | AE151: =(Y151*4)+(AA151*2) -> 0
A152: PRESTON | C152: 2 | D152: 7 | E152: 19 | G152: 8 | H152: 9 | I152: 57 | K152: 10 | L152: 12 | M152: 72 | O152: 13 | P152: 13 | Q152: 91 | S152: CHILDS
A153: BEST PLAYERS
A154: SPRINGVALE | C154: PROSSER | F154: MORGAN | I154: ANDERSON | L154: CLARK | O154: FOY | Q154: MENDE
A155: PRESTON | C155: DUNBAR | F155: PLOWMAN | I155: WATT | L155: BROWN | O155: HEANEY | Q155: VALKANIS
A156: GOALKICKERS | Q156: ELLIOTT | S156: MENDE
A157: SPRINGVALE | C157: ROBINSON 6 | F157: ANDERSON 4 | I157: PROSSER 4 | K157: MORGAN 3 | M157: STEWART 2 | P157: SECCULL 2 | R157: PALM
A158: PRESTON | C158: JORDAN 3 | F158: SHAW 2 | H158: OWEN 2 | J158: HOCKING 2 | M158: HALAS | O158: LUMICISI | Q158: DUNBAR | S158: WATT
A160: BOX HILL | C160: 3 | D160: 4 | E160: 22 | G160: 10 | H160: 5 | I160: 65 | K160: 14 | L160: 9 | M160: 93 | O160: 19 | P160: 14 | Q160: 128 | S160: VENUE: PORT MELBOURNE
A161: PORT MELBOURNE | C161: 4 | D161: 3 | E161: 27 | G161: 9 | H161: 9 | I161: 63 | K161: 14 | L161: 16 | M161: 100 | O161: 18 | P161: 18 | Q161: 126 | S161: TRESIZE :FOLLETT
A162: BEST PLAYERS
A163: BOX HILL | C163: NICHOLSON | F163: HOCKING | I163: BUTTIFANT | L163: DONOHUE | O163: ZARAFA | R163: HOLT
A164: PORT MELBOURNE | C164: RAINSFORD | F164: PRITCHARD | I164: FOLEY | L164: GOLDIE | O164: HARKINS | R164: HETHERTON
A165: GOALKICKERS
A166: BOX HILL | C166: S HOGAN 4 | F166: BOLTON 3 | I166: DONOHUE 2 | L166: ZARAFA 2 | N166: BUTTIFANT 2 | Q166: NICHOLSON | T166: HOLT | W166: HOCKING | X166: LAWRIE | AA166: GLEESON
A167: PORT MELBOURNE | C167: COOPER 5 | F167: BAILEY 3 | H167: RICHARDS 2 | K167: CONDON 2 | M167: HARKINS 2 | O167: HETHERTON 2 | R167: VARI | T167: FOLEY
A169: WILLIAMSTOWN | C169: 6 | D169: 2 | E169: 38 | G169: 13 | H169: 9 | I169: 87 | K169: 20 | L169: 10 | M169: 130 | O169: 28 | P169: 16 | Q169: 184 | S169: VENUE: BEACH ROAD
A170: SANDRINGHAM | C170: 4 | D170: 0 | E170: 24 | G170: 5 | H170: 4 | I170: 34 | K170: 6 | L170: 12 | M170: 48 | O170: 7 | P170: 15 | Q170: 57 | S170: LAWLOR :COATES
A171: BEST PLAYERS
A172: WILLIAMSTOWN | C172: GHAZI | F172: HOWLETT | I172: SWAN | L172: McGOWAN | O172: DELRE | R172: NILSSEN
A173: SANDRINGHAM | C173: BENNETT | F173: WEST | I173: FISCHER | L173: ERWIN | O173: FITZGERALD | R173: GUERTS
A174: GOALKICKERS
A175: WILLIAMSTOWN | C175: GHAZI 6 | E175: KENNY 5 | G175: RICKMAN 5 | I175: SWAN 2 | K175: CAHILL 2 | M175: HOWLETT 2 | P175: KENNEDY 2 | R175: GROENEWEGAN | W175: McGOWAN | Y175: NILSSEN | AB175: ROWSELL
A176: SANDRINGHAM | C176: BERGMAN 2 | F176: WEST 2 | H176: DALRYMPLE | K176: F RUGOLO | M176: GUERTS
A178: BRUNSWICK | C178: 4 | D178: 2 | E178: 26 | G178: 11 | H178: 8 | I178: 74 | K178: 15 | L178: 12 | M178: 102 | O178: 24 | P178: 18 | Q178: 162 | S178: VENUE: TOORAK PARK
A179: PRAHRAN | C179: 6 | D179: 7 | E179: 43 | G179: 12 | H179: 10 | I179: 82 | K179: 15 | L179: 12 | M179: 102 | O179: 18 | P179: 15 | Q179: 123 | S179: BEDFORD :HOWLETT
A180: BEST PLAYERS
A181: BRUNSWICK | C181: HOLMES | F181: DUGDALE | I181: HERBERT | L181: CLARKE | O181: GRIFFITHS | R181: SCULLY
A182: PRAHRAN | C182: EVANS | F182: KILEY | I182: SOULOS | L182: HAMILTON | O182: WALFORD | R182: PAGE
A183: GOALKICKERS
A184: BRUNSWICK | C184: GRIFFITHS 9 | F184: HERBERT 7 | I184: CALLANDER 3 | L184: HOLMES 2 | N184: WRIGHT | P184: CLARKE | R184: MAGUIRE
A185: PRAHRAN | C185: WALFORD 5 | F185: G GILES 3 | H185: EVANS 2 | J185: KILEY 2 | L185: HEWITSON 2 | O185: RICHARDS 2 | R185: McNICHOL | U185: DIROU
A187: BYES | E187: CAMBERWELL | J187: FRANKSTON
A189: ROUND 4 | D189: 29TH/30TH APRIL | I189: WEATHER | S189: VENUE: BRUNSWICK
D190: 1ST QTR | H190: 2ND QTR | L190: 3RD QTR | P190: FINAL | S190: UMPIRES
A191: BRUNSWICK | C191: 9 | D191: 6 | E191: 60 | G191: 15 | H191: 10 | I191: 100 | K191: 19 | L191: 13 | M191: 127 | O191: 28 | P191: 20 | Q191: 188 | S191: MORROW | Y191: LADDER | AC191: ROUND | AE191: 4
A192: SANDRINGHAM | C192: 6 | D192: 5 | E192: 41 | G192: 7 | H192: 7 | I192: 49 | K192: 12 | L192: 15 | M192: 87 | O192: 17 | P192: 15 | Q192: 117 | S192: ANTHONY
A193: BEST PLAYERS | W193: TEAM | X193: P | Y193: W | Z193: L | AA193: D | AB193: FOR | AC193: AGST | AD193: % | AE193: PTS
A194: BRUNSWICK | C194: CONNELL | F194: CALLANDER | I194: DUGDALE | L194: GRIFFITHS | O194: KERR | R194: BERTOLLO
A195: SANDRINGHAM | C195: DALRYMPLE | F195: McLEAN | I195: McCARTHY | L195: F RUGOLO | O195: BRIAN SAID | R195: FISCHER | W195: SPRINGVALE | X195: 4 | Y195: 4 | Z195: 0 | AA195: 0 | AB195: 718 | AC195: 299 | AD195: =(AB195/AC195)*100 -> 240.13377926421407 | AE195: =(Y195*4)+(AA195*2) -> 16
A196: GOALKICKERS | M196: BERTOLLO 2 | P196: HARMES | R196: KERR | W196: WILLIAMSTOWN | X196: 4 | Y196: 4 | Z196: 0 | AA196: 0 | AB196: 734 | AC196: 283 | AD196: =(AB196/AC196)*100 -> 259.36395759717317 | AE196: =(Y196*4)+(AA196*2) -> 16
A197: BRUNSWICK | C197: GRIFFITHS 9 | F197: HERBERT 4 | I197: BEALE 4 | K197: CALLANDER 3 | N197: HOLMES 2 | Q197: WRIGHT 2 | W197: COBURG | X197: 4 | Y197: 4 | Z197: 0 | AA197: 0 | AB197: 656 | AC197: 319 | AD197: =(AB197/AC197)*100 -> 205.64263322884014 | AE197: =(Y197*4)+(AA197*2) -> 16
A198: SANDRINGHAM | C198: F RUGOLO 6 | F198: BERGMAN 4 | I198: J RUGOLO 3 | L198: BRIAN SAID 2 | O198: HOWARD | Q198: McCARTHY | W198: BOX HILL | X198: 4 | Y198: 4 | Z198: 0 | AA198: 0 | AB198: 548 | AC198: 447 | AD198: =(AB198/AC198)*100 -> 122.59507829977629 | AE198: =(Y198*4)+(AA198*2) -> 16
S199: VENUE: WERRIBEE | W199: FRANKSTON | X199: 3 | Y199: 2 | Z199: 1 | AA199: 0 | AB199: 439 | AC199: 333 | AD199: =(AB199/AC199)*100 -> 131.83183183183183 | AE199: =(Y199*4)+(AA199*2) -> 8
A200: WERRIBEE | C200: 9 | D200: 4 | E200: 58 | G200: 14 | H200: 6 | I200: 90 | K200: 24 | L200: 10 | M200: 154 | O200: 34 | P200: 14 | Q200: 218 | S200: COOK
A201: CAMBERWELL | C201: 2 | D201: 2 | E201: 14 | G201: 8 | H201: 4 | I201: 52 | K201: 13 | L201: 5 | M201: 83 | O201: 18 | P201: 9 | Q201: 117 | S201: GERSCH | W201: WERRIBEE | X201: 4 | Y201: 3 | Z201: 1 | AA201: 0 | AB201: 696 | AC201: 430 | AD201: =(AB201/AC201)*100 -> 161.86046511627907 | AE201: =(Y201*4)+(AA201*2) -> 12
A202: BEST PLAYERS | W202: BRUNSWICK | X202: 3 | Y202: 3 | Z202: 0 | AA202: 0 | AB202: 481 | AC202: 333 | AD202: =(AB202/AC202)*100 -> 144.44444444444443 | AE202: =(Y202*4)+(AA202*2) -> 12
A203: WERRIBEE | C203: VASILOU | F203: WALSH | I203: MORRIS | L203: TAYLOR | O203: BURKE | R203: FENTON | W203: PORT MELBOURNE | X203: 4 | Y203: 1 | Z203: 3 | AA203: 0 | AB203: 401 | AC203: 555 | AD203: =(AB203/AC203)*100 -> 72.252252252252248 | AE203: =(Y203*4)+(AA203*2) -> 4
A204: CAMBERWELL | C204: BUDGE | F204: SULLIVAN | I204: LOCKMAN | L204: GREIG | W204: PRAHRAN | X204: 4 | Y204: 0 | Z204: 4 | AA204: 0 | AB204: 377 | AC204: 728 | AD204: =(AB204/AC204)*100 -> 51.785714285714292 | AE204: =(Y204*4)+(AA204*2) -> 0
A205: GOALKICKERS | W205: OAKLEIGH | X205: 3 | Y205: 0 | Z205: 3 | AA205: 0 | AB205: 314 | AC205: 486 | AD205: =(AB205/AC205)*100 -> 64.609053497942384 | AE205: =(Y205*4)+(AA205*2) -> 0
A206: WERRIBEE | C206: TAYLOR 9 | E206: SELLS 8 | G206: FLEMING 4 | I206: MONTGOMERY 3 | L206: WALSH 3 | N206: FREEMAN 3 | Q206: WRIGHT 3 | S206: FENTON | W206: PRESTON | X206: 4 | Y206: 0 | Z206: 4 | AA206: 0 | AB206: 317 | AC206: 566 | AD206: =(AB206/AC206)*100 -> 56.007067137809187 | AE206: =(Y206*4)+(AA206*2) -> 0
A207: CAMBERWELL | C207: SULLIVAN 5 | E207: TORPEY 2 | G207: GREIG 2 | I207: ANDERSON 2 | L207: RAZUMS | N207: FURLAN | P207: H MITCHELL | R207: LOCKMAN | W207: SANDRINGHAM | X207: 4 | Y207: 0 | Z207: 4 | AA207: 0 | AB207: 373 | AC207: 726 | AD207: =(AB207/AC207)*100 -> 51.37741046831956 | AE207: =(Y207*4)+(AA207*2) -> 0
N208: BUDGE | P208: VERESHAKA | S208: VENUE: COBURG | W208: DANDEN0NG | X208: 3 | Y208: 0 | Z208: 3 | AA208: 0 | AB208: 236 | AC208: 538 | AD208: =(AB208/AC208)*100 -> 43.866171003717476 | AE208: =(Y208*4)+(AA208*2) -> 0
A209: COBURG | C209: 5 | D209: 4 | E209: 34 | G209: 13 | H209: 8 | I209: 86 | K209: 19 | L209: 15 | M209: 129 | O209: 22 | P209: 18 | Q209: 150 | S209: LAWLOR | W209: CAMBERWELL | X209: 2 | Y209: 0 | Z209: 2 | AA209: 0 | AB209: 192 | AC209: 429 | AD209: =(AB209/AC209)*100 -> 44.755244755244753 | AE209: =(Y209*4)+(AA209*2) -> 0
A210: PRESTON | C210: 3 | D210: 6 | E210: 24 | G210: 4 | H210: 10 | I210: 34 | K210: 7 | L210: 15 | M210: 57 | O210: 7 | P210: 16 | Q210: 58 | S210: VAN BEEK
A211: BEST PLAYERS
A212: COBURG | C212: ANGWIN | F212: SHELDON | I212: EVANS | L212: ALLISON | O212: GUMLEY
A213: PRESTON | C213: SENNO | F213: VALKANIS | I213: PRITCHARD | L213: JORDAN | O213: PERCY
A214: GOALKICKERS | J214: REYNOLDSON | M214: TARANTO | O214: LANGAN | Q214: INGRAM
A215: COBURG | C215: WILLIAMS 7 | F215: KAAKOUR 3 | I215: GUMLEY 3 | K215: DARBY 2 | M215: ALLISON | O215: RIENIETS | Q215: MONACO
A216: PRESTON | C216: JORDAN 3 | F216: SHAW 2 | H216: PLOWMAN | K216: C LAWSON
A218: SPRINGVALE | C218: 3 | D218: 4 | E218: 22 | G218: 8 | H218: 9 | I218: 57 | K218: 13 | L218: 17 | M218: 95 | O218: 19 | P218: 20 | Q218: 134 | S218: VENUE: PORT MELBOURNE
A219: PORT MELBOURNE | C219: 4 | D219: 5 | E219: 29 | G219: 5 | H219: 9 | I219: 39 | K219: 7 | L219: 13 | M219: 55 | O219: 10 | P219: 17 | Q219: 77 | S219: BULLUSS ;COATES
A220: BEST PLAYERS
A221: SPRINGVALE | C221: JEFFS | F221: DWYER | I221: DUDLEY | L221: MALONI | O221: KING | Q221: PALM
A222: PORT MELBOURNE | C222: GOLDIE | F222: HETHERTON | I222: HARKINS | L222: BAILLIE
A223: GOALKICKERS
A224: SPRINGVALE | C224: ROBINSON 4 | F224: PROSSER 3 | I224: DEMPSTER 3 | L224: ANDERSON 2 | O224: PALM 2 | Q224: MORGAN 2 | T224: STEWART | X224: CLARKE | AA224: MARCOU
A225: PORT MELBOURNE | C225: STREMPL 2 | F225: HICKS 2 | H225: HARKINS 2 | J225: MUTIMER | M225: RICHARDS | O225: CONDON | Q225: HETHERTON
A227: BOX HILL | C227: 5 | D227: 3 | E227: 33 | G227: 11 | H227: 12 | I227: 78 | K227: 16 | L227: 14 | M227: 110 | O227: 20 | P227: 19 | Q227: 139 | S227: VENUE: BOX HILL
A228: FRANKSTON | C228: 4 | D228: 6 | E228: 30 | G228: 9 | H228: 7 | I228: 61 | K228: 10 | L228: 11 | M228: 71 | O228: 15 | P228: 15 | Q228: 105 | S228: HOWLETT :VERGONA
A229: BEST PLAYERS
A230: BOX HILL | C230: HICKS | F230: BUTTIFANT | I230: HOCKING | L230: BROWN | O230: GLARE | R230: LAWRIE
A231: FRANKSTON | C231: LOUTTIT | F231: LANE | I231: BOONKAMP | L231: MACE | O231: WATSON | R231: SHIELDS
A232: GOALKICKERS
A233: BOX HILL | C233: BUTTIFANT 6 | F233: GLARE 5 | H233: NICHOLSON 2 | K233: HOGAN | M233: DONOHUE | O233: ZARAFA | Q233: HOCKING | S233: LAWRIE | W233: GLEESON
A234: FRANKSTON | C234: BINGLEY 4 | F234: SHIELDS 4 | I234: P MARTIN 2 | L234: GAHAN 2 | N234: NIKAKIS | P234: VANDERMEER | S234: O'BRIEN
A236: WILLIAMSTOWN | C236: 7 | D236: 9 | E236: 51 | G236: 17 | H236: 14 | I236: 116 | K236: 27 | L236: 18 | M236: 180 | O236: 36 | P236: 22 | Q236: 238 | S236: AT WILLIAMSTOWN
A237: PRAHRAN | C237: 1 | D237: 2 | E237: 8 | G237: 4 | H237: 3 | I237: 27 | K237: 4 | L237: 3 | M237: 27 | O237: 8 | P237: 6 | Q237: 54 | S237: RICHARDSON :FOLLETT
A238: BEST PLAYERS
A239: WILLIAMSTOWN | C239: GROENEWEGAN | F239: SWAN | I239: HOWLETT | L239: MUSCHIALLI | O239: SLEVISON | R239: KENNY
A240: PRAHRAN | C240: KILEY | F240: W WALFORD | I240: S GILES
A241: GOALKICKERS
A242: WILLIAMSTOWN | C242: RICKMAN 8 | F242: GROENEWEGAN 8 | J242: KENNY 6 | L242: CAHILL 5 | N242: DELRE 3 | P242: MUSCHIALLI 2 | S242: GHAZI | U242: RAEBURN | Y242: SLEVISON | AB242: GOULD
A243: PRAHRAN | C243: HEWITSON 4 | F243: SOULOS | H243: RICHARDS | J243: DIROU | L243: KANE
A245: BYES | E245: OAKLEIGH | I245: DANDENONG
A247: ROUND 5 | D247: 6/7TH MAY | I247: WEATHER | S247: VENUE: SPRINGVALE
D248: 1ST QTR | H248: 2ND QTR | L248: 3RD QTR | P248: FINAL | S248: UMPIRES
A249: OAKLEIGH | C249: 6 | D249: 3 | E249: 39 | G249: 10 | H249: 7 | I249: 67 | K249: 13 | L249: 9 | M249: 87 | O249: 22 | P249: 11 | Q249: 143 | S249: HARRIS | Y249: LADDER | AC249: ROUND | AE249: 5
A250: SPRINGVALE | C250: 7 | D250: 3 | E250: 45 | G250: 9 | H250: 8 | I250: 62 | K250: 14 | L250: 11 | M250: 95 | O250: 17 | P250: 14 | Q250: 116 | S250: VAN BEEK
A251: BEST PLAYERS | W251: TEAM | X251: P | Y251: W | Z251: L | AA251: D | AB251: FOR | AC251: AGST | AD251: % | AE251: PTS
A252: OAKLEIGH | C252: DYSON | F252: BRIGGS | I252: CUNNINGHAM | L252: GARBUIO | O252: SMITH | R252: TODD
A253: SPRINGVALE | C253: ROBINSON | F253: KING | I253: DUDLEY | L253: DEMPSTER | O253: STEWART | W253: COBURG | X253: 5 | Y253: 5 | Z253: 0 | AA253: 0 | AB253: 953 | AC253: 376 | AD253: =(AB253/AC253)*100 -> 253.45744680851064 | AE253: =(Y253*4)+(AA253*2) -> 20
A254: GOALKICKERS | P254: ATHERTON | W254: WILLIAMSTOWN | X254: 5 | Y254: 5 | Z254: 0 | AA254: 0 | AB254: 909 | AC254: 367 | AD254: =(AB254/AC254)*100 -> 247.68392370572207 | AE254: =(Y254*4)+(AA254*2) -> 20
A255: OAKLEIGH | C255: PRETTO 6 | F255: SUTHERLAND 4 | I255: OWEN 3 | K255: DYSON 3 | M255: TODD 3 | O255: GARBUIO | Q255: DISSENT | W255: BOX HILL | X255: 5 | Y255: 5 | Z255: 0 | AA255: 0 | AB255: 677 | AC255: 569 | AD255: =(AB255/AC255)*100 -> 118.98066783831283 | AE255: =(Y255*4)+(AA255*2) -> 20
A256: SPRINGVALE | C256: ROBINSON 6 | F256: STEWART 3 | I256: ANDERSON 3 | L256: DUDLEY | N256: NORMAN | P256: DEMPSTER | R256: P MALONI | W256: SPRINGVALE | X256: 5 | Y256: 4 | Z256: 1 | AA256: 0 | AB256: 834 | AC256: 442 | AD256: =(AB256/AC256)*100 -> 188.68778280542986 | AE256: =(Y256*4)+(AA256*2) -> 16
M257: DWYER | S257: VENUE: CAMBERWELL | W257: WERRIBEE | X257: 5 | Y257: 4 | Z257: 1 | AA257: 0 | AB257: 865 | AC257: 499 | AD257: =(AB257/AC257)*100 -> 173.34669338677355 | AE257: =(Y257*4)+(AA257*2) -> 16
A258: COBURG | C258: 7 | D258: 6 | E258: 48 | G258: 19 | H258: 9 | I258: 123 | K258: 29 | L258: 14 | M258: 188 | O258: 46 | P258: 21 | Q258: 297 | S258: GREEN
A259: CAMBERWELL | C259: 2 | D259: 2 | E259: 14 | G259: 3 | H259: 5 | I259: 23 | K259: 7 | L259: 8 | M259: 50 | O259: 8 | P259: 9 | Q259: 57 | S259: RICHARDSON | W259: FRANKSTON | X259: 4 | Y259: 3 | Z259: 1 | AA259: 0 | AB259: 662 | AC259: 442 | AD259: =(AB259/AC259)*100 -> 149.77375565610859 | AE259: =(Y259*4)+(AA259*2) -> 12
A260: BEST PLAYERS | W260: BRUNSWICK | X260: 3 | Y260: 3 | Z260: 0 | AA260: 0 | AB260: 481 | AC260: 333 | AD260: =(AB260/AC260)*100 -> 144.44444444444443 | AE260: =(Y260*4)+(AA260*2) -> 12
A261: COBURG | C261: TEAM EFFORT | W261: OAKLEIGH | X261: 4 | Y261: 1 | Z261: 3 | AA261: 0 | AB261: 457 | AC261: 602 | AD261: =(AB261/AC261)*100 -> 75.913621262458477 | AE261: =(Y261*4)+(AA261*2) -> 4
A262: CAMBERWELL | C262: DIPIERDOMENICO | F262: TRIBE | I262: GREIG | L262: LOCKMAN | O262: SULLIVAN | R262: TORPEY | W262: PORT MELBOURNE | X262: 5 | Y262: 1 | Z262: 4 | AA262: 0 | AB262: 485 | AC262: 730 | AD262: =(AB262/AC262)*100 -> 66.438356164383563 | AE262: =(Y262*4)+(AA262*2) -> 4
A263: GOALKICKERS | L263: REYNOLDSON 2 | O263: DOYLE 2 | Q263: A WILSON | S263: EVANS | W263: SANDRINGHAM | X263: 5 | Y263: 0 | Z263: 5 | AA263: 0 | AB263: 495 | AC263: 855 | AD263: =(AB263/AC263)*100 -> 57.894736842105267 | AE263: =(Y263*4)+(AA263*2) -> 0
A264: COBURG | C264: WILLIAMS 9 | F264: BASSETT 7 | I264: IMGRAM 6 | K264: GUMLEY 5 | M264: DARBY 5 | O264: RIENIETS 4 | Q264: KAAKOUR 4 | W264: PRESTON | X264: 4 | Y264: 0 | Z264: 4 | AA264: 0 | AB264: 317 | AC264: 566 | AD264: =(AB264/AC264)*100 -> 56.007067137809187 | AE264: =(Y264*4)+(AA264*2) -> 0
A265: CAMBERWELL | C265: SULLIVAN 2 | F265: O'SULLIVAN 2 | I265: TUCKER 2 | K265: GREIG | M265: JONES | W265: PRAHRAN | X265: 5 | Y265: 0 | Z265: 5 | AA265: 0 | AB265: 446 | AC265: 897 | AD265: =(AB265/AC265)*100 -> 49.721293199554069 | AE265: =(Y265*4)+(AA265*2) -> 0
S266: VENUE: WERRIBEE | W266: DANDEN0NG | X266: 4 | Y266: 0 | Z266: 4 | AA266: 0 | AB266: 345 | AC266: 761 | AD266: =(AB266/AC266)*100 -> 45.335085413929036 | AE266: =(Y266*4)+(AA266*2) -> 0
A267: WERRIBEE | C267: 9 | D267: 5 | E267: 59 | G267: 12 | H267: 10 | I267: 82 | K267: 18 | L267: 13 | M267: 121 | O267: 25 | P267: 19 | Q267: 169 | S267: HARVEY | W267: CAMBERWELL | X267: 3 | Y267: 0 | Z267: 3 | AA267: 0 | AB267: 249 | AC267: 726 | AD267: =(AB267/AC267)*100 -> 34.29752066115703 | AE267: =(Y267*4)+(AA267*2) -> 0
A268: PRAHRAN | C268: 2 | D268: 1 | E268: 13 | G268: 3 | H268: 4 | I268: 22 | K268: 5 | L268: 10 | M268: 40 | O268: 9 | P268: 15 | Q268: 69 | S268: BULLUSS
A269: BEST PLAYERS
A270: WERRIBEE | C270: MOLONEY | F270: WALSH | I270: VASILOU | L270: HIGGINS | N270: RADCLIFFE | Q270: CHRISTIANSEN
A271: PRAHRAN | C271: G GILES | F271: HAMILTON | I271: HEWITSON | L271: S GILES | N271: SOULOS
A272: GOALKICKERS | M272: RADCLIFFE 2 | Q272: HIGGINS | S272: MORRIS
A273: WERRIBEE | C273: TAYLOR 6 | F273: CHRISTIANSEN 4 | I273: WALSH 3 | K273: SELLS 2 | M273: MONTGOMERY 2 | P273: VASILOU 2 | R273: FLEMING 2
A274: PRAHRAN | C274: G GILES 3 | F274: FERGUS 2 | I274: M EVANS | K274: SOULOS | M274: DIROU | O274: S GILES
A276: BOX HILL | C276: 3 | D276: 2 | E276: 20 | G276: 10 | H276: 7 | I276: 67 | K276: 15 | L276: 8 | M276: 98 | O276: 19 | P276: 15 | Q276: 129 | S276: VENUE: BEACH ROAD
A277: SANDRINGHAM | C277: 6 | D277: 3 | E277: 39 | G277: 10 | H277: 6 | I277: 66 | K277: 17 | L277: 12 | M277: 114 | O277: 18 | P277: 14 | Q277: 122 | S277: CHILDS :COOK
A278: BEST PLAYERS
A279: BOX HILL | C279: ZARAFA | F279: HOCKING | I279: JOHNS | L279: BUTTIFANT | O279: BOLTON | R279: HICKS
A280: SANDRINGHAM | C280: HOWARD | F280: DALRYMPLE | I280: BENNETT | L280: FITZGERALD | O280: McLEAN | R280: MERSON
A281: GOALKICKERS
A282: BOX HILL | C282: JOHNS 4 | E282: BUTTIFANT 4 | H282: BOLTON 3 | J282: HOLT 2 | L282: HOGAN | N282: DONOHUE | P282: NICHOLSON | S282: ZARAFA | W282: GLARE | Y282: O'BRIEN
A283: SANDRINGHAM | C283: BERGMAN 4 | F283: DALRYMPLE 3 | I283: F RUGOLO 3 | L283: HOWARD 2 | N283: J RUGOLO 2 | Q283: E FISCHER | S283: WEST | U283: DWYER | X283: ERWIN
A285: FRANKSTON | C285: 6 | D285: 4 | E285: 40 | G285: 16 | H285: 11 | I285: 107 | K285: 24 | L285: 20 | M285: 164 | O285: 33 | P285: 25 | Q285: 223 | S285: VENUE: DANDENONG
A286: DANDENONG | C286: 4 | D286: 1 | E286: 25 | G286: 9 | H286: 2 | I286: 56 | K286: 11 | L286: 3 | M286: 69 | O286: 17 | P286: 7 | Q286: 109 | S286: GERSCH :GREENE
A287: BEST PLAYERS
A288: FRANKSTON | C288: P MARTIN | F288: FOYSTER | I288: SHARP | L288: BINGLEY | O288: GAMBLE | R288: MACE
A289: DANDENONG | C289: ATKINSON | F289: NICHOLAS | I289: ARGOON | L289: BRUNNEN | O289: MILLANE
A290: GOALKICKERS | S290: BOONKAMP
A291: FRANKSTON | C291: BINGLEY 8 | E291: GAHAN 5 | G291: FREW 5 | I291: BROWN 3 | K291: P MARTIN 2 | N291: BRENNAN 2 | Q291: A HAMILL 2 | T291: WATSON 2 | X291: AMOORE | AA291: D MARTIN | AD291: POLLOCK
A292: DANDENONG | C292: ARGOON 5 | F292: TURNER 4 | I292: BRUNNEN 3 | L292: LACKO 2 | N292: YOUNG 2 | P292: ATKINSON
A294: WILLIAMSTOWN | C294: 5 | D294: 3 | E294: 33 | G294: 8 | H294: 7 | I294: 55 | K294: 18 | L294: 12 | M294: 120 | O294: 27 | P294: 13 | Q294: 175 | S294: VENUE: WILLIAMSTOWN
A295: PORT MELBOURNE | C295: 3 | D295: 5 | E295: 23 | G295: 8 | H295: 7 | I295: 55 | K295: 8 | L295: 11 | M295: 59 | O295: 12 | P295: 12 | Q295: 84 | S295: HOLT ;CASTLE
A296: BEST PLAYERS
A297: WILLIAMSTOWN | C297: RICKMAN | F297: McGOWAN | I297: AZIZ | L297: CAHILL | O297: MUSCHIALLI | R297: GHAZI
A298: PORT MELBOURNE | C298: N/A
A299: GOALKICKERS
A300: WILLIAMSTOWN | C300: RICKMAN 12 | F300: McGOWAN 4 | I300: CAHILL 3 | K300: ROUND 2 | M300: NILSSEN 2 | O300: GHAZI | Q300: SWAN | S300: MUSCHIALLI | X300: BURTON
A301: PORT MELBOURNE | C301: COOPER 3 | F301: LARKIN 3 | I301: HETHERTON 2 | L301: HICKS | N301: CONDON | P301: DERMOTT | R301: SCURRAH
A303: BYES | E303: PRESTON | J303: BRUNSWICK
A305: ROUND 6 | D305: 14TH MAY | I305: WEATHER | S305: VENUE: BRUNSWICK
D306: 1ST QTR | H306: 2ND QTR | L306: 3RD QTR | P306: FINAL | S306: UMPIRES
A307: COBURG | C307: 5 | D307: 7 | E307: 37 | G307: 8 | H307: 13 | I307: 61 | K307: 12 | L307: 21 | M307: 93 | O307: 18 | P307: 25 | Q307: 133 | S307: KHAN | Y307: LADDER | AC307: ROUND | AE307: 6
A308: BRUNSWICK | C308: 1 | D308: 4 | E308: 10 | G308: 10 | H308: 7 | I308: 67 | K308: 17 | L308: 8 | M308: 110 | O308: 20 | P308: 9 | Q308: 129 | S308: FOLLETT
A309: BEST PLAYERS | W309: TEAM | X309: P | Y309: W | Z309: L | AA309: D | AB309: FOR | AC309: AGST | AD309: % | AE309: PTS
A310: COBURG | C310: SHELDON | F310: DARBY | I310: BASSETT | L310: NIMMO | O310: EVANS | R310: LITTLER
A311: BRUNSWICK | C311: KERR | F311: DUGDALE | I311: THOROGOOD | L311: CALLANDER | O311: HYSLOP | R311: HARMES | W311: WILLIAMSTOWN | X311: 6 | Y311: 6 | Z311: 0 | AA311: 0 | AB311: 1070 | AC311: 435 | AD311: =(AB311/AC311)*100 -> 245.97701149425285 | AE311: =(Y311*4)+(AA311*2) -> 24
A312: GOALKICKERS | Q312: TARANTO | W312: COBURG | X312: 6 | Y312: 6 | Z312: 0 | AA312: 0 | AB312: 1086 | AC312: 505 | AD312: =(AB312/AC312)*100 -> 215.04950495049508 | AE312: =(Y312*4)+(AA312*2) -> 24
A313: COBURG | C313: DARBY 4 | E313: BASSETT 3 | G313: SHELDON 2 | I313: INGRAM 2 | K313: DOYLE 2 | M313: EADE | N313: ALLISON | P313: LITTLER | R313: WILLIAMS | W313: BOX HILL | X313: 6 | Y313: 6 | Z313: 0 | AA313: 0 | AB313: 889 | AC313: 676 | AD313: =(AB313/AC313)*100 -> 131.50887573964499 | AE313: =(Y313*4)+(AA313*2) -> 24
A314: BRUNSWICK | C314: GRIFFITHS 4 | F314: HARMES 4 | I314: HYSLOP 3 | K314: CALLANDER 3 | N314: WRIGHT 2 | P314: HERBERT 2 | R314: SCULLY | W314: SPRINGVALE | X314: 6 | Y314: 5 | Z314: 1 | AA314: 0 | AB314: 985 | AC314: 550 | AD314: =(AB314/AC314)*100 -> 179.09090909090909 | AE314: =(Y314*4)+(AA314*2) -> 20
M315: BEALE | S315: AT B. H, | W315: WERRIBEE | X315: 6 | Y315: 4 | Z315: 2 | AA315: 0 | AB315: 977 | AC315: 674 | AD315: =(AB315/AC315)*100 -> 144.95548961424331 | AE315: =(Y315*4)+(AA315*2) -> 16
A316: BOX HILL | C316: 3 | D316: 6 | E316: 24 | G316: 14 | H316: 15 | I316: 99 | K316: 22 | L316: 23 | M316: 155 | O316: 31 | P316: 26 | Q316: 212 | S316: CLEMENT
A317: CAMBERWELL | C317: 2 | D317: 10 | E317: 22 | G317: 7 | H317: 11 | I317: 53 | K317: 13 | L317: 11 | M317: 89 | O317: 15 | P317: 17 | Q317: 107 | S317: GREEN | W317: BRUNSWICK | X317: 4 | Y317: 3 | Z317: 1 | AA317: 0 | AB317: 610 | AC317: 466 | AD317: =(AB317/AC317)*100 -> 130.90128755364807 | AE317: =(Y317*4)+(AA317*2) -> 12
A318: BEST PLAYERS | W318: FRANKSTON | X318: 5 | Y318: 3 | Z318: 2 | AA318: 0 | AB318: 730 | AC318: 603 | AD318: =(AB318/AC318)*100 -> 121.06135986733003 | AE318: =(Y318*4)+(AA318*2) -> 12
A319: BOX HILL | C319: BROWN | F319: NICHOLSON | I319: BOLTON | L319: HOLT | O319: FRANCIS | R319: GLARE | W319: OAKLEIGH | X319: 5 | Y319: 2 | Z319: 3 | AA319: 0 | AB319: 632 | AC319: 714 | AD319: =(AB319/AC319)*100 -> 88.515406162464984 | AE319: =(Y319*4)+(AA319*2) -> 8
A320: CAMBERWELL | C320: DIPIERDOMENICO | F320: SULLIVAN | I320: TORPEY | L320: LOCKMAN | O320: GREIG | R320: BUDGE | W320: PORT MELBOURNE | X320: 5 | Y320: 1 | Z320: 4 | AA320: 0 | AB320: 485 | AC320: 730 | AD320: =(AB320/AC320)*100 -> 66.438356164383563 | AE320: =(Y320*4)+(AA320*2) -> 4
A321: GOALKICKERS | M321: LAWRIE | P321: HICKS | W321: PRAHRAN | X321: 6 | Y321: 1 | Z321: 5 | AA321: 0 | AB321: 649 | AC321: 994 | AD321: =(AB321/AC321)*100 -> 65.291750503018108 | AE321: =(Y321*4)+(AA321*2) -> 4
A322: BOX HILL | C322: BOLTON 9 | E322: GLARE 6 | G322: BUTTIFANT 4 | J322: HOLT 3 | L322: HOGAN 3 | N322: NICHOLSON 2 | Q322: JOHNS 2 | W322: SANDRINGHAM | X322: 6 | Y322: 0 | Z322: 6 | AA322: 0 | AB322: 603 | AC322: 1006 | AD322: =(AB322/AC322)*100 -> 59.940357852882705 | AE322: =(Y322*4)+(AA322*2) -> 0
A323: CAMBERWELL | C323: LOCKMAN 6 | F323: TORPEY 3 | H323: DIPIERDOMENICO 2 | L323: JONES | N323: GREIG | P323: VITACCA | R323: SULLIVAN | W323: PRESTON | X323: 4 | Y323: 0 | Z323: 4 | AA323: 0 | AB323: 317 | AC323: 566 | AD323: =(AB323/AC323)*100 -> 56.007067137809187 | AE323: =(Y323*4)+(AA323*2) -> 0
S324: VENUE: OAKLEIGH | W324: DANDEN0NG | X324: 5 | Y324: 0 | Z324: 5 | AA324: 0 | AB324: 442 | AC324: 964 | AD324: =(AB324/AC324)*100 -> 45.850622406639005 | AE324: =(Y324*4)+(AA324*2) -> 0
A325: OAKLEIGH | C325: 4 | D325: 4 | E325: 28 | G325: 10 | H325: 7 | I325: 67 | K325: 17 | L325: 11 | M325: 113 | O325: 27 | P325: 13 | Q325: 175 | S325: CASTLE | W325: CAMBERWELL | X325: 4 | Y325: 0 | Z325: 4 | AA325: 0 | AB325: 356 | AC325: 948 | AD325: =(AB325/AC325)*100 -> 37.552742616033754 | AE325: =(Y325*4)+(AA325*2) -> 0
A326: WERRIBEE | C326: 3 | D326: 2 | E326: 20 | G326: 7 | H326: 8 | I326: 50 | K326: 11 | L326: 13 | M326: 79 | O326: 16 | P326: 16 | Q326: 112 | S326: GREEN
A327: BEST PLAYERS
A328: OAKLEIGH | C328: SMITH | F328: CUNNINGHAM | I328: PRETTO | K328: SUTHERLAND | N328: GARBUIO | Q328: BRIGGS
A329: WERRIBEE | C329: McMASTER | F329: MORRIS | I329: SIZER | K329: GREY | N329: VASILOU | Q329: MONTGOMERY
A330: GOALKICKERS
A331: OAKLEIGH | C331: PRETTO 12 | F331: SUTHERLAND 7 | I331: HANKS 3 | K331: OWEN 3 | M331: MITCHELSON 2
A332: WERRIBEE | C332: MONTGOMERY 4 | F332: TAYLOR 3 | I332: WRIGHT 3 | K332: MCMASTER 2 | N332: SIZER | P332: RADCLIFFE | R332: BOURKE
M333: KOL
A334: SPRINGVALE | C334: 5 | D334: 2 | E334: 32 | G334: 12 | H334: 8 | I334: 80 | K334: 16 | L334: 17 | M334: 113 | O334: 22 | P334: 19 | Q334: 151 | S334: VENUE: SPRINGVALE
A335: SANDRINGHAM | C335: 5 | D335: 4 | E335: 34 | G335: 8 | H335: 8 | I335: 56 | K335: 11 | L335: 9 | M335: 75 | O335: 16 | P335: 12 | Q335: 108 | S335: GERSCH :BULLUSS
A336: BEST PLAYERS
A337: SPRINGVALE | C337: PROSSER | F337: PALM | I337: DEMPSTER | L337: MARCOU | O337: WARNER | R337: MORGAN
A338: SANDRINGHAM | C338: WEST | F338: HOWARD | I338: FITZGERALD | L338: PRATT | O338: BERGMAN | R338: IRWIN
A339: GOALKICKERS
A340: SPRINGVALE | C340: PROSSER 6 | E340: ROBINSON 3 | H340: MALONI 2 | J340: MAYLIN 2 | M340: PALM 2 | O340: WARNER 2 | Q340: G CLARKE | S340: DUDLEY | W340: MENDE | X340: ANDERSON | AA340: SECCULL
A341: SANDRINGHAM | C341: IRWIN 3 | E341: F RUGOLO 3 | H341: ALLEN 2 | J341: DWYER 2 | L341: BERGMAN 2 | O341: J RUGOLO | Q341: MERSON | S341: HOWARD | W341: FISCHER
A343: WILLIAMSTOWN | C343: 5 | D343: 5 | E343: 35 | G343: 9 | H343: 7 | I343: 61 | K343: 17 | L343: 13 | M343: 115 | O343: 24 | P343: 17 | Q343: 161 | S343: VENUE: FRANKSTON
A344: FRANKSTON | C344: 2 | D344: 6 | E344: 18 | G344: 3 | H344: 11 | I344: 29 | K344: 7 | L344: 12 | M344: 54 | O344: 9 | P344: 14 | Q344: 68 | S344: HARVEY :CHILDS
A345: BEST PLAYERS
A346: WILLIAMSTOWN | C346: MUSCHIALLI | F346: AZIZ | I346: BURTON | L346: SLEVISON | O346: CAHILL | Q346: GHAZI
A347: FRANKSTON | C347: MACE | F347: LOUTTIT | I347: POLLOCK | L347: FOYSTER | O347: O'BRIEN | Q347: P MARTIN
A348: GOALKICKERS
A349: WILLIAMSTOWN | C349: RICKMAN 7 | F349: MUSCHIALLI 4 | I349: GHAZI 3 | K349: BURTON 3 | M349: CAHILL 2 | O349: KENNY 2 | Q349: GROENEWEGAN | U349: PASTORE | X349: McGOWAN
A350: FRANKSTON | C350: BINGLEY 2 | E350: FREW | F350: P MARTIN | H350: GAMBLE | J350: FOYSTER | L350: SHIELDS | N350: WATSON | P350: O'BRIEN
A352: PRAHRAN | C352: 4 | D352: 9 | E352: 33 | G352: 12 | H352: 13 | I352: 85 | K352: 18 | L352: 22 | M352: 130 | O352: 30 | P352: 23 | Q352: 203 | S352: VENUE: TOORAK PARK
A353: DANDENONG | C353: 0 | D353: 2 | E353: 2 | G353: 4 | H353: 7 | I353: 31 | K353: 7 | L353: 11 | M353: 53 | O353: 14 | P353: 13 | Q353: 97 | S353: COOK :HARRIS
A354: BEST PLAYERS
A355: PRAHRAN | C355: G GILES | F355: RICHARDS | I355: KANE | L355: SOULOS | O355: S GILES | R355: CARROLL
A356: DANDENONG | C356: BRUNNEN | F356: MILLANE | I356: D'ARCY | L356: G MARRA | O356: LINDSAY
A357: GOALKICKERS
A358: PRAHRAN | C358: G GILES 14 | F358: KLEINJANS 5 | I358: HEWITSON 2 | L358: SOULOS 2 | N358: MCNICHOLL 2 | Q358: EVANS 2 | S358: RICHARDS | W358: KANE | X358: FERGUS
A359: DANDENONG | C359: BRUNNEN 3 | F359: G MARRA 3 | I359: A MARRA 3 | L359: KANNOURAKIS 2 | O359: ARGOON | Q359: COLLARD | S359: NICHOLAS
A361: BYES | E361: PORT MELBOURNE | J361: PRESTON
A363: ROUND 7 | D363: 20TH/21ST MAY | I363: WEATHER | S363: VENUE: WILLIAMSTOWN
D364: 1ST QTR | H364: 2ND QTR | L364: 3RD QTR | P364: FINAL | S364: UMPIRES
A365: WILLIAMSTOWN | C365: 8 | D365: 2 | E365: 50 | G365: 13 | H365: 3 | I365: 81 | K365: 23 | L365: 4 | M365: 142 | O365: 30 | P365: 10 | Q365: 190 | S365: MORROW | Y365: LADDER | AC365: ROUND | AE365: 7
A366: WERRIBEE | C366: 2 | D366: 2 | E366: 14 | G366: 6 | H366: 7 | I366: 43 | K366: 7 | L366: 8 | M366: 50 | O366: 10 | P366: 12 | Q366: 72 | S366: FOLLETT
A367: BEST PLAYERS | W367: TEAM | X367: P | Y367: W | Z367: L | AA367: D | AB367: FOR | AC367: AGST | AD367: % | AE367: PTS
A368: WILLIAMSTOWN | C368: RICKMAN | F368: GHAZI | I368: DELRE | L368: MUSCHIALLI | O368: SLEVISON | R368: ROUND
A369: WERRIBEE | C369: MORRIS | F369: B SMITH | I369: SIZER | L369: R SMITH | O369: WRIGHT | R369: BOURKE | W369: WILLIAMSTOWN | X369: 7 | Y369: 7 | Z369: 0 | AA369: 0 | AB369: 1260 | AC369: 507 | AD369: =(AB369/AC369)*100 -> 248.52071005917159 | AE369: =(Y369*4)+(AA369*2) -> 28
A370: GOALKICKERS | N370: HOWLETT | W370: COBURG | X370: 7 | Y370: 7 | Z370: 0 | AA370: 0 | AB370: 1183 | AC370: 580 | AD370: =(AB370/AC370)*100 -> 203.96551724137933 | AE370: =(Y370*4)+(AA370*2) -> 28
A371: WILLIAMSTOWN | C371: RICKMAN 9 | F371: DELRE 6 | H371: GHAZI 4 | J371: V DIMARTINO 3 | M371: KENNY 3 | O371: MUSCHIALLI 3 | R371: PASTORE | W371: BOX HILL | X371: 6 | Y371: 6 | Z371: 0 | AA371: 0 | AB371: 889 | AC371: 676 | AD371: =(AB371/AC371)*100 -> 131.50887573964499 | AE371: =(Y371*4)+(AA371*2) -> 24
A372: WERRIBEE | C372: SELLS 2 | F372: TAYLOR 2 | I372: VASILOU 2 | L372: SIZER | N372: B SMITH | P372: SPIERINGS | R372: WALSH | W372: SPRINGVALE | X372: 6 | Y372: 5 | Z372: 1 | AA372: 0 | AB372: 985 | AC372: 550 | AD372: =(AB372/AC372)*100 -> 179.09090909090909 | AE372: =(Y372*4)+(AA372*2) -> 20
S373: VENUE: DANDENONG | W373: BRUNSWICK | X373: 5 | Y373: 4 | Z373: 1 | AA373: 0 | AB373: 811 | AC373: 530 | AD373: =(AB373/AC373)*100 -> 153.01886792452831 | AE373: =(Y373*4)+(AA373*2) -> 16
A374: BRUNSWICK | C374: 1 | D374: 6 | E374: 12 | G374: 12 | H374: 16 | I374: 88 | K374: 20 | L374: 20 | M374: 140 | O374: 29 | P374: 27 | Q374: 201 | S374: CLEMENT
A375: DANDENONG | C375: 4 | D375: 4 | E375: 28 | G375: 5 | H375: 4 | I375: 34 | K375: 9 | L375: 8 | M375: 62 | O375: 9 | P375: 10 | Q375: 64 | S375: PRINCE | W375: WERRIBEE | X375: 7 | Y375: 4 | Z375: 3 | AA375: 0 | AB375: 1049 | AC375: 864 | AD375: =(AB375/AC375)*100 -> 121.41203703703705 | AE375: =(Y375*4)+(AA375*2) -> 16
A376: BEST PLAYERS | W376: FRANKSTON | X376: 6 | Y376: 3 | Z376: 3 | AA376: 0 | AB376: 805 | AC376: 700 | AD376: =(AB376/AC376)*100 -> 115 | AE376: =(Y376*4)+(AA376*2) -> 12
A377: BRUNSWICK | C377: CLARK | F377: HYSLOP | I377: WRIGHT | L377: SALVADORE | O377: LOVETT | R377: BONE | W377: OAKLEIGH | X377: 6 | Y377: 3 | Z377: 3 | AA377: 0 | AB377: 800 | AC377: 841 | AD377: =(AB377/AC377)*100 -> 95.124851367419737 | AE377: =(Y377*4)+(AA377*2) -> 12
A378: DANDENONG | C378: McCONCHIE | F378: ATKINSON | I378: LINDSAY | L378: SIMMONS | O378: MORRISON | R378: MILLANE | W378: PRAHRAN | X378: 7 | Y378: 2 | Z378: 5 | AA378: 0 | AB378: 850 | AC378: 1094 | AD378: =(AB378/AC378)*100 -> 77.696526508226697 | AE378: =(Y378*4)+(AA378*2) -> 8
A379: GOALKICKERS | L379: CONNELL | N379: SALVADORE | Q379: CLARK | S379: HOLMES | W379: PORT MELBOURNE | X379: 6 | Y379: 2 | Z379: 4 | AA379: 0 | AB379: 632 | AC379: 827 | AD379: =(AB379/AC379)*100 -> 76.420798065296253 | AE379: =(Y379*4)+(AA379*2) -> 8
A380: BRUNSWICK | C380: HYSLOP 6 | E380: GRIFFITHS 4 | H380: CALLANDER 4 | K380: HERBERT 4 | M380: BONE 3 | O380: BEALE 2 | Q380: WRIGHT 2 | W380: SANDRINGHAM | X380: 7 | Y380: 0 | Z380: 7 | AA380: 0 | AB380: 730 | AC380: 1174 | AD380: =(AB380/AC380)*100 -> 62.180579216354346 | AE380: =(Y380*4)+(AA380*2) -> 0
A381: DANDENONG | C381: SIMMONS 2 | F381: KANNOURAKIS 2 | J381: ATKINSON | M381: BRUNNEN | O381: G MARRA | Q381: MYNOTT | W381: PRESTON | X381: 5 | Y381: 0 | Z381: 5 | AA381: 0 | AB381: 414 | AC381: 713 | AD381: =(AB381/AC381)*100 -> 58.064516129032263 | AE381: =(Y381*4)+(AA381*2) -> 0
N382: NICHOLAS | S382: VENUE: PORT MELBOURNE | W382: DANDEN0NG | X382: 6 | Y382: 0 | Z382: 6 | AA382: 0 | AB382: 506 | AC382: 1165 | AD382: =(AB382/AC382)*100 -> 43.433476394849784 | AE382: =(Y382*4)+(AA382*2) -> 0
A383: PORT MELBOURNE | C383: 5 | D383: 3 | E383: 33 | G383: 9 | H383: 7 | I383: 61 | K383: 16 | L383: 12 | M383: 108 | O383: 22 | P383: 15 | Q383: 147 | S383: LAWLOR | W383: CAMBERWELL | X383: 5 | Y383: 0 | Z383: 5 | AA383: 0 | AB383: 456 | AC383: 1149 | AD383: =(AB383/AC383)*100 -> 39.686684073107045 | AE383: =(Y383*4)+(AA383*2) -> 0
A384: PRESTON | C384: 4 | D384: 5 | E384: 29 | G384: 9 | H384: 7 | I384: 61 | K384: 12 | L384: 9 | M384: 81 | O384: 14 | P384: 13 | Q384: 97 | S384: LUCKMAN
A385: BEST PLAYERS
A386: PORT MELBOURNE | C386: CONDON | E386: HETHERTON | H386: VARI | K386: DERMOTT | N386: FITZPATRICK | Q386: PRITCHARD
A387: PRESTON | C387: JORDAN | E387: HEANEY | H387: HOCKING | K387: LAWSON | N387: PERCY
A388: GOALKICKERS
A389: PORT MELBOURNE | C389: VARI 7 | E389: CONDON 6 | G389: WRIGHT 4 | I389: HICKS 2 | K389: BAILEY | M389: HETHERTON | P389: LARKIN
A390: PRESTON | C390: LUMICISI 3 | E390: WATT 2 | G390: PLOWMAN 2 | J390: SENNO 2 | L390: JORDAN | N390: SHAW | P390: HEANEY
M391: VALKANIS | P391: DUNBAR
A392: COBURG | C392: 2 | D392: 3 | E392: 15 | G392: 9 | H392: 8 | I392: 62 | K392: 11 | L392: 11 | M392: 77 | O392: 13 | P392: 19 | Q392: 97 | S392: VENUE: COBURG
A393: FRANKSTON | C393: 4 | D393: 4 | E393: 28 | G393: 5 | H393: 8 | I393: 38 | K393: 10 | L393: 14 | M393: 74 | O393: 10 | P393: 15 | Q393: 75 | S393: McKENZIE :CASTLE
A394: BEST PLAYERS
A395: COBURG | C395: HOTCHKIN | F395: GUMLEY | I395: DOYLE | L395: LITTLER | O395: EADE | R395: KAAKOUR
A396: FRANKSTON | C396: FOYSTER | F396: MARTIN | I396: VANDERMEER | L396: HAMILL | O396: POLLOCK | R396: O'BRIEN
A397: GOALKICKERS
A398: COBURG | C398: KAAKOUR 3 | F398: LANGAN 3 | I398: ALLISON 2 | K398: GUMLEY | M398: REYNOLDSON | P398: WILLIAMS | R398: NIMMO | T398: DOYLE
A399: FRANKSTON | C399: MACE 2 | E399: LOUTTIT 2 | G399: WATSON 2 | I399: BINGLEY | K399: FREW | M399: HAMILL | O399: O'BRIEN
A401: OAKLEIGH | C401: 7 | D401: 5 | E401: 47 | G401: 12 | H401: 7 | I401: 79 | K401: 20 | L401: 11 | M401: 131 | O401: 26 | P401: 12 | Q401: 168 | S401: VENUE: BEACH ROAD
A402: SANDRINGHAM | C402: 4 | D402: 6 | E402: 30 | G402: 13 | H402: 10 | I402: 88 | K402: 13 | L402: 15 | M402: 93 | O402: 18 | P402: 19 | Q402: 127 | S402: HARVEY :OAKLAND
A403: BEST PLAYERS
A404: OAKLEIGH | C404: DYSON | F404: MITCHELSON | I404: PRETTO | L404: TODD | O404: GARBUIO | Q404: SMITH
A405: SANDRINGHAM | C405: HOWARD | F405: BEILBY | I405: ALLEN | L405: FITZGERALD | O405: PRATT
A406: GOALKICKERS
A407: OAKLEIGH | C407: PRETTO 11 | F407: MITCHELSON 5 | I407: GARBUIO 5 | L407: DESSENT | N407: OLEKSYN | P407: HANKS | R407: DYSON | T407: OWEN
A408: SANDRINGHAM | C408: F RUGOLO 5 | F408: PRATT 3 | H408: IRWIN 3 | J408: BERGMAN 3 | M408: HOWARD 2 | P408: FITZGERALD 2
A410: PRAHRAN | C410: 3 | D410: 3 | E410: 21 | G410: 15 | H410: 8 | I410: 98 | K410: 21 | L410: 14 | M410: 140 | O410: 31 | P410: 15 | Q410: 201 | S410: VENUE: CAMBERWELL
A411: CAMBERWELL | C411: 4 | D411: 4 | E411: 28 | G411: 4 | H411: 7 | I411: 31 | K411: 9 | L411: 9 | M411: 63 | O411: 15 | P411: 10 | Q411: 100 | S411: VERGONA :VANBEEK
A412: BEST PLAYERS
A413: PRAHRAN | C413: S GILES | F413: RICHARDS | I413: SOULOS | L413: G GILES | P413: EVANS | R413: HIPWORTH
A414: CAMBERWELL | C414: BUDGE | F414: TORPY | I414: JONES | L414: DIPIERDOMENICO | P414: TUCKER | R414: SULLIVAN
A415: GOALKICKERS
A416: PRAHRAN | C416: G GILES 7 | F416: EVANS 6 | H416: KLEINJANS 4 | K416: BENNETT 3 | M416: HEWITSON 3 | P416: S GILES 2 | R416: SOULOS 2 | U416: HIPWORTH 2 | Y416: FERGUS | AA416: KANE
A417: CAMBERWELL | C417: BUDGE 5 | E417: TUCKER 3 | H417: DIPIERDOMENICO 2 | L417: GREIG | N417: LOCKMAN | Q417: TOMSIC | S417: BOYCE | U417: JONES
A419: BYES | E419: SPRINGVALE | J419: BOX HILL
A421: ROUND 8 | D421: 27/28TH MAY | I421: WEATHER | S421: VENUE: WERRIBEE
D422: 1ST QTR | H422: 2ND QTR | L422: 3RD QTR | P422: FINAL | S422: UMPIRES
A423: BOX HILL | C423: 4 | D423: 5 | E423: 29 | G423: 8 | H423: 12 | I423: 60 | K423: 12 | L423: 18 | M423: 90 | O423: 19 | P423: 19 | Q423: 133 | S423: GARLAND | Y423: LADDER | AC423: ROUND | AE423: 8
A424: WERRIBEE | C424: 4 | D424: 4 | E424: 28 | G424: 7 | H424: 8 | I424: 50 | K424: 8 | L424: 12 | M424: 60 | O424: 14 | P424: 18 | Q424: 102 | S424: LUCKMAN
A425: BEST PLAYERS | W425: TEAM | X425: P | Y425: W | Z425: L | AA425: D | AB425: FOR | AC425: AGST | AD425: % | AE425: PTS
A426: BOX HILL | C426: HOCKING | F426: BANFIELD | I426: NICHOLSON | L426: JOHNS | O426: ZARAFA | R426: FRANCIS
A427: WERRIBEE | C427: CHRISTIANSEN | F427: McMASTER | I427: BOURKE | L427: RADCLIFFE | O427: DOMBERG | R427: B SMITH | W427: WILLIAMSTOWN | X427: 8 | Y427: 8 | Z427: 0 | AA427: 0 | AB427: 1418 | AC427: 599 | AD427: =(AB427/AC427)*100 -> 236.72787979966608 | AE427: =(Y427*4)+(AA427*2) -> 32
A428: GOALKICKERS | O428: DONOHUE | W428: COBURG | X428: 8 | Y428: 7 | Z428: 1 | AA428: 0 | AB428: 1275 | AC428: 738 | AD428: =(AB428/AC428)*100 -> 172.76422764227641 | AE428: =(Y428*4)+(AA428*2) -> 28
A429: BOX HILL | C429: JOHNS 4 | E429: GLARE 4 | G429: ZARAFA 3 | I429: BUTTIFANT 3 | L429: BOLTON 2 | N429: REEVES | P429: NICHOLSON | W429: BOX HILL | X429: 7 | Y429: 7 | Z429: 0 | AA429: 0 | AB429: 1022 | AC429: 778 | AD429: =(AB429/AC429)*100 -> 131.3624678663239 | AE429: =(Y429*4)+(AA429*2) -> 28
A430: WERRIBEE | C430: SELLS 5 | E430: GUINTA 2 | G430: SIZER 2 | I430: TAYLOR 2 | K430: WALSH | M430: R SMITH | O430: WRIGHT | W430: SPRINGVALE | X430: 6 | Y430: 5 | Z430: 1 | AA430: 0 | AB430: 985 | AC430: 550 | AD430: =(AB430/AC430)*100 -> 179.09090909090909 | AE430: =(Y430*4)+(AA430*2) -> 20
S431: VENUE: BRUNSWICK | W431: BRUNSWICK | X431: 6 | Y431: 5 | Z431: 1 | AA431: 0 | AB431: 978 | AC431: 668 | AD431: =(AB431/AC431)*100 -> 146.4071856287425 | AE431: =(Y431*4)+(AA431*2) -> 20
A432: BRUNSWICK | C432: 4 | D432: 5 | E432: 29 | G432: 11 | H432: 9 | I432: 75 | K432: 19 | L432: 13 | M432: 127 | O432: 25 | P432: 17 | Q432: 167 | S432: MORROW
A433: PORT MELBOURNE | C433: 2 | D433: 7 | E433: 19 | G433: 6 | H433: 11 | I433: 47 | K433: 13 | L433: 17 | M433: 95 | O433: 20 | P433: 18 | Q433: 138 | S433: CASTLE | W433: WERRIBEE | X433: 8 | Y433: 4 | Z433: 4 | AA433: 0 | AB433: 1151 | AC433: 997 | AD433: =(AB433/AC433)*100 -> 115.44633901705114 | AE433: =(Y433*4)+(AA433*2) -> 16
A434: BEST PLAYERS | W434: OAKLEIGH | X434: 7 | Y434: 4 | Z434: 3 | AA434: 0 | AB434: 951 | AC434: 930 | AD434: =(AB434/AC434)*100 -> 102.25806451612902 | AE434: =(Y434*4)+(AA434*2) -> 16
A435: BRUNSWICK | C435: HERBERT | F435: BONE | I435: McGUIRE | L435: BERTOLLO | O435: CONNELL | R435: HYSLOP | W435: FRANKSTON | X435: 6 | Y435: 3 | Z435: 3 | AA435: 0 | AB435: 805 | AC435: 700 | AD435: =(AB435/AC435)*100 -> 115 | AE435: =(Y435*4)+(AA435*2) -> 12
A436: PORT MELBOURNE | C436: HETHERTON | F436: PRITCHARD | I436: HARKINS | L436: SCURRAH | O436: VARI | W436: PRAHRAN | X436: 8 | Y436: 2 | Z436: 6 | AA436: 0 | AB436: 976 | AC436: 1230 | AD436: =(AB436/AC436)*100 -> 79.349593495934954 | AE436: =(Y436*4)+(AA436*2) -> 8
A437: GOALKICKERS | P437: REID | W437: PORT MELBOURNE | X437: 7 | Y437: 2 | Z437: 5 | AA437: 0 | AB437: 770 | AC437: 994 | AD437: =(AB437/AC437)*100 -> 77.464788732394368 | AE437: =(Y437*4)+(AA437*2) -> 8
A438: BRUNSWICK | C438: HERBERT 9 | F438: GRIFFITHS 4 | I438: WRIGHT 3 | K438: HYSLOP 3 | M438: HARMES 2 | O438: CLARK | Q438: HOLMES | S438: BONE | W438: PRESTON | X438: 6 | Y438: 1 | Z438: 5 | AA438: 0 | AB438: 684 | AC438: 805 | AD438: =(AB438/AC438)*100 -> 84.968944099378888 | AE438: =(Y438*4)+(AA438*2) -> 4
A439: PORT MELBOURNE | C439: S HARKINS 4 | F439: HICKS 3 | H439: VARI 3 | J439: HETHERTON 2 | M439: WRIGHT 2 | O439: BAILEY | Q439: CONDON | S439: LARKIN | W439: SANDRINGHAM | X439: 8 | Y439: 1 | Z439: 7 | AA439: 0 | AB439: 866 | AC439: 1300 | AD439: =(AB439/AC439)*100 -> 66.615384615384627 | AE439: =(Y439*4)+(AA439*2) -> 4
S440: VENUE: PRESTON | W440: DANDEN0NG | X440: 7 | Y440: 0 | Z440: 7 | AA440: 0 | AB440: 595 | AC440: 1316 | AD440: =(AB440/AC440)*100 -> 45.212765957446813 | AE440: =(Y440*4)+(AA440*2) -> 0
A441: PRESTON | C441: 10 | D441: 3 | E441: 63 | G441: 19 | H441: 6 | I441: 120 | K441: 29 | L441: 10 | M441: 184 | O441: 43 | P441: 12 | Q441: 270 | S441: PRINCE | W441: CAMBERWELL | X441: 6 | Y441: 0 | Z441: 6 | AA441: 0 | AB441: 548 | AC441: 1419 | AD441: =(AB441/AC441)*100 -> 38.618745595489784 | AE441: =(Y441*4)+(AA441*2) -> 0
A442: CAMBERWELL | C442: 1 | D442: 3 | E442: 9 | G442: 6 | H442: 10 | I442: 46 | K442: 9 | L442: 11 | M442: 65 | O442: 13 | P442: 14 | Q442: 92 | S442: MARSHALL
A443: BEST PLAYERS
A444: PRESTON | C444: PERCY | F444: DUNBAR | I444: MARCON | L444: SHAW | O444: HEANEY | Q444: LAWSON
A445: CAMBERWELL | C445: SULLIVAN | F445: VERESHAKA | I445: DIPIERDOMENICO | L445: TRIBE | O445: BUDGE | Q445: O'SULLIVAN
A446: GOALKICKERS | I446: BROWN 2 | K446: MARCON | M446: HOCKING | O446: HEANEY | Q446: JORDAN | S446: SENNO
A447: PRESTON | C447: SHAW 15 | E447: PLOWMAN 4 | H447: LUMICISI 4 | J447: VALKANIS 4 | M447: OWEN 3 | O447: DUNBAR 3 | Q447: HUNT 3
A448: CAMBERWELL | C448: VITACCA 4 | F448: SULLIVAN 3 | I448: DIPIERDOMENICO 2 | M448: TRIBE 2 | O448: BUDGE | Q448: O'SULLIVAN
A450: OAKLEIGH | C450: 4 | D450: 3 | E450: 27 | G450: 9 | H450: 10 | I450: 64 | K450: 16 | L450: 12 | M450: 108 | O450: 23 | P450: 13 | Q450: 151 | S450: VENUE: OAKLEIGH
A451: DANDENONG | C451: 4 | D451: 5 | E451: 29 | G451: 7 | H451: 5 | I451: 47 | K451: 10 | L451: 9 | M451: 69 | O451: 13 | P451: 11 | Q451: 89 | S451: LAWLOR :ANTHONY
A452: BEST PLAYERS
A453: OAKLEIGH | C453: DESSENT | F453: DYSON | I453: SMITH | L453: PRETTO | O453: BULTE | R453: GARBUIO
A454: DANDENONG | C454: BRUNNEN | F454: MILLANE | I454: McCONCHIE | L454: D'ARCY | O454: DUNBAR | R454: KANNOURAKIS
A455: GOALKICKERS
A456: OAKLEIGH | C456: PRETTO 11 | F456: OWEN 5 | H456: GARBUIO 2 | J456: COWLED 2 | M456: OLEKSYN | O456: HANKS | Q456: DYSON
A457: DANDENONG | C457: CANN 3 | E457: MYNOTT 3 | H457: ARGOON 2 | J457: BRUNNEN 2 | L457: KANNOURAKIS | O457: NICHOLAS | Q457: HILL
A459: SANDRINGHAM | C459: 5 | D459: 2 | E459: 32 | G459: 11 | H459: 6 | I459: 72 | K459: 15 | L459: 8 | M459: 98 | O459: 20 | P459: 16 | Q459: 136 | S459: VENUE: BEACH ROAD
A460: PRAHRAN | C460: 5 | D460: 9 | E460: 39 | G460: 10 | H460: 13 | I460: 73 | K460: 15 | L460: 15 | M460: 105 | O460: 18 | P460: 18 | Q460: 126 | S460: HARRIS :CAULFIELD
A461: BEST PLAYERS
A462: SANDRINGHAM | C462: BENNETT | F462: PRATT | I462: PHILBEY | L462: FITZGERALD | O462: ALLEN | Q462: F RUGOLO
A463: PRAHRAN | C463: KILEY | F463: S GILES | I463: HEWITSON | L463: HAMILTON | O463: SOULOS | Q463: BOWER
A464: GOALKICKERS
A465: SANDRINGHAM | C465: PHILBEY 5 | F465: BERGMAN 3 | I465: F RUGOLO 3 | L465: PRATT 2 | N465: EAVES 2 | P465: HOWARD | R465: BEILBY | T465: BENZIE | W465: FITZGERALD | X465: RYAN
A466: PRAHRAN | C466: HAMILTON 5 | F466: G GILES 4 | I466: SOULOS 3 | K466: EVANS 2 | M466: KLEINJANS 2 | P466: RICHARDS | R466: KILEY
A468: WILLIAMSTOWN | C468: 6 | D468: 2 | E468: 38 | G468: 14 | H468: 3 | I468: 87 | K468: 18 | L468: 9 | M468: 117 | O468: 24 | P468: 14 | Q468: 158 | S468: VENUE: COBURG
A469: COBURG | C469: 3 | D469: 4 | E469: 22 | G469: 5 | H469: 8 | I469: 44 | K469: 9 | L469: 10 | M469: 64 | O469: 13 | P469: 14 | Q469: 92 | S469: BULLUSS :HARVEY
A470: BEST PLAYERS
A471: WILLIAMSTOWN | C471: ROUND | F471: DELRE | I471: MURPHY | L471: SLEVISON | O471: CAHILL | Q471: PASTORE
A472: COBURG | C472: EVANS | F472: EADE | I472: GUMLEY | L472: TARANTO
A473: GOALKICKERS
A474: WILLIAMSTOWN | C474: RICKMAN 5 | F474: PASTORE 4 | I474: DELRE 4 | K474: GHAZI 4 | M474: McGOWAN 3 | P474: LITCHFIELD 2 | S474: KENNY | U474: AZIZ
A475: COBURG | C475: EADE 3 | E475: KAAKOUR 3 | H475: ALLISON 2 | J475: CHRITENSEN 2 | M475: REYNOLDSON | P475: TARANTO | R475: DOYLE
A477: BYES | F477: FRANKSTON | J477: SPRINGVALE
A479: ROUND 9 | D479: 3RD/4TH JUNE | I479: WEATHER | S479: VENUE: WILLIAMSTOWN
D480: 1ST QTR | H480: 2ND QTR | L480: 3RD QTR | P480: FINAL | S480: UMPIRES
A481: WILLIAMSTOWN | C481: 7 | D481: 3 | E481: 45 | G481: 15 | H481: 7 | I481: 97 | K481: 22 | L481: 13 | M481: 145 | O481: 25 | P481: 16 | Q481: 166 | S481: O'BRIEN | Y481: LADDER | AC481: ROUND | AE481: 9
A482: CAMBERWELL | C482: 1 | D482: 2 | E482: 8 | G482: 2 | H482: 2 | I482: 14 | K482: 3 | L482: 4 | M482: 22 | O482: 4 | P482: 10 | Q482: 34 | S482: VINEY
A483: BEST PLAYERS | W483: TEAM | X483: P | Y483: W | Z483: L | AA483: D | AB483: FOR | AC483: AGST | AD483: % | AE483: PTS
A484: WILLIAMSTOWN | C484: SWAN | E484: GHAZI | H484: BURTON | K484: LITCHFIELD | N484: HOWLETT | Q484: CAHILL
A485: CAMBERWELL | C485: GREIG | E485: JONES | H485: SULLIVAN | K485: DIPIERDOMENICO | N485: BUDGE | Q485: VERESHAKA | W485: WILLIAMSTOWN | X485: 9 | Y485: 9 | Z485: 0 | AA485: 0 | AB485: 1584 | AC485: 634 | AD485: =(AB485/AC485)*100 -> 249.8422712933754 | AE485: =(Y485*4)+(AA485*2) -> 36
A486: GOALKICKERS | J486: GROENEWEGAN | M486: V DIMARTINO | P486: MOURNEY | W486: COBURG | X486: 9 | Y486: 8 | Z486: 1 | AA486: 0 | AB486: 1404 | AC486: 777 | AD486: =(AB486/AC486)*100 -> 180.6949806949807 | AE486: =(Y486*4)+(AA486*2) -> 32
A487: WILLIAMSTOWN | C487: LITCHFIELD 10 | F487: GHAZI 4 | H487: RICKMAN 3 | J487: PASTORE 2 | M487: HOWLETT 2 | P487: McTAGGART | W487: BOX HILL | X487: 7 | Y487: 7 | Z487: 0 | AA487: 0 | AB487: 1022 | AC487: 778 | AD487: =(AB487/AC487)*100 -> 131.3624678663239 | AE487: =(Y487*4)+(AA487*2) -> 28
A488: CAMBERWELL | C488: SULLIVAN | F488: MITCHELL | I488: BOYCE | K488: KLEIN | W488: SPRINGVALE | X488: 7 | Y488: 6 | Z488: 1 | AA488: 0 | AB488: 1146 | AC488: 669 | AD488: =(AB488/AC488)*100 -> 171.30044843049328 | AE488: =(Y488*4)+(AA488*2) -> 24
R489: VENUE: TOORAK PARK | W489: BRUNSWICK | X489: 7 | Y489: 5 | Z489: 2 | AA489: 0 | AB489: 1097 | AC489: 829 | AD489: =(AB489/AC489)*100 -> 132.32810615199037 | AE489: =(Y489*4)+(AA489*2) -> 20
A490: COBURG | C490: 5 | D490: 5 | E490: 35 | G490: 8 | H490: 10 | I490: 58 | K490: 12 | L490: 12 | M490: 84 | O490: 19 | P490: 15 | Q490: 129 | S490: MARSHALL
A491: PRAHRAN | C491: 0 | D491: 5 | E491: 5 | G491: 1 | H491: 7 | I491: 13 | K491: 3 | L491: 12 | M491: 30 | O491: 4 | P491: 15 | Q491: 39 | S491: CARLAND | W491: FRANKSTON | X491: 7 | Y491: 4 | Z491: 3 | AA491: 0 | AB491: 909 | AC491: 783 | AD491: =(AB491/AC491)*100 -> 116.0919540229885 | AE491: =(Y491*4)+(AA491*2) -> 16
A492: BEST PLAYERS | W492: WERRIBEE | X492: 8 | Y492: 4 | Z492: 4 | AA492: 0 | AB492: 1151 | AC492: 997 | AD492: =(AB492/AC492)*100 -> 115.44633901705114 | AE492: =(Y492*4)+(AA492*2) -> 16
A493: COBURG | C493: EADE | F493: INGRAM | I493: RACOVOLIS | L493: REYNOLDSON | O493: WILLIAMS | Q493: WEATHERALD | W493: OAKLEIGH | X493: 8 | Y493: 4 | Z493: 4 | AA493: 0 | AB493: 1034 | AC493: 1034 | AD493: =(AB493/AC493)*100 -> 100 | AE493: =(Y493*4)+(AA493*2) -> 16
A494: PRAHRAN | C494: HEWITSON | F494: BOWER | I494: RICHARDS | L494: CARTLEDGE | O494: HIPWORTH | W494: PORT MELBOURNE | X494: 8 | Y494: 3 | Z494: 5 | AA494: 0 | AB494: 866 | AC494: 1080 | AD494: =(AB494/AC494)*100 -> 80.185185185185176 | AE494: =(Y494*4)+(AA494*2) -> 12
A495: GOALKICKERS | W495: PRESTON | X495: 7 | Y495: 2 | Z495: 5 | AA495: 0 | AB495: 746 | AC495: 840 | AD495: =(AB495/AC495)*100 -> 88.80952380952381 | AE495: =(Y495*4)+(AA495*2) -> 8
A496: COBURG | C496: WEATHERALD 5 | F496: REYNOLDSON 5 | I496: WILLIAMS 5 | L496: EADE 2 | N496: KENNEDY | Q496: RACOVOLIS | W496: PRAHRAN | X496: 9 | Y496: 2 | Z496: 7 | AA496: 0 | AB496: 1015 | AC496: 1359 | AD496: =(AB496/AC496)*100 -> 74.687270051508463 | AE496: =(Y496*4)+(AA496*2) -> 8
A497: PRAHRAN | C497: G GILES 2 | F497: BOWER | H497: RYAN | W497: SANDRINGHAM | X497: 9 | Y497: 1 | Z497: 8 | AA497: 0 | AB497: 952 | AC497: 1396 | AD497: =(AB497/AC497)*100 -> 68.194842406876788 | AE497: =(Y497*4)+(AA497*2) -> 4
S498: VENUE: PORT MELBOURNE | W498: DANDEN0NG | X498: 8 | Y498: 0 | Z498: 8 | AA498: 0 | AB498: 635 | AC498: 1378 | AD498: =(AB498/AC498)*100 -> 46.081277213352685 | AE498: =(Y498*4)+(AA498*2) -> 0
A499: PORT MELBOURNE | C499: 3 | D499: 2 | E499: 20 | G499: 6 | H499: 6 | I499: 42 | K499: 8 | L499: 10 | M499: 58 | O499: 14 | P499: 12 | Q499: 96 | S499: VERGONA | W499: CAMBERWELL | X499: 7 | Y499: 0 | Z499: 7 | AA499: 0 | AB499: 582 | AC499: 1585 | AD499: =(AB499/AC499)*100 -> 36.719242902208208 | AE499: =(Y499*4)+(AA499*2) -> 0
A500: SANDRINGHAM | C500: 7 | D500: 3 | E500: 45 | G500: 8 | H500: 5 | I500: 53 | K500: 11 | L500: 7 | M500: 73 | O500: 13 | P500: 8 | Q500: 86 | S500: NOLAN
A501: BEST PLAYERS
A502: PORT MELBOURNE | C502: CONDON | F502: HETHERTON | I502: HARKINS | L502: PRITCHARD | O502: HICKS | Q502: RAINSFORD
A503: SANDRINGHAM | C503: ALLEN | F503: FITZGERALD | I503: BENZIE | L503: CLEMENT | O503: BEILBY | Q503: PRATT
A504: PRAHRAN
A505: PORT MELBOURNE | C505: CONDON 9 | F505: RICE 2 | H505: HICKS 2 | J505: HARKINS
A506: SANDRINGHAM | C506: FITZGERALD 6 | F506: ALLEN 2 | H506: DALRYMPLE | K506: BEILBY | M506: BERGMAN | P506: DWYER | R506: SAID
A508: FRANKSTON | C508: 5 | D508: 1 | E508: 31 | G508: 8 | H508: 4 | I508: 52 | K508: 13 | L508: 6 | M508: 84 | O508: 16 | P508: 8 | Q508: 104 | S508: VENUE: OAKLEIGH
A509: OAKLEIGH | C509: 3 | D509: 4 | E509: 22 | G509: 4 | H509: 8 | I509: 32 | K509: 8 | L509: 12 | M509: 60 | O509: 11 | P509: 17 | Q509: 83 | S509: SAVILLE :HOLT
A510: BEST PLAYERS
A511: FRANKSTON | C511: VANDERMEER | F511: MACE | I511: GAMBLE | L511: POLLOCK | O511: FOYSTER | R511: SHARPE
A512: OAKLEIGH | C512: DYSON | F512: BULTE | I512: HILLIARD | L512: JOHNSON | O512: SMITH | R512: DESSENT
A513: GOALKICKERS
A514: FRANKSTON | C514: BROWN 3 | E514: BINGLEY 3 | G514: O'BREIN 2 | I514: LOUTTIT 2 | K514: NIKAKIS 2 | M514: HAMILL | O514: WATSON | Q514: POLLOCK | S514: FREW
A515: OAKLEIGH | C515: PRETTO 3 | F515: OLEKSYN 3 | I515: LOWE 3 | K515: NICHOLSON 2
A517: PRESTON | C517: 4 | D517: 2 | E517: 26 | G517: 4 | H517: 9 | I517: 33 | K517: 4 | L517: 12 | M517: 36 | O517: 8 | P517: 14 | Q517: 62 | S517: VENUE: DANDENONG
A518: DANDENONG | C518: 2 | D518: 5 | E518: 17 | G518: 3 | H518: 7 | I518: 25 | K518: 3 | L518: 9 | M518: 27 | O518: 4 | P518: 11 | Q518: 35 | S518: THOMPSON :LAWLOR
A519: BEST PLAYERS
A520: PRESTON | C520: LUMICISI | F520: BROWN | I520: DUNBAR | L520: PRITCHARD | O520: PERCY | Q520: MARCON
A521: DANDENONG | C521: MILLANE | F521: LINDSAY | I521: ATKINSON | L521: YOUNG | O521: DODDS | Q521: MERRIGAN
A522: GOALKICKERS
A523: PRESTON | C523: LUMICISI 2 | F523: MARCON | I523: DUNBAR | K523: SENNO | M523: BROWN | O523: LAWSON | Q523: VALKANIS
A524: DANDENONG | C524: YOUNG | F524: SIMMONS | I524: HILL | K524: CANN
A526: SPRINGVALE | C526: 11 | D526: 4 | E526: 70 | G526: 17 | H526: 8 | I526: 110 | K526: 20 | L526: 15 | M526: 135 | O526: 24 | P526: 17 | Q526: 161 | S526: VENUE: SPRINGVALE
A527: BRUNSWICK | C527: 5 | D527: 4 | E527: 34 | G527: 10 | H527: 8 | I527: 68 | K527: 15 | L527: 9 | M527: 99 | O527: 18 | P527: 11 | Q527: 119 | S527: BULLUSS :LUCKMAN
A528: BEST PLAYERS
A529: SPRINGVALE | C529: CLARK | F529: MALONI | I529: JEFFS | K529: DEMPSTER | N529: WARNER | Q529: DUDLEY
A530: BRUNSWICK | C530: GRIFFITHS | F530: HERBERT | I530: KERR | K530: SALVADORE | N530: McGUIRE | Q530: BONE
A531: GOALKICKERS
A532: SPRINGVALE | C532: DUDLEY 4 | E532: G CLARKE 3 | H532: ANDERSON 3 | K532: MALONI 3 | M532: ROBINSON 3 | P532: SHANNON 3 | R532: NORMAN 2 | W532: PROSSER 2 | Y532: MARCOU
A533: BRUNSWICK | C533: GRIFFITHS 7 | F533: HERBERT 3 | I533: HARMES 2 | K533: BONE 2 | M533: CALLANDER | P533: HOLMES | R533: HYSLOP | U533: KERR
A535: BYES | F535: BOX HILL | J535: WERRIBEE
A537: ROUND 10 | D537: 17/18TH JUNE | I537: WEATHER | S537: VENUE: FRANKSTON
D538: 1ST QTR | H538: 2ND QTR | L538: 3RD QTR | P538: FINAL | S538: UMPIRES
A539: FRANKSTON | C539: 4 | D539: 5 | E539: 29 | G539: 6 | H539: 9 | I539: 45 | K539: 11 | L539: 11 | M539: 77 | O539: 17 | P539: 15 | Q539: 117 | S539: CULLEN | Y539: LADDER | AC539: ROUND | AE539: 10
A540: SPRINGVALE | C540: 4 | D540: 2 | E540: 26 | G540: 7 | H540: 5 | I540: 47 | K540: 7 | L540: 5 | M540: 47 | O540: 8 | P540: 7 | Q540: 55 | S540: CAMERON
A541: BEST PLAYERS | W541: TEAM | X541: P | Y541: W | Z541: L | AA541: D | AB541: FOR | AC541: AGST | AD541: % | AE541: PTS
A542: FRANKSTON | C542: D MARTIN | F542: MACE | I542: GAMBLE | L542: SHIELDS | O542: SARAU | Q542: BROWN
A543: SPRINGVALE | C543: CLARKE | F543: FOY | I543: PALM | L543: DUDLEY | W543: WILLIAMSTOWN | X543: 9 | Y543: 9 | Z543: 0 | AA543: 0 | AB543: 1584 | AC543: 634 | AD543: =(AB543/AC543)*100 -> 249.8422712933754 | AE543: =(Y543*4)+(AA543*2) -> 36
A544: GOALKICKERS | W544: COBURG | X544: 10 | Y544: 9 | Z544: 1 | AA544: 0 | AB544: 1455 | AC544: 815 | AD544: =(AB544/AC544)*100 -> 178.52760736196319 | AE544: =(Y544*4)+(AA544*2) -> 36
A545: FRANKSTON | C545: BROWN 6 | F545: KEANE 3 | H545: SHIELDS 2 | J545: BINGLEY 2 | M545: HAMILL 2 | O545: P MARTIN | Q545: FOYSTER | W545: BOX HILL | X545: 8 | Y545: 7 | Z545: 1 | AA545: 0 | AB545: 1060 | AC545: 829 | AD545: =(AB545/AC545)*100 -> 127.8648974668275 | AE545: =(Y545*4)+(AA545*2) -> 28
A546: SPRINGVALE | C546: ROBINSON 2 | F546: SHANNON 2 | I546: PALM | K546: CLARKE | M546: DUDLEY | O546: PROSSER | W546: SPRINGVALE | X546: 8 | Y546: 6 | Z546: 2 | AA546: 0 | AB546: 1201 | AC546: 786 | AD546: =(AB546/AC546)*100 -> 152.79898218829518 | AE546: =(Y546*4)+(AA546*2) -> 24
S547: VENUE: PRESTON | W547: BRUNSWICK | X547: 8 | Y547: 6 | Z547: 2 | AA547: 0 | AB547: 1205 | AC547: 875 | AD547: =(AB547/AC547)*100 -> 137.71428571428572 | AE547: =(Y547*4)+(AA547*2) -> 24
A548: PRESTON | C548: 5 | D548: 7 | E548: 37 | G548: 5 | H548: 7 | I548: 37 | K548: 7 | L548: 9 | M548: 51 | O548: 7 | P548: 9 | Q548: 51 | S548: BULLUSS
A549: WERRIBEE | C549: 2 | D549: 1 | E549: 13 | G549: 5 | H549: 7 | I549: 37 | K549: 6 | L549: 9 | M549: 45 | O549: 6 | P549: 12 | Q549: 48 | S549: SAVILLE | W549: FRANKSTON | X549: 8 | Y549: 5 | Z549: 3 | AA549: 0 | AB549: 1026 | AC549: 838 | AD549: =(AB549/AC549)*100 -> 122.43436754176611 | AE549: =(Y549*4)+(AA549*2) -> 20
A550: BEST PLAYERS | W550: WERRIBEE | X550: 9 | Y550: 4 | Z550: 5 | AA550: 0 | AB550: 1199 | AC550: 1048 | AD550: =(AB550/AC550)*100 -> 114.40839694656488 | AE550: =(Y550*4)+(AA550*2) -> 16
A551: PRESTON | C551: M LAWSON | F551: HUNT | I551: LUMICISI | L551: PERCY | O551: PRITCHARD | R551: JORDAN | W551: OAKLEIGH | X551: 9 | Y551: 4 | Z551: 5 | AA551: 0 | AB551: 1060 | AC551: 1098 | AD551: =(AB551/AC551)*100 -> 96.539162112932615 | AE551: =(Y551*4)+(AA551*2) -> 16
A552: WERRIBEE | C552: DOMBERG | F552: HIGGINS | I552: CHRISTIANSEN | L552: SELLS | O552: McMASTER | R552: SIZER | W552: PORT MELBOURNE | X552: 9 | Y552: 4 | Z552: 5 | AA552: 0 | AB552: 938 | AC552: 1102 | AD552: =(AB552/AC552)*100 -> 85.117967332123413 | AE552: =(Y552*4)+(AA552*2) -> 16
A553: GOALKICKERS | W553: PRESTON | X553: 8 | Y553: 3 | Z553: 5 | AA553: 0 | AB553: 797 | AC553: 888 | AD553: =(AB553/AC553)*100 -> 89.752252252252248 | AE553: =(Y553*4)+(AA553*2) -> 12
A554: PRESTON | C554: C LAWSON 2 | F554: JORDAN 2 | I554: M LAWSON | L554: DUNBAR | N554: SHAW | W554: PRAHRAN | X554: 10 | Y554: 3 | Z554: 7 | AA554: 0 | AB554: 1079 | AC554: 1385 | AD554: =(AB554/AC554)*100 -> 77.906137184115522 | AE554: =(Y554*4)+(AA554*2) -> 12
A555: WERRIBEE | C555: SELLS 3 | F555: HIGGINS 2 | I555: WALSH | W555: SANDRINGHAM | X555: 9 | Y555: 1 | Z555: 8 | AA555: 0 | AB555: 952 | AC555: 1396 | AD555: =(AB555/AC555)*100 -> 68.194842406876788 | AE555: =(Y555*4)+(AA555*2) -> 4
S556: VENUE: CAMBERWELL | W556: DANDEN0NG | X556: 9 | Y556: 0 | Z556: 9 | AA556: 0 | AB556: 657 | AC556: 1450 | AD556: =(AB556/AC556)*100 -> 45.310344827586206 | AE556: =(Y556*4)+(AA556*2) -> 0
A557: BRUNSWICK | C557: 5 | D557: 3 | E557: 33 | G557: 6 | H557: 7 | I557: 43 | K557: 10 | L557: 9 | M557: 69 | O557: 15 | P557: 18 | Q557: 108 | S557: NOLAN | W557: CAMBERWELL | X557: 8 | Y557: 0 | Z557: 8 | AA557: 0 | AB557: 628 | AC557: 1693 | AD557: =(AB557/AC557)*100 -> 37.093916125221497 | AE557: =(Y557*4)+(AA557*2) -> 0
A558: CAMBERWELL | C558: 2 | D558: 1 | E558: 13 | G558: 3 | H558: 3 | I558: 21 | K558: 5 | L558: 3 | M558: 33 | O558: 7 | P558: 4 | Q558: 46 | S558: ALLEN
A559: BEST PLAYERS
A560: BRUNSWICK | C560: CLARKE | F560: HOLMES | I560: BONE | L560: DAVIS | N560: SALVADORE | Q560: BERTOLLO
A561: CAMBERWELL | C561: HIPWORTH | F561: BUDGE | I561: GREIG | L561: BOYCE | N561: JONES | Q561: VERESHAKA
A562: GOALKICKERS | Q562: WRIGHT
A563: BRUNSWICK | C563: BONE 3 | E563: HERBERT 3 | G563: POTTER 3 | I563: GRIFFITHS 2 | L563: CLARKE | N563: HOLMES | P563: THOROGOOD
A564: CAMBERWELL | C564: SULLIVAN 3 | F564: JONES | H564: REEVES | J564: TORPY | L564: VITACCA
A566: PRAHRAN | C566: 2 | D566: 5 | E566: 17 | G566: 3 | H566: 7 | I566: 25 | K566: 7 | L566: 9 | M566: 51 | O566: 9 | P566: 10 | Q566: 64 | S566: VENUE: TOORAK PARK
A567: OAKLEIGH | C567: 0 | D567: 1 | E567: 1 | G567: 2 | H567: 7 | I567: 19 | K567: 2 | L567: 8 | M567: 20 | O567: 3 | P567: 8 | Q567: 26 | S567: SNEDDON :VINEY
A568: BEST PLAYERS
A569: PRAHRAN | C569: WHITE | F569: CARTLEDGE | I569: HEWITSON | L569: S GILES | O569: RICHARDS | R569: FERGUS
A570: OAKLEIGH | C570: TODD | F570: BULTE | I570: SMITH | L570: LOWE | O570: ATHERTON | R570: CUNNINGHAM
A571: GOALKICKERS
A572: PRAHRAN | C572: HUTCHISON 3 | F572: M EVANS 2 | I572: SOULOS 2 | K572: HEWITSON | N572: KLEINJANS
A573: OAKLEIGH | C573: OWEN 2 | F573: ATHERTON
A575: COBURG | C575: 2 | D575: 2 | E575: 14 | G575: 4 | H575: 7 | I575: 31 | K575: 6 | L575: 9 | M575: 45 | O575: 7 | P575: 9 | Q575: 51 | S575: VENUE: COBURG
A576: BOX HILL | C576: 3 | D576: 2 | E576: 20 | G576: 4 | H576: 2 | I576: 26 | K576: 4 | L576: 4 | M576: 28 | O576: 5 | P576: 8 | Q576: 38 | S576: CASTLE :FOSTER
A577: BEST PLAYERS
A578: COBURG | C578: RIENIETS | F578: RACOVOLIS | I578: EADE | L578: INGRAM | O578: BASSETT | R578: GUMLEY
A579: BOX HILL | C579: BANFIELD | F579: ZARAFA | I579: FRANCIS | L579: NICHOLSON | O579: O'BRIEN | R579: BROWN
A580: GOALKICKERS
A581: COBURG | C581: WILLIAMS 2 | F581: WEATHERALD 2 | J581: DARBY | L581: BASSETT | O581: RACOVOLIS
A582: BOX HILL | C582: BOLTON 2 | F582: ZARAFA 2 | I582: NICHOLSON
A584: PORT MELBOURNE | C584: 3 | D584: 5 | E584: 23 | G584: 7 | H584: 9 | I584: 51 | K584: 9 | L584: 11 | M584: 65 | O584: 10 | P584: 12 | Q584: 72 | S584: VENUE: DANDENONG
A585: DANDENONG | C585: 1 | D585: 0 | E585: 6 | G585: 2 | H585: 5 | I585: 17 | K585: 2 | L585: 6 | M585: 18 | O585: 2 | P585: 10 | Q585: 22 | S585: KILMER ;COATES
A586: BEST PLAYERS
A587: PORT MELBOURNE | C587: ERWIN | F587: STROOPER | I587: LIDDLE | L587: CARIS | O587: HETHERTON | R587: RAINSFORD
A588: DANDENONG | C588: LINDSAY | F588: LACKO | I588: DODDS | L588: MILLANE | O588: McCONCHIE | R588: BRUNNEN
A589: GOALKICKERS
A590: PORT MELBOURNE | C590: VARI 4 | E590: CONDON 3 | H590: NORTON 2 | K590: LIDDLE
A591: DANDENONG | C591: LINDSAY | F591: MYNOTT
A593: BYES | F593: WILLIAMSTOWN | J593: SANDRINGHAM
A595: ROUND 11 | D595: 24/25TH JUNE | I595: WEATHER | S595: VENUE: PORT MELBOURNE
D596: 1ST QTR | H596: 2ND QTR | L596: 3RD QTR | P596: FINAL | S596: UMPIRES
A597: PORT MELBOURNE | C597: 2 | D597: 3 | E597: 15 | G597: 5 | H597: 7 | I597: 37 | K597: 8 | L597: 11 | M597: 59 | O597: 10 | P597: 13 | Q597: 73 | S597: SAVILLE | Y597: LADDER | AC597: ROUND | AE597: 11
A598: PRAHRAN | C598: 2 | D598: 1 | E598: 13 | G598: 3 | H598: 3 | I598: 21 | K598: 5 | L598: 5 | M598: 35 | O598: 6 | P598: 6 | Q598: 42 | S598: LAWLOR
A599: BEST PLAYERS | W599: TEAM | X599: P | Y599: W | Z599: L | AA599: D | AB599: FOR | AC599: AGST | AD599: % | AE599: PTS
A600: PORT MELBOURNE | C600: FOLEY | F600: ERWIN | I600: CARIS | K600: HETHERTON | N600: CHADBAND | Q600: RAINSFORD
A601: PRAHRAN | C601: HIPWORTH | F601: S GILES | I601: WHITE | K601: EVANS | N601: SOULOS | Q601: HUTCHISON | W601: COBURG | X601: 11 | Y601: 10 | Z601: 1 | AA601: 0 | AB601: 1511 | AC601: 866 | AD601: =(AB601/AC601)*100 -> 174.48036951501155 | AE601: =(Y601*4)+(AA601*2) -> 40
A602: GOALKICKERS | W602: WILLIAMSTOWN | X602: 10 | Y602: 9 | Z602: 0 | AA602: 1 | AB602: 1674 | AC602: 724 | AD602: =(AB602/AC602)*100 -> 231.21546961325964 | AE602: =(Y602*4)+(AA602*2) -> 38
A603: PORT MELBOURNE | C603: CONDON 5 | F603: HARKINS 2 | I603: ERWIN | K603: PRITCHARD | N603: SCURRAH | W603: BOX HILL | X603: 9 | Y603: 7 | Z603: 1 | AA603: 1 | AB603: 1150 | AC603: 919 | AD603: =(AB603/AC603)*100 -> 125.1360174102285 | AE603: =(Y603*4)+(AA603*2) -> 30
A604: PRAHRAN | C604: HUTCHISON 3 | F604: HEWITSON | I604: SOULOS | K604: EVANS | W604: SPRINGVALE | X604: 9 | Y604: 7 | Z604: 2 | AA604: 0 | AB604: 1289 | AC604: 827 | AD604: =(AB604/AC604)*100 -> 155.86457073760579 | AE604: =(Y604*4)+(AA604*2) -> 28
S605: VENUE: CAMBERWELL | W605: BRUNSWICK | X605: 9 | Y605: 6 | Z605: 3 | AA605: 0 | AB605: 1256 | AC605: 931 | AD605: =(AB605/AC605)*100 -> 134.90870032223415 | AE605: =(Y605*4)+(AA605*2) -> 24
A606: DANDENONG | C606: 5 | D606: 3 | E606: 33 | G606: 8 | H606: 7 | I606: 55 | K606: 15 | L606: 9 | M606: 99 | O606: 18 | P606: 11 | Q606: 119 | S606: CULLEN
A607: CAMBERWELL | C607: 6 | D607: 1 | E607: 37 | G607: 7 | H607: 5 | I607: 47 | K607: 11 | L607: 7 | M607: 73 | O607: 11 | P607: 7 | Q607: 73 | S607: SNEDDON | W607: FRANKSTON | X607: 9 | Y607: 5 | Z607: 4 | AA607: 0 | AB607: 1124 | AC607: 973 | AD607: =(AB607/AC607)*100 -> 115.51901336073998 | AE607: =(Y607*4)+(AA607*2) -> 20
A608: BEST PLAYERS | W608: PORT MELBOURNE | X608: 10 | Y608: 5 | Z608: 5 | AA608: 0 | AB608: 1009 | AC608: 1144 | AD608: =(AB608/AC608)*100 -> 88.199300699300693 | AE608: =(Y608*4)+(AA608*2) -> 20
A609: DANDENONG | C609: TEAM EFFORT | W609: WERRIBEE | X609: 10 | Y609: 4 | Z609: 6 | AA609: 0 | AB609: 1240 | AC609: 1136 | AD609: =(AB609/AC609)*100 -> 109.1549295774648 | AE609: =(Y609*4)+(AA609*2) -> 16
A610: CAMBERWELL | C610: GOLLANT | F610: JONES | I610: SULLIVAN | L610: TORPY | O610: DIPIERDOMENICO | W610: OAKLEIGH | X610: 10 | Y610: 4 | Z610: 6 | AA610: 0 | AB610: 1153 | AC610: 1217 | AD610: =(AB610/AC610)*100 -> 94.741166803615457 | AE610: =(Y610*4)+(AA610*2) -> 16
A611: GOALKICKERS | O611: MILLANE | W611: PRESTON | X611: 9 | Y611: 4 | Z611: 5 | AA611: 0 | AB611: 916 | AC611: 981 | AD611: =(AB611/AC611)*100 -> 93.374108053007134 | AE611: =(Y611*4)+(AA611*2) -> 16
A612: DANDENONG | C612: NICHOLLS 4 | F612: METE 3 | H612: MYNOTT 3 | J612: LACKO 2 | L612: ATKINSON 2 | O612: DODDS 2 | Q612: YOUNG | W612: PRAHRAN | X612: 11 | Y612: 3 | Z612: 8 | AA612: 0 | AB612: 1121 | AC612: 1458 | AD612: =(AB612/AC612)*100 -> 76.886145404663921 | AE612: =(Y612*4)+(AA612*2) -> 12
A613: CAMBERWELL | C613: SULLIVAN 6 | F613: HIPWORTH 2 | I613: DIPIERDOMENICO | M613: JONES | O613: VITACCA | W613: SANDRINGHAM | X613: 10 | Y613: 2 | Z613: 8 | AA613: 0 | AB613: 1087 | AC613: 1494 | AD613: =(AB613/AC613)*100 -> 72.757697456492636 | AE613: =(Y613*4)+(AA613*2) -> 8
R614: VENUE: BEACH ROAD | W614: DANDEN0NG | X614: 10 | Y614: 1 | Z614: 9 | AA614: 0 | AB614: 776 | AC614: 1523 | AD614: =(AB614/AC614)*100 -> 50.952068286277083 | AE614: =(Y614*4)+(AA614*2) -> 4
A615: SANDRINGHAM | C615: 5 | D615: 6 | E615: 36 | G615: 11 | H615: 7 | I615: 73 | K615: 17 | L615: 12 | M615: 114 | O615: 20 | P615: 15 | Q615: 135 | S615: MORROW | W615: CAMBERWELL | X615: 9 | Y615: 0 | Z615: 9 | AA615: 0 | AB615: 701 | AC615: 1812 | AD615: =(AB615/AC615)*100 -> 38.686534216335538 | AE615: =(Y615*4)+(AA615*2) -> 0
A616: FRANKSTON | C616: 4 | D616: 0 | E616: 24 | G616: 8 | H616: 2 | I616: 50 | K616: 10 | L616: 4 | M616: 64 | O616: 15 | P616: 8 | Q616: 98 | S616: FOSTER
A617: BEST PLAYERS
A618: SANDRINGHAM | C618: TEAM EFFORT
A619: FRANKSTON | C619: SARAU | F619: BELL | I619: BINGLEY | L619: VANDERMEER | O619: POLLOCK
A620: GOALKICKERS | K620: PRATT | M620: DALRYMPLE | P620: J RUGOLO
A621: SANDRINGHAM | C621: FITZGERALD 5 | F621: ALLEN 3 | H621: EAVES 2 | J621: HOWARD 2 | M621: DWYER 2 | O621: SAID 2 | Q621: PHILBEY
A622: FRANKSTON | C622: BINGLEY 6 | F622: BROWN 2 | I622: SHIELDS 2 | K622: KEANE 2 | M622: LOUTTIT | O622: MACE | Q622: VANDERMEER
A624: SPRINGVALE | C624: 3 | D624: 4 | E624: 22 | G624: 6 | H624: 4 | I624: 40 | K624: 10 | L624: 6 | M624: 66 | O624: 13 | P624: 10 | Q624: 88 | S624: VENUE: WERRIBEE
A625: WERRIBEE | C625: 3 | D625: 2 | E625: 20 | G625: 4 | H625: 3 | I625: 27 | K625: 5 | L625: 4 | M625: 34 | O625: 6 | P625: 5 | Q625: 41 | S625: DORE :MARSHALL
A626: BEST PLAYERS
A627: SPRINGVALE | C627: MENDE | F627: FOY | I627: PHILLIPS | L627: MAYLIN | O627: NICOL | R627: MALONI
A628: WERRIBEE | C628: B SMITH | F628: BOURKE | I628: FENTON | L628: CHAPMAN | O628: McMASTER | R628: HIGGINS
A629: GOALKICKERS
A630: SPRINGVALE | C630: MENDE 4 | E630: ROBINSON 3 | H630: PROSSER 2 | K630: CLARK | M630: MALONI | O630: PHILLIPS | Q630: JEFFS
A631: WERRIBEE | C631: SELLS 3 | F631: MCMASTER | I631: HIGGINS | K631: FLEMING
A633: COBURG | C633: 0 | D633: 4 | E633: 4 | G633: 2 | H633: 7 | I633: 19 | K633: 6 | L633: 8 | M633: 44 | O633: 8 | P633: 8 | Q633: 56 | S633: VENUE: COBURG
A634: BRUNSWICK | C634: 2 | D634: 1 | E634: 13 | G634: 4 | H634: 1 | I634: 25 | K634: 6 | L634: 3 | M634: 39 | O634: 8 | P634: 3 | Q634: 51 | S634: VINEY ;CARLAND
A635: BEST PLAYERS
A636: COBURG | C636: WEIDEMAN | F636: GUMLEY | I636: BASSETT | L636: EADE | O636: INGRAM | R636: KAAKOUR
A637: BRUNSWICK | C637: BONE | F637: KERR | I637: CLARK | L637: LOVETT | O637: McGUIRE | R637: BERTOLLO
A638: GOALKICKERS
A639: COBURG | C639: KAAKOUR 4 | F639: BASSETT | I639: REYNOLDSON | L639: WEATHERALD | O639: DOYLE
A640: BRUNSWICK | C640: BONE 3 | F640: BERTOLLO 2 | I640: HERBERT | K640: CLARK | M640: LOVETT
A642: PRESTON | C642: 7 | D642: 2 | E642: 44 | G642: 12 | H642: 6 | I642: 78 | K642: 15 | L642: 9 | M642: 99 | O642: 18 | P642: 11 | Q642: 119 | S642: VENUE: OAKLEIGH
A643: OAKLEIGH | C643: 2 | D643: 1 | E643: 13 | G643: 4 | H643: 6 | I643: 30 | K643: 10 | L643: 8 | M643: 68 | O643: 14 | P643: 9 | Q643: 93 | S643: CASTLE :VERGONA
A644: BEST PLAYERS
A645: PRESTON | C645: VALKANIS | F645: HUNT | I645: BROWN | L645: PRITCHARD | O645: PERCY | R645: DUNBAR
A646: OAKLEIGH | C646: GARBUIO | F646: DYSON | I646: MITCHELSON | L646: JOHNSON | O646: KLIBINGAITIS | R646: TODD
A647: GOALKICKERS
A648: PRESTON | C648: BROWN 5 | F648: SHAW 5 | H648: JORDAN 3 | J648: MARCON | L648: DUNBAR | N648: DINTINOSANTE | Q648: C LAWSON | T648: EGAN
A649: OAKLEIGH | C649: PRETTO 3 | F649: MARSHALL 2 | I649: LOWE 2 | K649: GARBUIO 2 | N649: ATHERTON | Q649: OLEKSYN | S649: DYSON | W649: KLIBINGAITIS | X649: SERCIA
A651: WILLIAMSTOWN | C651: 3 | D651: 5 | E651: 23 | G651: 7 | H651: 9 | I651: 51 | K651: 10 | L651: 11 | M651: 71 | O651: 13 | P651: 12 | Q651: 90 | S651: VENUE: WILLIAMSTOWN
A652: BOX HILL | C652: 5 | D652: 1 | E652: 31 | G652: 6 | H652: 2 | I652: 38 | K652: 10 | L652: 2 | M652: 62 | O652: 14 | P652: 6 | Q652: 90 | S652: CAMERON ;ALLEN
A653: BEST PLAYERS
A654: WILLIAMSTOWN | C654: SWAN | F654: DELRE | I654: HOWLETT | L654: BURTON | O654: McTAGGART | R654: ROUND
A655: BOX HILL | C655: HOLT | F655: BANFIELD | I655: BROWN | L655: O'BRIEN | O655: ZARAFA | R655: HOCKING
A656: GOALKICKERS
A657: WILLIAMSTOWN | C657: DELRE 6 | F657: GHAZI 2 | H657: McGOWAN | J657: V DIMARTINO | M657: RICKMAN | O657: MOURNEY | R657: HOWLETT
A658: BOX HILL | C658: BOLTON 6 | F658: BUTTIFANT 5 | I658: ZARAFA | K658: LAWRIE
A660: ROUND 12 | D660: 1ST /2ND JULY | I660: WEATHER | S660: VENUE: BOX HILL
D661: 1ST QTR | H661: 2ND QTR | L661: 3RD QTR | P661: FINAL | S661: UMPIRES
A662: BOX HILL | C662: 6 | D662: 2 | E662: 38 | G662: 12 | H662: 5 | I662: 77 | K662: 18 | L662: 10 | M662: 118 | O662: 21 | P662: 12 | Q662: 138 | S662: MARSHALL | Y662: LADDER | AC662: ROUND | AE662: 12
A663: OAKLEIGH | C663: 2 | D663: 1 | E663: 13 | G663: 4 | H663: 5 | I663: 29 | K663: 7 | L663: 6 | M663: 48 | O663: 9 | P663: 13 | Q663: 67 | S663: KENNEDY
A664: BEST PLAYERS | W664: TEAM | X664: P | Y664: W | Z664: L | AA664: D | AB664: FOR | AC664: AGST | AD664: % | AE664: PTS
A665: BOX HILL | C665: HOCKING | F665: BANFIELD | I665: ZARAFA | L665: HOLT | O665: BUTTIFANT | R665: S HOGAN
A666: OAKLEIGH | C666: DYSON | F666: HANKS | I666: ATHERTON | L666: MITCHELSON | O666: ALLEN | R666: MELLODY | W666: WILLIAMSTOWN | X666: 11 | Y666: 10 | Z666: 0 | AA666: 1 | AB666: 1853 | AC666: 905 | AD666: =(AB666/AC666)*100 -> 204.75138121546962 | AE666: =(Y666*4)+(AA666*2) -> 42
A667: GOALKICKERS | J667: PRESTON | L667: ESPENSCHIED | O667: NICHOLSON | Q667: HOCKING | W667: COBURG | X667: 11 | Y667: 10 | Z667: 1 | AA667: 0 | AB667: 1511 | AC667: 866 | AD667: =(AB667/AC667)*100 -> 174.48036951501155 | AE667: =(Y667*4)+(AA667*2) -> 40
A668: BOX HILL | C668: HOGAN 3 | E668: BUTTIFANT 3 | H668: BOLTON 3 | J668: JOHNS 2 | L668: ZARAFA 2 | N668: LAWRIE 2 | P668: DWYER | R668: GLEESON | W668: BOX HILL | X668: 10 | Y668: 8 | Z668: 1 | AA668: 1 | AB668: 1288 | AC668: 986 | AD668: =(AB668/AC668)*100 -> 130.6288032454361 | AE668: =(Y668*4)+(AA668*2) -> 34
A669: OAKLEIGH | C669: MELLODY 3 | F669: DYSON 2 | H669: PRETTO 2 | J669: KLIBINGAITIS | M669: LOWE | W669: SPRINGVALE | X669: 10 | Y669: 8 | Z669: 2 | AA669: 0 | AB669: 1378 | AC669: 870 | AD669: =(AB669/AC669)*100 -> 158.39080459770113 | AE669: =(Y669*4)+(AA669*2) -> 32
S670: VENUE: BRUNSWICK | W670: BRUNSWICK | X670: 10 | Y670: 7 | Z670: 3 | AA670: 0 | AB670: 1335 | AC670: 994 | AD670: =(AB670/AC670)*100 -> 134.30583501006038 | AE670: =(Y670*4)+(AA670*2) -> 28
A671: BRUNSWICK | C671: 4 | D671: 2 | E671: 26 | G671: 7 | H671: 5 | I671: 47 | K671: 10 | L671: 6 | M671: 66 | O671: 12 | P671: 7 | Q671: 79 | S671: FORESTER
A672: FRANKSTON | C672: 3 | D672: 4 | E672: 22 | G672: 6 | H672: 8 | I672: 44 | K672: 7 | L672: 9 | M672: 51 | O672: 9 | P672: 9 | Q672: 63 | S672: LUCKMAN | W672: FRANKSTON | X672: 10 | Y672: 5 | Z672: 5 | AA672: 0 | AB672: 1187 | AC672: 1052 | AD672: =(AB672/AC672)*100 -> 112.83269961977187 | AE672: =(Y672*4)+(AA672*2) -> 20
A673: BEST PLAYERS | W673: WERRIBEE | X673: 11 | Y673: 5 | Z673: 6 | AA673: 0 | AB673: 1346 | AC673: 1207 | AD673: =(AB673/AC673)*100 -> 111.51615575807787 | AE673: =(Y673*4)+(AA673*2) -> 20
A674: BRUNSWICK | C674: BERTOLLO | F674: BEALE | I674: HERBERT | L674: CLARKE | O674: LOVETT | Q674: BONE | W674: PORT MELBOURNE | X674: 11 | Y674: 5 | Z674: 6 | AA674: 0 | AB674: 1090 | AC674: 1323 | AD674: =(AB674/AC674)*100 -> 82.388510959939538 | AE674: =(Y674*4)+(AA674*2) -> 20
A675: FRANKSTON | C675: SARAU | F675: VANDERMEER | I675: BINGLEY | L675: BLACKFORD | O675: BELL | Q675: LOUTTIT | W675: OAKLEIGH | X675: 11 | Y675: 4 | Z675: 7 | AA675: 0 | AB675: 1220 | AC675: 1355 | AD675: =(AB675/AC675)*100 -> 90.036900369003689 | AE675: =(Y675*4)+(AA675*2) -> 16
A676: GOALKICKERS | O676: HOLMES | W676: PRESTON | X676: 10 | Y676: 4 | Z676: 6 | AA676: 0 | AB676: 959 | AC676: 1070 | AD676: =(AB676/AC676)*100 -> 89.626168224299064 | AE676: =(Y676*4)+(AA676*2) -> 16
A677: BRUNSWICK | C677: DAVIS 2 | E677: BONE 2 | G677: BEALE 2 | I677: HERBERT | K677: LOVETT | M677: GRIFFITHS | O677: CALLANDER | R677: CLARK | W677: SANDRINGHAM | X677: 11 | Y677: 3 | Z677: 8 | AA677: 0 | AB677: 1268 | AC677: 1571 | AD677: =(AB677/AC677)*100 -> 80.712921705919797 | AE677: =(Y677*4)+(AA677*2) -> 12
A678: FRANKSTON | C678: FOYSTER 3 | F678: LOUTTIT 2 | I678: BINGLEY 2 | L678: KEANE | N678: VANDERMEER | W678: PRAHRAN | X678: 11 | Y678: 3 | Z678: 8 | AA678: 0 | AB678: 1121 | AC678: 1458 | AD678: =(AB678/AC678)*100 -> 76.886145404663921 | AE678: =(Y678*4)+(AA678*2) -> 12
S679: VENUE: PORT MELBOURNE | W679: DANDEN0NG | X679: 11 | Y679: 1 | Z679: 10 | AA679: 0 | AB679: 847 | AC679: 1629 | AD679: =(AB679/AC679)*100 -> 51.995089011663595 | AE679: =(Y679*4)+(AA679*2) -> 4
A680: WILLIAMSTOWN | C680: 6 | D680: 1 | E680: 37 | G680: 15 | H680: 4 | I680: 94 | K680: 20 | L680: 9 | M680: 129 | O680: 27 | P680: 17 | Q680: 179 | S680: CASTLE | W680: CAMBERWELL | X680: 10 | Y680: 0 | Z680: 10 | AA680: 0 | AB680: 778 | AC680: 1993 | AD680: =(AB680/AC680)*100 -> 39.036628198695432 | AE680: =(Y680*4)+(AA680*2) -> 0
A681: PORT MELBOURNE | C681: 2 | D681: 4 | E681: 16 | G681: 4 | H681: 5 | I681: 29 | K681: 9 | L681: 8 | M681: 62 | O681: 12 | P681: 9 | Q681: 81 | S681: THOMPSON
A682: BEST PLAYERS
A683: WILLIAMSTOWN | C683: CAHILL | F683: PASTORE | I683: GHAZI | L683: BURTON | O683: ROUND | Q683: McTAGGART
A684: PORT MELBOURNE | C684: SCURRAH | F684: HETHERTON | I684: STROOPER | L684: CARIS | O684: CONDON
A685: GOALKICKERS | L685: ROUND | N685: ROWSELL
A686: WILLIAMSTOWN | C686: CAHILL 6 | F686: LITCHFIELD 5 | I686: GHAZI 4 | K686: DELRE 4 | M686: RICKMAN 2 | P686: PASTORE 2 | R686: MOURNEY 2
A687: PORT MELBOURNE | C687: CONDON 3 | F687: HICKS 3 | H687: SCURRAH 3 | K687: VARI 2 | M687: ERWIN
A689: SANDRINGHAM | C689: 7 | D689: 9 | E689: 51 | G689: 13 | H689: 14 | I689: 92 | K689: 21 | L689: 22 | M689: 148 | O689: 26 | P689: 25 | Q689: 181 | S689: VENUE: BEACH ROAD
A690: CAMBERWELL | C690: 3 | D690: 1 | E690: 19 | G690: 6 | H690: 7 | I690: 43 | K690: 7 | L690: 8 | M690: 50 | O690: 11 | P690: 11 | Q690: 77 | S690: KILNER :DORE
A691: BEST PLAYERS
A692: SANDRINGHAM | C692: BENZIE | F692: DALRYMPLE | I692: FITZGERALD | L692: CARTY | O692: PRATT | R692: HOWARD
A693: CAMBERWELL | C693: BUDGE | F693: KRUSE | I693: SULLIVAN | L693: JONES | O693: M VERESHAKA | R693: GOLLANT
A694: GOALKICKERS
A695: SANDRINGHAM | C695: FITZGERALD 5 | F695: HOWARD 4 | I695: PRATT 3 | K695: BENNETT 3 | M695: CLEMENT 3 | P695: SAID 2 | R695: PHILBEY 2 | U695: ALLEN | X695: EAVES | Z695: BONNEY | AC695: DWYER
A696: CAMBERWELL | C696: SULLIVAN 5 | F696: GOLLANT 2 | I696: BUDGE | K696: DIPIERDOMENICO | O696: REEVES | Q696: KRUSE
A698: SPRINGVALE | C698: 2 | D698: 2 | E698: 14 | G698: 6 | H698: 7 | I698: 43 | K698: 7 | L698: 8 | M698: 50 | O698: 13 | P698: 11 | Q698: 89 | S698: VENUE: SPRINGVALE
A699: PRESTON | C699: 3 | D699: 3 | E699: 21 | G699: 4 | H699: 4 | I699: 28 | K699: 5 | L699: 6 | M699: 36 | O699: 6 | P699: 7 | Q699: 43 | S699: SNEDDON :GOLDSPINK
A700: BEST PLAYERS
A701: SPRINGVALE | C701: MAYLIN | F701: S CLARK | I701: JEFFS | L701: PROSSER | O701: KING | R701: MENDE
A702: PRESTON | C702: DUNBAR | F702: BROWN | I702: PERCY | L702: PLOWMAN | O702: MARCON | R702: HOCKING
A703: GOALKICKERS
A704: SPRINGVALE | C704: PROSSER 4 | F704: S CLARK 2 | I704: MENDE 2 | K704: ROBINSON 2 | N704: PHILLIPS | P704: ANDERSON | S704: MAYLIN
A705: PRESTON | C705: MARCON 2 | F705: EGAN | H705: HUNT | J705: JORDAN | L705: DINTINOSANTE
A707: WERRIBEE | C707: 6 | D707: 2 | E707: 38 | G707: 12 | H707: 5 | I707: 77 | K707: 13 | L707: 10 | M707: 88 | O707: 16 | P707: 10 | Q707: 106 | S707: VENUE: WERRIBEE
A708: DANDENONG | C708: 3 | D708: 3 | E708: 21 | G708: 3 | H708: 6 | I708: 24 | K708: 5 | L708: 7 | M708: 37 | O708: 10 | P708: 11 | Q708: 71 | S708: ALLEN ;MORROW
A709: BEST PLAYERS
A710: WERRIBEE | C710: CHRISTIANSEN | F710: DOMBERG | I710: McMASTER | L710: FENTON | O710: MONTGOMERY | R710: HIGGINS
A711: DANDENONG | C711: MYNOTT | F711: MILLANE | I711: BRUNNEN | L711: HILL | O711: ATKINSON | R711: NICHOLAS
A712: GOALKICKERS
A713: WERRIBEE | C713: SELLS 4 | F713: McMASTER 4 | I713: MONTGOMERY 4 | L713: B SMITH 2 | N713: BOURKE | P713: JOHNSON
A714: DANDENONG | C714: BRUNNEN 3 | F714: KANNOURAKIS 3 | J714: DODDS | L714: METE | N714: MILLANE | P714: NICHOLAS
A716: BYES | F716: COBURG | J716: PRAHRAN
A718: ROUND 13 | D718: 8/9TH JULY | I718: WEATHER | S718: VENUE: COBURG
D719: 1ST QTR | H719: 2ND QTR | L719: 3RD QTR | P719: FINAL | S719: UMPIRES
A720: COBURG | C720: 3 | D720: 1 | E720: 19 | G720: 4 | H720: 2 | I720: 26 | K720: 6 | L720: 4 | M720: 40 | O720: 10 | P720: 4 | Q720: 64 | S720: HOWLETT | Y720: LADDER | AC720: ROUND | AE720: 13
A721: SPRINGVALE | C721: 1 | D721: 1 | E721: 7 | G721: 5 | H721: 4 | I721: 34 | K721: 5 | L721: 6 | M721: 36 | O721: 7 | P721: 8 | Q721: 50 | S721: SAVILLE
A722: BEST PLAYERS | W722: TEAM | X722: P | Y722: W | Z722: L | AA722: D | AB722: FOR | AC722: AGST | AD722: % | AE722: PTS
A723: COBURG | C723: BASSETT | F723: WEIDEMAN | I723: RIENIETS | L723: TARANTO | N723: SHELDON | Q723: INGRAM
A724: SPRINGVALE | C724: FOY | F724: WARNER | I724: MAYLIN | L724: JEFFS | N724: G CLARKE | Q724: PHILLIPS | W724: COBURG | X724: 12 | Y724: 11 | Z724: 1 | AA724: 0 | AB724: 1575 | AC724: 916 | AD724: =(AB724/AC724)*100 -> 171.94323144104803 | AE724: =(Y724*4)+(AA724*2) -> 44
A725: GOALKICKERS | W725: WILLIAMSTOWN | X725: 11 | Y725: 10 | Z725: 0 | AA725: 1 | AB725: 1853 | AC725: 905 | AD725: =(AB725/AC725)*100 -> 204.75138121546962 | AE725: =(Y725*4)+(AA725*2) -> 42
A726: COBURG | C726: DARBY 4 | F726: RIENIETS | H726: GUMLEY | J726: WILLIAMS | M726: KAAKOUR | O726: RACOVOLIS | W726: BOX HILL | X726: 11 | Y726: 9 | Z726: 1 | AA726: 1 | AB726: 1438 | AC726: 1049 | AD726: =(AB726/AC726)*100 -> 137.08293612964729 | AE726: =(Y726*4)+(AA726*2) -> 38
A727: SPRINGVALE | C727: ROBINSON 2 | F727: MENDE | H727: G CLARKE | J727: ANDERSON | M727: PHILLIPS | W727: SPRINGVALE | X727: 11 | Y727: 8 | Z727: 3 | AA727: 0 | AB727: 1428 | AC727: 934 | AD727: =(AB727/AC727)*100 -> 152.89079229122055 | AE727: =(Y727*4)+(AA727*2) -> 32
S728: VENUE: CAMBERWELL | W728: BRUNSWICK | X728: 11 | Y728: 7 | Z728: 4 | AA728: 0 | AB728: 1392 | AC728: 1071 | AD728: =(AB728/AC728)*100 -> 129.9719887955182 | AE728: =(Y728*4)+(AA728*2) -> 28
A729: FRANKSTON | C729: 2 | D729: 2 | E729: 14 | G729: 10 | H729: 7 | I729: 67 | K729: 12 | L729: 8 | M729: 80 | O729: 18 | P729: 12 | Q729: 120 | S729: VERGONA
A730: CAMBERWELL | C730: 6 | D730: 3 | E730: 39 | G730: 8 | H730: 4 | I730: 52 | K730: 15 | L730: 10 | M730: 100 | O730: 16 | P730: 14 | Q730: 110 | S730: KENNEDY | W730: FRANKSTON | X730: 11 | Y730: 6 | Z730: 5 | AA730: 0 | AB730: 1307 | AC730: 1162 | AD730: =(AB730/AC730)*100 -> 112.47848537005163 | AE730: =(Y730*4)+(AA730*2) -> 24
A731: BEST PLAYERS | W731: WERRIBEE | X731: 11 | Y731: 5 | Z731: 6 | AA731: 0 | AB731: 1346 | AC731: 1207 | AD731: =(AB731/AC731)*100 -> 111.51615575807787 | AE731: =(Y731*4)+(AA731*2) -> 20
A732: FRANKSTON | C732: VANDERMEER | F732: FOYSTER | I732: FREW | L732: KELLY | O732: ERRANTE | R732: LOUTTIT | W732: PRESTON | X732: 11 | Y732: 5 | Z732: 6 | AA732: 0 | AB732: 1036 | AC732: 1127 | AD732: =(AB732/AC732)*100 -> 91.925465838509311 | AE732: =(Y732*4)+(AA732*2) -> 20
A733: CAMBERWELL | C733: GREIG | F733: M VERESHAKA | I733: DIPIERDOMENICO | L733: J VERESHAKA | O733: SULLIVAN | R733: TUCKER | W733: PORT MELBOURNE | X733: 11 | Y733: 5 | Z733: 6 | AA733: 0 | AB733: 1090 | AC733: 1323 | AD733: =(AB733/AC733)*100 -> 82.388510959939538 | AE733: =(Y733*4)+(AA733*2) -> 20
A734: GOALKICKERS | P734: TYRELL | W734: OAKLEIGH | X734: 11 | Y734: 4 | Z734: 7 | AA734: 0 | AB734: 1220 | AC734: 1355 | AD734: =(AB734/AC734)*100 -> 90.036900369003689 | AE734: =(Y734*4)+(AA734*2) -> 16
A735: FRANKSTON | C735: LOUTTIT 4 | E735: FOYSTER 3 | G735: VANDERMEER 3 | J735: BINGLEY 2 | M735: MACE 2 | O735: BROWN | Q735: NIKAKIS | S735: KELLY | W735: SANDRINGHAM | X735: 11 | Y735: 3 | Z735: 8 | AA735: 0 | AB735: 1268 | AC735: 1571 | AD735: =(AB735/AC735)*100 -> 80.712921705919797 | AE735: =(Y735*4)+(AA735*2) -> 12
A736: CAMBERWELL | C736: TUCKER 4 | E736: MITCHELL 2 | H736: J VERESHAKA 2 | K736: GREIG 2 | M736: RAZUMS | O736: GOLLANT | Q736: KRUSE | W736: PRAHRAN | X736: 12 | Y736: 3 | Z736: 9 | AA736: 0 | AB736: 1184 | AC736: 1608 | AD736: =(AB736/AC736)*100 -> 73.631840796019901 | AE736: =(Y736*4)+(AA736*2) -> 12
K737: HIPWORTH | M737: SULLIVAN | O737: KLEIN | S737: VENUE: BOX HILL | W737: DANDEN0NG | X737: 11 | Y737: 1 | Z737: 10 | AA737: 0 | AB737: 847 | AC737: 1629 | AD737: =(AB737/AC737)*100 -> 51.995089011663595 | AE737: =(Y737*4)+(AA737*2) -> 4
A738: BOX HILL | C738: 7 | D738: 7 | E738: 49 | G738: 11 | H738: 9 | I738: 75 | K738: 19 | L738: 18 | M738: 132 | O738: 21 | P738: 24 | Q738: 150 | S738: CASTLES | W738: CAMBERWELL | X738: 11 | Y738: 0 | Z738: 11 | AA738: 0 | AB738: 888 | AC738: 2113 | AD738: =(AB738/AC738)*100 -> 42.02555608140085 | AE738: =(Y738*4)+(AA738*2) -> 0
A739: PRAHRAN | C739: 0 | D739: 0 | E739: 0 | G739: 3 | H739: 4 | I739: 22 | K739: 6 | L739: 6 | M739: 42 | O739: 9 | P739: 9 | Q739: 63 | S739: SNEDDON
A740: BEST PLAYERS
A741: BOX HILL | C741: NICHOLSON | F741: JOHNS | I741: BUTTIFANT | L741: ESPENSCHIED | O741: GLEESON | R741: HOCKING
A742: PRAHRAN | C742: BENNETT | F742: T JOHNS | I742: KLEINJANS | L742: EVANS | O742: CARTLEDGE | R742: G GILES
A743: GOALKICKERS | P743: ZARAFA
A744: BOX HILL | C744: JOHNS 5 | E744: BOLTON 5 | G744: BUTTIFANT 4 | J744: HOGAN 2 | L744: NICHOLSON 2 | O744: ESPENSCHIED | R744: GLEESON
A745: PRAHRAN | C745: EVANS 4 | E745: GOW 2 | G745: BENNETT | I745: G GILES | K745: HEWITSON
A747: PRESTON | C747: 4 | D747: 1 | E747: 25 | G747: 5 | H747: 3 | I747: 33 | K747: 8 | L747: 4 | M747: 52 | O747: 11 | P747: 11 | Q747: 77 | S747: VENUE: PRESTON
A748: BRUNSWICK | C748: 5 | D748: 5 | E748: 35 | G748: 5 | H748: 6 | I748: 36 | K748: 8 | L748: 9 | M748: 57 | O748: 8 | P748: 9 | Q748: 57 | S748: BEDFORD ;LAWLOR
A749: BEST PLAYERS
A750: PRESTON | C750: PRITCHARD | F750: HUNT | I750: PERCY | L750: HALAS | O750: DUNBAR | Q750: M LAWSON
A751: BRUNSWICK | C751: WRIGHT | F751: SALVADORE | I751: THOROGOOD | L751: BERTOLLO | O751: CLARK
A752: GOALKICKERS
A753: PRESTON | C753: HALAS 4 | F753: DINTINOSANTE 3 | J753: HUNT | L753: SENNO | N753: JORDAN | P753: HOCKING
A754: BRUNSWICK | C754: HERBERT 3 | F754: HOLMES 2 | I754: WRIGHT 2 | K754: DAVIS
A756: BYES | E756: DANDENONG | H756: PORT MELBOURNE | K756: WERRIBEE | N756: SANDRINGHAM
A758: ROUND 14 | D758: 15/16TH JULY | I758: WEATHER | S758: VENUE: BRUNSWICK
D759: 1ST QTR | H759: 2ND QTR | L759: 3RD QTR | P759: FINAL | S759: UMPIRES
A760: BOX HILL | C760: 5 | D760: 4 | E760: 34 | G760: 8 | H760: 7 | I760: 55 | K760: 15 | L760: 12 | M760: 102 | O760: 16 | P760: 14 | Q760: 110 | S760: MORROW | Y760: LADDER | AC760: ROUND | AE760: 14
A761: BRUNSWICK | C761: 4 | D761: 7 | E761: 31 | G761: 7 | H761: 12 | I761: 54 | K761: 9 | L761: 15 | M761: 69 | O761: 14 | P761: 16 | Q761: 100 | S761: LAWLOR
A762: BEST PLAYERS | W762: TEAM | X762: P | Y762: W | Z762: L | AA762: D | AB762: FOR | AC762: AGST | AD762: % | AE762: PTS
A763: BOX HILL | C763: JOHNS | F763: DWYER | I763: HOGAN | L763: BOURKE | O763: ZARAFA
A764: BRUNSWICK | C764: KERR | F764: BONE | I764: THOROGOOD | L764: CALLANDER | O764: DUGDALE | Q764: WRIGHT | W764: COBURG | X764: 13 | Y764: 12 | Z764: 1 | AA764: 0 | AB764: 1722 | AC764: 951 | AD764: =(AB764/AC764)*100 -> 181.07255520504734 | AE764: =(Y764*4)+(AA764*2) -> 48
A765: GOALKICKERS | O765: BOURKE | W765: WILLIAMSTOWN | X765: 12 | Y765: 10 | Z765: 1 | AA765: 1 | AB765: 1951 | AC765: 1010 | AD765: =(AB765/AC765)*100 -> 193.16831683168317 | AE765: =(Y765*4)+(AA765*2) -> 42
A766: BOX HILL | C766: ZARAFA 4 | F766: BOLTON 3 | I766: JOHNS 3 | K766: HOGAN 2 | M766: BUTTIFANT 2 | P766: ESPENSCHIED | W766: BOX HILL | X766: 12 | Y766: 10 | Z766: 1 | AA766: 1 | AB766: 1548 | AC766: 1149 | AD766: =(AB766/AC766)*100 -> 134.72584856396867 | AE766: =(Y766*4)+(AA766*2) -> 42
A767: BRUNSWICK | C767: CALLANDER 4 | F767: HERBERT 3 | I767: BONE 2 | K767: GRIFFITHS | M767: HYSLOP | O767: KERR | Q767: MANCINI | W767: SPRINGVALE | X767: 12 | Y767: 9 | Z767: 3 | AA767: 0 | AB767: 1533 | AC767: 1032 | AD767: =(AB767/AC767)*100 -> 148.54651162790697 | AE767: =(Y767*4)+(AA767*2) -> 36
P768: TEMAY | S768: VENUE: DANDENONG | W768: BRUNSWICK | X768: 12 | Y768: 7 | Z768: 5 | AA768: 0 | AB768: 1492 | AC768: 1181 | AD768: =(AB768/AC768)*100 -> 126.33361558001694 | AE768: =(Y768*4)+(AA768*2) -> 28
A769: COBURG | C769: 5 | D769: 5 | E769: 35 | G769: 7 | H769: 10 | I769: 52 | K769: 15 | L769: 14 | M769: 104 | O769: 22 | P769: 15 | Q769: 147 | S769: VINEY
A770: DANDENONG | C770: 0 | D770: 2 | E770: 2 | G770: 2 | H770: 2 | I770: 14 | K770: 3 | L770: 3 | M770: 21 | O770: 5 | P770: 5 | Q770: 35 | S770: MORGAN | W770: FRANKSTON | X770: 12 | Y770: 7 | Z770: 5 | AA770: 0 | AB770: 1491 | AC770: 1297 | AD770: =(AB770/AC770)*100 -> 114.95759444872785 | AE770: =(Y770*4)+(AA770*2) -> 28
A771: BEST PLAYERS | W771: WERRIBEE | X771: 12 | Y771: 6 | Z771: 6 | AA771: 0 | AB771: 1521 | AC771: 1358 | AD771: =(AB771/AC771)*100 -> 112.00294550810015 | AE771: =(Y771*4)+(AA771*2) -> 24
A772: COBURG | C772: INGRAM | F772: KAAKOUR | I772: BASSETT | L772: EVANS | O772: EADE | Q772: DOYLE | W772: PRESTON | X772: 12 | Y772: 6 | Z772: 6 | AA772: 0 | AB772: 1172 | AC772: 1231 | AD772: =(AB772/AC772)*100 -> 95.207148659626313 | AE772: =(Y772*4)+(AA772*2) -> 24
A773: DANDENONG | C773: MERRIGAN | F773: MILLANE | I773: D'ARCY | L773: ATKINSON | O773: BRUNNEN | Q773: McCONCHIE | W773: OAKLEIGH | X773: 12 | Y773: 5 | Z773: 7 | AA773: 0 | AB773: 1377 | AC773: 1432 | AD773: =(AB773/AC773)*100 -> 96.159217877094974 | AE773: =(Y773*4)+(AA773*2) -> 20
A774: GOALKICKERS | O774: RACOVOLIS | W774: PORT MELBOURNE | X774: 12 | Y774: 5 | Z774: 7 | AA774: 0 | AB774: 1225 | AC774: 1507 | AD774: =(AB774/AC774)*100 -> 81.287325812873263 | AE774: =(Y774*4)+(AA774*2) -> 20
A775: COBURG | C775: WILLIAMS 7 | F775: KAAKOUR 5 | I775: DARBY 2 | K775: EADE 2 | M775: INGRAM 2 | O775: WEATHERALD 2 | R775: ALLISON | W775: SANDRINGHAM | X775: 12 | Y775: 3 | Z775: 9 | AA775: 0 | AB775: 1419 | AC775: 1746 | AD775: =(AB775/AC775)*100 -> 81.271477663230243 | AE775: =(Y775*4)+(AA775*2) -> 12
A776: DANDENONG | C776: BRUNNEN 4 | F776: NICHOLAS | W776: PRAHRAN | X776: 13 | Y776: 3 | Z776: 10 | AA776: 0 | AB776: 1288 | AC776: 1740 | AD776: =(AB776/AC776)*100 -> 74.022988505747122 | AE776: =(Y776*4)+(AA776*2) -> 12
S777: VENUE: TOORAK PARK | W777: DANDEN0NG | X777: 12 | Y777: 1 | Z777: 11 | AA777: 0 | AB777: 882 | AC777: 1776 | AD777: =(AB777/AC777)*100 -> 49.662162162162161 | AE777: =(Y777*4)+(AA777*2) -> 4
A778: PRESTON | C778: 5 | D778: 2 | E778: 32 | G778: 9 | H778: 8 | I778: 62 | K778: 13 | L778: 10 | M778: 88 | O778: 20 | P778: 12 | Q778: 132 | S778: McDONALD | W778: CAMBERWELL | X778: 12 | Y778: 0 | Z778: 12 | AA778: 0 | AB778: 965 | AC778: 2270 | AD778: =(AB778/AC778)*100 -> 42.51101321585903 | AE778: =(Y778*4)+(AA778*2) -> 0
A779: PRAHRAN | C779: 1 | D779: 3 | E779: 9 | G779: 6 | H779: 7 | I779: 43 | K779: 9 | L779: 12 | M779: 66 | O779: 15 | P779: 14 | Q779: 104 | S779: COOK
A780: BEST PLAYERS
A781: PRESTON | C781: HUNT | F781: DUNBAR | I781: DINTINOSANTE | L781: PERCY | O781: BURROWS | R781: SHAW
A782: PRAHRAN | C782: HAMILTON | F782: SOULOS | I782: RICHARDS | L782: WHITE | O782: CARTLEDGE | R782: S GILES
A783: GOALKICKERS
A784: PRESTON | C784: SHAW 8 | F784: JORDAN 6 | I784: NICOLAOU 2 | L784: MARCON 2 | O784: HEANEY | Q784: DINTINOSANTE
A785: PRAHRAN | C785: RICHARDS 6 | F785: HEWITSON 3 | I785: G GILES 2 | L785: B EVANS 2 | O785: SOULOS | Q785: K WALFORD
A787: FRANKSTON | C787: 8 | D787: 3 | E787: 51 | G787: 14 | H787: 5 | I787: 89 | K787: 19 | L787: 9 | M787: 123 | O787: 28 | P787: 16 | Q787: 184 | S787: VENUE: FRANKSTON
A788: PORT MELBOURNE | C788: 3 | D788: 4 | E788: 22 | G788: 10 | H788: 9 | I788: 69 | K788: 14 | L788: 12 | M788: 96 | O788: 20 | P788: 15 | Q788: 135 | S788: MARSHALL :BEDFORD
A789: BEST PLAYERS
A790: FRANKSTON | C790: MACE | F790: KEANE | I790: FOYSTER | L790: McCARTHY | O790: GAMBLE | R790: FREW
A791: PORT MELBOURNE | C791: PRITCHARD | F791: ERWIN | I791: SCURRAH | L791: MUTIMER | O791: HETHERTON | R791: YORGEY
A792: GOALKICKERS
A793: FRANKSTON | C793: BROWN 7 | E793: KEANE 5 | G793: BINGLEY 4 | I793: VANDERMEER 3 | L793: MARTIN 2 | N793: FREW 2 | P793: WEST 2 | R793: CROSS | T793: MACE | W793: GAMBLE
A794: PORT MELBOURNE | C794: VARI 5 | E794: WHITZELL 3 | H794: HICKS 3 | J794: SCURRAH 2 | M794: MUTIMER | O794: PRITCHARD | Q794: YORGEY | S794: CONDON | W794: HARKINS | Y794: HETHERTON | AC794: DUNBAR
A796: WERRIBEE | C796: 8 | D796: 3 | E796: 51 | G796: 15 | H796: 6 | I796: 96 | K796: 21 | L796: 9 | M796: 135 | O796: 27 | P796: 13 | Q796: 175 | S796: VENUE: WERRIBEE
A797: SANDRINGHAM | C797: 3 | D797: 2 | E797: 20 | G797: 10 | H797: 6 | I797: 66 | K797: 19 | L797: 6 | M797: 120 | O797: 24 | P797: 7 | Q797: 151 | S797: GARLAND :KENNEDY
A798: BEST PLAYERS
A799: WERRIBEE | C799: FLEMING | F799: SELLS | I799: B SMITH | L799: CHRISTIANSEN | O799: JUKAWICS | R799: VASILOU
A800: SANDRINGHAM | C800: DALRYMPLE | F800: BENZIE | I800: BONNEY | L800: F RUGOLO | O800: BRIAN SAID | R800: MERSON
A801: GOALKICKERS
A802: WERRIBEE | C802: FLEMING 13 | F802: MONTGOMERY 3 | J802: JUKAWICS 3 | M802: HIGGINS 3 | O802: SELLS 2 | Q802: VASILOU 2 | T802: RADCLIFFE
A803: SANDRINGHAM | C803: PHILBEY 6 | F803: BRIAN SAID 5 | I803: FITZGERALD 5 | L803: BENNETT 3 | N803: F RUGOLO 3 | Q803: PRATT | S803: CARTY
A805: OAKLEIGH | C805: 9 | D805: 3 | E805: 57 | G805: 10 | H805: 6 | I805: 66 | K805: 18 | L805: 11 | M805: 119 | O805: 23 | P805: 19 | Q805: 157 | S805: VENUE: CAMBERWELL
A806: CAMBERWELL | C806: 2 | D806: 0 | E806: 12 | G806: 6 | H806: 5 | I806: 41 | K806: 10 | L806: 10 | M806: 70 | O806: 11 | P806: 11 | Q806: 77 | S806: CHILDS :GREEN
A807: BEST PLAYERS
A808: OAKLEIGH | C808: DYSON | F808: GARBUIO | I808: ALLAN | L808: BATTERSBY | O808: MITCHELSON | R808: HANKS
A809: CAMBERWELL | C809: M KRUSE | F809: J VERESHAKA | I809: GREIG | L809: BUDGE | O809: FARRELL
A810: GOALKICKERS
A811: OAKLEIGH | C811: ALLAN 6 | E811: PRETTO 5 | G811: GARBUIO 4 | I811: OWEN 3 | K811: MELLODY 2 | N811: LOWE | P811: DYSON | R811: ATHERTON
A812: CAMBERWELL | C812: FARRELL 4 | F812: FATILEN 2 | I812: GREIG | K812: BUDGE | M812: DIPIERDOMENICO | Q812: FURLAN | S812: HIPWORTH
A814: SPRINGVALE | C814: 2 | D814: 3 | E814: 15 | G814: 6 | H814: 8 | I814: 44 | K814: 11 | L814: 11 | M814: 77 | O814: 15 | P814: 15 | Q814: 105 | S814: VENUE: SPRINGVALE
A815: WILLIAMSTOWN | C815: 6 | D815: 6 | E815: 42 | G815: 7 | H815: 9 | I815: 51 | K815: 10 | L815: 13 | M815: 73 | O815: 14 | P815: 14 | Q815: 98 | S815: CASTLE :BULLUSS
A816: BEST PLAYERS
A817: SPRINGVALE | C817: CLARK | F817: JEFFS | I817: FOY | L817: WARNER | O817: ROBINSON | R817: MAYLIN
A818: WILLIAMSTOWN | C818: KENNY | F818: PASTORE | I818: HOWLETT | L818: LITCHFIELD
A819: GOALKICKERS
A820: SPRINGVALE | C820: ROBINSON 7 | F820: JEFFS 3 | H820: DEMPSTER 2 | K820: PROSSER | M820: CLARK | O820: PHILLIPS
A821: WILLIAMSTOWN | C821: LITCHFIELD 5 | F821: MOURNEY 3 | I821: GHAZI 2 | K821: RICKMAN 2 | N821: DELRE 2
A823: ROUND 15 | D823: 22ND/23RD JULY | I823: WEATHER | S823: VENUE: PRESTON
D824: 1ST QTR | H824: 2ND QTR | L824: 3RD QTR | P824: FINAL | S824: UMPIRES
A825: FRANKSTON | C825: 3 | D825: 2 | E825: 20 | G825: 5 | H825: 4 | I825: 34 | K825: 7 | L825: 6 | M825: 48 | O825: 10 | P825: 6 | Q825: 66 | S825: MORROW | Y825: LADDER | AC825: ROUND | AE825: 15
A826: PRESTON | C826: 1 | D826: 4 | E826: 10 | G826: 3 | H826: 5 | I826: 23 | K826: 6 | L826: 7 | M826: 43 | O826: 9 | P826: 8 | Q826: 62 | S826: GREEN
A827: BEST PLAYERS | W827: TEAM | X827: P | Y827: W | Z827: L | AA827: D | AB827: FOR | AC827: AGST | AD827: % | AE827: PTS
A828: FRANKSTON | C828: TEAM EFFORT
A829: PRESTON | C829: JORDAN | F829: HOCKING | I829: HUNT | K829: DUNBAR | N829: MARCON | Q829: HEANEY | W829: COBURG | X829: 14 | Y829: 13 | Z829: 1 | AA829: 0 | AB829: 1792 | AC829: 995 | AD829: =(AB829/AC829)*100 -> 180.10050251256283 | AE829: =(Y829*4)+(AA829*2) -> 52
A830: GOALKICKERS | W830: BOX HILL | X830: 13 | Y830: 11 | Z830: 1 | AA830: 1 | AB830: 1676 | AC830: 1239 | AD830: =(AB830/AC830)*100 -> 135.27037933817593 | AE830: =(Y830*4)+(AA830*2) -> 46
A831: FRANKSTON | C831: BINGLEY 3 | F831: BROWN 2 | I831: P MARTIN 2 | L831: SMITH 2 | N831: BELL | W831: WILLIAMSTOWN | X831: 13 | Y831: 10 | Z831: 2 | AA831: 1 | AB831: 1995 | AC831: 1080 | AD831: =(AB831/AC831)*100 -> 184.72222222222223 | AE831: =(Y831*4)+(AA831*2) -> 42
A832: PRESTON | C832: SHAW 6 | F832: NICOLAOU 2 | I832: HALAS | W832: SPRINGVALE | X832: 13 | Y832: 9 | Z832: 4 | AA832: 0 | AB832: 1523 | AC832: 1160 | AD832: =(AB832/AC832)*100 -> 131.29310344827587 | AE832: =(Y832*4)+(AA832*2) -> 36
S833: VENUE: BOX HILL | W833: FRANKSTON | X833: 13 | Y833: 8 | Z833: 5 | AA833: 0 | AB833: 1557 | AC833: 1359 | AD833: =(AB833/AC833)*100 -> 114.56953642384107 | AE833: =(Y833*4)+(AA833*2) -> 32
A834: BOX HILL | C834: 3 | D834: 2 | E834: 20 | G834: 6 | H834: 7 | I834: 43 | K834: 14 | L834: 16 | M834: 100 | O834: 18 | P834: 20 | Q834: 128 | S834: SNEDDON | W834: BRUNSWICK | X834: 13 | Y834: 7 | Z834: 6 | AA834: 0 | AB834: 1582 | AC834: 1307 | AD834: =(AB834/AC834)*100 -> 121.04055087987757 | AE834: =(Y834*4)+(AA834*2) -> 28
A835: SPRINGVALE | C835: 6 | D835: 3 | E835: 39 | G835: 8 | H835: 8 | I835: 56 | K835: 10 | L835: 9 | M835: 69 | O835: 13 | P835: 12 | Q835: 90 | S835: KENNEDY | W835: WERRIBEE | X835: 13 | Y835: 7 | Z835: 6 | AA835: 0 | AB835: 1647 | AC835: 1448 | AD835: =(AB835/AC835)*100 -> 113.74309392265194 | AE835: =(Y835*4)+(AA835*2) -> 28
A836: BEST PLAYERS | W836: PRESTON | X836: 13 | Y836: 6 | Z836: 7 | AA836: 0 | AB836: 1234 | AC836: 1297 | AD836: =(AB836/AC836)*100 -> 95.142636854279104 | AE836: =(Y836*4)+(AA836*2) -> 24
A837: BOX HILL | C837: BROWN | F837: LAWRIE | I837: GLEESON | L837: HICKS | N837: HOCKING | Q837: NICHOLSON | W837: PORT MELBOURNE | X837: 13 | Y837: 6 | Z837: 7 | AA837: 0 | AB837: 1372 | AC837: 1588 | AD837: =(AB837/AC837)*100 -> 86.397984886649866 | AE837: =(Y837*4)+(AA837*2) -> 24
A838: SPRINGVALE | C838: FOY | F838: JEFFS | I838: MALONI | L838: WARNER | N838: SHANNON | W838: OAKLEIGH | X838: 13 | Y838: 5 | Z838: 8 | AA838: 0 | AB838: 1458 | AC838: 1579 | AD838: =(AB838/AC838)*100 -> 92.336922102596574 | AE838: =(Y838*4)+(AA838*2) -> 20
A839: GOALKICKERS | P839: BROWN | W839: SANDRINGHAM | X839: 13 | Y839: 4 | Z839: 9 | AA839: 0 | AB839: 1665 | AC839: 1839 | AD839: =(AB839/AC839)*100 -> 90.538336052202283 | AE839: =(Y839*4)+(AA839*2) -> 16
A840: BOX HILL | C840: BOLTON 4 | F840: BUTTIFANT 4 | I840: ZARAFA 3 | K840: DWYER 3 | M840: HOGAN | O840: JOHNS | Q840: GLEESON | W840: PRAHRAN | X840: 14 | Y840: 4 | Z840: 10 | AA840: 0 | AB840: 1427 | AC840: 1820 | AD840: =(AB840/AC840)*100 -> 78.406593406593402 | AE840: =(Y840*4)+(AA840*2) -> 16
A841: SPRINGVALE | C841: ROBINSON 3 | F841: CLARKE 2 | I841: MARCOU 2 | L841: ANDERSON | N841: PROSSER | P841: JEFFS | W841: DANDEN0NG | X841: 13 | Y841: 1 | Z841: 12 | AA841: 0 | AB841: 975 | AC841: 2022 | AD841: =(AB841/AC841)*100 -> 48.219584569732937 | AE841: =(Y841*4)+(AA841*2) -> 4
M842: DEMPSTER | P842: WARNER | S842: VENUE: TOORAK PARK | W842: CAMBERWELL | X842: 13 | Y842: 0 | Z842: 13 | AA842: 0 | AB842: 1045 | AC842: 2409 | AD842: =(AB842/AC842)*100 -> 43.378995433789953 | AE842: =(Y842*4)+(AA842*2) -> 0
A843: PRAHRAN | C843: 4 | D843: 6 | E843: 30 | G843: 9 | H843: 10 | I843: 64 | K843: 13 | L843: 17 | M843: 95 | O843: 20 | P843: 19 | Q843: 139 | S843: VERGONA
A844: CAMBERWELL | C844: 2 | D844: 6 | E844: 18 | G844: 3 | H844: 8 | I844: 26 | K844: 6 | L844: 8 | M844: 44 | O844: 11 | P844: 14 | Q844: 80 | S844: NOLAN
A845: BEST PLAYERS
A846: PRAHRAN | C846: HIPWORTH | F846: W WALFORD | I846: CARTLEDGE | L846: HAMILTON | O846: SOULOS | R846: M EVANS
A847: CAMBERWELL | C847: GREIG | F847: KRUSE | I847: BUDGE | L847: J VERESHAKA | O847: M VERESHAKA | R847: HIPWORTH
A848: GOALKICKERS | L848: SOULOS | N848: KILEY | P848: RICHARDS
A849: PRAHRAN | C849: KLEINJANS 5 | F849: B EVANS 4 | I849: HEWITSON 3 | L849: HAMILTON 3 | O849: McNICHOLL | Q849: FERGUS
A850: CAMBERWELL | C850: TORPY 2 | F850: LOCKMAN 2 | I850: GREIG | K850: FURLAN | M850: TUCKER | O850: JONES | Q850: GOLLANT
M851: KRUSE | O851: FARRELL
A852: SANDRINGHAM | C852: 7 | D852: 6 | E852: 48 | G852: 17 | H852: 11 | I852: 113 | K852: 25 | L852: 16 | M852: 166 | O852: 38 | P852: 18 | Q852: 246 | S852: VENUE: BEACH ROAD
A853: DANDENONG | C853: 1 | D853: 5 | E853: 11 | G853: 3 | H853: 8 | I853: 26 | K853: 7 | L853: 11 | M853: 53 | O853: 13 | P853: 15 | Q853: 93 | S853: COOK :BEDFORD
A854: BEST PLAYERS
A855: SANDRINGHAM | C855: BENZIE | F855: DALRYMPLE | I855: F RUGOLO | L855: HOWARD | O855: BENNETT | R855: PRATT
A856: DANDENONG | C856: BRUNNEN | F856: MYNOTT | I856: HILL | L856: LACKO | O856: ATKINSON | R856: ARGOON
A857: GOALKICKERS | W857: McGANNON
A858: SANDRINGHAM | C858: HOWARD 8 | E858: F RUGOLO 5 | H858: ENDERS 5 | J858: FITZGERALD 4 | M858: DWYER 3 | O858: DALRYMPLE 3 | R858: PRATT 3 | U858: MACKAY 3 | Y858: J RUGOLO | AB858: ALLEN | AD858: PHILBEY
A859: DANDENONG | C859: YOUNG 3 | E859: KANNOURAKIS 2 | I859: MILLANE 2 | L859: McCONCHIE 2 | O859: ARGOON | Q859: MYNOTT | S859: ATKINSON | W859: BRUNNEN
A861: PORT MELBOURNE | C861: 5 | D861: 4 | E861: 34 | G861: 11 | H861: 9 | I861: 75 | K861: 17 | L861: 13 | M861: 115 | O861: 22 | P861: 15 | Q861: 147 | S861: VENUE: OAKLEIGH
A862: OAKLEIGH | C862: 3 | D862: 3 | E862: 21 | G862: 8 | H862: 4 | I862: 52 | K862: 8 | L862: 6 | M862: 54 | O862: 12 | P862: 9 | Q862: 81 | S862: HARRIS :McKERNAN
A863: BEST PLAYERS
A864: PORT MELBOURNE | C864: PRITCHARD | F864: BAILEY | I864: HETHERTON | L864: VARI | O864: DOBSON | R864: HICKS
A865: OAKLEIGH | C865: HANKS | F865: BATTERSBY | I865: MELLODY | L865: ATHERTON | O865: TODD
A866: GOALKICKERS
A867: PORT MELBOURNE | C867: VARI 7 | E867: HICKS 5 | G867: BAILEY 2 | I867: SCURRAH 2 | L867: ERWIN 2 | N867: MUTIMER | Q867: CONDON | S867: FOLEY | U867: HETHERTON
A868: OAKLEIGH | C868: PRETTO 3 | E868: OWEN 2 | G868: ALLAN 2 | I868: MITCHELSON | L868: DYSON | N868: ATHERTON | Q868: MARSHALL | T868: MELLODY
A870: COBURG | C870: 3 | D870: 4 | E870: 22 | G870: 6 | H870: 6 | I870: 42 | K870: 8 | L870: 8 | M870: 56 | O870: 10 | P870: 10 | Q870: 70 | S870: VENUE: WILLIAMSTOWN
A871: WILLIAMSTOWN | C871: 0 | D871: 2 | E871: 2 | G871: 3 | H871: 5 | I871: 23 | K871: 3 | L871: 6 | M871: 24 | O871: 6 | P871: 8 | Q871: 44 | S871: SAWERS :McDONALD
A872: BEST PLAYERS
A873: COBURG | C873: RACOVOLIS | F873: EVANS | I873: LITTLER | L873: BASSETT | O873: SHELDON | R873: REYNOLDSON
A874: WILLIAMSTOWN | C874: O'CONNOR | F874: GOULD | I874: SWAN | L874: PASTORE | O874: MORRISSEY | R874: CORDY
A875: GOALKICKERS
A876: COBURG | C876: DARBY 3 | F876: WILLIAMS 2 | I876: KAAKOUR 2 | L876: INGRAM 2 | O876: RIENIETS
A877: WILLIAMSTOWN | C877: CAHILL 2 | F877: ROUND | H877: PASTORE | J877: MORRISSEY | M877: LITCHFIELD
A879: WERRIBEE | C879: 5 | D879: 3 | E879: 33 | G879: 8 | H879: 6 | I879: 54 | K879: 13 | L879: 8 | M879: 86 | O879: 19 | P879: 12 | Q879: 126 | S879: VENUE: WERRIBEE
A880: BRUNSWICK | C880: 1 | D880: 6 | E880: 12 | G880: 5 | H880: 10 | I880: 40 | K880: 10 | L880: 14 | M880: 74 | O880: 12 | P880: 18 | Q880: 90 | S880: CHILDS :BULLUSS
A881: BEST PLAYERS
A882: WERRIBEE | C882: DOMBERG | F882: SELLS | I882: B SMITH | L882: CHRISTIANSEN | O882: RADCLIFFE | R882: HIGGINS
A883: BRUNSWICK | C883: BONE | F883: THOROGOOD | I883: KERR | L883: MAGUIRE | O883: HYSLOP | R883: BERTOLLO
A884: GOALKICKERS
A885: WERRIBEE | C885: SELLS 5 | E885: MONTGOMERY 5 | H885: FLEMING 4 | K885: CHAPMAN 2 | N885: DOMBERG | Q885: RADCLIFFE | T885: MORRIS
A886: BRUNSWICK | C886: GRIFFITHS 5 | F886: BONE 4 | H886: HERBERT | J886: CALLANDER | M886: MANCINI
A888: ROUND 16 | D888: 29/30TH JULY | I888: WEATHER | S888: VENUE: BRUNSWICK
D889: 1ST QTR | H889: 2ND QTR | L889: 3RD QTR | P889: FINAL | S889: UMPIRES
A890: BRUNSWICK | C890: 5 | D890: 3 | E890: 33 | G890: 11 | H890: 4 | I890: 70 | K890: 12 | L890: 7 | M890: 79 | O890: 18 | P890: 12 | Q890: 120 | S890: VERGONA | Y890: LADDER | AC890: ROUND | AE890: 16
A891: WILLIAMSTOWN | C891: 4 | D891: 3 | E891: 27 | G891: 6 | H891: 6 | I891: 42 | K891: 10 | L891: 13 | M891: 73 | O891: 14 | P891: 15 | Q891: 99 | S891: SNEDDON
A892: BEST PLAYERS | W892: TEAM | X892: P | Y892: W | Z892: L | AA892: D | AB892: FOR | AC892: AGST | AD892: % | AE892: PTS
A893: BRUNSWICK | C893: SALVADORE | F893: THOROGOOD | I893: WRIGHT | L893: HERBERT | O893: KERR | Q893: BONE
A894: WILLIAMSTOWN | C894: BURTON | F894: RICKMAN | I894: GHAZI | L894: McGOWAN | O894: KENNY | Q894: CAHILL | W894: COBURG | X894: 14 | Y894: 13 | Z894: 1 | AA894: 0 | AB894: 1792 | AC894: 995 | AD894: =(AB894/AC894)*100 -> 180.10050251256283 | AE894: =(Y894*4)+(AA894*2) -> 52
A895: GOALKICKERS | P895: WRIGHT | W895: BOX HILL | X895: 14 | Y895: 12 | Z895: 1 | AA895: 1 | AB895: 1795 | AC895: 1303 | AD895: =(AB895/AC895)*100 -> 137.75901765157329 | AE895: =(Y895*4)+(AA895*2) -> 50
A896: BRUNSWICK | C896: HERBERT 6 | E896: HARMES 4 | G896: BERTOLLO 2 | J896: GRIFFITHS 2 | M896: BONE | N896: CALLANDER | Q896: McALLESTER | W896: WILLIAMSTOWN | X896: 14 | Y896: 10 | Z896: 3 | AA896: 1 | AB896: 2094 | AC896: 1200 | AD896: =(AB896/AC896)*100 -> 174.5 | AE896: =(Y896*4)+(AA896*2) -> 42
A897: WILLIAMSTOWN | C897: RICKMAN 6 | F897: BURTON 2 | I897: CAHILL 2 | K897: ROUND | M897: PASTORE | O897: CORDY | W897: SPRINGVALE | X897: 14 | Y897: 10 | Z897: 4 | AA897: 0 | AB897: 1672 | AC897: 1249 | AD897: =(AB897/AC897)*100 -> 133.86709367493995 | AE897: =(Y897*4)+(AA897*2) -> 40
S898: VENUE: OAKLEIGH | W898: FRANKSTON | X898: 14 | Y898: 9 | Z898: 5 | AA898: 0 | AB898: 1683 | AC898: 1478 | AD898: =(AB898/AC898)*100 -> 113.8700947225981 | AE898: =(Y898*4)+(AA898*2) -> 36
A899: SPRINGVALE | C899: 3 | D899: 5 | E899: 23 | G899: 10 | H899: 7 | I899: 67 | K899: 15 | L899: 8 | M899: 98 | O899: 23 | P899: 11 | Q899: 149 | S899: COOK
A900: OAKLEIGH | C900: 5 | D900: 3 | E900: 33 | G900: 9 | H900: 5 | I900: 59 | K900: 12 | L900: 9 | M900: 81 | O900: 13 | P900: 11 | Q900: 89 | S900: CHILDS | W900: BRUNSWICK | X900: 14 | Y900: 8 | Z900: 6 | AA900: 0 | AB900: 1702 | AC900: 1406 | AD900: =(AB900/AC900)*100 -> 121.05263157894737 | AE900: =(Y900*4)+(AA900*2) -> 32
A901: BEST PLAYERS | W901: WERRIBEE | X901: 14 | Y901: 7 | Z901: 7 | AA901: 0 | AB901: 1766 | AC901: 1574 | AD901: =(AB901/AC901)*100 -> 112.19822109275729 | AE901: =(Y901*4)+(AA901*2) -> 28
A902: SPRINGVALE | C902: S CLARK | F902: NICOL | I902: MARCOU | L902: MAYLIN | O902: JEFFS | Q902: KING | W902: PORT MELBOURNE | X902: 14 | Y902: 7 | Z902: 7 | AA902: 0 | AB902: 1538 | AC902: 1668 | AD902: =(AB902/AC902)*100 -> 92.206235011990415 | AE902: =(Y902*4)+(AA902*2) -> 28
A903: OAKLEIGH | C903: TODD | F903: ATHERTON | I903: BULTE | L903: MELLODY | O903: PRETTO | Q903: GARBUIO | W903: PRESTON | X903: 14 | Y903: 6 | Z903: 8 | AA903: 0 | AB903: 1363 | AC903: 1474 | AD903: =(AB903/AC903)*100 -> 92.469470827679771 | AE903: =(Y903*4)+(AA903*2) -> 24
A904: GOALKICKERS | H904: DEMPSTER 2 | K904: MARCOU | M904: WARNER | O904: G CLARKE | Q904: MAYLIN | W904: SANDRINGHAM | X904: 14 | Y904: 5 | Z904: 9 | AA904: 0 | AB904: 1842 | AC904: 1968 | AD904: =(AB904/AC904)*100 -> 93.597560975609767 | AE904: =(Y904*4)+(AA904*2) -> 20
A905: SPRINGVALE | C905: ROBINSON 4 | E905: STEWART 3 | H905: ANDERSON 2 | J905: JEFFS 2 | L905: S CLARK 2 | N905: PHILLIPS 2 | Q905: PROSSER 2 | W905: OAKLEIGH | X905: 14 | Y905: 5 | Z905: 9 | AA905: 0 | AB905: 1547 | AC905: 1728 | AD905: =(AB905/AC905)*100 -> 89.525462962962962 | AE905: =(Y905*4)+(AA905*2) -> 20
A906: OAKLEIGH | C906: PRETTO 7 | F906: MELLODY 4 | I906: DESSENT | K906: OWEN | W906: PRAHRAN | X906: 14 | Y906: 4 | Z906: 10 | AA906: 0 | AB906: 1427 | AC906: 1820 | AD906: =(AB906/AC906)*100 -> 78.406593406593402 | AE906: =(Y906*4)+(AA906*2) -> 16
S907: VENUE: PORT MELBOURNE | W907: DANDEN0NG | X907: 14 | Y907: 1 | Z907: 13 | AA907: 0 | AB907: 1039 | AC907: 2141 | AD907: =(AB907/AC907)*100 -> 48.528724894908919 | AE907: =(Y907*4)+(AA907*2) -> 4
A908: PORT MELBOURNE | C908: 2 | D908: 8 | E908: 20 | G908: 9 | H908: 11 | I908: 65 | K908: 14 | L908: 13 | M908: 97 | O908: 24 | P908: 22 | Q908: 166 | S908: GERSCH | W908: CAMBERWELL | X908: 14 | Y908: 0 | Z908: 14 | AA908: 0 | AB908: 1125 | AC908: 2575 | AD908: =(AB908/AC908)*100 -> 43.689320388349515 | AE908: =(Y908*4)+(AA908*2) -> 0
A909: CAMBERWELL | C909: 2 | D909: 4 | E909: 16 | G909: 6 | H909: 5 | I909: 41 | K909: 7 | L909: 7 | M909: 49 | O909: 12 | P909: 8 | Q909: 80 | S909: MORROW
A910: BEST PLAYERS
A911: PORT MELBOURNE | C911: HETHERTON | F911: RAINSFORD | I911: PRITCHARD | L911: STROOPER | N911: ERWIN | Q911: SMITH
A912: CAMBERWELL | C912: KRUSE | F912: GREIG | I912: BUDGE | L912: VITACCA | N912: J VERESHAKA | Q912: M VERESHAKA
A913: GOALKICKERS | M913: RAINSFORD | P913: SCURRAH | R913: STROOPER
A914: PORT MELBOURNE | C914: VARI 6 | E914: ERWIN 4 | G914: HICKS 3 | I914: MUTIMER 3 | L914: DRAIN 2 | N914: SMITH | P914: BAILEY | R914: HETHERTON
A915: CAMBERWELL | C915: VITACCA 4 | F915: DIPIERDOMENICO 2 | J915: SULLIVAN 2 | M915: TORPY | O915: TURNER | Q915: TRIBE
M916: LOCKMAN
A917: FRANKSTON | C917: 3 | D917: 1 | E917: 19 | G917: 8 | H917: 7 | I917: 55 | K917: 16 | L917: 10 | M917: 106 | O917: 19 | P917: 12 | Q917: 126 | S917: VENUE: FRANKSTON
A918: WERRIBEE | C918: 3 | D918: 10 | E918: 28 | G918: 7 | H918: 14 | I918: 56 | K918: 13 | L918: 15 | M918: 93 | O918: 17 | P918: 17 | Q918: 119 | S918: HARRIS :LAWLOR
A919: BEST PLAYERS
A920: FRANKSTON | C920: MCCARTHY | F920: GAMBLE | I920: SARAU | L920: BROWN | O920: BINGLEY | R920: KEANE
A921: WERRIBEE | C921: JUKAWICS | F921: SIZER | I921: VASILOU | L921: CHRISTIANSEN | O921: SELLS | R921: McMASTER
A922: GOALKICKERS
A923: FRANKSTON | C923: BROWN 6 | F923: BINGLEY 6 | I923: CROSS 3 | K923: WEST | M923: ERRANTE | O923: FOYSTER | Q923: O'BRIEN
A924: WERRIBEE | C924: SELLS 6 | F924: FLEMING 4 | I924: HIGGINS 2 | K924: BUCK | M924: CHRISTIANSEN | P924: JONES | R924: RADCLIFFE | U924: VASILOU
A926: SANDRINGHAM | C926: 4 | D926: 1 | E926: 25 | G926: 10 | H926: 7 | I926: 67 | K926: 15 | L926: 12 | M926: 102 | O926: 26 | P926: 21 | Q926: 177 | S926: VENUE: BEACH ROAD
A927: PRESTON | C927: 6 | D927: 7 | E927: 43 | G927: 11 | H927: 11 | I927: 77 | K927: 16 | L927: 14 | M927: 110 | O927: 19 | P927: 15 | Q927: 129 | S927: McKERNAN :BULLUSS
A928: BEST PLAYERS
A929: SANDRINGHAM | C929: EAVES | F929: PHILBEY | I929: DWYER | L929: BEILBY | O929: J RUGOLO | R929: BONNEY
A930: PRESTON | C930: NICOLAOU | F930: DUNBAR | I930: HUNT | L930: PLOWMAN | O930: PRITCHARD
A931: GOALKICKERS
A932: SANDRINGHAM | C932: PHILBEY 10 | F932: DWYER 7 | H932: FISCHER 2 | J932: ALLEN 2 | L932: F RUGOLO 2 | N932: SAID | P932: IRWIN | R932: DALRYMPLE
A933: PRESTON | C933: NICOLAOU 7 | F933: SHAW 4 | H933: SENNO 2 | J933: HALAS | L933: JORDAN | N933: HUNT | P933: DUNBAR | R933: PRITCHARD | U933: DINTINOSANTE
A935: BOX HILL | C935: 7 | D935: 5 | E935: 47 | G935: 11 | H935: 5 | I935: 71 | K935: 15 | L935: 13 | M935: 103 | O935: 17 | P935: 17 | Q935: 119 | S935: VENUE: DANDENONG
A936: DANDENONG | C936: 2 | D936: 2 | E936: 14 | G936: 4 | H936: 8 | I936: 32 | K936: 6 | L936: 11 | M936: 47 | O936: 8 | P936: 16 | Q936: 64 | S936: GREEN :ANTHONY
A937: BEST PLAYERS
A938: BOX HILL | C938: ZARAFA | F938: LAWRIE | I938: REEVES | L938: BUTTIFANT | O938: HOCKING | R938: HOLT
A939: DANDENONG | C939: ARGOON | F939: LINDSAY | I939: HILL | L939: TANNERHILL | O939: McCARTHY | R939: ANDERSON
A940: GOALKICKERS
A941: BOX HILL | C941: ZARAFA 4 | F941: BOLTON 4 | I941: NICHOLSON 2 | L941: HOGAN 2 | N941: GLEESON 2 | Q941: HAMILTON | T941: JOHNS | W941: BUTTIFANT
A942: DANDENONG | C942: McCARTHY 2 | F942: COLLARD | H942: ARGOON | J942: ATKINSON | M942: YOUNG | O942: LACKO | Q942: MYNOTT
A944: BYES | F944: COBURG | J944: PRAHRAN
A946: ROUND 17 | D946: 5/6TH AUGUST | I946: WEATHER | S946: VENUE: BOX HILL
D947: 1ST QTR | H947: 2ND QTR | L947: 3RD QTR | P947: FINAL | S947: UMPIRES
A948: WILLIAMSTOWN | C948: 9 | D948: 4 | E948: 58 | G948: 13 | H948: 7 | I948: 85 | K948: 20 | L948: 11 | M948: 131 | O948: 24 | P948: 14 | Q948: 158 | Y948: LADDER | AC948: ROUND | AE948: 17
A949: BOX HILL | C949: 2 | D949: 5 | E949: 17 | G949: 7 | H949: 13 | I949: 55 | K949: 12 | L949: 14 | M949: 86 | O949: 15 | P949: 23 | Q949: 113
A950: BEST PLAYERS | W950: TEAM | X950: P | Y950: W | Z950: L | AA950: D | AB950: FOR | AC950: AGST | AD950: % | AE950: PTS
A951: WILLIAMSTOWN | C951: BURTON | F951: SWAN | I951: DELRE | L951: JOHNSON | N951: RICKMAN | Q951: NILSSEN
A952: BOX HILL | C952: REEVES | F952: FRANCIS | I952: NICHOLSON | L952: LAWRIE | N952: HOCKING | Q952: HOLT | W952: COBURG | X952: 15 | Y952: 14 | Z952: 1 | AA952: 0 | AB952: 1978 | AC952: 1045 | AD952: =(AB952/AC952)*100 -> 189.28229665071768 | AE952: =(Y952*4)+(AA952*2) -> 56
A953: GOALKICKERS | N953: JOHNSON | P953: McTAGGART | W953: BOX HILL | X953: 15 | Y953: 12 | Z953: 2 | AA953: 1 | AB953: 1908 | AC953: 1461 | AD953: =(AB953/AC953)*100 -> 130.59548254620123 | AE953: =(Y953*4)+(AA953*2) -> 50
A954: WILLIAMSTOWN | C954: RICKMAN 7 | E954: DELRE 5 | G954: MINETT 3 | I954: BURTON 2 | K954: KENNY 2 | M954: GROENEWEGAN | P954: ROUND | R954: GHAZI | W954: WILLIAMSTOWN | X954: 15 | Y954: 11 | Z954: 3 | AA954: 1 | AB954: 2252 | AC954: 1313 | AD954: =(AB954/AC954)*100 -> 171.51561309977151 | AE954: =(Y954*4)+(AA954*2) -> 46
A955: BOX HILL | C955: REEVES 5 | E955: LAWRIE 3 | G955: BOLTON 2 | I955: HOCKING 2 | L955: BUTTIFANT | N955: FRANCIS | P955: GLEESON | W955: SPRINGVALE | X955: 15 | Y955: 11 | Z955: 4 | AA955: 0 | AB955: 1837 | AC955: 1313 | AD955: =(AB955/AC955)*100 -> 139.90860624523989 | AE955: =(Y955*4)+(AA955*2) -> 44
S956: VENUE: TOORAK PARK | W956: FRANKSTON | X956: 15 | Y956: 10 | Z956: 5 | AA956: 0 | AB956: 1794 | AC956: 1577 | AD956: =(AB956/AC956)*100 -> 113.76030437539633 | AE956: =(Y956*4)+(AA956*2) -> 40
A957: SANDRINGHAM | C957: 12 | D957: 4 | E957: 76 | G957: 13 | H957: 6 | I957: 84 | K957: 19 | L957: 9 | M957: 123 | O957: 24 | P957: 13 | Q957: 157 | S957: LAWLER
A958: PRAHRAN | C958: 1 | D958: 2 | E958: 8 | G958: 9 | H958: 4 | I958: 58 | K958: 11 | L958: 8 | M958: 74 | O958: 13 | P958: 14 | Q958: 92 | S958: GERSCH | W958: BRUNSWICK | X958: 15 | Y958: 8 | Z958: 7 | AA958: 0 | AB958: 1801 | AC958: 1517 | AD958: =(AB958/AC958)*100 -> 118.72116018457481 | AE958: =(Y958*4)+(AA958*2) -> 32
A959: BEST PLAYERS | W959: WERRIBEE | X959: 15 | Y959: 7 | Z959: 8 | AA959: 0 | AB959: 1816 | AC959: 1700 | AD959: =(AB959/AC959)*100 -> 106.8235294117647 | AE959: =(Y959*4)+(AA959*2) -> 28
A960: SANDRINGHAM | C960: ALLEN | F960: FISCHER | I960: HOWARD | L960: SAID | N960: RYAN | Q960: EAVES | W960: PRESTON | X960: 15 | Y960: 7 | Z960: 8 | AA960: 0 | AB960: 1406 | AC960: 1510 | AD960: =(AB960/AC960)*100 -> 93.11258278145695 | AE960: =(Y960*4)+(AA960*2) -> 28
A961: PRAHRAN | C961: McNICHOLL | F961: PAGE | I961: WHITE | L961: HIPWORTH | N961: HEWITSON | Q961: RICHARDS | W961: PORT MELBOURNE | X961: 15 | Y961: 7 | Z961: 8 | AA961: 0 | AB961: 1574 | AC961: 1711 | AD961: =(AB961/AC961)*100 -> 91.99298655756867 | AE961: =(Y961*4)+(AA961*2) -> 28
A962: GOALKICKERS | N962: IRWIN | P962: PHILBEY | W962: SANDRINGHAM | X962: 15 | Y962: 6 | Z962: 9 | AA962: 0 | AB962: 1999 | AC962: 2060 | AD962: =(AB962/AC962)*100 -> 97.038834951456309 | AE962: =(Y962*4)+(AA962*2) -> 24
A963: SANDRINGHAM | C963: HOWARD 5 | E963: F RUGOLO 4 | H963: DWYER 4 | J963: SAID 3 | L963: ALLEN 2 | N963: McKAY 2 | P963: FITZGERALD | R963: FISCHER | W963: OAKLEIGH | X963: 15 | Y963: 6 | Z963: 9 | AA963: 0 | AB963: 1694 | AC963: 1779 | AD963: =(AB963/AC963)*100 -> 95.222034851039908 | AE963: =(Y963*4)+(AA963*2) -> 24
A964: PRAHRAN | C964: HEWITSON 4 | F964: G GILES 3 | I964: EVANS | K964: HAMILTON | M964: HIPWORTH | O964: KLEINJANS | Q964: RICHARDS | W964: PRAHRAN | X964: 15 | Y964: 4 | Z964: 11 | AA964: 0 | AB964: 1519 | AC964: 1977 | AD964: =(AB964/AC964)*100 -> 76.833586241780466 | AE964: =(Y964*4)+(AA964*2) -> 16
O965: McNICHOLL | S965: VENUE: FRANKSTON | W965: DANDEN0NG | X965: 15 | Y965: 1 | Z965: 14 | AA965: 0 | AB965: 1090 | AC965: 2288 | AD965: =(AB965/AC965)*100 -> 47.63986013986014 | AE965: =(Y965*4)+(AA965*2) -> 4
A966: FRANKSTON | C966: 6 | D966: 0 | E966: 36 | G966: 12 | H966: 6 | I966: 78 | K966: 13 | L966: 7 | M966: 85 | O966: 17 | P966: 9 | Q966: 111 | S966: NOLAN | W966: CAMBERWELL | X966: 15 | Y966: 0 | Z966: 15 | AA966: 0 | AB966: 1189 | AC966: 2740 | AD966: =(AB966/AC966)*100 -> 43.394160583941606 | AE966: =(Y966*4)+(AA966*2) -> 0
A967: BRUNSWICK | C967: 5 | D967: 3 | E967: 33 | G967: 9 | H967: 4 | I967: 58 | K967: 12 | L967: 7 | M967: 79 | O967: 15 | P967: 9 | Q967: 99 | S967: FALLETT
A968: BEST PLAYERS
A969: FRANKSTON | C969: GAMBLE | F969: BINGLEY | I969: BELL | L969: D MARTIN | O969: LONGHAM | R969: WEST
A970: BRUNSWICK | C970: THOROGOOD | F970: KERR | I970: CLARK | L970: CONNELL | O970: SALVADORE | R970: DUGDALE
A971: GOALKICKERS
A972: FRANKSTON | C972: BINGLEY 7 | F972: BROWN 4 | I972: P MARTIN 3 | L972: WEST | N972: PARKER | P972: O'BRIEN
A973: BRUNSWICK | C973: CLARK 3 | E973: GRIFFITHS 3 | H973: BONE 3 | J973: HARMES 2 | M973: McALLESTER 2 | P973: HOLMES | R973: WRIGHT
A975: PRESTON | C975: 2 | D975: 1 | E975: 13 | G975: 3 | H975: 5 | I975: 23 | K975: 5 | L975: 7 | M975: 37 | O975: 6 | P975: 7 | Q975: 43 | S975: VENUE: PRESTON
A976: PORT MELBOURNE | C976: 1 | D976: 2 | E976: 8 | G976: 2 | H976: 2 | I976: 14 | K976: 5 | L976: 3 | M976: 33 | O976: 5 | P976: 6 | Q976: 36 | S976: FORSTER :SAVILLE
A977: BEST PLAYERS
A978: PRESTON | C978: JORDAN | F978: VALKANIS | I978: PRITCHARD | L978: DUNBAR | O978: MARCON | R978: PLOWMAN
A979: PORT MELBOURNE | C979: RAINSFORD | F979: MUTIMER | I979: FITZPATRICK | L979: HETHERTON | O979: GOLDIE | R979: BAILEY
A980: GOALKICKERS
A981: PRESTON | C981: JORDAN 2 | F981: HUNT | H981: NICOLAOU | K981: PRITCHARD | N981: DUNBAR
A982: PORT MELBOURNE | C982: MUTIMER 3 | F982: CONDON | I982: HARKINS
A984: COBURG | C984: 8 | D984: 7 | E984: 55 | G984: 9 | H984: 10 | I984: 64 | K984: 15 | L984: 13 | M984: 103 | O984: 18 | P984: 18 | Q984: 126 | S984: VENUE: COBURG
A985: WERRIBEE | C985: 1 | D985: 1 | E985: 7 | G985: 4 | H985: 4 | I985: 28 | K985: 6 | L985: 5 | M985: 41 | O985: 7 | P985: 8 | Q985: 50 | S985: TRESIZE :SNEDDON
A986: BEST PLAYERS
A987: COBURG | C987: EADE | F987: WEIDEMAN | I987: SHELDON | L987: INGRAM | O987: KAAKOUR | R987: WILLIAMS
A988: WERRIBEE | C988: SIZER | F988: DOMBERG | I988: HIGGINS | L988: BUCK | O988: MORRIS | R988: RADCLIFFE
A989: GOALKICKERS
A990: COBURG | C990: WILLIAMS 4 | F990: INGRAM 4 | I990: DOYLE 3 | K990: RACOVOLIS 3 | N990: KAAKOUR | Q990: RIENIETS | S990: SHELDON | W990: DARBY
A991: WERRIBEE | C991: FLEMING 2 | F991: MONTGOMERY 2 | J991: RADCLIFFE | M991: SELLS | O991: SIZER
A993: OAKLEIGH | C993: 8 | D993: 5 | E993: 53 | G993: 12 | H993: 11 | I993: 83 | K993: 17 | L993: 13 | M993: 115 | O993: 22 | P993: 15 | Q993: 147 | S993: VENUE: DANDENONG
A994: DANDENONG | C994: 2 | D994: 1 | E994: 13 | G994: 4 | H994: 2 | I994: 26 | K994: 4 | L994: 6 | M994: 30 | O994: 7 | P994: 9 | Q994: 51 | S994: VERGONA :RICHARDSON
A995: BEST PLAYERS
A996: OAKLEIGH | C996: HANKS | F996: MITCHELSON | I996: MELLODY | L996: DYSON | O996: CUNNINGHAM | R996: OWEN
A997: DANDENONG | C997: ATKINSON | F997: MILLANE | I997: TANNERHILL | L997: McCARTHY | O997: BASTIN | R997: LACKO
A998: GOALKICKERS
A999: OAKLEIGH | C999: OWEN 6 | E999: LOWE 5 | G999: PRETTO 4 | I999: MITCHELSON 3 | L999: KLIBINGATIS 2 | O999: DYSON | Q999: MELLODY
A1000: DANDENONG | C1000: MILLANE 2 | F1000: BRUNNEN | I1000: ATKINSON | K1000: LACKO | M1000: LINDSAY | O1000: D'ARCY
A1002: SPRINGVALE | C1002: 3 | D1002: 2 | E1002: 20 | G1002: 11 | H1002: 6 | I1002: 72 | K1002: 18 | L1002: 9 | M1002: 117 | O1002: 25 | P1002: 15 | Q1002: 165 | S1002: VENUE: SPRINGVALE
A1003: CAMBERWELL | C1003: 4 | D1003: 3 | E1003: 27 | G1003: 8 | H1003: 4 | I1003: 52 | K1003: 9 | L1003: 4 | M1003: 58 | O1003: 10 | P1003: 4 | Q1003: 64 | S1003: ANTHONY :CLEMENT
A1004: BEST PLAYERS
A1005: SPRINGVALE | C1005: MARCOU | F1005: PHILLIPS | I1005: MALONI | L1005: FOY | O1005: ANDERSON | R1005: ROBINSON
A1006: CAMBERWELL | C1006: KRUSE | F1006: SULLIVAN | I1006: GREIG | L1006: TORPY | O1006: TRIBE
A1007: GOALKICKERS | S1007: SHANNON
A1008: SPRINGVALE | C1008: ROBINSON 8 | F1008: PHILLIPS 4 | I1008: G CLARKE 2 | L1008: MARCOU 2 | N1008: PALM 2 | P1008: DEMPSTER | R1008: ANDERSON | U1008: MALONI | X1008: ELLIOTT | AA1008: WARNER | AC1008: STEWART
A1009: CAMBERWELL | C1009: SULLIVAN 5 | F1009: TORPY | H1009: TRIBE | J1009: KRUSE | L1009: TUCKER | N1009: CIRO
A1011: ROUND 18 | D1011: 12/13TH AUGUST | I1011: WEATHER | S1011: VENUE: WILLIAMSTOWN
D1012: 1ST QTR | H1012: 2ND QTR | L1012: 3RD QTR | P1012: FINAL | S1012: UMPIRES
A1013: WILLIAMSTOWN | C1013: 6 | D1013: 5 | E1013: 41 | G1013: 15 | H1013: 9 | I1013: 99 | K1013: 21 | L1013: 11 | M1013: 137 | O1013: 31 | P1013: 14 | Q1013: 200 | S1013: SAVILLE | Y1013: LADDER | AC1013: ROUND | AE1013: 18
A1014: DANDENONG | C1014: 4 | D1014: 2 | E1014: 26 | G1014: 4 | H1014: 3 | I1014: 27 | K1014: 9 | L1014: 7 | M1014: 61 | O1014: 12 | P1014: 8 | Q1014: 80 | S1014: CLEMENTS
A1015: BEST PLAYERS | W1015: TEAM | X1015: P | Y1015: W | Z1015: L | AA1015: D | AB1015: FOR | AC1015: AGST | AD1015: % | AE1015: PTS
A1016: WILLIAMSTOWN | C1016: RICKMAN | F1016: PASTORE | I1016: GHAZI | L1016: GROENEWEGAN | O1016: WHILLAS | Q1016: SWAN
A1017: DANDENONG | C1017: COLLARD | F1017: D'ARCY | I1017: LINDSAY | L1017: LACKO | O1017: MILLANE | Q1017: KANNOURAKIS | W1017: COBURG | X1017: 16 | Y1017: 15 | Z1017: 1 | AA1017: 0 | AB1017: 2116 | AC1017: 1101 | AD1017: =(AB1017/AC1017)*100 -> 192.188919164396 | AE1017: =(Y1017*4)+(AA1017*2) -> 60
A1018: GOALKICKERS | P1018: GROENEWEGAN | R1018: HOWLETT | W1018: BOX HILL | X1018: 16 | Y1018: 13 | Z1018: 2 | AA1018: 1 | AB1018: 2113 | AC1018: 1508 | AD1018: =(AB1018/AC1018)*100 -> 140.11936339522546 | AE1018: =(Y1018*4)+(AA1018*2) -> 54
A1019: WILLIAMSTOWN | C1019: RICKMAN 11 | F1019: GHAZI 7 | H1019: DELRE 4 | J1019: JOHNSON 3 | M1019: BURTON 2 | O1019: SMITH | Q1019: CAHILL | W1019: WILLIAMSTOWN | X1019: 16 | Y1019: 12 | Z1019: 3 | AA1019: 1 | AB1019: 2452 | AC1019: 1393 | AD1019: =(AB1019/AC1019)*100 -> 176.02297200287148 | AE1019: =(Y1019*4)+(AA1019*2) -> 50
A1020: DANDENONG | C1020: LACKO 2 | E1020: MILLANE 2 | G1020: MYNOTT 2 | I1020: MERRIGAN | K1020: KANNOURAKIS | N1020: DODDS | P1020: D'ARCY | R1020: BRUNNEN | W1020: SPRINGVALE | X1020: 16 | Y1020: 12 | Z1020: 4 | AA1020: 0 | AB1020: 1962 | AC1020: 1380 | AD1020: =(AB1020/AC1020)*100 -> 142.17391304347825 | AE1020: =(Y1020*4)+(AA1020*2) -> 48
M1021: ARGOON | S1021: VENUE: CAMBERWELL | W1021: FRANKSTON | X1021: 16 | Y1021: 11 | Z1021: 5 | AA1021: 0 | AB1021: 1946 | AC1021: 1636 | AD1021: =(AB1021/AC1021)*100 -> 118.94865525672371 | AE1021: =(Y1021*4)+(AA1021*2) -> 44
A1022: BOX HILL | C1022: 5 | D1022: 6 | E1022: 36 | G1022: 12 | H1022: 7 | I1022: 79 | K1022: 19 | L1022: 13 | M1022: 127 | O1022: 31 | P1022: 19 | Q1022: 205 | S1022: LAWLOR
A1023: CAMBERWELL | C1023: 0 | D1023: 5 | E1023: 5 | G1023: 3 | H1023: 11 | I1023: 29 | K1023: 5 | L1023: 11 | M1023: 41 | O1023: 6 | P1023: 11 | Q1023: 47 | S1023: PRINCE | W1023: BRUNSWICK | X1023: 16 | Y1023: 8 | Z1023: 8 | AA1023: 0 | AB1023: 1848 | AC1023: 1609 | AD1023: =(AB1023/AC1023)*100 -> 114.85394655065258 | AE1023: =(Y1023*4)+(AA1023*2) -> 32
A1024: BEST PLAYERS | W1024: PRESTON | X1024: 16 | Y1024: 8 | Z1024: 8 | AA1024: 0 | AB1024: 1498 | AC1024: 1557 | AD1024: =(AB1024/AC1024)*100 -> 96.210661528580601 | AE1024: =(Y1024*4)+(AA1024*2) -> 32
A1025: BOX HILL | C1025: REEVES | F1025: PRESTON | I1025: FRANCIS | L1025: BROWN | O1025: BOURKE | Q1025: NICHOLSON | W1025: WERRIBEE | X1025: 16 | Y1025: 7 | Z1025: 9 | AA1025: 0 | AB1025: 1883 | AC1025: 1825 | AD1025: =(AB1025/AC1025)*100 -> 103.17808219178082 | AE1025: =(Y1025*4)+(AA1025*2) -> 28
A1026: CAMBERWELL | C1026: TRIBE | F1026: LOCKMAN | I1026: KRUSE | L1026: TORPY | O1026: TUCKER | W1026: OAKLEIGH | X1026: 16 | Y1026: 7 | Z1026: 9 | AA1026: 0 | AB1026: 1844 | AC1026: 1891 | AD1026: =(AB1026/AC1026)*100 -> 97.514542570068755 | AE1026: =(Y1026*4)+(AA1026*2) -> 28
A1027: GOALKICKERS | H1027: GLEESON 2 | J1027: HICKS 2 | L1027: NICHOLSON 2 | O1027: HOCKING | R1027: REEVES | W1027: PORT MELBOURNE | X1027: 16 | Y1027: 7 | Z1027: 9 | AA1027: 0 | AB1027: 1630 | AC1027: 1849 | AD1027: =(AB1027/AC1027)*100 -> 88.155759870200114 | AE1027: =(Y1027*4)+(AA1027*2) -> 28
A1028: BOX HILL | C1028: BOURKE 6 | E1028: BUTTIFANT 4 | H1028: PRESTON 4 | J1028: ZARAFA 3 | M1028: FRANCIS 2 | O1028: JOHNS 2 | Q1028: BROWN 2 | W1028: SANDRINGHAM | X1028: 16 | Y1028: 6 | Z1028: 10 | AA1028: 0 | AB1028: 2111 | AC1028: 2210 | AD1028: =(AB1028/AC1028)*100 -> 95.520361990950235 | AE1028: =(Y1028*4)+(AA1028*2) -> 24
A1029: CAMBERWELL | C1029: SULLIVAN 2 | F1029: VITACCA | H1029: TORPY | J1029: MITCHELL | M1029: TUCKER | W1029: PRAHRAN | X1029: 16 | Y1029: 4 | Z1029: 12 | AA1029: 0 | AB1029: 1578 | AC1029: 2129 | AD1029: =(AB1029/AC1029)*100 -> 74.1193048379521 | AE1029: =(Y1029*4)+(AA1029*2) -> 16
S1030: VENUE: SPRINGVALE | W1030: DANDEN0NG | X1030: 16 | Y1030: 1 | Z1030: 15 | AA1030: 0 | AB1030: 1170 | AC1030: 2488 | AD1030: =(AB1030/AC1030)*100 -> 47.025723472668815 | AE1030: =(Y1030*4)+(AA1030*2) -> 4
A1031: SPRINGVALE | C1031: 7 | D1031: 5 | E1031: 47 | G1031: 12 | H1031: 6 | I1031: 78 | K1031: 14 | L1031: 14 | M1031: 98 | O1031: 17 | P1031: 23 | Q1031: 125 | S1031: FORSTER | W1031: CAMBERWELL | X1031: 16 | Y1031: 0 | Z1031: 16 | AA1031: 0 | AB1031: 1236 | AC1031: 2945 | AD1031: =(AB1031/AC1031)*100 -> 41.969439728353144 | AE1031: =(Y1031*4)+(AA1031*2) -> 0
A1032: WERRIBEE | C1032: 1 | D1032: 1 | E1032: 7 | G1032: 5 | H1032: 3 | I1032: 33 | K1032: 8 | L1032: 4 | M1032: 52 | O1032: 10 | P1032: 7 | Q1032: 67 | S1032: GOLDSPINK
A1033: BEST PLAYERS
A1034: SPRINGVALE | C1034: S CLARK | F1034: NICOL | H1034: PHILLIPS | K1034: MARCOU | N1034: FOY | Q1034: PROSSER
A1035: WERRIBEE | C1035: HIGGINS | F1035: SIZER | H1035: DOMBERG | K1035: CHRISTIANSEN | N1035: McMASTER | Q1035: GUDDE
A1036: GOALKICKERS
A1037: SPRINGVALE | C1037: ANDERSON 4 | F1037: ROBINSON 3 | I1037: PHILLIPS 3 | K1037: CLARK 2 | M1037: PROSSER 2 | O1037: DEMPSTER | Q1037: MAYLIN | S1037: JEFFS
A1038: WERRIBEE | C1038: MONTGOMERY 3 | F1038: RADCLIFFE 2 | I1038: SIZER | K1038: BUTTON | M1038: HIGGINS | O1038: FLEMING | Q1038: BUCK
A1040: PRESTON | C1040: 2 | D1040: 4 | E1040: 16 | G1040: 4 | H1040: 7 | I1040: 31 | K1040: 8 | L1040: 11 | M1040: 59 | O1040: 13 | P1040: 14 | Q1040: 92 | S1040: VENUE: BRUNSWICK
A1041: BRUNSWICK | C1041: 1 | D1041: 2 | E1041: 8 | G1041: 3 | H1041: 8 | I1041: 26 | K1041: 3 | L1041: 9 | M1041: 27 | O1041: 6 | P1041: 11 | Q1041: 47 | S1041: GERSCH :KHAN
A1042: BEST PLAYERS
A1043: PRESTON | C1043: LAWSON | F1043: NICOLAOU | I1043: DUNBAR | L1043: VALKANIS | O1043: HALAS
A1044: BRUNSWICK | C1044: THOROGOOD | F1044: McGUIRE | I1044: CALLANDER | L1044: CONNELL | O1044: DUGDALE | R1044: BONE
A1045: GOALKICKERS
A1046: PRESTON | C1046: SHAW 5 | F1046: LAWSON 3 | I1046: DUNBAR 3 | L1046: NICOLAOU 2
A1047: BRUNSWICK | C1047: HARMES 2 | F1047: HERBERT 2 | I1047: BONE | K1047: McALLESTER
A1049: COBURG | C1049: 1 | D1049: 7 | E1049: 13 | G1049: 8 | H1049: 10 | I1049: 58 | K1049: 13 | L1049: 13 | M1049: 91 | O1049: 20 | P1049: 18 | Q1049: 138 | S1049: VENUE: SUNSHINE
A1050: PORT MELBOURNE | C1050: 3 | D1050: 2 | E1050: 20 | G1050: 5 | H1050: 5 | I1050: 35 | K1050: 6 | L1050: 10 | M1050: 46 | O1050: 7 | P1050: 14 | Q1050: 56 | S1050: PRINCE :CARLAND
A1051: BEST PLAYERS
A1052: COBURG | C1052: BASSETT | F1052: WEIDEMAN | I1052: EADE | L1052: SHELDON | O1052: DOYLE | R1052: TARANTO
A1053: PORT MELBOURNE | C1053: KENNEDY | F1053: FITZPATRICK | I1053: YORGEY | L1053: GOLDIE | O1053: MUTIMER | R1053: HICKS
A1054: GOALKICKERS
A1055: COBURG | C1055: REYNOLDSON 4 | F1055: DARBY 4 | H1055: KAAKOUR 3 | K1055: DOYLE 3 | M1055: RACOVOLIS 2 | P1055: INGRAM 2 | R1055: GUMLEY | U1055: EADE
A1056: PORT MELBOURNE | C1056: CONDON 4 | F1056: BAILEY | H1056: HICKS | J1056: MUTIMER
A1058: OAKLEIGH | C1058: 2 | D1058: 3 | E1058: 15 | G1058: 11 | H1058: 6 | I1058: 72 | K1058: 14 | L1058: 8 | M1058: 92 | O1058: 23 | P1058: 12 | Q1058: 150 | S1058: VENUE: OAKLEIGH
A1059: SANDRINGHAM | C1059: 4 | D1059: 3 | E1059: 27 | G1059: 8 | H1059: 7 | I1059: 55 | K1059: 12 | L1059: 14 | M1059: 86 | O1059: 16 | P1059: 16 | Q1059: 112 | S1059: NOLAN :COATES
A1060: BEST PLAYERS
A1061: OAKLEIGH | C1061: SMITH | F1061: CUNNINGHAM | I1061: OWEN | L1061: GARBUIO | O1061: LOWE | R1061: DYSON
A1062: SANDRINGHAM | C1062: SAID | F1062: HOWARD | I1062: FISCHER | L1062: EAVES | O1062: ALLEN | R1062: PHILBEY
A1063: GOALKICKERS
A1064: OAKLEIGH | C1064: OWEN 8 | F1064: LOWE 6 | H1064: PRETTO 5 | J1064: KLIBINGATIS 2 | M1064: DESSENT | O1064: GARBUIO
A1065: SANDRINGHAM | C1065: HOWARD 4 | F1065: J RUGOLO 3 | I1065: IRWIN 3 | K1065: F RUGOLO 2 | N1065: ENDERS 2 | P1065: ALLEN | R1065: FISCHER
A1067: FRANKSTON | C1067: 1 | D1067: 1 | E1067: 7 | G1067: 8 | H1067: 6 | I1067: 54 | K1067: 14 | L1067: 12 | M1067: 96 | O1067: 23 | P1067: 14 | Q1067: 152 | S1067: VENUE: FRANKSTON
A1068: PRAHRAN | C1068: 4 | D1068: 2 | E1068: 26 | G1068: 6 | H1068: 8 | I1068: 44 | K1068: 8 | L1068: 10 | M1068: 58 | O1068: 8 | P1068: 11 | Q1068: 59 | S1068: MORROW :ANTHONY
A1069: BEST PLAYERS
A1070: FRANKSTON | C1070: WEST | F1070: SARAU | I1070: BELL | L1070: D MARTIN | O1070: VANDERMEER | R1070: BROWN
A1071: PRAHRAN | C1071: CARTLEDGE | F1071: PAGE | I1071: SOULOS | L1071: KLEINJANS | O1071: HIPWORTH
A1072: GOALKICKERS | U1072: WEST
A1073: FRANKSTON | C1073: BROWN 6 | E1073: MACE 3 | G1073: BINGLEY 2 | I1073: KEANE 2 | K1073: McCARTHY 2 | N1073: CROSS | P1073: FOYSTER | R1073: HAMILL | U1073: SARAU | X1073: O'BRIEN | Z1073: LONGHAM | AC1073: VANDERMEER
A1074: PRAHRAN | C1074: SOULOS 3 | F1074: HERMAN 2 | I1074: CARROLL | K1074: S BENNETT | N1074: RICHARDS
A1076: ROUND 19 | D1076: 12/13TH AUGUST | I1076: WEATHER | S1076: VENUE: WERRIBEE
D1077: 1ST QTR | H1077: 2ND QTR | L1077: 3RD QTR | P1077: FINAL | S1077: UMPIRES
A1078: OAKLEIGH | C1078: 3 | D1078: 7 | E1078: 25 | G1078: 8 | H1078: 9 | I1078: 57 | K1078: 11 | L1078: 13 | M1078: 79 | O1078: 16 | P1078: 19 | Q1078: 115 | S1078: CARLAND | Y1078: LADDER | AC1078: ROUND | AE1078: 19
A1079: WERRIBEE | C1079: 6 | D1079: 1 | E1079: 37 | G1079: 9 | H1079: 3 | I1079: 57 | K1079: 13 | L1079: 5 | M1079: 83 | O1079: 14 | P1079: 7 | Q1079: 91 | S1079: CAULFIELD
A1080: BEST PLAYERS | W1080: TEAM | X1080: P | Y1080: W | Z1080: L | AA1080: D | AB1080: FOR | AC1080: AGST | AD1080: % | AE1080: PTS
A1081: OAKLEIGH | C1081: SMITH | F1081: TODD | I1081: LOWE | L1081: CUNNINGHAM | O1081: GARBUIO | R1081: DYSON
A1082: WERRIBEE | C1082: HIGGINS | F1082: DOMBERG | I1082: VASILOU | L1082: CHRISTIANSEN | O1082: SPIERINGS | R1082: TAYLOR | W1082: COBURG | X1082: 17 | Y1082: 16 | Z1082: 1 | AA1082: 0 | AB1082: 2215 | AC1082: 1198 | AD1082: =(AB1082/AC1082)*100 -> 184.89148580968279 | AE1082: =(Y1082*4)+(AA1082*2) -> 64
A1083: GOALKICKERS | W1083: WILLIAMSTOWN | X1083: 17 | Y1083: 13 | Z1083: 3 | AA1083: 1 | AB1083: 2705 | AC1083: 1447 | AD1083: =(AB1083/AC1083)*100 -> 186.93849343469248 | AE1083: =(Y1083*4)+(AA1083*2) -> 54
A1084: OAKLEIGH | C1084: LOWE 7 | F1084: PRETTO 5 | I1084: DYSON 2 | K1084: GARBUIO | M1084: OWEN | W1084: BOX HILL | X1084: 17 | Y1084: 13 | Z1084: 3 | AA1084: 1 | AB1084: 2210 | AC1084: 1607 | AD1084: =(AB1084/AC1084)*100 -> 137.52333540759179 | AE1084: =(Y1084*4)+(AA1084*2) -> 54
A1085: WERRIBEE | C1085: VASILOU 6 | F1085: TAYLOR 4 | I1085: SIZER | K1085: RADCLIFFE | M1085: JUKAWICS | P1085: CHRISTIANSEN | W1085: SPRINGVALE | X1085: 17 | Y1085: 13 | Z1085: 4 | AA1085: 0 | AB1085: 2072 | AC1085: 1465 | AD1085: =(AB1085/AC1085)*100 -> 141.4334470989761 | AE1085: =(Y1085*4)+(AA1085*2) -> 52
S1086: VENUE: BEACH ROAD | W1086: FRANKSTON | X1086: 17 | Y1086: 11 | Z1086: 6 | AA1086: 0 | AB1086: 2031 | AC1086: 1746 | AD1086: =(AB1086/AC1086)*100 -> 116.32302405498282 | AE1086: =(Y1086*4)+(AA1086*2) -> 44
A1087: SANDRINGHAM | C1087: 7 | D1087: 4 | E1087: 46 | G1087: 14 | H1087: 11 | I1087: 95 | K1087: 23 | L1087: 17 | M1087: 155 | O1087: 30 | P1087: 21 | Q1087: 201 | S1087: CLEMENT
A1088: BRUNSWICK | C1088: 6 | D1088: 3 | E1088: 39 | G1088: 11 | H1088: 7 | I1088: 73 | K1088: 15 | L1088: 9 | M1088: 99 | O1088: 23 | P1088: 12 | Q1088: 150 | S1088: MORROW | W1088: PRESTON | X1088: 17 | Y1088: 9 | Z1088: 8 | AA1088: 0 | AB1088: 1609 | AC1088: 1632 | AD1088: =(AB1088/AC1088)*100 -> 98.590686274509807 | AE1088: =(Y1088*4)+(AA1088*2) -> 36
A1089: BEST PLAYERS | W1089: BRUNSWICK | X1089: 17 | Y1089: 8 | Z1089: 9 | AA1089: 0 | AB1089: 1998 | AC1089: 1810 | AD1089: =(AB1089/AC1089)*100 -> 110.38674033149172 | AE1089: =(Y1089*4)+(AA1089*2) -> 32
A1090: SANDRINGHAM | C1090: F RUGOLO | F1090: PRATT | I1090: J RUGOLO | L1090: ALLEN | N1090: EAVES | Q1090: FITZGERALD | W1090: OAKLEIGH | X1090: 17 | Y1090: 8 | Z1090: 9 | AA1090: 0 | AB1090: 1959 | AC1090: 1982 | AD1090: =(AB1090/AC1090)*100 -> 98.839556004036325 | AE1090: =(Y1090*4)+(AA1090*2) -> 32
A1091: BRUNSWICK | C1091: KERR | F1091: THOROGOOD | I1091: EAMES | L1091: CONNELL | N1091: DUGDALE | Q1091: CLARK | W1091: PORT MELBOURNE | X1091: 17 | Y1091: 8 | Z1091: 9 | AA1091: 0 | AB1091: 1809 | AC1091: 1983 | AD1091: =(AB1091/AC1091)*100 -> 91.22541603630863 | AE1091: =(Y1091*4)+(AA1091*2) -> 32
A1092: GOALKICKERS | Q1092: PRATT | S1092: IRWIN | W1092: WERRIBEE | X1092: 17 | Y1092: 7 | Z1092: 10 | AA1092: 0 | AB1092: 1974 | AC1092: 1940 | AD1092: =(AB1092/AC1092)*100 -> 101.75257731958763 | AE1092: =(Y1092*4)+(AA1092*2) -> 28
A1093: SANDRINGHAM | C1093: F RUGOLO 10 | F1093: HOWARD 4 | I1093: ALLEN 3 | K1093: PHILBEY 3 | M1093: SAID 3 | O1093: FITZGERALD 3 | R1093: FISCHER 2 | W1093: SANDRINGHAM | X1093: 17 | Y1093: 7 | Z1093: 10 | AA1093: 0 | AB1093: 2312 | AC1093: 2360 | AD1093: =(AB1093/AC1093)*100 -> 97.966101694915253 | AE1093: =(Y1093*4)+(AA1093*2) -> 28
A1094: BRUNSWICK | C1094: BONE 4 | E1094: HERBERT 3 | G1094: CLARK 2 | I1094: DUGDALE 2 | L1094: EAMES 2 | N1094: GRIFFITHS 2 | Q1094: LOVETT 2 | W1094: PRAHRAN | X1094: 17 | Y1094: 4 | Z1094: 13 | AA1094: 0 | AB1094: 1663 | AC1094: 2240 | AD1094: =(AB1094/AC1094)*100 -> 74.241071428571431 | AE1094: =(Y1094*4)+(AA1094*2) -> 16
F1095: SALVADORE 2 | I1095: KERR | K1095: CALLANDER | N1095: MEAD | P1095: McALLESTER | S1095: VENUE: SPRINGVALE | W1095: DANDEN0NG | X1095: 17 | Y1095: 1 | Z1095: 16 | AA1095: 0 | AB1095: 1304 | AC1095: 2667 | AD1095: =(AB1095/AC1095)*100 -> 48.893888263967007 | AE1095: =(Y1095*4)+(AA1095*2) -> 4
A1096: SPRINGVALE | C1096: 2 | D1096: 2 | E1096: 14 | G1096: 9 | H1096: 5 | I1096: 59 | K1096: 11 | L1096: 11 | M1096: 77 | O1096: 16 | P1096: 14 | Q1096: 110 | S1096: BULLUSS | W1096: CAMBERWELL | X1096: 17 | Y1096: 0 | Z1096: 17 | AA1096: 0 | AB1096: 1290 | AC1096: 3198 | AD1096: =(AB1096/AC1096)*100 -> 40.337711069418383 | AE1096: =(Y1096*4)+(AA1096*2) -> 0
A1097: FRANKSTON | C1097: 4 | D1097: 2 | E1097: 26 | G1097: 4 | H1097: 5 | I1097: 29 | K1097: 7 | L1097: 8 | M1097: 50 | O1097: 12 | P1097: 13 | Q1097: 85 | S1097: COATES
A1098: BEST PLAYERS
A1099: SPRINGVALE | C1099: S CLARK | F1099: NICOL | I1099: MARCOU | L1099: G CLARKE | O1099: MALONI | R1099: PHILLIPS
A1100: FRANKSTON | C1100: N/A
A1101: GOALKICKERS | M1101: PALM | O1101: SHANNON | R1101: PHILLIPS
A1102: SPRINGVALE | C1102: ROBINSON 4 | F1102: MARCOU 3 | I1102: ANDERSON 3 | L1102: G CLARKE | N1102: DEMPSTER | Q1102: MALONI
A1103: FRANKSTON | C1103: BROWN 6 | F1103: BINGLEY 4 | I1103: WEST | K1103: P MARTIN
A1105: PRESTON | C1105: 8 | D1105: 4 | E1105: 52 | G1105: 11 | H1105: 12 | I1105: 78 | K1105: 15 | L1105: 18 | M1105: 108 | O1105: 15 | P1105: 21 | Q1105: 111 | S1105: VENUE: PRESTON
A1106: PRAHRAN | C1106: 4 | D1106: 2 | E1106: 26 | G1106: 5 | H1106: 3 | I1106: 33 | K1106: 8 | L1106: 5 | M1106: 53 | O1106: 11 | P1106: 9 | Q1106: 75 | S1106: McDONALD :VERGONA
A1107: BEST PLAYERS
A1108: PRESTON | C1108: HUNT | F1108: JORDAN | I1108: NICOLAOU | L1108: M LAWSON | O1108: DUNBAR | R1108: HALAS
A1109: PRAHRAN | C1109: CARTLEDGE | F1109: McNICHOLL | I1109: KILEY | L1109: HIPWORTH | O1109: SOULOS | R1109: JOHNS
A1110: GOALKICKERS
A1111: PRESTON | C1111: NICOLAOU 6 | F1111: SHAW 4 | I1111: LUMICISI 2 | L1111: LAWSON | N1111: DUNBAR | Q1111: JORDAN
A1112: PRAHRAN | C1112: McNICHOLL 4 | F1112: RICHARDS 2 | I1112: WALFORD | K1112: EVANS | M1112: KLEINJANS | O1112: S GILES | Q1112: S BENNETT
A1114: COBURG | C1114: 2 | D1114: 1 | E1114: 13 | G1114: 5 | H1114: 2 | I1114: 32 | K1114: 9 | L1114: 3 | M1114: 57 | O1114: 15 | P1114: 9 | Q1114: 99 | S1114: VENUE: BOX HILL
A1115: BOX HILL | C1115: 2 | D1115: 6 | E1115: 18 | G1115: 6 | H1115: 11 | I1115: 47 | K1115: 12 | L1115: 12 | M1115: 84 | O1115: 14 | P1115: 13 | Q1115: 97 | S1115: FORSTER ;CAMERON
A1116: BEST PLAYERS
A1117: COBURG | C1117: TARANTO | F1117: BASSETT | I1117: NIMMO | L1117: SHELDON | O1117: ALLISON
A1118: BOX HILL | C1118: HOCKING | F1118: ZARAFA | I1118: LAWRIE | L1118: REEVES | O1118: O'NEILL
A1119: GOALKICKERS
A1120: COBURG | C1120: KAAKOUR 3 | F1120: LANGAN 2 | I1120: WEATHERALD 2 | L1120: WEIDEMAN 2 | O1120: ALLISON | Q1120: BASSETT | S1120: RIENIETS | W1120: GUMLEY | X1120: INGRAM
A1121: BOX HILL | C1121: REEVES 4 | F1121: BOLTON 2 | I1121: ZARAFA 2 | L1121: NICHOLSON | N1121: BUTTIFANT | Q1121: HOLT | R1121: PRESTON | U1121: BOURKE | X1121: FRANCIS
A1123: WILLIAMSTOWN | C1123: 8 | D1123: 5 | E1123: 53 | G1123: 18 | H1123: 10 | I1123: 118 | K1123: 29 | L1123: 15 | M1123: 189 | O1123: 39 | P1123: 19 | Q1123: 253 | S1123: VENUE: CAMBERWELL
A1124: CAMBERWELL | C1124: 3 | D1124: 2 | E1124: 20 | G1124: 5 | H1124: 5 | I1124: 35 | K1124: 5 | L1124: 9 | M1124: 39 | O1124: 7 | P1124: 12 | Q1124: 54 | S1124: KHAN :HOLT
A1125: BEST PLAYERS
A1126: WILLIAMSTOWN | C1126: RICKMAN | F1126: JOHNSON | I1126: DELRE | L1126: McTAGGART | O1126: SWAN | Q1126: GHAZI
A1127: CAMBERWELL | C1127: SULLIVAN | F1127: GREIG | I1127: BUDGE
A1128: GOALKICKERS
A1129: WILLIAMSTOWN | C1129: RICKMAN 15 | F1129: DELRE 10 | I1129: GHAZI 6 | K1129: GROENEWEGAN 3 | O1129: MOURNEY 3 | R1129: KENNY | T1129: JOHNSON
A1130: CAMBERWELL | C1130: SULLIVAN 3 | F1130: HIPWORTH 2 | I1130: TORPY | K1130: LOCKMAN
A1132: PORT MELBOURNE | C1132: 6 | D1132: 6 | E1132: 42 | G1132: 14 | H1132: 8 | I1132: 92 | K1132: 21 | L1132: 12 | M1132: 138 | O1132: 27 | P1132: 17 | Q1132: 179 | S1132: VENUE: PORT MELBOURNE
A1133: DANDENONG | C1133: 4 | D1133: 2 | E1133: 26 | G1133: 9 | H1133: 4 | I1133: 58 | K1133: 15 | L1133: 5 | M1133: 95 | O1133: 21 | P1133: 8 | Q1133: 134 | S1133: GOLDSPINK :PRINCE
A1134: BEST PLAYERS
A1135: PORT MELBOURNE | C1135: MUTIMER | F1135: CONDON | I1135: HARKINS | L1135: KENNEDY | O1135: CHADBAND | R1135: DUNBAR
A1136: DANDENONG | C1136: LACKO | F1136: BRUNNEN | I1136: MCCARTHY | L1136: COLLARD | O1136: SIMMONS | R1136: MYNOTT
A1137: GOALKICKERS
A1138: PORT MELBOURNE | C1138: CONDON 8 | F1138: HETHERTON 4 | I1138: HARKINS 3 | L1138: SCURRAH 3 | O1138: KENNEDY 3 | Q1138: ERWIN 2 | S1138: GOLDIE 2 | W1138: HICKS | X1138: RAINSFORD
A1139: DANDENONG | C1139: McCARTHY 4 | F1139: SIMMONS 4 | I1139: BRUNNEN 3 | L1139: MYNOTT 3 | N1139: DODDS 2 | P1139: HILL 2 | R1139: TANNERHILL | W1139: LACKO | X1139: KANNOURAKIS
A1141: ROUND 20 | D1141: 26/27TH AUGUST | I1141: WEATHER | S1141: VENUE: CAMBERWELL
D1142: 1ST QTR | H1142: 2ND QTR | L1142: 3RD QTR | P1142: FINAL | S1142: UMPIRES
A1143: WERRIBEE | C1143: 5 | D1143: 2 | E1143: 32 | G1143: 7 | H1143: 5 | I1143: 47 | K1143: 14 | L1143: 10 | M1143: 94 | O1143: 22 | P1143: 16 | Q1143: 148 | S1143: NOLAN | Y1143: LADDER | AC1143: ROUND | AE1143: 20
A1144: CAMBERWELL | C1144: 5 | D1144: 2 | E1144: 32 | G1144: 5 | H1144: 7 | I1144: 37 | K1144: 6 | L1144: 10 | M1144: 46 | O1144: 8 | P1144: 13 | Q1144: 61 | S1144: McDONALD
A1145: BEST PLAYERS | W1145: TEAM | X1145: P | Y1145: W | Z1145: L | AA1145: D | AB1145: FOR | AC1145: AGST | AD1145: % | AE1145: PTS
A1146: WERRIBEE | C1146: JUKAWICS | F1146: CHRISTIANSEN | I1146: GUDDE | L1146: MONTGOMERY | O1146: SPIERINGS | Q1146: MOLONEY
A1147: CAMBERWELL | C1147: TRIBE | F1147: GREIG | I1147: SULLIVAN | L1147: BUDGE | O1147: KRUSE | Q1147: VITACCA | W1147: COBURG | X1147: 18 | Y1147: 17 | Z1147: 1 | AA1147: 0 | AB1147: 2325 | AC1147: 1260 | AD1147: =(AB1147/AC1147)*100 -> 184.52380952380955 | AE1147: =(Y1147*4)+(AA1147*2) -> 68
A1148: GOALKICKERS | O1148: STEWART | Q1148: SMITH | W1148: WILLIAMSTOWN | X1148: 18 | Y1148: 14 | Z1148: 3 | AA1148: 1 | AB1148: 2820 | AC1148: 1519 | AD1148: =(AB1148/AC1148)*100 -> 185.64845292955891 | AE1148: =(Y1148*4)+(AA1148*2) -> 58
A1149: WERRIBEE | C1149: MONTGOMERY 7 | F1149: BUCK 4 | H1149: RADCLIFFE 3 | K1149: TAYLOR 3 | M1149: CHRISTIANSEN | P1149: LAMB | R1149: MCMASTER | W1149: BOX HILL | X1149: 18 | Y1149: 14 | Z1149: 3 | AA1149: 1 | AB1149: 2360 | AC1149: 1706 | AD1149: =(AB1149/AC1149)*100 -> 138.33528722157092 | AE1149: =(Y1149*4)+(AA1149*2) -> 58
A1150: CAMBERWELL | C1150: TRIBE 2 | E1150: LAURIE 2 | G1150: SULLIVAN | I1150: TUCKER | K1150: VITACCA | M1150: GREIG | W1150: SPRINGVALE | X1150: 18 | Y1150: 13 | Z1150: 5 | AA1150: 0 | AB1150: 2144 | AC1150: 1580 | AD1150: =(AB1150/AC1150)*100 -> 135.69620253164555 | AE1150: =(Y1150*4)+(AA1150*2) -> 52
S1151: VENUE: FRANKSTON | W1151: FRANKSTON | X1151: 18 | Y1151: 12 | Z1151: 6 | AA1151: 0 | AB1151: 2218 | AC1151: 1843 | AD1151: =(AB1151/AC1151)*100 -> 120.34725990233315 | AE1151: =(Y1151*4)+(AA1151*2) -> 48
A1152: FRANKSTON | C1152: 9 | D1152: 4 | E1152: 58 | G1152: 18 | H1152: 5 | I1152: 113 | K1152: 27 | L1152: 6 | M1152: 168 | O1152: 30 | P1152: 7 | Q1152: 187 | S1152: SAWERS
A1153: OAKLEIGH | C1153: 2 | D1153: 2 | E1153: 14 | G1153: 4 | H1153: 5 | I1153: 29 | K1153: 8 | L1153: 11 | M1153: 59 | O1153: 14 | P1153: 13 | Q1153: 97 | S1153: KHAN | W1153: BRUNSWICK | X1153: 18 | Y1153: 9 | Z1153: 9 | AA1153: 0 | AB1153: 2140 | AC1153: 1941 | AD1153: =(AB1153/AC1153)*100 -> 110.25244719216897 | AE1153: =(Y1153*4)+(AA1153*2) -> 36
A1154: BEST PLAYERS | W1154: PRESTON | X1154: 18 | Y1154: 9 | Z1154: 9 | AA1154: 0 | AB1154: 1671 | AC1154: 1742 | AD1154: =(AB1154/AC1154)*100 -> 95.924225028702637 | AE1154: =(Y1154*4)+(AA1154*2) -> 36
A1155: FRANKSTON | C1155: D MARTIN | F1155: BELL | I1155: BROWN | L1155: FOYSTER | O1155: CROSS | Q1155: GAMBLE | W1155: PORT MELBOURNE | X1155: 18 | Y1155: 9 | Z1155: 9 | AA1155: 0 | AB1155: 1951 | AC1155: 2112 | AD1155: =(AB1155/AC1155)*100 -> 92.376893939393938 | AE1155: =(Y1155*4)+(AA1155*2) -> 36
A1156: OAKLEIGH | C1156: DYSON | F1156: SUTHERLAND | I1156: MELLODY | L1156: ATHERTON | O1156: HILLIARD | Q1156: CUNNINGHAM | W1156: WERRIBEE | X1156: 18 | Y1156: 8 | Z1156: 10 | AA1156: 0 | AB1156: 2122 | AC1156: 2001 | AD1156: =(AB1156/AC1156)*100 -> 106.04697651174413 | AE1156: =(Y1156*4)+(AA1156*2) -> 32
A1157: GOALKICKERS | Q1157: D MARTIN | W1157: OAKLEIGH | X1157: 18 | Y1157: 8 | Z1157: 10 | AA1157: 0 | AB1157: 2056 | AC1157: 2169 | AD1157: =(AB1157/AC1157)*100 -> 94.790225910557851 | AE1157: =(Y1157*4)+(AA1157*2) -> 32
A1158: FRANKSTON | C1158: BROWN 15 | E1158: P MARTIN 4 | H1158: GARDNER 3 | K1158: KEANE 3 | M1158: BELL 2 | O1158: BOONKAMP | Q1158: GAMBLE | W1158: SANDRINGHAM | X1158: 18 | Y1158: 7 | Z1158: 11 | AA1158: 0 | AB1158: 2411 | AC1158: 2510 | AD1158: =(AB1158/AC1158)*100 -> 96.055776892430274 | AE1158: =(Y1158*4)+(AA1158*2) -> 28
A1159: OAKLEIGH | C1159: PRETTO 6 | E1159: OWEN 3 | G1159: ATHERTON | I1159: MITCHELSON | L1159: DYSON | N1159: GARBUIO | Q1159: SUTHERLAND | W1159: PRAHRAN | X1159: 18 | Y1159: 4 | Z1159: 14 | AA1159: 0 | AB1159: 1792 | AC1159: 2382 | AD1159: =(AB1159/AC1159)*100 -> 75.230898404701932 | AE1159: =(Y1159*4)+(AA1159*2) -> 16
S1160: VENUE: TOORAK PARK | W1160: DANDEN0NG | X1160: 18 | Y1160: 1 | Z1160: 17 | AA1160: 0 | AB1160: 1435 | AC1160: 2809 | AD1160: =(AB1160/AC1160)*100 -> 51.085795656817368 | AE1160: =(Y1160*4)+(AA1160*2) -> 4
A1161: PORT MELBOURNE | C1161: 7 | D1161: 3 | E1161: 45 | G1161: 11 | H1161: 4 | I1161: 70 | K1161: 19 | L1161: 9 | M1161: 123 | O1161: 22 | P1161: 10 | Q1161: 142 | S1161: BULLUSS | W1161: CAMBERWELL | X1161: 18 | Y1161: 0 | Z1161: 18 | AA1161: 0 | AB1161: 1351 | AC1161: 3346 | AD1161: =(AB1161/AC1161)*100 -> 40.376569037656907 | AE1161: =(Y1161*4)+(AA1161*2) -> 0
A1162: PRAHRAN | C1162: 2 | D1162: 2 | E1162: 14 | G1162: 9 | H1162: 10 | I1162: 64 | K1162: 10 | L1162: 13 | M1162: 73 | O1162: 19 | P1162: 15 | Q1162: 129 | S1162: TRESIZE
A1163: BEST PLAYERS
A1164: PORT MELBOURNE | C1164: MUTIMER | F1164: HARKINS | I1164: CHADBAND | L1164: NORTON | O1164: RAINSFORD | R1164: CONDON
A1165: PRAHRAN | C1165: KILEY | F1165: WALFORD | I1165: CARTLEDGE | L1165: HERMAN | O1165: WHITE | R1165: KLEINJANS
A1166: GOALKICKERS
A1167: PORT MELBOURNE | C1167: CONDON 7 | F1167: COOPER 5 | I1167: MUTIMER 4 | L1167: HARKINS 3 | N1167: DRAIN | P1167: LIDDLE | R1167: SCURRAH
A1168: PRAHRAN | C1168: HERMAN 4 | F1168: S BENNETT 3 | I1168: HIPWORTH 2 | L1168: KILEY 2 | N1168: SOULOS 2 | P1168: EVANS 2
I1169: KLEINJANS 2 | L1169: BOWER | N1169: CARTLEDGE
A1170: COBURG | C1170: 6 | D1170: 2 | E1170: 38 | G1170: 9 | H1170: 10 | I1170: 64 | K1170: 12 | L1170: 12 | M1170: 84 | O1170: 16 | P1170: 14 | Q1170: 110 | S1170: VENUE: PRESTON
A1171: PRESTON | C1171: 1 | D1171: 3 | E1171: 9 | G1171: 3 | H1171: 9 | I1171: 27 | K1171: 5 | L1171: 12 | M1171: 42 | O1171: 8 | P1171: 14 | Q1171: 62 | S1171: CARLAND :GOLDSPINK
A1172: BEST PLAYERS
A1173: COBURG | C1173: ALLISON | F1173: SHELDON | I1173: BASSETT | L1173: KAAKOUR | O1173: RIENIETS | R1173: INGRAM
A1174: PRESTON | C1174: DINTINOSANTE | F1174: SHAW | I1174: HUNT | L1174: PERCY | O1174: DUNBAR | R1174: LAWSON
A1175: GOALKICKERS
A1176: COBURG | C1176: INGRAM 4 | F1176: BASSETT 3 | I1176: KAAKOUR 2 | L1176: DOYLE 2 | N1176: RIENIETS | P1176: EADE | R1176: ALLISON | U1176: WEATHERALD
A1177: PRESTON | C1177: OWEN 3 | F1177: DUNBAR | H1177: NICOLAOU | J1177: PRITCHARD | M1177: M LAWSON | P1177: LUMICISI
A1179: BOX HILL | C1179: 6 | D1179: 4 | E1179: 40 | G1179: 13 | H1179: 7 | I1179: 85 | K1179: 17 | L1179: 14 | M1179: 116 | O1179: 22 | P1179: 18 | Q1179: 150 | S1179: VENUE: BOX HILL
A1180: SANDRINGHAM | C1180: 1 | D1180: 3 | E1180: 9 | G1180: 5 | H1180: 7 | I1180: 37 | K1180: 8 | L1180: 11 | M1180: 59 | O1180: 14 | P1180: 15 | Q1180: 99 | S1180: HOWLETT :HOLT
A1181: BEST PLAYERS
A1182: BOX HILL | C1182: BUTTIFANT | F1182: BOLTON | I1182: ZARAFA | L1182: REEVES | O1182: HICKS | Q1182: FRANCIS
A1183: SANDRINGHAM | C1183: J RUGOLO | F1183: EAVES | I1183: ALLEN | L1183: BONNEY | O1183: IRWIN | Q1183: PRATT
A1184: GOALKICKERS
A1185: BOX HILL | C1185: BOLTON 8 | F1185: ZARAFA 4 | I1185: HOGAN 3 | K1185: BUTTIFANT 2 | N1185: HICKS | P1185: HOCKING | R1185: BROWN | U1185: FRANCIS | X1185: REEVES
A1186: SANDRINGHAM | C1186: IRWIN 5 | F1186: PRATT 3 | H1186: F RUGOLO 3 | K1186: HOWARD | M1186: J RUGOLO | O1186: DALRYMPLE
A1188: BRUNSWICK | C1188: 4 | D1188: 7 | E1188: 31 | G1188: 8 | H1188: 7 | I1188: 55 | K1188: 15 | L1188: 13 | M1188: 103 | O1188: 21 | P1188: 16 | Q1188: 142 | S1188: VENUE: BRUNSWICK
A1189: DANDENONG | C1189: 5 | D1189: 0 | E1189: 30 | G1189: 16 | H1189: 3 | I1189: 99 | K1189: 19 | L1189: 6 | M1189: 120 | O1189: 20 | P1189: 11 | Q1189: 131 | S1189: KENNEDY :BEDFORD
A1190: BEST PLAYERS
A1191: BRUNSWICK | C1191: EAMES | F1191: KERR | I1191: DUGDALE | L1191: McGUIRE | O1191: THOROGOOD | R1191: BERTOLLO
A1192: DANDENONG | C1192: MYNOTT | F1192: BRUNNEN | I1192: TODD | L1192: LINDSAY | O1192: LACKO | R1192: HILL
A1193: GOALKICKERS
A1194: BRUNSWICK | C1194: CLARK 4 | E1194: GRIFFITHS 3 | H1194: McALLESTER 3 | K1194: EAMES 3 | M1194: POTTER 2 | O1194: McGUIRE 2 | Q1194: CALLANDER | T1194: BONE | W1194: BERTOLLO | X1194: HYSLOP
A1195: DANDENONG | C1195: MYNOTT 5 | F1195: HILL 4 | H1195: ATKINSON 2 | J1195: BRUNNEN 2 | M1195: LACKO 2 | O1195: MILLANE 2 | Q1195: SIMMONS 2 | T1195: COLLARD
A1197: WILLIAMSTOWN | C1197: 0 | D1197: 7 | E1197: 7 | G1197: 6 | H1197: 12 | I1197: 48 | K1197: 12 | L1197: 13 | M1197: 85 | O1197: 17 | P1197: 13 | Q1197: 115 | S1197: VENUE: WILLIAMSTOWN
A1198: SPRINGVALE | C1198: 3 | D1198: 2 | E1198: 20 | G1198: 5 | H1198: 9 | I1198: 39 | K1198: 6 | L1198: 11 | M1198: 47 | O1198: 9 | P1198: 18 | Q1198: 72 | S1198: MORROW :VERGONA
A1199: BEST PLAYERS
A1200: WILLIAMSTOWN | C1200: CAHILL | F1200: KENNY | I1200: PASTORE | L1200: JOHNSON | O1200: GHAZI | R1200: GOULD
A1201: SPRINGVALE | C1201: CLARK | F1201: FOY | I1201: WARNER | L1201: SHANNON | O1201: NICOL
A1202: GOALKICKERS
A1203: WILLIAMSTOWN | C1203: RICKMAN 4 | F1203: CAHILL 3 | H1203: GHAZI 3 | J1203: KENNY 2 | L1203: DELRE 2 | N1203: McTAGGART | Q1203: GROENEWEGAN
A1204: SPRINGVALE | C1204: PROSSER 2 | F1204: ROBINSON 2 | I1204: G CLARKE | K1204: MARCOU | M1204: DUDLEY | O1204: STEWART | Q1204: DEMPSTER
A1206: FINALS
A1207: ELIMINATION | D1207: 3RD SEPTEMBER | I1207: WEATHER
D1208: 1ST QTR | H1208: 2ND QTR | L1208: 3RD QTR | P1208: FINAL
A1209: SPRINGVALE | C1209: 6 | D1209: 5 | E1209: 41 | G1209: 8 | H1209: 7 | I1209: 55 | K1209: 17 | L1209: 11 | M1209: 113 | O1209: 23 | P1209: 11 | Q1209: 149 | S1209: VENUE: BEACH ROAD
A1210: FRANKSTON | C1210: 2 | D1210: 2 | E1210: 14 | G1210: 5 | H1210: 6 | I1210: 36 | K1210: 12 | L1210: 7 | M1210: 79 | O1210: 16 | P1210: 9 | Q1210: 105 | S1210: MORROW :SAWERS
A1211: BEST PLAYERS
A1212: SPRINGVALE | C1212: S CLARK | F1212: PALM | I1212: DEMPSTER | L1212: FOY | O1212: ANDERSON | R1212: WARNER
A1213: FRANKSTON | C1213: WEST | F1213: FREW | I1213: MARTIN | L1213: MACE | O1213: SARAU | R1213: KEANE
A1214: GOALKICKERS
A1215: SPRINGVALE | C1215: PALM 5 | E1215: ROBINSON 4 | H1215: PROSSER 4 | J1215: PHILLIPS 4 | M1215: ANDERSON 2 | P1215: DEMPSTER | R1215: MENDE | T1215: NICOL | W1215: G CLARKE
A1216: FRANKSTON | C1216: KEANE 5 | E1216: BROWN 4 | G1216: BINGLEY 3 | I1216: McCARTHY | L1216: MACE | N1216: SHIELDS | P1216: WEST
A1218: QUALIFYING | D1218: 2ND SEPTEMBER | I1218: WEATHER
A1219: BOX HILL | C1219: 5 | D1219: 1 | E1219: 31 | G1219: 10 | H1219: 1 | I1219: 61 | K1219: 14 | L1219: 6 | M1219: 90 | O1219: 17 | P1219: 9 | Q1219: 111 | S1219: VENUE: PORT MELBOURNE
A1220: WILLIAMSTOWN | C1220: 4 | D1220: 4 | E1220: 28 | G1220: 10 | H1220: 7 | I1220: 67 | K1220: 11 | L1220: 9 | M1220: 75 | O1220: 14 | P1220: 15 | Q1220: 99 | S1220: BULLUSS :CARLAND
A1221: BEST PLAYERS
A1222: BOX HILL | C1222: REEVES | F1222: ZARAFA | I1222: O'BRIEN | L1222: LAWRIE | O1222: FRANCIS | R1222: S HOGAN
A1223: WILLIAMSTOWN | C1223: RICKMAN | F1223: ROUND | I1223: McTAGGART | L1223: JOHNSON | O1223: PASTORE
A1224: GOALKICKERS
A1225: BOX HILL | C1225: BOLTON 4 | F1225: S HOGAN 4 | I1225: ZARAFA 3 | K1225: O'BRIEN | M1225: NICHOLSON | P1225: BUTTIFANT | R1225: FRANCIS | U1225: DWYER | X1225: HOCKING
A1226: WILLIAMSTOWN | C1226: RICKMAN 8 | F1226: GHAZI 2 | H1226: DELRE | J1226: MINETT | L1226: MURPHY | N1226: PASTORE
A1228: 1ST SEMI | D1228: 10TH SEPTEMBER
A1229: WILLIAMSTOWN | C1229: 2 | D1229: 2 | E1229: 14 | G1229: 7 | H1229: 5 | I1229: 47 | K1229: 13 | L1229: 7 | M1229: 85 | O1229: 18 | P1229: 11 | Q1229: 119 | S1229: AT P.M.
A1230: SPRINGVALE | C1230: 2 | D1230: 4 | E1230: 16 | G1230: 3 | H1230: 7 | I1230: 25 | K1230: 5 | L1230: 10 | M1230: 40 | O1230: 6 | P1230: 11 | Q1230: 47 | S1230: CAMERON ;HOWLETT
A1231: BEST PLAYERS
A1232: WILLIAMSTOWN | C1232: PASTORE | F1232: KENNY | I1232: SWAN | L1232: AZIZ | O1232: MCTAGGART | R1232: CAHILL
A1233: SPRINGVALE | C1233: WARNER | F1233: FOY | I1233: MALONI | L1233: MAYLIN | O1233: MORGAN
A1234: GOALKICKERS
A1235: WILLIAMSTOWN | C1235: RICKMAN 5 | F1235: AZIZ 4 | H1235: DIMARTINO 2 | K1235: MINETT 2 | M1235: McTAGGART | P1235: GHAZI | R1235: MUSCHIALLI | X1235: DELRE | Z1235: PASTORE
A1236: SPRINGVALE | C1236: MORGAN | F1236: PHILLIPS | H1236: CLARK | J1236: DUDLEY | L1236: DEMPSTER | O1236: WARNER
A1238: 2ND SEMI | D1238: 9TH SEPTEMBER
A1239: COBURG | C1239: 2 | D1239: 3 | E1239: 15 | G1239: 4 | H1239: 7 | I1239: 31 | K1239: 6 | L1239: 13 | M1239: 49 | O1239: 13 | P1239: 16 | Q1239: 94 | S1239: VENUE: PORT MELBOURNE
A1240: BOX HILL | C1240: 2 | D1240: 2 | E1240: 14 | G1240: 2 | H1240: 3 | I1240: 15 | K1240: 6 | L1240: 7 | M1240: 43 | O1240: 7 | P1240: 10 | Q1240: 52 | S1240: CASTLE :SNEDDON
A1241: BEST PLAYERS
A1242: COBURG | C1242: NIMMO | F1242: WEIDEMAN | I1242: ANGWIN | L1242: BASSETT | O1242: GUMLEY | R1242: DOYLE
A1243: BOX HILL | C1243: O'BRIEN | F1243: REEVES | I1243: DWYER | L1243: BANFIELD | O1243: BROWN | R1243: NICHOLSON
A1244: GOALKICKERS
A1245: COBURG | C1245: INGRAM 4 | F1245: ALLISON 2 | I1245: DOYLE 2 | K1245: LANGAN 2 | M1245: REYNOLDSON | P1245: BASSETT | R1245: WEIDEMAN
A1246: BOX HILL | C1246: NICHOLSON 3 | F1246: FRANCIS | H1246: ZARAFA | J1246: REEVES | L1246: BROWN
A1248: PRELIMINARY | D1248: 16TH SEPTEMBER
A1249: WILLIAMSTOWN | C1249: 4 | D1249: 4 | E1249: 28 | G1249: 8 | H1249: 8 | I1249: 56 | K1249: 11 | L1249: 13 | M1249: 79 | O1249: 19 | P1249: 15 | Q1249: 129 | S1249: VENUE: PORT MELBOURNE
A1250: BOX HILL | C1250: 5 | D1250: 4 | E1250: 34 | G1250: 9 | H1250: 6 | I1250: 60 | K1250: 12 | L1250: 9 | M1250: 81 | O1250: 17 | P1250: 12 | Q1250: 114 | S1250: BULLUSS :HOWLETT
A1251: BEST PLAYERS
A1252: WILLIAMSTOWN | C1252: SWAN | F1252: AZIZ | I1252: CAHILL | L1252: HOWLETT | O1252: McTAGGART | R1252: ROUND
A1253: BOX HILL | C1253: JOHNS | F1253: DWYER | I1253: REEVES | L1253: HOGAN | O1253: NICHOLSON | R1253: HOCKING
A1254: GOALKICKERS
A1255: WILLIAMSTOWN | C1255: AZIZ 8 | E1255: RICKMAN 5 | H1255: DELRE 2 | J1255: GHAZI | L1255: HOWLETT | N1255: MINETT | P1255: CAHILL
A1256: BOX HILL | C1256: JOHNS 4 | E1256: ZARAFA 3 | H1256: REEVES 2 | J1256: HOGAN 2 | L1256: GLARE | N1256: NICHOLSON | Q1256: DWYER | S1256: FRANCIS | W1256: BUTTIFANT
A1258: GRAND | D1258: 23RD SEPTEMBER
A1259: COBURG | C1259: 3 | D1259: 2 | E1259: 20 | G1259: 5 | H1259: 6 | I1259: 36 | K1259: 8 | L1259: 10 | M1259: 58 | O1259: 10 | P1259: 13 | Q1259: 73 | S1259: AT WINDY HILL
A1260: WILLIAMSTOWN | C1260: 1 | D1260: 1 | E1260: 7 | G1260: 2 | H1260: 6 | I1260: 18 | K1260: 4 | L1260: 7 | M1260: 31 | O1260: 7 | P1260: 11 | Q1260: 53 | S1260: CAMERON :SAWERS
A1261: BEST PLAYERS
A1262: COBURG | C1262: BASSETT | F1262: NIMMO | I1262: RIENIETS | L1262: REYNOLDSON | O1262: ANGWIN | R1262: DOYLE
A1263: WILLIAMSTOWN | C1263: McTAGGART | F1263: MURPHY | I1263: GOULD | L1263: ROUND | O1263: SWAN | R1263: KENNY
A1264: GOALKICKERS
A1265: COBURG | C1265: REYNOLDSON 3 | F1265: ALLISON 2 | I1265: WEATHERALD | L1265: KAAKOUR | N1265: LANGAN | P1265: INGRAM | R1265: DOYLE
A1266: WILLIAMSTOWN | C1266: RICKMAN 3 | F1266: DIMARTINO | I1266: SMITH | K1266: GHAZI | M1266: AZIZ