A1: Victorian Football Association
A2: Season 1990
A3: © Copyright Wal Williams | F3: First created: 1 September 2016
A4: Contact: joywalwi at gmail dot com | F4: Last updated: 3 December 2016 | W4: VFA Results and tables - Link to the main index page
A5: You are free to copy this document in whole or part provided that proper acknowledgement is given to the author. All rights reserved.
W7: Note: B'WICK/B'MEAD = Brunswick-Broadmeadows
A8: 1990 | C8: 1ST DIVISION
A9: ROUND 1 | D9: 7TH APRIL | I9: WEATHER | S9: Venue: SPRINGVALE
D10: 1ST QTR | H10: 2ND QTR | L10: 3RD QTR | P10: FINAL | S10: UMPIRES
A11: SPRINGVALE | C11: 4 | D11: 4 | E11: 28 | G11: 12 | H11: 10 | I11: 82 | K11: 13 | L11: 11 | M11: 89 | O11: 19 | P11: 12 | Q11: 126 | S11: BULLUSS | X11: LADDER | AA11: ROUND | AC11: 1
A12: COBURG | C12: 3 | D12: 5 | E12: 23 | G12: 7 | H12: 9 | I12: 51 | K12: 13 | L12: 14 | M12: 92 | O12: 17 | P12: 20 | Q12: 122 | S12: VAN BEEK
A13: BEST PLAYERS | W13: TEAM | X13: W | Y13: L | Z13: D | AA13: FOR | AB13: AGST | AC13: % | AD13: PTS
A14: SPRINGVALE | C14: PROSSER | F14: KOOP | I14: ROBINSON | L14: C DWYER | O14: DEMPSTER
A15: COBURG | C15: LANGAN | F15: LISTON | I15: KAAKOUR | L15: YOUNG | O15: GUMLEY | W15: BOX HILL | X15: 1 | Y15: 0 | Z15: 0 | AA15: 210 | AB15: 60 | AC15: =(AA15/AB15)*100 -> 350 | AD15: =(X15*4)+(Z15*2) -> 4
A16: GOALKICKERS | P16: STEWART | W16: WERRIBEE | X16: 1 | Y16: 0 | Z16: 0 | AA16: 185 | AB16: 97 | AC16: =(AA16/AB16)*100 -> 190.7216494845361 | AD16: =(X16*4)+(Z16*2) -> 4
A17: SPRINGVALE | C17: PROSSER 6 | E17: ROBINSON 4 | H17: KEIPERT 2 | J17: MITHEN 2 | L17: NICOL | N17: SHANNON | P17: DWYER | R17: C DUDLEY | W17: DANDEN0NG | X17: 1 | Y17: 0 | Z17: 0 | AA17: 140 | AB17: 86 | AC17: =(AA17/AB17)*100 -> 162.7906976744186 | AD17: =(X17*4)+(Z17*2) -> 4
A18: COBURG | C18: KAAKOUR 3 | F18: WEATHERALD 2 | I18: LANGAN 2 | K18: ALLISON 2 | M18: WILLIAMS 2 | P18: ANGWIN 2 | R18: YOUNG 2 | W18: SANDRINGHAM | X18: 1 | Y18: 0 | Z18: 0 | AA18: 141 | AB18: 98 | AC18: =(AA18/AB18)*100 -> 143.87755102040816 | AD18: =(X18*4)+(Z18*2) -> 4
D19: 14TH APRIL | O19: GUMLEY | Q19: LISTON | S19: Venue: PORT MELBOURNE | W19: WILLIAMSTOWN | X19: 1 | Y19: 0 | Z19: 0 | AA19: 144 | AB19: 122 | AC19: =(AA19/AB19)*100 -> 118.0327868852459 | AD19: =(X19*4)+(Z19*2) -> 4
A20: WILLIAMSTOWN | C20: 5 | D20: 3 | E20: 33 | G20: 12 | H20: 8 | I20: 80 | K20: 17 | L20: 10 | M20: 112 | O20: 22 | P20: 12 | Q20: 144 | S20: LAWLOR
A21: PORT MELBOURNE | C21: 2 | D21: 2 | E21: 14 | G21: 5 | H21: 8 | I21: 38 | K21: 15 | L21: 9 | M21: 99 | O21: 18 | P21: 14 | Q21: 122 | S21: VAN BEEK | W21: FRANKSTON | X21: 1 | Y21: 0 | Z21: 0 | AA21: 99 | AB21: 90 | AC21: =(AA21/AB21)*100 -> 110 | AD21: =(X21*4)+(Z21*2) -> 4
A22: BEST PLAYERS | W22: SPRINGVALE | X22: 1 | Y22: 0 | Z22: 0 | AA22: 126 | AB22: 124 | AC22: =(AA22/AB22)*100 -> 101.61290322580645 | AD22: =(X22*4)+(Z22*2) -> 4
A23: WILLIAMSTOWN | C23: GOULD | F23: HOWLETT | I23: BURTON | L23: PASTORE | O23: McTAGGART | R23: CAHILL | W23: COBURG | X23: 0 | Y23: 1 | Z23: 0 | AA23: 124 | AB23: 126 | AC23: =(AA23/AB23)*100 -> 98.412698412698404 | AD23: =(X23*4)+(Z23*2) -> 0
A24: PORT MELBOURNE | C24: KENNEDY | F24: HARKINS | I24: YORGEY | L24: CONDON | O24: WALL | R24: CHADBAND | W24: PRAHRAN | X24: 0 | Y24: 1 | Z24: 0 | AA24: 90 | AB24: 99 | AC24: =(AA24/AB24)*100 -> 90.909090909090907 | AD24: =(X24*4)+(Z24*2) -> 0
A25: GOALKICKERS | W25: PORT MELBOURNE | X25: 0 | Y25: 1 | Z25: 0 | AA25: 122 | AB25: 144 | AC25: =(AA25/AB25)*100 -> 84.722222222222214 | AD25: =(X25*4)+(Z25*2) -> 0
A26: WILLIAMSTOWN | C26: MOURNEY 5 | F26: AZIZ 4 | H26: BURTON 4 | J26: SWAN 2 | L26: V DIMARTINO 2 | O26: MINETT 2 | Q26: GOULD 2 | S26: CAHILL | W26: B'WICK/B'MEAD | X26: 0 | Y26: 1 | Z26: 0 | AA26: 98 | AB26: 141 | AC26: =(AA26/AB26)*100 -> 69.503546099290787 | AD26: =(X26*4)+(Z26*2) -> 0
A27: PORT MELBOURNE | C27: CONDON 5 | E27: HARKINS 3 | H27: FOLEY 2 | J27: KENNEDY 2 | M27: BAILEY | O27: CHADBAND | Q27: FORD | S27: HETHERTON | W27: OAKLEIGH | X27: 0 | Y27: 1 | Z27: 0 | AA27: 86 | AB27: 140 | AC27: =(AA27/AB27)*100 -> 61.428571428571431 | AD27: =(X27*4)+(Z27*2) -> 0
D28: 15 TH APRIL | O28: McCORMACK | R28: PRITCHARD | W28: PRESTON | X28: 0 | Y28: 1 | Z28: 0 | AA28: 97 | AB28: 185 | AC28: =(AA28/AB28)*100 -> 52.432432432432428 | AD28: =(X28*4)+(Z28*2) -> 0
A29: DANDENONG | C29: 3 | D29: 5 | E29: 23 | G29: 8 | H29: 11 | I29: 59 | K29: 12 | L29: 17 | M29: 89 | O29: 20 | P29: 20 | Q29: 140 | S29: Venue: OAKLEIGH | W29: CAMBERWELL | X29: 0 | Y29: 1 | Z29: 0 | AA29: 60 | AB29: 210 | AC29: =(AA29/AB29)*100 -> 28.571428571428569 | AD29: =(X29*4)+(Z29*2) -> 0
A30: OAKLEIGH | C30: 2 | D30: 1 | E30: 13 | G30: 4 | H30: 3 | I30: 27 | K30: 9 | L30: 6 | M30: 60 | O30: 13 | P30: 8 | Q30: 86 | S30: CLEMENT :HALES
A31: BEST PLAYERS
A32: DANDENONG | C32: GREEN | F32: ZBORIL | I32: McCORMACK | L32: BRADDY | O32: WICKS | Q32: McKENZIE
A33: OAKLEIGH | C33: C MARSHALL | F33: McGANNON | I33: ATHERTON | L33: OLEKSYN | O33: DESSENT | Q33: DYSON
A34: GOALKICKERS
A35: DANDENONG | C35: MURRAY 6 | F35: BRADDY 4 | I35: READ 3 | K35: GILDER 2 | M35: KNIGHT 2 | O35: LACKO | Q35: THIELE | S35: ELSHAUG
A36: OAKLEIGH | C36: PRETTO 4 | F36: SUTHERLAND 2 | I36: MARSHALL | L36: ATHERTON | N36: CUNNINGHAM | Q36: DESSENT | S36: GRIGG | U36: QUIRK | W36: DYSON
A38: FRANKSTON | C38: 2 | D38: 6 | E38: 18 | G38: 7 | H38: 13 | I38: 55 | K38: 11 | L38: 17 | M38: 83 | O38: 13 | P38: 21 | Q38: 99 | S38: Venue: FRANKSTON
A39: PRAHRAN | C39: 3 | D39: 2 | E39: 20 | G39: 7 | H39: 8 | I39: 50 | K39: 8 | L39: 14 | M39: 62 | O39: 12 | P39: 18 | Q39: 90 | S39: NOLAN :HINTON
A40: BEST PLAYERS
A41: FRANKSTON | C41: AMOORE | F41: VANDERMEER | I41: S HAMILL | L41: SHARP | O41: STEVENSON
A42: PRAHRAN | C42: SHORTHOUSE | F42: R JOHNSON | I42: PAGE | L42: KILEY | O42: TAPPING | R42: MORRISSEY
A43: GOALKICKERS
A44: FRANKSTON | C44: AMOORE 4 | F44: PARKER 3 | I44: McCARTHY 2 | L44: GAHAN | N44: TYRELL | P44: SHARP | R44: BINGLEY
A45: PRAHRAN | C45: LANGAN 2 | F45: LYNCH 2 | H45: R JOHNSON 2 | K45: HENRY 2 | M45: PAGE 2 | O45: TAYLOR | Q45: SOULOS
A47: BOX HILL | C47: 8 | D47: 6 | E47: 54 | G47: 15 | H47: 10 | I47: 100 | K47: 22 | L47: 14 | M47: 146 | O47: 32 | P47: 18 | Q47: 210 | S47: Venue: CAMBERWELL
A48: CAMBERWELL | C48: 2 | D48: 3 | E48: 15 | G48: 4 | H48: 7 | I48: 31 | K48: 6 | L48: 11 | M48: 47 | O48: 8 | P48: 12 | Q48: 60 | S48: GREEN :TURNHAM
A49: BEST PLAYERS
A50: BOX HILL | C50: LISLE | F50: ESPENSCHIED | I50: BOX | L50: DIXON | O50: NICHOLSON
A51: CAMBERWELL | C51: R VITACCA | F51: WYNN | I51: VERESHAKA | L51: DIPIERDOMENICO | O51: T VITACCA
A52: GOALKICKERS
A53: BOX HILL | C53: LISLE 6 | E53: HOGAN 5 | G53: ESPENSCHIED 5 | J53: NICOLSON 4 | M53: A HAMILTON 3 | P53: P BOLTON 2 | R53: BOX 2 | T53: ZARAFA 2 | W53: PENNY | X53: O'BRIEN | AA53: MORLEY
A54: CAMBERWELL | C54: HOLLOWAY 2 | F54: TUCKER | H54: WILKINSON | J54: PANZA | L54: MODICA | N54: GREIG | P54: DIPIERDOMENICO
A56: WERRIBEE | C56: 8 | D56: 1 | E56: 49 | G56: 18 | H56: 4 | I56: 112 | K56: 23 | L56: 7 | M56: 145 | O56: 29 | P56: 11 | Q56: 185 | S56: Venue: WERRIBEE
A57: PRESTON | C57: 5 | D57: 2 | E57: 32 | G57: 7 | H57: 5 | I57: 47 | K57: 11 | L57: 7 | M57: 73 | O57: 14 | P57: 13 | Q57: 97 | S57: SAVILLE :McKERNAN
A58: BEST PLAYERS
A59: WERRIBEE | C59: ALLDAY | F59: GEARY | I59: CHAPMAN | L59: McMASTER | O59: DOMBERG | R59: PANNELL
A60: PRESTON | C60: LUMICISI | F60: SALVADORE | I60: PRIDEAUX
A61: GOALKICKERS
A62: WERRIBEE | C62: GEARY 8 | E62: BUTTON 7 | H62: PANNELL 4 | J62: RAEBURN 4 | M62: SELLS 3 | O62: SIZER | Q62: HARRIS | S62: STOCKWELL
A63: PRESTON | C63: SHAW 5 | F63: LUMICISI 3 | I63: SALVADORE 2 | L63: NICOLAOU 2 | O63: PERCY | Q63: PLOWMAN
A65: SANDRINGHAM | C65: 3 | D65: 2 | E65: 20 | G65: 6 | H65: 7 | I65: 43 | K65: 15 | L65: 10 | M65: 100 | O65: 21 | P65: 15 | Q65: 141 | S65: Venue: BRUNSWICK
A66: B'WICK/B'MEAD | C66: 5 | D66: 2 | E66: 32 | G66: 8 | H66: 8 | I66: 56 | K66: 10 | L66: 10 | M66: 70 | O66: 14 | P66: 14 | Q66: 98 | S66: MORROW :KHAN
A67: BEST PLAYERS
A68: SANDRINGHAM | C68: J RUGOLO | F68: FOLEY | I68: MACKENZIE | L68: FISCHER | O68: PRATT | R68: SCHLEIGER
A69: B'WICK/B'MEAD | C69: CALLANDER | F69: BERTOLLO | I69: THOROGOOD | L69: BEALE | O69: HOTCHKIN
A70: GOALKICKERS
A71: SANDRINGHAM | C71: HOWARD 4 | F71: FOLEY 4 | H71: HIBBERT 3 | J71: M FISCHER 3 | M71: PETERS 2 | O71: EAVES 2 | Q71: DALRYMPLE | T71: MACKENZIE | X71: FITZGERALD
A72: B'WICK/B'MEAD | C72: GRIFFITHS 4 | F72: BEALE 2 | H72: BARWARD | J72: BERTOLLO | M72: BONE | N72: CALLANDER | Q72: CLARK | S72: DAVIS | U72: EAMES | W72: DIEULLO
A74: ROUND 2 | D74: 21ST APRIL | I74: WEATHER | S74: Venue: COBURG
D75: 1ST QTR | H75: 2ND QTR | L75: 3RD QTR | P75: FINAL | S75: UMPIRES
A76: COBURG | C76: 8 | D76: 4 | E76: 52 | G76: 14 | H76: 7 | I76: 91 | K76: 19 | L76: 14 | M76: 128 | O76: 23 | P76: 20 | Q76: 158 | S76: SAVILLE | X76: LADDER | AA76: ROUND | AC76: 2
A77: B'WICK/B'MEAD | C77: 2 | D77: 4 | E77: 16 | G77: 7 | H77: 7 | I77: 49 | K77: 7 | L77: 10 | M77: 52 | O77: 8 | P77: 17 | Q77: 65 | S77: McKENZIE
A78: BEST PLAYERS | W78: TEAM | X78: W | Y78: L | Z78: D | AA78: FOR | AB78: AGST | AC78: % | AD78: PTS
A79: COBURG | C79: KAAKOUR | F79: WILLIAMS | I79: WEATHERALD | L79: INGRAM | O79: LANGAN | R79: YOUNG
A80: B'WICK/B'MEAD | C80: BERTOLLO | F80: EAMES | I80: HOTCHKIN | W80: DANDEN0NG | X80: 2 | Y80: 0 | Z80: 0 | AA80: 254 | AB80: 165 | AC80: =(AA80/AB80)*100 -> 153.93939393939394 | AD80: =(X80*4)+(Z80*2) -> 8
A81: GOALKICKERS | P81: REYNOLDSON | S81: RACOVOLIS | W81: WILLIAMSTOWN | X81: 2 | Y81: 0 | Z81: 0 | AA81: 297 | AB81: 211 | AC81: =(AA81/AB81)*100 -> 140.75829383886256 | AD81: =(X81*4)+(Z81*2) -> 8
A82: COBURG | C82: WEATHERALD 7 | F82: KAAKOUR 4 | I82: WILLIAMS 4 | L82: YOUNG 2 | N82: LANGAN | P82: ALLISON | R82: DARBY | T82: BARNES | W82: SANDRINGHAM | X82: 2 | Y82: 0 | Z82: 0 | AA82: 289 | AB82: 211 | AC82: =(AA82/AB82)*100 -> 136.96682464454977 | AD82: =(X82*4)+(Z82*2) -> 8
A83: B'WICK/B'MEAD | C83: GRIFFITHS 2 | F83: BERTOLLO 2 | I83: POTTER 2 | K83: BONE | M83: WRIGHT | W83: BOX HILL | X83: 1 | Y83: 1 | Z83: 0 | AA83: 354 | AB83: 218 | AC83: =(AA83/AB83)*100 -> 162.38532110091742 | AD83: =(X83*4)+(Z83*2) -> 4
D84: 22ND APRIL | S84: Venue: WILLIAMSTOWN | W84: COBURG | X84: 1 | Y84: 1 | Z84: 0 | AA84: 282 | AB84: 191 | AC84: =(AA84/AB84)*100 -> 147.64397905759162 | AD84: =(X84*4)+(Z84*2) -> 4
A85: WILLIAMSTOWN | C85: 7 | D85: 7 | E85: 49 | G85: 10 | H85: 10 | I85: 70 | K85: 19 | L85: 14 | M85: 128 | O85: 23 | P85: 15 | Q85: 153 | S85: SNEDDON
A86: SPRINGVALE | C86: 3 | D86: 2 | E86: 20 | G86: 8 | H86: 5 | I86: 53 | K86: 9 | L86: 5 | M86: 59 | O86: 14 | P86: 5 | Q86: 89 | S86: KENNEDY | W86: WERRIBEE | X86: 1 | Y86: 1 | Z86: 0 | AA86: 264 | AB86: 211 | AC86: =(AA86/AB86)*100 -> 125.11848341232228 | AD86: =(X86*4)+(Z86*2) -> 4
A87: BEST PLAYERS | W87: PRESTON | X87: 1 | Y87: 1 | Z87: 0 | AA87: 295 | AB87: 261 | AC87: =(AA87/AB87)*100 -> 113.02681992337165 | AD87: =(X87*4)+(Z87*2) -> 4
A88: WILLIAMSTOWN | C88: CAHILL | F88: ROUND | I88: GOULD | L88: MOURNEY | O88: PASTORE | R88: OWEN | W88: PORT MELBOURNE | X88: 1 | Y88: 1 | Z88: 0 | AA88: 280 | AB88: 288 | AC88: =(AA88/AB88)*100 -> 97.222222222222214 | AD88: =(X88*4)+(Z88*2) -> 4
A89: SPRINGVALE | C89: DEMPSTER | F89: MENDE | I89: MORGAN | L89: KOOP | O89: STEWART | W89: PRAHRAN | X89: 1 | Y89: 1 | Z89: 0 | AA89: 208 | AB89: 214 | AC89: =(AA89/AB89)*100 -> 97.196261682242991 | AD89: =(X89*4)+(Z89*2) -> 4
A90: GOALKICKERS | L90: SWAN | N90: MINETT | P90: CAHILL | R90: PASTORE | W90: FRANKSTON | X90: 1 | Y90: 1 | Z90: 0 | AA90: 212 | AB90: 238 | AC90: =(AA90/AB90)*100 -> 89.075630252100851 | AD90: =(X90*4)+(Z90*2) -> 4
A91: WILLIAMSTOWN | C91: MOURNEY 4 | F91: BURTON 4 | I91: AZIZ 3 | K91: GOULD 2 | M91: McDONALD 2 | P91: ROUND 2 | R91: BROOKES 2 | W91: SPRINGVALE | X91: 1 | Y91: 1 | Z91: 0 | AA91: 215 | AB91: 277 | AC91: =(AA91/AB91)*100 -> 77.617328519855604 | AD91: =(X91*4)+(Z91*2) -> 4
A92: SPRINGVALE | C92: PROSSER 2 | F92: ROBINSON 2 | I92: KEIPERT 2 | K92: KOOP 2 | M92: CLARKE 2 | O92: NICOL | Q92: DUDLEY | S92: MORGAN | W92: OAKLEIGH | X92: 0 | Y92: 2 | Z92: 0 | AA92: 201 | AB92: 258 | AC92: =(AA92/AB92)*100 -> 77.906976744186053 | AD92: =(X92*4)+(Z92*2) -> 0
R93: DWYER | W93: B'WICK/B'MEAD | X93: 0 | Y93: 2 | Z93: 0 | AA93: 163 | AB93: 299 | AC93: =(AA93/AB93)*100 -> 54.515050167224075 | AD93: =(X93*4)+(Z93*2) -> 0
A94: PORT MELBOURNE | C94: 6 | D94: 0 | E94: 36 | G94: 12 | H94: 3 | I94: 75 | K94: 19 | L94: 6 | M94: 120 | O94: 25 | P94: 8 | Q94: 158 | S94: Venue: BOX HILL | W94: CAMBERWELL | X94: 0 | Y94: 2 | Z94: 0 | AA94: 136 | AB94: 408 | AC94: =(AA94/AB94)*100 -> 33.333333333333329 | AD94: =(X94*4)+(Z94*2) -> 0
A95: BOX HILL | C95: 4 | D95: 4 | E95: 28 | G95: 9 | H95: 7 | I95: 61 | K95: 14 | L95: 10 | M95: 94 | O95: 22 | P95: 12 | Q95: 144 | S95: MORROW :FORSTER
A96: BEST PLAYERS
A97: PORT MELBOURNE | C97: HARKINS | F97: WALL | I97: KENNEDY | L97: HICKS | O97: HETHERTON | R97: McCORMACK
A98: BOX HILL | C98: HOCKING | F98: REEVES | I98: BANFIELD | L98: BROWN | O98: ZARAFA
A99: GOALKICKERS | N99: PRITCHARD | Q99: TEMAY | S99: LOVE
A100: PORT MELBOURNE | C100: HICKS 7 | E100: HARKINS 4 | H100: CONDON 3 | J100: FOLEY 3 | L100: HETHERTON 2 | O100: McCORMACK 2 | R100: CHADBAND
A101: BOX HILL | C101: REEVES 6 | F101: LISLE 3 | H101: ZARAFA 3 | J101: HOCKING 3 | M101: A HAMILTON 2 | P101: DELL 2 | R101: DIXON 2 | U101: PENNY
A103: PRAHRAN | C103: 1 | D103: 3 | E103: 9 | G103: 10 | H103: 7 | I103: 67 | K103: 12 | L103: 11 | M103: 83 | O103: 17 | P103: 16 | Q103: 118 | S103: Venue: TOORAK PARK
A104: OAKLEIGH | C104: 3 | D104: 6 | E104: 24 | G104: 10 | H104: 7 | I104: 67 | K104: 14 | L104: 11 | M104: 95 | O104: 17 | P104: 13 | Q104: 115 | S104: TURNHAM :BULLUSS
A105: BEST PLAYERS
A106: PRAHRAN | C106: MARKS | F106: SHORTHOUSE | I106: TAYLOR | L106: R JOHNSON | O106: EVANS | R106: HENRY
A107: OAKLEIGH | C107: WELSFORD | F107: MELLODY | I107: PRETTO | L107: DYSON | O107: B MARSHALL | R107: GLENN
A108: GOALKICKERS
A109: PRAHRAN | C109: LANGAN 3 | E109: SOULOS 3 | G109: PAGE 2 | I109: TAYLOR 2 | K109: ATKINS 2 | M109: RYAN 2 | O109: HENRY | Q109: R JOHNSON | T109: EVANS
A110: OAKLEIGH | C110: PRETTO 7 | E110: GRIGG 3 | G110: WELSFORD 3 | J110: MARSHALL | M110: QUIRK | O110: MELLODY | Q110: OWEN
A112: DANDENONG | C112: 3 | D112: 1 | E112: 19 | G112: 8 | H112: 5 | I112: 53 | K112: 12 | L112: 10 | M112: 82 | O112: 17 | P112: 12 | Q112: 114 | S112: Venue: DANDENONG
A113: WERRIBEE | C113: 1 | D113: 3 | E113: 9 | G113: 4 | H113: 7 | I113: 31 | K113: 9 | L113: 8 | M113: 62 | O113: 11 | P113: 13 | Q113: 79 | S113: ALSOP :NOLAN
A114: BEST PLAYERS
A115: DANDENONG | C115: BRADDY | F115: READ | I115: J MARSHALL | L115: McKENZIE | O115: GREEN | Q115: ATKINSON
A116: WERRIBEE | C116: ALLDAY | F116: CHAPMAN | I116: SIZER | L116: DOMBERG | O116: WALSH
A117: GOALKICKERS
A118: DANDENONG | C118: READ 4 | E118: MCKENZIE 4 | H118: MEAD 3 | J118: LACKO 2 | L118: R MARSHALL 2 | O118: BRADDY | Q118: MILLANE
A119: WERRIBEE | C119: SELLS 5 | E119: BUTTON 2 | H119: SIZER | J119: RAEBURN | M119: ALLDAY | O119: WHYTE
A121: SANDRINGHAM | C121: 3 | D121: 6 | E121: 24 | G121: 10 | H121: 9 | I121: 69 | K121: 14 | L121: 14 | M121: 98 | O121: 21 | P121: 22 | Q121: 148 | S121: Venue: BEACH ROAD
A122: FRANKSTON | C122: 5 | D122: 6 | E122: 36 | G122: 10 | H122: 7 | I122: 67 | K122: 14 | L122: 10 | M122: 93 | O122: 17 | P122: 11 | Q122: 113 | S122: GRREN :HARVEY
A123: BEST PLAYERS
A124: SANDRINGHAM | C124: MCGANNON | F124: J RUGOLO | I124: FOLEY | L124: HIBBERT | O124: EAVES | Q124: PETERS
A125: FRANKSTON | C125: VANDERMEER | F125: HAMILL | I125: BINGLEY | L125: AMOORE | O125: GAHAN
A126: GOALKICKERS
A127: SANDRINGHAM | C127: F RUGOLO 8 | F127: HIBBERT 3 | I127: EAVES 3 | K127: BERGMAN 3 | N127: FOLEY | P127: M FISCHER | S127: J RUGOLO | V127: ALLEN
A128: FRANKSTON | C128: BINGLEY 5 | F128: BEEL 3 | H128: SPENCER 3 | J128: AMOORE 2 | M128: GAHAN | O128: STEVENSON | R128: BRENNAN | U128: VANDERMEER
A130: PRESTON | C130: 3 | D130: 6 | E130: 24 | G130: 10 | H130: 9 | I130: 69 | K130: 21 | L130: 14 | M130: 140 | O130: 30 | P130: 18 | Q130: 198 | S130: AT PTON
A131: CAMBERWELL | C131: 3 | D131: 4 | E131: 22 | G131: 6 | H131: 6 | I131: 42 | K131: 9 | L131: 8 | M131: 62 | O131: 11 | P131: 10 | Q131: 76 | S131: HALES :CLEMENT
A132: BEST PLAYERS
A133: PRESTON | C133: HUNT | F133: M LAWSON | I133: LUMICISI | L133: SENNO | O133: SHAW | Q133: PRITCHARD
A134: CAMBERWELL | C134: R VITACCA | F134: WYNN | I134: WILKINSON | L134: HOLLOWAY
A135: GOALKICKERS
A136: PRESTON | C136: SHAW 10 | E136: SENNO 6 | G136: NICOLAOU 5 | J136: LUMICSI 2 | M136: MAZOCCA 2 | P136: VALKANIS 2 | S136: M LAWSON 2 | V136: PLOWMAN
A137: CAMBERWELL | C137: WYNN 3 | E137: HOLLOWAY 2 | H137: N MITCHELL 2 | K137: WILKINSON | M137: T VITACCA | P137: R VITACCA | R137: BUDGE
A139: ROUND 3 | D139: 28TH APRIL | I139: WEATHER | S139: Venue: WILLIAMSTOWN
D140: 1ST QTR | H140: 2ND QTR | L140: 3RD QTR | P140: FINAL | S140: UMPIRES
A141: COBURG | C141: 5 | D141: 3 | E141: 33 | G141: 9 | H141: 6 | I141: 60 | K141: 13 | L141: 11 | M141: 89 | O141: 13 | P141: 14 | Q141: 92 | S141: BULLUSS | X141: LADDER | AA141: ROUND | AC141: 3
A142: WILLIAMSTOWN | C142: 1 | D142: 1 | E142: 7 | G142: 5 | H142: 3 | I142: 33 | K142: 6 | L142: 7 | M142: 43 | O142: 11 | P142: 11 | Q142: 77 | S142: FORSTER
A143: BEST PLAYERS | W143: TEAM | X143: W | Y143: L | Z143: D | AA143: FOR | AB143: AGST | AC143: % | AD143: PTS
A144: COBURG | C144: ANGWIN | F144: RACOVOLIS | I144: TARANTO | L144: EVANS | O144: LISTON
A145: WILLIAMSTOWN | C145: HOWLETT | F145: MURPHY | I145: LLOYD | L145: MCTAGGART | O145: MITCHELL | R145: ROUND | W145: DANDEN0NG | X145: 3 | Y145: 0 | Z145: 0 | AA145: 353 | AB145: 197 | AC145: =(AA145/AB145)*100 -> 179.18781725888323 | AD145: =(X145*4)+(Z145*2) -> 12
A146: GOALKICKERS | W146: SANDRINGHAM | X146: 3 | Y146: 0 | Z146: 0 | AA146: 421 | AB146: 313 | AC146: =(AA146/AB146)*100 -> 134.50479233226838 | AD146: =(X146*4)+(Z146*2) -> 12
A147: COBURG | C147: WEATHERALD 4 | F147: DARBY 3 | H147: RACOVOLIS 3 | K147: ALLISON | M147: YOUNG | O147: WILLIAMS | W147: WERRIBEE | X147: 2 | Y147: 1 | Z147: 0 | AA147: 407 | AB147: 291 | AC147: =(AA147/AB147)*100 -> 139.86254295532646 | AD147: =(X147*4)+(Z147*2) -> 8
A148: WILLIAMSTOWN | C148: AZIZ 2 | E148: CAHILL 2 | G148: MCGOWAN 2 | J148: BURTON | L148: GOULD | N148: PASTORE | P148: HOWLETT | R148: SMITH | W148: COBURG | X148: 2 | Y148: 1 | Z148: 0 | AA148: 374 | AB148: 268 | AC148: =(AA148/AB148)*100 -> 139.55223880597015 | AD148: =(X148*4)+(Z148*2) -> 8
D149: 29TH APRIL | I149: WEATHER | S149: Venue: SPRINGVALE | W149: WILLIAMSTOWN | X149: 2 | Y149: 1 | Z149: 0 | AA149: 374 | AB149: 303 | AC149: =(AA149/AB149)*100 -> 123.43234323432344 | AD149: =(X149*4)+(Z149*2) -> 8
A150: SPRINGVALE | C150: 2 | D150: 7 | E150: 19 | G150: 5 | H150: 11 | I150: 41 | K150: 7 | L150: 13 | M150: 55 | O150: 12 | P150: 18 | Q150: 90 | S150: LAWLER
A151: BOX HILL | C151: 6 | D151: 6 | E151: 42 | G151: 7 | H151: 8 | I151: 50 | K151: 10 | L151: 12 | M151: 72 | O151: 11 | P151: 13 | Q151: 79 | S151: SAVILLE | W151: PORT MELBOURNE | X151: 2 | Y151: 1 | Z151: 0 | AA151: 392 | AB151: 392 | AC151: =(AA151/AB151)*100 -> 100 | AD151: =(X151*4)+(Z151*2) -> 8
A152: BEST PLAYERS | W152: SPRINGVALE | X152: 2 | Y152: 1 | Z152: 0 | AA152: 305 | AB152: 356 | AC152: =(AA152/AB152)*100 -> 85.674157303370791 | AD152: =(X152*4)+(Z152*2) -> 8
A153: SPRINGVALE | C153: CLARK | F153: NICOL | I153: STEWART | L153: KOOP | O153: MORGAN | W153: BOX HILL | X153: 1 | Y153: 2 | Z153: 0 | AA153: 433 | AB153: 308 | AC153: =(AA153/AB153)*100 -> 140.58441558441558 | AD153: =(X153*4)+(Z153*2) -> 4
A154: BOX HILL | C154: DELL | F154: GLEESON | I154: BROWN | L154: BOX | O154: O'BRIEN | W154: PRESTON | X154: 1 | Y154: 2 | Z154: 0 | AA154: 399 | AB154: 373 | AC154: =(AA154/AB154)*100 -> 106.97050938337802 | AD154: =(X154*4)+(Z154*2) -> 4
A155: GOALKICKERS | W155: PRAHRAN | X155: 1 | Y155: 2 | Z155: 0 | AA155: 288 | AB155: 357 | AC155: =(AA155/AB155)*100 -> 80.672268907563023 | AD155: =(X155*4)+(Z155*2) -> 4
A156: SPRINGVALE | C156: ROBINSON 5 | F156: PROSSER 2 | I156: ATKINS 2 | K156: NICOL | M156: KOOP | O156: P MALONI | W156: B'WICK/B'MEAD | X156: 1 | Y156: 2 | Z156: 0 | AA156: 312 | AB156: 388 | AC156: =(AA156/AB156)*100 -> 80.412371134020617 | AD156: =(X156*4)+(Z156*2) -> 4
A157: BOX HILL | C157: LISLE 2 | E157: HOGAN 2 | G157: BOX 2 | I157: DELL 2 | K157: BROWN 2 | M157: DWYER | W157: FRANKSTON | X157: 1 | Y157: 2 | Z157: 0 | AA157: 301 | AB157: 387 | AC157: =(AA157/AB157)*100 -> 77.777777777777786 | AD157: =(X157*4)+(Z157*2) -> 4
S158: Venue: PORT MELBOURNE | W158: OAKLEIGH | X158: 0 | Y158: 3 | Z158: 0 | AA158: 303 | AB158: 390 | AC158: =(AA158/AB158)*100 -> 77.692307692307693 | AD158: =(X158*4)+(Z158*2) -> 0
A159: PORT MELBOURNE | C159: 2 | D159: 4 | E159: 16 | G159: 6 | H159: 11 | I159: 47 | K159: 10 | L159: 13 | M159: 73 | O159: 16 | P159: 16 | Q159: 112 | S159: NOLAN | W159: CAMBERWELL | X159: 0 | Y159: 3 | Z159: 0 | AA159: 168 | AB159: 507 | AC159: =(AA159/AB159)*100 -> 33.136094674556219 | AD159: =(X159*4)+(Z159*2) -> 0
A160: PRESTON | C160: 5 | D160: 5 | E160: 35 | G160: 7 | H160: 10 | I160: 52 | K160: 14 | L160: 14 | M160: 98 | O160: 14 | P160: 20 | Q160: 104 | S160: SNEDDON
A161: BEST PLAYERS
A162: PORT MELBOURNE | C162: ERWIN | F162: BAILEY | I162: LOVE | L162: CHADBAND | O162: PRITCHARD | R162: HICKS
A163: PRESTON | C163: LUMICISI | F163: HUNT | I163: OWEN | L163: PRIDEAUX | O163: LAWSON
A164: GOALKICKERS
A165: PORT MELBOURNE | C165: LOVE 5 | F165: CONDON 4 | I165: BAILEY 4 | K165: HICKS 2 | M165: ERWIN
A166: PRESTON | C166: SHAW 4 | F166: SALVADORE 3 | I166: NICOLAOU 2 | L166: SENNO 2 | N166: LUMICISI | P166: JORDAN | R166: C LAWSON
A168: WERRIBEE | C168: 2 | D168: 5 | E168: 17 | G168: 7 | H168: 11 | I168: 53 | K168: 13 | L168: 13 | M168: 91 | O168: 21 | P168: 17 | Q168: 143 | S168: Venue: WERRIBEE
A169: PRAHRAN | C169: 0 | D169: 4 | E169: 4 | G169: 1 | H169: 4 | I169: 10 | K169: 7 | L169: 7 | M169: 49 | O169: 12 | P169: 8 | Q169: 80 | S169: MORROW :GREEN
A170: BEST PLAYERS
A171: WERRIBEE | C171: McMASTER | F171: CHAPMAN | I171: RAEBURN | L171: SIZER | O171: HARRIS | R171: STOCKWELL
A172: PRAHRAN | C172: JOHNSON | F172: MORRISSEY | I172: KILEY | L172: TAYLOR | O172: WALFORD
A173: GOALKICKERS
A174: WERRIBEE | C174: GEARY 4 | E174: KNIGHT 4 | G174: SELLS 3 | I174: HARRIS 3 | K174: BUTTON 2 | M174: RAEBURN 2 | P174: PANNELL | R174: RADCLIFFE | U174: STOCKWELL
A175: PRAHRAN | C175: TAYLOR 4 | E175: R JOHNSON 2 | H175: LYNCH | J175: PAGE | L175: ATKINS | N175: EVANS | P175: RYAN | R175: KNIGHTS
A177: SANDRINGHAM | C177: 8 | D177: 8 | E177: 56 | G177: 9 | H177: 9 | I177: 63 | K177: 16 | L177: 9 | M177: 105 | O177: 20 | P177: 12 | Q177: 132 | S177: Venue: OAKLEIGH
A178: OAKLEIGH | C178: 2 | D178: 1 | E178: 13 | G178: 8 | H178: 8 | I178: 56 | K178: 10 | L178: 10 | M178: 70 | O178: 15 | P178: 12 | Q178: 102 | S178: HINTON-RAY :HOLT
A179: BEST PLAYERS
A180: SANDRINGHAM | C180: MACKENZIE | F180: F RUGOLO | I180: McGANNON | L180: PRATT | O180: DALRYMPLE | R180: EAVES
A181: OAKLEIGH | C181: WELSFORD | F181: DYSON | I181: DESSENT | L181: MEELODY | O181: JAMES | R181: QUIRK
A182: GOALKICKERS
A183: SANDRINGHAM | C183: F RUGOLO 10 | F183: M FISCHER 2 | I183: PETERS 2 | K183: FOLEY | M183: DALRYMPLE | P183: MACKENZIE | S183: FITZGERALD | W183: HALPHEN | X183: PRATT
A184: OAKLEIGH | C184: WELSFORD 5 | F184: PRETTO 4 | I184: MELLODY 2 | L184: DESSENT | N184: GRIGG | P184: DYSON | R184: HAWKER
A186: B'WICK/B'MEAD | C186: 6 | D186: 2 | E186: 38 | G186: 11 | H186: 5 | I186: 71 | K186: 17 | L186: 12 | M186: 114 | O186: 22 | P186: 17 | Q186: 149 | S186: Venue: FRANKSTON
A187: FRANKSTON | C187: 4 | D187: 4 | E187: 28 | G187: 7 | H187: 6 | I187: 48 | K187: 10 | L187: 10 | M187: 70 | O187: 12 | P187: 17 | Q187: 89 | S187: PRINCE :TURNHAM
A188: BEST PLAYERS
A189: B'WICK/B'MEAD | C189: TEAM EFFORT
A190: FRANKSTON | C190: VANDERMEER | F190: GAMBLE | I190: DENEREAZ | L190: SPENCER | O190: T HAMILL
A191: GOALKICKERS
A192: B'WICK/B'MEAD | C192: WRIGHT 7 | F192: BONE 4 | H192: CALLANDER 3 | K192: POTTER 2 | M192: GRIFFITHS | O192: EAMES | Q192: LUMSDEN | S192: SEMAAN | V192: DUGGAN | X192: SALVADORE
A193: FRANKSTON | C193: GAHAN 2 | E193: TYRELL 2 | G193: BINGLEY 2 | I193: GAMBLE 2 | L193: AMOORE | N193: PARKER | P193: VANDERMEER | S193: S HAMILL
A195: DANDENONG | C195: 3 | D195: 4 | E195: 22 | G195: 5 | H195: 6 | I195: 36 | K195: 8 | L195: 11 | M195: 59 | O195: 14 | P195: 15 | Q195: 99 | S195: Venue: CAMBERWELL
A196: CAMBERWELL | C196: 2 | D196: 3 | E196: 15 | G196: 3 | H196: 6 | I196: 24 | K196: 4 | L196: 7 | M196: 31 | O196: 4 | P196: 8 | Q196: 32 | S196: KEATING :McKERNAN
A197: BEST PLAYERS
A198: DANDENONG | C198: GREEN | F198: ELSHAUG | I198: LACKO | L198: ATKINSON | O198: WICKS | Q198: READ
A199: CAMBERWELL | C199: WILKINSON | F199: T VITACCA | I199: R VITACCA | L199: VERESHAKA | O199: SETON | Q199: N MITCHELL
A200: GOALKICKERS
A201: DANDENONG | C201: READ 3 | E201: McKENZIE 3 | H201: MURRAY 2 | J201: KNIGHT 2 | L201: ELSHAUG 2 | O201: WICKS | Q201: ZBORIL
A202: CAMBERWELL | C202: SETON 2 | F202: McKENZIE | I202: TRIBE
A205: ROUND 4 | D205: 5TH MAY | I205: WEATHER | S205: Venue: BEACH ROAD
D206: 1ST QTR | H206: 2ND QTR | L206: 3RD QTR | P206: FINAL | S206: UMPIRES
A207: SANDRINGHAM | C207: 7 | D207: 6 | E207: 48 | G207: 10 | H207: 8 | I207: 68 | K207: 12 | L207: 11 | M207: 83 | O207: 18 | P207: 11 | Q207: 119 | S207: SNEDDON | X207: LADDER | AA207: ROUND | AC207: 4
A208: WERRIBEE | C208: 3 | D208: 4 | E208: 22 | G208: 9 | H208: 8 | I208: 62 | K208: 11 | L208: 11 | M208: 77 | O208: 15 | P208: 16 | Q208: 106 | S208: VINEY
A209: BEST PLAYERS | W209: TEAM | X209: W | Y209: L | Z209: D | AA209: FOR | AB209: AGST | AC209: % | AD209: PTS
A210: SANDRINGHAM | C210: PRATT | F210: McGANNON | I210: J RUGOLO | L210: F RUGOLO | O210: MACKENZIE | R210: CRAMERI
A211: WERRIBEE | C211: WILSON | F211: SIZER | I211: ALLDAY | L211: RAEBURN | O211: FENTON | R211: SPIERINGS | W211: DANDEN0NG | X211: 4 | Y211: 0 | Z211: 0 | AA211: 490 | AB211: 301 | AC211: =(AA211/AB211)*100 -> 162.7906976744186 | AD211: =(X211*4)+(Z211*2) -> 16
A212: GOALKICKERS | W212: SANDRINGHAM | X212: 4 | Y212: 0 | Z212: 0 | AA212: 540 | AB212: 419 | AC212: =(AA212/AB212)*100 -> 128.87828162291169 | AD212: =(X212*4)+(Z212*2) -> 16
A213: SANDRINGHAM | C213: F RUGOLO 8 | F213: HIBBERT 3 | I213: FITZGERALD 3 | L213: M FISCHER | O213: EAVES | Q213: PRATT | S213: CUMMINGS | W213: COBURG | X213: 3 | Y213: 1 | Z213: 0 | AA213: 501 | AB213: 337 | AC213: =(AA213/AB213)*100 -> 148.66468842729969 | AD213: =(X213*4)+(Z213*2) -> 12
A214: WERRIBEE | C214: SELLS 5 | F214: GEARY 3 | H214: FENTON 2 | J214: PANNELL | L214: RAEBURN | N214: WHYTE | P214: CHAPMAN | R214: WILSON | W214: WILLIAMSTOWN | X214: 3 | Y214: 1 | Z214: 0 | AA214: 525 | AB214: 393 | AC214: =(AA214/AB214)*100 -> 133.58778625954199 | AD214: =(X214*4)+(Z214*2) -> 12
D215: 6TH MAY | S215: Venue: PRESTON | W215: SPRINGVALE | X215: 3 | Y215: 1 | Z215: 0 | AA215: 443 | AB215: 493 | AC215: =(AA215/AB215)*100 -> 89.858012170385393 | AD215: =(X215*4)+(Z215*2) -> 12
A216: SPRINGVALE | C216: 5 | D216: 3 | E216: 33 | G216: 12 | H216: 7 | I216: 79 | K216: 16 | L216: 12 | M216: 108 | O216: 20 | P216: 18 | Q216: 138 | S216: MORROW
A217: PRESTON | C217: 10 | D217: 3 | E217: 63 | G217: 10 | H217: 5 | I217: 65 | K217: 14 | L217: 9 | M217: 93 | O217: 21 | P217: 11 | Q217: 137 | S217: HOLT | W217: WERRIBEE | X217: 2 | Y217: 2 | Z217: 0 | AA217: 513 | AB217: 410 | AC217: =(AA217/AB217)*100 -> 125.1219512195122 | AD217: =(X217*4)+(Z217*2) -> 8
A218: BEST PLAYERS | W218: B'WICK/B'MEAD | X218: 2 | Y218: 2 | Z218: 0 | AA218: 474 | AB218: 455 | AC218: =(AA218/AB218)*100 -> 104.17582417582419 | AD218: =(X218*4)+(Z218*2) -> 8
A219: SPRINGVALE | C219: MALONI | F219: DUDLEY | I219: S CLARK | L219: NICOL | O219: DEMPSTER | R219: ROBINSON | W219: PORT MELBOURNE | X219: 2 | Y219: 2 | Z219: 0 | AA219: 496 | AB219: 529 | AC219: =(AA219/AB219)*100 -> 93.761814744801512 | AD219: =(X219*4)+(Z219*2) -> 8
A220: PRESTON | C220: M LAWSON | F220: BURROWS | I220: LUMICISI | L220: HUNT | O220: PRITCHARD | R220: MARCON | W220: PRAHRAN | X220: 2 | Y220: 2 | Z220: 0 | AA220: 417 | AB220: 445 | AC220: =(AA220/AB220)*100 -> 93.707865168539328 | AD220: =(X220*4)+(Z220*2) -> 8
A221: GOALKICKERS | W221: BOX HILL | X221: 1 | Y221: 3 | Z221: 0 | AA221: 523 | AB221: 459 | AC221: =(AA221/AB221)*100 -> 113.94335511982572 | AD221: =(X221*4)+(Z221*2) -> 4
A222: SPRINGVALE | C222: ROBINSON 7 | F222: DUDLEY 3 | H222: STEWART 2 | J222: CLARKE 2 | L222: ATKINS 2 | N222: PROSSER | P222: P MALONI | R222: KOOP | T222: CLARK | W222: PRESTON | X222: 1 | Y222: 3 | Z222: 0 | AA222: 536 | AB222: 511 | AC222: =(AA222/AB222)*100 -> 104.89236790606653 | AD222: =(X222*4)+(Z222*2) -> 4
A223: PRESTON | C223: SALVADORE 6 | F223: JORDAN 4 | I223: SHAW 3 | K223: LUMICISI 2 | M223: NICOLAOU | O223: M LAWSON | Q223: SENNO | S223: MARCON | W223: FRANKSTON | X223: 1 | Y223: 3 | Z223: 0 | AA223: 370 | AB223: 514 | AC223: =(AA223/AB223)*100 -> 71.98443579766537 | AD223: =(X223*4)+(Z223*2) -> 4
M224: HUNT | O224: HOCKING | S224: Venue: DANDENONG | W224: OAKLEIGH | X224: 0 | Y224: 4 | Z224: 0 | AA224: 370 | AB224: 552 | AC224: =(AA224/AB224)*100 -> 67.028985507246375 | AD224: =(X224*4)+(Z224*2) -> 0
A225: DANDENONG | C225: 3 | D225: 2 | E225: 20 | G225: 10 | H225: 5 | I225: 65 | K225: 15 | L225: 10 | M225: 100 | O225: 21 | P225: 11 | Q225: 137 | S225: BULLUSS | W225: CAMBERWELL | X225: 0 | Y225: 4 | Z225: 0 | AA225: 256 | AB225: 636 | AC225: =(AA225/AB225)*100 -> 40.25157232704403 | AD225: =(X225*4)+(Z225*2) -> 0
A226: PORT MELBOURNE | C226: 4 | D226: 1 | E226: 25 | G226: 9 | H226: 3 | I226: 57 | K226: 13 | L226: 6 | M226: 84 | O226: 16 | P226: 8 | Q226: 104 | S226: PRINCE
A227: BEST PLAYERS
A228: DANDENONG | C228: LACKO | F228: McCORMACK | I228: KNIGHT | L228: MURRAY | N228: ELSHAUG | Q228: WICKS
A229: PORT MELBOURNE | C229: M LAWSON | F229: BURROWS | I229: LUMICISI | L229: HUNT | N229: PRITCHARD | Q229: MARCON
A230: GOALKICKERS
A231: DANDENONG | C231: LACKO 7 | E231: MURRAY 4 | G231: KNIGHT 2 | I231: MILLANE 2 | K231: BRADDY | M231: MCKENZIE | O231: MEAD | Q231: ZBORIL | S231: D BOURKE | V231: D M BOURKE
A232: PORT MELBOURNE | C232: CONDON 6 | F232: TEMAY 2 | H232: HARKINS | J232: KENNEDY | L232: CHADBAND | N232: McCORMACK | Q232: PRITCHARD | T232: YORGEY | W232: HICKS | X232: PIGGOTT
A234: PRAHRAN | C234: 3 | D234: 2 | E234: 20 | G234: 7 | H234: 4 | I234: 46 | K234: 12 | L234: 7 | M234: 79 | O234: 19 | P234: 15 | Q234: 129 | S234: Venue: TOORAK PARK
A235: CAMBERWELL | C235: 4 | D235: 5 | E235: 29 | G235: 9 | H235: 8 | I235: 62 | K235: 11 | L235: 13 | M235: 79 | O235: 12 | P235: 16 | Q235: 88 | S235: LAWLER :CAULFIELD
A236: BEST PLAYERS
A237: PRAHRAN | C237: D'ALLESANDRO | F237: KILEY | I237: KNIGHTS | L237: STKINS | O237: R JOHNSON
A238: CAMBERWELL | C238: MCKENZIE | F238: WILKINSON | I238: BUDGE | L238: WYNN | O238: VITACCA | R238: HOLLOWAY
A239: GOALKICKERS
A240: PRAHRAN | C240: R JOHNSON 3 | F240: RYAN 3 | H240: KNIGHTS 3 | J240: K JOHNSON 2 | M240: TAYLOR 2 | O240: ATKINS 2 | Q240: MORRISSEY | T240: O'RILEY | V240: D'ALESSANDRO | X240: KILEY
A241: CAMBERWELL | C241: DIPIERDOMENICO 2 | G241: WYNN 2 | I241: SETON 2 | K241: MURTON 2 | M241: MCKENZIE | O241: BRASHER | Q241: VERESHAKA | U241: BINGLEY
A243: B'WICK/B'MEAD | C243: 4 | D243: 4 | E243: 28 | G243: 11 | H243: 11 | I243: 77 | K243: 13 | L243: 17 | M243: 95 | O243: 22 | P243: 30 | Q243: 162 | S243: Venue: BRUNSWICK
A244: OAKLEIGH | C244: 5 | D244: 6 | E244: 36 | G244: 7 | H244: 10 | I244: 52 | K244: 9 | L244: 13 | M244: 67 | O244: 9 | P244: 13 | Q244: 67 | S244: KEATING :NOLAN
A245: BEST PLAYERS
A246: B'WICK/B'MEAD | C246: LUMSDEN | F246: SALVADORE | I246: DUGGAN | L246: THOROGOOD | O246: BONE | Q246: CALLANDER
A247: OAKLEIGH | C247: DYSON | F247: JAMES | I247: SMITH | L247: WELSFORD | O247: MELLODY | Q247: QUIRK
A248: GOALKICKERS
A249: B'WICK/B'MEAD | C249: GRIFFITHS 5 | F249: WRIGHT 4 | I249: CLARKE 3 | K249: CALLANDER 2 | N249: DAVIS 2 | P249: DIELLIO 2 | R249: BONE | T249: POTTER | W249: GROVES | X249: SEMAAN
A250: OAKLEIGH | C250: PRETTO 4 | F250: WELSFORD 2 | I250: ATHERTON | L250: DYSON | N250: MCGANNON
A252: COBURG | C252: 4 | D252: 3 | E252: 27 | G252: 9 | H252: 8 | I252: 62 | K252: 13 | L252: 11 | M252: 89 | O252: 18 | P252: 19 | Q252: 127 | S252: Venue: COBURG
A253: FRANKSTON | C253: 2 | D253: 7 | E253: 19 | G253: 3 | H253: 9 | I253: 27 | K253: 5 | L253: 14 | M253: 44 | O253: 9 | P253: 15 | Q253: 69 | S253: CAMERON ;RICHARDSON
A254: BEST PLAYERS
A255: COBURG | C255: YOUNG | F255: EVANS | I255: LANGAN | L255: DARBY | O255: SHELDON | R255: INGRAM
A256: FRANKSTON | C256: D MARTIN | F256: SPENCER | I256: DENEREAZ | L256: McCARTHY | O256: GAMBLE | R256: VANDERMEER
A257: GOALKICKERS
A258: COBURG | C258: WEATHERALD 5 | F258: YOUNG 4 | H258: INGRAM 3 | J258: KAAKOUR | M258: LANGAN | O258: ALLISON | Q258: WILLIAMS | T258: DARBY | V258: BURKE
A259: FRANKSTON | C259: WEST 3 | E259: GAHAN 2 | G259: AMOORE | I259: VANDERMEER | L259: GAMBLE | N259: S HAMILL
A261: WILLIAMSTOWN | C261: 2 | D261: 6 | E261: 18 | G261: 4 | H261: 9 | I261: 33 | K261: 12 | L261: 10 | M261: 82 | O261: 23 | P261: 13 | Q261: 151 | S261: Venue: BOX HILL
A262: BOX HILL | C262: 5 | D262: 3 | E262: 33 | G262: 6 | H262: 7 | I262: 43 | K262: 10 | L262: 9 | M262: 69 | O262: 13 | P262: 12 | Q262: 90 | S262: MARSHALL ;UNWIN
A263: BEST PLAYERS
A264: WILLIAMSTOWN | C264: ROUND | F264: MITCHELL | I264: McTAGGART | L264: AZIZ | N264: JOHNSON | Q264: OWEN
A265: BOX HILL | C265: ZARAFA | F265: HOGAN | I265: BUTTIFANT | L265: DELL
A266: GOALKICKERS
A267: WILLIAMSTOWN | C267: AZIZ 6 | E267: MOURNEY 3 | H267: BROOKS 2 | J267: SMITH 2 | L267: JOHNSON 2 | N267: TKOCZ 2 | P267: MCGOWAN | R267: HOWLETT | U267: McTAGGART | X267: SLEVISON | AA267: N DIMARTINO
A268: BOX HILL | C268: BUTTIFANT 5 | F268: PENNY 2 | H268: REEVES 2 | J268: LISLE | L268: HOGAN | N268: ZARAFA | P268: DWYER
A271: ROUND 5 | D271: 12TH MAY | I271: WEATHER | S271: Venue: BOX HILL
D272: 1ST QTR | H272: 2ND QTR | L272: 3RD QTR | P272: FINAL | S272: UMPIRES
A273: COBURG | C273: 6 | D273: 4 | E273: 40 | G273: 10 | H273: 8 | I273: 68 | K273: 18 | L273: 18 | M273: 126 | O273: 22 | P273: 23 | Q273: 155 | S273: SNEDDON | X273: LADDER | AA273: ROUND | AC273: 5
A274: BOX HILL | C274: 5 | D274: 1 | E274: 31 | G274: 9 | H274: 5 | I274: 59 | K274: 11 | L274: 5 | M274: 71 | O274: 13 | P274: 8 | Q274: 86 | S274: GOLDSPINK
A275: BEST PLAYERS | W275: TEAM | X275: W | Y275: L | Z275: D | AA275: FOR | AB275: AGST | AC275: % | AD275: PTS
A276: COBURG | C276: SHELDON | F276: LANGAN | I276: INGRAM | L276: YOUNG | O276: EVANS | R276: LISTON
A277: BOX HILL | C277: LISLE | F277: HOLT | I277: HICKS | L277: B HOGAN | W277: SANDRINGHAM | X277: 5 | Y277: 0 | Z277: 0 | AA277: 644 | AB277: 499 | AC277: =(AA277/AB277)*100 -> 129.05811623246493 | AD277: =(X277*4)+(Z277*2) -> 20
A278: GOALKICKERS | R278: TARANTO | W278: COBURG | X278: 4 | Y278: 1 | Z278: 0 | AA278: 657 | AB278: 423 | AC278: =(AA278/AB278)*100 -> 155.31914893617019 | AD278: =(X278*4)+(Z278*2) -> 16
A279: COBURG | C279: WEATHERALD 6 | F279: YOUNG 5 | H279: LANGAN 3 | J279: INGRAM 2 | M279: SHELDON 2 | O279: KAAKOUR | Q279: LISTON | S279: ANGWIN | W279: DANDEN0NG | X279: 4 | Y279: 1 | Z279: 0 | AA279: 582 | AB279: 445 | AC279: =(AA279/AB279)*100 -> 130.7865168539326 | AD279: =(X279*4)+(Z279*2) -> 16
A280: BOX HILL | C280: ZARAFA 3 | F280: HOGAN 2 | H280: HANDLEY 2 | J280: HICKS 2 | L280: LISLE | N280: DELL | P280: BUTTIFANT | R280: HOLT | W280: SPRINGVALE | X280: 4 | Y280: 1 | Z280: 0 | AA280: 587 | AB280: 585 | AC280: =(AA280/AB280)*100 -> 100.34188034188034 | AD280: =(X280*4)+(Z280*2) -> 16
D281: 13TH MAY | I281: WEATHER | S281: Venue: SPRINGVALE | W281: WERRIBEE | X281: 3 | Y281: 2 | Z281: 0 | AA281: 668 | AB281: 471 | AC281: =(AA281/AB281)*100 -> 141.82590233545648 | AD281: =(X281*4)+(Z281*2) -> 12
A282: SPRINGVALE | C282: 4 | D282: 4 | E282: 28 | G282: 8 | H282: 11 | I282: 59 | K282: 15 | L282: 14 | M282: 104 | O282: 21 | P282: 18 | Q282: 144 | S282: CAULFIELD
A283: DANDENONG | C283: 5 | D283: 3 | E283: 33 | G283: 8 | H283: 5 | I283: 53 | K283: 10 | L283: 7 | M283: 67 | O283: 14 | P283: 8 | Q283: 92 | S283: GORE | W283: WILLIAMSTOWN | X283: 3 | Y283: 2 | Z283: 0 | AA283: 602 | AB283: 473 | AC283: =(AA283/AB283)*100 -> 127.27272727272727 | AD283: =(X283*4)+(Z283*2) -> 12
A284: BEST PLAYERS | W284: PRAHRAN | X284: 3 | Y284: 2 | Z284: 0 | AA284: 499 | AB284: 518 | AC284: =(AA284/AB284)*100 -> 96.332046332046332 | AD284: =(X284*4)+(Z284*2) -> 12
A285: SPRINGVALE | C285: G CLARKE | F285: MENDE | I285: NICOL | L285: T ELLIOTT | O285: ATKINS | R285: PROSSER | W285: PRESTON | X285: 2 | Y285: 3 | Z285: 0 | AA285: 616 | AB285: 588 | AC285: =(AA285/AB285)*100 -> 104.76190476190477 | AD285: =(X285*4)+(Z285*2) -> 8
A286: DANDENONG | C286: MCKENZIE | F286: D BOURKE | I286: MCCORMACK | L286: BRADDY | O286: ATKINSON | R286: KNIGHT | W286: PORT MELBOURNE | X286: 2 | Y286: 3 | Z286: 0 | AA286: 569 | AB286: 611 | AC286: =(AA286/AB286)*100 -> 93.126022913256961 | AD286: =(X286*4)+(Z286*2) -> 8
A287: GOALKICKERS | M287: T ELLIOTT 2 | P287: ATKINS | R287: PHILLIPS | W287: B'WICK/B'MEAD | X287: 2 | Y287: 3 | Z287: 0 | AA287: 535 | AB287: 610 | AC287: =(AA287/AB287)*100 -> 87.704918032786878 | AD287: =(X287*4)+(Z287*2) -> 8
A288: SPRINGVALE | C288: ROBINSON 5 | F288: PROSSER 3 | I288: G CLARKE 3 | L288: KOOP 2 | N288: MATHESON 2 | Q288: MAYLIN 2 | W288: FRANKSTON | X288: 2 | Y288: 3 | Z288: 0 | AA288: 534 | AB288: 641 | AC288: =(AA288/AB288)*100 -> 83.307332293291736 | AD288: =(X288*4)+(Z288*2) -> 8
A289: DANDENONG | C289: LACKO 3 | E289: MURRAY 2 | G289: McKENZIE 2 | I289: BRADDY | K289: READ | M289: KNIGHT | O289: ELSHAUG | Q289: MILLANE | W289: BOX HILL | X289: 1 | Y289: 4 | Z289: 0 | AA289: 609 | AB289: 615 | AC289: =(AA289/AB289)*100 -> 99.024390243902445 | AD289: =(X289*4)+(Z289*2) -> 4
K290: D M BOURKE | N290: McCORMACK | S290: Venue: PORT MELBOURNE | W290: OAKLEIGH | X290: 0 | Y290: 5 | Z290: 0 | AA290: 497 | AB290: 716 | AC290: =(AA290/AB290)*100 -> 69.413407821229043 | AD290: =(X290*4)+(Z290*2) -> 0
A291: PRAHRAN | C291: 2 | D291: 5 | E291: 17 | G291: 7 | H291: 8 | I291: 50 | K291: 9 | L291: 15 | M291: 69 | O291: 11 | P291: 16 | Q291: 82 | S291: FORSTER | W291: CAMBERWELL | X291: 0 | Y291: 5 | Z291: 0 | AA291: 336 | AB291: 740 | AC291: =(AA291/AB291)*100 -> 45.405405405405411 | AD291: =(X291*4)+(Z291*2) -> 0
A292: PORT MELBOURNE | C292: 2 | D292: 6 | E292: 18 | G292: 5 | H292: 6 | I292: 36 | K292: 8 | L292: 10 | M292: 58 | O292: 10 | P292: 13 | Q292: 73 | S292: RICHARDSON
A293: BEST PLAYERS
A294: PRAHRAN | C294: WHITE | F294: TAPPING | I294: KNIGHT | L294: MORRISSEY | O294: TAYLOR | R294: WALFORD
A295: PORT MELBOURNE | C295: HARKINS | F295: KENNEDY | I295: MUTIMER | L295: GOLDIE | O295: PRITCHARD | R295: WALL
A296: GOALKICKERS
A297: PRAHRAN | C297: TAYLOR 4 | F297: RYAN 3 | H297: HENRY | J297: R JOHNSON | M297: KNIGHT | O297: MARK
A298: PORT MELBOURNE | C298: HARKINS 4 | F298: KENNEDY 3 | I298: MUTIMER 2 | L298: CONDON
A300: SANDRINGHAM | C300: 5 | D300: 2 | E300: 32 | G300: 6 | H300: 7 | I300: 43 | K300: 11 | L300: 12 | M300: 78 | O300: 14 | P300: 20 | Q300: 104 | S300: Venue: CAMBERWELL
A301: CAMBERWELL | C301: 3 | D301: 5 | E301: 23 | G301: 6 | H301: 9 | I301: 45 | K301: 7 | L301: 16 | M301: 58 | O301: 10 | P301: 20 | Q301: 80 | S301: GYSS :UNWIN
A302: BEST PLAYERS
A303: SANDRINGHAM | C303: ALLEN | F303: PRATT | I303: M FISCHER | L303: MACKENZIE | O303: CUMMINGS | R303: McGANNON
A304: CAMBERWELL | C304: WILKINSON | F304: T VITACCA | I304: BUDGE | L304: MERTON | O304: HOLLOWAY | R304: McKENZIE
A305: GOALKICKERS
A306: SANDRINGHAM | C306: EAVES 2 | E306: ALLEN 2 | G306: CUMMINGS 2 | J306: E FISCHER 2 | M306: IRWIN 2 | O306: DALRYMPLE | R306: F RUGOLO | U306: BERGMAN | X306: DUNKLEY
A307: CAMBERWELL | C307: MERTON 3 | F307: N MITCHELL 2 | I307: FITZPATRICK 2 | L307: WYNN | N307: T VITACCA | Q307: DUNNE
A309: PRESTON | C309: 1 | D309: 1 | E309: 7 | G309: 6 | H309: 5 | I309: 41 | K309: 8 | L309: 8 | M309: 56 | O309: 11 | P309: 14 | Q309: 80 | S309: Venue: WILLIAMSTOWN
A310: WILLIAMSTOWN | C310: 3 | D310: 7 | E310: 25 | G310: 6 | H310: 10 | I310: 46 | K310: 8 | L310: 14 | M310: 62 | O310: 10 | P310: 17 | Q310: 77 | S310: HOLT :PRINCE
A311: BEST PLAYERS
A312: PRESTON | C312: TEAM EFFORT
A313: WILLIAMSTOWN | C313: LLOYD | F313: MCTAGGART | I313: ROUND | L313: PASTORE | O313: AZIZ | Q313: DIMARTINO
A314: GOALKICKERS
A315: PRESTON | C315: SHAW 4 | F315: MARCON 3 | I315: LUMICISI 2 | L315: SALVADORE | O315: SENNO
A316: WILLIAMSTOWN | C316: MOURNEY 5 | F316: AZIZ | H316: ROUND | J316: McTAGGART | M316: N DIMARTINO | P316: OWEN
A318: FRANKSTON | C318: 5 | D318: 1 | E318: 31 | G318: 11 | H318: 4 | I318: 70 | K318: 19 | L318: 7 | M318: 121 | O318: 26 | P318: 8 | Q318: 164 | S318: Venue: OAKLEIGH
A319: OAKLEIGH | C319: 6 | D319: 2 | E319: 38 | G319: 10 | H319: 3 | I319: 63 | K319: 15 | L319: 6 | M319: 96 | O319: 19 | P319: 13 | Q319: 127 | S319: LAWLER :COOK
A320: BEST PLAYERS
A321: FRANKSTON | C321: TEAM EFFORT
A322: OAKLEIGH | C322: MELLODY | F322: MITCHELSON | I322: PAYNE | K322: DYSON | N322: WELSFORD | Q322: JAMES
A323: GOALKICKERS
A324: FRANKSTON | C324: BROWN 14 | F324: WEST 5 | H324: BELL 3 | J324: FREW 2 | L324: GAHAN | N324: BLACKFORD
A325: OAKLEIGH | C325: PRETTO 5 | F325: DYSON 4 | H325: PAYNE 4 | J325: WELSFORD | M325: MELLODY | O325: LOWE | Q325: MITCHELSON | T325: THEOHARRIS | X325: GARBUIO
A327: WERRIBEE | C327: 4 | D327: 6 | E327: 30 | G327: 13 | H327: 11 | I327: 89 | K327: 15 | L327: 14 | M327: 104 | O327: 23 | P327: 17 | Q327: 155 | S327: Venue: WERRIBEE
A328: B'WICK/B'MEAD | C328: 5 | D328: 4 | E328: 34 | G328: 6 | H328: 7 | I328: 43 | K328: 7 | L328: 9 | M328: 51 | O328: 8 | P328: 13 | Q328: 61 | S328: CAMERON :SABILLE
A329: BEST PLAYERS
A330: WERRIBEE | C330: ALLDAY | F330: GEARY | I330: WILSON | L330: STOCKWELL | O330: SPIERINGS | R330: FITZPATRICK
A331: B'WICK/B'MEAD | C331: HILL | F331: SALVADORE | I331: EAMES
A332: GOALKICKERS
A333: WERRIBEE | C333: GEARY 10 | F333: FLEMING 5 | I333: STOCKWELL 3 | L333: SELLS 2 | N333: HARRIS | P333: FENTON | R333: ,MCMASTER
A334: B'WICK/B'MEAD | C334: GRIFFITHS 2 | F334: CALLANDER 2 | I334: BERTOLLO | K334: WRIGHT | M334: SEMAAN | O334: REID
A337: ROUND 6 | D337: 19TH MAY | I337: WEATHER | S337: Venue: DANDENONG
D338: 1ST QTR | H338: 2ND QTR | L338: 3RD QTR | P338: FINAL | S338: UMPIRES
A339: WILLIAMSTOWN | C339: 2 | D339: 2 | E339: 14 | G339: 6 | H339: 4 | I339: 40 | K339: 12 | L339: 7 | M339: 79 | O339: 16 | P339: 7 | Q339: 103 | X339: LADDER | AA339: ROUND | AC339: 6
A340: DANDENONG | C340: 2 | D340: 6 | E340: 18 | G340: 3 | H340: 13 | I340: 31 | K340: 6 | L340: 18 | M340: 54 | O340: 11 | P340: 22 | Q340: 88
A341: BEST PLAYERS | W341: TEAM | X341: W | Y341: L | Z341: D | AA341: FOR | AB341: AGST | AC341: % | AD341: PTS
A342: WILLIAMSTOWN | C342: PASTORE | F342: HOWLETT | I342: McTAGGART | L342: ROUND | N342: AZIZ | Q342: DIMARTINO
A343: DANDENONG | C343: GILDER | F343: THIELE | W343: COBURG | X343: 5 | Y343: 1 | Z343: 0 | AA343: 788 | AB343: 535 | AC343: =(AA343/AB343)*100 -> 147.28971962616822 | AD343: =(X343*4)+(Z343*2) -> 20
A344: GOALKICKERS | P344: McTAGGART | R344: O'CONNOR | W344: SANDRINGHAM | X344: 5 | Y344: 1 | Z344: 0 | AA344: 787 | AB344: 650 | AC344: =(AA344/AB344)*100 -> 121.07692307692308 | AD344: =(X344*4)+(Z344*2) -> 20
A345: WILLIAMSTOWN | C345: AZIZ 3 | E345: PASTORE 3 | G345: MOURNEY 2 | I345: BOURIS 2 | K345: GOULD | M345: ROUND | O345: JOHNSON | Q345: TCOKZ | W345: SPRINGVALE | X345: 5 | Y345: 1 | Z345: 0 | AA345: 757 | AB345: 656 | AC345: =(AA345/AB345)*100 -> 115.39634146341464 | AD345: =(X345*4)+(Z345*2) -> 20
A346: DANDENONG | C346: KNIGHT 2 | E346: WICKS 2 | G346: ZBORIL 2 | I346: MURRAY | K346: McKENZIE | M346: MILLANE | O346: D M BOURKE | W346: WERRIBEE | X346: 4 | Y346: 2 | Z346: 0 | AA346: 774 | AB346: 574 | AC346: =(AA346/AB346)*100 -> 134.8432055749129 | AD346: =(X346*4)+(Z346*2) -> 16
D347: 20TH MAY | I347: WEATHER | N347: MCCORMACK | S347: Venue: TOORAK PARK | W347: WILLIAMSTOWN | X347: 4 | Y347: 2 | Z347: 0 | AA347: 705 | AB347: 561 | AC347: =(AA347/AB347)*100 -> 125.66844919786095 | AD347: =(X347*4)+(Z347*2) -> 16
A348: SPRINGVALE | C348: 0 | D348: 4 | E348: 4 | G348: 4 | H348: 12 | I348: 36 | K348: 12 | L348: 14 | M348: 86 | O348: 24 | P348: 20 | Q348: 164 | S348: COOK
A349: PRAHRAN | C349: 3 | D349: 4 | E349: 22 | G349: 7 | H349: 6 | I349: 48 | K349: 8 | L349: 8 | M349: 56 | O349: 10 | P349: 11 | Q349: 71 | S349: UNWIN | W349: DANDEN0NG | X349: 4 | Y349: 2 | Z349: 0 | AA349: 670 | AB349: 548 | AC349: =(AA349/AB349)*100 -> 122.26277372262773 | AD349: =(X349*4)+(Z349*2) -> 16
A350: BEST PLAYERS | W350: PRESTON | X350: 3 | Y350: 3 | Z350: 0 | AA350: 730 | AB350: 671 | AC350: =(AA350/AB350)*100 -> 108.79284649776453 | AD350: =(X350*4)+(Z350*2) -> 12
A351: SPRINGVALE | C351: NICOL | F351: MENDE | I351: DUDLEY | L351: SMIT | O351: MATHESON | R351: KEIPERT | W351: B'WICK/B'MEAD | X351: 3 | Y351: 3 | Z351: 0 | AA351: 707 | AB351: 666 | AC351: =(AA351/AB351)*100 -> 106.15615615615614 | AD351: =(X351*4)+(Z351*2) -> 12
A352: PRAHRAN | C352: WHITE | F352: KNIGHTS | I352: MORRISSEY | L352: D'ALESSANDRO | W352: PORT MELBOURNE | X352: 3 | Y352: 3 | Z352: 0 | AA352: 720 | AB352: 754 | AC352: =(AA352/AB352)*100 -> 95.490716180371351 | AD352: =(X352*4)+(Z352*2) -> 12
A353: GOALKICKERS | Q353: MENDE | W353: PRAHRAN | X353: 3 | Y353: 3 | Z353: 0 | AA353: 570 | AB353: 682 | AC353: =(AA353/AB353)*100 -> 83.577712609970675 | AD353: =(X353*4)+(Z353*2) -> 12
A354: SPRINGVALE | C354: ROBINSON 5 | F354: CLARKE 5 | H354: PROSSER 3 | J354: ATKINS 3 | L354: KEIPERT 2 | N354: KOOP 2 | P354: T ELLIOTT 2 | R354: P MALONI | W354: FRANKSTON | X354: 2 | Y354: 4 | Z354: 0 | AA354: 637 | AB354: 747 | AC354: =(AA354/AB354)*100 -> 85.274431057563589 | AD354: =(X354*4)+(Z354*2) -> 8
A355: PRAHRAN | C355: TAYLOR 3 | F355: R JOHNSON 3 | I355: RYAN 2 | K355: EDWARDS | N355: TAPPING | W355: BOX HILL | X355: 1 | Y355: 5 | Z355: 0 | AA355: 692 | AB355: 729 | AC355: =(AA355/AB355)*100 -> 94.924554183813441 | AD355: =(X355*4)+(Z355*2) -> 4
S356: Venue: BEACH ROAD | W356: OAKLEIGH | X356: 0 | Y356: 6 | Z356: 0 | AA356: 609 | AB356: 847 | AC356: =(AA356/AB356)*100 -> 71.900826446281002 | AD356: =(X356*4)+(Z356*2) -> 0
A357: PORT MELBOURNE | C357: 9 | D357: 6 | E357: 60 | G357: 14 | H357: 7 | I357: 91 | K357: 18 | L357: 16 | M357: 124 | O357: 22 | P357: 19 | Q357: 151 | S357: CAMERON | W357: CAMBERWELL | X357: 0 | Y357: 6 | Z357: 0 | AA357: 392 | AB357: 912 | AC357: =(AA357/AB357)*100 -> 42.982456140350877 | AD357: =(X357*4)+(Z357*2) -> 0
A358: SANDRINGHAM | C358: 0 | D358: 2 | E358: 2 | G358: 8 | H358: 10 | I358: 58 | K358: 16 | L358: 12 | M358: 108 | O358: 21 | P358: 17 | Q358: 143 | S358: P MARSHALL
A359: BEST PLAYERS
A360: PORT MELBOURNE | C360: HARKINS | F360: FORD | I360: KENNEDY | L360: LOVE | O360: CAMERON
A361: SANDRINGHAM | C361: ALLEN | F361: McGANNON | I361: MACKENZIE | L361: FOLEY | O361: J RUGOLO
A362: GOALKICKERS
A363: PORT MELBOURNE | C363: LOVE 7 | E363: CONDON 5 | G363: BAILEY 2 | I363: HICKS 2 | K363: HARKINS | M363: FOLEY | O363: KENNEDY | Q363: CAMERON | S363: COOPER | V363: HARLAND
A364: SANDRINGHAM | C364: F RUGOLO 5 | F364: PETERS 4 | H364: FOLEY 2 | J364: HIBBERT 2 | M364: EAVES 2 | O364: ALLEN 2 | Q364: E FISCHER 2 | T364: MACKENZIE | X364: CRAMERI
A366: B'WICK/B'MEAD | C366: 4 | D366: 4 | E366: 28 | G366: 10 | H366: 10 | I366: 70 | K366: 18 | L366: 14 | M366: 122 | O366: 25 | P366: 22 | Q366: 172 | S366: Venue: BRUNSWICK
A367: CAMBERWELL | C367: 2 | D367: 4 | E367: 16 | G367: 5 | H367: 9 | I367: 39 | K367: 7 | L367: 10 | M367: 52 | O367: 7 | P367: 14 | Q367: 56 | S367: RICHARDSON ;CULLEN
A368: BEST PLAYERS
A369: B'WICK/B'MEAD | C369: POTTER | F369: CLARKE | I369: HILL | L369: THOROGOOD | O369: REID | Q369: EAMES
A370: CAMBERWELL | C370: N MITCHELL | F370: T VITACCA | I370: McKENZIE | L370: WYNN
A371: GOALKICKERS
A372: B'WICK/B'MEAD | C372: DALE 5 | E372: CALLANDER 4 | H372: POTTER 4 | J372: BONE 3 | L372: CLARKE 3 | N372: DIEULLIO 2 | Q372: READ 2 | S372: BEALE | U372: DAVIS
A373: CAMBERWELL | C373: KENNEDY 2 | F373: WILKINSON | I373: N MITCHELL | L373: MCKENZIE | N373: MERTON | P373: VERESHAKA
A375: WERRIBEE | C375: 3 | D375: 1 | E375: 19 | G375: 9 | H375: 5 | I375: 59 | K375: 10 | L375: 9 | M375: 69 | O375: 15 | P375: 16 | Q375: 106 | S375: Venue: FRANKSTON
A376: FRANKSTON | C376: 3 | D376: 6 | E376: 24 | G376: 6 | H376: 9 | I376: 45 | K376: 14 | L376: 11 | M376: 95 | O376: 15 | P376: 13 | Q376: 103 | S376: BULLUSS :CAULFIELD
A377: BEST PLAYERS
A378: WERRIBEE | C378: HARRIS | F378: ALLDAY | I378: FITZPATRICK | L378: SPIERINGS | O378: WILSON
A379: FRANKSTON | C379: McCARTHY | F379: WEST | I379: BOONKAMP | L379: GAMBLE | O379: GARDNER | R379: O'BRIEN
A380: GOALKICKERS
A381: WERRIBEE | C381: FLEMING 3 | F381: GEARY 2 | H381: HARRIS 2 | J381: RAEBURN 2 | M381: DUGGAN 2 | O381: SELLS | Q381: SIZER | S381: FENTON | V381: MCMASTER
A382: FRANKSTON | C382: WEST 4 | F382: FREW 3 | H382: BROWN 2 | J382: L GARDNER 2 | M382: O'NEILL 2 | O382: AMOORE | Q382: S HAMILL
A384: COBURG | C384: 5 | D384: 3 | E384: 33 | G384: 8 | H384: 10 | I384: 58 | K384: 14 | L384: 14 | M384: 98 | O384: 19 | P384: 17 | Q384: 131 | S384: Venue: OAKLEIGH
A385: OAKLEIGH | C385: 3 | D385: 3 | E385: 21 | G385: 8 | H385: 5 | I385: 53 | K385: 12 | L385: 8 | M385: 80 | O385: 17 | P385: 10 | Q385: 112 | S385: HOWLETT :GYSS
A386: BEST PLAYERS
A387: COBURG | C387: LITTLER | F387: ALLISON | I387: SHELDON | L387: LANGAN | O387: DARBY | R387: BARNES
A388: OAKLEIGH | C388: DYSON | F388: MELLODY | I388: JAMES | L388: QUIRK | O388: GARBUIO | R388: SMITH
A389: GOALKICKERS
A390: COBURG | C390: WEATHERALD 5 | F390: KEMPSTER 3 | I390: REYNOLDSON 2 | L390: INGRAM 2 | N390: SHELDON 2 | P390: ALLISON | R390: YOUNG | T390: BURKE | V390: TARANTO | X390: COMITO
A391: OAKLEIGH | C391: PRETTO 5 | F391: PAYNE 4 | H391: HAWKER 3 | J391: GARBUIO 3 | M391: DYSON | O391: MITCHELSON
A393: PRESTON | C393: 3 | D393: 2 | E393: 20 | G393: 6 | H393: 5 | I393: 41 | K393: 11 | L393: 8 | M393: 74 | O393: 17 | P393: 12 | Q393: 114 | S393: Venue: PRESTON
A394: BOX HILL | C394: 4 | D394: 1 | E394: 25 | G394: 7 | H394: 1 | I394: 43 | K394: 9 | L394: 3 | M394: 57 | O394: 13 | P394: 5 | Q394: 83 | S394: SAVILLE :LAWLER
A395: BEST PLAYERS
A396: PRESTON | C396: BURROWS | F396: PRIDEAUX | I396: SENNO | L396: PLOWMAN | O396: NICOLAOU | R396: C LAWSON
A397: BOX HILL | C397: ROSSELEY | F397: O'NEILL | I397: LISLE | L397: HOLT
A398: GOALKICKERS
A399: PRESTON | C399: SHAW 4 | F399: NICOLAOU 4 | I399: PLOWMAN 3 | L399: SENNO 2 | N399: SALVADORE | Q399: MARCON | S399: PRIDEAUX | V399: HALL
A400: BOX HILL | C400: LISLE 3 | F400: NICHOLSON 3 | I400: HICKS 2 | K400: P BOLTON | M400: BROWN | O400: BUTTIFANT | Q400: O'NEILL | S400: ROSSELEY
A402: ROUND 7 | D402: 26TH MAY | I402: WEATHER | S402: Venue: SPRINGVALE
D403: 1ST QTR | H403: 2ND QTR | L403: 3RD QTR | P403: FINAL | S403: UMPIRES
A404: SPRINGVALE | C404: 2 | D404: 6 | E404: 18 | G404: 13 | H404: 11 | I404: 89 | K404: 21 | L404: 17 | M404: 143 | O404: 29 | P404: 25 | Q404: 199 | S404: BULLUSS | X404: LADDER | AA404: ROUND | AC404: 7
A405: SANDRINGHAM | C405: 3 | D405: 3 | E405: 21 | G405: 3 | H405: 9 | I405: 27 | K405: 5 | L405: 17 | M405: 47 | O405: 6 | P405: 21 | Q405: 57 | S405: NOLAN
A406: BEST PLAYERS | W406: TEAM | X406: W | Y406: L | Z406: D | AA406: FOR | AB406: AGST | AC406: % | AD406: PTS
A407: SPRINGVALE | C407: CLARKE | F407: ATKINS | I407: KOOP | L407: KEIPERT | O407: ROBINSON | R407: NICOL
A408: SANDRINGHAM | C408: ALLEN | F408: SCHLEIGER | I408: PETERS | L408: J RUGOLO | O408: EAVES | R408: HALPHEN | W408: COBURG | X408: 6 | Y408: 1 | Z408: 0 | AA408: 926 | AB408: 623 | AC408: =(AA408/AB408)*100 -> 148.63563402889247 | AD408: =(X408*4)+(Z408*2) -> 24
A409: GOALKICKERS | W409: SPRINGVALE | X409: 6 | Y409: 1 | Z409: 0 | AA409: 956 | AB409: 713 | AC409: =(AA409/AB409)*100 -> 134.08134642356242 | AD409: =(X409*4)+(Z409*2) -> 24
A410: SPRINGVALE | C410: ROBINSON 9 | F410: KEIPERT 6 | I410: ATKINS 6 | K410: CLARKE 4 | M410: MALONI | O410: MAYLIN | Q410: T ELLIOTT | S410: PHILLIPS | W410: WERRIBEE | X410: 5 | Y410: 2 | Z410: 0 | AA410: 921 | AB410: 668 | AC410: =(AA410/AB410)*100 -> 137.87425149700599 | AD410: =(X410*4)+(Z410*2) -> 20
A411: SANDRINGHAM | C411: PETERS 3 | F411: F RUGOLO 2 | I411: EAVES | W411: DANDEN0NG | X411: 5 | Y411: 2 | Z411: 0 | AA411: 818 | AB411: 688 | AC411: =(AA411/AB411)*100 -> 118.8953488372093 | AD411: =(X411*4)+(Z411*2) -> 20
D412: 26TH MAY | I412: WEATHER | S412: Venue: PORT MELBOURNE | W412: SANDRINGHAM | X412: 5 | Y412: 2 | Z412: 0 | AA412: 844 | AB412: 849 | AC412: =(AA412/AB412)*100 -> 99.411071849234389 | AD412: =(X412*4)+(Z412*2) -> 20
A413: PORT MELBOURNE | C413: 7 | D413: 6 | E413: 48 | G413: 11 | H413: 11 | I413: 77 | K413: 16 | L413: 15 | M413: 111 | O413: 19 | P413: 20 | Q413: 134 | S413: MORROW
A414: B'WICK/B'MEAD | C414: 5 | D414: 1 | E414: 31 | G414: 9 | H414: 5 | I414: 59 | K414: 14 | L414: 8 | M414: 92 | O414: 17 | P414: 14 | Q414: 116 | S414: COOK | W414: WILLIAMSTOWN | X414: 4 | Y414: 3 | Z414: 0 | AA414: 789 | AB414: 671 | AC414: =(AA414/AB414)*100 -> 117.58569299552906 | AD414: =(X414*4)+(Z414*2) -> 16
A415: BEST PLAYERS | W415: PORT MELBOURNE | X415: 4 | Y415: 3 | Z415: 0 | AA415: 854 | AB415: 870 | AC415: =(AA415/AB415)*100 -> 98.160919540229884 | AD415: =(X415*4)+(Z415*2) -> 16
A416: PORT MELBOURNE | C416: FOLEY | F416: STROOPER | I416: TEMAY | L416: HICKS | O416: REISSIG | R416: CONDON | W416: PRAHRAN | X416: 4 | Y416: 3 | Z416: 0 | AA416: 680 | AB416: 766 | AC416: =(AA416/AB416)*100 -> 88.772845953002616 | AD416: =(X416*4)+(Z416*2) -> 16
A417: B'WICK/B'MEAD | C417: EAMES | F417: HILL | I417: BONE | L417: CONNELL | W417: FRANKSTON | X417: 3 | Y417: 4 | Z417: 0 | AA417: 864 | AB417: 827 | AC417: =(AA417/AB417)*100 -> 104.4740024183797 | AD417: =(X417*4)+(Z417*2) -> 12
A418: GOALKICKERS | W418: B'WICK/B'MEAD | X418: 3 | Y418: 4 | Z418: 0 | AA418: 823 | AB418: 800 | AC418: =(AA418/AB418)*100 -> 102.875 | AD418: =(X418*4)+(Z418*2) -> 12
A419: PORT MELBOURNE | C419: CONDON 7 | F419: HICKS 6 | H419: FOLEY 2 | J419: HARKINS | L419: BAILEY | N419: PIGOTT | P419: COOPER | W419: PRESTON | X419: 3 | Y419: 4 | Z419: 0 | AA419: 818 | AB419: 809 | AC419: =(AA419/AB419)*100 -> 101.11248454882571 | AD419: =(X419*4)+(Z419*2) -> 12
A420: B'WICK/B'MEAD | C420: GRIFFITHS 4 | F420: CALLANDER 4 | I420: BEALE 3 | K420: DAVIS 2 | M420: BONE | N420: WRIGHT | P420: DRAIN | R420: HILL | W420: BOX HILL | X420: 1 | Y420: 6 | Z420: 0 | AA420: 832 | AB420: 877 | AC420: =(AA420/AB420)*100 -> 94.868871151653366 | AD420: =(X420*4)+(Z420*2) -> 4
S421: Venue: CAMBERWELL | W421: OAKLEIGH | X421: 0 | Y421: 7 | Z421: 0 | AA421: 703 | AB421: 994 | AC421: =(AA421/AB421)*100 -> 70.724346076458758 | AD421: =(X421*4)+(Z421*2) -> 0
A422: FRANKSTON | C422: 6 | D422: 3 | E422: 39 | G422: 17 | H422: 7 | I422: 109 | K422: 27 | L422: 11 | M422: 173 | O422: 35 | P422: 17 | Q422: 227 | S422: CLEMENT | W422: CAMBERWELL | X422: 0 | Y422: 7 | Z422: 0 | AA422: 472 | AB422: 1139 | AC422: =(AA422/AB422)*100 -> 41.439859525899912 | AD422: =(X422*4)+(Z422*2) -> 0
A423: CAMBERWELL | C423: 1 | D423: 5 | E423: 11 | G423: 4 | H423: 9 | I423: 33 | K423: 7 | L423: 16 | M423: 58 | O423: 10 | P423: 20 | Q423: 80 | S423: GYSS
A424: BEST PLAYERS
A425: FRANKSTON | C425: D MARTIN | F425: SHARPE | I425: T HAMILL | L425: S HAMILL | O425: BROWN | R425: BELL
A426: CAMBERWELL | C426: WYNN | F426: R VITACCA | I426: SETON | L426: DIPIERDOMENICO
A427: GOALKICKERS | S427: D MARTIN
A428: FRANKSTON | C428: BROWN 13 | F428: BELL 6 | H428: BINGLEY 3 | J428: O'BRIEN 3 | L428: WEST 2 | N428: FREW 2 | P428: SHARPE | R428: GAMBLE | U428: S HAMILL | X428: L GARDNER | AB428: BRUNNEN
A429: CAMBERWELL | C429: DIPIERDOMENICO 3 | G429: WYNN 2 | I429: N MITCHELL | L429: BUDGE | N429: SETON | P429: BRASHER | R429: KENNEDY
A431: WERRIBEE | C431: 5 | D431: 4 | E431: 34 | G431: 12 | H431: 7 | I431: 79 | K431: 18 | L431: 11 | M431: 119 | O431: 22 | P431: 15 | Q431: 147 | S431: Venue: WERRIBEE
A432: OAKLEIGH | C432: 4 | D432: 2 | E432: 26 | G432: 8 | H432: 3 | I432: 51 | K432: 11 | L432: 6 | M432: 72 | O432: 14 | P432: 10 | Q432: 94 | S432: FOLLETT :HINTON
A433: BEST PLAYERS
A434: WERRIBEE | C434: RAEBURN | F434: CHAPMAN | I434: STOCKWELL | L434: HARRIS | O434: FITZPATRICK | R434: RADCLIFFE
A435: OAKLEIGH | C435: BRIGGS | F435: OWEN | I435: HICKEY | L435: QUIRK | O435: BULTE | R435: MITCHELSON
A436: GOALKICKERS
A437: WERRIBEE | C437: DUGGAN 6 | F437: RAEBURN 4 | I437: STOCKWELL 4 | L437: SIZER 3 | N437: GEARY | P437: McMASTER | R437: MORRIS | U437: WALSH | W437: WALPOLE
A438: OAKLEIGH | C438: OWEN 5 | F438: PRETTO 3 | I438: HOOD 3 | K438: DYSON | M438: MITCHELSON | P438: BULTE
A440: PRAHRAN | C440: 2 | D440: 2 | E440: 14 | G440: 7 | H440: 5 | I440: 47 | K440: 12 | L440: 13 | M440: 85 | O440: 16 | P440: 14 | Q440: 110 | S440: Venue: WILLIAMSTOWN
A441: WILLIAMSTOWN | C441: 2 | D441: 6 | E441: 18 | G441: 3 | H441: 14 | I441: 32 | K441: 8 | L441: 18 | M441: 66 | O441: 10 | P441: 24 | Q441: 84 | S441: CURRAN :MARSHALL
A442: BEST PLAYERS
A443: PRAHRAN | C443: KILEY | F443: MORRISSEY | I443: D'ALESSANDRO | L443: TAPPING
A444: WILLIAMSTOWN | C444: SWAN | F444: ROUND | I444: McTAGGART | L444: PASTORE
A445: GOALKICKERS
A446: PRAHRAN | C446: TAYLOR 7 | F446: RYAN 3 | H446: CUTLER 3 | J446: KILEY | L446: WALFORD | N446: ELKINGTON
A447: WILLIAMSTOWN | C447: PASTORE 4 | F447: BOURIS 4 | I447: AZIZ | K447: CORDY
A449: DANDENONG | C449: 2 | D449: 6 | E449: 18 | G449: 9 | H449: 7 | I449: 61 | K449: 18 | L449: 12 | M449: 120 | O449: 22 | P449: 16 | Q449: 148 | S449: Venue: BOX HILL
A450: BOX HILL | C450: 6 | D450: 2 | E450: 38 | G450: 12 | H450: 5 | I450: 77 | K450: 18 | L450: 6 | M450: 114 | O450: 22 | P450: 8 | Q450: 140 | S450: CAMERON :KHAN
A451: BEST PLAYERS
A452: DANDENONG | C452: MARSHALL | F452: D BOURKE | I452: ELSHAUG | L452: KNIGHT | O452: READ | R452: WICKS
A453: BOX HILL | C453: LISLE | F453: REEVES | I453: MOODY | L453: ROSSELEY
A454: GOALKICKERS
A455: DANDENONG | C455: READ 3 | E455: LACKO 3 | G455: McKENZIE 3 | J455: ATKINSON 3 | M455: MILLIGAN 3 | P455: WICKS 2 | R455: MURRAY | U455: KNIGHT | W455: THIELE | X455: ELSHAUG | AA455: McCORMACK
A456: BOX HILL | C456: HICKS 5 | F456: LAUGHTON 5 | I456: REEVES 4 | K456: NICHOLSON 3 | N456: ROSSELEY 3 | Q456: BUTTIFANT | T456: B HOGAN
A458: COBURG | C458: 4 | D458: 3 | E458: 27 | G458: 12 | H458: 5 | I458: 77 | K458: 16 | L458: 10 | M458: 106 | O458: 21 | P458: 12 | Q458: 138 | S458: Venue: COBURG
A459: PRESTON | C459: 1 | D459: 2 | E459: 8 | G459: 5 | H459: 8 | I459: 38 | K459: 9 | L459: 11 | M459: 65 | O459: 12 | P459: 16 | Q459: 88 | S459: KILNER :GERSCH
A460: BEST PLAYERS
A461: COBURG | C461: LANGAN | F461: INGRAM | I461: REYNOLDSON | L461: LISTON | O461: BARNES | R461: YOUNG
A462: PRESTON | C462: PLOWMAN | F462: PRITCHARD | I462: MARCON | L462: LUMICISI | O462: BURROWS | R462: C LAWSON
A463: GOALKICKERS
A464: COBURG | C464: KAAKOUR 5 | F464: WEATHERALD 5 | J464: REYNOLDSON 5 | M464: LANGAN | O464: ALLISON | Q464: LISTON | S464: ANGWIN | V464: BARNES | X464: INGRAM
A465: PRESTON | C465: SHAW 3 | F465: LUMICISI 3 | I465: MARCON 2 | L465: NICOLAOU | N465: PLOWMAN | Q465: HUNT | S465: PRIDEAUX
A467: ROUND 8 | D467: 2ND JUNE | I467: WEATHER | S467: Venue: FRANKSTON
D468: 1ST QTR | H468: 2ND QTR | L468: 3RD QTR | P468: FINAL | S468: UMPIRES
A469: FRANKSTON | C469: 3 | D469: 4 | E469: 22 | G469: 8 | H469: 8 | I469: 56 | K469: 11 | L469: 15 | M469: 81 | O469: 16 | P469: 17 | Q469: 113 | X469: LADDER | AA469: ROUND | AC469: 8
A470: PORT MELBOURNE | C470: 2 | D470: 2 | E470: 14 | G470: 5 | H470: 4 | I470: 34 | K470: 8 | L470: 7 | M470: 55 | O470: 11 | P470: 9 | Q470: 75
A471: BEST PLAYERS | W471: TEAM | X471: W | Y471: L | Z471: D | AA471: FOR | AB471: AGST | AC471: % | AD471: PTS
A472: FRANKSTON | C472: GAMBLE | F472: S HAMILL | I472: McCARTHY | L472: GARDNER | O472: WEST | R472: O'BRIEN
A473: PORT MELBOURNE | C473: KENNEDY | F473: PRITCHARD | I473: HARKINS | L473: STROOPER | O473: FOLEY | W473: COBURG | X473: 7 | Y473: 1 | Z473: 0 | AA473: 1021 | AB473: 704 | AC473: =(AA473/AB473)*100 -> 145.02840909090909 | AD473: =(X473*4)+(Z473*2) -> 28
A474: GOALKICKERS | W474: SPRINGVALE | X474: 6 | Y474: 2 | Z474: 0 | AA474: 1006 | AB474: 860 | AC474: =(AA474/AB474)*100 -> 116.97674418604652 | AD474: =(X474*4)+(Z474*2) -> 24
A475: FRANKSTON | C475: WEST 6 | F475: S HAMILL 3 | I475: BROWN 2 | K475: P MARTIN 2 | N475: McCARTHY | Q475: BEEL | R475: L GARDNER | W475: DANDEN0NG | X475: 5 | Y475: 2 | Z475: 1 | AA475: 919 | AB475: 789 | AC475: =(AA475/AB475)*100 -> 116.4765525982256 | AD475: =(X475*4)+(Z475*2) -> 22
A476: PORT MELBOURNE | C476: CONDON 4 | F476: HARKINS 2 | I476: HICKS 2 | K476: HETHERTON | N476: LOVE | P476: MUTIMER | W476: WERRIBEE | X476: 5 | Y476: 3 | Z476: 0 | AA476: 1002 | AB476: 763 | AC476: =(AA476/AB476)*100 -> 131.32372214941023 | AD476: =(X476*4)+(Z476*2) -> 20
D477: 3RD JUNE | I477: WEATHER | S477: Venue: BRUNSWICK | W477: WILLIAMSTOWN | X477: 5 | Y477: 3 | Z477: 0 | AA477: 916 | AB477: 780 | AC477: =(AA477/AB477)*100 -> 117.43589743589745 | AD477: =(X477*4)+(Z477*2) -> 20
A478: B'WICK/B'MEAD | C478: 7 | D478: 6 | E478: 48 | G478: 9 | H478: 9 | I478: 63 | K478: 15 | L478: 13 | M478: 103 | O478: 21 | P478: 21 | Q478: 147 | S478: HORTON
A479: SPRINGVALE | C479: 2 | D479: 2 | E479: 14 | G479: 4 | H479: 11 | I479: 35 | K479: 6 | L479: 11 | M479: 47 | O479: 6 | P479: 14 | Q479: 50 | S479: COMPTON | W479: SANDRINGHAM | X479: 5 | Y479: 3 | Z479: 0 | AA479: 953 | AB479: 976 | AC479: =(AA479/AB479)*100 -> 97.643442622950815 | AD479: =(X479*4)+(Z479*2) -> 20
A480: BEST PLAYERS | W480: B'WICK/B'MEAD | X480: 4 | Y480: 4 | Z480: 0 | AA480: 970 | AB480: 850 | AC480: =(AA480/AB480)*100 -> 114.11764705882352 | AD480: =(X480*4)+(Z480*2) -> 16
A481: B'WICK/B'MEAD | C481: BERTOLLO | F481: EAMES | I481: POTTER | L481: CALLANDER | O481: McALLESTER | W481: FRANKSTON | X481: 4 | Y481: 4 | Z481: 0 | AA481: 977 | AB481: 902 | AC481: =(AA481/AB481)*100 -> 108.3148558758315 | AD481: =(X481*4)+(Z481*2) -> 16
A482: SPRINGVALE | C482: DUDLEY | F482: SMIT | I482: CLARK | L482: ROBINSON | W482: PORT MELBOURNE | X482: 4 | Y482: 4 | Z482: 0 | AA482: 929 | AB482: 983 | AC482: =(AA482/AB482)*100 -> 94.506612410986776 | AD482: =(X482*4)+(Z482*2) -> 16
A483: GOALKICKERS | P483: WRIGHT | W483: PRAHRAN | X483: 4 | Y483: 4 | Z483: 0 | AA483: 776 | AB483: 914 | AC483: =(AA483/AB483)*100 -> 84.901531728665205 | AD483: =(X483*4)+(Z483*2) -> 16
A484: B'WICK/B'MEAD | C484: REID 5 | E484: DRAIN 5 | G484: GRIFFITHS 4 | I484: BEALE | K484: BERTOLLO | M484: BONE | N484: CALLANDER | Q484: DAVIS | R484: POTTER | W484: PRESTON | X484: 3 | Y484: 4 | Z484: 1 | AA484: 919 | AB484: 910 | AC484: =(AA484/AB484)*100 -> 100.98901098901098 | AD484: =(X484*4)+(Z484*2) -> 14
A485: SPRINGVALE | C485: ROBINSON 4 | F485: MITHEN | H485: KOOP | W485: BOX HILL | X485: 2 | Y485: 6 | Z485: 0 | AA485: 980 | AB485: 973 | AC485: =(AA485/AB485)*100 -> 100.71942446043165 | AD485: =(X485*4)+(Z485*2) -> 8
S486: Venue: OAKLEIGH | W486: OAKLEIGH | X486: 1 | Y486: 7 | Z486: 0 | AA486: 872 | AB486: 1117 | AC486: =(AA486/AB486)*100 -> 78.06624888093107 | AD486: =(X486*4)+(Z486*2) -> 4
A487: OAKLEIGH | C487: 8 | D487: 8 | E487: 56 | G487: 11 | H487: 13 | I487: 79 | K487: 19 | L487: 18 | M487: 132 | O487: 25 | P487: 19 | Q487: 169 | S487: KEATING | W487: CAMBERWELL | X487: 0 | Y487: 8 | Z487: 0 | AA487: 595 | AB487: 1308 | AC487: =(AA487/AB487)*100 -> 45.489296636085626 | AD487: =(X487*4)+(Z487*2) -> 0
A488: CAMBERWELL | C488: 1 | D488: 1 | E488: 7 | G488: 7 | H488: 2 | I488: 44 | K488: 11 | L488: 4 | M488: 70 | O488: 19 | P488: 9 | Q488: 123 | S488: KILNER
A489: BEST PLAYERS
A490: OAKLEIGH | C490: QUIRK | F490: DYSON | I490: MELLODY | L490: SMITH | O490: MITCHELSON | R490: B MARSHALL
A491: CAMBERWELL | C491: WILKINSON | F491: R VITACCA | I491: T VITACCA | L491: WYNN | O491: H MITCHELL
A492: GOALKICKERS | O492: MITCHELSON 2 | S492: SMITH
A493: OAKLEIGH | C493: PRETTO 4 | E493: GARBUIO 4 | G493: DYSON 3 | I493: MELLODY 3 | L493: OWEN 3 | N493: COWLED 3 | Q493: QUIRK 2
A494: CAMBERWELL | C494: WILKINSON 6 | F494: MCKENZIE 3 | I494: ZANIC 3 | K494: MERTON 2 | M494: FITZPATRICK 2 | P494: WYNN | R494: SETON
O495: VERESHAKA
A496: COBURG | C496: 2 | D496: 2 | E496: 14 | G496: 8 | H496: 7 | I496: 55 | K496: 11 | L496: 11 | M496: 77 | O496: 13 | P496: 17 | Q496: 95 | S496: Venue: WERRIBEE
A497: WERRIBEE | C497: 3 | D497: 2 | E497: 20 | G497: 6 | H497: 6 | I497: 42 | K497: 9 | L497: 9 | M497: 63 | O497: 12 | P497: 9 | Q497: 81 | S497: CAMERON :MORRIS
A498: BEST PLAYERS
A499: COBURG | C499: TARANTO | F499: BURKE | I499: ALLISON | L499: INGRAM | O499: SHELDON | R499: LITTLER
A500: WERRIBEE | C500: CHAPMAN | F500: ALLDAY | I500: SPIERINGS | L500: MCMASTER | O500: WALSH | R500: RAEBURN
A501: GOALKICKERS
A502: COBURG | C502: WEATHERALD 4 | F502: ALLISON 3 | I502: DARBY 2 | K502: BURKE 2 | M502: YOUNG | O502: REYNOLDSON
A503: WERRIBEE | C503: HARRIS 3 | F503: BUTTON 2 | I503: DUGGAN 2 | K503: WALSH 2 | M503: SIZER | O503: FLEMING | Q503: McMASTER
A505: WILLIAMSTOWN | C505: 2 | D505: 6 | E505: 18 | G505: 11 | H505: 10 | I505: 76 | K505: 14 | L505: 16 | M505: 100 | O505: 17 | P505: 25 | Q505: 127 | S505: Venue: BEACH ROAD
A506: SANDRINGHAM | C506: 6 | D506: 3 | E506: 39 | G506: 8 | H506: 6 | I506: 54 | K506: 13 | L506: 11 | M506: 89 | O506: 16 | P506: 13 | Q506: 109 | S506: HARRIS :COATES
A507: BEST PLAYERS
A508: WILLIAMSTOWN | C508: CORDY | F508: McTAGGART | I508: ROUND | L508: BURTON | O508: JOHNSON | R508: OWEN
A509: PRAHRAN | C509: EAVES | F509: PETERS | I509: McGANNON | L509: PRATT | O509: ALLEN | R509: SCHLEIGER
A510: GOALKICKERS
A511: WILLIAMSTOWN | C511: RICKMAN 5 | F511: BURTON 3 | I511: BOURIS 2 | K511: CORDY 2 | M511: McDONALD | P511: SMITH | R511: JOHNSON | U511: MILES | W511: SLEVISON
A512: PRAHRAN | C512: EAVES 7 | F512: BERGMAN 4 | I512: F RUGOLO 3 | L512: HOWARD | N512: PRATT
A514: BOX HILL | C514: 4 | D514: 5 | E514: 29 | G514: 10 | H514: 7 | I514: 67 | K514: 15 | L514: 9 | M514: 99 | O514: 23 | P514: 10 | Q514: 148 | S514: Venue: TOORAK PARK
A515: PRAHRAN | C515: 2 | D515: 3 | E515: 15 | G515: 5 | H515: 3 | I515: 33 | K515: 11 | L515: 4 | M515: 70 | O515: 15 | P515: 6 | Q515: 96 | S515: HOWLETT :GERSCH
A516: BEST PLAYERS
A517: BOX HILL | C517: ZARAFA | F517: B HOGAN | I517: ROSSELEY | L517: PENNY | O517: O'NEILL
A518: PRAHRAN | C518: MARK | F518: RYAN | I518: MORRISSEY | L518: WALFORD
A519: GOALKICKERS
A520: BOX HILL | C520: LAUGHTON 6 | F520: PENNY 3 | H520: ZARAFA 3 | J520: NICHOLSON 3 | M520: REEVES 3 | O520: LISLE 2 | Q520: BUTTIFANT 2 | T520: A HAMILTON
A521: PRAHRAN | C521: TAYLOR 5 | F521: D'ALESSANDRO 2 | J521: DUNLOP 2 | M521: R JOHNSON | P521: RYAN | R521: KILEY | T521: CUTLER | W521: WALFORD | X521: ASHCROFT
E522: 9TH JUNE | I522: WEATHER
A523: DANDENONG | C523: 3 | D523: 2 | E523: 20 | G523: 6 | H523: 9 | I523: 45 | K523: 8 | L523: 11 | M523: 59 | O523: 14 | P523: 17 | Q523: 101 | S523: Venue: DANDENONG
A524: PRESTON | C524: 1 | D524: 1 | E524: 7 | G524: 6 | H524: 1 | I524: 37 | K524: 10 | L524: 4 | M524: 64 | O524: 16 | P524: 5 | Q524: 101 | S524: FOLLETT :SNEDDON
A525: BEST PLAYERS
A526: DANDENONG | C526: READ | F526: D BOURKE | I526: WICKS
A527: PRESTON | C527: PRITCHARD | F527: HALL | I527: PRIDEAUX | L527: OWEN | O527: LUMICISI | R527: MARCON
A528: GOALKICKERS
A529: DANDENONG | C529: MCKENZIE 4 | F529: READ 2 | H529: WICKS 2 | J529: MILLIGAN 2 | M529: MURRAY | O529: LACKO | Q529: GREEN | S529: TODD
A530: PRESTON | C530: SHAW 4 | F530: LUMICISI 3 | I530: MARCON 3 | L530: NICOLAOU 2 | O530: PRIDEAUX 2 | R530: PLOWMAN | U530: GILLARD
A532: ROUND 9 | D532: 16TH JUNE | I532: WEATHER | S532: Venue: PORT MELBOURNE
D533: 1ST QTR | H533: 2ND QTR | L533: 3RD QTR | P533: FINAL | S533: UMPIRES
A534: OAKLEIGH | C534: 4 | D534: 3 | E534: 27 | G534: 7 | H534: 8 | I534: 50 | K534: 16 | L534: 10 | M534: 106 | O534: 22 | P534: 13 | Q534: 145 | S534: COATES | X534: LADDER | AA534: ROUND | AC534: 9
A535: PORT MELBOURNE | C535: 4 | D535: 3 | E535: 27 | G535: 11 | H535: 7 | I535: 73 | K535: 17 | L535: 8 | M535: 110 | O535: 19 | P535: 13 | Q535: 127 | S535: GERSCH
A536: BEST PLAYERS | W536: TEAM | X536: W | Y536: L | Z536: D | AA536: FOR | AB536: AGST | AC536: % | AD536: PTS
A537: OAKLEIGH | C537: GARBUIO | F537: PRETTO | I537: OWEN | L537: QUIRK | O537: MELLODY | R537: DYSON
A538: PORT MELBOURNE | C538: HETHERTON | F538: CONDON | I538: PRITCHARD | L538: LOVE | O538: HARKINS | W538: COBURG | X538: 8 | Y538: 1 | Z538: 0 | AA538: 1130 | AB538: 806 | AC538: =(AA538/AB538)*100 -> 140.1985111662531 | AD538: =(X538*4)+(Z538*2) -> 32
A539: GOALKICKERS | W539: SPRINGVALE | X539: 7 | Y539: 2 | Z539: 0 | AA539: 1181 | AB539: 929 | AC539: =(AA539/AB539)*100 -> 127.1259418729817 | AD539: =(X539*4)+(Z539*2) -> 28
A540: OAKLEIGH | C540: PRETTO 10 | F540: OWEN 6 | H540: MITCHELSON 2 | K540: QUIRK | M540: WELSFORD | P540: MELLODY | R540: GARBUIO | W540: WERRIBEE | X540: 6 | Y540: 3 | Z540: 0 | AA540: 1123 | AB540: 855 | AC540: =(AA540/AB540)*100 -> 131.34502923976606 | AD540: =(X540*4)+(Z540*2) -> 24
A541: PORT MELBOURNE | C541: CONDON 7 | F541: HICKS 3 | H541: HARKINS 2 | J541: FOLEY | L541: KENNEDY | N541: HETHERTON | Q541: LOVE | R541: COLLINS | W541: WILLIAMSTOWN | X541: 6 | Y541: 3 | Z541: 0 | AA541: 986 | AB541: 829 | AC541: =(AA541/AB541)*100 -> 118.93848009650181 | AD541: =(X541*4)+(Z541*2) -> 24
D542: 17TH JUNE | I542: WEATHER | N542: WALL | P542: PIGGOTT | S542: Venue: SPRINGVALE | W542: SANDRINGHAM | X542: 6 | Y542: 3 | Z542: 0 | AA542: 1105 | AB542: 1108 | AC542: =(AA542/AB542)*100 -> 99.729241877256314 | AD542: =(X542*4)+(Z542*2) -> 24
A543: SPRINGVALE | C543: 5 | D543: 4 | E543: 34 | G543: 13 | H543: 8 | I543: 86 | K543: 18 | L543: 12 | M543: 120 | O543: 26 | P543: 19 | Q543: 175 | S543: MORROW
A544: FRANKSTON | C544: 3 | D544: 2 | E544: 20 | G544: 8 | H544: 5 | I544: 53 | K544: 8 | L544: 9 | M544: 57 | O544: 10 | P544: 9 | Q544: 69 | S544: FORSTER | W544: DANDEN0NG | X544: 5 | Y544: 3 | Z544: 1 | AA544: 1021 | AB544: 898 | AC544: =(AA544/AB544)*100 -> 113.69710467706014 | AD544: =(X544*4)+(Z544*2) -> 22
A545: BEST PLAYERS | W545: PRESTON | X545: 4 | Y545: 4 | Z545: 1 | AA545: 1017 | AB545: 981 | AC545: =(AA545/AB545)*100 -> 103.6697247706422 | AD545: =(X545*4)+(Z545*2) -> 18
A546: SPRINGVALE | C546: ATKINS | F546: P MALONI | I546: MAYLIN | L546: DEMPSTER | O546: SECCULL | R546: MENDE | W546: B'WICK/B'MEAD | X546: 4 | Y546: 5 | Z546: 0 | AA546: 1019 | AB546: 920 | AC546: =(AA546/AB546)*100 -> 110.7608695652174 | AD546: =(X546*4)+(Z546*2) -> 16
A547: FRANKSTON | C547: GAHAN | F547: AMOORE | I547: T HAMILL | L547: D MARTIN | W547: FRANKSTON | X547: 4 | Y547: 5 | Z547: 0 | AA547: 1046 | AB547: 1077 | AC547: =(AA547/AB547)*100 -> 97.121634168987924 | AD547: =(X547*4)+(Z547*2) -> 16
A548: GOALKICKERS | P548: MENDE | W548: PORT MELBOURNE | X548: 4 | Y548: 5 | Z548: 0 | AA548: 1056 | AB548: 1128 | AC548: =(AA548/AB548)*100 -> 93.61702127659575 | AD548: =(X548*4)+(Z548*2) -> 16
A549: SPRINGVALE | C549: KEIPERT 5 | E549: PHILLIPS 4 | G549: PROSSER 3 | I549: ATKINS 3 | K549: MAYLIN 3 | M549: T DWYER 3 | P549: DEMPSTER 3 | R549: KOOP | W549: PRAHRAN | X549: 4 | Y549: 5 | Z549: 0 | AA549: 847 | AB549: 1012 | AC549: =(AA549/AB549)*100 -> 83.695652173913047 | AD549: =(X549*4)+(Z549*2) -> 16
A550: FRANKSTON | C550: BEEL 2 | E550: S HAMILL | G550: WEST | I550: BELL | J550: O'NEILL | L550: O'BRIEN | N550: BOONKAMP | Q550: COUGHLIN | W550: BOX HILL | X550: 2 | Y550: 7 | Z550: 0 | AA550: 1112 | AB550: 1125 | AC550: =(AA550/AB550)*100 -> 98.844444444444449 | AD550: =(X550*4)+(Z550*2) -> 8
O551: P MARTIN | S551: Venue: CAMBERWELL | W551: OAKLEIGH | X551: 2 | Y551: 7 | Z551: 0 | AA551: 1017 | AB551: 1254 | AC551: =(AA551/AB551)*100 -> 81.100478468899524 | AD551: =(X551*4)+(Z551*2) -> 8
A552: WERRIBEE | C552: 8 | D552: 5 | E552: 53 | G552: 11 | H552: 5 | I552: 71 | K552: 15 | L552: 3 | M552: 93 | O552: 19 | P552: 7 | Q552: 121 | S552: SIGMONT | W552: CAMBERWELL | X552: 0 | Y552: 9 | Z552: 0 | AA552: 687 | AB552: 1429 | AC552: =(AA552/AB552)*100 -> 48.075577326801962 | AD552: =(X552*4)+(Z552*2) -> 0
A553: CAMBERWELL | C553: 3 | D553: 6 | E553: 24 | G553: 6 | H553: 14 | I553: 50 | K553: 9 | L553: 15 | M553: 69 | O553: 12 | P553: 20 | Q553: 92 | S553: SAMPSON
A554: BEST PLAYERS
A555: WERRIBEE | C555: SPIERINGS | F555: ALLDAY | I555: CHAPMAN | L555: SIZER | O555: WALSH
A556: CAMBERWELL | C556: GREIG | F556: T VITACCA | I556: HOLLOWAY | L556: MERTON | O556: SETON | R556: PANZA
A557: GOALKICKERS
A558: WERRIBEE | C558: O'KEEFE 5 | F558: SIZER 4 | H558: GEARY 3 | J558: FENTON 2 | M558: CHAPMAN 2 | P558: STOCKWELL | S558: McMASTER | V558: WALSH
A559: CAMBERWELL | C559: WILKINSON 3 | F559: MERTON 3 | I559: GREIG | K559: T VITACCA | M559: SETON | O559: POWELL | Q559: CLARKE | S559: WYNN
A561: WILLIAMSTOWN | C561: 3 | D561: 3 | E561: 21 | G561: 4 | H561: 6 | I561: 30 | K561: 9 | L561: 10 | M561: 64 | O561: 10 | P561: 10 | Q561: 70 | S561: Venue: WILLIAMSTOWN
A562: B'WICK/B'MEAD | C562: 3 | D562: 7 | E562: 25 | G562: 4 | H562: 8 | I562: 32 | K562: 5 | L562: 10 | M562: 40 | O562: 6 | P562: 13 | Q562: 49 | S562: HOWLETT :ALLEN
A563: BEST PLAYERS
A564: WILLIAMSTOWN | C564: PASTORE | F564: McTAGGART | I564: ROUND | L564: AZIZ | O564: MITCHELL | R564: LLOYD
A565: B'WICK/B'MEAD | C565: EAMES | F565: McALLESTER | I565: CONNELL
A566: GOALKICKERS
A567: WILLIAMSTOWN | C567: RICKMAN 3 | F567: BURTON 2 | I567: ROUND 2 | L567: McDONALD | O567: SMITH | Q567: McTAGGART
A568: B'WICK/B'MEAD | C568: BONE 2 | F568: DAVIS 2 | I568: GRIFFITHS | L568: BERTOLLO
A570: SANDRINGHAM | C570: 9 | D570: 4 | E570: 58 | G570: 10 | H570: 6 | I570: 66 | K570: 15 | L570: 10 | M570: 100 | O570: 23 | P570: 14 | Q570: 152 | S570: Venue: BOX HILL
A571: BOX HILL | C571: 2 | D571: 2 | E571: 14 | G571: 8 | H571: 4 | I571: 52 | K571: 15 | L571: 9 | M571: 99 | O571: 20 | P571: 12 | Q571: 132 | S571: SNEDDON :MURNANE
A572: BEST PLAYERS
A573: SANDRINGHAM
A574: BOX HILL | C574: HICKS | F574: LISLE | I574: DALRYMPLE | L574: BRUSNAHAN | O574: ROSSELEY
A575: GOALKICKERS
A576: SANDRINGHAM | C576: PETERS 6 | F576: F RUGOLO 6 | I576: HIBBERT 4 | L576: EAVES 2 | N576: CULLINANE 2 | Q576: HOWARD | S576: BERGMAN | V576: ALLEN
A577: BOX HILL | C577: ZARAFA 4 | F577: A HAMILTON 3 | I577: HOCKING 3 | L577: HOLT 3 | N577: LAUGHTON 3 | Q577: ROSSELEY 2 | T577: LISLE | V577: DALRYMPLE
A579: PRESTON | C579: 3 | D579: 2 | E579: 20 | G579: 6 | H579: 8 | I579: 44 | K579: 9 | L579: 9 | M579: 63 | O579: 14 | P579: 14 | Q579: 98 | S579: Venue: PRESTON
A580: PRAHRAN | C580: 4 | D580: 1 | E580: 25 | G580: 6 | H580: 3 | I580: 39 | K580: 9 | L580: 4 | M580: 58 | O580: 11 | P580: 5 | Q580: 71 | S580: KEATING :TURNHAM
A581: BEST PLAYERS
A582: PRESTON | C582: MAZOCCA | F582: BURROWS | I582: NICOLAOU | L582: C LAWSON | O582: PRITCHARD | R582: HUNT
A583: PRAHRAN | C583: MORRISSEY | F583: D'ALESSANDRO | I583: TAPPING | L583: PAGE
A584: GOALKICKERS
A585: PRESTON | C585: NICOLAOU 5 | F585: SHAW 4 | H585: SALVADORE | K585: LUMICISI | M585: HUNT | O585: HALAS | Q585: DINTINOSANTE
A586: PRAHRAN | C586: WILLIAMSON 5 | F586: TAYLOR | H586: SOULOS | J586: R JOHNSON | M586: RYAN | O586: KILEY | Q586: MARK
A588: COBURG | C588: 5 | D588: 2 | E588: 32 | G588: 6 | H588: 5 | I588: 41 | K588: 13 | L588: 10 | M588: 88 | O588: 16 | P588: 13 | Q588: 109 | S588: Venue: COBURG
A589: DANDENONG | C589: 4 | D589: 4 | E589: 28 | G589: 8 | H589: 6 | I589: 54 | K589: 9 | L589: 7 | M589: 61 | O589: 15 | P589: 12 | Q589: 102 | S589: NOLAN :THOMPSON
A590: BEST PLAYERS
A591: COBURG | C591: TARANTO | F591: BURKE | I591: INGRAM | L591: COMITO | O591: SULLIVAN | R591: BARNES
A592: DANDENONG | C592: MURRAY | F592: READ | I592: D BOURKE | L592: GREEN | O592: McCONCHIE | R592: GILDER
A593: GOALKICKERS
A594: COBURG | C594: WEATHERALD 5 | F594: WILLIAMS 2 | I594: COMITO 2 | K594: KAAKOUR | M594: LANGAN | O594: REYNOLDSON | R594: BURKE | T594: TARANTO | W594: LITTLER | X594: NIMMO
A595: DANDENONG | C595: READ 3 | E595: McKENZIE 3 | H595: MILLANE 2 | J595: LACKO | L595: ELSHAUG | N595: D M BOURKE | Q595: MILLIGAN | S595: GREEN | U595: McCONCHIE | X595: J MARSHALL
A597: ROUND 10 | D597: 23RD JUNE | I597: WEATHER | S597: Venue: DANDENONG
D598: 1ST QTR | H598: 2ND QTR | L598: 3RD QTR | P598: FINAL | S598: UMPIRES
A599: DANDENONG | C599: 5 | D599: 6 | E599: 36 | G599: 15 | H599: 11 | I599: 101 | K599: 18 | L599: 16 | M599: 124 | O599: 21 | P599: 25 | Q599: 151 | X599: LADDER | AA599: ROUND | AC599: 10
A600: PRAHRAN | C600: 4 | D600: 3 | E600: 27 | G600: 6 | H600: 4 | I600: 40 | K600: 8 | L600: 7 | M600: 55 | O600: 11 | P600: 12 | Q600: 78
A601: BEST PLAYERS | W601: TEAM | X601: W | Y601: L | Z601: D | AA601: FOR | AB601: AGST | AC601: % | AD601: PTS
A602: DANDENONG | C602: WICKS | F602: KNIGHT | I602: READ | L602: ELSHAUGH | O602: GREEN | Q602: MILLANE
A603: PRAHRAN | C603: SHORTHOUSE | F603: WILLIAMSON | I603: WALFORD | L603: R JOHNSON | O603: PAGE | Q603: WALLACE | W603: COBURG | X603: 9 | Y603: 1 | Z603: 0 | AA603: 1290 | AB603: 888 | AC603: =(AA603/AB603)*100 -> 145.27027027027026 | AD603: =(X603*4)+(Z603*2) -> 36
A604: GOALKICKERS | P604: McCORMACK | W604: SPRINGVALE | X604: 8 | Y604: 2 | Z604: 0 | AA604: 1346 | AB604: 922 | AC604: =(AA604/AB604)*100 -> 145.98698481561823 | AD604: =(X604*4)+(Z604*2) -> 32
A605: DANDENONG | C605: WICKS 7 | E605: READ 4 | G605: KNIGHT 3 | I605: MILLIGAN 3 | L605: ELSHAUG | N605: MCKENZIE | Q605: D M BOURKE | W605: WILLIAMSTOWN | X605: 7 | Y605: 3 | Z605: 0 | AA605: 1129 | AB605: 886 | AC605: =(AA605/AB605)*100 -> 127.42663656884876 | AD605: =(X605*4)+(Z605*2) -> 28
A606: PRAHRAN | C606: WILLIAMSON 7 | G606: R JOHNSON 3 | J606: EVANS | W606: DANDEN0NG | X606: 6 | Y606: 3 | Z606: 1 | AA606: 1172 | AB606: 976 | AC606: =(AA606/AB606)*100 -> 120.08196721311475 | AD606: =(X606*4)+(Z606*2) -> 26
D607: 24TH JUNE | I607: WEATHER | S607: Venue: BEACH ROAD | W607: WERRIBEE | X607: 6 | Y607: 4 | Z607: 0 | AA607: 1244 | AB607: 1027 | AC607: =(AA607/AB607)*100 -> 121.12950340798443 | AD607: =(X607*4)+(Z607*2) -> 24
A608: PRESTON | C608: 5 | D608: 1 | E608: 31 | G608: 10 | H608: 6 | I608: 66 | K608: 13 | L608: 6 | M608: 84 | O608: 20 | P608: 9 | Q608: 129 | S608: MORROW
A609: SANDRINGHAM | C609: 5 | D609: 5 | E609: 35 | G609: 9 | H609: 10 | I609: 64 | K609: 12 | L609: 17 | M609: 89 | O609: 12 | P609: 18 | Q609: 90 | S609: FORSTER | W609: SANDRINGHAM | X609: 6 | Y609: 4 | Z609: 0 | AA609: 1195 | AB609: 1237 | AC609: =(AA609/AB609)*100 -> 96.604688763136622 | AD609: =(X609*4)+(Z609*2) -> 24
A610: BEST PLAYERS | W610: PRESTON | X610: 5 | Y610: 4 | Z610: 1 | AA610: 1146 | AB610: 891 | AC610: =(AA610/AB610)*100 -> 128.61952861952861 | AD610: =(X610*4)+(Z610*2) -> 22
A611: PRESTON | C611: SHAW | F611: HALL | I611: MAZOCCA | L611: HALAS | O611: LUMICISI | R611: OWEN | W611: B'WICK/B'MEAD | X611: 5 | Y611: 5 | Z611: 0 | AA611: 1115 | AB611: 1008 | AC611: =(AA611/AB611)*100 -> 110.61507936507937 | AD611: =(X611*4)+(Z611*2) -> 20
A612: SANDRINGHAM | C612: J RUGOLO | F612: F RUGOLO | I612: PETERS | L612: HALPHEN | O612: BERGMAN | W612: PORT MELBOURNE | X612: 5 | Y612: 5 | Z612: 0 | AA612: 1228 | AB612: 1249 | AC612: =(AA612/AB612)*100 -> 98.31865492393915 | AD612: =(X612*4)+(Z612*2) -> 20
A613: GOALKICKERS | W613: FRANKSTON | X613: 4 | Y613: 6 | Z613: 0 | AA613: 1103 | AB613: 1220 | AC613: =(AA613/AB613)*100 -> 90.409836065573771 | AD613: =(X613*4)+(Z613*2) -> 16
A614: PRESTON | C614: SHAW 9 | E614: HALAS 3 | G614: NICOLAOU 2 | J614: DINTINOSANTE 2 | M614: LUMICISI | O614: VALKANIS | Q614: JORDAN | S614: HALL | W614: PRAHRAN | X614: 4 | Y614: 6 | Z614: 0 | AA614: 925 | AB614: 1163 | AC614: =(AA614/AB614)*100 -> 79.535683576956146 | AD614: =(X614*4)+(Z614*2) -> 16
A615: SANDRINGHAM | C615: F RUGOLO 7 | F615: BERGMAN 2 | I615: FOLEY | K615: FITZGERALD | N615: CULLINANE | W615: BOX HILL | X615: 2 | Y615: 8 | Z615: 0 | AA615: 1200 | AB615: 1219 | AC615: =(AA615/AB615)*100 -> 98.441345365053323 | AD615: =(X615*4)+(Z615*2) -> 8
S616: Venue: OAKLEIGH | W616: OAKLEIGH | X616: 2 | Y616: 8 | Z616: 0 | AA616: 1110 | AB616: 1414 | AC616: =(AA616/AB616)*100 -> 78.500707213578508 | AD616: =(X616*4)+(Z616*2) -> 8
A617: SPRINGVALE | C617: 6 | D617: 1 | E617: 37 | G617: 10 | H617: 3 | I617: 63 | K617: 20 | L617: 9 | M617: 129 | O617: 25 | P617: 15 | Q617: 165 | S617: SAMSON | W617: CAMBERWELL | X617: 0 | Y617: 10 | Z617: 0 | AA617: 769 | AB617: 1589 | AC617: =(AA617/AB617)*100 -> 48.395217117684084 | AD617: =(X617*4)+(Z617*2) -> 0
A618: OAKLEIGH | C618: 2 | D618: 4 | E618: 16 | G618: 9 | H618: 6 | I618: 60 | K618: 10 | L618: 6 | M618: 66 | O618: 14 | P618: 9 | Q618: 93 | S618: TURNHAM
A619: BEST PLAYERS
A620: SPRINGVALE | C620: ATKINS | F620: DEMPSTER | I620: JEFFS | L620: MATHESON | O620: SMIT | Q620: MORGAN
A621: OAKLEIGH | C621: MITCHELSON | F621: BRIGGS | I621: GARBUIO | L621: CUNNINGHAM
A622: GOALKICKERS | M622: MAYLIN 2 | P622: KEIPERT | R622: M MALONI
A623: SPRINGVALE | C623: DEMPSTER 6 | F623: ROBINSON 4 | I623: ATKINS 3 | K623: P MALONI 3 | N623: PHILLIPS 3 | Q623: PROSSER 2
A624: OAKLEIGH | C624: PRETTO 5 | F624: QUIRK 2 | H624: DYSON 2 | J624: WELSFORD 2 | M624: OWEN | O624: GARBUIO | Q624: COWLED
A626: COBURG | C626: 10 | D626: 7 | E626: 67 | G626: 14 | H626: 10 | I626: 94 | K626: 19 | L626: 21 | M626: 135 | O626: 22 | P626: 28 | Q626: 160 | S626: Venue: CAMBERWELL
A627: CAMBERWELL | C627: 0 | D627: 0 | E627: 0 | G627: 5 | H627: 8 | I627: 38 | K627: 5 | L627: 10 | M627: 40 | O627: 12 | P627: 10 | Q627: 82 | S627: HINTON :KEATING
A628: BEST PLAYERS
A629: COBURG | C629: INGRAM | F629: COMITO | I629: WEATHERALD | L629: BARNES | O629: SHELDON
A630: CAMBERWELL | C630: GREIG | F630: R VITACCA | I630: WYNN | L630: J VITACCA | O630: SETON
A631: GOALKICKERS
A632: COBURG | C632: WEATHERALD 9 | F632: COMITO 4 | I632: WILLIAMS 3 | L632: ALLISON | N632: LISTON | P632: DARBY | R632: BURKE | T632: SHELDON | W632: SULLIVAN
A633: CAMBERWELL | C633: RICHARDSON 3 | F633: DIPIERDOMENICO 2 | J633: WYNN 2 | L633: R VITACCA 2 | O633: WILKINSON | R633: GREIG | T633: KENNEDY
A635: WILLIAMSTOWN | C635: 2 | D635: 2 | E635: 14 | G635: 10 | H635: 6 | I635: 66 | K635: 13 | L635: 10 | M635: 88 | O635: 22 | P635: 11 | Q635: 143 | S635: Venue: FRANKSTON
A636: FRANKSTON | C636: 5 | D636: 2 | E636: 32 | G636: 5 | H636: 4 | I636: 34 | K636: 8 | L636: 7 | M636: 55 | O636: 8 | P636: 9 | Q636: 57 | S636: BULLUSS :ALLAN
A637: BEST PLAYERS
A638: WILLIAMSTOWN | C638: ROUND | F638: McTAGGART | I638: SWAN | L638: LLOYD | N638: BURTON | Q638: SMITH
A639: FRANKSTON | C639: McCARTHY | F639: T HAMILL | I639: AMOORE | L639: GAMBLE | N639: S HAMILL | Q639: DENEREAZ
A640: GOALKICKERS
A641: WILLIAMSTOWN | C641: BURTON 5 | F641: RICKMAN 4 | I641: MILES 4 | K641: SWAN 2 | M641: MINETT 2 | O641: SMITH 2 | Q641: McDONALD | T641: BOURIS | W641: O'CONNOR
A642: FRANKSTON | C642: BELL 3 | F642: BINGLEY 2 | I642: BROWN | K642: O'BRIEN | M642: P MARTIN
A644: PORT MELBOURNE | C644: 8 | D644: 3 | E644: 51 | G644: 11 | H644: 4 | I644: 70 | K644: 22 | L644: 10 | M644: 142 | O644: 27 | P644: 10 | Q644: 172 | S644: Venue: WERRIBEE
A645: WERRIBEE | C645: 4 | D645: 2 | E645: 26 | G645: 9 | H645: 9 | I645: 63 | K645: 11 | L645: 11 | M645: 77 | O645: 18 | P645: 13 | Q645: 121 | S645: HOWLETT :THOMPSON
A646: BEST PLAYERS
A647: PORT MELBOURNE | C647: LOVE | F647: HARKINS | I647: STROOPER | L647: PRITCHARD | O647: HETHERTON | R647: FOLEY
A648: WERRIBEE | C648: KNIGHT | F648: RAEBURN | I648: FITZPATRICK | L648: O'KEEFE
A649: GOALKICKERS
A650: PORT MELBOURNE | C650: LOVE 10 | F650: CONDON 4 | I650: HARKINS 4 | L650: KENNEDY 4 | N650: FOLEY 2 | P650: HICKS 2 | R650: TEMAY
A651: WERRIBEE | C651: GEARY 5 | F651: RAEBURN 5 | I651: SIZER | K651: SELLS | M651: RADCLIFFE | P651: FENTON | R651: MORRIS
A653: B'WICK/B'MEAD | C653: 4 | D653: 2 | E653: 26 | G653: 9 | H653: 4 | I653: 58 | K653: 12 | L653: 8 | M653: 80 | O653: 14 | P653: 10 | Q653: 94 | S653: Venue: BRUNSWICK
A654: BOX HILL | C654: 2 | D654: 3 | E654: 15 | G654: 3 | H654: 10 | I654: 28 | K654: 5 | L654: 16 | M654: 46 | O654: 11 | P654: 22 | Q654: 88 | S654: HARVEY :NOLAN
A655: BEST PLAYERS
A656: B'WICK/B'MEAD | C656: BEALE | F656: BONE | I656: CONNELL | L656: EAMES | O656: McALLESTER | R656: DAVIS
A657: BOX HILL | C657: LISLE | F657: HANDLEY | I657: FRANCIS | L657: ROSSELEY | O657: BRUSNAHAN
A658: GOALKICKERS
A659: B'WICK/B'MEAD | C659: GRIFFITHS 2 | F659: CALLANDER 2 | I659: DAVIS 2 | K659: READ 2 | M659: BEALE | O659: BONE | Q659: WRIGHT | S659: LUMSDEN | V659: DUGGAN | X659: DRAIN
A660: BOX HILL | C660: ZARAFA 2 | F660: BANFIELD 2 | I660: P HAMILTON 2 | L660: A HAMILTON | O660: BOLTON | Q660: BUTTIFANT | T660: HANDLEY | W660: ROSSELEY
A662: ROUND 11 | D662: 30TH JUNE | I662: WEATHER | S662: Venue: PORT MELBOURNE
D663: 1ST QTR | H663: 2ND QTR | L663: 3RD QTR | P663: FINAL | S663: UMPIRES
A664: WERRIBEE | C664: 5 | D664: 5 | E664: 35 | G664: 7 | H664: 7 | I664: 49 | K664: 13 | L664: 11 | M664: 89 | O664: 17 | P664: 12 | Q664: 114 | S664: BULLUSS | X664: LADDER | AA664: ROUND | AC664: 11
A665: SPRINGVALE | C665: 3 | D665: 3 | E665: 21 | G665: 6 | H665: 7 | I665: 43 | K665: 9 | L665: 8 | M665: 62 | O665: 13 | P665: 12 | Q665: 90 | S665: HARVEY
A666: BEST PLAYERS | W666: TEAM | X666: W | Y666: L | Z666: D | AA666: FOR | AB666: AGST | AC666: % | AD666: PTS
A667: WERRIBEE | C667: RADCLIFFE | F667: LESIPUTTY | I667: O'KEEFE | L667: DOMBERG | O667: ALLDAY | R667: KNIGHT
A668: SPRINGVALE | C668: MORGAN | F668: MAYLIN | I668: DEMPSTER | L668: PHILLIPS | O668: ATKINS | W668: COBURG | X668: 10 | Y668: 1 | Z668: 0 | AA668: 1434 | AB668: 998 | AC668: =(AA668/AB668)*100 -> 143.68737474949899 | AD668: =(X668*4)+(Z668*2) -> 40
A669: GOALKICKERS | P669: SPIERINGS | W669: SPRINGVALE | X669: 8 | Y669: 3 | Z669: 0 | AA669: 1435 | AB669: 1036 | AC669: =(AA669/AB669)*100 -> 138.51351351351352 | AD669: =(X669*4)+(Z669*2) -> 32
A670: WERRIBEE | C670: GEARY 6 | F670: SELLS 3 | H670: RADCLIFFE 2 | K670: WALSH 2 | M670: McMASTER | O670: MORRIS | Q670: MONTGOMERY | W670: WILLIAMSTOWN | X670: 8 | Y670: 3 | Z670: 0 | AA670: 1286 | AB670: 938 | AC670: =(AA670/AB670)*100 -> 137.10021321961619 | AD670: =(X670*4)+(Z670*2) -> 32
A671: SPRINGVALE | C671: T DWYER 3 | F671: DEMPSTER 3 | I671: MITHEN 2 | K671: ATKINS | M671: CLARK | O671: MAYLIN | Q671: PHILLIPS | W671: DANDEN0NG | X671: 7 | Y671: 3 | Z671: 1 | AA671: 1319 | AB671: 1054 | AC671: =(AA671/AB671)*100 -> 125.14231499051233 | AD671: =(X671*4)+(Z671*2) -> 30
D672: 1ST JULY | I672: WEATHER | N672: ANDERSON | S672: Venue: PORT MELBOURNE | W672: WERRIBEE | X672: 7 | Y672: 4 | Z672: 0 | AA672: 1358 | AB672: 1117 | AC672: =(AA672/AB672)*100 -> 121.57564905998211 | AD672: =(X672*4)+(Z672*2) -> 28
A673: PORT MELBOURNE | C673: 7 | D673: 4 | E673: 46 | G673: 13 | H673: 8 | I673: 86 | K673: 16 | L673: 9 | M673: 105 | O673: 19 | P673: 14 | Q673: 128 | S673: ANTHONY
A674: CAMBERWELL | C674: 8 | D674: 1 | E674: 49 | G674: 10 | H674: 3 | I674: 63 | K674: 14 | L674: 6 | M674: 90 | O674: 16 | P674: 9 | Q674: 105 | S674: KHAN | W674: PRESTON | X674: 6 | Y674: 4 | Z674: 1 | AA674: 1275 | AB674: 1011 | AC674: =(AA674/AB674)*100 -> 126.1127596439169 | AD674: =(X674*4)+(Z674*2) -> 26
A675: BEST PLAYERS | W675: PORT MELBOURNE | X675: 6 | Y675: 5 | Z675: 0 | AA675: 1356 | AB675: 1354 | AC675: =(AA675/AB675)*100 -> 100.14771048744461 | AD675: =(X675*4)+(Z675*2) -> 24
A676: PORT MELBOURNE | C676: PRITCHARD | F676: HARKINS | I676: CHRIMES | L676: MUTIMER | O676: CONDON | Q676: LOVE | W676: SANDRINGHAM | X676: 6 | Y676: 5 | Z676: 0 | AA676: 1273 | AB676: 1384 | AC676: =(AA676/AB676)*100 -> 91.979768786127167 | AD676: =(X676*4)+(Z676*2) -> 24
A677: CAMBERWELL | C677: GREIG | F677: HOLLOWAY | I677: BUDGE | L677: VITACCA | O677: WYNN | Q677: DIPIERDOMENICO | W677: B'WICK/B'MEAD | X677: 5 | Y677: 6 | Z677: 0 | AA677: 1235 | AB677: 1137 | AC677: =(AA677/AB677)*100 -> 108.61917326297275 | AD677: =(X677*4)+(Z677*2) -> 20
A678: GOALKICKERS | W678: FRANKSTON | X678: 4 | Y678: 7 | Z678: 0 | AA678: 1206 | AB678: 1372 | AC678: =(AA678/AB678)*100 -> 87.900874635568513 | AD678: =(X678*4)+(Z678*2) -> 16
A679: PORT MELBOURNE | C679: CONDON 6 | F679: LOVE 5 | H679: HICKS 3 | J679: KENNEDY 2 | M679: HARKINS | O679: FOLEY | Q679: HARLAND | W679: PRAHRAN | X679: 4 | Y679: 7 | Z679: 0 | AA679: 1035 | AB679: 1307 | AC679: =(AA679/AB679)*100 -> 79.18898240244836 | AD679: =(X679*4)+(Z679*2) -> 16
A680: CAMBERWELL | C680: WILKINSON 4 | F680: WYNN 3 | H680: ZANIC 3 | J680: DIPIERDOMENICO 2 | N680: GREIG | P680: T VITACCA | R680: BUDGE | W680: BOX HILL | X680: 3 | Y680: 8 | Z680: 0 | AA680: 1352 | AB680: 1322 | AC680: =(AA680/AB680)*100 -> 102.26928895612708 | AD680: =(X680*4)+(Z680*2) -> 12
M681: RICHARDSON | S681: Venue: WILLIAMSTOWN | W681: OAKLEIGH | X681: 2 | Y681: 9 | Z681: 0 | AA681: 1162 | AB681: 1571 | AC681: =(AA681/AB681)*100 -> 73.965626989178872 | AD681: =(X681*4)+(Z681*2) -> 8
A682: WILLIAMSTOWN | C682: 4 | D682: 5 | E682: 29 | G682: 9 | H682: 6 | I682: 60 | K682: 16 | L682: 12 | M682: 108 | O682: 23 | P682: 19 | Q682: 157 | S682: CLEMENT | W682: CAMBERWELL | X682: 0 | Y682: 11 | Z682: 0 | AA682: 874 | AB682: 1717 | AC682: =(AA682/AB682)*100 -> 50.902737332556782 | AD682: =(X682*4)+(Z682*2) -> 0
A683: OAKLEIGH | C683: 2 | D683: 5 | E683: 17 | G683: 3 | H683: 6 | I683: 24 | K683: 5 | L683: 9 | M683: 39 | O683: 7 | P683: 10 | Q683: 52 | S683: LAWLER
A684: BEST PLAYERS
A685: WILLIAMSTOWN | C685: PASTORE | F685: LLOYD | I685: SMITH | L685: O'CONNOR | O685: BURTON | R685: AZIZ
A686: OAKLEIGH | C686: BRIGGS | F686: MITCHELSON | I686: HICKEY | L686: DYSON | O686: QUIRK | R686: SMITH
A687: GOALKICKERS | N687: V DIMARTINO | Q687: AZIZ
A688: WILLIAMSTOWN | C688: BURTON 7 | F688: SLEVISON 3 | I688: RICKMAN 3 | L688: MINETT 2 | N688: SMITH 2 | P688: O'CONNOR 2 | R688: MILES 2
A689: OAKLEIGH | C689: DYSON | E689: WELSFORD | H689: OWEN | J689: PAYNE | L689: COWLED | N689: SMITH | P689: RYAN
A691: BOX HILL | C691: 6 | D691: 4 | E691: 40 | G691: 13 | H691: 10 | I691: 88 | K691: 19 | L691: 15 | M691: 129 | O691: 22 | P691: 20 | Q691: 152 | S691: Venue: BOX HILL
A692: FRANKSTON | C692: 4 | D692: 1 | E692: 25 | G692: 7 | H692: 6 | I692: 48 | K692: 11 | L692: 9 | M692: 75 | O692: 15 | P692: 13 | Q692: 103 | S692: VAN BEEK :CAULFIELD
A693: BEST PLAYERS
A694: BOX HILL | C694: HOLT | F694: LISLE | I694: ZARAFA | L694: ROSSELEY | O694: DALRYMPLE | R694: HANDLEY
A695: FRANKSTON | C695: AHERN | F695: GAHAN | I695: GAMBLE | L695: BINGLEY | O695: AMOORE | R695: BOONKAMP
A696: GOALKICKERS
A697: BOX HILL | C697: ZARAFA 7 | F697: ROSSELEY 5 | I697: NICHOLSON 2 | L697: DELL 2 | N697: BUTTIFANT 2 | Q697: HANDLEY 2 | T697: LISLE | V697: A HAMILTON
A698: FRANKSTON | C698: BINGLEY 4 | F698: BROWN 3 | I698: BOONKAMP 2 | L698: AHERN 2 | N698: AMOORE | P698: STEVENSON | S698: BELL | U698: T HAMILL
D699: 7TH JULY | I699: WEATHER
A700: PRESTON | C700: 8 | D700: 3 | E700: 51 | G700: 11 | H700: 6 | I700: 72 | K700: 18 | L700: 13 | M700: 121 | O700: 19 | P700: 15 | Q700: 129 | S700: Venue: PORT MELBOURNE
A701: B'WICK/B'MEAD | C701: 3 | D701: 2 | E701: 20 | G701: 6 | H701: 7 | I701: 43 | K701: 7 | L701: 9 | M701: 51 | O701: 18 | P701: 12 | Q701: 120 | S701: MORROW :HOWLETT
A702: BEST PLAYERS
A703: PRESTON | C703: MARCON | F703: DINTINOSANTE | I703: LAWSON | L703: BURROWS | O703: LUMICISI | R703: HALAS
A704: B'WICK/B'MEAD | C704: EAMES | F704: CLARKE | I704: BONE | L704: BERTOLLO | O704: WRIGHT | R704: DRAIN
A705: GOALKICKERS
A706: PRESTON | C706: MARCON 5 | F706: HALAS 4 | H706: SHAW 2 | J706: NICOLAOU 2 | M706: DINTINOSANTE 2 | Q706: LUMICISI | S706: JORDAN | V706: GILLARD | X706: DUNBAR
A707: B'WICK/B'MEAD | C707: EAMES 5 | F707: DAVIS 3 | H707: WRIGHT 3 | J707: LUMSDEN 2 | M707: GRIFFITHS | O707: BERTOLLO | Q707: BONE | R707: DRAIN | U707: MCALLESTER
D708: 8TH JULY | I708: WEATHER
A709: DANDENONG | C709: 6 | D709: 7 | E709: 43 | G709: 10 | H709: 8 | I709: 68 | K709: 17 | L709: 18 | M709: 120 | O709: 20 | P709: 27 | Q709: 147 | S709: Venue: DANDENONG
A710: SANDRINGHAM | C710: 2 | D710: 7 | E710: 19 | G710: 5 | H710: 10 | I710: 40 | K710: 5 | L710: 13 | M710: 43 | O710: 10 | P710: 18 | Q710: 78 | S710: COATES :CARLSON
A711: BEST PLAYERS
A712: DANDENONG | C712: ATKINSON | F712: MILLANE | I712: MILLIGAN | L712: ELSHAUG | O712: WICKS | Q712: GILDER
A713: SANDRINGHAM | C713: McGANNON | F713: MACKENZIE | I713: EAVES | L713: J RUGOLO | O713: BAILEY | Q713: ALLEN
A714: GOALKICKERS
A715: DANDENONG | C715: BRADDY 5 | F715: ELSHAUG 4 | I715: WICKS 3 | K715: GILDER 2 | M715: LACKO 2 | O715: MEAD | Q715: D M BOURKE | T715: McCORMACK | X715: WELSH
A716: SANDRINGHAM | C716: EAVES 3 | F716: HOWARD | I716: FOLEY | K716: MACKENZIE | N716: BERGMAN | Q716: ALLEN | S716: E FISCHER | V716: CULLINANE
A718: COBURG | C718: 4 | D718: 5 | E718: 29 | G718: 9 | H718: 12 | I718: 66 | K718: 13 | L718: 16 | M718: 94 | O718: 21 | P718: 18 | Q718: 144 | S718: Venue: COBURG
A719: PRAHRAN | C719: 0 | D719: 8 | E719: 8 | G719: 4 | H719: 11 | I719: 35 | K719: 8 | L719: 13 | M719: 61 | O719: 16 | P719: 14 | Q719: 110 | S719: SNEDDON :CALLAHAN
A720: BEST PLAYERS
A721: COBURG | C721: TARANTO | F721: BARNES | I721: SULLIVAN | L721: WEATHERALD | O721: NIMMO | Q721: BUCKLEY
A722: PRAHRAN | C722: SOULOS | F722: JOHNSON | I722: PAGE | L722: TAYLOR | O722: EVANS | Q722: TAPPING
A723: GOALKICKERS
A724: COBURG | C724: WEATHERALD 7 | F724: WILLIAMS 5 | I724: ALLISON 2 | K724: BARNES 2 | M724: TARANTO 2 | P724: DARBY | R724: REYNOLDSON | V724: SHELDON
A725: PRAHRAN | C725: WILLIAMSON 4 | F725: THORNTON 4 | I725: EVANS 3 | K725: TAYLOR 2 | M725: SOULOS | O725: RYAN | Q725: KNIGHTS
A727: ROUND 12 | D727: 14TH JULY | I727: WEATHER | S727: Venue: PORT MELBOURNE
D728: 1ST QTR | H728: 2ND QTR | L728: 3RD QTR | P728: FINAL | S728: UMPIRES
A729: DANDENONG | C729: 2 | D729: 3 | E729: 15 | G729: 3 | H729: 9 | I729: 27 | K729: 8 | L729: 11 | M729: 59 | O729: 11 | P729: 18 | Q729: 84 | S729: LAWLER | X729: LADDER | AA729: ROUND | AC729: 12
A730: B'WICK/B'MEAD | C730: 2 | D730: 1 | E730: 13 | G730: 4 | H730: 6 | I730: 30 | K730: 6 | L730: 9 | M730: 45 | O730: 8 | P730: 14 | Q730: 62 | S730: THOMPSON
A731: BEST PLAYERS | W731: TEAM | X731: W | Y731: L | Z731: D | AA731: FOR | AB731: AGST | AC731: % | AD731: PTS
A732: DANDENONG | C732: MILLIGAN | F732: ATKINSON | I732: WICKS | L732: BOURKE | O732: McCORMACK | R732: WELSH
A733: B'WICK/B'MEAD | C733: BONE | F733: DUGGAN | I733: EAMES | L733: CALLANDER | O733: CLARKE | R733: HOTCHKIN | W733: COBURG | X733: 10 | Y733: 2 | Z733: 0 | AA733: 1511 | AB733: 1091 | AC733: =(AA733/AB733)*100 -> 138.4967919340055 | AD733: =(X733*4)+(Z733*2) -> 40
A734: GOALKICKERS | W734: SPRINGVALE | X734: 9 | Y734: 3 | Z734: 0 | AA734: 1672 | AB734: 1129 | AC734: =(AA734/AB734)*100 -> 148.09565987599646 | AD734: =(X734*4)+(Z734*2) -> 36
A735: DANDENONG | C735: BRADDY 3 | F735: LACKO 2 | I735: WICKS 2 | K735: ELSHAUG | M735: MEAD | O735: D M BOURKE | R735: MILLIGAN | W735: WILLIAMSTOWN | X735: 9 | Y735: 3 | Z735: 0 | AA735: 1380 | AB735: 1019 | AC735: =(AA735/AB735)*100 -> 135.42688910696762 | AD735: =(X735*4)+(Z735*2) -> 36
A736: B'WICK/B'MEAD | C736: DRAIN 3 | F736: BERTOLLO | I736: BONE | K736: CALLANDER | N736: BUTLER | P736: WRIGHT | W736: DANDEN0NG | X736: 8 | Y736: 3 | Z736: 1 | AA736: 1403 | AB736: 1116 | AC736: =(AA736/AB736)*100 -> 125.71684587813621 | AD736: =(X736*4)+(Z736*2) -> 34
D737: 15TH JULY | I737: WEATHER | S737: Venue: CAMBERWELL | W737: PRESTON | X737: 7 | Y737: 4 | Z737: 1 | AA737: 1385 | AB737: 1109 | AC737: =(AA737/AB737)*100 -> 124.88728584310189 | AD737: =(X737*4)+(Z737*2) -> 30
A738: SPRINGVALE | C738: 4 | D738: 5 | E738: 29 | G738: 6 | H738: 10 | I738: 46 | K738: 16 | L738: 12 | M738: 108 | O738: 26 | P738: 21 | Q738: 177 | S738: CALLAGHAN
A739: CAMBERWELL | C739: 5 | D739: 2 | E739: 32 | G739: 11 | H739: 5 | I739: 71 | K739: 12 | L739: 7 | M739: 79 | O739: 14 | P739: 9 | Q739: 93 | S739: KHAN | W739: WERRIBEE | X739: 7 | Y739: 5 | Z739: 0 | AA739: 1434 | AB739: 1211 | AC739: =(AA739/AB739)*100 -> 118.41453344343518 | AD739: =(X739*4)+(Z739*2) -> 28
A740: BEST PLAYERS | W740: PORT MELBOURNE | X740: 7 | Y740: 5 | Z740: 0 | AA740: 1449 | AB740: 1437 | AC740: =(AA740/AB740)*100 -> 100.83507306889352 | AD740: =(X740*4)+(Z740*2) -> 28
A741: SPRINGVALE | C741: KEIPERT | F741: CLARK | I741: ANDERSON | L741: ROBINSON | O741: MENDE | R741: JEFFS | W741: SANDRINGHAM | X741: 7 | Y741: 5 | Z741: 0 | AA741: 1399 | AB741: 1499 | AC741: =(AA741/AB741)*100 -> 93.328885923949301 | AD741: =(X741*4)+(Z741*2) -> 28
A742: CAMBERWELL | C742: GREIG | F742: CLARKE | I742: WILKINSON | L742: WYNN | O742: BUDGE | W742: B'WICK/B'MEAD | X742: 5 | Y742: 7 | Z742: 0 | AA742: 1297 | AB742: 1221 | AC742: =(AA742/AB742)*100 -> 106.22440622440624 | AD742: =(X742*4)+(Z742*2) -> 20
A743: GOALKICKERS | R743: MAYLIN | W743: BOX HILL | X743: 4 | Y743: 8 | Z743: 0 | AA743: 1515 | AB743: 1439 | AC743: =(AA743/AB743)*100 -> 105.28144544822793 | AD743: =(X743*4)+(Z743*2) -> 16
A744: SPRINGVALE | C744: ROBINSON 8 | F744: ANDERSON 6 | I744: MITHEN 4 | K744: KEIPERT 2 | M744: T ELLIOTT 2 | P744: KOOP | Q744: CLARKE | S744: ATKINS | W744: FRANKSTON | X744: 4 | Y744: 8 | Z744: 0 | AA744: 1304 | AB744: 1482 | AC744: =(AA744/AB744)*100 -> 87.989203778677464 | AD744: =(X744*4)+(Z744*2) -> 16
A745: CAMBERWELL | C745: WILKINSON 6 | F745: DIPIERDOMENICO 2 | J745: RICHARDSON 2 | M745: GREIG | O745: WYNN | Q745: ZANIC | S745: CLARKE | W745: PRAHRAN | X745: 4 | Y745: 8 | Z745: 0 | AA745: 1150 | AB745: 1433 | AC745: =(AA745/AB745)*100 -> 80.251221214235869 | AD745: =(X745*4)+(Z745*2) -> 16
S746: Venue: PORT MELBOURNE | W746: OAKLEIGH | X746: 2 | Y746: 10 | Z746: 0 | AA746: 1279 | AB746: 1734 | AC746: =(AA746/AB746)*100 -> 73.760092272203011 | AD746: =(X746*4)+(Z746*2) -> 8
A747: PORT MELBOURNE | C747: 5 | D747: 2 | E747: 32 | G747: 9 | H747: 4 | I747: 58 | K747: 11 | L747: 7 | M747: 73 | O747: 14 | P747: 9 | Q747: 93 | S747: MORROW | W747: CAMBERWELL | X747: 0 | Y747: 12 | Z747: 0 | AA747: 967 | AB747: 1894 | AC747: =(AA747/AB747)*100 -> 51.055966209081305 | AD747: =(X747*4)+(Z747*2) -> 0
A748: COBURG | C748: 4 | D748: 3 | E748: 27 | G748: 7 | H748: 7 | I748: 49 | K748: 8 | L748: 15 | M748: 63 | O748: 10 | P748: 17 | Q748: 77 | S748: MURNANE
A749: BEST PLAYERS
A750: PORT MELBOURNE | C750: CAMERON | F750: CHRIMES | I750: FOLEY | L750: PRITCHARD | O750: HARKINS | R750: MUTIMER
A751: COBURG | C751: TARANTO | F751: LITTLER | I751: COMITO | L751: NIMMO
A752: GOALKICKERS | M752: PRITCHARD | P752: ERWIN | R752: HARLAND
A753: PORT MELBOURNE | C753: HARKINS 2 | F753: KENNEDY 2 | I753: MUTIMER 2 | L753: SCURRAH 2 | O753: CONDON | Q753: FOLEY | S753: HICKS
A754: COBURG | C754: WILLIAMS 3 | F754: COMITO 3 | I754: WEATHERALD 2 | L754: ALLISON | N754: GILLINGHAM
A756: WILLIAMSTOWN | C756: 3 | D756: 2 | E756: 20 | G756: 5 | H756: 7 | I756: 37 | K756: 9 | L756: 11 | M756: 65 | O756: 13 | P756: 16 | Q756: 94 | S756: Venue: WERRIBEE
A757: WERRIBEE | C757: 0 | D757: 5 | E757: 5 | G757: 5 | H757: 10 | I757: 40 | K757: 9 | L757: 13 | M757: 67 | O757: 11 | P757: 15 | Q757: 81 | S757: DORE :MITCHELL
A758: BEST PLAYERS
A759: WILLIAMSTOWN | C759: MITCHELL | F759: O'CONNOR | I759: LLOYD | L759: MOURNEY | O759: SWAN | R759: SMITH
A760: WERRIBEE | C760: McMASTER | F760: WALSH | I760: ALLDAY | L760: DOMBERG | O760: O'KEEFE | R760: FITZPATRICK
A761: GOALKICKERS
A762: WILLIAMSTOWN | C762: MINETT 4 | F762: MOURNEY 3 | I762: BURTON | K762: V DIMARTINO | N762: ROUND | P762: SMITH | R762: O'CONNOR | U762: RICKMAN
A763: WERRIBEE | C763: WALSH 5 | F763: SELLS 2 | H763: GEARY | J763: SIZER | L763: McMASTER | O763: O'KEEFE
A765: BOX HILL | C765: 9 | D765: 5 | E765: 59 | G765: 15 | H765: 9 | I765: 99 | K765: 22 | L765: 13 | M765: 145 | O765: 24 | P765: 19 | Q765: 163 | S765: Venue: OAKLEIGH
A766: OAKLEIGH | C766: 6 | D766: 4 | E766: 40 | G766: 10 | H766: 8 | I766: 68 | K766: 14 | L766: 10 | M766: 94 | O766: 17 | P766: 15 | Q766: 117 | S766: CARLSON ;SIGMONT
A767: BEST PLAYERS
A768: BOX HILL | C768: ZARAFA | F768: HOLT | I768: HEANEY | L768: LISLE | O768: BUTTIFANT | R768: P BOLTON
A769: OAKLEIGH | C769: SMITH | F769: QUIRK | I769: PRETTO | L769: HICKEY | O769: GARBUIO | R769: MITCHELSON
A770: GOALKICKERS
A771: BOX HILL | C771: P BOLTON 5 | F771: BUTTIFANT 5 | I771: ZARAFA 4 | K771: DELL 3 | M771: HANDLEY 3 | P771: A HAMILTON | S771: NICHOLSON | W771: HOLT | X771: ROSSELEY
A772: OAKLEIGH | C772: PRETTO 7 | F772: MELLODY 2 | I772: OWEN 2 | K772: GARBUIO 2 | M772: WELSFORD | P772: MITCHELSON | S772: HICKEY | V772: JAMES
A774: PRESTON | C774: 4 | D774: 5 | E774: 29 | G774: 7 | H774: 6 | I774: 48 | K774: 14 | L774: 11 | M774: 95 | O774: 16 | P774: 14 | Q774: 110 | S774: Venue: FRANKSTON
A775: FRANKSTON | C775: 4 | D775: 5 | E775: 29 | G775: 8 | H775: 10 | I775: 58 | K775: 13 | L775: 12 | M775: 90 | O775: 14 | P775: 14 | Q775: 98 | S775: SNEDDON :KILNER
A776: BEST PLAYERS
A777: PRESTON | C777: MARCON | F777: LUMICISI | I777: DUNBAR | L777: HUNT | O777: PRIDEAUX | R777: JORDAN
A778: FRANKSTON | C778: S HAMILL | F778: DENEREAZ | I778: D MARTIN | L778: A HAMILL | O778: BOONKAMP | R778: OWEN
A779: GOALKICKERS
A780: PRESTON | C780: SHAW 6 | F780: HALAS 3 | H780: NICOLAOU 2 | K780: PRIDEAUX 2 | N780: JORDAN | P780: C LAWSON | S780: MARCON
A781: FRANKSTON | C781: OWEN 3 | E781: GAHAN 2 | G781: BINGLEY 2 | I781: BOONKAMP 2 | L781: WEST | N781: BROWN | P781: O'BRIEN | R781: D MARTIN | V781: MACE
A783: SANDRINGHAM | C783: 8 | D783: 4 | E783: 52 | G783: 9 | H783: 8 | I783: 62 | K783: 14 | L783: 12 | M783: 96 | O783: 18 | P783: 18 | Q783: 126 | S783: Venue: BEACH ROAD
A784: PRAHRAN | C784: 3 | D784: 0 | E784: 18 | G784: 11 | H784: 2 | I784: 68 | K784: 14 | L784: 7 | M784: 91 | O784: 18 | P784: 7 | Q784: 115 | S784: ANTHONY :BULLUSS
A785: BEST PLAYERS
A786: SANDRINGHAM | C786: F RUGOLO | F786: J RUGOLO
A787: PRAHRAN | C787: TAYLOR | F787: KNIGHTS | I787: MORRISSEY | L787: EVANS | O787: SHORTHOUSE
A788: GOALKICKERS
A789: SANDRINGHAM | C789: F RUGOLO 11 | F789: CULLINANE 2 | I789: BENZIE 2 | K789: FITZGERALD | N789: J RUGOLO | Q789: HALPHEN
A790: PRAHRAN | C790: TAYLOR 3 | F790: SOULOS 3 | I790: KNIGHTS 3 | K790: D'ALLESSANDRO 3 | O790: EVANS 2 | Q790: WILLIAMSON 2 | U790: R JOHNSON | X790: THORNTON
A792: ROUND 13 | D792: 21ST JULY | I792: WEATHER | S792: Venue: BOX HILL
D793: 1ST QTR | H793: 2ND QTR | L793: 3RD QTR | P793: FINAL | S793: UMPIRES
A794: WERRIBEE | C794: 6 | D794: 2 | E794: 38 | G794: 10 | H794: 10 | I794: 70 | K794: 18 | L794: 17 | M794: 125 | O794: 22 | P794: 18 | Q794: 150 | S794: SAVILLE | X794: LADDER | AA794: ROUND | AC794: 13
A795: BOX HILL | C795: 5 | D795: 4 | E795: 34 | G795: 10 | H795: 11 | I795: 71 | K795: 13 | L795: 11 | M795: 89 | O795: 19 | P795: 16 | Q795: 130 | S795: HOLT
A796: BEST PLAYERS | W796: TEAM | X796: W | Y796: L | Z796: D | AA796: FOR | AB796: AGST | AC796: % | AD796: PTS
A797: WERRIBEE | C797: O'KEEFE | F797: SIZER | I797: SELLS | L797: WALSH | O797: McMASTER | R797: FITZPATRICK
A798: BOX HILL | C798: HANDLEY | F798: HICKS | I798: DALRYMPLE | L798: ROSSELEY | O798: HEANEY | W798: COBURG | X798: 11 | Y798: 2 | Z798: 0 | AA798: 1609 | AB798: 1171 | AC798: =(AA798/AB798)*100 -> 137.40392826643895 | AD798: =(X798*4)+(Z798*2) -> 44
A799: GOALKICKERS | W799: WILLIAMSTOWN | X799: 10 | Y799: 3 | Z799: 0 | AA799: 1582 | AB799: 1051 | AC799: =(AA799/AB799)*100 -> 150.523311132255 | AD799: =(X799*4)+(Z799*2) -> 40
A800: WERRIBEE | C800: O'KEEFE 10 | F800: SELLS 5 | H800: SIZER 2 | J800: WALSH 2 | M800: RAEBURN | O800: McMASTER | Q800: LESIPUTTY | W800: SPRINGVALE | X800: 10 | Y800: 3 | Z800: 0 | AA800: 1774 | AB800: 1203 | AC800: =(AA800/AB800)*100 -> 147.46467165419784 | AD800: =(X800*4)+(Z800*2) -> 40
A801: BOX HILL | C801: HICKS 4 | E801: P BOLTON 3 | H801: DELL 3 | J801: ZARAFA 2 | M801: DALRYMPLE 2 | P801: B HOGAN | R801: A HAMILTON | W801: PRESTON | X801: 8 | Y801: 4 | Z801: 1 | AA801: 1511 | AB801: 1218 | AC801: =(AA801/AB801)*100 -> 124.05582922824303 | AD801: =(X801*4)+(Z801*2) -> 34
D802: 22ND JULY | I802: WEATHER | L802: BUTTIFANT | N802: HANDLEY | P802: ROSSELEY | S802: Venue: SPRINGVALE | W802: DANDEN0NG | X802: 8 | Y802: 4 | Z802: 1 | AA802: 1503 | AB802: 1221 | AC802: =(AA802/AB802)*100 -> 123.09582309582309 | AD802: =(X802*4)+(Z802*2) -> 34
A803: SPRINGVALE | C803: 3 | D803: 3 | E803: 21 | G803: 9 | H803: 8 | I803: 62 | K803: 11 | L803: 12 | M803: 78 | O803: 14 | P803: 18 | Q803: 102 | S803: LAWLER
A804: PORT MELBOURNE | C804: 4 | D804: 3 | E804: 27 | G804: 5 | H804: 8 | I804: 38 | K804: 9 | L804: 13 | M804: 67 | O804: 10 | P804: 14 | Q804: 74 | S804: CARLSON | W804: WERRIBEE | X804: 8 | Y804: 5 | Z804: 0 | AA804: 1594 | AB804: 1331 | AC804: =(AA804/AB804)*100 -> 119.7595792637115 | AD804: =(X804*4)+(Z804*2) -> 32
A805: BEST PLAYERS | W805: PORT MELBOURNE | X805: 7 | Y805: 6 | Z805: 0 | AA805: 1523 | AB805: 1539 | AC805: =(AA805/AB805)*100 -> 98.960363872644578 | AD805: =(X805*4)+(Z805*2) -> 28
A806: SPRINGVALE | C806: JEFFS | F806: PHILLIPS | I806: MORGAN | L806: KOOP | O806: DEMPSTER | R806: CLARK | W806: SANDRINGHAM | X806: 7 | Y806: 6 | Z806: 0 | AA806: 1479 | AB806: 1597 | AC806: =(AA806/AB806)*100 -> 92.611145898559798 | AD806: =(X806*4)+(Z806*2) -> 28
A807: PORT MELBOURNE | C807: MUTIMER | F807: CAMERON | I807: ERWIN | L807: STROOPER | O807: CHRIMES | R807: FOLEY | W807: B'WICK/B'MEAD | X807: 6 | Y807: 7 | Z807: 0 | AA807: 1436 | AB807: 1298 | AC807: =(AA807/AB807)*100 -> 110.63174114021572 | AD807: =(X807*4)+(Z807*2) -> 24
A808: GOALKICKERS | W808: FRANKSTON | X808: 5 | Y808: 8 | Z808: 0 | AA808: 1409 | AB808: 1582 | AC808: =(AA808/AB808)*100 -> 89.064475347661187 | AD808: =(X808*4)+(Z808*2) -> 20
A809: SPRINGVALE | C809: ROBINSON 3 | F809: ATKINS 3 | H809: PHILLIPS 3 | J809: KEIPERT | L809: MITHEN | N809: CLARKE | P809: T ELLIOTT | R809: JEFFS | W809: BOX HILL | X809: 4 | Y809: 9 | Z809: 0 | AA809: 1635 | AB809: 1589 | AC809: =(AA809/AB809)*100 -> 102.89490245437382 | AD809: =(X809*4)+(Z809*2) -> 16
A810: PORT MELBOURNE | C810: HICKS 4 | F810: CONDON 2 | I810: HARKINS | K810: MUTIMER | M810: HARLAND | O810: S SCURRAH | W810: PRAHRAN | X810: 4 | Y810: 9 | Z810: 0 | AA810: 1227 | AB810: 1572 | AC810: =(AA810/AB810)*100 -> 78.053435114503827 | AD810: =(X810*4)+(Z810*2) -> 16
S811: Venue: WILLIAMSTOWN | W811: OAKLEIGH | X811: 2 | Y811: 11 | Z811: 0 | AA811: 1388 | AB811: 1860 | AC811: =(AA811/AB811)*100 -> 74.623655913978496 | AD811: =(X811*4)+(Z811*2) -> 8
A812: WILLIAMSTOWN | C812: 7 | D812: 4 | E812: 46 | G812: 15 | H812: 10 | I812: 100 | K812: 21 | L812: 13 | M812: 139 | O812: 31 | P812: 16 | Q812: 202 | S812: DOWSLEY | W812: CAMBERWELL | X812: 0 | Y812: 13 | Z812: 0 | AA812: 999 | AB812: 2095 | AC812: =(AA812/AB812)*100 -> 47.684964200477324 | AD812: =(X812*4)+(Z812*2) -> 0
A813: CAMBERWELL | C813: 0 | D813: 5 | E813: 5 | G813: 2 | H813: 5 | I813: 17 | K813: 4 | L813: 8 | M813: 32 | O813: 4 | P813: 8 | Q813: 32 | S813: MARSHALL
A814: BEST PLAYERS
A815: WILLIAMSTOWN | C815: SMITH | F815: RICKMAN | I815: ROUND | L815: MITCHELL | O815: BURTON | Q815: MOURNEY
A816: CAMBERWELL | C816: WYNN | F816: MERTON | I816: R VITACCA
A817: GOALKICKERS | P817: O'CONNOR
A818: WILLIAMSTOWN | C818: RICKMAN 10 | F818: BURTON 5 | I818: MUSCHIALLI 4 | L818: MOURNEY 3 | O818: MINETT 2 | Q818: ROUND 2 | S818: CORDY
A819: CAMBERWELL | C819: DIPIERDOMENICO | G819: BUDGE | I819: MERTON | K819: RICHARDSON
A821: PRESTON | C821: 4 | D821: 2 | E821: 26 | G821: 11 | H821: 6 | I821: 72 | K821: 12 | L821: 8 | M821: 80 | O821: 19 | P821: 12 | Q821: 126 | S821: Venue: PRESTON
A822: OAKLEIGH | C822: 4 | D822: 4 | E822: 28 | G822: 5 | H822: 4 | I822: 34 | K822: 10 | L822: 11 | M822: 71 | O822: 16 | P822: 13 | Q822: 109 | S822: CUSWORTH :BULLUSS
A823: BEST PLAYERS
A824: PRESTON | C824: BURROWS | F824: MARCON | I824: LUMICISI | L824: SHAW | O824: McINERNEY | R824: PRITCHARD
A825: OAKLEIGH | C825: HICKEY | F825: OWEN | I825: DYSON | L825: PRETTO | O825: MELLODY | R825: QUIRK
A826: GOALKICKERS
A827: PRESTON | C827: SHAW 6 | F827: MARCON 6 | I827: NICOLAOU 3 | L827: JORDAN 2 | N827: HALAS | P827: DINTINOSANTE
A828: OAKLEIGH | C828: PRETTO 6 | F828: OWEN 4 | H828: DYSON 2 | J828: MELLODY 2 | M828: MITCHELSON | P828: GARBUIO
A830: FRANKSTON | C830: 7 | D830: 4 | E830: 46 | G830: 9 | H830: 6 | I830: 60 | K830: 11 | L830: 8 | M830: 74 | O830: 16 | P830: 9 | Q830: 105 | S830: Venue: DANDENONG
A831: DANDENONG | C831: 3 | D831: 2 | E831: 20 | G831: 4 | H831: 15 | I831: 39 | K831: 6 | L831: 15 | M831: 51 | O831: 13 | P831: 22 | Q831: 100 | S831: SIGMONT :NOLAN
A832: BEST PLAYERS
A833: FRANKSTON | C833: BELL | F833: BOONKAMP | I833: GAMBLE | L833: McCARTHY | O833: OWEN | R833: MARTIN
A834: DANDENONG | C834: GREEN | F834: D BOURKE | I834: ELSHAUG | L834: BRADDY | O834: J MARSHALL | R834: McCONCHIE
A835: GOALKICKERS
A836: FRANKSTON | C836: McCARTHY 5 | F836: GAMBLE 4 | I836: O'BRIEN 2 | K836: BOONKAMP 2 | N836: BINGLEY | P836: OWEN | R836: PARROTT
A837: DANDENONG | C837: KNIGHT 2 | E837: MEAD 2 | G837: WICKS 2 | I837: GREEN 2 | K837: BRADDY | M837: D M BOURKE | P837: McCONCHIE | S837: McCORMACK | W837: J MARSHALL
A839: B'WICK/B'MEAD | C839: 13 | D839: 2 | E839: 80 | G839: 14 | H839: 6 | I839: 90 | K839: 18 | L839: 10 | M839: 118 | O839: 21 | P839: 13 | Q839: 139 | S839: Venue: TOORAK PARK
A840: PRAHRAN | C840: 0 | D840: 2 | E840: 2 | G840: 5 | H840: 7 | I840: 37 | K840: 7 | L840: 12 | M840: 54 | O840: 9 | P840: 23 | Q840: 77 | S840: LUCKMAN :GYSS
A841: BEST PLAYERS
A842: B'WICK/B'MEAD | C842: WRIGHT | F842: BERTOLLO | I842: CALLANDER | L842: HOTCHKIN | O842: DUGGAN | R842: BONE
A843: PRAHRAN | C843: TAYLOR | F843: MORRISSEY | I843: MARK
A844: GOALKICKERS
A845: B'WICK/B'MEAD | C845: BONE 5 | E845: WRIGHT 3 | G845: BERTOLLO 2 | J845: LUMSDEN 2 | M845: READ 2 | O845: DRAIN 2 | Q845: CALLANDER | T845: EAMES | V845: DAVIS | X845: CONNELL | AA845: POPE
A846: PRAHRAN | C846: TAYLOR 2 | F846: KILEY 2 | H846: LANGAN | J846: SOULOS | L846: R JOHNSON | O846: RYAN | Q846: KNIGHTS
A848: COBURG | C848: 7 | D848: 1 | E848: 43 | G848: 8 | H848: 4 | I848: 52 | K848: 14 | L848: 7 | M848: 91 | O848: 15 | P848: 8 | Q848: 98 | S848: Venue: COBURG
A849: SANDRINGHAM | C849: 1 | D849: 2 | E849: 8 | G849: 5 | H849: 10 | I849: 40 | K849: 8 | L849: 13 | M849: 61 | O849: 10 | P849: 20 | Q849: 80 | S849: HOWLETT ;HALES
A850: BEST PLAYERS
A851: COBURG | C851: NIMMO | F851: SHELDON | I851: ALLISON | L851: DARBY | O851: LITTLER | R851: TARANTO
A852: SANDRINGHAM | C852: J RUGOLO | F852: ALLEN | I852: O'CONNOR | L852: BAILEY | O852: PRATT | R852: EAVES
A853: GOALKICKERS
A854: COBURG | C854: WEATHERALD 6 | F854: WILLIAMS 3 | I854: LANGAN | K854: DARBY | M854: REYNOLDSON | P854: RACOVOLIS | S854: LITTLER | V854: GILLINGHAM
A855: SANDRINGHAM | C855: F RUGOLO 3 | F855: EAVES 2 | H855: CULLINANE 2 | K855: HIBBERT | M855: FITZGERALD | P855: BRIAN SAID
A857: ROUND 14 | D857: 8TH JULY | I857: WEATHER | S857: Venue: WILLIAMSTOWN
D858: 1ST QTR | H858: 2ND QTR | L858: 3RD QTR | P858: FINAL | S858: UMPIRES
A859: WILLIAMSTOWN | C859: 3 | D859: 3 | E859: 21 | G859: 11 | H859: 8 | I859: 74 | K859: 15 | L859: 14 | M859: 104 | O859: 24 | P859: 16 | Q859: 160 | S859: UMPIRES | X859: LADDER | AA859: ROUND | AC859: 14
A860: PORT MELBOURNE | C860: 8 | D860: 1 | E860: 49 | G860: 10 | H860: 2 | I860: 62 | K860: 12 | L860: 5 | M860: 77 | O860: 17 | P860: 6 | Q860: 108
A861: BEST PLAYERS | W861: TEAM | X861: W | Y861: L | Z861: D | AA861: FOR | AB861: AGST | AC861: % | AD861: PTS
A862: WILLIAMSTOWN | C862: SMITH | F862: SWAN | I862: O'CONNOR | L862: SLEVISON | O862: ROUND | R862: MITCHELL
A863: PORT MELBOURNE | C863: KENNEDY | F863: CHRIMES | I863: HICKS | L863: PRITCHARD | O863: MUTIMER | R863: FOLEY | W863: WILLIAMSTOWN | X863: 11 | Y863: 3 | Z863: 0 | AA863: 1742 | AB863: 1159 | AC863: =(AA863/AB863)*100 -> 150.30198446937015 | AD863: =(X863*4)+(Z863*2) -> 44
A864: GOALKICKERS | Q864: ROUND | S864: SLEVISON | W864: SPRINGVALE | X864: 11 | Y864: 3 | Z864: 0 | AA864: 1902 | AB864: 1300 | AC864: =(AA864/AB864)*100 -> 146.30769230769232 | AD864: =(X864*4)+(Z864*2) -> 44
A865: WILLIAMSTOWN | C865: MOURNEY 5 | F865: O'CONNOR 5 | I865: MINETT 4 | K865: RICKMAN 3 | M865: SMITH 2 | O865: AZIZ | P865: SWAN | R865: V DIMARTINO | W865: COBURG | X865: 11 | Y865: 3 | Z865: 0 | AA865: 1706 | AB865: 1299 | AC865: =(AA865/AB865)*100 -> 131.33179368745189 | AD865: =(X865*4)+(Z865*2) -> 44
A866: PORT MELBOURNE | C866: CONDON 4 | F866: HICKS 4 | H866: LOVE 4 | J866: KENNEDY 2 | M866: PIGGOTT | O866: HARLAND | Q866: ZAUSA | W866: PRESTON | X866: 9 | Y866: 4 | Z866: 1 | AA866: 1626 | AB866: 1317 | AC866: =(AA866/AB866)*100 -> 123.46241457858771 | AD866: =(X866*4)+(Z866*2) -> 38
D867: 28TH JULY | I867: WEATHER | S867: Venue: COBURG | W867: DANDEN0NG | X867: 8 | Y867: 5 | Z867: 1 | AA867: 1602 | AB867: 1333 | AC867: =(AA867/AB867)*100 -> 120.18004501125282 | AD867: =(X867*4)+(Z867*2) -> 34
A868: SPRINGVALE | C868: 4 | D868: 4 | E868: 28 | G868: 10 | H868: 6 | I868: 66 | K868: 13 | L868: 9 | M868: 87 | O868: 19 | P868: 14 | Q868: 128 | S868: SAVILLE
A869: COBURG | C869: 2 | D869: 4 | E869: 16 | G869: 9 | H869: 5 | I869: 59 | K869: 11 | L869: 12 | M869: 78 | O869: 14 | P869: 13 | Q869: 97 | S869: MARSHALL | W869: WERRIBEE | X869: 8 | Y869: 6 | Z869: 0 | AA869: 1693 | AB869: 1446 | AC869: =(AA869/AB869)*100 -> 117.08160442600277 | AD869: =(X869*4)+(Z869*2) -> 32
A870: BEST PLAYERS | W870: B'WICK/B'MEAD | X870: 7 | Y870: 7 | Z870: 0 | AA870: 1585 | AB870: 1405 | AC870: =(AA870/AB870)*100 -> 112.81138790035587 | AD870: =(X870*4)+(Z870*2) -> 28
A871: SPRINGVALE | C871: MAYLIN | F871: KEIPERT | I871: PHILLIPS | L871: JEFFS | O871: CLARKE | R871: NICOL | W871: PORT MELBOURNE | X871: 7 | Y871: 7 | Z871: 0 | AA871: 1631 | AB871: 1699 | AC871: =(AA871/AB871)*100 -> 95.997645673925831 | AD871: =(X871*4)+(Z871*2) -> 28
A872: COBURG | C872: LANGAN | F872: DARBY | I872: RACOVOLIS | L872: ALLISON | O872: KAAKOUR | R872: LITTLER | W872: SANDRINGHAM | X872: 7 | Y872: 7 | Z872: 0 | AA872: 1586 | AB872: 1746 | AC872: =(AA872/AB872)*100 -> 90.836197021764036 | AD872: =(X872*4)+(Z872*2) -> 28
A873: GOALKICKERS | W873: FRANKSTON | X873: 6 | Y873: 8 | Z873: 0 | AA873: 1545 | AB873: 1692 | AC873: =(AA873/AB873)*100 -> 91.312056737588648 | AD873: =(X873*4)+(Z873*2) -> 24
A874: SPRINGVALE | C874: KEIPERT 6 | F874: PHILLIPS 4 | I874: ROBINSON 3 | L874: CLARKE 3 | N874: MITHEN 2 | Q874: ATKINS | W874: BOX HILL | X874: 5 | Y874: 9 | Z874: 0 | AA874: 1831 | AB874: 1727 | AC874: =(AA874/AB874)*100 -> 106.02200347423279 | AD874: =(X874*4)+(Z874*2) -> 20
A875: COBURG | C875: KAAKOUR 4 | F875: GILLINGHAM 3 | I875: ANGWIN 2 | L875: RACOVOLIS 2 | O875: WEATHERALD | R875: ALLISON | W875: PRAHRAN | X875: 4 | Y875: 10 | Z875: 0 | AA875: 1337 | AB875: 1706 | AC875: =(AA875/AB875)*100 -> 78.370457209847601 | AD875: =(X875*4)+(Z875*2) -> 16
D876: 29TH JULY | I876: WEATHER | N876: DARBY | S876: Venue: BOX HILL | W876: OAKLEIGH | X876: 3 | Y876: 11 | Z876: 0 | AA876: 1500 | AB876: 1959 | AC876: =(AA876/AB876)*100 -> 76.569678407350693 | AD876: =(X876*4)+(Z876*2) -> 12
A877: BOX HILL | C877: 6 | D877: 4 | E877: 40 | G877: 14 | H877: 7 | I877: 91 | K877: 21 | L877: 11 | M877: 137 | O877: 30 | P877: 14 | Q877: 194 | S877: CUSWORTH | W877: CAMBERWELL | X877: 0 | Y877: 14 | Z877: 0 | AA877: 1137 | AB877: 2291 | AC877: =(AA877/AB877)*100 -> 49.628982976865998 | AD877: =(X877*4)+(Z877*2) -> 0
A878: CAMBERWELL | C878: 4 | D878: 4 | E878: 28 | G878: 7 | H878: 10 | I878: 52 | K878: 14 | L878: 13 | M878: 97 | O878: 20 | P878: 18 | Q878: 138 | S878: HALES
A879: BEST PLAYERS
A880: BOX HILL | C880: DALRYMPLE | F880: HICKS | I880: HEANEY | L880: LISLE | O880: HANDLEY | R880: DELL
A881: CAMBERWELL | C881: GREIG | E881: DIPIERDOMENICO | I881: T VITACCA | L881: R VITACCA | O881: BUDGE | R881: WYNN
A882: GOALKICKERS | O882: ZARAFA | R882: BRUSNAHAN
A883: BOX HILL | C883: HANDLEY 6 | F883: HICKS 6 | H883: LAUGHTON 5 | K883: REEVES 4 | M883: BOURKE 3 | O883: BOX 2 | Q883: DALRYMPLE 2
A884: CAMBERWELL | C884: DIPIERDOMENICO 4 | G884: BRASHER 3 | J884: FITZPATRICK 3 | M884: T VITACCA 2 | P884: R VITACCA 2 | S884: BUDGE 2
H885: SETON | J885: MERTON | M885: POWELL | O885: RICHARDSON
A886: PRESTON | C886: 7 | D886: 4 | E886: 46 | G886: 8 | H886: 7 | I886: 55 | K886: 11 | L886: 14 | M886: 80 | O886: 16 | P886: 19 | Q886: 115 | S886: Venue: PRESTON
A887: WERRIBEE | C887: 3 | D887: 3 | E887: 21 | G887: 5 | H887: 9 | I887: 39 | K887: 8 | L887: 12 | M887: 60 | O887: 14 | P887: 15 | Q887: 99 | S887: LUCKMAN :LAWLER
A888: BEST PLAYERS
A889: PRESTON | C889: TEAM EFFORT
A890: WERRIBEE | C890: DOMBERG | F890: ALLDAY | I890: CHAPMAN | L890: HARRIS | O890: KNIGHT | R890: McMASTER
A891: GOALKICKERS
A892: PRESTON | C892: SHAW 4 | E892: NICOLAOU 3 | H892: LUMICISI 2 | J892: JORDAN 2 | M892: HALAS 2 | O892: SALVADORE | R892: SENNO | T892: DINTINOSANTE
A893: WERRIBEE | C893: KNIGHT 3 | F893: GEARY 2 | H893: SIZER 2 | J893: MORRIS 2 | M893: SELLS | O893: RAEBURN | Q893: LESIPUTTY | S893: DOMBERG | V893: LAMB
A895: OAKLEIGH | C895: 5 | D895: 4 | E895: 34 | G895: 8 | H895: 5 | I895: 53 | K895: 13 | L895: 9 | M895: 87 | O895: 17 | P895: 10 | Q895: 112 | S895: Venue: DANDENONG
A896: DANDENONG | C896: 3 | D896: 2 | E896: 20 | G896: 6 | H896: 6 | I896: 42 | K896: 11 | L896: 10 | M896: 76 | O896: 14 | P896: 15 | Q896: 99 | S896: DOWSETT :HOWLETT
A897: BEST PLAYERS
A898: OAKLEIGH | C898: HICKEY | F898: BRIGGS | I898: PRETTO | L898: DYSON | O898: BULTE | Q898: ATHERTON
A899: DANDENONG | C899: LANCE | F899: ELSHAUG | I899: McCORMACK | L899: MILLIGAN
A900: GOALKICKERS
A901: OAKLEIGH | C901: PRETTO 10 | F901: MELLODY 3 | I901: LOWE 2 | K901: DYSON | M901: MITCHELSON
A902: DANDENONG | C902: MILLIGAN 5 | F902: WICKS 3 | H902: LACKO 2 | J902: ELSHAUG | L902: D M BOURKE | O902: McCORMACK | R902: LANCE
A904: FRANKSTON | C904: 3 | D904: 2 | E904: 20 | G904: 5 | H904: 9 | I904: 39 | K904: 13 | L904: 19 | M904: 97 | O904: 18 | P904: 26 | Q904: 134 | S904: Venue: TOORAK PARK
A905: PRAHRAN | C905: 2 | D905: 2 | E905: 14 | G905: 8 | H905: 3 | I905: 51 | K905: 9 | L905: 4 | M905: 58 | O905: 17 | P905: 8 | Q905: 110 | S905: CALLAGHAN :COOK
A906: BEST PLAYERS
A907: FRANKSTON | C907: AMOORE | F907: BELL | I907: BOONKAMP | L907: O'BRIEN | O907: GAHAN | R907: MCCARTHY
A908: PRAHRAN | C908: KILEY | F908: MARK | I908: MORRISSEY | L908: TAPPING | O908: WALFORD | R908: SCICLUNA
A909: GOALKICKERS
A910: FRANKSTON | C910: BOONKAMP 4 | F910: OWEN 4 | H910: GAHAN 3 | J910: McCARTHY 2 | M910: BINGLAY | O910: GAMBLE | Q910: S HAMILL | S910: O'BRIEN | V910: ERRANTE
A911: PRAHRAN | C911: SOULOS 5 | F911: HENRY 3 | H911: WILLIAMSON 3 | K911: TAYLOR | M911: JOHNSON | O911: EVANS | Q911: WALFORD | S911: THORNTON
A913: B'WICK/B'MEAD | C913: 5 | D913: 1 | E913: 31 | G913: 9 | H913: 5 | I913: 59 | K913: 15 | L913: 11 | M913: 101 | O913: 23 | P913: 11 | Q913: 149 | S913: Venue: BEACH ROAD
A914: SANDRINGHAM | C914: 5 | D914: 3 | E914: 33 | G914: 9 | H914: 7 | I914: 61 | K914: 12 | L914: 12 | M914: 84 | O914: 15 | P914: 17 | Q914: 107 | S914: NOLAN ;HOLT
A915: BEST PLAYERS
A916: B'WICK/B'MEAD | C916: TEAM EFFORT
A917: SANDRINGHAM | C917: O'CONNOR | F917: J RUGOLO | I917: PETERS | L917: E FISCHER | O917: BAILEY
A918: GOALKICKERS
A919: B'WICK/B'MEAD | C919: GRIFFITHS 13 | F919: BERTOLLO 4 | I919: WRIGHT 3 | K919: CALLANDER | N919: DAVIS | P919: HOTCHKIN
A920: SANDRINGHAM | C920: HIBBERT 3 | F920: FITZGERALD 3 | I920: F RUGOLO 3 | L920: CULLINANE 2 | O920: MACKENZIE | R920: BERGMAN | V920: BENZIE | X920: BRIAN SAID
A922: ROUND 15 | D922: 4TH AUGUST | I922: WEATHER | S922: Venue: WERRIBEE
D923: 1ST QTR | H923: 2ND QTR | L923: 3RD QTR | P923: FINAL | S923: UMPIRES
A924: WERRIBEE | C924: 6 | D924: 7 | E924: 43 | G924: 8 | H924: 9 | I924: 57 | K924: 11 | L924: 12 | M924: 78 | O924: 17 | P924: 15 | Q924: 117 | S924: RUSSO | X924: LADDER | AA924: ROUND | AC924: 15
A925: DANDENONG | C925: 3 | D925: 2 | E925: 20 | G925: 7 | H925: 6 | I925: 48 | K925: 11 | L925: 8 | M925: 74 | O925: 12 | P925: 14 | Q925: 86 | S925: BULLUSS
A926: BEST PLAYERS | W926: TEAM | X926: W | Y926: L | Z926: D | AA926: FOR | AB926: AGST | AC926: % | AD926: PTS
A927: WERRIBEE | C927: ALLDAY | F927: HARRIS | I927: RAEBURN | L927: FITZPATRICK | O927: RADCLIFFE | R927: KNIGHT
A928: DANDENONG | C928: McCORMACK | F928: ELSHAUG | I928: MILLANE | L928: MEAD | O928: D BOURKE | R928: KANNOURAKIS | W928: SPRINGVALE | X928: 12 | Y928: 3 | Z928: 0 | AA928: 1997 | AB928: 1387 | AC928: =(AA928/AB928)*100 -> 143.97981254506129 | AD928: =(X928*4)+(Z928*2) -> 48
A929: GOALKICKERS | W929: COBURG | X929: 12 | Y929: 3 | Z929: 0 | AA929: 1803 | AB929: 1387 | AC929: =(AA929/AB929)*100 -> 129.99279019466474 | AD929: =(X929*4)+(Z929*2) -> 48
A930: WERRIBEE | C930: O'KEEFE 6 | F930: RAEBURN 3 | I930: SELLS 2 | K930: KNIGHT 2 | M930: MORRIS 2 | O930: SIZER | Q930: McMASTER | W930: WILLIAMSTOWN | X930: 11 | Y930: 4 | Z930: 0 | AA930: 1829 | AB930: 1254 | AC930: =(AA930/AB930)*100 -> 145.85326953748006 | AD930: =(X930*4)+(Z930*2) -> 44
A931: DANDENONG | C931: MILLANE 4 | F931: GILDER 2 | I931: ELSHAUG 2 | L931: WICKS 2 | N931: McCORMACK | Q931: LANCE | W931: PRESTON | X931: 10 | Y931: 4 | Z931: 1 | AA931: 1777 | AB931: 1380 | AC931: =(AA931/AB931)*100 -> 128.768115942029 | AD931: =(X931*4)+(Z931*2) -> 42
D932: 5TH AUGUST | I932: WEATHER | S932: Venue: SPRINGVALE | W932: WERRIBEE | X932: 9 | Y932: 6 | Z932: 0 | AA932: 1810 | AB932: 1532 | AC932: =(AA932/AB932)*100 -> 118.14621409921671 | AD932: =(X932*4)+(Z932*2) -> 36
A933: SPRINGVALE | C933: 1 | D933: 1 | E933: 7 | G933: 6 | H933: 9 | I933: 45 | K933: 10 | L933: 13 | M933: 73 | O933: 13 | P933: 17 | Q933: 95 | S933: MORROW
A934: WILLIAMSTOWN | C934: 7 | D934: 2 | E934: 44 | G934: 8 | H934: 4 | I934: 52 | K934: 11 | L934: 7 | M934: 73 | O934: 13 | P934: 9 | Q934: 87 | S934: HARRIS | W934: DANDEN0NG | X934: 8 | Y934: 6 | Z934: 1 | AA934: 1688 | AB934: 1450 | AC934: =(AA934/AB934)*100 -> 116.41379310344828 | AD934: =(X934*4)+(Z934*2) -> 34
A935: BEST PLAYERS | W935: B'WICK/B'MEAD | X935: 7 | Y935: 8 | Z935: 0 | AA935: 1673 | AB935: 1502 | AC935: =(AA935/AB935)*100 -> 111.38482023968041 | AD935: =(X935*4)+(Z935*2) -> 28
A936: SPRINGVALE | C936: DEMPSTER | F936: KOOP | I936: ROBINSON | L936: NICOL | O936: BROMAGE | W936: PORT MELBOURNE | X936: 7 | Y936: 8 | Z936: 0 | AA936: 1728 | AB936: 1823 | AC936: =(AA936/AB936)*100 -> 94.7888096544158 | AD936: =(X936*4)+(Z936*2) -> 28
A937: WILLIAMSTOWN | C937: SMITH | F937: McTAGGART | I937: MITCHELL | L937: MILES | O937: SWAN | W937: FRANKSTON | X937: 7 | Y937: 8 | Z937: 0 | AA937: 1674 | AB937: 1773 | AC937: =(AA937/AB937)*100 -> 94.416243654822338 | AD937: =(X937*4)+(Z937*2) -> 28
A938: GOALKICKERS | R938: DEMPSTER | W938: SANDRINGHAM | X938: 7 | Y938: 8 | Z938: 0 | AA938: 1667 | AB938: 1875 | AC938: =(AA938/AB938)*100 -> 88.906666666666666 | AD938: =(X938*4)+(Z938*2) -> 28
A939: SPRINGVALE | C939: ROBINSON 4 | F939: BROMAGE 2 | I939: KEIPERT | K939: SHANNON | M939: DUDLEY | O939: CLARKE | Q939: ATKINS | S939: PHILLIPS | W939: BOX HILL | X939: 6 | Y939: 9 | Z939: 0 | AA939: 1955 | AB939: 1824 | AC939: =(AA939/AB939)*100 -> 107.18201754385966 | AD939: =(X939*4)+(Z939*2) -> 24
A940: WILLIAMSTOWN | C940: MOURNEY 4 | F940: RICKMAN 3 | I940: AZIZ | K940: BURTON | M940: SWAN | O940: SMITH | Q940: O'CONNOR | S940: MUSCHIALLI | W940: OAKLEIGH | X940: 4 | Y940: 11 | Z940: 0 | AA940: 1638 | AB940: 2068 | AC940: =(AA940/AB940)*100 -> 79.206963249516434 | AD940: =(X940*4)+(Z940*2) -> 16
S941: Venue: PORT MELBOURNE | W941: PRAHRAN | X941: 4 | Y941: 11 | Z941: 0 | AA941: 1446 | AB941: 1844 | AC941: =(AA941/AB941)*100 -> 78.416485900216912 | AD941: =(X941*4)+(Z941*2) -> 16
A942: BOX HILL | C942: 4 | D942: 3 | E942: 27 | G942: 9 | H942: 6 | I942: 60 | K942: 16 | L942: 8 | M942: 104 | O942: 19 | P942: 10 | Q942: 124 | S942: LUCKMAN | W942: CAMBERWELL | X942: 0 | Y942: 15 | Z942: 0 | AA942: 1200 | AB942: 2442 | AC942: =(AA942/AB942)*100 -> 49.140049140049143 | AD942: =(X942*4)+(Z942*2) -> 0
A943: PORT MELBOURNE | C943: 3 | D943: 3 | E943: 21 | G943: 8 | H943: 6 | I943: 54 | K943: 11 | L943: 8 | M943: 74 | O943: 14 | P943: 13 | Q943: 97 | S943: McKERNAN
A944: BEST PLAYERS
A945: BOX HILL | C945: DALRYMPLE | F945: HOLT | I945: LISLE | L945: HANDLEY | O945: HICKS | Q945: ZARAFA
A946: PORT MELBOURNE | C946: WALL | F946: HARKINS | I946: HARLAND | L946: MUTIMER | O946: ERWIN | Q946: FOLEY
A947: GOALKICKERS | Q947: BOURKE
A948: BOX HILL | C948: ZARAFA 5 | F948: HANDLEY 5 | I948: DELL 2 | K948: HICKS 2 | M948: P BOLTON | O948: NICOLSON | Q948: REEVES | S948: ROSSELEY
A949: PORT MELBOURNE | C949: HICKS 4 | E949: CAMERON 2 | H949: FOLEY | J949: TEMAY | L949: ERWIN | N949: HARLAND | P949: WALL | R949: S SCURRAH
M950: MUTIMER
A951: PRESTON | C951: 5 | D951: 3 | E951: 33 | G951: 8 | H951: 8 | I951: 56 | K951: 17 | L951: 12 | M951: 114 | O951: 22 | P951: 19 | Q951: 151 | S951: Venue: CAMBERWELL
A952: CAMBERWELL | C952: 4 | D952: 3 | E952: 27 | G952: 4 | H952: 6 | I952: 30 | K952: 6 | L952: 7 | M952: 43 | O952: 9 | P952: 9 | Q952: 63 | S952: AGNEW ;NOLAN
A953: BEST PLAYERS
A954: PRESTON | C954: OWEN | F954: SHAW | I954: JORDAN | L954: DUNBAR | O954: SALVADOR | R954: LUMICISI
A955: CAMBERWELL | C955: T VITACCA | F955: HOLLOWAY | I955: POWELL
A956: GOALKICKERS
A957: PRESTON | C957: SHAW 7 | E957: SALVADOR 6 | H957: LUMICISI 2 | J957: SENNO 2 | L957: MAZOCCA | N957: JORDAN | P957: MARCON | R957: PRIDEAUX | U957: BURROWS
A958: CAMBERWELL | C958: WYNN 3 | E958: FITZPATRICK 2 | H958: WILKINSON | J958: BUDGE | L958: MERTON | N958: H MITCHELL
A960: OAKLEIGH | C960: 6 | D960: 2 | E960: 38 | G960: 7 | H960: 6 | I960: 48 | K960: 17 | L960: 10 | M960: 112 | O960: 21 | P960: 12 | Q960: 138 | S960: Venue: OAKLEIGH
A961: PRAHRAN | C961: 4 | D961: 3 | E961: 27 | G961: 6 | H961: 8 | I961: 44 | K961: 10 | L961: 10 | M961: 70 | O961: 16 | P961: 13 | Q961: 109 | S961: THOMPSON :CALLAGHAN
A962: BEST PLAYERS
A963: OAKLEIGH | C963: DYSON | F963: SMITH | I963: PRETTO | L963: BRIGGS | O963: GARBUIO | R963: HICKEY
A964: PRAHRAN | C964: JOHNSON | F964: MORRISSEY | I964: SCICLUNA
A965: GOALKICKERS
A966: OAKLEIGH | C966: PRETTO 8 | F966: DYSON 3 | H966: WELSFORD 2 | K966: LOWE 2 | M966: COWLED 2 | O966: MELLODY | Q966: OWEN | S966: SMITH | U966: BRIGGS
A967: PRAHRAN | C967: RYAN 4 | F967: CUTLER 3 | H967: SOULOS 2 | J967: HENRY 2 | L967: R JOHNSON 2 | O967: THORNTON 2 | R967: TAYLOR
A969: FRANKSTON | C969: 8 | D969: 2 | E969: 50 | G969: 12 | H969: 5 | I969: 77 | K969: 14 | L969: 14 | M969: 98 | O969: 19 | P969: 15 | Q969: 129 | S969: Venue: FRANKSTON
A970: SANDRINGHAM | C970: 4 | D970: 2 | E970: 26 | G970: 6 | H970: 6 | I970: 42 | K970: 7 | L970: 10 | M970: 52 | O970: 11 | P970: 15 | Q970: 81 | S970: DAVIE :MARSHALL
A971: BEST PLAYERS
A972: FRANKSTON | C972: DENEREAZ | F972: S HAMILL | I972: T HAMILL | L972: GAHAN | O972: MACE | R972: OWEN
A973: SANDRINGHAM | C973: EAVES | F973: McGANNON | I973: PRATT | L973: BAILEY | O973: J RUGOLO
A974: GOALKICKERS
A975: FRANKSTON | C975: OWEN 5 | E975: GAHAN 4 | G975: BINGLEY 3 | I975: BOONKAMP 2 | L975: ERRANTE 2 | N975: BELL | P975: O'BRIEN | R975: D MARTIN
A976: SANDRINGHAM | C976: EAVES 3 | F976: PRATT 3 | H976: FOLEY 2 | J976: F RUGOLO 2 | M976: HIBBERT
A978: COBURG | C978: 5 | D978: 1 | E978: 31 | G978: 9 | H978: 7 | I978: 61 | K978: 9 | L978: 9 | M978: 63 | O978: 14 | P978: 13 | Q978: 97 | S978: Venue: BRUNSWICK
A979: B'WICK/B'MEAD | C979: 3 | D979: 2 | E979: 20 | G979: 4 | H979: 3 | I979: 27 | K979: 12 | L979: 7 | M979: 79 | O979: 13 | P979: 10 | Q979: 88 | S979: LAWLER :CALLAGHAN
A980: BEST PLAYERS
A981: COBURG | C981: SULLIVAN | F981: GUMLEY | I981: LANGAN | L981: WILLIAMS | O981: DARBY | R981: GREEN
A982: B'WICK/B'MEAD | C982: HOTCHKIN | F982: CLARKE | I982: CALLANDER | L982: POPE | O982: DIEULLIO
A983: GOALKICKERS
A984: COBURG | C984: DARBY 4 | F984: KEMPSTER 4 | I984: ALLISON 2 | K984: SULLIVAN 2 | N984: WILLIAMS | Q984: DOYLE
A985: B'WICK/B'MEAD | C985: CLARKE 3 | F985: DRAIN 3 | H985: LUMSDEN 2 | K985: REID 2 | M985: GRIFFITHS | O985: BONE | Q985: DIEULLIO
A987: ROUND 16 | D987: 11TH AUGUST | I987: WEATHER | S987: Venue: COBURG
D988: 1ST QTR | H988: 2ND QTR | L988: 3RD QTR | P988: FINAL | S988: UMPIRES
A989: WILLIAMSTOWN | C989: 10 | D989: 6 | E989: 66 | G989: 16 | H989: 11 | I989: 107 | K989: 19 | L989: 16 | M989: 130 | O989: 22 | P989: 19 | Q989: 151 | S989: UMPIRES | X989: LADDER | AA989: ROUND | AC989: 16
A990: COBURG | C990: 2 | D990: 1 | E990: 13 | G990: 6 | H990: 3 | I990: 39 | K990: 8 | L990: 8 | M990: 56 | O990: 12 | P990: 12 | Q990: 84
A991: BEST PLAYERS | W991: TEAM | X991: W | Y991: L | Z991: D | AA991: FOR | AB991: AGST | AC991: % | AD991: PTS
A992: WILLIAMSTOWN | C992: O'CONNOR | F992: ROUND | I992: MUSCHIALLI | L992: AZIZ | O992: McTAGGART | R992: MILES
A993: COBURG | C993: SHELDON | F993: DARBY | I993: LANGAN | L993: GREEN | W993: WILLIAMSTOWN | X993: 12 | Y993: 4 | Z993: 0 | AA993: 1980 | AB993: 1338 | AC993: =(AA993/AB993)*100 -> 147.98206278026908 | AD993: =(X993*4)+(Z993*2) -> 48
A994: GOALKICKERS | Q994: HOWLETT | W994: SPRINGVALE | X994: 12 | Y994: 4 | Z994: 0 | AA994: 2081 | AB994: 1492 | AC994: =(AA994/AB994)*100 -> 139.47721179624665 | AD994: =(X994*4)+(Z994*2) -> 48
A995: WILLIAMSTOWN | C995: MUSCHIALLI 6 | F995: MOURNEY 4 | I995: RICKMAN 3 | L995: BURTON 2 | N995: MINETT 2 | P995: PASTORE 2 | R995: O'CONNOR 2 | W995: COBURG | X995: 12 | Y995: 4 | Z995: 0 | AA995: 1887 | AB995: 1538 | AC995: =(AA995/AB995)*100 -> 122.69180754226268 | AD995: =(X995*4)+(Z995*2) -> 48
A996: COBURG | C996: WILLIAMS 2 | F996: DARBY 2 | H996: KEMPSTER 2 | K996: DOYLE 2 | M996: LANGAN | O996: SHELDON | Q996: TARANTO | S996: LITTLER | W996: PRESTON | X996: 11 | Y996: 4 | Z996: 1 | AA996: 1955 | AB996: 1452 | AC996: =(AA996/AB996)*100 -> 134.64187327823691 | AD996: =(X996*4)+(Z996*2) -> 46
D997: 12TH AUGUST | I997: WEATHER | S997: Venue: BOX HILL | W997: WERRIBEE | X997: 10 | Y997: 6 | Z997: 0 | AA997: 1926 | AB997: 1642 | AC997: =(AA997/AB997)*100 -> 117.29598051157126 | AD997: =(X997*4)+(Z997*2) -> 40
A998: BOX HILL | C998: 2 | D998: 4 | E998: 16 | G998: 4 | H998: 9 | I998: 33 | K998: 9 | L998: 12 | M998: 66 | O998: 15 | P998: 15 | Q998: 105 | S998: GREEN
A999: SPRINGVALE | C999: 5 | D999: 1 | E999: 31 | G999: 8 | H999: 3 | I999: 51 | K999: 11 | L999: 5 | M999: 71 | O999: 13 | P999: 6 | Q999: 84 | S999: THOMPSON | W999: DANDEN0NG | X999: 9 | Y999: 6 | Z999: 1 | AA999: 1887 | AB999: 1480 | AC999: =(AA999/AB999)*100 -> 127.5 | AD999: =(X999*4)+(Z999*2) -> 38
A1000: BEST PLAYERS | W1000: FRANKSTON | X1000: 8 | Y1000: 8 | Z1000: 0 | AA1000: 1775 | AB1000: 1812 | AC1000: =(AA1000/AB1000)*100 -> 97.958057395143484 | AD1000: =(X1000*4)+(Z1000*2) -> 32
A1001: BOX HILL | C1001: HANDLEY | F1001: HEANEY | I1001: LISLE | L1001: DALRYMPLE | O1001: DELL | Q1001: HOLT | W1001: SANDRINGHAM | X1001: 8 | Y1001: 8 | Z1001: 0 | AA1001: 1785 | AB1001: 1977 | AC1001: =(AA1001/AB1001)*100 -> 90.28831562974203 | AD1001: =(X1001*4)+(Z1001*2) -> 32
A1002: SPRINGVALE | C1002: DEMPSTER | F1002: P MALONI | I1002: JEFFS | L1002: ATKINS | O1002: CLARK | Q1002: KOOP | W1002: BOX HILL | X1002: 7 | Y1002: 9 | Z1002: 0 | AA1002: 2060 | AB1002: 1908 | AC1002: =(AA1002/AB1002)*100 -> 107.9664570230608 | AD1002: =(X1002*4)+(Z1002*2) -> 28
A1003: GOALKICKERS | W1003: B'WICK/B'MEAD | X1003: 7 | Y1003: 9 | Z1003: 0 | AA1003: 1712 | AB1003: 1603 | AC1003: =(AA1003/AB1003)*100 -> 106.79975046787274 | AD1003: =(X1003*4)+(Z1003*2) -> 28
A1004: BOX HILL | C1004: HANDLEY 6 | F1004: BOURKE 3 | I1004: HICKS 2 | K1004: P BOLTON | M1004: ZARAFA | O1004: NICHOLSON | R1004: BROWN | W1004: PORT MELBOURNE | X1004: 7 | Y1004: 9 | Z1004: 0 | AA1004: 1800 | AB1004: 2001 | AC1004: =(AA1004/AB1004)*100 -> 89.955022488755617 | AD1004: =(X1004*4)+(Z1004*2) -> 28
A1005: SPRINGVALE | C1005: CLARKE 4 | F1005: ROBINSON 2 | I1005: P MALONI 2 | L1005: T ELLIOTT 2 | O1005: MITHEN | Q1005: KOOP | S1005: ATKINS | W1005: OAKLEIGH | X1005: 4 | Y1005: 12 | Z1005: 0 | AA1005: 1740 | AB1005: 2186 | AC1005: =(AA1005/AB1005)*100 -> 79.597438243366881 | AD1005: =(X1005*4)+(Z1005*2) -> 16
S1006: Venue: PRESTON | W1006: PRAHRAN | X1006: 4 | Y1006: 12 | Z1006: 0 | AA1006: 1556 | AB1006: 1960 | AC1006: =(AA1006/AB1006)*100 -> 79.387755102040813 | AD1006: =(X1006*4)+(Z1006*2) -> 16
A1007: PRESTON | C1007: 3 | D1007: 7 | E1007: 25 | G1007: 13 | H1007: 12 | I1007: 90 | K1007: 22 | L1007: 16 | M1007: 148 | O1007: 26 | P1007: 22 | Q1007: 178 | S1007: HOWLETT | W1007: CAMBERWELL | X1007: 0 | Y1007: 16 | Z1007: 0 | AA1007: 1230 | AB1007: 2641 | AC1007: =(AA1007/AB1007)*100 -> 46.573267701628176 | AD1007: =(X1007*4)+(Z1007*2) -> 0
A1008: PORT MELBOURNE | C1008: 1 | D1008: 2 | E1008: 8 | G1008: 3 | H1008: 6 | I1008: 24 | K1008: 6 | L1008: 10 | M1008: 46 | O1008: 10 | P1008: 12 | Q1008: 72 | S1008: HARRIS
A1009: BEST PLAYERS
A1010: PRESTON | C1010: SALVADORE | F1010: HALAS | I1010: LUMICISI | L1010: JORDAN
A1011: PORT MELBOURNE | C1011: STROOPER | F1011: TEMAY | I1011: PRITCHARD | L1011: HARKINS | O1011: KENNEDY | R1011: CAMERON
A1012: GOALKICKERS | L1012: MARCON | N1012: HALL | P1012: DUNBAR | R1012: OWEN
A1013: PRESTON | C1013: SALVADORE 5 | F1013: SHAW 4 | H1013: HALAS 4 | J1013: LUMICISI 3 | M1013: NICOLAOU 3 | P1013: SENNO 2 | R1013: JORDAN
A1014: PORT MELBOURNE | C1014: CONDON 4 | F1014: KENNEDY | I1014: HETHERTON | L1014: HICKS | N1014: CAMERON | Q1014: HARLAND | S1014: LIDDLE
A1016: DANDENONG | C1016: 4 | D1016: 5 | E1016: 29 | G1016: 9 | H1016: 13 | I1016: 67 | K1016: 18 | L1016: 17 | M1016: 125 | O1016: 30 | P1016: 19 | Q1016: 199 | S1016: Venue: DANDENONG
A1017: CAMBERWELL | C1017: 1 | D1017: 1 | E1017: 7 | G1017: 2 | H1017: 3 | I1017: 15 | K1017: 2 | L1017: 4 | M1017: 16 | O1017: 4 | P1017: 6 | Q1017: 30 | S1017: DAVID :COOK
A1018: BEST PLAYERS
A1019: DANDENONG | C1019: KNIGHT | F1019: GARRETT | I1019: ATKINSON | L1019: D M BOURKE | O1019: ELSHAUG | R1019: MILLIGAN
A1020: CAMBERWELL | C1020: FAFFOUTELLIS
A1021: GOALKICKERS
A1022: DANDENONG | C1022: GARRETT 8 | E1022: MILLIGAN 4 | H1022: GILDER 3 | J1022: LACKO 3 | L1022: ELSHAUG 3 | N1022: MILLANE 2 | Q1022: KANNOURAKIS 2 | U1022: LANCE 2 | X1022: KNIGHT | AA1022: WICKS | AC1022: McCONCHIE
A1023: CAMBERWELL | C1023: BUDGE 2 | F1023: WILKINSON | I1023: FAFFOUTELLIS
A1025: WERRIBEE | C1025: 3 | D1025: 6 | E1025: 24 | G1025: 5 | H1025: 8 | I1025: 38 | K1025: 12 | L1025: 11 | M1025: 83 | O1025: 17 | P1025: 14 | Q1025: 116 | S1025: Venue: TOORAK PARK
A1026: PRAHRAN | C1026: 4 | D1026: 5 | E1026: 29 | G1026: 9 | H1026: 11 | I1026: 65 | K1026: 13 | L1026: 12 | M1026: 90 | O1026: 16 | P1026: 14 | Q1026: 110 | S1026: AGNEW :CARLAND
A1027: BEST PLAYERS
A1028: WERRIBEE | C1028: FITZPATRICK | F1028: MORRIS | I1028: WALSH | L1028: LESIPUTTY | O1028: SIZER | Q1028: ALLDAY
A1029: PRAHRAN | C1029: SOULOS | F1029: LANGAN | I1029: JOHNSON | L1029: MARK | O1029: CUTLER
A1030: GOALKICKERS
A1031: WERRIBEE | C1031: O'KEEFE 6 | F1031: SELLS 3 | H1031: RAEBURN 2 | J1031: MORRIS 2 | M1031: SIZER | N1031: McMASTER | P1031: WALPOLE | R1031: LESIPUTTY
A1032: PRAHRAN | C1032: SOULOS 3 | F1032: CUTLER 3 | H1032: PAGE 2 | J1032: TAYLOR 2 | M1032: R JOHNSON 2 | P1032: RYAN 2 | R1032: LANGAN | U1032: EVANS
A1034: SANDRINGHAM | C1034: 7 | D1034: 3 | E1034: 45 | G1034: 11 | H1034: 9 | I1034: 75 | K1034: 13 | L1034: 15 | M1034: 93 | O1034: 16 | P1034: 22 | Q1034: 118 | S1034: Venue: BEACH ROAD
A1035: OAKLEIGH | C1035: 4 | D1035: 4 | E1035: 28 | G1035: 7 | H1035: 7 | I1035: 49 | K1035: 12 | L1035: 9 | M1035: 81 | O1035: 15 | P1035: 12 | Q1035: 102 | S1035: GERSCH :VAN BEEK
A1036: BEST PLAYERS
A1037: SANDRINGHAM | C1037: BAILEY | F1037: FOLEY | I1037: McGANNON | L1037: ALLEN | O1037: PETERS | Q1037: O'CONNOR
A1038: OAKLEIGH | C1038: SMITH | F1038: QUIRK | I1038: ATHERTON | L1038: GARBUIO | O1038: BRIGGS | Q1038: MITCHELSON
A1039: GOALKICKERS
A1040: SANDRINGHAM | C1040: PETERS 4 | F1040: EAVES 2 | H1040: E FISCHER 2 | K1040: IRWIN 2 | M1040: HOWARD | O1040: FOLEY | Q1040: HIBBERT | S1040: F RUGOLO | V1040: CULLINANE | X1040: OGG
A1041: OAKLEIGH | C1041: PRETTO 3 | F1041: MELLODY 3 | I1041: SMITH 3 | K1041: MITCHELSON 2 | N1041: RYAN 2 | P1041: GARBUIO | R1041: COWLED
A1043: FRANKSTON | C1043: 3 | D1043: 2 | E1043: 20 | G1043: 7 | H1043: 9 | I1043: 51 | K1043: 7 | L1043: 12 | M1043: 54 | O1043: 14 | P1043: 17 | Q1043: 101 | S1043: Venue: BRUNSWICK
A1044: B'WICK/B'MEAD | C1044: 2 | D1044: 5 | E1044: 17 | G1044: 2 | H1044: 6 | I1044: 18 | K1044: 4 | L1044: 7 | M1044: 31 | O1044: 5 | P1044: 9 | Q1044: 39
A1045: BEST PLAYERS
A1046: FRANKSTON | C1046: MACE | F1046: BELL | I1046: S HAMILL | L1046: O'BRIEN | O1046: BINGLEY | R1046: McCARTHY
A1047: B'WICK/B'MEAD | C1047: CLARKE | F1047: DAVIS | I1047: DIEULLIO | L1047: THOROGOOD | O1047: EAMES | R1047: McALLESTER
A1048: GOALKICKERS
A1049: FRANKSTON | C1049: BINGLEY 4 | F1049: GAMBLE 3 | I1049: McCARTHY 2 | L1049: GAHAN | N1049: STEVENSON | Q1049: S HAMILL | S1049: BOONKAMP | W1049: D MARTIN
A1050: B'WICK/B'MEAD | C1050: GRIFFITHS 3 | F1050: BONE | H1050: McALLESTER
A1052: ROUND 17 | D1052: 18TH AUGUST | I1052: WEATHER | S1052: Venue: SPRINGVALE
D1053: 1ST QTR | H1053: 2ND QTR | L1053: 3RD QTR | P1053: FINAL | S1053: UMPIRES
A1054: PRESTON | C1054: 6 | D1054: 3 | E1054: 39 | G1054: 12 | H1054: 9 | I1054: 81 | K1054: 15 | L1054: 14 | M1054: 104 | O1054: 22 | P1054: 16 | Q1054: 148 | S1054: MORROW | X1054: LADDER | AA1054: ROUND | AC1054: 17
A1055: SPRINGVALE | C1055: 4 | D1055: 4 | E1055: 28 | G1055: 5 | H1055: 6 | I1055: 36 | K1055: 9 | L1055: 8 | M1055: 62 | O1055: 14 | P1055: 11 | Q1055: 95 | S1055: CARLAND
A1056: BEST PLAYERS | W1056: TEAM | X1056: W | Y1056: L | Z1056: D | AA1056: FOR | AB1056: AGST | AC1056: % | AD1056: PTS
A1057: PRESTON | C1057: SHAW | F1057: DUNBAR | I1057: HALL | L1057: JORDAN | O1057: PRITCHARD | R1057: NICOLAOU
A1058: SPRINGVALE | C1058: NICOL | F1058: MAYLIN | I1058: JEFFS | L1058: MENDE | O1058: CLARK | R1058: KOOP | W1058: PRESTON | X1058: 12 | Y1058: 4 | Z1058: 1 | AA1058: 2103 | AB1058: 1547 | AC1058: =(AA1058/AB1058)*100 -> 135.94053005817713 | AD1058: =(X1058*4)+(Z1058*2) -> 50
A1059: GOALKICKERS | Q1059: HALAS | S1059: DUNBAR | W1059: WILLIAMSTOWN | X1059: 12 | Y1059: 5 | Z1059: 0 | AA1059: 2089 | AB1059: 1454 | AC1059: =(AA1059/AB1059)*100 -> 143.67262723521321 | AD1059: =(X1059*4)+(Z1059*2) -> 48
A1060: PRESTON | C1060: SHAW 10 | E1060: MARCON 3 | H1060: LUMICISI 2 | J1060: NICOLAOU 2 | M1060: SALVADORE | P1060: SENNO | R1060: JORDAN | W1060: SPRINGVALE | X1060: 12 | Y1060: 5 | Z1060: 0 | AA1060: 2176 | AB1060: 1640 | AC1060: =(AA1060/AB1060)*100 -> 132.6829268292683 | AD1060: =(X1060*4)+(Z1060*2) -> 48
A1061: SPRINGVALE | C1061: ROBINSON 4 | F1061: SHANNON 2 | I1061: CLARKE 2 | K1061: MITHEN | M1061: DUDLEY | O1061: KOOP | Q1061: ATKINS | S1061: MAYLIN | W1061: COBURG | X1061: 12 | Y1061: 5 | Z1061: 0 | AA1061: 1976 | AB1061: 1672 | AC1061: =(AA1061/AB1061)*100 -> 118.18181818181819 | AD1061: =(X1061*4)+(Z1061*2) -> 48
D1062: 19TH AUGUST | I1062: WEATHER | N1062: MENDE | S1062: Venue: PORT MELBOURNE | W1062: WERRIBEE | X1062: 11 | Y1062: 6 | Z1062: 0 | AA1062: 2107 | AB1062: 1765 | AC1062: =(AA1062/AB1062)*100 -> 119.37677053824362 | AD1062: =(X1062*4)+(Z1062*2) -> 44
A1063: DANDENONG | C1063: 6 | D1063: 3 | E1063: 39 | G1063: 11 | H1063: 7 | I1063: 73 | K1063: 17 | L1063: 10 | M1063: 112 | O1063: 22 | P1063: 13 | Q1063: 145 | S1063: LAWLER
A1064: PORT MELBOURNE | C1064: 5 | D1064: 2 | E1064: 32 | G1064: 7 | H1064: 6 | I1064: 48 | K1064: 10 | L1064: 8 | M1064: 68 | O1064: 14 | P1064: 11 | Q1064: 95 | S1064: MARSHALL | W1064: DANDEN0NG | X1064: 10 | Y1064: 6 | Z1064: 1 | AA1064: 2032 | AB1064: 1575 | AC1064: =(AA1064/AB1064)*100 -> 129.01587301587301 | AD1064: =(X1064*4)+(Z1064*2) -> 42
A1065: BEST PLAYERS | W1065: FRANKSTON | X1065: 9 | Y1065: 8 | Z1065: 0 | AA1065: 1909 | AB1065: 1901 | AC1065: =(AA1065/AB1065)*100 -> 100.42083114150446 | AD1065: =(X1065*4)+(Z1065*2) -> 36
A1066: DANDENONG | C1066: GARRETT | F1066: GILDER | I1066: KNIGHT | L1066: MILLIGAN | O1066: MILLANE | R1066: D M BOURKE | W1066: BOX HILL | X1066: 8 | Y1066: 9 | Z1066: 0 | AA1066: 2176 | AB1066: 2017 | AC1066: =(AA1066/AB1066)*100 -> 107.88299454635597 | AD1066: =(X1066*4)+(Z1066*2) -> 32
A1067: PORT MELBOURNE | C1067: HARKINS | F1067: FORD | I1067: KENNEDY | L1067: LOVE | O1067: HETHERTON | R1067: GOLDIE | W1067: B'WICK/B'MEAD | X1067: 8 | Y1067: 9 | Z1067: 0 | AA1067: 1822 | AB1067: 1710 | AC1067: =(AA1067/AB1067)*100 -> 106.54970760233917 | AD1067: =(X1067*4)+(Z1067*2) -> 32
A1068: GOALKICKERS | P1068: MILLANE | R1068: TODD | W1068: SANDRINGHAM | X1068: 8 | Y1068: 9 | Z1068: 0 | AA1068: 1908 | AB1068: 2158 | AC1068: =(AA1068/AB1068)*100 -> 88.415199258572756 | AD1068: =(X1068*4)+(Z1068*2) -> 32
A1069: DANDENONG | C1069: GARRETT 7 | E1069: GILDER 4 | G1069: LACKO 3 | I1069: BRADDY 2 | K1069: KNIGHT | M1069: MILLANE | O1069: D M BOURKE | R1069: MCCORMACK | W1069: PORT MELBOURNE | X1069: 7 | Y1069: 10 | Z1069: 0 | AA1069: 1895 | AB1069: 2146 | AC1069: =(AA1069/AB1069)*100 -> 88.303821062441756 | AD1069: =(X1069*4)+(Z1069*2) -> 28
A1070: PORT MELBOURNE | C1070: LOVE 6 | F1070: HICKS 3 | H1070: ASANI 2 | J1070: KENNEDY | M1070: S SCURRAH | P1070: KING | W1070: PRAHRAN | X1070: 5 | Y1070: 12 | Z1070: 0 | AA1070: 1668 | AB1070: 2018 | AC1070: =(AA1070/AB1070)*100 -> 82.656095143706636 | AD1070: =(X1070*4)+(Z1070*2) -> 20
S1071: Venue: CAMBERWELL | W1071: OAKLEIGH | X1071: 4 | Y1071: 13 | Z1071: 0 | AA1071: 1847 | AB1071: 2296 | AC1071: =(AA1071/AB1071)*100 -> 80.444250871080129 | AD1071: =(X1071*4)+(Z1071*2) -> 16
A1072: PRAHRAN | C1072: 4 | D1072: 6 | E1072: 30 | G1072: 8 | H1072: 7 | I1072: 55 | K1072: 11 | L1072: 16 | M1072: 82 | O1072: 15 | P1072: 22 | Q1072: 112 | S1072: KILNER | W1072: CAMBERWELL | X1072: 0 | Y1072: 17 | Z1072: 0 | AA1072: 1288 | AB1072: 2753 | AC1072: =(AA1072/AB1072)*100 -> 46.785325099891026 | AD1072: =(X1072*4)+(Z1072*2) -> 0
A1073: CAMBERWELL | C1073: 2 | D1073: 3 | E1073: 15 | G1073: 5 | H1073: 7 | I1073: 37 | K1073: 5 | L1073: 11 | M1073: 41 | O1073: 7 | P1073: 16 | Q1073: 58 | S1073: GERSCH
A1074: BEST PLAYERS
A1075: PRAHRAN | C1075: LANGAN | F1075: RYAN | I1075: SOULOS | L1075: CUTLER | O1075: JOHNSON | R1075: ATKINS
A1076: CAMBERWELL | C1076: GREIG | F1076: MERTON | I1076: N MITCHELL
A1077: GOALKICKERS
A1078: PRAHRAN | C1078: SOULOS 4 | F1078: THORNTON 4 | I1078: EVANS 2 | K1078: PAGE | M1078: TAYLOR | O1078: JOHNSON | Q1078: KILEY | R1078: HANRAHAN
A1079: CAMBERWELL | C1079: MERTON 2 | F1079: RICHARDSON 2 | I1079: WILKINSON | L1079: WYNN | N1079: FITZPATRICK
A1081: WERRIBEE | C1081: 9 | D1081: 2 | E1081: 56 | G1081: 16 | H1081: 4 | I1081: 100 | K1081: 22 | L1081: 8 | M1081: 140 | O1081: 28 | P1081: 13 | Q1081: 181 | S1081: Venue: WERRIBEE
A1082: SANDRINGHAM | C1082: 3 | D1082: 2 | E1082: 20 | G1082: 7 | H1082: 4 | I1082: 46 | K1082: 12 | L1082: 5 | M1082: 77 | O1082: 19 | P1082: 9 | Q1082: 123 | S1082: HARRIS :THOMPSON
A1083: BEST PLAYERS
A1084: WERRIBEE | C1084: DOMBERG | F1084: WALSH | I1084: SELLS | L1084: KNIGHT | O1084: McMASTER | R1084: ALLDAY
A1085: SANDRINGHAM | C1085: J RUGOLO | F1085: HOWARD | I1085: FOLEY | L1085: CULLINANE | O1085: MACKENZIE | R1085: BAILEY
A1086: GOALKICKERS
A1087: WERRIBEE | C1087: SELLS 8 | F1087: O'KEEFE 7 | H1087: KNIGHT 3 | J1087: WALSH 3 | L1087: RAEBURN 2 | N1087: SIZER | P1087: HARRIS | R1087: MCMASTER | V1087: MORRIS | X1087: FITZPATRICK
A1088: SANDRINGHAM | C1088: CULLINANE 6 | F1088: EAVES 3 | H1088: F RUGOLO 3 | K1088: FOLEY 2 | M1088: MACKENZIE 2 | P1088: IRWIN 2 | R1088: HOWARD
A1090: B'WICK/B'MEAD | C1090: 2 | D1090: 3 | E1090: 15 | G1090: 5 | H1090: 6 | I1090: 36 | K1090: 12 | L1090: 10 | M1090: 82 | O1090: 16 | P1090: 14 | Q1090: 110 | S1090: Venue: OAKLEIGH
A1091: OAKLEIGH | C1091: 4 | D1091: 4 | E1091: 28 | G1091: 8 | H1091: 9 | I1091: 57 | K1091: 11 | L1091: 14 | M1091: 80 | O1091: 15 | P1091: 17 | Q1091: 107 | S1091: LUCKMAN :McKERNAN
A1092: BEST PLAYERS
A1093: B'WICK/B'MEAD | C1093: CLARKE | F1093: EAMES | I1093: DIEULLIO | L1093: DUGGAN | O1093: HILL | R1093: WRIGHT
A1094: OAKLEIGH | C1094: HICKEY | F1094: GARBUIO | I1094: MITCHELSON | L1094: BULTE
A1095: GOALKICKERS
A1096: B'WICK/B'MEAD | C1096: GRIFFITHS 4 | F1096: DAVIS 3 | H1096: McGREGOR 2 | K1096: BERTOLLO | M1096: BONE | N1096: CLARKE | P1096: DIEULLIO | R1096: WRIGHT | U1096: REID | W1096: HILL
A1097: OAKLEIGH | C1097: PRETTO 6 | F1097: OWEN 3 | H1097: WELSFORD 2 | K1097: MITCHELSON | N1097: GARBUIO | P1097: SMITH | R1097: HICKEY
A1099: FRANKSTON | C1099: 3 | D1099: 3 | E1099: 21 | G1099: 9 | H1099: 7 | I1099: 61 | K1099: 10 | L1099: 8 | M1099: 68 | O1099: 20 | P1099: 14 | Q1099: 134 | S1099: Venue: FRANKSTON
A1100: COBURG | C1100: 4 | D1100: 4 | E1100: 28 | G1100: 5 | H1100: 7 | I1100: 37 | K1100: 10 | L1100: 12 | M1100: 72 | O1100: 12 | P1100: 17 | Q1100: 89 | S1100: NOLAN :VINEY
A1101: BEST PLAYERS
A1102: FRANKSTON | C1102: S HAMILL | F1102: GAHAN | I1102: MCCARTHY | L1102: WEST | O1102: T HAMILL
A1103: COBURG | C1103: SULLIVAN | F1103: RYAN | I1103: ANGWIN | L1103: DOYLE | O1103: NIMMO | R1103: COMITO
A1104: GOALKICKERS
A1105: FRANKSTON | C1105: GAHAN 4 | F1105: OWEN 4 | H1105: McCARTHY 3 | K1105: STEVENSON 2 | N1105: WEST 2 | P1105: O'BRIEN 2 | R1105: BROWN | U1105: BOONKAMP | X1105: P MARTIN
A1106: COBURG | C1106: WEATHERALD 5 | F1106: LANGAN | H1106: ANGWIN | J1106: REYNOLDSON | M1106: BURKE | O1106: TARANTO | Q1106: DOYLE | S1106: RYAN
A1108: BOX HILL | C1108: 5 | D1108: 5 | E1108: 35 | G1108: 8 | H1108: 8 | I1108: 56 | K1108: 11 | L1108: 11 | M1108: 77 | O1108: 17 | P1108: 14 | Q1108: 116 | S1108: Venue: WILLIAMSTOWN
A1109: WILLIAMSTOWN | C1109: 4 | D1109: 6 | E1109: 30 | G1109: 9 | H1109: 10 | I1109: 64 | K1109: 13 | L1109: 15 | M1109: 93 | O1109: 15 | P1109: 19 | Q1109: 109 | S1109: HOWLETT :SNEDDON
A1110: BEST PLAYERS
A1111: BOX HILL | C1111: NICHOLSON | F1111: B HOGAN | I1111: DALRYMPLE | L1111: DELL | O1111: HICKS | R1111: HEANEY
A1112: WILLIAMSTOWN | C1112: MITCHELL | F1112: MOURNEY | I1112: AZIZ | L1112: PASTORE | O1112: HOWLETT | R1112: SMITH
A1113: GOALKICKERS
A1114: BOX HILL | C1114: HICKS 4 | E1114: BOURKE 3 | G1114: PENNY 2 | I1114: ZARAFA 2 | K1114: NICHOLSON 2 | N1114: BOX | P1114: HANDLEY | R1114: DALRYMPLE | V1114: FRANCIS
A1115: WILLIAMSTOWN | C1115: MOURNEY 6 | F1115: PASTORE 2 | I1115: MUSCHIALLI 2 | L1115: BURTON | N1115: HOWLETT | P1115: SMITH | R1115: O'CONNOR | U1115: MILES
A1117: ROUND 18 | D1117: 25TH AUGUST | I1117: WEATHER | S1117: Venue: PRESTON
D1118: 1ST QTR | H1118: 2ND QTR | L1118: 3RD QTR | P1118: FINAL | S1118: UMPIRES
A1119: PRESTON | C1119: 3 | D1119: 6 | E1119: 24 | G1119: 7 | H1119: 8 | I1119: 50 | K1119: 11 | L1119: 12 | M1119: 78 | O1119: 12 | P1119: 13 | Q1119: 85 | S1119: LAWLER | X1119: LADDER | AA1119: ROUND | AC1119: 18
A1120: WILLIAMSTOWN | C1120: 0 | D1120: 1 | E1120: 1 | G1120: 3 | H1120: 3 | I1120: 21 | K1120: 6 | L1120: 3 | M1120: 39 | O1120: 7 | P1120: 5 | Q1120: 47 | S1120: NOLAN
A1121: BEST PLAYERS | W1121: TEAM | X1121: W | Y1121: L | Z1121: D | AA1121: FOR | AB1121: AGST | AC1121: % | AD1121: PTS
A1122: PRESTON | C1122: DUNBAR | F1122: LUMICISI | I1122: MARCON | L1122: JORDAN | O1122: PRIDEAUX | R1122: OWEN
A1123: WILLIAMSTOWN | C1123: LLOYD | F1123: SWAN | I1123: MITCHELL | L1123: AZIZ | O1123: WHILLAS | W1123: PRESTON | X1123: 13 | Y1123: 4 | Z1123: 1 | AA1123: 2188 | AB1123: 1594 | AC1123: =(AA1123/AB1123)*100 -> 137.26474278544543 | AD1123: =(X1123*4)+(Z1123*2) -> 54
A1124: GOALKICKERS | W1124: SPRINGVALE | X1124: 13 | Y1124: 5 | Z1124: 0 | AA1124: 2279 | AB1124: 1730 | AC1124: =(AA1124/AB1124)*100 -> 131.73410404624278 | AD1124: =(X1124*4)+(Z1124*2) -> 52
A1125: PRESTON | C1125: SHAW 4 | F1125: LUMICISI 2 | I1125: NICOLAOU 2 | L1125: SENNO 2 | N1125: PRIDEAUX | Q1125: DUNBAR | W1125: COBURG | X1125: 13 | Y1125: 5 | Z1125: 0 | AA1125: 2108 | AB1125: 1760 | AC1125: =(AA1125/AB1125)*100 -> 119.77272727272728 | AD1125: =(X1125*4)+(Z1125*2) -> 52
A1126: WILLIAMSTOWN | C1126: SWAN 2 | E1126: MILES 2 | G1126: MUSCHIALLI 2 | J1126: HOWLETT | W1126: WILLIAMSTOWN | X1126: 12 | Y1126: 6 | Z1126: 0 | AA1126: 2136 | AB1126: 1539 | AC1126: =(AA1126/AB1126)*100 -> 138.79142300194931 | AD1126: =(X1126*4)+(Z1126*2) -> 48
D1127: 26TH AUGUST | I1127: WEATHER | R1127: Venue: TOORAK PARK | W1127: WERRIBEE | X1127: 12 | Y1127: 6 | Z1127: 0 | AA1127: 2253 | AB1127: 1813 | AC1127: =(AA1127/AB1127)*100 -> 124.26916712630998 | AD1127: =(X1127*4)+(Z1127*2) -> 48
A1128: PORT MELBOURNE | C1128: 0 | D1128: 7 | E1128: 7 | G1128: 3 | H1128: 9 | I1128: 27 | K1128: 10 | L1128: 15 | M1128: 75 | O1128: 19 | P1128: 17 | Q1128: 131 | S1128: VAN BEEK
A1129: PRAHRAN | C1129: 3 | D1129: 6 | E1129: 24 | G1129: 9 | H1129: 13 | I1129: 67 | K1129: 10 | L1129: 15 | M1129: 75 | O1129: 15 | P1129: 17 | Q1129: 107 | S1129: MCDONALD | W1129: DANDEN0NG | X1129: 10 | Y1129: 7 | Z1129: 1 | AA1129: 2122 | AB1129: 1678 | AC1129: =(AA1129/AB1129)*100 -> 126.46007151370679 | AD1129: =(X1129*4)+(Z1129*2) -> 42
A1130: BEST PLAYERS | W1130: FRANKSTON | X1130: 10 | Y1130: 8 | Z1130: 0 | AA1130: 2079 | AB1130: 1990 | AC1130: =(AA1130/AB1130)*100 -> 104.47236180904522 | AD1130: =(X1130*4)+(Z1130*2) -> 40
A1131: PORT MELBOURNE | C1131: LOVE | F1131: MUTIMER | I1131: HARKINS | L1131: STROOPER | O1131: FORD | R1131: COOPER | W1131: SANDRINGHAM | X1131: 9 | Y1131: 9 | Z1131: 0 | AA1131: 2156 | AB1131: 2200 | AC1131: =(AA1131/AB1131)*100 -> 98 | AD1131: =(X1131*4)+(Z1131*2) -> 36
A1132: PRAHRAN | C1132: LANGAN | F1132: KNIGHTS | I1132: ATKINS | L1132: MORRISSEY | O1132: SOULOS | W1132: BOX HILL | X1132: 8 | Y1132: 10 | Z1132: 0 | AA1132: 2264 | AB1132: 2149 | AC1132: =(AA1132/AB1132)*100 -> 105.35132619823173 | AD1132: =(X1132*4)+(Z1132*2) -> 32
A1133: GOALKICKERS | W1133: B'WICK/B'MEAD | X1133: 8 | Y1133: 10 | Z1133: 0 | AA1133: 1870 | AB1133: 1856 | AC1133: =(AA1133/AB1133)*100 -> 100.75431034482759 | AD1133: =(X1133*4)+(Z1133*2) -> 32
A1134: PORT MELBOURNE | C1134: LOVE 11 | F1134: HICKS 5 | H1134: COOPER 3 | K1134: MUTIMER | M1134: ASANI | W1134: PORT MELBOURNE | X1134: 8 | Y1134: 10 | Z1134: 0 | AA1134: 2026 | AB1134: 2253 | AC1134: =(AA1134/AB1134)*100 -> 89.924545051043054 | AD1134: =(X1134*4)+(Z1134*2) -> 32
A1135: PRAHRAN | C1135: SOULOS 4 | F1135: THORNTON 4 | I1135: EVANS 2 | K1135: RYAN 2 | M1135: SHORTHOUSE 2 | P1135: KNIGHTS | W1135: PRAHRAN | X1135: 5 | Y1135: 13 | Z1135: 0 | AA1135: 1775 | AB1135: 2151 | AC1135: =(AA1135/AB1135)*100 -> 82.51975825197583 | AD1135: =(X1135*4)+(Z1135*2) -> 20
S1136: Venue: BEACH ROAD | W1136: OAKLEIGH | X1136: 4 | Y1136: 14 | Z1136: 0 | AA1136: 1936 | AB1136: 2466 | AC1136: =(AA1136/AB1136)*100 -> 78.507704785077053 | AD1136: =(X1136*4)+(Z1136*2) -> 16
A1137: SANDRINGHAM | C1137: 12 | D1137: 7 | E1137: 79 | G1137: 21 | H1137: 8 | I1137: 134 | K1137: 32 | L1137: 13 | M1137: 205 | O1137: 37 | P1137: 26 | Q1137: 248 | S1137: CALLAGHAN | W1137: CAMBERWELL | X1137: 0 | Y1137: 18 | Z1137: 0 | AA1137: 1330 | AB1137: 3001 | AC1137: =(AA1137/AB1137)*100 -> 44.318560479840052 | AD1137: =(X1137*4)+(Z1137*2) -> 0
A1138: CAMBERWELL | C1138: 1 | D1138: 8 | E1138: 14 | G1138: 2 | H1138: 9 | I1138: 21 | K1138: 3 | L1138: 12 | M1138: 36 | O1138: 4 | P1138: 18 | Q1138: 42 | S1138: GYSS
A1139: BEST PLAYERS
A1140: SANDRINGHAM | C1140: FOLEY | F1140: PRATT | I1140: ALLEN | L1140: BAILEY | O1140: PETERS | R1140: CULLINANE
A1141: CAMBERWELL | C1141: GREIG | F1141: BUDGE | I1141: T VITACCA | L1141: MITCHELL
A1142: GOALKICKERS | M1142: WEST 2 | O1142: MACKENZIE | R1142: BENZIE
A1143: SANDRINGHAM | C1143: F RUGOLO 8 | F1143: CULLINANE 6 | I1143: FOLEY 5 | K1143: PETERS 5 | M1143: HOWARD 3 | P1143: PRATT 3 | R1143: O'CONNOR 3
A1144: CAMBERWELL | C1144: N MITCHELL | F1144: T VITACCA | I1144: BUDGE | K1144: FITZPATRICK
A1146: WERRIBEE | C1146: 5 | D1146: 6 | E1146: 36 | G1146: 7 | H1146: 11 | I1146: 53 | K1146: 12 | L1146: 14 | M1146: 86 | O1146: 21 | P1146: 20 | Q1146: 146 | S1146: Venue: BRUNSWICK
A1147: B'WICK/B'MEAD | C1147: 1 | D1147: 1 | E1147: 7 | G1147: 4 | H1147: 5 | I1147: 29 | K1147: 5 | L1147: 7 | M1147: 37 | O1147: 6 | P1147: 12 | Q1147: 48 | S1147: BULLUSS :HOWARD
A1148: BEST PLAYERS
A1149: WERRIBEE | C1149: McMASTER | F1149: KNIGHT | I1149: FENTON | L1149: ALLDAY | O1149: WALPOLE | R1149: RADCLIFFE
A1150: B'WICK/B'MEAD | C1150: DAVIS | F1150: DIEULLIO | I1150: EAMES | L1150: THOROGOOD
A1151: GOALKICKERS
A1152: WERRIBEE | C1152: KNIGHT 5 | F1152: WALSH 3 | I1152: SELLS 2 | K1152: SIZER 2 | M1152: FENTON 2 | O1152: McMASTER 2 | R1152: O'KEEFE 2 | U1152: HARRIS | W1152: MONTGOMERY | Y1152: SPIERINGS
A1153: B'WICK/B'MEAD | C1153: CLARKE 2 | F1153: GRIFFITHS | I1153: DAVIS | K1153: WRIGHT | M1153: HILL
A1155: FRANKSTON | C1155: 8 | D1155: 3 | E1155: 51 | G1155: 15 | H1155: 6 | I1155: 96 | K1155: 20 | L1155: 9 | M1155: 129 | O1155: 26 | P1155: 14 | Q1155: 170 | S1155: Venue: FRANKSTON
A1156: OAKLEIGH | C1156: 1 | D1156: 3 | E1156: 9 | G1156: 4 | H1156: 3 | I1156: 27 | K1156: 9 | L1156: 7 | M1156: 61 | O1156: 13 | P1156: 11 | Q1156: 89 | S1156: MORROW :FORSTER
A1157: BEST PLAYERS
A1158: FRANKSTON | C1158: McCARTHY | F1158: STEVENSON | I1158: GAHAN | L1158: OWEN | O1158: BROWN | R1158: MACE
A1159: OAKLEIGH | C1159: MELLODY | F1159: OWEN | I1159: BRIGGS | L1159: MITCHELSON | O1159: PRETTO | R1159: ATHERTON
A1160: GOALKICKERS
A1161: FRANKSTON | C1161: GAHAN 6 | E1161: OWEN 6 | G1161: BOONKAMP 3 | J1161: GAMBLE 2 | M1161: BROWN 2 | O1161: AMOORE | Q1161: McCARTHY | T1161: BINGLEY | W1161: S HAMILL | X1161: MACE | Z1161: O'BRIEN | AB1161: P MARTIN
A1162: OAKLEIGH | C1162: PRETTO 7 | F1162: OWEN 2 | H1162: GARBUIO 2 | K1162: WELSFORD | N1162: MELLODY
A1164: SPRINGVALE | C1164: 3 | D1164: 3 | E1164: 21 | G1164: 9 | H1164: 4 | I1164: 58 | K1164: 10 | L1164: 7 | M1164: 67 | O1164: 15 | P1164: 13 | Q1164: 103 | S1164: Venue: DANDENONG
A1165: DANDENONG | C1165: 4 | D1165: 4 | E1165: 28 | G1165: 8 | H1165: 6 | I1165: 54 | K1165: 13 | L1165: 10 | M1165: 88 | O1165: 13 | P1165: 12 | Q1165: 90 | S1165: SNEDDON :SAVIGE
A1166: BEST PLAYERS
A1167: SPRINGVALE | C1167: S CLARK | F1167: MAYLIN | I1167: PEACOCK | L1167: JEFFS | O1167: SMIT | R1167: NICOL
A1168: DANDENONG | C1168: LACKO | F1168: GREEN | I1168: McCORMACK | L1168: D M BOURKE | O1168: McCONCHIE | R1168: ATKINSON
A1169: GOALKICKERS
A1170: SPRINGVALE | C1170: NICOL 3 | E1170: CLARKE 2 | G1170: CLARK 2 | I1170: MENDE 2 | K1170: PEACOCK 2 | M1170: MITHEN | O1170: MAYLIN | Q1170: DEMPSTER | T1170: P MALONI
A1171: DANDENONG | C1171: ELSHAUG 4 | F1171: MILLANE 2 | I1171: MILLIGAN 2 | L1171: GILDER 2 | N1171: BRADDY | P1171: MURRAY | R1171: KNIGHT
A1173: COBURG | C1173: 2 | D1173: 1 | E1173: 13 | G1173: 10 | H1173: 4 | I1173: 64 | K1173: 13 | L1173: 9 | M1173: 87 | O1173: 19 | P1173: 18 | Q1173: 132 | S1173: Venue: COBURG
A1174: BOX HILL | C1174: 5 | D1174: 5 | E1174: 35 | G1174: 6 | H1174: 7 | I1174: 43 | K1174: 9 | L1174: 8 | M1174: 62 | O1174: 13 | P1174: 10 | Q1174: 88 | S1174: CARLAND :MARSHALL
A1175: BEST PLAYERS
A1176: COBURG | C1176: RACOVOLIS | F1176: EVANS | I1176: RYAN | L1176: COMITO | O1176: NIMMO | Q1176: LANGAN
A1177: BOX HILL | C1177: HOGAN | F1177: DALRYMPLE | I1177: BOURKE | L1177: BUTTIFANT | O1177: HOLT | Q1177: HEANEY
A1178: GOALKICKERS
A1179: COBURG | C1179: LANGAN 3 | F1179: WEATHERALD 3 | J1179: KAAKOUR 2 | M1179: YOUNG 2 | O1179: RACOVOLIS 2 | R1179: INGRAM 2 | U1179: COMITO 2 | X1179: ALLISON | AA1179: ANGWIN | AC1179: ZANON
A1180: BOX HILL | C1180: BOURKE 5 | F1180: FRANCIS 3 | I1180: BROWN 2 | K1180: ZARAFA | M1180: NICHOLSON | P1180: ROSSELEY
A1182: FINALS
A1183: ELIMINATION | D1183: 2ND SEPTEMBER | I1183: WEATHER
D1184: 1ST QTR | H1184: 2ND QTR | L1184: 3RD QTR | P1184: FINAL | S1184: Venue: PORT MELBOURNE
A1185: WILLIAMSTOWN | C1185: 2 | D1185: 0 | E1185: 12 | G1185: 9 | H1185: 8 | I1185: 62 | K1185: 13 | L1185: 11 | M1185: 89 | O1185: 23 | P1185: 17 | Q1185: 155 | S1185: UMPIRES
A1186: WERRIBEE | C1186: 4 | D1186: 8 | E1186: 32 | G1186: 7 | H1186: 8 | I1186: 50 | K1186: 15 | L1186: 11 | M1186: 101 | O1186: 16 | P1186: 14 | Q1186: 110 | S1186: CARLAND :HOWLETT
A1187: BEST PLAYERS
A1188: WILLIAMSTOWN | C1188: MITCHELL | F1188: AZIZ | I1188: O'CONNOR | L1188: MUSCHIALLI | O1188: SMITH | Q1188: PASTORE
A1189: WERRIBEE | C1189: RADCLIFFE | F1189: FENTON | I1189: FITZPATRICK | L1189: ALLDAY | O1189: SELLS
A1190: GOALKICKERS
A1191: WILLIAMSTOWN | C1191: RICKMAN 5 | F1191: MUSCHIALLI 5 | I1191: AZIZ 4 | K1191: MOURNEY 3 | N1191: SLEVISON 2 | Q1191: O'CONNOR 2 | T1191: PASTORE | W1191: SMITH
A1192: WERRIBEE | C1192: SELLS 5 | F1192: O'KEEFE 4 | I1192: HARRIS 2 | K1192: KNIGHT 2 | M1192: RAEBURN | O1192: MORRIS | Q1192: SPIERINGS
A1194: QUALIFYING | D1194: 1ST SEPTEMBER | I1194: WEATHER
A1195: SPRINGVALE | C1195: 0 | D1195: 4 | E1195: 4 | G1195: 8 | H1195: 11 | I1195: 59 | K1195: 13 | L1195: 14 | M1195: 92 | O1195: 23 | P1195: 19 | Q1195: 157 | S1195: Venue: PORT MELBOURNE
A1196: COBURG | C1196: 5 | D1196: 3 | E1196: 33 | G1196: 7 | H1196: 6 | I1196: 48 | K1196: 9 | L1196: 10 | M1196: 64 | O1196: 12 | P1196: 12 | Q1196: 84 | S1196: FORSTER :SNEDDON
A1197: BEST PLAYERS
A1198: SPRINGVALE | C1198: S CLARK | F1198: MALONI | I1198: MAYLIN | L1198: MEADE | O1198: ROBINSON | R1198: DEMPSTER
A1199: COBURG | C1199: BARNES | F1199: SHELDON | I1199: RACOVOLIS | L1199: TARANTO | O1199: LANGAN | R1199: ANGWIN
A1200: GOALKICKERS
A1201: SPRINGVALE | C1201: ROBINSON 5 | F1201: ATKINS 4 | H1201: ANDERSON 4 | K1201: DEMPSTER 3 | N1201: PHILLIPS 2 | Q1201: PROSSER | S1201: DUDLEY | V1201: P MALONI | X1201: KOOP | Z1201: JEFFS
A1202: COBURG | C1202: WEATHERALD 4 | F1202: YOUNG 3 | H1202: LANGAN | J1202: REYNOLDSON | M1202: RACOVOLIS | P1202: COMITO | R1202: ZANON
A1204: 1ST SEMI | D1204: 8TH SEPTEMBER | I1204: WEATHER
A1205: WILLIAMSTOWN | C1205: 1 | D1205: 6 | E1205: 12 | G1205: 5 | H1205: 10 | I1205: 40 | K1205: 9 | L1205: 13 | M1205: 67 | O1205: 14 | P1205: 21 | Q1205: 105 | S1205: Venue: PORT MELBOURNE
A1206: COBURG | C1206: 4 | D1206: 4 | E1206: 28 | G1206: 7 | H1206: 7 | I1206: 49 | K1206: 8 | L1206: 10 | M1206: 58 | O1206: 8 | P1206: 12 | Q1206: 60 | S1206: BULLUSS :DORE
A1207: BEST PLAYERS
A1208: WILLIAMSTOWN | C1208: BURTON | F1208: McTAGGART | I1208: LLOYD | L1208: SLEVISON | O1208: O'CONNOR | R1208: ROUND
A1209: COBURG | C1209: NIMMO | F1209: BARNES | I1209: LITTLER | L1209: SHELDON | O1209: INGRAM | R1209: RYAN
A1210: GOALKICKERS
A1211: WILLIAMSTOWN | C1211: RICKMAN 5 | F1211: BURTON 3 | I1211: O'CONNOR 2 | L1211: MUSCHIALLI 2 | O1211: SLEVISON | Q1211: MILES
A1212: COBURG | C1212: SULLIVAN 3 | F1212: KAAKOUR 2 | I1212: ALLISON | K1212: REYNOLDSON | N1212: TARANTO
A1214: 2ND SEMI | D1214: 9TH SEPTEMBER | I1214: WEATHER
A1215: SPRINGVALE | C1215: 9 | D1215: 7 | E1215: 61 | G1215: 12 | H1215: 5 | I1215: 77 | K1215: 20 | L1215: 11 | M1215: 131 | O1215: 24 | P1215: 15 | Q1215: 159 | S1215: Venue: PORT MELBOURNE
A1216: PRESTON | C1216: 3 | D1216: 1 | E1216: 19 | G1216: 3 | H1216: 6 | I1216: 24 | K1216: 6 | L1216: 7 | M1216: 43 | O1216: 9 | P1216: 11 | Q1216: 65 | S1216: McDONALD :MORROW
A1217: BEST PLAYERS
A1218: SPRINGVALE | C1218: S CLARK | F1218: JEFFS | I1218: PEACOCK | L1218: DUDLEY | O1218: DEMPSTER | R1218: DWYER
A1219: PRESTON | C1219: LUMICISI | F1219: MARCON | I1219: OWEN | L1219: HUNT | O1219: DUNBAR
A1220: GOALKICKERS
A1221: SPRINGVALE | C1221: ROBINSON 6 | F1221: PROSSER 4 | I1221: DUDLEY 4 | K1221: ANDERSON 3 | N1221: KOOP 2 | P1221: ATKINS | R1221: P MALONI | U1221: PHILLIPS | X1221: DEMPSTER | AA1221: PEACOCK
A1222: PRESTON | C1222: SHAW 5 | F1222: MARCON | I1222: HALAS | K1222: DUNBAR | N1222: BROWN
A1224: PRELIMINARY | D1224: 16TH SEPTEMBER | I1224: WEATHER
A1225: WILLIAMSTOWN | C1225: 5 | D1225: 2 | E1225: 32 | G1225: 11 | H1225: 8 | I1225: 74 | K1225: 17 | L1225: 11 | M1225: 113 | O1225: 23 | P1225: 15 | Q1225: 153 | S1225: Venue: PORT MELBOURNE
A1226: PRESTON | C1226: 4 | D1226: 0 | E1226: 24 | G1226: 8 | H1226: 1 | I1226: 49 | K1226: 10 | L1226: 3 | M1226: 63 | O1226: 15 | P1226: 6 | Q1226: 96 | S1226: HARRIS :RUSSO
A1227: BEST PLAYERS
A1228: WILLIAMSTOWN | C1228: SMITH | F1228: BURTON | I1228: PASTORE | L1228: ROUND | O1228: HOWLETT | R1228: MINETT
A1229: PRESTON | C1229: SHAW | F1229: PRITCHARD | I1229: PERCY | L1229: OWEN | O1229: BURROWS | R1229: DUNBAR
A1230: GOALKICKERS
A1231: WILLIAMSTOWN | C1231: MINETT 4 | E1231: RICKMAN 4 | H1231: MUSCHIALLI 4 | K1231: MOURNEY 3 | N1231: SMITH 2 | P1231: AZIZ | Q1231: BURTON | S1231: HOWLETT | V1231: McTAGGART | X1231: SLEVISON | AA1231: GOULD
A1232: PRESTON | C1232: SHAW 5 | F1232: JORDAN 4 | I1232: PRIDEAUX 2 | L1232: DUNBAR 2 | O1232: SALVADORE | R1232: HALAS
A1234: GRAND | D1234: 30TH SEPTEMBER | I1234: WEATHER
A1235: WILLIAMSTOWN | C1235: 5 | D1235: 4 | E1235: 34 | G1235: 6 | H1235: 4 | I1235: 40 | K1235: 10 | L1235: 5 | M1235: 65 | O1235: 16 | P1235: 11 | Q1235: 107 | S1235: Venue: PRINCES PARK (CARLTON)
A1236: SPRINGVALE | C1236: 2 | D1236: 5 | E1236: 17 | G1236: 8 | H1236: 11 | I1236: 59 | K1236: 13 | L1236: 15 | M1236: 93 | O1236: 15 | P1236: 15 | Q1236: 105 | S1236: BULLUSS :RUSSO
A1237: BEST PLAYERS
A1238: WILLIAMSTOWN | C1238: ROUND | F1238: McTAGGART | I1238: O'CONNOR | L1238: RICKMAN | O1238: JOHANSEN | R1238: HOWLETT
A1239: SPRINGVALE | C1239: MAYLIN | F1239: MALONI | I1239: ROBINSON | L1239: CLARK | O1239: NICOL | R1239: PEACOCK
A1240: GOALKICKERS
A1241: WILLIAMSTOWN | C1241: RICKMAN 4 | F1241: MINETT 3 | I1241: JOHANSEN 3 | L1241: AZIZ | N1241: SWAN | P1241: GOULD | R1241: SMITH | T1241: O'CONNOR | W1241: MUSCHIALLI
A1242: SPRINGVALE | C1242: ROBINSON 3 | F1242: P MALONI 3 | I1242: DEMPSTER 3 | L1242: DUDLEY 2 | N1242: PHILLIPS 2 | Q1242: MAYLIN | S1242: JEFFS
A1244: REP MATCH
A1245: V.F.A. | C1245: 5 | D1245: 4 | E1245: 34 | G1245: 10 | H1245: 6 | I1245: 66 | K1245: 14 | L1245: 10 | M1245: 94 | O1245: 21 | P1245: 11 | Q1245: 137
A1246: A.C.T. | C1246: 2 | D1246: 2 | E1246: 14 | G1246: 5 | H1246: 7 | I1246: 37 | K1246: 9 | L1246: 7 | M1246: 61 | O1246: 13 | P1246: 14 | Q1246: 92
A1247: BEST PLAYERS
A1248: V.F.A. | C1248: DYSON | F1248: SMITH | I1248: PRITCHARD | L1248: HETHERTON | O1248: RICKMAN
A1249: A.C.T. | C1249: BISHOP | F1249: WYND | I1249: MUIR | L1249: GOSSER | O1249: HANNON
A1250: GOALKICKERS
A1251: V.F.A. | C1251: RICKMAN 5 | F1251: GRIFFITHS 2 | I1251: PRITCHARD 2 | L1251: SHELDON 2 | O1251: JORDAN 2 | Q1251: ALLISON | S1251: CLARKE | V1251: HETHERTON
C1252: DYSON | E1252: ALLEN | G1252: PERKINS | I1252: DARBY | K1252: RAEBURN
A1253: A.C.T. | C1253: CORNISH 3 | F1253: HANNON 2 | I1253: WHARTON 2 | L1253: MAPLESTON | O1253: BISHOP | Q1253: AULICH | S1253: DANIEL | V1253: HIRD