A1: Victorian Football Association
A2: Season 1991
A3: © Copyright Wal Williams | F3: First created: 1 September 2016
A4: Contact: joywalwi at gmail dot com | F4: Last updated: 3 December 2016 | W4: VFA Results and tables - Link to the main index page
A5: You are free to copy this document in whole or part provided that proper acknowledgement is given to the author. All rights reserved.
W7: Note: B'WICK/B'MEAD = Brunswick-Broadmeadows
A8: 1991 | C8: 1ST DIVISION
A9: ROUND 1 | D9: 6TH APRIL | I9: WEATHER | S9: Venue: WILLIAMSTOWN
D10: 1ST QTR | H10: 2ND QTR | L10: 3RD QTR | P10: FINAL | S10: UMPIRES
A11: WILLIAMSTOWN | C11: 2 | D11: 1 | E11: 13 | G11: 6 | H11: 5 | I11: 41 | K11: 9 | L11: 6 | M11: 60 | O11: 15 | P11: 12 | Q11: 102 | S11: CARLAND | Y11: LADDER | AB11: ROUND | AD11: 1
A12: SPRINGVALE | C12: 4 | D12: 7 | E12: 31 | G12: 5 | H12: 10 | I12: 40 | K12: 8 | L12: 16 | M12: 64 | O12: 8 | P12: 16 | Q12: 64 | S12: VAN BEEK
A13: BEST PLAYERS | W13: TEAM | X13: B | Y13: W | Z13: L | AA13: D | AB13: FOR | AC13: AGST | AD13: % | AE13: PTS
A14: WILLIAMSTOWN
A15: SPRINGVALE | W15: FRANKSTON | Y15: 1 | Z15: 0 | AA15: 0 | AB15: 140 | AC15: 80 | AD15: =(AB15/AC15)*100 -> 175 | AE15: =(Y15*4)+(AA15*2) -> 4
A16: GOALKICKERS | W16: WILLIAMSTOWN | Y16: 1 | Z16: 0 | AA16: 0 | AB16: 102 | AC16: 64 | AD16: =(AB16/AC16)*100 -> 159.375 | AE16: =(Y16*4)+(AA16*2) -> 4
A17: WILLIAMSTOWN | W17: WERRIBEE | Y17: 1 | Z17: 0 | AA17: 0 | AB17: 141 | AC17: 102 | AD17: =(AB17/AC17)*100 -> 138.23529411764704 | AE17: =(Y17*4)+(AA17*2) -> 4
A18: SPRINGVALE | W18: SANDRINGHAM | Y18: 1 | Z18: 0 | AA18: 0 | AB18: 142 | AC18: 110 | AD18: =(AB18/AC18)*100 -> 129.09090909090909 | AE18: =(Y18*4)+(AA18*2) -> 4
D19: 13TH APRIL | J19: WEATHER | S19: Venue: PORT MELBOURNE | W19: PORT MELBOURNE | Y19: 1 | Z19: 0 | AA19: 0 | AB19: 147 | AC19: 125 | AD19: =(AB19/AC19)*100 -> 117.6 | AE19: =(Y19*4)+(AA19*2) -> 4
A20: PORT MELBOURNE | C20: 4 | D20: 3 | E20: 27 | G20: 10 | H20: 9 | I20: 69 | K20: 16 | L20: 15 | M20: 111 | O20: 21 | P20: 21 | Q20: 147 | S20: MURNANE
A21: PRAHRAN | C21: 6 | D21: 5 | E21: 41 | G21: 11 | H21: 6 | I21: 72 | K21: 17 | L21: 8 | M21: 110 | O21: 19 | P21: 11 | Q21: 125 | S21: : | W21: DANDEN0NG | X21: 1 | Y21: 0 | Z21: 0 | AA21: 0 | AB21: 0 | AC21: 0 | AE21: =(Y21*4)+(AA21*2) -> 0
A22: BEST PLAYERS | W22: OAKLEIGH | X22: 1 | Y22: 0 | Z22: 0 | AA22: 0 | AB22: 0 | AC22: 0 | AE22: =(Y22*4)+(AA22*2) -> 0
A23: PORT MELBOURNE | C23: HARKINS | F23: YORGEY | I23: PAUL | L23: FORD | N23: WALL | Q23: FOLEY | W23: PRAHRAN | Y23: 0 | Z23: 1 | AA23: 0 | AB23: 125 | AC23: 147 | AD23: =(AB23/AC23)*100 -> 85.034013605442169 | AE23: =(Y23*4)+(AA23*2) -> 0
A24: PRAHRAN | C24: MATERA | F24: SINNI | I24: GILES | L24: HUG | N24: TAPPING | Q24: CHAPMAN | W24: COBURG | Y24: 0 | Z24: 1 | AA24: 0 | AB24: 110 | AC24: 142 | AD24: =(AB24/AC24)*100 -> 77.464788732394368 | AE24: =(Y24*4)+(AA24*2) -> 0
A25: GOALKICKERS | P25: CAMERON | R25: FOLEY | W25: BOX HILL | Y25: 0 | Z25: 1 | AA25: 0 | AB25: 102 | AC25: 141 | AD25: =(AB25/AC25)*100 -> 72.340425531914903 | AE25: =(Y25*4)+(AA25*2) -> 0
A26: PORT MELBOURNE | C26: PAUL 5 | E26: YORGEY 3 | G26: ASANI 3 | I26: BOWDEN 2 | K26: HARKINS 2 | M26: RAINSFORD 2 | P26: KENNEDY | R26: HETHERTON | W26: SPRINGVALE | Y26: 0 | Z26: 1 | AA26: 0 | AB26: 64 | AC26: 102 | AD26: =(AB26/AC26)*100 -> 62.745098039215684 | AE26: =(Y26*4)+(AA26*2) -> 0
A27: PRAHRAN | C27: TAYLOR 5 | E27: KNIGHT 3 | G27: MATERA 3 | I27: COLLINS 2 | K27: MITCHELL 2 | N27: SINNI 2 | P27: BOLZON | R27: MACKIE | W27: PRESTON | Y27: 0 | Z27: 1 | AA27: 0 | AB27: 80 | AC27: 140 | AD27: =(AB27/AC27)*100 -> 57.142857142857139 | AE27: =(Y27*4)+(AA27*2) -> 0
D28: 14TH APRIL | J28: WEATHER | S28: Venue: DANDENONG
A29: DANDENONG | C29: 5 | D29: 9 | E29: 39 | G29: 17 | H29: 15 | I29: 117 | K29: 29 | L29: 22 | M29: 196 | O29: 44 | P29: 29 | Q29: 293 | S29: CLEMENT :
A30: B'WICK/B'MEAD | C30: 0 | D30: 1 | E30: 1 | G30: 2 | H30: 4 | I30: 16 | K30: 4 | L30: 5 | M30: 29 | O30: 6 | P30: 7 | Q30: 43
A31: BEST PLAYERS
A32: DANDENONG | C32: GOTCH | F32: MILLIGAN | I32: GARRETT | L32: LACKO | O32: WICKS | R32: HALL
A33: B'WICK/B'MEAD | C33: DODERICO | F33: EDWARDS | I33: THOROGOOD | L33: DRAIN | O33: P LEYDIN
A34: GOALKICKERS | Q34: MILLIGAN | S34: O WELSH
A35: DANDENONG | C35: GARRETT 14 | F35: GOTCH 6 | H35: GREEN 4 | J35: MILLANE 4 | M35: READ 4 | O35: BOURKE 2 | Q35: MARSHALL 2 | T35: WICKS 2 | X35: MURRAY 2 | AA35: G DOYLE | AD35: ELSHAUG
A36: B'WICK/B'MEAD | C36: DODERIC 3 | F36: BUTLER | H36: DIEULLIO | J36: EDWARDS
A38: FRANKSTON | C38: 5 | D38: 5 | E38: 35 | G38: 11 | H38: 9 | I38: 75 | K38: 13 | L38: 13 | M38: 91 | O38: 21 | P38: 14 | Q38: 140 | S38: Venue: FRANKSTON
A39: PRESTON | C39: 2 | D39: 3 | E39: 15 | G39: 4 | H39: 6 | I39: 30 | K39: 6 | L39: 11 | M39: 47 | O39: 11 | P39: 14 | Q39: 80 | S39: CAMERON :CARLSON
A40: BEST PLAYERS
A41: FRANKSTON | C41: A HAMILL | F41: S HAMILL | I41: BINGLEY | L41: POLLOCK | O41: NEWMAN | Q41: STAPLETON
A42: PRESTON | C42: REEVES | F42: MARCON | I42: McINERNEY | L42: BURROWS | O42: POURSIANIDAS
A43: GOALKICKERS
A44: FRANKSTON | C44: BINGLEY 7 | F44: STAPLETON 4 | I44: GAHAN 3 | K44: A WISKEN 3 | N44: S HAMILL | Q44: BELL | R44: O'BRIEN | U44: BOONKAMP
A45: PRESTON | C45: POURSANIDAS 4 | F45: HEATLEY 3 | I45: REEVES | K45: JORDAN | M45: NICOLAOU | P45: GRAZIANO
A47: SANDRINGHAM | C47: 4 | D47: 0 | E47: 24 | G47: 12 | H47: 4 | I47: 76 | K47: 14 | L47: 8 | M47: 92 | O47: 22 | P47: 10 | Q47: 142 | S47: Venue: COBURG
A48: COBURG | C48: 3 | D48: 11 | E48: 29 | G48: 4 | H48: 15 | I48: 39 | K48: 10 | L48: 20 | M48: 80 | O48: 14 | P48: 26 | Q48: 110 | S48: SNEDDON :
A49: BEST PLAYERS
A50: SANDRINGHAM | C50: TEAM EFFORT
A51: COBURG | C51: NIMMO | F51: BAKER | I51: LISTON | L51: LOONE | O51: SHELDON
A52: GOALKICKERS
A53: SANDRINGHAM | C53: F RUGOLO 9 | F53: R JONES 3 | I53: CUMMINS 3 | L53: MCGANNON 2 | O53: GARRETT 2 | Q53: CONLAN | S53: BONNEY | W53: CULLINANE
A54: COBURG | C54: REYNOLDSON 3 | F54: GRIFFITH 3 | I54: KOURKEMELIS 2 | L54: WILLIAMS | N54: LANGAN | P54: LITTLER | R54: INGRAM | U54: GUMLEY | X54: BAKER
A56: WERRIBEE | C56: 3 | D56: 2 | E56: 20 | G56: 7 | H56: 9 | I56: 51 | K56: 12 | L56: 12 | M56: 84 | O56: 21 | P56: 15 | Q56: 141 | S56: Venue: BOX HILL
A57: BOX HILL | C57: 3 | D57: 7 | E57: 25 | G57: 8 | H57: 10 | I57: 58 | K57: 11 | L57: 16 | M57: 82 | O57: 14 | P57: 18 | Q57: 102
A58: BEST PLAYERS
A59: WERRIBEE | C59: WALSH | F59: ENEVER | I59: LESIPUTTY | L59: FENTON | O59: VASILOU | R59: DANIHER
A60: BOX HILL | C60: ZARAFA | F60: LISLE | I60: BOURKE | L60: BYRNE | O60: O'NEILL | R60: MOODY
A61: GOALKICKERS
A62: WERRIBEE | C62: DANIHER 5 | F62: FITZPATRICK 4 | I62: HARRIS 3 | K62: FENTON 3 | M62: DRUM 2 | O62: GEARY 2 | Q62: O'KEEFE | S62: RAEBURN | W62: MCMASTER
A63: BOX HILL | C63: BYRNE 3 | F63: ZARAFA 3 | I63: WYNN 2 | K63: BUTTIFANT | M63: BOX | N63: DEBOER | P63: LISLE | R63: REID | T63: DALRYMPLE
A65: BYE | C65: OAKLEIGH
A67: ROUND 2 | D67: 20TH APRIL | I67: WEATHER | S67: Venue: OAKLEIGH
D68: 1ST QTR | H68: 2ND QTR | L68: 3RD QTR | P68: FINAL | S68: UMPIRES
A69: BOX HILL | C69: 6 | D69: 3 | E69: 39 | G69: 11 | H69: 9 | I69: 75 | K69: 15 | L69: 14 | M69: 104 | O69: 23 | P69: 15 | Q69: 153 | S69: BOTT | Y69: LADDER | AB69: ROUND | AD69: 2
A70: OAKLEIGH | C70: 5 | D70: 3 | E70: 33 | G70: 6 | H70: 5 | I70: 41 | K70: 10 | L70: 8 | M70: 68 | O70: 10 | P70: 14 | Q70: 74 | S70: SAWERS
A71: BEST PLAYERS | W71: TEAM | X71: B | Y71: W | Z71: L | AA71: D | AB71: FOR | AC71: AGST | AD71: % | AE71: PTS
A72: BOX HILL | C72: BRUSNAHAN | F72: BYRNE | I72: ZARAFA | L72: PENNY | O72: BUTTIFANT | Q72: MOODY
A73: OAKLEIGH | C73: MITCHELSON | F73: BULTE | I73: HICKEY | L73: SUTHERLAND | O73: MELLODY | W73: WERRIBEE | Y73: 2 | Z73: 0 | AA73: 0 | AB73: 238 | AC73: 195 | AD73: =(AB73/AC73)*100 -> 122.05128205128206 | AE73: =(Y73*4)+(AA73*2) -> 8
A74: GOALKICKERS | O74: GROSS 2 | Q74: DEBOER | W74: PORT MELBOURNE | Y74: 2 | Z74: 0 | AA74: 0 | AB74: 237 | AC74: 208 | AD74: =(AB74/AC74)*100 -> 113.94230769230769 | AE74: =(Y74*4)+(AA74*2) -> 8
A75: BOX HILL | C75: HICKS 4 | E75: D BOURKE 3 | H75: BYRNE 3 | J75: BRUSNAHAN 3 | M75: BUTTIFANT 3 | P75: ZARAFA 2 | R75: LISLE 2 | W75: DANDEN0NG | X75: 1 | Y75: 1 | Z75: 0 | AA75: 0 | AB75: 217 | AC75: 78 | AD75: =(AB75/AC75)*100 -> 278.20512820512818 | AE75: =(Y75*4)+(AA75*2) -> 4
A76: OAKLEIGH | C76: PRETTO 6 | F76: ROBINSON | I76: SHARP | K76: TEMPLETON | N76: MURTON | W76: WILLIAMSTOWN | Y76: 1 | Z76: 1 | AA76: 0 | AB76: 195 | AC76: 161 | AD76: =(AB76/AC76)*100 -> 121.11801242236024 | AE76: =(Y76*4)+(AA76*2) -> 4
D77: 21ST APRIL | I77: WEATHER | S77: Venue: PRESTON | W77: BOX HILL | Y77: 1 | Z77: 1 | AA77: 0 | AB77: 255 | AC77: 215 | AD77: =(AB77/AC77)*100 -> 118.6046511627907 | AE77: =(Y77*4)+(AA77*2) -> 4
A78: COBURG | C78: 2 | D78: 1 | E78: 13 | G78: 7 | H78: 5 | I78: 47 | K78: 10 | L78: 7 | M78: 67 | O78: 14 | P78: 12 | Q78: 96 | S78: VINEY
A79: PRESTON | C79: 4 | D79: 2 | E79: 26 | G79: 7 | H79: 3 | I79: 45 | K79: 11 | L79: 10 | M79: 76 | O79: 13 | P79: 12 | Q79: 90 | S79: KENNEDY | W79: FRANKSTON | Y79: 1 | Z79: 1 | AA79: 0 | AB79: 209 | AC79: 177 | AD79: =(AB79/AC79)*100 -> 118.07909604519776 | AE79: =(Y79*4)+(AA79*2) -> 4
A80: BEST PLAYERS | W80: SANDRINGHAM | Y80: 1 | Z80: 1 | AA80: 0 | AB80: 225 | AC80: 200 | AD80: =(AB80/AC80)*100 -> 112.5 | AE80: =(Y80*4)+(AA80*2) -> 4
A81: COBURG | C81: BURKE | F81: NIMMO | I81: BARNES | L81: DOYLE | O81: LISTON | W81: SPRINGVALE | Y81: 1 | Z81: 1 | AA81: 0 | AB81: 156 | AC81: 171 | AD81: =(AB81/AC81)*100 -> 91.228070175438589 | AE81: =(Y81*4)+(AA81*2) -> 4
A82: PRESTON | C82: BURROWS | F82: MARCON | I82: LUMICIS | L82: NICOLAOU | O82: JORDAN | Q82: KOUTIFIDES | W82: COBURG | Y82: 1 | Z82: 1 | AA82: 0 | AB82: 206 | AC82: 232 | AD82: =(AB82/AC82)*100 -> 88.793103448275872 | AE82: =(Y82*4)+(AA82*2) -> 4
A83: GOALKICKERS | Q83: RACOVOLIS | W83: PRESTON | Y83: 0 | Z83: 2 | AA83: 0 | AB83: 170 | AC83: 236 | AD83: =(AB83/AC83)*100 -> 72.033898305084747 | AE83: =(Y83*4)+(AA83*2) -> 0
A84: COBURG | C84: INGRAM 4 | F84: BURKE 3 | H84: LOONE 2 | J84: REYNOLDSON | M84: GRIFFITHS | O84: GUMLEY | Q84: D HARRINGTON | W84: PRAHRAN | Y84: 0 | Z84: 2 | AA84: 0 | AB84: 203 | AC84: 364 | AD84: =(AB84/AC84)*100 -> 55.769230769230774 | AE84: =(Y84*4)+(AA84*2) -> 0
A85: PRESTON | C85: NICOLAOU 2 | F85: LUMICISI 2 | I85: MARCON 2 | K85: HALAS 2 | M85: GILLARD | O85: JORDAN | Q85: HEATLRY | W85: OAKLEIGH | X85: 1 | Y85: 0 | Z85: 1 | AA85: 0 | AB85: 74 | AC85: 153 | AD85: =(AB85/AC85)*100 -> 48.366013071895424 | AE85: =(Y85*4)+(AA85*2) -> 0
M86: WALKER | P86: BROWN
A87: SPRINGVALE | C87: 1 | D87: 8 | E87: 14 | G87: 4 | H87: 10 | I87: 34 | K87: 10 | L87: 13 | M87: 73 | O87: 13 | P87: 14 | Q87: 92 | S87: Venue: SPRINGVALE
A88: FRANKSTON | C88: 1 | D88: 1 | E88: 7 | G88: 4 | H88: 7 | I88: 31 | K88: 6 | L88: 7 | M88: 43 | O88: 10 | P88: 9 | Q88: 69 | S88: FORSTER :GYSS
A89: BEST PLAYERS
A90: SPRINGVALE | C90: NICOL | F90: BROMAGE | I90: DUDLEY | L90: MALONI | O90: McDONOUGH
A91: FRANKSTON | C91: S HAMILL | F91: T HAMILL | I91: VANDERMEER | L91: RAVEN | O91: SOLE
A92: GOALKICKERS
A93: SPRINGVALE | C93: REECE 3 | E93: JACKSON 2 | H93: PROSSER 2 | J93: DEMPSTER 2 | M93: CARIS | O93: CLARK | Q93: MORGAN | S93: WARNER
A94: FRANKSTON | C94: R ALLAN 3 | F94: GAHAN 2 | H94: WISKEN 2 | J94: GOLDSWORTHY | M94: S HAMILL | O94: BOONKAMP
A96: WERRIBEE | C96: 6 | D96: 5 | E96: 41 | G96: 8 | H96: 11 | I96: 59 | K96: 10 | L96: 17 | M96: 77 | O96: 13 | P96: 19 | Q96: 97 | S96: Venue: WERRIBEE
A97: WILLIAMSTOWN | C97: 4 | D97: 1 | E97: 25 | G97: 6 | H97: 3 | I97: 39 | K97: 11 | L97: 3 | M97: 69 | O97: 14 | P97: 9 | Q97: 93 | S97: HARVEY :McDONALD
A98: BEST PLAYERS
A99: WERRIBEE | C99: KNIGHT | F99: EAMES | I99: DANIHER | L99: RAEBUEN | O99: ALLDAY | R99: LESIPUTTY
A100: WILLIAMSTOWN | C100: ACKERLEY | F100: ROUND | I100: BURTON | L100: MILES | O100: SMITH | R100: AZIZ
A101: GOALKICKERS
A102: WERRIBEE | C102: DRUM 3 | E102: KNIGHT 3 | G102: SELLS 2 | I102: O'KEEFE | K102: RAEBURN | M102: MORGAN | O102: MCMASTER | R102: FITZPATRICK
A103: WILLIAMSTOWN | C103: AZIZ 5 | E103: MINETT 2 | G103: MUSCHIALLI 2 | J103: PERRY 2 | L103: JOHANSEN | N103: MILES | P103: SWAN
A105: DANDENONG | C105: 8 | D105: 2 | E105: 50 | G105: 18 | H105: 7 | I105: 115 | K105: 25 | L105: 7 | M105: 157 | O105: 34 | P105: 13 | Q105: 217 | S105: Venue: TOORAK PARK
A106: PRAHRAN | C106: 4 | D106: 1 | E106: 25 | G106: 4 | H106: 5 | I106: 29 | K106: 10 | L106: 9 | M106: 69 | O106: 11 | P106: 12 | Q106: 78 | S106: LUCKMAN :SIGMONT
A107: BEST PLAYERS
A108: DANDENONG | C108: MILLIGAN | F108: GOTCH | I108: WELSH | L108: HALL | O108: MURRAY | R108: GARRETT
A109: PRAHRAN | C109: SINNI | F109: SCICLUNA | I109: WILLIAMSON
A110: GOALKICKERS
A111: DANDENONG | C111: GARRETT 9 | F111: GOTCH 7 | H111: DOYLE 5 | J111: READ 4 | L111: LACKO 3 | N111: LANCE 2 | P111: McCORMACK 2 | S111: HALL | U111: D BOURKE
A112: PRAHRAN | C112: WILLIAMSON 5 | F112: MACKIE | H112: B TAYLOR | J112: POVEY | L112: COLLINS | N112: SOULOS | P112: CHAPMAN
A114: PORT MELBOURNE | C114: 1 | D114: 2 | E114: 8 | G114: 7 | H114: 3 | I114: 45 | K114: 8 | L114: 4 | M114: 52 | O114: 14 | P114: 6 | Q114: 90 | S114: Venue: BEACH ROAD
A115: SANDRINGHAM | C115: 4 | D115: 4 | E115: 28 | G115: 7 | H115: 4 | I115: 46 | K115: 11 | L115: 10 | M115: 76 | O115: 12 | P115: 11 | Q115: 83 | S115: DOWSLEY ;MORROW
A116: BEST PLAYERS
A117: PORT MELBOURNE | C117: LAFFEY | F117: STROOPER | I117: HARKINS | L117: BARLOW | O117: FOLEY | R117: YORGEY
A118: SANDRINGHAM | C118: O'CONNOR | F118: McINTOSH | I118: ALLEN | L118: BAILEY | O118: BONNEY
A119: GOALKICKERS
A120: PORT MELBOURNE | C120: YORGEY 3 | F120: PAUL 2 | H120: JENNINGS 2 | K120: FOLEY 2 | M120: HARKINS 2 | O120: BOWDEN | Q120: KEIGHRAN | S120: KENNEDY
A121: SANDRINGHAM | C121: P GARRETT 3 | F121: C GARRETT 2 | I121: BINGHAM 2 | L121: FOLEY 2 | N121: CONLAN | P121: JONES | R121: F RUGOLO
A123: BYE | C123: BRUNSWICK/BROADMEADOWS
A125: ROUND 3 | D125: 27TH APRIL | I125: WEATHER | S125: Venue: FRANKSTON
D126: 1ST QTR | H126: 2ND QTR | L126: 3RD QTR | P126: FINAL | S126: UMPIRES
A127: WILLIAMSTOWN | C127: 5 | D127: 2 | E127: 32 | G127: 9 | H127: 6 | I127: 60 | K127: 11 | L127: 13 | M127: 79 | O127: 16 | P127: 16 | Q127: 112 | S127: SAWERS | Y127: LADDER | AB127: ROUND | AD127: 3
A128: FRANKSTON | C128: 3 | D128: 1 | E128: 19 | G128: 8 | H128: 3 | I128: 51 | K128: 12 | L128: 7 | M128: 79 | O128: 13 | P128: 11 | Q128: 89 | S128: ANTHONY
A129: BEST PLAYERS | W129: TEAM | X129: B | Y129: W | Z129: L | AA129: D | AB129: FOR | AC129: AGST | AD129: % | AE129: PTS
A130: WILLIAMSTOWN | C130: BURTON | F130: KEANE | I130: AZIZ | L130: GHAZI | O130: ROUND | R130: ACKERLEY
A131: FRANKSTON | C131: RAVEN | F131: S HAMILL | I131: A HAMILL | L131: BELL | O131: WISKEN | W131: PORT MELBOURNE | Y131: 3 | Z131: 0 | AA131: 0 | AB131: 406 | AC131: 336 | AD131: =(AB131/AC131)*100 -> 120.83333333333333 | AE131: =(Y131*4)+(AA131*2) -> 12
A132: GOALKICKERS | W132: WERRIBEE | Y132: 3 | Z132: 0 | AA132: 0 | AB132: 378 | AC132: 317 | AD132: =(AB132/AC132)*100 -> 119.24290220820188 | AE132: =(Y132*4)+(AA132*2) -> 12
A133: WILLIAMSTOWN | C133: RICKMAN 6 | F133: AZIZ 2 | H133: MUSCHIALLI 2 | K133: GHAZI 2 | M133: SMITH | O133: WILLIAMS | Q133: MILES | S133: ROUND | W133: SANDRINGHAM | Y133: 2 | Z133: 1 | AA133: 0 | AB133: 364 | AC133: 289 | AD133: =(AB133/AC133)*100 -> 125.95155709342561 | AE133: =(Y133*4)+(AA133*2) -> 8
A134: FRANKSTON | C134: ALLAN 4 | E134: BINGLEY 2 | G134: GAHAN 2 | I134: S HAMILL | K134: A HAMILL | M134: SAVAGE | O134: BELL | Q134: BROWN | W134: WILLIAMSTOWN | Y134: 2 | Z134: 1 | AA134: 0 | AB134: 307 | AC134: 250 | AD134: =(AB134/AC134)*100 -> 122.8 | AE134: =(Y134*4)+(AA134*2) -> 8
D135: 28TH APRIL | I135: WEATHER | S135: Venue: OAKLEIGH | W135: COBURG | Y135: 2 | Z135: 1 | AA135: 0 | AB135: 302 | AC135: 325 | AD135: =(AB135/AC135)*100 -> 92.92307692307692 | AE135: =(Y135*4)+(AA135*2) -> 8
A136: WERRIBEE | C136: 5 | D136: 3 | E136: 33 | G136: 10 | H136: 8 | I136: 68 | K136: 16 | L136: 10 | M136: 106 | O136: 21 | P136: 14 | Q136: 140 | S136: AGNEW
A137: OAKLEIGH | C137: 6 | D137: 5 | E137: 41 | G137: 12 | H137: 6 | I137: 78 | K137: 13 | L137: 12 | M137: 90 | O137: 18 | P137: 14 | Q137: 122 | S137: SIGMONT | W137: DANDEN0NG | X137: 1 | Y137: 1 | Z137: 1 | AA137: 0 | AB137: 306 | AC137: 217 | AD137: =(AB137/AC137)*100 -> 141.01382488479263 | AE137: =(Y137*4)+(AA137*2) -> 4
A138: BEST PLAYERS | W138: BOX HILL | X138: 1 | Y138: 1 | Z138: 1 | AA138: 0 | AB138: 255 | AC138: 215 | AD138: =(AB138/AC138)*100 -> 118.6046511627907 | AE138: =(Y138*4)+(AA138*2) -> 4
A139: WERRIBEE | C139: HARRIS | F139: FITZPATRICK | I139: LESIPUTTY | L139: RAEBURN | O139: EAMES | R139: SELLS | W139: FRANKSTON | Y139: 1 | Z139: 2 | AA139: 0 | AB139: 298 | AC139: 289 | AD139: =(AB139/AC139)*100 -> 103.11418685121107 | AE139: =(Y139*4)+(AA139*2) -> 4
A140: OAKLEIGH | C140: MITCHELSON | F140: HICKEY | I140: OWEN | L140: BRIGGS | O140: ATHERTON | R140: LEMON | W140: SPRINGVALE | Y140: 1 | Z140: 2 | AA140: 0 | AB140: 249 | AC140: 267 | AD140: =(AB140/AC140)*100 -> 93.258426966292134 | AE140: =(Y140*4)+(AA140*2) -> 4
A141: GOALKICKERS | N141: EAMES | P141: MCMASTER | S141: BARRY | W141: PRESTON | Y141: 0 | Z141: 3 | AA141: 0 | AB141: 298 | AC141: 405 | AD141: =(AB141/AC141)*100 -> 73.580246913580254 | AE141: =(Y141*4)+(AA141*2) -> 0
A142: WERRIBEE | C142: SELLS 5 | E142: DANIHER 4 | H142: O'KEEFE 4 | J142: HARRIS | L142: DRUM | N142: WALSH | P142: MORGAN | R142: KNIGHT | W142: OAKLEIGH | X142: 1 | Y142: 0 | Z142: 2 | AA142: 0 | AB142: 196 | AC142: 293 | AD142: =(AB142/AC142)*100 -> 66.89419795221842 | AE142: =(Y142*4)+(AA142*2) -> 0
A143: OAKLEIGH | C143: HAWKER 4 | E143: PRETTO 4 | G143: SHARP 2 | I143: PAYNE 2 | K143: MERTON 2 | M143: MELLODY | O143: ROBINSON | Q143: OWEN | W143: PRAHRAN | X143: 1 | Y143: 0 | Z143: 2 | AA143: 0 | AB143: 203 | AC143: 364 | AD143: =(AB143/AC143)*100 -> 55.769230769230774 | AE143: =(Y143*4)+(AA143*2) -> 0
N144: SUTHERLAND
A145: BOX HILL | C145: 5 | D145: 6 | E145: 36 | G145: 12 | H145: 12 | I145: 84 | K145: 25 | L145: 16 | M145: 166 | O145: 35 | P145: 24 | Q145: 234 | S145: Venue: BOX HILL
A146: B'WICK/B'MEAD | C146: 1 | D146: 5 | E146: 11 | G146: 4 | H146: 9 | I146: 33 | K146: 7 | L146: 10 | M146: 52 | O146: 10 | P146: 13 | Q146: 73 | S146: GYSS :CALLAGHAN
A147: BEST PLAYERS
A148: BOX HILL | C148: DEBOER | F148: BRUSNAHAN | I148: ESPENSCHIED | L148: ZARAFA | O148: DALRYMPLE | R148: HAMILTON
A149: B'WICK/B'MEAD | C149: THOROGOOD | F149: DRAIN | I149: DIEULLIO | L149: HAYDEN | O149: McALLESTER | R149: LEYDIN
A150: GOALKICKERS | L150: HICKS 2 | N150: BOX | P150: GROSS | R150: HAMILTON | U150: ZARAFA
A151: BOX HILL | C151: BRUSNAHAN 9 | F151: BUTTIFANT 5 | I151: WYNN 5 | K151: DEBOER 3 | M151: ESPENSCHIED 3 | P151: BYRNE 2 | R151: DALRYMPLE 2
A152: B'WICK/B'MEAD | C152: HAYDEN 5 | F152: HARVEY 2 | I152: DIEULLIO | K152: L EDWARDS | N152: THORNTON
A154: PORT MELBOURNE | C154: 6 | D154: 6 | E154: 42 | G154: 10 | H154: 9 | I154: 69 | K154: 15 | L154: 16 | M154: 106 | O154: 24 | P154: 25 | Q154: 169 | S154: Venue: PORT MELBOURNE
A155: PRESTON | C155: 4 | D155: 3 | E155: 27 | G155: 11 | H155: 8 | I155: 74 | K155: 16 | L155: 12 | M155: 108 | O155: 19 | P155: 14 | Q155: 128 | S155: SNEDDON ;SIGMONT
A156: BEST PLAYERS
A157: PORT MELBOURNE | C157: CLOHESEY | F157: LAFFY | I157: FOLEY | L157: HARKINS | O157: HETHERTON | R157: STROOPER
A158: PRESTON | C158: REEVES | F158: MARCON | I158: BURROWS | L158: SENNO | O158: JORDAN | R158: KERR
A159: GOALKICKERS
A160: PORT MELBOURNE | C160: PAUL 5 | E160: FOLEY 3 | G160: ASANI 3 | I160: JAMES 3 | K160: HICKS 3 | M160: HARKINS 2 | P160: CAMERON | R160: CLOHESEY | U160: KENNEDY | Y160: LAFFY
A161: PRESTON | C161: SENNO 4 | E161: MARCON 3 | G161: HEATLEY 3 | I161: LUMICISI 3 | K161: HALAS 2 | M161: NICOLAOU | O161: REEVES | Q161: JORDAN | S161: MARCON
A163: SANDRINGHAM | C163: 3 | D163: 3 | E163: 21 | G163: 10 | H163: 8 | I163: 68 | K163: 14 | L163: 15 | M163: 99 | O163: 20 | P163: 19 | Q163: 139 | S163: Venue: DANDENONG
A164: DANDENONG | C164: 4 | D164: 4 | E164: 28 | G164: 7 | H164: 7 | I164: 49 | K164: 12 | L164: 8 | M164: 80 | O164: 13 | P164: 11 | Q164: 89 | S164: FORSTER ;BOTT
A165: BEST PLAYERS
A166: SANDRINGHAM | C166: ALLEN | F166: CONLAN | I166: BAILEY | L166: CZERKASKI | O166: DUURSMA | R166: O'CONNOR
A167: DANDENONG | C167: McCORMACK | F167: MURRAY
A168: GOALKICKERS
A169: SANDRINGHAM | C169: P GARRETT 5 | F169: FOLEY 4 | H169: FISCHER 3 | J169: BINGHAM 3 | M169: WEARNE 2 | O169: C GARRETT 2 | R169: CZERKASKI
A170: DANDENONG | C170: P GARRETT 4 | F170: DOYLE 2 | H170: LANCE 2 | J170: BOURKE | L170: GOTCH | N170: LACKO | P170: MILLANE | R170: McCORMACK
A172: COBURG | C172: 4 | D172: 2 | E172: 26 | G172: 9 | H172: 7 | I172: 61 | K172: 11 | L172: 9 | M172: 75 | O172: 14 | P172: 12 | Q172: 96 | S172: Venue: COBURG
A173: SPRINGVALE | C173: 2 | D173: 5 | E173: 17 | G173: 3 | H173: 7 | I173: 25 | K173: 8 | L173: 10 | M173: 58 | O173: 13 | P173: 15 | Q173: 93 | S173: LUCKMAN ;FALLET
A174: BEST PLAYERS
A175: COBURG | C175: BARNES | F175: T HARRINGTON | I175: RYAN | L175: BAKER | O175: ANGWIN | R175: INGRAM
A176: SPRINGVALE | C176: NICOL | F176: SMIT | I176: M MALONI | L176: P MALONI | O176: BROMAGE | R176: MAYLIN
A177: GOALKICKERS
A178: COBURG | C178: INGRAM 5 | F178: REYNOLDSON 3 | I178: WILLIAMS | K178: GRIFFITHS | M178: BAKER | O178: LOONE | Q178: T HARRINGTON | U178: DOYLE
A179: SPRINGVALE | C179: ROBINSON 3 | F179: PROSSER 3 | I179: KOOP 2 | K179: DEMPSTER 2 | N179: REECE | P179: JACKSON | R179: NICOL
A181: BYE | C181: PRAHRAN
A183: ROUND 4 | D183: 4TH MAY | I183: WEATHER | S183: Venue: PORT MELBOURNE
D184: 1ST QTR | H184: 2ND QTR | L184: 3RD QTR | P184: FINAL | S184: UMPIRES
A185: WERRIBEE | C185: 3 | D185: 4 | E185: 22 | G185: 10 | H185: 8 | I185: 68 | K185: 17 | L185: 12 | M185: 114 | O185: 20 | P185: 22 | Q185: 142 | S185: SNEDDON | Y185: LADDER | AB185: ROUND | AD185: 4
A186: FRANKSTON | C186: 5 | D186: 5 | E186: 35 | G186: 5 | H186: 9 | I186: 39 | K186: 10 | L186: 14 | M186: 74 | O186: 14 | P186: 16 | Q186: 100 | S186: DOWSLEY
A187: BEST PLAYERS | W187: TEAM | X187: B | Y187: W | Z187: L | AA187: D | AB187: FOR | AC187: AGST | AD187: % | AE187: PTS
A188: WERRIBEE | C188: EAMES | F188: MORGAN | I188: LESIPUTTY | L188: ALLDAY | O188: KNIGHT | R188: GEARY
A189: FRANKSTON | C189: HAMILL | F189: D MARTIN | I189: RAVEN | L189: HYNES | O189: MACE | R189: ALLAN | W189: WERRIBEE | Y189: 4 | Z189: 0 | AA189: 0 | AB189: 520 | AC189: 417 | AD189: =(AB189/AC189)*100 -> 124.70023980815348 | AE189: =(Y189*4)+(AA189*2) -> 16
A190: GOALKICKERS | P190: MORGAN | W190: PORT MELBOURNE | Y190: 4 | Z190: 0 | AA190: 0 | AB190: 545 | AC190: 457 | AD190: =(AB190/AC190)*100 -> 119.25601750547045 | AE190: =(Y190*4)+(AA190*2) -> 16
A191: WERRIBEE | C191: KNIGHT 5 | F191: EAMES 4 | H191: STUBBS 3 | J191: SELLS 2 | L191: RAEBURN 2 | N191: O'KEEFE 2 | Q191: DANIHER | W191: COBURG | Y191: 3 | Z191: 1 | AA191: 0 | AB191: 449 | AC191: 437 | AD191: =(AB191/AC191)*100 -> 102.74599542334096 | AE191: =(Y191*4)+(AA191*2) -> 12
A192: FRANKSTON | C192: R ALLAN 4 | F192: HAMILL 2 | I192: BINGLEY 2 | K192: RAVEN 2 | M192: SOLE | O192: GAHAN | Q192: HYNES | S192: BELL | W192: BOX HILL | X192: 1 | Y192: 2 | Z192: 1 | AA192: 0 | AB192: 410 | AC192: 323 | AD192: =(AB192/AC192)*100 -> 126.93498452012383 | AE192: =(Y192*4)+(AA192*2) -> 8
D193: 5TH MAY | I193: WEATHER | R193: Venue: TOORAK PARK | W193: SANDRINGHAM | X193: 1 | Y193: 2 | Z193: 1 | AA193: 0 | AB193: 364 | AC193: 289 | AD193: =(AB193/AC193)*100 -> 125.95155709342561 | AE193: =(Y193*4)+(AA193*2) -> 8
A194: BOX HILL | C194: 3 | D194: 8 | E194: 26 | G194: 7 | H194: 10 | I194: 52 | K194: 16 | L194: 21 | M194: 117 | O194: 22 | P194: 23 | Q194: 155 | S194: RICHARDSON
A195: PRAHRAN | C195: 4 | D195: 2 | E195: 26 | G195: 9 | H195: 9 | I195: 63 | K195: 10 | L195: 12 | M195: 72 | O195: 15 | P195: 18 | Q195: 108 | S195: RUSSO | W195: WILLIAMSTOWN | Y195: 2 | Z195: 2 | AA195: 0 | AB195: 419 | AC195: 397 | AD195: =(AB195/AC195)*100 -> 105.54156171284635 | AE195: =(Y195*4)+(AA195*2) -> 8
A196: BEST PLAYERS | W196: DANDEN0NG | X196: 1 | Y196: 1 | Z196: 2 | AA196: 0 | AB196: 409 | AC196: 333 | AD196: =(AB196/AC196)*100 -> 122.82282282282281 | AE196: =(Y196*4)+(AA196*2) -> 4
A197: BOX HILL | C197: HICKS | F197: ESPENSCHIED | I197: HANDLEY | L197: BOURKE | O197: BYRNE | Q197: BUTTIFANT | W197: FRANKSTON | Y197: 1 | Z197: 3 | AA197: 0 | AB197: 398 | AC197: 431 | AD197: =(AB197/AC197)*100 -> 92.343387470997683 | AE197: =(Y197*4)+(AA197*2) -> 4
A198: PRAHRAN | C198: DIMMATINA | F198: HUG | I198: B TAYLOR | L198: MATERA | O198: BOLZON | W198: SPRINGVALE | Y198: 1 | Z198: 3 | AA198: 0 | AB198: 370 | AC198: 406 | AD198: =(AB198/AC198)*100 -> 91.13300492610837 | AE198: =(Y198*4)+(AA198*2) -> 4
A199: GOALKICKERS | H199: BRUSNAHAN | K199: O'NEILL | M199: DEBOER | O199: GROSS | Q199: HICKS | W199: PRESTON | Y199: 1 | Z199: 3 | AA199: 0 | AB199: 414 | AC199: 508 | AD199: =(AB199/AC199)*100 -> 81.496062992125985 | AE199: =(Y199*4)+(AA199*2) -> 4
A200: BOX HILL | C200: HANDLEY 5 | F200: BUTTIFANT 4 | I200: WYNN 3 | K200: ESPENSCHIED 2 | N200: ZARAFA 2 | Q200: BYRNE | W200: OAKLEIGH | X200: 2 | Y200: 0 | Z200: 2 | AA200: 0 | AB200: 196 | AC200: 293 | AD200: =(AB200/AC200)*100 -> 66.89419795221842 | AE200: =(Y200*4)+(AA200*2) -> 0
A201: PRAHRAN | C201: B TAYLOR 6 | F201: SOULOS 2 | I201: SCICLUNA 2 | L201: WILLIAMSON 2 | O201: DIMMATINA 2 | R201: POVEY | W201: PRAHRAN | X201: 1 | Y201: 0 | Z201: 3 | AA201: 0 | AB201: 311 | AC201: 519 | AD201: =(AB201/AC201)*100 -> 59.922928709055881 | AE201: =(Y201*4)+(AA201*2) -> 0
A203: PRESTON | C203: 4 | D203: 2 | E203: 26 | G203: 10 | H203: 7 | I203: 67 | K203: 12 | L203: 9 | M203: 81 | O203: 17 | P203: 14 | Q203: 116 | S203: Venue: PRESTON
A204: DANDENONG | C204: 4 | D204: 4 | E204: 28 | G204: 6 | H204: 8 | I204: 44 | K204: 13 | L204: 12 | M204: 90 | O204: 15 | P204: 13 | Q204: 103 | S204: CALLAGHAN ;MORROW
A205: BEST PLAYERS
A206: PRESTON | C206: KERR | F206: VALKANIS | I206: HEATLEY | L206: KOUTIFIDIS | O206: BURROWS | R206: REEVES
A207: DANDENONG | C207: MURRAY | F207: MILLANE | I207: WELSH | L207: KNIGHT | O207: TAYLOR | R207: MILLIGAN
A208: GOALKICKERS
A209: PRESTON | C209: HEATLEY 4 | F209: GRAZIANO 3 | I209: NICOLAOU 2 | L209: HALAS 2 | N209: BROWN 2 | P209: JORDAN 2 | R209: LUMICISI | U209: WALKER
A210: DANDENONG | C210: WELSH 3 | E210: GARRETT 2 | H210: GOTCH 2 | J210: LACKO 2 | L210: FRANGALAS | O210: KNIGHT | Q210: MCCORMACK | T210: MILLIGAN | X210: READ | Y210: WICKS
A212: COBURG | C212: 7 | D212: 4 | E212: 46 | G212: 10 | H212: 6 | I212: 66 | K212: 18 | L212: 12 | M212: 120 | O212: 22 | P212: 15 | Q212: 147 | S212: Venue: WILLIAMSTOWN
A213: WILLIAMSTOWN | C213: 3 | D213: 1 | E213: 19 | G213: 11 | H213: 8 | I213: 74 | K213: 12 | L213: 12 | M213: 84 | O213: 16 | P213: 16 | Q213: 112 | S213: MITCHELL ;FORSTER
A214: BEST PLAYERS
A215: COBURG | C215: RYAN | F215: GUMLEY | I215: D HARRINGTON | L215: T HARRINGTON | O215: BAKER | Q215: DOYLE
A216: WILLIAMSTOWN | C216: GHAZI | F216: BURTON | I216: SMITH | L216: MITCHELL | O216: LLOYD
A217: GOALKICKERS
A218: COBURG | C218: N DOYLE 5 | F218: REYNOLDSON 4 | I218: INGRAM 3 | K218: LOONE 2 | M218: GRIFFITHS 2 | P218: ZANON | R218: BAKER | T218: BURKE | W218: D HARRINGTON | Y218: LANGAN
A219: WILLIAMSTOWN | C219: GHAZI 3 | E219: AZIZ 2 | G219: WILLIAMS 2 | J219: RICKMAN 2 | M219: SMITH 2 | O219: KEANE | Q219: ROUND | S219: MILES | U219: JOHANSEN | Y219: HEIGHT
A221: PORT MELBOURNE | C221: 8 | D221: 7 | E221: 55 | G221: 12 | H221: 11 | I221: 83 | K221: 17 | L221: 15 | M221: 117 | O221: 20 | P221: 19 | Q221: 139 | S221: Venue: SPRINGVALE
A222: SPRINGVALE | C222: 5 | D222: 4 | E222: 34 | G222: 9 | H222: 7 | I222: 61 | K222: 10 | L222: 12 | M222: 72 | O222: 17 | P222: 19 | Q222: 121 | S222: SAVILLE :HARVEY
A223: BEST PLAYERS
A224: PORT MELBOURNE | C224: HARKINS | F224: STROOPER | I224: BARLOW | L224: JAMES | O224: CAMERON | R224: FOLEY
A225: SPRINGVALE | C225: P MALONI | F225: MAYLIN | I225: KOOP | L225: PROSSER | O225: SMIT
A226: GOALKICKERS
A227: PORT MELBOURNE | C227: JAMES 5 | E227: DONALD 3 | G227: GASPARONI 3 | J227: HICKS 3 | L227: ASANI 2 | N227: BARLOW | P227: CLOHESY | R227: FOLEY | T227: TILLEY
A228: SPRINGVALE | C228: SMIT 4 | E228: DUDLEY 3 | G228: PROSSER 3 | I228: ROBINSON 2 | L228: P MALONI 2 | O228: CARIS | Q228: JACKSON | S228: NICOL
A230: OAKLEIGH | C230: 6 | D230: 4 | E230: 40 | G230: 13 | H230: 11 | I230: 89 | K230: 20 | L230: 13 | M230: 133 | O230: 30 | P230: 19 | Q230: 199 | S230: Venue: BRUNSWICK
A231: B'WICK/B'MEAD | C231: 6 | D231: 3 | E231: 39 | G231: 8 | H231: 9 | I231: 57 | K231: 11 | L231: 16 | M231: 82 | O231: 14 | P231: 18 | Q231: 102 | S231: AGNEW :SIGMONT
A232: BEST PLAYERS
A233: OAKLEIGH | C233: N/A
A234: B'WICK/B'MEAD | C234: N/A
A235: GOALKICKERS
A236: OAKLEIGH | C236: N/A
A237: B'WICK/B'MEAD | C237: N/A
A239: BYE | C239: SANDRINGHAM
A241: ROUND 5 | D241: 11TH MAY | I241: WEATHER | S241: Venue: PORT MELBOURNE
D242: 1ST QTR | H242: 2ND QTR | L242: 3RD QTR | P242: FINAL | S242: UMPIRES
A243: BOX HILL | C243: 3 | D243: 2 | E243: 20 | G243: 7 | H243: 6 | I243: 48 | K243: 15 | L243: 10 | M243: 100 | O243: 21 | P243: 10 | Q243: 136 | S243: HARVEY | Y243: LADDER | AB243: ROUND | AD243: 5
A244: SANDRINGHAM | C244: 4 | D244: 10 | E244: 34 | G244: 11 | H244: 12 | I244: 78 | K244: 15 | L244: 13 | M244: 103 | O244: 18 | P244: 16 | Q244: 124 | S244: PANOZZO
A245: BEST PLAYERS | W245: TEAM | X245: B | Y245: W | Z245: L | AA245: D | AB245: FOR | AC245: AGST | AD245: % | AE245: PTS
A246: BOX HILL | C246: LISLE | F246: DALRYMPLE | I246: HOGAN | L246: HICKS | O246: BUTTIFANT | R246: BANFIELD
A247: SANDRINGHAM | C247: O'CONNOR | F247: BAILEY | I247: J DUURSMA | L247: BINGHAM | W247: WERRIBEE | Y247: 5 | Z247: 0 | AA247: 0 | AB247: 689 | AC247: 518 | AD247: =(AB247/AC247)*100 -> 133.01158301158301 | AE247: =(Y247*4)+(AA247*2) -> 20
A248: GOALKICKERS | L248: HANDLEY | N248: HICKS | P248: DALRYMPLE | R248: DEBOER | W248: PORT MELBOURNE | Y248: 5 | Z248: 0 | AA248: 0 | AB248: 671 | AC248: 550 | AD248: =(AB248/AC248)*100 -> 122 | AE248: =(Y248*4)+(AA248*2) -> 20
A249: BOX HILL | C249: LISLE 5 | E249: BYRNE 3 | G249: BUTTIFANT 3 | J249: KENNAWAY 2 | M249: WYNN 2 | O249: GROSS | Q249: BRUSNAHAN | W249: BOX HILL | X249: 1 | Y249: 3 | Z249: 1 | AA249: 0 | AB249: 546 | AC249: 447 | AD249: =(AB249/AC249)*100 -> 122.14765100671141 | AE249: =(Y249*4)+(AA249*2) -> 12
A250: SANDRINGHAM | C250: WEARNE 4 | E250: FISCHER 3 | G250: FOLEY 2 | I250: JONES 2 | K250: CUMMINGS 2 | N250: C GARRETT 2 | Q250: P GARRETT | W250: COBURG | Y250: 3 | Z250: 2 | AA250: 0 | AB250: 537 | AC250: 566 | AD250: =(AB250/AC250)*100 -> 94.876325088339215 | AE250: =(Y250*4)+(AA250*2) -> 12
D251: 12TH MAY | I251: WEATHER | L251: BONNEY | N251: CULLINANE | S251: Venue: DANDENONG | W251: DANDEN0NG | X251: 1 | Y251: 2 | Z251: 2 | AA251: 0 | AB251: 529 | AC251: 413 | AD251: =(AB251/AC251)*100 -> 128.08716707021793 | AE251: =(Y251*4)+(AA251*2) -> 8
A252: DANDENONG | C252: 4 | D252: 4 | E252: 28 | G252: 9 | H252: 4 | I252: 58 | K252: 12 | L252: 7 | M252: 79 | O252: 18 | P252: 12 | Q252: 120 | S252: McDONALD
A253: SPRINGVALE | C253: 1 | D253: 4 | E253: 10 | G253: 4 | H253: 3 | I253: 27 | K253: 10 | L253: 8 | M253: 68 | O253: 12 | P253: 8 | Q253: 80 | S253: FALLET | W253: SANDRINGHAM | X253: 1 | Y253: 2 | Z253: 2 | AA253: 0 | AB253: 488 | AC253: 425 | AD253: =(AB253/AC253)*100 -> 114.8235294117647 | AE253: =(Y253*4)+(AA253*2) -> 8
A254: BEST PLAYERS | W254: FRANKSTON | Y254: 2 | Z254: 3 | AA254: 0 | AB254: 527 | AC254: 519 | AD254: =(AB254/AC254)*100 -> 101.54142581888246 | AE254: =(Y254*4)+(AA254*2) -> 8
A255: DANDENONG | C255: MILLIGAN | F255: BROWN | I255: McCORMACK | L255: FRANGALAS | O255: KNIGHT | Q255: TAYLOR | W255: WILLIAMSTOWN | Y255: 2 | Z255: 3 | AA255: 0 | AB255: 512 | AC255: 523 | AD255: =(AB255/AC255)*100 -> 97.896749521988525 | AE255: =(Y255*4)+(AA255*2) -> 8
A256: SPRINGVALE | C256: MAYLIN | F256: McDONOUGH | I256: NICOL | L256: MEIKLE | O256: MENDE | W256: SPRINGVALE | Y256: 1 | Z256: 4 | AA256: 0 | AB256: 450 | AC256: 524 | AD256: =(AB256/AC256)*100 -> 85.877862595419856 | AE256: =(Y256*4)+(AA256*2) -> 4
A257: GOALKICKERS | W257: PRAHRAN | X257: 1 | Y257: 1 | Z257: 3 | AA257: 0 | AB257: 489 | AC257: 611 | AD257: =(AB257/AC257)*100 -> 80.032733224222582 | AE257: =(Y257*4)+(AA257*2) -> 4
A258: DANDENONG | C258: McKENZIE 4 | F258: MILLANE 3 | I258: READ 3 | K258: WELSH 3 | M258: GARRETT 2 | P258: HALL 2 | R258: KNIGHT | W258: PRESTON | Y258: 1 | Z258: 4 | AA258: 0 | AB258: 515 | AC258: 677 | AD258: =(AB258/AC258)*100 -> 76.070901033973414 | AE258: =(Y258*4)+(AA258*2) -> 4
A259: SPRINGVALE | C259: MEIKLE 3 | F259: CLARKE 2 | I259: ROBINSON 2 | L259: PEACOCK | N259: DUDLEY | P259: PROSSER | R259: BROMAGE | W259: OAKLEIGH | X259: 2 | Y259: 0 | Z259: 3 | AA259: 0 | AB259: 288 | AC259: 471 | AD259: =(AB259/AC259)*100 -> 61.146496815286625 | AE259: =(Y259*4)+(AA259*2) -> 0
P260: DEMPSTER
A261: PORT MELBOURNE | C261: 0 | D261: 5 | E261: 5 | G261: 6 | H261: 10 | I261: 46 | K261: 12 | L261: 14 | M261: 86 | O261: 18 | P261: 18 | Q261: 126 | S261: Venue: PORT MELBOURNE
A262: WILLIAMSTOWN | C262: 5 | D262: 1 | E262: 31 | G262: 7 | H262: 3 | I262: 45 | K262: 12 | L262: 5 | M262: 77 | O262: 14 | P262: 9 | Q262: 93 | S262: SNEDDON :VAN BEEK
A263: BEST PLAYERS
A264: PORT MELBOURNE | C264: CAMERON | F264: BAILEY | I264: HARKINS | L264: TILLEY | O264: JAMES | Q264: KENNEDY
A265: WILLIAMSTOWN | C265: GHAZI | F265: BURTON | I265: PASTORE | L265: HEIGHT
A266: GOALKICKERS
A267: PORT MELBOURNE | C267: JAMES 5 | E267: PAUL 4 | G267: ASANI 2 | I267: CLOHESY 2 | K267: KENNEDY 2 | N267: BOWDEN | P267: FOLEY | R267: HARKINS
A268: WILLIAMSTOWN | C268: BURTON 5 | F268: GHAZI 2 | H268: WILLIAMS 2 | K268: GOULD 2 | M268: RICKMAN | O268: SYMONS | Q268: CORDY
A270: FRANKSTON | C270: 2 | D270: 1 | E270: 13 | G270: 8 | H270: 3 | I270: 51 | K270: 13 | L270: 12 | M270: 90 | O270: 19 | P270: 15 | Q270: 129 | S270: Venue: COBURG
A271: COBURG | C271: 3 | D271: 7 | E271: 25 | G271: 8 | H271: 8 | I271: 56 | K271: 10 | L271: 12 | M271: 72 | O271: 12 | P271: 16 | Q271: 88 | S271: GERSCH :MORROW
A272: BEST PLAYERS
A273: FRANKSTON | C273: S HAMILL | F273: POLLOCK | I273: BELL | L273: DENEREAZ | O273: RAVEN
A274: COBURG | C274: SHELDON | F274: BARNES | I274: RYAN | L274: T HARRINGTON
A275: GOALKICKERS
A276: FRANKSTON | C276: S HAMILL 5 | F276: R ALLAN 4 | I276: KEANE 3 | K276: HYNES 2 | M276: SHANNON 2 | P276: PAYNTER | R276: GAHAN | U276: MACE
A277: COBURG | C277: REYNOLDSON 5 | F277: DOYLE 2 | H277: LANGAN 2 | J277: BURKE | L277: GUMLEY | N277: INGRAM
A279: PRAHRAN | C279: 10 | D279: 3 | E279: 63 | G279: 17 | H279: 9 | I279: 111 | K279: 23 | L279: 11 | M279: 149 | O279: 27 | P279: 16 | Q279: 178 | S279: Venue: OAKLEIGH
A280: OAKLEIGH | C280: 3 | D280: 1 | E280: 19 | G280: 6 | H280: 3 | I280: 39 | K280: 7 | L280: 10 | M280: 52 | O280: 13 | P280: 14 | Q280: 92 | S280: SAVILLE :TURNHAM
A281: BEST PLAYERS
A282: PRAHRAN | C282: CHAPPLE | F282: B TAYLOR | I282: SHORTHOUSE | L282: HYRSOULAKIS | O282: BOLZON | R282: HUG
A283: OAKLEIGH | C283: LEMON | F283: SMITH | I283: OWEN | L283: ATHERTON | O283: ROBINSON
A284: GOALKICKERS
A285: PRAHRAN | C285: B TAYLOR 10 | F285: RADBONE 4 | I285: COLLINS 3 | K285: DIMMATINA 2 | N285: MATERA 2 | Q285: WILLIAMSON 2 | W285: HYRSOULAKIS | X285: BERRY | Z285: POVEY | AB285: CUTLER
A286: OAKLEIGH | C286: PRETTO 4 | F286: OWEN 3 | H286: SUTHERLAND 3 | K286: ATHERTON | N286: HAWKER | P286: MELLODY
A288: WERRIBEE | C288: 3 | D288: 1 | E288: 19 | G288: 14 | H288: 3 | I288: 87 | K288: 18 | L288: 8 | M288: 116 | O288: 26 | P288: 13 | Q288: 169 | S288: Venue: WERRIBEE
A289: PRESTON | C289: 4 | D289: 5 | E289: 29 | G289: 6 | H289: 8 | I289: 44 | K289: 10 | L289: 12 | M289: 72 | O289: 14 | P289: 17 | Q289: 101 | S289: ALLEN :RICHARDSON
A290: BEST PLAYERS
A291: WERRIBEE | C291: MORGAN | F291: LESIPUTTY | I291: DANIHER | L291: KNIGHT | O291: GEARY | R291: FITZPATRICK
A292: PRESTON | C292: MARCON | F292: OWEN | I292: REEVES | L292: VALKANIS | O292: KERR | R292: WALKER
A293: GOALKICKERS
A294: WERRIBEE | C294: WRIGHT 6 | F294: DANIHER 5 | I294: EAMES 5 | K294: SELLS 3 | M294: STUBBS 3 | O294: RAEBURN 3 | Q294: GEARY
A295: PRESTON | C295: HEATLEY 4 | F295: LUMICISI 2 | I295: MARCON 2 | L295: SENNO | N295: POURSANIDES | Q295: GRAZIANO | S295: KERR | U295: BURROWS
A297: ROUND 6 | D297: 18TH MAY | I297: WEATHER | S297: Venue: PORT MELBOURNE
D298: 1ST QTR | H298: 2ND QTR | L298: 3RD QTR | P298: FINAL | S298: UMPIRES
A299: DANDENONG | C299: 7 | D299: 2 | E299: 44 | G299: 14 | H299: 7 | I299: 91 | K299: 24 | L299: 9 | M299: 153 | O299: 34 | P299: 11 | Q299: 215 | S299: SAVILLE | Y299: LADDER | AB299: ROUND | AD299: 6
A300: WILLIAMSTOWN | C300: 6 | D300: 2 | E300: 38 | G300: 10 | H300: 3 | I300: 63 | K300: 18 | L300: 5 | M300: 113 | O300: 21 | P300: 9 | Q300: 135 | S300: LUCKMAN
A301: BEST PLAYERS | W301: TEAM | X301: B | Y301: W | Z301: L | AA301: D | AB301: FOR | AC301: AGST | AD301: % | AE301: PTS
A302: DANDENONG | C302: MURRAY | F302: WELSH | I302: READ | L302: MILLANE | O302: ATKINSON | R302: KNIGHT
A303: WILLIAMSTOWN | C303: GOULD | F303: GHAZI | I303: McGOWAN | L303: SWAN | O303: HOWLETT | W303: PORT MELBOURNE | Y303: 6 | Z303: 0 | AA303: 0 | AB303: 803 | AC303: 656 | AD303: =(AB303/AC303)*100 -> 122.40853658536585 | AE303: =(Y303*4)+(AA303*2) -> 24
A304: GOALKICKERS | K304: BOURKE | M304: MILLIGAN | O304: BROWN | Q304: MOREY | W304: WERRIBEE | Y304: 5 | Z304: 1 | AA304: 0 | AB304: 827 | AC304: 693 | AD304: =(AB304/AC304)*100 -> 119.33621933621934 | AE304: =(Y304*4)+(AA304*2) -> 20
A305: DANDENONG | C305: WELSH 11 | E305: GOTCH 5 | G305: MILLANE 4 | I305: READ 4 | K305: ATKINSON 2 | N305: McKENZIE 2 | Q305: WICKS 2 | W305: BOX HILL | X305: 1 | Y305: 4 | Z305: 1 | AA305: 0 | AB305: 690 | AC305: 563 | AD305: =(AB305/AC305)*100 -> 122.55772646536411 | AE305: =(Y305*4)+(AA305*2) -> 16
A306: WILLIAMSTOWN | C306: GHAZI 5 | E306: BURTON 5 | G306: RICKMAN 4 | I306: MCGOWAN 2 | L306: SMITH | N306: KENNY | P306: MUSCHIALLI | W306: COBURG | Y306: 4 | Z306: 2 | AA306: 0 | AB306: 712 | AC306: 704 | AD306: =(AB306/AC306)*100 -> 101.13636363636364 | AE306: =(Y306*4)+(AA306*2) -> 16
D307: 19TH MAY | I307: WEATHER | M307: HOWLETT | P307: McTAGGART | S307: Venue: PRESTON | W307: SANDRINGHAM | X307: 1 | Y307: 3 | Z307: 2 | AA307: 0 | AB307: 687 | AC307: 425 | AD307: =(AB307/AC307)*100 -> 161.64705882352942 | AE307: =(Y307*4)+(AA307*2) -> 12
A308: BOX HILL | C308: 0 | D308: 4 | E308: 4 | G308: 6 | H308: 6 | I308: 42 | K308: 16 | L308: 7 | M308: 103 | O308: 22 | P308: 12 | Q308: 144 | S308: CARLAND
A309: PRESTON | C309: 4 | D309: 7 | E309: 31 | G309: 7 | H309: 10 | I309: 52 | K309: 14 | L309: 11 | M309: 95 | O309: 17 | P309: 14 | Q309: 116 | S309: FALLET | W309: DANDEN0NG | X309: 1 | Y309: 3 | Z309: 2 | AA309: 0 | AB309: 744 | AC309: 548 | AD309: =(AB309/AC309)*100 -> 135.76642335766422 | AE309: =(Y309*4)+(AA309*2) -> 12
A310: BEST PLAYERS | W310: FRANKSTON | Y310: 2 | Z310: 4 | AA310: 0 | AB310: 633 | AC310: 651 | AD310: =(AB310/AC310)*100 -> 97.235023041474662 | AE310: =(Y310*4)+(AA310*2) -> 8
A311: BOX HILL | C311: HOGAN | F311: BANFIELD | I311: O'NEILL | L311: GROSS | O311: HANDLEY | R311: ZARAFA | W311: SPRINGVALE | Y311: 2 | Z311: 4 | AA311: 0 | AB311: 576 | AC311: 625 | AD311: =(AB311/AC311)*100 -> 92.16 | AE311: =(Y311*4)+(AA311*2) -> 8
A312: PRESTON | C312: REEVES | F312: OWEN | I312: PERCY | L312: WALKER | O312: LUMICISI | R312: KERR | W312: WILLIAMSTOWN | Y312: 2 | Z312: 4 | AA312: 0 | AB312: 647 | AC312: 738 | AD312: =(AB312/AC312)*100 -> 87.669376693766949 | AE312: =(Y312*4)+(AA312*2) -> 8
A313: GOALKICKERS | Q313: LISLE | W313: PRAHRAN | X313: 1 | Y313: 1 | Z313: 4 | AA313: 0 | AB313: 590 | AC313: 737 | AD313: =(AB313/AC313)*100 -> 80.054274084124827 | AE313: =(Y313*4)+(AA313*2) -> 4
A314: BOX HILL | C314: HANDLEY 6 | E314: HICKS 6 | G314: DALRYMPLE 2 | J314: DEBOER 2 | L314: BUTTIFANT 2 | O314: KENNAWAY 2 | R314: HOGAN | W314: PRESTON | Y314: 1 | Z314: 5 | AA314: 0 | AB314: 631 | AC314: 821 | AD314: =(AB314/AC314)*100 -> 76.857490864799033 | AE314: =(Y314*4)+(AA314*2) -> 4
A315: PRESTON | C315: GRAZIANO 4 | F315: LUMICIS 3 | I315: SENNO 3 | K315: MARCON 3 | M315: NICOLAOU | O315: BROWN | Q315: DINTINOSANTE | W315: OAKLEIGH | X315: 2 | Y315: 0 | Z315: 4 | AA315: 0 | AB315: 371 | AC315: 670 | AD315: =(AB315/AC315)*100 -> 55.373134328358212 | AE315: =(Y315*4)+(AA315*2) -> 0
P316: HEATLEY
A317: PORT MELBOURNE | C317: 6 | D317: 4 | E317: 40 | G317: 9 | H317: 5 | I317: 59 | K317: 11 | L317: 10 | M317: 76 | O317: 20 | P317: 12 | Q317: 132 | S317: Venue: FRANKSTON
A318: FRANKSTON | C318: 1 | D318: 2 | E318: 8 | G318: 8 | H318: 7 | I318: 55 | K318: 11 | L318: 13 | M318: 79 | O318: 15 | P318: 16 | Q318: 106 | S318: CAULFIELD :ALLEN
A319: BEST PLAYERS
A320: PORT MELBOURNE | C320: CAMERON | F320: HARKINS | I320: BARLOW | L320: STROOPER | O320: PAUL | Q320: BOWDEN
A321: FRANKSTON | C321: D MARTIN | F321: MACE | I321: GAHAN | L321: S HAMILL | O321: SOLE
A322: GOALKICKERS
A323: PORT MELBOURNE | C323: PAUL 7 | E323: JAMES 4 | G323: ASANI 3 | I323: CLOHESY 2 | K323: BAILEY | M323: FOLEY | O323: HARKINS | Q323: TILLEY
A324: FRANKSTON | C324: BINGLEY 4 | F324: KEANE 4 | H324: PAYNTER 3 | J324: WEBB | L324: S HAMILL | N324: SHANNON | Q324: M HYNES
A326: COBURG | C326: 7 | D326: 7 | E326: 49 | G326: 13 | H326: 12 | I326: 90 | K326: 21 | L326: 15 | M326: 141 | O326: 26 | P326: 19 | Q326: 175 | S326: Venue: COBURG
A327: WERRIBEE | C327: 4 | D327: 4 | E327: 28 | G327: 9 | H327: 6 | I327: 60 | K327: 13 | L327: 10 | M327: 88 | O327: 21 | P327: 12 | Q327: 138 | S327: SNEDDON :AGNEW
A328: BEST PLAYERS
A329: COBURG | C329: ZANON | F329: SULLIVAN | I329: BAKER | L329: ALLISON | O329: BARNES
A330: WERRIBEE | C330: GEARY | F330: McMASTER | I330: DANIHER | L330: FITZPATRICK | O330: SELLS | Q330: HARRIS
A331: GOALKICKERS
A332: COBURG | C332: SULLIVAN 6 | F332: GRIFFITHS 4 | I332: YOUNG 4 | K332: BAKER 4 | M332: KAAKOUR 2 | P332: REYNOLDSON 2 | S332: SHELDON 2 | W332: SALVADORE | Y332: BURKE
A333: WERRIBEE | C333: SELLS 5 | F333: DRUM 3 | H333: WRIGHT 3 | J333: KNIGHT 2 | L333: MCMASTER 2 | O333: STUBBS | Q333: EAMES | S333: MORGAN | W333: DANIHER | Y333: O'KEEFE | AB333: RAEBURN
A335: SANDRINGHAM | C335: 5 | D335: 5 | E335: 35 | G335: 13 | H335: 11 | I335: 89 | K335: 18 | L335: 19 | M335: 127 | O335: 29 | P335: 25 | Q335: 199 | S335: Venue: BEACH ROAD
A336: OAKLEIGH | C336: 4 | D336: 5 | E336: 29 | G336: 7 | H336: 7 | I336: 49 | K336: 8 | L336: 7 | M336: 55 | O336: 12 | P336: 11 | Q336: 83 | S336: VAN BEEK :MORROW
A337: BEST PLAYERS
A338: SANDRINGHAM | C338: ALLEN | F338: BAILEY | I338: RYAN | L338: FOLEY | O338: J RUGOLO | R338: FISCHER
A339: OAKLEIGH | C339: OWEN | F339: HILLIARD | I339: PRETTO | L339: ATHERTON
A340: GOALKICKERS
A341: SANDRINGHAM | C341: FISCHER 6 | F341: WEARNE 6 | I341: P GARRETT 4 | L341: F RUGOLO 4 | O341: FOLEY 3 | Q341: C GARRETT 3 | T341: BINGHAM | X341: JONES | Y341: ALLEN
A342: OAKLEIGH | C342: PRETTO 7 | F342: MYNOTT 2 | I342: OWEN | K342: HAWKER | M342: SHARP
A344: SPRINGVALE | C344: 2 | D344: 4 | E344: 16 | G344: 8 | H344: 9 | I344: 57 | K344: 13 | L344: 10 | M344: 88 | O344: 18 | P344: 18 | Q344: 126 | S344: Venue: SPRINGVALE
A345: PRAHRAN | C345: 4 | D345: 3 | E345: 27 | G345: 6 | H345: 7 | I345: 43 | K345: 10 | L345: 17 | M345: 77 | O345: 14 | P345: 17 | Q345: 101
A346: BEST PLAYERS
A347: SPRINGVALE
A348: PRAHRAN
A349: GOALKICKERS
A350: SPRINGVALE
A351: PRAHRAN
A353: ROUND 7 | D353: 25TH MAY | I353: WEATHER | S353: Venue: PORT MELBOURNE
D354: 1ST QTR | H354: 2ND QTR | L354: 3RD QTR | P354: FINAL | S354: UMPIRES
A355: PORT MELBOURNE | C355: 6 | D355: 2 | E355: 38 | G355: 9 | H355: 11 | I355: 65 | K355: 14 | L355: 16 | M355: 100 | O355: 21 | P355: 17 | Q355: 143 | S355: McDONALD | Y355: LADDER | AB355: ROUND | AD355: 7
A356: COBURG | C356: 0 | D356: 5 | E356: 5 | G356: 1 | H356: 11 | I356: 17 | K356: 4 | L356: 22 | M356: 46 | O356: 13 | P356: 25 | Q356: 103 | S356: FALLET
A357: BEST PLAYERS | W357: TEAM | X357: B | Y357: W | Z357: L | AA357: D | AB357: FOR | AC357: AGST | AD357: % | AE357: PTS
A358: PORT MELBOURNE | C358: HARKINS | F358: GASPARONI | I358: CAMERON | L358: PAUL | O358: HETHERTON | R358: DONALD
A359: COBURG | C359: NIMMO | F359: ZANON | I359: SALVADOR | L359: BAKER | W359: PORT MELBOURNE | Y359: 7 | Z359: 0 | AA359: 0 | AB359: 946 | AC359: 759 | AD359: =(AB359/AC359)*100 -> 124.63768115942028 | AE359: =(Y359*4)+(AA359*2) -> 28
A360: GOALKICKERS | W360: WERRIBEE | Y360: 6 | Z360: 1 | AA360: 0 | AB360: 997 | AC360: 831 | AD360: =(AB360/AC360)*100 -> 119.97593261131168 | AE360: =(Y360*4)+(AA360*2) -> 24
A361: PORT MELBOURNE | C361: PAUL 8 | E361: HETHERTON 5 | H361: JAMES 3 | J361: HARKINS 2 | M361: KENNEDY | O361: FOLEY | Q361: CLOHESSY | W361: BOX HILL | X361: 1 | Y361: 5 | Z361: 1 | AA361: 0 | AB361: 833 | AC361: 679 | AD361: =(AB361/AC361)*100 -> 122.68041237113403 | AE361: =(Y361*4)+(AA361*2) -> 20
A362: COBURG | C362: YOUNG 3 | E362: SULLIVAN 2 | H362: DOYLE 2 | J362: NIMMO 2 | L362: SHELDON 2 | O362: BAKER | Q362: HARRINGTON | W362: SANDRINGHAM | X362: 1 | Y362: 4 | Z362: 2 | AA362: 0 | AB362: 816 | AC362: 551 | AD362: =(AB362/AC362)*100 -> 148.09437386569871 | AE362: =(Y362*4)+(AA362*2) -> 16
D363: 26TH MAY | I363: WEATHER | S363: Venue: BOX HILL | W363: DANDEN0NG | X363: 1 | Y363: 4 | Z363: 2 | AA363: 0 | AB363: 962 | AC363: 672 | AD363: =(AB363/AC363)*100 -> 143.1547619047619 | AE363: =(Y363*4)+(AA363*2) -> 16
A364: BOX HILL | C364: 5 | D364: 5 | E364: 35 | G364: 12 | H364: 7 | I364: 79 | K364: 16 | L364: 9 | M364: 105 | O364: 22 | P364: 11 | Q364: 143 | S364: HARRIS
A365: SPRINGVALE | C365: 5 | D365: 2 | E365: 32 | G365: 5 | H365: 6 | I365: 36 | K365: 11 | L365: 11 | M365: 77 | O365: 17 | P365: 14 | Q365: 116 | S365: AGNEW | W365: COBURG | Y365: 4 | Z365: 3 | AA365: 0 | AB365: 815 | AC365: 847 | AD365: =(AB365/AC365)*100 -> 96.221959858323487 | AE365: =(Y365*4)+(AA365*2) -> 16
A366: BEST PLAYERS | W366: SPRINGVALE | Y366: 2 | Z366: 5 | AA366: 0 | AB366: 692 | AC366: 768 | AD366: =(AB366/AC366)*100 -> 90.104166666666657 | AE366: =(Y366*4)+(AA366*2) -> 8
A367: BOX HILL | C367: HOGAN | F367: GROSS | I367: LISLE | L367: KENNAWAY | O367: BUTTIFANT | R367: ZARAFA | W367: WILLIAMSTOWN | Y367: 2 | Z367: 5 | AA367: 0 | AB367: 773 | AC367: 867 | AD367: =(AB367/AC367)*100 -> 89.158016147635522 | AE367: =(Y367*4)+(AA367*2) -> 8
A368: SPRINGVALE | C368: MORGAN | F368: MALONI | I368: CLARKE | L368: NICOL | O368: ROBINSON | R368: MENDE | W368: FRANKSTON | Y368: 2 | Z368: 5 | AA368: 0 | AB368: 757 | AC368: 869 | AD368: =(AB368/AC368)*100 -> 87.111622554660528 | AE368: =(Y368*4)+(AA368*2) -> 8
A369: GOALKICKERS | L369: WYNN | N369: ZARAFA | P369: ESPENSCHIED | W369: PRESTON | Y369: 2 | Z369: 5 | AA369: 0 | AB369: 777 | AC369: 935 | AD369: =(AB369/AC369)*100 -> 83.101604278074873 | AE369: =(Y369*4)+(AA369*2) -> 8
A370: BOX HILL | C370: BUTTIFANT 5 | F370: LISLE 5 | H370: BOX 2 | J370: HANDLEY 2 | M370: HICKS 2 | O370: BYRNE 2 | Q370: DEBOER | W370: PRAHRAN | X370: 1 | Y370: 1 | Z370: 5 | AA370: 0 | AB370: 728 | AC370: 907 | AD370: =(AB370/AC370)*100 -> 80.264608599779493 | AE370: =(Y370*4)+(AA370*2) -> 4
A371: SPRINGVALE | C371: ROBINSON 5 | F371: NICOL 3 | H371: PEACOCK 2 | K371: MENDE 2 | M371: MIEKLE 2 | O371: DEMPSTER | Q371: PROSSER | W371: OAKLEIGH | X371: 2 | Y371: 0 | Z371: 5 | AA371: 0 | AB371: 485 | AC371: 816 | AD371: =(AB371/AC371)*100 -> 59.436274509803923 | AE371: =(Y371*4)+(AA371*2) -> 0
P372: MALONI
A373: DANDENONG | C373: 8 | D373: 2 | E373: 50 | G373: 17 | H373: 7 | I373: 119 | K373: 26 | L373: 9 | M373: 165 | O373: 34 | P373: 14 | Q373: 218 | S373: Venue: DANDENONG
A374: FRANKSTON | C374: 3 | D374: 2 | E374: 20 | G374: 10 | H374: 5 | I374: 65 | K374: 16 | L374: 8 | M374: 104 | O374: 19 | P374: 10 | Q374: 124 | S374: CARLAND :TURNHAM
A375: BEST PLAYERS
A376: DANDENONG | C376: BROWN | F376: McKENZIE | I376: MILLANE | L376: KNIGHT | O376: MILLIGAN | R376: BOURKE
A377: FRANKSTON | C377: VANDERMEER | F377: BINGLEY | I377: KEANE | L377: COLLINS | O377: MARTIN
A378: GOALKICKERS | S378: BOURKE | W378: HALL
A379: DANDENONG | C379: READ 6 | E379: McKENZIE 5 | H379: DOYLE 4 | J379: ELSHAUG 4 | M379: ATKINSON 2 | P379: BROWN 2 | R379: GOTCH 2 | U379: McCORMACK 2 | Y379: MILLANE 2 | AB379: WELSH 2 | AD379: WICKS
A380: FRANKSTON | C380: KEANE 5 | E380: BINGLEY 3 | G380: ALLAN 2 | I380: GAHAN 2 | K380: HAMILL | M380: BELL | N380: DENEREAZ | Q380: SHANNON | S380: PAYNTER | W380: GARDNER | Y380: VANDERMEER
A382: PRESTON | C382: 6 | D382: 3 | E382: 39 | G382: 12 | H382: 9 | I382: 81 | K382: 15 | L382: 12 | M382: 102 | O382: 22 | P382: 14 | Q382: 146 | S382: Venue: OAKLEIGH
A383: OAKLEIGH | C383: 3 | D383: 2 | E383: 20 | G383: 6 | H383: 5 | I383: 41 | K383: 14 | L383: 7 | M383: 91 | O383: 17 | P383: 12 | Q383: 114 | S383: KEATING :GERSCH
A384: BEST PLAYERS
A385: PRESTON | C385: OWEN | F385: GRAZIANO | I385: PERCY | L385: KERR | O385: LUMICISI | Q385: KING
A386: OAKLEIGH | C386: HICKEY | F386: LEMON | I386: SUTHERLAND | L386: OWEN | O386: TODD | Q386: HAWKER
A387: GOALKICKERS
A388: PRESTON | C388: GRAZIANO 9 | F388: LUMICISI 3 | I388: SENNO 3 | K388: NICOLAOU 2 | N388: CARDAMONE 2 | Q388: BURROWS | S388: KERR | U388: WALKER
A389: OAKLEIGH | C389: PRETTO 8 | F389: WELSFORD 3 | I389: OWEN 3 | K389: HICKEY | M389: TODD | O389: SUTHERLAND
A391: WERRIBEE | C391: 7 | D391: 6 | E391: 48 | G391: 11 | H391: 8 | I391: 74 | K391: 21 | L391: 12 | M391: 138 | O391: 25 | P391: 20 | Q391: 170 | S391: Venue: TOORAK PARK
A392: PRAHRAN | C392: 4 | D392: 5 | E392: 29 | G392: 9 | H392: 8 | I392: 62 | K392: 14 | L392: 11 | M392: 95 | O392: 21 | P392: 12 | Q392: 138 | S392: SAWERS :CALLAGHAN
A393: BEST PLAYERS
A394: WERRIBEE | C394: DRUM | F394: GEARY | I394: ALLDAY | L394: RAEBURN | O394: DANIHER | R394: CHAPMAN
A395: PRAHRAN | C395: B TAYLOR | F395: DIMMATINA | I395: SINNI | L395: SHORTHOUSE | O395: HUG
A396: GOALKICKERS
A397: WERRIBEE | C397: SELLS 7 | F397: DANIHER 5 | I397: DRUM 4 | K397: RAEBURN 2 | N397: WRIGHT 2 | Q397: McMASTER 2 | T397: NORMINGTON | Y397: KNIGHT | AB397: EAMES
A398: PRAHRAN | C398: B TAYLOR 7 | F398: COLLINS 4 | I398: DIMMATINA 3 | L398: CUTLER 2 | N398: T TAYLOR 2 | Q398: CHAPPLE | S398: TAPPING | W398: POVEY
A400: SANDRINGHAM | C400: 3 | D400: 7 | E400: 25 | G400: 8 | H400: 10 | I400: 58 | K400: 15 | L400: 13 | M400: 103 | O400: 19 | P400: 15 | Q400: 129 | S400: Venue: BEACH ROAD
A401: WILLIAMSTOWN | C401: 1 | D401: 4 | E401: 10 | G401: 3 | H401: 8 | I401: 26 | K401: 14 | L401: 8 | M401: 92 | O401: 19 | P401: 12 | Q401: 126 | S401: CAMERON :CAULFIELD
A402: BEST PLAYERS
A403: SANDRINGHAM | C403: DUURSMA | F403: RYAN | I403: BONNEY | L403: CZERKASKI | O403: BAILEY | R403: J RUGOLO
A404: WILLIAMSTOWN | C404: SWAN | F404: WRIGHT | I404: McGOWAN | L404: McTAGGART | O404: SMITH
A405: GOALKICKERS
A406: SANDRINGHAM | C406: F RUGOLO 7 | F406: GILDER 3 | H406: FISCHER 2 | J406: BONNEY 2 | M406: C GARRETT 2 | P406: FOLEY | R406: DUURSMA | U406: ALLEN
A407: WILLIAMSTOWN | C407: TURCINOVICH 5 | F407: PERRY 4 | H407: McGOWAN 3 | K407: ROUND 2 | M407: PATTERSON | P407: GHAZI | R407: HOWLETT | U407: WRIGHT | X407: McTAGGART
A409: ROUND 8 | D409: 1ST JUNE | I409: WEATHER | S409: Venue: WERRIBEE
D410: 1ST QTR | H410: 2ND QTR | L410: 3RD QTR | P410: FINAL | S410: UMPIRES
A411: WERRIBEE | C411: 6 | D411: 1 | E411: 37 | G411: 11 | H411: 4 | I411: 70 | K411: 15 | L411: 11 | M411: 101 | O411: 20 | P411: 13 | Q411: 133 | S411: MORROW | Y411: LADDER | AB411: ROUND | AD411: 8
A412: PORT MELBOURNE | C412: 1 | D412: 5 | E412: 11 | G412: 3 | H412: 11 | I412: 29 | K412: 4 | L412: 13 | M412: 37 | O412: 7 | P412: 19 | Q412: 61 | S412: TURNHAM
A413: BEST PLAYERS | W413: TEAM | X413: B | Y413: W | Z413: L | AA413: D | AB413: FOR | AC413: AGST | AD413: % | AE413: PTS
A414: WERRIBEE | C414: EAMES | F414: KNIGHT | I414: FITZPATRICK | L414: MORGAN | O414: DRUM | Q414: SELLS
A415: PORT MELBOURNE | C415: CAMERON | F415: GASPARONI | I415: STROOPER | L415: HETHERTON | W415: WERRIBEE | Y415: 7 | Z415: 1 | AA415: 0 | AB415: 1130 | AC415: 892 | AD415: =(AB415/AC415)*100 -> 126.68161434977578 | AE415: =(Y415*4)+(AA415*2) -> 28
A416: GOALKICKERS | W416: PORT MELBOURNE | Y416: 7 | Z416: 1 | AA416: 0 | AB416: 1007 | AC416: 892 | AD416: =(AB416/AC416)*100 -> 112.89237668161437 | AE416: =(Y416*4)+(AA416*2) -> 28
A417: WERRIBEE | C417: SELLS 7 | F417: DRUM 4 | H417: RAEBURN 3 | K417: HARRIS | M417: DANIHER | O417: MORGAN | Q417: EAMES | W417: DANDEN0NG | X417: 1 | Y417: 5 | Z417: 2 | AA417: 0 | AB417: 1084 | AC417: 743 | AD417: =(AB417/AC417)*100 -> 145.89502018842529 | AE417: =(Y417*4)+(AA417*2) -> 20
A418: PORT MELBOURNE | C418: FOLEY 3 | F418: HARKINS | H418: LAFFY | J418: CHRIMES | L418: BOWDEN | W418: SANDRINGHAM | X418: 1 | Y418: 5 | Z418: 2 | AA418: 0 | AB418: 914 | AC418: 643 | AD418: =(AB418/AC418)*100 -> 142.14618973561431 | AE418: =(Y418*4)+(AA418*2) -> 20
D419: 2ND JUNE | I419: WEATHER | S419: Venue: WILLIAMSTOWN | W419: BOX HILL | X419: 1 | Y419: 5 | Z419: 2 | AA419: 0 | AB419: 881 | AC419: 784 | AD419: =(AB419/AC419)*100 -> 112.37244897959184 | AE419: =(Y419*4)+(AA419*2) -> 20
A420: WILLIAMSTOWN | C420: 5 | D420: 4 | E420: 34 | G420: 6 | H420: 7 | I420: 43 | K420: 9 | L420: 11 | M420: 65 | O420: 15 | P420: 15 | Q420: 105 | S420: HINTON
A421: BOX HILL | C421: 0 | D421: 3 | E421: 3 | G421: 1 | H421: 8 | I421: 14 | K421: 3 | L421: 14 | M421: 32 | O421: 5 | P421: 18 | Q421: 48 | S421: PRINCE | W421: COBURG | Y421: 4 | Z421: 4 | AA421: 0 | AB421: 886 | AC421: 969 | AD421: =(AB421/AC421)*100 -> 91.434468524251812 | AE421: =(Y421*4)+(AA421*2) -> 16
A422: BEST PLAYERS | W422: SPRINGVALE | Y422: 3 | Z422: 5 | AA422: 0 | AB422: 789 | AC422: 806 | AD422: =(AB422/AC422)*100 -> 97.890818858560792 | AE422: =(Y422*4)+(AA422*2) -> 12
A423: WILLIAMSTOWN | C423: GHAZI | E423: SWAN | H423: SMITH | K423: PASTORE | N423: McTAGGART | Q423: ACKERLEY | W423: WILLIAMSTOWN | Y423: 3 | Z423: 5 | AA423: 0 | AB423: 878 | AC423: 915 | AD423: =(AB423/AC423)*100 -> 95.95628415300547 | AE423: =(Y423*4)+(AA423*2) -> 12
A424: BOX HILL | C424: ZARAFA | E424: BYRNE | H424: DALRYMPLE | K424: JEFFREY | N424: BANFIELD | Q424: LISLE | W424: PRAHRAN | X424: 1 | Y424: 2 | Z424: 5 | AA424: 0 | AB424: 862 | AC424: 965 | AD424: =(AB424/AC424)*100 -> 89.326424870466326 | AE424: =(Y424*4)+(AA424*2) -> 8
A425: GOALKICKERS | L425: TURCINOVICH | O425: SLEVISON | Q425: WILLIAMS | W425: FRANKSTON | Y425: 2 | Z425: 6 | AA425: 0 | AB425: 849 | AC425: 967 | AD425: =(AB425/AC425)*100 -> 87.797311271975175 | AE425: =(Y425*4)+(AA425*2) -> 8
A426: WILLIAMSTOWN | C426: PATTERSON 4 | F426: RICKMAN 3 | I426: PASTORE 2 | K426: McTAGGART | N426: SMITH | P426: SWAN | W426: PRESTON | Y426: 2 | Z426: 6 | AA426: 0 | AB426: 835 | AC426: 1069 | AD426: =(AB426/AC426)*100 -> 78.110383536014965 | AE426: =(Y426*4)+(AA426*2) -> 8
A427: BOX HILL | C427: BYRNE | E427: BOX | G427: DALRYMPLE | J427: WYNN | L427: LISLE | W427: OAKLEIGH | X427: 2 | Y427: 0 | Z427: 6 | AA427: 0 | AB427: 523 | AC427: 913 | AD427: =(AB427/AC427)*100 -> 57.283680175246445 | AE427: =(Y427*4)+(AA427*2) -> 0
A429: SANDRINGHAM | C429: 3 | D429: 3 | E429: 21 | G429: 6 | H429: 8 | I429: 44 | K429: 11 | L429: 11 | M429: 77 | O429: 14 | P429: 14 | Q429: 98 | S429: Venue: FRANKSTON
A430: FRANKSTON | C430: 4 | D430: 5 | E430: 29 | G430: 5 | H430: 5 | I430: 35 | K430: 10 | L430: 10 | M430: 70 | O430: 13 | P430: 14 | Q430: 92 | S430: DAVID :VAN BEEK
A431: BEST PLAYERS
A432: SANDRINGHAM | C432: BONNEY | F432: J RUGOLO | I432: RYAN | L432: MACKENZIE | O432: CZERKASKI | R432: BAILEY
A433: FRANKSTON | C433: BROWN | F433: SOLE | I433: BINGLEY | L433: RAVEN | O433: ALLAN | R433: VANDERMEER
A434: GOALKICKERS
A435: SANDRINGHAM | C435: F RUGOLO 3 | F435: GILDER 3 | H435: WEARNE 2 | K435: BONNEY 2 | M435: CULLINANE 2 | P435: McGANNON | R435: JONES
A436: FRANKSTON | C436: ALLAN 5 | F436: STAPLETON 2 | I436: BINGLEY 2 | K436: BELL | M436: BROWN | O436: HAMILL | Q436: PEARCE
A438: DANDENONG | C438: 2 | D438: 4 | E438: 16 | G438: 7 | H438: 7 | I438: 49 | K438: 9 | L438: 13 | M438: 67 | O438: 17 | P438: 20 | Q438: 122 | S438: Venue: COBURG
A439: COBURG | C439: 3 | D439: 4 | E439: 22 | G439: 4 | H439: 5 | I439: 29 | K439: 6 | L439: 7 | M439: 43 | O439: 10 | P439: 11 | Q439: 71 | S439: CAMERON :PANOZZO
A440: BEST PLAYERS
A441: DANDENONG | C441: BOURKE | F441: WELSH | I441: KNIGHT | L441: READ | O441: GOTCH | R441: McCORMACK
A442: COBURG | C442: SHELDON | F442: LOONE | I442: T HARRINGTON
A443: GOALKICKERS
A444: DANDENONG | C444: McKENZIE 4 | F444: GOTCH 2 | H444: READ 2 | J444: BROWN 2 | L444: ELSHAUG 2 | O444: MURRAY | Q444: MILLANE | S444: WELSH | U444: KNIGHT | X444: MILLIGAN
A445: COBURG | C445: KEMPSTER 4 | F445: INGRAM 2 | I445: GRIFFITHS | K445: YOUNG | M445: SHELDON | O445: T HARRINGTON
A447: SPRINGVALE | C447: 1 | D447: 3 | E447: 9 | G447: 3 | H447: 8 | I447: 26 | K447: 8 | L447: 12 | M447: 60 | O447: 14 | P447: 13 | Q447: 97 | S447: Venue: SPRINGVALE
A448: OAKLEIGH | C448: 0 | D448: 9 | E448: 9 | G448: 0 | H448: 12 | I448: 12 | K448: 0 | L448: 17 | M448: 17 | O448: 3 | P448: 20 | Q448: 38 | S448: CARLAND :CULLEN
A449: BEST PLAYERS
A450: SPRINGVALE | C450: REECE | F450: NICOL | I450: MAYLIN | L450: KOOP | O450: PROSSER | R450: MORGAN
A451: OAKLEIGH | C451: MITCHELSON | F451: TODD | I451: BRIGGS | L451: SUTHERLAND | O451: LEMON | R451: TEMPLETON
A452: GOALKICKERS
A453: SPRINGVALE | C453: NICOL 7 | F453: MENDE 2 | I453: MEIKLE | K453: MAYLIN | M453: ROBINSON | O453: REECE | Q453: MALONI
A454: OAKLEIGH | C454: PRETTO | F454: WELSFORD | I454: SUTHERLAND
A456: PRAHRAN | C456: 3 | D456: 4 | E456: 22 | G456: 12 | H456: 7 | I456: 79 | K456: 16 | L456: 10 | M456: 106 | O456: 22 | P456: 12 | Q456: 144 | S456: Venue: PRESTON
A457: PRESTON | C457: 2 | D457: 4 | E457: 16 | G457: 3 | H457: 4 | I457: 22 | K457: 5 | L457: 8 | M457: 38 | O457: 8 | P457: 10 | Q457: 58 | S457: MURNANE :HARRIS
A458: BEST PLAYERS
A459: PRAHRAN | C459: BOLZON | F459: CHAPPLE | I459: TAYLOR | L459: HUG | O459: HYRSOULAKIS | R459: SHORTHOUSE
A460: PRESTON | C460: OWEN | F460: WALKER | I460: KING | L460: REEVES | O460: MARCON | R460: LUMICISI
A461: GOALKICKERS
A462: PRAHRAN | C462: TAYLOR 9 | F462: RADBONE 5 | I462: DIMMATINA 3 | L462: BOLZON | N462: HYRSOULAKIS | Q462: POVEY | S462: WEEDING | W462: CHAPPLE
A463: PRESTON | C463: GRAZIANO 3 | F463: SENNO | H463: JORDAN | J463: MARCON | L463: BURROWS | N463: REEVES
A465: ROUND 9 | D465: 8TH JUNE | I465: WEATHER | S465: Venue: BOX HILL
D466: 1ST QTR | H466: 2ND QTR | L466: 3RD QTR | P466: FINAL | S466: UMPIRES
A467: BOX HILL | C467: 3 | D467: 4 | E467: 22 | G467: 6 | H467: 8 | I467: 44 | K467: 9 | L467: 9 | M467: 63 | O467: 11 | P467: 16 | Q467: 82 | S467: MORROW | Y467: LADDER | AB467: ROUND | AD467: 9
A468: COBURG | C468: 1 | D468: 5 | E468: 11 | G468: 5 | H468: 6 | I468: 36 | K468: 7 | L468: 8 | M468: 50 | O468: 8 | P468: 9 | Q468: 57 | S468: VAN BEEK
A469: BEST PLAYERS | W469: TEAM | X469: B | Y469: W | Z469: L | AA469: D | AB469: FOR | AC469: AGST | AD469: % | AE469: PTS
A470: BOX HILL | C470: BANFIELD | F470: HOGAN | I470: BYRNE | L470: DIEULLIO | O470: BOURKE | Q470: ZARAFA
A471: COBURG | C471: GUMLEY | F471: LOONE | I471: SHELDON | W471: WERRIBEE | X471: 1 | Y471: 7 | Z471: 1 | AA471: 0 | AB471: 1130 | AC471: 892 | AD471: =(AB471/AC471)*100 -> 126.68161434977578 | AE471: =(Y471*4)+(AA471*2) -> 28
A472: GOALKICKERS | W472: PORT MELBOURNE | X472: 1 | Y472: 7 | Z472: 1 | AA472: 0 | AB472: 1007 | AC472: 892 | AD472: =(AB472/AC472)*100 -> 112.89237668161437 | AE472: =(Y472*4)+(AA472*2) -> 28
A473: BOX HILL | C473: BYRNE 2 | E473: ZARAFA 2 | G473: HICKS 2 | I473: HOGAN 2 | K473: BOX | M473: WYNN | O473: BUTTIFANT | W473: DANDEN0NG | X473: 1 | Y473: 6 | Z473: 2 | AA473: 0 | AB473: 1252 | AC473: 759 | AD473: =(AB473/AC473)*100 -> 164.95388669301713 | AE473: =(Y473*4)+(AA473*2) -> 24
A474: COBURG | C474: GRIFFITHS 2 | F474: YOUNG 2 | H474: INGRAM | J474: SHELDON | M474: KEMPSTER | W474: SANDRINGHAM | X474: 1 | Y474: 6 | Z474: 2 | AA474: 0 | AB474: 1006 | AC474: 734 | AD474: =(AB474/AC474)*100 -> 137.05722070844686 | AE474: =(Y474*4)+(AA474*2) -> 24
S475: Venue: DANDENONG | W475: BOX HILL | X475: 1 | Y475: 6 | Z475: 2 | AA475: 0 | AB475: 963 | AC475: 841 | AD475: =(AB475/AC475)*100 -> 114.50653983353152 | AE475: =(Y475*4)+(AA475*2) -> 24
A476: DANDENONG | C476: 4 | D476: 3 | E476: 27 | G476: 10 | H476: 9 | I476: 69 | K476: 18 | L476: 13 | M476: 121 | O476: 24 | P476: 24 | Q476: 168 | S476: SNEDDON
A477: OAKLEIGH | C477: 1 | D477: 1 | E477: 7 | G477: 1 | H477: 3 | I477: 9 | K477: 2 | L477: 4 | M477: 16 | O477: 2 | P477: 4 | Q477: 16 | S477: PRINCE | W477: COBURG | Y477: 4 | Z477: 5 | AA477: 0 | AB477: 943 | AC477: 1051 | AD477: =(AB477/AC477)*100 -> 89.72407231208372 | AE477: =(Y477*4)+(AA477*2) -> 16
A478: BEST PLAYERS | W478: SPRINGVALE | X478: 1 | Y478: 3 | Z478: 5 | AA478: 0 | AB478: 789 | AC478: 806 | AD478: =(AB478/AC478)*100 -> 97.890818858560792 | AE478: =(Y478*4)+(AA478*2) -> 12
A479: DANDENONG | C479: MILLIGAN | F479: MILLANE | I479: BOURKE | L479: BROWN | O479: McCORMACK | R479: KNIGHT | W479: WILLIAMSTOWN | X479: 1 | Y479: 3 | Z479: 5 | AA479: 0 | AB479: 878 | AC479: 915 | AD479: =(AB479/AC479)*100 -> 95.95628415300547 | AE479: =(Y479*4)+(AA479*2) -> 12
A480: OAKLEIGH | C480: OWEN | F480: HILLIARD | I480: TODD | L480: BULTE | O480: SMITH | W480: PRAHRAN | X480: 1 | Y480: 2 | Z480: 6 | AA480: 0 | AB480: 953 | AC480: 1057 | AD480: =(AB480/AC480)*100 -> 90.160832544938501 | AE480: =(Y480*4)+(AA480*2) -> 8
A481: GOALKICKERS | K481: ELSHAUG | M481: KNIGHT | O481: DOYLE | Q481: LACKO | W481: FRANKSTON | X481: 1 | Y481: 2 | Z481: 6 | AA481: 0 | AB481: 849 | AC481: 967 | AD481: =(AB481/AC481)*100 -> 87.797311271975175 | AE481: =(Y481*4)+(AA481*2) -> 8
A482: DANDENONG | C482: McKENZIE 6 | F482: MILLANE 5 | I482: BROWN 3 | K482: WELSH 2 | M482: McCORMACK 2 | P482: GOTCH | R482: WICKS | W482: PRESTON | X482: 1 | Y482: 2 | Z482: 6 | AA482: 0 | AB482: 835 | AC482: 1069 | AD482: =(AB482/AC482)*100 -> 78.110383536014965 | AE482: =(Y482*4)+(AA482*2) -> 8
A483: OAKLEIGH | C483: OWEN 2 | W483: OAKLEIGH | X483: 2 | Y483: 0 | Z483: 7 | AA483: 0 | AB483: 539 | AC483: 1081 | AD483: =(AB483/AC483)*100 -> 49.861239592969476 | AE483: =(Y483*4)+(AA483*2) -> 0
A485: SANDRINGHAM | C485: 3 | D485: 3 | E485: 21 | G485: 6 | H485: 7 | I485: 43 | K485: 9 | L485: 11 | M485: 65 | O485: 12 | P485: 20 | Q485: 92 | S485: Venue: BEACH ROAD
A486: PRAHRAN | C486: 3 | D486: 3 | E486: 21 | G486: 11 | H486: 5 | I486: 71 | K486: 14 | L486: 7 | M486: 91 | O486: 14 | P486: 7 | Q486: 91 | S486: URWIN :HINTON
A487: BEST PLAYERS
A488: SANDRINGHAM | C488: FISCHER | F488: DIPIERDOMENICO | J488: J RUGOLO | L488: C GARRETT | O488: BONNEY | R488: FOLEY
A489: PRAHRAN | C489: BOLZON | F489: SHELTON | I489: MATERA | L489: CAMERON | O489: SHORTHOUSE | R489: HUG
A490: GOALKICKERS
A491: SANDRINGHAM | C491: F RUGOLO 3 | F491: C GARRETT 3 | I491: FOLEY 2 | K491: GILDER 2 | M491: FISCHER | O491: McGANNON
A492: PRAHRAN | C492: TAYLOR 4 | F492: WEEDING 3 | I492: SHELTON 2 | L492: MATERA | N492: BOLZON | P492: CHAPPLE | R492: CUTLER | U492: DIMMATINA
A494: BYES | C494: FRANKSTON | F494: PORT MELBOURNE | I494: PRESTON | K494: WERRIBEE | M494: WILLIAMSTOWN | Q494: SPRINGVALE
A496: ROUND 10 | D496: 15TH JUNE | I496: WEATHER | S496: Venue: PORT MELBOURNE
D497: 1ST QTR | H497: 2ND QTR | L497: 3RD QTR | P497: FINAL | S497: UMPIRES
A498: PRAHRAN | C498: 2 | D498: 1 | E498: 13 | G498: 5 | H498: 6 | I498: 36 | K498: 8 | L498: 9 | M498: 57 | O498: 9 | P498: 10 | Q498: 64 | S498: CARLSON | Y498: LADDER | AB498: ROUND | AD498: 10
A499: FRANKSTON | C499: 3 | D499: 2 | E499: 20 | G499: 6 | H499: 4 | I499: 40 | K499: 6 | L499: 8 | M499: 44 | O499: 7 | P499: 11 | Q499: 53 | S499: McDONALD
A500: BEST PLAYERS | W500: TEAM | X500: B | Y500: W | Z500: L | AA500: D | AB500: FOR | AC500: AGST | AD500: % | AE500: PTS
A501: PRAHRAN | C501: HYRSOULAKIS | F501: POVEY | I501: BRINKOTTER | L501: CHAPMAN | O501: SHORTHOUSE | R501: BOLZON
A502: FRANKSTON | C502: DENEREAZ | F502: MACE | I502: GAHAN | L502: RAVEN | O502: HAMILL | W502: WERRIBEE | X502: 1 | Y502: 8 | Z502: 1 | AA502: 0 | AB502: 1263 | AC502: 979 | AD502: =(AB502/AC502)*100 -> 129.00919305413686 | AE502: =(Y502*4)+(AA502*2) -> 32
A503: GOALKICKERS | W503: DANDEN0NG | X503: 1 | Y503: 7 | Z503: 2 | AA503: 0 | AB503: 1372 | AC503: 825 | AD503: =(AB503/AC503)*100 -> 166.30303030303031 | AE503: =(Y503*4)+(AA503*2) -> 28
A504: PRAHRAN | C504: TAYLOR 3 | F504: COLLINS 2 | I504: CHAPMAN | L504: HYRSOULAKIS | O504: CHAPPLE | Q504: MARCOU | W504: PORT MELBOURNE | X504: 1 | Y504: 7 | Z504: 2 | AA504: 0 | AB504: 1073 | AC504: 1012 | AD504: =(AB504/AC504)*100 -> 106.02766798418972 | AE504: =(Y504*4)+(AA504*2) -> 28
A505: FRANKSTON | C505: GAHAN 2 | F505: PAYNTER 2 | I505: ALLAN | K505: KEANE | M505: POLLOCK | W505: SANDRINGHAM | X505: 1 | Y505: 6 | Z505: 3 | AA505: 0 | AB505: 1093 | AC505: 867 | AD505: =(AB505/AC505)*100 -> 126.06689734717416 | AE505: =(Y505*4)+(AA505*2) -> 24
D506: 16TH JUNE | I506: WEATHER | S506: Venue: SPRINGVALE | W506: BOX HILL | X506: 2 | Y506: 6 | Z506: 2 | AA506: 0 | AB506: 963 | AC506: 841 | AD506: =(AB506/AC506)*100 -> 114.50653983353152 | AE506: =(Y506*4)+(AA506*2) -> 24
A507: SPRINGVALE | C507: 4 | D507: 3 | E507: 27 | G507: 11 | H507: 3 | I507: 69 | K507: 15 | L507: 8 | M507: 98 | O507: 19 | P507: 12 | Q507: 126 | S507: CALLAGHAN
A508: PRESTON | C508: 2 | D508: 4 | E508: 16 | G508: 4 | H508: 6 | I508: 30 | K508: 6 | L508: 8 | M508: 44 | O508: 7 | P508: 13 | Q508: 55 | S508: LUCKMAN | W508: SPRINGVALE | X508: 1 | Y508: 4 | Z508: 5 | AA508: 0 | AB508: 915 | AC508: 861 | AD508: =(AB508/AC508)*100 -> 106.27177700348432 | AE508: =(Y508*4)+(AA508*2) -> 16
A509: BEST PLAYERS | W509: WILLIAMSTOWN | X509: 1 | Y509: 4 | Z509: 5 | AA509: 0 | AB509: 1019 | AC509: 959 | AD509: =(AB509/AC509)*100 -> 106.25651720542231 | AE509: =(Y509*4)+(AA509*2) -> 16
A510: SPRINGVALE | C510: MIEKLE | F510: NICOL | I510: MORGAN | L510: PEACOCK | O510: ROBINSON | R510: PROSSER | W510: COBURG | X510: 1 | Y510: 4 | Z510: 5 | AA510: 0 | AB510: 943 | AC510: 1051 | AD510: =(AB510/AC510)*100 -> 89.72407231208372 | AE510: =(Y510*4)+(AA510*2) -> 16
A511: PRESTON | C511: KERR | F511: LUMICISI | I511: BURROWS | L511: PERCY | W511: PRAHRAN | X511: 1 | Y511: 3 | Z511: 6 | AA511: 0 | AB511: 1017 | AC511: 1110 | AD511: =(AB511/AC511)*100 -> 91.621621621621614 | AE511: =(Y511*4)+(AA511*2) -> 12
A512: GOALKICKERS | O512: MORGAN | Q512: PROSSER | W512: FRANKSTON | X512: 1 | Y512: 2 | Z512: 7 | AA512: 0 | AB512: 902 | AC512: 1031 | AD512: =(AB512/AC512)*100 -> 87.487875848690592 | AE512: =(Y512*4)+(AA512*2) -> 8
A513: SPRINGVALE | C513: NICOL 6 | F513: ROBINSON 4 | I513: DUDLEY 2 | K513: KOOP 2 | M513: WARNER | O513: MIEKLE | Q513: MENDE | W513: PRESTON | X513: 1 | Y513: 2 | Z513: 7 | AA513: 0 | AB513: 890 | AC513: 1195 | AD513: =(AB513/AC513)*100 -> 74.476987447698733 | AE513: =(Y513*4)+(AA513*2) -> 8
A514: PRESTON | C514: POURSANIDES 2 | F514: CARDAMONE 2 | I514: KING | K514: LUMICISI | M514: OWEN | W514: OAKLEIGH | X514: 2 | Y514: 0 | Z514: 8 | AA514: 0 | AB514: 583 | AC514: 1222 | AD514: =(AB514/AC514)*100 -> 47.708674304418984 | AE514: =(Y514*4)+(AA514*2) -> 0
A516: DANDENONG | C516: 3 | D516: 0 | E516: 18 | G516: 12 | H516: 1 | I516: 73 | K516: 13 | L516: 4 | M516: 82 | O516: 18 | P516: 12 | Q516: 120 | S516: Venue: DANDENONG
A517: PORT MELBOURNE | C517: 2 | D517: 4 | E517: 16 | G517: 2 | H517: 4 | I517: 16 | K517: 8 | L517: 10 | M517: 58 | O517: 9 | P517: 12 | Q517: 66 | S517: HARRIS :URWIN
A518: BEST PLAYERS
A519: DANDENONG | C519: FRANGALAS | F519: KNIGHT | I519: ELSHAUG | L519: MCCORMACK | O519: READ | Q519: MILLIGAN
A520: PORT MELBOURNE | C520: KEIGHRAN | F520: FOLEY | I520: STROOPER | L520: CLOHESSY | O520: CHRIMES
A521: GOALKICKERS
A522: DANDENONG | C522: READ 4 | E522: McKENZIE 3 | H522: WICKS 2 | J522: GOTCH 2 | L522: DOYLE | N522: ELSHAUG | P522: KNIGHT | R522: LACKO | T522: McCONCHIE | X522: MILLANE | AA522: WELSH
A523: PORT MELBOURNE | C523: ASANI 2 | E523: DONOGHUE 2 | H523: PAUL | J523: YORGEY | L523: KENNEDY | N523: JAMES | P523: KEIGHRAN
A525: WILLIAMSTOWN | C525: 3 | D525: 6 | E525: 24 | G525: 9 | H525: 11 | I525: 65 | K525: 15 | L525: 17 | M525: 107 | O525: 20 | P525: 21 | Q525: 141 | S525: Venue: WILLIAMSTOWN
A526: OAKLEIGH | C526: 3 | D526: 2 | E526: 20 | G526: 3 | H526: 5 | I526: 23 | K526: 5 | L526: 6 | M526: 36 | O526: 6 | P526: 8 | Q526: 44 | S526: KEATING :MURNANE
A527: BEST PLAYERS
A528: WILLIAMSTOWN | C528: SWAN | F528: SMITH | I528: TURCINOVICH | L528: MITCHELL | O528: ACKERLEY | R528: KENNY
A529: OAKLEIGH | C529: CUNNINGHAM | F529: WELSFORD | I529: BULTE | L529: GARBUIO | O529: DUNLOP
A530: GOALKICKERS
A531: WILLIAMSTOWN | C531: TURCINOVICH 10 | G531: HOWLETT 3 | J531: SMITH 2 | L531: GHAZI 2 | N531: WILLIAMS | Q531: GOULD | S531: SWAN
A532: OAKLEIGH | C532: PRETTO 3 | F532: OWEN | H532: MELLODY | J532: SMITH
A534: WERRIBEE | C534: 7 | D534: 4 | E534: 46 | G534: 10 | H534: 6 | I534: 66 | K534: 14 | L534: 9 | M534: 93 | O534: 20 | P534: 13 | Q534: 133 | S534: Venue: WERRIBEE
A535: SANDRINGHAM | C535: 3 | D535: 2 | E535: 20 | G535: 7 | H535: 8 | I535: 50 | K535: 9 | L535: 13 | M535: 67 | O535: 12 | P535: 15 | Q535: 87 | S535: ANTHONY :CULLEN
A536: BEST PLAYERS
A537: WERRIBEE | C537: EAMES | F537: DRUM | J537: ALLDAY | M537: FITZPATRICK | P537: KNIGHT | R537: RAEBURN
A538: SANDRINGHAM | C538: CZERKASKI | F538: DIPIERDOMENICO | J538: C GARRETT | M538: WEARNE | P538: FOLEY | R538: BONNEY
A539: GOALKICKERS
A540: WERRIBEE | C540: DRUM 4 | E540: McPHERSON 4 | H540: DANIHER 3 | J540: RAEBURN 2 | M540: NORMINGTON 2 | P540: EAMES 2 | R540: SELLS | T540: KNIGHT | X540: BUTTON
A541: SANDRINGHAM | C541: FOLEY 3 | E541: C GARRETT 2 | H541: S JONES 2 | K541: O'CONNOR | M541: F RUGOLO | O541: WEARNE | Q541: DIPIERDOMENICO
A543: BYES | C543: BOX HILL | F543: COBURG
A545: ROUND 11 | D545: 22ND JUNE | I545: WEATHER | S545: Venue: PORT MELBOURNE
D546: 1ST QTR | H546: 2ND QTR | L546: 3RD QTR | P546: FINAL | S546: UMPIRES
A547: WERRIBEE | C547: 1 | D547: 5 | E547: 11 | G547: 7 | H547: 8 | I547: 50 | K547: 12 | L547: 14 | M547: 86 | O547: 16 | P547: 17 | Q547: 113 | S547: MITCHELL | Y547: LADDER | AB547: ROUND | AD547: 11
A548: DANDENONG | C548: 4 | D548: 8 | E548: 32 | G548: 4 | H548: 12 | I548: 36 | K548: 6 | L548: 17 | M548: 53 | O548: 12 | P548: 23 | Q548: 95 | S548: McDONALD
A549: BEST PLAYERS | W549: TEAM | X549: B | Y549: W | Z549: L | AA549: D | AB549: FOR | AC549: AGST | AD549: % | AE549: PTS
A550: WERRIBEE
A551: DANDENONG | W551: WERRIBEE | X551: 1 | Y551: 9 | Z551: 1 | AA551: 0 | AB551: 1376 | AC551: 1074 | AD551: =(AB551/AC551)*100 -> 128.11918063314712 | AE551: =(Y551*4)+(AA551*2) -> 36
A552: GOALKICKERS | W552: PORT MELBOURNE | X552: 1 | Y552: 8 | Z552: 2 | AA552: 0 | AB552: 1141 | AC552: 1062 | AD552: =(AB552/AC552)*100 -> 107.43879472693033 | AE552: =(Y552*4)+(AA552*2) -> 32
A553: WERRIBEE | W553: DANDEN0NG | X553: 1 | Y553: 7 | Z553: 3 | AA553: 0 | AB553: 1467 | AC553: 938 | AD553: =(AB553/AC553)*100 -> 156.39658848614073 | AE553: =(Y553*4)+(AA553*2) -> 28
A554: DANDENONG | W554: SANDRINGHAM | X554: 1 | Y554: 7 | Z554: 3 | AA554: 0 | AB554: 1143 | AC554: 907 | AD554: =(AB554/AC554)*100 -> 126.01984564498345 | AE554: =(Y554*4)+(AA554*2) -> 28
D555: 23RD JUNE | S555: Venue: OAKLEIGH | W555: BOX HILL | X555: 2 | Y555: 6 | Z555: 3 | AA555: 0 | AB555: 1013 | AC555: 909 | AD555: =(AB555/AC555)*100 -> 111.44114411441144 | AE555: =(Y555*4)+(AA555*2) -> 24
A556: FRANKSTON | C556: 5 | D556: 8 | E556: 38 | G556: 7 | H556: 16 | I556: 58 | K556: 9 | L556: 22 | M556: 76 | O556: 12 | P556: 23 | Q556: 95 | S556: DAVID
A557: OAKLEIGH | C557: 1 | D557: 3 | E557: 9 | G557: 4 | H557: 6 | I557: 30 | K557: 5 | L557: 9 | M557: 39 | O557: 8 | P557: 10 | Q557: 58 | S557: VAN BEEK | W557: WILLIAMSTOWN | X557: 1 | Y557: 5 | Z557: 5 | AA557: 0 | AB557: 1074 | AC557: 985 | AD557: =(AB557/AC557)*100 -> 109.03553299492386 | AE557: =(Y557*4)+(AA557*2) -> 20
A558: BEST PLAYERS | W558: COBURG | X558: 1 | Y558: 5 | Z558: 5 | AA558: 0 | AB558: 998 | AC558: 1081 | AD558: =(AB558/AC558)*100 -> 92.321924144310813 | AE558: =(Y558*4)+(AA558*2) -> 20
A559: FRANKSTON | W559: SPRINGVALE | X559: 1 | Y559: 4 | Z559: 6 | AA559: 0 | AB559: 955 | AC559: 911 | AD559: =(AB559/AC559)*100 -> 104.82985729967069 | AE559: =(Y559*4)+(AA559*2) -> 16
A560: OAKLEIGH | W560: FRANKSTON | X560: 1 | Y560: 3 | Z560: 7 | AA560: 0 | AB560: 997 | AC560: 1089 | AD560: =(AB560/AC560)*100 -> 91.55188246097336 | AE560: =(Y560*4)+(AA560*2) -> 12
A561: GOALKICKERS | W561: PRAHRAN | X561: 1 | Y561: 3 | Z561: 7 | AA561: 0 | AB561: 1047 | AC561: 1165 | AD561: =(AB561/AC561)*100 -> 89.871244635193136 | AE561: =(Y561*4)+(AA561*2) -> 12
A562: FRANKSTON | W562: PRESTON | X562: 1 | Y562: 2 | Z562: 8 | AA562: 0 | AB562: 916 | AC562: 1250 | AD562: =(AB562/AC562)*100 -> 73.28 | AE562: =(Y562*4)+(AA562*2) -> 8
A563: OAKLEIGH | W563: OAKLEIGH | X563: 2 | Y563: 0 | Z563: 9 | AA563: 0 | AB563: 641 | AC563: 1317 | AD563: =(AB563/AC563)*100 -> 48.671222475322701 | AE563: =(Y563*4)+(AA563*2) -> 0
A565: COBURG | C565: 3 | D565: 1 | E565: 19 | G565: 4 | H565: 4 | I565: 28 | K565: 6 | L565: 10 | M565: 46 | O565: 7 | P565: 13 | Q565: 55 | S565: Venue: COBURG
A566: PRAHRAN | C566: 3 | D566: 2 | E566: 20 | G566: 3 | H566: 5 | I566: 23 | K566: 3 | L566: 5 | M566: 23 | O566: 4 | P566: 6 | Q566: 30 | S566: KEATING :LUCKMAN
A567: BEST PLAYERS
A568: COBURG
A569: PRAHRAN
A570: GOALKICKERS
A571: COBURG
A572: PRAHRAN
A574: WILLIAMSTOWN | C574: 4 | D574: 1 | E574: 25 | G574: 5 | H574: 1 | I574: 31 | K574: 6 | L574: 4 | M574: 40 | O574: 8 | P574: 7 | Q574: 55 | S574: Venue: PRESTON
A575: PRESTON | C575: 1 | D575: 1 | E575: 7 | G575: 1 | H575: 5 | I575: 11 | K575: 2 | L575: 6 | M575: 18 | O575: 3 | P575: 8 | Q575: 26 | S575: ANTHONY :SNEDDON
A576: BEST PLAYERS
A577: WILLIAMSTOWN
A578: PRESTON
A579: GOALKICKERS
A580: WILLIAMSTOWN
A581: PRESTON
A583: PORT MELBOURNE | C583: 6 | D583: 1 | E583: 37 | G583: 9 | H583: 4 | I583: 58 | K583: 10 | L583: 6 | M583: 66 | O583: 10 | P583: 8 | Q583: 68 | S583: Venue: PORT MELBOURNE
A584: BOX HILL | C584: 1 | D584: 2 | E584: 8 | G584: 6 | H584: 5 | I584: 41 | K584: 7 | L584: 7 | M584: 49 | O584: 7 | P584: 8 | Q584: 50 | S584: CAREY :PRINCE
A585: BEST PLAYERS
A586: PORT MELBOURNE
A587: BOX HILL
A588: GOALKICKERS
A589: PORT MELBOURNE
A590: BOX HILL
A592: SANDRINGHAM | C592: 2 | D592: 3 | E592: 15 | G592: 4 | H592: 5 | I592: 29 | K592: 4 | L592: 8 | M592: 32 | O592: 7 | P592: 8 | Q592: 50 | S592: Venue: SPRINGVALE
A593: SPRINGVALE | C593: 1 | D593: 0 | E593: 6 | G593: 3 | H593: 1 | I593: 19 | K593: 6 | L593: 1 | M593: 37 | O593: 6 | P593: 4 | Q593: 40 | S593: MORROW :CARLSON
A594: BEST PLAYERS
A595: SANDRINGHAM
A596: SPRINGVALE
A597: GOALKICKERS
A598: SANDRINGHAM
A599: SPRINGVALE
A601: ROUND 12 | D601: 29TH JUNE | I601: WEATHER | S601: Venue: TOORAK PARK
D602: 1ST QTR | H602: 2ND QTR | L602: 3RD QTR | P602: FINAL | S602: UMPIRES
A603: PRAHRAN | C603: 4 | D603: 2 | E603: 26 | G603: 5 | H603: 5 | I603: 35 | K603: 6 | L603: 6 | M603: 42 | O603: 9 | P603: 11 | Q603: 65 | S603: UMPIRES | Y603: LADDER | AB603: ROUND | AD603: 12
A604: WILLIAMSTOWN | C604: 4 | D604: 2 | E604: 26 | G604: 4 | H604: 7 | I604: 31 | K604: 8 | L604: 10 | M604: 58 | O604: 9 | P604: 11 | Q604: 65
A605: BEST PLAYERS | W605: TEAM | X605: B | Y605: W | Z605: L | AA605: D | AB605: FOR | AC605: AGST | AD605: % | AE605: PTS
A606: PRAHRAN | C606: BOLZON | F606: POVEY | I606: CAMERON | L606: DIMMATINA | O606: LANGAN | Q606: MORRISSEY
A607: WILLIAMSTOWN | C607: ACKERLEY | F607: LLOYD | I607: SMITH | L607: McTAGGART | O607: SWAN | Q607: KENNY | W607: WERRIBEE | X607: 1 | Y607: 10 | Z607: 1 | AA607: 0 | AB607: 1486 | AC607: 1144 | AD607: =(AB607/AC607)*100 -> 129.89510489510491 | AE607: =(Y607*4)+(AA607*2) -> 40
A608: GOALKICKERS | W608: PORT MELBOURNE | X608: 1 | Y608: 9 | Z608: 2 | AA608: 0 | AB608: 1241 | AC608: 1146 | AD608: =(AB608/AC608)*100 -> 108.28970331588133 | AE608: =(Y608*4)+(AA608*2) -> 36
A609: PRAHRAN | C609: TAYLOR 2 | F609: DIMMATINA 2 | I609: MATERA | K609: SHELTON | M609: BRINKOTTER | P609: MARCOU | R609: BOLZON | W609: DANDEN0NG | X609: 1 | Y609: 7 | Z609: 4 | AA609: 0 | AB609: 1565 | AC609: 1038 | AD609: =(AB609/AC609)*100 -> 150.77071290944124 | AE609: =(Y609*4)+(AA609*2) -> 28
A610: WILLIAMSTOWN | C610: PATTERSON 2 | F610: AZIZ 2 | H610: RICKMAN 2 | K610: McTAGGART | N610: GHAZI | P610: WILLIAMS | W610: SANDRINGHAM | X610: 2 | Y610: 7 | Z610: 3 | AA610: 0 | AB610: 1143 | AC610: 907 | AD610: =(AB610/AC610)*100 -> 126.01984564498345 | AE610: =(Y610*4)+(AA610*2) -> 28
D611: 30TH JUNE | I611: WEATHER | S611: Venue: BOX HILL | W611: BOX HILL | X611: 2 | Y611: 7 | Z611: 3 | AA611: 0 | AB611: 1113 | AC611: 1007 | AD611: =(AB611/AC611)*100 -> 110.5263157894737 | AE611: =(Y611*4)+(AA611*2) -> 28
A612: BOX HILL | C612: 5 | D612: 3 | E612: 33 | G612: 8 | H612: 6 | I612: 54 | K612: 10 | L612: 9 | M612: 69 | O612: 15 | P612: 10 | Q612: 100
A613: DANDENONG | C613: 5 | D613: 2 | E613: 32 | G613: 7 | H613: 3 | I613: 45 | K613: 11 | L613: 8 | M613: 74 | O613: 14 | P613: 14 | Q613: 98 | W613: WILLIAMSTOWN | X613: 1 | Y613: 5 | Z613: 5 | AA613: 1 | AB613: 1139 | AC613: 1050 | AD613: =(AB613/AC613)*100 -> 108.47619047619048 | AE613: =(Y613*4)+(AA613*2) -> 22
A614: BEST PLAYERS | W614: COBURG | X614: 2 | Y614: 5 | Z614: 5 | AA614: 0 | AB614: 998 | AC614: 1081 | AD614: =(AB614/AC614)*100 -> 92.321924144310813 | AE614: =(Y614*4)+(AA614*2) -> 20
A615: BOX HILL | C615: KENNAWAY | F615: PENNY | I615: BYRNE | L615: ZARAFA | O615: GROSS | Q615: BANFIELD | W615: SPRINGVALE | X615: 1 | Y615: 4 | Z615: 7 | AA615: 0 | AB615: 1025 | AC615: 1021 | AD615: =(AB615/AC615)*100 -> 100.39177277179236 | AE615: =(Y615*4)+(AA615*2) -> 16
A616: DANDENONG | C616: MILLIGAN | F616: KNIGHT | I616: McCORMACK | L616: MOREY | O616: BOURKE | Q616: ELSHAUG | W616: PRAHRAN | X616: 1 | Y616: 3 | Z616: 7 | AA616: 1 | AB616: 1112 | AC616: 1230 | AD616: =(AB616/AC616)*100 -> 90.40650406504065 | AE616: =(Y616*4)+(AA616*2) -> 14
A617: GOALKICKERS | O617: BUTTIFANT | W617: FRANKSTON | X617: 2 | Y617: 3 | Z617: 7 | AA617: 0 | AB617: 997 | AC617: 1089 | AD617: =(AB617/AC617)*100 -> 91.55188246097336 | AE617: =(Y617*4)+(AA617*2) -> 12
A618: BOX HILL | C618: HAMILTON 3 | F618: ZARAFA 3 | I618: BYRNE 3 | K618: HICKS 2 | M618: KENNAWAY | P618: BANFIELD | R618: DIEULLIO | W618: PRESTON | X618: 2 | Y618: 2 | Z618: 8 | AA618: 0 | AB618: 916 | AC618: 1250 | AD618: =(AB618/AC618)*100 -> 73.28 | AE618: =(Y618*4)+(AA618*2) -> 8
A619: DANDENONG | C619: WELSH 5 | F619: MILLANE 3 | I619: BOURKE | K619: BROWN | M619: ELSHAUG | O619: KNIGHT | Q619: MOREY | S619: READ | W619: OAKLEIGH | X619: 2 | Y619: 0 | Z619: 10 | AA619: 0 | AB619: 725 | AC619: 1417 | AD619: =(AB619/AC619)*100 -> 51.164431898376847 | AE619: =(Y619*4)+(AA619*2) -> 0
A621: PORT MELBOURNE | C621: 2 | D621: 8 | E621: 20 | G621: 5 | H621: 15 | I621: 45 | K621: 12 | L621: 17 | M621: 89 | O621: 13 | P621: 24 | Q621: 102 | S621: Venue: PORT MELBOURNE
A622: OAKLEIGH | C622: 0 | D622: 3 | E622: 3 | G622: 4 | H622: 4 | I622: 28 | K622: 8 | L622: 8 | M622: 56 | O622: 12 | P622: 12 | Q622: 84
A623: BEST PLAYERS
A624: PORT MELBOURNE | C624: JENNINGS | F624: STROOPER | I624: BARLOW | L624: CLOHESSY | O624: PAUL
A625: OAKLEIGH | C625: MELLODY | F625: OWEN | I625: ATHERTON | L625: MYNOTT | O625: ROURKE | R625: PANOZZO
A626: GOALKICKERS
A627: PORT MELBOURNE | C627: PAUL 7 | F627: JAMES 2 | H627: ASANI | J627: BOWDEN | L627: CHRIMES | N627: CLOHESSY
A628: OAKLEIGH | C628: MYNOTT 5 | F628: PRETTO 2 | I628: MELLODY | K628: TODD | M628: GARBUIO | O628: PAYNE | Q628: HICKEY
A630: WERRIBEE | C630: 5 | D630: 4 | E630: 34 | G630: 8 | H630: 9 | I630: 57 | K630: 11 | L630: 14 | M630: 80 | O630: 15 | P630: 20 | Q630: 110 | S630: Venue: WERRIBEE
A631: SPRINGVALE | C631: 4 | D631: 2 | E631: 26 | G631: 7 | H631: 5 | I631: 47 | K631: 10 | L631: 7 | M631: 67 | O631: 10 | P631: 10 | Q631: 70
A632: BEST PLAYERS
A633: WERRIBEE | C633: NORMINGTON | F633: MORGAN | I633: SELLS | L633: GEARY | O633: EAMES | R633: McMASTER
A634: SPRINGVALE | C634: BICOL | F634: MAYLIN | I634: MORGAN | L634: CLARK | O634: SMIT | R634: McDONOUGH
A635: GOALKICKERS
A636: WERRIBEE | C636: SELLS 6 | F636: RAEBURN 4 | I636: KNIGHT 2 | K636: O'KEEFE | M636: LESIPUTTY | P636: MCMASTER
A637: SPRINGVALE | C637: NICOL 5 | F637: PROSSER 2 | I637: MAYLIN | K637: JEFFS | M637: ROBINSON
A639: BYES | C639: COBURG | F639: FRANKSTON | J639: PRESTON | M639: SANDRINGHAM
A641: ROUND 13 | D641: 6TH JULY | I641: WEATHER | S641: Venue: BEACH ROAD
D642: 1ST QTR | H642: 2ND QTR | L642: 3RD QTR | P642: FINAL | S642: UMPIRES
A643: SANDRINGHAM | C643: 4 | D643: 2 | E643: 26 | G643: 11 | H643: 7 | I643: 73 | K643: 21 | L643: 12 | M643: 138 | O643: 27 | P643: 14 | Q643: 176 | S643: CAREY | Y643: LADDER | AB643: ROUND | AD643: 13
A644: PRESTON | C644: 1 | D644: 4 | E644: 10 | G644: 3 | H644: 7 | I644: 25 | K644: 7 | L644: 11 | M644: 53 | O644: 8 | P644: 12 | Q644: 60 | S644: HARRIS
A645: BEST PLAYERS | W645: TEAM | X645: B | Y645: W | Z645: L | AA645: D | AB645: FOR | AC645: AGST | AD645: % | AE645: PTS
A646: SANDRINGHAM | C646: RYAN | F646: J RUGOLO | I646: F RUGOLO | L646: ALLEN | N646: McGANNON | Q646: BONNEY
A647: PRESTON | C647: CARDAMONE | F647: BROWN | I647: KERR | L647: KING | N647: VITACCA | Q647: WALKER | W647: WERRIBEE | X647: 2 | Y647: 10 | Z647: 1 | AA647: 0 | AB647: 1486 | AC647: 1144 | AD647: =(AB647/AC647)*100 -> 129.89510489510491 | AE647: =(Y647*4)+(AA647*2) -> 40
A648: GOALKICKERS | O648: KELLAWAY | Q648: BAILEY | W648: PORT MELBOURNE | X648: 2 | Y648: 9 | Z648: 2 | AA648: 0 | AB648: 1241 | AC648: 1146 | AD648: =(AB648/AC648)*100 -> 108.28970331588133 | AE648: =(Y648*4)+(AA648*2) -> 36
A649: SANDRINGHAM | C649: F RUGOLO 13 | F649: O'CONNOR 3 | I649: EDMUNDS 3 | L649: GARRETT 2 | N649: OGG 2 | P649: FOLEY | R649: ALLEN | W649: SANDRINGHAM | X649: 2 | Y649: 8 | Z649: 3 | AA649: 0 | AB649: 1319 | AC649: 967 | AD649: =(AB649/AC649)*100 -> 136.40124095139606 | AE649: =(Y649*4)+(AA649*2) -> 32
A650: PRESTON | C650: CARDAMONE 2 | F650: NICOLAOU 2 | I650: PERRY | K650: OWEN | M650: GRAZIANO | P650: DOBBS | W650: BOX HILL | X650: 2 | Y650: 8 | Z650: 3 | AA650: 0 | AB650: 1201 | AC650: 1094 | AD650: =(AB650/AC650)*100 -> 109.78062157221207 | AE650: =(Y650*4)+(AA650*2) -> 32
D651: 7TH JULY | I651: WEATHER | S651: Venue: OAKLEIGH | W651: DANDEN0NG | X651: 2 | Y651: 7 | Z651: 4 | AA651: 0 | AB651: 1565 | AC651: 1038 | AD651: =(AB651/AC651)*100 -> 150.77071290944124 | AE651: =(Y651*4)+(AA651*2) -> 28
A652: OAKLEIGH | C652: 4 | D652: 2 | E652: 26 | G652: 8 | H652: 5 | I652: 53 | K652: 12 | L652: 9 | M652: 81 | O652: 13 | P652: 14 | Q652: 92 | S652: SIGMONT
A653: COBURG | C653: 2 | D653: 2 | E653: 14 | G653: 8 | H653: 5 | I653: 53 | K653: 9 | L653: 9 | M653: 63 | O653: 10 | P653: 12 | Q653: 72 | S653: RICH | W653: WILLIAMSTOWN | X653: 2 | Y653: 5 | Z653: 5 | AA653: 1 | AB653: 1139 | AC653: 1050 | AD653: =(AB653/AC653)*100 -> 108.47619047619048 | AE653: =(Y653*4)+(AA653*2) -> 22
A654: BEST PLAYERS | W654: COBURG | X654: 2 | Y654: 5 | Z654: 6 | AA654: 0 | AB654: 1070 | AC654: 1173 | AD654: =(AB654/AC654)*100 -> 91.219096334185849 | AE654: =(Y654*4)+(AA654*2) -> 20
A655: OAKLEIGH | C655: HAWKER | F655: MYNOTT | I655: MELLODY | L655: PRETTO | O655: GARBUIO | Q655: OWEN | W655: SPRINGVALE | X655: 2 | Y655: 4 | Z655: 7 | AA655: 0 | AB655: 1025 | AC655: 1021 | AD655: =(AB655/AC655)*100 -> 100.39177277179236 | AE655: =(Y655*4)+(AA655*2) -> 16
A656: COBURG | C656: SALVADORE | F656: GUMLEY | I656: GRIFFITHS | L656: WILLIAMS | W656: PRAHRAN | X656: 2 | Y656: 3 | Z656: 7 | AA656: 1 | AB656: 1112 | AC656: 1230 | AD656: =(AB656/AC656)*100 -> 90.40650406504065 | AE656: =(Y656*4)+(AA656*2) -> 14
A657: GOALKICKERS | W657: FRANKSTON | X657: 2 | Y657: 3 | Z657: 8 | AA657: 0 | AB657: 1084 | AC657: 1177 | AD657: =(AB657/AC657)*100 -> 92.098555649957518 | AE657: =(Y657*4)+(AA657*2) -> 12
A658: OAKLEIGH | C658: PRETTO 6 | F658: MYNOTT 5 | I658: OWEN | K658: GARBUIO | W658: PRESTON | X658: 2 | Y658: 2 | Z658: 9 | AA658: 0 | AB658: 976 | AC658: 1426 | AD658: =(AB658/AC658)*100 -> 68.443197755960725 | AE658: =(Y658*4)+(AA658*2) -> 8
A659: COBURG | C659: GRIFFITHS 5 | F659: BUTTS | H659: INGRAM | J659: LOONE | L659: WILLIAMS | N659: SULLIVAN | W659: OAKLEIGH | X659: 2 | Y659: 1 | Z659: 10 | AA659: 0 | AB659: 817 | AC659: 1489 | AD659: =(AB659/AC659)*100 -> 54.86903962390867 | AE659: =(Y659*4)+(AA659*2) -> 4
A661: BOX HILL | C661: 0 | D661: 2 | E661: 2 | G661: 6 | H661: 5 | I661: 41 | K661: 12 | L661: 7 | M661: 79 | O661: 13 | P661: 10 | Q661: 88 | S661: Venue: FRANKSTON
A662: FRANKSTON | C662: 1 | D662: 6 | E662: 12 | G662: 2 | H662: 8 | I662: 20 | K662: 6 | L662: 10 | M662: 46 | O662: 12 | P662: 15 | Q662: 87 | S662: SNEDDON :MORROW
A663: BEST PLAYERS
A664: BOX HILL | C664: DALRYMPLE | F664: BANFIELD | I664: ZARAFA | L664: PENNY | O664: O'NEILL
A665: FRANKSTON | C665: T HAMILL | F665: MACE | I665: DENEREAZ | L665: RAVEN | O665: S HAMILL | R665: GAHAN
A666: GOALKICKERS
A667: BOX HILL | C667: HICKS 3 | F667: DALRYMPLE 3 | I667: DE BOER | K667: BOURKE | M667: HAMILTON | P667: BUTTIFANT | R667: BOX | T667: BYRNE | W667: LISLE
A668: FRANKSTON | C668: SOLE 3 | F668: BROWN 2 | I668: GAHAN 2 | K668: ALLAN | M668: BELL | O668: MACE | Q668: MARTIN | S668: BINGLEY
A670: BYES | C670: DANDENONG | F670: PORT MELBOURNE | I670: PRAHRAN | K670: SPRINGVALE | N670: WERRIBEE | Q670: WILLIAMSTOWN
A672: ROUND 14 | D672: 13TH JULY | I672: WEATHER | S672: Venue: BEACH ROAD
D673: 1ST QTR | H673: 2ND QTR | L673: 3RD QTR | P673: FINAL | S673: UMPIRES
A674: SPRINGVALE | C674: 6 | D674: 1 | E674: 37 | G674: 9 | H674: 5 | I674: 59 | K674: 10 | L674: 9 | M674: 69 | O674: 13 | P674: 12 | Q674: 90 | S674: RICH | Y674: LADDER | AB674: ROUND | AD674: 14
A675: WILLIAMSTOWN | C675: 1 | D675: 3 | E675: 9 | G675: 2 | H675: 4 | I675: 16 | K675: 2 | L675: 9 | M675: 21 | O675: 5 | P675: 10 | Q675: 40 | S675: ALLEN
A676: BEST PLAYERS | W676: TEAM | X676: B | Y676: W | Z676: L | AA676: D | AB676: FOR | AC676: AGST | AD676: % | AE676: PTS
A677: SPRINGVALE | C677: CLARK | F677: MAYLIN | I677: JEFFS | L677: MORGAN | O677: CAPLES | Q677: KANNOURAKIS
A678: WILLIAMSTOWN | C678: ACKERLEY | F678: MITCHELL | I678: McTAGGART | L678: GHAZI | O678: PERRY | Q678: HEIGHT | W678: WERRIBEE | X678: 2 | Y678: 10 | Z678: 2 | AA678: 0 | AB678: 1553 | AC678: 1231 | AD678: =(AB678/AC678)*100 -> 126.15759545085297 | AE678: =(Y678*4)+(AA678*2) -> 40
A679: GOALKICKERS | C679: -1 | O679: CLARK | W679: BOX HILL | X679: 2 | Y679: 9 | Z679: 3 | AA679: 0 | AB679: 1288 | AC679: 1161 | AD679: =(AB679/AC679)*100 -> 110.93884582256675 | AE679: =(Y679*4)+(AA679*2) -> 36
A680: SPRINGVALE | C680: NICOL 2 | E680: KOOP 2 | G680: ROBINSON 2 | J680: KANNOURAKIS 2 | N680: DUDLEY | P680: DEMPSTER | R680: PROSSER | W680: PORT MELBOURNE | X680: 2 | Y680: 9 | Z680: 3 | AA680: 0 | AB680: 1292 | AC680: 1239 | AD680: =(AB680/AC680)*100 -> 104.27764326069411 | AE680: =(Y680*4)+(AA680*2) -> 36
A681: WILLIAMSTOWN | C681: MINETT 2 | F681: PASTORE | I681: MOURNEY | K681: WILLIAMS | W681: DANDEN0NG | X681: 2 | Y681: 8 | Z681: 4 | AA681: 0 | AB681: 1675 | AC681: 1094 | AD681: =(AB681/AC681)*100 -> 153.10786106032907 | AE681: =(Y681*4)+(AA681*2) -> 32
D682: 14TH JULY | I682: WEATHER | S682: Venue: WERRIBEE | W682: SANDRINGHAM | X682: 2 | Y682: 8 | Z682: 4 | AA682: 0 | AB682: 1390 | AC682: 1112 | AD682: =(AB682/AC682)*100 -> 125 | AE682: =(Y682*4)+(AA682*2) -> 32
A683: BOX HILL | C683: 3 | D683: 4 | E683: 22 | G683: 7 | H683: 9 | I683: 51 | K683: 12 | L683: 12 | M683: 84 | O683: 12 | P683: 15 | Q683: 87 | S683: BOTT
A684: WERRIBEE | C684: 4 | D684: 3 | E684: 27 | G684: 7 | H684: 4 | I684: 46 | K684: 9 | L684: 5 | M684: 59 | O684: 10 | P684: 7 | Q684: 67 | S684: SAVILLE | W684: COBURG | X684: 2 | Y684: 6 | Z684: 6 | AA684: 0 | AB684: 1215 | AC684: 1244 | AD684: =(AB684/AC684)*100 -> 97.668810289389057 | AE684: =(Y684*4)+(AA684*2) -> 24
A685: BEST PLAYERS | W685: WILLIAMSTOWN | X685: 2 | Y685: 5 | Z685: 6 | AA685: 1 | AB685: 1179 | AC685: 1140 | AD685: =(AB685/AC685)*100 -> 103.42105263157895 | AE685: =(Y685*4)+(AA685*2) -> 22
A686: BOX HILL | C686: ZARAFA | F686: DE BOER | I686: DALRYMPLE | L686: DEIULLIO | O686: LISLE | Q686: HEANEY | W686: SPRINGVALE | X686: 2 | Y686: 5 | Z686: 7 | AA686: 0 | AB686: 1115 | AC686: 1061 | AD686: =(AB686/AC686)*100 -> 105.08953817153628 | AE686: =(Y686*4)+(AA686*2) -> 20
A687: WERRIBEE | C687: MORGAN | F687: CHAPMAN | I687: NORMINGTON | L687: EAMES | O687: SELLS | Q687: ALLDAY | W687: PRAHRAN | X687: 2 | Y687: 4 | Z687: 7 | AA687: 1 | AB687: 1205 | AC687: 1281 | AD687: =(AB687/AC687)*100 -> 94.067135050741612 | AE687: =(Y687*4)+(AA687*2) -> 18
A688: GOALKICKERS | P688: BYRNE | W688: FRANKSTON | X688: 2 | Y688: 4 | Z688: 8 | AA688: 0 | AB688: 1152 | AC688: 1217 | AD688: =(AB688/AC688)*100 -> 94.658997534921937 | AE688: =(Y688*4)+(AA688*2) -> 16
A689: BOX HILL | C689: DE BOER 3 | E689: DALRYMPLE 2 | H689: DIEULLIO 2 | K689: DWYER | M689: HANDLEY | O689: ZARAFA | Q689: BUTTIFANT | W689: PRESTON | X689: 2 | Y689: 2 | Z689: 10 | AA689: 0 | AB689: 1016 | AC689: 1494 | AD689: =(AB689/AC689)*100 -> 68.005354752342711 | AE689: =(Y689*4)+(AA689*2) -> 8
A690: WERRIBEE | C690: SELLS 5 | F690: HARRIS | H690: DANIHER | J690: O'KEEFE | L690: RAEBURN | N690: MORGAN | W690: OAKLEIGH | X690: 2 | Y690: 1 | Z690: 11 | AA690: 0 | AB690: 873 | AC690: 1599 | AD690: =(AB690/AC690)*100 -> 54.596622889305813 | AE690: =(Y690*4)+(AA690*2) -> 4
A692: COBURG | C692: 6 | D692: 4 | E692: 40 | G692: 10 | H692: 11 | I692: 71 | K692: 13 | L692: 12 | M692: 90 | O692: 21 | P692: 19 | Q692: 145 | S692: Venue: BEACH ROAD
A693: SANDRINGHAM | C693: 6 | D693: 5 | E693: 41 | G693: 7 | H693: 7 | I693: 49 | K693: 10 | L693: 9 | M693: 69 | O693: 10 | P693: 11 | Q693: 71 | S693: MORROW :VAN BEEK
A694: BEST PLAYERS
A695: COBURG | C695: LOONE | F695: LANGAN | J695: ZANON | L695: WILLIAMS | O695: GUMLEY | R695: NIMMO
A696: SANDRINGHAM | C696: GARRETT | F696: DIPIERDOMENICO | J696: ALLEN | L696: CZERKASKI | O696: J RUGOLO | R696: O'CONNOR
A697: GOALKICKERS
A698: COBURG | C698: WILLIAMS 6 | F698: GRIFFITHS 5 | I698: LANGAN 2 | K698: KOURKAMELIS 2 | N698: SALVADOR 2 | Q698: INGRAM | S698: BURKE | W698: HARRINGTON | X698: REYNOLDSON
A699: SANDRINGHAM | C699: GARRETT 3 | F699: OGG 2 | H699: O'CONNOR 2 | K699: FOLEY | M699: FISCHER | O699: MACKENZIE
A701: FRANKSTON | C701: 2 | D701: 6 | E701: 18 | G701: 5 | H701: 7 | I701: 37 | K701: 6 | L701: 9 | M701: 45 | O701: 9 | P701: 14 | Q701: 68 | S701: Venue: PRESTON
A702: PRESTON | C702: 2 | D702: 1 | E702: 13 | G702: 3 | H702: 5 | I702: 23 | K702: 4 | L702: 9 | M702: 33 | O702: 5 | P702: 10 | Q702: 40 | S702: LUCKMAN :CLEMENT
A703: BEST PLAYERS
A704: FRANKSTON | C704: PARKER | F704: SAVAGE | I704: GAHAN | L704: MARTIN | O704: SOLE | R704: HILLIARD
A705: PRESTON | C705: LUMICISI | F705: NICOLAOU | I705: LAWSON | L705: BROWN | O705: McINERNEY
A706: GOALKICKERS
A707: FRANKSTON | C707: G BROWN 3 | F707: MACE 3 | H707: BINGLEY | J707: SOLE | L707: DENEREAZ
A708: PRESTON | C708: WALKER 3 | F708: JORDAN | H708: LUMICISI
A710: DANDENONG | C710: 4 | D710: 2 | E710: 26 | G710: 7 | H710: 4 | I710: 46 | K710: 13 | L710: 5 | M710: 83 | O710: 17 | P710: 8 | Q710: 110 | S710: Venue: OAKLEIGH
A711: OAKLEIGH | C711: 0 | D711: 2 | E711: 2 | G711: 2 | H711: 4 | I711: 16 | K711: 3 | L711: 6 | M711: 24 | O711: 8 | P711: 8 | Q711: 56 | S711: CALLAGHAN :SNEDDON
A712: BEST PLAYERS
A713: DANDENONG | C713: FRANGALAS | F713: KNIGHT | I713: DOYLE | L713: READ | O713: McCORMACK | R713: BOURKE
A714: OAKLEIGH | C714: SMITH | F714: TODD | I714: HAWKER | L714: OWEN | O714: PRETTO
A715: GOALKICKERS
A716: DANDENONG | C716: WELSH 4 | F716: CASSETT 3 | I716: GOTCH 2 | K716: READ 2 | M716: BOURKE | O716: BROWN | Q716: KNIGHT | S716: McCORMACK | X716: MARSHALL | Y716: MILLIGAN
A717: OAKLEIGH | C717: PRETTO 5 | F717: HICKEY | H717: CUNNINGHAM | K717: TODD
A719: PRAHRAN | C719: 3 | D719: 4 | E719: 22 | G719: 5 | H719: 7 | I719: 37 | K719: 9 | L719: 13 | M719: 67 | O719: 13 | P719: 15 | Q719: 93 | S719: Venue: TOORAK PARK
A720: PORT MELBOURNE | C720: 2 | D720: 3 | E720: 15 | G720: 3 | H720: 8 | I720: 26 | K720: 4 | L720: 8 | M720: 32 | O720: 7 | P720: 9 | Q720: 51 | S720: SAWERS :SIGMONT
A721: BEST PLAYERS
A722: PRAHRAN | C722: LANGAN | F722: CAMERON | I722: POVEY | L722: MORRISSEY | O722: SHORTHOUSE | R722: CHAPPLE
A723: PORT MELBOURNE | C723: RICHARDS | F723: ROBERTSON | I723: JENNINGS | L723: KEIGHRAN | O723: CAMERON
A724: GOALKICKERS
A725: PRAHRAN | C725: CAMERON 4 | F725: MITCHELL 2 | I725: KNIGHTS 2 | K725: POVEY | M725: MATERA | O725: ORIGLASSO | Q725: CUTLER | S725: CHAPPLE
A726: PORT MELBOURNE | C726: RICHARDS 2 | F726: CLOHESSY | I726: FOLEY | K726: PAUL | M726: ROBERTSON | P726: YORGEY
A728: ROUND 15 | D728: 20TH JULY | I728: WEATHER | S728: Venue: PORT MELBOURNE
D729: 1ST QTR | H729: 2ND QTR | L729: 3RD QTR | P729: FINAL | S729: UMPIRES
A730: SANDRINGHAM | C730: 6 | D730: 5 | E730: 41 | G730: 8 | H730: 8 | I730: 56 | K730: 13 | L730: 9 | M730: 87 | O730: 21 | P730: 14 | Q730: 140 | S730: RICH | Y730: LADDER | AB730: ROUND | AD730: 15
A731: PORT MELBOURNE | C731: 3 | D731: 2 | E731: 20 | G731: 5 | H731: 6 | I731: 36 | K731: 9 | L731: 12 | M731: 66 | O731: 11 | P731: 17 | Q731: 83 | S731: ALLEN
A732: BEST PLAYERS | W732: TEAM | X732: B | Y732: W | Z732: L | AA732: D | AB732: FOR | AC732: AGST | AD732: % | AE732: PTS
A733: SANDRINGHAM | C733: F RUGOLO | F733: GARRETT | I733: ALLEN | L733: FOLEY
A734: PORT MELBOURNE | C734: STROOPER | F734: GASPARONI | I734: YORGEY | L734: RICHARDS | W734: WERRIBEE | X734: 2 | Y734: 11 | Z734: 2 | AA734: 0 | AB734: 1677 | AC734: 1350 | AD734: =(AB734/AC734)*100 -> 124.22222222222221 | AE734: =(Y734*4)+(AA734*2) -> 44
A735: GOALKICKERS | P735: CULLINANE | W735: BOX HILL | X735: 2 | Y735: 10 | Z735: 3 | AA735: 0 | AB735: 1472 | AC735: 1219 | AD735: =(AB735/AC735)*100 -> 120.75471698113208 | AE735: =(Y735*4)+(AA735*2) -> 40
A736: SANDRINGHAM | C736: F RUGOLO 11 | F736: GARRETT 3 | I736: FOLEY 2 | K736: FISCHER | M736: ALLEN | O736: O'CONNOR | Q736: DIPIERDOMENICO | W736: DANDEN0NG | X736: 2 | Y736: 9 | Z736: 4 | AA736: 0 | AB736: 1774 | AC736: 1181 | AD736: =(AB736/AC736)*100 -> 150.21168501270111 | AE736: =(Y736*4)+(AA736*2) -> 36
A737: PORT MELBOURNE | C737: GASPARONI 3 | F737: JAMES 3 | H737: KEIGHRAN | J737: CLOHESSY | M737: HARKINS | O737: PAUL | Q737: YORGEY | W737: SANDRINGHAM | X737: 2 | Y737: 9 | Z737: 4 | AA737: 0 | AB737: 1530 | AC737: 1195 | AD737: =(AB737/AC737)*100 -> 128.03347280334728 | AE737: =(Y737*4)+(AA737*2) -> 36
D738: 21ST JULY | I738: WEATHER | S738: Venue: BOX HILL | W738: PORT MELBOURNE | X738: 2 | Y738: 9 | Z738: 4 | AA738: 0 | AB738: 1375 | AC738: 1379 | AD738: =(AB738/AC738)*100 -> 99.709934735315443 | AE738: =(Y738*4)+(AA738*2) -> 36
A739: BOX HILL | C739: 6 | D739: 3 | E739: 39 | G739: 12 | H739: 9 | I739: 81 | K739: 20 | L739: 11 | M739: 131 | O739: 28 | P739: 16 | Q739: 184 | S739: McKERNAN
A740: OAKLEIGH | C740: 1 | D740: 1 | E740: 7 | G740: 4 | H740: 7 | I740: 31 | K740: 5 | L740: 10 | M740: 40 | O740: 8 | P740: 10 | Q740: 58 | S740: GERSCH | W740: SPRINGVALE | X740: 2 | Y740: 6 | Z740: 7 | AA740: 0 | AB740: 1257 | AC740: 1151 | AD740: =(AB740/AC740)*100 -> 109.20938314509124 | AE740: =(Y740*4)+(AA740*2) -> 24
A741: BEST PLAYERS | W741: COBURG | X741: 2 | Y741: 6 | Z741: 7 | AA741: 0 | AB741: 1301 | AC741: 1368 | AD741: =(AB741/AC741)*100 -> 95.102339181286553 | AE741: =(Y741*4)+(AA741*2) -> 24
A742: BOX HILL | C742: BYRNE | F742: DALRYMPLE | I742: HOGAN | L742: HEANEY | O742: BOURKE | Q742: O'NEILL | W742: WILLIAMSTOWN | X742: 2 | Y742: 5 | Z742: 7 | AA742: 1 | AB742: 1298 | AC742: 1264 | AD742: =(AB742/AC742)*100 -> 102.68987341772151 | AE742: =(Y742*4)+(AA742*2) -> 22
A743: OAKLEIGH | C743: ATHERTON | F743: HAWKER | I743: GARBUIO | L743: MYNOTT | W743: PRAHRAN | X743: 2 | Y743: 4 | Z743: 8 | AA743: 1 | AB743: 1292 | AC743: 1380 | AD743: =(AB743/AC743)*100 -> 93.623188405797094 | AE743: =(Y743*4)+(AA743*2) -> 18
A744: GOALKICKERS | J744: HOGAN | L744: HAMILTON | N744: HEANEY | P744: HICKS | R744: LISLE | W744: FRANKSTON | X744: 2 | Y744: 4 | Z744: 9 | AA744: 0 | AB744: 1242 | AC744: 1359 | AD744: =(AB744/AC744)*100 -> 91.390728476821195 | AE744: =(Y744*4)+(AA744*2) -> 16
A745: BOX HILL | C745: BYRNE 5 | E745: HANDLEY 5 | H745: DIEULLIO 4 | J745: DWYER 3 | L745: BUTTIFANT 2 | O745: DALRYMPLE 2 | R745: DEBOER 2 | W745: PRESTON | X745: 2 | Y745: 3 | Z745: 10 | AA745: 0 | AB745: 1140 | AC745: 1580 | AD745: =(AB745/AC745)*100 -> 72.151898734177209 | AE745: =(Y745*4)+(AA745*2) -> 12
A746: OAKLEIGH | C746: MYNOTT 3 | F746: PRETTO 2 | I746: TODD | K746: HAWKER | M746: TEMPLETON | W746: OAKLEIGH | X746: 2 | Y746: 1 | Z746: 12 | AA746: 0 | AB746: 931 | AC746: 1783 | AD746: =(AB746/AC746)*100 -> 52.215367358384746 | AE746: =(Y746*4)+(AA746*2) -> 4
A748: SPRINGVALE | C748: 4 | D748: 3 | E748: 27 | G748: 8 | H748: 7 | I748: 55 | K748: 15 | L748: 13 | M748: 103 | O748: 21 | P748: 16 | Q748: 142 | S748: Venue: FRANKSTON
A749: FRANKSTON | C749: 4 | D749: 3 | E749: 27 | G749: 8 | H749: 5 | I749: 53 | K749: 10 | L749: 7 | M749: 67 | O749: 13 | P749: 12 | Q749: 90 | S749: VAN BEEK :ANTHONY
A750: BEST PLAYERS
A751: SPRINGVALE | C751: MORGAN | F751: P MALONI | I751: PEACOCK | L751: McDONOUGH
A752: FRANKSTON | C752: MACE | F752: A HAMILL | I752: S HAMILL | L752: S GARDNER | O752: POLLOCK
A753: GOALKICKERS
A754: SPRINGVALE | C754: ROBINSON 7 | F754: KANNOURAKIS 3 | J754: NICOL 3 | L754: KOOP 2 | N754: PROSSER 2 | Q754: MIEKLE | S754: P MALONI | W754: PEACOCK | Y754: McDONOUGH
A755: FRANKSTON | C755: MACE 4 | E755: S GARDNER 3 | H755: KEANE 2 | J755: S HAMILL 2 | M755: BINGLEY | O755: BARBER
A757: PRESTON | C757: 4 | D757: 4 | E757: 28 | G757: 9 | H757: 8 | I757: 62 | K757: 15 | L757: 9 | M757: 99 | O757: 19 | P757: 10 | Q757: 124 | S757: Venue: COBURG
A758: COBURG | C758: 4 | D758: 4 | E758: 28 | G758: 5 | H758: 6 | I758: 36 | K758: 9 | L758: 10 | M758: 64 | O758: 12 | P758: 14 | Q758: 86 | S758: SAVILLE :McDONALD
A759: BEST PLAYERS
A760: PRESTON | C760: KERR | F760: WALKER | I760: LAWSON
A761: COBURG | C761: ZANON | F761: GUMLEY | I761: SALVADORE
A762: GOALKICKERS
A763: PRESTON | C763: WALKER 3 | E763: KERR 3 | G763: LAWSON 2 | I763: GILLARD 2 | K763: CARDAMONE | N763: JORDAN | P763: REEVES | R763: DINTINOSANTE | W763: McINERNEY | X763: OWEN | Z763: PERCY | AB763: VALKANIS | AD763: LUMICISI
A764: COBURG | C764: WILLIAMS 4 | F764: POTTER 2 | I764: KAAKOUR 2 | L764: REYNOLDSON | O764: CALLANDER | R764: ALESSIO | U764: GUMLEY
A766: DANDENONG | C766: 2 | D766: 4 | E766: 16 | G766: 5 | H766: 12 | I766: 42 | K766: 9 | L766: 18 | M766: 72 | O766: 13 | P766: 21 | Q766: 99 | S766: Venue: DANDENONG
A767: PRAHRAN | C767: 4 | D767: 3 | E767: 27 | G767: 8 | H767: 4 | I767: 52 | K767: 9 | L767: 6 | M767: 60 | O767: 13 | P767: 9 | Q767: 87 | S767: CAMERON :CAULFIELD
A768: BEST PLAYERS
A769: DANDENONG | C769: MILLIGAN | F769: McCORMACK | I769: GOTCH | L769: KNIGHT | O769: MILLANE | R769: ELSHAUG
A770: PRAHRAN | C770: BOLZON | F770: SINNI | I770: POVEY | L770: MITCHELL | O770: KNIGHTS | R770: BRINKOTTER
A771: GOALKICKERS
A772: DANDENONG | C772: WELSH 3 | E772: GOTCH 3 | G772: MARSHALL 2 | J772: ELSHAUG | M772: KNIGHT | O772: MILLANE | Q772: MILLIGAN | S772: WICKS
A773: PRAHRAN | C773: HUG 4 | E773: POVEY 2 | G773: WEEDING 2 | J773: CAMERON 2 | M773: ORIGLASSO | P773: KNIGHTS | R773: CHAPPLE
A775: WERRIBEE | C775: 7 | D775: 3 | E775: 45 | G775: 13 | H775: 5 | I775: 83 | K775: 13 | L775: 13 | M775: 91 | O775: 18 | P775: 16 | Q775: 124 | S775: Venue: WILLIAMSTOWN
A776: WILLIAMSTOWN | C776: 5 | D776: 4 | E776: 34 | G776: 8 | H776: 9 | I776: 57 | K776: 14 | L776: 12 | M776: 96 | O776: 17 | P776: 17 | Q776: 119 | S776: MORROW :SHEEHAN
A777: BEST PLAYERS
A778: WERRIBEE | C778: SELLS | F778: CHAPMAN | I778: NORMINGTON | L778: O'KEEFE | O778: RAEBURN | R778: HARRIS
A779: WILLIAMSTOWN | C779: SWAN | F779: MITCHELL | I779: McTAGGART | L779: TURCINOVICH | O779: PERRY
A780: GOALKICKERS
A781: WERRIBEE | C781: SELLS 6 | F781: O'KEEFE 6 | I781: EAMES 2 | K781: RAEBURN 2 | N781: KNIGHT | P781: HARRIS
A782: WILLIAMSTOWN | C782: TURCINOVICH 4 | F782: GHAZI 3 | H782: AZIZ 3 | J782: SWAN 2 | L782: RICKMAN | N782: SMITH | P782: SYMONS | R782: PASTORE | U782: MITCHELL
A784: ROUND 16 | D784: 27TH JULY | I784: WEATHER | S784: Venue: PORT MELBOURNE
D785: 1ST QTR | H785: 2ND QTR | L785: 3RD QTR | P785: FINAL | S785: UMPIRES
A786: SPRINGVALE | C786: 0 | D786: 1 | E786: 1 | G786: 4 | H786: 3 | I786: 27 | K786: 6 | L786: 5 | M786: 41 | O786: 12 | P786: 8 | Q786: 80 | S786: CAULFIELD | Y786: LADDER | AB786: ROUND | AD786: 16
A787: COBURG | C787: 8 | D787: 4 | E787: 52 | G787: 8 | H787: 7 | I787: 55 | K787: 10 | L787: 9 | M787: 69 | O787: 11 | P787: 12 | Q787: 78 | S787: LUCKMAN
A788: BEST PLAYERS | W788: TEAM | X788: B | Y788: W | Z788: L | AA788: D | AB788: FOR | AC788: AGST | AD788: % | AE788: PTS
A789: SPRINGVALE | C789: P MALONI | F789: M MALONI | I789: C STEWART | L789: ROBINSON | O789: McDONOUGH | R789: MENDE
A790: COBURG | C790: SALVADORE | F790: LOONE | I790: BARNES | L790: NIMMO | W790: WERRIBEE | X790: 2 | Y790: 12 | Z790: 2 | AA790: 0 | AB790: 1803 | AC790: 1402 | AD790: =(AB790/AC790)*100 -> 128.60199714693294 | AE790: =(Y790*4)+(AA790*2) -> 48
A791: GOALKICKERS | O791: KANNOURAKIS | W791: DANDEN0NG | X791: 2 | Y791: 10 | Z791: 4 | AA791: 0 | AB791: 1921 | AC791: 1286 | AD791: =(AB791/AC791)*100 -> 149.37791601866252 | AE791: =(Y791*4)+(AA791*2) -> 40
A792: SPRINGVALE | C792: ROBINSON 5 | F792: PROSSER 2 | I792: SMIT | J792: STEWART | M792: DUDLEY | O792: McDONOUGH | W792: BOX HILL | X792: 2 | Y792: 10 | Z792: 4 | AA792: 0 | AB792: 1566 | AC792: 1330 | AD792: =(AB792/AC792)*100 -> 117.74436090225564 | AE792: =(Y792*4)+(AA792*2) -> 40
A793: COBURG | C793: KAAKOUR 3 | F793: WILLIAMS 2 | I793: D SULLIVAN 2 | L793: ALESSIO 2 | N793: P SULLIVAN 2 | W793: PORT MELBOURNE | X793: 2 | Y793: 10 | Z793: 4 | AA793: 0 | AB793: 1472 | AC793: 1401 | AD793: =(AB793/AC793)*100 -> 105.06780870806567 | AE793: =(Y793*4)+(AA793*2) -> 40
D794: 28TH JULY | I794: WEATHER | S794: Venue: BOX HILL | W794: SANDRINGHAM | X794: 2 | Y794: 9 | Z794: 5 | AA794: 0 | AB794: 1635 | AC794: 1342 | AD794: =(AB794/AC794)*100 -> 121.83308494783904 | AE794: =(Y794*4)+(AA794*2) -> 36
A795: PRAHRAN | C795: 1 | D795: 2 | E795: 8 | G795: 8 | H795: 5 | I795: 53 | K795: 12 | L795: 9 | M795: 81 | O795: 17 | P795: 9 | Q795: 111 | S795: RICH
A796: BOX HILL | C796: 6 | D796: 4 | E796: 40 | G796: 8 | H796: 7 | I796: 55 | K796: 11 | L796: 9 | M796: 75 | O796: 14 | P796: 10 | Q796: 94 | S796: McDONALD | W796: SPRINGVALE | X796: 2 | Y796: 7 | Z796: 7 | AA796: 0 | AB796: 1337 | AC796: 1229 | AD796: =(AB796/AC796)*100 -> 108.78763222131815 | AE796: =(Y796*4)+(AA796*2) -> 28
A797: BEST PLAYERS | W797: COBURG | X797: 2 | Y797: 6 | Z797: 8 | AA797: 0 | AB797: 1379 | AC797: 1448 | AD797: =(AB797/AC797)*100 -> 95.234806629834253 | AE797: =(Y797*4)+(AA797*2) -> 24
A798: PRAHRAN | C798: ORIGLASSO | F798: POVEY | I798: MORRISSEY | L798: TAYLOR | O798: SINNI | Q798: CAMERON | W798: WILLIAMSTOWN | X798: 2 | Y798: 5 | Z798: 8 | AA798: 1 | AB798: 1365 | AC798: 1339 | AD798: =(AB798/AC798)*100 -> 101.94174757281553 | AE798: =(Y798*4)+(AA798*2) -> 22
A799: BOX HILL | C799: HANDLEY | F799: DALRYMPLE | I799: HAMILTON | W799: PRAHRAN | X799: 2 | Y799: 5 | Z799: 8 | AA799: 1 | AB799: 1403 | AC799: 1474 | AD799: =(AB799/AC799)*100 -> 95.183175033921302 | AE799: =(Y799*4)+(AA799*2) -> 22
A800: GOALKICKERS | W800: FRANKSTON | X800: 2 | Y800: 5 | Z800: 9 | AA800: 0 | AB800: 1317 | AC800: 1426 | AD800: =(AB800/AC800)*100 -> 92.356241234221599 | AE800: =(Y800*4)+(AA800*2) -> 20
A801: PRAHRAN | C801: TAYLOR 5 | F801: SINNI 3 | H801: CAMERON 3 | K801: MITCHELL 2 | N801: DIMMATINA 2 | Q801: HUG | R801: BLUHM | W801: PRESTON | X801: 2 | Y801: 3 | Z801: 11 | AA801: 0 | AB801: 1162 | AC801: 1677 | AD801: =(AB801/AC801)*100 -> 69.290399522957657 | AE801: =(Y801*4)+(AA801*2) -> 12
A802: BOX HILL | C802: DIEUKKIO 4 | F802: ZARAFA 4 | I802: BUTTIFANT 2 | L802: HANDLEY 2 | O802: HICKS | Q802: DE BOER | W802: OAKLEIGH | X802: 2 | Y802: 1 | Z802: 13 | AA802: 0 | AB802: 983 | AC802: 1909 | AD802: =(AB802/AC802)*100 -> 51.492928234677834 | AE802: =(Y802*4)+(AA802*2) -> 4
A804: DANDENONG | C804: 6 | D804: 1 | E804: 37 | G804: 12 | H804: 7 | I804: 79 | K804: 18 | L804: 12 | M804: 120 | O804: 22 | P804: 15 | Q804: 147 | S804: Venue: BEACH ROAD
A805: SANDRINGHAM | C805: 5 | D805: 3 | E805: 33 | G805: 7 | H805: 7 | I805: 49 | K805: 10 | L805: 10 | M805: 70 | O805: 15 | P805: 15 | Q805: 105 | S805: GERSCH :TURNHAM
A806: BEST PLAYERS
A807: DANDENONG | C807: McCORMACK | F807: MOREY | I807: WELSH | L807: McCONCHIE | O807: BOURKE | R807: McKENZIE
A808: SANDRINGHAM | C808: ALLEN | F808: J RUGOLO | I808: DIPIERDOMENICO | L808: DUURSMA | O808: GARRETT | R808: FOLEY
A809: GOALKICKERS
A810: DANDENONG | C810: MOREY 6 | F810: WELSH 6 | H810: McKENZIE 4 | K810: GOTCH 2 | M810: McCONCHIE 2 | P810: BROWN | R810: MILLANE
A811: SANDRINGHAM | C811: GILDER 4 | F811: EDMONDS 3 | I811: F RUGOLO 3 | L811: GARRETT 2 | O811: ALLEN 2 | Q811: DIPIERDOMENICO
A813: FRANKSTON | C813: 4 | D813: 3 | E813: 27 | G813: 7 | H813: 8 | I813: 50 | K813: 7 | L813: 10 | M813: 52 | O813: 10 | P813: 15 | Q813: 75 | S813: Venue: WILLIAMSTOWN
A814: WILLIAMSTOWN | C814: 3 | D814: 3 | E814: 21 | G814: 3 | H814: 5 | I814: 23 | K814: 8 | L814: 7 | M814: 55 | O814: 9 | P814: 13 | Q814: 67 | S814: HARVEY :SNEDDON
A815: BEST PLAYERS
A816: FRANKSTON | C816: BELL | F816: HANGAR | I816: HILLIARD | L816: PARKER | O816: VANDERMEER | R816: A HAMILL
A817: WILLIAMSTOWN | C817: SLEVISON | F817: GHAZI | I817: ACKERLEY | L817: MITCHELL | O817: KENNY
A818: GOALKICKERS
A819: FRANKSTON | C819: BROWN 2 | F819: RAVEN 2 | I819: BARBER | K819: GARDNER | M819: SOLE | O819: HILLIARD | Q819: S HAMILL | S819: BELL
A820: WILLIAMSTOWN | C820: BURTON 3 | F820: RICKMAN 2 | I820: MCGOWAN 2 | L820: McDONALD | O820: SWAN
A822: WERRIBEE | C822: 4 | D822: 1 | E822: 25 | G822: 11 | H822: 9 | I822: 75 | K822: 16 | L822: 13 | M822: 109 | O822: 18 | P822: 18 | Q822: 126 | S822: Venue: WERRIBEE
A823: OAKLEIGH | C823: 5 | D823: 4 | E823: 34 | G823: 5 | H823: 7 | I823: 37 | K823: 7 | L823: 9 | M823: 51 | O823: 7 | P823: 10 | Q823: 52 | S823: CARLAND :DAVID
A824: BEST PLAYERS
A825: WERRIBEE | C825: MORGAN | F825: KNIGHT | I825: WALSH | L825: CHAPMAN | O825: NORMINGTON | R825: HARRIS
A826: OAKLEIGH | C826: WELSFORD | F826: TEMPLETON | I826: TODD | L826: MERTON | O826: DUNLOP
A827: GOALKICKERS
A828: WERRIBEE | C828: O'KEEFE 4 | F828: RAEBURN 3 | I828: MORGAN 3 | K828: SELLS 2 | M828: DRUM 2 | O828: HARRIS | Q828: WALSH | S828: DANIHER | W828: McMASTER
A829: OAKLEIGH | C829: MERTON 2 | F829: TEMPLETON 2 | I829: TODD | K829: PRETTO | M829: MARSHALL
A831: PORT MELBOURNE | C831: 4 | D831: 5 | E831: 29 | G831: 6 | H831: 10 | I831: 46 | K831: 10 | L831: 12 | M831: 72 | O831: 14 | P831: 13 | Q831: 97 | S831: Venue: PRESTON
A832: PRESTON | C832: 0 | D832: 3 | E832: 3 | G832: 2 | H832: 6 | I832: 18 | K832: 2 | L832: 8 | M832: 20 | O832: 2 | P832: 10 | Q832: 22 | S832: AGNEW :HINTON
A833: BEST PLAYERS
A834: PORT MELBOURNE | C834: YORGEY | F834: HARKINS | I834: HARROP
A835: PRESTON | C835: LUMICISI | F835: JORDAN | I835: NICOLAOU | L835: REEVES | O835: McINERNEY
A836: GOALKICKERS
A837: PORT MELBOURNE | C837: HICKS 3 | E837: YORGEY 2 | G837: PAUL 2 | I837: RAINSFORD | L837: HARROP | N837: JAMES | P837: KEIGHRAN | R837: CLOHESSY | U837: GASPARONI | Y837: HARKINS
A838: PRESTON | C838: LUMICISI | F838: VALKANIS
A840: ROUND 17 | D840: 3RD AUGUST | I840: WEATHER | S840: Venue: PORT MELBOURNE
D841: 1ST QTR | H841: 2ND QTR | L841: 3RD QTR | P841: FINAL | S841: UMPIRES
A842: BOX HILL | C842: 3 | D842: 3 | E842: 21 | G842: 7 | H842: 6 | I842: 48 | K842: 16 | L842: 7 | M842: 103 | O842: 24 | P842: 8 | Q842: 152 | S842: CARLAND | Y842: LADDER | AB842: ROUND | AD842: 17
A843: SANDRINGHAM | C843: 4 | D843: 3 | E843: 27 | G843: 7 | H843: 4 | I843: 46 | K843: 10 | L843: 4 | M843: 64 | O843: 12 | P843: 9 | Q843: 81 | S843: ANTHONY
A844: BEST PLAYERS | W844: TEAM | X844: B | Y844: W | Z844: L | AA844: D | AB844: FOR | AC844: AGST | AD844: % | AE844: PTS
A845: BOX HILL | C845: ZARAFA | F845: SAID | I845: O'NEILL | L845: DALRYMPLE | O845: DIEULLIO | R845: HOGAN
A846: SANDRINGHAM | C846: J RUGOLO | F846: ALLEN | I846: F RUGOLO | L846: GARRETT | O846: CZERKASKI | R846: RYAN | W846: WERRIBEE | X846: 2 | Y846: 13 | Z846: 2 | AA846: 0 | AB846: 1950 | AC846: 1467 | AD846: =(AB846/AC846)*100 -> 132.92433537832312 | AE846: =(Y846*4)+(AA846*2) -> 52
A847: GOALKICKERS | L847: HEANEY | N847: HICKS | P847: LISLE | R847: SAID | W847: DANDEN0NG | X847: 2 | Y847: 11 | Z847: 4 | AA847: 0 | AB847: 2012 | AC847: 1337 | AD847: =(AB847/AC847)*100 -> 150.48616305160806 | AE847: =(Y847*4)+(AA847*2) -> 44
A848: BOX HILL | C848: DIEULLIO 7 | F848: HANDLEY 3 | I848: DE BOER 3 | K848: ZARAFA 3 | M848: BYRNE 2 | O848: BROWN | Q848: DWYER | W848: BOX HILL | X848: 2 | Y848: 11 | Z848: 4 | AA848: 0 | AB848: 1718 | AC848: 1411 | AD848: =(AB848/AC848)*100 -> 121.75761871013466 | AE848: =(Y848*4)+(AA848*2) -> 44
A849: SANDRINGHAM | C849: F RUGOLO 7 | F849: GARRETT 3 | I849: FISCHER | K849: O'CONNOR | W849: PORT MELBOURNE | X849: 2 | Y849: 10 | Z849: 5 | AA849: 0 | AB849: 1559 | AC849: 1538 | AD849: =(AB849/AC849)*100 -> 101.36540962288687 | AE849: =(Y849*4)+(AA849*2) -> 40
D850: 4TH AUGUST | I850: WEATHER | S850: Venue: SPRINGVALE | W850: SANDRINGHAM | X850: 2 | Y850: 9 | Z850: 6 | AA850: 0 | AB850: 1716 | AC850: 1494 | AD850: =(AB850/AC850)*100 -> 114.85943775100402 | AE850: =(Y850*4)+(AA850*2) -> 36
A851: DANDENONG | C851: 2 | D851: 4 | E851: 16 | G851: 2 | H851: 9 | I851: 21 | K851: 7 | L851: 16 | M851: 58 | O851: 12 | P851: 19 | Q851: 91 | S851: MORROW
A852: SPRINGVALE | C852: 1 | D852: 2 | E852: 8 | G852: 6 | H852: 8 | I852: 44 | K852: 6 | L852: 11 | M852: 47 | O852: 6 | P852: 15 | Q852: 51 | S852: RICHARDSON | W852: SPRINGVALE | X852: 2 | Y852: 7 | Z852: 8 | AA852: 0 | AB852: 1388 | AC852: 1320 | AD852: =(AB852/AC852)*100 -> 105.15151515151516 | AE852: =(Y852*4)+(AA852*2) -> 28
A853: BEST PLAYERS | W853: COBURG | X853: 2 | Y853: 7 | Z853: 8 | AA853: 0 | AB853: 1479 | AC853: 1544 | AD853: =(AB853/AC853)*100 -> 95.790155440414509 | AE853: =(Y853*4)+(AA853*2) -> 28
A854: DANDENONG | C854: DOYLE | F854: BROWN | I854: KNIGHT | L854: BOURKE | O854: WELSH | Q854: TAYLOR | W854: WILLIAMSTOWN | X854: 2 | Y854: 6 | Z854: 8 | AA854: 1 | AB854: 1502 | AC854: 1416 | AD854: =(AB854/AC854)*100 -> 106.07344632768361 | AE854: =(Y854*4)+(AA854*2) -> 26
A855: SPRINGVALE | C855: MORGAN | F855: DUDLEY | I855: SMIT | L855: M MALONI | O855: P McDONOUGH | W855: PRAHRAN | X855: 2 | Y855: 6 | Z855: 8 | AA855: 1 | AB855: 1563 | AC855: 1547 | AD855: =(AB855/AC855)*100 -> 101.03425985778927 | AE855: =(Y855*4)+(AA855*2) -> 26
A856: GOALKICKERS | W856: FRANKSTON | X856: 2 | Y856: 5 | Z856: 10 | AA856: 0 | AB856: 1414 | AC856: 1526 | AD856: =(AB856/AC856)*100 -> 92.660550458715591 | AE856: =(Y856*4)+(AA856*2) -> 20
A857: DANDENONG | C857: WELSH 6 | F857: DOYLE | H857: FRANGALAS | K857: HOLLOW | M857: McCORMACK | P857: MOREY | R857: READ | W857: PRESTON | X857: 2 | Y857: 3 | Z857: 12 | AA857: 0 | AB857: 1227 | AC857: 1824 | AD857: =(AB857/AC857)*100 -> 67.26973684210526 | AE857: =(Y857*4)+(AA857*2) -> 12
A858: SPRINGVALE | C858: KANNOURAKIS 2 | G858: PROSSER 2 | J858: MIEKLE | L858: DUDLEY | W858: OAKLEIGH | X858: 2 | Y858: 1 | Z858: 14 | AA858: 0 | AB858: 1056 | AC858: 2069 | AD858: =(AB858/AC858)*100 -> 51.039149347510872 | AE858: =(Y858*4)+(AA858*2) -> 4
A860: COBURG | C860: 2 | D860: 5 | E860: 17 | G860: 5 | H860: 10 | I860: 40 | K860: 10 | L860: 12 | M860: 72 | O860: 14 | P860: 16 | Q860: 100 | S860: Venue: FRANKSTON
A861: FRANKSTON | C861: 3 | D861: 9 | E861: 27 | G861: 4 | H861: 16 | I861: 40 | K861: 8 | L861: 17 | M861: 65 | O861: 13 | P861: 18 | Q861: 96 | S861: HINTON :MURNANE
A862: BEST PLAYERS
A863: COBURG | C863: YOUNG | F863: SULLIVAN | I863: LOONE | L863: KOUKOUMELIS | O863: BARNES | R863: DOYLE
A864: FRANKSTON | C864: PARKER | F864: MARTIN | I864: BELL | L864: S HAMILL | O864: BROWN | R864: GARDNER
A865: GOALKICKERS
A866: COBURG | C866: YOUNG 4 | F866: WILLIAMS 4 | I866: KAAKOUR 2 | L866: GRIFFITHS 2 | O866: SULLIVAN | Q866: INGRAM
A867: FRANKSTON | C867: GARDNER 5 | F867: BROWN 4 | I867: BARBER | K867: SOLE | M867: MARTIN | O867: S HAMILL
A869: PRAHRAN | C869: 5 | D869: 4 | E869: 34 | G869: 10 | H869: 9 | I869: 69 | K869: 18 | L869: 14 | M869: 122 | O869: 24 | P869: 16 | Q869: 160 | S869: Venue: TOORAK PARK
A870: OAKLEIGH | C870: 2 | D870: 4 | E870: 16 | G870: 4 | H870: 8 | I870: 32 | K870: 6 | L870: 10 | M870: 46 | O870: 10 | P870: 13 | Q870: 73 | S870: AGNEW :VAN BEEK
A871: BEST PLAYERS
A872: PRAHRAN | C872: POVEY | F872: SHORTHOUSE | I872: BLUHM | L872: CHAPPLE | O872: MARTELLO | R872: MITCHELL
A873: OAKLEIGH | C873: TEMPLETON | F873: SHARPE | I873: SMITH | L873: WELSFORD | O873: MELLODY
A874: GOALKICKERS
A875: PRAHRAN | C875: TAYLOR 7 | F875: CAMERON 5 | I875: POVEY 4 | K875: MITCHELL 2 | N875: HUG 2 | P875: MATERA | R875: CHAPPLE | U875: DIMMATINA | Y875: MORRISSEY
A876: OAKLEIGH | C876: OWEN 3 | F876: J CUNNINGHAM 2 | K876: HAWKER | M876: MERTON | O876: PRETTO | Q876: MELLODY | S876: SHARPE
A878: WILLIAMSTOWN | C878: 5 | D878: 2 | E878: 32 | G878: 10 | H878: 6 | I878: 66 | K878: 13 | L878: 9 | M878: 87 | O878: 20 | P878: 17 | Q878: 137 | S878: Venue: WILLIAMSTOWN
A879: PORT MELBOURNE | C879: 5 | D879: 5 | E879: 35 | G879: 7 | H879: 9 | I879: 51 | K879: 9 | L879: 13 | M879: 67 | O879: 12 | P879: 15 | Q879: 87 | S879: McDONALD :McKERNAN
A880: BEST PLAYERS
A881: WILLIAMSTOWN | C881: KENNY | F881: GHAZI | I881: PERRY | L881: AZIZ | O881: LLOYD | R881: SWAN
A882: PORT MELBOURNE | C882: BOWDEN | F882: PAUL | I882: YORGEY | L882: KEIGHRAN
A883: GOALKICKERS
A884: WILLIAMSTOWN | C884: GHAZI 5 | F884: RICKMAN 3 | I884: SLEVISON 3 | L884: McGOWAN 2 | O884: O'CONNOR 2 | R884: AZIZ 2 | U884: MUSCHIALLI 2 | Y884: BURTON
A885: PORT MELBOURNE | C885: RAINSFORD 4 | F885: HARROP 2 | I885: JAMES 2 | K885: BARLOW | M885: BOWDEN | O885: MUTIMER | Q885: YORGEY
A887: WERRIBEE | C887: 1 | D887: 2 | E887: 8 | G887: 6 | H887: 6 | I887: 42 | K887: 12 | L887: 8 | M887: 80 | O887: 22 | P887: 15 | Q887: 147 | S887: Venue: PRESTON
A888: PRESTON | C888: 5 | D888: 1 | E888: 31 | G888: 7 | H888: 1 | I888: 43 | K888: 9 | L888: 5 | M888: 59 | O888: 10 | P888: 5 | Q888: 65 | S888: ALLEN ;TURNHAM
A889: BEST PLAYERS
A890: WERRIBEE | C890: ALLDAY | F890: GEARY | I890: CHAPMAN | L890: McMASTER | O890: RAEBURN | R890: EAMES
A891: PRESTON | C891: LUMICISI | F891: VALKANIS | I891: JORDAN | L891: KING | O891: BURROWS
A892: GOALKICKERS
A893: WERRIBEE | C893: DRUM 5 | E893: O'KEEFE 4 | G893: GEARY 2 | I893: WALSH 2 | K893: DANIHER 2 | M893: RAEBURN 2 | P893: EAMES 2 | R893: HARRIS | U893: McPHERSON | Y893: PAVLIDIS
A894: PRESTON | C894: GILLARD 2 | F894: GRAZIANO 2 | I894: OWEN 2 | K894: KERR | M894: LAWSON | O894: LUMICISI | Q894: VALKANIS
A896: ROUND 18 | D896: 10TH AUGUST | I896: WEATHER | S896: Venue: PORT MELBOURNE
D897: 1ST QTR | H897: 2ND QTR | L897: 3RD QTR | P897: FINAL | S897: UMPIRES
A898: FRANKSTON | C898: 2 | D898: 3 | E898: 15 | G898: 8 | H898: 5 | I898: 53 | K898: 14 | L898: 9 | M898: 93 | O898: 22 | P898: 14 | Q898: 146 | S898: CARLAND | Y898: LADDER | AB898: ROUND | AD898: 18
A899: PORT MELBOURNE | C899: 7 | D899: 4 | E899: 46 | G899: 9 | H899: 9 | I899: 63 | K899: 12 | L899: 14 | M899: 86 | O899: 15 | P899: 16 | Q899: 106 | S899: LUCKMAN
A900: BEST PLAYERS | W900: TEAM | X900: B | Y900: W | Z900: L | AA900: D | AB900: FOR | AC900: AGST | AD900: % | AE900: PTS
A901: FRANKSTON | C901: S HAMILL | F901: MILLANE | I901: BROWN | L901: MACE | O901: GARDNER
A902: PORT MELBOURNE | C902: CAMERON | F902: DONALD | I902: GASPARONI | W902: WERRIBEE | X902: 2 | Y902: 14 | Z902: 2 | AA902: 0 | AB902: 2081 | AC902: 1576 | AD902: =(AB902/AC902)*100 -> 132.04314720812184 | AE902: =(Y902*4)+(AA902*2) -> 56
A903: GOALKICKERS | Q903: RAVEN | W903: DANDEN0NG | X903: 2 | Y903: 12 | Z903: 4 | AA903: 0 | AB903: 2186 | AC903: 1424 | AD903: =(AB903/AC903)*100 -> 153.51123595505618 | AE903: =(Y903*4)+(AA903*2) -> 48
A904: FRANKSTON | C904: BROWN 8 | F904: S HAMILL 4 | I904: GARDNER 4 | L904: SHANNON 2 | O904: BELL | P904: MACE | R904: T HAMILL | W904: BOX HILL | X904: 2 | Y904: 12 | Z904: 4 | AA904: 0 | AB904: 1860 | AC904: 1501 | AD904: =(AB904/AC904)*100 -> 123.9173884077282 | AE904: =(Y904*4)+(AA904*2) -> 48
A905: PORT MELBOURNE | C905: JAMES 5 | F905: CAMERON 3 | I905: PAUL 3 | K905: BOWDEN | M905: DONALD | O905: HARKINS | Q905: HICKS | W905: SANDRINGHAM | X905: 2 | Y905: 10 | Z905: 6 | AA905: 0 | AB905: 1802 | AC905: 1565 | AD905: =(AB905/AC905)*100 -> 115.14376996805112 | AE905: =(Y905*4)+(AA905*2) -> 40
D906: 11TH AUGUST | I906: WEATHER | S906: Venue: BOX HILL | W906: PORT MELBOURNE | X906: 2 | Y906: 10 | Z906: 6 | AA906: 0 | AB906: 1665 | AC906: 1684 | AD906: =(AB906/AC906)*100 -> 98.87173396674585 | AE906: =(Y906*4)+(AA906*2) -> 40
A907: BOX HILL | C907: 5 | D907: 7 | E907: 37 | G907: 10 | H907: 9 | I907: 69 | K907: 14 | L907: 13 | M907: 97 | O907: 21 | P907: 16 | Q907: 142 | S907: HARVEY
A908: PRESTON | C908: 3 | D908: 0 | E908: 18 | G908: 9 | H908: 3 | I908: 57 | K908: 11 | L908: 7 | M908: 73 | O908: 13 | P908: 12 | Q908: 90 | S908: MURNANE | W908: SPRINGVALE | X908: 2 | Y908: 8 | Z908: 8 | AA908: 0 | AB908: 1517 | AC908: 1412 | AD908: =(AB908/AC908)*100 -> 107.43626062322946 | AE908: =(Y908*4)+(AA908*2) -> 32
A909: BEST PLAYERS | W909: COBURG | X909: 2 | Y909: 7 | Z909: 9 | AA909: 0 | AB909: 1588 | AC909: 1675 | AD909: =(AB909/AC909)*100 -> 94.805970149253724 | AE909: =(Y909*4)+(AA909*2) -> 28
A910: BOX HILL | C910: DE BOER | F910: ZARAFA | I910: DALRYMPLE | L910: HICKS | O910: T BROWN | R910: HEANEY | W910: WILLIAMSTOWN | X910: 2 | Y910: 6 | Z910: 9 | AA910: 1 | AB910: 1589 | AC910: 1590 | AD910: =(AB910/AC910)*100 -> 99.937106918238996 | AE910: =(Y910*4)+(AA910*2) -> 26
A911: PRESTON | C911: KERR | F911: LUMICIS | I911: PERCY | L911: P BROWN | O911: OWEN | R911: BURROWS | W911: PRAHRAN | X911: 2 | Y911: 6 | Z911: 9 | AA911: 1 | AB911: 1655 | AC911: 1676 | AD911: =(AB911/AC911)*100 -> 98.747016706443915 | AE911: =(Y911*4)+(AA911*2) -> 26
A912: GOALKICKERS | N912: DE BOER | P912: HAMILTON | R912: LISLE | W912: FRANKSTON | X912: 2 | Y912: 6 | Z912: 10 | AA912: 0 | AB912: 1560 | AC912: 1632 | AD912: =(AB912/AC912)*100 -> 95.588235294117652 | AE912: =(Y912*4)+(AA912*2) -> 24
A913: BOX HILL | C913: BUTTIFANT 3 | F913: BYRNE 3 | H913: DIEULLIO 3 | J913: HICKS 3 | L913: T BROWN 2 | O913: DALRYMPLE 2 | R913: ZARAFA 2 | W913: PRESTON | X913: 2 | Y913: 3 | Z913: 13 | AA913: 0 | AB913: 1317 | AC913: 1966 | AD913: =(AB913/AC913)*100 -> 66.988809766022385 | AE913: =(Y913*4)+(AA913*2) -> 12
A914: PRESTON | C914: DINTINOSANTE 2 | F914: GILLARD 2 | I914: NICOLAOU 2 | L914: OWEN 2 | N914: JORDAN | P914: BURROWS | R914: P BROWN | W914: OAKLEIGH | X914: 2 | Y914: 1 | Z914: 15 | AA914: 0 | AB914: 1127 | AC914: 2155 | AD914: =(AB914/AC914)*100 -> 52.296983758700698 | AE914: =(Y914*4)+(AA914*2) -> 4
N915: LAWSON | P915: LUMICISI
A916: WERRIBEE | C916: 4 | D916: 3 | E916: 27 | G916: 8 | H916: 4 | I916: 52 | K916: 17 | L916: 9 | M916: 111 | O916: 19 | P916: 17 | Q916: 131 | S916: Venue: WERRIBEE
A917: COBURG | C917: 5 | D917: 2 | E917: 32 | G917: 6 | H917: 6 | I917: 42 | K917: 8 | L917: 6 | M917: 54 | O917: 17 | P917: 7 | Q917: 109 | S917: FALLET :KEATING
A918: BEST PLAYERS
A919: WERRIBEE | C919: KNIGHT | F919: ALLDAY | I919: McMASTER | L919: FITZPATRICK | O919: EAMES | R919: NORMINGTON
A920: COBURG | C920: BARNES | F920: ZANON | I920: LOONE | L920: GRIFFITHS | O920: HARRINGTON
A921: GOALKICKERS
A922: WERRIBEE | C922: DRUM 4 | E922: DANIHER 3 | H922: O'KEEFE 2 | J922: RAEBURN 2 | M922: KNIGHT 2 | O922: LESIPUTTY 2 | R922: GEARY | T922: EAMES | W922: McMASTER | Y922: McPHERSON
A923: COBURG | C923: GRIFFITHS 5 | F923: ALESSIO 4 | I923: KAAKOUR 2 | L923: ZANON 2 | N923: YOUNG 2 | P923: INGRAM | R923: WILLIAMS
A925: DANDENONG | C925: 8 | D925: 1 | E925: 49 | G925: 8 | H925: 2 | I925: 50 | K925: 18 | L925: 6 | M925: 114 | O925: 28 | P925: 6 | Q925: 174 | S925: Venue: DANDENONG
A926: WILLIAMSTOWN | C926: 1 | D926: 1 | E926: 7 | G926: 6 | H926: 8 | I926: 44 | K926: 8 | L926: 8 | M926: 56 | O926: 13 | P926: 9 | Q926: 87 | S926: CLEMENT :DORE
A927: BEST PLAYERS
A928: DANDENONG | C928: WELSH | F928: READ | I928: HALL | L928: FRANGALAS | O928: BOURKE | R928: KNIGHT
A929: WILLIAMSTOWN | C929: O'CONNOR | F929: ACKERLEY | I929: SWAN | L929: GHAZI
A930: GOALKICKERS
A931: DANDENONG | C931: WELSH 11 | F931: READ 6 | H931: HALL 3 | J931: DOYLE 2 | L931: GOTCH 2 | N931: McKENZIE 2 | Q931: McCONCHIE | T931: WICKS
A932: WILLIAMSTOWN | C932: BURTON 3 | F932: O'CONNOR 3 | I932: TURCINOVICH 2 | L932: RICKMAN | N932: SLEVISON | P932: SWAN | R932: GHAZI | T932: ACKERLEY
A934: SANDRINGHAM | C934: 2 | D934: 5 | E934: 17 | G934: 5 | H934: 5 | I934: 35 | K934: 12 | L934: 7 | M934: 79 | O934: 13 | P934: 8 | Q934: 86 | S934: Venue: OAKLEIGH
A935: OAKLEIGH | C935: 4 | D935: 3 | E935: 27 | G935: 8 | H935: 3 | I935: 51 | K935: 8 | L935: 3 | M935: 51 | O935: 11 | P935: 5 | Q935: 71 | S935: McKERNAN :URWIN
A936: BEST PLAYERS
A937: SANDRINGHAM | C937: ALLEN | F937: C GARRETT | I937: McGANNON | L937: BAILEY | O937: CZERKASKI | R937: KELLAWAY
A938: OAKLEIGH | C938: WELSFORD | F938: MITCHELSON | I938: OWEN | L938: MELLODY | O938: HILLIARD
A939: GOALKICKERS
A940: SANDRINGHAM | C940: F RUGOLO 5 | F940: WILLIAMS 3 | I940: ALLEN | K940: O'CONNOR | M940: MACKENZIE | P940: BONNEY | R940: EDMONDS
A941: OAKLEIGH | C941: OWEN 3 | F941: J CUNNINGHAM 3 | J941: PRETTO 3 | M941: R CUNNINGHAM | P941: MITCHELSON
A943: SPRINGVALE | C943: 3 | D943: 6 | E943: 24 | G943: 7 | H943: 10 | I943: 52 | K943: 13 | L943: 11 | M943: 89 | O943: 19 | P943: 14 | Q943: 128 | S943: Venue: TOORAK PARK
A944: PRAHRAN | C944: 2 | D944: 6 | E944: 18 | G944: 5 | H944: 7 | I944: 37 | K944: 10 | L944: 10 | M944: 70 | O944: 13 | P944: 14 | Q944: 92 | S944: HOWLETT :SNEDDON
A945: BEST PLAYERS
A946: SPRINGVALE | C946: SCURRAH | F946: DUDLEY | I946: MAYLIN | L946: ROBINSON | O946: SMIT | Q946: MALONI
A947: PRAHRAN | C947: CHAPPLE | F947: BOLZON | I947: DIMMATINA | L947: POVEY
A948: GOALKICKERS
A949: SPRINGVALE | C949: ROBINSON 5 | F949: NICOL 4 | H949: SCURRAH 3 | K949: DEMPSTER 3 | N949: KOOP | P949: DUDLEY | R949: MORGAN | U949: CLARKE
A950: PRAHRAN | C950: TAYLOR 3 | F950: MATERA 3 | I950: HUG 3 | K950: DIMMATINA 2 | N950: POVEY | P950: SINNI
A952: ROUND 19 | D952: 17TH AUGUST | I952: WEATHER | S952: Venue: COBURG
D953: 1ST QTR | H953: 2ND QTR | L953: 3RD QTR | P953: FINAL | S953: UMPIRES
A954: WILLIAMSTOWN | C954: 3 | D954: 6 | E954: 24 | G954: 11 | H954: 12 | I954: 78 | K954: 17 | L954: 15 | M954: 117 | O954: 17 | P954: 20 | Q954: 122 | S954: SNEDDON | Y954: LADDER | AB954: ROUND | AD954: 19
A955: COBURG | C955: 6 | D955: 3 | E955: 39 | G955: 10 | H955: 7 | I955: 67 | K955: 13 | L955: 13 | M955: 91 | O955: 15 | P955: 16 | Q955: 106 | S955: AGNEW
A956: BEST PLAYERS | W956: TEAM | X956: B | Y956: W | Z956: L | AA956: D | AB956: FOR | AC956: AGST | AD956: % | AE956: PTS
A957: WILLIAMSTOWN | C957: PASTORE | F957: O'CONNOR | I957: MITCHELL | L957: KENNY | O957: GHAZI | Q957: BURTON
A958: COBURG | C958: BARNES | F958: TARANTO | I958: ZANON | L958: ALESSIO | O958: LITTLER | W958: WERRIBEE | X958: 2 | Y958: 15 | Z958: 2 | AA958: 0 | AB958: 2225 | AC958: 1707 | AD958: =(AB958/AC958)*100 -> 130.34563561804336 | AE958: =(Y958*4)+(AA958*2) -> 60
A959: GOALKICKERS | N959: LLOYD | P959: O'CONNOR | W959: DANDEN0NG | X959: 2 | Y959: 12 | Z959: 5 | AA959: 0 | AB959: 2296 | AC959: 1557 | AD959: =(AB959/AC959)*100 -> 147.46307000642261 | AE959: =(Y959*4)+(AA959*2) -> 48
A960: WILLIAMSTOWN | C960: BURTON 5 | E960: GHAZI 3 | G960: ACKERLEY 2 | J960: McGOWAN 2 | M960: PASTORE 2 | P960: TURCINOVICH | W960: BOX HILL | X960: 2 | Y960: 12 | Z960: 5 | AA960: 0 | AB960: 1914 | AC960: 1657 | AD960: =(AB960/AC960)*100 -> 115.50995775497887 | AE960: =(Y960*4)+(AA960*2) -> 48
A961: COBURG | C961: ALESSIO 4 | F961: KOURKOUMELIS 4 | J961: BAKER 3 | L961: GRIFFITHS 3 | O961: LANGAN | W961: PORT MELBOURNE | X961: 2 | Y961: 11 | Z961: 6 | AA961: 0 | AB961: 1821 | AC961: 1738 | AD961: =(AB961/AC961)*100 -> 104.77560414269276 | AE961: =(Y961*4)+(AA961*2) -> 44
D962: 18TH AUGUST | I962: WEATHER | S962: Venue: BOX HILL | W962: SANDRINGHAM | X962: 2 | Y962: 10 | Z962: 7 | AA962: 0 | AB962: 1933 | AC962: 1709 | AD962: =(AB962/AC962)*100 -> 113.1070801638385 | AE962: =(Y962*4)+(AA962*2) -> 40
A963: PORT MELBOURNE | C963: 5 | D963: 4 | E963: 34 | G963: 9 | H963: 10 | I963: 64 | K963: 14 | L963: 14 | M963: 98 | O963: 23 | P963: 18 | Q963: 156 | S963: FORSTER
A964: BOX HILL | C964: 2 | D964: 3 | E964: 15 | G964: 5 | H964: 6 | I964: 36 | K964: 6 | L964: 10 | M964: 46 | O964: 7 | P964: 12 | Q964: 54 | S964: MORROW | W964: SPRINGVALE | X964: 2 | Y964: 9 | Z964: 8 | AA964: 0 | AB964: 1669 | AC964: 1440 | AD964: =(AB964/AC964)*100 -> 115.90277777777777 | AE964: =(Y964*4)+(AA964*2) -> 36
A965: BEST PLAYERS | W965: PRAHRAN | X965: 2 | Y965: 7 | Z965: 9 | AA965: 1 | AB965: 1791 | AC965: 1756 | AD965: =(AB965/AC965)*100 -> 101.99316628701594 | AE965: =(Y965*4)+(AA965*2) -> 30
A966: PORT MELBOURNE | W966: WILLIAMSTOWN | X966: 2 | Y966: 7 | Z966: 9 | AA966: 1 | AB966: 1711 | AC966: 1696 | AD966: =(AB966/AC966)*100 -> 100.88443396226414 | AE966: =(Y966*4)+(AA966*2) -> 30
A967: BOX HILL | C967: O'NEILL | F967: BOURKE | I967: LISLE | L967: HEANEY | W967: FRANKSTON | X967: 2 | Y967: 7 | Z967: 10 | AA967: 0 | AB967: 1693 | AC967: 1742 | AD967: =(AB967/AC967)*100 -> 97.187141216991961 | AE967: =(Y967*4)+(AA967*2) -> 28
A968: GOALKICKERS | P968: DONALD | W968: COBURG | X968: 2 | Y968: 7 | Z968: 10 | AA968: 0 | AB968: 1694 | AC968: 1797 | AD968: =(AB968/AC968)*100 -> 94.268224819143015 | AE968: =(Y968*4)+(AA968*2) -> 28
A969: PORT MELBOURNE | C969: ASANI 6 | E969: BAILEY 4 | G969: GASPARONI 3 | J969: HARKINS 3 | M969: PAUL 3 | O969: JAMES 2 | Q969: CAMERON | W969: PRESTON | X969: 2 | Y969: 3 | Z969: 14 | AA969: 0 | AB969: 1397 | AC969: 2102 | AD969: =(AB969/AC969)*100 -> 66.46051379638439 | AE969: =(Y969*4)+(AA969*2) -> 12
A970: BOX HILL | C970: BYRNE | E970: DALRYMPLE | H970: DE BOER | J970: DIEULLIO | L970: HAMILTON | N970: HICKS | P970: HOGAN | W970: OAKLEIGH | X970: 2 | Y970: 1 | Z970: 16 | AA970: 0 | AB970: 1155 | AC970: 2307 | AD970: =(AB970/AC970)*100 -> 50.065019505851758 | AE970: =(Y970*4)+(AA970*2) -> 4
A972: FRANKSTON | C972: 2 | D972: 2 | E972: 14 | G972: 12 | H972: 3 | I972: 75 | K972: 17 | L972: 10 | M972: 112 | O972: 20 | P972: 13 | Q972: 133 | S972: Venue: FRANKSTON
A973: DANDENONG | C973: 5 | D973: 3 | E973: 33 | G973: 6 | H973: 3 | I973: 39 | K973: 10 | L973: 5 | M973: 65 | O973: 17 | P973: 8 | Q973: 110 | S973: CULLEN :McDONALD
A974: BEST PLAYERS
A975: FRANKSTON | C975: RAVEN | F975: HILLARD | I975: PARKER | L975: MACE | O975: POLLOCK | R975: S HAMILL
A976: DANDENONG | C976: FRANGALAS | F976: MOREY | I976: WELSH
A977: GOALKICKERS
A978: FRANKSTON | C978: MACE 4 | E978: BROWN 4 | G978: GARDNER 3 | J978: RAVEN 2 | L978: HILLARD 2 | N978: S HAMILL 2 | Q978: SOLE | R978: COLLINS | U978: HOLMES
A979: DANDENONG | C979: WELSH 9 | F979: FRANGALAS 4 | I979: MILLANE 2 | L979: McCORMACK | O979: READ
A981: SPRINGVALE | C981: 4 | D981: 2 | E981: 26 | G981: 9 | H981: 6 | I981: 60 | K981: 17 | L981: 7 | M981: 109 | O981: 24 | P981: 8 | Q981: 152 | S981: Venue: OAKLEIGH
A982: OAKLEIGH | C982: 3 | D982: 0 | E982: 18 | G982: 4 | H982: 2 | I982: 26 | K982: 4 | L982: 3 | M982: 27 | O982: 4 | P982: 4 | Q982: 28 | S982: CALLAGHAN :LUCKMAN
A983: BEST PLAYERS
A984: SPRINGVALE | C984: CLARK | F984: DUDLEY | I984: NICOL | L984: DEMPSTER | O984: REECE | R984: P MALONI
A985: OAKLEIGH | C985: SHARP | F985: TODD | I985: OWEN | L985: HILLIARD
A986: GOALKICKERS
A987: SPRINGVALE | C987: NICOL 8 | F987: ROBINSON 5 | I987: DEMPSTER 4 | L987: M MALONI 3 | O987: McDONOUGH | R987: DUDLEY | U987: MENDE | X987: REECE
A988: OAKLEIGH | C988: PRETTO 2 | F988: TODD 2
A990: PRAHRAN | C990: 5 | D990: 2 | E990: 32 | G990: 12 | H990: 6 | I990: 78 | K990: 15 | L990: 10 | M990: 100 | O990: 20 | P990: 16 | Q990: 136 | S990: Venue: TOORAK PARK
A991: PRESTON | C991: 2 | D991: 2 | E991: 14 | G991: 2 | H991: 5 | I991: 17 | K991: 8 | L991: 10 | M991: 58 | O991: 11 | P991: 14 | Q991: 80 | S991: URWIN :McKERNAN
A992: BEST PLAYERS
A993: PRAHRAN | C993: ORIGLASSO | F993: POVEY | I993: BOLZON | L993: CHAPPLE | O993: SHELTON | R993: MATERA
A994: PRESTON | C994: KING | F994: NICOLAOU | I994: BROWN | L994: LUMICISI | O994: KERR | R994: PERCY
A995: GOALKICKERS
A996: PRAHRAN | C996: WEEDING 4 | F996: HUG 4 | H996: POVEY 3 | J996: SHELTON 3 | M996: CAMERON 2 | P996: DIMMATINA | R996: MATERA | U996: MITCHELL | Y996: ODGERS
A997: PRESTON | C997: JORDAN 3 | F997: LUMICISI 2 | I997: OWEN | K997: GRAZIANO | M997: GILLARD | O997: HALAS | Q997: MITCHELL | S997: BROWN
A999: WERRIBEE | C999: 7 | D999: 5 | E999: 47 | G999: 13 | H999: 8 | I999: 86 | K999: 16 | L999: 8 | M999: 104 | O999: 22 | P999: 12 | Q999: 144 | S999: Venue: BEACH ROAD
A1000: SANDRINGHAM | C1000: 1 | D1000: 3 | E1000: 9 | G1000: 4 | H1000: 8 | I1000: 32 | K1000: 13 | L1000: 14 | M1000: 92 | O1000: 19 | P1000: 17 | Q1000: 131 | S1000: HOWLETT :VINEY
A1001: BEST PLAYERS
A1002: WERRIBEE | C1002: CHAPMAN | F1002: LESIPUTTY | I1002: MORGAN | L1002: FITZPATRICK | O1002: EAMES | R1002: MCMASTER
A1003: SANDRINGHAM | C1003: J RUGOLO | F1003: ALLEN | I1003: RYAN | L1003: BAILEY | O1003: HALPHEN | R1003: BONNEY
A1004: GOALKICKERS
A1005: WERRIBEE | C1005: O'KEEFE 7 | F1005: DANIHER 4 | I1005: DRUM 3 | K1005: RAEBURN 2 | N1005: KNIGHT 2 | P1005: GEARY | R1005: MORGAN | U1005: LESIPUTTY | Y1005: McMASTER
A1006: SANDRINGHAM | C1006: F RUGOLO 4 | F1006: J RUGOLO 3 | I1006: RYAN 3 | K1006: FISCHER 2 | M1006: OGG 2 | O1006: BONNEY | Q1006: ALLEN | S1006: CZERKASKI | W1006: O'CONNOR | Y1006: BAILEY
A1008: ROUND 20 | D1008: 24TH AUGUST | I1008: WEATHER | S1008: Venue: DANDENONG
D1009: 1ST QTR | H1009: 2ND QTR | L1009: 3RD QTR | P1009: FINAL | S1009: UMPIRES
A1010: DANDENONG | C1010: 1 | D1010: 5 | E1010: 11 | G1010: 4 | H1010: 6 | I1010: 30 | K1010: 9 | L1010: 8 | M1010: 62 | O1010: 10 | P1010: 8 | Q1010: 68 | S1010: SNEDDON | Y1010: LADDER | AB1010: ROUND | AD1010: 20
A1011: BOX HILL | C1011: 2 | D1011: 3 | E1011: 15 | G1011: 2 | H1011: 6 | I1011: 18 | K1011: 4 | L1011: 8 | M1011: 32 | O1011: 6 | P1011: 10 | Q1011: 46 | S1011: HOWLETT
A1012: BEST PLAYERS | W1012: TEAM | X1012: B | Y1012: W | Z1012: L | AA1012: D | AB1012: FOR | AC1012: AGST | AD1012: % | AE1012: PTS
A1013: DANDENONG
A1014: BOX HILL | W1014: WERRIBEE | X1014: 2 | Y1014: 15 | Z1014: 3 | AA1014: 0 | AB1014: 2335 | AC1014: 1840 | AD1014: =(AB1014/AC1014)*100 -> 126.90217391304348 | AE1014: =(Y1014*4)+(AA1014*2) -> 60
A1015: GOALKICKERS | W1015: DANDEN0NG | X1015: 2 | Y1015: 13 | Z1015: 5 | AA1015: 0 | AB1015: 2364 | AC1015: 1603 | AD1015: =(AB1015/AC1015)*100 -> 147.47348721147847 | AE1015: =(Y1015*4)+(AA1015*2) -> 52
A1016: DANDENONG | W1016: BOX HILL | X1016: 2 | Y1016: 12 | Z1016: 6 | AA1016: 0 | AB1016: 1960 | AC1016: 1725 | AD1016: =(AB1016/AC1016)*100 -> 113.62318840579711 | AE1016: =(Y1016*4)+(AA1016*2) -> 48
A1017: BOX HILL | W1017: PORT MELBOURNE | X1017: 2 | Y1017: 12 | Z1017: 6 | AA1017: 0 | AB1017: 1954 | AC1017: 1848 | AD1017: =(AB1017/AC1017)*100 -> 105.73593073593072 | AE1017: =(Y1017*4)+(AA1017*2) -> 48
D1018: 25TH AUGUST | S1018: Venue: COBURG | W1018: SPRINGVALE | X1018: 2 | Y1018: 10 | Z1018: 8 | AA1018: 0 | AB1018: 1865 | AC1018: 1503 | AD1018: =(AB1018/AC1018)*100 -> 124.08516300731868 | AE1018: =(Y1018*4)+(AA1018*2) -> 40
A1019: OAKLEIGH | C1019: 3 | D1019: 4 | E1019: 22 | G1019: 8 | H1019: 7 | I1019: 55 | K1019: 11 | L1019: 15 | M1019: 81 | O1019: 16 | P1019: 17 | Q1019: 113 | S1019: GERSCH
A1020: COBURG | C1020: 7 | D1020: 7 | E1020: 49 | G1020: 10 | H1020: 10 | I1020: 70 | K1020: 11 | L1020: 12 | M1020: 78 | O1020: 16 | P1020: 13 | Q1020: 109 | S1020: ANTHONY | W1020: SANDRINGHAM | X1020: 2 | Y1020: 10 | Z1020: 8 | AA1020: 0 | AB1020: 2015 | AC1020: 1874 | AD1020: =(AB1020/AC1020)*100 -> 107.5240128068303 | AE1020: =(Y1020*4)+(AA1020*2) -> 40
A1021: BEST PLAYERS | W1021: WILLIAMSTOWN | X1021: 2 | Y1021: 8 | Z1021: 9 | AA1021: 1 | AB1021: 1876 | AC1021: 1778 | AD1021: =(AB1021/AC1021)*100 -> 105.51181102362204 | AE1021: =(Y1021*4)+(AA1021*2) -> 34
A1022: OAKLEIGH | W1022: FRANKSTON | X1022: 2 | Y1022: 8 | Z1022: 10 | AA1022: 0 | AB1022: 1828 | AC1022: 1863 | AD1022: =(AB1022/AC1022)*100 -> 98.121309715512623 | AE1022: =(Y1022*4)+(AA1022*2) -> 32
A1023: COBURG | W1023: PRAHRAN | X1023: 2 | Y1023: 7 | Z1023: 10 | AA1023: 1 | AB1023: 1912 | AC1023: 1891 | AD1023: =(AB1023/AC1023)*100 -> 101.11052353252248 | AE1023: =(Y1023*4)+(AA1023*2) -> 30
A1024: GOALKICKERS | W1024: COBURG | X1024: 2 | Y1024: 7 | Z1024: 11 | AA1024: 0 | AB1024: 1803 | AC1024: 1910 | AD1024: =(AB1024/AC1024)*100 -> 94.397905759162299 | AE1024: =(Y1024*4)+(AA1024*2) -> 28
A1025: OAKLEIGH | W1025: PRESTON | X1025: 2 | Y1025: 3 | Z1025: 15 | AA1025: 0 | AB1025: 1460 | AC1025: 2298 | AD1025: =(AB1025/AC1025)*100 -> 63.533507397737168 | AE1025: =(Y1025*4)+(AA1025*2) -> 12
A1026: COBURG | W1026: OAKLEIGH | X1026: 2 | Y1026: 2 | Z1026: 16 | AA1026: 0 | AB1026: 1268 | AC1026: 2416 | AD1026: =(AB1026/AC1026)*100 -> 52.483443708609265 | AE1026: =(Y1026*4)+(AA1026*2) -> 8
A1028: FRANKSTON | C1028: 5 | D1028: 8 | E1028: 38 | G1028: 10 | H1028: 11 | I1028: 71 | K1028: 15 | L1028: 17 | M1028: 107 | O1028: 19 | P1028: 21 | Q1028: 135 | S1028: Venue: FRANKSTON
A1029: PRAHRAN | C1029: 5 | D1029: 1 | E1029: 31 | G1029: 8 | H1029: 4 | I1029: 52 | K1029: 16 | L1029: 7 | M1029: 103 | O1029: 18 | P1029: 13 | Q1029: 121 | S1029: CALLAGHAN :LUCKMAN
A1030: BEST PLAYERS
A1031: FRANKSTON
A1032: PRAHRAN
A1033: GOALKICKERS
A1034: FRANKSTON
A1035: PRAHRAN
A1037: PORT MELBOURNE | C1037: 10 | D1037: 4 | E1037: 64 | G1037: 15 | H1037: 10 | I1037: 100 | K1037: 17 | L1037: 15 | M1037: 117 | O1037: 19 | P1037: 19 | Q1037: 133 | S1037: Venue: PORT MELBOURNE
A1038: WERRIBEE | C1038: 2 | D1038: 2 | E1038: 14 | G1038: 5 | H1038: 9 | I1038: 39 | K1038: 7 | L1038: 14 | M1038: 56 | O1038: 15 | P1038: 20 | Q1038: 110 | S1038: HARVEY :SAVILLE
A1039: BEST PLAYERS
A1040: PORT MELBOURNE
A1041: WERRIBEE
A1042: GOALKICKERS
A1043: PORT MELBOURNE
A1044: WERRIBEE
A1046: SPRINGVALE | C1046: 6 | D1046: 6 | E1046: 42 | G1046: 12 | H1046: 9 | I1046: 81 | K1046: 15 | L1046: 13 | M1046: 103 | O1046: 30 | P1046: 16 | Q1046: 196 | S1046: Venue: PRESTON
A1047: PRESTON | C1047: 3 | D1047: 2 | E1047: 20 | G1047: 6 | H1047: 7 | I1047: 43 | K1047: 9 | L1047: 7 | M1047: 61 | O1047: 9 | P1047: 9 | Q1047: 63 | S1047: FORSTER :McDONALD
A1048: BEST PLAYERS
A1049: SPRINGVALE
A1050: PRESTON
A1051: GOALKICKERS
A1052: SPRINGVALE
A1053: PRESTON
A1055: WILLIAMSTOWN | C1055: 5 | D1055: 2 | E1055: 32 | G1055: 11 | H1055: 5 | I1055: 71 | K1055: 16 | L1055: 10 | M1055: 106 | O1055: 25 | P1055: 15 | Q1055: 165 | S1055: Venue: WILLIAMSTOWN
A1056: SANDRINGHAM | C1056: 4 | D1056: 3 | E1056: 27 | G1056: 6 | H1056: 9 | I1056: 45 | K1056: 8 | L1056: 13 | M1056: 61 | O1056: 11 | P1056: 16 | Q1056: 82 | S1056: MORROW :CARLAND
A1057: BEST PLAYERS
A1058: WILLIAMSTOWN
A1059: SANDRINGHAM
A1060: GOALKICKERS
A1061: WILLIAMSTOWN
A1062: SANDRINGHAM
A1064: FINALS
A1065: ELIMINATION | D1065: 31ST AUGUST | I1065: WEATHER
D1066: 1ST QTR | H1066: 2ND QTR | L1066: 3RD QTR | P1066: FINAL | S1066: Venue: PORT MELBOURNE
A1067: SPRINGVALE | C1067: 3 | D1067: 4 | E1067: 22 | G1067: 8 | H1067: 7 | I1067: 55 | K1067: 10 | L1067: 9 | M1067: 69 | O1067: 14 | P1067: 12 | Q1067: 96 | S1067: UMPIRES
A1068: PORT MELBOURNE | C1068: 4 | D1068: 5 | E1068: 29 | G1068: 6 | H1068: 7 | I1068: 43 | K1068: 9 | L1068: 10 | M1068: 64 | O1068: 12 | P1068: 10 | Q1068: 82 | S1068: CARLAND :HOWLETT
A1069: BEST PLAYERS
A1070: SPRINGVALE
A1071: PORT MELBOURNE
A1072: GOALKICKERS
A1073: SPRINGVALE
A1074: PORT MELBOURNE
A1076: QUALIFYING | D1076: 1ST SEPTEMBER | I1076: WEATHER
A1077: DANDENONG | C1077: 9 | D1077: 2 | E1077: 56 | G1077: 9 | H1077: 7 | I1077: 61 | K1077: 13 | L1077: 11 | M1077: 89 | O1077: 19 | P1077: 15 | Q1077: 129 | S1077: Venue: PORT MELBOURNE
A1078: BOX HILL | C1078: 5 | D1078: 1 | E1078: 31 | G1078: 6 | H1078: 2 | I1078: 38 | K1078: 12 | L1078: 8 | M1078: 80 | O1078: 16 | P1078: 7 | Q1078: 103 | S1078: FORSTER :McDONALD
A1079: BEST PLAYERS
A1080: DANDENONG
A1081: BOX HILL
A1082: GOALKICKERS
A1083: DANDENONG
A1084: BOX HILL
A1086: 1ST SEMI | D1086: 7/8TH SEPTEMBER | I1086: WEATHER
A1087: BOX HILL | C1087: 3 | D1087: 1 | E1087: 19 | G1087: 6 | H1087: 2 | I1087: 38 | K1087: 12 | L1087: 7 | M1087: 79 | O1087: 15 | P1087: 10 | Q1087: 100 | S1087: Venue: PORT MELBOURNE
A1088: SPRINGVALE | C1088: 4 | D1088: 5 | E1088: 29 | G1088: 8 | H1088: 7 | I1088: 55 | K1088: 8 | L1088: 11 | M1088: 59 | O1088: 13 | P1088: 14 | Q1088: 92
A1089: BEST PLAYERS
A1090: BOX HILL
A1091: SPRINGVALE
A1092: GOALKICKERS
A1093: BOX HILL
A1094: SPRINGVALE
A1096: 2ND SEMI | D1096: 7/8TH SEPTEMBER | I1096: WEATHER
A1097: WERRIBEE | C1097: 5 | D1097: 5 | E1097: 35 | G1097: 8 | H1097: 6 | I1097: 54 | K1097: 12 | L1097: 7 | M1097: 79 | O1097: 16 | P1097: 9 | Q1097: 105 | S1097: Venue: PORT MELBOURNE
A1098: DANDENONG | C1098: 0 | D1098: 4 | E1098: 4 | G1098: 5 | H1098: 12 | I1098: 42 | K1098: 8 | L1098: 16 | M1098: 64 | O1098: 11 | P1098: 27 | Q1098: 93
A1099: BEST PLAYERS
A1100: WERRIBEE
A1101: DANDENONG
A1102: GOALKICKERS
A1103: WERRIBEE
A1104: DANDENONG
A1106: PRELIMINARY | D1106: 15TH SEPTEMBER | I1106: WEATHER
A1107: DANDENONG | C1107: 5 | D1107: 2 | E1107: 32 | G1107: 7 | H1107: 7 | I1107: 49 | K1107: 14 | L1107: 9 | M1107: 93 | O1107: 24 | P1107: 15 | Q1107: 159 | S1107: Venue: PORT MELBOURNE
A1108: BOX HILL | C1108: 3 | D1108: 2 | E1108: 20 | G1108: 6 | H1108: 1 | I1108: 37 | K1108: 9 | L1108: 9 | M1108: 63 | O1108: 14 | P1108: 10 | Q1108: 94 | S1108: CAREY :KENNEDY
A1109: BEST PLAYERS
A1110: DANDENONG
A1111: BOX HILL
A1112: GOALKICKERS
A1113: DANDENONG
A1114: BOX HILL
A1116: GRAND | D1116: 22ND SEPTEMBER | I1116: WEATHER
A1117: DANDENONG | C1117: 4 | D1117: 0 | E1117: 24 | G1117: 4 | H1117: 6 | I1117: 30 | K1117: 11 | L1117: 13 | M1117: 79 | O1117: 15 | P1117: 15 | Q1117: 105 | S1117: Venue: PRINCES PARK (CARLTON)
A1118: WERRIBEE | C1118: 3 | D1118: 4 | E1118: 22 | G1118: 8 | H1118: 6 | I1118: 54 | K1118: 11 | L1118: 8 | M1118: 74 | O1118: 14 | P1118: 12 | Q1118: 96 | S1118: CAREY :MORROW
A1119: BEST PLAYERS
A1120: DANDENONG
A1121: WERRIBEE
A1122: GOALKICKERS
A1123: DANDENONG | C1123: WELSH 4 | E1123: GOTCH 4 | G1123: MILLANE 2 | I1123: ATKINSON | K1123: DOYLE | M1123: ELSHAUG | O1123: McKENZIE | Q1123: WICKS
A1124: WERRIBEE | C1124: DRUM 2 | E1124: EAMES 2 | G1124: MORGAN 2 | I1124: SELLS 2 | K1124: HARRIS | M1124: KNIGHT | O1124: LESIPUTTY | Q1124: NORMINGTON | T1124: O'KEEFE | X1124: WALSH