A1: Victorian Football Association
A2: Season 1992
A3: © Copyright Wal Williams | F3: First created: 1 September 2016
A4: Contact: joywalwi at gmail dot com | F4: Last updated: 1 September 2016 | W4: VFA Results and tables - Link to the main index page
A5: You are free to copy this document in whole or part provided that proper acknowledgement is given to the author. All rights reserved.
A7: 1992 | C7: 1ST DIVISION
A8: ROUND 1 | D8: 11TH APRIL | I8: WEATHER | S8: Venue: DANDENONG
D9: 1ST QTR | H9: 2ND QTR | L9: 3RD QTR | P9: FINAL | S9: UMPIRES
A10: WERRIBEE | C10: 6 | D10: 4 | E10: 40 | G10: 16 | H10: 5 | I10: 101 | K10: 19 | L10: 7 | M10: 121 | O10: 30 | P10: 11 | Q10: 191 | S10: RUSSO | Y10: LADDER | AB10: ROUND | AD10: 1
A11: DANDENONG | C11: 7 | D11: 0 | E11: 42 | G11: 10 | H11: 1 | I11: 61 | K11: 18 | L11: 3 | M11: 111 | O11: 21 | P11: 8 | Q11: 134 | S11: MORROW
A12: BEST PLAYERS | W12: TEAM | X12: W | Y12: L | Z12: D | AA12: FOR | AB12: AGST | AC12: % | AD12: PTS
A13: WERRIBEE | C13: GEARY | F13: DRUM | I13: RAEBURN | L13: ALLDAY | O13: EAMES | Q13: CULLEN
A14: DANDENONG | C14: LACKO | F14: MARSHALL | I14: HOLLOW | L14: BOURKE | O14: DOYLE | Q14: GOTCH | W14: FRANKSTON | X14: 1 | Y14: 0 | Z14: 0 | AA14: 173 | AB14: 63 | AC14: =(AA14/AB14)*100 -> 274.60317460317458 | AD14: =(X14*4)+(Z14*2) -> 4
A15: GOALKICKERS | L15: ALDERDICE 2 | O15: MORGAN | Q15: RYAN | S15: MADIGAN | W15: SPRINGVALE | X15: 1 | Y15: 0 | Z15: 0 | AA15: 125 | AB15: 66 | AC15: =(AA15/AB15)*100 -> 189.39393939393941 | AD15: =(X15*4)+(Z15*2) -> 4
A16: WERRIBEE | C16: DRUM 6 | E16: TAYLOR 5 | G16: CULLEN 3 | I16: EAMES 3 | K16: McMASTER 3 | N16: MURPHY 3 | Q16: RAEBURN 2 | W16: BOX HILL | X16: 1 | Y16: 0 | Z16: 0 | AA16: 100 | AB16: 66 | AC16: =(AA16/AB16)*100 -> 151.5151515151515 | AD16: =(X16*4)+(Z16*2) -> 4
A17: DANDENONG | C17: BOURKE 4 | E17: CASSETT 4 | H17: GOTCH 4 | J17: MARSHALL 2 | M17: MEAD 2 | O17: DOWER | Q17: HALL | R17: MILLANE | W17: WERRIBEE | X17: 1 | Y17: 0 | Z17: 0 | AA17: 191 | AB17: 134 | AC17: =(AA17/AB17)*100 -> 142.53731343283582 | AD17: =(X17*4)+(Z17*2) -> 4
D18: 18TH APRIL | I18: WEATHER | N18: DOYLE | P18: MILLIGAN | S18: Venue: WILLIAMSTOWN | W18: WILLIAMSTOWN | X18: 1 | Y18: 0 | Z18: 0 | AA18: 148 | AB18: 104 | AC18: =(AA18/AB18)*100 -> 142.30769230769232 | AD18: =(X18*4)+(Z18*2) -> 4
A19: WILLIAMSTOWN | C19: 8 | D19: 1 | E19: 49 | G19: 16 | H19: 3 | I19: 99 | K19: 20 | L19: 14 | M19: 134 | O19: 22 | P19: 16 | Q19: 148 | S19: DORE
A20: SANDRINGHAM | C20: 1 | D20: 2 | E20: 8 | G20: 10 | H20: 4 | I20: 64 | K20: 11 | L20: 4 | M20: 70 | O20: 16 | P20: 8 | Q20: 104 | S20: CALLAGHAN | W20: PRESTON | X20: 1 | Y20: 0 | Z20: 0 | AA20: 86 | AB20: 77 | AC20: =(AA20/AB20)*100 -> 111.68831168831169 | AD20: =(X20*4)+(Z20*2) -> 4
A21: BEST PLAYERS | W21: COBURG | X21: 0 | Y21: 1 | Z21: 0 | AA21: 77 | AB21: 86 | AC21: =(AA21/AB21)*100 -> 89.534883720930239 | AD21: =(X21*4)+(Z21*2) -> 0
A22: WILLIAMSTOWN | C22: HOWLETT | F22: SHANKS | I22: PASTORE | L22: GHAZI | O22: MITCHELL | R22: SYMONS | W22: SANDRINGHAM | X22: 0 | Y22: 1 | Z22: 0 | AA22: 104 | AB22: 148 | AC22: =(AA22/AB22)*100 -> 70.270270270270274 | AD22: =(X22*4)+(Z22*2) -> 0
A23: SANDRINGHAM | C23: CZERKASKI | F23: KELLAWAY | I23: FOLEY | L23: E FISCHER | O23: F RUGOLO | W23: DANDEN0NG | X23: 0 | Y23: 1 | Z23: 0 | AA23: 134 | AB23: 191 | AC23: =(AA23/AB23)*100 -> 70.157068062827221 | AD23: =(X23*4)+(Z23*2) -> 0
A24: GOALKICKERS | M24: SYMONS | O24: PASTORE | Q24: VENNER | S24: GOULD | W24: PRAHRAN | X24: 0 | Y24: 1 | Z24: 0 | AA24: 66 | AB24: 100 | AC24: =(AA24/AB24)*100 -> 66 | AD24: =(X24*4)+(Z24*2) -> 0
A25: WILLIAMSTOWN | C25: RICKMAN 6 | F25: SHANKS 3 | I25: HARRIS 2 | K25: GHAZI 2 | M25: JOHANSEN 2 | P25: O'CONNOR 2 | R25: MILES | W25: PORT MELBOURNE | X25: 0 | Y25: 1 | Z25: 0 | AA25: 66 | AB25: 125 | AC25: =(AA25/AB25)*100 -> 52.8 | AD25: =(X25*4)+(Z25*2) -> 0
A26: SANDRINGHAM | C26: F RUGOLO 7 | F26: FOLEY 3 | H26: E FISCHER 2 | J26: KRAKOUER | M26: WILSON | O26: AUBREY | Q26: ALLEN | W26: OAKLEIGH | X26: 0 | Y26: 1 | Z26: 0 | AA26: 63 | AB26: 173 | AC26: =(AA26/AB26)*100 -> 36.416184971098261 | AD26: =(X26*4)+(Z26*2) -> 0
D27: 19TH APRIL | I27: WEATHER
A28: BOX HILL | C28: 4 | D28: 7 | E28: 31 | G28: 7 | H28: 9 | I28: 51 | K28: 12 | L28: 13 | M28: 85 | O28: 14 | P28: 16 | Q28: 100 | S28: Venue: BOX HILL
A29: PRAHRAN | C29: 2 | D29: 2 | E29: 14 | G29: 4 | H29: 5 | I29: 29 | K29: 6 | L29: 8 | M29: 44 | O29: 9 | P29: 12 | Q29: 66 | S29: SHEEHAN :HOLT
A30: BEST PLAYERS
A31: BOX HILL | C31: HEANEY | F31: O'NEILL | I31: P BOURKE | L31: PENNY | O31: BANFIELD | R31: WATSON
A32: PRAHRAN | C32: LENNOX | F32: CHAPPLE | I32: KILEY | L32: WALFORD | O32: LUCAS
A33: GOALKICKERS
A34: BOX HILL | C34: DALY 3 | E34: P BOURKE 2 | H34: BRUSNAHAN 2 | K34: WATSON 2 | M34: ZARAFA 2 | O34: DEBOER | Q34: DWYER | S34: MARK ERWIN
A35: PRAHRAN | C35: MRAKOV 4 | F35: BRUNI 2 | H35: KNIGHT | J35: SINNI | L35: DIMMATINA
A37: PRESTON | C37: 7 | D37: 5 | E37: 47 | G37: 8 | H37: 6 | I37: 54 | K37: 12 | L37: 8 | M37: 80 | O37: 13 | P37: 8 | Q37: 86 | S37: Venue: COBURG
A38: COBURG | C38: 0 | D38: 1 | E38: 1 | G38: 6 | H38: 6 | I38: 42 | K38: 7 | L38: 8 | M38: 50 | O38: 11 | P38: 11 | Q38: 77 | S38: PRINCE :CAULFIELD
A39: BEST PLAYERS
A40: PRESTON | C40: BURROWS | F40: ESPENSCHIED | I40: REEVES | L40: MAY | O40: MUNRIVANA
A41: COBURG | C41: SHELDON | F41: FOTIA | I41: RACOVOLIS | L41: ALLISON | O41: GORMAN
A42: GOALKICKERS
A43: PRESTON | C43: JORDAN 4 | F43: FOWLER 2 | I43: NICOLAOU 2 | L43: SEDGEWICK 2 | O43: REEVES | Q43: MAY | R43: KING
A44: COBURG | C44: SULLIVAN 4 | F44: CHRISTIE 3 | I44: INGRAM 2 | K44: ALESSIO | M44: RACOVOLIS
A46: FRANKSTON | C46: 5 | D46: 5 | E46: 35 | G46: 7 | H46: 13 | I46: 55 | K46: 17 | L46: 18 | M46: 120 | O46: 25 | P46: 23 | Q46: 173 | S46: Venue: OAKLEIGH
A47: OAKLEIGH | C47: 3 | D47: 4 | E47: 22 | G47: 5 | H47: 5 | I47: 35 | K47: 7 | L47: 9 | M47: 51 | O47: 9 | P47: 9 | Q47: 63 | S47: UNWIN :HARVEY
A48: BEST PLAYERS
A49: FRANKSTON | C49: PARKER | F49: MARTIN | I49: MACE | L49: GAHAN | O49: S HAMILL | Q49: ALLAN
A50: OAKLEIGH | C50: PANNOZZO | F50: DUNLOP | I50: DI NATALE | L50: MELLODY | O50: QUIRK | Q50: ATHERTON
A51: GOALKICKERS
A52: FRANKSTON | C52: S HAMILL 4 | F52: GAHAN 4 | H52: YOUNG 3 | J52: STROUD 3 | M52: THEODORE 2 | P52: BROWN 2 | R52: GOOSEY | U52: PYM | W52: BOONKAMP | X52: MACE | Z52: GARDNER | AB52: FOOT | AC52: ALLAN
A53: OAKLEIGH | C53: PRETTO 3 | F53: KLEEVAN 2 | I53: SUTHERLAND 2 | L53: DI NATALE | O53: OWEN
A55: SPRINGVALE | C55: 6 | D55: 6 | E55: 42 | G55: 7 | H55: 9 | I55: 51 | K55: 12 | L55: 19 | M55: 91 | O55: 17 | P55: 23 | Q55: 125 | S55: Venue: SPRINGVALE
A56: PORT MELBOURNE | C56: 2 | D56: 3 | E56: 15 | G56: 5 | H56: 6 | I56: 36 | K56: 6 | L56: 7 | M56: 43 | O56: 9 | P56: 12 | Q56: 66 | S56: MURNANE :BROWN
A57: BEST PLAYERS
A58: SPRINGVALE | C58: CLARK | F58: PEACOCK | I58: LYNCH | L58: WILLIAMS | O58: O'DONNELL | R58: SCURRAH
A59: PORT MELBOURNE | C59: McKINNON | F59: BAILEY | I59: STROOPER | L59: HARLAND | O59: HARKINS
A60: GOALKICKERS
A61: SPRINGVALE | C61: WILLIAMS 4 | F61: SIMISTER 3 | I61: KOOP 2 | K61: SCURRAH 2 | M61: PHILLIPS | O61: ELLIOTT | Q61: WEST | R61: CARROLL | U61: TIBBALLS | X61: McKENZIE
A62: PORT MELBOURNE | C62: BAILEY 3 | F62: PAUL 2 | H62: McKINNON 2 | K62: A JAMES | M62: HICKS
A64: ROUND 2 | D64: 25TH APRIL | I64: WEATHER | S64: Venue: PORT MELBOURNE
D65: 1ST QTR | H65: 2ND QTR | L65: 3RD QTR | P65: FINAL | S65: UMPIRES
A66: DANDENONG | C66: 6 | D66: 3 | E66: 39 | G66: 14 | H66: 9 | I66: 93 | K66: 16 | L66: 12 | M66: 108 | O66: 21 | P66: 17 | Q66: 143 | S66: HOLT | Y66: LADDER | AB66: ROUND | AD66: 2
A67: PORT MELBOURNE | C67: 2 | D67: 5 | E67: 17 | G67: 8 | H67: 8 | I67: 56 | K67: 13 | L67: 13 | M67: 91 | O67: 15 | P67: 16 | Q67: 106 | S67: FALLET
A68: BEST PLAYERS | W68: TEAM | X68: W | Y68: L | Z68: D | AA68: FOR | AB68: AGST | AC68: % | AD68: PTS
A69: DANDENONG | C69: KNIGHT | F69: HALL | I69: GOTCH | L69: BOURKE | O69: LACKO | R69: MARSHALL
A70: PORT MELBOURNE | C70: McKINNON | F70: LAFFY | I70: BARLOW | L70: HALL | W70: FRANKSTON | X70: 2 | Y70: 0 | Z70: 0 | AA70: 311 | AB70: 131 | AC70: =(AA70/AB70)*100 -> 237.40458015267177 | AD70: =(X70*4)+(Z70*2) -> 8
A71: GOALKICKERS | Q71: VAN RAAY | W71: PRESTON | X71: 2 | Y71: 0 | Z71: 0 | AA71: 223 | AB71: 211 | AC71: =(AA71/AB71)*100 -> 105.68720379146919 | AD71: =(X71*4)+(Z71*2) -> 8
A72: DANDENONG | C72: GOTCH 5 | E72: WICKS 3 | G72: BOURKE 2 | I72: DOWER 2 | K72: HALL 2 | M72: KNIGHT 2 | O72: LACKO 2 | Q72: CASSETT | S72: MILLIGAN | W72: PRAHRAN | X72: 1 | Y72: 1 | Z72: 0 | AA72: 252 | AB72: 198 | AC72: =(AA72/AB72)*100 -> 127.27272727272727 | AD72: =(X72*4)+(Z72*2) -> 4
A73: PORT MELBOURNE | C73: PAUL 6 | E73: BAILEY 2 | G73: McKINNON 2 | J73: McLEOD | L73: PRITCHARD | N73: SHAW | P73: CAMERON | R73: CLOHESY | W73: COBURG | X73: 1 | Y73: 1 | Z73: 0 | AA73: 192 | AB73: 153 | AC73: =(AA73/AB73)*100 -> 125.49019607843137 | AD73: =(X73*4)+(Z73*2) -> 4
D74: 26TH APRIL | I74: WEATHER | S74: Venue: FRANKSTON | W74: WILLIAMSTOWN | X74: 1 | Y74: 1 | Z74: 0 | AA74: 282 | AB74: 241 | AC74: =(AA74/AB74)*100 -> 117.01244813278009 | AD74: =(X74*4)+(Z74*2) -> 4
A75: FRANKSTON | C75: 2 | D75: 3 | E75: 15 | G75: 9 | H75: 6 | I75: 60 | K75: 14 | L75: 9 | M75: 93 | O75: 21 | P75: 12 | Q75: 138 | S75: LUCKMAN
A76: SPRINGVALE | C76: 3 | D76: 2 | E76: 20 | G76: 5 | H76: 5 | I76: 35 | K76: 7 | L76: 7 | M76: 49 | O76: 9 | P76: 14 | Q76: 68 | S76: MORROW | W76: SANDRINGHAM | X76: 1 | Y76: 1 | Z76: 0 | AA76: 217 | AB76: 209 | AC76: =(AA76/AB76)*100 -> 103.82775119617224 | AD76: =(X76*4)+(Z76*2) -> 4
A77: BEST PLAYERS | W77: WERRIBEE | X77: 1 | Y77: 1 | Z77: 0 | AA77: 258 | AB77: 249 | AC77: =(AA77/AB77)*100 -> 103.6144578313253 | AD77: =(X77*4)+(Z77*2) -> 4
A78: FRANKSTON | C78: ALLAN | F78: PARKER | I78: SAVAGE | L78: MACE | O78: VANDERMEER | R78: GAHAN | W78: SPRINGVALE | X78: 1 | Y78: 1 | Z78: 0 | AA78: 193 | AB78: 204 | AC78: =(AA78/AB78)*100 -> 94.607843137254903 | AD78: =(X78*4)+(Z78*2) -> 4
A79: SPRINGVALE | C79: PEACOCK | F79: CARROLL | I79: CLARK | L79: FOGARTY | O79: WALSH | R79: CAPLES | W79: DANDEN0NG | X79: 1 | Y79: 1 | Z79: 0 | AA79: 277 | AB79: 297 | AC79: =(AA79/AB79)*100 -> 93.265993265993259 | AD79: =(X79*4)+(Z79*2) -> 4
A80: GOALKICKERS | Q80: VANDERMEER | W80: BOX HILL | X80: 1 | Y80: 1 | Z80: 0 | AA80: 161 | AB80: 179 | AC80: =(AA80/AB80)*100 -> 89.944134078212286 | AD80: =(X80*4)+(Z80*2) -> 4
A81: FRANKSTON | C81: MACE 4 | E81: STROUD 4 | G81: GOOSEY 3 | I81: THEODORE 2 | L81: GARDNER 2 | N81: ALLAN 2 | P81: GAHAN 2 | R81: BROWN | W81: PORT MELBOURNE | X81: 0 | Y81: 2 | Z81: 0 | AA81: 172 | AB81: 268 | AC81: =(AA81/AB81)*100 -> 64.179104477611943 | AD81: =(X81*4)+(Z81*2) -> 0
A82: SPRINGVALE | C82: SIMISTER 3 | F82: WEST 3 | H82: IRVING | J82: MORGAN | L82: WALSH | W82: OAKLEIGH | X82: 0 | Y82: 2 | Z82: 0 | AA82: 161 | AB82: 359 | AC82: =(AA82/AB82)*100 -> 44.846796657381617 | AD82: =(X82*4)+(Z82*2) -> 0
A84: PRAHRAN | C84: 6 | D84: 3 | E84: 39 | G84: 15 | H84: 5 | I84: 95 | K84: 19 | L84: 15 | M84: 129 | O84: 28 | P84: 18 | Q84: 186 | S84: Venue: TOORAK PARK
A85: OAKLEIGH | C85: 4 | D85: 2 | E85: 26 | G85: 6 | H85: 6 | I85: 42 | K85: 10 | L85: 8 | M85: 68 | O85: 15 | P85: 8 | Q85: 98 | S85: McBURNEY :CALLAGHAN
A86: BEST PLAYERS
A87: PRAHRAN | C87: TAYLOR | F87: WALFORD | I87: CHAPPLE | L87: WINTON | O87: KILEY | Q87: SCICLUNA
A88: OAKLEIGH | C88: DI NATALE | F88: BULTE | I88: HICKEY | L88: VAIL | O88: DUNLOP
A89: GOALKICKERS
A90: PRAHRAN | C90: TAYLOR 16 | F90: CHAPPLE 3 | I90: SINNI | J90: KILEY | L90: BARRETT | N90: SCICLUNA | P90: WINTON | R90: SHELTON | U90: MRAKOV | X90: MITCHELL | AA90: NOBLE
A91: OAKLEIGH | C91: DI NATALE 3 | F91: SUTHERLAND 2 | I91: PRETTO 2 | K91: OWEN 2 | M91: VAIL 2 | O91: SHARP | Q91: KLEEVAN | S91: MELLODY | V91: TEMPLETON
A93: PRESTON | C93: 7 | D93: 2 | E93: 44 | G93: 11 | H93: 4 | I93: 70 | K93: 17 | L93: 4 | M93: 106 | O93: 22 | P93: 5 | Q93: 137 | S93: Venue: PRESTON
A94: WILLIAMSTOWN | C94: 1 | D94: 2 | E94: 8 | G94: 8 | H94: 4 | I94: 52 | K94: 18 | L94: 8 | M94: 116 | O94: 20 | P94: 14 | Q94: 134 | S94: URWIN :FOSTER
A95: BEST PLAYERS
A96: PRESTON | C96: JORDAN | F96: SHAW | I96: SEDGEWICK | L96: WALKER | O96: LUMICISI
A97: WILLIAMSTOWN | C97: GHAZI | F97: SHANKS | I97: PASTORE | L97: LONG | O97: DWYER
A98: GOALKICKERS
A99: PRESTON | C99: SHAW 9 | F99: SEDGEWICK 4 | I99: LUMICISI 3 | K99: JORDAN 3 | M99: KING | O99: FOWLER | Q99: CARDAMONE
A100: WILLIAMSTOWN | C100: DWYER 4 | F100: RICKMAN 4 | I100: SHANKS 2 | K100: GHAZI 2 | M100: PASTORE 2 | O100: TURCINOVICH 2 | R100: GOULD | T100: JOHNSON | W100: PERRY | X100: MILES
A102: COBURG | C102: 4 | D102: 1 | E102: 25 | G102: 6 | H102: 8 | I102: 44 | K102: 13 | L102: 11 | M102: 89 | O102: 17 | P102: 13 | Q102: 115 | S102: Venue: WERRIBEE
A103: WERRIBEE | C103: 2 | D103: 3 | E103: 15 | G103: 4 | H103: 7 | I103: 31 | K103: 5 | L103: 12 | M103: 42 | O103: 9 | P103: 13 | Q103: 67 | S103: SNEDDON :SAVILLE
A104: BEST PLAYERS
A105: COBURG | C105: SHELDON | F105: RACOVOLIS | I105: FOTIA | L105: HARRINGTON | O105: KENNEDY | Q105: SULLIVAN
A106: WERRIBEE | C106: GEARY | F106: SPIERINGS | I106: FITZPATRICK | L106: ALLDAY
A107: GOALKICKERS
A108: COBURG | C108: SULLIVAN 6 | F108: INGRAM 4 | I108: CHRISTIE 3 | K108: HARRISON | M108: GUMLEY | O108: RACOVOLIS | R108: LOONE
A109: WERRIBEE | C109: TAYLOR 3 | F109: CULLEN 2 | I109: DRUM | K109: EAMES | M109: HUNGERFORD | P109: RYAN
A111: SANDRINGHAM | C111: 2 | D111: 2 | E111: 14 | G111: 10 | H111: 6 | I111: 66 | K111: 11 | L111: 12 | M111: 78 | O111: 16 | P111: 17 | Q111: 113 | S111: Venue: BEACH ROAD
A112: BOX HILL | C112: 3 | D112: 4 | E112: 22 | G112: 3 | H112: 4 | I112: 22 | K112: 5 | L112: 12 | M112: 42 | O112: 7 | P112: 19 | Q112: 61 | S112: AGNEW :CAULFIELD
A113: BEST PLAYERS
A114: SANDRINGHAM | C114: JOHNSTONE | F114: KELLAWAY | I114: ARGUS | L114: MOREY | O114: ALLEN | Q114: P GARRETT
A115: BOX HILL | C115: CROTHERS | F115: LISLE | I115: PENNY | L115: CROWLEY | O115: HOLT | Q115: ZARAFA
A116: GOALKICKERS
A117: SANDRINGHAM | C117: F RUGOLO 4 | F117: WILLIAMS 4 | I117: KRAKOUER 3 | L117: FOLEY 2 | N117: J RUGOLO | Q117: GARRETT | S117: KELLAWAY
A118: BOX HILL | C118: LIVINGSTONE 2 | F118: BRUSNAHAN | I118: DALY | K118: DE BOER | M118: ERWIN | O118: HEANEY
A120: ROUND 3 | D120: 2ND MAY | I120: WEATHER | S120: Venue: TOORAK PARK
D121: 1ST QTR | H121: 2ND QTR | L121: 3RD QTR | P121: FINAL | S121: UMPIRES
A122: PRAHRAN | C122: 6 | D122: 4 | E122: 40 | G122: 10 | H122: 8 | I122: 68 | K122: 15 | L122: 15 | M122: 105 | O122: 23 | P122: 18 | Q122: 156 | S122: ANTHONY | Y122: LADDER | AB122: ROUND | AD122: 3
A123: FRANKSTON | C123: 4 | D123: 2 | E123: 26 | G123: 8 | H123: 4 | I123: 52 | K123: 11 | L123: 5 | M123: 71 | O123: 15 | P123: 11 | Q123: 101 | S123: McKERNAN
A124: BEST PLAYERS | W124: TEAM | X124: W | Y124: L | Z124: D | AA124: FOR | AB124: AGST | AC124: % | AD124: PTS
A125: PRAHRAN | C125: LENNOX | F125: MRAKOV | I125: SINNI | L125: R LANGAN | O125: TAYLOR | Q125: CHAPPLE
A126: FRANKSTON | C126: S HAMILL | F126: GARDNER | I126: THEODORE | L126: PARKER | O126: BELL | W126: BOX HILL | X126: 2 | Y126: 1 | Z126: 0 | AA126: 334 | AB126: 226 | AC126: =(AA126/AB126)*100 -> 147.78761061946904 | AD126: =(X126*4)+(Z126*2) -> 8
A127: GOALKICKERS | Q127: WALFORD | W127: FRANKSTON | X127: 2 | Y127: 1 | Z127: 0 | AA127: 412 | AB127: 287 | AC127: =(AA127/AB127)*100 -> 143.55400696864112 | AD127: =(X127*4)+(Z127*2) -> 8
A128: PRAHRAN | C128: TAYLOR 9 | F128: MRAKOV 5 | I128: TAPPING 2 | K128: DIMMATINA | N128: NOBLE | P128: WINTON | R128: LENNOX | W128: COBURG | X128: 2 | Y128: 1 | Z128: 0 | AA128: 344 | AB128: 251 | AC128: =(AA128/AB128)*100 -> 137.05179282868525 | AD128: =(X128*4)+(Z128*2) -> 8
A129: FRANKSTON | C129: GARDNER 5 | F129: S HAMILL 3 | I129: STROUD 2 | K129: WILLIAMS | M129: BELL | N129: THEODORE | Q129: SAVAGE | W129: PRAHRAN | X129: 2 | Y129: 1 | Z129: 0 | AA129: 408 | AB129: 299 | AC129: =(AA129/AB129)*100 -> 136.45484949832775 | AD129: =(X129*4)+(Z129*2) -> 8
D130: 3RD MAY | I130: WEATHER | O130: VANDERMEER | S130: Venue: BOX HILL | W130: WILLIAMSTOWN | X130: 2 | Y130: 1 | Z130: 0 | AA130: 381 | AB130: 301 | AC130: =(AA130/AB130)*100 -> 126.57807308970099 | AD130: =(X130*4)+(Z130*2) -> 8
A131: BOX HILL | C131: 10 | D131: 3 | E131: 63 | G131: 16 | H131: 6 | I131: 102 | K131: 22 | L131: 13 | M131: 145 | O131: 26 | P131: 17 | Q131: 173 | S131: MORROW
A132: PRESTON | C132: 0 | D132: 3 | E132: 3 | G132: 3 | H132: 3 | I132: 21 | K132: 4 | L132: 6 | M132: 30 | O132: 6 | P132: 11 | Q132: 47 | S132: HARVEY | W132: SANDRINGHAM | X132: 2 | Y132: 1 | Z132: 0 | AA132: 396 | AB132: 316 | AC132: =(AA132/AB132)*100 -> 125.31645569620254 | AD132: =(X132*4)+(Z132*2) -> 8
A133: BEST PLAYERS | W133: DANDEN0NG | X133: 2 | Y133: 1 | Z133: 0 | AA133: 417 | AB133: 386 | AC133: =(AA133/AB133)*100 -> 108.03108808290156 | AD133: =(X133*4)+(Z133*2) -> 8
A134: BOX HILL | C134: LISLE | F134: LIVINGSTONE | I134: BANFIELD | L134: ZARAFA | N134: P BOURKE | Q134: CROWLEY | W134: PRESTON | X134: 2 | Y134: 1 | Z134: 0 | AA134: 270 | AB134: 384 | AC134: =(AA134/AB134)*100 -> 70.3125 | AD134: =(X134*4)+(Z134*2) -> 8
A135: PRESTON | C135: OWEN | W135: WERRIBEE | X135: 1 | Y135: 2 | Z135: 0 | AA135: 318 | AB135: 348 | AC135: =(AA135/AB135)*100 -> 91.379310344827587 | AD135: =(X135*4)+(Z135*2) -> 4
A136: GOALKICKERS | L136: DALRYMPLE | O136: HEANEY | Q136: HOLT | R136: LISLE | W136: SPRINGVALE | X136: 1 | Y136: 2 | Z136: 0 | AA136: 282 | AB136: 344 | AC136: =(AA136/AB136)*100 -> 81.976744186046517 | AD136: =(X136*4)+(Z136*2) -> 4
A137: BOX HILL | C137: BRUSNAHAN 7 | F137: BARREN-TOOP 5 | I137: ERWIN 4 | K137: LIVINGSTONE 4 | N137: P BOURKE | Q137: BUTTIFANT | W137: PORT MELBOURNE | X137: 0 | Y137: 3 | Z137: 0 | AA137: 270 | AB137: 420 | AC137: =(AA137/AB137)*100 -> 64.285714285714292 | AD137: =(X137*4)+(Z137*2) -> 0
A138: PRESTON | C138: LUMICISI 2 | F138: NICOLAOU | I138: GRAZIANO | K138: TUCKER | M138: PERCY | W138: OAKLEIGH | X138: 0 | Y138: 3 | Z138: 0 | AA138: 268 | AB138: 538 | AC138: =(AA138/AB138)*100 -> 49.814126394052046 | AD138: =(X138*4)+(Z138*2) -> 0
A140: SANDRINGHAM | C140: 5 | D140: 4 | E140: 34 | G140: 12 | H140: 8 | I140: 80 | K140: 20 | L140: 13 | M140: 133 | O140: 27 | P140: 17 | Q140: 179 | S140: Venue: OAKLEIGH
A141: OAKLEIGH | C141: 3 | D141: 5 | E141: 23 | G141: 7 | H141: 6 | I141: 48 | K141: 10 | L141: 9 | M141: 69 | O141: 16 | P141: 11 | Q141: 107 | S141: DOOLEY :SNEDDON
A142: BEST PLAYERS
A143: SANDRINGHAM | C143: F RUGOLO | F143: CZERKASKI | I143: KELLAWAY | L143: MITCHELSON
A144: OAKLEIGH | C144: SUTHERLAND | F144: SHARP | I144: BRIGGS | L144: TODD | O144: MELLODY | R144: OWEN
A145: GOALKICKERS
A146: SANDRINGHAM | C146: F RUGOLO 10 | F146: P GARRETT 5 | I146: WILLIAMS 3 | L146: FOLEY 3 | N146: KRAKOUER 2 | Q146: ANGUS | S146: MITCHELSON | W146: TAYLOR | X146: SIDERELLIS
A147: OAKLEIGH | C147: TODD 3 | E147: SUTHERLAND 3 | H147: OWEN 3 | J147: DI NATALE 2 | M147: HIPWORTH | P147: DUNLOP | R147: GARBUIO | U147: VAIL | W147: GORDON
A149: COBURG | C149: 3 | D149: 4 | E149: 22 | G149: 4 | H149: 8 | I149: 32 | K149: 9 | L149: 9 | M149: 63 | O149: 22 | P149: 20 | Q149: 152 | S149: Venue: COBURG
A150: PORT MELBOURNE | C150: 5 | D150: 2 | E150: 32 | G150: 8 | H150: 5 | I150: 53 | K150: 14 | L150: 8 | M150: 92 | O150: 15 | P150: 8 | Q150: 98
A151: BEST PLAYERS
A152: COBURG | C152: ZANON | F152: McDONALD | I152: KENNEDY | L152: FOTIA | O152: SHELDON
A153: PORT MELBOURNE | C153: PRITCHARD | F153: LAFFY | I153: HARKINS | L153: RYDER | O153: McKINNON | R153: DONALD
A154: GOALKICKERS
A155: COBURG | C155: SULLIVAN 6 | F155: ALESSIO 3 | I155: CHRISTIE 3 | L155: SHELDON 2 | N155: RACOVOLIS 2 | Q155: LOONE 2 | S155: BARNES 2 | V155: HARRISON | X155: GUMLEY
A156: PORT MELBOURNE | C156: PAUL 3 | E156: RYDER 3 | G156: HARLAND 2 | J156: O'DONOGHUE 2 | M156: McLEOD | O156: McKINNON | Q156: DONALD | S156: HARKINS | V156: O'KANE
A158: DANDENONG | C158: 5 | D158: 3 | E158: 33 | G158: 8 | H158: 10 | I158: 58 | K158: 15 | L158: 14 | M158: 104 | O158: 21 | P158: 14 | Q158: 140 | S158: Venue: DANDENONG
A159: SPRINGVALE | C159: 3 | D159: 4 | E159: 22 | G159: 6 | H159: 8 | I159: 44 | K159: 8 | L159: 11 | M159: 59 | O159: 12 | P159: 17 | Q159: 89 | S159: SAVILLE :FORSTER
A160: BEST PLAYERS
A161: DANDENONG | C161: MILLANE | F161: DOYLE | I161: HOLLOW | L161: BOURKE | O161: KNIGHT | Q161: HUNT
A162: SPRINGVALE | C162: LYNCH | F162: FOGARTY | I162: KOOP | L162: CAPLES | O162: JEFFS | Q162: O'DONNELL
A163: GOALKICKERS
A164: DANDENONG | C164: PRETTO 7 | F164: MILLANE 5 | I164: KNIGHT 3 | K164: MARSHALL 2 | N164: BOURKE | P164: CASSETT | R164: GOTCH | T164: LACKO
A165: SPRINGVALE | C165: WEST 3 | F165: JEFFS 2 | H165: LYNCH 2 | J165: P SCURRAH 2 | M165: WILLIAMS 2 | O165: SIMISTER
A167: WILLIAMSTOWN | C167: 6 | D167: 3 | E167: 39 | G167: 7 | H167: 6 | I167: 48 | K167: 13 | L167: 9 | M167: 87 | O167: 14 | P167: 15 | Q167: 99 | S167: Venue: WILLIAMSTOWN
A168: WERRIBEE | C168: 2 | D168: 1 | E168: 13 | G168: 4 | H168: 5 | I168: 29 | K168: 6 | L168: 8 | M168: 44 | O168: 8 | P168: 12 | Q168: 60 | S168: VAN BEEK :HOLT
A169: BEST PLAYERS
A170: WILLIAMSTOWN | C170: HARRIS | F170: SHANKS | I170: PERRY | L170: PASTORE | O170: AZIZ
A171: WERRIBEE | C171: ALLDAY | F171: WILKINS | I171: FITZPATRICK | L171: SHEEHAN
A172: GOALKICKERS
A173: WILLIAMSTOWN | C173: GHAZI 4 | F173: HARRIS 3 | I173: SHANKS 2 | K173: PASTORE | M173: ZAMKYL | O173: GOULD | Q173: MILES | S173: SYMONS
A174: WERRIBEE | C174: TAYLOR 3 | F174: MURPHY 3 | I174: EAMES | K174: CULLEN
A178: ROUND 4 | D178: 9TH MAY | I178: WEATHER | S178: Venue: WERRIBEE
D179: 1ST QTR | H179: 2ND QTR | L179: 3RD QTR | P179: FINAL | S179: UMPIRES
A180: WERRIBEE | C180: 4 | D180: 3 | E180: 27 | G180: 8 | H180: 7 | I180: 55 | K180: 14 | L180: 10 | M180: 94 | O180: 21 | P180: 12 | Q180: 138 | S180: SNEDDON | Y180: LADDER | AB180: ROUND | AD180: 4
A181: BOX HILL | C181: 4 | D181: 3 | E181: 27 | G181: 6 | H181: 7 | I181: 43 | K181: 10 | L181: 9 | M181: 69 | O181: 12 | P181: 15 | Q181: 87 | S181: McKERNAN
A182: BEST PLAYERS | W182: TEAM | X182: W | Y182: L | Z182: D | AA182: FOR | AB182: AGST | AC182: % | AD182: PTS
A183: WERRIBEE | C183: GEARY | F183: WRIGHT | I183: ALLDAY | L183: NORMINGTON | O183: CULLEN | Q183: LUPSON
A184: BOX HILL | C184: LIVINGSTONE | F184: BANFIELD | I184: WATSON | L184: ZARAFA | O184: HOGAN | Q184: DALRYMPLE | W184: COBURG | X184: 3 | Y184: 1 | Z184: 0 | AA184: 473 | AB184: 318 | AC184: =(AA184/AB184)*100 -> 148.74213836477986 | AD184: =(X184*4)+(Z184*2) -> 12
A185: GOALKICKERS | I185: LESIPUTTY | K185: EAMES | M185: BUCK | O185: SHEAHAN | Q185: MCCARTHY | W185: SANDRINGHAM | X185: 3 | Y185: 1 | Z185: 0 | AA185: 544 | AB185: 434 | AC185: =(AA185/AB185)*100 -> 125.34562211981566 | AD185: =(X185*4)+(Z185*2) -> 12
A186: WERRIBEE | C186: TAYLOR 3 | E186: MURPHY 3 | G186: WILKINS 2 | I186: CULLEN 2 | K186: ALDERDICE 2 | N186: DRUM 2 | P186: WRIGHT | R186: ALLDAY | W186: DANDEN0NG | X186: 3 | Y186: 1 | Z186: 0 | AA186: 556 | AB186: 447 | AC186: =(AA186/AB186)*100 -> 124.38478747203578 | AD186: =(X186*4)+(Z186*2) -> 12
A187: BOX HILL | C187: BADROCK 2 | F187: BRUSNAHAN 2 | I187: WATSON 2 | K187: DALRYMPLE | N187: ERWIN | P187: EVANS | R187: LIVINGSTONE | W187: PRESTON | X187: 3 | Y187: 1 | Z187: 0 | AA187: 482 | AB187: 500 | AC187: =(AA187/AB187)*100 -> 96.4 | AD187: =(X187*4)+(Z187*2) -> 12
D188: 10TH MAY | I188: WEATHER | M188: O'NEILL | O188: ZARAFA | S188: Venue: SPRINGVALE | W188: PRAHRAN | X188: 2 | Y188: 2 | Z188: 0 | AA188: 526 | AB188: 447 | AC188: =(AA188/AB188)*100 -> 117.67337807606265 | AD188: =(X188*4)+(Z188*2) -> 8
A189: COBURG | C189: 4 | D189: 3 | E189: 27 | G189: 9 | H189: 9 | I189: 63 | K189: 13 | L189: 12 | M189: 90 | O189: 19 | P189: 15 | Q189: 129 | S189: VAN BEEK
A190: SPRINGVALE | C190: 0 | D190: 3 | E190: 3 | G190: 3 | H190: 7 | I190: 25 | K190: 8 | L190: 11 | M190: 59 | O190: 9 | P190: 13 | Q190: 67 | S190: CALLAGHAN | W190: WILLIAMSTOWN | X190: 2 | Y190: 2 | Z190: 0 | AA190: 456 | AB190: 394 | AC190: =(AA190/AB190)*100 -> 115.73604060913705 | AD190: =(X190*4)+(Z190*2) -> 8
A191: BEST PLAYERS | W191: BOX HILL | X191: 2 | Y191: 2 | Z191: 0 | AA191: 421 | AB191: 364 | AC191: =(AA191/AB191)*100 -> 115.65934065934067 | AD191: =(X191*4)+(Z191*2) -> 8
A192: COBURG | C192: ALESSIO | F192: INGRAM | I192: HARRISON | L192: McDONALD | O192: HARRINGTON | R192: BARNES | W192: FRANKSTON | X192: 2 | Y192: 2 | Z192: 0 | AA192: 473 | AB192: 426 | AC192: =(AA192/AB192)*100 -> 111.03286384976525 | AD192: =(X192*4)+(Z192*2) -> 8
A193: SPRINGVALE | C193: CLARK | F193: O'DONNELL | I193: JEFFS | L193: CARROLL | W193: WERRIBEE | X193: 2 | Y193: 2 | Z193: 0 | AA193: 456 | AB193: 435 | AC193: =(AA193/AB193)*100 -> 104.82758620689656 | AD193: =(X193*4)+(Z193*2) -> 8
A194: GOALKICKERS | P194: HARRINGTON | W194: SPRINGVALE | X194: 1 | Y194: 3 | Z194: 0 | AA194: 349 | AB194: 473 | AC194: =(AA194/AB194)*100 -> 73.784355179704022 | AD194: =(X194*4)+(Z194*2) -> 4
A195: COBURG | C195: INGRAM 5 | F195: CHRISTIE 5 | I195: HARRISON 3 | L195: BAKER 2 | N195: GUMLEY | P195: LOONE | R195: FOTIA | W195: PORT MELBOURNE | X195: 1 | Y195: 3 | Z195: 0 | AA195: 363 | AB195: 495 | AC195: =(AA195/AB195)*100 -> 73.333333333333329 | AD195: =(X195*4)+(Z195*2) -> 4
A196: SPRINGVALE | C196: P SCURRAH 2 | F196: CAPLES | H196: CARIS | J196: CARROLL | L196: IRVING | N196: NELSON | P196: PHILLIPS | R196: SIMISTER | W196: OAKLEIGH | X196: 0 | Y196: 4 | Z196: 0 | AA196: 384 | AB196: 750 | AC196: =(AA196/AB196)*100 -> 51.2 | AD196: =(X196*4)+(Z196*2) -> 0
A198: SANDRINGHAM | C198: 3 | D198: 1 | E198: 19 | G198: 13 | H198: 8 | I198: 86 | K198: 17 | L198: 15 | M198: 117 | O198: 21 | P198: 22 | Q198: 148 | S198: Venue: BEACH ROAD
A199: PRAHRAN | C199: 4 | D199: 4 | E199: 28 | G199: 5 | H199: 7 | I199: 37 | K199: 9 | L199: 10 | M199: 64 | O199: 17 | P199: 16 | Q199: 118 | S199: SAVILLE :HARVEY
A200: BEST PLAYERS
A201: SANDRINGHAM | C201: KELLAWAY | F201: P GARRETT | I201: ARGUS | L201: BAILEY | O201: MITCHELSON | R201: ANGUS
A202: PRAHRAN | C202: PROBERT | F202: CHAPPLE | I202: R LANGAN | L202: BOURKE | O202: NOBLE | R202: KILEY
A203: GOALKICKERS
A204: SANDRINGHAM | C204: F RUGOLO 5 | F204: P GARRETT 3 | I204: C GARRETT 3 | L204: TARPEY 3 | N204: E FISCHER 2 | Q204: McGANNON 2 | T204: FOLEY | V204: WILLIAMS | X204: KRAKOUER
A205: PRAHRAN | C205: WALFORD 3 | F205: R LANGAN 2 | I205: WINTON 2 | K205: SCICLUNA 2 | N205: MRAKOV 2 | Q205: NOBLE 2 | S205: DIMMATINA | W205: CHAPPLE | X205: TREWELLA | AA205: KILEY
A207: PORT MELBOURNE | C207: 4 | D207: 1 | E207: 25 | G207: 9 | H207: 2 | I207: 56 | K207: 13 | L207: 4 | M207: 82 | O207: 14 | P207: 9 | Q207: 93 | S207: Venue: PORT MELBOURNE
A208: WILLIAMSTOWN | C208: 4 | D208: 3 | E208: 27 | G208: 5 | H208: 5 | I208: 35 | K208: 8 | L208: 11 | M208: 59 | O208: 10 | P208: 15 | Q208: 75 | S208: DOWLING :FALLET
A209: BEST PLAYERS
A210: PORT MELBOURNE | C210: A JAMES | F210: PRITCHARD | I210: HARKINS | L210: LAFFY | O210: BOWDEN | R210: McKINNON
A211: WILLIAMSTOWN | C211: ACKERLEY | F211: PERRY | I211: LONG | L211: SHANKS | O211: MITCHELL | R211: PASTORE
A212: GOALKICKERS
A213: PORT MELBOURNE | C213: HICKS 3 | E213: McKINNON 3 | H213: DONALD 2 | J213: PAUL 2 | L213: BAILEY | N213: BOWDEN | P213: DONOHUE | R213: RYDER
A214: WILLIAMSTOWN | C214: PASTORE 2 | F214: ZAMKYL 2 | I214: DWYER | K214: JARRIS | M214: GHAZI | O214: KOENIG | Q214: LONG | S214: SHANKS
A216: DANDENONG | C216: 2 | D216: 7 | E216: 19 | G216: 10 | H216: 9 | I216: 69 | K216: 17 | L216: 13 | M216: 115 | O216: 20 | P216: 19 | Q216: 139 | S216: Venue: FRANKSTON
A217: FRANKSTON | C217: 2 | D217: 3 | E217: 15 | G217: 4 | H217: 4 | I217: 28 | K217: 6 | L217: 6 | M217: 42 | O217: 9 | P217: 7 | Q217: 61 | S217: NORDEN :COATES
A218: BEST PLAYERS
A219: DANDENONG | C219: DOYLE | F219: CASSETT | I219: BOURKE | L219: LACKO | O219: HUNT | Q219: PRETTO
A220: FRANKSTON | C220: ALLAN | F220: RYAN | I220: S GARDNER | L220: PYM
A221: GOALKICKERS
A222: DANDENONG | C222: PRETTO 8 | F222: CASSETT 3 | I222: MILLANE 3 | L222: SODERSTROM 2 | O222: BOURKE | Q222: HALL | S222: D KNIGHT | V222: LACKO
A223: FRANKSTON | C223: S GARDNER 5 | F223: STROUD 2 | I223: RYAN | K223: ALLAN
A225: PRESTON | C225: 7 | D225: 5 | E225: 47 | G225: 19 | H225: 7 | I225: 121 | K225: 23 | L225: 11 | M225: 149 | O225: 32 | P225: 20 | Q225: 212 | S225: Venue: PRESTON
A226: OAKLEIGH | C226: 2 | D226: 4 | E226: 16 | G226: 6 | H226: 7 | I226: 43 | K226: 14 | L226: 11 | M226: 95 | O226: 17 | P226: 14 | Q226: 116 | S226: MURNANE :AGNEW
A227: BEST PLAYERS
A228: PRESTON | C228: BURROWS | F228: KERR | I228: KING | L228: MAY | O228: REEVES | R228: SENNO
A229: OAKLEIGH | C229: SUTHERLAND | F229: BRIGGS | I229: GORDON | L229: GARBUIO
A230: GOALKICKERS
A231: PRESTON | C231: JORDAN 8 | F231: SHAW 7 | H231: SEDGEWICK 5 | K231: NICOLAOU 3 | N231: SENNO 2 | P231: MAY 2 | R231: LUMICISI 2 | U231: PEZZIN | W231: TUCKER | Y231: FYFFE
A232: OAKLEIGH | C232: SUTHERLAND 5 | F232: GORDON 4 | I232: VAIL 2 | K232: HIPWORTH | M232: SHARP | O232: DI NATALE | R232: QUIRK | T232: GARBUIO | W232: OWEN
A236: ROUND 5 | D236: 16TH MAY | I236: WEATHER | S236: Venue: COBURG
D237: 1ST QTR | H237: 2ND QTR | L237: 3RD QTR | P237: FINAL | S237: UMPIRES
A238: DANDENONG | C238: 3 | D238: 2 | E238: 20 | G238: 6 | H238: 10 | I238: 46 | K238: 12 | L238: 11 | M238: 83 | O238: 18 | P238: 17 | Q238: 125 | S238: DOWSLEY | Y238: LADDER | AB238: ROUND | AD238: 5
A239: COBURG | C239: 9 | D239: 0 | E239: 54 | G239: 12 | H239: 6 | I239: 78 | K239: 14 | L239: 7 | M239: 91 | O239: 15 | P239: 9 | Q239: 99 | S239: HARVEY
A240: BEST PLAYERS | W240: TEAM | X240: W | Y240: L | Z240: D | AA240: FOR | AB240: AGST | AC240: % | AD240: PTS
A241: DANDENONG | C241: HALL | F241: DOYLE | I241: MILLANE | L241: KNIGHT | O241: MARSHALL | R241: BOURKE
A242: COBURG | C242: SHELDON | F242: RACOVOLIS | I242: HARRISON | L242: RYAN | W242: SANDRINGHAM | X242: 4 | Y242: 1 | Z242: 0 | AA242: 735 | AB242: 508 | AC242: =(AA242/AB242)*100 -> 144.68503937007875 | AD242: =(X242*4)+(Z242*2) -> 16
A243: GOALKICKERS | Q243: PALLANT | W243: DANDEN0NG | X243: 4 | Y243: 1 | Z243: 0 | AA243: 681 | AB243: 546 | AC243: =(AA243/AB243)*100 -> 124.72527472527473 | AD243: =(X243*4)+(Z243*2) -> 16
A244: DANDENONG | C244: MARSHALL 5 | F244: DOYLE 3 | H244: HALL 2 | J244: MEAD 2 | L244: WICKS 2 | N244: BOURKE | P244: CASSETT | R244: MILLANE | W244: BOX HILL | X244: 3 | Y244: 2 | Z244: 0 | AA244: 567 | AB244: 436 | AC244: =(AA244/AB244)*100 -> 130.04587155963304 | AD244: =(X244*4)+(Z244*2) -> 12
A245: COBURG | C245: REYNOLDSON 3 | F245: CHRISTIE 3 | I245: SULLIVAN 2 | L245: RACOVOLIS 2 | O245: LOONE 2 | Q245: INGRAM 2 | S245: BAKER | W245: COBURG | X245: 3 | Y245: 2 | Z245: 0 | AA245: 572 | AB245: 443 | AC245: =(AA245/AB245)*100 -> 129.11963882618511 | AD245: =(X245*4)+(Z245*2) -> 12
D246: 17TH MAY | I246: WEATHER | W246: PRAHRAN | X246: 3 | Y246: 2 | Z246: 0 | AA246: 681 | AB246: 537 | AC246: =(AA246/AB246)*100 -> 126.81564245810056 | AD246: =(X246*4)+(Z246*2) -> 12
A247: BOX HILL | C247: 4 | D247: 3 | E247: 27 | G247: 11 | H247: 3 | I247: 69 | K247: 17 | L247: 5 | M247: 107 | O247: 23 | P247: 8 | Q247: 146 | S247: Venue: PORT MELBOURNE
A248: PORT MELBOURNE | C248: 6 | D248: 3 | E248: 39 | G248: 8 | H248: 8 | I248: 56 | K248: 8 | L248: 10 | M248: 58 | O248: 10 | P248: 12 | Q248: 72 | S248: MURNANE ; VAN BEEK | W248: WILLIAMSTOWN | X248: 3 | Y248: 2 | Z248: 0 | AA248: 548 | AB248: 436 | AC248: =(AA248/AB248)*100 -> 125.68807339449542 | AD248: =(X248*4)+(Z248*2) -> 12
A249: BEST PLAYERS | W249: WERRIBEE | X249: 3 | Y249: 2 | Z249: 0 | AA249: 605 | AB249: 495 | AC249: =(AA249/AB249)*100 -> 122.22222222222223 | AD249: =(X249*4)+(Z249*2) -> 12
A250: BOX HILL | C250: LIVINGSTONE | F250: WATSON | I250: DALRYMPLE | L250: BUTTIFANT | O250: SWAN | Q250: LISLE | W250: PRESTON | X250: 3 | Y250: 2 | Z250: 0 | AA250: 572 | AB250: 655 | AC250: =(AA250/AB250)*100 -> 87.328244274809165 | AD250: =(X250*4)+(Z250*2) -> 12
A251: PORT MELBOURNE | C251: McKINNON | F251: A HICKS | I251: BARLOW | L251: LAFFY | O251: HART | W251: FRANKSTON | X251: 2 | Y251: 3 | Z251: 0 | AA251: 547 | AB251: 617 | AC251: =(AA251/AB251)*100 -> 88.654781199351703 | AD251: =(X251*4)+(Z251*2) -> 8
A252: GOALKICKERS | M252: CROWLEY | P252: DALY | R252: DALRYMPLE | W252: SPRINGVALE | X252: 1 | Y252: 4 | Z252: 0 | AA252: 391 | AB252: 565 | AC252: =(AA252/AB252)*100 -> 69.203539823008853 | AD252: =(X252*4)+(Z252*2) -> 4
A253: BOX HILL | C253: LIVINGSTONE 8 | F253: ZARAFA 4 | I253: BARRON-TOOP 3 | L253: BRUSNAHAN 2 | O253: ERWIN 2 | Q253: BUTTIFANT | W253: PORT MELBOURNE | X253: 1 | Y253: 4 | Z253: 0 | AA253: 435 | AB253: 641 | AC253: =(AA253/AB253)*100 -> 67.862714508580353 | AD253: =(X253*4)+(Z253*2) -> 4
A254: PORT MELBOURNE | C254: PAUL 4 | E254: DONOHUE 2 | H254: KING 2 | J254: McKINNON | M254: CAMERON | W254: OAKLEIGH | X254: 0 | Y254: 5 | Z254: 0 | AA254: 444 | AB254: 899 | AC254: =(AA254/AB254)*100 -> 49.388209121245829 | AD254: =(X254*4)+(Z254*2) -> 0
A256: WERRIBEE | C256: 8 | D256: 4 | E256: 52 | G256: 13 | H256: 7 | I256: 85 | K256: 18 | L256: 10 | M256: 118 | O256: 23 | P256: 11 | Q256: 149 | S256: Venue: OAKLEIGH
A257: OAKLEIGH | C257: 2 | D257: 2 | E257: 14 | G257: 5 | H257: 5 | I257: 35 | K257: 5 | L257: 7 | M257: 37 | O257: 8 | P257: 12 | Q257: 60 | S257: NORDEN :CALLAGHAN
A258: BEST PLAYERS
A259: WERRIBEE | C259: McMASTER | F259: NORMINGTON | I259: ALLDAY | L259: CULLEN | O259: LUPSON | Q259: SHEAHAN
A260: OAKLEIGH | C260: MELLODY | F260: GARBUIO | I260: BULTE | L260: SHARP | O260: TURLEY | Q260: WELSFORD
A261: GOALKICKERS
A262: WERRIBEE | C262: TAYLOR 7 | F262: ALDERDICE 4 | I262: WILKINS 3 | K262: NORMINGTON 2 | N262: CULLEN 2 | P262: FITZPATRICK 2 | S262: MURPHY | V262: LUPSON | X262: MORGAN
A263: OAKLEIGH | C263: MELLODY 2 | F263: OWEN 2 | H263: HIPWORTH | J263: DESSENT | L263: QUIRK | N263: GORDON
A265: PRAHRAN | C265: 2 | D265: 6 | E265: 18 | G265: 5 | H265: 11 | I265: 41 | K265: 14 | L265: 16 | M265: 100 | O265: 22 | P265: 23 | Q265: 155 | S265: Venue: TOORAK PARK
A266: PRESTON | C266: 4 | D266: 3 | E266: 27 | G266: 5 | H266: 6 | I266: 36 | K266: 9 | L266: 10 | M266: 64 | O266: 13 | P266: 12 | Q266: 90 | S266: RICHARDSON ;CARLAND
A267: BEST PLAYERS
A268: PRAHRAN | C268: PROBERT | F268: KILEY | I268: SHELTON | L268: MRAKOV | O268: R LANGAN | R268: NOBLE
A269: PRESTON | C269: REEVES | F269: MUNRIVANA | I269: NICOLAOU | L269: BIZZOTTO
A270: GOALKICKERS
A271: PRAHRAN | C271: MRAKOV 8 | F271: NOBLE 4 | H271: POVEY 3 | J271: SINNI 2 | L271: DAVIS | N271: WINTON | P271: KILEY | R271: BARRINGTON | V271: DIMMATINA
A272: PRESTON | C272: NICOLAOU 3 | F272: SEDGEWICK 3 | I272: REEVES 2 | K272: WALKER 2 | M272: JORDAN | O272: PEZZIN | Q272: KING
A274: SANDRINGHAM | C274: 4 | D274: 2 | E274: 26 | G274: 13 | H274: 7 | I274: 85 | K274: 20 | L274: 14 | M274: 134 | O274: 28 | P274: 23 | Q274: 191 | S274: Venue: BEACH ROAD
A275: FRANKSTON | C275: 1 | D275: 9 | E275: 15 | G275: 5 | H275: 11 | I275: 41 | K275: 6 | L275: 12 | M275: 48 | O275: 10 | P275: 14 | Q275: 74 | S275: McKERNAN :NASH
A276: BEST PLAYERS
A277: SANDRINGHAM | C277: KELLAWAY | F277: ALLEN | I277: CZERKASKI | L277: WILLIAMS | O277: TARPEY | Q277: JOHNSTONE
A278: FRANKSTON | C278: HAMILL | F278: PARKER
A279: GOALKICKERS
A280: SANDRINGHAM | C280: F RUGOLO 7 | F280: P GARRETT 6 | I280: TARPEY 6 | K280: WILLIAMS 5 | N280: FOLEY 2 | P280: C GARRETT | S280: KRAKOUER
A281: FRANKSTON | C281: RYAN 4 | F281: HAMILL 2 | I281: ALLAN | K281: BELL | M281: THEODORE | P281: GILBERT
A283: WILLIAMSTOWN | C283: 5 | D283: 4 | E283: 34 | G283: 7 | H283: 7 | I283: 49 | K283: 12 | L283: 11 | M283: 83 | O283: 13 | P283: 14 | Q283: 92 | S283: Venue: WILLIAMSTOWN
A284: SPRINGVALE | C284: 3 | D284: 1 | E284: 19 | G284: 4 | H284: 3 | I284: 27 | K284: 4 | L284: 7 | M284: 31 | O284: 5 | P284: 12 | Q284: 42 | S284: SNEDDON :MORROW
A285: BEST PLAYERS
A286: WILLIAMSTOWN | C286: PERRY | F286: O'CONNOR | I286: RICKMAN | L286: MITCHELL | O286: LLOYD | Q286: McTAGGART
A287: SPRINGVALE | C287: S SCURRAH | F287: CAPLES | I287: CLARK | L287: O'DONNELL | O287: LYNCH | Q287: SIMISTER
A288: GOALKICKERS
A289: WILLIAMSTOWN | C289: RICKMAN 4 | F289: O'CONNOR 2 | I289: AZIZ 2 | K289: SHANKS | M289: MILES | O289: SYMONS | Q289: McTAGGART | T289: GHAZI
A290: SPRINGVALE | C290: CAPLES | F290: FERGUSON | I290: O'DONNELL | L290: S SCURRAH | O290: SIMISTER
A292: ROUND 6 | D292: 23RD MAY | I292: WEATHER | S292: Venue: BOX HILL
D293: 1ST QTR | H293: 2ND QTR | L293: 3RD QTR | P293: FINAL | S293: UMPIRES
A294: BOX HILL | C294: 3 | D294: 1 | E294: 19 | G294: 10 | H294: 4 | I294: 64 | K294: 17 | L294: 6 | M294: 108 | O294: 23 | P294: 11 | Q294: 149 | S294: RICHARDSON | Y294: LADDER | AB294: ROUND | AD294: 6
A295: SPRINGVALE | C295: 5 | D295: 5 | E295: 35 | G295: 9 | H295: 8 | I295: 62 | K295: 13 | L295: 11 | M295: 89 | O295: 15 | P295: 12 | Q295: 102 | S295: VINEY
A296: BEST PLAYERS | W296: TEAM | X296: W | Y296: L | Z296: D | AA296: FOR | AB296: AGST | AC296: % | AD296: PTS
A297: BOX HILL | C297: WATSON | F297: DALRYMPLE | I297: SWAN | L297: DALY | O297: BADROCK | R297: ERWIN
A298: SPRINGVALE | C298: CLARK | F298: NELSON | I298: FOGARTY | L298: O'DONNELL | O298: P SCURRAH | R298: PEACOCK | W298: SANDRINGHAM | X298: 5 | Y298: 1 | Z298: 0 | AA298: 908 | AB298: 611 | AC298: =(AA298/AB298)*100 -> 148.60883797054009 | AD298: =(X298*4)+(Z298*2) -> 20
A299: GOALKICKERS | M299: LIVINGSTONE | P299: PENNY | R299: SWAN | W299: PRAHRAN | X299: 4 | Y299: 2 | Z299: 0 | AA299: 801 | AB299: 600 | AC299: =(AA299/AB299)*100 -> 133.5 | AD299: =(X299*4)+(Z299*2) -> 16
A300: BOX HILL | C300: DALY 6 | E300: BADROCK 4 | H300: ZARAFA 4 | J300: ERWIN 3 | L300: CROWLEY | N300: DALRYMPLE | Q300: EVANS | W300: BOX HILL | X300: 4 | Y300: 2 | Z300: 0 | AA300: 716 | AB300: 538 | AC300: =(AA300/AB300)*100 -> 133.08550185873605 | AD300: =(X300*4)+(Z300*2) -> 16
A301: SPRINGVALE | C301: CAPLES 3 | E301: PHILLIPS 2 | G301: P SCURRAH 2 | J301: SIMISTER 2 | M301: ELLIOTT | O301: CARIS | Q301: S SCURRAH | W301: WILLIAMSTOWN | X301: 4 | Y301: 2 | Z301: 0 | AA301: 644 | AB301: 486 | AC301: =(AA301/AB301)*100 -> 132.51028806584361 | AD301: =(X301*4)+(Z301*2) -> 16
D302: 30TH MAY | I302: WEATHER | K302: CLARK | M302: O'DONNELL | O302: WILLIAMS | S302: Venue: PRESTON | W302: COBURG | X302: 4 | Y302: 2 | Z302: 0 | AA302: 690 | AB302: 521 | AC302: =(AA302/AB302)*100 -> 132.43761996161228 | AD302: =(X302*4)+(Z302*2) -> 16
A303: SANDRINGHAM | C303: 3 | D303: 3 | E303: 21 | G303: 13 | H303: 7 | I303: 85 | K303: 21 | L303: 14 | M303: 140 | O303: 26 | P303: 17 | Q303: 173 | S303: PRINCE
A304: PRESTON | C304: 3 | D304: 0 | E304: 18 | G304: 6 | H304: 0 | I304: 36 | K304: 9 | L304: 0 | M304: 54 | O304: 17 | P304: 1 | Q304: 103 | S304: SNEDDON | W304: DANDEN0NG | X304: 4 | Y304: 2 | Z304: 0 | AA304: 731 | AB304: 642 | AC304: =(AA304/AB304)*100 -> 113.86292834890965 | AD304: =(X304*4)+(Z304*2) -> 16
A305: BEST PLAYERS | W305: WERRIBEE | X305: 3 | Y305: 3 | Z305: 0 | AA305: 668 | AB305: 615 | AC305: =(AA305/AB305)*100 -> 108.6178861788618 | AD305: =(X305*4)+(Z305*2) -> 12
A306: SANDRINGHAM | C306: ANGUS | F306: BAILEY | I306: JOHNSTONE | L306: KELLAWAY | O306: F RUGOLO | Q306: J RUGOLO | W306: PRESTON | X306: 3 | Y306: 3 | Z306: 0 | AA306: 673 | AB306: 828 | AC306: =(AA306/AB306)*100 -> 81.280193236714965 | AD306: =(X306*4)+(Z306*2) -> 12
A307: PRESTON | C307: BIZZOTTO | F307: REEVES | I307: BURROWS | W307: FRANKSTON | X307: 2 | Y307: 4 | Z307: 0 | AA307: 625 | AB307: 735 | AC307: =(AA307/AB307)*100 -> 85.034013605442169 | AD307: =(X307*4)+(Z307*2) -> 8
A308: GOALKICKERS | Q308: ALLEN | S308: P GARRETT | W308: PORT MELBOURNE | X308: 2 | Y308: 4 | Z308: 0 | AA308: 561 | AB308: 725 | AC308: =(AA308/AB308)*100 -> 77.379310344827587 | AD308: =(X308*4)+(Z308*2) -> 8
A309: SANDRINGHAM | C309: F RUGOLO 9 | F309: WILLIAMS 5 | I309: C GARRETT 4 | L309: KELLAWAY 2 | O309: E FISCHER 2 | R309: FOLEY | T309: TARPEY | W309: SPRINGVALE | X309: 1 | Y309: 5 | Z309: 0 | AA309: 493 | AB309: 714 | AC309: =(AA309/AB309)*100 -> 69.047619047619051 | AD309: =(X309*4)+(Z309*2) -> 4
A310: PRESTON | C310: SHAW 6 | F310: PEZZIN 2 | H310: WALKER 2 | J310: NICOLAOU 2 | M310: SEDGEWICK 2 | P310: LUMICISI 2 | R310: FYFFE | W310: OAKLEIGH | X310: 0 | Y310: 6 | Z310: 0 | AA310: 528 | AB310: 1025 | AC310: =(AA310/AB310)*100 -> 51.512195121951223 | AD310: =(X310*4)+(Z310*2) -> 0
D311: 31ST MAY | I311: WEATHER
A312: PORT MELBOURNE | C312: 4 | D312: 3 | E312: 27 | G312: 8 | H312: 6 | I312: 54 | K312: 11 | L312: 9 | M312: 75 | O312: 19 | P312: 12 | Q312: 126 | S312: Venue: OAKLEIGH
A313: OAKLEIGH | C313: 4 | D313: 2 | E313: 26 | G313: 8 | H313: 3 | I313: 51 | K313: 11 | L313: 7 | M313: 73 | O313: 12 | P313: 12 | Q313: 84 | S313: MORROW :CALLAGHAN
A314: BEST PLAYERS
A315: PORT MELBOURNE | C315: BAILEY | F315: HARKINS | I315: McLEOD | L315: STROOPER | O315: LINDSAY | R315: GASPARONI
A316: OAKLEIGH | C316: BRIGGS | F316: WELSFORD | I316: SMITH | L316: CUNNINGHAM | O316: QUIRK | R316: MELLODY
A317: GOALKICKERS
A318: PORT MELBOURNE | C318: KING 4 | E318: McLEOD 3 | G318: PAUL 3 | I318: BAILEY 3 | K318: HARKINS 2 | M318: HART | N318: GASPARONI | Q318: LAFFY | S318: A HICKS
A319: OAKLEIGH | C319: SHARP 2 | E319: DI NATALE 2 | H319: TODD 2 | J319: GORDON 2 | M319: BULTE | O319: WELSFORD | Q319: MELLODY | S319: OWEN
A321: WILLIAMSTOWN | C321: 2 | D321: 2 | E321: 14 | G321: 9 | H321: 7 | I321: 61 | K321: 11 | L321: 8 | M321: 74 | O321: 14 | P321: 12 | Q321: 96 | S321: Venue: DANDENONG
A322: DANDENONG | C322: 1 | D322: 2 | E322: 8 | G322: 1 | H322: 4 | I322: 10 | K322: 6 | L322: 6 | M322: 42 | O322: 7 | P322: 8 | Q322: 50 | S322: McKERNAN :THOMPSON
A323: BEST PLAYERS
A324: WILLIAMSTOWN | C324: PERRY | F324: SHANKS | I324: GHAZI | L324: PASTORE | O324: MITCHELL | R324: LLOYD
A325: DANDENONG | C325: LACKO | F325: WICKS | I325: KENNEDY | L325: HUNT | O325: HALL | R325: TAYLOR
A326: GOALKICKERS
A327: WILLIAMSTOWN | C327: SHANKS 4 | F327: AZIZ 3 | H327: RICKMAN 2 | J327: GHAZI 2 | L327: MILES | N327: PERRY | P327: O'CONNOR
A328: DANDENONG | C328: PRETTO 2 | F328: CASSETT | H328: HALL | J328: MILLANE | L328: TAYLOR | N328: PALLANT
A330: PRAHRAN | C330: 2 | D330: 0 | E330: 12 | G330: 6 | H330: 5 | I330: 41 | K330: 12 | L330: 10 | M330: 82 | O330: 18 | P330: 12 | Q330: 120 | S330: Venue: WERRIBEE
A331: WERRIBEE | C331: 3 | D331: 1 | E331: 19 | G331: 5 | H331: 5 | I331: 35 | K331: 7 | L331: 6 | M331: 48 | O331: 9 | P331: 9 | Q331: 63 | S331: CARLAND :CAULFIELD
A332: BEST PLAYERS
A333: PRAHRAN | C333: PROBERT | F333: NOBLE | I333: KILEY | L333: DIMMATINA | O333: POVEY | Q333: SINNI
A334: WERRIBEE | C334: NORMINGTON | F334: ALDERDICE | I334: FITZPATRICK | L334: GEARY
A335: GOALKICKERS
A336: PRAHRAN | C336: WALFORD 4 | F336: B TAYLOR 3 | I336: KILEY 3 | K336: CHAPPLE 2 | M336: DIMMATINA 2 | P336: TREWELLA 2 | R336: POVEY | T336: R LANGAN
A337: WERRIBEE | C337: RAEBURN 2 | F337: D TAYLOR 2 | I337: BUTTON 2 | K337: ALDERDICE | N337: ALLDAY | P337: RYAN
A339: COBURG | C339: 3 | D339: 1 | E339: 19 | G339: 10 | H339: 5 | I339: 65 | K339: 13 | L339: 7 | M339: 85 | O339: 18 | P339: 10 | Q339: 118 | S339: Venue: FRANKSTON
A340: FRANKSTON | C340: 1 | D340: 2 | E340: 8 | G340: 4 | H340: 3 | I340: 27 | K340: 7 | L340: 11 | M340: 53 | O340: 10 | P340: 18 | Q340: 78 | S340: NASH :NORDEN
A341: BEST PLAYERS
A342: COBURG | C342: INGRAM | F342: SALVADOR | I342: HARRISON | L342: KENNEDY | O342: BAKER | R342: ALLISON
A343: FRANKSTON | C343: PARKER | F343: WOOD | I343: FOOT | L343: MACE
A344: GOALKICKERS
A345: COBURG | C345: INGRAM 5 | F345: HARRISON 3 | I345: CHRISTIE 2 | K345: RACOVOLIS 2 | N345: SULLIVAN 2 | Q345: ALLISON 2 | S345: LOONE | U345: KOURKAMELIS
A346: FRANKSTON | C346: PARKER 3 | F346: MACE 3 | H346: GAHAN 2 | J346: PAYNTER | M346: GARDNER
A348: ROUND 7 | D348: 6TH JUNE | I348: WEATHER | S348: Venue: BEACH ROAD
D349: 1ST QTR | H349: 2ND QTR | L349: 3RD QTR | P349: FINAL | S349: UMPIRES
A350: SANDRINGHAM | C350: 6 | D350: 4 | E350: 40 | G350: 10 | H350: 9 | I350: 69 | K350: 14 | L350: 11 | M350: 95 | O350: 16 | P350: 17 | Q350: 113 | S350: RICHARDSON | Y350: LADDER | AB350: ROUND | AD350: 7
A351: WERRIBEE | C351: 5 | D351: 4 | E351: 34 | G351: 7 | H351: 6 | I351: 48 | K351: 10 | L351: 11 | M351: 71 | O351: 11 | P351: 16 | Q351: 82 | S351: URWIN
A352: BEST PLAYERS | W352: TEAM | X352: W | Y352: L | Z352: D | AA352: FOR | AB352: AGST | AC352: % | AD352: PTS
A353: SANDRINGHAM | C353: FOLEY | F353: TARPEY | I353: KRAKOUER | L353: ANGUS | O353: RYAN | R353: CZERKASKI
A354: WERRIBEE | C354: WALSH | F354: RAEBURN | I354: NORMINGTON | L354: EAMES | O354: LAMONT | R354: CULLEN | W354: SANDRINGHAM | X354: 6 | Y354: 1 | Z354: 0 | AA354: 1021 | AB354: 693 | AC354: =(AA354/AB354)*100 -> 147.33044733044733 | AD354: =(X354*4)+(Z354*2) -> 24
A355: GOALKICKERS | P355: C GARRETT | R355: McGANNON | W355: WILLIAMSTOWN | X355: 5 | Y355: 2 | Z355: 0 | AA355: 728 | AB355: 537 | AC355: =(AA355/AB355)*100 -> 135.56797020484171 | AD355: =(X355*4)+(Z355*2) -> 20
A356: SANDRINGHAM | C356: WILLIAMS 3 | F356: TARPEY 3 | H356: FOLEY 3 | J356: GORIZIDIS 2 | M356: P GARRETT | P356: MITCHELSON | R356: KRAKOUER | W356: BOX HILL | X356: 5 | Y356: 2 | Z356: 0 | AA356: 779 | AB356: 594 | AC356: =(AA356/AB356)*100 -> 131.14478114478115 | AD356: =(X356*4)+(Z356*2) -> 20
A357: WERRIBEE | C357: SELLS 3 | F357: BUTTON 2 | I357: RAEBURN 2 | L357: ALDERDICE | N357: LESIPUTTY | Q357: McMASTER | T357: WATTS | W357: PRAHRAN | X357: 4 | Y357: 3 | Z357: 0 | AA357: 874 | AB357: 680 | AC357: =(AA357/AB357)*100 -> 128.52941176470588 | AD357: =(X357*4)+(Z357*2) -> 16
D358: 7TH JUNE | I358: WEATHER | S358: Venue: PORT MELBOURNE | W358: COBURG | X358: 4 | Y358: 3 | Z358: 0 | AA358: 741 | AB358: 605 | AC358: =(AA358/AB358)*100 -> 122.47933884297521 | AD358: =(X358*4)+(Z358*2) -> 16
A359: PORT MELBOURNE | C359: 3 | D359: 3 | E359: 21 | G359: 7 | H359: 5 | I359: 47 | K359: 10 | L359: 8 | M359: 68 | O359: 12 | P359: 8 | Q359: 80 | S359: THOMPSON
A360: PRAHRAN | C360: 4 | D360: 2 | E360: 26 | G360: 9 | H360: 3 | I360: 57 | K360: 11 | L360: 5 | M360: 71 | O360: 11 | P360: 7 | Q360: 73 | S360: K CALLAGHAN | W360: DANDEN0NG | X360: 4 | Y360: 3 | Z360: 0 | AA360: 787 | AB360: 705 | AC360: =(AA360/AB360)*100 -> 111.63120567375886 | AD360: =(X360*4)+(Z360*2) -> 16
A361: BEST PLAYERS | W361: WERRIBEE | X361: 3 | Y361: 4 | Z361: 0 | AA361: 750 | AB361: 728 | AC361: =(AA361/AB361)*100 -> 103.02197802197801 | AD361: =(X361*4)+(Z361*2) -> 12
A362: PORT MELBOURNE | C362: JAMES | F362: McKINNON | I362: BOWDEN | L362: CAMERON | O362: G PRITCHARD | R362: BAILEY | W362: FRANKSTON | X362: 3 | Y362: 4 | Z362: 0 | AA362: 693 | AB362: 790 | AC362: =(AA362/AB362)*100 -> 87.721518987341767 | AD362: =(X362*4)+(Z362*2) -> 12
A363: PRAHRAN | C363: CHAPPLE | F363: R LANGAN | I363: LUCAS | L363: SHELTON | O363: LENNOX | W363: PRESTON | X363: 3 | Y363: 4 | Z363: 0 | AA363: 728 | AB363: 896 | AC363: =(AA363/AB363)*100 -> 81.25 | AD363: =(X363*4)+(Z363*2) -> 12
A364: GOALKICKERS | W364: PORT MELBOURNE | X364: 3 | Y364: 4 | Z364: 0 | AA364: 641 | AB364: 798 | AC364: =(AA364/AB364)*100 -> 80.325814536340857 | AD364: =(X364*4)+(Z364*2) -> 12
A365: PORT MELBOURNE | C365: JAMES 3 | F365: PAUL 2 | H365: McKINNON 2 | K365: CAMERON 2 | N365: HARKINS | P365: HICKS | R365: KING | W365: SPRINGVALE | X365: 1 | Y365: 6 | Z365: 0 | AA365: 557 | AB365: 789 | AC365: =(AA365/AB365)*100 -> 70.595690747782001 | AD365: =(X365*4)+(Z365*2) -> 4
A366: PRAHRAN | C366: MRAKOV 5 | F366: TREWELLA 2 | I366: SHELTON | K366: POVEY | M366: R LANGAN | P366: KEIPERT | W366: OAKLEIGH | X366: 1 | Y366: 6 | Z366: 0 | AA366: 603 | AB366: 1089 | AC366: =(AA366/AB366)*100 -> 55.371900826446286 | AD366: =(X366*4)+(Z366*2) -> 4
A368: FRANKSTON | C368: 2 | D368: 7 | E368: 19 | G368: 5 | H368: 13 | I368: 43 | K368: 7 | L368: 19 | M368: 61 | O368: 8 | P368: 20 | Q368: 68 | S368: Venue: PRESTON
A369: PRESTON | C369: 2 | D369: 0 | E369: 12 | G369: 3 | H369: 1 | I369: 19 | K369: 5 | L369: 4 | M369: 34 | O369: 8 | P369: 7 | Q369: 55 | S369: P CALLAGHAN ;CARLAND
A370: BEST PLAYERS
A371: FRANKSTON | C371: POLLOCK | F371: FOOT | I371: WILSON | L371: RYAN | O371: GAHAN | R371: GOOSEY
A372: PRESTON | C372: PEZZIN | F372: BURROWS | I372: PARKER | L372: McINTOSH | O372: CALLANDER | R372: KING
A373: GOALKICKERS
A374: FRANKSTON | C374: GOOSEY 3 | F374: THEODORE 2 | I374: HAMILL | K374: PARKER | M374: GAHAN
A375: PRESTON | C375: SEDGEWICK | F375: SHAW | H375: GRAZIANO | J375: JORDAN | L375: MUNRIVANA | O375: PEZZIN | Q375: REEVES | S375: McINTOSH
A377: OAKLEIGH | C377: 3 | D377: 4 | E377: 22 | G377: 4 | H377: 5 | I377: 29 | K377: 7 | L377: 5 | M377: 47 | O377: 11 | P377: 9 | Q377: 75 | S377: Venue: SPRINGVALE
A378: SPRINGVALE | C378: 3 | D378: 2 | E378: 20 | G378: 6 | H378: 5 | I378: 41 | K378: 8 | L378: 11 | M378: 59 | O378: 8 | P378: 16 | Q378: 64 | S378: LUCKMAN :PEARCE
A379: BEST PLAYERS
A380: OAKLEIGH | C380: WELSFORD | F380: TODD | I380: OWEN | L380: BRIGGS | O380: ATHERTON | R380: QUIRK
A381: SPRINGVALE | C381: CAPLES | F381: PHILLIPS | I381: P SCURRAH
A382: GOALKICKERS
A383: OAKLEIGH | C383: SHARP 3 | F383: DI NATALE 3 | I383: CUNNINGHAM | L383: PANOZZO | N383: SUTHERALND | Q383: GORDON | S383: MELLODY
A384: SPRINGVALE | C384: SIMISTER 2 | F384: PHILLIPS | H384: P SCURRAH | K384: CARROLL | M384: S SCURRAH | P384: SCARDAMAGLIA | S384: JEFFS
A386: WILLIAMSTOWN | C386: 5 | D386: 2 | E386: 32 | G386: 7 | H386: 6 | I386: 48 | K386: 9 | L386: 10 | M386: 64 | O386: 12 | P386: 12 | Q386: 84 | S386: Venue: WILLIAMSTOWN
A387: COBURG | C387: 6 | D387: 0 | E387: 36 | G387: 6 | H387: 1 | I387: 37 | K387: 7 | L387: 3 | M387: 45 | O387: 8 | P387: 3 | Q387: 51 | S387: MORROW :SNEDDON
A388: BEST PLAYERS
A389: WILLIAMSTOWN | C389: GHAZI | F389: MITCHELL | I389: KOENIG | L389: RICKMAN | O389: McTAGGART | R389: VENNER
A390: COBURG | C390: KENNEDY | F390: SHELDON | I390: HARRINGTON | L390: GUMLEY | O390: TARANTO
A391: GOALKICKERS
A392: WILLIAMSTOWN | C392: RICKMAN 4 | F392: GHAZI 2 | H392: AZIZ 2 | J392: MINETT 2 | L392: PASTORE | N392: SYMONS
A393: COBURG | C393: GUMLEY 2 | F393: McDONALD | I393: INGRAM | K393: BAKER | M393: SULLIVAN | O393: SHELDON | Q393: ALLISON
A395: BOX HILL | C395: 3 | D395: 4 | E395: 22 | G395: 4 | H395: 7 | I395: 31 | K395: 7 | L395: 8 | M395: 50 | O395: 9 | P395: 9 | Q395: 63 | S395: Venue: BOX HILL
A396: DANDENONG | C396: 5 | D396: 3 | E396: 33 | G396: 5 | H396: 4 | I396: 34 | K396: 8 | L396: 7 | M396: 55 | O396: 8 | P396: 8 | Q396: 56 | S396: NASH :NORTON
A397: BEST PLAYERS
A398: BOX HILL | C398: ZARAFA | F398: CROWLEY | I398: WATSON | L398: BADROCK | O398: BUTTIFANT | R398: HOLT
A399: DANDENONG | C399: MILLIGAN | F399: HALL | I399: BOURKE | L399: LACKO | O399: HUNT | R399: SODERSTROM
A400: GOALKICKERS
A401: BOX HILL | C401: CROWLEY 2 | F401: ERWIN 2 | I401: HEANEY 2 | K401: BADROCK | M401: BRUSNAHAN | P401: ZARAFA
A402: DANDENONG | C402: PRETTO 2 | F402: LACKO 2 | I402: BOURKE | K402: CASSETT | M402: HALL | O402: MAGRO
A404: ROUND 8 | D404: 13TH JUNE | I404: WEATHER | S404: Venue: FRANKSTON
D405: 1ST QTR | H405: 2ND QTR | L405: 3RD QTR | P405: FINAL | S405: UMPIRES
A406: WILLIAMSTOWN | C406: 5 | D406: 6 | E406: 36 | G406: 10 | H406: 11 | I406: 71 | K406: 15 | L406: 15 | M406: 105 | O406: 20 | P406: 18 | Q406: 138 | S406: VAN BEEK | Y406: LADDER | AB406: ROUND | AD406: 8
A407: FRANKSTON | C407: 2 | D407: 2 | E407: 14 | G407: 4 | H407: 5 | I407: 29 | K407: 8 | L407: 8 | M407: 56 | O407: 12 | P407: 8 | Q407: 80 | S407: SAVILLE
A408: BEST PLAYERS | W408: TEAM | X408: W | Y408: L | Z408: D | AA408: FOR | AB408: AGST | AC408: % | AD408: PTS
A409: WILLIAMSTOWN | C409: MINETT | F409: HOWLETT | I409: AZIZ | L409: PERRY | O409: MITCHELL | R409: RICKMAN
A410: FRANKSTON | C410: PARKER | F410: T HAMILL | I410: THEODORE | L410: WILLIAMS | O410: GOOSEY | W410: SANDRINGHAM | X410: 7 | Y410: 1 | Z410: 0 | AA410: 1160 | AB410: 750 | AC410: =(AA410/AB410)*100 -> 154.66666666666666 | AD410: =(X410*4)+(Z410*2) -> 28
A411: GOALKICKERS | R411: VENNER | W411: WILLIAMSTOWN | X411: 6 | Y411: 2 | Z411: 0 | AA411: 866 | AB411: 617 | AC411: =(AA411/AB411)*100 -> 140.35656401944894 | AD411: =(X411*4)+(Z411*2) -> 24
A412: WILLIAMSTOWN | C412: RICKMAN 5 | F412: PASTORE 3 | I412: MINETT 3 | K412: AZIZ 2 | M412: SYMONS 2 | O412: GHAZI 2 | Q412: GOULD | S412: MITCHELL | W412: DANDEN0NG | X412: 5 | Y412: 3 | Z412: 0 | AA412: 1021 | AB412: 751 | AC412: =(AA412/AB412)*100 -> 135.9520639147803 | AD412: =(X412*4)+(Z412*2) -> 20
A413: FRANKSTON | C413: GOOSEY 5 | F413: RYAN 3 | H413: THEODORE 2 | K413: POLLOCK | M413: STREMPL | W413: COBURG | X413: 5 | Y413: 3 | Z413: 0 | AA413: 869 | AB413: 685 | AC413: =(AA413/AB413)*100 -> 126.86131386861315 | AD413: =(X413*4)+(Z413*2) -> 20
D414: 14TH JUNE | I414: WEATHER | S414: Venue: COBURG | W414: BOX HILL | X414: 5 | Y414: 3 | Z414: 0 | AA414: 859 | AB414: 722 | AC414: =(AA414/AB414)*100 -> 118.97506925207757 | AD414: =(X414*4)+(Z414*2) -> 20
A415: COBURG | C415: 3 | D415: 1 | E415: 19 | G415: 9 | H415: 1 | I415: 55 | K415: 14 | L415: 6 | M415: 90 | O415: 20 | P415: 8 | Q415: 128 | S415: URWIN
A416: BOX HILL | C416: 3 | D416: 3 | E416: 21 | G416: 4 | H416: 10 | I416: 34 | K416: 7 | L416: 11 | M416: 53 | O416: 11 | P416: 14 | Q416: 80 | S416: PRINCE | W416: PRAHRAN | X416: 4 | Y416: 4 | Z416: 0 | AA416: 946 | AB416: 796 | AC416: =(AA416/AB416)*100 -> 118.84422110552764 | AD416: =(X416*4)+(Z416*2) -> 16
A417: BEST PLAYERS | W417: WERRIBEE | X417: 4 | Y417: 4 | Z417: 0 | AA417: 943 | AB417: 802 | AC417: =(AA417/AB417)*100 -> 117.58104738154613 | AD417: =(X417*4)+(Z417*2) -> 16
A418: COBURG | C418: INGRAM | F418: GUMLEY | I418: SHELDON | L418: ZANON | O418: ALESSIO | R418: LOONE | W418: FRANKSTON | X418: 3 | Y418: 5 | Z418: 0 | AA418: 773 | AB418: 928 | AC418: =(AA418/AB418)*100 -> 83.297413793103445 | AD418: =(X418*4)+(Z418*2) -> 12
A419: BOX HILL | C419: WATSON | F419: PENNY | I419: ZARAFA | L419: SWAN | O419: HOLT | R419: CROWLEY | W419: PORT MELBOURNE | X419: 3 | Y419: 5 | Z419: 0 | AA419: 698 | AB419: 937 | AC419: =(AA419/AB419)*100 -> 74.493062966915687 | AD419: =(X419*4)+(Z419*2) -> 12
A420: GOALKICKERS | P420: KENNEDY | W420: PRESTON | X420: 3 | Y420: 5 | Z420: 0 | AA420: 802 | AB420: 1089 | AC420: =(AA420/AB420)*100 -> 73.645546372819098 | AD420: =(X420*4)+(Z420*2) -> 12
A421: COBURG | C421: INGRAM 8 | F421: SULLIVAN 5 | I421: CHRISTIE 2 | K421: RACOVOLIS | M421: GUMLEY | O421: ZANON | Q421: HARRINGTON | W421: SPRINGVALE | X421: 2 | Y421: 6 | Z421: 0 | AA421: 673 | AB421: 861 | AC421: =(AA421/AB421)*100 -> 78.164924506387919 | AD421: =(X421*4)+(Z421*2) -> 8
A422: BOX HILL | C422: CROWLEY 2 | F422: ZARAFA 2 | I422: BRUSNAHAN | L422: DWYER | N422: HOLT | P422: O'NEILL | R422: LAWRIE | W422: OAKLEIGH | X422: 1 | Y422: 7 | Z422: 0 | AA422: 649 | AB422: 1323 | AC422: =(AA422/AB422)*100 -> 49.055177626606202 | AD422: =(X422*4)+(Z422*2) -> 4
P423: DALRYMPLE | R423: DALY
A424: DANDENONG | C424: 4 | D424: 3 | E424: 27 | G424: 13 | H424: 7 | I424: 85 | K424: 21 | L424: 12 | M424: 138 | O424: 36 | P424: 18 | Q424: 234 | S424: Venue: DANDENONG
A425: OAKLEIGH | C425: 2 | D425: 3 | E425: 15 | G425: 3 | H425: 3 | I425: 21 | K425: 4 | L425: 3 | M425: 27 | O425: 7 | P425: 4 | Q425: 46 | S425: VINEY :PANOZZO
A426: BEST PLAYERS
A427: DANDENONG | C427: WICKS | F427: HALL | I427: MILLANE | L427: MILLIGAN | N427: BOURKE | Q427: SODERSTROM
A428: OAKLEIGH | C428: OWEN | F428: SMITH | I428: QUIRK | L428: MELLODY | N428: ROURKE | Q428: WELSFORD
A429: GOALKICKERS | T429: SALIBA | V429: TAYLOR
A430: DANDENONG | C430: PRETTO 10 | E430: MILLANE 5 | H430: MARSHALL 4 | K430: MAGRO 3 | M430: BOURKE 2 | O430: WICKS 2 | Q430: WULF 2 | S430: DOYLE | U430: HALL | W430: HICKEY | X430: HOLLOW | AA430: MILLIGAN | AC430: McCONCHIE
A431: OAKLEIGH | C431: SHARP 2 | F431: MARSHALL | I431: TURLEY | K431: SUTHERLAND | N431: MELLODY | P431: OWEN
A433: SANDRINGHAM | C433: 5 | D433: 2 | E433: 32 | G433: 8 | H433: 4 | I433: 52 | K433: 14 | L433: 9 | M433: 93 | O433: 21 | P433: 13 | Q433: 139 | S433: Venue: PORT MELBOURNE
A434: PORT MELBOURNE | C434: 3 | D434: 5 | E434: 23 | G434: 4 | H434: 8 | I434: 32 | K434: 6 | L434: 13 | M434: 49 | O434: 7 | P434: 15 | Q434: 57 | S434: MORROW ;CARLAND
A435: BEST PLAYERS
A436: SANDRINGHAM | C436: J RUGOLO | F436: ARGUS | I436: FISCHER | L436: KRAKOUER | O436: KELLAWAY | R436: MACKENZIE
A437: PORT MELBOURNE | C437: LINDSAY | F437: MUTIMER | I437: PERKINS | L437: McKINNON | O437: SHAW | R437: R BOWDEN
A438: GOALKICKERS
A439: SANDRINGHAM | C439: WILLIAMS 6 | F439: F RUGOLO 4 | I439: FOLEY 3 | K439: TARPEY 2 | M439: KRAKOUER 2 | P439: C GARRETT 2 | S439: FISCHER | V439: MITCHELSON
A440: PORT MELBOURNE | C440: DONALD 3 | F440: KING 2 | H440: PERKINS | J440: GASPARONI
A442: SPRINGVALE | C442: 5 | D442: 2 | E442: 32 | G442: 8 | H442: 5 | I442: 53 | K442: 10 | L442: 10 | M442: 70 | O442: 17 | P442: 14 | Q442: 116 | S442: Venue: TOORAK PARK
A443: PRAHRAN | C443: 2 | D443: 2 | E443: 14 | G443: 7 | H443: 5 | I443: 47 | K443: 9 | L443: 6 | M443: 60 | O443: 11 | P443: 6 | Q443: 72 | S443: CAULFIELD :FALLET
A444: BEST PLAYERS
A445: SPRINGVALE | C445: CAPLES | F445: WILLIAMS | I445: WELSH | L445: PHILLIPS | O445: S SCURRAH | R445: P SCURRAH
A446: PRAHRAN | C446: KEIPERT | F446: LUCAS | I446: R LANGAN | L446: KILEY | O446: CHAPPLE
A447: GOALKICKERS
A448: SPRINGVALE | C448: SIMISTER 5 | F448: PHILLIPS 4 | I448: S SCURRAH 2 | L448: P SCURRAH 2 | O448: McKENZIE | Q448: JEFFS | S448: CARROLL | V448: CARIS
A449: PRAHRAN | C449: MRAKOV 5 | F449: DIMMATINA 3 | I449: KEIPERT 2 | L449: TAYLOR
A451: WERRIBEE | C451: 5 | D451: 6 | E451: 36 | G451: 16 | H451: 11 | I451: 107 | K451: 21 | L451: 15 | M451: 141 | O451: 29 | P451: 19 | Q451: 193 | S451: Venue: WERRIBEE
A452: PRESTON | C452: 3 | D452: 3 | E452: 21 | G452: 5 | H452: 3 | I452: 33 | K452: 9 | L452: 6 | M452: 60 | O452: 11 | P452: 8 | Q452: 74 | S452: LUCKMAN :CALLAGHAN
A453: BEST PLAYERS
A454: WERRIBEE | C454: ALLDAY | F454: McMASTER | I454: CULLEN | L454: RAEBURN | O454: LAMONT | R454: WILSON
A455: PRESTON | C455: KING | F455: PERCY | I455: BURROWS | L455: WALKER
A456: GOALKICKERS
A457: WERRIBEE | C457: TAYLOR 6 | F457: McMASTER 5 | I457: RAEBURN 5 | L457: ALDERDICE 4 | O457: LAMONT 3 | Q457: SELLS 2 | S457: LESIPUTTY 2 | X457: EAMES | Z457: WILKINS
A458: PRESTON | C458: GRAZIANO 4 | F458: MUNRIVANA 2 | I458: SHAW 2 | K458: JORDAN | M458: LUMICISI | O458: NICOLAOU
A460: ROUND 9 | D460: 20TH JUNE | I460: WEATHER | S460: Venue: TOORAK PARK
D461: 1ST QTR | H461: 2ND QTR | L461: 3RD QTR | P461: FINAL | S461: UMPIRES
A462: PRAHRAN | C462: 6 | D462: 5 | E462: 41 | G462: 10 | H462: 6 | I462: 66 | K462: 15 | L462: 13 | M462: 103 | O462: 19 | P462: 16 | Q462: 130 | S462: FALLET | Y462: LADDER | AB462: ROUND | AD462: 9
A463: DANDENONG | C463: 1 | D463: 2 | E463: 8 | G463: 4 | H463: 6 | I463: 30 | K463: 5 | L463: 7 | M463: 37 | O463: 6 | P463: 8 | Q463: 44 | S463: MORROW
A464: BEST PLAYERS | W464: TEAM | X464: W | Y464: L | Z464: D | AA464: FOR | AB464: AGST | AC464: % | AD464: PTS
A465: PRAHRAN | C465: TREWELLA | F465: CHAPPLE | I465: KEIPERT | L465: SHELTON | N465: McCORMACK | Q465: PROBERT
A466: DANDENONG | C466: MILLIGAN | F466: HALL | I466: CASSETT | L466: HOLLOW | N466: LACKO | Q466: MILLANE | W466: SANDRINGHAM | X466: 8 | Y466: 1 | Z466: 0 | AA466: 1294 | AB466: 869 | AC466: =(AA466/AB466)*100 -> 148.90678941311853 | AD466: =(X466*4)+(Z466*2) -> 32
A467: GOALKICKERS | R467: CLARK | W467: COBURG | X467: 6 | Y467: 3 | Z467: 0 | AA467: 1009 | AB467: 751 | AC467: =(AA467/AB467)*100 -> 134.35419440745673 | AD467: =(X467*4)+(Z467*2) -> 24
A468: PRAHRAN | C468: TREWELLA 5 | F468: KEIPERT 5 | H468: MRAKOV 2 | J468: DIMMATINA 2 | M468: POVEY | O468: R LANGAN | Q468: TAYLOR | S468: SHELTON | W468: WILLIAMSTOWN | X468: 6 | Y468: 3 | Z468: 0 | AA468: 922 | AB468: 702 | AC468: =(AA468/AB468)*100 -> 131.33903133903132 | AD468: =(X468*4)+(Z468*2) -> 24
A469: DANDENONG | C469: McCONCHIE 2 | F469: CASSETT | H469: GOTCH | J469: PRETTO | L469: WICKS | W469: BOX HILL | X469: 6 | Y469: 3 | Z469: 0 | AA469: 944 | AB469: 778 | AC469: =(AA469/AB469)*100 -> 121.33676092544987 | AD469: =(X469*4)+(Z469*2) -> 24
D470: 21ST JUNE | I470: WEATHER | W470: PRAHRAN | X470: 5 | Y470: 4 | Z470: 0 | AA470: 1076 | AB470: 840 | AC470: =(AA470/AB470)*100 -> 128.09523809523807 | AD470: =(X470*4)+(Z470*2) -> 20
A471: BOX HILL | C471: 4 | D471: 0 | E471: 24 | G471: 5 | H471: 1 | I471: 31 | K471: 9 | L471: 4 | M471: 58 | O471: 13 | P471: 7 | Q471: 85 | S471: Venue: BOX HILL
A472: WILLIAMSTOWN | C472: 2 | D472: 2 | E472: 14 | G472: 4 | H472: 3 | I472: 27 | K472: 7 | L472: 7 | M472: 49 | O472: 8 | P472: 8 | Q472: 56 | S472: PANOZZO :RUSSO | W472: WERRIBEE | X472: 5 | Y472: 4 | Z472: 0 | AA472: 1049 | AB472: 853 | AC472: =(AA472/AB472)*100 -> 122.97772567409145 | AD472: =(X472*4)+(Z472*2) -> 20
A473: BEST PLAYERS | W473: DANDEN0NG | X473: 5 | Y473: 4 | Z473: 0 | AA473: 1065 | AB473: 881 | AC473: =(AA473/AB473)*100 -> 120.88535754824063 | AD473: =(X473*4)+(Z473*2) -> 20
A474: BOX HILL | C474: HOLT | E474: DALY | H474: BANFIELD | K474: ZARAFA | N474: WATSON | Q474: DALRYMPLE | W474: PRESTON | X474: 4 | Y474: 5 | Z474: 0 | AA474: 906 | AB474: 1174 | AC474: =(AA474/AB474)*100 -> 77.172061328790463 | AD474: =(X474*4)+(Z474*2) -> 16
A475: WILLIAMSTOWN | C475: VENNER | E475: ACKERLEY | H475: SHANKS | K475: KOENIG | N475: MITCHELL | W475: FRANKSTON | X475: 3 | Y475: 6 | Z475: 0 | AA475: 824 | AB475: 1034 | AC475: =(AA475/AB475)*100 -> 79.69052224371373 | AD475: =(X475*4)+(Z475*2) -> 12
A476: GOALKICKERS | W476: PORT MELBOURNE | X476: 3 | Y476: 6 | Z476: 0 | AA476: 783 | AB476: 1041 | AC476: =(AA476/AB476)*100 -> 75.216138328530263 | AD476: =(X476*4)+(Z476*2) -> 12
A477: BOX HILL | C477: LAWRIE 4 | F477: SWAN 2 | H477: MI ERWIN 2 | K477: JAMES | M477: HEANEY | O477: O'NEILL | Q477: PENNY | S477: ZARAFA | W477: SPRINGVALE | X477: 2 | Y477: 7 | Z477: 0 | AA477: 792 | AB477: 995 | AC477: =(AA477/AB477)*100 -> 79.597989949748751 | AD477: =(X477*4)+(Z477*2) -> 8
A478: WILLIAMSTOWN | C478: PERRY 2 | F478: ACKERLEY | I478: AZIZ | K478: GHAZI | M478: JOHANSEN | P478: MINETT | R478: SHANKS | W478: OAKLEIGH | X478: 1 | Y478: 8 | Z478: 0 | AA478: 715 | AB478: 1463 | AC478: =(AA478/AB478)*100 -> 48.872180451127818 | AD478: =(X478*4)+(Z478*2) -> 4
A480: COBURG | C480: 4 | D480: 3 | E480: 27 | G480: 8 | H480: 7 | I480: 55 | K480: 16 | L480: 9 | M480: 105 | O480: 21 | P480: 14 | Q480: 140 | S480: Venue: OAKLEIGH
A481: OAKLEIGH | C481: 2 | D481: 3 | E481: 15 | G481: 6 | H481: 6 | I481: 42 | K481: 8 | L481: 8 | M481: 56 | O481: 9 | P481: 12 | Q481: 66 | S481: ROBINSON :HOLT
A482: BEST PLAYERS
A483: COBURG | C483: INGRAM | F483: ALLISON | I483: FOTIA | L483: GUMLEY | O483: SHELDON
A484: OAKLEIGH | C484: SMITH | F484: OWEN | I484: TURLEY | L484: ATHERTON | O484: DUNLOP | R484: WELSFORD
A485: GOALKICKERS
A486: COBURG | C486: INGRAM 9 | F486: SULLIVAN 3 | I486: BAKER 2 | K486: RACOVOLIS | M486: HARRISON | O486: GUMLEY | Q486: SHELDON | S486: HARRINGTON | W486: KENNEDY | X486: AIELLO
A487: OAKLEIGH | C487: GORDON 2 | F487: OWEN 2 | H487: SHARP | J487: TODD | L487: QUIRK | N487: GARBUIO | P487: WELSFORD
A489: PRESTON | C489: 2 | D489: 3 | E489: 15 | G489: 7 | H489: 5 | I489: 47 | K489: 12 | L489: 6 | M489: 78 | O489: 16 | P489: 8 | Q489: 104 | S489: Venue: PRESTON
A490: PORT MELBOURNE | C490: 2 | D490: 5 | E490: 17 | G490: 7 | H490: 7 | I490: 49 | K490: 8 | L490: 7 | M490: 55 | O490: 13 | P490: 7 | Q490: 85 | S490: CAULFIELD :AGNEW
A491: BEST PLAYERS
A492: PRESTON | C492: TEAM EFFORT
A493: PORT MELBOURNE | C493: HARKINS | F493: EDWARDS | I493: MUTIMER | L493: R BOWDEN | O493: DONALD
A494: GOALKICKERS
A495: PRESTON | C495: SHAW 9 | F495: JORDAN 2 | I495: DINTIOSANTE 2 | L495: DOBBS | N495: FYFFE | P495: GRAZIANO
A496: PORT MELBOURNE | C496: HARKINS 3 | F496: CAMERON 2 | I496: A JAMES 2 | L496: LAFFY 2 | N496: R BOWDEN | Q496: S BOWDEN | T496: BAILEY | V496: DONALD
A498: WERRIBEE | C498: 1 | D498: 5 | E498: 11 | G498: 5 | H498: 11 | I498: 41 | K498: 8 | L498: 18 | M498: 66 | O498: 14 | P498: 22 | Q498: 106 | S498: Venue: WERRIBEE
A499: FRANKSTON | C499: 1 | D499: 4 | E499: 10 | G499: 2 | H499: 7 | I499: 19 | K499: 4 | L499: 11 | M499: 35 | O499: 6 | P499: 15 | Q499: 51 | S499: CAMERON :URWIN
A500: BEST PLAYERS
A501: WERRIBEE | C501: GEARY | F501: WALSH | I501: ALDERDICE | L501: CULLEN | O501: WATTS | Q501: WILSON
A502: FRANKSTON | C502: T HAMILL | F502: POLLOCK | I502: HILLIARD | L502: YOUNG | O502: WOOD | Q502: RYAN
A503: GOALKICKERS
A504: WERRIBEE | C504: LESIPUTTY 4 | F504: TAYLOR 3 | I504: SELLS | K504: RAEBURN | M504: ALDERDICE | P504: EAMES | R504: McMASTER | V504: LAMONT | X504: WILSON
A505: FRANKSTON | C505: GOOSEY 2 | F505: WILLIAMS | I505: YOUNG | K505: THEODORE | N505: BOONKAMP
A507: SANDRINGHAM | C507: 3 | D507: 1 | E507: 19 | G507: 7 | H507: 6 | I507: 48 | K507: 13 | L507: 11 | M507: 89 | O507: 20 | P507: 14 | Q507: 134 | S507: Venue: BEACH ROAD
A508: SPRINGVALE | C508: 6 | D508: 5 | E508: 41 | G508: 10 | H508: 8 | I508: 68 | K508: 15 | L508: 10 | M508: 100 | O508: 18 | P508: 11 | Q508: 119 | S508: LUCKMAN :K CALLAGHAN
A509: BEST PLAYERS
A510: SANDRINGHAM | C510: MITCHELSON | F510: MACKENZIE | I510: RYAN | L510: KELLAWAY | O510: ALLEN
A511: SPRINGVALE | C511: P SCURRAH | F511: CARROLL | I511: SIMISTER | L511: HARDWICK | O511: WELSH | Q511: CLARK
A512: GOALKICKERS
A513: SANDRINGHAM | C513: F RUGOLO 5 | F513: MITCHELSON 2 | I513: WILSON 2 | K513: P GARRETT 2 | N513: KRAKOUER 2 | Q513: J RUGOLO 2 | T513: MOREY 2 | V513: TARPEY | X513: KELLAWAY | AB513: C GARRETT
A514: SPRINGVALE | C514: SIMISTER 8 | F514: P SCURRAH 3 | I514: C ELLIOTT 2 | L514: CARROLL | N514: HARDWICK | Q514: JEFFS | S514: MORGAN | W514: PHILLIPS
A516: ROUND 10 | D516: 27TH JUNE | I516: WEATHER | S516: Venue: PORT MELBOURNE
D517: 1ST QTR | H517: 2ND QTR | L517: 3RD QTR | P517: FINAL | S517: UMPIRES
A518: WERRIBEE | C518: 7 | D518: 6 | E518: 48 | G518: 11 | H518: 11 | I518: 77 | K518: 13 | L518: 18 | M518: 96 | O518: 16 | P518: 23 | Q518: 119 | S518: K CALLAGHAN | Y518: LADDER | AB518: ROUND | AD518: 10
A519: PORT MELBOURNE | C519: 0 | D519: 3 | E519: 3 | G519: 4 | H519: 3 | I519: 27 | K519: 9 | L519: 6 | M519: 60 | O519: 14 | P519: 10 | Q519: 94 | S519: P CALLAGHAN
A520: BEST PLAYERS | W520: TEAM | X520: W | Y520: L | Z520: D | AA520: FOR | AB520: AGST | AC520: % | AD520: PTS
A521: WERRIBEE | C521: McMASTER | F521: ALLDAY | I521: CULLEN | L521: EAMES | O521: FITZPATRICK | R521: WILSON
A522: PORT MELBOURNE | C522: HARKINS | F522: EDWARDS | I522: PRITCHARD | L522: A JAMES | O522: R BOWDEN | R522: S HICKS | W522: SANDRINGHAM | X522: 9 | Y522: 1 | Z522: 0 | AA522: 1426 | AB522: 946 | AC522: =(AA522/AB522)*100 -> 150.73995771670189 | AD522: =(X522*4)+(Z522*2) -> 36
A523: GOALKICKERS | W523: WILLIAMSTOWN | X523: 7 | Y523: 3 | Z523: 0 | AA523: 1079 | AB523: 732 | AC523: =(AA523/AB523)*100 -> 147.40437158469945 | AD523: =(X523*4)+(Z523*2) -> 28
A524: WERRIBEE | C524: TAYLOR 4 | F524: SELLS 3 | H524: LAMONT 3 | J524: WILSON 2 | L524: ALDERDICE 2 | O524: NORMINGTON | R524: McMASTER | W524: BOX HILL | X524: 7 | Y524: 3 | Z524: 0 | AA524: 1070 | AB524: 839 | AC524: =(AA524/AB524)*100 -> 127.53277711561381 | AD524: =(X524*4)+(Z524*2) -> 28
A525: PORT MELBOURNE | C525: HARKINS 5 | F525: CLARK 3 | H525: A HICKS 2 | J525: LINDSAY | L525: BAILEY | N525: EDWARDS | Q525: McGAW | W525: PRAHRAN | X525: 6 | Y525: 4 | Z525: 0 | AA525: 1258 | AB525: 908 | AC525: =(AA525/AB525)*100 -> 138.54625550660793 | AD525: =(X525*4)+(Z525*2) -> 24
D526: 28TH JUNE | I526: WEATHER | S526: Venue: DANDENONG | W526: WERRIBEE | X526: 6 | Y526: 4 | Z526: 0 | AA526: 1168 | AB526: 947 | AC526: =(AA526/AB526)*100 -> 123.33685322069694 | AD526: =(X526*4)+(Z526*2) -> 24
A527: SANDRINGHAM | C527: 7 | D527: 6 | E527: 48 | G527: 13 | H527: 10 | I527: 88 | K527: 16 | L527: 15 | M527: 111 | O527: 19 | P527: 18 | Q527: 132 | S527: RUSSO
A528: DANDENONG | C528: 3 | D528: 1 | E528: 19 | G528: 7 | H528: 5 | I528: 47 | K528: 8 | L528: 7 | M528: 55 | O528: 11 | P528: 11 | Q528: 77 | S528: HOLT | W528: COBURG | X528: 6 | Y528: 4 | Z528: 0 | AA528: 1077 | AB528: 933 | AC528: =(AA528/AB528)*100 -> 115.43408360128618 | AD528: =(X528*4)+(Z528*2) -> 24
A529: BEST PLAYERS | W529: DANDEN0NG | X529: 5 | Y529: 5 | Z529: 0 | AA529: 1142 | AB529: 1013 | AC529: =(AA529/AB529)*100 -> 112.7344521224087 | AD529: =(X529*4)+(Z529*2) -> 20
A530: SANDRINGHAM | C530: GARRETT | F530: ANGUS | I530: ARGUS | L530: CZERKASKI | O530: KELLAWAY | R530: TARPEY | W530: PRESTON | X530: 5 | Y530: 5 | Z530: 0 | AA530: 1004 | AB530: 1237 | AC530: =(AA530/AB530)*100 -> 81.16410670978172 | AD530: =(X530*4)+(Z530*2) -> 20
A531: DANDENONG | C531: MILLIGAN | F531: LACKO | I531: KENNEDY | L531: BOURKE | O531: HALL | R531: MILLANE | W531: FRANKSTON | X531: 3 | Y531: 7 | Z531: 0 | AA531: 885 | AB531: 1160 | AC531: =(AA531/AB531)*100 -> 76.293103448275872 | AD531: =(X531*4)+(Z531*2) -> 12
A532: GOALKICKERS | W532: PORT MELBOURNE | X532: 3 | Y532: 7 | Z532: 0 | AA532: 877 | AB532: 1160 | AC532: =(AA532/AB532)*100 -> 75.603448275862078 | AD532: =(X532*4)+(Z532*2) -> 12
A533: SANDRINGHAM | C533: GARRETT 6 | F533: F RUGOLO 5 | I533: KRAKOUER 2 | L533: J RUGOLO 2 | O533: RYAN 2 | Q533: WILLIAMS | T533: FOLEY | W533: SPRINGVALE | X533: 2 | Y533: 8 | Z533: 0 | AA533: 855 | AB533: 1093 | AC533: =(AA533/AB533)*100 -> 78.225068618481245 | AD533: =(X533*4)+(Z533*2) -> 8
A534: DANDENONG | C534: MARSHALL 3 | F534: MILLANE 3 | I534: CASSETT 2 | L534: HALL | N534: KNIGHT | P534: LACKO | W534: OAKLEIGH | X534: 1 | Y534: 9 | Z534: 0 | AA534: 745 | AB534: 1620 | AC534: =(AA534/AB534)*100 -> 45.987654320987652 | AD534: =(X534*4)+(Z534*2) -> 4
A536: BOX HILL | C536: 3 | D536: 2 | E536: 20 | G536: 5 | H536: 2 | I536: 32 | K536: 12 | L536: 4 | M536: 76 | O536: 20 | P536: 6 | Q536: 126 | S536: Venue: BOX HILL
A537: FRANKSTON | C537: 5 | D537: 3 | E537: 33 | G537: 8 | H537: 5 | I537: 53 | K537: 8 | L537: 6 | M537: 54 | O537: 9 | P537: 7 | Q537: 61 | S537: MORROW :FALLET
A538: BEST PLAYERS
A539: BOX HILL | C539: HOLT | F539: CROWLEY | I539: BANFIELD | L539: O'NEILL | O539: WATSON | R539: DALRYMPLE
A540: FRANKSTON | C540: BELL | F540: POLLOCK | I540: T HAMILL
A541: GOALKICKERS
A542: BOX HILL | C542: ELLIS 3 | E542: STOKES 3 | G542: WATSON 3 | I542: BADROCK 2 | L542: O'NEILL 2 | N542: DALRYMPLE 2 | Q542: BUTTIFANT | T542: LAWRIE | W542: MI ERWIN | X542: CROWLEY | AA542: JAMES
A543: FRANKSTON | C543: GOOSEY 3 | F543: PARKER 3 | I543: PAYNTER 2 | L543: THEODORE
A545: PRAHRAN | C545: 7 | D545: 3 | E545: 45 | G545: 14 | H545: 9 | I545: 93 | K545: 18 | L545: 12 | M545: 120 | O545: 28 | P545: 14 | Q545: 182 | S545: Venue: COBURG
A546: COBURG | C546: 3 | D546: 0 | E546: 18 | G546: 3 | H546: 3 | I546: 21 | K546: 7 | L546: 5 | M546: 47 | O546: 10 | P546: 8 | Q546: 68 | S546: PANOZZO :CAULFIELD
A547: BEST PLAYERS
A548: PRAHRAN | C548: TREWELLA | F548: MARTELLO | I548: MRAKOV | L548: SINNI | O548: LENNOX | Q548: R LANGAN
A549: COBURG | C549: SHELDON | F549: ALESSIO | I549: GUMLEY | L549: ZANON | O549: GORMAN
A550: GOALKICKERS
A551: PRAHRAN | C551: KEIPERT 6 | F551: MRAKOV 5 | I551: TREWELLA 4 | L551: POVEY 3 | N551: TAYLOR 3 | Q551: DIMMATINA 3 | U551: SINNI | W551: KILEY | X551: SHELTON | AA551: NOBLE
A552: COBURG | C552: CHRISTIE 2 | F552: KOURKOUMELIS 2 | J552: ALESSIO 2 | M552: ONLEY 2 | O552: GUMLEY | Q552: KENNEDY
A554: PRESTON | C554: 2 | D554: 3 | E554: 15 | G554: 4 | H554: 4 | I554: 28 | K554: 9 | L554: 6 | M554: 60 | O554: 15 | P554: 8 | Q554: 98 | S554: Venue: SPRINGVALE
A555: SPRINGVALE | C555: 2 | D555: 6 | E555: 18 | G555: 3 | H555: 14 | I555: 32 | K555: 4 | L555: 17 | M555: 41 | O555: 7 | P555: 21 | Q555: 63 | S555: MURNANE :PRICE
A556: BEST PLAYERS
A557: PRESTON | C557: PERCY | F557: BURROWS | I557: SHAW | L557: LAMBETH | O557: LEYDIN | R557: SALVADOR
A558: SPRINGVALE | C558: CLARK | F558: PEACOCK | I558: CAPLES | L558: S SCURRAH | O558: C ELLIOTT | R558: JEFFS
A559: GOALKICKERS
A560: PRESTON | C560: SHAW 8 | E560: GRAZIANO 2 | H560: SALVADOR 2 | K560: FYFFE | M560: PEZZIN | O560: JORDAN
A561: SPRINGVALE | C561: SIMISTER 3 | F561: P SCURRAH | I561: SCARDAMAGLIA | L561: JEFFS | N561: HARDWICK
A563: WILLIAMSTOWN | C563: 4 | D563: 4 | E563: 28 | G563: 13 | H563: 7 | I563: 85 | K563: 18 | L563: 8 | M563: 116 | O563: 24 | P563: 13 | Q563: 157 | S563: Venue: WILLIAMSTOWN
A564: OAKLEIGH | C564: 2 | D564: 2 | E564: 14 | G564: 2 | H564: 4 | I564: 16 | K564: 3 | L564: 5 | M564: 23 | O564: 4 | P564: 6 | Q564: 30 | S564: AGNEW ;DOWSLEY
A565: BEST PLAYERS
A566: WILLIAMSTOWN | C566: HOWLETT | F566: RICKMAN | I566: MITCHELL | L566: KOENIG | O566: SWAN
A567: OAKLEIGH | C567: SMITH | F567: BRIGGS | I567: OWEN | L567: DUNLOP | O567: MELLODY | R567: TODD
A568: GOALKICKERS
A569: WILLIAMSTOWN | C569: RICKMAN 11 | F569: O'CONNOR 4 | I569: MINETT 2 | K569: SWAN 2 | M569: SYMONS 2 | O569: PERRY | Q569: PASTORE | S569: VENNER
A570: OAKLEIGH | C570: ATHERTON 2 | F570: BRIGGS | H570: TODD
A572: ROUND 11 | D572: 4TH JULY | I572: WEATHER | S572: Venue: BEACH ROAD
D573: 1ST QTR | H573: 2ND QTR | L573: 3RD QTR | P573: FINAL | S573: UMPIRES
A574: SANDRINGHAM | C574: 4 | D574: 3 | E574: 27 | G574: 10 | H574: 8 | I574: 68 | K574: 15 | L574: 10 | M574: 100 | O574: 22 | P574: 14 | Q574: 146 | S574: FORSTER | Y574: LADDER | AB574: ROUND | AD574: 11
A575: COBURG | C575: 2 | D575: 7 | E575: 19 | G575: 5 | H575: 7 | I575: 37 | K575: 10 | L575: 10 | M575: 70 | O575: 13 | P575: 12 | Q575: 90 | S575: MORROW
A576: BEST PLAYERS | W576: TEAM | X576: W | Y576: L | Z576: D | AA576: FOR | AB576: AGST | AC576: % | AD576: PTS
A577: SANDRINGHAM | C577: KRAKOUER | F577: KELLOWAY | I577: P GARRETT | L577: ARGUS | O577: JOHNSTONE | R577: TARPEY
A578: COBURG | C578: LISTON | F578: ANGWIN | I578: TARANTO | L578: GUMLEY | O578: HARRISON | W578: SANDRINGHAM | X578: 10 | Y578: 1 | Z578: 0 | AA578: 1572 | AB578: 1036 | AC578: =(AA578/AB578)*100 -> 151.73745173745175 | AD578: =(X578*4)+(Z578*2) -> 40
A579: GOALKICKERS | L579: KRAKOUER | O579: MOREY | Q579: ARGUS | T579: ALLEN | W579: WILLIAMSTOWN | X579: 8 | Y579: 3 | Z579: 0 | AA579: 1147 | AB579: 774 | AC579: =(AA579/AB579)*100 -> 148.19121447028422 | AD579: =(X579*4)+(Z579*2) -> 32
A580: SANDRINGHAM | C580: F RUGOLO 4 | F580: TARPEY 4 | I580: P GARRETT 3 | L580: WILLIAMS 3 | O580: FOLEY 2 | Q580: C GARRETT 2 | W580: BOX HILL | X580: 8 | Y580: 3 | Z580: 0 | AA580: 1219 | AB580: 899 | AC580: =(AA580/AB580)*100 -> 135.59510567296996 | AD580: =(X580*4)+(Z580*2) -> 32
A581: COBURG | C581: GRIFFITHS 4 | F581: HARRISON 4 | I581: INGRAM | K581: TARANTO | M581: KOUURKAMELIS | P581: KENNEDY | R581: BAKER | W581: PRAHRAN | X581: 6 | Y581: 5 | Z581: 0 | AA581: 1300 | AB581: 976 | AC581: =(AA581/AB581)*100 -> 133.19672131147541 | AD581: =(X581*4)+(Z581*2) -> 24
D582: 5TH JULY | I582: WEATHER | S582: Venue: OAKLEIGH | W582: WERRIBEE | X582: 6 | Y582: 5 | Z582: 0 | AA582: 1226 | AB582: 1051 | AC582: =(AA582/AB582)*100 -> 116.65080875356804 | AD582: =(X582*4)+(Z582*2) -> 24
A583: BOX HILL | C583: 3 | D583: 2 | E583: 20 | G583: 7 | H583: 3 | I583: 45 | K583: 16 | L583: 5 | M583: 101 | O583: 23 | P583: 11 | Q583: 149 | S583: McKERNAN
A584: OAKLEIGH | C584: 3 | D584: 3 | E584: 21 | G584: 6 | H584: 6 | I584: 42 | K584: 8 | L584: 10 | M584: 58 | O584: 8 | P584: 12 | Q584: 60 | S584: LUCKMAN | W584: COBURG | X584: 6 | Y584: 5 | Z584: 0 | AA584: 1167 | AB584: 1079 | AC584: =(AA584/AB584)*100 -> 108.15569972196479 | AD584: =(X584*4)+(Z584*2) -> 24
A585: BEST PLAYERS | W585: PRESTON | X585: 6 | Y585: 5 | Z585: 0 | AA585: 1116 | AB585: 1309 | AC585: =(AA585/AB585)*100 -> 85.255920550038198 | AD585: =(X585*4)+(Z585*2) -> 24
A586: BOX HILL | C586: WATTS | F586: LAWRIE | I586: DALRYMPLE | L586: ZARAFA | O586: MI ERWIN | R586: EVANS | W586: DANDEN0NG | X586: 5 | Y586: 6 | Z586: 0 | AA586: 1214 | AB586: 1125 | AC586: =(AA586/AB586)*100 -> 107.91111111111111 | AD586: =(X586*4)+(Z586*2) -> 20
A587: OAKLEIGH | C587: TURLEY | F587: DUNLOP | I587: QUIRK | L587: SHARP | O587: OWEN | W587: PORT MELBOURNE | X587: 4 | Y587: 7 | Z587: 0 | AA587: 985 | AB587: 1248 | AC587: =(AA587/AB587)*100 -> 78.926282051282044 | AD587: =(X587*4)+(Z587*2) -> 16
A588: GOALKICKERS | M588: ZARAFA | O588: EVANS | Q588: LISLE | R588: WATSON | W588: SPRINGVALE | X588: 3 | Y588: 8 | Z588: 0 | AA588: 959 | AB588: 1151 | AC588: =(AA588/AB588)*100 -> 83.31885317115551 | AD588: =(X588*4)+(Z588*2) -> 12
A589: BOX HILL | C589: LAWRIE 6 | F589: JAMES 5 | H589: O'NEILL 3 | J589: CROWLEY 2 | M589: BADROCK | O589: DALRYMPLE | R589: MI ERWIN | W589: FRANKSTON | X589: 3 | Y589: 8 | Z589: 0 | AA589: 973 | AB589: 1268 | AC589: =(AA589/AB589)*100 -> 76.735015772870668 | AD589: =(X589*4)+(Z589*2) -> 12
A590: OAKLEIGH | C590: W BRIGGS 4 | F590: TURLEY | H590: GARBUIO | J590: WELSFORD | M590: OWEN | W590: OAKLEIGH | X590: 1 | Y590: 10 | Z590: 0 | AA590: 805 | AB590: 1769 | AC590: =(AA590/AB590)*100 -> 45.505935556811764 | AD590: =(X590*4)+(Z590*2) -> 4
A592: WILLIAMSTOWN | C592: 3 | D592: 1 | E592: 19 | G592: 5 | H592: 1 | I592: 31 | K592: 7 | L592: 9 | M592: 51 | O592: 9 | P592: 14 | Q592: 68 | S592: Venue: WILLIAMSTOWN
A593: PRAHRAN | C593: 1 | D593: 2 | E593: 8 | G593: 5 | H593: 6 | I593: 36 | K593: 5 | L593: 9 | M593: 39 | O593: 5 | P593: 12 | Q593: 42 | S593: RUSSO :MURNANE
A594: BEST PLAYERS
A595: WILLIAMSTOWN | C595: McTAGGART | F595: HOWLETT | I595: KOENIG | L595: VENNER | O595: LLOYD
A596: PRAHRAN | C596: MARTELLO | F596: S LANGAN | I596: LUCAS | L596: WINTON | O596: NOBLE
A597: GOALKICKERS
A598: WILLIAMSTOWN | C598: RICKMAN 4 | F598: GHAZI 2 | H598: PASTORE | J598: HARRIS | L598: AZIZ
A599: PRAHRAN | C599: DIMMATINA 2 | F599: TREWELLA | I599: TAYLOR | K599: DWYER
A601: PRESTON | C601: 8 | D601: 3 | E601: 51 | G601: 8 | H601: 5 | I601: 53 | K601: 13 | L601: 9 | M601: 87 | O601: 17 | P601: 10 | Q601: 112 | S601: Venue: PRESTON
A602: DANDENONG | C602: 0 | D602: 3 | E602: 3 | G602: 6 | H602: 10 | I602: 46 | K602: 7 | L602: 12 | M602: 54 | O602: 9 | P602: 18 | Q602: 72 | S602: CALLAGHAN :CAULFIELD
A603: BEST PLAYERS
A604: PRESTON | C604: KING | F604: LUMICISI | I604: PEZZIN | L604: REEVES | O604: WALKER
A605: DANDENONG | C605: HOLLOW | F605: BOURKE | I605: MILLIGAN | L605: HALL | O605: KENNEDY | R605: HUNT
A606: GOALKICKERS
A607: PRESTON | C607: GRAZIANO 5 | F607: SALVADOR 2 | I607: DOBBS 2 | K607: SHAW 2 | M607: FYFFE 2 | O607: JORDAN | Q607: NICOLAOU | S607: LUMICISI | V607: MAY
A608: DANDENONG | C608: CASSETT 4 | F608: MILLANE 2 | I608: LACKO | K608: MARSHALL | N608: WICKS
A610: SPRINGVALE | C610: 3 | D610: 2 | E610: 20 | G610: 8 | H610: 12 | I610: 60 | K610: 10 | L610: 15 | M610: 75 | O610: 14 | P610: 20 | Q610: 104 | S610: Venue: SPRINGVALE
A611: WERRIBEE | C611: 2 | D611: 8 | E611: 20 | G611: 2 | H611: 8 | I611: 20 | K611: 7 | L611: 8 | M611: 50 | O611: 8 | P611: 10 | Q611: 58 | S611: AGNEW :HOLT
A612: BEST PLAYERS
A613: SPRINGVALE | C613: CLARK | F613: CAPLES | I613: WELSH | L613: CARROLL | O613: JEFFS | Q613: P SCURRAH
A614: WERRIBEE | C614: NORMINGTON | F614: WALSH | I614: LESIPUTTY
A615: GOALKICKERS
A616: SPRINGVALE | C616: SIMISTER 4 | F616: P SCURRAH 2 | I616: McKENZIE 2 | L616: LYNCH | N616: JEFFS | P616: CLARK | R616: BONNICCI | U616: CARIS | W616: CARROLL
A617: WERRIBEE | C617: NORMINGTON 2 | F617: McMASTER 2 | I617: DRUM | K617: TAYLOR | M617: LAMONT | O617: WILSON
A619: PORT MELBOURNE | C619: 5 | D619: 6 | E619: 36 | G619: 9 | H619: 6 | I619: 60 | K619: 14 | L619: 16 | M619: 100 | O619: 15 | P619: 18 | Q619: 108 | S619: Venue: FRANKSTON
A620: FRANKSTON | C620: 2 | D620: 2 | E620: 14 | G620: 6 | H620: 5 | I620: 41 | K620: 7 | L620: 6 | M620: 48 | O620: 13 | P620: 10 | Q620: 88 | S620: PANOZZO :DOWSLEY
A621: BEST PLAYERS
A622: PORT MELBOURNE | C622: PRITCHARD | F622: McKINNON | I622: BAILEY | L622: A HICKS | O622: JAMES | R622: BOWDEN
A623: FRANKSTON | C623: D UCELLO | F623: BROWN | I623: RYAN | L623: GEORGE | O623: S HAMILL
A624: GOALKICKERS
A625: PORT MELBOURNE | C625: A HICKS 4 | F625: CLARK 3 | H625: LINDSAY 3 | J625: BAILEY 2 | L625: JAMES | N625: HARKINS | P625: McGAW
A626: FRANKSTON | C626: WILLIAMS 3 | F626: SVAGANOVIC 3 | I626: S HAMILL 2 | L626: RYAN 2 | N626: T HAMILL | Q626: GOOSEY | S626: SHANNON
A628: ROUND 12 | D628: 11TH JULY | I628: WEATHER | S628: Venue: PRESTON
D629: 1ST QTR | H629: 2ND QTR | L629: 3RD QTR | P629: FINAL | S629: UMPIRES
A630: PRESTON | C630: 2 | D630: 3 | E630: 15 | G630: 8 | H630: 8 | I630: 56 | K630: 13 | L630: 11 | M630: 89 | O630: 17 | P630: 11 | Q630: 113 | S630: DOWSLEY | Y630: LADDER | AB630: ROUND | AD630: 12
A631: COBURG | C631: 8 | D631: 3 | E631: 51 | G631: 8 | H631: 3 | I631: 51 | K631: 11 | L631: 5 | M631: 71 | O631: 14 | P631: 9 | Q631: 93 | S631: SNEDDON
A632: BEST PLAYERS | W632: TEAM | X632: W | Y632: L | Z632: D | AA632: FOR | AB632: AGST | AC632: % | AD632: PTS
A633: PRESTON | C633: PEZZIN | F633: GRAZIANO | I633: REEVES | L633: FINDLAY | O633: KING | Q633: MAIORANA
A634: COBURG | C634: ALESSIO | F634: INGRAM | I634: TARANTO | L634: LISTON | O634: ANGWIN | Q634: AIELLO | W634: SANDRINGHAM | X634: 11 | Y634: 1 | Z634: 0 | AA634: 1695 | AB634: 1138 | AC634: =(AA634/AB634)*100 -> 148.94551845342707 | AD634: =(X634*4)+(Z634*2) -> 44
A635: GOALKICKERS | W635: WILLIAMSTOWN | X635: 8 | Y635: 4 | Z635: 0 | AA635: 1249 | AB635: 897 | AC635: =(AA635/AB635)*100 -> 139.24191750278706 | AD635: =(X635*4)+(Z635*2) -> 32
A636: PRESTON | C636: SHAW 5 | F636: SALVADOR 3 | I636: GRAZIANO 3 | L636: PEZZIN 3 | N636: DOBBS | P636: FYFFE | R636: LUMICISI | W636: BOX HILL | X636: 8 | Y636: 4 | Z636: 0 | AA636: 1270 | AB636: 1030 | AC636: =(AA636/AB636)*100 -> 123.3009708737864 | AD636: =(X636*4)+(Z636*2) -> 32
A637: COBURG | C637: IMGRAM 6 | F637: SALVADORE 2 | I637: AIELLO 2 | K637: HARRISON | M637: TARANTO | O637: CHRISTIE | Q637: ALESSIO | W637: PRAHRAN | X637: 7 | Y637: 5 | Z637: 0 | AA637: 1431 | AB637: 1027 | AC637: =(AA637/AB637)*100 -> 139.33787731256086 | AD637: =(X637*4)+(Z637*2) -> 28
D638: 12TH JULY | I638: WEATHER | S638: Venue: PORT MELBOURNE | W638: WERRIBEE | X638: 7 | Y638: 5 | Z638: 0 | AA638: 1348 | AB638: 1136 | AC638: =(AA638/AB638)*100 -> 118.66197183098592 | AD638: =(X638*4)+(Z638*2) -> 28
A639: PORT MELBOURNE | C639: 4 | D639: 1 | E639: 25 | G639: 8 | H639: 7 | I639: 55 | K639: 13 | L639: 10 | M639: 88 | O639: 23 | P639: 11 | Q639: 149 | S639: FORSTER
A640: SPRINGVALE | C640: 4 | D640: 3 | E640: 27 | G640: 5 | H640: 10 | I640: 40 | K640: 8 | L640: 15 | M640: 63 | O640: 13 | P640: 18 | Q640: 96 | S640: LUCKMAN | W640: PRESTON | X640: 7 | Y640: 5 | Z640: 0 | AA640: 1229 | AB640: 1402 | AC640: =(AA640/AB640)*100 -> 87.660485021398003 | AD640: =(X640*4)+(Z640*2) -> 28
A641: BEST PLAYERS | W641: COBURG | X641: 6 | Y641: 6 | Z641: 0 | AA641: 1260 | AB641: 1192 | AC641: =(AA641/AB641)*100 -> 105.70469798657717 | AD641: =(X641*4)+(Z641*2) -> 24
A642: PORT MELBOURNE | C642: HARKINS | F642: DONALD | I642: EDWARDS | L642: McKINNON | O642: S BOWDEN | R642: PRITCHARD | W642: DANDEN0NG | X642: 5 | Y642: 7 | Z642: 0 | AA642: 1299 | AB642: 1247 | AC642: =(AA642/AB642)*100 -> 104.17000801924618 | AD642: =(X642*4)+(Z642*2) -> 20
A643: SPRINGVALE | C643: CAPLES | F643: LYNCH | I643: P SCURRAH | L643: SIMISTER | W643: PORT MELBOURNE | X643: 5 | Y643: 7 | Z643: 0 | AA643: 1134 | AB643: 1344 | AC643: =(AA643/AB643)*100 -> 84.375 | AD643: =(X643*4)+(Z643*2) -> 20
A644: GOALKICKERS | M644: CLARK | O644: A JAMES | Q644: R BOWDEN | W644: FRANKSTON | X644: 4 | Y644: 8 | Z644: 0 | AA644: 1090 | AB644: 1354 | AC644: =(AA644/AB644)*100 -> 80.502215657311666 | AD644: =(X644*4)+(Z644*2) -> 16
A645: PORT MELBOURNE | C645: LOVE 5 | E645: S BOWDEN 4 | H645: HARKINS 3 | J645: HICKS 3 | L645: McKINNON 2 | O645: EDWARDS 2 | R645: LAFFY | W645: SPRINGVALE | X645: 3 | Y645: 9 | Z645: 0 | AA645: 1055 | AB645: 1300 | AC645: =(AA645/AB645)*100 -> 81.15384615384616 | AD645: =(X645*4)+(Z645*2) -> 12
A646: SPRINGVALE | C646: SIMISTER 6 | F646: CAPLES 2 | I646: BONNICCI 2 | L646: D CARROLL | O646: C ELLIOTT | Q646: C PHILLIPS | W646: OAKLEIGH | X646: 1 | Y646: 11 | Z646: 0 | AA646: 891 | AB646: 1886 | AC646: =(AA646/AB646)*100 -> 47.242841993637327 | AD646: =(X646*4)+(Z646*2) -> 4
A648: SANDRINGHAM | C648: 4 | D648: 4 | E648: 28 | G648: 7 | H648: 8 | I648: 50 | K648: 17 | L648: 9 | M648: 111 | O648: 19 | P648: 9 | Q648: 123 | S648: Venue: BEACH ROAD
A649: WILLIAMSTOWN | C649: 5 | D649: 5 | E649: 35 | G649: 10 | H649: 7 | I649: 67 | K649: 11 | L649: 9 | M649: 75 | O649: 15 | P649: 12 | Q649: 102 | S649: CAULFIELD :McKERNAN
A650: BEST PLAYERS
A651: SANDRINGHAM | C651: ANGUS | F651: ARGUS | I651: JOHNSTONE | L651: TARPEY | O651: CZERKASKI | R651: RYAN
A652: WILLIAMSTOWN | C652: MITCHELL | F652: LLOYD | I652: LONG | L652: VENNER | O652: O'CONNOR
A653: GOALKICKERS
A654: SANDRINGHAM | C654: TARPEY 4 | E654: F RUGOLO 4 | H654: P GARRETT 3 | K654: C GARRETT 3 | N654: BAILEY | P654: MITCHELSON | S654: KRAKOUER | V654: WILLIAMS | X654: FOLEY
A655: WILLIAMSTOWN | C655: HARRIS 3 | E655: MINETT 2 | G655: PASTORE 2 | I655: AZIZ 2 | K655: GHAZI 2 | M655: MITCHELL | P655: RICKMAN | R655: CALLAHAN | U655: SHANKS
A657: FRANKSTON | C657: 5 | D657: 6 | E657: 36 | G657: 6 | H657: 8 | I657: 44 | K657: 10 | L657: 18 | M657: 78 | O657: 16 | P657: 21 | Q657: 117 | S657: Venue: FRANKSTON
A658: OAKLEIGH | C658: 2 | D658: 1 | E658: 13 | G658: 6 | H658: 6 | I658: 42 | K658: 11 | L658: 13 | M658: 79 | O658: 12 | P658: 14 | Q658: 86 | S658: CALLAGHAN :MURNANE
A659: BEST PLAYERS
A660: FRANKSTON | C660: WILLIAMS | F660: S HAMILL | I660: T HAMILL | L660: BROWN | O660: MARTIN
A661: OAKLEIGH | C661: DUNLOP | F661: D BRIGGS | I661: QUIRK | L661: MELLODY | O661: SIEBRAND | R661: OWEN
A662: GOALKICKERS
A663: FRANKSTON | C663: BROWN 6 | F663: GARDNER 2 | I663: McCOMB 2 | L663: T HAMILL 2 | O663: MARTIN | Q663: SHANNON | S663: RYAN | U663: ROWE
A664: OAKLEIGH | C664: OWEN 3 | F664: MELLODY 2 | I664: J CUNNINGHAM 2 | M664: W BRIGGS | O664: TODD | Q664: PANOZZO | S664: D BRIGGS | V664: CLEMENT
A666: PRAHRAN | C666: 4 | D666: 5 | E666: 29 | G666: 10 | H666: 9 | I666: 69 | K666: 13 | L666: 11 | M666: 89 | O666: 19 | P666: 17 | Q666: 131 | S666: Venue: TOORAK PARK
A667: BOX HILL | C667: 5 | D667: 3 | E667: 33 | G667: 6 | H667: 5 | I667: 41 | K667: 7 | L667: 8 | M667: 50 | O667: 7 | P667: 9 | Q667: 51 | S667: SAVILLE :NASH
A668: BEST PLAYERS
A669: PRAHRAN | C669: SHELTON | F669: SINNI | I669: WINTON | L669: MRAKOV | O669: LENNOX | R669: McCORMACK
A670: BOX HILL | C670: P BOURKE | F670: WATSON | I670: ZARAFA | L670: BANFIELD | O670: EVANS | R670: BADROCK
A671: GOALKICKERS
A672: PRAHRAN | C672: MRAKOV 5 | F672: KEIPERT 4 | I672: TAYLOR 3 | K672: TREWELLA 2 | N672: WINTON 2 | Q672: SINNI | S672: POVEY | U672: R LANGAN
A673: BOX HILL | C673: BADROCK 2 | F673: JAMES 2 | I673: CROWLEY | K673: LAWRIE | M673: STOKES
A675: WERRIBEE | C675: 4 | D675: 2 | E675: 26 | G675: 6 | H675: 9 | I675: 45 | K675: 9 | L675: 13 | M675: 67 | O675: 18 | P675: 14 | Q675: 122 | S675: Venue: WERRIBEE
A676: DANDENONG | C676: 4 | D676: 6 | E676: 30 | G676: 6 | H676: 7 | I676: 43 | K676: 9 | L676: 10 | M676: 64 | O676: 12 | P676: 13 | Q676: 85 | S676: PANOZZO :AGNEW
A677: BEST PLAYERS
A678: WERRIBEE | C678: ALLDAY | F678: EAMES | I678: McMASTER | L678: WILSON | O678: O'KEEFE | R678: WALSH
A679: DANDENONG | C679: BOURKE | F679: HOLLOW | I679: CASSETT | L679: KANNOURAKIS | O679: HALL | R679: BURNETT
A680: GOALKICKERS
A681: WERRIBEE | C681: O'KEEFE 9 | F681: BOND 2 | H681: NORMINGTON | K681: CULLEN | M681: SELLS | O681: LESIPUTTY | Q681: EAMES | S681: McMASTER | V681: M SHAW
A682: DANDENONG | C682: CASSETT 4 | F682: KNIGHT 2 | I682: LACKO 2 | K682: DOWER | M682: HALL | O682: SONNBERG | R682: WICKS
A684: ROUND 13 | D684: 18TH JULY | I684: WEATHER | S684: Venue: BOX HILL
D685: 1ST QTR | H685: 2ND QTR | L685: 3RD QTR | P685: FINAL | S685: UMPIRES
A686: SANDRINGHAM | C686: 1 | D686: 3 | E686: 9 | G686: 7 | H686: 5 | I686: 47 | K686: 8 | L686: 6 | M686: 54 | O686: 11 | P686: 8 | Q686: 74 | S686: MORROW | Y686: LADDER | AB686: ROUND | AD686: 13
A687: BOX HILL | C687: 1 | D687: 2 | E687: 8 | G687: 4 | H687: 3 | I687: 27 | K687: 10 | L687: 8 | M687: 68 | O687: 10 | P687: 11 | Q687: 71 | S687: GOLDSPINK
A688: BEST PLAYERS | W688: TEAM | X688: W | Y688: L | Z688: D | AA688: FOR | AB688: AGST | AC688: % | AD688: PTS
A689: SANDRINGHAM | C689: MITCHELSON | F689: TARPEY | I689: FOLEY | L689: KELLOWAY | O689: FORD | Q689: ALLEN
A690: BOX HILL | C690: WATSON | F690: SWAN | I690: DALRYMPLE | L690: CROWLEY | O690: ERWIN | Q690: P BOURKE | W690: SANDRINGHAM | X690: 12 | Y690: 1 | Z690: 0 | AA690: 1769 | AB690: 1209 | AC690: =(AA690/AB690)*100 -> 146.31927212572373 | AD690: =(X690*4)+(Z690*2) -> 48
A691: GOALKICKERS | P691: MOREY | W691: WILLIAMSTOWN | X691: 9 | Y691: 4 | Z691: 0 | AA691: 1357 | AB691: 967 | AC691: =(AA691/AB691)*100 -> 140.33092037228542 | AD691: =(X691*4)+(Z691*2) -> 36
A692: SANDRINGHAM | C692: FORD 3 | E692: M WILLIAMS 2 | H692: TARPEY | J692: KRAKOUER | M692: FOLEY | O692: C GARRETT | Q692: MITCHELSON | W692: PRAHRAN | X692: 8 | Y692: 5 | Z692: 0 | AA692: 1601 | AB692: 1099 | AC692: =(AA692/AB692)*100 -> 145.67788898999089 | AD692: =(X692*4)+(Z692*2) -> 32
A693: BOX HILL | C693: CROWLEY 4 | F693: BADROCK 2 | I693: P BOURKE 2 | L693: JAMES | N693: WILSON | W693: BOX HILL | X693: 8 | Y693: 5 | Z693: 0 | AA693: 1341 | AB693: 1104 | AC693: =(AA693/AB693)*100 -> 121.46739130434783 | AD693: =(X693*4)+(Z693*2) -> 32
D694: 19TH JULY | I694: WEATHER | S694: Venue: DANDENONG | W694: WERRIBEE | X694: 7 | Y694: 6 | Z694: 0 | AA694: 1408 | AB694: 1204 | AC694: =(AA694/AB694)*100 -> 116.9435215946844 | AD694: =(X694*4)+(Z694*2) -> 28
A695: PORT MELBOURNE | C695: 0 | D695: 3 | E695: 3 | G695: 2 | H695: 6 | I695: 18 | K695: 8 | L695: 9 | M695: 57 | O695: 16 | P695: 14 | Q695: 110 | S695: MURNANE
A696: DANDENONG | C696: 3 | D696: 8 | E696: 26 | G696: 6 | H696: 13 | I696: 49 | K696: 9 | L696: 16 | M696: 70 | O696: 13 | P696: 16 | Q696: 94 | S696: McKERNAN | W696: COBURG | X696: 7 | Y696: 6 | Z696: 0 | AA696: 1328 | AB696: 1252 | AC696: =(AA696/AB696)*100 -> 106.0702875399361 | AD696: =(X696*4)+(Z696*2) -> 28
A697: BEST PLAYERS | W697: PRESTON | X697: 7 | Y697: 6 | Z697: 0 | AA697: 1299 | AB697: 1510 | AC697: =(AA697/AB697)*100 -> 86.026490066225165 | AD697: =(X697*4)+(Z697*2) -> 28
A698: PORT MELBOURNE | C698: DONALD | F698: PRITCHARD | I698: BOWDEN | L698: HARKINS | O698: PAUL | R698: McKINNON | W698: PORT MELBOURNE | X698: 6 | Y698: 7 | Z698: 0 | AA698: 1244 | AB698: 1438 | AC698: =(AA698/AB698)*100 -> 86.509040333796932 | AD698: =(X698*4)+(Z698*2) -> 24
A699: DANDENONG | C699: HALL | F699: KANNOURAKIS | I699: BOURKE | L699: MILLANE | O699: CASSETT | R699: MARSHALL | W699: DANDEN0NG | X699: 5 | Y699: 8 | Z699: 0 | AA699: 1393 | AB699: 1357 | AC699: =(AA699/AB699)*100 -> 102.65291083271923 | AD699: =(X699*4)+(Z699*2) -> 20
A700: GOALKICKERS | W700: SPRINGVALE | X700: 4 | Y700: 9 | Z700: 0 | AA700: 1145 | AB700: 1352 | AC700: =(AA700/AB700)*100 -> 84.689349112426044 | AD700: =(X700*4)+(Z700*2) -> 16
A701: PORT MELBOURNE | C701: PAUL 5 | E701: BAILEY 3 | G701: BOWDEN 2 | I701: CHRIMES | K701: McKINNON | M701: HICKS | O701: DONALD | Q701: LOVE | S701: KING | W701: FRANKSTON | X701: 4 | Y701: 9 | Z701: 0 | AA701: 1142 | AB701: 1444 | AC701: =(AA701/AB701)*100 -> 79.08587257617728 | AD701: =(X701*4)+(Z701*2) -> 16
A702: DANDENONG | C702: CASSETT 3 | F702: DOWER 3 | I702: HALL 2 | K702: LACKO 2 | M702: MAGRO 2 | O702: MILLANE | W702: OAKLEIGH | X702: 1 | Y702: 12 | Z702: 0 | AA702: 963 | AB702: 2056 | AC702: =(AA702/AB702)*100 -> 46.838521400778212 | AD702: =(X702*4)+(Z702*2) -> 4
A704: PRAHRAN | C704: 6 | D704: 6 | E704: 42 | G704: 17 | H704: 10 | I704: 112 | K704: 19 | L704: 16 | M704: 130 | O704: 25 | P704: 20 | Q704: 170 | S704: Venue: OAKLEIGH
A705: OAKLEIGH | C705: 3 | D705: 3 | E705: 21 | G705: 3 | H705: 4 | I705: 22 | K705: 7 | L705: 7 | M705: 49 | O705: 10 | P705: 12 | Q705: 72 | S705: SAVILLE :FORSTER
A706: BEST PLAYERS
A707: PRAHRAN | C707: MRAKOV | F707: R LANGAN | I707: SINNI | L707: MARTELLO | O707: TREWELLA | R707: CHAPPLE
A708: OAKLEIGH | C708: TURLEY | F708: DUNLOP | I708: SIEBRAND | L708: MELLODY | O708: WELSFORD | R708: OWEN
A709: GOALKICKERS
A710: PRAHRAN | C710: MRAKOV 11 | F710: SINNI 4 | H710: TAYLOR 2 | J710: DIMMATINA 2 | M710: POVEY | O710: NOBLE | Q710: KEIPERT | S710: WINTON | V710: TREWELLA | X710: CHAPPLE
A711: OAKLEIGH | C711: OWEN 3 | F711: R CUNNINGHAM 2 | J711: ATHERTON | M711: SMITH | O711: WELSFORD | Q711: MELLODY | T711: J CUNNINGHAM
A713: COBURG | C713: 0 | D713: 1 | E713: 1 | G713: 5 | H713: 5 | I713: 35 | K713: 7 | L713: 7 | M713: 49 | O713: 10 | P713: 8 | Q713: 68 | S713: Venue: COBURG
A714: WERRIBEE | C714: 4 | D714: 4 | E714: 28 | G714: 4 | H714: 8 | I714: 32 | K714: 6 | L714: 16 | M714: 52 | O714: 7 | P714: 18 | Q714: 60 | S714: THOMPSON :LUCKMAN
A715: BEST PLAYERS
A716: COBURG | C716: BAKER | F716: AIELLO | I716: ANGWIN | L716: ZANON | O716: SHELDON | R716: FOTIA
A717: WERRIBEE | C717: CULLEN | F717: McMASTER | I717: FITZPATRICK | L717: SHEEHAN | O717: WILSON
A718: GOALKICKERS
A719: COBURG | C719: ONLEY 3 | F719: INGRAM 2 | I719: FOTIA 2 | K719: KOURKAMELIS 2 | N719: SALVADORE
A720: WERRIBEE | C720: O'KEEFE 2 | F720: WRIGHT | I720: BOND | K720: KNIGHTS | M720: LESIPUTTY | O720: CULLEN
A722: SPRINGVALE | C722: 5 | D722: 5 | E722: 35 | G722: 7 | H722: 6 | I722: 48 | K722: 10 | L722: 11 | M722: 71 | O722: 13 | P722: 12 | Q722: 90 | S722: Venue: SPRINGVALE
A723: FRANKSTON | C723: 0 | D723: 0 | E723: 0 | G723: 5 | H723: 6 | I723: 36 | K723: 6 | L723: 8 | M723: 44 | O723: 7 | P723: 10 | Q723: 52 | S723: NORDEN :VINEY
A724: BEST PLAYERS
A725: SPRINGVALE | C725: JEFFS | F725: LYNCH | I725: McKENZIE | L725: CLARK | O725: WELSH | Q725: CARIS
A726: FRANKSTON | C726: WILLIAMS | F726: BOONKAMP | I726: POLLOCK | L726: SHANNON
A727: GOALKICKERS
A728: SPRINGVALE | C728: SIMISTER 5 | F728: CARIS 2 | H728: McKENZIE 2 | K728: PHILLIPS 2 | N728: P SCURRAH | Q728: FOGARTY
A729: FRANKSTON | C729: G STROUD 3 | F729: RYAN | H729: WILLIAMS | J729: HAMILL | L729: BRENNAN
A731: WILLIAMSTOWN | C731: 5 | D731: 5 | E731: 35 | G731: 10 | H731: 8 | I731: 68 | K731: 14 | L731: 9 | M731: 93 | O731: 16 | P731: 12 | Q731: 108 | S731: Venue: WILLIAMSTOWN
A732: PRESTON | C732: 0 | D732: 0 | E732: 0 | G732: 2 | H732: 5 | I732: 17 | K732: 5 | L732: 7 | M732: 37 | O732: 10 | P732: 10 | Q732: 70 | S732: SNEDDON :NASH
A733: BEST PLAYERS
A734: WILLIAMSTOWN | C734: PERRY | F734: PASTORE | I734: HOWLETT | L734: VENNER | O734: KOENIG | R734: GHAZI
A735: PRESTON | C735: BURROWS | F735: MAY | I735: FINDLAY | L735: MUNRIVANA | O735: BIZZOTTO | R735: WALKER
A736: GOALKICKERS
A737: WILLIAMSTOWN | C737: RICKMAN 6 | F737: GHAZI 3 | H737: MINETT 2 | J737: PASTORE | L737: AZIZ | M737: O'CONNOR | O737: ZAMKYL | Q737: SHANKS
A738: PRESTON | C738: SHAW 3 | F738: MAY 2 | H738: SALVADOR | J738: REEVES | L738: GRAZIANO | N738: ATKINSON | Q738: PERCY
A740: ROUND 14 | D740: 25TH JULY | I740: WEATHER | S740: Venue: SPRINGVALE
D741: 1ST QTR | H741: 2ND QTR | L741: 3RD QTR | P741: FINAL | S741: UMPIRES
A742: SPRINGVALE | C742: 3 | D742: 5 | E742: 23 | G742: 6 | H742: 9 | I742: 45 | K742: 8 | L742: 11 | M742: 59 | O742: 12 | P742: 12 | Q742: 84 | S742: MORROW | Y742: LADDER | AB742: ROUND | AD742: 14
A743: DANDENONG | C743: 0 | D743: 3 | E743: 3 | G743: 0 | H743: 7 | I743: 7 | K743: 3 | L743: 9 | M743: 27 | O743: 6 | P743: 12 | Q743: 48 | S743: NASH
A744: BEST PLAYERS | W744: TEAM | X744: W | Y744: L | Z744: D | AA744: FOR | AB744: AGST | AC744: % | AD744: PTS
A745: SPRINGVALE | C745: PHILLIPS | F745: D CARROLL | I745: P SCURRAH | L745: CLARK | O745: HARDWICK | R745: WELSH
A746: DANDENONG | C746: BOURKE | F746: WICKS | I746: LACKO | L746: HOLLOW | O746: MILLANE | W746: SANDRINGHAM | X746: 13 | Y746: 1 | Z746: 0 | AA746: 2014 | AB746: 1264 | AC746: =(AA746/AB746)*100 -> 159.3354430379747 | AD746: =(X746*4)+(Z746*2) -> 52
A747: GOALKICKERS | P747: HARDWICK | W747: WILLIAMSTOWN | X747: 9 | Y747: 5 | Z747: 0 | AA747: 1488 | AB747: 1043 | AC747: =(AA747/AB747)*100 -> 142.66538830297219 | AD747: =(X747*4)+(Z747*2) -> 36
A748: SPRINGVALE | C748: SIMISTER 3 | F748: GOLDBERG 2 | I748: PHILLIPS 2 | K748: D CARROLL 2 | N748: FERGUSON | Q748: S SCURRAH | W748: BOX HILL | X748: 9 | Y748: 5 | Z748: 0 | AA748: 1495 | AB748: 1166 | AC748: =(AA748/AB748)*100 -> 128.21612349914238 | AD748: =(X748*4)+(Z748*2) -> 36
A749: DANDENONG | C749: CASSETT 3 | F749: MAGRO | H749: MILLANE | J749: SONNBERG | W749: PRAHRAN | X749: 8 | Y749: 6 | Z749: 0 | AA749: 1736 | AB749: 1258 | AC749: =(AA749/AB749)*100 -> 137.99682034976152 | AD749: =(X749*4)+(Z749*2) -> 32
D750: 26TH JULY | I750: WEATHER | S750: Venue: PORT MELBOURNE | W750: WERRIBEE | X750: 8 | Y750: 6 | Z750: 0 | AA750: 1539 | AB750: 1280 | AC750: =(AA750/AB750)*100 -> 120.234375 | AD750: =(X750*4)+(Z750*2) -> 32
A751: PORT MELBOURNE | C751: 4 | D751: 6 | E751: 30 | G751: 6 | H751: 8 | I751: 44 | K751: 13 | L751: 14 | M751: 92 | O751: 20 | P751: 19 | Q751: 139 | S751: NORDEN | W751: COBURG | X751: 7 | Y751: 7 | Z751: 0 | AA751: 1455 | AB751: 1391 | AC751: =(AA751/AB751)*100 -> 104.60100647016534 | AD751: =(X751*4)+(Z751*2) -> 28
A752: COBURG | C752: 4 | D752: 4 | E752: 28 | G752: 11 | H752: 8 | I752: 74 | K752: 15 | L752: 11 | M752: 101 | O752: 19 | P752: 13 | Q752: 127 | S752: SAVILLE | W752: PORT MELBOURNE | X752: 7 | Y752: 7 | Z752: 0 | AA752: 1383 | AB752: 1565 | AC752: =(AA752/AB752)*100 -> 88.370607028753994 | AD752: =(X752*4)+(Z752*2) -> 28
A753: BEST PLAYERS | W753: PRESTON | X753: 7 | Y753: 7 | Z753: 0 | AA753: 1361 | AB753: 1664 | AC753: =(AA753/AB753)*100 -> 81.790865384615387 | AD753: =(X753*4)+(Z753*2) -> 28
A754: PORT MELBOURNE | C754: MUTIMER | F754: DONALD | I754: EDWARDS | L754: LOVE | O754: R BOWDEN | R754: S BOWDEN | W754: DANDEN0NG | X754: 5 | Y754: 9 | Z754: 0 | AA754: 1441 | AB754: 1441 | AC754: =(AA754/AB754)*100 -> 100 | AD754: =(X754*4)+(Z754*2) -> 20
A755: COBURG | C755: BAKER | F755: SALVADORE | I755: ALESSIO | L755: LOONE | O755: KENNEDY | W755: SPRINGVALE | X755: 5 | Y755: 9 | Z755: 0 | AA755: 1229 | AB755: 1400 | AC755: =(AA755/AB755)*100 -> 87.785714285714292 | AD755: =(X755*4)+(Z755*2) -> 20
A756: GOALKICKERS | W756: FRANKSTON | X756: 5 | Y756: 9 | Z756: 0 | AA756: 1301 | AB756: 1579 | AC756: =(AA756/AB756)*100 -> 82.393920202659913 | AD756: =(X756*4)+(Z756*2) -> 20
A757: PORT MELBOURNE | C757: LOVE 7 | E757: BAILEY 3 | G757: BOWDEN 3 | I757: HARKINS 2 | K757: HICKS 2 | M757: DONALD 2 | O757: McKINNON | W757: OAKLEIGH | X757: 1 | Y757: 13 | Z757: 0 | AA757: 1018 | AB757: 2301 | AC757: =(AA757/AB757)*100 -> 44.241634072142553 | AD757: =(X757*4)+(Z757*2) -> 4
A758: COBURG | C758: SALVADORE 3 | F758: ONLEY 3 | H758: HARRISON 3 | K758: INGRAM 2 | M758: KAAKOUR 2 | P758: LOONE 2 | R758: KENNEDY
O759: RACOVOLIS | Q759: GUMLEY | S759: FOTIA
A760: FRANKSTON | C760: 7 | D760: 1 | E760: 43 | G760: 11 | H760: 3 | I760: 69 | K760: 20 | L760: 7 | M760: 127 | O760: 25 | P760: 9 | Q760: 159 | S760: Venue: FRANKSTON
A761: PRAHRAN | C761: 2 | D761: 2 | E761: 14 | G761: 8 | H761: 6 | I761: 54 | K761: 13 | L761: 10 | M761: 88 | O761: 20 | P761: 15 | Q761: 135 | S761: URWIN :PRICE
A762: BEST PLAYERS
A763: FRANKSTON | C763: GAHAN | F763: S HAMILL | I763: GARDNER | L763: BOONKAMP | O763: T HAMILL | R763: WILLIAMS
A764: PRAHRAN | C764: TAYLOR | F764: CHAPPLE | I764: DIMMATINA | L764: POVEY | O764: PROBERT | R764: MARTELLO
A765: GOALKICKERS
A766: FRANKSTON | C766: GARDNER 8 | F766: S HAMILL 5 | I766: STROUD 3 | K766: RYAN 3 | M766: WILLIAMS | P766: BOONKAMP | R766: WILSON | U766: BROWN | W766: SHANNON | X766: GAHAN
A767: PRAHRAN | C767: TAYLOR 6 | F767: MRAKOV 4 | I767: TREWELLA 3 | L767: KEIPERT 3 | N767: POVEY 2 | P767: DIMMATINA | S767: SINNI
A769: SANDRINGHAM | C769: 7 | D769: 6 | E769: 48 | G769: 13 | H769: 9 | I769: 87 | K769: 25 | L769: 15 | M769: 165 | O769: 38 | P769: 17 | Q769: 245 | S769: Venue: BEACH ROAD
A770: OAKLEIGH | C770: 3 | D770: 2 | E770: 20 | G770: 3 | H770: 5 | I770: 23 | K770: 3 | L770: 5 | M770: 23 | O770: 8 | P770: 7 | Q770: 55 | S770: THOMPSON :RICHARDSON
A771: BEST PLAYERS
A772: SANDRINGHAM | C772: TARPEY | F772: KELLOWAY | I772: J RUGOLO | L772: MITCHELSON | O772: FORD | R772: ALLEN
A773: OAKLEIGH | C773: SMITH | F773: OWEN | I773: DUNLOP | L773: QUIRK | O773: WELSFORD
A774: GOALKICKERS | S774: KRAKOUER | V774: JOHNSTONE
A775: SANDRINGHAM | C775: TARPEY 12 | F775: FORD 7 | H775: WILLIAMS 4 | J775: F RUGOLO 3 | M775: BAILEY 2 | O775: CZERKASKI 2 | R775: MOREY 2 | U775: KELLOWAY | X775: P GARRETT | AA775: C GARRETT | AC775: J RUGOLO
A776: OAKLEIGH | C776: ATHERTON 2 | F776: R CUNNINGHAM 2 | J776: DESSENT | L776: J CUNNINGHAM | O776: TURLEY | Q776: SMITH
A778: BOX HILL | C778: 4 | D778: 3 | E778: 27 | G778: 9 | H778: 7 | I778: 61 | K778: 15 | L778: 9 | M778: 99 | O778: 23 | P778: 16 | Q778: 154 | S778: Venue: PRESTON
A779: PRESTON | C779: 4 | D779: 4 | E779: 28 | G779: 5 | H779: 5 | I779: 35 | K779: 8 | L779: 6 | M779: 54 | O779: 9 | P779: 8 | Q779: 62 | S779: VINEY :LUCKMAN
A780: BEST PLAYERS
A781: BOX HILL | C781: JAMES | F781: P BOURKE | I781: BEALE | L781: PENNY | O781: ERWIN | R781: BANFIELD
A782: PRESTON | C782: KING | F782: FYFFE | I782: LAMBETH
A783: GOALKICKERS
A784: BOX HILL | C784: JAMES 8 | F784: MOLLOY 4 | I784: HOGAN 3 | K784: P BOURKE 2 | N784: CROWLEY 2 | Q784: LISLE 2 | S784: EVANS | U784: WATSON
A785: PRESTON | C785: SHAW 2 | F785: SALVADOR 2 | I785: ATKINSON | L785: GRAZIANO | N785: LUMICISI | P785: PARKER | R785: JORDAN
A787: WERRIBEE | C787: 4 | D787: 7 | E787: 31 | G787: 10 | H787: 12 | I787: 72 | K787: 15 | L787: 13 | M787: 103 | O787: 19 | P787: 17 | Q787: 131 | S787: Venue: WERRIBEE
A788: WILLIAMSTOWN | C788: 2 | D788: 3 | E788: 15 | G788: 6 | H788: 5 | I788: 41 | K788: 10 | L788: 9 | M788: 69 | O788: 11 | P788: 10 | Q788: 76 | S788: CARLAND :CALLAGHAN
A789: BEST PLAYERS
A790: WERRIBEE | C790: NORMINGTON | F790: RAEBURN | I790: GEARY | L790: ALLDAY | O790: EAMES | R790: WILSON
A791: WILLIAMSTOWN | C791: MITCHELL | F791: PASTORE | I791: HOWLETT
A792: GOALKICKERS
A793: WERRIBEE | C793: O'KEEFE 6 | F793: McMASTER 3 | I793: RAEBURN 3 | L793: GEARY 2 | N793: WRIGHT | P793: ALLDAY | R793: CULLEN | U793: WATTS | X793: WILSON
A794: WILLIAMSTOWN | C794: RICKMAN 3 | F794: PASTORE 3 | I794: MINETT | K794: ZAMKYL | M794: GHAZI | O794: AZIZ | Q794: HARRIS
A796: ROUND 15 | D796: 1ST AUGUST | I796: WEATHER | S796: Venue: WILLIAMSTOWN
D797: 1ST QTR | H797: 2ND QTR | L797: 3RD QTR | P797: FINAL | S797: UMPIRES
A798: WILLIAMSTOWN | C798: 2 | D798: 4 | E798: 16 | G798: 4 | H798: 9 | I798: 33 | K798: 11 | L798: 13 | M798: 79 | O798: 15 | P798: 18 | Q798: 108 | S798: FORSTER | Y798: LADDER | AB798: ROUND | AD798: 15
A799: PORT MELBOURNE | C799: 0 | D799: 2 | E799: 2 | G799: 3 | H799: 4 | I799: 22 | K799: 4 | L799: 6 | M799: 30 | O799: 9 | P799: 8 | Q799: 62 | S799: THOMPSON
A800: BEST PLAYERS | W800: TEAM | X800: W | Y800: L | Z800: D | AA800: FOR | AB800: AGST | AC800: % | AD800: PTS
A801: WILLIAMSTOWN | C801: O'CONNOR | F801: VENNER | I801: WILLIAMS | L801: SWAN | O801: LLOYD | R801: HOWLETT
A802: PORT MELBOURNE | C802: EDWARDS | F802: MUTIMER | I802: S BOWDEN | L802: HART | O802: CHRIMES | R802: R BOWDEN | W802: SANDRINGHAM | X802: 13 | Y802: 2 | Z802: 0 | AA802: 2081 | AB802: 1350 | AC802: =(AA802/AB802)*100 -> 154.14814814814815 | AD802: =(X802*4)+(Z802*2) -> 52
A803: GOALKICKERS | W803: WILLIAMSTOWN | X803: 10 | Y803: 5 | Z803: 0 | AA803: 1596 | AB803: 1105 | AC803: =(AA803/AB803)*100 -> 144.43438914027149 | AD803: =(X803*4)+(Z803*2) -> 40
A804: WILLIAMSTOWN | C804: RICKMAN 7 | F804: HARRIS 2 | H804: GOULD 2 | J804: WILLIAMS | M804: SMITH | O804: GHAZI | Q804: AZIZ | W804: BOX HILL | X804: 10 | Y804: 5 | Z804: 0 | AA804: 1586 | AB804: 1224 | AC804: =(AA804/AB804)*100 -> 129.57516339869281 | AD804: =(X804*4)+(Z804*2) -> 40
A805: PORT MELBOURNE | C805: LOVE 4 | E805: S BOWDEN | H805: BAILEY | J805: CLARK | L805: DONALD | N805: HARKINS | W805: PRAHRAN | X805: 9 | Y805: 6 | Z805: 0 | AA805: 1822 | AB805: 1325 | AC805: =(AA805/AB805)*100 -> 137.50943396226415 | AD805: =(X805*4)+(Z805*2) -> 36
D806: 2ND AUGUST | I806: WEATHER | S806: Venue: BOX HILL | W806: WERRIBEE | X806: 8 | Y806: 7 | Z806: 0 | AA806: 1597 | AB806: 1371 | AC806: =(AA806/AB806)*100 -> 116.48431801604669 | AD806: =(X806*4)+(Z806*2) -> 32
A807: BOX HILL | C807: 4 | D807: 4 | E807: 28 | G807: 7 | H807: 8 | I807: 50 | K807: 10 | L807: 11 | M807: 71 | O807: 13 | P807: 13 | Q807: 91 | S807: NORDEN
A808: WERRIBEE | C808: 2 | D808: 2 | E808: 14 | G808: 3 | H808: 4 | I808: 22 | K808: 7 | L808: 8 | M808: 50 | O808: 8 | P808: 10 | Q808: 58 | S808: FALLET | W808: PRESTON | X808: 8 | Y808: 7 | Z808: 0 | AA808: 1472 | AB808: 1731 | AC808: =(AA808/AB808)*100 -> 85.037550548815716 | AD808: =(X808*4)+(Z808*2) -> 32
A809: BEST PLAYERS | W809: COBURG | X809: 7 | Y809: 8 | Z809: 0 | AA809: 1539 | AB809: 1493 | AC809: =(AA809/AB809)*100 -> 103.08104487608843 | AD809: =(X809*4)+(Z809*2) -> 28
A810: BOX HILL | C810: LISLE | F810: PENNY | I810: EVANS | L810: BANFIELD | O810: HOGAN | R810: CROWLEY | W810: PORT MELBOURNE | X810: 7 | Y810: 8 | Z810: 0 | AA810: 1445 | AB810: 1673 | AC810: =(AA810/AB810)*100 -> 86.371787208607287 | AD810: =(X810*4)+(Z810*2) -> 28
A811: WERRIBEE | C811: WALSH | F811: CULLEN | I811: WATTS | W811: DANDEN0NG | X811: 6 | Y811: 9 | Z811: 0 | AA811: 1590 | AB811: 1512 | AC811: =(AA811/AB811)*100 -> 105.15873015873017 | AD811: =(X811*4)+(Z811*2) -> 24
A812: GOALKICKERS | W812: SPRINGVALE | X812: 6 | Y812: 9 | Z812: 0 | AA812: 1331 | AB812: 1484 | AC812: =(AA812/AB812)*100 -> 89.690026954177895 | AD812: =(X812*4)+(Z812*2) -> 24
A813: BOX HILL | C813: EVANS 4 | F813: MOLLOY 3 | I813: CROWLEY 2 | L813: DALY 2 | N813: BEALE | P813: MI ERWIN | W813: FRANKSTON | X813: 5 | Y813: 10 | Z813: 0 | AA813: 1372 | AB813: 1728 | AC813: =(AA813/AB813)*100 -> 79.398148148148152 | AD813: =(X813*4)+(Z813*2) -> 20
A814: WERRIBEE | C814: KNIGHT 2 | F814: EAMES 2 | H814: WALSH | J814: ALDERDICE | M814: WILSON | O814: J TAYLOR | W814: OAKLEIGH | X814: 1 | Y814: 14 | Z814: 0 | AA814: 1085 | AB814: 2412 | AC814: =(AA814/AB814)*100 -> 44.983416252072963 | AD814: =(X814*4)+(Z814*2) -> 4
A816: SPRINGVALE | C816: 3 | D816: 3 | E816: 21 | G816: 10 | H816: 7 | I816: 67 | K816: 14 | L816: 10 | M816: 94 | O816: 15 | P816: 12 | Q816: 102 | S816: Venue: COBURG
A817: COBURG | C817: 8 | D817: 2 | E817: 50 | G817: 8 | H817: 7 | I817: 55 | K817: 9 | L817: 9 | M817: 63 | O817: 12 | P817: 12 | Q817: 84 | S817: THOMPSON :RICHARDSON
A818: BEST PLAYERS
A819: SPRINGVALE | C819: S SCURRAH | F819: P SCURRAH | I819: HARDWICK | L819: FERGUSON | O819: GOLDBERG | R819: SIMISTER
A820: COBURG | C820: BENSTEAD | F820: KENNEDY | I820: FOTIA | L820: TARANTO | O820: ALLISON
A821: GOALKICKERS
A822: SPRINGVALE | C822: SIMISTER 5 | F822: GOLDBERG 3 | I822: PHILLIPS 3 | K822: R ELLIOTT | M822: FERGUSON | O822: MCKENZIE | Q822: P SCURRAH
A823: COBURG | C823: ONLEY 4 | F823: KAAKOUR 3 | I823: KENNEDY 2 | L823: BENSTEAD | O823: HARRISON | Q823: RACOVOLIS
A825: DANDENONG | C825: 5 | D825: 1 | E825: 31 | G825: 10 | H825: 6 | I825: 66 | K825: 16 | L825: 10 | M825: 106 | O825: 22 | P825: 17 | Q825: 149 | S825: Venue: DANDENONG
A826: FRANKSTON | C826: 2 | D826: 0 | E826: 12 | G826: 6 | H826: 1 | I826: 37 | K826: 10 | L826: 3 | M826: 63 | O826: 11 | P826: 5 | Q826: 71 | S826: MARSHALL :LUCKMAN
A827: BEST PLAYERS
A828: DANDENONG | C828: HALL | F828: MILLIGAN | I828: CASSETT | L828: MILLANE | O828: LACKO | R828: KENNEDY
A829: FRANKSTON | C829: GOOSEY | F829: GARDNER
A830: GOALKICKERS | R830: TAYLOR
A831: DANDENONG | C831: BURNELL 5 | F831: CASSETT 3 | I831: MILLIGAN 3 | L831: GOTCH 2 | N831: BOURKE | P831: DOWER | R831: HALL | T831: KENNEDY | W831: KANNOURAKIS | X831: C KNIGHT | AA831: LACKO | AC831: MILLANE
A832: FRANKSTON | C832: GARDNER 4 | F832: BROWN 2 | I832: HILLARD | K832: PARKER | M832: VANDERMEER | P832: SHANNON | R832: BOONKAMP
A834: PRESTON | C834: 3 | D834: 2 | E834: 20 | G834: 8 | H834: 8 | I834: 56 | K834: 12 | L834: 11 | M834: 83 | O834: 16 | P834: 15 | Q834: 111 | S834: Venue: OAKLEIGH
A835: OAKLEIGH | C835: 6 | D835: 3 | E835: 39 | G835: 7 | H835: 6 | I835: 48 | K835: 10 | L835: 6 | M835: 66 | O835: 10 | P835: 7 | Q835: 67 | S835: MORROW :URWIN
A836: BEST PLAYERS
A837: PRESTON | C837: FYFFE | F837: SHAW | I837: KING | L837: BURROWS | O837: LAMBETH | R837: JORDAN
A838: OAKLEIGH | C838: TURLEY | F838: DUNLOP | I838: SIEBRAND | L838: GILES | O838: R CUNNINGHAM
A839: GOALKICKERS
A840: PRESTON | C840: SHAW 8 | F840: VALKANIS 2 | I840: LUMICISI 2 | L840: REEVES | N840: OWEN | P840: KING | R840: FYFFE
A841: OAKLEIGH | C841: DI NATALE 2 | F841: TURLEY 2 | I841: GARBUIO 2 | L841: R CUNNINGHAM | O841: J CUNNINGHAM | R841: MELLODY | U841: WELSFORD
A843: PRAHRAN | C843: 2 | D843: 2 | E843: 14 | G843: 7 | H843: 3 | I843: 45 | K843: 10 | L843: 7 | M843: 67 | O843: 13 | P843: 8 | Q843: 86 | S843: Venue: TOORAK PARK
A844: SANDRINGHAM | C844: 4 | D844: 4 | E844: 28 | G844: 6 | H844: 8 | I844: 44 | K844: 7 | L844: 8 | M844: 50 | O844: 9 | P844: 13 | Q844: 67 | S844: CARLAND :VINEY
A845: BEST PLAYERS
A846: PRAHRAN | C846: LENNOX | F846: DIMMATINA | I846: SINNI | L846: WINTON | O846: MARTELLO | R846: KILEY
A847: SANDRINGHAM | C847: BAILEY | F847: CZERKASKI | I847: RYAN | L847: LAMBERT | O847: MACKENZIE | R847: TARPEY
A848: GOALKICKERS
A849: PRAHRAN | C849: SINNI 3 | E849: KEIPERT 3 | G849: TAYLOR 2 | I849: R LANGAN 2 | L849: DIMMATINA | N849: PROBERT | P849: MRAKOV
A850: SANDRINGHAM | C850: FORD 5 | F850: TARPEY | H850: J RUGOLO | J850: WILLIAMS | M850: P GARRETT
A852: ROUND 16 | D852: 8TH AUGUST | I852: WEATHER | S852: Venue: PRESTON
D853: 1ST QTR | H853: 2ND QTR | L853: 3RD QTR | P853: FINAL | S853: UMPIRES
A854: PRAHRAN | C854: 3 | D854: 6 | E854: 24 | G854: 7 | H854: 9 | I854: 51 | K854: 12 | L854: 13 | M854: 85 | O854: 14 | P854: 15 | Q854: 99 | S854: NORDEN | Y854: LADDER | AB854: ROUND | AD854: 16
A855: PRESTON | C855: 2 | D855: 5 | E855: 17 | G855: 4 | H855: 10 | I855: 34 | K855: 4 | L855: 11 | M855: 35 | O855: 10 | P855: 13 | Q855: 73 | S855: FORSTER
A856: BEST PLAYERS | W856: TEAM | X856: W | Y856: L | Z856: D | AA856: FOR | AB856: AGST | AC856: % | AD856: PTS
A857: PRAHRAN | C857: McCORMACK | F857: POVEY | I857: PROBERT | L857: R LANGAN | O857: LENNOX | R857: MARTELLO
A858: PRESTON | C858: BURROWS | F858: FYFFE | I858: KING | W858: SANDRINGHAM | X858: 14 | Y858: 2 | Z858: 0 | AA858: 2192 | AB858: 1444 | AC858: =(AA858/AB858)*100 -> 151.80055401662048 | AD858: =(X858*4)+(Z858*2) -> 56
A859: GOALKICKERS | S859: KILEY | W859: WILLIAMSTOWN | X859: 11 | Y859: 5 | Z859: 0 | AA859: 1693 | AB859: 1188 | AC859: =(AA859/AB859)*100 -> 142.50841750841752 | AD859: =(X859*4)+(Z859*2) -> 44
A860: PRAHRAN | C860: TAYLOR 4 | E860: SINNI 2 | G860: POVEY | I860: KEIPERT | K860: WINTON | M860: TREWELLA | O860: LENNOX | Q860: MRAKOV | S860: R LANGAN | W860: PRAHRAN | X860: 10 | Y860: 6 | Z860: 0 | AA860: 1921 | AB860: 1398 | AC860: =(AA860/AB860)*100 -> 137.41058655221744 | AD860: =(X860*4)+(Z860*2) -> 40
A861: PRESTON | C861: SHAW 3 | F861: NICOLAOU 2 | I861: REEVES | K861: VALKANIS | M861: FYFFE | O861: TUCKER | Q861: CALLANDER | W861: BOX HILL | X861: 10 | Y861: 6 | Z861: 0 | AA861: 1704 | AB861: 1347 | AC861: =(AA861/AB861)*100 -> 126.50334075723831 | AD861: =(X861*4)+(Z861*2) -> 40
D862: 9TH AUGUST | I862: WEATHER | S862: Venue: BOX HILL | W862: WERRIBEE | X862: 9 | Y862: 7 | Z862: 0 | AA862: 1804 | AB862: 1442 | AC862: =(AA862/AB862)*100 -> 125.10402219140084 | AD862: =(X862*4)+(Z862*2) -> 36
A863: PORT MELBOURNE | C863: 6 | D863: 0 | E863: 36 | G863: 12 | H863: 1 | I863: 73 | K863: 14 | L863: 3 | M863: 87 | O863: 20 | P863: 3 | Q863: 123 | S863: ANTHONY
A864: BOX HILL | C864: 1 | D864: 4 | E864: 10 | G864: 6 | H864: 5 | I864: 41 | K864: 13 | L864: 10 | M864: 88 | O864: 17 | P864: 16 | Q864: 118 | S864: HARVEY | W864: PORT MELBOURNE | X864: 8 | Y864: 8 | Z864: 0 | AA864: 1568 | AB864: 1791 | AC864: =(AA864/AB864)*100 -> 87.548855388051379 | AD864: =(X864*4)+(Z864*2) -> 32
A865: BEST PLAYERS | W865: PRESTON | X865: 8 | Y865: 8 | Z865: 0 | AA865: 1545 | AB865: 1830 | AC865: =(AA865/AB865)*100 -> 84.426229508196727 | AD865: =(X865*4)+(Z865*2) -> 32
A866: PORT MELBOURNE | C866: LAFFY | F866: LOVE | I866: HARKINS | L866: HART | N866: R BOWDEN | Q866: S BOWDEN | W866: DANDEN0NG | X866: 7 | Y866: 9 | Z866: 0 | AA866: 1735 | AB866: 1547 | AC866: =(AA866/AB866)*100 -> 112.15255332902392 | AD866: =(X866*4)+(Z866*2) -> 28
A867: BOX HILL | C867: BADROCK | F867: P BOURKE | I867: MI ERWIN | L867: DALY | N867: ZARAFA | Q867: LISLE | W867: COBURG | X867: 7 | Y867: 9 | Z867: 0 | AA867: 1574 | AB867: 1638 | AC867: =(AA867/AB867)*100 -> 96.092796092796092 | AD867: =(X867*4)+(Z867*2) -> 28
A868: GOALKICKERS | W868: SPRINGVALE | X868: 6 | Y868: 10 | Z868: 0 | AA868: 1414 | AB868: 1581 | AC868: =(AA868/AB868)*100 -> 89.437065148640102 | AD868: =(X868*4)+(Z868*2) -> 24
A869: PORT MELBOURNE | C869: LOVE 9 | E869: R BOWDEN 3 | H869: A JAMES 3 | J869: S BOWDEN | M869: DONALD | O869: HARKINS | Q869: RYDER | S869: WILLIAMS | W869: FRANKSTON | X869: 5 | Y869: 11 | Z869: 0 | AA869: 1466 | AB869: 1839 | AC869: =(AA869/AB869)*100 -> 79.717237629146283 | AD869: =(X869*4)+(Z869*2) -> 20
A870: BOX HILL | C870: JAMES 6 | E870: BADROCK 4 | H870: CROWLEY 2 | K870: DALY 2 | M870: MI ERWIN | O870: EVANS | Q870: MOLLOY | W870: OAKLEIGH | X870: 1 | Y870: 15 | Z870: 0 | AA870: 1156 | AB870: 2619 | AC870: =(AA870/AB870)*100 -> 44.138984345169909 | AD870: =(X870*4)+(Z870*2) -> 4
A872: SANDRINGHAM | C872: 0 | D872: 2 | E872: 2 | G872: 4 | H872: 3 | I872: 27 | K872: 11 | L872: 6 | M872: 72 | O872: 17 | P872: 9 | Q872: 111 | S872: Venue: FRANKSTON
A873: FRANKSTON | C873: 3 | D873: 3 | E873: 21 | G873: 5 | H873: 10 | I873: 40 | K873: 7 | L873: 14 | M873: 56 | O873: 13 | P873: 16 | Q873: 94 | S873: THOMPSON :ALLEN
A874: BEST PLAYERS
A875: SANDRINGHAM | C875: MACKENZIE | F875: ARGUS | I875: WILLIAMS | L875: GOLDBERG | O875: TARPEY
A876: FRANKSTON | C876: PYM | F876: WILLIAMS | I876: SHANNON | L876: COCHRANE | O876: GOOSEY | R876: GAHAN
A877: GOALKICKERS
A878: SANDRINGHAM | C878: MACKENZIE 3 | F878: WILLIAMS 2 | I878: MOREY 2 | K878: FOLEY 2 | M878: GORIZIDIS 2 | P878: FORD 2 | R878: TARPEY | U878: P GARRETT | X878: GOLDBERG | AA878: KELLOWAY
A879: FRANKSTON | C879: GARDNER 4 | F879: PYM 4 | H879: PARKER | J879: SHANNON | M879: RYAN | O879: McCOMB | Q879: COCHRANE
A881: WERRIBEE | C881: 6 | D881: 8 | E881: 44 | G881: 13 | H881: 16 | I881: 94 | K881: 21 | L881: 23 | M881: 149 | O881: 30 | P881: 27 | Q881: 207 | S881: Venue: WERRIBEE
A882: OAKLEIGH | C882: 2 | D882: 0 | E882: 12 | G882: 5 | H882: 1 | I882: 31 | K882: 7 | L882: 2 | M882: 44 | O882: 11 | P882: 5 | Q882: 71 | S882: SNEDDON :NASH
A883: BEST PLAYERS
A884: WERRIBEE | C884: SHEAHAN | F884: WILSON | I884: BUTTON | L884: McMASTER | O884: KNIGHT | R884: WATTS
A885: OAKLEIGH | C885: QUIRK | F885: SIEBRAND | I885: MELLODY | L885: TODD | O885: SUTHERLAND | R885: GILES
A886: GOALKICKERS | Q886: FITZPATRICK | S886: BUCK
A887: WERRIBEE | C887: SELLS 5 | E887: KNIGHT 4 | G887: O'KEEFE 3 | I887: WRIGHT 3 | K887: McMASTER 2 | N887: MURPHY 2 | Q887: LAMONT 2 | S887: WALSH 2 | U887: WATTS 2 | W887: MORRIS | X887: BUTTON | AA887: ALLDAY
A888: OAKLEIGH | C888: GARBUIO 3 | F888: SUTHERLAND 2 | I888: OWEN 2 | K888: CUNNINGHAM | N888: TODD | P888: DUNLOP | R888: QUIRK
A890: DANDENONG | C890: 2 | D890: 3 | E890: 15 | G890: 6 | H890: 6 | I890: 42 | K890: 13 | L890: 13 | M890: 91 | O890: 21 | P890: 19 | Q890: 145 | S890: Venue: DANDENONG
A891: COBURG | C891: 1 | D891: 0 | E891: 6 | G891: 3 | H891: 1 | I891: 19 | K891: 3 | L891: 4 | M891: 22 | O891: 5 | P891: 5 | Q891: 35 | S891: FALLET :VINEY
A892: BEST PLAYERS
A893: DANDENONG | C893: MILLANE | F893: HALL | I893: TAYLOR | L893: MILLIGAN | O893: BOURKE | R893: HOLLOW
A894: COBURG | C894: BAKER | F894: ALESSIO | I894: SALVADORE | L894: TARANTO | O894: ALLISON
A895: GOALKICKERS
A896: DANDENONG | C896: DOWER 6 | F896: BURNELL 3 | I896: HALL 3 | K896: WICKS 3 | M896: BOURKE 2 | O896: CASSETT 2 | Q896: HOLLOW | S896: LACKO
A897: COBURG | C897: ONLEY 2 | F897: GRIFFITHS | I897: ALESSIO | K897: GUMLEY
A899: WILLIAMSTOWN | C899: 1 | D899: 0 | E899: 6 | G899: 5 | H899: 4 | I899: 34 | K899: 6 | L899: 6 | M899: 42 | O899: 14 | P899: 13 | Q899: 97 | S899: Venue: SPRINGVALE
A900: SPRINGVALE | C900: 6 | D900: 2 | E900: 38 | G900: 7 | H900: 4 | I900: 46 | K900: 8 | L900: 9 | M900: 57 | O900: 12 | P900: 11 | Q900: 83 | S900: CALLAGHAN :CARLAND
A901: BEST PLAYERS
A902: WILLIAMSTOWN | C902: PASTORE | F902: GOULD | I902: MITCHELL | L902: McTAGGART | O902: LONG | R902: HOWLETT
A903: SPRINGVALE | C903: CLARK | F903: PHILLIPS | I903: LYNCH | L903: D CARROLL | O903: SIMISTER | R903: McKENZIE
A904: GOALKICKERS
A905: WILLIAMSTOWN | C905: RICKMAN 5 | F905: PASTORE 3 | I905: GHAZI 2 | K905: CALLAHAN 2 | N905: GOULD | P905: WILSON
A906: SPRINGVALE | C906: SIMISTER 6 | F906: CARIS 2 | H906: McKENZIE 2 | K906: JEFFS | M906: TIBBALLS
A908: ROUND 17 | D908: 15TH AUGUST | I908: WEATHER | S908: Venue: TOORAK PARK
D909: 1ST QTR | H909: 2ND QTR | L909: 3RD QTR | P909: FINAL | S909: UMPIRES
A910: PRAHRAN | C910: 2 | D910: 1 | E910: 13 | G910: 6 | H910: 7 | I910: 43 | K910: 10 | L910: 8 | M910: 68 | O910: 15 | P910: 11 | Q910: 101 | S910: CARLAND | Y910: LADDER | AB910: ROUND | AD910: 17
A911: WERRIBEE | C911: 3 | D911: 1 | E911: 19 | G911: 5 | H911: 4 | I911: 34 | K911: 10 | L911: 6 | M911: 66 | O911: 11 | P911: 10 | Q911: 76 | S911: CAULFIELD
A912: BEST PLAYERS | W912: TEAM | X912: W | Y912: L | Z912: D | AA912: FOR | AB912: AGST | AC912: % | AD912: PTS
A913: PRAHRAN | C913: KEIPERT | F913: LUCAS | I913: LENNOX | L913: KILEY | O913: McCORMACK | R913: R LANGAN
A914: WERRIBEE | C914: WALSH | F914: CULLEN | I914: McMASTER | L914: TAYLOR | O914: FITZPATRICK | R914: SHEAHAN | W914: SANDRINGHAM | X914: 15 | Y914: 2 | Z914: 0 | AA914: 2306 | AB914: 1550 | AC914: =(AA914/AB914)*100 -> 148.7741935483871 | AD914: =(X914*4)+(Z914*2) -> 60
A915: GOALKICKERS | W915: WILLIAMSTOWN | X915: 12 | Y915: 5 | Z915: 0 | AA915: 1803 | AB915: 1277 | AC915: =(AA915/AB915)*100 -> 141.19028974158184 | AD915: =(X915*4)+(Z915*2) -> 48
A916: PRAHRAN | C916: TAYLOR 5 | F916: SINNI 3 | H916: TREWELLA 3 | K916: KEIPERT 2 | N916: DIMMATINA | Q916: NOBLE | W916: PRAHRAN | X916: 11 | Y916: 6 | Z916: 0 | AA916: 2022 | AB916: 1474 | AC916: =(AA916/AB916)*100 -> 137.17774762550883 | AD916: =(X916*4)+(Z916*2) -> 44
A917: WERRIBEE | C917: EAMES 3 | F917: BUTTON 2 | I917: KNIGHT 2 | K917: WALSH | M917: WRIGHT | O917: MURPHY | Q917: WILSON | W917: BOX HILL | X917: 10 | Y917: 7 | Z917: 0 | AA917: 1772 | AB917: 1466 | AC917: =(AA917/AB917)*100 -> 120.87312414733971 | AD917: =(X917*4)+(Z917*2) -> 40
D918: 16TH AUGUST | I918: WEATHER | S918: Venue: PORT MELBOURNE | W918: WERRIBEE | X918: 9 | Y918: 8 | Z918: 0 | AA918: 1880 | AB918: 1543 | AC918: =(AA918/AB918)*100 -> 121.84057031756319 | AD918: =(X918*4)+(Z918*2) -> 36
A919: PORT MELBOURNE | C919: 8 | D919: 4 | E919: 52 | G919: 16 | H919: 13 | I919: 109 | K919: 24 | L919: 15 | M919: 159 | O919: 37 | P919: 21 | Q919: 243 | S919: FALLET
A920: OAKLEIGH | C920: 2 | D920: 5 | E920: 17 | G920: 5 | H920: 9 | I920: 39 | K920: 9 | L920: 12 | M920: 66 | O920: 11 | P920: 14 | Q920: 80 | S920: PANOZZO | W920: PORT MELBOURNE | X920: 9 | Y920: 8 | Z920: 0 | AA920: 1811 | AB920: 1871 | AC920: =(AA920/AB920)*100 -> 96.793158738642433 | AD920: =(X920*4)+(Z920*2) -> 36
A921: BEST PLAYERS | W921: PRESTON | X921: 8 | Y921: 9 | Z921: 0 | AA921: 1651 | AB921: 1944 | AC921: =(AA921/AB921)*100 -> 84.927983539094654 | AD921: =(X921*4)+(Z921*2) -> 32
A922: PORT MELBOURNE | C922: McKINNON | F922: CLOHESY | I922: R BOWDEN | L922: LAFFY | O922: LOVE | R922: PAUL | W922: DANDEN0NG | X922: 7 | Y922: 10 | Z922: 0 | AA922: 1824 | AB922: 1657 | AC922: =(AA922/AB922)*100 -> 110.07845503922753 | AD922: =(X922*4)+(Z922*2) -> 28
A923: OAKLEIGH | C923: WELSFORD | F923: COURTNEY | I923: QUIRK | L923: SUTHERLAND | O923: OWEN | W923: COBURG | X923: 7 | Y923: 10 | Z923: 0 | AA923: 1656 | AB923: 1747 | AC923: =(AA923/AB923)*100 -> 94.791070406410995 | AD923: =(X923*4)+(Z923*2) -> 28
A924: GOALKICKERS | H924: R BOWDEN | K924: S BOWDEN | M924: CHRIMES | P924: KING | R924: S HICKS | W924: SPRINGVALE | X924: 7 | Y924: 10 | Z924: 0 | AA924: 1533 | AB924: 1649 | AC924: =(AA924/AB924)*100 -> 92.965433596118856 | AD924: =(X924*4)+(Z924*2) -> 28
A925: PORT MELBOURNE | C925: LOVE 11 | E925: PAUL 6 | G925: McKINNON 5 | J925: CAMERON 3 | M925: HARKINS 2 | O925: RYDER 2 | Q925: MUTIMER 2 | W925: FRANKSTON | X925: 6 | Y925: 11 | Z925: 0 | AA925: 1575 | AB925: 1921 | AC925: =(AA925/AB925)*100 -> 81.988547631441961 | AD925: =(X925*4)+(Z925*2) -> 24
A926: OAKLEIGH | C926: BOWMAN 2 | F926: CUNNINGHAM | I926: DI NATALE | K926: SUTHERLAND | N926: VAIL | P926: GILES | R926: JAMES | W926: OAKLEIGH | X926: 1 | Y926: 16 | Z926: 0 | AA926: 1236 | AB926: 2862 | AC926: =(AA926/AB926)*100 -> 43.186582809224319 | AD926: =(X926*4)+(Z926*2) -> 4
O927: GARBUIO | Q927: SMITH | S927: OWEN
A928: WILLIAMSTOWN | C928: 1 | D928: 2 | E928: 8 | G928: 9 | H928: 7 | I928: 61 | K928: 12 | L928: 11 | M928: 83 | O928: 16 | P928: 14 | Q928: 110 | S928: Venue: WILLIAMSTOWN
A929: DANDENONG | C929: 5 | D929: 2 | E929: 32 | G929: 6 | H929: 6 | I929: 42 | K929: 9 | L929: 10 | M929: 64 | O929: 13 | P929: 11 | Q929: 89 | S929: ANTHONY :SNEDDON
A930: BEST PLAYERS
A931: WILLIAMSTOWN | C931: AZIZ | F931: GHAZI | I931: SHANKS | L931: PASTORE | O931: HOWLETT | R931: O'CONNOR
A932: DANDENONG | C932: HOLLOW | F932: TAYLOR | I932: GOTCH | L932: MAGRO | O932: BOURKE | R932: LACKO
A933: GOALKICKERS
A934: WILLIAMSTOWN | C934: RICKMAN 4 | F934: AZIZ 4 | H934: GHAZI 4 | J934: O'CONNOR 2 | M934: PASTORE | O934: SHANKS
A935: DANDENONG | C935: CASSETT 4 | F935: BURNELL 2 | I935: GOTCH 2 | K935: DOWER | M935: HALL | O935: C KNIGHT | Q935: D KNIGHT | S935: MEAD
A937: FRANKSTON | C937: 7 | D937: 4 | E937: 46 | G937: 9 | H937: 5 | I937: 59 | K937: 16 | L937: 7 | M937: 103 | O937: 17 | P937: 7 | Q937: 109 | S937: Venue: COBURG
A938: COBURG | C938: 1 | D938: 2 | E938: 8 | G938: 5 | H938: 4 | I938: 34 | K938: 7 | L938: 5 | M938: 47 | O938: 12 | P938: 10 | Q938: 82 | S938: HARVEY :HOLT
A939: BEST PLAYERS
A940: FRANKSTON | C940: GOOSEY | F940: BROWN | I940: WILLIAMS | L940: PYM | O940: POLLOCK | R940: GARDNER
A941: COBURG | C941: ALESSIO | F941: SHELDON | I941: TARANTO | L941: ALLISON | O941: BENSTEAD
A942: GOALKICKERS
A943: FRANKSTON | C943: GARDNER 5 | F943: GOOSEY 3 | I943: GAHAN 2 | K943: BOONKAMP | N943: BROWN | P943: HAMILL | R943: PYM | T943: RYAN | V943: ROWE | X943: WILLIAMS
A944: COBURG | C944: GRIFFITHS 4 | F944: SALVADORE 3 | I944: ZANON | K944: TARANTO | M944: SHELDON | O944: ALESSIO | Q944: KAAKOUR
A946: SANDRINGHAM | C946: 5 | D946: 4 | E946: 34 | G946: 7 | H946: 9 | I946: 51 | K946: 11 | L946: 14 | M946: 80 | O946: 16 | P946: 18 | Q946: 114 | S946: Venue: BEACH ROAD
A947: PRESTON | C947: 2 | D947: 2 | E947: 14 | G947: 5 | H947: 7 | I947: 37 | K947: 9 | L947: 10 | M947: 64 | O947: 15 | P947: 16 | Q947: 106 | S947: SAVILLE :NASH
A948: BEST PLAYERS
A949: SANDRINGHAM | C949: ARGUS | F949: WILLIAMS | I949: RYAN | L949: KRAKOUER
A950: PRESTON | C950: JORDAN | F950: FINDLAY | I950: PEZZIN | L950: LUMICISI | O950: LEYDIN | Q950: BURROWS
A951: GOALKICKERS
A952: SANDRINGHAM | C952: WILLIAMS 4 | F952: KRAKOUER 4 | I952: GORIZIDIS 3 | L952: F RUGOLO 2 | O952: JOHNSTONE | R952: MACKENZIE
A953: PRESTON | C953: LUMICIS 4 | F953: PEZZIN 4 | H953: SHAW 3 | J953: SENNO 3 | L953: OWEN
A955: SPRINGVALE | C955: 4 | D955: 5 | E955: 29 | G955: 6 | H955: 6 | I955: 42 | K955: 13 | L955: 8 | M955: 86 | O955: 18 | P955: 11 | Q955: 119 | S955: Venue: SPRINGVALE
A956: BOX HILL | C956: 2 | D956: 0 | E956: 12 | G956: 3 | H956: 4 | I956: 22 | K956: 5 | L956: 6 | M956: 36 | O956: 10 | P956: 8 | Q956: 68 | S956: MORROW :ALLEN
A957: BEST PLAYERS
A958: SPRINGVALE | C958: CARIS | F958: WELSH | I958: FOGARTY | L958: HARDWICK | O958: P SCURRAH | R958: CAPLES
A959: BOX HILL | C959: BANFIELD | F959: DALY | I959: LISLE
A960: GOALKICKERS
A961: SPRINGVALE | C961: McKENZIE 4 | F961: CARIS 3 | H961: SIMISTER 3 | K961: CAPLES 2 | M961: HARDWICK 2 | P961: WEST | R961: CARROLL | U961: R ELLIOTT | X961: S SCURRAH
A962: BOX HILL | C962: BADROCK 2 | F962: EVANS 2 | H962: MOLLOY 2 | K962: BEALE | M962: CROWLEY | O962: JAMES | Q962: WATSON
A964: ROUND 18 | D964: 22ND AUGUST | I964: WEATHER | S964: Venue: WERRIBEE
D965: 1ST QTR | H965: 2ND QTR | L965: 3RD QTR | P965: FINAL | S965: UMPIRES
A966: WERRIBEE | C966: 3 | D966: 1 | E966: 19 | G966: 4 | H966: 3 | I966: 27 | K966: 10 | L966: 7 | M966: 67 | O966: 13 | P966: 11 | Q966: 89 | S966: MORROW | Y966: LADDER | AB966: ROUND | AD966: 18
A967: SANDRINGHAM | C967: 1 | D967: 1 | E967: 7 | G967: 6 | H967: 8 | I967: 44 | K967: 10 | L967: 10 | M967: 70 | O967: 12 | P967: 13 | Q967: 85 | S967: ALLEN
A968: BEST PLAYERS | W968: TEAM | X968: W | Y968: L | Z968: D | AA968: FOR | AB968: AGST | AC968: % | AD968: PTS
A969: WERRIBEE | C969: CULLEN | F969: EAMES | I969: McMASTER | L969: FITZPATRICK | O969: SHEEHAN | Q969: WATTS
A970: SANDRINGHAM | C970: MITCHELSON | F970: MACKENZIE | I970: RYAN | L970: KELLAWAY | O970: ARGUS | W970: SANDRINGHAM | X970: 15 | Y970: 3 | Z970: 0 | AA970: 2391 | AB970: 1639 | AC970: =(AA970/AB970)*100 -> 145.88163514338009 | AD970: =(X970*4)+(Z970*2) -> 60
A971: GOALKICKERS | W971: WILLIAMSTOWN | X971: 13 | Y971: 5 | Z971: 0 | AA971: 1868 | AB971: 1306 | AC971: =(AA971/AB971)*100 -> 143.0321592649311 | AD971: =(X971*4)+(Z971*2) -> 52
A972: WERRIBEE | C972: LAMONT 4 | E972: WRIGHT 2 | G972: ALLDAY 2 | I972: WATTS 2 | K972: MURPHY | M972: TAYLOR | O972: CULLEN | W972: PRAHRAN | X972: 12 | Y972: 6 | Z972: 0 | AA972: 2326 | AB972: 1528 | AC972: =(AA972/AB972)*100 -> 152.22513089005236 | AD972: =(X972*4)+(Z972*2) -> 48
A973: SANDRINGHAM | C973: F RUGOLO 4 | F973: GORIZIDIS 2 | I973: M WILLIAMS | L973: FORD | M973: KRAKOUER | P973: MACKENZIE | R973: KELLAWAY | W973: WERRIBEE | X973: 10 | Y973: 8 | Z973: 0 | AA973: 1969 | AB973: 1628 | AC973: =(AA973/AB973)*100 -> 120.94594594594594 | AD973: =(X973*4)+(Z973*2) -> 40
D974: 23RD AUGUST | O974: MITCHELSON | S974: Venue: OAKLEIGH | W974: BOX HILL | X974: 10 | Y974: 8 | Z974: 0 | AA974: 1834 | AB974: 1537 | AC974: =(AA974/AB974)*100 -> 119.32335718932987 | AD974: =(X974*4)+(Z974*2) -> 40
A975: SPRINGVALE | C975: 7 | D975: 3 | E975: 45 | G975: 9 | H975: 6 | I975: 60 | K975: 13 | L975: 10 | M975: 88 | O975: 22 | P975: 14 | Q975: 146 | S975: CAULFIELD
A976: OAKLEIGH | C976: 1 | D976: 1 | E976: 7 | G976: 5 | H976: 3 | I976: 33 | K976: 7 | L976: 4 | M976: 46 | O976: 9 | P976: 5 | Q976: 59 | S976: RICHARDSON | W976: PORT MELBOURNE | X976: 9 | Y976: 9 | Z976: 0 | AA976: 1865 | AB976: 1975 | AC976: =(AA976/AB976)*100 -> 94.430379746835442 | AD976: =(X976*4)+(Z976*2) -> 36
A977: BEST PLAYERS | W977: DANDEN0NG | X977: 8 | Y977: 10 | Z977: 0 | AA977: 1895 | AB977: 1719 | AC977: =(AA977/AB977)*100 -> 110.23851076207096 | AD977: =(X977*4)+(Z977*2) -> 32
A978: SPRINGVALE | C978: HARDWICK | F978: MORGAN | I978: CARIS | L978: LYNCH | N978: S SCURRAH | Q978: D WEST | W978: SPRINGVALE | X978: 8 | Y978: 10 | Z978: 0 | AA978: 1679 | AB978: 1708 | AC978: =(AA978/AB978)*100 -> 98.302107728337234 | AD978: =(X978*4)+(Z978*2) -> 32
A979: OAKLEIGH | C979: QUIRK | F979: CUNNINGHAM | I979: WELSFORD | L979: COURTNEY | N979: SMITH | W979: PRESTON | X979: 8 | Y979: 10 | Z979: 0 | AA979: 1774 | AB979: 2084 | AC979: =(AA979/AB979)*100 -> 85.124760076775431 | AD979: =(X979*4)+(Z979*2) -> 32
A980: GOALKICKERS | W980: COBURG | X980: 7 | Y980: 11 | Z980: 0 | AA980: 1685 | AB980: 1812 | AC980: =(AA980/AB980)*100 -> 92.991169977924955 | AD980: =(X980*4)+(Z980*2) -> 28
A981: SPRINGVALE | C981: SIMISTER 10 | F981: CARIS 5 | H981: CAPLES 2 | J981: P SCURRAH 2 | M981: PHILLIPS | O981: McKENZIE | Q981: HARDWICK | W981: FRANKSTON | X981: 7 | Y981: 11 | Z981: 0 | AA981: 1715 | AB981: 2044 | AC981: =(AA981/AB981)*100 -> 83.904109589041099 | AD981: =(X981*4)+(Z981*2) -> 28
A982: OAKLEIGH | C982: SHARP 2 | E982: CUNNINGHAM 2 | H982: GARBUIO 2 | K982: DINATALE | M982: BOWMAN | O982: OWEN | W982: OAKLEIGH | X982: 1 | Y982: 17 | Z982: 0 | AA982: 1295 | AB982: 3008 | AC982: =(AA982/AB982)*100 -> 43.05186170212766 | AD982: =(X982*4)+(Z982*2) -> 4
A984: WILLIAMSTOWN | C984: 1 | D984: 2 | E984: 8 | G984: 4 | H984: 5 | I984: 29 | K984: 4 | L984: 7 | M984: 31 | O984: 9 | P984: 11 | Q984: 65 | S984: Venue: COBURG
A985: COBURG | C985: 1 | D985: 3 | E985: 9 | G985: 1 | H985: 3 | I985: 9 | K985: 3 | L985: 4 | M985: 22 | O985: 4 | P985: 5 | Q985: 29 | S985: CARLAND :THOMPSON
A986: BEST PLAYERS
A987: WILLIAMSTOWN | C987: PASTORE | F987: MITCHELL | I987: GOULD | L987: HOWLETT | N987: O'CONNOR
A988: COBURG | C988: ALESSIO | F988: TARANTO | I988: BAKER | L988: RACOVOLIS | N988: SALVADOR
A989: GOALKICKERS
A990: WILLIAMSTOWN | C990: RICKMAN 2 | F990: AZIZ 2 | H990: ZAMKYLL | J990: GHAZI | L990: MITCHELL | N990: SHANKS | Q990: CALLAHAN
A991: COBURG | C991: INGRAM | F991: TARANTO | I991: GUMLEY | L991: KAAKOUR
A993: FRANKSTON | C993: 8 | D993: 6 | E993: 54 | G993: 12 | H993: 12 | I993: 84 | K993: 19 | L993: 11 | M993: 125 | O993: 20 | P993: 20 | Q993: 140 | S993: Venue: FRANKSTON
A994: PRESTON | C994: 2 | D994: 1 | E994: 13 | G994: 6 | H994: 7 | I994: 43 | K994: 10 | L994: 7 | M994: 67 | O994: 19 | P994: 9 | Q994: 123 | S994: DOWSLEY :McFARLANE
A995: BEST PLAYERS
A996: FRANKSTON | C996: WILLIAMS | F996: GAHAN | I996: COCHRANE | L996: PYM | N996: S HAMILL | Q996: POLLOCK
A997: PRESTON | C997: BURROWS | F997: SENNO | I997: CALLANDER | L997: LUMICISI | N997: SHAW
A998: GOALKICKERS
A999: FRANKSTON | C999: GARDNER 6 | F999: PYM 5 | H999: BELL 2 | J999: SHANNON 2 | M999: S HAMILL 2 | P999: COX | Q999: WILSON | S999: WOOD
A1000: PRESTON | C1000: SHAW 5 | E1000: LUMICISI 4 | H1000: SENNO 3 | J1000: MAY | L1000: KERR | M1000: NICOLAOU | P1000: RHEINBERGER | S1000: FYFE | U1000: MUNRIVANA | X1000: CALLANDER
A1002: PRAHRAN | C1002: 6 | D1002: 3 | E1002: 39 | G1002: 9 | H1002: 7 | I1002: 61 | K1002: 14 | L1002: 11 | M1002: 95 | O1002: 15 | P1002: 14 | Q1002: 104 | S1002: Venue: TOORAK PARK
A1003: PORT MELBOURNE | C1003: 0 | D1003: 2 | E1003: 2 | G1003: 2 | H1003: 3 | I1003: 15 | K1003: 5 | L1003: 4 | M1003: 34 | O1003: 7 | P1003: 12 | Q1003: 54 | S1003: NASH :COATES
A1004: BEST PLAYERS
A1005: PRAHRAN | C1005: SHELTON | F1005: LUCAS | I1005: LENNOX | L1005: KEIPERT | O1005: GEURTS
A1006: PORT MELBOURNE | C1006: HARKINS | F1006: McKINNON | I1006: KING | L1006: MUTIMER | O1006: LAFFY | Q1006: HART
A1007: GOALKICKERS
A1008: PRAHRAN | C1008: MRAKOV 4 | F1008: KEIPERT 4 | I1008: WALFORD 2 | L1008: TREWELLA 2 | O1008: WINTON | Q1008: SHELTON | T1008: DIMMATINA
A1009: PORT MELBOURNE | C1009: PAUL | E1009: HART | G1009: S HICKS | I1009: MUTOMER | L1009: CLOHESY | O1009: KING | Q1009: WILLIAMS
A1011: DANDENONG | C1011: 3 | D1011: 4 | E1011: 22 | G1011: 4 | H1011: 7 | I1011: 31 | K1011: 7 | L1011: 15 | M1011: 57 | O1011: 9 | P1011: 17 | Q1011: 71 | S1011: Venue: DANDENONG
A1012: BOX HILL | C1012: 2 | D1012: 3 | E1012: 15 | G1012: 2 | H1012: 5 | I1012: 17 | K1012: 6 | L1012: 5 | M1012: 41 | O1012: 9 | P1012: 8 | Q1012: 62 | S1012: SAVILLE ;HOLT
A1013: BEST PLAYERS
A1014: DANDENONG | C1014: HALL | F1014: MILLANE | I1014: GOTCH | L1014: D BOURKE | O1014: C KNIGHT | Q1014: MAGRO
A1015: BOX HILL | C1015: BEALE | F1015: BRUSNAHAN | I1015: CROWLEY | L1015: LISLE | O1015: MALLOY | Q1015: P BOURKE
A1016: GOALKICKERS
A1017: DANDENONG | C1017: HALL 2 | E1017: MAGRO 2 | H1017: D BOURKE | K1017: CASSETT | M1017: MARSHALL | P1017: MYNOTT | R1017: WICKS
A1018: BOX HILL | C1018: CROWLEY 4 | F1018: BEALE | H1018: P BOURKE | K1018: HOGAN | M1018: JAMES | O1018: BRUSNAHAN
A1020: FINALS
A1021: ELIMINATION | D1021: 29TH AUGUST | I1021: WEATHER
D1022: 1ST QTR | H1022: 2ND QTR | L1022: 3RD QTR | P1022: FINAL | S1022: Venue: PORT MELBOURNE
A1023: BOX HILL | C1023: 5 | D1023: 7 | E1023: 37 | G1023: 10 | H1023: 8 | I1023: 68 | K1023: 20 | L1023: 15 | M1023: 135 | O1023: 23 | P1023: 16 | Q1023: 154 | S1023: UMPIRES
A1024: WERRIBEE | C1024: 7 | D1024: 0 | E1024: 42 | G1024: 8 | H1024: 2 | I1024: 50 | K1024: 10 | L1024: 4 | M1024: 64 | O1024: 14 | P1024: 4 | Q1024: 88 | S1024: HARVEY :LUCKMAN
A1025: BEST PLAYERS
A1026: BOX HILL | C1026: P BOURKE | F1026: LISLE | I1026: DALRYMPLE | L1026: WATSON | O1026: PENNY | R1026: JAMES
A1027: WERRIBEE | C1027: SPIERINGS | F1027: ALLDAY | I1027: WATTS | L1027: EAMES | O1027: FITZPATRICK
A1028: GOALKICKERS
A1029: BOX HILL | C1029: BADROCK 4 | F1029: O'NEILL 4 | I1029: D BOURKE 3 | L1029: P BOURKE 3 | O1029: JAMES 2 | Q1029: MOLLOY 2 | S1029: PENNY 2 | V1029: BUTTIFANT | X1029: DALRYMPLE | AB1029: CROWLEY
A1030: WERRIBEE | C1030: EAMES 5 | F1030: MURPHY 2 | I1030: FITZPATRICK 2 | L1030: CULLEN | N1030: BOND | P1030: WRIGHT | R1030: BUTTON | U1030: RAEBURN
D1031: 30TH AUGUST | I1031: WEATHER
A1032: QUALIFYING
A1033: PRAHRAN | C1033: 4 | D1033: 4 | E1033: 28 | G1033: 8 | H1033: 7 | I1033: 55 | K1033: 13 | L1033: 9 | M1033: 87 | O1033: 18 | P1033: 10 | Q1033: 118 | S1033: Venue: PORT MELBOURNE | W1033: AFTER | X1033: EXTRA TIME
A1034: WILLIAMSTOWN | C1034: 4 | D1034: 2 | E1034: 26 | G1034: 6 | H1034: 5 | I1034: 41 | K1034: 9 | L1034: 8 | M1034: 62 | O1034: 17 | P1034: 11 | Q1034: 113 | S1034: AGNEW :MORROW
A1035: BEST PLAYERS
A1036: PRAHRAN | C1036: MARTELLO | F1036: TAYLOR | I1036: LUCAS | L1036: WINTON | O1036: SINNI | R1036: KILEY
A1037: WILLIAMSTOWN | C1037: PASTORE | F1037: KOENIG | I1037: MITCHELL | L1037: VENNER | O1037: GHAZI | R1037: RICKMAN
A1038: GOALKICKERS
A1039: PRAHRAN | C1039: TAYLOR 6 | F1039: KEIPERT 4 | I1039: SINNI 2 | K1039: MRAKOV 2 | M1039: DIMMATINA 2 | P1039: TREWELLA | S1039: CHAPPLE
A1040: WILLIAMSTOWN | C1040: RICKMAN 5 | F1040: GHAZI 5 | H1040: DWYER 2 | J1040: PASTORE 2 | M1040: SWAN | O1040: KOENIG | Q1040: AZIZ
A1042: 1ST SEMI | D1042: 5TH SEPTEMBER | I1042: WEATHER
A1043: WILLIAMSTOWN | C1043: 2 | D1043: 2 | E1043: 14 | G1043: 5 | H1043: 7 | I1043: 37 | K1043: 6 | L1043: 9 | M1043: 45 | O1043: 9 | P1043: 12 | Q1043: 66 | S1043: Venue: PORT MELBOURNE
A1044: BOX HILL | C1044: 2 | D1044: 4 | E1044: 16 | G1044: 3 | H1044: 9 | I1044: 27 | K1044: 3 | L1044: 12 | M1044: 30 | O1044: 3 | P1044: 16 | Q1044: 34 | S1044: SAVILLE :CAULFIELD
A1045: BEST PLAYERS
A1046: WILLIAMSTOWN | C1046: McTAGGART | F1046: AZIZ | I1046: HONIG | L1046: GHAZI | O1046: ACKERLEY
A1047: BOX HILL | C1047: BRUSNAHAN | F1047: P BOURKE | I1047: BEALE | L1047: LISLE | O1047: PENNY | Q1047: BANFIELD
A1048: GOALKICKERS
A1049: WILLIAMSTOWN | C1049: RICKMAN 3 | F1049: AZIZ 2 | H1049: ACKERLEY | K1049: O'CONNOR | M1049: SMITH | O1049: PASTORE
A1050: BOX HILL | C1050: DALRYMPLE | F1050: LIVINGSTONE | J1050: MOLLOY
A1052: 2ND SEMI | D1052: 6TH SEPTEMBER | I1052: WEATHER
A1053: SANDRINGHAM | C1053: 3 | D1053: 0 | E1053: 18 | G1053: 8 | H1053: 2 | I1053: 50 | K1053: 14 | L1053: 4 | M1053: 88 | O1053: 18 | P1053: 5 | Q1053: 113 | S1053: Venue: PORT MELBOURNE
A1054: PRAHRAN | C1054: 3 | D1054: 1 | E1054: 19 | G1054: 4 | H1054: 3 | I1054: 27 | K1054: 8 | L1054: 6 | M1054: 54 | O1054: 13 | P1054: 7 | Q1054: 85 | S1054: CARLAND ;McKERNAN
A1055: BEST PLAYERS
A1056: SANDRINGHAM | C1056: MOREY | F1056: ARGUS | I1056: FOLEY | L1056: ANGUS | O1056: C GARRETT | R1056: J RUGOLO
A1057: PRAHRAN | C1057: SINNI | F1057: GEURTS | I1057: TREWELLA | L1057: LUCAS | O1057: CLARKE | R1057: LENNOX
A1058: GOALKICKERS
A1059: SANDRINGHAM | C1059: M WILLIAMS 5 | F1059: C GARRETT 5 | I1059: FOLEY 2 | K1059: GOROZIDIS 2 | N1059: MITCHELSON 2 | Q1059: FISCHER | S1059: LAMBERT
A1060: PRAHRAN | C1060: DIMMATINA 2 | F1060: KEIPERT 2 | I1060: LANGAN 2 | L1060: POVEY | N1060: SHELTON | P1060: PROVERT | R1060: WINTON | U1060: TREWLLA | X1060: MRAKOV | AA1060: MARTELLO
A1062: PRELIMINARY | D1062: 13TH SEPTEMBER | I1062: WEATHER
A1063: WILLIAMSTOWN | C1063: 1 | D1063: 4 | E1063: 10 | G1063: 6 | H1063: 12 | I1063: 48 | K1063: 7 | L1063: 15 | M1063: 57 | O1063: 7 | P1063: 16 | Q1063: 58 | S1063: Venue: PORT MELBOURNE
A1064: PRAHRAN | C1064: 2 | D1064: 0 | E1064: 12 | G1064: 3 | H1064: 2 | I1064: 20 | K1064: 4 | L1064: 6 | M1064: 30 | O1064: 5 | P1064: 7 | Q1064: 37 | S1064: CALLAGHAN :RUSSO
A1065: BEST PLAYERS
A1066: WILLIAMSTOWN | C1066: RICKMAN | F1066: WILLIAMS | I1066: O'CONNOR | L1066: DWYER | O1066: MITCHELL | R1066: LONG
A1067: PRAHRAN | C1067: LUCAS | F1067: GUERTS | I1067: McCORMACK | L1067: PROBERT | O1067: CLARK | R1067: LENNOX
A1068: GOALKICKERS
A1069: WILLIAMSTOWN | C1069: RICKMAN 4 | F1069: JOHANSEN | I1069: O'CONNOR | L1069: GHAZI
A1070: PRAHRAN | C1070: TAYLOR 2 | F1070: LENNOX | H1070: KEIPERT | J1070: POVEY
A1072: GRAND | D1072: 20TH SEPTEMBER
A1073: SANDRINGHAM | C1073: 6 | D1073: 3 | E1073: 39 | G1073: 11 | H1073: 4 | I1073: 70 | K1073: 15 | L1073: 13 | M1073: 103 | O1073: 19 | P1073: 16 | Q1073: 130 | S1073: Venue: PRINCES PARK (CARLTON)
A1074: WILLIAMSTOWN | C1074: 3 | D1074: 3 | E1074: 21 | G1074: 4 | H1074: 3 | I1074: 27 | K1074: 8 | L1074: 4 | M1074: 52 | O1074: 13 | P1074: 8 | Q1074: 86 | S1074: CALLAGHAN ;RUSSO
A1075: BEST PLAYERS
A1076: SANDRINGHAM | C1076: J RUGOLO | F1076: BAILEY | I1076: ARGUS | L1076: F RUGOLO | O1076: JOHNSTONE | R1076: CZERKASKI
A1077: WILLIAMSTOWN | C1077: HOWLETT | F1077: WILLIAMS | I1077: ACKERLEY | L1077: GOULD | O1077: O'CONNOR | R1077: SHANKS
A1078: GOALKICKERS
A1079: SANDRINGHAM | C1079: F RUGOLO 6 | F1079: GOROZIDIS 5 | I1079: M WILLIAMS 3 | L1079: ANGUS | N1079: BAILEY | P1079: FORD | R1079: KRAKOUER | V1079: C GARRETT
A1080: WILLIAMSTOWN | C1080: GHAZI 3 | E1080: DWYER 3 | G1080: RICKMAN 2 | K1080: MITCHELL 2 | N1080: LLOYD | P1080: WILLIAMS | R1080: O'CONNOR