A1: Victorian Football Association
A2: Season 1993
A3: © Copyright Wal Williams | F3: First created: 1 September 2016
A4: Contact: joywalwi at gmail dot com | F4: Last updated: 3 December 2016 | W4: VFA Results and tables - Link to the main index page
A5: You are free to copy this document in whole or part provided that proper acknowledgement is given to the author. All rights reserved.
A7: 1993 | D7: 1ST DIVISION
A8: ROUND 1 | D8: 17TH APRIL | I8: WEATHER | S8: Venue: BEACH ROAD
D9: 1ST QTR | H9: 2ND QTR | L9: 3RD QTR | P9: FINAL | S9: UMPIRES
A10: SANDRINGHAM | O10: 21 | P10: 19 | Q10: 145 | S10: SAWERS | Y10: LADDER | AB10: ROUND | AD10: 1
A11: WILLIAMSTOWN | O11: 8 | P11: 12 | Q11: 60 | S11: NICHOLS
A12: BEST PLAYERS | W12: TEAM | X12: W | Y12: L | Z12: D | AA12: FOR | AB12: AGST | AC12: % | AD12: PTS
A13: SANDRINGHAM | C13: J RUGOLO | F13: KELLOWAY | I13: MITCHELSON | L13: BAILEY | O13: FORD | Q13: KRAKOUER
A14: WILLIAMSTOWN | C14: HOWLETT | F14: JOHANSEN | W14: SANDRINGHAM | X14: 1 | Y14: 0 | Z14: 0 | AA14: 145 | AB14: 60 | AC14: =(AA14/AB14)*100 -> 241.66666666666666 | AD14: =(X14*4)+(Z14*2) -> 4
A15: GOALKICKERS | Q15: MACKENZIE | W15: FRANKSTON | X15: 1 | Y15: 0 | Z15: 0 | AA15: 153 | AB15: 65 | AC15: =(AA15/AB15)*100 -> 235.38461538461539 | AD15: =(X15*4)+(Z15*2) -> 4
A16: SANDRINGHAM | C16: MANNING 5 | F16: FORD 4 | H16: F RUGOLO 4 | J16: CLARKSON 2 | M16: C GARRETT 2 | P16: DIMMATINA 2 | R16: KRAKOUER | W16: PRAHRAN | X16: 1 | Y16: 0 | Z16: 0 | AA16: 183 | AB16: 86 | AC16: =(AA16/AB16)*100 -> 212.7906976744186 | AD16: =(X16*4)+(Z16*2) -> 4
A17: WILLIAMSTOWN | C17: PASTORE 2 | F17: RICKMAN 2 | I17: McTAGGART | L17: GHAZI | N17: SMITH | P17: ZAMKYL | W17: PRESTON | X17: 1 | Y17: 0 | Z17: 0 | AA17: 135 | AB17: 66 | AC17: =(AA17/AB17)*100 -> 204.54545454545453 | AD17: =(X17*4)+(Z17*2) -> 4
D18: 18TH APRIL | W18: WERRIBEE | X18: 1 | Y18: 0 | Z18: 0 | AA18: 119 | AB18: 74 | AC18: =(AA18/AB18)*100 -> 160.81081081081081 | AD18: =(X18*4)+(Z18*2) -> 4
A19: PORT MELBOURNE | O19: 19 | P19: 21 | Q19: 135 | S19: Venue: PORT MELBOURNE
A20: OAKLEIGH | O20: 16 | P20: 20 | Q20: 116 | W20: PORT MELBOURNE | X20: 1 | Y20: 0 | Z20: 0 | AA20: 135 | AB20: 116 | AC20: =(AA20/AB20)*100 -> 116.37931034482759 | AD20: =(X20*4)+(Z20*2) -> 4
A21: BEST PLAYERS | W21: OAKLEIGH | X21: 0 | Y21: 1 | Z21: 0 | AA21: 116 | AB21: 135 | AC21: =(AA21/AB21)*100 -> 85.925925925925924 | AD21: =(X21*4)+(Z21*2) -> 0
A22: PORT MELBOURNE | C22: MOYLAN | F22: R BOWDEN | I22: KEIGHRAN | L22: S BOWDEN | O22: FOX | Q22: McLEOD | W22: SPRINGVALE | X22: 0 | Y22: 1 | Z22: 0 | AA22: 74 | AB22: 119 | AC22: =(AA22/AB22)*100 -> 62.184873949579831 | AD22: =(X22*4)+(Z22*2) -> 0
A23: OAKLEIGH | C23: GRIGGS | F23: LEARMOUTH | I23: QUIRK | L23: MELLODY | O23: THORPE | Q23: D STUBBS | W23: DANDEN0NG | X23: 0 | Y23: 1 | Z23: 0 | AA23: 66 | AB23: 135 | AC23: =(AA23/AB23)*100 -> 48.888888888888886 | AD23: =(X23*4)+(Z23*2) -> 0
A24: GOALKICKERS | Q24: MEUNCH | W24: COBURG | X24: 0 | Y24: 1 | Z24: 0 | AA24: 86 | AB24: 183 | AC24: =(AA24/AB24)*100 -> 46.994535519125684 | AD24: =(X24*4)+(Z24*2) -> 0
A25: PORT MELBOURNE | C25: ASANI 4 | E25: FOX 4 | G25: RICHARDSON 2 | J25: A HICKS 2 | M25: JAMES 2 | O25: HARKINS 2 | Q25: S BOWDEN | S25: DONALD | W25: BOX HILL | X25: 0 | Y25: 1 | Z25: 0 | AA25: 65 | AB25: 153 | AC25: =(AA25/AB25)*100 -> 42.483660130718953 | AD25: =(X25*4)+(Z25*2) -> 0
A26: OAKLEIGH | C26: THORPE 7 | E26: SUTHERLAND 2 | H26: BICKNELL | J26: R STUBBS | L26: KIDGULE | N26: HAWKER | P26: WILLIAMS | R26: QUIRK | W26: WILLIAMSTOWN | X26: 0 | Y26: 1 | Z26: 0 | AA26: 60 | AB26: 145 | AC26: =(AA26/AB26)*100 -> 41.379310344827587 | AD26: =(X26*4)+(Z26*2) -> 0
A28: PRESTON | O28: 20 | P28: 15 | Q28: 135 | S28: Venue: PRESTON
A29: DANDENONG | O29: 9 | P29: 12 | Q29: 66
A30: BEST PLAYERS
A31: PRESTON | C31: HOTTON | F31: CROUGH | I31: MAY | L31: WALKER | O31: BIZZOTTO
A32: DANDENONG | C32: LACKO | F32: KNIGHT | I32: DOCKERY | L32: MARSHALL | O32: HALL | Q32: GILDER
A33: GOALKICKERS
A34: PRESTON | C34: CROUGH 6 | F34: SHAW 5 | H34: KING 2 | J34: CALLANDER | M34: DOBBS | O34: LUMICISI | Q34: MAIORANA | T34: WALKER | W34: MUNRIVANA | X34: PEZZIN
A35: DANDENONG | C35: PRETTO 4 | F35: CASSETT 2 | I35: SALIBA | K35: GOTCH | M35: LACKO
A37: FRANKSTON | O37: 23 | P37: 15 | Q37: 153 | S37: Venue: FRANKSTON
A38: BOX HILL | O38: 9 | P38: 11 | Q38: 65
A39: BEST PLAYERS
A40: FRANKSTON | C40: GOOSEY | F40: WILLIAMS | I40: MOORE | L40: POLLOCK | O40: BROWN | Q40: GLASCOTT
A41: BOX HILL | C41: SWAN | F41: QUINN | I41: NICHOL | L41: WATSON | O41: ROWE
A42: GOALKICKERS
A43: FRANKSTON | C43: KEAYS 6 | E43: GARDNER 4 | H43: MORWOOD 3 | K43: DAVIES 2 | M43: GEORGE | O43: NAPOLI | Q43: MOORE | S43: BROWN | V43: MARTIN | X43: RYAN | Z43: WHITMORE | AC43: BOONKAMP
A44: BOX HILL | C44: CROWLEY 2 | F44: DISNEY 2 | H44: ERWIN | J44: JAMES | L44: O'NEILL | N44: QUINN | P44: WALLIS
A46: PRAHRAN | O46: 27 | P46: 21 | Q46: 183 | S46: Venue: TOORAK PARK
A47: COBURG | O47: 12 | P47: 14 | Q47: 86
A48: BEST PLAYERS
A49: PRAHRAN | C49: ORIGLASSO | F49: KILEY | I49: TUDDENHAM | L49: SINNI | O49: MRAKOV | R49: MOLONEY
A50: COBURG | C50: TARANTO | F50: BENSTEAD | I50: CAPUANO | L50: BAKER | O50: KENNEDY | R50: LISTON
A51: GOALKICKERS
A52: PRAHRAN | C52: MRAKOV 7 | E52: TUDDENHAM 4 | H52: TREWELLA 3 | K52: POVEY 2 | M52: WILSON 2 | O52: WINTON 2 | Q52: KEIPERT 2 | S52: PHELAN 2 | V52: ORIGLASSO | X52: SINNI | Z52: DILENA
A53: COBURG | C53: ALESSIO 3 | F53: KENNEDY 2 | I53: INGRAM 2 | K53: FALLA | M53: BAKER | O53: BENSTEAD | R53: SALVADORE
A55: WERRIBEE | O55: 17 | P55: 17 | Q55: 119 | S55: Venue: WERRIBEE
A56: SPRINGVALE | O56: 11 | P56: 8 | Q56: 74
A57: BEST PLAYERS
A58: WERRIBEE | C58: POWER | F58: CONNELL | I58: WATTS | L58: SHEAHAN | O58: WILSON
A59: SPRINGVALE | C59: EVANS | F59: SMIT | I59: WELSH | L59: O'DONNELL
A60: GOALKICKERS
A61: WERRIBEE | C61: AZIZ 5 | E61: POWER 4 | G61: FOTIA 3 | I61: STANLEY 2 | K61: WATTS | M61: WRIGHT | O61: McMASTER
A62: SPRINGVALE | C62: EVANS 7 | F62: O'DONNELL 2 | I62: SCURRAH | K62: JEFFS
A64: ROUND 2 | D64: 24TH APRIL | I64: WEATHER
D65: 1ST QTR | H65: 2ND QTR | L65: 3RD QTR | P65: FINAL | S65: Venue: WILLIAMSTOWN
A66: WILLIAMSTOWN | O66: 11 | P66: 15 | Q66: 81 | S66: UMPIRES | Y66: LADDER | AB66: ROUND | AD66: 2
A67: PRAHRAN | O67: 10 | P67: 10 | Q67: 70
A68: BEST PLAYERS | W68: TEAM | X68: W | Y68: L | Z68: D | AA68: FOR | AB68: AGST | AC68: % | AD68: PTS
A69: WILLIAMSTOWN | C69: VENNER | F69: ZAMKYL | I69: GOULD | L69: O'CONNOR | O69: HOWLETT | R69: PASTORE
A70: PRAHRAN | C70: SINNI | F70: MOLONEY | I70: PARSONS | L70: BOLZON | W70: WERRIBEE | X70: 2 | Y70: 0 | Z70: 0 | AA70: 352 | AB70: 171 | AC70: =(AA70/AB70)*100 -> 205.84795321637426 | AD70: =(X70*4)+(Z70*2) -> 8
A71: GOALKICKERS | W71: PRESTON | X71: 2 | Y71: 0 | Z71: 0 | AA71: 233 | AB71: 143 | AC71: =(AA71/AB71)*100 -> 162.93706293706293 | AD71: =(X71*4)+(Z71*2) -> 8
A72: WILLIAMSTOWN | C72: RICKMAN 4 | F72: GHAZI 3 | H72: SWAN | J72: PASTORE | M72: ZAMKYL | O72: TURCINOVICH | W72: PORT MELBOURNE | X72: 2 | Y72: 0 | Z72: 0 | AA72: 239 | AB72: 207 | AC72: =(AA72/AB72)*100 -> 115.45893719806763 | AD72: =(X72*4)+(Z72*2) -> 8
A73: PRAHRAN | C73: BOLZON 2 | F73: MRAKOV 2 | I73: GRACE 2 | K73: KEIPERT | M73: DILENA | O73: MOLONEY | Q73: WILSON | W73: PRAHRAN | X73: 1 | Y73: 1 | Z73: 0 | AA73: 253 | AB73: 167 | AC73: =(AA73/AB73)*100 -> 151.49700598802397 | AD73: =(X73*4)+(Z73*2) -> 4
D74: 25TH APRIL | W74: FRANKSTON | X74: 1 | Y74: 1 | Z74: 0 | AA74: 273 | AB74: 192 | AC74: =(AA74/AB74)*100 -> 142.1875 | AD74: =(X74*4)+(Z74*2) -> 4
A75: WERRIBEE | O75: 36 | P75: 17 | Q75: 233 | S75: Venue: COBURG
A76: COBURG | O76: 15 | P76: 7 | Q76: 97 | W76: SANDRINGHAM | X76: 1 | Y76: 1 | Z76: 0 | AA76: 249 | AB76: 207 | AC76: =(AA76/AB76)*100 -> 120.28985507246377 | AD76: =(X76*4)+(Z76*2) -> 4
A77: BEST PLAYERS | W77: OAKLEIGH | X77: 1 | Y77: 1 | Z77: 0 | AA77: 263 | AB77: 239 | AC77: =(AA77/AB77)*100 -> 110.04184100418411 | AD77: =(X77*4)+(Z77*2) -> 4
A78: WERRIBEE | C78: POWER | F78: NORMINGTON | I78: AZIZ | L78: SHEAHAN | O78: CONNELL | W78: DANDEN0NG | X78: 1 | Y78: 1 | Z78: 0 | AA78: 193 | AB78: 255 | AC78: =(AA78/AB78)*100 -> 75.686274509803923 | AD78: =(X78*4)+(Z78*2) -> 4
A79: COBURG | C79: INGRAM | F79: BAKER | I79: TARANTO | L79: ALESSIO | O79: SALVADORE | W79: WILLIAMSTOWN | X79: 1 | Y79: 1 | Z79: 0 | AA79: 141 | AB79: 215 | AC79: =(AA79/AB79)*100 -> 65.581395348837219 | AD79: =(X79*4)+(Z79*2) -> 4
A80: GOALKICKERS | H80: RYAN 2 | J80: CONNELL | L80: WRIGHT | N80: LESIPUTTY | Q80: McMASTER | W80: SPRINGVALE | X80: 0 | Y80: 2 | Z80: 0 | AA80: 151 | AB80: 217 | AC80: =(AA80/AB80)*100 -> 69.585253456221196 | AD80: =(X80*4)+(Z80*2) -> 0
A81: WERRIBEE | C81: AZIZ 10 | E81: POWER 5 | G81: RAEBURN 4 | I81: STANLEY 3 | K81: McDONALD 3 | N81: SALTALAMACCHIA 3 | R81: RIENIETS 2 | W81: BOX HILL | X81: 0 | Y81: 2 | Z81: 0 | AA81: 156 | AB81: 257 | AC81: =(AA81/AB81)*100 -> 60.700389105058363 | AD81: =(X81*4)+(Z81*2) -> 0
A82: COBURG | C82: ALESSIO 4 | E82: INGRAM 3 | G82: BAKER 2 | I82: GRIFFITHS 2 | L82: SEMAAN | N82: KENNEDY | P82: FALLA | R82: SALVADORE | W82: COBURG | X82: 0 | Y82: 2 | Z82: 0 | AA82: 183 | AB82: 416 | AC82: =(AA82/AB82)*100 -> 43.990384615384613 | AD82: =(X82*4)+(Z82*2) -> 0
A84: PORT MELBOURNE | O84: 13 | P84: 26 | Q84: 104 | S84: Venue: BOX HILL
A85: BOX HILL | O85: 12 | P85: 19 | Q85: 91
A86: BEST PLAYERS
A87: PORT MELBOURNE | C87: KING | F87: EDWARDS | I87: MUENCH | L87: KEIGHRAN | O87: R BOWDEN | R87: S BOWDEN
A88: BOX HILL | C88: HEANEY | F88: QUINN | I88: DALRYMPLE | L88: BOURKE | O88: EVANS
A89: GOALKICKERS
A90: PORT MELBOURNE | C90: S BOWDEN 3 | F90: MUENCH 2 | I90: JAMES 2 | K90: R BOWDEN | M90: FOX | N90: CUNNINGHAM | Q90: LOVE | R90: CLOHESY | U90: KELLY
A91: BOX HILL | C91: KELLY 4 | F91: MA ERWIN 2 | I91: O'NEILL 2 | K91: BADROCK | M91: DALY | N91: DISNEY | P91: PRESTON
A93: DANDENONG | O93: 20 | P93: 7 | Q93: 127 | S93: Venue: DANDENONG
A94: FRANKSTON | O94: 18 | P94: 12 | Q94: 120
A95: BEST PLAYERS
A96: DANDENONG | C96: MILLIGAN | F96: GILDER | I96: MARSHALL | L96: PRETTO | O96: CASSETT | R96: KENNEDY
A97: FRANKSTON | C97: S HAMILL | F97: BROWN | I97: BOONKAMP | L97: GARDNER
A98: GOALKICKERS
A99: DANDENONG | C99: PRETTO 8 | F99: CASSETT 4 | I99: MILLANE 2 | K99: MEAD 2 | M99: GILDER 2 | O99: BURNETT | Q99: MARSHALL
A100: FRANKSTON | C100: GARDNER 5 | F100: MORWOOD 4 | I100: KEAYS 3 | K100: DAVIES | M100: S HAMILL | O100: BROWN | Q100: ROWE | S100: WHITMORE | V100: GEORGE
A102: OAKLEIGH | O102: 22 | P102: 15 | Q102: 147 | S102: Venue: OAKLEIGH
A103: SANDRINGHAM | O103: 16 | P103: 8 | Q103: 104 | S103: CARLAND :CALLAGHAN
A104: BEST PLAYERS
A105: OAKLEIGH | C105: WILLIAMS | F105: OWEN | I105: YOUNG | L105: D STUBBS | O105: GARBUIO | R105: SIEBRAND
A106: SANDRINGHAM | C106: LAMBERT
A107: GOALKICKERS
A108: OAKLEIGH | C108: YOUNG 7 | E108: SHEPHERD 4 | H108: OWEN 2 | J108: BICKNELL | M108: KIDGELL | O108: JORDAN | Q108: SUTHERLAND | T108: -5
A109: SANDRINGHAM | C109: M WILLIAMS 3 | F109: ANGUS 3 | H109: C GARRETT 3 | K109: A WILLIAMS 2 | N109: KRAKOUER 2 | Q109: FORD | R109: LAMBERT | U109: BAILEY
A111: PRESTON | O111: 14 | P111: 14 | Q111: 98 | S111: Venue: SPRINGVALE
A112: SPRINGVALE | O112: 11 | P112: 11 | Q112: 77
A113: BEST PLAYERS
A114: PRESTON | C114: HOTTON | F114: MAY | I114: REEVES | L114: MORGAN | O114: DOBBS
A115: SPRINGVALE | C115: MALONI | F115: LYNCH | I115: O'DONNELL | L115: MORGAN | O115: SMITH
A116: GOALKICKERS
A117: PRESTON | C117: SHAW 6 | F117: CALLANDER 2 | I117: CROUGH 2 | K117: PEZZIN 2 | M117: MUNRIVANA | P117: WALKER
A118: SPRINGVALE | C118: EVANS 4 | F118: R ELLIOTT 3 | I118: PHILLIPS | K118: WELSH | M118: O'DONNELL | P118: JEFFS
A120: ROUND 3 | D120: 1ST MAY | I120: WEATHER
D121: 1ST QTR | H121: 2ND QTR | L121: 3RD QTR | P121: FINAL | S121: Venue: FRANKSTON
A122: FRANKSTON | O122: 17 | P122: 16 | Q122: 118 | S122: UMPIRES | Y122: LADDER | AB122: ROUND | AD122: 3
A123: SPRINGVALE | O123: 15 | P123: 15 | Q123: 105
A124: BEST PLAYERS | W124: TEAM | X124: W | Y124: L | Z124: D | AA124: FOR | AB124: AGST | AC124: % | AD124: PTS
A125: FRANKSTON | C125: WILLIAMS | F125: GOOSEY | I125: MOORE | L125: BROWN | O125: GARDNER | R125: KEAYS
A126: SPRINGVALE | C126: MALONI | F126: FOGARTY | I126: LYNCH | L126: EVANS | O126: CARIS | R126: KNIGHT | W126: WERRIBEE | X126: 3 | Y126: 0 | Z126: 0 | AA126: 469 | AB126: 234 | AC126: =(AA126/AB126)*100 -> 200.42735042735043 | AD126: =(X126*4)+(Z126*2) -> 12
A127: GOALKICKERS | O127: BROWN | W127: PRESTON | X127: 3 | Y127: 0 | Z127: 0 | AA127: 404 | AB127: 204 | AC127: =(AA127/AB127)*100 -> 198.03921568627453 | AD127: =(X127*4)+(Z127*2) -> 12
A128: FRANKSTON | C128: GARDNER 5 | F128: VERBEEK 3 | I128: NAPOLI 2 | K128: D RYAN 2 | M128: MORWOOD 2 | P128: M RYAN | R128: WILLIAMS | W128: PORT MELBOURNE | X128: 3 | Y128: 0 | Z128: 0 | AA128: 419 | AB128: 298 | AC128: =(AA128/AB128)*100 -> 140.60402684563758 | AD128: =(X128*4)+(Z128*2) -> 12
A129: SPRINGVALE | C129: EVANS 6 | F129: SCURRAH 3 | I129: JEFFS 3 | K129: CARIS 2 | M129: PHILLIPS | W129: PRAHRAN | X129: 2 | Y129: 1 | Z129: 0 | AA129: 382 | AB129: 248 | AC129: =(AA129/AB129)*100 -> 154.03225806451613 | AD129: =(X129*4)+(Z129*2) -> 8
D130: 2ND MAY | I130: WEATHER | W130: FRANKSTON | X130: 2 | Y130: 1 | Z130: 0 | AA130: 391 | AB130: 297 | AC130: =(AA130/AB130)*100 -> 131.64983164983164 | AD130: =(X130*4)+(Z130*2) -> 8
A131: WERRIBEE | O131: 17 | P131: 15 | Q131: 117 | S131: Venue: WERRIBEE
A132: WILLIAMSTOWN | O132: 9 | P132: 9 | Q132: 63 | W132: SANDRINGHAM | X132: 1 | Y132: 2 | Z132: 0 | AA132: 330 | AB132: 336 | AC132: =(AA132/AB132)*100 -> 98.214285714285708 | AD132: =(X132*4)+(Z132*2) -> 4
A133: BEST PLAYERS | W133: BOX HILL | X133: 1 | Y133: 2 | Z133: 0 | AA133: 312 | AB133: 347 | AC133: =(AA133/AB133)*100 -> 89.913544668587903 | AD133: =(X133*4)+(Z133*2) -> 4
A134: WERRIBEE | C134: GEARY | F134: RAEBURN | I134: McPHERSON | L134: NORMINGTON | O134: AZIZ | Q134: McMASTER | W134: OAKLEIGH | X134: 1 | Y134: 2 | Z134: 0 | AA134: 353 | AB134: 395 | AC134: =(AA134/AB134)*100 -> 89.367088607594937 | AD134: =(X134*4)+(Z134*2) -> 4
A135: WILLIAMSTOWN | C135: O'CONNOR | F135: GOULD | I135: HOWLETT | L135: LLOYD | O135: HORE | W135: DANDEN0NG | X135: 1 | Y135: 2 | Z135: 0 | AA135: 284 | AB135: 435 | AC135: =(AA135/AB135)*100 -> 65.287356321839084 | AD135: =(X135*4)+(Z135*2) -> 4
A136: GOALKICKERS | P136: CULLEN | W136: WILLIAMSTOWN | X136: 1 | Y136: 2 | Z136: 0 | AA136: 204 | AB136: 332 | AC136: =(AA136/AB136)*100 -> 61.445783132530117 | AD136: =(X136*4)+(Z136*2) -> 4
A137: WERRIBEE | C137: AZIZ 6 | E137: STANLEY 2 | G137: GEARY 2 | I137: McDONALD 2 | L137: RAEBURN 2 | O137: WRIGHT | Q137: McMASTER | W137: SPRINGVALE | X137: 0 | Y137: 3 | Z137: 0 | AA137: 256 | AB137: 335 | AC137: =(AA137/AB137)*100 -> 76.417910447761201 | AD137: =(X137*4)+(Z137*2) -> 0
A138: WILLIAMSTOWN | C138: TURCINOVICH 2 | F138: JOHANSEN 2 | I138: ZAMKYL 2 | K138: GHAZI | M138: GOULD | O138: MOLONEY | W138: COBURG | X138: 0 | Y138: 3 | Z138: 0 | AA138: 244 | AB138: 587 | AC138: =(AA138/AB138)*100 -> 41.567291311754687 | AD138: =(X138*4)+(Z138*2) -> 0
A140: BOX HILL | O140: 24 | P140: 12 | Q140: 156 | S140: Venue: BOX HILL
A141: OAKLEIGH | O141: 13 | P141: 12 | Q141: 90
A142: BEST PLAYERS
A143: BOX HILL | C143: MA ERWIN | F143: EVANS | I143: LISLE | L143: BOURKE | O143: NICHOL | Q143: SWAN
A144: OAKLEIGH | C144: QUIRK | F144: SIEBRAND | I144: STUBBS | L144: GARBUIO | O144: TODD
A145: GOALKICKERS
A146: BOX HILL | C146: MA ERWIN 7 | F146: JAMES 4 | H146: O'NEILL 4 | J146: BOURKE 3 | M146: EVANS 2 | O146: DALRYMPLE | R146: HEANEY | U146: KELLY
A147: OAKLEIGH | C147: SHEPHARD 4 | F147: OWEN 3 | H147: BICKNELL | J147: BONNEY | L147: MORELAND | N147: JAMES | P147: WILLIAMS | R147: MELLODY
A149: PORT MELBOURNE | O149: 26 | P149: 24 | Q149: 180 | S149: Venue: PORT MELBOURNE
A150: DANDENONG | O150: 13 | P150: 13 | Q150: 91
A151: BEST PLAYERS
A152: PORT MELBOURNE | C152: MUENCH | F152: EDWARDS | I152: McKINNON | L152: BARLOW | O152: CHRIMES | R152: R BOWDEN
A153: DANDENONG | C153: MILLANE | F153: LACKO | I153: MARSHALL | L153: MILLIGAN | O153: KENNEDY | R153: HUNTER
A154: GOALKICKERS | R154: KING | U154: CLOHESY
A155: PORT MELBOURNE | C155: RICHARDSON 5 | F155: LOVE 4 | H155: HICKS 3 | J155: CHRIMES 2 | M155: S BOWDEN 2 | P155: JAMES 2 | R155: McKINNON 2 | V155: FOX | W155: R BOWDEN | X155: CUNNINGHAM | AB155: DONALD
A156: DANDENONG | C156: PRETTO 4 | F156: MILLANE 3 | H156: HALL | J156: MAGRO | L156: MEAD | N156: MILLIGAN | P156: MYNOTT | R156: KNIGHT
A158: PRESTON | O158: 27 | P158: 9 | Q158: 171 | S158: Venue: PRESTON
A159: COBURG | O159: 9 | P159: 7 | Q159: 61
A160: BEST PLAYERS
A161: PRESTON | C161: REEVES | F161: CROUGH | I161: SHAW | L161: MORGAN | O161: LUMICISI | R161: HUCKER
A162: COBURG | C162: SALVADORE | F162: GORMAN | I162: ALESSIO | L162: TARANTO | O162: KURET | R162: EVANS
A163: GOALKICKERS
A164: PRESTON | C164: SHAW 8 | E164: GRAZIANO 4 | H164: CROUGH 3 | J164: KING 3 | L164: MAIORANA 2 | O164: PEZZIN 2 | Q164: CALLANDER | T164: LUMICISI | W164: MORGAN | X164: MUNRIVANA | AB164: REEVES
A165: COBURG | C165: LISTON 3 | F165: INGRAM 2 | I165: SALVADORE 2 | L165: SEMAAN | N165: EVANS
A167: PRAHRAN | O167: 19 | P167: 15 | Q167: 129 | S167: Venue: TOORAK PARK
A168: SANDRINGHAM | O168: 11 | P168: 15 | Q168: 81 | S168: RICH :MURNANE
A169: BEST PLAYERS
A170: PRAHRAN | C170: CHAPPLE | F170: LUCAS | I170: KEIPERT | L170: BOLZON | O170: MARTELLO | R170: TREWELLA
A171: SANDRINGHAM | C171: KRAKOUER | F171: LAMBERT | I171: ARGUS | L171: CZERKASKI
A172: GOALKICKERS
A173: PRAHRAN | C173: KEIPERT 5 | F173: TREWELLA 3 | I173: PARSONS 3 | L173: ORIGLASSO 2 | O173: MOLONEY 2 | Q173: POVEY | S173: KILEY | U173: AHMAD | W173: TUDDENHAM
A174: SANDRINGHAM | C174: GORIZIDIS 4 | F174: DIMMATINA 2 | I174: FORD | K174: KRAKOUER | N174: A WILLIAMS | Q174: M WILLIAMS | T174: MOREY
A176: ROUND 4 | D176: 8TH MAY | I176: WEATHER | S176: Venue: BEACH ROAD
D177: 1ST QTR | H177: 2ND QTR | L177: 3RD QTR | P177: FINAL | S177: UMPIRES
A178: WERRIBEE | C178: 4 | D178: 6 | E178: 30 | G178: 6 | H178: 8 | I178: 44 | K178: 10 | L178: 13 | M178: 73 | O178: 14 | P178: 15 | Q178: 99 | S178: VINEY | Y178: LADDER | AB178: ROUND | AD178: 4
A179: SANDRINGHAM | C179: 1 | D179: 6 | E179: 12 | G179: 6 | H179: 8 | I179: 44 | K179: 8 | L179: 9 | M179: 57 | O179: 12 | P179: 11 | Q179: 83 | S179: VAN BEEK
A180: BEST PLAYERS | W180: TEAM | X180: W | Y180: L | Z180: D | AA180: FOR | AB180: AGST | AC180: % | AD180: PTS
A181: WERRIBEE | C181: NORMINGTON | F181: HARRINGTON | I181: LESIPUTTY | L181: McDONALD | O181: McMASTER | R181: FITZPATRICK
A182: SANDRINGHAM | C182: MURRAY | F182: ALLEN | I182: CLARKSON | L182: KRAKOUER | O182: J RUGOLO | W182: WERRIBEE | X182: 4 | Y182: 0 | Z182: 0 | AA182: 568 | AB182: 317 | AC182: =(AA182/AB182)*100 -> 179.17981072555204 | AD182: =(X182*4)+(Z182*2) -> 16
A183: GOALKICKERS | Q183: RAEBURN | W183: PORT MELBOURNE | X183: 4 | Y183: 0 | Z183: 0 | AA183: 590 | AB183: 387 | AC183: =(AA183/AB183)*100 -> 152.45478036175712 | AD183: =(X183*4)+(Z183*2) -> 16
A184: WERRIBEE | C184: McDONALD 3 | F184: WRIGHT 2 | I184: GEARY 2 | K184: AZIZ 2 | M184: McMASTER 2 | P184: POWER | R184: McPHERSON | W184: PRAHRAN | X184: 3 | Y184: 1 | Z184: 0 | AA184: 565 | AB184: 338 | AC184: =(AA184/AB184)*100 -> 167.15976331360946 | AD184: =(X184*4)+(Z184*2) -> 12
A185: SANDRINGHAM | C185: C GARRETT 2 | F185: KRAKOUER 2 | I185: GOROZIDIS 2 | L185: M WILLIAMS 2 | O185: ALLEN | Q185: MOREY | W185: PRESTON | X185: 3 | Y185: 1 | Z185: 0 | AA185: 498 | AB185: 307 | AC185: =(AA185/AB185)*100 -> 162.21498371335505 | AD185: =(X185*4)+(Z185*2) -> 12
D186: 9TH MAY | I186: WEATHER | M186: DIMMATINA | P186: J RUGOLO | S186: Venue: COBURG | W186: FRANKSTON | X186: 3 | Y186: 1 | Z186: 0 | AA186: 574 | AB186: 364 | AC186: =(AA186/AB186)*100 -> 157.69230769230768 | AD186: =(X186*4)+(Z186*2) -> 12
A187: FRANKSTON | C187: 6 | D187: 5 | E187: 41 | G187: 12 | H187: 10 | I187: 82 | K187: 18 | L187: 15 | M187: 123 | O187: 27 | P187: 21 | Q187: 183 | S187: SERGOTA
A188: COBURG | C188: 2 | D188: 3 | E188: 15 | G188: 3 | H188: 10 | I188: 28 | K188: 4 | L188: 14 | M188: 38 | O188: 8 | P188: 19 | Q188: 67 | S188: AGNEW | W188: BOX HILL | X188: 2 | Y188: 2 | Z188: 0 | AA188: 437 | AB188: 454 | AC188: =(AA188/AB188)*100 -> 96.255506607929519 | AD188: =(X188*4)+(Z188*2) -> 8
A189: BEST PLAYERS | W189: WILLIAMSTOWN | X189: 2 | Y189: 2 | Z189: 0 | AA189: 307 | AB189: 426 | AC189: =(AA189/AB189)*100 -> 72.065727699530512 | AD189: =(X189*4)+(Z189*2) -> 8
A190: FRANKSTON | C190: SHANNON | F190: VANDERMEER | I190: KEAYS | L190: D RYAN | O190: HAMILL | R190: M RYAN | W190: SANDRINGHAM | X190: 1 | Y190: 3 | Z190: 0 | AA190: 413 | AB190: 435 | AC190: =(AA190/AB190)*100 -> 94.94252873563218 | AD190: =(X190*4)+(Z190*2) -> 4
A191: COBURG | C191: ALESSIO | F191: RYAN | I191: SALVADORE | L191: CASIO | O191: O'MEARA | W191: OAKLEIGH | X191: 1 | Y191: 3 | Z191: 0 | AA191: 443 | AB191: 578 | AC191: =(AA191/AB191)*100 -> 76.643598615916957 | AD191: =(X191*4)+(Z191*2) -> 4
A192: GOALKICKERS | N192: ROWE | P192: MACE | R192: A SHANNON | W192: DANDEN0NG | X192: 1 | Y192: 3 | Z192: 0 | AA192: 391 | AB192: 560 | AC192: =(AA192/AB192)*100 -> 69.821428571428569 | AD192: =(X192*4)+(Z192*2) -> 4
A193: FRANKSTON | C193: KEAYS 9 | E193: RYAN 3 | G193: GARDNER 3 | J193: MORWOOD 3 | M193: NAPOLI 2 | O193: D RYAN 2 | Q193: HAMILL | S193: SHANNON | W193: SPRINGVALE | X193: 0 | Y193: 4 | Z193: 0 | AA193: 345 | AB193: 506 | AC193: =(AA193/AB193)*100 -> 68.181818181818173 | AD193: =(X193*4)+(Z193*2) -> 0
A194: COBURG | C194: KAAKOUR 3 | F194: RYAN | H194: SALVADORE | K194: CASIO | M194: KENNEDY | O194: BARCLAY | W194: COBURG | X194: 0 | Y194: 4 | Z194: 0 | AA194: 311 | AB194: 770 | AC194: =(AA194/AB194)*100 -> 40.38961038961039 | AD194: =(X194*4)+(Z194*2) -> 0
A196: PRAHRAN | C196: 7 | D196: 5 | E196: 47 | G196: 13 | H196: 13 | I196: 91 | K196: 22 | L196: 17 | M196: 149 | O196: 27 | P196: 21 | Q196: 183 | S196: Venue: OAKLEIGH
A197: OAKLEIGH | C197: 6 | D197: 4 | E197: 40 | G197: 8 | H197: 5 | I197: 53 | K197: 10 | L197: 10 | M197: 70 | O197: 13 | P197: 12 | Q197: 90 | S197: NASH :SAWERS
A198: BEST PLAYERS
A199: PRAHRAN | C199: ORIGLASSO | F199: BOLZON | I199: SINNI | L199: AHMAD | O199: PARSONS | R199: DILENA
A200: OAKLEIGH | C200: JORDAN | F200: STUBBS | I200: WILLIAMS | L200: QUIRK | O200: BRIGGS
A201: GOALKICKERS
A202: PRAHRAN | C202: ORIGLASSO 6 | F202: DALE 5 | H202: KEIPERT 3 | J202: TUDDENHAM 3 | M202: TREWELLA 2 | P202: DILENA 2 | R202: MOLONEY 2 | V202: LENNOX | X202: KILEY | Z202: MARTELLO | AC202: CHAPPLE
A203: OAKLEIGH | C203: THORPE 3 | F203: OWEN 3 | H203: STUBBS | J203: BRIGGS | L203: SAUNDERS | N203: WILLIAMS | Q203: QUIRK | S203: GARBUIO | V203: MELLODY
A205: PORT MELBOURNE | C205: 4 | D205: 4 | E205: 28 | G205: 9 | H205: 6 | I205: 60 | K205: 16 | L205: 12 | M205: 108 | O205: 26 | P205: 15 | Q205: 171 | S205: Venue: SPRINGVALE
A206: SPRINGVALE | C206: 5 | D206: 2 | E206: 32 | G206: 9 | H206: 6 | I206: 60 | K206: 11 | L206: 9 | M206: 75 | O206: 13 | P206: 11 | Q206: 89 | S206: RICH :ELLIS
A207: BEST PLAYERS
A208: PORT MELBOURNE | C208: CLOHESY | F208: HICKS | I208: MUENCH | L208: TOUT | O208: BARLOW | R208: KING
A209: SPRINGVALE | C209: LYNCH | F209: CARIS | I209: WILLIAMS | L209: EVANS
A210: GOALKICKERS
A211: PORT MELBOURNE | C211: HICKS 6 | E211: LOVE 5 | G211: ASANI 3 | I211: BOWDEN 3 | K211: CHRIMES 3 | M211: CUNNINGHAM 2 | P211: FOX | Q211: CAMERON | S211: DONALD | V211: RICHARDSON
A212: SPRINGVALE | C212: CARIS 3 | E212: SCURRAH 2 | H212: ELLIOTT 2 | J212: EVANS 2 | L212: PEACOCK | N212: WEST | P212: HAMILTON | R212: FOGARTY
A214: WILLIAMSTOWN | C214: 4 | D214: 0 | E214: 24 | G214: 6 | H214: 4 | I214: 40 | K214: 12 | L214: 11 | M214: 83 | O214: 15 | P214: 13 | Q214: 103 | S214: Venue: WILLIAMSTOWN
A215: PRESTON | C215: 5 | D215: 3 | E215: 33 | G215: 7 | H215: 5 | I215: 47 | K215: 10 | L215: 8 | M215: 68 | O215: 14 | P215: 10 | Q215: 94 | S215: McINERNEY :SEXTON
A216: BEST PLAYERS
A217: WILLIAMSTOWN | C217: GHAZI | F217: MOLONEY | I217: SWAN | L217: SMITH | O217: McGOWAN | R217: VENNER
A218: PRESTON | C218: KING | F218: DUNBAR | I218: SHAW | L218: LUMICISI | O218: CROUGH | R218: HUCKER
A219: GOALKICKERS
A220: WILLIAMSTOWN | C220: RICKMAN 3 | F220: GHAZI 3 | H220: MOLONEY 2 | K220: TURCINOVICH 2 | N220: ZAMKYL 2 | Q220: SHANKS | S220: O'CONNOR | V220: FUENTES
A221: PRESTON | C221: SHAW 7 | F221: CROUGH 4 | I221: CALLANDER | L221: KING | N221: MAIORANA
A223: BOX HILL | C223: 3 | D223: 5 | E223: 23 | G223: 9 | H223: 10 | I223: 64 | K223: 14 | L223: 11 | M223: 95 | O223: 18 | P223: 17 | Q223: 125 | S223: Venue: DANDENONG
A224: DANDENONG | C224: 5 | D224: 0 | E224: 30 | G224: 8 | H224: 0 | I224: 48 | K224: 12 | L224: 4 | M224: 76 | O224: 17 | P224: 5 | Q224: 107
A225: BEST PLAYERS
A226: BOX HILL | C226: LISLE | F226: BANFIELD | I226: DALRYMPLE | L226: BOURKE | O226: ZARAFA | R226: EVANS
A227: DANDENONG | C227: LACKO | F227: MILLIGAN | I227: KENNEDY | L227: BURNELL | O227: MARSHALL | R227: HALL
A228: GOALKICKERS
A229: BOX HILL | C229: JAMES 7 | F229: ERWIN 2 | H229: BOURKE 2 | J229: COHEN | L229: DALY | N229: ELLIS | P229: QUINN | R229: ROWE | T229: WATSON | W229: ZARAFA
A230: DANDENONG | C230: PRETTO 5 | F230: CASSETT 4 | I230: MEAD 2 | K230: HALL | M230: GILDER | O230: HUNTER | Q230: MARSHALL | T230: MILLANE | W230: PETER-BUDGE
A232: ROUND 5 | D232: 15TH MAY | I232: WEATHER
D233: 1ST QTR | H233: 2ND QTR | L233: 3RD QTR | P233: FINAL | S233: Venue: BOX HILL
A234: BOX HILL | O234: 18 | P234: 10 | Q234: 118 | S234: UMPIRES | Y234: LADDER | AB234: ROUND | AD234: 5
A235: SPRINGVALE | O235: 9 | P235: 18 | Q235: 72
A236: BEST PLAYERS | W236: TEAM | X236: W | Y236: L | Z236: D | AA236: FOR | AB236: AGST | AC236: % | AD236: PTS
A237: BOX HILL | C237: SWAN | F237: COHEN | I237: ROWE | L237: LISLE | O237: DALRYMPLE | R237: NICHOL
A238: SPRINGVALE | C238: LYNCH | F238: SUTHERLAND | I238: JEFFS | L238: CLARK | O238: PEACOCK | R238: O'DONNELL | W238: PORT MELBOURNE | X238: 5 | Y238: 0 | Z238: 0 | AA238: 724 | AB238: 441 | AC238: =(AA238/AB238)*100 -> 164.17233560090702 | AD238: =(X238*4)+(Z238*2) -> 20
A239: GOALKICKERS | Q239: WATSON | W239: PRAHRAN | X239: 4 | Y239: 1 | Z239: 0 | AA239: 691 | AB239: 443 | AC239: =(AA239/AB239)*100 -> 155.98194130925509 | AD239: =(X239*4)+(Z239*2) -> 16
A240: BOX HILL | C240: O'NEILL 4 | F240: MA ERWIN 3 | I240: HEANEY 3 | K240: BRUSNAHAN 2 | N240: DALY 2 | P240: EVANS 2 | R240: SWAN | W240: WERRIBEE | X240: 4 | Y240: 1 | Z240: 0 | AA240: 673 | AB240: 443 | AC240: =(AA240/AB240)*100 -> 151.91873589164786 | AD240: =(X240*4)+(Z240*2) -> 16
A241: SPRINGVALE | C241: MORRISON 4 | F241: EVANS 2 | I241: CARIS | J241: DYSON-HOLLAND | N241: DAVIDSON | W241: FRANKSTON | X241: 3 | Y241: 2 | Z241: 0 | AA241: 664 | AB241: 459 | AC241: =(AA241/AB241)*100 -> 144.6623093681917 | AD241: =(X241*4)+(Z241*2) -> 12
D242: 16TH MAY | I242: WEATHER | W242: PRESTON | X242: 3 | Y242: 2 | Z242: 0 | AA242: 549 | AB242: 435 | AC242: =(AA242/AB242)*100 -> 126.20689655172414 | AD242: =(X242*4)+(Z242*2) -> 12
A243: PORT MELBOURNE | O243: 19 | P243: 22 | Q243: 134 | S243: Venue: PORT MELBOURNE
A244: COBURG | O244: 7 | P244: 12 | Q244: 54 | W244: BOX HILL | X244: 3 | Y244: 2 | Z244: 0 | AA244: 555 | AB244: 526 | AC244: =(AA244/AB244)*100 -> 105.51330798479088 | AD244: =(X244*4)+(Z244*2) -> 12
A245: BEST PLAYERS | W245: WILLIAMSTOWN | X245: 3 | Y245: 2 | Z245: 0 | AA245: 402 | AB245: 516 | AC245: =(AA245/AB245)*100 -> 77.906976744186053 | AD245: =(X245*4)+(Z245*2) -> 12
A246: PORT MELBOURNE | C246: EDWARDS | F246: CLOHESY | I246: MUENCH | L246: CAMERON | O246: KING | Q246: R BOWDEN | W246: SANDRINGHAM | X246: 2 | Y246: 3 | Z246: 0 | AA246: 541 | AB246: 486 | AC246: =(AA246/AB246)*100 -> 111.31687242798354 | AD246: =(X246*4)+(Z246*2) -> 8
A247: COBURG | C247: INGRAM | F247: ALESSIO | I247: DADALIARIS | L247: HAWKINS | O247: TARANTO | W247: OAKLEIGH | X247: 2 | Y247: 3 | Z247: 0 | AA247: 610 | AB247: 716 | AC247: =(AA247/AB247)*100 -> 85.19553072625699 | AD247: =(X247*4)+(Z247*2) -> 8
A248: GOALKICKERS | Q248: CLOHESY | S248: TOUT | W248: DANDEN0NG | X248: 1 | Y248: 4 | Z248: 0 | AA248: 529 | AB248: 727 | AC248: =(AA248/AB248)*100 -> 72.764786795048138 | AD248: =(X248*4)+(Z248*2) -> 4
A249: PORT MELBOURNE | C249: LOVE 4 | E249: CHRIMES 3 | G249: McLEOD 2 | I249: S BOWDEN 2 | L249: HICKS 2 | N249: ASANI | P249: FOX | Q249: DONALD | S249: MUENCH | W249: SPRINGVALE | X249: 0 | Y249: 5 | Z249: 0 | AA249: 417 | AB249: 624 | AC249: =(AA249/AB249)*100 -> 66.826923076923066 | AD249: =(X249*4)+(Z249*2) -> 0
A250: COBURG | C250: LISTON 2 | F250: ONLEY | H250: KAAKOUR | J250: BARCLAY | L250: O'MEARA | N250: KENNEDY | W250: COBURG | X250: 0 | Y250: 5 | Z250: 0 | AA250: 365 | AB250: 904 | AC250: =(AA250/AB250)*100 -> 40.376106194690266 | AD250: =(X250*4)+(Z250*2) -> 0
A252: OAKLEIGH | O252: 26 | P252: 11 | Q252: 167 | S252: Venue: DANDENONG
A253: DANDENONG | O253: 21 | P253: 12 | Q253: 138
A254: BEST PLAYERS
A255: OAKLEIGH | C255: WILLIAMS | F255: MELLODY | I255: STUBBS | L255: KIDGELL | O255: THORPE | R255: SHEPHARD
A256: DANDENONG | C256: LACKO | F256: HALL | I256: MILLANE | L256: MILLIGAN | O256: PRETTO | R256: SRUK
A257: GOALKICKERS
A258: OAKLEIGH | C258: THORPE 6 | E258: SHEPHARD 3 | H258: STUBBS 3 | J258: MORELAND 3 | M258: MELLODY 3 | P258: JORDAN 2 | R258: OWEN 2 | U258: LEARMOUTH | X258: QUIRK
A259: DANDENONG | C259: PRETTO 6 | E259: LACKO 4 | G259: SEUK 3 | I259: PARTINGTON 2 | L259: GOTCH | N259: CASSETT | P259: HALL | R259: PETER-BUDGE | V259: MARSHALL | X259: MEAD
A261: SANDRINGHAM | O261: 20 | P261: 8 | Q261: 128 | S261: Venue: PRESTON
A262: PRESTON | O262: 6 | P262: 15 | Q262: 51 | S262: MORROW ;HARVEY
A263: BEST PLAYERS
A264: SANDRINGHAM | C264: GOROZIDIS | F264: ALLEN | I264: KELLOWAY | L264: MOREY | O264: CLARKSON | R264: MURRAY
A265: PRESTON | C265: HOTTON | F265: KING | I265: MORGAN | L265: SHAW | O265: HUCKER
A266: GOALKICKERS
A267: SANDRINGHAM | C267: GOROZIDIS 7 | F267: M WILLIAMS 3 | I267: CLARKSON 2 | L267: KRAKOUER 2 | O267: PAGE | Q267: MOREY | S267: J RUGOLO | V267: MITCHELSON | X267: A MACKENZIE | AB267: GARRETT
A268: PRESTON | C268: SHAW 5 | F268: T WALKER
A270: PRAHRAN | O270: 18 | P270: 18 | Q270: 126 | S270: Venue: WERRIBEE
A271: WERRIBEE | O271: 16 | P271: 9 | Q271: 105
A272: BEST PLAYERS
A273: PRAHRAN | C273: AHMAD | F273: LUCAS | I273: SINNI | L273: MARTELLO | O273: TUDDENHAM | R273: BOLZON
A274: WERRIBEE | C274: STANLEY | F274: McMASTER | I274: AZIZ | L274: HARRINGTON
A275: GOALKICKERS
A276: PRAHRAN | C276: PARSONS 3 | F276: WILSON 3 | I276: DILENA 2 | K276: DALEY 2 | M276: AHMAD 2 | O276: KEIPERT | Q276: TUDDENHAM | T276: SINNI | V276: TREWELLA | X276: CHAPPLE | AA276: LENNOX
A277: WERRIBEE | C277: McDONALD 4 | F277: AZIZ 4 | H277: POWER 2 | J277: HARRINGTON 2 | M277: WRIGHT | O277: RAEBURN | Q277: STANLEY | T277: GEARY
A279: WILLIAMSTOWN | O279: 13 | P279: 17 | Q279: 95 | S279: Venue: WILLIAMSTOWN
A280: FRANKSTON | O280: 13 | P280: 12 | Q280: 90
A281: BEST PLAYERS
A282: WILLIAMSTOWN | C282: TEAM EFFORT
A283: FRANKSTON | C283: S HAMILL | F283: MOORE | I283: ROWE | L283: PYM | O283: WILLIAMS | R283: BOONKAMP
A284: GOALKICKERS
A285: WILLIAMSTOWN | C285: RICKMAN 3 | F285: SHANKS 2 | I285: JOHANSEN 2 | L285: FUENTES 2 | O285: PASTORE | Q285: GHAZI | S285: ZAMKYL | V285: HOUGH
A286: FRANKSTON | C286: KEAYS 3 | F286: MORWOOD 2 | I286: BROWN 2 | K286: D RYAN 2 | M286: M RYAN 2 | P286: S HAMILL | R286: GOOSEY
A288: ROUND 6 | D288: 22ND MAY | I288: WEATHER | S288: Venue: FRANKSTON
D289: 1ST QTR | H289: 2ND QTR | L289: 3RD QTR | P289: FINAL | S289: UMPIRES
A290: FRANKSTON | O290: 21 | P290: 12 | Q290: 138 | S290: NORDEN | Y290: LADDER | AB290: ROUND | AD290: 6
A291: SANDRINGHAM | O291: 13 | P291: 11 | Q291: 89 | S291: NASH
A292: BEST PLAYERS | W292: TEAM | X292: W | Y292: L | Z292: D | AA292: FOR | AB292: AGST | AC292: % | AD292: PTS
A293: FRANKSTON | C293: MOORE | F293: WILLIAMS | I293: S HAMILL | L293: GARDNER | N293: BOONKAMP | Q293: VANDERMEER
A294: SANDRINGHAM | C294: GOROZIDIS | F294: BAILEY | I294: CZERKASKI | L294: KRAKOUER | W294: PORT MELBOURNE | X294: 6 | Y294: 0 | Z294: 0 | AA294: 858 | AB294: 538 | AC294: =(AA294/AB294)*100 -> 159.4795539033457 | AD294: =(X294*4)+(Z294*2) -> 24
A295: GOALKICKERS | P295: WILLIAMS | R295: RYAN | W295: WERRIBEE | X295: 5 | Y295: 1 | Z295: 0 | AA295: 849 | AB295: 520 | AC295: =(AA295/AB295)*100 -> 163.26923076923077 | AD295: =(X295*4)+(Z295*2) -> 20
A296: FRANKSTON | C296: GARDNER 6 | F296: KEAYS 4 | H296: DAVIES 3 | J296: MORWOOD 2 | M296: S HAMILL | O296: BROWN | Q296: PYM | R296: VERBEEK | W296: FRANKSTON | X296: 4 | Y296: 2 | Z296: 0 | AA296: 802 | AB296: 548 | AC296: =(AA296/AB296)*100 -> 146.35036496350364 | AD296: =(X296*4)+(Z296*2) -> 16
A297: SANDRINGHAM | C297: GOROZIDIS 9 | F297: R ALLAN | H297: A ALLEN | J297: MITCHELSON | M297: FOLEY | W297: PRAHRAN | X297: 4 | Y297: 2 | Z297: 0 | AA297: 801 | AB297: 555 | AC297: =(AA297/AB297)*100 -> 144.32432432432432 | AD297: =(X297*4)+(Z297*2) -> 16
D298: 23RD MAY | I298: WEATHER | W298: PRESTON | X298: 4 | Y298: 2 | Z298: 0 | AA298: 661 | AB298: 545 | AC298: =(AA298/AB298)*100 -> 121.28440366972477 | AD298: =(X298*4)+(Z298*2) -> 16
A299: PORT MELBOURNE | O299: 20 | P299: 14 | Q299: 134 | S299: Venue: PORT MELBOURNE
A300: WILLIAMSTOWN | O300: 15 | P300: 7 | Q300: 97 | W300: BOX HILL | X300: 4 | Y300: 2 | Z300: 0 | AA300: 708 | AB300: 625 | AC300: =(AA300/AB300)*100 -> 113.28 | AD300: =(X300*4)+(Z300*2) -> 16
A301: BEST PLAYERS | W301: WILLIAMSTOWN | X301: 3 | Y301: 3 | Z301: 0 | AA301: 499 | AB301: 650 | AC301: =(AA301/AB301)*100 -> 76.769230769230774 | AD301: =(X301*4)+(Z301*2) -> 12
A302: PORT MELBOURNE | C302: LAFFY | F302: EDWARDS | I302: R BOWDEN | L302: S BOWDEN | O302: KING | Q302: STYNES | W302: SANDRINGHAM | X302: 2 | Y302: 4 | Z302: 0 | AA302: 630 | AB302: 624 | AC302: =(AA302/AB302)*100 -> 100.96153846153845 | AD302: =(X302*4)+(Z302*2) -> 8
A303: WILLIAMSTOWN | C303: MINETT | F303: GHAZI | I303: RICKMAN | L303: SYMONS | O303: HORE | Q303: O'CONNOR | W303: OAKLEIGH | X303: 2 | Y303: 4 | Z303: 0 | AA303: 687 | AB303: 892 | AC303: =(AA303/AB303)*100 -> 77.017937219730939 | AD303: =(X303*4)+(Z303*2) -> 8
A304: GOALKICKERS | P304: CLOHESY | R304: HARKINS | W304: SPRINGVALE | X304: 1 | Y304: 5 | Z304: 0 | AA304: 556 | AB304: 729 | AC304: =(AA304/AB304)*100 -> 76.268861454046643 | AD304: =(X304*4)+(Z304*2) -> 4
A305: PORT MELBOURNE | C305: LOVE 6 | E305: CUNNINGHAM 4 | H305: S BOWDEN 2 | K305: FOX 2 | M305: HICKS 2 | O305: R BOWDEN | Q305: CHRIMES | W305: DANDEN0NG | X305: 1 | Y305: 5 | Z305: 0 | AA305: 634 | AB305: 866 | AC305: =(AA305/AB305)*100 -> 73.210161662817555 | AD305: =(X305*4)+(Z305*2) -> 4
A306: WILLIAMSTOWN | C306: RICKMAN 6 | F306: ZAMKYL 2 | I306: GHAZI 2 | K306: FUENTES 2 | N306: JOHANSEN | Q306: O'CONNOR | W306: COBURG | X306: 0 | Y306: 6 | Z306: 0 | AA306: 464 | AB306: 1057 | AC306: =(AA306/AB306)*100 -> 43.897824030274364 | AD306: =(X306*4)+(Z306*2) -> 0
P307: SYMONS
A308: BOX HILL | O308: 23 | P308: 15 | Q308: 153 | S308: Venue: COBURG
A309: COBURG | O309: 15 | P309: 9 | Q309: 99
A310: BEST PLAYERS
A311: BOX HILL | C311: DALRYMPLE | F311: ZARAFA | I311: JAMES | L311: KELLY | O311: DALY | R311: SWAN
A312: COBURG | C312: ALESSIO | F312: EVANS | I312: HALE | L312: INGRAM | O312: MOORFIELD
A313: GOALKICKERS
A314: BOX HILL | C314: JAMES 8 | F314: DALY 4 | H314: MA ERWIN 3 | K314: HEANEY 3 | M314: BOURKE | O314: BRUSNAHAN | R314: KELLY | T314: O'NEILL | V314: QUINN
A315: COBURG | C315: ALESSIO 5 | F315: INGRAM 5 | I315: KAAKOUR 3 | L315: EVANS | N315: O'MEARA
A317: WERRIBEE | O317: 27 | P317: 14 | Q317: 176 | S317: Venue: OAKLEIGH
A318: OAKLEIGH | O318: 12 | P318: 5 | Q318: 77
A319: BEST PLAYERS
A320: WERRIBEE | C320: WRIGHT | F320: HARRINGTON | I320: WILLIAMS | L320: LESIPUTTY | O320: BUTTON | R320: POWER
A321: OAKLEIGH | C321: BICKNELL | F321: SAUNDERS | I321: SHEPHARD | L321: TODD | O321: WILLIAMS
A322: GOALKICKERS
A323: WERRIBEE | C323: AZIZ 8 | E323: POWER 5 | G323: BUTTON 4 | I323: WRIGHT 3 | K323: FOTIA 3 | M323: GEARY 2 | O323: REYNOLDSON | R323: HARRINGTON
A324: OAKLEIGH | C324: THORPE 4 | F324: SHEPHARD 3 | I324: MORELAND | L324: LEARMOUTH | O324: MORELAND | R324: JORDAN | U324: OWEN
A326: PRESTON | O326: 16 | P326: 16 | Q326: 112 | S326: Venue: TOORAK PARK
A327: PRAHRAN | O327: 17 | P327: 8 | Q327: 110
A328: BEST PLAYERS
A329: PRESTON | C329: BURROWS | F329: KING | I329: MAY | L329: CROUGH | O329: DUNBAR | R329: GRAZIANO
A330: PRAHRAN | C330: KILEY | F330: PARSONS | I330: LUCAS | L330: SINNI | O330: MCORMACK | R330: KEIPERT
A331: GOALKICKERS
A332: PRESTON | C332: SHAW 5 | F332: CROUGH 2 | I332: DOBELL 2 | K332: MAY 2 | M332: GRAZIANO | O332: MAIORANA | Q332: CALLANDER | T332: LUMICISI | W332: POLGAR
A333: PRAHRAN | C333: PARSONS 6 | F333: KEIPERT 5 | I333: DILENA | K333: DALE | M333: WILSON | O333: SINNI | Q333: AHMAD | S333: KILEY
A335: SPRINGVALE | O335: 20 | P335: 19 | Q335: 139 | S335: Venue: SPRINGVALE
A336: DANDENONG | O336: 16 | P336: 9 | Q336: 105
A337: BEST PLAYERS
A338: SPRINGVALE | C338: KNIGHT | F338: CARIS | I338: JEFFS | L338: PLAQU | O338: PEACOCK | R338: O'DONNELL
A339: DANDENONG | C339: KNIGHT | F339: MARSHALL | I339: PETER-BUDGE | L339: PRETTO | O339: MILLIGAN
A340: GOALKICKERS
A341: SPRINGVALE | C341: MORRISON 5 | F341: KNIGHT 4 | H341: EVANS 3 | J341: CARIS 2 | L341: BEESLEY 2 | N341: WEST | P341: LYNCH | R341: JEFFS | T341: GOLDBERG
A342: DANDENONG | C342: PRETTO 5 | F342: MARSHALL 3 | I342: GOTCH 2 | K342: MILLANE 2 | N342: MEAD | P342: GILDER | R342: SALIBA | U342: SRUK
A344: ROUND 7 | D344: 29TH MAY | I344: WEATHER
D345: 1ST QTR | H345: 2ND QTR | L345: 3RD QTR | P345: FINAL | S345: Venue: PRESTON
A346: WERRIBEE | O346: 19 | P346: 15 | Q346: 129 | S346: UMPIRES | Y346: LADDER | AB346: ROUND | AD346: 7
A347: PRESTON | O347: 9 | P347: 15 | Q347: 69
A348: BEST PLAYERS | W348: TEAM | X348: W | Y348: L | Z348: D | AA348: FOR | AB348: AGST | AC348: % | AD348: PTS
A349: WERRIBEE | C349: BUTTON | F349: LESIPUTTY | I349: NORMINGTON | L349: WILLIAMS | O349: GEARY | Q349: McPHERSON
A350: PRESTON | C350: KING | F350: HOTTON | I350: REEVES | L350: MORGAN | O350: SHAW | Q350: HUCKER | W350: PORT MELBOURNE | X350: 7 | Y350: 0 | Z350: 0 | AA350: 963 | AB350: 615 | AC350: =(AA350/AB350)*100 -> 156.58536585365854 | AD350: =(X350*4)+(Z350*2) -> 28
A351: GOALKICKERS | M351: LESIPUTTY | P351: McMASTER | R351: STANLEY | W351: WERRIBEE | X351: 6 | Y351: 1 | Z351: 0 | AA351: 978 | AB351: 589 | AC351: =(AA351/AB351)*100 -> 166.04414261460101 | AD351: =(X351*4)+(Z351*2) -> 24
A352: WERRIBEE | C352: AZIZ 3 | E352: McDONALD 3 | H352: POWER 3 | J352: RAEBURN 3 | M352: CULLEN 2 | O352: BUTTON | Q352: NORMINGTON | W352: PRAHRAN | X352: 5 | Y352: 2 | Z352: 0 | AA352: 920 | AB352: 656 | AC352: =(AA352/AB352)*100 -> 140.2439024390244 | AD352: =(X352*4)+(Z352*2) -> 20
A353: PRESTON | C353: SHAW 6 | F353: DOBELL | H353: KING | J353: LUMICISI | W353: BOX HILL | X353: 5 | Y353: 2 | Z353: 0 | AA353: 841 | AB353: 741 | AC353: =(AA353/AB353)*100 -> 113.49527665317139 | AD353: =(X353*4)+(Z353*2) -> 20
D354: 30TH MAY | I354: WEATHER | W354: FRANKSTON | X354: 4 | Y354: 3 | Z354: 0 | AA354: 903 | AB354: 667 | AC354: =(AA354/AB354)*100 -> 135.3823088455772 | AD354: =(X354*4)+(Z354*2) -> 16
A355: PRAHRAN | O355: 17 | P355: 17 | Q355: 119 | S355: Venue: FRANKSTON
A356: FRANKSTON | O356: 15 | P356: 11 | Q356: 101 | W356: PRESTON | X356: 4 | Y356: 3 | Z356: 0 | AA356: 730 | AB356: 674 | AC356: =(AA356/AB356)*100 -> 108.30860534124629 | AD356: =(X356*4)+(Z356*2) -> 16
A357: BEST PLAYERS | W357: WILLIAMSTOWN | X357: 3 | Y357: 4 | Z357: 0 | AA357: 615 | AB357: 783 | AC357: =(AA357/AB357)*100 -> 78.544061302681996 | AD357: =(X357*4)+(Z357*2) -> 12
A358: PRAHRAN | C358: KEIPERT | F358: TREWELLA | I358: SCICLUNA | L358: BOLZON | O358: POVEY | Q358: McCORMACK | W358: SANDRINGHAM | X358: 2 | Y358: 5 | Z358: 0 | AA358: 707 | AB358: 729 | AC358: =(AA358/AB358)*100 -> 96.982167352537715 | AD358: =(X358*4)+(Z358*2) -> 8
A359: FRANKSTON | C359: MOORE | F359: VANDERMEER | W359: DANDEN0NG | X359: 2 | Y359: 5 | Z359: 0 | AA359: 782 | AB359: 934 | AC359: =(AA359/AB359)*100 -> 83.725910064239827 | AD359: =(X359*4)+(Z359*2) -> 8
A360: GOALKICKERS | W360: SPRINGVALE | X360: 2 | Y360: 5 | Z360: 0 | AA360: 649 | AB360: 799 | AC360: =(AA360/AB360)*100 -> 81.226533166458069 | AD360: =(X360*4)+(Z360*2) -> 8
A361: PRAHRAN | C361: KEIPERT 8 | F361: PARSONS 4 | I361: DILENA 2 | K361: KILEY | M361: AHMAD | O361: PHELAN | W361: OAKLEIGH | X361: 2 | Y361: 5 | Z361: 0 | AA361: 757 | AB361: 985 | AC361: =(AA361/AB361)*100 -> 76.852791878172582 | AD361: =(X361*4)+(Z361*2) -> 8
A362: FRANKSTON | C362: GARDNER 5 | F362: KEAYS 3 | H362: CORMACK 2 | K362: DAVIES | M362: VERBEEK | O362: PYM | P362: WILLIAMS | R362: RYAN | W362: COBURG | X362: 0 | Y362: 7 | Z362: 0 | AA362: 532 | AB362: 1205 | AC362: =(AA362/AB362)*100 -> 44.149377593360995 | AD362: =(X362*4)+(Z362*2) -> 0
A364: BOX HILL | O364: 20 | P364: 13 | Q364: 133 | S364: Venue: WILLIAMSTOWN
A365: WILLIAMSTOWN | O365: 16 | P365: 20 | Q365: 116
A366: BEST PLAYERS
A367: BOX HILL | C367: ERWIN | F367: BOURKE | I367: COHEN | L367: DALY | O367: BANFIELD | R367: KELLY
A368: WILLIAMSTOWN | C368: GHAZI | F368: FUENTES | I368: HORE | L368: LONG | O368: HOWLETT
A369: GOALKICKERS
A370: BOX HILL | C370: ERWIN 9 | F370: BADROCK 2 | I370: BOURKE 2 | K370: ELLIS 2 | M370: JAMES 2 | O370: DALRYMPLE | R370: DALY | T370: KELLY
A371: WILLIAMSTOWN | C371: GHAZI 8 | F371: FUENTES 3 | I371: TURCINOVICH 2 | L371: MCGOWAN | O371: ZAMKYL | Q371: HORE
A373: PORT MELBOURNE | O373: 15 | P373: 15 | Q373: 105 | S373: Venue: BEACH ROAD
A374: SANDRINGHAM | O374: 11 | P374: 11 | Q374: 77 | S374: CARLAND :McKENZIE
A375: BEST PLAYERS
A376: PORT MELBOURNE | C376: LARKIN | F376: EDWARDS | I376: HICKS | L376: LAFFY | N376: KEIGHRAN | Q376: CUNNINGHAM
A377: SANDRINGHAM | C377: MACKENZIE | F377: KELLOWAY | I377: KRAKOUER
A378: GOALKICKERS
A379: PORT MELBOURNE | C379: LARKIN 3 | F379: CHRIMES 3 | I379: HICKS 2 | K379: MUENCH 2 | M379: R BOWDEN | P379: KEIGHRAN | R379: S BOWDEN | U379: CUNNINGHAM | X379: CLOHESY
A380: SANDRINGHAM | C380: RUGOLO 4 | F380: DIMMATINA 3 | I380: GOROZODIS 2 | L380: KELLOWAY | N380: MACKENZIE
A382: DANDENONG | O382: 20 | P382: 28 | Q382: 148 | S382: Venue: DANDENONG
A383: COBURG | O383: 10 | P383: 8 | Q383: 68
A384: BEST PLAYERS
A385: DANDENONG | C385: HALL | F385: LACKO | I385: FOSTER | L385: PETER-BUDGE | O385: MARSHALL | R385: GOTCH
A386: COBURG | C386: ALESSIO | F386: INGRAM | I386: RYAN | L386: O'MEARA | O386: SEMAAN
A387: GOALKICKERS
A388: DANDENONG | C388: GOTCH 4 | F388: PETER-BUDGE 4 | I388: PRETTO 3 | K388: CASSETT 3 | M388: MILLANE | O388: MEAD | Q388: BURNELL | S388: MARSHALL | V388: McCONCHIE | X388: SRUK
A389: COBURG | C389: O'MEARA 4 | F389: MOORFIELD 2 | I389: ALESSIO 2 | K389: INGRAM 2
A391: SPRINGVALE | O391: 13 | P391: 15 | Q391: 93 | S391: Venue: SPRINGVALE
A392: OAKLEIGH | O392: 9 | P392: 16 | Q392: 70
A393: BEST PLAYERS
A394: SPRINGVALE | C394: IRVING | F394: JEFFS | I394: GOLDBERG | L394: CLARK | O394: SMIT | R394: SUTHERLAND
A395: OAKLEIGH | C395: TODD | F395: BICKNELL | I395: HAWKER | L395: SAUNDERS | O395: YOUNG | R395: SHEPHARD
A396: GOALKICKERS
A397: SPRINGVALE | C397: EVANS 3 | E397: KNIGHT 2 | G397: FOGARTY 2 | I397: LYNCH 2 | K397: DAVIDSON | M397: GOLDBERG | P397: CARIS | R397: PEACOCK
A398: OAKLEIGH | C398: SHEPHARD 3 | F398: THORPE 2 | I398: MORELAND | L398: JORDAN | N398: YOUNG | P398: OWEN
A400: ROUND 8 | D400: 5TH JUNE | I400: WEATHER
D401: 1ST QTR | H401: 2ND QTR | L401: 3RD QTR | P401: FINAL | S401: Venue: TOORAK PARK
A402: PORT MELBOURNE | O402: 21 | P402: 12 | Q402: 138 | S402: UMPIRES | Y402: LADDER | AB402: ROUND | AD402: 8
A403: PRAHRAN | O403: 14 | P403: 8 | Q403: 92
A404: BEST PLAYERS | W404: TEAM | X404: W | Y404: L | Z404: D | AA404: FOR | AB404: AGST | AC404: % | AD404: PTS
A405: PORT MELBOURNE | C405: CLOHESY | F405: DONALD | I405: LAFFY | L405: FOX | O405: R BOWDEN | R405: S BOWDEN
A406: PRAHRAN | C406: McGREGOR | F406: PARSONS | I406: LENNOX | L406: DILENA | O406: PHELAN | R406: SCICLUNA | W406: PORT MELBOURNE | X406: 8 | Y406: 0 | Z406: 0 | AA406: 1101 | AB406: 707 | AC406: =(AA406/AB406)*100 -> 155.72842998585571 | AD406: =(X406*4)+(Z406*2) -> 32
A407: GOALKICKERS | K407: R BOWDEN | M407: LAFFY | P407: CHRIMES | R407: HARKINS | W407: WERRIBEE | X407: 6 | Y407: 2 | Z407: 0 | AA407: 1075 | AB407: 694 | AC407: =(AA407/AB407)*100 -> 154.89913544668588 | AD407: =(X407*4)+(Z407*2) -> 24
A408: PORT MELBOURNE | C408: S BOWDEN 3 | F408: CUNNINGHAM 3 | I408: MUENCH 3 | K408: BAILEY 2 | M408: DONALD 2 | O408: FOX 2 | Q408: HICKS 2 | W408: FRANKSTON | X408: 5 | Y408: 3 | Z408: 0 | AA408: 1008 | AB408: 764 | AC408: =(AA408/AB408)*100 -> 131.93717277486911 | AD408: =(X408*4)+(Z408*2) -> 20
A409: PRAHRAN | C409: PARSONS 6 | F409: KEIPERT 3 | I409: POVEY 2 | K409: TREWELLA | N409: KILEY | P409: WINTON | W409: PRAHRAN | X409: 5 | Y409: 3 | Z409: 0 | AA409: 1012 | AB409: 794 | AC409: =(AA409/AB409)*100 -> 127.45591939546598 | AD409: =(X409*4)+(Z409*2) -> 20
D410: 6TH JUNE | W410: PRESTON | X410: 5 | Y410: 3 | Z410: 0 | AA410: 830 | AB410: 742 | AC410: =(AA410/AB410)*100 -> 111.85983827493263 | AD410: =(X410*4)+(Z410*2) -> 20
A411: FRANKSTON | O411: 16 | P411: 9 | Q411: 105 | S411: Venue: WERRIBEE
A412: WERRIBEE | O412: 14 | P412: 13 | Q412: 97 | W412: BOX HILL | X412: 5 | Y412: 3 | Z412: 0 | AA412: 918 | AB412: 834 | AC412: =(AA412/AB412)*100 -> 110.07194244604317 | AD412: =(X412*4)+(Z412*2) -> 20
A413: BEST PLAYERS | W413: SANDRINGHAM | X413: 3 | Y413: 5 | Z413: 0 | AA413: 800 | AB413: 806 | AC413: =(AA413/AB413)*100 -> 99.255583126550874 | AD413: =(X413*4)+(Z413*2) -> 12
A414: FRANKSTON | C414: KEAYS | F414: McCARTHY | I414: GAHAN | L414: GARDNER | O414: VANDERMEER | R414: VERBEEK | W414: DANDEN0NG | X414: 3 | Y414: 5 | Z414: 0 | AA414: 878 | AB414: 985 | AC414: =(AA414/AB414)*100 -> 89.137055837563452 | AD414: =(X414*4)+(Z414*2) -> 12
A415: WERRIBEE | C415: AZIZ | F415: HARRINGTON | I415: McPHERSON | L415: GEARY | W415: SPRINGVALE | X415: 3 | Y415: 5 | Z415: 0 | AA415: 751 | AB415: 852 | AC415: =(AA415/AB415)*100 -> 88.145539906103281 | AD415: =(X415*4)+(Z415*2) -> 12
A416: GOALKICKERS | O416: HAMILL | Q416: MOORE | W416: WILLIAMSTOWN | X416: 3 | Y416: 5 | Z416: 0 | AA416: 666 | AB416: 879 | AC416: =(AA416/AB416)*100 -> 75.76791808873719 | AD416: =(X416*4)+(Z416*2) -> 12
A417: FRANKSTON | C417: GARDNER 5 | F417: McCARTHY 2 | I417: GAHAN 2 | K417: MORWOOD 2 | N417: BROWN | P417: RYAN | R417: GOOSEY | W417: OAKLEIGH | X417: 2 | Y417: 6 | Z417: 0 | AA417: 825 | AB417: 1085 | AC417: =(AA417/AB417)*100 -> 76.036866359447004 | AD417: =(X417*4)+(Z417*2) -> 8
A418: WERRIBEE | C418: AZIZ 7 | F418: McPHERSON 2 | I418: BUTTON | K418: CULLEN | M418: McDONALD | P418: HARRINGTON | S418: STANLEY | W418: COBURG | X418: 0 | Y418: 8 | Z418: 0 | AA418: 585 | AB418: 1307 | AC418: =(AA418/AB418)*100 -> 44.758990053557767 | AD418: =(X418*4)+(Z418*2) -> 0
A420: PRESTON | O420: 14 | P420: 16 | Q420: 100 | S420: Venue: OAKLEIGH
A421: OAKLEIGH | O421: 9 | P421: 14 | Q421: 68
A422: BEST PLAYERS
A423: PRESTON | C423: DUNBAR | F423: PEZZIN | I423: REEVES | L423: LUMICISI | O423: MUNRIVANA | R423: BURROWS
A424: OAKLEIGH | C424: LEARMOUTH | F424: D STUBBS | I424: BONNEY | L424: TODD | O424: BRIGGS | R424: SHEPHARD
A425: GOALKICKERS
A426: PRESTON | C426: PEZZIN 4 | F426: SHAW 3 | H426: GRAZIANO 2 | K426: DUNBAR | M426: MUNRIVANA | P426: CROUGH | R426: KING | T426: LUMICISI
A427: OAKLEIGH | C427: SHEPHARD 3 | F427: MORELAND 2 | I427: THORPE | K427: BRIGGS | M427: DI NATALE | O427: TODD
A429: DANDENONG | O429: 13 | P429: 18 | Q429: 96 | S429: Venue: WILLIAMSTOWN
A430: WILLIAMSTOWN | O430: 7 | P430: 9 | Q430: 51
A431: BEST PLAYERS
A432: DANDENONG | C432: PETER-BUDGE | F432: LACKO | I432: BURNELL | L432: GOTCH | O432: GWIN | R432: MILLANE
A433: WILLIAMSTOWN | C433: MINETT | F433: VENNER | I433: GHAZI
A434: GOALKICKERS
A435: DANDENONG | C435: PRETTO 3 | F435: MILLANE 3 | I435: PETER-BUDGE 2 | L435: SRUK 2 | N435: McCONCHIE | Q435: COUSINS | S435: FOSTER
A436: WILLIAMSTOWN | C436: RICKMAN 2 | F436: MOLONEY | I436: KNIGHT | K436: FUENTES | M436: HORE | O436: LONG
A438: SPRINGVALE | O438: 15 | P438: 12 | Q438: 102 | S438: Venue: COBURG
A439: COBURG | O439: 7 | P439: 11 | Q439: 53
A440: BEST PLAYERS
A441: SPRINGVALE | C441: CLARK | F441: PEACOCK | I441: GOLDBERG | L441: HALPHEN | O441: SUTHERLAND | R441: DYSON-HOLLAND
A442: COBURG | C442: ALESSIO | F442: SALVADORE | I442: TARANTO | L442: DORIAN | O442: LISTON
A443: GOALKICKERS
A444: SPRINGVALE | C444: EVANS 5 | F444: KNIGHT 2 | I444: CARIS 2 | K444: PEACOCK | M444: LYNCH | O444: CLARK | Q444: JEFFS | S444: BEESLEY | V444: CARROLL
A445: COBURG | C445: ZIROS 2 | F445: O'MEARA 2 | I445: INGRAM | K445: KAAKOUR | M445: BARCLAY
D446: 12TH JUNE | I446: WEATHER
A447: SANDRINGHAM | O447: 14 | P447: 9 | Q447: 93 | S447: Venue: BOX HILL
A448: BOX HILL | O448: 12 | P448: 5 | Q448: 77 | S448: MANN :PANOZZO
A449: BEST PLAYERS
A450: SANDRINGHAM | C450: KRAKOUER | F450: CLARKSON | I450: MOREY | L450: BAILEY | O450: DIMMATINA | R450: J RUGOLO
A451: BOX HILL | C451: WATSON | F451: BANFIELD | I451: LISLE | L451: PENNY | O451: MA ERWIN | R451: EVANS
A452: GOALKICKERS
A453: SANDRINGHAM | C453: MOREY 4 | F453: KRAKOUER 2 | I453: DIMMATINA 2 | L453: FORD 2 | N453: F RUGOLO | P453: ALLAN | R453: MACKENZIE | V453: MACGEORGE
A454: BOX HILL | C454: EVANS 3 | E454: MA ERWIN 3 | H454: JAMES 2 | J454: MI ERWIN | M454: WILKINSON
A456: ROUND 9 | D456: 19TH JUNE | I456: WEATHER
D457: 1ST QTR | H457: 2ND QTR | L457: 3RD QTR | P457: FINAL | S457: Venue: PORT MELBOURNE
A458: WERRIBEE | O458: 21 | P458: 13 | Q458: 139 | S458: UMPIRES | Y458: LADDER | AB458: ROUND | AD458: 9
A459: PORT MELBOURNE | O459: 13 | P459: 11 | Q459: 89
A460: BEST PLAYERS | W460: TEAM | X460: W | Y460: L | Z460: D | AA460: FOR | AB460: AGST | AC460: % | AD460: PTS
A461: WERRIBEE | C461: AZIZ | F461: WALSH | I461: POWER | K461: CULLEN | N461: WILSON | Q461: McDONALD
A462: PORT MELBOURNE | C462: LAFFY | F462: MUENCH | I462: HICKS | K462: BAILEY | N462: KING | W462: PORT MELBOURNE | X462: 8 | Y462: 1 | Z462: 0 | AA462: 1190 | AB462: 846 | AC462: =(AA462/AB462)*100 -> 140.66193853427896 | AD462: =(X462*4)+(Z462*2) -> 32
A463: GOALKICKERS | W463: WERRIBEE | X463: 7 | Y463: 2 | Z463: 0 | AA463: 1214 | AB463: 783 | AC463: =(AA463/AB463)*100 -> 155.04469987228609 | AD463: =(X463*4)+(Z463*2) -> 28
A464: WERRIBEE | C464: AZIZ 9 | E464: BUTTON 4 | G464: GEARY 3 | I464: RIENIETS | K464: RAEBURN | M464: MCDONALD | P464: WILSON | R464: SAMUT | W464: FRANKSTON | X464: 6 | Y464: 3 | Z464: 0 | AA464: 1143 | AB464: 819 | AC464: =(AA464/AB464)*100 -> 139.56043956043956 | AD464: =(X464*4)+(Z464*2) -> 24
A465: PORT MELBOURNE | C465: HICKS 4 | F465: CUNNINGHAM 2 | I465: HOLMES 2 | K465: LOVE 2 | M465: CHRIMES | O465: FOX | Q465: LAFFY | W465: BOX HILL | X465: 6 | Y465: 3 | Z465: 0 | AA465: 1011 | AB465: 926 | AC465: =(AA465/AB465)*100 -> 109.1792656587473 | AD465: =(X465*4)+(Z465*2) -> 24
D466: 20TH JUNE | I466: WEATHER | W466: PRAHRAN | X466: 5 | Y466: 4 | Z466: 0 | AA466: 1104 | AB466: 887 | AC466: =(AA466/AB466)*100 -> 124.46448703494927 | AD466: =(X466*4)+(Z466*2) -> 20
A467: DANDENONG | O467: 17 | P467: 13 | Q467: 115 | S467: Venue: DANDENONG
A468: SANDRINGHAM | O468: 16 | P468: 7 | Q468: 103 | S468: RICH :WENN | W468: PRESTON | X468: 5 | Y468: 4 | Z468: 0 | AA468: 885 | AB468: 877 | AC468: =(AA468/AB468)*100 -> 100.91220068415052 | AD468: =(X468*4)+(Z468*2) -> 20
A469: BEST PLAYERS | W469: DANDEN0NG | X469: 4 | Y469: 5 | Z469: 0 | AA469: 993 | AB469: 1088 | AC469: =(AA469/AB469)*100 -> 91.268382352941174 | AD469: =(X469*4)+(Z469*2) -> 16
A470: DANDENONG | C470: KENNEDY | F470: MILLIGAN | I470: SRUK | L470: HALL | O470: KNIGHT | Q470: MILLANE | W470: SPRINGVALE | X470: 4 | Y470: 5 | Z470: 0 | AA470: 822 | AB470: 922 | AC470: =(AA470/AB470)*100 -> 89.15401301518439 | AD470: =(X470*4)+(Z470*2) -> 16
A471: SANDRINGHAM | C471: MURRAY | F471: KELLOWAY | I471: WILLIAMS | L471: LAMBERT | W471: SANDRINGHAM | X471: 3 | Y471: 6 | Z471: 0 | AA471: 903 | AB471: 921 | AC471: =(AA471/AB471)*100 -> 98.045602605863195 | AD471: =(X471*4)+(Z471*2) -> 12
A472: GOALKICKERS | W472: OAKLEIGH | X472: 3 | Y472: 6 | Z472: 0 | AA472: 943 | AB472: 1202 | AC472: =(AA472/AB472)*100 -> 78.452579034941763 | AD472: =(X472*4)+(Z472*2) -> 12
A473: DANDENONG | C473: MILLANE 4 | F473: PRETTO 4 | H473: FOSTER 3 | J473: SRUK 2 | L473: GILDER | N473: SALIBA | P473: GOTCH | R473: HALL | W473: WILLIAMSTOWN | X473: 3 | Y473: 6 | Z473: 0 | AA473: 736 | AB473: 950 | AC473: =(AA473/AB473)*100 -> 77.473684210526315 | AD473: =(X473*4)+(Z473*2) -> 12
A474: SANDRINGHAM | C474: WILLIAMS 4 | F474: MOREY 3 | H474: GOROZIDIS 2 | K474: CZERKASKI 2 | N474: ALLAN 2 | P474: FOLEY | R474: CLARKSON | W474: COBURG | X474: 0 | Y474: 9 | Z474: 0 | AA474: 702 | AB474: 1425 | AC474: =(AA474/AB474)*100 -> 49.263157894736842 | AD474: =(X474*4)+(Z474*2) -> 0
O475: RYAN
A476: FRANKSTON | O476: 20 | P476: 15 | Q476: 135 | S476: Venue: FRANKSTON
A477: PRESTON | O477: 8 | P477: 7 | Q477: 55
A478: BEST PLAYERS
A479: FRANKSTON | C479: KEAYS | F479: FOOT | I479: GAHAN | L479: S HAMILL | O479: D RYAN | R479: GOOSEY
A480: PRESTON | C480: KING | F480: DOBBS | I480: HUCKER | L480: LEYDIN | O480: SHAW | R480: MUNRIVANA
A481: GOALKICKERS
A482: FRANKSTON | C482: DAVIES 5 | E482: MORWOOD 4 | H482: GARDNER 3 | J482: GOOSEY 2 | L482: WILLIAMS | N482: KEAYS | P482: M RYAN | R482: VANDERMEER | V482: McCARTHY | X482: GAHAN
A483: PRESTON | C483: SHAW 5 | F483: MUNRIVANA 2 | I483: KING
A485: BOX HILL | O485: 13 | P485: 15 | Q485: 93 | S485: Venue: BOX HILL
A486: PRAHRAN | O486: 13 | P486: 14 | Q486: 92
A487: BEST PLAYERS
A488: BOX HILL | C488: BANFIELD | F488: NICHOL | I488: WILKINSON | L488: EVANS | O488: ROWE | R488: ZARAFA
A489: PRAHRAN | C489: WINTON | F489: MOLONEY | I489: SINNI | L489: POVEY | O489: PARSONS
A490: GOALKICKERS
A491: BOX HILL | C491: DALY 2 | E491: HEANEY 2 | H491: HOGAN 2 | J491: WILKINSON 2 | M491: DALRYMPLE | P491: JAMES | R491: O'NEILL | T491: PENNY | V491: ZARAFA
A492: PRAHRAN | C492: PARSONS 5 | F492: WINTON 2 | I492: KEIPERT | K492: DILENA | M492: TUDDENHAM | P492: SINNI | R492: TREWELLA | U492: AHMAD
A494: OAKLEIGH | O494: 17 | P494: 16 | Q494: 118 | S494: Venue: COBURG
A495: COBURG | O495: 17 | P495: 15 | Q495: 117
A496: BEST PLAYERS
A497: OAKLEIGH | C497: BICKNELL | F497: LEARMOUTH | I497: HAZELL | L497: YOUNG | O497: BONNEY
A498: COBURG | C498: MOORFIELD | F498: INGRAM | I498: SALVADORE | L498: BAKER | O498: LISTON
A499: GOALKICKERS
A500: OAKLEIGH | C500: SHEPHARD 5 | F500: OWEN 4 | H500: MORELAND 3 | K500: YOUNG 2 | M500: DI NATALE | P500: WILLIAMS | R500: QUIRK
A501: COBURG | C501: INGRAM 6 | F501: BARCLAY 2 | I501: AIELLO 2 | K501: KAAKOUR 2 | N501: MOORFIELD 2 | Q501: HALE | R501: ZIROA | T501: O'MEARA
A503: SPRINGVALE | O503: 9 | P503: 17 | Q503: 71 | S503: Venue: SPRINGVALE
A504: WILLIAMSTOWN | O504: 10 | P504: 10 | Q504: 70
A505: BEST PLAYERS
A506: SPRINGVALE | C506: HALPHEN | F506: KNIGHT | I506: CARROLL | L506: CLARK | O506: KOOP | R506: DYSON-HOLLAND
A507: WILLIAMSTOWN | C507: VENNER | F507: HORE | I507: GOULD | L507: LONG
A508: GOALKICKERS
A509: SPRINGVALE | C509: CLARK 2 | F509: CAPLES 2 | I509: CARIS | K509: CARROLL | M509: KNIGHT | O509: DAVIDSON | R509: HALPHEN
A510: WILLIAMSTOWN | C510: WILLIAMS 3 | F510: SMITH 2 | H510: ZAMKYL 2 | K510: RICKMAN | M510: MINETT | O510: FUENTES
A512: ROUND 10 | D512: 26TH JUNE | I512: WEATHER
D513: 1ST QTR | H513: 2ND QTR | L513: 3RD QTR | P513: FINAL | S513: Venue: WERRIBEE
A514: WERRIBEE | O514: 18 | P514: 14 | Q514: 122 | S514: UMPIRES | Y514: LADDER | AB514: ROUND | AD514: 10
A515: BOX HILL | O515: 13 | P515: 12 | Q515: 90
A516: BEST PLAYERS | W516: TEAM | X516: W | Y516: L | Z516: D | AA516: FOR | AB516: AGST | AC516: % | AD516: PTS
A517: WERRIBEE | C517: MCDONALD | F517: O'KEEFE | I517: RIENIETS | L517: ALLDAY | O517: POWER | Q517: WILLIAMS
A518: BOX HILL | C518: BANFIELD | F518: HOGAN | I518: WILKINSON | L518: NICHOL | W518: PORT MELBOURNE | X518: 9 | Y518: 1 | Z518: 0 | AA518: 1322 | AB518: 912 | AC518: =(AA518/AB518)*100 -> 144.95614035087718 | AD518: =(X518*4)+(Z518*2) -> 36
A519: GOALKICKERS | W519: WERRIBEE | X519: 8 | Y519: 2 | Z519: 0 | AA519: 1336 | AB519: 873 | AC519: =(AA519/AB519)*100 -> 153.03550973654066 | AD519: =(X519*4)+(Z519*2) -> 32
A520: WERRIBEE | C520: POWER 5 | F520: McDONALD 4 | I520: O'KEEFE 3 | K520: AZIZ 2 | M520: SWAN | O520: ZAMKYL | Q520: SMITH | S520: MOLONEY | W520: FRANKSTON | X520: 7 | Y520: 3 | Z520: 0 | AA520: 1337 | AB520: 889 | AC520: =(AA520/AB520)*100 -> 150.39370078740157 | AD520: =(X520*4)+(Z520*2) -> 28
A521: BOX HILL | C521: HOGAN 5 | F521: BADROCK 2 | I521: ROWE 2 | K521: BOURKE | M521: COHEN | O521: DALRYMPLE | R521: MA ERWIN | W521: PRAHRAN | X521: 6 | Y521: 4 | Z521: 0 | AA521: 1212 | AB521: 963 | AC521: =(AA521/AB521)*100 -> 125.85669781931463 | AD521: =(X521*4)+(Z521*2) -> 24
D522: 27TH JUNE | I522: WEATHER | W522: BOX HILL | X522: 6 | Y522: 4 | Z522: 0 | AA522: 1101 | AB522: 1048 | AC522: =(AA522/AB522)*100 -> 105.05725190839695 | AD522: =(X522*4)+(Z522*2) -> 24
A523: PORT MELBOURNE | O523: 20 | P523: 12 | Q523: 132 | S523: Venue: PRESTON
A524: PRESTON | O524: 9 | P524: 12 | Q524: 66 | W524: PRESTON | X524: 5 | Y524: 5 | Z524: 0 | AA524: 951 | AB524: 1009 | AC524: =(AA524/AB524)*100 -> 94.251734390485638 | AD524: =(X524*4)+(Z524*2) -> 20
A525: BEST PLAYERS | W525: SANDRINGHAM | X525: 4 | Y525: 6 | Z525: 0 | AA525: 1037 | AB525: 998 | AC525: =(AA525/AB525)*100 -> 103.90781563126252 | AD525: =(X525*4)+(Z525*2) -> 16
A526: PORT MELBOURNE | C526: LAFFY | F526: HARKINS | I526: EDWARDS | L526: KEIGHRAN | O526: KING | Q526: CLOHESY | W526: DANDEN0NG | X526: 4 | Y526: 6 | Z526: 0 | AA526: 1069 | AB526: 1196 | AC526: =(AA526/AB526)*100 -> 89.381270903010034 | AD526: =(X526*4)+(Z526*2) -> 16
A527: PRESTON | C527: KING | F527: DOBELL | I527: HUCKER | L527: HOLT | O527: REEVES | W527: SPRINGVALE | X527: 4 | Y527: 6 | Z527: 0 | AA527: 899 | AB527: 1056 | AC527: =(AA527/AB527)*100 -> 85.132575757575751 | AD527: =(X527*4)+(Z527*2) -> 16
A528: GOALKICKERS | P528: KING | W528: WILLIAMSTOWN | X528: 4 | Y528: 6 | Z528: 0 | AA528: 857 | AB528: 1033 | AC528: =(AA528/AB528)*100 -> 82.962245885769605 | AD528: =(X528*4)+(Z528*2) -> 16
A529: PORT MELBOURNE | C529: LOVE 4 | E529: HARKINS 3 | H529: JAMES 3 | J529: STYNES 3 | L529: BAILEY 2 | N529: CHRIMES 2 | Q529: BOWDEN | S529: SEXTON | W529: OAKLEIGH | X529: 3 | Y529: 7 | Z529: 0 | AA529: 1013 | AB529: 1396 | AC529: =(AA529/AB529)*100 -> 72.564469914040117 | AD529: =(X529*4)+(Z529*2) -> 12
A530: PRESTON | C530: KING 4 | E530: REEVES 2 | H530: SHAW 2 | J530: LEYDIN | W530: COBURG | X530: 0 | Y530: 10 | Z530: 0 | AA530: 785 | AB530: 1546 | AC530: =(AA530/AB530)*100 -> 50.776196636481238 | AD530: =(X530*4)+(Z530*2) -> 0
A532: FRANKSTON | O532: 29 | P532: 20 | Q532: 194 | S532: Venue: FRANKSTON
A533: OAKLEIGH | O533: 10 | P533: 10 | Q533: 70
A534: BEST PLAYERS
A535: FRANKSTON | C535: S HAMILL | F535: VERBEEK | I535: BOONKAMP | L535: McCARTHY | O535: GAHAN | Q535: MORWOOD
A536: OAKLEIGH | C536: R STUBBS | F536: YOUNG | I536: BURTON | L536: BONNEY
A537: GOALKICKERS | R537: D RYAN | U537: HEENAN
A538: FRANKSTON | C538: MORWOOD 4 | F538: McCARTHY 4 | I538: GAHAN 4 | K538: KEAYS 4 | M538: GARDNER 3 | P538: S HAMILL 2 | S538: M RYAN 2 | V538: GOOSEY | X538: DAVIES | Z538: BROWN | AB538: WILLIAMS
A539: OAKLEIGH | C539: MORELAND 3 | F539: YOUNG 2 | I539: SHEPHARD | L539: BONNEY | N539: BRIGGS | P539: LEARMOUTH | S539: GARBUIO
A541: PRAHRAN | O541: 16 | P541: 12 | Q541: 108 | S541: Venue: TOORAK PARK
A542: DANDENONG | O542: 11 | P542: 10 | Q542: 76
A543: BEST PLAYERS
A544: PRAHRAN | C544: LENNOX | F544: STANLEY | I544: WILSON | L544: DILENA | O544: ORIGLASSO | R544: TUDDENHAM
A545: DANDENONG | C545: MILLIGAN | F545: PETER-BUDGE | I545: BURNELL | L545: PRETTO | O545: MILLANE | R545: SALIBA
A546: GOALKICKERS
A547: PRAHRAN | C547: DILENA 6 | F547: PARSONS 3 | I547: WILSON 2 | K547: STANLEY 2 | N547: KEIPERT 2 | Q547: WINTON
A548: DANDENONG | C548: PRETTO 5 | F548: BURNELL 2 | I548: MILLANE 2 | L548: GOTCH | N548: SALIBA
A550: SANDRINGHAM | O550: 20 | P550: 14 | Q550: 134 | S550: Venue: BEACH ROAD
A551: SPRINGVALE | O551: 12 | P551: 5 | Q551: 77 | S551: NORDEN :ELLIS
A552: BEST PLAYERS
A553: SANDRINGHAM | C553: CLARKSON | F553: KELLOWAY | I553: ALLEN | L553: M WILLIAMS | O553: MACGEORGE | R553: MITCHELSON
A554: SPRINGVALE | C554: CLARKSON | F554: HALPHEN | I554: DYSON-HOLLAND | L554: SUTHERLAND | O554: DAVISON | R554: KOOP
A555: GOALKICKERS
A556: SANDRINGHAM | C556: MOREY 4 | E556: M WILLIAMS 4 | H556: FORD 3 | J556: CLARKSON 2 | M556: A WILLIAMS 2 | P556: GORIZIDIS 2 | R556: CROUGH | U556: J RUGOLO | X556: MACGEORGE
A557: SPRINGVALE | C557: CAPLES 2 | F557: JEFFS 2 | H557: DAVISON 2 | K557: PHILLIPS | M557: SUTHERLAND | P557: LYNCH | R557: KNIGHT | U557: CLARK | W557: EVANS
A559: WILLIAMSTOWN | O559: 17 | P559: 19 | Q559: 121 | S559: Venue: WILLIAMSTOWN
A560: COBURG | O560: 12 | P560: 11 | Q560: 83
A561: BEST PLAYERS
A562: WILLIAMSTOWN | C562: GOULD | F562: PASTORE | I562: LLOYD | L562: HOWLETT | O562: SWAN | Q562: LONG
A563: COBURG | C563: SEMAAN | F563: SALVADORE | I563: KAAKOUR | L563: O'MEARA | O563: BAKER
A564: GOALKICKERS
A565: WILLIAMSTOWN | C565: PASTORE 9 | F565: GHAZI 2 | H565: MINETT | J565: SWAN | L565: ZAMKYL | N565: SMITH | P565: MOLONEY | R565: GOULD
A566: COBURG | C566: O'MEARA 3 | F566: ALESSIO 3 | I566: INGRAM 2 | K566: KAAKOUR 2 | N566: SEMAAN | P566: SALVADORE
A568: ROUND 11 | D568: 3RD JULY | I568: WEATHER
D569: 1ST QTR | H569: 2ND QTR | L569: 3RD QTR | P569: FINAL | S569: Venue: OAKLEIGH
A570: WILLIAMSTOWN | O570: 15 | P570: 12 | Q570: 102 | S570: UMPIRES | Y570: LADDER | AB570: ROUND | AD570: 11
A571: OAKLEIGH | O571: 7 | P571: 16 | Q571: 58
A572: BEST PLAYERS | W572: TEAM | X572: W | Y572: L | Z572: D | AA572: FOR | AB572: AGST | AC572: % | AD572: PTS
A573: WILLIAMSTOWN | C573: ZAMKYL | F573: MINETT | I573: LLOYD | L573: SHANKS | O573: O'CONNOR | R573: GHAZI
A574: OAKLEIGH | C574: BONNEY | F574: BICKNELL | I574: WILLIAMS | L574: QUIRK | O574: LEARMOUTH | W574: PORT MELBOURNE | X574: 10 | Y574: 1 | Z574: 0 | AA574: 1405 | AB574: 977 | AC574: =(AA574/AB574)*100 -> 143.80757420675539 | AD574: =(X574*4)+(Z574*2) -> 40
A575: GOALKICKERS | P575: JOHANSEN | W575: WERRIBEE | X575: 9 | Y575: 2 | Z575: 0 | AA575: 1493 | AB575: 966 | AC575: =(AA575/AB575)*100 -> 154.55486542443063 | AD575: =(X575*4)+(Z575*2) -> 36
A576: WILLIAMSTOWN | C576: PASTORE 3 | F576: McTAGGART 3 | I576: SWAN 2 | K576: ZAMKYL 2 | M576: O'CONNOR | O576: GHAZI | Q576: GOULD | S576: SHANKS | W576: FRANKSTON | X576: 7 | Y576: 4 | Z576: 0 | AA576: 1402 | AB576: 972 | AC576: =(AA576/AB576)*100 -> 144.23868312757202 | AD576: =(X576*4)+(Z576*2) -> 28
A577: OAKLEIGH | C577: BONNEY 2 | F577: D STUBBS 2 | I577: TODD | K577: QUIRK | M577: OWEN | W577: PRAHRAN | X577: 7 | Y577: 4 | Z577: 0 | AA577: 1365 | AB577: 1056 | AC577: =(AA577/AB577)*100 -> 129.26136363636365 | AD577: =(X577*4)+(Z577*2) -> 28
D578: 4TH JULY | I578: WEATHER | W578: BOX HILL | X578: 7 | Y578: 4 | Z578: 0 | AA578: 1211 | AB578: 1155 | AC578: =(AA578/AB578)*100 -> 104.84848484848486 | AD578: =(X578*4)+(Z578*2) -> 28
A579: PORT MELBOURNE | O579: 11 | P579: 17 | Q579: 83 | S579: Venue: PORT MELBOURNE
A580: FRANKSTON | O580: 8 | P580: 17 | Q580: 65 | W580: SANDRINGHAM | X580: 5 | Y580: 6 | Z580: 0 | AA580: 1232 | AB580: 1051 | AC580: =(AA580/AB580)*100 -> 117.22169362511895 | AD580: =(X580*4)+(Z580*2) -> 20
A581: BEST PLAYERS | W581: PRESTON | X581: 5 | Y581: 6 | Z581: 0 | AA581: 1058 | AB581: 1119 | AC581: =(AA581/AB581)*100 -> 94.548704200178733 | AD581: =(X581*4)+(Z581*2) -> 20
A582: PORT MELBOURNE | C582: CLOHESY | F582: CAMERON | I582: KEIGHRAN | L582: DONALD | O582: CHRIMES | R582: EDWARDS | W582: WILLIAMSTOWN | X582: 5 | Y582: 6 | Z582: 0 | AA582: 959 | AB582: 1091 | AC582: =(AA582/AB582)*100 -> 87.901008249312568 | AD582: =(X582*4)+(Z582*2) -> 20
A583: FRANKSTON | C583: VERBEEK | F583: BOONKAMP | I583: RYAN | L583: VANDERMEER | O583: CORMACK | R583: McCARTHY | W583: DANDEN0NG | X583: 4 | Y583: 7 | Z583: 0 | AA583: 1162 | AB583: 1353 | AC583: =(AA583/AB583)*100 -> 85.883222468588329 | AD583: =(X583*4)+(Z583*2) -> 16
A584: GOALKICKERS | W584: SPRINGVALE | X584: 4 | Y584: 7 | Z584: 0 | AA584: 992 | AB584: 1209 | AC584: =(AA584/AB584)*100 -> 82.051282051282044 | AD584: =(X584*4)+(Z584*2) -> 16
A585: PORT MELBOURNE | C585: JAMES 3 | F585: LOVE 2 | H585: CHRIMES | J585: SEXTON | L585: LAFFY | N585: MUENCH | P585: CLOHESY | R585: HARKINS | W585: OAKLEIGH | X585: 3 | Y585: 8 | Z585: 0 | AA585: 1071 | AB585: 1498 | AC585: =(AA585/AB585)*100 -> 71.495327102803742 | AD585: =(X585*4)+(Z585*2) -> 12
A586: FRANKSTON | C586: MORWOOD 2 | F586: MCCARTHY 2 | I586: GARDNER | K586: CORMACK | M586: BROWN | O586: CASSETT | W586: COBURG | X586: 0 | Y586: 11 | Z586: 0 | AA586: 838 | AB586: 1741 | AC586: =(AA586/AB586)*100 -> 48.133256748994832 | AD586: =(X586*4)+(Z586*2) -> 0
A588: WERRIBEE | O588: 24 | P588: 13 | Q588: 157 | S588: Venue: DANDENONG
A589: DANDENONG | O589: 14 | P589: 9 | Q589: 93
A590: BEST PLAYERS
A591: WERRIBEE | C591: MCDONALD | F591: RAEBURN | I591: BUTTON | L591: WALSH | O591: MURRAY | R591: McMASTER
A592: DANDENONG | C592: KENNEDY | F592: MILLANE | I592: HALL | L592: MARSHALL | O592: BURNELL | R592: DOCKERY
A593: GOALKICKERS
A594: WERRIBEE | C594: McDONALD 9 | F594: AZIZ 4 | H594: REYNOLDSON 2 | K594: O'KEEFE 2 | M594: WILLIAMS 2 | P594: MCMASTER | R594: SAMMUTT | U594: CULLEN | W594: RIENIETS | X594: ALLDAY
A595: DANDENONG | C595: MILLANE 4 | F595: GOTCH 2 | H595: PETER-BUDGE 2 | K595: PRETTO 2 | M595: KENNEDY | O595: GILDER | Q595: MEAD | S595: SRUK
A597: BOX HILL | O597: 17 | P597: 8 | Q597: 110 | S597: Venue: PRESTON
A598: PRESTON | O598: 16 | P598: 11 | Q598: 107
A599: BEST PLAYERS
A600: BOX HILL | C600: SWAN | F600: BANFIELD | I600: ZARAFA | L600: KELLY | O600: QUINN | Q600: WILKINSON
A601: PRESTON | C601: MUNRIVANA | F601: HUCKER | I601: KERRY | L601: DOBELL | O601: SMITH | Q601: KOUTOUFIDES
A602: GOALKICKERS
A603: BOX HILL | C603: WILKINSON 4 | F603: ZARAFA 4 | I603: MI ERWIN 3 | L603: JAMES 3 | N603: MA ERWIN | Q603: EVANS | S603: HEANEY | V603: PENNY
A604: PRESTON | C604: KOUTOUFIDES 4 | F604: MUNRIVANA 3 | I604: SHAW 3 | K604: KING 2 | M604: LUMICISI | O604: JOHNS | Q604: HOTTON | S604: LEYDIN
A606: SANDRINGHAM | O606: 29 | P606: 21 | Q606: 195 | S606: Venue: BEACH ROAD
A607: COBURG | O607: 7 | P607: 11 | Q607: 53 | S607: CARLAND :AGNEW
A608: BEST PLAYERS
A609: SANDRINGHAM | C609: A WILLIAMS | F609: CLARKSON | I609: BAILEY | L609: KELLOWAY | O609: MITCHELSON | R609: MOREY
A610: COBURG | C610: SALVADORE | F610: McWATTERS | I610: DAVID | L610: LISTON | O610: DADILIARIS
A611: GOALKICKERS | U611: MACKENZIE
A612: SANDRINGHAM | C612: MOREY 6 | E612: CLARKSON 5 | H612: GOROZIDIS 4 | K612: F RUGOLO 3 | M612: A WILLIAMS 2 | P612: M WILLIAMS 2 | S612: BAILEY 2 | V612: MACGEORGE 2 | X612: MITCHELSON | AB612: KELLOWAY
A613: COBURG | C613: McWATTERS 4 | F613: INGRAM | I613: DORIAN | K613: LISTON
A615: PRAHRAN | O615: 22 | P615: 21 | Q615: 153 | S615: Venue: SPRINGVALE
A616: SPRINGVALE | O616: 13 | P616: 15 | Q616: 93
A617: BEST PLAYERS
A618: PRAHRAN | C618: TREWELLA | F618: PARSONS | I618: DILENA | L618: LENNOX | O618: CHAPPLE | R618: BAKER
A619: SPRINGVALE | C619: HALPHEN | F619: KOOP | I619: DYSON-HOLLAND | L619: LYNCH | O619: CARROLL
A620: GOALKICKERS
A621: PRAHRAN | C621: PARSONS 7 | F621: DILENA 5 | H621: KEIPERT 4 | J621: MOLONEY 2 | M621: CHAPPLE 2 | O621: WILSON | Q621: TREWELLA
A622: SPRINGVALE | C622: DYSON-HOLLAND 4 | G622: GOONAWARDENE 3 | K622: O'DONNELL 2 | N622: SUTHERLAND | Q622: KNIGHT | S622: IRVING | U622: HALPHEN
A624: ROUND 12 | D624: 10TH JULY | I624: WEATHER
D625: 1ST QTR | H625: 2ND QTR | L625: 3RD QTR | P625: FINAL | S625: Venue: SPRINGVALE
A626: SPRINGVALE | O626: 12 | P626: 14 | Q626: 86 | S626: UMPIRES | Y626: LADDER | AB626: ROUND | AD626: 12
A627: WERRIBEE | O627: 12 | P627: 5 | Q627: 77
A628: BEST PLAYERS | W628: TEAM | X628: W | Y628: L | Z628: D | AA628: FOR | AB628: AGST | AC628: % | AD628: PTS
A629: SPRINGVALE | C629: CLARK | F629: KOOP | I629: KNIGHT | L629: LYNCH | O629: DYSON-HOLLAND | R629: O'DONNELL
A630: WERRIBEE | C630: WALSH | F630: RAEBURN | I630: WILSON | W630: PORT MELBOURNE | X630: 11 | Y630: 1 | Z630: 0 | AA630: 1545 | AB630: 1036 | AC630: =(AA630/AB630)*100 -> 149.13127413127413 | AD630: =(X630*4)+(Z630*2) -> 44
A631: GOALKICKERS | W631: WERRIBEE | X631: 9 | Y631: 3 | Z631: 0 | AA631: 1570 | AB631: 1052 | AC631: =(AA631/AB631)*100 -> 149.23954372623572 | AD631: =(X631*4)+(Z631*2) -> 36
A632: SPRINGVALE | C632: GOONAWARDENE 4 | G632: DYSON-HOLLAND 4 | K632: CARROLL 2 | N632: JEFFS | P632: SCHULTZ | W632: FRANKSTON | X632: 8 | Y632: 4 | Z632: 0 | AA632: 1512 | AB632: 1067 | AC632: =(AA632/AB632)*100 -> 141.70571696344891 | AD632: =(X632*4)+(Z632*2) -> 32
A633: WERRIBEE | C633: WALSH 6 | F633: McDONALD 2 | I633: RIENIETS 2 | L633: O'KEEFE | N633: WILSON | W633: PRAHRAN | X633: 8 | Y633: 4 | Z633: 0 | AA633: 1519 | AB633: 1132 | AC633: =(AA633/AB633)*100 -> 134.18727915194347 | AD633: =(X633*4)+(Z633*2) -> 32
D634: 11TH JULY | I634: WEATHER | S634: Venue: WILLIAMSTOWN | W634: BOX HILL | X634: 7 | Y634: 5 | Z634: 0 | AA634: 1306 | AB634: 1265 | AC634: =(AA634/AB634)*100 -> 103.24110671936759 | AD634: =(X634*4)+(Z634*2) -> 28
A635: WILLIAMSTOWN | O635: 13 | P635: 10 | Q635: 88 | S635: CAULFIELD
A636: SANDRINGHAM | O636: 11 | P636: 14 | Q636: 80 | S636: VINEY | W636: WILLIAMSTOWN | X636: 6 | Y636: 6 | Z636: 0 | AA636: 1047 | AB636: 1171 | AC636: =(AA636/AB636)*100 -> 89.410760034158841 | AD636: =(X636*4)+(Z636*2) -> 24
A637: BEST PLAYERS | W637: SANDRINGHAM | X637: 5 | Y637: 7 | Z637: 0 | AA637: 1312 | AB637: 1139 | AC637: =(AA637/AB637)*100 -> 115.18876207199298 | AD637: =(X637*4)+(Z637*2) -> 20
A638: WILLIAMSTOWN | C638: SWAN | F638: ZAMKYL | I638: GOULD | L638: McGOWAN | O638: VENNER | Q638: GHAZI | W638: DANDEN0NG | X638: 5 | Y638: 7 | Z638: 0 | AA638: 1306 | AB638: 1405 | AC638: =(AA638/AB638)*100 -> 92.953736654804274 | AD638: =(X638*4)+(Z638*2) -> 20
A639: SANDRINGHAM | C639: CZERKASKI | F639: MITCHELSON | I639: KELLOWAY | W639: PRESTON | X639: 5 | Y639: 7 | Z639: 0 | AA639: 1110 | AB639: 1263 | AC639: =(AA639/AB639)*100 -> 87.88598574821853 | AD639: =(X639*4)+(Z639*2) -> 20
A640: GOALKICKERS | W640: SPRINGVALE | X640: 5 | Y640: 7 | Z640: 0 | AA640: 1078 | AB640: 1286 | AC640: =(AA640/AB640)*100 -> 83.825816485225502 | AD640: =(X640*4)+(Z640*2) -> 20
A641: WILLIAMSTOWN | C641: PASTORE 4 | F641: GHAZI 3 | H641: ZAMKYL 2 | J641: McTAGGART | M641: SHANKS | O641: SYMONS | Q641: WILLIAMS | W641: OAKLEIGH | X641: 3 | Y641: 9 | Z641: 0 | AA641: 1130 | AB641: 1638 | AC641: =(AA641/AB641)*100 -> 68.986568986568983 | AD641: =(X641*4)+(Z641*2) -> 12
A642: SANDRINGHAM | C642: F RUGOLO 4 | F642: MOREY 3 | H642: AMIET 2 | J642: ALLEN | L642: A WILLIAMS | W642: COBURG | X642: 0 | Y642: 12 | Z642: 0 | AA642: 914 | AB642: 1895 | AC642: =(AA642/AB642)*100 -> 48.232189973614773 | AD642: =(X642*4)+(Z642*2) -> 0
A644: PRAHRAN | O644: 22 | P644: 22 | Q644: 154 | S644: Venue: COBURG
A645: COBURG | O645: 11 | P645: 10 | Q645: 76
A646: BEST PLAYERS
A647: PRAHRAN | C647: TREWELLA | F647: MRAKOV | I647: SINNI | L647: STANLEY | O647: LENNOX
A648: COBURG | C648: DAVID | F648: LISTON | I648: DORIAN | L648: GORMAN
A649: GOALKICKERS
A650: PRAHRAN | C650: MRAKOV 5 | E650: KEIPERT 4 | G650: POVEY 2 | I650: DILENA 2 | K650: PARSONS 2 | M650: STANLEY 2 | P650: BAKER 2 | R650: WILSON | U650: TREWELLA | X650: AHMAD
A651: COBURG | C651: AIELLO 3 | F651: INGRAM 3 | I651: SALVADORE 2 | L651: ZANON | N651: ALESSIO | P651: ZIROS
A653: DANDENONG | O653: 22 | P653: 12 | Q653: 144 | S653: Venue: DANDENONG
A654: PRESTON | O654: 7 | P654: 10 | Q654: 52
A655: BEST PLAYERS
A656: DANDENONG | C656: MILLIGAN | F656: GOTCH | I656: HALL | L656: LACKO | O656: MARSHALL | R656: KNIGHT
A657: PRESTON | C657: LUMICISI | F657: HUCKER | I657: KERR | L657: WALKER | O657: REEVES | R657: KOUOUFIDES
A658: GOALKICKERS
A659: DANDENONG | C659: PRETTO 6 | F659: SRUK 3 | H659: BURNELL 3 | J659: FOSTER 2 | L659: MILLANE 2 | N659: GOTCH 2 | P659: MYNOTT 2 | R659: PETER-BUDGE | V659: GILDER
A660: PRESTON | C660: SHAW 3 | F660: REEVES | H660: MUNRIVANA | K660: MAIORANA | N660: HOLT
A662: PORT MELBOURNE | O662: 20 | P662: 20 | Q662: 140 | S662: Venue: OAKLEIGH
A663: OAKLEIGH | O663: 8 | P663: 11 | Q663: 59
A664: BEST PLAYERS
A665: PORT MELBOURNE | C665: CLOHESY | F665: KING | I665: HARKINS | L665: BAILEY | O665: LOVE | Q665: CHRIMES
A666: OAKLEIGH | C666: JORDAN | F666: QUIRK | I666: BURTON | L666: HAZELL | O666: BONNEY | Q666: YOUNG
A667: GOALKICKERS
A668: PORT MELBOURNE | C668: CHRIMES 5 | F668: LOVE 4 | H668: S BOWDEN 2 | K668: JAMES 2 | M668: BAILEY 2 | O668: STYNES 2 | Q668: R BOWDEN | T668: MUENCH | W668: KING
A669: OAKLEIGH | C669: HAZELL 2 | F669: MORELAND 2 | I669: SHEPHARD | K669: BRIGGS | M669: WILLIAMS | O669: JAMES
A671: FRANKSTON | O671: 16 | P671: 14 | Q671: 110 | S671: Venue: BOX HILL
A672: BOX HILL | O672: 14 | P672: 11 | Q672: 95
A673: BEST PLAYERS
A674: FRANKSTON | C674: McCARTHY | F674: VERBEEK | I674: BROWN | L674: M RYAN | O674: FOOT | Q674: VANDERMEER
A675: BOX HILL | C675: LISLE | F675: SWAN | I675: WILKINSON
A676: GOALKICKERS
A677: FRANKSTON | C677: KEAYS 4 | E677: MORWOOD 4 | H677: McCARTHY 4 | K677: M RYAN | M677: D RYAN | O677: HAMILL | Q677: LANCE
A678: BOX HILL | C678: DISNEY 3 | F678: MA ERWIN 3 | I678: PENNY 3 | K678: MI ERWIN 2 | N678: WILKINSON 2 | Q678: DALRYMPLE
A680: ROUND 13 | D680: 17TH JULY | I680: WEATHER
D681: 1ST QTR | H681: 2ND QTR | L681: 3RD QTR | P681: FINAL | S681: Venue: PORT MELBOURNE
A682: PORT MELBOURNE | O682: 22 | P682: 16 | Q682: 148 | S682: UMPIRES | Y682: LADDER | AB682: ROUND | AD682: 13
A683: BOX HILL | O683: 15 | P683: 4 | Q683: 94
A684: BEST PLAYERS | W684: TEAM | X684: W | Y684: L | Z684: D | AA684: FOR | AB684: AGST | AC684: % | AD684: PTS
A685: PORT MELBOURNE | C685: R BOWDEN | F685: LOVE | I685: STYNES | L685: MUENCH | N685: LAFFY | Q685: EDWARDS
A686: BOX HILL | C686: MI ERWIN | F686: COHEN | I686: ROWE | W686: PORT MELBOURNE | X686: 12 | Y686: 1 | Z686: 0 | AA686: 1693 | AB686: 1130 | AC686: =(AA686/AB686)*100 -> 149.82300884955754 | AD686: =(X686*4)+(Z686*2) -> 48
A687: GOALKICKERS | W687: WERRIBEE | X687: 10 | Y687: 3 | Z687: 0 | AA687: 1703 | AB687: 1150 | AC687: =(AA687/AB687)*100 -> 148.08695652173913 | AD687: =(X687*4)+(Z687*2) -> 40
A688: PORT MELBOURNE | C688: LOVE 9 | F688: STYNES 5 | I688: R BOWDEN 3 | L688: JAMES | N688: BAILEY | P688: SEXTON | R688: BOARD | T688: TOUT | W688: FRANKSTON | X688: 9 | Y688: 4 | Z688: 0 | AA688: 1623 | AB688: 1165 | AC688: =(AA688/AB688)*100 -> 139.31330472103005 | AD688: =(X688*4)+(Z688*2) -> 36
A689: BOX HILL | C689: WILKINSON 5 | F689: DISNEY 3 | H689: BADROCK | J689: BANFIELD | L689: DALRYMPLE | O689: HOGAN | Q689: PENNY | S689: QUINN | W689: PRAHRAN | X689: 9 | Y689: 4 | Z689: 0 | AA689: 1643 | AB689: 1202 | AC689: =(AA689/AB689)*100 -> 136.68885191347752 | AD689: =(X689*4)+(Z689*2) -> 36
D690: 18TH JULY | I690: WEATHER | O690: ZARAFA | W690: BOX HILL | X690: 7 | Y690: 6 | Z690: 0 | AA690: 1400 | AB690: 1413 | AC690: =(AA690/AB690)*100 -> 99.079971691436668 | AD690: =(X690*4)+(Z690*2) -> 28
A691: FRANKSTON | O691: 17 | P691: 9 | Q691: 111 | S691: Venue: FRANKSTON
A692: DANDENONG | O692: 14 | P692: 14 | Q692: 98 | W692: SANDRINGHAM | X692: 6 | Y692: 7 | Z692: 0 | AA692: 1535 | AB692: 1230 | AC692: =(AA692/AB692)*100 -> 124.79674796747969 | AD692: =(X692*4)+(Z692*2) -> 24
A693: BEST PLAYERS | W693: WILLIAMSTOWN | X693: 6 | Y693: 7 | Z693: 0 | AA693: 1117 | AB693: 1295 | AC693: =(AA693/AB693)*100 -> 86.254826254826256 | AD693: =(X693*4)+(Z693*2) -> 24
A694: FRANKSTON | C694: MOORE | F694: S HAMILL | I694: D RYAN | L694: VANDERMEER | O694: WILLIAMS | R694: VERBEEK | W694: SPRINGVALE | X694: 6 | Y694: 7 | Z694: 0 | AA694: 1195 | AB694: 1392 | AC694: =(AA694/AB694)*100 -> 85.847701149425291 | AD694: =(X694*4)+(Z694*2) -> 24
A695: DANDENONG | C695: MARSHALL | F695: HALL | I695: PETER-BUDGE | L695: DOCKERY | O695: MILLANE | R695: SRUK | W695: DANDEN0NG | X695: 5 | Y695: 8 | Z695: 0 | AA695: 1404 | AB695: 1516 | AC695: =(AA695/AB695)*100 -> 92.612137203166228 | AD695: =(X695*4)+(Z695*2) -> 20
A696: GOALKICKERS | W696: PRESTON | X696: 5 | Y696: 8 | Z696: 0 | AA696: 1216 | AB696: 1380 | AC696: =(AA696/AB696)*100 -> 88.115942028985501 | AD696: =(X696*4)+(Z696*2) -> 20
A697: FRANKSTON | C697: WILLIAMS 6 | F697: MORWOOD 4 | I697: KEAYS 2 | K697: CASSETT 2 | N697: S HAMILL | P697: GAHAN | R697: M RYAN | W697: OAKLEIGH | X697: 3 | Y697: 10 | Z697: 0 | AA697: 1221 | AB697: 1861 | AC697: =(AA697/AB697)*100 -> 65.60988715744223 | AD697: =(X697*4)+(Z697*2) -> 12
A698: DANDENONG | C698: PRETTO 4 | E698: MILLANE 2 | G698: SRUK 2 | I698: GILDER | K698: SALIBA | M698: GOTCH | O698: HUNTER | Q698: MYNOTT | W698: COBURG | X698: 0 | Y698: 13 | Z698: 0 | AA698: 1012 | AB698: 2028 | AC698: =(AA698/AB698)*100 -> 49.901380670611438 | AD698: =(X698*4)+(Z698*2) -> 0
N699: PETER-BUDGE
A700: PRAHRAN | O700: 17 | P700: 22 | Q700: 124 | S700: Venue: TOORAK PARK
A701: WILLIAMSTOWN | O701: 10 | P701: 10 | Q701: 70
A702: BEST PLAYERS
A703: PRAHRAN | C703: TREWELLA | F703: WINTON | I703: MOLONEY | L703: LENNOX | O703: CHAPPLE | R703: LUCAS
A704: WILLIAMSTOWN | C704: MINETT | F704: LLOYD | I704: SYMONS
A705: GOALKICKERS
A706: PRAHRAN | C706: MRAKOV 5 | F706: PARSONS 3 | I706: KEIPERT 3 | K706: TREWELLA 2 | N706: DILENA | P706: MOLONEY | R706: SINNI | T706: CHAPPLE
A707: WILLIAMSTOWN | C707: PASTORE 3 | F707: GHAZI 2 | H707: BLOOM | J707: SYMONS | L707: SHANKS | N707: O'CONNOR | Q707: ZAMKYL
A709: SANDRINGHAM | O709: 33 | P709: 25 | Q709: 223 | S709: Venue: BEACH ROAD
A710: OAKLEIGH | O710: 14 | P710: 7 | Q710: 91 | S710: RUSSO :LOVE
A711: BEST PLAYERS
A712: SANDRINGHAM | C712: BAILEY | F712: FORD | I712: CZERKASKI | L712: LAMBERT | O712: GARRETT | R712: KELLOWAY
A713: OAKLEIGH | C713: QUINN | F713: BURTON | I713: BRIGGS | L713: JORDAN
A714: GOALKICKERS | S714: MITCHELSON 2
A715: SANDRINGHAM | C715: MOREY 5 | E715: BAILEY 4 | G715: AMIET 3 | I715: FORD 3 | K715: GARRETT 3 | M715: CLARKSON 3 | P715: CROUGH 2 | R715: FOLEY 2 | U715: KELLOWAY 2 | X715: F RUGOLO 2 | AB715: J RUGOLO 2
A716: OAKLEIGH | C716: JAMES 3 | E716: SHEPHARD 2 | H716: LEARMONTH 2 | K716: NEWMAN 2 | M716: BONNEY | O716: MORELAND | Q716: JORDAN | S716: SMITH | U716: WILLIAMS
A718: WERRIBEE | O718: 19 | P718: 19 | Q718: 133 | S718: Venue: WERRIBEE
A719: COBURG | O719: 14 | P719: 14 | Q719: 98
A720: BEST PLAYERS
A721: WERRIBEE | C721: RAEBURN | F721: McMASTER | I721: WALSH | L721: WILLIAMS | O721: WILSON | R721: HARRIS
A722: COBURG | C722: INGRAM | F722: ALESSIO | I722: GORMAN | L722: DAVID | O722: GRECH
A723: GOALKICKERS
A724: WERRIBEE | C724: HARRIS 6 | F724: POWER 3 | H724: LAMONT 3 | J724: McMASTER 2 | M724: WRIGHT | O724: RAEBURN | Q724: O'KEEFE | S724: WALSH | U724: RIENIETS
A725: COBURG | C725: ZIROS 4 | F725: ALESSIO 4 | I725: MOORFIELD 2 | L725: McWATTERS | O725: TARANTO | Q725: INGRAM | S725: SALVADORE
A727: SPRINGVALE | O727: 16 | P727: 21 | Q727: 117 | S727: Venue: PRESTON
A728: PRESTON | O728: 16 | P728: 10 | Q728: 106
A729: BEST PLAYERS
A730: SPRINGVALE | C730: PEACOCK | F730: SUTHERLAND | I730: PHILLIPS | L730: KNIGHT | O730: HALPHEN | R730: KOOP
A731: PRESTON | C731: HUCKER | F731: SHAW | I731: KING | L731: LUMICISI | O731: HOTTEN | R731: REEVES
A732: GOALKICKERS
A733: SPRINGVALE | C733: GOONAWARDENE 3 | G733: CARIS 3 | I733: PHILLIPS 2 | K733: SCURRAH | M733: CARROLL | O733: FOGARTY | Q733: DYSON-HOLLAND | U733: KOOP | W733: HALPHEN | X733: JEFFS | Z733: SCHULTZ
A734: PRESTON | C734: SHAW 7 | F734: LUMICISI 3 | I734: KING 2 | K734: GRAZIANO | M734: MUNRIVANA | P734: HENRY | R734: KOUTOUFIDES
A736: ROUND 14 | D736: 24TH JULY | I736: WEATHER
D737: 1ST QTR | H737: 2ND QTR | L737: 3RD QTR | P737: FINAL | S737: Venue: DANDENONG
A738: PORT MELBOURNE | O738: 24 | P738: 10 | Q738: 154 | S738: UMPIRES | Y738: LADDER | AB738: ROUND | AD738: 14
A739: DANDENONG | O739: 12 | P739: 13 | Q739: 85
A740: BEST PLAYERS | W740: TEAM | X740: W | Y740: L | Z740: D | AA740: FOR | AB740: AGST | AC740: % | AD740: PTS
A741: PORT MELBOURNE | C741: S BOWDEN | F741: HICKS | I741: KING | L741: MUENCH | O741: TOUT | R741: JAMES
A742: DANDENONG | C742: PETER-BUDGE | F742: HALL | I742: BURNELL | L742: GOTCH | O742: HUNTER | R742: KENNEDY | W742: PORT MELBOURNE | X742: 13 | Y742: 1 | Z742: 0 | AA742: 1847 | AB742: 1215 | AC742: =(AA742/AB742)*100 -> 152.01646090534979 | AD742: =(X742*4)+(Z742*2) -> 52
A743: GOALKICKERS | W743: WERRIBEE | X743: 10 | Y743: 4 | Z743: 0 | AA743: 1803 | AB743: 1252 | AC743: =(AA743/AB743)*100 -> 144.00958466453676 | AD743: =(X743*4)+(Z743*2) -> 40
A744: PORT MELBOURNE | C744: HICKS 6 | E744: STYNES 4 | G744: KING 3 | I744: SEXTON 3 | K744: BAILEY 2 | M744: FOX 2 | O744: JAMES 2 | Q744: HARLAND | S744: S BOWDEN | W744: FRANKSTON | X744: 10 | Y744: 4 | Z744: 0 | AA744: 1717 | AB744: 1247 | AC744: =(AA744/AB744)*100 -> 137.69045709703286 | AD744: =(X744*4)+(Z744*2) -> 40
A745: DANDENONG | C745: PETER-BUDGE 4 | F745: PRETTO 3 | I745: MEAD | K745: FOSTER | M745: MARSHALL | P745: TAYLOR | R745: KANNOURAKIS | W745: PRAHRAN | X745: 9 | Y745: 5 | Z745: 0 | AA745: 1723 | AB745: 1319 | AC745: =(AA745/AB745)*100 -> 130.6292645943897 | AD745: =(X745*4)+(Z745*2) -> 36
D746: 25 TH JULY | I746: WEATHER | W746: BOX HILL | X746: 8 | Y746: 6 | Z746: 0 | AA746: 1504 | AB746: 1510 | AC746: =(AA746/AB746)*100 -> 99.602649006622514 | AD746: =(X746*4)+(Z746*2) -> 32
A747: WILLIAMSTOWN | O747: 16 | P747: 6 | Q747: 102 | S747: Venue: WILLIAMSTOWN
A748: WERRIBEE | O748: 14 | P748: 16 | Q748: 100 | W748: SANDRINGHAM | X748: 7 | Y748: 7 | Z748: 0 | AA748: 1652 | AB748: 1310 | AC748: =(AA748/AB748)*100 -> 126.10687022900764 | AD748: =(X748*4)+(Z748*2) -> 28
A749: BEST PLAYERS | W749: WILLIAMSTOWN | X749: 7 | Y749: 7 | Z749: 0 | AA749: 1219 | AB749: 1395 | AC749: =(AA749/AB749)*100 -> 87.383512544802869 | AD749: =(X749*4)+(Z749*2) -> 28
A750: WILLIAMSTOWN | C750: GHAZI | F750: MINETT | I750: GOULD | L750: SMITH | O750: HOWLETT | R750: PASTORE | W750: PRESTON | X750: 6 | Y750: 8 | Z750: 0 | AA750: 1346 | AB750: 1458 | AC750: =(AA750/AB750)*100 -> 92.318244170096023 | AD750: =(X750*4)+(Z750*2) -> 24
A751: WERRIBEE | C751: WATTS | F751: RAEBURN | I751: McMASTER | L751: BUTTON | O751: WILSON | W751: SPRINGVALE | X751: 6 | Y751: 8 | Z751: 0 | AA751: 1277 | AB751: 1486 | AC751: =(AA751/AB751)*100 -> 85.93539703903096 | AD751: =(X751*4)+(Z751*2) -> 24
A752: GOALKICKERS | P752: HOFFMAN | W752: DANDEN0NG | X752: 5 | Y752: 9 | Z752: 0 | AA752: 1489 | AB752: 1670 | AC752: =(AA752/AB752)*100 -> 89.161676646706596 | AD752: =(X752*4)+(Z752*2) -> 20
A753: WILLIAMSTOWN | C753: GHAZI 6 | E753: VENNER 2 | G753: McTAGGART 2 | J753: SHANKS | L753: PASTORE | N753: PERRY | P753: SYMONS | R753: O'CONNOR | W753: OAKLEIGH | X753: 3 | Y753: 11 | Z753: 0 | AA753: 1318 | AB753: 1965 | AC753: =(AA753/AB753)*100 -> 67.073791348600508 | AD753: =(X753*4)+(Z753*2) -> 12
A754: WERRIBEE | C754: AZIZ 2 | E754: McMASTER 2 | H754: B KRAKOUER 2 | K754: LAMONT 2 | M754: HARRIS | O754: WALSH | Q754: RAEBURN | W754: COBURG | X754: 0 | Y754: 14 | Z754: 0 | AA754: 1090 | AB754: 2158 | AC754: =(AA754/AB754)*100 -> 50.509731232622798 | AD754: =(X754*4)+(Z754*2) -> 0
L755: J KRAKOUER | O755: McDONALD | R755: LESIPUTTY
A756: PRESTON | O756: 19 | P756: 16 | Q756: 130 | S756: Venue: COBURG
A757: COBURG | O757: 11 | P757: 12 | Q757: 78
A758: BEST PLAYERS
A759: PRESTON | C759: REEVES | F759: MAIORANA | I759: MUNRIVANA | L759: SHAW | O759: KERR
A760: COBURG | C760: DAVID | F760: BAKER | I760: GORMAN | L760: LISTON | O760: INGRAM
A761: GOALKICKERS
A762: PRESTON | C762: SHAW 8 | F762: MAIORANA 6 | I762: KING 4 | K762: HUCKER
A763: COBURG | C763: INGRAM 4 | F763: ALESSIO 3 | I763: GRIFFITH | K763: HUBBARD | N763: BAKER | P763: ZIROS
A765: BOX HILL | O765: 15 | P765: 14 | Q765: 104 | S765: Venue: OAKLEIGH
A766: OAKLEIGH | O766: 14 | P766: 13 | Q766: 97
A767: BEST PLAYERS
A768: BOX HILL | C768: BANFIELD | F768: COHEN | I768: JAMES | L768: KEATING | O768: BRUSNAHAN | R768: CROWLEY
A769: OAKLEIGH | C769: BONNEY | F769: JORDAN | I769: MORELAND | L769: BRIGGS | O769: R STUBBS | R769: BICKNELL
A770: GOALKICKERS
A771: BOX HILL | C771: JAMES 6 | F771: BADROCK 2 | I771: CROWLEY 2 | L771: WILKINSON 2 | O771: DALRYMPLE | R771: EVANS | U771: KELLY
A772: OAKLEIGH | C772: JAMES 3 | F772: SHEPHARD 2 | I772: D STUBBS 2 | L772: YOUNG 2 | N772: BICKNELL | Q772: CLARK | S772: DI NATALE | V772: QUIRK | X772: DOOLAN
A774: SANDRINGHAM | O774: 17 | P774: 15 | Q774: 117 | S774: Venue: BEACH ROAD
A775: PRAHRAN | O775: 11 | P775: 14 | Q775: 80 | S775: NASH :McLAREN
A776: BEST PLAYERS
A777: SANDRINGHAM | C777: CLARKSON | F777: CZERKASKI | I777: MITCHELSON | L777: LAMBERT | O777: MURRAY | R777: MACKENZIE
A778: PRAHRAN | C778: WINTON | F778: LENNOX | I778: POVEY | L778: LUCAS | O778: STANLEY
A779: GOALKICKERS
A780: SANDRINGHAM | C780: MOREY 5 | F780: AMIET 4 | H780: GARRETT 3 | J780: ALLEN 2 | L780: J RUGOLO | N780: CROUGH | P780: MACKENZIE
A781: PRAHRAN | C781: KEIPERT 2 | F781: POVEY | H781: DILENA | J781: TUDDENHAM | M781: ORIGLASSO | P781: MRAKOV | R781: WINTON | U781: TREWELLA | X781: LENNOX | Z781: CHAPPLE
A783: FRANKSTON | O783: 14 | P783: 10 | Q783: 94 | S783: Venue: SPRINGVALE
A784: SPRINGVALE | O784: 10 | P784: 22 | Q784: 82
A785: BEST PLAYERS
A786: FRANKSTON | C786: HAMILL | F786: BROWN | I786: FOOT | L786: WILLIAMS | O786: GOOSEY | R786: WOOD
A787: SPRINGVALE | C787: SUTHERLAND | F787: MALONI | I787: KNIGHT | L787: MORGAN | O787: LYNCH | R787: KOOP
A788: GOALKICKERS
A789: FRANKSTON | C789: WOOD 4 | F789: RYAN 3 | H789: KEAYS 2 | J789: McCARTHY 2 | M789: GAHAN | O789: HAMILL | Q789: WILLIAMS
A790: SPRINGVALE | C790: GOONAWARDENE 2 | G790: DYSON-HOLLAND 2 | K790: KOOP 2 | M790: SMITH 2 | O790: PHILLIPS | Q790: CARIS
A792: ROUND 15 | D792: 31ST JULY | I792: WEATHER | S792: Venue: WERRIBEE
D793: 1ST QTR | H793: 2ND QTR | L793: 3RD QTR | P793: FINAL | S793: UMPIRES
A794: WERRIBEE | O794: 20 | P794: 13 | Q794: 133 | S794: RICH | Y794: LADDER | AB794: ROUND | AD794: 15
A795: SANDRINGHAM | O795: 12 | P795: 11 | Q795: 83 | S795: McKENZIE
A796: BEST PLAYERS | W796: TEAM | X796: W | Y796: L | Z796: D | AA796: FOR | AB796: AGST | AC796: % | AD796: PTS
A797: WERRIBEE | C797: RAEBURN | F797: BUTTON | I797: WATTS | L797: RIENIETS | O797: McDONALD | R797: AZIZ
A798: SANDRINGHAM | C798: MURRAY | F798: CZERKASKI | I798: KELLOWAY | L798: A MACKENZIE | O798: A WILLIAMS | W798: PORT MELBOURNE | X798: 13 | Y798: 2 | Z798: 0 | AA798: 1918 | AB798: 1346 | AC798: =(AA798/AB798)*100 -> 142.49628528974739 | AD798: =(X798*4)+(Z798*2) -> 52
A799: GOALKICKERS | P799: RAEBURN | W799: FRANKSTON | X799: 11 | Y799: 4 | Z799: 0 | AA799: 1941 | AB799: 1290 | AC799: =(AA799/AB799)*100 -> 150.46511627906978 | AD799: =(X799*4)+(Z799*2) -> 44
A800: WERRIBEE | C800: GEARY 4 | E800: KRAKOUER 4 | H800: AZIZ 4 | J800: SALTALAMACCHIA 3 | N800: McMASTER 3 | Q800: McDONALD | W800: WERRIBEE | X800: 11 | Y800: 4 | Z800: 0 | AA800: 1936 | AB800: 1335 | AC800: =(AA800/AB800)*100 -> 145.0187265917603 | AD800: =(X800*4)+(Z800*2) -> 44
A801: SANDRINGHAM | C801: AMIET 3 | E801: BAILEY 2 | G801: J RUGOLO 2 | J801: R ALLAN 2 | M801: MOREY 2 | O801: C GARRETT | W801: PRAHRAN | X801: 10 | Y801: 5 | Z801: 0 | AA801: 1916 | AB801: 1372 | AC801: =(AA801/AB801)*100 -> 139.65014577259475 | AD801: =(X801*4)+(Z801*2) -> 40
D802: 1ST AUGUST | I802: WEATHER | S802: Venue: TOORAK PARK | W802: BOX HILL | X802: 8 | Y802: 7 | Z802: 0 | AA802: 1596 | AB802: 1617 | AC802: =(AA802/AB802)*100 -> 98.701298701298697 | AD802: =(X802*4)+(Z802*2) -> 32
A803: PRAHRAN | O803: 28 | P803: 25 | Q803: 193
A804: OAKLEIGH | O804: 8 | P804: 5 | Q804: 53 | W804: SANDRINGHAM | X804: 7 | Y804: 8 | Z804: 0 | AA804: 1735 | AB804: 1443 | AC804: =(AA804/AB804)*100 -> 120.23562023562025 | AD804: =(X804*4)+(Z804*2) -> 28
A805: BEST PLAYERS | W805: PRESTON | X805: 7 | Y805: 8 | Z805: 0 | AA805: 1435 | AB805: 1519 | AC805: =(AA805/AB805)*100 -> 94.47004608294931 | AD805: =(X805*4)+(Z805*2) -> 28
A806: PRAHRAN | C806: LENNOX | F806: BAKER | I806: DILENA | L806: POVEY | O806: PARSONS | R806: CHAPPLE | W806: SPRINGVALE | X806: 7 | Y806: 8 | Z806: 0 | AA806: 1408 | AB806: 1557 | AC806: =(AA806/AB806)*100 -> 90.430314707771359 | AD806: =(X806*4)+(Z806*2) -> 28
A807: OAKLEIGH | C807: R STUBBS | F807: D CLARKE | I807: YOUNG | L807: BONNEY | W807: WILLIAMSTOWN | X807: 7 | Y807: 8 | Z807: 0 | AA807: 1280 | AB807: 1484 | AC807: =(AA807/AB807)*100 -> 86.253369272237208 | AD807: =(X807*4)+(Z807*2) -> 28
A808: GOALKICKERS | O808: LENNOX | Q808: POVEY | W808: DANDEN0NG | X808: 6 | Y808: 9 | Z808: 0 | AA808: 1596 | AB808: 1762 | AC808: =(AA808/AB808)*100 -> 90.578887627695806 | AD808: =(X808*4)+(Z808*2) -> 24
A809: PRAHRAN | C809: DILENA 7 | E809: AHMAD 6 | G809: PARSONS 4 | I809: BAKER 3 | K809: BOLZON 2 | M809: TREWELLA 2 | P809: ORIGLASSO | R809: KEIPERT | W809: OAKLEIGH | X809: 3 | Y809: 12 | Z809: 0 | AA809: 1371 | AB809: 2158 | AC809: =(AA809/AB809)*100 -> 63.531047265987027 | AD809: =(X809*4)+(Z809*2) -> 12
A810: OAKLEIGH | C810: D CLARKE 3 | F810: BONNEY | I810: D STUBBS | K810: QUIRK | M810: SMITH | O810: SWAINSTON | W810: COBURG | X810: 0 | Y810: 15 | Z810: 0 | AA810: 1133 | AB810: 2382 | AC810: =(AA810/AB810)*100 -> 47.565071368597813 | AD810: =(X810*4)+(Z810*2) -> 0
A812: FRANKSTON | O812: 35 | P812: 14 | Q812: 224 | S812: Venue: FRANKSTON
A813: COBURG | O813: 6 | P813: 7 | Q813: 43
A814: BEST PLAYERS
A815: FRANKSTON | C815: MOORE | F815: WILLIAMS | I815: BROWN | L815: KEAYS | O815: S HAMILL | R815: MORWOOD
A816: COBURG | C816: LISTON | F816: SALVADORE | I816: GORMAN | L816: ALESSIO | O816: WILSON
A817: GOALKICKERS
A818: FRANKSTON | C818: KEAYS 9 | E818: MORWOOD 5 | H818: LANCE 4 | J818: McCARTHY 3 | M818: MOORE 3 | O818: M RYAN 3 | Q818: BROWN 2 | S818: D RYAN 2 | V818: SHANNON 2 | X818: BOONKAMP | AA818: WOOD
A819: COBURG | C819: BARCLAY | F819: ALESSIO | I819: INGRAM | K819: KAAKOUR | N819: McWATTERS | Q819: McMAHON
A821: PRESTON | O821: 12 | P821: 17 | Q821: 89 | S821: Venue: PRESTON
A822: WILLIAMSTOWN | O822: 8 | P822: 13 | Q822: 61
A823: BEST PLAYERS
A824: PRESTON | C824: MUNRIVANA | F824: HOTTON | I824: KING | L824: LUMICISI | O824: DOBBS | R824: PLUNKETT
A825: WILLIAMSTOWN | C825: LONG | F825: VENNER | I825: SYMONS
A826: GOALKICKERS
A827: PRESTON | C827: SHAW 4 | F827: KING 4 | H827: HUCKER 2 | K827: DAVIDSON | N827: KOUTOUFIDES
A828: WILLIAMSTOWN | C828: BLOOM 2 | F828: ZAMKYL 2 | I828: GHAZI 2 | K828: PASTORE | N828: WILLIAMS
A830: SPRINGVALE | O830: 19 | P830: 17 | Q830: 131 | S830: Venue: PORT MELBOURNE
A831: PORT MELBOURNE | O831: 10 | P831: 11 | Q831: 71
A832: BEST PLAYERS
A833: SPRINGVALE | C833: KNIGHT | F833: KOOP | I833: SCURRAH | L833: LYNCH | O833: CARROLL | R833: DYSON-HOLLAND
A834: PORT MELBOURNE | C834: KING | F834: CLOHESY | I834: MUENCH | L834: JAMES | O834: STYNES | R834: EDWARDS
A835: GOALKICKERS
A836: SPRINGVALE | C836: KNIGHT 5 | F836: SMITH 3 | H836: HICKEY 3 | J836: SCURRAH 2 | M836: CARIS 2 | O836: DYSON-HOLLAND 2 | S836: PHILLIPS | V836: KOOP
A837: PORT MELBOURNE | C837: STYNES 3 | F837: FOX 2 | H837: HICKS 2 | J837: BOARD | L837: S BOWDEN | N837: CLOHESY
A839: DANDENONG | O839: 16 | P839: 11 | Q839: 107 | S839: Venue: BOX HILL
A840: BOX HILL | O840: 13 | P840: 14 | Q840: 92
A841: BEST PLAYERS
A842: DANDENONG | C842: BURNELL | F842: KENNEDY | I842: HALL | L842: KANNOURAKIS | O842: MYNOTT | R842: DOCKERY
A843: BOX HILL | C843: WILKINSON | F843: ZARAFA | I843: ROWE | L843: COHEN | O843: EVANS
A844: GOALKICKERS
A845: DANDENONG | C845: PRETTO 6 | F845: BURNELL 3 | I845: MILLANE 2 | L845: MYNOTT 2 | O845: GOTCH | Q845: HALL | S845: FOSTER
A846: BOX HILL | C846: VARLEY 4 | F846: WILKINSON 4 | I846: DISNEY 2 | K846: COHEN | M846: ERWIN | O846: PENNY
A848: ROUND 16 | D848: 7TH AUGUST | I848: WEATHER
D849: 1ST QTR | H849: 2ND QTR | L849: 3RD QTR | P849: FINAL | S849: Venue: TOORAK PARK
A850: PRAHRAN | O850: 18 | P850: 6 | Q850: 114 | S850: UMPIRES | Y850: LADDER | AB850: ROUND | AD850: 16
A851: WERRIBEE | O851: 13 | P851: 14 | Q851: 92
A852: BEST PLAYERS | W852: TEAM | X852: W | Y852: L | Z852: D | AA852: FOR | AB852: AGST | AC852: % | AD852: PTS
A853: PRAHRAN | C853: WINTON | F853: SICLUNA | I853: STANLEY | L853: ORIGLASSO | O853: BOLZON | R853: DILENA
A854: WERRIBEE | C854: CULLEN | F854: WATTS | I854: RIENIETS | L854: McMASTER | O854: CONNELL | W854: PORT MELBOURNE | X854: 14 | Y854: 2 | Z854: 0 | AA854: 2125 | AB854: 1406 | AC854: =(AA854/AB854)*100 -> 151.13798008534852 | AD854: =(X854*4)+(Z854*2) -> 56
A855: GOALKICKERS | W855: FRANKSTON | X855: 12 | Y855: 4 | Z855: 0 | AA855: 2031 | AB855: 1340 | AC855: =(AA855/AB855)*100 -> 151.56716417910448 | AD855: =(X855*4)+(Z855*2) -> 48
A856: PRAHRAN | C856: DILENA 4 | E856: STANLEY 4 | H856: PARSONS 3 | J856: MRAKOV 3 | M856: MOLONEY | O856: TREWELLA | Q856: CHAPPLE | S856: BOLZON | W856: WERRIBEE | X856: 11 | Y856: 5 | Z856: 0 | AA856: 2028 | AB856: 1449 | AC856: =(AA856/AB856)*100 -> 139.95859213250517 | AD856: =(X856*4)+(Z856*2) -> 44
A857: WERRIBEE | C857: O'KEEFE 2 | E857: W KRAKOUER 2 | H857: SALTALAMACCHIA 2 | L857: McDONALD 2 | O857: AZIZ 2 | Q857: GEARY | S857: WILSON | W857: PRAHRAN | X857: 11 | Y857: 5 | Z857: 0 | AA857: 2030 | AB857: 1464 | AC857: =(AA857/AB857)*100 -> 138.66120218579235 | AD857: =(X857*4)+(Z857*2) -> 44
D858: 8TH AUGUST | P858: CULLEN | W858: SANDRINGHAM | X858: 8 | Y858: 8 | Z858: 0 | AA858: 1856 | AB858: 1486 | AC858: =(AA858/AB858)*100 -> 124.89905787348587 | AD858: =(X858*4)+(Z858*2) -> 32
A859: SPRINGVALE | O859: 20 | P859: 16 | Q859: 136 | S859: Venue: SPRINGVALE
A860: BOX HILL | O860: 8 | P860: 10 | Q860: 58 | W860: SPRINGVALE | X860: 8 | Y860: 8 | Z860: 0 | AA860: 1544 | AB860: 1615 | AC860: =(AA860/AB860)*100 -> 95.603715170278633 | AD860: =(X860*4)+(Z860*2) -> 32
A861: BEST PLAYERS | W861: BOX HILL | X861: 8 | Y861: 8 | Z861: 0 | AA861: 1654 | AB861: 1753 | AC861: =(AA861/AB861)*100 -> 94.352538505419275 | AD861: =(X861*4)+(Z861*2) -> 32
A862: SPRINGVALE | C862: CLARK | F862: SUTHERLAND | I862: DYSON-HOLLAND | L862: HALPHEN | O862: MORGAN | R862: LYNCH | W862: DANDEN0NG | X862: 7 | Y862: 9 | Z862: 0 | AA862: 1738 | AB862: 1853 | AC862: =(AA862/AB862)*100 -> 93.793847814355104 | AD862: =(X862*4)+(Z862*2) -> 28
A863: BOX HILL | C863: ZARAFA | F863: BANFIELD | I863: JAMES | W863: PRESTON | X863: 7 | Y863: 9 | Z863: 0 | AA863: 1478 | AB863: 1640 | AC863: =(AA863/AB863)*100 -> 90.121951219512198 | AD863: =(X863*4)+(Z863*2) -> 28
A864: GOALKICKERS | P864: SMITH | W864: WILLIAMSTOWN | X864: 7 | Y864: 9 | Z864: 0 | AA864: 1330 | AB864: 1574 | AC864: =(AA864/AB864)*100 -> 84.498094027954252 | AD864: =(X864*4)+(Z864*2) -> 28
A865: SPRINGVALE | C865: CARIS 4 | E865: DYSON-HOLLAND 4 | I865: HICKEY 4 | K865: JEFFS 3 | M865: PEACOCK | O865: PHILLIPS | Q865: O'DONNELL | T865: KNIGHT | W865: OAKLEIGH | X865: 3 | Y865: 13 | Z865: 0 | AA865: 1462 | AB865: 2300 | AC865: =(AA865/AB865)*100 -> 63.565217391304351 | AD865: =(X865*4)+(Z865*2) -> 12
A866: BOX HILL | C866: WATSON 3 | F866: ERWIN 2 | I866: JAMES 2 | K866: EVANS | W866: COBURG | X866: 0 | Y866: 16 | Z866: 0 | AA866: 1193 | AB866: 2589 | AC866: =(AA866/AB866)*100 -> 46.079567400540746 | AD866: =(X866*4)+(Z866*2) -> 0
A868: SANDRINGHAM | O868: 18 | P868: 13 | Q868: 121 | S868: Venue: BEACH ROAD
A869: PRESTON | O869: 6 | P869: 7 | Q869: 43 | S869: PANOZZO :MANN
A870: BEST PLAYERS
A871: SANDRINGHAM | C871: BAILEY | F871: ALLEN | I871: MURRAY | L871: CZERKASKI | O871: WILLIAMS | R871: KELLOWAY
A872: PRESTON | C872: DOBBS | F872: KERR | I872: BUCKLEY | L872: BURROWS
A873: GOALKICKERS
A874: SANDRINGHAM | C874: AMIET 3 | E874: MITCHELSON 2 | H874: BAILEY 2 | J874: LAMBERT 2 | M874: PEARCE 2 | O874: ALLEN | Q874: KELLOWAY | T874: CLARKSON | W874: WILLIAMS | X874: CZERKASKI | AA874: MOREY | AC874: GARRETT
A875: PRESTON | C875: SHAW 2 | F875: REEVES 2 | I875: PLUNKETT | L875: LUMICISI
A877: DANDENONG | O877: 20 | P877: 22 | Q877: 142 | S877: Venue: OAKLEIGH
A878: OAKLEIGH | O878: 13 | P878: 13 | Q878: 91
A879: BEST PLAYERS
A880: DANDENONG | C880: LACKO | F880: BRADLEY | I880: DOCKERY | L880: PRETTO | O880: PETER-BUDGE | R880: BURNELL
A881: OAKLEIGH | C881: SWAINSTON | F881: YOUNG | I881: CLARKE | L881: BURTON | O881: DI NATALE
A882: GOALKICKERS
A883: DANDENONG | C883: PRETTO 7 | F883: BURNELL 3 | I883: BRADLEY 3 | L883: GOTCH | N883: LACKO | P883: McCONCHIE | S883: GILDER | U883: MEAD | W883: KNIGHT | X883: PETER-BUDGE
A884: OAKLEIGH | C884: SHEPHARD 3 | F884: BICKNELL 2 | I884: CLARKE 2 | K884: OWEN 2 | M884: BRIGGS | O884: DI NATALE | R884: QUIRK | T884: YOUNG
A886: FRANKSTON | O886: 12 | P886: 18 | Q886: 90 | S886: Venue: FRANKSTON
A887: WILLIAMSTOWN | O887: 8 | P887: 2 | Q887: 50
A888: BEST PLAYERS
A889: FRANKSTON | C889: BROWN | F889: WILLIAMS | I889: GOOSEY | L889: WOOD | O889: VERBEEK | R889: D RYAN
A890: WILLIAMSTOWN | C890: McGOWAN | F890: PASTORE | I890: O'CONNOR | L890: LLOYD | O890: LONG | R890: SWAN
A891: GOALKICKERS
A892: FRANKSTON | C892: D RYAN 6 | F892: KEAYS 2 | I892: McCARTHY 2 | L892: NAPOLI | N892: M RYAN
A893: WILLIAMSTOWN | C893: RICKMAN 3 | F893: O'CONNOR 2 | I893: McGOWAN | L893: PASTORE | N893: HOFFMAN
A895: PORT MELBOURNE | O895: 30 | P895: 27 | Q895: 207 | S895: Venue: COBURG
A896: COBURG | O896: 9 | P896: 6 | Q896: 60
A897: BEST PLAYERS
A898: PORT MELBOURNE | C898: STYNESS | F898: CLOHESY | I898: KING | L898: CHRIMES | O898: KEIGHRAN | R898: TOUT
A899: COBURG | C899: SALVADORE | F899: LISTON | I899: TARANTO | L899: DAVID
A900: GOALKICKERS
A901: PORT MELBOURNE | C901: STYNES 12 | F901: S BOWDEN 6 | I901: KING 3 | K901: CHRIMES 2 | N901: R BOWDEN | Q901: KEIGHRAN | S901: FOX | U901: BAILEY | W901: TOUT | X901: EDWARDS | AA901: MUENCH
A902: COBURG | C902: ALESSIO 2 | F902: KAAKOUER 2 | I902: O'MEARA 2 | L902: BENSTEAD | O902: GRIFFITHS | R902: INGRAM
A904: ROUND 17 | D904: 14TH AUGUST | I904: WEATHER
D905: 1ST QTR | H905: 2ND QTR | L905: 3RD QTR | P905: FINAL | S905: Venue: PRESTON
A906: PRAHRAN | O906: 14 | P906: 12 | Q906: 96 | S906: UMPIRES | Y906: LADDER | AB906: ROUND | AD906: 17
A907: PRESTON | O907: 6 | P907: 9 | Q907: 45
A908: BEST PLAYERS | W908: TEAM | X908: W | Y908: L | Z908: D | AA908: FOR | AB908: AGST | AC908: % | AD908: PTS
A909: PRAHRAN | C909: MOLONEY | F909: MRAKOV | I909: LUCAS | L909: BOLZON | O909: LENNOX | Q909: TREWELLA
A910: PRESTON | C910: DOBBS | F910: T WALKER | I910: BUCKLEY | L910: PLUNKETT | O910: SMITH | Q910: CROUGH | W910: PORT MELBOURNE | X910: 15 | Y910: 2 | Z910: 0 | AA910: 2203 | AB910: 1483 | AC910: =(AA910/AB910)*100 -> 148.5502360080917 | AD910: =(X910*4)+(Z910*2) -> 60
A911: GOALKICKERS | N911: AHMAD | P911: STANLEY | R911: GOODALE | W911: FRANKSTON | X911: 12 | Y911: 5 | Z911: 0 | AA911: 2074 | AB911: 1425 | AC911: =(AA911/AB911)*100 -> 145.54385964912279 | AD911: =(X911*4)+(Z911*2) -> 48
A912: PRAHRAN | C912: KEIPERT 3 | F912: POVEY 2 | H912: PARSONS 2 | K912: DILENA | M912: ORIGLASSO | P912: MRAKOV | R912: SINNI | W912: WERRIBEE | X912: 12 | Y912: 5 | Z912: 0 | AA912: 2129 | AB912: 1468 | AC912: =(AA912/AB912)*100 -> 145.02724795640327 | AD912: =(X912*4)+(Z912*2) -> 48
A913: PRESTON | C913: SHAW 2 | F913: KING | H913: McGARRIGLE | K913: KOUTOUFIDES | N913: LUMICISI | W913: PRAHRAN | X913: 12 | Y913: 5 | Z913: 0 | AA913: 2226 | AB913: 1509 | AC913: =(AA913/AB913)*100 -> 147.51491053677933 | AD913: =(X913*4)+(Z913*2) -> 48
D914: 15TH AUGUST | I914: WEATHER | W914: SANDRINGHAM | X914: 9 | Y914: 8 | Z914: 0 | AA914: 1941 | AB914: 1529 | AC914: =(AA914/AB914)*100 -> 126.94571615434924 | AD914: =(X914*4)+(Z914*2) -> 36
A915: WERRIBEE | O915: 15 | P915: 11 | Q915: 101 | S915: Venue: WERRIBEE
A916: OAKLEIGH | O916: 2 | P916: 7 | Q916: 19 | W916: SPRINGVALE | X916: 9 | Y916: 8 | Z916: 0 | AA916: 1626 | AB916: 1673 | AC916: =(AA916/AB916)*100 -> 97.190675433353263 | AD916: =(X916*4)+(Z916*2) -> 36
A917: BEST PLAYERS | W917: BOX HILL | X917: 9 | Y917: 8 | Z917: 0 | AA917: 1759 | AB917: 1780 | AC917: =(AA917/AB917)*100 -> 98.82022471910112 | AD917: =(X917*4)+(Z917*2) -> 36
A918: WERRIBEE | C918: McMASTER | F918: WILLIAMS | I918: CULLEN | L918: HAVARD | O918: WATTS | R918: CONNELL | W918: DANDEN0NG | X918: 7 | Y918: 10 | Z918: 0 | AA918: 1796 | AB918: 1935 | AC918: =(AA918/AB918)*100 -> 92.816537467700257 | AD918: =(X918*4)+(Z918*2) -> 28
A919: OAKLEIGH | C919: BURTON | F919: YOUNG | I919: MORELAND | L919: SWAINSTON | O919: GOODEN | W919: PRESTON | X919: 7 | Y919: 10 | Z919: 0 | AA919: 1523 | AB919: 1736 | AC919: =(AA919/AB919)*100 -> 87.730414746543786 | AD919: =(X919*4)+(Z919*2) -> 28
A920: GOALKICKERS | W920: WILLIAMSTOWN | X920: 7 | Y920: 10 | Z920: 0 | AA920: 1407 | AB920: 1652 | AC920: =(AA920/AB920)*100 -> 85.169491525423723 | AD920: =(X920*4)+(Z920*2) -> 28
A921: WERRIBEE | C921: AZIZ 5 | E921: LAMONT 4 | H921: GEARY 2 | J921: McDONALD 2 | M921: BUTTON | O921: WILSON | W921: OAKLEIGH | X921: 3 | Y921: 14 | Z921: 0 | AA921: 1481 | AB921: 2401 | AC921: =(AA921/AB921)*100 -> 61.682632236568089 | AD921: =(X921*4)+(Z921*2) -> 12
A922: OAKLEIGH | C922: CLARKE | F922: WILLIAMS | W922: COBURG | X922: 0 | Y922: 17 | Z922: 0 | AA922: 1220 | AB922: 2694 | AC922: =(AA922/AB922)*100 -> 45.28582034149963 | AD922: =(X922*4)+(Z922*2) -> 0
A924: PORT MELBOURNE | O924: 11 | P924: 12 | Q924: 78 | S924: Venue: WILLIAMSTOWN
A925: WILLIAMSTOWN | O925: 10 | P925: 17 | Q925: 77
A926: BEST PLAYERS
A927: PORT MELBOURNE | C927: CLOHESY | F927: KING | I927: R BOWDEN | L927: HARKINS | O927: KEIGHRAN | R927: S BOWDEN
A928: WILLIAMSTOWN | C928: SWAN | F928: PASTORE | I928: LONG | L928: McGOWAN | O928: McTAGGART | R928: SYMONS
A929: GOALKICKERS
A930: PORT MELBOURNE | C930: STYNES 4 | F930: HICKS 2 | I930: LOVE 2 | K930: CHRIMES | M930: S BOWDEN | P930: JAMES
A931: WILLIAMSTOWN | C931: SYMONS 3 | F931: RICKMAN 2 | I931: SWAN | K931: ZAMKYL | M931: SHANKS | O931: HORE | Q931: GHAZI
A933: BOX HILL | O933: 14 | P933: 21 | Q933: 105 | S933: Venue: BOX HILL
A934: COBURG | O934: 4 | P934: 3 | Q934: 27
A935: BEST PLAYERS
A936: BOX HILL | C936: WILKINSON | F936: HUGHSON | I936: BOURKE | L936: GREIG | O936: ELLIS | R936: COHEN
A937: COBURG | C937: SAL;VADORE | F937: HUBBARD | I937: GORMAN | L937: CAPUANO | O937: TARANTO
A938: GOALKICKERS
A939: BOX HILL | C939: WILKINSON 6 | F939: ELLIS 5 | H939: EVANS | J939: QUINN | L939: WATSON
A940: COBURG | C940: HUBBARD 2 | F940: McWATTERS | I940: ALESSIO
A942: SPRINGVALE | O942: 11 | P942: 16 | Q942: 82 | S942: Venue: DANDENONG
A943: DANDENONG | O943: 8 | P943: 10 | Q943: 58
A944: BEST PLAYERS
A945: SPRINGVALE | C945: O'DONNELL | F945: DYSON-HOLLAND | J945: CLARKE | M945: SMIT | O945: CARROLL | R945: KOOP
A946: DANDENONG | C946: MILLANE | F946: DOCKERY | J946: FOSTER | M946: SRUK | O946: GILDER | R946: MARSHALL
A947: GOALKICKERS
A948: SPRINGVALE | C948: DYSON-HOLLAND 4 | G948: PHILLIPS 3 | J948: KNIGHT | L948: SCURRAH | N948: KOOP | P948: HALPHEN
A949: DANDENONG | C949: MILLANE 3 | F949: SALIBA | H949: BURNELL | J949: PETER-BUDGE | M949: PRETTO | O949: MYNOTT
A951: SANDRINGHAM | O951: 12 | P951: 13 | Q951: 85 | S951: Venue: BEACH ROAD
A952: FRANKSTON | O952: 5 | P952: 13 | Q952: 43 | S952: McINERNEY :RUSSO
A953: BEST PLAYERS
A954: SANDRINGHAM | C954: GARRETT | F954: BAILEY | I954: J RUGOLO | L954: CZERKASKI | O954: PEARCE | Q954: A WILLIAMS
A955: FRANKSTON | C955: FOOT | F955: BROWN | I955: GOOSEY
A956: GOALKICKERS
A957: SANDRINGHAM | C957: M WILLIAMS 4 | F957: GARRETT 3 | I957: MOREY 2 | K957: PEARCE | M957: FORD | O957: CZERKASKI
A958: FRANKSTON | C958: GOOSEY 2 | F958: RYAN | H958: HAMILL | J958: BROWN
A960: ROUND 18 | D960: 21ST AUGUST | I960: WEATHER | S960: Venue: PORT MELBOURNE
D961: 1ST QTR | H961: 2ND QTR | L961: 3RD QTR | P961: FINAL | S961: UMPIRES
A962: PORT MELBOURNE | O962: 16 | P962: 17 | Q962: 113 | S962: CALLAGHAN | Y962: LADDER | AB962: ROUND | AD962: 18
A963: SANDRINGHAM | O963: 15 | P963: 11 | Q963: 101 | S963: McCAULEY
A964: BEST PLAYERS | W964: TEAM | X964: W | Y964: L | Z964: D | AA964: FOR | AB964: AGST | AC964: % | AD964: PTS
A965: PORT MELBOURNE | C965: HICKS | F965: KEIGHRAN | I965: DONALD | L965: CAMERON | O965: STYNES | R965: JAMES
A966: SANDRINGHAM | C966: ALLEN | F966: CZERKASKI | I966: ARGUS | L966: WILLIAMS | O966: CLARKSON | R966: FORD | W966: PORT MELBOURNE | X966: 16 | Y966: 2 | Z966: 0 | AA966: 2316 | AB966: 1584 | AC966: =(AA966/AB966)*100 -> 146.21212121212122 | AD966: =(X966*4)+(Z966*2) -> 64
A967: GOALKICKERS | W967: WERRIBEE | X967: 13 | Y967: 5 | Z967: 0 | AA967: 2288 | AB967: 1564 | AC967: =(AA967/AB967)*100 -> 146.29156010230179 | AD967: =(X967*4)+(Z967*2) -> 52
A968: PORT MELBOURNE | C968: HICKS 7 | E968: STYNES 4 | H968: R BOWDEN | K968: CHRIMES | M968: JAMES | O968: BAILEY | Q968: LOVE | W968: PRAHRAN | X968: 13 | Y968: 5 | Z968: 0 | AA968: 2352 | AB968: 1620 | AC968: =(AA968/AB968)*100 -> 145.18518518518519 | AD968: =(X968*4)+(Z968*2) -> 52
A969: SANDRINGHAM | C969: WILLIAMS 5 | F969: FORD 3 | H969: GARRETT 2 | K969: KELLOWAY 2 | N969: BAILEY 2 | P969: CLARKSON | W969: FRANKSTON | X969: 12 | Y969: 6 | Z969: 0 | AA969: 2185 | AB969: 1551 | AC969: =(AA969/AB969)*100 -> 140.87685364281108 | AD969: =(X969*4)+(Z969*2) -> 48
D970: 22ND AUGUST | I970: WEATHER | W970: SPRINGVALE | X970: 10 | Y970: 8 | Z970: 0 | AA970: 1784 | AB970: 1713 | AC970: =(AA970/AB970)*100 -> 104.14477524810275 | AD970: =(X970*4)+(Z970*2) -> 40
A971: BOX HILL | O971: 13 | P971: 15 | Q971: 93 | S971: Venue: BOX HILL
A972: WILLIAMSTOWN | O972: 14 | P972: 6 | Q972: 90 | W972: BOX HILL | X972: 10 | Y972: 8 | Z972: 0 | AA972: 1852 | AB972: 1870 | AC972: =(AA972/AB972)*100 -> 99.037433155080208 | AD972: =(X972*4)+(Z972*2) -> 40
A973: BEST PLAYERS | W973: SANDRINGHAM | X973: 9 | Y973: 9 | Z973: 0 | AA973: 2042 | AB973: 1642 | AC973: =(AA973/AB973)*100 -> 124.36053593179051 | AD973: =(X973*4)+(Z973*2) -> 36
A974: BOX HILL | C974: ROWE | F974: WILKINSON | I974: BOURKE | L974: WATSON | O974: KELLY | R974: GREIG | W974: DANDEN0NG | X974: 8 | Y974: 10 | Z974: 0 | AA974: 1898 | AB974: 2029 | AC974: =(AA974/AB974)*100 -> 93.543617545588958 | AD974: =(X974*4)+(Z974*2) -> 32
A975: WILLIAMSTOWN | C975: PASTORE | F975: LONG | I975: SYMONS | L975: RICKMAN | O975: VENNER | R975: McTAGGART | W975: WILLIAMSTOWN | X975: 7 | Y975: 11 | Z975: 0 | AA975: 1497 | AB975: 1745 | AC975: =(AA975/AB975)*100 -> 85.787965616045852 | AD975: =(X975*4)+(Z975*2) -> 28
A976: GOALKICKERS | P976: WATSON | W976: PRESTON | X976: 7 | Y976: 11 | Z976: 0 | AA976: 1619 | AB976: 1895 | AC976: =(AA976/AB976)*100 -> 85.435356200527707 | AD976: =(X976*4)+(Z976*2) -> 28
A977: BOX HILL | C977: EVANS 3 | F977: ELLIS 2 | H977: WILKINSON 2 | K977: ZARAFA 2 | M977: COHEN | O977: ERWIN | Q977: PRESTON | W977: OAKLEIGH | X977: 3 | Y977: 15 | Z977: 0 | AA977: 1521 | AB977: 2559 | AC977: =(AA977/AB977)*100 -> 59.437280187573272 | AD977: =(X977*4)+(Z977*2) -> 12
A978: WILLIAMSTOWN | C978: RICKMAN 3 | F978: ZAMKYL 3 | I978: McTAGGART 2 | L978: GHAZI 2 | N978: SYMONS | P978: PASTORE | R978: WILLIAMS | W978: COBURG | X978: 0 | Y978: 18 | Z978: 0 | AA978: 1314 | AB978: 2796 | AC978: =(AA978/AB978)*100 -> 46.995708154506438 | AD978: =(X978*4)+(Z978*2) -> 0
O979: LONG
A980: DANDENONG | O980: 15 | P980: 12 | Q980: 102 | S980: Venue: COBURG
A981: COBURG | O981: 13 | P981: 16 | Q981: 94
A982: BEST PLAYERS
A983: DANDENONG | C983: PRETTO | F983: LACKO | I983: DOCKERY | L983: HALL | O983: MARSHALL
A984: COBURG | C984: ALESSIO | F984: DAVID | I984: SEMAAN | L984: SALVADORE | O984: HUBBARD
A985: GOALKICKERS
A986: DANDENONG | C986: PRETTO 10 | F986: MILLANE 2 | I986: GILDER | K986: GOTCH | M986: SRUK
A987: COBURG | C987: INGRAM 4 | F987: McMAHON 2 | I987: GRIFFITHS 2 | L987: KAAKOUR | N987: O'MEARA | P987: SEMAAN | R987: CAPUANO | U987: SALVADORE
A989: SPRINGVALE | O989: 22 | P989: 26 | Q989: 158 | S989: Venue: OAKLEIGH
A990: OAKLEIGH | O990: 5 | P990: 10 | Q990: 40
A991: BEST PLAYERS
A992: SPRINGVALE | C992: CARROLL | F992: LYNCH | I992: SUTHERLAND | L992: DYSON-HOLLAND | O992: PEACOCK | R992: CLARK
A993: OAKLEIGH | C993: YOUNG | F993: LEARMONTH | I993: D CLARKE | L993: JAMES | O993: BICKNELL | R993: SAUNDERS
A994: GOALKICKERS
A995: SPRINGVALE | C995: CARIS 5 | E995: DYSON-HOLLAND 3 | I995: CARROLL 3 | L995: SMITH 2 | N995: KNIGHT 2 | P995: CAPLES 2 | R995: PHILLIPS | U995: KOOP | W995: SCURRAH | X995: HALPHEN | AA995: GOLDBERG
A996: OAKLEIGH | C996: R STUBBS | F996: BURTON | H996: QUIRK | J996: GOODEN | L996: OWEN
A998: PRAHRAN | O998: 19 | P998: 12 | Q998: 126 | S998: Venue: TOORAK PARK
A999: FRANKSTON | O999: 16 | P999: 15 | Q999: 111
A1000: BEST PLAYERS
A1001: PRAHRAN | C1001: LENNOX | F1001: WILSON | I1001: KEIPERT | L1001: TREWELLA | O1001: BOLZON | R1001: SCICLUNA
A1002: FRANKSTON | C1002: FOOT | F1002: P WILLIAMS | I1002: WOOD | L1002: BROWN | O1002: S HAMILL | R1002: M RYAN
A1003: GOALKICKERS
A1004: PRAHRAN | C1004: WILSON 4 | E1004: SINNI 4 | G1004: PARSONS 3 | I1004: KEIPERT 3 | K1004: LENNOX | M1004: ORIGLASSO | P1004: AHMAD | R1004: MOLONEY | U1004: TREWELLA
A1005: FRANKSTON | C1005: WOOD 4 | E1005: CASSETT 3 | H1005: KEAYS 2 | J1005: GAHAN 2 | L1005: MORWOOD 2 | O1005: P WILLIAMS | R1005: M RYAN | U1005: VERBEEK
A1007: WERRIBEE | O1007: 25 | P1007: 9 | Q1007: 159 | S1007: Venue: WERRIBEE
A1008: PRESTON | O1008: 14 | P1008: 12 | Q1008: 96
A1009: BEST PLAYERS
A1010: WERRIBEE | C1010: GEARY | F1010: WALSH | I1010: WATTS | L1010: AZIZ | O1010: WILSON
A1011: PRESTON | C1011: DOBBS | F1011: SMITH | I1011: KING | L1011: CROUGH | O1011: LUMICISI
A1012: GOALKICKERS
A1013: WERRIBEE | C1013: AZIZ 10 | E1013: MCDONALD 4 | H1013: GEARY 3 | J1013: LAMONT 3 | M1013: RIENIETS | O1013: NORMINGTON | R1013: CULLEN | U1013: SALTALAMACCHIA | X1013: WILLIAMS
A1014: PRESTON | C1014: SMITH 4 | F1014: LUMICISI 3 | I1014: KOUTOUFIDES 2 | L1014: DAVIDSON 2 | O1014: MUNRIVANA | R1014: KING | T1014: GLASCOTT
A1016: FINALS
A1017: ELIMINATION | D1017: 29TH AUGUST | I1017: WEATHER
D1018: 1ST QTR | H1018: 2ND QTR | L1018: 3RD QTR | P1018: FINAL | S1018: Venue: MOORABBIN
A1019: SPRINGVALE | O1019: 17 | P1019: 17 | Q1019: 119 | S1019: UMPIRES
A1020: FRANKSTON | O1020: 14 | P1020: 10 | Q1020: 94 | S1020: CARLAND :ELLIS
A1021: BEST PLAYERS
A1022: SPRINGVALE | C1022: KNIGHT | F1022: GOLDBERG | I1022: MALONI | L1022: CLARK | N1022: JEFFS | Q1022: HALPHEN
A1023: FRANKSTON | C1023: BROWN | F1023: VERBEEK | I1023: MORWOOD
A1024: GOALKICKERS
A1025: SPRINGVALE | C1025: JEFFS 5 | F1025: PHILLIPS 3 | I1025: SCURRAH 3 | L1025: KNIGHT 2 | N1025: SMITH 2 | P1025: KOOP | R1025: HALPHEN
A1026: FRANKSTON | C1026: MORWOOD 5 | F1026: VERBEEK 2 | I1026: McCARTHY 2 | L1026: CASSETT | N1026: KEAYS | P1026: HAMILL | R1026: D RYAN | U1026: M RYAN
A1028: QUALIFYING | D1028: 28TH AUGUST | I1028: WEATHER
A1029: WERRIBEE | O1029: 12 | P1029: 16 | Q1029: 88 | S1029: Venue: MOORABBIN
A1030: PRAHRAN | O1030: 11 | P1030: 13 | Q1030: 79
A1031: BEST PLAYERS
A1032: WERRIBEE | C1032: RAEBURN | F1032: WATTS | I1032: HAVARD | L1032: AZIZ | O1032: BUTTON | R1032: McPHERSON
A1033: PRAHRAN | C1033: LUCAS | F1033: CHAPPLE | I1033: LENNOX | L1033: TREWELLA
A1034: GOALKICKERS
A1035: WERRIBEE | C1035: AZIZ 7 | E1035: RIENIETS | G1035: BUTTON | I1035: POWER | K1035: SALTALAMACCHIA | O1035: McDONALD
A1036: PRAHRAN | C1036: MOLONEY 2 | F1036: KEIPERT 2 | I1036: WILSON 2 | K1036: PARSONS 2 | N1036: AHMAD | P1036: CHAPPLE | R1036: DILENA
A1038: 1ST SEMI | D1038: 4TH SEPTEMBER | I1038: WEATHER
A1039: SPRINGVALE | O1039: 14 | P1039: 16 | Q1039: 100 | S1039: Venue: MOORABBIN
A1040: PRAHRAN | O1040: 12 | P1040: 16 | Q1040: 88 | S1040: ALLEN :McKERNAN
A1041: BEST PLAYERS
A1042: SPRINGVALE | C1042: CAPLES | F1042: PEACOCK | I1042: SMITH | L1042: KNIGHT | O1042: SUTHERLAND | R1042: HALPHEN
A1043: PRAHRAN | C1043: CHAPPLE | F1043: SINNI | I1043: PARSONS | L1043: AHMAD | O1043: WINTON | R1043: STANLEY
A1044: GOALKICKERS
A1045: SPRINGVALE | C1045: PHILLIPS 3 | F1045: SCURRAH 2 | I1045: DYSON-HOLLAND 2 | M1045: JEFFS 2 | O1045: KNIGHT | Q1045: KOOP | S1045: SMITH | V1045: HALPHEN | X1045: GOONEWARDENE
A1046: PRAHRAN | C1046: PARSONS 4 | F1046: STANLEY 3 | I1046: SINNI 2 | K1046: POVEY | M1046: MRAKOV | O1046: AHMAD
A1048: 2ND SEMI | D1048: 5TH SEPTEMBER | I1048: WEATHER
A1049: PORT MELBOURNE | O1049: 11 | P1049: 25 | Q1049: 91 | S1049: Venue: MOORABBIN
A1050: WERRIBEE | O1050: 11 | P1050: 14 | Q1050: 80
A1051: BEST PLAYERS
A1052: PORT MELBOURNE | C1052: KEIGHRAN | F1052: BARLOW | I1052: HARKINS | L1052: KING | O1052: S BOWDEN | R1052: R BOWDEN
A1053: WERRIBEE | C1053: CULLEN | F1053: McDONALD | I1053: WATTS | L1053: POWER | O1053: WILLIAMS
A1054: GOALKICKERS
A1055: PORT MELBOURNE | C1055: STYNES 2 | E1055: HARKINS 2 | H1055: CHRIMES | J1055: KEIGHRAN | M1055: JAMES | O1055: BAILEY | Q1055: HICKS | S1055: MUENCH | V1055: KING
A1056: WERRIBEE | C1056: McDONALD 3 | F1056: SALTALAMACCHIA 2 | J1056: RIENIETS | L1056: O'KEEFE | N1056: KRAKOUER | Q1056: POWER | S1056: AZIZ | U1056: HAVARD
A1058: PRELIMINARY | D1058: 12TH SEPTEMBER
A1059: WERRIBEE | O1059: 14 | P1059: 14 | Q1059: 98 | S1059: Venue: MOORABBIN
A1060: SPRINGVALE | O1060: 14 | P1060: 11 | Q1060: 95 | S1060: MURNANE :McKERNAN
A1061: BEST PLAYERS
A1062: WERRIBEE | C1062: AZIZ | F1062: HARRINGTON | I1062: WILLIAMS | L1062: WATTS | O1062: WILSON | R1062: ALLDAY
A1063: SPRINGVALE | C1063: DYSON-HOLLAND | F1063: PEACOCK | I1063: HALPHEN | L1063: KNIGHT | O1063: CLARK | R1063: PHILLIPS
A1064: GOALKICKERS
A1065: WERRIBEE | C1065: AZIZ 6 | E1065: BUTTON 2 | H1065: MCDONALD 2 | K1065: GEARY | M1065: POWER | O1065: McMASTER | R1065: LAMONT
A1066: SPRINGVALE | C1066: PHILLIPS 3 | F1066: FOGARTY 3 | I1066: SCURRAH 2 | L1066: KNIGHT 2 | N1066: DYSON-HOLLAND 2 | R1066: KOOP | T1066: HALPHEN
A1068: GRAND | D1068: 19TH SEPTEMBER
A1069: WERRIBEE | S1069: Venue: PRINCES PARK (CARLTON)
A1070: PORT MELBOURNE | S1070: NASH :AGNEW
A1071: BEST PLAYERS
A1072: WERRIBEE
A1073: PORT MELBOURNE
A1074: GOALKICKERS
A1075: WERRIBEE
A1076: PORT MELBOURNE