A1: Victorian Football Association
A2: Season 1994
A3: © Copyright Wal Williams | F3: First created: 1 September 2016
A4: Contact: joywalwi at gmail dot com | F4: Last updated: 3 December 2016 | W4: VFA Results and tables - Link to the main index page
A5: You are free to copy this document in whole or part provided that proper acknowledgement is given to the author. All rights reserved.
A7: 1994 | C7: 1ST DIVISION
A8: ROUND 1 | D8: 15TH APRIL | I8: WEATHER
D9: 1ST QTR | H9: 2ND QTR | L9: 3RD QTR | P9: FINAL | S9: Venue: SPRINGVALE
A10: SPRINGVALE | C10: 7 | D10: 4 | E10: =(C10*6)+D10 -> 46 | G10: 12 | H10: 5 | I10: 77 | K10: 17 | L10: 8 | M10: =(K10*6)+L10 -> 110 | O10: 22 | P10: 11 | Q10: 143 | S10: UMPIRES | Y10: LADDER | AB10: ROUND | AD10: 1
A11: PRAHRAN | C11: 0 | D11: 1 | E11: =(C11*6)+D11 -> 1 | G11: 2 | H11: 2 | I11: 14 | K11: 7 | L11: 5 | M11: =(K11*6)+L11 -> 47 | O11: 11 | P11: 6 | Q11: 72
A12: BEST PLAYERS | W12: TEAM | X12: W | Y12: L | Z12: D | AA12: FOR | AB12: AGST | AC12: % | AD12: PTS
A13: SPRINGVALE | C13: BALDWIN | F13: CLARK | I13: KNIGHT | L13: DYSON-HOLLAND | P13: MORGAN | R13: PEACOCK
A14: PRAHRAN | C14: GLADMAN | F14: JAMES | I14: O'CONNELL | L14: KEIPERT | W14: SANDRINGHAM | X14: 1 | Y14: 0 | Z14: 0 | AA14: 207 | AB14: 34 | AC14: =(AA14/AB14)*100 -> 608.82352941176464 | AD14: =(X14*4)+(Z14*2) -> 4
A15: GOALKICKERS | M15: DELARUE 2 | P15: BALDWIN 2 | R15: CAPSALIS | W15: SPRINGVALE | X15: 1 | Y15: 0 | Z15: 0 | AA15: 143 | AB15: 72 | AC15: =(AA15/AB15)*100 -> 198.61111111111111 | AD15: =(X15*4)+(Z15*2) -> 4
A16: SPRINGVALE | C16: PHILLIPS 4 | E16: KNIGHT 3 | G16: HALPHEN 2 | I16: R SMITH 2 | K16: EVANS 2 | M16: DYSON-HOLLAND 2 | Q16: MONTGOMERY 2 | W16: PRESTON | X16: 1 | Y16: 0 | Z16: 0 | AA16: 114 | AB16: 59 | AC16: =(AA16/AB16)*100 -> 193.22033898305085 | AD16: =(X16*4)+(Z16*2) -> 4
A17: PRAHRAN | C17: KEIPERT 2 | E17: GLADMAN 2 | H17: GOODALE | J17: HARTMAN | M17: JAMES | N17: SINNI | P17: PARSONS | R17: HUGHES | W17: BOX HILL | X17: 1 | Y17: 0 | Z17: 0 | AA17: 111 | AB17: 62 | AC17: =(AA17/AB17)*100 -> 179.03225806451613 | AD17: =(X17*4)+(Z17*2) -> 4
D18: 16TH APRIL | I18: WEATHER | O18: CRISP | W18: OAKLEIGH | X18: 1 | Y18: 0 | Z18: 0 | AA18: 99 | AB18: 68 | AC18: =(AA18/AB18)*100 -> 145.58823529411765 | AD18: =(X18*4)+(Z18*2) -> 4
A19: PORT MELBOURNE | C19: 4 | D19: 1 | E19: =(C19*6)+D19 -> 25 | G19: 8 | H19: 6 | I19: =(G19*6)+H19 -> 54 | K19: 14 | L19: 9 | M19: =(K19*6)+L19 -> 93 | O19: 17 | P19: 11 | Q19: 113 | S19: Venue: WERRIBEE
A20: WERRIBEE | C20: 7 | D20: 2 | E20: =(C20*6)+D20 -> 44 | G20: 10 | H20: 3 | I20: =(G20*6)+H20 -> 63 | K20: 13 | L20: 5 | M20: =(K20*6)+L20 -> 83 | O20: 16 | P20: 8 | Q20: 104 | W20: PORT MELBOURNE | X20: 1 | Y20: 0 | Z20: 0 | AA20: 113 | AB20: 104 | AC20: =(AA20/AB20)*100 -> 108.65384615384615 | AD20: =(X20*4)+(Z20*2) -> 4
A21: BEST PLAYERS | W21: WERRIBEE | X21: 0 | Y21: 1 | Z21: 0 | AA21: 104 | AB21: 113 | AC21: =(AA21/AB21)*100 -> 92.035398230088489 | AD21: =(X21*4)+(Z21*2) -> 0
A22: PORT MELBOURNE | C22: CLOHESY | F22: FRANKEN | I22: R BOWDEN | L22: BAILEY | O22: EDWARDS | R22: SEXTON | W22: WILLIAMSTOWN | X22: 0 | Y22: 0 | Z22: 0 | AA22: 68 | AB22: 99 | AC22: =(AA22/AB22)*100 -> 68.686868686868678 | AD22: =(X22*4)+(Z22*2) -> 0
A23: WERRIBEE | C23: CULLEN | F23: WILKINS | I23: RAEBURN | L23: HAVARD | O23: SHEAHAN | W23: FRANKSTON | X23: 0 | Y23: 1 | Z23: 0 | AA23: 62 | AB23: 111 | AC23: =(AA23/AB23)*100 -> 55.85585585585585 | AD23: =(X23*4)+(Z23*2) -> 0
A24: GOALKICKERS | N24: DONALD | P24: CLOHESY | W24: COBURG | X24: 0 | Y24: 1 | Z24: 0 | AA24: 59 | AB24: 114 | AC24: =(AA24/AB24)*100 -> 51.754385964912288 | AD24: =(X24*4)+(Z24*2) -> 0
A25: PORT MELBOURNE | C25: TARCZON 4 | E25: JAMES 3 | G25: BAILEY 2 | I25: JONES 2 | K25: LOCKHEAD 2 | N25: R BOWDEN | Q25: S BOWDEN | W25: PRAHRAN | X25: 0 | Y25: 1 | Z25: 0 | AA25: 72 | AB25: 143 | AC25: =(AA25/AB25)*100 -> 50.349650349650354 | AD25: =(X25*4)+(Z25*2) -> 0
A26: WERRIBEE | C26: HARRINGTON 4 | F26: SHEAHAN 4 | I26: MCDONALD 2 | L26: WILSON 2 | N26: WILLIAMS | Q26: EAMES | W26: DANDEN0NG | X26: 0 | Y26: 1 | Z26: 0 | AA26: 34 | AB26: 207 | AC26: =(AA26/AB26)*100 -> 16.425120772946862 | AD26: =(X26*4)+(Z26*2) -> 0
D27: 17TH APRIL | I27: WEATHER | P27: LESIPUTTY | R27: BUTTON
A28: BOX HILL | C28: 8 | D28: 2 | E28: =(C28*6)+D28 -> 50 | G28: 11 | H28: 11 | I28: =(G28*6)+H28 -> 77 | K28: 13 | L28: 13 | M28: =(K28*6)+L28 -> 91 | O28: 16 | P28: 15 | Q28: 111 | S28: Venue: BOX HILL
A29: FRANKSTON | C29: 3 | D29: 2 | E29: =(C29*6)+D29 -> 20 | G29: 6 | H29: 4 | I29: =(G29*6)+H29 -> 40 | K29: 6 | L29: 9 | M29: =(K29*6)+L29 -> 45 | O29: 8 | P29: 14 | Q29: 62
A30: BEST PLAYERS
A31: BOX HILL | C31: BADROCK | F31: LIVINGSTONE | I31: TREWELLA | L31: ZARAFA | O31: O'NEILL | R31: EVANS
A32: FRANKSTON | C32: POLLOCK | F32: NAPOLI | I32: BOWEY | L32: RYAN | O32: HAMILL | R32: MOORE
A33: GOALKICKERS
A34: BOX HILL | C34: EVANS 4 | E34: TREWELLA 3 | H34: WILKINSON 3 | K34: DALY | M34: ERWIN | O34: GREIG | Q34: KELLY | S34: LIVINGSTONE
A35: FRANKSTON | C35: FIDGE | E35: GAHAN | G35: BOWEY | I35: GARDNER | K35: LANCE | M35: ESLER | O35: RYAN | Q35: SHANNON
A37: PRESTON | C37: 2 | D37: 7 | E37: =(C37*6)+D37 -> 19 | G37: 7 | H37: 12 | I37: =(G37*6)+H37 -> 54 | K37: 12 | L37: 15 | M37: =(K37*6)+L37 -> 87 | O37: 16 | P37: 18 | Q37: 114 | S37: Venue: COBURG
A38: COBURG | C38: 4 | D38: 0 | E38: =(C38*6)+D38 -> 24 | G38: 7 | H38: 5 | I38: =(G38*6)+H38 -> 47 | K38: 7 | L38: 6 | M38: =(K38*6)+L38 -> 48 | O38: 8 | P38: 11 | Q38: 59
A39: BEST PLAYERS
A40: PRESTON | C40: WALKER | F40: MUNRIVANA | I40: DONALDSON | L40: DOBBS | O40: DUPUY
A41: COBURG | C41: MELIA | F41: EVANS | I41: DORIAN | L41: RACOVOLIS | O41: BAKER
A42: GOALKICKERS
A43: PRESTON | C43: DUPUY 6 | F43: KING 5 | H43: HOLT 2 | J43: CARELLI | L43: DINTINOSANTE | O43: TAYLOR
A44: COBURG | C44: NICOLAOU 3 | F44: M GILL 2 | H44: BAKER | J44: ALESSIO | L44: SEMAAN
A46: OAKLEIGH | C46: 5 | D46: 5 | E46: =(C46*6)+D46 -> 35 | G46: 7 | H46: 10 | I46: =(G46*6)+H46 -> 52 | K46: 11 | L46: 13 | M46: =(K46*6)+L46 -> 79 | O46: 14 | P46: 15 | Q46: 99 | S46: Venue: OAKLEIGH
A47: WILLIAMSTOWN | C47: 2 | D47: 3 | E47: =(C47*6)+D47 -> 15 | G47: 5 | H47: 7 | I47: =(G47*6)+H47 -> 37 | K47: 7 | L47: 10 | M47: =(K47*6)+L47 -> 52 | O47: 9 | P47: 14 | Q47: 68
A48: BEST PLAYERS
A49: OAKLEIGH | C49: YOUNG | F49: KIDGELL | I49: AUBREY | L49: RE STUBBS | O49: MORELAND | R49: COURTNEY
A50: WILLIAMSTOWN | C50: S LLOYD | F50: MITCHELL | I50: ARCERI | L50: PASTORE
A51: GOALKICKERS
A52: OAKLEIGH | C52: DALE 5 | E52: RE STUBBS 3 | H52: MORELAND 2 | K52: YOUNG | M52: COURTNEY | O52: OWEN | Q52: TOPAKIS
A53: WILLIAMSTOWN | C53: O'CONNOR 3 | F53: ZAMKYL 2 | I53: JOHANSEN | L53: GOULD | N53: A VENNER | Q53: MINETT
A55: SANDRINGHAM | C55: 10 | D55: 6 | E55: =(C55*6)+D55 -> 66 | G55: 15 | H55: 9 | I55: =(G55*6)+H55 -> 99 | K55: 25 | L55: 14 | M55: =(K55*6)+L55 -> 164 | O55: 31 | P55: 21 | Q55: 207 | S55: Venue: BEACH ROAD
A56: DANDENONG | C56: 1 | D56: 4 | E56: =(C56*6)+D56 -> 10 | G56: 1 | H56: 6 | I56: =(G56*6)+H56 -> 12 | K56: 4 | L56: 7 | M56: =(K56*6)+L56 -> 31 | O56: 4 | P56: 10 | Q56: 34 | S56: WENN ;BLOXIDGE
A57: BEST PLAYERS
A58: SANDRINGHAM | C58: CZERKASKI | F58: MOLONEY | I58: GOROZIDIS | L58: WILLIAMS | O58: MITCHELSON | R58: HERMAN
A59: DANDENONG | C59: BURNELL | F59: MILLIGAN | I59: HUNTER | L59: LACKO
A60: GOALKICKERS
A61: SANDRINGHAM | C61: GOROZIDIS 9 | F61: McMASTER 7 | I61: MOREY 4 | K61: O'DWYER 4 | M61: HERMAN 2 | P61: WINTON | R61: MITCHELSON | V61: MOLONEY | X61: CLARKSON | AA61: J RUGOLO
A62: DANDENONG | C62: PRETTO 2 | F62: BURNELL | I62: MYNOTT
A64: ROUND 2 | D64: 23RD APRIL | I64: WEATHER
D65: 1ST QTR | H65: 2ND QTR | L65: 3RD QTR | P65: FINAL | S65: Venue: FRANKSTON
A66: SPRINGVALE | C66: 4 | D66: 4 | E66: =(C66*6)+D66 -> 28 | G66: 9 | H66: 13 | I66: =(G66*6)+H66 -> 67 | K66: 12 | L66: 16 | M66: =(K66*6)+L66 -> 88 | O66: 15 | P66: 24 | Q66: 114 | S66: UMPIRES | Y66: LADDER | AB66: ROUND | AD66: 2
A67: FRANKSTON | C67: 6 | D67: 1 | E67: =(C67*6)+D67 -> 37 | G67: 10 | H67: 1 | I67: =(G67*6)+H67 -> 61 | K67: 14 | L67: 5 | M67: =(K67*6)+L67 -> 89 | O67: 15 | P67: 6 | Q67: 96
A68: BEST PLAYERS | W68: TEAM | X68: W | Y68: L | Z68: D | AA68: FOR | AB68: AGST | AC68: % | AD68: PTS
A69: SPRINGVALE | C69: JEFFS | F69: ANTHONY | I69: BALDWIN | L69: KNIGHT | O69: EVANS | Q69: DYSON-HOLLAND
A70: FRANKSTON | C70: RYAN | F70: ESLER | I70: VANDERMEER | L70: O'NEILL | O70: MOORE | Q70: BOONKAMP | W70: SANDRINGHAM | X70: 2 | Y70: 0 | Z70: 0 | AA70: 326 | AB70: 103 | AC70: =(AA70/AB70)*100 -> 316.50485436893206 | AD70: =(X70*4)+(Z70*2) -> 8
A71: GOALKICKERS | P71: FOGARTY | W71: BOX HILL | X71: 2 | Y71: 0 | Z71: 0 | AA71: 255 | AB71: 156 | AC71: =(AA71/AB71)*100 -> 163.46153846153845 | AD71: =(X71*4)+(Z71*2) -> 8
A72: SPRINGVALE | C72: EVANS 5 | E72: ANTHONY 2 | H72: CAPSALIS 2 | J72: DALRYMPLE 2 | M72: JEFFREY | O72: KNIGHT | Q72: MONTGOMERY | W72: PRESTON | X72: 2 | Y72: 0 | Z72: 0 | AA72: 212 | AB72: 130 | AC72: =(AA72/AB72)*100 -> 163.07692307692307 | AD72: =(X72*4)+(Z72*2) -> 8
A73: FRANKSTON | C73: RYAN 5 | E73: WILLIAMS 2 | H73: GOOSEY | J73: WOOD | L73: NAPOLI | N73: COCHRANE | Q73: MOORE | W73: SPRINGVALE | X73: 2 | Y73: 0 | Z73: 0 | AA73: 257 | AB73: 168 | AC73: =(AA73/AB73)*100 -> 152.97619047619045 | AD73: =(X73*4)+(Z73*2) -> 8
D74: 24TH APRIL | I74: WEATHER | M74: BOWEY | O74: ESLER | Q74: LANCE | S74: Venue: WILLIAMSTOWN | W74: OAKLEIGH | X74: 1 | Y74: 1 | Z74: 0 | AA74: 170 | AB74: 166 | AC74: =(AA74/AB74)*100 -> 102.40963855421687 | AD74: =(X74*4)+(Z74*2) -> 4
A75: SANDRINGHAM | C75: 3 | D75: 3 | E75: =(C75*6)+D75 -> 21 | G75: 5 | H75: 8 | I75: =(G75*6)+H75 -> 38 | K75: 8 | L75: 14 | M75: =(K75*6)+L75 -> 62 | O75: 16 | P75: 23 | Q75: 119 | S75: LOVE
A76: WILLIAMSTOWN | C76: 2 | D76: 4 | E76: =(C76*6)+D76 -> 16 | G76: 5 | H76: 8 | I76: =(G76*6)+H76 -> 38 | K76: 7 | L76: 9 | M76: =(K76*6)+L76 -> 51 | O76: 10 | P76: 9 | Q76: 69 | S76: PHILLIPS | W76: PORT MELBOURNE | X76: 1 | Y76: 1 | Z76: 0 | AA76: 207 | AB76: 248 | AC76: =(AA76/AB76)*100 -> 83.467741935483872 | AD76: =(X76*4)+(Z76*2) -> 4
A77: BEST PLAYERS | W77: PRAHRAN | X77: 1 | Y77: 1 | Z77: 0 | AA77: 204 | AB77: 269 | AC77: =(AA77/AB77)*100 -> 75.836431226765797 | AD77: =(X77*4)+(Z77*2) -> 4
A78: SANDRINGHAM | C78: LAMBERT | F78: FOLEY | I78: WILLIAMS | L78: CZERKASKI | O78: MITCHELSON | W78: DANDEN0NG | X78: 1 | Y78: 1 | Z78: 0 | AA78: 169 | AB78: 296 | AC78: =(AA78/AB78)*100 -> 57.094594594594597 | AD78: =(X78*4)+(Z78*2) -> 4
A79: WILLIAMSTOWN | C79: GOULD | F79: O'CONNOR | I79: MITCHELL | L79: T WEST | O79: S LLOYD | W79: WERRIBEE | X79: 0 | Y79: 2 | Z79: 0 | AA79: 230 | AB79: 245 | AC79: =(AA79/AB79)*100 -> 93.877551020408163 | AD79: =(X79*4)+(Z79*2) -> 0
A80: GOALKICKERS | P80: MURRAY | R80: LAMBERT | W80: FRANKSTON | X80: 0 | Y80: 2 | Z80: 0 | AA80: 158 | AB80: 225 | AC80: =(AA80/AB80)*100 -> 70.222222222222214 | AD80: =(X80*4)+(Z80*2) -> 0
A81: SANDRINGHAM | C81: MOREY 2 | E81: McMASTER 2 | H81: GOROZIDIS 2 | J81: WINTON 2 | M81: HERMAN 2 | O81: O'DWYER 2 | Q81: FOLEY | S81: J RUGOLO | W81: WILLIAMSTOWN | X81: 0 | Y81: 2 | Z81: 0 | AA81: 137 | AB81: 218 | AC81: =(AA81/AB81)*100 -> 62.844036697247709 | AD81: =(X81*4)+(Z81*2) -> 0
A82: WILLIAMSTOWN | C82: O'CONNOR 3 | F82: A VENNER 2 | I82: GHAZI | K82: SHANKS | M82: MINETT | O82: PASTORE | Q82: JESS | W82: COBURG | X82: 0 | Y82: 2 | Z82: 0 | AA82: 148 | AB82: 249 | AC82: =(AA82/AB82)*100 -> 59.437751004016057 | AD82: =(X82*4)+(Z82*2) -> 0
A84: BOX HILL | C84: 8 | D84: 7 | E84: =(C84*6)+D84 -> 55 | G84: 11 | H84: 11 | I84: =(G84*6)+H84 -> 77 | K84: 14 | L84: 14 | M84: =(K84*6)+L84 -> 98 | O84: 21 | P84: 18 | Q84: 144 | S84: Venue: PORT MELBOURNE
A85: PORT MELBOURNE | C85: 2 | D85: 3 | E85: =(C85*6)+D85 -> 15 | G85: 8 | H85: 8 | I85: =(G85*6)+H85 -> 56 | K85: 11 | L85: 14 | M85: =(K85*6)+L85 -> 80 | O85: 13 | P85: 16 | Q85: 94
A86: BEST PLAYERS
A87: BOX HILL | C87: BADROCK | F87: D ROWE | I87: ZARAFA | L87: WILKINSON | O87: EVANS | R87: LIVINGSTONE
A88: PORT MELBOURNE | C88: FRANKEN | F88: R BOWDEN | I88: S BOWDEN | L88: KEIGHRAN | O88: CLOHESY | R88: BAILEY
A89: GOALKICKERS | R89: TREWELLA
A90: BOX HILL | C90: WILKINSON 7 | F90: EVANS 4 | H90: DALY 3 | J90: ERWIN 2 | L90: KELLY | N90: LIVINGSTONE | Q90: QUINN | S90: R ROWE
A91: PORT MELBOURNE | C91: TARCZON 3 | F91: R BOWDEN 3 | I91: MUENCH 2 | K91: FRANKEN | M91: JAMES | O91: BAILEY | Q91: DI BLASI | S91: CLOHESY
A93: DANDENONG | C93: 1 | D93: 8 | E93: =(C93*6)+D93 -> 14 | G93: 7 | H93: 12 | I93: =(G93*6)+H93 -> 54 | K93: 15 | L93: 19 | M93: =(K93*6)+L93 -> 109 | O93: 19 | P93: 21 | Q93: 135 | S93: Venue: DANDENONG
A94: COBURG | C94: 2 | D94: 2 | E94: =(C94*6)+D94 -> 14 | G94: 4 | H94: 4 | I94: =(G94*6)+H94 -> 28 | K94: 6 | L94: 6 | M94: =(K94*6)+L94 -> 42 | O94: 13 | P94: 11 | Q94: 89
A95: BEST PLAYERS
A96: DANDENONG | C96: HALL | F96: MORRISON | I96: ATKINSON | L96: LACKO | O96: MILLIGAN | R96: CLIFFORD
A97: COBURG | C97: MELIA | F97: DAVID | I97: SALVADORE | L97: DORIAN | O97: TARANTO
A98: GOALKICKERS
A99: DANDENONG | C99: PRETTO 5 | E99: MORRISON 4 | H99: ATKINSON 2 | J99: BARWICK | L99: CLIFFORD | N99: FOSTER | P99: HALL | Q99: MILLIGAN | S99: MYNOTT | V99: SALIBA | X99: TAYLOR
A100: COBURG | C100: HAWKINS 2 | F100: WESTON 2 | I100: ALESSIO 2 | K100: BAKER | M100: RACOVOLIS | P100: DAVID | R100: NICOLAOU | U100: BARCLAY | X100: REYNOR | AA100: TARANTO
A102: PRAHRAN | C102: 4 | D102: 4 | E102: =(C102*6)+D102 -> 28 | G102: 7 | H102: 6 | I102: =(G102*6)+H102 -> 48 | K102: 13 | L102: 9 | M102: =(K102*6)+L102 -> 87 | O102: 20 | P102: 12 | Q102: 132 | S102: Venue: TOORAK PARK
A103: WERRIBEE | C103: 5 | D103: 7 | E103: =(C103*6)+D103 -> 37 | G103: 12 | H103: 9 | I103: =(G103*6)+H103 -> 81 | K103: 16 | L103: 12 | M103: =(K103*6)+L103 -> 108 | O103: 19 | P103: 12 | Q103: 126
A104: BEST PLAYERS
A105: PRAHRAN | C105: LUCAS | F105: LENNOX | I105: GLADMAN | L105: TUDDENHAM | O105: PARSONS | R105: PANG
A106: WERRIBEE | C106: WILLIAMS | F106: WILKINS | I106: RAEBURN | L106: SHEAHAN | O106: WRIGHT | R106: EAMES
A107: GOALKICKERS
A108: PRAHRAN | C108: KEIPERT 4 | E108: LUCAS 4 | G108: GOODALE 2 | J108: MARTELLO 2 | M108: PANG 2 | O108: WALFORD 2 | Q108: LENNOX | S108: PARSONS | V108: KILEY | X108: TUDDENHAM
A109: WERRIBEE | C109: SMITH 7 | F109: EAMES 5 | H109: BUTTON 2 | J109: HARRINGTON 2 | M109: McMASTER | P109: WILLIAMS | R109: RAEBURN
A111: PRESTON | C111: 5 | D111: 4 | E111: =(C111*6)+D111 -> 34 | G111: 7 | H111: 10 | I111: =(G111*6)+H111 -> 52 | K111: 11 | L111: 12 | M111: =(K111*6)+L111 -> 78 | O111: 13 | P111: 20 | Q111: 98 | S111: Venue: PRESTON
A112: OAKLEIGH | C112: 2 | D112: 2 | E112: =(C112*6)+D112 -> 14 | G112: 5 | H112: 7 | I112: =(G112*6)+H112 -> 37 | K112: 8 | L112: 8 | M112: =(K112*6)+L112 -> 56 | O112: 10 | P112: 11 | Q112: 71
A113: BEST PLAYERS
A114: PRESTON | C114: DUNBAR | F114: MUNRIVANA | I114: BURROWS | L114: CARELLI | O114: TAYLOR
A115: OAKLEIGH | C115: GARBUIO | F115: RE STUBBS | I115: BRIGGS | L115: MORELAND | O115: YOUNG
A116: GOALKICKERS
A117: PRESTON | C117: KING 2 | E117: CARELLI 2 | G117: McWATTERS 2 | J117: DUNBAR | L117: DUPUY | N117: ESPENSCHIED | Q117: HOLT | R117: PEZZIN | T117: TAYLOR | W117: MUNRIVANA
A118: OAKLEIGH | C118: DALE 4 | F118: RE STUBBS 2 | I118: MORELAND | L118: COURTNEY | O118: OWEN | Q118: TOPAKIS
A120: ROUND 3 | D120: 30TH APRIL | I120: WEATHER
D121: 1ST QTR | H121: 2ND QTR | L121: 3RD QTR | P121: FINAL | S121: Venue: BOX HILL
A122: SPRINGVALE | C122: 5 | D122: 7 | E122: =(C122*6)+D122 -> 37 | G122: 11 | H122: 14 | I122: =(G122*6)+H122 -> 80 | K122: 14 | L122: 16 | M122: =(K122*6)+L122 -> 100 | O122: 18 | P122: 23 | Q122: 131 | S122: UMPIRES | Y122: LADDER | AB122: ROUND | AD122: 3
A123: BOX HILL | C123: 2 | D123: 3 | E123: =(C123*6)+D123 -> 15 | G123: 5 | H123: 6 | I123: =(G123*6)+H123 -> 36 | K123: 12 | L123: 10 | M123: =(K123*6)+L123 -> 82 | O123: 16 | P123: 12 | Q123: 108
A124: BEST PLAYERS | W124: TEAM | X124: W | Y124: L | Z124: D | AA124: FOR | AB124: AGST | AC124: % | AD124: PTS
A125: SPRINGVALE | C125: DYSON-HOLLAND | F125: KNIGHT | I125: CAPLES | L125: CAPSALIS | O125: PEACOCK | R125: IRVING
A126: BOX HILL | C126: LIVINGSTONE | F126: BADROCK | I126: GREIG | L126: WILKINSON | O126: BOURKE | R126: DALY | W126: SANDRINGHAM | X126: 3 | Y126: 0 | Z126: 0 | AA126: 492 | AB126: 168 | AC126: =(AA126/AB126)*100 -> 292.85714285714283 | AD126: =(X126*4)+(Z126*2) -> 12
A127: GOALKICKERS | P127: HALPHEN | W127: SPRINGVALE | X127: 3 | Y127: 0 | Z127: 0 | AA127: 388 | AB127: 276 | AC127: =(AA127/AB127)*100 -> 140.57971014492753 | AD127: =(X127*4)+(Z127*2) -> 12
A128: SPRINGVALE | C128: PHILLIPS 5 | F128: EVANS 4 | H128: CARIS 2 | J128: KNIGHT 2 | L128: FOGARTY 2 | O128: CAPSALIS | Q128: MONTGOMERY | W128: BOX HILL | X128: 2 | Y128: 1 | Z128: 0 | AA128: 363 | AB128: 287 | AC128: =(AA128/AB128)*100 -> 126.4808362369338 | AD128: =(X128*4)+(Z128*2) -> 8
A129: BOX HILL | C129: WILKINSON 4 | F129: DALY 2 | H129: EVANS 2 | J129: JAMES 2 | L129: TREWELLA 2 | O129: LIVINGSTONE 2 | R129: BOURKE | W129: OAKLEIGH | X129: 2 | Y129: 1 | Z129: 0 | AA129: 276 | AB129: 253 | AC129: =(AA129/AB129)*100 -> 109.09090909090908 | AD129: =(X129*4)+(Z129*2) -> 8
D130: 1ST MAY | I130: WEATHER | O130: D ROWE | W130: PORT MELBOURNE | X130: 2 | Y130: 1 | Z130: 0 | AA130: 346 | AB130: 340 | AC130: =(AA130/AB130)*100 -> 101.76470588235293 | AD130: =(X130*4)+(Z130*2) -> 8
A131: PORT MELBOURNE | C131: 6 | D131: 5 | E131: =(C131*6)+D131 -> 41 | G131: 10 | H131: 12 | I131: =(G131*6)+H131 -> 72 | K131: 14 | L131: 15 | M131: =(K131*6)+L131 -> 99 | O131: 20 | P131: 19 | Q131: 139 | S131: Venue: PORT MELBOURNE
A132: PRAHRAN | C132: 3 | D132: 2 | E132: =(C132*6)+D132 -> 20 | G132: 8 | H132: 6 | I132: =(G132*6)+H132 -> 54 | K132: 12 | L132: 8 | M132: =(K132*6)+L132 -> 80 | O132: 13 | P132: 14 | Q132: 92 | W132: PRESTON | X132: 2 | Y132: 1 | Z132: 0 | AA132: 277 | AB132: 296 | AC132: =(AA132/AB132)*100 -> 93.581081081081081 | AD132: =(X132*4)+(Z132*2) -> 8
A133: BEST PLAYERS | W133: DANDEN0NG | X133: 2 | Y133: 1 | Z133: 0 | AA133: 312 | AB133: 394 | AC133: =(AA133/AB133)*100 -> 79.187817258883257 | AD133: =(X133*4)+(Z133*2) -> 8
A134: PORT MELBOURNE | C134: CAMERON | F134: S BOWDEN | I134: R BOWDEN | L134: JONES | O134: FRANKEN | R134: SEXTON | W134: WERRIBEE | X134: 1 | Y134: 2 | Z134: 0 | AA134: 346 | AB134: 319 | AC134: =(AA134/AB134)*100 -> 108.4639498432602 | AD134: =(X134*4)+(Z134*2) -> 4
A135: PRAHRAN | C135: LUCAS | F135: SUCKLING | I135: KEIPERT | L135: WALFORD | O135: SINNI | R135: TUDDENHAM | W135: PRAHRAN | X135: 1 | Y135: 2 | Z135: 0 | AA135: 296 | AB135: 408 | AC135: =(AA135/AB135)*100 -> 72.549019607843135 | AD135: =(X135*4)+(Z135*2) -> 4
A136: GOALKICKERS | P136: CLOHESY | W136: FRANKSTON | X136: 0 | Y136: 3 | Z136: 0 | AA136: 232 | AB136: 341 | AC136: =(AA136/AB136)*100 -> 68.035190615835774 | AD136: =(X136*4)+(Z136*2) -> 0
A137: PORT MELBOURNE | C137: JONES 5 | F137: S BOWDEN 4 | I137: SEXTON 3 | K137: BAILEY 2 | M137: HICKS 2 | O137: TARCZON | Q137: JAMES | S137: DONALD | W137: COBURG | X137: 0 | Y137: 3 | Z137: 0 | AA137: 235 | AB137: 355 | AC137: =(AA137/AB137)*100 -> 66.197183098591552 | AD137: =(X137*4)+(Z137*2) -> 0
A138: PRAHRAN | C138: KEIPERT 6 | F138: PARSONS 3 | I138: SINNI 2 | K138: PANG | M138: HARTMAN | W138: WILLIAMSTOWN | X138: 0 | Y138: 3 | Z138: 0 | AA138: 235 | AB138: 361 | AC138: =(AA138/AB138)*100 -> 65.096952908587255 | AD138: =(X138*4)+(Z138*2) -> 0
A140: SANDRINGHAM | C140: 4 | D140: 6 | E140: =(C140*6)+D140 -> 30 | G140: 10 | H140: 9 | I140: =(G140*6)+H140 -> 69 | K140: 15 | L140: 12 | M140: =(K140*6)+L140 -> 102 | O140: 25 | P140: 16 | Q140: 166 | S140: Venue: BEACH ROAD
A141: PRESTON | C141: 2 | D141: 3 | E141: =(C141*6)+D141 -> 15 | G141: 5 | H141: 6 | I141: =(G141*6)+H141 -> 36 | K141: 7 | L141: 9 | M141: =(K141*6)+L141 -> 51 | O141: 9 | P141: 11 | Q141: 65 | S141: WENN :HEASLEY
A142: BEST PLAYERS
A143: SANDRINGHAM | C143: MOLONEY | F143: WILLIAMS | I143: FOLEY | L143: GARRETT | O143: LAMBERT | R143: CROUGH
A144: PRESTON | C144: WALKER | F144: TAYLOR | I144: DUNBAR | L144: MUNRIVANA
A145: GOALKICKERS
A146: SANDRINGHAM | C146: GORIZIDIS 7 | F146: GARRETT 6 | I146: HERMAN 3 | K146: FOLEY 2 | M146: KELLOWAY 2 | P146: McMASTER 2 | S146: MACGEORGE | W146: MITCHELSON | Y146: WINTON
A147: PRESTON | C147: DUPUY 2 | F147: CARELLI 2 | I147: PEZZIN 2 | K147: KING 2 | M147: MAY
A149: WERRIBEE | C149: 3 | D149: 2 | E149: =(C149*6)+D149 -> 20 | G149: 6 | H149: 7 | I149: =(G149*6)+H149 -> 43 | K149: 11 | L149: 9 | M149: =(K149*6)+L149 -> 75 | O149: 17 | P149: 14 | Q149: 116 | S149: Venue: WERRIBEE
A150: FRANKSTON | C150: 6 | D150: 3 | E150: =(C150*6)+D150 -> 39 | G150: 7 | H150: 4 | I150: =(G150*6)+H150 -> 46 | K150: 9 | L150: 5 | M150: =(K150*6)+L150 -> 59 | O150: 11 | P150: 8 | Q150: 74
A151: BEST PLAYERS
A152: WERRIBEE | C152: SAUNDERS | F152: SMITH | I152: P BALLAN | L152: WRIGHT | O152: MAY
A153: FRANKSTON | C153: D RYAN | F153: G O'NEILL | I153: VERBEEK | L153: GAHAN | O153: BOONKAMP
A154: GOALKICKERS
A155: WERRIBEE | C155: SMITH 8 | F155: WRIGHT 3 | I155: EAMES 2 | K155: RAEBURN 2 | N155: McDONALD | Q155: McMASTER
A156: FRANKSTON | C156: M RYAN 3 | F156: VERBEEK 2 | I156: G O'NEILL 2 | L156: BOWEY 2 | N156: S HAMILL | Q156: GOOSEY
A158: DANDENONG | C158: 7 | D158: 1 | E158: =(C158*6)+D158 -> 43 | G158: 12 | H158: 3 | I158: =(G158*6)+H158 -> 75 | K158: 18 | L158: 5 | M158: =(K158*6)+L158 -> 113 | O158: 23 | P158: 5 | Q158: 143 | S158: Venue: DANDENONG
A159: WILLIAMSTOWN | C159: 0 | D159: 1 | E159: =(C159*6)+D159 -> 1 | G159: 1 | H159: 7 | I159: =(G159*6)+H159 -> 13 | K159: 8 | L159: 9 | M159: =(K159*6)+L159 -> 57 | O159: 14 | P159: 14 | Q159: 98
A160: BEST PLAYERS
A161: DANDENONG | C161: LACKO | F161: HALL | I161: L TAYLOR | L161: BARWICK | O161: SALIBA | R161: MARSHALL
A162: WILLIAMSTOWN | C162: MITCHELL | F162: WEST | I162: TURCINOVICH | L162: WILLIAMS | O162: HOWLETT
A163: GOALKICKERS
A164: DANDENONG | C164: PRETTO 8 | F164: BARWICK 5 | I164: L TAYLOR 3 | L164: CLIFFORD 2 | O164: MORRISON 2 | R164: CHARLES | U164: MEAD | W164: MILLIGAN
A165: WILLIAMSTOWN | C165: TURCINOVICH 7 | F165: HOUGH | H165: BARROW | J165: ARCIERI | L165: PASTORE | N165: GHAZI | P165: WILLIAMS | R165: ZAMKYL
A167: OAKLEIGH | C167: 4 | D167: 8 | E167: =(C167*6)+D167 -> 32 | G167: 6 | H167: 10 | I167: =(G167*6)+H167 -> 46 | K167: 10 | L167: 10 | M167: =(K167*6)+L167 -> 70 | O167: 15 | P167: 16 | Q167: 106 | S167: Venue: COBURG
A168: COBURG | C168: 0 | D168: 4 | E168: =(C168*6)+D168 -> 4 | G168: 5 | H168: 8 | I168: =(G168*6)+H168 -> 38 | K168: 11 | L168: 13 | M168: =(K168*6)+L168 -> 79 | O168: 12 | P168: 15 | Q168: 87
A169: BEST PLAYERS
A170: OAKLEIGH | C170: GARBUIO | F170: RE STUBBS | I170: BRIGGS | L170: BICKNELL | O170: AUBREY | R170: SAUNDERS
A171: COBURG | C171: BAKER | F171: DAVID | I171: SALVADORE | L171: TARANTO | O171: BERGER
A172: GOALKICKERS
A173: OAKLEIGH | C173: DALE 3 | E173: MELLODY 2 | H173: TOPAKIS 2 | K173: MORELAND 2 | N173: QUIRK | P173: COGHLAN | R173: D STUBBS | U173: SMITH | W173: COURTNEY | Y173: HAZELL
A174: COBURG | C174: BERGER 4 | F174: SALVADORE 2 | I174: MOORFIELD 2 | L174: BAKER | N174: FITZPATRICK | Q174: TARANTO | S174: EVANS
A176: ROUND 4 | D176: 7TH MAY | I176: WEATHER
D177: 1ST QTR | H177: 2ND QTR | L177: 3RD QTR | P177: FINAL | S177: Venue: PRESTON
A178: DANDENONG | C178: 3 | D178: 4 | E178: =(C178*6)+D178 -> 22 | G178: 11 | H178: 8 | I178: =(G178*6)+H178 -> 74 | K178: 13 | L178: 12 | M178: =(K178*6)+L178 -> 90 | O178: 20 | P178: 16 | Q178: 136 | S178: UMPIRES | Y178: LADDER | AB178: ROUND | AD178: 4
A179: PRESTON | C179: 4 | D179: 0 | E179: =(C179*6)+D179 -> 24 | G179: 7 | H179: 5 | I179: =(G179*6)+H179 -> 47 | K179: 11 | L179: 8 | M179: =(K179*6)+L179 -> 74 | O179: 14 | P179: 10 | Q179: 94
A180: BEST PLAYERS | W180: TEAM | X180: W | Y180: L | Z180: D | AA180: FOR | AB180: AGST | AC180: % | AD180: PTS
A181: DANDENONG | C181: MILLIGAN | F181: HALL | I181: LACKO | L181: MILLANE | O181: FOSTER | Q181: CHARLES
A182: PRESTON | C182: CARELLI | F182: MUNRIVANA | I182: McWATTERS | L182: DOBBS | W182: SANDRINGHAM | X182: 4 | Y182: 0 | Z182: 0 | AA182: 658 | AB182: 198 | AC182: =(AA182/AB182)*100 -> 332.32323232323233 | AD182: =(X182*4)+(Z182*2) -> 16
A183: GOALKICKERS | P183: HALL | R183: SCOTT | W183: SPRINGVALE | X183: 3 | Y183: 1 | Z183: 0 | AA183: 445 | AB183: 355 | AC183: =(AA183/AB183)*100 -> 125.35211267605635 | AD183: =(X183*4)+(Z183*2) -> 12
A184: DANDENONG | C184: BARWICK 6 | F184: PRETTO 4 | I184: CLIFFORD 3 | L184: MEAD 2 | N184: MILLANE 2 | Q184: ANDERSON | W184: DANDEN0NG | X184: 3 | Y184: 1 | Z184: 0 | AA184: 448 | AB184: 488 | AC184: =(AA184/AB184)*100 -> 91.803278688524586 | AD184: =(X184*4)+(Z184*2) -> 12
A185: PRESTON | C185: CARELLI 6 | F185: McWATTERS 4 | I185: DUPUY | K185: TAYLOR | M185: MAY | O185: ESPENSCHIED | W185: BOX HILL | X185: 2 | Y185: 2 | Z185: 0 | AA185: 434 | AB185: 377 | AC185: =(AA185/AB185)*100 -> 115.11936339522546 | AD185: =(X185*4)+(Z185*2) -> 8
D186: 8TH MAY | I186: WEATHER | W186: WERRIBEE | X186: 2 | Y186: 2 | Z186: 0 | AA186: 425 | AB186: 376 | AC186: =(AA186/AB186)*100 -> 113.03191489361701 | AD186: =(X186*4)+(Z186*2) -> 8
A187: PRAHRAN | C187: 4 | D187: 3 | E187: =(C187*6)+D187 -> 27 | G187: 7 | H187: 9 | I187: =(G187*6)+H187 -> 51 | K187: 9 | L187: 14 | M187: =(K187*6)+L187 -> 68 | O187: 12 | P187: 18 | Q187: 90 | S187: Venue: BOX HILL | W187: PORT MELBOURNE | X187: 2 | Y187: 2 | Z187: 0 | AA187: 451 | AB187: 459 | AC187: =(AA187/AB187)*100 -> 98.257080610021788 | AD187: =(X187*4)+(Z187*2) -> 8
A188: BOX HILL | C188: 5 | D188: 1 | E188: =(C188*6)+D188 -> 31 | G188: 7 | H188: 3 | I188: =(G188*6)+H188 -> 45 | K188: 8 | L188: 4 | M188: =(K188*6)+L188 -> 52 | O188: 11 | P188: 5 | Q188: 71 | W188: PRESTON | X188: 2 | Y188: 2 | Z188: 0 | AA188: 371 | AB188: 432 | AC188: =(AA188/AB188)*100 -> 85.879629629629633 | AD188: =(X188*4)+(Z188*2) -> 8
A189: BEST PLAYERS | W189: PRAHRAN | X189: 2 | Y189: 2 | Z189: 0 | AA189: 386 | AB189: 479 | AC189: =(AA189/AB189)*100 -> 80.584551148225472 | AD189: =(X189*4)+(Z189*2) -> 8
A190: PRAHRAN | C190: LENNOX | F190: JAMES | I190: PARSONS | L190: LUCAS | O190: SUCKLING | Q190: TUDDENHAM | W190: OAKLEIGH | X190: 2 | Y190: 2 | Z190: 0 | AA190: 306 | AB190: 419 | AC190: =(AA190/AB190)*100 -> 73.031026252983295 | AD190: =(X190*4)+(Z190*2) -> 8
A191: BOX HILL | C191: LIVINGSTONE | F191: BOURKE | I191: EVANS | L191: BANFIELD | O191: SWAN | W191: FRANKSTON | X191: 1 | Y191: 3 | Z191: 0 | AA191: 351 | AB191: 446 | AC191: =(AA191/AB191)*100 -> 78.699551569506738 | AD191: =(X191*4)+(Z191*2) -> 4
A192: GOALKICKERS | W192: WILLIAMSTOWN | X192: 1 | Y192: 3 | Z192: 0 | AA192: 310 | AB192: 428 | AC192: =(AA192/AB192)*100 -> 72.429906542056074 | AD192: =(X192*4)+(Z192*2) -> 4
A193: PRAHRAN | C193: KEIPERT 4 | F193: TUDDENHAM 4 | I193: MARTELLO | K193: LENNOX | M193: PARSONS | O193: McLAUGHLIN | W193: COBURG | X193: 0 | Y193: 4 | Z193: 0 | AA193: 302 | AB193: 430 | AC193: =(AA193/AB193)*100 -> 70.232558139534888 | AD193: =(X193*4)+(Z193*2) -> 0
A194: BOX HILL | C194: WILKINSON 4 | F194: HEANEY 2 | I194: CROWLEY | K194: DALY | M194: KELLY | O194: LIVINGSTONE | R194: JAMES
A196: WILLIAMSTOWN | C196: 2 | D196: 9 | E196: =(C196*6)+D196 -> 21 | G196: 4 | H196: 12 | I196: =(G196*6)+H196 -> 36 | K196: 5 | L196: 17 | M196: =(K196*6)+L196 -> 47 | O196: 9 | P196: 21 | Q196: 75 | S196: Venue: COBURG
A197: COBURG | C197: 1 | D197: 3 | E197: =(C197*6)+D197 -> 9 | G197: 3 | H197: 4 | I197: =(G197*6)+H197 -> 22 | K197: 7 | L197: 7 | M197: =(K197*6)+L197 -> 49 | O197: 10 | P197: 7 | Q197: 67
A198: BEST PLAYERS
A199: WILLIAMSTOWN | C199: MITCHELL | F199: HOWLETT | I199: ARCIERI | L199: GHAZI | O199: DOOLEY
A200: COBURG | C200: O'MEARA | F200: ALESSIO | I200: BAKER | L200: FITZPATRICK | O200: DAVID
A201: GOALKICKERS
A202: WILLIAMSTOWN | C202: CARRICK 3 | F202: TURCINOVICH 2 | I202: PASTORE 2 | L202: BARROW | N202: ARCIERI
A203: COBURG | C203: BERGER 2 | F203: NICOLAOU 2 | I203: FITZPATRICK | L203: SALVADORE | O203: EVANS | Q203: FRASER | S203: TARANTO | V203: DORIAN
A205: FRANKSTON | C205: 5 | D205: 4 | E205: =(C205*6)+D205 -> 34 | G205: 9 | H205: 5 | I205: =(G205*6)+H205 -> 59 | K205: 14 | L205: 9 | M205: =(K205*6)+L205 -> 93 | O205: 18 | P205: 11 | Q205: 119 | S205: Venue: FRANKSTON
A206: PORT MELBOURNE | C206: 0 | D206: 1 | E206: =(C206*6)+D206 -> 1 | G206: 11 | H206: 5 | I206: =(G206*6)+H206 -> 71 | K206: 11 | L206: 8 | M206: =(K206*6)+L206 -> 74 | O206: 15 | P206: 15 | Q206: 105
A207: BEST PLAYERS
A208: FRANKSTON | C208: FIDGE | F208: D RYAN | I208: K LIELNORS | L208: POLLOCK | O208: WILLIAMS | R208: S HAMILL
A209: PORT MELBOURNE | C209: K BOWDEN | F209: BAILEY | I209: R BOWDEN | L209: CAMERON | O209: CLOHESY | R209: SEXTON
A210: GOALKICKERS
A211: FRANKSTON | C211: FIDGE 8 | E211: VERBEEK 4 | H211: WINKEL 2 | J211: M RYAN | L211: WILLIAMS | N211: BOWEY | P211: MOORE
A212: PORT MELBOURNE | C212: LOVE 3 | E212: HICKS 3 | G212: S BOWDEN 2 | J212: SEXTON 2 | L212: BAILEY | N212: JONES | P212: K BOWDEN | R212: McGEE | T212: MUENCH
A214: SANDRINGHAM | C214: 2 | D214: 4 | E214: =(C214*6)+D214 -> 16 | G214: 12 | H214: 8 | I214: =(G214*6)+H214 -> 80 | K214: 16 | L214: 12 | M214: =(K214*6)+L214 -> 108 | O214: 25 | P214: 16 | Q214: 166 | S214: Venue: OAKLEIGH
A215: OAKLEIGH | C215: 2 | D215: 6 | E215: =(C215*6)+D215 -> 18 | G215: 2 | H215: 6 | I215: =(G215*6)+H215 -> 18 | K215: 3 | L215: 9 | M215: =(K215*6)+L215 -> 27 | O215: 3 | P215: 12 | Q215: 30 | S215: GILES :McAULEY
A216: BEST PLAYERS
A217: SANDRINGHAM | C217: MITCHELSON | F217: MURRAY | I217: FOLEY | L217: BAILEY | O217: CZERKASKI | R217: McCRABB
A218: OAKLEIGH | C218: HAZELL | F218: GARBUIO | I218: RI STUBBS | L218: WICKS | O218: KAVANAGH
A219: GOALKICKERS
A220: SANDRINGHAM | C220: MITCHELSON 4 | F220: GARRETT 4 | I220: WINTON 4 | K220: MOLONEY 3 | N220: RUGOLO 2 | Q220: FOLEY 2 | S220: McMASTER 2 | W220: GORIZIDIS 2 | Y220: BAILEY | AA220: WILLIAMS
A221: OAKLEIGH | C221: MORELAND | F221: HAZELL | I221: COURTNEY
A223: WERRIBEE | C223: 2 | D223: 4 | E223: =(C223*6)+D223 -> 16 | G223: 5 | H223: 8 | I223: =(G223*6)+H223 -> 38 | K223: 8 | L223: 10 | M223: =(K223*6)+L223 -> 58 | O223: 11 | P223: 13 | Q223: 79 | S223: Venue: SPRINGVALE
A224: SPRINGVALE | C224: 3 | D224: 1 | E224: =(C224*6)+D224 -> 19 | G224: 5 | H224: 4 | I224: =(G224*6)+H224 -> 34 | K224: 6 | L224: 7 | M224: =(K224*6)+L224 -> 43 | O224: 8 | P224: 9 | Q224: 57
A225: BEST PLAYERS
A226: WERRIBEE | C226: RAEBURN | F226: SMITH | I226: MAY | L226: McMASTER | O226: M BALLAN
A227: SPRINGVALE | C227: PEACOCK | F227: CLARK | I227: DYSON-HOLLAND | L227: DELARUE | O227: CAPSALIS
A228: GOALKICKERS
A229: WERRIBEE | C229: AZIZ 3 | E229: SMITH 3 | G229: POWER 2 | I229: EAMES | K229: McDONALD | N229: McMASTER
A230: SPRINGVALE | C230: DYSON-HOLLAND 3 | G230: GOONAWARDENE | K230: DALRYMPLE | N230: FOGARTY | Q230: KNIGHT | S230: EVANS
A232: ROUND 5 | D232: 14TH MAY | I232: WEATHER
D233: 1ST QTR | H233: 2ND QTR | L233: 3RD QTR | P233: FINAL | S233: Venue: PORT MELBOURNE
A234: PORT MELBOURNE | C234: 4 | D234: 5 | E234: =(C234*6)+D234 -> 29 | G234: 6 | H234: 8 | I234: =(G234*6)+H234 -> 44 | K234: 13 | L234: 12 | M234: =(K234*6)+L234 -> 90 | O234: 15 | P234: 15 | Q234: 105 | S234: UMPIRES | Y234: LADDER | AB234: ROUND | AD234: 5
A235: SPRINGVALE | C235: 2 | D235: 1 | E235: =(C235*6)+D235 -> 13 | G235: 4 | H235: 1 | I235: =(G235*6)+H235 -> 25 | K235: 4 | L235: 12 | M235: =(K235*6)+L235 -> 36 | O235: 7 | P235: 18 | Q235: 60
A236: BEST PLAYERS | W236: TEAM | X236: W | Y236: L | Z236: D | AA236: FOR | AB236: AGST | AC236: % | AD236: PTS
A237: PORT MELBOURNE | C237: R BOWDEN | F237: CLOKE | I237: CAMERON | L237: BAILEY | O237: JAMES | Q237: S BOWDEN
A238: SPRINGVALE | C238: PHILLIPS | F238: CAPLES | I238: IRVING | L238: DELARUE | W238: SANDRINGHAM | X238: 5 | Y238: 0 | Z238: 0 | AA238: 829 | AB238: 235 | AC238: =(AA238/AB238)*100 -> 352.7659574468085 | AD238: =(X238*4)+(Z238*2) -> 20
A239: GOALKICKERS | Q239: DULMANIS | W239: DANDEN0NG | X239: 4 | Y239: 1 | Z239: 0 | AA239: 570 | AB239: 592 | AC239: =(AA239/AB239)*100 -> 96.28378378378379 | AD239: =(X239*4)+(Z239*2) -> 16
A240: PORT MELBOURNE | C240: MUENCH 3 | F240: R BOWDEN 2 | I240: JAMES 2 | K240: BAILEY 2 | M240: SEXTON 2 | O240: CLOKE | Q240: TARCZON | S240: HEHIR | W240: WERRIBEE | X240: 3 | Y240: 2 | Z240: 0 | AA240: 545 | AB240: 451 | AC240: =(AA240/AB240)*100 -> 120.84257206208426 | AD240: =(X240*4)+(Z240*2) -> 12
A241: SPRINGVALE | C241: PHILLIPS 5 | F241: EVANS | H241: DYSON-HOLLAND | W241: SPRINGVALE | X241: 3 | Y241: 2 | Z241: 0 | AA241: 505 | AB241: 460 | AC241: =(AA241/AB241)*100 -> 109.78260869565217 | AD241: =(X241*4)+(Z241*2) -> 12
D242: 15TH MAY | I242: WEATHER | S242: Venue: BEACH ROAD | W242: PORT MELBOURNE | X242: 3 | Y242: 2 | Z242: 0 | AA242: 556 | AB242: 519 | AC242: =(AA242/AB242)*100 -> 107.1290944123314 | AD242: =(X242*4)+(Z242*2) -> 12
A243: SANDRINGHAM | C243: 7 | D243: 4 | E243: =(C243*6)+D243 -> 46 | G243: 14 | H243: 9 | I243: =(G243*6)+H243 -> 93 | K243: 21 | L243: 14 | M243: =(K243*6)+L243 -> 140 | O243: 26 | P243: 15 | Q243: 171 | S243: FRAUMANO
A244: COBURG | C244: 0 | D244: 2 | E244: =(C244*6)+D244 -> 2 | G244: 1 | H244: 4 | I244: =(G244*6)+H244 -> 10 | K244: 1 | L244: 5 | M244: =(K244*6)+L244 -> 11 | O244: 5 | P244: 7 | Q244: 37 | S244: DAVIDSON | W244: BOX HILL | X244: 2 | Y244: 3 | Z244: 0 | AA244: 509 | AB244: 497 | AC244: =(AA244/AB244)*100 -> 102.41448692152917 | AD244: =(X244*4)+(Z244*2) -> 8
A245: BEST PLAYERS | W245: PRESTON | X245: 2 | Y245: 3 | Z245: 0 | AA245: 434 | AB245: 509 | AC245: =(AA245/AB245)*100 -> 85.265225933202359 | AD245: =(X245*4)+(Z245*2) -> 8
A246: SANDRINGHAM | C246: FOLEY | F246: GOROZIDS | I246: MOLONEY | L246: MITCHELSON | O246: LAMBERT | R246: KELLOWAY | W246: PRAHRAN | X246: 2 | Y246: 3 | Z246: 0 | AA246: 492 | AB246: 588 | AC246: =(AA246/AB246)*100 -> 83.673469387755105 | AD246: =(X246*4)+(Z246*2) -> 8
A247: COBURG | C247: ALESSIO | F247: DAVID | I247: MELIA | L247: SALVADORE | O247: PONIEWAZ | W247: FRANKSTON | X247: 2 | Y247: 3 | Z247: 0 | AA247: 460 | AB247: 552 | AC247: =(AA247/AB247)*100 -> 83.333333333333343 | AD247: =(X247*4)+(Z247*2) -> 8
A248: GOALKICKERS | W248: WILLIAMSTOWN | X248: 2 | Y248: 3 | Z248: 0 | AA248: 387 | AB248: 491 | AC248: =(AA248/AB248)*100 -> 78.818737270875758 | AD248: =(X248*4)+(Z248*2) -> 8
A249: SANDRINGHAM | C249: GOROZIDIS 13 | F249: McMASTER 4 | I249: MOREY 3 | K249: BAILEY 2 | M249: FOLEY | O249: MOLONEY | Q249: J RUGOLO | S249: WINTON | W249: OAKLEIGH | X249: 2 | Y249: 3 | Z249: 0 | AA249: 410 | AB249: 541 | AC249: =(AA249/AB249)*100 -> 75.785582255083185 | AD249: =(X249*4)+(Z249*2) -> 8
A250: COBURG | C250: MELIA 3 | F250: SALVADORE | I250: NICOLAOU | W250: COBURG | X250: 0 | Y250: 5 | Z250: 0 | AA250: 339 | AB250: 601 | AC250: =(AA250/AB250)*100 -> 56.405990016638938 | AD250: =(X250*4)+(Z250*2) -> 0
A252: WERRIBEE | C252: 2 | D252: 1 | E252: =(C252*6)+D252 -> 13 | G252: 7 | H252: 6 | I252: =(G252*6)+H252 -> 48 | K252: 14 | L252: 8 | M252: =(K252*6)+L252 -> 92 | O252: 18 | P252: 12 | Q252: 120 | S252: Venue: WERRIBEE
A253: BOX HILL | C253: 6 | D253: 3 | E253: =(C253*6)+D253 -> 39 | G253: 6 | H253: 4 | I253: =(G253*6)+H253 -> 40 | K253: 8 | L253: 6 | M253: =(K253*6)+L253 -> 54 | O253: 11 | P253: 9 | Q253: 75
A254: BEST PLAYERS
A255: WERRIBEE | C255: SMITH | F255: McMASTER | I255: P BALLAN | L255: POWER | O255: O'KEEFE | R255: MCDONALD
A256: BOX HILL | C256: LIVINGSTONE | F256: ZARAFA | I256: BANFIELD
A257: GOALKICKERS
A258: WERRIBEE | C258: SMITH 6 | F258: O'KEEFE 3 | I258: POWER 2 | K258: WRIGHT 2 | M258: TAYLOR 2 | O258: McDONALD | R258: AZIZ
A259: BOX HILL | C259: CROWLEY 4 | F259: BOURKE 2 | I259: WILKINSON 2 | L259: TREWELLA 2 | O259: ZARAFA
A261: WILLIAMSTOWN | C261: 2 | D261: 1 | E261: =(C261*6)+D261 -> 13 | G261: 5 | H261: 1 | I261: =(G261*6)+H261 -> 31 | K261: 7 | L261: 4 | M261: =(K261*6)+L261 -> 46 | O261: 11 | P261: 11 | Q261: 77 | S261: Venue: WILLIAMSTOWN
A262: PRESTON | C262: 4 | D262: 6 | E262: =(C262*6)+D262 -> 30 | G262: 7 | H262: 10 | I262: =(G262*6)+H262 -> 52 | K262: 7 | L262: 15 | M262: =(K262*6)+L262 -> 57 | O262: 8 | P262: 15 | Q262: 63
A263: BEST PLAYERS
A264: WILLIAMSTOWN | C264: WEST | F264: MACKAY | I264: WILLIAMS | L264: MITCHELL | O264: BARROW | R264: PASTORE
A265: PRESTON | C265: MORRISH | F265: BUCKLEY | I265: DOBBS | L265: BIZZOTTO
A266: GOALKICKERS
A267: WILLIAMSTOWN | C267: ARCIERI 3 | F267: BARROW 2 | I267: MACKAY 2 | L267: CARRICK | N267: ZAMKYL | P267: WILLIAMS | R267: MITCHELL
A268: PRESTON | C268: CARELLI 2 | F268: SMITH 2 | H268: BROWN 2 | J268: BUCKLEY | L268: KING
A270: DANDENONG | C270: 4 | D270: 9 | E270: =(C270*6)+D270 -> 33 | G270: 7 | H270: 14 | I270: =(G270*6)+H270 -> 56 | K270: 14 | L270: 17 | M270: =(K270*6)+L270 -> 101 | O270: 17 | P270: 20 | Q270: 122 | S270: Venue: DANDENONG
A271: OAKLEIGH | C271: 3 | D271: 2 | E271: =(C271*6)+D271 -> 20 | G271: 6 | H271: 4 | I271: =(G271*6)+H271 -> 40 | K271: 8 | L271: 9 | M271: =(K271*6)+L271 -> 57 | O271: 15 | P271: 14 | Q271: 104
A272: BEST PLAYERS
A273: DANDENONG | C273: MEAD | F273: HALL | I273: LACKO | L273: MOODY | O273: TAYLOR | R273: PRETTO
A274: OAKLEIGH | C274: MELLODY | F274: SAUNDERS | I274: YOUNG | L274: HAZELL | O274: RI STUBBS | R274: AUBURY
A275: GOALKICKERS
A276: DANDENONG | C276: PRETTO 9 | F276: BARWICK 3 | I276: CLIFFORD | K276: HALL | M276: SALIBA | O276: SCOTT | Q276: TAYLOR
A277: OAKLEIGH | C277: DALE 5 | F277: MELLODY 2 | I277: MORELAND 2 | L277: TOPAKIS 2 | O277: HAZELL | Q277: R STUBBS | S277: OWEN | U277: YOUNG
A279: FRANKSTON | C279: 8 | D279: 1 | E279: =(C279*6)+D279 -> 49 | G279: 11 | H279: 1 | I279: =(G279*6)+H279 -> 67 | K279: 14 | L279: 5 | M279: =(K279*6)+L279 -> 89 | O279: 17 | P279: 7 | Q279: 109 | S279: Venue: TOORAK PARK
A280: PRAHRAN | C280: 2 | D280: 4 | E280: =(C280*6)+D280 -> 16 | G280: 8 | H280: 8 | I280: =(G280*6)+H280 -> 56 | K280: 13 | L280: 11 | M280: =(K280*6)+L280 -> 89 | O280: 15 | P280: 16 | Q280: 106
A281: BEST PLAYERS
A282: FRANKSTON | C282: ESLER | F282: POLLOCK | I282: LANCE | L282: FIDGE | O282: WOOD | R282: WILLIAMS
A283: PRAHRAN | C283: HARTMAN | F283: KILEY | I283: LUCAS | L283: JAMES | O283: MORRISSEY | R283: LENNOX
A284: GOALKICKERS
A285: FRANKSTON | C285: FIDGE 7 | F285: WILLIAMS 4 | I285: VERBEEK 2 | K285: LIELNORS 2 | N285: T HAMILL | P285: WINKEL
A286: PRAHRAN | C286: KEIPERT 6 | F286: HARTMAN 3 | I286: TUDDENHAM 2 | L286: GOODALE | N286: LUCAS | P286: SINNI | R286: McLACHLAN
A288: ROUND 6 | D288: 21ST MAY | I288: WEATHER
D289: 1ST QTR | H289: 2ND QTR | L289: 3RD QTR | P289: FINAL | S289: Venue: WILLIAMSTOWN
A290: WILLIAMSTOWN | C290: 4 | D290: 0 | E290: =(C290*6)+D290 -> 24 | G290: 11 | H290: 3 | I290: =(G290*6)+H290 -> 69 | K290: 13 | L290: 4 | M290: =(K290*6)+L290 -> 82 | O290: 18 | P290: 9 | Q290: 117 | S290: UMPIRES | Y290: LADDER | AB290: ROUND | AD290: 6
A291: PRAHRAN | C291: 3 | D291: 4 | E291: =(C291*6)+D291 -> 22 | G291: 3 | H291: 6 | I291: =(G291*6)+H291 -> 24 | K291: 6 | L291: 9 | M291: =(K291*6)+L291 -> 45 | O291: 7 | P291: 13 | Q291: 55
A292: BEST PLAYERS | W292: TEAM | X292: W | Y292: L | Z292: D | AA292: FOR | AB292: AGST | AC292: % | AD292: PTS
A293: WILLIAMSTOWN | C293: PASTORE | F293: P DOOLEY | I293: GHAZI | L293: O'CONNOR | O293: ARCIERI | Q293: S LLOYD
A294: PRAHRAN | C294: MORRISSEY | F294: LUCAS | I294: CHAPPLE | L294: LENNOX | O294: HARTLAND | W294: SANDRINGHAM | X294: 5 | Y294: 1 | Z294: 0 | AA294: 899 | AB294: 349 | AC294: =(AA294/AB294)*100 -> 257.59312320916905 | AD294: =(X294*4)+(Z294*2) -> 20
A295: GOALKICKERS | P295: WILLIAMS | R295: MITCHELL | W295: DANDEN0NG | X295: 5 | Y295: 1 | Z295: 0 | AA295: 641 | AB295: 657 | AC295: =(AA295/AB295)*100 -> 97.564687975646876 | AD295: =(X295*4)+(Z295*2) -> 20
A296: WILLIAMSTOWN | C296: TURCINOVICH 4 | F296: PASTORE 4 | I296: ARCIERI 3 | K296: MACKAY | M296: CARRICK | O296: S LLOYD | Q296: GHAZI | W296: SPRINGVALE | X296: 4 | Y296: 2 | Z296: 0 | AA296: 639 | AB296: 492 | AC296: =(AA296/AB296)*100 -> 129.8780487804878 | AD296: =(X296*4)+(Z296*2) -> 16
A297: PRAHRAN | C297: TUDDENHAM 2 | F297: KEIPERT | H297: MARTELLO | K297: LUCAS | M297: CHAPPLE | O297: FRAY | W297: PORT MELBOURNE | X297: 4 | Y297: 2 | Z297: 0 | AA297: 670 | AB297: 589 | AC297: =(AA297/AB297)*100 -> 113.7521222410866 | AD297: =(X297*4)+(Z297*2) -> 16
D298: 22ND MAY | I298: WEATHER | W298: BOX HILL | X298: 3 | Y298: 3 | Z298: 0 | AA298: 679 | AB298: 552 | AC298: =(AA298/AB298)*100 -> 123.00724637681159 | AD298: =(X298*4)+(Z298*2) -> 12
A299: DANDENONG | C299: 0 | D299: 1 | E299: =(C299*6)+D299 -> 1 | G299: 3 | H299: 5 | I299: =(G299*6)+H299 -> 23 | K299: 7 | L299: 7 | M299: =(K299*6)+L299 -> 49 | O299: 10 | P299: 11 | Q299: 71 | S299: Venue: DANDENONG
A300: WERRIBEE | C300: 3 | D300: 4 | E300: =(C300*6)+D300 -> 22 | G300: 4 | H300: 9 | I300: =(G300*6)+H300 -> 33 | K300: 8 | L300: 9 | M300: =(K300*6)+L300 -> 57 | O300: 9 | P300: 11 | Q300: 65 | W300: WERRIBEE | X300: 3 | Y300: 3 | Z300: 0 | AA300: 610 | AB300: 522 | AC300: =(AA300/AB300)*100 -> 116.85823754789273 | AD300: =(X300*4)+(Z300*2) -> 12
A301: BEST PLAYERS | W301: PRESTON | X301: 3 | Y301: 3 | Z301: 0 | AA301: 554 | AB301: 590 | AC301: =(AA301/AB301)*100 -> 93.898305084745758 | AD301: =(X301*4)+(Z301*2) -> 12
A302: DANDENONG | C302: FOSTER | F302: SALIBA | I302: MYNOTT | L302: HALL | N302: MILLIGAN | Q302: ATKINSON | W302: WILLIAMSTOWN | X302: 3 | Y302: 3 | Z302: 0 | AA302: 509 | AB302: 546 | AC302: =(AA302/AB302)*100 -> 93.223443223443226 | AD302: =(X302*4)+(Z302*2) -> 12
A303: WERRIBEE | C303: SAUNDERS | F303: HARRINGTON | I303: MAY | L303: PULI | W303: FRANKSTON | X303: 2 | Y303: 4 | Z303: 0 | AA303: 541 | AB303: 672 | AC303: =(AA303/AB303)*100 -> 80.50595238095238 | AD303: =(X303*4)+(Z303*2) -> 8
A304: GOALKICKERS | W304: PRAHRAN | X304: 2 | Y304: 4 | Z304: 0 | AA304: 547 | AB304: 705 | AC304: =(AA304/AB304)*100 -> 77.588652482269509 | AD304: =(X304*4)+(Z304*2) -> 8
A305: DANDENONG | C305: HALL 3 | E305: ATKINSON 2 | H305: FOSTER 2 | K305: BARWICK | M305: PRETTO | O305: SALIBA | W305: OAKLEIGH | X305: 2 | Y305: 4 | Z305: 0 | AA305: 465 | AB305: 711 | AC305: =(AA305/AB305)*100 -> 65.400843881856545 | AD305: =(X305*4)+(Z305*2) -> 8
A306: WERRIBEE | C306: SMITH 3 | F306: AZIZ 3 | H306: O'KEEFE | J306: TAYLOR | L306: McDONALD | W306: COBURG | X306: 0 | Y306: 6 | Z306: 0 | AA306: 371 | AB306: 735 | AC306: =(AA306/AB306)*100 -> 50.476190476190474 | AD306: =(X306*4)+(Z306*2) -> 0
A308: SPRINGVALE | C308: 6 | D308: 2 | E308: =(C308*6)+D308 -> 38 | G308: 10 | H308: 8 | I308: =(G308*6)+H308 -> 68 | K308: 14 | L308: 10 | M308: =(K308*6)+L308 -> 94 | O308: 20 | P308: 14 | Q308: 134 | S308: Venue: COBURG
A309: COBURG | C309: 0 | D309: 3 | E309: =(C309*6)+D309 -> 3 | G309: 0 | H309: 4 | I309: =(G309*6)+H309 -> 4 | K309: 2 | L309: 5 | M309: =(K309*6)+L309 -> 17 | O309: 4 | P309: 8 | Q309: 32
A310: BEST PLAYERS
A311: SPRINGVALE | C311: HALPHEN | F311: SUTHERLAND | I311: IRVING | L311: PEACOCK | O311: KNIGHT | R311: CLARK
A312: COBURG | C312: FITZPATRICK | F312: BAKER | I312: ALESSIO | L312: WESTON | O312: O'MEARA
A313: GOALKICKERS
A314: SPRINGVALE | C314: CARIS 3 | E314: EVANS 3 | G314: PHILLIPS 2 | I314: LYNCH 2 | K314: DYSON-HOLLAND 2 | O314: HALPHEN 2 | Q314: DALE 2 | S314: DALRYMPLE | W314: ANTHONY | X314: FOGARTY | AA314: CHEEL
A315: COBURG | C315: BARCLAY 2 | F315: BAKER | H315: DAVID
A317: BOX HILL | C317: 5 | D317: 2 | E317: =(C317*6)+D317 -> 32 | G317: 13 | H317: 6 | I317: =(G317*6)+H317 -> 84 | K317: 21 | L317: 11 | M317: =(K317*6)+L317 -> 137 | O317: 26 | P317: 14 | Q317: 170 | S317: Venue: OAKLEIGH
A318: OAKLEIGH | C318: 3 | D318: 7 | E318: =(C318*6)+D318 -> 25 | G318: 6 | H318: 7 | I318: =(G318*6)+H318 -> 43 | K318: 7 | L318: 9 | M318: =(K318*6)+L318 -> 51 | O318: 7 | P318: 13 | Q318: 55
A319: BEST PLAYERS
A320: BOX HILL | C320: DALY | F320: TREWELLA | I320: O'NEILL | L320: LIVINGSTONE | O320: ZARAFA | R320: HEANEY
A321: OAKLEIGH | C321: SMITH | F321: BRIGGS | I321: MELLODY | L321: HAZELL | O321: MORELAND
A322: GOALKICKERS
A323: BOX HILL | C323: CROWLEY 6 | F323: DALY 5 | H323: TREWELLA 5 | K323: BOURKE 2 | M323: BADROCK | O323: COHEN | Q323: GREIG | S323: JAMES | U323: ROWE | W323: McBEAN | X323: LIVINGSTONE | AB323: ZARAFA
A324: OAKLEIGH | C324: MORELAND 2 | F324: TOPAKIS 2 | I324: HAZELL | K324: MELLODY | N324: DALE
A326: PRESTON | C326: 4 | D326: 5 | E326: =(C326*6)+D326 -> 29 | G326: 10 | H326: 5 | I326: =(G326*6)+H326 -> 65 | K326: 13 | L326: 7 | M326: =(K326*6)+L326 -> 85 | O326: 18 | P326: 12 | Q326: 120 | S326: Venue: PRESTON
A327: FRANKSTON | C327: 2 | D327: 0 | E327: =(C327*6)+D327 -> 12 | G327: 5 | H327: 4 | I327: =(G327*6)+H327 -> 34 | K327: 8 | L327: 4 | M327: =(K327*6)+L327 -> 52 | O327: 12 | P327: 9 | Q327: 81
A328: BEST PLAYERS
A329: PRESTON | C329: MUNRIVANA | F329: WALKER | I329: BIZZOTTO | L329: McWATTERS | O329: MORRISH | R329: DOBBS
A330: FRANKSTON | C330: WILLIAMS | F330: WINKEL | I330: VERBEEK
A331: GOALKICKERS
A332: PRESTON | C332: DUPUY 6 | F332: McWATTERS 5 | I332: MAY 2 | K332: PEZZIN 2 | M332: MUNRIVANA | P332: CARELLI | R332: KING
A333: FRANKSTON | C333: GOOSEY 3 | F333: VERBEEK 2 | I333: WILLIAMS 2 | K333: LIELNORS | M333: MACKAY | O333: VANDERMEER | R333: ESLER | T333: FIDGE
A335: PORT MELBOURNE | C335: 6 | D335: 5 | E335: =(C335*6)+D335 -> 41 | G335: 11 | H335: 5 | I335: =(G335*6)+H335 -> 71 | K335: 11 | L335: 8 | M335: =(K335*6)+L335 -> 74 | O335: 17 | P335: 12 | Q335: 114 | S335: Venue: BEACH ROAD
A336: SANDRINGHAM | C336: 2 | D336: 3 | E336: =(C336*6)+D336 -> 15 | G336: 5 | H336: 9 | I336: =(G336*6)+H336 -> 39 | K336: 8 | L336: 15 | M336: =(K336*6)+L336 -> 63 | O336: 9 | P336: 16 | Q336: 70 | S336: McKENZIE :McLAREN
A337: BEST PLAYERS
A338: PORT MELBOURNE | C338: HEHIR | F338: R BOWDEN | I338: JAMES | L338: CLOKE | O338: SHAW | R338: CLOHESY
A339: SANDRINGHAM | C339: FOLEY | F339: McCRABB | I339: CZERKASKI | L339: KELLAWAY | O339: MURRAY
A340: GOALKICKERS
A341: PORT MELBOURNE | C341: R BOWDEN 4 | F341: SEXTON 4 | I341: MUENCH 3 | K341: JAMES 2 | M341: BAILEY 2 | O341: K BOWDEN | R341: HEHIR
A342: SANDRINGHAM | C342: GOROZIDIS 4 | F342: BAILEY | H342: HERMAN | J342: MITCHELSON | M342: J RUGOLO | O342: WILLIAMS
A344: ROUND 7 | D344: 28TH MAY | I344: WEATHER | S344: Venue: WERRIBEE
D345: 1ST QTR | H345: 2ND QTR | L345: 3RD QTR | P345: FINAL | S345: UMPIRES
A346: SANDRINGHAM | C346: 7 | D346: 2 | E346: =(C346*6)+D346 -> 44 | G346: 9 | H346: 6 | I346: =(G346*6)+H346 -> 60 | K346: 14 | L346: 11 | M346: =(K346*6)+L346 -> 95 | O346: 19 | P346: 15 | Q346: 129 | S346: SERGOTA | Y346: LADDER | AB346: ROUND | AD346: 7
A347: WERRIBEE | C347: 4 | D347: 0 | E347: =(C347*6)+D347 -> 24 | G347: 7 | H347: 2 | I347: =(G347*6)+H347 -> 44 | K347: 10 | L347: 3 | M347: =(K347*6)+L347 -> 63 | O347: 13 | P347: 4 | Q347: 82 | S347: SERCIA
A348: BEST PLAYERS | W348: TEAM | X348: W | Y348: L | Z348: D | AA348: FOR | AB348: AGST | AC348: % | AD348: PTS
A349: SANDRINGHAM | C349: CROUGH | F349: FOLEY | I349: McCRABB | L349: MITCHELSON | O349: MURRAY | Q349: TARPEY
A350: WERRIBEE | C350: POWER | F350: LESIPUTTY | I350: WRIGHT | L350: CULLEN | O350: CORNWALL | W350: SANDRINGHAM | X350: 6 | Y350: 1 | Z350: 0 | AA350: 1028 | AB350: 431 | AC350: =(AA350/AB350)*100 -> 238.51508120649655 | AD350: =(X350*4)+(Z350*2) -> 24
A351: GOALKICKERS | M351: HERMAN | O351: WINTON | Q351: MACGEORGE | W351: DANDENONG | X351: 6 | Y351: 1 | Z351: 0 | AA351: 783 | AB351: 718 | AC351: =(AA351/AB351)*100 -> 109.05292479108635 | AD351: =(X351*4)+(Z351*2) -> 24
A352: SANDRINGHAM | C352: TARPEY 4 | E352: PEARCE 3 | G352: McMASTER 2 | J352: GARRETT 2 | M352: MITCHELSON 2 | P352: AMIET 2 | R352: FOLEY | W352: SPRINGVALE | X352: 5 | Y352: 2 | Z352: 0 | AA352: 788 | AB352: 556 | AC352: =(AA352/AB352)*100 -> 141.72661870503597 | AD352: =(X352*4)+(Z352*2) -> 20
A353: WERRIBEE | C353: BUTTON 3 | F353: WRIGHT 3 | I353: SMITH 2 | K353: POWER 2 | M353: SALTALAMACCHIA | Q353: CULLEN | W353: PORT MELBOURNE | X353: 5 | Y353: 2 | Z353: 0 | AA353: 825 | AB353: 667 | AC353: =(AA353/AB353)*100 -> 123.68815592203899 | AD353: =(X353*4)+(Z353*2) -> 20
D354: 29TH MAY | I354: WEATHER | O354: HARRINGTON | W354: BOX HILL | X354: 4 | Y354: 3 | Z354: 0 | AA354: 833 | AB354: 629 | AC354: =(AA354/AB354)*100 -> 132.43243243243242 | AD354: =(X354*4)+(Z354*2) -> 16
A355: SPRINGVALE | C355: 7 | D355: 5 | E355: =(C355*6)+D355 -> 47 | G355: 10 | H355: 9 | I355: =(G355*6)+H355 -> 69 | K355: 19 | L355: 20 | M355: =(K355*6)+L355 -> 134 | O355: 21 | P355: 23 | Q355: 149 | S355: Venue: SPRINGVALE
A356: PRESTON | C356: 3 | D356: 0 | E356: =(C356*6)+D356 -> 18 | G356: 6 | H356: 3 | I356: =(G356*6)+H356 -> 39 | K356: 6 | L356: 8 | M356: =(K356*6)+L356 -> 44 | O356: 9 | P356: 10 | Q356: 64 | W356: WERRIBEE | X356: 3 | Y356: 4 | Z356: 0 | AA356: 692 | AB356: 651 | AC356: =(AA356/AB356)*100 -> 106.29800307219661 | AD356: =(X356*4)+(Z356*2) -> 12
A357: BEST PLAYERS | W357: FRANKSTON | X357: 3 | Y357: 4 | Z357: 0 | AA357: 672 | AB357: 769 | AC357: =(AA357/AB357)*100 -> 87.386215864759436 | AD357: =(X357*4)+(Z357*2) -> 12
A358: SPRINGVALE | C358: DYSON-HOLLAND | F358: HALPHEN | I358: MORGAN | L358: EVANS | O358: KNIGHT | Q358: PEACOCK | W358: WILLIAMSTOWN | X358: 3 | Y358: 4 | Z358: 0 | AA358: 587 | AB358: 701 | AC358: =(AA358/AB358)*100 -> 83.737517831669038 | AD358: =(X358*4)+(Z358*2) -> 12
A359: PRESTON | C359: DOBBS | F359: WALKER | I359: KING | L359: CARELLI | W359: PRESTON | X359: 3 | Y359: 4 | Z359: 0 | AA359: 618 | AB359: 739 | AC359: =(AA359/AB359)*100 -> 83.626522327469559 | AD359: =(X359*4)+(Z359*2) -> 12
A360: GOALKICKERS | P360: MORGAN | W360: PRAHRAN | X360: 2 | Y360: 5 | Z360: 0 | AA360: 608 | AB360: 847 | AC360: =(AA360/AB360)*100 -> 71.782762691853591 | AD360: =(X360*4)+(Z360*2) -> 8
A361: SPRINGVALE | C361: EVANS 7 | E361: DYSON-HOLLAND 3 | I361: CARIS 3 | K361: PHILLIPS 2 | M361: HALPHEN 2 | O361: CAPSALIS | Q361: HALPHEN | S361: KOOP | W361: OAKLEIGH | X361: 2 | Y361: 5 | Z361: 0 | AA361: 562 | AB361: 842 | AC361: =(AA361/AB361)*100 -> 66.745843230403807 | AD361: =(X361*4)+(Z361*2) -> 8
A362: PRESTON | C362: CARELLI 4 | F362: DUPUY | H362: HOLT | J362: KING | L362: PEZZIN | N362: McWATTERS | W362: COBURG | X362: 0 | Y362: 7 | Z362: 0 | AA362: 448 | AB362: 889 | AC362: =(AA362/AB362)*100 -> 50.393700787401571 | AD362: =(X362*4)+(Z362*2) -> 0
A364: BOX HILL | C364: 5 | D364: 6 | E364: =(C364*6)+D364 -> 36 | G364: 11 | H364: 8 | I364: =(G364*6)+H364 -> 74 | K364: 20 | L364: 14 | M364: =(K364*6)+L364 -> 134 | O364: 23 | P364: 16 | Q364: 154 | S364: Venue: BOX HILL
A365: COBURG | C365: 1 | D365: 3 | E365: =(C365*6)+D365 -> 9 | G365: 4 | H365: 6 | I365: =(G365*6)+H365 -> 30 | K365: 6 | L365: 12 | M365: =(K365*6)+L365 -> 48 | O365: 10 | P365: 17 | Q365: 77
A366: BEST PLAYERS
A367: BOX HILL | C367: LIVINGSTONE | F367: DALY | I367: ZARAFA | L367: GREIG | O367: A QUINN | R367: O'NEILL
A368: COBURG | C368: O'MEARA | F368: LISTON | I368: TARANTO | L368: BAKER | O368: SALVADORE
A369: GOALKICKERS
A370: BOX HILL | C370: LIVINGSTONE 5 | F370: McBEAN 5 | I370: DALY 3 | K370: CROWLEY 2 | M370: D ROWE 2 | O370: TREWELLA 2 | R370: BOURKE | U370: ELLIS | W370: A QUINN | X370: STANTON
A371: COBURG | C371: BARCLAY 3 | F371: NICOLAOU 3 | I371: ALESSIO 2 | K371: TARANTO | M371: MOORFIELD
A373: FRANKSTON | C373: 4 | D373: 6 | E373: =(C373*6)+D373 -> 30 | G373: 9 | H373: 10 | I373: =(G373*6)+H373 -> 64 | K373: 14 | L373: 15 | M373: =(K373*6)+L373 -> 99 | O373: 19 | P373: 17 | Q373: 131 | S373: Venue: FRANKSTON
A374: OAKLEIGH | C374: 6 | D374: 2 | E374: =(C374*6)+D374 -> 38 | G374: 9 | H374: 4 | I374: =(G374*6)+H374 -> 58 | K374: 11 | L374: 9 | M374: =(K374*6)+L374 -> 75 | O374: 14 | P374: 13 | Q374: 97
A375: BEST PLAYERS
A376: FRANKSTON | C376: VANDERMEER | F376: MORWOOD | I376: VERBEEK | L376: ESLER | O376: LANCE | R376: WILLIAMS
A377: OAKLEIGH | C377: YOUNG | F377: MELLODY | I377: GARBUIO | L377: TOPAKIS | O377: R STUBBS | R377: AUBREY
A378: GOALKICKERS
A379: FRANKSTON | C379: GOOSEY 4 | E379: McKAY 4 | G379: MORWOOD 2 | J379: K LIELNORS 2 | M379: COCHRANE 2 | P379: LANCE 2 | R379: ESLER | T379: D LIELNORS | W379: T HAMILL
A380: OAKLEIGH | C380: DALE 3 | F380: R STUBBS 2 | I380: MORELAND 2 | L380: TOPAKIS 2 | N380: SMITH | P380: COURTNEY | R380: BICKNELL | U380: AUBREY | X380: GARBUIO
A382: PORT MELBOURNE | C382: 4 | D382: 5 | E382: =(C382*6)+D382 -> 29 | G382: 11 | H382: 9 | I382: =(G382*6)+H382 -> 75 | K382: 17 | L382: 15 | M382: =(K382*6)+L382 -> 117 | O382: 22 | P382: 23 | Q382: 155 | S382: Venue: PORT MELBOURNE
A383: WILLIAMSTOWN | C383: 2 | D383: 2 | E383: =(C383*6)+D383 -> 14 | G383: 3 | H383: 5 | I383: =(G383*6)+H383 -> 23 | K383: 8 | L383: 7 | M383: =(K383*6)+L383 -> 55 | O383: 11 | P383: 12 | Q383: 78
A384: BEST PLAYERS
A385: PORT MELBOURNE | C385: CLOHESY | F385: KING | I385: HEHIR | L385: HARKINS | O385: LAFFY | Q385: SEXTON
A386: WILLIAMSTOWN | C386: PASTORE | F386: GHAZI | I386: KOENIG | L386: CARRICK | O386: LLOYD | Q386: WILLIAMS
A387: GOALKICKERS
A388: PORT MELBOURNE | C388: SEXTON 6 | F388: LOCHEAD 5 | I388: KING 3 | K388: BOWDEN 2 | M388: TARCZON | O388: R BOWDEN | Q388: BAILEY | S388: McGEE | U388: HEHIR | W388: HARKINS
A389: WILLIAMSTOWN | C389: TURCINOVICH 4 | F389: WILLIAMS 2 | I389: PASTORE | K389: ZAMKYL | M389: SHANKS | O389: ARCIERI | Q389: GHAZI
A391: DANDENONG | C391: 5 | D391: 5 | E391: =(C391*6)+D391 -> 35 | G391: 8 | H391: 8 | I391: =(G391*6)+H391 -> 56 | K391: 15 | L391: 13 | M391: =(K391*6)+L391 -> 103 | O391: 21 | P391: 16 | Q391: 142 | S391: Venue: TOORAK PARK
A392: PRAHRAN | C392: 1 | D392: 0 | E392: =(C392*6)+D392 -> 6 | G392: 6 | H392: 2 | I392: =(G392*6)+H392 -> 38 | K392: 7 | L392: 4 | M392: =(K392*6)+L392 -> 46 | O392: 9 | P392: 7 | Q392: 61
A393: BEST PLAYERS
A394: DANDENONG | C394: CLIFFORD | F394: HALL | I394: MILLIGAN | L394: ATKINSON | O394: MILLANE | R394: L TAYLOR
A395: PRAHRAN | C395: W WALFORD | F395: LUCAS | I395: MORRISSEY | L395: LENNOX | O395: SCOTT-BRANAGAN | R395: GRAY
A396: GOALKICKERS
A397: DANDENONG | C397: PRETTO 8 | F397: BARWICK 6 | I397: L TAYLOR 2 | L397: ATKINSON | N397: CLIFFORD | P397: GILDER | R397: HALL | T397: LACKO
A398: PRAHRAN | C398: LENNOX 2 | F398: GRAY 2 | H398: McLACHLAN 2 | K398: KEIPERT | M398: TUDDENHAM | P398: W WALFORD
A400: ROUND 8 | D400: 4TH JUNE | I400: WEATHER
D401: 1ST QTR | H401: 2ND QTR | L401: 3RD QTR | P401: FINAL | S401: Venue: OAKLEIGH
A402: WERRIBEE | C402: 4 | D402: 2 | E402: =(C402*6)+D402 -> 26 | G402: 7 | H402: 5 | I402: =(G402*6)+H402 -> 47 | K402: 11 | L402: 13 | M402: =(K402*6)+L402 -> 79 | O402: 21 | P402: 16 | Q402: 142 | S402: UMPIRES | Y402: LADDER | AB402: ROUND | AD402: 8
A403: OAKLEIGH | C403: 5 | D403: 5 | E403: =(C403*6)+D403 -> 35 | G403: 14 | H403: 9 | I403: =(G403*6)+H403 -> 93 | K403: 16 | L403: 12 | M403: =(K403*6)+L403 -> 108 | O403: 18 | P403: 15 | Q403: 123
A404: BEST PLAYERS | W404: TEAM | X404: W | Y404: L | Z404: D | AA404: FOR | AB404: AGST | AC404: % | AD404: PTS
A405: WERRIBEE | C405: SMITH | F405: BUTTON | I405: RAEBURN | L405: RANKIN | O405: McDONALD | R405: POWER
A406: OAKLEIGH | C406: RE STUBBS | F406: GARBUIO | I406: YOUNG | L406: SMITH | O406: AUBREY | W406: SANDRINGHAM | X406: 7 | Y406: 1 | Z406: 0 | AA406: 1131 | AB406: 516 | AC406: =(AA406/AB406)*100 -> 219.18604651162789 | AD406: =(X406*4)+(Z406*2) -> 28
A407: GOALKICKERS | W407: DANDENONG | X407: 7 | Y407: 1 | Z407: 0 | AA407: 906 | AB407: 791 | AC407: =(AA407/AB407)*100 -> 114.5385587863464 | AD407: =(X407*4)+(Z407*2) -> 28
A408: WERRIBEE | C408: SMITH 12 | F408: AZIZ 3 | H408: POWER 2 | J408: RANKIN 2 | M408: RAEBURN | O408: CULLEN | W408: SPRINGVALE | X408: 6 | Y408: 2 | Z408: 0 | AA408: 878 | AB408: 631 | AC408: =(AA408/AB408)*100 -> 139.14421553090332 | AD408: =(X408*4)+(Z408*2) -> 24
A409: OAKLEIGH | C409: DALE 3 | E409: GARBUIO 3 | G409: MELLODY 2 | I409: MORELAND 2 | L409: RI STUBBS 2 | N409: AUBREY 2 | P409: YOUNG | R409: HAZELL | W409: PORT MELBOURNE | X409: 6 | Y409: 2 | Z409: 0 | AA409: 965 | AB409: 769 | AC409: =(AA409/AB409)*100 -> 125.48764629388816 | AD409: =(X409*4)+(Z409*2) -> 24
D410: 5TH JUNE | I410: WEATHER | L410: BRADLEY | N410: RE STUBBS | W410: BOX HILL | X410: 4 | Y410: 4 | Z410: 0 | AA410: 906 | AB410: 752 | AC410: =(AA410/AB410)*100 -> 120.47872340425532 | AD410: =(X410*4)+(Z410*2) -> 16
A411: PORT MELBOURNE | C411: 5 | D411: 3 | E411: =(C411*6)+D411 -> 33 | G411: 11 | H411: 5 | I411: =(G411*6)+H411 -> 71 | K411: 14 | L411: 10 | M411: =(K411*6)+L411 -> 94 | O411: 21 | P411: 14 | Q411: 140 | S411: Venue: PRESTON
A412: PRESTON | C412: 1 | D412: 0 | E412: =(C412*6)+D412 -> 6 | G412: 8 | H412: 6 | I412: =(G412*6)+H412 -> 54 | K412: 11 | L412: 11 | M412: =(K412*6)+L412 -> 77 | O412: 15 | P412: 12 | Q412: 102 | W412: WERRIBEE | X412: 4 | Y412: 4 | Z412: 0 | AA412: 834 | AB412: 774 | AC412: =(AA412/AB412)*100 -> 107.75193798449611 | AD412: =(X412*4)+(Z412*2) -> 16
A413: BEST PLAYERS | W413: FRANKSTON | X413: 3 | Y413: 5 | Z413: 0 | AA413: 757 | AB413: 872 | AC413: =(AA413/AB413)*100 -> 86.811926605504581 | AD413: =(X413*4)+(Z413*2) -> 12
A414: PORT MELBOURNE | C414: HEHIR | F414: DULLARD | I414: HARKINS | L414: SEXTON | O414: TARCZON | R414: K BOWDEN | W414: WILLIAMSTOWN | X414: 3 | Y414: 5 | Z414: 0 | AA414: 662 | AB414: 791 | AC414: =(AA414/AB414)*100 -> 83.691529709228831 | AD414: =(X414*4)+(Z414*2) -> 12
A415: PRESTON | C415: DOBBS | F415: KING | I415: WALKER | L415: CARELLI | O415: McWATTERS | R415: DUNCAN | W415: PRESTON | X415: 3 | Y415: 5 | Z415: 0 | AA415: 720 | AB415: 879 | AC415: =(AA415/AB415)*100 -> 81.911262798634809 | AD415: =(X415*4)+(Z415*2) -> 12
A416: GOALKICKERS | M416: DULLARD | O416: KLENJANS | Q416: CAMERON | W416: PRAHRAN | X416: 2 | Y416: 6 | Z416: 0 | AA416: 701 | AB416: 946 | AC416: =(AA416/AB416)*100 -> 74.101479915433401 | AD416: =(X416*4)+(Z416*2) -> 8
A417: PORT MELBOURNE | C417: SEXTON 4 | E417: TARCZON 4 | H417: LOCHEAD 3 | J417: FRANKEN 2 | M417: S BOWDEN 2 | P417: LOVE 2 | R417: BAILEY | W417: OAKLEIGH | X417: 2 | Y417: 6 | Z417: 0 | AA417: 685 | AB417: 984 | AC417: =(AA417/AB417)*100 -> 69.613821138211378 | AD417: =(X417*4)+(Z417*2) -> 8
A418: PRESTON | C418: McWATTERS 6 | F418: DUPUY 3 | H418: PEZZIN 2 | J418: WALKER | L418: ESPENSCHIED | O418: DOBBS | Q418: CARELLI | W418: COBURG | X418: 1 | Y418: 7 | Z418: 0 | AA418: 547 | AB418: 982 | AC418: =(AA418/AB418)*100 -> 55.70264765784114 | AD418: =(X418*4)+(Z418*2) -> 4
A420: SANDRINGHAM | C420: 1 | D420: 3 | E420: =(C420*6)+D420 -> 9 | G420: 7 | H420: 7 | I420: =(G420*6)+H420 -> 49 | K420: 12 | L420: 10 | M420: =(K420*6)+L420 -> 82 | O420: 15 | P420: 13 | Q420: 103 | S420: Venue: BEACH ROAD
A421: FRANKSTON | C421: 2 | D421: 4 | E421: =(C421*6)+D421 -> 16 | G421: 5 | H421: 7 | I421: =(G421*6)+H421 -> 37 | K421: 9 | L421: 10 | M421: =(K421*6)+L421 -> 64 | O421: 12 | P421: 13 | Q421: 85 | S421: SEXTON :GOODRIDGE
A422: BEST PLAYERS
A423: SANDRINGHAM | C423: McCRABB | F423: LAMBERT | I423: MACKENZIE | L423: WILLIAMS | O423: CROUGH | R423: CZERKASKI
A424: FRANKSTON | C424: VANDERMEER | F424: MARTIN | I424: MOORE | L424: VERBEEK | O424: WILLIAMS | R424: BROWN
A425: GOALKICKERS
A426: SANDRINGHAM | C426: GOROZIDIS 6 | F426: McMASTER 4 | I426: AMIET | K426: HERMAN | M426: MACGEORGE | P426: MOREY | R426: PEARCE
A427: FRANKSTON | C427: VERBEEK 3 | F427: G O'NEIL 2 | I427: K LIELNORS 2 | L427: WILLIAMS | N427: COCHRANE | Q427: MORWOOD | T427: ESLER | V427: D LIELNORS
A429: SPRINGVALE | C429: 2 | D429: 3 | E429: =(C429*6)+D429 -> 15 | G429: 5 | H429: 3 | I429: =(G429*6)+H429 -> 33 | K429: 8 | L429: 3 | M429: =(K429*6)+L429 -> 51 | O429: 14 | P429: 6 | Q429: 90 | S429: Venue: WILLIAMSTOWN
A430: WILLIAMSTOWN | C430: 2 | D430: 1 | E430: =(C430*6)+D430 -> 13 | G430: 5 | H430: 4 | I430: =(G430*6)+H430 -> 34 | K430: 9 | L430: 6 | M430: =(K430*6)+L430 -> 60 | O430: 11 | P430: 9 | Q430: 75
A431: BEST PLAYERS
A432: SPRINGVALE | C432: MORGAN | F432: CAPLES | I432: JEFFREY | L432: PHILLIPS | O432: IRVING | Q432: CHEEL
A433: WILLIAMSTOWN | C433: GHAZI | F433: SHEEHAN | I433: MINETT | L433: MITCHELL | O433: GOULD | Q433: ARCIERI
A434: GOALKICKERS
A435: SPRINGVALE | C435: BALDWIN 5 | F435: EVANS 3 | H435: KNIGHT 2 | J435: JEFFREY | L435: CARIS | N435: PHILLIPS | P435: GOONAWARDENE
A436: WILLIAMSTOWN | C436: TURCINOVICH 2 | F436: PASTORE 2 | I436: ARCIERI 2 | K436: LONG | M436: ZAMKYL | O436: SHANKS | Q436: GHAZI | S436: BUGEJA
A438: COBURG | C438: 4 | D438: 3 | E438: =(C438*6)+D438 -> 27 | G438: 8 | H438: 4 | I438: =(G438*6)+H438 -> 52 | K438: 12 | L438: 4 | M438: =(K438*6)+L438 -> 76 | O438: 15 | P438: 9 | Q438: 99 | S438: Venue: COBURG
A439: PRAHRAN | C439: 4 | D439: 3 | E439: =(C439*6)+D439 -> 27 | G439: 8 | H439: 5 | I439: =(G439*6)+H439 -> 53 | K439: 12 | L439: 9 | M439: =(K439*6)+L439 -> 81 | O439: 14 | P439: 9 | Q439: 93
A440: BEST PLAYERS
A441: COBURG | C441: TEAM EFFORT
A442: PRAHRAN | C442: LUCAS | F442: SAGDIC | I442: MORRISSEY | L442: GOODALE | O442: SUCKLING | R442: LENNOX
A443: GOALKICKERS
A444: COBURG | C444: NICOLAOU 5 | F444: ALESSIO 2 | I444: BARCLAY 2 | L444: SEMAAN 2 | O444: HUBBARD | Q444: DORIAN | S444: PONIEWAZ | V444: O'MEARA
A445: PRAHRAN | C445: LENNOX 4 | F445: KEIPERT 4 | I445: WALFORD 2 | L445: GOODALE | N445: LIGHT | P445: LUCAS | R445: HARTMAN
A447: DANDENONG | C447: 4 | D447: 3 | E447: =(C447*6)+D447 -> 27 | G447: 8 | H447: 6 | I447: =(G447*6)+H447 -> 54 | K447: 15 | L447: 8 | M447: =(K447*6)+L447 -> 98 | O447: 19 | P447: 9 | Q447: 123 | S447: Venue: DANDENONG
A448: BOX HILL | C448: 1 | D448: 4 | E448: =(C448*6)+D448 -> 10 | G448: 2 | H448: 6 | I448: =(G448*6)+H448 -> 18 | K448: 5 | L448: 10 | M448: =(K448*6)+L448 -> 40 | O448: 10 | P448: 13 | Q448: 73
A449: BEST PLAYERS
A450: DANDENONG | C450: LACKO | F450: MILLANE | I450: SALIBA | L450: BURNELL | O450: ATKINSON | R450: PARTINGTON
A451: BOX HILL | C451: HEANEY | F451: O'NEILL | I451: LISLE
A452: GOALKICKERS
A453: DANDENONG | C453: PRETTO 6 | E453: CLIFFORD 2 | H453: ATKINSON 2 | J453: CASSETT 2 | M453: HALL 2 | O453: D TAYLOR 2 | R453: L TAYLOR | U453: MEAD | W453: GILDER
A454: BOX HILL | C454: ERWIN 3 | F454: NICHOL 2 | H454: STANTON 2 | K454: CROWLEY | M454: TREWELLA | P454: ZARAFA
A456: ROUND 9 | D456: 11TH JUNE | I456: WEATHER
D457: 1ST QTR | H457: 2ND QTR | L457: 3RD QTR | P457: FINAL | S457: Venue: FRANKSTON
A458: FRANKSTON | C458: 6 | D458: 2 | E458: =(C458*6)+D458 -> 38 | G458: 12 | H458: 6 | I458: =(G458*6)+H458 -> 78 | K458: 16 | L458: 9 | M458: =(K458*6)+L458 -> 105 | O458: 20 | P458: 12 | Q458: 132 | S458: UMPIRES | Y458: LADDER | AB458: ROUND | AD458: 9
A459: DANDENONG | C459: 1 | D459: 4 | E459: =(C459*6)+D459 -> 10 | G459: 4 | H459: 5 | I459: =(G459*6)+H459 -> 29 | K459: 8 | L459: 9 | M459: =(K459*6)+L459 -> 57 | O459: 10 | P459: 10 | Q459: 70
A460: BEST PLAYERS | W460: TEAM | X460: W | Y460: L | Z460: D | AA460: FOR | AB460: AGST | AC460: % | AD460: PTS
A461: FRANKSTON | C461: LANCE | F461: BROWN | I461: ESLER | L461: VANDERMEER | O461: VERBEEK | Q461: RYAN
A462: DANDENONG | C462: MEAD | F462: SALIBA | I462: CASSETT | L462: TAYLOR | O462: FOSTER | Q462: GILDER | W462: SANDRINGHAM | X462: 7 | Y462: 2 | Z462: 0 | AA462: 1195 | AB462: 597 | AC462: =(AA462/AB462)*100 -> 200.16750418760466 | AD462: =(X462*4)+(Z462*2) -> 28
A463: GOALKICKERS | N463: MOORE | P463: ESLER | W463: SPRINGVALE | X463: 7 | Y463: 2 | Z463: 0 | AA463: 959 | AB463: 695 | AC463: =(AA463/AB463)*100 -> 137.98561151079136 | AD463: =(X463*4)+(Z463*2) -> 28
A464: FRANKSTON | C464: GARDNER 6 | E464: McKAY 5 | G464: D LIELNORS 2 | J464: WILLIAMS 2 | M464: K LIELNORS | P464: WOOD | R464: BROWN | W464: PORT MELBOURNE | X464: 7 | Y464: 2 | Z464: 0 | AA464: 1105 | AB464: 837 | AC464: =(AA464/AB464)*100 -> 132.01911589008364 | AD464: =(X464*4)+(Z464*2) -> 28
A465: DANDENONG | C465: PRETTO 4 | F465: CASSETT 2 | I465: HALL 2 | K465: CLIFFORD | M465: BURNELL | W465: DANDENONG | X465: 7 | Y465: 2 | Z465: 0 | AA465: 976 | AB465: 923 | AC465: =(AA465/AB465)*100 -> 105.7421451787649 | AD465: =(X465*4)+(Z465*2) -> 28
D466: 12TH JUNE | I466: WEATHER | W466: BOX HILL | X466: 5 | Y466: 4 | Z466: 0 | AA466: 1045 | AB466: 806 | AC466: =(AA466/AB466)*100 -> 129.65260545905707 | AD466: =(X466*4)+(Z466*2) -> 20
A467: WERRIBEE | C467: 3 | D467: 4 | E467: =(C467*6)+D467 -> 22 | G467: 10 | H467: 6 | I467: =(G467*6)+H467 -> 66 | K467: 15 | L467: 10 | M467: =(K467*6)+L467 -> 100 | O467: 16 | P467: 11 | Q467: 107 | S467: Venue: WERRIBEE
A468: COBURG | C468: 1 | D468: 1 | E468: =(C468*6)+D468 -> 7 | G468: 2 | H468: 5 | I468: =(G468*6)+H468 -> 17 | K468: 4 | L468: 6 | M468: =(K468*6)+L468 -> 30 | O468: 8 | P468: 9 | Q468: 57 | W468: WERRIBEE | X468: 5 | Y468: 4 | Z468: 0 | AA468: 941 | AB468: 831 | AC468: =(AA468/AB468)*100 -> 113.23706377858002 | AD468: =(X468*4)+(Z468*2) -> 20
A469: BEST PLAYERS | W469: FRANKSTON | X469: 4 | Y469: 5 | Z469: 0 | AA469: 889 | AB469: 942 | AC469: =(AA469/AB469)*100 -> 94.373673036093422 | AD469: =(X469*4)+(Z469*2) -> 16
A470: WERRIBEE | C470: AZIZ | F470: McDONALD | I470: M RYAN | L470: CULLEN | O470: CORNWELL | W470: PRESTON | X470: 3 | Y470: 6 | Z470: 0 | AA470: 793 | AB470: 953 | AC470: =(AA470/AB470)*100 -> 83.210912906610702 | AD470: =(X470*4)+(Z470*2) -> 12
A471: COBURG | C471: DAVID | F471: ALESSIO | I471: LISTON | L471: R O'MEARA | O471: DORIAN | Q471: ZIROS | W471: WILLIAMSTOWN | X471: 3 | Y471: 6 | Z471: 0 | AA471: 716 | AB471: 930 | AC471: =(AA471/AB471)*100 -> 76.989247311827953 | AD471: =(X471*4)+(Z471*2) -> 12
A472: GOALKICKERS | O472: SAUNDERS | W472: PRAHRAN | X472: 3 | Y472: 6 | Z472: 0 | AA472: 775 | AB472: 1019 | AC472: =(AA472/AB472)*100 -> 76.054955839057897 | AD472: =(X472*4)+(Z472*2) -> 12
A473: WERRIBEE | C473: SMITH 5 | E473: AZIZ 4 | G473: BUTTON 2 | I473: SALTALAMACCHIA | M473: WRIGHT | O473: NORMINGTON | R473: RYAN | W473: OAKLEIGH | X473: 2 | Y473: 7 | Z473: 0 | AA473: 753 | AB473: 1124 | AC473: =(AA473/AB473)*100 -> 66.992882562277572 | AD473: =(X473*4)+(Z473*2) -> 8
A474: COBURG | C474: NICOLAOU | F474: SEMAAN | H474: BARCLAY | J474: HAWKINS | M474: P O'MEARA | P474: PONIEWAZ | R474: EVANS | W474: COBURG | X474: 1 | Y474: 8 | Z474: 0 | AA474: 604 | AB474: 108 | AC474: =(AA474/AB474)*100 -> 559.25925925925924 | AD474: =(X474*4)+(Z474*2) -> 4
O475: ALESSIO
A476: BOX HILL | C476: 1 | D476: 2 | E476: =(C476*6)+D476 -> 8 | G476: 9 | H476: 9 | I476: =(G476*6)+H476 -> 63 | K476: 14 | L476: 11 | M476: =(K476*6)+L476 -> 95 | O476: 21 | P476: 13 | Q476: 139 | S476: Venue: BOX HILL
A477: WILLIAMSTOWN | C477: 2 | D477: 6 | E477: =(C477*6)+D477 -> 18 | G477: 3 | H477: 6 | I477: =(G477*6)+H477 -> 24 | K477: 5 | L477: 10 | M477: =(K477*6)+L477 -> 40 | O477: 7 | P477: 12 | Q477: 54
A478: BEST PLAYERS
A479: BOX HILL | C479: GREIG | F479: LIVINGSTONE | I479: HEANEY | L479: QUINN | O479: LISLE | R479: SWAN
A480: WILLIAMSTOWN | C480: B LLOYD | F480: MITCHELL | I480: GOULD | L480: GHAZI | O480: MINETT
A481: GOALKICKERS | M481: QUINN | O481: ROWE | Q481: STANTON | S481: TREWELLA
A482: BOX HILL | C482: WILKINSON 4 | F482: CROWLEY 2 | I482: HEANEY 2 | K482: LIVINGSTONE 2 | N482: SWAN 2 | P482: ZARAFA 2 | R482: COHEN | T482: ERWIN | V482: GREIG
A483: WILLIAMSTOWN | C483: BUGEJA 3 | F483: WEST | H483: ARCIERI | J483: MITCHELL | M483: BARROW
D484: 18TH JUNE | I484: WEATHER
A485: SPRINGVALE | C485: 5 | D485: 4 | E485: =(C485*6)+D485 -> 34 | G485: 8 | H485: 5 | I485: =(G485*6)+H485 -> 53 | K485: 9 | L485: 9 | M485: =(K485*6)+L485 -> 63 | O485: 12 | P485: 9 | Q485: 81 | S485: Venue: SPRINGVALE
A486: SANDRINGHAM | C486: 1 | D486: 1 | E486: =(C486*6)+D486 -> 7 | G486: 4 | H486: 5 | I486: =(G486*6)+H486 -> 29 | K486: 7 | L486: 6 | M486: =(K486*6)+L486 -> 48 | O486: 9 | P486: 10 | Q486: 64
A487: BEST PLAYERS
A488: SPRINGVALE | C488: PEACOCK | F488: MORGAN | I488: CAPLES | L488: PHILLIPS | O488: CAPSALIS | R488: EVANS
A489: SANDRINGHAM | C489: CROUGH | F489: FOLEY | I489: LAMBERT | L489: AMIET | O489: McCRABB | R489: MACKENZIE
A490: GOALKICKERS
A491: SPRINGVALE | C491: EVANS 4 | F491: PHILLIPS 3 | I491: BALDWIN 2 | L491: HALPHEN | N491: ANTHONY | Q491: DYSON-HOLLAND
A492: SANDRINGHAM | C492: AMIET 3 | F492: HERMAN 2 | I492: GOROZIDIS 2 | L492: MCMASTER | O492: MOREY
D493: 19TH JUNE | I493: WEATHER
A494: PORT MELBOURNE | C494: 4 | D494: 7 | E494: =(C494*6)+D494 -> 31 | G494: 7 | H494: 14 | I494: =(G494*6)+H494 -> 56 | K494: 13 | L494: 18 | M494: =(K494*6)+L494 -> 96 | O494: 19 | P494: 26 | Q494: 140 | S494: Venue: PORT MELBOURNE
A495: OAKLEIGH | C495: 1 | D495: 3 | E495: =(C495*6)+D495 -> 9 | G495: 3 | H495: 4 | I495: =(G495*6)+H495 -> 22 | K495: 6 | L495: 6 | M495: =(K495*6)+L495 -> 42 | O495: 10 | P495: 8 | Q495: 68
A496: BEST PLAYERS
A497: PORT MELBOURNE | C497: JAMES | F497: KLENJANS | I497: SEXTON | L497: HARKINS | O497: K BOWDEN
A498: OAKLEIGH | C498: YOUNG | F498: RI STUBBS | I498: SAUNDERS | L498: SIEBRAND | O498: D STUBBS | R498: SMITH
A499: GOALKICKERS
A500: PORT MELBOURNE | C500: LOVE 6 | E500: SEXTON 3 | G500: HARKINS 2 | I500: TARCZON | K500: S BOWDEN | M500: BAILEY | O500: JONES | Q500: K BOWDEN | T500: KLENJANS | W500: HEHIR | X500: DULMANIS
A501: OAKLEIGH | C501: MORELAND 3 | F501: YOUNG 2 | H501: AUBREY | J501: RE STUBBS | M501: RI STUBBS | O501: SMITH | Q501: GARBUIO
A503: PRAHRAN | C503: 3 | D503: 1 | E503: =(C503*6)+D503 -> 19 | G503: 7 | H503: 5 | I503: =(G503*6)+H503 -> 47 | K503: 8 | L503: 9 | M503: =(K503*6)+L503 -> 57 | O503: 10 | P503: 14 | Q503: 74 | S503: Venue: TOORAK PARK
A504: PRESTON | C504: 4 | D504: 4 | E504: =(C504*6)+D504 -> 28 | G504: 6 | H504: 6 | I504: =(G504*6)+H504 -> 42 | K504: 10 | L504: 7 | M504: =(K504*6)+L504 -> 67 | O504: 11 | P504: 7 | Q504: 73
A505: BEST PLAYERS
A506: PRAHRAN | C506: MORRISSEY | F506: SUCKLING | I506: CHAPPLE | L506: McLACHLAN | O506: ELLINGHAUS | R506: LUCAS
A507: PRESTON | C507: HARDENBERG | F507: REEVES | I507: DOLINKO | L507: BRYSON
A508: GOALKICKERS
A509: PRAHRAN | C509: KEIPERT 4 | F509: TUDDENHAM 2 | I509: McLACHLAN 2 | L509: SINNI | N509: LENNOX
A510: PRESTON | C510: KING 2 | E510: REEVES 2 | G510: DUPUY 2 | I510: CARELLI | K510: ESPENSCHIED | N510: IBRAHIM | P510: McWATTERS | S510: PEZZIN
A512: ROUND 10 | D512: 25TH JUNE | I512: WEATHER
D513: 1ST QTR | H513: 2ND QTR | L513: 3RD QTR | P513: FINAL | S513: Venue: DANDENONG
A514: DANDENONG | C514: 3 | D514: 4 | E514: =(C514*6)+D514 -> 22 | G514: 7 | H514: 10 | I514: =(G514*6)+H514 -> 52 | K514: 13 | L514: 13 | M514: =(K514*6)+L514 -> 91 | O514: 22 | P514: 20 | Q514: 152 | S514: UMPIRES | Y514: LADDER | AB514: ROUND | AD514: 10
A515: PORT MELBOURNE | C515: 7 | D515: 2 | E515: =(C515*6)+D515 -> 44 | G515: 10 | H515: 4 | I515: =(G515*6)+H515 -> 64 | K515: 11 | L515: 5 | M515: =(K515*6)+L515 -> 71 | O515: 16 | P515: 7 | Q515: 103
A516: BEST PLAYERS | W516: TEAM | X516: W | Y516: L | Z516: D | AA516: FOR | AB516: AGST | AC516: % | AD516: PTS
A517: DANDENONG | C517: MILLIGAN | F517: ATKINSON | I517: SALIBA | L517: MEAD | N517: PARTINGTON | Q517: L TAYLOR
A518: PORT MELBOURNE | C518: SEXTON | F518: S BOWDEN | I518: DULLARD | L518: HEHIR | N518: JAMES | W518: SANDRINGHAM | X518: 8 | Y518: 2 | Z518: 0 | AA518: 1395 | AB518: 666 | AC518: =(AA518/AB518)*100 -> 209.45945945945948 | AD518: =(X518*4)+(Z518*2) -> 32
A519: GOALKICKERS | W519: SPRINGVALE | X519: 8 | Y519: 2 | Z519: 0 | AA519: 1096 | AB519: 759 | AC519: =(AA519/AB519)*100 -> 144.40052700922266 | AD519: =(X519*4)+(Z519*2) -> 32
A520: DANDENONG | C520: PRETTO 6 | E520: BARWICK 5 | H520: CASSETT 4 | J520: CLIFFORD 3 | M520: SALIBA | O520: MEAD | Q520: ATKINSON | S520: L TAYLOR | W520: DANDENONG | X520: 8 | Y520: 2 | Z520: 0 | AA520: 1128 | AB520: 1026 | AC520: =(AA520/AB520)*100 -> 109.94152046783626 | AD520: =(X520*4)+(Z520*2) -> 32
A521: PORT MELBOURNE | C521: SEXTON 3 | E521: LOVE 3 | G521: BOYD 2 | I521: DONALD 2 | K521: JONES | M521: JAMES | O521: TARCZON | Q521: FRANKEN | S521: KLENJANS | W521: PORT MELBOURNE | X521: 7 | Y521: 3 | Z521: 0 | AA521: 1208 | AB521: 989 | AC521: =(AA521/AB521)*100 -> 122.14357937310413 | AD521: =(X521*4)+(Z521*2) -> 28
D522: 26TH JUNE | I522: WEATHER | P522: DULLARD | W522: BOX HILL | X522: 6 | Y522: 4 | Z522: 0 | AA522: 1153 | AB522: 880 | AC522: =(AA522/AB522)*100 -> 131.02272727272728 | AD522: =(X522*4)+(Z522*2) -> 24
A523: FRANKSTON | C523: 6 | D523: 7 | E523: =(C523*6)+D523 -> 43 | G523: 14 | H523: 13 | I523: =(G523*6)+H523 -> 97 | K523: 18 | L523: 15 | M523: =(K523*6)+L523 -> 123 | O523: 20 | P523: 19 | Q523: 139 | S523: Venue: COBURG
A524: COBURG | C524: 3 | D524: 4 | E524: =(C524*6)+D524 -> 22 | G524: 6 | H524: 8 | I524: =(G524*6)+H524 -> 44 | K524: 9 | L524: 14 | M524: =(K524*6)+L524 -> 68 | O524: 13 | P524: 16 | Q524: 94 | W524: WERRIBEE | X524: 5 | Y524: 5 | Z524: 0 | AA524: 999 | AB524: 908 | AC524: =(AA524/AB524)*100 -> 110.02202643171806 | AD524: =(X524*4)+(Z524*2) -> 20
A525: BEST PLAYERS | W525: FRANKSTON | X525: 5 | Y525: 5 | Z525: 0 | AA525: 1028 | AB525: 1036 | AC525: =(AA525/AB525)*100 -> 99.227799227799224 | AD525: =(X525*4)+(Z525*2) -> 20
A526: FRANKSTON | C526: D RYAN | F526: S HAMILL | I526: NAPOLI | L526: GARDNER | O526: LANCE | Q526: ESLER | W526: WILLIAMSTOWN | X526: 4 | Y526: 6 | Z526: 0 | AA526: 793 | AB526: 988 | AC526: =(AA526/AB526)*100 -> 80.26315789473685 | AD526: =(X526*4)+(Z526*2) -> 16
A527: COBURG | C527: ALESSIO | F527: P O'MEARA | I527: RACOVOLIS | L527: SALVADORE | O527: BAKER | W527: PRESTON | X527: 3 | Y527: 7 | Z527: 0 | AA527: 867 | AB527: 1061 | AC527: =(AA527/AB527)*100 -> 81.715362865221479 | AD527: =(X527*4)+(Z527*2) -> 12
A528: GOALKICKERS | W528: PRAHRAN | X528: 3 | Y528: 7 | Z528: 0 | AA528: 844 | AB528: 1219 | AC528: =(AA528/AB528)*100 -> 69.237079573420829 | AD528: =(X528*4)+(Z528*2) -> 12
A529: FRANKSTON | C529: GARDNER 7 | F529: NAPOLI 4 | H529: FIDGE 3 | J529: HAMILL 2 | L529: LIELNORS | N529: WOOD | P529: LANCE | R529: RYAN | W529: OAKLEIGH | X529: 2 | Y529: 8 | Z529: 0 | AA529: 817 | AB529: 1261 | AC529: =(AA529/AB529)*100 -> 64.789849325931797 | AD529: =(X529*4)+(Z529*2) -> 8
A530: COBURG | C530: ALESSIO 5 | F530: SALVADORE 2 | I530: P O'MEARA 2 | L530: GLENN 2 | N530: GRIFFITHS | Q530: BAKER | W530: COBURG | X530: 1 | Y530: 9 | Z530: 0 | AA530: 698 | AB530: 1228 | AC530: =(AA530/AB530)*100 -> 56.840390879478832 | AD530: =(X530*4)+(Z530*2) -> 4
A532: SPRINGVALE | C532: 5 | D532: 3 | E532: =(C532*6)+D532 -> 33 | G532: 9 | H532: 6 | I532: =(G532*6)+H532 -> 60 | K532: 14 | L532: 13 | M532: =(K532*6)+L532 -> 97 | O532: 20 | P532: 17 | Q532: 137 | S532: Venue: OAKLEIGH
A533: OAKLEIGH | C533: 2 | D533: 4 | E533: =(C533*6)+D533 -> 16 | G533: 5 | H533: 7 | I533: =(G533*6)+H533 -> 37 | K533: 8 | L533: 9 | M533: =(K533*6)+L533 -> 57 | O533: 9 | P533: 10 | Q533: 64
A534: BEST PLAYERS
A535: SPRINGVALE | C535: BALDWIN | F535: PHILLIPS | I535: WOODMAN | L535: KNIGHT | O535: CAPLES | R535: EVANS
A536: OAKLEIGH | C536: YOUNG | F536: SIEBRAND | I536: OPIE | L536: GARBUIO | O536: MELLODY
A537: GOALKICKERS
A538: SPRINGVALE | C538: EVANS 7 | E538: PHILLIPS 5 | H538: KNIGHT 4 | J538: CAPSALIS 2 | M538: HALPHEN | O538: DELARUE
A539: OAKLEIGH | C539: BRIGGS 2 | E539: GARBUIO 2 | H539: D STUBBS | J539: R STUBBS | M539: MORELAND | P539: DI NATALE | R539: BRADLEY
A541: BOX HILL | C541: 2 | D541: 5 | E541: =(C541*6)+D541 -> 17 | G541: 7 | H541: 8 | I541: =(G541*6)+H541 -> 50 | K541: 11 | L541: 13 | M541: =(K541*6)+L541 -> 79 | O541: 15 | P541: 18 | Q541: 108 | S541: Venue: PRESTON
A542: PRESTON | C542: 3 | D542: 3 | E542: =(C542*6)+D542 -> 21 | G542: 5 | H542: 6 | I542: =(G542*6)+H542 -> 36 | K542: 10 | L542: 8 | M542: =(K542*6)+L542 -> 68 | O542: 11 | P542: 8 | Q542: 74
A543: BEST PLAYERS
A544: BOX HILL | C544: O'NEILL | F544: SWAN | I544: WILKINSON | L544: LIVINGSTONE | O544: LISLE
A545: PRESTON | C545: DOBBS | F545: MORRISH | I545: DUNCAN | L545: MAY | O545: TAYLOR
A546: GOALKICKERS
A547: BOX HILL | C547: WILKINSON 6 | F547: CROWLEY 3 | I547: ERWIN 2 | K547: BOURKE | M547: COHEN | O547: LIVINGSTONE | R547: STANTON
A548: PRESTON | C548: DUPUY 2 | F548: TAYLOR 2 | I548: MUNRIVANA 2 | L548: WALKER 2 | O548: DUNCAN | Q548: MILLER | S548: ESPENSCHIED
A550: SANDRINGHAM | C550: 11 | D550: 9 | E550: =(C550*6)+D550 -> 75 | G550: 21 | H550: 10 | I550: =(G550*6)+H550 -> 136 | K550: 23 | L550: 13 | M550: =(K550*6)+L550 -> 151 | O550: 31 | P550: 14 | Q550: 200 | S550: Venue: BEACH ROAD
A551: PRAHRAN | C551: 2 | D551: 1 | E551: =(C551*6)+D551 -> 13 | G551: 3 | H551: 4 | I551: =(G551*6)+H551 -> 22 | K551: 8 | L551: 8 | M551: =(K551*6)+L551 -> 56 | O551: 9 | P551: 15 | Q551: 69 | S551: SEXTON :JONES
A552: BEST PLAYERS
A553: SANDRINGHAM | C553: MURRAY | F553: TARPEY | I553: S MOLONEY | L553: CZERKASKI | O553: CROUGH | R553: MOREY
A554: PRAHRAN | C554: ELLINGHAUS | F554: McLACHLAN | I554: HARTMAN | L554: LUCAS
A555: GOALKICKERS | S555: S MOLONEY | W555: WINTON
A556: SANDRINGHAM | C556: TARPEY 8 | E556: AMIET 7 | G556: MOREY 3 | I556: PEARCE 2 | K556: BAILEY 2 | M556: GOROZIDIS 2 | P556: ALLEN | R556: CROUGH | U556: LAMBERT | X556: R MALONEY | AB556: MITCHELSON
A557: PRAHRAN | C557: KEIPERT 3 | F557: LETHLEAN 2 | I557: SINNI | K557: MITCHELL | M557: SUCKLING | O557: McLACHLAN
A559: WILLIAMSTOWN | C559: 2 | D559: 2 | E559: =(C559*6)+D559 -> 14 | G559: 3 | H559: 5 | I559: =(G559*6)+H559 -> 23 | K559: 7 | L559: 6 | M559: =(K559*6)+L559 -> 48 | O559: 11 | P559: 11 | Q559: 77 | S559: Venue: WILLIAMSTOWN
A560: WERRIBEE | C560: 2 | D560: 5 | E560: =(C560*6)+D560 -> 17 | G560: 4 | H560: 6 | I560: =(G560*6)+H560 -> 30 | K560: 7 | L560: 6 | M560: =(K560*6)+L560 -> 48 | O560: 8 | P560: 10 | Q560: 58
A561: BEST PLAYERS
A562: WILLIAMSTOWN | C562: GHAZI | F562: McGOWAN | I562: O'KEEFE | L562: BARROW | O562: WEST
A563: WERRIBEE | C563: WILKINS | F563: MAY | I563: WRIGHT | L563: EAMES
A564: GOALKICKERS
A565: WILLIAMSTOWN | C565: GHAZI 5 | F565: O'KEEFE 4 | I565: MITCHELL | L565: KNIGHTS
A566: WERRIBEE | C566: AZIZ 2 | F566: McMASTER | I566: EAMES | K566: RYAN | M566: POWER | O566: SMITH | Q566: LARKIN
A568: ROUND 11 | D568: 2ND JULY | I568: WEATHER
D569: 1ST QTR | H569: 2ND QTR | L569: 3RD QTR | P569: FINAL | S569: Venue: TOORAK PARK
A570: OAKLEIGH | C570: 5 | D570: 4 | E570: =(C570*6)+D570 -> 34 | G570: 8 | H570: 9 | I570: =(G570*6)+H570 -> 57 | K570: 13 | L570: 13 | M570: =(K570*6)+L570 -> 91 | O570: 18 | P570: 14 | Q570: 122 | S570: UMPIRES | Y570: LADDER | AB570: ROUND | AD570: 11
A571: PRAHRAN | C571: 1 | D571: 4 | E571: =(C571*6)+D571 -> 10 | G571: 5 | H571: 6 | I571: =(G571*6)+H571 -> 36 | K571: 9 | L571: 6 | M571: =(K571*6)+L571 -> 60 | O571: 13 | P571: 8 | Q571: 86
A572: BEST PLAYERS | W572: TEAM | X572: W | Y572: L | Z572: D | AA572: FOR | AB572: AGST | AC572: % | AD572: PTS
A573: OAKLEIGH | C573: YOUNG | F573: HAZELL | I573: COURTNEY | L573: D STUBBS | O573: MORELAND | R573: MELLODY
A574: PRAHRAN | C574: SUCKLING | F574: ELLINGHAUS | I574: WALFORD | L574: JAMES | W574: SANDRINGHAM | X574: 9 | Y574: 2 | Z574: 0 | AA574: 1503 | AB574: 729 | AC574: =(AA574/AB574)*100 -> 206.17283950617283 | AD574: =(X574*4)+(Z574*2) -> 36
A575: GOALKICKERS | R575: BARKER | W575: SPRINGVALE | X575: 9 | Y575: 2 | Z575: 0 | AA575: 1190 | AB575: 848 | AC575: =(AA575/AB575)*100 -> 140.33018867924528 | AD575: =(X575*4)+(Z575*2) -> 36
A576: OAKLEIGH | C576: MORELAND 5 | F576: MELLODY 3 | I576: FORD 2 | K576: DALE 2 | M576: BRADLEY 2 | O576: AUBREY | Q576: R STUBBS | S576: GARBUIO | W576: DANDENONG | X576: 8 | Y576: 3 | Z576: 0 | AA576: 1217 | AB576: 1120 | AC576: =(AA576/AB576)*100 -> 108.66071428571429 | AD576: =(X576*4)+(Z576*2) -> 32
A577: PRAHRAN | C577: KEIPERT 3 | F577: McLACHLAN 3 | I577: PANG 2 | K577: GOODALE | M577: MARTELLO | P577: LUCAS | R577: WALFORD | W577: PORT MELBOURNE | X577: 7 | Y577: 4 | Z577: 0 | AA577: 1290 | AB577: 1084 | AC577: =(AA577/AB577)*100 -> 119.00369003690037 | AD577: =(X577*4)+(Z577*2) -> 28
D578: 3RD JULY | I578: WEATHER | N578: KARAGEORGIOU | W578: BOX HILL | X578: 6 | Y578: 5 | Z578: 0 | AA578: 1216 | AB578: 988 | AC578: =(AA578/AB578)*100 -> 123.07692307692308 | AD578: =(X578*4)+(Z578*2) -> 24
A579: FRANKSTON | C579: 12 | D579: 3 | E579: =(C579*6)+D579 -> 75 | G579: 12 | H579: 6 | I579: =(G579*6)+H579 -> 78 | K579: 19 | L579: 10 | M579: =(K579*6)+L579 -> 124 | O579: 28 | P579: 15 | Q579: 183 | S579: Venue: FRANKSTON
A580: WILLIAMSTOWN | C580: 1 | D580: 1 | E580: =(C580*6)+D580 -> 7 | G580: 3 | H580: 4 | I580: =(G580*6)+H580 -> 22 | K580: 5 | L580: 7 | M580: =(K580*6)+L580 -> 37 | O580: 9 | P580: 7 | Q580: 61 | W580: WERRIBEE | X580: 6 | Y580: 5 | Z580: 0 | AA580: 1140 | AB580: 956 | AC580: =(AA580/AB580)*100 -> 119.24686192468619 | AD580: =(X580*4)+(Z580*2) -> 24
A581: BEST PLAYERS | W581: FRANKSTON | X581: 6 | Y581: 5 | Z581: 0 | AA581: 1211 | AB581: 1097 | AC581: =(AA581/AB581)*100 -> 110.39197812215131 | AD581: =(X581*4)+(Z581*2) -> 24
A582: FRANKSTON | C582: ESLER | F582: HAMILL | I582: MOORE | L582: WOOD | O582: KIMPTON | R582: LANCE | W582: WILLIAMSTOWN | X582: 4 | Y582: 7 | Z582: 0 | AA582: 854 | AB582: 1171 | AC582: =(AA582/AB582)*100 -> 72.929120409906062 | AD582: =(X582*4)+(Z582*2) -> 16
A583: WILLIAMSTOWN | C583: LLOYD | F583: BARROW | I583: GHAZI | L583: WEST | W583: PRESTON | X583: 3 | Y583: 8 | Z583: 0 | AA583: 915 | AB583: 1202 | AC583: =(AA583/AB583)*100 -> 76.123128119800327 | AD583: =(X583*4)+(Z583*2) -> 12
A584: GOALKICKERS | Q584: KIMPTON | S584: VERBEEK | W584: OAKLEIGH | X584: 3 | Y584: 8 | Z584: 0 | AA584: 939 | AB584: 1347 | AC584: =(AA584/AB584)*100 -> 69.710467706013361 | AD584: =(X584*4)+(Z584*2) -> 12
A585: FRANKSTON | C585: WOOD 5 | E585: FIDGE 5 | G585: GARDNER 5 | I585: D LIELNORS 4 | L585: HAMILL 3 | N585: MORWOOD 2 | Q585: K LIELNORS | T585: NAPOLI | W585: PRAHRAN | X585: 3 | Y585: 8 | Z585: 0 | AA585: 930 | AB585: 1341 | AC585: =(AA585/AB585)*100 -> 69.351230425055931 | AD585: =(X585*4)+(Z585*2) -> 12
A586: WILLIAMSTOWN | C586: O'KEEFE 2 | F586: KNIGHT 2 | H586: BARROW | J586: SHANKS | L586: HOWLETT | O586: HOUGH | Q586: ZAMKYL | W586: COBURG | X586: 2 | Y586: 9 | Z586: 0 | AA586: 793 | AB586: 1310 | AC586: =(AA586/AB586)*100 -> 60.534351145038165 | AD586: =(X586*4)+(Z586*2) -> 8
A588: COBURG | C588: 8 | D588: 2 | E588: =(C588*6)+D588 -> 50 | G588: 11 | H588: 3 | I588: =(G588*6)+H588 -> 69 | K588: 13 | L588: 9 | M588: =(K588*6)+L588 -> 87 | O588: 14 | P588: 11 | Q588: 95 | S588: Venue: PORT MELBOURNE
A589: PORT MELBOURNE | C589: 0 | D589: 3 | E589: =(C589*6)+D589 -> 3 | G589: 7 | H589: 5 | I589: =(G589*6)+H589 -> 47 | K589: 9 | L589: 5 | M589: =(K589*6)+L589 -> 59 | O589: 12 | P589: 10 | Q589: 82
A590: BEST PLAYERS
A591: COBURG | C591: TEAM EFFORT
A592: PORT MELBOURNE | C592: LAFFY | F592: S BOWDEN | I592: KEIGHRAN | L592: PICCIAONE | O592: TARCZON
A593: GOALKICKERS
A594: COBURG | C594: GLENN 4 | E594: EVANS 2 | G594: GRIFFITHS 2 | J594: BAKER 2 | L594: NICOLAOU | N594: DORIAN | P594: ALESSIO | R594: SALVADORE
A595: PORT MELBOURNE | C595: PICCIAONE 2 | F595: JONES 2 | H595: LOVE 2 | J595: KEIGHRAN | M595: S BOWDEN | P595: JAMES | R595: SEXTON | U595: DONALD | X595: MUENCH
A597: SPRINGVALE | C597: 1 | D597: 0 | E597: =(C597*6)+D597 -> 6 | G597: 6 | H597: 5 | I597: =(G597*6)+H597 -> 41 | K597: 10 | L597: 7 | M597: =(K597*6)+L597 -> 67 | O597: 14 | P597: 10 | Q597: 94 | S597: Venue: SPRINGVALE
A598: DANDENONG | C598: 7 | D598: 6 | E598: =(C598*6)+D598 -> 48 | G598: 7 | H598: 7 | I598: =(G598*6)+H598 -> 49 | K598: 8 | L598: 14 | M598: =(K598*6)+L598 -> 62 | O598: 12 | P598: 17 | Q598: 89
A599: BEST PLAYERS
A600: SPRINGVALE | C600: DILLON | F600: CARROLL | I600: BALDWIN | L600: CAPLES | O600: CHEEL | R600: IRVING
A601: DANDENONG | C601: SALIBA | F601: MILLIGAN | I601: ATKINSON | L601: PARTINGTON | O601: CLIFFORD | R601: HALL
A602: GOALKICKERS
A603: SPRINGVALE | C603: PHILLIPS 2 | E603: BALDWIN 2 | H603: HALPHEN 2 | J603: WOODMAN | M603: CAPSALIS | O603: CARROLL | Q603: BALDWIN | S603: CAPLES | U603: CHEEL | W603: IRVING | X603: JEFFS
A604: DANDENONG | C604: CASSETT 5 | F604: PRETTO 2 | I604: SALIBA 2 | K604: CLIFFORD | M604: GILDER | O604: MILLIGAN
A606: SANDRINGHAM | C606: 4 | D606: 7 | E606: =(C606*6)+D606 -> 31 | G606: 9 | H606: 8 | I606: =(G606*6)+H606 -> 62 | K606: 14 | L606: 10 | M606: =(K606*6)+L606 -> 94 | O606: 16 | P606: 12 | Q606: 108 | S606: Venue: BOX HILL
A607: BOX HILL | C607: 2 | D607: 0 | E607: =(C607*6)+D607 -> 12 | G607: 4 | H607: 6 | I607: =(G607*6)+H607 -> 30 | K607: 6 | L607: 7 | M607: =(K607*6)+L607 -> 43 | O607: 9 | P607: 9 | Q607: 63 | S607: PHILLIPS ;MILLER
A608: BEST PLAYERS
A609: SANDRINGHAM | C609: BAILEY | F609: MURRAY | I609: FOLEY | K609: CZERKASKI | N609: TARPEY | Q609: WILLIAMS
A610: BOX HILL | C610: COHEN | F610: TREWELLA | I610: ZARAFA
A611: GOALKICKERS
A612: SANDRINGHAM | C612: AMIET 5 | E612: FOLEY 3 | G612: WILLIAMS 2 | J612: BAILEY | L612: MOLONEY | N612: ALLEN | P612: MACGEORGE | S612: McMASTER | V612: CZERKASKI
A613: BOX HILL | C613: TREWELLA 4 | F613: QUINN 2 | H613: CROWLEY | J613: LIVINGSTONE | M613: WILKINSON
A615: WERRIBEE | C615: 2 | D615: 2 | E615: =(C615*6)+D615 -> 14 | G615: 8 | H615: 5 | I615: =(G615*6)+H615 -> 53 | K615: 15 | L615: 7 | M615: =(K615*6)+L615 -> 97 | O615: 22 | P615: 9 | Q615: 141 | S615: Venue: WERRIBEE
A616: PRESTON | C616: 2 | D616: 3 | E616: =(C616*6)+D616 -> 15 | G616: 5 | H616: 13 | I616: =(G616*6)+H616 -> 43 | K616: 5 | L616: 15 | M616: =(K616*6)+L616 -> 45 | O616: 5 | P616: 18 | Q616: 48
A617: BEST PLAYERS
A618: WERRIBEE | C618: MAY | F618: BALLAN | I618: MURPHY | L618: NORMINGTON | O618: FITZPATRICK
A619: PRESTON | C619: MUNRIVANA | F619: DOBBS | I619: MORRISH | L619: BRYSON | O619: KING | Q619: CARELLI
A620: GOALKICKERS
A621: WERRIBEE | C621: SMITH 6 | E621: CAMILLIERI 3 | H621: TAYLOR 3 | J621: AZIZ 3 | L621: LYON 2 | N621: LARKIN 2 | P621: EAMES | R621: McDONALD | V621: SAUNDERS
A622: PRESTON | C622: KING 3 | F622: IVEY | H622: ESPENSCHIED
A624: ROUND 12 | D624: 9TH JULY | I624: WEATHER
D625: 1ST QTR | H625: 2ND QTR | L625: 3RD QTR | P625: FINAL | S625: Venue: BEACH RD
A626: SANDRINGHAM | C626: 4 | D626: 5 | E626: =(C626*6)+D626 -> 29 | G626: 8 | H626: 6 | I626: =(G626*6)+H626 -> 54 | K626: 17 | L626: 9 | M626: =(K626*6)+L626 -> 111 | O626: 22 | P626: 12 | Q626: 144 | S626: UMPIRES | Y626: LADDER | AB626: ROUND | AD626: 12
A627: WERRIBEE | C627: 2 | D627: 5 | E627: =(C627*6)+D627 -> 17 | G627: 7 | H627: 7 | I627: =(G627*6)+H627 -> 49 | K627: 8 | L627: 8 | M627: =(K627*6)+L627 -> 56 | O627: 13 | P627: 9 | Q627: 87 | S627: MANN :ACKLAND
A628: BEST PLAYERS | W628: TEAM | X628: W | Y628: L | Z628: D | AA628: FOR | AB628: AGST | AC628: % | AD628: PTS
A629: SANDRINGHAM | C629: MACGEORGE | F629: AMIET | I629: ALLEN | L629: CROUGH | N629: LAMBERT | Q629: MURRAY
A630: WERRIBEE | C630: POWER | F630: NORMINGTON | I630: WILKINS | L630: EAMES | N630: AZIZ | W630: SANDRINGHAM | X630: 10 | Y630: 2 | Z630: 0 | AA630: 1647 | AB630: 816 | AC630: =(AA630/AB630)*100 -> 201.83823529411765 | AD630: =(X630*4)+(Z630*2) -> 40
A631: GOALKICKERS | O631: WILLIAMS | W631: SPRINGVALE | X631: 10 | Y631: 2 | Z631: 0 | AA631: 1308 | AB631: 943 | AC631: =(AA631/AB631)*100 -> 138.70625662778366 | AD631: =(X631*4)+(Z631*2) -> 40
A632: SANDRINGHAM | C632: AMIET 7 | E632: TARPEY 3 | G632: GARRETT 2 | I632: McMASTER 2 | L632: ALLEN | N632: HERMAN | P632: MITCHELSON | R632: MOLONEY | W632: DANDENONG | X632: 9 | Y632: 3 | Z632: 0 | AA632: 1326 | AB632: 1187 | AC632: =(AA632/AB632)*100 -> 111.71019376579612 | AD632: =(X632*4)+(Z632*2) -> 36
A633: WERRIBEE | C633: EAMES 3 | F633: SMITH 2 | H633: LARKIN 2 | J633: WILKINS | L633: CAMILLIERI | N633: MAY | P633: McDONALD | R633: AZIZ | W633: BOX HILL | X633: 7 | Y633: 5 | Z633: 0 | AA633: 1336 | AB633: 1080 | AC633: =(AA633/AB633)*100 -> 123.7037037037037 | AD633: =(X633*4)+(Z633*2) -> 28
D634: 10TH JULY | I634: WEATHER | W634: PORT MELBOURNE | X634: 7 | Y634: 5 | Z634: 0 | AA634: 1377 | AB634: 1173 | AC634: =(AA634/AB634)*100 -> 117.39130434782609 | AD634: =(X634*4)+(Z634*2) -> 28
A635: BOX HILL | C635: 4 | D635: 13 | E635: =(C635*6)+D635 -> 37 | G635: 9 | H635: 18 | I635: =(G635*6)+H635 -> 72 | K635: 11 | L635: 20 | M635: =(K635*6)+L635 -> 86 | O635: 16 | P635: 24 | Q635: 120 | S635: Venue: COBURG
A636: COBURG | C636: 4 | D636: 2 | E636: =(C636*6)+D636 -> 26 | G636: 7 | H636: 4 | I636: =(G636*6)+H636 -> 46 | K636: 14 | L636: 8 | M636: =(K636*6)+L636 -> 92 | O636: 14 | P636: 8 | Q636: 92 | W636: FRANKSTON | X636: 7 | Y636: 5 | Z636: 0 | AA636: 1363 | AB636: 1499 | AC636: =(AA636/AB636)*100 -> 90.927284856571049 | AD636: =(X636*4)+(Z636*2) -> 28
A637: BEST PLAYERS | W637: WERRIBEE | X637: 6 | Y637: 6 | Z637: 0 | AA637: 1227 | AB637: 1100 | AC637: =(AA637/AB637)*100 -> 111.54545454545455 | AD637: =(X637*4)+(Z637*2) -> 24
A638: BOX HILL | C638: BOURKE | F638: ZARAFA | I638: HEANEY | L638: COHEN | O638: NICHOL | R638: HARTIN | W638: WILLIAMSTOWN | X638: 5 | Y638: 7 | Z638: 0 | AA638: 943 | AB638: 1258 | AC638: =(AA638/AB638)*100 -> 74.960254372019079 | AD638: =(X638*4)+(Z638*2) -> 20
A639: COBURG | C639: NICOLAOU | F639: SALVADORE | I639: ALESSIO | L639: RACOVOLIS | O639: DORIAN | W639: OAKLEIGH | X639: 3 | Y639: 9 | Z639: 0 | AA639: 1057 | AB639: 1347 | AC639: =(AA639/AB639)*100 -> 78.470675575352629 | AD639: =(X639*4)+(Z639*2) -> 12
A640: GOALKICKERS | P640: TREWELLA | W640: PRESTON | X640: 3 | Y640: 9 | Z640: 0 | AA640: 1010 | AB640: 1320 | AC640: =(AA640/AB640)*100 -> 76.515151515151516 | AD640: =(X640*4)+(Z640*2) -> 12
A641: BOX HILL | C641: NICHOL 4 | E641: ZARAFA 3 | H641: HARTIN 2 | J641: WILKINSON 2 | M641: BOURKE | O641: COHEN | Q641: QUINN | S641: ROWE | W641: PRAHRAN | X641: 3 | Y641: 9 | Z641: 0 | AA641: 997 | AB641: 1450 | AC641: =(AA641/AB641)*100 -> 68.758620689655174 | AD641: =(X641*4)+(Z641*2) -> 12
A642: COBURG | C642: NICOLAOU 5 | F642: ALESSIO 3 | I642: GRIFFITHS 2 | L642: TARANTO | N642: EVANS | P642: GLENN | R642: HAWKINS | W642: COBURG | X642: 2 | Y642: 10 | Z642: 0 | AA642: 885 | AB642: 1430 | AC642: =(AA642/AB642)*100 -> 61.888111888111887 | AD642: =(X642*4)+(Z642*2) -> 8
A644: FRANKSTON | C644: 8 | D644: 6 | E644: =(C644*6)+D644 -> 54 | G644: 10 | H644: 9 | I644: =(G644*6)+H644 -> 69 | K644: 19 | L644: 18 | M644: =(K644*6)+L644 -> 132 | O644: 23 | P644: 14 | Q644: 152 | S644: Venue: OAKLEIGH
A645: OAKLEIGH | C645: 3 | D645: 1 | E645: =(C645*6)+D645 -> 19 | G645: 6 | H645: 6 | I645: =(G645*6)+H645 -> 42 | K645: 11 | L645: 8 | M645: =(K645*6)+L645 -> 74 | O645: 18 | P645: 10 | Q645: 118
A646: BEST PLAYERS
A647: FRANKSTON | C647: S HAMILL | F647: RYAN | I647: GAHAN | L647: BOONKAMP | O647: MORWOOD | R647: VERBEEK
A648: OAKLEIGH | C648: COURTNEY | F648: MELLODY | I648: D STUBBS | L648: AUBREY | O648: R STUBBS | R648: GARBUIO
A649: GOALKICKERS | Q649: K LIELNORS | T649: MORWOOD
A650: FRANKSTON | C650: GARDNER 5 | F650: RYAN 4 | H650: D LIELNORS 4 | K650: S HAMILL 3 | N650: McKAY 2 | P650: KIMPTON | R650: FIDGE | T650: VERBEEK
A651: OAKLEIGH | C651: DALE 7 | E651: HAZELL 2 | G651: COURTNEY 2 | J651: R STUBBS | L651: SAUNDERS | N651: MORELAND | Q651: D COGHLAN | T651: BARKER
D652: 16TH JULY | I652: WEATHER | Q652: GARBUIO | S652: MELLODY
A653: WILLIAMSTOWN | C653: 5 | D653: 7 | E653: =(C653*6)+D653 -> 37 | G653: 8 | H653: 10 | I653: =(G653*6)+H653 -> 58 | K653: 12 | L653: 15 | M653: =(K653*6)+L653 -> 87 | O653: 12 | P653: 17 | Q653: 89 | S653: Venue: WILLIAMSTOWN
A654: PORT MELBOURNE | C654: 0 | D654: 1 | E654: =(C654*6)+D654 -> 1 | G654: 2 | H654: 10 | I654: =(G654*6)+H654 -> 22 | K654: 5 | L654: 13 | M654: =(K654*6)+L654 -> 43 | O654: 11 | P654: 21 | Q654: 87
A655: BEST PLAYERS
A656: WILLIAMSTOWN | C656: BARROW | F656: A VENNER | I656: S VENNER | L656: MITCHELL | O656: B LLOYD | R656: GOULD
A657: PORT MELBOURNE | C657: LAFFY | F657: KLENJANS | I657: KEIGHRAN | L657: McGEE | O657: TARCZON | R657: HARLAND
A658: GOALKICKERS
A659: WILLIAMSTOWN | C659: SHANKS 3 | F659: O'KEEFE 3 | I659: HOUGH 3 | K659: HOWLETT 2 | N659: KNIGHT
A660: PORT MELBOURNE | C660: S BOWDEN 2 | F660: LOVE 2 | H660: KLENJANS 2 | K660: JAMES | M660: BAILEY | O660: K BOWDEN | Q660: CAMERON | T660: DONALD
D661: 17TH JULY | I661: WEATHER
A662: DANDENONG | C662: 1 | D662: 4 | E662: =(C662*6)+D662 -> 10 | G662: 6 | H662: 7 | I662: =(G662*6)+H662 -> 43 | K662: 10 | L662: 9 | M662: =(K662*6)+L662 -> 69 | O662: 16 | P662: 13 | Q662: 109 | S662: Venue: DANDENONG
A663: PRAHRAN | C663: 2 | D663: 3 | E663: =(C663*6)+D663 -> 15 | G663: 4 | H663: 5 | I663: =(G663*6)+H663 -> 29 | K663: 5 | L663: 8 | M663: =(K663*6)+L663 -> 38 | O663: 9 | P663: 13 | Q663: 67
A664: BEST PLAYERS
A665: DANDENONG | C665: CLIFFORD | F665: MARSHALL | I665: MEAD | L665: TAYLOR | O665: HALL | R665: MILLIGAN
A666: PRAHRAN | C666: WALFORD | F666: MORRISSEY | I666: KILEY | L666: McLACHLAN | O666: LUCAS
A667: GOALKICKERS
A668: DANDENONG | C668: PRETTO 5 | F668: BARWICK 5 | I668: LACKO 2 | K668: MORRISON 2 | N668: TAYLOR | P668: MILLIGAN
A669: PRAHRAN | C669: SUCKLING 3 | F669: GRAY 2 | H669: MARTELLO | J669: SINNI | L669: WEBB | N669: McLACHLAN
A671: SPRINGVALE | C671: 4 | D671: 3 | E671: =(C671*6)+D671 -> 27 | G671: 8 | H671: 5 | I671: =(G671*6)+H671 -> 53 | K671: 11 | L671: 7 | M671: =(K671*6)+L671 -> 73 | O671: 18 | P671: 10 | Q671: 118 | S671: Venue: PRESTON
A672: PRESTON | C672: 2 | D672: 3 | E672: =(C672*6)+D672 -> 15 | G672: 6 | H672: 11 | I672: =(G672*6)+H672 -> 47 | K672: 10 | L672: 17 | M672: =(K672*6)+L672 -> 77 | O672: 12 | P672: 23 | Q672: 95
A673: BEST PLAYERS
A674: SPRINGVALE | C674: DILLON | F674: EVANS | I674: SUTHERLAND | L674: KNIGHT | O674: FOGARTY | R674: DYSON-HOLLAND
A675: PRESTON | C675: CARELLI | F675: MUNRIVANA | I675: TAYLOR | L675: ESPENSCHIED | O675: HABERMAN | R675: MILLER
A676: GOALKICKERS
A677: SPRINGVALE | C677: EVANS 4 | F677: CARIS 3 | H677: FOGARTY 2 | J677: CLARK 2 | L677: JEFFS 2 | N677: PEACOCK | P677: CAPSALIS | R677: CARROLL | U677: KNIGHT | W677: MONTGOMERY
A678: PRESTON | C678: CARELLI 4 | F678: BRYSON 2 | I678: WALKER 2 | L678: DUPUY | N678: ESPENSCHIED | Q678: KING | S678: MUNRIVANA
A680: ROUND 13 | D680: 23RD JULY | I680: WEATHER | S680: Venue: PORT MELBOURNE
D681: 1ST QTR | H681: 2ND QTR | L681: 3RD QTR | P681: FINAL | S681: UMPIRES
A682: SANDRINGHAM | C682: 6 | D682: 4 | E682: =(C682*6)+D682 -> 40 | G682: 7 | H682: 10 | I682: =(G682*6)+H682 -> 52 | K682: 10 | L682: 16 | M682: =(K682*6)+L682 -> 76 | O682: 13 | P682: 19 | Q682: 97 | S682: McBURNEY | Y682: LADDER | AB682: ROUND | AD682: 13
A683: PORT MELBOURNE | C683: 1 | D683: 0 | E683: =(C683*6)+D683 -> 6 | G683: 4 | H683: 4 | I683: =(G683*6)+H683 -> 28 | K683: 9 | L683: 4 | M683: =(K683*6)+L683 -> 58 | O683: 12 | P683: 7 | Q683: 79 | S683: AGNEW
A684: BEST PLAYERS | W684: TEAM | X684: W | Y684: L | Z684: D | AA684: FOR | AB684: AGST | AC684: % | AD684: PTS
A685: SANDRINGHAM | C685: MURRAY | F685: WINTON | I685: MCCRABB | L685: FOLEY | O685: A WILLIAMS | R685: BAILEY
A686: PORT MELBOURNE | C686: CLOKE | F686: LAFFY | I686: DULLARD | L686: McGEE | O686: KEIGHRAN | R686: SHAW | W686: SANDRINGHAM | X686: 11 | Y686: 2 | Z686: 0 | AA686: 1744 | AB686: 895 | AC686: =(AA686/AB686)*100 -> 194.86033519553072 | AD686: =(X686*4)+(Z686*2) -> 44
A687: GOALKICKERS | W687: SPRINGVALE | X687: 10 | Y687: 3 | Z687: 0 | AA687: 1374 | AB687: 1022 | AC687: =(AA687/AB687)*100 -> 134.4422700587084 | AD687: =(X687*4)+(Z687*2) -> 40
A688: SANDRINGHAM | C688: GOROZIDIS 6 | F688: FOLEY 3 | H688: CLARKSON | J688: FRATER | L688: HERMAN | N688: McCRABB | W688: DANDENONG | X688: 9 | Y688: 4 | Z688: 0 | AA688: 1408 | AB688: 1295 | AC688: =(AA688/AB688)*100 -> 108.72586872586874 | AD688: =(X688*4)+(Z688*2) -> 36
A689: PORT MELBOURNE | C689: SEXTON 4 | E689: KEIGHRAN 2 | H689: CHRIMES | J689: HARLAND | M689: CLOKE | N689: S BOWDEN | Q689: JAMES | S689: KLENJANS | W689: BOX HILL | X689: 8 | Y689: 5 | Z689: 0 | AA689: 1487 | AB689: 1159 | AC689: =(AA689/AB689)*100 -> 128.3002588438309 | AD689: =(X689*4)+(Z689*2) -> 32
D690: 24TH JULY | W690: FRANKSTON | X690: 8 | Y690: 5 | Z690: 0 | AA690: 1472 | AB690: 1586 | AC690: =(AA690/AB690)*100 -> 92.812105926860028 | AD690: =(X690*4)+(Z690*2) -> 32
A691: BOX HILL | C691: 9 | D691: 6 | E691: =(C691*6)+D691 -> 60 | G691: 12 | H691: 9 | I691: =(G691*6)+H691 -> 81 | K691: 17 | L691: 15 | M691: =(K691*6)+L691 -> 117 | O691: 22 | P691: 19 | Q691: 151 | S691: Venue: BOX HILL
A692: OAKLEIGH | C692: 0 | D692: 1 | E692: =(C692*6)+D692 -> 1 | G692: 3 | H692: 4 | I692: =(G692*6)+H692 -> 22 | K692: 6 | L692: 9 | M692: =(K692*6)+L692 -> 45 | O692: 11 | P692: 13 | Q692: 79 | W692: PORT MELBOURNE | X692: 7 | Y692: 6 | Z692: 0 | AA692: 1456 | AB692: 1270 | AC692: =(AA692/AB692)*100 -> 114.64566929133859 | AD692: =(X692*4)+(Z692*2) -> 28
A693: BEST PLAYERS | W693: WERRIBEE | X693: 7 | Y693: 6 | Z693: 0 | AA693: 1335 | AB693: 1182 | AC693: =(AA693/AB693)*100 -> 112.94416243654824 | AD693: =(X693*4)+(Z693*2) -> 28
A694: BOX HILL | C694: ZARAFA | F694: HEANEY | I694: ROWE | L694: CROWLEY | O694: COHEN | R694: WILKINSON | W694: WILLIAMSTOWN | X694: 6 | Y694: 7 | Z694: 0 | AA694: 1061 | AB694: 1341 | AC694: =(AA694/AB694)*100 -> 79.120059656972401 | AD694: =(X694*4)+(Z694*2) -> 24
A695: OAKLEIGH | C695: AUBREY | F695: OPIE | I695: D STUBBS | L695: YOUNG | O695: MELLODY | W695: PRESTON | X695: 3 | Y695: 10 | Z695: 0 | AA695: 1097 | AB695: 1429 | AC695: =(AA695/AB695)*100 -> 76.766969909027296 | AD695: =(X695*4)+(Z695*2) -> 12
A696: GOALKICKERS | R696: LIVINGSTONE | W696: OAKLEIGH | X696: 3 | Y696: 10 | Z696: 0 | AA696: 1136 | AB696: 1498 | AC696: =(AA696/AB696)*100 -> 75.834445927903872 | AD696: =(X696*4)+(Z696*2) -> 12
A697: BOX HILL | C697: CROWLEY 5 | E697: WILKINSON 4 | H697: ZARAFA 4 | J697: BOURKE 2 | L697: DALY 2 | N697: TREWELLA 2 | Q697: MA ERWIN | S697: HEANEY | W697: PRAHRAN | X697: 3 | Y697: 10 | Z697: 0 | AA697: 1080 | AB697: 1568 | AC697: =(AA697/AB697)*100 -> 68.877551020408163 | AD697: =(X697*4)+(Z697*2) -> 12
A698: OAKLEIGH | C698: BRIGGS 2 | F698: DALE 2 | H698: YOUNG 2 | J698: WICKS | L698: OPIE | M698: AUBREY | O698: D COGHLAN | R698: R STUBBS | W698: COBURG | X698: 3 | Y698: 10 | Z698: 0 | AA698: 964 | AB698: 1496 | AC698: =(AA698/AB698)*100 -> 64.438502673796791 | AD698: =(X698*4)+(Z698*2) -> 12
A700: FRANKSTON | C700: 5 | D700: 5 | E700: =(C700*6)+D700 -> 35 | G700: 9 | H700: 13 | I700: =(G700*6)+H700 -> 67 | K700: 12 | L700: 18 | M700: =(K700*6)+L700 -> 90 | O700: 14 | P700: 25 | Q700: 109 | S700: Venue: FRANKSTON
A701: PRESTON | C701: 3 | D701: 4 | E701: =(C701*6)+D701 -> 22 | G701: 7 | H701: 6 | I701: =(G701*6)+H701 -> 48 | K701: 10 | L701: 8 | M701: =(K701*6)+L701 -> 68 | O701: 12 | P701: 15 | Q701: 87
A702: BEST PLAYERS
A703: FRANKSTON | C703: MORWOOD | F703: WOOD | I703: MOORE | L703: McKAY | O703: NAPOLI | R703: BROWN
A704: PRESTON | C704: TAYLOR | F704: HABERMAN | I704: ESPENSCHIED | L704: MORRISH | O704: BURROWS | R704: MAIORANA
A705: GOALKICKERS
A706: FRANKSTON | C706: WOOD 2 | E706: FIDGE 2 | G706: LANCE 2 | I706: GAHAN 2 | K706: KIMPTON 2 | M706: MCKAY | O706: BOONKAMP | Q706: D LIELNORS | T706: K LIELNORS
A707: PRESTON | C707: DUPUY 4 | F707: HABERMAN 2 | I707: ESPENSCHIED 2 | L707: KING | N707: BRYSON | P707: DOBBS | R707: WALKER
A709: WILLIAMSTOWN | C709: 5 | D709: 2 | E709: =(C709*6)+D709 -> 32 | G709: 10 | H709: 13 | I709: =(G709*6)+H709 -> 73 | K709: 12 | L709: 18 | M709: =(K709*6)+L709 -> 90 | O709: 16 | P709: 22 | Q709: 118 | S709: Venue: TOORAK PARK
A710: PRAHRAN | C710: 4 | D710: 3 | E710: =(C710*6)+D710 -> 27 | G710: 4 | H710: 5 | I710: =(G710*6)+H710 -> 29 | K710: 9 | L710: 7 | M710: =(K710*6)+L710 -> 61 | O710: 12 | P710: 11 | Q710: 83
A711: BEST PLAYERS
A712: WILLIAMSTOWN | C712: B LLOYD | F712: SYMONS | I712: BARROW | L712: ARCIERI | O712: SHANKS | R712: MITCHELL
A713: PRAHRAN | C713: KEIPERT | F713: MORRISSEY | I713: McLACHLAN | L713: WALFORD | O713: SUCKLING | R713: HARTMAN
A714: GOALKICKERS
A715: WILLIAMSTOWN | C715: ARCIERI 4 | F715: MITCHELL 3 | I715: PASTORE 2 | K715: HOWLETT 2 | M715: B LLOYD 2 | O715: SHANKS | Q715: O'KEEFE | S715: GHAZI
A716: PRAHRAN | C716: McLACHLAN 4 | F716: GRAZIANO 3 | I716: KEIPERT 2 | K716: PANG | M716: ELLINGHAUS | P716: COOTE
A718: COBURG | C718: 3 | D718: 5 | E718: =(C718*6)+D718 -> 23 | G718: 4 | H718: 9 | I718: =(G718*6)+H718 -> 33 | K718: 9 | L718: 12 | M718: =(K718*6)+L718 -> 66 | O718: 11 | P718: 13 | Q718: 79 | S718: Venue: SPRINGVALE
A719: SPRINGVALE | C719: 2 | D719: 1 | E719: =(C719*6)+D719 -> 13 | G719: 4 | H719: 4 | I719: =(G719*6)+H719 -> 28 | K719: 6 | L719: 6 | M719: =(K719*6)+L719 -> 42 | O719: 9 | P719: 12 | Q719: 66
A720: BEST PLAYERS
A721: COBURG | C721: TEAM EFFORT
A722: SPRINGVALE | C722: DILLON | F722: KNIGHT | I722: CARROLL | L722: HALPHEN | O722: JEFFS | Q722: PEACOCK
A723: GOALKICKERS
A724: COBURG | C724: WESTON 2 | F724: ALESSIO 2 | I724: P O'MEARA 2 | L724: BARCLAY | N724: GLENN | P724: GRIFFITHS | R724: SEMAAN | U724: EVANS
A725: SPRINGVALE | C725: CAPSALIS 3 | F725: JEFFS 2 | H725: MONTGOMERY 2 | K725: CARROLL | M725: DILLON
A727: WERRIBEE | C727: 3 | D727: 2 | E727: =(C727*6)+D727 -> 20 | G727: 9 | H727: 6 | I727: =(G727*6)+H727 -> 60 | K727: 13 | L727: 9 | M727: =(K727*6)+L727 -> 87 | O727: 16 | P727: 12 | Q727: 108 | S727: Venue: WERRIBEE
A728: DANDENONG | C728: 3 | D728: 3 | E728: =(C728*6)+D728 -> 21 | G728: 6 | H728: 3 | I728: =(G728*6)+H728 -> 39 | K728: 10 | L728: 7 | M728: =(K728*6)+L728 -> 67 | O728: 12 | P728: 10 | Q728: 82
A729: BEST PLAYERS
A730: WERRIBEE | C730: LARKIN | F730: POWER | I730: LESIPUTTY | L730: EAMES | O730: AZIZ | R730: SAUNDERS
A731: DANDENONG | C731: LACKO | F731: MILLIGAN | I731: MILLANE | L731: MEAD | O731: CLIFFORD | R731: HALL
A732: GOALKICKERS
A733: WERRIBEE | C733: AZIZ 5 | E733: SMITH 3 | G733: POWER 2 | I733: EAMES 2 | K733: RYAN 2 | M733: SPEAR | O733: SAUNDERS
A734: DANDENONG | C734: BARWICK 4 | F734: PRETTO 3 | I734: CASSETT 2 | L734: HALL | N734: MILLANE | P734: MILLIGAN
A736: ROUND 14 | D736: 30TH JULY | I736: WEATHER
D737: 1ST QTR | H737: 2ND QTR | L737: 3RD QTR | P737: FINAL | S737: Venue: FRANKSTON
A738: BOX HILL | C738: 5 | D738: 0 | E738: =(C738*6)+D738 -> 30 | G738: 9 | H738: 2 | I738: =(G738*6)+H738 -> 56 | K738: 13 | L738: 8 | M738: =(K738*6)+L738 -> 86 | O738: 16 | P738: 11 | Q738: 107 | S738: UMPIRES | Y738: LADDER | AB738: ROUND | AD738: 14
A739: FRANKSTON | C739: 5 | D739: 3 | E739: =(C739*6)+D739 -> 33 | G739: 9 | H739: 4 | I739: =(G739*6)+H739 -> 58 | K739: 10 | L739: 7 | M739: =(K739*6)+L739 -> 67 | O739: 11 | P739: 8 | Q739: 74
A740: BEST PLAYERS | W740: TEAM | X740: W | Y740: L | Z740: D | AA740: FOR | AB740: AGST | AC740: % | AD740: PTS
A741: BOX HILL | C741: ZARAFA | F741: BOURKE | I741: COHEN | L741: LISLE | O741: O'NEILL | Q741: BANFIELD
A742: FRANKSTON | C742: MORWOOD | F742: MARTIN | I742: KIMPTON | L742: BOONKAMP | O742: NAPOLI | Q742: HAMILL | W742: SANDRINGHAM | X742: 12 | Y742: 2 | Z742: 0 | AA742: 1863 | AB742: 966 | AC742: =(AA742/AB742)*100 -> 192.85714285714286 | AD742: =(X742*4)+(Z742*2) -> 48
A743: GOALKICKERS | W743: SPRINGVALE | X743: 11 | Y743: 3 | Z743: 0 | AA743: 1492 | AB743: 1114 | AC743: =(AA743/AB743)*100 -> 133.93177737881507 | AD743: =(X743*4)+(Z743*2) -> 44
A744: BOX HILL | C744: ZARAFA 4 | F744: COHEN 3 | H744: WILKINSON 3 | K744: BOURKE 2 | M744: CROWLEY 2 | P744: DALY 2 | W744: BOX HILL | X744: 9 | Y744: 5 | Z744: 0 | AA744: 1594 | AB744: 1233 | AC744: =(AA744/AB744)*100 -> 129.27818329278182 | AD744: =(X744*4)+(Z744*2) -> 36
A745: FRANKSTON | C745: KIMPTON 3 | F745: WOOD 2 | H745: McKAY 2 | J745: FIDGE | L745: NAPOLI | N745: K LIELNORS | Q745: GARDNER | W745: DANDENONG | X745: 9 | Y745: 5 | Z745: 0 | AA745: 1479 | AB745: 1414 | AC745: =(AA745/AB745)*100 -> 104.59688826025459 | AD745: =(X745*4)+(Z745*2) -> 36
D746: 31ST JULY | I746: WEATHER | W746: PORT MELBOURNE | X746: 8 | Y746: 6 | Z746: 0 | AA746: 1540 | AB746: 1337 | AC746: =(AA746/AB746)*100 -> 115.18324607329843 | AD746: =(X746*4)+(Z746*2) -> 32
A747: PORT MELBOURNE | C747: 3 | D747: 7 | E747: =(C747*6)+D747 -> 25 | G747: 4 | H747: 8 | I747: =(G747*6)+H747 -> 32 | K747: 8 | L747: 14 | M747: =(K747*6)+L747 -> 62 | O747: 11 | P747: 18 | Q747: 84 | S747: Venue: PORT MELBOURNE
A748: WERRIBEE | C748: 3 | D748: 3 | E748: =(C748*6)+D748 -> 21 | G748: 4 | H748: 9 | I748: =(G748*6)+H748 -> 33 | K748: 6 | L748: 10 | M748: =(K748*6)+L748 -> 46 | O748: 9 | P748: 13 | Q748: 67 | W748: FRANKSTON | X748: 8 | Y748: 6 | Z748: 0 | AA748: 1546 | AB748: 1693 | AC748: =(AA748/AB748)*100 -> 91.317188422917894 | AD748: =(X748*4)+(Z748*2) -> 32
A749: BEST PLAYERS | W749: WERRIBEE | X749: 7 | Y749: 7 | Z749: 0 | AA749: 1402 | AB749: 1266 | AC749: =(AA749/AB749)*100 -> 110.74249605055293 | AD749: =(X749*4)+(Z749*2) -> 28
A750: PORT MELBOURNE | C750: LAFFY | F750: EDWARDS | I750: DULLARD | L750: S BOWDEN | O750: MOYLAN | R750: KEIGHRAN | W750: WILLIAMSTOWN | X750: 7 | Y750: 7 | Z750: 0 | AA750: 1165 | AB750: 1373 | AC750: =(AA750/AB750)*100 -> 84.85069191551348 | AD750: =(X750*4)+(Z750*2) -> 28
A751: WERRIBEE | C751: MAY | F751: NORMINGTON | I751: McDONALD | L751: AZIZ | W751: COBURG | X751: 4 | Y751: 10 | Z751: 0 | AA751: 1029 | AB751: 1539 | AC751: =(AA751/AB751)*100 -> 66.861598440545805 | AD751: =(X751*4)+(Z751*2) -> 16
A752: GOALKICKERS | W752: PRESTON | X752: 3 | Y752: 11 | Z752: 0 | AA752: 1140 | AB752: 1494 | AC752: =(AA752/AB752)*100 -> 76.305220883534147 | AD752: =(X752*4)+(Z752*2) -> 12
A753: PORT MELBOURNE | C753: HARLAND 2 | F753: SEXTON 2 | I753: DI BLASI 2 | L753: EDWARDS 2 | O753: R BOURKE 2 | R753: WEEDING | W753: OAKLEIGH | X753: 3 | Y753: 11 | Z753: 0 | AA753: 1168 | AB753: 1602 | AC753: =(AA753/AB753)*100 -> 72.908863920099876 | AD753: =(X753*4)+(Z753*2) -> 12
A754: WERRIBEE | C754: AZIZ 3 | E754: McMASTER 2 | H754: POWER | J754: RAEBURN | L754: SMITH | N754: LARKIN | W754: PRAHRAN | X754: 3 | Y754: 11 | Z754: 0 | AA754: 1172 | AB754: 1686 | AC754: =(AA754/AB754)*100 -> 69.513641755634637 | AD754: =(X754*4)+(Z754*2) -> 12
A756: SANDRINGHAM | C756: 3 | D756: 7 | E756: =(C756*6)+D756 -> 25 | G756: 7 | H756: 11 | I756: =(G756*6)+H756 -> 53 | K756: 14 | L756: 14 | M756: =(K756*6)+L756 -> 98 | O756: 17 | P756: 17 | Q756: 119 | S756: Venue: DANDENONG
A757: DANDENONG | C757: 2 | D757: 0 | E757: =(C757*6)+D757 -> 12 | G757: 6 | H757: 4 | I757: =(G757*6)+H757 -> 40 | K757: 9 | L757: 7 | M757: =(K757*6)+L757 -> 61 | O757: 10 | P757: 11 | Q757: 71
A758: BEST PLAYERS
A759: SANDRINGHAM | C759: MITCHELSON | F759: CLARKSON | I759: ALLEN | L759: MACGEORGE | O759: KELLAWAY | R759: MCCRABB
A760: DANDENONG | C760: MILLIGAN | F760: MEAD | I760: FOSTER | L760: TAYLOR | O760: CLIFFORD | R760: LACKO
A761: GOALKICKERS
A762: SANDRINGHAM | C762: TARPEY 5 | F762: AMIET 4 | H762: ALLEN 2 | J762: GARRETT 2 | M762: BAILEY | O762: FOLEY | Q762: MOLONEY | S762: CLARKSON
A763: DANDENONG | C763: PRETTO 3 | F763: BARWICK 3 | I763: MEAD 2 | K763: CLIFFORD | M763: LACKO
A765: SPRINGVALE | C765: 4 | D765: 5 | E765: =(C765*6)+D765 -> 29 | G765: 7 | H765: 6 | I765: =(G765*6)+H765 -> 48 | K765: 13 | L765: 10 | M765: =(K765*6)+L765 -> 88 | O765: 18 | P765: 10 | Q765: 118 | S765: Venue: TOORAK PARK
A766: PRAHRAN | C766: 4 | D766: 2 | E766: =(C766*6)+D766 -> 26 | G766: 6 | H766: 7 | I766: =(G766*6)+H766 -> 43 | K766: 11 | L766: 10 | M766: =(K766*6)+L766 -> 76 | O766: 13 | P766: 14 | Q766: 92
A767: BEST PLAYERS
A768: SPRINGVALE | C768: CAPLES | F768: BALDWIN | I768: KOOP | L768: PEACOCK | O768: CAPSALIS | R768: DILLON
A769: PRAHRAN | C769: MORRISSEY | F769: LUCAS | I769: KILEY | L769: JAMES | O769: MARTELLO
A770: GOALKICKERS
A771: SPRINGVALE | C771: HALPHEN 5 | F771: SMITH 3 | H771: MONTGOMERY 3 | K771: EVANS 2 | M771: DYSON-HOLLAND 2 | Q771: BALDWIN | S771: KOOP | U771: JEFFS
A772: PRAHRAN | C772: JAMES 3 | F772: BAKER 3 | H772: McLACHLAN 2 | K772: TUDDENHAM 2 | N772: KEIPERT 2 | Q772: PARKER
A774: COBURG | C774: 6 | D774: 4 | E774: =(C774*6)+D774 -> 40 | G774: 7 | H774: 5 | I774: =(G774*6)+H774 -> 47 | K774: 10 | L774: 5 | M774: =(K774*6)+L774 -> 65 | O774: 10 | P774: 5 | Q774: 65 | S774: Venue: PRESTON
A775: PRESTON | C775: 2 | D775: 3 | E775: =(C775*6)+D775 -> 15 | G775: 3 | H775: 8 | I775: =(G775*6)+H775 -> 26 | K775: 4 | L775: 12 | M775: =(K775*6)+L775 -> 36 | O775: 5 | P775: 13 | Q775: 43
A776: BEST PLAYERS
A777: COBURG | C777: WESTON | F777: ALESSIO | I777: HAWKINS | L777: DAVID | O777: BAKER
A778: PRESTON | C778: DOBBS | F778: REEVES | I778: MORRISH | L778: ESPENSCHIED
A779: GOALKICKERS
A780: COBURG | C780: ALESSIO 5 | F780: WESTON 2 | I780: P O'MEARA | L780: GRIFFITHS | N780: GLENN
A781: PRESTON | C781: BRYSON 2 | F781: DOBBS | H781: IVEY | J781: CALLANDER
A783: WILLIAMSTOWN | C783: 1 | D783: 3 | E783: =(C783*6)+D783 -> 9 | G783: 4 | H783: 7 | I783: =(G783*6)+H783 -> 31 | K783: 8 | L783: 10 | M783: =(K783*6)+L783 -> 58 | O783: 15 | P783: 14 | Q783: 104 | S783: Venue: WILLIAMSTOWN
A784: OAKLEIGH | C784: 0 | D784: 0 | E784: =(C784*6)+D784 -> 0 | G784: 2 | H784: 1 | I784: =(G784*6)+H784 -> 13 | K784: 3 | L784: 2 | M784: =(K784*6)+L784 -> 20 | O784: 4 | P784: 8 | Q784: 32
A785: BEST PLAYERS
A786: WILLIAMSTOWN | C786: SHANKS | F786: BARROW | I786: PASTORE | L786: HOUGH | O786: SHEEHAN | R786: MITCHELL
A787: OAKLEIGH | C787: COURTNEY | F787: YOUNG | I787: SMITH | L787: BRIGGS | O787: HUNTER | R787: RI STUBBS
A788: GOALKICKERS
A789: WILLIAMSTOWN | C789: SHANKS 4 | F789: O'KEEFE 3 | H789: ARCIERI 2 | K789: GHAZI 2 | M789: HOWLETT 2 | P789: SHEEHAN | R789: BLOOM
A790: OAKLEIGH | C790: GARBUIO 2 | F790: BRIGGS | H790: DALE
A792: ROUND 15 | D792: 6TH AUGUST | I792: WEATHER | S792: Venue: BEACH ROAD
D793: 1ST QTR | H793: 2ND QTR | L793: 3RD QTR | P793: FINAL | S793: UMPIRES
A794: SANDRINGHAM | C794: 5 | D794: 6 | E794: =(C794*6)+D794 -> 36 | G794: 8 | H794: 7 | I794: =(G794*6)+H794 -> 55 | K794: 13 | L794: 12 | M794: =(K794*6)+L794 -> 90 | O794: 16 | P794: 14 | Q794: 110 | S794: SERCIA | Y794: LADDER | AB794: ROUND | AD794: 15
A795: WILLIAMSTOWN | C795: 0 | D795: 2 | E795: =(C795*6)+D795 -> 2 | G795: 3 | H795: 4 | I795: =(G795*6)+H795 -> 22 | K795: 7 | L795: 7 | M795: =(K795*6)+L795 -> 49 | O795: 10 | P795: 10 | Q795: 70 | S795: EDWARDS
A796: BEST PLAYERS | W796: TEAM | X796: W | Y796: L | Z796: D | AA796: FOR | AB796: AGST | AC796: % | AD796: PTS
A797: SANDRINGHAM | C797: KELLAWAY | F797: BAILEY | I797: AMIET | L797: JOHNSTONE | O797: CLARKSON | R797: MITCHELSON
A798: WILLIAMSTOWN | C798: HOUGH | F798: VENNER | I798: MINETT | L798: BLOOM | O798: BARROW | R798: LLOYD | W798: SANDRINGHAM | X798: 13 | Y798: 2 | Z798: 0 | AA798: 1973 | AB798: 1036 | AC798: =(AA798/AB798)*100 -> 190.44401544401543 | AD798: =(X798*4)+(Z798*2) -> 52
A799: GOALKICKERS | W799: SPRINGVALE | X799: 12 | Y799: 3 | Z799: 0 | AA799: 1565 | AB799: 1147 | AC799: =(AA799/AB799)*100 -> 136.44289450741064 | AD799: =(X799*4)+(Z799*2) -> 48
A800: SANDRINGHAM | C800: AMIET 6 | F800: TARPEY 3 | I800: GARRETT 3 | K800: ALLEN | M800: CLARKSON | O800: KELLAWAY | R800: SNOOKS | W800: BOX HILL | X800: 10 | Y800: 5 | Z800: 0 | AA800: 1728 | AB800: 1302 | AC800: =(AA800/AB800)*100 -> 132.7188940092166 | AD800: =(X800*4)+(Z800*2) -> 40
A801: WILLIAMSTOWN | C801: KNIGHT 4 | F801: HOWLETT 3 | I801: MACKAY 2 | L801: BLOOM | W801: DANDENONG | X801: 10 | Y801: 5 | Z801: 0 | AA801: 1608 | AB801: 1504 | AC801: =(AA801/AB801)*100 -> 106.91489361702126 | AD801: =(X801*4)+(Z801*2) -> 40
D802: 7TH AUGUST | I802: WEATHER | W802: WERRIBEE | X802: 8 | Y802: 7 | Z802: 0 | AA802: 1572 | AB802: 1313 | AC802: =(AA802/AB802)*100 -> 119.72581873571973 | AD802: =(X802*4)+(Z802*2) -> 32
A803: BOX HILL | C803: 6 | D803: 4 | E803: =(C803*6)+D803 -> 40 | G803: 10 | H803: 6 | I803: =(G803*6)+H803 -> 66 | K803: 14 | L803: 12 | M803: =(K803*6)+L803 -> 96 | O803: 20 | P803: 14 | Q803: 134 | S803: Venue: BOX HILL
A804: PORT MELBOURNE | C804: 2 | D804: 2 | E804: =(C804*6)+D804 -> 14 | G804: 6 | H804: 5 | I804: =(G804*6)+H804 -> 41 | K804: 7 | L804: 7 | M804: =(K804*6)+L804 -> 49 | O804: 10 | P804: 9 | Q804: 69 | W804: PORT MELBOURNE | X804: 8 | Y804: 7 | Z804: 0 | AA804: 1609 | AB804: 1471 | AC804: =(AA804/AB804)*100 -> 109.38137321549965 | AD804: =(X804*4)+(Z804*2) -> 32
A805: BEST PLAYERS | W805: FRANKSTON | X805: 8 | Y805: 7 | Z805: 0 | AA805: 1579 | AB805: 1766 | AC805: =(AA805/AB805)*100 -> 89.411098527746319 | AD805: =(X805*4)+(Z805*2) -> 32
A806: BOX HILL | C806: WILKINSON | F806: LIVINGSTONE | I806: CROWLEY | L806: DALY | O806: COHEN | R806: O'NEILL | W806: WILLIAMSTOWN | X806: 7 | Y806: 8 | Z806: 0 | AA806: 1235 | AB806: 1483 | AC806: =(AA806/AB806)*100 -> 83.277140930546196 | AD806: =(X806*4)+(Z806*2) -> 28
A807: PORT MELBOURNE | C807: JAMES | F807: DULLARD | I807: MOYLAN | L807: K BOWDEN | O807: HARLAND | R807: S BOWDEN | W807: PRESTON | X807: 4 | Y807: 11 | Z807: 0 | AA807: 1282 | AB807: 1560 | AC807: =(AA807/AB807)*100 -> 82.179487179487182 | AD807: =(X807*4)+(Z807*2) -> 16
A808: GOALKICKERS | W808: COBURG | X808: 4 | Y808: 11 | Z808: 0 | AA808: 1119 | AB808: 1668 | AC808: =(AA808/AB808)*100 -> 67.086330935251809 | AD808: =(X808*4)+(Z808*2) -> 16
A809: BOX HILL | C809: WILKINSON 10 | F809: DALY 4 | H809: CROWLEY 2 | K809: LIVINGSTONE 2 | N809: DISNEY | P809: ELLIS | W809: OAKLEIGH | X809: 3 | Y809: 12 | Z809: 0 | AA809: 1234 | AB809: 1744 | AC809: =(AA809/AB809)*100 -> 70.756880733944953 | AD809: =(X809*4)+(Z809*2) -> 12
A810: PORT MELBOURNE | C810: HARLAND 4 | F810: KEIGHRAN | I810: K BOWDEN | L810: S BOWDEN | O810: DI BLASI | Q810: DONALD | S810: KLENJANS | W810: PRAHRAN | X810: 3 | Y810: 12 | Z810: 0 | AA810: 1219 | AB810: 1856 | AC810: =(AA810/AB810)*100 -> 65.678879310344826 | AD810: =(X810*4)+(Z810*2) -> 12
A812: DANDENONG | C812: 8 | D812: 5 | E812: =(C812*6)+D812 -> 53 | G812: 13 | H812: 8 | I812: =(G812*6)+H812 -> 86 | K812: 15 | L812: 13 | M812: =(K812*6)+L812 -> 103 | O812: 19 | P812: 15 | Q812: 129 | S812: Venue: COBURG
A813: COBURG | C813: 2 | D813: 5 | E813: =(C813*6)+D813 -> 17 | G813: 3 | H813: 6 | I813: =(G813*6)+H813 -> 24 | K813: 5 | L813: 11 | M813: =(K813*6)+L813 -> 41 | O813: 13 | P813: 12 | Q813: 90
A814: BEST PLAYERS
A815: DANDENONG | C815: MILLANE | F815: MEAD | I815: HALL | L815: SALIBA | O815: LACKO | R815: MORRISON
A816: COBURG | C816: R O'MEARA | F816: DORIAN | I816: DAVID | L816: RACOVOLIS | O816: GRIFFITHS
A817: GOALKICKERS
A818: DANDENONG | C818: MORRISON 5 | F818: MEAD 3 | H818: ATKINSON 2 | K818: HALL 2 | M818: PRETTO 2 | O818: BARWICK | Q818: BURNELL | S818: CAMPBELL | V818: SALIBA | X818: L TAYLOR
A819: COBURG | C819: GRIFFITHS 3 | F819: ALESSIO 2 | I819: RACOVOLIS 2 | L819: SEMAAN 2 | O819: EVANS | Q819: NICOLAOU | S819: BARCLAY | V819: BAKER
A821: PRESTON | C821: 8 | D821: 5 | E821: =(C821*6)+D821 -> 53 | G821: 12 | H821: 7 | I821: =(G821*6)+H821 -> 79 | K821: 18 | L821: 12 | M821: =(K821*6)+L821 -> 120 | O821: 21 | P821: 16 | Q821: 142 | S821: Venue: OAKLEIGH
A822: OAKLEIGH | C822: 2 | D822: 1 | E822: =(C822*6)+D822 -> 13 | G822: 3 | H822: 7 | I822: =(G822*6)+H822 -> 25 | K822: 6 | L822: 8 | M822: =(K822*6)+L822 -> 44 | O822: 9 | P822: 12 | Q822: 66
A823: BEST PLAYERS
A824: PRESTON | C824: TAYLOR | F824: REEVES | I824: KING | L824: CARELLI | O824: DUPUY | R824: HABERMAN
A825: OAKLEIGH | C825: AUBREY | F825: DI NATALE | I825: COGHLAN | L825: COURTNRY | O825: RE STUBBS
A826: GOALKICKERS
A827: PRESTON | C827: KING 6 | F827: CARELLI 4 | I827: MILLER 4 | K827: DUPUY 3 | M827: TAYLOR 2 | O827: PEZZIN | Q827: HABERMAN
A828: OAKLEIGH | C828: AUBREY 3 | F828: RI STUBBS 2 | I828: BRIGGS | K828: DALE | M828: YOUNG | O828: SAUNDERS
A830: SPRINGVALE | C830: 4 | D830: 4 | E830: =(C830*6)+D830 -> 28 | G830: 7 | H830: 8 | I830: =(G830*6)+H830 -> 50 | K830: 7 | L830: 15 | M830: =(K830*6)+L830 -> 57 | O830: 9 | P830: 19 | Q830: 73 | S830: Venue: SPRINGVALE
A831: FRANKSTON | C831: 0 | D831: 0 | E831: =(C831*6)+D831 -> 0 | G831: 0 | H831: 3 | I831: =(G831*6)+H831 -> 3 | K831: 2 | L831: 3 | M831: =(K831*6)+L831 -> 15 | O831: 5 | P831: 3 | Q831: 33
A832: BEST PLAYERS
A833: SPRINGVALE | C833: MORGAN | F833: DYSON-HOLLAND | J833: IRVING | L833: CAPLES | O833: CARROLL | R833: HALPHEN
A834: FRANKSTON | C834: ESLER | F834: MORWOOD | J834: WEBB | L834: VERBEEK
A835: GOALKICKERS
A836: SPRINGVALE | C836: DYSON-HOLLAND 3 | G836: SMITH 2 | I836: KOOP | K836: EVANS | M836: JEFFS | O836: MONTGOMERY
A837: FRANKSTON | C837: FIDGE 2 | F837: PYM 2 | H837: COCHRANE
A839: WERRIBEE | C839: 4 | D839: 5 | E839: =(C839*6)+D839 -> 29 | G839: 9 | H839: 11 | I839: =(G839*6)+H839 -> 65 | K839: 20 | L839: 13 | M839: =(K839*6)+L839 -> 133 | O839: 25 | P839: 20 | Q839: 170 | S839: Venue: WERRIBEE
A840: PRAHRAN | C840: 2 | D840: 2 | E840: =(C840*6)+D840 -> 14 | G840: 3 | H840: 4 | I840: =(G840*6)+H840 -> 22 | K840: 4 | L840: 4 | M840: =(K840*6)+L840 -> 28 | O840: 7 | P840: 5 | Q840: 47
A841: BEST PLAYERS
A842: WERRIBEE | C842: EAMES | F842: WILKINS | I842: SPEAR | L842: McMASTER | O842: NORMINGTON | R842: SMITH
A843: PRAHRAN | C843: MORRISSEY | F843: TUDDENHAM | I843: McLACHLAN | L843: KILEY | O843: KEIPERT | R843: HARTMAN
A844: GOALKICKERS
A845: WERRIBEE | C845: EAMES 6 | F845: SMITH 5 | H845: POWER 3 | J845: AZIZ 3 | L845: McDONALD 2 | O845: SALTALAMACCHIA 2 | S845: RYAN 2 | V845: RAEBURN | X845: WILLIAMS
A846: PRAHRAN | C846: PANG 3 | F846: TUDDENHAM 2 | J846: SINNI | L846: PARKER
A848: ROUND 16 | D848: 13TH AUGUST | I848: WEATHER
D849: 1ST QTR | H849: 2ND QTR | L849: 3RD QTR | P849: FINAL | S849: Venue: SPRINGVALE
A850: BOX HILL | C850: 3 | D850: 3 | E850: =(C850*6)+D850 -> 21 | G850: 7 | H850: 8 | I850: =(G850*6)+H850 -> 50 | K850: 12 | L850: 12 | M850: =(K850*6)+L850 -> 84 | O850: 19 | P850: 14 | Q850: 128 | S850: UMPIRES | Y850: LADDER | AB850: ROUND | AD850: 16
A851: SPRINGVALE | C851: 3 | D851: 3 | E851: =(C851*6)+D851 -> 21 | G851: 5 | H851: 4 | I851: =(G851*6)+H851 -> 34 | K851: 8 | L851: 5 | M851: =(K851*6)+L851 -> 53 | O851: 11 | P851: 6 | Q851: 72
A852: BEST PLAYERS | W852: TEAM | X852: W | Y852: L | Z852: D | AA852: FOR | AB852: AGST | AC852: % | AD852: PTS
A853: BOX HILL | C853: BOURKE | F853: WILKINSON | I853: LISLE | L853: O'NEILL | O853: LIVINGSTONE | R853: ZARAFA
A854: SPRINGVALE | C854: PEACOCK | F854: CAPLES | I854: PHILLIPS | L854: MORGAN | O854: CAPSALIS | W854: SANDRINGHAM | X854: 14 | Y854: 2 | Z854: 0 | AA854: 2080 | AB854: 1097 | AC854: =(AA854/AB854)*100 -> 189.6080218778487 | AD854: =(X854*4)+(Z854*2) -> 56
A855: GOALKICKERS | N855: ELLIS | P855: ZARAFA | W855: SPRINGVALE | X855: 12 | Y855: 4 | Z855: 0 | AA855: 1637 | AB855: 1275 | AC855: =(AA855/AB855)*100 -> 128.39215686274511 | AD855: =(X855*4)+(Z855*2) -> 48
A856: BOX HILL | C856: WILKINSON 7 | F856: CROWLEY 2 | I856: DALY 2 | K856: EVANS 2 | M856: LIVINGSTONE 2 | P856: BOURKE | R856: COHEN | W856: BOX HILL | X856: 11 | Y856: 5 | Z856: 0 | AA856: 1856 | AB856: 1374 | AC856: =(AA856/AB856)*100 -> 135.08005822416303 | AD856: =(X856*4)+(Z856*2) -> 44
A857: SPRINGVALE | C857: PHILLIPS 3 | F857: CAPSALIS 2 | I857: DYSON-HOLLAND 2 | M857: HALPHEN 2 | P857: DALE 2 | W857: DANDENONG | X857: 11 | Y857: 5 | Z857: 0 | AA857: 1744 | AB857: 1599 | AC857: =(AA857/AB857)*100 -> 109.06816760475297 | AD857: =(X857*4)+(Z857*2) -> 44
D858: 14TH AUGUST | I858: WEATHER | W858: PORT MELBOURNE | X858: 9 | Y858: 7 | Z858: 0 | AA858: 1723 | AB858: 1566 | AC858: =(AA858/AB858)*100 -> 110.02554278416348 | AD858: =(X858*4)+(Z858*2) -> 36
A859: FRANKSTON | C859: 9 | D859: 1 | E859: =(C859*6)+D859 -> 55 | G859: 12 | H859: 3 | I859: =(G859*6)+H859 -> 75 | K859: 21 | L859: 5 | M859: =(K859*6)+L859 -> 131 | O859: 26 | P859: 7 | Q859: 163 | S859: Venue: FRANKSTON
A860: WERRIBEE | C860: 1 | D860: 2 | E860: =(C860*6)+D860 -> 8 | G860: 5 | H860: 8 | I860: =(G860*6)+H860 -> 38 | K860: 5 | L860: 9 | M860: =(K860*6)+L860 -> 39 | O860: 8 | P860: 12 | Q860: 60 | W860: FRANKSTON | X860: 9 | Y860: 7 | Z860: 0 | AA860: 1752 | AB860: 1826 | AC860: =(AA860/AB860)*100 -> 95.947426067907998 | AD860: =(X860*4)+(Z860*2) -> 36
A861: BEST PLAYERS | W861: WERRIBEE | X861: 8 | Y861: 8 | Z861: 0 | AA861: 1632 | AB861: 1486 | AC861: =(AA861/AB861)*100 -> 109.82503364737551 | AD861: =(X861*4)+(Z861*2) -> 32
A862: FRANKSTON | C862: GOOSEY | F862: MORWOOD | I862: MACKAY | L862: BROWN | O862: BOONKAMP | R862: WEBB | W862: WILLIAMSTOWN | X862: 7 | Y862: 9 | Z862: 0 | AA862: 1330 | AB862: 1619 | AC862: =(AA862/AB862)*100 -> 82.149474984558367 | AD862: =(X862*4)+(Z862*2) -> 28
A863: WERRIBEE | C863: WILKINS | F863: SMITH | I863: NORMINGTON | L863: RYAN | O863: SALTALAMACCHIA | W863: PRESTON | X863: 4 | Y863: 12 | Z863: 0 | AA863: 1343 | AB863: 1667 | AC863: =(AA863/AB863)*100 -> 80.563887222555479 | AD863: =(X863*4)+(Z863*2) -> 16
A864: GOALKICKERS | P864: VERBEEK | R864: KIMPTON | W864: OAKLEIGH | X864: 4 | Y864: 12 | Z864: 0 | AA864: 1380 | AB864: 1857 | AC864: =(AA864/AB864)*100 -> 74.313408723747969 | AD864: =(X864*4)+(Z864*2) -> 16
A865: FRANKSTON | C865: MACKAY 8 | F865: WOOD 5 | H865: BOONKAMP 4 | K865: RYAN 2 | M865: WILLIAMS 2 | O865: NAPOLI | Q865: GAHAN | S865: BROWN | W865: COBURG | X865: 4 | Y865: 12 | Z865: 0 | AA865: 1232 | AB865: 1814 | AC865: =(AA865/AB865)*100 -> 67.9162072767365 | AD865: =(X865*4)+(Z865*2) -> 16
A866: WERRIBEE | C866: AZIZ 4 | E866: SMITH | G866: McDONALD | J866: EAMES | L866: RAEBURN | W866: PRAHRAN | X866: 3 | Y866: 13 | Z866: 0 | AA866: 1314 | AB866: 1970 | AC866: =(AA866/AB866)*100 -> 66.700507614213194 | AD866: =(X866*4)+(Z866*2) -> 12
A868: OAKLEIGH | C868: 2 | D868: 3 | E868: =(C868*6)+D868 -> 15 | G868: 8 | H868: 8 | I868: =(G868*6)+H868 -> 56 | K868: 12 | L868: 12 | M868: =(K868*6)+L868 -> 84 | O868: 22 | P868: 14 | Q868: 146 | S868: Venue: OAKLEIGH
A869: COBURG | C869: 5 | D869: 2 | E869: =(C869*6)+D869 -> 32 | G869: 7 | H869: 4 | I869: =(G869*6)+H869 -> 46 | K869: 12 | L869: 9 | M869: =(K869*6)+L869 -> 81 | O869: 17 | P869: 11 | Q869: 113
A870: BEST PLAYERS
A871: OAKLEIGH | C871: RI STUBBS | F871: BRIGGS | I871: WICKS | L871: MELLODY | O871: COURTNEY | R871: RE STUBBS
A872: COBURG | C872: SALVADORE | F872: R O'MEARA | I872: BAKER | L872: ZIROS | O872: LISTON
A873: GOALKICKERS
A874: OAKLEIGH | C874: RI STUBBS 9 | F874: DALE 4 | H874: AUBREY 3 | J874: MORELAND 2 | M874: GARBUIO | O874: COURTNEY | Q874: A SULLIVAN | T874: WICKS
A875: COBURG | C875: ALESSIO 4 | F875: BAKER 3 | H875: ZIROS 2 | J875: P O'MEARA | M875: SALVADORE | P875: GLENN | R875: SEMAAN | U875: SIR
O876: BARCLAY | Q876: TARANTO | S876: M GILL
A877: PORT MELBOURNE | C877: 7 | D877: 5 | E877: =(C877*6)+D877 -> 47 | G877: 8 | H877: 7 | I877: =(G877*6)+H877 -> 55 | K877: 13 | L877: 10 | M877: =(K877*6)+L877 -> 88 | O877: 17 | P877: 12 | Q877: 114 | S877: Venue: TOORAK PARK
A878: PRAHRAN | C878: 2 | D878: 4 | E878: =(C878*6)+D878 -> 16 | G878: 8 | H878: 6 | I878: =(G878*6)+H878 -> 54 | K878: 9 | L878: 11 | M878: =(K878*6)+L878 -> 65 | O878: 14 | P878: 11 | Q878: 95
A879: BEST PLAYERS
A880: PORT MELBOURNE | C880: MOYLAN | F880: SHAW | I880: KEIGHRAN | L880: CLOKE | O880: HEHIR | R880: JAMES
A881: PRAHRAN | C881: MARTELLO | F881: MORRISSEY | I881: McLACHLAN | L881: LUCAS | O881: TUDDENHAM | R881: HARTMAN
A882: GOALKICKERS
A883: PORT MELBOURNE | C883: HARLAND 3 | F883: JAMES 3 | H883: SEXTON 2 | J883: HICKS 2 | L883: McGEE 2 | N883: CLOKE | P883: BAILEY | R883: K BOWDEN | U883: DI BLASI | X883: CHEEL
A884: PRAHRAN | C884: PARSONS 4 | F884: SINNI 2 | H884: TUDDENHAM 2 | K884: GRAY | M884: WARBURTON | P884: COOTE | R884: KILEY | T884: KEIPERT | W884: ELLINGHAUS
A886: SANDRINGHAM | C886: 2 | D886: 4 | E886: =(C886*6)+D886 -> 16 | G886: 4 | H886: 8 | I886: =(G886*6)+H886 -> 32 | K886: 7 | L886: 10 | M886: =(K886*6)+L886 -> 52 | O886: 15 | P886: 17 | Q886: 107 | S886: Venue: PRESTON
A887: PRESTON | C887: 1 | D887: 4 | E887: =(C887*6)+D887 -> 10 | G887: 3 | H887: 6 | I887: =(G887*6)+H887 -> 24 | K887: 6 | L887: 7 | M887: =(K887*6)+L887 -> 43 | O887: 9 | P887: 7 | Q887: 61 | S887: BLOXIDGE :MANN
A888: BEST PLAYERS
A889: SANDRINGHAM | C889: FOLEY | F889: MOLONEY | I889: JOHNSTONE | L889: MITCHELSON | O889: MACGEORGE | R889: BAILEY
A890: PRESTON | C890: DOBBS | F890: HARDENBERG | I890: MORRISH | L890: TAYLOR | O890: ESPENSCHIED
A891: GOALKICKERS
A892: SANDRINGHAM | C892: AMIET 6 | F892: MOLONEY 3 | I892: TARPEY 3 | K892: HERMAN | M892: CROUGH | O892: GOROZIDIS
A893: PRESTON | C893: KING 2 | E893: ESPENSCHIED 2 | H893: CARELLI 2 | J893: MILLER | L893: DOBBS | N893: DUPUY
A895: DANDENONG | C895: 3 | D895: 0 | E895: =(C895*6)+D895 -> 18 | G895: 9 | H895: 5 | I895: =(G895*6)+H895 -> 59 | K895: 16 | L895: 8 | M895: =(K895*6)+L895 -> 104 | O895: 21 | P895: 10 | Q895: 136 | S895: Venue: WILLIAMSTOWN
A896: WILLIAMSTOWN | C896: 7 | D896: 3 | E896: =(C896*6)+D896 -> 45 | G896: 8 | H896: 4 | I896: =(G896*6)+H896 -> 52 | K896: 12 | L896: 6 | M896: =(K896*6)+L896 -> 78 | O896: 14 | P896: 11 | Q896: 95
A897: BEST PLAYERS
A898: DANDENONG | C898: LACKO | F898: ATKINSON | I898: GEORGE | L898: SALIBA | O898: MILLANE | R898: MILLIGAN
A899: WILLIAMSTOWN | C899: VENNER | F899: B LLOYD | I899: S LLOYD | L899: ARCIERI | O899: PASTORE
A900: GOALKICKERS
A901: DANDENONG | C901: PRETTO 6 | F901: GEORGE 4 | I901: LACKO 3 | K901: BARWICK 3 | N901: CLIFFORD 2 | Q901: ATKINSON | S901: FOSTER | U901: MEAD
A902: WILLIAMSTOWN | C902: O'KEEFE 4 | F902: GHAZI 4 | H902: KNIGHT 2 | J902: ARCIERI 2 | M902: PASTORE | O902: HOUGH
A904: ROUND 17 | D904: 20TH AUGUST | I904: WEATHER | Y904: LADDER | AB904: ROUND | AD904: 17
D905: 1ST QTR | H905: 2ND QTR | L905: 3RD QTR | P905: FINAL | S905: Venue: PORT MELBOURNE
A906: FRANKSTON | C906: 8 | D906: 3 | E906: =(C906*6)+D906 -> 51 | G906: 11 | H906: 8 | I906: =(G906*6)+H906 -> 74 | K906: 12 | L906: 11 | M906: =(K906*6)+L906 -> 83 | O906: 13 | P906: 13 | Q906: 91 | S906: UMPIRES | W906: TEAM | X906: W | Y906: L | Z906: D | AA906: FOR | AB906: AGST | AC906: % | AD906: PTS
A907: PORT MELBOURNE | C907: 0 | D907: 2 | E907: =(C907*6)+D907 -> 2 | G907: 2 | H907: 6 | I907: =(G907*6)+H907 -> 18 | K907: 3 | L907: 11 | M907: =(K907*6)+L907 -> 29 | O907: 8 | P907: 15 | Q907: 63
A908: BEST PLAYERS | W908: SANDRINGHAM | X908: 15 | Y908: 2 | Z908: 0 | AA908: 2253 | AB908: 1182 | AC908: =(AA908/AB908)*100 -> 190.60913705583758 | AD908: =(X908*4)+(Z908*2) -> 60
A909: FRANKSTON | C909: GAHAN | F909: ESLER | I909: T HAMILL | L909: S HAMILL | O909: POLLOCK | R909: BROWN | W909: BOX HILL | X909: 12 | Y909: 5 | Z909: 0 | AA909: 1994 | AB909: 1452 | AC909: =(AA909/AB909)*100 -> 137.32782369146005 | AD909: =(X909*4)+(Z909*2) -> 48
A910: PORT MELBOURNE | C910: DULLARD | F910: KEIGHRAN | I910: SEXTON | L910: LOVE | O910: CHEEL | R910: HARKINS | W910: SPRINGVALE | X910: 12 | Y910: 5 | Z910: 0 | AA910: 1688 | AB910: 1372 | AC910: =(AA910/AB910)*100 -> 123.03206997084548 | AD910: =(X910*4)+(Z910*2) -> 48
A911: GOALKICKERS | W911: DANDENONG | X911: 12 | Y911: 5 | Z911: 0 | AA911: 1891 | AB911: 1666 | AC911: =(AA911/AB911)*100 -> 113.50540216086435 | AD911: =(X911*4)+(Z911*2) -> 48
A912: FRANKSTON | C912: MACKAY 5 | F912: BROWN 3 | I912: GAHAN 3 | K912: ROBERTSON | N912: BOONKAMP | W912: FRANKSTON | X912: 10 | Y912: 7 | Z912: 0 | AA912: 1843 | AB912: 1889 | AC912: =(AA912/AB912)*100 -> 97.564849126521963 | AD912: =(X912*4)+(Z912*2) -> 40
A913: PORT MELBOURNE | C913: S BOWDEN 2 | F913: HICKS 2 | H913: K BOWDEN | J913: LOVE | L913: CLOHESY | N913: HEHIR
D914: 21ST AUGUST | I914: WEATHER | W914: WERRIBEE | X914: 9 | Y914: 8 | Z914: 0 | AA914: 1729 | AB914: 1537 | AC914: =(AA914/AB914)*100 -> 112.4918672739102 | AD914: =(X914*4)+(Z914*2) -> 36
A915: DANDENONG | C915: 5 | D915: 3 | E915: =(C915*6)+D915 -> 33 | G915: 8 | H915: 7 | I915: =(G915*6)+H915 -> 55 | K915: 17 | L915: 11 | M915: =(K915*6)+L915 -> 113 | O915: 22 | P915: 15 | Q915: 147 | S915: Venue: DANDENONG | W915: PORT MELBOURNE | X915: 9 | Y915: 8 | Z915: 0 | AA915: 1786 | AB915: 1657 | AC915: =(AA915/AB915)*100 -> 107.78515389257694 | AD915: =(X915*4)+(Z915*2) -> 36
A916: PRESTON | C916: 1 | D916: 5 | E916: =(C916*6)+D916 -> 11 | G916: 6 | H916: 5 | I916: =(G916*6)+H916 -> 41 | K916: 8 | L916: 5 | M916: =(K916*6)+L916 -> 53 | O916: 10 | P916: 7 | Q916: 67 | W916: WILLIAMSTOWN | X916: 8 | Y916: 9 | Z916: 0 | AA916: 1425 | AB916: 1700 | AC916: =(AA916/AB916)*100 -> 83.82352941176471 | AD916: =(X916*4)+(Z916*2) -> 32
A917: BEST PLAYERS | W917: PRESTON | X917: 4 | Y917: 13 | Z917: 0 | AA917: 1410 | AB917: 1814 | AC917: =(AA917/AB917)*100 -> 77.728776185226025 | AD917: =(X917*4)+(Z917*2) -> 16
A918: DANDENONG | C918: MEAD | F918: HALL | I918: CLIFFORD | L918: MILLIGAN | O918: LACKO | Q918: ATKINSON | W918: OAKLEIGH | X918: 4 | Y918: 13 | Z918: 0 | AA918: 1465 | AB918: 2030 | AC918: =(AA918/AB918)*100 -> 72.167487684729053 | AD918: =(X918*4)+(Z918*2) -> 16
A919: PRESTON | C919: TAYLOR | F919: MORRISH | I919: DUPUY | L919: WALKER | W919: COBURG | X919: 4 | Y919: 13 | Z919: 0 | AA919: 1313 | AB919: 1909 | AC919: =(AA919/AB919)*100 -> 68.779465688842322 | AD919: =(X919*4)+(Z919*2) -> 16
A920: GOALKICKERS | Q920: MORRISON | W920: PRAHRAN | X920: 3 | Y920: 14 | Z920: 0 | AA920: 1392 | AB920: 2108 | AC920: =(AA920/AB920)*100 -> 66.034155597722972 | AD920: =(X920*4)+(Z920*2) -> 12
A921: DANDENONG | C921: PRETTO 5 | E921: ATKINSON 3 | H921: BURNELL 3 | J921: GEORGE 3 | L921: MILLIGAN 2 | N921: CLIFFORD 2 | Q921: HALL | R921: LACKO | T921: MEAD
A922: PRESTON | C922: IVEY 4 | E922: WALKER 2 | H922: DUPUY 2 | J922: KING | L922: CARELLI
A924: BOX HILL | C924: 7 | D924: 4 | E924: =(C924*6)+D924 -> 46 | G924: 11 | H924: 8 | I924: =(G924*6)+H924 -> 74 | K924: 14 | L924: 17 | M924: =(K924*6)+L924 -> 101 | O924: 19 | P924: 24 | Q924: 138 | S924: Venue: TOORAK PARK
A925: PRAHRAN | C925: 3 | D925: 6 | E925: =(C925*6)+D925 -> 24 | G925: 3 | H925: 8 | I925: =(G925*6)+H925 -> 26 | K925: 8 | L925: 10 | M925: =(K925*6)+L925 -> 58 | O925: 11 | P925: 12 | Q925: 78
A926: BEST PLAYERS
A927: BOX HILL | C927: O'NEILL | F927: CRAWLEY | I927: CROWLEY | L927: LISLE | O927: BANFIELD | R927: LIVINGSTONE
A928: PRAHRAN | C928: KILEY | F928: MORRISSEY | I928: WALFORD | L928: LUCAS | O928: MARTELLO | R928: HARTMAN
A929: GOALKICKERS
A930: BOX HILL | C930: CROWLEY 6 | F930: LIVINGSTONE 4 | I930: WILKINSON 4 | L930: TREWELLA 2 | O930: CRAWLEY | Q930: DALY | R930: ZARAFA
A931: PRAHRAN | C931: JAMES 2 | E931: GRAY 2 | G931: PARSONS 2 | J931: COOTE | L931: SINNI | N931: ELLINGHAUS | Q931: PANG | S931: TUDDENHAM
A933: SANDRINGHAM | C933: 6 | D933: 5 | E933: =(C933*6)+D933 -> 41 | G933: 19 | H933: 7 | I933: =(G933*6)+H933 -> 121 | K933: 23 | L933: 13 | M933: =(K933*6)+L933 -> 151 | O933: 26 | P933: 17 | Q933: 173 | S933: Venue: BEACH ROAD
A934: OAKLEIGH | C934: 1 | D934: 2 | E934: =(C934*6)+D934 -> 8 | G934: 5 | H934: 2 | I934: =(G934*6)+H934 -> 32 | K934: 10 | L934: 4 | M934: =(K934*6)+L934 -> 64 | O934: 13 | P934: 7 | Q934: 85 | S934: DAVIDSON :MILLER
A935: BEST PLAYERS
A936: SANDRINGHAM | C936: LAMBERT | F936: MITCHELSON | I936: MURRAY | L936: JOHNSTONE | O936: P McMASTER | R936: CROUGH
A937: OAKLEIGH | C937: RI STUBBS | F937: MORELAND | I937: AUBREY | L937: MELLODY
A938: GOALKICKERS
A939: SANDRINGHAM | C939: GOROZIDIS 7 | F939: AMIET 5 | H939: TARPEY 4 | J939: MCCRABB 3 | M939: BAILEY 2 | O939: MOLONEY 2 | R939: MITCHELSON | V939: MOREY | X939: SUTTON
A940: OAKLEIGH | C940: YOUNG 3 | F940: SAUNDERS 2 | I940: GARBUIO 2 | L940: BRIGGS | N940: QUIRK | P940: A SUTHERLAND | S940: R STUBBS | V940: AUBREY | X940: DALE
A942: WERRIBEE | C942: 1 | D942: 3 | E942: =(C942*6)+D942 -> 9 | G942: 4 | H942: 5 | I942: =(G942*6)+H942 -> 29 | K942: 13 | L942: 10 | M942: =(K942*6)+L942 -> 88 | O942: 14 | P942: 13 | Q942: 97 | S942: Venue: WERRIBEE
A943: SPRINGVALE | C943: 2 | D943: 3 | E943: =(C943*6)+D943 -> 15 | G943: 5 | H943: 9 | I943: =(G943*6)+H943 -> 39 | K943: 5 | L943: 9 | M943: =(K943*6)+L943 -> 39 | O943: 6 | P943: 15 | Q943: 51
A944: BEST PLAYERS
A945: WERRIBEE | C945: RAEBURN | F945: AZIZ | I945: SAUNDERS | L945: McDONALD | O945: FITZPATRICK | R945: EAMES
A946: SPRINGVALE | C946: JEFFS | F946: MORGAN | I946: D CARROLL | L946: ELLIOTT | O946: IRVING
A947: GOALKICKERS
A948: WERRIBEE | C948: EAMES 3 | E948: TAYLOR 2 | G948: WRIGHT 2 | I948: SMITH 2 | K948: LARKIN | M948: SALTALAMACCHIA | Q948: POWER | S948: RAEBURN | V948: McDONALD
A949: SPRINGVALE | C949: KOOP 2 | E949: O'DONNELL 2 | H949: CAPSALIS | J949: DYSON-HOLLAND
A951: WILLIAMSTOWN | C951: 3 | D951: 4 | E951: =(C951*6)+D951 -> 22 | G951: 5 | H951: 7 | I951: =(G951*6)+H951 -> 37 | K951: 12 | L951: 10 | M951: =(K951*6)+L951 -> 82 | O951: 14 | P951: 11 | Q951: 95 | S951: Venue: WILLIAMSTOWN
A952: COBURG | C952: 4 | D952: 3 | E952: =(C952*6)+D952 -> 27 | G952: 6 | H952: 5 | I952: =(G952*6)+H952 -> 41 | K952: 8 | L952: 9 | M952: =(K952*6)+L952 -> 57 | O952: 12 | P952: 9 | Q952: 81
A953: BEST PLAYERS
A954: WILLIAMSTOWN | C954: A VENNER | F954: MITCHELL | I954: O'KEEFE | L954: HOWLETT | O954: PASTORE | R954: WEST
A955: COBURG | C955: EVANS | F955: DAVID | I955: MAHER | L955: O'MEARA | O955: ZIROS | R955: TARANTO
A956: GOALKICKERS
A957: WILLIAMSTOWN | C957: O'KEEFE 5 | F957: PASTORE 3 | I957: MITCHELL 2 | L957: BARROW | N957: GHAZI | P957: B LLOYD | R957: KNIGHT
A958: COBURG | C958: EVANS 2 | F958: ALESSIO 2 | I958: M GILL | K958: FITZPATRICK | N958: SIR | O958: LISTON | Q958: BAKER | S958: ZIROS | U958: SALVADORE | X958: FRAZER
A960: ROUND 18 | D960: 27TH AUGUST | I960: WEATHER
D961: 1ST QTR | H961: 2ND QTR | L961: 3RD QTR | P961: FINAL | S961: Venue: BOX HILL
A962: BOX HILL | C962: 8 | D962: 4 | E962: =(C962*6)+D962 -> 52 | G962: 11 | H962: 9 | I962: =(G962*6)+H962 -> 75 | K962: 16 | L962: 13 | M962: =(K962*6)+L962 -> 109 | O962: 20 | P962: 16 | Q962: 136 | S962: UMPIRES | Y962: LADDER | AB962: ROUND | AD962: 18
A963: WERRIBEE | C963: 3 | D963: 2 | E963: =(C963*6)+D963 -> 20 | G963: 6 | H963: 3 | I963: =(G963*6)+H963 -> 39 | K963: 9 | L963: 4 | M963: =(K963*6)+L963 -> 58 | O963: 11 | P963: 8 | Q963: 74
A964: BEST PLAYERS | W964: TEAM | X964: W | Y964: L | Z964: D | AA964: FOR | AB964: AGST | AC964: % | AD964: PTS
A965: BOX HILL | C965: O'NEILL | F965: LISLE | I965: ROWE | L965: HUGHSON | O965: BANFIELD | R965: BOURKE
A966: WERRIBEE | C966: SMITH | F966: RAEBURN | I966: McMASTER | L966: RAEBURN | W966: SANDRINGHAM | X966: 16 | Y966: 2 | Z966: 0 | AA966: 2425 | AB966: 1256 | AC966: =(AA966/AB966)*100 -> 193.07324840764329 | AD966: =(X966*4)+(Z966*2) -> 64
A967: GOALKICKERS | P967: ZARAFA | W967: BOX HILL | X967: 13 | Y967: 5 | Z967: 0 | AA967: 2130 | AB967: 1526 | AC967: =(AA967/AB967)*100 -> 139.5806028833552 | AD967: =(X967*4)+(Z967*2) -> 52
A968: BOX HILL | C968: McBEAN 5 | E968: BOURKE 4 | G968: DALY 4 | I968: CROWLEY 3 | L968: HUGHSON | N968: LIVINGSTONE | Q968: TREWELLA | W968: SPRINGVALE | X968: 13 | Y968: 5 | Z968: 0 | AA968: 1804 | AB968: 1413 | AC968: =(AA968/AB968)*100 -> 127.67162066525124 | AD968: =(X968*4)+(Z968*2) -> 52
A969: WERRIBEE | C969: SALTALAMACCHIA 2 | G969: SMITH | I969: WRIGHT | K969: CULLEN | M969: EAMES | O969: McDONALD | Q969: McMASTER | W969: DANDENONG | X969: 13 | Y969: 5 | Z969: 0 | AA969: 2048 | AB969: 1812 | AC969: =(AA969/AB969)*100 -> 113.0242825607064 | AD969: =(X969*4)+(Z969*2) -> 52
D970: 28TH AUGUST | I970: WEATHER | L970: RAEBURN | N970: AZIZ | P970: WILLIAMS | S970: Venue: COBURG | W970: FRANKSTON | X970: 11 | Y970: 7 | Z970: 0 | AA970: 1985 | AB970: 1934 | AC970: =(AA970/AB970)*100 -> 102.63702171664943 | AD970: =(X970*4)+(Z970*2) -> 44
A971: SANDRINGHAM | C971: 9 | D971: 2 | E971: =(C971*6)+D971 -> 56 | G971: 10 | H971: 6 | I971: =(G971*6)+H971 -> 66 | K971: 17 | L971: 13 | M971: =(K971*6)+L971 -> 115 | O971: 26 | P971: 16 | Q971: 172 | S971: ADAMS
A972: COBURG | C972: 2 | D972: 1 | E972: =(C972*6)+D972 -> 13 | G972: 8 | H972: 3 | I972: =(G972*6)+H972 -> 51 | K972: 9 | L972: 3 | M972: =(K972*6)+L972 -> 57 | O972: 10 | P972: 6 | Q972: 66 | S972: SERCIA | W972: WERRIBEE | X972: 9 | Y972: 9 | Z972: 0 | AA972: 1803 | AB972: 1673 | AC972: =(AA972/AB972)*100 -> 107.77047220561865 | AD972: =(X972*4)+(Z972*2) -> 36
A973: BEST PLAYERS | W973: PORT MELBOURNE | X973: 9 | Y973: 9 | Z973: 0 | AA973: 1827 | AB973: 1773 | AC973: =(AA973/AB973)*100 -> 103.04568527918782 | AD973: =(X973*4)+(Z973*2) -> 36
A974: SANDRINGHAM | C974: GARRETT | F974: MACGEORGE | I974: TARPEY | L974: MITCHELSON | O974: BAILEY | R974: FOLEY | W974: WILLIAMSTOWN | X974: 8 | Y974: 10 | Z974: 0 | AA974: 1495 | AB974: 1802 | AC974: =(AA974/AB974)*100 -> 82.963374028856833 | AD974: =(X974*4)+(Z974*2) -> 32
A975: COBURG | C975: DAVID | F975: BAKER | I975: HAWKINS | L975: LISTON | O975: CASTELLO | R975: SALVADORE | W975: PRESTON | X975: 5 | Y975: 13 | Z975: 0 | AA975: 1512 | AB975: 1884 | AC975: =(AA975/AB975)*100 -> 80.254777070063696 | AD975: =(X975*4)+(Z975*2) -> 20
A976: GOALKICKERS | Q976: MITCHELSON | W976: OAKLEIGH | X976: 4 | Y976: 14 | Z976: 0 | AA976: 1611 | AB976: 2187 | AC976: =(AA976/AB976)*100 -> 73.66255144032921 | AD976: =(X976*4)+(Z976*2) -> 16
A977: SANDRINGHAM | C977: TARPEY 6 | E977: GOROZIDIS 6 | H977: AMIET 6 | J977: FOLEY 2 | L977: GARRETT 2 | N977: McCRABB | P977: MOREY | R977: SNOOKS | W977: COBURG | X977: 4 | Y977: 14 | Z977: 0 | AA977: 1379 | AB977: 2081 | AC977: =(AA977/AB977)*100 -> 66.266218164344068 | AD977: =(X977*4)+(Z977*2) -> 16
A978: COBURG | C978: GRIFFITHS 2 | F978: CASTELLO 2 | I978: ALESSIO 2 | K978: NICOL;AOU | N978: SALVADORE | Q978: DICKSON | S978: BAKER | W978: PRAHRAN | X978: 3 | Y978: 15 | Z978: 0 | AA978: 1427 | AB978: 2250 | AC978: =(AA978/AB978)*100 -> 63.422222222222224 | AD978: =(X978*4)+(Z978*2) -> 12
A980: FRANKSTON | C980: 3 | D980: 4 | E980: =(C980*6)+D980 -> 22 | G980: 9 | H980: 11 | I980: =(G980*6)+H980 -> 65 | K980: 14 | L980: 15 | M980: =(K980*6)+L980 -> 99 | O980: 20 | P980: 22 | Q980: 142 | S980: Venue: FRANKSTON
A981: PRAHRAN | C981: 1 | D981: 1 | E981: =(C981*6)+D981 -> 7 | G981: 1 | H981: 3 | I981: =(G981*6)+H981 -> 9 | K981: 3 | L981: 4 | M981: =(K981*6)+L981 -> 22 | O981: 5 | P981: 5 | Q981: 35
A982: BEST PLAYERS
A983: FRANKSTON | C983: ESLER | F983: S HAMILL | I983: MARTIN | L983: MORWOOD | O983: WILLIAMS | R983: BROWN
A984: PRAHRAN | C984: WALFORD | F984: KILEY | I984: MORRISSEY | L984: LUCAS
A985: GOALKICKERS
A986: FRANKSTON | C986: WILLIAMS 4 | F986: WOOD 3 | H986: MACKAY 3 | J986: BROWN 2 | L986: LANCE 2 | N986: GOOSEY | P986: S HAMILL | R986: BOONKAMP | V986: VERBEEK | X986: ESLER | Z986: KIMPTON
A987: PRAHRAN | C987: KEIPERT 3 | F987: BROOK | H987: PARSONS
A989: DANDENONG | C989: 6 | D989: 4 | E989: =(C989*6)+D989 -> 40 | G989: 13 | H989: 11 | I989: =(G989*6)+H989 -> 89 | K989: 18 | L989: 14 | M989: =(K989*6)+L989 -> 122 | O989: 23 | P989: 19 | Q989: 157 | S989: Venue: OAKLEIGH
A990: OAKLEIGH | C990: 3 | D990: 2 | E990: =(C990*6)+D990 -> 20 | G990: 9 | H990: 4 | I990: =(G990*6)+H990 -> 58 | K990: 14 | L990: 11 | M990: =(K990*6)+L990 -> 95 | O990: 22 | P990: 14 | Q990: 146
A991: BEST PLAYERS
A992: DANDENONG | C992: GOTTLIEBSEN | F992: CLIFFORD | I992: BURNELL | L992: ATKINSON | O992: TAYLOR | R992: PRETTO
A993: OAKLEIGH | C993: QUIRK | F993: MELLODY | I993: COURTNEY | L993: A SUTHERLAND | O993: YOUNG | R993: AUBREY
A994: GOALKICKERS
A995: DANDENONG | C995: PRETTO 7 | E995: CASSETT 3 | G995: CLIFFORD 3 | I995: BARWICK 2 | L995: ESLICK 2 | N995: FOSTER 2 | P995: GEORGE | R995: SRUK | T995: TAYLOR | W995: COX
A996: OAKLEIGH | C996: RI STUBBS 5 | F996: AUBREY 4 | I996: YOUNG 3 | K996: A SUTHERLAND 3 | N996: COLLINS 2 | Q996: RE STUBBS 2 | T996: SAUNDERS 2 | X996: MELLODY
A998: PRESTON | C998: 4 | D998: 4 | E998: =(C998*6)+D998 -> 28 | G998: 7 | H998: 8 | I998: =(G998*6)+H998 -> 50 | K998: 12 | L998: 14 | M998: =(K998*6)+L998 -> 86 | O998: 14 | P998: 18 | Q998: 102 | S998: Venue: PRESTON
A999: WILLIAMSTOWN | C999: 2 | D999: 4 | E999: =(C999*6)+D999 -> 16 | G999: 5 | H999: 5 | I999: =(G999*6)+H999 -> 35 | K999: 5 | L999: 7 | M999: =(K999*6)+L999 -> 37 | O999: 10 | P999: 10 | Q999: 70
A1000: BEST PLAYERS
A1001: PRESTON | C1001: CARELLI | F1001: TAYLOR | I1001: BIZZOTTO | L1001: WALKER | O1001: KING | R1001: DOBBS
A1002: WILLIAMSTOWN | C1002: VENNER | F1002: HOWLETT | I1002: LLOYD | L1002: MITCHELL
A1003: GOALKICKERS
A1004: PRESTON | C1004: KING 5 | E1004: CARELLI 4 | H1004: DUPUY 3 | J1004: TAYLOR | L1004: DOBBS
A1005: WILLIAMSTOWN | C1005: O'CONNOR 3 | F1005: O'KEEFE 2 | I1005: ARCIERI | K1005: KNIGHT | M1005: GHAZI | O1005: PASTORE | Q1005: BLOOM
A1007: SPRINGVALE | C1007: 1 | D1007: 3 | E1007: =(C1007*6)+D1007 -> 9 | G1007: 8 | H1007: 5 | I1007: =(G1007*6)+H1007 -> 53 | K1007: 13 | L1007: 11 | M1007: =(K1007*6)+L1007 -> 89 | O1007: 16 | P1007: 20 | Q1007: 116 | S1007: Venue: SPRINGVALE
A1008: PORT MELBOURNE | C1008: 2 | D1008: 3 | E1008: =(C1008*6)+D1008 -> 15 | G1008: 2 | H1008: 5 | I1008: =(G1008*6)+H1008 -> 17 | K1008: 3 | L1008: 5 | M1008: =(K1008*6)+L1008 -> 23 | O1008: 6 | P1008: 5 | Q1008: 41
A1009: BEST PLAYERS
A1010: SPRINGVALE | C1010: CAPSALIS | F1010: JEFFS | I1010: CLARK | L1010: CAPLES | O1010: KOOP
A1011: PORT MELBOURNE | C1011: MOYLAN | F1011: LAFFY | I1011: SAUNDERS | L1011: S BOWDEN | O1011: HARKINS | R1011: HEHIR
A1012: GOALKICKERS
A1013: SPRINGVALE | C1013: BALDWIN 4 | F1013: PHILLIPS 3 | I1013: DYSON-HOLLAND 2 | M1013: HALPHEN 2 | P1013: O'DONNELL | R1013: DAVISON | U1013: CARROLL | X1013: IRVING | Z1013: EVANS
A1014: PORT MELBOURNE | C1014: S BOWDEN 2 | F1014: MOYLAN 2 | I1014: DULLARD | K1014: MORTON
A1016: FINALS
A1017: ELIMINATION | D1017: 4TH SEPTEMBER | I1017: WEATHER
D1018: 1ST QTR | H1018: 2ND QTR | L1018: 3RD QTR | P1018: FINAL | S1018: Venue: VICTORIA PARK
A1019: DANDENONG | C1019: 6 | D1019: 5 | E1019: =(C1019*6)+D1019 -> 41 | G1019: 10 | H1019: 7 | I1019: =(G1019*6)+H1019 -> 67 | K1019: 13 | L1019: 14 | M1019: =(K1019*6)+L1019 -> 92 | O1019: 19 | P1019: 15 | Q1019: 129 | S1019: UMPIRES
A1020: FRANKSTON | C1020: 1 | D1020: 1 | E1020: =(C1020*6)+D1020 -> 7 | G1020: 3 | H1020: 8 | I1020: =(G1020*6)+H1020 -> 26 | K1020: 4 | L1020: 12 | M1020: =(K1020*6)+L1020 -> 36 | O1020: 9 | P1020: 17 | Q1020: 71
A1021: BEST PLAYERS
A1022: DANDENONG | C1022: LACKO | F1022: HALL | I1022: ATKINSON | L1022: D TAYLOR | O1022: BARWICK | R1022: MEAD
A1023: FRANKSTON | C1023: RYAN | F1023: POLLOCK | I1023: MACKAY | L1023: VERBEEK
A1024: GOALKICKERS
A1025: DANDENONG | C1025: BARWICK 5 | F1025: CASSETT 3 | I1025: D TAYLOR 3 | L1025: CLIFFORD 2 | N1025: GEORGE | P1025: MEAD | R1025: PRETTO | T1025: FOSTER | W1025: MORRISON | X1025: HALL
A1026: FRANKSTON | C1026: MACKAY 4 | F1026: VERBEEK 2 | I1026: WILLIAMS | L1026: KIMPTON | N1026: WOOD
A1028: QUALIFYING | D1028: 3RD SEPTEMBER | I1028: WEATHER
A1029: BOX HILL | C1029: 6 | D1029: 1 | E1029: =(C1029*6)+D1029 -> 37 | G1029: 8 | H1029: 5 | I1029: =(G1029*6)+H1029 -> 53 | K1029: 10 | L1029: 7 | M1029: =(K1029*6)+L1029 -> 67 | O1029: 10 | P1029: 14 | Q1029: 74 | S1029: Venue: VICTORIA PARK
A1030: SPRINGVALE | C1030: 2 | D1030: 3 | E1030: =(C1030*6)+D1030 -> 15 | G1030: 6 | H1030: 6 | I1030: =(G1030*6)+H1030 -> 42 | K1030: 7 | L1030: 9 | M1030: =(K1030*6)+L1030 -> 51 | O1030: 7 | P1030: 14 | Q1030: 56 | S1030: PANOZZO :ELLIS
A1031: BEST PLAYERS
A1032: BOX HILL | C1032: LISLE | F1032: ROWE | I1032: SWAN | L1032: O'NEILL | O1032: WILKINSON | R1032: HEANEY
A1033: SPRINGVALE | C1033: SUTHERLAND | F1033: EVANS | I1033: JEFFS | L1033: DAVISON | O1033: CARROLL | R1033: CLARK
A1034: GOALKICKERS
A1035: BOX HILL | C1035: WILKINSON 4 | F1035: BOURKE | I1035: COHEN | K1035: CROWLEY | M1035: GREIG | O1035: McBEAN | Q1035: ZARAFA
A1036: SPRINGVALE | C1036: EVANS 4 | F1036: BALDWIN | I1036: DYSON-HOLLAND | M1036: HALPHEN
A1038: 1ST SEMI | D1038: 10TH SEPTEMBER | I1038: WEATHER
A1039: SPRINGVALE | C1039: 7 | D1039: 6 | E1039: =(C1039*6)+D1039 -> 48 | G1039: 13 | H1039: 8 | I1039: =(G1039*6)+H1039 -> 86 | K1039: 13 | L1039: 15 | M1039: =(K1039*6)+L1039 -> 93 | O1039: 16 | P1039: 19 | Q1039: 115 | S1039: Venue: VICTORIA PARK
A1040: DANDENONG | C1040: 4 | D1040: 0 | E1040: =(C1040*6)+D1040 -> 24 | G1040: 7 | H1040: 3 | I1040: =(G1040*6)+H1040 -> 45 | K1040: 10 | L1040: 4 | M1040: =(K1040*6)+L1040 -> 64 | O1040: 11 | P1040: 7 | Q1040: 73 | S1040: GOODRIDGE :CAULFIELD
A1041: BEST PLAYERS
A1042: SPRINGVALE | C1042: JEFFS | F1042: CAPLES | I1042: DYSON-HOLLAND | L1042: KOOP | O1042: DILLON | R1042: CARROLL
A1043: DANDENONG | C1043: MORRISON | F1043: GEORGE | I1043: ATKINSON | L1043: CLIFFORD | O1043: MARSHALL | R1043: D TAYLOR
A1044: GOALKICKERS
A1045: SPRINGVALE | C1045: EVANS 4 | F1045: BALDWIN 3 | I1045: KNIGHT 2 | K1045: DYSON-HOLLAND 2 | O1045: PHILLIPS | Q1045: DAVISON | S1045: IRVING | U1045: KOOP | W1045: DILLON
A1046: DANDENONG | C1046: CASSETT 3 | F1046: GEORGE 3 | I1046: MORRISON 3 | L1046: CLIFFORD | O1046: O'BRIEN
A1048: 2ND SEMI | D1048: 11TH SEPTEMBER | I1048: WEATHER
A1049: SANDRINGHAM | C1049: 4 | D1049: 5 | E1049: =(C1049*6)+D1049 -> 29 | G1049: 7 | H1049: 12 | I1049: =(G1049*6)+H1049 -> 54 | K1049: 10 | L1049: 17 | M1049: =(K1049*6)+L1049 -> 77 | O1049: 12 | P1049: 21 | Q1049: 93 | S1049: Venue: VICTORIA PARK
A1050: BOX HILL | C1050: 2 | D1050: 7 | E1050: =(C1050*6)+D1050 -> 19 | G1050: 7 | H1050: 9 | I1050: =(G1050*6)+H1050 -> 51 | K1050: 9 | L1050: 13 | M1050: =(K1050*6)+L1050 -> 67 | O1050: 12 | P1050: 15 | Q1050: 87
A1051: BEST PLAYERS
A1052: SANDRINGHAM | C1052: TARPEY | F1052: MITCHELSON | I1052: ALLEN | L1052: McMASTER | O1052: CROUGH | R1052: CLARKSON
A1053: BOX HILL | C1053: D ROWE | F1053: SWAN | I1053: O'NEILL | L1053: LISLE | O1053: HEANEY | R1053: DALY
A1054: GOALKICKERS
A1055: SANDRINGHAM | C1055: AMIET 3 | F1055: FOLEY 2 | H1055: TARPEY 2 | K1055: GOROZIDIS 2 | N1055: ALLEN | P1055: MOLONEY | R1055: GARRETT
A1056: BOX HILL | C1056: DALY 2 | E1056: TREWELLA 2 | H1056: WILKINSON 2 | K1056: COHEN | M1056: CROWLEY | O1056: HEANEY | Q1056: LIVINGSTONE | T1056: D ROWE | W1056: ZARAFA
A1058: PRELIMINARY | D1058: 18TH SEPTEMBER
A1059: BOX HILL | C1059: 3 | D1059: 3 | E1059: =(C1059*6)+D1059 -> 21 | G1059: 6 | H1059: 5 | I1059: =(G1059*6)+H1059 -> 41 | K1059: 13 | L1059: 9 | M1059: =(K1059*6)+L1059 -> 87 | O1059: 18 | P1059: 12 | Q1059: 120 | S1059: Venue: VICTORIA PARK
A1060: SPRINGVALE | C1060: 3 | D1060: 4 | E1060: =(C1060*6)+D1060 -> 22 | G1060: 3 | H1060: 6 | I1060: =(G1060*6)+H1060 -> 24 | K1060: 6 | L1060: 7 | M1060: =(K1060*6)+L1060 -> 43 | O1060: 7 | P1060: 12 | Q1060: 54 | S1060: SEXTON ;PRINCE
A1061: BEST PLAYERS
A1062: BOX HILL | C1062: COHEN | F1062: GREIG | I1062: O'NEILL | L1062: QUINN | O1062: SWAN | R1062: WILKINSON
A1063: SPRINGVALE | C1063: CARROLL | F1063: CAPLES | I1063: CLARK | L1063: KNIGHT | O1063: KOOP | R1063: SUTHERLAND
A1064: GOALKICKERS
A1065: BOX HILL | C1065: WILKINSON 5 | F1065: DALY 3 | H1065: EVANS 3 | J1065: TREWELLA 2 | M1065: ZARAFA 2 | O1065: GREIG | Q1065: HUGHSON | S1065: LIVINGSTONE
A1066: SPRINGVALE | C1066: PEACOCK | F1066: CARROLL | H1066: CARIS | J1066: FOGARTY | L1066: EVANS | N1066: DILLON | P1066: HALPHEN
A1068: GRAND | D1068: 25TH SEPTEMBER
A1069: SANDRINGHAM | C1069: 0 | D1069: 2 | E1069: =(C1069*6)+D1069 -> 2 | G1069: 2 | H1069: 6 | I1069: =(G1069*6)+H1069 -> 18 | K1069: 5 | L1069: 9 | M1069: =(K1069*6)+L1069 -> 39 | O1069: 11 | P1069: 12 | Q1069: 78 | S1069: Venue: VICTORIA PARK
A1070: BOX HILL | C1070: 3 | D1070: 2 | E1070: =(C1070*6)+D1070 -> 20 | G1070: 6 | H1070: 3 | I1070: =(G1070*6)+H1070 -> 39 | K1070: 9 | L1070: 9 | M1070: =(K1070*6)+L1070 -> 63 | O1070: 10 | P1070: 9 | Q1070: 69 | S1070: NICHOLLS :CAULFIELD
A1071: BEST PLAYERS
A1072: SANDRINGHAM
A1073: BOX HILL
A1074: GOALKICKERS
A1075: SANDRINGHAM
A1076: BOX HILL