A1: Victorian Football Association
A2: Season 1995
A3: © Copyright Wal Williams | F3: First created: 1 September 2016
A4: Contact: joywalwi at gmail dot com | F4: Last updated: 3 December 2016 | W4: VFA Results and tables - Link to the main index page
A5: You are free to copy this document in whole or part provided that proper acknowledgement is given to the author. All rights reserved.
A7: 1995 SEASON
A8: ROUND 1 | D8: 15TH APRIL | J8: WEATHER | S8: Venue: BEACH ROAD
D9: 1ST QTR | H9: 2ND QTR | L9: 3RD QTR | P9: FINAL | S9: UMPIRES | U9: SEXTON
A10: SANDRINGHAM | C10: 6 | D10: 1 | E10: =(C10*6)+D10 -> 37 | G10: 13 | H10: 5 | I10: =(G10*6)+H10 -> 83 | K10: 14 | L10: 7 | M10: =(K10*6)+L10 -> 91 | O10: 20 | P10: 11 | Q10: =(O10*6)+P10 -> 131 | S10: GODRIDGE | Z10: LADDER | AC10: ROUND | AE10: 1
A11: BOX HILL | C11: 4 | D11: 2 | E11: =(C11*6)+D11 -> 26 | G11: 6 | H11: 3 | I11: =(G11*6)+H11 -> 39 | K11: 9 | L11: 7 | M11: =(K11*6)+L11 -> 61 | O11: 12 | P11: 8 | Q11: =(O11*6)+P11 -> 80 | S11: MALCOLM
A12: BEST PLAYERS | W12: TEAM | X12: B | Y12: W | Z12: L | AA12: D | AB12: FOR | AC12: AGST | AD12: % | AE12: PTS
A13: SANDRINGHAM | D13: ALVIN | G13: SNOOKS | J13: WILLIAMS | M13: FOLEY | O13: CLARKSON | R13: MACGEORGE
A14: BOX HILL | D14: CROWLEY | G14: ELLINGHAUS | J14: IBRAHIM | M14: BADROCK | O14: JAMES | W14: SPRINGVALE | Y14: 1 | Z14: 0 | AA14: 0 | AB14: 99 | AC14: 22 | AD14: =(AB14/AC14)*100 -> 450 | AE14: =(Y14*4)+(AA14*2) -> 4
A15: GOALKICKERS | Q15: SCOTT-BRANIGAN | W15: PORT MELBOURNE | Y15: 1 | Z15: 0 | AA15: 0 | AB15: 123 | AC15: 37 | AD15: =(AB15/AC15)*100 -> 332.43243243243239 | AE15: =(Y15*4)+(AA15*2) -> 4
A16: SANDRINGHAM | D16: AMIET 5 | F16: SNOOKS 4 | I16: A KELLOWAY 3 | L16: TARPEY 3 | N16: FOLEY 2 | P16: ALVIN 2 | W16: SANDRINGHAM | Y16: 1 | Z16: 0 | AA16: 0 | AB16: 131 | AC16: 80 | AD16: =(AB16/AC16)*100 -> 163.75 | AE16: =(Y16*4)+(AA16*2) -> 4
A17: BOX HILL | D17: CROWLEY 5 | F17: GREIG 2 | H17: BADROCK | J17: McBEAN | L17: GOTTLIEBSEN | O17: IBRAHIM | Q17: LIVINGSTONE | W17: PRESTON | Y17: 1 | Z17: 0 | AA17: 0 | AB17: 151 | AC17: 135 | AD17: =(AB17/AC17)*100 -> 111.85185185185185 | AE17: =(Y17*4)+(AA17*2) -> 4
D18: 22ND APRIL | J18: WEATHER | S18: Venue: WILLIAMSTOWN | W18: COBURG | X18: 1 | Y18: 0 | Z18: 0 | AA18: 0 | AB18: 0 | AC18: 0 | AE18: =(Y18*4)+(AA18*2) -> 0
A19: PRESTON | C19: 2 | D19: 4 | E19: =(C19*6)+D19 -> 16 | G19: 9 | H19: 8 | I19: =(G19*6)+H19 -> 62 | K19: 16 | L19: 14 | M19: =(K19*6)+L19 -> 110 | O19: 22 | P19: 19 | Q19: =(O19*6)+P19 -> 151 | S19: HANLEY
A20: WILLIAMSTOWN | C20: 7 | D20: 1 | E20: =(C20*6)+D20 -> 43 | G20: 11 | H20: 3 | I20: =(G20*6)+H20 -> 69 | K20: 16 | L20: 4 | M20: =(K20*6)+L20 -> 100 | O20: 21 | P20: 9 | Q20: =(O20*6)+P20 -> 135 | S20: RUSSELL | W20: WILLIAMSTOWN | Y20: 0 | Z20: 1 | AA20: 0 | AB20: 135 | AC20: 151 | AD20: =(AB20/AC20)*100 -> 89.403973509933778 | AE20: =(Y20*4)+(AA20*2) -> 0
A21: BEST PLAYERS | W21: BOX HILL | Y21: 0 | Z21: 1 | AA21: 0 | AB21: 80 | AC21: 131 | AD21: =(AB21/AC21)*100 -> 61.068702290076338 | AE21: =(Y21*4)+(AA21*2) -> 0
A22: PRESTON | D22: BRYSON | G22: CARELLI | J22: DOBBS | M22: MORRISEY | O22: SHEARER | R22: MILLER | W22: WERRIBEE | Y22: 0 | Z22: 1 | AA22: 0 | AB22: 37 | AC22: 123 | AD22: =(AB22/AC22)*100 -> 30.081300813008134 | AE22: =(Y22*4)+(AA22*2) -> 0
A23: WILLIAMSTOWN | D23: PENNA | G23: VENNER | J23: LLOYD | M23: BUGEJA | O23: JACAVOU | R23: JOHANSEN | W23: FRANKSTON | Y23: 0 | Z23: 1 | AA23: 0 | AB23: 22 | AC23: 99 | AD23: =(AB23/AC23)*100 -> 22.222222222222221 | AE23: =(Y23*4)+(AA23*2) -> 0
A24: GOALKICKERS | Q24: MAIROANA
A25: PRESTON | D25: SHEARER 7 | F25: KING 5 | H25: AIELLO 3 | J25: CARELLI 3 | M25: HABERMAN | P25: ARMSTRONG | S25: MILLER
A26: WILLIAMSTOWN | D26: VENNER 4 | F26: JOHANSEN 3 | I26: LLOYD 3 | K26: TURCINOVICH 2 | N26: GHAZI 2 | P26: SHANKS | R26: PASTORE | U26: DUFF-TYLER | X26: HOUGH | Z26: JACOVOU | AC26: BUGEJA | AE26: PENNA
A28: SPRINGVALE | C28: 7 | D28: 4 | E28: =(C28*6)+D28 -> 46 | G28: 7 | H28: 9 | I28: =(G28*6)+H28 -> 51 | K28: 9 | L28: 12 | M28: =(K28*6)+L28 -> 66 | O28: 14 | P28: 15 | Q28: =(O28*6)+P28 -> 99 | S28: Venue: SPRINGVALE
A29: FRANKSTON | C29: 1 | D29: 1 | E29: =(C29*6)+D29 -> 7 | G29: 2 | H29: 6 | I29: =(G29*6)+H29 -> 18 | K29: 2 | L29: 8 | M29: =(K29*6)+L29 -> 20 | O29: 2 | P29: 10 | Q29: =(O29*6)+P29 -> 22
A30: BEST PLAYERS
A31: SPRINGVALE | D31: MELLODY | G31: TAYLOR | J31: BURNS | M31: JEFFREY | O31: DYSON-HOLLAND | S31: CARIS
A32: FRANKSTON | D32: D TAYLOR | G32: B MOORE | J32: ATKINSON | M32: SRUK | O32: S RYAN | S32: SALIBA
A33: GOALKICKERS
A34: SPRINGVALE | D34: CARIS 5 | F34: DILLON 3 | I34: TAYLOR 2 | L34: SMITH 2 | N34: DYSON-HOLLAND | R34: KNIGHT
A35: FRANKSTON | D35: SRUK | G35: D RYAN
A37: PORT MELBOURNE | C37: 1 | D37: 9 | E37: =(C37*6)+D37 -> 15 | G37: 3 | H37: 11 | I37: =(G37*6)+H37 -> 29 | K37: 11 | L37: 21 | M37: =(K37*6)+L37 -> 87 | O37: 16 | P37: 27 | Q37: =(O37*6)+P37 -> 123 | S37: Venue: PORT MELBOURNE
A38: WERRIBEE | C38: 0 | D38: 3 | E38: =(C38*6)+D38 -> 3 | G38: 2 | H38: 6 | I38: =(G38*6)+H38 -> 18 | K38: 2 | L38: 9 | M38: =(K38*6)+L38 -> 21 | O38: 4 | P38: 13 | Q38: =(O38*6)+P38 -> 37 | S38: PHILLIPS :DELLER :GILES
A39: BEST PLAYERS
A40: PORT MELBOURNE | D40: MOYLAN | G40: PICIOANE | J40: PITURA | M40: HARKINS | O40: BAILEY | R40: JAMES
A41: WERRIBEE | D41: ROACH | G41: McDONALD | J41: FITZPATRICK
A42: GOALKICKERS
A43: PORT MELBOURNE | D43: BERRY 7 | G43: HARKINS 3 | J43: SEXTON 3 | M43: JAMES | O43: BAILEY | Q43: LOCHEAD
A44: WERRIBEE | D44: O'CONNOR | G44: MAY | I44: BUTTON | K44: AZIZ
A46: BYE | D46: COBURG
A48: ROUND 2 | D48: 29TH APRIL | J48: WEATHER | S48: Venue: WERRIBEE
D49: 1ST QTR | H49: 2ND QTR | L49: 3RD QTR | P49: FINAL | S49: UMPIRES
A50: SPRINGVALE | C50: 5 | D50: 3 | E50: =(C50*6)+D50 -> 33 | G50: 12 | H50: 6 | I50: =(G50*6)+H50 -> 78 | K50: 16 | L50: 12 | M50: =(K50*6)+L50 -> 108 | O50: 20 | P50: 20 | Q50: =(O50*6)+P50 -> 140 | S50: EDWARDS | Z50: LADDER | AC50: ROUND | AE50: 2
A51: WERRIBEE | C51: 0 | D51: 3 | E51: =(C51*6)+D51 -> 3 | G51: 2 | H51: 3 | I51: =(G51*6)+H51 -> 15 | K51: 2 | L51: 8 | M51: =(K51*6)+L51 -> 20 | O51: 5 | P51: 8 | Q51: =(O51*6)+P51 -> 38 | S51: ROCK
A52: BEST PLAYERS | W52: TEAM | X52: B | Y52: W | Z52: L | AA52: D | AB52: FOR | AC52: AGST | AD52: % | AE52: PTS
A53: SPRINGVALE | D53: TAYLOR | G53: DILLON | J53: JEFFS | M53: CARROLL | O53: MELLODY | R53: BURNS
A54: WERRIBEE | D54: MITCHELL | G54: BUCHANAN | J54: EDWARDS | M54: ROACH | O54: McCARTHY | R54: P BALLAN | W54: SPRINGVALE | Y54: 2 | Z54: 0 | AA54: 0 | AB54: 239 | AC54: 60 | AD54: =(AB54/AC54)*100 -> 398.33333333333331 | AE54: =(Y54*4)+(AA54*2) -> 8
A55: GOALKICKERS | Q55: EVANS | W55: SANDRINGHAM | Y55: 2 | Z55: 0 | AA55: 0 | AB55: 190 | AC55: 115 | AD55: =(AB55/AC55)*100 -> 165.21739130434781 | AE55: =(Y55*4)+(AA55*2) -> 8
A56: SPRINGVALE | D56: DILLON 6 | F56: TAYLOR 4 | I56: CARIS 3 | K56: SMITH 2 | M56: MONTGOMERY 2 | P56: O'DONNELL | R56: GARBUIO | W56: PRESTON | Y56: 2 | Z56: 0 | AA56: 0 | AB56: 212 | AC56: 184 | AD56: =(AB56/AC56)*100 -> 115.21739130434783 | AE56: =(Y56*4)+(AA56*2) -> 8
A57: WERRIBEE | D57: McDONALD 2 | G57: BUCHANAN 2 | K57: CARROLL | W57: PORT MELBOURNE | Y57: 1 | Z57: 1 | AA57: 0 | AB57: 172 | AC57: 98 | AD57: =(AB57/AC57)*100 -> 175.51020408163265 | AE57: =(Y57*4)+(AA57*2) -> 4
D58: 30TH APRIL | J58: WEATHER | M58: FINE | S58: Venue: BOX HILL | W58: BOX HILL | Y58: 1 | Z58: 1 | AA58: 0 | AB58: 193 | AC58: 185 | AD58: =(AB58/AC58)*100 -> 104.32432432432432 | AE58: =(Y58*4)+(AA58*2) -> 4
A59: BOX HILL | C59: 9 | D59: 4 | E59: =(C59*6)+D59 -> 58 | G59: 12 | H59: 13 | I59: =(G59*6)+H59 -> 85 | K59: 13 | L59: 14 | M59: =(K59*6)+L59 -> 92 | O59: 16 | P59: 17 | Q59: =(O59*6)+P59 -> 113 | S59: GILES
A60: COBURG | C60: 2 | D60: 1 | E60: =(C60*6)+D60 -> 13 | G60: 3 | H60: 1 | I60: =(G60*6)+H60 -> 19 | K60: 6 | L60: 3 | M60: =(K60*6)+L60 -> 39 | O60: 8 | P60: 6 | Q60: =(O60*6)+P60 -> 54 | S60: SHEARER | W60: WILLIAMSTOWN | X60: 1 | Y60: 0 | Z60: 1 | AA60: 0 | AB60: 135 | AC60: 151 | AD60: =(AB60/AC60)*100 -> 89.403973509933778 | AE60: =(Y60*4)+(AA60*2) -> 0
A61: BEST PLAYERS | S61: MALCOLM | W61: COBURG | X61: 1 | Y61: 0 | Z61: 1 | AA61: 0 | AB61: 54 | AC61: 113 | AD61: =(AB61/AC61)*100 -> 47.787610619469028 | AE61: =(Y61*4)+(AA61*2) -> 0
A62: BOX HILL | D62: LIVINGSTONE | G62: JAMES | J62: SHANAHAN | M62: ZARAFA | O62: ELLINGHAUS | R62: PANNAM | W62: WERRIBEE | Y62: 0 | Z62: 2 | AA62: 0 | AB62: 75 | AC62: 263 | AD62: =(AB62/AC62)*100 -> 28.517110266159694 | AE62: =(Y62*4)+(AA62*2) -> 0
A63: COBURG | D63: ALESSIO | G63: ZIROS | J63: PORTER | W63: FRANKSTON | Y63: 0 | Z63: 2 | AA63: 0 | AB63: 57 | AC63: 158 | AD63: =(AB63/AC63)*100 -> 36.075949367088604 | AE63: =(Y63*4)+(AA63*2) -> 0
A64: GOALKICKERS | P64: LIVINGSTONE | S64: BREWER
A65: BOX HILL | D65: CROWLEY 3 | G65: DALY 3 | I65: WILKINSON 2 | L65: IBRAHIM 2 | N65: McFARLANE 2 | Q65: GRIFFEN | S65: ZARAFA
A66: COBURG | D66: AUBREY 4 | G66: DALE 3 | J66: PIESCIK
A68: SANDRINGHAM | C68: 1 | D68: 2 | E68: =(C68*6)+D68 -> 8 | G68: 4 | H68: 6 | I68: =(G68*6)+H68 -> 30 | K68: 6 | L68: 9 | M68: =(K68*6)+L68 -> 45 | O68: 8 | P68: 11 | Q68: =(O68*6)+P68 -> 59 | S68: Venue: FRANKSTON
A69: FRANKSTON | C69: 4 | D69: 1 | E69: =(C69*6)+D69 -> 25 | G69: 4 | H69: 2 | I69: =(G69*6)+H69 -> 26 | K69: 4 | L69: 3 | M69: =(K69*6)+L69 -> 27 | O69: 5 | P69: 5 | Q69: =(O69*6)+P69 -> 35 | S69: FRAUMANO :HANLEY :HEAD
A70: BEST PLAYERS
A71: SANDRINGHAM | D71: HERMAN | G71: RIENETS | J71: WILLIAMS | M71: CLARKSON | P71: MACGEORGE | S71: CROUGH
A72: FRANKSTON | D72: ANTHONY | G72: HOPGOOD | J72: PARKER | M72: ATKINSON | P72: KENNEDY | S72: MOORE
A73: GOALKICKERS
A74: SANDRINGHAM | D74: HERMAN 3 | G74: SCOTT-BRANIGAN 2 | L74: AMIET | N74: KELLAWAY | Q74: SNOOKS
A75: FRANKSTON | D75: LANCE 3 | G75: B BOWEY | J75: D TAYLOR
A77: PRESTON | C77: 1 | D77: 2 | E77: =(C77*6)+D77 -> 8 | G77: 3 | H77: 7 | I77: =(G77*6)+H77 -> 25 | K77: 4 | L77: 13 | M77: =(K77*6)+L77 -> 37 | O77: 7 | P77: 19 | Q77: =(O77*6)+P77 -> 61 | S77: Venue: PRESTON
A78: PORT MELBOURNE | C78: 4 | D78: 2 | E78: =(C78*6)+D78 -> 26 | G78: 5 | H78: 5 | I78: =(G78*6)+H78 -> 35 | K78: 6 | L78: 6 | M78: =(K78*6)+L78 -> 42 | O78: 7 | P78: 7 | Q78: =(O78*6)+P78 -> 49 | S78: ACKLAND :LOVE :NICHOLLS
A79: BEST PLAYERS
A80: PRESTON | D80: TAYLOR | G80: DOBBS | J80: HUCKER | M80: MORRISEY | P80: CUNNINGHAM | S80: KING
A81: PORT MELBOURNE | D81: KEIGHRAN | G81: McNAMARA | J81: SEXTON | M81: BAILEY
A82: GOALKICKERS
A83: PRESTON | D83: AIELLO 2 | G83: CARELLI | J83: DOBBS | L83: FLAVELL | O83: KING | Q83: TAYLOR
A84: PORT MELBOURNE | D84: SEXTON 3 | G84: CORRIGAN | J84: LOCHEAD | L84: HARKINS | O84: BERRY
A86: BYE | D86: WILLIAMSTOWN
A88: ROUND 3 | D88: 6TH MAY | J88: WEATHER | S88: Venue: COBURG
D89: 1ST QTR | H89: 2ND QTR | L89: 3RD QTR | P89: FINAL | S89: UMPIRES | U89: DELLER
A90: COBURG | C90: 6 | D90: 1 | E90: =(C90*6)+D90 -> 37 | G90: 8 | H90: 4 | I90: =(G90*6)+H90 -> 52 | K90: 14 | L90: 7 | M90: =(K90*6)+L90 -> 91 | O90: 21 | P90: 9 | Q90: =(O90*6)+P90 -> 135 | S90: FRAUMANO | Z90: LADDER | AC90: ROUND | AE90: 3
A91: FRANKSTON | C91: 1 | D91: 8 | E91: =(C91*6)+D91 -> 14 | G91: 4 | H91: 10 | I91: =(G91*6)+H91 -> 34 | K91: 9 | L91: 18 | M91: =(K91*6)+L91 -> 72 | O91: 12 | P91: 20 | Q91: =(O91*6)+P91 -> 92 | S91: PHILLIPS
A92: BEST PLAYERS | W92: TEAM | X92: B | Y92: W | Z92: L | AA92: D | AB92: FOR | AC92: AGST | AD92: % | AE92: PTS
A93: COBURG | D93: ZIROS | F93: DALE | I93: SALVADOR | L93: PORTER | N93: GRIFFITHS | Q93: RACOVOLIS
A94: FRANKSTON | D94: BOWEY | F94: PICKERING | I94: ANTHONY | L94: RYAN | N94: BURNELL | Q94: TAYLOR | W94: SPRINGVALE | Y94: 3 | Z94: 0 | AA94: 0 | AB94: 370 | AC94: 139 | AD94: =(AB94/AC94)*100 -> 266.1870503597122 | AE94: =(Y94*4)+(AA94*2) -> 12
A95: GOALKICKERS | W95: SANDRINGHAM | Y95: 3 | Z95: 0 | AA95: 0 | AB95: 294 | AC95: 148 | AD95: =(AB95/AC95)*100 -> 198.64864864864865 | AE95: =(Y95*4)+(AA95*2) -> 12
A96: COBURG | D96: DALE 8 | F96: GRIFFITHS 5 | I96: PIESCIK 4 | L96: BAKER 2 | O96: STANLEY | Q96: AUBREY | W96: PORT MELBOURNE | Y96: 2 | Z96: 1 | AA96: 0 | AB96: 398 | AC96: 152 | AD96: =(AB96/AC96)*100 -> 261.84210526315786 | AE96: =(Y96*4)+(AA96*2) -> 8
A97: FRANKSTON | D97: McCARTHY 2 | G97: SRUK 2 | I97: MARTIN | K97: MEAD | M97: RYAN | N97: PARKER | P97: BOWEY | R97: ATKINSON | W97: PRESTON | Y97: 2 | Z97: 1 | AA97: 0 | AB97: 291 | AC97: 315 | AD97: =(AB97/AC97)*100 -> 92.38095238095238 | AE97: =(Y97*4)+(AA97*2) -> 8
D98: 7TH MAY | J98: WEATHER | N98: ANTHONY | Q98: LANCE | S98: Venue: BEACH RD | W98: BOX HILL | X98: 1 | Y98: 1 | Z98: 1 | AA98: 0 | AB98: 193 | AC98: 185 | AD98: =(AB98/AC98)*100 -> 104.32432432432432 | AE98: =(Y98*4)+(AA98*2) -> 4
A99: SANDRINGHAM | C99: 3 | D99: 1 | E99: =(C99*6)+D99 -> 19 | G99: 4 | H99: 8 | I99: =(G99*6)+H99 -> 32 | K99: 8 | L99: 12 | M99: =(K99*6)+L99 -> 60 | O99: 15 | P99: 14 | Q99: =(O99*6)+P99 -> 104 | S99: LOVE
A100: WERRIBEE | C100: 1 | D100: 3 | E100: =(C100*6)+D100 -> 9 | G100: 2 | H100: 4 | I100: =(G100*6)+H100 -> 16 | K100: 3 | L100: 6 | M100: =(K100*6)+L100 -> 24 | O100: 4 | P100: 9 | Q100: =(O100*6)+P100 -> 33 | S100: McCAULEY | W100: COBURG | X100: 1 | Y100: 1 | Z100: 1 | AA100: 0 | AB100: 189 | AC100: 205 | AD100: =(AB100/AC100)*100 -> 92.195121951219519 | AE100: =(Y100*4)+(AA100*2) -> 4
A101: BEST PLAYERS | S101: PRINCE | W101: FRANKSTON | Y101: 0 | Z101: 3 | AA101: 0 | AB101: 149 | AC101: 293 | AD101: =(AB101/AC101)*100 -> 50.853242320819113 | AE101: =(Y101*4)+(AA101*2) -> 0
A102: SANDRINGHAM | D102: WILLIAMS | G102: ALVIN | J102: SCOTT-BRANIGAN | N102: KEIPERT | P102: HANSON | R102: OAKLEY | W102: WILLIAMSTOWN | X102: 1 | Y102: 0 | Z102: 2 | AA102: 0 | AB102: 189 | AC102: 377 | AD102: =(AB102/AC102)*100 -> 50.132625994694955 | AE102: =(Y102*4)+(AA102*2) -> 0
A103: WERRIBEE | D103: FITZPATRICK | G103: BUCHANAN | J103: GLADMAN | M103: MAY | O103: ROACH | W103: WERRIBEE | Y103: 0 | Z103: 3 | AA103: 0 | AB103: 108 | AC103: 367 | AD103: =(AB103/AC103)*100 -> 29.427792915531338 | AE103: =(Y103*4)+(AA103*2) -> 0
A104: GOALKICKERS
A105: SANDRINGHAM | D105: AMIET 4 | G105: ALVIN 4 | J105: KEIPERT 4 | M105: SNOOKS | O105: ALLEN | Q105: WALKER
A106: WERRIBEE | D106: McDONALD 4
A108: SPRINGVALE | C108: 6 | D108: 5 | E108: =(C108*6)+D108 -> 41 | G108: 12 | H108: 7 | I108: =(G108*6)+H108 -> 79 | K108: 15 | L108: 8 | M108: =(K108*6)+L108 -> 98 | O108: 20 | P108: 11 | Q108: =(O108*6)+P108 -> 131 | S108: Venue: SPRINGVALE
A109: PRESTON | C109: 1 | D109: 0 | E109: =(C109*6)+D109 -> 6 | G109: 4 | H109: 2 | I109: =(G109*6)+H109 -> 26 | K109: 10 | L109: 7 | M109: =(K109*6)+L109 -> 67 | O109: 12 | P109: 7 | Q109: =(O109*6)+P109 -> 79 | S109: SEXTON ;KANZA :MILLER
A110: BEST PLAYERS
A111: SPRINGVALE | D111: JEFFREY | G111: CARROLL | J111: MELLODY | M111: JEFFS | O111: EVANS | R111: SMITH
A112: PRESTON | D112: McLOUGHLIN | G112: CARELLI | J112: MORRISEY | M112: MAIROANA
A113: GOALKICKERS
A114: SPRINGVALE | D114: EVANS 6 | G114: SMITH 5 | J114: CARIS 4 | M114: DYSON-HOLLAND 3 | Q114: BURNS | S114: CARROLL
A115: PRESTON | D115: FLAVELL 3 | G115: McWATTERS 2 | J115: WILSON 2 | M115: SHEARER | O115: TAYLOR | Q115: CARELLI | T115: AIELLO | W115: McLOUGHLIN
A117: PORT MELBOURNE | C117: 5 | D117: 8 | E117: =(C117*6)+D117 -> 38 | G117: 14 | H117: 12 | I117: =(G117*6)+H117 -> 96 | K117: 25 | L117: 18 | M117: =(K117*6)+L117 -> 168 | O117: 34 | P117: 22 | Q117: =(O117*6)+P117 -> 226 | S117: Venue: PORT MELBOURNE
A118: WILLIAMSTOWN | C118: 3 | D118: 0 | E118: =(C118*6)+D118 -> 18 | G118: 4 | H118: 2 | I118: =(G118*6)+H118 -> 26 | K118: 5 | L118: 4 | M118: =(K118*6)+L118 -> 34 | O118: 8 | P118: 6 | Q118: =(O118*6)+P118 -> 54 | S118: SERCIA :VOZZO :KELSEY
A119: BEST PLAYERS
A120: PORT MELBOURNE | D120: BERRY | G120: S BOWDEN | J120: R BOWDEN | M120: KELLY | O120: CLOHESY | R120: SEXTON
A121: WILLIAMSTOWN | D121: TRANTA | G121: PENNA | J121: MALONEY | M121: BUGEJA | O121: SHANKS
A122: GOALKICKERS
A123: PORT MELBOURNE | D123: BERRY 15 | F123: LOCHEAD 4 | I123: KELLY 3 | K123: JAMES 3 | M123: BAILEY 2 | O123: SEXTON 2 | Q123: McNAMARA | T123: CHEEL | W123: CAMERON | X123: S BOWDEN | AA123: HARKINS
A124: WILLIAMSTOWN | D124: CHRISTENSEN 2 | H124: HOUGH 2 | K124: McCURRY 2 | N124: HORE | P124: JACOVOU
A126: BYE | D126: BOX HILL
A128: ROUND 4 | D128: 13TH MAY | J128: WEATHER
D129: 1ST QTR | H129: 2ND QTR | L129: 3RD QTR | P129: FINAL | S129: Venue: FRANKSTON
A130: FRANKSTON | C130: 7 | D130: 1 | E130: =(C130*6)+D130 -> 43 | G130: 11 | H130: 3 | I130: =(G130*6)+H130 -> 69 | K130: 18 | L130: 11 | M130: =(K130*6)+L130 -> 119 | O130: 22 | P130: 12 | Q130: =(O130*6)+P130 -> 144 | S130: UMPIRES | Z130: LADDER | AC130: ROUND | AE130: 4
A131: BOX HILL | C131: 3 | D131: 2 | E131: =(C131*6)+D131 -> 20 | G131: 5 | H131: 4 | I131: =(G131*6)+H131 -> 34 | K131: 7 | L131: 8 | M131: =(K131*6)+L131 -> 50 | O131: 8 | P131: 8 | Q131: =(O131*6)+P131 -> 56
A132: BEST PLAYERS | W132: TEAM | X132: B | Y132: W | Z132: L | AA132: D | AB132: FOR | AC132: AGST | AD132: % | AE132: PTS
A133: FRANKSTON | D133: WEBB | G133: PARKER | J133: ANTHONY | M133: MOORE | O133: S RYAN | Q133: BURNELL
A134: BOX HILL | D134: ZARAFA | G134: CROWLEY | J134: IBRAHIM | M134: GREIG | W134: SPRINGVALE | Y134: 4 | Z134: 0 | AA134: 0 | AB134: 551 | AC134: 244 | AD134: =(AB134/AC134)*100 -> 225.81967213114754 | AE134: =(Y134*4)+(AA134*2) -> 16
A135: GOALKICKERS | W135: SANDRINGHAM | Y135: 4 | Z135: 0 | AA135: 0 | AB135: 373 | AC135: 211 | AD135: =(AB135/AC135)*100 -> 176.77725118483411 | AE135: =(Y135*4)+(AA135*2) -> 16
A136: FRANKSTON | D136: WEBB 10 | F136: McCARTHY 4 | I136: SRUK 3 | K136: PICKERING | M136: BURNELL | O136: S RYAN | Q136: MEAD | S136: TAYLOR | W136: PORT MELBOURNE | X136: 1 | Y136: 2 | Z136: 1 | AA136: 0 | AB136: 398 | AC136: 152 | AD136: =(AB136/AC136)*100 -> 261.84210526315786 | AE136: =(Y136*4)+(AA136*2) -> 8
A137: BOX HILL | D137: CROWLEY 3 | G137: IBRAHIM | J137: JAMES | L137: McFARLANE | O137: PANNAM | Q137: ZARAFA | W137: PRESTON | Y137: 2 | Z137: 2 | AA137: 0 | AB137: 354 | AC137: 394 | AD137: =(AB137/AC137)*100 -> 89.847715736040612 | AE137: =(Y137*4)+(AA137*2) -> 8
D138: 14TH MAY | J138: WEATHER | S138: Venue: WERRIBEE | W138: FRANKSTON | Y138: 1 | Z138: 3 | AA138: 0 | AB138: 293 | AC138: 349 | AD138: =(AB138/AC138)*100 -> 83.954154727793693 | AE138: =(Y138*4)+(AA138*2) -> 4
A139: WERRIBEE | C139: 8 | D139: 4 | E139: =(C139*6)+D139 -> 52 | G139: 9 | H139: 5 | I139: =(G139*6)+H139 -> 59 | K139: 14 | L139: 12 | M139: =(K139*6)+L139 -> 96 | O139: 16 | P139: 14 | Q139: =(O139*6)+P139 -> 110 | S139: GOODRIDGE
A140: COBURG | C140: 0 | D140: 2 | E140: =(C140*6)+D140 -> 2 | G140: 1 | H140: 9 | I140: =(G140*6)+H140 -> 15 | K140: 5 | L140: 12 | M140: =(K140*6)+L140 -> 42 | O140: 8 | P140: 16 | Q140: =(O140*6)+P140 -> 64 | S140: JAMES | W140: COBURG | X140: 1 | Y140: 1 | Z140: 2 | AA140: 0 | AB140: 253 | AC140: 315 | AD140: =(AB140/AC140)*100 -> 80.317460317460316 | AE140: =(Y140*4)+(AA140*2) -> 4
A141: BEST PLAYERS | S141: SEXTON | W141: BOX HILL | X141: 1 | Y141: 1 | Z141: 2 | AA141: 0 | AB141: 249 | AC141: 329 | AD141: =(AB141/AC141)*100 -> 75.683890577507597 | AE141: =(Y141*4)+(AA141*2) -> 4
A142: WERRIBEE | D142: ROACH | G142: McDONALD | J142: P BALLAN | M142: FITZPATRICK | P142: MAY | R142: PURCELL | W142: WERRIBEE | Y142: 1 | Z142: 3 | AA142: 0 | AB142: 218 | AC142: 431 | AD142: =(AB142/AC142)*100 -> 50.580046403712295 | AE142: =(Y142*4)+(AA142*2) -> 4
A143: COBURG | D143: RACOVOLIS | G143: BAKER | J143: PORTER | M143: ZIROS | P143: STANLEY | W143: WILLIAMSTOWN | X143: 1 | Y143: 0 | Z143: 3 | AA143: 0 | AB143: 294 | AC143: 558 | AD143: =(AB143/AC143)*100 -> 52.688172043010752 | AE143: =(Y143*4)+(AA143*2) -> 0
A144: GOALKICKERS
A145: WERRIBEE | D145: McDONALD 8 | G145: BUTTON 2 | I145: EDWARDS 2 | L145: BUCHANAN | O145: MUSARRA | Q145: PURCELL | S145: ROACH
A146: COBURG | D146: CASEY 2 | G146: DALE 2 | J146: RACOVOLIS | M146: PIESCAK | O146: BAKER | Q146: COGHLAN
A148: SANDRINGHAM | C148: 2 | D148: 1 | E148: =(C148*6)+D148 -> 13 | G148: 6 | H148: 2 | I148: =(G148*6)+H148 -> 38 | K148: 9 | L148: 3 | M148: =(K148*6)+L148 -> 57 | O148: 12 | P148: 7 | Q148: =(O148*6)+P148 -> 79 | S148: Venue: PRESTON
A149: PRESTON | C149: 3 | D149: 4 | E149: =(C149*6)+D149 -> 22 | G149: 4 | H149: 8 | I149: =(G149*6)+H149 -> 32 | K149: 7 | L149: 9 | M149: =(K149*6)+L149 -> 51 | O149: 9 | P149: 9 | Q149: =(O149*6)+P149 -> 63 | S149: DAVIDSON :SHEARER :VOZZO
A150: BEST PLAYERS
A151: SANDRINGHAM | D151: MURRAY | G151: HANSON | J151: KEIPERT | M151: MITCHELSON | P151: CROUGH | R151: CLARKSON
A152: PRESTON | D152: MORRISEY | G152: McLAUGHLAN | J152: DOBBS | M152: CUNNINGHAM | P152: TAYLOR
A153: GOALKICKERS
A154: SANDRINGHAM | D154: AMIET 5 | G154: OAKLEY 2 | J154: SNOOKS 2 | M154: KEIPERT | O154: ALLEN | Q154: ALVIN
A155: PRESTON | D155: TOWNSEND 2 | G155: KING | I155: FLAVELL | K155: CARELLI | M155: AIELLO | O155: SHEARER | Q155: TAYLOR | S155: MORRISEY
A157: SPRINGVALE | C157: 8 | D157: 3 | E157: =(C157*6)+D157 -> 51 | G157: 12 | H157: 4 | I157: =(G157*6)+H157 -> 76 | K157: 23 | L157: 12 | M157: =(K157*6)+L157 -> 150 | O157: 28 | P157: 13 | Q157: =(O157*6)+P157 -> 181 | S157: Venue: WILLIAMSTOWN
A158: WILLIAMSTOWN | C158: 2 | D158: 1 | E158: =(C158*6)+D158 -> 13 | G158: 11 | H158: 3 | I158: =(G158*6)+H158 -> 69 | K158: 11 | L158: 4 | M158: =(K158*6)+L158 -> 70 | O158: 16 | P158: 9 | Q158: =(O158*6)+P158 -> 105 | S158: NICHOLLS :McCAULEY :AGNEW
A159: BEST PLAYERS
A160: SPRINGVALE | D160: JEFFS | G160: CARROLL | J160: DYSON-HOLLAND | N160: TAYLOR | Q160: SMITH | S160: EVANS
A161: WILLIAMSTOWN | D161: SHANKS | G161: CHRISTENSEN | J161: BUJEGA | N161: JOHANSEN | Q161: HOUGH
A162: GOALKICKERS | R162: SMITH | T162: CLEMENTS | X162: TKOCZ
A163: SPRINGVALE | D163: EVANS 5 | F163: DYSON-HOLLAND 4 | J163: BALDWIN 2 | M163: MONTGOMERY 2 | P163: BURNS 2 | R163: CARIS 2 | U163: TAYLOR 2 | X163: DILLON 2 | AA163: GARBUIO 2 | AD163: O'DONNELL
A164: WILLIAMSTOWN | D164: SHANKS 5 | F164: BUJEGA | H164: PATTERSON | K164: KARAKIOZAKIS | N164: JOHANSEN | Q164: WILLIAMS | S164: HOUGH | U164: McCURRY | X164: VENNER | Z164: MINET | AB164: SCOTT | AD164: CHRISTENSEN
A166: BYE | D166: PORT MELBOURNE
A168: ROUND 5 | D168: 20TH MAY | J168: WEATHER | S168: Venue: SPRINGVALE
D169: 1ST QTR | H169: 2ND QTR | L169: 3RD QTR | P169: FINAL | S169: UMPIRES | U169: SPENCE
A170: SPRINGVALE | C170: 4 | D170: 1 | E170: =(C170*6)+D170 -> 25 | G170: 8 | H170: 4 | I170: =(G170*6)+H170 -> 52 | K170: 15 | L170: 6 | M170: =(K170*6)+L170 -> 96 | O170: 17 | P170: 13 | Q170: =(O170*6)+P170 -> 115 | S170: MALCOLM | Z170: LADDER | AC170: ROUND | AE170: 5
A171: PORT MELBOURNE | C171: 1 | D171: 2 | E171: =(C171*6)+D171 -> 8 | G171: 7 | H171: 5 | I171: =(G171*6)+H171 -> 47 | K171: 12 | L171: 6 | M171: =(K171*6)+L171 -> 78 | O171: 16 | P171: 9 | Q171: =(O171*6)+P171 -> 105 | S171: GILES
A172: BEST PLAYERS | W172: TEAM | X172: B | Y172: W | Z172: L | AA172: D | AB172: FOR | AC172: AGST | AD172: % | AE172: PTS
A173: SPRINGVALE | D173: MELLODY | G173: BURGMAN | J173: BALDWIN | M173: EVANS | O173: JEFFS | R173: PEACOCK
A174: PORT MELBOURNE | D174: R BOWDEN | G174: BAILEY | J174: LAFFEY | M174: MOYLAN | O174: SEXTON | R174: McNAMARA | W174: SANDRINGHAM | Y174: 5 | Z174: 0 | AA174: 0 | AB174: 548 | AC174: 281 | AD174: =(AB174/AC174)*100 -> 195.01779359430606 | AE174: =(Y174*4)+(AA174*2) -> 20
A175: GOALKICKERS | O175: COURTNEY | R175: GARBUIO | W175: SPRINGVALE | Y175: 5 | Z175: 0 | AA175: 0 | AB175: 666 | AC175: 349 | AD175: =(AB175/AC175)*100 -> 190.83094555873924 | AE175: =(Y175*4)+(AA175*2) -> 20
A176: SPRINGVALE | D176: SMITH 4 | F176: BALDWIN 4 | I176: EVANS 2 | K176: MONTGOMERY 2 | N176: CAPLES | P176: BURNS | R176: CARIS | W176: PRESTON | Y176: 3 | Z176: 2 | AA176: 0 | AB176: 475 | AC176: 481 | AD176: =(AB176/AC176)*100 -> 98.752598752598757 | AE176: =(Y176*4)+(AA176*2) -> 12
A177: PORT MELBOURNE | D177: BERRY 7 | G177: SEXTON 5 | J177: JAMES 2 | M177: KELLY | O177: RAGGAT | W177: PORT MELBOURNE | X177: 1 | Y177: 2 | Z177: 2 | AA177: 0 | AB177: 503 | AC177: 267 | AD177: =(AB177/AC177)*100 -> 188.38951310861424 | AE177: =(Y177*4)+(AA177*2) -> 8
D178: 21ST MAY | J178: WEATHER | S178: Venue: COBURG | W178: BOX HILL | X178: 1 | Y178: 2 | Z178: 2 | AA178: 0 | AB178: 353 | AC178: 414 | AD178: =(AB178/AC178)*100 -> 85.265700483091791 | AE178: =(Y178*4)+(AA178*2) -> 8
A179: PRESTON | C179: 5 | D179: 1 | E179: =(C179*6)+D179 -> 31 | G179: 8 | H179: 6 | I179: =(G179*6)+H179 -> 54 | K179: 11 | L179: 8 | M179: =(K179*6)+L179 -> 74 | O179: 18 | P179: 13 | Q179: =(O179*6)+P179 -> 121 | S179: AGNEW
A180: COBURG | C180: 4 | D180: 1 | E180: =(C180*6)+D180 -> 25 | G180: 7 | H180: 3 | I180: =(G180*6)+H180 -> 45 | K180: 13 | L180: 5 | M180: =(K180*6)+L180 -> 83 | O180: 13 | P180: 9 | Q180: =(O180*6)+P180 -> 87 | S180: NICHOLLS | W180: FRANKSTON | X180: 1 | Y180: 1 | Z180: 3 | AA180: 0 | AB180: 293 | AC180: 349 | AD180: =(AB180/AC180)*100 -> 83.954154727793693 | AE180: =(Y180*4)+(AA180*2) -> 4
A181: BEST PLAYERS | S181: HEAD | W181: COBURG | X181: 1 | Y181: 1 | Z181: 3 | AA181: 0 | AB181: 340 | AC181: 436 | AD181: =(AB181/AC181)*100 -> 77.981651376146786 | AE181: =(Y181*4)+(AA181*2) -> 4
A182: PRESTON | D182: MORRISEY | G182: MORRISH | J182: CARELLI | M182: DOBBS | O182: McLOUGHLIN | R182: HUCKER | W182: WERRIBEE | Y182: 1 | Z182: 4 | AA182: 0 | AB182: 303 | AC182: 535 | AD182: =(AB182/AC182)*100 -> 56.635514018691588 | AE182: =(Y182*4)+(AA182*2) -> 4
A183: COBURG | D183: BAKER | G183: LEGG | J183: STANLEY | M183: TARANTO | O183: MELIA | W183: WILLIAMSTOWN | X183: 1 | Y183: 0 | Z183: 4 | AA183: 0 | AB183: 364 | AC183: 733 | AD183: =(AB183/AC183)*100 -> 49.658935879945432 | AE183: =(Y183*4)+(AA183*2) -> 0
A184: GOALKICKERS
A185: PRESTON | D185: SHEARER 4 | F185: CARELLI 4 | I185: DOBBS 3 | K185: AIELLO 2 | M185: McWATTERS 2 | P185: HUCKER 2 | R185: KING
A186: COBURG | D186: PIESCAK 4 | F186: DALE 3 | H186: STANLEY 2 | K186: NAPOLI | M186: ALESSIO | O186: O'MEARA | Q186: BAKER
A188: SANDRINGHAM | C188: 5 | D188: 3 | E188: =(C188*6)+D188 -> 33 | G188: 10 | H188: 8 | I188: =(G188*6)+H188 -> 68 | K188: 15 | L188: 14 | M188: =(K188*6)+L188 -> 104 | O188: 26 | P188: 19 | Q188: =(O188*6)+P188 -> 175 | S188: Venue: BEACH ROAD
A189: WILLIAMSTOWN | C189: 2 | D189: 4 | E189: =(C189*6)+D189 -> 16 | G189: 3 | H189: 7 | I189: =(G189*6)+H189 -> 25 | K189: 9 | L189: 7 | M189: =(K189*6)+L189 -> 61 | O189: 10 | P189: 10 | Q189: =(O189*6)+P189 -> 70 | S189: ADAMS :EDWARDS :KAMSY
A190: BEST PLAYERS
A191: SANDRINGHAM | D191: WALKER | G191: CLARKSON | J191: ARGUS | M191: MACGEORGE | P191: KEIPERT | S191: KELLAWAY
A192: WILLIAMSTOWN | D192: ILICH | G192: WILLIAMS | J192: HORE | M192: SHANKS | P192: PATTERSON
A193: GOALKICKERS
A194: SANDRINGHAM | D194: KEIPERT 5 | F194: OAKLEY 4 | I194: KELLAWAY 3 | L194: ALVIN 3 | N194: CLARKSON 2 | Q194: AMIET 2 | S194: HERMAN 2 | W194: WALKER 2 | X194: ALLEN | Z194: SCOTT-BRANIGAN | AD194: LAMBERT
A195: WILLIAMSTOWN | D195: PATTERSON 4 | G195: JOHANSEN 2 | J195: SCOTT | L195: SHANKS | N195: MINETT | P195: CHRISTENSEN
A197: BOX HILL | C197: 5 | D197: 6 | E197: =(C197*6)+D197 -> 36 | G197: 10 | H197: 6 | I197: =(G197*6)+H197 -> 66 | K197: 11 | L197: 12 | M197: =(K197*6)+L197 -> 78 | O197: 15 | P197: 14 | Q197: =(O197*6)+P197 -> 104 | S197: Venue: BOX HILL
A198: WERRIBEE | C198: 3 | D198: 0 | E198: =(C198*6)+D198 -> 18 | G198: 6 | H198: 1 | I198: =(G198*6)+H198 -> 37 | K198: 7 | L198: 9 | M198: =(K198*6)+L198 -> 51 | O198: 12 | P198: 13 | Q198: =(O198*6)+P198 -> 85 | S198: RUSSO :DAVIDSON :KELSEY
A199: BEST PLAYERS
A200: BOX HILL | D200: JAMES | G200: ZARAFA | J200: GREIG | M200: DOUGLAS | P200: LIVINGSTONE | S200: COHEN
A201: WERRIBEE | D201: SATTERLEY | G201: MITCHELL | J201: WRIGHT | M201: DITZPATRICK | P201: BUTTON
A202: GOALKICKERS
A203: BOX HILL | D203: TREWELLA 3 | G203: ZARAFA 2 | I203: DALY 2 | K203: WILKINSON 2 | N203: McFARLANE 2 | Q203: QUINN | S203: GREIG | W203: LIVINGSTONE | Y203: BREWER
A204: WERRIBEE | D204: BUTTON 3 | G204: YZE 2 | I204: McDONALD 2 | L204: SATTERLEY 2 | O204: PURCELL | Q204: O'CONNOR | T204: WILLIAMS
A206: BYE | D206: FRANKSTON
A208: ROUND 6 | D208: 27TH MAY | J208: WEATHER | S208: Venue: PRESTON
D209: 1ST QTR | H209: 2ND QTR | L209: 3RD QTR | P209: FINAL | S209: UMPIRES | U209: JAMES
A210: BOX HILL | C210: 1 | D210: 5 | E210: =(C210*6)+D210 -> 11 | G210: 4 | H210: 7 | I210: =(G210*6)+H210 -> 31 | K210: 7 | L210: 10 | M210: =(K210*6)+L210 -> 52 | O210: 10 | P210: 11 | Q210: =(O210*6)+P210 -> 71 | S210: GOODRIDGE | Z210: LADDER | AC210: ROUND | AE210: 6
A211: PRESTON | C211: 0 | D211: 1 | E211: =(C211*6)+D211 -> 1 | G211: 2 | H211: 3 | I211: =(G211*6)+H211 -> 15 | K211: 2 | L211: 4 | M211: =(K211*6)+L211 -> 16 | O211: 3 | P211: 5 | Q211: =(O211*6)+P211 -> 23 | S211: KANIZAY
A212: BEST PLAYERS | W212: TEAM | X212: B | Y212: W | Z212: L | AA212: D | AB212: FOR | AC212: AGST | AD212: % | AE212: PTS
A213: BOX HILL | D213: GREIG | G213: BADROCK | J213: LIVINGSTONE | M213: GOODALE | P213: JAMES | R213: BOURKE
A214: PRESTON | D214: BRYSON | G214: DOBBS | J214: MORRISEY | M214: CUNNINGHAM | W214: SPRINGVALE | X214: 1 | Y214: 5 | Z214: 0 | AA214: 0 | AB214: 666 | AC214: 349 | AD214: =(AB214/AC214)*100 -> 190.83094555873924 | AE214: =(Y214*4)+(AA214*2) -> 20
A215: GOALKICKERS | W215: SANDRINGHAM | Y215: 5 | Z215: 1 | AA215: 0 | AB215: 633 | AC215: 423 | AD215: =(AB215/AC215)*100 -> 149.64539007092199 | AE215: =(Y215*4)+(AA215*2) -> 20
A216: BOX HILL | D216: WILKINSON 4 | G216: TREWELLA 3 | J216: GREIG | L216: QUINN | N216: LIVINGSTONE | W216: PORT MELBOURNE | X216: 1 | Y216: 3 | Z216: 2 | AA216: 0 | AB216: 645 | AC216: 352 | AD216: =(AB216/AC216)*100 -> 183.23863636363635 | AE216: =(Y216*4)+(AA216*2) -> 12
A217: PRESTON | D217: SHEARER 2 | G217: TOWNSEND | W217: BOX HILL | X217: 1 | Y217: 3 | Z217: 2 | AA217: 0 | AB217: 424 | AC217: 437 | AD217: =(AB217/AC217)*100 -> 97.025171624713963 | AE217: =(Y217*4)+(AA217*2) -> 12
D218: 28TH MAY | J218: WEATHER | S218: Venue: WILLIAMSTOWN | W218: PRESTON | Y218: 3 | Z218: 3 | AA218: 0 | AB218: 498 | AC218: 552 | AD218: =(AB218/AC218)*100 -> 90.217391304347828 | AE218: =(Y218*4)+(AA218*2) -> 12
A219: COBURG | C219: 5 | D219: 3 | E219: =(C219*6)+D219 -> 33 | G219: 12 | H219: 5 | I219: =(G219*6)+H219 -> 77 | K219: 18 | L219: 11 | M219: =(K219*6)+L219 -> 119 | O219: 19 | P219: 13 | Q219: =(O219*6)+P219 -> 127 | S219: TWITT
A220: WILLIAMSTOWN | C220: 4 | D220: 2 | E220: =(C220*6)+D220 -> 26 | G220: 7 | H220: 6 | I220: =(G220*6)+H220 -> 48 | K220: 10 | L220: 7 | M220: =(K220*6)+L220 -> 67 | O220: 16 | P220: 10 | Q220: =(O220*6)+P220 -> 106 | S220: MALCOLM | W220: COBURG | X220: 1 | Y220: 2 | Z220: 3 | AA220: 0 | AB220: 467 | AC220: 542 | AD220: =(AB220/AC220)*100 -> 86.162361623616235 | AE220: =(Y220*4)+(AA220*2) -> 8
A221: BEST PLAYERS | S221: PHILLIPS | W221: WERRIBEE | Y221: 2 | Z221: 4 | AA221: 0 | AB221: 426 | AC221: 607 | AD221: =(AB221/AC221)*100 -> 70.181219110378919 | AE221: =(Y221*4)+(AA221*2) -> 8
A222: COBURG | D222: BAKER | G222: STANLEY | J222: WESTON | M222: INGRAM | P222: AUBREY | W222: FRANKSTON | X222: 1 | Y222: 1 | Z222: 4 | AA222: 0 | AB222: 365 | AC222: 472 | AD222: =(AB222/AC222)*100 -> 77.330508474576277 | AE222: =(Y222*4)+(AA222*2) -> 4
A223: WILLIAMSTOWN | D223: JOHANSEN | G223: CHRISTENSEN | J223: SHANKS | M223: PENNA | P223: WEST | W223: WILLIAMSTOWN | X223: 1 | Y223: 0 | Z223: 5 | AA223: 0 | AB223: 470 | AC223: 860 | AD223: =(AB223/AC223)*100 -> 54.651162790697668 | AE223: =(Y223*4)+(AA223*2) -> 0
A224: GOALKICKERS | Q224: MELIA
A225: COBURG | D225: DALE 7 | F225: TARANTO 3 | I225: STANLEY 2 | L225: BENJAMIN 2 | O225: BAKER 2 | Q225: NAPOLI | S225: AUBREY
A226: WILLIAMSTOWN | D226: PATTERSON 3 | G226: JOHANSEN 3 | J226: SHANKS 2 | M226: DUFF-TYLER 2 | P226: GHAZI 2 | R226: McGOWAN 2 | W226: PASTORE | X226: HOUGH
A228: PORT MELBOURNE | C228: 5 | D228: 7 | E228: =(C228*6)+D228 -> 37 | G228: 9 | H228: 9 | I228: =(G228*6)+H228 -> 63 | K228: 16 | L228: 12 | M228: =(K228*6)+L228 -> 108 | O228: 21 | P228: 16 | Q228: =(O228*6)+P228 -> 142 | S228: Venue: PORT MELBOURNE
A229: SANDRINGHAM | C229: 3 | D229: 0 | E229: =(C229*6)+D229 -> 18 | G229: 7 | H229: 0 | I229: =(G229*6)+H229 -> 42 | K229: 9 | L229: 4 | M229: =(K229*6)+L229 -> 58 | O229: 13 | P229: 7 | Q229: =(O229*6)+P229 -> 85 | S229: SEXTON :HANLEY :RUSSO
A230: BEST PLAYERS
A231: PORT MELBOURNE | D231: CAMERON | G231: SEXTON | J231: CHEEL | L231: LAFFY | O231: BERRY | R231: PICIAONE
A232: SANDRINGHAM | D232: ALLEN | G232: CLARKSON | J232: MACGEORGE
A233: GOALKICKERS
A234: PORT MELBOURNE | D234: BERRY 9 | F234: SEXTON 5 | I234: JAMES 2 | L234: RAGGATT 2 | O234: CHEEL | Q234: CAMERON | T234: CLOHESY
A235: SANDRINGHAM | D235: AMIET 4 | G235: SCOTT-BRANIGAN 2 | K235: ALVIN 2 | M235: WALKER 2 | P235: WILLIAMS | R235: ALLEN | T235: OAKLEY
A237: WERRIBEE | C237: 3 | D237: 4 | E237: =(C237*6)+D237 -> 22 | G237: 8 | H237: 6 | I237: =(G237*6)+H237 -> 54 | K237: 12 | L237: 9 | M237: =(K237*6)+L237 -> 81 | O237: 18 | P237: 15 | Q237: =(O237*6)+P237 -> 123 | S237: Venue: WERRIBEE
A238: FRANKSTON | C238: 4 | D238: 1 | E238: =(C238*6)+D238 -> 25 | G238: 6 | H238: 1 | I238: =(G238*6)+H238 -> 37 | K238: 8 | L238: 3 | M238: =(K238*6)+L238 -> 51 | O238: 11 | P238: 6 | Q238: =(O238*6)+P238 -> 72 | S238: DELLER :ELLIS WENN
A239: BEST PLAYERS
A240: WERRIBEE | D240: P BALLAN | G240: MITCHELL | J240: McDONALD | M240: FITZPATRICK | P240: SATTERLEY | S240: BUTTON
A241: FRANKSTON | D241: L TAYLOR | G241: MEAD | J241: S RYAN | M241: ATKINSON | P241: WEBB | S241: MOORE
A242: GOALKICKERS
A243: WERRIBEE | D243: McDONALD 7 | G243: BUTTON 3 | I243: MUSARRA 2 | L243: EAMES | N243: O'CONNOR | Q243: MAY | R243: RYAN | T243: SATTERLEY | X243: MURPHY
A244: FRANKSTON | D244: MEAD 4 | G244: WEBB | I244: ANTHONY | K244: SRUK | M244: L TAYLOR | O244: ATKINSON | R244: BOWEY | U244: BROWN
A246: BYE | D246: SPRINGVALE
A248: ROUND 7 | D248: 3RD JUNE | J248: WEATHER | S248: Venue: BEACH ROAD
D249: 1ST QTR | H249: 2ND QTR | L249: 3RD QTR | P249: FINAL | S249: UMPIRES | U249: SERCIS
A250: SPRINGVALE | C250: 3 | D250: 1 | E250: =(C250*6)+D250 -> 19 | G250: 4 | H250: 3 | I250: =(G250*6)+H250 -> 27 | K250: 8 | L250: 7 | M250: =(K250*6)+L250 -> 55 | O250: 12 | P250: 8 | Q250: =(O250*6)+P250 -> 80 | S250: FRAUMANO | Z250: LADDER | AC250: ROUND | AE250: 7
A251: SANDRINGHAM | C251: 2 | D251: 3 | E251: =(C251*6)+D251 -> 15 | G251: 5 | H251: 7 | I251: =(G251*6)+H251 -> 37 | K251: 9 | L251: 7 | M251: =(K251*6)+L251 -> 61 | O251: 11 | P251: 12 | Q251: =(O251*6)+P251 -> 78 | S251: KELSEY
A252: BEST PLAYERS | W252: TEAM | X252: B | Y252: W | Z252: L | AA252: D | AB252: FOR | AC252: AGST | AD252: % | AE252: PTS
A253: SPRINGVALE | D253: MONTGOMERY | G253: BURGMANN | J253: MELLODY | M253: CAPLES | O253: JEFFREY | R253: BLASIUS
A254: SANDRINGHAM | D254: HERMAN | G254: FOLEY | J254: KEIPERT | M254: ALVIN | O254: RIENIETS | R254: OAKLEY | W254: SPRINGVALE | X254: 1 | Y254: 6 | Z254: 0 | AA254: 0 | AB254: 746 | AC254: 427 | AD254: =(AB254/AC254)*100 -> 174.70725995316158 | AE254: =(Y254*4)+(AA254*2) -> 24
A255: GOALKICKERS | W255: SANDRINGHAM | Y255: 5 | Z255: 2 | AA255: 0 | AB255: 711 | AC255: 503 | AD255: =(AB255/AC255)*100 -> 141.35188866799206 | AE255: =(Y255*4)+(AA255*2) -> 20
A256: SPRINGVALE | D256: BALDWIN 3 | F256: EVANS 3 | H256: DYSON-HOLLAND 2 | L256: MONTGOMERY | O256: O'DONNELL | Q256: CARIS | S256: MELLODY | W256: PORT MELBOURNE | X256: 1 | Y256: 4 | Z256: 2 | AA256: 0 | AB256: 807 | AC256: 469 | AD256: =(AB256/AC256)*100 -> 172.06823027718551 | AE256: =(Y256*4)+(AA256*2) -> 16
A257: SANDRINGHAM | D257: KEIPERT 5 | G257: AMIET 4 | J257: FOLEY | L257: AMIET | W257: BOX HILL | X257: 1 | Y257: 4 | Z257: 2 | AA257: 0 | AB257: 514 | AC257: 513 | AD257: =(AB257/AC257)*100 -> 100.19493177387915 | AE257: =(Y257*4)+(AA257*2) -> 16
D258: 4TH JUNE | J258: WEATHER | O258: NORTH BREEZE | S258: Venue: COBURG | W258: PRESTON | Y258: 3 | Z258: 4 | AA258: 0 | AB258: 588 | AC258: 683 | AD258: =(AB258/AC258)*100 -> 86.090775988286978 | AE258: =(Y258*4)+(AA258*2) -> 12
A259: PORT MELBOURNE | C259: 5 | D259: 2 | E259: =(C259*6)+D259 -> 32 | G259: 16 | H259: 4 | I259: =(G259*6)+H259 -> 100 | K259: 20 | L259: 9 | M259: =(K259*6)+L259 -> 129 | O259: 25 | P259: 12 | Q259: =(O259*6)+P259 -> 162 | S259: MANN
A260: COBURG | C260: 2 | D260: 2 | E260: =(C260*6)+D260 -> 14 | G260: 5 | H260: 5 | I260: =(G260*6)+H260 -> 35 | K260: 11 | L260: 6 | M260: =(K260*6)+L260 -> 72 | O260: 18 | P260: 9 | Q260: =(O260*6)+P260 -> 117 | S260: GOODRIDGE | W260: FRANKSTON | X260: 1 | Y260: 2 | Z260: 4 | AA260: 0 | AB260: 496 | AC260: 562 | AD260: =(AB260/AC260)*100 -> 88.256227758007128 | AE260: =(Y260*4)+(AA260*2) -> 8
A261: BEST PLAYERS | S261: ADAMS | W261: COBURG | X261: 1 | Y261: 2 | Z261: 4 | AA261: 0 | AB261: 584 | AC261: 704 | AD261: =(AB261/AC261)*100 -> 82.954545454545453 | AE261: =(Y261*4)+(AA261*2) -> 8
A262: PORT MELBOURNE | D262: S BOWDEN | G262: R BOWDEN | J262: CHEEL | M262: WEEDING | O262: MOYLAN | R262: KELLY | W262: WERRIBEE | X262: 1 | Y262: 2 | Z262: 4 | AA262: 0 | AB262: 426 | AC262: 607 | AD262: =(AB262/AC262)*100 -> 70.181219110378919 | AE262: =(Y262*4)+(AA262*2) -> 8
A263: COBURG | D263: PORTER | G263: INGRAM | J263: MELIA | M263: BAKER | O263: HAWKINS | W263: WILLIAMSTOWN | X263: 1 | Y263: 0 | Z263: 6 | AA263: 0 | AB263: 546 | AC263: 950 | AD263: =(AB263/AC263)*100 -> 57.473684210526322 | AE263: =(Y263*4)+(AA263*2) -> 0
A264: GOALKICKERS | O264: BAILEY | Q264: CHEEL | S264: CAMERON
A265: PORT MELBOURNE | D265: BERRY 9 | F265: SEXTON 4 | H265: WEEDING 2 | J265: HARKINS 2 | M265: S BOWDEN 2 | P265: R BOWDEN 2 | S265: KELLY
A266: COBURG | D266: MELIA 4 | F266: DALE 3 | H266: GRIFFITH 3 | J266: BENJAMIN 2 | M266: O'MEARA 2 | P266: DICKSON | R266: HAWKINS | U266: STANLEY | X266: PIESCAK
A268: BOX HILL | C268: 4 | D268: 0 | E268: =(C268*6)+D268 -> 24 | G268: 7 | H268: 4 | I268: =(G268*6)+H268 -> 46 | K268: 9 | L268: 12 | M268: =(K268*6)+L268 -> 66 | O268: 12 | P268: 18 | Q268: =(O268*6)+P268 -> 90 | S268: Venue: BOX HILL
A269: WILLIAMSTOWN | C269: 3 | D269: 2 | E269: =(C269*6)+D269 -> 20 | G269: 3 | H269: 4 | I269: =(G269*6)+H269 -> 22 | K269: 8 | L269: 8 | M269: =(K269*6)+L269 -> 56 | O269: 11 | P269: 10 | Q269: =(O269*6)+P269 -> 76 | S269: HANLEY :NICHOLLS :SHEARER
A270: BEST PLAYERS
A271: BOX HILL | D271: GREIG | G271: COHEN | J271: DALY | L271: WILKINSON | O271: BADROCK | R271: JAMES
A272: WILLIAMSTOWN | D272: PASTORE | G272: ILICH | J272: WEST | L272: GHAZI | O272: SHANKS | R272: PINKNEY
A273: GOALKICKERS
A274: BOX HILL | D274: WILKINSON 3 | G274: CROWLEY 2 | J274: ZARAFA 2 | M274: DALY 2 | O274: COHEN | Q274: McFARLANE | T274: GOODALE
A275: WILLIAMSTOWN | D275: PINKNEY 4 | G275: GHAZI 2 | I275: HORE | J275: McGOWAN | M275: WEST | O275: JOHANSEN | Q275: SCOTT
A277: FRANKSTON | C277: 8 | D277: 1 | E277: =(C277*6)+D277 -> 49 | G277: 10 | H277: 4 | I277: =(G277*6)+H277 -> 64 | K277: 14 | L277: 7 | M277: =(K277*6)+L277 -> 91 | O277: 20 | P277: 11 | Q277: =(O277*6)+P277 -> 131 | S277: Venue: FRANKSTON
A278: PRESTON | C278: 0 | D278: 2 | E278: =(C278*6)+D278 -> 2 | G278: 9 | H278: 4 | I278: =(G278*6)+H278 -> 58 | K278: 11 | L278: 5 | M278: =(K278*6)+L278 -> 71 | O278: 14 | P278: 6 | Q278: =(O278*6)+P278 -> 90 | S278: GILES :PHILLIPS :VOZZO
A279: BEST PLAYERS
A280: FRANKSTON | D280: S RYAN | G280: MEAD | J280: MOORE | M280: PICKERING | P280: KENNEDY | R280: PARKER
A281: PRESTON | D281: DOBBS | G281: MORRISSEY | J281: TOWNSEND | M281: MAIROANA
A282: GOALKICKERS
A283: FRANKSTON | D283: McCARTHY 4 | G283: PICKERING 3 | J283: MEAD 3 | L283: L TAYLOR 2 | O283: BOWEY 2 | Q283: SRUK | R283: WEBB | T283: O'NEIL | W283: LAWRENCE | X283: MARTIN | Z283: ANTHONY
A284: PRESTON | D284: SHEARER 5 | G284: CARELLI 2 | J284: WILSON 2 | M284: AIELLO | O284: DOBBS | Q284: KING | R284: CUNNINGHAM | W284: TOWNSEND
A286: BYE | D286: WERRIBEE
A288: ROUND 8 | D288: 10TH JUNE | J288: WEATHER | S288: PLAYED AT P, M,
D289: 1ST QTR | H289: 2ND QTR | L289: 3RD QTR | P289: FINAL | S289: UMPIRES | U289: EDWARDS
A290: PORT MELBOURNE | C290: 7 | D290: 6 | E290: =(C290*6)+D290 -> 48 | G290: 12 | H290: 10 | I290: =(G290*6)+H290 -> 82 | K290: 17 | L290: 12 | M290: =(K290*6)+L290 -> 114 | O290: 21 | P290: 17 | Q290: =(O290*6)+P290 -> 143 | S290: PHILLIPS | Z290: LADDER | AC290: ROUND | AE290: 8
A291: BOX HILL | C291: 3 | D291: 1 | E291: =(C291*6)+D291 -> 19 | G291: 3 | H291: 3 | I291: =(G291*6)+H291 -> 21 | K291: 9 | L291: 7 | M291: =(K291*6)+L291 -> 61 | O291: 11 | P291: 11 | Q291: =(O291*6)+P291 -> 77 | S291: VOZZO
A292: BEST PLAYERS | W292: TEAM | X292: B | Y292: W | Z292: L | AA292: D | AB292: FOR | AC292: AGST | AD292: % | AE292: PTS
A293: PORT MELBOURNE | D293: BAILEY | G293: CLOHESY | J293: CHEEL | M293: PICIAONE | P293: SHARP | R293: JAMES
A294: BOX HILL | D294: BADROCK | G294: BANFIELD | J294: COHEN | M294: WILKINSON | P294: QUINN | R294: PANNAM | W294: SPRINGVALE | X294: 1 | Y294: 6 | Z294: 1 | AA294: 0 | AB294: 816 | AC294: 517 | AD294: =(AB294/AC294)*100 -> 157.83365570599614 | AE294: =(Y294*4)+(AA294*2) -> 24
A295: GOALKICKERS | P295: WEEDING | R295: KELLY | W295: PORT MELBOURNE | X295: 1 | Y295: 5 | Z295: 2 | AA295: 0 | AB295: 950 | AC295: 546 | AD295: =(AB295/AC295)*100 -> 173.99267399267399 | AE295: =(Y295*4)+(AA295*2) -> 20
A296: PORT MELBOURNE | D296: BAILEY 8 | F296: SEXTON 4 | I296: JAMES 3 | K296: BERRY | M296: S BOWDEN | P296: CHEEL | R296: PERKINS | W296: SANDRINGHAM | X296: 1 | Y296: 5 | Z296: 2 | AA296: 0 | AB296: 711 | AC296: 503 | AD296: =(AB296/AC296)*100 -> 141.35188866799206 | AE296: =(Y296*4)+(AA296*2) -> 20
A297: BOX HILL | D297: WILKINSON 4 | G297: PANNAM 2 | J297: CROWLEY 2 | M297: JAMES | O297: DALY | Q297: TREWELLA | W297: BOX HILL | X297: 1 | Y297: 4 | Z297: 3 | AA297: 0 | AB297: 591 | AC297: 656 | AD297: =(AB297/AC297)*100 -> 90.091463414634148 | AE297: =(Y297*4)+(AA297*2) -> 16
D298: 11TH JUNE | J298: WEATHER | S298: Venue: SPRINGVALE | W298: FRANKSTON | X298: 1 | Y298: 3 | Z298: 4 | AA298: 0 | AB298: 626 | AC298: 613 | AD298: =(AB298/AC298)*100 -> 102.12071778140293 | AE298: =(Y298*4)+(AA298*2) -> 12
A299: COBURG | C299: 3 | D299: 2 | E299: =(C299*6)+D299 -> 20 | G299: 4 | H299: 4 | I299: =(G299*6)+H299 -> 28 | K299: 13 | L299: 4 | M299: =(K299*6)+L299 -> 82 | O299: 14 | P299: 6 | Q299: =(O299*6)+P299 -> 90 | S299: SEXTON
A300: SPRINGVALE | C300: 3 | D300: 2 | E300: =(C300*6)+D300 -> 20 | G300: 7 | H300: 5 | I300: =(G300*6)+H300 -> 47 | K300: 9 | L300: 5 | M300: =(K300*6)+L300 -> 59 | O300: 10 | P300: 10 | Q300: =(O300*6)+P300 -> 70 | S300: KANIZAY | W300: COBURG | X300: 1 | Y300: 3 | Z300: 4 | AA300: 0 | AB300: 674 | AC300: 774 | AD300: =(AB300/AC300)*100 -> 87.080103359173123 | AE300: =(Y300*4)+(AA300*2) -> 12
A301: BEST PLAYERS | S301: O'REILLY | W301: PRESTON | Y301: 3 | Z301: 5 | AA301: 0 | AB301: 631 | AC301: 728 | AD301: =(AB301/AC301)*100 -> 86.675824175824175 | AE301: =(Y301*4)+(AA301*2) -> 12
A302: COBURG | D302: PORTER | G302: BAKER | J302: LEGG | M302: STANLEY | P302: WESTON | W302: WERRIBEE | X302: 1 | Y302: 3 | Z302: 4 | AA302: 0 | AB302: 471 | AC302: 650 | AD302: =(AB302/AC302)*100 -> 72.461538461538467 | AE302: =(Y302*4)+(AA302*2) -> 12
A303: SPRINGVALE | D303: LITTLE | G303: BURGMAN | J303: CLARK | M303: CAPLES | W303: WILLIAMSTOWN | X303: 1 | Y303: 0 | Z303: 7 | AA303: 0 | AB303: 597 | AC303: 1080 | AD303: =(AB303/AC303)*100 -> 55.277777777777779 | AE303: =(Y303*4)+(AA303*2) -> 0
A304: GOALKICKERS
A305: COBURG | D305: GRIFFITHS 3 | G305: BAKER 3 | J305: WESTON 3 | M305: O'MEARA 2 | P305: LEGG 2 | R305: STANLEY
A306: SPRINGVALE | D306: BALDWIN 2 | G306: CLARK 2 | I306: JEFFS 2 | K306: PEACOCK | M306: MONTGOMERY | P306: KNIGHT | R306: EVANS
A308: FRANKSTON | C308: 1 | D308: 2 | E308: =(C308*6)+D308 -> 8 | G308: 11 | H308: 4 | I308: =(G308*6)+H308 -> 70 | K308: 15 | L308: 7 | M308: =(K308*6)+L308 -> 97 | O308: 20 | P308: 10 | Q308: =(O308*6)+P308 -> 130 | S308: Venue: WILLIAMSTOWN
A309: WILLIAMSTOWN | C309: 3 | D309: 4 | E309: =(C309*6)+D309 -> 22 | G309: 3 | H309: 5 | I309: =(G309*6)+H309 -> 23 | K309: 5 | L309: 4 | M309: =(K309*6)+L309 -> 34 | O309: 7 | P309: 9 | Q309: =(O309*6)+P309 -> 51 | S309: ROSE :DAVIDSON :JAMES
A310: BEST PLAYERS
A311: FRANKSTON | D311: MEAD | G311: RYAN | J311: ATKINSON | N311: FREEMAN | Q311: BOWEY | S311: FREEMAN
A312: WILLIAMSTOWN | D312: VENNER | G312: JOHANSEN | J312: M CHRISTENSEN | N312: HOUGH | Q312: SHANKS
A313: GOALKICKERS
A314: FRANKSTON | D314: McCARTHY 7 | G314: MEAD 5 | J314: BOWEY 3 | M314: SRUK 2 | O314: BURNELL | Q314: TAYLOR | S314: RYAN
A315: WILLIAMSTOWN | D315: JOHANSEN 3 | G315: M CHRISTENSEN | K315: D CHRISTENSEN | O315: GHAZI | Q315: SHANKS
A317: WERRIBEE | C317: 0 | D317: 0 | E317: =(C317*6)+D317 -> 0 | G317: 4 | H317: 2 | I317: =(G317*6)+H317 -> 26 | K317: 5 | L317: 3 | M317: =(K317*6)+L317 -> 33 | O317: 7 | P317: 3 | Q317: =(O317*6)+P317 -> 45 | S317: Venue: PRESTON
A318: PRESTON | C318: 1 | D318: 2 | E318: =(C318*6)+D318 -> 8 | G318: 2 | H318: 4 | I318: =(G318*6)+H318 -> 16 | K318: 4 | L318: 8 | M318: =(K318*6)+L318 -> 32 | O318: 5 | P318: 13 | Q318: =(O318*6)+P318 -> 43 | S318: AGNEW :NICHOLLS :HANLEY
A319: BEST PLAYERS
A320: WERRIBEE | D320: BUTTON | G320: FITZPATRICK | J320: RYAN | M320: BALLAN | P320: ROACH | S320: SATTERLEY
A321: PRESTON | D321: CUNNINGHAM | G321: DOBBS | J321: CARELLI | M321: SINCLAIR | P321: HUCKER
A322: GOALKICKERS
A323: WERRIBEE | D323: MUSSARA 3 | G323: EAMES 2 | J323: BUTTON 2
A324: PRESTON | D324: TOWNSEND | G324: HABERMAN | J324: WILSON | L324: KING | N324: CARELLI
A326: BYE | D326: SANDRINGHAM
A328: ROUND 9 | D328: 24TH JUNE | J328: WEATHER | S328: Venue: COBURG
D329: 1ST QTR | H329: 2ND QTR | L329: 3RD QTR | P329: FINAL | S329: UMPIRES | U329: DAVIDSON
A330: SANDRINGHAM | C330: 7 | D330: 5 | E330: =(C330*6)+D330 -> 47 | G330: 10 | H330: 6 | I330: =(G330*6)+H330 -> 66 | K330: 16 | L330: 14 | M330: =(K330*6)+L330 -> 110 | O330: 20 | P330: 20 | Q330: =(O330*6)+P330 -> 140 | S330: RUSSO | Z330: LADDER | AC330: ROUND | AE330: 9
A331: COBURG | C331: 3 | D331: 0 | E331: =(C331*6)+D331 -> 18 | G331: 6 | H331: 3 | I331: =(G331*6)+H331 -> 39 | K331: 8 | L331: 7 | M331: =(K331*6)+L331 -> 55 | O331: 11 | P331: 9 | Q331: =(O331*6)+P331 -> 75 | S331: HEAD
A332: BEST PLAYERS | W332: TEAM | X332: B | Y332: W | Z332: L | AA332: D | AB332: FOR | AC332: AGST | AD332: % | AE332: PTS
A333: SANDRINGHAM | D333: WALKER | G333: SNOOKS | J333: CROUGH | M333: MITCHELSON | P333: CLARKSON | S333: AMIET
A334: COBURG | D334: INGRAM | G334: PORTER | J334: ALESSIO | M334: LEGG | W334: SPRINGVALE | X334: 1 | Y334: 7 | Z334: 1 | AA334: 0 | AB334: 904 | AC334: 587 | AD334: =(AB334/AC334)*100 -> 154.00340715502557 | AE334: =(Y334*4)+(AA334*2) -> 28
A335: GOALKICKERS | W335: PORT MELBOURNE | X335: 1 | Y335: 6 | Z335: 2 | AA335: 0 | AB335: 1076 | AC335: 605 | AD335: =(AB335/AC335)*100 -> 177.85123966942149 | AE335: =(Y335*4)+(AA335*2) -> 24
A336: SANDRINGHAM | D336: AMIET 5 | F336: WALKER 5 | I336: SNOOKS 5 | L336: FOLEY 2 | N336: OAKLEY | P336: KEIPERT | R336: MITCHELSON | W336: SANDRINGHAM | X336: 1 | Y336: 6 | Z336: 2 | AA336: 0 | AB336: 851 | AC336: 578 | AD336: =(AB336/AC336)*100 -> 147.2318339100346 | AE336: =(Y336*4)+(AA336*2) -> 24
A337: COBURG | D337: DALE 4 | G337: PIESCIK 2 | J337: WESTON 2 | M337: ALESSIO 2 | P337: BAKER | W337: BOX HILL | X337: 1 | Y337: 4 | Z337: 4 | AA337: 0 | AB337: 661 | AC337: 744 | AD337: =(AB337/AC337)*100 -> 88.844086021505376 | AE337: =(Y337*4)+(AA337*2) -> 16
D338: 25TH JUNE | J338: WEATHER | O338: NORTH BREEZE | S338: Venue: BOX HILL | W338: WERRIBEE | X338: 1 | Y338: 4 | Z338: 4 | AA338: 0 | AB338: 538 | AC338: 710 | AD338: =(AB338/AC338)*100 -> 75.774647887323937 | AE338: =(Y338*4)+(AA338*2) -> 16
A339: SPRINGVALE | C339: 3 | D339: 2 | E339: =(C339*6)+D339 -> 20 | G339: 5 | H339: 5 | I339: =(G339*6)+H339 -> 35 | K339: 9 | L339: 9 | M339: =(K339*6)+L339 -> 63 | O339: 13 | P339: 10 | Q339: =(O339*6)+P339 -> 88 | S339: AGNEW
A340: BOX HILL | C340: 2 | D340: 3 | E340: =(C340*6)+D340 -> 15 | G340: 5 | H340: 4 | I340: =(G340*6)+H340 -> 34 | K340: 6 | L340: 9 | M340: =(K340*6)+L340 -> 45 | O340: 10 | P340: 10 | Q340: =(O340*6)+P340 -> 70 | S340: GOODRIDGE | W340: FRANKSTON | X340: 1 | Y340: 3 | Z340: 5 | AA340: 0 | AB340: 685 | AC340: 739 | AD340: =(AB340/AC340)*100 -> 92.692828146143441 | AE340: =(Y340*4)+(AA340*2) -> 12
A341: BEST PLAYERS | S341: DELLER | W341: PRESTON | X341: 1 | Y341: 3 | Z341: 5 | AA341: 0 | AB341: 631 | AC341: 728 | AD341: =(AB341/AC341)*100 -> 86.675824175824175 | AE341: =(Y341*4)+(AA341*2) -> 12
A342: SPRINGVALE | D342: O'DONNELL | G342: MONTGOMERY | J342: CAPLES | M342: DYSON-HOLLAND | P342: KNIGHT | R342: PEACOCK | W342: COBURG | X342: 1 | Y342: 3 | Z342: 5 | AA342: 0 | AB342: 749 | AC342: 914 | AD342: =(AB342/AC342)*100 -> 81.947483588621438 | AE342: =(Y342*4)+(AA342*2) -> 12
A343: BOX HILL | D343: BADROCK | G343: WILKINSON | J343: GOODALE | M343: JAMES | P343: QUINN | R343: GREIG | W343: WILLIAMSTOWN | X343: 1 | Y343: 0 | Z343: 8 | AA343: 0 | AB343: 657 | AC343: 1147 | AD343: =(AB343/AC343)*100 -> 57.27986050566696 | AE343: =(Y343*4)+(AA343*2) -> 0
A344: GOALKICKERS
A345: SPRINGVALE | D345: COURTNEY 4 | G345: MONTGOMERY 4 | K345: KNIGHT 2 | N345: DYSON-HOLLAND 2 | R345: CLARK
A346: BOX HILL | D346: WILKINSON 5 | G346: GRIFFEN 2 | J346: McFARLANE | M346: HUGHSON | O346: ZARAFA
A348: PORT MELBOURNE | C348: 2 | D348: 3 | E348: =(C348*6)+D348 -> 15 | G348: 8 | H348: 7 | I348: =(G348*6)+H348 -> 55 | K348: 12 | L348: 12 | M348: =(K348*6)+L348 -> 84 | O348: 18 | P348: 18 | Q348: =(O348*6)+P348 -> 126 | S348: Venue: FRANKSTON
A349: FRANKSTON | C349: 3 | D349: 1 | E349: =(C349*6)+D349 -> 19 | G349: 5 | H349: 1 | I349: =(G349*6)+H349 -> 31 | K349: 6 | L349: 6 | M349: =(K349*6)+L349 -> 42 | O349: 8 | P349: 11 | Q349: =(O349*6)+P349 -> 59 | S349: KANIZAY :SEXTON :SERCIA
A350: BEST PLAYERS
A351: PORT MELBOURNE | D351: PICIAONE | G351: McNAMARA | J351: CLOHESY | M351: KELLY | O351: JAMES | R351: BAILEY
A352: FRANKSTON | D352: WINKEL | G352: O'NEIL | J352: FREEMAN | M352: MOORE | O352: CHARLES
A353: GOALKICKERS
A354: PORT MELBOURNE | D354: KELLY 3 | F354: JAMES 3 | H354: SEXTON 3 | J354: CLOHESY 2 | M354: R BOWDEN | P354: S BOWDEN | S354: BERRY | U354: BAILEY | X354: PICIAONE | AA354: HARKINS | AC354: RAGGATT
A355: FRANKSTON | D355: L TAYLOR 3 | G355: McCARTHY 2 | J355: FREEMAN | L355: WINKEL | N355: POLLOCK
A357: WERRIBEE | C357: 3 | D357: 0 | E357: =(C357*6)+D357 -> 18 | G357: 6 | H357: 2 | I357: =(G357*6)+H357 -> 38 | K357: 9 | L357: 4 | M357: =(K357*6)+L357 -> 58 | O357: 10 | P357: 7 | Q357: =(O357*6)+P357 -> 67 | S357: Venue: WERRIBEE
A358: WILLIAMSTOWN | C358: 2 | D358: 6 | E358: =(C358*6)+D358 -> 18 | G358: 4 | H358: 7 | I358: =(G358*6)+H358 -> 31 | K358: 5 | L358: 13 | M358: =(K358*6)+L358 -> 43 | O358: 7 | P358: 18 | Q358: =(O358*6)+P358 -> 60 | S358: ACKLAND :MILLER :EDWARDS
A359: BEST PLAYERS
A360: WERRIBEE | D360: FITZPATRICK | G360: RYAN | J360: AZIZ | M360: BUCHANAN | P360: SATTERLEY | S360: ROBINSON
A361: WILLIAMSTOWN | D361: PASTORE | G361: SHANKS | J361: HORE | M361: GHAZI | P361: ILICH
A362: GOALKICKERS
A363: WERRIBEE | D363: AZIZ 2 | F363: ROBINSON 2 | I363: BUCHANAN | L363: BUTTON | N363: McDONALD | Q363: MITCHELL | T363: MUSSARA | X363: WILLIAMS
A364: WILLIAMSTOWN | D364: PASTORE | F364: DUFF-TYLER | I364: GHAZI | K364: SCOTT | M364: PINKNEY | O364: FUENTES | R364: DOOLEY
A366: BYE | D366: PRESTON
A368: ROUND 10 | D368: 1ST JULY | J368: WEATHER | S368: Venue: BOX HILL
D369: 1ST QTR | H369: 2ND QTR | L369: 3RD QTR | P369: FINAL | S369: UMPIRES | U369: MALCOLM
A370: BOX HILL | C370: 2 | D370: 4 | E370: =(C370*6)+D370 -> 16 | G370: 5 | H370: 6 | I370: =(G370*6)+H370 -> 36 | K370: 7 | L370: 9 | M370: =(K370*6)+L370 -> 51 | O370: 10 | P370: 12 | Q370: =(O370*6)+P370 -> 72 | S370: MANN | Z370: LADDER | AC370: ROUND | AE370: 10
A371: SANDRINGHAM | C371: 3 | D371: 4 | E371: =(C371*6)+D371 -> 22 | G371: 7 | H371: 6 | I371: =(G371*6)+H371 -> 48 | K371: 9 | L371: 8 | M371: =(K371*6)+L371 -> 62 | O371: 10 | P371: 9 | Q371: =(O371*6)+P371 -> 69 | S371: GILES
A372: BEST PLAYERS | W372: TEAM | X372: B | Y372: W | Z372: L | AA372: D | AB372: FOR | AC372: AGST | AD372: % | AE372: PTS
A373: BOX HILL | D373: BADROCK | G373: LIVINGSTONE | J373: COHEN | L373: BANFIELD | O373: WILKINSON | R373: SHANAHAN
A374: SANDRINGHAM | D374: MACGEORGE | G374: SCOTT-BRANIGAN | K374: RIENIETS | M374: LAMBERT | P374: ALLEN | W374: SPRINGVALE | X374: 1 | Y374: 8 | Z374: 1 | AA374: 0 | AB374: 1003 | AC374: 663 | AD374: =(AB374/AC374)*100 -> 151.28205128205127 | AE374: =(Y374*4)+(AA374*2) -> 32
A375: GOALKICKERS | W375: PORT MELBOURNE | X375: 1 | Y375: 6 | Z375: 3 | AA375: 0 | AB375: 1159 | AC375: 701 | AD375: =(AB375/AC375)*100 -> 165.3352353780314 | AE375: =(Y375*4)+(AA375*2) -> 24
A376: BOX HILL | D376: WILKINSON 5 | G376: McFARLANE 2 | K376: LIVINGSTONE | N376: ZARAFA | P376: BADROCK | W376: SANDRINGHAM | X376: 1 | Y376: 6 | Z376: 3 | AA376: 0 | AB376: 920 | AC376: 650 | AD376: =(AB376/AC376)*100 -> 141.53846153846155 | AE376: =(Y376*4)+(AA376*2) -> 24
A377: SANDRINGHAM | D377: FOLEY 2 | F377: SCOTT-BRANIGAN 2 | J377: B OAKLEY 2 | M377: SNOOKS | O377: WILLIAMS | Q377: WALKER | W377: BOX HILL | X377: 1 | Y377: 5 | Z377: 4 | AA377: 0 | AB377: 733 | AC377: 813 | AD377: =(AB377/AC377)*100 -> 90.159901599015996 | AE377: =(Y377*4)+(AA377*2) -> 20
D378: 2ND JULY | J378: WEATHER | N378: MITCHELSON | S378: Venue: FRANKSTON | W378: WERRIBEE | X378: 1 | Y378: 5 | Z378: 4 | AA378: 0 | AB378: 634 | AC378: 793 | AD378: =(AB378/AC378)*100 -> 79.949558638083232 | AE378: =(Y378*4)+(AA378*2) -> 20
A379: SPRINGVALE | C379: 2 | D379: 2 | E379: =(C379*6)+D379 -> 14 | G379: 7 | H379: 6 | I379: =(G379*6)+H379 -> 48 | K379: 7 | L379: 7 | M379: =(K379*6)+L379 -> 49 | O379: 15 | P379: 9 | Q379: =(O379*6)+P379 -> 99 | S379: MILLER
A380: FRANKSTON | C380: 2 | D380: 3 | E380: =(C380*6)+D380 -> 15 | G380: 5 | H380: 4 | I380: =(G380*6)+H380 -> 34 | K380: 10 | L380: 8 | M380: =(K380*6)+L380 -> 68 | O380: 11 | P380: 10 | Q380: =(O380*6)+P380 -> 76 | S380: ACKLAND | W380: PRESTON | X380: 1 | Y380: 4 | Z380: 5 | AA380: 0 | AB380: 780 | AC380: 811 | AD380: =(AB380/AC380)*100 -> 96.17755856966707 | AE380: =(Y380*4)+(AA380*2) -> 16
A381: BEST PLAYERS | S381: EDWARDS | W381: FRANKSTON | X381: 1 | Y381: 3 | Z381: 6 | AA381: 0 | AB381: 761 | AC381: 838 | AD381: =(AB381/AC381)*100 -> 90.811455847255374 | AE381: =(Y381*4)+(AA381*2) -> 12
A382: SPRINGVALE | D382: CAPLES | G382: LITTLE | J382: BURGMAN | M382: CARROLL | P382: DAVISON | W382: COBURG | X382: 2 | Y382: 3 | Z382: 5 | AA382: 0 | AB382: 749 | AC382: 914 | AD382: =(AB382/AC382)*100 -> 81.947483588621438 | AE382: =(Y382*4)+(AA382*2) -> 12
A383: FRANKSTON | D383: HOPGOOD | G383: MILLANE | J383: WINKEL | M383: MEAD | P383: BURNELL | S383: ATKINSON | W383: WILLIAMSTOWN | X383: 1 | Y383: 0 | Z383: 9 | AA383: 0 | AB383: 740 | AC383: 1296 | AD383: =(AB383/AC383)*100 -> 57.098765432098766 | AE383: =(Y383*4)+(AA383*2) -> 0
A384: GOALKICKERS | O384: COURTNEY | R384: TAYLOR
A385: SPRINGVALE | D385: BALDWIN 4 | F385: MELLODY 2 | I385: EVANS 2 | K385: LIELNORS 2 | N385: MONTGOMERY | Q385: DAVISON | S385: O'DONNELL
A386: FRANKSTON | D386: McCARTHY 3 | G386: WINKEL 3 | J386: MEAD 2 | M386: McKAY | O386: ATKINSON | R386: BOWEY
A388: WERRIBEE | C388: 5 | D388: 3 | E388: =(C388*6)+D388 -> 33 | G388: 7 | H388: 8 | I388: =(G388*6)+H388 -> 50 | K388: 12 | L388: 9 | M388: =(K388*6)+L388 -> 81 | O388: 14 | P388: 12 | Q388: =(O388*6)+P388 -> 96 | S388: Venue: WERRIBEE
A389: PORT MELBOURNE | C389: 3 | D389: 1 | E389: =(C389*6)+D389 -> 19 | G389: 3 | H389: 8 | I389: =(G389*6)+H389 -> 26 | K389: 6 | L389: 10 | M389: =(K389*6)+L389 -> 46 | O389: 12 | P389: 11 | Q389: =(O389*6)+P389 -> 83 | S389: ELLIS :ADAMS :BEARD
A390: BEST PLAYERS
A391: WERRIBEE | D391: PURCELL | G391: P BALLAN | J391: WRIGHT | M391: FITZPATRICK | P391: WILKINS | S391: EAMES
A392: PORT MELBOURNE | D392: KELLY | G392: K BOWDEN | J392: S BOWDEN | M392: CLOHESY
A393: GOALKICKERS
A394: WERRIBEE | D394: McDONALD 4 | G394: BUTTON 2 | I394: McKELLIN 2 | L394: BUCHANAN | N394: CAMILLIERI | Q394: MUSSARA | T394: ROACH | W394: PURCELL | X394: SATTERLEY
A395: PORT MELBOURNE | D395: KELLY 3 | F395: S BOWDEN 2 | I395: LOCHEAD 2 | L395: R BOWDEN | N395: K BOWDEN | Q395: BAILEY | S395: SEXTON | W395: HARKINS
A397: PRESTON | C397: 4 | D397: 2 | E397: =(C397*6)+D397 -> 26 | G397: 12 | H397: 8 | I397: =(G397*6)+H397 -> 80 | K397: 14 | L397: 8 | M397: =(K397*6)+L397 -> 92 | O397: 23 | P397: 11 | Q397: =(O397*6)+P397 -> 149 | S397: Venue: PRESTON
A398: WILLIAMSTOWN | C398: 3 | D398: 4 | E398: =(C398*6)+D398 -> 22 | G398: 4 | H398: 5 | I398: =(G398*6)+H398 -> 29 | K398: 8 | L398: 12 | M398: =(K398*6)+L398 -> 60 | O398: 11 | P398: 17 | Q398: =(O398*6)+P398 -> 83 | S398: NICHOLLS :PHILLIPS :SHEARER
A399: BEST PLAYERS
A400: PRESTON | D400: WILSON | G400: FLAVELL | J400: CARELLI | M400: KING | P400: MAIROANA | S400: TAYLOR
A401: WILLIAMSTOWN | D401: SHANKS | G401: FUENTES | J401: GHAZI | M401: BUGEJA | P401: PINKNEY | S401: WEST
A402: GOALKICKERS
A403: PRESTON | D403: SHEARER 6 | F403: WILSON 4 | I403: AIELLO 3 | K403: CARELLI 2 | M403: KING 2 | O403: MAIORANA 2 | R403: HABERMAN | W403: FLAVELL | X403: McWATTERS | AB403: McLOUGHLIN
A404: WILLIAMSTOWN | D404: PINKNEY 3 | G404: SCOTT 3 | J404: FUENTES 2 | M404: GHAZI 2 | P404: DOOLEY
A406: BYE | D406: COBURG
A408: ROUND 11 | D408: 8TH JULY | J408: WEATHER | S408: Venue: PORT MELBOURNE
D409: 1ST QTR | H409: 2ND QTR | L409: 3RD QTR | P409: FINAL | S409: UMPIRES | U409: O'REILLY
A410: PORT MELBOURNE | C410: 5 | D410: 4 | E410: =(C410*6)+D410 -> 34 | G410: 12 | H410: 11 | I410: =(G410*6)+H410 -> 83 | K410: 17 | L410: 15 | M410: =(K410*6)+L410 -> 117 | O410: 24 | P410: 20 | Q410: =(O410*6)+P410 -> 164 | S410: GOODRIDGE | Z410: LADDER | AC410: ROUND | AE410: 11
A411: PRESTON | C411: 3 | D411: 3 | E411: =(C411*6)+D411 -> 21 | G411: 8 | H411: 7 | I411: =(G411*6)+H411 -> 55 | K411: 12 | L411: 9 | M411: =(K411*6)+L411 -> 81 | O411: 14 | P411: 13 | Q411: =(O411*6)+P411 -> 97 | S411: :SERCIA
A412: BEST PLAYERS | W412: TEAM | X412: B | Y412: W | Z412: L | AA412: D | AB412: FOR | AC412: AGST | AD412: % | AE412: PTS
A413: PORT MELBOURNE | D413: McGEE | G413: KELLY | J413: DOYLE | M413: R BOWDEN | P413: SEXTON | R413: McNAMARA
A414: PRESTON | D414: WILSON | G414: MUNRIVANA | J414: MORRISEY | W414: SPRINGVALE | X414: 1 | Y414: 9 | Z414: 1 | AA414: 0 | AB414: 1154 | AC414: 710 | AD414: =(AB414/AC414)*100 -> 162.53521126760563 | AE414: =(Y414*4)+(AA414*2) -> 36
A415: GOALKICKERS | L415: R BOWDEN | O415: BAILEY | Q415: McGEE | W415: PORT MELBOURNE | X415: 1 | Y415: 7 | Z415: 3 | AA415: 0 | AB415: 1323 | AC415: 798 | AD415: =(AB415/AC415)*100 -> 165.78947368421052 | AE415: =(Y415*4)+(AA415*2) -> 28
A416: PORT MELBOURNE | D416: SEXTON 6 | F416: McNAMARA 5 | I416: KELLY 3 | K416: HOFFMAN 2 | N416: CAMERON 2 | Q416: JONES 2 | S416: JAMES | W416: SANDRINGHAM | X416: 1 | Y416: 7 | Z416: 3 | AA416: 0 | AB416: 1048 | AC416: 762 | AD416: =(AB416/AC416)*100 -> 137.53280839895012 | AE416: =(Y416*4)+(AA416*2) -> 28
A417: PRESTON | D417: KING 3 | F417: CARELLI 3 | I417: WILSON 2 | K417: McLOUGHLIN 2 | N417: HABERMAN 2 | Q417: AIELLO | S417: FLAVELL | W417: BOX HILL | X417: 1 | Y417: 6 | Z417: 4 | AA417: 0 | AB417: 806 | AC417: 884 | AD417: =(AB417/AC417)*100 -> 91.17647058823529 | AE417: =(Y417*4)+(AA417*2) -> 24
D418: 9TH JULY | J418: WEATHER | S418: Venue: COBURG | W418: WERRIBEE | X418: 1 | Y418: 5 | Z418: 5 | AA418: 0 | AB418: 681 | AC418: 944 | AD418: =(AB418/AC418)*100 -> 72.139830508474574 | AE418: =(Y418*4)+(AA418*2) -> 20
A419: BOX HILL | C419: 2 | D419: 3 | E419: =(C419*6)+D419 -> 15 | G419: 6 | H419: 6 | I419: =(G419*6)+H419 -> 42 | K419: 7 | L419: 9 | M419: =(K419*6)+L419 -> 51 | O419: 10 | P419: 13 | Q419: =(O419*6)+P419 -> 73 | S419: ACKLAND
A420: COBURG | C420: 2 | D420: 3 | E420: =(C420*6)+D420 -> 15 | G420: 6 | H420: 6 | I420: =(G420*6)+H420 -> 42 | K420: 8 | L420: 11 | M420: =(K420*6)+L420 -> 59 | O420: 10 | P420: 11 | Q420: =(O420*6)+P420 -> 71 | S420: MILLER | W420: PRESTON | X420: 1 | Y420: 4 | Z420: 6 | AA420: 0 | AB420: 877 | AC420: 975 | AD420: =(AB420/AC420)*100 -> 89.948717948717956 | AE420: =(Y420*4)+(AA420*2) -> 16
A421: BEST PLAYERS | S421: JAMES | W421: FRANKSTON | X421: 1 | Y421: 3 | Z421: 7 | AA421: 0 | AB421: 873 | AC421: 966 | AD421: =(AB421/AC421)*100 -> 90.372670807453417 | AE421: =(Y421*4)+(AA421*2) -> 12
A422: BOX HILL | D422: BANFIELD | G422: DWYER | J422: WILKINSON | M422: CRISP | O422: LIVINGSTONE | R422: WRIGHT | W422: COBURG | X422: 2 | Y422: 3 | Z422: 6 | AA422: 0 | AB422: 820 | AC422: 987 | AD422: =(AB422/AC422)*100 -> 83.080040526849047 | AE422: =(Y422*4)+(AA422*2) -> 12
A423: COBURG | D423: STANLEY | G423: WESTON | J423: LEGG | M423: PORTER | O423: AUBREY | W423: WILLIAMSTOWN | X423: 2 | Y423: 0 | Z423: 9 | AA423: 0 | AB423: 740 | AC423: 1296 | AD423: =(AB423/AC423)*100 -> 57.098765432098766 | AE423: =(Y423*4)+(AA423*2) -> 0
A424: GOALKICKERS
A425: BOX HILL | D425: CROWLEY 3 | G425: WILKINSON 3 | K425: CRISP | M425: DALY | O425: DWYER | Q425: TREWELLA
A426: COBURG | D426: DALE 3 | G426: ALESSIO 3 | K426: PIESCIK 2 | N426: TARANTO | Q426: SALVADORE
A428: SANDRINGHAM | C428: 4 | D428: 4 | E428: =(C428*6)+D428 -> 28 | G428: 9 | H428: 11 | I428: 65 | K428: 14 | L428: 13 | M428: =(K428*6)+L428 -> 97 | O428: 19 | P428: 14 | Q428: =(O428*6)+P428 -> 128 | S428: Venue: BEACH ROAD
A429: FRANKSTON | C429: 4 | D429: 2 | E429: =(C429*6)+D429 -> 26 | G429: 8 | H429: 6 | I429: =(G429*6)+H429 -> 54 | K429: 12 | L429: 8 | M429: =(K429*6)+L429 -> 80 | O429: 17 | P429: 10 | Q429: =(O429*6)+P429 -> 112 | S429: ELLIS :PHILLIPS :DAVIDSON
A430: BEST PLAYERS
A431: SANDRINGHAM | D431: MITCHELSON | G431: WILLIAMS | J431: HERMAN | M431: CLARKSON | P431: OAKLEY | R431: MURRAY
A432: FRANKSTON | D432: SALIBA | G432: WINKEL | J432: ATKINSON | M432: ANTHONY | P432: CHARLES | R432: McKAY
A433: GOALKICKERS
A434: SANDRINGHAM | D434: AMIET 4 | F434: SNOOKS 4 | I434: WALKER 3 | L434: SCOTT-BRANIGAN 3 | P434: CLARKSON 2 | S434: MURRAY | W434: OAKLEY | X434: ALLEN
A435: FRANKSTON | D435: STUBBS 4 | G435: WINKEL 2 | J435: MEAD 2 | L435: BOWEY 2 | N435: McKAY 2 | P435: McCARTHY | S435: ANTHONY | W435: MORRISON | X435: SALIBA | AA435: TAYLOR
A437: SPRINGVALE | C437: 3 | D437: 6 | E437: =(C437*6)+D437 -> 24 | G437: 11 | H437: 11 | I437: =(G437*6)+H437 -> 77 | K437: 14 | L437: 14 | M437: =(K437*6)+L437 -> 98 | O437: 22 | P437: 19 | Q437: =(O437*6)+P437 -> 151 | S437: Venue: SPRINGVALE
A438: WERRIBEE | C438: 1 | D438: 2 | E438: =(C438*6)+D438 -> 8 | G438: 4 | H438: 2 | I438: =(G438*6)+H438 -> 26 | K438: 7 | L438: 4 | M438: =(K438*6)+L438 -> 46 | O438: 7 | P438: 5 | Q438: =(O438*6)+P438 -> 47 | S438: AGNEW :VOZZO :RUSSO
A439: BEST PLAYERS
A440: SPRINGVALE | D440: CLARK | G440: O'DONNELL | J440: MELLODY | M440: KNIGHT | P440: BURGMAN | S440: JEFFREY
A441: WERRIBEE | D441: BALLAN | G441: SATTERLEY | J441: MUSSARA | M441: RYAN | P441: PURCELL | S441: WILKINS
A442: GOALKICKERS
A443: SPRINGVALE | D443: BALDWIN 5 | G443: CARROLL 3 | J443: EVANS 3 | L443: KNIGHT 3 | N443: DYSON-HOLLAND 2 | R443: JEFFREY 2 | U443: DAVISON | X443: JEFFS | Z443: O'DONNELL | AC443: COURTNEY
A444: WERRIBEE | D444: AZIZ 2 | G444: MUSSARA 2 | J444: CAMILLIERI | M444: McCARTHY | P444: MAHONEY
A446: BYE | D446: WILLIAMSTOWN
A448: ROUND 12 | D448: 15TH JULY | J448: WEATHER | S448: Venue: FRANKSTON
D449: 1ST QTR | H449: 2ND QTR | L449: 3RD QTR | P449: FINAL | S449: UMPIRES | U449: ADAMS
A450: FRANKSTON | C450: 4 | D450: 3 | E450: =(C450*6)+D450 -> 27 | G450: 7 | H450: 7 | I450: =(G450*6)+H450 -> 49 | K450: 13 | L450: 11 | M450: =(K450*6)+L450 -> 89 | O450: 23 | P450: 12 | Q450: =(O450*6)+P450 -> 150 | S450: KELSEY | Z450: LADDER | AC450: ROUND | AE450: 12
A451: COBURG | C451: 1 | D451: 4 | E451: =(C451*6)+D451 -> 10 | G451: 7 | H451: 8 | I451: =(G451*6)+H451 -> 50 | K451: 11 | L451: 11 | M451: =(K451*6)+L451 -> 77 | O451: 11 | P451: 14 | Q451: =(O451*6)+P451 -> 80 | S451: ADAMS
A452: BEST PLAYERS | W452: TEAM | X452: B | Y452: W | Z452: L | AA452: D | AB452: FOR | AC452: AGST | AD452: % | AE452: PTS
A453: FRANKSTON | D453: TAYLOR | G453: ANTHONY | J453: McKAY | M453: ATKINSON | P453: McCARTHY | S453: MEAD
A454: COBURG | D454: AUBREY | G454: ALESSIO | J454: STANLEY | M454: PORTER | P454: PIESCIK | W454: SPRINGVALE | X454: 1 | Y454: 10 | Z454: 1 | AA454: 0 | AB454: 1250 | AC454: 781 | AD454: =(AB454/AC454)*100 -> 160.05121638924456 | AE454: =(Y454*4)+(AA454*2) -> 40
A455: GOALKICKERS | O455: COX | P455: RYAN | R455: WOLFE | W455: PORT MELBOURNE | X455: 1 | Y455: 8 | Z455: 3 | AA455: 0 | AB455: 1524 | AC455: 854 | AD455: =(AB455/AC455)*100 -> 178.45433255269322 | AE455: =(Y455*4)+(AA455*2) -> 32
A456: FRANKSTON | D456: McCARTHY 5 | G456: McKAY 3 | I456: WINKEL 3 | K456: BOWEY 3 | M456: ANTHONY 2 | P456: CHARLES 2 | R456: MEAD 2 | W456: SANDRINGHAM | X456: 1 | Y456: 7 | Z456: 4 | AA456: 0 | AB456: 1106 | AC456: 827 | AD456: =(AB456/AC456)*100 -> 133.73639661426844 | AE456: =(Y456*4)+(AA456*2) -> 28
A457: COBURG | D457: DALE 4 | G457: PIESCIK 4 | J457: WESTON | L457: ALESSIO | N457: STANLEY | W457: BOX HILL | X457: 2 | Y457: 6 | Z457: 4 | AA457: 0 | AB457: 806 | AC457: 884 | AD457: =(AB457/AC457)*100 -> 91.17647058823529 | AE457: =(Y457*4)+(AA457*2) -> 24
D458: 16TH JULY | J458: WEATHER | S458: Venue: WERRIBEE | W458: WERRIBEE | X458: 1 | Y458: 6 | Z458: 5 | AA458: 0 | AB458: 746 | AC458: 1002 | AD458: =(AB458/AC458)*100 -> 74.451097804391225 | AE458: =(Y458*4)+(AA458*2) -> 24
A459: WERRIBEE | C459: 3 | D459: 2 | E459: =(C459*6)+D459 -> 20 | G459: 4 | H459: 3 | I459: =(G459*6)+H459 -> 27 | K459: 4 | L459: 4 | M459: =(K459*6)+L459 -> 28 | O459: 10 | P459: 5 | Q459: =(O459*6)+P459 -> 65 | S459: ELLIS
A460: SANDRINGHAM | C460: 2 | D460: 2 | E460: =(C460*6)+D460 -> 14 | G460: 5 | H460: 3 | I460: =(G460*6)+H460 -> 33 | K460: 8 | L460: 6 | M460: =(K460*6)+L460 -> 54 | O460: 8 | P460: 10 | Q460: =(O460*6)+P460 -> 58 | S460: DELLER | W460: PRESTON | X460: 1 | Y460: 4 | Z460: 7 | AA460: 0 | AB460: 948 | AC460: 1071 | AD460: =(AB460/AC460)*100 -> 88.515406162464984 | AE460: =(Y460*4)+(AA460*2) -> 16
A461: BEST PLAYERS | S461: EDWARDS | W461: FRANKSTON | X461: 1 | Y461: 4 | Z461: 7 | AA461: 0 | AB461: 1023 | AC461: 1046 | AD461: =(AB461/AC461)*100 -> 97.801147227533463 | AE461: =(Y461*4)+(AA461*2) -> 16
A462: WERRIBEE | D462: WILLIAMS | G462: MITCHELL | J462: AZIZ | M462: FITZPATRICK | P462: SATTERLEY | S462: ROACH | W462: COBURG | X462: 2 | Y462: 3 | Z462: 7 | AA462: 0 | AB462: 900 | AC462: 1137 | AD462: =(AB462/AC462)*100 -> 79.155672823218993 | AE462: =(Y462*4)+(AA462*2) -> 12
A463: SANDRINGHAM | D463: OAKLEY | G463: CROUGH | J463: ALLEN | M463: MACGEORGE | P463: HERMAN | W463: WILLIAMSTOWN | X463: 2 | Y463: 0 | Z463: 10 | AA463: 0 | AB463: 796 | AC463: 1497 | AD463: =(AB463/AC463)*100 -> 53.173012692050769 | AE463: =(Y463*4)+(AA463*2) -> 0
A464: GOALKICKERS
A465: WERRIBEE | D465: AZIZ 4 | G465: MUSSARA 3 | J465: YZE 2 | L465: McCARTHY
A466: SANDRINGHAM | D466: MACGEORGE 2 | G466: AMIET 2 | J466: WALKER | L466: ALLEN | N466: KEIPERT | P466: SEELEY
A468: SPRINGVALE | C468: 8 | D468: 4 | E468: =(C468*6)+D468 -> 52 | G468: 8 | H468: 6 | I468: =(G468*6)+H468 -> 54 | K468: 11 | L468: 9 | M468: =(K468*6)+L468 -> 75 | O468: 14 | P468: 12 | Q468: =(O468*6)+P468 -> 96 | S468: Venue: PRESTON
A469: PRESTON | C469: 0 | D469: 1 | E469: =(C469*6)+D469 -> 1 | G469: 4 | H469: 7 | I469: =(G469*6)+H469 -> 31 | K469: 6 | L469: 9 | M469: =(K469*6)+L469 -> 45 | O469: 10 | P469: 11 | Q469: =(O469*6)+P469 -> 71 | S469: CALLAGHAN :MANN :GOODYEAR
A470: BEST PLAYERS
A471: SPRINGVALE | D471: LIELNORS | G471: BURGMAN | J471: PEACOCK | M471: HAZELL | P471: JEFFS | R471: CLARK
A472: PRESTON | D472: MAIORANA | G472: FLAVELL | J472: KING | M472: MUNRIVANA | P472: DOBBS | R472: MORRISH
A473: GOALKICKERS
A474: SPRINGVALE | D474: LIELNORS 3 | F474: BALDWIN 2 | I474: O'DONNELL 2 | L474: CLARK 2 | N474: JEFFREY | P474: KNIGHT | R474: TAYLOR | U474: EVANS | X474: HAZELL
A475: PRESTON | D475: KING 2 | F475: SHEARER 2 | I475: WILSON 2 | L475: CARELLI 2 | O475: FLAVELL | R475: HUCKER
A477: PORT MELBOURNE | C477: 5 | D477: 8 | E477: =(C477*6)+D477 -> 38 | G477: 14 | H477: 12 | I477: =(G477*6)+H477 -> 96 | K477: 20 | L477: 21 | M477: =(K477*6)+L477 -> 141 | O477: 29 | P477: 27 | Q477: =(O477*6)+P477 -> 201 | S477: Venue: WILLIAMSTOWN
A478: WILLIAMSTOWN | C478: 1 | D478: 4 | E478: =(C478*6)+D478 -> 10 | G478: 4 | H478: 4 | I478: =(G478*6)+H478 -> 28 | K478: 6 | L478: 6 | M478: =(K478*6)+L478 -> 42 | O478: 8 | P478: 8 | Q478: =(O478*6)+P478 -> 56 | S478: AGNEW :GILES ;MALCOLM
A479: BEST PLAYERS
A480: PORT MELBOURNE | D480: JAMES | G480: PICIAONE | J480: BAILEY | M480: McNAMARA | P480: KELLY | R480: CLOHESY
A481: WILLIAMSTOWN | D481: SHANKS | G481: VENNER | J481: PINKNEY
A482: GOALKICKERS
A483: PORT MELBOURNE | D483: McNAMARA 6 | G483: KELLY 4 | I483: SEXTON 4 | K483: JONES 3 | M483: DI BLASI 3 | O483: BAILEY 3 | Q483: RAGGATT 2 | T483: McGEE | W483: LOCHEAD | X483: JAMES | Z483: HOFFMAN
A484: WILLIAMSTOWN | D484: PINKNEY 3 | G484: SHANKS 2 | J484: VENNER | L484: JOHANSEN | O484: GHAZI
A486: BYE | D486: BOX HILL
A488: ROUND 13 | D488: 22ND JULY | J488: WEATHER | S488: Venue: COBURG
D489: 1ST QTR | H489: 2ND QTR | L489: 3RD QTR | P489: FINAL | S489: UMPIRES | U489: SEXTON
A490: COBURG | C490: 2 | D490: 2 | E490: =(C490*6)+D490 -> 14 | G490: 9 | H490: 8 | I490: =(G490*6)+H490 -> 62 | K490: 11 | L490: 11 | M490: =(K490*6)+L490 -> 77 | O490: 14 | P490: 15 | Q490: =(O490*6)+P490 -> 99 | S490: KANIZAY | Z490: LADDER | AC490: ROUND | AE490: 13
A491: WERRIBEE | C491: 7 | D491: 5 | E491: =(C491*6)+D491 -> 47 | G491: 8 | H491: 6 | I491: =(G491*6)+H491 -> 54 | K491: 10 | L491: 9 | M491: =(K491*6)+L491 -> 69 | O491: 14 | P491: 12 | Q491: =(O491*6)+P491 -> 96 | S491: PHILLIPS
A492: BEST PLAYERS | W492: TEAM | X492: B | Y492: W | Z492: L | AA492: D | AB492: FOR | AC492: AGST | AD492: % | AE492: PTS
A493: COBURG | D493: ALESSIO | G493: INGRAM | J493: AUBREY | M493: WESTON | P493: DALE
A494: WERRIBEE | D494: SATTERLEY | G494: AZIZ | J494: BUTTON | M494: ROACH | P494: WRIGHT | W494: SPRINGVALE | X494: 1 | Y494: 11 | Z494: 1 | AA494: 0 | AB494: 1429 | AC494: 804 | AD494: =(AB494/AC494)*100 -> 177.7363184079602 | AE494: =(Y494*4)+(AA494*2) -> 44
A495: GOALKICKERS | P495: NAPOLI | W495: PORT MELBOURNE | X495: 2 | Y495: 8 | Z495: 3 | AA495: 0 | AB495: 1524 | AC495: 854 | AD495: =(AB495/AC495)*100 -> 178.45433255269322 | AE495: =(Y495*4)+(AA495*2) -> 32
A496: COBURG | D496: AUBREY 4 | F496: ALESSIO 3 | I496: PIESCIK 2 | K496: EVANS | M496: BAKER | O496: DALE | Q496: O'MEARA | W496: SANDRINGHAM | X496: 1 | Y496: 8 | Z496: 4 | AA496: 0 | AB496: 1272 | AC496: 898 | AD496: =(AB496/AC496)*100 -> 141.64810690423161 | AE496: =(Y496*4)+(AA496*2) -> 32
A497: WERRIBEE | D497: AZIZ 7 | G497: YZE 3 | J497: MUSSARA 2 | M497: WILLIAMS | O497: McDONALD | W497: BOX HILL | X497: 2 | Y497: 6 | Z497: 5 | AA497: 0 | AB497: 875 | AC497: 1034 | AD497: =(AB497/AC497)*100 -> 84.622823984526107 | AE497: =(Y497*4)+(AA497*2) -> 24
D498: 23RD JULY | J498: WEATHER | S498: Venue: BEACH ROAD | W498: WERRIBEE | X498: 1 | Y498: 6 | Z498: 6 | AA498: 0 | AB498: 842 | AC498: 1101 | AD498: =(AB498/AC498)*100 -> 76.475930971843781 | AE498: =(Y498*4)+(AA498*2) -> 24
A499: SANDRINGHAM | C499: 6 | D499: 4 | E499: =(C499*6)+D499 -> 40 | G499: 11 | H499: 11 | I499: =(G499*6)+H499 -> 77 | K499: 18 | L499: 12 | M499: =(K499*6)+L499 -> 120 | O499: 25 | P499: 16 | Q499: =(O499*6)+P499 -> 166 | S499: AGNEW
A500: PRESTON | C500: 3 | D500: 0 | E500: =(C500*6)+D500 -> 18 | G500: 7 | H500: 1 | I500: =(G500*6)+H500 -> 43 | K500: 10 | L500: 3 | M500: =(K500*6)+L500 -> 63 | O500: 11 | P500: 5 | Q500: =(O500*6)+P500 -> 71 | S500: KELSEY | W500: FRANKSTON | X500: 1 | Y500: 5 | Z500: 7 | AA500: 0 | AB500: 1173 | AC500: 1115 | AD500: =(AB500/AC500)*100 -> 105.20179372197309 | AE500: =(Y500*4)+(AA500*2) -> 20
A501: BEST PLAYERS | S501: MALCOLM | W501: COBURG | X501: 2 | Y501: 4 | Z501: 7 | AA501: 0 | AB501: 999 | AC501: 1133 | AD501: =(AB501/AC501)*100 -> 88.172992056487203 | AE501: =(Y501*4)+(AA501*2) -> 16
A502: SANDRINGHAM | D502: WINTON | G502: AMIET | J502: TYMMS | M502: ALLEN | P502: MACGEORGE | S502: SEELEY | W502: PRESTON | X502: 1 | Y502: 4 | Z502: 8 | AA502: 0 | AB502: 1019 | AC502: 1237 | AD502: =(AB502/AC502)*100 -> 82.376717865804366 | AE502: =(Y502*4)+(AA502*2) -> 16
A503: PRESTON | D503: DOBBS | G503: MORRISH | J503: WILSON | M503: TAYLOR | P503: MUNRIVANA | W503: WILLIAMSTOWN | X503: 2 | Y503: 0 | Z503: 11 | AA503: 0 | AB503: 819 | AC503: 1676 | AD503: =(AB503/AC503)*100 -> 48.866348448687354 | AE503: =(Y503*4)+(AA503*2) -> 0
A504: GOALKICKERS | N504: MURRAY | Q504: SCOTT-BRANIGAN
A505: SANDRINGHAM | D505: AMIET 8 | F505: SEELEY 6 | H505: KEIPERT 3 | J505: SNOOKS 2 | M505: HERMAN 2 | O505: MITCHELSON | R505: FOLEY
A506: PRESTON | D506: HUCKER 4 | G506: WILSON 3 | J506: SHEARER 2 | M506: KING 2
A508: SPRINGVALE | C508: 9 | D508: 3 | E508: =(C508*6)+D508 -> 57 | G508: 14 | H508: 9 | I508: =(G508*6)+H508 -> 93 | K508: 22 | L508: 13 | M508: =(K508*6)+L508 -> 145 | O508: 27 | P508: 17 | Q508: =(O508*6)+P508 -> 179 | S508: Venue: SPRINGVALE
A509: WILLIAMSTOWN | C509: 1 | D509: 1 | E509: =(C509*6)+D509 -> 7 | G509: 1 | H509: 3 | I509: =(G509*6)+H509 -> 9 | K509: 3 | L509: 4 | M509: =(K509*6)+L509 -> 22 | O509: 3 | P509: 5 | Q509: =(O509*6)+P509 -> 23 | S509: ACKLAND :JAMES :MILLER
A510: BEST PLAYERS
A511: SPRINGVALE | D511: MELLODY | G511: CARROLL | J511: BALDWIN | M511: CAPLES | P511: CLARK | R511: MONTGOMERY
A512: WILLIAMSTOWN | D512: HOUGH | G512: BUGEJA | J512: DOOLEY | M512: HORE | P512: GHAZI
A513: GOALKICKERS
A514: SPRINGVALE | D514: BALDWIN 7 | F514: MONTGOMERY 5 | J514: EVANS 4 | L514: COURTNEY 3 | O514: DYSON-HOLLAND 3 | S514: BURGMAN 2 | X514: PEACOCK | AA514: TAYLOR | AC514: DAVISON
A515: WILLIAMSTOWN | D515: PINKNEY | G515: SHANKS | J515: HORE
A517: FRANKSTON | C517: 4 | D517: 3 | E517: =(C517*6)+D517 -> 27 | G517: 9 | H517: 8 | I517: =(G517*6)+H517 -> 62 | K517: 13 | L517: 11 | M517: =(K517*6)+L517 -> 89 | O517: 23 | P517: 12 | Q517: =(O517*6)+P517 -> 150 | S517: Venue: BOX HILL
A518: BOX HILL | C518: 2 | D518: 3 | E518: =(C518*6)+D518 -> 15 | G518: 6 | H518: 5 | I518: =(G518*6)+H518 -> 41 | K518: 8 | L518: 7 | M518: =(K518*6)+L518 -> 55 | O518: 10 | P518: 9 | Q518: =(O518*6)+P518 -> 69 | S518: RUSSO :DAVIDSON :SHEARER
A519: BEST PLAYERS
A520: FRANKSTON | D520: McCARTHY | G520: RYAN | J520: STUBBS
A521: BOX HILL | D521: DALY | G521: DOUGLAS | J521: WILKINSON
A522: GOALKICKERS
A523: FRANKSTON | D523: McCARTHY 7 | G523: S RYAN 5 | I523: BOWEY 3 | K523: MEAD 3 | M523: STUBBS 2 | P523: PICKERING | S523: SALIBA | U523: WOLFE
A524: BOX HILL | D524: WILKINSON 3 | G524: GRIFFEN 3 | J524: DALY | L524: BADROCK | N524: TREWELLA | Q524: LIVINGSTONE
A526: BYE | D526: PORT MELBOURNE
A528: ROUND 14 | D528: 29TH JULY | J528: WEATHER | S528: Venue: PORT MELBOURNE
D529: 1ST QTR | H529: 2ND QTR | L529: 3RD QTR | P529: FINAL | S529: UMPIRES | U529: SEXTON
A530: SPRINGVALE | C530: 8 | D530: 3 | E530: =(C530*6)+D530 -> 51 | G530: 9 | H530: 7 | I530: =(G530*6)+H530 -> 61 | K530: 17 | L530: 12 | M530: =(K530*6)+L530 -> 114 | O530: 21 | P530: 17 | Q530: =(O530*6)+P530 -> 143 | S530: KANIZAY | Z530: LADDER | AC530: ROUND | AE530: 14
A531: PORT MELBOURNE | C531: 2 | D531: 1 | E531: =(C531*6)+D531 -> 13 | G531: 4 | H531: 9 | I531: =(G531*6)+H531 -> 33 | K531: 8 | L531: 10 | M531: =(K531*6)+L531 -> 58 | O531: 10 | P531: 13 | Q531: =(O531*6)+P531 -> 73 | S531: PHILLIPS
A532: BEST PLAYERS | W532: TEAM | X532: B | Y532: W | Z532: L | AA532: D | AB532: FOR | AC532: AGST | AD532: % | AE532: PTS
A533: SPRINGVALE | D533: CLARK | F533: DYSON-HOLLAND | J533: JEFFS | L533: COURTNEY | O533: MELLODY | R533: CAPLES
A534: PORT MELBOURNE | D534: DOYLE | F534: BAILEY | J534: CLOHESY | L534: DULLARD | W534: SPRINGVALE | X534: 1 | Y534: 12 | Z534: 1 | AA534: 0 | AB534: 1572 | AC534: 877 | AD534: =(AB534/AC534)*100 -> 179.24743443557583 | AE534: =(Y534*4)+(AA534*2) -> 48
A535: GOALKICKERS | K535: EVANS 2 | M535: BALDWIN | O535: O'DONNELL | R535: TAYLOR | W535: SANDRINGHAM | X535: 1 | Y535: 9 | Z535: 4 | AA535: 0 | AB535: 1393 | AC535: 946 | AD535: =(AB535/AC535)*100 -> 147.25158562367864 | AE535: =(Y535*4)+(AA535*2) -> 36
A536: SPRINGVALE | D536: DYSON-HOLLAND 4 | H536: KNIGHT 3 | J536: LIELNORS 3 | M536: CARROLL 2 | P536: MELLODY 2 | S536: DILLON 2 | W536: PORT MELBOURNE | X536: 2 | Y536: 8 | Z536: 4 | AA536: 0 | AB536: 1597 | AC536: 997 | AD536: =(AB536/AC536)*100 -> 160.18054162487462 | AE536: =(Y536*4)+(AA536*2) -> 32
A537: PORT MELBOURNE | D537: BERRY 2 | F537: BAILEY 2 | H537: SEXTON 2 | K537: DI BLASI | M537: PICIAONE | P537: LOCHEAD | R537: JONES | W537: WERRIBEE | X537: 1 | Y537: 7 | Z537: 6 | AA537: 0 | AB537: 919 | AC537: 1149 | AD537: =(AB537/AC537)*100 -> 79.982593559617058 | AE537: =(Y537*4)+(AA537*2) -> 28
D538: 30TH JULY | J538: WEATHER | S538: Venue: PRESTON | W538: BOX HILL | X538: 2 | Y538: 6 | Z538: 6 | AA538: 0 | AB538: 923 | AC538: 1111 | AD538: =(AB538/AC538)*100 -> 83.078307830783089 | AE538: =(Y538*4)+(AA538*2) -> 24
A539: PRESTON | C539: 5 | D539: 4 | E539: =(C539*6)+D539 -> 34 | G539: 5 | H539: 7 | I539: =(G539*6)+H539 -> 37 | K539: 7 | L539: 10 | M539: =(K539*6)+L539 -> 52 | O539: 10 | P539: 13 | Q539: =(O539*6)+P539 -> 73 | S539: ACKLAND
A540: COBURG | C540: 0 | D540: 0 | E540: =(C540*6)+D540 -> 0 | G540: 2 | H540: 2 | I540: =(G540*6)+H540 -> 14 | K540: 3 | L540: 3 | M540: =(K540*6)+L540 -> 21 | O540: 4 | P540: 3 | Q540: =(O540*6)+P540 -> 27 | S540: SHEARER | W540: FRANKSTON | X540: 2 | Y540: 5 | Z540: 7 | AA540: 0 | AB540: 1173 | AC540: 1115 | AD540: =(AB540/AC540)*100 -> 105.20179372197309 | AE540: =(Y540*4)+(AA540*2) -> 20
A541: BEST PLAYERS | S541: EDWARDS | W541: PRESTON | X541: 1 | Y541: 5 | Z541: 8 | AA541: 0 | AB541: 1092 | AC541: 1264 | AD541: =(AB541/AC541)*100 -> 86.39240506329115 | AE541: =(Y541*4)+(AA541*2) -> 20
A542: PRESTON | D542: WILSON | G542: MAIORANA | J542: MUNRIVANA | M542: MORRISH | O542: FLAVELL | R542: TAYLOR | W542: COBURG | X542: 2 | Y542: 4 | Z542: 8 | AA542: 0 | AB542: 1026 | AC542: 1206 | AD542: =(AB542/AC542)*100 -> 85.074626865671647 | AE542: =(Y542*4)+(AA542*2) -> 16
A543: COBURG | D543: STANLEY | G543: HAWKINS | J543: INGRAM | M543: BAKER | O543: WESTON | W543: WILLIAMSTOWN | X543: 2 | Y543: 0 | Z543: 12 | AA543: 0 | AB543: 867 | AC543: 1797 | AD543: =(AB543/AC543)*100 -> 48.247078464106849 | AE543: =(Y543*4)+(AA543*2) -> 0
A544: GOALKICKERS
A545: PRESTON | D545: KING 3 | F545: WILSON 2 | I545: SHEARER | K545: FLAVELL | M545: MUNRIVANA | P545: HUCKER | R545: CARELLI
A546: COBURG | D546: PIESCIK | G546: ALESSIO | J546: ZIROS | L546: AUBREY
A548: SANDRINGHAM | C548: 4 | D548: 1 | E548: 25 | G548: 8 | H548: 8 | I548: =(G548*6)+H548 -> 56 | K548: 10 | L548: 9 | M548: =(K548*6)+L548 -> 69 | O548: 18 | P548: 13 | Q548: =(O548*6)+P548 -> 121 | S548: Venue: WILLIAMSTOWN
A549: WILLIAMSTOWN | C549: 3 | D549: 0 | E549: =(C549*6)+D549 -> 18 | G549: 3 | H549: 3 | I549: =(G549*6)+H549 -> 21 | K549: 7 | L549: 5 | M549: =(K549*6)+L549 -> 47 | O549: 7 | P549: 6 | Q549: =(O549*6)+P549 -> 48 | S549: WENN :KANIZAY :PHILLIPS
A550: BEST PLAYERS
A551: SANDRINGHAM | D551: SCOTT-BRANIGAN | H551: MACGEORGE | K551: MURRAY | N551: RIENIETS | Q551: OAKLEY
A552: WILLIAMSTOWN | D552: HORE | H552: BUGEJA | K552: SHANKS | N552: DOOLEY | Q552: ILICH
A553: GOALKICKERS
A554: SANDRINGHAM | D554: AMIET 4 | F554: SEELEY 3 | H554: SCOTT-BRANIGAN 3 | L554: OAKLEY 3 | N554: RIENIETS 2 | Q554: SNOOKS | S554: WINTON | W554: MACGEORGE
A555: WILLIAMSTOWN | D555: VENNER 3 | G555: McGOWAN 2 | J555: BUGEJA | L555: PATTERSON
A557: WERRIBEE | C557: 5 | D557: 4 | E557: =(C557*6)+D557 -> 34 | G557: 5 | H557: 6 | I557: =(G557*6)+H557 -> 36 | K557: 9 | L557: 8 | M557: =(K557*6)+L557 -> 62 | O557: 11 | P557: 11 | Q557: =(O557*6)+P557 -> 77 | S557: Venue: WERRIBEE
A558: BOX HILL | C558: 0 | D558: 2 | E558: =(C558*6)+D558 -> 2 | G558: 3 | H558: 5 | I558: =(G558*6)+H558 -> 23 | K558: 3 | L558: 8 | M558: =(K558*6)+L558 -> 26 | O558: 6 | P558: 12 | Q558: =(O558*6)+P558 -> 48 | S558: AGNEW :SERCIA :GILES
A559: BEST PLAYERS
A560: WERRIBEE | D560: SATTERLEY | G560: FITZPATRICK | K560: BUTTON | N560: MITCHELL | Q560: PURCELL | T560: WILLIAMS
A561: BOX HILL | D561: DWYER | G561: TREWELLA | K561: BADROCK
A562: GOALKICKERS
A563: WERRIBEE | D563: BUTTON 5 | G563: YZE 3 | J563: AZIZ 2 | M563: MURPHY
A564: BOX HILL | D564: CROWLEY 2 | G564: TREWELLA 2 | K564: DWYER 2
A566: BYE | D566: FRANKSTON
A568: ROUND 15 | D568: 5TH AUGUST | J568: WEATHER | S568: Venue: BEACH ROAD
D569: 1ST QTR | H569: 2ND QTR | L569: 3RD QTR | P569: FINAL | S569: UMPIRES | U569: SERCIA
A570: PORT MELBOURNE | C570: 1 | D570: 1 | E570: =(C570*6)+D570 -> 7 | G570: 6 | H570: 3 | I570: =(G570*6)+H570 -> 39 | K570: 8 | L570: 4 | M570: =(K570*6)+L570 -> 52 | O570: 11 | P570: 7 | Q570: =(O570*6)+P570 -> 73 | S570: SEXTON | Z570: LADDER | AC570: ROUND | AE570: 15
A571: SANDRINGHAM | C571: 1 | D571: 3 | E571: =(C571*6)+D571 -> 9 | G571: 1 | H571: 6 | I571: =(G571*6)+H571 -> 12 | K571: 3 | L571: 12 | M571: =(K571*6)+L571 -> 30 | O571: 4 | P571: 13 | Q571: =(O571*6)+P571 -> 37 | S571: ADAMS
A572: BEST PLAYERS | W572: TEAM | X572: B | Y572: W | Z572: L | AA572: D | AB572: FOR | AC572: AGST | AD572: % | AE572: PTS
A573: PORT MELBOURNE | D573: DULLARD | G573: PICIAONE | J573: R BOWDEN | M573: CAMERON | O573: McNAMARA | R573: EDWARDS
A574: SANDRINGHAM | D574: ALLEN | G574: ANGUS | J574: HERMAN | M574: WINTON | W574: SPRINGVALE | X574: 2 | Y574: 12 | Z574: 1 | AA574: 0 | AB574: 1572 | AC574: 877 | AD574: =(AB574/AC574)*100 -> 179.24743443557583 | AE574: =(Y574*4)+(AA574*2) -> 48
A575: GOALKICKERS | W575: PORT MELBOURNE | X575: 2 | Y575: 9 | Z575: 4 | AA575: 0 | AB575: 1670 | AC575: 1034 | AD575: =(AB575/AC575)*100 -> 161.50870406189554 | AE575: =(Y575*4)+(AA575*2) -> 36
A576: PORT MELBOURNE | D576: KELLY 2 | F576: BERRY 2 | H576: WEEDING 2 | K576: R BOWDEN | M576: JAMES | O576: BAILEY | Q576: SEXTON | S576: CAMERON | W576: SANDRINGHAM | X576: 1 | Y576: 9 | Z576: 5 | AA576: 0 | AB576: 1430 | AC576: 1019 | AD576: =(AB576/AC576)*100 -> 140.33366045142296 | AE576: =(Y576*4)+(AA576*2) -> 36
A577: SANDRINGHAM | D577: SEELEY 3 | G577: SCOTT-BRANIGAN | W577: BOX HILL | X577: 2 | Y577: 7 | Z577: 6 | AA577: 0 | AB577: 967 | AC577: 1146 | AD577: =(AB577/AC577)*100 -> 84.380453752181509 | AE577: =(Y577*4)+(AA577*2) -> 28
D578: 6TH AUGUST | J578: WEATHER | S578: Venue: COBURG | W578: WERRIBEE | X578: 1 | Y578: 7 | Z578: 7 | AA578: 0 | AB578: 970 | AC578: 1238 | AD578: =(AB578/AC578)*100 -> 78.352180936995154 | AE578: =(Y578*4)+(AA578*2) -> 28
A579: COBURG | C579: 2 | D579: 2 | E579: =(C579*6)+D579 -> 14 | G579: 3 | H579: 5 | I579: =(G579*6)+H579 -> 23 | K579: 4 | L579: 8 | M579: =(K579*6)+L579 -> 32 | O579: 5 | P579: 11 | Q579: =(O579*6)+P579 -> 41 | S579: DAVIDSON
A580: WILLIAMSTOWN | C580: 3 | D580: 3 | E580: =(C580*6)+D580 -> 21 | G580: 4 | H580: 4 | I580: =(G580*6)+H580 -> 28 | K580: 4 | L580: 14 | M580: =(K580*6)+L580 -> 38 | O580: 4 | P580: 15 | Q580: =(O580*6)+P580 -> 39 | S580: GILES | W580: FRANKSTON | X580: 2 | Y580: 6 | Z580: 7 | AA580: 0 | AB580: 1262 | AC580: 1166 | AD580: =(AB580/AC580)*100 -> 108.23327615780447 | AE580: =(Y580*4)+(AA580*2) -> 24
A581: BEST PLAYERS | S581: HEAD | W581: PRESTON | X581: 1 | Y581: 5 | Z581: 9 | AA581: 0 | AB581: 1127 | AC581: 1308 | AD581: =(AB581/AC581)*100 -> 86.162079510703364 | AE581: =(Y581*4)+(AA581*2) -> 20
A582: COBURG | D582: WESTON | G582: STANLEY | J582: HAWKINS | M582: FITZPATRICK | P582: SALVADORE | W582: COBURG | X582: 2 | Y582: 5 | Z582: 8 | AA582: 0 | AB582: 1067 | AC582: 1243 | AD582: =(AB582/AC582)*100 -> 85.840707964601776 | AE582: =(Y582*4)+(AA582*2) -> 20
A583: WILLIAMSTOWN | D583: TEAM EFFORT | W583: WILLIAMSTOWN | X583: 2 | Y583: 0 | Z583: 13 | AA583: 0 | AB583: 904 | AC583: 1838 | AD583: =(AB583/AC583)*100 -> 49.183895538628946 | AE583: =(Y583*4)+(AA583*2) -> 0
A584: GOALKICKERS
A585: COBURG | D585: PIESCIK 3 | G585: ALESSIO 2
A586: WILLIAMSTOWN | D586: MINETT | G586: BUGEJA | J586: JOHANSEN | M586: VENNER
A588: BOX HILL | C588: 4 | D588: 1 | E588: =(C588*6)+D588 -> 25 | G588: 4 | H588: 2 | I588: =(G588*6)+H588 -> 26 | K588: 5 | L588: 4 | M588: =(K588*6)+L588 -> 34 | O588: 6 | P588: 8 | Q588: =(O588*6)+P588 -> 44 | S588: Venue: BOX HILL
A589: PRESTON | C589: 2 | D589: 4 | E589: =(C589*6)+D589 -> 16 | G589: 2 | H589: 11 | I589: =(G589*6)+H589 -> 23 | K589: 4 | L589: 11 | M589: =(K589*6)+L589 -> 35 | O589: 4 | P589: 11 | Q589: =(O589*6)+P589 -> 35 | S589: PHILLIPS :MANN :JAMES
A590: BEST PLAYERS
A591: BOX HILL | D591: JAMES | G591: LIVINGSTONE | J591: BADROCK | M591: ROWE | O591: TREWELLA | R591: GREIG
A592: PRESTON | D592: MUNRIVANA | G592: FLAVELL | J592: DOBBS | M592: KING | O592: BRYSON | R592: MORRISEY
A593: GOALKICKERS
A594: BOX HILL | D594: DOUGLAS 2 | G594: McBEAN 2 | J594: GREIG | L594: TREWELLA
A595: PRESTON | D595: SHEARER 2 | G595: CARELLI | J595: WILSON
A597: FRANKSTON | C597: 3 | D597: 2 | E597: =(C597*6)+D597 -> 20 | G597: 7 | H597: 4 | I597: =(G597*6)+H597 -> 46 | K597: 9 | L597: 7 | M597: =(K597*6)+L597 -> 61 | O597: 13 | P597: 11 | Q597: =(O597*6)+P597 -> 89 | S597: Venue: FRANKSTON
A598: WERRIBEE | C598: 4 | D598: 1 | E598: =(C598*6)+D598 -> 25 | G598: 5 | H598: 3 | I598: =(G598*6)+H598 -> 33 | K598: 6 | L598: 5 | M598: =(K598*6)+L598 -> 41 | O598: 7 | P598: 9 | Q598: =(O598*6)+P598 -> 51 | S598: NICHOLLS :MALCOLM :VOZZO
A599: BEST PLAYERS
A600: FRANKSTON | D600: ATKINSON | G600: McKAY | J600: BOWEY | M600: PICKERING | P600: CHARLES | R600: TAYLOR
A601: WERRIBEE | D601: MITCHELL | G601: PURCELL | J601: WRIGHT | M601: FITZPATRICK | P601: TAYLOR
A602: GOALKICKERS
A603: FRANKSTON | D603: BOWEY 4 | G603: S RYAN 3 | J603: ANTHONY 2 | M603: MOORE | O603: MILLANE | R603: FREEMAN | U603: CHARLES
A604: WERRIBEE | D604: AZIZ 2 | G604: MURPHY | J604: PURCELL | M604: BUTTON | O604: ROACH | R604: McDONALD
A606: BYE | D606: SPRINGVALE
A608: ROUND 16 | D608: 12TH AUGUST | J608: WEATHER | S608: Venue: SPRINGVALE
D609: 1ST QTR | H609: 2ND QTR | L609: 3RD QTR | P609: FINAL | S609: UMPIRES | U609: GOODRICH
A610: SPRINGVALE | C610: 7 | D610: 1 | E610: =(C610*6)+D610 -> 43 | G610: 11 | H610: 3 | I610: =(G610*6)+H610 -> 69 | K610: 14 | L610: 6 | M610: =(K610*6)+L610 -> 90 | O610: 16 | P610: 7 | Q610: =(O610*6)+P610 -> 103 | S610: SHEARER | Z610: LADDER | AC610: ROUND | AE610: 16
A611: SANDRINGHAM | C611: 1 | D611: 3 | E611: =(C611*6)+D611 -> 9 | G611: 3 | H611: 5 | I611: =(G611*6)+H611 -> 23 | K611: 5 | L611: 6 | M611: =(K611*6)+L611 -> 36 | O611: 9 | P611: 6 | Q611: =(O611*6)+P611 -> 60 | S611: EDWARDS
A612: BEST PLAYERS | W612: TEAM | X612: B | Y612: W | Z612: L | AA612: D | AB612: FOR | AC612: AGST | AD612: % | AE612: PTS
A613: SPRINGVALE | D613: EVANS | G613: PEACOCK | J613: CARROLL | M613: TAYLOR | P613: O'DONNELL | S613: CLARKE
A614: SANDRINGHAM | D614: ARGUS | G614: SCOTT-BRANAGAN | M614: MITCHELSON | W614: SPRINGVALE | X614: 2 | Y614: 13 | Z614: 1 | AA614: 0 | AB614: 1675 | AC614: 937 | AD614: =(AB614/AC614)*100 -> 178.76200640341514 | AE614: =(Y614*4)+(AA614*2) -> 52
A615: GOALKICKERS | Q615: DYSON-HOLLAND | W615: PORT MELBOURNE | X615: 2 | Y615: 10 | Z615: 4 | AA615: 0 | AB615: 1814 | AC615: 1139 | AD615: =(AB615/AC615)*100 -> 159.26251097453908 | AE615: =(Y615*4)+(AA615*2) -> 40
A616: SPRINGVALE | D616: SMITH 4 | F616: EVANS 4 | H616: TAYLOR 2 | J616: CARIS 2 | L616: BALDWIN | N616: CARROLL | P616: KNIGHT | W616: SANDRINGHAM | X616: 1 | Y616: 9 | Z616: 6 | AA616: 0 | AB616: 1490 | AC616: 1122 | AD616: =(AB616/AC616)*100 -> 132.79857397504455 | AE616: =(Y616*4)+(AA616*2) -> 36
A617: SANDRINGHAM | D617: SCOTT-BRANAGAN 4 | H617: SEELEY 3 | K617: WINTON | M617: MARTELLO | W617: BOX HILL | X617: 2 | Y617: 8 | Z617: 6 | AA617: 0 | AB617: 1101 | AC617: 1224 | AD617: =(AB617/AC617)*100 -> 89.950980392156865 | AE617: =(Y617*4)+(AA617*2) -> 32
D618: 13TH AUGUST | J618: WEATHER | S618: Venue: PORT MELBOURNE | W618: FRANKSTON | X618: 2 | Y618: 7 | Z618: 7 | AA618: 0 | AB618: 1384 | AC618: 1242 | AD618: =(AB618/AC618)*100 -> 111.43317230273753 | AE618: =(Y618*4)+(AA618*2) -> 28
A619: PORT MELBOURNE | C619: 4 | D619: 4 | E619: =(C619*6)+D619 -> 28 | G619: 9 | H619: 8 | I619: =(G619*6)+H619 -> 62 | K619: 14 | L619: 16 | M619: =(K619*6)+L619 -> 100 | O619: 21 | P619: 18 | Q619: =(O619*6)+P619 -> 144 | S619: NICHOLLS
A620: COBURG | C620: 5 | D620: 1 | E620: =(C620*6)+D620 -> 31 | G620: 8 | H620: 5 | I620: =(G620*6)+H620 -> 53 | K620: 13 | L620: 6 | M620: =(K620*6)+L620 -> 84 | O620: 16 | P620: 9 | Q620: =(O620*6)+P620 -> 105 | S620: MALCOLM | W620: WERRIBEE | X620: 2 | Y620: 7 | Z620: 7 | AA620: 0 | AB620: 970 | AC620: 1238 | AD620: =(AB620/AC620)*100 -> 78.352180936995154 | AE620: =(Y620*4)+(AA620*2) -> 28
A621: BEST PLAYERS | S621: MANN | W621: COBURG | X621: 2 | Y621: 5 | Z621: 9 | AA621: 0 | AB621: 1172 | AC621: 1387 | AD621: =(AB621/AC621)*100 -> 84.498918529199713 | AE621: =(Y621*4)+(AA621*2) -> 20
A622: PORT MELBOURNE | D622: LAFFY | G622: R BOWDEN | J622: CHEEL | M622: LOCHEAD | P622: JAMES | S622: KELLY | W622: PRESTON | X622: 1 | Y622: 5 | Z622: 10 | AA622: 0 | AB622: 1203 | AC622: 1430 | AD622: =(AB622/AC622)*100 -> 84.12587412587412 | AE622: =(Y622*4)+(AA622*2) -> 20
A623: COBURG | D623: ALESSIO | G623: ZIROS | J623: WESTON | M623: STANLEY | P623: INGRAM | W623: WILLIAMSTOWN | X623: 2 | Y623: 0 | Z623: 14 | AA623: 0 | AB623: 982 | AC623: 1972 | AD623: =(AB623/AC623)*100 -> 49.79716024340771 | AE623: =(Y623*4)+(AA623*2) -> 0
A624: GOALKICKERS | L624: CAMERON | O624: EDWARDS | R624: CLOHESY
A625: PORT MELBOURNE | D625: LOCHEAD 9 | F625: McNAMARA 2 | I625: JAMES 2 | K625: HICKS 2 | M625: R BOWDEN | P625: SEXTON | R625: CHEEL
A626: COBURG | D626: ALESSIO 6 | G626: GRIFFITH 3 | J626: STANLEY 2 | M626: DALE 2 | O626: EVANS | Q626: PIESCIK | S626: NAPOLI
A628: BOX HILL | C628: 4 | D628: 4 | E628: =(C628*6)+D628 -> 28 | G628: 14 | H628: 9 | I628: =(G628*6)+H628 -> 93 | K628: 15 | L628: 11 | M628: =(K628*6)+L628 -> 101 | O628: 19 | P628: 20 | Q628: =(O628*6)+P628 -> 134 | S628: Venue: WILLIAMSTOWN
A629: WILLIAMSTOWN | C629: 2 | D629: 3 | E629: =(C629*6)+D629 -> 15 | G629: 3 | H629: 4 | I629: =(G629*6)+H629 -> 22 | K629: 6 | L629: 9 | M629: =(K629*6)+L629 -> 45 | O629: 11 | P629: 12 | Q629: =(O629*6)+P629 -> 78 | S629: ELLIS :MILLER :O'REILLY
A630: BEST PLAYERS
A631: BOX HILL | D631: BADROCK | G631: DALY | J631: CROWLEY | M631: DOUGLAS | P631: BREWER | S631: JOHNSON
A632: WILLIAMSTOWN | D632: ILICH | G632: CHRISTENSEN | J632: GHAZI | M632: BUGETA | P632: McGOWAN
A633: GOALKICKERS
A634: BOX HILL | D634: DOUGLAS 6 | G634: McBEAN 4 | J634: DWYER 2 | L634: LIVINGSTONE 2 | O634: CROWLEY | Q634: GREIG | S634: LYNDON | W634: TREWELLA | X634: SHANAHAN
A635: WILLIAMSTOWN | D635: GHAZI 3 | G635: McGOWAN 3 | J635: BUGEJA 2 | L635: JOHANSEN | O635: VENNER | Q635: PATTERSON
A637: FRANKSTON | C637: 6 | D637: 5 | E637: =(C637*6)+D637 -> 41 | G637: 10 | H637: 7 | I637: =(G637*6)+H637 -> 67 | K637: 16 | L637: 12 | M637: =(K637*6)+L637 -> 108 | O637: 18 | P637: 14 | Q637: =(O637*6)+P637 -> 122 | S637: Venue: PRESTON
A638: PRESTON | C638: 1 | D638: 5 | E638: =(C638*6)+D638 -> 11 | G638: 4 | H638: 10 | I638: =(G638*6)+H638 -> 34 | K638: 7 | L638: 11 | M638: =(K638*6)+L638 -> 53 | O638: 10 | P638: 16 | Q638: =(O638*6)+P638 -> 76 | S638: HEAD :RUSSO :DAVIDSON
A639: BEST PLAYERS
A640: FRANKSTON | D640: WINKEL | G640: ATKINSON | J640: PICKERING | M640: BOWEY | P640: KENNEDY | S640: ANTHONY
A641: PRESTON | D641: MORRISH | G641: McWATTERS | J641: WILSON
A642: GOALKICKERS
A643: FRANKSTON | D643: WINKEL 5 | G643: ANTHONY 3 | J643: MILLANE 2 | M643: COX 2 | O643: BOWEY 2 | Q643: RYAN 2 | S643: FREEMAN | W643: MEAD
A644: PRESTON | D644: SHEARER 3 | G644: CARELLI 2 | J644: TAYLOR | L644: FLAVELL | N644: MORRISSEY | Q644: WILSON | S644: MUNRIVANA
A646: BYE | D646: WERRIBEE
A648: ROUND 17 | D648: 19TH AUGUST | J648: WEATHER | S648: Venue: BOX HILL
D649: 1ST QTR | H649: 2ND QTR | L649: 3RD QTR | P649: FINAL | S649: UMPIRES | U649: FRAUMANO
A650: PORT MELBOURNE | C650: 2 | D650: 7 | E650: =(C650*6)+D650 -> 19 | G650: 6 | H650: 9 | I650: =(G650*6)+H650 -> 45 | K650: 17 | L650: 11 | M650: =(K650*6)+L650 -> 113 | O650: 21 | P650: 13 | Q650: =(O650*6)+P650 -> 139 | S650: DAVIDSON | Z650: LADDER | AC650: ROUND | AE650: 17
A651: BOX HILL | C651: 4 | D651: 4 | E651: =(C651*6)+D651 -> 28 | G651: 6 | H651: 5 | I651: =(G651*6)+H651 -> 41 | K651: 9 | L651: 9 | M651: =(K651*6)+L651 -> 63 | O651: 15 | P651: 13 | Q651: =(O651*6)+P651 -> 103 | S651: KELSEY
A652: BEST PLAYERS | W652: TEAM | X652: B | Y652: W | Z652: L | AA652: D | AB652: FOR | AC652: AGST | AD652: % | AE652: PTS
A653: PORT MELBOURNE | D653: PICIAONE | G653: DOYLE | J653: WEEDING | M653: DULLARD | P653: SEXTON | R653: CORRIGAN
A654: BOX HILL | D654: BADROCK | G654: GREIG | J654: BREWER | M654: WILKINSON | P654: GOODALE | R654: D ROWE | W654: SPRINGVALE | X654: 2 | Y654: 14 | Z654: 1 | AA654: 0 | AB654: 1776 | AC654: 1005 | AD654: =(AB654/AC654)*100 -> 176.71641791044777 | AE654: =(Y654*4)+(AA654*2) -> 56
A655: GOALKICKERS | O655: DULLARD | Q655: LOCHEAD | W655: PORT MELBOURNE | X655: 2 | Y655: 11 | Z655: 4 | AA655: 0 | AB655: 1953 | AC655: 1242 | AD655: =(AB655/AC655)*100 -> 157.24637681159422 | AE655: =(Y655*4)+(AA655*2) -> 44
A656: PORT MELBOURNE | D656: WEEDING 7 | F656: BAILEY 3 | H656: KELLY 2 | J656: SEXTON 2 | L656: HICKS 2 | N656: McNAMARA | Q656: JAMES | S656: PICIAONE | W656: SANDRINGHAM | X656: 2 | Y656: 9 | Z656: 6 | AA656: 0 | AB656: 1490 | AC656: 1122 | AD656: =(AB656/AC656)*100 -> 132.79857397504455 | AE656: =(Y656*4)+(AA656*2) -> 36
A657: BOX HILL | D657: WILKINSON 4 | G657: TREWELLA 3 | J657: BADROCK 2 | M657: DOUGLAS | O657: IBRAHIM | Q657: HEANEY | S657: GRIFFEN | W657: FRANKSTON | X657: 2 | Y657: 8 | Z657: 7 | AA657: 0 | AB657: 1533 | AC657: 1313 | AD657: =(AB657/AC657)*100 -> 116.75552170601675 | AE657: =(Y657*4)+(AA657*2) -> 32
D658: 20TH AUGUST | J658: WEATHER | N658: BREWER | P658: LIVINGSTONE | S658: Venue: COBURG | W658: BOX HILL | X658: 2 | Y658: 8 | Z658: 7 | AA658: 0 | AB658: 1204 | AC658: 1363 | AD658: =(AB658/AC658)*100 -> 88.334556126192226 | AE658: =(Y658*4)+(AA658*2) -> 32
A659: SPRINGVALE | C659: 1 | D659: 1 | E659: =(C659*6)+D659 -> 7 | G659: 8 | H659: 7 | I659: =(G659*6)+H659 -> 55 | K659: 11 | L659: 9 | M659: =(K659*6)+L659 -> 75 | O659: 14 | P659: 17 | Q659: =(O659*6)+P659 -> 101 | S659: HANLEY
A660: COBURG | C660: 3 | D660: 6 | E660: =(C660*6)+D660 -> 24 | G660: 3 | H660: 10 | I660: =(G660*6)+H660 -> 28 | K660: 8 | L660: 13 | M660: =(K660*6)+L660 -> 61 | O660: 9 | P660: 14 | Q660: =(O660*6)+P660 -> 68 | S660: SEXTON | W660: WERRIBEE | X660: 2 | Y660: 8 | Z660: 7 | AA660: 0 | AB660: 1054 | AC660: 1307 | AD660: =(AB660/AC660)*100 -> 80.642693190512631 | AE660: =(Y660*4)+(AA660*2) -> 32
A661: BEST PLAYERS | S661: AGNEW | W661: PRESTON | X661: 1 | Y661: 5 | Z661: 11 | AA661: 0 | AB661: 1272 | AC661: 1514 | AD661: =(AB661/AC661)*100 -> 84.015852047556137 | AE661: =(Y661*4)+(AA661*2) -> 20
A662: SPRINGVALE | D662: CAPLES | G662: BURGMAN | J662: BALDWIN | M662: TAYLOR | P662: JEFFS | R662: MELLODY | W662: COBURG | X662: 2 | Y662: 5 | Z662: 10 | AA662: 0 | AB662: 1240 | AC662: 1488 | AD662: =(AB662/AC662)*100 -> 83.333333333333343 | AE662: =(Y662*4)+(AA662*2) -> 20
A663: COBURG | D663: WESTON | G663: STANLEY | J663: BAKER | M663: ZIROS | P663: AUBREY | W663: WILLIAMSTOWN | X663: 2 | Y663: 0 | Z663: 15 | AA663: 0 | AB663: 1053 | AC663: 2121 | AD663: =(AB663/AC663)*100 -> 49.646393210749643 | AE663: =(Y663*4)+(AA663*2) -> 0
A664: GOALKICKERS | L664: CARROLL | O664: TAYLOR | Q664: SMITH | S664: MORGAN
A665: SPRINGVALE | D665: MONTGOMERY 3 | G665: MELLODY 2 | J665: DYSON-HOLLAND 2 | N665: KNIGHT 2 | Q665: BALDWIN
A666: COBURG | D666: ALESSIO 3 | G666: PIESCIK 2 | J666: KHEIR 2 | M666: GRIFFITHS | P666: WESTON
A668: FRANKSTON | C668: 4 | D668: 7 | E668: =(C668*6)+D668 -> 31 | G668: 10 | H668: 15 | I668: =(G668*6)+H668 -> 75 | K668: 14 | L668: 17 | M668: =(K668*6)+L668 -> 101 | O668: 21 | P668: 23 | Q668: =(O668*6)+P668 -> 149 | S668: Venue: FRANKSTON
A669: WILLIAMSTOWN | C669: 3 | D669: 4 | E669: =(C669*6)+D669 -> 22 | G669: 5 | H669: 8 | I669: =(G669*6)+H669 -> 38 | K669: 8 | L669: 9 | M669: =(K669*6)+L669 -> 57 | O669: 10 | P669: 11 | Q669: =(O669*6)+P669 -> 71 | S669: ADAMS :NICHOLLS :KANIZAY
A670: BEST PLAYERS
A671: FRANKSTON | D671: PICKERING | G671: MILLANE | J671: S RYAN | M671: SALIBA | P671: MOORE | R671: BOWEY
A672: WILLIAMSTOWN | D672: ILICH | G672: SHANKS | J672: PASTORE | M672: DOOLEY | P672: GHAZI
A673: GOALKICKERS
A674: FRANKSTON | D674: S RYAN 5 | F674: ANTHONY 3 | I674: McKAY 2 | K674: BOWEY 2 | M674: MILLANE 2 | P674: WOLFE | R674: MEAD | T674: LANCE | W674: D RYAN | Y674: WINKEL | AA674: PICKERING | AC674: CHARLES
A675: WILLIAMSTOWN | D675: DUFF-TYLER 3 | H675: MINETT 2 | K675: McGOWAN 2 | N675: GHAZI | P675: HOUGH | R675: SHANKS
A677: WERRIBEE | C677: 4 | D677: 2 | E677: =(C677*6)+D677 -> 26 | G677: 7 | H677: 8 | I677: =(G677*6)+H677 -> 50 | K677: 8 | L677: 8 | M677: =(K677*6)+L677 -> 56 | O677: 12 | P677: 12 | Q677: =(O677*6)+P677 -> 84 | S677: Venue: WERRIBEE
A678: PRESTON | C678: 3 | D678: 4 | E678: =(C678*6)+D678 -> 22 | G678: 4 | H678: 9 | I678: =(G678*6)+H678 -> 33 | K678: 8 | L678: 13 | M678: =(K678*6)+L678 -> 61 | O678: 9 | P678: 15 | Q678: =(O678*6)+P678 -> 69 | S678: JAMES :DELLER :ELLIS
A679: BEST PLAYERS
A680: WERRIBEE | D680: FITZPATRICK | G680: PURCELL | J680: MITCHELL | M680: EAMES | P680: MAY
A681: PRESTON | D681: CARELLI | G681: WILSON | J681: BRYSON | M681: TAYLOR | P681: HOLT | R681: MAIORANA
A682: GOALKICKERS
A683: WERRIBEE | D683: AZIZ 3 | G683: McDONALD 3 | J683: WRIGHT 2 | M683: BUTTON | O683: MURPHY | Q683: PURCELL | S683: YZE
A684: PRESTON | D684: WILSON 4 | G684: IVEY 2 | J684: McWATTERS | M684: SHEARER | O684: CARELLI
A686: BYE | D686: SANDRINGHAM
A688: ROUND 18 | D688: 26TH AUGUST | J688: WEATHER | S688: Venue: SPRINGVALE
D689: 1ST QTR | H689: 2ND QTR | L689: 3RD QTR | P689: FINAL | S689: UMPIRES | U689: ADAMS
A690: SPRINGVALE | C690: 4 | D690: 1 | E690: =(C690*6)+D690 -> 25 | G690: 10 | H690: 6 | I690: =(G690*6)+H690 -> 66 | K690: 12 | L690: 11 | M690: =(K690*6)+L690 -> 83 | O690: 17 | P690: 14 | Q690: =(O690*6)+P690 -> 116 | S690: MALCOLM | Z690: LADDER | AC690: ROUND | AE690: 18
A691: BOX HILL | C691: 5 | D691: 3 | E691: =(C691*6)+D691 -> 33 | G691: 7 | H691: 6 | I691: =(G691*6)+H691 -> 48 | K691: 10 | L691: 9 | M691: =(K691*6)+L691 -> 69 | O691: 12 | P691: 12 | Q691: =(O691*6)+P691 -> 84 | S691: MILLER
A692: BEST PLAYERS | W692: TEAM | X692: B | Y692: W | Z692: L | AA692: D | AB692: FOR | AC692: AGST | AD692: % | AE692: PTS
A693: SPRINGVALE | D693: CAPLES | G693: CLARK | J693: BALDWIN | M693: TAYLOR | O693: O'DONNELL | R693: CARROLL
A694: BOX HILL | D694: GREIG | G694: BADROCK | J694: GRIFFEN | M694: LIVINGSTONE | P694: JAMES | R694: ZARAFA | W694: SPRINGVALE | X694: 2 | Y694: 15 | Z694: 1 | AA694: 0 | AB694: 1892 | AC694: 1089 | AD694: =(AB694/AC694)*100 -> 173.73737373737376 | AE694: =(Y694*4)+(AA694*2) -> 60
A695: GOALKICKERS | O695: DYSON-HOLLAND | S695: BURNS | W695: PORT MELBOURNE | X695: 2 | Y695: 12 | Z695: 4 | AA695: 0 | AB695: 2058 | AC695: 1312 | AD695: =(AB695/AC695)*100 -> 156.85975609756099 | AE695: =(Y695*4)+(AA695*2) -> 48
A696: SPRINGVALE | D696: BALDWIN 3 | F696: LIELNORS 3 | I696: TAYLOR 3 | K696: CARIS 2 | M696: SMITH 2 | O696: MONTGOMERY | R696: O'DONNELL | W696: SANDRINGHAM | X696: 2 | Y696: 10 | Z696: 6 | AA696: 0 | AB696: 1622 | AC696: 1207 | AD696: =(AB696/AC696)*100 -> 134.38276719138361 | AE696: =(Y696*4)+(AA696*2) -> 40
A697: BOX HILL | D697: CROWLEY 2 | G697: WILKINSON 2 | J697: LIVINGSTONE 2 | M697: TREWELLA 2 | P697: IBRAHIM | R697: DALY | W697: WERRIBEE | X697: 2 | Y697: 9 | Z697: 7 | AA697: 0 | AB697: 1189 | AC697: 1338 | AD697: =(AB697/AC697)*100 -> 88.86397608370703 | AE697: =(Y697*4)+(AA697*2) -> 36
D698: 27TH AUGUST | J698: WEATHER | M698: GOTTLIEBSEN | P698: BADROCK | S698: Venue: BEACH ROAD | W698: FRANKSTON | X698: 2 | Y698: 8 | Z698: 8 | AA698: 0 | AB698: 1603 | AC698: 1418 | AD698: =(AB698/AC698)*100 -> 113.0465444287729 | AE698: =(Y698*4)+(AA698*2) -> 32
A699: SANDRINGHAM | C699: 5 | D699: 7 | E699: =(C699*6)+D699 -> 37 | G699: 8 | H699: 12 | I699: =(G699*6)+H699 -> 60 | K699: 13 | L699: 17 | M699: =(K699*6)+L699 -> 95 | O699: 18 | P699: 24 | Q699: =(O699*6)+P699 -> 132 | S699: NICHOLLS
A700: COBURG | C700: 2 | D700: 1 | E700: =(C700*6)+D700 -> 13 | G700: 7 | H700: 4 | I700: =(G700*6)+H700 -> 46 | K700: 10 | L700: 9 | M700: =(K700*6)+L700 -> 69 | O700: 12 | P700: 13 | Q700: =(O700*6)+P700 -> 85 | S700: HEAD | W700: BOX HILL | X700: 2 | Y700: 8 | Z700: 8 | AA700: 0 | AB700: 1288 | AC700: 1379 | AD700: =(AB700/AC700)*100 -> 93.401015228426402 | AE700: =(Y700*4)+(AA700*2) -> 32
A701: BEST PLAYERS | S701: PHILLIPS | W701: PRESTON | X701: 2 | Y701: 5 | Z701: 11 | AA701: 0 | AB701: 1272 | AC701: 1514 | AD701: =(AB701/AC701)*100 -> 84.015852047556137 | AE701: =(Y701*4)+(AA701*2) -> 20
A702: SANDRINGHAM | D702: FOLEY | G702: RIENIETS | J702: MITCHELSON | M702: ARGUS | O702: KELLAWAY | R702: MURRAY | W702: COBURG | X702: 2 | Y702: 5 | Z702: 11 | AA702: 0 | AB702: 1325 | AC702: 1620 | AD702: =(AB702/AC702)*100 -> 81.790123456790127 | AE702: =(Y702*4)+(AA702*2) -> 20
A703: COBURG | D703: PORTER | G703: INGRAM | J703: HAWKINS | M703: PIESCIK | O703: ZIROS | W703: WILLIAMSTOWN | X703: 2 | Y703: 0 | Z703: 16 | AA703: 0 | AB703: 1084 | AC703: 2256 | AD703: =(AB703/AC703)*100 -> 48.049645390070921 | AE703: =(Y703*4)+(AA703*2) -> 0
A704: GOALKICKERS | L704: WINTON | O704: KELLAWAY | R704: FOLEY
A705: SANDRINGHAM | D705: SNOOKS 3 | F705: RIENIETS 3 | I705: SCOTT-BRANIGAN 3 | M705: ALLEN 2 | O705: SEELEY 2 | Q705: OAKLEY 2
A706: COBURG | D706: PIESCIK 5 | G706: ALESSIO 3 | J706: LLOYD 2 | M706: AUBREY | O706: FITZPATRICK
A708: PORT MELBOURNE | C708: 4 | D708: 4 | E708: =(C708*6)+D708 -> 28 | G708: 6 | H708: 6 | I708: =(G708*6)+H708 -> 42 | K708: 9 | L708: 11 | M708: =(K708*6)+L708 -> 65 | O708: 15 | P708: 15 | Q708: =(O708*6)+P708 -> 105 | S708: Venue: PORT MELBOURNE
A709: FRANKSTON | C709: 4 | D709: 3 | E709: =(C709*6)+D709 -> 27 | G709: 5 | H709: 5 | I709: =(G709*6)+H709 -> 35 | K709: 8 | L709: 9 | M709: =(K709*6)+L709 -> 57 | O709: 10 | P709: 10 | Q709: =(O709*6)+P709 -> 70 | S709: GOODRIDGE :SHEARER :RUSSO
A710: BEST PLAYERS
A711: PORT MELBOURNE | D711: PERKINS | G711: McGEE | J711: DOYLE | M711: SEXTON | O711: CLOHESY | R711: JAMES
A712: FRANKSTON | D712: ATKINSON | G712: SALIBA | J712: HOPGOOD | M712: WINKEL | O712: MILLANE | R712: FREEMAN
A713: GOALKICKERS
A714: PORT MELBOURNE | D714: LOCHEAD 5 | G714: SEXTON 4 | J714: WEEDING 2 | M714: KELLY | O714: BAILEY | Q714: CHEEL | S714: PERKINS
A715: FRANKSTON | D715: MILLANE 3 | G715: BOWEY 2 | J715: MEAD 2 | M715: COX | O715: WEBB | Q715: D RYAN
A717: WERRIBEE | C717: 3 | D717: 0 | E717: =(C717*6)+D717 -> 18 | G717: 6 | H717: 6 | I717: =(G717*6)+H717 -> 42 | K717: 11 | L717: 10 | M717: =(K717*6)+L717 -> 76 | O717: 20 | P717: 15 | Q717: =(O717*6)+P717 -> 135 | S717: Venue: WILLIAMSTOWN
A718: WILLIAMSTOWN | C718: 0 | D718: 4 | E718: =(C718*6)+D718 -> 4 | G718: 0 | H718: 6 | I718: =(G718*6)+H718 -> 6 | K718: 1 | L718: 11 | M718: =(K718*6)+L718 -> 17 | O718: 3 | P718: 13 | Q718: =(O718*6)+P718 -> 31 | S718: LOVE :MANN :GILES
A719: BEST PLAYERS
A720: WERRIBEE | D720: FITZPATRICK | G720: MAY | I720: PURCELL | L720: GLADMAN | O720: SHANNON | R720: MITCHELL
A721: WILLIAMSTOWN | D721: DOOLEY | G721: HORE | I721: SHANKS | L721: McGOWAN | O721: ILICH
A722: GOALKICKERS
A723: WERRIBEE | D723: BUTTON 4 | G723: AZIZ 4 | I723: MITCHELL 3 | L723: RYAN 2 | N723: McDONALD 2 | Q723: MAY | R723: WRIGHT | U723: O'CONNOR | X723: SHANNON | AA723: PURCELL
A724: WILLIAMSTOWN | D724: McGOWAN 2 | G724: LLOYD
A726: BYE | D726: PRESTON
A728: FINALS
A729: ELIMINATION FINAL | F729: 2ND SEPTEMBER
D730: 1ST QTR | H730: 2ND QTR | L730: 3RD QTR | P730: FINAL
A731: FRANKSTON | C731: 3 | D731: 1 | E731: =(C731*6)+D731 -> 19 | G731: 5 | H731: 5 | I731: =(G731*6)+H731 -> 35 | K731: 9 | L731: 11 | M731: =(K731*6)+L731 -> 65 | O731: 14 | P731: 13 | Q731: =(O731*6)+P731 -> 97 | S731: Venue: VICTORIA PARK
A732: WERRIBEE | C732: 6 | D732: 1 | E732: =(C732*6)+D732 -> 37 | G732: 9 | H732: 4 | I732: =(G732*6)+H732 -> 58 | K732: 11 | L732: 6 | M732: =(K732*6)+L732 -> 72 | O732: 13 | P732: 7 | Q732: =(O732*6)+P732 -> 85 | S732: SERCIA :ACKLAND :MANN
A733: BEST PLAYERS
A734: FRANKSTON | D734: McKAY | G734: ATKINSON | J734: MILLANE | M734: WINKEL | P734: SALIBA | R734: BURNELL
A735: WERRIBEE | D735: FITZPATRICK | G735: WRIGHT | J735: MAY | M735: SATTERLEY | P735: A TAYLOR
A736: GOALKICKERS
A737: FRANKSTON | D737: WEBB 4 | F737: LANCE 2 | I737: SALIBA | K737: MEAD | M737: D RYAN | O737: S RYAN | Q737: MILLANE | S737: PICKERING | W737: WOLFE | Y737: CHARLES
A738: WERRIBEE | D738: AZIZ 3 | G738: YZE 3 | I738: MITCHELL 2 | L738: SATTERLEY | N738: ROACH | P738: McDONALD | R738: WILLIAMS | U738: SHANNON
A740: QUALIFYING FINAL | E740: 3RD SEPTEMBER | J740: WEATHER
A741: SANDRINGHAM | C741: 2 | D741: 3 | E741: =(C741*6)+D741 -> 15 | G741: 6 | H741: 8 | I741: =(G741*6)+H741 -> 44 | K741: 11 | L741: 11 | M741: =(K741*6)+L741 -> 77 | O741: 19 | P741: 18 | Q741: =(O741*6)+P741 -> 132 | S741: Venue: VICTORIA PARK
A742: PORT MELBOURNE | C742: 4 | D742: 5 | E742: =(C742*6)+D742 -> 29 | G742: 6 | H742: 9 | I742: =(G742*6)+H742 -> 45 | K742: 10 | L742: 13 | M742: =(K742*6)+L742 -> 73 | O742: 12 | P742: 15 | Q742: =(O742*6)+P742 -> 87 | S742: FRAUMANO :SEXTON :DAVIDSON
A743: BEST PLAYERS
A744: SANDRINGHAM | D744: SNOOKS | G744: RIENIETS | J744: ALVIN | M744: MITCHELSON | P744: HERMAN | S744: SMITH
A745: PORT MELBOURNE | D745: SEXTON | G745: LAFFY | J745: CAMERON
A746: GOALKICKERS
A747: SANDRINGHAM | D747: SNOOKS 8 | G747: ALVIN 3 | J747: WINTON 2 | M747: FOLEY 2 | O747: SCOTT-BRANIGAN 2 | S747: SMITH | U747: OAKLEY
A748: PORT MELBOURNE | D748: SEXTON 5 | G748: WEEDING 3 | J748: R BOWDEN | M748: BERRY | O748: JAMES | Q748: BAILEY
A750: 1ST SEMI | E750: 9TH SEPTEMBER
A751: PORT MELBOURNE | C751: 4 | D751: 1 | E751: =(C751*6)+D751 -> 25 | G751: 7 | H751: 1 | I751: =(G751*6)+H751 -> 43 | K751: 15 | L751: 6 | M751: =(K751*6)+L751 -> 96 | O751: 23 | P751: 8 | Q751: =(O751*6)+P751 -> 146 | S751: Venue: VICTORIA PARK
A752: FRANKSTON | C752: 2 | D752: 1 | E752: =(C752*6)+D752 -> 13 | G752: 8 | H752: 5 | I752: =(G752*6)+H752 -> 53 | K752: 12 | L752: 5 | M752: =(K752*6)+L752 -> 77 | O752: 14 | P752: 8 | Q752: =(O752*6)+P752 -> 92 | S752: SEXTON :LOVE :DELLER
A753: BEST PLAYERS
A754: PORT MELBOURNE | D754: CHEEL | G754: SEXTON | J754: HARKINS | M754: EDWARDS | P754: McGEE | S754: McNAMARA
A755: FRANKSTON | D755: SALIBA | G755: BURNELL | J755: PICKERING | M755: WINKEL | P755: TAYLOR
A756: GOALKICKERS
A757: PORT MELBOURNE | D757: SEXTON 8 | G757: McNAMARA 4 | J757: LOCHEAD 3 | M757: HARKINS 2 | P757: PICIAONE 2 | R757: DULLARD | U757: KELLY | X757: McGEE | Z757: RAGGATT
A758: FRANKSTON | D758: McKAY 3 | G758: TAYLOR 3 | J758: WINKEL 2 | M758: McCARTHY 2 | P758: PICKERING | R758: LANCE | T758: SALIBA | W758: FREEMAN
A760: 2ND SEMI | E760: 10TH SEPTEMBER
A761: SPRINGVALE | C761: 4 | D761: 4 | E761: =(C761*6)+D761 -> 28 | G761: 7 | H761: 5 | I761: =(G761*6)+H761 -> 47 | K761: 14 | L761: 13 | M761: =(K761*6)+L761 -> 97 | O761: 19 | P761: 15 | Q761: =(O761*6)+P761 -> 129 | S761: Venue: VICTORIA PARK
A762: SANDRINGHAM | C762: 1 | D762: 0 | E762: =(C762*6)+D762 -> 6 | G762: 6 | H762: 6 | I762: =(G762*6)+H762 -> 42 | K762: 7 | L762: 10 | M762: =(K762*6)+L762 -> 52 | O762: 12 | P762: 12 | Q762: =(O762*6)+P762 -> 84 | S762: GOODRIDGE :KELSEY :GARCIA
A763: BEST PLAYERS
A764: SPRINGVALE | D764: TAYLOR | G764: DYSON-HOLLAND | K764: CARROLL | N764: KNIGHT | P764: BURGMAN | S764: CLARK
A765: SANDRINGHAM | D765: HERMAN | G765: AMIET | K765: RIENIETS | N765: MARTELLO
A766: GOALKICKERS
A767: SPRINGVALE | D767: MONTGOMERY 4 | G767: KNIGHT 4 | J767: SMITH 3 | M767: BALDWIN 2 | P767: DYSON-HOLLAND 2 | T767: EVANS 2 | X767: MELLODY | AA767: BURGMAN
A768: SANDRINGHAM | D768: AMIET 5 | G768: SNOOKS 2 | J768: ALLEN | L768: ARGUS | N768: SCOTT-BRANIGAN | R768: FOLEY | T768: SMITH
A770: PRELIMINARY FINAL | F770: 17TH SEPTEMBER
A771: SANDRINGHAM | C771: 5 | D771: 5 | E771: =(C771*6)+D771 -> 35 | G771: 7 | H771: 9 | I771: =(G771*6)+H771 -> 51 | K771: 12 | L771: 17 | M771: =(K771*6)+L771 -> 89 | O771: 18 | P771: 18 | Q771: =(O771*6)+P771 -> 126 | S771: Venue: VICTORIA PARK
A772: PORT MELBOURNE | C772: 1 | D772: 2 | E772: =(C772*6)+D772 -> 8 | G772: 3 | H772: 4 | I772: =(G772*6)+H772 -> 22 | K772: 3 | L772: 6 | M772: =(K772*6)+L772 -> 24 | O772: 8 | P772: 10 | Q772: =(O772*6)+P772 -> 58 | S772: HANLEY :LOVE :SERCIA
A773: BEST PLAYERS
A774: SANDRINGHAM | D774: ALLEN | G774: FRATER | J774: HERMAN | M774: WINTON | P774: FOLEY | S774: SMITH
A775: PORT MELBOURNE | D775: McGEE | G775: EDWARDS | J775: RAGGATT
A776: GOALKICKERS
A777: SANDRINGHAM | D777: AMIET 4 | G777: SNOOKS 3 | J777: WALKER 3 | M777: SCOTT-BRANIGAN 2 | Q777: FRATER 2 | S777: HERMAN | W777: HANSON | Y777: KEIPERT | AA777: ALVIN
A778: PORT MELBOURNE | D778: RAGGATT 2 | G778: KEIGHRAN 2 | J778: McNAMARA | M778: JAMES | O778: SEXTON | Q778: McGEE
A780: GRAND FINAL | E780: 24TH SEPTEMBER
A781: SPRINGVALE | C781: 1 | D781: 1 | E781: =(C781*6)+D781 -> 7 | G781: 5 | H781: 5 | I781: =(G781*6)+H781 -> 35 | K781: 7 | L781: 5 | M781: =(K781*6)+L781 -> 47 | O781: 14 | P781: 10 | Q781: =(O781*6)+P781 -> 94 | S781: Venue: VICTORIA PARK
A782: SANDRINGHAM | C782: 2 | D782: 2 | E782: =(C782*6)+D782 -> 14 | G782: 3 | H782: 4 | I782: =(G782*6)+H782 -> 22 | K782: 5 | L782: 12 | M782: =(K782*6)+L782 -> 42 | O782: 6 | P782: 15 | Q782: =(O782*6)+P782 -> 51 | S782: HANLEY :SERCIA :SEXTON
A783: BEST PLAYERS
A784: SPRINGVALE | D784: BURGMANN | G784: CAPLES | J784: JEFFS | M784: EVANS | P784: MELLODY | S784: CARROLL
A785: SANDRINGHAM | D785: FRATER | G785: RIENIETS | J785: MARTELLO | M785: FOLEY | P785: WINTON | S785: MITCHELSON
A786: GOALKICKERS
A787: SPRINGVALE | D787: EVANS 5 | F787: SMITH 2 | H787: O'DONNELL 2 | K787: PEACOCK | M787: BALDWIN | O787: COURTNEY | R787: MELLODY | U787: DYSON-HOLLAND
A788: SANDRINGHAM | D788: AMIET 2 | G788: FOLEY 2 | J788: ALLEN | L788: WALKER