A1: Victorian Football League
A2: Season 1996
A3: © Copyright Wal Williams | F3: First created: 4 September 2016
A4: Contact: joywalwi at gmail dot com | F4: Last updated: 3 December 2016 | W4: VFA Results and tables - Link to the main index page
A5: You are free to copy this document in whole or part provided that proper acknowledgement is given to the author. All rights reserved.
A7: 1996 SEASON
A8: ROUND 1 | D8: 6TH APRIL | J8: WEATHER | S8: Venue: WILLIAMSTOWN
D9: 1ST QTR | H9: 2ND QTR | L9: 3RD QTR | P9: FINAL | S9: UMPIRES | V9: MALCOLM
A10: WILLIAMSTOWN | C10: 3 | D10: 1 | E10: =(C10*6)+D10 -> 19 | G10: 7 | H10: 5 | I10: =(G10*6)+H10 -> 47 | K10: 10 | L10: 6 | M10: =(K10*6)+L10 -> 66 | O10: 12 | P10: 12 | Q10: =(O10*6)+P10 -> 84 | S10: RUSSO | Z10: LADDER | AC10: ROUND | AE10: 1
A11: WERRIBEE | C11: 1 | D11: 4 | E11: =(C11*6)+D11 -> 10 | G11: 4 | H11: 5 | I11: =(G11*6)+H11 -> 29 | K11: 6 | L11: 10 | M11: =(K11*6)+L11 -> 46 | O11: 8 | P11: 13 | Q11: =(O11*6)+P11 -> 61 | S11: PRITCHARD
A12: BEST PLAYERS | W12: TEAM | X12: B | Y12: W | Z12: L | AA12: D | AB12: FOR | AC12: AGST | AD12: % | AE12: PTS
A13: WILLIAMSTOWN | C13: PASTORE | F13: HOUGH | I13: SHANKS | L13: O'KEEFE | O13: FRASER | R13: KENNY
A14: WERRIBEE | C14: AZIZ | F14: FITZPATRICK | I14: PURCELL | L14: EAMES | O14: McDONALD | W14: FRANKSTON | Y14: 1 | Z14: 0 | AA14: 0 | AB14: 150 | AC14: 38 | AD14: =(AB14/AC14)*100 -> 394.73684210526312 | AE14: =(Y14*4)+(AA14*2) -> 4
A15: GOALKICKERS | W15: WILLIAMSTOWN | Y15: 1 | Z15: 0 | AA15: 0 | AB15: 84 | AC15: 61 | AD15: =(AB15/AC15)*100 -> 137.70491803278688 | AE15: =(Y15*4)+(AA15*2) -> 4
A16: WILLIAMSTOWN | C16: PASTORE 3 | F16: VASSELLO 2 | I16: JOHANSEN 2 | K16: LLOYD | M16: DELRE | O16: GHAZI | Q16: SHANKS | S16: O'KEEFE | W16: NORTH BALLARAT | Y16: 1 | Z16: 0 | AA16: 0 | AB16: 99 | AC16: 84 | AD16: =(AB16/AC16)*100 -> 117.85714285714286 | AE16: =(Y16*4)+(AA16*2) -> 4
A17: WERRIBEE | C17: McDONALD 3 | F17: TAYLOR 2 | I17: MANSFIELD | L17: SAUNDERS | O17: SATTERLEY | W17: SANDRINGHAM | Y17: 1 | Z17: 0 | AA17: 0 | AB17: 91 | AC17: 78 | AD17: =(AB17/AC17)*100 -> 116.66666666666667 | AE17: =(Y17*4)+(AA17*2) -> 4
D18: 7TH APRIL | J18: WEATHER | S18: Venue: FRANKSTON | W18: SPRINGVALE | X18: 1 | Y18: 0 | Z18: 0 | AA18: 0 | AB18: 0 | AC18: 0 | AE18: =(Y18*4)+(AA18*2) -> 0
A19: FRANKSTON | C19: 3 | D19: 2 | E19: =(C19*6)+D19 -> 20 | G19: 9 | H19: 7 | I19: =(G19*6)+H19 -> 61 | K19: 17 | L19: 12 | M19: =(K19*6)+L19 -> 114 | O19: 22 | P19: 18 | Q19: =(O19*6)+P19 -> 150 | S19: MANN
A20: TRARALGON | C20: 4 | D20: 2 | E20: =(C20*6)+D20 -> 26 | G20: 4 | H20: 5 | I20: =(G20*6)+H20 -> 29 | K20: 4 | L20: 7 | M20: =(K20*6)+L20 -> 31 | O20: 5 | P20: 8 | Q20: =(O20*6)+P20 -> 38 | S20: JONES | W20: PORT MELBOURNE | X20: 1 | Y20: 0 | Z20: 0 | AA20: 0 | AB20: 0 | AC20: 0 | AE20: =(Y20*4)+(AA20*2) -> 0
A21: BEST PLAYERS | S21: SEXTON | W21: PRESTON | X21: 1 | Y21: 0 | Z21: 0 | AA21: 0 | AB21: 0 | AC21: 0 | AE21: =(Y21*4)+(AA21*2) -> 0
A22: FRANKSTON | C22: A PICKERING | F22: MILLANE | I22: CLARK | L22: MEAD | O22: D TAYLOR | R22: R STUBBS | W22: COBURG | Y22: 0 | Z22: 1 | AA22: 0 | AB22: 78 | AC22: 91 | AD22: =(AB22/AC22)*100 -> 85.714285714285708 | AE22: =(Y22*4)+(AA22*2) -> 0
A23: TRARALGON | C23: WOLFE | F23: STOCKDALE | I23: CAMERON | L23: WITHERS | O23: SMITH | R23: McGANNON | W23: BOX HILL | Y23: 0 | Z23: 1 | AA23: 0 | AB23: 84 | AC23: 99 | AD23: =(AB23/AC23)*100 -> 84.848484848484844 | AE23: =(Y23*4)+(AA23*2) -> 0
A24: GOALKICKERS | M24: BURNELL 2 | P24: BOWEY | R24: D TAYLOR | W24: WERRIBEE | Y24: 0 | Z24: 1 | AA24: 0 | AB24: 61 | AC24: 84 | AD24: =(AB24/AC24)*100 -> 72.61904761904762 | AE24: =(Y24*4)+(AA24*2) -> 0
A25: FRANKSTON | C25: D STUBBS 4 | F25: MILLANE 3 | I25: MEAD 3 | K25: CLARK 2 | M25: L TAYLOR 2 | P25: R STUBBS 2 | R25: A PICKERING 2 | W25: TRARALGON | Y25: 0 | Z25: 1 | AA25: 0 | AB25: 38 | AC25: 150 | AD25: =(AB25/AC25)*100 -> 25.333333333333336 | AE25: =(Y25*4)+(AA25*2) -> 0
A26: TRARALGON | C26: McGANNON 2 | F26: CUNNINGHAM | I26: FORYS | K26: TRESIDER
A28: NORTH BALLARAT | C28: 4 | D28: 2 | E28: =(C28*6)+D28 -> 26 | G28: 9 | H28: 6 | I28: =(G28*6)+H28 -> 60 | K28: 12 | L28: 7 | M28: =(K28*6)+L28 -> 79 | O28: 15 | P28: 9 | Q28: =(O28*6)+P28 -> 99 | S28: Venue: NORTH BALLARAT
A29: BOX HILL | C29: 4 | D29: 2 | E29: =(C29*6)+D29 -> 26 | G29: 6 | H29: 4 | I29: =(G29*6)+H29 -> 40 | K29: 7 | L29: 9 | M29: =(K29*6)+L29 -> 51 | O29: 12 | P29: 12 | Q29: =(O29*6)+P29 -> 84 | S29: DELLER :GOODRIDGE :JAMES
A30: BEST PLAYERS
A31: NORTH BALLARAT | C31: VENNER | F31: COX | I31: BUNN | L31: SLATER | O31: SHARPE | R31: T POLKINGHORNE
A32: BOX HILL | C32: GOODALE | F32: GRIFFIN | I32: DOWER
A33: GOALKICKERS
A34: NORTH BALLARAT | C34: DISNEY 2 | E34: MARTIN 2 | G34: BUNN 2 | I34: BROADBENT 2 | L34: QUINLAN 2 | N34: EZARD | P34: SHARPE | R34: GRANT | U34: SLATER | X34: FORWARD
A35: BOX HILL | C35: DOWER 4 | F35: WILKINSON 2 | I35: O'NEILL 2 | K35: COHEN | M35: FARRUGIA | O35: CHURCH | Q35: LIVINGSTONE
A37: SANDRINGHAM | C37: 1 | D37: 4 | E37: =(C37*6)+D37 -> 10 | G37: 4 | H37: 12 | I37: =(G37*6)+H37 -> 36 | K37: 9 | L37: 16 | M37: =(K37*6)+L37 -> 70 | O37: 12 | P37: 19 | Q37: =(O37*6)+P37 -> 91 | S37: Venue: COBURG
A38: COBURG | C38: 4 | D38: 3 | E38: =(C38*6)+D38 -> 27 | G38: 7 | H38: 5 | I38: =(G38*6)+H38 -> 47 | K38: 7 | L38: 8 | M38: =(K38*6)+L38 -> 50 | O38: 11 | P38: 12 | Q38: =(O38*6)+P38 -> 78 | S38: EDWARDS :KANIZAY :SHEARER
A39: BEST PLAYERS
A40: SANDRINGHAM | C40: ALLEN | F40: COUGHLAN | I40: SUTTON | L40: SAMPIERI | O40: McKELLAR
A41: COBURG | C41: CANN | F41: BAKER | I41: AITKEN | L41: STANLEY | O41: INGRAM | R41: ALESSIO
A42: GOALKICKERS
A43: SANDRINGHAM | C43: SMITH 3 | F43: ALVIN 2 | H43: KEIPERT 2 | K43: TEMPLETON 2 | N43: MOLONEY 2 | Q43: SCOTT-BRANAGAN
A44: COBURG | C44: ALESSIO 3 | F44: DALE 3 | H44: EVANS 2 | J44: INGRAM | L44: STANLEY | N44: PIESCIK
A46: BYE | D46: PORT MELBOURNE | G46: PRESTON | J46: SPRINGVALE
A48: ROUND 2 | D48: 13TH APRIL | J48: WEATHER | S48: Venue: BOX HILL
D49: 1ST QTR | H49: 2ND QTR | L49: 3RD QTR | P49: FINAL | S49: UMPIRES | V49: RUSSO
A50: COBURG | C50: 1 | D50: 4 | E50: =(C50*6)+D50 -> 10 | G50: 5 | H50: 6 | I50: =(G50*6)+H50 -> 36 | K50: 11 | L50: 11 | M50: =(K50*6)+L50 -> 77 | O50: 15 | P50: 12 | Q50: =(O50*6)+P50 -> 102 | S50: ADAMS | Z50: LADDER | AC50: ROUND | AE50: 2
A51: BOX HILL | C51: 2 | D51: 1 | E51: =(C51*6)+D51 -> 13 | G51: 3 | H51: 5 | I51: =(G51*6)+H51 -> 23 | K51: 3 | L51: 5 | M51: =(K51*6)+L51 -> 23 | O51: 5 | P51: 7 | Q51: =(O51*6)+P51 -> 37 | S51: NELIS
A52: BEST PLAYERS | W52: TEAM | X52: B | Y52: W | Z52: L | AA52: D | AB52: FOR | AC52: AGST | AD52: % | AE52: PTS
A53: COBURG | C53: SALVADORE | F53: INGRAM | I53: BAKER | L53: STANLEY | O53: ALESSIO | R53: ALLISON
A54: BOX HILL | C54: GRIFFIN | F54: GOODALE | I54: LIVINGSTONE | L54: ALLSOP | W54: FRANKSTON | Y54: 2 | Z54: 0 | AA54: 0 | AB54: 285 | AC54: 95 | AD54: =(AB54/AC54)*100 -> 300 | AE54: =(Y54*4)+(AA54*2) -> 8
A55: GOALKICKERS | W55: WILLIAMSTOWN | Y55: 2 | Z55: 0 | AA55: 0 | AB55: 200 | AC55: 151 | AD55: =(AB55/AC55)*100 -> 132.45033112582783 | AE55: =(Y55*4)+(AA55*2) -> 8
A56: COBURG | C56: ALESSIO 6 | F56: ZIROS 2 | H56: CERINI 2 | J56: SIR | K56: SALVADORE | N56: STANLEY | P56: EVANS | R56: PIESCIK | W56: COBURG | Y56: 1 | Z56: 1 | AA56: 0 | AB56: 180 | AC56: 128 | AD56: =(AB56/AC56)*100 -> 140.625 | AE56: =(Y56*4)+(AA56*2) -> 4
A57: BOX HILL | C57: GREIG | F57: LIVINGSTONE | I57: O'NEILL | K57: GOODALE | N57: COHEN | W57: SANDRINGHAM | X57: 1 | Y57: 1 | Z57: 0 | AA57: 0 | AB57: 91 | AC57: 78 | AD57: =(AB57/AC57)*100 -> 116.66666666666667 | AE57: =(Y57*4)+(AA57*2) -> 4
D58: 14TH APRIL | J58: WEATHER | M58: FINE | S58: Venue: FRANKSTON | W58: PORT MELBOURNE | X58: 1 | Y58: 1 | Z58: 0 | AA58: 0 | AB58: 80 | AC58: 74 | AD58: =(AB58/AC58)*100 -> 108.10810810810811 | AE58: =(Y58*4)+(AA58*2) -> 4
A59: FRANKSTON | C59: 4 | D59: 3 | E59: =(C59*6)+D59 -> 27 | G59: 9 | H59: 6 | I59: =(G59*6)+H59 -> 60 | K59: 12 | L59: 10 | M59: =(K59*6)+L59 -> 82 | O59: 20 | P59: 15 | Q59: =(O59*6)+P59 -> 135 | S59: MALCOLM
A60: NORTH BALLARAT | C60: 3 | D60: 0 | E60: =(C60*6)+D60 -> 18 | G60: 5 | H60: 2 | I60: =(G60*6)+H60 -> 32 | K60: 7 | L60: 5 | M60: =(K60*6)+L60 -> 47 | O60: 8 | P60: 9 | Q60: =(O60*6)+P60 -> 57 | S60: TWITT | W60: WERRIBEE | Y60: 1 | Z60: 1 | AA60: 0 | AB60: 131 | AC60: 131 | AD60: =(AB60/AC60)*100 -> 100 | AE60: =(Y60*4)+(AA60*2) -> 4
A61: BEST PLAYERS | S61: SHEARER | W61: NORTH BALLARAT | Y61: 1 | Z61: 1 | AA61: 0 | AB61: 156 | AC61: 219 | AD61: =(AB61/AC61)*100 -> 71.232876712328761 | AE61: =(Y61*4)+(AA61*2) -> 4
A62: FRANKSTON | C62: MEAD | E62: D TAYLOR | H62: MILLANE | K62: BOWEY | N62: D RYAN | Q62: RHYS-JONES | W62: SPRINGVALE | X62: 1 | Y62: 0 | Z62: 1 | AA62: 0 | AB62: 74 | AC62: 80 | AD62: =(AB62/AC62)*100 -> 92.5 | AE62: =(Y62*4)+(AA62*2) -> 0
A63: NORTH BALLARAT | C63: EZARD | E63: VENNER | H63: HUNES | K63: MADIGAN | N63: QUINLAN | Q63: T POLKINGHORNE | W63: PRESTON | X63: 1 | Y63: 0 | Z63: 1 | AA63: 0 | AB63: 47 | AC63: 70 | AD63: =(AB63/AC63)*100 -> 67.142857142857139 | AE63: =(Y63*4)+(AA63*2) -> 0
A64: GOALKICKERS | Q64: CLARK | W64: BOX HILL | Y64: 0 | Z64: 2 | AA64: 0 | AB64: 121 | AC64: 201 | AD64: =(AB64/AC64)*100 -> 60.199004975124382 | AE64: =(Y64*4)+(AA64*2) -> 0
A65: FRANKSTON | C65: MEAD 8 | E65: S RYAN 2 | G65: J PICKERING 2 | J65: R STUBBS 2 | M65: GEORGE 2 | O65: D STUBBS | Q65: L TAYLOR | T65: BOWEY | W65: TRARALGON | Y65: 0 | Z65: 2 | AA65: 0 | AB65: 128 | AC65: 266 | AD65: =(AB65/AC65)*100 -> 48.120300751879697 | AE65: =(Y65*4)+(AA65*2) -> 0
A66: NORTH BALLARAT | C66: MARTIN 3 | F66: QUINLAN 3 | I66: S SLATER | K66: M PARTINGTON
A68: PORT MELBOURNE | C68: 5 | D68: 7 | E68: =(C68*6)+D68 -> 37 | G68: 6 | H68: 11 | I68: =(G68*6)+H68 -> 47 | K68: 8 | L68: 15 | M68: =(K68*6)+L68 -> 63 | O68: 10 | P68: 20 | Q68: =(O68*6)+P68 -> 80 | S68: Venue: SPRINGVALE
A69: SPRINGVALE | C69: 2 | D69: 1 | E69: =(C69*6)+D69 -> 13 | G69: 8 | H69: 8 | I69: =(G69*6)+H69 -> 56 | K69: 10 | L69: 7 | M69: =(K69*6)+L69 -> 67 | O69: 11 | P69: 8 | Q69: =(O69*6)+P69 -> 74 | S69: VOZZO :MANN :QUIGLEY
A70: BEST PLAYERS
A71: PORT MELBOURNE | C71: HOFFMAN | F71: HARKINS | I71: WHELAN | L71: WEEDING | O71: BALLANTYNE | R71: BERRY
A72: SPRINGVALE | C72: CAPLES | F72: CLARK | I72: WOODMAN | L72: COURTNEY | O72: CAPSALIS | R72: STUBBS
A73: GOALKICKERS
A74: PORT MELBOURNE | C74: BERRY 3 | F74: HOFFMAN 2 | I74: BALLANTYNE 2 | L74: BAILEY | N74: WEEDING | Q74: SHARP
A75: SPRINGVALE | C75: STUBBS 4 | F75: BALDWIN 3 | I75: DAVISON 2 | L75: LEILNORS | N75: BURGMANN
A77: WERRIBEE | C77: 1 | D77: 7 | E77: =(C77*6)+D77 -> 13 | G77: 3 | H77: 11 | I77: =(G77*6)+H77 -> 29 | K77: 6 | L77: 11 | M77: =(K77*6)+L77 -> 47 | O77: 9 | P77: 16 | Q77: =(O77*6)+P77 -> 70 | S77: Venue: WERRIBEE
A78: PRESTON | C78: 2 | D78: 0 | E78: =(C78*6)+D78 -> 12 | G78: 4 | H78: 3 | I78: =(G78*6)+H78 -> 27 | K78: 5 | L78: 5 | M78: =(K78*6)+L78 -> 35 | O78: 7 | P78: 5 | Q78: =(O78*6)+P78 -> 47 | S78: GILES :SEXTON :STEWART
A79: BEST PLAYERS
A80: WERRIBEE | C80: McCARTHY | F80: ROACH | I80: MANSFIELD | L80: MITCHELL | O80: AZIZ | Q80: D SAUNDERS
A81: PRESTON | C81: MAIORANA | F81: DOBELL | I81: KOFOED | L81: MILLER
A82: GOALKICKERS
A83: WERRIBEE | C83: BUTTON 3 | F83: CHURCHILL | I83: MASSARA | K83: PURCELL | M83: MITCHELL | O83: MURPHY | Q83: D SAUNDERS
A84: PRESTON | C84: BYRNE 3 | F84: BLAGROVE 2 | I84: DOBELL | K84: WILSON
A86: WILLIAMSTOWN | C86: 4 | D86: 1 | E86: =(C86*6)+D86 -> 25 | G86: 10 | H86: 3 | I86: =(G86*6)+H86 -> 63 | K86: 14 | L86: 4 | M86: =(K86*6)+L86 -> 88 | O86: 18 | P86: 8 | Q86: =(O86*6)+P86 -> 116 | S86: Venue: TRARALGON
A87: TRARALGON | C87: 1 | D87: 6 | E87: =(C87*6)+D87 -> 12 | G87: 2 | H87: 8 | I87: =(G87*6)+H87 -> 20 | K87: 7 | L87: 15 | M87: =(K87*6)+L87 -> 57 | O87: 12 | P87: 18 | Q87: =(O87*6)+P87 -> 90 | S87: DAVISON :KELSEY :MASON
A88: BEST PLAYERS
A89: WILLIAMSTOWN | C89: LLOYD | F89: NEILSON | I89: KIRKBY | L89: O'KEEFE | O89: FRASER | R89: GOULD
A90: TRARALGON | C90: WOLFE | F90: STOCKDALE | I90: SMITH | L90: CAMERON | O90: BURRIDGE | R90: ROBERTSON
A91: GOALKICKERS
A92: WILLIAMSTOWN | C92: NEILSON 7 | F92: O'KEEFE 4 | I92: DELRE 3 | K92: FRASER 2 | N92: GHAZI | P92: LLOYD
A93: TRARALGON | C93: STOCKDALE 7 | F93: GARNER | H93: TRESIDER | K93: DECIERO | M93: FORYS | O93: RAYNER
A95: BYE | D95: SANDRINGHAM
A97: ROUND 3 | D97: 20TH APRIL | J97: WEATHER | S97: Venue: NORTH BALLARAT
D98: 1ST QTR | H98: 2ND QTR | L98: 3RD QTR | P98: FINAL | S98: UMPIRES | V98: DAVIDSON
A99: SPRINGVALE | C99: 1 | D99: 1 | E99: =(C99*6)+D99 -> 7 | G99: 2 | H99: 6 | I99: =(G99*6)+H99 -> 18 | K99: 4 | L99: 10 | M99: =(K99*6)+L99 -> 34 | O99: 5 | P99: 18 | Q99: =(O99*6)+P99 -> 48 | S99: HEAD | Z99: LADDER | AC99: ROUND | AE99: 3
A100: NORTH BALLARAT | C100: 2 | D100: 6 | E100: =(C100*6)+D100 -> 18 | G100: 2 | H100: 8 | I100: =(G100*6)+H100 -> 20 | K100: 3 | L100: 11 | M100: =(K100*6)+L100 -> 29 | O100: 5 | P100: 12 | Q100: =(O100*6)+P100 -> 42 | S100: QUIGLEY
A101: BEST PLAYERS | W101: TEAM | X101: B | Y101: W | Z101: L | AA101: D | AB101: FOR | AC101: AGST | AD101: % | AE101: PTS
A102: SPRINGVALE | C102: CAPLES | F102: CARROLL | I102: DELARUE | L102: CLARK | N102: O'DONNELL | R102: YEATS
A103: NORTH BALLARAT | C103: COX | F103: BUNN | I103: MURRIHY | L103: CARR | N103: T POLKINGHORNE | R103: MADIGAN | W103: FRANKSTON | Y103: 3 | Z103: 0 | AA103: 0 | AB103: 443 | AC103: 184 | AD103: =(AB103/AC103)*100 -> 240.76086956521738 | AE103: =(Y103*4)+(AA103*2) -> 12
A104: GOALKICKERS | W104: WERRIBEE | Y104: 2 | Z104: 1 | AA104: 0 | AB104: 259 | AC104: 177 | AD104: =(AB104/AC104)*100 -> 146.32768361581921 | AE104: =(Y104*4)+(AA104*2) -> 8
A105: SPRINGVALE | C105: LEILNORS 2 | F105: STUBBS | H105: BURGMANN | K105: BALDWIN | W105: WILLIAMSTOWN | X105: 1 | Y105: 2 | Z105: 0 | AA105: 0 | AB105: 200 | AC105: 151 | AD105: =(AB105/AC105)*100 -> 132.45033112582783 | AE105: =(Y105*4)+(AA105*2) -> 8
A106: NORTH BALLARAT | C106: QUINLAN 2 | F106: HOOD 2 | H106: BROADBENT | W106: COBURG | Y106: 2 | Z106: 1 | AA106: 0 | AB106: 317 | AC106: 242 | AD106: =(AB106/AC106)*100 -> 130.99173553719007 | AE106: =(Y106*4)+(AA106*2) -> 8
D107: 21ST APRIL | J107: WEATHER | S107: Venue: BOX HILL | W107: SANDRINGHAM | X107: 1 | Y107: 2 | Z107: 0 | AA107: 0 | AB107: 174 | AC107: 159 | AD107: =(AB107/AC107)*100 -> 109.43396226415094 | AE107: =(Y107*4)+(AA107*2) -> 8
A108: FRANKSTON | C108: 8 | D108: 6 | E108: =(C108*6)+D108 -> 54 | G108: 15 | H108: 10 | I108: =(G108*6)+H108 -> 100 | K108: 21 | L108: 14 | M108: =(K108*6)+L108 -> 140 | O108: 24 | P108: 14 | Q108: =(O108*6)+P108 -> 158 | S108: MALCOLM
A109: BOX HILL | C109: 1 | D109: 4 | E109: =(C109*6)+D109 -> 10 | G109: 5 | H109: 4 | I109: =(G109*6)+H109 -> 34 | K109: 8 | L109: 5 | M109: =(K109*6)+L109 -> 53 | O109: 13 | P109: 11 | Q109: =(O109*6)+P109 -> 89 | S109: TWITT | W109: SPRINGVALE | X109: 1 | Y109: 1 | Z109: 1 | AA109: 0 | AB109: 122 | AC109: 122 | AD109: =(AB109/AC109)*100 -> 100 | AE109: =(Y109*4)+(AA109*2) -> 4
A110: BEST PLAYERS | S110: SHEARER | W110: PORT MELBOURNE | X110: 1 | Y110: 1 | Z110: 1 | AA110: 0 | AB110: 194 | AC110: 211 | AD110: =(AB110/AC110)*100 -> 91.943127962085299 | AE110: =(Y110*4)+(AA110*2) -> 4
A111: FRANKSTON | C111: BOWEY | F111: R STUBBS | I111: CLARK | L111: RHYS-JONES | O111: BURNELL | W111: NORTH BALLARAT | Y111: 1 | Z111: 2 | AA111: 0 | AB111: 198 | AC111: 267 | AD111: =(AB111/AC111)*100 -> 74.157303370786522 | AE111: =(Y111*4)+(AA111*2) -> 4
A112: BOX HILL | C112: PAYNE | F112: GOODALE | I112: DUANE | L112: DOWER | W112: PRESTON | X112: 1 | Y112: 0 | Z112: 2 | AA112: 0 | AB112: 128 | AC112: 153 | AD112: =(AB112/AC112)*100 -> 83.66013071895425 | AE112: =(Y112*4)+(AA112*2) -> 0
A113: GOALKICKERS | L113: RYAN | N113: PARIS | P113: D STUBBS | R113: MILLANE | W113: BOX HILL | Y113: 0 | Z113: 3 | AA113: 0 | AB113: 210 | AC113: 359 | AD113: =(AB113/AC113)*100 -> 58.495821727019504 | AE113: =(Y113*4)+(AA113*2) -> 0
A114: FRANKSTON | C114: R STUBBS 8 | F114: TAYLOR 3 | I114: GEORGE 3 | K114: PICKERING 2 | N114: BOWEY 2 | P114: MEAD | R114: BURNELL | W114: TRARALGON | Y114: 0 | Z114: 3 | AA114: 0 | AB114: 174 | AC114: 394 | AD114: =(AB114/AC114)*100 -> 44.162436548223347 | AE114: =(Y114*4)+(AA114*2) -> 0
A115: BOX HILL | C115: DOWER 5 | F115: EDDY 2 | H115: DUANE | J115: GOODALE | M115: MORLEY | O115: COHEN | Q115: PAYNE | S115: O'NEILL
A117: COBURG | C117: 4 | D117: 4 | E117: =(C117*6)+D117 -> 28 | G117: 10 | H117: 6 | I117: =(G117*6)+H117 -> 66 | K117: 14 | L117: 10 | M117: =(K117*6)+L117 -> 94 | O117: 20 | P117: 17 | Q117: =(O117*6)+P117 -> 137 | S117: Venue: PORT MELBOURNE
A118: PORT MELBOURNE | C118: 4 | D118: 3 | E118: =(C118*6)+D118 -> 27 | G118: 9 | H118: 4 | I118: =(G118*6)+H118 -> 58 | K118: 13 | L118: 6 | M118: =(K118*6)+L118 -> 84 | O118: 18 | P118: 6 | Q118: =(O118*6)+P118 -> 114 | S118: PRITCHARD :DELLER :JAMES
A119: BEST PLAYERS
A120: COBURG | C120: ZIROS | F120: INGRAM | I120: STANLEY | L120: PORTER | O120: CERINI | R120: BAKER
A121: PORT MELBOURNE | C121: HARKINS | F121: HOLLOW | I121: GIARUSSO | L121: BALLANTYNE | O121: CAMERON | R121: SEXTON
A122: GOALKICKERS
A123: COBURG | C123: ZIROS 5 | E123: PIESCIK 3 | G123: SIR 2 | I123: SOLOMON 2 | L123: SALVADORE 2 | O123: EVANS | Q123: BAKER | S123: ALESSIO | V123: BAKIS | X123: NAPOLI | AA123: STANLEY
A124: PORT MELBOURNE | C124: BALLANTYNE 4 | F124: KELLY 4 | H124: WEEDING 3 | K124: THOMPSON 2 | N124: KEIGHRAN | Q124: JAMES | S124: HARKINS | V124: SHARP | X124: CAMPBELL
A126: SANDRINGHAM | C126: 5 | D126: 2 | E126: =(C126*6)+D126 -> 32 | G126: 8 | H126: 2 | I126: =(G126*6)+H126 -> 50 | K126: 10 | L126: 5 | M126: =(K126*6)+L126 -> 65 | O126: 12 | P126: 11 | Q126: =(O126*6)+P126 -> 83 | S126: Venue: PRESTON
A127: PRESTON | C127: 4 | D127: 3 | E127: =(C127*6)+D127 -> 27 | G127: 8 | H127: 8 | I127: =(G127*6)+H127 -> 56 | K127: 9 | L127: 12 | M127: =(K127*6)+L127 -> 66 | O127: 11 | P127: 15 | Q127: =(O127*6)+P127 -> 81 | S127: GOODRICH :JONES :MANN
A128: BEST PLAYERS
A129: SANDRINGHAM | C129: SCOTT-BRANAGAN | G129: S SMITH | I129: CROUGH | L129: SAMPIERI | O129: McKELLAR
A130: PRESTON | C130: DOBELL | F130: MAIORANA | I130: MUNRIVANA | L130: HAMMER | O130: BOOKER | R130: TAYLOR
A131: GOALKICKERS
A132: SANDRINGHAM | C132: SCOTT-BRANAGAN 3 | G132: S SMITH 2 | J132: KEIPERT 2 | M132: SNOOKS 2 | O132: TEMPLETON | R132: M SMITH | U132: ALVIN
A133: PRESTON | C133: BOOKER 3 | F133: MALLON 3 | I133: BLAGROVE 2 | L133: PASCOE 2 | N133: CARELLI
A135: WERRIBEE | C135: 7 | D135: 1 | E135: =(C135*6)+D135 -> 43 | G135: 11 | H135: 7 | I135: =(G135*6)+H135 -> 73 | K135: 14 | L135: 13 | M135: =(K135*6)+L135 -> 97 | O135: 19 | P135: 14 | Q135: =(O135*6)+P135 -> 128 | S135: Venue: WERRIBEE
A136: TRARALGON | C136: 0 | D136: 3 | E136: =(C136*6)+D136 -> 3 | G136: 3 | H136: 3 | I136: =(G136*6)+H136 -> 21 | K136: 3 | L136: 4 | M136: =(K136*6)+L136 -> 22 | O136: 6 | P136: 10 | Q136: =(O136*6)+P136 -> 46 | S136: ADAMS :PANOZZA :EDWARDS
A137: BEST PLAYERS
A138: WERRIBEE | C138: CHURCHILL | F138: BUTTON | I138: N SAUNDERS | L138: AZIZ | O138: EAMES | R138: PULI
A139: TRARALGON | C139: CAMERON | F139: BURRIDGE | I139: WOLFE | L139: STOCKDALE | O139: WITHERS | R139: FOSTER
A140: GOALKICKERS
A141: WERRIBEE | C141: BUTTON 7 | E141: D SAUNDERS 2 | H141: MITCHELL 2 | J141: MURPHY | L141: CHURCHILL | N141: PURCELL | P141: McCARTHY | R141: N SAUNDERS | W141: MAY | X141: MANSFIELD | AA141: ROACH
A142: TRARALGON | C142: STOCKDALE 4 | G142: RAYNER | J142: SHERRIFF
A144: BYE | D144: WILLIAMSTOWN
A146: ROUND 4 | D146: 27TH APRIL | J146: WEATHER | S146: Venue: PORT MELBOURNE
D147: 1ST QTR | H147: 2ND QTR | L147: 3RD QTR | P147: FINAL | S147: UMPIRES | V147: DAVIDSON
A148: PORT MELBOURNE | C148: 6 | D148: 4 | E148: =(C148*6)+D148 -> 40 | G148: 9 | H148: 9 | I148: =(G148*6)+H148 -> 63 | K148: 12 | L148: 10 | M148: =(K148*6)+L148 -> 82 | O148: 15 | P148: 12 | Q148: =(O148*6)+P148 -> 102 | S148: STEWART | Z148: LADDER | AC148: ROUND | AE148: 4
A149: BOX HILL | C149: 1 | D149: 3 | E149: =(C149*6)+D149 -> 9 | G149: 4 | H149: 7 | I149: =(G149*6)+H149 -> 31 | K149: 6 | L149: 12 | M149: =(K149*6)+L149 -> 48 | O149: 12 | P149: 17 | Q149: =(O149*6)+P149 -> 89 | S149: SHEARER
A150: BEST PLAYERS | W150: TEAM | X150: B | Y150: W | Z150: L | AA150: D | AB150: FOR | AC150: AGST | AD150: % | AE150: PTS
A151: PORT MELBOURNE | C151: KELLY | F151: McGEE | I151: CAMERON | L151: R BOWDEN | O151: HARKINS | R151: PEKIN
A152: BOX HILL | C152: GOODALE | F152: SLATER | I152: PAYNE | L152: DOUGLAS | O152: O'NEILL | R152: DOWER | W152: FRANKSTON | Y152: 4 | Z152: 0 | AA152: 0 | AB152: 619 | AC152: 227 | AD152: =(AB152/AC152)*100 -> 272.68722466960355 | AE152: =(Y152*4)+(AA152*2) -> 16
A153: GOALKICKERS | P153: WEEDING | R153: McGEE | W153: SANDRINGHAM | X153: 1 | Y153: 3 | Z153: 0 | AA153: 0 | AB153: 302 | AC153: 259 | AD153: =(AB153/AC153)*100 -> 116.60231660231659 | AE153: =(Y153*4)+(AA153*2) -> 12
A154: PORT MELBOURNE | C154: BERRY 4 | E154: HARKINS 2 | H154: BAILEY 2 | J154: KELLY 2 | L154: BALLANTYNE | O154: K BOWDEN | R154: PEKIN | W154: SPRINGVALE | X154: 1 | Y154: 2 | Z154: 1 | AA154: 0 | AB154: 246 | AC154: 157 | AD154: =(AB154/AC154)*100 -> 156.68789808917199 | AE154: =(Y154*4)+(AA154*2) -> 8
A155: BOX HILL | C155: DOWER 4 | F155: DUANE 2 | H155: IBRAHIM | J155: MURLEY | L155: SLATER | N155: O'NEILL | W155: WERRIBEE | X155: 1 | Y155: 2 | Z155: 1 | AA155: 0 | AB155: 259 | AC155: 177 | AD155: =(AB155/AC155)*100 -> 146.32768361581921 | AE155: =(Y155*4)+(AA155*2) -> 8
D156: 28TH APRIL | J156: WEATHER | S156: Venue: FRANKSTON | W156: WILLIAMSTOWN | X156: 1 | Y156: 2 | Z156: 1 | AA156: 0 | AB156: 300 | AC156: 279 | AD156: =(AB156/AC156)*100 -> 107.5268817204301 | AE156: =(Y156*4)+(AA156*2) -> 8
A157: FRANKSTON | C157: 4 | D157: 5 | E157: =(C157*6)+D157 -> 29 | G157: 14 | H157: 9 | I157: =(G157*6)+H157 -> 93 | K157: 20 | L157: 13 | M157: =(K157*6)+L157 -> 133 | O157: 26 | P157: 20 | Q157: =(O157*6)+P157 -> 176 | S157: HEAD
A158: COBURG | C158: 1 | D158: 4 | E158: =(C158*6)+D158 -> 10 | G158: 2 | H158: 5 | I158: =(G158*6)+H158 -> 17 | K158: 3 | L158: 5 | M158: =(K158*6)+L158 -> 23 | O158: 6 | P158: 7 | Q158: =(O158*6)+P158 -> 43 | S158: GOODRIDGE | W158: PORT MELBOURNE | X158: 1 | Y158: 2 | Z158: 1 | AA158: 0 | AB158: 296 | AC158: 300 | AD158: =(AB158/AC158)*100 -> 98.666666666666671 | AE158: =(Y158*4)+(AA158*2) -> 8
A159: BEST PLAYERS | S159: MANN | W159: COBURG | Y159: 2 | Z159: 2 | AA159: 0 | AB159: 360 | AC159: 553 | AD159: =(AB159/AC159)*100 -> 65.099457504520799 | AE159: =(Y159*4)+(AA159*2) -> 8
A160: FRANKSTON | C160: MILLANE | F160: BOWEY | I160: MACKAY | L160: CLARKE | O160: BURNELL | R160: A PICKERING | W160: NORTH BALLARAT | Y160: 1 | Z160: 3 | AA160: 0 | AB160: 254 | AC160: 366 | AD160: =(AB160/AC160)*100 -> 69.398907103825138 | AE160: =(Y160*4)+(AA160*2) -> 4
A161: COBURG | C161: INGRAM | F161: STANLEY | I161: AUBREY | L161: WESTON | O161: AITKEN | W161: TRARALGON | Y161: 1 | Z161: 3 | AA161: 0 | AB161: 273 | AC161: 450 | AD161: =(AB161/AC161)*100 -> 60.666666666666671 | AE161: =(Y161*4)+(AA161*2) -> 4
A162: GOALKICKERS | Q162: GEORGE | W162: BOX HILL | Y162: 0 | Z162: 4 | AA162: 0 | AB162: 299 | AC162: 461 | AD162: =(AB162/AC162)*100 -> 64.859002169197396 | AE162: =(Y162*4)+(AA162*2) -> 0
A163: FRANKSTON | C163: MACKAY 9 | F163: MILLANE 4 | I163: BOWEY 4 | K163: R STUBBS 3 | N163: J PICKERING 2 | Q163: CLARK 2 | S163: MEAD | W163: PRESTON | X163: 1 | Y163: 0 | Z163: 3 | AA163: 0 | AB163: 163 | AC163: 277 | AD163: =(AB163/AC163)*100 -> 58.844765342960294 | AE163: =(Y163*4)+(AA163*2) -> 0
A164: COBURG | C164: ZIROS 3 | F164: EVANS | H164: SALVADORE | K164: ALESSIO
A166: TRARALGON | C166: 3 | D166: 3 | E166: =(C166*6)+D166 -> 21 | G166: 5 | H166: 5 | I166: =(G166*6)+H166 -> 35 | K166: 9 | L166: 10 | M166: =(K166*6)+L166 -> 64 | O166: 14 | P166: 15 | Q166: =(O166*6)+P166 -> 99 | S166: Venue: TRARALGON
A167: NORTH BALLARAT | C167: 5 | D167: 5 | E167: =(C167*6)+D167 -> 35 | G167: 5 | H167: 7 | I167: =(G167*6)+H167 -> 37 | K167: 8 | L167: 8 | M167: =(K167*6)+L167 -> 56 | O167: 8 | P167: 8 | Q167: =(O167*6)+P167 -> 56 | S167: TWITT :GILES :DELLER
A168: BEST PLAYERS
A169: TRARALGON | C169: CUNNINGHAM | F169: HEIL | I169: G MORLEY | L169: WITHERS | O169: GARNER | R169: BURRIDGE
A170: NORTH BALLARAT | C170: COX | F170: NICHOLSON | I170: MURRIHY | L170: POLKINGHORNE | O170: SCHOLL
A171: GOALKICKERS
A172: TRARALGON | C172: STOCKDALE 5 | F172: BURRIDGE 2 | I172: ROBERTSON 2 | L172: WOLFE 2 | N172: CUNNINGHAM | Q172: GARNER | S172: SWITZER
A173: NORTH BALLARAT | C173: SCHOLL 2 | F173: QUINLAN 2 | I173: SHARP | K173: EZARD | M173: FORD | O173: BUNN
A175: SPRINGVALE | C175: 4 | D175: 0 | E175: =(C175*6)+D175 -> 24 | G175: 9 | H175: 3 | I175: =(G175*6)+H175 -> 57 | K175: 14 | L175: 7 | M175: =(K175*6)+L175 -> 91 | O175: 19 | P175: 10 | Q175: =(O175*6)+P175 -> 124 | S175: Venue: PRESTON
A176: PRESTON | C176: 1 | D176: 2 | E176: =(C176*6)+D176 -> 8 | G176: 3 | H176: 2 | I176: =(G176*6)+H176 -> 20 | K176: 4 | L176: 3 | M176: =(K176*6)+L176 -> 27 | O176: 5 | P176: 5 | Q176: =(O176*6)+P176 -> 35 | S176: RUSSO :MALCOLM :NELIS
A177: BEST PLAYERS
A178: SPRINGVALE | C178: STUBBS | F178: CAPSALIS | I178: BURGMANN | L178: DELARUE | O178: PEACOCK | R178: CLARK
A179: PRESTON | C179: DOBELL | F179: MUNRIVANA | I179: PLUNKETT | L179: McLOUGHLIN | O179: TAYLOR
A180: GOALKICKERS
A181: SPRINGVALE | C181: STUBBS 10 | F181: DELARUE 3 | I181: BALDWIN 2 | L181: LEILNORS | N181: PEACOCK | Q181: SMITH | S181: WOODMAN
A182: PRESTON | C182: PLUNKETT 2 | F182: WILSON | H182: HARMER | J182: NELSON
A184: SANDRINGHAM | C184: 6 | D184: 4 | E184: =(C184*6)+D184 -> 40 | G184: 10 | H184: 6 | I184: =(G184*6)+H184 -> 66 | K184: 15 | L184: 10 | M184: =(K184*6)+L184 -> 100 | O184: 19 | P184: 14 | Q184: =(O184*6)+P184 -> 128 | S184: Venue: BEACH ROAD
A185: WILLIAMSTOWN | C185: 3 | D185: 1 | E185: =(C185*6)+D185 -> 19 | G185: 8 | H185: 5 | I185: =(G185*6)+H185 -> 53 | K185: 11 | L185: 8 | M185: =(K185*6)+L185 -> 74 | O185: 15 | P185: 10 | Q185: =(O185*6)+P185 -> 100 | S185: SEXTON :KELSEY :MASON
A186: BEST PLAYERS
A187: SANDRINGHAM | C187: FOLEY | F187: CLARKSON | I187: CROUGH | L187: COGHLAN | O187: MURRAY | R187: SAMPIERI
A188: WILLIAMSTOWN | C188: SHANKS | F188: GHAZI | I188: B LLOYD | L188: JOHANSEN | O188: DOOLEY | R188: O'KEEFE
A189: GOALKICKERS
A190: SANDRINGHAM | C190: ALVIN 3 | E190: S SMITH 3 | G190: R MALONEY 2 | J190: SAMPIERI 2 | M190: SCOTT-BRANAGAN 2 | Q190: LLOYD 2 | S190: FOLEY 2 | V190: SNOOKS 2 | X190: KEIPERT
A191: WILLIAMSTOWN | C191: O'KEEFE 3 | E191: JORDAN 2 | G191: JOHANSEN 2 | J191: LLOYD | L191: L MAHONEY | N191: J MAHONEY | Q191: DELRE | S191: KERRY | V191: COPELAND | X191: NELSON | AA191: DOOLEY
A193: BYE | D193: WERRIBEE
A195: ROUND 5 | D195: 4TH MAY | J195: WEATHER | S195: Venue: WERRIBEE
D196: 1ST QTR | H196: 2ND QTR | L196: 3RD QTR | P196: FINAL | S196: UMPIRES | V196: DAVIDSON
A197: WERRIBEE | C197: 1 | D197: 3 | E197: =(C197*6)+D197 -> 9 | G197: 10 | H197: 3 | I197: =(G197*6)+H197 -> 63 | K197: 15 | L197: 10 | M197: =(K197*6)+L197 -> 100 | O197: 18 | P197: 13 | Q197: =(O197*6)+P197 -> 121 | S197: QUIGLEY | Z197: LADDER | AC197: ROUND | AE197: 5
A198: SANDRINGHAM | C198: 6 | D198: 3 | E198: =(C198*6)+D198 -> 39 | G198: 8 | H198: 6 | I198: =(G198*6)+H198 -> 54 | K198: 10 | L198: 6 | M198: =(K198*6)+L198 -> 66 | O198: 13 | P198: 12 | Q198: =(O198*6)+P198 -> 90 | S198: PRITCHARD
A199: BEST PLAYERS | W199: TEAM | X199: B | Y199: W | Z199: L | AA199: D | AB199: FOR | AC199: AGST | AD199: % | AE199: PTS
A200: WERRIBEE | C200: PURCELL | F200: D SAUNDERS | I200: ROACH | L200: AZIZ | O200: SATTERLEY | R200: PULI
A201: SANDRINGHAM | C201: CROUGH | F201: SCOTT-BRANAGAN | J201: COGHLAN | W201: FRANKSTON | X201: 1 | Y201: 4 | Z201: 0 | AA201: 0 | AB201: 619 | AC201: 227 | AD201: =(AB201/AC201)*100 -> 272.68722466960355 | AE201: =(Y201*4)+(AA201*2) -> 16
A202: GOALKICKERS | O202: TAYLOR | Q202: MAY | W202: SPRINGVALE | X202: 1 | Y202: 3 | Z202: 1 | AA202: 0 | AB202: 349 | AC202: 201 | AD202: =(AB202/AC202)*100 -> 173.6318407960199 | AE202: =(Y202*4)+(AA202*2) -> 12
A203: WERRIBEE | C203: AZIZ 5 | E203: SATTERLEY 3 | H203: ROACH 3 | J203: D SAUNDERS 2 | M203: MANSFIELD | P203: MITCHELL | R203: N SAUNDERS | W203: WERRIBEE | X203: 1 | Y203: 3 | Z203: 1 | AA203: 0 | AB203: 380 | AC203: 267 | AD203: =(AB203/AC203)*100 -> 142.32209737827714 | AE203: =(Y203*4)+(AA203*2) -> 12
A204: SANDRINGHAM | C204: SMITH 4 | E204: SCOTT-BRANAGAN 3 | I204: SNOOKS 2 | K204: TEMPLETON | N204: ALVIN | P204: KEIPERT | R204: FOLEY | W204: PORT MELBOURNE | X204: 1 | Y204: 3 | Z204: 1 | AA204: 0 | AB204: 454 | AC204: 364 | AD204: =(AB204/AC204)*100 -> 124.72527472527473 | AE204: =(Y204*4)+(AA204*2) -> 12
D205: 5TH MAY | J205: WEATHER | S205: Venue: BOX HILL | W205: SANDRINGHAM | X205: 1 | Y205: 3 | Z205: 1 | AA205: 0 | AB205: 392 | AC205: 380 | AD205: =(AB205/AC205)*100 -> 103.15789473684211 | AE205: =(Y205*4)+(AA205*2) -> 12
A206: BOX HILL | C206: 2 | D206: 1 | E206: =(C206*6)+D206 -> 13 | G206: 5 | H206: 3 | I206: =(G206*6)+H206 -> 33 | K206: 10 | L206: 11 | M206: =(K206*6)+L206 -> 71 | O206: 10 | P206: 13 | Q206: =(O206*6)+P206 -> 73 | S206: RUSSO
A207: PRESTON | C207: 5 | D207: 6 | E207: =(C207*6)+D207 -> 36 | G207: 6 | H207: 8 | I207: =(G207*6)+H207 -> 44 | K207: 6 | L207: 9 | M207: =(K207*6)+L207 -> 45 | O207: 9 | P207: 12 | Q207: =(O207*6)+P207 -> 66 | S207: SEXTON | W207: COBURG | Y207: 3 | Z207: 2 | AA207: 0 | AB207: 455 | AC207: 637 | AD207: =(AB207/AC207)*100 -> 71.428571428571431 | AE207: =(Y207*4)+(AA207*2) -> 12
A208: BEST PLAYERS | S208: MASON | W208: WILLIAMSTOWN | X208: 1 | Y208: 2 | Z208: 2 | AA208: 0 | AB208: 344 | AC208: 382 | AD208: =(AB208/AC208)*100 -> 90.052356020942398 | AE208: =(Y208*4)+(AA208*2) -> 8
A209: BOX HILL | C209: McNAMARA | F209: GOODALE | I209: SLATER | L209: GRIFFEN | O209: O'NEILL | Q209: COHEN | W209: NORTH BALLARAT | Y209: 1 | Z209: 4 | AA209: 0 | AB209: 338 | AC209: 461 | AD209: =(AB209/AC209)*100 -> 73.31887201735357 | AE209: =(Y209*4)+(AA209*2) -> 4
A210: PRESTON | C210: TAYLOR | F210: DOBELL | I210: BOOKER | L210: WILSON | O210: HAMER | Q210: BAYRE | W210: BOX HILL | Y210: 1 | Z210: 4 | AA210: 0 | AB210: 372 | AC210: 527 | AD210: =(AB210/AC210)*100 -> 70.588235294117652 | AE210: =(Y210*4)+(AA210*2) -> 4
A211: GOALKICKERS | W211: TRARALGON | Y211: 1 | Z211: 4 | AA211: 0 | AB211: 337 | AC211: 608 | AD211: =(AB211/AC211)*100 -> 55.42763157894737 | AE211: =(Y211*4)+(AA211*2) -> 4
A212: BOX HILL | C212: WILKINSON 4 | F212: McNAMARA 2 | I212: DOWER | K212: SLATER | M212: EDDY | N212: COHEN | W212: PRESTON | X212: 1 | Y212: 0 | Z212: 4 | AA212: 0 | AB212: 229 | AC212: 350 | AD212: =(AB212/AC212)*100 -> 65.428571428571431 | AE212: =(Y212*4)+(AA212*2) -> 0
A213: PRESTON | C213: WILSON 6 | F213: DOBELL | H213: McLOUGHLIN | K213: BLAGROVE
A215: COBURG | C215: 4 | D215: 3 | E215: =(C215*6)+D215 -> 27 | G215: 8 | H215: 9 | I215: =(G215*6)+H215 -> 57 | K215: 9 | L215: 12 | M215: =(K215*6)+L215 -> 66 | O215: 13 | P215: 17 | Q215: =(O215*6)+P215 -> 95 | S215: Venue: NORTH BALLARAT
A216: NORTH BALLARAT | C216: 4 | D216: 2 | E216: =(C216*6)+D216 -> 26 | G216: 5 | H216: 4 | I216: =(G216*6)+H216 -> 34 | K216: 8 | L216: 6 | M216: =(K216*6)+L216 -> 54 | O216: 12 | P216: 12 | Q216: =(O216*6)+P216 -> 84 | S216: NELIS :JONES :MALCOLM
A217: BEST PLAYERS
A218: COBURG | C218: STANLEY | F218: COHEN | I218: WESTON | L218: HILDEBRAND | O218: ALESSIO | R218: AITKEN
A219: NORTH BALLARAT | C219: G POLKINGHORNE | G219: NICHOLSON | J219: MURRIHY | L219: T POLKINGHORNE | O219: MARTIN
A220: GOALKICKERS
A221: COBURG | C221: ALESSIO 5 | F221: SOLOMON 3 | I221: NAPOLI 2 | K221: PORTER | M221: PIESCIK | O221: STANLEY
A222: NORTH BALLARAT | C222: EZARD 2 | E222: SCHOLL 2 | G222: SNIBSON 2 | J222: NICHOLSON | M222: MARTIN | O222: SLATER | Q222: HYNES | S222: QUINLAN | V222: HARRINGTON
A224: PORT MELBOURNE | C224: 4 | D224: 9 | E224: =(C224*6)+D224 -> 33 | G224: 12 | H224: 17 | I224: =(G224*6)+H224 -> 89 | K224: 17 | L224: 20 | M224: =(K224*6)+L224 -> 122 | O224: 22 | P224: 26 | Q224: =(O224*6)+P224 -> 158 | S224: Venue: PORT MELBOURNE
A225: TRARALGON | C225: 1 | D225: 4 | E225: =(C225*6)+D225 -> 10 | G225: 3 | H225: 6 | I225: =(G225*6)+H225 -> 24 | K225: 7 | L225: 10 | M225: =(K225*6)+L225 -> 52 | O225: 8 | P225: 16 | Q225: =(O225*6)+P225 -> 64 | S225: GOODRIDGE :KANIZAY :KELSEY
A226: BEST PLAYERS
A227: PORT MELBOURNE | C227: BERRY | F227: HOFFMAN | I227: PEKIN | L227: WHELAN | O227: KEIGHRAN | R227: M CHEEL
A228: TRARALGON | C228: SMITH | F228: JENNINGS | I228: STOCKDALE | L228: HOPKINS | O228: WITHERS
A229: GOALKICKERS
A230: PORT MELBOURNE | C230: BERRY 10 | F230: SEXTON 3 | I230: KELLY 3 | K230: PEKIN 2 | M230: M CHEEL 2 | P230: McGEE | R230: BALLANTYNE
A231: TRARALGON | C231: STOCKDALE 6 | F231: McGANNON | I231: BURRIDGE
A233: SPRINGVALE | C233: 8 | D233: 5 | E233: =(C233*6)+D233 -> 53 | G233: 11 | H233: 11 | I233: =(G233*6)+H233 -> 77 | K233: 12 | L233: 12 | M233: =(K233*6)+L233 -> 84 | O233: 14 | P233: 19 | Q233: =(O233*6)+P233 -> 103 | S233: Venue: SPRINGVALE
A234: WILLIAMSTOWN | C234: 0 | D234: 6 | E234: =(C234*6)+D234 -> 6 | G234: 1 | H234: 6 | I234: =(G234*6)+H234 -> 12 | K234: 5 | L234: 11 | M234: =(K234*6)+L234 -> 41 | O234: 5 | P234: 14 | Q234: =(O234*6)+P234 -> 44 | S234: ROWE :JAMES :ADAMS
A235: BEST PLAYERS
A236: SPRINGVALE | C236: CARROLL | F236: LITTLE | I236: PIROUET | L236: WOODMAN | O236: CLARK | R236: BALDWIN
A237: WILLIAMSTOWN | C237: LLOYD | F237: KERRY | I237: O'KEEFE | L237: SHANKS | O237: PASTORE | R237: GOULD
A238: GOALKICKERS
A239: SPRINGVALE | C239: STUBBS 5 | F239: WATSON 2 | I239: EVANS 2 | K239: DELARUE 2 | N239: DAVIDSON | Q239: YEATS | S239: LIELNORS
A240: WILLIAMSTOWN | C240: LLOYD 2 | F240: O'KEEFE 2 | I240: SHANKS
A242: BYE | D242: FRANKSTON
A244: ROUND 6 | D244: 11TH MAY | J244: WEATHER | S244: Venue: COBURG
D245: 1ST QTR | H245: 2ND QTR | L245: 3RD QTR | P245: FINAL | S245: UMPIRES | V245: PRITCHARD
A246: COBURG | C246: 5 | D246: 3 | E246: =(C246*6)+D246 -> 33 | G246: 10 | H246: 5 | I246: =(G246*6)+H246 -> 65 | K246: 12 | L246: 8 | M246: =(K246*6)+L246 -> 80 | O246: 15 | P246: 9 | Q246: =(O246*6)+P246 -> 99 | S246: KANIZAY | Z246: LADDER | AC246: ROUND | AE246: 6
A247: PRESTON | C247: 1 | D247: 4 | E247: =(C247*6)+D247 -> 10 | G247: 1 | H247: 7 | I247: =(G247*6)+H247 -> 13 | K247: 5 | L247: 12 | M247: =(K247*6)+L247 -> 42 | O247: 8 | P247: 19 | Q247: =(O247*6)+P247 -> 67 | S247: DAVIDSON
A248: BEST PLAYERS | W248: TEAM | X248: B | Y248: W | Z248: L | AA248: D | AB248: FOR | AC248: AGST | AD248: % | AE248: PTS
A249: COBURG | C249: ALESSIO | F249: WESTON | I249: NAPOLI | L249: TATE | O249: INGRAM | R249: BENJAMIN
A250: PRESTON | C250: TAYLOR | F250: MORRISSEY | I250: MILLER | L250: PLUNKETT | O250: BOOKER | R250: BLAGROVE | W250: FRANKSTON | X250: 1 | Y250: 4 | Z250: 1 | AA250: 0 | AB250: 700 | AC250: 320 | AD250: =(AB250/AC250)*100 -> 218.75 | AE250: =(Y250*4)+(AA250*2) -> 16
A251: GOALKICKERS | Q251: ZIROS | W251: SPRINGVALE | X251: 1 | Y251: 4 | Z251: 1 | AA251: 0 | AB251: 519 | AC251: 262 | AD251: =(AB251/AC251)*100 -> 198.09160305343511 | AE251: =(Y251*4)+(AA251*2) -> 16
A252: COBURG | C252: ALESSIO 6 | F252: KNIGHTS 2 | I252: SOLOMON 2 | L252: STANLEY | N252: KHEIR | P252: AITKEN | R252: NAPOLI | W252: WERRIBEE | X252: 1 | Y252: 4 | Z252: 1 | AA252: 0 | AB252: 473 | AC252: 348 | AD252: =(AB252/AC252)*100 -> 135.91954022988506 | AE252: =(Y252*4)+(AA252*2) -> 16
A253: PRESTON | C253: POWER 2 | F253: PLUNKETT | I253: TAYLOR | K253: NEILSON | M253: MAIORANA | P253: MUNRIVANA | S253: BLAGROVE | W253: PORT MELBOURNE | X253: 1 | Y253: 4 | Z253: 1 | AA253: 0 | AB253: 517 | AC253: 400 | AD253: =(AB253/AC253)*100 -> 129.25 | AE253: =(Y253*4)+(AA253*2) -> 16
D254: 12TH MAY | J254: WEATHER | S254: Venue: WERRIBEE | W254: SANDRINGHAM | X254: 1 | Y254: 4 | Z254: 1 | AA254: 0 | AB254: 487 | AC254: 438 | AD254: =(AB254/AC254)*100 -> 111.18721461187215 | AE254: =(Y254*4)+(AA254*2) -> 16
A255: WERRIBEE | C255: 3 | D255: 3 | E255: =(C255*6)+D255 -> 21 | G255: 8 | H255: 5 | I255: =(G255*6)+H255 -> 53 | K255: 13 | L255: 7 | M255: =(K255*6)+L255 -> 85 | O255: 14 | P255: 9 | Q255: =(O255*6)+P255 -> 93 | S255: MANN
A256: FRANKSTON | C256: 2 | D256: 0 | E256: =(C256*6)+D256 -> 12 | G256: 4 | H256: 4 | I256: =(G256*6)+H256 -> 28 | K256: 8 | L256: 4 | M256: =(K256*6)+L256 -> 52 | O256: 12 | P256: 9 | Q256: =(O256*6)+P256 -> 81 | S256: SEXTON | W256: COBURG | Y256: 4 | Z256: 2 | AA256: 0 | AB256: 554 | AC256: 704 | AD256: =(AB256/AC256)*100 -> 78.693181818181827 | AE256: =(Y256*4)+(AA256*2) -> 16
A257: BEST PLAYERS | S257: HEAD | W257: WILLIAMSTOWN | X257: 1 | Y257: 2 | Z257: 3 | AA257: 0 | AB257: 380 | AC257: 445 | AD257: =(AB257/AC257)*100 -> 85.393258426966284 | AE257: =(Y257*4)+(AA257*2) -> 8
A258: WERRIBEE | C258: ROACH | F258: CHURCHILL | I258: D SAUNDERS | L258: N SAUNDERS | O258: TAYLOR | Q258: AZIZ | W258: NORTH BALLARAT | X258: 1 | Y258: 1 | Z258: 4 | AA258: 0 | AB258: 338 | AC258: 461 | AD258: =(AB258/AC258)*100 -> 73.31887201735357 | AE258: =(Y258*4)+(AA258*2) -> 4
A259: FRANKSTON | C259: CLARK | F259: CHARLES | I259: A PICKERING | L259: MOORE | W259: BOX HILL | Y259: 1 | Z259: 5 | AA259: 0 | AB259: 433 | AC259: 697 | AD259: =(AB259/AC259)*100 -> 62.123385939741752 | AE259: =(Y259*4)+(AA259*2) -> 4
A260: GOALKICKERS | W260: TRARALGON | Y260: 1 | Z260: 5 | AA260: 0 | AB260: 395 | AC260: 703 | AD260: =(AB260/AC260)*100 -> 56.1877667140825 | AE260: =(Y260*4)+(AA260*2) -> 4
A261: WERRIBEE | C261: AZIZ 6 | F261: SPROULE 3 | I261: CAMILIERI 2 | L261: SHAW | N261: BUTTON | P261: PURCELL | W261: PRESTON | X261: 1 | Y261: 0 | Z261: 5 | AA261: 0 | AB261: 296 | AC261: 449 | AD261: =(AB261/AC261)*100 -> 65.924276169265028 | AE261: =(Y261*4)+(AA261*2) -> 0
A262: FRANKSTON | C262: BOWEY 2 | F262: R STUBBS 2 | I262: J PICKERING | L262: MILLANE | N262: GEORGE | P262: A PICKERING | S262: MACKAY
K263: SALIBA | M263: RHYS-JONES | P263: MEAD
A264: PORT MELBOURNE | C264: 1 | D264: 9 | E264: =(C264*6)+D264 -> 15 | G264: 2 | H264: 11 | I264: =(G264*6)+H264 -> 23 | K264: 6 | L264: 14 | M264: =(K264*6)+L264 -> 50 | O264: 8 | P264: 15 | Q264: =(O264*6)+P264 -> 63 | S264: Venue: PORT MELBOURNE
A265: WILLIAMSTOWN | C265: 0 | D265: 2 | E265: =(C265*6)+D265 -> 2 | G265: 1 | H265: 5 | I265: =(G265*6)+H265 -> 11 | K265: 2 | L265: 6 | M265: =(K265*6)+L265 -> 18 | O265: 4 | P265: 12 | Q265: =(O265*6)+P265 -> 36 | S265: VOZZO :EDWARDS :GILES
A266: BEST PLAYERS
A267: PORT MELBOURNE | C267: SEXTON | F267: HARKINS | I267: R BOWDEN | L267: DIBLASI | O267: HOLLOW | R267: WHELAN
A268: WILLIAMSTOWN | C268: WEST | F268: SHANKS | I268: HOUGH | L268: GOULD | O268: DELRE
A269: GOALKICKERS
A270: PORT MELBOURNE | C270: BERRY 5 | F270: DIBLASI | I270: JAMES | K270: CHEEL
A271: WILLIAMSTOWN | C271: O'KEEFE | F271: NICHOLSON | I271: DELRE | K271: DOOLEY
A273: SANDRINGHAM | C273: 5 | D273: 5 | E273: =(C273*6)+D273 -> 35 | G273: 7 | H273: 7 | I273: =(G273*6)+H273 -> 49 | K273: 10 | L273: 10 | M273: =(K273*6)+L273 -> 70 | O273: 14 | P273: 11 | Q273: =(O273*6)+P273 -> 95 | S273: Venue: BEACH ROAD
A274: TRARALGON | C274: 3 | D274: 2 | E274: =(C274*6)+D274 -> 20 | G274: 7 | H274: 6 | I274: =(G274*6)+H274 -> 48 | K274: 7 | L274: 8 | M274: =(K274*6)+L274 -> 50 | O274: 8 | P274: 10 | Q274: =(O274*6)+P274 -> 58 | S274: STEWART :ROWE :ADAMS
A275: BEST PLAYERS
A276: SANDRINGHAM | C276: CLARKSON | F276: CROUGH | I276: MATTHEWS | L276: FOLEY | N276: FRATER | Q276: SCOTT-BRANAGAN
A277: TRARALGON | C277: SMITH | F277: HOPKINS | I277: GARNER
A278: GOALKICKERS
A279: SANDRINGHAM | C279: SMITH 4 | F279: SCOTT-BRANAGAN 3 | J279: SNOOKS 2 | M279: KEIPERT 2 | P279: WATSON | R279: FOLEY | U279: FRATER
A280: TRARALGON | C280: STOCKDALE 3 | F280: GARNER 2 | I280: MOLONE 2 | L280: SWITZER
A282: SPRINGVALE | C282: 8 | D282: 4 | E282: =(C282*6)+D282 -> 52 | G282: 13 | H282: 8 | I282: =(G282*6)+H282 -> 86 | K282: 17 | L282: 11 | M282: =(K282*6)+L282 -> 113 | O282: 26 | P282: 14 | Q282: =(O282*6)+P282 -> 170 | S282: Venue: SPRINGVALE
A283: BOX HILL | C283: 2 | D283: 4 | E283: =(C283*6)+D283 -> 16 | G283: 5 | H283: 5 | I283: =(G283*6)+H283 -> 35 | K283: 7 | L283: 6 | M283: =(K283*6)+L283 -> 48 | O283: 9 | P283: 7 | Q283: =(O283*6)+P283 -> 61
A284: BEST PLAYERS
A285: SPRINGVALE | C285: DELARUE | F285: CAPSALIS | I285: WOODMAN | L285: BALDWIN | O285: PIROUET | R285: CARROLL
A286: BOX HILL | C286: ROWE | F286: WILKINSON | I286: COHEN
A287: GOALKICKERS
A288: SPRINGVALE | C288: BALDWIN 6 | F288: STUBBS 4 | H288: DAVISON 3 | K288: EVANS 3 | M288: LIELNORS 3 | P288: SMITH 3 | R288: LITTLE | U288: WOODMAN | X288: WATSON | AA288: DELARUE
A289: BOX HILL | C289: WILKINSON 2 | F289: DOWER 2 | I289: BICKERTON 2 | L289: SHANAHAN 2 | O289: DUANE
A291: BYE | D291: NORTH BALLARAT
A293: ROUND 7 | D293: 18TH MAY | J293: WEATHER | S293: Venue: BOX HILL
D294: 1ST QTR | H294: 2ND QTR | L294: 3RD QTR | P294: FINAL | S294: UMPIRES | V294: C ROWE
A295: BOX HILL | C295: 2 | D295: 2 | E295: =(C295*6)+D295 -> 14 | G295: 9 | H295: 5 | I295: =(G295*6)+H295 -> 59 | K295: 13 | L295: 6 | M295: =(K295*6)+L295 -> 84 | O295: 15 | P295: 7 | Q295: =(O295*6)+P295 -> 97 | S295: MANN | Z295: LADDER | AC295: ROUND | AE295: 7
A296: SANDRINGHAM | C296: 3 | D296: 3 | E296: =(C296*6)+D296 -> 21 | G296: 4 | H296: 4 | I296: =(G296*6)+H296 -> 28 | K296: 6 | L296: 6 | M296: =(K296*6)+L296 -> 42 | O296: 10 | P296: 14 | Q296: =(O296*6)+P296 -> 74 | S296: HEAD
A297: BEST PLAYERS | W297: TEAM | X297: B | Y297: W | Z297: L | AA297: D | AB297: FOR | AC297: AGST | AD297: % | AE297: PTS
A298: BOX HILL | D298: QUINN | G298: DUANE | J298: BISHOP | M298: PAYNE | O298: SLATER | Q298: D ROWE
A299: SANDRINGHAM | D299: FRATER | G299: MATTHEWS | J299: SUTTON | W299: FRANKSTON | X299: 1 | Y299: 5 | Z299: 1 | AA299: 0 | AB299: 810 | AC299: 380 | AD299: =(AB299/AC299)*100 -> 213.15789473684214 | AE299: =(Y299*4)+(AA299*2) -> 20
A300: GOALKICKERS | Q300: WILKINSON | W300: PORT MELBOURNE | X300: 1 | Y300: 5 | Z300: 1 | AA300: 0 | AB300: 639 | AC300: 504 | AD300: =(AB300/AC300)*100 -> 126.78571428571428 | AE300: =(Y300*4)+(AA300*2) -> 20
A301: BOX HILL | D301: BISHOP 5 | G301: DOWER 4 | J301: B ROWE 2 | M301: DUANE | O301: QUINN | Q301: CRISP | W301: COBURG | Y301: 5 | Z301: 2 | AA301: 0 | AB301: 671 | AC301: 817 | AD301: =(AB301/AC301)*100 -> 82.129742962056312 | AE301: =(Y301*4)+(AA301*2) -> 20
A302: SANDRINGHAM | D302: SMITH 2 | G302: SNOOKS 2 | J302: SCOTT-BRANIGAN 2 | N302: KEIPERT | P302: CLARKSON | R302: ALVIN | W302: SPRINGVALE | X302: 1 | Y302: 4 | Z302: 2 | AA302: 0 | AB302: 579 | AC302: 372 | AD302: =(AB302/AC302)*100 -> 155.64516129032256 | AE302: =(Y302*4)+(AA302*2) -> 16
D303: 19TH MAY | J303: WEATHER | O303: COUGHLAN | S303: Venue: PORT MELBOURNE | W303: WERRIBEE | X303: 1 | Y303: 4 | Z303: 2 | AA303: 0 | AB303: 586 | AC303: 465 | AD303: =(AB303/AC303)*100 -> 126.02150537634409 | AE303: =(Y303*4)+(AA303*2) -> 16
A304: PORT MELBOURNE | C304: 6 | D304: 0 | E304: =(C304*6)+D304 -> 36 | G304: 12 | H304: 6 | I304: =(G304*6)+H304 -> 78 | K304: 15 | L304: 11 | M304: =(K304*6)+L304 -> 101 | O304: 18 | P304: 14 | Q304: =(O304*6)+P304 -> 122 | S304: RUSSO
A305: NORTH BALLARAT | C305: 6 | D305: 6 | E305: =(C305*6)+D305 -> 42 | G305: 8 | H305: 7 | I305: =(G305*6)+H305 -> 55 | K305: 10 | L305: 11 | M305: =(K305*6)+L305 -> 71 | O305: 15 | P305: 14 | Q305: =(O305*6)+P305 -> 104 | S305: QUIGLEY | W305: SANDRINGHAM | X305: 1 | Y305: 4 | Z305: 2 | AA305: 0 | AB305: 561 | AC305: 535 | AD305: =(AB305/AC305)*100 -> 104.85981308411215 | AE305: =(Y305*4)+(AA305*2) -> 16
A306: BEST PLAYERS | S306: DAVIDSON | W306: WILLIAMSTOWN | X306: 1 | Y306: 3 | Z306: 3 | AA306: 0 | AB306: 522 | AC306: 555 | AD306: =(AB306/AC306)*100 -> 94.054054054054063 | AE306: =(Y306*4)+(AA306*2) -> 12
A307: PORT MELBOURNE | D307: WHELAN | G307: SEXTON | J307: HOLLOW | M307: BAILEY | O307: JAMES | R307: BALLANTYNE | W307: BOX HILL | Y307: 2 | Z307: 5 | AA307: 0 | AB307: 530 | AC307: 771 | AD307: =(AB307/AC307)*100 -> 68.741893644617377 | AE307: =(Y307*4)+(AA307*2) -> 8
A308: NORTH BALLARAT | D308: QUINLAN | G308: NICHOLSON | J308: MURPHY | L308: G POLKINGHORNE | P308: T POLKINGHORNE | T308: HOOD | W308: NORTH BALLARAT | X308: 1 | Y308: 1 | Z308: 5 | AA308: 0 | AB308: 442 | AC308: 583 | AD308: =(AB308/AC308)*100 -> 75.814751286449393 | AE308: =(Y308*4)+(AA308*2) -> 4
A309: GOALKICKERS | O309: McGEE | Q309: SHARP | W309: TRARALGON | X309: 1 | Y309: 1 | Z309: 5 | AA309: 0 | AB309: 395 | AC309: 703 | AD309: =(AB309/AC309)*100 -> 56.1877667140825 | AE309: =(Y309*4)+(AA309*2) -> 4
A310: PORT MELBOURNE | D310: BERRY 5 | G310: KERSHAW 4 | J310: JAMES 2 | L310: DI BLASI 2 | N310: PEKIN | P310: SEXTON | R310: CHEEL | W310: PRESTON | X310: 1 | Y310: 0 | Z310: 6 | AA310: 0 | AB310: 406 | AC310: 591 | AD310: =(AB310/AC310)*100 -> 68.697123519458543 | AE310: =(Y310*4)+(AA310*2) -> 0
A311: NORTH BALLARAT | D311: QUINLAN 6 | F311: BUNN 2 | H311: G POLKINGHORNE 2 | L311: NICHOLSON | O311: JENSON | Q311: MADIGAN | T311: MURPHY | W311: VENNER
A313: WILLIAMSTOWN | C313: 4 | D313: 4 | E313: =(C313*6)+D313 -> 28 | G313: 9 | H313: 6 | I313: =(G313*6)+H313 -> 60 | K313: 16 | L313: 7 | M313: =(K313*6)+L313 -> 103 | O313: 22 | P313: 10 | Q313: =(O313*6)+P313 -> 142 | S313: Venue: PRESTON
A314: PRESTON | C314: 2 | D314: 4 | E314: =(C314*6)+D314 -> 16 | G314: 8 | H314: 7 | I314: =(G314*6)+H314 -> 55 | K314: 11 | L314: 10 | M314: =(K314*6)+L314 -> 76 | O314: 16 | P314: 14 | Q314: =(O314*6)+P314 -> 110 | S314: DELLER :TWITT :STEWART
A315: BEST PLAYERS
A316: WILLIAMSTOWN | D316: DOOLEY | G316: DELRE | J316: SHANKS | M316: HOUGH | O316: GHAZI | R316: CARRICK
A317: PRESTON | D317: HAMER | G317: MAIORANA | J317: TAYLOR | M317: WILSON | O317: BOOKER
A318: GOALKICKERS
A319: WILLIAMSTOWN | D319: DELRE 9 | G319: NIELSEN 4 | J319: NICHOLSON 2 | M319: GHAZI 2 | O319: O'KEEFE 2 | Q319: JOHANSEN | T319: WEST | W319: PASTORE
A320: PRESTON | D320: HAMER 4 | G320: PLUNKETT 3 | J320: CARELLI 2 | M320: BOOKER 2 | O320: WILSON | Q320: MAIORANA | T320: DOBELL | W320: BLAGROVE | X320: TAYLOR
A322: FRANKSTON | C322: 3 | D322: 2 | E322: =(C322*6)+D322 -> 20 | G322: 7 | H322: 7 | I322: =(G322*6)+H322 -> 49 | K322: 12 | L322: 10 | M322: =(K322*6)+L322 -> 82 | O322: 16 | P322: 14 | Q322: =(O322*6)+P322 -> 110 | S322: Venue: SPRINGVALE
A323: SPRINGVALE | C323: 2 | D323: 3 | E323: =(C323*6)+D323 -> 15 | G323: 3 | H323: 5 | I323: =(G323*6)+H323 -> 23 | K323: 4 | L323: 9 | M323: =(K323*6)+L323 -> 33 | O323: 8 | P323: 12 | Q323: =(O323*6)+P323 -> 60 | S323: MALCOLM :GOODRIDGE :JAMES
A324: BEST PLAYERS
A325: FRANKSTON | D325: BOWEY | G325: CLARKE | J325: MILLANE | M325: A PICKERING | P325: ATKINSON | R325: S RYAN
A326: SPRINGVALE | D326: BURGMAN | G326: LITTLE | J326: SUTHERLAND | M326: EVANS | P326: DELARUE
A327: GOALKICKERS
A328: FRANKSTON | D328: BOWEY 5 | G328: GEORGE 3 | J328: R STUBBS 3 | M328: MEAD 2 | O328: MILLANE | Q328: ATKINSON | T328: CLARKE
A329: SPRINGVALE | D329: EVANS 2 | G329: CLARK 2 | J329: BALDWIN 2 | M329: YEATS | O329: STUBBS
A331: COBURG | C331: 4 | D331: 4 | E331: =(C331*6)+D331 -> 28 | G331: 7 | H331: 5 | I331: =(G331*6)+H331 -> 47 | K331: 10 | L331: 8 | M331: =(K331*6)+L331 -> 68 | O331: 18 | P331: 9 | Q331: =(O331*6)+P331 -> 117 | S331: Venue: WERRIBEE
A332: WERRIBEE | C332: 5 | D332: 2 | E332: =(C332*6)+D332 -> 32 | G332: 9 | H332: 2 | I332: =(G332*6)+H332 -> 56 | K332: 13 | L332: 8 | M332: =(K332*6)+L332 -> 86 | O332: 17 | P332: 11 | Q332: =(O332*6)+P332 -> 113 | S332: ADAMS :JONES :VOZZO
A333: BEST PLAYERS
A334: COBURG | C334: BAKER | F334: SALVADORE | I334: AITKEN | L334: NAPOLI | N334: KNIGHTS | Q334: PORTER
A335: WERRIBEE | C335: D TAYLOR | F335: N SAUNDERS | I335: D SAUNDERS | L335: EAMES | N335: AZIZ | Q335: MITCHELL
A336: GOALKICKERS
A337: COBURG | C337: ALESSIO 6 | F337: EVANS 2 | H337: BAKER 2 | K337: STANLEY 2 | N337: CLEEVE 2 | Q337: SOLOMON 2 | T337: SALVADORE | X337: NAPOLI
A338: WERRIBEE | C338: AZIZ 6 | E338: CHURCHILL 2 | H338: SHAW 2 | J338: N SAUNDERS 2 | N338: MANSFIELD | Q338: SPROULE | S338: PURCELL | V338: MAHONEY | X338: D SAUNDERS
A340: BYE | D340: TRARALGON
A342: ROUND 8 | D342: 25TH MAY | J342: WEATHER | S342: Venue: COBURG
D343: 1ST QTR | H343: 2ND QTR | L343: 3RD QTR | P343: FINAL | S343: UMPIRES | V343: NELIS
A344: COBURG | C344: 3 | D344: 4 | E344: =(C344*6)+D344 -> 22 | G344: 8 | H344: 5 | I344: =(G344*6)+H344 -> 53 | K344: 14 | L344: 10 | M344: =(K344*6)+L344 -> 94 | O344: 22 | P344: 14 | Q344: =(O344*6)+P344 -> 146 | S344: EDWARDS | Z344: LADDER | AC344: ROUND | AE344: 8
A345: TRARALGON | C345: 3 | D345: 4 | E345: =(C345*6)+D345 -> 22 | G345: 7 | H345: 5 | I345: =(G345*6)+H345 -> 47 | K345: 9 | L345: 5 | M345: =(K345*6)+L345 -> 59 | O345: 10 | P345: 7 | Q345: =(O345*6)+P345 -> 67 | S345: DAVIDSON
A346: BEST PLAYERS | W346: TEAM | X346: B | Y346: W | Z346: L | AA346: D | AB346: FOR | AC346: AGST | AD346: % | AE346: PTS
A347: COBURG | D347: PORTER | G347: INGRAM | J347: AITKEN | M347: AUBREY | P347: NAPOLI | R347: ALESSIO
A348: TRARALGON | D348: WOLFE | G348: SMITH | J348: HOPKINS | M348: JENNINGS | P348: FOSTER | R348: BURRIDGE | W348: FRANKSTON | X348: 1 | Y348: 6 | Z348: 1 | AA348: 0 | AB348: 931 | AC348: 463 | AD348: =(AB348/AC348)*100 -> 201.07991360691148 | AE348: =(Y348*4)+(AA348*2) -> 24
A349: GOALKICKERS | N349: SOLOMON | P349: AITKEN | R349: KHEIR | W349: COBURG | Y349: 6 | Z349: 2 | AA349: 0 | AB349: 817 | AC349: 884 | AD349: =(AB349/AC349)*100 -> 92.420814479638011 | AE349: =(Y349*4)+(AA349*2) -> 24
A350: COBURG | D350: ALESSIO 7 | F350: ZIROS 4 | H350: BAKER 2 | J350: TARANTO 2 | M350: STANLEY | O350: CERINI | Q350: EVANS | S350: AUBREY | W350: WERRIBEE | X350: 1 | Y350: 5 | Z350: 2 | AA350: 0 | AB350: 692 | AC350: 545 | AD350: =(AB350/AC350)*100 -> 126.97247706422019 | AE350: =(Y350*4)+(AA350*2) -> 20
A351: TRARALGON | D351: STOCKDALE 4 | G351: VINCENT 2 | J351: FORYS | L351: JENNINGS | N351: McGANNON | Q351: SHERRIF | W351: PORT MELBOURNE | X351: 1 | Y351: 5 | Z351: 2 | AA351: 0 | AB351: 719 | AC351: 610 | AD351: =(AB351/AC351)*100 -> 117.8688524590164 | AE351: =(Y351*4)+(AA351*2) -> 20
D352: 26TH MAY | J352: WEATHER | S352: Venue: FRANKSTON | W352: SANDRINGHAM | X352: 1 | Y352: 5 | Z352: 2 | AA352: 0 | AB352: 656 | AC352: 605 | AD352: =(AB352/AC352)*100 -> 108.4297520661157 | AE352: =(Y352*4)+(AA352*2) -> 20
A353: FRANKSTON | C353: 5 | D353: 7 | E353: =(C353*6)+D353 -> 37 | G353: 5 | H353: 13 | I353: =(G353*6)+H353 -> 43 | K353: 9 | L353: 18 | M353: =(K353*6)+L353 -> 72 | O353: 17 | P353: 19 | Q353: =(O353*6)+P353 -> 121 | S353: KANIZAY
A354: WILLIAMSTOWN | C354: 2 | D354: 3 | E354: =(C354*6)+D354 -> 15 | G354: 7 | H354: 5 | I354: =(G354*6)+H354 -> 47 | K354: 10 | L354: 8 | M354: =(K354*6)+L354 -> 68 | O354: 12 | P354: 11 | Q354: =(O354*6)+P354 -> 83 | S354: GILES | W354: SPRINGVALE | X354: 1 | Y354: 4 | Z354: 3 | AA354: 0 | AB354: 649 | AC354: 467 | AD354: =(AB354/AC354)*100 -> 138.97216274089936 | AE354: =(Y354*4)+(AA354*2) -> 16
A355: BEST PLAYERS | S355: PRITCHARD | W355: WILLIAMSTOWN | X355: 1 | Y355: 3 | Z355: 4 | AA355: 0 | AB355: 605 | AC355: 676 | AD355: =(AB355/AC355)*100 -> 89.497041420118336 | AE355: =(Y355*4)+(AA355*2) -> 12
A356: FRANKSTON | D356: A PICKERING | G356: R STUBBS | J356: HOPGOOD | M356: CHARLES | O356: CLARKE | Q356: J PICKERING | W356: NORTH BALLARAT | X356: 1 | Y356: 2 | Z356: 5 | AA356: 0 | AB356: 544 | AC356: 625 | AD356: =(AB356/AC356)*100 -> 87.04 | AE356: =(Y356*4)+(AA356*2) -> 8
A357: WILLIAMSTOWN | D357: KERRY | G357: NICHOLSON | J357: SHANKS | M357: GOULD | O357: GHAZI | Q357: HORE | W357: BOX HILL | X357: 1 | Y357: 2 | Z357: 5 | AA357: 0 | AB357: 530 | AC357: 771 | AD357: =(AB357/AC357)*100 -> 68.741893644617377 | AE357: =(Y357*4)+(AA357*2) -> 8
A358: GOALKICKERS | W358: TRARALGON | X358: 1 | Y358: 1 | Z358: 6 | AA358: 0 | AB358: 462 | AC358: 849 | AD358: =(AB358/AC358)*100 -> 54.416961130742045 | AE358: =(Y358*4)+(AA358*2) -> 4
A359: FRANKSTON | D359: R STUBBS 5 | G359: BOWEY 4 | I359: McKAY 3 | K359: WEBB 2 | M359: GEORGE | O359: ATKINSON | R359: BURNELL | W359: PRESTON | X359: 1 | Y359: 0 | Z359: 7 | AA359: 0 | AB359: 448 | AC359: 693 | AD359: =(AB359/AC359)*100 -> 64.646464646464651 | AE359: =(Y359*4)+(AA359*2) -> 0
A360: WILLIAMSTOWN | D360: GHAZI 4 | F360: NIELSON 3 | I360: SHANKS | K360: O'KEEFE | M360: JOHANSEN | P360: DELRE | R360: L MAHONEY
A362: NORTH BALLARAT | C362: 5 | D362: 4 | E362: =(C362*6)+D362 -> 34 | G362: 7 | H362: 7 | I362: =(G362*6)+H362 -> 49 | K362: 12 | L362: 10 | M362: =(K362*6)+L362 -> 82 | O362: 15 | P362: 12 | Q362: =(O362*6)+P362 -> 102 | S362: Venue: NORTH BALLARAT
A363: PRESTON | C363: 0 | D363: 2 | E363: =(C363*6)+D363 -> 2 | G363: 2 | H363: 5 | I363: =(G363*6)+H363 -> 17 | K363: 3 | L363: 8 | M363: =(K363*6)+L363 -> 26 | O363: 5 | P363: 12 | Q363: =(O363*6)+P363 -> 42 | S363: SHEARER :GOODRIDGE :BEARD
A364: BEST PLAYERS
A365: NORTH BALLARAT | D365: COX | F365: T POLKINGHORNE | J365: SHOLL | L365: BUNN | N365: FORD | P365: HOLLOWAY
A366: PRESTON | D366: DOBELL | F366: POWER | I366: HARDENBERG | L366: MORRISEY | N366: LUCAS
A367: GOALKICKERS
A368: NORTH BALLARAT | D368: JENSEN 3 | G368: MURRIHY 3 | J368: QUINLAN 2 | M368: NICHOLSON 2 | P368: HARRINGTON 2 | T368: EZARD | W368: SNIBSON | X368: BUNN
A369: PRESTON | D369: BLAGROVE 2 | G369: MAIORANA | J369: MUNRIVANA | M369: WILSON
A371: SANDRINGHAM | C371: 1 | D371: 3 | E371: =(C371*6)+D371 -> 9 | G371: 6 | H371: 9 | I371: =(G371*6)+H371 -> 45 | K371: 10 | L371: 15 | M371: =(K371*6)+L371 -> 75 | O371: 13 | P371: 17 | Q371: =(O371*6)+P371 -> 95 | S371: Venue: BEACH ROAD
A372: SPRINGVALE | C372: 3 | D372: 3 | E372: =(C372*6)+D372 -> 21 | G372: 6 | H372: 4 | I372: =(G372*6)+H372 -> 40 | K372: 8 | L372: 7 | M372: =(K372*6)+L372 -> 55 | O372: 10 | P372: 10 | Q372: =(O372*6)+P372 -> 70 | S372: VOZZO :DELLER :KELSEY
A373: BEST PLAYERS
A374: SANDRINGHAM | D374: OAKLEY | G374: COGHLAN | J374: CLARKSON | M374: FOLEY | O374: CROUGH | R374: ALLEN
A375: SPRINGVALE | D375: LITTLE | G375: SUTHERLAND | J375: PEACOCK | M375: CAPSALIS
A376: GOALKICKERS
A377: SANDRINGHAM | D377: S SMITH 5 | G377: ALLEN 3 | J377: SCOTT-BRANIGAN 2 | N377: GARBUIO | P377: CLARKSON | R377: SNOOKS
A378: SPRINGVALE | D378: CLARK 2 | F378: BALDWIN | I378: EVANS | K378: LITTLE | M378: JEFFREY | O378: DELARUE | Q378: WOODMAN | T378: CAPSALIS | X378: CARROLL
A380: WERRIBEE | C380: 4 | D380: 4 | E380: =(C380*6)+D380 -> 28 | G380: 8 | H380: 6 | I380: =(G380*6)+H380 -> 54 | K380: 12 | L380: 7 | M380: =(K380*6)+L380 -> 79 | O380: 16 | P380: 10 | Q380: =(O380*6)+P380 -> 106 | S380: Venue: WERRIBEE
A381: PORT MELBOURNE | C381: 3 | D381: 2 | E381: =(C381*6)+D381 -> 20 | G381: 6 | H381: 8 | I381: =(G381*6)+H381 -> 44 | K381: 10 | L381: 10 | M381: =(K381*6)+L381 -> 70 | O381: 11 | P381: 14 | Q381: =(O381*6)+P381 -> 80 | S381: MALCOLM ;SEXTON ;MASON
A382: BEST PLAYERS
A383: WERRIBEE | D383: D SAUNDERS | G383: D TAYLOR | J383: CAMILLIERI | M383: SPROULE | O383: AZIZ | R383: EAMES
A384: PORT MELBOURNE | D384: HOLLOW | G384: BALLANTYNE | J384: GILMORE | M384: McGEE | O384: HARKINS | R384: THOMPSON
A385: GOALKICKERS
A386: WERRIBEE | D386: AZIZ 6 | G386: SPROULE 2 | J386: SATTERLEY 2 | M386: N SAUNDERS 2 | P386: MITCHELL | R386: MANSFIELD | V386: EAMES | X386: CAMILLIERI
A387: PORT MELBOURNE | D387: BERRY 6 | G387: BOWDEN | J387: BALLANTYNE | M387: BAILEY | O387: KERSHAW | R387: THOMPSON
A389: BYE | D389: BOX HILL
A391: ROUND 9 | D391: 8TH JUNE | J391: WEATHER | S391: Venue: PRESTON
D392: 1ST QTR | H392: 2ND QTR | L392: 3RD QTR | P392: FINAL | S392: UMPIRES | V392: DELLER
A393: FRANKSTON | C393: 4 | D393: 5 | E393: =(C393*6)+D393 -> 29 | G393: 9 | H393: 7 | I393: =(G393*6)+H393 -> 61 | K393: 12 | L393: 14 | M393: =(K393*6)+L393 -> 86 | O393: 13 | P393: 15 | Q393: =(O393*6)+P393 -> 93 | S393: ROWE | Z393: LADDER | AC393: ROUND | AE393: 9
A394: PRESTON | C394: 2 | D394: 3 | E394: =(C394*6)+D394 -> 15 | G394: 4 | H394: 4 | I394: =(G394*6)+H394 -> 28 | K394: 5 | L394: 5 | M394: =(K394*6)+L394 -> 35 | O394: 10 | P394: 6 | Q394: =(O394*6)+P394 -> 66 | S394: KELSEY
A395: BEST PLAYERS | W395: TEAM | X395: B | Y395: W | Z395: L | AA395: D | AB395: FOR | AC395: AGST | AD395: % | AE395: PTS
A396: FRANKSTON | D396: HOPGOOD | G396: ATKINSON | J396: MILLANE
A397: PRESTON | D397: MAIORANA | G397: TAYLOR | J397: POWER | M397: CARELLI | P397: BLAGROVE | S397: PLUNKETT | W397: FRANKSTON | X397: 1 | Y397: 7 | Z397: 1 | AA397: 0 | AB397: 1024 | AC397: 529 | AD397: =(AB397/AC397)*100 -> 193.57277882797732 | AE397: =(Y397*4)+(AA397*2) -> 28
A398: GOALKICKERS | P398: D TAYLOR | W398: PORT MELBOURNE | X398: 1 | Y398: 6 | Z398: 2 | AA398: 0 | AB398: 841 | AC398: 689 | AD398: =(AB398/AC398)*100 -> 122.06095791001452 | AE398: =(Y398*4)+(AA398*2) -> 24
A399: FRANKSTON | D399: McKAY 4 | F399: MILLANE 2 | I399: ATKINSON | K399: STUBBS | M399: PICKERING | O399: BOWEY | Q399: CLARKE | S399: WEBB | W399: COBURG | X399: 1 | Y399: 6 | Z399: 2 | AA399: 0 | AB399: 817 | AC399: 884 | AD399: =(AB399/AC399)*100 -> 92.420814479638011 | AE399: =(Y399*4)+(AA399*2) -> 24
A400: PRESTON | D400: ECCLES 2 | G400: McLOUGHLIN 2 | J400: BOOKER 2 | M400: CARELLI | O400: BYRNE | Q400: BLAGROVE | W400: SPRINGVALE | X400: 1 | Y400: 5 | Z400: 3 | AA400: 0 | AB400: 739 | AC400: 552 | AD400: =(AB400/AC400)*100 -> 133.87681159420291 | AE400: =(Y400*4)+(AA400*2) -> 20
D401: 9TH JUNE | J401: WEATHER | N401: MAIORANA | W401: WERRIBEE | X401: 1 | Y401: 5 | Z401: 3 | AA401: 0 | AB401: 777 | AC401: 635 | AD401: =(AB401/AC401)*100 -> 122.36220472440944 | AE401: =(Y401*4)+(AA401*2) -> 20
A402: SPRINGVALE | C402: 3 | D402: 4 | E402: =(C402*6)+D402 -> 22 | G402: 7 | H402: 6 | I402: =(G402*6)+H402 -> 48 | K402: 9 | L402: 11 | M402: =(K402*6)+L402 -> 65 | O402: 13 | P402: 12 | Q402: =(O402*6)+P402 -> 90 | S402: Venue: SPRINGVALE
A403: WERRIBEE | C403: 3 | D403: 1 | E403: =(C403*6)+D403 -> 19 | G403: 8 | H403: 3 | I403: =(G403*6)+H403 -> 51 | K403: 11 | L403: 5 | M403: =(K403*6)+L403 -> 71 | O403: 13 | P403: 7 | Q403: =(O403*6)+P403 -> 85 | W403: SANDRINGHAM | X403: 1 | Y403: 5 | Z403: 3 | AA403: 0 | AB403: 735 | AC403: 727 | AD403: =(AB403/AC403)*100 -> 101.10041265474553 | AE403: =(Y403*4)+(AA403*2) -> 20
A404: BEST PLAYERS | W404: WILLIAMSTOWN | X404: 1 | Y404: 4 | Z404: 4 | AA404: 0 | AB404: 709 | AC404: 778 | AD404: =(AB404/AC404)*100 -> 91.131105398457578 | AE404: =(Y404*4)+(AA404*2) -> 16
A405: SPRINGVALE | D405: CLARK | G405: EVANS | J405: BURGMAN | M405: D CARROLL | P405: DELARUE | S405: TAYLOR | W405: BOX HILL | X405: 1 | Y405: 3 | Z405: 5 | AA405: 0 | AB405: 673 | AC405: 885 | AD405: =(AB405/AC405)*100 -> 76.045197740112997 | AE405: =(Y405*4)+(AA405*2) -> 12
A406: WERRIBEE | D406: D SAUNDERS | G406: N SAUNDERS | J406: MITCHELL | M406: SATTERLEY | P406: D TAYLOR | W406: NORTH BALLARAT | X406: 1 | Y406: 2 | Z406: 6 | AA406: 0 | AB406: 646 | AC406: 729 | AD406: =(AB406/AC406)*100 -> 88.614540466392327 | AE406: =(Y406*4)+(AA406*2) -> 8
A407: GOALKICKERS | W407: TRARALGON | X407: 1 | Y407: 1 | Z407: 7 | AA407: 0 | AB407: 576 | AC407: 992 | AD407: =(AB407/AC407)*100 -> 58.064516129032263 | AE407: =(Y407*4)+(AA407*2) -> 4
A408: SPRINGVALE | D408: STUBBS 4 | G408: TAYLOR 3 | J408: EVANS 2 | M408: WOODMAN 2 | P408: D CARROLL | S408: YEATS | W408: PRESTON | X408: 1 | Y408: 0 | Z408: 8 | AA408: 0 | AB408: 514 | AC408: 786 | AD408: =(AB408/AC408)*100 -> 65.394402035623415 | AE408: =(Y408*4)+(AA408*2) -> 0
A409: WERRIBEE | D409: AZIZ 3 | F409: D SAUNDERS 2 | J409: CAMILLIERI | M409: SPROULE | O409: CHURCHILL | R409: SHAW
L410: PURCELL | N410: ROACH | Q410: MITCHELL | T410: MALONEY
A411: BOX HILL | C411: 6 | D411: 7 | E411: =(C411*6)+D411 -> 43 | G411: 12 | H411: 11 | I411: =(G411*6)+H411 -> 83 | K411: 15 | L411: 18 | M411: =(K411*6)+L411 -> 108 | O411: 21 | P411: 17 | Q411: =(O411*6)+P411 -> 143 | S411: Venue: TRARALGON
A412: TRARALGON | C412: 1 | D412: 3 | E412: =(C412*6)+D412 -> 9 | G412: 3 | H412: 7 | I412: =(G412*6)+H412 -> 25 | K412: 9 | L412: 9 | M412: =(K412*6)+L412 -> 63 | O412: 17 | P412: 12 | Q412: =(O412*6)+P412 -> 114 | S412: VOZZO
A413: BEST PLAYERS
A414: BOX HILL | D414: WILKINSON | G414: PAYNE | J414: DUANE | M414: SLATER | O414: GRIFFEN | R414: GREIG
A415: TRARALGON | D415: WOLFE | G415: JENNINGS | J415: GARNER | M415: MORLEY | O415: SWITZER | R415: RAYNER
A416: GOALKICKERS
A417: BOX HILL | D417: WILKINSON 5 | G417: DOWER 5 | I417: B ROWE 4 | L417: D ROWE 2 | N417: A SHANAHAN 2 | R417: JENKINS | V417: BOURKE | X417: DUANE
A418: TRARALGON | D418: McCULLOCH 4 | G418: VINCENT 2 | I418: JENNINGS 2 | L418: SWITZER 2 | O418: GARNER | Q418: HAYWARD | U418: MORLEY | W418: RAYNER | X418: SMITH | AA418: WOLFE | AC418: SHERRIFF
A420: PORT MELBOURNE | C420: 3 | D420: 3 | E420: =(C420*6)+D420 -> 21 | G420: 7 | H420: 9 | I420: =(G420*6)+H420 -> 51 | K420: 12 | L420: 11 | M420: =(K420*6)+L420 -> 83 | O420: 18 | P420: 14 | Q420: =(O420*6)+P420 -> 122 | S420: Venue: PORT MELBOURNE
A421: SANDRINGHAM | C421: 3 | D421: 1 | E421: =(C421*6)+D421 -> 19 | G421: 6 | H421: 6 | I421: =(G421*6)+H421 -> 42 | K421: 8 | L421: 8 | M421: =(K421*6)+L421 -> 56 | O421: 11 | P421: 13 | Q421: =(O421*6)+P421 -> 79 | S421: JONES :SHEARER :ADAMS
A422: BEST PLAYERS
A423: PORT MELBOURNE | D423: R BOWDEN | G423: KERSHAW | J423: WHELAN | L423: HOFFMAN | O423: McGEE | R423: GILMORE
A424: SANDRINGHAM | D424: SMITH | G424: SCOTT-BRANIGAN | K424: ALLEN
A425: GOALKICKERS
A426: PORT MELBOURNE | D426: KERSHAW 7 | G426: HOFFMAN 3 | J426: R BOWDEN | M426: K BOWDEN | O426: JAMES | Q426: SEXTON | S426: CHEEL | V426: HOPE | X426: HARKINS | AA426: REID
A427: SANDRINGHAM | D427: SMITH 6 | G427: ALLEN 2 | J427: SNOOKS 2 | M427: OAKLEY
A429: WILLIAMSTOWN | C429: 5 | D429: 3 | E429: =(C429*6)+D429 -> 33 | G429: 10 | H429: 7 | I429: =(G429*6)+H429 -> 67 | K429: 13 | L429: 8 | M429: =(K429*6)+L429 -> 86 | O429: 15 | P429: 14 | Q429: =(O429*6)+P429 -> 104 | S429: Venue: WILLIAMSTOWN
A430: NORTH BALLARAT | C430: 5 | D430: 1 | E430: =(C430*6)+D430 -> 31 | G430: 7 | H430: 5 | I430: =(G430*6)+H430 -> 47 | K430: 11 | L430: 5 | M430: =(K430*6)+L430 -> 71 | O430: 16 | P430: 6 | Q430: =(O430*6)+P430 -> 102 | S430: MALCOLM :SEXTON :QUIGLEY
A431: BEST PLAYERS
A432: WILLIAMSTOWN | D432: KERRY | G432: HORE | J432: WEST | L432: DELRE | O432: GOULD | R432: J MAHONEY
A433: NORTH BALLARAT | D433: SNIBSON | G433: G POLKINGHORNE | K433: BUNN | M433: NICHOLSON | P433: DISNEY | R433: SHOLL
A434: GOALKICKERS
A435: WILLIAMSTOWN | D435: DELRE 3 | G435: JOHANSEN 3 | J435: O'KEEFE 3 | M435: NIELSEN 2 | P435: SHANKS | R435: FRASER | U435: DOOLEY | X435: GHAZI
A436: NORTH BALLARAT | D436: SHOLL 5 | G436: JENSEN 4 | I436: NICHOLSON 3 | L436: QUINLAN | N436: MARKHAM | Q436: EZARD | S436: HARRINGTON
A438: BYE | D438: COBURG
A440: ROUND 10 | D440: 15TH JUNE | J440: WEATHER | S440: Venue: FRANKSTON
D441: 1ST QTR | H441: 2ND QTR | L441: 3RD QTR | P441: FINAL | S441: UMPIRES | V441: BEARD
A442: FRANKSTON | C442: 1 | D442: 4 | E442: =(C442*6)+D442 -> 10 | G442: 7 | H442: 8 | I442: =(G442*6)+H442 -> 50 | K442: 14 | L442: 12 | M442: =(K442*6)+L442 -> 96 | O442: 20 | P442: 14 | Q442: =(O442*6)+P442 -> 134 | S442: SEXTON | Z442: LADDER | AC442: ROUND | AE442: 10
A443: SANDRINGHAM | C443: 3 | D443: 3 | E443: =(C443*6)+D443 -> 21 | G443: 4 | H443: 3 | I443: =(G443*6)+H443 -> 27 | K443: 8 | L443: 3 | M443: =(K443*6)+L443 -> 51 | O443: 10 | P443: 6 | Q443: =(O443*6)+P443 -> 66 | S443: MALCOLM
A444: BEST PLAYERS | W444: TEAM | X444: B | Y444: W | Z444: L | AA444: D | AB444: FOR | AC444: AGST | AD444: % | AE444: PTS
A445: FRANKSTON | D445: MILLANE | G445: A PICKERING | J445: HOPGOOD | M445: DAN CLARKE | P445: DAM CLARKE | S445: MEAD
A446: SANDRINGHAM | D446: S SMITH | G446: M SMITH | J446: CROUGH | W446: FRANKSTON | X446: 1 | Y446: 8 | Z446: 1 | AA446: 0 | AB446: 1158 | AC446: 595 | AD446: =(AB446/AC446)*100 -> 194.62184873949579 | AE446: =(Y446*4)+(AA446*2) -> 32
A447: GOALKICKERS | K447: McKAY 2 | M447: D TAYLOR | P447: BURNELL | R447: ATKINSON | W447: SPRINGVALE | X447: 1 | Y447: 6 | Z447: 3 | AA447: 0 | AB447: 864 | AC447: 615 | AD447: =(AB447/AC447)*100 -> 140.48780487804876 | AE447: =(Y447*4)+(AA447*2) -> 24
A448: FRANKSTON | D448: MEAD 3 | F448: L TAYLOR 3 | I448: A PICKERING 3 | L448: MILLANE 2 | N448: R STUBBS 2 | Q448: DAN CLARKE 2 | W448: WERRIBEE | X448: 1 | Y448: 6 | Z448: 3 | AA448: 0 | AB448: 909 | AC448: 686 | AD448: =(AB448/AC448)*100 -> 132.50728862973762 | AE448: =(Y448*4)+(AA448*2) -> 24
A449: SANDRINGHAM | D449: S SMITH 6 | G449: M SMITH | J449: SCOTT-BRANIGAN | N449: FOLEY | P449: LLOYD | W449: PORT MELBOURNE | X449: 2 | Y449: 6 | Z449: 2 | AA449: 0 | AB449: 841 | AC449: 689 | AD449: =(AB449/AC449)*100 -> 122.06095791001452 | AE449: =(Y449*4)+(AA449*2) -> 24
D450: 16TH JUNE | J450: WEATHER | S450: Venue: BOX HILL | W450: COBURG | X450: 1 | Y450: 6 | Z450: 3 | AA450: 0 | AB450: 880 | AC450: 1009 | AD450: =(AB450/AC450)*100 -> 87.215064420218042 | AE450: =(Y450*4)+(AA450*2) -> 24
A451: WILLIAMSTOWN | C451: 6 | D451: 3 | E451: =(C451*6)+D451 -> 39 | G451: 9 | H451: 5 | I451: =(G451*6)+H451 -> 59 | K451: 12 | L451: 10 | M451: =(K451*6)+L451 -> 82 | O451: 17 | P451: 17 | Q451: =(O451*6)+P451 -> 119 | S451: JAMES
A452: BOX HILL | C452: 2 | D452: 4 | E452: =(C452*6)+D452 -> 16 | G452: 6 | H452: 13 | I452: =(G452*6)+H452 -> 49 | K452: 9 | L452: 17 | M452: =(K452*6)+L452 -> 71 | O452: 13 | P452: 23 | Q452: =(O452*6)+P452 -> 101 | S452: SHEARER | W452: WILLIAMSTOWN | X452: 1 | Y452: 5 | Z452: 4 | AA452: 0 | AB452: 828 | AC452: 879 | AD452: =(AB452/AC452)*100 -> 94.197952218430032 | AE452: =(Y452*4)+(AA452*2) -> 20
A453: BEST PLAYERS | S453: KELSEY | W453: SANDRINGHAM | X453: 1 | Y453: 5 | Z453: 4 | AA453: 0 | AB453: 801 | AC453: 861 | AD453: =(AB453/AC453)*100 -> 93.031358885017426 | AE453: =(Y453*4)+(AA453*2) -> 20
A454: WILLIAMSTOWN | D454: JOHANSEN | G454: CARRICK | J454: GHAZI | M454: PASTORE | P454: SHANKS | S454: DOOLEY | W454: BOX HILL | X454: 1 | Y454: 3 | Z454: 6 | AA454: 0 | AB454: 774 | AC454: 1004 | AD454: =(AB454/AC454)*100 -> 77.091633466135463 | AE454: =(Y454*4)+(AA454*2) -> 12
A455: BOX HILL | D455: GREIG | G455: BREWER | J455: GRIFFEN | W455: NORTH BALLARAT | X455: 1 | Y455: 2 | Z455: 7 | AA455: 0 | AB455: 697 | AC455: 861 | AD455: =(AB455/AC455)*100 -> 80.952380952380949 | AE455: =(Y455*4)+(AA455*2) -> 8
A456: GOALKICKERS | O456: CARRICK | Q456: HOUGH | S456: NIELSEN | W456: PRESTON | X456: 1 | Y456: 1 | Z456: 8 | AA456: 0 | AB456: 690 | AC456: 866 | AD456: =(AB456/AC456)*100 -> 79.676674364896073 | AE456: =(Y456*4)+(AA456*2) -> 4
A457: WILLIAMSTOWN | D457: JOHANSEN 4 | G457: PASTORE 3 | J457: FRASER 2 | M457: GHAZI 2 | O457: DOOLEY 2 | R457: LLOYD | W457: TRARALGON | X457: 1 | Y457: 1 | Z457: 8 | AA457: 0 | AB457: 656 | AC457: 1168 | AD457: =(AB457/AC457)*100 -> 56.164383561643838 | AE457: =(Y457*4)+(AA457*2) -> 4
A458: BOX HILL | D458: DOWER 4 | G458: EDDY 2 | J458: WILKINSON 2 | M458: BREWER 2 | O458: LIVINGSTONE | R458: BOURKE
Q459: HEANEY
A460: SPRINGVALE | C460: 4 | D460: 7 | E460: =(C460*6)+D460 -> 31 | G460: 11 | H460: 8 | I460: =(G460*6)+H460 -> 74 | K460: 13 | L460: 15 | M460: =(K460*6)+L460 -> 93 | O460: 18 | P460: 17 | Q460: =(O460*6)+P460 -> 125 | S460: Venue: COBURG
A461: COBURG | C461: 3 | D461: 4 | E461: =(C461*6)+D461 -> 22 | G461: 5 | H461: 7 | I461: =(G461*6)+H461 -> 37 | K461: 6 | L461: 12 | M461: =(K461*6)+L461 -> 48 | O461: 8 | P461: 15 | Q461: =(O461*6)+P461 -> 63 | S461: PRITCHARD :GOODRIDGE :STEWART
A462: BEST PLAYERS
A463: SPRINGVALE | D463: BURGMAN | G463: J CARROLL | J463: EVANS | M463: D CARROLL | P463: LITTLE | S463: YEATS
A464: COBURG | D464: INGRAM | G464: NAPOLI | J464: STANLEY | M464: TATE | P464: G BAKER | S464: EVANS
A465: GOALKICKERS
A466: SPRINGVALE | D466: STUBBS 3 | G466: EVANS 3 | J466: CAPSALIS 3 | M466: COURTNEY 2 | P466: D CARROLL 2 | S466: CAPLES | V466: WOODMAN | X466: WATSON | AA466: CLARK | AC466: DELARUE
A467: COBURG | D467: G BAKER 3 | G467: STANLEY | J467: TATE | L467: NAPOLI | N467: KNIGHTS | P467: ALESSIO
A469: WERRIBEE | C469: 3 | D469: 4 | E469: =(C469*6)+D469 -> 22 | G469: 9 | H469: 8 | I469: =(G469*6)+H469 -> 62 | K469: 13 | L469: 10 | M469: =(K469*6)+L469 -> 88 | O469: 20 | P469: 12 | Q469: =(O469*6)+P469 -> 132 | S469: Venue: NORTH BALLARAT
A470: NORTH BALLARAT | C470: 1 | D470: 7 | E470: =(C470*6)+D470 -> 13 | G470: 1 | H470: 7 | I470: =(G470*6)+H470 -> 13 | K470: 5 | L470: 8 | M470: =(K470*6)+L470 -> 38 | O470: 7 | P470: 9 | Q470: =(O470*6)+P470 -> 51 | S470: DAVIDSON :ROWE :KANIZAY
A471: BEST PLAYERS
A472: WERRIBEE | D472: AZIZ | G472: SPROULE | J472: MURPHY | M472: CAMILLIERI | P472: MANSFIELD | S472: EDWARDS
A473: NORTH BALLARAT | D473: COX | F473: T POLKINGHORNE | J473: BUNN | M473: EZARD
A474: GOALKICKERS
A475: WERRIBEE | D475: AZIZ 10 | G475: EAMES 2 | J475: SATTERLEY 2 | M475: MANSFIELD 2 | P475: EDWARDS | R475: CHURCHILL | V475: D SAUNDERS | X475: WRIGHT
A476: NORTH BALLARAT | D476: COX 3 | G476: NICHOLSON | J476: EZARD | L476: BUNN | N476: SHOLL
A478: PRESTON | C478: 5 | D478: 2 | E478: =(C478*6)+D478 -> 32 | G478: 13 | H478: 6 | I478: =(G478*6)+H478 -> 84 | K478: 22 | L478: 9 | M478: =(K478*6)+L478 -> 141 | O478: 27 | P478: 14 | Q478: =(O478*6)+P478 -> 176 | S478: Venue: PRESTON
A479: TRARALGON | C479: 2 | D479: 2 | E479: =(C479*6)+D479 -> 14 | G479: 2 | H479: 4 | I479: =(G479*6)+H479 -> 16 | K479: 9 | L479: 7 | M479: =(K479*6)+L479 -> 61 | O479: 12 | P479: 8 | Q479: =(O479*6)+P479 -> 80 | S479: ADAMS :QUIGLEY :TWITT
A480: BEST PLAYERS
A481: PRESTON | D481: BOOKER | G481: POWER | J481: BLAGROVE | M481: BAYRE | P481: MORRISEY | S481: M AIELLO
A482: TRARALGON | D482: CAMERON | G482: MORLEY | J482: JENNINGS | M482: McGANNON | P482: HOPKINS | S482: WOLFE
A483: GOALKICKERS
A484: PRESTON | D484: BLAGROVE 7 | G484: BAYRE 6 | I484: BOOKER 5 | L484: HAMER 3 | N484: CARELLI 2 | Q484: WILSON 2 | T484: MUNRIVANA | X484: McLOUGHLIN
A485: TRARALGON | D485: HOPKINS 3 | G485: CUNNINGHAM 2 | J485: MORLEY 2 | M485: BURRIDGE | O485: McCULLOCH | R485: McGANNON | V485: WOLFE | X485: VINCENT
A487: BYE | D487: PORT MELBOURNE
A489: ROUND 11 | D489: 22ND JUNE | J489: WEATHER | S489: Venue: PORT MELBOURNE
D490: 1ST QTR | H490: 2ND QTR | L490: 3RD QTR | P490: FINAL | S490: UMPIRES | V490: GOODRIDGE
A491: FRANKSTON | C491: 6 | D491: 0 | E491: =(C491*6)+D491 -> 36 | G491: 7 | H491: 2 | I491: =(G491*6)+H491 -> 44 | K491: 12 | L491: 4 | M491: 76 | O491: 16 | P491: 6 | Q491: =(O491*6)+P491 -> 102 | S491: DELLER | Z491: LADDER | AC491: ROUND | AE491: 11
A492: PORT MELBOURNE | C492: 0 | D492: 3 | E492: =(C492*6)+D492 -> 3 | G492: 0 | H492: 5 | I492: =(G492*6)+H492 -> 5 | K492: 3 | L492: 7 | M492: =(K492*6)+L492 -> 25 | O492: 5 | P492: 9 | Q492: =(O492*6)+P492 -> 39 | S492: JAMES
A493: BEST PLAYERS | W493: TEAM | X493: B | Y493: W | Z493: L | AA493: D | AB493: FOR | AC493: AGST | AD493: % | AE493: PTS
A494: FRANKSTON | D494: L TAYLOR | G494: BURNELL | J494: D CLARKE | M494: MILLANE | P494: HOPGOOD
A495: PORT MELBOURNE | D495: HOLLOW | G495: M CHEEL | J495: PEKIN | M495: THOMPSON | P495: R BOWDEN | W495: FRANKSTON | X495: 1 | Y495: 9 | Z495: 1 | AA495: 0 | AB495: 1260 | AC495: 634 | AD495: =(AB495/AC495)*100 -> 198.73817034700318 | AE495: =(Y495*4)+(AA495*2) -> 36
A496: GOALKICKERS | O496: GEORGE 2 | Q496: MOORE | W496: SPRINGVALE | X496: 1 | Y496: 7 | Z496: 3 | AA496: 0 | AB496: 1034 | AC496: 676 | AD496: =(AB496/AC496)*100 -> 152.95857988165679 | AE496: =(Y496*4)+(AA496*2) -> 28
A497: FRANKSTON | D497: D STUBBS 3 | G497: PICKERING 2 | J497: MEAD 2 | L497: BOWEY 2 | N497: R STUBBS 2 | Q497: MILLANE 2 | W497: WERRIBEE | X497: 1 | Y497: 7 | Z497: 3 | AA497: 0 | AB497: 974 | AC497: 710 | AD497: =(AB497/AC497)*100 -> 137.18309859154928 | AE497: =(Y497*4)+(AA497*2) -> 28
A498: PORT MELBOURNE | D498: KERSHAW 2 | G498: BALLANTYNE | J498: BAILEY | L498: GILMORE | W498: PORT MELBOURNE | X498: 2 | Y498: 6 | Z498: 3 | AA498: 0 | AB498: 880 | AC498: 791 | AD498: =(AB498/AC498)*100 -> 111.25158027812896 | AE498: =(Y498*4)+(AA498*2) -> 24
D499: 23RD JUNE | J499: WEATHER | S499: Venue: BEACH ROAD | W499: WILLIAMSTOWN | X499: 1 | Y499: 6 | Z499: 4 | AA499: 0 | AB499: 984 | AC499: 978 | AD499: =(AB499/AC499)*100 -> 100.61349693251533 | AE499: =(Y499*4)+(AA499*2) -> 24
A500: SANDRINGHAM | C500: 1 | D500: 3 | E500: =(C500*6)+D500 -> 9 | G500: 2 | H500: 9 | I500: =(G500*6)+H500 -> 21 | K500: 2 | L500: 11 | M500: =(K500*6)+L500 -> 23 | O500: 5 | P500: 15 | Q500: =(O500*6)+P500 -> 45 | S500: EDWARDS
A501: NORTH BALLARAT | C501: 2 | D501: 2 | E501: =(C501*6)+D501 -> 14 | G501: 3 | H501: 4 | I501: =(G501*6)+H501 -> 22 | K501: 4 | L501: 4 | M501: =(K501*6)+L501 -> 28 | O501: 6 | P501: 5 | Q501: =(O501*6)+P501 -> 41 | S501: GILES | W501: SANDRINGHAM | X501: 1 | Y501: 6 | Z501: 4 | AA501: 0 | AB501: 846 | AC501: 902 | AD501: =(AB501/AC501)*100 -> 93.791574279379148 | AE501: =(Y501*4)+(AA501*2) -> 24
A502: BEST PLAYERS | W502: COBURG | X502: 1 | Y502: 6 | Z502: 4 | AA502: 0 | AB502: 979 | AC502: 1165 | AD502: =(AB502/AC502)*100 -> 84.034334763948493 | AE502: =(Y502*4)+(AA502*2) -> 24
A503: SANDRINGHAM | D503: OAKLEY | G503: CROUGH | J503: SCOTT-BRANIGAN | W503: BOX HILL | X503: 1 | Y503: 3 | Z503: 7 | AA503: 0 | AB503: 798 | AC503: 1069 | AD503: =(AB503/AC503)*100 -> 74.649204864359206 | AE503: =(Y503*4)+(AA503*2) -> 12
A504: NORTH BALLARAT | D504: G POLKINGHORNE | H504: T POLKINGHORNE | L504: COX | N504: NICHOLSON | Q504: SNIBSON | T504: BUNN | W504: NORTH BALLARAT | X504: 1 | Y504: 2 | Z504: 8 | AA504: 0 | AB504: 738 | AC504: 906 | AD504: =(AB504/AC504)*100 -> 81.456953642384107 | AE504: =(Y504*4)+(AA504*2) -> 8
A505: GOALKICKERS | W505: PRESTON | X505: 2 | Y505: 1 | Z505: 8 | AA505: 0 | AB505: 690 | AC505: 866 | AD505: =(AB505/AC505)*100 -> 79.676674364896073 | AE505: =(Y505*4)+(AA505*2) -> 4
A506: SANDRINGHAM | D506: SCOTT-BRANIGAN 2 | H506: SNOOKS | J506: PHYLAND | L506: LLOYD | W506: TRARALGON | X506: 1 | Y506: 1 | Z506: 9 | AA506: 0 | AB506: 717 | AC506: 1338 | AD506: =(AB506/AC506)*100 -> 53.587443946188337 | AE506: =(Y506*4)+(AA506*2) -> 4
A507: NORTH BALLARAT | D507: NICHOLSON 2 | H507: QUINLAN | J507: JENSEN | L507: BUNN | N507: MADIGAN
A509: WERRIBEE | C509: 2 | D509: 3 | E509: =(C509*6)+D509 -> 15 | G509: 6 | H509: 7 | I509: =(G509*6)+H509 -> 43 | K509: 6 | L509: 11 | M509: =(K509*6)+L509 -> 47 | O509: 9 | P509: 11 | Q509: =(O509*6)+P509 -> 65 | S509: Venue: WERRIBEE
A510: BOX HILL | C510: 1 | D510: 1 | E510: =(C510*6)+D510 -> 7 | G510: 1 | H510: 1 | I510: =(G510*6)+H510 -> 7 | K510: 2 | L510: 4 | M510: =(K510*6)+L510 -> 16 | O510: 3 | P510: 6 | Q510: =(O510*6)+P510 -> 24 | S510: BEARD ;RUSSO ;NELIS
A511: BEST PLAYERS
A512: WERRIBEE | D512: ROACH | G512: PURCELL | J512: CAMILLIERI | M512: SATTERLEY | P512: N SAUNDERS
A513: BOX HILL | D513: JENKINS | G513: LIVINGSTONE | J513: SLATER | M513: BANFIELD | P513: BOURKE
A514: GOALKICKERS
A515: WERRIBEE | D515: SPROULE 3 | G515: CHURCHILL 2 | K515: AZIZ | M515: SATTERLEY | P515: TAYLOR | R515: D SAUNDERS
A516: BOX HILL | D516: GRACE 2 | G516: DOWER
A518: WILLIAMSTOWN | C518: 3 | D518: 5 | E518: =(C518*6)+D518 -> 23 | G518: 8 | H518: 11 | I518: =(G518*6)+H518 -> 59 | K518: 16 | L518: 13 | M518: =(K518*6)+L518 -> 109 | O518: 23 | P518: 18 | Q518: =(O518*6)+P518 -> 156 | S518: Venue: WILLIAMSTOWN
A519: COBURG | C519: 5 | D519: 1 | E519: =(C519*6)+D519 -> 31 | G519: 7 | H519: 6 | I519: =(G519*6)+H519 -> 48 | K519: 11 | L519: 5 | M519: =(K519*6)+L519 -> 71 | O519: 15 | P519: 9 | Q519: =(O519*6)+P519 -> 99 | S519: VOZZO :STEWART ;MANN
A520: BEST PLAYERS
A521: WILLIAMSTOWN | D521: LLOYD | G521: CARRICK | J521: KERRY | M521: DOOLEY | P521: WEST | R521: DELRE
A522: COBURG | D522: INGRAM | G522: NAPOLI | J522: CERINI | M522: WESTON | P522: STANLEY
A523: GOALKICKERS
A524: WILLIAMSTOWN | D524: NIELSEN 5 | G524: DELRE 5 | I524: FRASER 4 | K524: JOHANSEN 3 | N524: LLOYD 2 | P524: PASTORE | R524: O'KEEFE | U524: NICHOLSON | X524: KERRY
A525: COBURG | D525: ALESSIO 5 | G525: A BAKER 3 | J525: EVANS 3 | M525: G BAKER 2 | P525: STANLEY | R525: KNIGHTS
D526: 6TH AUGUST
A527: SPRINGVALE | C527: 1 | D527: 3 | E527: =(C527*6)+D527 -> 9 | G527: 4 | H527: 4 | I527: =(G527*6)+H527 -> 28 | K527: 6 | L527: 7 | M527: =(K527*6)+L527 -> 43 | O527: 6 | P527: 11 | Q527: =(O527*6)+P527 -> 47 | S527: Venue: TRARALGON (moved from SPRINGVALE)
A528: TRARALGON | C528: 1 | D528: 4 | E528: =(C528*6)+D528 -> 10 | G528: 1 | H528: 5 | I528: =(G528*6)+H528 -> 11 | K528: 3 | L528: 8 | M528: =(K528*6)+L528 -> 26 | O528: 3 | P528: 9 | Q528: =(O528*6)+P528 -> 27
A529: BEST PLAYERS
A530: SPRINGVALE
A531: TRARALGON
A532: GOALKICKERS
A533: SPRINGVALE
A534: TRARALGON
A536: BYE | D536: PRESTON
A538: ROUND 12 | D538: 29TH JUNE | J538: WEATHER | S538: Venue: BOX HILL
D539: 1ST QTR | H539: 2ND QTR | L539: 3RD QTR | P539: FINAL | S539: UMPIRES | V539: MALCOLM
A540: NORTH BALLARAT | C540: 1 | D540: 2 | E540: =(C540*6)+D540 -> 8 | G540: 4 | H540: 10 | I540: =(G540*6)+H540 -> 34 | K540: 5 | L540: 12 | M540: =(K540*6)+L540 -> 42 | O540: 7 | P540: 16 | Q540: =(O540*6)+P540 -> 58 | S540: MANN | Z540: LADDER | AC540: ROUND | AE540: 12
A541: BOX HILL | C541: 2 | D541: 8 | E541: =(C541*6)+D541 -> 20 | G541: 2 | H541: 9 | I541: =(G541*6)+H541 -> 21 | K541: 5 | L541: 13 | M541: =(K541*6)+L541 -> 43 | O541: 7 | P541: 15 | Q541: =(O541*6)+P541 -> 57 | S541: QUIGLEY
A542: BEST PLAYERS | W542: TEAM | X542: B | Y542: W | Z542: L | AA542: D | AB542: FOR | AC542: AGST | AD542: % | AE542: PTS
A543: NORTH BALLARAT | D543: SNIBSON | G543: BUNN | I543: T POLKINGHORNE | M543: COX | N543: MARKHAM | Q543: HARRINGTON
A544: BOX HILL | D544: SLATER | G544: GREIG | I544: WILKINSON | M544: BANFIELD | W544: FRANKSTON | X544: 1 | Y544: 10 | Z544: 1 | AA544: 0 | AB544: 1350 | AC544: 678 | AD544: =(AB544/AC544)*100 -> 199.11504424778761 | AE544: =(Y544*4)+(AA544*2) -> 40
A545: GOALKICKERS | W545: WERRIBEE | X545: 1 | Y545: 8 | Z545: 3 | AA545: 0 | AB545: 1019 | AC545: 725 | AD545: =(AB545/AC545)*100 -> 140.55172413793105 | AE545: =(Y545*4)+(AA545*2) -> 32
A546: NORTH BALLARAT | D546: BUNN 3 | G546: G POLKINGHORNE | K546: QUINLAN | N546: SHARP | P546: VENNER | W546: SPRINGVALE | X546: 2 | Y546: 7 | Z546: 3 | AA546: 0 | AB546: 1034 | AC546: 676 | AD546: =(AB546/AC546)*100 -> 152.95857988165679 | AE546: =(Y546*4)+(AA546*2) -> 28
A547: BOX HILL | D547: WILKINSON 4 | G547: QUINN | I547: BADROCK | K547: DOWER | W547: SANDRINGHAM | X547: 1 | Y547: 7 | Z547: 4 | AA547: 0 | AB547: 935 | AC547: 961 | AD547: =(AB547/AC547)*100 -> 97.29448491155047 | AE547: =(Y547*4)+(AA547*2) -> 28
D548: 30TH JUNE | J548: WEATHER | S548: Venue: PRESTON | W548: PORT MELBOURNE | X548: 2 | Y548: 6 | Z548: 4 | AA548: 0 | AB548: 921 | AC548: 834 | AD548: =(AB548/AC548)*100 -> 110.431654676259 | AE548: =(Y548*4)+(AA548*2) -> 24
A549: PRESTON | C549: 2 | D549: 1 | E549: =(C549*6)+D549 -> 13 | G549: 5 | H549: 3 | I549: =(G549*6)+H549 -> 33 | K549: 6 | L549: 4 | M549: =(K549*6)+L549 -> 40 | O549: 6 | P549: 7 | Q549: =(O549*6)+P549 -> 43 | S549: MASON
A550: PORT MELBOURNE | C550: 1 | D550: 1 | E550: =(C550*6)+D550 -> 7 | G550: 2 | H550: 1 | I550: =(G550*6)+H550 -> 13 | K550: 3 | L550: 4 | M550: =(K550*6)+L550 -> 22 | O550: 6 | P550: 5 | Q550: =(O550*6)+P550 -> 41 | S550: GILES | W550: WILLIAMSTOWN | X550: 1 | Y550: 6 | Z550: 5 | AA550: 0 | AB550: 999 | AC550: 1023 | AD550: =(AB550/AC550)*100 -> 97.653958944281527 | AE550: =(Y550*4)+(AA550*2) -> 24
A551: BEST PLAYERS | S551: ROWE | W551: COBURG | X551: 1 | Y551: 6 | Z551: 5 | AA551: 0 | AB551: 1038 | AC551: 1254 | AD551: =(AB551/AC551)*100 -> 82.775119617224874 | AE551: =(Y551*4)+(AA551*2) -> 24
A552: PRESTON | D552: MALLON | G552: WILSON | J552: PLUNKETT | M552: BOBELL | O552: M AIELLO | R552: POWER | W552: NORTH BALLARAT | X552: 1 | Y552: 3 | Z552: 8 | AA552: 0 | AB552: 796 | AC552: 963 | AD552: =(AB552/AC552)*100 -> 82.658359293873318 | AE552: =(Y552*4)+(AA552*2) -> 12
A553: PORT MELBOURNE | D553: R BOWDEN | G553: PEKIN | J553: CHEEL | M553: HOLLOW | O553: BUTTERWORTH | R553: KEIGHRAN | W553: BOX HILL | X553: 1 | Y553: 3 | Z553: 8 | AA553: 0 | AB553: 855 | AC553: 1127 | AD553: =(AB553/AC553)*100 -> 75.865128660159726 | AE553: =(Y553*4)+(AA553*2) -> 12
A554: GOALKICKERS | W554: PRESTON | X554: 2 | Y554: 2 | Z554: 8 | AA554: 0 | AB554: 733 | AC554: 907 | AD554: =(AB554/AC554)*100 -> 80.815876515986773 | AE554: =(Y554*4)+(AA554*2) -> 8
A555: PRESTON | D555: CARELLI 2 | G555: PLUNKETT 2 | J555: MAIORANA | M555: BLAGROVE | W555: TRARALGON | X555: 1 | Y555: 1 | Z555: 10 | AA555: 0 | AB555: 761 | AC555: 1428 | AD555: =(AB555/AC555)*100 -> 53.291316526610643 | AE555: =(Y555*4)+(AA555*2) -> 4
A556: PORT MELBOURNE | D556: KERSHAW 2 | G556: BAILEY | I556: SEXTON | K556: BUTTERWORTH | N556: GILMORE
A558: SANDRINGHAM | C558: 5 | D558: 4 | E558: =(C558*6)+D558 -> 34 | G558: 6 | H558: 9 | I558: =(G558*6)+H558 -> 45 | K558: 11 | L558: 15 | M558: =(K558*6)+L558 -> 81 | O558: 12 | P558: 17 | Q558: =(O558*6)+P558 -> 89 | S558: Venue: BEACH ROAD
A559: COBURG | C559: 2 | D559: 1 | E559: =(C559*6)+D559 -> 13 | G559: 4 | H559: 3 | I559: =(G559*6)+H559 -> 27 | K559: 6 | L559: 8 | M559: =(K559*6)+L559 -> 44 | O559: 8 | P559: 11 | Q559: =(O559*6)+P559 -> 59 | S559: DLEER :JONES :HEAD
A560: BEST PLAYERS
A561: SANDRINGHAM | D561: FOLEY | G561: KELLAWAY | J561: CLARKSON | M561: M SMITH | P561: COGHLAN | S561: SCOTT-BRANIGAN
A562: COBURG | D562: AUBREY | G562: NAPOLI | J562: STANLEY | M562: CERINI | P562: WESTON | S562: INGRAM
A563: GOALKICKERS
A564: SANDRINGHAM | D564: S SMITH 3 | G564: SCOTT-BRANIGAN 3 | K564: SNOOKS 2 | N564: M SMITH 2 | Q564: FOLEY | S564: McCONVILLE
A565: COBURG | D565: WESTON 2 | G565: GRIFFITHS | J565: NAPOLI | L565: STANLEY | N565: SIR | O565: ZIROS | Q565: TARANTO
A567: FRANKSTON | C567: 2 | D567: 3 | E567: =(C567*6)+D567 -> 15 | G567: 6 | H567: 12 | I567: =(G567*6)+H567 -> 48 | K567: 7 | L567: 15 | M567: =(K567*6)+L567 -> 57 | O567: 12 | P567: 18 | Q567: =(O567*6)+P567 -> 90 | S567: Venue: TRARALGON
A568: TRARALGON | C568: 1 | D568: 3 | E568: =(C568*6)+D568 -> 9 | G568: 1 | H568: 6 | I568: =(G568*6)+H568 -> 12 | K568: 2 | L568: 13 | M568: =(K568*6)+L568 -> 25 | O568: 5 | P568: 14 | Q568: =(O568*6)+P568 -> 44 | S568: SEXTON :NELIS :KELSEY
A569: BEST PLAYERS
A570: FRANKSTON | D570: CLARKE | G570: BURNELL | J570: HOPGOOD | M570: MOORE | O570: POLLOCK
A571: TRARALGON | D571: JENNINGS | G571: DICERIO | J571: CAMERON | M571: CAMPBELL | O571: SHERRIFF | R571: HOPKINS
A572: GOALKICKERS
A573: FRANKSTON | D573: STUBBS 3 | F573: MILLANE 2 | I573: MOORE 2 | K573: GEORGE | M573: McKAY | O573: J PICKERING | R573: MEAD | U573: B BOWEY
A574: TRARALGON | D574: P STOCKDALE 3 | H574: RAYNER | J574: SHERRIFF
A576: WERRIBEE | C576: 2 | D576: 3 | E576: =(C576*6)+D576 -> 15 | G576: 2 | H576: 4 | I576: =(G576*6)+H576 -> 16 | K576: 5 | L576: 10 | M576: =(K576*6)+L576 -> 40 | O576: 5 | P576: 15 | Q576: =(O576*6)+P576 -> 45 | S576: Venue: WERRIBEE
A577: WILLIAMSTOWN | C577: 1 | D577: 6 | E577: =(C577*6)+D577 -> 12 | G577: 1 | H577: 7 | I577: =(G577*6)+H577 -> 13 | K577: 1 | L577: 7 | M577: =(K577*6)+L577 -> 13 | O577: 1 | P577: 9 | Q577: =(O577*6)+P577 -> 15 | S577: JAMES :DAVIDSON :TWITT
A578: BEST PLAYERS
A579: WERRIBEE | D579: MANSFIELD | G579: SATTERLEY | J579: PURCELL | M579: D TAYLOR | P579: CHURCHILL | S579: SPROULE
A580: WILLIAMSTOWN | D580: KERRY | G580: HOUGH | J580: HORE | M580: DOOLEY | P580: GHAZI | S580: J MAHONEY
A581: GOALKICKERS
A582: WERRIBEE | D582: SPROULE 3 | G582: SATTERLEY | J582: BUTTON
A583: WILLIAMSTOWN | D583: DELRE
A585: BYE | D585: SPRINGVALE
A587: ROUND 13 | D587: 6TH JULY | J587: WEATHER | S587: Venue: COBURG
D588: 1ST QTR | H588: 2ND QTR | L588: 3RD QTR | P588: FINAL | S588: UMPIRES | V588: ADAMS
A589: BOX HILL | C589: 5 | D589: 6 | E589: =(C589*6)+D589 -> 36 | G589: 6 | H589: 9 | I589: =(G589*6)+H589 -> 45 | K589: 7 | L589: 13 | M589: =(K589*6)+L589 -> 55 | O589: 14 | P589: 14 | Q589: =(O589*6)+P589 -> 98 | S589: TWITT | Z589: LADDER | AC589: ROUND | AE589: 13
A590: COBURG | C590: 2 | D590: 4 | E590: =(C590*6)+D590 -> 16 | G590: 5 | H590: 5 | I590: =(G590*6)+H590 -> 35 | K590: 7 | L590: 7 | M590: =(K590*6)+L590 -> 49 | O590: 8 | P590: 13 | Q590: =(O590*6)+P590 -> 61 | S590: GOODRIDGE
A591: BEST PLAYERS | W591: TEAM | X591: B | Y591: W | Z591: L | AA591: D | AB591: FOR | AC591: AGST | AD591: % | AE591: PTS
A592: BOX HILL | D592: GOODALE | G592: PAYNE | J592: HEANEY | M592: SLATER | O592: LIVINGSTONE | R592: BOURKE
A593: COBURG | D593: INGRAM | G593: PORTER | J593: CERINI | M593: AUBREY | O593: ALESSIO | W593: FRANKSTON | X593: 1 | Y593: 11 | Z593: 1 | AA593: 0 | AB593: 1391 | AC593: 693 | AD593: =(AB593/AC593)*100 -> 200.72150072150072 | AE593: =(Y593*4)+(AA593*2) -> 44
A594: GOALKICKERS | Q594: BOURKE | W594: WERRIBEE | X594: 1 | Y594: 9 | Z594: 3 | AA594: 0 | AB594: 1097 | AC594: 771 | AD594: =(AB594/AC594)*100 -> 142.28274967574578 | AE594: =(Y594*4)+(AA594*2) -> 36
A595: BOX HILL | D595: WILKINSON 3 | G595: MURLEY 3 | J595: DOWER 2 | M595: ROWE 2 | O595: BADROCK 2 | R595: HEANEY | W595: SPRINGVALE | X595: 2 | Y595: 8 | Z595: 3 | AA595: 0 | AB595: 1130 | AC595: 722 | AD595: =(AB595/AC595)*100 -> 156.50969529085873 | AE595: =(Y595*4)+(AA595*2) -> 32
A596: COBURG | D596: DALE 3 | G596: SIR 2 | I596: TATE | K596: FITZPATRICK | N596: TARANTO | W596: WILLIAMSTOWN | X596: 1 | Y596: 7 | Z596: 5 | AA596: 0 | AB596: 1089 | AC596: 1105 | AD596: =(AB596/AC596)*100 -> 98.552036199095028 | AE596: =(Y596*4)+(AA596*2) -> 28
D597: 7TH JULY | J597: WEATHER | S597: Venue: NORTH BALLARAT | W597: SANDRINGHAM | X597: 2 | Y597: 7 | Z597: 4 | AA597: 0 | AB597: 935 | AC597: 961 | AD597: =(AB597/AC597)*100 -> 97.29448491155047 | AE597: =(Y597*4)+(AA597*2) -> 28
A598: FRANKSTON | C598: 0 | D598: 4 | E598: =(C598*6)+D598 -> 4 | G598: 1 | H598: 5 | I598: =(G598*6)+H598 -> 11 | K598: 1 | L598: 9 | M598: =(K598*6)+L598 -> 15 | O598: 4 | P598: 17 | Q598: =(O598*6)+P598 -> 41 | S598: BEARD
A599: NORTH BALLARAT | C599: 0 | D599: 0 | E599: =(C599*6)+D599 -> 0 | G599: 1 | H599: 2 | I599: =(G599*6)+H599 -> 8 | K599: 2 | L599: 2 | M599: =(K599*6)+L599 -> 14 | O599: 2 | P599: 3 | Q599: =(O599*6)+P599 -> 15 | S599: PRITCHARD | W599: PORT MELBOURNE | X599: 2 | Y599: 6 | Z599: 5 | AA599: 0 | AB599: 967 | AC599: 930 | AD599: =(AB599/AC599)*100 -> 103.97849462365592 | AE599: =(Y599*4)+(AA599*2) -> 24
A600: BEST PLAYERS | S600: STEWART | W600: COBURG | X600: 1 | Y600: 6 | Z600: 6 | AA600: 0 | AB600: 1099 | AC600: 1352 | AD600: =(AB600/AC600)*100 -> 81.286982248520715 | AE600: =(Y600*4)+(AA600*2) -> 24
A601: FRANKSTON | D601: D TAYLOR | G601: MOORE | J601: RYAN | M601: L TAYLOR | P601: AGNELLO | W601: BOX HILL | X601: 1 | Y601: 4 | Z601: 8 | AA601: 0 | AB601: 953 | AC601: 1188 | AD601: =(AB601/AC601)*100 -> 80.218855218855225 | AE601: =(Y601*4)+(AA601*2) -> 16
A602: NORTH BALLARAT | D602: SNIBSON | G602: COX | I602: G POLKINGHORNE | M602: MARKHAM | P602: T POLKINGHORNE | T602: RYAN | W602: NORTH BALLARAT | X602: 1 | Y602: 3 | Z602: 9 | AA602: 0 | AB602: 811 | AC602: 1004 | AD602: =(AB602/AC602)*100 -> 80.776892430278878 | AE602: =(Y602*4)+(AA602*2) -> 12
A603: GOALKICKERS | W603: PRESTON | X603: 2 | Y603: 2 | Z603: 9 | AA603: 0 | AB603: 779 | AC603: 985 | AD603: =(AB603/AC603)*100 -> 79.086294416243646 | AE603: =(Y603*4)+(AA603*2) -> 8
A604: FRANKSTON | D604: D CLARKE | G604: GEORGE | J604: R STUBBS | M604: AGNELLO | W604: TRARALGON | X604: 1 | Y604: 1 | Z604: 11 | AA604: 0 | AB604: 843 | AC604: 1518 | AD604: =(AB604/AC604)*100 -> 55.533596837944664 | AE604: =(Y604*4)+(AA604*2) -> 4
A605: NORTH BALLARAT | D605: T POLKINGHORNE | H605: QUINLAN
A607: SPRINGVALE | C607: 2 | D607: 2 | E607: =(C607*6)+D607 -> 14 | G607: 6 | H607: 4 | I607: =(G607*6)+H607 -> 40 | K607: 11 | L607: 5 | M607: =(K607*6)+L607 -> 71 | O607: 15 | P607: 6 | Q607: =(O607*6)+P607 -> 96 | S607: Venue: PORT MELBOURNE
A608: PORT MELBOURNE | C608: 2 | D608: 2 | E608: =(C608*6)+D608 -> 14 | G608: 2 | H608: 4 | I608: =(G608*6)+H608 -> 16 | K608: 5 | L608: 8 | M608: =(K608*6)+L608 -> 38 | O608: 6 | P608: 10 | Q608: =(O608*6)+P608 -> 46 | S608: VOZZO :KELSEY :DAVIDSON
A609: BEST PLAYERS
A610: SPRINGVALE | D610: D CARROLL | G610: SUTHERLAND | J610: DELARUE | M610: LITTLE | O610: CAPSALIS | R610: LIELNORS
A611: PORT MELBOURNE | D611: S CHEEL | G611: WEEDING
A612: GOALKICKERS
A613: SPRINGVALE | D613: CAPSALIS 3 | G613: COURTNEY 3 | J613: LIELNORS 2 | M613: STUBBS 2 | O613: YEATS 2 | Q613: JEFFREY | S613: EVANS
A614: PORT MELBOURNE | D614: KERSHAW 3 | G614: SEXTON | J614: M CHEEL | M614: McGEE
A616: WERRIBEE | C616: 0 | D616: 5 | E616: =(C616*6)+D616 -> 5 | G616: 5 | H616: 7 | I616: =(G616*6)+H616 -> 37 | K616: 6 | L616: 10 | M616: =(K616*6)+L616 -> 46 | O616: 11 | P616: 12 | Q616: =(O616*6)+P616 -> 78 | S616: Venue: PRESTON
A617: PRESTON | C617: 1 | D617: 4 | E617: =(C617*6)+D617 -> 10 | G617: 3 | H617: 8 | I617: =(G617*6)+H617 -> 26 | K617: 4 | L617: 10 | M617: =(K617*6)+L617 -> 34 | O617: 6 | P617: 10 | Q617: =(O617*6)+P617 -> 46 | S617: EDWARDS :MALCOLM :QUIGLEY
A618: BEST PLAYERS
A619: WERRIBEE | D619: MURPHY | G619: O'CONNOR | J619: D SAUNDERS | M619: CHURCHILL | P619: AZIZ | R619: D TAYLOR
A620: PRESTON | D620: DOBELL | G620: MORRISEY | J620: M AIELLO | M620: PLUNKETT | P620: MAIORANA | R620: D LUCAS
A621: GOALKICKERS
A622: WERRIBEE | D622: AZIZ 4 | G622: MURPHY 2 | J622: CHURCHILL | M622: SATTERLEY | P622: MANSFIELD | S622: BUTTON | V622: N SAUNDERS
A623: PRESTON | D623: M AIELLO 2 | G623: BAYRE 2 | J623: FLAVELL | M623: WILSON
A625: WILLIAMSTOWN | C625: 4 | D625: 4 | E625: =(C625*6)+D625 -> 28 | G625: 6 | H625: 9 | I625: =(G625*6)+H625 -> 45 | K625: 10 | L625: 14 | M625: =(K625*6)+L625 -> 74 | O625: 12 | P625: 18 | Q625: =(O625*6)+P625 -> 90 | S625: Venue: WILLIAMSTOWN
A626: TRARALGON | C626: 2 | D626: 6 | E626: =(C626*6)+D626 -> 18 | G626: 7 | H626: 8 | I626: =(G626*6)+H626 -> 50 | K626: 8 | L626: 12 | M626: =(K626*6)+L626 -> 60 | O626: 11 | P626: 16 | Q626: =(O626*6)+P626 -> 82 | S626: RUSSO :JONES :KANIZAY
A627: BEST PLAYERS
A628: WILLIAMSTOWN | D628: SHANKS | G628: HOUGH | J628: O'KEEFE | M628: DELRE | P628: WEST
A629: TRARALGON | D629: GARNER | G629: McGANNON | J629: BURRIDGE | M629: CAMERON | P629: McCULLOCH | S629: WOLFE
A630: GOALKICKERS
A631: WILLIAMSTOWN | D631: O'KEEFE 6 | G631: DELRE 2 | J631: SHANKS 2 | M631: CARRICK 2
A632: TRARALGON | D632: McCULLOCH 3 | G632: CUNNINGHAM | J632: GARNER | L632: HOPKINS | N632: MORLEY | P632: RICHARDS | R632: STOCKDALE | V632: WOLFE | X632: DICIERO
A634: BYE | D634: SANDRINGHAM
A636: ROUND 14 | D636: 13TH JULY | J636: WEATHER | S636: Venue: COBURG
D637: 1ST QTR | H637: 2ND QTR | L637: 3RD QTR | P637: FINAL | S637: UMPIRES | V637: JAMES
A638: PORT MELBOURNE | C638: 2 | D638: 3 | E638: =(C638*6)+D638 -> 15 | G638: 6 | H638: 6 | I638: =(G638*6)+H638 -> 42 | K638: 8 | L638: 9 | M638: =(K638*6)+L638 -> 57 | O638: 14 | P638: 13 | Q638: =(O638*6)+P638 -> 97 | S638: EDWARDS | Z638: LADDER | AC638: ROUND | AE638: 14
A639: COBURG | C639: 5 | D639: 1 | E639: =(C639*6)+D639 -> 31 | G639: 6 | H639: 4 | I639: =(G639*6)+H639 -> 40 | K639: 9 | L639: 9 | M639: =(K639*6)+L639 -> 63 | O639: 12 | P639: 12 | Q639: =(O639*6)+P639 -> 84 | S639: MASON
A640: BEST PLAYERS | W640: TEAM | X640: B | Y640: W | Z640: L | AA640: D | AB640: FOR | AC640: AGST | AD640: % | AE640: PTS
A641: PORT MELBOURNE | D641: R BOWDEN | G641: KERSHAW | J641: WEEDING | M641: SEXTON | O641: McGEE | R641: CAMERON
A642: COBURG | D642: INGRAM | G642: CLEEVE | J642: PORTER | M642: AUBREY | O642: STANLEY | R642: TATE | W642: FRANKSTON | X642: 1 | Y642: 12 | Z642: 1 | AA642: 0 | AB642: 1542 | AC642: 746 | AD642: =(AB642/AC642)*100 -> 206.70241286863268 | AE642: =(Y642*4)+(AA642*2) -> 48
A643: GOALKICKERS | W643: SPRINGVALE | X643: 2 | Y643: 9 | Z643: 3 | AA643: 0 | AB643: 1226 | AC643: 774 | AD643: =(AB643/AC643)*100 -> 158.39793281653746 | AE643: =(Y643*4)+(AA643*2) -> 36
A644: PORT MELBOURNE | D644: KERSHAW 7 | G644: SEXTON 3 | J644: WEEDING 2 | M644: D'GIACOMA | P644: REYNOLDS | W644: WERRIBEE | X644: 2 | Y644: 9 | Z644: 3 | AA644: 0 | AB644: 1097 | AC644: 771 | AD644: =(AB644/AC644)*100 -> 142.28274967574578 | AE644: =(Y644*4)+(AA644*2) -> 36
A645: COBURG | D645: DALE 4 | G645: KAVANAGH 2 | J645: EVANS 2 | M645: ZIROS | O645: SIR | Q645: AUBREY | S645: ALESSIO | W645: WILLIAMSTOWN | X645: 1 | Y645: 8 | Z645: 5 | AA645: 0 | AB645: 1233 | AC645: 1185 | AD645: =(AB645/AC645)*100 -> 104.0506329113924 | AE645: =(Y645*4)+(AA645*2) -> 32
D646: 14TH JULY | J646: WEATHER | S646: Venue: FRANKSTON | W646: PORT MELBOURNE | X646: 2 | Y646: 7 | Z646: 5 | AA646: 0 | AB646: 1064 | AC646: 1014 | AD646: =(AB646/AC646)*100 -> 104.93096646942801 | AE646: =(Y646*4)+(AA646*2) -> 28
A647: FRANKSTON | C647: 7 | D647: 2 | E647: =(C647*6)+D647 -> 44 | G647: 12 | H647: 4 | I647: =(G647*6)+H647 -> 76 | K647: 16 | L647: 10 | M647: =(K647*6)+L647 -> 106 | O647: 23 | P647: 13 | Q647: =(O647*6)+P647 -> 151 | S647: SHEARER
A648: BOX HILL | C648: 3 | D648: 3 | E648: =(C648*6)+D648 -> 21 | G648: 4 | H648: 6 | I648: =(G648*6)+H648 -> 30 | K648: 5 | L648: 7 | M648: =(K648*6)+L648 -> 37 | O648: 7 | P648: 11 | Q648: =(O648*6)+P648 -> 53 | S648: HEAD | W648: SANDRINGHAM | X648: 2 | Y648: 7 | Z648: 5 | AA648: 0 | AB648: 1015 | AC648: 1105 | AD648: =(AB648/AC648)*100 -> 91.855203619909503 | AE648: =(Y648*4)+(AA648*2) -> 28
A649: BEST PLAYERS | S649: RUSSO | W649: COBURG | X649: 1 | Y649: 6 | Z649: 7 | AA649: 0 | AB649: 1183 | AC649: 1449 | AD649: =(AB649/AC649)*100 -> 81.642512077294683 | AE649: =(Y649*4)+(AA649*2) -> 24
A650: FRANKSTON | D650: S RYAN | G650: L TAYLOR | J650: DAN CLARKE | M650: MOORE | O650: AGNELLO | R650: J PICKERING | W650: NORTH BALLARAT | X650: 1 | Y650: 4 | Z650: 9 | AA650: 0 | AB650: 873 | AC650: 1045 | AD650: =(AB650/AC650)*100 -> 83.540669856459331 | AE650: =(Y650*4)+(AA650*2) -> 16
A651: BOX HILL | D651: BREWER | G651: PAYNE | J651: GOODALE | W651: BOX HILL | X651: 1 | Y651: 4 | Z651: 9 | AA651: 0 | AB651: 1006 | AC651: 1339 | AD651: =(AB651/AC651)*100 -> 75.130694548170268 | AE651: =(Y651*4)+(AA651*2) -> 16
A652: GOALKICKERS | I652: DAN CLARKE 2 | M652: MILLANE 2 | P652: AGNELLO | R652: A PICKERING | W652: PRESTON | X652: 2 | Y652: 2 | Z652: 10 | AA652: 0 | AB652: 831 | AC652: 1081 | AD652: =(AB652/AC652)*100 -> 76.873265494912118 | AE652: =(Y652*4)+(AA652*2) -> 8
A653: FRANKSTON | D653: S RYAN 4 | G653: McQUEEN 4 | J653: McKAY 4 | M653: J PICKERING 3 | P653: BOWEY 2 | W653: TRARALGON | X653: 1 | Y653: 1 | Z653: 12 | AA653: 0 | AB653: 884 | AC653: 1580 | AD653: =(AB653/AC653)*100 -> 55.949367088607595 | AE653: =(Y653*4)+(AA653*2) -> 4
A654: BOX HILL | D654: BADROCK 2 | G654: ROWE 2 | J654: WILKINSON | M654: PAYNE | O654: BANFIELD
A656: NORTH BALLARAT | C656: 0 | D656: 2 | E656: =(C656*6)+D656 -> 2 | G656: 4 | H656: 6 | I656: =(G656*6)+H656 -> 30 | K656: 6 | L656: 7 | M656: =(K656*6)+L656 -> 43 | O656: 9 | P656: 8 | Q656: =(O656*6)+P656 -> 62 | S656: Venue: NORTH BALLARAT
A657: TRARALGON | C657: 1 | D657: 0 | E657: =(C657*6)+D657 -> 6 | G657: 3 | H657: 5 | I657: =(G657*6)+H657 -> 23 | K657: 4 | L657: 9 | M657: =(K657*6)+L657 -> 33 | O657: 5 | P657: 11 | Q657: =(O657*6)+P657 -> 41 | S657: GOODRIDGE :DELLER :TWITT
A658: BEST PLAYERS
A659: NORTH BALLARAT | D659: BUNN | G659: VENNER | J659: SNIBSON | M659: T POLKINGHORNE | Q659: COX | R659: NICHOLSON
A660: TRARALGON | D660: JENNINGS | G660: SHERRIFF | J660: McGANNON | M660: BURRIDGE | P660: HOPKINS | R660: DICERIO
A661: GOALKICKERS
A662: NORTH BALLARAT | D662: COX 4 | G662: SNIBSON 2 | J662: BUNN | L662: SHARP | N662: PARTINGTON
A663: TRARALGON | D663: McCULLOCH 2 | G663: RAYNER 2 | J663: P STOCKDALE
A665: SPRINGVALE | C665: 2 | D665: 3 | E665: =(C665*6)+D665 -> 15 | G665: 5 | H665: 6 | I665: =(G665*6)+H665 -> 36 | K665: 7 | L665: 9 | M665: =(K665*6)+L665 -> 51 | O665: 14 | P665: 12 | Q665: =(O665*6)+P665 -> 96 | S665: Venue: SPRINGVALE
A666: PRESTON | C666: 3 | D666: 3 | E666: =(C666*6)+D666 -> 21 | G666: 4 | H666: 5 | I666: =(G666*6)+H666 -> 29 | K666: 6 | L666: 8 | M666: =(K666*6)+L666 -> 44 | O666: 7 | P666: 10 | Q666: =(O666*6)+P666 -> 52 | S666: MANN :KANIZAY :ADAMS
A667: BEST PLAYERS
A668: SPRINGVALE | D668: BURGMAN | G668: CLARK | J668: D CARROLL | M668: LIELNORS | P668: COURTNEY | S668: J CARROLL
A669: PRESTON | D669: DOBELL | G669: BOOKER | J669: HARDENBERG | M669: MAIORANA | P669: POWER | S669: DUSSI
A670: GOALKICKERS
A671: SPRINGVALE | D671: CLARK 5 | G671: STUBBS 2 | J671: COURTNEY 2 | M671: D CARROLL 2 | P671: LIELNORS 2 | S671: CAPLES
A672: PRESTON | D672: BAYRE 3 | G672: BLAGROVE 2 | J672: PLUNKETT | M672: WILSON
A674: WILLIAMSTOWN | C674: 6 | D674: 5 | E674: =(C674*6)+D674 -> 41 | G674: 11 | H674: 11 | I674: =(G674*6)+H674 -> 77 | K674: 13 | L674: 18 | M674: =(K674*6)+L674 -> 96 | O674: 20 | P674: 24 | Q674: =(O674*6)+P674 -> 144 | S674: Venue: WILLIAMSTOWN
A675: SANDRINGHAM | C675: 2 | D675: 4 | E675: =(C675*6)+D675 -> 16 | G675: 6 | H675: 5 | I675: =(G675*6)+H675 -> 41 | K675: 9 | L675: 7 | M675: =(K675*6)+L675 -> 61 | O675: 12 | P675: 8 | Q675: =(O675*6)+P675 -> 80 | S675: SEXTON :NELIS :PRITCHARD
A676: BEST PLAYERS
A677: WILLIAMSTOWN | D677: P DOOLEY | G677: O'KEEFE | J677: PASTORE | M677: DELRE | P677: SHANKS | R677: GOULD
A678: SANDRINGHAM | D678: S SMITH | G678: FRATER | J678: KELLAWAY | M678: MARTELLO | P678: SCOTT-BRANIGAN
A679: GOALKICKERS
A680: WILLIAMSTOWN | D680: O'KEEFE 8 | G680: DELRE 4 | J680: NICHOLSON 3 | M680: P DOOLEY 2 | P680: JOHANSEN | R680: SHANKS | U680: CARRICK
A681: SANDRINGHAM | D681: S SMITH 7 | G681: CLARKSON 2 | J681: KELLAWAY | N681: MARTELLO | Q681: SCOTT-BRANIGAN
A683: BYE | D683: WERRIBEE
A685: ROUND 15 | D685: 20TH JULY | J685: WEATHER | S685: Venue: COBURG
D686: 1ST QTR | H686: 2ND QTR | L686: 3RD QTR | P686: FINAL | S686: UMPIRES | V686: DAVIDSON
A687: NORTH BALLARAT | C687: 6 | D687: 4 | E687: =(C687*6)+D687 -> 40 | G687: 15 | H687: 6 | I687: =(G687*6)+H687 -> 96 | K687: 18 | L687: 8 | M687: =(K687*6)+L687 -> 116 | O687: 24 | P687: 9 | Q687: =(O687*6)+P687 -> 153 | S687: JONES | Z687: LADDER | AC687: ROUND | AE687: 15
A688: COBURG | C688: 3 | D688: 5 | E688: =(C688*6)+D688 -> 23 | G688: 3 | H688: 9 | I688: =(G688*6)+H688 -> 27 | K688: 7 | L688: 12 | M688: =(K688*6)+L688 -> 54 | O688: 10 | P688: 14 | Q688: =(O688*6)+P688 -> 74 | S688: HEAD
A689: BEST PLAYERS | W689: TEAM | X689: B | Y689: W | Z689: L | AA689: D | AB689: FOR | AC689: AGST | AD689: % | AE689: PTS
A690: NORTH BALLARAT | D690: C RYAN | G690: SNIBSON | J690: PARTINGTON | M690: SHARP | O690: BUNN | R690: NICHOLSON
A691: COBURG | D691: INGRAM | G691: PORTER | J691: AUBREY | M691: BAKER | O691: STANLEY | R691: TATE | W691: FRANKSTON | X691: 2 | Y691: 12 | Z691: 1 | AA691: 0 | AB691: 1542 | AC691: 746 | AD691: =(AB691/AC691)*100 -> 206.70241286863268 | AE691: =(Y691*4)+(AA691*2) -> 48
A692: GOALKICKERS | N692: POLKINGHORNE | R692: DISNEY | W692: WERRIBEE | X692: 2 | Y692: 10 | Z692: 3 | AA692: 0 | AB692: 1159 | AC692: 819 | AD692: =(AB692/AC692)*100 -> 141.51404151404151 | AE692: =(Y692*4)+(AA692*2) -> 40
A693: NORTH BALLARAT | D693: PARTINGTON 6 | G693: SHARP 5 | I693: BROADBENT 3 | L693: EZARD 3 | N693: SNIBSON 2 | Q693: BUNN 2 | S693: HOOD | W693: SPRINGVALE | X693: 2 | Y693: 9 | Z693: 4 | AA693: 0 | AB693: 1258 | AC693: 838 | AD693: =(AB693/AC693)*100 -> 150.11933174224345 | AE693: =(Y693*4)+(AA693*2) -> 36
A694: COBURG | D694: LATTENSTEIN 2 | H694: EVANS 2 | K694: KAVANAGH 2 | N694: SIR | O694: TATE | Q694: INGRAM | S694: DALE | W694: WILLIAMSTOWN | X694: 1 | Y694: 9 | Z694: 5 | AA694: 0 | AB694: 1297 | AC694: 1217 | AD694: =(AB694/AC694)*100 -> 106.57354149548068 | AE694: =(Y694*4)+(AA694*2) -> 36
D695: 21ST JULY | J695: WEATHER | S695: Venue: PRESTON | W695: PORT MELBOURNE | X695: 2 | Y695: 8 | Z695: 5 | AA695: 0 | AB695: 1134 | AC695: 1067 | AD695: =(AB695/AC695)*100 -> 106.2792877225867 | AE695: =(Y695*4)+(AA695*2) -> 32
A696: PRESTON | C696: 3 | D696: 2 | E696: =(C696*6)+D696 -> 20 | G696: 6 | H696: 2 | I696: =(G696*6)+H696 -> 38 | K696: 9 | L696: 5 | M696: =(K696*6)+L696 -> 59 | O696: 11 | P696: 8 | Q696: =(O696*6)+P696 -> 74 | S696: PRITCHARD
A697: BOX HILL | C697: 2 | D697: 2 | E697: =(C697*6)+D697 -> 14 | G697: 4 | H697: 3 | I697: =(G697*6)+H697 -> 27 | K697: 5 | L697: 3 | M697: =(K697*6)+L697 -> 33 | O697: 7 | P697: 4 | Q697: =(O697*6)+P697 -> 46 | S697: MASON | W697: SANDRINGHAM | X697: 2 | Y697: 7 | Z697: 6 | AA697: 0 | AB697: 1063 | AC697: 1167 | AD697: =(AB697/AC697)*100 -> 91.08826049700086 | AE697: =(Y697*4)+(AA697*2) -> 28
A698: BEST PLAYERS | S698: KELSEY | W698: COBURG | X698: 1 | Y698: 6 | Z698: 8 | AA698: 0 | AB698: 1257 | AC698: 1602 | AD698: =(AB698/AC698)*100 -> 78.464419475655433 | AE698: =(Y698*4)+(AA698*2) -> 24
A699: PRESTON | D699: MAIORANA | G699: D LUCAS | J699: PLUNKETT | M699: WILSON | O699: BLAGROVE | R699: POWER | W699: NORTH BALLARAT | X699: 1 | Y699: 5 | Z699: 9 | AA699: 0 | AB699: 1026 | AC699: 1119 | AD699: =(AB699/AC699)*100 -> 91.689008042895438 | AE699: =(Y699*4)+(AA699*2) -> 20
A700: BOX HILL | D700: PAYNE | G700: LIVINGSTONE | J700: CROWLEY | W700: BOX HILL | X700: 1 | Y700: 4 | Z700: 10 | AA700: 0 | AB700: 1052 | AC700: 1413 | AD700: =(AB700/AC700)*100 -> 74.451521585279551 | AE700: =(Y700*4)+(AA700*2) -> 16
A701: GOALKICKERS | W701: PRESTON | X701: 2 | Y701: 3 | Z701: 10 | AA701: 0 | AB701: 905 | AC701: 1127 | AD701: =(AB701/AC701)*100 -> 80.301685891747994 | AE701: =(Y701*4)+(AA701*2) -> 12
A702: PRESTON | D702: WILSON 4 | G702: ECCLES 2 | J702: PLUNKETT 2 | M702: BOOKER | O702: GRAINGER | R702: SINCLAIR | W702: TRARALGON | X702: 1 | Y702: 1 | Z702: 13 | AA702: 0 | AB702: 937 | AC702: 1650 | AD702: =(AB702/AC702)*100 -> 56.787878787878789 | AE702: =(Y702*4)+(AA702*2) -> 4
A703: BOX HILL | D703: PAYNE 2 | G703: WILKINSON | J703: BADROCK | M703: BOURKE | O703: LIVINGSTONE | R703: ROSCOE
A705: WILLIAMSTOWN | C705: 1 | D705: 4 | E705: =(C705*6)+D705 -> 10 | G705: 5 | H705: 8 | I705: =(G705*6)+H705 -> 38 | K705: 5 | L705: 8 | M705: =(K705*6)+L705 -> 38 | O705: 9 | P705: 10 | Q705: =(O705*6)+P705 -> 64 | S705: Venue: SPRINGVALE
A706: SPRINGVALE | C706: 2 | D706: 3 | E706: =(C706*6)+D706 -> 15 | G706: 2 | H706: 3 | I706: =(G706*6)+H706 -> 15 | K706: 4 | L706: 7 | M706: =(K706*6)+L706 -> 31 | O706: 4 | P706: 8 | Q706: =(O706*6)+P706 -> 32 | S706: VOZZO ;STEWART :MALCOLM
A707: BEST PLAYERS
A708: WILLIAMSTOWN | D708: LLOYD | G708: CARRICK | J708: KERRY | M708: MAHONEY | P708: SHANKS | R708: HORE
A709: SPRINGVALE | D709: DELARUE | G709: CAPLES | J709: TAYLOR | M709: COURTNRY | P709: BURGMAN
A710: GOALKICKERS
A711: WILLIAMSTOWN | D711: GHAZI 2 | G711: DELRE 2 | J711: JOHANSEN 2 | M711: O'KEEFE | P711: LLOYD | R711: COPELAND
A712: SPRINGVALE | D712: CAPLES | G712: COURTNEY | J712: CAPSALIS | M712: DELARUE
A714: PORT MELBOURNE | C714: 2 | D714: 5 | E714: =(C714*6)+D714 -> 17 | G714: 5 | H714: 8 | I714: =(G714*6)+H714 -> 38 | K714: 8 | L714: 9 | M714: =(K714*6)+L714 -> 57 | O714: 10 | P714: 10 | Q714: =(O714*6)+P714 -> 70 | S714: Venue: TRARALGON
A715: TRARALGON | C715: 2 | D715: 1 | E715: =(C715*6)+D715 -> 13 | G715: 2 | H715: 5 | I715: =(G715*6)+H715 -> 17 | K715: 4 | L715: 8 | M715: =(K715*6)+L715 -> 32 | O715: 7 | P715: 11 | Q715: =(O715*6)+P715 -> 53 | S715: GILES ;MANN :ROWE
A716: BEST PLAYERS
A717: PORT MELBOURNE | D717: R BOWDEN | G717: CAMERON | J717: BALLANTYNE | M717: SEXTON | P717: McGEE | R717: HOFFMAN
A718: TRARALGON | D718: McGANNON | G718: MORLEY | J718: CAMPBELL | M718: JENNINGS | P718: WOLFE | R718: HOPKINS
A719: GOALKICKERS
A720: PORT MELBOURNE | D720: KERSHAW 4 | G720: DOCHERTY 2 | J720: WEEDING | L720: D'GIACOMA | O720: BOWDEN | Q720: HARKINS
A721: TRARALGON | D721: McCULLOCH 3 | G721: KERR | I721: CAMERON | K721: GARNER | M721: BURRIDGE
A723: WERRIBEE | C723: 4 | D723: 5 | E723: =(C723*6)+D723 -> 29 | G723: 4 | H723: 6 | I723: =(G723*6)+H723 -> 30 | K723: 8 | L723: 7 | M723: =(K723*6)+L723 -> 55 | O723: 9 | P723: 8 | Q723: =(O723*6)+P723 -> 62 | S723: Venue: WERRIBEE
A724: SANDRINGHAM | C724: 0 | D724: 0 | E724: =(C724*6)+D724 -> 0 | G724: 5 | H724: 2 | I724: =(G724*6)+H724 -> 32 | K724: 6 | L724: 3 | M724: =(K724*6)+L724 -> 39 | O724: 7 | P724: 6 | Q724: =(O724*6)+P724 -> 48 | S724: ADAMS :BEARD :SHEARER
A725: BEST PLAYERS
A726: WERRIBEE | D726: EAMES | G726: AZIZ | J726: SPEAR | L726: D TAYLOR | O726: O'CONNOR | R726: MURPHY
A727: SANDRINGHAM | D727: MITCHELSON | G727: MALONEY | J727: WATSON | L727: FOLEY | O727: FRATER | R727: MATTHEWS
A728: GOALKICKERS
A729: WERRIBEE | D729: AZIZ 5 | G729: D TAYLOR 2 | J729: MANSFIELD | M729: O'CONNOR
A730: SANDRINGHAM | D730: FOLEY 2 | G730: MITCHELSON 2 | K730: CROUGH | M730: SUTTON | O730: SMITH
A732: BYE | D732: FRANKSTON
A734: ROUND 16 | D734: 27TH JULY | J734: WEATHER | S734: Venue: PORT MELBOURNE
D735: 1ST QTR | H735: 2ND QTR | L735: 3RD QTR | P735: FINAL | S735: UMPIRES | V735: SEXTON
A736: PORT MELBOURNE | C736: 4 | D736: 2 | E736: =(C736*6)+D736 -> 26 | G736: 9 | H736: 7 | I736: =(G736*6)+H736 -> 61 | K736: 14 | L736: 10 | M736: =(K736*6)+L736 -> 94 | O736: 17 | P736: 11 | Q736: =(O736*6)+P736 -> 113 | S736: KANIZAY | Z736: LADDER | AC736: ROUND | AE736: 16
A737: WILLIAMSTOWN | C737: 6 | D737: 0 | E737: =(C737*6)+D737 -> 36 | G737: 10 | H737: 4 | I737: =(G737*6)+H737 -> 64 | K737: 15 | L737: 7 | M737: =(K737*6)+L737 -> 97 | O737: 17 | P737: 11 | Q737: =(O737*6)+P737 -> 113 | S737: GOODRIDGE
A738: BEST PLAYERS | W738: TEAM | X738: B | Y738: W | Z738: L | AA738: D | AB738: FOR | AC738: AGST | AD738: % | AE738: PTS
A739: PORT MELBOURNE | D739: CHEEL | G739: BOWDEN | J739: McGEE | M739: DOCHERTY | P739: BAILEY | R739: HARKINS
A740: WILLIAMSTOWN | D740: HORE | G740: PASTORE | J740: WEST | M740: DELRE | P740: O'KEEFE | R740: McGOWAN | W740: FRANKSTON | X740: 2 | Y740: 13 | Z740: 1 | AA740: 0 | AB740: 1662 | AC740: 830 | AD740: =(AB740/AC740)*100 -> 200.24096385542168 | AE740: =(Y740*4)+(AA740*2) -> 52
A741: GOALKICKERS | P741: SEXTON | R741: McGEE | W741: WERRIBEE | X741: 2 | Y741: 11 | Z741: 3 | AA741: 0 | AB741: 1266 | AC741: 910 | AD741: =(AB741/AC741)*100 -> 139.12087912087912 | AE741: =(Y741*4)+(AA741*2) -> 44
A742: PORT MELBOURNE | D742: KERSHAW 5 | G742: DOCHERTY 3 | J742: HOLLOW 2 | M742: CHEEL 2 | O742: HARKINS 2 | R742: BAILEY | W742: WILLIAMSTOWN | X742: 1 | Y742: 9 | Z742: 5 | AA742: 1 | AB742: 1410 | AC742: 1330 | AD742: =(AB742/AC742)*100 -> 106.01503759398496 | AE742: =(Y742*4)+(AA742*2) -> 38
A743: WILLIAMSTOWN | D743: GHAZI 4 | F743: O'KEEFE 3 | I743: DELRE 2 | K743: McGOWAN | M743: SHANKS | O743: FRASER | Q743: PASTORE | W743: SPRINGVALE | X743: 2 | Y743: 9 | Z743: 5 | AA743: 0 | AB743: 1308 | AC743: 897 | AD743: =(AB743/AC743)*100 -> 145.81939799331104 | AE743: =(Y743*4)+(AA743*2) -> 36
D744: 28TH JULY | J744: WEATHER | M744: COPELAND | O744: DOOLEY | Q744: LLOYD | S744: Venue: COBURG | W744: PORT MELBOURNE | X744: 2 | Y744: 8 | Z744: 5 | AA744: 1 | AB744: 1247 | AC744: 1180 | AD744: =(AB744/AC744)*100 -> 105.67796610169491 | AE744: =(Y744*4)+(AA744*2) -> 34
A745: FRANKSTON | C745: 4 | D745: 3 | E745: =(C745*6)+D745 -> 27 | G745: 10 | H745: 5 | I745: =(G745*6)+H745 -> 65 | K745: 14 | L745: 8 | M745: =(K745*6)+L745 -> 92 | O745: 18 | P745: 12 | Q745: =(O745*6)+P745 -> 120 | S745: ADAMS
A746: COBURG | C746: 2 | D746: 2 | E746: =(C746*6)+D746 -> 14 | G746: 4 | H746: 4 | I746: =(G746*6)+H746 -> 28 | K746: 6 | L746: 10 | M746: =(K746*6)+L746 -> 46 | O746: 12 | P746: 12 | Q746: =(O746*6)+P746 -> 84 | S746: MALCOLM | W746: SANDRINGHAM | X746: 2 | Y746: 7 | Z746: 7 | AA746: 0 | AB746: 1137 | AC746: 1245 | AD746: =(AB746/AC746)*100 -> 91.325301204819283 | AE746: =(Y746*4)+(AA746*2) -> 28
A747: BEST PLAYERS | S747: KELSEY | W747: COBURG | X747: 1 | Y747: 6 | Z747: 9 | AA747: 0 | AB747: 1341 | AC747: 1722 | AD747: =(AB747/AC747)*100 -> 77.874564459930312 | AE747: =(Y747*4)+(AA747*2) -> 24
A748: FRANKSTON | D748: D CLARKE | G748: PICKERING | J748: TAYLOR | M748: POLLOCK | P748: RYAN | W748: NORTH BALLARAT | X748: 2 | Y748: 5 | Z748: 9 | AA748: 0 | AB748: 1026 | AC748: 1119 | AD748: =(AB748/AC748)*100 -> 91.689008042895438 | AE748: =(Y748*4)+(AA748*2) -> 20
A749: COBURG | D749: INGRAM | G749: PORTER | J749: ALESSIO | M749: STANLEY | P749: AUBREY | R749: BAKER | W749: BOX HILL | X749: 1 | Y749: 5 | Z749: 10 | AA749: 0 | AB749: 1111 | AC749: 1463 | AD749: =(AB749/AC749)*100 -> 75.939849624060145 | AE749: =(Y749*4)+(AA749*2) -> 20
A750: GOALKICKERS | Q750: TAYLOR | W750: PRESTON | X750: 2 | Y750: 4 | Z750: 10 | AA750: 0 | AB750: 983 | AC750: 1201 | AD750: =(AB750/AC750)*100 -> 81.848459616985849 | AE750: =(Y750*4)+(AA750*2) -> 16
A751: FRANKSTON | D751: MEAD 4 | F751: MILLANE 3 | I751: McQUEEN 3 | L751: BOWEY 2 | N751: BURNELL 2 | Q751: GEORGE 2 | S751: STUBBS | W751: TRARALGON | X751: 1 | Y751: 1 | Z751: 14 | AA751: 0 | AB751: 1028 | AC751: 1757 | AD751: =(AB751/AC751)*100 -> 58.5088218554354 | AE751: =(Y751*4)+(AA751*2) -> 4
A752: COBURG | D752: DALE 5 | G752: BAKER 2 | J752: EVANS 2 | M752: KNIGHTS | O752: NAPOLI | Q752: INGRAM
A754: PRESTON | C754: 2 | D754: 2 | E754: =(C754*6)+D754 -> 14 | G754: 4 | H754: 8 | I754: =(G754*6)+H754 -> 32 | K754: 8 | L754: 13 | M754: =(K754*6)+L754 -> 61 | O754: 10 | P754: 18 | Q754: =(O754*6)+P754 -> 78 | S754: Venue: BEACH ROAD
A755: SANDRINGHAM | C755: 1 | D755: 5 | E755: =(C755*6)+D755 -> 11 | G755: 5 | H755: 9 | I755: =(G755*6)+H755 -> 39 | K755: 7 | L755: 10 | M755: =(K755*6)+L755 -> 52 | O755: 10 | P755: 14 | Q755: =(O755*6)+P755 -> 74 | S755: VOZZO :JONES :SHEARER
A756: BEST PLAYERS
A757: PRESTON | D757: LUCAS | G757: MAIORANA | J757: BOOKER | M757: DOBELL | O757: M AIELLO | R757: PLUNKETT
A758: SANDRINGHAM | D758: McCONVIL | G758: OAKLEY | J758: COGHLAN | M758: SNOOKS | O758: TEMPLETON
A759: GOALKICKERS
A760: PRESTON | D760: PLUNKETT 2 | G760: DOBELL 2 | I760: McLAUGHLIN 2 | L760: BLAGROVE | N760: LUCAS | P760: MALLON | R760: WILSON
A761: SANDRINGHAM | D761: SNOOKS 4 | G761: SCOTT-BRANIGAN 3 | K761: MITCHELSON | N761: TEMPLETON | Q761: MALONEY
A763: WERRIBEE | C763: 4 | D763: 1 | E763: =(C763*6)+D763 -> 25 | G763: 8 | H763: 7 | I763: =(G763*6)+H763 -> 55 | K763: 11 | L763: 8 | M763: =(K763*6)+L763 -> 74 | O763: 16 | P763: 11 | Q763: =(O763*6)+P763 -> 107 | S763: Venue: TRARALGON
A764: TRARALGON | C764: 1 | D764: 3 | E764: =(C764*6)+D764 -> 9 | G764: 4 | H764: 4 | I764: =(G764*6)+H764 -> 28 | K764: 9 | L764: 6 | M764: =(K764*6)+L764 -> 60 | O764: 14 | P764: 7 | Q764: =(O764*6)+P764 -> 91 | S764: EDWARDS :MASON :PRITCHARD
A765: BEST PLAYERS
A766: WERRIBEE | D766: MURPHY | G766: TAYLOR | J766: AZIZ | M766: MITCHELL | P766: ROACH | R766: EDWARDS
A767: TRARALGON | D767: JENNINGS | G767: MORLEY | J767: McGANNON | M767: SHERRIF | P767: GARNER | R767: VINCENT
A768: GOALKICKERS
A769: WERRIBEE | D769: AZIZ 8 | G769: TAYLOR 3 | J769: SATTERLEY | M769: SAUNDERS | O769: ROACH | Q769: McCARTHY | T769: BUTTON
A770: TRARALGON | D770: M STOCKDALE 3 | H770: P STOCKDALE 2 | K770: McCULLOCH 2 | N770: JENNINGS 2 | Q770: GARNER 2 | T770: MORLEY | W770: BURRIDGE | X770: HALL
A772: BOX HILL | C772: 2 | D772: 7 | E772: =(C772*6)+D772 -> 19 | G772: 4 | H772: 10 | I772: =(G772*6)+H772 -> 34 | K772: 6 | L772: 15 | M772: =(K772*6)+L772 -> 51 | O772: 7 | P772: 17 | Q772: =(O772*6)+P772 -> 59 | S772: Venue: BOX HILL
A773: SPRINGVALE | C773: 2 | D773: 1 | E773: =(C773*6)+D773 -> 13 | G773: 5 | H773: 3 | I773: =(G773*6)+H773 -> 33 | K773: 6 | L773: 6 | M773: =(K773*6)+L773 -> 42 | O773: 7 | P773: 8 | Q773: =(O773*6)+P773 -> 50 | S773: DAVIDSON :MANN :TWITT
A774: BEST PLAYERS
A775: BOX HILL | D775: LIVINGSTONE | G775: PAYNE | J775: PORTER | M775: CROWLEY | P775: GRIFFEN | R775: SLATER
A776: SPRINGVALE | D776: DELARUE | G776: SMITH | J776: DILLON | M776: CLARK | P776: JEFFS | R776: LITTLE
A777: GOALKICKERS
A778: BOX HILL | D778: DOWER 2 | G778: WILKINSON 2 | K778: PORTER | M778: BOURKE | O778: LIVINGSTONE
A779: SPRINGVALE | D779: SMITH 3 | G779: BALDWIN | J779: YEATS | L779: CAPSALIS | O779: EVANS
A781: BYE | D781: NORTH BALLARAT
A783: ROUND 17 | D783: 3RD AUGUST | J783: WEATHER | S783: Venue: COBURG
D784: 1ST QTR | H784: 2ND QTR | L784: 3RD QTR | P784: FINAL | S784: UMPIRES
A785: WERRIBEE | C785: 3 | D785: 2 | E785: =(C785*6)+D785 -> 20 | G785: 5 | H785: 3 | I785: =(G785*6)+H785 -> 33 | K785: 7 | L785: 7 | M785: =(K785*6)+L785 -> 49 | O785: 9 | P785: 12 | Q785: =(O785*6)+P785 -> 66 | Z785: LADDER | AC785: ROUND | AE785: 17
A786: COBURG | C786: 1 | D786: 5 | E786: =(C786*6)+D786 -> 11 | G786: 4 | H786: 5 | I786: =(G786*6)+H786 -> 29 | K786: 6 | L786: 6 | M786: =(K786*6)+L786 -> 42 | O786: 9 | P786: 7 | Q786: =(O786*6)+P786 -> 61
A787: BEST PLAYERS | W787: TEAM | X787: B | Y787: W | Z787: L | AA787: D | AB787: FOR | AC787: AGST | AD787: % | AE787: PTS
A788: WERRIBEE | D788: CHURCHILL | G788: MITCHELL | J788: EDWARDS | M788: MANSFIELD | P788: SPEAR | R788: DIROSA
A789: COBURG | D789: AUBREY | G789: INGRAM | J789: DALE | M789: ALESSIO | P789: McLEOD | R789: SOLOMON | W789: FRANKSTON | X789: 2 | Y789: 13 | Z789: 2 | AA789: 0 | AB789: 1738 | AC789: 933 | AD789: =(AB789/AC789)*100 -> 186.2808145766345 | AE789: =(Y789*4)+(AA789*2) -> 52
A790: GOALKICKERS | W790: WERRIBEE | X790: 2 | Y790: 12 | Z790: 3 | AA790: 0 | AB790: 1332 | AC790: 971 | AD790: =(AB790/AC790)*100 -> 137.178166838311 | AE790: =(Y790*4)+(AA790*2) -> 48
A791: WERRIBEE | D791: CHURCHILL 3 | G791: AZIZ 2 | J791: SHANNON 2 | M791: EDWARDS 2 | W791: WILLIAMSTOWN | X791: 1 | Y791: 10 | Z791: 5 | AA791: 1 | AB791: 1482 | AC791: 1383 | AD791: =(AB791/AC791)*100 -> 107.15835140997831 | AE791: =(Y791*4)+(AA791*2) -> 42
A792: COBURG | D792: DALE 5 | G792: ALESSIO 3 | J792: WESTON | W792: SPRINGVALE | X792: 2 | Y792: 10 | Z792: 5 | AA792: 0 | AB792: 1411 | AC792: 973 | AD792: =(AB792/AC792)*100 -> 145.01541623843781 | AE792: =(Y792*4)+(AA792*2) -> 40
D793: 4TH AUGUST | J793: WEATHER | W793: PORT MELBOURNE | X793: 2 | Y793: 8 | Z793: 6 | AA793: 1 | AB793: 1274 | AC793: 1278 | AD793: =(AB793/AC793)*100 -> 99.687010954616582 | AE793: =(Y793*4)+(AA793*2) -> 34
A794: SPRINGVALE | C794: 3 | D794: 2 | E794: =(C794*6)+D794 -> 20 | G794: 6 | H794: 3 | I794: =(G794*6)+H794 -> 39 | K794: 11 | L794: 5 | M794: =(K794*6)+L794 -> 71 | O794: 16 | P794: 7 | Q794: =(O794*6)+P794 -> 103 | S794: Venue: FRANKSTON
A795: FRANKSTON | C795: 4 | D795: 5 | E795: =(C795*6)+D795 -> 29 | G795: 7 | H795: 12 | I795: =(G795*6)+H795 -> 54 | K795: 8 | L795: 13 | M795: =(K795*6)+L795 -> 61 | O795: 10 | P795: 16 | Q795: =(O795*6)+P795 -> 76 | S795: VOZZO | W795: SANDRINGHAM | X795: 2 | Y795: 8 | Z795: 7 | AA795: 0 | AB795: 1271 | AC795: 1318 | AD795: =(AB795/AC795)*100 -> 96.433990895295906 | AE795: =(Y795*4)+(AA795*2) -> 32
A796: BEST PLAYERS | W796: NORTH BALLARAT | X796: 2 | Y796: 6 | Z796: 9 | AA796: 0 | AB796: 1124 | AC796: 1146 | AD796: =(AB796/AC796)*100 -> 98.080279232111693 | AE796: =(Y796*4)+(AA796*2) -> 24
A797: SPRINGVALE | D797: CLARK | G797: D CARROLL | J797: EVANS | M797: COURTNEY | P797: DILLON | R797: WOODMAN | W797: COBURG | X797: 1 | Y797: 6 | Z797: 10 | AA797: 0 | AB797: 1402 | AC797: 1788 | AD797: =(AB797/AC797)*100 -> 78.411633109619686 | AE797: =(Y797*4)+(AA797*2) -> 24
A798: FRANKSTON | D798: MOORE | G798: POLLOCK | J798: FREEMAN | M798: MILLANE | P798: DAM CLARKE | W798: BOX HILL | X798: 1 | Y798: 5 | Z798: 11 | AA798: 0 | AB798: 1184 | AC798: 1597 | AD798: =(AB798/AC798)*100 -> 74.139010644959299 | AE798: =(Y798*4)+(AA798*2) -> 20
A799: GOALKICKERS | P799: LIELNORS | S799: CAPSALIS | W799: PRESTON | X799: 2 | Y799: 4 | Z799: 11 | AA799: 0 | AB799: 1036 | AC799: 1273 | AD799: =(AB799/AC799)*100 -> 81.382560879811479 | AE799: =(Y799*4)+(AA799*2) -> 16
A800: SPRINGVALE | D800: EVANS 4 | F800: COURTNEY 3 | I800: DILLON 2 | K800: WOODMAN 2 | N800: TAYLOR | P800: J SMITH | R800: O'DONNELL | W800: TRARALGON | X800: 2 | Y800: 1 | Z800: 14 | AA800: 0 | AB800: 1028 | AC800: 1757 | AD800: =(AB800/AC800)*100 -> 58.5088218554354 | AE800: =(Y800*4)+(AA800*2) -> 4
A801: FRANKSTON | D801: MILLANE 3 | G801: L TAYLOR | J801: GEORGE | L801: S RYAN | N801: A PICKERING | Q801: RHYS-JONES | T801: MEAD
P802: BOWEY
A803: NORTH BALLARAT | C803: 5 | D803: 3 | E803: =(C803*6)+D803 -> 33 | G803: 7 | H803: 4 | I803: =(G803*6)+H803 -> 46 | K803: 11 | L803: 11 | M803: =(K803*6)+L803 -> 77 | O803: 14 | P803: 14 | Q803: =(O803*6)+P803 -> 98 | S803: Venue: NORTH BALLARAT
A804: PORT MELBOURNE | C804: 0 | D804: 2 | E804: =(C804*6)+D804 -> 2 | G804: 2 | H804: 6 | I804: =(G804*6)+H804 -> 18 | K804: 2 | L804: 8 | M804: =(K804*6)+L804 -> 20 | O804: 3 | P804: 9 | Q804: =(O804*6)+P804 -> 27
A805: BEST PLAYERS
A806: NORTH BALLARAT | D806: VENNER | G806: T POLKINGHORNE | K806: BUNN | N806: DISNEY | P806: G POLKINGHORNE
A807: PORT MELBOURNE | D807: SEXTON | G807: BALLANTYNE | K807: PEKIN | N807: BUTTERWORTH
A808: GOALKICKERS
A809: NORTH BALLARAT | D809: PARTINGTON 3 | G809: DISNEY 3 | I809: SHARP 2 | K809: EZARD 2 | M809: BROADBENT 2 | P809: LAWLEY | R809: JENSEN
A810: PORT MELBOURNE | D810: KERSHAW 2 | G810: WEEDING
A812: SANDRINGHAM | C812: 7 | D812: 3 | E812: =(C812*6)+D812 -> 45 | G812: 12 | H812: 4 | I812: =(G812*6)+H812 -> 76 | K812: 17 | L812: 5 | M812: =(K812*6)+L812 -> 107 | O812: 21 | P812: 8 | Q812: =(O812*6)+P812 -> 134 | S812: Venue: BEACH ROAD
A813: BOX HILL | C813: 2 | D813: 2 | E813: =(C813*6)+D813 -> 14 | G813: 2 | H813: 5 | I813: =(G813*6)+H813 -> 17 | K813: 6 | L813: 9 | M813: =(K813*6)+L813 -> 45 | O813: 10 | P813: 13 | Q813: =(O813*6)+P813 -> 73
A814: BEST PLAYERS
A815: SANDRINGHAM | D815: HERMAN | G815: ANGUS | J815: FOLEY | M815: McCONVIL | P815: MITCHELSON | S815: KELLAWAY
A816: BOX HILL | D816: CROWLEY | G816: SLATER | J816: WILKINSON
A817: GOALKICKERS
A818: SANDRINGHAM | D818: SNOOKS 5 | G818: MITCHELSON 4 | J818: FOLEY 3 | L818: S SMITH 3 | N818: SCOTT-BRANIGAN 3 | R818: KELLAWAY | V818: M SMITH | Y818: CLARKSON
A819: BOX HILL | D819: BISHOP 2 | G819: ROWE 2 | J819: ALLSOP | L819: BREWER | N819: CRISP | P819: O'NEILL | R819: PORTER | V819: SLATER
A821: WILLIAMSTOWN | C821: 3 | D821: 0 | E821: =(C821*6)+D821 -> 18 | G821: 7 | H821: 5 | I821: =(G821*6)+H821 -> 47 | K821: 8 | L821: 10 | M821: =(K821*6)+L821 -> 58 | O821: 10 | P821: 12 | Q821: =(O821*6)+P821 -> 72 | S821: Venue: WILLIAMSTOWN
A822: PRESTON | C822: 3 | D822: 7 | E822: =(C822*6)+D822 -> 25 | G822: 4 | H822: 7 | I822: =(G822*6)+H822 -> 31 | K822: 7 | L822: 10 | M822: =(K822*6)+L822 -> 52 | O822: 7 | P822: 11 | Q822: =(O822*6)+P822 -> 53
A823: BEST PLAYERS
A824: WILLIAMSTOWN | D824: P DOOLEY | G824: COPELAND | J824: WEST | L824: O'KEEFE | O824: J MAHONEY | R824: PASTORE
A825: PRESTON | D825: M AIELLO | G825: MORISSEY | J825: PLUNKETT | L825: DUSSI
A826: GOALKICKERS
A827: WILLIAMSTOWN | D827: O'KEEFE 7 | G827: JOHANSEN 2 | J827: FRASER
A828: PRESTON | D828: AIELLO 2 | G828: PLUNKETT 2 | J828: HABERMAN | M828: BOOKER | O828: MALLON
A830: BYE | D830: TRARALGON
A832: ROUND 18 | D832: 10TH AUGUST | J832: WEATHER | S832: Venue: PORT MELBOURNE
D833: 1ST QTR | H833: 2ND QTR | L833: 3RD QTR | P833: FINAL | S833: UMPIRES | V833: SHEARER
A834: PORT MELBOURNE | C834: 2 | D834: 4 | E834: =(C834*6)+D834 -> 16 | G834: 3 | H834: 5 | I834: =(G834*6)+H834 -> 23 | K834: 8 | L834: 6 | M834: =(K834*6)+L834 -> 54 | O834: 12 | P834: 9 | Q834: =(O834*6)+P834 -> 81 | S834: VOZZO | Z834: LADDER | AC834: ROUND | AE834: 18
A835: WERRIBEE | C835: 3 | D835: 5 | E835: =(C835*6)+D835 -> 23 | G835: 6 | H835: 8 | I835: =(G835*6)+H835 -> 44 | K835: 9 | L835: 10 | M835: =(K835*6)+L835 -> 64 | O835: 9 | P835: 12 | Q835: =(O835*6)+P835 -> 66 | S835: TWITT
A836: BEST PLAYERS | W836: TEAM | X836: B | Y836: W | Z836: L | AA836: D | AB836: FOR | AC836: AGST | AD836: % | AE836: PTS
A837: PORT MELBOURNE | D837: R BOWDEN | G837: CAMPBELL | J837: SEXTON | M837: McGEE | O837: KERSHAW
A838: WERRIBEE | D838: CHURCHILL | G838: MITCHELL | J838: MURPHY | M838: WRIGHT | O838: MAXWELL | W838: FRANKSTON | X838: 2 | Y838: 14 | Z838: 2 | AA838: 0 | AB838: 1802 | AC838: 980 | AD838: =(AB838/AC838)*100 -> 183.87755102040816 | AE838: =(Y838*4)+(AA838*2) -> 56
A839: GOALKICKERS | W839: WERRIBEE | X839: 2 | Y839: 12 | Z839: 4 | AA839: 0 | AB839: 1398 | AC839: 1052 | AD839: =(AB839/AC839)*100 -> 132.88973384030419 | AE839: =(Y839*4)+(AA839*2) -> 48
A840: PORT MELBOURNE | D840: KERSHAW 6 | G840: McGEE 3 | J840: R BOWDEN | M840: HARKINS | O840: BUTTERWORTH | W840: WILLIAMSTOWN | X840: 1 | Y840: 10 | Z840: 6 | AA840: 1 | AB840: 1529 | AC840: 1447 | AD840: =(AB840/AC840)*100 -> 105.66689702833449 | AE840: =(Y840*4)+(AA840*2) -> 42
A841: WERRIBEE | D841: CHURCHILL 2 | G841: AZIZ 2 | J841: SPROULE 2 | M841: EDWARDS 2 | P841: MURPHY | W841: SPRINGVALE | X841: 2 | Y841: 10 | Z841: 6 | AA841: 0 | AB841: 1463 | AC841: 1035 | AD841: =(AB841/AC841)*100 -> 141.35265700483092 | AE841: =(Y841*4)+(AA841*2) -> 40
D842: 11TH AUGUST | J842: WEATHER | S842: Venue: PRESTON | W842: PORT MELBOURNE | X842: 2 | Y842: 9 | Z842: 6 | AA842: 1 | AB842: 1355 | AC842: 1344 | AD842: =(AB842/AC842)*100 -> 100.81845238095238 | AE842: =(Y842*4)+(AA842*2) -> 38
A843: PRESTON | C843: 3 | D843: 4 | E843: =(C843*6)+D843 -> 22 | G843: 4 | H843: 5 | I843: =(G843*6)+H843 -> 29 | K843: 6 | L843: 8 | M843: =(K843*6)+L843 -> 44 | O843: 8 | P843: 10 | Q843: =(O843*6)+P843 -> 58 | S843: DELLER
A844: NORTH BALLARAT | C844: 0 | D844: 0 | E844: =(C844*6)+D844 -> 0 | G844: 0 | H844: 2 | I844: =(G844*6)+H844 -> 2 | K844: 1 | L844: 6 | M844: =(K844*6)+L844 -> 12 | O844: 3 | P844: 7 | Q844: =(O844*6)+P844 -> 25 | S844: HEAD | W844: SANDRINGHAM | X844: 2 | Y844: 9 | Z844: 7 | AA844: 0 | AB844: 1333 | AC844: 1370 | AD844: =(AB844/AC844)*100 -> 97.299270072992698 | AE844: =(Y844*4)+(AA844*2) -> 36
A845: BEST PLAYERS | S845: GOODRIDGE | W845: COBURG | X845: 1 | Y845: 7 | Z845: 10 | AA845: 0 | AB845: 1573 | AC845: 1876 | AD845: =(AB845/AC845)*100 -> 83.848614072494669 | AE845: =(Y845*4)+(AA845*2) -> 28
A846: PRESTON | D846: MAIORANA | G846: D LUCAS | J846: BOOKER | M846: M AIELLO | O846: MORRISSEY | R846: WILSON | W846: NORTH BALLARAT | X846: 2 | Y846: 6 | Z846: 10 | AA846: 0 | AB846: 1149 | AC846: 1204 | AD846: =(AB846/AC846)*100 -> 95.431893687707642 | AE846: =(Y846*4)+(AA846*2) -> 24
A847: NORTH BALLARAT | D847: QUILAN | G847: BROADBENT | J847: BUNN | M847: RYAN | O847: T POLKINGHORNE | W847: PRESTON | X847: 2 | Y847: 5 | Z847: 11 | AA847: 0 | AB847: 1094 | AC847: 1298 | AD847: =(AB847/AC847)*100 -> 84.283513097072415 | AE847: =(Y847*4)+(AA847*2) -> 20
A848: GOALKICKERS | W848: BOX HILL | X848: 2 | Y848: 5 | Z848: 11 | AA848: 0 | AB848: 1184 | AC848: 1597 | AD848: =(AB848/AC848)*100 -> 74.139010644959299 | AE848: =(Y848*4)+(AA848*2) -> 20
A849: PRESTON | D849: GRAINGER 2 | G849: McCREDDIN 2 | K849: CARELLI | M849: PLUNKETT | O849: M LUCAS | Q849: HAYDOCK | W849: TRARALGON | X849: 2 | Y849: 1 | Z849: 15 | AA849: 0 | AB849: 1116 | AC849: 1928 | AD849: =(AB849/AC849)*100 -> 57.8838174273859 | AE849: =(Y849*4)+(AA849*2) -> 4
A850: NORTH BALLARAT | D850: PARTINGTON | G850: FORD | I850: QUINLAN
A852: SANDRINGHAM | C852: 3 | D852: 4 | E852: =(C852*6)+D852 -> 22 | G852: 4 | H852: 9 | I852: =(G852*6)+H852 -> 33 | K852: 5 | L852: 13 | M852: =(K852*6)+L852 -> 43 | O852: 8 | P852: 14 | Q852: =(O852*6)+P852 -> 62 | S852: Venue: SPRINGVALE
A853: SPRINGVALE | C853: 1 | D853: 5 | E853: =(C853*6)+D853 -> 11 | G853: 5 | H853: 6 | I853: =(G853*6)+H853 -> 36 | K853: 7 | L853: 8 | M853: =(K853*6)+L853 -> 50 | O853: 7 | P853: 10 | Q853: =(O853*6)+P853 -> 52 | S853: JAMES :SEXTON :KANIZAY
A854: BEST PLAYERS
A855: SANDRINGHAM | D855: MARTELLO | G855: FOLEY | J855: McCONVIL | M855: FRATER | O855: COGHLAN | R855: MALONEY
A856: SPRINGVALE | D856: J CARROLL | G856: CAPLES | J856: COURTNEY | M856: EVANS | O856: TAYLOR
A857: GOALKICKERS
A858: SANDRINGHAM | D858: FOLEY 2 | G858: SCOTT-BRANIGAN 2 | L858: SMITH | N858: SNOOKS | P858: MARTELLO | R858: ANGUS
A859: SPRINGVALE | D859: COURTNEY 2 | G859: EVANS 2 | J859: DAVISON | L859: WOODMAN | N859: SMITH
A861: COBURG | C861: 8 | D861: 6 | E861: =(C861*6)+D861 -> 54 | G861: 15 | H861: 9 | I861: =(G861*6)+H861 -> 99 | K861: 24 | L861: 12 | M861: =(K861*6)+L861 -> 156 | O861: 26 | P861: 15 | Q861: =(O861*6)+P861 -> 171 | S861: Venue: TRARALGON
A862: TRARALGON | C862: 4 | D862: 2 | E862: =(C862*6)+D862 -> 26 | G862: 5 | H862: 4 | I862: =(G862*6)+H862 -> 34 | K862: 7 | L862: 7 | M862: =(K862*6)+L862 -> 49 | O862: 13 | P862: 10 | Q862: =(O862*6)+P862 -> 88 | S862: KELSEY :DAVIDSON :BEARD
A863: BEST PLAYERS
A864: COBURG | D864: STANLEY | G864: McLEOD | J864: ZIROS | M864: INGRAM | O864: ALESSIO | R864: AUBREY
A865: TRARALGON | D865: MORLEY | G865: CAMPBELL | J865: MURRAY | M865: BURRIDGE | O865: VINCENT | R865: McGANNON
A866: GOALKICKERS
A867: COBURG | D867: ALESSIO 5 | F867: DALE 5 | H867: WESTON 4 | J867: STANLEY 3 | M867: INGRAM 2 | P867: ZIROS 2 | R867: NAPOLI | U867: TARANTO | X867: BAKER | Z867: FITZPATRICK | AC867: AUBREY
A868: TRARALGON | D868: BURRIDGE 4 | G868: McCULLOCH 3 | J868: P STOCKDALE | M868: M STOCKDALE | P868: FORYS | R868: GARNER | V868: MORLEY | X868: FOSTER
A870: FRANKSTON | C870: 0 | D870: 0 | E870: =(C870*6)+D870 -> 0 | G870: 4 | H870: 3 | I870: =(G870*6)+H870 -> 27 | K870: 6 | L870: 7 | M870: =(K870*6)+L870 -> 43 | O870: 9 | P870: 10 | Q870: =(O870*6)+P870 -> 64 | S870: Venue: WILLIAMSTOWN
A871: WILLIAMSTOWN | C871: 5 | D871: 3 | E871: =(C871*6)+D871 -> 33 | G871: 5 | H871: 3 | I871: =(G871*6)+H871 -> 33 | K871: 6 | L871: 4 | M871: =(K871*6)+L871 -> 40 | O871: 7 | P871: 5 | Q871: =(O871*6)+P871 -> 47
A872: BEST PLAYERS
A873: FRANKSTON | D873: BOWEY | G873: McKAY | J873: PICKERING | M873: DAM CLARKE | P873: MOORE
A874: WILLIAMSTOWN | D874: HOUGH | G874: CARRICK | J874: COPELAND | M874: WEST | P874: O'KEEFE | S874: KERRY
A875: GOALKICKERS
A876: FRANKSTON | D876: McKAY 5 | G876: GEORGE | J876: BOWEY | M876: RYAN | O876: WEBB
A877: WILLIAMSTOWN | D877: O'KEEFE 3 | G877: DELRE | J877: CARRICK | M877: GHAZI | O877: PASTORE
A879: BYE | D879: BOX HILL
A881: ROUND 19 | D881: 17TH AUGUST | J881: WEATHER | S881: Venue: WERRIBEE
D882: 1ST QTR | H882: 2ND QTR | L882: 3RD QTR | P882: FINAL | S882: UMPIRES | V882: MALCOLM
A883: SPRINGVALE | C883: 2 | D883: 3 | E883: =(C883*6)+D883 -> 15 | G883: 4 | H883: 8 | I883: =(G883*6)+H883 -> 32 | K883: 11 | L883: 9 | M883: =(K883*6)+L883 -> 75 | O883: 15 | P883: 13 | Q883: =(O883*6)+P883 -> 103 | S883: MANN | Z883: LADDER | AC883: ROUND | AE883: 19
A884: WERRIBEE | C884: 0 | D884: 3 | E884: =(C884*6)+D884 -> 3 | G884: 1 | H884: 5 | I884: =(G884*6)+H884 -> 11 | K884: 4 | L884: 6 | M884: =(K884*6)+L884 -> 30 | O884: 5 | P884: 10 | Q884: =(O884*6)+P884 -> 40 | S884: RUSSO
A885: BEST PLAYERS | W885: TEAM | X885: B | Y885: W | Z885: L | AA885: D | AB885: FOR | AC885: AGST | AD885: % | AE885: PTS
A886: SPRINGVALE | D886: BURGMAN | G886: LITTLE | J886: SUTHERLAND | M886: O'DONNELL | P886: CLARKE | R886: J CARROLL
A887: WERRIBEE | D887: EAMES | G887: PURCELL | J887: SPROULE | M887: WRIGHT | P887: CHURCHILL | W887: FRANKSTON | X887: 2 | Y887: 15 | Z887: 2 | AA887: 0 | AB887: 1947 | AC887: 1026 | AD887: =(AB887/AC887)*100 -> 189.76608187134502 | AE887: =(Y887*4)+(AA887*2) -> 60
A888: GOALKICKERS | O888: LIELNORS | Q888: DELARUE | W888: WERRIBEE | X888: 2 | Y888: 12 | Z888: 5 | AA888: 0 | AB888: 1438 | AC888: 1155 | AD888: =(AB888/AC888)*100 -> 124.50216450216449 | AE888: =(Y888*4)+(AA888*2) -> 48
A889: SPRINGVALE | D889: SMITH 3 | F889: CAPSALIS 3 | I889: YEATS 2 | K889: EVANS 2 | M889: J CARROLL | P889: BALDWIN | R889: TAYLOR | W889: WILLIAMSTOWN | X889: 1 | Y889: 11 | Z889: 6 | AA889: 1 | AB889: 1591 | AC889: 1482 | AD889: =(AB889/AC889)*100 -> 107.3549257759784 | AE889: =(Y889*4)+(AA889*2) -> 46
A890: WERRIBEE | D890: EAMES | F890: AZIZ | H890: EDWARDS | J890: SAUNDERS | M890: SATTERLEY | W890: SPRINGVALE | X890: 2 | Y890: 11 | Z890: 6 | AA890: 0 | AB890: 1566 | AC890: 1075 | AD890: =(AB890/AC890)*100 -> 145.67441860465115 | AE890: =(Y890*4)+(AA890*2) -> 44
D891: 18TH AUGUST | J891: WEATHER | S891: Venue: BOX HILL | W891: PORT MELBOURNE | X891: 2 | Y891: 10 | Z891: 6 | AA891: 1 | AB891: 1451 | AC891: 1411 | AD891: =(AB891/AC891)*100 -> 102.83486888731397 | AE891: =(Y891*4)+(AA891*2) -> 42
A892: BOX HILL | C892: 1 | D892: 2 | E892: =(C892*6)+D892 -> 8 | G892: 11 | H892: 5 | I892: =(G892*6)+H892 -> 71 | K892: 14 | L892: 6 | M892: =(K892*6)+L892 -> 90 | O892: 20 | P892: 9 | Q892: =(O892*6)+P892 -> 129 | S892: ADAMS
A893: TRARALGON | C893: 6 | D893: 5 | E893: =(C893*6)+D893 -> 41 | G893: 8 | H893: 6 | I893: =(G893*6)+H893 -> 54 | K893: 10 | L893: 9 | M893: =(K893*6)+L893 -> 69 | O893: 14 | P893: 11 | Q893: =(O893*6)+P893 -> 95 | S893: KANIZAY | W893: SANDRINGHAM | X893: 2 | Y893: 9 | Z893: 8 | AA893: 0 | AB893: 1400 | AC893: 1466 | AD893: =(AB893/AC893)*100 -> 95.49795361527967 | AE893: =(Y893*4)+(AA893*2) -> 36
A894: BEST PLAYERS | S894: PRITCHARD | W894: COBURG | X894: 2 | Y894: 7 | Z894: 10 | AA894: 0 | AB894: 1573 | AC894: 1876 | AD894: =(AB894/AC894)*100 -> 83.848614072494669 | AE894: =(Y894*4)+(AA894*2) -> 28
A895: BOX HILL | D895: WILKINSON | G895: PAYNE | J895: LIVINGSTONE | M895: CROWLEY | P895: GRIFFEN | R895: GREIG | W895: NORTH BALLARAT | X895: 2 | Y895: 6 | Z895: 11 | AA895: 0 | AB895: 1184 | AC895: 1266 | AD895: =(AB895/AC895)*100 -> 93.522906793048975 | AE895: =(Y895*4)+(AA895*2) -> 24
A896: TRARALGON | D896: BURRIDGE | G896: RAYNER | J896: HEIL | M896: CUNNINGHAM | P896: MURRAY | R896: CAMPBELL | W896: BOX HILL | X896: 2 | Y896: 6 | Z896: 11 | AA896: 0 | AB896: 1319 | AC896: 1692 | AD896: =(AB896/AC896)*100 -> 77.95508274231679 | AE896: =(Y896*4)+(AA896*2) -> 24
A897: GOALKICKERS | Q897: GRIFFEN | W897: PRESTON | X897: 2 | Y897: 5 | Z897: 12 | AA897: 0 | AB897: 1140 | AC897: 1443 | AD897: =(AB897/AC897)*100 -> 79.002079002079 | AE897: =(Y897*4)+(AA897*2) -> 20
A898: BOX HILL | D898: WILKINSON 9 | G898: JOHNSON 3 | J898: BREWER 3 | M898: NOTT 2 | O898: PORTER | Q898: LIVINGSTONE | W898: TRARALGON | X898: 2 | Y898: 1 | Z898: 16 | AA898: 0 | AB898: 1211 | AC898: 2057 | AD898: =(AB898/AC898)*100 -> 58.872143898881866 | AE898: =(Y898*4)+(AA898*2) -> 4
A899: TRARALGON | D899: BURRIDGE 4 | G899: CUNNINGHAM 2 | J899: MORLEY 2 | M899: McCULLOCH 2 | P899: FORYS | R899: SMITH
L900: WOLFE | N900: RAYNER
A901: FRANKSTON | C901: 2 | D901: 3 | E901: =(C901*6)+D901 -> 15 | G901: 9 | H901: 5 | I901: =(G901*6)+H901 -> 59 | K901: 16 | L901: 9 | M901: =(K901*6)+L901 -> 105 | O901: 22 | P901: 13 | Q901: =(O901*6)+P901 -> 145 | S901: Venue: FRANKSTON
A902: PRESTON | C902: 2 | D902: 5 | E902: =(C902*6)+D902 -> 17 | G902: 5 | H902: 8 | I902: =(G902*6)+H902 -> 38 | K902: 5 | L902: 9 | M902: =(K902*6)+L902 -> 39 | O902: 6 | P902: 10 | Q902: =(O902*6)+P902 -> 46 | S902: NELIS :KELSEY :TWITT
A903: BEST PLAYERS
A904: FRANKSTON | D904: DAN CLARKE | G904: HOPGOOD | J904: S RYAN | L904: J PICKERING | O904: MILLANE
A905: PRESTON | D905: WILSON | G905: D LUCAS | J905: POWER | L905: HARDENBERG
A906: GOALKICKERS
A907: FRANKSTON | D907: MILLANE 4 | G907: WEBB 3 | I907: MEAD 3 | K907: McKAY 3 | M907: J PICKERING 2 | P907: A PICKERING 2 | S907: BOWEY 2 | V907: S RYAN 2 | X907: GEORGE
A908: PRESTON | D908: WILSON 4 | G908: BOOKER | J908: D LUCAS
A910: PORT MELBOURNE | C910: 3 | D910: 7 | E910: =(C910*6)+D910 -> 25 | G910: 5 | H910: 7 | I910: =(G910*6)+H910 -> 37 | K910: 9 | L910: 7 | M910: =(K910*6)+L910 -> 61 | O910: 14 | P910: 12 | Q910: =(O910*6)+P910 -> 96 | S910: Venue: BEACH ROAD
A911: SANDRINGHAM | C911: 3 | D911: 3 | E911: =(C911*6)+D911 -> 21 | G911: 6 | H911: 10 | I911: =(G911*6)+H911 -> 46 | K911: 8 | L911: 15 | M911: =(K911*6)+L911 -> 63 | O911: 8 | P911: 19 | Q911: =(O911*6)+P911 -> 67 | S911: GOODRIDGE :DAVIDSON :SHEARER
A912: BEST PLAYERS
A913: PORT MELBOURNE | D913: HOLLOW | G913: SEXTON | J913: McGEE | M913: BUTTERWORTH | P913: HOFFMAN | S913: DOYLE
A914: SANDRINGHAM | D914: COGHLAN | G914: FOLEY | J914: KELLAWAY | M914: McCONVIL | P914: SCOTT-BRANIGAN
A915: GOALKICKERS
A916: PORT MELBOURNE | D916: KERSHAW 4 | G916: R BOWDEN 2 | J916: HARKINS 2 | M916: SEXTON 2 | O916: HOFFMAN | Q916: JAMES | S916: BAILEY | V916: CAMPBELL
A917: SANDRINGHAM | D917: SCOTT-BRANIGAN 3 | H917: S SMITH | J917: MITCHELSON | M917: SNOOKS | O917: ANGUS | Q917: B SMITH
A919: WILLIAMSTOWN | C919: 2 | D919: 6 | E919: =(C919*6)+D919 -> 18 | G919: 3 | H919: 7 | I919: =(G919*6)+H919 -> 25 | K919: 7 | L919: 9 | M919: =(K919*6)+L919 -> 51 | O919: 8 | P919: 14 | Q919: =(O919*6)+P919 -> 62 | S919: Venue: NORTH BALLARAT
A920: NORTH BALLARAT | C920: 2 | D920: 1 | E920: =(C920*6)+D920 -> 13 | G920: 4 | H920: 4 | I920: =(G920*6)+H920 -> 28 | K920: 5 | L920: 4 | M920: =(K920*6)+L920 -> 34 | O920: 5 | P920: 5 | Q920: =(O920*6)+P920 -> 35 | S920: VOZZO :SEXTON :QUIGLEY
A921: BEST PLAYERS
A922: WILLIAMSTOWN | D922: PASTORE | G922: CARRICK | J922: WEST | L922: J MAHONEY | O922: ILICH | R922: DOOLEY
A923: NORTH BALLARAT | D923: QUILAN | G923: G POLKINHORNE | K923: ROSS | M923: PARTINGTON | P923: McLEAN | R923: T POLKINGHORNE
A924: GOALKICKERS
A925: WILLIAMSTOWN | D925: DELRE 3 | G925: LLOYD 2 | J925: FRASER | L925: L DOOLEY | O925: NICHOLSON
A926: NORTH BALLARAT | D926: SNIBSON | G926: BROADBENT | J926: EZARD | L926: HARRINGTON | O926: PARTINGTON
A928: BYE | D928: COBURG
A930: ROUND 20 | D930: 24TH AUGUST | J930: WEATHER | S930: Venue: BOX HILL
D931: 1ST QTR | H931: 2ND QTR | L931: 3RD QTR | P931: FINAL | S931: UMPIRES | V931: BEARD
A932: PORT MELBOURNE | C932: 2 | D932: 0 | E932: =(C932*6)+D932 -> 12 | G932: 7 | H932: 2 | I932: =(G932*6)+H932 -> 44 | K932: 8 | L932: 4 | M932: =(K932*6)+L932 -> 52 | O932: 14 | P932: 8 | Q932: =(O932*6)+P932 -> 92 | S932: DELLER | Z932: LADDER | AC932: ROUND | AE932: 20
A933: BOX HILL | C933: 0 | D933: 3 | E933: =(C933*6)+D933 -> 3 | G933: 2 | H933: 5 | I933: =(G933*6)+H933 -> 17 | K933: 4 | L933: 10 | M933: =(K933*6)+L933 -> 34 | O933: 7 | P933: 12 | Q933: =(O933*6)+P933 -> 54 | S933: MALCOLM
A934: BEST PLAYERS | W934: TEAM | X934: B | Y934: W | Z934: L | AA934: D | AB934: FOR | AC934: AGST | AD934: % | AE934: PTS
A935: PORT MELBOURNE | D935: SEXTON | G935: BALLANTYNE | J935: HOLLOW | M935: PEKIN | O935: CAMPBELL | R935: CAMERON
A936: BOX HILL | D936: BREWER | G936: CROWLEY | J936: GREIG | M936: BURR | O936: GRIFFEN | R936: PAYNE | W936: FRANKSTON | X936: 2 | Y936: 16 | Z936: 2 | AA936: 0 | AB936: 2111 | AC936: 1059 | AD936: =(AB936/AC936)*100 -> 199.33899905571292 | AE936: =(Y936*4)+(AA936*2) -> 64
A937: GOALKICKERS | O937: McGEE | Q937: CAMPBELL | W937: WERRIBEE | X937: 2 | Y937: 13 | Z937: 5 | AA937: 0 | AB937: 1602 | AC937: 1217 | AD937: =(AB937/AC937)*100 -> 131.63516844700084 | AE937: =(Y937*4)+(AA937*2) -> 52
A938: PORT MELBOURNE | D938: KERSHAW 5 | G938: R BOWDEN 2 | J938: REYNOLDS 2 | M938: DI BLASI | O938: BALLANTYNE | R938: M CHEEL | W938: SPRINGVALE | X938: 2 | Y938: 12 | Z938: 6 | AA938: 0 | AB938: 1671 | AC938: 1158 | AD938: =(AB938/AC938)*100 -> 144.30051813471502 | AE938: =(Y938*4)+(AA938*2) -> 48
A939: BOX HILL | D939: GRIFFEN | G939: PORTER | J939: GREIG | L939: JOHNSON | N939: ROWE | P939: BREWER | R939: LIVINGSTONE | W939: WILLIAMSTOWN | X939: 2 | Y939: 11 | Z939: 6 | AA939: 1 | AB939: 1591 | AC939: 1482 | AD939: =(AB939/AC939)*100 -> 107.3549257759784 | AE939: =(Y939*4)+(AA939*2) -> 46
D940: 25TH AUGUST | J940: WEATHER | S940: Venue: BEACH ROAD | W940: PORT MELBOURNE | X940: 2 | Y940: 11 | Z940: 6 | AA940: 1 | AB940: 1543 | AC940: 1465 | AD940: =(AB940/AC940)*100 -> 105.32423208191126 | AE940: =(Y940*4)+(AA940*2) -> 46
A941: FRANKSTON | C941: 6 | D941: 5 | E941: =(C941*6)+D941 -> 41 | G941: 13 | H941: 6 | I941: =(G941*6)+H941 -> 84 | K941: 19 | L941: 10 | M941: =(K941*6)+L941 -> 124 | O941: 25 | P941: 14 | Q941: =(O941*6)+P941 -> 164 | S941: PRITCHARD
A942: SANDRINGHAM | C942: 1 | D942: 0 | E942: =(C942*6)+D942 -> 6 | G942: 2 | H942: 3 | I942: =(G942*6)+H942 -> 15 | K942: 3 | L942: 6 | M942: =(K942*6)+L942 -> 24 | O942: 4 | P942: 9 | Q942: =(O942*6)+P942 -> 33 | S942: MANN | W942: SANDRINGHAM | X942: 2 | Y942: 9 | Z942: 9 | AA942: 0 | AB942: 1433 | AC942: 1630 | AD942: =(AB942/AC942)*100 -> 87.914110429447859 | AE942: =(Y942*4)+(AA942*2) -> 36
A943: BEST PLAYERS | S943: VOZZO | W943: COBURG | X943: 2 | Y943: 7 | Z943: 11 | AA943: 0 | AB943: 1656 | AC943: 1981 | AD943: =(AB943/AC943)*100 -> 83.594144371529538 | AE943: =(Y943*4)+(AA943*2) -> 28
A944: FRANKSTON | D944: FREEMAN | G944: POLLOCK | J944: RHYS-JONES | M944: BOWEY | O944: RYAN | R944: PICKERING | W944: NORTH BALLARAT | X944: 2 | Y944: 6 | Z944: 12 | AA944: 0 | AB944: 1246 | AC944: 1430 | AD944: =(AB944/AC944)*100 -> 87.132867132867133 | AE944: =(Y944*4)+(AA944*2) -> 24
A945: SANDRINGHAM | D945: COGHLAN | G945: FRATER | J945: MALONEY | M945: CLARKSON | W945: PRESTON | X945: 2 | Y945: 6 | Z945: 12 | AA945: 0 | AB945: 1283 | AC945: 1501 | AD945: =(AB945/AC945)*100 -> 85.476349100599606 | AE945: =(Y945*4)+(AA945*2) -> 24
A946: GOALKICKERS | M946: TAYLOR | O946: MOORE | Q946: RHYS-JONES | T946: WEBB | W946: BOX HILL | X946: 2 | Y946: 6 | Z946: 12 | AA946: 0 | AB946: 1373 | AC946: 1784 | AD946: =(AB946/AC946)*100 -> 76.961883408071756 | AE946: =(Y946*4)+(AA946*2) -> 24
A947: FRANKSTON | D947: McKAY 7 | F947: MILLANE 3 | I947: GEORGE 3 | K947: BOWEY 2 | M947: D CLARKE 2 | P947: S RYAN 2 | R947: MEAD 2 | W947: TRARALGON | X947: 2 | Y947: 1 | Z947: 17 | AA947: 0 | AB947: 1269 | AC947: 2200 | AD947: =(AB947/AC947)*100 -> 57.68181818181818 | AE947: =(Y947*4)+(AA947*2) -> 4
A948: SANDRINGHAM | D948: TEMPLETON 2 | H948: SNOOKS | J948: FRATER
A950: SPRINGVALE | C950: 4 | D950: 4 | E950: =(C950*6)+D950 -> 28 | G950: 8 | H950: 8 | I950: =(G950*6)+H950 -> 56 | K950: 13 | L950: 10 | M950: =(K950*6)+L950 -> 88 | O950: 15 | P950: 15 | Q950: =(O950*6)+P950 -> 105 | S950: Venue: SPRINGVALE
A951: COBURG | C951: 4 | D951: 2 | E951: =(C951*6)+D951 -> 26 | G951: 5 | H951: 4 | I951: =(G951*6)+H951 -> 34 | K951: 9 | L951: 8 | M951: =(K951*6)+L951 -> 62 | O951: 12 | P951: 11 | Q951: =(O951*6)+P951 -> 83 | S951: DAVIDSON :NELIS :MASON
A952: BEST PLAYERS
A953: SPRINGVALE | D953: J CARROLL | G953: COURTNEY | J953: YEATS | M953: EVANS | O953: D CARROLL | R953: LIELNORS
A954: COBURG | D954: PORTER | G954: McLEOD | J954: STANLEY | M954: INGRAM | O954: NAPOLI | R954: CERINI
A955: GOALKICKERS
A956: SPRINGVALE | D956: DAVISON 3 | G956: EVANS 3 | I956: J CARROLL 2 | L956: BALDWIN 2 | O956: COURTNEY | Q956: CLARK | S956: JEFFS | U956: DELARUE | X956: DILLON
A957: COBURG | D957: ALESSIO 2 | G957: ZIROS 2 | I957: NAPOLI 2 | L957: DALE 2 | N957: BAKER | P957: INGRAM | R957: FITZPATRICK | W957: WESTON
A959: PRESTON | C959: 5 | D959: 5 | E959: =(C959*6)+D959 -> 35 | G959: 10 | H959: 9 | I959: =(G959*6)+H959 -> 69 | K959: 16 | L959: 15 | M959: =(K959*6)+L959 -> 111 | O959: 21 | P959: 17 | Q959: =(O959*6)+P959 -> 143 | S959: Venue: TRARALGON
A960: TRARALGON | C960: 3 | D960: 0 | E960: =(C960*6)+D960 -> 18 | G960: 3 | H960: 2 | I960: =(G960*6)+H960 -> 20 | K960: 5 | L960: 4 | M960: =(K960*6)+L960 -> 34 | O960: 8 | P960: 10 | Q960: =(O960*6)+P960 -> 58 | S960: SHEARER :SEXTON :STEWART
A961: BEST PLAYERS
A962: PRESTON | D962: CARELLI | G962: WILSON | J962: MAIORANA | M962: POWER | O962: MUNRIVANA | R962: HARDENBERG
A963: TRARALGON | D963: VINCENT | G963: STOCKDALE | J963: RAYNER | M963: CAMERON | O963: HOPKINS | R963: CAMPBELL
A964: GOALKICKERS
A965: PRESTON | D965: WILSON 5 | G965: FLAVELL 4 | J965: CARELLI 3 | M965: BLAGROVE 3 | P965: M AIELLO 2 | S965: BOOKER 2 | W965: GRAINGER | Y965: LUCAS
A966: TRARALGON | D966: BURRIDGE 2 | G966: JENNINGS | J966: MORLEY | L966: RAYNER | N966: McCULLOCH | Q966: TRESIDER | S966: HAYWARD
A968: WERRIBEE | C968: 6 | D968: 1 | E968: =(C968*6)+D968 -> 37 | G968: 11 | H968: 3 | I968: =(G968*6)+H968 -> 69 | K968: 19 | L968: 5 | M968: =(K968*6)+L968 -> 119 | O968: 26 | P968: 8 | Q968: =(O968*6)+P968 -> 164 | S968: Venue: WERRIBEE
A969: NORTH BALLARAT | C969: 2 | D969: 1 | E969: =(C969*6)+D969 -> 13 | G969: 6 | H969: 2 | I969: =(G969*6)+H969 -> 38 | K969: 7 | L969: 5 | M969: =(K969*6)+L969 -> 47 | O969: 9 | P969: 8 | Q969: =(O969*6)+P969 -> 62 | S969: ADAMS :GILES :ROWE
A970: BEST PLAYERS
A971: WERRIBEE | D971: MANSFIELD | G971: CHURCHILL | J971: FITZPATRICK | M971: O'CONNOR | O971: SATTERLEY | R971: AZIZ
A972: NORTH BALLARAT | D972: T POLKINGHORNE | H972: SHARP | J972: G POLKINGHORNE
A973: GOALKICKERS
A974: WERRIBEE | D974: AZIZ 8 | F974: MANSFIELD 4 | I974: McDONALD 4 | L974: O'CONNOR 3 | O974: D TAYLOR 2 | R974: MAHONEY 2 | W974: MURPHY | Y974: A TAYLOR
A975: NORTH BALLARAT | D975: SHARP 3 | G975: QUINLAN 2 | J975: MADIGAN | M975: MURRIHY | O975: BUNN | Q975: HOOD
A977: BYE | D977: WILLIAMSTOWN
A979: FINALS
A980: ELIMINATION FINAL | E980: 1ST SEPTEMBER | J980: WEATHER
D981: 1ST QTR | H981: 2ND QTR | L981: 3RD QTR | P981: FINAL | S981: Venue: PORT MELBOURNE
A982: WILLIAMSTOWN | C982: 4 | D982: 8 | E982: =(C982*6)+D982 -> 32 | G982: 13 | H982: 10 | I982: =(G982*6)+H982 -> 88 | K982: 15 | L982: 14 | M982: =(K982*6)+L982 -> 104 | O982: 19 | P982: 19 | Q982: =(O982*6)+P982 -> 133 | S982: UMPIRES
A983: PORT MELBOURNE | C983: 5 | D983: 2 | E983: =(C983*6)+D983 -> 32 | G983: 11 | H983: 4 | I983: =(G983*6)+H983 -> 70 | K983: 14 | L983: 9 | M983: =(K983*6)+L983 -> 93 | O983: 18 | P983: 12 | Q983: =(O983*6)+P983 -> 120 | S983: JAMES :MALCOLM :SEXTON
A984: BEST PLAYERS
A985: WILLIAMSTOWN | D985: J MAHONEY | G985: P DOOLEY | J985: JOHNASEN | N985: LLOYD | Q985: SHANKS | S985: DELRE
A986: PORT MELBOURNE | D986: KERSHAW | G986: CAMPBELL | J986: BUTTERWORTH | N986: R BOWDEN | Q986: SEXTON | S986: McGEE
A987: GOALKICKERS
A988: WILLIAMSTOWN | D988: DELRE 5 | F988: O'KEEFE 3 | I988: JOHANSEN 3 | L988: NICHOLSON 2 | O988: LLOYD 2 | Q988: P DOOLEY | S988: SHANKS | V988: FRASER | X988: GHAZI
A989: PORT MELBOURNE | D989: KERSHAW 8 | G989: McGEE 3 | I989: R BOWDEN 2 | L989: HOFFMAN | N989: JAMES | P989: BAILEY | R989: CAMERON | U989: CAMPBELL
A991: QUALIFYING FINAL | E991: 31ST AUGUST | J991: WEATHER
A992: SPRINGVALE | C992: 1 | D992: 6 | E992: =(C992*6)+D992 -> 12 | G992: 3 | H992: 11 | I992: =(G992*6)+H992 -> 29 | K992: 10 | L992: 14 | M992: =(K992*6)+L992 -> 74 | O992: 13 | P992: 16 | Q992: =(O992*6)+P992 -> 94 | S992: Venue: PORT MELBOURNE
A993: WERRIBEE | C993: 2 | D993: 1 | E993: =(C993*6)+D993 -> 13 | G993: 5 | H993: 2 | I993: =(G993*6)+H993 -> 32 | K993: 7 | L993: 4 | M993: =(K993*6)+L993 -> 46 | O993: 8 | P993: 7 | Q993: =(O993*6)+P993 -> 55 | S993: VOZZO :SHEARER :DELLER
A994: BEST PLAYERS
A995: SPRINGVALE | D995: CLARK | G995: EVANS | J995: J CARROLL | M995: D CARROLL | P995: COURTNEY | S995: TAYLOR
A996: WERRIBEE | D996: SATTERLEY | G996: MITCHELL | J996: CHURCHILL | M996: PULI | P996: O'CONNOR
A997: GOALKICKERS
A998: SPRINGVALE | D998: EVANS 4 | F998: DELARUE 2 | I998: DAVISON | K998: BALDWIN | M998: YEATS | O998: COURTNEY | Q998: CAPSALIS | S998: D CARROLL | V998: SMITH
A999: WERRIBEE | D999: MANSFIELD 2 | G999: McDONALD 2 | J999: SAUNDERS | M999: SATTERLEY | P999: O'CONNOR | S999: AZIZ
A1001: 1ST SEMI FINAL | E1001: 8TH SEPTEMBER
A1002: WERRIBEE | C1002: 1 | D1002: 4 | E1002: =(C1002*6)+D1002 -> 10 | G1002: 5 | H1002: 8 | I1002: =(G1002*6)+H1002 -> 38 | K1002: 8 | L1002: 13 | M1002: =(K1002*6)+L1002 -> 61 | O1002: 13 | P1002: 19 | Q1002: =(O1002*6)+P1002 -> 97 | S1002: Venue: PORT MELBOURNE
A1003: WILLIAMSTOWN | C1003: 4 | D1003: 1 | E1003: =(C1003*6)+D1003 -> 25 | G1003: 4 | H1003: 2 | I1003: =(G1003*6)+H1003 -> 26 | K1003: 7 | L1003: 4 | M1003: =(K1003*6)+L1003 -> 46 | O1003: 9 | P1003: 5 | Q1003: =(O1003*6)+P1003 -> 59 | S1003: SEXTON :DAVIDSON :KELSEY
A1004: BEST PLAYERS
A1005: WERRIBEE | D1005: CHURCHILL | G1005: D SAUNDERS | J1005: N SAUNDERS | M1005: MANSFIELD | P1005: SPROULE | S1005: PULI
A1006: WILLIAMSTOWN | D1006: HOUGH | G1006: WEST | J1006: KERRY | M1006: GOULD | P1006: DOOLEY | S1006: MAHONEY
A1007: GOALKICKERS
A1008: WERRIBEE | D1008: AZIZ 3 | F1008: N SAUNDERS 2 | J1008: D SAUNDERS 2 | N1008: MANSFIELD | Q1008: PULI | R1008: CHURCHILL | U1008: SPROULE | W1008: ROACH | Y1008: EAMES
A1009: WILLIAMSTOWN | D1009: O'KEEFE 4 | G1009: GHAZI 2 | J1009: CARRICK | M1009: HOUGH | O1009: DELRE
A1011: 2ND SEMI FINAL | E1011: 7TH SEPTEMBER
A1012: SPRINGVALE | C1012: 2 | D1012: 3 | E1012: =(C1012*6)+D1012 -> 15 | G1012: 6 | H1012: 4 | I1012: =(G1012*6)+H1012 -> 40 | K1012: 12 | L1012: 8 | M1012: =(K1012*6)+L1012 -> 80 | O1012: 17 | P1012: 11 | Q1012: =(O1012*6)+P1012 -> 113 | S1012: Venue: PORT MELBOURNE
A1013: FRANKSTON | C1013: 3 | D1013: 1 | E1013: =(C1013*6)+D1013 -> 19 | G1013: 7 | H1013: 5 | I1013: =(G1013*6)+H1013 -> 47 | K1013: 8 | L1013: 6 | M1013: =(K1013*6)+L1013 -> 54 | O1013: 9 | P1013: 10 | Q1013: =(O1013*6)+P1013 -> 64 | S1013: DELLER :GOODRIDGE :ADAMS
A1014: BEST PLAYERS
A1015: SPRINGVALE | D1015: LITTLE | G1015: CLARK | J1015: COURTNEY | M1015: BURGMAN | P1015: TAYLOR | S1015: DELARUE
A1016: FRANKSTON | D1016: POLLOCK | G1016: TAYLOR | J1016: D CLARKE | M1016: GEORGE | P1016: RHYS-JONES
A1017: GOALKICKERS
A1018: SPRINGVALE | D1018: LIELNORS 3 | G1018: SMITH 3 | I1018: JEFFREY 2 | K1018: CAPSALIS 2 | N1018: JEFFS 2 | P1018: DAVISON 2 | R1018: BALDWIN | U1018: CLARK | W1018: EVANS
A1019: FRANKSTON | D1019: D GEORGE 3 | G1019: MEAD 2 | I1019: R STUBBS | K1019: MOORE | M1019: BOWEY | O1019: S RYAN
A1021: PRELIMINARY FINAL | F1021: 15TH SEPTEMBER
A1022: FRANKSTON | C1022: 2 | D1022: 2 | E1022: =(C1022*6)+D1022 -> 14 | G1022: 4 | H1022: 2 | I1022: =(G1022*6)+H1022 -> 26 | K1022: 8 | L1022: 5 | M1022: =(K1022*6)+L1022 -> 53 | O1022: 9 | P1022: 5 | Q1022: =(O1022*6)+P1022 -> 59 | S1022: Venue: PORT MELBOURNE
A1023: WERRIBEE | C1023: 1 | D1023: 1 | E1023: =(C1023*6)+D1023 -> 7 | G1023: 2 | H1023: 2 | I1023: =(G1023*6)+H1023 -> 14 | K1023: 4 | L1023: 3 | M1023: =(K1023*6)+L1023 -> 27 | O1023: 5 | P1023: 3 | Q1023: =(O1023*6)+P1023 -> 33 | S1023: VOZZO
A1024: BEST PLAYERS
A1025: FRANKSTON | D1025: J PICKERING | G1025: POLLOCK | J1025: DAN CLARKE | M1025: DAM CLARKE | P1025: FREEMAN | S1025: MOORE
A1026: WERRIBEE | D1026: FITZPATRICK | G1026: MANSFIELD | J1026: PULI | M1026: MITCHELL | P1026: CAMILLIERI | S1026: D SAUNDERS
A1027: GOALKICKERS
A1028: FRANKSTON | D1028: J PICKERING 3 | H1028: DAM CLARKE 2 | K1028: BOWEY | M1028: GEORGE | O1028: TAYLOR | Q1028: McKAY
A1029: WERRIBEE | D1029: AZIZ 3 | G1029: SAUNDERS | J1029: MURPHY
A1031: GRAND FINAL | E1031: 14TH SEPTEMBER
A1032: SPRINGVALE | C1032: 3 | D1032: 2 | E1032: =(C1032*6)+D1032 -> 20 | G1032: 7 | H1032: 6 | I1032: =(G1032*6)+H1032 -> 48 | K1032: 10 | L1032: 7 | M1032: =(K1032*6)+L1032 -> 67 | O1032: 11 | P1032: 7 | Q1032: =(O1032*6)+P1032 -> 73 | S1032: Venue: PRINCES PARK (Carlton)
A1033: FRANKSTON | C1033: 5 | D1033: 4 | E1033: =(C1033*6)+D1033 -> 34 | G1033: 9 | H1033: 6 | I1033: =(G1033*6)+H1033 -> 60 | K1033: 9 | L1033: 7 | M1033: =(K1033*6)+L1033 -> 61 | O1033: 10 | P1033: 10 | Q1033: =(O1033*6)+P1033 -> 70 | S1033: SEXTON :MALCOLM :SHEARER
A1034: BEST PLAYERS
A1035: SPRINGVALE
A1036: FRANKSTON
A1037: GOALKICKERS
A1038: SPRINGVALE
A1039: FRANKSTON