A1: Victorian Football League
A2: Season 1997
A3: © Copyright Wal Williams | F3: First created: 4 September 2016
A4: Contact: joywalwi at gmail dot com | F4: Last updated: 4 September 2016 | W4: VFA Results and tables - Link to the main index page
A5: You are free to copy this document in whole or part provided that proper acknowledgement is given to the author. All rights reserved.
A7: 1997 SEASON
A8: ROUND 1 | D8: 5TH APRIL | J8: WEATHER | S8: Venue: FRANKSTON
D9: 1ST QTR | H9: 2ND QTR | L9: 3RD QTR | P9: FINAL | S9: UMPIRES | V9: VOZZO
A10: FRANKSTON | C10: 4 | D10: 4 | E10: =(C10*6)+D10 -> 28 | G10: 8 | H10: 4 | I10: =(G10*6)+H10 -> 52 | K10: 13 | L10: 7 | M10: =(K10*6)+L10 -> 85 | O10: 15 | P10: 11 | Q10: =(O10*6)+P10 -> 101 | S10: GOODRIDGE | Z10: LADDER | AC10: ROUND | AE10: 1
A11: SPRINGVALE | C11: 4 | D11: 1 | E11: =(C11*6)+D11 -> 25 | G11: 8 | H11: 6 | I11: =(G11*6)+H11 -> 54 | K11: 9 | L11: 6 | M11: =(K11*6)+L11 -> 60 | O11: 11 | P11: 10 | Q11: =(O11*6)+P11 -> 76 | S11: JAMES
A12: BEST PLAYERS | W12: TEAM | X12: B | Y12: W | Z12: L | AA12: D | AB12: FOR | AC12: AGST | AD12: % | AE12: PTS
A13: FRANKSTON | C13: DAN CLARKE | F13: BURNELL | H13: CUMMINGS | K13: S RYAN | N13: MALLOY | P13: MOORE
A14: SPRINGVALE | C14: DILLON | F14: S SMITH | H14: J CARROLL | K14: BURGMANN | W14: PORT MELBOURNE | Y14: 1 | Z14: 0 | AA14: 0 | AB14: 79 | AC14: 39 | AD14: =(AB14/AC14)*100 -> 202.56410256410254 | AE14: =(Y14*4)+(AA14*2) -> 4
A15: GOALKICKERS | Q15: MOORE | W15: FRANKSTON | Y15: 1 | Z15: 0 | AA15: 0 | AB15: 101 | AC15: 76 | AD15: =(AB15/AC15)*100 -> 132.89473684210526 | AE15: =(Y15*4)+(AA15*2) -> 4
A16: FRANKSTON | C16: S RYAN 5 | E16: R STUBBS 2 | H16: SULLIVAN 2 | J16: MILLANE 2 | M16: CUMMINGS | P16: MURRAY | R16: BOWEY | W16: PRESTON | Y16: 1 | Z16: 0 | AA16: 0 | AB16: 95 | AC16: 90 | AD16: =(AB16/AC16)*100 -> 105.55555555555556 | AE16: =(Y16*4)+(AA16*2) -> 4
A17: SPRINGVALE | C17: S SMITH 7 | F17: DILLON 3 | I17: DYSON-HOLLAND | W17: WILLIAMSTOWN | Y17: 0 | Z17: 0 | AA17: 1 | AB17: 70 | AC17: 70 | AD17: =(AB17/AC17)*100 -> 100 | AE17: =(Y17*4)+(AA17*2) -> 2
S18: Venue: PRESTON | W18: TRARALGON | Y18: 0 | Z18: 0 | AA18: 1 | AB18: 70 | AC18: 70 | AD18: =(AB18/AC18)*100 -> 100 | AE18: =(Y18*4)+(AA18*2) -> 2
A19: PRESTON | C19: 4 | D19: 6 | E19: =(C19*6)+D19 -> 30 | G19: 8 | H19: 9 | I19: =(G19*6)+H19 -> 57 | K19: 11 | L19: 10 | M19: =(K19*6)+L19 -> 76 | O19: 14 | P19: 11 | Q19: =(O19*6)+P19 -> 95 | S19: MANN
A20: NORTH BALLARAT | C20: 5 | D20: 4 | E20: =(C20*6)+D20 -> 34 | G20: 8 | H20: 7 | I20: =(G20*6)+H20 -> 55 | K20: 12 | L20: 9 | M20: =(K20*6)+L20 -> 81 | O20: 13 | P20: 12 | Q20: =(O20*6)+P20 -> 90 | S20: ROWE | W20: COBURG | X20: 1 | Y20: 0 | Z20: 0 | AA20: 0 | AB20: 0 | AC20: 0 | AE20: =(Y20*4)+(AA20*2) -> 0
A21: BEST PLAYERS | S21: BEARD | W21: BOX HILL | X21: 1 | Y21: 0 | Z21: 0 | AA21: 0 | AB21: 0 | AC21: 0 | AE21: =(Y21*4)+(AA21*2) -> 0
A22: PRESTON | C22: MORRISSEY | F22: MAIORANA | I22: POWER | K22: PLUNKETT | N22: McDUFF | Q22: DOBELL | W22: WERRIBEE | X22: 1 | Y22: 0 | Z22: 0 | AA22: 0 | AB22: 0 | AC22: 0 | AE22: =(Y22*4)+(AA22*2) -> 0
A23: NORTH BALLARAT | C23: HOLMES | F23: COX | I23: LAMB | K23: ELLIS | N23: SNIBSON | Q23: POLKINGHORNE | W23: NORTH BALLARAT | Y23: 0 | Z23: 1 | AA23: 0 | AB23: 90 | AC23: 95 | AD23: =(AB23/AC23)*100 -> 94.73684210526315 | AE23: =(Y23*4)+(AA23*2) -> 0
A24: GOALKICKERS | L24: WINTHER | O24: McCREDDEN | R24: MAIORANA | W24: SPRINGVALE | Y24: 0 | Z24: 1 | AA24: 0 | AB24: 76 | AC24: 101 | AD24: =(AB24/AC24)*100 -> 75.247524752475243 | AE24: =(Y24*4)+(AA24*2) -> 0
A25: PRESTON | C25: ECCLES 3 | E25: HAYDOCK 2 | H25: PLUNKETT 2 | K25: BLAGROVE | M25: PIESCIK | O25: HABERMAN | Q25: DOBELL | W25: SANDRINGHAM | Y25: 0 | Z25: 1 | AA25: 0 | AB25: 39 | AC25: 79 | AD25: =(AB25/AC25)*100 -> 49.367088607594937 | AE25: =(Y25*4)+(AA25*2) -> 0
A26: NORTH BALLARAT | C26: FIELD 3 | E26: NICHOLSON 2 | H26: SNIBSON | J26: QUINLAN | L26: GRANT | N26: LAMB | P26: HOLMES | R26: FRITH
D27: 6TH APRIL | J27: WEATHER | N27: ELLIS | P27: BERRY
A28: PORT MELBOURNE | C28: 4 | D28: 4 | E28: =(C28*6)+D28 -> 28 | G28: 5 | H28: 4 | I28: =(G28*6)+H28 -> 34 | K28: 9 | L28: 7 | M28: =(K28*6)+L28 -> 61 | O28: 12 | P28: 7 | Q28: =(O28*6)+P28 -> 79 | S28: Venue: BEACH ROAD
A29: SANDRINGHAM | C29: 1 | D29: 1 | E29: =(C29*6)+D29 -> 7 | G29: 3 | H29: 6 | I29: =(G29*6)+H29 -> 24 | K29: 3 | L29: 8 | M29: =(K29*6)+L29 -> 26 | O29: 5 | P29: 9 | Q29: =(O29*6)+P29 -> 39 | S29: DAVIDSON :ADAMS :KELSEY
A30: BEST PLAYERS
A31: PORT MELBOURNE | C31: JAMES | F31: CAMERON | I31: ARTZ | L31: HOLLOW | O31: TAYLOR | R31: McGEE
A32: SANDRINGHAM | C32: COGHLAN | F32: SAUTNER | I32: NUGENT | L32: MACGEORGE
A33: GOALKICKERS
A34: PORT MELBOURNE | C34: ARTZ 4 | F34: EDWARDS 3 | I34: SEXTON 2 | L34: JAMES | N34: BUTTERWORTH | Q34: McGEE
A35: SANDRINGHAM | C35: TEMPLETON 2 | F35: RIENIETS | I35: SNOOKS | K35: MOONEY
A37: TRARALGON | C37: 1 | D37: 5 | E37: =(C37*6)+D37 -> 11 | G37: 3 | H37: 10 | I37: =(G37*6)+H37 -> 28 | K37: 6 | L37: 13 | M37: =(K37*6)+L37 -> 49 | O37: 9 | P37: 16 | Q37: =(O37*6)+P37 -> 70 | S37: Venue: TRARALGON
A38: WILLIAMSTOWN | C38: 4 | D38: 3 | E38: =(C38*6)+D38 -> 27 | G38: 5 | H38: 8 | I38: =(G38*6)+H38 -> 38 | K38: 8 | L38: 10 | M38: =(K38*6)+L38 -> 58 | O38: 10 | P38: 10 | Q38: =(O38*6)+P38 -> 70
A39: BEST PLAYERS
A40: TRARALGON | C40: WOLFE | F40: MORLEY | I40: BENNELL | L40: TURNER | O40: BOURNE | R40: FORYS
A41: WILLIAMSTOWN | C41: THOMPSON | F41: WEST | I41: GHAZI | L41: ZAVALAS | O41: HORE | R41: GOULD
A42: GOALKICKERS
A43: TRARALGON | C43: FORYS 4 | F43: RAYNER 2 | I43: HAZELMAN | L43: WOLFE | N43: HOPKINS
A44: WILLIAMSTOWN | C44: REAPER 2 | F44: JOHANSEN 2 | I44: O'KEEFE 2 | L44: DELRE | N44: POTTER | P44: CARRICK | R44: GHAZI
A46: BYE | D46: BOX HILL | G46: COBURG | J46: WERRIBEE
A48: ROUND 2 | D48: 12TH APRIL | J48: WEATHER | S48: Venue: PRESTON
D49: 1ST QTR | H49: 2ND QTR | L49: 3RD QTR | P49: FINAL | S49: UMPIRES | V49: ADAMS
A50: PRESTON | C50: 3 | D50: 2 | E50: =(C50*6)+D50 -> 20 | G50: 6 | H50: 5 | I50: =(G50*6)+H50 -> 41 | K50: 11 | L50: 8 | M50: =(K50*6)+L50 -> 74 | O50: 16 | P50: 14 | Q50: =(O50*6)+P50 -> 110 | S50: QUIGLEY | Z50: LADDER | AC50: ROUND | AE50: 2
A51: WERRIBEE | C51: 3 | D51: 3 | E51: =(C51*6)+D51 -> 21 | G51: 5 | H51: 7 | I51: =(G51*6)+H51 -> 37 | K51: 9 | L51: 10 | M51: =(K51*6)+L51 -> 64 | O51: 9 | P51: 12 | Q51: =(O51*6)+P51 -> 66 | S51: RUSSO
A52: BEST PLAYERS | W52: TEAM | X52: B | Y52: W | Z52: L | AA52: D | AB52: FOR | AC52: AGST | AD52: % | AE52: PTS
A53: PRESTON | C53: MAIORANA | F53: AIELLO | I53: HABERMAN | L53: McDUFF | O53: McCREDDEN | R53: KOFOED
A54: WERRIBEE | C54: PULI | F54: CHURCHILL | I54: SATTERLEY | L54: FITZPATRICK | O54: TAYLOR | R54: DYER | W54: PRESTON | Y54: 2 | Z54: 0 | AA54: 0 | AB54: 205 | AC54: 156 | AD54: =(AB54/AC54)*100 -> 131.41025641025641 | AE54: =(Y54*4)+(AA54*2) -> 8
A55: GOALKICKERS | M55: CORNELL | O55: ECCLES | Q55: HARDENBERG | W55: FRANKSTON | Y55: 2 | Z55: 0 | AA55: 0 | AB55: 188 | AC55: 151 | AD55: =(AB55/AC55)*100 -> 124.50331125827813 | AE55: =(Y55*4)+(AA55*2) -> 8
A56: PRESTON | C56: PLUNKETT 4 | F56: McCREDDIN 2 | I56: PIESCIK 2 | L56: WINTHER | N56: AIELLO | P56: WILSON | R56: McDONOUGH | W56: WILLIAMSTOWN | Y56: 1 | Z56: 0 | AA56: 1 | AB56: 164 | AC56: 144 | AD56: =(AB56/AC56)*100 -> 113.88888888888889 | AE56: =(Y56*4)+(AA56*2) -> 6
A57: WERRIBEE | C57: CHURCHILL 3 | F57: AZIZ 2 | H57: ATKINS | J57: GRAY | L57: SATTERLEY | O57: SPROULE | W57: SANDRINGHAM | Y57: 1 | Z57: 1 | AA57: 0 | AB57: 146 | AC57: 115 | AD57: =(AB57/AC57)*100 -> 126.95652173913044 | AE57: =(Y57*4)+(AA57*2) -> 4
S58: Venue: FRANKSTON | W58: COBURG | X58: 1 | Y58: 1 | Z58: 0 | AA58: 0 | AB58: 101 | AC58: 82 | AD58: =(AB58/AC58)*100 -> 123.17073170731707 | AE58: =(Y58*4)+(AA58*2) -> 4
A59: FRANKSTON | C59: 3 | D59: 2 | E59: =(C59*6)+D59 -> 20 | G59: 6 | H59: 3 | I59: =(G59*6)+H59 -> 39 | K59: 6 | L59: 4 | M59: =(K59*6)+L59 -> 40 | O59: 13 | P59: 9 | Q59: =(O59*6)+P59 -> 87 | S59: TWITT
A60: PORT MELBOURNE | C60: 3 | D60: 4 | E60: =(C60*6)+D60 -> 22 | G60: 5 | H60: 4 | I60: =(G60*6)+H60 -> 34 | K60: 10 | L60: 7 | M60: =(K60*6)+L60 -> 67 | O60: 11 | P60: 9 | Q60: =(O60*6)+P60 -> 75 | S60: MANN | W60: PORT MELBOURNE | Y60: 1 | Z60: 1 | AA60: 0 | AB60: 154 | AC60: 126 | AD60: =(AB60/AC60)*100 -> 122.22222222222223 | AE60: =(Y60*4)+(AA60*2) -> 4
A61: BEST PLAYERS | S61: BEARD | W61: TRARALGON | X61: 1 | Y61: 0 | Z61: 0 | AA61: 1 | AB61: 70 | AC61: 70 | AD61: =(AB61/AC61)*100 -> 100 | AE61: =(Y61*4)+(AA61*2) -> 2
A62: FRANKSTON | C62: DAN CLARKE | F62: CUMMINGS | I62: GOODWIN | L62: MOORE | N62: SULLIVAN | Q62: BOWEY | W62: BOX HILL | X62: 1 | Y62: 0 | Z62: 1 | AA62: 0 | AB62: 82 | AC62: 101 | AD62: =(AB62/AC62)*100 -> 81.188118811881196 | AE62: =(Y62*4)+(AA62*2) -> 0
A63: PORT MELBOURNE | C63: TINSLEY | F63: HOPE | I63: DURLING | L63: WHELAN | N63: SEXTON | Q63: BUTTERWORTH | W63: SPRINGVALE | Y63: 0 | Z63: 2 | AA63: 0 | AB63: 150 | AC63: 195 | AD63: =(AB63/AC63)*100 -> 76.923076923076934 | AE63: =(Y63*4)+(AA63*2) -> 0
A64: GOALKICKERS | P64: GOODWIN | R64: MURRAY | W64: NORTH BALLARAT | Y64: 0 | Z64: 2 | AA64: 0 | AB64: 126 | AC64: 202 | AD64: =(AB64/AC64)*100 -> 62.376237623762378 | AE64: =(Y64*4)+(AA64*2) -> 0
A65: FRANKSTON | C65: MILLANE 2 | E65: DAM CLARKE 2 | I65: CUMMINGS 2 | L65: SULLIVAN 2 | O65: BOWEY | Q65: KING | S65: S RYAN | W65: WERRIBEE | X65: 1 | Y65: 0 | Z65: 1 | AA65: 0 | AB65: 66 | AC65: 110 | AD65: =(AB65/AC65)*100 -> 60 | AE65: =(Y65*4)+(AA65*2) -> 0
A66: PORT MELBOURNE | C66: EDWARDS 3 | F66: McGEE 3 | I66: SHANAHAN 2 | L66: DIBLASI 2 | O66: SEXTON
A68: COBURG | C68: 4 | D68: 2 | E68: =(C68*6)+D68 -> 26 | G68: 10 | H68: 6 | I68: =(G68*6)+H68 -> 66 | K68: 11 | L68: 8 | M68: =(K68*6)+L68 -> 74 | O68: 15 | P68: 11 | Q68: =(O68*6)+P68 -> 101 | S68: Venue: BOX HILL
A69: BOX HILL | C69: 1 | D69: 6 | E69: =(C69*6)+D69 -> 12 | G69: 4 | H69: 7 | I69: =(G69*6)+H69 -> 31 | K69: 9 | L69: 12 | M69: =(K69*6)+L69 -> 66 | O69: 11 | P69: 16 | Q69: =(O69*6)+P69 -> 82 | S69: HEAD :REED :VOZZO
A70: BEST PLAYERS
A71: COBURG | C71: ALESSIO | F71: WESTON | I71: CAPAPELLO | L71: TORTORA | O71: BEACHAM | R71: EZARD
A72: BOX HILL | C72: SLATER | F72: WRIGHT | I72: ANDERSON
A73: GOALKICKERS
A74: COBURG | C74: ALESSIO 6 | F74: TORTORA 3 | I74: SULLIVAN 3 | L74: WESTON | N74: BESANKO | P74: TARANTO
A75: BOX HILL | C75: WILKINSON 4 | F75: ROWE 2 | H75: GRIFFIN | J75: ANDERSON | M75: SLATER | O75: DUANE | Q75: CROWLEY
E76: NIGHT GAME
A77: SANDRINGHAM | C77: 5 | D77: 3 | E77: =(C77*6)+D77 -> 33 | G77: 10 | H77: 4 | I77: =(G77*6)+H77 -> 64 | K77: 12 | L77: 5 | M77: =(K77*6)+L77 -> 77 | O77: 17 | P77: 5 | Q77: =(O77*6)+P77 -> 107 | S77: Venue: NORTH BALLARAT
A78: NORTH BALLARAT | C78: 0 | D78: 0 | E78: =(C78*6)+D78 -> 0 | G78: 0 | H78: 0 | I78: =(G78*6)+H78 -> 0 | K78: 3 | L78: 6 | M78: =(K78*6)+L78 -> 24 | O78: 5 | P78: 6 | Q78: =(O78*6)+P78 -> 36
A79: BEST PLAYERS
A80: SANDRINGHAM | C80: CLARKSON | F80: NUGENT | I80: BAXTER | L80: DEAR | O80: HAYNES | R80: MURRAY
A81: NORTH BALLARAT | C81: TAYLOR | F81: ELLIS | I81: HOLMES | L81: POLKINGHORNE | O81: BERRY | R81: MACKAY
A82: GOALKICKERS
A83: SANDRINGHAM | C83: OAKLEY 4 | E83: DEAR 3 | G83: SAUTNER 2 | I83: SNOOKS 2 | L83: SCOTT-BRANIGAN 2 | P83: HAYNES | R83: BAXTER | U83: RIENIETS | X83: MITCHELSON
A84: NORTH BALLARAT | C84: MACKAY 3 | F84: O'SULLIVAN | I84: FRITH
E85: 14TH APRIL | K85: WEATHER | N85: FINE
A86: WILLIAMSTOWN | C86: 1 | D86: 0 | E86: =(C86*6)+D86 -> 6 | G86: 8 | H86: 4 | I86: =(G86*6)+H86 -> 52 | K86: 12 | L86: 6 | M86: =(K86*6)+L86 -> 78 | O86: 14 | P86: 10 | Q86: =(O86*6)+P86 -> 94 | S86: Venue: SPRINGVALE
A87: SPRINGVALE | C87: 4 | D87: 5 | E87: =(C87*6)+D87 -> 29 | G87: 5 | H87: 7 | I87: =(G87*6)+H87 -> 37 | K87: 7 | L87: 10 | M87: =(K87*6)+L87 -> 52 | O87: 10 | P87: 14 | Q87: =(O87*6)+P87 -> 74 | S87: KELSEY :DAVIDSON :ROWE
A88: BEST PLAYERS
A89: WILLIAMSTOWN | C89: SHANKS | F89: KERRY | I89: CARRICK | L89: HOWLETT | O89: GOULD
A90: SPRINGVALE | C90: TAYLOR | F90: KNIGHT | I90: DILLON | L90: SMITH | O90: BURGMANN
A91: GOALKICKERS
A92: WILLIAMSTOWN | C92: DELRE 4 | F92: JOHANSEN 3 | I92: REAPER 2 | L92: GHAZI | N92: SHEATHER | Q92: NASH | S92: FRASER | V92: HORE
A93: SPRINGVALE | C93: SMITH 3 | F93: KNIGHT 3 | I93: K LIELNORS 2 | L93: HARD | N93: JEFFS
A95: BYE | D95: TRARALGON
A97: ROUND 3 | D97: 19TH APRIL | J97: WEATHER
D98: 1ST QTR | H98: 2ND QTR | L98: 3RD QTR | P98: FINAL | S98: Venue: TRARALGON
A99: PRESTON | C99: 4 | D99: 2 | E99: =(C99*6)+D99 -> 26 | G99: 5 | H99: 7 | I99: =(G99*6)+H99 -> 37 | K99: 8 | L99: 8 | M99: =(K99*6)+L99 -> 56 | O99: 9 | P99: 9 | Q99: =(O99*6)+P99 -> 63 | S99: UMPIRES | Z99: LADDER | AC99: ROUND | AE99: 3
A100: TRARALGON | C100: 1 | D100: 2 | E100: =(C100*6)+D100 -> 8 | G100: 3 | H100: 6 | I100: =(G100*6)+H100 -> 24 | K100: 4 | L100: 7 | M100: =(K100*6)+L100 -> 31 | O100: 7 | P100: 11 | Q100: =(O100*6)+P100 -> 53
A101: BEST PLAYERS | W101: TEAM | X101: B | Y101: W | Z101: L | AA101: D | AB101: FOR | AC101: AGST | AD101: % | AE101: PTS
A102: PRESTON | C102: KOFOED | F102: AIELLO | I102: McDONOUGH | L102: POWER | O102: ECCLES | Q102: McDUFF
A103: TRARALGON | C103: DOYLE | F103: CAMERON | I103: MALONE | L103: MORLEY | O103: HABEL | Q103: BOURNE | W103: FRANKSTON | Y103: 3 | Z103: 0 | AA103: 0 | AB103: 306 | AC103: 230 | AD103: =(AB103/AC103)*100 -> 133.04347826086956 | AE103: =(Y103*4)+(AA103*2) -> 12
A104: GOALKICKERS | W104: PRESTON | Y104: 3 | Z104: 0 | AA104: 0 | AB104: 268 | AC104: 209 | AD104: =(AB104/AC104)*100 -> 128.22966507177034 | AE104: =(Y104*4)+(AA104*2) -> 12
A105: PRESTON | C105: ECCLES 3 | F105: McDONOUGH 2 | J105: WINTHER 2 | M105: HAYDOCK | P105: PLUNKETT | W105: SANDRINGHAM | Y105: 2 | Z105: 1 | AA105: 0 | AB105: 239 | AC105: 206 | AD105: =(AB105/AC105)*100 -> 116.01941747572815 | AE105: =(Y105*4)+(AA105*2) -> 8
A106: TRARALGON | C106: STOCKDALE 2 | F106: MORLEY | H106: HOPKINS | J106: DOYLE | L106: JENNINGS | N106: FORYS | W106: PORT MELBOURNE | Y106: 2 | Z106: 1 | AA106: 0 | AB106: 236 | AC106: 206 | AD106: =(AB106/AC106)*100 -> 114.5631067961165 | AE106: =(Y106*4)+(AA106*2) -> 8
D107: 20TH APRIL | J107: WEATHER | W107: WILLIAMSTOWN | Y107: 1 | Z107: 1 | AA107: 1 | AB107: 255 | AC107: 237 | AD107: =(AB107/AC107)*100 -> 107.59493670886076 | AE107: =(Y107*4)+(AA107*2) -> 6
A108: SANDRINGHAM | C108: 1 | D108: 1 | E108: =(C108*6)+D108 -> 7 | G108: 5 | H108: 5 | I108: =(G108*6)+H108 -> 35 | K108: 11 | L108: 7 | M108: =(K108*6)+L108 -> 73 | O108: 14 | P108: 9 | Q108: =(O108*6)+P108 -> 93 | S108: Venue: WILLIAMSTOWN
A109: WILLIAMSTOWN | C109: 6 | D109: 4 | E109: =(C109*6)+D109 -> 40 | G109: 7 | H109: 6 | I109: =(G109*6)+H109 -> 48 | K109: 10 | L109: 8 | M109: =(K109*6)+L109 -> 68 | O109: 13 | P109: 13 | Q109: =(O109*6)+P109 -> 91 | W109: WERRIBEE | X109: 1 | Y109: 1 | Z109: 1 | AA109: 0 | AB109: 187 | AC109: 146 | AD109: =(AB109/AC109)*100 -> 128.08219178082192 | AE109: =(Y109*4)+(AA109*2) -> 4
A110: BEST PLAYERS | W110: COBURG | X110: 1 | Y110: 1 | Z110: 1 | AA110: 0 | AB110: 137 | AC110: 203 | AD110: =(AB110/AC110)*100 -> 67.487684729064028 | AE110: =(Y110*4)+(AA110*2) -> 4
A111: SANDRINGHAM | C111: FRATER | F111: KELLAWAY | I111: DEAR | L111: NUGENT | N111: AMIET | Q111: FOLEY | W111: TRARALGON | X111: 1 | Y111: 0 | Z111: 1 | AA111: 1 | AB111: 123 | AC111: 133 | AD111: =(AB111/AC111)*100 -> 92.481203007518801 | AE111: =(Y111*4)+(AA111*2) -> 2
A112: WILLIAMSTOWN | C112: DELRE | F112: HORE | I112: HOWLETT | L112: REAPER | N112: SHANKS | Q112: GHAZI | W112: SPRINGVALE | X112: 1 | Y112: 0 | Z112: 2 | AA112: 0 | AB112: 150 | AC112: 195 | AD112: =(AB112/AC112)*100 -> 76.923076923076934 | AE112: =(Y112*4)+(AA112*2) -> 0
A113: GOALKICKERS | W113: BOX HILL | X113: 1 | Y113: 0 | Z113: 2 | AA113: 0 | AB113: 161 | AC113: 219 | AD113: =(AB113/AC113)*100 -> 73.515981735159812 | AE113: =(Y113*4)+(AA113*2) -> 0
A114: SANDRINGHAM | C114: AMIET 5 | F114: FOLEY 2 | H114: NUGENT 2 | K114: HAYNES 2 | M114: BAXTER | O114: OAKLEY | Q114: MITCHELSON | W114: NORTH BALLARAT | Y114: 0 | Z114: 3 | AA114: 0 | AB114: 206 | AC114: 282 | AD114: =(AB114/AC114)*100 -> 73.049645390070921 | AE114: =(Y114*4)+(AA114*2) -> 0
A115: WILLIAMSTOWN | C115: REAPER 7 | F115: GHAZI | H115: JOHANSEN | K115: NASH | M115: CARRICK | O115: ZAVALAS | Q115: POTTER
A117: FRANKSTON | C117: 4 | D117: 5 | E117: =(C117*6)+D117 -> 29 | G117: 9 | H117: 8 | I117: =(G117*6)+H117 -> 62 | K117: 10 | L117: 12 | M117: =(K117*6)+L117 -> 72 | O117: 17 | P117: 16 | Q117: =(O117*6)+P117 -> 118 | S117: Venue: BOX HILL
A118: BOX HILL | C118: 2 | D118: 2 | E118: =(C118*6)+D118 -> 14 | G118: 3 | H118: 4 | I118: =(G118*6)+H118 -> 22 | K118: 8 | L118: 5 | M118: =(K118*6)+L118 -> 53 | O118: 12 | P118: 7 | Q118: =(O118*6)+P118 -> 79
A119: BEST PLAYERS
A120: FRANKSTON | C120: CUMMINGS | F120: S RYAN | I120: LAMBERT | L120: BOWEY | N120: MILLANE | Q120: MALLOY
A121: BOX HILL | C121: WILKINSON | F121: DIMMATINA | I121: SLATER | L121: CRISP | N121: TRANQUILLI | Q121: JENKINS
A122: GOALKICKERS
A123: FRANKSTON | C123: R STUBBS 3 | F123: KING 2 | H123: S RYAN 2 | J123: CUMMINGS 2 | M123: PICKERING 2 | P123: LAMBERT | R123: GOODWIN | V123: DAN CLARKE | X123: DAM CLARKE | AB123: SULLIVAN | AD123: MURRAY
A124: BOX HILL | C124: WILKINSON 8 | F124: LYNDON 2 | I124: B ROWE | K124: PORTER
A126: WERRIBEE | C126: 3 | D126: 4 | E126: =(C126*6)+D126 -> 22 | G126: 6 | H126: 9 | I126: =(G126*6)+H126 -> 45 | K126: 12 | L126: 15 | M126: =(K126*6)+L126 -> 87 | O126: 17 | P126: 19 | Q126: =(O126*6)+P126 -> 121 | S126: Venue: WERRIBEE
A127: COBURG | C127: 1 | D127: 2 | E127: =(C127*6)+D127 -> 8 | G127: 3 | H127: 3 | I127: =(G127*6)+H127 -> 21 | K127: 4 | L127: 4 | M127: =(K127*6)+L127 -> 28 | O127: 5 | P127: 6 | Q127: =(O127*6)+P127 -> 36
A128: BEST PLAYERS
A129: WERRIBEE | C129: SPROULE | F129: CHURCHILL | I129: EAMES | L129: DYER | N129: TAYLOR | Q129: ATKINS
A130: COBURG | C130: STEFANIC | F130: CORR | I130: BAGNADA | L130: McLEOD
A131: GOALKICKERS
A132: WERRIBEE | C132: BUTTON 3 | E132: SPROULE 3 | H132: MURPHY 2 | K132: MONTGOMERY | N132: TAYLOR | P132: SHANNON | R132: EAMES | U132: AZIZ | W132: WILLIAMS | X132: CHURCHILL | AA132: DYER | AC132: SATTERLEY
A133: COBURG | C133: ALESSIO 2 | F133: KHEIR | H133: PLATT | J133: PIGNATORO
A135: PORT MELBOURNE | C135: 1 | D135: 2 | E135: =(C135*6)+D135 -> 8 | G135: 8 | H135: 3 | I135: =(G135*6)+H135 -> 51 | K135: 10 | L135: 8 | M135: =(K135*6)+L135 -> 68 | O135: 12 | P135: 10 | Q135: =(O135*6)+P135 -> 82 | S135: Venue: WERRIBEE
A136: NORTH BALLARAT | C136: 3 | D136: 7 | E136: =(C136*6)+D136 -> 25 | G136: 4 | H136: 11 | I136: =(G136*6)+H136 -> 35 | K136: 4 | L136: 17 | M136: =(K136*6)+L136 -> 41 | O136: 10 | P136: 20 | Q136: =(O136*6)+P136 -> 80
A137: BEST PLAYERS
A138: PORT MELBOURNE | C138: SEXTON | F138: REID | I138: DIBLASI | L138: HOFFMAN | O138: SHANAHAN | R138: TINSLEY
A139: NORTH BALLARAT | C139: T POLKINGHORNE | G139: MARTIN | I139: G POLKINGHORNE | M139: HOLMES | O139: HILLS
A140: GOALKICKERS
A141: PORT MELBOURNE | C141: SEXTON 7 | F141: EDWARDS 2 | I141: REID 2 | L141: DIBLASI
A142: NORTH BALLARAT | C142: BROADBENT 2 | F142: O'SULLIVAN 2 | I142: PARTINGTON 2 | M142: GRANT | O142: OXLEY | Q142: POLKINGHORNE | V142: McKAY
A144: BYE | D144: SPRINGVALE
A146: ROUND 4 | D146: 25TH APRIL | J146: WEATHER | S146: Venue: WILLIAMSTOWN
D147: 1ST QTR | H147: 2ND QTR | L147: 3RD QTR | P147: FINAL | S147: UMPIRES | V147: MANN
A148: WILLIAMSTOWN | C148: 6 | D148: 4 | E148: =(C148*6)+D148 -> 40 | G148: 9 | H148: 5 | I148: =(G148*6)+H148 -> 59 | K148: 14 | L148: 10 | M148: =(K148*6)+L148 -> 94 | O148: 15 | P148: 14 | Q148: =(O148*6)+P148 -> 104 | S148: NELIS | Z148: LADDER | AC148: ROUND | AE148: 4
A149: WERRIBEE | C149: 4 | D149: 4 | E149: =(C149*6)+D149 -> 28 | G149: 7 | H149: 7 | I149: =(G149*6)+H149 -> 49 | K149: 9 | L149: 10 | M149: =(K149*6)+L149 -> 64 | O149: 13 | P149: 11 | Q149: =(O149*6)+P149 -> 89 | S149: DAVIDSON
A150: BEST PLAYERS | W150: TEAM | X150: B | Y150: W | Z150: L | AA150: D | AB150: FOR | AC150: AGST | AD150: % | AE150: PTS
A151: WILLIAMSTOWN | C151: SHANKS | F151: DELRE | I151: HORE | L151: CARRICK | O151: WEST | R151: WALLACE
A152: WERRIBEE | C152: ATKINS | F152: PULI | I152: SAUNDERS | L152: AZIZ | O152: SATTERLEY | R152: MURPHY | W152: PRESTON | Y152: 4 | Z152: 0 | AA152: 0 | AB152: 432 | AC152: 285 | AD152: =(AB152/AC152)*100 -> 151.57894736842107 | AE152: =(Y152*4)+(AA152*2) -> 16
A153: GOALKICKERS | Q153: O'KEEFE | W153: SANDRINGHAM | Y153: 3 | Z153: 1 | AA153: 0 | AB153: 348 | AC153: 258 | AD153: =(AB153/AC153)*100 -> 134.88372093023256 | AE153: =(Y153*4)+(AA153*2) -> 12
A154: WILLIAMSTOWN | C154: DELRE 4 | E154: REAPER 2 | G154: NEILSON 2 | I154: FRASER | K154: WEST | M154: GHAZI | O154: CARRICK | Q154: ZAVALAS | W154: FRANKSTON | X154: 1 | Y154: 3 | Z154: 0 | AA154: 0 | AB154: 306 | AC154: 230 | AD154: =(AB154/AC154)*100 -> 133.04347826086956 | AE154: =(Y154*4)+(AA154*2) -> 12
A155: WERRIBEE | C155: SPROULE 2 | F155: SATTERLEY 2 | I155: CHURCHILL 2 | L155: AZIZ 2 | N155: ATKINS | P155: GRAY | R155: BUTTON | W155: PORT MELBOURNE | Y155: 3 | Z155: 1 | AA155: 0 | AB155: 338 | AC155: 258 | AD155: =(AB155/AC155)*100 -> 131.00775193798449 | AE155: =(Y155*4)+(AA155*2) -> 12
D156: NIGHT GAME | K156: EAMES | M156: McINTOSH | S156: Venue: NORTH BALLARAT | W156: WILLIAMSTOWN | Y156: 2 | Z156: 1 | AA156: 1 | AB156: 359 | AC156: 326 | AD156: =(AB156/AC156)*100 -> 110.12269938650307 | AE156: =(Y156*4)+(AA156*2) -> 10
A157: BOX HILL | C157: 1 | D157: 6 | E157: =(C157*6)+D157 -> 12 | G157: 5 | H157: 7 | I157: =(G157*6)+H157 -> 37 | K157: 8 | L157: 10 | M157: =(K157*6)+L157 -> 58 | O157: 10 | P157: 12 | Q157: =(O157*6)+P157 -> 72 | S157: BEARD
A158: NORTH BALLARAT | C158: 2 | D158: 1 | E158: =(C158*6)+D158 -> 13 | G158: 2 | H158: 6 | I158: =(G158*6)+H158 -> 18 | K158: 4 | L158: 8 | M158: =(K158*6)+L158 -> 32 | O158: 9 | P158: 9 | Q158: =(O158*6)+P158 -> 63 | S158: HEAD | W158: WERRIBEE | X158: 1 | Y158: 1 | Z158: 2 | AA158: 0 | AB158: 276 | AC158: 250 | AD158: =(AB158/AC158)*100 -> 110.4 | AE158: =(Y158*4)+(AA158*2) -> 4
A159: BEST PLAYERS | S159: REID | W159: BOX HILL | X159: 1 | Y159: 1 | Z159: 2 | AA159: 0 | AB159: 233 | AC159: 282 | AD159: =(AB159/AC159)*100 -> 82.62411347517731 | AE159: =(Y159*4)+(AA159*2) -> 4
A160: BOX HILL | C160: LIVINGSTONE | F160: TRANQUILLI | I160: SLATER | L160: NICHIL | O160: WILKINSON | R160: PORTER | W160: COBURG | X160: 1 | Y160: 1 | Z160: 2 | AA160: 0 | AB160: 213 | AC160: 367 | AD160: =(AB160/AC160)*100 -> 58.038147138964582 | AE160: =(Y160*4)+(AA160*2) -> 4
A161: NORTH BALLARAT | C161: NICHOLSON | F161: COX | I161: MACKAY | L161: HILLS | W161: TRARALGON | X161: 1 | Y161: 0 | Z161: 2 | AA161: 1 | AB161: 175 | AC161: 235 | AD161: =(AB161/AC161)*100 -> 74.468085106382972 | AE161: =(Y161*4)+(AA161*2) -> 2
A162: GOALKICKERS | W162: NORTH BALLARAT | Y162: 0 | Z162: 4 | AA162: 0 | AB162: 269 | AC162: 354 | AD162: =(AB162/AC162)*100 -> 75.988700564971751 | AE162: =(Y162*4)+(AA162*2) -> 0
A163: BOX HILL | C163: WILKINSON 3 | F163: LYNDON 2 | I163: LIVINGSTONE 2 | L163: CROWLEY | N163: PORTER | P163: ROWE | W163: SPRINGVALE | X163: 1 | Y163: 0 | Z163: 3 | AA163: 0 | AB163: 202 | AC163: 304 | AD163: =(AB163/AC163)*100 -> 66.44736842105263 | AE163: =(Y163*4)+(AA163*2) -> 0
A164: NORTH BALLARAT | C164: BROADBENT 2 | F164: LAMB 2 | H164: SHOLL 2 | J164: FIELD | L164: GRANT | N164: MACKAY
D165: 26TH APRIL | J165: WEATHER
A166: SANDRINGHAM | C166: 2 | D166: 4 | E166: =(C166*6)+D166 -> 16 | G166: 7 | H166: 9 | I166: =(G166*6)+H166 -> 51 | K166: 12 | L166: 13 | M166: =(K166*6)+L166 -> 85 | O166: 15 | P166: 19 | Q166: =(O166*6)+P166 -> 109 | S166: Venue: BEACH ROAD
A167: SPRINGVALE | C167: 1 | D167: 3 | E167: =(C167*6)+D167 -> 9 | G167: 4 | H167: 3 | I167: =(G167*6)+H167 -> 27 | K167: 6 | L167: 6 | M167: =(K167*6)+L167 -> 42 | O167: 7 | P167: 10 | Q167: =(O167*6)+P167 -> 52 | S167: KELSEY :JAMES ;ROWE
A168: BEST PLAYERS
A169: SANDRINGHAM | C169: RIENIETS | F169: NUGENT | I169: BAXTER | L169: MITCHELSON | O169: CLARKSON | R169: MACGEORGE
A170: SPRINGVALE | C170: CAPLES | F170: SUTHERLAND | I170: DEETH | L170: HALL | O170: SMITH | R170: CLARK
A171: GOALKICKERS
A172: SANDRINGHAM | C172: MOONEY 4 | E172: AMIET 2 | G172: BAXTER 2 | I172: SNOOKS 2 | L172: SCOTT-BRANAGAN | P172: OAKLEY | R172: CROUGH | U172: DEAR | W172: NUGENT
A173: SPRINGVALE | C173: SMITH 3 | F173: KNIGHT | H173: O'DONNELL | K173: DYSON-HOLLAND | O173: SCOTT
A175: PRESTON | C175: 9 | D175: 4 | E175: =(C175*6)+D175 -> 58 | G175: 15 | H175: 10 | I175: =(G175*6)+H175 -> 100 | K175: 22 | L175: 12 | M175: =(K175*6)+L175 -> 144 | O175: 25 | P175: 14 | Q175: =(O175*6)+P175 -> 164 | S175: Venue: COBURG
A176: COBURG | C176: 2 | D176: 4 | E176: =(C176*6)+D176 -> 16 | G176: 4 | H176: 4 | I176: =(G176*6)+H176 -> 28 | K176: 5 | L176: 7 | M176: =(K176*6)+L176 -> 37 | O176: 11 | P176: 10 | Q176: =(O176*6)+P176 -> 76 | S176: ADAMS ;KANIZAY :VOZZO
A177: BEST PLAYERS
A178: PRESTON | C178: KNIGHTS | F178: McCREDDEN | I178: PLUNKETT | L178: HABERMAN | O178: ECCLES | R178: POWER
A179: COBURG | C179: ALESSIO | F179: WESTON | I179: McMAHON
A180: GOALKICKERS | U180: MANN
A181: PRESTON | C181: ECCLES 6 | E181: McCREDDEN 4 | H181: PIESCIK 2 | J181: BLAGROVE 2 | M181: GRAINGER 2 | P181: PLUNKETT 2 | S181: WINSHER 2 | V181: HABERMAN | X181: PENN | Z181: MAIORANA | AC181: HAYDOCK
A182: COBURG | C182: ALESSIO 7 | F182: TARANTO | I182: PIGNATORO | L182: McMAHON | O182: CHAHOUD
D183: 27TH APRIL | J183: WEATHER
A184: PORT MELBOURNE | C184: 2 | D184: 5 | E184: =(C184*6)+D184 -> 17 | G184: 4 | H184: 8 | I184: =(G184*6)+H184 -> 32 | K184: 8 | L184: 9 | M184: =(K184*6)+L184 -> 57 | O184: 15 | P184: 12 | Q184: =(O184*6)+P184 -> 102 | S184: Venue: TRARALGON
A185: TRARALGON | C185: 2 | D185: 1 | E185: =(C185*6)+D185 -> 13 | G185: 5 | H185: 4 | I185: =(G185*6)+H185 -> 34 | K185: 5 | L185: 6 | M185: =(K185*6)+L185 -> 36 | O185: 7 | P185: 10 | Q185: =(O185*6)+P185 -> 52 | S185: MASON ;GOODRIDGE :QUIGLEY
A186: BEST PLAYERS
A187: PORT MELBOURNE | C187: SETCHELL | F187: CAMERON | I187: KERSHAW | L187: HOLLOW | O187: REID | R187: BALLANTYNE
A188: TRARALGON | C188: CAMERON | F188: DOYLE | I188: JENNINGS | L188: MORLEY | O188: HOPKINS | R188: BENNETT
A189: GOALKICKERS
A190: PORT MELBOURNE | C190: KERSHAW 6 | F190: EDWARDS | I190: JAMES | K190: DIBLASI | M190: McGEE | O190: PICIAONE | Q190: REID | S190: SETCHELL | W190: SEXTON | X190: WHELAN
A191: TRARALGON | C191: WOLFE 3 | F191: BURRIDGE | I191: FORYS | K191: MOYLAN | M191: STOCKDALE
A193: BYE | D193: FRANKSTON
A195: ROUND 5 | D195: 3RD MAY | J195: WEATHER
D196: 1ST QTR | H196: 2ND QTR | L196: 3RD QTR | P196: FINAL | S196: Venue: COBURG
A197: TRARALGON | C197: 4 | D197: 4 | E197: =(C197*6)+D197 -> 28 | G197: 6 | H197: 6 | I197: =(G197*6)+H197 -> 42 | K197: 9 | L197: 8 | M197: =(K197*6)+L197 -> 62 | O197: 17 | P197: 16 | Q197: =(O197*6)+P197 -> 118 | S197: UMPIRES | Z197: LADDER | AC197: ROUND | AE197: 5
A198: COBURG | C198: 1 | D198: 4 | E198: =(C198*6)+D198 -> 10 | G198: 3 | H198: 7 | I198: =(G198*6)+H198 -> 25 | K198: 8 | L198: 9 | M198: =(K198*6)+L198 -> 57 | O198: 8 | P198: 10 | Q198: =(O198*6)+P198 -> 58
A199: BEST PLAYERS | W199: TEAM | X199: B | Y199: W | Z199: L | AA199: D | AB199: FOR | AC199: AGST | AD199: % | AE199: PTS
A200: TRARALGON | C200: DOYLE | F200: MOYLAN | I200: FORYS | K200: CAMERON | N200: WOLFE | P200: HOPKINS
A201: COBURG | C201: STEFANIC | F201: WESTON | I201: McLEOD | W201: FRANKSTON | X201: 1 | Y201: 4 | Z201: 0 | AA201: 0 | AB201: 432 | AC201: 293 | AD201: =(AB201/AC201)*100 -> 147.44027303754265 | AE201: =(Y201*4)+(AA201*2) -> 16
A202: GOALKICKERS | N202: KERR | P202: STOCKDALE | W202: PRESTON | Y202: 4 | Z202: 1 | AA202: 0 | AB202: 495 | AC202: 411 | AD202: =(AB202/AC202)*100 -> 120.43795620437956 | AE202: =(Y202*4)+(AA202*2) -> 16
A203: TRARALGON | C203: FORYS 5 | E203: RAYNER 3 | H203: DOYLE 2 | J203: JENNINGS 2 | M203: TURNER | O203: HOPKINS | Q203: BENNETT | W203: WILLIAMSTOWN | Y203: 3 | Z203: 1 | AA203: 1 | AB203: 442 | AC203: 381 | AD203: =(AB203/AC203)*100 -> 116.01049868766404 | AE203: =(Y203*4)+(AA203*2) -> 14
A204: COBURG | C204: BEACHAM 2 | F204: CHARHOUD 2 | I204: ALESSIO | K204: KHEIR | M204: PLATT | O204: WESTON | W204: SANDRINGHAM | X204: 1 | Y204: 3 | Z204: 1 | AA204: 0 | AB204: 348 | AC204: 258 | AD204: =(AB204/AC204)*100 -> 134.88372093023256 | AE204: =(Y204*4)+(AA204*2) -> 12
W205: PORT MELBOURNE | Y205: 3 | Z205: 2 | AA205: 0 | AB205: 401 | AC205: 364 | AD205: =(AB205/AC205)*100 -> 110.16483516483517 | AE205: =(Y205*4)+(AA205*2) -> 12
A206: SPRINGVALE | C206: 8 | D206: 4 | E206: =(C206*6)+D206 -> 52 | G206: 10 | H206: 10 | I206: =(G206*6)+H206 -> 70 | K206: 12 | L206: 14 | M206: =(K206*6)+L206 -> 86 | O206: 15 | P206: 16 | Q206: =(O206*6)+P206 -> 106 | S206: Venue: PORT MELBOURNE
A207: PORT MELBOURNE | C207: 0 | D207: 1 | E207: =(C207*6)+D207 -> 1 | G207: 4 | H207: 2 | I207: =(G207*6)+H207 -> 26 | K207: 4 | L207: 6 | M207: =(K207*6)+L207 -> 30 | O207: 9 | P207: 9 | Q207: =(O207*6)+P207 -> 63 | W207: WERRIBEE | X207: 1 | Y207: 2 | Z207: 2 | AA207: 0 | AB207: 386 | AC207: 286 | AD207: =(AB207/AC207)*100 -> 134.96503496503496 | AE207: =(Y207*4)+(AA207*2) -> 8
A208: BEST PLAYERS | W208: TRARALGON | X208: 1 | Y208: 1 | Z208: 2 | AA208: 1 | AB208: 293 | AC208: 293 | AD208: =(AB208/AC208)*100 -> 100 | AE208: =(Y208*4)+(AA208*2) -> 6
A209: SPRINGVALE | C209: D CARROLL | F209: SUTHERLAND | I209: J CARROLL | L209: CLARK | O209: DEETH | Q209: HARD | W209: SPRINGVALE | X209: 1 | Y209: 1 | Z209: 3 | AA209: 0 | AB209: 308 | AC209: 367 | AD209: =(AB209/AC209)*100 -> 83.923705722070835 | AE209: =(Y209*4)+(AA209*2) -> 4
A210: PORT MELBOURNE | C210: EDWARDS | F210: SETCHELL | I210: HOLLOW | L210: TINSLEY | O210: McGEE | Q210: JAMES | W210: BOX HILL | X210: 1 | Y210: 1 | Z210: 3 | AA210: 0 | AB210: 288 | AC210: 365 | AD210: =(AB210/AC210)*100 -> 78.904109589041099 | AE210: =(Y210*4)+(AA210*2) -> 4
A211: GOALKICKERS | P211: LIELNORS | W211: COBURG | X211: 1 | Y211: 1 | Z211: 3 | AA211: 0 | AB211: 271 | AC211: 485 | AD211: =(AB211/AC211)*100 -> 55.876288659793815 | AE211: =(Y211*4)+(AA211*2) -> 4
A212: SPRINGVALE | C212: SMITH 5 | E212: DILLON 2 | G212: HARD 2 | I212: DYSON-HOLLAND 2 | M212: CARROLL | O212: O'DONNELL | Q212: CAPSALIS | W212: NORTH BALLARAT | Y212: 0 | Z212: 5 | AA212: 0 | AB212: 305 | AC212: 464 | AD212: =(AB212/AC212)*100 -> 65.732758620689651 | AE212: =(Y212*4)+(AA212*2) -> 0
A213: PORT MELBOURNE | C213: SETCHELL 3 | F213: EDWARDS 2 | I213: McGEE | K213: DOCKERTY | N213: DIBLASI
D214: 4TH MAY | J214: WEATHER
A215: WILLIAMSTOWN | C215: 4 | D215: 3 | E215: =(C215*6)+D215 -> 27 | G215: 5 | H215: 4 | I215: =(G215*6)+H215 -> 34 | K215: 9 | L215: 9 | M215: =(K215*6)+L215 -> 63 | O215: 11 | P215: 17 | Q215: =(O215*6)+P215 -> 83 | S215: Venue: BOX HILL
A216: BOX HILL | C216: 0 | D216: 2 | E216: =(C216*6)+D216 -> 2 | G216: 6 | H216: 3 | I216: =(G216*6)+H216 -> 39 | K216: 8 | L216: 4 | M216: =(K216*6)+L216 -> 52 | O216: 8 | P216: 7 | Q216: =(O216*6)+P216 -> 55
A217: BEST PLAYERS
A218: WILLIAMSTOWN | C218: GHAZI | F218: SHANKS | I218: HORE | L218: GOULD | N218: PASTORE | Q218: WALLACE
A219: BOX HILL | C219: ALLSOP | F219: CUNNINGHAM | I219: DUANE | L219: BANFIELD
A220: GOALKICKERS
A221: WILLIAMSTOWN | C221: O'KEEFE 4 | F221: SHANKS 3 | I221: REAPER | K221: GHAZI | M221: JOHANSEN | P221: KERRY
A222: BOX HILL | C222: DUANE 3 | F222: WILKINSON 2 | J222: PORTER | L222: WRIGHT | N222: ALLSOP
A224: FRANKSTON | C224: 4 | D224: 2 | E224: =(C224*6)+D224 -> 26 | G224: 10 | H224: 5 | I224: =(G224*6)+H224 -> 65 | K224: 16 | L224: 7 | M224: =(K224*6)+L224 -> 103 | O224: 19 | P224: 12 | Q224: =(O224*6)+P224 -> 126 | S224: Venue: FRANKSTON
A225: PRESTON | C225: 4 | D225: 4 | E225: =(C225*6)+D225 -> 28 | G225: 5 | H225: 5 | I225: =(G225*6)+H225 -> 35 | K225: 8 | L225: 8 | M225: =(K225*6)+L225 -> 56 | O225: 9 | P225: 9 | Q225: =(O225*6)+P225 -> 63
A226: BEST PLAYERS
A227: FRANKSTON | C227: R STUBBS | F227: CUMMINGS | I227: SULLIVAN | L227: GEORGIOU | N227: MURRAY | Q227: LEYS
A228: PRESTON | C228: POWER | F228: AIELLO | I228: KNIGHTS | L228: KOFOED | N228: ECCLES | Q228: HAYDOCK
A229: GOALKICKERS
A230: FRANKSTON | C230: MURRAY 5 | F230: SULLIVAN 4 | I230: MILLANE 2 | L230: S RYAN 2 | N230: MEAD 2 | P230: MOORE | R230: R STUBBS | W230: CUMMINGS | X230: KING
A231: PRESTON | C231: ECCLES 2 | F231: BLAGROVE 2 | I231: GRAINGER 2 | L231: KNIGHTS | N231: HAYDOCK
A233: WERRIBEE | C233: 6 | D233: 6 | E233: =(C233*6)+D233 -> 42 | G233: 8 | H233: 9 | I233: =(G233*6)+H233 -> 57 | K233: 12 | L233: 12 | M233: =(K233*6)+L233 -> 84 | O233: 16 | P233: 14 | Q233: =(O233*6)+P233 -> 110 | S233: Venue: SPRINGVALE
A234: NORTH BALLARAT | C234: 0 | D234: 2 | E234: =(C234*6)+D234 -> 2 | G234: 3 | H234: 2 | I234: =(G234*6)+H234 -> 20 | K234: 4 | L234: 4 | M234: =(K234*6)+L234 -> 28 | O234: 5 | P234: 6 | Q234: =(O234*6)+P234 -> 36
A235: BEST PLAYERS
A236: WERRIBEE | C236: DYER | F236: BUTTON | I236: SAUNDERS | L236: BAILEY | N236: L SHANNON | Q236: ATKINS
A237: NORTH BALLARAT | C237: O'SULLIVAN | F237: ROBERTS | I237: PARTINGTON | L237: MCKAY | N237: COX
A238: GOALKICKERS
A239: WERRIBEE | C239: AZIZ 4 | F239: L SHANNON 4 | I239: CHURCHILL 2 | L239: BUTTON | N239: SATTERLEY | Q239: CHRISTO | T239: DYER | W239: SMITH | X239: EAMES
A240: NORTH BALLARAT | C240: O'SULLIVAN | F240: ROBERTS | I240: PARTINGTON | L240: MACKAY | N240: COX
A242: BYE | D242: SANDRINGHAM
A244: ROUND 6 | D244: 10TH MAY | J244: WEATHER
D245: 1ST QTR | H245: 2ND QTR | L245: 3RD QTR | P245: FINAL | S245: Venue: PORT MELBOURNE
A246: WILLIAMSTOWN | C246: 1 | D246: 1 | E246: =(C246*6)+D246 -> 7 | G246: 4 | H246: 3 | I246: =(G246*6)+H246 -> 27 | K246: 10 | L246: 4 | M246: =(K246*6)+L246 -> 64 | O246: 13 | P246: 5 | Q246: =(O246*6)+P246 -> 83 | S246: UMPIRES | Z246: LADDER | AC246: ROUND | AE246: 6
A247: PORT MELBOURNE | C247: 3 | D247: 7 | E247: =(C247*6)+D247 -> 25 | G247: 5 | H247: 9 | I247: =(G247*6)+H247 -> 39 | K247: 7 | L247: 14 | M247: =(K247*6)+L247 -> 56 | O247: 10 | P247: 19 | Q247: =(O247*6)+P247 -> 79
A248: BEST PLAYERS | W248: TEAM | X248: B | Y248: W | Z248: L | AA248: D | AB248: FOR | AC248: AGST | AD248: % | AE248: PTS
A249: WILLIAMSTOWN | C249: VASSALO | F249: HOWLETT | I249: PATTERSON | L249: HORE | N249: ZAVALAS | Q249: O'KEEFE
A250: PORT MELBOURNE | C250: CLOHESY | F250: DIBLASI | I250: WHELAN | L250: BLOMELEY | N250: SHANAHAN | Q250: EDWARDS | W250: FRANKSTON | X250: 1 | Y250: 5 | Z250: 0 | AA250: 0 | AB250: 543 | AC250: 353 | AD250: =(AB250/AC250)*100 -> 153.82436260623228 | AE250: =(Y250*4)+(AA250*2) -> 20
A251: GOALKICKERS | O251: KENNY | Q251: HOWLETT | W251: PRESTON | Y251: 5 | Z251: 1 | AA251: 0 | AB251: 582 | AC251: 481 | AD251: =(AB251/AC251)*100 -> 120.997920997921 | AE251: =(Y251*4)+(AA251*2) -> 20
A252: WILLIAMSTOWN | C252: O'KEEFE 4 | F252: SHANKS | H252: CARRICK | J252: HORE | L252: PASTORE | N252: JOHANSEN | Q252: DELRE | R252: GHAZI | W252: WILLIAMSTOWN | Y252: 4 | Z252: 1 | AA252: 1 | AB252: 525 | AC252: 460 | AD252: =(AB252/AC252)*100 -> 114.13043478260869 | AE252: =(Y252*4)+(AA252*2) -> 18
A253: PORT MELBOURNE | C253: EDWARDS 3 | F253: JAMES 2 | H253: BALLANTYNE | K253: CAMERON | M253: CLOHESY | P253: REID | R253: SHANAHAN | W253: SANDRINGHAM | X253: 1 | Y253: 4 | Z253: 1 | AA253: 0 | AB253: 489 | AC253: 295 | AD253: =(AB253/AC253)*100 -> 165.76271186440678 | AE253: =(Y253*4)+(AA253*2) -> 16
D254: 11TH MAY | J254: WEATHER | W254: PORT MELBOURNE | Y254: 3 | Z254: 3 | AA254: 0 | AB254: 480 | AC254: 447 | AD254: =(AB254/AC254)*100 -> 107.38255033557047 | AE254: =(Y254*4)+(AA254*2) -> 12
A255: FRANKSTON | C255: 5 | D255: 4 | E255: =(C255*6)+D255 -> 34 | G255: 7 | H255: 9 | I255: =(G255*6)+H255 -> 51 | K255: 12 | L255: 12 | M255: =(K255*6)+L255 -> 84 | O255: 16 | P255: 15 | Q255: =(O255*6)+P255 -> 111 | S255: Venue: FRANKSTON
A256: WERRIBEE | C256: 4 | D256: 3 | E256: =(C256*6)+D256 -> 27 | G256: 5 | H256: 8 | I256: =(G256*6)+H256 -> 38 | K256: 7 | L256: 12 | M256: =(K256*6)+L256 -> 54 | O256: 8 | P256: 12 | Q256: =(O256*6)+P256 -> 60 | W256: SPRINGVALE | X256: 1 | Y256: 2 | Z256: 3 | AA256: 0 | AB256: 500 | AC256: 397 | AD256: =(AB256/AC256)*100 -> 125.94458438287153 | AE256: =(Y256*4)+(AA256*2) -> 8
A257: BEST PLAYERS | W257: WERRIBEE | X257: 1 | Y257: 2 | Z257: 3 | AA257: 0 | AB257: 446 | AC257: 397 | AD257: =(AB257/AC257)*100 -> 112.34256926952142 | AE257: =(Y257*4)+(AA257*2) -> 8
A258: FRANKSTON | C258: CUMMINGS | F258: DAM CLARKE | I258: GOODWIN | L258: FREEMAN | N258: R STUBBS | Q258: MOORE | W258: TRARALGON | X258: 1 | Y258: 1 | Z258: 3 | AA258: 1 | AB258: 330 | AC258: 434 | AD258: =(AB258/AC258)*100 -> 76.036866359447004 | AE258: =(Y258*4)+(AA258*2) -> 6
A259: WERRIBEE | C259: DYER | F259: EAMES | I259: FITZPATRICK | L259: SMITH | N259: O'CONNOR | Q259: MURPHY | W259: BOX HILL | X259: 1 | Y259: 1 | Z259: 4 | AA259: 0 | AB259: 358 | AC259: 425 | AD259: =(AB259/AC259)*100 -> 84.235294117647058 | AE259: =(Y259*4)+(AA259*2) -> 4
A260: GOALKICKERS | Q260: MOORE | W260: COBURG | X260: 1 | Y260: 1 | Z260: 4 | AA260: 0 | AB260: 301 | AC260: 677 | AD260: =(AB260/AC260)*100 -> 44.460856720827181 | AE260: =(Y260*4)+(AA260*2) -> 4
A261: FRANKSTON | C261: S RYAN 5 | E261: DAM CLARKE 4 | I261: CUMMINGS 2 | L261: SULLIVAN 2 | O261: GEORGIOU | Q261: R STUBBS | W261: NORTH BALLARAT | X261: 1 | Y261: 0 | Z261: 5 | AA261: 0 | AB261: 305 | AC261: 464 | AD261: =(AB261/AC261)*100 -> 65.732758620689651 | AE261: =(Y261*4)+(AA261*2) -> 0
A262: WERRIBEE | C262: AZIZ 3 | F262: ATKINS 2 | I262: CHURCHILL | L262: O'CONNOR | N262: BUTTON
A264: PRESTON | C264: 0 | D264: 0 | E264: =(C264*6)+D264 -> 0 | G264: 6 | H264: 4 | I264: =(G264*6)+H264 -> 40 | K264: 9 | L264: 4 | M264: =(K264*6)+L264 -> 58 | O264: 13 | P264: 9 | Q264: =(O264*6)+P264 -> 87 | S264: Venue: PRESTON
A265: BOX HILL | C265: 6 | D265: 0 | E265: =(C265*6)+D265 -> 36 | G265: 8 | H265: 1 | I265: =(G265*6)+H265 -> 49 | K265: 11 | L265: 3 | M265: =(K265*6)+L265 -> 69 | O265: 11 | P265: 4 | Q265: =(O265*6)+P265 -> 70
A266: BEST PLAYERS
A267: PRESTON | C267: MORRISEY | F267: DOBELL | I267: KNIGHTS | L267: PLUNKETT | O267: ECCLES | Q267: MAIORANA
A268: BOX HILL | C268: NICHOL | F268: DUANE | I268: WILKINSON | L268: GLASSBORROW
A269: GOALKICKERS
A270: PRESTON | C270: ECCLES 5 | F270: KNIGHTS 3 | I270: GRANGER 2 | L270: HAYDOCK 2 | O270: McDONOUGH
A271: BOX HILL | C271: WILKINSON 3 | F271: TRANQUILLI 2 | I271: CROWLEY | L271: WRIGHT | N271: PARTHENIDES | Q271: ROWE | S271: ROBINSON | W271: DUANE
A273: SANDRINGHAM | C273: 1 | D273: 3 | E273: =(C273*6)+D273 -> 9 | G273: 6 | H273: 10 | I273: =(G273*6)+H273 -> 46 | K273: 14 | L273: 14 | M273: =(K273*6)+L273 -> 98 | O273: 20 | P273: 21 | Q273: =(O273*6)+P273 -> 141 | S273: Venue: TRARALGON
A274: TRARALGON | C274: 1 | D274: 2 | E274: =(C274*6)+D274 -> 8 | G274: 2 | H274: 3 | I274: =(G274*6)+H274 -> 15 | K274: 2 | L274: 5 | M274: =(K274*6)+L274 -> 17 | O274: 5 | P274: 7 | Q274: =(O274*6)+P274 -> 37
A275: BEST PLAYERS
A276: SANDRINGHAM | C276: FRATER | F276: MURRAY | I276: MACGEORGE | L276: SNOOKS | O276: RIENIETS
A277: TRARALGON | C277: MOYLAN | F277: WOLFE | I277: BURRIDGE | L277: CAMPBELL | O277: BRADLEY
A278: GOALKICKERS
A279: SANDRINGHAM | C279: AMIET 4 | E279: BAXTER 4 | H279: SNOOKS 3 | J279: MOONEY 2 | M279: GRANT | O279: SCOTT-BRANIGAN | S279: FRATER | V279: CLARKE | X279: OAKLEY | AA279: SAUTNER | AC279: DEAR
A280: TRARALGON | C280: DOYLE 2 | F280: WOLFE | I280: TRESIDER | L280: JENNINGS
A282: SPRINGVALE | C282: 1 | D282: 11 | E282: =(C282*6)+D282 -> 17 | G282: 9 | H282: 15 | I282: =(G282*6)+H282 -> 69 | K282: 18 | L282: 20 | M282: =(K282*6)+L282 -> 128 | O282: 28 | P282: 24 | Q282: =(O282*6)+P282 -> 192 | S282: Venue: SPRINGVALE
A283: COBURG | C283: 0 | D283: 1 | E283: =(C283*6)+D283 -> 1 | G283: 1 | H283: 1 | I283: =(G283*6)+H283 -> 7 | K283: 3 | L283: 3 | M283: =(K283*6)+L283 -> 21 | O283: 4 | P283: 6 | Q283: =(O283*6)+P283 -> 30
A284: BEST PLAYERS
A285: SPRINGVALE | C285: TAYLOR | F285: KNIGHT | I285: D CARROLL | L285: O'DONNELL | O285: HARD | Q285: SMITH
A286: COBURG | C286: KHEIR | F286: ALESSIO | I286: WESTON | L286: SOURASIS
A287: GOALKICKERS
A288: SPRINGVALE | C288: SMITH 7 | E288: KNIGHT 5 | G288: HARD 4 | I288: J CARROLL 2 | L288: O'BRIEN 2 | N288: CAPSALIS 2 | Q288: DYSON-HOLLAND 2 | W288: O'DONNELL | X288: D LIELNORS | AA288: K LIELNORS | AD288: TAYLOR
A289: COBURG | C289: KHEIR 2 | F289: WESTON | I289: ALESSIO
A291: BYE | D291: NORTH BALLARAT
A293: ROUND 7 | D293: 17TH MAY | J293: WEATHER
D294: 1ST QTR | H294: 2ND QTR | L294: 3RD QTR | P294: FINAL | S294: Venue: WERRIBEE
A295: WERRIBEE | C295: 4 | D295: 4 | E295: =(C295*6)+D295 -> 28 | G295: 7 | H295: 6 | I295: =(G295*6)+H295 -> 48 | K295: 13 | L295: 6 | M295: =(K295*6)+L295 -> 84 | O295: 22 | P295: 9 | Q295: =(O295*6)+P295 -> 141 | S295: UMPIRES | Z295: LADDER | AC295: ROUND | AE295: 7
A296: PORT MELBOURNE | C296: 0 | D296: 2 | E296: =(C296*6)+D296 -> 2 | G296: 2 | H296: 7 | I296: =(G296*6)+H296 -> 19 | K296: 4 | L296: 10 | M296: =(K296*6)+L296 -> 34 | O296: 7 | P296: 12 | Q296: =(O296*6)+P296 -> 54
A297: BEST PLAYERS | W297: TEAM | X297: B | Y297: W | Z297: L | AA297: D | AB297: FOR | AC297: AGST | AD297: % | AE297: PTS
A298: WERRIBEE | C298: ATKINS | F298: CHURCHILL | I298: AZIZ | L298: LOVE | N298: PULI | P298: BAILEY
A299: PORT MELBOURNE | C299: TINSLEY | F299: HOLLOW | I299: SHANAHAN | W299: FRANKSTON | X299: 1 | Y299: 6 | Z299: 0 | AA299: 0 | AB299: 692 | AC299: 399 | AD299: =(AB299/AC299)*100 -> 173.43358395989975 | AE299: =(Y299*4)+(AA299*2) -> 24
A300: GOALKICKERS | O300: McINTOSH | Q300: FASTUCA | W300: SANDRINGHAM | X300: 1 | Y300: 5 | Z300: 1 | AA300: 0 | AB300: 560 | AC300: 336 | AD300: =(AB300/AC300)*100 -> 166.66666666666669 | AE300: =(Y300*4)+(AA300*2) -> 20
A301: WERRIBEE | C301: AZIZ 8 | E301: SHAW 4 | G301: CHURCHILL 2 | J301: MURPHY 2 | L301: LOVE | N301: EAMES | P301: SPROULE | R301: GRAY | W301: PRESTON | Y301: 5 | Z301: 2 | AA301: 0 | AB301: 639 | AC301: 578 | AD301: =(AB301/AC301)*100 -> 110.55363321799308 | AE301: =(Y301*4)+(AA301*2) -> 20
A302: PORT MELBOURNE | C302: EDWARDS 3 | F302: SETCHELL | I302: SHANAHAN | L302: SEXTON | N302: TINSLEY | W302: WILLIAMSTOWN | X302: 1 | Y302: 4 | Z302: 1 | AA302: 1 | AB302: 525 | AC302: 460 | AD302: =(AB302/AC302)*100 -> 114.13043478260869 | AE302: =(Y302*4)+(AA302*2) -> 18
W303: SPRINGVALE | X303: 1 | Y303: 3 | Z303: 3 | AA303: 0 | AB303: 597 | AC303: 454 | AD303: =(AB303/AC303)*100 -> 131.49779735682819 | AE303: =(Y303*4)+(AA303*2) -> 12
A304: SANDRINGHAM | C304: 1 | D304: 1 | E304: =(C304*6)+D304 -> 7 | G304: 3 | H304: 2 | I304: =(G304*6)+H304 -> 20 | K304: 6 | L304: 6 | M304: =(K304*6)+L304 -> 42 | O304: 10 | P304: 11 | Q304: =(O304*6)+P304 -> 71 | S304: Venue: BOX HILL
A305: BOX HILL | C305: 2 | D305: 3 | E305: =(C305*6)+D305 -> 15 | G305: 3 | H305: 3 | I305: =(G305*6)+H305 -> 21 | K305: 5 | L305: 3 | M305: =(K305*6)+L305 -> 33 | O305: 6 | P305: 5 | Q305: =(O305*6)+P305 -> 41 | W305: WERRIBEE | X305: 1 | Y305: 3 | Z305: 3 | AA305: 0 | AB305: 587 | AC305: 451 | AD305: =(AB305/AC305)*100 -> 130.15521064301552 | AE305: =(Y305*4)+(AA305*2) -> 12
A306: BEST PLAYERS | W306: PORT MELBOURNE | Y306: 3 | Z306: 4 | AA306: 0 | AB306: 534 | AC306: 588 | AD306: =(AB306/AC306)*100 -> 90.816326530612244 | AE306: =(Y306*4)+(AA306*2) -> 12
A307: SANDRINGHAM | C307: TREGEAR | F307: MURRAY | I307: MITCHELSON | L307: SCOTT-BRANIGAN | P307: NUGENT | R307: CLARKSON | W307: TRARALGON | X307: 1 | Y307: 1 | Z307: 4 | AA307: 1 | AB307: 376 | AC307: 535 | AD307: =(AB307/AC307)*100 -> 70.280373831775705 | AE307: =(Y307*4)+(AA307*2) -> 6
A308: BOX HILL | C308: DIMMATINA | F308: CROWLEY | I308: CUNNINGHAM | L308: TRANQUILLI | P308: LIVINGSTONE | S308: PORTER | W308: BOX HILL | X308: 1 | Y308: 1 | Z308: 5 | AA308: 0 | AB308: 399 | AC308: 496 | AD308: =(AB308/AC308)*100 -> 80.443548387096769 | AE308: =(Y308*4)+(AA308*2) -> 4
A309: GOALKICKERS | M309: SCOTT-BRANIGAN | Q309: MITCHELSON | W309: NORTH BALLARAT | X309: 1 | Y309: 1 | Z309: 5 | AA309: 0 | AB309: 406 | AC309: 510 | AD309: =(AB309/AC309)*100 -> 79.607843137254903 | AE309: =(Y309*4)+(AA309*2) -> 4
A310: SANDRINGHAM | C310: AMIET | E310: GRANT | G310: HAYNES | I310: KELLAWAY | L310: DEAR | N310: FRATER | P310: MURRAY | R310: BAXTER | W310: COBURG | X310: 1 | Y310: 1 | Z310: 5 | AA310: 0 | AB310: 347 | AC310: 826 | AD310: =(AB310/AC310)*100 -> 42.009685230024211 | AE310: =(Y310*4)+(AA310*2) -> 4
A311: BOX HILL | C311: CUNNINGHAM | F311: WILKINSON | I311: DUANE | K311: B ROWE | M311: LYNDON | O311: LIVINGSTONE
A313: FRANKSTON | C313: 4 | D313: 5 | E313: =(C313*6)+D313 -> 29 | G313: 9 | H313: 8 | I313: =(G313*6)+H313 -> 62 | K313: 13 | L313: 11 | M313: =(K313*6)+L313 -> 89 | O313: 22 | P313: 17 | Q313: =(O313*6)+P313 -> 149 | S313: Venue: COBURG
A314: COBURG | C314: 3 | D314: 5 | E314: =(C314*6)+D314 -> 23 | G314: 3 | H314: 5 | I314: =(G314*6)+H314 -> 23 | K314: 6 | L314: 8 | M314: =(K314*6)+L314 -> 44 | O314: 6 | P314: 10 | Q314: =(O314*6)+P314 -> 46
A315: BEST PLAYERS
A316: FRANKSTON | C316: FREEMAN | F316: GEORGIOU | I316: MACKAY | L316: D CLARKE | N316: MILLANE | Q316: MOORE
A317: COBURG | C317: PIGNATORA | F317: STEFANIC | I317: OPERLANDER | L317: ALESSIO
A318: GOALKICKERS
A319: FRANKSTON | C319: STUBBS 4 | E319: SULLIVAN 3 | H319: D CLARKE 3 | K319: S RYAN 2 | M319: GEORGIOU 2 | P319: MACKAY 2 | S319: MILLANE 2 | V319: CUMMINGS | X319: KING | Z319: BOWEY | AB319: D RYAN
A320: COBURG | C320: ALESSIO 3 | F320: MORAN | I320: OPPERLANDER | L320: ALESSIO
A322: SPRINGVALE | C322: 4 | D322: 4 | E322: =(C322*6)+D322 -> 28 | G322: 10 | H322: 5 | I322: =(G322*6)+H322 -> 65 | K322: 13 | L322: 9 | M322: =(K322*6)+L322 -> 87 | O322: 14 | P322: 13 | Q322: =(O322*6)+P322 -> 97 | S322: Venue: PRESTON
A323: PRESTON | C323: 1 | D323: 3 | E323: =(C323*6)+D323 -> 9 | G323: 4 | H323: 5 | I323: =(G323*6)+H323 -> 29 | K323: 6 | L323: 7 | M323: =(K323*6)+L323 -> 43 | O323: 8 | P323: 9 | Q323: =(O323*6)+P323 -> 57
A324: BEST PLAYERS
A325: SPRINGVALE | C325: D CARROLL | F325: TAYLOR | I325: J CARROLL | L325: WOODMAN | O325: HARD | Q325: O'DONNELL
A326: PRESTON | C326: HARDENBERG | F326: KNIGHTS | I326: ECCLES | L326: AIELLO | O326: HAYDOCK
A327: GOALKICKERS
A328: SPRINGVALE | C328: SMITH 7 | F328: SINNEMA 2 | I328: DYSON-HOLLAND 2 | M328: CAPSALIS | O328: LIELNORS | Q328: DILLON
A329: PRESTON | C329: ECCLES 3 | F329: GRANGER | I329: WITHER
C330: NIGHT MATCH
A331: NORTH BALLARAT | C331: 4 | D331: 4 | E331: =(C331*6)+D331 -> 28 | G331: 6 | H331: 9 | I331: =(G331*6)+H331 -> 45 | K331: 10 | L331: 12 | M331: =(K331*6)+L331 -> 72 | O331: 14 | P331: 17 | Q331: =(O331*6)+P331 -> 101 | S331: Venue: NORTH BALLARAT
A332: TRARALGON | C332: 2 | D332: 3 | E332: =(C332*6)+D332 -> 15 | G332: 5 | H332: 6 | I332: =(G332*6)+H332 -> 36 | K332: 5 | L332: 10 | M332: =(K332*6)+L332 -> 40 | O332: 5 | P332: 16 | Q332: =(O332*6)+P332 -> 46
A333: BEST PLAYERS
A334: NORTH BALLARAT | C334: MARTIN | F334: SHOLL | I334: T POLKINGHORNE | M334: BERRY | O334: O'SULLIVAN
A335: TRARALGON | C335: FORYS | F335: SHERRIF | I335: MORLEY | L335: DOYLE
A336: GOALKICKERS
A337: NORTH BALLARAT | C337: SHOLL 6 | F337: HOLMES 2 | I337: T POLKINGHORNE 2 | M337: LAMB | O337: OLDFIELD | R337: D QUINLAN | V337: SNIBSON
A338: TRARALGON | C338: FORYS 3 | F338: STOCKDALE | I338: DOYLE
A340: BYE | D340: WILLIAMSTOWN
A342: ROUND 8 | D342: 24TH MAY | J342: WEATHER
D343: 1ST QTR | H343: 2ND QTR | L343: 3RD QTR | P343: FINAL | S343: Venue: WILLIAMSTOWN
A344: FRANKSTON | C344: 5 | D344: 4 | E344: =(C344*6)+D344 -> 34 | G344: 12 | H344: 5 | I344: =(G344*6)+H344 -> 77 | K344: 17 | L344: 6 | M344: =(K344*6)+L344 -> 108 | O344: 21 | P344: 12 | Q344: =(O344*6)+P344 -> 138 | S344: UMPIRES | Z344: LADDER | AC344: ROUND | AE344: 8
A345: WILLIAMSTOWN | C345: 4 | D345: 3 | E345: =(C345*6)+D345 -> 27 | G345: 6 | H345: 4 | I345: =(G345*6)+H345 -> 40 | K345: 8 | L345: 8 | M345: =(K345*6)+L345 -> 56 | O345: 10 | P345: 9 | Q345: =(O345*6)+P345 -> 69
A346: BEST PLAYERS | W346: TEAM | X346: B | Y346: W | Z346: L | AA346: D | AB346: FOR | AC346: AGST | AD346: % | AE346: PTS
A347: FRANKSTON | C347: J PICKERING | F347: BURNELL | I347: MILLANE | L347: MOORE | N347: D CLARKE | Q347: LAWRENCE
A348: WILLIAMSTOWN | C348: HOWLETT | F348: O'KEEFE | I348: GHAZI | L348: FLAVELL | W348: FRANKSTON | X348: 1 | Y348: 7 | Z348: 0 | AA348: 0 | AB348: 830 | AC348: 468 | AD348: =(AB348/AC348)*100 -> 177.35042735042734 | AE348: =(Y348*4)+(AA348*2) -> 28
A349: GOALKICKERS | M349: KING 2 | O349: MACKAY | Q349: MOLLOY | W349: SANDRINGHAM | X349: 1 | Y349: 6 | Z349: 1 | AA349: 0 | AB349: 649 | AC349: 387 | AD349: =(AB349/AC349)*100 -> 167.7002583979328 | AE349: =(Y349*4)+(AA349*2) -> 24
A350: FRANKSTON | C350: D CLARKE 4 | F350: MEAD 4 | H350: MILLANE 3 | K350: J PICKERING 2 | N350: SULLIVAN 2 | Q350: BOWEY 2 | W350: PRESTON | Y350: 5 | Z350: 3 | AA350: 0 | AB350: 690 | AC350: 667 | AD350: =(AB350/AC350)*100 -> 103.44827586206897 | AE350: =(Y350*4)+(AA350*2) -> 20
A351: WILLIAMSTOWN | C351: O'KEEFE 3 | F351: HORE 2 | H351: HOWLETT 2 | K351: NEILSEN | M351: REAPER | O351: FRASER | W351: WILLIAMSTOWN | X351: 1 | Y351: 4 | Z351: 2 | AA351: 1 | AB351: 594 | AC351: 598 | AD351: =(AB351/AC351)*100 -> 99.331103678929765 | AE351: =(Y351*4)+(AA351*2) -> 18
D352: 26TH MAY | J352: WEATHER | W352: SPRINGVALE | X352: 1 | Y352: 4 | Z352: 3 | AA352: 0 | AB352: 717 | AC352: 524 | AD352: =(AB352/AC352)*100 -> 136.8320610687023 | AE352: =(Y352*4)+(AA352*2) -> 16
A353: NORTH BALLARAT | C353: 6 | D353: 3 | E353: =(C353*6)+D353 -> 39 | G353: 10 | H353: 7 | I353: =(G353*6)+H353 -> 67 | K353: 18 | L353: 8 | M353: =(K353*6)+L353 -> 116 | O353: 23 | P353: 8 | Q353: =(O353*6)+P353 -> 146 | S353: Venue: COBURG
A354: COBURG | C354: 0 | D354: 3 | E354: =(C354*6)+D354 -> 3 | G354: 2 | H354: 5 | I354: =(G354*6)+H354 -> 17 | K354: 3 | L354: 9 | M354: =(K354*6)+L354 -> 27 | O354: 7 | P354: 11 | Q354: =(O354*6)+P354 -> 53 | W354: WERRIBEE | X354: 1 | Y354: 4 | Z354: 3 | AA354: 0 | AB354: 680 | AC354: 520 | AD354: =(AB354/AC354)*100 -> 130.76923076923077 | AE354: =(Y354*4)+(AA354*2) -> 16
A355: BEST PLAYERS | W355: PORT MELBOURNE | X355: 1 | Y355: 3 | Z355: 4 | AA355: 0 | AB355: 534 | AC355: 588 | AD355: =(AB355/AC355)*100 -> 90.816326530612244 | AE355: =(Y355*4)+(AA355*2) -> 12
A356: NORTH BALLARAT | C356: GRANT | F356: LAMB | H356: NICHOLSON | K356: PARTINGTON | N356: O'SULLIVAN | Q356: MARTIN | W356: NORTH BALLARAT | X356: 1 | Y356: 2 | Z356: 5 | AA356: 0 | AB356: 552 | AC356: 563 | AD356: =(AB356/AC356)*100 -> 98.046181172291284 | AE356: =(Y356*4)+(AA356*2) -> 8
A357: COBURG | C357: WESTON | F357: PIGNATORE | I357: WILDE | W357: TRARALGON | X357: 1 | Y357: 1 | Z357: 5 | AA357: 1 | AB357: 445 | AC357: 628 | AD357: =(AB357/AC357)*100 -> 70.859872611464965 | AE357: =(Y357*4)+(AA357*2) -> 6
A358: GOALKICKERS | N358: TAYLOR | P358: T POLKINGHORNE | W358: BOX HILL | X358: 1 | Y358: 1 | Z358: 6 | AA358: 0 | AB358: 469 | AC358: 616 | AD358: =(AB358/AC358)*100 -> 76.13636363636364 | AE358: =(Y358*4)+(AA358*2) -> 4
A359: NORTH BALLARAT | C359: LAMB 6 | E359: HOLMES 3 | H359: SNIBSON 2 | J359: GRANT 2 | L359: HILLS | M359: McKAY | O359: DOYLE | Q359: ELLIS | S359: JONES | W359: COBURG | X359: 1 | Y359: 1 | Z359: 6 | AA359: 0 | AB359: 400 | AC359: 972 | AD359: =(AB359/AC359)*100 -> 41.152263374485599 | AE359: =(Y359*4)+(AA359*2) -> 4
A360: COBURG | C360: WILDE 2 | F360: ALESSIO | H360: KHEIR | J360: S McLEOD | L360: PIGNATORO | O360: TARANTO
D361: 25TH MAY | J361: WEATHER
A362: SANDRINGHAM | C362: 2 | D362: 2 | E362: =(C362*6)+D362 -> 14 | G362: 8 | H362: 9 | I362: =(G362*6)+H362 -> 57 | K362: 8 | L362: 13 | M362: =(K362*6)+L362 -> 61 | O362: 12 | P362: 17 | Q362: =(O362*6)+P362 -> 89 | S362: Venue: BEACH ROAD
A363: PRESTON | C363: 1 | D363: 3 | E363: =(C363*6)+D363 -> 9 | G363: 3 | H363: 4 | I363: =(G363*6)+H363 -> 22 | K363: 6 | L363: 8 | M363: =(K363*6)+L363 -> 44 | O363: 7 | P363: 9 | Q363: =(O363*6)+P363 -> 51
A364: BEST PLAYERS
A365: SANDRINGHAM | C365: CLARKSON | F365: RIENIETS | I365: MURRAY | L365: TREGEAR | O365: CLARKE | R365: BAXTER
A366: PRESTON | C366: HAYDOCK | F366: McDUFF | I366: HARDENBERG
A367: GOALKICKERS | R367: BAXTER
A368: SANDRINGHAM | C368: SCOTT-BRANIGAN 2 | G368: DEAR 2 | I368: AMIET 2 | K368: FRATER | M368: TREGEAR | O368: CLARKSON | Q368: OAKLEY | S368: NUGENT
A369: PRESTON | C369: ECCLES 2 | F369: PIESCIK | H369: DOBELL | J369: SINNI | L369: WINTHER | N369: HAYDOCK
A371: SPRINGVALE | C371: 2 | D371: 1 | E371: =(C371*6)+D371 -> 13 | G371: 6 | H371: 6 | I371: =(G371*6)+H371 -> 42 | K371: 9 | L371: 8 | M371: =(K371*6)+L371 -> 62 | O371: 18 | P371: 12 | Q371: =(O371*6)+P371 -> 120 | S371: Venue: SPRINGVALE
A372: BOX HILL | C372: 4 | D372: 4 | E372: =(C372*6)+D372 -> 28 | G372: 7 | H372: 5 | I372: =(G372*6)+H372 -> 47 | K372: 8 | L372: 8 | M372: =(K372*6)+L372 -> 56 | O372: 10 | P372: 10 | Q372: =(O372*6)+P372 -> 70
A373: BEST PLAYERS
A374: SPRINGVALE | C374: KNIGHT | F374: DELARUE | I374: D CARROLL | L374: O'DONNELL | O374: O'BRIEN | R374: J CARROLL
A375: BOX HILL | C375: LIVINGSTONE | F375: HOLLAND | I375: TRANQUILLI
A376: GOALKICKERS | R376: DELARUE
A377: SPRINGVALE | C377: SMITH 7 | F377: O'DONNELL 3 | I377: D CARROLL 2 | L377: DILLON 2 | N377: HILDEBRAND 2 | Q377: LIELNORS
A378: BOX HILL | C378: DUANE 2 | F378: DOUGLAS 2 | I378: LIVINGSTONE 2 | M378: DIMMATINA 2 | P378: ROWE | Q378: ROBINSON
A380: WERRIBEE | C380: 3 | D380: 4 | E380: =(C380*6)+D380 -> 22 | G380: 6 | H380: 7 | I380: =(G380*6)+H380 -> 43 | K380: 10 | L380: 14 | M380: =(K380*6)+L380 -> 74 | O380: 12 | P380: 21 | Q380: =(O380*6)+P380 -> 93 | S380: Venue: TRARALGON
A381: TRARALGON | C381: 1 | D381: 2 | E381: =(C381*6)+D381 -> 8 | G381: 5 | H381: 4 | I381: =(G381*6)+H381 -> 34 | K381: 9 | L381: 8 | M381: =(K381*6)+L381 -> 62 | O381: 10 | P381: 9 | Q381: =(O381*6)+P381 -> 69
A382: BEST PLAYERS
A383: WERRIBEE | C383: SHAW | F383: SAUNDERS | I383: CHRISTO | L383: PULI | N383: O'CONNOR | Q383: AZIZ
A384: TRARALGON | C384: WOLFE | F384: HOPKINS | I384: STOCKDALE | L384: CAMPBELL | N384: MORLEY | Q384: BENNETT
A385: GOALKICKERS
A386: WERRIBEE | C386: AZIZ 6 | E386: MURPHY 2 | H386: SHAW 2 | J386: WILLIAMS | M386: O'CONNOR
A387: TRARALGON | C387: FORYS 2 | F387: CAMPBELL 2 | I387: MORLEY | K387: MOYLAN | M387: HOPKINS | O387: JENNINGS | Q387: HAZELMAN
Q388: SMITH
A389: BYE | D389: PORT MELBOURNE
A391: ROUND 9 | D391: 31ST MAY | J391: WEATHER
D392: 1ST QTR | H392: 2ND QTR | L392: 3RD QTR | P392: FINAL | S392: Venue: BOX HILL
A393: BOX HILL | C393: 7 | D393: 1 | E393: =(C393*6)+D393 -> 43 | G393: 12 | H393: 5 | I393: =(G393*6)+H393 -> 77 | K393: 18 | L393: 8 | M393: =(K393*6)+L393 -> 116 | O393: 24 | P393: 12 | Q393: =(O393*6)+P393 -> 156 | S393: UMPIRES | Z393: LADDER | AC393: ROUND | AE393: 9
A394: TRARALGON | C394: 1 | D394: 3 | E394: =(C394*6)+D394 -> 9 | G394: 3 | H394: 3 | I394: =(G394*6)+H394 -> 21 | K394: 5 | L394: 4 | M394: =(K394*6)+L394 -> 34 | O394: 9 | P394: 5 | Q394: =(O394*6)+P394 -> 59
A395: BEST PLAYERS | W395: TEAM | X395: B | Y395: W | Z395: L | AA395: D | AB395: FOR | AC395: AGST | AD395: % | AE395: PTS
A396: BOX HILL | C396: CROWLEY | F396: LIVINGSTONE | J396: PORTER | M396: NICHOL | O396: TRANQUILLI | R396: DOUGLAS
A397: TRARALGON | C397: WOLFE | F397: CAMPBELL | J397: BRADLEY | M397: SMITH | W397: FRANKSTON | X397: 1 | Y397: 8 | Z397: 0 | AA397: 0 | AB397: 922 | AC397: 531 | AD397: =(AB397/AC397)*100 -> 173.63465160075327 | AE397: =(Y397*4)+(AA397*2) -> 32
A398: GOALKICKERS | M398: DIMMATINA 2 | P398: HEANEY | R398: ROBINSON | W398: SANDRINGHAM | X398: 1 | Y398: 6 | Z398: 2 | AA398: 0 | AB398: 712 | AC398: 479 | AD398: =(AB398/AC398)*100 -> 148.64300626304802 | AE398: =(Y398*4)+(AA398*2) -> 24
A399: BOX HILL | C399: DOUGLAS 5 | F399: SLATER 4 | H399: GRIFFEN 3 | J399: TRANQUILLI 2 | M399: ANDERSON 2 | P399: NICHOL 2 | R399: B ROWE 2 | W399: WILLIAMSTOWN | X399: 1 | Y399: 5 | Z399: 2 | AA399: 1 | AB399: 736 | AC399: 684 | AD399: =(AB399/AC399)*100 -> 107.60233918128654 | AE399: =(Y399*4)+(AA399*2) -> 22
A400: TRARALGON | C400: CAMPBELL 4 | F400: BURRIDGE 2 | I400: DOYLE | K400: FORYS | M400: WOLFE | W400: SPRINGVALE | X400: 1 | Y400: 5 | Z400: 3 | AA400: 0 | AB400: 826 | AC400: 588 | AD400: =(AB400/AC400)*100 -> 140.47619047619045 | AE400: =(Y400*4)+(AA400*2) -> 20
W401: PRESTON | Y401: 5 | Z401: 4 | AA401: 0 | AB401: 776 | AC401: 809 | AD401: =(AB401/AC401)*100 -> 95.920889987639057 | AE401: =(Y401*4)+(AA401*2) -> 20
A402: PORT MELBOURNE | C402: 6 | D402: 3 | E402: =(C402*6)+D402 -> 39 | G402: 11 | H402: 4 | I402: =(G402*6)+H402 -> 70 | K402: 16 | L402: 7 | M402: =(K402*6)+L402 -> 103 | O402: 23 | P402: 11 | Q402: =(O402*6)+P402 -> 149 | S402: Venue: PORT MELBOURNE
A403: COBURG | C403: 3 | D403: 2 | E403: =(C403*6)+D403 -> 20 | G403: 6 | H403: 4 | I403: =(G403*6)+H403 -> 40 | K403: 7 | L403: 4 | M403: =(K403*6)+L403 -> 46 | O403: 12 | P403: 7 | Q403: =(O403*6)+P403 -> 79 | W403: WERRIBEE | X403: 2 | Y403: 4 | Z403: 3 | AA403: 0 | AB403: 680 | AC403: 520 | AD403: =(AB403/AC403)*100 -> 130.76923076923077 | AE403: =(Y403*4)+(AA403*2) -> 16
A404: BEST PLAYERS | W404: PORT MELBOURNE | X404: 1 | Y404: 4 | Z404: 4 | AA404: 0 | AB404: 683 | AC404: 667 | AD404: =(AB404/AC404)*100 -> 102.39880059970015 | AE404: =(Y404*4)+(AA404*2) -> 16
A405: PORT MELBOURNE | C405: M CHEEL | F405: CLOHESY | I405: MORTON | L405: SETCHELL | O405: SEXTON | R405: EDWARDS | W405: BOX HILL | X405: 1 | Y405: 2 | Z405: 6 | AA405: 0 | AB405: 625 | AC405: 675 | AD405: =(AB405/AC405)*100 -> 92.592592592592595 | AE405: =(Y405*4)+(AA405*2) -> 8
A406: COBURG | C406: BEECHAM | F406: WILDE | I406: KHEIR | L406: TARANTO | O406: ALESSIO | R406: EZARD | W406: NORTH BALLARAT | X406: 1 | Y406: 2 | Z406: 6 | AA406: 0 | AB406: 614 | AC406: 672 | AD406: =(AB406/AC406)*100 -> 91.36904761904762 | AE406: =(Y406*4)+(AA406*2) -> 8
A407: GOALKICKERS | P407: GREENHAM | S407: JESS | W407: TRARALGON | X407: 1 | Y407: 1 | Z407: 6 | AA407: 1 | AB407: 504 | AC407: 784 | AD407: =(AB407/AC407)*100 -> 64.285714285714292 | AE407: =(Y407*4)+(AA407*2) -> 6
A408: PORT MELBOURNE | C408: SEXTON 5 | E408: WEEDING 4 | H408: EDWARDS 4 | K408: McGEE 3 | M408: REYNOLDS 2 | P408: JAMES 2 | R408: M CHEEL | W408: COBURG | X408: 1 | Y408: 1 | Z408: 7 | AA408: 0 | AB408: 479 | AC408: 1121 | AD408: =(AB408/AC408)*100 -> 42.729705619982163 | AE408: =(Y408*4)+(AA408*2) -> 4
A409: COBURG | C409: WILDE 4 | F409: ALESSIO 3 | I409: KHEIR 2 | L409: WESTON 2 | O409: WILLOUGHBY
D410: 1ST JUNE | J410: WEATHER
A411: FRANKSTON | C411: 3 | D411: 5 | E411: =(C411*6)+D411 -> 23 | G411: 9 | H411: 9 | I411: =(G411*6)+H411 -> 63 | K411: 12 | L411: 10 | M411: =(K411*6)+L411 -> 82 | O411: 13 | P411: 14 | Q411: =(O411*6)+P411 -> 92 | S411: Venue: FRANKSTON
A412: SANDRINGHAM | C412: 3 | D412: 4 | E412: =(C412*6)+D412 -> 22 | G412: 4 | H412: 5 | I412: =(G412*6)+H412 -> 29 | K412: 8 | L412: 9 | M412: =(K412*6)+L412 -> 57 | O412: 9 | P412: 9 | Q412: =(O412*6)+P412 -> 63
A413: BEST PLAYERS
A414: FRANKSTON | C414: MACKAY | F414: FREEMAN | I414: BURNELL | L414: D CLARKE | O414: DUNDAS | Q414: STUBBS
A415: SANDRINGHAM | C415: GRANT | F415: MACGEORGE
A416: GOALKICKERS
A417: FRANKSTON | C417: R STUBBS 3 | F417: D CLARKE 3 | I417: MILLANE 2 | L417: CUMMINGS 2 | O417: BOWEY | Q417: GEORGIOU | T417: MEAD
A418: SANDRINGHAM | C418: BAXTER 2 | F418: SNOOKS | H418: OAKLEY | J418: RIENIETS | L418: GRANT | N418: SCOTT-BRANIGAN | R418: SAUTNER | V418: NUGENT
A420: SPRINGVALE | C420: 4 | D420: 3 | E420: =(C420*6)+D420 -> 27 | G420: 7 | H420: 4 | I420: =(G420*6)+H420 -> 46 | K420: 11 | L420: 7 | M420: =(K420*6)+L420 -> 73 | O420: 16 | P420: 13 | Q420: =(O420*6)+P420 -> 109 | S420: Venue: SPRINGVALE
A421: NORTH BALLARAT | C421: 3 | D421: 1 | E421: =(C421*6)+D421 -> 19 | G421: 6 | H421: 2 | I421: =(G421*6)+H421 -> 38 | K421: 9 | L421: 4 | M421: =(K421*6)+L421 -> 58 | O421: 9 | P421: 8 | Q421: =(O421*6)+P421 -> 62
A422: BEST PLAYERS
A423: SPRINGVALE | C423: BURGMAN | F423: SUTHERLAND | I423: J CARROLL | L423: KNIGHT | O423: D CARROLL | R423: LITTLE
A424: NORTH BALLARAT | C424: G POLKINGHORNE | G424: T POLKINGHORNE | K424: BERRY | M424: DOYLE | O424: TAYLOR | R424: SNIBSON
A425: GOALKICKERS
A426: SPRINGVALE | C426: SMITH 5 | F426: LITTLE 5 | H426: J CARROLL 2 | K426: COURTNEY | M426: O'BRIEN | O426: KNIGHT | Q426: DELARUE
A427: NORTH BALLARAT | C427: G POLKINGHORNE 3 | G427: PARTINGTON 2 | J427: BROADBENT | M427: DOYLE | O427: ELLIS | Q427: SHOLL
A429: WILLIAMSTOWN | C429: 5 | D429: 3 | E429: =(C429*6)+D429 -> 33 | G429: 11 | H429: 6 | I429: =(G429*6)+H429 -> 72 | K429: 15 | L429: 8 | M429: =(K429*6)+L429 -> 98 | O429: 22 | P429: 10 | Q429: =(O429*6)+P429 -> 142 | S429: Venue: WILLIAMSTOWN
A430: PRESTON | C430: 3 | D430: 2 | E430: =(C430*6)+D430 -> 20 | G430: 6 | H430: 5 | I430: =(G430*6)+H430 -> 41 | K430: 9 | L430: 7 | M430: =(K430*6)+L430 -> 61 | O430: 13 | P430: 8 | Q430: =(O430*6)+P430 -> 86
A431: BEST PLAYERS
A432: WILLIAMSTOWN | C432: O'KEEFE | F432: GHAZI | I432: THOMPSON | L432: CARRICK | O432: HOWLETT | R432: WALLACE
A433: PRESTON | C433: AIELLO | F433: MAIORANA | I433: HAYDOCK | L433: ECCLES | O433: PLUNKETT
A434: GOALKICKERS
A435: WILLIAMSTOWN | C435: O'KEEFE 9 | F435: PASTORE 3 | I435: NIELSEN 2 | L435: THOMPSON 2 | O435: FRASER 2 | R435: GHAZI 2 | V435: CARRICK | X435: POTTER
A436: PRESTON | C436: ECCLES 4 | F436: PIESCIK 2 | I436: PENN 2 | K436: WINTHER 2 | N436: SINNI | P436: KNIGHTS | R436: PLUNKETT
A438: BYE | D438: WERRIBEE
A440: ROUND 10 | D440: 7TH JUNE | J440: WEATHER
D441: 1ST QTR | H441: 2ND QTR | L441: 3RD QTR | P441: FINAL | S441: Venue: NORTH BALLARAT
A442: NORTH BALLARAT | C442: 3 | D442: 6 | E442: =(C442*6)+D442 -> 24 | G442: 4 | H442: 11 | I442: =(G442*6)+H442 -> 35 | K442: 5 | L442: 16 | M442: =(K442*6)+L442 -> 46 | O442: 10 | P442: 23 | Q442: =(O442*6)+P442 -> 83 | S442: UMPIRES | Z442: LADDER | AC442: ROUND | AE442: 10
A443: WILLIAMSTOWN | C443: 2 | D443: 3 | E443: =(C443*6)+D443 -> 15 | G443: 3 | H443: 4 | I443: =(G443*6)+H443 -> 22 | K443: 6 | L443: 6 | M443: =(K443*6)+L443 -> 42 | O443: 10 | P443: 7 | Q443: =(O443*6)+P443 -> 67
A444: BEST PLAYERS | W444: TEAM | X444: B | Y444: W | Z444: L | AA444: D | AB444: FOR | AC444: AGST | AD444: % | AE444: PTS
A445: NORTH BALLARAT | C445: SNIBSON | E445: DOYLE | H445: DOHNT | K445: PARTINGTON | N445: T POLKINGHORNE | R445: NICHOLSON
A446: WILLIAMSTOWN | C446: GHAZI | E446: FRASER | H446: MAHONEY | K446: PASTORE | N446: WALLACE | R446: HOWLETT | W446: FRANKSTON | X446: 1 | Y446: 9 | Z446: 0 | AA446: 0 | AB446: 1060 | AC446: 598 | AD446: =(AB446/AC446)*100 -> 177.25752508361202 | AE446: =(Y446*4)+(AA446*2) -> 36
A447: GOALKICKERS | W447: SANDRINGHAM | X447: 1 | Y447: 7 | Z447: 2 | AA447: 0 | AB447: 845 | AC447: 528 | AD447: =(AB447/AC447)*100 -> 160.03787878787878 | AE447: =(Y447*4)+(AA447*2) -> 28
A448: NORTH BALLARAT | C448: DOHNT 2 | F448: GRANT 2 | I448: SHOLL 2 | L448: DOYLE | N448: HILLS | P448: TAYLOR | R448: YORK | W448: SPRINGVALE | X448: 1 | Y448: 6 | Z448: 3 | AA448: 0 | AB448: 955 | AC448: 677 | AD448: =(AB448/AC448)*100 -> 141.06351550960119 | AE448: =(Y448*4)+(AA448*2) -> 24
A449: WILLIAMSTOWN | C449: O'KEEFE 4 | F449: NEILSEN | I449: GHAZI | K449: PASTORE | M449: DELRE | O449: GOULD | Q449: HOWLETT | W449: WILLIAMSTOWN | X449: 1 | Y449: 5 | Z449: 3 | AA449: 1 | AB449: 803 | AC449: 767 | AD449: =(AB449/AC449)*100 -> 104.6936114732725 | AE449: =(Y449*4)+(AA449*2) -> 22
W450: PORT MELBOURNE | X450: 1 | Y450: 5 | Z450: 4 | AA450: 0 | AB450: 773 | AC450: 747 | AD450: =(AB450/AC450)*100 -> 103.4805890227577 | AE450: =(Y450*4)+(AA450*2) -> 20
A451: PORT MELBOURNE | C451: 4 | D451: 3 | E451: =(C451*6)+D451 -> 27 | G451: 9 | H451: 6 | I451: =(G451*6)+H451 -> 60 | K451: 12 | L451: 9 | M451: =(K451*6)+L451 -> 81 | O451: 13 | P451: 12 | Q451: =(O451*6)+P451 -> 90 | S451: Venue: PORT MELBOURNE
A452: BOX HILL | C452: 2 | D452: 2 | E452: =(C452*6)+D452 -> 14 | G452: 8 | H452: 6 | I452: =(G452*6)+H452 -> 54 | K452: 8 | L452: 9 | M452: =(K452*6)+L452 -> 57 | O452: 11 | P452: 14 | Q452: =(O452*6)+P452 -> 80 | W452: PRESTON | X452: 1 | Y452: 5 | Z452: 4 | AA452: 0 | AB452: 776 | AC452: 809 | AD452: =(AB452/AC452)*100 -> 95.920889987639057 | AE452: =(Y452*4)+(AA452*2) -> 20
A453: BEST PLAYERS | W453: WERRIBEE | X453: 2 | Y453: 4 | Z453: 4 | AA453: 0 | AB453: 769 | AC453: 649 | AD453: =(AB453/AC453)*100 -> 118.4899845916795 | AE453: =(Y453*4)+(AA453*2) -> 16
A454: PORT MELBOURNE | C454: JAMES | F454: CLOHESY | I454: SETCHELL | L454: MADDEN | N454: EDWARDS | Q454: SHANAHAN | W454: NORTH BALLARAT | X454: 1 | Y454: 3 | Z454: 6 | AA454: 0 | AB454: 697 | AC454: 739 | AD454: =(AB454/AC454)*100 -> 94.31664411366711 | AE454: =(Y454*4)+(AA454*2) -> 12
A455: BOX HILL | C455: LIVINGSTONE | F455: PORTER | I455: DUANE | L455: DOUGLAS | N455: TRANQUILLI | Q455: CUNNINGHAM | W455: BOX HILL | X455: 1 | Y455: 2 | Z455: 7 | AA455: 0 | AB455: 705 | AC455: 765 | AD455: =(AB455/AC455)*100 -> 92.156862745098039 | AE455: =(Y455*4)+(AA455*2) -> 8
A456: GOALKICKERS | W456: TRARALGON | X456: 1 | Y456: 1 | Z456: 7 | AA456: 1 | AB456: 571 | AC456: 922 | AD456: =(AB456/AC456)*100 -> 61.930585683297181 | AE456: =(Y456*4)+(AA456*2) -> 6
A457: PORT MELBOURNE | C457: SETCHELL 5 | F457: EDWARDS 4 | I457: WEEDING | K457: SHANAHAN | N457: KERSHAW | Q457: HOFFMAN | W457: COBURG | X457: 1 | Y457: 1 | Z457: 8 | AA457: 0 | AB457: 528 | AC457: 1254 | AD457: =(AB457/AC457)*100 -> 42.105263157894733 | AE457: =(Y457*4)+(AA457*2) -> 4
A458: BOX HILL | C458: DUANE 4 | F458: SLATER 3 | I458: TRANQUILLI 2 | M458: HOLLAND | P458: CRISP
A460: SPRINGVALE | C460: 4 | D460: 5 | E460: =(C460*6)+D460 -> 29 | G460: 9 | H460: 9 | I460: =(G460*6)+H460 -> 63 | K460: 13 | L460: 16 | M460: =(K460*6)+L460 -> 94 | O460: 18 | P460: 21 | Q460: =(O460*6)+P460 -> 129 | S460: Venue: WERRIBEE
A461: WERRIBEE | C461: 2 | D461: 2 | E461: =(C461*6)+D461 -> 14 | G461: 5 | H461: 5 | I461: =(G461*6)+H461 -> 35 | K461: 7 | L461: 9 | M461: =(K461*6)+L461 -> 51 | O461: 13 | P461: 11 | Q461: =(O461*6)+P461 -> 89
A462: BEST PLAYERS
A463: SPRINGVALE | C463: KNIGHT | F463: CAPLES | I463: J CARROLL | L463: D CARROLL | O463: DELARUE | R463: SUTHERLAND
A464: WERRIBEE | C464: WILLIAMS | F464: SHAW | I464: PULI | L464: SAUNDERS | O464: AZIZ | R464: O'CONNOR
A465: GOALKICKERS
A466: SPRINGVALE | C466: SMITH 7 | F466: LITTLE 4 | I466: DILLON 2 | L466: DEETH | N466: HARD | P466: KNIGHT | R466: O'DONNELL | V466: WOODMAN
A467: WERRIBEE | C467: AZIZ 4 | F467: CAMILLIERI 2 | J467: BUTTON 2 | M467: CHURCHILL 2 | P467: MURPHY | R467: LOVE | T467: O'CONNOR
D468: 8TH JUNE | J468: WEATHER
A469: FRANKSTON | C469: 7 | D469: 5 | E469: =(C469*6)+D469 -> 47 | G469: 10 | H469: 10 | I469: =(G469*6)+H469 -> 70 | K469: 14 | L469: 14 | M469: =(K469*6)+L469 -> 98 | O469: 20 | P469: 18 | Q469: =(O469*6)+P469 -> 138 | S469: Venue: FRANKSTON
A470: TRARALGON | C470: 2 | D470: 0 | E470: =(C470*6)+D470 -> 12 | G470: 4 | H470: 3 | I470: =(G470*6)+H470 -> 27 | K470: 7 | L470: 5 | M470: =(K470*6)+L470 -> 47 | O470: 10 | P470: 7 | Q470: =(O470*6)+P470 -> 67
A471: BEST PLAYERS
A472: FRANKSTON | C472: FREEMAN | F472: HOPGOOD | I472: CHARLES | L472: GEORGIOU | O472: MOORE | Q472: MURRAY
A473: TRARALGON | C473: DOYLE | F473: RAYNER | I473: JENNINGS | L473: SHERRIFF | O473: BENNETT
A474: GOALKICKERS
A475: FRANKSTON | C475: R STUBBS 4 | F475: DAM CLARKE 3 | I475: S RYAN 3 | K475: BOWEY 2 | M475: J PICKERING 2 | P475: MACKAY | R475: MOORE | T475: CUMMINGS | X475: MILLANE | AA475: GOODWIN | AC475: MOLLOY
A476: TRARALGON | C476: FORYS 3 | F476: DOYLE 2 | I476: MOYLAN | K476: CAMPBELL | M476: WOLFE | O476: BENNETT | Q476: MALONE
A478: SANDRINGHAM | C478: 5 | D478: 3 | E478: =(C478*6)+D478 -> 33 | G478: 9 | H478: 5 | I478: =(G478*6)+H478 -> 59 | K478: 15 | L478: 9 | M478: =(K478*6)+L478 -> 99 | O478: 20 | P478: 13 | Q478: =(O478*6)+P478 -> 133 | S478: Venue: BEACH ROAD
A479: COBURG | C479: 2 | D479: 1 | E479: =(C479*6)+D479 -> 13 | G479: 5 | H479: 2 | I479: =(G479*6)+H479 -> 32 | K479: 7 | L479: 4 | M479: =(K479*6)+L479 -> 46 | O479: 7 | P479: 7 | Q479: =(O479*6)+P479 -> 49
A480: BEST PLAYERS
A481: SANDRINGHAM | C481: OAKLEY | F481: NUGENT | I481: TEMPLETON | L481: D GRANT | N481: McCONVIL | Q481: SNOOKS
A482: COBURG | C482: WESTON | F482: PIGNATORO | I482: EZARD | L482: ALESSIO
A483: GOALKICKERS
A484: SANDRINGHAM | C484: TEMPLETON 6 | F484: D GRANT 6 | I484: OAKLEY 5 | L484: BAXTER | N484: FRATER | P484: SAUTNER
A485: COBURG | C485: CAPELLO 2 | F485: EZARD 2 | I485: ALESSIO | K485: WATSON | M485: SAURASSIS
A487: BYE | D487: PRESTON
A489: ROUND 11 | D489: 21ST JUNE | J489: WEATHER
D490: 1ST QTR | H490: 2ND QTR | L490: 3RD QTR | P490: FINAL | S490: Venue: PRESTON
A491: PORT MELBOURNE | C491: 2 | D491: 5 | E491: =(C491*6)+D491 -> 17 | G491: 9 | H491: 6 | I491: =(G491*6)+H491 -> 60 | K491: 11 | L491: 7 | M491: =(K491*6)+L491 -> 73 | O491: 15 | P491: 11 | Q491: =(O491*6)+P491 -> 101 | S491: UMPIRES | Z491: LADDER | AC491: ROUND | AE491: 11
A492: PRESTON | C492: 3 | D492: 2 | E492: =(C492*6)+D492 -> 20 | G492: 5 | H492: 3 | I492: =(G492*6)+H492 -> 33 | K492: 5 | L492: 9 | M492: =(K492*6)+L492 -> 39 | O492: 9 | P492: 10 | Q492: =(O492*6)+P492 -> 64
A493: BEST PLAYERS | W493: TEAM | X493: B | Y493: W | Z493: L | AA493: D | AB493: FOR | AC493: AGST | AD493: % | AE493: PTS
A494: PORT MELBOURNE | C494: GOLD | F494: MORTON | I494: SEXTON | L494: GREENAHM | O494: M CHEEL | Q494: JESS
A495: PRESTON | C495: MAIORANA | F495: POWER | I495: MORISSEY | L495: HAYDOCK | O495: AIELLO | Q495: WHITNALL | W495: FRANKSTON | X495: 1 | Y495: 10 | Z495: 0 | AA495: 0 | AB495: 1143 | AC495: 652 | AD495: =(AB495/AC495)*100 -> 175.30674846625766 | AE495: =(Y495*4)+(AA495*2) -> 40
A496: GOALKICKERS | W496: SPRINGVALE | X496: 1 | Y496: 7 | Z496: 3 | AA496: 0 | AB496: 1136 | AC496: 745 | AD496: =(AB496/AC496)*100 -> 152.48322147651007 | AE496: =(Y496*4)+(AA496*2) -> 28
A497: PORT MELBOURNE | C497: SEXTON 4 | F497: GREENHAM 4 | I497: KERSHAW 3 | L497: WEEDING 2 | O497: GOLD | Q497: CLOHESY | W497: SANDRINGHAM | X497: 1 | Y497: 7 | Z497: 3 | AA497: 0 | AB497: 919 | AC497: 632 | AD497: =(AB497/AC497)*100 -> 145.41139240506328 | AE497: =(Y497*4)+(AA497*2) -> 28
A498: PRESTON | C498: PLUNKETT 3 | F498: WILSON 2 | I498: WHITNALL | L498: PIESCIK | N498: KNIGHTS | P498: AIELLO | W498: WILLIAMSTOWN | X498: 1 | Y498: 6 | Z498: 3 | AA498: 1 | AB498: 914 | AC498: 838 | AD498: =(AB498/AC498)*100 -> 109.06921241050121 | AE498: =(Y498*4)+(AA498*2) -> 26
W499: PORT MELBOURNE | X499: 1 | Y499: 6 | Z499: 4 | AA499: 0 | AB499: 874 | AC499: 811 | AD499: =(AB499/AC499)*100 -> 107.76818742293466 | AE499: =(Y499*4)+(AA499*2) -> 24
A500: WERRIBEE | C500: 3 | D500: 1 | E500: =(C500*6)+D500 -> 19 | G500: 7 | H500: 2 | I500: =(G500*6)+H500 -> 44 | K500: 13 | L500: 7 | M500: =(K500*6)+L500 -> 85 | O500: 16 | P500: 8 | Q500: =(O500*6)+P500 -> 104 | S500: Venue: WERRIBEE | W500: WERRIBEE | X500: 2 | Y500: 5 | Z500: 4 | AA500: 0 | AB500: 873 | AC500: 723 | AD500: =(AB500/AC500)*100 -> 120.74688796680498 | AE500: =(Y500*4)+(AA500*2) -> 20
A501: SANDRINGHAM | C501: 1 | D501: 2 | E501: =(C501*6)+D501 -> 8 | G501: 5 | H501: 8 | I501: =(G501*6)+H501 -> 38 | K501: 6 | L501: 9 | M501: =(K501*6)+L501 -> 45 | O501: 10 | P501: 14 | Q501: =(O501*6)+P501 -> 74 | W501: PRESTON | X501: 1 | Y501: 5 | Z501: 5 | AA501: 0 | AB501: 840 | AC501: 913 | AD501: =(AB501/AC501)*100 -> 92.004381161007672 | AE501: =(Y501*4)+(AA501*2) -> 20
A502: BEST PLAYERS | W502: NORTH BALLARAT | X502: 1 | Y502: 3 | Z502: 7 | AA502: 0 | AB502: 751 | AC502: 822 | AD502: =(AB502/AC502)*100 -> 91.362530413625308 | AE502: =(Y502*4)+(AA502*2) -> 12
A503: WERRIBEE | C503: AZIZ | F503: SAUNDERS | I503: SHAW | L503: EAMES | O503: PULI | Q503: O'CONNOR | W503: BOX HILL | X503: 2 | Y503: 2 | Z503: 7 | AA503: 0 | AB503: 705 | AC503: 765 | AD503: =(AB503/AC503)*100 -> 92.156862745098039 | AE503: =(Y503*4)+(AA503*2) -> 8
A504: SANDRINGHAM | C504: D GRANT | F504: AMIET | W504: TRARALGON | X504: 1 | Y504: 1 | Z504: 8 | AA504: 1 | AB504: 639 | AC504: 1103 | AD504: =(AB504/AC504)*100 -> 57.932910244786939 | AE504: =(Y504*4)+(AA504*2) -> 6
A505: GOALKICKERS | W505: COBURG | X505: 1 | Y505: 1 | Z505: 9 | AA505: 0 | AB505: 599 | AC505: 1365 | AD505: =(AB505/AC505)*100 -> 43.882783882783883 | AE505: =(Y505*4)+(AA505*2) -> 4
A506: WERRIBEE | C506: AZIZ 6 | F506: SHAW 4 | I506: CHURCHILL 2 | L506: WRIGHT | N506: BUTTON | P506: SPROULE | R506: TAYLOR
A507: SANDRINGHAM | C507: AMIET 4 | F507: TEMPLETON 2 | I507: BAXTER | K507: GRANT | M507: CLARKSON | P507: NUGENT
D508: 22ND JUNE | J508: WEATHER
A509: FRANKSTON | C509: 1 | D509: 7 | E509: =(C509*6)+D509 -> 13 | G509: 7 | H509: 9 | I509: =(G509*6)+H509 -> 51 | K509: 8 | L509: 11 | M509: =(K509*6)+L509 -> 59 | O509: 12 | P509: 11 | Q509: =(O509*6)+P509 -> 83 | S509: Venue: NORTH BALLARAT
A510: NORTH BALLARAT | C510: 3 | D510: 1 | E510: =(C510*6)+D510 -> 19 | G510: 5 | H510: 2 | I510: =(G510*6)+H510 -> 32 | K510: 8 | L510: 4 | M510: =(K510*6)+L510 -> 52 | O510: 8 | P510: 6 | Q510: =(O510*6)+P510 -> 54
A511: BEST PLAYERS
A512: FRANKSTON | C512: DUNDAS | F512: LEYS | I512: MOORE | L512: PICKERING | O512: KING | Q512: MACKAY
A513: NORTH BALLARAT | C513: T POLKINGHORNE | G513: MARTIN | I513: OXLEY | L513: BROADBENT | O513: DOYLE | Q513: COX
A514: GOALKICKERS
A515: FRANKSTON | C515: MACKAY 4 | F515: CLARKE 3 | I515: BOWEY 2 | L515: STUBBS | N515: MOORE | P515: SULLIVAN
A516: NORTH BALLARAT | C516: LAMB 2 | F516: DOHNT 2 | I516: COX 2 | K516: GRANT | M516: ELLIS
A518: WILLIAMSTOWN | C518: 2 | D518: 0 | E518: =(C518*6)+D518 -> 12 | G518: 10 | H518: 4 | I518: =(G518*6)+H518 -> 64 | K518: 12 | L518: 7 | M518: =(K518*6)+L518 -> 79 | O518: 16 | P518: 15 | Q518: =(O518*6)+P518 -> 111 | S518: Venue: COBURG
A519: COBURG | C519: 3 | D519: 5 | E519: =(C519*6)+D519 -> 23 | G519: 5 | H519: 5 | I519: =(G519*6)+H519 -> 35 | K519: 10 | L519: 9 | M519: =(K519*6)+L519 -> 69 | O519: 10 | P519: 11 | Q519: =(O519*6)+P519 -> 71
A520: BEST PLAYERS
A521: WILLIAMSTOWN | C521: HORE | F521: DELRE | I521: PASTORE | L521: McCARTNEY | O521: MAHONEY | Q521: SHIELDS
A522: COBURG | C522: M McLEOD | F522: PIGNATORO | I522: PETREVESKI | L522: FLETCHER | O522: TARANTO | Q522: LAFORGIA
A523: GOALKICKERS
A524: WILLIAMSTOWN | C524: PASTORE 5 | F524: MAHONEY 2 | I524: O'KEEFE 2 | L524: SHIELDS | N524: DELRE | P524: GHAZI | R524: BUGEJA | U524: HORE | W524: PATTERSON | X524: NEILSEN
A525: COBURG | C525: ALESSIO 2 | F525: WESTON 2 | I525: WILDE | K525: SPIVEY | M525: SUTHERLAND | P525: TORTORA | R525: EZARD
A527: SPRINGVALE | C527: 7 | D527: 2 | E527: =(C527*6)+D527 -> 44 | G527: 17 | H527: 6 | I527: =(G527*6)+H527 -> 108 | K527: 23 | L527: 10 | M527: =(K527*6)+L527 -> 148 | O527: 28 | P527: 13 | Q527: =(O527*6)+P527 -> 181 | S527: Venue: TRARALGON
A528: TRARALGON | C528: 4 | D528: 0 | E528: =(C528*6)+D528 -> 24 | G528: 5 | H528: 2 | I528: =(G528*6)+H528 -> 32 | K528: 8 | L528: 6 | M528: =(K528*6)+L528 -> 54 | O528: 10 | P528: 8 | Q528: =(O528*6)+P528 -> 68
A529: BEST PLAYERS
A530: SPRINGVALE | C530: LITTLE | F530: NAGEL | I530: O'DONNELL | L530: CARROLL | N530: HILDEBRANDT | Q530: KNIGHT
A531: TRARALGON | C531: DOYLE | F531: BURRIDGE | I531: WOLFE | L531: MALONE | N531: HOPKINS | Q531: TURNER
A532: GOALKICKERS
A533: SPRINGVALE | C533: LITTLE 11 | E533: CARROLL 3 | H533: DILLON 3 | J533: JEFFREY 2 | L533: JOY 2 | N533: LIELNORS 2 | Q533: SMITH | S533: O'DONNELL | W533: NAGEL | X533: KNIGHT | Z533: CLARK
A534: TRARALGON | C534: BURRIDGE 2 | F534: HABEL 2 | H534: JENNINGS | K534: SMITH | M534: WOLFE | O534: FORYS
A536: BYE | D536: BOX HILL
A538: ROUND 12 | D538: 28TH JUNE | J538: WEATHER
D539: 1ST QTR | H539: 2ND QTR | L539: 3RD QTR | P539: FINAL | S539: Venue: SPRINGVALE
A540: SPRINGVALE | C540: 4 | D540: 3 | E540: =(C540*6)+D540 -> 27 | G540: 8 | H540: 7 | I540: =(G540*6)+H540 -> 55 | K540: 11 | L540: 11 | M540: =(K540*6)+L540 -> 77 | O540: 14 | P540: 17 | Q540: =(O540*6)+P540 -> 101 | S540: UMPIRES | Z540: LADDER | AC540: ROUND | AE540: 12
A541: FRANKSTON | C541: 2 | D541: 4 | E541: =(C541*6)+D541 -> 16 | G541: 3 | H541: 6 | I541: =(G541*6)+H541 -> 24 | K541: 6 | L541: 11 | M541: =(K541*6)+L541 -> 47 | O541: 8 | P541: 13 | Q541: =(O541*6)+P541 -> 61
A542: BEST PLAYERS | W542: TEAM | X542: B | Y542: W | Z542: L | AA542: D | AB542: FOR | AC542: AGST | AD542: % | AE542: PTS
A543: SPRINGVALE | C543: D CARROLL | F543: DILLON | I543: DELARUE | L543: HILDEBRANDT | O543: O'DONNELL | R543: KNIGHT
A544: FRANKSTON | C544: MOORE | F544: LEYS | I544: CUMMINGS | L544: DUNDAS | W544: FRANKSTON | X544: 1 | Y544: 10 | Z544: 1 | AA544: 0 | AB544: 1204 | AC544: 753 | AD544: =(AB544/AC544)*100 -> 159.89375830013279 | AE544: =(Y544*4)+(AA544*2) -> 40
A545: GOALKICKERS | P545: COURTNEY | R545: NAGLE | W545: SPRINGVALE | X545: 1 | Y545: 8 | Z545: 3 | AA545: 0 | AB545: 1237 | AC545: 806 | AD545: =(AB545/AC545)*100 -> 153.47394540942929 | AE545: =(Y545*4)+(AA545*2) -> 32
A546: SPRINGVALE | C546: SMITH 3 | E546: J CARROLL 2 | H546: KNIGHT 2 | J546: DELARUE 2 | M546: O'DONNELL | P546: JOY | Q546: LIELNORS | W546: SANDRINGHAM | X546: 1 | Y546: 8 | Z546: 3 | AA546: 0 | AB546: 1015 | AC546: 665 | AD546: =(AB546/AC546)*100 -> 152.63157894736844 | AE546: =(Y546*4)+(AA546*2) -> 32
A547: FRANKSTON | C547: BOWEY 2 | F547: CUMMINGS 2 | J547: DUNDAS | L547: PICKERING | N547: D CLARKE | Q547: SULLIVAN | W547: WILLIAMSTOWN | X547: 1 | Y547: 7 | Z547: 3 | AA547: 1 | AB547: 1069 | AC547: 909 | AD547: =(AB547/AC547)*100 -> 117.60176017601761 | AE547: =(Y547*4)+(AA547*2) -> 30
W548: WERRIBEE | X548: 2 | Y548: 6 | Z548: 4 | AA548: 0 | AB548: 997 | AC548: 760 | AD548: =(AB548/AC548)*100 -> 131.18421052631578 | AE548: =(Y548*4)+(AA548*2) -> 24
A549: NORTH BALLARAT | C549: 4 | D549: 3 | E549: =(C549*6)+D549 -> 27 | G549: 6 | H549: 9 | I549: =(G549*6)+H549 -> 45 | K549: 7 | L549: 13 | M549: =(K549*6)+L549 -> 55 | O549: 8 | P549: 15 | Q549: =(O549*6)+P549 -> 63 | S549: Venue: NORTH BALLARAT
A550: PRESTON | C550: 2 | D550: 1 | E550: =(C550*6)+D550 -> 13 | G550: 4 | H550: 2 | I550: =(G550*6)+H550 -> 26 | K550: 5 | L550: 4 | M550: =(K550*6)+L550 -> 34 | O550: 6 | P550: 4 | Q550: =(O550*6)+P550 -> 40 | W550: PORT MELBOURNE | X550: 1 | Y550: 6 | Z550: 5 | AA550: 0 | AB550: 907 | AC550: 907 | AD550: =(AB550/AC550)*100 -> 100 | AE550: =(Y550*4)+(AA550*2) -> 24
A551: BEST PLAYERS | W551: PRESTON | X551: 1 | Y551: 5 | Z551: 6 | AA551: 0 | AB551: 880 | AC551: 976 | AD551: =(AB551/AC551)*100 -> 90.163934426229503 | AE551: =(Y551*4)+(AA551*2) -> 20
A552: NORTH BALLARAT | C552: T POLKINGHORNE | G552: DOYLE | I552: FLETCHER | L552: FIELD | N552: G POLKINGHORNE | R552: BROADBENT | W552: NORTH BALLARAT | X552: 1 | Y552: 4 | Z552: 7 | AA552: 0 | AB552: 814 | AC552: 862 | AD552: =(AB552/AC552)*100 -> 94.431554524361943 | AE552: =(Y552*4)+(AA552*2) -> 16
A553: PRESTON | C553: McDUFF | G553: MORRISEY | I553: AIELLO | L553: POWER | N553: PLUNKETT | W553: BOX HILL | X553: 2 | Y553: 2 | Z553: 8 | AA553: 0 | AB553: 742 | AC553: 889 | AD553: =(AB553/AC553)*100 -> 83.464566929133852 | AE553: =(Y553*4)+(AA553*2) -> 8
A554: GOALKICKERS | W554: TRARALGON | X554: 1 | Y554: 1 | Z554: 9 | AA554: 1 | AB554: 710 | AC554: 1258 | AD554: =(AB554/AC554)*100 -> 56.43879173290938 | AE554: =(Y554*4)+(AA554*2) -> 6
A555: NORTH BALLARAT | C555: DOHNT 2 | F555: PARTINGTON | I555: G POLKINGHORNE | M555: LAMB | O555: FLETCHER | Q555: QUINLAN | W555: COBURG | X555: 2 | Y555: 1 | Z555: 9 | AA555: 0 | AB555: 599 | AC555: 1365 | AD555: =(AB555/AC555)*100 -> 43.882783882783883 | AE555: =(Y555*4)+(AA555*2) -> 4
A556: PRESTON | C556: PLUNKETT 2 | F556: ECCLES 2 | I556: McCREDDIN | L556: HABERMAN
D557: 29TH JUNE | J557: WEATHER
A558: WILLIAMSTOWN | C558: 3 | D558: 1 | E558: =(C558*6)+D558 -> 19 | G558: 9 | H558: 3 | I558: =(G558*6)+H558 -> 57 | K558: 17 | L558: 10 | M558: =(K558*6)+L558 -> 112 | O558: 23 | P558: 17 | Q558: =(O558*6)+P558 -> 155 | S558: Venue: WILLIAMSTOWN
A559: TRARALGON | C559: 1 | D559: 3 | E559: =(C559*6)+D559 -> 9 | G559: 3 | H559: 6 | I559: =(G559*6)+H559 -> 24 | K559: 6 | L559: 9 | M559: =(K559*6)+L559 -> 45 | O559: 10 | P559: 11 | Q559: =(O559*6)+P559 -> 71
A560: BEST PLAYERS
A561: WILLIAMSTOWN | C561: SHANKS | F561: GHAZI | I561: HORE | K561: PASTORE | N561: WEST | Q561: NASH
A562: TRARALGON | C562: MOYLAN | F562: JENNINGS | I562: HABEL | K562: DOYLE
A563: GOALKICKERS
A564: WILLIAMSTOWN | C564: PASTORE 7 | E564: DELRE 3 | G564: PATTERSON 2 | J564: POTTER 2 | L564: NASH 2 | N564: McGOWAN | Q564: SHANKS | S564: WEST | V564: SHIELDS | X564: GHAZI | Z564: SHEATHER | AC564: A MERRINGTON
A565: TRARALGON | C565: FORYS 3 | F565: MOYLAN 3 | I565: BURRIDGE 2 | L565: HABEL | N565: JENNINGS
A567: SANDRINGHAM | C567: 1 | D567: 7 | E567: =(C567*6)+D567 -> 13 | G567: 3 | H567: 15 | I567: =(G567*6)+H567 -> 33 | K567: 7 | L567: 17 | M567: =(K567*6)+L567 -> 59 | O567: 13 | P567: 18 | Q567: =(O567*6)+P567 -> 96 | S567: Venue: PORT MELBOURNE
A568: PORT MELBOURNE | C568: 3 | D568: 0 | E568: =(C568*6)+D568 -> 18 | G568: 3 | H568: 2 | I568: =(G568*6)+H568 -> 20 | K568: 4 | L568: 4 | M568: =(K568*6)+L568 -> 28 | O568: 4 | P568: 9 | Q568: =(O568*6)+P568 -> 33
A569: BEST PLAYERS
A570: SANDRINGHAM | C570: CROUGH | F570: MACGEORGE | I570: BAXTER | K570: NUGENT | N570: COGHLAN | Q570: COLLINS
A571: PORT MELBOURNE | C571: BALLANTYNE | F571: JAMES | I571: TINSLEY | K571: MADDEN | N571: HOLLOW | Q571: BUTTERWORTH
A572: GOALKICKERS
A573: SANDRINGHAM | C573: AMIET 4 | F573: BAXTER 3 | I573: SNOOKS 2 | L573: TREGEAR | N573: SCOTT-BRANAGAN | R573: ANGUS | V573: MURRAY
A574: PORT MELBOURNE | C574: EDWARDS | F574: KERSHAW | I574: BUTTERWORTH | M574: M CHEEL
A576: WERRIBEE | C576: 4 | D576: 8 | E576: =(C576*6)+D576 -> 32 | G576: 6 | H576: 13 | I576: =(G576*6)+H576 -> 49 | K576: 13 | L576: 18 | M576: =(K576*6)+L576 -> 96 | O576: 17 | P576: 22 | Q576: =(O576*6)+P576 -> 124 | S576: Venue: BOX HILL
A577: BOX HILL | C577: 1 | D577: 3 | E577: =(C577*6)+D577 -> 9 | G577: 4 | H577: 4 | I577: =(G577*6)+H577 -> 28 | K577: 5 | L577: 6 | M577: =(K577*6)+L577 -> 36 | O577: 5 | P577: 7 | Q577: =(O577*6)+P577 -> 37
A578: BEST PLAYERS
A579: WERRIBEE | C579: EAMES | F579: BAILEY | I579: GELLIE | K579: SAUNDERS | N579: FITZPATRICK | Q579: ATKINS
A580: BOX HILL | C580: WILKINSON
A581: GOALKICKERS
A582: WERRIBEE | C582: AZIZ 5 | F582: BUTTON 3 | I582: SPROULE 2 | L582: SHAW | N582: WRIGHT | P582: GELLIE | R582: EAMES | V582: O'CONNOR | Y582: MILES
A583: BOX HILL | C583: WILKINSON 3 | F583: ANDERSON | I583: NICHOL
A585: BYE | D585: COBURG
A587: ROUND 13 | D587: 5TH JULY | J587: WEATHER
D588: 1ST QTR | H588: 2ND QTR | L588: 3RD QTR | P588: FINAL | S588: Venue: PORT MELBOURNE
A589: FRANKSTON | C589: 1 | D589: 5 | E589: =(C589*6)+D589 -> 11 | G589: 2 | H589: 7 | I589: =(G589*6)+H589 -> 19 | K589: 7 | L589: 11 | M589: =(K589*6)+L589 -> 53 | O589: 10 | P589: 15 | Q589: =(O589*6)+P589 -> 75 | S589: UMPIRES | Z589: LADDER | AC589: ROUND | AE589: 13
A590: PORT MELBOURNE | C590: 2 | D590: 2 | E590: =(C590*6)+D590 -> 14 | G590: 5 | H590: 4 | I590: =(G590*6)+H590 -> 34 | K590: 6 | L590: 5 | M590: =(K590*6)+L590 -> 41 | O590: 9 | P590: 7 | Q590: =(O590*6)+P590 -> 61
A591: BEST PLAYERS | W591: TEAM | X591: B | Y591: W | Z591: L | AA591: D | AB591: FOR | AC591: AGST | AD591: % | AE591: PTS
A592: FRANKSTON | C592: LEYS | F592: MOORE | I592: COOPER | L592: CUMMINGS | O592: DUNDAS | Q592: MALLOY
A593: PORT MELBOURNE | C593: MORTON | F593: PICIAONE | I593: EDWRADS | L593: SETCHELL | O593: JAMES | Q593: JESS | W593: FRANKSTON | X593: 1 | Y593: 11 | Z593: 1 | AA593: 0 | AB593: 1279 | AC593: 814 | AD593: =(AB593/AC593)*100 -> 157.12530712530713 | AE593: =(Y593*4)+(AA593*2) -> 44
A594: GOALKICKERS | W594: SPRINGVALE | X594: 1 | Y594: 9 | Z594: 3 | AA594: 0 | AB594: 1392 | AC594: 879 | AD594: =(AB594/AC594)*100 -> 158.36177474402731 | AE594: =(Y594*4)+(AA594*2) -> 36
A595: FRANKSTON | C595: GOODWIN 3 | F595: COOPER 2 | I595: D CLARKE 2 | L595: GEORGIOU | N595: HOPGOOD | P595: GEORGE | W595: SANDRINGHAM | X595: 1 | Y595: 9 | Z595: 3 | AA595: 0 | AB595: 1124 | AC595: 729 | AD595: =(AB595/AC595)*100 -> 154.18381344307269 | AE595: =(Y595*4)+(AA595*2) -> 36
A596: PORT MELBOURNE | C596: REYNOLDS 3 | F596: BUTTERWORTH | I596: CLOHESY | K596: DWYER | M596: EDWARDS | P596: HOFFMAN | R596: JAMES | W596: WILLIAMSTOWN | X596: 1 | Y596: 7 | Z596: 4 | AA596: 1 | AB596: 1142 | AC596: 1064 | AD596: =(AB596/AC596)*100 -> 107.33082706766916 | AE596: =(Y596*4)+(AA596*2) -> 30
D597: 6TH JULY | J597: WEATHER | W597: WERRIBEE | X597: 2 | Y597: 7 | Z597: 4 | AA597: 0 | AB597: 1157 | AC597: 833 | AD597: =(AB597/AC597)*100 -> 138.89555822328933 | AE597: =(Y597*4)+(AA597*2) -> 28
A598: SPRINGVALE | C598: 3 | D598: 9 | E598: =(C598*6)+D598 -> 27 | G598: 9 | H598: 13 | I598: =(G598*6)+H598 -> 67 | K598: 17 | L598: 21 | M598: =(K598*6)+L598 -> 123 | O598: 22 | P598: 23 | Q598: =(O598*6)+P598 -> 155 | S598: Venue: WILLIAMSTOWN
A599: WILLIAMSTOWN | C599: 2 | D599: 0 | E599: =(C599*6)+D599 -> 12 | G599: 5 | H599: 1 | I599: =(G599*6)+H599 -> 31 | K599: 7 | L599: 3 | M599: =(K599*6)+L599 -> 45 | O599: 11 | P599: 7 | Q599: =(O599*6)+P599 -> 73 | W599: PORT MELBOURNE | X599: 1 | Y599: 6 | Z599: 6 | AA599: 0 | AB599: 968 | AC599: 982 | AD599: =(AB599/AC599)*100 -> 98.574338085539708 | AE599: =(Y599*4)+(AA599*2) -> 24
A600: BEST PLAYERS | W600: PRESTON | X600: 1 | Y600: 5 | Z600: 7 | AA600: 0 | AB600: 953 | AC600: 1136 | AD600: =(AB600/AC600)*100 -> 83.890845070422543 | AE600: =(Y600*4)+(AA600*2) -> 20
A601: SPRINGVALE | C601: DILLON | F601: DELARUE | I601: CARROLL | L601: JEFFREY | O601: KNIGHT | Q601: LIELNORS | W601: NORTH BALLARAT | X601: 1 | Y601: 4 | Z601: 8 | AA601: 0 | AB601: 878 | AC601: 971 | AD601: =(AB601/AC601)*100 -> 90.42224510813594 | AE601: =(Y601*4)+(AA601*2) -> 16
A602: WILLIAMSTOWN | C602: O'KEEFE | F602: McCARTNEY | I602: NASH | L602: GHAZI | W602: BOX HILL | X602: 2 | Y602: 3 | Z602: 8 | AA602: 0 | AB602: 850 | AC602: 958 | AD602: =(AB602/AC602)*100 -> 88.726513569937367 | AE602: =(Y602*4)+(AA602*2) -> 12
A603: GOALKICKERS | K603: LIELNORS 2 | M603: DELARUE 2 | P603: DILLON 2 | R603: KNIGHT | W603: TRARALGON | X603: 2 | Y603: 1 | Z603: 9 | AA603: 1 | AB603: 710 | AC603: 1258 | AD603: =(AB603/AC603)*100 -> 56.43879173290938 | AE603: =(Y603*4)+(AA603*2) -> 6
A604: SPRINGVALE | C604: SMITH 4 | E604: JEFFREY 3 | H604: CARROLL 2 | K604: COURTNEY 2 | N604: SUTHERLAND 2 | Q604: O'BRIEN 2 | W604: COBURG | X604: 2 | Y604: 1 | Z604: 10 | AA604: 0 | AB604: 668 | AC604: 1473 | AD604: =(AB604/AC604)*100 -> 45.349626612355735 | AE604: =(Y604*4)+(AA604*2) -> 4
A605: WILLIAMSTOWN | C605: O'KEEFE 5 | F605: GHAZI 2 | H605: McGOWAN | K605: SHANKS | M605: PASTORE | P605: DELRE
A607: SANDRINGHAM | C607: 3 | D607: 2 | E607: =(C607*6)+D607 -> 20 | G607: 5 | H607: 5 | I607: =(G607*6)+H607 -> 35 | K607: 11 | L607: 7 | M607: =(K607*6)+L607 -> 73 | O607: 16 | P607: 13 | Q607: =(O607*6)+P607 -> 109 | S607: Venue: BEACH ROAD
A608: NORTH BALLARAT | C608: 3 | D608: 6 | E608: =(C608*6)+D608 -> 24 | G608: 8 | H608: 7 | I608: =(G608*6)+H608 -> 55 | K608: 8 | L608: 7 | M608: =(K608*6)+L608 -> 55 | O608: 9 | P608: 10 | Q608: =(O608*6)+P608 -> 64
A609: BEST PLAYERS
A610: SANDRINGHAM | C610: HAYNES | F610: McKELLAR | I610: BAXTER | L610: SCOTT-BRANIGAN | P610: D GRANT | R610: FRATER
A611: NORTH BALLARAT | C611: HOLMES | F611: SHOLL | I611: PARTINGTON | L611: T POLKINGHORNE
A612: GOALKICKERS
A613: SANDRINGHAM | C613: ANGUS 4 | F613: OAKLEY 3 | H613: FOLEY 2 | J613: SNOOKS 2 | L613: AMIET 2 | N613: D GRANT | P613: CLARKE | R613: SCOTT-BRANIGAN
A614: NORTH BALLARAT | C614: SHOLL 4 | F614: PARTINGTON 2 | J614: G POLKINGHORNE | N614: T POLKINGHORNE | R614: QUINLAN
A616: WERRIBEE | C616: 1 | D616: 5 | E616: =(C616*6)+D616 -> 11 | G616: 10 | H616: 9 | I616: =(G616*6)+H616 -> 69 | K616: 15 | L616: 14 | M616: =(K616*6)+L616 -> 104 | O616: 24 | P616: 16 | Q616: =(O616*6)+P616 -> 160 | S616: Venue: WERRIBEE
A617: PRESTON | C617: 3 | D617: 4 | E617: =(C617*6)+D617 -> 22 | G617: 4 | H617: 5 | I617: =(G617*6)+H617 -> 29 | K617: 9 | L617: 5 | M617: =(K617*6)+L617 -> 59 | O617: 11 | P617: 7 | Q617: =(O617*6)+P617 -> 73
A618: BEST PLAYERS
A619: WERRIBEE | C619: AZIZ | F619: BUTTON | I619: REARDON | L619: ATKINS | O619: WRIGHT | Q619: DWYER
A620: PRESTON | C620: MORRISEY | F620: PASCOE | I620: PLUNKETT | L620: McDUFF
A621: GOALKICKERS
A622: WERRIBEE | C622: AZIZ 9 | F622: REARDON 4 | I622: ATKINS 2 | L622: BUTTON | N622: GOODEY | P622: SPROULE | R622: O'CONNOR | V622: DWYER | X622: WRIGHT | Z622: CHURCHILL | AC622: SHAW
A623: PRESTON | C623: ECCLES 3 | F623: PASCOE 2 | I623: WYATT 2 | L623: HAYDOCK | N623: KNIGHTS | P623: O'CONNOR | R623: PIESCIK
A625: BOX HILL | C625: 5 | D625: 4 | E625: =(C625*6)+D625 -> 34 | G625: 10 | H625: 8 | I625: =(G625*6)+H625 -> 68 | K625: 13 | L625: 15 | M625: =(K625*6)+L625 -> 93 | O625: 15 | P625: 18 | Q625: =(O625*6)+P625 -> 108 | S625: Venue: COBURG
A626: COBURG | C626: 2 | D626: 1 | E626: =(C626*6)+D626 -> 13 | G626: 5 | H626: 2 | I626: =(G626*6)+H626 -> 32 | K626: 7 | L626: 4 | M626: =(K626*6)+L626 -> 46 | O626: 10 | P626: 9 | Q626: =(O626*6)+P626 -> 69
A627: BEST PLAYERS
A628: BOX HILL | C628: LIVINGSTONE | F628: WILKINSON | I628: DOUGLAS | L628: JENKINS | O628: BANFIELD | Q628: TRANQUILLI
A629: COBURG | C629: M McLEOD | F629: OPPENLANDER | I629: EZARD | L629: LAFORDIA | O629: TARANTO | Q629: PREDESKI
A630: GOALKICKERS
A631: BOX HILL | C631: TRANQUILLI 3 | F631: BELLO 2 | H631: NICHOL 2 | J631: LIVINGSTONE 2 | M631: WARRY 2 | P631: DWAYN | R631: MAYHEW | V631: GRIFFEN | X631: SLATER
A632: COBURG | C632: ALESSIO 3 | F632: WILLOUGHBY 2 | J632: WESTON 2 | M632: TARANTO | P632: SPIVEY | R632: TORTORA
A634: BYE | D634: TRARALGON
A636: ROUND 14 | D636: 12TH JULY | J636: WEATHER | S636: Venue: BEACH ROAD
D637: 1ST QTR | H637: 2ND QTR | L637: 3RD QTR | P637: FINAL | S637: UMPIRES | V637: NATHAN
A638: SANDRINGHAM | C638: 4 | D638: 6 | E638: =(C638*6)+D638 -> 30 | G638: 7 | H638: 11 | I638: =(G638*6)+H638 -> 53 | K638: 11 | L638: 16 | M638: =(K638*6)+L638 -> 82 | O638: 12 | P638: 21 | Q638: =(O638*6)+P638 -> 93 | S638: ADAMS | Z638: LADDER | AC638: ROUND | AE638: 14
A639: WILLIAMSTOWN | C639: 1 | D639: 2 | E639: =(C639*6)+D639 -> 8 | G639: 3 | H639: 4 | I639: =(G639*6)+H639 -> 22 | K639: 6 | L639: 5 | M639: =(K639*6)+L639 -> 41 | O639: 9 | P639: 9 | Q639: =(O639*6)+P639 -> 63 | S639: DAVIDSON
A640: BEST PLAYERS | W640: TEAM | X640: B | Y640: W | Z640: L | AA640: D | AB640: FOR | AC640: AGST | AD640: % | AE640: PTS
A641: SANDRINGHAM | C641: NUGENT | F641: BAXTER | I641: CROUGH | L641: D GRANT | N641: COGHLAN | Q641: MACGEORGE
A642: WILLIAMSTOWN | C642: WALLACE | F642: McCARTNEY | I642: ZAVALAS | L642: FISHLEY | N642: O'KEEFE | Q642: KERRY | W642: FRANKSTON | X642: 1 | Y642: 12 | Z642: 1 | AA642: 0 | AB642: 1434 | AC642: 858 | AD642: =(AB642/AC642)*100 -> 167.13286713286712 | AE642: =(Y642*4)+(AA642*2) -> 48
A643: GOALKICKERS | W643: SANDRINGHAM | X643: 1 | Y643: 10 | Z643: 3 | AA643: 0 | AB643: 1217 | AC643: 792 | AD643: =(AB643/AC643)*100 -> 153.66161616161617 | AE643: =(Y643*4)+(AA643*2) -> 40
A644: SANDRINGHAM | C644: SNOOKS 4 | F644: AMIET 3 | I644: FOLEY 2 | K644: BAXTER 2 | N644: SCOTT-BRANAGAN | W644: SPRINGVALE | X644: 2 | Y644: 9 | Z644: 3 | AA644: 0 | AB644: 1392 | AC644: 879 | AD644: =(AB644/AC644)*100 -> 158.36177474402731 | AE644: =(Y644*4)+(AA644*2) -> 36
A645: WILLIAMSTOWN | C645: O'KEEFE 5 | F645: ZAVALAS | I645: CHAMPS | K645: GHAZI | M645: HOWLETT | W645: WERRIBEE | X645: 2 | Y645: 8 | Z645: 4 | AA645: 0 | AB645: 1346 | AC645: 897 | AD645: =(AB645/AC645)*100 -> 150.0557413600892 | AE645: =(Y645*4)+(AA645*2) -> 32
D646: 13TH JULY | J646: WEATHER | S646: Venue: PRESTON | W646: WILLIAMSTOWN | X646: 1 | Y646: 7 | Z646: 5 | AA646: 1 | AB646: 1205 | AC646: 1157 | AD646: =(AB646/AC646)*100 -> 104.14866032843561 | AE646: =(Y646*4)+(AA646*2) -> 30
A647: PRESTON | C647: 3 | D647: 4 | E647: =(C647*6)+D647 -> 22 | G647: 7 | H647: 9 | I647: =(G647*6)+H647 -> 51 | K647: 14 | L647: 13 | M647: =(K647*6)+L647 -> 97 | O647: 16 | P647: 14 | Q647: =(O647*6)+P647 -> 110 | S647: VOZZO | W647: PORT MELBOURNE | X647: 1 | Y647: 7 | Z647: 6 | AA647: 0 | AB647: 1094 | AC647: 1060 | AD647: =(AB647/AC647)*100 -> 103.20754716981133 | AE647: =(Y647*4)+(AA647*2) -> 28
A648: TRARALGON | C648: 0 | D648: 1 | E648: =(C648*6)+D648 -> 1 | G648: 1 | H648: 2 | I648: =(G648*6)+H648 -> 8 | K648: 2 | L648: 3 | M648: =(K648*6)+L648 -> 15 | O648: 2 | P648: 9 | Q648: =(O648*6)+P648 -> 21 | S648: ROWE | W648: PRESTON | X648: 1 | Y648: 6 | Z648: 7 | AA648: 0 | AB648: 1054 | AC648: 1157 | AD648: =(AB648/AC648)*100 -> 91.097666378565251 | AE648: =(Y648*4)+(AA648*2) -> 24
A649: BEST PLAYERS | S649: TWITT | W649: NORTH BALLARAT | X649: 1 | Y649: 4 | Z649: 9 | AA649: 0 | AB649: 956 | AC649: 1097 | AD649: =(AB649/AC649)*100 -> 87.14676390154969 | AE649: =(Y649*4)+(AA649*2) -> 16
A650: PRESTON | C650: WILSON | F650: PASCOE | I650: PLUNKETT | L650: AIELLO | O650: KOFOED | R650: DOBELL | W650: BOX HILL | X650: 2 | Y650: 3 | Z650: 9 | AA650: 0 | AB650: 894 | AC650: 1113 | AD650: =(AB650/AC650)*100 -> 80.323450134770894 | AE650: =(Y650*4)+(AA650*2) -> 12
A651: TRARALGON | C651: CAMERON | F651: MALONE | I651: SHIRREFF | L651: HABEL | O651: HOPKINS | R651: MORLEY | W651: TRARALGON | X651: 2 | Y651: 1 | Z651: 10 | AA651: 1 | AB651: 731 | AC651: 1368 | AD651: =(AB651/AC651)*100 -> 53.435672514619881 | AE651: =(Y651*4)+(AA651*2) -> 6
A652: GOALKICKERS | M652: MAIORANA | P652: HAYDOCK | W652: COBURG | X652: 2 | Y652: 1 | Z652: 11 | AA652: 0 | AB652: 732 | AC652: 1662 | AD652: =(AB652/AC652)*100 -> 44.04332129963899 | AE652: =(Y652*4)+(AA652*2) -> 4
A653: PRESTON | C653: WILSON 4 | E653: PASCOE 3 | H653: PLUNKETT 2 | K653: ECCLES 2 | M653: MANN | O653: WYATT | Q653: AIELLO
A654: TRARALGON | C654: BENNETT | F654: HABEL
A656: FRANKSTON | C656: 4 | D656: 5 | E656: =(C656*6)+D656 -> 29 | G656: 9 | H656: 7 | I656: =(G656*6)+H656 -> 61 | K656: 17 | L656: 13 | M656: =(K656*6)+L656 -> 115 | O656: 23 | P656: 17 | Q656: =(O656*6)+P656 -> 155 | S656: Venue: FRANKSTON
A657: BOX HILL | C657: 1 | D657: 1 | E657: =(C657*6)+D657 -> 7 | G657: 3 | H657: 5 | I657: =(G657*6)+H657 -> 23 | K657: 4 | L657: 8 | M657: =(K657*6)+L657 -> 32 | O657: 6 | P657: 8 | Q657: =(O657*6)+P657 -> 44 | S657: KELSEY :KANIZAY :RUSSO
A658: BEST PLAYERS
A659: FRANKSTON | C659: CUMMINGS | F659: MALLOY | I659: MOORE | L659: MURRAY | O659: HOPGOOD | R659: CHARLES
A660: BOX HILL | C660: WILKINSON | F660: PORTER | I660: TRANQUILLI | L660: HOLLAND
A661: GOALKICKERS
A662: FRANKSTON | C662: MURRAY 4 | E662: GOODWIN 4 | H662: MALLOY 2 | J662: LEYS 2 | L662: HOPGOOD 2 | N662: CUMMINGS 2 | Q662: MILLANE 2 | T662: A PICKERING | X662: MOORE | Z662: CLARKE | AB662: BOWEY | AD662: L TAYLOR
A663: BOX HILL | C663: TRANQUILLI 2 | F663: SLATER | H663: DUANE | J663: HOLLAND | M663: MAYHEW
A665: WERRIBEE | C665: 7 | D665: 7 | E665: =(C665*6)+D665 -> 49 | G665: 17 | H665: 9 | I665: =(G665*6)+H665 -> 111 | K665: 24 | L665: 12 | M665: =(K665*6)+L665 -> 156 | O665: 29 | P665: 15 | Q665: =(O665*6)+P665 -> 189 | S665: Venue: COBURG
A666: COBURG | C666: 2 | D666: 2 | E666: =(C666*6)+D666 -> 14 | G666: 4 | H666: 4 | I666: =(G666*6)+H666 -> 28 | K666: 5 | L666: 6 | M666: =(K666*6)+L666 -> 36 | O666: 9 | P666: 10 | Q666: =(O666*6)+P666 -> 64 | S666: BEARD :MANN
A667: BEST PLAYERS
A668: WERRIBEE | C668: AZIZ | F668: ATKINS | I668: O'CONNOR | L668: GELLIE | O668: GRAY | R668: DYER
A669: COBURG | C669: SOURASSIS | F669: OPPENLANDER | I669: BAGNATO | L669: WILDE | O669: LIPPENSTEIN
A670: GOALKICKERS
A671: WERRIBEE | C671: AZIZ 15 | F671: WRIGHT 4 | H671: O'CONNOR 2 | K671: CHURCHILL 2 | N671: ATKINS 2 | P671: SHAW | R671: GOODEY | U671: CHRISTOU | X671: MASSIS
A672: COBURG | C672: LA FORGIA 2 | F672: SPIVEY 2 | I672: WILDE 2 | K672: WILLOUGHBY | N672: S HARDY | Q672: TORTORA
A674: PORT MELBOURNE | C674: 5 | D674: 2 | E674: =(C674*6)+D674 -> 32 | G674: 12 | H674: 6 | I674: =(G674*6)+H674 -> 78 | K674: 15 | L674: 11 | M674: =(K674*6)+L674 -> 101 | O674: 19 | P674: 12 | Q674: =(O674*6)+P674 -> 126 | S674: Venue: NORTH BALLARAT
A675: NORTH BALLARAT | C675: 2 | D675: 3 | E675: =(C675*6)+D675 -> 15 | G675: 6 | H675: 4 | I675: =(G675*6)+H675 -> 40 | K675: 9 | L675: 8 | M675: =(K675*6)+L675 -> 62 | O675: 11 | P675: 12 | Q675: =(O675*6)+P675 -> 78 | S675: NELIS :JAMES REID
A676: BEST PLAYERS
A677: PORT MELBOURNE | C677: SETCHELL | F677: MORTON | I677: CAMERON | L677: WEEDING | O677: SEXTON | R677: JAMES
A678: NORTH BALLARAT | C678: FIELD | F678: HOLMES | I678: T POLKINGHORNE | M678: TAYLOR
A679: GOALKICKERS
A680: PORT MELBOURNE | C680: SEXTON 6 | F680: WEEDING 5 | I680: EDWARDS 3 | L680: DWYER 2 | N680: GREENHAM | Q680: JAMES | S680: PICIAONE
A681: NORTH BALLARAT | C681: COX 3 | E681: DOHNT 2 | G681: MARTIN | I681: LAMB | K681: HOLMES | M681: FIELD | O681: DOYLE | Q681: SNIBSON
A683: BYE | D683: SPRINGVALE
A685: ROUND 15 | D685: 19TH JULY | J685: WEATHER
D686: 1ST QTR | H686: 2ND QTR | L686: 3RD QTR | P686: FINAL | S686: Venue: WERRIBEE
A687: WERRIBEE | C687: 5 | D687: 1 | E687: =(C687*6)+D687 -> 31 | G687: 9 | H687: 6 | I687: =(G687*6)+H687 -> 60 | K687: 14 | L687: 6 | M687: =(K687*6)+L687 -> 90 | O687: 18 | P687: 15 | Q687: =(O687*6)+P687 -> 123 | S687: UMPIRES | Z687: LADDER | AC687: ROUND | AE687: 15
A688: WILLIAMSTOWN | C688: 4 | D688: 2 | E688: =(C688*6)+D688 -> 26 | G688: 7 | H688: 3 | I688: =(G688*6)+H688 -> 45 | K688: 9 | L688: 7 | M688: =(K688*6)+L688 -> 61 | O688: 10 | P688: 9 | Q688: =(O688*6)+P688 -> 69
A689: BEST PLAYERS | W689: TEAM | X689: B | Y689: W | Z689: L | AA689: D | AB689: FOR | AC689: AGST | AD689: % | AE689: PTS
A690: WERRIBEE | C690: BAILEY | F690: PULI | I690: CHURCHILL | L690: ATKINS | N690: GELLIE | Q690: MURPHY
A691: WILLIAMSTOWN | C691: NASH | F691: SHIELDS | I691: HORE | L691: SHANKS | N691: KERRY | Q691: WEST | W691: FRANKSTON | X691: 1 | Y691: 13 | Z691: 1 | AA691: 0 | AB691: 1549 | AC691: 922 | AD691: =(AB691/AC691)*100 -> 168.0043383947939 | AE691: =(Y691*4)+(AA691*2) -> 52
A692: GOALKICKERS | W692: SPRINGVALE | X692: 2 | Y692: 10 | Z692: 3 | AA692: 0 | AB692: 1512 | AC692: 965 | AD692: =(AB692/AC692)*100 -> 156.68393782383421 | AE692: =(Y692*4)+(AA692*2) -> 40
A693: WERRIBEE | C693: CHURCHILL 5 | F693: WRIGHT 3 | H693: BUTTON 3 | K693: AZIZ 3 | M693: SPROULE 2 | P693: REARDON | S693: BAILEY | W693: SANDRINGHAM | X693: 2 | Y693: 10 | Z693: 3 | AA693: 0 | AB693: 1217 | AC693: 792 | AD693: =(AB693/AC693)*100 -> 153.66161616161617 | AE693: =(Y693*4)+(AA693*2) -> 40
A694: WILLIAMSTOWN | C694: DELRE 4 | F694: O'KEEFE 2 | I694: SHIELDS | K694: PATTERSON | N694: WALLACE | P694: PASTORE | W694: WERRIBEE | X694: 2 | Y694: 9 | Z694: 4 | AA694: 0 | AB694: 1469 | AC694: 966 | AD694: =(AB694/AC694)*100 -> 152.0703933747412 | AE694: =(Y694*4)+(AA694*2) -> 36
D695: 20TH JULY | J695: WEATHER | W695: WILLIAMSTOWN | X695: 1 | Y695: 7 | Z695: 6 | AA695: 1 | AB695: 1274 | AC695: 1280 | AD695: =(AB695/AC695)*100 -> 99.53125 | AE695: =(Y695*4)+(AA695*2) -> 30
A696: BOX HILL | C696: 3 | D696: 0 | E696: =(C696*6)+D696 -> 18 | G696: 5 | H696: 3 | I696: =(G696*6)+H696 -> 33 | K696: 9 | L696: 8 | M696: =(K696*6)+L696 -> 62 | O696: 17 | P696: 10 | Q696: =(O696*6)+P696 -> 112 | S696: Venue: BOX HILL
A697: NORTH BALLARAT | C697: 4 | D697: 2 | E697: =(C697*6)+D697 -> 26 | G697: 7 | H697: 5 | I697: =(G697*6)+H697 -> 47 | K697: 7 | L697: 7 | M697: =(K697*6)+L697 -> 49 | O697: 7 | P697: 8 | Q697: =(O697*6)+P697 -> 50 | W697: PORT MELBOURNE | X697: 1 | Y697: 7 | Z697: 7 | AA697: 0 | AB697: 1180 | AC697: 1180 | AD697: =(AB697/AC697)*100 -> 100 | AE697: =(Y697*4)+(AA697*2) -> 28
A698: BEST PLAYERS | W698: PRESTON | X698: 1 | Y698: 6 | Z698: 8 | AA698: 0 | AB698: 1118 | AC698: 1272 | AD698: =(AB698/AC698)*100 -> 87.893081761006286 | AE698: =(Y698*4)+(AA698*2) -> 24
A699: BOX HILL | C699: HOLLAND | F699: TRANQUILLI | I699: PORTER | L699: PARTHENIDES | O699: BELLO | Q699: NICHOL | W699: BOX HILL | X699: 2 | Y699: 4 | Z699: 9 | AA699: 0 | AB699: 1006 | AC699: 1163 | AD699: =(AB699/AC699)*100 -> 86.500429922613932 | AE699: =(Y699*4)+(AA699*2) -> 16
A700: NORTH BALLARAT | C700: G POLKINGHORNE | G700: COX | I700: T POLKINGHORNE | M700: McMAHON | W700: NORTH BALLARAT | X700: 1 | Y700: 4 | Z700: 10 | AA700: 0 | AB700: 1006 | AC700: 1209 | AD700: =(AB700/AC700)*100 -> 83.209263854425146 | AE700: =(Y700*4)+(AA700*2) -> 16
A701: GOALKICKERS | O701: MAYHEW | Q701: LIVINGSTONE | W701: TRARALGON | X701: 2 | Y701: 2 | Z701: 10 | AA701: 1 | AB701: 850 | AC701: 1453 | AD701: =(AB701/AC701)*100 -> 58.499655884377155 | AE701: =(Y701*4)+(AA701*2) -> 10
A702: BOX HILL | C702: WILKINSON 3 | F702: DOUGLAS 3 | I702: PORTER 3 | L702: OAKLEY 2 | N702: SLATER 2 | P702: BELLO | R702: PARTHENIDES | W702: COBURG | X702: 2 | Y702: 1 | Z702: 12 | AA702: 0 | AB702: 817 | AC702: 1781 | AD702: =(AB702/AC702)*100 -> 45.873104997192584 | AE702: =(Y702*4)+(AA702*2) -> 4
A703: NORTH BALLARAT | C703: BERRY 4 | F703: POLKINGHORNE | I703: HEENAN | K703: MARTIN
A705: FRANKSTON | C705: 3 | D705: 4 | E705: =(C705*6)+D705 -> 22 | G705: 8 | H705: 9 | I705: =(G705*6)+H705 -> 57 | K705: 11 | L705: 11 | M705: =(K705*6)+L705 -> 77 | O705: 17 | P705: 13 | Q705: =(O705*6)+P705 -> 115 | S705: Venue: PRESTON
A706: PRESTON | C706: 4 | D706: 2 | E706: =(C706*6)+D706 -> 26 | G706: 6 | H706: 3 | I706: =(G706*6)+H706 -> 39 | K706: 7 | L706: 8 | M706: =(K706*6)+L706 -> 50 | O706: 9 | P706: 10 | Q706: =(O706*6)+P706 -> 64
A707: BEST PLAYERS
A708: FRANKSTON | C708: D CLARKE | F708: R STUBBS | I708: GOODWIN | L708: CUMMINGS | O708: DUNDAS
A709: PRESTON | C709: MAIORANA | F709: ECCLES | I709: PLUNKETT | L709: HARDENBERG | O709: KOFOED | R709: WYATT
A710: GOALKICKERS
A711: FRANKSTON | C711: GOODWIN 4 | F711: R STUBBS 3 | I711: BOWEY 3 | L711: MILLANE 3 | O711: L TAYLOR 2 | R711: A PICKERING | W711: CUMMINGS
A712: PRESTON | C712: ECCLES 5 | F712: WYATT | H712: WILSON | J712: PLUNKETT | M712: PASCOE
A714: SPRINGVALE | C714: 4 | D714: 2 | E714: =(C714*6)+D714 -> 26 | G714: 12 | H714: 6 | I714: =(G714*6)+H714 -> 78 | K714: 16 | L714: 6 | M714: =(K714*6)+L714 -> 102 | O714: 18 | P714: 12 | Q714: =(O714*6)+P714 -> 120 | S714: Venue: SPRINGVALE
A715: PORT MELBOURNE | C715: 4 | D715: 4 | E715: =(C715*6)+D715 -> 28 | G715: 6 | H715: 7 | I715: =(G715*6)+H715 -> 43 | K715: 9 | L715: 10 | M715: =(K715*6)+L715 -> 64 | O715: 12 | P715: 14 | Q715: =(O715*6)+P715 -> 86
A716: BEST PLAYERS
A717: SPRINGVALE | C717: DELARUE | F717: WOODMAN | I717: KNIGHT | L717: DILLON | O717: J CARROLL | R717: LIELNORS
A718: PORT MELBOURNE | C718: CHEEL | F718: EDWARDS | I718: MORTON | L718: JESS | O718: GREENHAM
A719: GOALKICKERS
A720: SPRINGVALE | C720: SMITH 5 | F720: COURTNEY 3 | I720: LITTLE 2 | L720: KNIGHT 2 | O720: DELARUE 2 | R720: J CARROLL | W720: WOODMAN | X720: SINNEMA | AA720: SCOTT
A721: PORT MELBOURNE | C721: EDWARDS 4 | F721: SEXTON 2 | I721: GREENHAM 2 | L721: KERSHAW | N721: WEEDING | P721: JESS | Q721: REYNOLDS
A723: TRARALGON | C723: 4 | D723: 4 | E723: =(C723*6)+D723 -> 28 | G723: 12 | H723: 6 | I723: =(G723*6)+H723 -> 78 | K723: 16 | L723: 6 | M723: =(K723*6)+L723 -> 102 | O723: 18 | P723: 11 | Q723: =(O723*6)+P723 -> 119 | S723: Venue: TRARALGON
A724: COBURG | C724: 3 | D724: 1 | E724: =(C724*6)+D724 -> 19 | G724: 5 | H724: 2 | I724: =(G724*6)+H724 -> 32 | K724: 8 | L724: 8 | M724: =(K724*6)+L724 -> 56 | O724: 12 | P724: 13 | Q724: =(O724*6)+P724 -> 85
A725: BEST PLAYERS
A726: TRARALGON | C726: BENNETT | F726: FORYS | I726: MALONE | L726: MORLEY | N726: CAMPBELL | Q726: JOHNSTON
A727: COBURG | C727: EZARD | F727: PIGNATORO | I727: ALESSIO | L727: LA FORGIA | N727: WILDE
A728: GOALKICKERS
A729: TRARALGON | C729: FORYS 7 | F729: MORLEY 2 | I729: BRADLEY 2 | L729: KENNY 2 | N729: HABEL | P729: BURRIDGE | R729: JOHNSTON | V729: WOLFE | X729: MOYLAN
A730: COBURG | C730: ALESSIO 4 | F730: TORTORA 2 | I730: PIGNATORA | L730: TARANTO | N730: LATTENSTEIN | Q730: FLETCHER | T730: LA FORGIA | X730: WILDE
A732: BYE | D732: SANDRINGHAM
A734: ROUND 16 | D734: 26TH JULY | J734: WEATHER
D735: 1ST QTR | H735: 2ND QTR | L735: 3RD QTR | P735: FINAL | S735: Venue: WILLIAMSTOWN
A736: PORT MELBOURNE | C736: 5 | D736: 4 | E736: =(C736*6)+D736 -> 34 | G736: 11 | H736: 9 | I736: =(G736*6)+H736 -> 75 | K736: 14 | L736: 13 | M736: =(K736*6)+L736 -> 97 | O736: 20 | P736: 17 | Q736: =(O736*6)+P736 -> 137 | S736: UMPIRES | Z736: LADDER | AC736: ROUND | AE736: 16
A737: WILLIAMSTOWN | C737: 1 | D737: 1 | E737: =(C737*6)+D737 -> 7 | G737: 1 | H737: 5 | I737: =(G737*6)+H737 -> 11 | K737: 2 | L737: 5 | M737: =(K737*6)+L737 -> 17 | O737: 6 | P737: 8 | Q737: =(O737*6)+P737 -> 44
A738: BEST PLAYERS | W738: TEAM | X738: B | Y738: W | Z738: L | AA738: D | AB738: FOR | AC738: AGST | AD738: % | AE738: PTS
A739: PORT MELBOURNE | C739: CLOHESY | F739: McGEE | I739: EDWARDS | L739: JAMES | N739: CAMERON | Q739: PICIAONE
A740: WILLIAMSTOWN | C740: WEST | F740: NASH | I740: SHANKS | K740: DELRE | M740: LAMBROVOULOS | Q740: BELLEVILLE | W740: FRANKSTON | X740: 2 | Y740: 13 | Z740: 1 | AA740: 0 | AB740: 1549 | AC740: 922 | AD740: =(AB740/AC740)*100 -> 168.0043383947939 | AE740: =(Y740*4)+(AA740*2) -> 52
A741: GOALKICKERS | O741: REYNOLDS | Q741: SEXTON | W741: SPRINGVALE | X741: 2 | Y741: 11 | Z741: 3 | AA741: 0 | AB741: 1657 | AC741: 1030 | AD741: =(AB741/AC741)*100 -> 160.873786407767 | AE741: =(Y741*4)+(AA741*2) -> 44
A742: PORT MELBOURNE | C742: GREENHAM 4 | F742: McGEE 4 | H742: WEEDING 4 | K742: M CHEEL | M742: EDWARDS | P742: JAMES | R742: PICIAONE | W742: SANDRINGHAM | X742: 2 | Y742: 11 | Z742: 3 | AA742: 0 | AB742: 1354 | AC742: 853 | AD742: =(AB742/AC742)*100 -> 158.73388042203987 | AE742: =(Y742*4)+(AA742*2) -> 44
A743: WILLIAMSTOWN | C743: KERRY 2 | F743: ZAVALAS 2 | I743: GOULD | K743: WEST | W743: WERRIBEE | X743: 2 | Y743: 10 | Z743: 4 | AA743: 0 | AB743: 1594 | AC743: 1061 | AD743: =(AB743/AC743)*100 -> 150.23562676720076 | AE743: =(Y743*4)+(AA743*2) -> 40
W744: PORT MELBOURNE | X744: 1 | Y744: 8 | Z744: 7 | AA744: 0 | AB744: 1317 | AC744: 1224 | AD744: =(AB744/AC744)*100 -> 107.59803921568627 | AE744: =(Y744*4)+(AA744*2) -> 32
A745: BOX HILL | C745: 5 | D745: 2 | E745: =(C745*6)+D745 -> 32 | G745: 6 | H745: 4 | I745: =(G745*6)+H745 -> 40 | K745: 11 | L745: 9 | M745: =(K745*6)+L745 -> 75 | O745: 14 | P745: 9 | Q745: =(O745*6)+P745 -> 93 | S745: Venue: BOX HILL
A746: PRESTON | C746: 2 | D746: 3 | E746: =(C746*6)+D746 -> 15 | G746: 4 | H746: 9 | I746: =(G746*6)+H746 -> 33 | K746: 4 | L746: 12 | M746: =(K746*6)+L746 -> 36 | O746: 7 | P746: 13 | Q746: =(O746*6)+P746 -> 55 | W746: WILLIAMSTOWN | X746: 1 | Y746: 7 | Z746: 7 | AA746: 1 | AB746: 1318 | AC746: 1417 | AD746: =(AB746/AC746)*100 -> 93.013408609738889 | AE746: =(Y746*4)+(AA746*2) -> 30
A747: BEST PLAYERS | W747: PRESTON | X747: 1 | Y747: 6 | Z747: 9 | AA747: 0 | AB747: 1173 | AC747: 1365 | AD747: =(AB747/AC747)*100 -> 85.934065934065927 | AE747: =(Y747*4)+(AA747*2) -> 24
A748: BOX HILL | C748: JENKINS | F748: WILKINSON | I748: LIVINGSTONE | L748: TRANQUILLI | O748: DUANE | Q748: CROWLEY | W748: BOX HILL | X748: 2 | Y748: 5 | Z748: 9 | AA748: 0 | AB748: 1099 | AC748: 1218 | AD748: =(AB748/AC748)*100 -> 90.229885057471265 | AE748: =(Y748*4)+(AA748*2) -> 20
A749: PRESTON | C749: MORRISEY | F749: AIELLO | I749: MAIORANA | L749: HARDENBERG | O749: KOFOEL | W749: NORTH BALLARAT | X749: 1 | Y749: 4 | Z749: 11 | AA749: 0 | AB749: 1101 | AC749: 1334 | AD749: =(AB749/AC749)*100 -> 82.533733133433287 | AE749: =(Y749*4)+(AA749*2) -> 16
A750: GOALKICKERS | Q750: JENKINS | W750: TRARALGON | X750: 2 | Y750: 2 | Z750: 11 | AA750: 1 | AB750: 911 | AC750: 1590 | AD750: =(AB750/AC750)*100 -> 57.295597484276726 | AE750: =(Y750*4)+(AA750*2) -> 10
A751: BOX HILL | C751: DUANE 4 | E751: LIVINGSTONE 2 | I751: TRANQUILLI 2 | L751: MAYHEW 2 | O751: WILKINSON 2 | R751: DOUGLAS | W751: COBURG | X751: 2 | Y751: 1 | Z751: 13 | AA751: 0 | AB751: 882 | AC751: 1926 | AD751: =(AB751/AC751)*100 -> 45.794392523364486 | AE751: =(Y751*4)+(AA751*2) -> 4
A752: PRESTON | C752: VAN BLOMMESTEIN | G752: ECCLES | I752: HABERMAN | L752: McDUFF | N752: MAIORANA | Q752: PLUNKETT
D753: 27TH JULY | J753: WEATHER | P753: PASCOE
A754: SPRINGVALE | C754: 6 | D754: 1 | E754: =(C754*6)+D754 -> 37 | G754: 10 | H754: 6 | I754: =(G754*6)+H754 -> 66 | K754: 17 | L754: 11 | M754: =(K754*6)+L754 -> 113 | O754: 22 | P754: 13 | Q754: =(O754*6)+P754 -> 145 | S754: Venue: COBURG
A755: COBURG | C755: 4 | D755: 2 | E755: =(C755*6)+D755 -> 26 | G755: 5 | H755: 5 | I755: =(G755*6)+H755 -> 35 | K755: 6 | L755: 8 | M755: =(K755*6)+L755 -> 44 | O755: 9 | P755: 11 | Q755: =(O755*6)+P755 -> 65
A756: BEST PLAYERS
A757: SPRINGVALE | C757: JEFFREY | F757: DILLON | I757: SMITH | L757: DELARUE | O757: CAPLES | Q757: CAPSALIS
A758: COBURG | C758: WILDE | F758: WILLOUGHBY | I758: PIGNATARO | L758: PETREVSKI | O758: ALESSIO | Q758: TARANTO
A759: GOALKICKERS
A760: SPRINGVALE | C760: SMITH 8 | E760: JEFFREY 3 | H760: CAPSALIS 3 | K760: KNIGHT 2 | M760: O'DONNELL | P760: WOODMAN | S760: O'BRIEN | V760: SILVESTER | X760: FORD | Z760: DELARUE
A761: COBURG | C761: WILLOUGHBY 6 | G761: FLETCHER | J761: LAFORGIA | M761: S HARDY
A763: WERRIBEE | C763: 6 | D763: 5 | E763: =(C763*6)+D763 -> 41 | G763: 12 | H763: 8 | I763: =(G763*6)+H763 -> 80 | K763: 15 | L763: 11 | M763: =(K763*6)+L763 -> 101 | O763: 19 | P763: 11 | Q763: =(O763*6)+P763 -> 125 | S763: Venue: NORTH BALLARAT
A764: NORTH BALLARAT | C764: 3 | D764: 1 | E764: =(C764*6)+D764 -> 19 | G764: 5 | H764: 4 | I764: =(G764*6)+H764 -> 34 | K764: 10 | L764: 6 | M764: =(K764*6)+L764 -> 66 | O764: 14 | P764: 11 | Q764: =(O764*6)+P764 -> 95
A765: BEST PLAYERS
A766: WERRIBEE | C766: AZIZ | F766: TAYLOR | I766: CHRISTO | L766: SPROULE | O766: DWYER | Q766: SATTERLEY
A767: NORTH BALLARAT | C767: FLETCHER | F767: HOLMES | I767: TAYLOR | L767: T POLKINGHORNE | P767: MARTIN | R767: VERBENE
A768: GOALKICKERS
A769: WERRIBEE | C769: AZIZ 6 | E769: CHRISTO 2 | H769: WRIGHT 2 | J769: MASSURA 2 | M769: MURPHY 2 | P769: DWYER | R769: BAILEY | V769: SAUNDERS | X769: ATKINS | AA769: DOYLE
A770: NORTH BALLARAT | C770: DOHNT 4 | E770: HOLMES 3 | H770: MARTIN 2 | J770: McMAHON | M770: FLETCHER | O770: VERBENE | Q770: G POLKINGHORNE | W770: REARDON
A772: SANDRINGHAM | C772: 2 | D772: 3 | E772: =(C772*6)+D772 -> 15 | G772: 11 | H772: 5 | I772: =(G772*6)+H772 -> 71 | K772: 14 | L772: 13 | M772: =(K772*6)+L772 -> 97 | O772: 20 | P772: 17 | Q772: =(O772*6)+P772 -> 137 | S772: Venue: BEACH ROAD
A773: TRARALGON | C773: 3 | D773: 2 | E773: =(C773*6)+D773 -> 20 | G773: 6 | H773: 6 | I773: =(G773*6)+H773 -> 42 | K773: 8 | L773: 6 | M773: =(K773*6)+L773 -> 54 | O773: 9 | P773: 7 | Q773: =(O773*6)+P773 -> 61
A774: BEST PLAYERS
A775: SANDRINGHAM | C775: OAKLEY | F775: MITCHELSON | I775: CLARKSON | L775: MACGEORGE | O775: MURRAY | R775: FOLEY
A776: TRARALGON | C776: RAYNER | F776: DOYLE | I776: CAMERON | L776: HOPKINS | O776: GLASCOCK | R776: MALONE
A777: GOALKICKERS
A778: SANDRINGHAM | C778: OAKLEY 6 | E778: SCOTT-BRANIGAN 4 | I778: D GRANT 3 | L778: MACGEORGE 2 | O778: BAXTER | Q778: SNOOKS | S778: HAYNES | W778: FRATER | Y778: AMIET
A779: TRARALGON | C779: CAMPBELL 3 | F779: JENNINGS 2 | I779: CAMERON | L779: BURRIDGE | N779: RAYNER | P779: DOYLE
A781: BYE | D781: FRANKSTON
A783: ROUND 17 | D783: 2ND AUGUST | J783: WEATHER
D784: 1ST QTR | H784: 2ND QTR | L784: 3RD QTR | P784: FINAL | S784: Venue: WERRIBEE
A785: FRANKSTON | C785: 3 | D785: 4 | E785: =(C785*6)+D785 -> 22 | G785: 5 | H785: 8 | I785: =(G785*6)+H785 -> 38 | K785: 7 | L785: 11 | M785: =(K785*6)+L785 -> 53 | O785: 11 | P785: 15 | Q785: =(O785*6)+P785 -> 81 | S785: UMPIRES | Z785: LADDER | AC785: ROUND | AE785: 17
A786: WERRIBEE | C786: 3 | D786: 0 | E786: =(C786*6)+D786 -> 18 | G786: 7 | H786: 1 | I786: =(G786*6)+H786 -> 43 | K786: 10 | L786: 5 | M786: =(K786*6)+L786 -> 65 | O786: 12 | P786: 7 | Q786: =(O786*6)+P786 -> 79
A787: BEST PLAYERS | W787: TEAM | X787: B | Y787: W | Z787: L | AA787: D | AB787: FOR | AC787: AGST | AD787: % | AE787: PTS
A788: FRANKSTON | C788: CUMMINGS | F788: CHARLES | I788: LEYS | L788: BURNELL | O788: DUNDAS | Q788: MOORE
A789: WERRIBEE | C789: CHRISTO | F789: SAUNDERS | I789: TAYLOR | L789: EAMES | O789: DYER | Q789: ATKINS | W789: FRANKSTON | X789: 2 | Y789: 14 | Z789: 1 | AA789: 0 | AB789: 1630 | AC789: 1001 | AD789: =(AB789/AC789)*100 -> 162.83716283716282 | AE789: =(Y789*4)+(AA789*2) -> 56
A790: GOALKICKERS | P790: D CLARKE | W790: SANDRINGHAM | X790: 2 | Y790: 12 | Z790: 3 | AA790: 0 | AB790: 1460 | AC790: 928 | AD790: =(AB790/AC790)*100 -> 157.32758620689654 | AE790: =(Y790*4)+(AA790*2) -> 48
A791: FRANKSTON | C791: BOWEY 3 | E791: GOODWIN 2 | H791: SULLIVAN | J791: MOLLOY | L791: J PICKERING | O791: DUNDAS | Q791: D RYAN | W791: SPRINGVALE | X791: 2 | Y791: 11 | Z791: 4 | AA791: 0 | AB791: 1732 | AC791: 1136 | AD791: =(AB791/AC791)*100 -> 152.46478873239437 | AE791: =(Y791*4)+(AA791*2) -> 44
A792: WERRIBEE | C792: AZIZ 6 | F792: BUTTON | H792: O'CONNOR | J792: SHAW | L792: WILLIAMS | O792: SAUNDERS | Q792: SPROULE | W792: WERRIBEE | X792: 2 | Y792: 10 | Z792: 5 | AA792: 0 | AB792: 1673 | AC792: 1142 | AD792: =(AB792/AC792)*100 -> 146.49737302977232 | AE792: =(Y792*4)+(AA792*2) -> 40
W793: PORT MELBOURNE | X793: 1 | Y793: 9 | Z793: 7 | AA793: 0 | AB793: 1520 | AC793: 1285 | AD793: =(AB793/AC793)*100 -> 118.28793774319067 | AE793: =(Y793*4)+(AA793*2) -> 36
A794: PRESTON | C794: 3 | D794: 4 | E794: =(C794*6)+D794 -> 22 | G794: 5 | H794: 4 | I794: =(G794*6)+H794 -> 34 | K794: 14 | L794: 8 | M794: =(K794*6)+L794 -> 92 | O794: 16 | P794: 13 | Q794: =(O794*6)+P794 -> 109 | S794: Venue: PRESTON
A795: COBURG | C795: 0 | D795: 1 | E795: =(C795*6)+D795 -> 1 | G795: 2 | H795: 4 | I795: =(G795*6)+H795 -> 16 | K795: 4 | L795: 4 | M795: =(K795*6)+L795 -> 28 | O795: 8 | P795: 6 | Q795: =(O795*6)+P795 -> 54 | W795: WILLIAMSTOWN | X795: 1 | Y795: 7 | Z795: 7 | AA795: 2 | AB795: 1372 | AC795: 1471 | AD795: =(AB795/AC795)*100 -> 93.269884432358936 | AE795: =(Y795*4)+(AA795*2) -> 32
A796: BEST PLAYERS | W796: PRESTON | X796: 1 | Y796: 7 | Z796: 9 | AA796: 0 | AB796: 1282 | AC796: 1419 | AD796: =(AB796/AC796)*100 -> 90.345313601127557 | AE796: =(Y796*4)+(AA796*2) -> 28
A797: PRESTON | C797: MAIORANA | F797: AIELLO | I797: ECCLES | L797: HAYDOCK | O797: MORRISEY | R797: BLAGROVE | W797: BOX HILL | X797: 2 | Y797: 5 | Z797: 9 | AA797: 1 | AB797: 1153 | AC797: 1272 | AD797: =(AB797/AC797)*100 -> 90.644654088050316 | AE797: =(Y797*4)+(AA797*2) -> 22
A798: COBURG | C798: BEACHAM | F798: STEFANIC | I798: S HARDY | L798: ALESSIO | O798: WILDE | W798: NORTH BALLARAT | X798: 2 | Y798: 4 | Z798: 11 | AA798: 0 | AB798: 1101 | AC798: 1334 | AD798: =(AB798/AC798)*100 -> 82.533733133433287 | AE798: =(Y798*4)+(AA798*2) -> 16
A799: GOALKICKERS | W799: TRARALGON | X799: 2 | Y799: 2 | Z799: 12 | AA799: 1 | AB799: 972 | AC799: 1793 | AD799: =(AB799/AC799)*100 -> 54.210819854991634 | AE799: =(Y799*4)+(AA799*2) -> 10
A800: PRESTON | C800: ECCLES 8 | F800: WILSON 2 | I800: HAYDOCK 2 | L800: PLUNKETT 2 | O800: PASCOE | Q800: VAN BLOMMENSTEIN | W800: COBURG | X800: 2 | Y800: 1 | Z800: 14 | AA800: 0 | AB800: 936 | AC800: 2035 | AD800: =(AB800/AC800)*100 -> 45.995085995085994 | AE800: =(Y800*4)+(AA800*2) -> 4
A801: COBURG | C801: ALESSIO 3 | F801: S HARDY | I801: TARANTO | L801: WESTON | N801: BEACHAM | Q801: EZARD
D802: 3RD AUGUST | J802: WEATHER
A803: SANDRINGHAM | C803: 1 | D803: 6 | E803: =(C803*6)+D803 -> 12 | G803: 6 | H803: 10 | I803: =(G803*6)+H803 -> 46 | K803: 9 | L803: 17 | M803: =(K803*6)+L803 -> 71 | O803: 14 | P803: 22 | Q803: =(O803*6)+P803 -> 106 | S803: Venue: SPRINGVALE
A804: SPRINGVALE | C804: 3 | D804: 3 | E804: =(C804*6)+D804 -> 21 | G804: 3 | H804: 5 | I804: =(G804*6)+H804 -> 23 | K804: 7 | L804: 8 | M804: =(K804*6)+L804 -> 50 | O804: 11 | P804: 9 | Q804: =(O804*6)+P804 -> 75
A805: BEST PLAYERS
A806: SANDRINGHAM | C806: CROUGH | F806: COGHLAN | I806: BAXTER | L806: CLARKSON | O806: NUGENT | R806: MITCHELSON
A807: SPRINGVALE | C807: BURGMAN | F807: TAYLOR | I807: JEFFS | L807: SUTHERLAND | O807: CAPLES | R807: JEFFREY
A808: GOALKICKERS
A809: SANDRINGHAM | C809: OAKLEY 3 | F809: BAXTER 3 | I809: SNOOKS 2 | L809: MOONEY 2 | O809: MURRAY | Q809: AMIET | S809: HAYNES | W809: MACGEORGE
A810: SPRINGVALE | C810: PHILLIPS 2 | F810: O'BRIEN 2 | I810: SINNEMA 2 | L810: TAYLOR 2 | O810: LITTLE | Q810: SMITH | S810: LIELNORS
A812: PORT MELBOURNE | C812: 7 | D812: 3 | E812: =(C812*6)+D812 -> 45 | G812: 13 | H812: 8 | I812: =(G812*6)+H812 -> 86 | K812: 23 | L812: 14 | M812: =(K812*6)+L812 -> 152 | O812: 31 | P812: 17 | Q812: =(O812*6)+P812 -> 203 | S812: Venue: PORT MELBOURNE
A813: TRARALGON | C813: 2 | D813: 4 | E813: =(C813*6)+D813 -> 16 | G813: 4 | H813: 8 | I813: =(G813*6)+H813 -> 32 | K813: 5 | L813: 10 | M813: =(K813*6)+L813 -> 40 | O813: 8 | P813: 13 | Q813: =(O813*6)+P813 -> 61
A814: BEST PLAYERS
A815: PORT MELBOURNE | C815: CLOHESY | F815: JAMES | I815: SEXTON | L815: PICIAONE | O815: EDWARDS | R815: HOLLOW
A816: TRARALGON | C816: DOYLE | F816: WOLFE | I816: JENNINGS | L816: MORLEY
A817: GOALKICKERS
A818: PORT MELBOURNE | C818: SEXTON 9 | E818: EDWARDS 5 | H818: GREENHAM 3 | K818: McGEE 3 | M818: WEEDING 3 | P818: DWYER 3 | R818: REYNOLDS 2 | W818: CAMERON | X818: M CHEEL | AA818: CLOHESY | AC818: JAMES
A819: TRARALGON | C819: BURRIDGE 3 | F819: MORLEY | H819: JENNINGS | K819: CAMPBELL | M819: FORYS | O819: HOPKINS
A821: WILLIAMSTOWN | C821: 1 | D821: 2 | E821: =(C821*6)+D821 -> 8 | G821: 3 | H821: 3 | I821: =(G821*6)+H821 -> 21 | K821: 5 | L821: 6 | M821: =(K821*6)+L821 -> 36 | O821: 7 | P821: 12 | Q821: =(O821*6)+P821 -> 54 | S821: Venue: WILLIAMSTOWN
A822: BOX HILL | C822: 1 | D822: 2 | E822: =(C822*6)+D822 -> 8 | G822: 3 | H822: 3 | I822: =(G822*6)+H822 -> 21 | K822: 5 | L822: 6 | M822: =(K822*6)+L822 -> 36 | O822: 7 | P822: 12 | Q822: =(O822*6)+P822 -> 54
A823: BEST PLAYERS
A824: WILLIAMSTOWN | C824: FRASER | F824: LAMBROPOULOS | J824: PATERSON | M824: KERRY | O824: HORE | Q824: BERGIN
A825: BOX HILL | C825: NICHOL | F825: PARTHENIDES | J825: ALLSOP | M825: LIVINGSTONE | P825: TRANQUILLI | S825: SLATER
A826: GOALKICKERS
A827: WILLIAMSTOWN | C827: KERRY 4 | F827: O'KEEFE 2 | I827: ZAVALAS
A828: BOX HILL | C828: BELLO 2 | F828: SLATER 2 | I828: DUANE | K828: WILKINSON | N828: GRIFFEN
A830: BYE | D830: NORTH BALLARAT
A832: ROUND 18 | D832: 9TH AUGUST | J832: WEATHER
D833: 1ST QTR | H833: 2ND QTR | L833: 3RD QTR | P833: FINAL | S833: Venue: PORT MELBOURNE
A834: WERRIBEE | C834: 1 | D834: 4 | E834: =(C834*6)+D834 -> 10 | G834: 7 | H834: 5 | I834: =(G834*6)+H834 -> 47 | K834: 8 | L834: 6 | M834: =(K834*6)+L834 -> 54 | O834: 12 | P834: 9 | Q834: =(O834*6)+P834 -> 81 | S834: UMPIRES | Z834: LADDER | AC834: ROUND | AE834: 18
A835: PORT MELBOURNE | C835: 1 | D835: 2 | E835: =(C835*6)+D835 -> 8 | G835: 1 | H835: 4 | I835: =(G835*6)+H835 -> 10 | K835: 5 | L835: 10 | M835: =(K835*6)+L835 -> 40 | O835: 7 | P835: 14 | Q835: =(O835*6)+P835 -> 56
A836: BEST PLAYERS | W836: TEAM | X836: B | Y836: W | Z836: L | AA836: D | AB836: FOR | AC836: AGST | AD836: % | AE836: PTS
A837: WERRIBEE | C837: MURPHY | F837: TAYLOR | I837: CHRISTO | L837: SPROULE | O837: AZIZ | Q837: CAMILLIERI
A838: PORT MELBOURNE | C838: HOLLOW | F838: CLOHESY | I838: HOFFMAN | L838: CAMERON | O838: McGEE | Q838: CHEEL | W838: FRANKSTON | X838: 2 | Y838: 15 | Z838: 1 | AA838: 0 | AB838: 1798 | AC838: 1039 | AD838: =(AB838/AC838)*100 -> 173.05101058710301 | AE838: =(Y838*4)+(AA838*2) -> 60
A839: GOALKICKERS | Q839: CAMILLIERI | W839: SANDRINGHAM | X839: 2 | Y839: 13 | Z839: 3 | AA839: 0 | AB839: 1552 | AC839: 989 | AD839: =(AB839/AC839)*100 -> 156.92618806875632 | AE839: =(Y839*4)+(AA839*2) -> 52
A840: WERRIBEE | C840: AZIZ 3 | E840: SWAN 2 | G840: SATTERLEY | I840: O'CONNOR | L840: SPROULE | N840: BUTTON | P840: MURPHY | R840: BAILEY | W840: SPRINGVALE | X840: 2 | Y840: 12 | Z840: 4 | AA840: 0 | AB840: 1851 | AC840: 1173 | AD840: =(AB840/AC840)*100 -> 157.80051150895139 | AE840: =(Y840*4)+(AA840*2) -> 48
A841: PORT MELBOURNE | C841: EDWARDS 2 | F841: CAMERON | I841: DWYER | L841: HOLLOW | N841: REYNOLDS | Q841: SEXTON | W841: WERRIBEE | X841: 2 | Y841: 11 | Z841: 5 | AA841: 0 | AB841: 1754 | AC841: 1198 | AD841: =(AB841/AC841)*100 -> 146.41068447412354 | AE841: =(Y841*4)+(AA841*2) -> 44
D842: 10TH AUGUST | J842: WEATHER | W842: PORT MELBOURNE | X842: 1 | Y842: 9 | Z842: 8 | AA842: 0 | AB842: 1576 | AC842: 1366 | AD842: =(AB842/AC842)*100 -> 115.37335285505124 | AE842: =(Y842*4)+(AA842*2) -> 36
A843: SANDRINGHAM | C843: 1 | D843: 3 | E843: =(C843*6)+D843 -> 9 | G843: 7 | H843: 9 | I843: =(G843*6)+H843 -> 51 | K843: 7 | L843: 10 | M843: =(K843*6)+L843 -> 52 | O843: 12 | P843: 20 | Q843: =(O843*6)+P843 -> 92 | S843: Venue: BEACH ROAD
A844: BOX HILL | C844: 4 | D844: 2 | E844: =(C844*6)+D844 -> 26 | G844: 4 | H844: 2 | I844: =(G844*6)+H844 -> 26 | K844: 7 | L844: 6 | M844: =(K844*6)+L844 -> 48 | O844: 9 | P844: 7 | Q844: =(O844*6)+P844 -> 61 | W844: WILLIAMSTOWN | X844: 2 | Y844: 7 | Z844: 7 | AA844: 2 | AB844: 1372 | AC844: 1471 | AD844: =(AB844/AC844)*100 -> 93.269884432358936 | AE844: =(Y844*4)+(AA844*2) -> 32
A845: BEST PLAYERS | W845: PRESTON | X845: 1 | Y845: 7 | Z845: 10 | AA845: 0 | AB845: 1319 | AC845: 1538 | AD845: =(AB845/AC845)*100 -> 85.760728218465545 | AE845: =(Y845*4)+(AA845*2) -> 28
A846: SANDRINGHAM | C846: MACGEORGE | F846: CROUGH | I846: COGHLAN | L846: MITCHELSON | O846: McKELLAR | R846: FRATER | W846: BOX HILL | X846: 2 | Y846: 5 | Z846: 10 | AA846: 1 | AB846: 1214 | AC846: 1364 | AD846: =(AB846/AC846)*100 -> 89.002932551319645 | AE846: =(Y846*4)+(AA846*2) -> 22
A847: BOX HILL | C847: TRANQUILLI | F847: NICHOL | I847: PORTER | L847: WRIGHT | O847: SLATER | W847: NORTH BALLARAT | X847: 2 | Y847: 5 | Z847: 11 | AA847: 0 | AB847: 1207 | AC847: 1418 | AD847: =(AB847/AC847)*100 -> 85.119887165021154 | AE847: =(Y847*4)+(AA847*2) -> 20
A848: GOALKICKERS | P848: SCOTT-BRANIGAN | W848: TRARALGON | X848: 2 | Y848: 2 | Z848: 13 | AA848: 1 | AB848: 1056 | AC848: 1899 | AD848: =(AB848/AC848)*100 -> 55.608214849921012 | AE848: =(Y848*4)+(AA848*2) -> 10
A849: SANDRINGHAM | C849: MACGEORGE 3 | F849: AMIET 3 | H849: TEMPLETON | K849: NUGENT | M849: CROUGH | O849: MITCHELSON | R849: MOONEY | W849: COBURG | X849: 2 | Y849: 1 | Z849: 15 | AA849: 0 | AB849: 974 | AC849: 2203 | AD849: =(AB849/AC849)*100 -> 44.212437585111211 | AE849: =(Y849*4)+(AA849*2) -> 4
A850: BOX HILL | C850: DOUGLAS 2 | F850: TRANQUILLI 2 | I850: MATHEWS | L850: WRIGHT | N850: HUGGINS | P850: LIVINGSTONE | S850: PORTER
A852: SPRINGVALE | C852: 1 | D852: 3 | E852: =(C852*6)+D852 -> 9 | G852: 9 | H852: 10 | I852: =(G852*6)+H852 -> 64 | K852: 10 | L852: 14 | M852: =(K852*6)+L852 -> 74 | O852: 17 | P852: 17 | Q852: =(O852*6)+P852 -> 119 | S852: Venue: SPRINGVALE
A853: PRESTON | C853: 3 | D853: 4 | E853: =(C853*6)+D853 -> 22 | G853: 3 | H853: 5 | I853: =(G853*6)+H853 -> 23 | K853: 4 | L853: 7 | M853: =(K853*6)+L853 -> 31 | O853: 5 | P853: 7 | Q853: =(O853*6)+P853 -> 37
A854: BEST PLAYERS
A855: SPRINGVALE | C855: SMITH | F855: COURTNEY | I855: SUTHERLAND | L855: LIELNORS | O855: DILLON | R855: JEFFS
A856: PRESTON | C856: KOEFOED | F856: MORRISEY | I856: WILSON
A857: GOALKICKERS
A858: SPRINGVALE | C858: SMITH 10 | F858: FORD 3 | I858: JEFFREY | K858: LIELNORS | N858: DELARUE | P858: SINNEMA
A859: PRESTON | C859: GRAINGER 3 | F859: BLAGROVE | I859: WILSON
A861: FRANKSTON | C861: 6 | D861: 2 | E861: =(C861*6)+D861 -> 38 | G861: 13 | H861: 7 | I861: =(G861*6)+H861 -> 85 | K861: 17 | L861: 9 | M861: =(K861*6)+L861 -> 111 | O861: 26 | P861: 12 | Q861: =(O861*6)+P861 -> 168 | S861: Venue: FRANKSTON
A862: COBURG | C862: 1 | D862: 3 | E862: =(C862*6)+D862 -> 9 | G862: 2 | H862: 5 | I862: =(G862*6)+H862 -> 17 | K862: 5 | L862: 8 | M862: =(K862*6)+L862 -> 38 | O862: 5 | P862: 8 | Q862: =(O862*6)+P862 -> 38
A863: BEST PLAYERS
A864: FRANKSTON | C864: BOWEY | F864: CUMMINGS | I864: MOORE | L864: SULLIVAN | O864: D RYAN | R864: FREEMAN
A865: COBURG | C865: PIGNATORO | F865: BOGNATO | I865: WESTON | L865: CORR | O865: McLEOD
A866: GOALKICKERS
A867: FRANKSTON | C867: SULLIVAN 5 | F867: BOWEY 4 | H867: D RYAN 4 | J867: CUMMINGS 3 | M867: L TAYLOR 2 | P867: J PICKERING 2 | S867: GOODWIN 2 | W867: A PICKERING 2 | Y867: MOLLOY | AB867: MOORE
A868: COBURG | C868: BEACHAM 2 | F868: ALESSIO | I868: S HARDY | L868: PIGNATORO
A870: NORTH BALLARAT | C870: 6 | D870: 2 | E870: =(C870*6)+D870 -> 38 | G870: 8 | H870: 8 | I870: =(G870*6)+H870 -> 56 | K870: 15 | L870: 9 | M870: =(K870*6)+L870 -> 99 | O870: 16 | P870: 10 | Q870: =(O870*6)+P870 -> 106 | S870: Venue: TRARALGON
A871: TRARALGON | C871: 3 | D871: 0 | E871: =(C871*6)+D871 -> 18 | G871: 7 | H871: 4 | I871: =(G871*6)+H871 -> 46 | K871: 8 | L871: 9 | M871: =(K871*6)+L871 -> 57 | O871: 12 | P871: 12 | Q871: =(O871*6)+P871 -> 84
A872: BEST PLAYERS
A873: NORTH BALLARAT | C873: HOLMES | F873: MARTIN | I873: FLETCHER | L873: DOYLE | N873: FIELD
A874: TRARALGON | C874: WOLFE | F874: CAMERON | I874: JENNINGS | L874: SHERRIFF | N874: BRADLEY | Q874: MALONE
A875: GOALKICKERS
A876: NORTH BALLARAT | C876: BERRY 4 | F876: DOHNT 2 | H876: FLETCHER 2 | K876: LAMB 2 | M876: MARTIN 2 | P876: DOYLE | R876: HOLLOWAY | V876: McMAHON | X876: HOLMES
A877: TRARALGON | C877: BURRIDGE 4 | F877: MORLEY 2 | I877: CAMERON | L877: CAMPBELL | N877: HABEL | P877: JENNINGS | R877: WOLFE | U877: HOPKINS
A879: BYE | D879: WILLIAMSTOWN
A881: ROUND 19 | D881: 16TH AUGUST | J881: WEATHER
D882: 1ST QTR | H882: 2ND QTR | L882: 3RD QTR | P882: FINAL | S882: Venue: FRANKSTON
A883: FRANKSTON | C883: 5 | D883: 3 | E883: =(C883*6)+D883 -> 33 | G883: 9 | H883: 5 | I883: =(G883*6)+H883 -> 59 | K883: 17 | L883: 10 | M883: =(K883*6)+L883 -> 112 | O883: 18 | P883: 12 | Q883: =(O883*6)+P883 -> 120 | S883: UMPIRES | Z883: LADDER | AC883: ROUND | AE883: 19
A884: WILLIAMSTOWN | C884: 2 | D884: 2 | E884: =(C884*6)+D884 -> 14 | G884: 6 | H884: 7 | I884: =(G884*6)+H884 -> 43 | K884: 10 | L884: 8 | M884: =(K884*6)+L884 -> 68 | O884: 15 | P884: 9 | Q884: =(O884*6)+P884 -> 99
A885: BEST PLAYERS | W885: TEAM | X885: B | Y885: W | Z885: L | AA885: D | AB885: FOR | AC885: AGST | AD885: % | AE885: PTS
A886: FRANKSTON | C886: MOORE | F886: CUMMINGS | I886: J PICKERING | L886: MOLLOY | N886: FREEMAN | Q886: DUNDAS
A887: WILLIAMSTOWN | C887: GHAZI | F887: WALLACE | I887: DELRE | W887: FRANKSTON | X887: 2 | Y887: 16 | Z887: 1 | AA887: 0 | AB887: 1918 | AC887: 1138 | AD887: =(AB887/AC887)*100 -> 168.54130052724076 | AE887: =(Y887*4)+(AA887*2) -> 64
A888: GOALKICKERS | W888: SANDRINGHAM | X888: 2 | Y888: 14 | Z888: 3 | AA888: 0 | AB888: 1635 | AC888: 1027 | AD888: =(AB888/AC888)*100 -> 159.20155793573517 | AE888: =(Y888*4)+(AA888*2) -> 56
A889: FRANKSTON | C889: J PICKERING 5 | F889: MURRAY 3 | H889: DUNDAS 2 | J889: SULLIVAN 2 | M889: A PICKERING | P889: D CLARKE | S889: BOWEY | W889: SPRINGVALE | X889: 2 | Y889: 13 | Z889: 4 | AA889: 0 | AB889: 1920 | AC889: 1229 | AD889: =(AB889/AC889)*100 -> 156.2245728234337 | AE889: =(Y889*4)+(AA889*2) -> 52
A890: WILLIAMSTOWN | C890: DELRE 5 | E890: SHIELDS 3 | H890: O'KEEFE 3 | K890: HARRIES | M890: ZAVALAS | O890: PATERSON | Q890: PASTORE | W890: WERRIBEE | X890: 2 | Y890: 12 | Z890: 5 | AA890: 0 | AB890: 1854 | AC890: 1280 | AD890: =(AB890/AC890)*100 -> 144.84375 | AE890: =(Y890*4)+(AA890*2) -> 48
W891: PORT MELBOURNE | X891: 2 | Y891: 9 | Z891: 8 | AA891: 0 | AB891: 1576 | AC891: 1366 | AD891: =(AB891/AC891)*100 -> 115.37335285505124 | AE891: =(Y891*4)+(AA891*2) -> 36
A892: WERRIBEE | C892: 6 | D892: 10 | E892: =(C892*6)+D892 -> 46 | G892: 7 | H892: 16 | I892: =(G892*6)+H892 -> 58 | K892: 8 | L892: 18 | M892: =(K892*6)+L892 -> 66 | O892: 13 | P892: 22 | Q892: =(O892*6)+P892 -> 100 | S892: Venue: WERRIBEE
A893: TRARALGON | C893: 1 | D893: 0 | E893: =(C893*6)+D893 -> 6 | G893: 7 | H893: 4 | I893: =(G893*6)+H893 -> 46 | K893: 8 | L893: 9 | M893: =(K893*6)+L893 -> 57 | O893: 12 | P893: 10 | Q893: =(O893*6)+P893 -> 82 | W893: WILLIAMSTOWN | X893: 2 | Y893: 7 | Z893: 8 | AA893: 2 | AB893: 1471 | AC893: 1591 | AD893: =(AB893/AC893)*100 -> 92.457573852922692 | AE893: =(Y893*4)+(AA893*2) -> 32
A894: BEST PLAYERS | W894: PRESTON | X894: 1 | Y894: 7 | Z894: 11 | AA894: 0 | AB894: 1357 | AC894: 1621 | AD894: =(AB894/AC894)*100 -> 83.713756940160394 | AE894: =(Y894*4)+(AA894*2) -> 28
A895: WERRIBEE | C895: SHAW | F895: SAUNDERS | I895: EAMES | L895: TAYLOR | N895: GELLIE | Q895: SATTERLEY | W895: NORTH BALLARAT | X895: 2 | Y895: 6 | Z895: 11 | AA895: 0 | AB895: 1269 | AC895: 1464 | AD895: =(AB895/AC895)*100 -> 86.680327868852459 | AE895: =(Y895*4)+(AA895*2) -> 24
A896: TRARALGON | C896: BRADLEY | F896: DOYLE | I896: RAYNER | L896: MALONE | N896: FORYS | Q896: JENNINGS | W896: BOX HILL | X896: 2 | Y896: 5 | Z896: 11 | AA896: 1 | AB896: 1270 | AC896: 1433 | AD896: =(AB896/AC896)*100 -> 88.625261688764837 | AE896: =(Y896*4)+(AA896*2) -> 22
A897: GOALKICKERS | W897: TRARALGON | X897: 2 | Y897: 2 | Z897: 14 | AA897: 1 | AB897: 1138 | AC897: 1999 | AD897: =(AB897/AC897)*100 -> 56.928464232116063 | AE897: =(Y897*4)+(AA897*2) -> 10
A898: WERRIBEE | C898: SHAW 5 | F898: SATTERLEY 4 | J898: AZIZ 2 | L898: ATKINS | N898: SPROULE | W898: COBURG | X898: 2 | Y898: 1 | Z898: 16 | AA898: 0 | AB898: 1020 | AC898: 2265 | AD898: =(AB898/AC898)*100 -> 45.033112582781456 | AE898: =(Y898*4)+(AA898*2) -> 4
A899: TRARALGON | C899: JENNINGS 3 | F899: BURRIDGE 3 | I899: FORYS 2 | K899: G CAMPBELL | N899: CAMERON | Q899: HOPKINS | S899: MORLEY
D900: 17TH AUGUST | J900: WEATHER
A901: NORTH BALLARAT | C901: 3 | D901: 3 | E901: =(C901*6)+D901 -> 21 | G901: 3 | H901: 6 | I901: =(G901*6)+H901 -> 24 | K901: 8 | L901: 8 | M901: =(K901*6)+L901 -> 56 | O901: 9 | P901: 8 | Q901: =(O901*6)+P901 -> 62 | S901: Venue: NORTH BALLARAT
A902: COBURG | C902: 0 | D902: 2 | E902: =(C902*6)+D902 -> 2 | G902: 3 | H902: 7 | I902: =(G902*6)+H902 -> 25 | K902: 4 | L902: 9 | M902: =(K902*6)+L902 -> 33 | O902: 6 | P902: 10 | Q902: =(O902*6)+P902 -> 46
A903: BEST PLAYERS
A904: NORTH BALLARAT | C904: HOLMES | F904: T POLKINGHORNE | J904: DOYLE | M904: COX | O904: FLETCHER | R904: McMAHON
A905: COBURG | C905: SPIVEY | F905: WESTON | J905: PIGNATORO | M905: EZARD | O905: ALESSIO | R905: WILDE
A906: GOALKICKERS
A907: NORTH BALLARAT | C907: DOHNT 3 | F907: BERRY 2 | I907: FLETCHER | L907: HOLMES | N907: McMAHON | Q907: G POLKINGHORNE
A908: COBURG | C908: ALESSIO 3 | F908: WHITE 2 | I908: WILLOUGHBY
A910: SANDRINGHAM | C910: 5 | D910: 1 | E910: =(C910*6)+D910 -> 31 | G910: 10 | H910: 3 | I910: =(G910*6)+H910 -> 63 | K910: 10 | L910: 8 | M910: =(K910*6)+L910 -> 68 | O910: 12 | P910: 11 | Q910: =(O910*6)+P910 -> 83 | S910: Venue: PRESTON
A911: PRESTON | C911: 1 | D911: 2 | E911: =(C911*6)+D911 -> 8 | G911: 3 | H911: 3 | I911: =(G911*6)+H911 -> 21 | K911: 4 | L911: 7 | M911: =(K911*6)+L911 -> 31 | O911: 5 | P911: 8 | Q911: =(O911*6)+P911 -> 38
A912: BEST PLAYERS
A913: SANDRINGHAM | C913: FOLEY | F913: RIENIETS | I913: COGHLAN | L913: McKELLAR | O913: GRANT | Q913: MURRAY
A914: PRESTON | C914: KNIGHTS | F914: POWER | I914: MAIORANA | L914: ANGELOPOLOUS | O914: PASCOE
A915: GOALKICKERS
A916: SANDRINGHAM | C916: MOONEY 2 | F916: TEMPLETON 2 | I916: FOLEY 2 | K916: FRATER 2 | M916: MITCHELSON 2 | P916: SCOTT-BRANIGAN | T916: COGHLAN
A917: PRESTON | C917: PLUNKETT 2 | F917: ECCLES 2 | I917: MANN
A919: SPRINGVALE | C919: 3 | D919: 2 | E919: =(C919*6)+D919 -> 20 | G919: 6 | H919: 8 | I919: =(G919*6)+H919 -> 44 | K919: 7 | L919: 9 | M919: =(K919*6)+L919 -> 51 | O919: 9 | P919: 15 | Q919: =(O919*6)+P919 -> 69 | S919: Venue: BOX HILL
A920: BOX HILL | C920: 3 | D920: 2 | E920: =(C920*6)+D920 -> 20 | G920: 3 | H920: 3 | I920: =(G920*6)+H920 -> 21 | K920: 7 | L920: 6 | M920: =(K920*6)+L920 -> 48 | O920: 8 | P920: 8 | Q920: =(O920*6)+P920 -> 56
A921: BEST PLAYERS
A922: SPRINGVALE | C922: CAPLES | F922: D CARROLL | I922: O'DONNELL | L922: JEFFS | N922: KNIGHT | Q922: SUTHERLAND
A923: BOX HILL | C923: HOLLAND | F923: NICHOL | I923: JENKINS | L923: MATHEWS | N923: TRANQUILLI | Q923: LIVINGSTONE
A924: GOALKICKERS
A925: SPRINGVALE | C925: SMITH 3 | F925: D CARROLL 2 | I925: J CARROLL | L925: KNIGHT | N925: DELARUE | P925: DILLON
A926: BOX HILL | C926: HOLLAND 3 | F926: MATHEWS 3 | I926: HUGGINS | K926: SLATER
A928: BYE | D928: PORT MELBOURNE
A930: ROUND 20 | D930: 23RD AUGUST | J930: WEATHER
D931: 1ST QTR | H931: 2ND QTR | L931: 3RD QTR | P931: FINAL | S931: Venue: BEACH ROAD
A932: FRANKSTON | C932: 1 | D932: 4 | E932: =(C932*6)+D932 -> 10 | G932: 3 | H932: 10 | I932: =(G932*6)+H932 -> 28 | K932: 4 | L932: 16 | M932: =(K932*6)+L932 -> 40 | O932: 5 | P932: 18 | Q932: =(O932*6)+P932 -> 48 | S932: UMPIRES | Z932: LADDER | AC932: ROUND | AE932: 20
A933: SANDRINGHAM | C933: 1 | D933: 5 | E933: =(C933*6)+D933 -> 11 | G933: 1 | H933: 7 | I933: =(G933*6)+H933 -> 13 | K933: 3 | L933: 8 | M933: =(K933*6)+L933 -> 26 | O933: 5 | P933: 12 | Q933: =(O933*6)+P933 -> 42
A934: BEST PLAYERS | W934: TEAM | X934: B | Y934: W | Z934: L | AA934: D | AB934: FOR | AC934: AGST | AD934: % | AE934: PTS
A935: FRANKSTON | C935: CUMMINGS | F935: CHARLES | I935: MOORE | L935: LEYS | N935: R STUBBS | Q935: DUNDAS
A936: SANDRINGHAM | C936: FOLEY | F936: MACGEORGE | I936: OAKLEY | L936: McCONVIL | N936: FRATER | Q936: HAYNES | W936: FRANKSTON | X936: 2 | Y936: 17 | Z936: 1 | AA936: 0 | AB936: 1966 | AC936: 1180 | AD936: =(AB936/AC936)*100 -> 166.61016949152543 | AE936: =(Y936*4)+(AA936*2) -> 68
A937: GOALKICKERS | W937: SPRINGVALE | X937: 2 | Y937: 14 | Z937: 4 | AA937: 0 | AB937: 2006 | AC937: 1258 | AD937: =(AB937/AC937)*100 -> 159.45945945945945 | AE937: =(Y937*4)+(AA937*2) -> 56
A938: FRANKSTON | C938: FREEMAN | F938: KING | H938: BURNELL | K938: J PICKERING | N938: GEORGIOU | W938: SANDRINGHAM | X938: 2 | Y938: 14 | Z938: 4 | AA938: 0 | AB938: 1677 | AC938: 1075 | AD938: =(AB938/AC938)*100 -> 156 | AE938: =(Y938*4)+(AA938*2) -> 56
A939: SANDRINGHAM | C939: OAKLEY 3 | F939: MITCHELSON | I939: MOONEY | W939: WERRIBEE | X939: 2 | Y939: 12 | Z939: 6 | AA939: 0 | AB939: 1883 | AC939: 1366 | AD939: =(AB939/AC939)*100 -> 137.84773060029283 | AE939: =(Y939*4)+(AA939*2) -> 48
D940: 24TH AUGUST | J940: WEATHER | W940: PORT MELBOURNE | X940: 2 | Y940: 10 | Z940: 8 | AA940: 0 | AB940: 1660 | AC940: 1430 | AD940: =(AB940/AC940)*100 -> 116.08391608391608 | AE940: =(Y940*4)+(AA940*2) -> 40
A941: TRARALGON | C941: 4 | D941: 2 | E941: =(C941*6)+D941 -> 26 | G941: 5 | H941: 8 | I941: =(G941*6)+H941 -> 38 | K941: 5 | L941: 11 | M941: =(K941*6)+L941 -> 41 | O941: 8 | P941: 13 | Q941: =(O941*6)+P941 -> 61 | S941: Venue: TRARALGON
A942: BOX HILL | C942: 0 | D942: 3 | E942: =(C942*6)+D942 -> 3 | G942: 4 | H942: 3 | I942: =(G942*6)+H942 -> 27 | K942: 5 | L942: 7 | M942: =(K942*6)+L942 -> 37 | O942: 7 | P942: 12 | Q942: =(O942*6)+P942 -> 54 | W942: WILLIAMSTOWN | X942: 2 | Y942: 8 | Z942: 8 | AA942: 2 | AB942: 1544 | AC942: 1662 | AD942: =(AB942/AC942)*100 -> 92.900120336943431 | AE942: =(Y942*4)+(AA942*2) -> 36
A943: BEST PLAYERS | W943: PRESTON | X943: 2 | Y943: 7 | Z943: 11 | AA943: 0 | AB943: 1357 | AC943: 1621 | AD943: =(AB943/AC943)*100 -> 83.713756940160394 | AE943: =(Y943*4)+(AA943*2) -> 28
A944: TRARALGON | C944: DOYLE | F944: JENNINGS | I944: WOLFE | L944: FORYS | N944: HABEL | Q944: MORLEY | W944: NORTH BALLARAT | X944: 2 | Y944: 6 | Z944: 12 | AA944: 0 | AB944: 1340 | AC944: 1537 | AD944: =(AB944/AC944)*100 -> 87.18282368249838 | AE944: =(Y944*4)+(AA944*2) -> 24
A945: BOX HILL | C945: NICHOL | F945: MATHEWS | I945: SLATER | W945: BOX HILL | X945: 2 | Y945: 5 | Z945: 12 | AA945: 1 | AB945: 1324 | AC945: 1494 | AD945: =(AB945/AC945)*100 -> 88.621151271753689 | AE945: =(Y945*4)+(AA945*2) -> 22
A946: GOALKICKERS | W946: TRARALGON | X946: 2 | Y946: 3 | Z946: 14 | AA946: 1 | AB946: 1199 | AC946: 2053 | AD946: =(AB946/AC946)*100 -> 58.402338041889912 | AE946: =(Y946*4)+(AA946*2) -> 14
A947: TRARALGON | C947: WOLFE 3 | F947: BURRIDGE 3 | J947: HOPKINS | M947: FORYS | W947: COBURG | X947: 2 | Y947: 1 | Z947: 17 | AA947: 0 | AB947: 1084 | AC947: 2349 | AD947: =(AB947/AC947)*100 -> 46.147296722009365 | AE947: =(Y947*4)+(AA947*2) -> 4
A948: BOX HILL | C948: CROWLEY 2 | F948: MATHEWS | I948: WARRY | K948: HEANEY | M948: ROBINSON | P948: ALLSOP
A950: PORT MELBOURNE | C950: 2 | D950: 5 | E950: =(C950*6)+D950 -> 17 | G950: 3 | H950: 7 | I950: =(G950*6)+H950 -> 25 | K950: 7 | L950: 10 | M950: =(K950*6)+L950 -> 52 | O950: 12 | P950: 12 | Q950: =(O950*6)+P950 -> 84 | S950: Venue: COBURG
A951: COBURG | C951: 2 | D951: 1 | E951: =(C951*6)+D951 -> 13 | G951: 7 | H951: 4 | I951: =(G951*6)+H951 -> 46 | K951: 7 | L951: 6 | M951: =(K951*6)+L951 -> 48 | O951: 9 | P951: 10 | Q951: =(O951*6)+P951 -> 64
A952: BEST PLAYERS
A953: PORT MELBOURNE | C953: SETCHELL | F953: HOLLOW | I953: MORTON | L953: CLOHESY | N953: PICIAONE | Q953: WEEDING
A954: COBURG | C954: McLEOD | F954: WESTON | I954: PIGNATORO | L954: BEACHAM | N954: TORTORA | Q954: CORR
A955: GOALKICKERS
A956: PORT MELBOURNE | C956: WEEDING 3 | F956: CAMERON 2 | I956: McGEE 2 | L956: REYNOLDS 2 | O956: HOLLOW | Q956: SEXTON | S956: TINSLEY
A957: COBURG | C957: ALESSIO 5 | F957: WESTON 3 | I957: PIGNATORO
A959: SPRINGVALE | C959: 2 | D959: 8 | E959: =(C959*6)+D959 -> 20 | G959: 5 | H959: 12 | I959: =(G959*6)+H959 -> 42 | K959: 9 | L959: 18 | M959: =(K959*6)+L959 -> 72 | O959: 11 | P959: 20 | Q959: =(O959*6)+P959 -> 86 | S959: Venue: SPRINGVALE
A960: WERRIBEE | C960: 2 | D960: 2 | E960: =(C960*6)+D960 -> 14 | G960: 3 | H960: 5 | I960: =(G960*6)+H960 -> 23 | K960: 3 | L960: 5 | M960: =(K960*6)+L960 -> 23 | O960: 4 | P960: 5 | Q960: =(O960*6)+P960 -> 29
A961: BEST PLAYERS
A962: SPRINGVALE | C962: JEFFREY | F962: O'BRIEN | I962: JEFFS | L962: CAPSALIS | N962: D CARROLL | Q962: HILDEBRANDT
A963: WERRIBEE | C963: TAYLOR | F963: SHAW | I963: MURPHY | L963: ROACH | N963: SPROULE | Q963: ROBINSON
A964: GOALKICKERS
A965: SPRINGVALE | C965: SINNEMA 4 | F965: SMITH 3 | I965: JEFFREY 2 | L965: CAPLES | N965: CAPSALIS
A966: WERRIBEE | C966: SATTERLEY 2 | F966: AZIZ | H966: SHAW
A968: WILLIAMSTOWN | C968: 4 | D968: 7 | E968: =(C968*6)+D968 -> 31 | G968: 5 | H968: 10 | I968: =(G968*6)+H968 -> 40 | K968: 9 | L968: 13 | M968: =(K968*6)+L968 -> 67 | O968: 10 | P968: 13 | Q968: =(O968*6)+P968 -> 73 | S968: Venue: WILLIAMSTOWN
A969: NORTH BALLARAT | C969: 1 | D969: 1 | E969: =(C969*6)+D969 -> 7 | G969: 3 | H969: 4 | I969: =(G969*6)+H969 -> 22 | K969: 5 | L969: 8 | M969: =(K969*6)+L969 -> 38 | O969: 10 | P969: 11 | Q969: =(O969*6)+P969 -> 71
A970: BEST PLAYERS
A971: WILLIAMSTOWN | C971: FRASER | F971: GHAZI | I971: PASTORE | L971: GOULD | N971: SHIELDS | Q971: HORE
A972: NORTH BALLARAT | C972: DOYLE | F972: COX | I972: HOLMES | L972: T POLKINGHORNE | P972: SNIBSON
A973: GOALKICKERS
A974: WILLIAMSTOWN | C974: DELRE 2 | F974: FRASER | H974: GHAZI | J974: KERRY | L974: PASTORE | N974: GOULD | P974: SHIELDS | R974: HORE
A975: NORTH BALLARAT | C975: G POLKINGHORNE 2 | G975: McMAHON 2 | J975: MARTIN 2 | L975: DOHNT | N975: BROADBENT | Q975: GLEESON | T975: SNIBSON
A977: BYE | D977: PRESTON
A979: FINALS
A980: ELIMINATION FINAL | E980: 31ST AUGUST | J980: WEATHER
D981: 1ST QTR | H981: 2ND QTR | L981: 3RD QTR | P981: FINAL | S981: Venue: PORT MELBOURNE
A982: PORT MELBOURNE | C982: 4 | D982: 2 | E982: =(C982*6)+D982 -> 26 | G982: 6 | H982: 6 | I982: =(G982*6)+H982 -> 42 | K982: 11 | L982: 10 | M982: =(K982*6)+L982 -> 76 | O982: 17 | P982: 14 | Q982: =(O982*6)+P982 -> 116 | S982: UMPIRES
A983: WERRIBEE | C983: 2 | D983: 6 | E983: =(C983*6)+D983 -> 18 | G983: 6 | H983: 11 | I983: =(G983*6)+H983 -> 47 | K983: 10 | L983: 14 | M983: =(K983*6)+L983 -> 74 | O983: 14 | P983: 16 | Q983: =(O983*6)+P983 -> 100
A984: BEST PLAYERS
A985: PORT MELBOURNE | D985: McGEE | G985: BALLANTYNE | J985: SETCHELL | M985: REYNOLDS | P985: PICIAONE | S985: TINSLEY
A986: WERRIBEE | D986: EAMES | G986: ATKINS | J986: GELLIE | M986: SATTERLEY | P986: BUTTON | S986: PULI
A987: GOALKICKERS
A988: PORT MELBOURNE | D988: REYNOLDS 4 | G988: McGEE 4 | I988: SETCHELL 2 | L988: WEEDING 2 | O988: BUTTERWORTH | R988: EDWARDS | V988: HOLLOW | X988: PICIAONE | AA988: SEXTON
A989: WERRIBEE | D989: AZIZ 4 | G989: SHAW 2 | I989: GELLIE 2 | L989: CHRISTO | N989: LOVE | P989: MURPHY | R989: ATKINS | V989: EAMES | X989: CAMILLIERI
A991: QUALIFYING FINAL | E991: 1ST SEPTEMBER | J991: WEATHER
A992: SANDRINGHAM | C992: 3 | D992: 2 | E992: =(C992*6)+D992 -> 20 | G992: 7 | H992: 9 | I992: =(G992*6)+H992 -> 51 | K992: 13 | L992: 11 | M992: =(K992*6)+L992 -> 89 | O992: 17 | P992: 13 | Q992: =(O992*6)+P992 -> 115 | S992: Venue: PORT MELBOURNE
A993: SPRINGVALE | C993: 5 | D993: 3 | E993: =(C993*6)+D993 -> 33 | G993: 8 | H993: 2 | I993: =(G993*6)+H993 -> 50 | K993: 12 | L993: 4 | M993: =(K993*6)+L993 -> 76 | O993: 14 | P993: 6 | Q993: =(O993*6)+P993 -> 90
A994: BEST PLAYERS
A995: SANDRINGHAM | D995: FOLEY | G995: RIENIETS | J995: CLARKSON | M995: NUGENT | P995: BAXTER | S995: MACGEORGE
A996: SPRINGVALE | D996: SMITH | G996: CLARK | J996: CAPLES | M996: KNIGHT | P996: O'DONNELL | S996: BURGMAN
A997: GOALKICKERS
A998: SANDRINGHAM | D998: TEMPLETON 3 | G998: FOLEY 3 | I998: NUGENT 2 | K998: OAKLEY 2 | M998: MITCHELSON | P998: HAYNES | R998: MACGEORGE | W998: FRATER | X998: BAXTER | AA998: SAUTNER | AC998: MOONEY
A999: SPRINGVALE | D999: SMITH 7 | G999: SINNEMA 2 | J999: COURTNEY | M999: O'DONNELL | P999: JEFFREY | R999: KNIGHT | U999: CLARK
A1001: 1ST SEMI FINAL | E1001: 6TH SEPTEMBER
A1002: SPRINGVALE | C1002: 4 | D1002: 1 | E1002: =(C1002*6)+D1002 -> 25 | G1002: 6 | H1002: 3 | I1002: =(G1002*6)+H1002 -> 39 | K1002: 10 | L1002: 5 | M1002: =(K1002*6)+L1002 -> 65 | O1002: 16 | P1002: 7 | Q1002: =(O1002*6)+P1002 -> 103 | S1002: Venue: PORT MELBOURNE
A1003: PORT MELBOURNE | C1003: 2 | D1003: 2 | E1003: =(C1003*6)+D1003 -> 14 | G1003: 5 | H1003: 4 | I1003: =(G1003*6)+H1003 -> 34 | K1003: 9 | L1003: 6 | M1003: =(K1003*6)+L1003 -> 60 | O1003: 13 | P1003: 6 | Q1003: =(O1003*6)+P1003 -> 84
A1004: BEST PLAYERS
A1005: SPRINGVALE | D1005: O'BRIEN | G1005: KNIGHT | J1005: CLARK | M1005: CAPSALIS | P1005: D CARROLL | S1005: J CARROLL
A1006: PORT MELBOURNE | D1006: TINSLEY | G1006: M CHEEL | J1006: CLOHESY | M1006: McGEE | P1006: EDWARDS | S1006: SHARP
A1007: GOALKICKERS
A1008: SPRINGVALE | D1008: SMITH 5 | G1008: O'BRIEN 4 | I1008: KNIGHT 2 | K1008: O'DONNELL | N1008: D CARROLL | Q1008: JEFFREY | T1008: HILDEBRANDT | X1008: PHILLIPS
A1009: PORT MELBOURNE | D1009: EDWARDS 3 | G1009: BALLANTYNE | J1009: M CHEEL | L1009: GREENHAM | N1009: HOLLOW | P1009: REYNOLDS | R1009: PICIAONE | V1009: McGEE | X1009: SETCHELL | AA1009: SEXTON | AC1009: WEEDING
A1011: 2ND SEMI FINAL | E1011: 7TH SEPTEMBER
A1012: SANDRINGHAM | C1012: 2 | D1012: 3 | E1012: =(C1012*6)+D1012 -> 15 | G1012: 6 | H1012: 6 | I1012: =(G1012*6)+H1012 -> 42 | K1012: 9 | L1012: 10 | M1012: =(K1012*6)+L1012 -> 64 | O1012: 16 | P1012: 12 | Q1012: =(O1012*6)+P1012 -> 108 | S1012: Venue: PORT MELBOURNE
A1013: FRANKSTON | C1013: 3 | D1013: 4 | E1013: =(C1013*6)+D1013 -> 22 | G1013: 7 | H1013: 5 | I1013: =(G1013*6)+H1013 -> 47 | K1013: 9 | L1013: 6 | M1013: =(K1013*6)+L1013 -> 60 | O1013: 10 | P1013: 7 | Q1013: =(O1013*6)+P1013 -> 67
A1014: BEST PLAYERS
A1015: SANDRINGHAM | D1015: McKELLAR | G1015: HAYNES | J1015: BAXTER | M1015: FOLEY | P1015: MACGEORGE | S1015: CLARKSON
A1016: FRANKSTON | D1016: R STUBBS | G1016: SULLIVAN | J1016: CHARLES | M1016: LEYS
A1017: GOALKICKERS
A1018: SANDRINGHAM | D1018: FOLEY 3 | F1018: TEMPLETON 2 | I1018: DEAR 2 | K1018: McKELLAR 2 | N1018: BAXTER 2 | Q1018: NUGENT | S1018: SAUTNER | W1018: COGHLAN | X1018: HAYNES | AA1018: OAKLEY
A1019: FRANKSTON | D1019: SULLIVAN 4 | G1019: J PICKERING 2 | K1019: BOWEY | M1019: GOODWIN | O1019: GEORGIOU | R1019: R STUBBS
A1021: PRELIMINARY FINAL | E1021: 14TH SEPTEMBER
A1022: FRANKSTON | C1022: 3 | D1022: 4 | E1022: =(C1022*6)+D1022 -> 22 | G1022: 6 | H1022: 9 | I1022: =(G1022*6)+H1022 -> 45 | K1022: 10 | L1022: 12 | M1022: =(K1022*6)+L1022 -> 72 | O1022: 14 | P1022: 17 | Q1022: =(O1022*6)+P1022 -> 101 | S1022: Venue: PORT MELBOURNE
A1023: SPRINGVALE | C1023: 5 | D1023: 0 | E1023: =(C1023*6)+D1023 -> 30 | G1023: 7 | H1023: 1 | I1023: =(G1023*6)+H1023 -> 43 | K1023: 8 | L1023: 4 | M1023: =(K1023*6)+L1023 -> 52 | O1023: 9 | P1023: 8 | Q1023: =(O1023*6)+P1023 -> 62
A1024: BEST PLAYERS
A1025: FRANKSTON | D1025: CUMMINGS | G1025: DUNDAS | J1025: CHARLES | M1025: R STUBBS | P1025: MOORE | R1025: J PICKERING
A1026: SPRINGVALE | D1026: CAPLES | G1026: SUTHERLAND | J1026: SMITH | M1026: BURGMAN | P1026: CLARK | R1026: J CARROLL
A1027: GOALKICKERS
A1028: FRANKSTON | D1028: J PICKERING 4 | G1028: R STUBBS 3 | J1028: PARIS | L1028: S RYAN | N1028: CUMMINGS | Q1028: DAN CLARKE | U1028: GEORGIOU | X1028: DUNDAS | AA1028: GOODWIN
A1029: SPRINGVALE | D1029: SMITH 5 | G1029: O'BRIEN | J1029: KNIGHT | L1029: TAYLOR | N1029: DILLON
A1031: GRAND FINAL | E1031: 21ST SEPTEMBER
A1032: SANDRINGHAM | C1032: 3 | D1032: 1 | E1032: =(C1032*6)+D1032 -> 19 | G1032: 5 | H1032: 6 | I1032: =(G1032*6)+H1032 -> 36 | K1032: 7 | L1032: 10 | M1032: =(K1032*6)+L1032 -> 52 | O1032: 10 | P1032: 13 | Q1032: =(O1032*6)+P1032 -> 73 | S1032: Venue: PORT MELBOURNE
A1033: FRANKSTON | C1033: 1 | D1033: 3 | E1033: =(C1033*6)+D1033 -> 9 | G1033: 4 | H1033: 3 | I1033: =(G1033*6)+H1033 -> 27 | K1033: 4 | L1033: 9 | M1033: =(K1033*6)+L1033 -> 33 | O1033: 5 | P1033: 14 | Q1033: =(O1033*6)+P1033 -> 44
A1034: BEST PLAYERS
A1035: SANDRINGHAM
A1036: FRANKSTON
A1037: GOALKICKERS
A1038: SANDRINGHAM
A1039: FRANKSTON
A1041: INTERSTATE MATCH
A1042: V.F.L. | C1042: 3 | D1042: 7 | E1042: =(C1042*6)+D1042 -> 25 | G1042: 5 | H1042: 13 | I1042: =(G1042*6)+H1042 -> 43 | K1042: 7 | L1042: 20 | M1042: =(K1042*6)+L1042 -> 62 | O1042: 11 | P1042: 25 | Q1042: =(O1042*6)+P1042 -> 91
A1043: A.C.T./A.F.L. | C1043: 5 | D1043: 1 | E1043: =(C1043*6)+D1043 -> 31 | G1043: 6 | H1043: 4 | I1043: =(G1043*6)+H1043 -> 40 | K1043: 6 | L1043: 4 | M1043: =(K1043*6)+L1043 -> 40 | O1043: 10 | P1043: 6 | Q1043: =(O1043*6)+P1043 -> 66
A1044: BEST PLAYERS
A1045: V.F.L. | D1045: MOORE | G1045: JAMES | J1045: J CARROLL | M1045: HOWLETT | O1045: D CARROLL | R1045: CLARKSON
A1046: A.C.T./A.F.L. | D1046: KICK | G1046: LANGAN | J1046: BOWMAN | M1046: PANG | O1046: WYND
A1047: GOALKICKERS
A1048: V.F.L. | D1048: ALESSIO 5 | G1048: SMITH 3 | J1048: BALLANTYNE | M1048: HAYDOCK | O1048: MILLANE
A1049: A.C.T./A.F.L. | D1049: CHRISTIE 2 | G1049: LANGAN 2 | J1049: BROAD 2 | M1049: R HONEY 2 | P1049: NETTING | R1049: G CANNON