A1: Victorian Football League
A2: Season 1998
A3: © Copyright Wal Williams | F3: First created: 4 September 2016
A4: Contact: joywalwi at gmail dot com | F4: Last updated: 4 September 2016 | W4: VFA Results and tables - Link to the main index page
A5: You are free to copy this document in whole or part provided that proper acknowledgement is given to the author. All rights reserved.
A7: 1998 SEASON
A8: ROUND 1 | D8: 4TH APRIL | J8: WEATHER
D9: 1ST QTR | H9: 2ND QTR | L9: 3RD QTR | P9: FINAL | S9: Venue: PORT MELBOURNE
A10: BOX HILL | C10: 3 | D10: 6 | E10: =(C10*6)+D10 -> 24 | G10: 5 | H10: 8 | I10: =(G10*6)+H10 -> 38 | K10: 7 | L10: 11 | M10: =(K10*6)+L10 -> 53 | O10: 14 | P10: 15 | Q10: =(O10*6)+P10 -> 99 | S10: UMPIRES | Z10: LADDER | AC10: ROUND | AE10: 1
A11: PORT MELBOURNE | C11: 3 | D11: 1 | E11: =(C11*6)+D11 -> 19 | G11: 5 | H11: 4 | I11: =(G11*6)+H11 -> 34 | K11: 9 | L11: 8 | M11: =(K11*6)+L11 -> 62 | O11: 12 | P11: 11 | Q11: =(O11*6)+P11 -> 83
A12: BEST PLAYERS | W12: TEAM | X12: B | Y12: W | Z12: L | AA12: D | AB12: FOR | AC12: AGST | AD12: % | AE12: PTS
A13: BOX HILL | C13: HARTIN | F13: SLATER | I13: TRANQUILLI | L13: BELLO | N13: CROWLEY | Q13: ROBINSON
A14: PORT MELBOURNE | C14: CLOHESY | F14: HOLLOW | I14: HENDERSON | L14: DUANE | N14: MORTON | W14: SPRINGVALE | Y14: 1 | Z14: 0 | AA14: 0 | AB14: 157 | AC14: 83 | AD14: =(AB14/AC14)*100 -> 189.15662650602408 | AE14: =(Y14*4)+(AA14*2) -> 4
A15: GOALKICKERS | N15: ROWE | P15: WILKINSON | W15: WILLIAMSTOWN | Y15: 1 | Z15: 0 | AA15: 0 | AB15: 115 | AC15: 82 | AD15: =(AB15/AC15)*100 -> 140.2439024390244 | AE15: =(Y15*4)+(AA15*2) -> 4
A16: BOX HILL | C16: COOK 2 | E16: HABERFIELD 2 | H16: HARTIN 2 | J16: NICHOL 2 | L16: TRANQUILLI 2 | O16: BELLO | Q16: ROBINSON | W16: BOX HILL | Y16: 1 | Z16: 0 | AA16: 0 | AB16: 99 | AC16: 83 | AD16: =(AB16/AC16)*100 -> 119.27710843373494 | AE16: =(Y16*4)+(AA16*2) -> 4
A17: PORT MELBOURNE | C17: DUANE 4 | F17: DURLING 2 | I17: JAMES 2 | L17: McCARTHY 2 | O17: McGEE | Q17: McNAMARA | W17: FRANKSTON | Y17: 1 | Z17: 0 | AA17: 0 | AB17: 94 | AC17: 82 | AD17: =(AB17/AC17)*100 -> 114.63414634146341 | AE17: =(Y17*4)+(AA17*2) -> 4
W18: NORTH BALLARAT | Y18: 1 | Z18: 0 | AA18: 0 | AB18: 90 | AC18: 83 | AD18: =(AB18/AC18)*100 -> 108.43373493975903 | AE18: =(Y18*4)+(AA18*2) -> 4
A19: FRANKSTON | C19: 1 | D19: 3 | E19: =(C19*6)+D19 -> 9 | G19: 4 | H19: 6 | I19: =(G19*6)+H19 -> 30 | K19: 9 | L19: 7 | M19: =(K19*6)+L19 -> 61 | O19: 14 | P19: 10 | Q19: =(O19*6)+P19 -> 94 | S19: Venue: FRANKSTON | W19: SANDRINGHAM | X19: 1 | Y19: 0 | Z19: 0 | AA19: 0 | AB19: 0 | AC19: 0 | AE19: =(Y19*4)+(AA19*2) -> 0
A20: WERRIBEE | C20: 5 | D20: 1 | E20: =(C20*6)+D20 -> 31 | G20: 6 | H20: 3 | I20: =(G20*6)+H20 -> 39 | K20: 7 | L20: 8 | M20: =(K20*6)+L20 -> 50 | O20: 12 | P20: 10 | Q20: =(O20*6)+P20 -> 82
A21: BEST PLAYERS | W21: BENDIGO | Y21: 0 | Z21: 1 | AA21: 0 | AB21: 83 | AC21: 90 | AD21: =(AB21/AC21)*100 -> 92.222222222222229 | AE21: =(Y21*4)+(AA21*2) -> 0
A22: FRANKSTON | C22: ANDERSON | F22: MACKAY | I22: D CLARKE | L22: MOORE | N22: KING | W22: WERRIBEE | Y22: 0 | Z22: 1 | AA22: 0 | AB22: 82 | AC22: 94 | AD22: =(AB22/AC22)*100 -> 87.2340425531915 | AE22: =(Y22*4)+(AA22*2) -> 0
A23: WERRIBEE | C23: SAUNDERS | F23: DYER | I23: WILSON | L23: FROST | N23: GOODEY | Q23: JOYCE | W23: PORT MELBOURNE | Y23: 0 | Z23: 1 | AA23: 0 | AB23: 83 | AC23: 99 | AD23: =(AB23/AC23)*100 -> 83.838383838383834 | AE23: =(Y23*4)+(AA23*2) -> 0
A24: GOALKICKERS | O24: BOWEY | Q24: SULLIVAN | W24: PRESTON | Y24: 0 | Z24: 1 | AA24: 0 | AB24: 82 | AC24: 115 | AD24: =(AB24/AC24)*100 -> 71.304347826086953 | AE24: =(Y24*4)+(AA24*2) -> 0
A25: FRANKSTON | C25: MACKAY 3 | E25: ANDERSON 3 | H25: WELSH | J25: HOLCOMBE | M25: CUMMINGS | P25: DOYLE | R25: LAWRENCE | W25: COBURG | Y25: 0 | Z25: 1 | AA25: 0 | AB25: 83 | AC25: 157 | AD25: =(AB25/AC25)*100 -> 52.866242038216562 | AE25: =(Y25*4)+(AA25*2) -> 0
A26: WERRIBEE | C26: AZIZ 2 | E26: WHITNALL 2 | H26: C GOWANS 2 | K26: SAUNDERS 2 | N26: DYER | P26: SMITH | R26: HYDE | U26: P GOWANS
D27: 5TH APRIL | J27: WEATHER
A28: WILLIAMSTOWN | C28: 2 | D28: 3 | E28: =(C28*6)+D28 -> 15 | G28: 8 | H28: 3 | I28: =(G28*6)+H28 -> 51 | K28: 15 | L28: 6 | M28: =(K28*6)+L28 -> 96 | O28: 18 | P28: 7 | Q28: =(O28*6)+P28 -> 115 | S28: Venue: WILLIAMSTOWN
A29: PRESTON | C29: 4 | D29: 6 | E29: =(C29*6)+D29 -> 30 | G29: 4 | H29: 11 | I29: =(G29*6)+H29 -> 35 | K29: 6 | L29: 14 | M29: =(K29*6)+L29 -> 50 | O29: 11 | P29: 16 | Q29: =(O29*6)+P29 -> 82
A30: BEST PLAYERS
A31: WILLIAMSTOWN | C31: GHAZI | E31: FRASER | H31: ZAVALAS | K31: HOWLETT | M31: PATERSON | P31: LAMBROPOULOS
A32: PRESTON | C32: PENN | E32: ZORZI | H32: KNIGHTS | K32: CLARKE | M32: WISENDDEN | P32: MAIORANA
A33: GOALKICKERS
A34: WILLIAMSTOWN | C34: DELRE 4 | F34: ZAVALAS 3 | I34: McMAHON 3 | L34: GHAZI 3 | N34: LAMBROPOULOS 3 | R34: DOOLEY | V34: FRASER
A35: PRESTON | C35: ECCLES 2 | F35: CARACELLA 2 | I35: POWER 2 | L35: MANN 2 | N35: PASCOE | P35: HAYDOCK | R35: BLAGROVE
A37: SPRINGVALE | C37: 6 | D37: 2 | E37: =(C37*6)+D37 -> 38 | G37: 10 | H37: 6 | I37: =(G37*6)+H37 -> 66 | K37: 16 | L37: 11 | M37: =(K37*6)+L37 -> 107 | O37: 24 | P37: 13 | Q37: =(O37*6)+P37 -> 157 | S37: Venue: SPRINGVALE
A38: COBURG | C38: 3 | D38: 2 | E38: =(C38*6)+D38 -> 20 | G38: 6 | H38: 3 | I38: =(G38*6)+H38 -> 39 | K38: 7 | L38: 4 | M38: =(K38*6)+L38 -> 46 | O38: 13 | P38: 5 | Q38: =(O38*6)+P38 -> 83
A39: BEST PLAYERS
A40: SPRINGVALE | C40: TAYLOR | F40: WILLOUGHBY | I40: KNIGHT | L40: FORD | N40: J CARROLL
A41: COBURG | C41: DUNCAN | F41: AGRESTA | I41: DAVIDSON | L41: McLEOD | N41: McCABE
A42: GOALKICKERS
A43: SPRINGVALE | C43: SMITH 6 | E43: JEWELL 4 | G43: J CARROLL 3 | J43: EVANS 2 | L43: FORD 2 | N43: SHAW 2 | P43: WILLOUGHBY 2 | T43: KNIGHT | W43: TAYLOR | X43: TROLLOPE
A44: COBURG | C44: SUTHERLAND 3 | F44: EZARD 2 | H44: SOURASSIS 2 | K44: WILLIAMS | M44: DUNCAN | O44: WILLOUGHBY | R44: McCABE | U44: HILL | W44: AGRESTA
A46: NORTH BALLARAT | C46: 2 | D46: 4 | E46: =(C46*6)+D46 -> 16 | G46: 7 | H46: 6 | I46: =(G46*6)+H46 -> 48 | K46: 10 | L46: 8 | M46: =(K46*6)+L46 -> 68 | O46: 13 | P46: 12 | Q46: =(O46*6)+P46 -> 90 | S46: Venue: BENDIGO
A47: BENDIGO | C47: 4 | D47: 3 | E47: =(C47*6)+D47 -> 27 | G47: 4 | H47: 9 | I47: =(G47*6)+H47 -> 33 | K47: 8 | L47: 13 | M47: =(K47*6)+L47 -> 61 | O47: 11 | P47: 17 | Q47: =(O47*6)+P47 -> 83
A48: BEST PLAYERS
A49: NORTH BALLARAT | C49: MARTIN | F49: MAHER | I49: McCULLOCK | L49: T POLKINGHORNE | P49: DOHERTY | R49: COX
A50: BENDIGO | C50: LANCASTER | F50: CURSIO | I50: DURIE | L50: TOINTON | P50: SMITH | R50: ELSUM
A51: GOALKICKERS
A52: NORTH BALLARAT | C52: MARTIN 5 | F52: DOHERTY 2 | I52: DOYLE 2 | K52: ADAMS | M52: INIA | O52: FIELD | Q52: MAHER
A53: BENDIGO | C53: TOINTON 5 | F53: O'CALLAGHAN 2 | I53: ELSUM 2 | K53: ORR | M53: WHITSED
A55: BYE | D55: SANDRINGHAM
A57: ROUND 2 | D57: 11TH APRIL | J57: WEATHER
D58: 1ST QTR | H58: 2ND QTR | L58: 3RD QTR | P58: FINAL | S58: Venue: BEACH ROAD
A59: FRANKSTON | C59: 3 | D59: 0 | E59: =(C59*6)+D59 -> 18 | G59: 9 | H59: 1 | I59: =(G59*6)+H59 -> 55 | K59: 10 | L59: 5 | M59: =(K59*6)+L59 -> 65 | O59: 14 | P59: 10 | Q59: =(O59*6)+P59 -> 94 | S59: UMPIRES | Z59: LADDER | AC59: ROUND | AE59: 2
A60: SANDRINGHAM | C60: 8 | D60: 2 | E60: =(C60*6)+D60 -> 50 | G60: 8 | H60: 9 | I60: =(G60*6)+H60 -> 57 | K60: 8 | L60: 11 | M60: =(K60*6)+L60 -> 59 | O60: 9 | P60: 13 | Q60: =(O60*6)+P60 -> 67
A61: BEST PLAYERS | W61: TEAM | X61: B | Y61: W | Z61: L | AA61: D | AB61: FOR | AC61: AGST | AD61: % | AE61: PTS
A62: FRANKSTON | C62: CUMMINGS | F62: LAWRENCE | I62: MACKAY | L62: MURRAY | N62: BOWEY | P62: SCOTT
A63: SANDRINGHAM | C63: RIENIETS | F63: OAKLEY | I63: D GRANT | W63: NORTH BALLARAT | Y63: 2 | Z63: 0 | AA63: 0 | AB63: 194 | AC63: 149 | AD63: =(AB63/AC63)*100 -> 130.20134228187919 | AE63: =(Y63*4)+(AA63*2) -> 8
A64: GOALKICKERS | P64: HOLCOMBE | W64: FRANKSTON | Y64: 2 | Z64: 0 | AA64: 0 | AB64: 188 | AC64: 149 | AD64: =(AB64/AC64)*100 -> 126.1744966442953 | AE64: =(Y64*4)+(AA64*2) -> 8
A65: FRANKSTON | C65: MURRAY 4 | F65: ANDERSON 3 | I65: WEBB 2 | K65: RYAN | M65: MALLOY | O65: D CLARKE | Q65: SCOTT | W65: SPRINGVALE | Y65: 1 | Z65: 1 | AA65: 0 | AB65: 221 | AC65: 154 | AD65: =(AB65/AC65)*100 -> 143.50649350649351 | AE65: =(Y65*4)+(AA65*2) -> 4
A66: SANDRINGHAM | C66: B OAKLEY 2 | F66: BRADLEY | H66: NUGENT | J66: AMIET | L66: TEMPLETON | O66: MURRAY | Q66: MITCHELSON | W66: BOX HILL | X66: 1 | Y66: 1 | Z66: 0 | AA66: 0 | AB66: 99 | AC66: 83 | AD66: =(AB66/AC66)*100 -> 119.27710843373494 | AE66: =(Y66*4)+(AA66*2) -> 4
N67: BAXTER | W67: BENDIGO | Y67: 1 | Z67: 1 | AA67: 0 | AB67: 156 | AC67: 140 | AD67: =(AB67/AC67)*100 -> 111.42857142857143 | AE67: =(Y67*4)+(AA67*2) -> 4
A68: PRESTON | C68: 4 | D68: 2 | E68: =(C68*6)+D68 -> 26 | G68: 8 | H68: 5 | I68: =(G68*6)+H68 -> 53 | K68: 10 | L68: 6 | M68: =(K68*6)+L68 -> 66 | O68: 13 | P68: 9 | Q68: =(O68*6)+P68 -> 87 | S68: Venue: PRESTON | W68: WILLIAMSTOWN | Y68: 1 | Z68: 1 | AA68: 0 | AB68: 181 | AC68: 186 | AD68: =(AB68/AC68)*100 -> 97.311827956989248 | AE68: =(Y68*4)+(AA68*2) -> 4
A69: PORT MELBOURNE | C69: 4 | D69: 2 | E69: =(C69*6)+D69 -> 26 | G69: 6 | H69: 7 | I69: =(G69*6)+H69 -> 43 | K69: 8 | L69: 7 | M69: =(K69*6)+L69 -> 55 | O69: 11 | P69: 11 | Q69: =(O69*6)+P69 -> 77
A70: BEST PLAYERS | W70: WERRIBEE | Y70: 1 | Z70: 1 | AA70: 0 | AB70: 153 | AC70: 158 | AD70: =(AB70/AC70)*100 -> 96.835443037974684 | AE70: =(Y70*4)+(AA70*2) -> 4
A71: PRESTON | C71: ECCLES | F71: MAIORANA | I71: ZORZI | L71: CLARKE | N71: BLAGROVE | W71: PRESTON | Y71: 1 | Z71: 1 | AA71: 0 | AB71: 169 | AC71: 192 | AD71: =(AB71/AC71)*100 -> 88.020833333333343 | AE71: =(Y71*4)+(AA71*2) -> 4
A72: PORT MELBOURNE | C72: CLOHESY | F72: HOLLOW | I72: HENDERSON | L72: BALLANTYNE | O72: SEXTON | Q72: BUTTERWORTH | W72: PORT MELBOURNE | Y72: 0 | Z72: 2 | AA72: 0 | AB72: 160 | AC72: 186 | AD72: =(AB72/AC72)*100 -> 86.021505376344081 | AE72: =(Y72*4)+(AA72*2) -> 0
A73: GOALKICKERS | W73: SANDRINGHAM | X73: 1 | Y73: 0 | Z73: 1 | AA73: 0 | AB73: 67 | AC73: 94 | AD73: =(AB73/AC73)*100 -> 71.276595744680847 | AE73: =(Y73*4)+(AA73*2) -> 0
A74: PRESTON | C74: ECCLES 6 | F74: D GRAINGER 3 | J74: PASCOE 2 | M74: CLARKE 2 | W74: COBURG | Y74: 0 | Z74: 2 | AA74: 0 | AB74: 133 | AC74: 230 | AD74: =(AB74/AC74)*100 -> 57.826086956521735 | AE74: =(Y74*4)+(AA74*2) -> 0
A75: PORT MELBOURNE | C75: PICIAONE 2 | F75: SEXTON 2 | I75: WEEDING 2 | L75: BALLANTYNE | O75: SEXTON | Q75: BUTTERWORTH
E76: NIGHT MATCH
A77: NORTH BALLARAT | C77: 1 | D77: 2 | E77: =(C77*6)+D77 -> 8 | G77: 7 | H77: 5 | I77: =(G77*6)+H77 -> 47 | K77: 13 | L77: 7 | M77: =(K77*6)+L77 -> 85 | O77: 16 | P77: 8 | Q77: =(O77*6)+P77 -> 104 | S77: Venue: NORTH BALLARAT
A78: WILLIAMSTOWN | C78: 2 | D78: 4 | E78: =(C78*6)+D78 -> 16 | G78: 4 | H78: 6 | I78: =(G78*6)+H78 -> 30 | K78: 7 | L78: 9 | M78: =(K78*6)+L78 -> 51 | O78: 9 | P78: 12 | Q78: =(O78*6)+P78 -> 66
A79: BEST PLAYERS
A80: NORTH BALLARAT | C80: J POLKINGHORNE | G80: McULLOCH | J80: FIELD | L80: CLARKE | N80: LUBEEK | Q80: VERBONE
A81: WILLIAMSTOWN | C81: CARRICK | G81: HORE | J81: WALLACE | L81: GRIFFEN | N81: GHAZI
A82: GOALKICKERS
A83: NORTH BALLARAT | C83: CLARKE 4 | E83: EDMONDS 2 | H83: MARTIN 2 | K83: T POLKINGHORNE | O83: KEENAN | Q83: MAHER | S83: DOHERTY | W83: PICKFORD | X83: INIA
A84: WILLIAMSTOWN | C84: DELRE 3 | F84: ZAVALAS 3 | I84: CARRICK | K84: HOWLETT | M84: GHAZI | O84: KERRY
D85: 12TH APRIL | J85: WEATHER | M85: FINE
A86: WERRIBEE | C86: 2 | D86: 2 | E86: =(C86*6)+D86 -> 14 | G86: 6 | H86: 7 | I86: =(G86*6)+H86 -> 43 | K86: 8 | L86: 9 | M86: =(K86*6)+L86 -> 57 | O86: 10 | P86: 11 | Q86: =(O86*6)+P86 -> 71 | S86: Venue: WERRIBEE
A87: SPRINGVALE | C87: 3 | D87: 3 | E87: =(C87*6)+D87 -> 21 | G87: 4 | H87: 4 | I87: =(G87*6)+H87 -> 28 | K87: 7 | L87: 6 | M87: =(K87*6)+L87 -> 48 | O87: 9 | P87: 10 | Q87: =(O87*6)+P87 -> 64
A88: BEST PLAYERS
A89: WERRIBEE | C89: WHITNALL | F89: FROST | I89: GOODEY | K89: KELLETT | N89: DYER | P89: SMITH
A90: SPRINGVALE | C90: SUTHERLAND | F90: JEFFREY | I90: LITTLE | K90: KNIGHT | N90: HALL
A91: GOALKICKERS
A92: WERRIBEE | C92: AZIZ 3 | F92: SHAW 3 | I92: FROST | K92: REARDON | M92: FAULKNER
A93: SPRINGVALE | C93: SMITH 3 | F93: EVANS | H93: J CARROLL | K93: FORD | M93: WARREN | P93: JEFFREY | R93: WILLOUGHBY
A95: BENDIGO | C95: 2 | D95: 4 | E95: =(C95*6)+D95 -> 16 | G95: 3 | H95: 4 | I95: =(G95*6)+H95 -> 22 | K95: 8 | L95: 12 | M95: =(K95*6)+L95 -> 60 | O95: 10 | P95: 13 | Q95: =(O95*6)+P95 -> 73 | S95: Venue: COBURG
A96: COBURG | C96: 1 | D96: 3 | E96: =(C96*6)+D96 -> 9 | G96: 3 | H96: 7 | I96: =(G96*6)+H96 -> 25 | K96: 3 | L96: 8 | M96: =(K96*6)+L96 -> 26 | O96: 6 | P96: 14 | Q96: =(O96*6)+P96 -> 50
A97: BEST PLAYERS
A98: BENDIGO | C98: SMITH | F98: CURCIO | I98: DURIE | K98: JENNINGS | N98: SCHMIDT | Q98: BUTLER
A99: COBURG | C99: WESTON | F99: PEVERILL | I99: DUNCAN
A100: GOALKICKERS
A101: BENDIGO | C101: DURIE 3 | F101: MARSHALL 2 | I101: TOINTON | L101: CURCIO | N101: LANCASTER | Q101: LANGAN | T101: PASCOE
A102: COBURG | C102: ALESSIO 3 | F102: HILL 2 | I102: DAVIDSON
A104: BYE | D104: BOX HILL
A106: ROUND 3 | D106: 18TH APRIL | J106: WEATHER
D107: 1ST QTR | H107: 2ND QTR | L107: 3RD QTR | P107: FINAL | S107: Venue: PORT MELBOURNE
A108: PORT MELBOURNE | C108: 3 | D108: 4 | E108: =(C108*6)+D108 -> 22 | G108: 6 | H108: 6 | I108: =(G108*6)+H108 -> 42 | K108: 11 | L108: 7 | M108: =(K108*6)+L108 -> 73 | O108: 16 | P108: 9 | Q108: =(O108*6)+P108 -> 105 | S108: UMPIRES | Z108: LADDER | AC108: ROUND | AE108: 3
A109: NORTH BALLARAT | C109: 1 | D109: 4 | E109: =(C109*6)+D109 -> 10 | G109: 6 | H109: 5 | I109: =(G109*6)+H109 -> 41 | K109: 8 | L109: 7 | M109: =(K109*6)+L109 -> 55 | O109: 9 | P109: 12 | Q109: =(O109*6)+P109 -> 66
A110: BEST PLAYERS | W110: TEAM | X110: B | Y110: W | Z110: L | AA110: D | AB110: FOR | AC110: AGST | AD110: % | AE110: PTS
A111: PORT MELBOURNE | C111: SCHAEFER | F111: SEXTON | I111: D'GIACOMA | L111: NAPOLI | N111: PICIAONE | Q111: VILLAROSSA
A112: NORTH BALLARAT | C112: J POLKINGHORNE | G112: FLETCHER | J112: G POLKINGHORNE | N112: DOYLE | W112: SPRINGVALE | Y112: 2 | Z112: 1 | AA112: 0 | AB112: 363 | AC112: 210 | AD112: =(AB112/AC112)*100 -> 172.85714285714286 | AE112: =(Y112*4)+(AA112*2) -> 8
A113: GOALKICKERS | W113: FRANKSTON | X113: 1 | Y113: 2 | Z113: 0 | AA113: 0 | AB113: 188 | AC113: 149 | AD113: =(AB113/AC113)*100 -> 126.1744966442953 | AE113: =(Y113*4)+(AA113*2) -> 8
A114: PORT MELBOURNE | C114: SEXTON 5 | F114: WEEDING 5 | I114: M CHEEL 2 | L114: CREDLIN | N114: DUANE | P114: GOODALE | R114: VILLAROSSA | W114: WERRIBEE | Y114: 2 | Z114: 1 | AA114: 0 | AB114: 314 | AC114: 251 | AD114: =(AB114/AC114)*100 -> 125.09960159362549 | AE114: =(Y114*4)+(AA114*2) -> 8
A115: NORTH BALLARAT | C115: MARTIN 2 | F115: INIA 2 | I115: T POLKINGHORNE | M115: FIELD | O115: DOYLE | Q115: CLARKE | S115: EDMONDS | W115: WILLIAMSTOWN | Y115: 2 | Z115: 1 | AA115: 0 | AB115: 297 | AC115: 262 | AD115: =(AB115/AC115)*100 -> 113.3587786259542 | AE115: =(Y115*4)+(AA115*2) -> 8
D116: 19TH APRIL | J116: WEATHER | W116: PRESTON | Y116: 2 | Z116: 1 | AA116: 0 | AB116: 252 | AC116: 245 | AD116: =(AB116/AC116)*100 -> 102.85714285714285 | AE116: =(Y116*4)+(AA116*2) -> 8
A117: SPRINGVALE | C117: 4 | D117: 2 | E117: =(C117*6)+D117 -> 26 | G117: 9 | H117: 4 | I117: =(G117*6)+H117 -> 58 | K117: 15 | L117: 7 | M117: =(K117*6)+L117 -> 97 | O117: 22 | P117: 10 | Q117: =(O117*6)+P117 -> 142 | S117: Venue: SPRINGVALE | W117: NORTH BALLARAT | Y117: 2 | Z117: 1 | AA117: 0 | AB117: 260 | AC117: 254 | AD117: =(AB117/AC117)*100 -> 102.36220472440945 | AE117: =(Y117*4)+(AA117*2) -> 8
A118: SANDRINGHAM | C118: 2 | D118: 1 | E118: =(C118*6)+D118 -> 13 | G118: 7 | H118: 3 | I118: =(G118*6)+H118 -> 45 | K118: 7 | L118: 6 | M118: =(K118*6)+L118 -> 48 | O118: 8 | P118: 8 | Q118: =(O118*6)+P118 -> 56
A119: BEST PLAYERS | W119: PORT MELBOURNE | Y119: 1 | Z119: 2 | AA119: 0 | AB119: 265 | AC119: 252 | AD119: =(AB119/AC119)*100 -> 105.15873015873017 | AE119: =(Y119*4)+(AA119*2) -> 4
A120: SPRINGVALE | C120: D CARROLL | F120: JEFFREY | I120: FORD | K120: J CARROLL | N120: CAPLES | W120: BOX HILL | X120: 1 | Y120: 1 | Z120: 1 | AA120: 0 | AB120: 152 | AC120: 166 | AD120: =(AB120/AC120)*100 -> 91.566265060240966 | AE120: =(Y120*4)+(AA120*2) -> 4
A121: SANDRINGHAM | C121: RIENIETS | W121: BENDIGO | Y121: 1 | Z121: 2 | AA121: 0 | AB121: 249 | AC121: 301 | AD121: =(AB121/AC121)*100 -> 82.724252491694344 | AE121: =(Y121*4)+(AA121*2) -> 4
A122: GOALKICKERS | K122: TAYLOR | M122: JEFFREY | O122: KNIGHT | Q122: LITTLE | R122: O'BRIEN | W122: COBURG | Y122: 0 | Z122: 3 | AA122: 0 | AB122: 209 | AC122: 346 | AD122: =(AB122/AC122)*100 -> 60.404624277456641 | AE122: =(Y122*4)+(AA122*2) -> 0
A123: SPRINGVALE | C123: SMITH 5 | E123: EVANS 3 | G123: J CARROLL 2 | J123: JEWELL 2 | L123: WARREN 2 | O123: DELARUE | Q123: FORD | S123: HALL | W123: SANDRINGHAM | X123: 1 | Y123: 0 | Z123: 2 | AA123: 0 | AB123: 123 | AC123: 236 | AD123: =(AB123/AC123)*100 -> 52.118644067796616 | AE123: =(Y123*4)+(AA123*2) -> 0
A124: SANDRINGHAM | C124: TEMPLETON 3 | F124: ARGUS | H124: MITCHELSON | K124: RADFORD | M124: SCOTT-BRANIGAN | Q124: AMIET
A126: WERRIBEE | C126: 8 | D126: 2 | E126: =(C126*6)+D126 -> 50 | G126: 12 | H126: 5 | I126: =(G126*6)+H126 -> 77 | K126: 16 | L126: 7 | M126: =(K126*6)+L126 -> 103 | O126: 25 | P126: 11 | Q126: =(O126*6)+P126 -> 161 | S126: Venue: BENDIGO
A127: BENDIGO | C127: 2 | D127: 3 | E127: =(C127*6)+D127 -> 15 | G127: 8 | H127: 5 | I127: =(G127*6)+H127 -> 53 | K127: 11 | L127: 10 | M127: =(K127*6)+L127 -> 76 | O127: 13 | P127: 15 | Q127: =(O127*6)+P127 -> 93
A128: BEST PLAYERS
A129: WERRIBEE | C129: GOODEY | F129: AZIZ | I129: FAULKNER | L129: FROST | O129: PULI | Q129: SUTTON
A130: BENDIGO | C130: DURIE | F130: ST CLAIR | I130: LANGAN | L130: LANCASTER | O130: HURST | Q130: ELSUM
A131: GOALKICKERS
A132: WERRIBEE | C132: AZIZ 7 | E132: ROACH 3 | G132: FAULKNER 2 | J132: SHAW 2 | L132: SAUNDERS 2 | O132: GELLIE 2 | Q132: REARDON 2 | T132: PULI | V132: GOODEY | X132: GOWANS | AA132: DYER | AC132: ATKINS
A133: BENDIGO | C133: LANGAN 2 | E133: PASCOE 2 | G133: DURIE 2 | I133: ELSUM 2 | K133: SANDERFORD | N133: TOINTON | P133: O'CALLAGHAN | T133: SCHMIDT | W133: SMITH
A135: WILLIAMSTOWN | C135: 1 | D135: 2 | E135: =(C135*6)+D135 -> 8 | G135: 6 | H135: 3 | I135: =(G135*6)+H135 -> 39 | K135: 13 | L135: 11 | M135: =(K135*6)+L135 -> 89 | O135: 17 | P135: 14 | Q135: =(O135*6)+P135 -> 116 | S135: Venue: WILLIAMSTOWN
A136: COBURG | C136: 3 | D136: 3 | E136: =(C136*6)+D136 -> 21 | G136: 7 | H136: 5 | I136: =(G136*6)+H136 -> 47 | K136: 8 | L136: 6 | M136: =(K136*6)+L136 -> 54 | O136: 11 | P136: 10 | Q136: =(O136*6)+P136 -> 76
A137: BEST PLAYERS
A138: WILLIAMSTOWN | C138: GHAZI | F138: WEST | I138: SHIELDS | L138: McHARDY | O138: DELRE | Q138: KERRY
A139: COBURG | C139: BUDGE | F139: GILPIN | I139: CONDON | L139: SALVADOR | O139: HOOD | Q139: PEEL
A140: GOALKICKERS
A141: WILLIAMSTOWN | C141: DELRE 6 | E141: GHAZI 3 | G141: CARRICK 2 | J141: BETTIN | L141: SHIELDS | N141: CAPE | P141: FRASER | R141: WALLACE | V141: GOULD
A142: COBURG | C142: GILPIN 4 | F142: ALESSIO 2 | I142: DUNCAN 2 | L142: SUTHERLAND | O142: DAVIDSON | R142: SALVADOR
A144: PRESTON | C144: 1 | D144: 5 | E144: =(C144*6)+D144 -> 11 | G144: 3 | H144: 11 | I144: =(G144*6)+H144 -> 29 | K144: 6 | L144: 15 | M144: =(K144*6)+L144 -> 51 | O144: 11 | P144: 17 | Q144: =(O144*6)+P144 -> 83 | S144: Venue: BOX HILL
A145: BOX HILL | C145: 2 | D145: 5 | E145: =(C145*6)+D145 -> 17 | G145: 5 | H145: 8 | I145: =(G145*6)+H145 -> 38 | K145: 5 | L145: 11 | M145: =(K145*6)+L145 -> 41 | O145: 7 | P145: 11 | Q145: =(O145*6)+P145 -> 53
A146: BEST PLAYERS
A147: PRESTON | C147: KOFOED | F147: ECCLES | I147: KNIGHTS | L147: MAIORANA | O147: POWER | Q147: PENN
A148: BOX HILL | C148: NIL
A149: GOALKICKERS
A150: PRESTON | C150: ECCLES 5 | F150: PASCOE 2 | I150: BAYRE | K150: MANN | M150: CLARKE | O150: KNIGHTS
A151: BOX HILL | C151: NICHOL 2 | F151: WILKINSON 2 | J151: DOUGLAS | M151: TRANQUILLI | P151: PARTHEBIDES
A153: BYE | D153: FRANKSTON
A155: ROUND 4 | D155: 25TH APRIL | J155: WEATHER
D156: 1ST QTR | H156: 2ND QTR | L156: 3RD QTR | P156: FINAL | S156: Venue: WERRIBEE
A157: WERRIBEE | C157: 1 | D157: 6 | E157: =(C157*6)+D157 -> 12 | G157: 5 | H157: 11 | I157: =(G157*6)+H157 -> 41 | K157: 8 | L157: 12 | M157: =(K157*6)+L157 -> 60 | O157: 13 | P157: 14 | Q157: =(O157*6)+P157 -> 92 | S157: UMPIRES | Z157: LADDER | AC157: ROUND | AE157: 4
A158: WILLIAMSTOWN | C158: 3 | D158: 2 | E158: =(C158*6)+D158 -> 20 | G158: 7 | H158: 3 | I158: =(G158*6)+H158 -> 45 | K158: 10 | L158: 7 | M158: =(K158*6)+L158 -> 67 | O158: 11 | P158: 11 | Q158: =(O158*6)+P158 -> 77
A159: BEST PLAYERS | W159: TEAM | X159: B | Y159: W | Z159: L | AA159: D | AB159: FOR | AC159: AGST | AD159: % | AE159: PTS
A160: WERRIBEE | C160: FAULKNER | F160: HYDE | I160: ATKINS | L160: PULI | N160: KELLETT | Q160: GOODEY
A161: WILLIAMSTOWN | C161: WEST | F161: DELRE | I161: RAILTON | L161: GHAZI | N161: HORE | Q161: PATERSON | W161: FRANKSTON | X161: 1 | Y161: 3 | Z161: 0 | AA161: 0 | AB161: 256 | AC161: 205 | AD161: =(AB161/AC161)*100 -> 124.8780487804878 | AE161: =(Y161*4)+(AA161*2) -> 12
A162: GOALKICKERS | P162: CHURCHILL | W162: WERRIBEE | Y162: 3 | Z162: 1 | AA162: 0 | AB162: 406 | AC162: 328 | AD162: =(AB162/AC162)*100 -> 123.78048780487805 | AE162: =(Y162*4)+(AA162*2) -> 12
A163: WERRIBEE | C163: FAULKNER 3 | F163: SHAW 2 | H163: AZIZ 2 | J163: SMITH 2 | M163: FROST | O163: REARDON | Q163: WILSON | W163: NORTH BALLARAT | Y163: 3 | Z163: 1 | AA163: 0 | AB163: 313 | AC163: 283 | AD163: =(AB163/AC163)*100 -> 110.60070671378092 | AE163: =(Y163*4)+(AA163*2) -> 12
A164: WILLIAMSTOWN | C164: DELRE 6 | F164: GHAZI 2 | I164: RAILTON | K164: WEST | M164: HOLLOW | W164: SPRINGVALE | Y164: 2 | Z164: 2 | AA164: 0 | AB164: 419 | AC164: 278 | AD164: =(AB164/AC164)*100 -> 150.71942446043164 | AE164: =(Y164*4)+(AA164*2) -> 8
D165: NIGHT GAME | W165: WILLIAMSTOWN | Y165: 2 | Z165: 2 | AA165: 0 | AB165: 374 | AC165: 354 | AD165: =(AB165/AC165)*100 -> 105.64971751412429 | AE165: =(Y165*4)+(AA165*2) -> 8
A166: NORTH BALLARAT | C166: 2 | D166: 3 | E166: =(C166*6)+D166 -> 15 | G166: 2 | H166: 3 | I166: =(G166*6)+H166 -> 15 | K166: 7 | L166: 5 | M166: =(K166*6)+L166 -> 47 | O166: 8 | P166: 5 | Q166: =(O166*6)+P166 -> 53 | S166: Venue: NORTH BALLARAT | W166: PRESTON | X166: 1 | Y166: 2 | Z166: 1 | AA166: 0 | AB166: 252 | AC166: 245 | AD166: =(AB166/AC166)*100 -> 102.85714285714285 | AE166: =(Y166*4)+(AA166*2) -> 8
A167: BOX HILL | C167: 0 | D167: 1 | E167: =(C167*6)+D167 -> 1 | G167: 3 | H167: 3 | I167: =(G167*6)+H167 -> 21 | K167: 3 | L167: 3 | M167: =(K167*6)+L167 -> 21 | O167: 4 | P167: 5 | Q167: =(O167*6)+P167 -> 29
A168: BEST PLAYERS | W168: PORT MELBOURNE | Y168: 1 | Z168: 3 | AA168: 0 | AB168: 332 | AC168: 321 | AD168: =(AB168/AC168)*100 -> 103.42679127725856 | AE168: =(Y168*4)+(AA168*2) -> 4
A169: NORTH BALLARAT | C169: G POLKINGHORNE | G169: YORK | I169: PICKFORD | L169: J POLKINGHORNE | P169: VERBEEN | R169: CLARKE | W169: BENDIGO | Y169: 1 | Z169: 3 | AA169: 0 | AB169: 315 | AC169: 368 | AD169: =(AB169/AC169)*100 -> 85.597826086956516 | AE169: =(Y169*4)+(AA169*2) -> 4
A170: BOX HILL | C170: CROWLEY | G170: SLATER | J170: WILKINSON | W170: BOX HILL | X170: 1 | Y170: 1 | Z170: 2 | AA170: 0 | AB170: 181 | AC170: 219 | AD170: =(AB170/AC170)*100 -> 82.648401826484019 | AE170: =(Y170*4)+(AA170*2) -> 4
A171: GOALKICKERS | W171: COBURG | Y171: 1 | Z171: 3 | AA171: 0 | AB171: 278 | AC171: 413 | AD171: =(AB171/AC171)*100 -> 67.312348668280876 | AE171: =(Y171*4)+(AA171*2) -> 4
A172: NORTH BALLARAT | C172: EDMONDS 2 | F172: McCULLOCH | I172: PICKFORD | L172: INIA | M172: MAHER | O172: MARTIN | Q172: G POLKINGHORNE | W172: SANDRINGHAM | X172: 1 | Y172: 1 | Z172: 2 | AA172: 0 | AB172: 190 | AC172: 302 | AD172: =(AB172/AC172)*100 -> 62.913907284768214 | AE172: =(Y172*4)+(AA172*2) -> 4
A173: BOX HILL | C173: AIELLO 2 | F173: SLATER | I173: GEORGIADIS
D174: 26TH APRIL | J174: WEATHER
A175: FRANKSTON | C175: 3 | D175: 2 | E175: =(C175*6)+D175 -> 20 | G175: 6 | H175: 3 | I175: =(G175*6)+H175 -> 39 | K175: 9 | L175: 3 | M175: =(K175*6)+L175 -> 57 | O175: 10 | P175: 8 | Q175: =(O175*6)+P175 -> 68 | S175: Venue: FRANKSTON
A176: SPRINGVALE | C176: 2 | D176: 3 | E176: =(C176*6)+D176 -> 15 | G176: 5 | H176: 6 | I176: =(G176*6)+H176 -> 36 | K176: 5 | L176: 7 | M176: =(K176*6)+L176 -> 37 | O176: 8 | P176: 8 | Q176: =(O176*6)+P176 -> 56
A177: BEST PLAYERS
A178: FRANKSTON | C178: DAM CLARKE | F178: KING | I178: WELSH | L178: MOORE | N178: CUMMINGS | Q178: BURNELL
A179: SPRINGVALE | C179: SUTHERLAND | F179: TROLLOPE | I179: TAYLOR | L179: JOY | N179: PASTORE
A180: GOALKICKERS
A181: FRANKSTON | C181: WELSH 4 | F181: SCOTT | H181: BOWEY | J181: BURNELL | M181: WEBB | O181: ANDERSON | R181: HOPGOOD
A182: SPRINGVALE | C182: SMITH 4 | F182: DELARUE | I182: FORD | K182: JEWELL | M182: LITTLE
A184: SANDRINGHAM | C184: 2 | D184: 4 | E184: =(C184*6)+D184 -> 16 | G184: 4 | H184: 7 | I184: =(G184*6)+H184 -> 31 | K184: 8 | L184: 10 | M184: =(K184*6)+L184 -> 58 | O184: 9 | P184: 13 | Q184: =(O184*6)+P184 -> 67 | S184: Venue: BEACH ROAD
A185: BENDIGO | C185: 1 | D185: 0 | E185: =(C185*6)+D185 -> 6 | G185: 2 | H185: 3 | I185: =(G185*6)+H185 -> 15 | K185: 3 | L185: 6 | M185: =(K185*6)+L185 -> 24 | O185: 9 | P185: 12 | Q185: =(O185*6)+P185 -> 66
A186: BEST PLAYERS
A187: SANDRINGHAM | C187: TREGEAR | F187: NUGENT | I187: SCOTT-BRANIGAN | M187: McKELLAR | P187: RIENIETS
A188: BENDIGO | C188: LANGAN | F188: PASCOE | I188: SMITH | L188: CURSIO | O188: GORMAN | R188: SCHMIDT
A189: GOALKICKERS
A190: SANDRINGHAM | C190: TEMPLETON 2 | F190: AMIET 2 | I190: OAKLEY | K190: BAXTER | M190: NUGENT | O190: SCOTT-BRANAGAN | S190: SAUTNER
A191: BENDIGO | C191: HEWITT 2 | F191: LANGAN 2 | I191: SCHMIDT 2 | L191: TOINTON 2 | O191: SLATER
A193: COBURG | C193: 3 | D193: 1 | E193: =(C193*6)+D193 -> 19 | G193: 3 | H193: 3 | I193: =(G193*6)+H193 -> 21 | K193: 6 | L193: 8 | M193: =(K193*6)+L193 -> 44 | O193: 10 | P193: 9 | Q193: =(O193*6)+P193 -> 69 | S193: Venue: COBURG
A194: PORT MELBOURNE | C194: 1 | D194: 0 | E194: =(C194*6)+D194 -> 6 | G194: 8 | H194: 1 | I194: =(G194*6)+H194 -> 49 | K194: 9 | L194: 5 | M194: =(K194*6)+L194 -> 59 | O194: 10 | P194: 7 | Q194: =(O194*6)+P194 -> 67
A195: BEST PLAYERS
A196: COBURG | C196: EZARD | F196: McHARDY | I196: ALESSIO | L196: PEVERILL | O196: McLEOD
A197: PORT MELBOURNE | C197: HOLLOW | F197: PICIAONE | I197: MORTON | L197: SHARP | O197: GOODALE | R197: D'GIACOMA
A198: GOALKICKERS
A199: COBURG | C199: ALESSIO 3 | F199: CONDON | H199: DUNCAN | J199: WEATON | L199: SALVADORE | O199: McLEOD | Q199: McCABE | T199: PEEL
A200: PORT MELBOURNE | C200: BUTTERWORTH 2 | F200: D'GIACOMA 2 | I200: McNAMARA 2 | L200: GOODALE | N200: HOLLOW | P200: WEEDING | S200: VILLAROSA
A202: BYE | D202: PRESTON
A204: ROUND 5 | D204: 2ND MAY | J204: WEATHER
D205: 1ST QTR | H205: 2ND QTR | L205: 3RD QTR | P205: FINAL | S205: Venue: BOX HILL
A206: COBURG | C206: 6 | D206: 5 | E206: =(C206*6)+D206 -> 41 | G206: 6 | H206: 7 | I206: =(G206*6)+H206 -> 43 | K206: 10 | L206: 11 | M206: =(K206*6)+L206 -> 71 | O206: 13 | P206: 16 | Q206: =(O206*6)+P206 -> 94 | S206: UMPIRES | Z206: LADDER | AC206: ROUND | AE206: 5
A207: BOX HILL | C207: 2 | D207: 2 | E207: =(C207*6)+D207 -> 14 | G207: 7 | H207: 4 | I207: =(G207*6)+H207 -> 46 | K207: 9 | L207: 8 | M207: =(K207*6)+L207 -> 62 | O207: 11 | P207: 11 | Q207: =(O207*6)+P207 -> 77
A208: BEST PLAYERS | W208: TEAM | X208: B | Y208: W | Z208: L | AA208: D | AB208: FOR | AC208: AGST | AD208: % | AE208: PTS
A209: COBURG | C209: EZARD | F209: McLEOD | I209: PEVERILL | L209: WESTON | N209: KELLY | Q209: DUNCAN
A210: BOX HILL | C210: WILKINSON | F210: BELLO | I210: NICHOL | W210: FRANKSTON | X210: 1 | Y210: 4 | Z210: 0 | AA210: 0 | AB210: 380 | AC210: 266 | AD210: =(AB210/AC210)*100 -> 142.85714285714286 | AE210: =(Y210*4)+(AA210*2) -> 16
A211: GOALKICKERS | O211: SOURASIS | Q211: HILL | W211: WERRIBEE | Y211: 4 | Z211: 1 | AA211: 0 | AB211: 508 | AC211: 402 | AD211: =(AB211/AC211)*100 -> 126.3681592039801 | AE211: =(Y211*4)+(AA211*2) -> 16
A212: COBURG | C212: GILPIN 4 | E212: SUTHERLAND 2 | I212: NUNZIATO | L212: TORTORA | N212: WESTON | P212: DAVIDSON | S212: EZARD | W212: NORTH BALLARAT | Y212: 4 | Z212: 1 | AA212: 0 | AB212: 412 | AC212: 361 | AD212: =(AB212/AC212)*100 -> 114.12742382271468 | AE212: =(Y212*4)+(AA212*2) -> 16
A213: BOX HILL | C213: COOK 2 | E213: NICHOL 2 | G213: AIELLO | I213: BELLO | K213: GEORGIADIS | N213: HABERFIELD | Q213: HARTIN | S213: MURLEY | W213: SPRINGVALE | X213: 1 | Y213: 2 | Z213: 2 | AA213: 0 | AB213: 419 | AC213: 278 | AD213: =(AB213/AC213)*100 -> 150.71942446043164 | AE213: =(Y213*4)+(AA213*2) -> 8
D214: 3RD MAY | J214: WEATHER | P214: TRANQUILLI | W214: WILLIAMSTOWN | Y214: 2 | Z214: 3 | AA214: 0 | AB214: 416 | AC214: 416 | AD214: =(AB214/AC214)*100 -> 100 | AE214: =(Y214*4)+(AA214*2) -> 8
A215: NORTH BALLARAT | C215: 4 | D215: 6 | E215: =(C215*6)+D215 -> 30 | G215: 7 | H215: 8 | I215: =(G215*6)+H215 -> 50 | K215: 12 | L215: 11 | M215: =(K215*6)+L215 -> 83 | O215: 14 | P215: 15 | Q215: =(O215*6)+P215 -> 99 | S215: Venue: PRESTON | W215: PRESTON | X215: 1 | Y215: 2 | Z215: 2 | AA215: 0 | AB215: 330 | AC215: 344 | AD215: =(AB215/AC215)*100 -> 95.930232558139537 | AE215: =(Y215*4)+(AA215*2) -> 8
A216: PRESTON | C216: 1 | D216: 5 | E216: =(C216*6)+D216 -> 11 | G216: 6 | H216: 9 | I216: =(G216*6)+H216 -> 45 | K216: 8 | L216: 9 | M216: =(K216*6)+L216 -> 57 | O216: 11 | P216: 12 | Q216: =(O216*6)+P216 -> 78
A217: BEST PLAYERS | W217: COBURG | Y217: 2 | Z217: 3 | AA217: 0 | AB217: 372 | AC217: 490 | AD217: =(AB217/AC217)*100 -> 75.91836734693878 | AE217: =(Y217*4)+(AA217*2) -> 8
A218: NORTH BALLARAT | C218: PICKFORD | E218: FIELD | G218: FLETCHER | J218: CUTHBERTSON | M218: G POLKINGHORNE | Q218: J POLKINGHORNE | W218: SANDRINGHAM | X218: 1 | Y218: 2 | Z218: 2 | AA218: 0 | AB218: 252 | AC218: 344 | AD218: =(AB218/AC218)*100 -> 73.255813953488371 | AE218: =(Y218*4)+(AA218*2) -> 8
A219: PRESTON | C219: AIELLO | F219: BOOKER | H219: PASCOE | K219: S GRAINGER | N219: HABERMAN | W219: PORT MELBOURNE | Y219: 1 | Z219: 4 | AA219: 0 | AB219: 406 | AC219: 423 | AD219: =(AB219/AC219)*100 -> 95.981087470449182 | AE219: =(Y219*4)+(AA219*2) -> 4
A220: GOALKICKERS | W220: BOX HILL | X220: 1 | Y220: 1 | Z220: 3 | AA220: 0 | AB220: 258 | AC220: 313 | AD220: =(AB220/AC220)*100 -> 82.428115015974441 | AE220: =(Y220*4)+(AA220*2) -> 4
A221: NORTH BALLARAT | C221: CUTHBERTSON 7 | G221: MACKAY 2 | J221: YORK | L221: PICKFORD | N221: S MAHER | P221: FIELD | R221: PARTINGTON | W221: BENDIGO | Y221: 1 | Z221: 4 | AA221: 0 | AB221: 376 | AC221: 492 | AD221: =(AB221/AC221)*100 -> 76.422764227642276 | AE221: =(Y221*4)+(AA221*2) -> 4
A222: PRESTON | C222: D GRAINGER 2 | F222: HAYWOOD 2 | I222: BOOKER 2 | K222: GRAY | M222: KNIGHTS | O222: ECCLES | Q222: CLARK | S222: HABERMAN
A224: SANDRINGHAM | C224: 1 | D224: 2 | E224: =(C224*6)+D224 -> 8 | G224: 2 | H224: 9 | I224: =(G224*6)+H224 -> 21 | K224: 7 | L224: 14 | M224: =(K224*6)+L224 -> 56 | O224: 8 | P224: 14 | Q224: =(O224*6)+P224 -> 62 | S224: Venue: WILLIAMSTOWN
A225: WILLIAMSTOWN | C225: 0 | D225: 2 | E225: =(C225*6)+D225 -> 2 | G225: 1 | H225: 5 | I225: =(G225*6)+H225 -> 11 | K225: 2 | L225: 10 | M225: =(K225*6)+L225 -> 22 | O225: 5 | P225: 12 | Q225: =(O225*6)+P225 -> 42
A226: BEST PLAYERS
A227: SANDRINGHAM | C227: RIENIETS | F227: CROUGH | I227: CLARKE | K227: GRANT | M227: TEMPLETON | P227: OAKLEY
A228: WILLIAMSTOWN | C228: KERRY | F228: GOULD | I228: HORE | K228: GHAZI | M228: DELRE | P228: WEST
A229: GOALKICKERS
A230: SANDRINGHAM | C230: TEMPLETON 4 | F230: BAXTER | H230: MITCHELSON | K230: OAKLEY | M230: SAUTNER
A231: WILLIAMSTOWN | C231: DELRE 3 | F231: ZAVALAS | I231: HORE
A233: FRANKSTON | C233: 3 | D233: 2 | E233: =(C233*6)+D233 -> 20 | G233: 9 | H233: 7 | I233: =(G233*6)+H233 -> 61 | K233: 14 | L233: 11 | M233: =(K233*6)+L233 -> 95 | O233: 18 | P233: 16 | Q233: =(O233*6)+P233 -> 124 | S233: Venue: BENDIGO
A234: BENDIGO | C234: 3 | D234: 2 | E234: =(C234*6)+D234 -> 20 | G234: 5 | H234: 3 | I234: =(G234*6)+H234 -> 33 | K234: 7 | L234: 4 | M234: =(K234*6)+L234 -> 46 | O234: 9 | P234: 7 | Q234: =(O234*6)+P234 -> 61
A235: BEST PLAYERS
A236: FRANKSTON | C236: BURNELL | F236: D CLARKE | I236: LAWRENCE | L236: MOLLOY | N236: MURRAY | Q236: WELSH
A237: BENDIGO | C237: SMITH | F237: ST CLAIR | I237: BUTLER | L237: R LANGAN | N237: DURIE
A238: GOALKICKERS
A239: FRANKSTON | C239: WELSH 6 | E239: MOLLOY 2 | G239: WEBB 2 | I239: CUMMINGS 2 | L239: CHARLES | N239: ANDERSON | P239: BOWEY | R239: LAWRENCE | V239: HOLCOMBE | X239: MOORE
A240: BENDIGO | C240: R LANGAN 3 | F240: MARSHALL | I240: BUTLER | K240: SCHMIDT | M240: SMITH | O240: PASCOE | Q240: TOINTON
A242: WERRIBEE | C242: 2 | D242: 2 | E242: =(C242*6)+D242 -> 14 | G242: 4 | H242: 5 | I242: =(G242*6)+H242 -> 29 | K242: 10 | L242: 7 | M242: =(K242*6)+L242 -> 67 | O242: 15 | P242: 12 | Q242: =(O242*6)+P242 -> 102 | S242: Venue: PORT MELBOURNE
A243: PORT MELBOURNE | C243: 1 | D243: 5 | E243: =(C243*6)+D243 -> 11 | G243: 4 | H243: 10 | I243: =(G243*6)+H243 -> 34 | K243: 8 | L243: 12 | M243: =(K243*6)+L243 -> 60 | O243: 10 | P243: 14 | Q243: =(O243*6)+P243 -> 74
A244: BEST PLAYERS
A245: WERRIBEE | C245: SUTTON | F245: WHITNALL | I245: FROST | K245: PULI | N245: REARDON | Q245: SMITH
A246: PORT MELBOURNE | C246: SEXTON | F246: BALLANTYNE | I246: NAPOLI | K246: HENDERSON | N246: SHARP | Q246: HOLLOW
A247: GOALKICKERS
A248: WERRIBEE | C248: AZIZ 3 | E248: REARDON 3 | H248: GOWANS 2 | J248: SHAW | L248: CHURCHILL | N248: DYER | P248: HYDE | R248: SUTTON | U248: FAULKNER | X248: SMITH
A249: PORT MELBOURNE | C249: SEXTON 3 | E249: McGEE 2 | G249: BAUMGARTNER | K249: BUTTERWORTH | O249: McCARTHY | R249: VILLAROSA | V249: WEEDING
A251: BYE | D251: SPRINGVALE
A253: ROUND 6 | D253: 9TH MAY | J253: WEATHER
D254: 1ST QTR | H254: 2ND QTR | L254: 3RD QTR | P254: FINAL | S254: Venue: COBURG
A255: PRESTON | C255: 0 | D255: 2 | E255: =(C255*6)+D255 -> 2 | G255: 7 | H255: 9 | I255: =(G255*6)+H255 -> 51 | K255: 10 | L255: 11 | M255: =(K255*6)+L255 -> 71 | O255: 11 | P255: 15 | Q255: =(O255*6)+P255 -> 81 | S255: UMPIRES | Z255: LADDER | AC255: ROUND | AE255: 6
A256: COBURG | C256: 3 | D256: 8 | E256: =(C256*6)+D256 -> 26 | G256: 4 | H256: 11 | I256: =(G256*6)+H256 -> 35 | K256: 6 | L256: 17 | M256: =(K256*6)+L256 -> 53 | O256: 8 | P256: 20 | Q256: =(O256*6)+P256 -> 68
A257: BEST PLAYERS | W257: TEAM | X257: B | Y257: W | Z257: L | AA257: D | AB257: FOR | AC257: AGST | AD257: % | AE257: PTS
A258: PRESTON | C258: MAIORANA | F258: AIELLO | I258: MANN | L258: PASCOE | O258: KOFOED | Q258: GRAY
A259: COBURG | C259: McHARDY | F259: KELLY | I259: EZARD | L259: McLEOD | O259: ALESSIO | W259: FRANKSTON | X259: 1 | Y259: 5 | Z259: 0 | AA259: 0 | AB259: 494 | AC259: 332 | AD259: =(AB259/AC259)*100 -> 148.79518072289159 | AE259: =(Y259*4)+(AA259*2) -> 20
A260: GOALKICKERS | W260: WERRIBEE | Y260: 5 | Z260: 1 | AA260: 0 | AB260: 643 | AC260: 516 | AD260: =(AB260/AC260)*100 -> 124.6124031007752 | AE260: =(Y260*4)+(AA260*2) -> 20
A261: PRESTON | C261: D GRAINGER 3 | F261: BAYRE 3 | I261: HABERMAN 2 | L261: KNIGHTS | N261: PASCOE | P261: McGREGOR | W261: NORTH BALLARAT | X261: 1 | Y261: 4 | Z261: 1 | AA261: 0 | AB261: 412 | AC261: 361 | AD261: =(AB261/AC261)*100 -> 114.12742382271468 | AE261: =(Y261*4)+(AA261*2) -> 16
A262: COBURG | C262: WESTON | E262: GILPIN | G262: AGRESTA | I262: DAVIDSON | L262: PEVERILL | N262: ALESSIO | P262: EZARD | R262: SUTHERLAND | W262: SPRINGVALE | X262: 1 | Y262: 3 | Z262: 2 | AA262: 0 | AB262: 544 | AC262: 313 | AD262: =(AB262/AC262)*100 -> 173.80191693290735 | AE262: =(Y262*4)+(AA262*2) -> 12
D263: 10TH MAY | J263: WEATHER | W263: PRESTON | X263: 1 | Y263: 3 | Z263: 2 | AA263: 0 | AB263: 411 | AC263: 412 | AD263: =(AB263/AC263)*100 -> 99.757281553398059 | AE263: =(Y263*4)+(AA263*2) -> 12
A264: FRANKSTON | C264: 1 | D264: 3 | E264: =(C264*6)+D264 -> 9 | G264: 3 | H264: 11 | I264: =(G264*6)+H264 -> 29 | K264: 9 | L264: 14 | M264: =(K264*6)+L264 -> 68 | O264: 16 | P264: 18 | Q264: =(O264*6)+P264 -> 114 | S264: Venue: FRANKSTON | W264: PORT MELBOURNE | Y264: 2 | Z264: 4 | AA264: 0 | AB264: 480 | AC264: 490 | AD264: =(AB264/AC264)*100 -> 97.959183673469383 | AE264: =(Y264*4)+(AA264*2) -> 8
A265: WILLIAMSTOWN | C265: 4 | D265: 2 | E265: =(C265*6)+D265 -> 26 | G265: 6 | H265: 2 | I265: =(G265*6)+H265 -> 38 | K265: 9 | L265: 4 | M265: =(K265*6)+L265 -> 58 | O265: 10 | P265: 6 | Q265: =(O265*6)+P265 -> 66
A266: BEST PLAYERS | W266: WILLIAMSTOWN | Y266: 2 | Z266: 4 | AA266: 0 | AB266: 482 | AC266: 530 | AD266: =(AB266/AC266)*100 -> 90.943396226415103 | AE266: =(Y266*4)+(AA266*2) -> 8
A267: FRANKSTON | C267: BURNELL | F267: LAWRENCE | I267: MURRAY | L267: MOORE | O267: KING | Q267: CUMMINGS | W267: COBURG | Y267: 2 | Z267: 4 | AA267: 0 | AB267: 440 | AC267: 571 | AD267: =(AB267/AC267)*100 -> 77.057793345008747 | AE267: =(Y267*4)+(AA267*2) -> 8
A268: WILLIAMSTOWN | C268: McMAHON | F268: HORE | I268: FRASER | L268: HOWLETT | O268: FISHLEY | Q268: HOLLOW | W268: SANDRINGHAM | X268: 1 | Y268: 2 | Z268: 3 | AA268: 0 | AB268: 319 | AC268: 418 | AD268: =(AB268/AC268)*100 -> 76.31578947368422 | AE268: =(Y268*4)+(AA268*2) -> 8
A269: GOALKICKERS | O269: MALLOY | Q269: CUMMINGS | W269: BOX HILL | X269: 1 | Y269: 1 | Z269: 4 | AA269: 0 | AB269: 372 | AC269: 448 | AD269: =(AB269/AC269)*100 -> 83.035714285714292 | AE269: =(Y269*4)+(AA269*2) -> 4
A270: FRANKSTON | C270: WELSH 3 | E270: SULLIVAN 3 | H270: DOYLE 3 | J270: KING | L270: ANDERSON | N270: HOPGOOD | P270: DAM CLARKE | S270: LAWRENCE | W270: BENDIGO | Y270: 1 | Z270: 5 | AA270: 0 | AB270: 411 | AC270: 617 | AD270: =(AB270/AC270)*100 -> 66.612641815235008 | AE270: =(Y270*4)+(AA270*2) -> 4
A271: WILLIAMSTOWN | C271: HOWLETT 5 | F271: DELRE 3 | I271: FISHLEY | K271: HOLLOW
A273: PORT MELBOURNE | C273: 3 | D273: 8 | E273: =(C273*6)+D273 -> 26 | G273: 6 | H273: 10 | I273: =(G273*6)+H273 -> 46 | K273: 9 | L273: 12 | M273: =(K273*6)+L273 -> 66 | O273: 10 | P273: 14 | Q273: =(O273*6)+P273 -> 74 | S273: Venue: BEACH ROAD
A274: SANDRINGHAM | C274: 2 | D274: 0 | E274: =(C274*6)+D274 -> 12 | G274: 2 | H274: 5 | I274: =(G274*6)+H274 -> 17 | K274: 5 | L274: 6 | M274: =(K274*6)+L274 -> 36 | O274: 9 | P274: 13 | Q274: =(O274*6)+P274 -> 67
A275: BEST PLAYERS
A276: PORT MELBOURNE | C276: GOODALE | F276: BALLANTYNE | I276: McNAMARA | L276: SCHAEFER | O276: CHEEL | Q276: HENDERSON
A277: SANDRINGHAM | C277: CLARKE | F277: S RADFORD | I277: TREGEAR
A278: GOALKICKERS
A279: PORT MELBOURNE | C279: BALLANTYNE 4 | F279: DWYER | H279: HENDERSON | K279: HOLLOW | M279: PICIAONE | O279: SCHAEFER | R279: SHEEDY
A280: SANDRINGHAM | C280: SAUTNER 3 | F280: AMIET | H280: CROUGH | J280: ARGUS | L280: M GRANT | N280: HAYNES | P280: SCOTT-BRANAGAN
A282: SPRINGVALE | C282: 5 | D282: 1 | E282: =(C282*6)+D282 -> 31 | G282: 9 | H282: 3 | I282: =(G282*6)+H282 -> 57 | K282: 14 | L282: 8 | M282: =(K282*6)+L282 -> 92 | O282: 19 | P282: 11 | Q282: =(O282*6)+P282 -> 125 | S282: Venue: SPRINGVALE
A283: BENDIGO | C283: 0 | D283: 0 | E283: =(C283*6)+D283 -> 0 | G283: 3 | H283: 3 | I283: =(G283*6)+H283 -> 21 | K283: 4 | L283: 3 | M283: =(K283*6)+L283 -> 27 | O283: 5 | P283: 5 | Q283: =(O283*6)+P283 -> 35
A284: BEST PLAYERS
A285: SPRINGVALE | C285: SMITH | F285: FORD | I285: TAYLOR | L285: SHAW | N285: LITTLE
A286: BENDIGO | C286: DURIE | F286: LANCASTER | I286: SLATER | L286: LANGAN | N286: TOINTON
A287: GOALKICKERS
A288: SPRINGVALE | C288: SMITH 10 | E288: CLARK | G288: FORD | I288: JOY | J288: JEWELL | L288: KNIGHT | N288: NAGLE | P288: O'DONNELL | R288: SHAW | U288: TROLLOPE
A289: BENDIGO | C289: SMITH 2 | F289: O'CALLAGHAN | I289: SCHMIDT | K289: R LANGAN
A291: WERRIBEE | C291: 4 | D291: 3 | E291: =(C291*6)+D291 -> 27 | G291: 12 | H291: 6 | I291: =(G291*6)+H291 -> 78 | K291: 16 | L291: 11 | M291: =(K291*6)+L291 -> 107 | O291: 20 | P291: 15 | Q291: =(O291*6)+P291 -> 135 | S291: Venue: WERRIBEE
A292: BOX HILL | C292: 8 | D292: 4 | E292: =(C292*6)+D292 -> 52 | G292: 11 | H292: 8 | I292: =(G292*6)+H292 -> 74 | K292: 15 | L292: 11 | M292: =(K292*6)+L292 -> 101 | O292: 17 | P292: 12 | Q292: =(O292*6)+P292 -> 114
A293: BEST PLAYERS
A294: WERRIBEE | C294: PULI | F294: TAYLOR | I294: FAULKNER | L294: KELLETT | O294: SHAW | Q294: ATKINS
A295: BOX HILL | C295: SLATER | F295: HEANEY | I295: TRANQUILLI | L295: WILKINSON | O295: BELLO | Q295: PORTER
A296: GOALKICKERS
A297: WERRIBEE | C297: SHAW 4 | E297: FROST 4 | G297: FAULKNER 3 | J297: PULI 3 | L297: C GOWANS 2 | O297: SUTTON | Q297: ATKINS | S297: REARDON | W297: KELLETT
A298: BOX HILL | C298: SLATER 5 | E298: COOK 4 | G298: PORTER 2 | J298: CROWLEY | L298: NICHOL | N298: TRANQUILLI | Q298: ACKLANDS | T298: O'NEILL | W298: GEORGIADIS
A300: BYE | D300: NORTH BALLARAT
A302: ROUND 7 | D302: 16TH MAY | J302: WEATHER
D303: 1ST QTR | H303: 2ND QTR | L303: 3RD QTR | P303: FINAL | S303: Venue: PRESTON
A304: WERRIBEE | C304: 6 | D304: 3 | E304: =(C304*6)+D304 -> 39 | G304: 9 | H304: 9 | I304: =(G304*6)+H304 -> 63 | K304: 12 | L304: 11 | M304: =(K304*6)+L304 -> 83 | O304: 16 | P304: 13 | Q304: =(O304*6)+P304 -> 109 | S304: UMPIRES | Z304: LADDER | AC304: ROUND | AE304: 7
A305: PRESTON | C305: 3 | D305: 0 | E305: =(C305*6)+D305 -> 18 | G305: 6 | H305: 1 | I305: =(G305*6)+H305 -> 37 | K305: 10 | L305: 5 | M305: =(K305*6)+L305 -> 65 | O305: 12 | P305: 6 | Q305: =(O305*6)+P305 -> 78
A306: BEST PLAYERS | W306: TEAM | X306: B | Y306: W | Z306: L | AA306: D | AB306: FOR | AC306: AGST | AD306: % | AE306: PTS
A307: WERRIBEE | C307: TAYLOR | F307: P GOWANS | I307: FAULKNER | L307: FROST | O307: SPROULE | Q307: C GOWANS
A308: PRESTON | C308: PASCOE | F308: KOFOED | I308: GRAINGER | L308: MAIORANA | O308: GRAY | Q308: BOOKER | W308: FRANKSTON | X308: 1 | Y308: 6 | Z308: 0 | AA308: 0 | AB308: 618 | AC308: 399 | AD308: =(AB308/AC308)*100 -> 154.88721804511277 | AE308: =(Y308*4)+(AA308*2) -> 24
A309: GOALKICKERS | M309: WHITNALL | P309: SUTTON | W309: WERRIBEE | Y309: 6 | Z309: 1 | AA309: 0 | AB309: 752 | AC309: 594 | AD309: =(AB309/AC309)*100 -> 126.5993265993266 | AE309: =(Y309*4)+(AA309*2) -> 24
A310: WERRIBEE | C310: AZIZ 4 | E310: SHAW 3 | G310: DYER 2 | I310: FAULKNER 2 | L310: KELLETT | N310: SKROBALAK | Q310: GRAY | W310: NORTH BALLARAT | X310: 1 | Y310: 5 | Z310: 1 | AA310: 0 | AB310: 547 | AC310: 407 | AD310: =(AB310/AC310)*100 -> 134.39803439803438 | AE310: =(Y310*4)+(AA310*2) -> 20
A311: PRESTON | C311: GRAINGER 4 | E311: McGREGOR 2 | H311: MAIORANA | K311: POWER | M311: HABERMAN | P311: KNIGHTS | R311: GRAY | W311: SPRINGVALE | X311: 1 | Y311: 4 | Z311: 2 | AA311: 0 | AB311: 637 | AC311: 388 | AD311: =(AB311/AC311)*100 -> 164.17525773195877 | AE311: =(Y311*4)+(AA311*2) -> 16
O312: BOOKER | W312: SANDRINGHAM | X312: 1 | Y312: 3 | Z312: 3 | AA312: 0 | AB312: 442 | AC312: 466 | AD312: =(AB312/AC312)*100 -> 94.849785407725321 | AE312: =(Y312*4)+(AA312*2) -> 12
A313: SANDRINGHAM | C313: 5 | D313: 4 | E313: =(C313*6)+D313 -> 34 | G313: 8 | H313: 6 | I313: =(G313*6)+H313 -> 54 | K313: 12 | L313: 10 | M313: =(K313*6)+L313 -> 82 | O313: 18 | P313: 15 | Q313: =(O313*6)+P313 -> 123 | S313: Venue: BOX HILL | W313: PRESTON | X313: 1 | Y313: 3 | Z313: 3 | AA313: 0 | AB313: 489 | AC313: 521 | AD313: =(AB313/AC313)*100 -> 93.857965451055662 | AE313: =(Y313*4)+(AA313*2) -> 12
A314: BOX HILL | C314: 0 | D314: 0 | E314: =(C314*6)+D314 -> 0 | G314: 3 | H314: 2 | I314: =(G314*6)+H314 -> 20 | K314: 5 | L314: 4 | M314: =(K314*6)+L314 -> 34 | O314: 7 | P314: 6 | Q314: =(O314*6)+P314 -> 48
A315: BEST PLAYERS | W315: WILLIAMSTOWN | Y315: 2 | Z315: 5 | AA315: 0 | AB315: 557 | AC315: 623 | AD315: =(AB315/AC315)*100 -> 89.406099518459072 | AE315: =(Y315*4)+(AA315*2) -> 8
A316: SANDRINGHAM | C316: MACGEORGE | F316: MITCHELSON | I316: SCOTT-BRANAGAN | M316: CLARKE | O316: TEMPLETON | R316: TREGEAR | W316: PORT MELBOURNE | Y316: 2 | Z316: 5 | AA316: 0 | AB316: 547 | AC316: 614 | AD316: =(AB316/AC316)*100 -> 89.087947882736145 | AE316: =(Y316*4)+(AA316*2) -> 8
A317: BOX HILL | C317: GRIFFEN | F317: HABERFIELD | I317: ACKLAND | M317: WILKINSON | W317: COBURG | Y317: 2 | Z317: 5 | AA317: 0 | AB317: 486 | AC317: 706 | AD317: =(AB317/AC317)*100 -> 68.838526912181308 | AE317: =(Y317*4)+(AA317*2) -> 8
A318: GOALKICKERS | H318: ARGUS | J318: CLARKE | L318: MITCHELSON | O318: BINGHAM | Q318: CAPSALIS | W318: BOX HILL | X318: 1 | Y318: 1 | Z318: 5 | AA318: 0 | AB318: 420 | AC318: 571 | AD318: =(AB318/AC318)*100 -> 73.555166374781095 | AE318: =(Y318*4)+(AA318*2) -> 4
A319: SANDRINGHAM | C319: HAYNES 3 | E319: TEMPLETON 3 | H319: RADFORD 2 | K319: SCOTT-BRANAGAN 2 | O319: SAUTNER 2 | R319: FRATER | W319: BENDIGO | X319: 1 | Y319: 1 | Z319: 5 | AA319: 0 | AB319: 411 | AC319: 617 | AD319: =(AB319/AC319)*100 -> 66.612641815235008 | AE319: =(Y319*4)+(AA319*2) -> 4
A320: BOX HILL | C320: ACKLAND 2 | F320: COOK 2 | I320: BELLO | K320: O'NEILL | M320: PORTER
A322: NORTH BALLARAT | C322: 5 | D322: 2 | E322: =(C322*6)+D322 -> 32 | G322: 8 | H322: 3 | I322: =(G322*6)+H322 -> 51 | K322: 14 | L322: 6 | M322: =(K322*6)+L322 -> 90 | O322: 21 | P322: 9 | Q322: =(O322*6)+P322 -> 135 | S322: Venue: NORTH BALLARAT
A323: COBURG | C323: 1 | D323: 2 | E323: =(C323*6)+D323 -> 8 | G323: 4 | H323: 4 | I323: =(G323*6)+H323 -> 28 | K323: 5 | L323: 4 | M323: =(K323*6)+L323 -> 34 | O323: 7 | P323: 4 | Q323: =(O323*6)+P323 -> 46
A324: BEST PLAYERS
A325: NORTH BALLARAT | C325: CLARKE | F325: PICKFORD | I325: CUTHBERTSON | L325: LUBEEK | O325: EDMONDS | Q325: J POLKINGHORNE
A326: COBURG | C326: McCABE | F326: DAVIDSON | I326: EZARD | L326: CAPELLO | O326: AGRESTA
A327: GOALKICKERS
A328: NORTH BALLARAT | C328: CUTHBERTSON 8 | F328: EDMONDS 4 | I328: S MAHER 2 | L328: PEAKE 2 | N328: DOYLE | P328: PARTINGTON | S328: MARTIN | V328: DOHERTY | X328: INIA
A329: COBURG | C329: NUNZIATO 3 | F329: PEVERILL | I329: ALESSIO | K329: McHARDY | M329: CAPELLO
D330: 17TH MAY | J330: WEATHER
A331: FRANKSTON | C331: 3 | D331: 5 | E331: =(C331*6)+D331 -> 23 | G331: 6 | H331: 8 | I331: =(G331*6)+H331 -> 44 | K331: 12 | L331: 13 | M331: =(K331*6)+L331 -> 85 | O331: 18 | P331: 16 | Q331: =(O331*6)+P331 -> 124 | S331: Venue: PORT MELBOURNE
A332: PORT MELBOURNE | C332: 2 | D332: 5 | E332: =(C332*6)+D332 -> 17 | G332: 5 | H332: 6 | I332: =(G332*6)+H332 -> 36 | K332: 7 | L332: 8 | M332: =(K332*6)+L332 -> 50 | O332: 9 | P332: 13 | Q332: =(O332*6)+P332 -> 67
A333: BEST PLAYERS
A334: FRANKSTON | C334: BURNELL | F334: D CLARKE | I334: CHARLES | L334: MOORE | O334: STUBBS | Q334: BOWEY
A335: PORT MELBOURNE | C335: SEXTON | F335: HOLLOW | I335: MORTON | L335: CLOHESY | O335: GOODALE | Q335: M CHEEL
A336: GOALKICKERS
A337: FRANKSTON | C337: WELSH 5 | F337: HOLCOMBE 3 | I337: STUBBS 3 | L337: SULLIVAN 2 | O337: BOWEY 2 | Q337: WEBB | S337: S RYAN | V337: ANDERSON
A338: PORT MELBOURNE | C338: BALLANTYNE 3 | F338: SEXTON 2 | I338: CLOHESY | K338: DWYER | M338: NAPOLI | O338: VILLAROSA
A340: SPRINGVALE | C340: 2 | D340: 4 | E340: =(C340*6)+D340 -> 16 | G340: 4 | H340: 5 | I340: =(G340*6)+H340 -> 29 | K340: 7 | L340: 10 | M340: =(K340*6)+L340 -> 52 | O340: 13 | P340: 15 | Q340: =(O340*6)+P340 -> 93 | S340: Venue: WILLIAMSTOWN
A341: WILLIAMSTOWN | C341: 1 | D341: 1 | E341: =(C341*6)+D341 -> 7 | G341: 5 | H341: 4 | I341: =(G341*6)+H341 -> 34 | K341: 9 | L341: 8 | M341: =(K341*6)+L341 -> 62 | O341: 11 | P341: 9 | Q341: =(O341*6)+P341 -> 75
A342: BEST PLAYERS
A343: SPRINGVALE | C343: SHAW | F343: TAYLOR | I343: KNIGHT | L343: CLARK | O343: SUTHERLAND
A344: WILLIAMSTOWN | C344: KERRY | F344: WEST | I344: DELRE | L344: PATERSON | O344: LATTENSTEIN | R344: GHAZI
A345: GOALKICKERS
A346: SPRINGVALE | C346: CLARK 4 | F346: SHAW 3 | I346: SMITH 2 | L346: EVANS | N346: KNIGHT | P346: SCHULTZ | R346: PASTORE
A347: WILLIAMSTOWN | C347: DELRE 5 | F347: HOWLETT 2 | I347: WALLACE | L347: RAILTON | N347: PATERSON | P347: GHAZI
A349: BYE | D349: BENDIGO
A351: ROUND 8 | D351: 23RD MAY | J351: WEATHER
D352: 1ST QTR | H352: 2ND QTR | L352: 3RD QTR | P352: FINAL | S352: Venue: SPRINGVALE
A353: SPRINGVALE | C353: 5 | D353: 5 | E353: =(C353*6)+D353 -> 35 | G353: 6 | H353: 7 | I353: =(G353*6)+H353 -> 43 | K353: 12 | L353: 11 | M353: =(K353*6)+L353 -> 83 | O353: 13 | P353: 12 | Q353: =(O353*6)+P353 -> 90 | S353: UMPIRES | Z353: LADDER | AC353: ROUND | AE353: 8
A354: PORT MELBOURNE | C354: 0 | D354: 1 | E354: =(C354*6)+D354 -> 1 | G354: 4 | H354: 3 | I354: =(G354*6)+H354 -> 27 | K354: 5 | L354: 3 | M354: =(K354*6)+L354 -> 33 | O354: 8 | P354: 11 | Q354: =(O354*6)+P354 -> 59
A355: BEST PLAYERS | W355: TEAM | X355: B | Y355: W | Z355: L | AA355: D | AB355: FOR | AC355: AGST | AD355: % | AE355: PTS
A356: SPRINGVALE | C356: CAPLES | F356: CLARK | I356: PASTORE | L356: JOY | O356: SMITH | Q356: SHIPP
A357: PORT MELBOURNE | C357: RUECROFT | F357: GOODALE | I357: SEXTON | L357: McNAMARA | O357: HOLLOW | Q357: CLOHESY | W357: FRANKSTON | X357: 1 | Y357: 7 | Z357: 0 | AA357: 0 | AB357: 732 | AC357: 452 | AD357: =(AB357/AC357)*100 -> 161.94690265486727 | AE357: =(Y357*4)+(AA357*2) -> 28
A358: GOALKICKERS | W358: WERRIBEE | Y358: 7 | Z358: 1 | AA358: 0 | AB358: 907 | AC358: 624 | AD358: =(AB358/AC358)*100 -> 145.35256410256409 | AE358: =(Y358*4)+(AA358*2) -> 28
A359: SPRINGVALE | C359: PASTORE 4 | F359: JOY 2 | H359: ENTWHISTLE 2 | K359: TAYLOR | M359: SMITH | O359: SHIPP | Q359: CAPLES | S359: SHAW | W359: SPRINGVALE | X359: 1 | Y359: 5 | Z359: 2 | AA359: 0 | AB359: 727 | AC359: 447 | AD359: =(AB359/AC359)*100 -> 162.63982102908275 | AE359: =(Y359*4)+(AA359*2) -> 20
A360: PORT MELBOURNE | C360: SEXTON 3 | F360: BALLANTYNE 2 | J360: CAMERON | M360: HOLLOW | O360: VILAROSA | W360: NORTH BALLARAT | X360: 1 | Y360: 5 | Z360: 2 | AA360: 0 | AB360: 577 | AC360: 562 | AD360: =(AB360/AC360)*100 -> 102.66903914590748 | AE360: =(Y360*4)+(AA360*2) -> 20
D361: 24TH MAY | J361: WEATHER | W361: PRESTON | X361: 1 | Y361: 4 | Z361: 3 | AA361: 0 | AB361: 563 | AC361: 563 | AD361: =(AB361/AC361)*100 -> 100 | AE361: =(Y361*4)+(AA361*2) -> 16
A362: PRESTON | C362: 0 | D362: 2 | E362: =(C362*6)+D362 -> 2 | G362: 3 | H362: 5 | I362: =(G362*6)+H362 -> 23 | K362: 6 | L362: 7 | M362: =(K362*6)+L362 -> 43 | O362: 11 | P362: 8 | Q362: =(O362*6)+P362 -> 74 | S362: Venue: BEACH ROAD | W362: SANDRINGHAM | X362: 1 | Y362: 3 | Z362: 4 | AA362: 0 | AB362: 484 | AC362: 540 | AD362: =(AB362/AC362)*100 -> 89.629629629629619 | AE362: =(Y362*4)+(AA362*2) -> 12
A363: SANDRINGHAM | C363: 1 | D363: 3 | E363: =(C363*6)+D363 -> 9 | G363: 3 | H363: 7 | I363: =(G363*6)+H363 -> 25 | K363: 4 | L363: 9 | M363: =(K363*6)+L363 -> 33 | O363: 5 | P363: 12 | Q363: =(O363*6)+P363 -> 42
A364: BEST PLAYERS | W364: PORT MELBOURNE | Y364: 2 | Z364: 6 | AA364: 0 | AB364: 606 | AC364: 704 | AD364: =(AB364/AC364)*100 -> 86.079545454545453 | AE364: =(Y364*4)+(AA364*2) -> 8
A365: PRESTON | C365: McCREDDIN | F365: BLAGROVE | I365: GRAINGER | L365: HAYDOCK | N365: MARTELLO | Q365: McGREGOR | W365: WILLIAMSTOWN | Y365: 2 | Z365: 6 | AA365: 0 | AB365: 601 | AC365: 712 | AD365: =(AB365/AC365)*100 -> 84.410112359550567 | AE365: =(Y365*4)+(AA365*2) -> 8
A366: SANDRINGHAM | C366: RADFORD | F366: HAYNES | I366: FRATER | W366: BENDIGO | X366: 1 | Y366: 2 | Z366: 5 | AA366: 0 | AB366: 500 | AC366: 661 | AD366: =(AB366/AC366)*100 -> 75.642965204236006 | AE366: =(Y366*4)+(AA366*2) -> 8
A367: GOALKICKERS | W367: COBURG | X367: 1 | Y367: 2 | Z367: 5 | AA367: 0 | AB367: 486 | AC367: 706 | AD367: =(AB367/AC367)*100 -> 68.838526912181308 | AE367: =(Y367*4)+(AA367*2) -> 8
A368: PRESTON | C368: ECCLES 2 | F368: PLUNKETT 2 | I368: McCREDDIN | L368: BAYRE | N368: D GRAINGER | Q368: McGREGOR | W368: BOX HILL | X368: 1 | Y368: 1 | Z368: 6 | AA368: 0 | AB368: 473 | AC368: 685 | AD368: =(AB368/AC368)*100 -> 69.051094890510939 | AE368: =(Y368*4)+(AA368*2) -> 4
A369: SANDRINGHAM | C369: FRATER 2 | F369: RADFORD | I369: NUGENT | L369: BINGHAM
A371: WERRIBEE | C371: 4 | D371: 4 | E371: =(C371*6)+D371 -> 28 | G371: 14 | H371: 7 | I371: =(G371*6)+H371 -> 91 | K371: 20 | L371: 9 | M371: =(K371*6)+L371 -> 129 | O371: 24 | P371: 11 | Q371: =(O371*6)+P371 -> 155 | S371: Venue: WERRIBEE
A372: NORTH BALLARAT | C372: 1 | D372: 0 | E372: =(C372*6)+D372 -> 6 | G372: 1 | H372: 0 | I372: =(G372*6)+H372 -> 6 | K372: 3 | L372: 3 | M372: =(K372*6)+L372 -> 21 | O372: 4 | P372: 6 | Q372: =(O372*6)+P372 -> 30
A373: BEST PLAYERS
A374: WERRIBEE | C374: AZIZ | F374: FAULKNER | I374: WHITNALL | L374: GRAY | N374: PULI | Q374: FROST
A375: NORTH BALLARAT | C375: LUBEEK | F375: McCULLOCH
A376: GOALKICKERS
A377: WERRIBEE | C377: AZIZ 8 | E377: GRAY 4 | G377: FROST 3 | I377: J GOWANS 2 | L377: FAULKNER 2 | O377: ATKINS 2 | Q377: SKRBOLAK | T377: DYER | V377: SPROULE
A378: NORTH BALLARAT | C378: EDMOND 2 | F378: PICKFORD | I378: MACKAY
A380: BENDIGO | C380: 3 | D380: 6 | E380: =(C380*6)+D380 -> 24 | G380: 6 | H380: 8 | I380: =(G380*6)+H380 -> 44 | K380: 11 | L380: 10 | M380: =(K380*6)+L380 -> 76 | O380: 13 | P380: 11 | Q380: =(O380*6)+P380 -> 89 | S380: Venue: BENDIGO
A381: WILLIAMSTOWN | C381: 3 | D381: 0 | E381: =(C381*6)+D381 -> 18 | G381: 4 | H381: 2 | I381: =(G381*6)+H381 -> 26 | K381: 5 | L381: 3 | M381: =(K381*6)+L381 -> 33 | O381: 6 | P381: 8 | Q381: =(O381*6)+P381 -> 44
A382: BEST PLAYERS
A383: BENDIGO | C383: SLATER | F383: GORMAN | I383: CURSIO | L383: ORR | N383: SMITH | Q383: O'SHANNESSY
A384: WILLIAMSTOWN | C384: GHAZI | F384: HORE | I384: FRASER | L384: GOULD | N384: BROWN
A385: GOALKICKERS
A386: BENDIGO | C386: MARSHALL 3 | F386: SLATER 2 | H386: ST CLAIR 2 | J386: O'CALLAGHAN | M386: SCHMIDT | O386: GORMAN | Q386: WHITSED | T386: CURSIO | W386: R LANGAN
A387: WILLIAMSTOWN | C387: FORYS 2 | F387: GRIFFIN | H387: PATERSON | K387: HOWLETT | M387: GHAZI
A389: FRANKSTON | C389: 4 | D389: 5 | E389: =(C389*6)+D389 -> 29 | G389: 8 | H389: 12 | I389: =(G389*6)+H389 -> 60 | K389: 11 | L389: 17 | M389: =(K389*6)+L389 -> 83 | O389: 15 | P389: 24 | Q389: =(O389*6)+P389 -> 114 | S389: Venue: FRANKSTON
A390: BOX HILL | C390: 2 | D390: 4 | E390: =(C390*6)+D390 -> 16 | G390: 3 | H390: 4 | I390: =(G390*6)+H390 -> 22 | K390: 5 | L390: 4 | M390: =(K390*6)+L390 -> 34 | O390: 8 | P390: 5 | Q390: =(O390*6)+P390 -> 53
A391: BEST PLAYERS
A392: FRANKSTON | C392: BURNELL | F392: CHARLES | I392: LAWRENCE | L392: MOORE | N392: DAM CLARKE | Q392: SULLIVAN
A393: BOX HILL | C393: NICHOL | F393: WILKINSON | I393: BELLO | L393: PORTER
A394: GOALKICKERS
A395: FRANKSTON | C395: KING 3 | E395: SULLIVAN 3 | H395: MALLOY 2 | J395: S RYAN | L395: WELSH | N395: BURNELL | P395: STUBBS | R395: CUMMINGS | V395: HOLCOMBE | X395: BURGMAN
A396: BOX HILL | C396: WILKINSON 3 | F396: ROWE 2 | I396: NICHOL | K396: CROWLEY | M396: BELLO
A398: BYE | D398: COBURG
A400: ROUND 9 | D400: 30TH MAY | J400: WEATHER
D401: 1ST QTR | H401: 2ND QTR | L401: 3RD QTR | P401: FINAL | S401: Venue: NORTH BALLARAT
A402: NORTH BALLARAT | C402: 4 | D402: 1 | E402: =(C402*6)+D402 -> 25 | G402: 7 | H402: 3 | I402: =(G402*6)+H402 -> 45 | K402: 13 | L402: 6 | M402: =(K402*6)+L402 -> 84 | O402: 14 | P402: 6 | Q402: =(O402*6)+P402 -> 90 | S402: UMPIRES | Z402: LADDER | AC402: ROUND | AE402: 9
A403: SANDRINGHAM | C403: 5 | D403: 2 | E403: =(C403*6)+D403 -> 32 | G403: 7 | H403: 3 | I403: =(G403*6)+H403 -> 45 | K403: 8 | L403: 4 | M403: =(K403*6)+L403 -> 52 | O403: 10 | P403: 8 | Q403: =(O403*6)+P403 -> 68
A404: BEST PLAYERS | W404: TEAM | X404: B | Y404: W | Z404: L | AA404: D | AB404: FOR | AC404: AGST | AD404: % | AE404: PTS
A405: NORTH BALLARAT | C405: J POLKINGHORNE | G405: G POLKINGHORNE | K405: FLETCHER | N405: LUBEEK | P405: COX | R405: PICKFORD
A406: SANDRINGHAM | C406: CROUGH | W406: WERRIBEE | Y406: 8 | Z406: 1 | AA406: 0 | AB406: 1028 | AC406: 675 | AD406: =(AB406/AC406)*100 -> 152.2962962962963 | AE406: =(Y406*4)+(AA406*2) -> 32
A407: GOALKICKERS | O407: EDMONDS | R407: PICKFORD | W407: FRANKSTON | X407: 1 | Y407: 7 | Z407: 1 | AA407: 0 | AB407: 803 | AC407: 549 | AD407: =(AB407/AC407)*100 -> 146.26593806921676 | AE407: =(Y407*4)+(AA407*2) -> 28
A408: NORTH BALLARAT | C408: CUTHBERTSON 4 | G408: CLARKE 3 | I408: DOHERTY 2 | L408: T POLKINGHORNE 2 | P408: McDONALD | W408: SPRINGVALE | X408: 1 | Y408: 6 | Z408: 2 | AA408: 0 | AB408: 873 | AC408: 490 | AD408: =(AB408/AC408)*100 -> 178.16326530612244 | AE408: =(Y408*4)+(AA408*2) -> 24
A409: SANDRINGHAM | C409: SAUTNER 3 | F409: SCOTT-BRANAGAN 2 | J409: TEMPLETON 2 | M409: AMIET | O409: MITCHELSON | R409: CAPSALIS | W409: NORTH BALLARAT | X409: 1 | Y409: 6 | Z409: 2 | AA409: 0 | AB409: 667 | AC409: 630 | AD409: =(AB409/AC409)*100 -> 105.87301587301587 | AE409: =(Y409*4)+(AA409*2) -> 24
D410: 31ST MAY | J410: WEATHER | W410: PRESTON | X410: 1 | Y410: 5 | Z410: 3 | AA410: 0 | AB410: 660 | AC410: 634 | AD410: =(AB410/AC410)*100 -> 104.10094637223975 | AE410: =(Y410*4)+(AA410*2) -> 20
A411: WERRIBEE | C411: 5 | D411: 3 | E411: =(C411*6)+D411 -> 33 | G411: 11 | H411: 7 | I411: =(G411*6)+H411 -> 73 | K411: 12 | L411: 12 | M411: =(K411*6)+L411 -> 84 | O411: 17 | P411: 19 | Q411: =(O411*6)+P411 -> 121 | S411: Venue: COBURG | W411: PORT MELBOURNE | Y411: 3 | Z411: 6 | AA411: 0 | AB411: 698 | AC411: 791 | AD411: =(AB411/AC411)*100 -> 88.242730720606829 | AE411: =(Y411*4)+(AA411*2) -> 12
A412: COBURG | C412: 0 | D412: 2 | E412: =(C412*6)+D412 -> 2 | G412: 2 | H412: 5 | I412: =(G412*6)+H412 -> 17 | K412: 6 | L412: 7 | M412: =(K412*6)+L412 -> 43 | O412: 7 | P412: 9 | Q412: =(O412*6)+P412 -> 51
A413: BEST PLAYERS | W413: SANDRINGHAM | X413: 1 | Y413: 3 | Z413: 5 | AA413: 0 | AB413: 552 | AC413: 630 | AD413: =(AB413/AC413)*100 -> 87.61904761904762 | AE413: =(Y413*4)+(AA413*2) -> 12
A414: WERRIBEE | C414: FROST | F414: BALLAN | I414: SPROULE | L414: WHITNALL | O414: PULI | Q414: SHAW | W414: WILLIAMSTOWN | X414: 1 | Y414: 2 | Z414: 6 | AA414: 0 | AB414: 601 | AC414: 712 | AD414: =(AB414/AC414)*100 -> 84.410112359550567 | AE414: =(Y414*4)+(AA414*2) -> 8
A415: COBURG | C415: HOOD | F415: CAPELLO | I415: WILLIAMS | L415: DAVIDSON | O415: AGRESTA | W415: BENDIGO | X415: 1 | Y415: 2 | Z415: 6 | AA415: 0 | AB415: 587 | AC415: 753 | AD415: =(AB415/AC415)*100 -> 77.954847277556439 | AE415: =(Y415*4)+(AA415*2) -> 8
A416: GOALKICKERS | O416: WHITNALL | R416: SPROULE | W416: COBURG | X416: 1 | Y416: 2 | Z416: 6 | AA416: 0 | AB416: 537 | AC416: 827 | AD416: =(AB416/AC416)*100 -> 64.933494558645705 | AE416: =(Y416*4)+(AA416*2) -> 8
A417: WERRIBEE | C417: C GOWANS 3 | F417: FROST 3 | H417: SHAW 3 | J417: AZIZ 2 | L417: SKROBOLAK 2 | O417: BALLAN | Q417: GRAY | W417: BOX HILL | X417: 1 | Y417: 1 | Z417: 7 | AA417: 0 | AB417: 516 | AC417: 831 | AD417: =(AB417/AC417)*100 -> 62.093862815884485 | AE417: =(Y417*4)+(AA417*2) -> 4
A418: COBURG | C418: McHARDY 2 | F418: ALESSIO | H418: AGRESTA | J418: EZARD | L418: BUDGE | N418: WILLIAMS
A420: PRESTON | C420: 3 | D420: 4 | E420: =(C420*6)+D420 -> 22 | G420: 7 | H420: 11 | I420: =(G420*6)+H420 -> 53 | K420: 13 | L420: 13 | M420: =(K420*6)+L420 -> 91 | O420: 14 | P420: 13 | Q420: =(O420*6)+P420 -> 97 | S420: Venue: PRESTON
A421: FRANKSTON | C421: 2 | D421: 4 | E421: =(C421*6)+D421 -> 16 | G421: 5 | H421: 4 | I421: =(G421*6)+H421 -> 34 | K421: 8 | L421: 8 | M421: =(K421*6)+L421 -> 56 | O421: 10 | P421: 11 | Q421: =(O421*6)+P421 -> 71
A422: BEST PLAYERS
A423: PRESTON | C423: AIELLO | F423: BOOKER | I423: CLARKE | L423: GRAY | N423: MAIORANA | Q423: PASCOE
A424: FRANKSTON | C424: BURNELL | F424: CHARLES | I424: LAWRENCE | L424: MOORE
A425: GOALKICKERS
A426: PRESTON | C426: GRAY 5 | E426: D GRAINGER 2 | H426: BOOKER | J426: ECCLES | L426: McGREGOR | O426: BAYRE | Q426: MAIORANA | T426: PLUNKETT | X426: PASCOE
A427: FRANKSTON | C427: D CLARKE 2 | F427: BURNELL | H427: MURRAY | J427: SULLIVAN | M427: LAWRENCE | P427: S RYAN | R427: HOLCOMBE | V427: BOWEY | X427: HOPGOOD
A429: SPRINGVALE | C429: 2 | D429: 5 | E429: =(C429*6)+D429 -> 17 | G429: 7 | H429: 12 | I429: =(G429*6)+H429 -> 54 | K429: 14 | L429: 14 | M429: =(K429*6)+L429 -> 98 | O429: 21 | P429: 20 | Q429: =(O429*6)+P429 -> 146 | S429: Venue: BOX HILL
A430: BOX HILL | C430: 2 | D430: 5 | E430: =(C430*6)+D430 -> 17 | G430: 3 | H430: 3 | I430: =(G430*6)+H430 -> 21 | K430: 6 | L430: 5 | M430: =(K430*6)+L430 -> 41 | O430: 6 | P430: 7 | Q430: =(O430*6)+P430 -> 43
A431: BEST PLAYERS
A432: SPRINGVALE | C432: KNIGHT | F432: SHAW | I432: JEFFREY | L432: SHIPP | N432: SMITH | Q432: CLARK
A433: BOX HILL | C433: CROWLEY | F433: ACKLAND | I433: TRANQUILLI
A434: GOALKICKERS
A435: SPRINGVALE | C435: KNIGHT 6 | F435: SMITH 6 | I435: ENTWISTLE 3 | L435: EVANS 2 | N435: J CARROLL | Q435: JEFFREY | S435: PASTORE | W435: SHAW
A436: BOX HILL | C436: FROST 2 | F436: DISNEY | I436: WILKINSON | L436: HABERFIELD | O436: ROWE
A438: PORT MELBOURNE | C438: 2 | D438: 3 | E438: =(C438*6)+D438 -> 15 | G438: 7 | H438: 5 | I438: =(G438*6)+H438 -> 47 | K438: 12 | L438: 11 | M438: =(K438*6)+L438 -> 83 | O438: 13 | P438: 14 | Q438: =(O438*6)+P438 -> 92 | S438: Venue: PORT MELBOURNE
A439: BENDIGO | C439: 3 | D439: 0 | E439: =(C439*6)+D439 -> 18 | G439: 6 | H439: 4 | I439: =(G439*6)+H439 -> 40 | K439: 7 | L439: 6 | M439: =(K439*6)+L439 -> 48 | O439: 13 | P439: 9 | Q439: =(O439*6)+P439 -> 87
A440: BEST PLAYERS
A441: PORT MELBOURNE | C441: HOLLOW | F441: SHARP | I441: BALLANTYNE | L441: PICIAONE | O441: GOODALE | R441: DWYER
A442: BENDIGO | C442: O'SHANNESSY | F442: ORR | I442: PASCOE | L442: R LANGAN | O442: TOINTON | R442: SCHMIDT
A443: GOALKICKERS
A444: PORT MELBOURNE | C444: BALLANTYNE 4 | F444: JAMES 2 | H444: CAMERON | J444: DWYER | L444: GOODALE | N444: HALPIN | P444: McCARTHY | S444: SCHAEFER | W444: SHANAHAN
A445: BENDIGO | C445: TOINTON 4 | F445: SCHMIDT 2 | I445: R LANGAN 2 | L445: RUDD | N445: MARSHALL | Q445: SLATER | S445: BUTLER | W445: DURIE
A447: BYE | D447: WILLIAMSTOWN
A449: ROUND 10 | D449: 13TH JUNE | J449: WEATHER | S449: Venue: WILLIAMSTOWN
D450: 1ST QTR | H450: 2ND QTR | L450: 3RD QTR | P450: FINAL | S450: UMPIRES | V450: CALLAHAN
A451: WILLIAMSTOWN | C451: 3 | D451: 6 | E451: =(C451*6)+D451 -> 24 | G451: 4 | H451: 11 | I451: =(G451*6)+H451 -> 35 | K451: 5 | L451: 16 | M451: =(K451*6)+L451 -> 46 | O451: 13 | P451: 12 | Q451: =(O451*6)+P451 -> 90 | S451: VOZZO | Z451: LADDER | AC451: ROUND | AE451: 10
A452: PORT MELBOURNE | C452: 2 | D452: 3 | E452: =(C452*6)+D452 -> 15 | G452: 3 | H452: 4 | I452: =(G452*6)+H452 -> 22 | K452: 6 | L452: 6 | M452: =(K452*6)+L452 -> 42 | O452: 10 | P452: 14 | Q452: =(O452*6)+P452 -> 74 | S452: SEXTON
A453: BEST PLAYERS | W453: TEAM | X453: B | Y453: W | Z453: L | AA453: D | AB453: FOR | AC453: AGST | AD453: % | AE453: PTS
A454: WILLIAMSTOWN | C454: KERRY | F454: GHAZI | I454: WEST | L454: LAMBROPOULOS | O454: BROWN | R454: EAMES
A455: PORT MELBOURNE | C455: CHEEL | F455: BALLANTYNE | I455: WEEDING | L455: DWYER | O455: HENDERSON | R455: PICIAONE | W455: WERRIBEE | X455: 1 | Y455: 8 | Z455: 1 | AA455: 0 | AB455: 1028 | AC455: 675 | AD455: =(AB455/AC455)*100 -> 152.2962962962963 | AE455: =(Y455*4)+(AA455*2) -> 32
A456: GOALKICKERS | W456: FRANKSTON | X456: 1 | Y456: 8 | Z456: 1 | AA456: 0 | AB456: 928 | AC456: 611 | AD456: =(AB456/AC456)*100 -> 151.88216039279868 | AE456: =(Y456*4)+(AA456*2) -> 32
A457: WILLIAMSTOWN | C457: FORYS 3 | E457: GHAZI 3 | G457: DELRE 2 | I457: GRIFFIN 2 | K457: ZAVALAS | M457: KERRY | O457: PATTERSON | W457: SPRINGVALE | X457: 1 | Y457: 7 | Z457: 2 | AA457: 0 | AB457: 988 | AC457: 549 | AD457: =(AB457/AC457)*100 -> 179.96357012750454 | AE457: =(Y457*4)+(AA457*2) -> 28
A458: PORT MELBOURNE | C458: WEEDING 4 | F458: DURLING | H458: DWYER | J458: JESS | L458: McCARTHY | N458: SHANAHAN | Q458: VILLAROSSA | W458: NORTH BALLARAT | X458: 1 | Y458: 6 | Z458: 3 | AA458: 0 | AB458: 729 | AC458: 755 | AD458: =(AB458/AC458)*100 -> 96.556291390728475 | AE458: =(Y458*4)+(AA458*2) -> 24
D459: 14TH JUNE | J459: WEATHER | S459: Venue: BEACH ROAD | W459: PRESTON | X459: 1 | Y459: 5 | Z459: 4 | AA459: 0 | AB459: 719 | AC459: 749 | AD459: =(AB459/AC459)*100 -> 95.994659546061413 | AE459: =(Y459*4)+(AA459*2) -> 20
A460: SANDRINGHAM | C460: 4 | D460: 3 | E460: =(C460*6)+D460 -> 27 | G460: 9 | H460: 6 | I460: =(G460*6)+H460 -> 60 | K460: 12 | L460: 9 | M460: =(K460*6)+L460 -> 81 | O460: 23 | P460: 8 | Q460: =(O460*6)+P460 -> 146 | S460: DAVIDSON | W460: SANDRINGHAM | X460: 1 | Y460: 4 | Z460: 5 | AA460: 0 | AB460: 698 | AC460: 686 | AD460: =(AB460/AC460)*100 -> 101.74927113702623 | AE460: =(Y460*4)+(AA460*2) -> 16
A461: COBURG | C461: 2 | D461: 2 | E461: =(C461*6)+D461 -> 14 | G461: 8 | H461: 6 | I461: =(G461*6)+H461 -> 54 | K461: 8 | L461: 9 | M461: =(K461*6)+L461 -> 57 | O461: 8 | P461: 8 | Q461: =(O461*6)+P461 -> 56 | S461: COOK
A462: BEST PLAYERS | S462: FORBES | W462: WILLIAMSTOWN | X462: 1 | Y462: 3 | Z462: 6 | AA462: 0 | AB462: 691 | AC462: 786 | AD462: =(AB462/AC462)*100 -> 87.913486005089055 | AE462: =(Y462*4)+(AA462*2) -> 12
A463: SANDRINGHAM | C463: AMIET | F463: JOHNSTON | I463: CROUGH | L463: ROBINS | O463: TREGEAR | R463: TEMPLETON | W463: PORT MELBOURNE | Y463: 3 | Z463: 7 | AA463: 0 | AB463: 772 | AC463: 881 | AD463: =(AB463/AC463)*100 -> 87.627695800227016 | AE463: =(Y463*4)+(AA463*2) -> 12
A464: COBURG | C464: SALVADORE | F464: DUNCAN | I464: PEVERILL | W464: BENDIGO | X464: 1 | Y464: 3 | Z464: 6 | AA464: 0 | AB464: 717 | AC464: 867 | AD464: =(AB464/AC464)*100 -> 82.698961937716263 | AE464: =(Y464*4)+(AA464*2) -> 12
A465: GOALKICKERS | I465: HAYWARD | L465: S RADFORD | O465: WEBB | Q465: BAXTER | S465: HAYNES | W465: COBURG | X465: 1 | Y465: 2 | Z465: 7 | AA465: 0 | AB465: 593 | AC465: 973 | AD465: =(AB465/AC465)*100 -> 60.945529290853031 | AE465: =(Y465*4)+(AA465*2) -> 8
A466: SANDRINGHAM | C466: AMIET 7 | E466: TEMPLETON 3 | H466: SCOTT-BRANAGAN 3 | L466: MITCHELSON 2 | O466: JOHNSTONE 2 | R466: MACGEORGE | W466: BOX HILL | X466: 1 | Y466: 1 | Z466: 8 | AA466: 0 | AB466: 630 | AC466: 961 | AD466: =(AB466/AC466)*100 -> 65.556711758584811 | AE466: =(Y466*4)+(AA466*2) -> 4
A467: COBURG | C467: SOURASSIS 3 | F467: SALVADORE 2 | I467: CAPELLO | K467: GIACOTTO | N467: PIGNATORO
A469: BENDIGO | C469: 4 | D469: 5 | E469: =(C469*6)+D469 -> 29 | G469: 9 | H469: 9 | I469: =(G469*6)+H469 -> 63 | K469: 13 | L469: 16 | M469: =(K469*6)+L469 -> 94 | O469: 19 | P469: 16 | Q469: =(O469*6)+P469 -> 130 | S469: Venue: BENDIGO
A470: BOX HILL | C470: 2 | D470: 2 | E470: =(C470*6)+D470 -> 14 | G470: 5 | H470: 5 | I470: =(G470*6)+H470 -> 35 | K470: 7 | L470: 9 | M470: =(K470*6)+L470 -> 51 | O470: 17 | P470: 12 | Q470: =(O470*6)+P470 -> 114 | S470: HEAD :MANN :DYE
A471: BEST PLAYERS
A472: BENDIGO | C472: DURIE | F472: ORR | I472: KELLY | L472: A TOINTON | O472: LANCASTER | R472: STEVENS
A473: BOX HILL | C473: WILKINSON | F473: BELLO | I473: SLATER | L473: TRANQUILLI | O473: NICHOL | R473: HABERFIELD
A474: GOALKICKERS
A475: BENDIGO | C475: A TOINTON 5 | F475: SLATER 3 | H475: DURIE 2 | J475: STEVENS 2 | M475: RUDD 2 | O475: S LANGAN | R475: SCHMIDT | V475: LANCASTER | X475: HEWITT | Z475: ELSUM
A476: BOX HILL | C476: WILKINSON 6 | F476: SLATER 5 | I476: HABERFIELD 2 | L476: HOLLAND 2 | O476: AIELLO | Q476: GLASSBOROUGH
A478: FRANKSTON | C478: 7 | D478: 5 | E478: =(C478*6)+D478 -> 47 | G478: 10 | H478: 10 | I478: =(G478*6)+H478 -> 70 | K478: 14 | L478: 14 | M478: =(K478*6)+L478 -> 98 | O478: 19 | P478: 11 | Q478: =(O478*6)+P478 -> 125 | S478: Venue: FRANKSTON
A479: NORTH BALLARAT | C479: 2 | D479: 0 | E479: =(C479*6)+D479 -> 12 | G479: 4 | H479: 3 | I479: =(G479*6)+H479 -> 27 | K479: 7 | L479: 5 | M479: =(K479*6)+L479 -> 47 | O479: 9 | P479: 8 | Q479: =(O479*6)+P479 -> 62 | S479: KELSEY :JAMES :GRUN
A480: BEST PLAYERS
A481: FRANKSTON | C481: MILLANE | F481: MOORE | I481: MACKAY | L481: MURRAY | O481: MALLOY | R481: STRINGER
A482: NORTH BALLARAT | C482: J POLKINGHORNE | G482: G POLKINGHORNE | K482: COX | M482: EDMONDS | P482: DOYLE | R482: RUYG
A483: GOALKICKERS
A484: FRANKSTON | C484: MILLANE 5 | F484: QUINN 2 | H484: ANDERSON 2 | K484: WEBB 2 | M484: STRINGER 2 | P484: BURGMANN | S484: GEORGE | V484: MURRAY | X484: SULLIVAN | AA484: HOLCOMBE | AD484: BURNELL
A485: NORTH BALLARAT | C485: EDMONDS 3 | F485: CUTHBERTSON 2 | J485: PICKFORD 2 | M485: MAHER | O485: INIA
A487: SPRINGVALE | C487: 5 | D487: 3 | E487: =(C487*6)+D487 -> 33 | G487: 9 | H487: 5 | I487: =(G487*6)+H487 -> 59 | K487: 15 | L487: 9 | M487: =(K487*6)+L487 -> 99 | O487: 17 | P487: 13 | Q487: =(O487*6)+P487 -> 115 | S487: Venue: SPRINGVALE
A488: PRESTON | C488: 2 | D488: 1 | E488: =(C488*6)+D488 -> 13 | G488: 5 | H488: 2 | I488: =(G488*6)+H488 -> 32 | K488: 7 | L488: 4 | M488: =(K488*6)+L488 -> 46 | O488: 8 | P488: 11 | Q488: =(O488*6)+P488 -> 59 | S488: ROWE :JEFFREY :NICHOLLS
A489: BEST PLAYERS
A490: SPRINGVALE | C490: LITTLE | F490: EVANS | I490: WILLOUGHBY | L490: CLARK | O490: FORD | R490: CARROLL
A491: PRESTON | C491: POWER | F491: MAIORANA | I491: BLAGROVE | L491: AIELLO | O491: HAYDOCK
A492: GOALKICKERS
A493: SPRINGVALE | C493: SMITH 5 | F493: EVANS 4 | I493: LITTLE 3 | K493: FORD 3 | M493: CARROLL | O493: KNIGHT
A494: PRESTON | C494: PLUNKETT 2 | F494: GRAY 2 | I494: McGREGOR | L494: POWER | N494: BOOKER | P494: MAIORANA
A496: BYE | D496: WERRIBEE
A498: ROUND 11 | D498: 20TH JUNE | J498: WEATHER | S498: Venue: PRESTON
D499: 1ST QTR | H499: 2ND QTR | L499: 3RD QTR | P499: FINAL | S499: UMPIRES | V499: KELSEY
A500: PRESTON | C500: 2 | D500: 5 | E500: =(C500*6)+D500 -> 17 | G500: 9 | H500: 6 | I500: =(G500*6)+H500 -> 60 | K500: 11 | L500: 7 | M500: =(K500*6)+L500 -> 73 | O500: 15 | P500: 15 | Q500: =(O500*6)+P500 -> 105 | S500: GUNN | Z500: LADDER | AC500: ROUND | AE500: 11
A501: BENDIGO | C501: 3 | D501: 2 | E501: =(C501*6)+D501 -> 20 | G501: 5 | H501: 3 | I501: =(G501*6)+H501 -> 33 | K501: 5 | L501: 9 | M501: =(K501*6)+L501 -> 39 | O501: 14 | P501: 10 | Q501: =(O501*6)+P501 -> 94 | S501: FORBES
A502: BEST PLAYERS | W502: TEAM | X502: B | Y502: W | Z502: L | AA502: D | AB502: FOR | AC502: AGST | AD502: % | AE502: PTS
A503: PRESTON | C503: McGREGOR | F503: HABERMAN | I503: PENN | L503: HAYDOCK | O503: CLARKE | R503: PASCOE
A504: BENDIGO | C504: TUITON | F504: SCHMIDT | I504: LANCASTER | L504: ELSUM | O504: RUDD | W504: WERRIBEE | X504: 1 | Y504: 9 | Z504: 1 | AA504: 0 | AB504: 1115 | AC504: 704 | AD504: =(AB504/AC504)*100 -> 158.38068181818181 | AE504: =(Y504*4)+(AA504*2) -> 36
A505: GOALKICKERS | Q505: HABERMAN | W505: FRANKSTON | X505: 1 | Y505: 9 | Z505: 1 | AA505: 0 | AB505: 1002 | AC505: 670 | AD505: =(AB505/AC505)*100 -> 149.55223880597015 | AE505: =(Y505*4)+(AA505*2) -> 36
A506: PRESTON | C506: D GRAINGER 4 | F506: S GRAINGER 3 | I506: McGREGOR 2 | L506: PASCOE 2 | N506: BOOKER 2 | Q506: McCREDDEN | W506: SPRINGVALE | X506: 1 | Y506: 7 | Z506: 3 | AA506: 0 | AB506: 1025 | AC506: 599 | AD506: =(AB506/AC506)*100 -> 171.11853088480802 | AE506: =(Y506*4)+(AA506*2) -> 28
A507: BENDIGO | C507: TOINTON 5 | F507: SCHMIDT 2 | I507: STEVENS 2 | L507: ORR 2 | N507: HEWITT | P507: RUDD | R507: HAYES | W507: NORTH BALLARAT | X507: 1 | Y507: 7 | Z507: 3 | AA507: 0 | AB507: 779 | AC507: 792 | AD507: =(AB507/AC507)*100 -> 98.358585858585855 | AE507: =(Y507*4)+(AA507*2) -> 28
S508: Venue: COBURG | W508: PRESTON | X508: 1 | Y508: 6 | Z508: 4 | AA508: 0 | AB508: 824 | AC508: 843 | AD508: =(AB508/AC508)*100 -> 97.746144721233691 | AE508: =(Y508*4)+(AA508*2) -> 24
A509: FRANKSTON | C509: 3 | D509: 1 | E509: =(C509*6)+D509 -> 19 | G509: 7 | H509: 2 | I509: =(G509*6)+H509 -> 44 | K509: 13 | L509: 7 | M509: =(K509*6)+L509 -> 85 | O509: 11 | P509: 8 | Q509: =(O509*6)+P509 -> 74 | S509: DYE | W509: SANDRINGHAM | X509: 1 | Y509: 4 | Z509: 6 | AA509: 0 | AB509: 727 | AC509: 773 | AD509: =(AB509/AC509)*100 -> 94.049159120310478 | AE509: =(Y509*4)+(AA509*2) -> 16
A510: COBURG | C510: 1 | D510: 2 | E510: =(C510*6)+D510 -> 8 | G510: 5 | H510: 8 | I510: =(G510*6)+H510 -> 38 | K510: 6 | L510: 9 | M510: =(K510*6)+L510 -> 45 | O510: 7 | P510: 17 | Q510: =(O510*6)+P510 -> 59 | S510: MANN
A511: BEST PLAYERS | S511: SEXTON | W511: WILLIAMSTOWN | X511: 1 | Y511: 4 | Z511: 6 | AA511: 0 | AB511: 783 | AC511: 863 | AD511: =(AB511/AC511)*100 -> 90.730011587485521 | AE511: =(Y511*4)+(AA511*2) -> 16
A512: FRANKSTON | C512: MOLLOY | F512: BURGMANN | I512: MOORE | L512: MACKAY | O512: BURNELL | W512: PORT MELBOURNE | X512: 1 | Y512: 3 | Z512: 7 | AA512: 0 | AB512: 772 | AC512: 881 | AD512: =(AB512/AC512)*100 -> 87.627695800227016 | AE512: =(Y512*4)+(AA512*2) -> 12
A513: COBURG | C513: McLEOD | F513: McHARDY | I513: JURICA | L513: WESTON | O513: SOURASSIS | W513: BENDIGO | X513: 1 | Y513: 3 | Z513: 7 | AA513: 0 | AB513: 811 | AC513: 972 | AD513: =(AB513/AC513)*100 -> 83.436213991769549 | AE513: =(Y513*4)+(AA513*2) -> 12
A514: GOALKICKERS | Q514: BURNELL | W514: COBURG | X514: 1 | Y514: 2 | Z514: 8 | AA514: 0 | AB514: 652 | AC514: 1047 | AD514: =(AB514/AC514)*100 -> 62.273161413562562 | AE514: =(Y514*4)+(AA514*2) -> 8
A515: FRANKSTON | C515: WEBB 3 | E515: SULLIVAN 2 | H515: KING | J515: STRINGER | M515: D CLARKE | P515: MURRAY | R515: QUINN | W515: BOX HILL | X515: 1 | Y515: 1 | Z515: 9 | AA515: 0 | AB515: 707 | AC515: 1053 | AD515: =(AB515/AC515)*100 -> 67.141500474833805 | AE515: =(Y515*4)+(AA515*2) -> 4
A516: COBURG | C516: SOURASSIS | F516: McHARDY | H516: GILPIN | J516: KELLY | L516: PEEL | N516: ALESSIO | P516: GIACOTTO
D517: 21ST JUNE | J517: WEATHER
A518: WERRIBEE | C518: 1 | D518: 7 | E518: =(C518*6)+D518 -> 13 | G518: 7 | H518: 9 | I518: =(G518*6)+H518 -> 51 | K518: 8 | L518: 11 | M518: =(K518*6)+L518 -> 59 | O518: 13 | P518: 9 | Q518: =(O518*6)+P518 -> 87 | S518: Venue: WERRIBEE
A519: SANDRINGHAM | E519: =(C519*6)+D519 -> 0 | I519: =(G519*6)+H519 -> 0 | M519: =(K519*6)+L519 -> 0 | O519: 4 | P519: 5 | Q519: =(O519*6)+P519 -> 29 | S519: ROWE :CALLAHAN :JEFFREY
A520: BEST PLAYERS
A521: WERRIBEE | C521: PULI | F521: SHAW | I521: FROST | L521: TAYLOR | O521: SAUNDERS | R521: SPROULE
A522: SANDRINGHAM | C522: M GRANT | F522: MITCHELSON | I522: HAYWARD
A523: GOALKICKERS
A524: WERRIBEE | C524: FROST 3 | E524: SHAW 3 | G524: PULI 2 | I524: SKROBOLAK | L524: FAULKNER | O524: ATKINS | Q524: GOODEY | T524: AZIZ
A525: SANDRINGHAM | C525: NUGENT 2 | F525: AMIET | H525: SAUTNER
A527: WILLIAMSTOWN | C527: 2 | D527: 0 | E527: =(C527*6)+D527 -> 12 | G527: 10 | H527: 4 | I527: =(G527*6)+H527 -> 64 | K527: 12 | L527: 7 | M527: =(K527*6)+L527 -> 79 | O527: 13 | P527: 14 | Q527: =(O527*6)+P527 -> 92 | S527: Venue: BOX HILL
A528: BOX HILL | C528: 3 | D528: 5 | E528: =(C528*6)+D528 -> 23 | G528: 5 | H528: 5 | I528: =(G528*6)+H528 -> 35 | K528: 10 | L528: 9 | M528: =(K528*6)+L528 -> 69 | O528: 11 | P528: 11 | Q528: =(O528*6)+P528 -> 77 | S528: COOK :JAMES :TWITT
A529: BEST PLAYERS
A530: WILLIAMSTOWN | C530: HOLLOW | F530: ROUND | I530: DELRE | L530: BROWN | O530: FRASER | R530: EAMES
A531: BOX HILL | C531: CROWLEY | F531: AIELLO | I531: SIMMONDS | L531: ALLSOPP | O531: BOURKE | R531: BELLIO
A532: GOALKICKERS
A533: WILLIAMSTOWN | C533: CHRISTOFARO 4 | F533: DELRE 4 | I533: FORYS 2 | K533: FRASER | M533: GHAZI | O533: HOLLOW
A534: BOX HILL | C534: SLATER 3 | F534: HOLLAND 2 | I534: SIMMONDS 2 | L534: TRANQUILLI 2 | O534: COOK 2
A536: NORTH BALLARAT | C536: 7 | D536: 2 | E536: =(C536*6)+D536 -> 44 | G536: 17 | H536: 6 | I536: =(G536*6)+H536 -> 108 | K536: 23 | L536: 10 | M536: =(K536*6)+L536 -> 148 | O536: 6 | P536: 14 | Q536: =(O536*6)+P536 -> 50 | S536: Venue: NORTH BALLARAT
A537: SPRINGVALE | C537: 4 | D537: 0 | E537: =(C537*6)+D537 -> 24 | G537: 5 | H537: 2 | I537: =(G537*6)+H537 -> 32 | K537: 8 | L537: 6 | M537: =(K537*6)+L537 -> 54 | O537: 5 | P537: 7 | Q537: =(O537*6)+P537 -> 37 | S537: VOZZO :HEAD :DAVIDSON
A538: BEST PLAYERS
A539: NORTH BALLARAT | C539: J POLKINGHORNE | G539: T POLKINHORNE | J539: DOYLE | L539: McDONALD | O539: RUYG | Q539: G POLKINGHORNE
A540: SPRINGVALE | C540: D CARROLL | F540: SUTHERLAND | I540: TAYLOR | L540: SHIPP | O540: LITTLE | Q540: CLARK
A541: GOALKICKERS
A542: NORTH BALLARAT | C542: DOYLE | E542: EDMONDS | H542: CUTHBERTSON | K542: McDONALD | N542: RUYG | P542: CLARKE
A543: SPRINGVALE | C543: EVANS 2 | F543: TAYLOR | H543: FORD | J543: DWYER
A545: BYE | D545: PORT MELBOURNE
A547: ROUND 12 | D547: 27TH JUNE | J547: WEATHER
D548: 1ST QTR | H548: 2ND QTR | L548: 3RD QTR | P548: FINAL | S548: Venue: WERRIBEE
A549: WERRIBEE | C549: 3 | D549: 3 | E549: =(C549*6)+D549 -> 21 | G549: 7 | H549: 5 | I549: =(G549*6)+H549 -> 47 | K549: 13 | L549: 7 | M549: =(K549*6)+L549 -> 85 | O549: 18 | P549: 10 | Q549: =(O549*6)+P549 -> 118 | S549: UMPIRES | Z549: LADDER | AC549: ROUND | AE549: 12
A550: FRANKSTON | C550: 1 | D550: 1 | E550: =(C550*6)+D550 -> 7 | G550: 3 | H550: 2 | I550: =(G550*6)+H550 -> 20 | K550: 3 | L550: 5 | M550: =(K550*6)+L550 -> 23 | O550: 4 | P550: 6 | Q550: =(O550*6)+P550 -> 30
A551: BEST PLAYERS | W551: TEAM | X551: B | Y551: W | Z551: L | AA551: D | AB551: FOR | AC551: AGST | AD551: % | AE551: PTS
A552: WERRIBEE | C552: J GOWANS | F552: C GOWANS | I552: BALLAN | L552: CAMILLIERI | O552: SPROULE | Q552: ATKINS
A553: FRANKSTON | C553: BURGMAN | F553: MOORE | I553: KING | L553: BURNELL | W553: WERRIBEE | X553: 1 | Y553: 10 | Z553: 1 | AA553: 0 | AB553: 1233 | AC553: 734 | AD553: =(AB553/AC553)*100 -> 167.98365122615803 | AE553: =(Y553*4)+(AA553*2) -> 40
A554: GOALKICKERS | H554: KELLETT | J554: SPROULE | L554: FAULKNER | O554: J GOWANS | Q554: ATKINS | S554: PULI | W554: FRANKSTON | X554: 1 | Y554: 9 | Z554: 2 | AA554: 0 | AB554: 1032 | AC554: 788 | AD554: =(AB554/AC554)*100 -> 130.96446700507613 | AE554: =(Y554*4)+(AA554*2) -> 36
A555: WERRIBEE | C555: CAMILLIERI 3 | F555: GRAY 2 | H555: AZIZ 2 | J555: C GOWANS 2 | M555: FROST | O555: SHAW | Q555: CHURCHILL | W555: SPRINGVALE | X555: 1 | Y555: 8 | Z555: 3 | AA555: 0 | AB555: 1144 | AC555: 623 | AD555: =(AB555/AC555)*100 -> 183.62760834670948 | AE555: =(Y555*4)+(AA555*2) -> 32
A556: FRANKSTON | C556: WEBB 2 | F556: DAM CLARKE | I556: STRINGER | W556: NORTH BALLARAT | X556: 1 | Y556: 8 | Z556: 3 | AA556: 0 | AB556: 862 | AC556: 834 | AD556: =(AB556/AC556)*100 -> 103.35731414868106 | AE556: =(Y556*4)+(AA556*2) -> 32
D557: 28TH JUNE | J557: WEATHER | W557: PRESTON | X557: 1 | Y557: 6 | Z557: 5 | AA557: 0 | AB557: 876 | AC557: 899 | AD557: =(AB557/AC557)*100 -> 97.441601779755288 | AE557: =(Y557*4)+(AA557*2) -> 24
A558: PORT MELBOURNE | C558: 2 | D558: 3 | E558: =(C558*6)+D558 -> 15 | G558: 9 | H558: 6 | I558: =(G558*6)+H558 -> 60 | K558: 12 | L558: 9 | M558: =(K558*6)+L558 -> 81 | O558: 14 | P558: 11 | Q558: =(O558*6)+P558 -> 95 | S558: Venue: BOX HILL | W558: WILLIAMSTOWN | X558: 1 | Y558: 5 | Z558: 6 | AA558: 0 | AB558: 839 | AC558: 915 | AD558: =(AB558/AC558)*100 -> 91.693989071038246 | AE558: =(Y558*4)+(AA558*2) -> 20
A559: BOX HILL | C559: 4 | D559: 6 | E559: =(C559*6)+D559 -> 30 | G559: 5 | H559: 7 | I559: =(G559*6)+H559 -> 37 | K559: 9 | L559: 11 | M559: =(K559*6)+L559 -> 65 | O559: 11 | P559: 14 | Q559: =(O559*6)+P559 -> 80
A560: BEST PLAYERS | W560: SANDRINGHAM | X560: 2 | Y560: 4 | Z560: 6 | AA560: 0 | AB560: 727 | AC560: 773 | AD560: =(AB560/AC560)*100 -> 94.049159120310478 | AE560: =(Y560*4)+(AA560*2) -> 16
A561: PORT MELBOURNE | C561: PICIAONE | F561: HENDERSON | I561: CLOHESY | L561: NAPOLI | O561: SEXTON | Q561: GOODALE | W561: PORT MELBOURNE | X561: 1 | Y561: 4 | Z561: 7 | AA561: 0 | AB561: 867 | AC561: 961 | AD561: =(AB561/AC561)*100 -> 90.218522372528625 | AE561: =(Y561*4)+(AA561*2) -> 16
A562: BOX HILL | C562: WILKINSON | F562: PORTER | I562: McCARTNEY | L562: CROWLEY | O562: JENKINS | Q562: MURLEY | W562: BENDIGO | X562: 1 | Y562: 3 | Z562: 8 | AA562: 0 | AB562: 853 | AC562: 1055 | AD562: =(AB562/AC562)*100 -> 80.853080568720387 | AE562: =(Y562*4)+(AA562*2) -> 12
A563: GOALKICKERS | O563: MORTON | Q563: SHEEDY | W563: COBURG | X563: 1 | Y563: 2 | Z563: 9 | AA563: 0 | AB563: 675 | AC563: 1166 | AD563: =(AB563/AC563)*100 -> 57.890222984562612 | AE563: =(Y563*4)+(AA563*2) -> 8
A564: PORT MELBOURNE | C564: CAMERON 2 | F564: DWYER 2 | H564: JAMES 2 | J564: McCARTHY 2 | M564: SCHAEFER 2 | P564: CLOHESY | R564: DUANE | W564: BOX HILL | X564: 1 | Y564: 1 | Z564: 10 | AA564: 0 | AB564: 787 | AC564: 1148 | AD564: =(AB564/AC564)*100 -> 68.554006968641119 | AE564: =(Y564*4)+(AA564*2) -> 4
A565: BOX HILL | C565: WILKINSON 6 | F565: HABERFIELD 2 | I565: BOURKE | K565: TRANQUILLI | N565: SLATER
A567: SPRINGVALE | C567: 2 | D567: 11 | E567: =(C567*6)+D567 -> 23 | G567: 5 | H567: 15 | I567: =(G567*6)+H567 -> 45 | K567: 10 | L567: 20 | M567: =(K567*6)+L567 -> 80 | O567: 16 | P567: 23 | Q567: =(O567*6)+P567 -> 119 | S567: Venue: COBURG
A568: COBURG | C568: 0 | D568: 1 | E568: =(C568*6)+D568 -> 1 | G568: 0 | H568: 3 | I568: =(G568*6)+H568 -> 3 | K568: 2 | L568: 3 | M568: =(K568*6)+L568 -> 15 | O568: 3 | P568: 5 | Q568: =(O568*6)+P568 -> 23
A569: BEST PLAYERS
A570: SPRINGVALE | C570: CLARK | F570: EVANS | I570: O'BRIEN | L570: SHIPP | N570: TAYLOR | Q570: LITTLE
A571: COBURG | C571: ALESSIO | F571: HILL | I571: PEEL
A572: GOALKICKERS
A573: SPRINGVALE | C573: SMITH 4 | E573: CLARK 2 | G573: FORD 2 | I573: PASTORE 2 | L573: O'BRIEN 2 | N573: D CARROLL | Q573: KNIGHT | T573: SHAW | W573: TROLLOPE
A574: COBURG | C574: ALESSIO | F574: SUTHERLAND | I574: WALKER
A576: WILLIAMSTOWN | C576: 1 | D576: 1 | E576: =(C576*6)+D576 -> 7 | G576: 2 | H576: 5 | I576: =(G576*6)+H576 -> 17 | K576: 4 | L576: 9 | M576: =(K576*6)+L576 -> 33 | O576: 7 | P576: 14 | Q576: =(O576*6)+P576 -> 56 | S576: Venue: PRESTON
A577: PRESTON | C577: 4 | D577: 2 | E577: =(C577*6)+D577 -> 26 | G577: 6 | H577: 3 | I577: =(G577*6)+H577 -> 39 | K577: 6 | L577: 8 | M577: =(K577*6)+L577 -> 44 | O577: 7 | P577: 10 | Q577: =(O577*6)+P577 -> 52
A578: BEST PLAYERS
A579: WILLIAMSTOWN | C579: LATTENSTEIN | F579: HORE | I579: BROWN | L579: WEST | N579: HOLLOW | Q579: WALLACE
A580: PRESTON | C580: AIELLO | F580: GRAY | I580: HABERMAN | L580: KOFOED | N580: POWER | Q580: KNIGHTS
A581: GOALKICKERS
A582: WILLIAMSTOWN | C582: CHRISTOFORO 3 | G582: DELRE 2 | J582: FORYS | L582: WEST
A583: PRESTON | C583: GRAY 3 | F583: PASCOE | H583: BAYRE | J583: D GRAINGER | M583: KNIGHTS
A585: NORTH BALLARAT | C585: 0 | D585: 4 | E585: =(C585*6)+D585 -> 4 | G585: 4 | H585: 8 | I585: =(G585*6)+H585 -> 32 | K585: 7 | L585: 11 | M585: =(K585*6)+L585 -> 53 | O585: 11 | P585: 17 | Q585: =(O585*6)+P585 -> 83 | S585: Venue: NORTH BALLARAT
A586: BENDIGO | C586: 1 | D586: 3 | E586: =(C586*6)+D586 -> 9 | G586: 2 | H586: 3 | I586: =(G586*6)+H586 -> 15 | K586: 6 | L586: 6 | M586: =(K586*6)+L586 -> 42 | O586: 6 | P586: 6 | Q586: =(O586*6)+P586 -> 42
A587: BEST PLAYERS
A588: NORTH BALLARAT | C588: EDMONDS | F588: McDONALD | I588: FLETCHER | L588: G POLKINGHORNE | P588: REID | R588: RUYG
A589: BENDIGO | C589: LANCASTER | F589: S LANGAN | I589: SCHMIDT | L589: ORR | N589: A TOINTON
A590: GOALKICKERS
A591: NORTH BALLARAT | C591: EDMONDS 4 | F591: REID 3 | I591: CUTHBERTSON | L591: CLARKE | N591: MOLONEY | Q591: MARTIN
A592: BENDIGO | C592: A TOINTON 2 | F592: HAYES | H592: DURIE | J592: SCHMIDT | M592: R LANGAN
A594: BYE | D594: SANDRINGHAM
A596: ROUND 13 | D596: 4TH JULY | J596: WEATHER
D597: 1ST QTR | H597: 2ND QTR | L597: 3RD QTR | P597: FINAL | S597: Venue: FRANKSTON
A598: FRANKSTON | C598: 2 | D598: 3 | E598: =(C598*6)+D598 -> 15 | G598: 10 | H598: 4 | I598: =(G598*6)+H598 -> 64 | K598: 14 | L598: 6 | M598: =(K598*6)+L598 -> 90 | O598: 21 | P598: 8 | Q598: =(O598*6)+P598 -> 134 | S598: UMPIRES | Z598: LADDER | AC598: ROUND | AE598: 13
A599: SANDRINGHAM | C599: 1 | D599: 0 | E599: =(C599*6)+D599 -> 6 | G599: 3 | H599: 1 | I599: =(G599*6)+H599 -> 19 | K599: 3 | L599: 3 | M599: =(K599*6)+L599 -> 21 | O599: 3 | P599: 4 | Q599: =(O599*6)+P599 -> 22
A600: BEST PLAYERS | W600: TEAM | X600: B | Y600: W | Z600: L | AA600: D | AB600: FOR | AC600: AGST | AD600: % | AE600: PTS
A601: FRANKSTON | C601: AGNELLO | F601: MEAD | H601: SULLIVAN | K601: S RYAN | N601: BOWEY | P601: CHARLES
A602: SANDRINGHAM | C602: KENNEDY | W602: WERRIBEE | X602: 1 | Y602: 11 | Z602: 1 | AA602: 0 | AB602: 1297 | AC602: 794 | AD602: =(AB602/AC602)*100 -> 163.35012594458439 | AE602: =(Y602*4)+(AA602*2) -> 44
A603: GOALKICKERS | O603: CUMMINGS | R603: CORRIGAN | W603: FRANKSTON | X603: 1 | Y603: 10 | Z603: 2 | AA603: 0 | AB603: 1166 | AC603: 810 | AD603: =(AB603/AC603)*100 -> 143.95061728395063 | AE603: =(Y603*4)+(AA603*2) -> 40
A604: FRANKSTON | C604: BOWEY 4 | E604: S RYAN 4 | H604: BURGMAN 3 | K604: MEAD 3 | M604: WEBB 2 | O604: MOLLOY 2 | Q604: KING | W604: SPRINGVALE | X604: 1 | Y604: 8 | Z604: 4 | AA604: 0 | AB604: 1204 | AC604: 687 | AD604: =(AB604/AC604)*100 -> 175.254730713246 | AE604: =(Y604*4)+(AA604*2) -> 32
A605: SANDRINGHAM | C605: MURRAY 2 | F605: OAKLEY | W605: NORTH BALLARAT | X605: 1 | Y605: 8 | Z605: 4 | AA605: 0 | AB605: 946 | AC605: 920 | AD605: =(AB605/AC605)*100 -> 102.82608695652173 | AE605: =(Y605*4)+(AA605*2) -> 32
W606: PRESTON | X606: 1 | Y606: 7 | Z606: 5 | AA606: 0 | AB606: 956 | AC606: 960 | AD606: =(AB606/AC606)*100 -> 99.583333333333329 | AE606: =(Y606*4)+(AA606*2) -> 28
A607: PRESTON | C607: 1 | D607: 1 | E607: =(C607*6)+D607 -> 7 | G607: 6 | H607: 4 | I607: =(G607*6)+H607 -> 40 | K607: 7 | L607: 5 | M607: =(K607*6)+L607 -> 47 | O607: 12 | P607: 8 | Q607: =(O607*6)+P607 -> 80 | S607: Venue: PRESTON | W607: WILLIAMSTOWN | X607: 1 | Y607: 6 | Z607: 6 | AA607: 0 | AB607: 925 | AC607: 999 | AD607: =(AB607/AC607)*100 -> 92.592592592592595 | AE607: =(Y607*4)+(AA607*2) -> 24
A608: PORT MELBOURNE | C608: 5 | D608: 4 | E608: =(C608*6)+D608 -> 34 | G608: 6 | H608: 7 | I608: =(G608*6)+H608 -> 43 | K608: 6 | L608: 9 | M608: =(K608*6)+L608 -> 45 | O608: 8 | P608: 13 | Q608: =(O608*6)+P608 -> 61
A609: BEST PLAYERS | W609: PORT MELBOURNE | X609: 1 | Y609: 4 | Z609: 8 | AA609: 0 | AB609: 928 | AC609: 1041 | AD609: =(AB609/AC609)*100 -> 89.145052833813637 | AE609: =(Y609*4)+(AA609*2) -> 16
A610: PRESTON | C610: POWER | F610: McCREDDIN | I610: GRAY | K610: KNIGHTS | N610: D GRAINGER | Q610: MAIORANA | W610: SANDRINGHAM | X610: 2 | Y610: 4 | Z610: 7 | AA610: 0 | AB610: 749 | AC610: 907 | AD610: =(AB610/AC610)*100 -> 82.579933847850057 | AE610: =(Y610*4)+(AA610*2) -> 16
A611: PORT MELBOURNE | C611: CLOHESY | F611: PICIAONE | I611: CHEEL | K611: GOODALE | N611: MORTON | W611: BENDIGO | X611: 1 | Y611: 4 | Z611: 8 | AA611: 0 | AB611: 905 | AC611: 1096 | AD611: =(AB611/AC611)*100 -> 82.572992700729927 | AE611: =(Y611*4)+(AA611*2) -> 16
A612: GOALKICKERS | W612: COBURG | X612: 1 | Y612: 2 | Z612: 10 | AA612: 0 | AB612: 716 | AC612: 1207 | AD612: =(AB612/AC612)*100 -> 59.320629660314829 | AE612: =(Y612*4)+(AA612*2) -> 8
A613: PRESTON | C613: GRAY 4 | E613: ECCLES 2 | H613: D GRAINGER 2 | K613: PASCOE | M613: S GRAINGER | P613: CARACELLA | S613: HABERMAN | W613: BOX HILL | X613: 2 | Y613: 1 | Z613: 10 | AA613: 0 | AB613: 787 | AC613: 1148 | AD613: =(AB613/AC613)*100 -> 68.554006968641119 | AE613: =(Y613*4)+(AA613*2) -> 4
A614: PORT MELBOURNE | C614: DWYER 2 | F614: SEXTON 2 | I614: DOBELL | K614: MADDEN | M614: PICIAONE | O614: WEEDING
D615: 5TH JULY | J615: WEATHER
A616: BENDIGO | C616: 4 | D616: 4 | E616: =(C616*6)+D616 -> 28 | G616: 4 | H616: 9 | I616: =(G616*6)+H616 -> 33 | K616: 4 | L616: 13 | M616: =(K616*6)+L616 -> 37 | O616: 6 | P616: 16 | Q616: =(O616*6)+P616 -> 52 | S616: Venue: BENDIGO
A617: COBURG | C617: 1 | D617: 1 | E617: =(C617*6)+D617 -> 7 | G617: 2 | H617: 2 | I617: =(G617*6)+H617 -> 14 | K617: 5 | L617: 3 | M617: =(K617*6)+L617 -> 33 | O617: 6 | P617: 5 | Q617: =(O617*6)+P617 -> 41
A618: BEST PLAYERS
A619: BENDIGO | C619: GORMAN | F619: ST CLAIR | I619: RUDD | K619: MORTON | N619: DURIE
A620: COBURG | C620: ALESSIO | F620: DAVIDSON | I620: CARROLL | K620: DUNCAN | N620: PEVERILL
A621: GOALKICKERS
A622: BENDIGO | C622: TOINTON | F622: WHITSED | I622: BUTLER | K622: STEVENS | M622: GORMAN | O622: SLATER
A623: COBURG | C623: CARROLL 4 | F623: WALKER | I623: SOURASIA
A625: WILLIAMSTOWN | C625: 4 | D625: 2 | E625: =(C625*6)+D625 -> 26 | G625: 6 | H625: 2 | I625: =(G625*6)+H625 -> 38 | K625: 12 | L625: 3 | M625: =(K625*6)+L625 -> 75 | O625: 13 | P625: 8 | Q625: =(O625*6)+P625 -> 86 | S625: Venue: WILLIAMSTOWN
A626: NORTH BALLARAT | C626: 1 | D626: 2 | E626: =(C626*6)+D626 -> 8 | G626: 9 | H626: 2 | I626: =(G626*6)+H626 -> 56 | K626: 11 | L626: 2 | M626: =(K626*6)+L626 -> 68 | O626: 13 | P626: 6 | Q626: =(O626*6)+P626 -> 84
A627: BEST PLAYERS
A628: WILLIAMSTOWN | C628: FRASER | F628: GHAZI | I628: DELRE | K628: WEST | N628: PATERSON | Q628: BROWN
A629: NORTH BALLARAT | C629: G POLKINGHORNE | G629: MARTIN | I629: J POLKINGHORNE | M629: ADAMS | O629: MOLONEY | Q629: REID
A630: GOALKICKERS
A631: WILLIAMSTOWN | C631: DELRE 4 | F631: CHRISTOFORO 4 | J631: FORYS 2 | M631: McHARDY | P631: WALLACE | R631: GHAZI
A632: NORTH BALLARAT | C632: EDMONDS 3 | F632: CUTHBERTSON 3 | J632: T POLKINGHORNE 2 | N632: MARTIN 2 | Q632: DOHERTY | T632: RUYG | W632: FIELD
A634: WERRIBEE | C634: 3 | D634: 1 | E634: =(C634*6)+D634 -> 19 | G634: 4 | H634: 2 | I634: =(G634*6)+H634 -> 26 | K634: 9 | L634: 3 | M634: =(K634*6)+L634 -> 57 | O634: 10 | P634: 4 | Q634: =(O634*6)+P634 -> 64 | S634: Venue: SPRINGVALE
A635: SPRINGVALE | C635: 1 | D635: 0 | E635: =(C635*6)+D635 -> 6 | G635: 5 | H635: 2 | I635: =(G635*6)+H635 -> 32 | K635: 5 | L635: 5 | M635: =(K635*6)+L635 -> 35 | O635: 9 | P635: 6 | Q635: =(O635*6)+P635 -> 60
A636: BEST PLAYERS
A637: WERRIBEE | C637: PULI | F637: SPROULE | I637: CHURCHILL | L637: DYER | N637: KELLETT
A638: SPRINGVALE | C638: DELARUE | F638: SUTHERLAND | I638: FORD | L638: JEFFS | N638: SMITH
A639: GOALKICKERS
A640: WERRIBEE | C640: CAMILLIERI 2 | F640: AZIZ 2 | H640: C GOWANS | J640: J GOWANS | L640: CHURCHILL | O640: FROST | Q640: SATTERLEY | U640: PULI
A641: SPRINGVALE | C641: DELARUE 2 | F641: FORD 2 | H641: CLARK | J641: EVANS | L641: JOY | M641: SMITH | O641: WILLOUGHBY
A643: BYE | D643: BOX HILL
A645: ROUND 14 | D645: 11TH JULY | J645: WEATHER
D646: 1ST QTR | H646: 2ND QTR | L646: 3RD QTR | P646: FINAL | S646: Venue: BEACH ROAD
A647: SANDRINGHAM | C647: 3 | D647: 2 | E647: =(C647*6)+D647 -> 20 | G647: 7 | H647: 4 | I647: =(G647*6)+H647 -> 46 | K647: 8 | L647: 8 | M647: =(K647*6)+L647 -> 56 | O647: 12 | P647: 13 | Q647: =(O647*6)+P647 -> 85 | S647: UMPIRES | Z647: LADDER | AC647: ROUND | AE647: 14
A648: SPRINGVALE | C648: 3 | D648: 3 | E648: =(C648*6)+D648 -> 21 | G648: 6 | H648: 6 | I648: =(G648*6)+H648 -> 42 | K648: 8 | L648: 13 | M648: =(K648*6)+L648 -> 61 | O648: 10 | P648: 15 | Q648: =(O648*6)+P648 -> 75
A649: BEST PLAYERS | W649: TEAM | X649: B | Y649: W | Z649: L | AA649: D | AB649: FOR | AC649: AGST | AD649: % | AE649: PTS
A650: SANDRINGHAM | C650: CROUGH | F650: SAUTNER | I650: TEMPLETON | L650: HAYNES | O650: TREGEAR | Q650: RADFORD
A651: SPRINGVALE | C651: TAYLOR | F651: JEFFS | I651: SHEAHAN | L651: WARREN | O651: JOY | W651: WERRIBEE | X651: 1 | Y651: 12 | Z651: 1 | AA651: 0 | AB651: 1428 | AC651: 884 | AD651: =(AB651/AC651)*100 -> 161.53846153846155 | AE651: =(Y651*4)+(AA651*2) -> 48
A652: GOALKICKERS | W652: FRANKSTON | X652: 2 | Y652: 10 | Z652: 2 | AA652: 0 | AB652: 1166 | AC652: 810 | AD652: =(AB652/AC652)*100 -> 143.95061728395063 | AE652: =(Y652*4)+(AA652*2) -> 40
A653: SANDRINGHAM | C653: TEMPLETON 7 | F653: McKELLAR 2 | I653: MURRAY | K653: PHILLIPS | M653: RADFORD | W653: NORTH BALLARAT | X653: 1 | Y653: 8 | Z653: 4 | AA653: 1 | AB653: 990 | AC653: 964 | AD653: =(AB653/AC653)*100 -> 102.69709543568464 | AE653: =(Y653*4)+(AA653*2) -> 34
A654: SPRINGVALE | C654: SMITH 3 | F654: JEFFREY 2 | H654: JOY | I654: FORD | K654: O'BRIEN | M654: DELARUE | O654: SHIPP | W654: SPRINGVALE | X654: 1 | Y654: 8 | Z654: 5 | AA654: 0 | AB654: 1279 | AC654: 772 | AD654: =(AB654/AC654)*100 -> 165.67357512953367 | AE654: =(Y654*4)+(AA654*2) -> 32
W655: PRESTON | X655: 1 | Y655: 8 | Z655: 5 | AA655: 0 | AB655: 1036 | AC655: 1018 | AD655: =(AB655/AC655)*100 -> 101.76817288801571 | AE655: =(Y655*4)+(AA655*2) -> 32
A656: NORTH BALLARAT | C656: 5 | D656: 5 | E656: =(C656*6)+D656 -> 35 | G656: 6 | H656: 7 | I656: =(G656*6)+H656 -> 43 | K656: 6 | L656: 8 | M656: =(K656*6)+L656 -> 44 | O656: 6 | P656: 8 | Q656: =(O656*6)+P656 -> 44 | S656: Venue: NORTH BALLARAT | W656: WILLIAMSTOWN | X656: 1 | Y656: 7 | Z656: 6 | AA656: 0 | AB656: 1034 | AC656: 1048 | AD656: =(AB656/AC656)*100 -> 98.664122137404576 | AE656: =(Y656*4)+(AA656*2) -> 28
A657: PORT MELBOURNE | C657: 1 | D657: 0 | E657: =(C657*6)+D657 -> 6 | G657: 3 | H657: 5 | I657: =(G657*6)+H657 -> 23 | K657: 3 | L657: 5 | M657: =(K657*6)+L657 -> 23 | O657: 6 | P657: 8 | Q657: =(O657*6)+P657 -> 44
A658: BEST PLAYERS | W658: SANDRINGHAM | X658: 2 | Y658: 5 | Z658: 7 | AA658: 0 | AB658: 834 | AC658: 982 | AD658: =(AB658/AC658)*100 -> 84.928716904276996 | AE658: =(Y658*4)+(AA658*2) -> 20
A659: NORTH BALLARAT | C659: COX | F659: ADAMS | I659: G POLKINGHORNE | W659: PORT MELBOURNE | X659: 1 | Y659: 4 | Z659: 8 | AA659: 1 | AB659: 972 | AC659: 1085 | AD659: =(AB659/AC659)*100 -> 89.58525345622121 | AE659: =(Y659*4)+(AA659*2) -> 18
A660: PORT MELBOURNE | C660: SCHAEFER | F660: PICIAONE | I660: WHELAN | L660: CLOHESY | O660: GOODALE | Q660: CREDLIN | W660: BENDIGO | X660: 1 | Y660: 4 | Z660: 9 | AA660: 0 | AB660: 995 | AC660: 1227 | AD660: =(AB660/AC660)*100 -> 81.092094539527309 | AE660: =(Y660*4)+(AA660*2) -> 16
A661: GOALKICKERS | W661: COBURG | X661: 1 | Y661: 2 | Z661: 11 | AA661: 0 | AB661: 765 | AC661: 1316 | AD661: =(AB661/AC661)*100 -> 58.130699088145896 | AE661: =(Y661*4)+(AA661*2) -> 8
A662: NORTH BALLARAT | C662: CUTHBERTSON 3 | G662: RUYG | I662: T POLKINGHORNE | M662: CLARKE | W662: BOX HILL | X662: 2 | Y662: 1 | Z662: 11 | AA662: 0 | AB662: 845 | AC662: 1228 | AD662: =(AB662/AC662)*100 -> 68.811074918566774 | AE662: =(Y662*4)+(AA662*2) -> 4
A663: PORT MELBOURNE | C663: REYNOLDS 2 | F663: MADDEN 2 | I663: SCHAEFER | L663: CREDLIN
A665: PRESTON | C665: 2 | D665: 4 | E665: =(C665*6)+D665 -> 16 | G665: 7 | H665: 6 | I665: =(G665*6)+H665 -> 48 | K665: 10 | L665: 10 | M665: =(K665*6)+L665 -> 70 | O665: 11 | P665: 14 | Q665: =(O665*6)+P665 -> 80 | S665: Venue: PRESTON
A666: BOX HILL | C666: 1 | D666: 1 | E666: =(C666*6)+D666 -> 7 | G666: 4 | H666: 2 | I666: =(G666*6)+H666 -> 26 | K666: 6 | L666: 3 | M666: =(K666*6)+L666 -> 39 | O666: 8 | P666: 10 | Q666: =(O666*6)+P666 -> 58
A667: BEST PLAYERS
A668: PRESTON | C668: MAIORANA | F668: PASCOE | I668: KNIGHTS | L668: HABERMAN | O668: CLARKE | R668: BLAGROVE
A669: BOX HILL | C669: BELLO | F669: SLATER | I669: CROWLEY | L669: MURLEY | O669: HABERFIELD | R669: TRANQUILLI
A670: GOALKICKERS
A671: PRESTON | C671: HAYWOOD 2 | F671: KNIGHTS 2 | I671: PASCOE | K671: PLUNKETT | M671: HABERMAN | P671: ECCLES | R671: GRAY | T671: BOOKER | W671: S GRAINGER
A672: BOX HILL | C672: WILKINSON 2 | F672: HABERFIELD 2 | J672: T SIMMONDS | M672: SLATER | O672: CUNNINGHAM | R672: TRANQUILLI
D673: 12TH JULY | J673: WEATHER
A674: WILLIAMSTOWN | C674: 4 | D674: 2 | E674: =(C674*6)+D674 -> 26 | G674: 10 | H674: 8 | I674: =(G674*6)+H674 -> 68 | K674: 14 | L674: 11 | M674: =(K674*6)+L674 -> 95 | O674: 15 | P674: 19 | Q674: =(O674*6)+P674 -> 109 | S674: Venue: COBURG
A675: COBURG | C675: 0 | D675: 1 | E675: =(C675*6)+D675 -> 1 | G675: 1 | H675: 1 | I675: =(G675*6)+H675 -> 7 | K675: 3 | L675: 5 | M675: =(K675*6)+L675 -> 23 | O675: 7 | P675: 7 | Q675: =(O675*6)+P675 -> 49
A676: BEST PLAYERS
A677: WILLIAMSTOWN | C677: GHAZI | F677: FRASER | I677: BROWN | L677: LATTENSTEIN | O677: HOLLOW | Q677: CHRISTOFORO
A678: COBURG | C678: ALESSIO | F678: McLEOD | I678: McHARDY
A679: GOALKICKERS
A680: WILLIAMSTOWN | C680: CHRISTOFORO 3 | F680: McHARDY 2 | I680: FORYS 2 | K680: DELRE 2 | M680: GHAZI 2 | O680: HOLLOW 2 | R680: FRASER | U680: BROWN
A681: COBURG | C681: ALESSIO 4 | F681: CARROLL 2 | I681: CAPELLO
A683: WERRIBEE | C683: 5 | D683: 1 | E683: =(C683*6)+D683 -> 31 | G683: 11 | H683: 4 | I683: =(G683*6)+H683 -> 70 | K683: 16 | L683: 10 | M683: =(K683*6)+L683 -> 106 | O683: 20 | P683: 11 | Q683: =(O683*6)+P683 -> 131 | S683: Venue: WERRIBEE
A684: BENDIGO | C684: 2 | D684: 3 | E684: =(C684*6)+D684 -> 15 | G684: 6 | H684: 6 | I684: =(G684*6)+H684 -> 42 | K684: 7 | L684: 8 | M684: =(K684*6)+L684 -> 50 | O684: 13 | P684: 12 | Q684: =(O684*6)+P684 -> 90
A685: BEST PLAYERS
A686: WERRIBEE | C686: FAULKNER | F686: FROST | I686: CAMILLIERI | L686: SPROULE | O686: GOODEY | Q686: SATTERLEY
A687: BENDIGO | C687: ST CLAIR | F687: LANCASTER | I687: O'CALLAGHAN | L687: GORMAN | O687: SCHMIDT | Q687: LANGAN
A688: GOALKICKERS
A689: WERRIBEE | C689: AZIZ 5 | E689: CAMILLIERI 4 | H689: MURPHY 2 | J689: SATTERLEY 2 | M689: SAUNDERS 2 | P689: SHAW | R689: J GOWANS | V689: CHURCHILL | X689: FROST | Z689: KELLETT
A690: BENDIGO | C690: SCHMIDT 3 | F690: GORMAN 3 | I690: TOINTON 2
A692: BYE | D692: FRANKSTON
A694: ROUND 15 | D694: 18TH JULY | J694: WEATHER
D695: 1ST QTR | H695: 2ND QTR | L695: 3RD QTR | P695: FINAL | S695: Venue: SPRINGVALE
A696: FRANKSTON | C696: 3 | D696: 3 | E696: =(C696*6)+D696 -> 21 | G696: 6 | H696: 4 | I696: =(G696*6)+H696 -> 40 | K696: 11 | L696: 7 | M696: =(K696*6)+L696 -> 73 | O696: 15 | P696: 11 | Q696: =(O696*6)+P696 -> 101 | S696: UMPIRES | Z696: LADDER | AC696: ROUND | AE696: 15
A697: SPRINGVALE | C697: 3 | D697: 4 | E697: =(C697*6)+D697 -> 22 | G697: 6 | H697: 10 | I697: =(G697*6)+H697 -> 46 | K697: 9 | L697: 13 | M697: =(K697*6)+L697 -> 67 | O697: 13 | P697: 16 | Q697: =(O697*6)+P697 -> 94
A698: BEST PLAYERS | W698: TEAM | X698: B | Y698: W | Z698: L | AA698: D | AB698: FOR | AC698: AGST | AD698: % | AE698: PTS
A699: FRANKSTON | C699: SULLIVAN | F699: BURGMAN | I699: PICKERING | L699: BURNELL | O699: MOORE | Q699: MALLOY
A700: SPRINGVALE | C700: DWYER | F700: J CARROLL | I700: EVANS | L700: SMITH | O700: DELARUE | Q700: JOY | W700: WERRIBEE | X700: 1 | Y700: 13 | Z700: 1 | AA700: 0 | AB700: 1511 | AC700: 935 | AD700: =(AB700/AC700)*100 -> 161.6042780748663 | AE700: =(Y700*4)+(AA700*2) -> 52
A701: GOALKICKERS | W701: FRANKSTON | X701: 2 | Y701: 11 | Z701: 2 | AA701: 0 | AB701: 1267 | AC701: 904 | AD701: =(AB701/AC701)*100 -> 140.15486725663717 | AE701: =(Y701*4)+(AA701*2) -> 44
A702: FRANKSTON | C702: BURGMAN 4 | F702: S RYAN 4 | H702: PICKERING 3 | K702: BURNELL | M702: DAM CLARKE | P702: DAN CLARKE | S702: MEAD | W702: NORTH BALLARAT | X702: 1 | Y702: 8 | Z702: 5 | AA702: 1 | AB702: 1081 | AC702: 1067 | AD702: =(AB702/AC702)*100 -> 101.31208997188379 | AE702: =(Y702*4)+(AA702*2) -> 34
A703: SPRINGVALE | C703: EVANS 5 | F703: SMITH 4 | H703: DELARUE | J703: JOY | L703: SHAW | N703: TAYLOR | W703: SPRINGVALE | X703: 1 | Y703: 8 | Z703: 6 | AA703: 0 | AB703: 1373 | AC703: 873 | AD703: =(AB703/AC703)*100 -> 157.2737686139748 | AE703: =(Y703*4)+(AA703*2) -> 32
D704: 19TH JULY | J704: WEATHER | W704: PRESTON | X704: 2 | Y704: 8 | Z704: 5 | AA704: 0 | AB704: 1036 | AC704: 1018 | AD704: =(AB704/AC704)*100 -> 101.76817288801571 | AE704: =(Y704*4)+(AA704*2) -> 32
A705: PORT MELBOURNE | C705: 7 | D705: 4 | E705: =(C705*6)+D705 -> 46 | G705: 13 | H705: 7 | I705: =(G705*6)+H705 -> 85 | K705: 17 | L705: 8 | M705: =(K705*6)+L705 -> 110 | O705: 25 | P705: 12 | Q705: =(O705*6)+P705 -> 162 | S705: Venue: PORT MELBOURNE | W705: WILLIAMSTOWN | X705: 1 | Y705: 7 | Z705: 7 | AA705: 0 | AB705: 1085 | AC705: 1131 | AD705: =(AB705/AC705)*100 -> 95.932802829354557 | AE705: =(Y705*4)+(AA705*2) -> 28
A706: COBURG | C706: 0 | D706: 0 | E706: =(C706*6)+D706 -> 0 | G706: 0 | H706: 0 | I706: =(G706*6)+H706 -> 0 | K706: 1 | L706: 1 | M706: =(K706*6)+L706 -> 7 | O706: 6 | P706: 1 | Q706: =(O706*6)+P706 -> 37
A707: BEST PLAYERS | W707: SANDRINGHAM | X707: 2 | Y707: 6 | Z707: 7 | AA707: 0 | AB707: 917 | AC707: 1030 | AD707: =(AB707/AC707)*100 -> 89.029126213592235 | AE707: =(Y707*4)+(AA707*2) -> 24
A708: PORT MELBOURNE | C708: CREDLIN | F708: CLOHESY | I708: DOBELL | L708: GOODALE | O708: PICIAONE | R708: MORTON | W708: PORT MELBOURNE | X708: 1 | Y708: 5 | Z708: 8 | AA708: 1 | AB708: 1134 | AC708: 1122 | AD708: =(AB708/AC708)*100 -> 101.06951871657755 | AE708: =(Y708*4)+(AA708*2) -> 22
A709: COBURG | C709: RENNEX | F709: ALESSIO | I709: PEVERILL | W709: BENDIGO | X709: 1 | Y709: 4 | Z709: 10 | AA709: 0 | AB709: 1043 | AC709: 1310 | AD709: =(AB709/AC709)*100 -> 79.618320610687022 | AE709: =(Y709*4)+(AA709*2) -> 16
A710: GOALKICKERS | L710: CLOHESY | N710: DWYER | P710: MADDEN | R710: PICIAONE | W710: BOX HILL | X710: 2 | Y710: 2 | Z710: 11 | AA710: 0 | AB710: 948 | AC710: 1319 | AD710: =(AB710/AC710)*100 -> 71.872630780894625 | AE710: =(Y710*4)+(AA710*2) -> 8
A711: PORT MELBOURNE | C711: CREDLIN 10 | F711: CHEEL 3 | H711: JAMES 3 | J711: BAUMGARTNER 2 | N711: DOBELL 2 | P711: BUTTERWORTH | W711: COBURG | X711: 1 | Y711: 2 | Z711: 12 | AA711: 0 | AB711: 802 | AC711: 1478 | AD711: =(AB711/AC711)*100 -> 54.262516914749661 | AE711: =(Y711*4)+(AA711*2) -> 8
A712: COBURG | C712: RENNEX 2 | F712: ALESSIO | H712: CARROLL | J712: WALKER | L712: CAPPELLO
A714: SANDRINGHAM | C714: 4 | D714: 4 | E714: =(C714*6)+D714 -> 28 | G714: 6 | H714: 5 | I714: =(G714*6)+H714 -> 41 | K714: 9 | L714: 12 | M714: =(K714*6)+L714 -> 66 | O714: 11 | P714: 17 | Q714: =(O714*6)+P714 -> 83 | S714: Venue: BENDIGO
A715: BENDIGO | C715: 2 | D715: 1 | E715: =(C715*6)+D715 -> 13 | G715: 3 | H715: 3 | I715: =(G715*6)+H715 -> 21 | K715: 4 | L715: 3 | M715: =(K715*6)+L715 -> 27 | O715: 7 | P715: 6 | Q715: =(O715*6)+P715 -> 48
A716: BEST PLAYERS
A717: SANDRINGHAM | C717: ARGUS | F717: JOHNSTONE | I717: BAXTER | K717: MACGEORGE | N717: CLARKSON | Q717: NUGENT
A718: BENDIGO | C718: ST CLAIR | F718: LANCASTER | I718: O'SHANNESSY | L718: CURSIO | N718: DURIE | Q718: MARTIN
A719: GOALKICKERS
A720: SANDRINGHAM | C720: JOHNSTONE 3 | F720: SCOTT-BRANAGAN 2 | J720: MURRAY 2 | M720: CLARKSON | P720: CROUGH | R720: BAXTER | U720: KENNEDY
A721: BENDIGO | C721: BUTLER 2 | F721: TOINTON | I721: DURIE | K721: RUDD | M721: ORR | O721: LANGAN
A723: BOX HILL | C723: 5 | D723: 5 | E723: =(C723*6)+D723 -> 35 | G723: 8 | H723: 7 | I723: =(G723*6)+H723 -> 55 | K723: 13 | L723: 10 | M723: =(K723*6)+L723 -> 88 | O723: 15 | P723: 13 | Q723: =(O723*6)+P723 -> 103 | S723: Venue: BOX HILL
A724: NORTH BALLARAT | C724: 1 | D724: 2 | E724: =(C724*6)+D724 -> 8 | G724: 5 | H724: 4 | I724: =(G724*6)+H724 -> 34 | K724: 8 | L724: 8 | M724: =(K724*6)+L724 -> 56 | O724: 13 | P724: 13 | Q724: =(O724*6)+P724 -> 91
A725: BEST PLAYERS
A726: BOX HILL | C726: WILKINSON | F726: NICHOL | H726: CROWLEY | K726: McCARTNEY | N726: JENKINS | Q726: SLATER
A727: NORTH BALLARAT | C727: CUTHBERTSON | F727: G POLKINGHORNE | J727: EDMONDS | M727: PEAKE
A728: GOALKICKERS
A729: BOX HILL | C729: WILKINSON 6 | F729: SLATER 4 | I729: TRANQUILLI 2 | M729: AIELLO 2 | P729: ROBINSON
A730: NORTH BALLARAT | C730: CUTHBERTSON 5 | G730: EDMONDS 3 | J730: REID | L730: PARTINGTON | O730: CLARKE | Q730: G POLKINGHORNE | V730: T POLKINGHORNE
A732: WERRIBEE | C732: 3 | D732: 10 | E732: =(C732*6)+D732 -> 28 | G732: 5 | H732: 13 | I732: =(G732*6)+H732 -> 43 | K732: 8 | L732: 16 | M732: =(K732*6)+L732 -> 64 | O732: 11 | P732: 17 | Q732: =(O732*6)+P732 -> 83 | S732: Venue: WILLIAMSTOWN
A733: WILLIAMSTOWN | C733: 1 | D733: 1 | E733: =(C733*6)+D733 -> 7 | G733: 4 | H733: 8 | I733: =(G733*6)+H733 -> 32 | K733: 4 | L733: 11 | M733: =(K733*6)+L733 -> 35 | O733: 6 | P733: 15 | Q733: =(O733*6)+P733 -> 51
A734: BEST PLAYERS
A735: WERRIBEE | C735: AZIZ | F735: ATKINS | I735: FROST | K735: PULI | N735: FAULKNER | Q735: CHURCHILL
A736: WILLIAMSTOWN | C736: GRIFFIN | F736: LAMBROPOULOS | I736: KERRY | K736: FRASER | N736: McHARDY | Q736: BROWN
A737: GOALKICKERS
A738: WERRIBEE | C738: AZIZ 4 | F738: J GOWANS 2 | I738: C GOWANS 2 | L738: PULI | N738: SAUNDERS | Q738: SHAW
A739: WILLIAMSTOWN | C739: CHRISTOFORO 2 | G739: WALLACE | I739: GHAZI | K739: DELRE | M739: LAMBROPOULOS
A741: BYE | D741: PRESTON
A743: ROUND 16 | D743: 25TH JULY | J743: WEATHER
D744: 1ST QTR | H744: 2ND QTR | L744: 3RD QTR | P744: FINAL | S744: NORTH BALLARAT
A745: NORTH BALLARAT | C745: 2 | D745: 1 | E745: =(C745*6)+D745 -> 13 | G745: 4 | H745: 5 | I745: =(G745*6)+H745 -> 29 | K745: 5 | L745: 10 | M745: =(K745*6)+L745 -> 40 | O745: 10 | P745: 14 | Q745: =(O745*6)+P745 -> 74 | S745: UMPIRES | Z745: LADDER | AC745: ROUND | AE745: 16
A746: PRESTON | C746: 1 | D746: 4 | E746: =(C746*6)+D746 -> 10 | G746: 3 | H746: 8 | I746: =(G746*6)+H746 -> 26 | K746: 6 | L746: 12 | M746: =(K746*6)+L746 -> 48 | O746: 6 | P746: 14 | Q746: =(O746*6)+P746 -> 50
A747: BEST PLAYERS | W747: TEAM | X747: B | Y747: W | Z747: L | AA747: D | AB747: FOR | AC747: AGST | AD747: % | AE747: PTS
A748: NORTH BALLARAT | C748: PICKFORD | F748: G POLKINGHORNE | J748: REID | L748: CLARKE | N748: RUYG | P748: T POLKINGHORNE
A749: PRESTON | C749: HAYDOCK | F749: GRAY | H749: PASCOE | K749: CARACELLA | N749: HABERMAN | W749: WERRIBEE | X749: 2 | Y749: 13 | Z749: 1 | AA749: 0 | AB749: 1511 | AC749: 935 | AD749: =(AB749/AC749)*100 -> 161.6042780748663 | AE749: =(Y749*4)+(AA749*2) -> 52
A750: GOALKICKERS | O750: PICKFORD | Q750: EDMONDS | W750: FRANKSTON | X750: 2 | Y750: 12 | Z750: 2 | AA750: 0 | AB750: 1431 | AC750: 997 | AD750: =(AB750/AC750)*100 -> 143.530591775326 | AE750: =(Y750*4)+(AA750*2) -> 48
A751: NORTH BALLARAT | C751: CLARKE 2 | F751: CUTHBERTSON | I751: L MAHER | K751: MARTIN | M751: REID | O751: COX | P751: T POLKINGHORNE | W751: NORTH BALLARAT | X751: 1 | Y751: 9 | Z751: 5 | AA751: 1 | AB751: 1155 | AC751: 1117 | AD751: =(AB751/AC751)*100 -> 103.40196956132498 | AE751: =(Y751*4)+(AA751*2) -> 38
A752: PRESTON | C752: ECCLES 3 | F752: HAYWOOD | I752: CLARKE | K752: GRAY | W752: SPRINGVALE | X752: 2 | Y752: 8 | Z752: 6 | AA752: 0 | AB752: 1373 | AC752: 873 | AD752: =(AB752/AC752)*100 -> 157.2737686139748 | AE752: =(Y752*4)+(AA752*2) -> 32
D753: 26TH JULY | J753: WEATHER | W753: PRESTON | X753: 2 | Y753: 8 | Z753: 6 | AA753: 0 | AB753: 1086 | AC753: 1092 | AD753: =(AB753/AC753)*100 -> 99.45054945054946 | AE753: =(Y753*4)+(AA753*2) -> 32
A754: BOX HILL | C754: 2 | D754: 5 | E754: =(C754*6)+D754 -> 17 | G754: 6 | H754: 6 | I754: =(G754*6)+H754 -> 42 | K754: 8 | L754: 9 | M754: =(K754*6)+L754 -> 57 | O754: 13 | P754: 14 | Q754: =(O754*6)+P754 -> 92 | S754: Venue: COBURG | W754: WILLIAMSTOWN | X754: 1 | Y754: 7 | Z754: 8 | AA754: 0 | AB754: 1177 | AC754: 1229 | AD754: =(AB754/AC754)*100 -> 95.768917819365342 | AE754: =(Y754*4)+(AA754*2) -> 28
A755: COBURG | C755: 0 | D755: 0 | E755: =(C755*6)+D755 -> 0 | G755: 4 | H755: 1 | I755: =(G755*6)+H755 -> 25 | K755: 10 | L755: 1 | M755: =(K755*6)+L755 -> 61 | O755: 10 | P755: 1 | Q755: =(O755*6)+P755 -> 61
A756: BEST PLAYERS | W756: SANDRINGHAM | X756: 2 | Y756: 7 | Z756: 7 | AA756: 0 | AB756: 1015 | AC756: 1122 | AD756: =(AB756/AC756)*100 -> 90.463458110516939 | AE756: =(Y756*4)+(AA756*2) -> 28
A757: BOX HILL | C757: CROWLEY | F757: ROWE | I757: NICHOL | L757: GRIFFIN | O757: SIMMONDS | R757: ROBINSON | W757: PORT MELBOURNE | X757: 2 | Y757: 5 | Z757: 8 | AA757: 1 | AB757: 1134 | AC757: 1122 | AD757: =(AB757/AC757)*100 -> 101.06951871657755 | AE757: =(Y757*4)+(AA757*2) -> 22
A758: COBURG | C758: ALESSIO | F758: PEVERILL | I758: CONDON | L758: McGUIRE | O758: McLEOD | R758: BUDGE | W758: BENDIGO | X758: 1 | Y758: 4 | Z758: 11 | AA758: 0 | AB758: 1136 | AC758: 1474 | AD758: =(AB758/AC758)*100 -> 77.06919945725916 | AE758: =(Y758*4)+(AA758*2) -> 16
A759: GOALKICKERS | W759: BOX HILL | X759: 2 | Y759: 3 | Z759: 11 | AA759: 0 | AB759: 1040 | AC759: 1380 | AD759: =(AB759/AC759)*100 -> 75.362318840579718 | AE759: =(Y759*4)+(AA759*2) -> 12
A760: BOX HILL | C760: BOURKE 3 | F760: GRIFFIN 3 | H760: SLATER 2 | J760: MURLEY | L760: CROWLEY | N760: ROWE | P760: SIMMONDS | S760: BELLO | W760: COBURG | X760: 1 | Y760: 2 | Z760: 13 | AA760: 0 | AB760: 863 | AC760: 1570 | AD760: =(AB760/AC760)*100 -> 54.968152866242036 | AE760: =(Y760*4)+(AA760*2) -> 8
A761: COBURG | C761: ALESSIO 5 | F761: PEVERILL 4 | I761: McGUIRE
A763: SANDRINGHAM | C763: 5 | D763: 6 | E763: =(C763*6)+D763 -> 36 | G763: 8 | H763: 9 | I763: =(G763*6)+H763 -> 57 | K763: 11 | L763: 13 | M763: =(K763*6)+L763 -> 79 | O763: 13 | P763: 20 | Q763: =(O763*6)+P763 -> 98 | S763: Venue: BEACH ROAD
A764: WILLIAMSTOWN | C764: 6 | D764: 1 | E764: =(C764*6)+D764 -> 37 | G764: 7 | H764: 5 | I764: =(G764*6)+H764 -> 47 | K764: 12 | L764: 7 | M764: =(K764*6)+L764 -> 79 | O764: 14 | P764: 8 | Q764: =(O764*6)+P764 -> 92
A765: BEST PLAYERS
A766: SANDRINGHAM | C766: CROUGH | F766: B OAKLEY | I766: L OAKLEY | L766: MACGEORGE | O766: KENNEDY | R766: MITCHELSON
A767: WILLIAMSTOWN | C767: DELRE | F767: CHRISTOFORO | I767: GRIFFIN | L767: McHARDY | O767: PATERSON
A768: GOALKICKERS
A769: SANDRINGHAM | C769: B OAKLEY 4 | F769: L OAKLEY 4 | I769: MURRAY | K769: CLARKSON | M769: HAYNES | O769: HAYWARD | Q769: KENNEDY
A770: WILLIAMSTOWN | C770: DELRE 6 | F770: CHRISTOFORO 5 | J770: GHAZI | L770: ZAVALAS | N770: LAMBROPOULOS
A772: FRANKSTON | C772: 6 | D772: 2 | E772: =(C772*6)+D772 -> 38 | G772: 10 | H772: 5 | I772: =(G772*6)+H772 -> 65 | K772: 19 | L772: 10 | M772: =(K772*6)+L772 -> 124 | O772: 25 | P772: 14 | Q772: =(O772*6)+P772 -> 164 | S772: Venue: FRANKSTON
A773: BENDIGO | C773: 2 | D773: 3 | E773: =(C773*6)+D773 -> 15 | G773: 5 | H773: 9 | I773: =(G773*6)+H773 -> 39 | K773: 7 | L773: 13 | M773: =(K773*6)+L773 -> 55 | O773: 13 | P773: 15 | Q773: =(O773*6)+P773 -> 93
A774: BEST PLAYERS
A775: FRANKSTON | C775: SULLIVAN | F775: MOORE | I775: CORRIGAN | L775: FREEMAN | O775: BOWEY | R775: MALLOY
A776: BENDIGO | C776: WHITSED | F776: PASCOE | I776: LANCASTER | L776: LANGAN | O776: TOINTON
A777: GOALKICKERS | S777: SULLIVAN
A778: FRANKSTON | C778: PICKERING 3 | F778: WEBB 3 | H778: BOWEY 3 | J778: W GEORGE 3 | M778: MEAD 2 | O778: MOORE 2 | Q778: BURNELL 2 | T778: S RYAN 2 | X778: BURGMAN | AA778: MALLOY | AC778: HOPGOOD | AF778: CORRIGAN
A779: BENDIGO | C779: LANCASTER 3 | F779: STEVENS 2 | I779: SLATER 2 | L779: LANGAN | N779: MARSHALL | Q779: RUDD | S779: SCHMIDT | W779: PASCOE | X779: DURIE
A781: BYE | D781: PORT MELBOURNE | H781: SPRINGVALE | K781: WERRIBEE
A783: ROUND 17 | D783: 1ST AUGUST | J783: WEATHER
D784: 1ST QTR | H784: 2ND QTR | L784: 3RD QTR | P784: FINAL | S784: Venue: WILLIAMSTOWN
A785: FRANKSTON | C785: 1 | D785: 1 | E785: =(C785*6)+D785 -> 7 | G785: 9 | H785: 4 | I785: =(G785*6)+H785 -> 58 | K785: 14 | L785: 6 | M785: =(K785*6)+L785 -> 90 | O785: 15 | P785: 8 | Q785: =(O785*6)+P785 -> 98 | S785: UMPIRES | Z785: LADDER | AC785: ROUND | AE785: 17
A786: WILLIAMSTOWN | C786: 6 | D786: 1 | E786: =(C786*6)+D786 -> 37 | G786: 8 | H786: 2 | I786: =(G786*6)+H786 -> 50 | K786: 9 | L786: 5 | M786: =(K786*6)+L786 -> 59 | O786: 13 | P786: 9 | Q786: =(O786*6)+P786 -> 87
A787: BEST PLAYERS | W787: TEAM | X787: B | Y787: W | Z787: L | AA787: D | AB787: FOR | AC787: AGST | AD787: % | AE787: PTS
A788: FRANKSTON | C788: MALLOY | F788: SULLIVAN | I788: MEAD | K788: WEBB | N788: DAN CLARKE | Q788: MOORE
A789: WILLIAMSTOWN | C789: FORYS | F789: BROWN | I789: GHAZI | K789: EAMES | N789: FRASER | Q789: LATTENSTEIN | W789: WERRIBEE | X789: 2 | Y789: 13 | Z789: 2 | AA789: 0 | AB789: 1579 | AC789: 1018 | AD789: =(AB789/AC789)*100 -> 155.10805500982318 | AE789: =(Y789*4)+(AA789*2) -> 52
A790: GOALKICKERS | W790: FRANKSTON | X790: 2 | Y790: 13 | Z790: 2 | AA790: 0 | AB790: 1529 | AC790: 1084 | AD790: =(AB790/AC790)*100 -> 141.05166051660515 | AE790: =(Y790*4)+(AA790*2) -> 52
A791: FRANKSTON | C791: WEBB 6 | E791: BOWEY 2 | G791: MALLOY 2 | J791: SCOTT | L791: PICKERING | N791: MACKAY | P791: MOORE | R791: BURGMAN | W791: NORTH BALLARAT | X791: 2 | Y791: 9 | Z791: 5 | AA791: 1 | AB791: 1155 | AC791: 1117 | AD791: =(AB791/AC791)*100 -> 103.40196956132498 | AE791: =(Y791*4)+(AA791*2) -> 38
A792: WILLIAMSTOWN | C792: FORYS 6 | F792: DELRE 2 | H792: CARRICK | J792: LAMBROPOULOS | N792: BROWN | P792: DOOLEY | R792: HOLLOW | W792: SPRINGVALE | X792: 2 | Y792: 9 | Z792: 6 | AA792: 0 | AB792: 1479 | AC792: 918 | AD792: =(AB792/AC792)*100 -> 161.11111111111111 | AE792: =(Y792*4)+(AA792*2) -> 36
W793: PRESTON | X793: 2 | Y793: 9 | Z793: 6 | AA793: 0 | AB793: 1138 | AC793: 1123 | AD793: =(AB793/AC793)*100 -> 101.33570792520035 | AE793: =(Y793*4)+(AA793*2) -> 36
A794: BOX HILL | C794: 2 | D794: 5 | E794: =(C794*6)+D794 -> 17 | G794: 8 | H794: 5 | I794: =(G794*6)+H794 -> 53 | K794: 11 | L794: 9 | M794: =(K794*6)+L794 -> 75 | O794: 12 | P794: 11 | Q794: =(O794*6)+P794 -> 83 | S794: Venue: BOX HILL | W794: SANDRINGHAM | X794: 2 | Y794: 8 | Z794: 7 | AA794: 0 | AB794: 1070 | AC794: 1147 | AD794: =(AB794/AC794)*100 -> 93.286835222319098 | AE794: =(Y794*4)+(AA794*2) -> 32
A795: WERRIBEE | C795: 3 | D795: 4 | E795: =(C795*6)+D795 -> 22 | G795: 6 | H795: 8 | I795: =(G795*6)+H795 -> 44 | K795: 8 | L795: 11 | M795: =(K795*6)+L795 -> 59 | O795: 9 | P795: 14 | Q795: =(O795*6)+P795 -> 68
A796: BEST PLAYERS | W796: WILLIAMSTOWN | X796: 1 | Y796: 7 | Z796: 9 | AA796: 0 | AB796: 1264 | AC796: 1327 | AD796: =(AB796/AC796)*100 -> 95.252449133383578 | AE796: =(Y796*4)+(AA796*2) -> 28
A797: BOX HILL | C797: CROWLEY | F797: TRANQUILLI | I797: NICHOL | L797: BELLO | N797: McCARTNEY | Q797: JENKINS | W797: PORT MELBOURNE | X797: 2 | Y797: 5 | Z797: 9 | AA797: 1 | AB797: 1159 | AC797: 1177 | AD797: =(AB797/AC797)*100 -> 98.470688190314362 | AE797: =(Y797*4)+(AA797*2) -> 22
A798: WERRIBEE | C798: FROST | F798: KELLETT | I798: REARDON | L798: SPROULE | N798: PULI | Q798: CHURCHILL | W798: BOX HILL | X798: 2 | Y798: 4 | Z798: 11 | AA798: 0 | AB798: 1123 | AC798: 1448 | AD798: =(AB798/AC798)*100 -> 77.555248618784532 | AE798: =(Y798*4)+(AA798*2) -> 16
A799: GOALKICKERS | W799: BENDIGO | X799: 1 | Y799: 4 | Z799: 12 | AA799: 0 | AB799: 1181 | AC799: 1580 | AD799: =(AB799/AC799)*100 -> 74.74683544303798 | AE799: =(Y799*4)+(AA799*2) -> 16
A800: BOX HILL | C800: ROBINSON 3 | F800: WILKINSON 2 | I800: TRANQUILLI 2 | L800: SLATER 2 | O800: BOURKE 2 | R800: CROWLEY | W800: COBURG | X800: 1 | Y800: 2 | Z800: 14 | AA800: 0 | AB800: 894 | AC800: 1622 | AD800: =(AB800/AC800)*100 -> 55.117139334155361 | AE800: =(Y800*4)+(AA800*2) -> 8
A801: WERRIBEE | C801: REARDON 4 | F801: SHAW 3 | I801: J GOWANS | L801: FROST
A803: PRESTON | C803: 3 | D803: 0 | E803: =(C803*6)+D803 -> 18 | G803: 3 | H803: 1 | I803: =(G803*6)+H803 -> 19 | K803: 6 | L803: 3 | M803: =(K803*6)+L803 -> 39 | O803: 8 | P803: 4 | Q803: =(O803*6)+P803 -> 52 | S803: Venue: PRESTON
A804: COBURG | C804: 1 | D804: 3 | E804: =(C804*6)+D804 -> 9 | G804: 1 | H804: 5 | I804: =(G804*6)+H804 -> 11 | K804: 3 | L804: 5 | M804: =(K804*6)+L804 -> 23 | O804: 4 | P804: 7 | Q804: =(O804*6)+P804 -> 31
A805: BEST PLAYERS
A806: PRESTON | C806: HAYDOCK | F806: MARTELLO | I806: CARACELLA | L806: HABERMAN | O806: PASCOE | Q806: AIELLO
A807: COBURG | C807: PEEL | F807: DUNCAN | I807: McHARDY | L807: KELLY | O807: CONDON | Q807: McLEOD
A808: GOALKICKERS
A809: PRESTON | C809: CARACELLA 2 | F809: S GRAINGER 2 | I809: MARTELLO | L809: PLUNKETT | O809: PASCOE | Q809: HABERMAN
A810: COBURG | C810: PEEL 2 | F810: DUNCAN | I810: ALESSIO
D811: 2ND AUGUST | J811: WEATHER
A812: SANDRINGHAM | C812: 2 | D812: 0 | E812: =(C812*6)+D812 -> 12 | G812: 2 | H812: 0 | I812: =(G812*6)+H812 -> 12 | K812: 5 | L812: 2 | M812: =(K812*6)+L812 -> 32 | O812: 8 | P812: 7 | Q812: =(O812*6)+P812 -> 55 | S812: Venue: PORT MELBOURNE
A813: PORT MELBOURNE | C813: 1 | D813: 2 | E813: =(C813*6)+D813 -> 8 | G813: 3 | H813: 3 | I813: =(G813*6)+H813 -> 21 | K813: 3 | L813: 6 | M813: =(K813*6)+L813 -> 24 | O813: 3 | P813: 7 | Q813: =(O813*6)+P813 -> 25
A814: BEST PLAYERS
A815: SANDRINGHAM | C815: MITCHELSON | F815: CROUGH | I815: CLARKSON | L815: JOHNSTONE | O815: ROBINS | Q815: HAYWARD
A816: PORT MELBOURNE | C816: CHEEL | F816: PICIAONE | I816: HOLLOW | L816: CLOHESY | O816: SCHAEFER | Q816: GOODALE
A817: GOALKICKERS
A818: SANDRINGHAM | C818: TEMPLETON 3 | F818: BAXTER 2 | I818: HAYNES 2 | L818: SCOTT-BRANAGAN
A819: PORT MELBOURNE | C819: BALLANTYNE | F819: CHEEL | H819: JAMES
A821: SPRINGVALE | C821: 5 | D821: 1 | E821: =(C821*6)+D821 -> 31 | G821: 10 | H821: 2 | I821: =(G821*6)+H821 -> 62 | K821: 13 | L821: 5 | M821: =(K821*6)+L821 -> 83 | O821: 16 | P821: 10 | Q821: =(O821*6)+P821 -> 106 | S821: Venue: BENDIGO
A822: BENDIGO | C822: 1 | D822: 1 | E822: =(C822*6)+D822 -> 7 | G822: 5 | H822: 2 | I822: =(G822*6)+H822 -> 32 | K822: 5 | L822: 2 | M822: =(K822*6)+L822 -> 32 | O822: 7 | P822: 3 | Q822: =(O822*6)+P822 -> 45
A823: BEST PLAYERS
A824: SPRINGVALE | C824: SHIPP | F824: SHAW | I824: CAPLES | L824: J CARROLL | O824: JEFFS | Q824: D CARROLL
A825: BENDIGO | C825: LANCASTER | F825: WHITSED | I825: MARTIN | L825: STEVENS | O825: ELSUM
A826: GOALKICKERS
A827: SPRINGVALE | C827: SMITH 4 | E827: CAPLES 4 | G827: SHAW 2 | I827: J CARROLL | L827: D CARROLL | N827: WOODMAN | Q827: SHIPP | S827: SHERRY | V827: LITTLE
A828: BENDIGO | C828: STEVENS 2 | F828: SCHMIDT | I828: DURIE | K828: R LANGAN | N828: O'CALLAGHAN
A830: BYE | D830: NORTH BALLARAT
A832: ROUND 18 | D832: 8TH AUGUST | J832: WEATHER
D833: 1ST QTR | H833: 2ND QTR | L833: 3RD QTR | P833: FINAL | S833: Venue: SPRINGVALE
A834: SPRINGVALE | C834: 7 | D834: 3 | E834: =(C834*6)+D834 -> 45 | G834: 13 | H834: 4 | I834: =(G834*6)+H834 -> 82 | K834: 18 | L834: 10 | M834: =(K834*6)+L834 -> 118 | O834: 23 | P834: 13 | Q834: =(O834*6)+P834 -> 151 | S834: UMPIRES | Z834: LADDER | AC834: ROUND | AE834: 18
A835: WILLIAMSTOWN | C835: 2 | D835: 0 | E835: =(C835*6)+D835 -> 12 | G835: 5 | H835: 6 | I835: =(G835*6)+H835 -> 36 | K835: 9 | L835: 7 | M835: =(K835*6)+L835 -> 61 | O835: 15 | P835: 8 | Q835: =(O835*6)+P835 -> 98
A836: BEST PLAYERS | W836: TEAM | X836: B | Y836: W | Z836: L | AA836: D | AB836: FOR | AC836: AGST | AD836: % | AE836: PTS
A837: SPRINGVALE | C837: DELARUE | F837: CLARK | I837: SMITH | L837: D CARROLL | O837: SHIPP | Q837: KNIGHT
A838: WILLIAMSTOWN | C838: DELRE | F838: HOLLOW | I838: ZAVALAS | L838: BROWN | W838: WERRIBEE | X838: 2 | Y838: 14 | Z838: 2 | AA838: 0 | AB838: 1714 | AC838: 1100 | AD838: =(AB838/AC838)*100 -> 155.81818181818181 | AE838: =(Y838*4)+(AA838*2) -> 56
A839: GOALKICKERS | N839: EVANS | P839: FORD | R839: KNIGHT | W839: FRANKSTON | X839: 2 | Y839: 14 | Z839: 2 | AA839: 0 | AB839: 1613 | AC839: 1147 | AD839: =(AB839/AC839)*100 -> 140.62772449869223 | AE839: =(Y839*4)+(AA839*2) -> 56
A840: SPRINGVALE | C840: SMITH 7 | E840: DELARUE 3 | H840: CLARK 2 | J840: JEFFREY 2 | L840: SHAW 2 | N840: SHERRY 2 | P840: D CARROLL | S840: DOWSETT | W840: NORTH BALLARAT | X840: 2 | Y840: 10 | Z840: 5 | AA840: 1 | AB840: 1301 | AC840: 1168 | AD840: =(AB840/AC840)*100 -> 111.38698630136987 | AE840: =(Y840*4)+(AA840*2) -> 42
A841: WILLIAMSTOWN | C841: DELRE 4 | E841: ZAVALAS 4 | H841: FORYS 2 | J841: FRASER | L841: HORE | N841: BROWN | P841: CHRISTOFORO | S841: RAILTON | W841: SPRINGVALE | X841: 2 | Y841: 10 | Z841: 6 | AA841: 0 | AB841: 1630 | AC841: 1016 | AD841: =(AB841/AC841)*100 -> 160.43307086614175 | AE841: =(Y841*4)+(AA841*2) -> 40
W842: PRESTON | X842: 2 | Y842: 9 | Z842: 7 | AA842: 0 | AB842: 1220 | AC842: 1257 | AD842: =(AB842/AC842)*100 -> 97.056483691328566 | AE842: =(Y842*4)+(AA842*2) -> 36
A843: NORTH BALLARAT | C843: 3 | D843: 2 | E843: =(C843*6)+D843 -> 20 | G843: 11 | H843: 6 | I843: =(G843*6)+H843 -> 72 | K843: 16 | L843: 8 | M843: =(K843*6)+L843 -> 104 | O843: 22 | P843: 14 | Q843: =(O843*6)+P843 -> 146 | S843: Venue: COBURG | W843: SANDRINGHAM | X843: 2 | Y843: 8 | Z843: 8 | AA843: 0 | AB843: 1154 | AC843: 1245 | AD843: =(AB843/AC843)*100 -> 92.690763052208837 | AE843: =(Y843*4)+(AA843*2) -> 32
A844: COBURG | C844: 4 | D844: 2 | E844: =(C844*6)+D844 -> 26 | G844: 4 | H844: 2 | I844: =(G844*6)+H844 -> 26 | K844: 7 | L844: 2 | M844: =(K844*6)+L844 -> 44 | O844: 8 | P844: 3 | Q844: =(O844*6)+P844 -> 51
A845: BEST PLAYERS | W845: WILLIAMSTOWN | X845: 1 | Y845: 7 | Z845: 10 | AA845: 0 | AB845: 1362 | AC845: 1478 | AD845: =(AB845/AC845)*100 -> 92.151556156968866 | AE845: =(Y845*4)+(AA845*2) -> 28
A846: NORTH BALLARAT | C846: RUYG | E846: CLARKE | H846: PICKFORD | K846: J POLKINGHORNE | O846: T POLKINGHORNE | S846: REID | W846: PORT MELBOURNE | X846: 2 | Y846: 5 | Z846: 10 | AA846: 1 | AB846: 1222 | AC846: 1261 | AD846: =(AB846/AC846)*100 -> 96.907216494845358 | AE846: =(Y846*4)+(AA846*2) -> 22
A847: COBURG | C847: ALESSIO | E847: WILLOUGHBY | H847: McLEOD | K847: KOUTSOVASILIS | O847: PEEL | W847: BOX HILL | X847: 2 | Y847: 5 | Z847: 11 | AA847: 0 | AB847: 1221 | AC847: 1532 | AD847: =(AB847/AC847)*100 -> 79.699738903394262 | AE847: =(Y847*4)+(AA847*2) -> 20
A848: GOALKICKERS | H848: PARTINGTON | K848: PICKFORD | M848: PEAKE | O848: S MAHER | Q848: CUTHBERTSON | W848: BENDIGO | X848: 2 | Y848: 4 | Z848: 12 | AA848: 0 | AB848: 1181 | AC848: 1580 | AD848: =(AB848/AC848)*100 -> 74.74683544303798 | AE848: =(Y848*4)+(AA848*2) -> 16
A849: NORTH BALLARAT | C849: EDMONDS 4 | F849: McDONALD 3 | I849: REID 3 | K849: RUYG 2 | M849: L MAHER 2 | P849: EDWARDS 2 | S849: CLARKE | W849: COBURG | X849: 1 | Y849: 2 | Z849: 15 | AA849: 0 | AB849: 945 | AC849: 1768 | AD849: =(AB849/AC849)*100 -> 53.450226244343888 | AE849: =(Y849*4)+(AA849*2) -> 8
A850: COBURG | C850: ALESSIO 5 | F850: WILLOUGHBY | I850: PEVERILL | L850: HILL
D851: 9TH AUGUST | J851: WEATHER
A852: WERRIBEE | C852: 7 | D852: 2 | E852: =(C852*6)+D852 -> 44 | G852: 12 | H852: 4 | I852: =(G852*6)+H852 -> 76 | K852: 15 | L852: 12 | M852: =(K852*6)+L852 -> 102 | O852: 20 | P852: 15 | Q852: =(O852*6)+P852 -> 135 | S852: Venue: WERRIBEE
A853: PRESTON | C853: 1 | D853: 2 | E853: =(C853*6)+D853 -> 8 | G853: 6 | H853: 2 | I853: =(G853*6)+H853 -> 38 | K853: 9 | L853: 3 | M853: =(K853*6)+L853 -> 57 | O853: 13 | P853: 4 | Q853: =(O853*6)+P853 -> 82
A854: BEST PLAYERS
A855: WERRIBEE | C855: ATKINS | F855: PULI | I855: SPROULE | L855: CHURCHILL | O855: REARDON | Q855: SAUNDERS
A856: PRESTON | C856: PENN | F856: GROSSMAN | I856: AIELLO | L856: ZORZI | O856: HAYWOOD | Q856: GRAY
A857: GOALKICKERS
A858: WERRIBEE | C858: REARDON 7 | F858: SHAW 3 | H858: PULI 3 | J858: FROST 3 | L858: C GOWANS | O858: J GOWANS | Q858: SUTTON | S858: SMITH
A859: PRESTON | C859: GRAINGER 3 | F859: GRAY 3 | H859: PASCOE 2 | K859: McGREGOR 2 | N859: McDONOUGH 2 | Q859: HARRISON
A861: BOX HILL | C861: 2 | D861: 2 | E861: =(C861*6)+D861 -> 14 | G861: 7 | H861: 3 | I861: =(G861*6)+H861 -> 45 | K861: 10 | L861: 5 | M861: =(K861*6)+L861 -> 65 | O861: 15 | P861: 8 | Q861: =(O861*6)+P861 -> 98 | S861: Venue: BEACH ROAD
A862: SANDRINGHAM | C862: 3 | D862: 4 | E862: =(C862*6)+D862 -> 22 | G862: 8 | H862: 5 | I862: =(G862*6)+H862 -> 53 | K862: 9 | L862: 10 | M862: =(K862*6)+L862 -> 64 | O862: 12 | P862: 12 | Q862: =(O862*6)+P862 -> 84
A863: BEST PLAYERS
A864: BOX HILL | C864: ALLSOP | F864: WILKINSON | I864: CROWLEY | L864: BELLO | O864: GRIFFIN | R864: JENKINS
A865: SANDRINGHAM | C865: MACGEORGE | F865: MURRAY | I865: CROUGH | L865: TEMPLETON | O865: MITCHELSON | R865: D GRANT
A866: GOALKICKERS
A867: BOX HILL | C867: WILKINSON 6 | F867: JENKINS 2 | I867: ROBINSON 2 | L867: TRANQUILLI | O867: CROWLEY | Q867: COOK | S867: HARTIN | V867: ALLSOP
A868: SANDRINGHAM | C868: TEMPLETON 6 | F868: JOHNSTONE | I868: MURRAY | K868: BAXTER | M868: FRATER | O868: AMIET | Q868: OAKLEY
A870: FRANKSTON | C870: 2 | D870: 2 | E870: =(C870*6)+D870 -> 14 | G870: 4 | H870: 4 | I870: =(G870*6)+H870 -> 28 | K870: 8 | L870: 4 | M870: =(K870*6)+L870 -> 52 | O870: 13 | P870: 6 | Q870: =(O870*6)+P870 -> 84 | S870: Venue: FRANKSTON
A871: PORT MELBOURNE | C871: 2 | D871: 5 | E871: =(C871*6)+D871 -> 17 | G871: 2 | H871: 8 | I871: =(G871*6)+H871 -> 20 | K871: 4 | L871: 12 | M871: =(K871*6)+L871 -> 36 | O871: 8 | P871: 15 | Q871: =(O871*6)+P871 -> 63
A872: BEST PLAYERS
A873: FRANKSTON | C873: MALLOY | F873: MURRAY | I873: CHARLES | L873: BOWEY | N873: SULLIVAN | Q873: DAM CLARKE
A874: PORT MELBOURNE | C874: GOODALE | F874: SCHAEFER | I874: DOBELL | L874: BALLANTYNE | O874: HENDERSON | R874: HOLLOW
A875: GOALKICKERS
A876: FRANKSTON | C876: WEBB 2 | E876: S RYAN 2 | G876: MURRAY 2 | J876: DAM CLARKE 2 | N876: MEAD | P876: STRINGER | S876: BOWEY | V876: SULLIVAN | X876: KING
A877: PORT MELBOURNE | C877: TRENTEPOL 2 | F877: GOODALE 2 | I877: D'GIACOMA | L877: DOBELL | N877: DUANE | P877: McNAMARA
A879: BYE | D879: BENDIGO
A881: ROUND 19 | D881: 15TH AUGUST | J881: WEATHER
D882: 1ST QTR | H882: 2ND QTR | L882: 3RD QTR | P882: FINAL | S882: Venue: PORT MELBOURNE
A883: PORT MELBOURNE | C883: 0 | D883: 1 | E883: =(C883*6)+D883 -> 1 | G883: 6 | H883: 4 | I883: =(G883*6)+H883 -> 40 | K883: 9 | L883: 7 | M883: =(K883*6)+L883 -> 61 | O883: 12 | P883: 12 | Q883: =(O883*6)+P883 -> 84 | S883: UMPIRES | Z883: LADDER | AC883: ROUND | AE883: 19
A884: SPRINGVALE | C884: 3 | D884: 1 | E884: =(C884*6)+D884 -> 19 | G884: 6 | H884: 3 | I884: =(G884*6)+H884 -> 39 | K884: 8 | L884: 4 | M884: =(K884*6)+L884 -> 52 | O884: 9 | P884: 7 | Q884: =(O884*6)+P884 -> 61
A885: BEST PLAYERS | W885: TEAM | X885: B | Y885: W | Z885: L | AA885: D | AB885: FOR | AC885: AGST | AD885: % | AE885: PTS
A886: PORT MELBOURNE | C886: SCHAEFER | F886: CLOHESY | I886: BALLANTYNE | L886: HOLLOW | O886: GOODALE | R886: DOBELL
A887: SPRINGVALE | C887: SUTHERLAND | F887: KNIGHT | I887: CLARK | L887: SHIPP | O887: CAPLES | W887: WERRIBEE | X887: 2 | Y887: 15 | Z887: 2 | AA887: 0 | AB887: 1812 | AC887: 1132 | AD887: =(AB887/AC887)*100 -> 160.07067137809187 | AE887: =(Y887*4)+(AA887*2) -> 60
A888: GOALKICKERS | Q888: WEEDING | W888: FRANKSTON | X888: 2 | Y888: 15 | Z888: 2 | AA888: 0 | AB888: 1723 | AC888: 1252 | AD888: =(AB888/AC888)*100 -> 137.61980830670925 | AE888: =(Y888*4)+(AA888*2) -> 60
A889: PORT MELBOURNE | C889: VILLAROSA 3 | F889: D'GIACOMA 2 | I889: DOBELL 2 | L889: CAMERON | N889: CHEEL | P889: CLOHESY | R889: McNAMARA | W889: NORTH BALLARAT | X889: 2 | Y889: 10 | Z889: 6 | AA889: 1 | AB889: 1333 | AC889: 1266 | AD889: =(AB889/AC889)*100 -> 105.29225908372828 | AE889: =(Y889*4)+(AA889*2) -> 42
A890: SPRINGVALE | C890: SMITH 2 | F890: EVANS | H890: FORD | I890: JEFFREY | K890: KNIGHT | M890: NAGLE | O890: SHAW | Q890: WOODMAN | W890: SPRINGVALE | X890: 2 | Y890: 10 | Z890: 7 | AA890: 0 | AB890: 1691 | AC890: 1100 | AD890: =(AB890/AC890)*100 -> 153.72727272727275 | AE890: =(Y890*4)+(AA890*2) -> 40
D891: 16TH AUGUST | J891: WEATHER | W891: PRESTON | X891: 2 | Y891: 10 | Z891: 7 | AA891: 0 | AB891: 1306 | AC891: 1339 | AD891: =(AB891/AC891)*100 -> 97.535474234503354 | AE891: =(Y891*4)+(AA891*2) -> 40
A892: FRANKSTON | C892: 5 | D892: 3 | E892: =(C892*6)+D892 -> 33 | G892: 8 | H892: 5 | I892: =(G892*6)+H892 -> 53 | K892: 12 | L892: 7 | M892: =(K892*6)+L892 -> 79 | O892: 17 | P892: 8 | Q892: =(O892*6)+P892 -> 110 | S892: Venue: BOX HILL | W892: WILLIAMSTOWN | X892: 1 | Y892: 8 | Z892: 10 | AA892: 0 | AB892: 1446 | AC892: 1557 | AD892: =(AB892/AC892)*100 -> 92.870905587668602 | AE892: =(Y892*4)+(AA892*2) -> 32
A893: BOX HILL | C893: 3 | D893: 2 | E893: =(C893*6)+D893 -> 20 | G893: 8 | H893: 7 | I893: =(G893*6)+H893 -> 55 | K893: 10 | L893: 8 | M893: =(K893*6)+L893 -> 68 | O893: 16 | P893: 9 | Q893: =(O893*6)+P893 -> 105
A894: BEST PLAYERS | W894: SANDRINGHAM | X894: 2 | Y894: 8 | Z894: 9 | AA894: 0 | AB894: 1236 | AC894: 1331 | AD894: =(AB894/AC894)*100 -> 92.862509391435012 | AE894: =(Y894*4)+(AA894*2) -> 32
A895: FRANKSTON | C895: BOWEY | F895: AGNELLO | I895: MOORE | L895: MALLOY | N895: KING | Q895: SULLIVAN | W895: PORT MELBOURNE | X895: 2 | Y895: 6 | Z895: 10 | AA895: 1 | AB895: 1306 | AC895: 1322 | AD895: =(AB895/AC895)*100 -> 98.789712556732226 | AE895: =(Y895*4)+(AA895*2) -> 26
A896: BOX HILL | C896: DOUGLAS | F896: TRANQUILLI | I896: WILKINSON | L896: NICHOL | N896: ROBINSON | Q896: BELLO | W896: BOX HILL | X896: 2 | Y896: 5 | Z896: 12 | AA896: 0 | AB896: 1326 | AC896: 1642 | AD896: =(AB896/AC896)*100 -> 80.75517661388551 | AE896: =(Y896*4)+(AA896*2) -> 20
A897: GOALKICKERS | N897: MALLOY | P897: AGNELLO | S897: MOORE | W897: BENDIGO | X897: 2 | Y897: 4 | Z897: 13 | AA897: 0 | AB897: 1260 | AC897: 1664 | AD897: =(AB897/AC897)*100 -> 75.72115384615384 | AE897: =(Y897*4)+(AA897*2) -> 16
A898: FRANKSTON | C898: BOWEY 4 | E898: CUMMINGS 2 | H898: WEBB 2 | J898: MACKAY 2 | M898: MEAD 2 | O898: HOLCOMBE | Q898: D CLARKE | W898: COBURG | X898: 2 | Y898: 2 | Z898: 15 | AA898: 0 | AB898: 945 | AC898: 1768 | AD898: =(AB898/AC898)*100 -> 53.450226244343888 | AE898: =(Y898*4)+(AA898*2) -> 8
A899: BOX HILL | C899: WILKINSON 5 | F899: TRANQUILLI 3 | I899: ROBINSON 2 | L899: HARTIN 2 | O899: SLATER 2 | Q899: CROWLEY | T899: COOK
A901: WERRIBEE | C901: 4 | D901: 4 | E901: =(C901*6)+D901 -> 28 | G901: 11 | H901: 7 | I901: =(G901*6)+H901 -> 73 | K901: 14 | L901: 10 | M901: =(K901*6)+L901 -> 94 | O901: 14 | P901: 14 | Q901: =(O901*6)+P901 -> 98 | S901: Venue: NORTH BALLARAT
A902: NORTH BALLARAT | C902: 2 | D902: 2 | E902: =(C902*6)+D902 -> 14 | G902: 3 | H902: 4 | I902: =(G902*6)+H902 -> 22 | K902: 3 | L902: 4 | M902: =(K902*6)+L902 -> 22 | O902: 4 | P902: 8 | Q902: =(O902*6)+P902 -> 32
A903: BEST PLAYERS
A904: WERRIBEE | C904: KELLETT | F904: SUTTON | I904: J GOWANS | L904: SPROULE | O904: ATKINS | Q904: C GOWANS
A905: NORTH BALLARAT | C905: CLARKE | F905: MOLONEY | I905: DOYLE | K905: J POLKINGHORNE | O905: T POLKINGHORNE | S905: COX
A906: GOALKICKERS
A907: WERRIBEE | C907: SAUNDERS 3 | F907: SHAW 3 | H907: PULI 2 | J907: C GOWANS 2 | M907: AZIZ | O907: WHITNALL | Q907: J GOWANS | T907: MURPHY
A908: NORTH BALLARAT | C908: GREAVES | F908: CLARKE | I908: RUYG | K908: FIELD
A910: PRESTON | C910: 2 | D910: 3 | E910: =(C910*6)+D910 -> 15 | G910: 7 | H910: 8 | I910: =(G910*6)+H910 -> 50 | K910: 11 | L910: 11 | M910: =(K910*6)+L910 -> 77 | O910: 12 | P910: 14 | Q910: =(O910*6)+P910 -> 86 | S910: Venue: PRESTON
A911: SANDRINGHAM | C911: 4 | D911: 3 | E911: =(C911*6)+D911 -> 27 | G911: 5 | H911: 5 | I911: =(G911*6)+H911 -> 35 | K911: 8 | L911: 8 | M911: =(K911*6)+L911 -> 56 | O911: 12 | P911: 10 | Q911: =(O911*6)+P911 -> 82
A912: BEST PLAYERS
A913: PRESTON | C913: MANN | F913: ZORZI | I913: McCREDDIN | L913: BAYRE | N913: McDONOUGH | Q913: CLARKE
A914: SANDRINGHAM | C914: CROUGH
A915: GOALKICKERS
A916: PRESTON | C916: McDONOUGH 5 | F916: D GRAINGER 2 | J916: ECCLES 2 | M916: CARACELLA 2 | P916: BAYRE
A917: SANDRINGHAM | C917: ROBINS 3 | E917: OAKLEY | G917: RADFORD | I917: SAUTNER | K917: CROUGH | M917: MITCHELSON | P917: MURRAY | R917: GRANT | U917: SCOTT-BRANAGAN | X917: HAYNES
A919: WILLIAMSTOWN | C919: 3 | D919: 2 | E919: =(C919*6)+D919 -> 20 | G919: 7 | H919: 5 | I919: =(G919*6)+H919 -> 47 | K919: 10 | L919: 9 | M919: =(K919*6)+L919 -> 69 | O919: 12 | P919: 12 | Q919: =(O919*6)+P919 -> 84 | S919: Venue: WILLIAMSTOWN
A920: BENDIGO | C920: 1 | D920: 3 | E920: =(C920*6)+D920 -> 9 | G920: 3 | H920: 7 | I920: =(G920*6)+H920 -> 25 | K920: 8 | L920: 9 | M920: =(K920*6)+L920 -> 57 | O920: 11 | P920: 13 | Q920: =(O920*6)+P920 -> 79
A921: BEST PLAYERS
A922: WILLIAMSTOWN | C922: DELRE | F922: LAMBROPOULOS | J922: GHAZI | L922: GRIFFIN | O922: FRASER | Q922: WEST
A923: BENDIGO | C923: DURIE | F923: R LANGAN | J923: TOINTON | L923: WHITSED | O923: ELSUM
A924: GOALKICKERS
A925: WILLIAMSTOWN | C925: DELRE 3 | F925: GHAZI 3 | I925: RAILTON 2 | L925: FORYS 2 | N925: DOOLEY | P925: BEASLEY
A926: BENDIGO | C926: ARENTZ 4 | F926: SCHMIDT 2 | I926: SMITH 2 | L926: O'SHANESSY | O926: DURIE | Q926: REID
A928: BYE | D928: COBURG
A930: ROUND 20 | D930: 22ND AUGUST | J930: WEATHER
D931: 1ST QTR | H931: 2ND QTR | L931: 3RD QTR | P931: FINAL | S931: Venue: FRANKSTON
A932: FRANKSTON | C932: 4 | D932: 1 | E932: =(C932*6)+D932 -> 25 | G932: 4 | H932: 5 | I932: =(G932*6)+H932 -> 29 | K932: 9 | L932: 7 | M932: =(K932*6)+L932 -> 61 | O932: 14 | P932: 19 | Q932: =(O932*6)+P932 -> 103 | S932: UMPIRES | Z932: LADDER | AC932: ROUND | AE932: 20
A933: PRESTON | C933: 2 | D933: 1 | E933: =(C933*6)+D933 -> 13 | G933: 3 | H933: 2 | I933: =(G933*6)+H933 -> 20 | K933: 4 | L933: 4 | M933: =(K933*6)+L933 -> 28 | O933: 6 | P933: 4 | Q933: =(O933*6)+P933 -> 40
A934: BEST PLAYERS | W934: TEAM | X934: B | Y934: W | Z934: L | AA934: D | AB934: FOR | AC934: AGST | AD934: % | AE934: PTS
A935: FRANKSTON | C935: MOORE | F935: MALLOY | I935: DAN CLARKE | L935: SULLIVAN | N935: BOWEY | P935: CHARLES
A936: PRESTON | C936: CLARKE | F936: PASCOE | I936: ZORZI | L936: PENN | N936: MANN | W936: WERRIBEE | X936: 2 | Y936: 16 | Z936: 2 | AA936: 0 | AB936: 1938 | AC936: 1182 | AD936: =(AB936/AC936)*100 -> 163.95939086294416 | AE936: =(Y936*4)+(AA936*2) -> 64
A937: GOALKICKERS | Q937: AGNELLO | W937: FRANKSTON | X937: 2 | Y937: 16 | Z937: 2 | AA937: 0 | AB937: 1826 | AC937: 1292 | AD937: =(AB937/AC937)*100 -> 141.3312693498452 | AE937: =(Y937*4)+(AA937*2) -> 64
A938: FRANKSTON | C938: MACKAY 3 | F938: SULLIVAN 3 | I938: BOWEY 2 | K938: STRINGER 2 | N938: DAN CLARKE | Q938: BURNELL | S938: MEAD | W938: SPRINGVALE | X938: 2 | Y938: 11 | Z938: 7 | AA938: 0 | AB938: 1795 | AC938: 1178 | AD938: =(AB938/AC938)*100 -> 152.37691001697792 | AE938: =(Y938*4)+(AA938*2) -> 44
A939: PRESTON | C939: GRAINGER 4 | F939: BAYRE | H939: PENN | W939: NORTH BALLARAT | X939: 2 | Y939: 10 | Z939: 7 | AA939: 1 | AB939: 1389 | AC939: 1324 | AD939: =(AB939/AC939)*100 -> 104.9093655589124 | AE939: =(Y939*4)+(AA939*2) -> 42
D940: 23RD AUGUST | J940: WEATHER | W940: PRESTON | X940: 2 | Y940: 10 | Z940: 8 | AA940: 0 | AB940: 1346 | AC940: 1442 | AD940: =(AB940/AC940)*100 -> 93.342579750346744 | AE940: =(Y940*4)+(AA940*2) -> 40
A941: SPRINGVALE | C941: 2 | D941: 4 | E941: =(C941*6)+D941 -> 16 | G941: 6 | H941: 7 | I941: =(G941*6)+H941 -> 43 | K941: 7 | L941: 13 | M941: =(K941*6)+L941 -> 55 | O941: 14 | P941: 20 | Q941: =(O941*6)+P941 -> 104 | S941: Venue: SPRINGVALE | W941: SANDRINGHAM | X941: 2 | Y941: 9 | Z941: 9 | AA941: 0 | AB941: 1294 | AC941: 1387 | AD941: =(AB941/AC941)*100 -> 93.294881038211969 | AE941: =(Y941*4)+(AA941*2) -> 36
A942: BOX HILL | C942: 4 | D942: 5 | E942: =(C942*6)+D942 -> 29 | G942: 6 | H942: 6 | I942: =(G942*6)+H942 -> 42 | K942: 11 | L942: 8 | M942: =(K942*6)+L942 -> 74 | O942: 11 | P942: 12 | Q942: =(O942*6)+P942 -> 78
A943: BEST PLAYERS | W943: WILLIAMSTOWN | X943: 2 | Y943: 8 | Z943: 10 | AA943: 0 | AB943: 1446 | AC943: 1557 | AD943: =(AB943/AC943)*100 -> 92.870905587668602 | AE943: =(Y943*4)+(AA943*2) -> 32
A944: SPRINGVALE | C944: LITTLE | F944: SHIPP | I944: D CARROLL | L944: CAPLES | N944: TROLLOPE | W944: PORT MELBOURNE | X944: 2 | Y944: 7 | Z944: 10 | AA944: 1 | AB944: 1450 | AC944: 1395 | AD944: =(AB944/AC944)*100 -> 103.94265232974911 | AE944: =(Y944*4)+(AA944*2) -> 30
A945: BOX HILL | C945: TRANQUILLI | F945: DOUGLAS | I945: BELLO | L945: OAKLEY | N945: SIMMONDS | W945: BOX HILL | X945: 2 | Y945: 5 | Z945: 13 | AA945: 0 | AB945: 1404 | AC945: 1746 | AD945: =(AB945/AC945)*100 -> 80.412371134020617 | AE945: =(Y945*4)+(AA945*2) -> 20
A946: GOALKICKERS | Q946: McCAUGHAN | W946: BENDIGO | X946: 2 | Y946: 4 | Z946: 14 | AA946: 0 | AB946: 1333 | AC946: 1808 | AD946: =(AB946/AC946)*100 -> 73.727876106194685 | AE946: =(Y946*4)+(AA946*2) -> 16
A947: SPRINGVALE | C947: SMITH 3 | E947: SHIPP 3 | G947: KNIGHT 2 | I947: SHAW | K947: FORD | M947: LITTLE | O947: D CARROLL | R947: DOWSETT | W947: COBURG | X947: 2 | Y947: 2 | Z947: 16 | AA947: 0 | AB947: 995 | AC947: 1894 | AD947: =(AB947/AC947)*100 -> 52.534318901795139 | AE947: =(Y947*4)+(AA947*2) -> 8
A948: BOX HILL | C948: TRANQUILLI 5 | G948: ROBINSON 2 | J948: WILKINSON 2 | M948: SLATER | O948: BELLO
A950: WERRIBEE | C950: 3 | D950: 3 | E950: =(C950*6)+D950 -> 21 | G950: 10 | H950: 7 | I950: =(G950*6)+H950 -> 67 | K950: 17 | L950: 13 | M950: =(K950*6)+L950 -> 115 | O950: 18 | P950: 18 | Q950: =(O950*6)+P950 -> 126 | S950: Venue: WERRIBEE
A951: COBURG | C951: 0 | D951: 6 | E951: =(C951*6)+D951 -> 6 | G951: 3 | H951: 6 | I951: =(G951*6)+H951 -> 24 | K951: 3 | L951: 7 | M951: =(K951*6)+L951 -> 25 | O951: 7 | P951: 8 | Q951: =(O951*6)+P951 -> 50
A952: BEST PLAYERS
A953: WERRIBEE | C953: AZIZ | E953: C GOWANS | H953: J GOWANS | K953: KELLETT | N953: FROST | P953: CHURCHILL
A954: COBURG | C954: MCCARTHY | F954: PEVERILL | I954: TARANTO | L954: ALESSIO | N954: WALKER
A955: GOALKICKERS
A956: WERRIBEE | C956: CAMILLIERI 5 | F956: C GOWANS 3 | I956: J GOWANS 3 | L956: CHURCHILL 2 | O956: SHAW | Q956: REARDON | T956: DYER | V956: KELLETT | X956: SPROULE
A957: COBURG | C957: DAVIDSON 2 | F957: WALKER | H957: PEVERILL | J957: McCARDY | L957: HILL | N957: TORTORA
A959: SANDRINGHAM | C959: 3 | D959: 2 | E959: =(C959*6)+D959 -> 20 | G959: 4 | H959: 4 | I959: =(G959*6)+H959 -> 28 | K959: 6 | L959: 9 | M959: =(K959*6)+L959 -> 45 | O959: 8 | P959: 10 | Q959: =(O959*6)+P959 -> 58 | S959: Venue: BEACH ROAD
A960: NORTH BALLARAT | C960: 4 | D960: 4 | E960: =(C960*6)+D960 -> 28 | G960: 4 | H960: 9 | I960: =(G960*6)+H960 -> 33 | K960: 5 | L960: 11 | M960: =(K960*6)+L960 -> 41 | O960: 7 | P960: 14 | Q960: =(O960*6)+P960 -> 56
A961: BEST PLAYERS
A962: SANDRINGHAM | C962: CROUGH | F962: HAYNES | I962: NUGENT | L962: D GRANT | O962: BAXTER | Q962: SAUTNER
A963: NORTH BALLARAT | C963: FIELD | F963: CLARKE | I963: DOHERTY | L963: DOYLE | O963: G POLKINGHORNE | S963: RUYG
A964: GOALKICKERS
A965: SANDRINGHAM | C965: MURRAY 2 | F965: SAUTNER | I965: NUGENT | K965: ROBINS | M965: ARGUS | O965: SCOTT-BRANAGAN | S965: BAXTER
A966: NORTH BALLARAT | C966: GREAVES 3 | F966: REID | H966: J POLKINGHORNE | L966: T POLKINGHORNE | P966: FIELD
A968: PORT MELBOURNE | C968: 5 | D968: 5 | E968: =(C968*6)+D968 -> 35 | G968: 11 | H968: 10 | I968: =(G968*6)+H968 -> 76 | K968: 16 | L968: 14 | M968: =(K968*6)+L968 -> 110 | O968: 21 | P968: 18 | Q968: =(O968*6)+P968 -> 144 | S968: Venue: BENDIGO
A969: BENDIGO | C969: 1 | D969: 2 | E969: =(C969*6)+D969 -> 8 | G969: 4 | H969: 4 | I969: =(G969*6)+H969 -> 28 | K969: 7 | L969: 4 | M969: =(K969*6)+L969 -> 46 | O969: 11 | P969: 7 | Q969: =(O969*6)+P969 -> 73
A970: BEST PLAYERS
A971: PORT MELBOURNE | C971: CLOHESY | F971: GOODALE | I971: SHANAHAN | L971: PICIAONE | O971: SCHAEFER | R971: HOLLOW
A972: BENDIGO | C972: R LANGAN | F972: WHITSED | I972: DURIE | L972: CURSIO | O972: ELSUM | R972: SCHMIDT
A973: GOALKICKERS | R973: SHANAHAN
A974: PORT MELBOURNE | C974: WEEDING 4 | F974: CLOHESY 3 | I974: CREDLIN 2 | K974: D'GIACOMA 2 | N974: SEXTON 2 | Q974: BUTTERWORTH | U974: CHEEL | W974: CAMERON | X974: GOODALE | AA974: MORTON | AC974: SCHAEFER | AF974: VILLAROSA
A975: BENDIGO | C975: SCHMIDT 4 | F975: LANCASTER 2 | J975: R LANGAN 2 | M975: MARTIN | O975: ST CLAIR | R975: HAWKINS
A977: BYE | D977: WILLIAMSTOWN
A979: FINALS
A980: ELIMINATION FINAL | E980: 30TH AUGUST | J980: WEATHER
D981: 1ST QTR | H981: 2ND QTR | L981: 3RD QTR | P981: FINAL | S981: Venue: PORT MELBOURNE
A982: SPRINGVALE | C982: 6 | D982: 2 | E982: =(C982*6)+D982 -> 38 | G982: 9 | H982: 6 | I982: =(G982*6)+H982 -> 60 | K982: 12 | L982: 9 | M982: =(K982*6)+L982 -> 81 | O982: 15 | P982: 16 | Q982: =(O982*6)+P982 -> 106 | S982: UMPIRES
A983: SANDRINGHAM | C983: 2 | D983: 1 | E983: =(C983*6)+D983 -> 13 | G983: 3 | H983: 2 | I983: =(G983*6)+H983 -> 20 | K983: 4 | L983: 7 | M983: =(K983*6)+L983 -> 31 | O983: 5 | P983: 8 | Q983: =(O983*6)+P983 -> 38 | S983: VOZZO :CALLAHAN :JAMES
A984: BEST PLAYERS
A985: SPRINGVALE | D985: KNIGHT | G985: TREZISE | J985: DOWSETT | M985: CAPLES | P985: D CARROLL | S985: SHIPP
A986: SANDRINGHAM | D986: SAUTNER | G986: TREGEAR | J986: D GRANT | M986: RIENIETS | P986: MACGEORGE | S986: HAYNES
A987: GOALKICKERS
A988: SPRINGVALE | D988: KNIGHT 6 | G988: SMITH 4 | J988: O'BRIEN 2 | M988: JEFFS 2 | O988: LITTLE
A989: SANDRINGHAM | D989: TEMPLETON | G989: RADFORD | J989: MITCHELSON | M989: SAUTNER | O989: SCOTT-BRANAGAN
A991: ELIMINATION FINAL | E991: 29TH AUGUST | J991: WEATHER
D992: 1ST QTR | H992: 2ND QTR | L992: 3RD QTR | P992: FINAL | S992: Venue: NORTH BALLARAT
A993: NORTH BALLARAT | C993: 3 | D993: 2 | E993: =(C993*6)+D993 -> 20 | G993: 7 | H993: 4 | I993: =(G993*6)+H993 -> 46 | K993: 11 | L993: 8 | M993: =(K993*6)+L993 -> 74 | O993: 13 | P993: 9 | Q993: =(O993*6)+P993 -> 87 | S993: UMPIRES
A994: PRESTON | C994: 2 | D994: 4 | E994: =(C994*6)+D994 -> 16 | G994: 3 | H994: 6 | I994: =(G994*6)+H994 -> 24 | K994: 5 | L994: 10 | M994: =(K994*6)+L994 -> 40 | O994: 8 | P994: 11 | Q994: =(O994*6)+P994 -> 59 | S994: MANN :TWITT :SEXTON
A995: BEST PLAYERS
A996: NORTH BALLARAT | D996: DOYLE | G996: FIELD | J996: HOLMES | M996: FLETCHER | P996: CLARKE | S996: MOLONEY
A997: PRESTON | D997: MANN | G997: AIELLO | J997: HAYWARD | M997: PASCOE | P997: HABERMAN | S997: POWER
A998: GOALKICKERS
A999: NORTH BALLARAT | D999: BERRY 3 | F999: CLARKE 3 | I999: J POLKINGHORNE 2 | M999: RUYG 2 | O999: EDMONDS 2 | R999: FIELD
A1000: PRESTON | D1000: GRAY 2 | F1000: D GRAINGER 2 | I1000: BOOKER | K1000: CARACELLA | N1000: MANN | P1000: PASCOE
A1002: QUALIFYING FINAL | E1002: 30TH AUGUST | K1002: WEATHER
A1003: WERRIBEE | C1003: 3 | D1003: 2 | E1003: =(C1003*6)+D1003 -> 20 | G1003: 7 | H1003: 9 | I1003: =(G1003*6)+H1003 -> 51 | K1003: 13 | L1003: 11 | M1003: =(K1003*6)+L1003 -> 89 | O1003: 17 | P1003: 13 | Q1003: =(O1003*6)+P1003 -> 115 | S1003: Venue: PORT MELBOURNE
A1004: FRANKSTON | C1004: 5 | D1004: 3 | E1004: =(C1004*6)+D1004 -> 33 | G1004: 8 | H1004: 2 | I1004: =(G1004*6)+H1004 -> 50 | K1004: 12 | L1004: 4 | M1004: =(K1004*6)+L1004 -> 76 | O1004: 14 | P1004: 6 | Q1004: =(O1004*6)+P1004 -> 90 | S1004: KELSEY :NICHOLLS :ROWE
A1005: BEST PLAYERS
A1006: WERRIBEE | D1006: FAULKNER | G1006: J GOWANS | J1006: FROST | M1006: MURPHY | P1006: C GOWANS | S1006: SHAW
A1007: FRANKSTON | D1007: KING | G1007: SULLIVAN | J1007: D CLARKE | M1007: HOPGOOD
A1008: GOALKICKERS
A1009: WERRIBEE | D1009: CAMILLIERI 3 | G1009: AZIZ 3 | I1009: SHAW 2 | K1009: DYER 2 | M1009: SAUNDERS 2 | P1009: C GOWANS | R1009: CHURCHILL | U1009: FAULKNER | X1009: FROST | Z1009: SMITH
A1010: FRANKSTON | D1010: S RYAN 3 | G1010: HOPGOOD 2 | J1010: WEBB 2 | L1010: R STUBBS | N1010: MURRAY | P1010: MEAD | R1010: SULLIVAN | U1010: BURGMANN | X1010: CUMMINGS
A1012: 1ST SEMI FINAL | E1012: 6TH SEPTEMBER
A1013: WERRIBEE | C1013: 3 | D1013: 1 | E1013: =(C1013*6)+D1013 -> 19 | G1013: 6 | H1013: 7 | I1013: =(G1013*6)+H1013 -> 43 | K1013: 11 | L1013: 8 | M1013: =(K1013*6)+L1013 -> 74 | O1013: 19 | P1013: 13 | Q1013: =(O1013*6)+P1013 -> 127 | S1013: Venue: PORT MELBOURNE
A1014: SPRINGVALE | C1014: 2 | D1014: 1 | E1014: =(C1014*6)+D1014 -> 13 | G1014: 3 | H1014: 6 | I1014: =(G1014*6)+H1014 -> 24 | K1014: 5 | L1014: 11 | M1014: =(K1014*6)+L1014 -> 41 | O1014: 7 | P1014: 14 | Q1014: =(O1014*6)+P1014 -> 56 | S1014: KELSEY :CALLAHAN :NICHOLLS
A1015: BEST PLAYERS
A1016: WERRIBEE | D1016: SPROULE | G1016: ATKINS | J1016: SAUNDERS | M1016: FROST | P1016: FAULKNER | S1016: SMITH
A1017: SPRINGVALE | D1017: DWYER | G1017: PASTORE | J1017: TROLLOP
A1018: GOALKICKERS
A1019: WERRIBEE | D1019: AZIZ 3 | F1019: C GOWANS 3 | I1019: FROST 3 | K1019: SMITH 2 | M1019: ATKINS 2 | O1019: CAMILLIERI | R1019: J GOWANS | U1019: KELLETT | W1019: FAULKNER | X1019: SATTERLEY | AA1019: SUTTON
A1020: SPRINGVALE | D1020: SHIPP 2 | G1020: CAPLES 2 | J1020: KNIGHT | L1020: JOY | N1020: JEFFS
A1022: 2ND SEMI FINAL | E1022: 7TH SEPTEMBER
A1023: NORTH BALLARAT | C1023: 5 | D1023: 0 | E1023: =(C1023*6)+D1023 -> 30 | G1023: 9 | H1023: 2 | I1023: =(G1023*6)+H1023 -> 56 | K1023: 14 | L1023: 3 | M1023: =(K1023*6)+L1023 -> 87 | O1023: 19 | P1023: 6 | Q1023: =(O1023*6)+P1023 -> 120 | S1023: Venue: PORT MELBOURNE
A1024: FRANKSTON | C1024: 4 | D1024: 4 | E1024: =(C1024*6)+D1024 -> 28 | G1024: 10 | H1024: 6 | I1024: =(G1024*6)+H1024 -> 66 | K1024: 15 | L1024: 12 | M1024: =(K1024*6)+L1024 -> 102 | O1024: 17 | P1024: 13 | Q1024: =(O1024*6)+P1024 -> 115 | S1024: VOZZO :ROWE :JAMES
A1025: BEST PLAYERS
A1026: NORTH BALLARAT | D1026: J POLKINGHORNE | H1026: CUTHBERTSON | K1026: CLARKE | M1026: T POLKINGHORNE | Q1026: FLETCHER | T1026: DOYLE
A1027: FRANKSTON | D1027: STUBBS | G1027: KING | J1027: SULLIVAN | M1027: STRINGER
A1028: GOALKICKERS
A1029: NORTH BALLARAT | D1029: CUTHBERTSON 5 | G1029: PICKFORD 3 | J1029: CLARKE 3 | M1029: McDONALD 2 | P1029: PEAKE 2 | R1029: EDMONDS 2 | U1029: BERRY | W1029: FIELD
A1030: FRANKSTON | D1030: STUBBS 4 | G1030: MACKAY 3 | J1030: S RYAN 2 | M1030: KING 2 | O1030: WEBB 2 | Q1030: CUMMINGS | T1030: DOYLE | V1030: BOWEY | X1030: STRINGER
A1032: PRELIMINARY FINAL | F1032: 14TH SEPTEMBER
A1033: SPRINGVALE | C1033: 2 | D1033: 0 | E1033: =(C1033*6)+D1033 -> 12 | G1033: 5 | H1033: 3 | I1033: =(G1033*6)+H1033 -> 33 | K1033: 8 | L1033: 6 | M1033: =(K1033*6)+L1033 -> 54 | O1033: 9 | P1033: 10 | Q1033: =(O1033*6)+P1033 -> 64 | S1033: Venue: PORT MELBOURNE
A1034: NORTH BALLARAT | C1034: 5 | D1034: 2 | E1034: =(C1034*6)+D1034 -> 32 | G1034: 5 | H1034: 3 | I1034: =(G1034*6)+H1034 -> 33 | K1034: 8 | L1034: 5 | M1034: =(K1034*6)+L1034 -> 53 | O1034: 9 | P1034: 8 | Q1034: =(O1034*6)+P1034 -> 62 | S1034: JAMES ;KELSEY :ROWE
A1035: BEST PLAYERS
A1036: SPRINGVALE | D1036: J CARROLL | G1036: LITTLE | J1036: TAYLOR | M1036: CAPLES | P1036: JOY | S1036: KNIGHT
A1037: NORTH BALLARAT | D1037: MOLONEY | G1037: FIELD | I1037: J POLKINGHORNE | M1037: DOYLE | P1037: FLETCHER | S1037: HOLMES
A1038: GOALKICKERS
A1039: SPRINGVALE | D1039: KNIGHT 3 | G1039: DWYER 2 | J1039: DELARUE 2 | M1039: PASTORE | P1039: SMITH
A1040: NORTH BALLARAT | D1040: CUTHBERTSON 3 | G1040: MARTIN 2 | J1040: McDONALD | M1040: PICKFORD | P1040: EDMONDS | R1040: PEAKE
A1042: GRAND FINAL | E1042: 21ST SEPTEMBER
A1043: SPRINGVALE | C1043: 2 | D1043: 7 | E1043: =(C1043*6)+D1043 -> 19 | G1043: 6 | H1043: 9 | I1043: =(G1043*6)+H1043 -> 45 | K1043: 9 | L1043: 10 | M1043: =(K1043*6)+L1043 -> 64 | O1043: 11 | P1043: 17 | Q1043: =(O1043*6)+P1043 -> 83 | S1043: Venue: PRINCES PARK (Carlton)
A1044: WERRIBEE | C1044: 1 | D1044: 4 | E1044: =(C1044*6)+D1044 -> 10 | G1044: 2 | H1044: 8 | I1044: =(G1044*6)+H1044 -> 20 | K1044: 5 | L1044: 12 | M1044: =(K1044*6)+L1044 -> 42 | O1044: 9 | P1044: 7 | Q1044: =(O1044*6)+P1044 -> 61
A1045: BEST PLAYERS
A1046: SPRINGVALE | D1046: J CARROLL | G1046: CLARK | J1046: DELARUE | M1046: CAPLES | P1046: SMITH | R1046: LITTLE
A1047: WERRIBEE | D1047: CHURCHILL | G1047: FAULKNER | J1047: BALLAN | M1047: SPROULE | P1047: PULI | R1047: SUTTON
A1048: GOALKICKERS
A1049: SPRINGVALE | D1049: SMITH 3 | G1049: CAPLES 2 | J1049: KNIGHT 2 | M1049: O'DONNELL | P1049: O'BRIEN | R1049: TAYLOR | U1049: SHIPP
A1050: WERRIBEE | D1050: AZIZ 4 | G1050: SATTERLEY | J1050: C GOWANS | M1050: FROST | O1050: CAMILLIERI | R1050: WHITNALL
A1052: INTERSTATE MATCH | F1052: 6TH JUNE | K1052: WEATHER
A1053: T.F.L. | C1053: 4 | D1053: 3 | E1053: =(C1053*6)+D1053 -> 27 | G1053: 7 | H1053: 9 | I1053: =(G1053*6)+H1053 -> 51 | K1053: 8 | L1053: 10 | M1053: =(K1053*6)+L1053 -> 58 | O1053: 13 | P1053: 10 | Q1053: =(O1053*6)+P1053 -> 88 | S1053: Venue: NORTH HOBART OVAL
A1054: V.F.L. | C1054: 2 | D1054: 2 | E1054: =(C1054*6)+D1054 -> 14 | G1054: 3 | H1054: 4 | I1054: =(G1054*6)+H1054 -> 22 | K1054: 4 | L1054: 15 | M1054: =(K1054*6)+L1054 -> 39 | O1054: 6 | P1054: 17 | Q1054: =(O1054*6)+P1054 -> 53
A1055: BEST PLAYERS
A1056: T.F.L. | D1056: BOURN | G1056: McLEAN | J1056: CLARKE | M1056: BRERETON | P1056: REYNOLDS | S1056: McCARTHY
A1057: V.F.L. | D1057: MOORE | G1057: HOLLOW | J1057: WEST | M1057: SEXTON | P1057: BALLANTYNE
A1058: GOALKICKERS
A1059: T.F.L. | D1059: ALLEN 3 | G1059: McCARTHY 2 | J1059: GIBSON 2 | M1059: JONES 2 | P1059: REYNOLDS 2 | S1059: SANDERS | V1059: GUARD
A1060: V.F.L. | D1060: FROST 3 | G1060: GHAZI | J1060: SEXTON | M1060: SMITH
A1062: GRAND FINAL TEAMS
E1063: SPRINGVALE | N1063: WERRIBEE
A1064: B. | C1064: LITTLE | F1064: SUTHERLAND | I1064: JEFFS | L1064: SUTTON | O1064: BALLAN | R1064: SATTERLEY
A1065: H.B. | C1065: TAYLOR | F1065: CAPLES | I1065: TROLLOPE | L1065: KELLETT | O1065: SPROULE | R1065: TAYLOR
A1066: C. | C1066: J CARROLL | F1066: DELARUE | I1066: O'DONNELL | L1066: DYER | O1066: ATKINS | R1066: CHURCHILL
A1067: H.F. | C1067: KNIGHT | F1067: SMITH | I1067: SHIPP | L1067: J GOWANS | O1067: SAUNDERS | R1067: C GOWANS
A1068: F. | C1068: DWYER | F1068: PASTORE | I1068: FORD | L1068: SHAW | O1068: AZIZ | R1068: CAMILLIERI
A1069: R. | C1069: CLARK | F1069: JOY | I1069: D CARROLL | L1069: PULI | O1069: FROST | R1069: FAULKNER
A1070: INT. | C1070: O'BRIEN | F1070: SHAW | I1070: DOWSETT | L1070: WHITNALL | O1070: SMITH | R1070: MURPHY