A1: Victorian Football League
A2: Season 1999
A3: © Copyright Wal Williams | F3: First created: 4 September 2016
A4: Contact: joywalwi at gmail dot com | F4: Last updated: 4 September 2016 | W4: VFA Results and tables - Link to the main index page
A5: You are free to copy this document in whole or part provided that proper acknowledgement is given to the author. All rights reserved.
A7: 1999 SEASON
A8: ROUND 1 | D8: 3RD APRIL | J8: WEATHER
D9: 1ST QTR | H9: 2ND QTR | L9: 3RD QTR | P9: FINAL | S9: Venue: SPRINGVALE
A10: WERRIBEE | C10: 4 | D10: 3 | E10: =(C10*6)+D10 -> 27 | G10: 8 | H10: 5 | I10: =(G10*6)+H10 -> 53 | K10: 13 | L10: 10 | M10: =(K10*6)+L10 -> 88 | O10: 18 | P10: 13 | Q10: =(O10*6)+P10 -> 121 | S10: UMPIRES | Z10: LADDER | AC10: ROUND | AE10: 1
A11: SPRINGVALE | C11: 3 | D11: 4 | E11: =(C11*6)+D11 -> 22 | G11: 4 | H11: 6 | I11: =(G11*6)+H11 -> 30 | K11: 8 | L11: 10 | M11: =(K11*6)+L11 -> 58 | O11: 12 | P11: 12 | Q11: =(O11*6)+P11 -> 84
A12: BEST PLAYERS | W12: TEAM | X12: B | Y12: W | Z12: L | AA12: D | AB12: FOR | AC12: AGST | AD12: % | AE12: PTS
A13: WERRIBEE | C13: CHURCHILL | F13: FAULKNER | I13: GOODEY | L13: HYDE | N13: SUTTON | P13: ATKINS
A14: SPRINGVALE | C14: SMITH | F14: DONATI | I14: C CLARK | L14: FORD | N14: CARROLL | W14: FRANKSTON | Y14: 1 | Z14: 0 | AA14: 0 | AB14: 125 | AC14: 75 | AD14: =(AB14/AC14)*100 -> 166.66666666666669 | AE14: =(Y14*4)+(AA14*2) -> 4
A15: GOALKICKERS | M15: PULI | O15: SHANNON | Q15: PRIDDLE | W15: WERRIBEE | Y15: 1 | Z15: 0 | AA15: 0 | AB15: 121 | AC15: 84 | AD15: =(AB15/AC15)*100 -> 144.04761904761904 | AE15: =(Y15*4)+(AA15*2) -> 4
A16: WERRIBEE | C16: MITCHELL 4 | F16: CHURCHILL 3 | I16: FAULKNER 3 | L16: SMITH 2 | N16: FROST | P16: BUTTON | R16: SMITH | W16: SANDRINGHAM | Y16: 1 | Z16: 0 | AA16: 0 | AB16: 118 | AC16: 82 | AD16: =(AB16/AC16)*100 -> 143.90243902439025 | AE16: =(Y16*4)+(AA16*2) -> 4
A17: SPRINGVALE | C17: SMITH 5 | F17: DWYER 2 | I17: PASSADOR 2 | L17: DONATI | N17: S CLARK | P17: C CLARK | W17: BENDIGO | Y17: 1 | Z17: 0 | AA17: 0 | AB17: 114 | AC17: 85 | AD17: =(AB17/AC17)*100 -> 134.11764705882351 | AE17: =(Y17*4)+(AA17*2) -> 4
W18: PORT MELBOURNE | Y18: 1 | Z18: 0 | AA18: 0 | AB18: 80 | AC18: 74 | AD18: =(AB18/AC18)*100 -> 108.10810810810811 | AE18: =(Y18*4)+(AA18*2) -> 4
A19: BENDIGO | C19: 3 | D19: 0 | E19: =(C19*6)+D19 -> 18 | G19: 7 | H19: 1 | I19: =(G19*6)+H19 -> 43 | K19: 13 | L19: 4 | M19: =(K19*6)+L19 -> 82 | O19: 18 | P19: 6 | Q19: =(O19*6)+P19 -> 114 | S19: Venue: PRESTON | W19: WILLIAMSTOWN | X19: 1 | Y19: 0 | Z19: 0 | AA19: 0 | AB19: 0 | AC19: 0 | AE19: =(Y19*4)+(AA19*2) -> 0
A20: PRESTON | C20: 2 | D20: 0 | E20: =(C20*6)+D20 -> 12 | G20: 6 | H20: 2 | I20: =(G20*6)+H20 -> 38 | K20: 9 | L20: 5 | M20: =(K20*6)+L20 -> 59 | O20: 12 | P20: 13 | Q20: =(O20*6)+P20 -> 85
A21: BEST PLAYERS | W21: NORTH BALLARAT | Y21: 0 | Z21: 1 | AA21: 0 | AB21: 74 | AC21: 80 | AD21: =(AB21/AC21)*100 -> 92.5 | AE21: =(Y21*4)+(AA21*2) -> 0
A22: BENDIGO | C22: FLEMING | F22: ANGOVE | I22: RUDD | L22: PROWSE | O22: BLAKE | Q22: ELSUM | W22: PRESTON | Y22: 0 | Z22: 1 | AA22: 0 | AB22: 85 | AC22: 114 | AD22: =(AB22/AC22)*100 -> 74.561403508771932 | AE22: =(Y22*4)+(AA22*2) -> 0
A23: PRESTON | C23: GIBSON | F23: KOFOED | I23: ZORZI | L23: BONADIO | O23: TAYLOR | W23: BOX HILL | Y23: 0 | Z23: 1 | AA23: 0 | AB23: 82 | AC23: 118 | AD23: =(AB23/AC23)*100 -> 69.491525423728817 | AE23: =(Y23*4)+(AA23*2) -> 0
A24: GOALKICKERS | P24: SCHMIDT | R24: SHARKEY | W24: SPRINGVALE | Y24: 0 | Z24: 1 | AA24: 0 | AB24: 84 | AC24: 121 | AD24: =(AB24/AC24)*100 -> 69.421487603305792 | AE24: =(Y24*4)+(AA24*2) -> 0
A25: BENDIGO | C25: RUDD 7 | E25: BLAKE 2 | G25: O'SHANNESSY 2 | J25: BLAKE | L25: MITROVIC | N25: O'CALLAGHAN | Q25: PASCOE | S25: PROWSE | W25: COBURG | Y25: 0 | Z25: 1 | AA25: 0 | AB25: 75 | AC25: 125 | AD25: =(AB25/AC25)*100 -> 60 | AE25: =(Y25*4)+(AA25*2) -> 0
A26: PRESTON | C26: GIBSON 2 | E26: HALLINAN 2 | H26: CLOSE | I26: MANGIN | K26: PASCOE | M26: McDONOUGH | P26: TAYLOR | R26: HAYWOOD
D27: NIGHT MATCH | O27: GAY | Q27: HABERMAN
A28: PORT MELBOURNE | C28: 2 | D28: 2 | E28: =(C28*6)+D28 -> 14 | G28: 6 | H28: 3 | I28: =(G28*6)+H28 -> 39 | K28: 9 | L28: 5 | M28: =(K28*6)+L28 -> 59 | O28: 12 | P28: 8 | Q28: =(O28*6)+P28 -> 80 | S28: Venue: NORTH BALLARAT
A29: NORTH BALLARAT | C29: 1 | D29: 2 | E29: =(C29*6)+D29 -> 8 | G29: 5 | H29: 8 | I29: =(G29*6)+H29 -> 38 | K29: 7 | L29: 3 | M29: =(K29*6)+L29 -> 45 | O29: 10 | P29: 14 | Q29: =(O29*6)+P29 -> 74
A30: BEST PLAYERS
A31: PORT MELBOURNE | C31: SEXTON | F31: SHARP | I31: CLOHESY | L31: HOLLOW | N31: VILLAROSA | Q31: MATTHEWS-HERALD
A32: NORTH BALLARAT | C32: HANCOCK | F32: INKSTER | I32: RUYG | L32: SNIBSON | N32: CUTHBERTSON
A33: GOALKICKERS
A34: PORT MELBOURNE | C34: SEXTON 4 | F34: CROCKER 3 | I34: SCHAEFER 2 | L34: VILLAROSA 2 | O34: DURLING
A35: NORTH BALLARAT | C35: KIRZNER 3 | F35: CUTHBERTSON 2 | J35: EDMONDS 2 | M35: INKSTER 2 | P35: FISHER
D36: 4TH APRIL | J36: WEATHER
A37: SANDRINGHAM | C37: 2 | D37: 3 | E37: =(C37*6)+D37 -> 15 | G37: 7 | H37: 8 | I37: =(G37*6)+H37 -> 50 | K37: 11 | L37: 12 | M37: =(K37*6)+L37 -> 78 | O37: 17 | P37: 16 | Q37: =(O37*6)+P37 -> 118 | S37: Venue: BOX HILL
A38: BOX HILL | C38: 3 | D38: 1 | E38: =(C38*6)+D38 -> 19 | G38: 4 | H38: 6 | I38: =(G38*6)+H38 -> 30 | K38: 7 | L38: 9 | M38: =(K38*6)+L38 -> 51 | O38: 12 | P38: 10 | Q38: =(O38*6)+P38 -> 82
A39: BEST PLAYERS
A40: SANDRINGHAM | C40: TREGEAR | F40: TEMPLETON | I40: NGUYEN | L40: SAUTNER | N40: FRATER | Q40: SCOTT-BRANAGAN
A41: BOX HILL | C41: SLATER | F41: MccARTNEY | I41: JENKINS | L41: ROBINSON | N41: WILKINSON | Q41: BREBNER
A42: GOALKICKERS
A43: SANDRINGHAM | C43: SAUTNER 6 | F43: FRATER 2 | H43: SCOTT-BRANAGAN 2 | L43: HAYWARD 2 | O43: TREGEAR | Q43: TEMPLETON | T43: LIDDELL | W43: MACGEORGE | X43: McKELLAR
A44: BOX HILL | C44: WILKINSON 5 | F44: GIANNOPOULOS 2 | J44: ROWE 2 | L44: BREWER | N44: HOLLAND | P44: ROBINSON
A46: FRANKSTON | C46: 3 | D46: 2 | E46: =(C46*6)+D46 -> 20 | G46: 10 | H46: 4 | I46: =(G46*6)+H46 -> 64 | K46: 14 | L46: 7 | M46: =(K46*6)+L46 -> 91 | O46: 19 | P46: 11 | Q46: =(O46*6)+P46 -> 125 | S46: Venue: FRANKSTON
A47: COBURG | C47: 2 | D47: 3 | E47: =(C47*6)+D47 -> 15 | G47: 4 | H47: 5 | I47: =(G47*6)+H47 -> 29 | K47: 8 | L47: 7 | M47: =(K47*6)+L47 -> 55 | O47: 11 | P47: 9 | Q47: =(O47*6)+P47 -> 75
A48: BEST PLAYERS
A49: FRANKSTON | C49: BURGMAN | F49: VOLKES | H49: GEORGE | K49: KNOTT
A50: COBURG | C50: DE PASQUALE | F50: BICER | H50: WILLOUGHBY | K50: GORDON | N50: CONDON
A51: GOALKICKERS
A52: FRANKSTON | C52: CLARKE 6 | F52: WILLIAMS 3 | I52: KNOTT 3 | L52: McCORMACK 2 | O52: SULLIVAN | Q52: BURNELL | T52: MILES | W52: DART | X52: WATSON
A53: COBURG | C53: WILLOUGHBY 2 | F53: POTTER 2 | H53: BICER 2 | J53: DUNCAN | L53: MANSFIELD | O53: GLEESON | Q53: DE PASQUALE | U53: CANNING
A55: BYE | D55: WILLIAMSTOWN
A57: ROUND 2 | D57: 10TH APRIL | J57: WEATHER
D58: 1ST QTR | H58: 2ND QTR | L58: 3RD QTR | P58: FINAL | S58: Venue: COBURG
A59: WILLIAMSTOWN | C59: 2 | D59: 5 | E59: =(C59*6)+D59 -> 17 | G59: 6 | H59: 6 | I59: =(G59*6)+H59 -> 42 | K59: 7 | L59: 9 | M59: =(K59*6)+L59 -> 51 | O59: 11 | P59: 11 | Q59: =(O59*6)+P59 -> 77 | S59: UMPIRES | Z59: LADDER | AC59: ROUND | AE59: 2
A60: COBURG | C60: 4 | D60: 4 | E60: =(C60*6)+D60 -> 28 | G60: 7 | H60: 7 | I60: =(G60*6)+H60 -> 49 | K60: 7 | L60: 10 | M60: =(K60*6)+L60 -> 52 | O60: 9 | P60: 12 | Q60: =(O60*6)+P60 -> 66
A61: BEST PLAYERS | W61: TEAM | X61: B | Y61: W | Z61: L | AA61: D | AB61: FOR | AC61: AGST | AD61: % | AE61: PTS
A62: WILLIAMSTOWN | C62: BEASLEY | F62: WEST | I62: RAILTON | L62: VIDOVIC | O62: ZAVALAS | R62: SIR
A63: COBURG | C63: CONDON | F63: DE PASQUALE | I63: CANNING | L63: O'CALLAGHAN | O63: FLETCHER | R63: BICER | W63: PORT MELBOURNE | Y63: 2 | Z63: 0 | AA63: 0 | AB63: 237 | AC63: 173 | AD63: =(AB63/AC63)*100 -> 136.99421965317919 | AE63: =(Y63*4)+(AA63*2) -> 8
A64: GOALKICKERS | W64: WERRIBEE | Y64: 2 | Z64: 0 | AA64: 0 | AB64: 250 | AC64: 197 | AD64: =(AB64/AC64)*100 -> 126.90355329949239 | AE64: =(Y64*4)+(AA64*2) -> 8
A65: WILLIAMSTOWN | C65: RAILTON 2 | F65: REYNOLDS 2 | I65: TAYLOR 2 | K65: SHANKS | M65: EAMES | O65: STANLEY | Q65: BUGEJA | S65: HOLLOW | W65: SANDRINGHAM | Y65: 1 | Z65: 0 | AA65: 1 | AB65: 210 | AC65: 174 | AD65: =(AB65/AC65)*100 -> 120.68965517241379 | AE65: =(Y65*4)+(AA65*2) -> 6
A66: COBURG | C66: CANNING 3 | F66: MANSFIELD | I66: NUNZIATO | K66: McLENNAN | N66: TORTORA | P66: CUSWORTH | R66: WILLOUGHBY | W66: FRANKSTON | Y66: 1 | Z66: 1 | AA66: 0 | AB66: 238 | AC66: 204 | AD66: =(AB66/AC66)*100 -> 116.66666666666667 | AE66: =(Y66*4)+(AA66*2) -> 4
W67: WILLIAMSTOWN | X67: 1 | Y67: 1 | Z67: 0 | AA67: 0 | AB67: 77 | AC67: 66 | AD67: =(AB67/AC67)*100 -> 116.66666666666667 | AE67: =(Y67*4)+(AA67*2) -> 4
A68: SPRINGVALE | C68: 5 | D68: 4 | E68: =(C68*6)+D68 -> 34 | G68: 12 | H68: 6 | I68: =(G68*6)+H68 -> 78 | K68: 17 | L68: 8 | M68: =(K68*6)+L68 -> 110 | O68: 25 | P68: 15 | Q68: =(O68*6)+P68 -> 165 | S68: Venue: BENDIGO | W68: SPRINGVALE | Y68: 1 | Z68: 1 | AA68: 0 | AB68: 249 | AC68: 230 | AD68: =(AB68/AC68)*100 -> 108.26086956521739 | AE68: =(Y68*4)+(AA68*2) -> 4
A69: BENDIGO | C69: 3 | D69: 2 | E69: =(C69*6)+D69 -> 20 | G69: 7 | H69: 7 | I69: =(G69*6)+H69 -> 49 | K69: 12 | L69: 11 | M69: =(K69*6)+L69 -> 83 | O69: 16 | P69: 13 | Q69: =(O69*6)+P69 -> 109
A70: BEST PLAYERS | W70: BENDIGO | Y70: 1 | Z70: 1 | AA70: 0 | AB70: 223 | AC70: 250 | AD70: =(AB70/AC70)*100 -> 89.2 | AE70: =(Y70*4)+(AA70*2) -> 4
A71: SPRINGVALE | C71: C CLARKE | F71: DONATI | I71: SMITH | L71: BARDSLEY | O71: PASSADOR | R71: KNIGHT | W71: PRESTON | Y71: 0 | Z71: 1 | AA71: 1 | AB71: 177 | AC71: 206 | AD71: =(AB71/AC71)*100 -> 85.922330097087368 | AE71: =(Y71*4)+(AA71*2) -> 2
A72: BENDIGO | C72: O'CALLAGHAN | F72: ELSUM | H72: CONNAUGHTON | L72: DE ANGELIS | O72: BLAKE | R72: SHARKEY | W72: NORTH BALLARAT | X72: 1 | Y72: 0 | Z72: 1 | AA72: 0 | AB72: 74 | AC72: 80 | AD72: =(AB72/AC72)*100 -> 92.5 | AE72: =(Y72*4)+(AA72*2) -> 0
A73: GOALKICKERS | Q73: CANN | W73: COBURG | Y73: 0 | Z73: 2 | AA73: 0 | AB73: 141 | AC73: 202 | AD73: =(AB73/AC73)*100 -> 69.801980198019791 | AE73: =(Y73*4)+(AA73*2) -> 0
A74: SPRINGVALE | C74: PASSADOR 6 | F74: DONATI 5 | H74: ENTWISTLE 4 | K74: KNIGHT 3 | M74: SMITH 3 | O74: BARDSLEY 2 | R74: DELARUE | W74: BOX HILL | Y74: 0 | Z74: 2 | AA74: 0 | AB74: 181 | AC74: 275 | AD74: =(AB74/AC74)*100 -> 65.818181818181813 | AE74: =(Y74*4)+(AA74*2) -> 0
A75: BENDIGO | C75: PASCOE 4 | F75: SHARKEY 4 | I75: RUDD 3 | K75: BOWER 2 | N75: SCHMIDT 2 | Q75: LANCASTER
D76: 11TH APRIL | J76: WEATHER | M76: FINE
A77: PORT MELBOURNE | C77: 7 | D77: 3 | E77: =(C77*6)+D77 -> 45 | G77: 14 | H77: 5 | I77: =(G77*6)+H77 -> 89 | K77: 20 | L77: 6 | M77: =(K77*6)+L77 -> 126 | O77: 25 | P77: 7 | Q77: =(O77*6)+P77 -> 157 | S77: Venue: PORT MELBOURNE
A78: BOX HILL | C78: 2 | D78: 0 | E78: =(C78*6)+D78 -> 12 | G78: 5 | H78: 0 | I78: =(G78*6)+H78 -> 30 | K78: 8 | L78: 2 | M78: =(K78*6)+L78 -> 50 | O78: 16 | P78: 3 | Q78: =(O78*6)+P78 -> 99
A79: BEST PLAYERS
A80: PORT MELBOURNE | C80: McCORMICK | F80: GOODALE | I80: CROCKER | L80: CLOHESY | N80: FOLINO | Q80: COX
A81: BOX HILL | C81: JENKINS | F81: WILKINSON | I81: BREBNER | L81: PAWLIK | N81: NICHOL
A82: GOALKICKERS
A83: PORT MELBOURNE | C83: CROCKER 6 | E83: SEXTON 3 | G83: SCHAEFER 3 | J83: BAUMGARTNER 3 | N83: McCORMICK 2 | Q83: VILLAROSA 2 | U83: CLOHESY 2 | X83: McNAMARA 2 | AB83: D'GIACOMA | AD83: PICIAONE
A84: BOX HILL | C84: WILKINSON 6 | F84: JENKINS 4 | I84: TRANQUILLI 2 | M84: BREWER 2 | P84: BREBNER | R84: ROBINSON
A86: SANDRINGHAM | C86: 2 | D86: 8 | E86: =(C86*6)+D86 -> 20 | G86: 4 | H86: 12 | I86: =(G86*6)+H86 -> 36 | K86: 11 | L86: 17 | M86: =(K86*6)+L86 -> 83 | O86: 12 | P86: 20 | Q86: =(O86*6)+P86 -> 92 | S86: Venue: BEACH ROAD
A87: PRESTON | C87: 3 | D87: 1 | E87: =(C87*6)+D87 -> 19 | G87: 8 | H87: 4 | I87: =(G87*6)+H87 -> 52 | K87: 9 | L87: 4 | M87: =(K87*6)+L87 -> 58 | O87: 14 | P87: 8 | Q87: =(O87*6)+P87 -> 92
A88: BEST PLAYERS
A89: SANDRINGHAM | C89: HAYWARD | F89: MOLONEY | I89: NGUYEN
A90: PRESTON | C90: BONADIO | F90: HABERMAN | I90: GIBSON | L90: GRAINGER | O90: PASCOE | Q90: PENN
A91: GOALKICKERS
A92: SANDRINGHAM | C92: OAKLEY 3 | E92: MAGNUSSEN 2 | H92: SAUTNER | J92: McKELLAR | M92: BINGHAM | O92: SCOTT-BRANAGAN | S92: HAYWARD | W92: RADFORD | X92: KENNEDY
A93: PRESTON | C93: HAYWOOD 2 | F93: PENN 2 | H93: GRAINGER 2 | K93: WISENDEN 2 | N93: GIBSON 2 | P93: HALLINAN 2 | S93: CLOSE | V93: MILNE
A95: WERRIBEE | C95: 2 | D95: 1 | E95: =(C95*6)+D95 -> 13 | G95: 8 | H95: 4 | I95: =(G95*6)+H95 -> 52 | K95: 17 | L95: 8 | M95: =(K95*6)+L95 -> 110 | O95: 20 | P95: 9 | Q95: =(O95*6)+P95 -> 129 | S95: Venue: WERRIBEE
A96: FRANKSTON | C96: 6 | D96: 2 | E96: =(C96*6)+D96 -> 38 | G96: 11 | H96: 3 | I96: =(G96*6)+H96 -> 69 | K96: 16 | L96: 4 | M96: =(K96*6)+L96 -> 100 | O96: 18 | P96: 5 | Q96: =(O96*6)+P96 -> 113
A97: BEST PLAYERS
A98: WERRIBEE | C98: FORD | F98: FROST | I98: SPROULE | L98: ATKINS | N98: SAUNDERS | Q98: PULI
A99: FRANKSTON | C99: BURGMAN | F99: BURNELL | I99: DAFF | L99: WILLIAMS | N99: BUTLER
A100: GOALKICKERS
A101: WERRIBEE | C101: MITCHELL 3 | F101: SPROULE 3 | I101: SAUNDERS 2 | L101: PRIDDLE 2 | N101: FROST 2 | P101: SATTERLEY 2 | S101: FORD 2 | U101: CHURCHILL | X101: BUTTON | Z101: TAYLOR | AB101: FAULKNER
A102: FRANKSTON | C102: CLARKE 4 | F102: McCORMACK 4 | I102: WILLIAMS 3 | L102: LOVETT 2 | N102: KNOTT | P102: MURRAY | R102: ROBERTS | V102: MALLOY | X102: ANDERSON
A104: BYE | D104: NORTH BALLARAT
A106: ROUND 3 | D106: 17TH APRIL | J106: WEATHER
D107: 1ST QTR | H107: 2ND QTR | L107: 3RD QTR | P107: FINAL | S107: Venue: BOX HILL
A108: NORTH BALLARAT | C108: 6 | D108: 3 | E108: =(C108*6)+D108 -> 39 | G108: 12 | H108: 4 | I108: =(G108*6)+H108 -> 76 | K108: 14 | L108: 5 | M108: =(K108*6)+L108 -> 89 | O108: 17 | P108: 7 | Q108: =(O108*6)+P108 -> 109 | S108: UMPIRES | Z108: LADDER | AC108: ROUND | AE108: 3
A109: BOX HILL | C109: 3 | D109: 3 | E109: =(C109*6)+D109 -> 21 | G109: 5 | H109: 4 | I109: =(G109*6)+H109 -> 34 | K109: 9 | L109: 10 | M109: =(K109*6)+L109 -> 64 | O109: 15 | P109: 10 | Q109: =(O109*6)+P109 -> 100
A110: BEST PLAYERS | W110: TEAM | X110: B | Y110: W | Z110: L | AA110: D | AB110: FOR | AC110: AGST | AD110: % | AE110: PTS
A111: NORTH BALLARAT | C111: CLARKE | F111: CUTHBERTSON | J111: EDMONDS | M111: KENNEDY | P111: SNIBSON | R111: RUYG
A112: BOX HILL | C112: COLLINGS | F112: JENKINS | J112: TRANQUILLI | M112: GERTSMAN | P112: BREWER | R112: GEORGIADIS | W112: PORT MELBOURNE | Y112: 3 | Z112: 0 | AA112: 0 | AB112: 297 | AC112: 231 | AD112: =(AB112/AC112)*100 -> 128.57142857142858 | AE112: =(Y112*4)+(AA112*2) -> 12
A113: GOALKICKERS | Q113: CUTHBERTSON | W113: FRANKSTON | Y113: 2 | Z113: 1 | AA113: 0 | AB113: 390 | AC113: 253 | AD113: =(AB113/AC113)*100 -> 154.1501976284585 | AE113: =(Y113*4)+(AA113*2) -> 8
A114: NORTH BALLARAT | C114: EDMONDS 4 | F114: CLARKE 3 | H114: KIRZNER 3 | J114: JENKINS 2 | L114: FISHER 2 | N114: INKSTER | P114: RUYG | W114: WILLIAMSTOWN | X114: 1 | Y114: 2 | Z114: 0 | AA114: 0 | AB114: 193 | AC114: 146 | AD114: =(AB114/AC114)*100 -> 132.1917808219178 | AE114: =(Y114*4)+(AA114*2) -> 8
A115: BOX HILL | C115: GIANNOPOULOS 3 | F115: SIKORA 2 | H115: JENKINS 2 | J115: HABERFIELD | M115: GERTSMAN | P115: WILKINSON | R115: BREBNER | W115: SPRINGVALE | Y115: 2 | Z115: 1 | AA115: 0 | AB115: 365 | AC115: 301 | AD115: =(AB115/AC115)*100 -> 121.26245847176081 | AE115: =(Y115*4)+(AA115*2) -> 8
D116: 18TH APRIL | G116: WEATHER | J116: TRANQUILLI | M116: GEORGIADIS | P116: NICHOL | R116: SLATER | W116: WERRIBEE | Y116: 2 | Z116: 1 | AA116: 0 | AB116: 330 | AC116: 313 | AD116: =(AB116/AC116)*100 -> 105.43130990415335 | AE116: =(Y116*4)+(AA116*2) -> 8
A117: WILLIAMSTOWN | C117: 1 | D117: 4 | E117: =(C117*6)+D117 -> 10 | G117: 9 | H117: 8 | I117: =(G117*6)+H117 -> 62 | K117: 14 | L117: 11 | M117: =(K117*6)+L117 -> 95 | O117: 17 | P117: 14 | Q117: =(O117*6)+P117 -> 116 | S117: Venue: WHITTEN OVAL | W117: SANDRINGHAM | Y117: 1 | Z117: 1 | AA117: 1 | AB117: 281 | AC117: 290 | AD117: =(AB117/AC117)*100 -> 96.896551724137936 | AE117: =(Y117*4)+(AA117*2) -> 6
A118: WERRIBEE | C118: 6 | D118: 3 | E118: =(C118*6)+D118 -> 39 | G118: 6 | H118: 4 | I118: =(G118*6)+H118 -> 40 | K118: 10 | L118: 6 | M118: =(K118*6)+L118 -> 66 | O118: 12 | P118: 8 | Q118: =(O118*6)+P118 -> 80
A119: BEST PLAYERS | W119: NORTH BALLARAT | X119: 1 | Y119: 1 | Z119: 1 | AA119: 0 | AB119: 183 | AC119: 180 | AD119: =(AB119/AC119)*100 -> 101.66666666666666 | AE119: =(Y119*4)+(AA119*2) -> 4
A120: WILLIAMSTOWN | C120: DELRE | F120: TAYLOR | I120: GRIFFIN | L120: HOLLOW | O120: JUEGAN | Q120: HORE | W120: BENDIGO | Y120: 1 | Z120: 2 | AA120: 0 | AB120: 272 | AC120: 402 | AD120: =(AB120/AC120)*100 -> 67.661691542288565 | AE120: =(Y120*4)+(AA120*2) -> 4
A121: WERRIBEE | C121: CLONAN | F121: SHANNON | I121: WISEMAN | L121: GOODEY | O121: JACK | Q121: M SMITH | W121: PRESTON | Y121: 0 | Z121: 2 | AA121: 1 | AB121: 235 | AC121: 266 | AD121: =(AB121/AC121)*100 -> 88.345864661654133 | AE121: =(Y121*4)+(AA121*2) -> 2
A122: GOALKICKERS | W122: BOX HILL | Y122: 0 | Z122: 3 | AA122: 0 | AB122: 281 | AC122: 384 | AD122: =(AB122/AC122)*100 -> 73.177083333333343 | AE122: =(Y122*4)+(AA122*2) -> 0
A123: WILLIAMSTOWN | C123: DELRE 9 | F123: TAYLOR 3 | I123: BUGEJA 2 | L123: SHANKS | N123: STANLEY | P123: GHAZI | W123: COBURG | X123: 1 | Y123: 0 | Z123: 2 | AA123: 0 | AB123: 141 | AC123: 202 | AD123: =(AB123/AC123)*100 -> 69.801980198019791 | AE123: =(Y123*4)+(AA123*2) -> 0
A124: WERRIBEE | C124: M SMITH 3 | F124: JACK 3 | H124: SATTERLEY 2 | K124: BUTTON | M124: ROSS | O124: SHANNON | Q124: GOODEY
A126: PORT MELBOURNE | C126: 2 | D126: 2 | E126: =(C126*6)+D126 -> 14 | G126: 4 | H126: 5 | I126: =(G126*6)+H126 -> 29 | K126: 4 | L126: 6 | M126: =(K126*6)+L126 -> 30 | O126: 9 | P126: 6 | Q126: =(O126*6)+P126 -> 60 | S126: Venue: PRESTON
A127: PRESTON | C127: 1 | D127: 4 | E127: =(C127*6)+D127 -> 10 | G127: 4 | H127: 4 | I127: =(G127*6)+H127 -> 28 | K127: 6 | L127: 5 | M127: =(K127*6)+L127 -> 41 | O127: 8 | P127: 10 | Q127: =(O127*6)+P127 -> 58
A128: BEST PLAYERS
A129: PORT MELBOURNE | C129: GOODALE | F129: D'GIACOMA | I129: JESS | K129: CLOHESY | N129: SEXTON | Q129: SCHAEFER
A130: PRESTON | C130: BONADIO | F130: ZORZI | I130: GIBSON | K130: S TAYLOR | N130: HABERMAN
A131: GOALKICKERS
A132: PORT MELBOURNE | C132: BAUMGARTNER 2 | G132: CROCKER 2 | J132: DUANE 2 | M132: SEXTON 2 | P132: PICIAONE
A133: PRESTON | C133: PASCOE 2 | F133: PENN 2 | H133: GRAINGER | K133: MANGIN | M133: HABERMAN | P133: HOLLAND
A135: FRANKSTON | C135: 6 | D135: 4 | E135: =(C135*6)+D135 -> 40 | G135: 10 | H135: 8 | I135: =(G135*6)+H135 -> 68 | K135: 16 | L135: 11 | M135: =(K135*6)+L135 -> 107 | O135: 23 | P135: 14 | Q135: =(O135*6)+P135 -> 152 | S135: Venue: FRANKSTON
A136: BENDIGO | C136: 1 | D136: 1 | E136: =(C136*6)+D136 -> 7 | G136: 3 | H136: 4 | I136: =(G136*6)+H136 -> 22 | K136: 6 | L136: 5 | M136: =(K136*6)+L136 -> 41 | O136: 7 | P136: 7 | Q136: =(O136*6)+P136 -> 49
A137: BEST PLAYERS
A138: FRANKSTON | C138: CORN | F138: MALLOY | I138: BUTLER | L138: AGNELLO | N138: GEORGIOU | Q138: SULLIVAN
A139: BENDIGO | C139: DE ANGELIS | F139: O'CALLAGHAN | I139: ANGOVE | L139: ELSUM | N139: CURCIO | Q139: LANCASTER
A140: GOALKICKERS
A141: FRANKSTON | C141: CLARKE 4 | E141: MILLANE 3 | H141: SULLIVAN 3 | K141: MILES 3 | M141: MALLOY 3 | P141: McCORMACK 2 | S141: KNOTT 2 | W141: LOVETT | X141: AGNELLO | AA141: CORN
A142: BENDIGO | C142: RUDD 3 | F142: BLAKE | H142: O'CALLAGHAN | K142: PASCOE | M142: SHARKEY
A144: SPRINGVALE | C144: 2 | D144: 4 | E144: =(C144*6)+D144 -> 16 | G144: 10 | H144: 4 | I144: =(G144*6)+H144 -> 64 | K144: 13 | L144: 10 | M144: =(K144*6)+L144 -> 88 | O144: 17 | P144: 14 | Q144: =(O144*6)+P144 -> 116 | S144: Venue: SPRINGVALE
A145: SANDRINGHAM | C145: 2 | D145: 2 | E145: =(C145*6)+D145 -> 14 | G145: 6 | H145: 5 | I145: =(G145*6)+H145 -> 41 | K145: 9 | L145: 10 | M145: =(K145*6)+L145 -> 64 | O145: 10 | P145: 11 | Q145: =(O145*6)+P145 -> 71
A146: BEST PLAYERS
A147: SPRINGVALE | C147: DONATI | F147: J CARROLL | I147: SUTHERLAND | L147: FORD | N147: CANN | Q147: DELARUE
A148: SANDRINGHAM | C148: MITCHELSON | F148: LIDDELL | I148: HAYNES
A149: GOALKICKERS
A150: SPRINGVALE | C150: SMITH 5 | E150: DONATI 3 | G150: CANN 2 | I150: KNIGHT 2 | K150: D CARROLL | N150: J CARROLL | Q150: O'BRIEN | S150: PASSADOR | W150: DELARUE
A151: SANDRINGHAM | C151: SAUTNER 2 | F151: LIDDELL 2 | I151: SCOTT-BRANAGAN 2 | M151: L OAKLEY | P151: MAGNUSSEN | S151: HAYNES
A153: BYE | D153: COBURG
A155: ROUND 4 | D155: 24TH APRIL | J155: WEATHER
D156: 1ST QTR | H156: 2ND QTR | L156: 3RD QTR | P156: FINAL | S156: Venue: BEACH ROAD
A157: FRANKSTON | C157: 3 | D157: 3 | E157: =(C157*6)+D157 -> 21 | G157: 6 | H157: 7 | I157: =(G157*6)+H157 -> 43 | K157: 9 | L157: 10 | M157: =(K157*6)+L157 -> 64 | O157: 16 | P157: 11 | Q157: =(O157*6)+P157 -> 107 | S157: UMPIRES | Z157: LADDER | AC157: ROUND | AE157: 4
A158: SANDRINGHAM | C158: 4 | D158: 3 | E158: =(C158*6)+D158 -> 27 | G158: 8 | H158: 6 | I158: =(G158*6)+H158 -> 54 | K158: 11 | L158: 8 | M158: =(K158*6)+L158 -> 74 | O158: 14 | P158: 12 | Q158: =(O158*6)+P158 -> 96
A159: BEST PLAYERS | W159: TEAM | X159: B | Y159: W | Z159: L | AA159: D | AB159: FOR | AC159: AGST | AD159: % | AE159: PTS
A160: FRANKSTON | C160: BUTLER | F160: MILLANE | I160: CLARKE | L160: GEORGIOU | O160: SULLIVAN | R160: CORN
A161: SANDRINGHAM | C161: COGHLAN | F161: SAUTNER | I161: MACGEORGE | W161: PORT MELBOURNE | Y161: 4 | Z161: 0 | AA161: 0 | AB161: 391 | AC161: 308 | AD161: =(AB161/AC161)*100 -> 126.94805194805194 | AE161: =(Y161*4)+(AA161*2) -> 16
A162: GOALKICKERS | W162: WILLIAMSTOWN | X162: 1 | Y162: 3 | Z162: 0 | AA162: 0 | AB162: 411 | AC162: 223 | AD162: =(AB162/AC162)*100 -> 184.30493273542601 | AE162: =(Y162*4)+(AA162*2) -> 12
A163: FRANKSTON | C163: CLARKE 4 | E163: MILLANE 4 | H163: SULLIVAN 2 | K163: McCORMACK 2 | N163: KNOTT 2 | P163: MALLOY | R163: LOVETT | W163: FRANKSTON | Y163: 3 | Z163: 1 | AA163: 0 | AB163: 497 | AC163: 349 | AD163: =(AB163/AC163)*100 -> 142.40687679083095 | AE163: =(Y163*4)+(AA163*2) -> 12
A164: SANDRINGHAM | C164: SAUTNER 8 | F164: SCOTT-BRANAGAN 2 | J164: M GRANT | M164: QUINN | O164: L OAKLEY | R164: LIDDELL | W164: WERRIBEE | Y164: 3 | Z164: 1 | AA164: 0 | AB164: 468 | AC164: 353 | AD164: =(AB164/AC164)*100 -> 132.57790368271955 | AE164: =(Y164*4)+(AA164*2) -> 12
D165: NIGHT GAME | W165: NORTH BALLARAT | X165: 1 | Y165: 2 | Z165: 1 | AA165: 0 | AB165: 305 | AC165: 234 | AD165: =(AB165/AC165)*100 -> 130.34188034188034 | AE165: =(Y165*4)+(AA165*2) -> 8
A166: NORTH BALLARAT | C166: 3 | D166: 2 | E166: =(C166*6)+D166 -> 20 | G166: 7 | H166: 6 | I166: =(G166*6)+H166 -> 48 | K166: 13 | L166: 13 | M166: =(K166*6)+L166 -> 91 | O166: 18 | P166: 14 | Q166: =(O166*6)+P166 -> 122 | S166: Venue: NORTH BALLARAT | W166: SPRINGVALE | Y166: 2 | Z166: 2 | AA166: 0 | AB166: 442 | AC166: 395 | AD166: =(AB166/AC166)*100 -> 111.89873417721519 | AE166: =(Y166*4)+(AA166*2) -> 8
A167: PRESTON | C167: 2 | D167: 2 | E167: =(C167*6)+D167 -> 14 | G167: 3 | H167: 3 | I167: =(G167*6)+H167 -> 21 | K167: 4 | L167: 6 | M167: =(K167*6)+L167 -> 30 | O167: 8 | P167: 6 | Q167: =(O167*6)+P167 -> 54
A168: BEST PLAYERS | W168: SANDRINGHAM | Y168: 1 | Z168: 2 | AA168: 1 | AB168: 377 | AC168: 397 | AD168: =(AB168/AC168)*100 -> 94.962216624685141 | AE168: =(Y168*4)+(AA168*2) -> 6
A169: NORTH BALLARAT | C169: JURICA | F169: EDMONDS | I169: KIRZNER | L169: JENKINS | O169: EDWARDS | R169: KENNEDY | W169: BENDIGO | Y169: 1 | Z169: 3 | AA169: 0 | AB169: 349 | AC169: 520 | AD169: =(AB169/AC169)*100 -> 67.115384615384613 | AE169: =(Y169*4)+(AA169*2) -> 4
A170: PRESTON | C170: GRAINGER | F170: ZORZI | I170: HABERMAN | W170: PRESTON | Y170: 0 | Z170: 3 | AA170: 1 | AB170: 289 | AC170: 388 | AD170: =(AB170/AC170)*100 -> 74.484536082474222 | AE170: =(Y170*4)+(AA170*2) -> 2
A171: GOALKICKERS | O171: McDONALD | R171: B QUINLAN | W171: BOX HILL | X171: 1 | Y171: 0 | Z171: 3 | AA171: 0 | AB171: 281 | AC171: 384 | AD171: =(AB171/AC171)*100 -> 73.177083333333343 | AE171: =(Y171*4)+(AA171*2) -> 0
A172: NORTH BALLARAT | C172: KIRZNER 6 | E172: CUTHBERTSON 3 | I172: INKSTER 2 | L172: PEAKE 2 | N172: EDMONDS 2 | Q172: KENNEDY | W172: COBURG | X172: 1 | Y172: 0 | Z172: 3 | AA172: 0 | AB172: 181 | AC172: 340 | AD172: =(AB172/AC172)*100 -> 53.235294117647058 | AE172: =(Y172*4)+(AA172*2) -> 0
A173: PRESTON | C173: PASCOE | E173: PLUNKETT | H173: FROST | J173: GRAINGER | M173: ZORZI | O173: CLARKE | Q173: PITT | R173: HOLLAND
D174: 25TH APRIL | J174: WEATHER
A175: WILLIAMSTOWN | C175: 2 | D175: 4 | E175: =(C175*6)+D175 -> 16 | G175: 8 | H175: 8 | I175: =(G175*6)+H175 -> 56 | K175: 14 | L175: 8 | M175: =(K175*6)+L175 -> 92 | O175: 18 | P175: 10 | Q175: =(O175*6)+P175 -> 118 | S175: Venue: BENDIGO
A176: BENDIGO | C176: 3 | D176: 3 | E176: =(C176*6)+D176 -> 21 | G176: 7 | H176: 6 | I176: =(G176*6)+H176 -> 48 | K176: 10 | L176: 7 | M176: =(K176*6)+L176 -> 67 | O176: 11 | P176: 11 | Q176: =(O176*6)+P176 -> 77
A177: BEST PLAYERS
A178: WILLIAMSTOWN | C178: ROUND | F178: REYNOLDS | I178: TAYLOR | L178: GRIFFIN | O178: SIR | Q178: McMAHON
A179: BENDIGO | C179: CURCIO | F179: ANGOVE | I179: O'CALLAGHAN | L179: W BLAKE | O179: HARROP | Q179: DE ANGELIS
A180: GOALKICKERS
A181: WILLIAMSTOWN | C181: TAYLOR 3 | E181: DELRE 2 | G181: GHAZI 2 | I181: BUGEJA 2 | K181: CHRISTOFORO 2 | N181: REYNOLDS | Q181: HORE | S181: ROUND | V181: EAMES | X181: STANLEY | AA181: RAILTON | AC181: SIR
A182: BENDIGO | C182: LANCASTER 3 | F182: CURCIO 2 | I182: O'SHANNESSY | L182: PASCOE | N182: RUDD | P182: SCHMIDT | R182: SHIELS | U182: WHITSED
A184: PORT MELBOURNE | C184: 5 | D184: 5 | E184: =(C184*6)+D184 -> 35 | G184: 7 | H184: 8 | I184: =(G184*6)+H184 -> 50 | K184: 10 | L184: 13 | M184: =(K184*6)+L184 -> 73 | O184: 13 | P184: 16 | Q184: =(O184*6)+P184 -> 94 | S184: Venue: PORT MELBOURNE
A185: SPRINGVALE | C185: 3 | D185: 4 | E185: =(C185*6)+D185 -> 22 | G185: 4 | H185: 10 | I185: =(G185*6)+H185 -> 34 | K185: 8 | L185: 16 | M185: =(K185*6)+L185 -> 64 | O185: 10 | P185: 17 | Q185: =(O185*6)+P185 -> 77
A186: BEST PLAYERS
A187: PORT MELBOURNE | C187: SCHAEFER | F187: SHARP | I187: JESS | L187: DOBELL | O187: McNAMARA | R187: SEXTON
A188: SPRINGVALE | C188: LITTLE | F188: SHEAHAN | I188: J CARROLL | L188: DELARUE | O188: CLARK
A189: GOALKICKERS
A190: PORT MELBOURNE | C190: McNAMARA 6 | F190: PICIAONE 3 | I190: COLLINS | K190: SEXTON | M190: DUANE | O190: FOLINO
A191: SPRINGVALE | C191: DONATI 2 | F191: CANN | H191: J CARROLL | J191: CLARKE | L191: CLARK | N191: KNIGHT | P191: PASSADORE | S191: SHERRY | W191: WOODMAN
A193: WERRIBEE | C193: 4 | D193: 4 | E193: =(C193*6)+D193 -> 28 | G193: 10 | H193: 9 | I193: =(G193*6)+H193 -> 69 | K193: 12 | L193: 10 | M193: =(K193*6)+L193 -> 82 | O193: 21 | P193: 12 | Q193: =(O193*6)+P193 -> 138 | S193: Venue: WERRIBEE
A194: COBURG | C194: 0 | D194: 1 | E194: =(C194*6)+D194 -> 1 | G194: 1 | H194: 1 | I194: =(G194*6)+H194 -> 7 | K194: 4 | L194: 3 | M194: =(K194*6)+L194 -> 27 | O194: 6 | P194: 4 | Q194: =(O194*6)+P194 -> 40
A195: BEST PLAYERS
A196: WERRIBEE | C196: FAULKNER | F196: FROST | I196: BUTTON | L196: PULI | O196: ATKINS | Q196: S SMITH
A197: COBURG | C197: DE PASQUALE | F197: FLETCHER | I197: PEVERILL | L197: SHEATHER | O197: CONDON | Q197: O'CALLAGHAN
A198: GOALKICKERS
A199: WERRIBEE | C199: S SMITH 7 | F199: BUTTON 4 | I199: SATTERLEY 2 | L199: FORD | N199: FROST | P199: JACK | R199: MITCHELL | V199: REARDON | X199: SAUNDERS | AA199: SHANNON | AC199: M SMITH
A200: COBURG | C200: MANSFIELD 3 | F200: BICER | H200: CUSWORTH | K200: KEENAN
A202: BYE | D202: BOX HILL
A204: ROUND 5 | D204: 1ST MAY | J204: WEATHER
D205: 1ST QTR | H205: 2ND QTR | L205: 3RD QTR | P205: FINAL | S205: Venue: PRESTON
A206: PRESTON | C206: 1 | D206: 7 | E206: =(C206*6)+D206 -> 13 | G206: 5 | H206: 10 | I206: =(G206*6)+H206 -> 40 | K206: 6 | L206: 14 | M206: =(K206*6)+L206 -> 50 | O206: 9 | P206: 19 | Q206: =(O206*6)+P206 -> 73 | S206: UMPIRES | Z206: LADDER | AC206: ROUND | AE206: 5
A207: BOX HILL | C207: 3 | D207: 1 | E207: =(C207*6)+D207 -> 19 | G207: 5 | H207: 4 | I207: =(G207*6)+H207 -> 34 | K207: 8 | L207: 10 | M207: =(K207*6)+L207 -> 58 | O207: 10 | P207: 13 | Q207: =(O207*6)+P207 -> 73
A208: BEST PLAYERS | W208: TEAM | X208: B | Y208: W | Z208: L | AA208: D | AB208: FOR | AC208: AGST | AD208: % | AE208: PTS
A209: PRESTON | C209: PLUNKETT | F209: HABERMAN | I209: GRAINGER | L209: GAY | N209: MANGIN | Q209: S TAYLOR
A210: BOX HILL | C210: BREWER | F210: TRANQUILLI | I210: HABERFEILD | L210: NICHOL | N210: JENKINS | W210: WILLIAMSTOWN | X210: 1 | Y210: 4 | Z210: 0 | AA210: 0 | AB210: 532 | AC210: 324 | AD210: =(AB210/AC210)*100 -> 164.19753086419752 | AE210: =(Y210*4)+(AA210*2) -> 16
A211: GOALKICKERS | W211: FRANKSTON | Y211: 4 | Z211: 1 | AA211: 0 | AB211: 619 | AC211: 402 | AD211: =(AB211/AC211)*100 -> 153.98009950248758 | AE211: =(Y211*4)+(AA211*2) -> 16
A212: PRESTON | C212: MANGIN 3 | F212: PLUNKETT 2 | I212: PENN | K212: MANN | M212: GIBSON | O212: GAY | W212: PORT MELBOURNE | Y212: 4 | Z212: 1 | AA212: 0 | AB212: 444 | AC212: 430 | AD212: =(AB212/AC212)*100 -> 103.25581395348837 | AE212: =(Y212*4)+(AA212*2) -> 16
A213: BOX HILL | C213: GIANNOPOULOS 3 | F213: SIKORA 2 | H213: BREBNER | J213: ECCLES | L213: GERSTMAN | O213: PARTHENIDES | R213: ROWE | W213: NORTH BALLARAT | X213: 1 | Y213: 3 | Z213: 1 | AA213: 0 | AB213: 392 | AC213: 289 | AD213: =(AB213/AC213)*100 -> 135.64013840830449 | AE213: =(Y213*4)+(AA213*2) -> 12
D214: 2ND MAY | J214: WEATHER | W214: WERRIBEE | X214: 1 | Y214: 3 | Z214: 1 | AA214: 0 | AB214: 468 | AC214: 353 | AD214: =(AB214/AC214)*100 -> 132.57790368271955 | AE214: =(Y214*4)+(AA214*2) -> 12
A215: NORTH BALLARAT | C215: 2 | D215: 3 | E215: =(C215*6)+D215 -> 15 | G215: 5 | H215: 6 | I215: =(G215*6)+H215 -> 36 | K215: 7 | L215: 11 | M215: =(K215*6)+L215 -> 53 | O215: 12 | P215: 15 | Q215: =(O215*6)+P215 -> 87 | S215: Venue: SPRINGVALE | W215: SPRINGVALE | Y215: 2 | Z215: 3 | AA215: 0 | AB215: 497 | AC215: 482 | AD215: =(AB215/AC215)*100 -> 103.11203319502073 | AE215: =(Y215*4)+(AA215*2) -> 8
A216: SPRINGVALE | C216: 2 | D216: 2 | E216: =(C216*6)+D216 -> 14 | G216: 4 | H216: 10 | I216: =(G216*6)+H216 -> 34 | K216: 5 | L216: 11 | M216: =(K216*6)+L216 -> 41 | O216: 7 | P216: 13 | Q216: =(O216*6)+P216 -> 55
A217: BEST PLAYERS | W217: SANDRINGHAM | Y217: 1 | Z217: 3 | AA217: 1 | AB217: 478 | AC217: 518 | AD217: =(AB217/AC217)*100 -> 92.277992277992283 | AE217: =(Y217*4)+(AA217*2) -> 6
A218: NORTH BALLARAT | C218: SNIBSON | F218: MURPHY | I218: EDMONDS | L218: KENNEDY | O218: JURICA | Q218: CLARKE | W218: PRESTON | Y218: 0 | Z218: 3 | AA218: 2 | AB218: 362 | AC218: 461 | AD218: =(AB218/AC218)*100 -> 78.524945770065074 | AE218: =(Y218*4)+(AA218*2) -> 4
A219: SPRINGVALE | C219: BARDSLEY | F219: D CARROLL | I219: CAPLES | L219: SUTHERLAND | O219: O'DONNELL | W219: COBURG | X219: 1 | Y219: 1 | Z219: 3 | AA219: 0 | AB219: 301 | AC219: 403 | AD219: =(AB219/AC219)*100 -> 74.689826302729529 | AE219: =(Y219*4)+(AA219*2) -> 4
A220: GOALKICKERS | W220: BENDIGO | Y220: 1 | Z220: 4 | AA220: 0 | AB220: 412 | AC220: 640 | AD220: =(AB220/AC220)*100 -> 64.375 | AE220: =(Y220*4)+(AA220*2) -> 4
A221: NORTH BALLARAT | C221: KIRZNER 4 | F221: FISHER 2 | H221: T POLKINGHORNE | L221: JURICA | N221: EDMONDS | Q221: RUYG | R221: INKSTER | W221: BOX HILL | X221: 1 | Y221: 0 | Z221: 3 | AA221: 1 | AB221: 354 | AC221: 457 | AD221: =(AB221/AC221)*100 -> 77.461706783369806 | AE221: =(Y221*4)+(AA221*2) -> 2
A222: SPRINGVALE | C222: SMITH 2 | F222: CANN | H222: J CARROLL | J222: CLARK | L222: FORD | N222: KNIGHT
A224: FRANKSTON | C224: 5 | D224: 1 | E224: =(C224*6)+D224 -> 31 | G224: 9 | H224: 1 | I224: =(G224*6)+H224 -> 55 | K224: 14 | L224: 5 | M224: =(K224*6)+L224 -> 89 | O224: 19 | P224: 8 | Q224: =(O224*6)+P224 -> 122 | S224: Venue: FRANKSTON
A225: PORT MELBOURNE | C225: 2 | D225: 4 | E225: =(C225*6)+D225 -> 16 | G225: 5 | H225: 6 | I225: =(G225*6)+H225 -> 36 | K225: 5 | L225: 10 | M225: =(K225*6)+L225 -> 40 | O225: 7 | P225: 11 | Q225: =(O225*6)+P225 -> 53
A226: BEST PLAYERS
A227: FRANKSTON
A228: PORT MELBOURNE
A229: GOALKICKERS
A230: FRANKSTON | C230: WILLIAMS 4 | F230: CLARKE 4 | H230: MILLANE 3 | J230: KNOTT 2 | L230: McCORMACK | O230: LOVETT | Q230: MILES | S230: CORRIGAN | W230: STRINGER | X230: KENNEDY
A231: PORT MELBOURNE | C231: FOLINO 2 | F231: CAMERON | I231: DUANE | K231: PICIAONE | N231: SCHAEFER | Q231: VILLAROSA
A233: WILLIAMSTOWN | C233: 0 | D233: 3 | E233: =(C233*6)+D233 -> 3 | G233: 8 | H233: 4 | I233: =(G233*6)+H233 -> 52 | K233: 12 | L233: 8 | M233: =(K233*6)+L233 -> 80 | O233: 18 | P233: 13 | Q233: =(O233*6)+P233 -> 121 | S233: Venue: WILLIAMSTOWN
A234: SANDRINGHAM | C234: 5 | D234: 4 | E234: =(C234*6)+D234 -> 34 | G234: 8 | H234: 7 | I234: =(G234*6)+H234 -> 55 | K234: 11 | L234: 11 | M234: =(K234*6)+L234 -> 77 | O234: 14 | P234: 17 | Q234: =(O234*6)+P234 -> 101
A235: BEST PLAYERS
A236: WILLIAMSTOWN | C236: STANLEY | F236: REYNOLDS | I236: GRIFFIN | L236: HORE | N236: N JUEGAN | Q236: BROWN
A237: SANDRINGHAM | C237: MACGEORGE | F237: QUINN | I237: HAYNES | L237: MAGNUSSEN | O237: McKELLAR
A238: GOALKICKERS
A239: WILLIAMSTOWN | C239: TAYLOR 4 | E239: REYNOLDS 3 | H239: STANLEY 3 | K239: DELRE 3 | M239: HORE | O239: ROUND | Q239: BUGEJA | S239: SHANKS | W239: GHAZI
A240: SANDRINGHAM | C240: SCOTT-BRANAGAN 4 | G240: LIDDELL 3 | I240: COGHLAN 2 | L240: HAYNES | N240: TREGEAR | P240: MALONEY | R240: GILLIGAN | V240: KENNEDY
A242: COBURG | C242: 5 | D242: 2 | E242: =(C242*6)+D242 -> 32 | G242: 10 | H242: 2 | I242: =(G242*6)+H242 -> 62 | K242: 16 | L242: 4 | M242: =(K242*6)+L242 -> 100 | O242: 19 | P242: 6 | Q242: =(O242*6)+P242 -> 120 | S242: Venue: COBURG
A243: BENDIGO | C243: 2 | D243: 5 | E243: =(C243*6)+D243 -> 17 | G243: 4 | H243: 9 | I243: =(G243*6)+H243 -> 33 | K243: 5 | L243: 14 | M243: =(K243*6)+L243 -> 44 | O243: 7 | P243: 21 | Q243: =(O243*6)+P243 -> 63
A244: BEST PLAYERS
A245: COBURG | C245: DUNCAN | F245: ALESSIO | I245: SHEATHER | L245: CONDON | O245: KEENAN | Q245: WILLOUGHBY
A246: BENDIGO | C246: ANGOVE | F246: LANCASTER | I246: DE ANGELIS | L246: CURCIO | O246: O'CALLAGHAN | R246: O'SHANNESSY
A247: GOALKICKERS
A248: COBURG | C248: ALESSIO 7 | E248: DUNCAN 3 | H248: DE PASQUALE 2 | K248: O'CONNOR 2 | N248: CUSWORTH | Q248: WEBBER | S248: BICER | V248: TORTORA | X248: PIGNATARO
A249: BENDIGO | C249: SHARKEY 3 | F249: BOWER | H249: PASCOE | J249: PROWES | L249: SHIELS
A251: BYE | D251: WERRIBEE
A253: ROUND 6 | D253: 8TH MAY | J253: WEATHER
D254: 1ST QTR | H254: 2ND QTR | L254: 3RD QTR | P254: FINAL | S254: Venue: NORTH BALLARAT
A255: NORTH BALLARAT | C255: 4 | D255: 1 | E255: =(C255*6)+D255 -> 25 | G255: 6 | H255: 3 | I255: =(G255*6)+H255 -> 39 | K255: 9 | L255: 5 | M255: =(K255*6)+L255 -> 59 | O255: 9 | P255: 10 | Q255: =(O255*6)+P255 -> 64 | S255: UMPIRES | Z255: LADDER | AC255: ROUND | AE255: 6
A256: FRANKSTON | C256: 0 | D256: 2 | E256: =(C256*6)+D256 -> 2 | G256: 1 | H256: 3 | I256: =(G256*6)+H256 -> 9 | K256: 2 | L256: 5 | M256: =(K256*6)+L256 -> 17 | O256: 4 | P256: 11 | Q256: =(O256*6)+P256 -> 35
A257: BEST PLAYERS | W257: TEAM | X257: B | Y257: W | Z257: L | AA257: D | AB257: FOR | AC257: AGST | AD257: % | AE257: PTS
A258: NORTH BALLARAT | C258: SNIBSON | F258: J POLKINGHORNE | J258: CLARKE | M258: KENNEDY | P258: PEAKE | R258: FIELD
A259: FRANKSTON | C259: ROBERTS | F259: BURGMAN | J259: DAFF | M259: BUTLER | W259: PORT MELBOURNE | Y259: 5 | Z259: 1 | AA259: 0 | AB259: 575 | AC259: 509 | AD259: =(AB259/AC259)*100 -> 112.96660117878193 | AE259: =(Y259*4)+(AA259*2) -> 20
A260: GOALKICKERS | W260: NORTH BALLARAT | X260: 1 | Y260: 4 | Z260: 1 | AA260: 0 | AB260: 456 | AC260: 324 | AD260: =(AB260/AC260)*100 -> 140.74074074074073 | AE260: =(Y260*4)+(AA260*2) -> 16
A261: NORTH BALLARAT | C261: FISHER 4 | F261: EDMONDS 2 | I261: CUTHBERTSON 2 | M261: INKSTER | W261: FRANKSTON | Y261: 4 | Z261: 2 | AA261: 0 | AB261: 654 | AC261: 466 | AD261: =(AB261/AC261)*100 -> 140.34334763948496 | AE261: =(Y261*4)+(AA261*2) -> 16
A262: FRANKSTON | C262: VOLKES | F262: CORN | H262: STRINGER | K262: MILLANE | W262: WILLIAMSTOWN | X262: 1 | Y262: 4 | Z262: 1 | AA262: 0 | AB262: 611 | AC262: 455 | AD262: =(AB262/AC262)*100 -> 134.28571428571428 | AE262: =(Y262*4)+(AA262*2) -> 16
D263: 9TH MAY | J263: WEATHER | W263: WERRIBEE | X263: 1 | Y263: 4 | Z263: 1 | AA263: 0 | AB263: 559 | AC263: 432 | AD263: =(AB263/AC263)*100 -> 129.39814814814815 | AE263: =(Y263*4)+(AA263*2) -> 16
A264: PORT MELBOURNE | C264: 4 | D264: 3 | E264: =(C264*6)+D264 -> 27 | G264: 10 | H264: 5 | I264: =(G264*6)+H264 -> 65 | K264: 15 | L264: 8 | M264: =(K264*6)+L264 -> 98 | O264: 20 | P264: 11 | Q264: =(O264*6)+P264 -> 131 | S264: Venue: PORT MELBOURNE | W264: SPRINGVALE | Y264: 3 | Z264: 3 | AA264: 0 | AB264: 580 | AC264: 557 | AD264: =(AB264/AC264)*100 -> 104.12926391382406 | AE264: =(Y264*4)+(AA264*2) -> 12
A265: WILLIAMSTOWN | C265: 4 | D265: 2 | E265: =(C265*6)+D265 -> 26 | G265: 7 | H265: 3 | I265: =(G265*6)+H265 -> 45 | K265: 9 | L265: 6 | M265: =(K265*6)+L265 -> 60 | O265: 12 | P265: 7 | Q265: =(O265*6)+P265 -> 79
A266: BEST PLAYERS | W266: SANDRINGHAM | Y266: 2 | Z266: 3 | AA266: 1 | AB266: 634 | AC266: 555 | AD266: =(AB266/AC266)*100 -> 114.23423423423425 | AE266: =(Y266*4)+(AA266*2) -> 10
A267: PORT MELBOURNE | C267: DOBELL | F267: McCORMICK | J267: DURLING | M267: FOLINO | P267: JESS | R267: GOODALE | W267: PRESTON | X267: 1 | Y267: 0 | Z267: 3 | AA267: 2 | AB267: 362 | AC267: 461 | AD267: =(AB267/AC267)*100 -> 78.524945770065074 | AE267: =(Y267*4)+(AA267*2) -> 4
A268: WILLIAMSTOWN | C268: DELRE | F268: ROUND | J268: HORE | M268: STANLEY | P268: SIR | W268: BENDIGO | Y268: 1 | Z268: 5 | AA268: 0 | AB268: 491 | AC268: 731 | AD268: =(AB268/AC268)*100 -> 67.168262653898765 | AE268: =(Y268*4)+(AA268*2) -> 4
A269: GOALKICKERS | L269: PICIAONE 2 | O269: FOLINO | Q269: DUANE | S269: SEXTON | W269: COBURG | X269: 1 | Y269: 1 | Z269: 4 | AA269: 0 | AB269: 338 | AC269: 564 | AD269: =(AB269/AC269)*100 -> 59.929078014184398 | AE269: =(Y269*4)+(AA269*2) -> 4
A270: PORT MELBOURNE | C270: DURLING 3 | E270: McCORMICK 3 | H270: SCHAEFER 3 | K270: BAUMGARTNER 2 | O270: DOBELL 2 | Q270: GOODALE 2 | W270: BOX HILL | X270: 1 | Y270: 0 | Z270: 4 | AA270: 1 | AB270: 429 | AC270: 540 | AD270: =(AB270/AC270)*100 -> 79.444444444444443 | AE270: =(Y270*4)+(AA270*2) -> 2
A271: WILLIAMSTOWN | C271: DELRE 6 | F271: GHAZI 2 | H271: HOLLOW | J271: HORE | L271: SHANKS | N271: EAMES
A273: WERRIBEE | C273: 3 | D273: 2 | E273: =(C273*6)+D273 -> 20 | G273: 8 | H273: 6 | I273: =(G273*6)+H273 -> 54 | K273: 12 | L273: 8 | M273: =(K273*6)+L273 -> 80 | O273: 13 | P273: 13 | Q273: =(O273*6)+P273 -> 91 | S273: Venue: BENDIGO
A274: BENDIGO | C274: 2 | D274: 3 | E274: =(C274*6)+D274 -> 15 | G274: 4 | H274: 7 | I274: =(G274*6)+H274 -> 31 | K274: 9 | L274: 9 | M274: =(K274*6)+L274 -> 63 | O274: 11 | P274: 13 | Q274: =(O274*6)+P274 -> 79
A275: BEST PLAYERS
A276: WERRIBEE | C276: BUTTON | F276: FROST | I276: FAULKNER | L276: SUTTON | N276: SAUNDERS | Q276: ATKINS
A277: BENDIGO | C277: DE ANGELIS | F277: SCHMIDT | I277: W BLAKE | L277: ANGOVE | N277: S BLAKE | Q277: LANCASTER
A278: GOALKICKERS
A279: WERRIBEE | C279: SMITH 5 | F279: BUTTON 3 | I279: PULI | K279: FROST | M279: SAUNDERS | P279: MITCHELL | R279: JACK
A280: BENDIGO | C280: SHARKEY 3 | F280: BOWER 2 | I280: DE ANGELIS 2 | L280: BLAKE | N280: PROWSE | P280: VAN DEN HAM | T280: WHITSED
A282: SANDRINGHAM | C282: 4 | D282: 3 | E282: =(C282*6)+D282 -> 27 | G282: 8 | H282: 13 | I282: =(G282*6)+H282 -> 61 | K282: 13 | L282: 17 | M282: =(K282*6)+L282 -> 95 | O282: 24 | P282: 17 | Q282: =(O282*6)+P282 -> 161 | S282: Venue: BEACH ROAD
A283: COBURG | C283: 0 | D283: 2 | E283: =(C283*6)+D283 -> 2 | G283: 1 | H283: 3 | I283: =(G283*6)+H283 -> 9 | K283: 2 | L283: 4 | M283: =(K283*6)+L283 -> 16 | O283: 5 | P283: 7 | Q283: =(O283*6)+P283 -> 37
A284: BEST PLAYERS
A285: SANDRINGHAM | C285: MACGEORGE | F285: SAUTNER | I285: McKELLAR | M285: HAYNES | O285: TREGEAR | Q285: GRANT
A286: COBURG | C286: POTTER | F286: GILPIN | I286: DE PASQUALE | M286: McLEOD | O286: ALESSIO | Q286: McHARDY
A287: GOALKICKERS
A288: SANDRINGHAM | C288: SAUTNER 9 | F288: MACGEORGE 5 | I288: COGHLAN 3 | L288: LIDDELL 2 | N288: HAYNES 2 | Q288: NGUYEN | T288: SCOTT-BRANAGAN | X288: MITCHELSON
A289: COBURG | C289: TORTORA | F289: WILLOUGHBY | I289: O'CONNOR | L289: DUNCAN | N289: PIGNATARO
A291: SPRINGVALE | C291: 3 | D291: 3 | E291: =(C291*6)+D291 -> 21 | G291: 7 | H291: 4 | I291: =(G291*6)+H291 -> 46 | K291: 12 | L291: 6 | M291: =(K291*6)+L291 -> 78 | O291: 12 | P291: 11 | Q291: =(O291*6)+P291 -> 83 | S291: Venue: BOX HILL
A292: BOX HILL | C292: 1 | D292: 7 | E292: =(C292*6)+D292 -> 13 | G292: 4 | H292: 10 | I292: =(G292*6)+H292 -> 34 | K292: 6 | L292: 13 | M292: =(K292*6)+L292 -> 49 | O292: 10 | P292: 15 | Q292: =(O292*6)+P292 -> 75
A293: BEST PLAYERS
A294: SPRINGVALE | C294: DELARUE | F294: JEFFS | I294: D CARROLL | L294: FORD | O294: SMITH | Q294: TAYLOR
A295: BOX HILL | C295: BREBNER | F295: DISNEY | I295: HOLLAND | L295: McCARTNEY | O295: ROWE | Q295: WILKINSON
A296: GOALKICKERS
A297: SPRINGVALE | C297: SMITH 5 | F297: J CARROLL 2 | I297: D CARROLL | L297: DELARUE | N297: DWYER | P297: LITTLE | R297: CLARK
A298: BOX HILL | C298: TRANQUILLI 4 | F298: WILKINSON | I298: SIKORA | K298: JENKINS | M298: CROWLEY | P298: BREWER | R298: BREBNER
A300: BYE | D300: PRESTON
A302: ROUND 7 | D302: 15TH MAY | J302: WEATHER
D303: 1ST QTR | H303: 2ND QTR | L303: 3RD QTR | P303: FINAL | S303: Venue: WILLIAMSTOWN
A304: NORTH BALLARAT | C304: 1 | D304: 7 | E304: =(C304*6)+D304 -> 13 | G304: 2 | H304: 8 | I304: =(G304*6)+H304 -> 20 | K304: 6 | L304: 11 | M304: =(K304*6)+L304 -> 47 | O304: 7 | P304: 14 | Q304: =(O304*6)+P304 -> 56 | S304: UMPIRES | Z304: LADDER | AC304: ROUND | AE304: 7
A305: WILLIAMSTOWN | C305: 0 | D305: 0 | E305: =(C305*6)+D305 -> 0 | G305: 0 | H305: 1 | I305: =(G305*6)+H305 -> 1 | K305: 2 | L305: 3 | M305: =(K305*6)+L305 -> 15 | O305: 2 | P305: 4 | Q305: =(O305*6)+P305 -> 16
A306: BEST PLAYERS | W306: TEAM | X306: B | Y306: W | Z306: L | AA306: D | AB306: FOR | AC306: AGST | AD306: % | AE306: PTS
A307: NORTH BALLARAT | C307: FIELD | E307: PEAKE | H307: CLARKE | K307: J POLKINGHORNE | O307: EDMONDS | Q307: JENKINS
A308: WILLIAMSTOWN | C308: WEST | E308: McMAHON | H308: REYNOLDS | K308: ROUND | O308: ZAVALAS | W308: PORT MELBOURNE | Y308: 6 | Z308: 1 | AA308: 0 | AB308: 680 | AC308: 551 | AD308: =(AB308/AC308)*100 -> 123.41197822141561 | AE308: =(Y308*4)+(AA308*2) -> 24
A309: GOALKICKERS | W309: FRANKSTON | Y309: 5 | Z309: 2 | AA309: 0 | AB309: 798 | AC309: 524 | AD309: =(AB309/AC309)*100 -> 152.29007633587784 | AE309: =(Y309*4)+(AA309*2) -> 20
A310: NORTH BALLARAT | C310: KIRZNER 2 | F310: CLARKE | H310: J POLKINGHORNE | L310: EDMONDS | N310: JURICA | P310: PEAKE | W310: NORTH BALLARAT | X310: 1 | Y310: 5 | Z310: 1 | AA310: 0 | AB310: 512 | AC310: 340 | AD310: =(AB310/AC310)*100 -> 150.58823529411765 | AE310: =(Y310*4)+(AA310*2) -> 20
A311: WILLIAMSTOWN | C311: TAYLOR | F311: SHANKS | W311: WERRIBEE | X311: 1 | Y311: 5 | Z311: 1 | AA311: 0 | AB311: 646 | AC311: 514 | AD311: =(AB311/AC311)*100 -> 125.68093385214007 | AE311: =(Y311*4)+(AA311*2) -> 20
D312: 16TH MAY | J312: WEATHER | W312: WILLIAMSTOWN | X312: 1 | Y312: 4 | Z312: 2 | AA312: 0 | AB312: 627 | AC312: 511 | AD312: =(AB312/AC312)*100 -> 122.70058708414872 | AE312: =(Y312*4)+(AA312*2) -> 16
A313: FRANKSTON | C313: 8 | D313: 5 | E313: =(C313*6)+D313 -> 53 | G313: 14 | H313: 8 | I313: =(G313*6)+H313 -> 92 | K313: 17 | L313: 10 | M313: =(K313*6)+L313 -> 112 | O313: 22 | P313: 12 | Q313: =(O313*6)+P313 -> 144 | S313: Venue: FRANKSTON | W313: SPRINGVALE | Y313: 4 | Z313: 3 | AA313: 0 | AB313: 677 | AC313: 602 | AD313: =(AB313/AC313)*100 -> 112.45847176079735 | AE313: =(Y313*4)+(AA313*2) -> 16
A314: BOX HILL | C314: 0 | D314: 2 | E314: =(C314*6)+D314 -> 2 | G314: 0 | H314: 6 | I314: =(G314*6)+H314 -> 6 | K314: 4 | L314: 13 | M314: =(K314*6)+L314 -> 37 | O314: 7 | P314: 16 | Q314: =(O314*6)+P314 -> 58
A315: BEST PLAYERS | W315: SANDRINGHAM | Y315: 2 | Z315: 4 | AA315: 1 | AB315: 716 | AC315: 642 | AD315: =(AB315/AC315)*100 -> 111.5264797507788 | AE315: =(Y315*4)+(AA315*2) -> 10
A316: FRANKSTON | C316: GEORGIOU | F316: BURNELL | I316: BUTLER | L316: LOVETT | O316: ROBERTS | R316: STRINGER | W316: PRESTON | X316: 1 | Y316: 0 | Z316: 4 | AA316: 2 | AB316: 407 | AC316: 558 | AD316: =(AB316/AC316)*100 -> 72.939068100358426 | AE316: =(Y316*4)+(AA316*2) -> 4
A317: BOX HILL | C317: McCARTNEY | F317: CROWLEY | I317: ROWE | L317: BREWER | O317: TRANQUILLI | W317: BENDIGO | X317: 1 | Y317: 1 | Z317: 5 | AA317: 0 | AB317: 491 | AC317: 731 | AD317: =(AB317/AC317)*100 -> 67.168262653898765 | AE317: =(Y317*4)+(AA317*2) -> 4
A318: GOALKICKERS | C318: * | D318: (3 SHORT) | W318: COBURG | X318: 1 | Y318: 1 | Z318: 5 | AA318: 0 | AB318: 380 | AC318: 669 | AD318: =(AB318/AC318)*100 -> 56.801195814648729 | AE318: =(Y318*4)+(AA318*2) -> 4
A319: FRANKSTON | C319: GEORGIOU 5 | F319: BURNELL 5 | I319: WILLIAMS 3 | L319: MILLANE 2 | N319: ANDERSON 2 | Q319: SULLIVAN | T319: WEBB | W319: BOX HILL | X319: 1 | Y319: 0 | Z319: 5 | AA319: 1 | AB319: 487 | AC319: 684 | AD319: =(AB319/AC319)*100 -> 71.198830409356731 | AE319: =(Y319*4)+(AA319*2) -> 2
A320: BOX HILL | C320: TRANQUILLI 4 | G320: ROBERTSON 2 | J320: BREWER
A322: SPRINGVALE | C322: 2 | D322: 2 | E322: =(C322*6)+D322 -> 14 | G322: 8 | H322: 4 | I322: =(G322*6)+H322 -> 52 | K322: 9 | L322: 7 | M322: =(K322*6)+L322 -> 61 | O322: 14 | P322: 13 | Q322: =(O322*6)+P322 -> 97 | S322: Venue: SHEPLEY OVAL
A323: PRESTON | C323: 3 | D323: 4 | E323: =(C323*6)+D323 -> 22 | G323: 6 | H323: 7 | I323: =(G323*6)+H323 -> 43 | K323: 6 | L323: 8 | M323: =(K323*6)+L323 -> 44 | O323: 6 | P323: 9 | Q323: =(O323*6)+P323 -> 45
A324: BEST PLAYERS
A325: SPRINGVALE | C325: LITTLE | F325: BARDSLEY | I325: FORD | L325: SHAW | N325: J CARROLL | Q325: SHEAHAN
A326: PRESTON | C326: PAWSEY | F326: PASCOE | I326: GRAINGER | L326: HAYWOOD | N326: HALLINAN
A327: GOALKICKERS
A328: SPRINGVALE | C328: FORD 3 | E328: SMITH 3 | G328: J CARROLL 2 | J328: DELARUE 2 | M328: S CLARK | O328: DONATI | Q328: O'BRIEN | S328: SHAW
A329: PRESTON | C329: PLUNKETT 2 | F329: GIBSON 2 | H329: PENN | J329: HABERMAN
A331: PORT MELBOURNE | C331: 2 | D331: 1 | E331: =(C331*6)+D331 -> 13 | G331: 7 | H331: 2 | I331: =(G331*6)+H331 -> 44 | K331: 12 | L331: 5 | M331: =(K331*6)+L331 -> 77 | O331: 16 | P331: 9 | Q331: =(O331*6)+P331 -> 105 | S331: Venue: COBURG
A332: COBURG | C332: 2 | D332: 1 | E332: =(C332*6)+D332 -> 13 | G332: 3 | H332: 5 | I332: =(G332*6)+H332 -> 23 | K332: 3 | L332: 9 | M332: =(K332*6)+L332 -> 27 | O332: 5 | P332: 12 | Q332: =(O332*6)+P332 -> 42
A333: BEST PLAYERS
A334: PORT MELBOURNE | C334: D'GIACOMA | F334: HALPIN | I334: HOLLOW | K334: SEXTON | N334: JESS | Q334: GOODALE
A335: COBURG | C335: DE PASQUALE | F335: McHARDY | I335: GILPIN | K335: NAPOLI | N335: McLEOD | Q335: POTTER
A336: GOALKICKERS | C336: * | D336: (2 SHORT)
A337: PORT MELBOURNE | C337: CAMERON 3 | F337: PICIAONE 3 | I337: BAUMGARTNER 2 | M337: McCORMICK 2 | P337: GRIGG 2 | R337: DOBELL 2
A338: COBURG | C338: ALESSIO 3 | F338: TARANTO | I338: NUNZIATO
A340: WERRIBEE | C340: 2 | D340: 2 | E340: =(C340*6)+D340 -> 14 | G340: 7 | H340: 4 | I340: =(G340*6)+H340 -> 46 | K340: 10 | L340: 8 | M340: =(K340*6)+L340 -> 68 | O340: 13 | P340: 9 | Q340: =(O340*6)+P340 -> 87 | S340: Venue: WERRIBEE
A341: SANDRINGHAM | C341: 1 | D341: 5 | E341: =(C341*6)+D341 -> 11 | G341: 4 | H341: 7 | I341: =(G341*6)+H341 -> 31 | K341: 6 | L341: 9 | M341: =(K341*6)+L341 -> 45 | O341: 12 | P341: 10 | Q341: =(O341*6)+P341 -> 82
A342: BEST PLAYERS
A343: WERRIBEE | C343: PULI | F343: FAULKNER | I343: SUTTON | L343: CLONAN | O343: ATKINS | R343: HYDE
A344: SANDRINGHAM | C344: LIDDELL | F344: CARROLL | I344: MACGEORGE | L344: McKELLAR | O344: TREGEAR | R344: COGHLAN
A345: GOALKICKERS | C345: * | D345: (2 SHORT)
A346: WERRIBEE | C346: MITCHELL 2 | F346: SPROULE 2 | I346: HYDE | J346: CHURCHILL | M346: SATTERLEY | P346: ATKINS | R346: FROST | U346: GOODEY | X346: BUTTON
A347: SANDRINGHAM | C347: SAUTNER 4 | F347: HAYWARD 2 | I347: BINGHAM | K347: LIDDELL | M347: MAGNUSSEN | P347: NGUYEN | R347: TEMPLETON
C348: * | D348: (1 SHORT)
A349: BYE | D349: BENDIGO
A351: ROUND 8 | D351: 22ND MAY | J351: WEATHER | S351: Venue: PORT MELBOURNE
D352: 1ST QTR | H352: 2ND QTR | L352: 3RD QTR | P352: FINAL | S352: UMPIRES | V352: MANN
A353: WERRIBEE | C353: 3 | D353: 2 | E353: =(C353*6)+D353 -> 20 | G353: 6 | H353: 4 | I353: =(G353*6)+H353 -> 40 | K353: 13 | L353: 5 | M353: =(K353*6)+L353 -> 83 | O353: 16 | P353: 8 | Q353: =(O353*6)+P353 -> 104 | S353: JEFFREY | Z353: LADDER | AC353: ROUND | AE353: 8
A354: PORT MELBOURNE | C354: 4 | D354: 1 | E354: =(C354*6)+D354 -> 25 | G354: 9 | H354: 3 | I354: =(G354*6)+H354 -> 57 | K354: 11 | L354: 5 | M354: =(K354*6)+L354 -> 71 | O354: 15 | P354: 6 | Q354: =(O354*6)+P354 -> 96 | S354: MASON
A355: BEST PLAYERS | W355: TEAM | X355: B | Y355: W | Z355: L | AA355: D | AB355: FOR | AC355: AGST | AD355: % | AE355: PTS
A356: WERRIBEE | C356: TAYLOR | F356: BURTON | I356: SAUNDERS | L356: FORD | N356: ATKINS | Q356: SPROULE
A357: PORT MELBOURNE | C357: COLLINS | F357: DURLING | I357: DOBELL | L357: GRIGG | N357: HALPIN | Q357: D'GIACOMA | W357: NORTH BALLARAT | X357: 1 | Y357: 6 | Z357: 1 | AA357: 0 | AB357: 658 | AC357: 353 | AD357: =(AB357/AC357)*100 -> 186.40226628895184 | AE357: =(Y357*4)+(AA357*2) -> 24
A358: GOALKICKERS | W358: FRANKSTON | Y358: 6 | Z358: 2 | AA358: 0 | AB358: 918 | AC358: 576 | AD358: =(AB358/AC358)*100 -> 159.375 | AE358: =(Y358*4)+(AA358*2) -> 24
A359: WERRIBEE | C359: MITCHELL 5 | F359: BUTTON 4 | I359: CHURCHILL 2 | L359: SATTERLEY 2 | O359: SAUNDERS 2 | R359: ATKINS | W359: WERRIBEE | X359: 1 | Y359: 6 | Z359: 1 | AA359: 0 | AB359: 750 | AC359: 610 | AD359: =(AB359/AC359)*100 -> 122.95081967213115 | AE359: =(Y359*4)+(AA359*2) -> 24
A360: PORT MELBOURNE | C360: HALPIN 4 | E360: DOBELL 2 | G360: PICIAONE 2 | J360: SCHAEFER 2 | M360: DURLING | O360: McNAMARA | R360: VILLAROSSA | W360: PORT MELBOURNE | Y360: 6 | Z360: 2 | AA360: 0 | AB360: 776 | AC360: 655 | AD360: =(AB360/AC360)*100 -> 118.47328244274809 | AE360: =(Y360*4)+(AA360*2) -> 24
M361: O'NEIL | O361: SEXTON | S361: Venue: BEACH ROAD | W361: SPRINGVALE | X361: 1 | Y361: 4 | Z361: 3 | AA361: 0 | AB361: 677 | AC361: 602 | AD361: =(AB361/AC361)*100 -> 112.45847176079735 | AE361: =(Y361*4)+(AA361*2) -> 16
A362: SANDRINGHAM | C362: 6 | D362: 2 | E362: =(C362*6)+D362 -> 38 | G362: 9 | H362: 6 | I362: =(G362*6)+H362 -> 60 | K362: 13 | L362: 11 | M362: =(K362*6)+L362 -> 89 | O362: 22 | P362: 14 | Q362: =(O362*6)+P362 -> 146 | S362: RUSSO | W362: WILLIAMSTOWN | X362: 1 | Y362: 4 | Z362: 3 | AA362: 0 | AB362: 674 | AC362: 635 | AD362: =(AB362/AC362)*100 -> 106.14173228346458 | AE362: =(Y362*4)+(AA362*2) -> 16
A363: BENDIGO | C363: 1 | D363: 0 | E363: =(C363*6)+D363 -> 6 | G363: 4 | H363: 0 | I363: =(G363*6)+H363 -> 24 | K363: 6 | L363: 3 | M363: =(K363*6)+L363 -> 39 | O363: 6 | P363: 7 | Q363: =(O363*6)+P363 -> 43 | S363: PANNELL
A364: BEST PLAYERS | S364: NICHOLLS | W364: SANDRINGHAM | Y364: 3 | Z364: 4 | AA364: 1 | AB364: 862 | AC364: 685 | AD364: =(AB364/AC364)*100 -> 125.83941605839416 | AE364: =(Y364*4)+(AA364*2) -> 14
A365: SANDRINGHAM | C365: SAUTNER | F365: HAYNES | I365: McKELLAR | L365: M GRANT | O365: TREGEAR | R365: LIDDELL | W365: BOX HILL | X365: 1 | Y365: 1 | Z365: 5 | AA365: 1 | AB365: 611 | AC365: 737 | AD365: =(AB365/AC365)*100 -> 82.903663500678419 | AE365: =(Y365*4)+(AA365*2) -> 6
A366: BENDIGO | C366: CURCIO | F366: ANGOVE | I366: D'ANGELIS | W366: PRESTON | X366: 1 | Y366: 0 | Z366: 5 | AA366: 2 | AB366: 459 | AC366: 678 | AD366: =(AB366/AC366)*100 -> 67.69911504424779 | AE366: =(Y366*4)+(AA366*2) -> 4
A367: GOALKICKERS | O367: HAYWARD | R367: JOHNSTON | W367: BENDIGO | X367: 1 | Y367: 1 | Z367: 6 | AA367: 0 | AB367: 534 | AC367: 877 | AD367: =(AB367/AC367)*100 -> 60.889395667046756 | AE367: =(Y367*4)+(AA367*2) -> 4
A368: SANDRINGHAM | C368: SAUTNER 10 | F368: LIDDELL 3 | H368: HAYNES 2 | J368: SCOTT-BRANAGAN 2 | N368: D GRANT | P368: CARROLL | R368: MALONEY | W368: COBURG | X368: 1 | Y368: 1 | Z368: 6 | AA368: 0 | AB368: 393 | AC368: 795 | AD368: =(AB368/AC368)*100 -> 49.433962264150942 | AE368: =(Y368*4)+(AA368*2) -> 4
A369: BENDIGO | C369: RUDD 2 | F369: DILLON | H369: O'CALLAGHAN | K369: PROWSE | M369: VAN DEN HAY
A371: NORTH BALLARAT | C371: 2 | D371: 0 | E371: =(C371*6)+D371 -> 12 | G371: 8 | H371: 7 | I371: =(G371*6)+H371 -> 55 | K371: 13 | L371: 7 | M371: =(K371*6)+L371 -> 85 | O371: 19 | P371: 12 | Q371: =(O371*6)+P371 -> 126 | S371: NORTH BALLARAT
A372: COBURG | C372: 1 | D372: 0 | E372: =(C372*6)+D372 -> 6 | G372: 1 | H372: 0 | I372: =(G372*6)+H372 -> 6 | K372: 1 | L372: 1 | M372: =(K372*6)+L372 -> 7 | O372: 2 | P372: 1 | Q372: =(O372*6)+P372 -> 13 | S372: REID :ACKLAND :COOK
A373: BEST PLAYERS
A374: NORTH BALLARAT | C374: PEAKE | F374: EDWARDS | I374: CUTHBERTSON | L374: FIELD | O374: FRITH | R374: RHODES
A375: COBURG | C375: WATSON | F375: POTTER | I375: NUNZIATO | L375: TARANTO | O375: DE PASQUALE
A376: GOALKICKERS
A377: NORTH BALLARAT | C377: EDMONDS 4 | F377: CUTHBERTSON 3 | J377: LUBEEK 3 | L377: JURICA 2 | N377: PEAKE 2 | P377: FIELD | R377: MAHER | U377: T POLKINGHORNE | Y377: FRITH | AA377: RUYG
A378: COBURG | C378: KEENAN | F378: RYAN
D379: 23RD MAY | J379: WEATHER
A380: FRANKSTON | C380: 6 | D380: 1 | E380: =(C380*6)+D380 -> 37 | G380: 11 | H380: 3 | I380: =(G380*6)+H380 -> 69 | K380: 14 | L380: 4 | M380: =(K380*6)+L380 -> 88 | O380: 19 | P380: 6 | Q380: =(O380*6)+P380 -> 120 | S380: Venue: PRESTON
A381: PRESTON | C381: 4 | D381: 1 | E381: =(C381*6)+D381 -> 25 | G381: 4 | H381: 3 | I381: =(G381*6)+H381 -> 27 | K381: 5 | L381: 8 | M381: =(K381*6)+L381 -> 38 | O381: 7 | P381: 10 | Q381: =(O381*6)+P381 -> 52 | S381: TWITT :MALCOLM :QUIGLEY
A382: BEST PLAYERS
A383: FRANKSTON | C383: DAFF | F383: MALLOY | I383: ROBERTS | L383: LOVETT | O383: SULLIVAN | R383: CLARKE
A384: PRESTON | C384: GRAINGER | F384: HAYWARD | I384: HALLINAN | L384: KOFOED | O384: TAYLOR | R384: PASCOE
A385: GOALKICKERS | C385: * | D385: (1 SHORT)
A386: FRANKSTON | C386: WILLIAMS 3 | F386: McCORMICK 3 | I386: BURNELL 3 | L386: SULLIVAN 2 | O386: MILLANE | Q386: ROBERTS | T386: CONN | W386: TAYLOR | X386: CORRIGAN | AA386: CLARKE | AC386: WEBB
A387: PRESTON | C387: GRAINGER 3 | F387: MANGAN | I387: HOLLAND | L387: CARACELLA | O387: GAY
A389: BOX HILL | C389: 0 | D389: 0 | E389: =(C389*6)+D389 -> 0 | G389: 0 | H389: 0 | I389: =(G389*6)+H389 -> 0 | K389: 0 | L389: 0 | M389: =(K389*6)+L389 -> 0 | O389: 19 | P389: 10 | Q389: =(O389*6)+P389 -> 124 | S389: Venue: BOX HILL
A390: WILLIAMSTOWN | C390: 0 | D390: 0 | E390: =(C390*6)+D390 -> 0 | G390: 0 | H390: 0 | I390: =(G390*6)+H390 -> 0 | K390: 0 | L390: 0 | M390: =(K390*6)+L390 -> 0 | O390: 6 | P390: 11 | Q390: =(O390*6)+P390 -> 47 | S390: IRVIN :HEAD :CALLAGHAN
A391: BEST PLAYERS
A392: BOX HILL | C392: TRANQUILLI | F392: WILKINSON | I392: SMITH | L392: SLATER | O392: McCARTNEY | R392: THOMAS
A393: WILLIAMSTOWN | C393: HOLLOW | F393: ROUND | I393: ZAVALAS | L393: HORE | O393: BUGEJA
A394: GOALKICKERS
A395: BOX HILL | C395: WILKINSON 8 | F395: CROWLEY 3 | I395: NOTT 2 | K395: ALLSOPP | M395: HABERFIELD | P395: McCARTNEY | S395: SLATER | V395: THOMAS | X395: HOLLAND
A396: WILLIAMSTOWN | C396: DELRE 3 | F396: BUGEJA | I396: HORE | K396: SHANKS
A398: BYE | D398: SPRINGVALE
A400: ROUND 9 | D400: 5TH JUNE | J400: WEATHER
D401: 1ST QTR | H401: 2ND QTR | L401: 3RD QTR | P401: FINAL | S401: Venue: FRANKSTON
A402: SPRINGVALE | C402: 8 | D402: 3 | E402: =(C402*6)+D402 -> 51 | G402: 8 | H402: 13 | I402: =(G402*6)+H402 -> 61 | K402: 11 | L402: 14 | M402: =(K402*6)+L402 -> 80 | O402: 13 | P402: 18 | Q402: =(O402*6)+P402 -> 96 | S402: UMPIRES | Z402: LADDER | AC402: ROUND | AE402: 9
A403: FRANKSTON | C403: 3 | D403: 1 | E403: =(C403*6)+D403 -> 19 | G403: 3 | H403: 6 | I403: =(G403*6)+H403 -> 24 | K403: 7 | L403: 9 | M403: =(K403*6)+L403 -> 51 | O403: 13 | P403: 10 | Q403: =(O403*6)+P403 -> 88
A404: BEST PLAYERS | W404: TEAM | X404: B | Y404: W | Z404: L | AA404: D | AB404: FOR | AC404: AGST | AD404: % | AE404: PTS
A405: SPRINGVALE | C405: J CARROLL | F405: DONATI | I405: PASSADORE | L405: ROBBINS | O405: DELARUE | R405: O'BRIEN
A406: FRANKSTON | C406: CLARKE | F406: LOVETT | I406: McCORMACK | L406: GEORGIOU | O406: MILLANE | W406: PORT MELBOURNE | Y406: 7 | Z406: 2 | AA406: 0 | AB406: 860 | AC406: 699 | AD406: =(AB406/AC406)*100 -> 123.03290414878398 | AE406: =(Y406*4)+(AA406*2) -> 28
A407: GOALKICKERS | W407: WERRIBEE | X407: 1 | Y407: 7 | Z407: 1 | AA407: 0 | AB407: 842 | AC407: 698 | AD407: =(AB407/AC407)*100 -> 120.63037249283668 | AE407: =(Y407*4)+(AA407*2) -> 28
A408: SPRINGVALE | C408: SMITH 3 | E408: CANN 2 | G408: DONATI 2 | J408: PASSADOR 2 | M408: C CLARKE 2 | P408: O'BRIEN | R408: SHEAHAN | W408: NORTH BALLARAT | X408: 1 | Y408: 6 | Z408: 2 | AA408: 0 | AB408: 746 | AC408: 445 | AD408: =(AB408/AC408)*100 -> 167.64044943820224 | AE408: =(Y408*4)+(AA408*2) -> 24
A409: FRANKSTON | C409: McCORMACK 4 | F409: KNOTT 2 | H409: CORN | J409: MILLANE | L409: GEORGIOU | N409: KENNEDY | P409: CORRIGAN | R409: WEBB | W409: FRANKSTON | Y409: 6 | Z409: 3 | AA409: 0 | AB409: 1006 | AC409: 672 | AD409: =(AB409/AC409)*100 -> 149.70238095238096 | AE409: =(Y409*4)+(AA409*2) -> 24
A410: (1 SHORT) | D410: 6TH JUNE | J410: WEATHER | W410: SPRINGVALE | X410: 1 | Y410: 5 | Z410: 3 | AA410: 0 | AB410: 773 | AC410: 690 | AD410: =(AB410/AC410)*100 -> 112.02898550724638 | AE410: =(Y410*4)+(AA410*2) -> 20
A411: WILLIAMSTOWN | C411: 2 | D411: 1 | E411: =(C411*6)+D411 -> 13 | G411: 6 | H411: 6 | I411: =(G411*6)+H411 -> 42 | K411: 9 | L411: 9 | M411: =(K411*6)+L411 -> 63 | O411: 15 | P411: 13 | Q411: =(O411*6)+P411 -> 103 | S411: Venue: WILLIAMSTOWN | W411: WILLIAMSTOWN | X411: 1 | Y411: 5 | Z411: 3 | AA411: 0 | AB411: 777 | AC411: 702 | AD411: =(AB411/AC411)*100 -> 110.6837606837607 | AE411: =(Y411*4)+(AA411*2) -> 20
A412: PRESTON | C412: 2 | D412: 8 | E412: =(C412*6)+D412 -> 20 | G412: 4 | H412: 10 | I412: =(G412*6)+H412 -> 34 | K412: 6 | L412: 10 | M412: =(K412*6)+L412 -> 46 | O412: 9 | P412: 13 | Q412: =(O412*6)+P412 -> 67
A413: BEST PLAYERS | W413: SANDRINGHAM | X413: 1 | Y413: 3 | Z413: 4 | AA413: 1 | AB413: 862 | AC413: 685 | AD413: =(AB413/AC413)*100 -> 125.83941605839416 | AE413: =(Y413*4)+(AA413*2) -> 14
A414: WILLIAMSTOWN | C414: SIR | F414: SHANKS | I414: REYNOLDS | L414: GHAZI | O414: ROUND | R414: ZAVALAS | W414: BOX HILL | X414: 1 | Y414: 2 | Z414: 5 | AA414: 1 | AB414: 762 | AC414: 805 | AD414: =(AB414/AC414)*100 -> 94.658385093167709 | AE414: =(Y414*4)+(AA414*2) -> 10
A415: PRESTON | C415: PASCOE | F415: MANN | I415: HABERMAN | L415: ZORZO | O415: CROWLEY | W415: PRESTON | X415: 1 | Y415: 0 | Z415: 6 | AA415: 2 | AB415: 526 | AC415: 781 | AD415: =(AB415/AC415)*100 -> 67.349551856594118 | AE415: =(Y415*4)+(AA415*2) -> 4
A416: GOALKICKERS | C416: * | D416: (1 SHORT) | W416: BENDIGO | X416: 1 | Y416: 1 | Z416: 7 | AA416: 0 | AB416: 578 | AC416: 961 | AD416: =(AB416/AC416)*100 -> 60.145681581685736 | AE416: =(Y416*4)+(AA416*2) -> 4
A417: WILLIAMSTOWN | C417: DELRE 5 | F417: BUGEJA 2 | I417: HORE 2 | K417: PEARSON 2 | N417: TAYLOR | P417: EAMES | R417: STANLEY | W417: COBURG | X417: 1 | Y417: 1 | Z417: 7 | AA417: 0 | AB417: 461 | AC417: 946 | AD417: =(AB417/AC417)*100 -> 48.731501057082454 | AE417: =(Y417*4)+(AA417*2) -> 4
A418: PRESTON | C418: GIBSON 4 | F418: CARACELLA | I418: BROWN | K418: PENN | M418: GRAINGER | P418: CROWLEY
A420: PORT MELBOURNE | C420: 4 | D420: 4 | E420: =(C420*6)+D420 -> 28 | G420: 6 | H420: 7 | I420: =(G420*6)+H420 -> 43 | K420: 8 | L420: 11 | M420: =(K420*6)+L420 -> 59 | O420: 12 | P420: 12 | Q420: =(O420*6)+P420 -> 84 | S420: Venue: BENDIGO
A421: BENDIGO | C421: 3 | D421: 0 | E421: =(C421*6)+D421 -> 18 | G421: 5 | H421: 4 | I421: =(G421*6)+H421 -> 34 | K421: 5 | L421: 7 | M421: =(K421*6)+L421 -> 37 | O421: 6 | P421: 8 | Q421: =(O421*6)+P421 -> 44
A422: BEST PLAYERS
A423: PORT MELBOURNE | C423: SEXTON | F423: JESS | I423: HENDERSON | L423: HOLLOW | N423: McCORMICK | Q423: SHARP
A424: BENDIGO | C424: LANCASTER | F424: SCHMIDT | I424: DE ANGELIS | L424: CURCIO | N424: ANGOVE | Q424: ROGERS
A425: GOALKICKERS | C425: * | D425: (1 SHORT)
A426: PORT MELBOURNE | C426: CAMERON 3 | F426: SCHAEFER 2 | I426: JESS 2 | K426: PICIAONE 2 | N426: FOLINO | P426: HALPIN
A427: BENDIGO | C427: BATES 2 | F427: RUDD 2 | I427: BOWER | K427: SHARKEY
A429: WERRIBEE | C429: 4 | D429: 3 | E429: =(C429*6)+D429 -> 27 | G429: 5 | H429: 5 | I429: =(G429*6)+H429 -> 35 | K429: 9 | L429: 7 | M429: =(K429*6)+L429 -> 61 | O429: 14 | P429: 8 | Q429: =(O429*6)+P429 -> 92 | S429: Venue: WERRIBEE
A430: NORTH BALLARAT | C430: 4 | D430: 5 | E430: =(C430*6)+D430 -> 29 | G430: 6 | H430: 11 | I430: =(G430*6)+H430 -> 47 | K430: 10 | L430: 14 | M430: =(K430*6)+L430 -> 74 | O430: 12 | P430: 16 | Q430: =(O430*6)+P430 -> 88
A431: BEST PLAYERS
A432: WERRIBEE | C432: CHURCHILL | F432: PULI | I432: FORD | L432: SATTERLEY | O432: TAYLOR
A433: NORTH BALLARAT | C433: FIELD | F433: FRITH | I433: JENKINS | L433: HANCOCK | O433: POLKINGHORNE | R433: KENNEDY
A434: GOALKICKERS | C434: * | D434: (3 SHORT)
A435: WERRIBEE | C435: MITCHELL 3 | F435: SPROULE 2 | I435: SMITH 2 | K435: PRIDDLE | M435: WHITNALL | P435: BUTTON | R435: SAUNDERS
A436: NORTH BALLARAT | C436: ELLIOTT 2 | F436: JENKINS | I436: PEAKE | K436: FISHER | M436: RUYG | O436: EDMONDS | Q436: FRITH | S436: FIELD | U436: LUBEEK
C437: * | D437: (2 SHORT)
A438: BOX HILL | C438: 3 | D438: 0 | E438: =(C438*6)+D438 -> 18 | G438: 10 | H438: 6 | I438: =(G438*6)+H438 -> 66 | K438: 16 | L438: 7 | M438: =(K438*6)+L438 -> 103 | O438: 23 | P438: 13 | Q438: =(O438*6)+P438 -> 151 | S438: Venue: COBURG
A439: COBURG | C439: 2 | D439: 4 | E439: =(C439*6)+D439 -> 16 | G439: 4 | H439: 5 | I439: =(G439*6)+H439 -> 29 | K439: 8 | L439: 7 | M439: =(K439*6)+L439 -> 55 | O439: 10 | P439: 8 | Q439: =(O439*6)+P439 -> 68
A440: BEST PLAYERS
A441: BOX HILL | C441: SLATER | F441: TRANQUILLI | I441: NOTT | L441: HABERFIELD | O441: CROWLEY | Q441: BREWER
A442: COBURG | C442: NUNZIATO | F442: ALESSIO | I442: SAUNDERS | L442: WATSON | O442: TORTORA | Q442: DE PASQUALE
A443: GOALKICKERS | C443: * | E443: (3 GOALS SHORT)
A444: BOX HILL | C444: NOTT 7 | F444: WILKINSON 3 | I444: ROBINSON 3 | L444: HOLLAND 3 | O444: BREWER 2 | Q444: SMITH | S444: SLATER
A445: COBURG | C445: MANSFIELD 2 | F445: ALESSIO 2 | I445: WATSON 2 | L445: BICER | N445: SAUNDERS | Q445: BOSSI | S445: RYAN
A447: BYE | D447: SANDRINGHAM
A449: ROUND 10 | D449: 12TH JUNE | J449: WEATHER
D450: 1ST QTR | H450: 2ND QTR | L450: 3RD QTR | P450: FINAL | S450: Venue: SHEPLEY OVAL
A451: SPRINGVALE | C451: 1 | D451: 6 | E451: =(C451*6)+D451 -> 12 | G451: 8 | H451: 10 | I451: =(G451*6)+H451 -> 58 | K451: 12 | L451: 16 | M451: =(K451*6)+L451 -> 88 | O451: 17 | P451: 21 | Q451: =(O451*6)+P451 -> 123 | S451: UMPIRES | Z451: LADDER | AC451: ROUND | AE451: 10
A452: WILLIAMSTOWN | C452: 3 | D452: 1 | E452: =(C452*6)+D452 -> 19 | G452: 3 | H452: 5 | I452: =(G452*6)+H452 -> 23 | K452: 4 | L452: 7 | M452: =(K452*6)+L452 -> 31 | O452: 5 | P452: 9 | Q452: =(O452*6)+P452 -> 39
A453: BEST PLAYERS | W453: TEAM | X453: B | Y453: W | Z453: L | AA453: D | AB453: FOR | AC453: AGST | AD453: % | AE453: PTS
A454: SPRINGVALE | C454: LITTLE | F454: ROBBINS | I454: KNIGHT | L454: O'BRIEN | O454: CAPLES | Q454: SUTHERLAND
A455: WILLIAMSTOWN | C455: SIR | F455: N JUEGAN | I455: D JUEGAN | L455: STANLEY | O455: GHAZI | W455: PORT MELBOURNE | Y455: 8 | Z455: 2 | AA455: 0 | AB455: 945 | AC455: 775 | AD455: =(AB455/AC455)*100 -> 121.93548387096773 | AE455: =(Y455*4)+(AA455*2) -> 32
A456: GOALKICKERS | C456: * | D456: (4 SHORT) | W456: WERRIBEE | X456: 1 | Y456: 8 | Z456: 1 | AA456: 0 | AB456: 949 | AC456: 804 | AD456: =(AB456/AC456)*100 -> 118.03482587064677 | AE456: =(Y456*4)+(AA456*2) -> 32
A457: SPRINGVALE | C457: KNIGHT 4 | F457: COURTNEY 3 | I457: CANN 2 | K457: FORD | M457: J CARROLL | P457: S CLARK | R457: O'DONNELL | W457: NORTH BALLARAT | X457: 1 | Y457: 7 | Z457: 2 | AA457: 0 | AB457: 821 | AC457: 475 | AD457: =(AB457/AC457)*100 -> 172.84210526315789 | AE457: =(Y457*4)+(AA457*2) -> 28
A458: WILLIAMSTOWN | C458: N JUEGAN 2 | F458: McLEAN | H458: PEARSON | J458: DELRE | W458: FRANKSTON | X458: 1 | Y458: 6 | Z458: 3 | AA458: 0 | AB458: 1006 | AC458: 672 | AD458: =(AB458/AC458)*100 -> 149.70238095238096 | AE458: =(Y458*4)+(AA458*2) -> 24
W459: SPRINGVALE | X459: 1 | Y459: 6 | Z459: 3 | AA459: 0 | AB459: 896 | AC459: 729 | AD459: =(AB459/AC459)*100 -> 122.90809327846365 | AE459: =(Y459*4)+(AA459*2) -> 24
A460: WERRIBEE | C460: 7 | D460: 5 | E460: =(C460*6)+D460 -> 47 | G460: 11 | H460: 8 | I460: =(G460*6)+H460 -> 74 | K460: 15 | L460: 11 | M460: =(K460*6)+L460 -> 101 | O460: 16 | P460: 11 | Q460: =(O460*6)+P460 -> 107 | S460: Venue: BOX HILL | W460: WILLIAMSTOWN | X460: 1 | Y460: 5 | Z460: 4 | AA460: 0 | AB460: 816 | AC460: 825 | AD460: =(AB460/AC460)*100 -> 98.909090909090907 | AE460: =(Y460*4)+(AA460*2) -> 20
A461: BOX HILL | C461: 2 | D461: 2 | E461: =(C461*6)+D461 -> 14 | G461: 8 | H461: 6 | I461: =(G461*6)+H461 -> 54 | K461: 10 | L461: 8 | M461: =(K461*6)+L461 -> 68 | O461: 16 | P461: 10 | Q461: =(O461*6)+P461 -> 106
A462: BEST PLAYERS | W462: SANDRINGHAM | X462: 1 | Y462: 3 | Z462: 5 | AA462: 1 | AB462: 938 | AC462: 770 | AD462: =(AB462/AC462)*100 -> 121.81818181818183 | AE462: =(Y462*4)+(AA462*2) -> 14
A463: WERRIBEE | C463: PULI | F463: FROST | I463: CHURCHILL | L463: TAYLOR | O463: ATKINS | Q463: FAULKNER | W463: BOX HILL | X463: 1 | Y463: 2 | Z463: 6 | AA463: 1 | AB463: 868 | AC463: 912 | AD463: =(AB463/AC463)*100 -> 95.175438596491219 | AE463: =(Y463*4)+(AA463*2) -> 10
A464: BOX HILL | C464: McCARTNEY | F464: JENKINS | I464: HOLLAND | L464: PUGSLEY | O464: HABERFIELD | R464: SIMKIN | W464: COBURG | X464: 1 | Y464: 2 | Z464: 7 | AA464: 0 | AB464: 547 | AC464: 1014 | AD464: =(AB464/AC464)*100 -> 53.944773175542402 | AE464: =(Y464*4)+(AA464*2) -> 8
A465: GOALKICKERS | C465: * | D465: (2 SHORT) | Q465: ATKINS | W465: PRESTON | X465: 1 | Y465: 0 | Z465: 7 | AA465: 2 | AB465: 594 | AC465: 867 | AD465: =(AB465/AC465)*100 -> 68.512110726643598 | AE465: =(Y465*4)+(AA465*2) -> 4
A466: WERRIBEE | C466: MITCHELL 3 | F466: CHURCHILL 2 | I466: SMITH 2 | K466: FROST 2 | M466: TAYLOR 2 | P466: SATTERLEY | S466: PULI | W466: BENDIGO | X466: 1 | Y466: 1 | Z466: 8 | AA466: 0 | AB466: 608 | AC466: 1036 | AD466: =(AB466/AC466)*100 -> 58.687258687258691 | AE466: =(Y466*4)+(AA466*2) -> 4
A467: BOX HILL | C467: HABERFIELD 3 | F467: HOLLAND 3 | I467: NOTT 3 | K467: WILKINSON 3 | N467: BREBNER 2 | Q467: SIMKIN | S467: SMITH
D468: 13TH JUNE | J468: WEATHER
A469: NORTH BALLARAT | C469: 3 | D469: 4 | E469: =(C469*6)+D469 -> 22 | G469: 5 | H469: 9 | I469: =(G469*6)+H469 -> 39 | K469: 7 | L469: 11 | M469: =(K469*6)+L469 -> 53 | O469: 10 | P469: 15 | Q469: =(O469*6)+P469 -> 75 | S469: Venue: NORTH BALLARAT
A470: BENDIGO | C470: 1 | D470: 0 | E470: =(C470*6)+D470 -> 6 | G470: 1 | H470: 2 | I470: =(G470*6)+H470 -> 8 | K470: 2 | L470: 4 | M470: =(K470*6)+L470 -> 16 | O470: 4 | P470: 6 | Q470: =(O470*6)+P470 -> 30
A471: BEST PLAYERS
A472: NORTH BALLARAT | C472: J POLKINGHORNE | G472: CLARKE | J472: SNIBSON | M472: MURRIHY | P472: FIELD | R472: EDWARDS
A473: BENDIGO | C473: TOINTON | G473: ROGERS | J473: WHITSED | M473: FLEMING | P473: S RUDD | R473: O'CALLAGHAN
A474: GOALKICKERS
A475: NORTH BALLARAT | C475: FIELD 3 | F475: EDMONDS 2 | I475: KIRZNER 2 | L475: CLARKE 2 | O475: LUBEEK
A476: BENDIGO | D476: BOWER 2 | G476: BATES | J476: O'SHANNESSY
A478: PORT MELBOURNE | C478: 0 | D478: 2 | E478: =(C478*6)+D478 -> 2 | G478: 4 | H478: 7 | I478: =(G478*6)+H478 -> 31 | K478: 9 | L478: 10 | M478: =(K478*6)+L478 -> 64 | O478: 12 | P478: 13 | Q478: =(O478*6)+P478 -> 85 | S478: Venue: PORT MELBOURNE
A479: SANDRINGHAM | C479: 3 | D479: 4 | E479: =(C479*6)+D479 -> 22 | G479: 3 | H479: 8 | I479: =(G479*6)+H479 -> 26 | K479: 6 | L479: 12 | M479: =(K479*6)+L479 -> 48 | O479: 10 | P479: 16 | Q479: =(O479*6)+P479 -> 76
A480: BEST PLAYERS
A481: PORT MELBOURNE | C481: SEXTON | F481: HOLLOW | I481: COLLINS | L481: SHARP | O481: MARTIN | R481: BAUMGARTNER
A482: SANDRINGHAM | C482: HAYNES | F482: COGHLAN | I482: LIDDELL | L482: MALONEY | O482: GRANT
A483: GOALKICKERS | C483: * | D483: (1 SHORT)
A484: PORT MELBOURNE | C484: SEXTON 4 | F484: SCHAEFER 3 | I484: BAUMGARTNER 2 | M484: FOLINO | O484: McCORMICK
A485: SANDRINGHAM | C485: SAUTNER 3 | F485: SCOTT-BRANAGAN 2 | J485: MACGEORGE | M485: LIDDELL | O485: QUINN | Q485: HAYNES
D486: * | E486: (1 SHORT)
A487: COBURG | C487: 1 | D487: 0 | E487: =(C487*6)+D487 -> 6 | G487: 6 | H487: 1 | I487: =(G487*6)+H487 -> 37 | K487: 8 | L487: 2 | M487: =(K487*6)+L487 -> 50 | O487: 14 | P487: 2 | Q487: =(O487*6)+P487 -> 86 | S487: Venue: PRESTON
A488: PRESTON | C488: 2 | D488: 8 | E488: =(C488*6)+D488 -> 20 | G488: 2 | H488: 11 | I488: =(G488*6)+H488 -> 23 | K488: 6 | L488: 14 | M488: =(K488*6)+L488 -> 50 | O488: 9 | P488: 14 | Q488: =(O488*6)+P488 -> 68
A489: BEST PLAYERS
A490: COBURG | C490: SHEATHER | F490: ALESSIO | I490: MANSFIELD | L490: NUNZIATO | O490: GILPIN | Q490: WEBBER
A491: PRESTON | C491: N/A
A492: GOALKICKERS
A493: COBURG | C493: ALESSIO 7 | F493: RYAN 3 | H493: MANSFIELD 2 | K493: WEBBER | M493: SHEATHER
A494: PRESTON | C494: GRAINGER 2 | F494: CARACELLA 2 | J494: PENN | L494: WISENDEN | N494: MANGIN | P494: GIBSON | R494: HALLINAN
A496: BYE | D496: FRANKSTON
A498: ROUND 11 | D498: 19TH JUNE | J498: WEATHER
D499: 1ST QTR | H499: 2ND QTR | L499: 3RD QTR | P499: FINAL | S499: Venue: WERRIBEE
A500: WERRIBEE | C500: 2 | D500: 3 | E500: =(C500*6)+D500 -> 15 | G500: 3 | H500: 10 | I500: =(G500*6)+H500 -> 28 | K500: 11 | L500: 14 | M500: =(K500*6)+L500 -> 80 | O500: 17 | P500: 23 | Q500: =(O500*6)+P500 -> 125 | S500: UMPIRES | Z500: LADDER | AC500: ROUND | AE500: 11
A501: PRESTON | C501: 6 | D501: 1 | E501: =(C501*6)+D501 -> 37 | G501: 8 | H501: 4 | I501: =(G501*6)+H501 -> 52 | K501: 11 | L501: 6 | M501: =(K501*6)+L501 -> 72 | O501: 13 | P501: 6 | Q501: =(O501*6)+P501 -> 84
A502: BEST PLAYERS | W502: TEAM | X502: B | Y502: W | Z502: L | AA502: D | AB502: FOR | AC502: AGST | AD502: % | AE502: PTS
A503: WERRIBEE | C503: DYER | F503: FROST | I503: SAUNDERS | L503: FAULKNER | O503: SPROULE | Q503: ATKINS
A504: PRESTON | C504: TAYLOR | F504: PASCOE | I504: HABERMAN | L504: MANN | W504: WERRIBEE | X504: 1 | Y504: 9 | Z504: 1 | AA504: 0 | AB504: 1074 | AC504: 888 | AD504: =(AB504/AC504)*100 -> 120.94594594594594 | AE504: =(Y504*4)+(AA504*2) -> 36
A505: GOALKICKERS | C505: * | D505: (3 SHORT) | W505: PORT MELBOURNE | X505: 1 | Y505: 8 | Z505: 2 | AA505: 0 | AB505: 945 | AC505: 775 | AD505: =(AB505/AC505)*100 -> 121.93548387096773 | AE505: =(Y505*4)+(AA505*2) -> 32
A506: WERRIBEE | C506: BUTTON 3 | E506: FORD 2 | G506: DYER 2 | I506: MITCHELL 2 | L506: SPROULE 2 | O506: SAUNDERS 2 | R506: CHURCHILL | W506: FRANKSTON | X506: 1 | Y506: 7 | Z506: 3 | AA506: 0 | AB506: 1089 | AC506: 735 | AD506: =(AB506/AC506)*100 -> 148.16326530612244 | AE506: =(Y506*4)+(AA506*2) -> 28
A507: PRESTON | C507: FROST 3 | E507: GIBSON 3 | G507: CARACELLA 3 | J507: TAYLOR | L507: GRAINGER | O507: McDONOUGH | R507: CROWLEY | W507: NORTH BALLARAT | X507: 1 | Y507: 7 | Z507: 3 | AA507: 0 | AB507: 865 | AC507: 605 | AD507: =(AB507/AC507)*100 -> 142.97520661157023 | AE507: =(Y507*4)+(AA507*2) -> 28
D508: 20TH JUNE | J508: WEATHER | W508: SPRINGVALE | X508: 1 | Y508: 7 | Z508: 3 | AA508: 0 | AB508: 1001 | AC508: 795 | AD508: =(AB508/AC508)*100 -> 125.91194968553458 | AE508: =(Y508*4)+(AA508*2) -> 28
A509: SPRINGVALE | C509: 2 | D509: 0 | E509: =(C509*6)+D509 -> 12 | G509: 8 | H509: 9 | I509: =(G509*6)+H509 -> 57 | K509: 11 | L509: 11 | M509: =(K509*6)+L509 -> 77 | O509: 15 | P509: 15 | Q509: =(O509*6)+P509 -> 105 | S509: Venue: COBURG | W509: WILLIAMSTOWN | X509: 1 | Y509: 5 | Z509: 5 | AA509: 0 | AB509: 879 | AC509: 908 | AD509: =(AB509/AC509)*100 -> 96.806167400881066 | AE509: =(Y509*4)+(AA509*2) -> 20
A510: COBURG | C510: 3 | D510: 2 | E510: =(C510*6)+D510 -> 20 | G510: 3 | H510: 3 | I510: =(G510*6)+H510 -> 21 | K510: 9 | L510: 5 | M510: =(K510*6)+L510 -> 59 | O510: 10 | P510: 6 | Q510: =(O510*6)+P510 -> 66
A511: BEST PLAYERS | W511: SANDRINGHAM | X511: 1 | Y511: 4 | Z511: 5 | AA511: 1 | AB511: 1068 | AC511: 814 | AD511: =(AB511/AC511)*100 -> 131.20393120393121 | AE511: =(Y511*4)+(AA511*2) -> 18
A512: SPRINGVALE | C512: COURTNEY | F512: DONATI | I512: PASSADOR | L512: S CLARK | O512: ROBBINS | R512: O'DONNELL | W512: BOX HILL | X512: 1 | Y512: 3 | Z512: 6 | AA512: 1 | AB512: 954 | AC512: 978 | AD512: =(AB512/AC512)*100 -> 97.546012269938657 | AE512: =(Y512*4)+(AA512*2) -> 14
A513: COBURG | C513: TORTORA | F513: O'CALLAGHAN | I513: POTTER | L513: SAUNDERS | O513: BICER | R513: MASSOUDI | W513: COBURG | X513: 1 | Y513: 2 | Z513: 8 | AA513: 0 | AB513: 613 | AC513: 1119 | AD513: =(AB513/AC513)*100 -> 54.781054512957994 | AE513: =(Y513*4)+(AA513*2) -> 8
A514: GOALKICKERS | C514: * | D514: (1 SHORT) | W514: PRESTON | X514: 1 | Y514: 0 | Z514: 8 | AA514: 2 | AB514: 678 | AC514: 992 | AD514: =(AB514/AC514)*100 -> 68.346774193548384 | AE514: =(Y514*4)+(AA514*2) -> 4
A515: SPRINGVALE | C515: PASSADOR 4 | F515: SMITH 3 | H515: KNIGHT 2 | J515: CANN | L515: SHAW | N515: O'BRIEN | P515: ROBBINS | S515: DONATI | W515: BENDIGO | X515: 1 | Y515: 1 | Z515: 9 | AA515: 0 | AB515: 674 | AC515: 1122 | AD515: =(AB515/AC515)*100 -> 60.071301247771835 | AE515: =(Y515*4)+(AA515*2) -> 4
A516: COBURG | C516: RYAN 3 | F516: ALESSIO 2 | I516: BICER 2 | L516: WEBBER | N516: POTTER | P516: SAUNDERS
A518: FRANKSTON | C518: 2 | D518: 3 | E518: =(C518*6)+D518 -> 15 | G518: 5 | H518: 6 | I518: =(G518*6)+H518 -> 36 | K518: 6 | L518: 9 | M518: =(K518*6)+L518 -> 45 | O518: 12 | P518: 11 | Q518: =(O518*6)+P518 -> 83 | S518: Venue: WILLIAMSTOWN
A519: WILLIAMSTOWN | C519: 1 | D519: 2 | E519: =(C519*6)+D519 -> 8 | G519: 2 | H519: 2 | I519: =(G519*6)+H519 -> 14 | K519: 6 | L519: 12 | M519: =(K519*6)+L519 -> 48 | O519: 8 | P519: 15 | Q519: =(O519*6)+P519 -> 63
A520: BEST PLAYERS
A521: FRANKSTON | C521: MILES | F521: McCORMACK | I521: LOVETT | L521: CLARKE | N521: MALLOY | Q521: O'NEIL
A522: WILLIAMSTOWN | C522: STANLEY | F522: ROUND | I522: GHAZI | L522: REYNOLDS
A523: GOALKICKERS
A524: FRANKSTON | C524: MILES 5 | F524: McCORMACK 4 | J524: KNOTT | L524: CLARKE | N524: WEBB
A525: WILLIAMSTOWN | C525: DELRE 4 | F525: CHRISTOFORO 2 | J525: EAMES | L525: RAILTON
A527: SANDRINGHAM | C527: 4 | D527: 1 | E527: =(C527*6)+D527 -> 25 | G527: 7 | H527: 12 | I527: =(G527*6)+H527 -> 54 | K527: 8 | L527: 12 | M527: =(K527*6)+L527 -> 60 | O527: 19 | P527: 16 | Q527: =(O527*6)+P527 -> 130 | S527: Venue: BEACH ROAD
A528: NORTH BALLARAT | C528: 4 | D528: 4 | E528: =(C528*6)+D528 -> 28 | G528: 4 | H528: 4 | I528: =(G528*6)+H528 -> 28 | K528: 6 | L528: 6 | M528: =(K528*6)+L528 -> 42 | O528: 6 | P528: 8 | Q528: =(O528*6)+P528 -> 44
A529: BEST PLAYERS
A530: SANDRINGHAM | C530: TREGEAR | F530: D GRANT | I530: MALONEY | L530: FRATER | O530: MACGEORGE | R530: B OAKLEY
A531: NORTH BALLARAT | C531: J POLKINGHORNE | G531: PEAKE | I531: MURRIHY | L531: RUYG
A532: GOALKICKERS | C532: * | D532: (4 SHORT)
A533: SANDRINGHAM | C533: SCOTT-BRANAGAN 5 | G533: TEMPLETON 3 | J533: MACGEORGE 3 | M533: SAUTNER 2 | P533: JOHNSTONE 2
A534: NORTH BALLARAT | C534: HAYLES 2 | F534: BROWN | H534: PEAKE | J534: J POLKINGHORNE | N534: FIELD
A536: BOX HILL | C536: 3 | D536: 8 | E536: =(C536*6)+D536 -> 26 | G536: 6 | H536: 13 | I536: =(G536*6)+H536 -> 49 | K536: 9 | L536: 14 | M536: =(K536*6)+L536 -> 68 | O536: 12 | P536: 14 | Q536: =(O536*6)+P536 -> 86 | S536: Venue: BENDIGO
A537: BENDIGO | C537: 2 | D537: 2 | E537: =(C537*6)+D537 -> 14 | G537: 4 | H537: 3 | I537: =(G537*6)+H537 -> 27 | K537: 8 | L537: 8 | M537: =(K537*6)+L537 -> 56 | O537: 9 | P537: 12 | Q537: =(O537*6)+P537 -> 66
A538: BEST PLAYERS
A539: BOX HILL | C539: SLATER | F539: DISNEY | I539: CROWLEY | L539: TRANQULLI | O539: BREBNER | R539: BREWER
A540: BENDIGO | C540: O'CALLAGHAN | F540: CURCIO | I540: WHITSED | L540: LANCASTER | O540: BATES | R540: ANGOVE
A541: GOALKICKERS
A542: BOX HILL | C542: NOTT 4 | F542: WILKINSON 3 | J542: CROWLEY 2 | M542: ECCLES 2 | P542: HARTIN
A543: BENDIGO | C543: A RUDD 3 | F543: BATES 3 | I543: BOWER 2 | L543: O'CALLAGHAN
A545: BYE | D545: PORT MELBOURNE
A547: ROUND 12 | D547: 26TH JUNE | J547: WEATHER
D548: 1ST QTR | H548: 2ND QTR | L548: 3RD QTR | P548: FINAL | S548: Venue: BENDIGO
A549: BENDIGO | C549: 7 | D549: 5 | E549: =(C549*6)+D549 -> 47 | G549: 9 | H549: 10 | I549: =(G549*6)+H549 -> 64 | K549: 10 | L549: 14 | M549: =(K549*6)+L549 -> 74 | O549: 15 | P549: 22 | Q549: =(O549*6)+P549 -> 112 | S549: UMPIRES | Z549: LADDER | AC549: ROUND | AE549: 12
A550: PRESTON | C550: 2 | D550: 1 | E550: =(C550*6)+D550 -> 13 | G550: 6 | H550: 1 | I550: =(G550*6)+H550 -> 37 | K550: 12 | L550: 6 | M550: =(K550*6)+L550 -> 78 | O550: 14 | P550: 7 | Q550: =(O550*6)+P550 -> 91
A551: BEST PLAYERS | W551: TEAM | X551: B | Y551: W | Z551: L | AA551: D | AB551: FOR | AC551: AGST | AD551: % | AE551: PTS
A552: BENDIGO | C552: FLEMING | F552: SHARKEY | I552: O'CALLAGHAN | L552: W BLAKE | N552: DE ANGELIS | Q552: WHITSED
A553: PRESTON | C553: TAYLOR | F553: PASCOE | I553: BROWN | W553: PORT MELBOURNE | X553: 1 | Y553: 9 | Z553: 2 | AA553: 0 | AB553: 1045 | AC553: 823 | AD553: =(AB553/AC553)*100 -> 126.97448359659782 | AE553: =(Y553*4)+(AA553*2) -> 36
A554: GOALKICKERS | W554: WERRIBEE | X554: 1 | Y554: 9 | Z554: 2 | AA554: 0 | AB554: 1151 | AC554: 1011 | AD554: =(AB554/AC554)*100 -> 113.84767556874382 | AE554: =(Y554*4)+(AA554*2) -> 36
A555: BENDIGO | C555: BATES 3 | E555: BOWER 3 | H555: O'CALLAGHAN 2 | L555: ROGERS 2 | N555: A RUDD 2 | P555: S RUDD 2 | S555: SHARKEY | W555: FRANKSTON | X555: 1 | Y555: 8 | Z555: 3 | AA555: 0 | AB555: 1182 | AC555: 777 | AD555: =(AB555/AC555)*100 -> 152.12355212355214 | AE555: =(Y555*4)+(AA555*2) -> 32
A556: PRESTON | C556: GIBSON 3 | E556: VAN BLOMMESTEIN 3 | I556: GRAINGER 2 | L556: S TAYLOR | N556: FROST | P556: PENN | R556: MANGIN | W556: SPRINGVALE | X556: 1 | Y556: 8 | Z556: 3 | AA556: 0 | AB556: 1124 | AC556: 872 | AD556: =(AB556/AC556)*100 -> 128.89908256880733 | AE556: =(Y556*4)+(AA556*2) -> 32
D557: * | E557: (2 SHORT) | W557: NORTH BALLARAT | X557: 1 | Y557: 7 | Z557: 4 | AA557: 0 | AB557: 913 | AC557: 705 | AD557: =(AB557/AC557)*100 -> 129.50354609929079 | AE557: =(Y557*4)+(AA557*2) -> 28
A558: PORT MELBOURNE | C558: 0 | D558: 4 | E558: =(C558*6)+D558 -> 4 | G558: 6 | H558: 8 | I558: =(G558*6)+H558 -> 44 | K558: 8 | L558: 13 | M558: =(K558*6)+L558 -> 61 | O558: 14 | P558: 16 | Q558: =(O558*6)+P558 -> 100 | S558: Venue: PORT MELBOURNE | W558: SANDRINGHAM | X558: 1 | Y558: 5 | Z558: 5 | AA558: 1 | AB558: 1200 | AC558: 886 | AD558: =(AB558/AC558)*100 -> 135.44018058690745 | AE558: =(Y558*4)+(AA558*2) -> 22
A559: NORTH BALLARAT | C559: 0 | D559: 1 | E559: =(C559*6)+D559 -> 1 | G559: 2 | H559: 2 | I559: =(G559*6)+H559 -> 14 | K559: 3 | L559: 4 | M559: =(K559*6)+L559 -> 22 | O559: 7 | P559: 6 | Q559: =(O559*6)+P559 -> 48
A560: BEST PLAYERS | W560: WILLIAMSTOWN | X560: 2 | Y560: 5 | Z560: 5 | AA560: 0 | AB560: 879 | AC560: 908 | AD560: =(AB560/AC560)*100 -> 96.806167400881066 | AE560: =(Y560*4)+(AA560*2) -> 20
A561: PORT MELBOURNE | C561: COLLINS | F561: D'GIACOMA | I561: SEXTON | L561: McCORMICK | O561: HALPIN | Q561: MARTIN | W561: BOX HILL | X561: 1 | Y561: 3 | Z561: 7 | AA561: 1 | AB561: 1026 | AC561: 1110 | AD561: =(AB561/AC561)*100 -> 92.432432432432435 | AE561: =(Y561*4)+(AA561*2) -> 14
A562: NORTH BALLARAT | C562: FIELD | F562: MURRIHY | I562: FRITH | L562: ELLIOTT | W562: BENDIGO | X562: 1 | Y562: 2 | Z562: 9 | AA562: 0 | AB562: 786 | AC562: 1213 | AD562: =(AB562/AC562)*100 -> 64.798021434460011 | AE562: =(Y562*4)+(AA562*2) -> 8
A563: GOALKICKERS | C563: * | D563: (2 GOALS SHORT) | W563: COBURG | X563: 1 | Y563: 2 | Z563: 9 | AA563: 0 | AB563: 655 | AC563: 1212 | AD563: =(AB563/AC563)*100 -> 54.042904290429036 | AE563: =(Y563*4)+(AA563*2) -> 8
A564: PORT MELBOURNE | C564: SEXTON 3 | F564: PICIAONE 3 | I564: SCHAEFER 2 | L564: McCORMICK 2 | O564: HALPIN | Q564: GOODALE | W564: PRESTON | X564: 1 | Y564: 0 | Z564: 9 | AA564: 2 | AB564: 769 | AC564: 1104 | AD564: =(AB564/AC564)*100 -> 69.655797101449281 | AE564: =(Y564*4)+(AA564*2) -> 4
A565: NORTH BALLARAT | C565: MURRIHY 3 | F565: FISHER | I565: CUTHBERTSON | L565: RUYG | N565: INIA
D566: 27TH JUNE | J566: WEATHER
A567: FRANKSTON | C567: 2 | D567: 5 | E567: =(C567*6)+D567 -> 17 | G567: 5 | H567: 7 | I567: =(G567*6)+H567 -> 37 | K567: 8 | L567: 10 | M567: =(K567*6)+L567 -> 58 | O567: 13 | P567: 15 | Q567: =(O567*6)+P567 -> 93 | S567: Venue: COBURG
A568: COBURG | C568: 1 | D568: 1 | E568: =(C568*6)+D568 -> 7 | G568: 3 | H568: 1 | I568: =(G568*6)+H568 -> 19 | K568: 6 | L568: 2 | M568: =(K568*6)+L568 -> 38 | O568: 6 | P568: 6 | Q568: =(O568*6)+P568 -> 42
A569: BEST PLAYERS
A570: FRANKSTON | C570: WILLIAMS | F570: STRINGER | I570: LOVETT | L570: MALLOY | O570: BURGMAN | R570: DAFF
A571: COBURG | C571: TORTORA | F571: DE PASQUALE | I571: CANNING | L571: MANSFIELD
A572: GOALKICKERS | C572: * | D572: (1GOAL SHORT )
A573: FRANKSTON | C573: AGNELLO 2 | F573: GEORGIOU 2 | I573: O'NEIL 2 | K573: WEBB 2 | M573: BELL | O573: BURNELL | Q573: KNOTT | S573: ROBERTS
A574: COBURG | C574: RYAN 2 | F574: LITTLE 2 | I574: ALESSIO | K574: GORDON
A576: SANDRINGHAM | C576: 4 | D576: 3 | E576: =(C576*6)+D576 -> 27 | G576: 9 | H576: 11 | I576: =(G576*6)+H576 -> 65 | K576: 17 | L576: 15 | M576: =(K576*6)+L576 -> 117 | O576: 19 | P576: 18 | Q576: =(O576*6)+P576 -> 132 | S576: Venue: BEACH ROAD
A577: BOX HILL | C577: 0 | D577: 2 | E577: =(C577*6)+D577 -> 2 | G577: 1 | H577: 3 | I577: =(G577*6)+H577 -> 9 | K577: 3 | L577: 5 | M577: =(K577*6)+L577 -> 23 | O577: 11 | P577: 6 | Q577: =(O577*6)+P577 -> 72
A578: BEST PLAYERS
A579: SANDRINGHAM | C579: McKELLAR | F579: SCOTT-BRANAGAN | J579: MALONEY | M579: B OAKLEY | P579: WEBB | R579: LIDDELL
A580: BOX HILL | C580: SLATER | F580: HOLMES | I580: DISNEY | L580: HABERFIELD
A581: GOALKICKERS
A582: SANDRINGHAM | C582: SAUTNER 4 | E582: B OAKLEY 4 | H582: SCOTT-BRANAGAN 3 | L582: LIDDELL 2 | N582: WEBB 2 | P582: TEMPLETON | S582: D GRANT | W582: McKELLAR | X582: HAYWARD
A583: BOX HILL | C583: HOLMES 2 | F583: NOTT 2 | H583: TRANQUILLI 2 | K583: CROWLEY | M583: HABERFIELD | P583: McCARROLL | S583: SMITH
D584: * | E584: (1 SHORT)
A585: SPRINGVALE | C585: 3 | D585: 5 | E585: =(C585*6)+D585 -> 23 | G585: 7 | H585: 6 | I585: =(G585*6)+H585 -> 48 | K585: 13 | L585: 11 | M585: =(K585*6)+L585 -> 89 | O585: 18 | P585: 15 | Q585: =(O585*6)+P585 -> 123 | S585: Venue: WERRIBEE
A586: WERRIBEE | C586: 3 | D586: 3 | E586: =(C586*6)+D586 -> 21 | G586: 5 | H586: 8 | I586: =(G586*6)+H586 -> 38 | K586: 9 | L586: 9 | M586: =(K586*6)+L586 -> 63 | O586: 11 | P586: 11 | Q586: =(O586*6)+P586 -> 77
A587: BEST PLAYERS
A588: SPRINGVALE | C588: DELARUE | F588: O'BRIEN | I588: FORD | K588: LITTLE | N588: D CARROLL | Q588: S SMITH
A589: WERRIBEE | C589: FAULKNER | F589: ATKINS | I589: FROST | K589: SAUNDERS | N589: PULI | Q589: TAYLOR
A590: GOALKICKERS
A591: SPRINGVALE | C591: S SMITH 6 | F591: FORD 4 | H591: PASSADOR 4 | K591: D CARROLL | N591: CLARK | P591: KNIGHT | R591: SHAW
A592: WERRIBEE | C592: MITCHELL 2 | F592: CHURCHILL 2 | I592: SHAW 2 | K592: FAULKNER | N592: SAUNDERS | Q592: SPROULE | T592: FROST | W592: S SMITH
A594: BYE | D594: WILLIAMSTOWN
A596: ROUND 13 | D596: 3RD JULY | J596: WEATHER
D597: 1ST QTR | H597: 2ND QTR | L597: 3RD QTR | P597: FINAL | S597: Venue: BOX HILL
A598: BOX HILL | C598: 2 | D598: 4 | E598: =(C598*6)+D598 -> 16 | G598: 8 | H598: 6 | I598: =(G598*6)+H598 -> 54 | K598: 9 | L598: 11 | M598: =(K598*6)+L598 -> 65 | O598: 13 | P598: 13 | Q598: =(O598*6)+P598 -> 91 | S598: UMPIRES | Z598: LADDER | AC598: ROUND | AE598: 13
A599: PORT MELBOURNE | C599: 2 | D599: 2 | E599: =(C599*6)+D599 -> 14 | G599: 6 | H599: 5 | I599: =(G599*6)+H599 -> 41 | K599: 7 | L599: 6 | M599: =(K599*6)+L599 -> 48 | O599: 9 | P599: 8 | Q599: =(O599*6)+P599 -> 62
A600: BEST PLAYERS | W600: TEAM | X600: B | Y600: W | Z600: L | AA600: D | AB600: FOR | AC600: AGST | AD600: % | AE600: PTS
A601: BOX HILL | C601: ROWE | F601: HABERFIELD | I601: BREBNER | L601: BREWER | O601: JENKINS | R601: SLATER
A602: PORT MELBOURNE | C602: HOLLOW | F602: HENDERSON | I602: HALPIN | L602: COLLINS | O602: D'GIACOMA | W602: FRANKSTON | X602: 1 | Y602: 9 | Z602: 3 | AA602: 0 | AB602: 1260 | AC602: 838 | AD602: =(AB602/AC602)*100 -> 150.35799522673031 | AE602: =(Y602*4)+(AA602*2) -> 36
A603: GOALKICKERS | W603: SPRINGVALE | X603: 1 | Y603: 9 | Z603: 3 | AA603: 0 | AB603: 1206 | AC603: 928 | AD603: =(AB603/AC603)*100 -> 129.95689655172413 | AE603: =(Y603*4)+(AA603*2) -> 36
A604: BOX HILL | C604: HOLMES 4 | F604: NOTT 3 | I604: TRANQUILLI 3 | M604: BREBNER | O604: BREWER | Q604: CROWLEY | W604: PORT MELBOURNE | X604: 1 | Y604: 9 | Z604: 3 | AA604: 0 | AB604: 1107 | AC604: 914 | AD604: =(AB604/AC604)*100 -> 121.11597374179431 | AE604: =(Y604*4)+(AA604*2) -> 36
A605: PORT MELBOURNE | C605: SEXTON 3 | F605: SCHAEFER 2 | I605: PICIAONE | L605: HOLLOW | N605: FOLINO | P605: DUANE | W605: WERRIBEE | X605: 1 | Y605: 9 | Z605: 3 | AA605: 0 | AB605: 1212 | AC605: 1089 | AD605: =(AB605/AC605)*100 -> 111.29476584022038 | AE605: =(Y605*4)+(AA605*2) -> 36
W606: NORTH BALLARAT | X606: 2 | Y606: 7 | Z606: 4 | AA606: 0 | AB606: 913 | AC606: 705 | AD606: =(AB606/AC606)*100 -> 129.50354609929079 | AE606: =(Y606*4)+(AA606*2) -> 28
A607: SANDRINGHAM | C607: 5 | D607: 1 | E607: =(C607*6)+D607 -> 31 | G607: 12 | H607: 3 | I607: =(G607*6)+H607 -> 75 | K607: 17 | L607: 5 | M607: =(K607*6)+L607 -> 107 | O607: 19 | P607: 9 | Q607: =(O607*6)+P607 -> 123 | S607: Venue: PRESTON | W607: SANDRINGHAM | X607: 1 | Y607: 6 | Z607: 5 | AA607: 1 | AB607: 1323 | AC607: 946 | AD607: =(AB607/AC607)*100 -> 139.8520084566596 | AE607: =(Y607*4)+(AA607*2) -> 26
A608: PRESTON | C608: 3 | D608: 1 | E608: =(C608*6)+D608 -> 19 | G608: 5 | H608: 2 | I608: =(G608*6)+H608 -> 32 | K608: 7 | L608: 3 | M608: =(K608*6)+L608 -> 45 | O608: 9 | P608: 6 | Q608: =(O608*6)+P608 -> 60
A609: BEST PLAYERS | W609: WILLIAMSTOWN | X609: 2 | Y609: 5 | Z609: 6 | AA609: 0 | AB609: 944 | AC609: 979 | AD609: =(AB609/AC609)*100 -> 96.424923391215529 | AE609: =(Y609*4)+(AA609*2) -> 20
A610: SANDRINGHAM | C610: LIDDELL | F610: HAYNES | I610: QUINN | L610: MITCHELSON | O610: MACGEORGE | R610: SAUTNER | W610: BOX HILL | X610: 1 | Y610: 4 | Z610: 7 | AA610: 1 | AB610: 1117 | AC610: 1172 | AD610: =(AB610/AC610)*100 -> 95.307167235494887 | AE610: =(Y610*4)+(AA610*2) -> 18
A611: PRESTON | C611: CLARKE | F611: MANGIN | I611: McDONOUGH | L611: FROST | W611: COBURG | X611: 1 | Y611: 3 | Z611: 9 | AA611: 0 | AB611: 726 | AC611: 1277 | AD611: =(AB611/AC611)*100 -> 56.851996867658571 | AE611: =(Y611*4)+(AA611*2) -> 12
A612: GOALKICKERS | Q612: TREGEAR | W612: BENDIGO | X612: 1 | Y612: 2 | Z612: 10 | AA612: 0 | AB612: 842 | AC612: 1295 | AD612: =(AB612/AC612)*100 -> 65.019305019305023 | AE612: =(Y612*4)+(AA612*2) -> 8
A613: SANDRINGHAM | C613: SAUTNER 5 | E613: SCOTT-BRANAGAN 4 | I613: QUINN 3 | K613: HAYNES 2 | M613: MAGNUSSEN 2 | P613: FRATER | R613: JOHNSTONE | W613: PRESTON | X613: 1 | Y613: 0 | Z613: 10 | AA613: 2 | AB613: 829 | AC613: 1227 | AD613: =(AB613/AC613)*100 -> 67.563162184189068 | AE613: =(Y613*4)+(AA613*2) -> 4
A614: PRESTON | C614: CARACELLA 2 | F614: VAN BLOMMESTEIN 2 | J614: GRAINGER | M614: PLUNKETT | O614: MANGIN | Q614: GIBSON
A615: * | B615: (1 GOAL SHORT) | J615: WEATHER
A616: SPRINGVALE | C616: 1 | D616: 6 | E616: =(C616*6)+D616 -> 12 | G616: 2 | H616: 11 | I616: =(G616*6)+H616 -> 23 | K616: 8 | L616: 15 | M616: =(K616*6)+L616 -> 63 | O616: 11 | P616: 16 | Q616: =(O616*6)+P616 -> 82 | S616: Venue: SPRINGVALE
A617: BENDIGO | C617: 3 | D617: 1 | E617: =(C617*6)+D617 -> 19 | G617: 7 | H617: 4 | I617: =(G617*6)+H617 -> 46 | K617: 8 | L617: 6 | M617: =(K617*6)+L617 -> 54 | O617: 8 | P617: 8 | Q617: =(O617*6)+P617 -> 56
A618: BEST PLAYERS
A619: SPRINGVALE | C619: CAPLES | F619: BARDSLEY | I619: O'BRIEN | L619: SHAW | N619: COURTNEY | Q619: DELARUE
A620: BENDIGO | C620: WHITSED | F620: W BLAKE | I620: A RUDD | L620: CURCIO | N620: ELSUM | Q620: FLEMING
A621: GOALKICKERS
A622: SPRINGVALE | C622: CAPLES 2 | E622: DELARUE 2 | H622: KNIGHT 2 | J622: D CARROLL | M622: COURTNEY | O622: DONATI | Q622: JOY | R622: O'BRIEN
A623: BENDIGO | C623: BATES 3 | F623: A RUDD 3 | I623: ELSUM | K623: LANCASTER
A625: COBURG | C625: 1 | D625: 2 | E625: =(C625*6)+D625 -> 8 | G625: 6 | H625: 2 | I625: =(G625*6)+H625 -> 38 | K625: 7 | L625: 2 | M625: =(K625*6)+L625 -> 44 | O625: 11 | P625: 5 | Q625: =(O625*6)+P625 -> 71 | S625: Venue: WILLIAMSTOWN
A626: WILLIAMSTOWN | C626: 2 | D626: 2 | E626: =(C626*6)+D626 -> 14 | G626: 2 | H626: 4 | I626: =(G626*6)+H626 -> 16 | K626: 8 | L626: 7 | M626: =(K626*6)+L626 -> 55 | O626: 9 | P626: 11 | Q626: =(O626*6)+P626 -> 65
A627: BEST PLAYERS
A628: COBURG | C628: MASSOUDI | F628: TORTORA | I628: LITTLE | L628: DE PASQUALE | O628: SHEATHER | R628: DUNCAN
A629: WILLIAMSTOWN | C629: BROWN | F629: REYNOLDS | I629: VIDOVIC | L629: WEST | O629: D JUEGAN
A630: GOALKICKERS
A631: COBURG | C631: ALESSIO 3 | F631: RYAN 3 | I631: CANNING 2 | L631: LITTLE | N631: MANSFIELD | Q631: MORRISON
A632: WILLIAMSTOWN | C632: DELRE 2 | F632: D JUEGAN 2 | I632: REYNOLDS 2 | L632: TAYLOR | N632: CHRISTOFORO | Q632: BROWN
A634: FRANKSTON | C634: 3 | D634: 2 | E634: =(C634*6)+D634 -> 20 | G634: 7 | H634: 4 | I634: =(G634*6)+H634 -> 46 | K634: 10 | L634: 5 | M634: =(K634*6)+L634 -> 65 | O634: 12 | P634: 6 | Q634: =(O634*6)+P634 -> 78 | S634: Venue: FRANKSTON
A635: WERRIBEE | C635: 3 | D635: 2 | E635: =(C635*6)+D635 -> 20 | G635: 4 | H635: 4 | I635: =(G635*6)+H635 -> 28 | K635: 8 | L635: 4 | M635: =(K635*6)+L635 -> 52 | O635: 9 | P635: 7 | Q635: =(O635*6)+P635 -> 61
A636: BEST PLAYERS
A637: FRANKSTON | C637: WILLIAMS | F637: GEORGIOU | I637: STRINGER | L637: DAFF | N637: AGNELLO
A638: WERRIBEE | C638: CHURCHILL | F638: FAULKNER | I638: PULI | L638: TAYLOR | N638: MITCHELL
A639: GOALKICKERS
A640: FRANKSTON | C640: McCORMACK 4 | F640: WEBB 3 | H640: CLARKE 2 | K640: HOPGOOD | M640: VOKES | O640: GEORGIOU
A641: WERRIBEE | C641: MITCHELL 3 | F641: CAMILLIERI | I641: SAUNDERS | L641: BUTTON | N641: FAULKNER | P641: KELLETT | R641: SPROULE
A643: BYE | D643: NORTH BALLARAT
A645: ROUND 14 | D645: 10TH JULY | J645: WEATHER
D646: 1ST QTR | H646: 2ND QTR | L646: 3RD QTR | P646: FINAL | S646: Venue: WERRIBEE
A647: WERRIBEE | C647: 4 | D647: 5 | E647: =(C647*6)+D647 -> 29 | G647: 9 | H647: 8 | I647: =(G647*6)+H647 -> 62 | K647: 12 | L647: 12 | M647: =(K647*6)+L647 -> 84 | O647: 16 | P647: 17 | Q647: =(O647*6)+P647 -> 113 | S647: UMPIRES | Z647: LADDER | AC647: ROUND | AE647: 14
A648: WILLIAMSTOWN | C648: 2 | D648: 2 | E648: =(C648*6)+D648 -> 14 | G648: 4 | H648: 5 | I648: =(G648*6)+H648 -> 29 | K648: 6 | L648: 5 | M648: =(K648*6)+L648 -> 41 | O648: 9 | P648: 6 | Q648: =(O648*6)+P648 -> 60
A649: BEST PLAYERS | W649: TEAM | X649: B | Y649: W | Z649: L | AA649: D | AB649: FOR | AC649: AGST | AD649: % | AE649: PTS
A650: WERRIBEE | C650: WHITNALL | F650: TAYLOR | I650: ATKINS | L650: CHURCHILL | O650: PULI | Q650: FAULKNER
A651: WILLIAMSTOWN | C651: GRIFFIN | F651: CARRICK | I651: WEST | L651: CAPE | W651: FRANKSTON | X651: 1 | Y651: 10 | Z651: 3 | AA651: 0 | AB651: 1359 | AC651: 907 | AD651: =(AB651/AC651)*100 -> 149.83461962513783 | AE651: =(Y651*4)+(AA651*2) -> 40
A652: GOALKICKERS | W652: SPRINGVALE | X652: 1 | Y652: 10 | Z652: 3 | AA652: 0 | AB652: 1298 | AC652: 995 | AD652: =(AB652/AC652)*100 -> 130.45226130653268 | AE652: =(Y652*4)+(AA652*2) -> 40
A653: WERRIBEE | C653: MITCHELL 4 | F653: CHURCHILL 4 | I653: SHAW 3 | K653: ATKINS | M653: BUTTON | O653: PULI | P653: SPROULE | R653: PRIDDLE | W653: WERRIBEE | X653: 1 | Y653: 10 | Z653: 3 | AA653: 0 | AB653: 1325 | AC653: 1149 | AD653: =(AB653/AC653)*100 -> 115.31766753698869 | AE653: =(Y653*4)+(AA653*2) -> 40
A654: WILLIAMSTOWN | C654: REYNOLDS 4 | F654: DELRE 2 | I654: TAYLOR | K654: CHRISTOFORO | N654: McLEAN | W654: PORT MELBOURNE | X654: 1 | Y654: 9 | Z654: 4 | AA654: 0 | AB654: 1197 | AC654: 1035 | AD654: =(AB654/AC654)*100 -> 115.65217391304347 | AE654: =(Y654*4)+(AA654*2) -> 36
W655: NORTH BALLARAT | X655: 2 | Y655: 8 | Z655: 4 | AA655: 0 | AB655: 1052 | AC655: 753 | AD655: =(AB655/AC655)*100 -> 139.70783532536521 | AE655: =(Y655*4)+(AA655*2) -> 32
A656: NORTH BALLARAT | C656: 3 | D656: 5 | E656: =(C656*6)+D656 -> 23 | G656: 9 | H656: 8 | I656: =(G656*6)+H656 -> 62 | K656: 15 | L656: 15 | M656: =(K656*6)+L656 -> 105 | O656: 20 | P656: 19 | Q656: =(O656*6)+P656 -> 139 | S656: Venue: NORTH BALLARAT | W656: SANDRINGHAM | X656: 1 | Y656: 6 | Z656: 6 | AA656: 1 | AB656: 1390 | AC656: 1038 | AD656: =(AB656/AC656)*100 -> 133.91136801541427 | AE656: =(Y656*4)+(AA656*2) -> 26
A657: BOX HILL | C657: 0 | D657: 0 | E657: =(C657*6)+D657 -> 0 | G657: 2 | H657: 3 | I657: =(G657*6)+H657 -> 15 | K657: 3 | L657: 4 | M657: =(K657*6)+L657 -> 22 | O657: 7 | P657: 6 | Q657: =(O657*6)+P657 -> 48
A658: BEST PLAYERS | W658: WILLIAMSTOWN | X658: 2 | Y658: 5 | Z658: 7 | AA658: 0 | AB658: 1004 | AC658: 1092 | AD658: =(AB658/AC658)*100 -> 91.941391941391942 | AE658: =(Y658*4)+(AA658*2) -> 20
A659: NORTH BALLARAT | C659: SNIBSON | F659: FIELD | I659: PEAKE | L659: JURICA | O659: INIA | Q659: CLARKE | W659: BOX HILL | X659: 1 | Y659: 4 | Z659: 8 | AA659: 1 | AB659: 1165 | AC659: 1311 | AD659: =(AB659/AC659)*100 -> 88.86346300533944 | AE659: =(Y659*4)+(AA659*2) -> 18
A660: BOX HILL | C660: McCARTNEY | F660: HABERFIELD | I660: JENKINS | L660: BREBNER | W660: COBURG | X660: 2 | Y660: 3 | Z660: 9 | AA660: 0 | AB660: 726 | AC660: 1277 | AD660: =(AB660/AC660)*100 -> 56.851996867658571 | AE660: =(Y660*4)+(AA660*2) -> 12
A661: GOALKICKERS | C661: * | D661: (3 GOALS SHORT) | W661: PRESTON | X661: 1 | Y661: 1 | Z661: 10 | AA661: 2 | AB661: 950 | AC661: 1317 | AD661: =(AB661/AC661)*100 -> 72.133637053910405 | AE661: =(Y661*4)+(AA661*2) -> 8
A662: NORTH BALLARAT | C662: PEAKE 5 | F662: JURICA 3 | I662: JENKINS 3 | L662: SNIBSON 2 | O662: MAHER 2 | Q662: EDMONDS 2 | W662: BENDIGO | X662: 1 | Y662: 2 | Z662: 11 | AA662: 0 | AB662: 911 | AC662: 1394 | AD662: =(AB662/AC662)*100 -> 65.35150645624104 | AE662: =(Y662*4)+(AA662*2) -> 8
A663: BOX HILL | C663: SIKORA 3 | F663: HUGGINS | I663: DISNEY | K663: TRANQUILLI | N663: SIMKIN
D664: 11TH JULY | J664: WEATHER
A665: PRESTON | C665: 5 | D665: 1 | E665: =(C665*6)+D665 -> 31 | G665: 6 | H665: 3 | I665: =(G665*6)+H665 -> 39 | K665: 14 | L665: 6 | M665: =(K665*6)+L665 -> 90 | O665: 18 | P665: 13 | Q665: =(O665*6)+P665 -> 121 | S665: Venue: PORT MELBOURNE
A666: PORT MELBOURNE | C666: 5 | D666: 3 | E666: =(C666*6)+D666 -> 33 | G666: 8 | H666: 8 | I666: =(G666*6)+H666 -> 56 | K666: 10 | L666: 10 | M666: =(K666*6)+L666 -> 70 | O666: 13 | P666: 12 | Q666: =(O666*6)+P666 -> 90
A667: BEST PLAYERS
A668: PRESTON | C668: ZORZI | F668: GIBSON | I668: PASCOE | L668: LEE | N668: HAYWARD | Q668: CLARKE
A669: PORT MELBOURNE | C669: SEXTON | F669: COLLINS | I669: GOODALE | L669: FOLINO | N669: McCORMICK | Q669: HOLLOW
A670: GOALKICKERS
A671: PRESTON | C671: PENN 2 | E671: CROWLEY 2 | H671: BONADIO 2 | J671: PLUNKETT 2 | M671: MANGIN 2 | O671: CLARKE 2 | Q671: LEE | R671: S TAYLOR | W671: HALLINAN | X671: MANN | Z671: HABERMAN | AC671: CARACELLA
A672: PORT MELBOURNE | C672: SEXTON 4 | F672: McCORMICK 2 | I672: CREDLIN 2 | L672: DUANE 2 | O672: SCHAEFER | R672: FOLINO
D673: * | E673: (1 GOAL SHORT)
A674: FRANKSTON | C674: 4 | D674: 3 | E674: =(C674*6)+D674 -> 27 | G674: 7 | H674: 6 | I674: =(G674*6)+H674 -> 48 | K674: 11 | L674: 6 | M674: =(K674*6)+L674 -> 72 | O674: 15 | P674: 9 | Q674: =(O674*6)+P674 -> 99 | S674: Venue: BENDIGO
A675: BENDIGO | C675: 2 | D675: 3 | E675: =(C675*6)+D675 -> 15 | G675: 4 | H675: 5 | I675: =(G675*6)+H675 -> 29 | K675: 9 | L675: 7 | M675: =(K675*6)+L675 -> 61 | O675: 10 | P675: 9 | Q675: =(O675*6)+P675 -> 69
A676: BEST PLAYERS
A677: FRANKSTON | C677: GEORGIOU | F677: MALLOY | I677: CORRIGAN | L677: AGNELLO | N677: CLARKE | Q677: HOLCOMBE
A678: BENDIGO | C678: LANCASTER | F678: FLEMING | I678: CURCIO | L678: O'CALLAGHAN | O678: BOWER | Q678: ELSUM
A679: GOALKICKERS | C679: * | D679: (2 GOALS SHORT)
A680: FRANKSTON | C680: CLARKE 4 | F680: GEORGIOU 2 | I680: WEBB 2 | K680: MILES 2 | N680: McCORMACK | Q680: O'NEIL | S680: MALLOY
A681: BENDIGO | C681: BATES 3 | F681: ELSUM 2 | I681: PASCOE 2 | L681: RUDD 2 | N681: KELLY
A683: SPRINGVALE | C683: 3 | D683: 1 | E683: =(C683*6)+D683 -> 19 | G683: 6 | H683: 6 | I683: =(G683*6)+H683 -> 42 | K683: 11 | L683: 6 | M683: =(K683*6)+L683 -> 72 | O683: 14 | P683: 8 | Q683: =(O683*6)+P683 -> 92 | S683: Venue: BEACH ROAD
A684: SANDRINGHAM | C684: 2 | D684: 6 | E684: =(C684*6)+D684 -> 18 | G684: 2 | H684: 8 | I684: =(G684*6)+H684 -> 20 | K684: 5 | L684: 13 | M684: =(K684*6)+L684 -> 43 | O684: 8 | P684: 19 | Q684: =(O684*6)+P684 -> 67
A685: BEST PLAYERS
A686: SPRINGVALE | D686: CAPLES | G686: C CLARKE | J686: LITTLE | M686: O'BRIEN | P686: DONATI | R686: CANN
A687: SANDRINGHAM | D687: McKELLAR | G687: HAYWARD | J687: TREGEAR | M687: GOLD | P687: LIDDELL | R687: GRAY
A688: GOALKICKERS | D688: * | E688: (3 GOALS SHORT)
A689: SPRINGVALE | D689: DONATI 3 | G689: SMITH 2 | I689: PASSADOR 2 | L689: CANN | N689: COURTNEY | Q689: S CLARK | T689: C CLARKE
A690: SANDRINGHAM | D690: SAUTNER 2 | G690: LIDDELL 2 | J690: HAYNES | L690: B OAKLEY | O690: GOLD | Q690: CARROLL
A692: BYE | D692: COBURG
A694: ROUND 15 | D694: 17TH JULY | J694: WEATHER
D695: 1ST QTR | H695: 2ND QTR | L695: 3RD QTR | P695: FINAL | S695: Venue: FRANKSTON
A696: SANDRINGHAM | C696: 3 | D696: 3 | E696: =(C696*6)+D696 -> 21 | G696: 7 | H696: 6 | I696: =(G696*6)+H696 -> 48 | K696: 8 | L696: 11 | M696: =(K696*6)+L696 -> 59 | O696: 9 | P696: 15 | Q696: =(O696*6)+P696 -> 69 | S696: UMPIRES | Z696: LADDER | AC696: ROUND | AE696: 15
A697: FRANKSTON | C697: 1 | D697: 1 | E697: =(C697*6)+D697 -> 7 | G697: 4 | H697: 6 | I697: =(G697*6)+H697 -> 30 | K697: 6 | L697: 8 | M697: =(K697*6)+L697 -> 44 | O697: 8 | P697: 9 | Q697: =(O697*6)+P697 -> 57
A698: BEST PLAYERS | W698: TEAM | X698: B | Y698: W | Z698: L | AA698: D | AB698: FOR | AC698: AGST | AD698: % | AE698: PTS
A699: SANDRINGHAM | C699: COGHLAN | F699: McKELLAR | I699: HAYWARD | L699: OAKLEY | O699: MACGEORGE | R699: LIDDELL
A700: FRANKSTON | C700: CORRIGAN | F700: ROBERTS | I700: DAFF | L700: WILLIAMS | O700: HOLCOMBE | R700: BUTLER | W700: SPRINGVALE | X700: 1 | Y700: 11 | Z700: 3 | AA700: 0 | AB700: 1441 | AC700: 1034 | AD700: =(AB700/AC700)*100 -> 139.36170212765958 | AE700: =(Y700*4)+(AA700*2) -> 44
A701: GOALKICKERS | W701: WERRIBEE | X701: 1 | Y701: 11 | Z701: 3 | AA701: 0 | AB701: 1410 | AC701: 1212 | AD701: =(AB701/AC701)*100 -> 116.33663366336633 | AE701: =(Y701*4)+(AA701*2) -> 44
A702: SANDRINGHAM | C702: SAUTNER 3 | F702: MACGEORGE | I702: SCOTT-BRANAGAN | M702: GRANT | O702: FRATER | Q702: QUINN | S702: GOLD | W702: FRANKSTON | X702: 1 | Y702: 10 | Z702: 4 | AA702: 0 | AB702: 1416 | AC702: 976 | AD702: =(AB702/AC702)*100 -> 145.08196721311475 | AE702: =(Y702*4)+(AA702*2) -> 40
A703: FRANKSTON | C703: WEBB 2 | F703: CLARKE 2 | I703: STRINGER | L703: WILLIAMS | O703: HOLCOMBE | R703: BUTLER | W703: NORTH BALLARAT | X703: 2 | Y703: 9 | Z703: 4 | AA703: 0 | AB703: 1162 | AC703: 841 | AD703: =(AB703/AC703)*100 -> 138.16884661117717 | AE703: =(Y703*4)+(AA703*2) -> 36
W704: PORT MELBOURNE | X704: 1 | Y704: 9 | Z704: 5 | AA704: 0 | AB704: 1236 | AC704: 1178 | AD704: =(AB704/AC704)*100 -> 104.92359932088284 | AE704: =(Y704*4)+(AA704*2) -> 36
A705: NORTH BALLARAT | C705: 2 | D705: 5 | E705: =(C705*6)+D705 -> 17 | G705: 8 | H705: 11 | I705: =(G705*6)+H705 -> 59 | K705: 11 | L705: 13 | M705: =(K705*6)+L705 -> 79 | O705: 15 | P705: 20 | Q705: =(O705*6)+P705 -> 110 | S705: Venue: PRESTON | W705: SANDRINGHAM | X705: 1 | Y705: 7 | Z705: 6 | AA705: 1 | AB705: 1459 | AC705: 1095 | AD705: =(AB705/AC705)*100 -> 133.24200913242009 | AE705: =(Y705*4)+(AA705*2) -> 30
A706: PRESTON | C706: 4 | D706: 3 | E706: =(C706*6)+D706 -> 27 | G706: 7 | H706: 5 | I706: =(G706*6)+H706 -> 47 | K706: 12 | L706: 9 | M706: =(K706*6)+L706 -> 81 | O706: 13 | P706: 10 | Q706: =(O706*6)+P706 -> 88
A707: BEST PLAYERS | W707: WILLIAMSTOWN | X707: 2 | Y707: 6 | Z707: 7 | AA707: 0 | AB707: 1074 | AC707: 1151 | AD707: =(AB707/AC707)*100 -> 93.310165073848822 | AE707: =(Y707*4)+(AA707*2) -> 24
A708: NORTH BALLARAT | C708: JURICA | F708: J POLKINGHORNE | J708: JENKINS | M708: MURRIHY | W708: BOX HILL | X708: 2 | Y708: 4 | Z708: 8 | AA708: 1 | AB708: 1165 | AC708: 1311 | AD708: =(AB708/AC708)*100 -> 88.86346300533944 | AE708: =(Y708*4)+(AA708*2) -> 18
A709: PRESTON | C709: BROWN | F709: HOOPER | J709: GIBSON | M709: PASCOE | P709: HABERMAN | W709: COBURG | X709: 2 | Y709: 3 | Z709: 10 | AA709: 0 | AB709: 789 | AC709: 1362 | AD709: =(AB709/AC709)*100 -> 57.929515418502199 | AE709: =(Y709*4)+(AA709*2) -> 12
A710: GOALKICKERS | W710: PRESTON | X710: 1 | Y710: 1 | Z710: 11 | AA710: 2 | AB710: 1038 | AC710: 1427 | AD710: =(AB710/AC710)*100 -> 72.740014015416961 | AE710: =(Y710*4)+(AA710*2) -> 8
A711: NORTH BALLARAT | C711: CUTHBERTSON 5 | G711: EDMONDS 3 | J711: SIER 2 | L711: JENKINS 2 | N711: ELLITT | P711: CLARKE | R711: MURRIHY | W711: BENDIGO | X711: 1 | Y711: 2 | Z711: 12 | AA711: 0 | AB711: 970 | AC711: 1464 | AD711: =(AB711/AC711)*100 -> 66.256830601092901 | AE711: =(Y711*4)+(AA711*2) -> 8
A712: PRESTON | C712: PLUNKETT 3 | F712: PENN 2 | H712: HOOPER 2 | J712: PASCOE | L712: LEE | M712: GIBSON | O712: HABERMAN
A713: * | B713: (2 GOALS SHORT) | J713: WEATHER
A714: WERRIBEE | C714: 2 | D714: 4 | E714: =(C714*6)+D714 -> 16 | G714: 6 | H714: 6 | I714: =(G714*6)+H714 -> 42 | K714: 10 | L714: 11 | M714: =(K714*6)+L714 -> 71 | O714: 12 | P714: 13 | Q714: =(O714*6)+P714 -> 85 | S714: Venue: COBURG
A715: COBURG | C715: 3 | D715: 2 | E715: =(C715*6)+D715 -> 20 | G715: 4 | H715: 6 | I715: =(G715*6)+H715 -> 30 | K715: 5 | L715: 6 | M715: =(K715*6)+L715 -> 36 | O715: 9 | P715: 9 | Q715: =(O715*6)+P715 -> 63
A716: BEST PLAYERS
A717: WERRIBEE | C717: PULI | F717: ATKINS | I717: WHITNALL | L717: FAULKNER | O717: SHANNON | R717: SAUNDERS
A718: COBURG | C718: DE PASQUALE | F718: SHEATHER | I718: MANSFIELD | L718: SAUNDERS
A719: GOALKICKERS
A720: WERRIBEE | C720: S SMITH 4 | F720: REARDON 2 | I720: BUTTON 2 | L720: PULI | N720: DYER | P720: SAUNDERS | S720: GOODEY
A721: COBURG | C721: ALLSOP 3 | F721: RYAN 2 | H721: CANNING | K721: LITTLE | M721: BICER | O721: MORRISON
A723: WILLIAMSTOWN | C723: 1 | D723: 3 | E723: =(C723*6)+D723 -> 9 | G723: 3 | H723: 9 | I723: =(G723*6)+H723 -> 27 | K723: 7 | L723: 12 | M723: =(K723*6)+L723 -> 54 | O723: 9 | P723: 16 | Q723: =(O723*6)+P723 -> 70 | S723: Venue: WILLIAMSTOWN
A724: BENDIGO | C724: 3 | D724: 2 | E724: =(C724*6)+D724 -> 20 | G724: 4 | H724: 6 | I724: =(G724*6)+H724 -> 30 | K724: 7 | L724: 8 | M724: =(K724*6)+L724 -> 50 | O724: 8 | P724: 11 | Q724: =(O724*6)+P724 -> 59
A725: BEST PLAYERS
A726: WILLIAMSTOWN | C726: VIDOVIC | F726: WEST | I726: REYNOLDS | L726: CARRICK | O726: GRIFFIN | R726: EAMES
A727: BENDIGO | C727: CURCIO | F727: LANCASTER | I727: FLEMING | L727: O'CALLAGHAN | O727: BLAKE
A728: GOALKICKERS
A729: WILLIAMSTOWN | C729: REYNOLDS 4 | F729: HORE 2 | I729: EAMES | K729: DELRE | M729: McGREGOR
A730: BENDIGO | C730: SHAWCROSS 3 | F730: PASCOE 2 | I730: ELSUM | K730: O'CALLAGHAN | N730: RUDD
A732: SPRINGVALE | C732: 4 | D732: 2 | E732: =(C732*6)+D732 -> 26 | G732: 11 | H732: 4 | I732: =(G732*6)+H732 -> 70 | K732: 13 | L732: 5 | M732: =(K732*6)+L732 -> 83 | O732: 23 | P732: 5 | Q732: =(O732*6)+P732 -> 143 | S732: Venue: SPRINGVALE
A733: PORT MELBOURNE | C733: 1 | D733: 2 | E733: =(C733*6)+D733 -> 8 | G733: 1 | H733: 6 | I733: =(G733*6)+H733 -> 12 | K733: 5 | L733: 9 | M733: =(K733*6)+L733 -> 39 | O733: 5 | P733: 9 | Q733: =(O733*6)+P733 -> 39
A734: BEST PLAYERS
A735: SPRINGVALE | C735: D CARROLL | F735: O'BRIEN | I735: SMITH | L735: ROBBINS | O735: DELARUE | R735: FORD
A736: PORT MELBOURNE | C736: FOLINO | F736: PICIAONE | I736: GOODALE | L736: BAKOULAS | O736: SHARP | R736: HENDERSON
A737: GOALKICKERS | C737: * | D737: (6 GOALS SHORT)
A738: SPRINGVALE | C738: SMITH 8 | F738: PASSADOR 4 | I738: BARDSLEY | L738: D CARROLL | O738: J CARROLL | R738: CANN | T738: COURTNEY
A739: PORT MELBOURNE | C739: SCHAEFER 2 | G739: PHAN | I739: CROCKER | K739: COLLINS
A741: BYE | D741: BOX HILL
A743: ROUND 16 | D743: 24TH JULY | J743: WEATHER
D744: 1ST QTR | H744: 2ND QTR | L744: 3RD QTR | P744: FINAL | S744: Venue: BEACH ROAD
A745: SANDRINGHAM | C745: 2 | D745: 6 | E745: =(C745*6)+D745 -> 18 | G745: 7 | H745: 13 | I745: =(G745*6)+H745 -> 55 | K745: 12 | L745: 16 | M745: =(K745*6)+L745 -> 88 | O745: 20 | P745: 21 | Q745: =(O745*6)+P745 -> 141 | S745: UMPIRES | Z745: LADDER | AC745: ROUND | AE745: 16
A746: WILLIAMSTOWN | C746: 2 | D746: 2 | E746: =(C746*6)+D746 -> 14 | G746: 4 | H746: 4 | I746: =(G746*6)+H746 -> 28 | K746: 7 | L746: 5 | M746: =(K746*6)+L746 -> 47 | O746: 10 | P746: 7 | Q746: =(O746*6)+P746 -> 67
A747: BEST PLAYERS | W747: TEAM | X747: B | Y747: W | Z747: L | AA747: D | AB747: FOR | AC747: AGST | AD747: % | AE747: PTS
A748: SANDRINGHAM | C748: SAUTNER | F748: MAGNUSSEN | I748: MITCHELSON | L748: B OAKLEY | O748: CARROLL | Q748: HAYNES
A749: WILLIAMSTOWN | C749: REYNOLDS | F749: HOLLOW | I749: JUEAGAN | L749: SIR | W749: SPRINGVALE | X749: 1 | Y749: 12 | Z749: 3 | AA749: 0 | AB749: 1551 | AC749: 1082 | AD749: =(AB749/AC749)*100 -> 143.34565619223662 | AE749: =(Y749*4)+(AA749*2) -> 48
A750: GOALKICKERS | C750: * | D750: (2 GOALS SHORT) | W750: WERRIBEE | X750: 2 | Y750: 11 | Z750: 3 | AA750: 0 | AB750: 1410 | AC750: 1212 | AD750: =(AB750/AC750)*100 -> 116.33663366336633 | AE750: =(Y750*4)+(AA750*2) -> 44
A751: SANDRINGHAM | C751: SAUTNER 7 | F751: B OAKLEY 4 | I751: HAYNES 3 | L751: D GRANT 2 | O751: MACGEORGE 2 | W751: FRANKSTON | X751: 2 | Y751: 10 | Z751: 4 | AA751: 0 | AB751: 1416 | AC751: 976 | AD751: =(AB751/AC751)*100 -> 145.08196721311475 | AE751: =(Y751*4)+(AA751*2) -> 40
A752: WILLIAMSTOWN | C752: DELRE 3 | F752: CHRISTOFORO 2 | I752: JUEGAN 2 | L752: HOLLOW | N752: REYNOLDS | P752: STANLEY | W752: NORTH BALLARAT | X752: 2 | Y752: 9 | Z752: 5 | AA752: 0 | AB752: 1210 | AC752: 951 | AD752: =(AB752/AC752)*100 -> 127.23449001051526 | AE752: =(Y752*4)+(AA752*2) -> 36
W753: PORT MELBOURNE | X753: 2 | Y753: 9 | Z753: 5 | AA753: 0 | AB753: 1236 | AC753: 1178 | AD753: =(AB753/AC753)*100 -> 104.92359932088284 | AE753: =(Y753*4)+(AA753*2) -> 36
A754: BOX HILL | C754: 4 | D754: 4 | E754: =(C754*6)+D754 -> 28 | G754: 9 | H754: 12 | I754: =(G754*6)+H754 -> 66 | K754: 9 | L754: 15 | M754: =(K754*6)+L754 -> 69 | O754: 17 | P754: 18 | Q754: =(O754*6)+P754 -> 120 | S754: Venue: BOX HILL | W754: SANDRINGHAM | X754: 1 | Y754: 8 | Z754: 6 | AA754: 1 | AB754: 1600 | AC754: 1162 | AD754: =(AB754/AC754)*100 -> 137.69363166953528 | AE754: =(Y754*4)+(AA754*2) -> 34
A755: PRESTON | C755: 2 | D755: 2 | E755: =(C755*6)+D755 -> 14 | G755: 6 | H755: 2 | I755: =(G755*6)+H755 -> 38 | K755: 12 | L755: 4 | M755: =(K755*6)+L755 -> 76 | O755: 14 | P755: 4 | Q755: =(O755*6)+P755 -> 88
A756: BEST PLAYERS | W756: WILLIAMSTOWN | X756: 2 | Y756: 6 | Z756: 8 | AA756: 0 | AB756: 1080 | AC756: 1292 | AD756: =(AB756/AC756)*100 -> 83.591331269349851 | AE756: =(Y756*4)+(AA756*2) -> 24
A757: BOX HILL | C757: PARTHENIDES | F757: McCARTNEY | I757: ROBINSON | L757: HOLLAND | O757: HABERFIELD | R757: JENKINS | W757: BOX HILL | X757: 2 | Y757: 5 | Z757: 8 | AA757: 1 | AB757: 1285 | AC757: 1399 | AD757: =(AB757/AC757)*100 -> 91.851322373123651 | AE757: =(Y757*4)+(AA757*2) -> 22
A758: PRESTON | C758: GIBSON | F758: ZORZI | I758: GROSSMAN | L758: CARACELLA | O758: BROWN | W758: COBURG | X758: 2 | Y758: 4 | Z758: 10 | AA758: 0 | AB758: 883 | AC758: 1428 | AD758: =(AB758/AC758)*100 -> 61.834733893557427 | AE758: =(Y758*4)+(AA758*2) -> 16
A759: GOALKICKERS | I759: NICHOL | K759: PARTHENIDES | N759: ROWE | P759: SIKORA | R759: ROBINSON | W759: PRESTON | X759: 1 | Y759: 1 | Z759: 12 | AA759: 2 | AB759: 1126 | AC759: 1547 | AD759: =(AB759/AC759)*100 -> 72.786037491919842 | AE759: =(Y759*4)+(AA759*2) -> 8
A760: BOX HILL | C760: TRANQUILLI 3 | F760: BREBNER 2 | I760: HABERFIELD 2 | L760: HOLMES 2 | O760: WILKINSON 2 | R760: HOLLAND | W760: BENDIGO | X760: 1 | Y760: 2 | Z760: 13 | AA760: 0 | AB760: 1033 | AC760: 1558 | AD760: =(AB760/AC760)*100 -> 66.302952503209241 | AE760: =(Y760*4)+(AA760*2) -> 8
A761: PRESTON | C761: GIBSON 6 | F761: CARACELLA 3 | I761: HALLINAN 2 | L761: BONADIO 2 | O761: PENN
D762: 25TH JULY | J762: WEATHER
A763: COBURG | C763: 4 | D763: 0 | E763: =(C763*6)+D763 -> 24 | G763: 8 | H763: 4 | I763: =(G763*6)+H763 -> 52 | K763: 9 | L763: 6 | M763: =(K763*6)+L763 -> 60 | O763: 14 | P763: 10 | Q763: =(O763*6)+P763 -> 94 | S763: Venue: BENDIGO
A764: BENDIGO | C764: 4 | D764: 2 | E764: =(C764*6)+D764 -> 26 | G764: 8 | H764: 4 | I764: =(G764*6)+H764 -> 52 | K764: 10 | L764: 4 | M764: =(K764*6)+L764 -> 64 | O764: 10 | P764: 6 | Q764: =(O764*6)+P764 -> 66
A765: BEST PLAYERS
A766: COBURG | C766: McLEOD | F766: MASSOUDI | I766: T McHARDY | L766: TORTORA | O766: GILPIN | R766: O'CALLAGHAN
A767: BENDIGO | C767: WHITSED | F767: ANGOVE | I767: CURCIO | L767: LANCASTER | O767: CONNAUGHTON | R767: SHIELLS
A768: GOALKICKERS
A769: COBURG | C769: RYAN 4 | F769: MANSFIELD 3 | I769: BICER 2 | K769: SALIH 2 | M769: ALESSIO | O769: LITTLE | Q769: GLEESON
A770: BENDIGO | C770: RUDD 3 | F770: SHIELLS 2 | I770: DILLON | K770: ELSUM | M770: O'CALLAGHAN | P770: PASCOE | R770: SHAWCROSS
A772: SPRINGVALE | C772: 5 | D772: 2 | E772: =(C772*6)+D772 -> 32 | G772: 7 | H772: 5 | I772: =(G772*6)+H772 -> 47 | K772: 10 | L772: 8 | M772: =(K772*6)+L772 -> 68 | O772: 16 | P772: 14 | Q772: =(O772*6)+P772 -> 110 | S772: Venue: NORTH BALLARAT
A773: NORTH BALLARAT | C773: 2 | D773: 3 | E773: =(C773*6)+D773 -> 15 | G773: 4 | H773: 3 | I773: =(G773*6)+H773 -> 27 | K773: 6 | L773: 5 | M773: =(K773*6)+L773 -> 41 | O773: 7 | P773: 6 | Q773: =(O773*6)+P773 -> 48
A774: BEST PLAYERS
A775: SPRINGVALE | C775: ROBBINS | F775: DONATI | I775: CAPLES | L775: LITTLE | O775: D CARROLL | R775: DELARUE
A776: NORTH BALLARAT | C776: J POLKINGHORNE | G776: FISHER | I776: FIELD | K776: MccULLOCH
A777: GOALKICKERS
A778: SPRINGVALE | C778: SMITH 6 | F778: CAPLES 2 | H778: DONATI 2 | K778: KNIGHT 2 | M778: PASSADOR 2 | P778: COURTNEY | S778: O'BRIEN
A779: NORTH BALLARAT | C779: KIRZNER 3 | F779: MAHER | H779: CLARKE | J779: CUTHBERTSON | N779: FRITH
A781: BYE | D781: PORT MELBOURNE | H781: FRANKSTON | K781: WERRIBEE
A783: ROUND 17 | D783: 31ST JULY | J783: WEATHER
D784: 1ST QTR | H784: 2ND QTR | L784: 3RD QTR | P784: FINAL | S784: Venue: FRANKSTON
A785: FRANKSTON | C785: 6 | D785: 2 | E785: =(C785*6)+D785 -> 38 | G785: 12 | H785: 5 | I785: =(G785*6)+H785 -> 77 | K785: 16 | L785: 8 | M785: =(K785*6)+L785 -> 104 | O785: 20 | P785: 9 | Q785: =(O785*6)+P785 -> 129 | S785: UMPIRES | Z785: LADDER | AC785: ROUND | AE785: 17
A786: NORTH BALLARAT | C786: 2 | D786: 1 | E786: =(C786*6)+D786 -> 13 | G786: 6 | H786: 2 | I786: =(G786*6)+H786 -> 38 | K786: 12 | L786: 6 | M786: =(K786*6)+L786 -> 78 | O786: 16 | P786: 12 | Q786: =(O786*6)+P786 -> 108
A787: BEST PLAYERS | W787: TEAM | X787: B | Y787: W | Z787: L | AA787: D | AB787: FOR | AC787: AGST | AD787: % | AE787: PTS
A788: FRANKSTON | C788: MALLOY | F788: CLARKE | I788: DAFF | K788: HOPGOOD | N788: BUTLER | Q788: O'NEIL
A789: NORTH BALLARAT | C789: FIELD | F789: JURICA | I789: T POLKINGHORNE | M789: FRITH | W789: SPRINGVALE | X789: 1 | Y789: 13 | Z789: 3 | AA789: 0 | AB789: 1683 | AC789: 1189 | AD789: =(AB789/AC789)*100 -> 141.54751892346508 | AE789: =(Y789*4)+(AA789*2) -> 52
A790: GOALKICKERS | C790: ** | D790: (4 GOALS SHORT/2GOALS SHORT) | W790: WERRIBEE | X790: 2 | Y790: 12 | Z790: 3 | AA790: 0 | AB790: 1567 | AC790: 1295 | AD790: =(AB790/AC790)*100 -> 121.003861003861 | AE790: =(Y790*4)+(AA790*2) -> 48
A791: FRANKSTON | C791: CLARKE 7 | E791: MALLOY 3 | H791: LOVETT 3 | K791: O'NEIL | M791: ANDERSON | P791: MURRAY | R791: WILLIAMS | W791: FRANKSTON | X791: 2 | Y791: 11 | Z791: 4 | AA791: 0 | AB791: 1545 | AC791: 1084 | AD791: =(AB791/AC791)*100 -> 142.52767527675277 | AE791: =(Y791*4)+(AA791*2) -> 44
A792: NORTH BALLARAT | C792: KIRZNER 3 | F792: JURICA 2 | H792: FIELD 2 | J792: FISHER 2 | L792: T POLKINGHORNE 2 | P792: SIER 2 | R792: SIMPSON | W792: PORT MELBOURNE | X792: 2 | Y792: 10 | Z792: 5 | AA792: 0 | AB792: 1321 | AC792: 1242 | AD792: =(AB792/AC792)*100 -> 106.36070853462158 | AE792: =(Y792*4)+(AA792*2) -> 40
D793: 1ST AUGUST | J793: WEATHER | W793: SANDRINGHAM | X793: 1 | Y793: 9 | Z793: 6 | AA793: 1 | AB793: 1706 | AC793: 1184 | AD793: =(AB793/AC793)*100 -> 144.08783783783784 | AE793: =(Y793*4)+(AA793*2) -> 38
A794: WERRIBEE | C794: 7 | D794: 3 | E794: =(C794*6)+D794 -> 45 | G794: 10 | H794: 9 | I794: =(G794*6)+H794 -> 69 | K794: 16 | L794: 13 | M794: =(K794*6)+L794 -> 109 | O794: 23 | P794: 19 | Q794: =(O794*6)+P794 -> 157 | S794: Venue: WERRIBEE | W794: NORTH BALLARAT | X794: 2 | Y794: 9 | Z794: 6 | AA794: 0 | AB794: 1318 | AC794: 1080 | AD794: =(AB794/AC794)*100 -> 122.03703703703704 | AE794: =(Y794*4)+(AA794*2) -> 36
A795: BENDIGO | C795: 3 | D795: 0 | E795: =(C795*6)+D795 -> 18 | G795: 9 | H795: 2 | I795: =(G795*6)+H795 -> 56 | K795: 10 | L795: 4 | M795: =(K795*6)+L795 -> 64 | O795: 13 | P795: 5 | Q795: =(O795*6)+P795 -> 83
A796: BEST PLAYERS | W796: WILLIAMSTOWN | X796: 2 | Y796: 6 | Z796: 9 | AA796: 0 | AB796: 1144 | AC796: 1377 | AD796: =(AB796/AC796)*100 -> 83.079157588961507 | AE796: =(Y796*4)+(AA796*2) -> 24
A797: WERRIBEE | C797: WHITNALL | F797: ATKINS | I797: CHURCHILL | L797: S SMITH | N797: SPROULE | Q797: FAULKNER | W797: BOX HILL | X797: 2 | Y797: 5 | Z797: 9 | AA797: 1 | AB797: 1392 | AC797: 1531 | AD797: =(AB797/AC797)*100 -> 90.920966688438938 | AE797: =(Y797*4)+(AA797*2) -> 22
A798: BENDIGO | C798: LANCASTER | F798: O'CALLAGHAN | I798: CURCIO | L798: TOINTON | N798: WHITSED | Q798: SHIELS | W798: COBURG | X798: 2 | Y798: 4 | Z798: 11 | AA798: 0 | AB798: 905 | AC798: 1534 | AD798: =(AB798/AC798)*100 -> 58.996088657105602 | AE798: =(Y798*4)+(AA798*2) -> 16
A799: GOALKICKERS | C799: * | D799: (2 GOALS SHORT) | W799: PRESTON | X799: 2 | Y799: 1 | Z799: 12 | AA799: 2 | AB799: 1126 | AC799: 1547 | AD799: =(AB799/AC799)*100 -> 72.786037491919842 | AE799: =(Y799*4)+(AA799*2) -> 8
A800: WERRIBEE | C800: S SMITH 6 | E800: MITCHELL 5 | H800: CHURCHILL 3 | K800: PULI 2 | M800: SAUNDERS 2 | P800: ATKINS 2 | S800: SPROULE | W800: BENDIGO | X800: 1 | Y800: 2 | Z800: 14 | AA800: 0 | AB800: 1116 | AC800: 1715 | AD800: =(AB800/AC800)*100 -> 65.072886297376101 | AE800: =(Y800*4)+(AA800*2) -> 8
A801: BENDIGO | C801: PASCOE 3 | E801: TOINTON 3 | H801: ELSUM 2 | K801: BOWER | M801: ROGERS | O801: SHARKEY | Q801: SHIELLS | S801: SCHMIDT
A803: SPRINGVALE | C803: 4 | D803: 8 | E803: =(C803*6)+D803 -> 32 | G803: 7 | H803: 10 | I803: =(G803*6)+H803 -> 52 | K803: 14 | L803: 15 | M803: =(K803*6)+L803 -> 99 | O803: 19 | P803: 18 | Q803: =(O803*6)+P803 -> 132 | S803: Venue: SHEPLEY OVAL
A804: BOX HILL | C804: 2 | D804: 5 | E804: =(C804*6)+D804 -> 17 | G804: 10 | H804: 8 | I804: =(G804*6)+H804 -> 68 | K804: 13 | L804: 10 | M804: =(K804*6)+L804 -> 88 | O804: 16 | P804: 11 | Q804: =(O804*6)+P804 -> 107
A805: BEST PLAYERS
A806: SPRINGVALE | C806: KNIGHT | F806: PASSADOR | I806: SHEAHAN | L806: ROBBINS | O806: D CARROLL | R806: O'BRIEN
A807: BOX HILL | C807: McCARTNEY | F807: BREBNER | I807: HOLLAND | L807: AIELLO | O807: WILKINSON | R807: HOLMES
A808: GOALKICKERS | C808: * | D808: (2 GOALS SHORT)
A809: SPRINGVALE | C809: KNIGHT 5 | F809: PASSADOR 5 | I809: DONATI 2 | L809: O'BRIEN 2 | N809: BARDSLEY | P809: D CARROLL | S809: C CLARKE
A810: BOX HILL | C810: WILKINSON 4 | F810: SLATER 4 | H810: ALLSOP 2 | J810: BREBNER 2 | M810: HABERFIELD 2 | P810: McCARTNEY | S810: TRANQUILLI
A812: SANDRINGHAM | C812: 3 | D812: 2 | E812: =(C812*6)+D812 -> 20 | G812: 7 | H812: 9 | I812: =(G812*6)+H812 -> 51 | K812: 12 | L812: 14 | M812: =(K812*6)+L812 -> 86 | O812: 14 | P812: 22 | Q812: =(O812*6)+P812 -> 106 | S812: Venue: COBURG
A813: COBURG | C813: 0 | D813: 1 | E813: =(C813*6)+D813 -> 1 | G813: 0 | H813: 1 | I813: =(G813*6)+H813 -> 1 | K813: 2 | L813: 3 | M813: =(K813*6)+L813 -> 15 | O813: 3 | P813: 4 | Q813: =(O813*6)+P813 -> 22
A814: BEST PLAYERS
A815: SANDRINGHAM | C815: MALONEY | F815: GRANT | I815: McKELLAR | L815: OAKLEY | O815: MACGEORGE | R815: FRATER
A816: COBURG | C816: McHARDY | F816: GILPIN | I816: DE PASQUALE | L816: CONDON
A817: GOALKICKERS | C817: * | D817: (1 GOAL SHORT)
A818: SANDRINGHAM | C818: SAUTNER 5 | F818: MALONEY 2 | I818: GRANT 2 | L818: SCOTT-BRANAGAN 2 | P818: MACGEORGE | S818: OAKLEY
A819: COBURG | C819: ALESSIO 2 | F819: McLEOD
A821: PORT MELBOURNE | C821: 5 | D821: 4 | E821: =(C821*6)+D821 -> 34 | G821: 8 | H821: 10 | I821: =(G821*6)+H821 -> 58 | K821: 9 | L821: 12 | M821: =(K821*6)+L821 -> 66 | O821: 12 | P821: 13 | Q821: =(O821*6)+P821 -> 85 | S821: Venue: WILLIAMSTOWN
A822: WILLIAMSTOWN | C822: 0 | D822: 0 | E822: =(C822*6)+D822 -> 0 | G822: 3 | H822: 3 | I822: =(G822*6)+H822 -> 21 | K822: 5 | L822: 7 | M822: =(K822*6)+L822 -> 37 | O822: 9 | P822: 10 | Q822: =(O822*6)+P822 -> 64
A823: BEST PLAYERS
A824: PORT MELBOURNE | C824: PICIAONE | F824: SEXTON | I824: MARTIN | L824: FOLINO | O824: McCORMICK | R824: CROCKER
A825: WILLIAMSTOWN | C825: CARRICK | F825: REYNOLDS | I825: GRIFFIN | L825: KENNEDY | O825: PEARSON
A826: GOALKICKERS
A827: PORT MELBOURNE | C827: CROCKER 6 | F827: PICIAONE 2 | I827: SEXTON 2 | L827: MARTIN | N827: McCORMICK
A828: WILLIAMSTOWN | C828: REYNOLDS 4 | F828: PEARSON 3 | I828: WEST | K828: GRIFFIN
A830: BYE | D830: PRESTON
A832: ROUND 18 | D832: 7TH AUGUST | J832: WEATHER
D833: 1ST QTR | H833: 2ND QTR | L833: 3RD QTR | P833: FINAL | S833: Venue: BEACH ROAD
A834: SANDRINGHAM | C834: 5 | D834: 5 | E834: =(C834*6)+D834 -> 35 | G834: 11 | H834: 7 | I834: =(G834*6)+H834 -> 73 | K834: 16 | L834: 11 | M834: =(K834*6)+L834 -> 107 | O834: 18 | P834: 12 | Q834: =(O834*6)+P834 -> 120 | S834: UMPIRES | Z834: LADDER | AC834: ROUND | AE834: 18
A835: WERRIBEE | C835: 2 | D835: 2 | E835: =(C835*6)+D835 -> 14 | G835: 5 | H835: 8 | I835: =(G835*6)+H835 -> 38 | K835: 7 | L835: 12 | M835: =(K835*6)+L835 -> 54 | O835: 12 | P835: 17 | Q835: =(O835*6)+P835 -> 89
A836: BEST PLAYERS | W836: TEAM | X836: B | Y836: W | Z836: L | AA836: D | AB836: FOR | AC836: AGST | AD836: % | AE836: PTS
A837: SANDRINGHAM | C837: FRATER | F837: HAYNES | I837: McKELLAR | L837: SCOTT-BRANAGAN | P837: CARROLL | R837: B OAKLEY
A838: WERRIBEE | C838: FAULKNER | F838: ROGERS | I838: TAYLOR | L838: SCHENK | P838: SMITH | R838: DYER | W838: SPRINGVALE | X838: 1 | Y838: 14 | Z838: 3 | AA838: 0 | AB838: 1792 | AC838: 1257 | AD838: =(AB838/AC838)*100 -> 142.56165473349245 | AE838: =(Y838*4)+(AA838*2) -> 56
A839: GOALKICKERS | H839: McKELLAR | K839: SCOTT-BRANAGAN | O839: MALONEY | Q839: FRATER | W839: FRANKSTON | X839: 2 | Y839: 12 | Z839: 4 | AA839: 0 | AB839: 1661 | AC839: 1152 | AD839: =(AB839/AC839)*100 -> 144.18402777777777 | AE839: =(Y839*4)+(AA839*2) -> 48
A840: SANDRINGHAM | C840: SAUTNER 3 | F840: NUGENT 3 | I840: B OAKLEY 2 | L840: HAYNES 2 | N840: QUINN 2 | P840: L OAKLEY 2 | W840: WERRIBEE | X840: 2 | Y840: 12 | Z840: 4 | AA840: 0 | AB840: 1656 | AC840: 1415 | AD840: =(AB840/AC840)*100 -> 117.03180212014135 | AE840: =(Y840*4)+(AA840*2) -> 48
A841: WERRIBEE | C841: SPROULE 3 | E841: SMITH 2 | G841: SATTERLEY | J841: BUTTON | L841: BAXTER | N841: GOODEY | P841: PULI | Q841: FAULKNER | W841: PORT MELBOURNE | X841: 2 | Y841: 11 | Z841: 5 | AA841: 0 | AB841: 1414 | AC841: 1280 | AD841: =(AB841/AC841)*100 -> 110.46875 | AE841: =(Y841*4)+(AA841*2) -> 44
M842: MITCHELL | W842: SANDRINGHAM | X842: 1 | Y842: 10 | Z842: 6 | AA842: 1 | AB842: 1826 | AC842: 1273 | AD842: =(AB842/AC842)*100 -> 143.44069128043989 | AE842: =(Y842*4)+(AA842*2) -> 42
A843: NORTH BALLARAT | C843: 3 | D843: 0 | E843: =(C843*6)+D843 -> 18 | G843: 8 | H843: 1 | I843: =(G843*6)+H843 -> 49 | K843: 8 | L843: 5 | M843: =(K843*6)+L843 -> 53 | O843: 10 | P843: 8 | Q843: =(O843*6)+P843 -> 68 | S843: Venue: NORTH BALLARAT | W843: NORTH BALLARAT | X843: 2 | Y843: 10 | Z843: 6 | AA843: 0 | AB843: 1386 | AC843: 1126 | AD843: =(AB843/AC843)*100 -> 123.09058614564832 | AE843: =(Y843*4)+(AA843*2) -> 40
A844: WILLIAMSTOWN | C844: 4 | D844: 1 | E844: =(C844*6)+D844 -> 25 | G844: 5 | H844: 1 | I844: =(G844*6)+H844 -> 31 | K844: 6 | L844: 3 | M844: =(K844*6)+L844 -> 39 | O844: 7 | P844: 4 | Q844: =(O844*6)+P844 -> 46
A845: BEST PLAYERS | W845: WILLIAMSTOWN | X845: 2 | Y845: 6 | Z845: 10 | AA845: 0 | AB845: 1190 | AC845: 1445 | AD845: =(AB845/AC845)*100 -> 82.35294117647058 | AE845: =(Y845*4)+(AA845*2) -> 24
A846: NORTH BALLARAT | C846: FIELD | E846: JURICA | H846: G POLKINGHORNE | L846: CUTHBERTSON | O846: EDWARDS | Q846: SNIBSON | W846: BOX HILL | X846: 2 | Y846: 5 | Z846: 10 | AA846: 1 | AB846: 1460 | AC846: 1647 | AD846: =(AB846/AC846)*100 -> 88.646023072252575 | AE846: =(Y846*4)+(AA846*2) -> 22
A847: WILLIAMSTOWN | C847: SIR | E847: REYNOLDS | H847: ZAVALAS | L847: CARRICK | O847: BROWN | Q847: ROUND | W847: COBURG | X847: 2 | Y847: 4 | Z847: 12 | AA847: 0 | AB847: 943 | AC847: 1629 | AD847: =(AB847/AC847)*100 -> 57.888275015346835 | AE847: =(Y847*4)+(AA847*2) -> 16
A848: GOALKICKERS | W848: PRESTON | X848: 2 | Y848: 1 | Z848: 13 | AA848: 2 | AB848: 1194 | AC848: 1656 | AD848: =(AB848/AC848)*100 -> 72.101449275362313 | AE848: =(Y848*4)+(AA848*2) -> 8
A849: NORTH BALLARAT | C849: MACKAY 2 | F849: SIER 2 | H849: KIRZNER 2 | K849: CLARKE | M849: FIELD | O849: EDWARDS | Q849: FRITH | W849: BENDIGO | X849: 2 | Y849: 2 | Z849: 14 | AA849: 0 | AB849: 1116 | AC849: 1715 | AD849: =(AB849/AC849)*100 -> 65.072886297376101 | AE849: =(Y849*4)+(AA849*2) -> 8
A850: WILLIAMSTOWN | C850: REYNOLDS 3 | F850: DELRE 2 | I850: EAMES | K850: PEARSON
A852: PORT MELBOURNE | C852: 3 | D852: 2 | E852: =(C852*6)+D852 -> 20 | G852: 6 | H852: 5 | I852: =(G852*6)+H852 -> 41 | K852: 10 | L852: 11 | M852: =(K852*6)+L852 -> 71 | O852: 13 | P852: 15 | Q852: =(O852*6)+P852 -> 93 | S852: Venue: PORT MELBOURNE
A853: COBURG | C853: 1 | D853: 1 | E853: =(C853*6)+D853 -> 7 | G853: 3 | H853: 3 | I853: =(G853*6)+H853 -> 21 | K853: 4 | L853: 4 | M853: =(K853*6)+L853 -> 28 | O853: 5 | P853: 8 | Q853: =(O853*6)+P853 -> 38
A854: BEST PLAYERS
A855: PORT MELBOURNE | C855: MARTIN | F855: GOODALE | I855: CLOHESY | L855: PICIAONE | O855: BAKOULAS | R855: SHARP
A856: COBURG | C856: DE PASQUALE | F856: CANNING | I856: SAUNDERS | L856: CONDON | O856: MORRISON | R856: TORTORA
A857: GOALKICKERS
A858: PORT MELBOURNE | C858: BAKOULAS 5 | F858: SEXTON 2 | I858: JESS 2 | K858: PICIAONE 2 | N858: GRIGG | P858: PATTERSON
A859: COBURG | C859: CANNING 2 | F859: S RYAN | I859: ALESSIO | K859: WILLOUGHBY
D860: 8TH AUGUST | J860: WEATHER
A861: SPRINGVALE | C861: 4 | D861: 3 | E861: =(C861*6)+D861 -> 27 | G861: 4 | H861: 8 | I861: =(G861*6)+H861 -> 32 | K861: 9 | L861: 16 | M861: =(K861*6)+L861 -> 70 | O861: 15 | P861: 19 | Q861: =(O861*6)+P861 -> 109 | S861: Venue: PRESTON
A862: PRESTON | C862: 0 | D862: 2 | E862: =(C862*6)+D862 -> 2 | G862: 5 | H862: 4 | I862: =(G862*6)+H862 -> 34 | K862: 7 | L862: 5 | M862: =(K862*6)+L862 -> 47 | O862: 10 | P862: 8 | Q862: =(O862*6)+P862 -> 68
A863: BEST PLAYERS
A864: SPRINGVALE | C864: DONATI | F864: ROBBINS | I864: S CLARK | L864: COURTNEY | O864: SHEARER | R864: PASSADORE
A865: PRESTON | C865: BROWN | F865: TAYLOR | I865: HALLINAN | L865: CLARKE | O865: GIBSON
A866: GOALKICKERS
A867: SPRINGVALE | C867: DONATI 5 | F867: SMITH 3 | H867: J CARROLL | K867: SHAW | M867: LITTLE | O867: CANN | Q867: S CLARK | T867: ROBBINS | W867: C CLARKE
A868: PRESTON | C868: GIBSON 2 | F868: HABERMAN 2 | I868: PASCOE | K868: TAYLOR | M868: GRAINGER | P868: WISEMAN | R868: MANGIN | U868: HALLINAN
A870: FRANKSTON | C870: 4 | D870: 1 | E870: =(C870*6)+D870 -> 25 | G870: 11 | H870: 5 | I870: =(G870*6)+H870 -> 71 | K870: 13 | L870: 11 | M870: =(K870*6)+L870 -> 89 | O870: 17 | P870: 14 | Q870: =(O870*6)+P870 -> 116 | S870: Venue: BOX HILL
A871: BOX HILL | C871: 2 | D871: 5 | E871: =(C871*6)+D871 -> 17 | G871: 2 | H871: 6 | I871: =(G871*6)+H871 -> 18 | K871: 6 | L871: 10 | M871: =(K871*6)+L871 -> 46 | O871: 9 | P871: 14 | Q871: =(O871*6)+P871 -> 68
A872: BEST PLAYERS
A873: FRANKSTON | C873: MALLOY | F873: LOVETT | I873: GEORGIOU | L873: DAFF | N873: BURGMAN | Q873: WEBB
A874: BOX HILL | C874: HABERFIELD | F874: AEILLO | I874: SIMKIN | L874: BAXTER | N874: TRANQUILLI | Q874: JENKINS
A875: GOALKICKERS
A876: FRANKSTON | C876: WEBB 4 | E876: MURRAY 3 | H876: ANDERSON 3 | K876: MILES 2 | M876: GEORGIOU | O876: BURNELL | Q876: MARSHALL | U876: MALLOY | X876: HOLCOMBE
A877: BOX HILL | C877: CROWLEY 2 | F877: JENKINS 2 | I877: SLATER 2 | L877: ALLSOP | N877: HABERFIELD | Q877: WILKINSON
A879: BYE | D879: BENDIGO
A881: ROUND 19 | D881: 14TH AUGUST | J881: WEATHER
D882: 1ST QTR | H882: 2ND QTR | L882: 3RD QTR | P882: FINAL | S882: Venue: WERRIBEE
A883: WERRIBEE | C883: 4 | D883: 1 | E883: =(C883*6)+D883 -> 25 | G883: 7 | H883: 2 | I883: =(G883*6)+H883 -> 44 | K883: 9 | L883: 6 | M883: =(K883*6)+L883 -> 60 | O883: 15 | P883: 11 | Q883: =(O883*6)+P883 -> 101 | S883: UMPIRES | Z883: LADDER | AC883: ROUND | AE883: 19
A884: PORT MELBOURNE | C884: 2 | D884: 3 | E884: =(C884*6)+D884 -> 15 | G884: 4 | H884: 4 | I884: =(G884*6)+H884 -> 28 | K884: 8 | L884: 5 | M884: =(K884*6)+L884 -> 53 | O884: 11 | P884: 6 | Q884: =(O884*6)+P884 -> 72 | S884: MALCOLM
A885: BEST PLAYERS | W885: TEAM | X885: B | Y885: W | Z885: L | AA885: D | AB885: FOR | AC885: AGST | AD885: % | AE885: PTS
A886: WERRIBEE | C886: SAUNDERS | F886: S SMITH | I886: TAYLOR | L886: SPROULE | N886: FAULKNER | Q886: PULI
A887: PORT MELBOURNE | C887: MARTIN | F887: SEXTON | I887: CREDLIN | L887: PICIAONE | N887: HOLLOW | Q887: SCHAEFER | W887: SPRINGVALE | X887: 2 | Y887: 14 | Z887: 3 | AA887: 0 | AB887: 1792 | AC887: 1257 | AD887: =(AB887/AC887)*100 -> 142.56165473349245 | AE887: =(Y887*4)+(AA887*2) -> 56
A888: GOALKICKERS | Q888: FORD | W888: FRANKSTON | X888: 2 | Y888: 13 | Z888: 4 | AA888: 0 | AB888: 1736 | AC888: 1225 | AD888: =(AB888/AC888)*100 -> 141.71428571428569 | AE888: =(Y888*4)+(AA888*2) -> 52
A889: WERRIBEE | C889: BUTTON 4 | E889: SAUNDERS 3 | H889: S SMITH 2 | J889: CHURCHILL | M889: SPROULE | O889: PULI | P889: ATKINS | R889: MITCHELL | W889: WERRIBEE | X889: 2 | Y889: 13 | Z889: 4 | AA889: 0 | AB889: 1757 | AC889: 1487 | AD889: =(AB889/AC889)*100 -> 118.15736381977135 | AE889: =(Y889*4)+(AA889*2) -> 52
A890: PORT MELBOURNE | C890: CROCKER 4 | F890: MARTIN 3 | I890: PICIAONE 2 | L890: McCORMACK | O890: SEXTON | W890: SANDRINGHAM | X890: 1 | Y890: 11 | Z890: 6 | AA890: 1 | AB890: 1934 | AC890: 1346 | AD890: =(AB890/AC890)*100 -> 143.68499257057948 | AE890: =(Y890*4)+(AA890*2) -> 46
D891: 15TH AUGUST | J891: WEATHER | S891: Venue: BENDIGO | W891: NORTH BALLARAT | X891: 2 | Y891: 11 | Z891: 6 | AA891: 0 | AB891: 1472 | AC891: 1163 | AD891: =(AB891/AC891)*100 -> 126.56921754084264 | AE891: =(Y891*4)+(AA891*2) -> 44
A892: SANDRINGHAM | C892: 5 | D892: 1 | E892: =(C892*6)+D892 -> 31 | G892: 10 | H892: 4 | I892: =(G892*6)+H892 -> 64 | K892: 13 | L892: 8 | M892: =(K892*6)+L892 -> 86 | O892: 16 | P892: 12 | Q892: =(O892*6)+P892 -> 108 | S892: DAVIDSON | W892: PORT MELBOURNE | X892: 2 | Y892: 11 | Z892: 6 | AA892: 0 | AB892: 1486 | AC892: 1381 | AD892: =(AB892/AC892)*100 -> 107.60318609703114 | AE892: =(Y892*4)+(AA892*2) -> 44
A893: BENDIGO | C893: 3 | D893: 2 | E893: =(C893*6)+D893 -> 20 | G893: 5 | H893: 3 | I893: =(G893*6)+H893 -> 33 | K893: 8 | L893: 5 | M893: =(K893*6)+L893 -> 53 | O893: 11 | P893: 7 | Q893: =(O893*6)+P893 -> 73 | S893: LEARMOUTH
A894: BEST PLAYERS | S894: JEFFREY | W894: WILLIAMSTOWN | X894: 2 | Y894: 7 | Z894: 10 | AA894: 0 | AB894: 1288 | AC894: 1521 | AD894: =(AB894/AC894)*100 -> 84.681130834976997 | AE894: =(Y894*4)+(AA894*2) -> 28
A895: SANDRINGHAM | C895: TREGEAR | F895: SAUTNER | I895: M GRANT | L895: L OAKLEY | N895: B OAKLEY | Q895: FRATER | W895: BOX HILL | X895: 2 | Y895: 5 | Z895: 11 | AA895: 1 | AB895: 1536 | AC895: 1745 | AD895: =(AB895/AC895)*100 -> 88.022922636103146 | AE895: =(Y895*4)+(AA895*2) -> 22
A896: BENDIGO | C896: TOINTON | F896: SHIELS | I896: WHITSED | L896: ANGOVE | N896: CURCIO | Q896: WATERS | W896: COBURG | X896: 2 | Y896: 4 | Z896: 13 | AA896: 0 | AB896: 980 | AC896: 1715 | AD896: =(AB896/AC896)*100 -> 57.142857142857139 | AE896: =(Y896*4)+(AA896*2) -> 16
A897: GOALKICKERS | W897: PRESTON | X897: 2 | Y897: 1 | Z897: 14 | AA897: 2 | AB897: 1267 | AC897: 1731 | AD897: =(AB897/AC897)*100 -> 73.194685153090703 | AE897: =(Y897*4)+(AA897*2) -> 8
A898: SANDRINGHAM | C898: SAUTNER 8 | E898: B OAKLEY 2 | H898: LIDDELL 2 | J898: TEMPLETON | M898: FRATER | O898: SCOTT-BRANAGAN | S898: L OAKLEY | W898: BENDIGO | X898: 2 | Y898: 2 | Z898: 15 | AA898: 0 | AB898: 1189 | AC898: 1823 | AD898: =(AB898/AC898)*100 -> 65.222161272627531 | AE898: =(Y898*4)+(AA898*2) -> 8
A899: BENDIGO | C899: SHIELS 2 | E899: BOWER | G899: CURCIO | I899: DE ANGELIS | L899: ELSUM | N899: LANCASTER | Q899: O'SHANNESSEY
N900: SHARKEY | P900: WATERS | R900: WHITSED
A901: FRANKSTON | C901: 2 | D901: 3 | E901: =(C901*6)+D901 -> 15 | G901: 6 | H901: 6 | I901: =(G901*6)+H901 -> 42 | K901: 8 | L901: 7 | M901: =(K901*6)+L901 -> 55 | O901: 11 | P901: 9 | Q901: =(O901*6)+P901 -> 75 | S901: Venue: FRANKSTON
A902: PRESTON | C902: 2 | D902: 2 | E902: =(C902*6)+D902 -> 14 | G902: 5 | H902: 2 | I902: =(G902*6)+H902 -> 32 | K902: 9 | L902: 4 | M902: =(K902*6)+L902 -> 58 | O902: 11 | P902: 7 | Q902: =(O902*6)+P902 -> 73 | S902: HEAD :ACKLAND :MEREDITH
A903: BEST PLAYERS
A904: FRANKSTON | C904: BURGMANN | F904: CORRIGAN | I904: DUFF | L904: HOPGOOD | N904: AGNELLO | Q904: LOVETT
A905: PRESTON | C905: HABERMAN | F905: PASCOE | I905: McDONOUGH | L905: TAYLOR | N905: GIBSON
A906: GOALKICKERS
A907: FRANKSTON | C907: MILLANE 3 | F907: ANDERSON 3 | I907: MILES 2 | K907: CLARKE | M907: HOPGOOD | P907: MALLOY
A908: PRESTON | C908: CLARKE 2 | F908: KOFOED 2 | H908: HALLIANAN | K908: MANN | M908: CARACELLA | P908: GIBSON | R908: McINTOSH | V908: MANGAN
A910: WILLIAMSTOWN | C910: 3 | D910: 1 | E910: =(C910*6)+D910 -> 19 | G910: 7 | H910: 5 | I910: =(G910*6)+H910 -> 47 | K910: 8 | L910: 7 | M910: =(K910*6)+L910 -> 55 | O910: 15 | P910: 8 | Q910: =(O910*6)+P910 -> 98 | S910: Venue: WILLIAMSTOWN
A911: BOX HILL | C911: 4 | D911: 5 | E911: =(C911*6)+D911 -> 29 | G911: 6 | H911: 7 | I911: =(G911*6)+H911 -> 43 | K911: 10 | L911: 12 | M911: =(K911*6)+L911 -> 72 | O911: 10 | P911: 16 | Q911: =(O911*6)+P911 -> 76 | S911: NICHOLLS :FORBES :QUIGLEY
A912: BEST PLAYERS
A913: WILLIAMSTOWN | C913: EAMES | F913: GRIFFIN | I913: BROWN | L913: STANLEY | N913: SIR | Q913: HORE
A914: BOX HILL | C914: JENKINS | F914: PARTHENIDES | I914: HOLLAND | L914: AIELLO | N914: SIKOLA | Q914: DISNEY
A915: GOALKICKERS
A916: WILLIAMSTOWN | C916: REYNOLDS 4 | F916: DELRE 3 | H916: WEST 2 | J916: HOLLOW | L916: EAMES | N916: GRIFFITH | P916: GHAZI | R916: HOLLANDS | V916: FOLEY
A917: BOX HILL | C917: SLATER 2 | E917: SIKORA 2 | G917: HABERFIELD | J917: GERGSPAN | M917: HUGGINS | O917: ROWE | Q917: PAWLIK | S917: PARTHENIDES
A919: NORTH BALLARAT | C919: 5 | D919: 5 | E919: =(C919*6)+D919 -> 35 | G919: 7 | H919: 8 | I919: =(G919*6)+H919 -> 50 | K919: 12 | L919: 12 | M919: =(K919*6)+L919 -> 84 | O919: 12 | P919: 14 | Q919: =(O919*6)+P919 -> 86 | S919: Venue: COBURG
A920: COBURG | C920: 1 | D920: 1 | E920: =(C920*6)+D920 -> 7 | G920: 2 | H920: 2 | I920: =(G920*6)+H920 -> 14 | K920: 2 | L920: 3 | M920: =(K920*6)+L920 -> 15 | O920: 5 | P920: 7 | Q920: =(O920*6)+P920 -> 37 | S920: READ :MANN :DYE
A921: BEST PLAYERS
A922: NORTH BALLARAT | C922: FIELD | F922: FRITH | I922: CUTHBERTSON | L922: EDWARDS | O922: CLARKE | Q922: G POLKINGHORNE
A923: COBURG | C923: DE PASQUALE | F923: MANSFIELD | I923: WATSON | L923: GORDON | O923: CONDON | Q923: GILPIN
A924: GOALKICKERS
A925: NORTH BALLARAT | C925: SIER 3 | E925: INKSTER 2 | H925: CLARKE 2 | J925: EDMONDS 2 | M925: MACKAY | O925: KIRZNER | Q925: FRITH
A926: COBURG | C926: GORDON | F926: GLEESON | I926: LITTLE | K926: DE PASQUALE | N926: ALESSIO
A928: BYE | D928: SPRINGVALE
A930: ROUND 20 | D930: 21ST AUGUST | J930: WEATHER
D931: 1ST QTR | H931: 2ND QTR | L931: 3RD QTR | P931: FINAL | S931: Venue: NORTH BALLARAT
A932: NORTH BALLARAT | C932: 5 | D932: 1 | E932: =(C932*6)+D932 -> 31 | G932: 6 | H932: 2 | I932: =(G932*6)+H932 -> 38 | K932: 11 | L932: 5 | M932: =(K932*6)+L932 -> 71 | O932: 12 | P932: 9 | Q932: =(O932*6)+P932 -> 81 | S932: UMPIRES | Z932: LADDER | AC932: ROUND | AE932: 20
A933: WERRIBEE | C933: 2 | D933: 2 | E933: =(C933*6)+D933 -> 14 | G933: 6 | H933: 1 | I933: =(G933*6)+H933 -> 37 | K933: 10 | L933: 8 | M933: =(K933*6)+L933 -> 68 | O933: 10 | P933: 13 | Q933: =(O933*6)+P933 -> 73
A934: BEST PLAYERS | W934: TEAM | X934: B | Y934: W | Z934: L | AA934: D | AB934: FOR | AC934: AGST | AD934: % | AE934: PTS
A935: NORTH BALLARAT | C935: CUTHBERTSON | F935: FIELD | I935: SNIBSON | L935: EDWARDS | O935: MURRIHY
A936: WERRIBEE | C936: FAULKNER | F936: SUTTON | I936: SAUNDERS | L936: CAMILLIERI | O936: PULI | Q936: CHURCHILL | W936: SPRINGVALE | X936: 2 | Y936: 15 | Z936: 3 | AA936: 0 | AB936: 1903 | AC936: 1298 | AD936: =(AB936/AC936)*100 -> 146.61016949152543 | AE936: =(Y936*4)+(AA936*2) -> 60
A937: GOALKICKERS | P937: EDMONDS | W937: FRANKSTON | X937: 2 | Y937: 13 | Z937: 5 | AA937: 0 | AB937: 1777 | AC937: 1336 | AD937: =(AB937/AC937)*100 -> 133.00898203592814 | AE937: =(Y937*4)+(AA937*2) -> 52
A938: NORTH BALLARAT | C938: CUTHBERTSON 3 | F938: McKAY 2 | H938: KIRZNER 2 | J938: RUYG | L938: INKSTER | N938: FIELD | P938: T POLKINGHORNE | W938: WERRIBEE | X938: 2 | Y938: 13 | Z938: 5 | AA938: 0 | AB938: 1830 | AC938: 1568 | AD938: =(AB938/AC938)*100 -> 116.70918367346938 | AE938: =(Y938*4)+(AA938*2) -> 52
A939: WERRIBEE | C939: CAMILLIERI 2 | F939: BUTTON 2 | I939: ATKINS | K939: MITCHELL | M939: DYER | O939: FORD | Q939: FAULKNER | W939: NORTH BALLARAT | X939: 2 | Y939: 12 | Z939: 6 | AA939: 0 | AB939: 1553 | AC939: 1236 | AD939: =(AB939/AC939)*100 -> 125.64724919093851 | AE939: =(Y939*4)+(AA939*2) -> 48
N940: SPROULE | W940: PORT MELBOURNE | X940: 2 | Y940: 12 | Z940: 6 | AA940: 0 | AB940: 1662 | AC940: 1431 | AD940: =(AB940/AC940)*100 -> 116.14255765199162 | AE940: =(Y940*4)+(AA940*2) -> 48
A941: BOX HILL | C941: 2 | D941: 5 | E941: =(C941*6)+D941 -> 17 | G941: 4 | H941: 8 | I941: =(G941*6)+H941 -> 32 | K941: 9 | L941: 9 | M941: =(K941*6)+L941 -> 63 | O941: 14 | P941: 16 | Q941: =(O941*6)+P941 -> 100 | S941: Venue: BOX HILL | W941: SANDRINGHAM | X941: 2 | Y941: 11 | Z941: 6 | AA941: 1 | AB941: 1934 | AC941: 1346 | AD941: =(AB941/AC941)*100 -> 143.68499257057948 | AE941: =(Y941*4)+(AA941*2) -> 46
A942: COBURG | C942: 1 | D942: 4 | E942: =(C942*6)+D942 -> 10 | G942: 6 | H942: 5 | I942: =(G942*6)+H942 -> 41 | K942: 9 | L942: 7 | M942: =(K942*6)+L942 -> 61 | O942: 12 | P942: 10 | Q942: =(O942*6)+P942 -> 82
A943: BEST PLAYERS | W943: WILLIAMSTOWN | X943: 2 | Y943: 8 | Z943: 10 | AA943: 0 | AB943: 1421 | AC943: 1604 | AD943: =(AB943/AC943)*100 -> 88.591022443890282 | AE943: =(Y943*4)+(AA943*2) -> 32
A944: BOX HILL | C944: PARTHENIDES | F944: CROWLEY | I944: BAXTER | L944: ROBINSON | O944: SIKORA | R944: JENKINS | W944: BOX HILL | X944: 2 | Y944: 6 | Z944: 11 | AA944: 1 | AB944: 1636 | AC944: 1827 | AD944: =(AB944/AC944)*100 -> 89.545703338806788 | AE944: =(Y944*4)+(AA944*2) -> 26
A945: COBURG | C945: BICER | F945: CANNING | I945: McLEOD | L945: WATSON | O945: RYAN | R945: CONDON | W945: COBURG | X945: 2 | Y945: 4 | Z945: 14 | AA945: 0 | AB945: 1062 | AC945: 1815 | AD945: =(AB945/AC945)*100 -> 58.512396694214871 | AE945: =(Y945*4)+(AA945*2) -> 16
A946: GOALKICKERS | P946: SIMKIN | W946: PRESTON | X946: 2 | Y946: 1 | Z946: 15 | AA946: 2 | AB946: 1350 | AC946: 1864 | AD946: =(AB946/AC946)*100 -> 72.424892703862668 | AE946: =(Y946*4)+(AA946*2) -> 8
A947: BOX HILL | C947: JENKINS 5 | F947: PARTHENIDES 2 | I947: SIKORA 2 | L947: DOOLEY 2 | O947: HOLLAND | Q947: ROBINSON | W947: BENDIGO | X947: 2 | Y947: 2 | Z947: 16 | AA947: 0 | AB947: 1239 | AC947: 1999 | AD947: =(AB947/AC947)*100 -> 61.980990495247624 | AE947: =(Y947*4)+(AA947*2) -> 8
A948: COBURG | C948: RYAN 4 | F948: BICER 2 | I948: LITTLE 2 | L948: CANNING 2 | O948: McLEOD | Q948: MORRISON
A950: WILLIAMSTOWN | C950: 5 | D950: 2 | E950: =(C950*6)+D950 -> 32 | G950: 12 | H950: 3 | I950: =(G950*6)+H950 -> 75 | K950: 17 | L950: 5 | M950: =(K950*6)+L950 -> 107 | O950: 21 | P950: 7 | Q950: =(O950*6)+P950 -> 133 | S950: Venue: PRESTON
A951: PRESTON | C951: 2 | D951: 2 | E951: =(C951*6)+D951 -> 14 | G951: 4 | H951: 4 | I951: =(G951*6)+H951 -> 28 | K951: 6 | L951: 6 | M951: =(K951*6)+L951 -> 42 | O951: 12 | P951: 11 | Q951: =(O951*6)+P951 -> 83
A952: BEST PLAYERS
A953: WILLIAMSTOWN | C953: DELRE | F953: STANLEY | I953: ROUND | L953: SIR | N953: WEST | Q953: GHAZI
A954: PRESTON | C954: HABERMAN | F954: TAYLOR | I954: PASCOE | L954: GRAINGER | N954: McINTOSH | Q954: HALLINAN
A955: GOALKICKERS
A956: WILLIAMSTOWN | C956: DELRE 3 | E956: HOLLOW 2 | G956: ROUND 2 | I956: REYNOLDS 2 | L956: KENNEDY 2 | O956: MOUNTJOY 2 | R956: HOLLAND 2 | U956: EAMES 2 | X956: SHANKS | AA956: STANLEY | AC956: GHAZI | AD956: WEST
A957: PRESTON | C957: McINTOSH 4 | F957: MANGIN 2 | I957: MANN | K957: McDONOUGH | N957: HALLINAN | P957: CLARKE | R957: CARACELLA | V957: SCANLON
A959: PORT MELBOURNE | C959: 4 | D959: 2 | E959: =(C959*6)+D959 -> 26 | G959: 12 | H959: 6 | I959: =(G959*6)+H959 -> 78 | K959: 18 | L959: 10 | M959: =(K959*6)+L959 -> 118 | O959: 27 | P959: 14 | Q959: =(O959*6)+P959 -> 176 | S959: Venue: PORT MELBOURNE
A960: BENDIGO | C960: 3 | D960: 3 | E960: =(C960*6)+D960 -> 21 | G960: 4 | H960: 3 | I960: =(G960*6)+H960 -> 27 | K960: 5 | L960: 4 | M960: =(K960*6)+L960 -> 34 | O960: 7 | P960: 8 | Q960: =(O960*6)+P960 -> 50
A961: BEST PLAYERS
A962: PORT MELBOURNE | C962: McCORMICK | F962: FOLINO | I962: GOODALE | L962: CLOHESY | N962: PICIAONE | Q962: SCHAEFER
A963: BENDIGO | C963: O'CALLAGHAN | F963: TOINTON | I963: WHITSED | L963: SCHMIDT | N963: LANCASTER
A964: GOALKICKERS
A965: PORT MELBOURNE | C965: MADDEN 6 | F965: CROCKER 6 | I965: McCORMICK 3 | L965: PICIAONE 3 | N965: SCHAEFER 2 | Q965: BAKOULIS 2 | T965: DOBELL | V965: CAMERON | X965: CLOHESY | AA965: McMANUS | AC965: FOLINO
A966: BENDIGO | C966: ANGOVE | E966: BOWER | G966: FLEMING | I966: PASCOE | K966: SHIELLS | M966: TOINTON | O966: WHITSED
D967: 22ND AUGUST | J967: WEATHER
A968: SPRINGVALE | C968: 5 | D968: 4 | E968: =(C968*6)+D968 -> 34 | G968: 8 | H968: 12 | I968: =(G968*6)+H968 -> 60 | K968: 12 | L968: 19 | M968: =(K968*6)+L968 -> 91 | O968: 15 | P968: 21 | Q968: =(O968*6)+P968 -> 111 | S968: Venue: PAKENHAM
A969: FRANKSTON | C969: 1 | D969: 1 | E969: =(C969*6)+D969 -> 7 | G969: 2 | H969: 3 | I969: =(G969*6)+H969 -> 15 | K969: 3 | L969: 5 | M969: =(K969*6)+L969 -> 23 | O969: 5 | P969: 11 | Q969: =(O969*6)+P969 -> 41
A970: BEST PLAYERS
A971: SPRINGVALE | C971: SHEAHAN | F971: LITTLE | I971: CAPLES | L971: COURTNEY | O971: PASSADOR | R971: KNIGHT
A972: FRANKSTON | C972: BURGMAN | F972: BURNELL | I972: BUTLER | L972: AGNELLO | O972: DAFF
A973: GOALKICKERS
A974: SPRINGVALE | C974: PASSADOR 4 | F974: KNIGHT 3 | I974: CANN | K974: COURTNEY | N974: DELARUE | P974: LOGAN | R974: O'DONNELL | V974: ROBBINS | X974: S SMITH | AA974: SHEAHAN
A975: FRANKSTON | C975: HOSE | E975: CLARKE | G975: MILES | I975: LOVETT | K975: WEBB
A977: BYE | D977: SANDRINGHAM
A979: FINALS
A980: ELIMINATION FINAL | F980: 29TH AUGUST | J980: WEATHER
D981: 1ST QTR | H981: 2ND QTR | L981: 3RD QTR | P981: FINAL | S981: Venue: PORT MELBOURNE
A982: SANDRINGHAM | C982: 2 | D982: 0 | E982: =(C982*6)+D982 -> 12 | G982: 6 | H982: 3 | I982: =(G982*6)+H982 -> 39 | K982: 7 | L982: 8 | M982: =(K982*6)+L982 -> 50 | O982: 11 | P982: 12 | Q982: =(O982*6)+P982 -> 78 | S982: UMPIRES
A983: WERRIBEE | C983: 4 | D983: 1 | E983: =(C983*6)+D983 -> 25 | G983: 6 | H983: 3 | I983: =(G983*6)+H983 -> 39 | K983: 6 | L983: 4 | M983: =(K983*6)+L983 -> 40 | O983: 9 | P983: 5 | Q983: =(O983*6)+P983 -> 59
A984: BEST PLAYERS
A985: SANDRINGHAM | D985: McKELLAR | G985: LIDDELL | J985: CARROLL | M985: HAYWARD | P985: MAGNUSSEN | S985: SCOTT-BRANAGAN
A986: WERRIBEE | D986: FAULKNER | G986: WHITNELL | J986: ROGERS | M986: SAUNDERS | P986: CHURCHILL | S986: BUTTON
A987: GOALKICKERS
A988: SANDRINGHAM | D988: SAUTNER 2 | G988: TEMPLETON 2 | J988: MALONEY 2 | M988: GEHLING | O988: MAGNUSSEN | R988: OAKLEY | U988: MITCHELSON | X988: SCOTT-BRANAGAN
A989: WERRIBEE | D989: MITCHELL 4 | G989: CHURCHILL 2 | K989: FORD | M989: SMITH | O989: FAULKNER
A991: ELIMINATION FINAL
D992: 1ST QTR | H992: 2ND QTR | L992: 3RD QTR | P992: FINAL | S992: Venue: NORTH BALLARAT
A993: NORTH BALLARAT | C993: 5 | D993: 2 | E993: =(C993*6)+D993 -> 32 | G993: 8 | H993: 4 | I993: =(G993*6)+H993 -> 52 | K993: 10 | L993: 7 | M993: =(K993*6)+L993 -> 67 | O993: 13 | P993: 10 | Q993: =(O993*6)+P993 -> 88 | S993: UMPIRES
A994: PORT MELBOURNE | C994: 1 | D994: 3 | E994: =(C994*6)+D994 -> 9 | G994: 6 | H994: 6 | I994: =(G994*6)+H994 -> 42 | K994: 8 | L994: 9 | M994: =(K994*6)+L994 -> 57 | O994: 10 | P994: 12 | Q994: =(O994*6)+P994 -> 72
A995: BEST PLAYERS
A996: NORTH BALLARAT | D996: J POLKINGHORNE | H996: McCULLOCH | K996: RUYG | M996: G POLKINGHORNE | Q996: EDWARDS | S996: MURRIHY
A997: PORT MELBOURNE | D997: HOLLOW | G997: GOODALE | J997: SEXTON | M997: FOLINO | P997: SHARP | S997: JESS
A998: GOALKICKERS
A999: NORTH BALLARAT | D999: EDMONDS 2 | G999: PEAKE 2 | I999: INKSTER 2 | K999: EDWARDS 2 | N999: CUTHBERTSON | Q999: SNIBSON | S999: MACKAY | V999: KIRZNER | X999: G POLKINGHORNE
A1000: PORT MELBOURNE
A1002: QUALIFYING FINAL | F1002: 28TH AUGUST | J1002: WEATHER
A1003: SPRINGVALE | C1003: 0 | D1003: 6 | E1003: =(C1003*6)+D1003 -> 6 | G1003: 4 | H1003: 10 | I1003: =(G1003*6)+H1003 -> 34 | K1003: 11 | L1003: 15 | M1003: =(K1003*6)+L1003 -> 81 | O1003: 15 | P1003: 19 | Q1003: =(O1003*6)+P1003 -> 109 | S1003: Venue: PORT MELBOURNE
A1004: FRANKSTON | C1004: 2 | D1004: 0 | E1004: =(C1004*6)+D1004 -> 12 | G1004: 5 | H1004: 6 | I1004: =(G1004*6)+H1004 -> 36 | K1004: 6 | L1004: 7 | M1004: =(K1004*6)+L1004 -> 43 | O1004: 6 | P1004: 9 | Q1004: =(O1004*6)+P1004 -> 45
A1005: BEST PLAYERS
A1006: SPRINGVALE | D1006: O'BRIEN | G1006: J CARROLL | J1006: SHEAHAN | M1006: D CARROLL | P1006: COURTNEY | S1006: O'DONNELL
A1007: FRANKSTON | D1007: STRINGER | G1007: DAFF | J1007: HOPGOOD | M1007: VOLKES | P1007: BURGMAN | S1007: BUTLER
A1008: GOALKICKERS
A1009: SPRINGVALE | D1009: DONATI 3 | G1009: O'BRIEN 3 | J1009: SMITH 3 | L1009: CARROLL 2 | O1009: COURTNEY 2 | R1009: CAPLES | V1009: ROBBINS
A1010: FRANKSTON | D1010: WEBB 2 | G1010: WILLIAMS 2 | J1010: SULLIVAN | M1010: HOPGOOD
A1012: 1ST SEMI FINAL | E1012: 5TH SEPTEMBER
A1013: SANDRINGHAM | C1013: 7 | D1013: 2 | E1013: =(C1013*6)+D1013 -> 44 | G1013: 11 | H1013: 5 | I1013: =(G1013*6)+H1013 -> 71 | K1013: 18 | L1013: 8 | M1013: =(K1013*6)+L1013 -> 116 | O1013: 19 | P1013: 10 | Q1013: =(O1013*6)+P1013 -> 124 | S1013: Venue: PORT MELBOURNE
A1014: FRANKSTON | C1014: 2 | D1014: 2 | E1014: =(C1014*6)+D1014 -> 14 | G1014: 8 | H1014: 5 | I1014: =(G1014*6)+H1014 -> 53 | K1014: 8 | L1014: 6 | M1014: =(K1014*6)+L1014 -> 54 | O1014: 15 | P1014: 8 | Q1014: =(O1014*6)+P1014 -> 98
A1015: BEST PLAYERS
A1016: SANDRINGHAM | D1016: HAYNES | G1016: FRATER | J1016: SCOTT-BRANAGAN | N1016: TEMPLETON | Q1016: CARROLL | S1016: COGHLAN
A1017: FRANKSTON | D1017: CORRIGAN | G1017: WILLIAMS | J1017: BURGMAN | N1017: DAFF | Q1017: LOVETT
A1018: GOALKICKERS
A1019: SANDRINGHAM | D1019: SCOTT-BRANAGAN 5 | H1019: TEMPLETON 4 | K1019: SAUTNER 2 | N1019: QUINN 2 | P1019: HAYNES 2 | R1019: MITCHELSON | W1019: MACGEORGE | X1019: D GRANT | AA1019: GOLD
A1020: FRANKSTON | D1020: WILLIAMS 5 | G1020: LOVETT 3 | I1020: McCORMACK 2 | L1020: STRINGER | N1020: WEBB | P1020: HOSE | R1020: DAFF | U1020: MURRAY
A1022: 2ND SEMI FINAL | E1022: 4TH SEPTEMBER
A1023: SPRINGVALE | C1023: 7 | D1023: 1 | E1023: =(C1023*6)+D1023 -> 43 | G1023: 8 | H1023: 6 | I1023: =(G1023*6)+H1023 -> 54 | K1023: 10 | L1023: 8 | M1023: =(K1023*6)+L1023 -> 68 | O1023: 12 | P1023: 8 | Q1023: =(O1023*6)+P1023 -> 80 | S1023: Venue: PORT MELBOURNE
A1024: NORTH BALLARAT | C1024: 0 | D1024: 4 | E1024: =(C1024*6)+D1024 -> 4 | G1024: 0 | H1024: 7 | I1024: =(G1024*6)+H1024 -> 7 | K1024: 3 | L1024: 13 | M1024: =(K1024*6)+L1024 -> 31 | O1024: 6 | P1024: 14 | Q1024: =(O1024*6)+P1024 -> 50
A1025: BEST PLAYERS
A1026: SPRINGVALE | D1026: LITTLE | G1026: COURTNEY | J1026: D CARROLL | M1026: ROBBINS | P1026: SMITH | R1026: CAPLES
A1027: NORTH BALLARAT | D1027: RUYG | G1027: HANCOCK | J1027: FIELD | M1027: J POLKINGHORNE | Q1027: INKSTER
A1028: GOALKICKERS
A1029: SPRINGVALE | D1029: SMITH 4 | G1029: D CARROLL 2 | K1029: PASSADOR 2 | N1029: J CARROLL | Q1029: KNIGHT | S1029: LITTLE | W1029: O'BRIEN
A1030: NORTH BALLARAT | D1030: INKSTER 3 | G1030: FIELD | I1030: McCULLOCH | L1030: FRITH
A1032: PRELIMINARY FINAL | G1032: 12TH SEPTEMBER
A1033: NORTH BALLARAT | C1033: 6 | D1033: 1 | E1033: =(C1033*6)+D1033 -> 37 | G1033: 10 | H1033: 3 | I1033: =(G1033*6)+H1033 -> 63 | K1033: 15 | L1033: 12 | M1033: =(K1033*6)+L1033 -> 102 | O1033: 22 | P1033: 14 | Q1033: =(O1033*6)+P1033 -> 146 | S1033: Venue: PORT MELBOURNE
A1034: SANDRINGHAM | C1034: 2 | D1034: 3 | E1034: =(C1034*6)+D1034 -> 15 | G1034: 5 | H1034: 4 | I1034: =(G1034*6)+H1034 -> 34 | K1034: 6 | L1034: 5 | M1034: =(K1034*6)+L1034 -> 41 | O1034: 10 | P1034: 6 | Q1034: =(O1034*6)+P1034 -> 66 | S1034: JEFFREY :MALCOLM :ACKLAND
A1035: BEST PLAYERS
A1036: NORTH BALLARAT | D1036: HANCOCK | G1036: PEAKE | J1036: FRITH | M1036: RUYG | O1036: G POLKINGHORNE | S1036: J POLKINGHORNE
A1037: SANDRINGHAM | D1037: B OAKLEY | G1037: LIDDELL | J1037: SAUTNER
A1038: GOALKICKERS | W1038: EDMONDS
A1039: NORTH BALLARAT | D1039: INKSTER 4 | G1039: PEAKE 3 | I1039: FRITH 3 | K1039: FISHER 2 | M1039: CLARKE 2 | O1039: FIELD | Q1039: EDWARDS | T1039: RUYG | V1039: McCULLOCH | X1039: SIER | Z1039: MURRIHY | AC1039: SMART
A1040: SANDRINGHAM | D1040: SAUTNER 3 | G1040: L OAKLEY 3 | J1040: B OAKLEY | M1040: HAYNES | O1040: QUINN | Q1040: TEMPLETON
A1042: GRAND FINAL | E1042: 21ST SEPTEMBER
A1043: SPRINGVALE | C1043: 3 | D1043: 0 | E1043: =(C1043*6)+D1043 -> 18 | G1043: 9 | H1043: 3 | I1043: =(G1043*6)+H1043 -> 57 | K1043: 13 | L1043: 7 | M1043: =(K1043*6)+L1043 -> 85 | O1043: 19 | P1043: 11 | Q1043: =(O1043*6)+P1043 -> 125 | S1043: Venue: PRINCES PARK (Carlton)
A1044: NORTH BALLARAT | C1044: 3 | D1044: 4 | E1044: =(C1044*6)+D1044 -> 22 | G1044: 3 | H1044: 7 | I1044: =(G1044*6)+H1044 -> 25 | K1044: 5 | L1044: 10 | M1044: =(K1044*6)+L1044 -> 40 | O1044: 9 | P1044: 11 | Q1044: =(O1044*6)+P1044 -> 65
A1045: BEST PLAYERS
A1046: SPRINGVALE | D1046: DONATI | G1046: O'BRIEN | J1046: ROBBINS | M1046: SUTHERLAND | P1046: O'DONNELL | S1046: CAPLES
A1047: NORTH BALLARAT | D1047: SNIBSON | G1047: FIELD | J1047: RUYG | M1047: T POLKINGHORNE | Q1047: J POLKINGHORNE
A1048: GOALKICKERS
A1049: SPRINGVALE | D1049: SMITH 5 | F1049: O'BRIEN 4 | I1049: FORD 3 | K1049: SHEAHAN 2 | N1049: C CLARKE | Q1049: DELARUE | T1049: KNIGHT | W1049: O'DONNELL | Y1049: PASSADOR
A1050: NORTH BALLARAT | D1050: SIER 2 | G1050: JURICA | I1050: FISHER | K1050: FRITH | M1050: CLARKE | O1050: SMART | Q1050: G POLKINGHORNE | V1050: EDWARDS
A1052: INTERSTATE MATCH | F1052: 6TH JUNE | J1052: WEATHER
A1053: S.A.N.F.L. | C1053: 0 | D1053: 3 | E1053: =(C1053*6)+D1053 -> 3 | G1053: 4 | H1053: 5 | I1053: =(G1053*6)+H1053 -> 29 | K1053: 7 | L1053: 10 | M1053: =(K1053*6)+L1053 -> 52 | O1053: 12 | P1053: 11 | Q1053: =(O1053*6)+P1053 -> 83 | S1053: Venue: M.C.G.
A1054: V.F.L. | C1054: 1 | D1054: 4 | E1054: 10 | G1054: 4 | H1054: 4 | I1054: =(G1054*6)+H1054 -> 28 | K1054: 4 | L1054: 7 | M1054: =(K1054*6)+L1054 -> 31 | O1054: 8 | P1054: 11 | Q1054: =(O1054*6)+P1054 -> 59 | S1054: NICHOLLS ;TWITT :WOODCOCK
A1055: BEST PLAYERS
A1056: S.A.N.F.L. | D1056: HARVEY | G1056: BIGLANDS | J1056: KELLY | M1056: CARTER | P1056: COLVILLE | S1056: HELE
A1057: V.F.L. | D1057: LINDSAY | G1057: WEST | J1057: CARROLL | M1057: GEORGIOU | P1057: REYNOLDS | S1057: SNIBSON
A1058: GOALKICKERS
A1059: S.A.N.F.L. | D1059: PAVLICH 3 | G1059: DIREEN 2 | I1059: BROWN 2 | K1059: HARVEY 2 | M1059: NEILL | O1059: MILLS | Q1059: COLVILLE
A1060: V.F.L. | D1060: GEORGIOU 2 | G1060: CLARKE | I1060: GIBSON | K1060: TRANQUILLI | N1060: BREWER | P1060: TAYLOR | R1060: REYNOLDS
A1062: GRAND FINAL TEAMS
E1063: SPRINGVALE | O1063: NORTH BALLARAT
A1064: B. | C1064: COURTNEY | F1064: LITTLE | I1064: SUTHERLAND | M1064: SNIBSON | Q1064: MOLONEY | W1064: MURRIHY
A1065: H.B. | C1065: TAYLOR | F1065: CAPLES | I1065: SHEAHAN | M1065: FISHER | Q1065: CUTHBERTSON | W1065: RUYG
A1066: C. | C1066: DONATI | F1066: ROBBINS | I1066: O'DONNELL | M1066: G POLKINGHORNE | Q1066: J POLKINGHORNE | W1066: EDWARDS
A1067: H.F. | C1067: D CARROLL | F1067: FORD | I1067: J CARROLL | M1067: PEAKE | Q1067: JURICA | W1067: FRITH
A1068: F. | C1068: KNIGHT | F1068: SMITH | I1068: PASSADORE | M1068: CLARKE | Q1068: SMART | W1068: SIER
A1069: R. | C1069: CLARK | F1069: DELARUE | I1069: O'BRIEN | M1069: HANCOCK | Q1069: T POLKINGHORNE | W1069: FIELD
A1070: INT. | C1070: C CLARKE | F1070: BARDSLEY | I1070: JOY | M1070: McCULLOCH | Q1070: EDMONDS | W1070: MACKAY