A1: Victorian Football League
A2: Season 2000
A3: © Copyright Wal Williams | F3: First created: 4 September 2016
A4: Contact: joywalwi at gmail dot com | F4: Last updated: 13 October 2016 | W4: VFA Results and tables - Link to the main index page
A5: You are free to copy this document in whole or part provided that proper acknowledgement is given to the author. All rights reserved.
A7: 2000 SEASON
A8: ROUND 1 | D8: 16TH MARCH | J8: WEATHER
D9: 1ST QTR | H9: 2ND QTR | L9: 3RD QTR | P9: FINAL | S9: Venue: M.C.G. (Curtain Raiser)
A10: ESSENDON | C10: 5 | D10: 0 | E10: =(C10*6)+D10 -> 30 | G10: 10 | H10: 4 | I10: =(G10*6)+H10 -> 64 | K10: 16 | L10: 7 | M10: =(K10*6)+L10 -> 103 | O10: 24 | P10: 8 | Q10: =(O10*6)+P10 -> 152 | S10: UMPIRES | Y10: LADDER | AB10: ROUND | AD10: 1
A11: RICHMOND | C11: 4 | D11: 2 | E11: =(C11*6)+D11 -> 26 | G11: 7 | H11: 2 | I11: =(G11*6)+H11 -> 44 | K11: 9 | L11: 5 | M11: =(K11*6)+L11 -> 59 | O11: 12 | P11: 9 | Q11: =(O11*6)+P11 -> 81
A12: BEST PLAYERS | W12: TEAM | X12: W | Y12: L | Z12: D | AA12: FOR | AB12: AGST | AC12: % | AD12: PTS
A13: ESSENDON | C13: McGRATH | F13: FRASER | I13: EASTAUGH | L13: LUCAS | O13: JACOBS | R13: SHEPPARD
A14: RICHMOND | C14: HAYNES | F14: TAYLOR | I14: MILLS | L14: HALL | O14: POYAS | R14: EDWARDS | W14: FRANKSTON | X14: 1 | Y14: 0 | Z14: 0 | AA14: 132 | AB14: 67 | AC14: =(AA14/AB14)*100 -> 197.01492537313433 | AD14: =(X14*4)+(Z14*2) -> 4
A15: GOALKICKERS | C15: * | D15: (1 GOAL SHORT) | L15: EASTAUGH | O15: HILLE | Q15: JACOBS | S15: McALISTER | W15: BOX HILL | X15: 1 | Y15: 0 | Z15: 0 | AA15: 114 | AB15: 59 | AC15: =(AA15/AB15)*100 -> 193.22033898305085 | AD15: =(X15*4)+(Z15*2) -> 4
A16: ESSENDON | C16: LUCAS 7 | E16: MOORCROFT 3 | H16: McGRATH 3 | K16: LADHAMS 2 | N16: PODSIADLY 2 | Q16: FRASER | S16: PRIOR | W16: ESSENDON | X16: 1 | Y16: 0 | Z16: 0 | AA16: 152 | AB16: 81 | AC16: =(AA16/AB16)*100 -> 187.6543209876543 | AD16: =(X16*4)+(Z16*2) -> 4
A17: RICHMOND | C17: HAYNES 3 | E17: MILLS 2 | G17: EDWARDS 2 | J17: FIORA | L17: POYAS | N17: GREIG | P17: ZANTUCK | S17: TAYLOR | W17: COLLINGWOOD | X17: 1 | Y17: 0 | Z17: 0 | AA17: 156 | AB17: 102 | AC17: =(AA17/AB17)*100 -> 152.94117647058823 | AD17: =(X17*4)+(Z17*2) -> 4
D18: 18TH MARCH | J18: WEATHER | W18: NORTH BALLARAT | X18: 1 | Y18: 0 | Z18: 0 | AA18: 102 | AB18: 70 | AC18: =(AA18/AB18)*100 -> 145.71428571428569 | AD18: =(X18*4)+(Z18*2) -> 4
A19: COLLINGWOOD | C19: 6 | D19: 3 | E19: =(C19*6)+D19 -> 39 | G19: 15 | H19: 8 | I19: =(G19*6)+H19 -> 98 | K19: 19 | L19: 11 | M19: =(K19*6)+L19 -> 125 | O19: 24 | P19: 12 | Q19: =(O19*6)+P19 -> 156 | S19: Venue: PORT MELBOURNE | W19: SANDRINGHAM | X19: 1 | Y19: 0 | Z19: 0 | AA19: 113 | AB19: 78 | AC19: =(AA19/AB19)*100 -> 144.87179487179486 | AD19: =(X19*4)+(Z19*2) -> 4
A20: PORT MELBOURNE | C20: 2 | D20: 4 | E20: =(C20*6)+D20 -> 16 | G20: 3 | H20: 6 | I20: =(G20*6)+H20 -> 24 | K20: 9 | L20: 10 | M20: =(K20*6)+L20 -> 64 | O20: 15 | P20: 12 | Q20: =(O20*6)+P20 -> 102 | W20: WILLIAMSTOWN | X20: 1 | Y20: 0 | Z20: 0 | AA20: 144 | AB20: 106 | AC20: =(AA20/AB20)*100 -> 135.84905660377359 | AD20: =(X20*4)+(Z20*2) -> 4
A21: BEST PLAYERS | W21: GEELONG | X21: 1 | Y21: 0 | Z21: 0 | AA21: 97 | AB21: 91 | AC21: =(AA21/AB21)*100 -> 106.5934065934066 | AD21: =(X21*4)+(Z21*2) -> 4
A22: COLLINGWOOD | C22: BROWN | F22: SMITH | I22: PATTERSON | L22: SCOTLAND | O22: CROSISCA | R22: McKEE
A23: PORT MELBOURNE | C23: NAISH | F23: LUFF | I23: BOSSONG | L23: GREENHAM | O23: BOMFORD | W23: PRESTON | X23: 1 | Y23: 0 | Z23: 0 | AA23: 115 | AB23: 109 | AC23: =(AA23/AB23)*100 -> 105.50458715596329 | AD23: =(X23*4)+(Z23*2) -> 4
A24: GOALKICKERS | C24: * | D24: (5 GOALS TOO MANY) | I24: CROSISCA | L24: ROACH | N24: SCOTLAND | Q24: SHEEHAN | S24: WATSON | W24: SPRINGVALE | X24: 0 | Y24: 1 | Z24: 0 | AA24: 109 | AB24: 115 | AC24: =(AA24/AB24)*100 -> 94.782608695652172 | AD24: =(X24*4)+(Z24*2) -> 0
A25: COLLINGWOOD | C25: BROWN 6 | E25: BAYNES 3 | G25: SMITH 2 | I25: DAVIS 2 | K25: LANE 2 | M25: SHARPEN 2 | P25: PATTERSON | S25: McKEE | W25: ST KILDA | X25: 0 | Y25: 0 | Z25: 0 | AA25: 91 | AB25: 97 | AC25: =(AA25/AB25)*100 -> 93.814432989690715 | AD25: =(X25*4)+(Z25*2) -> 0
A26: PORT MELBOURNE | C26: LUFF 4 | E26: NAISH 2 | G26: GREENHAM 2 | J26: CADZOW | L26: BOSSONG | N26: LINDSAY | P26: ARNOLD | R26: D'GIACOMA | W26: WERRIBEE | X26: 0 | Y26: 1 | Z26: 0 | AA26: 106 | AB26: 144 | AC26: =(AA26/AB26)*100 -> 73.611111111111114 | AD26: =(X26*4)+(Z26*2) -> 0
O27: SANGSTER | Q27: BOMFORD | W27: MURRAY KANGAROOS | X27: 0 | Y27: 0 | Z27: 0 | AA27: 78 | AB27: 113 | AC27: =(AA27/AB27)*100 -> 69.026548672566364 | AD27: =(X27*4)+(Z27*2) -> 0
A28: GEELONG | C28: 4 | D28: 3 | E28: =(C28*6)+D28 -> 27 | G28: 8 | H28: 5 | I28: =(G28*6)+H28 -> 53 | K28: 11 | L28: 10 | M28: =(K28*6)+L28 -> 76 | O28: 14 | P28: 13 | Q28: =(O28*6)+P28 -> 97 | S28: Venue: SHELL STADIUM (C/R) | W28: COBURG | X28: 0 | Y28: 0 | Z28: 0 | AA28: 70 | AB28: 102 | AC28: =(AA28/AB28)*100 -> 68.627450980392155 | AD28: =(X28*4)+(Z28*2) -> 0
A29: ST KILDA | C29: 3 | D29: 1 | E29: =(C29*6)+D29 -> 19 | G29: 5 | H29: 4 | I29: =(G29*6)+H29 -> 34 | K29: 8 | L29: 9 | M29: =(K29*6)+L29 -> 57 | O29: 13 | P29: 13 | Q29: =(O29*6)+P29 -> 91 | W29: PORT MELBOURNE | X29: 0 | Y29: 1 | Z29: 0 | AA29: 102 | AB29: 156 | AC29: =(AA29/AB29)*100 -> 65.384615384615387 | AD29: =(X29*4)+(Z29*2) -> 0
A30: BEST PLAYERS | W30: RICHMOND | X30: 0 | Y30: 1 | Z30: 0 | AA30: 81 | AB30: 152 | AC30: =(AA30/AB30)*100 -> 53.289473684210535 | AD30: =(X30*4)+(Z30*2) -> 0
A31: GEELONG | C31: STEINFORT | F31: O'BRIEN | I31: LINDSAY | L31: McKAY | O31: RAHILLY | R31: T LYNCH | W31: CARLTON | X31: 0 | Y31: 1 | Z31: 0 | AA31: 59 | AB31: 114 | AC31: =(AA31/AB31)*100 -> 51.754385964912288 | AD31: =(X31*4)+(Z31*2) -> 0
A32: ST KILDA | C32: KNOWLES | F32: HEATLEY | I32: TRAIANIDIS | L32: ELLIOTT | W32: BENDIGO | X32: 0 | Y32: 0 | Z32: 0 | AA32: 67 | AB32: 132 | AC32: =(AA32/AB32)*100 -> 50.757575757575758 | AD32: =(X32*4)+(Z32*2) -> 0
A33: GOALKICKERS
A34: GEELONG | C34: O'BRIEN 5 | F34: CHAPMAN 3 | I34: ARNOTT 2 | L34: T LYNCH 2 | O34: BALDWIN 2
A35: ST KILDA | C35: HEATLEY 4 | F35: KNOWLES 2 | I35: CRANAGE | K35: MOYLE | M35: MILNE | O35: FORTNAM | Q35: SCHWARZE | T35: TRAIANIDIS | X35: ELLIOTT
A37: FRANKSTON | C37: 2 | D37: 6 | E37: =(C37*6)+D37 -> 18 | G37: 6 | H37: 10 | I37: =(G37*6)+H37 -> 46 | K37: 11 | L37: 16 | M37: =(K37*6)+L37 -> 82 | O37: 19 | P37: 18 | Q37: =(O37*6)+P37 -> 132 | S37: Venue: FRANKSTON
A38: BENDIGO | C38: 1 | D38: 3 | E38: =(C38*6)+D38 -> 9 | G38: 5 | H38: 6 | I38: =(G38*6)+H38 -> 36 | K38: 5 | L38: 10 | M38: =(K38*6)+L38 -> 40 | O38: 9 | P38: 13 | Q38: =(O38*6)+P38 -> 67
A39: BEST PLAYERS
A40: FRANKSTON | C40: ROBERTS | F40: HOSE | I40: DAM CLARKE | L40: DAN CLARKE | O40: GEORGIOU | R40: SULLIVAN
A41: BENDIGO | C41: N/A
A42: GOALKICKERS
A43: FRANKSTON | C43: DAM CLARKE 7 | F43: BURNELL 3 | I43: SULLIVAN 2 | L43: WELSH | N43: GEORGIOU | Q43: MURRAY | S43: DAN CLARKE | W43: BURGMAN | X43: MALLOY | AA43: HOSE
A44: BENDIGO | C44: N/A
A46: NORTH BALLARAT | C46: 3 | D46: 5 | E46: =(C46*6)+D46 -> 23 | G46: 7 | H46: 6 | I46: =(G46*6)+H46 -> 48 | K46: 12 | L46: 10 | M46: =(K46*6)+L46 -> 82 | O46: 15 | P46: 12 | Q46: =(O46*6)+P46 -> 102 | S46: Venue: COBURG
A47: COBURG | C47: 1 | D47: 2 | E47: =(C47*6)+D47 -> 8 | G47: 7 | H47: 5 | I47: =(G47*6)+H47 -> 47 | K47: 7 | L47: 5 | M47: =(K47*6)+L47 -> 47 | O47: 10 | P47: 10 | Q47: =(O47*6)+P47 -> 70
A48: BEST PLAYERS
A49: NORTH BALLARAT | C49: J POLKINGHORNE | G49: KENNEDY | J49: POWER | M49: GREIG | O49: SOMERVILLE | R49: FUNCKE
A50: COBURG | C50: DEPASQUALE | G50: McLEOD | J50: LAPPIN | M50: RYAN | O50: McKENZIE-McHARG
A51: GOALKICKERS
A52: NORTH BALLARAT | C52: POWER 5 | F52: REID 3 | H52: BAKER 3 | K52: JURICA 2 | N52: PEAKE | P52: INKSTER
A53: COBURG | C53: CANNING 2 | F53: MORRISON 2 | I53: OPPENLANDER 2 | M53: WATSON | O53: HOGG | Q53: T LITTLE | T53: McKENZIE-McHARG
A55: SANDRINGHAM | C55: 2 | D55: 1 | E55: =(C55*6)+D55 -> 13 | G55: 11 | H55: 6 | I55: =(G55*6)+H55 -> 72 | K55: 14 | L55: 8 | M55: =(K55*6)+L55 -> 92 | O55: 17 | P55: 11 | Q55: =(O55*6)+P55 -> 113 | S55: Venue: BEACH ROAD
A56: MURRAY KANGAROOS | C56: 5 | D56: 2 | E56: =(C56*6)+D56 -> 32 | G56: 6 | H56: 2 | I56: =(G56*6)+H56 -> 38 | K56: 9 | L56: 8 | M56: =(K56*6)+L56 -> 62 | O56: 11 | P56: 12 | Q56: =(O56*6)+P56 -> 78
A57: BEST PLAYERS
A58: SANDRINGHAM | C58: TREGEAR | F58: FRATER | I58: COLLINS | L58: BEAMS | N58: LIDDELL | Q58: KENNEDY
A59: MURRAY KANGAROOS | C59: WATT | F59: COCHRANE | I59: HILTON | L59: MAKEPEACE | O59: VAN DER KLOOSTER | S59: McCORMICK
A60: GOALKICKERS
A61: SANDRINGHAM | C61: SAUTNER 4 | F61: KENNEDY 2 | I61: LAMB 2 | K61: BEAMS 2 | M61: SPEERS | O61: WILLIAMS | Q61: FRATER | S61: LIDDELL | V61: LYNCH | X61: SCOTT-BRANAGAN | AB61: TREGEAR
A62: MURRAY KANGAROOS | C62: KINGSLEY 7 | F62: WATT 2 | I62: DHURKAY | L62: BOVALINO
D63: 19TH MARCH | J63: WEATHER
A64: PRESTON | C64: 2 | D64: 1 | E64: =(C64*6)+D64 -> 13 | G64: 6 | H64: 5 | I64: =(G64*6)+H64 -> 41 | K64: 11 | L64: 8 | M64: =(K64*6)+L64 -> 74 | O64: 17 | P64: 13 | Q64: =(O64*6)+P64 -> 115 | S64: Venue: SPRINGVALE
A65: SPRINGVALE | C65: 4 | D65: 4 | E65: =(C65*6)+D65 -> 28 | G65: 8 | H65: 7 | I65: =(G65*6)+H65 -> 55 | K65: 12 | L65: 9 | M65: =(K65*6)+L65 -> 81 | O65: 16 | P65: 13 | Q65: =(O65*6)+P65 -> 109
A66: BEST PLAYERS
A67: PRESTON | C67: FROST | F67: ZORZI | I67: LEE | L67: PENN | N67: MOYLE | Q67: GROSSMAN
A68: SPRINGVALE | C68: SMITH | F68: SHEAHAN | I68: CAPLES | L68: CARROLL | N68: SHAW
A69: GOALKICKERS
A70: PRESTON | C70: MOYLE 3 | E70: McINTOSH 2 | H70: CUSACK 2 | K70: FROST 2 | M70: PENN | O70: BONADIA | Q70: BLIGHT | S70: SCANLON | W70: CARACELLA | X70: LEE | Z70: CLARKE | AB70: FAVRIN
A71: SPRINGVALE | C71: SMITH 5 | F71: SHAW 3 | H71: COURTNEY 2 | K71: IRISH 2 | M71: DELARUE | O71: LOGAN | Q71: O'BRIEN | S71: PITT
A73: WILLIAMSTOWN | C73: 9 | D73: 7 | E73: =(C73*6)+D73 -> 61 | G73: 14 | H73: 9 | I73: =(G73*6)+H73 -> 93 | K73: 18 | L73: 10 | M73: =(K73*6)+L73 -> 118 | O73: 22 | P73: 12 | Q73: =(O73*6)+P73 -> 144 | S73: Venue: WHITTEN OVAL
A74: WERRIBEE | C74: 5 | D74: 1 | E74: =(C74*6)+D74 -> 31 | G74: 9 | H74: 3 | I74: =(G74*6)+H74 -> 57 | K74: 13 | L74: 8 | M74: =(K74*6)+L74 -> 86 | O74: 16 | P74: 10 | Q74: =(O74*6)+P74 -> 106
A75: BEST PLAYERS
A76: WILLIAMSTOWN | C76: MAHONEY | F76: ROUND | I76: WOOD | L76: ELLIS | N76: TAYLOR | Q76: ROBBINS
A77: WERRIBEE | C77: FROST | F77: DIROSA | I77: FAULKNER | L77: FULLER | N77: MURPHY | Q77: SYMES
A78: GOALKICKERS
A79: WILLIAMSTOWN | C79: SMOKER 5 | F79: MAHONEY 5 | I79: TAYLOR 3 | L79: ROBBINS 3 | O79: LLOYD 2 | Q79: GHAZI 2 | T79: MACRI | W79: HOLLOW
A80: WERRIBEE | C80: SYMES 4 | E80: PENNY 3 | G80: DIROSA 2 | J80: FROST | L80: BUTTON | N80: FAULKNER | Q80: MITCHELL | T80: ALVEY | W80: FULLER | X80: MURPHY
D81: 20TH MARCH | H81: NIGHT MATCH | K81: WEATHER
A82: BOX HILL | C82: 6 | D82: 3 | E82: =(C82*6)+D82 -> 39 | G82: 9 | H82: 7 | I82: =(G82*6)+H82 -> 61 | K82: 15 | L82: 10 | M82: =(K82*6)+L82 -> 100 | O82: 17 | P82: 12 | Q82: =(O82*6)+P82 -> 114 | S82: Venue: WAVERLEY
A83: CARLTON | C83: 2 | D83: 2 | E83: =(C83*6)+D83 -> 14 | G83: 3 | H83: 8 | I83: =(G83*6)+H83 -> 26 | K83: 4 | L83: 10 | M83: =(K83*6)+L83 -> 34 | O83: 8 | P83: 11 | Q83: =(O83*6)+P83 -> 59
A84: BEST PLAYERS
A85: BOX HILL | C85: VANDENBERG | F85: KRUMMEL | I85: BOWYER | L85: COX | N85: FINNOCHAIRO | Q85: MANN
A86: CARLTON | C86: HOULIHAN | F86: CARROLL | I86: PORTER
A87: GOALKICKERS
A88: BOX HILL | C88: COX 3 | E88: BANKS 2 | G88: McPHARLIN 2 | J88: O'FARRELL 2 | M88: TAYLOR 2 | O88: VANDENBERG 2 | R88: BAIRD | T88: BOWYER | W88: KRUMMEL | X88: MALSEED
A89: CARLTON | C89: HOULIHAN 4 | F89: DOERING | H89: MERRINGTON | K89: MATHEWS | N89: DUKES
A91: ROUND 2 | D91: 25TH MARCH | J91: WEATHER
D92: 1ST QTR | H92: 2ND QTR | L92: 3RD QTR | P92: FINAL | S92: Venue: COBURG
A93: WILLIAMSTOWN | C93: 4 | D93: 5 | E93: =(C93*6)+D93 -> 29 | G93: 9 | H93: 6 | I93: =(G93*6)+H93 -> 60 | K93: 12 | L93: 7 | M93: =(K93*6)+L93 -> 79 | O93: 18 | P93: 11 | Q93: =(O93*6)+P93 -> 119 | S93: UMPIRES | Y93: LADDER | AB93: ROUND | AD93: 2
A94: MURRAY KANGAROOS | C94: 3 | D94: 4 | E94: =(C94*6)+D94 -> 22 | G94: 7 | H94: 4 | I94: =(G94*6)+H94 -> 46 | K94: 12 | L94: 5 | M94: =(K94*6)+L94 -> 77 | O94: 13 | P94: 8 | Q94: =(O94*6)+P94 -> 86
A95: BEST PLAYERS | W95: TEAM | X95: W | Y95: L | Z95: D | AA95: FOR | AB95: AGST | AC95: % | AD95: PTS
A96: WILLIAMSTOWN | C96: TAYLOR | F96: DOOLEY | I96: MACRI | K96: ANDERSON | N96: WATT | P96: HORE
A97: MURRAY KANGAROOS | C97: HILTON | F97: VAN DER KLOOSTER | J97: AINLEY | L97: ANDERSON | N97: McCORMACK | W97: SANDRINGHAM | X97: 2 | Y97: 0 | Z97: 0 | AA97: 203 | AB97: 128 | AC97: =(AA97/AB97)*100 -> 158.59375 | AD97: =(X97*4)+(Z97*2) -> 8
A98: GOALKICKERS | C98: * | D98: (2 GOALS SHORT ) | W98: BOX HILL | X98: 2 | Y98: 0 | Z98: 0 | AA98: 257 | AB98: 177 | AC98: =(AA98/AB98)*100 -> 145.19774011299435 | AD98: =(X98*4)+(Z98*2) -> 8
A99: WILLIAMSTOWN | C99: MACRI 6 | F99: TAYLOR 3 | I99: LLOYD 2 | K99: GHAZI 2 | M99: SMOKER | O99: ROUND | Q99: ANDERSON | W99: WILLIAMSTOWN | X99: 2 | Y99: 0 | Z99: 0 | AA99: 263 | AB99: 192 | AC99: =(AA99/AB99)*100 -> 136.97916666666669 | AD99: =(X99*4)+(Z99*2) -> 8
A100: MURRAY KANGAROOS | C100: DHURKAY 4 | F100: KINGSLEY 2 | I100: YOUNIE 2 | L100: HAY | M100: LOWTHER | O100: TAFFT | Q100: WILLETT | W100: ST KILDA | X100: 2 | Y100: 0 | Z100: 0 | AA100: 228 | AB100: 191 | AC100: =(AA100/AB100)*100 -> 119.37172774869109 | AD100: =(X100*4)+(Z100*2) -> 8
D101: 18TH MARCH | J101: WEATHER | N101: VANDER KLOOSTER | W101: COLLINGWOOD | X101: 2 | Y101: 0 | Z101: 0 | AA101: 264 | AB101: 232 | AC101: =(AA101/AB101)*100 -> 113.79310344827587 | AD101: =(X101*4)+(Z101*2) -> 8
A102: GEELONG | C102: 4 | D102: 3 | E102: =(C102*6)+D102 -> 27 | G102: 7 | H102: 6 | I102: =(G102*6)+H102 -> 48 | K102: 11 | L102: 8 | M102: =(K102*6)+L102 -> 74 | O102: 16 | P102: 12 | Q102: =(O102*6)+P102 -> 108 | S102: Venue: PUNT ROAD | W102: GEELONG | X102: 2 | Y102: 0 | Z102: 0 | AA102: 205 | AB102: 194 | AC102: =(AA102/AB102)*100 -> 105.67010309278351 | AD102: =(X102*4)+(Z102*2) -> 8
A103: RICHMOND | C103: 5 | D103: 1 | E103: =(C103*6)+D103 -> 31 | G103: 8 | H103: 2 | I103: =(G103*6)+H103 -> 50 | K103: 13 | L103: 4 | M103: =(K103*6)+L103 -> 82 | O103: 16 | P103: 7 | Q103: =(O103*6)+P103 -> 103 | W103: COBURG | X103: 1 | Y103: 1 | Z103: 0 | AA103: 229 | AB103: 156 | AC103: =(AA103/AB103)*100 -> 146.7948717948718 | AD103: =(X103*4)+(Z103*2) -> 4
A104: BEST PLAYERS | W104: FRANKSTON | X104: 1 | Y104: 1 | Z104: 0 | AA104: 250 | AB104: 210 | AC104: =(AA104/AB104)*100 -> 119.04761904761905 | AD104: =(X104*4)+(Z104*2) -> 4
A105: GEELONG | C105: HALL | F105: STEINFORT | I105: COWELL | K105: LOWTHER | N105: CHAPMAN | Q105: T LYNCH
A106: RICHMOND | C106: PROCTOR | F106: VARDY | I106: MILLS | K106: BIDDISCOMBE | W106: ESSENDON | X106: 1 | Y106: 1 | Z106: 0 | AA106: 246 | AB106: 218 | AC106: =(AA106/AB106)*100 -> 112.8440366972477 | AD106: =(X106*4)+(Z106*2) -> 4
A107: GOALKICKERS | W107: PORT MELBOURNE | X107: 1 | Y107: 1 | Z107: 0 | AA107: 251 | AB107: 240 | AC107: =(AA107/AB107)*100 -> 104.58333333333334 | AD107: =(X107*4)+(Z107*2) -> 4
A108: GEELONG | C108: HALL 3 | E108: LONG 3 | G108: BALDWIN 3 | J108: BRAY 2 | L108: LOWTHER 2 | N108: H SIMPSON | Q108: CHAPMAN | S108: CLARK | W108: NORTH BALLARAT | X108: 1 | Y108: 1 | Z108: 0 | AA108: 152 | AB108: 160 | AC108: =(AA108/AB108)*100 -> 95 | AD108: =(X108*4)+(Z108*2) -> 4
A109: RICHMOND | C109: EVANS 4 | E109: JAMES 2 | G109: WHITE 2 | I109: HAYNES 2 | K109: POWELL | M109: DEAN | O109: ZANTUCK | Q109: GREIG | R109: BIDDISCOMBE | W109: PRESTON | X109: 1 | Y109: 1 | Z109: 0 | AA109: 169 | AB109: 268 | AC109: =(AA109/AB109)*100 -> 63.059701492537314 | AD109: =(X109*4)+(Z109*2) -> 4
P110: FIORA | W110: SPRINGVALE | X110: 0 | Y110: 1 | Z110: 1 | AA110: 202 | AB110: 208 | AC110: =(AA110/AB110)*100 -> 97.115384615384613 | AD110: =(X110*4)+(Z110*2) -> 2
A111: PORT MELBOURNE | C111: 6 | D111: 2 | E111: =(C111*6)+D111 -> 38 | G111: 11 | H111: 5 | I111: =(G111*6)+H111 -> 71 | K111: 16 | L111: 8 | M111: =(K111*6)+L111 -> 104 | O111: 23 | P111: 11 | Q111: =(O111*6)+P111 -> 149 | S111: Venue: PORT MELBOURNE | W111: WERRIBEE | X111: 0 | Y111: 1 | Z111: 1 | AA111: 199 | AB111: 217 | AC111: =(AA111/AB111)*100 -> 91.705069124423972 | AD111: =(X111*4)+(Z111*2) -> 2
A112: BENDIGO | C112: 2 | D112: 3 | E112: =(C112*6)+D112 -> 15 | G112: 8 | H112: 5 | I112: =(G112*6)+H112 -> 53 | K112: 14 | L112: 7 | M112: =(K112*6)+L112 -> 91 | O112: 16 | P112: 12 | Q112: =(O112*6)+P112 -> 108 | W112: CARLTON | X112: 0 | Y112: 2 | Z112: 0 | AA112: 189 | AB112: 246 | AC112: =(AA112/AB112)*100 -> 76.829268292682926 | AD112: =(X112*4)+(Z112*2) -> 0
A113: BEST PLAYERS | W113: RICHMOND | X113: 0 | Y113: 2 | Z113: 0 | AA113: 184 | AB113: 260 | AC113: =(AA113/AB113)*100 -> 70.769230769230774 | AD113: =(X113*4)+(Z113*2) -> 0
A114: PORT MELBOURNE | C114: FOLINO | F114: FRANCIS | I114: McCORMICK | L114: SWAN | N114: FEAST | Q114: BOLTON | W114: MURRAY KANGAROOS | X114: 0 | Y114: 2 | Z114: 0 | AA114: 164 | AB114: 232 | AC114: =(AA114/AB114)*100 -> 70.689655172413794 | AD114: =(X114*4)+(Z114*2) -> 0
A115: BENDIGO | C115: O'CALLAGHAN | F115: SUTHERLAND | I115: TOINTON | L115: DILLON | N115: WALSH | W115: BENDIGO | X115: 0 | Y115: 2 | Z115: 0 | AA115: 175 | AB115: 281 | AC115: =(AA115/AB115)*100 -> 62.277580071174377 | AD115: =(X115*4)+(Z115*2) -> 0
A116: GOALKICKERS
A117: PORT MELBOURNE | C117: FEAST 5 | E117: KIRK 3 | G117: SWAN 2 | I117: BOSSONG 2 | L117: CROW 2 | N117: McCORMICK 2 | Q117: FOLINO 2 | S117: GREENHAM | W117: D'GIACOMA | X117: GOODALL | AA117: SCHAEFER | AC117: SANGSTER
A118: BENDIGO | C118: DILLON 4 | F118: O'CALLAGHAN 3 | J118: SHIELS-BROCK 3 | N118: O'TOOLE 2 | Q118: SCHMIDT 2 | T118: WALSH | W118: MITSOBIC
D119: NIGHT MATCH
A120: SANDRINGHAM | C120: 4 | D120: 2 | E120: =(C120*6)+D120 -> 26 | G120: 9 | H120: 4 | I120: =(G120*6)+H120 -> 58 | K120: 11 | L120: 10 | M120: =(K120*6)+L120 -> 76 | O120: 13 | P120: 12 | Q120: =(O120*6)+P120 -> 90 | S120: Venue: NORTH BALLARAT
A121: NORTH BALLARAT | C121: 1 | D121: 1 | E121: =(C121*6)+D121 -> 7 | G121: 1 | H121: 3 | I121: =(G121*6)+H121 -> 9 | K121: 4 | L121: 4 | M121: =(K121*6)+L121 -> 28 | O121: 7 | P121: 8 | Q121: =(O121*6)+P121 -> 50
A122: BEST PLAYERS
A123: SANDRINGHAM | C123: BROWN | F123: FRATER | I123: MACGEORGE | L123: NICHOLSON | O123: WILLIAMS | R123: BEAMS
A124: NORTH BALLARAT | C124: SOMERVILLE | F124: J POLKINGHORNE | J124: GREIG | L124: KENNEDY | O124: FUNCKE | R124: POWER
A125: GOALKICKERS
A126: SANDRINGHAM | C126: SAUTNER 3 | F126: WILLIAMS 2 | I126: RAMSAY 2 | L126: BEAMS 2 | N126: LAMB | P126: SCOTT-BRANAGAN | T126: NICHOLSON | X126: MACGEORGE
A127: NORTH BALLARAT | C127: CLARKE 2 | F127: REID | H127: FISHER | J127: JURICA | L127: POWER | N127: BAKER
D128: 26TH MARCH | J128: WEATHER
A129: COLLINGWOOD | C129: 6 | D129: 3 | E129: =(C129*6)+D129 -> 39 | G129: 10 | H129: 6 | I129: =(G129*6)+H129 -> 66 | K129: 16 | L129: 8 | M129: =(K129*6)+L129 -> 104 | O129: 20 | P129: 12 | Q129: =(O129*6)+P129 -> 132 | S129: Venue: M.C.G. (C/R)
A130: CARLTON | C130: 3 | D130: 0 | E130: =(C130*6)+D130 -> 18 | G130: 11 | H130: 2 | I130: =(G130*6)+H130 -> 68 | K130: 16 | L130: 6 | M130: =(K130*6)+L130 -> 102 | O130: 20 | P130: 10 | Q130: =(O130*6)+P130 -> 130
A131: BEST PLAYERS
A132: COLLINGWOOD | C132: OLARENSHAW | F132: WATSON | I132: LANE | L132: OBORNE | O132: MARTELLO
A133: CARLTON | C133: FREEBORN | F133: FRANCHINA | I133: MERRINGTON | L133: VANCE | O133: HOULIHAN | R133: MATTHEWS
A134: GOALKICKERS
A135: COLLINGWOOD | C135: OBORNE 5 | F135: WATSON 3 | I135: LANE 3 | K135: BAYNES 3 | M135: DIMMATINA 2 | P135: McKEE | R135: SMITH | T135: SHARPEN | W135: SCOTLAND
A136: CARLTON | C136: MERRINGTON 4 | F136: DOERING 4 | I136: BACKWELL 3 | L136: FRANCHINA 2 | O136: CHRISTOU 2 | R136: PASSADOR 2 | V136: PICKERING | X136: FREEBORN | AA136: PORTER
A138: BOX HILL | C138: 6 | D138: 2 | E138: =(C138*6)+D138 -> 38 | G138: 10 | H138: 14 | I138: =(G138*6)+H138 -> 74 | K138: 17 | L138: 15 | M138: =(K138*6)+L138 -> 117 | O138: 20 | P138: 23 | Q138: =(O138*6)+P138 -> 143 | S138: Venue: BOX HILL
A139: FRANKSTON | C139: 3 | D139: 3 | E139: =(C139*6)+D139 -> 21 | G139: 6 | H139: 3 | I139: =(G139*6)+H139 -> 39 | K139: 13 | L139: 3 | M139: =(K139*6)+L139 -> 81 | O139: 19 | P139: 4 | Q139: =(O139*6)+P139 -> 118
A140: BEST PLAYERS
A141: BOX HILL | C141: JOHNSON | F141: BREWER | I141: HABERFIELD | L141: LORD | O141: MANN | R141: FINNOCHIRO
A142: FRANKSTON | C142: MURRAY | F142: SULLIVAN | I142: BURGMAN | L142: ROBERTS | O142: HOLCOMBE
A143: GOALKICKERS
A144: BOX HILL | C144: HABERFIELD 4 | F144: McPHARLIN 4 | I144: BREWER 2 | L144: O'FARRELL 2 | O144: COX 2 | Q144: MALSEED 2 | T144: MANN | W144: LORD | X144: RODE | Z144: BAIRD
A145: FRANKSTON | C145: WILLIAMS 4 | F145: BURNELL 4 | I145: ANDERSON 3 | L145: MURRAY 3 | N145: SULLIVAN 2 | Q145: HOSE 2 | S145: McCORMACK
A147: WERRIBEE | C147: 2 | D147: 6 | E147: =(C147*6)+D147 -> 18 | G147: 7 | H147: 11 | I147: =(G147*6)+H147 -> 53 | K147: 11 | L147: 16 | M147: =(K147*6)+L147 -> 82 | O147: 12 | P147: 21 | Q147: =(O147*6)+P147 -> 93 | S147: Venue: WERRIBEE
A148: SPRINGVALE | C148: 3 | D148: 1 | E148: =(C148*6)+D148 -> 19 | G148: 7 | H148: 7 | I148: =(G148*6)+H148 -> 49 | K148: 9 | L148: 8 | M148: =(K148*6)+L148 -> 62 | O148: 14 | P148: 9 | Q148: =(O148*6)+P148 -> 93
A149: BEST PLAYERS
A150: WERRIBEE | C150: SUTTON | F150: HYDE | I150: ALVEY | K150: ROBINSON | N150: SAUNDERS
A151: SPRINGVALE | C151: COURTNEY | F151: CARROLL | I151: SUTHERLAND | L151: LITTLE | N151: LOGAN | Q151: ROBBINS
A152: GOALKICKERS
A153: WERRIBEE | C153: ROBINSON 3 | F153: BUTTON 2 | I153: PENNY 2 | L153: ALVEY | N153: ATKINS | P153: FROST | R153: MILES | T153: SAUNDERS
A154: SPRINGVALE | C154: LOGAN 5 | F154: SMITH 4 | I154: HORBAN 2 | L154: SHAW | N154: LITTLE | P154: IRISH
A156: COBURG | C156: 8 | D156: 8 | E156: =(C156*6)+D156 -> 56 | G156: 12 | H156: 13 | I156: =(G156*6)+H156 -> 85 | K156: 17 | L156: 18 | M156: =(K156*6)+L156 -> 120 | O156: 23 | P156: 21 | Q156: =(O156*6)+P156 -> 159 | S156: Venue: PRESTON
A157: PRESTON | C157: 0 | D157: 1 | E157: =(C157*6)+D157 -> 1 | G157: 2 | H157: 5 | I157: =(G157*6)+H157 -> 17 | K157: 4 | L157: 10 | M157: =(K157*6)+L157 -> 34 | O157: 7 | P157: 12 | Q157: =(O157*6)+P157 -> 54
A158: BEST PLAYERS
A159: COBURG | C159: LOCK | F159: LAPPIN | I159: OPPENLANDER | L159: CONDON | N159: MORRISON | Q159: DEPASQUALE
A160: PRESTON | C160: GROSSMAN | F160: HOLMAN | I160: HAYWARD | L160: MANN
A161: GOALKICKERS
A162: COBURG | C162: KEENAN 4 | F162: R LITTLE 3 | I162: OPPENLANDER 3 | M162: LOCK 3 | O162: LJUBIC 3 | Q162: BOSSI 2 | S162: CANNING | V162: DEPASQUALE | X162: WESTON | AA162: RYAN | AB162: MORRISON
A163: PRESTON | C163: CARACELLA 2 | F163: FAVRIN 2 | I163: MOYLE | K163: SCANLON | M163: V EVANS
A165: ST KILDA | C165: 6 | D165: 2 | E165: =(C165*6)+D165 -> 38 | G165: 11 | H165: 6 | I165: =(G165*6)+H165 -> 72 | K165: 14 | L165: 12 | M165: =(K165*6)+L165 -> 96 | O165: 20 | P165: 17 | Q165: =(O165*6)+P165 -> 137 | S165: Venue: MOORABBIN
A166: ESSENDON | C166: 4 | D166: 1 | E166: =(C166*6)+D166 -> 25 | G166: 7 | H166: 3 | I166: =(G166*6)+H166 -> 45 | K166: 10 | L166: 4 | M166: =(K166*6)+L166 -> 64 | O166: 15 | P166: 4 | Q166: =(O166*6)+P166 -> 94
A167: BEST PLAYERS
A168: ST KILDA | C168: TRAIANIDIS | F168: KNOWLES | I168: PITTS | L168: CAMPBELL | O168: SCHWARZE | R168: BROWN
A169: ESSENDON | C169: PRIOR | F169: MOORCROFT | I169: McGRATH | L169: EASTAUGH | O169: LADHAMS | R169: JACOBS
A170: GOALKICKERS
A171: ST KILDA | C171: WITTISON 4 | F171: CAMPBELL 3 | I171: MILNE 3 | K171: CRANAGE 2 | N171: TRAIANIDIS 2 | Q171: BAKER | S171: FORTNAM | W171: ELLIOTT | X171: SCHWARZE | AA171: WULF | AB171: MOYLE
A172: ESSENDON | C172: EASTAUGH 3 | F172: PODSIADLY 3 | I172: LADHAMS 2 | L172: MOORCROFT 2 | O172: RIOLI | Q172: PRIOR | S172: FORSTER-KNIGHT | X172: D JOHNSON | AA172: HILLE
A174: ROUND 3 | D174: 31ST MARCH | J174: WEATHER
D175: 1ST QTR | H175: 2ND QTR | L175: 3RD QTR | P175: FINAL | S175: Venue: SHELL STADIUM
A176: GEELONG | C176: 4 | D176: 4 | E176: =(C176*6)+D176 -> 28 | G176: 10 | H176: 7 | I176: =(G176*6)+H176 -> 67 | K176: 15 | L176: 9 | M176: =(K176*6)+L176 -> 99 | O176: 21 | P176: 14 | Q176: =(O176*6)+P176 -> 140 | S176: UMPIRES | Y176: LADDER | AB176: ROUND | AD176: 3
A177: MURRAY KANGAROOS | C177: 3 | D177: 4 | E177: =(C177*6)+D177 -> 22 | G177: 4 | H177: 5 | I177: =(G177*6)+H177 -> 29 | K177: 5 | L177: 6 | M177: =(K177*6)+L177 -> 36 | O177: 7 | P177: 8 | Q177: =(O177*6)+P177 -> 50
A178: BEST PLAYERS | W178: TEAM | X178: W | Y178: L | Z178: D | AA178: FOR | AB178: AGST | AC178: % | AD178: PTS
A179: GEELONG | C179: HALL | F179: COWELL | I179: LOWTHER | L179: LINDSAY | O179: T LYNCH | R179: BALDWIN
A180: MURRAY KANGAROOS | C180: COCHRANE | F180: DHURKAY | I180: VAN DER KLOOSTER | M180: LOWTHER | O180: PAGAN | R180: TEAGUE | W180: SANDRINGHAM | X180: 3 | Y180: 0 | Z180: 0 | AA180: 390 | AB180: 184 | AC180: =(AA180/AB180)*100 -> 211.95652173913041 | AD180: =(X180*4)+(Z180*2) -> 12
A181: GOALKICKERS | W181: ST KILDA | X181: 3 | Y181: 0 | Z181: 0 | AA181: 415 | AB181: 267 | AC181: =(AA181/AB181)*100 -> 155.4307116104869 | AD181: =(X181*4)+(Z181*2) -> 12
A182: GEELONG | C182: BALDWIN 6 | F182: HALL 5 | H182: COWELL 3 | J182: LOWTHER 2 | M182: O'BRIEN 2 | O182: ARNOTT | Q182: T LYNCH | S182: ENRIGHT | W182: BOX HILL | X182: 3 | Y182: 0 | Z182: 0 | AA182: 386 | AB182: 249 | AC182: =(AA182/AB182)*100 -> 155.02008032128515 | AD182: =(X182*4)+(Z182*2) -> 12
A183: MURRAY KANGAROOS | C183: ANDERSON 2 | F183: YOUNIE | I183: WATT | K183: BROWN | M183: HAYE | O183: HILTON | W183: WILLIAMSTOWN | X183: 3 | Y183: 0 | Z183: 0 | AA183: 381 | AB183: 257 | AC183: =(AA183/AB183)*100 -> 148.24902723735408 | AD183: =(X183*4)+(Z183*2) -> 12
D184: 1ST APRIL | J184: WEATHER | W184: GEELONG | X184: 3 | Y184: 0 | Z184: 0 | AA184: 345 | AB184: 244 | AC184: =(AA184/AB184)*100 -> 141.39344262295083 | AD184: =(X184*4)+(Z184*2) -> 12
A185: NORTH BALLARAT | C185: 3 | D185: 3 | E185: =(C185*6)+D185 -> 21 | G185: 5 | H185: 3 | I185: =(G185*6)+H185 -> 33 | K185: 6 | L185: 4 | M185: =(K185*6)+L185 -> 40 | O185: 6 | P185: 6 | Q185: =(O185*6)+P185 -> 42 | S185: Venue: NORTH BALLARAT | W185: FRANKSTON | X185: 2 | Y185: 1 | Z185: 0 | AA185: 371 | AB185: 284 | AC185: =(AA185/AB185)*100 -> 130.63380281690141 | AD185: =(X185*4)+(Z185*2) -> 8
A186: PORT MELBOURNE | C186: 1 | D186: 1 | E186: =(C186*6)+D186 -> 7 | G186: 1 | H186: 5 | I186: =(G186*6)+H186 -> 11 | K186: 2 | L186: 7 | M186: =(K186*6)+L186 -> 19 | O186: 3 | P186: 10 | Q186: =(O186*6)+P186 -> 28 | W186: ESSENDON | X186: 2 | Y186: 1 | Z186: 0 | AA186: 368 | AB186: 309 | AC186: =(AA186/AB186)*100 -> 119.0938511326861 | AD186: =(X186*4)+(Z186*2) -> 8
A187: BEST PLAYERS | W187: NORTH BALLARAT | X187: 2 | Y187: 1 | Z187: 0 | AA187: 194 | AB187: 188 | AC187: =(AA187/AB187)*100 -> 103.19148936170212 | AD187: =(X187*4)+(Z187*2) -> 8
A188: NORTH BALLARAT | C188: EDWARDS | F188: GREIG | I188: FIELD | L188: FUNCKE | O188: SNIBSON | R188: MOLONEY
A189: PORT MELBOURNE | C189: SCHAEFER | F189: MATTHEWS-HERALD | J189: GOODALE | M189: KIRK | O189: FRANCIS | R189: FOLINO | W189: COLLINGWOOD | X189: 2 | Y189: 1 | Z189: 0 | AA189: 329 | AB189: 350 | AC189: =(AA189/AB189)*100 -> 94 | AD189: =(X189*4)+(Z189*2) -> 8
A190: GOALKICKERS | W190: COBURG | X190: 1 | Y190: 2 | Z190: 0 | AA190: 303 | AB190: 277 | AC190: =(AA190/AB190)*100 -> 109.38628158844766 | AD190: =(X190*4)+(Z190*2) -> 4
A191: NORTH BALLARAT | C191: McDONALD | F191: GREIG | H191: JURICA | J191: FREELAND | M191: SNIBSON | O191: REID | W191: CARLTON | X191: 1 | Y191: 2 | Z191: 0 | AA191: 305 | AB191: 292 | AC191: =(AA191/AB191)*100 -> 104.45205479452055 | AD191: =(X191*4)+(Z191*2) -> 4
A192: PORT MELBOURNE | C192: FEAST 2 | F192: GREENHAM | W192: PORT MELBOURNE | X192: 1 | Y192: 2 | Z192: 0 | AA192: 279 | AB192: 282 | AC192: =(AA192/AB192)*100 -> 98.936170212765958 | AD192: =(X192*4)+(Z192*2) -> 4
W193: PRESTON | X193: 1 | Y193: 2 | Z193: 0 | AA193: 225 | AB193: 455 | AC193: =(AA193/AB193)*100 -> 49.450549450549453 | AD193: =(X193*4)+(Z193*2) -> 4
A194: CARLTON | C194: 4 | D194: 3 | E194: =(C194*6)+D194 -> 27 | G194: 7 | H194: 4 | I194: =(G194*6)+H194 -> 46 | K194: 15 | L194: 8 | M194: =(K194*6)+L194 -> 98 | O194: 18 | P194: 8 | Q194: =(O194*6)+P194 -> 116 | S194: Venue: OPTUS OVAL | W194: WERRIBEE | X194: 0 | Y194: 2 | Z194: 1 | AA194: 290 | AB194: 339 | AC194: =(AA194/AB194)*100 -> 85.545722713864308 | AD194: =(X194*4)+(Z194*2) -> 2
A195: SPRINGVALE | C195: 1 | D195: 0 | E195: =(C195*6)+D195 -> 6 | G195: 2 | H195: 6 | I195: =(G195*6)+H195 -> 18 | K195: 3 | L195: 7 | M195: =(K195*6)+L195 -> 25 | O195: 6 | P195: 10 | Q195: =(O195*6)+P195 -> 46 | W195: SPRINGVALE | X195: 0 | Y195: 2 | Z195: 1 | AA195: 248 | AB195: 324 | AC195: =(AA195/AB195)*100 -> 76.543209876543202 | AD195: =(X195*4)+(Z195*2) -> 2
A196: BEST PLAYERS | W196: BENDIGO | X196: 0 | Y196: 3 | Z196: 0 | AA196: 247 | AB196: 410 | AC196: =(AA196/AB196)*100 -> 60.243902439024389 | AD196: =(X196*4)+(Z196*2) -> 0
A197: CARLTON | C197: FLETCHER | F197: WHITE | I197: MANTON | L197: FREEBORN | O197: PORTER | R197: HOULIHAN | W197: RICHMOND | X197: 0 | Y197: 3 | Z197: 0 | AA197: 260 | AB197: 447 | AC197: =(AA197/AB197)*100 -> 58.165548098434009 | AD197: =(X197*4)+(Z197*2) -> 0
A198: SPRINGVALE | C198: LOGAN | F198: TROLLOPE | I198: COURTNEY | L198: IRISH | O198: CARROLL | R198: DELARUE | W198: MURRAY KANGAROOS | X198: 0 | Y198: 3 | Z198: 0 | AA198: 214 | AB198: 372 | AC198: =(AA198/AB198)*100 -> 57.526881720430111 | AD198: =(X198*4)+(Z198*2) -> 0
A199: GOALKICKERS
A200: CARLTON | C200: MERRINGTON 4 | F200: PASSADOR 3 | I200: FLETCHER 2 | L200: FREEBORN 2 | O200: BACKWELL 2 | R200: HOULIHAN | W200: PRENDERGAST | X200: CARROLL | AA200: PICKERING | AC200: KELLY
A201: SPRINGVALE | C201: HORBAN 2 | F201: SMITH 2 | I201: LOGAN | K201: PITT
A203: SANDRINGHAM | C203: 6 | D203: 2 | E203: =(C203*6)+D203 -> 38 | G203: 17 | H203: 9 | I203: =(G203*6)+H203 -> 111 | K203: 21 | L203: 14 | M203: =(K203*6)+L203 -> 140 | O203: 27 | P203: 25 | Q203: =(O203*6)+P203 -> 187 | S203: Venue: BEACH ROAD
A204: PRESTON | C204: 3 | D204: 5 | E204: =(C204*6)+D204 -> 23 | G204: 4 | H204: 6 | I204: =(G204*6)+H204 -> 30 | K204: 6 | L204: 7 | M204: =(K204*6)+L204 -> 43 | O204: 8 | P204: 8 | Q204: =(O204*6)+P204 -> 56
A205: BEST PLAYERS
A206: SANDRINGHAM | C206: BEAMS | F206: OAKLEY | I206: GODFREY | L206: WILLIAMS | O206: RAMSAY | R206: HAYWARD
A207: PRESTON | C207: CANN | F207: HILL | I207: LEE | L207: ZORZI | O207: GRAINGER
A208: GOALKICKERS | T208: MACGEORGE
A209: SANDRINGHAM | C209: BEAMS 6 | E209: HAYWARD 4 | H209: RAMSAY 3 | J209: GODFREY 3 | M209: COLLINS 2 | O209: B OAKLEY 2 | R209: FRATER | T209: PITT | V209: WHEATLEY | X209: CLARK | Z209: SAUTNER | AB209: KENNEDY
A210: PRESTON | C210: GRAINGER 4 | F210: HILL 2 | I210: CANN | K210: FAVRIN
D211: 2ND APRIL | J211: WEATHER
A212: BOX HILL | C212: 5 | D212: 1 | E212: =(C212*6)+D212 -> 31 | G212: 11 | H212: 4 | I212: =(G212*6)+H212 -> 70 | K212: 15 | L212: 8 | M212: =(K212*6)+L212 -> 98 | O212: 19 | P212: 15 | Q212: =(O212*6)+P212 -> 129 | S212: Venue: BENDIGO
A213: BENDIGO | C213: 2 | D213: 4 | E213: =(C213*6)+D213 -> 16 | G213: 8 | H213: 7 | I213: =(G213*6)+H213 -> 55 | K213: 9 | L213: 10 | M213: =(K213*6)+L213 -> 64 | O213: 10 | P213: 12 | Q213: =(O213*6)+P213 -> 72
A214: BEST PLAYERS
A215: BOX HILL | C215: HILL | F215: YOUNG | I215: BREWER | L215: PUGSLEY | O215: RODE | Q215: LORD
A216: BENDIGO | C216: O'TOOLE | F216: CARTER | I216: ANGOVE | L216: WALSH | O216: TOINTON
A217: GOALKICKERS | V217: LORD
A218: BOX HILL | C218: McPHARLIN 3 | F218: BANKS 2 | H218: O'FARRELL 2 | K218: COX 2 | M218: RODE 2 | O218: BREWER | Q218: MANN | S218: FINNICHARIO | W218: HABERFIELD | X218: JOHNSON | AA218: MALSEED | AC218: BOWYER
A219: BENDIGO | C219: WALSH 2 | F219: BOSWORTH | I219: BROWN | K219: CARTER | M219: DILLON | O219: FAUKHEAD | R219: MITROVIC | U219: O'CALLAGHAN | X219: BROCK SHIELLS
A221: FRANKSTON | C221: 3 | D221: 3 | E221: =(C221*6)+D221 -> 21 | G221: 8 | H221: 5 | I221: =(G221*6)+H221 -> 53 | K221: 14 | L221: 7 | M221: =(K221*6)+L221 -> 91 | O221: 18 | P221: 13 | Q221: =(O221*6)+P221 -> 121 | S221: Venue: FRANKSTON
A222: COBURG | C222: 3 | D222: 3 | E222: =(C222*6)+D222 -> 21 | G222: 5 | H222: 6 | I222: =(G222*6)+H222 -> 36 | K222: 8 | L222: 10 | M222: =(K222*6)+L222 -> 58 | O222: 10 | P222: 14 | Q222: =(O222*6)+P222 -> 74
A223: BEST PLAYERS
A224: FRANKSTON | C224: MALLOY | F224: ROBERTS | I224: HOLCOMBE | L224: CORRIGAN | O224: HOPGOOD | R224: LAWRENCE
A225: COBURG | C225: CONDON | F225: WILLOUGHBY | I225: LANG
A226: GOALKICKERS
A227: FRANKSTON | C227: SMITH 4 | F227: DAM CLARKE 3 | J227: McCORMACK 3 | N227: WILLIAMS 2 | Q227: ANDERSON 2 | T227: BURNELL 2 | W227: DAN CLARKE | X227: HOPGOOD
A228: COBURG | C228: WILLOUGHBY 4 | F228: OPPENLANDER 3 | J228: KEENAN | L228: LITTLE | N228: McKENZIE-McHARG
A230: WILLIAMSTOWN | C230: 5 | D230: 2 | E230: =(C230*6)+D230 -> 32 | G230: 9 | H230: 4 | I230: =(G230*6)+H230 -> 58 | K230: 12 | L230: 13 | M230: =(K230*6)+L230 -> 85 | O230: 16 | P230: 22 | Q230: =(O230*6)+P230 -> 118 | S230: Venue: WILLIAMSTOWN
A231: COLLINGWOOD | C231: 2 | D231: 7 | E231: =(C231*6)+D231 -> 19 | G231: 5 | H231: 13 | I231: =(G231*6)+H231 -> 43 | K231: 6 | L231: 15 | M231: =(K231*6)+L231 -> 51 | O231: 8 | P231: 17 | Q231: =(O231*6)+P231 -> 65
A232: BEST PLAYERS
A233: WILLIAMSTOWN | C233: ANDERSON | F233: HAHN | I233: HOLLOW | L233: ROBBINS | O233: PLUNKETT | R233: ROUND
A234: COLLINGWOOD | C234: SCOTLAND | F234: SMITH | I234: McKEE | L234: OLARENSHAWW | O234: JACOTINE
A235: GOALKICKERS
A236: WILLIAMSTOWN | C236: DOOLEY 3 | F236: TAYLOR 3 | I236: MACRI 3 | K236: RALPH 2 | M236: HOLLOW | O236: LLOYD | Q236: CAPE | S236: ANDERSON | W236: ROBBINS
A237: COLLINGWOOD | C237: SMITH 2 | F237: PATTERSON | I237: BAYNES | K237: SCOTLAND | N237: GREY | P237: TUCKEY | R237: DAVIS
A239: ESSENDON | C239: 4 | D239: 5 | E239: =(C239*6)+D239 -> 29 | G239: 13 | H239: 6 | I239: =(G239*6)+H239 -> 84 | K239: 15 | L239: 8 | M239: =(K239*6)+L239 -> 98 | O239: 19 | P239: 8 | Q239: =(O239*6)+P239 -> 122 | S239: Venue: WERRIBEE
A240: WERRIBEE | C240: 2 | D240: 4 | E240: =(C240*6)+D240 -> 16 | G240: 4 | H240: 5 | I240: =(G240*6)+H240 -> 29 | K240: 7 | L240: 8 | M240: =(K240*6)+L240 -> 50 | O240: 13 | P240: 13 | Q240: =(O240*6)+P240 -> 91
A241: BEST PLAYERS
A242: ESSENDON | C242: DENHAM | F242: HILLE | I242: RIOLOI | L242: JACOBS | O242: CARACELLA | R242: BOLTON
A243: WERRIBEE | C243: FAULKNER | F243: ALVEY | I243: ATKINS | L243: FULLER | O243: FROST
A244: GOALKICKERS
A245: ESSENDON | C245: CARACELLA 4 | F245: BERBAKOV 3 | I245: PODSIADLY 3 | L245: LADHAMS 3 | O245: DENHAM | Q245: JACOBS | S245: SWITALA | W245: GIUSCHENKO | X245: HILLE | Z245: LALICH | AB245: RIOLI
A246: WERRIBEE | C246: WIGGINS 2 | F246: LAMB 2 | H246: FROST | J246: SATTERLEY | M246: ROBINSON | O246: FAULKNER | R246: DEROSA | T246: PULI | V246: ATKINS | X246: SAUNDERS | AA246: ALVEY
D247: 3RD APRIL | H247: NIGHT MATCH | K247: WEATHER
A248: ST KILDA | C248: 8 | D248: 1 | E248: =(C248*6)+D248 -> 49 | G248: 14 | H248: 6 | I248: =(G248*6)+H248 -> 90 | K248: 21 | L248: 10 | M248: =(K248*6)+L248 -> 136 | O248: 29 | P248: 13 | Q248: =(O248*6)+P248 -> 187 | S248: Venue: WAVERLEY
A249: RICHMOND | C249: 4 | D249: 2 | E249: =(C249*6)+D249 -> 26 | G249: 7 | H249: 5 | I249: =(G249*6)+H249 -> 47 | K249: 9 | L249: 6 | M249: =(K249*6)+L249 -> 60 | O249: 11 | P249: 10 | Q249: =(O249*6)+P249 -> 76
A250: BEST PLAYERS
A251: ST KILDA | C251: TRAIANIDIS | F251: SIERAKOWSKI | I251: CHARLES | L251: MOYLE | O251: CRANAGE | R251: WALTON
A252: RICHMOND | C252: CHAFFEY | F252: VARDY | I252: JAMES | L252: M EDWARDS | O252: TAYLOR
A253: GOALKICKERS | S253: WULF | U253: MILNE
A254: ST KILDA | C254: SIERAKOWSKI 5 | F254: WALTON 4 | I254: HEATLEY 3 | L254: CRANAGE 3 | N254: CHARLES 3 | Q254: PLAPP 3 | S254: PECKETT 2 | W254: TRAIANIDIS | X254: ELLIOTT | Z254: PITTS | AB254: MOYLE
A255: RICHMOND | C255: ARTHURSON 2 | F255: JEWELL 2 | I255: ZANTUCK 2 | L255: M EDWARDS | O255: T EDWARDS | R255: GREIG | T255: FIORA | V255: JOYCE
A257: ROUND 4 | D257: 8TH APRIL | J257: WEATHER
D258: 1ST QTR | H258: 2ND QTR | L258: 3RD QTR | P258: FINAL | S258: Venue: BENDIGO
A259: NORTH BALLARAT | C259: 5 | D259: 7 | E259: =(C259*6)+D259 -> 37 | G259: 9 | H259: 13 | I259: =(G259*6)+H259 -> 67 | K259: 13 | L259: 14 | M259: =(K259*6)+L259 -> 92 | O259: 18 | P259: 23 | Q259: =(O259*6)+P259 -> 131 | S259: UMPIRES | Y259: LADDER | AB259: ROUND | AD259: 4
A260: BENDIGO | C260: 0 | D260: 8 | E260: =(C260*6)+D260 -> 8 | G260: 1 | H260: 12 | I260: =(G260*6)+H260 -> 18 | K260: 1 | L260: 13 | M260: =(K260*6)+L260 -> 19 | O260: 2 | P260: 16 | Q260: =(O260*6)+P260 -> 28
A261: BEST PLAYERS | W261: TEAM | X261: W | Y261: L | Z261: D | AA261: FOR | AB261: AGST | AC261: % | AD261: PTS
A262: NORTH BALLARAT | C262: J POLKINGHORNE | G262: FUNCKE | J262: EDWARDS | M262: McDONALD | P262: CLAYTON | R262: FIELD
A263: BENDIGO | C263: SCHMIDT | G263: SUTHERLAND | J263: ANGOVE | M263: TOINTON | P263: BROCK | R263: SHIELS | W263: SANDRINGHAM | X263: 4 | Y263: 0 | Z263: 0 | AA263: 505 | AB263: 260 | AC263: =(AA263/AB263)*100 -> 194.23076923076923 | AD263: =(X263*4)+(Z263*2) -> 16
A264: GOALKICKERS | L264: FISHER | N264: REID | P264: McDONALD | S264: POWER | W264: ST KILDA | X264: 4 | Y264: 0 | Z264: 0 | AA264: 545 | AB264: 317 | AC264: =(AA264/AB264)*100 -> 171.92429022082018 | AD264: =(X264*4)+(Z264*2) -> 16
A265: NORTH BALLARAT | C265: RYALL 4 | E265: SOMERVILLE 2 | H265: EDWARDS 2 | K265: FIELD 2 | M265: SIER 2 | O265: J POLKINGHORNE | R265: FUNCKE | W265: GEELONG | X265: 4 | Y265: 0 | Z265: 0 | AA265: 462 | AB265: 310 | AC265: =(AA265/AB265)*100 -> 149.03225806451613 | AD265: =(X265*4)+(Z265*2) -> 16
A266: BENDIGO | C266: GEDDES 2 | W266: BOX HILL | X266: 4 | Y266: 0 | Z266: 0 | AA266: 495 | AB266: 337 | AC266: =(AA266/AB266)*100 -> 146.88427299703264 | AD266: =(X266*4)+(Z266*2) -> 16
D267: 18TH MARCH | J267: WEATHER | W267: WILLIAMSTOWN | X267: 4 | Y267: 0 | Z267: 0 | AA267: 512 | AB267: 356 | AC267: =(AA267/AB267)*100 -> 143.82022471910113 | AD267: =(X267*4)+(Z267*2) -> 16
A268: PORT MELBOURNE | C268: 4 | D268: 4 | E268: =(C268*6)+D268 -> 28 | G268: 5 | H268: 7 | I268: =(G268*6)+H268 -> 37 | K268: 12 | L268: 11 | M268: =(K268*6)+L268 -> 83 | O268: 16 | P268: 18 | Q268: =(O268*6)+P268 -> 114 | S268: Venue: PORT MELBOURNE | W268: NORTH BALLARAT | X268: 3 | Y268: 1 | Z268: 0 | AA268: 325 | AB268: 216 | AC268: =(AA268/AB268)*100 -> 150.46296296296296 | AD268: =(X268*4)+(Z268*2) -> 12
A269: FRANKSTON | C269: 4 | D269: 2 | E269: =(C269*6)+D269 -> 26 | G269: 5 | H269: 3 | I269: =(G269*6)+H269 -> 33 | K269: 12 | L269: 9 | M269: =(K269*6)+L269 -> 81 | O269: 15 | P269: 12 | Q269: =(O269*6)+P269 -> 102 | W269: FRANKSTON | X269: 2 | Y269: 2 | Z269: 0 | AA269: 473 | AB269: 398 | AC269: =(AA269/AB269)*100 -> 118.84422110552764 | AD269: =(X269*4)+(Z269*2) -> 8
A270: BEST PLAYERS | W270: CARLTON | X270: 2 | Y270: 2 | Z270: 0 | AA270: 449 | AB270: 383 | AC270: =(AA270/AB270)*100 -> 117.23237597911226 | AD270: =(X270*4)+(Z270*2) -> 8
A271: PORT MELBOURNE | C271: ARNOLD | F271: FILANDIA | I271: SANGSTER | L271: FRANCIS | O271: KIRK | Q271: GOODALE
A272: FRANKSTON | C272: CLARKE | F272: GEORGIOU | I272: McCORMACK | L272: BURNELL | O272: BURGMAN | W272: PORT MELBOURNE | X272: 2 | Y272: 2 | Z272: 0 | AA272: 393 | AB272: 384 | AC272: =(AA272/AB272)*100 -> 102.34375 | AD272: =(X272*4)+(Z272*2) -> 8
A273: GOALKICKERS | Q273: FILANDIA | W273: ESSENDON | X273: 2 | Y273: 2 | Z273: 0 | AA273: 459 | AB273: 453 | AC273: =(AA273/AB273)*100 -> 101.32450331125828 | AD273: =(X273*4)+(Z273*2) -> 8
A274: PORT MELBOURNE | C274: CROW 4 | E274: O'KEEFE 2 | G274: NAISH 2 | I274: ALLISON 2 | K274: ARNOLD 2 | M274: GREENHAM | P274: SANGSTER | R274: KIRK | W274: COLLINGWOOD | X274: 2 | Y274: 2 | Z274: 0 | AA274: 417 | AB274: 459 | AC274: =(AA274/AB274)*100 -> 90.849673202614383 | AD274: =(X274*4)+(Z274*2) -> 8
A275: FRANKSTON | C275: CLARKE 7 | E275: WELSH 3 | H275: McCORMACK | K275: BURNELL | M275: SMITH | O275: ** | Q275: (2 GOALS SHORT) | W275: WERRIBEE | X275: 1 | Y275: 2 | Z275: 1 | AA275: 420 | AB275: 407 | AC275: =(AA275/AB275)*100 -> 103.19410319410321 | AD275: =(X275*4)+(Z275*2) -> 6
W276: COBURG | X276: 1 | Y276: 3 | Z276: 0 | AA276: 379 | AB276: 392 | AC276: =(AA276/AB276)*100 -> 96.683673469387756 | AD276: =(X276*4)+(Z276*2) -> 4
A277: GEELONG | C277: 6 | D277: 7 | E277: =(C277*6)+D277 -> 43 | G277: 8 | H277: 10 | I277: =(G277*6)+H277 -> 58 | K277: 14 | L277: 16 | M277: =(K277*6)+L277 -> 100 | O277: 16 | P277: 21 | Q277: =(O277*6)+P277 -> 117 | S277: Venue: WAVERLEY | W277: PRESTON | X277: 1 | Y277: 3 | Z277: 0 | AA277: 293 | AB277: 585 | AC277: =(AA277/AB277)*100 -> 50.085470085470085 | AD277: =(X277*4)+(Z277*2) -> 4
A278: SPRINGVALE | C278: 3 | D278: 1 | E278: =(C278*6)+D278 -> 19 | G278: 6 | H278: 3 | I278: =(G278*6)+H278 -> 39 | K278: 9 | L278: 5 | M278: =(K278*6)+L278 -> 59 | O278: 10 | P278: 6 | Q278: =(O278*6)+P278 -> 66 | W278: SPRINGVALE | X278: 0 | Y278: 3 | Z278: 1 | AA278: 314 | AB278: 441 | AC278: =(AA278/AB278)*100 -> 71.201814058956913 | AD278: =(X278*4)+(Z278*2) -> 2
A279: BEST PLAYERS | W279: RICHMOND | X279: 0 | Y279: 4 | Z279: 0 | AA279: 359 | AB279: 578 | AC279: =(AA279/AB279)*100 -> 62.110726643598611 | AD279: =(X279*4)+(Z279*2) -> 0
A280: GEELONG | C280: LING | F280: LINDSAY | I280: HALL | K280: PICKERING | N280: WOJCINSKI | Q280: T LYNCH | W280: MURRAY KANGAROOS | X280: 0 | Y280: 4 | Z280: 0 | AA280: 264 | AB280: 502 | AC280: =(AA280/AB280)*100 -> 52.589641434262944 | AD280: =(X280*4)+(Z280*2) -> 0
A281: SPRINGVALE | C281: O'BRIEN | F281: LITTLE | I281: TROLLOPE | K281: DELARUE | N281: CARROLL | Q281: SHAW-DENNIS | W281: BENDIGO | X281: 0 | Y281: 4 | Z281: 0 | AA281: 275 | AB281: 541 | AC281: =(AA281/AB281)*100 -> 50.831792975970423 | AD281: =(X281*4)+(Z281*2) -> 0
A282: GOALKICKERS
A283: GEELONG | C283: LING 5 | F283: HALL 4 | I283: COWELL 3 | L283: BRAY 2 | N283: CHAPMAN | Q283: FOSTER
A284: SPRINGVALE | C284: SMITH 2 | F284: DILLON 2 | I284: IRISH 2 | L284: LOGAN | N284: PITT | P284: CLARK | R284: DELARUE
A286: WILLIAMSTOWN | C286: 5 | D286: 2 | E286: =(C286*6)+D286 -> 32 | G286: 10 | H286: 5 | I286: =(G286*6)+H286 -> 65 | K286: 14 | L286: 9 | M286: =(K286*6)+L286 -> 93 | O286: 20 | P286: 11 | Q286: =(O286*6)+P286 -> 131 | S286: Venue: WILLIAMSTOWN
A287: RICHMOND | C287: 3 | D287: 4 | E287: =(C287*6)+D287 -> 22 | G287: 7 | H287: 9 | I287: =(G287*6)+H287 -> 51 | K287: 11 | L287: 13 | M287: =(K287*6)+L287 -> 79 | O287: 14 | P287: 15 | Q287: =(O287*6)+P287 -> 99
A288: BEST PLAYERS
A289: WILLIAMSTOWN | C289: LLOYD | F289: CAPE | I289: SMOKER | K289: ANDERSON | N289: ROUND | Q289: GHAZI
A290: RICHMOND | C290: VARDY | F290: WHITE | I290: POYAS | K290: M EDWARDS
A291: GOALKICKERS | C291: * | D291: (1 GOAL TOO MANY ) | T291: McMAHON
A292: WILLIAMSTOWN | C292: GHAZI 4 | E292: BOWDEN 3 | H292: HOLLOW 2 | J292: P DOOLEY 2 | M292: TAYLOR 2 | O292: ROUND | Q292: CAPE | R292: ROBBINS | U292: ANDERSON | X292: PLUNKETT | AA292: CROFT | AC292: BROWN
A293: RICHMOND | C293: POYAS 3 | F293: WHITE 3 | I293: HAYNES 2 | L293: M EDWARDS 2 | O293: PROCTOR | Q293: JAMES | S293: FIORA | U293: MERENDA
A295: SANDRINGHAM | C295: 7 | D295: 2 | E295: =(C295*6)+D295 -> 44 | G295: 11 | H295: 4 | I295: =(G295*6)+H295 -> 70 | K295: 13 | L295: 9 | M295: =(K295*6)+L295 -> 87 | O295: 17 | P295: 13 | Q295: =(O295*6)+P295 -> 115 | S295: Venue: COBURG
A296: COBURG | C296: 4 | D296: 0 | E296: =(C296*6)+D296 -> 24 | G296: 5 | H296: 3 | I296: =(G296*6)+H296 -> 33 | K296: 10 | L296: 6 | M296: =(K296*6)+L296 -> 66 | O296: 11 | P296: 10 | Q296: =(O296*6)+P296 -> 76
A297: BEST PLAYERS
A298: SANDRINGHAM | C298: COGHLAN | F298: CLARK | I298: GODFREY | L298: L OAKLEY | O298: WHEATLEY | R298: TAYLOR
A299: COBURG | C299: DEPASQUALE | F299: McKENZIE-McHARG | J299: HOGG | L299: RYAN | O299: OPPENLANDER
A300: GOALKICKERS | S300: RAMSAY
A301: SANDRINGHAM | C301: LAMB 2 | E301: B OAKLEY 2 | H301: HAYWARD 2 | K301: SPEERS 2 | M301: LIDDELL 2 | O301: KENNEDY | Q301: MACGEORGE | T301: SAUTNER | W301: COLLINS | X301: TEMPLETON | AA301: GODFREY | AC301: GRANT
A302: COBURG | C302: LOCK 3 | F302: CANNING 2 | I302: OPPENLANDER | L302: KEENAN | N302: BOSSI | P302: HOGG | R302: WILLOUGHBY | V302: ALOI
A304: CARLTON | C304: 7 | D304: 7 | E304: =(C304*6)+D304 -> 49 | G304: 12 | H304: 8 | I304: =(G304*6)+H304 -> 80 | K304: 16 | L304: 10 | M304: =(K304*6)+L304 -> 106 | O304: 22 | P304: 12 | Q304: =(O304*6)+P304 -> 144 | S304: Venue: M.C.G. (C/R)
A305: ESSENDON | C305: 0 | D305: 2 | E305: =(C305*6)+D305 -> 2 | G305: 4 | H305: 7 | I305: =(G305*6)+H305 -> 31 | K305: 10 | L305: 10 | M305: =(K305*6)+L305 -> 70 | O305: 13 | P305: 13 | Q305: =(O305*6)+P305 -> 91
A306: BEST PLAYERS
A307: CARLTON | C307: HICKMONT | F307: MERRINGTON | I307: CARROLL | L307: HULME | O307: SEXTON
A308: ESSENDON | C308: LALICH | F308: BOLTON | I308: JACOBS | L308: HENNEMAN
A309: GOALKICKERS
A310: CARLTON | C310: CARROLL 6 | F310: PASSADOR 5 | I310: KELLY 2 | K310: HOULIHAN 2 | N310: MERRINGTON 2 | R310: DOERING | U310: BACKWELL | X310: NELSON | Z310: HULME | AB310: DUKES
A311: ESSENDON | C311: McVEIGH 3 | F311: PODSIADLY 2 | I311: SWITALE 2 | L311: LALICH 2 | O311: PICKETT | Q311: EASTAUGH | T311: LADHAMS | W311: D JOHNSON
A313: BOX HILL | C313: 6 | D313: 3 | E313: =(C313*6)+D313 -> 39 | G313: 9 | H313: 11 | I313: =(G313*6)+H313 -> 65 | K313: 11 | L313: 14 | M313: =(K313*6)+L313 -> 80 | O313: 15 | P313: 19 | Q313: =(O313*6)+P313 -> 109 | S313: Venue: BOX HILL
A314: COLLINGWOOD | C314: 2 | D314: 2 | E314: =(C314*6)+D314 -> 14 | G314: 6 | H314: 5 | I314: =(G314*6)+H314 -> 41 | K314: 13 | L314: 7 | M314: =(K314*6)+L314 -> 85 | O314: 13 | P314: 10 | Q314: =(O314*6)+P314 -> 88
A315: BEST PLAYERS
A316: BOX HILL | C316: MANN | F316: TRELEVEN | I316: BREWER | L316: BOWYER | O316: O'FARRELL | R316: PUGSLEY
A317: COLLINGWOOD | C317: PATTERSON | F317: BAYNES | I317: SMITH | L317: MARTELLO | O317: ANSTEY
A318: GOALKICKERS
A319: BOX HILL | C319: BANKS 2 | E319: O'FARRELL 2 | H319: TRELEVEN 2 | K319: BAIRD | M319: BOWYER | O319: BREWER | Q319: HARTIN | S319: JENKINS | V319: LOATS | X319: McCARTNEY | AA319: PICIAONE | AC319: PUGSLEY
A320: COLLINGWOOD | C320: TOOVEY 3 | F320: BAYNES 2 | I320: MARTELLO 2 | L320: TUCKEY 2 | O320: PATTERSON | R320: SMITH | T320: OBORNE | W320: ROACH
A322: ST KILDA | C322: 4 | D322: 12 | E322: =(C322*6)+D322 -> 36 | G322: 9 | H322: 14 | I322: =(G322*6)+H322 -> 68 | K322: 14 | L322: 15 | M322: =(K322*6)+L322 -> 99 | O322: 19 | P322: 16 | Q322: =(O322*6)+P322 -> 130 | S322: Venue: MOORABBIN
A323: MURRAY KANGAROOS | C323: 1 | D323: 3 | E323: =(C323*6)+D323 -> 9 | G323: 4 | H323: 4 | I323: =(G323*6)+H323 -> 28 | K323: 6 | L323: 7 | M323: =(K323*6)+L323 -> 43 | O323: 7 | P323: 8 | Q323: =(O323*6)+P323 -> 50
A324: BEST PLAYERS
A325: ST KILDA | C325: KNOWLES | F325: YOUNG | I325: MOYLE | L325: HAZELWOOD | O325: PITTS | Q325: ELLIOTT
A326: MURRAY KANGAROOS | C326: ANDERSON | F326: HILTON | I326: COCHRANE | L326: STEPHENS | O326: TEAGUE | Q326: VAN DER KLOOSTER
A327: GOALKICKERS
A328: ST KILDA | C328: ELLIOTT 4 | E328: MILNE 3 | G328: SCHWARZE 2 | J328: YOUNG 2 | L328: HEATLEY 2 | N328: KNOWLES | P328: CRANAGE | R328: WULF | T328: MOYLE | W328: HAZELWOOD | Y328: PITTS
A329: MURRAY KANGAROOS | C329: STEPHENS 3 | F329: ANDERSON | I329: YOUNIE | K329: BOVALINO | N329: THOMPSON
D330: 10TH APRIL | H330: NIGHT MATCH | K330: WEATHER
A331: WERRIBEE | C331: 5 | D331: 5 | E331: =(C331*6)+D331 -> 35 | G331: 13 | H331: 11 | I331: =(G331*6)+H331 -> 89 | K331: 15 | L331: 17 | M331: =(K331*6)+L331 -> 107 | O331: 18 | P331: 22 | Q331: =(O331*6)+P331 -> 130 | S331: Venue: WAVERLEY
A332: PRESTON | C332: 3 | D332: 2 | E332: =(C332*6)+D332 -> 20 | G332: 7 | H332: 3 | I332: =(G332*6)+H332 -> 45 | K332: 9 | L332: 4 | M332: =(K332*6)+L332 -> 58 | O332: 10 | P332: 8 | Q332: =(O332*6)+P332 -> 68
A333: BEST PLAYERS
A334: WERRIBEE | C334: ATKINS | F334: SAUNDERS | I334: MITCHELL | L334: S SMITH | O334: FAULKNER | R334: FULLER
A335: PRESTON | C335: CUSACK | F335: CANN | I335: GIBSON | L335: MITCHELL | O335: LEE | R335: V EVANS
A336: GOALKICKERS
A337: WERRIBEE | C337: MITCHELL 6 | F337: WIGGINS 4 | I337: DYER 2 | K337: ATKINS | M337: FULLER | O337: ROBERTSON | R337: PENNY | T337: ALVEY | W337: GOODEY
A338: PRESTON | C338: CARACELLA 2 | F338: LEE 2 | H338: FROST | J338: CANN | L338: GIBSON | N338: SCANLON | P338: MOYLE | R338: CUSACK
A340: ROUND 5 | D340: 15TH APRIL | J340: WEATHER
D341: 1ST QTR | H341: 2ND QTR | L341: 3RD QTR | P341: FINAL | S341: Venue: OPTUS OVAL (C/R)
A342: WERRIBEE | C342: 3 | D342: 2 | E342: =(C342*6)+D342 -> 20 | G342: 10 | H342: 7 | I342: =(G342*6)+H342 -> 67 | K342: 12 | L342: 9 | M342: =(K342*6)+L342 -> 81 | O342: 17 | P342: 15 | Q342: =(O342*6)+P342 -> 117 | S342: UMPIRES | Y342: LADDER | AB342: ROUND | AD342: 5
A343: CARLTON | C343: 7 | D343: 2 | E343: =(C343*6)+D343 -> 44 | G343: 9 | H343: 3 | I343: =(G343*6)+H343 -> 57 | K343: 14 | L343: 7 | M343: =(K343*6)+L343 -> 91 | O343: 16 | P343: 13 | Q343: =(O343*6)+P343 -> 109
A344: BEST PLAYERS | W344: TEAM | X344: W | Y344: L | Z344: D | AA344: FOR | AB344: AGST | AC344: % | AD344: PTS
A345: WERRIBEE | C345: PULI | F345: ATKINS | I345: FROST | L345: MURPHY | N345: WIGGINS | Q345: ALVEY
A346: CARLTON | C346: SEXTON | F346: CULPIT | I346: O'REILLY | L346: MERRINGTON | W346: SANDRINGHAM | X346: 5 | Y346: 0 | Z346: 0 | AA346: 636 | AB346: 335 | AC346: =(AA346/AB346)*100 -> 189.85074626865674 | AD346: =(X346*4)+(Z346*2) -> 20
A347: GOALKICKERS | J347: SAUNDERS | M347: FULLER | O347: PULI | Q347: GILBEE | W347: ST KILDA | X347: 5 | Y347: 0 | Z347: 0 | AA347: 662 | AB347: 386 | AC347: =(AA347/AB347)*100 -> 171.50259067357513 | AD347: =(X347*4)+(Z347*2) -> 20
A348: WERRIBEE | C348: WIGGINS 5 | F348: ROBERTSON 2 | I348: PENNY | K348: SMITH | M348: FROST | N348: ALVEY | P348: WILLS | R348: ATKINS | W348: GEELONG | X348: 5 | Y348: 0 | Z348: 0 | AA348: 601 | AB348: 370 | AC348: =(AA348/AB348)*100 -> 162.43243243243245 | AD348: =(X348*4)+(Z348*2) -> 20
A349: CARLTON | C349: MERRINGTON 5 | F349: O'REILLY 2 | I349: CULPIT 2 | K349: DELULIO | M349: MATTHEWS | P349: KELLY | R349: DOERING | W349: WILLIAMSTOWN | X349: 5 | Y349: 0 | Z349: 0 | AA349: 614 | AB349: 413 | AC349: =(AA349/AB349)*100 -> 148.6682808716707 | AD349: =(X349*4)+(Z349*2) -> 20
J350: O'LOUGHLIN | M350: CARROLL | P350: WITHERS | W350: BOX HILL | X350: 5 | Y350: 0 | Z350: 0 | AA350: 582 | AB350: 419 | AC350: =(AA350/AB350)*100 -> 138.90214797136039 | AD350: =(X350*4)+(Z350*2) -> 20
A351: ST KILDA | C351: 6 | D351: 4 | E351: =(C351*6)+D351 -> 40 | G351: 8 | H351: 9 | I351: =(G351*6)+H351 -> 57 | K351: 13 | L351: 12 | M351: =(K351*6)+L351 -> 90 | O351: 17 | P351: 15 | Q351: =(O351*6)+P351 -> 117 | S351: Venue: M.C.G. (C/R) | W351: NORTH BALLARAT | X351: 3 | Y351: 2 | Z351: 0 | AA351: 407 | AB351: 303 | AC351: =(AA351/AB351)*100 -> 134.32343234323432 | AD351: =(X351*4)+(Z351*2) -> 12
A352: COLLINGWOOD | C352: 2 | D352: 2 | E352: =(C352*6)+D352 -> 14 | G352: 5 | H352: 7 | I352: =(G352*6)+H352 -> 37 | K352: 6 | L352: 10 | M352: =(K352*6)+L352 -> 46 | O352: 9 | P352: 15 | Q352: =(O352*6)+P352 -> 69 | W352: FRANKSTON | X352: 3 | Y352: 2 | Z352: 0 | AA352: 608 | AB352: 509 | AC352: =(AA352/AB352)*100 -> 119.44990176817289 | AD352: =(X352*4)+(Z352*2) -> 12
A353: BEST PLAYERS | W353: WERRIBEE | X353: 2 | Y353: 2 | Z353: 1 | AA353: 537 | AB353: 516 | AC353: =(AA353/AB353)*100 -> 104.06976744186048 | AD353: =(X353*4)+(Z353*2) -> 10
A354: ST KILDA | C354: WALTON | F354: HEATLEY | I354: CRANAGE | L354: RYAN | N354: BAKER | Q354: ELLIOTT
A355: COLLINGWOOD | C355: BAYNES | F355: DIMMATINA | I355: JOHNSON | L355: MARTELLO | N355: SCOTLAND | Q355: SMITH | W355: CARLTON | X355: 2 | Y355: 3 | Z355: 0 | AA355: 558 | AB355: 500 | AC355: =(AA355/AB355)*100 -> 111.6 | AD355: =(X355*4)+(Z355*2) -> 8
A356: GOALKICKERS | Q356: McMASTER | W356: COBURG | X356: 2 | Y356: 3 | Z356: 0 | AA356: 483 | AB356: 459 | AC356: =(AA356/AB356)*100 -> 105.22875816993465 | AD356: =(X356*4)+(Z356*2) -> 8
A357: ST KILDA | C357: HEATLEY 8 | F357: MILNE 2 | H357: CRANAGE 2 | K357: FORTNAM | M357: HAZELMAN | P357: WALTON | R357: WAKELIN | W357: PORT MELBOURNE | X357: 2 | Y357: 3 | Z357: 0 | AA357: 468 | AB357: 515 | AC357: =(AA357/AB357)*100 -> 90.873786407766985 | AD357: =(X357*4)+(Z357*2) -> 8
A358: COLLINGWOOD | C358: MARTELLO 2 | F358: PATTERSON | I358: JACOTINE | K358: OBORNE | M358: BAYNES | O358: HAWKING | Q358: TOOVEY | S358: DAVIS | W358: ESSENDON | X358: 2 | Y358: 3 | Z358: 0 | AA358: 519 | AB358: 592 | AC358: =(AA358/AB358)*100 -> 87.668918918918919 | AD358: =(X358*4)+(Z358*2) -> 8
W359: COLLINGWOOD | X359: 2 | Y359: 3 | Z359: 0 | AA359: 486 | AB359: 576 | AC359: =(AA359/AB359)*100 -> 84.375 | AD359: =(X359*4)+(Z359*2) -> 8
A360: WILLIAMSTOWN | C360: 7 | D360: 4 | E360: =(C360*6)+D360 -> 46 | G360: 8 | H360: 6 | I360: =(G360*6)+H360 -> 54 | K360: 11 | L360: 9 | M360: =(K360*6)+L360 -> 75 | O360: 15 | P360: 12 | Q360: =(O360*6)+P360 -> 102 | S360: Venue: WAVERLEY | W360: MURRAY KANGAROOS | X360: 1 | Y360: 4 | Z360: 0 | AA360: 354 | AB360: 575 | AC360: =(AA360/AB360)*100 -> 61.565217391304351 | AD360: =(X360*4)+(Z360*2) -> 4
A361: SPRINGVALE | C361: 0 | D361: 3 | E361: =(C361*6)+D361 -> 3 | G361: 2 | H361: 5 | I361: =(G361*6)+H361 -> 17 | K361: 3 | L361: 8 | M361: =(K361*6)+L361 -> 26 | O361: 8 | P361: 9 | Q361: =(O361*6)+P361 -> 57 | W361: PRESTON | X361: 1 | Y361: 4 | Z361: 0 | AA361: 404 | AB361: 720 | AC361: =(AA361/AB361)*100 -> 56.111111111111114 | AD361: =(X361*4)+(Z361*2) -> 4
A362: BEST PLAYERS | W362: SPRINGVALE | X362: 0 | Y362: 4 | Z362: 1 | AA362: 371 | AB362: 543 | AC362: =(AA362/AB362)*100 -> 68.324125230202583 | AD362: =(X362*4)+(Z362*2) -> 2
A363: WILLIAMSTOWN | C363: ANDERSON | F363: MACRI | I363: BROWN | L363: LLOYD | N363: P DOOLEY | Q363: WOOD | W363: RICHMOND | X363: 0 | Y363: 5 | Z363: 0 | AA363: 432 | AB363: 668 | AC363: =(AA363/AB363)*100 -> 64.670658682634723 | AD363: =(X363*4)+(Z363*2) -> 0
A364: SPRINGVALE | C364: LITTLE | F364: ROBBINS | I364: TROLLOPE | L364: SHEAHAN | N364: COURTNEY | Q364: CLARK | W364: BENDIGO | X364: 0 | Y364: 5 | Z364: 0 | AA364: 342 | AB364: 645 | AC364: =(AA364/AB364)*100 -> 53.023255813953483 | AD364: =(X364*4)+(Z364*2) -> 0
A365: GOALKICKERS
A366: WILLIAMSTOWN | C366: MACRI 6 | E366: LLOYD 2 | G366: PLUNKETT 2 | J366: GHAZI | L366: P DOOLEY | N366: CROFT | P366: TAYLOR | R366: M WEST
A367: SPRINGVALE | C367: ROBBINS 2 | F367: SMITH 2 | I367: COURTNEY | K367: CARMODY | M367: HARRISON | O367: LOGAN
A369: COBURG | C369: 2 | D369: 3 | E369: =(C369*6)+D369 -> 15 | G369: 11 | H369: 7 | I369: =(G369*6)+H369 -> 73 | K369: 12 | L369: 10 | M369: =(K369*6)+L369 -> 82 | O369: 15 | P369: 14 | Q369: =(O369*6)+P369 -> 104 | S369: Venue: COBURG
A370: BENDIGO | C370: 4 | D370: 3 | E370: =(C370*6)+D370 -> 27 | G370: 6 | H370: 4 | I370: =(G370*6)+H370 -> 40 | K370: 9 | L370: 10 | M370: =(K370*6)+L370 -> 64 | O370: 9 | P370: 13 | Q370: =(O370*6)+P370 -> 67
A371: BEST PLAYERS
A372: COBURG | C372: DRYDEN | F372: RYAN | I372: HOGG | L372: DEPASQUALE | O372: CANNING
A373: BENDIGO | C373: TOOHEY | F373: GEDDES | I373: O'TOOLE | L373: PINNER | O373: SUTHERLAND | R373: TOINTON
A374: GOALKICKERS
A375: COBURG | C375: CANNING 4 | F375: WILLOUGHBY 3 | J375: HOGG 2 | L375: ALOI | M375: KEENAN | O375: LANG | Q375: LOCK | R375: LAPPIN | T375: TORTORA
A376: BENDIGO | C376: O'TOOLE 2 | F376: BOSWORTH | I376: DIXON | K376: MITROVIC | M376: O'CALLAGHAN | P376: PROWSE | R376: WALSH | T376: SHIELS
A378: SANDRINGHAM | C378: 5 | D378: 2 | E378: =(C378*6)+D378 -> 32 | G378: 9 | H378: 6 | I378: =(G378*6)+H378 -> 60 | K378: 11 | L378: 10 | M378: =(K378*6)+L378 -> 76 | O378: 19 | P378: 17 | Q378: =(O378*6)+P378 -> 131 | S378: Venue: BEACH ROAD
A379: PORT MELBOURNE | C379: 2 | D379: 0 | E379: =(C379*6)+D379 -> 12 | G379: 4 | H379: 1 | I379: =(G379*6)+H379 -> 25 | K379: 9 | L379: 6 | M379: =(K379*6)+L379 -> 60 | O379: 11 | P379: 9 | Q379: =(O379*6)+P379 -> 75
A380: BEST PLAYERS
A381: SANDRINGHAM | C381: TREGEAR | F381: WARD | I381: COGHLAN | L381: NICHOLSON | O381: MACGEORGE | R381: FEBEY
A382: PORT MELBOURNE | C382: KIRK | F382: MATTHEWS-HERALD | J382: GOODALE | M382: O;KEEFE
A383: GOALKICKERS
A384: SANDRINGHAM | C384: HAYWARD 3 | F384: PITT 3 | H384: COLLINS 2 | J384: OAKLEY 2 | M384: KENNEDY 2 | P384: GODFREY | R384: CHISHOLM | U384: LAMB | W384: FEBEY | X384: LIDDELL | AA384: TAYLOR | AC384: SPEERS
A385: PORT MELBOURNE | C385: FOSDIKE 2 | F385: NAISH 2 | I385: ARNOLD | K385: DOYLE | M385: FEAST | N385: FOLINO | P385: PATERSON | R385: SANGSTER | U385: WEBB
F386: NIGHT MATCH
A387: BOX HILL | C387: 3 | D387: 2 | E387: =(C387*6)+D387 -> 20 | G387: 7 | H387: 8 | I387: =(G387*6)+H387 -> 50 | K387: 8 | L387: 13 | M387: =(K387*6)+L387 -> 61 | O387: 12 | P387: 15 | Q387: =(O387*6)+P387 -> 87 | S387: Venue: NORTH BALLARAT
A388: NORTH BALLARAT | C388: 2 | D388: 0 | E388: =(C388*6)+D388 -> 12 | G388: 5 | H388: 5 | I388: =(G388*6)+H388 -> 35 | K388: 10 | L388: 7 | M388: =(K388*6)+L388 -> 67 | O388: 12 | P388: 10 | Q388: =(O388*6)+P388 -> 82
A389: BEST PLAYERS
A390: BOX HILL | C390: KRUMMEL | F390: CHAPMAN | I390: BREWER | L390: FINNOCHAIRO | O390: PICIAONE | R390: HARTIN
A391: NORTH BALLARAT | C391: FIELD | F391: MURRIHY | I391: FUNCKE | L391: GREIG | N391: J POLKINGHORNE | R391: POWER
A392: GOALKICKERS
A393: BOX HILL | C393: BANKS 3 | F393: BATEMAN 2 | I393: KRUMMEL 2 | L393: HARTIN | N393: BREWER | P393: FINNOCHAIRO | S393: COX | U393: MANN
A394: NORTH BALLARAT | C394: N/A
D395: 16TH APRIL | J395: WEATHER
A396: FRANKSTON | C396: 3 | D396: 3 | E396: =(C396*6)+D396 -> 21 | G396: 10 | H396: 10 | I396: =(G396*6)+H396 -> 70 | K396: 13 | L396: 11 | M396: =(K396*6)+L396 -> 89 | O396: 20 | P396: 15 | Q396: =(O396*6)+P396 -> 135 | S396: Venue: FRANKSTON
A397: PRESTON | C397: 5 | D397: 3 | E397: =(C397*6)+D397 -> 33 | G397: 8 | H397: 4 | I397: =(G397*6)+H397 -> 52 | K397: 13 | L397: 8 | M397: =(K397*6)+L397 -> 86 | O397: 17 | P397: 9 | Q397: =(O397*6)+P397 -> 111
A398: BEST PLAYERS
A399: FRANKSTON | C399: McCORMACK | F399: SMITH | I399: LAWRENCE | L399: MURRAY | N399: CLARK | Q399: ROBERTS
A400: PRESTON | C400: GRAINGER | F400: CANN | I400: CUSACK | L400: ZORZI | N400: LEE | Q400: FROST
A401: GOALKICKERS
A402: FRANKSTON | C402: McCORMACK 7 | F402: SMITH 4 | H402: WILLIAMS 2 | K402: HOSE | M402: MURRAY | O402: LAWRENCE | R402: SULLIVAN | U402: WELSH | X402: ANDERSON | AA402: DAM CLARKE
A403: PRESTON | C403: McINTOSH 4 | F403: GIBSON 2 | I403: CANN 2 | K403: SCANLON 2 | N403: HILL 2 | P403: FROST | R403: CARACELLA | U403: CLAYTON | X403: GROSSMAN | AA403: LEE
A405: MURRAY KANGAROOS | C405: 2 | D405: 2 | E405: =(C405*6)+D405 -> 14 | G405: 5 | H405: 7 | I405: =(G405*6)+H405 -> 37 | K405: 9 | L405: 8 | M405: =(K405*6)+L405 -> 62 | O405: 13 | P405: 12 | Q405: =(O405*6)+P405 -> 90 | S405: Venue: LAVINGTON
A406: RICHMOND | C406: 6 | D406: 1 | E406: =(C406*6)+D406 -> 37 | G406: 8 | H406: 2 | I406: =(G406*6)+H406 -> 50 | K406: 11 | L406: 3 | M406: =(K406*6)+L406 -> 69 | O406: 11 | P406: 7 | Q406: =(O406*6)+P406 -> 73
A407: BEST PLAYERS
A408: MURRAY KANGAROOS | C408: MOTLOP | F408: VAN DER KLOOSTER | J408: CHANDLER | M408: COCHRANE | P408: STEPHENS | R408: HILTON
A409: RICHMOND | C409: VARDY | F409: JAMES | I409: POYAS | K409: TAYLOR
A410: GOALKICKERS
A411: MURRAY KANGAROOS | C411: SHOLL 3 | F411: KINGSLEY 3 | I411: PILTZ 2 | K411: WILLETT | M411: TEAGUE | O411: YOUNIE | Q411: RAWLINGS | T411: VAVALINO
A412: RICHMOND | C412: JAMES 4 | F412: GREIG 2 | I412: TAYLOR 2 | L412: T EDWATRDS | O412: M EDWARDS | R412: ARTHURSON
D413: 17TH APRIL | H413: NIGHT MATCH | K413: WEATHER
A414: GEELONG | C414: 3 | D414: 5 | E414: =(C414*6)+D414 -> 23 | G414: 10 | H414: 7 | I414: =(G414*6)+H414 -> 67 | K414: 15 | L414: 13 | M414: =(K414*6)+L414 -> 103 | O414: 20 | P414: 19 | Q414: =(O414*6)+P414 -> 139 | S414: Venue: WAVERLEY
A415: ESSENDON | C415: 1 | D415: 3 | E415: =(C415*6)+D415 -> 9 | G415: 6 | H415: 4 | I415: =(G415*6)+H415 -> 40 | K415: 8 | L415: 4 | M415: =(K415*6)+L415 -> 52 | O415: 9 | P415: 6 | Q415: =(O415*6)+P415 -> 60
A416: BEST PLAYERS
A417: GEELONG | C417: PICKERING | F417: McKAY | I417: CHAPMAN | L417: ENRIGHT | N417: T LYNCH | Q417: COWELL
A418: ESSENDON | C418: LADHAMS | F418: HENNEMAN | I418: BERBOKOV | L418: PEVERILL | N418: FRASER | Q418: ROBRAN
A419: GOALKICKERS
A420: GEELONG | C420: ENRIGHT 4 | F420: HALL 2 | H420: CHAPMAN 2 | K420: LING 2 | M420: BALDWIN 2 | P420: RYAN 2 | R420: BRAY 2 | T420: T CLARK 2 | W420: PICKERING | X420: CORRIGAN
A421: ESSENDON | C421: BERBAKOV 2 | F421: FRASER 2 | I421: LALICH | K421: EASTAUGH | N421: ROBRAN
A423: ROUND 6 | D423: 20TH APRIL | G423: NIGHT MATCH | J423: WEATHER
D424: 1ST QTR | H424: 2ND QTR | L424: 3RD QTR | P424: FINAL
A425: NORTH BALLARAT | C425: 5 | D425: 6 | E425: =(C425*6)+D425 -> 36 | G425: 7 | H425: 10 | I425: =(G425*6)+H425 -> 52 | K425: 8 | L425: 12 | M425: =(K425*6)+L425 -> 60 | O425: 11 | P425: 13 | Q425: =(O425*6)+P425 -> 79 | S425: Venue: NORTH BALLARAT | Y425: LADDER | AB425: ROUND | AD425: 6
A426: FRANKSTON | C426: 3 | D426: 2 | E426: =(C426*6)+D426 -> 20 | G426: 4 | H426: 4 | I426: =(G426*6)+H426 -> 28 | K426: 8 | L426: 8 | M426: =(K426*6)+L426 -> 56 | O426: 9 | P426: 10 | Q426: =(O426*6)+P426 -> 64
A427: BEST PLAYERS | W427: TEAM | X427: W | Y427: L | Z427: D | AA427: FOR | AB427: AGST | AC427: % | AD427: PTS
A428: NORTH BALLARAT | C428: MURRIHY | F428: FIELD | I428: GREIG | L428: FUNCKE | O428: MOLONEY
A429: FRANKSTON | C429: BURGMAN | F429: McCORMACK | I429: MERCHAN | L429: LAWRENCE | O429: GEORGIOU | W429: ST KILDA | X429: 6 | Y429: 0 | Z429: 0 | AA429: 758 | AB429: 480 | AC429: =(AA429/AB429)*100 -> 157.91666666666666 | AD429: =(X429*4)+(Z429*2) -> 24
A430: GOALKICKERS | W430: GEELONG | X430: 6 | Y430: 0 | Z430: 0 | AA430: 716 | AB430: 464 | AC430: =(AA430/AB430)*100 -> 154.31034482758622 | AD430: =(X430*4)+(Z430*2) -> 24
A431: NORTH BALLARAT | C431: CLAYTON 2 | F431: FISHER 2 | I431: McDONALD 2 | L431: POWER 2 | N431: FUNCKE | P431: FIELD | R431: SIER | W431: BOX HILL | X431: 6 | Y431: 0 | Z431: 0 | AA431: 690 | AB431: 515 | AC431: =(AA431/AB431)*100 -> 133.98058252427185 | AD431: =(X431*4)+(Z431*2) -> 24
A432: FRANKSTON | C432: MCCORMACK 4 | F432: SMITH 2 | I432: D CLARKE 2 | L432: O'NEIL | W432: SANDRINGHAM | X432: 5 | Y432: 1 | Z432: 0 | AA432: 732 | AB432: 450 | AC432: =(AA432/AB432)*100 -> 162.66666666666666 | AD432: =(X432*4)+(Z432*2) -> 20
D433: 22ND APRIL | J433: WEATHER | W433: WILLIAMSTOWN | X433: 5 | Y433: 1 | Z433: 0 | AA433: 608 | AB433: 509 | AC433: =(AA433/AB433)*100 -> 119.44990176817289 | AD433: =(X433*4)+(Z433*2) -> 20
A434: WERRIBEE | C434: 4 | D434: 4 | E434: =(C434*6)+D434 -> 28 | G434: 7 | H434: 7 | I434: =(G434*6)+H434 -> 49 | K434: 15 | L434: 12 | M434: =(K434*6)+L434 -> 102 | O434: 21 | P434: 17 | Q434: =(O434*6)+P434 -> 143 | S434: Venue: WERRIBEE | W434: NORTH BALLARAT | X434: 4 | Y434: 2 | Z434: 0 | AA434: 486 | AB434: 367 | AC434: =(AA434/AB434)*100 -> 132.42506811989102 | AD434: =(X434*4)+(Z434*2) -> 16
A435: MURRAY KANGAROOS | C435: 6 | D435: 3 | E435: =(C435*6)+D435 -> 39 | G435: 10 | H435: 7 | I435: =(G435*6)+H435 -> 67 | K435: 12 | L435: 8 | M435: =(K435*6)+L435 -> 80 | O435: 14 | P435: 9 | Q435: =(O435*6)+P435 -> 93 | W435: WERRIBEE | X435: 3 | Y435: 2 | Z435: 1 | AA435: 680 | AB435: 609 | AC435: =(AA435/AB435)*100 -> 111.6584564860427 | AD435: =(X435*4)+(Z435*2) -> 14
A436: BEST PLAYERS | W436: CARLTON | X436: 3 | Y436: 3 | Z436: 0 | AA436: 685 | AB436: 576 | AC436: =(AA436/AB436)*100 -> 118.92361111111111 | AD436: =(X436*4)+(Z436*2) -> 12
A437: WERRIBEE | C437: PULI | F437: PENNY | I437: SAUNDERS | L437: FROST | N437: WIGGINS | Q437: MURPHY
A438: MURRAY KANGAROOS | C438: COCHRANE | F438: STEPHENS | I438: RAWLINGS | L438: ABLETT | N438: PITZ | W438: FRANKSTON | X438: 3 | Y438: 3 | Z438: 0 | AA438: 672 | AB438: 588 | AC438: =(AA438/AB438)*100 -> 114.28571428571428 | AD438: =(X438*4)+(Z438*2) -> 12
A439: GOALKICKERS | P439: ATKINS | R439: MITCHELL | W439: COLLINGWOOD | X439: 3 | Y439: 3 | Z439: 0 | AA439: 581 | AB439: 640 | AC439: =(AA439/AB439)*100 -> 90.78125 | AD439: =(X439*4)+(Z439*2) -> 12
A440: WERRIBEE | C440: FULLER 4 | E440: WILLIAMS 4 | H440: PENNY 3 | J440: SAUNDERS 2 | M440: BUTTON 2 | O440: WILLS 2 | Q440: SMITH | S440: CHURCHILL | W440: COBURG | X440: 2 | Y440: 4 | Z440: 0 | AA440: 579 | AB440: 567 | AC440: =(AA440/AB440)*100 -> 102.11640211640211 | AD440: =(X440*4)+(Z440*2) -> 8
A441: MURRAY KANGAROOS | C441: SCHOLL 2 | E441: CALTHORPE 2 | H441: KINGSLEY 2 | J441: LOWTHER 2 | M441: WOODLEY 2 | P441: ABLETT 2 | R441: YOUNIE | T441: SCOTT | W441: PORT MELBOURNE | X441: 2 | Y441: 4 | Z441: 0 | AA441: 549 | AB441: 604 | AC441: =(AA441/AB441)*100 -> 90.894039735099341 | AD441: =(X441*4)+(Z441*2) -> 8
D442: 23RD APRIL | J442: WEATHER | W442: ESSENDON | X442: 2 | Y442: 4 | Z442: 0 | AA442: 583 | AB442: 687 | AC442: =(AA442/AB442)*100 -> 84.861717612809315 | AD442: =(X442*4)+(Z442*2) -> 8
A443: PRESTON | C443: 5 | D443: 2 | E443: =(C443*6)+D443 -> 32 | G443: 8 | H443: 4 | I443: =(G443*6)+H443 -> 52 | K443: 11 | L443: 5 | M443: =(K443*6)+L443 -> 71 | O443: 14 | P443: 13 | Q443: =(O443*6)+P443 -> 97 | S443: Venue: BENDIGO | W443: PRESTON | X443: 2 | Y443: 4 | Z443: 0 | AA443: 501 | AB443: 805 | AC443: =(AA443/AB443)*100 -> 62.236024844720497 | AD443: =(X443*4)+(Z443*2) -> 8
A444: BENDIGO | C444: 1 | D444: 4 | E444: =(C444*6)+D444 -> 10 | G444: 4 | H444: 8 | I444: =(G444*6)+H444 -> 32 | K444: 9 | L444: 17 | M444: =(K444*6)+L444 -> 71 | O444: 11 | P444: 19 | Q444: =(O444*6)+P444 -> 85 | W444: SPRINGVALE | X444: 1 | Y444: 4 | Z444: 1 | AA444: 460 | AB444: 624 | AC444: =(AA444/AB444)*100 -> 73.71794871794873 | AD444: =(X444*4)+(Z444*2) -> 6
A445: BEST PLAYERS | W445: MURRAY KANGAROOS | X445: 1 | Y445: 5 | Z445: 0 | AA445: 447 | AB445: 718 | AC445: =(AA445/AB445)*100 -> 62.256267409470759 | AD445: =(X445*4)+(Z445*2) -> 4
A446: PRESTON | C446: LEE | E446: MANN | G446: McINTOSH | J446: CARACELLA | M446: CLAYTON | P446: SAGE | W446: RICHMOND | X446: 0 | Y446: 6 | Z446: 0 | AA446: 508 | AB446: 795 | AC446: =(AA446/AB446)*100 -> 63.899371069182386 | AD446: =(X446*4)+(Z446*2) -> 0
A447: BENDIGO | C447: GATHERCOLE | F447: GEDDES | I447: CARTER | K447: CUNNINGHAM | N447: O'CALLAGHAN | W447: BENDIGO | X447: 0 | Y447: 6 | Z447: 0 | AA447: 427 | AB447: 742 | AC447: =(AA447/AB447)*100 -> 57.547169811320757 | AD447: =(X447*4)+(Z447*2) -> 0
A448: GOALKICKERS | P448: GIBSON | R448: MOYLE
A449: PRESTON | C449: HILL 2 | E449: McINTOSH 2 | H449: FAVRIN 2 | J449: FROST | L449: MITCHELL | N449: SCANLON | P449: GRAINGER | R449: MANN | T449: LEE
A450: BENDIGO | C450: ARGO 2 | E450: CONNAUGHTON 2 | I450: GEDDES 2 | L450: BROCK SHIELLS 2 | P450: ISON | Q450: PROWSE
O451: BEAU SHIELLS
A452: SPRINGVALE | C452: 3 | D452: 3 | E452: =(C452*6)+D452 -> 21 | G452: 6 | H452: 4 | I452: =(G452*6)+H452 -> 40 | K452: 10 | L452: 7 | M452: =(K452*6)+L452 -> 67 | O452: 13 | P452: 11 | Q452: =(O452*6)+P452 -> 89 | S452: Venue: PORT MELBOURNE
A453: PORT MELBOURNE | C453: 3 | D453: 3 | E453: =(C453*6)+D453 -> 21 | G453: 6 | H453: 6 | I453: =(G453*6)+H453 -> 42 | K453: 9 | L453: 8 | M453: =(K453*6)+L453 -> 62 | O453: 12 | P453: 9 | Q453: =(O453*6)+P453 -> 81
A454: BEST PLAYERS
A455: SPRINGVALE | C455: ROBBINS | F455: O'BRIEN | I455: LOGAN | K455: COURTNEY | N455: SUTHERLAND | Q455: LITTLE
A456: PORT MELBOURNE | C456: O'KEEFE | F456: GOODALE | I456: CREDLIN | K456: FOSDIKE | N456: BENNETT | Q456: MATTHEWS-HERALD
A457: GOALKICKERS
A458: SPRINGVALE | C458: SMITH 4 | E458: JOY 2 | G458: LOGAN 2 | I458: ROBBINS | K458: COURTNEY | N458: O'BRIEN | P458: DELARUE | S458: IRISH
A459: PORT MELBOURNE | C459: O'KEEFE 3 | E459: CREDLIN 2 | G459: ARNOLD | I459: BOSSONG | K459: SALISBURY | N459: SANGSTER | Q459: GREENHAM | T459: NAISH | W459: GOODALE
A461: ST KILDA | C461: 3 | D461: 3 | E461: =(C461*6)+D461 -> 21 | G461: 5 | H461: 7 | I461: =(G461*6)+H461 -> 37 | K461: 13 | L461: 10 | M461: =(K461*6)+L461 -> 88 | O461: 14 | P461: 12 | Q461: =(O461*6)+P461 -> 96 | S461: Venue: WILLIAMSTOWN
A462: WILLIAMSTOWN | C462: 3 | D462: 3 | E462: =(C462*6)+D462 -> 21 | G462: 7 | H462: 7 | I462: =(G462*6)+H462 -> 49 | K462: 10 | L462: 9 | M462: =(K462*6)+L462 -> 69 | O462: 13 | P462: 16 | Q462: =(O462*6)+P462 -> 94
A463: BEST PLAYERS
A464: ST KILDA | C464: BEETHAM | F464: B THOMPSON | I464: PITTS | L464: JONES | N464: MONKHURST | Q464: BLAKE
A465: WILLIAMSTOWN | C465: BROWN | F465: TAYLOR | I465: P DOOLEY | L465: CARRICK | N465: ANDERSON | Q465: T WEST
A466: GOALKICKERS
A467: ST KILDA | C467: WALTON 3 | F467: MILNE 3 | H467: SCHWARZE 2 | K467: CRANAGE 2 | N467: BEETHAM | Q467: PITTS | R467: HEAZELWOOD | V467: JONES
A468: WILLIAMSTOWN | C468: P DOOLEY 4 | F468: KOLYNUIK 3 | I468: BOWDEN 2 | L468: PLUNKETT | N468: TAYLOR | P468: LLOYD | R468: M WEST
A470: BOX HILL | C470: 6 | D470: 8 | E470: =(C470*6)+D470 -> 44 | G470: 10 | H470: 13 | I470: =(G470*6)+H470 -> 73 | K470: 14 | L470: 16 | M470: =(K470*6)+L470 -> 100 | O470: 15 | P470: 18 | Q470: =(O470*6)+P470 -> 108 | S470: Venue: BOX HILL
A471: COBURG | C471: 3 | D471: 1 | E471: =(C471*6)+D471 -> 19 | G471: 8 | H471: 3 | I471: =(G471*6)+H471 -> 51 | K471: 11 | L471: 6 | M471: =(K471*6)+L471 -> 72 | O471: 15 | P471: 6 | Q471: =(O471*6)+P471 -> 96
A472: BEST PLAYERS
A473: BOX HILL | C473: FINNOCHIARO | F473: PICIAONE | I473: LEKKAS | K473: JOHNSON | N473: CHAPMAN | Q473: JENKINS
A474: COBURG | C474: HOGG | F474: CONDON | I474: DRYDEN | K474: RYAN | N474: OPPENLANDER
A475: GOALKICKERS
A476: BOX HILL | C476: LEKKAS 3 | E476: JOHNSON 2 | H476: O'FARRELL 2 | K476: BREWER 2 | M476: COX | N476: TUCK | P476: BANKS | R476: JENKINS | U476: OBST | W476: FINNOCHIARO
A477: COBURG | C477: ALESSIO 3 | F477: CANNING 2 | I477: RYAN 2 | K477: HOGG 2 | M477: LUBIC | N477: CONDON | P477: WILLOUGHBY | S477: LOCK | U477: OPPENLANDER | X477: McKENZIE-McHARG
D478: 19TH MARCH | J478: WEATHER
A479: COLLINGWOOD | C479: 5 | D479: 5 | E479: =(C479*6)+D479 -> 35 | G479: 7 | H479: 7 | I479: =(G479*6)+H479 -> 49 | K479: 11 | L479: 10 | M479: =(K479*6)+L479 -> 76 | O479: 14 | P479: 11 | Q479: =(O479*6)+P479 -> 95 | S479: Venue: VICTORIA PARK
A480: ESSENDON | C480: 1 | D480: 2 | E480: =(C480*6)+D480 -> 8 | G480: 2 | H480: 6 | I480: =(G480*6)+H480 -> 18 | K480: 5 | L480: 6 | M480: =(K480*6)+L480 -> 36 | O480: 9 | P480: 10 | Q480: =(O480*6)+P480 -> 64
A481: BEST PLAYERS
A482: COLLINGWOOD | C482: JOHNSON | F482: BAYNES | I482: DIMMATINA | L482: SCOTLAND | N482: PATTERSON | Q482: GARDINER
A483: ESSENDON | C483: FRASER | F483: McVEIGH | I483: SWITALA | L483: HILLE | N483: PEVERILL
A484: GOALKICKERS
A485: COLLINGWOOD | C485: JOHNSON 3 | F485: PATTERSON | I485: GARDINER | K485: CLARK | M485: LANE | N485: OBORNE | P485: ROACH | R485: SCOTLAND | U485: DIMMATINA | X485: TOOVEY | Z485: GEORGE | AB485: L DAVIS
A486: ESSENDON | C486: EASTAUGH 3 | F486: SWITALA 2 | I486: BERBAKOV | L486: GODDARD | N486: PRIOR | P486: FRASER
D487: 24TH APRIL | H487: NIGHT MATCH | K487: WEATHER
A488: CARLTON | C488: 3 | D488: 4 | E488: =(C488*6)+D488 -> 22 | G488: 5 | H488: 9 | I488: =(G488*6)+H488 -> 39 | K488: 10 | L488: 13 | M488: =(K488*6)+L488 -> 73 | O488: 18 | P488: 19 | Q488: =(O488*6)+P488 -> 127 | S488: Venue: M.C.G. (C/R)
A489: RICHMOND | C489: 3 | D489: 6 | E489: =(C489*6)+D489 -> 24 | G489: 6 | H489: 11 | I489: =(G489*6)+H489 -> 47 | K489: 9 | L489: 13 | M489: =(K489*6)+L489 -> 67 | O489: 10 | P489: 16 | Q489: =(O489*6)+P489 -> 76
A490: BEST PLAYERS
A491: CARLTON | C491: WHITE | F491: O'REILLY | I491: DOERING | L491: CHRISTOU | N491: MANSFIELD | Q491: DELULIO
A492: RICHMOND | C492: POYAS | F492: HALL | I492: DEAN | L492: ZANTUCK
A493: GOALKICKERS
A494: CARLTON | C494: O'REILLY 4 | F494: PASSADOR 4 | I494: MANSFIELD 2 | L494: DUKES 2 | N494: MERRINGTON 2 | Q494: CHATFIELD | T494: WHITE | W494: HOULIHAN | X494: WITHERS
A495: RICHMOND | C495: ZANTUCK 3 | F495: PROCTOR | I495: JAMES | K495: POWELL | M495: EVANS | O495: POYAS | Q495: 2 GOALS SHORT
F496: NIGHT MATCH
A497: GEELONG | C497: 3 | D497: 3 | E497: =(C497*6)+D497 -> 21 | G497: 6 | H497: 7 | I497: =(G497*6)+H497 -> 43 | K497: 10 | L497: 11 | M497: =(K497*6)+L497 -> 71 | O497: 17 | P497: 13 | Q497: =(O497*6)+P497 -> 115 | S497: Venue: WAVERLEY
A498: SANDRINGHAM | C498: 3 | D498: 2 | E498: =(C498*6)+D498 -> 20 | G498: 9 | H498: 4 | I498: =(G498*6)+H498 -> 58 | K498: 10 | L498: 5 | M498: =(K498*6)+L498 -> 65 | O498: 14 | P498: 10 | Q498: =(O498*6)+P498 -> 94
A499: BEST PLAYERS
A500: GEELONG | C500: FOSTER | F500: LINDSAY | I500: LING | L500: T LYNCH | O500: ENRIGHT | R500: ARNOTT
A501: SANDRINGHAM | C501: PITT | F501: BROWN | I501: MACGEORGE | L501: OAKLEY | O501: COGHLAN | R501: NICHOLSON
A502: GOALKICKERS
A503: GEELONG | C503: BALDWIN 4 | F503: ARNOTT 3 | I503: HALL 2 | K503: CHAPMAN 2 | N503: ENRIGHT 2 | Q503: COREY | S503: PICKERING | V503: COWELL | X503: HAY
A504: SANDRINGHAM | C504: PITT 5 | F504: SAUTNER 4 | I504: SPEERS 2 | K504: OAKLEY 2 | N504: MACGEORGE
A506: ROUND 7 | D506: 28TH APRIL | J506: WEATHER
D507: 1ST QTR | H507: 2ND QTR | L507: 3RD QTR | P507: FINAL
A508: CARLTON | C508: 8 | D508: 0 | E508: =(C508*6)+D508 -> 48 | G508: 10 | H508: 7 | I508: =(G508*6)+H508 -> 67 | K508: 11 | L508: 8 | M508: =(K508*6)+L508 -> 74 | O508: 15 | P508: 14 | Q508: =(O508*6)+P508 -> 104 | S508: Venue: MOORABBIN | Y508: LADDER | AB508: ROUND | AD508: 7
A509: ST KILDA | C509: 2 | D509: 3 | E509: =(C509*6)+D509 -> 15 | G509: 2 | H509: 6 | I509: =(G509*6)+H509 -> 18 | K509: 6 | L509: 10 | M509: =(K509*6)+L509 -> 46 | O509: 6 | P509: 12 | Q509: =(O509*6)+P509 -> 48
A510: BEST PLAYERS | W510: TEAM | X510: W | Y510: L | Z510: D | AA510: FOR | AB510: AGST | AC510: % | AD510: PTS
A511: CARLTON | C511: O'REILLY | F511: CHRISTOU | I511: DELUILO | L511: CHATFIELD | O511: DOERING
A512: ST KILDA | C512: BAKER | F512: HEAZELWOOD | I512: CRANAGE | L512: JONES | O512: BLAKE | W512: GEELONG | X512: 7 | Y512: 0 | Z512: 0 | AA512: 811 | AB512: 541 | AC512: =(AA512/AB512)*100 -> 149.90757855822551 | AD512: =(X512*4)+(Z512*2) -> 28
A513: GOALKICKERS | W513: BOX HILL | X513: 7 | Y513: 0 | Z513: 0 | AA513: 785 | AB513: 594 | AC513: =(AA513/AB513)*100 -> 132.15488215488216 | AD513: =(X513*4)+(Z513*2) -> 28
A514: CARLTON | C514: O'REILLY 5 | E514: CARROLL 3 | H514: MERRINGTON 2 | K514: HOULIHAN | M514: DUKES | O514: KELLY | Q514: DOERING | S514: PASSADOR | W514: SANDRINGHAM | X514: 6 | Y514: 1 | Z514: 0 | AA514: 860 | AB514: 493 | AC514: =(AA514/AB514)*100 -> 174.4421906693712 | AD514: =(X514*4)+(Z514*2) -> 24
A515: ST KILDA | C515: MILNE 2 | F515: McMASTER | I515: HEAZELWOOD | L515: MITCHELL | N515: B THOMPSON | W515: ST KILDA | X515: 6 | Y515: 1 | Z515: 0 | AA515: 806 | AB515: 584 | AC515: =(AA515/AB515)*100 -> 138.01369863013699 | AD515: =(X515*4)+(Z515*2) -> 24
D516: 29TH APRIL | J516: WEATHER | W516: NORTH BALLARAT | X516: 5 | Y516: 2 | Z516: 0 | AA516: 591 | AB516: 389 | AC516: =(AA516/AB516)*100 -> 151.92802056555271 | AD516: =(X516*4)+(Z516*2) -> 20
A517: RICHMOND | C517: 2 | D517: 3 | E517: =(C517*6)+D517 -> 15 | G517: 5 | H517: 5 | I517: =(G517*6)+H517 -> 35 | K517: 10 | L517: 8 | M517: =(K517*6)+L517 -> 68 | O517: 14 | P517: 11 | Q517: =(O517*6)+P517 -> 95 | S517: Venue: VICTORIA PARK | W517: WILLIAMSTOWN | X517: 5 | Y517: 2 | Z517: 0 | AA517: 630 | AB517: 614 | AC517: =(AA517/AB517)*100 -> 102.60586319218241 | AD517: =(X517*4)+(Z517*2) -> 20
A518: PRESTON | C518: 2 | D518: 3 | E518: =(C518*6)+D518 -> 15 | G518: 6 | H518: 6 | I518: =(G518*6)+H518 -> 42 | K518: 8 | L518: 8 | M518: =(K518*6)+L518 -> 56 | O518: 12 | P518: 11 | Q518: =(O518*6)+P518 -> 83 | W518: WERRIBEE | X518: 4 | Y518: 2 | Z518: 1 | AA518: 763 | AB518: 682 | AC518: =(AA518/AB518)*100 -> 111.87683284457476 | AD518: =(X518*4)+(Z518*2) -> 18
A519: BEST PLAYERS | W519: CARLTON | X519: 4 | Y519: 3 | Z519: 0 | AA519: 789 | AB519: 624 | AC519: =(AA519/AB519)*100 -> 126.44230769230769 | AD519: =(X519*4)+(Z519*2) -> 16
A520: RICHMOND | C520: ZANTUCK | F520: BAKER | I520: POWELL | L520: HALL | O520: VARDY | R520: EVANS
A521: PRESTON | C521: MANN | F521: BONADIO | I521: LEE | L521: MITCHELL | O521: SCANLON | W521: FRANKSTON | X521: 4 | Y521: 3 | Z521: 0 | AA521: 778 | AB521: 662 | AC521: =(AA521/AB521)*100 -> 117.52265861027192 | AD521: =(X521*4)+(Z521*2) -> 16
A522: GOALKICKERS | W522: COLLINGWOOD | X522: 3 | Y522: 4 | Z522: 0 | AA522: 658 | AB522: 735 | AC522: =(AA522/AB522)*100 -> 89.523809523809533 | AD522: =(X522*4)+(Z522*2) -> 12
A523: RICHMOND | C523: HAYNES 5 | F523: TAYLOR 2 | I523: ARTHURSON 2 | L523: SAMPSON | N523: PROCTOR | P523: POWELL | R523: JAMES | T523: HALL | W523: ESSENDON | X523: 3 | Y523: 4 | Z523: 0 | AA523: 587 | AB523: 748 | AC523: =(AA523/AB523)*100 -> 78.475935828877013 | AD523: =(X523*4)+(Z523*2) -> 12
A524: PRESTON | C524: HILL 4 | F524: LEE 2 | I524: MOYLE 2 | L524: SAGE 2 | N524: FAVRIIN | Q524: GLEESON | W524: COBURG | X524: 2 | Y524: 5 | Z524: 0 | AA524: 652 | AB524: 650 | AC524: =(AA524/AB524)*100 -> 100.30769230769229 | AD524: =(X524*4)+(Z524*2) -> 8
W525: PORT MELBOURNE | X525: 2 | Y525: 5 | Z525: 0 | AA525: 628 | AB525: 699 | AC525: =(AA525/AB525)*100 -> 89.84263233190272 | AD525: =(X525*4)+(Z525*2) -> 8
A526: BOX HILL | C526: 5 | D526: 2 | E526: =(C526*6)+D526 -> 32 | G526: 9 | H526: 3 | I526: =(G526*6)+H526 -> 57 | K526: 10 | L526: 8 | M526: =(K526*6)+L526 -> 68 | O526: 14 | P526: 10 | Q526: =(O526*6)+P526 -> 94 | S526: Venue: PORT MELBOURNE | W526: PRESTON | X526: 2 | Y526: 5 | Z526: 0 | AA526: 584 | AB526: 900 | AC526: =(AA526/AB526)*100 -> 64.888888888888886 | AD526: =(X526*4)+(Z526*2) -> 8
A527: PORT MELBOURNE | C527: 1 | D527: 4 | E527: =(C527*6)+D527 -> 10 | G527: 5 | H527: 9 | I527: =(G527*6)+H527 -> 39 | K527: 7 | L527: 11 | M527: =(K527*6)+L527 -> 53 | O527: 11 | P527: 13 | Q527: =(O527*6)+P527 -> 79 | W527: SPRINGVALE | X527: 1 | Y527: 5 | Z527: 1 | AA527: 534 | AB527: 730 | AC527: =(AA527/AB527)*100 -> 73.150684931506845 | AD527: =(X527*4)+(Z527*2) -> 6
A528: BEST PLAYERS | W528: RICHMOND | X528: 1 | Y528: 6 | Z528: 0 | AA528: 603 | AB528: 878 | AC528: =(AA528/AB528)*100 -> 68.678815489749439 | AD528: =(X528*4)+(Z528*2) -> 4
A529: BOX HILL | C529: SMITH | F529: JENKINS | I529: TRELEVEN | L529: PUGSLEY | O529: OBST | Q529: COLLICA | W529: MURRAY KANGAROOS | X529: 1 | Y529: 6 | Z529: 0 | AA529: 508 | AB529: 822 | AC529: =(AA529/AB529)*100 -> 61.800486618004868 | AD529: =(X529*4)+(Z529*2) -> 4
A530: PORT MELBOURNE | C530: MATTHEWS-HERALD | G530: FOLINO | I530: HLOOW | L530: CLARK | O530: HENDERSON | W530: BENDIGO | X530: 0 | Y530: 7 | Z530: 0 | AA530: 470 | AB530: 870 | AC530: =(AA530/AB530)*100 -> 54.022988505747129 | AD530: =(X530*4)+(Z530*2) -> 0
A531: GOALKICKERS | Q531: HARTIN | S531: BANKS
A532: BOX HILL | C532: JENKINS 2 | E532: COLLICA 2 | H532: NICHOLLS 2 | K532: HAZELL 2 | M532: PUGSLEY | O532: JOHNSON | Q532: BATEMAN | S532: TRELEVEN
A533: PORT MELBOURNE | C533: O'KEEFE 2 | F533: SWAN 2 | I533: ARNOLD 2 | L533: FOLINO 2 | N533: CLARK | P533: EVANS | R533: BLUMFIELD
A535: WERRIBEE | C535: 0 | D535: 0 | E535: =(C535*6)+D535 -> 0 | G535: 7 | H535: 9 | I535: =(G535*6)+H535 -> 51 | K535: 7 | L535: 10 | M535: =(K535*6)+L535 -> 52 | O535: 11 | P535: 17 | Q535: =(O535*6)+P535 -> 83 | S535: Venue: COBURG
A536: COBURG | C536: 5 | D536: 3 | E536: =(C536*6)+D536 -> 33 | G536: 5 | H536: 4 | I536: =(G536*6)+H536 -> 34 | K536: 9 | L536: 6 | M536: =(K536*6)+L536 -> 60 | O536: 11 | P536: 7 | Q536: =(O536*6)+P536 -> 73
A537: BEST PLAYERS
A538: WERRIBEE | C538: DENT | F538: DYER | I538: FROST | L538: MURPHY | O538: ROBERTSON | R538: S SMITH
A539: COBURG | C539: DEPASQUALE | F539: MORRISON | I539: WESTON | L539: OPPENLANDER | O539: DRYDEN | R539: T LITTLE
A540: GOALKICKERS
A541: WERRIBEE | C541: FULLER 2 | E541: ROSA 2 | G541: CHURCHILL 2 | J541: BUTTON | L541: MURPHY | N541: ROBERTSON | Q541: SYMES | S541: DYER
A542: COBURG | C542: OPPENLANDER 4 | G542: McKENZIE-McHARG | K542: RYAN | M542: WESTON | O542: BIGGS | Q542: HOGG | R542: ALESSIO | T542: LUBIC
A544: ESSENDON | C544: 2 | D544: 2 | E544: =(C544*6)+D544 -> 14 | G544: 7 | H544: 8 | I544: =(G544*6)+H544 -> 50 | K544: 11 | L544: 11 | M544: =(K544*6)+L544 -> 77 | O544: 15 | P544: 14 | Q544: =(O544*6)+P544 -> 104 | S544: Venue: WINDY HILL
A545: MURRAY KANGAROOS | C545: 1 | D545: 4 | E545: =(C545*6)+D545 -> 10 | G545: 3 | H545: 4 | I545: =(G545*6)+H545 -> 22 | K545: 5 | L545: 11 | M545: =(K545*6)+L545 -> 41 | O545: 8 | P545: 13 | Q545: =(O545*6)+P545 -> 61
A546: BEST PLAYERS
A547: ESSENDON | C547: JACOBS | F547: FLETCHER | I547: ROBRAN | L547: D JOHNSON | O547: PEVERILL | R547: DENHAM
A548: MURRAY KANGAROOS | C548: COCHRANE | F548: KINGSLEY | I548: TEAGUE | L548: CALTHORPE | O548: RAWLINGS | R548: HENDERSON
A549: GOALKICKERS
A550: ESSENDON | C550: EASTAUGH 3 | F550: LADHAMS 3 | I550: SWITALA 3 | L550: JACOBS 3 | O550: LALICH | Q550: McVEIGH | S550: FRASER
A551: MURRAY KANGAROOS | C551: SPAULL 2 | F551: AINLEY 2 | I551: COCHRANE | L551: THOMPSON | O551: TAFF | Q551: BROWN
F552: NIGHT MATCH
A553: NORTH BALLARAT | C553: 2 | D553: 6 | E553: =(C553*6)+D553 -> 18 | G553: 5 | H553: 10 | I553: =(G553*6)+H553 -> 40 | K553: 9 | L553: 13 | M553: =(K553*6)+L553 -> 67 | O553: 15 | P553: 15 | Q553: =(O553*6)+P553 -> 105 | S553: Venue: NORTH BALLARAT
A554: WILLIAMSTOWN | C554: 1 | D554: 2 | E554: =(C554*6)+D554 -> 8 | G554: 1 | H554: 2 | I554: =(G554*6)+H554 -> 8 | K554: 1 | L554: 6 | M554: =(K554*6)+L554 -> 12 | O554: 2 | P554: 10 | Q554: =(O554*6)+P554 -> 22
A555: BEST PLAYERS
A556: NORTH BALLARAT | C556: MURRIHY | F556: T POLKINGHORNE | J556: GREIG | M556: FIELD | O556: CLARKE | R556: POWER
A557: WILLIAMSTOWN | C557: PLUNKETT | F557: LLOYD | J557: HOLLOW | M557: ROBBINS | O557: SMOKER | R557: BROWN
A558: GOALKICKERS
A559: NORTH BALLARAT | C559: RYALL 4 | E559: GREIG 2 | G559: POWER 2 | I559: FISHER 2 | K559: J POLKINGHORNE | N559: McDONALD | Q559: T POLKINGHORNE | U559: CLARKE | X559: JURICA
A560: WILLIAMSTOWN | C560: KOLYNUIK | F560: BARTLETT
D561: 30TH APRIL | K561: WEATHER
A562: FRANKSTON | C562: 2 | D562: 2 | E562: =(C562*6)+D562 -> 14 | G562: 7 | H562: 7 | I562: =(G562*6)+H562 -> 49 | K562: 13 | L562: 10 | M562: =(K562*6)+L562 -> 88 | O562: 15 | P562: 16 | Q562: =(O562*6)+P562 -> 106 | S562: Venue: WAVERLEY
A563: SPRINGVALE | C563: 4 | D563: 2 | E563: =(C563*6)+D563 -> 26 | G563: 5 | H563: 3 | I563: =(G563*6)+H563 -> 33 | K563: 7 | L563: 6 | M563: =(K563*6)+L563 -> 48 | O563: 11 | P563: 8 | Q563: =(O563*6)+P563 -> 74
A564: BEST PLAYERS
A565: FRANKSTON | C565: BURGMAN | F565: SYLVIO | I565: ZIETSMAN | L565: DAFF | N565: LAWRENCE | Q565: MALLOY
A566: SPRINGVALE | C566: TROLLOPE | F566: DELARUE | I566: O'BRIEN | L566: CLARK | N566: SHAW-DENNIS
A567: GOALKICKERS
A568: FRANKSTON | C568: WILLIAMS 4 | F568: MCCORMACK 3 | J568: SULLIVAN 2 | M568: ANDERSON 2 | P568: WELSH | R568: HOSE | T568: MERCHAN | X568: SYLVIO
A569: SPRINGVALE | C569: SMITH 3 | F569: PITT 2 | I569: IRISH 2 | L569: LITTLE | N569: O'BRIEN | P569: DELARUE | R569: DILLON
A571: GEELONG | C571: 4 | D571: 3 | E571: =(C571*6)+D571 -> 27 | G571: 5 | H571: 9 | I571: =(G571*6)+H571 -> 39 | K571: 9 | L571: 11 | M571: =(K571*6)+L571 -> 65 | O571: 13 | P571: 17 | Q571: =(O571*6)+P571 -> 95 | S571: Venue: VICTORIA PARK
A572: COLLINGWOOD | C572: 7 | D572: 1 | E572: =(C572*6)+D572 -> 43 | G572: 7 | H572: 4 | I572: =(G572*6)+H572 -> 46 | K572: 9 | L572: 5 | M572: =(K572*6)+L572 -> 59 | O572: 12 | P572: 5 | Q572: =(O572*6)+P572 -> 77
A573: BEST PLAYERS
A574: GEELONG | C574: ARNOTT | F574: PICKERING | I574: LINDSAY | L574: CHAPMAN | N574: HAY | Q574: FOSTER
A575: COLLINGWOOD | C575: BAYNES | F575: DIMMATINA | I575: HAWKING | L575: GARDINER | N575: PATTERSON | Q575: SCOTLAND
A576: GOALKICKERS
A577: GEELONG | C577: ARNOTT 2 | F577: HAY 2 | I577: ENRIGHT 2 | L577: LING 2 | N577: BALDWIN | Q577: CHAPMAN | T577: LINDSAY | W577: RYAN | X577: STREET
A578: COLLINGWOOD | C578: TUCKEY 3 | F578: PATTERSON 2 | I578: OBORNE 2 | L578: SHARPEN 2 | O578: SCOTLAND 2 | R578: GRAY
A580: SANDRINGHAM | C580: 3 | D580: 6 | E580: =(C580*6)+D580 -> 24 | G580: 6 | H580: 13 | I580: =(G580*6)+H580 -> 49 | K580: 10 | L580: 18 | M580: =(K580*6)+L580 -> 78 | O580: 18 | P580: 20 | Q580: =(O580*6)+P580 -> 128 | S580: Venue: WAVERLEY
A581: BENDIGO | C581: 1 | D581: 1 | E581: =(C581*6)+D581 -> 7 | G581: 2 | H581: 2 | I581: =(G581*6)+H581 -> 14 | K581: 3 | L581: 6 | M581: =(K581*6)+L581 -> 24 | O581: 6 | P581: 7 | Q581: =(O581*6)+P581 -> 43
A582: BEST PLAYERS
A583: SANDRINGHAM | C583: McKELLAR | F583: WILLIAMS | I583: SAUTNER | L583: GODFREY | O583: TREGEAR | Q583: NICHOLSON
A584: BENDIGO | C584: O'CALLAGHAN | F584: BOWER | I584: BROCK SHIELLS | M584: WALSH | O584: ANGOVE
A585: GOALKICKERS
A586: SANDRINGHAM | C586: SAUTNER 5 | F586: WILLIAMS 4 | I586: GODFREY 2 | L586: MACGEORGE 2 | O586: RAMSAY | Q586: GEHLING | S586: FEBEY | U586: CHISHOLM | X586: BROWN
A587: BENDIGO | C587: BROCK SHIELLS 2 | G587: ANGOVE | I587: BOWER | K587: DILLON | M587: MITROVIC
A589: ROUND 8 | D589: 5TH MAY | G589: NIGHT MATCH | J589: WEATHER
D590: 1ST QTR | H590: 2ND QTR | L590: 3RD QTR | P590: FINAL
A591: COLLINGWOOD | C591: 4 | D591: 3 | E591: =(C591*6)+D591 -> 27 | G591: 7 | H591: 7 | I591: =(G591*6)+H591 -> 49 | K591: 11 | L591: 11 | M591: =(K591*6)+L591 -> 77 | O591: 11 | P591: 12 | Q591: =(O591*6)+P591 -> 78 | S591: Venue: LAVINGTON | Y591: LADDER | AB591: ROUND | AD591: 8
A592: MURRAY KANGAROOS | C592: 1 | D592: 1 | E592: =(C592*6)+D592 -> 7 | G592: 3 | H592: 4 | I592: =(G592*6)+H592 -> 22 | K592: 6 | L592: 6 | M592: =(K592*6)+L592 -> 42 | O592: 10 | P592: 10 | Q592: =(O592*6)+P592 -> 70
A593: BEST PLAYERS | W593: TEAM | X593: W | Y593: L | Z593: D | AA593: FOR | AB593: AGST | AC593: % | AD593: PTS
A594: COLLINGWOOD | C594: CROSISCA | F594: GARDINER | I594: DIMMATINA | L594: SMITH | N594: OBORNE | Q594: ROACH
A595: MURRAY KANGAROOS | C595: CAPUANO | F595: KINGSLEY | I595: STEPHENS | L595: PAGAN | N595: TEAGUE | Q595: HILTON | W595: BOX HILL | X595: 8 | Y595: 0 | Z595: 0 | AA595: 935 | AB595: 654 | AC595: =(AA595/AB595)*100 -> 142.96636085626909 | AD595: =(X595*4)+(Z595*2) -> 32
A596: GOALKICKERS | R596: OBORNE | W596: SANDRINGHAM | X596: 7 | Y596: 1 | Z596: 0 | AA596: 1009 | AB596: 620 | AC596: =(AA596/AB596)*100 -> 162.74193548387098 | AD596: =(X596*4)+(Z596*2) -> 28
A597: COLLINGWOOD | C597: LANE 2 | E597: BROWN 2 | G597: DAVIS | I597: SMITH | K597: PATTERSON | N597: GARDINER | Q597: MARTELLO | S597: SHEEHAN | W597: ST KILDA | X597: 7 | Y597: 1 | Z597: 0 | AA597: 918 | AB597: 635 | AC597: =(AA597/AB597)*100 -> 144.56692913385828 | AD597: =(X597*4)+(Z597*2) -> 28
A598: MURRAY KANGAROOS | C598: HEWITT 4 | F598: PAGAN 2 | I598: CAPUANO | K598: ABLETT | M598: KINGSLEY | O598: HENDERSON | W598: GEELONG | X598: 7 | Y598: 1 | Z598: 0 | AA598: 924 | AB598: 685 | AC598: =(AA598/AB598)*100 -> 134.89051094890513 | AD598: =(X598*4)+(Z598*2) -> 28
D599: 6TH MAY | J599: WEATHER | W599: NORTH BALLARAT | X599: 6 | Y599: 2 | Z599: 0 | AA599: 719 | AB599: 482 | AC599: =(AA599/AB599)*100 -> 149.1701244813278 | AD599: =(X599*4)+(Z599*2) -> 24
A600: CARLTON | C600: 6 | D600: 4 | E600: =(C600*6)+D600 -> 40 | G600: 10 | H600: 6 | I600: =(G600*6)+H600 -> 66 | K600: 19 | L600: 12 | M600: =(K600*6)+L600 -> 126 | O600: 21 | P600: 18 | Q600: =(O600*6)+P600 -> 144 | S600: Venue: OPTUS OVAL | W600: WILLIAMSTOWN | X600: 6 | Y600: 2 | Z600: 0 | AA600: 783 | AB600: 667 | AC600: =(AA600/AB600)*100 -> 117.39130434782609 | AD600: =(X600*4)+(Z600*2) -> 24
A601: GEELONG | C601: 2 | D601: 3 | E601: =(C601*6)+D601 -> 15 | G601: 7 | H601: 5 | I601: =(G601*6)+H601 -> 47 | K601: 10 | L601: 9 | M601: =(K601*6)+L601 -> 69 | O601: 16 | P601: 17 | Q601: =(O601*6)+P601 -> 113 | W601: CARLTON | X601: 5 | Y601: 3 | Z601: 0 | AA601: 933 | AB601: 737 | AC601: =(AA601/AB601)*100 -> 126.59430122116689 | AD601: =(X601*4)+(Z601*2) -> 20
A602: BEST PLAYERS | W602: WERRIBEE | X602: 4 | Y602: 3 | Z602: 1 | AA602: 814 | AB602: 794 | AC602: =(AA602/AB602)*100 -> 102.51889168765742 | AD602: =(X602*4)+(Z602*2) -> 18
A603: CARLTON | C603: CHATFIELD | F603: BACKWELL | I603: PRENDERGAST | L603: DOERING | N603: HOULIHAN | Q603: O'REILLY
A604: GEELONG | C604: COWELL | F604: McKAY | I604: CLARK | L604: COREY | N604: CORRIGAN | W604: FRANKSTON | X604: 4 | Y604: 4 | Z604: 0 | AA604: 905 | AB604: 811 | AC604: =(AA604/AB604)*100 -> 111.59062885326759 | AD604: =(X604*4)+(Z604*2) -> 16
A605: GOALKICKERS | L605: KELLY | N605: CARROLL | P605: McKAY | R605: VALLEJO | W605: COLLINGWOOD | X605: 4 | Y605: 4 | Z605: 0 | AA605: 736 | AB605: 805 | AC605: =(AA605/AB605)*100 -> 91.428571428571431 | AD605: =(X605*4)+(Z605*2) -> 16
A606: CARLTON | C606: O'REILLY 5 | F606: BACKWELL 4 | I606: HOULIHAN 3 | L606: PASSADOR 2 | O606: CHATFIELD | R606: SEXTON | T606: DUKES | W606: PORT MELBOURNE | X606: 3 | Y606: 5 | Z606: 0 | AA606: 715 | AB606: 773 | AC606: =(AA606/AB606)*100 -> 92.496765847348001 | AD606: =(X606*4)+(Z606*2) -> 12
A607: GEELONG | C607: LING 3 | E607: CLARK 2 | G607: HAY 2 | I607: CHAPMAN | L607: COREY | N607: COWELL | P607: ENRIGHT | R607: HARDING | W607: ESSENDON | X607: 3 | Y607: 5 | Z607: 0 | AA607: 640 | AB607: 901 | AC607: =(AA607/AB607)*100 -> 71.032186459489452 | AD607: =(X607*4)+(Z607*2) -> 12
L608: LINDSAY | N608: PICKERING | Q608: RYAN | S608: WOJCINSKI | W608: SPRINGVALE | X608: 2 | Y608: 5 | Z608: 1 | AA608: 640 | AB608: 795 | AC608: =(AA608/AB608)*100 -> 80.503144654088061 | AD608: =(X608*4)+(Z608*2) -> 10
A609: WILLIAMSTOWN | C609: 5 | D609: 3 | E609: =(C609*6)+D609 -> 33 | G609: 12 | H609: 8 | I609: =(G609*6)+H609 -> 80 | K609: 18 | L609: 11 | M609: =(K609*6)+L609 -> 119 | O609: 23 | P609: 15 | Q609: =(O609*6)+P609 -> 153 | S609: Venue: WILLIAMSTOWN | W609: COBURG | X609: 2 | Y609: 6 | Z609: 0 | AA609: 726 | AB609: 737 | AC609: =(AA609/AB609)*100 -> 98.507462686567166 | AD609: =(X609*4)+(Z609*2) -> 8
A610: ESSENDON | C610: 2 | D610: 3 | E610: =(C610*6)+D610 -> 15 | G610: 3 | H610: 4 | I610: =(G610*6)+H610 -> 22 | K610: 6 | L610: 5 | M610: =(K610*6)+L610 -> 41 | O610: 8 | P610: 5 | Q610: =(O610*6)+P610 -> 53 | W610: PRESTON | X610: 2 | Y610: 6 | Z610: 0 | AA610: 644 | AB610: 1050 | AC610: =(AA610/AB610)*100 -> 61.333333333333329 | AD610: =(X610*4)+(Z610*2) -> 8
A611: BEST PLAYERS | W611: RICHMOND | X611: 1 | Y611: 7 | Z611: 0 | AA611: 696 | AB611: 1006 | AC611: =(AA611/AB611)*100 -> 69.184890656063615 | AD611: =(X611*4)+(Z611*2) -> 4
A612: WILLIAMSTOWN | C612: ROBBINS | F612: PLUNKETT | I612: LLOYD | L612: HAHN | N612: M WEST | Q612: TAYLOR | W612: MURRAY KANGAROOS | X612: 1 | Y612: 7 | Z612: 0 | AA612: 578 | AB612: 900 | AC612: =(AA612/AB612)*100 -> 64.222222222222229 | AD612: =(X612*4)+(Z612*2) -> 4
A613: ESSENDON | C613: DENHAM | F613: HILLE | I613: PEVERILL | L613: FLETCHER | N613: McVEIGH | Q613: FRASER | W613: BENDIGO | X613: 0 | Y613: 8 | Z613: 0 | AA613: 535 | AB613: 976 | AC613: =(AA613/AB613)*100 -> 54.815573770491795 | AD613: =(X613*4)+(Z613*2) -> 0
A614: GOALKICKERS
A615: WILLIAMSTOWN | C615: MACRI 6 | E615: KOLYNIUCK 4 | H615: SMOKER 4 | K615: ANDERSON 3 | N615: TAYLOR 3 | Q615: KING 2 | S615: LLOYD
A616: ESSENDON | C616: McVEIGH 2 | F616: LADHAMS 2 | I616: BERBAKOV | K616: PICKETT | M616: PODSIADLY | P616: GLEESON
A618: SPRINGVALE | C618: 5 | D618: 1 | E618: =(C618*6)+D618 -> 31 | G618: 8 | H618: 5 | I618: =(G618*6)+H618 -> 53 | K618: 14 | L618: 7 | M618: =(K618*6)+L618 -> 91 | O618: 16 | P618: 10 | Q618: =(O618*6)+P618 -> 106 | S618: Venue: BENDIGO
A619: BENDIGO | C619: 1 | D619: 6 | E619: =(C619*6)+D619 -> 12 | G619: 3 | H619: 7 | I619: =(G619*6)+H619 -> 25 | K619: 6 | L619: 13 | M619: =(K619*6)+L619 -> 49 | O619: 8 | P619: 17 | Q619: =(O619*6)+P619 -> 65
A620: BEST PLAYERS
A621: SPRINGVALE | C621: O'BRIEN | F621: SMITH | I621: SHEEHAN | L621: PITT | N621: ROBBINS | Q621: LITTLE
A622: BENDIGO | C622: GATHERCOLE | F622: SUTHERLAND | I622: CONNAUGHTON | L622: WALSH | N622: CARTER
A623: GOALKICKERS
A624: SPRINGVALE | C624: SMITH 6 | E624: LOGAN 2 | G624: CARMODY | I624: COURTNEY | L624: DELARUE | N624: IRISH | P624: JOY | Q624: MEYER | S624: O'BRIEN | V624: PITT
A625: BENDIGO | C625: BROWN 2 | F625: CARTER | I625: GATHERCOLE | L625: PINNER | N625: PROWSE | P625: BROCK SHIELS | S625: WHITSED
A627: PORT MELBOURNE | C627: 3 | D627: 2 | E627: =(C627*6)+D627 -> 20 | G627: 8 | H627: 8 | I627: =(G627*6)+H627 -> 56 | K627: 11 | L627: 13 | M627: =(K627*6)+L627 -> 79 | O627: 12 | P627: 15 | Q627: =(O627*6)+P627 -> 87 | S627: Venue: COBURG
A628: COBURG | C628: 3 | D628: 1 | E628: =(C628*6)+D628 -> 19 | G628: 4 | H628: 1 | I628: =(G628*6)+H628 -> 25 | K628: 5 | L628: 4 | M628: =(K628*6)+L628 -> 34 | O628: 11 | P628: 8 | Q628: =(O628*6)+P628 -> 74
A629: BEST PLAYERS
A630: PORT MELBOURNE | C630: SANGSTER | F630: HENDERSON | I630: ROSE | L630: GOODALE | N630: BOMFORD
A631: COBURG | C631: WESTON | F631: CANNING | I631: McKENZIE-McHARG | M631: RYAN | N631: LAPPIN
A632: GOALKICKERS
A633: PORT MELBOURNE | C633: O'KEEFE 4 | F633: BOMFORD 2 | I633: FIXTER 2 | K633: NAISH | M633: ARNOLD | O633: HENDERSON | R633: CREDLIN
A634: COBURG | C634: CANNING 3 | F634: BAKOULAS 2 | I634: ALESSIO 2 | L634: BIGGS | N634: KEENAN | P634: McKENZIE-McHARG | T634: OPPENLANDER
A636: SANDRINGHAM | C636: 5 | D636: 3 | E636: =(C636*6)+D636 -> 33 | G636: 12 | H636: 5 | I636: =(G636*6)+H636 -> 77 | K636: 16 | L636: 8 | M636: =(K636*6)+L636 -> 104 | O636: 23 | P636: 11 | Q636: =(O636*6)+P636 -> 149 | S636: Venue: FRANKSTON
A637: FRANKSTON | C637: 4 | D637: 0 | E637: =(C637*6)+D637 -> 24 | G637: 10 | H637: 3 | I637: =(G637*6)+H637 -> 63 | K637: 18 | L637: 6 | M637: =(K637*6)+L637 -> 114 | O637: 20 | P637: 7 | Q637: =(O637*6)+P637 -> 127
A638: BEST PLAYERS
A639: SANDRINGHAM | C639: PITT | F639: GODFREY | I639: SAUTNER | L639: COLLINS | N639: FRATER | Q639: CHISHOLM
A640: FRANKSTON | C640: DAN CLARKE | F640: McCORMACK | I640: MALLOY | L640: SULLIVAN | N640: ROBERTS | Q640: DAFF
A641: GOALKICKERS
A642: SANDRINGHAM | C642: PITT 8 | F642: SAUTNER 6 | I642: CHISHOLM 3 | L642: FRATER 2 | N642: KENNEDY | Q642: HAYWARD | T642: RAMSAY | W642: GODFREY
A643: FRANKSTON | C643: McCORMACK 4 | F643: SMITH 4 | H643: MURRAY 2 | J643: ANDERSON 2 | M643: DAM CLARKE 2 | P643: GEORGIOU | R643: SULLIVAN | U643: MALLOY | X643: DAN CLARKE | AB643: LAWRENCE
D644: 7TH MAY | J644: WEATHER | W644: ZIETSMAN
A645: BOX HILL | C645: 4 | D645: 3 | E645: =(C645*6)+D645 -> 27 | G645: 8 | H645: 6 | I645: =(G645*6)+H645 -> 54 | K645: 16 | L645: 9 | M645: =(K645*6)+L645 -> 105 | O645: 23 | P645: 12 | Q645: =(O645*6)+P645 -> 150 | S645: Venue: BOX HILL
A646: PRESTON | C646: 2 | D646: 1 | E646: =(C646*6)+D646 -> 13 | G646: 6 | H646: 4 | I646: =(G646*6)+H646 -> 40 | K646: 8 | L646: 5 | M646: =(K646*6)+L646 -> 53 | O646: 9 | P646: 6 | Q646: =(O646*6)+P646 -> 60
A647: BEST PLAYERS
A648: BOX HILL | C648: NICHOLLS | F648: SMITH | I648: MANN | L648: COLLICA | O648: BATEMAN | R648: PICIAONE
A649: PRESTON | C649: LEE | F649: CUSACK | I649: ZORZI | L649: MOYLE | O649: GIBSON | R649: BONADIO
A650: GOALKICKERS
A651: BOX HILL | C651: MANN 5 | E651: NICHOLLS 3 | H651: SMITH 2 | J651: LOATS 2 | L651: BATEMAN 2 | O651: COLLICA 2 | R651: HAZELL 2 | U651: RODE | W651: CHAPMAN | X651: BAXTER | AA651: JACKSON
A652: PRESTON | C652: LEE 3 | F652: FROST 2 | I652: HILL | K652: BLIGHT | M652: MOYLE | O652: ZORZI
A654: NORTH BALLARAT | C654: 6 | D654: 2 | E654: =(C654*6)+D654 -> 38 | G654: 8 | H654: 6 | I654: =(G654*6)+H654 -> 54 | K654: 16 | L654: 11 | M654: =(K654*6)+L654 -> 107 | O654: 19 | P654: 14 | Q654: =(O654*6)+P654 -> 128 | S654: Venue: NORTH BALLARAT
A655: RICHMOND | C655: 4 | D655: 3 | E655: =(C655*6)+D655 -> 27 | G655: 6 | H655: 6 | I655: =(G655*6)+H655 -> 42 | K655: 11 | L655: 8 | M655: =(K655*6)+L655 -> 74 | O655: 14 | P655: 9 | Q655: =(O655*6)+P655 -> 93
A656: BEST PLAYERS
A657: NORTH BALLARAT | C657: SOMERVILLE | F657: J POLKINGHORNE | J657: FIELD | M657: FUNCKE | O657: JURICA | R657: GREIG
A658: RICHMOND | C658: SAMPSON | F658: EVANS | I658: T EDWARDS | L658: TAYLOR | O658: PROCTOR | R658: WHITE
A659: GOALKICKERS | Z659: FIELD
A660: NORTH BALLARAT | C660: POWER 3 | E660: JURICA 2 | G660: INKSTER 2 | I660: CLARKE 2 | K660: FREELAND | M660: FUNCKE | O660: FISHER | Q660: GREIG | R660: EDWARDS | U660: T POLKINGHORNE | X660: SNIBSON | AA660: CLAYTON | AC660: RYALL
A661: RICHMOND | C661: WHITE 3 | F661: HAYNES 2 | I661: BURGEIL 2 | L661: ZANTUCK | N661: POWELL | P661: PROCTOR | R661: MILLS | T661: SAMPSON | W661: EVANS | X661: TAYLOR
D662: 8TH MAY | H662: NIGHT MATCH | K662: WEATHER
A663: ST KILDA | C663: 3 | D663: 5 | E663: =(C663*6)+D663 -> 23 | G663: 8 | H663: 6 | I663: =(G663*6)+H663 -> 54 | K663: 14 | L663: 8 | M663: =(K663*6)+L663 -> 92 | O663: 16 | P663: 16 | Q663: =(O663*6)+P663 -> 112 | S663: Venue: WAVERLEY
A664: WERRIBEE | C664: 1 | D664: 2 | E664: =(C664*6)+D664 -> 8 | G664: 2 | H664: 8 | I664: =(G664*6)+H664 -> 20 | K664: 5 | L664: 12 | M664: =(K664*6)+L664 -> 42 | O664: 6 | P664: 15 | Q664: =(O664*6)+P664 -> 51
A665: BEST PLAYERS
A666: ST KILDA | C666: BEETHAM | F666: CAMPBELL | I666: MITCHELL | L666: MONKHURST | O666: PLAPP | Q666: PITTS
A667: WERRIBEE | C667: FROST | F667: TAYLOR | I667: ROBERTSON | L667: BUTTON | O667: MURPHY | Q667: ATKINS
A668: GOALKICKERS
A669: ST KILDA | C669: MITCHELL 4 | F669: WALTON 2 | I669: MILNE 2 | K669: WULF 2 | M669: SIERAKOWSKI 2 | P669: RYAN | R669: BROWN | T669: CAMPBELL | X669: McLAREN
A670: WERRIBEE | C670: FULLER 2 | F670: BUTTON | I670: BAKER | K670: FROST | M670: PENNY
A672: ROUND 9 | D672: 13TH MAY | J672: WEATHER
D673: 1ST QTR | H673: 2ND QTR | L673: 3RD QTR | P673: FINAL
A674: COLLINGWOOD | C674: 4 | D674: 2 | E674: =(C674*6)+D674 -> 26 | G674: 9 | H674: 7 | I674: =(G674*6)+H674 -> 61 | K674: 12 | L674: 9 | M674: =(K674*6)+L674 -> 81 | O674: 17 | P674: 10 | Q674: =(O674*6)+P674 -> 112 | S674: Venue: M.C.G. (C/R) | Y674: LADDER | AB674: ROUND | AD674: 9
A675: RICHMOND | C675: 7 | D675: 1 | E675: =(C675*6)+D675 -> 43 | G675: 9 | H675: 5 | I675: =(G675*6)+H675 -> 59 | K675: 12 | L675: 8 | M675: =(K675*6)+L675 -> 80 | O675: 15 | P675: 11 | Q675: =(O675*6)+P675 -> 101
A676: BEST PLAYERS | W676: TEAM | X676: W | Y676: L | Z676: D | AA676: FOR | AB676: AGST | AC676: % | AD676: PTS
A677: COLLINGWOOD | C677: OBORNE | F677: JACOTINE | I677: MICHAEL | L677: JOHNSON | N677: SHEAHAN | Q677: GARDINER
A678: RICHMOND | C678: WHITE | F678: MILLS | I678: ZANTUCK | L678: HAYNES | N678: PROCTOR | Q678: TAYLOR | W678: SANDRINGHAM | X678: 8 | Y678: 1 | Z678: 0 | AA678: 1103 | AB678: 700 | AC678: =(AA678/AB678)*100 -> 157.57142857142856 | AD678: =(X678*4)+(Z678*2) -> 32
A679: GOALKICKERS | R679: ANSTEY | W679: ST KILDA | X679: 8 | Y679: 1 | Z679: 0 | AA679: 1038 | AB679: 705 | AC679: =(AA679/AB679)*100 -> 147.23404255319147 | AD679: =(X679*4)+(Z679*2) -> 32
A680: COLLINGWOOD | C680: MICHAEL 4 | F680: JOHNSON 3 | I680: WATSON 3 | L680: L DAVIS 2 | N680: OBORNE 2 | Q680: SMITH | S680: ROACH | W680: BOX HILL | X680: 8 | Y680: 1 | Z680: 0 | AA680: 1015 | AB680: 748 | AC680: =(AA680/AB680)*100 -> 135.69518716577539 | AD680: =(X680*4)+(Z680*2) -> 32
A681: RICHMOND | C681: WHITE 4 | E681: MILLS 4 | G681: BURGEIL 2 | J681: JAMES | L681: PROCTOR | N681: TAYLOR | P681: T EDWARDS | W681: NORTH BALLARAT | X681: 7 | Y681: 2 | Z681: 0 | AA681: 791 | AB681: 553 | AC681: =(AA681/AB681)*100 -> 143.03797468354432 | AD681: =(X681*4)+(Z681*2) -> 28
O682: E EDWARDS | W682: GEELONG | X682: 7 | Y682: 2 | Z682: 0 | AA682: 985 | AB682: 764 | AC682: =(AA682/AB682)*100 -> 128.92670157068062 | AD682: =(X682*4)+(Z682*2) -> 28
A683: SANDRINGHAM | C683: 3 | D683: 5 | E683: =(C683*6)+D683 -> 23 | G683: 8 | H683: 8 | I683: =(G683*6)+H683 -> 56 | K683: 10 | L683: 10 | M683: =(K683*6)+L683 -> 70 | O683: 13 | P683: 16 | Q683: =(O683*6)+P683 -> 94 | S683: Venue: BEACH ROAD | W683: WILLIAMSTOWN | X683: 6 | Y683: 3 | Z683: 0 | AA683: 865 | AB683: 805 | AC683: =(AA683/AB683)*100 -> 107.45341614906832 | AD683: =(X683*4)+(Z683*2) -> 24
A684: BOX HILL | C684: 2 | D684: 5 | E684: =(C684*6)+D684 -> 17 | G684: 4 | H684: 5 | I684: =(G684*6)+H684 -> 29 | K684: 10 | L684: 8 | M684: =(K684*6)+L684 -> 68 | O684: 12 | P684: 8 | Q684: =(O684*6)+P684 -> 80 | W684: WERRIBEE | X684: 5 | Y684: 3 | Z684: 1 | AA684: 962 | AB684: 876 | AC684: =(AA684/AB684)*100 -> 109.81735159817352 | AD684: =(X684*4)+(Z684*2) -> 22
A685: BEST PLAYERS | W685: FRANKSTON | X685: 5 | Y685: 4 | Z685: 0 | AA685: 1043 | AB685: 893 | AC685: =(AA685/AB685)*100 -> 116.79731243001119 | AD685: =(X685*4)+(Z685*2) -> 20
A686: SANDRINGHAM | C686: McKELLAR | F686: TREGEAR | I686: LIDDELL | L686: MACGEORGE | N686: COLLINS | Q686: BEAMS
A687: BOX HILL | C687: SMITH | F687: NICHOLLS | I687: CHAPMAN | L687: MANN | N687: COLLICA | Q687: BATEMAN | W687: CARLTON | X687: 5 | Y687: 4 | Z687: 0 | AA687: 994 | AB687: 881 | AC687: =(AA687/AB687)*100 -> 112.82633371169126 | AD687: =(X687*4)+(Z687*2) -> 20
A688: GOALKICKERS | W688: COLLINGWOOD | X688: 5 | Y688: 4 | Z688: 0 | AA688: 848 | AB688: 906 | AC688: =(AA688/AB688)*100 -> 93.598233995584991 | AD688: =(X688*4)+(Z688*2) -> 20
A689: SANDRINGHAM | C689: PITT 4 | E689: JOHNSTONE 3 | H689: GREEN 2 | J689: BEAMS | L689: SAUTNER | N689: COLLINS | P689: OAKLEY | W689: PORT MELBOURNE | X689: 4 | Y689: 5 | Z689: 0 | AA689: 794 | AB689: 834 | AC689: =(AA689/AB689)*100 -> 95.203836930455637 | AD689: =(X689*4)+(Z689*2) -> 16
A690: BOX HILL | C690: JENKINS 2 | E690: BREWER 2 | H690: BATEMAN 2 | K690: NICHOLLS 2 | N690: MANN | P690: PICIAONE | R690: LOATS | W690: SPRINGVALE | X690: 3 | Y690: 5 | Z690: 1 | AA690: 742 | AB690: 874 | AC690: =(AA690/AB690)*100 -> 84.897025171624719 | AD690: =(X690*4)+(Z690*2) -> 14
Q691: HAZELL | W691: ESSENDON | X691: 3 | Y691: 6 | Z691: 0 | AA691: 711 | AB691: 973 | AC691: =(AA691/AB691)*100 -> 73.072970195272362 | AD691: =(X691*4)+(Z691*2) -> 12
A692: NORTH BALLARAT | C692: 2 | D692: 1 | E692: =(C692*6)+D692 -> 13 | G692: 5 | H692: 3 | I692: =(G692*6)+H692 -> 33 | K692: 6 | L692: 5 | M692: =(K692*6)+L692 -> 41 | O692: 11 | P692: 6 | Q692: =(O692*6)+P692 -> 72 | S692: Venue: WINDY HILL | W692: COBURG | X692: 2 | Y692: 7 | Z692: 0 | AA692: 805 | AB692: 839 | AC692: =(AA692/AB692)*100 -> 95.947556615017888 | AD692: =(X692*4)+(Z692*2) -> 8
A693: ESSENDON | C693: 4 | D693: 4 | E693: =(C693*6)+D693 -> 28 | G693: 6 | H693: 7 | I693: =(G693*6)+H693 -> 43 | K693: 9 | L693: 12 | M693: =(K693*6)+L693 -> 66 | O693: 9 | P693: 17 | Q693: =(O693*6)+P693 -> 71 | W693: MURRAY KANGAROOS | X693: 2 | Y693: 7 | Z693: 0 | AA693: 722 | AB693: 961 | AC693: =(AA693/AB693)*100 -> 75.130072840790845 | AD693: =(X693*4)+(Z693*2) -> 8
A694: BEST PLAYERS | W694: PRESTON | X694: 2 | Y694: 7 | Z694: 0 | AA694: 714 | AB694: 1170 | AC694: =(AA694/AB694)*100 -> 61.025641025641029 | AD694: =(X694*4)+(Z694*2) -> 8
A695: NORTH BALLARAT | C695: SOMERVILLE | F695: FUNCKE | I695: GREIG | K695: SNIBSON | N695: MOLONEY | W695: RICHMOND | X695: 1 | Y695: 8 | Z695: 0 | AA695: 797 | AB695: 1118 | AC695: =(AA695/AB695)*100 -> 71.288014311270118 | AD695: =(X695*4)+(Z695*2) -> 4
A696: ESSENDON | C696: McALISTER | F696: PRIOR | I696: PEVERILL | K696: McGRATH | N696: McVEIGH | Q696: MOORCROFT | W696: BENDIGO | X696: 0 | Y696: 9 | Z696: 0 | AA696: 617 | AB696: 1124 | AC696: =(AA696/AB696)*100 -> 54.893238434163706 | AD696: =(X696*4)+(Z696*2) -> 0
A697: GOALKICKERS | Q697: T POLKINGHORNE
A698: NORTH BALLARAT | C698: CLARKE 2 | E698: SIER 2 | G698: POWER | I698: EDWARDS | K698: FUNCKE | M698: CLAYTON | O698: MURRIHY | Q698: GREIG
A699: ESSENDON | C699: EASTAUGH 2 | F699: PEVERILL | H699: LALICH | J699: McVEIGH | L699: MOORCROFT | O699: BERBAKOV | Q699: FRASER | S699: JOHNSON
D700: 14TH MAY | J700: WEATHER
A701: WERRIBEE | C701: 7 | D701: 5 | E701: =(C701*6)+D701 -> 47 | G701: 11 | H701: 8 | I701: =(G701*6)+H701 -> 74 | K701: 20 | L701: 8 | M701: =(K701*6)+L701 -> 128 | O701: 23 | P701: 10 | Q701: =(O701*6)+P701 -> 148 | S701: Venue: WERRIBEE
A702: BENDIGO | C702: 3 | D702: 0 | E702: =(C702*6)+D702 -> 18 | G702: 7 | H702: 4 | I702: =(G702*6)+H702 -> 46 | K702: 11 | L702: 7 | M702: =(K702*6)+L702 -> 73 | O702: 12 | P702: 10 | Q702: =(O702*6)+P702 -> 82
A703: BEST PLAYERS
A704: WERRIBEE | C704: ROBERTSON | F704: FROST | I704: FAULKNER | L704: MURPHY | N704: TAYLOR | Q704: DENT
A705: BENDIGO | C705: WALSH | F705: CARTER | I705: GATHERCOLE | L705: DILLON | N705: TOINTON | Q705: CONNAUGHTON
A706: GOALKICKERS
A707: WERRIBEE | C707: WILLS 4 | E707: PENNY 4 | G707: WIGGINS 3 | I707: SYMES 3 | K707: MURPHY 2 | M707: BAKER | O707: BUTTON | Q707: DENT | R707: FAULKINER | V707: SMITH | Y707: FROST | Z707: FULLER
A708: BENDIGO | C708: SHIELD 3 | E708: BROWN 2 | G708: DILLON 2 | I708: CONNAUGHTON | L708: O'TOOLE | N708: PROWSE | P708: SCHMIDT | R708: WALSH
A710: PORT MELBOURNE | C710: 3 | D710: 3 | E710: =(C710*6)+D710 -> 21 | G710: 7 | H710: 5 | I710: =(G710*6)+H710 -> 47 | K710: 9 | L710: 8 | M710: =(K710*6)+L710 -> 62 | O710: 11 | P710: 13 | Q710: =(O710*6)+P710 -> 79 | S710: Venue: SHELL STADIUM
A711: GEELONG | C711: 3 | D711: 2 | E711: =(C711*6)+D711 -> 20 | G711: 8 | H711: 2 | I711: =(G711*6)+H711 -> 50 | K711: 9 | L711: 5 | M711: =(K711*6)+L711 -> 59 | O711: 9 | P711: 7 | Q711: =(O711*6)+P711 -> 61
A712: BEST PLAYERS
A713: PORT MELBOURNE | C713: HENDERSON | F713: SANGSTER | I713: GOODALE | L713: McPHERSON | O713: ARNOLD | Q713: ROSE
A714: GEELONG | C714: LINDSAY | F714: STREET | I714: WOJCINSKI | L714: SIMPSON
A715: GOALKICKERS
A716: PORT MELBOURNE | C716: ARNOLD 3 | F716: FITZGERALD 2 | I716: GOODALE | K716: FILANDIA | M716: McPHERSON | P716: KIRK | Q716: HOLLOW | S716: CLARK
A717: GEELONG | C717: BALDWIN 2 | F717: PICKERING 2 | I717: T CLARK | K717: COWELL | M717: HARDING | P717: O'BRIEN | R717: RYAN
A719: FRANKSTON | C719: 2 | D719: 2 | E719: =(C719*6)+D719 -> 14 | G719: 9 | H719: 9 | I719: =(G719*6)+H719 -> 63 | K719: 12 | L719: 11 | M719: =(K719*6)+L719 -> 83 | O719: 20 | P719: 18 | Q719: =(O719*6)+P719 -> 138 | S719: Venue: FRANKSTON
A720: WILLIAMSTOWN | C720: 3 | D720: 0 | E720: =(C720*6)+D720 -> 18 | G720: 7 | H720: 4 | I720: =(G720*6)+H720 -> 46 | K720: 11 | L720: 7 | M720: =(K720*6)+L720 -> 73 | O720: 12 | P720: 10 | Q720: =(O720*6)+P720 -> 82
A721: BEST PLAYERS
A722: FRANKSTON | C722: MITCHELL | F722: DAN CLARKE | I722: DAM CLARKE | L722: MALLOY | O722: ROBERTS | Q722: WILLIAMS
A723: WILLIAMSTOWN | C723: HOLLOW | F723: PLUNKETT | I723: KING | L723: EAMES
A724: GOALKICKERS
A725: FRANKSTON | C725: WILLIAMS 7 | F725: DAM CLARKE 5 | J725: McCORMACK 2 | N725: MALLOY 2 | Q725: WEBB | S725: SULLIVAN | W725: BURNELL | X725: ANDERSON
A726: WILLIAMSTOWN | C726: PLUNKETT | F726: ANDERSON | I726: ROUND | K726: GHAZI | M726: TAYLOR | O726: EAMES | Q726: MACRI | S726: DOOLEY
A728: ST KILDA | C728: 5 | D728: 3 | E728: =(C728*6)+D728 -> 33 | G728: 8 | H728: 10 | I728: =(G728*6)+H728 -> 58 | K728: 12 | L728: 15 | M728: =(K728*6)+L728 -> 87 | O728: 17 | P728: 18 | Q728: =(O728*6)+P728 -> 120 | S728: Venue: MOORABBIN
A729: PRESTON | C729: 0 | D729: 3 | E729: =(C729*6)+D729 -> 3 | G729: 0 | H729: 4 | I729: =(G729*6)+H729 -> 4 | K729: 9 | L729: 7 | M729: =(K729*6)+L729 -> 61 | O729: 10 | P729: 10 | Q729: =(O729*6)+P729 -> 70
A730: BEST PLAYERS
A731: ST KILDA | C731: SIERAKOWSKI | F731: PITTS | I731: BROWN | K731: BAKER | N731: ELLIOTT | Q731: PLATT
A732: PRESTON | C732: HAYWARD | F732: MOYLE | I732: FROST | K732: ZORZI | N732: GIBSON | Q732: GRAINGER
A733: GOALKICKERS
A734: ST KILDA | C734: WULF 4 | E734: WALTON 2 | H734: SIERAKOWSKI 2 | K734: RYAN 2 | M734: MITCHELL 2 | P734: DAVIS | R734: MILNE | T734: YOUNG | W734: CRANAGE | X734: PLAPP
A735: PRESTON | C735: GIBSON 4 | F735: GRAINGER 2 | I735: FROST | K735: CANN | M735: D EVANS | O735: GROSSMAN
A737: MURRAY KANGAROOS | C737: 8 | D737: 5 | E737: =(C737*6)+D737 -> 53 | G737: 13 | H737: 9 | I737: =(G737*6)+H737 -> 87 | K737: 16 | L737: 16 | M737: =(K737*6)+L737 -> 112 | O737: 21 | P737: 18 | Q737: =(O737*6)+P737 -> 144 | S737: Venue: M.C.G. (C/R)
A738: CARLTON | C738: 3 | D738: 2 | E738: =(C738*6)+D738 -> 20 | G738: 5 | H738: 4 | I738: =(G738*6)+H738 -> 34 | K738: 7 | L738: 5 | M738: =(K738*6)+L738 -> 47 | O738: 9 | P738: 7 | Q738: =(O738*6)+P738 -> 61
A739: BEST PLAYERS
A740: MURRAY KANGAROOS | C740: CAPUANO | F740: CHANDLER | I740: AINLEY | K740: SPAULL | N740: COLBERT | Q740: RAWLINGS
A741: CARLTON | C741: HOULIHAN | F741: PORTER | I741: PASSADOR
A742: GOALKICKERS
A743: MURRAY KANGAROOS | C743: SPAULL 6 | E743: HEWITT 4 | G743: WOODLEY 2 | J743: CHANDLER 2 | M743: CAPUANO 2 | P743: COLBERT | R743: ANDERSON | U743: HAY | W743: RAWLINGS | X743: ABLETT
A744: CARLTON | C744: BACKWELL 3 | F744: PASSADOR 2 | I744: NELSON | K744: MERRINGTON | N744: HOULIHAN | Q744: DELUILIO
D745: 8TH MAY | H745: NIGHT MATCH | K745: WEATHER
A746: SPRINGVALE | C746: 4 | D746: 4 | E746: =(C746*6)+D746 -> 28 | G746: 9 | H746: 6 | I746: =(G746*6)+H746 -> 60 | K746: 13 | L746: 8 | M746: =(K746*6)+L746 -> 86 | O746: 15 | P746: 12 | Q746: =(O746*6)+P746 -> 102 | S746: Venue: WAVERLEY
A747: COBURG | C747: 1 | D747: 4 | E747: =(C747*6)+D747 -> 10 | G747: 6 | H747: 5 | I747: =(G747*6)+H747 -> 41 | K747: 8 | L747: 6 | M747: =(K747*6)+L747 -> 54 | O747: 12 | P747: 7 | Q747: =(O747*6)+P747 -> 79
A748: BEST PLAYERS
A749: SPRINGVALE | C749: O'BRIEN | F749: PITT | I749: ROBBINS | L749: SHEAHAN | O749: RIGG | Q749: DELARUE
A750: COBURG | C750: KEENAN | F750: McLEOD | I750: MORRISON | L750: TORTORA
A751: GOALKICKERS
A752: SPRINGVALE | C752: SMITH 3 | E752: PITT 3 | G752: DILLON 2 | I752: MEYER 2 | K752: COURTNEY | N752: DELARUE | P752: IRISH | R752: LOGAN | T752: ROBBINS
A753: COBURG | C753: ALESSIO 2 | F753: CANNING 2 | I753: LAPPIN 2 | K753: BOSSI | M753: HOGG | O753: T LITTLE | Q753: KEENAN | S753: DEPASQUALE | W753: McKENZIE-McHARG
A755: ROUND 10 | D755: 20TH MAY | J755: WEATHER
D756: 1ST QTR | H756: 2ND QTR | L756: 3RD QTR | P756: FINAL
A757: CARLTON | C757: 2 | D757: 5 | E757: =(C757*6)+D757 -> 17 | G757: 4 | H757: 6 | I757: =(G757*6)+H757 -> 30 | K757: 8 | L757: 12 | M757: =(K757*6)+L757 -> 60 | O757: 9 | P757: 15 | Q757: =(O757*6)+P757 -> 69 | S757: Venue: OPTUS OVAL (C/R) | Y757: LADDER | AB757: ROUND | AD757: 10
A758: FRANKSTON | C758: 1 | D758: 3 | E758: =(C758*6)+D758 -> 9 | G758: 7 | H758: 7 | I758: =(G758*6)+H758 -> 49 | K758: 9 | L758: 7 | M758: =(K758*6)+L758 -> 61 | O758: 10 | P758: 7 | Q758: =(O758*6)+P758 -> 67
A759: BEST PLAYERS | W759: TEAM | X759: W | Y759: L | Z759: D | AA759: FOR | AB759: AGST | AC759: % | AD759: PTS
A760: CARLTON | C760: NELSON | F760: SEXTON | I760: PASSADOR | L760: DUKES | N760: DOERING
A761: FRANKSTON | C761: BURNELL | F761: CORN | I761: DAFF | L761: ROBERTS | W761: SANDRINGHAM | X761: 9 | Y761: 1 | Z761: 0 | AA761: 1214 | AB761: 772 | AC761: =(AA761/AB761)*100 -> 157.25388601036269 | AD761: =(X761*4)+(Z761*2) -> 36
A762: GOALKICKERS | W762: ST KILDA | X762: 8 | Y762: 2 | Z762: 0 | AA762: 1110 | AB762: 816 | AC762: =(AA762/AB762)*100 -> 136.02941176470588 | AD762: =(X762*4)+(Z762*2) -> 32
A763: CARLTON | C763: DOERING 2 | F763: CARROLL 2 | I763: GRAHAM | K763: PASSADOR | M763: BACKWELL | P763: MERRINGTON | S763: FEVOLA | W763: BOX HILL | X763: 8 | Y763: 2 | Z763: 0 | AA763: 1087 | AB763: 848 | AC763: =(AA763/AB763)*100 -> 128.18396226415095 | AD763: =(X763*4)+(Z763*2) -> 32
A764: FRANKSTON | C764: DAM CLARKE 3 | F764: WEBB 2 | H764: DAN CLARKE | K764: MURRAY | M764: ANDERSON | P764: McCORMACK | S764: GEORGE | W764: GEELONG | X764: 8 | Y764: 2 | Z764: 0 | AA764: 1048 | AB764: 822 | AC764: =(AA764/AB764)*100 -> 127.49391727493918 | AD764: =(X764*4)+(Z764*2) -> 32
W765: NORTH BALLARAT | X765: 7 | Y765: 3 | Z765: 0 | AA765: 849 | AB765: 616 | AC765: =(AA765/AB765)*100 -> 137.82467532467533 | AD765: =(X765*4)+(Z765*2) -> 28
A766: GEELONG | C766: 4 | D766: 2 | E766: =(C766*6)+D766 -> 26 | G766: 6 | H766: 5 | I766: =(G766*6)+H766 -> 41 | K766: 8 | L766: 6 | M766: =(K766*6)+L766 -> 54 | O766: 9 | P766: 9 | Q766: =(O766*6)+P766 -> 63 | S766: Venue: SHELL STADIUM | W766: WILLIAMSTOWN | X766: 7 | Y766: 3 | Z766: 0 | AA766: 967 | AB766: 900 | AC766: =(AA766/AB766)*100 -> 107.44444444444446 | AD766: =(X766*4)+(Z766*2) -> 28
A767: NORTH BALLARAT | C767: 2 | D767: 0 | E767: =(C767*6)+D767 -> 12 | G767: 5 | H767: 5 | I767: =(G767*6)+H767 -> 35 | K767: 6 | L767: 8 | M767: =(K767*6)+L767 -> 44 | O767: 8 | P767: 10 | Q767: =(O767*6)+P767 -> 58 | W767: WERRIBEE | X767: 6 | Y767: 3 | Z767: 1 | AA767: 1096 | AB767: 927 | AC767: =(AA767/AB767)*100 -> 118.23085221143475 | AD767: =(X767*4)+(Z767*2) -> 26
A768: BEST PLAYERS | W768: CARLTON | X768: 6 | Y768: 4 | Z768: 0 | AA768: 1063 | AB768: 948 | AC768: =(AA768/AB768)*100 -> 112.13080168776371 | AD768: =(X768*4)+(Z768*2) -> 24
A769: GEELONG | C769: LINDSAY | F769: SIMPSON | I769: CLARK | L769: CHAPMAN | N769: HALL | Q769: KARAMATIC
A770: NORTH BALLARAT | C770: FIELD | F770: J POLKINGHORNE | J770: SOMERVILLE | M770: MURRIHY | O770: SNIBSON | Q770: POWER | W770: COLLINGWOOD | X770: 6 | Y770: 4 | Z770: 0 | AA770: 942 | AB770: 937 | AC770: =(AA770/AB770)*100 -> 100.53361792956244 | AD770: =(X770*4)+(Z770*2) -> 24
A771: GOALKICKERS | W771: FRANKSTON | X771: 5 | Y771: 5 | Z771: 0 | AA771: 1110 | AB771: 962 | AC771: =(AA771/AB771)*100 -> 115.38461538461537 | AD771: =(X771*4)+(Z771*2) -> 20
A772: GEELONG | C772: T CLARK 2 | F772: BALDWIN | I772: BRAY | K772: CHAPMAN | M772: FOSTER | O772: HARDING | Q772: LINDSAY | S772: STREET | W772: SPRINGVALE | X772: 4 | Y772: 5 | Z772: 1 | AA772: 842 | AB772: 946 | AC772: =(AA772/AB772)*100 -> 89.006342494714588 | AD772: =(X772*4)+(Z772*2) -> 18
A773: NORTH BALLARAT | C773: SIER 2 | F773: SOMERVILLE 2 | J773: CLARKE | L773: FUNCKE | N773: CLAYTON | P773: GREIG | W773: PORT MELBOURNE | X773: 4 | Y773: 6 | Z773: 0 | AA773: 866 | AB773: 945 | AC773: =(AA773/AB773)*100 -> 91.640211640211646 | AD773: =(X773*4)+(Z773*2) -> 16
W774: ESSENDON | X774: 4 | Y774: 6 | Z774: 0 | AA774: 822 | AB774: 1045 | AC774: =(AA774/AB774)*100 -> 78.660287081339703 | AD774: =(X774*4)+(Z774*2) -> 16
A775: SANDRINGHAM | C775: 6 | D775: 4 | E775: =(C775*6)+D775 -> 40 | G775: 6 | H775: 8 | I775: =(G775*6)+H775 -> 44 | K775: 16 | L775: 15 | M775: =(K775*6)+L775 -> 111 | O775: 17 | P775: 20 | Q775: =(O775*6)+P775 -> 122 | S775: Venue: BEACH ROAD | W775: MURRAY KANGAROOS | X775: 3 | Y775: 7 | Z775: 0 | AA775: 816 | AB775: 1050 | AC775: =(AA775/AB775)*100 -> 77.714285714285708 | AD775: =(X775*4)+(Z775*2) -> 12
A776: ST KILDA | C776: 3 | D776: 0 | E776: =(C776*6)+D776 -> 18 | G776: 6 | H776: 7 | I776: =(G776*6)+H776 -> 43 | K776: 7 | L776: 7 | M776: =(K776*6)+L776 -> 49 | O776: 8 | P776: 10 | Q776: =(O776*6)+P776 -> 58 | W776: COBURG | X776: 2 | Y776: 8 | Z776: 0 | AA776: 836 | AB776: 933 | AC776: =(AA776/AB776)*100 -> 89.60342979635584 | AD776: =(X776*4)+(Z776*2) -> 8
A777: BEST PLAYERS | W777: PRESTON | X777: 2 | Y777: 8 | Z777: 0 | AA777: 803 | AB777: 1264 | AC777: =(AA777/AB777)*100 -> 63.528481012658233 | AD777: =(X777*4)+(Z777*2) -> 8
A778: SANDRINGHAM | C778: LIDDELL | F778: COLLINS | I778: SHANAHAN | L778: SAUTNER | O778: TREGEAR | Q778: FEBEY | W778: RICHMOND | X778: 1 | Y778: 9 | Z778: 0 | AA778: 848 | AB778: 1252 | AC778: =(AA778/AB778)*100 -> 67.731629392971243 | AD778: =(X778*4)+(Z778*2) -> 4
A779: ST KILDA | C779: PLAPP | F779: SCHWARZE | I779: WALTON | L779: BAKER | W779: BENDIGO | X779: 0 | Y779: 10 | Z779: 0 | AA779: 712 | AB779: 1226 | AC779: =(AA779/AB779)*100 -> 58.075040783034261 | AD779: =(X779*4)+(Z779*2) -> 0
A780: GOALKICKERS | P780: PITT | R780: JOHNSTONE
A781: SANDRINGHAM | C781: SAUTNER 6 | F781: HAYNES 2 | I781: BEAMS 2 | K781: GODFREY | M781: FEBEY | N781: MACGEORGE | Q781: COLLINS | S781: LIDDELL
A782: ST KILDA | C782: WALTON 2 | F782: BROWN | H782: HEATLEY | J782: CHARLES | L782: PLAPP | N782: MITCHELL | Q782: FORTNAM
A784: ESSENDON | C784: 5 | D784: 5 | E784: =(C784*6)+D784 -> 35 | G784: 10 | H784: 9 | I784: =(G784*6)+H784 -> 69 | K784: 13 | L784: 14 | M784: =(K784*6)+L784 -> 92 | O784: 16 | P784: 15 | Q784: =(O784*6)+P784 -> 111 | S784: Venue: PORT MELBOURNE
A785: PORT MELBOURNE | C785: 3 | D785: 3 | E785: =(C785*6)+D785 -> 21 | G785: 6 | H785: 4 | I785: =(G785*6)+H785 -> 40 | K785: 7 | L785: 5 | M785: =(K785*6)+L785 -> 47 | O785: 10 | P785: 12 | Q785: =(O785*6)+P785 -> 72
A786: BEST PLAYERS
A787: ESSENDON | C787: McVEIGH | F787: ALESSIO | I787: EASTAUGH | L787: DENHAM | O787: McALISTER | R787: BOLTON
A788: PORT MELBOURNE | C788: FILANDIA | F788: BENNETT | I788: GOODALE | L788: SIMPSON | O788: McPHERSON | R788: ROSE
A789: GOALKICKERS
A790: ESSENDON | C790: McVEIGH 5 | F790: EASTAUGH 3 | I790: McALISTER | L790: HILLE | N790: MOORCROFT | Q790: PRIOR | S790: LADHAMS | W790: LALICH | X790: BOLTON | Z790: DENHAM
A791: PORT MELBOURNE | C791: CLARK 2 | F791: ARNOLD 2 | I791: CREDLIN | K791: FILANDIA | M791: BENNETT | O791: GOODALE | Q791: KIRK | R791: McPHERSON
D792: 21ST MAY | J792: WEATHER
A793: WERRIBEE | C793: 5 | D793: 3 | E793: =(C793*6)+D793 -> 33 | G793: 13 | H793: 7 | I793: =(G793*6)+H793 -> 85 | K793: 16 | L793: 10 | M793: =(K793*6)+L793 -> 106 | O793: 20 | P793: 14 | Q793: =(O793*6)+P793 -> 134 | S793: Venue: PUNT ROAD
A794: RICHMOND | C794: 4 | D794: 3 | E794: =(C794*6)+D794 -> 27 | G794: 5 | H794: 7 | I794: =(G794*6)+H794 -> 37 | K794: 5 | L794: 9 | M794: =(K794*6)+L794 -> 39 | O794: 7 | P794: 9 | Q794: =(O794*6)+P794 -> 51
A795: BEST PLAYERS
A796: WERRIBEE | C796: ROBERTSON | F796: FAULKINER | I796: WIGGINS | L796: FROST | N796: SUTTON | Q796: DENT
A797: RICHMOND | C797: ARTHURSON | F797: PROCTOR | I797: T EDWARDS | L797: ROMBOTIS
A798: GOALKICKERS
A799: WERRIBEE | C799: WIGGINS 4 | F799: MITCHELL 4 | I799: BAKER 3 | K799: BUTTON 2 | M799: FULLER 2 | O799: HIDE | Q799: PENNY | S799: KRETIUK | V799: DYER | X799: GILBEE
A800: RICHMOND | C800: POWELL 2 | F800: GREIG | H800: HOMEWOOD | J800: WHITE | L800: HAYNES | N800: JEWELL
A802: SPRINGVALE | C802: 1 | D802: 2 | E802: =(C802*6)+D802 -> 8 | G802: 7 | H802: 8 | I802: =(G802*6)+H802 -> 50 | K802: 10 | L802: 11 | M802: =(K802*6)+L802 -> 71 | O802: 14 | P802: 16 | Q802: =(O802*6)+P802 -> 100 | S802: Venue: WAVERLEY
A803: BOX HILL | C803: 3 | D803: 1 | E803: =(C803*6)+D803 -> 19 | G803: 5 | H803: 3 | I803: =(G803*6)+H803 -> 33 | K803: 8 | L803: 4 | M803: =(K803*6)+L803 -> 52 | O803: 11 | P803: 6 | Q803: =(O803*6)+P803 -> 72
A804: BEST PLAYERS
A805: SPRINGVALE | C805: CARROLL | F805: TROLLOPE | I805: PITT | L805: ROBBINS | N805: CLARK | Q805: MEYER
A806: BOX HILL | C806: PICIAONE | F806: JOHNSON | I806: McPHARLIN | L806: MANN | N806: BREWER | Q806: RODE
A807: GOALKICKERS
A808: SPRINGVALE | C808: PITT 4 | E808: MEYER 3 | H808: SMITH 2 | J808: CARROLL | L808: CARMODY | N808: LOGAN | P808: LITTLE | R808: O'BRIEN
A809: BOX HILL | C809: MANN 3 | F809: LOATS 2 | I809: NICHOLLS | K809: RODE | M809: HAZELL | O809: MALSEED | Q809: TUCK | S809: HABERFIELD
D810: 22ND MAY | G810: NIGHT MATCH | J810: WEATHER
A811: WILLIAMSTOWN | C811: 3 | D811: 1 | E811: =(C811*6)+D811 -> 19 | G811: 8 | H811: 5 | I811: =(G811*6)+H811 -> 53 | K811: 13 | L811: 8 | M811: =(K811*6)+L811 -> 86 | O811: 15 | P811: 12 | Q811: =(O811*6)+P811 -> 102 | S811: Venue: WAVERLEY
A812: BENDIGO | C812: 3 | D812: 5 | E812: =(C812*6)+D812 -> 23 | G812: 6 | H812: 6 | I812: =(G812*6)+H812 -> 42 | K812: 11 | L812: 11 | M812: =(K812*6)+L812 -> 77 | O812: 14 | P812: 11 | Q812: =(O812*6)+P812 -> 95
A813: BEST PLAYERS
A814: WILLIAMSTOWN | C814: ROBINS | F814: PLUNKETT | I814: SMOKER | L814: GHAZI | N814: BROWN | Q814: KING
A815: BENDIGO | C815: TOINTON | F815: SUTHERLAND | I815: BEAU SHIELS | L815: CARTER | N815: BROWN | Q815: WHITSED
A816: GOALKICKERS
A817: WILLIAMSTOWN | C817: DOOLEY 4 | F817: MAHONEY 2 | I817: MANES 2 | K817: MACRI 2 | M817: BOWDEN 2 | P817: TAYLOR | R817: GHAZI | T817: SMOKER
A818: BENDIGO | C818: BEAU SHIELS 6 | F818: O'TOOLE 2 | I818: BOWER | K818: BROWN | M818: CONNAUGHTON | P818: GATHERCOLE | S818: ROGERS | V818: WALSH
D819: 27TH MAY | J819: WEATHER
A820: MURRAY KANGAROOS | C820: 3 | D820: 4 | E820: =(C820*6)+D820 -> 22 | G820: 7 | H820: 8 | I820: =(G820*6)+H820 -> 50 | K820: 12 | L820: 9 | M820: =(K820*6)+L820 -> 81 | O820: 14 | P820: 10 | Q820: =(O820*6)+P820 -> 94 | S820: Venue: VICTORIA PARK
A821: PRESTON | C821: 2 | D821: 5 | E821: =(C821*6)+D821 -> 17 | G821: 4 | H821: 6 | I821: =(G821*6)+H821 -> 30 | K821: 9 | L821: 9 | M821: =(K821*6)+L821 -> 63 | O821: 13 | P821: 11 | Q821: =(O821*6)+P821 -> 89
A822: BEST PLAYERS
A823: MURRAY KANGAROOS | C823: STEPHENS | F823: TEAGUE | I823: ANDERSON | L823: SHOLL | N823: ABLETT | Q823: HILTON
A824: PRESTON | C824: CANN | F824: LEE | I824: CLARKE | L824: ZORZI | N824: GRAINGER | Q824: MOYLE
A825: GOALKICKERS
A826: MURRAY KANGAROOS | C826: SPAULL 3 | F826: COCHRANE 2 | I826: DHURKAY 2 | L826: STEPHENS | N826: ABLETT | P826: HEWITT | R826: KINGSLEY | U826: LANGE | X826: AINLEY | Z826: PAGAN
A827: PRESTON | C827: GRAINGER 3 | F827: MOYLE 3 | I827: CLARKE 2 | L827: D EVANS | N827: PENN | P827: HILL | Q827: CANN | R827: BLIGHT
D828: 29TH MAY | H828: NIGHT MATCH | K828: WEATHER
A829: COLLINGWOOD | C829: 2 | D829: 2 | E829: =(C829*6)+D829 -> 14 | G829: 6 | H829: 6 | I829: =(G829*6)+H829 -> 42 | K829: 8 | L829: 12 | M829: =(K829*6)+L829 -> 60 | O829: 13 | P829: 16 | Q829: =(O829*6)+P829 -> 94 | S829: Venue: WAVERLEY
A830: COBURG | C830: 1 | D830: 2 | E830: =(C830*6)+D830 -> 8 | G830: 2 | H830: 3 | I830: =(G830*6)+H830 -> 15 | K830: 2 | L830: 5 | M830: =(K830*6)+L830 -> 17 | O830: 4 | P830: 7 | Q830: =(O830*6)+P830 -> 31
A831: BEST PLAYERS
A832: COLLINGWOOD | C832: LYON | F832: CROSISCA | I832: DIMMATINA | L832: OBORNE | N832: PATTERSON | Q832: SHEEHAN
A833: COBURG | C833: MORRISON | F833: TORIORI | I833: ALOI | L833: LITTLE | N833: WILLOUGHBY
A834: GOALKICKERS
A835: COLLINGWOOD | C835: DAVIS 4 | E835: JOHNSON 2 | H835: PATTERSON | J835: McKEE | L835: OBORNE | N835: SCOTLAND | Q835: DIMMATINA | T835: MARTELLO | X835: TUCKEY
A836: COBURG | C836: RYAN 3 | F836: CANNING
A838: ROUND 11 | D838: 3RD JUNE | J838: WEATHER
D839: 1ST QTR | H839: 2ND QTR | L839: 3RD QTR | P839: FINAL
A840: FRANKSTON | C840: 4 | D840: 6 | E840: =(C840*6)+D840 -> 30 | G840: 6 | H840: 8 | I840: =(G840*6)+H840 -> 44 | K840: 8 | L840: 12 | M840: =(K840*6)+L840 -> 60 | O840: 15 | P840: 17 | Q840: =(O840*6)+P840 -> 107 | S840: Venue: FRANKSTON | Y840: LADDER | AB840: ROUND | AD840: 11
A841: COLLINGWOOD | C841: 3 | D841: 2 | E841: =(C841*6)+D841 -> 20 | G841: 7 | H841: 10 | I841: =(G841*6)+H841 -> 52 | K841: 13 | L841: 13 | M841: =(K841*6)+L841 -> 91 | O841: 14 | P841: 14 | Q841: =(O841*6)+P841 -> 98
A842: BEST PLAYERS | W842: TEAM | X842: W | Y842: L | Z842: D | AA842: FOR | AB842: AGST | AC842: % | AD842: PTS
A843: FRANKSTON | C843: MALLOY | F843: GEORGIOU | I843: CORRIGAN | L843: DAN CLARKE | O843: DAM CLARKE | R843: MURRAY
A844: COLLINGWOOD | C844: JACOTINE | F844: SCOTLAND | I844: LYON | L844: OBORNE | O844: SHAW | R844: WATSON | W844: SANDRINGHAM | X844: 10 | Y844: 1 | Z844: 0 | AA844: 1340 | AB844: 839 | AC844: =(AA844/AB844)*100 -> 159.71394517282479 | AD844: =(X844*4)+(Z844*2) -> 40
A845: GOALKICKERS | M845: SULLIVAN | O845: D CLARKE | R845: BURNELL | W845: GEELONG | X845: 9 | Y845: 2 | Z845: 0 | AA845: 1197 | AB845: 893 | AC845: =(AA845/AB845)*100 -> 134.04255319148936 | AD845: =(X845*4)+(Z845*2) -> 36
A846: FRANKSTON | C846: DAN CLARKE 4 | F846: ANDERSON 3 | I846: LAWRENCE | L846: GEORGIOU | N846: MURRAY | P846: McCORMACK | S846: CORRIGAN | W846: NORTH BALLARAT | X846: 8 | Y846: 3 | Z846: 0 | AA846: 983 | AB846: 721 | AC846: =(AA846/AB846)*100 -> 136.3384188626907 | AD846: =(X846*4)+(Z846*2) -> 32
A847: COLLINGWOOD | C847: TUCKEY 3 | F847: JOHNSON 3 | I847: WASLEY 2 | L847: PATTERSON 2 | O847: SCOTLAND | Q847: DAVIS | S847: SMITH | W847: ST KILDA | X847: 8 | Y847: 3 | Z847: 0 | AA847: 1197 | AB847: 918 | AC847: =(AA847/AB847)*100 -> 130.39215686274511 | AD847: =(X847*4)+(Z847*2) -> 32
Q848: GARDINER | W848: BOX HILL | X848: 8 | Y848: 3 | Z848: 0 | AA848: 1137 | AB848: 930 | AC848: =(AA848/AB848)*100 -> 122.25806451612904 | AD848: =(X848*4)+(Z848*2) -> 32
A849: GEELONG | C849: 5 | D849: 3 | E849: =(C849*6)+D849 -> 33 | G849: 12 | H849: 8 | I849: =(G849*6)+H849 -> 80 | K849: 16 | L849: 11 | M849: =(K849*6)+L849 -> 107 | O849: 23 | P849: 11 | Q849: =(O849*6)+P849 -> 149 | S849: Venue: VICTORIA PARK | W849: WILLIAMSTOWN | X849: 8 | Y849: 3 | Z849: 0 | AA849: 1070 | AB849: 965 | AC849: =(AA849/AB849)*100 -> 110.88082901554404 | AD849: =(X849*4)+(Z849*2) -> 32
A850: PRESTON | C850: 2 | D850: 2 | E850: =(C850*6)+D850 -> 14 | G850: 4 | H850: 7 | I850: =(G850*6)+H850 -> 31 | K850: 8 | L850: 11 | M850: =(K850*6)+L850 -> 59 | O850: 10 | P850: 11 | Q850: =(O850*6)+P850 -> 71 | W850: WERRIBEE | X850: 7 | Y850: 3 | Z850: 1 | AA850: 1178 | AB850: 977 | AC850: =(AA850/AB850)*100 -> 120.57318321392016 | AD850: =(X850*4)+(Z850*2) -> 30
A851: BEST PLAYERS | W851: CARLTON | X851: 7 | Y851: 4 | Z851: 0 | AA851: 1138 | AB851: 1017 | AC851: =(AA851/AB851)*100 -> 111.89773844641103 | AD851: =(X851*4)+(Z851*2) -> 28
A852: GEELONG | C852: HALL | F852: PICKERING | I852: COREY | L852: SIMPSON | O852: LINDSAY | R852: CORRIGAN
A853: PRESTON | C853: ZORZI | F853: GIBSON | I853: LEE | L853: CANN | O853: FROST | R853: GRAINGER | W853: FRANKSTON | X853: 6 | Y853: 5 | Z853: 0 | AA853: 1217 | AB853: 1060 | AC853: =(AA853/AB853)*100 -> 114.81132075471699 | AD853: =(X853*4)+(Z853*2) -> 24
A854: GOALKICKERS | F854: ENRIGHT | H854: HALL | J854: KARAMATIC | M854: LINDSAY | O854: O'BRIEN | Q854: PICKERING | S854: WOJCINSKI | W854: COLLINGWOOD | X854: 6 | Y854: 5 | Z854: 0 | AA854: 1040 | AB854: 1044 | AC854: =(AA854/AB854)*100 -> 99.616858237547888 | AD854: =(X854*4)+(Z854*2) -> 24
A855: GEELONG | C855: STREET 4 | E855: ARNOTT 3 | G855: C MOONEY 3 | J855: P LYNCH 2 | M855: HARDING 2 | P855: BALDWIN | R855: COREY | W855: SPRINGVALE | X855: 5 | Y855: 5 | Z855: 1 | AA855: 944 | AB855: 1033 | AC855: =(AA855/AB855)*100 -> 91.384317521781227 | AD855: =(X855*4)+(Z855*2) -> 22
A856: PRESTON | C856: CANN 2 | F856: PENN | H856: HILL | I856: GRAINGER | K856: LEE | L856: MOYLE | N856: ZORZI | P856: CARACELLA | R856: CUSACK | W856: PORT MELBOURNE | X856: 4 | Y856: 7 | Z856: 0 | AA856: 913 | AB856: 997 | AC856: =(AA856/AB856)*100 -> 91.574724172517548 | AD856: =(X856*4)+(Z856*2) -> 16
W857: ESSENDON | X857: 4 | Y857: 7 | Z857: 0 | AA857: 889 | AB857: 1171 | AC857: =(AA857/AB857)*100 -> 75.918018787361234 | AD857: =(X857*4)+(Z857*2) -> 16
A858: WERRIBEE | C858: 3 | D858: 2 | E858: =(C858*6)+D858 -> 20 | G858: 4 | H858: 7 | I858: =(G858*6)+H858 -> 31 | K858: 11 | L858: 8 | M858: =(K858*6)+L858 -> 74 | O858: 12 | P858: 10 | Q858: =(O858*6)+P858 -> 82 | S858: Venue: WERRIBEE | W858: MURRAY KANGAROOS | X858: 3 | Y858: 8 | Z858: 0 | AA858: 921 | AB858: 1184 | AC858: =(AA858/AB858)*100 -> 77.787162162162161 | AD858: =(X858*4)+(Z858*2) -> 12
A859: BOX HILL | C859: 3 | D859: 2 | E859: =(C859*6)+D859 -> 20 | G859: 4 | H859: 4 | I859: =(G859*6)+H859 -> 28 | K859: 5 | L859: 6 | M859: =(K859*6)+L859 -> 36 | O859: 7 | P859: 8 | Q859: =(O859*6)+P859 -> 50 | W859: COBURG | X859: 2 | Y859: 9 | Z859: 0 | AA859: 901 | AB859: 1036 | AC859: =(AA859/AB859)*100 -> 86.969111969111964 | AD859: =(X859*4)+(Z859*2) -> 8
A860: BEST PLAYERS | W860: RICHMOND | X860: 2 | Y860: 9 | Z860: 0 | AA860: 900 | AB860: 1299 | AC860: =(AA860/AB860)*100 -> 69.284064665127019 | AD860: =(X860*4)+(Z860*2) -> 8
A861: WERRIBEE | C861: SMITH | F861: FAULKINER | I861: CHURCHILL | L861: SUTTON | O861: HYDE | Q861: DENT | W861: PRESTON | X861: 2 | Y861: 9 | Z861: 0 | AA861: 874 | AB861: 1413 | AC861: =(AA861/AB861)*100 -> 61.854210898796893 | AD861: =(X861*4)+(Z861*2) -> 8
A862: BOX HILL | C862: LOATS | F862: NICHOLLS | I862: COX | L862: MANN | O862: OBST | W862: BENDIGO | X862: 0 | Y862: 11 | Z862: 0 | AA862: 781 | AB862: 1301 | AC862: =(AA862/AB862)*100 -> 60.030745580322829 | AD862: =(X862*4)+(Z862*2) -> 0
A863: GOALKICKERS
A864: WERRIBEE | C864: KRETIUK 3 | F864: DENT 2 | I864: MITCHELL 2 | L864: ATKINS 2 | N864: BUTTON | P864: ALVEY | R864: WIGGINS
A865: BOX HILL | C865: BANKS 2 | F865: BATEMAN 2 | I865: HABERFIELD 2 | M865: MANN
A867: SPRINGVALE | C867: 2 | D867: 2 | E867: =(C867*6)+D867 -> 14 | G867: 5 | H867: 6 | I867: =(G867*6)+H867 -> 36 | K867: 8 | L867: 11 | M867: =(K867*6)+L867 -> 59 | O867: 14 | P867: 18 | Q867: =(O867*6)+P867 -> 102 | S867: Venue: WAVERLEY
A868: ST KILDA | C868: 3 | D868: 3 | E868: =(C868*6)+D868 -> 21 | G868: 7 | H868: 5 | I868: =(G868*6)+H868 -> 47 | K868: 11 | L868: 11 | M868: =(K868*6)+L868 -> 77 | O868: 12 | P868: 15 | Q868: =(O868*6)+P868 -> 87
A869: BEST PLAYERS
A870: SPRINGVALE | C870: CAPLES | F870: SUTHERLAND | I870: PITT | L870: CARROLL | O870: RIGG | Q870: LITTLE
A871: ST KILDA | C871: ELLIOTT | F871: PITTS | I871: WALTON | L871: BROWN | O871: YOUNG
A872: GOALKICKERS
A873: SPRINGVALE | C873: SMITH 4 | F873: CAPLES 2 | I873: DELARUE 2 | L873: LOGAN 2 | N873: PITT 2 | P873: CARMODY | R873: SHAW-DENNIS
A874: ST KILDA | C874: MITCHELL 3 | F874: HEATLEY 2 | I874: WULF 2 | K874: BAKER | M874: FORTNAM | O874: CHARLES | Q874: ELLIOTT | S874: WALTON
D875: 4TH JUNE | J875: WEATHER
A876: WILLIAMSTOWN | C876: 4 | D876: 4 | E876: =(C876*6)+D876 -> 28 | G876: 5 | H876: 7 | I876: =(G876*6)+H876 -> 37 | K876: 11 | L876: 13 | M876: =(K876*6)+L876 -> 79 | O876: 15 | P876: 13 | Q876: =(O876*6)+P876 -> 103 | S876: Venue: WILLIAMSTOWN
A877: COBURG | C877: 4 | D877: 2 | E877: =(C877*6)+D877 -> 26 | G877: 7 | H877: 8 | I877: =(G877*6)+H877 -> 50 | K877: 8 | L877: 8 | M877: =(K877*6)+L877 -> 56 | O877: 9 | P877: 11 | Q877: =(O877*6)+P877 -> 65
A878: BEST PLAYERS
A879: WILLIAMSTOWN | C879: P DOOLEY | F879: ROUND | I879: PLUNKETT | L879: MACRI | O879: GHAZI | Q879: LLOYD
A880: COBURG | C880: DE PASQUALE | F880: WESTON | I880: TORTORA | L880: WILLOUGHBY | O880: RYAN | Q880: VERNON
A881: GOALKICKERS
A882: WILLIAMSTOWN | C882: P DOOLEY 6 | F882: ROUND 2 | I882: SMOKER 2 | L882: KOLYNIUK 2 | O882: MAHONEY | Q882: GHAZI | S882: ROBBINS
A883: COBURG | C883: RYAN 4 | F883: ALESSIO | I883: BOSSI | K883: HOGG | M883: McKENZIE-McHARG | Q883: DEPASQUALE
A885: NORTH BALLARAT | C885: 6 | D885: 3 | E885: =(C885*6)+D885 -> 39 | G885: 13 | H885: 5 | I885: =(G885*6)+H885 -> 83 | K885: 19 | L885: 7 | M885: =(K885*6)+L885 -> 121 | O885: 21 | P885: 8 | Q885: =(O885*6)+P885 -> 134 | S885: Venue: COBURG
A886: MURRAY KANGAROOS | C886: 5 | D886: 2 | E886: =(C886*6)+D886 -> 32 | G886: 9 | H886: 3 | I886: =(G886*6)+H886 -> 57 | K886: 10 | L886: 4 | M886: =(K886*6)+L886 -> 64 | O886: 16 | P886: 9 | Q886: =(O886*6)+P886 -> 105
A887: BEST PLAYERS
A888: NORTH BALLARAT | C888: JURICA | F888: SOMERVILLE | I888: FIELD | L888: GREIG | N888: FUNCKE | Q888: POWER
A889: MURRAY KANGAROOS | C889: SHOLL | F889: COCHRANE | I889: SCOTT
A890: GOALKICKERS
A891: NORTH BALLARAT | C891: RYALL 5 | F891: JURICA 3 | I891: POWER 3 | K891: CLAYTON 2 | N891: FUNCKE 2 | Q891: SOMERVILLE 2 | T891: SIER | V891: CLARKE | X891: EDWARDS | AA891: FIELD
A892: MURRAY KANGAROOS | C892: SHOLL 6 | F892: HEWITT 4 | I892: DHURKAY 3 | L892: ANDERSON | N892: STEPHENS | Q892: ABLETT
A894: CARLTON | C894: 1 | D894: 0 | E894: =(C894*6)+D894 -> 6 | G894: 4 | H894: 2 | I894: =(G894*6)+H894 -> 26 | K894: 8 | L894: 4 | M894: =(K894*6)+L894 -> 52 | O894: 11 | P894: 9 | Q894: =(O894*6)+P894 -> 75 | S894: Venue: BENDIGO
A895: BENDIGO | C895: 0 | D895: 3 | E895: =(C895*6)+D895 -> 3 | G895: 4 | H895: 8 | I895: =(G895*6)+H895 -> 32 | K895: 7 | L895: 13 | M895: =(K895*6)+L895 -> 55 | O895: 9 | P895: 15 | Q895: =(O895*6)+P895 -> 69
A896: BEST PLAYERS
A897: CARLTON | C897: DOERING | F897: PORTER | I897: VANCE | L897: BACKWELL | O897: ORLANDO
A898: BENDIGO | C898: SCHMIDT | F898: CONNAUGHTON | I898: GEDDES | L898: ANGOVE | O898: PINNER | R898: TOINTON
A899: GOALKICKERS
A900: CARLTON | C900: CARROLL 2 | F900: PASSADOR 2 | I900: CULPITT | K900: PICKERING | N900: MASSIE | P900: DELULIO | R900: HOULIHAN | U900: MATTHEWS | X900: O'REILLY
A901: BENDIGO | C901: BOWER | E901: BOSWORTH | H901: BROWN | J901: DILLON | L901: GEDDES | N901: O'CALLAGHAN | Q901: SHIELLS | S901: WALSH | U901: WHITSED
A903: SANDRINGHAM | C903: 5 | D903: 5 | E903: =(C903*6)+D903 -> 35 | G903: 7 | H903: 10 | I903: =(G903*6)+H903 -> 52 | K903: 16 | L903: 11 | M903: =(K903*6)+L903 -> 107 | O903: 19 | P903: 12 | Q903: =(O903*6)+P903 -> 126 | S903: Venue: BEACH ROAD
A904: ESSENDON | C904: 3 | D904: 3 | E904: =(C904*6)+D904 -> 21 | G904: 5 | H904: 4 | I904: =(G904*6)+H904 -> 34 | K904: 7 | L904: 5 | M904: =(K904*6)+L904 -> 47 | O904: 10 | P904: 7 | Q904: =(O904*6)+P904 -> 67
A905: BEST PLAYERS
A906: SANDRINGHAM | C906: TREGEAR | F906: COGHLAN | I906: WILLIAMS | L906: McKELLAR | O906: WHEATLEY | R906: MACGEORGE
A907: ESSENDON | C907: LALICH | F907: PRIOR | I907: FRASER | L907: BERBAKOV | O907: BEWICK | R907: BOLTON
A908: GOALKICKERS
A909: SANDRINGHAM | C909: COOK 5 | E909: SAUTNER 4 | H909: PITT 3 | J909: MACGEORGE 2 | N909: BEAMS 2 | Q909: WILLIAMS | T909: OAKLEY | W909: OTTENS
A910: ESSENDON | C910: SWITALA 2 | F910: EASTAUGH 2 | I910: BEWICK 2 | L910: LALICH | N910: LADHAMS | Q910: HENNEMAN | T910: PODSIADLY
D911: 12TH JUNE | H911: NIGHT MATCH | K911: WEATHER
A912: RICHMOND | C912: 3 | D912: 2 | E912: =(C912*6)+D912 -> 20 | G912: 3 | H912: 2 | I912: =(G912*6)+H912 -> 20 | K912: 6 | L912: 3 | M912: =(K912*6)+L912 -> 39 | O912: 8 | P912: 4 | Q912: =(O912*6)+P912 -> 52 | S912: Venue: WAVERLEY
A913: PORT MELBOURNE | C913: 1 | D913: 3 | E913: =(C913*6)+D913 -> 9 | G913: 4 | H913: 7 | I913: =(G913*6)+H913 -> 31 | K913: 5 | L913: 10 | M913: =(K913*6)+L913 -> 40 | O913: 6 | P913: 11 | Q913: =(O913*6)+P913 -> 47
A914: BEST PLAYERS
A915: RICHMOND | C915: SAMPSON | F915: T EDWARDS | I915: POYAS | K915: POWELL | N915: ARTHURSON | Q915: CLOKE
A916: PORT MELBOURNE | C916: BENNETT | F916: SWAN | I916: ELLIOTT | K916: CROW
A917: GOALKICKERS
A918: RICHMOND | C918: POWELL 4 | F918: EVANS | H918: BURGEIL | J918: SAMPSON | M918: PROCTOR
A919: PORT MELBOURNE | C919: O'KEEFE 3 | F919: FILANDIA | I919: HENDERSON | L919: SWAN
A921: ROUND 12 | D921: 10TH JUNE | J921: WEATHER
D922: 1ST QTR | H922: 2ND QTR | L922: 3RD QTR | P922: FINAL
A923: GEELONG | C923: 5 | D923: 2 | E923: =(C923*6)+D923 -> 32 | G923: 6 | H923: 4 | I923: =(G923*6)+H923 -> 40 | K923: 12 | L923: 9 | M923: =(K923*6)+L923 -> 81 | O923: 15 | P923: 12 | Q923: =(O923*6)+P923 -> 102 | S923: Venue: COBURG | Y923: LADDER | AB923: ROUND | AD923: 12
A924: COBURG | C924: 2 | D924: 2 | E924: =(C924*6)+D924 -> 14 | G924: 7 | H924: 3 | I924: =(G924*6)+H924 -> 45 | K924: 8 | L924: 3 | M924: =(K924*6)+L924 -> 51 | O924: 10 | P924: 6 | Q924: =(O924*6)+P924 -> 66
A925: BEST PLAYERS | W925: TEAM | X925: W | Y925: L | Z925: D | AA925: FOR | AB925: AGST | AC925: % | AD925: PTS
A926: GEELONG | C926: CORRIGAN | F926: CHAPMAN | I926: ARNOTT | L926: T CLARKE | O926: STREET | R926: HARDING
A927: COBURG | C927: WESTON | F927: WILLOUGHBY | I927: DEPASQUALE | L927: RYAN | O927: McKENZIE-McHARG | W927: SANDRINGHAM | X927: 11 | Y927: 1 | Z927: 0 | AA927: 1448 | AB927: 908 | AC927: =(AA927/AB927)*100 -> 159.47136563876651 | AD927: =(X927*4)+(Z927*2) -> 44
A928: GOALKICKERS | M928: T CLARKE | O928: ENRIGHT | Q928: COREY | W928: GEELONG | X928: 10 | Y928: 2 | Z928: 0 | AA928: 1299 | AB928: 959 | AC928: =(AA928/AB928)*100 -> 135.4535974973931 | AD928: =(X928*4)+(Z928*2) -> 40
A929: GEELONG | C929: ARNOTT 3 | F929: CHAPMAN 2 | I929: CORRIGAN 2 | L929: C MOONEY 2 | O929: HARDING 2 | R929: BALDWIN | W929: ST KILDA | X929: 9 | Y929: 3 | Z929: 0 | AA929: 1304 | AB929: 1015 | AC929: =(AA929/AB929)*100 -> 128.4729064039409 | AD929: =(X929*4)+(Z929*2) -> 36
A930: COBURG | C930: WILLOUGHBY 2 | F930: HOGG 2 | H930: ALESSIO | J930: CANNING | L930: VERNON | N930: RYAN | P930: LAPPIN | R930: McLEOD | W930: BOX HILL | X930: 9 | Y930: 3 | Z930: 0 | AA930: 1226 | AB930: 1016 | AC930: =(AA930/AB930)*100 -> 120.66929133858268 | AD930: =(X930*4)+(Z930*2) -> 36
W931: WERRIBEE | X931: 8 | Y931: 3 | Z931: 1 | AA931: 1314 | AB931: 1020 | AC931: =(AA931/AB931)*100 -> 128.82352941176472 | AD931: =(X931*4)+(Z931*2) -> 34
A932: ESSENDON | C932: 3 | D932: 5 | E932: =(C932*6)+D932 -> 23 | G932: 8 | H932: 8 | I932: =(G932*6)+H932 -> 56 | K932: 10 | L932: 11 | M932: =(K932*6)+L932 -> 71 | O932: 14 | P932: 12 | Q932: =(O932*6)+P932 -> 96 | S932: Venue: WINDY HILL | W932: NORTH BALLARAT | X932: 8 | Y932: 4 | Z932: 0 | AA932: 1044 | AB932: 782 | AC932: =(AA932/AB932)*100 -> 133.50383631713555 | AD932: =(X932*4)+(Z932*2) -> 32
A933: PRESTON | C933: 5 | D933: 1 | E933: =(C933*6)+D933 -> 31 | G933: 9 | H933: 3 | I933: =(G933*6)+H933 -> 57 | K933: 11 | L933: 7 | M933: =(K933*6)+L933 -> 73 | O933: 14 | P933: 11 | Q933: =(O933*6)+P933 -> 95 | W933: CARLTON | X933: 8 | Y933: 4 | Z933: 0 | AA933: 1210 | AB933: 1078 | AC933: =(AA933/AB933)*100 -> 112.24489795918366 | AD933: =(X933*4)+(Z933*2) -> 32
A934: BEST PLAYERS | W934: WILLIAMSTOWN | X934: 8 | Y934: 4 | Z934: 0 | AA934: 1156 | AB934: 1054 | AC934: =(AA934/AB934)*100 -> 109.6774193548387 | AD934: =(X934*4)+(Z934*2) -> 32
A935: ESSENDON | C935: LALICH | F935: McVEIGH | I935: MOORCROFT | L935: EASTAUGH | O935: COLLINS | R935: BERBAKOV
A936: PRESTON | C936: GIBSON | F936: BLIGHT | I936: GRAINGER | L936: ZORZI | O936: PENN | R936: CLAYTON | W936: COLLINGWOOD | X936: 7 | Y936: 5 | Z936: 0 | AA936: 1168 | AB936: 1126 | AC936: =(AA936/AB936)*100 -> 103.73001776198933 | AD936: =(X936*4)+(Z936*2) -> 28
A937: GOALKICKERS | M937: HENNEMAN | P937: PICKETT | R937: LADHAMS | W937: SPRINGVALE | X937: 6 | Y937: 5 | Z937: 1 | AA937: 1044 | AB937: 1100 | AC937: =(AA937/AB937)*100 -> 94.909090909090907 | AD937: =(X937*4)+(Z937*2) -> 26
A938: ESSENDON | C938: EASTAUGH 3 | F938: MOORCROFT 2 | I938: COLLINS 2 | L938: McALISTER | N938: LALICH | P938: PODSIADLY | R938: SWITALA | W938: FRANKSTON | X938: 6 | Y938: 6 | Z938: 0 | AA938: 1260 | AB938: 1196 | AC938: =(AA938/AB938)*100 -> 105.35117056856187 | AD938: =(X938*4)+(Z938*2) -> 24
A939: PRESTON | C939: GRAINGER 4 | F939: GIBSON 3 | I939: PENN | J939: HILL | L939: CANN | M939: LEE | N939: CARACELLA | Q939: FAVRIN | S939: SAGE | W939: ESSENDON | X939: 5 | Y939: 7 | Z939: 0 | AA939: 985 | AB939: 1266 | AC939: =(AA939/AB939)*100 -> 77.804107424960506 | AD939: =(X939*4)+(Z939*2) -> 20
W940: PORT MELBOURNE | X940: 4 | Y940: 8 | Z940: 0 | AA940: 1010 | AB940: 1104 | AC940: =(AA940/AB940)*100 -> 91.485507246376812 | AD940: =(X940*4)+(Z940*2) -> 16
A941: CARLTON | C941: 4 | D941: 5 | E941: =(C941*6)+D941 -> 29 | G941: 6 | H941: 6 | I941: =(G941*6)+H941 -> 42 | K941: 7 | L941: 9 | M941: =(K941*6)+L941 -> 51 | O941: 10 | P941: 12 | Q941: =(O941*6)+P941 -> 72 | S941: Venue: NORTH BALLARAT | W941: MURRAY KANGAROOS | X941: 3 | Y941: 9 | Z941: 0 | AA941: 988 | AB941: 1284 | AC941: =(AA941/AB941)*100 -> 76.947040498442362 | AD941: =(X941*4)+(Z941*2) -> 12
A942: NORTH BALLARAT | C942: 0 | D942: 1 | E942: =(C942*6)+D942 -> 1 | G942: 3 | H942: 4 | I942: =(G942*6)+H942 -> 22 | K942: 7 | L942: 6 | M942: =(K942*6)+L942 -> 48 | O942: 9 | P942: 7 | Q942: =(O942*6)+P942 -> 61 | W942: COBURG | X942: 2 | Y942: 10 | Z942: 0 | AA942: 967 | AB942: 1138 | AC942: =(AA942/AB942)*100 -> 84.973637961335683 | AD942: =(X942*4)+(Z942*2) -> 8
A943: BEST PLAYERS | W943: RICHMOND | X943: 2 | Y943: 10 | Z943: 0 | AA943: 969 | AB943: 1407 | AC943: =(AA943/AB943)*100 -> 68.869936034115142 | AD943: =(X943*4)+(Z943*2) -> 8
A944: CARLTON | C944: BROWN | F944: O'REILLY | I944: PORTER | L944: CARROLL | O944: MASSIE | R944: VANCE | W944: PRESTON | X944: 2 | Y944: 10 | Z944: 0 | AA944: 969 | AB944: 1509 | AC944: =(AA944/AB944)*100 -> 64.214711729622266 | AD944: =(X944*4)+(Z944*2) -> 8
A945: NORTH BALLARAT | C945: J POLKINGHORNE | G945: GREIG | I945: FIELD | L945: T POLKINGHORNE | P945: FISHER | R945: BROWN | W945: BENDIGO | X945: 0 | Y945: 12 | Z945: 0 | AA945: 863 | AB945: 1429 | AC945: =(AA945/AB945)*100 -> 60.391882435269416 | AD945: =(X945*4)+(Z945*2) -> 0
A946: GOALKICKERS
A947: CARLTON | C947: PASSADOR 3 | F947: FEVOLA 2 | I947: DELULIO 2 | L947: BACKWELL | N947: MASSIE | P947: CARROLL
A948: NORTH BALLARAT | C948: RYALL 2 | F948: CLAYTON | I948: SIER | J948: T POLKINGHORNE | N948: FIELD | P948: EDWARDS | R948: POWER | T948: CLARKE
A950: SPRINGVALE | C950: 3 | D950: 0 | E950: =(C950*6)+D950 -> 18 | G950: 10 | H950: 3 | I950: =(G950*6)+H950 -> 63 | K950: 14 | L950: 8 | M950: =(K950*6)+L950 -> 92 | O950: 15 | P950: 10 | Q950: =(O950*6)+P950 -> 100 | S950: Venue: PUNT ROAD
A951: MURRAY KANGAROOS | C951: 1 | D951: 2 | E951: =(C951*6)+D951 -> 8 | G951: 4 | H951: 2 | I951: =(G951*6)+H951 -> 26 | K951: 8 | L951: 4 | M951: =(K951*6)+L951 -> 52 | O951: 10 | P951: 7 | Q951: =(O951*6)+P951 -> 67
A952: BEST PLAYERS
A953: SPRINGVALE | C953: ROBBINS | F953: CARROLL | I953: LITTLE | L953: O'BRIEN | O953: CLARK | R953: LOGAN
A954: MURRAY KANGAROOS | C954: KINGSLEY | F954: COCHRANE | I954: HILTON | L954: HEWITT | O954: VAN DER KLOOSTER | S954: CAPUANO
A955: GOALKICKERS
A956: SPRINGVALE | C956: LOGAN 3 | F956: CARROLL 2 | I956: PITT 2 | K956: CLARK 2 | M956: COURTNEY | P956: SMITH | R956: SHEAHAN | U956: O'BRIEN | W956: CARMODY | X956: CAPLES
A957: MURRAY KANGAROOS | C957: KINGSLEY 5 | F957: HEWITT 2 | I957: YOUNIE | K957: ABLETT | M957: DHURKAY
D958: 11TH JUNE | J958: WEATHER
A959: WERRIBEE | C959: 2 | D959: 4 | E959: =(C959*6)+D959 -> 16 | G959: 6 | H959: 13 | I959: =(G959*6)+H959 -> 49 | K959: 16 | L959: 15 | M959: =(K959*6)+L959 -> 111 | O959: 19 | P959: 22 | Q959: =(O959*6)+P959 -> 136 | S959: Venue: WERRIBEE
A960: FRANKSTON | C960: 3 | D960: 3 | E960: =(C960*6)+D960 -> 21 | G960: 6 | H960: 4 | I960: =(G960*6)+H960 -> 40 | K960: 6 | L960: 6 | M960: =(K960*6)+L960 -> 42 | O960: 6 | P960: 7 | Q960: =(O960*6)+P960 -> 43
A961: BEST PLAYERS
A962: WERRIBEE | C962: FROST | F962: ATKINS | J962: SAUNDERS | M962: PULI | O962: FULLER
A963: FRANKSTON | C963: DAFF | F963: DAM CLARKE | J963: GEORGIOU
A964: GOALKICKERS
A965: WERRIBEE | C965: WIGGINS 5 | F965: FULLER 4 | I965: SMITH 2 | K965: SAUNDERS 2 | N965: CHURCHILL 2 | Q965: ATKINS 2 | S965: MITCHELL | W965: BAKER
A966: FRANKSTON | C966: DAN CLARKE 2 | F966: DAM CLARKE 2 | J966: GEORGE | M966: MURRAY
A968: ST KILDA | C968: 5 | D968: 2 | E968: =(C968*6)+D968 -> 32 | G968: 8 | H968: 5 | I968: =(G968*6)+H968 -> 53 | K968: 13 | L968: 9 | M968: =(K968*6)+L968 -> 87 | O968: 16 | P968: 11 | Q968: =(O968*6)+P968 -> 107 | S968: Venue: MOORABBIN
A969: PORT MELBOURNE | C969: 0 | D969: 2 | E969: =(C969*6)+D969 -> 2 | G969: 4 | H969: 7 | I969: =(G969*6)+H969 -> 31 | K969: 8 | L969: 11 | M969: =(K969*6)+L969 -> 59 | O969: 14 | P969: 13 | Q969: =(O969*6)+P969 -> 97
A970: BEST PLAYERS
A971: ST KILDA | C971: MONKHURST | F971: PITTS | I971: MOYLE | L971: SCHWARZE | O971: MILNE | R971: BROWN
A972: PORT MELBOURNE | C972: NAISH | F972: CROW | I972: McMAHON | L972: DOYLE | O972: McCORMICK | R972: ELLIOTT
A973: GOALKICKERS
A974: ST KILDA | C974: WITTISON 5 | F974: MILNE 4 | I974: CRANAGE 2 | L974: FORTNAM 2 | O974: WULF | Q974: SCHWARZE | T974: YOUNG
A975: PORT MELBOURNE | C975: FIXTER 3 | E975: SIMPSON 2 | H975: TRAIL 2 | J975: BAUMGARTNER 2 | N975: McCORMICK | Q975: NAISH | S975: CLARK | U975: D'GIACOMA | X975: McMANUS
A977: BOX HILL | C977: 8 | D977: 2 | E977: =(C977*6)+D977 -> 50 | G977: 8 | H977: 6 | I977: =(G977*6)+H977 -> 54 | K977: 12 | L977: 6 | M977: =(K977*6)+L977 -> 78 | O977: 13 | P977: 11 | Q977: =(O977*6)+P977 -> 89 | S977: Venue: BOX HILL
A978: WILLIAMSTOWN | C978: 1 | D978: 1 | E978: =(C978*6)+D978 -> 7 | G978: 5 | H978: 3 | I978: =(G978*6)+H978 -> 33 | K978: 6 | L978: 11 | M978: =(K978*6)+L978 -> 47 | O978: 12 | P978: 14 | Q978: =(O978*6)+P978 -> 86
A979: BEST PLAYERS
A980: BOX HILL | C980: TRELEVEN | F980: JOHNSON | I980: BREWER | L980: MANN | N980: COX | Q980: HABERFIELD
A981: WILLIAMSTOWN | C981: HAHN | F981: KOLYNIUK | I981: PLUNKETT | L981: BROWN | N981: ROUND | Q981: SMOKER
A982: GOALKICKERS
A983: BOX HILL | C983: PUGSLEY 3 | F983: NICHOLLS 2 | I983: HABERFIELD 2 | L983: JENKINS | N983: BREWER | P983: COLLICA | R983: JOHNSON | U983: NOTT | W983: KRAWCYZK
A984: WILLIAMSTOWN | C984: KOLYNIUK 4 | F984: WEST 3 | I984: MACRI 2 | K984: MAHONEY | M984: TAYLOR | O984: P DOOLEY
A986: COLLINGWOOD | C986: 2 | D986: 2 | E986: =(C986*6)+D986 -> 14 | G986: 5 | H986: 3 | I986: =(G986*6)+H986 -> 33 | K986: 11 | L986: 7 | M986: =(K986*6)+L986 -> 73 | O986: 20 | P986: 8 | Q986: =(O986*6)+P986 -> 128 | S986: Venue: BENDIGO
A987: BENDIGO | C987: 2 | D987: 3 | E987: =(C987*6)+D987 -> 15 | G987: 7 | H987: 7 | I987: =(G987*6)+H987 -> 49 | K987: 9 | L987: 8 | M987: =(K987*6)+L987 -> 62 | O987: 12 | P987: 10 | Q987: =(O987*6)+P987 -> 82
A988: BEST PLAYERS
A989: COLLINGWOOD | C989: WASLEY | F989: LYON | I989: JOHNSON | L989: SMITH | N989: CROSICA | Q989: PATTERSON
A990: BENDIGO | C990: GATHERCOLE | F990: O'CALLAGHAN | I990: BROWN | L990: GEDDES | N990: SUTHERLAND | Q990: WALSH
A991: GOALKICKERS
A992: COLLINGWOOD | C992: S ROCCA 4 | F992: DAVIS 3 | I992: SCOTLAND 3 | L992: JAMES 3 | N992: JOHNSON 3 | Q992: WASLEY 2 | T992: PATTERSON | X992: WATSON
A993: BENDIGO | C993: BROWN 3 | F993: DILLON 2 | I993: O'TOOLE 2 | L993: WALSH 2 | N993: O'CALLAGHAN | Q993: SCHMIDT | S993: WHITSED
A995: SANDRINGHAM | C995: 3 | D995: 6 | E995: =(C995*6)+D995 -> 24 | G995: 7 | H995: 7 | I995: =(G995*6)+H995 -> 49 | K995: 12 | L995: 16 | M995: =(K995*6)+L995 -> 88 | O995: 15 | P995: 18 | Q995: =(O995*6)+P995 -> 108 | S995: Venue: BEACH ROAD
A996: RICHMOND | C996: 3 | D996: 1 | E996: =(C996*6)+D996 -> 19 | G996: 7 | H996: 7 | I996: =(G996*6)+H996 -> 49 | K996: 9 | L996: 9 | M996: =(K996*6)+L996 -> 63 | O996: 10 | P996: 9 | Q996: =(O996*6)+P996 -> 69
A997: BEST PLAYERS
A998: SANDRINGHAM | C998: SAUTNER | F998: NICHOLSON | I998: SHANAHAN | L998: FEBEY | O998: HAYNES | R998: WILLIAMS
A999: RICHMOND | C999: EVANS | F999: BURGIEL | I999: T EDWARDS | L999: MORRISON | O999: ZANTUCK
A1000: GOALKICKERS
A1001: SANDRINGHAM | C1001: SAUTNER 7 | F1001: FEBEY 3 | I1001: KENNEDY | K1001: LAMB | M1001: WILLIAMS | P1001: GRGIC | R1001: GREEN
A1002: RICHMOND | C1002: BURGIEL 5 | F1002: M EDWARDS 2 | J1002: HART | L1002: PROCTOR | N1002: SAMPSON
A1004: ROUND 13 | D1004: 16TH JUNE | J1004: WEATHER
D1005: 1ST QTR | H1005: 2ND QTR | L1005: 3RD QTR | P1005: FINAL
A1006: COLLINGWOOD | C1006: 8 | D1006: 0 | E1006: =(C1006*6)+D1006 -> 48 | G1006: 14 | H1006: 1 | I1006: =(G1006*6)+H1006 -> 85 | K1006: 17 | L1006: 3 | M1006: =(K1006*6)+L1006 -> 105 | O1006: 21 | P1006: 8 | Q1006: =(O1006*6)+P1006 -> 134 | S1006: Venue: M.C.G. (C/R) | Y1006: LADDER | AB1006: ROUND | AD1006: 13
A1007: WERRIBEE | C1007: 0 | D1007: 4 | E1007: =(C1007*6)+D1007 -> 4 | G1007: 3 | H1007: 6 | I1007: =(G1007*6)+H1007 -> 24 | K1007: 7 | L1007: 10 | M1007: =(K1007*6)+L1007 -> 52 | O1007: 13 | P1007: 15 | Q1007: =(O1007*6)+P1007 -> 93
A1008: BEST PLAYERS | W1008: TEAM | X1008: W | Y1008: L | Z1008: D | AA1008: FOR | AB1008: AGST | AC1008: % | AD1008: PTS
A1009: COLLINGWOOD | C1009: LANE | F1009: WATSON | I1009: KINNEAR | L1009: PATTERSON | O1009: OBORNE | R1009: WASLEY
A1010: WERRIBEE | C1010: SAUNDERS | F1010: FROST | I1010: GARLICK | L1010: LAMB | W1010: SANDRINGHAM | X1010: 11 | Y1010: 2 | Z1010: 0 | AA1010: 1550 | AB1010: 1024 | AC1010: =(AA1010/AB1010)*100 -> 151.3671875 | AD1010: =(X1010*4)+(Z1010*2) -> 44
A1011: GOALKICKERS | N1011: WATSON | P1011: SHEEHAN | R1011: McKEE | W1011: GEELONG | X1011: 11 | Y1011: 2 | Z1011: 0 | AA1011: 1407 | AB1011: 1040 | AC1011: =(AA1011/AB1011)*100 -> 135.28846153846155 | AD1011: =(X1011*4)+(Z1011*2) -> 44
A1012: COLLINGWOOD | C1012: DAVIS 4 | E1012: TUCKEY 4 | G1012: OBORNE 2 | I1012: WASLEY 2 | K1012: JAMES 2 | M1012: GARDINER | O1012: SHAW | Q1012: LANE | R1012: BAYNES | W1012: NORTH BALLARAT | X1012: 9 | Y1012: 4 | Z1012: 0 | AA1012: 1147 | AB1012: 863 | AC1012: =(AA1012/AB1012)*100 -> 132.90845886442642 | AD1012: =(X1012*4)+(Z1012*2) -> 36
A1013: WERRIBEE | C1013: GARLICK 4 | F1013: BUTTON 3 | I1013: SMITH 2 | K1013: WILLS | M1013: FULLER | O1013: SAUNDERS | R1013: DYER | W1013: ST KILDA | X1013: 9 | Y1013: 4 | Z1013: 0 | AA1013: 1385 | AB1013: 1118 | AC1013: =(AA1013/AB1013)*100 -> 123.88193202146691 | AD1013: =(X1013*4)+(Z1013*2) -> 36
D1014: 17TH JUNE | J1014: WEATHER | W1014: BOX HILL | X1014: 9 | Y1014: 4 | Z1014: 0 | AA1014: 1307 | AB1014: 1124 | AC1014: =(AA1014/AB1014)*100 -> 116.28113879003558 | AD1014: =(X1014*4)+(Z1014*2) -> 36
A1015: CARLTON | C1015: 7 | D1015: 3 | E1015: =(C1015*6)+D1015 -> 45 | G1015: 12 | H1015: 5 | I1015: =(G1015*6)+H1015 -> 77 | K1015: 18 | L1015: 8 | M1015: =(K1015*6)+L1015 -> 116 | O1015: 20 | P1015: 10 | Q1015: =(O1015*6)+P1015 -> 130 | S1015: Venue: OPTUS (C/R) | W1015: CARLTON | X1015: 9 | Y1015: 4 | Z1015: 0 | AA1015: 1340 | AB1015: 1169 | AC1015: =(AA1015/AB1015)*100 -> 114.62788708297691 | AD1015: =(X1015*4)+(Z1015*2) -> 36
A1016: COBURG | C1016: 4 | D1016: 3 | E1016: =(C1016*6)+D1016 -> 27 | G1016: 6 | H1016: 6 | I1016: =(G1016*6)+H1016 -> 42 | K1016: 7 | L1016: 7 | M1016: =(K1016*6)+L1016 -> 49 | O1016: 13 | P1016: 13 | Q1016: =(O1016*6)+P1016 -> 91 | W1016: WILLIAMSTOWN | X1016: 9 | Y1016: 4 | Z1016: 0 | AA1016: 1272 | AB1016: 1156 | AC1016: =(AA1016/AB1016)*100 -> 110.03460207612457 | AD1016: =(X1016*4)+(Z1016*2) -> 36
A1017: BEST PLAYERS | W1017: WERRIBEE | X1017: 8 | Y1017: 4 | Z1017: 1 | AA1017: 1407 | AB1017: 1154 | AC1017: =(AA1017/AB1017)*100 -> 121.92374350086655 | AD1017: =(X1017*4)+(Z1017*2) -> 34
A1018: CARLTON | C1018: PORTER | F1018: CULPIT | I1018: FEVOLA | L1018: VANCE | O1018: MASSIE | R1018: BACKWELL
A1019: COBURG | C1019: RYAN | F1019: WESTON | I1019: DRYDEN | L1019: McKENZIE-McHARG | P1019: WILLOUGHBY | S1019: McLEOD | W1019: COLLINGWOOD | X1019: 8 | Y1019: 5 | Z1019: 0 | AA1019: 1302 | AB1019: 1219 | AC1019: =(AA1019/AB1019)*100 -> 106.80885972108285 | AD1019: =(X1019*4)+(Z1019*2) -> 32
A1020: GOALKICKERS | P1020: DUKES | R1020: MATTHEWS | W1020: SPRINGVALE | X1020: 7 | Y1020: 5 | Z1020: 1 | AA1020: 1174 | AB1020: 1141 | AC1020: =(AA1020/AB1020)*100 -> 102.89219982471516 | AD1020: =(X1020*4)+(Z1020*2) -> 30
A1021: CARLTON | C1021: FEVOLA 7 | E1021: PORTER 2 | G1021: CULPIT 2 | I1021: PICKERING 2 | L1021: DOERING 2 | N1021: BACKWELL | Q1021: MASSIE | S1021: NELSON | W1021: FRANKSTON | X1021: 6 | Y1021: 7 | Z1021: 0 | AA1021: 1318 | AB1021: 1322 | AC1021: =(AA1021/AB1021)*100 -> 99.697428139183046 | AD1021: =(X1021*4)+(Z1021*2) -> 24
A1022: COBURG | C1022: RYAN 5 | E1022: LAPPIN 2 | G1022: O'CONNOR 2 | J1022: DRYDEN | L1022: LANG | N1022: DEPASQUALE | Q1022: BICER | W1022: ESSENDON | X1022: 6 | Y1022: 7 | Z1022: 0 | AA1022: 1114 | AB1022: 1342 | AC1022: =(AA1022/AB1022)*100 -> 83.010432190760071 | AD1022: =(X1022*4)+(Z1022*2) -> 24
W1023: PORT MELBOURNE | X1023: 4 | Y1023: 9 | Z1023: 0 | AA1023: 1112 | AB1023: 1207 | AC1023: =(AA1023/AB1023)*100 -> 92.129246064623032 | AD1023: =(X1023*4)+(Z1023*2) -> 16
A1024: GEELONG | C1024: 2 | D1024: 3 | E1024: =(C1024*6)+D1024 -> 15 | G1024: 6 | H1024: 6 | I1024: =(G1024*6)+H1024 -> 42 | K1024: 8 | L1024: 9 | M1024: =(K1024*6)+L1024 -> 57 | O1024: 16 | P1024: 12 | Q1024: =(O1024*6)+P1024 -> 108 | S1024: Venue: SHELL STADIUM (C/R) | W1024: MURRAY KANGAROOS | X1024: 4 | Y1024: 9 | Z1024: 0 | AA1024: 1114 | AB1024: 1342 | AC1024: =(AA1024/AB1024)*100 -> 83.010432190760071 | AD1024: =(X1024*4)+(Z1024*2) -> 16
A1025: BOX HILL | C1025: 6 | D1025: 0 | E1025: =(C1025*6)+D1025 -> 36 | G1025: 11 | H1025: 1 | I1025: =(G1025*6)+H1025 -> 67 | K1025: 13 | L1025: 3 | M1025: =(K1025*6)+L1025 -> 81 | O1025: 13 | P1025: 3 | Q1025: =(O1025*6)+P1025 -> 81 | W1025: PRESTON | X1025: 3 | Y1025: 10 | Z1025: 0 | AA1025: 1072 | AB1025: 1611 | AC1025: =(AA1025/AB1025)*100 -> 66.542520173805087 | AD1025: =(X1025*4)+(Z1025*2) -> 12
A1026: BEST PLAYERS | W1026: COBURG | X1026: 2 | Y1026: 11 | Z1026: 0 | AA1026: 1058 | AB1026: 1268 | AC1026: =(AA1026/AB1026)*100 -> 83.438485804416402 | AD1026: =(X1026*4)+(Z1026*2) -> 8
A1027: GEELONG | C1027: HAY | F1027: COREY | I1027: HALL | K1027: ARNOTT | N1027: STREET | Q1027: CHAPMAN | W1027: RICHMOND | X1027: 2 | Y1027: 11 | Z1027: 0 | AA1027: 1010 | AB1027: 1537 | AC1027: =(AA1027/AB1027)*100 -> 65.712426805465199 | AD1027: =(X1027*4)+(Z1027*2) -> 8
A1028: BOX HILL | C1028: McPHARLIN | F1028: TRELEVEN | I1028: BREWER | K1028: MALSEED | N1028: JOHNSON | Q1028: OBST | W1028: BENDIGO | X1028: 0 | Y1028: 13 | Z1028: 0 | AA1028: 939 | AB1028: 1558 | AC1028: =(AA1028/AB1028)*100 -> 60.269576379974325 | AD1028: =(X1028*4)+(Z1028*2) -> 0
A1029: GOALKICKERS
A1030: GEELONG | C1030: C MOONEY 4 | F1030: HARDING 4 | I1030: COREY 2 | K1030: ARNOTT | M1030: BRAY | N1030: CHAPMAN | Q1030: HALL | R1030: RYAN | T1030: STREET
A1031: BOX HILL | C1031: CHAPMAN 4 | F1031: MALSEED 3 | I1031: HABERFIELD 2 | M1031: COLLICA | O1031: BREWER | Q1031: JOHNSON | T1031: LORD
A1033: SPRINGVALE | C1033: 2 | D1033: 3 | E1033: =(C1033*6)+D1033 -> 15 | G1033: 5 | H1033: 9 | I1033: =(G1033*6)+H1033 -> 39 | K1033: 12 | L1033: 15 | M1033: =(K1033*6)+L1033 -> 87 | O1033: 18 | P1033: 22 | Q1033: =(O1033*6)+P1033 -> 130 | S1033: Venue: PUNT ROAD
A1034: RICHMOND | C1034: 3 | D1034: 2 | E1034: =(C1034*6)+D1034 -> 20 | G1034: 4 | H1034: 3 | I1034: =(G1034*6)+H1034 -> 27 | K1034: 5 | L1034: 5 | M1034: =(K1034*6)+L1034 -> 35 | O1034: 6 | P1034: 5 | Q1034: =(O1034*6)+P1034 -> 41
A1035: BEST PLAYERS
A1036: SPRINGVALE | C1036: TROLLOPE | F1036: CAPLES | I1036: HARRISON | L1036: LOGAN | N1036: ROBBINS | Q1036: O'BRIEN
A1037: RICHMOND | C1037: DRAGICEVIC | F1037: STEINFORT | I1037: VARDY | L1037: HALL
A1038: GOALKICKERS
A1039: SPRINGVALE | C1039: CAPLES 4 | F1039: MEYER 4 | I1039: LOGAN 3 | L1039: DILLON 3 | N1039: IRISH 2 | P1039: CARROLL | R1039: PITT
A1040: RICHMOND | C1040: BURGIEL 2 | F1040: JEWELL | H1040: POYAS | J1040: HALL | L1040: HART
D1041: 18TH JUNE | J1041: WEATHER
A1042: ESSENDON | C1042: 5 | D1042: 5 | E1042: =(C1042*6)+D1042 -> 35 | G1042: 11 | H1042: 11 | I1042: =(G1042*6)+H1042 -> 77 | K1042: 13 | L1042: 13 | M1042: =(K1042*6)+L1042 -> 91 | O1042: 19 | P1042: 15 | Q1042: =(O1042*6)+P1042 -> 129 | S1042: Venue: WINDY HILL
A1043: BENDIGO | C1043: 2 | D1043: 2 | E1043: =(C1043*6)+D1043 -> 14 | G1043: 6 | H1043: 5 | I1043: =(G1043*6)+H1043 -> 41 | K1043: 9 | L1043: 9 | M1043: =(K1043*6)+L1043 -> 63 | O1043: 11 | P1043: 10 | Q1043: =(O1043*6)+P1043 -> 76
A1044: BEST PLAYERS
A1045: ESSENDON | C1045: MOORCROFT | F1045: ROBRAN | I1045: LALICH | L1045: BERBAKOV | O1045: FRASER | R1045: MCVEIGH
A1046: BENDIGO | C1046: WALSH | F1046: SUTHERLAND | I1046: DILLON | L1046: TOINTON | O1046: WHITSED | R1046: GEDDES
A1047: GOALKICKERS | Q1047: ROBRAN
A1048: ESSENDON | C1048: MOORCROFT 4 | F1048: McVEIGH 2 | I1048: EASTAUGH 2 | L1048: BERBAKOV 2 | O1048: McGRATH 2 | R1048: PICKETT | T1048: SWITALA | W1048: JACOBS | X1048: WALLIS | AA1048: PODSIADLY | AC1048: LADHAMS
A1049: BENDIGO | C1049: BOWER 2 | F1049: DILLON 2 | I1049: SCHMIDT 2 | L1049: KEON | N1049: O'TOOLE | P1049: BROCK SHIELS | S1049: TOINTON | V1049: WALSH
A1051: PRESTON | C1051: 2 | D1051: 2 | E1051: =(C1051*6)+D1051 -> 14 | G1051: 4 | H1051: 3 | I1051: =(G1051*6)+H1051 -> 27 | K1051: 11 | L1051: 7 | M1051: =(K1051*6)+L1051 -> 73 | O1051: 16 | P1051: 7 | Q1051: =(O1051*6)+P1051 -> 103 | S1051: Venue: PRESTON
A1052: PORT MELBOURNE | C1052: 5 | D1052: 5 | E1052: =(C1052*6)+D1052 -> 35 | G1052: 9 | H1052: 9 | I1052: =(G1052*6)+H1052 -> 63 | K1052: 11 | L1052: 11 | M1052: =(K1052*6)+L1052 -> 77 | O1052: 14 | P1052: 18 | Q1052: =(O1052*6)+P1052 -> 102
A1053: BEST PLAYERS
A1054: PRESTON | C1054: GRAINGER | F1054: GIBSON | I1054: LEE | L1054: D EVANS | O1054: HAYWARD | R1054: MITCHELL
A1055: PORT MELBOURNE | C1055: ROSE | F1055: ELLIOTT | I1055: DOYLE | L1055: FILANDIA | O1055: SWAN
A1056: GOALKICKERS
A1057: PRESTON | C1057: GRAINGER 7 | F1057: HAYWARD 3 | I1057: CANN 2 | K1057: HILL | M1057: LEE | O1057: MITCHELL | Q1057: GIBSON
A1058: PORT MELBOURNE | C1058: SEYMOUR 2 | F1058: TRAILL 2 | H1058: BAUMGARTNER 2 | L1058: McMANUS | N1058: McCORMICK | Q1058: FILANDIA | S1058: FIXTER | U1058: CROW | W1058: NAISH | X1058: ELLIOTT | AA1058: TOMSIC
A1060: WILLIAMSTOWN | C1060: 5 | D1060: 4 | E1060: =(C1060*6)+D1060 -> 34 | G1060: 8 | H1060: 5 | I1060: =(G1060*6)+H1060 -> 53 | K1060: 12 | L1060: 10 | M1060: =(K1060*6)+L1060 -> 82 | O1060: 17 | P1060: 14 | Q1060: =(O1060*6)+P1060 -> 116 | S1060: WILLIAMSTOWN
A1061: SANDRINGHAM | C1061: 3 | D1061: 2 | E1061: =(C1061*6)+D1061 -> 20 | G1061: 8 | H1061: 6 | I1061: =(G1061*6)+H1061 -> 54 | K1061: 15 | L1061: 10 | M1061: =(K1061*6)+L1061 -> 100 | O1061: 15 | P1061: 12 | Q1061: =(O1061*6)+P1061 -> 102
A1062: BEST PLAYERS
A1063: WILLIAMSTOWN | C1063: DOOLEY | F1063: GHAZI | I1063: ROUND | L1063: SMOKER | N1063: HOLLOW | Q1063: BROWN
A1064: SANDRINGHAM | C1064: GODFREY | F1064: MACGEORGE | I1064: SHANAHAN | L1064: PITT | N1064: BROWN | Q1064: BRUCE
A1065: GOALKICKERS
A1066: WILLIAMSTOWN | C1066: DOOLEY 3 | E1066: MACRI 3 | G1066: ROUND 2 | I1066: GHAZI 2 | K1066: COX 2 | M1066: M WEST 2 | O1066: RALPH | Q1066: TAYLOR | S1066: BOWDEN
A1067: SANDRINGHAM | C1067: PITT 7 | F1067: BRUCE 2 | I1067: SAUTNER | K1067: RADFORD | M1067: WILLIAMS | O1067: HAYWARD | Q1067: OTTENS | S1067: KENNEDY
A1069: NORTH BALLARAT | C1069: 2 | D1069: 2 | E1069: =(C1069*6)+D1069 -> 14 | G1069: 8 | H1069: 8 | I1069: =(G1069*6)+H1069 -> 56 | K1069: 11 | L1069: 10 | M1069: =(K1069*6)+L1069 -> 76 | O1069: 15 | P1069: 13 | Q1069: =(O1069*6)+P1069 -> 103 | S1069: NORTH BALLARAT
A1070: ST KILDA | C1070: 5 | D1070: 3 | E1070: =(C1070*6)+D1070 -> 33 | G1070: 6 | H1070: 6 | I1070: =(G1070*6)+H1070 -> 42 | K1070: 8 | L1070: 7 | M1070: =(K1070*6)+L1070 -> 55 | O1070: 12 | P1070: 9 | Q1070: =(O1070*6)+P1070 -> 81
A1071: BEST PLAYERS
A1072: NORTH BALLARAT | C1072: FIELD | E1072: GREIG | H1072: SOMERVILLE | K1072: J POLKINGHORNE | N1072: POWER | P1072: T POLKINGHORNE
A1073: ST KILDA | C1073: CRANAGE | E1073: BAKER | H1073: BROWN | K1073: HEAZELWOOD | N1073: TRAINIDES | Q1073: PITTS
A1074: GOALKICKERS
A1075: NORTH BALLARAT | C1075: JURICA 4 | F1075: CLAYTON 3 | I1075: POWER 2 | K1075: GREIG 2 | M1075: T POLKINGHORNE | Q1075: CLARKE | S1075: FUNCKE | V1075: BAKER
A1076: ST KILDA | C1076: WITTISON 5 | F1076: CHARLES | I1076: MILNE | K1076: PITTS | M1076: WALTON | O1076: HEAZELWOOD | R1076: McLAREN | U1076: MOYLE
D1077: 19TH JUNE | H1077: NIGHT MATCH | K1077: WEATHER
A1078: MURRAY KANGAROOS | C1078: 5 | D1078: 4 | E1078: =(C1078*6)+D1078 -> 34 | G1078: 11 | H1078: 6 | I1078: =(G1078*6)+H1078 -> 72 | K1078: 18 | L1078: 9 | M1078: =(K1078*6)+L1078 -> 117 | O1078: 19 | P1078: 12 | Q1078: =(O1078*6)+P1078 -> 126 | S1078: Venue: WAVERLEY
A1079: FRANKSTON | C1079: 1 | D1079: 2 | E1079: =(C1079*6)+D1079 -> 8 | G1079: 2 | H1079: 6 | I1079: =(G1079*6)+H1079 -> 18 | K1079: 3 | L1079: 8 | M1079: =(K1079*6)+L1079 -> 26 | O1079: 8 | P1079: 10 | Q1079: =(O1079*6)+P1079 -> 58
A1080: BEST PLAYERS
A1081: MURRAY KANGAROOS | C1081: HEWITT | F1081: ANDERSON | I1081: RAWLINGS | L1081: CAPUANO | N1081: CALTHORPE | Q1081: PAGAN
A1082: FRANKSTON | C1082: MALLOY | F1082: BURGMAN
A1083: GOALKICKERS
A1084: MURRAY KANGAROOS | C1084: CAPUANO 5 | F1084: HEWITT 5 | I1084: VAN DER KLOOSTER 3 | M1084: RAWLINGS 3 | P1084: WILLIAMS | R1084: PAGAN | T1084: McCORMACK
A1085: FRANKSTON | C1085: WILLIAMS 3 | F1085: MALLOY | H1085: BURNELL | J1085: DAN CLARKE | M1085: GEORGIOU | O1085: HOLCOMBE
A1087: ROUND 14 | D1087: 24TH JUNE | J1087: WEATHER
D1088: 1ST QTR | H1088: 2ND QTR | L1088: 3RD QTR | P1088: FINAL
A1089: GEELONG | C1089: 4 | D1089: 7 | E1089: =(C1089*6)+D1089 -> 31 | G1089: 11 | H1089: 10 | I1089: =(G1089*6)+H1089 -> 76 | K1089: 18 | L1089: 16 | M1089: =(K1089*6)+L1089 -> 124 | O1089: 25 | P1089: 20 | Q1089: =(O1089*6)+P1089 -> 170 | S1089: Venue: SHELL STADIUM (C/R) | Y1089: LADDER | AB1089: ROUND | AD1089: 14
A1090: BENDIGO | C1090: 1 | D1090: 3 | E1090: =(C1090*6)+D1090 -> 9 | G1090: 2 | H1090: 4 | I1090: =(G1090*6)+H1090 -> 16 | K1090: 6 | L1090: 7 | M1090: =(K1090*6)+L1090 -> 43 | O1090: 6 | P1090: 9 | Q1090: =(O1090*6)+P1090 -> 45
A1091: BEST PLAYERS | W1091: TEAM | X1091: W | Y1091: L | Z1091: D | AA1091: FOR | AB1091: AGST | AC1091: % | AD1091: PTS
A1092: GEELONG | C1092: COREY | F1092: HARDING | I1092: FOSTER | L1092: ARNOTT | O1092: HALL | Q1092: LINDSAY
A1093: BENDIGO | C1093: DILLON | F1093: CARTER | I1093: O'CALLAGHAN | L1093: PINNER | O1093: ANGOVE | W1093: SANDRINGHAM | X1093: 12 | Y1093: 2 | Z1093: 0 | AA1093: 1672 | AB1093: 1115 | AC1093: =(AA1093/AB1093)*100 -> 149.95515695067266 | AD1093: =(X1093*4)+(Z1093*2) -> 48
A1094: GOALKICKERS | N1094: CLARKE | P1094: C MOONEY | R1094: SIMPSON | W1094: GEELONG | X1094: 12 | Y1094: 2 | Z1094: 0 | AA1094: 1577 | AB1094: 1085 | AC1094: =(AA1094/AB1094)*100 -> 145.34562211981569 | AD1094: =(X1094*4)+(Z1094*2) -> 48
A1095: GEELONG | C1095: HARDING 7 | F1095: HALL 4 | H1095: FOSTER 3 | J1095: KARAMATIC 3 | M1095: T LYNCH 2 | P1095: STREET 2 | R1095: BRAY | W1095: NORTH BALLARAT | X1095: 10 | Y1095: 4 | Z1095: 0 | AA1095: 1261 | AB1095: 908 | AC1095: =(AA1095/AB1095)*100 -> 138.87665198237886 | AD1095: =(X1095*4)+(Z1095*2) -> 40
A1096: BENDIGO | C1096: PARKER | E1096: CONNAUGHTON | H1096: DILLON | J1096: GEDDES | L1096: MITROVIC | N1096: O'CALLAGHAN | W1096: ST KILDA | X1096: 10 | Y1096: 4 | Z1096: 0 | AA1096: 1465 | AB1096: 1187 | AC1096: =(AA1096/AB1096)*100 -> 123.42038753159225 | AD1096: =(X1096*4)+(Z1096*2) -> 40
W1097: CARLTON | X1097: 10 | Y1097: 4 | Z1097: 0 | AA1097: 1475 | AB1097: 1246 | AC1097: =(AA1097/AB1097)*100 -> 118.37881219903691 | AD1097: =(X1097*4)+(Z1097*2) -> 40
A1098: CARLTON | C1098: 4 | D1098: 4 | E1098: =(C1098*6)+D1098 -> 28 | G1098: 8 | H1098: 6 | I1098: =(G1098*6)+H1098 -> 54 | K1098: 16 | L1098: 8 | M1098: =(K1098*6)+L1098 -> 104 | O1098: 21 | P1098: 9 | Q1098: =(O1098*6)+P1098 -> 135 | S1098: Venue: WILLIAMSTOWN | W1098: BOX HILL | X1098: 9 | Y1098: 5 | Z1098: 0 | AA1098: 1404 | AB1098: 1234 | AC1098: =(AA1098/AB1098)*100 -> 113.77633711507293 | AD1098: =(X1098*4)+(Z1098*2) -> 36
A1099: WILLIAMSTOWN | C1099: 4 | D1099: 6 | E1099: =(C1099*6)+D1099 -> 30 | G1099: 7 | H1099: 10 | I1099: =(G1099*6)+H1099 -> 52 | K1099: 8 | L1099: 16 | M1099: =(K1099*6)+L1099 -> 64 | O1099: 9 | P1099: 23 | Q1099: =(O1099*6)+P1099 -> 77 | W1099: WILLIAMSTOWN | X1099: 9 | Y1099: 5 | Z1099: 0 | AA1099: 1349 | AB1099: 1291 | AC1099: =(AA1099/AB1099)*100 -> 104.49264136328426 | AD1099: =(X1099*4)+(Z1099*2) -> 36
A1100: BEST PLAYERS | W1100: WERRIBEE | X1100: 8 | Y1100: 5 | Z1100: 1 | AA1100: 1498 | AB1100: 1276 | AC1100: =(AA1100/AB1100)*100 -> 117.39811912225706 | AD1100: =(X1100*4)+(Z1100*2) -> 34
A1101: CARLTON | C1101: DOERING | F1101: HOULIHAN | I1101: DELULIO | L1101: MERRINGTON | O1101: CHATFIELD | R1101: NELSON
A1102: WILLIAMSTOWN | C1102: T WEST | F1102: MAHONEY | I1102: GHAZI | L1102: TAYLOR | W1102: SPRINGVALE | X1102: 8 | Y1102: 5 | Z1102: 1 | AA1102: 1268 | AB1102: 1209 | AC1102: =(AA1102/AB1102)*100 -> 104.88006617038874 | AD1102: =(X1102*4)+(Z1102*2) -> 34
A1103: GOALKICKERS | H1103: DELULIO | J1103: DUKES | L1103: KELLY | N1103: PICKERING | P1103: ORLANDO | S1103: WITHERS | W1103: COLLINGWOOD | X1103: 8 | Y1103: 6 | Z1103: 0 | AA1103: 1370 | AB1103: 1313 | AC1103: =(AA1103/AB1103)*100 -> 104.34120335110435 | AD1103: =(X1103*4)+(Z1103*2) -> 32
A1104: CARLTON | C1104: FEVOLA 4 | E1104: MERRINGTON 2 | H1104: CULPIT 2 | J1104: HOULIHAN 2 | M1104: DOERING 2 | O1104: CARROLL 2 | R1104: CHATFIELD | W1104: ESSENDON | X1104: 7 | Y1104: 7 | Z1104: 0 | AA1104: 1224 | AB1104: 1439 | AC1104: =(AA1104/AB1104)*100 -> 85.059068797776234 | AD1104: =(X1104*4)+(Z1104*2) -> 28
A1105: WILLIAMSTOWN | C1105: MAHONEY 2 | F1105: BROWN | H1105: P DOOLEY | J1105: M WEST | L1105: MACRI | N1105: TAYLOR | P1105: SMOKER | R1105: GHAZI | W1105: FRANKSTON | X1105: 6 | Y1105: 7 | Z1105: 1 | AA1105: 1403 | AB1105: 1407 | AC1105: =(AA1105/AB1105)*100 -> 99.715707178393743 | AD1105: =(X1105*4)+(Z1105*2) -> 26
W1106: MURRAY KANGAROOS | X1106: 5 | Y1106: 9 | Z1106: 0 | AA1106: 1243 | AB1106: 1420 | AC1106: =(AA1106/AB1106)*100 -> 87.535211267605632 | AD1106: =(X1106*4)+(Z1106*2) -> 20
A1107: MURRAY KANGAROOS | C1107: 6 | D1107: 4 | E1107: =(C1107*6)+D1107 -> 40 | G1107: 11 | H1107: 6 | I1107: =(G1107*6)+H1107 -> 72 | K1107: 15 | L1107: 10 | M1107: =(K1107*6)+L1107 -> 100 | O1107: 19 | P1107: 15 | Q1107: =(O1107*6)+P1107 -> 129 | S1107: Venue: PORT MELBOURNE | W1107: PORT MELBOURNE | X1107: 4 | Y1107: 10 | Z1107: 0 | AA1107: 1190 | AB1107: 1336 | AC1107: =(AA1107/AB1107)*100 -> 89.071856287425149 | AD1107: =(X1107*4)+(Z1107*2) -> 16
A1108: PORT MELBOURNE | C1108: 3 | D1108: 3 | E1108: =(C1108*6)+D1108 -> 21 | G1108: 4 | H1108: 9 | I1108: =(G1108*6)+H1108 -> 33 | K1108: 9 | L1108: 10 | M1108: =(K1108*6)+L1108 -> 64 | O1108: 11 | P1108: 12 | Q1108: =(O1108*6)+P1108 -> 78 | W1108: PRESTON | X1108: 3 | Y1108: 11 | Z1108: 0 | AA1108: 1117 | AB1108: 1725 | AC1108: =(AA1108/AB1108)*100 -> 64.753623188405797 | AD1108: =(X1108*4)+(Z1108*2) -> 12
A1109: BEST PLAYERS | W1109: RICHMOND | X1109: 2 | Y1109: 11 | Z1109: 1 | AA1109: 1095 | AB1109: 1622 | AC1109: =(AA1109/AB1109)*100 -> 67.509247842170168 | AD1109: =(X1109*4)+(Z1109*2) -> 10
A1110: MURRAY KANGAROOS | C1110: HEWITT | F1110: SCHOLL | I1110: WATT | K1110: PAGAN | N1110: CALTHORPE | Q1110: McCORMICK | W1110: COBURG | X1110: 2 | Y1110: 12 | Z1110: 0 | AA1110: 1127 | AB1110: 1348 | AC1110: =(AA1110/AB1110)*100 -> 83.605341246290806 | AD1110: =(X1110*4)+(Z1110*2) -> 8
A1111: PORT MELBOURNE | C1111: CRAIG | F1111: NAISH | I1111: TRAIL | K1111: ARNOLD | N1111: DOYLE | W1111: BENDIGO | X1111: 0 | Y1111: 14 | Z1111: 0 | AA1111: 984 | AB1111: 1728 | AC1111: =(AA1111/AB1111)*100 -> 56.944444444444443 | AD1111: =(X1111*4)+(Z1111*2) -> 0
A1112: GOALKICKERS | M1112: WOODLEY | P1112: LASSCOCK | R1112: HEWITT
A1113: MURRAY KANGAROOS | C1113: SCHOLL 6 | E1113: SMITH 3 | G1113: KINGSLEY 2 | J1113: VAN DER KLOOSTER 2 | N1113: DHURKAY | P1113: AINLEY | R1113: McCORMICK
A1114: PORT MELBOURNE | C1114: TRAIL 4 | F1114: ARNOLD 3 | I1114: NAISH 2 | L1114: McMANUS | N1114: WHITE
D1115: 25TH JUNE | J1115: WEATHER
A1116: NORTH BALLARAT | C1116: 8 | D1116: 5 | E1116: =(C1116*6)+D1116 -> 53 | G1116: 9 | H1116: 7 | I1116: =(G1116*6)+H1116 -> 61 | K1116: 12 | L1116: 9 | M1116: =(K1116*6)+L1116 -> 81 | O1116: 17 | P1116: 12 | Q1116: =(O1116*6)+P1116 -> 114 | S1116: Venue: PRESTON
A1117: PRESTON | C1117: 0 | D1117: 1 | E1117: =(C1117*6)+D1117 -> 1 | G1117: 3 | H1117: 4 | I1117: =(G1117*6)+H1117 -> 22 | K1117: 3 | L1117: 12 | M1117: =(K1117*6)+L1117 -> 30 | O1117: 5 | P1117: 15 | Q1117: =(O1117*6)+P1117 -> 45
A1118: BEST PLAYERS
A1119: NORTH BALLARAT | C1119: FUNCKE | F1119: FIELD | I1119: INKSTER | K1119: CLARKE | N1119: FISHER | Q1119: CLAYTON
A1120: PRESTON | C1120: ZORZI | F1120: D EVANS | I1120: BLIGHT | K1120: CLARKE | N1120: LEE
A1121: GOALKICKERS
A1122: NORTH BALLARAT | C1122: INKSTER 4 | F1122: JURICA 2 | I1122: SIER 2 | K1122: CLARKE 2 | M1122: RYALL 2 | O1122: CLAYTON | Q1122: POWER | S1122: McDONALD | W1122: GREIG | X1122: FISHER
A1123: PRESTON | C1123: CANN 2 | F1123: CUSACK 2 | I1123: GRAINGER
A1125: SANDRINGHAM | C1125: 7 | D1125: 3 | E1125: =(C1125*6)+D1125 -> 45 | G1125: 12 | H1125: 5 | I1125: =(G1125*6)+H1125 -> 77 | K1125: 14 | L1125: 9 | M1125: =(K1125*6)+L1125 -> 93 | O1125: 18 | P1125: 14 | Q1125: =(O1125*6)+P1125 -> 122 | S1125: Venue: BEACH ROAD
A1126: WERRIBEE | C1126: 5 | D1126: 3 | E1126: =(C1126*6)+D1126 -> 33 | G1126: 7 | H1126: 6 | I1126: =(G1126*6)+H1126 -> 48 | K1126: 9 | L1126: 10 | M1126: =(K1126*6)+L1126 -> 64 | O1126: 13 | P1126: 13 | Q1126: =(O1126*6)+P1126 -> 91
A1127: BEST PLAYERS
A1128: SANDRINGHAM | C1128: LAMB | F1128: BROWN | I1128: LIDDELL | L1128: GODFREY | O1128: MOLONEY | R1128: HAYNES
A1129: WERRIBEE | C1129: SMITH | F1129: LAMB | I1129: ROBERTSON | L1129: FROST | O1129: SAUNDERS | R1129: GILBEE
A1130: GOALKICKERS
A1131: SANDRINGHAM | C1131: BRUCE 3 | E1131: BROWN 2 | G1131: SAUTNER 2 | J1131: OTTENS 2 | L1131: SCOTT-BRANAGAN 2 | P1131: GEHLING | R1131: HAYNES | U1131: WARD | W1131: MACGEORGE | X1131: CHISHOLM | AA1131: GODFREY | AC1131: LIDDELL
A1132: WERRIBEE | C1132: MITCHELL 4 | F1132: SATTERLEY 3 | I1132: SAUNDERS | L1132: FULLER | N1132: ROBERTSON | Q1132: SMITH | S1132: FAULKINER
A1134: ESSENDON | C1134: 4 | D1134: 6 | E1134: =(C1134*6)+D1134 -> 30 | G1134: 9 | H1134: 9 | I1134: =(G1134*6)+H1134 -> 63 | K1134: 13 | L1134: 11 | M1134: =(K1134*6)+L1134 -> 89 | O1134: 16 | P1134: 14 | Q1134: =(O1134*6)+P1134 -> 110 | S1134: Venue: WINDY HILL
A1135: BOX HILL | C1135: 2 | D1135: 2 | E1135: =(C1135*6)+D1135 -> 14 | G1135: 6 | H1135: 2 | I1135: =(G1135*6)+H1135 -> 38 | K1135: 10 | L1135: 5 | M1135: =(K1135*6)+L1135 -> 65 | O1135: 15 | P1135: 7 | Q1135: =(O1135*6)+P1135 -> 97
A1136: BEST PLAYERS
A1137: ESSENDON | C1137: D JOHNSON | F1137: DENHAM | I1137: JACOBS | L1137: EASTAUGH | O1137: BEWICK | R1137: BERBAKOV
A1138: BOX HILL | C1138: LORD | F1138: LEKKAS | I1138: SMITH | L1138: TAYLOR | O1138: McCARTNEY | R1138: COLLICA
A1139: GOALKICKERS
A1140: ESSENDON | C1140: JACOBS 4 | F1140: EASTAUGH 4 | I1140: SWITALA 3 | L1140: FERNEE 2 | O1140: LALICH | Q1140: McVEIGH | S1140: D JOHNSON
A1141: BOX HILL | C1141: TAYLOR 3 | F1141: COLLICA 2 | I1141: HABERFIELD 2 | L1141: O'FARRELL 2 | O1141: BREWER | Q1141: HAZELL | S1141: LEKKAS | V1141: MALSEED | X1141: PUGSLEY | AA1141: SMITH
A1143: FRANKSTON | C1143: 0 | D1143: 1 | E1143: =(C1143*6)+D1143 -> 1 | G1143: 0 | H1143: 5 | I1143: =(G1143*6)+H1143 -> 5 | K1143: 5 | L1143: 9 | M1143: =(K1143*6)+L1143 -> 39 | O1143: 12 | P1143: 13 | Q1143: =(O1143*6)+P1143 -> 85 | S1143: Venue: FRANKSTON
A1144: RICHMOND | C1144: 5 | D1144: 2 | E1144: =(C1144*6)+D1144 -> 32 | G1144: 9 | H1144: 4 | I1144: =(G1144*6)+H1144 -> 58 | K1144: 12 | L1144: 7 | M1144: =(K1144*6)+L1144 -> 79 | O1144: 13 | P1144: 7 | Q1144: =(O1144*6)+P1144 -> 85
A1145: BEST PLAYERS
A1146: FRANKSTON | C1146: MURRAY | F1146: SULLIVAN | I1146: GEORGIOU | L1146: BURGMAN | O1146: DAFF
A1147: RICHMOND | C1147: BURGIEL | F1147: WHITE | I1147: ZANTUCK | L1147: PROCTOR | O1147: HAYNES
A1148: GOALKICKERS
A1149: FRANKSTON | C1149: CLARKE 2 | F1149: ANDERSON 2 | I1149: GEORGE 2 | L1149: SULLIVAN 2 | O1149: SMITH | Q1149: D CLARKE | S1149: WEBB | U1149: BURNELL
A1150: RICHMOND | C1150: BURGIEL 7 | F1150: HAYNES 2 | I1150: EDWARDS | K1150: PROCTOR | M1150: McGHIE | O1150: WHITE
A1152: ST KILDA | C1152: 6 | D1152: 4 | E1152: =(C1152*6)+D1152 -> 40 | G1152: 8 | H1152: 10 | I1152: =(G1152*6)+H1152 -> 58 | K1152: 8 | L1152: 11 | M1152: =(K1152*6)+L1152 -> 59 | O1152: 11 | P1152: 14 | Q1152: =(O1152*6)+P1152 -> 80 | S1152: Venue: COBURG
A1153: COBURG | C1153: 2 | D1153: 2 | E1153: =(C1153*6)+D1153 -> 14 | G1153: 7 | H1153: 3 | I1153: =(G1153*6)+H1153 -> 45 | K1153: 10 | L1153: 9 | M1153: =(K1153*6)+L1153 -> 69 | O1153: 10 | P1153: 9 | Q1153: =(O1153*6)+P1153 -> 69
A1154: BEST PLAYERS
A1155: ST KILDA | C1155: PITTS | F1155: RYAN | I1155: HEATLEY | L1155: PLAPP | O1155: CRANAGE
A1156: COBURG | C1156: McLEOD | F1156: BICER | I1156: TORTORA | L1156: DEPASQUALE | O1156: McKENZIE-McHARG | S1156: O'CONNOR
A1157: GOALKICKERS
A1158: ST KILDA | C1158: WALTON 2 | F1158: MILNE 2 | I1158: FORTNAM 2 | L1158: HEATLEY | N1158: RYAN | P1158: YOUNG | R1158: CHARLES | U1158: CRANAGE
A1159: COBURG | C1159: O'CONNOR 3 | F1159: BICER 3 | I1159: WILLOUGHBY | L1159: LAPPIN | N1159: DRYDEN | P1159: NUNZIATO
D1160: 26TH JUNE | H1160: NIGHT MATCH | K1160: WEATHER
A1161: SPRINGVALE | C1161: 4 | D1161: 1 | E1161: =(C1161*6)+D1161 -> 25 | G1161: 8 | H1161: 4 | I1161: =(G1161*6)+H1161 -> 52 | K1161: 9 | L1161: 5 | M1161: =(K1161*6)+L1161 -> 59 | O1161: 14 | P1161: 10 | Q1161: =(O1161*6)+P1161 -> 94 | S1161: Venue: WAVERLEY
A1162: COLLINGWOOD | C1162: 2 | D1162: 2 | E1162: =(C1162*6)+D1162 -> 14 | G1162: 6 | H1162: 2 | I1162: =(G1162*6)+H1162 -> 38 | K1162: 10 | L1162: 7 | M1162: =(K1162*6)+L1162 -> 67 | O1162: 10 | P1162: 8 | Q1162: =(O1162*6)+P1162 -> 68
A1163: BEST PLAYERS
A1164: SPRINGVALE | C1164: CARROLL | F1164: HARRISON | I1164: O'BRIEN | L1164: CAPLES | O1164: IRISH | Q1164: LOGAN
A1165: COLLINGWOOD | C1165: WASLEY | F1165: PATTERSON | I1165: OBORNE | L1165: LANE | O1165: JACOTINE | Q1165: CROSISCA
A1166: GOALKICKERS
A1167: SPRINGVALE | C1167: CAPLES 3 | F1167: SMITH 3 | I1167: O'BRIEN 2 | L1167: CARROLL 2 | O1167: LOGAN | Q1167: TROLLOPE | S1167: CARMODY | V1167: IRISH
A1168: COLLINGWOOD | C1168: WASLEY 4 | F1168: KINNEAR 2 | I1168: LANE 2 | L1168: JACOTINE | N1168: SHARPEN
A1170: ROUND 15 | D1170: 1ST JULY | J1170: WEATHER
D1171: 1ST QTR | H1171: 2ND QTR | L1171: 3RD QTR | P1171: FINAL
A1172: ESSENDON | C1172: 3 | D1172: 3 | E1172: =(C1172*6)+D1172 -> 21 | G1172: 12 | H1172: 4 | I1172: =(G1172*6)+H1172 -> 76 | K1172: 16 | L1172: 6 | M1172: =(K1172*6)+L1172 -> 102 | O1172: 20 | P1172: 8 | Q1172: =(O1172*6)+P1172 -> 128 | S1172: Venue: M.C.G. (C/R) | Y1172: LADDER | AB1172: ROUND | AD1172: 15
A1173: RICHMOND | C1173: 1 | D1173: 1 | E1173: =(C1173*6)+D1173 -> 7 | G1173: 5 | H1173: 2 | I1173: =(G1173*6)+H1173 -> 32 | K1173: 8 | L1173: 4 | M1173: =(K1173*6)+L1173 -> 52 | O1173: 9 | P1173: 5 | Q1173: =(O1173*6)+P1173 -> 59
A1174: BEST PLAYERS | W1174: TEAM | X1174: W | Y1174: L | Z1174: D | AA1174: FOR | AB1174: AGST | AC1174: % | AD1174: PTS
A1175: ESSENDON | C1175: BERBAKOV | F1175: McVEIGH | I1175: BOLTON | L1175: RIOLI | O1175: EASTAUGH | R1175: PEVERILL
A1176: RICHMOND | C1176: HARRISON | F1176: GREIG | I1176: ZANTUCK | L1176: FINLAYSON | O1176: REYNOLDS | W1176: SANDRINGHAM | X1176: 13 | Y1176: 2 | Z1176: 0 | AA1176: 1769 | AB1176: 1170 | AC1176: =(AA1176/AB1176)*100 -> 151.19658119658118 | AD1176: =(X1176*4)+(Z1176*2) -> 52
A1177: GOALKICKERS | F1177: SWITALA 2 | I1177: RIOLI | K1177: COLLINS | M1177: McVEIGH | O1177: BERBAKOV | Q1177: PODSIADLY | W1177: GEELONG | X1177: 12 | Y1177: 3 | Z1177: 0 | AA1177: 1623 | AB1177: 1225 | AC1177: =(AA1177/AB1177)*100 -> 132.48979591836735 | AD1177: =(X1177*4)+(Z1177*2) -> 48
A1178: ESSENDON | C1178: PICKETT 3 | E1178: McGRATH 2 | H1178: CRANAGE 2 | K1178: EASTAUGH 2 | N1178: WALLIS 2 | Q1178: LALICH 2 | W1178: NORTH BALLARAT | X1178: 11 | Y1178: 4 | Z1178: 0 | AA1178: 1333 | AB1178: 936 | AC1178: =(AA1178/AB1178)*100 -> 142.41452991452991 | AD1178: =(X1178*4)+(Z1178*2) -> 44
A1179: RICHMOND | C1179: T EDWARDS 2 | F1179: DIMMATINA | I1179: GREEN | K1179: EVANS | M1179: HARRISON | O1179: HAYNES | Q1179: BURGIEL | S1179: REYNOLDS | W1179: ST KILDA | X1179: 11 | Y1179: 4 | Z1179: 0 | AA1179: 1605 | AB1179: 1233 | AC1179: =(AA1179/AB1179)*100 -> 130.17031630170317 | AD1179: =(X1179*4)+(Z1179*2) -> 44
W1180: CARLTON | X1180: 11 | Y1180: 4 | Z1180: 0 | AA1180: 1622 | AB1180: 1328 | AC1180: =(AA1180/AB1180)*100 -> 122.13855421686748 | AD1180: =(X1180*4)+(Z1180*2) -> 44
A1181: NORTH BALLARAT | C1181: 4 | D1181: 4 | E1181: =(C1181*6)+D1181 -> 28 | G1181: 7 | H1181: 7 | I1181: =(G1181*6)+H1181 -> 49 | K1181: 9 | L1181: 10 | M1181: =(K1181*6)+L1181 -> 64 | O1181: 10 | P1181: 12 | Q1181: =(O1181*6)+P1181 -> 72 | S1181: Venue: NORTH BALLARAT | W1181: BOX HILL | X1181: 10 | Y1181: 5 | Z1181: 0 | AA1181: 1498 | AB1181: 1324 | AC1181: =(AA1181/AB1181)*100 -> 113.14199395770392 | AD1181: =(X1181*4)+(Z1181*2) -> 40
A1182: COBURG | C1182: 1 | D1182: 1 | E1182: =(C1182*6)+D1182 -> 7 | G1182: 1 | H1182: 5 | I1182: =(G1182*6)+H1182 -> 11 | K1182: 3 | L1182: 6 | M1182: =(K1182*6)+L1182 -> 24 | O1182: 3 | P1182: 10 | Q1182: =(O1182*6)+P1182 -> 28 | W1182: WERRIBEE | X1182: 9 | Y1182: 5 | Z1182: 1 | AA1182: 1620 | AB1182: 1336 | AC1182: =(AA1182/AB1182)*100 -> 121.25748502994011 | AD1182: =(X1182*4)+(Z1182*2) -> 38
A1183: BEST PLAYERS | W1183: SPRINGVALE | X1183: 9 | Y1183: 5 | Z1183: 1 | AA1183: 1355 | AB1183: 1284 | AC1183: =(AA1183/AB1183)*100 -> 105.52959501557633 | AD1183: =(X1183*4)+(Z1183*2) -> 38
A1184: NORTH BALLARAT | C1184: CLAYTON | F1184: MOLONEY | I1184: T POLKINGHORNE | M1184: FUNCKE | O1184: FISHER | Q1184: MAHER
A1185: COBURG | C1185: DEPASQUALE | F1185: TORTORA | I1185: BAKOULAS | M1185: SAUNDERS | O1185: McKENZIE-McHARG | S1185: McLEOD | W1185: WILLIAMSTOWN | X1185: 9 | Y1185: 6 | Z1185: 0 | AA1185: 1409 | AB1185: 1413 | AC1185: =(AA1185/AB1185)*100 -> 99.716914366595901 | AD1185: =(X1185*4)+(Z1185*2) -> 36
A1186: GOALKICKERS | W1186: COLLINGWOOD | X1186: 8 | Y1186: 7 | Z1186: 0 | AA1186: 1425 | AB1186: 1410 | AC1186: =(AA1186/AB1186)*100 -> 101.06382978723406 | AD1186: =(X1186*4)+(Z1186*2) -> 32
A1187: NORTH BALLARAT | C1187: MAHER 2 | F1187: FUNCKE 2 | I1187: FISHER 2 | L1187: RYALL | N1187: INKSTER | P1187: FIELD | R1187: BAKER | W1187: ESSENDON | X1187: 8 | Y1187: 7 | Z1187: 0 | AA1187: 1352 | AB1187: 1498 | AC1187: =(AA1187/AB1187)*100 -> 90.253671562082786 | AD1187: =(X1187*4)+(Z1187*2) -> 32
A1188: COBURG | C1188: NUNZIATO | F1188: BAKOULAS | I1188: McKENZIE-McHARG | W1188: FRANKSTON | X1188: 7 | Y1188: 7 | Z1188: 1 | AA1188: 1581 | AB1188: 1494 | AC1188: =(AA1188/AB1188)*100 -> 105.82329317269077 | AD1188: =(X1188*4)+(Z1188*2) -> 30
W1189: MURRAY KANGAROOS | X1189: 5 | Y1189: 10 | Z1189: 0 | AA1189: 1333 | AB1189: 1514 | AC1189: =(AA1189/AB1189)*100 -> 88.044914134742399 | AD1189: =(X1189*4)+(Z1189*2) -> 20
A1190: ST KILDA | C1190: 2 | D1190: 5 | E1190: =(C1190*6)+D1190 -> 17 | G1190: 10 | H1190: 13 | I1190: =(G1190*6)+H1190 -> 73 | K1190: 14 | L1190: 16 | M1190: =(K1190*6)+L1190 -> 100 | O1190: 20 | P1190: 20 | Q1190: =(O1190*6)+P1190 -> 140 | S1190: Venue: MOORABBIN | W1190: PORT MELBOURNE | X1190: 4 | Y1190: 11 | Z1190: 0 | AA1190: 1272 | AB1190: 1483 | AC1190: =(AA1190/AB1190)*100 -> 85.77208361429534 | AD1190: =(X1190*4)+(Z1190*2) -> 16
A1191: GEELONG | C1191: 0 | D1191: 3 | E1191: =(C1191*6)+D1191 -> 3 | G1191: 3 | H1191: 4 | I1191: =(G1191*6)+H1191 -> 22 | K1191: 5 | L1191: 4 | M1191: =(K1191*6)+L1191 -> 34 | O1191: 7 | P1191: 4 | Q1191: =(O1191*6)+P1191 -> 46 | W1191: PRESTON | X1191: 3 | Y1191: 12 | Z1191: 0 | AA1191: 1192 | AB1191: 1812 | AC1191: =(AA1191/AB1191)*100 -> 65.783664459161145 | AD1191: =(X1191*4)+(Z1191*2) -> 12
A1192: BEST PLAYERS | W1192: RICHMOND | X1192: 2 | Y1192: 12 | Z1192: 1 | AA1192: 1154 | AB1192: 1750 | AC1192: =(AA1192/AB1192)*100 -> 65.94285714285715 | AD1192: =(X1192*4)+(Z1192*2) -> 10
A1193: ST KILDA | C1193: DAVIS | F1193: CARR | I1193: MITCHELL | L1193: MONKHURST | O1193: PITTS | Q1193: YOUNG | W1193: COBURG | X1193: 2 | Y1193: 13 | Z1193: 0 | AA1193: 1155 | AB1193: 1420 | AC1193: =(AA1193/AB1193)*100 -> 81.338028169014081 | AD1193: =(X1193*4)+(Z1193*2) -> 8
A1194: GEELONG | C1194: SIMPSON | F1194: SPRIGGS | I1194: ENRIGHT | L1194: BALDWIN | W1194: BENDIGO | X1194: 0 | Y1194: 15 | Z1194: 0 | AA1194: 1071 | AB1194: 1906 | AC1194: =(AA1194/AB1194)*100 -> 56.1909758656873 | AD1194: =(X1194*4)+(Z1194*2) -> 0
A1195: GOALKICKERS | P1195: HEAZELWOOD
A1196: ST KILDA | C1196: MONKHURST 4 | F1196: MILNE 4 | H1196: WULF 3 | J1196: MITCHELL 3 | M1196: YOUNG 2 | O1196: WALTON | Q1196: HEATLEY | S1196: CARR
A1197: GEELONG | C1197: BALDWIN 4 | F1197: BURNS | H1197: T CLARK | J1197: FOSTER
A1199: SANDRINGHAM | C1199: 3 | D1199: 2 | E1199: =(C1199*6)+D1199 -> 20 | G1199: 4 | H1199: 8 | I1199: =(G1199*6)+H1199 -> 32 | K1199: 8 | L1199: 14 | M1199: =(K1199*6)+L1199 -> 62 | O1199: 13 | P1199: 19 | Q1199: =(O1199*6)+P1199 -> 97 | S1199: Venue: VICTORIA PARK
A1200: COLLINGWOOD | C1200: 2 | D1200: 7 | E1200: =(C1200*6)+D1200 -> 19 | G1200: 3 | H1200: 11 | I1200: =(G1200*6)+H1200 -> 29 | K1200: 4 | L1200: 11 | M1200: =(K1200*6)+L1200 -> 35 | O1200: 7 | P1200: 13 | Q1200: =(O1200*6)+P1200 -> 55
A1201: BEST PLAYERS
A1202: SANDRINGHAM | C1202: COGHLAN | F1202: MALONEY | I1202: GODFREY | L1202: SHANAHAN | O1202: LIDDELL | R1202: WARD
A1203: COLLINGWOOD | C1203: CROSISCA | F1203: SHARPEN | I1203: PATTERSON | L1203: ADKINS | O1203: LANE | R1203: STONE
A1204: GOALKICKERS
A1205: SANDRINGHAM | C1205: HAYNES 3 | E1205: TEMPLETON 2 | H1205: CHISHOLM 2 | K1205: KENNEDY | M1205: WARD | O1205: GODFREY | Q1205: COOK | S1205: LE CORDIER | W1205: MACGEORGE
A1206: COLLINGWOOD | C1206: OBORNE 2 | F1206: SMITH 2 | I1206: PATTERSON | L1206: McKEE | N1206: LANE
A1208: BOX HILL | C1208: 5 | D1208: 0 | E1208: =(C1208*6)+D1208 -> 30 | G1208: 8 | H1208: 5 | I1208: =(G1208*6)+H1208 -> 53 | K1208: 11 | L1208: 19 | M1208: =(K1208*6)+L1208 -> 85 | O1208: 13 | P1208: 16 | Q1208: =(O1208*6)+P1208 -> 94 | S1208: Venue: BOX HILL
A1209: MURRAY KANGAROOS | C1209: 6 | D1209: 2 | E1209: =(C1209*6)+D1209 -> 38 | G1209: 8 | H1209: 7 | I1209: =(G1209*6)+H1209 -> 55 | K1209: 11 | L1209: 10 | M1209: =(K1209*6)+L1209 -> 76 | O1209: 13 | P1209: 12 | Q1209: =(O1209*6)+P1209 -> 90
A1210: BEST PLAYERS
A1211: BOX HILL | C1211: MANN | F1211: HARTIN | I1211: BARLOW | L1211: LOATS | O1211: TAYLOR | Q1211: OBST
A1212: MURRAY KANGAROOS | C1212: LASSCOCK | F1212: KINGSLEY | I1212: COCHRANE | L1212: McCORMICK | O1212: SCOTT | Q1212: HILTON
A1213: GOALKICKERS
A1214: BOX HILL | C1214: BARLOW 2 | F1214: BREWER 2 | I1214: COLLICA 2 | L1214: HARTIN 2 | N1214: HABERFIELD | Q1214: HAZELL | S1214: O'FARRELL | W1214: TAYLOR | X1214: RODE
A1215: MURRAY KANGAROOS | C1215: SHOLL 3 | F1215: KINGSLEY 2 | I1215: CALTHORPE 2 | L1215: LASSCOCK | N1215: CHANDLER | Q1215: SCOTT | S1215: VAN DER KLOOSTER | X1215: HEWITT | Z1215: WOODLEY
D1216: 2ND JULY | J1216: WEATHER
A1217: FRANKSTON | C1217: 5 | D1217: 1 | E1217: =(C1217*6)+D1217 -> 31 | G1217: 15 | H1217: 3 | I1217: =(G1217*6)+H1217 -> 93 | K1217: 19 | L1217: 3 | M1217: =(K1217*6)+L1217 -> 117 | O1217: 29 | P1217: 4 | Q1217: =(O1217*6)+P1217 -> 178 | S1217: Venue: BENDIGO
A1218: BENDIGO | C1218: 4 | D1218: 2 | E1218: =(C1218*6)+D1218 -> 26 | G1218: 7 | H1218: 6 | I1218: =(G1218*6)+H1218 -> 48 | K1218: 7 | L1218: 12 | M1218: =(K1218*6)+L1218 -> 54 | O1218: 12 | P1218: 15 | Q1218: =(O1218*6)+P1218 -> 87
A1219: BEST PLAYERS
A1220: FRANKSTON | C1220: BURGMAN | F1220: ANDERSON | I1220: GEORGE | L1220: GEORGIOU | O1220: MALLOY | Q1220: ROBERTS
A1221: BENDIGO | C1221: GATHERCOLE | F1221: SUTHERLAND | I1221: DIXON | L1221: ANGOVE | O1221: WHITSED | Q1221: GRIGG
A1222: GOALKICKERS
A1223: FRANKSTON | C1223: ANDERSON 6 | F1223: SULLIVAN 6 | I1223: GEORGE 5 | K1223: CLARKE 4 | M1223: WILLIAMS 3 | P1223: BURGMAN 2 | S1223: GEORGIOU | W1223: MALLOY | X1223: McCORMACK
A1224: BENDIGO | C1224: CONNAUGHTON 2 | F1224: O'TOOLE 2 | I1224: SHIELS 2 | K1224: WALSH 2 | M1224: DILLON | O1224: KEOWN | Q1224: O'CALLAGHAN | U1224: SCHMIDT
A1226: SPRINGVALE | C1226: 3 | D1226: 5 | E1226: =(C1226*6)+D1226 -> 23 | G1226: 8 | H1226: 6 | I1226: =(G1226*6)+H1226 -> 54 | K1226: 10 | L1226: 9 | M1226: =(K1226*6)+L1226 -> 69 | O1226: 12 | P1226: 15 | Q1226: =(O1226*6)+P1226 -> 87 | S1226: Venue: PRESTON
A1227: PRESTON | C1227: 3 | D1227: 3 | E1227: =(C1227*6)+D1227 -> 21 | G1227: 6 | H1227: 3 | I1227: =(G1227*6)+H1227 -> 39 | K1227: 8 | L1227: 8 | M1227: =(K1227*6)+L1227 -> 56 | O1227: 11 | P1227: 9 | Q1227: =(O1227*6)+P1227 -> 75
A1228: BEST PLAYERS
A1229: SPRINGVALE | C1229: LOGAN | F1229: PITT | I1229: SHEAHAN | L1229: COURTNEY | O1229: JOY | Q1229: CLARK
A1230: PRESTON | C1230: ZORZI | F1230: GROSSMAN | I1230: BLIGHT | L1230: D EVANS | O1230: WEBBER | Q1230: CLARKE
A1231: GOALKICKERS
A1232: SPRINGVALE | C1232: LOGAN 4 | F1232: COURTNEY | I1232: SMITH | K1232: O'BRIEN | M1232: CARROLL | O1232: HARRISON | Q1232: PITT | R1232: CARMODY | U1232: IRISH
A1233: PRESTON | C1233: GRAINGER 4 | F1233: MANN 2 | I1233: HILL | J1233: CANN | L1233: SCANLON | N1233: ZORZI | P1233: FAVRIN
A1235: WERRIBEE | C1235: 5 | D1235: 7 | E1235: =(C1235*6)+D1235 -> 37 | G1235: 7 | H1235: 13 | I1235: =(G1235*6)+H1235 -> 55 | K1235: 10 | L1235: 22 | M1235: =(K1235*6)+L1235 -> 82 | O1235: 16 | P1235: 26 | Q1235: =(O1235*6)+P1235 -> 122 | S1235: Venue: WHITTEN OVAL
A1236: WILLIAMSTOWN | C1236: 2 | D1236: 2 | E1236: =(C1236*6)+D1236 -> 14 | G1236: 5 | H1236: 4 | I1236: =(G1236*6)+H1236 -> 34 | K1236: 8 | L1236: 5 | M1236: =(K1236*6)+L1236 -> 53 | O1236: 9 | P1236: 6 | Q1236: =(O1236*6)+P1236 -> 60
A1237: BEST PLAYERS
A1238: WERRIBEE | C1238: ROBERTSON | F1238: GILBEE | I1238: MURPHY | L1238: WILLS | O1238: SMITH | Q1238: GOODEY
A1239: WILLIAMSTOWN | C1239: DONALDSON | F1239: WOOD | I1239: TAYLOR | L1239: MACRI | O1239: LLOYD | Q1239: BOWDEN
A1240: GOALKICKERS
A1241: WERRIBEE | C1241: SMITH 5 | F1241: MITCHELL 3 | I1241: GILBEE 2 | L1241: SATTERLEY 2 | O1241: FULLER 2 | Q1241: LAMB | S1241: CHURCHILL
A1242: WILLIAMSTOWN | C1242: BOWDEN 5 | F1242: MACRI | H1242: WEST | J1242: CHRISTOFORO | M1242: GIANSIRACUSA
D1243: 3RD JULY | H1243: NIGHT MATCH | K1243: WEATHER
A1244: CARLTON | C1244: 4 | D1244: 4 | E1244: =(C1244*6)+D1244 -> 28 | G1244: 6 | H1244: 6 | I1244: =(G1244*6)+H1244 -> 42 | K1244: 12 | L1244: 11 | M1244: =(K1244*6)+L1244 -> 83 | O1244: 22 | P1244: 15 | Q1244: =(O1244*6)+P1244 -> 147 | S1244: Venue: WAVERLEY
A1245: PORT MELBOURNE | C1245: 3 | D1245: 2 | E1245: =(C1245*6)+D1245 -> 20 | G1245: 7 | H1245: 6 | I1245: =(G1245*6)+H1245 -> 48 | K1245: 10 | L1245: 8 | M1245: =(K1245*6)+L1245 -> 68 | O1245: 12 | P1245: 10 | Q1245: =(O1245*6)+P1245 -> 82
A1246: BEST PLAYERS
A1247: CARLTON | C1247: DOERING | F1247: CHATFIELD | I1247: BROWN | L1247: FEVOLA | N1247: MURPHY | Q1247: PRENDERGAST
A1248: PORT MELBOURNE | C1248: FEAST | F1248: FIXTER | I1248: WHITE | L1248: NAISH | N1248: CROW | Q1248: TOMSIC
A1249: GOALKICKERS
A1250: CARLTON | C1250: DOERING 6 | F1250: FEVOLA 5 | I1250: BROWN 3 | K1250: ADAM MERRINGTON 2 | O1250: BACKWELL | Q1250: ANDREW MERRINGTON | W1250: COLBERT | X1250: DELULIO | AA1250: DUKES | AC1250: CARROLL
A1251: PORT MELBOURNE | C1251: TRAIL 3 | F1251: WHITE 2 | I1251: FEAST 2 | K1251: SWAN 2 | M1251: ELLIOTT | O1251: SANGSTER | Q1251: NAISH
A1253: ROUND 16 | D1253: 8TH JULY | J1253: WEATHER
D1254: 1ST QTR | H1254: 2ND QTR | L1254: 3RD QTR | P1254: FINAL
A1255: SPRINGVALE | C1255: 3 | D1255: 1 | E1255: =(C1255*6)+D1255 -> 19 | G1255: 7 | H1255: 5 | I1255: =(G1255*6)+H1255 -> 47 | K1255: 8 | L1255: 9 | M1255: =(K1255*6)+L1255 -> 57 | O1255: 8 | P1255: 11 | Q1255: =(O1255*6)+P1255 -> 59 | S1255: Venue: WAVERLEY | Y1255: LADDER | AB1255: ROUND | AD1255: 16
A1256: ESSENDON | C1256: 2 | D1256: 5 | E1256: =(C1256*6)+D1256 -> 17 | G1256: 3 | H1256: 7 | I1256: =(G1256*6)+H1256 -> 25 | K1256: 6 | L1256: 7 | M1256: =(K1256*6)+L1256 -> 43 | O1256: 8 | P1256: 10 | Q1256: =(O1256*6)+P1256 -> 58
A1257: BEST PLAYERS | W1257: TEAM | X1257: W | Y1257: L | Z1257: D | AA1257: FOR | AB1257: AGST | AC1257: % | AD1257: PTS
A1258: SPRINGVALE | C1258: HARRISON | F1258: LITTLE | I1258: CARMODY | L1258: MEYER | N1258: O'BRIEN | Q1258: SUTHERLAND
A1259: ESSENDON | C1259: BOLTON | F1259: BERBAKOV | I1259: McGRATH | L1259: McVEIGH | N1259: RIOLI | Q1259: FRASER | W1259: SANDRINGHAM | X1259: 14 | Y1259: 2 | Z1259: 0 | AA1259: 1827 | AB1259: 1209 | AC1259: =(AA1259/AB1259)*100 -> 151.1166253101737 | AD1259: =(X1259*4)+(Z1259*2) -> 56
A1260: GOALKICKERS | W1260: ST KILDA | X1260: 12 | Y1260: 4 | Z1260: 0 | AA1260: 1774 | AB1260: 1301 | AC1260: =(AA1260/AB1260)*100 -> 136.3566487317448 | AD1260: =(X1260*4)+(Z1260*2) -> 48
A1261: SPRINGVALE | C1261: SMITH 4 | F1261: MEYER 2 | I1261: O'BRIEN | K1261: HARRISON | W1261: GEELONG | X1261: 12 | Y1261: 4 | Z1261: 0 | AA1261: 1733 | AB1261: 1359 | AC1261: =(AA1261/AB1261)*100 -> 127.52023546725533 | AD1261: =(X1261*4)+(Z1261*2) -> 48
A1262: ESSENDON | C1262: McVEIGH 4 | F1262: BERBAKOV 2 | I1262: SHEPPARD | L1262: EASTAUGH | W1262: CARLTON | X1262: 12 | Y1262: 4 | Z1262: 0 | AA1262: 1757 | AB1262: 1402 | AC1262: =(AA1262/AB1262)*100 -> 125.32097004279601 | AD1262: =(X1262*4)+(Z1262*2) -> 48
D1263: 9TH JULY | J1263: WEATHER | W1263: NORTH BALLARAT | X1263: 11 | Y1263: 5 | Z1263: 0 | AA1263: 1404 | AB1263: 1099 | AC1263: =(AA1263/AB1263)*100 -> 127.75250227479526 | AD1263: =(X1263*4)+(Z1263*2) -> 44
A1264: ST KILDA | C1264: 4 | D1264: 2 | E1264: =(C1264*6)+D1264 -> 26 | G1264: 11 | H1264: 4 | I1264: =(G1264*6)+H1264 -> 70 | K1264: 21 | L1264: 5 | M1264: =(K1264*6)+L1264 -> 131 | O1264: 27 | P1264: 7 | Q1264: =(O1264*6)+P1264 -> 169 | S1264: Venue: MOORABBIN | W1264: BOX HILL | X1264: 11 | Y1264: 5 | Z1264: 0 | AA1264: 1592 | AB1264: 1392 | AC1264: =(AA1264/AB1264)*100 -> 114.36781609195404 | AD1264: =(X1264*4)+(Z1264*2) -> 44
A1265: FRANKSTON | C1265: 2 | D1265: 6 | E1265: =(C1265*6)+D1265 -> 18 | G1265: 5 | H1265: 7 | I1265: =(G1265*6)+H1265 -> 37 | K1265: 9 | L1265: 11 | M1265: =(K1265*6)+L1265 -> 65 | O1265: 9 | P1265: 14 | Q1265: =(O1265*6)+P1265 -> 68 | W1265: WERRIBEE | X1265: 10 | Y1265: 5 | Z1265: 1 | AA1265: 1783 | AB1265: 1407 | AC1265: =(AA1265/AB1265)*100 -> 126.72352523098792 | AD1265: =(X1265*4)+(Z1265*2) -> 42
A1266: BEST PLAYERS | W1266: SPRINGVALE | X1266: 10 | Y1266: 5 | Z1266: 1 | AA1266: 1414 | AB1266: 1342 | AC1266: =(AA1266/AB1266)*100 -> 105.36512667660209 | AD1266: =(X1266*4)+(Z1266*2) -> 42
A1267: ST KILDA | C1267: MILNE | F1267: YOUNG | I1267: WALTON | L1267: PITTS | N1267: SCHWARZE | Q1267: CARR
A1268: FRANKSTON | C1268: LAWRENCE | F1268: MALLOY | I1268: GEORGIOU | L1268: WILLIAMS | W1268: WILLIAMSTOWN | X1268: 10 | Y1268: 6 | Z1268: 0 | AA1268: 1543 | AB1268: 1523 | AC1268: =(AA1268/AB1268)*100 -> 101.31319763624424 | AD1268: =(X1268*4)+(Z1268*2) -> 40
A1269: GOALKICKERS | L1269: BRAYSHAW | O1269: CARR | Q1269: WOOD | S1269: PITTS | W1269: COLLINGWOOD | X1269: 8 | Y1269: 8 | Z1269: 0 | AA1269: 1499 | AB1269: 1545 | AC1269: =(AA1269/AB1269)*100 -> 97.022653721682843 | AD1269: =(X1269*4)+(Z1269*2) -> 32
A1270: ST KILDA | C1270: MILNE 6 | E1270: WALTON 5 | H1270: KIELY 3 | J1270: WULF 3 | L1270: MONKHURST 3 | O1270: FORTNAM | Q1270: YOUNG | S1270: MITCHELL | W1270: ESSENDON | X1270: 8 | Y1270: 8 | Z1270: 0 | AA1270: 1410 | AB1270: 1557 | AC1270: =(AA1270/AB1270)*100 -> 90.5587668593449 | AD1270: =(X1270*4)+(Z1270*2) -> 32
A1271: FRANKSTON | C1271: WILLIAMS 2 | F1271: GEORGE 2 | I1271: ANDERSON 2 | L1271: FERRARO 2 | O1271: DAM CLARKE | W1271: FRANKSTON | X1271: 7 | Y1271: 8 | Z1271: 1 | AA1271: 1649 | AB1271: 1663 | AC1271: =(AA1271/AB1271)*100 -> 99.158147925435955 | AD1271: =(X1271*4)+(Z1271*2) -> 30
W1272: PORT MELBOURNE | X1272: 5 | Y1272: 11 | Z1272: 0 | AA1272: 1407 | AB1272: 1532 | AC1272: =(AA1272/AB1272)*100 -> 91.840731070496091 | AD1272: =(X1272*4)+(Z1272*2) -> 20
A1273: PORT MELBOURNE | C1273: 5 | D1273: 2 | E1273: =(C1273*6)+D1273 -> 32 | G1273: 9 | H1273: 3 | I1273: =(G1273*6)+H1273 -> 57 | K1273: 14 | L1273: 4 | M1273: =(K1273*6)+L1273 -> 88 | O1273: 21 | P1273: 9 | Q1273: =(O1273*6)+P1273 -> 135 | S1273: Venue: BENDIGO | W1273: MURRAY KANGAROOS | X1273: 5 | Y1273: 11 | Z1273: 0 | AA1273: 1372 | AB1273: 1572 | AC1273: =(AA1273/AB1273)*100 -> 87.277353689567434 | AD1273: =(X1273*4)+(Z1273*2) -> 20
A1274: BENDIGO | C1274: 4 | D1274: 0 | E1274: =(C1274*6)+D1274 -> 24 | G1274: 4 | H1274: 2 | I1274: =(G1274*6)+H1274 -> 26 | K1274: 6 | L1274: 4 | M1274: =(K1274*6)+L1274 -> 40 | O1274: 7 | P1274: 7 | Q1274: =(O1274*6)+P1274 -> 49 | W1274: PRESTON | X1274: 4 | Y1274: 12 | Z1274: 0 | AA1274: 1303 | AB1274: 1888 | AC1274: =(AA1274/AB1274)*100 -> 69.014830508474574 | AD1274: =(X1274*4)+(Z1274*2) -> 16
A1275: BEST PLAYERS | W1275: RICHMOND | X1275: 2 | Y1275: 13 | Z1275: 1 | AA1275: 1222 | AB1275: 1844 | AC1275: =(AA1275/AB1275)*100 -> 66.268980477223423 | AD1275: =(X1275*4)+(Z1275*2) -> 10
A1276: PORT MELBOURNE | C1276: BENNETT | F1276: MATTHEWS-HERALD | J1276: WARFF | L1276: SWAN | N1276: FEAST | P1276: ELLIOTT | W1276: COBURG | X1276: 2 | Y1276: 14 | Z1276: 0 | AA1276: 1231 | AB1276: 1531 | AC1276: =(AA1276/AB1276)*100 -> 80.404964075767467 | AD1276: =(X1276*4)+(Z1276*2) -> 8
A1277: BENDIGO | C1277: WALSH | F1277: DILLON | I1277: WHITSED | L1277: CARTER | N1277: SCHMIDT | P1277: GATHERCOLE | W1277: BENDIGO | X1277: 0 | Y1277: 16 | Z1277: 0 | AA1277: 1130 | AB1277: 2041 | AC1277: =(AA1277/AB1277)*100 -> 55.365017148456644 | AD1277: =(X1277*4)+(Z1277*2) -> 0
A1278: GOALKICKERS | L1278: MATTHEWS-HERALD | P1278: ROSE | Q1278: TRAIL | S1278: WHITE
A1279: PORT MELBOURNE | C1279: SWAN 6 | E1279: ARNOLD 3 | G1279: FEAST 2 | I1279: BAUMGARTNER 2 | M1279: BOSSONG 2 | P1279: ELLIOTT | R1279: McCORMICK
A1280: BENDIGO | C1280: BOWER 2 | F1280: BROCK SHIELS 2 | J1280: WALSH 2 | M1280: DILLON
A1282: WERRIBEE | C1282: 6 | D1282: 2 | E1282: =(C1282*6)+D1282 -> 38 | G1282: 11 | H1282: 3 | I1282: =(G1282*6)+H1282 -> 69 | K1282: 16 | L1282: 4 | M1282: =(K1282*6)+L1282 -> 100 | O1282: 26 | P1282: 7 | Q1282: =(O1282*6)+P1282 -> 163 | S1282: Venue: WERRIBEE
A1283: NORTH BALLARAT | C1283: 1 | D1283: 5 | E1283: =(C1283*6)+D1283 -> 11 | G1283: 3 | H1283: 6 | I1283: =(G1283*6)+H1283 -> 24 | K1283: 6 | L1283: 10 | M1283: =(K1283*6)+L1283 -> 46 | O1283: 10 | P1283: 11 | Q1283: =(O1283*6)+P1283 -> 71
A1284: BEST PLAYERS
A1285: WERRIBEE | C1285: ALVEY | F1285: WIGGINS | I1285: MURPHY | L1285: FAULKINER | N1285: HYDE | P1285: GILBEE
A1286: NORTH BALLARAT | C1286: J POLKINGHORNE | G1286: FISHER | I1286: POWER | L1286: FIELD | N1286: LUBEEK
A1287: GOALKICKERS
A1288: WERRIBEE | C1288: WIGGINS 7 | F1288: ALVEY 5 | H1288: FULLER 4 | K1288: GILBEE 3 | M1288: MURPHY 2 | P1288: GOODEY | R1288: MITCHELL | U1288: SAUNDERS | X1288: HARGREAVES | AB1288: SUTTON
A1289: NORTH BALLARAT | C1289: INKSTER 2 | F1289: FISHER | H1289: EDWARDS | J1289: BAKER | L1289: McDONALD | N1289: MURRIHY | P1289: JURICA | R1289: POWER | T1289: McCORKELL
A1291: PRESTON | C1291: 8 | D1291: 2 | E1291: =(C1291*6)+D1291 -> 50 | G1291: 10 | H1291: 4 | I1291: =(G1291*6)+H1291 -> 64 | K1291: 12 | L1291: 5 | M1291: =(K1291*6)+L1291 -> 77 | O1291: 17 | P1291: 9 | Q1291: =(O1291*6)+P1291 -> 111 | S1291: Venue: COBURG
A1292: COBURG | C1292: 1 | D1292: 2 | E1292: =(C1292*6)+D1292 -> 8 | G1292: 5 | H1292: 5 | I1292: =(G1292*6)+H1292 -> 35 | K1292: 7 | L1292: 9 | M1292: =(K1292*6)+L1292 -> 51 | O1292: 11 | P1292: 10 | Q1292: =(O1292*6)+P1292 -> 76
A1293: BEST PLAYERS
A1294: PRESTON | C1294: ZORZI | F1294: CANN | I1294: CARACELLA | L1294: BLIGHT | O1294: CLARKE | Q1294: LEE
A1295: COBURG | C1295: McLEOD | F1295: McKENZIE-McHARG | J1295: LAPPIN | L1295: HAOUCHER | O1295: SHEATHER
A1296: GOALKICKERS
A1297: PRESTON | C1297: CANN 5 | F1297: GIBSON 5 | I1297: GRAINGER 3 | L1297: PENN | N1297: CROWLEY | Q1297: CARACELLA | T1297: CHAMBERS
A1298: COBURG | C1298: RYAN 2 | E1298: KEENAN 2 | H1298: CANNING | J1298: McLEOD | L1298: OPPENLANDER | O1298: LAPPIN | Q1298: BICER | R1298: DEPASQUALE | V1298: WILLOUGHBY
A1300: CARLTON | C1300: 4 | D1300: 3 | E1300: =(C1300*6)+D1300 -> 27 | G1300: 9 | H1300: 4 | I1300: =(G1300*6)+H1300 -> 58 | K1300: 16 | L1300: 7 | M1300: =(K1300*6)+L1300 -> 103 | O1300: 21 | P1300: 9 | Q1300: =(O1300*6)+P1300 -> 135 | S1300: Venue: OPTUS OVAL (C/R)
A1301: COLLINGWOOD | C1301: 2 | D1301: 2 | E1301: =(C1301*6)+D1301 -> 14 | G1301: 7 | H1301: 4 | I1301: =(G1301*6)+H1301 -> 46 | K1301: 9 | L1301: 6 | M1301: =(K1301*6)+L1301 -> 60 | O1301: 11 | P1301: 8 | Q1301: =(O1301*6)+P1301 -> 74
A1302: BEST PLAYERS
A1303: CARLTON | C1303: DOERING | F1303: MURPHY | I1303: CHATFIELD | L1303: FEVOLA | N1303: MANTON | Q1303: PRENDERGAST
A1304: COLLINGWOOD | C1304: JACOTINE | F1304: LOCKYER | I1304: ROACH | L1304: LANE
A1305: GOALKICKERS
A1306: CARLTON | C1306: FEVOLA 7 | F1306: DOERING 3 | I1306: PASSADOR 3 | L1306: BACKWELL 3 | O1306: A MERRINGTON 2 | S1306: VANCE | U1306: CHATFIELD | X1306: CARROLL
A1307: COLLINGWOOD | C1307: MARTELLO 3 | F1307: WATSON 2 | I1307: GARDINER | L1307: SMITH | N1307: ROACH | P1307: ADKINS | R1307: ANSTEY | T1307: GEORGE
A1309: WILLIAMSTOWN | C1309: 6 | D1309: 3 | E1309: =(C1309*6)+D1309 -> 39 | G1309: 9 | H1309: 9 | I1309: =(G1309*6)+H1309 -> 63 | K1309: 15 | L1309: 11 | M1309: =(K1309*6)+L1309 -> 101 | O1309: 20 | P1309: 14 | Q1309: =(O1309*6)+P1309 -> 134 | S1309: Venue: WILLIAMSTOWN
A1310: GEELONG | C1310: 4 | D1310: 5 | E1310: =(C1310*6)+D1310 -> 29 | G1310: 8 | H1310: 8 | I1310: =(G1310*6)+H1310 -> 56 | K1310: 14 | L1310: 9 | M1310: =(K1310*6)+L1310 -> 93 | O1310: 16 | P1310: 14 | Q1310: =(O1310*6)+P1310 -> 110
A1311: BEST PLAYERS
A1312: WILLIAMSTOWN | C1312: M WEST | F1312: MACRI | I1312: LLOYD | K1312: CARRICK | N1312: T WEST | Q1312: LLOYD
A1313: GEELONG | C1313: HALL | F1313: BALDWIN | I1313: SIMPSON | K1313: PICKERING | N1313: LINDSAY | Q1313: CHAPMAN
A1314: GOALKICKERS
A1315: WILLIAMSTOWN | C1315: TAYLOR 7 | F1315: GHAZI 3 | I1315: COX 3 | K1315: MACRI 2 | M1315: ROUND | O1315: BOWDEN | Q1315: RIPPON | S1315: SMOKER | V1315: M WEST
A1316: GEELONG | C1316: BALDWIN 8 | F1316: HALL 3 | I1316: STONEHAM 3 | L1316: HARDING | N1316: STREET
A1318: SANDRINGHAM | C1318: 4 | D1318: 0 | E1318: =(C1318*6)+D1318 -> 24 | G1318: 6 | H1318: 1 | I1318: =(G1318*6)+H1318 -> 37 | K1318: 6 | L1318: 7 | M1318: =(K1318*6)+L1318 -> 43 | O1318: 8 | P1318: 10 | Q1318: =(O1318*6)+P1318 -> 58 | S1318: Venue: LAVINGTON
A1319: MURRAY KANGAROOS | C1319: 2 | D1319: 2 | E1319: =(C1319*6)+D1319 -> 14 | G1319: 3 | H1319: 3 | I1319: =(G1319*6)+H1319 -> 21 | K1319: 4 | L1319: 7 | M1319: =(K1319*6)+L1319 -> 31 | O1319: 5 | P1319: 9 | Q1319: =(O1319*6)+P1319 -> 39
A1320: BEST PLAYERS
A1321: SANDRINGHAM | C1321: HAYNES | F1321: COGHLAN | I1321: MALONEY | K1321: BRUCE | N1321: HOPGOOD | Q1321: MACGEORGE
A1322: MURRAY KANGAROOS | C1322: STEPHENS | F1322: ABLETT | I1322: PIKE | K1322: LASSCOCK | N1322: WATT
A1323: GOALKICKERS
A1324: SANDRINGHAM | C1324: BRUCE 4 | F1324: MACGEORGE | I1324: SAUTNER | K1324: SCOTT-BRANAGAN | O1324: KENNEDY
A1325: MURRAY KANGAROOS | C1325: TAFFT 2 | F1325: SPAULL | H1325: WOODLEY | J1325: STEPHENS
D1326: 12TH JUNE | H1326: NIGHT MATCH | K1326: WEATHER
A1327: BOX HILL | C1327: 3 | D1327: 5 | E1327: =(C1327*6)+D1327 -> 23 | G1327: 6 | H1327: 9 | I1327: =(G1327*6)+H1327 -> 45 | K1327: 10 | L1327: 15 | M1327: =(K1327*6)+L1327 -> 75 | O1327: 13 | P1327: 16 | Q1327: =(O1327*6)+P1327 -> 94 | S1327: Venue: WAVERLEY
A1328: RICHMOND | C1328: 3 | D1328: 3 | E1328: =(C1328*6)+D1328 -> 21 | G1328: 5 | H1328: 5 | I1328: =(G1328*6)+H1328 -> 35 | K1328: 7 | L1328: 7 | M1328: =(K1328*6)+L1328 -> 49 | O1328: 10 | P1328: 8 | Q1328: =(O1328*6)+P1328 -> 68
A1329: BEST PLAYERS
A1330: BOX HILL | C1330: MANN | F1330: SMITH | I1330: OBST | K1330: BARLOW | N1330: MALSEED
A1331: RICHMOND | C1331: STEINFORT | F1331: ZANTUCK | I1331: HAYNES | K1331: ARTHURSON | N1331: HART
A1332: GOALKICKERS
A1333: BOX HILL | C1333: BARLOW 2 | F1333: MALSEED 2 | I1333: BATEMAN | K1333: CHAPMAN | M1333: COLLICA | O1333: HABERFIELD | R1333: HARTIN | T1333: LOATS | W1333: MANN | X1333: McPHARLIN | AA1333: PUGSLEY
A1334: RICHMOND | C1334: BURGIEL 3 | F1334: REYNOLDS 2 | I1334: WHITE 2 | L1334: SAMPSON | N1334: STEINFORT | Q1334: M EDWARDS
A1336: ROUND 17 | D1336: 15TH JULY | J1336: WEATHER
D1337: 1ST QTR | H1337: 2ND QTR | L1337: 3RD QTR | P1337: FINAL
A1338: GEELONG | C1338: 5 | D1338: 6 | E1338: =(C1338*6)+D1338 -> 36 | G1338: 12 | H1338: 6 | I1338: =(G1338*6)+H1338 -> 78 | K1338: 16 | L1338: 10 | M1338: =(K1338*6)+L1338 -> 106 | O1338: 21 | P1338: 15 | Q1338: =(O1338*6)+P1338 -> 141 | S1338: Venue: SHELL STADIUM | Y1338: LADDER | AB1338: ROUND | AD1338: 17
A1339: WERRIBEE | C1339: 3 | D1339: 3 | E1339: =(C1339*6)+D1339 -> 21 | G1339: 7 | H1339: 4 | I1339: =(G1339*6)+H1339 -> 46 | K1339: 11 | L1339: 5 | M1339: =(K1339*6)+L1339 -> 71 | O1339: 16 | P1339: 7 | Q1339: =(O1339*6)+P1339 -> 103
A1340: BEST PLAYERS | W1340: TEAM | X1340: W | Y1340: L | Z1340: D | AA1340: FOR | AB1340: AGST | AC1340: % | AD1340: PTS
A1341: GEELONG | C1341: ARNOTT | F1341: HAY | I1341: CORRIGAN | L1341: T LYNCH | O1341: LINDSAY | R1341: LING
A1342: WERRIBEE | C1342: HARGREAVES | F1342: SAUNDERS | I1342: FROST | L1342: ROBERTSON | O1342: MITCHELL | R1342: FAULKINER | W1342: SANDRINGHAM | X1342: 15 | Y1342: 2 | Z1342: 0 | AA1342: 1949 | AB1342: 1291 | AC1342: =(AA1342/AB1342)*100 -> 150.96824167312161 | AD1342: =(X1342*4)+(Z1342*2) -> 60
A1343: GOALKICKERS | H1343: T CLARK | J1343: CORRIGAN | M1343: KARAMATIC | P1343: LINDSAY | S1343: STONEHAM | W1343: ST KILDA | X1343: 13 | Y1343: 4 | Z1343: 0 | AA1343: 1879 | AB1343: 1361 | AC1343: =(AA1343/AB1343)*100 -> 138.06024981631154 | AD1343: =(X1343*4)+(Z1343*2) -> 52
A1344: GEELONG | C1344: LING 4 | E1344: STREET 3 | G1344: CHAPMAN 2 | J1344: COWELL 2 | M1344: HARDING 2 | P1344: BALDWIN 2 | S1344: ARNOTT | W1344: GEELONG | X1344: 13 | Y1344: 4 | Z1344: 0 | AA1344: 1874 | AB1344: 1462 | AC1344: =(AA1344/AB1344)*100 -> 128.18057455540355 | AD1344: =(X1344*4)+(Z1344*2) -> 52
A1345: WERRIBEE | C1345: WILLS 3 | E1345: MITCHELL 3 | H1345: SAUNDERS 3 | K1345: BUTTON 2 | M1345: PULI 2 | O1345: SATTERLEY | Q1345: GILBEE | W1345: NORTH BALLARAT | X1345: 12 | Y1345: 5 | Z1345: 0 | AA1345: 1483 | AB1345: 1157 | AC1345: =(AA1345/AB1345)*100 -> 128.17631806395852 | AD1345: =(X1345*4)+(Z1345*2) -> 48
N1346: HARGREAVES | W1346: CARLTON | X1346: 12 | Y1346: 5 | Z1346: 0 | AA1346: 1839 | AB1346: 1524 | AC1346: =(AA1346/AB1346)*100 -> 120.66929133858268 | AD1346: =(X1346*4)+(Z1346*2) -> 48
A1347: NORTH BALLARAT | C1347: 2 | D1347: 5 | E1347: =(C1347*6)+D1347 -> 17 | G1347: 5 | H1347: 10 | I1347: =(G1347*6)+H1347 -> 40 | K1347: 9 | L1347: 13 | M1347: =(K1347*6)+L1347 -> 67 | O1347: 11 | P1347: 13 | Q1347: =(O1347*6)+P1347 -> 79 | S1347: Venue: NORTH BALLARAT | W1347: BOX HILL | X1347: 12 | Y1347: 5 | Z1347: 0 | AA1347: 1719 | AB1347: 1451 | AC1347: =(AA1347/AB1347)*100 -> 118.47002067539627 | AD1347: =(X1347*4)+(Z1347*2) -> 48
A1348: SPRINGVALE | C1348: 1 | D1348: 4 | E1348: =(C1348*6)+D1348 -> 10 | G1348: 3 | H1348: 7 | I1348: =(G1348*6)+H1348 -> 25 | K1348: 3 | L1348: 10 | M1348: =(K1348*6)+L1348 -> 28 | O1348: 8 | P1348: 10 | Q1348: =(O1348*6)+P1348 -> 58 | W1348: WILLIAMSTOWN | X1348: 11 | Y1348: 6 | Z1348: 0 | AA1348: 1657 | AB1348: 1625 | AC1348: =(AA1348/AB1348)*100 -> 101.96923076923076 | AD1348: =(X1348*4)+(Z1348*2) -> 44
A1349: BEST PLAYERS | W1349: WERRIBEE | X1349: 10 | Y1349: 6 | Z1349: 1 | AA1349: 1886 | AB1349: 1548 | AC1349: =(AA1349/AB1349)*100 -> 121.83462532299743 | AD1349: =(X1349*4)+(Z1349*2) -> 42
A1350: NORTH BALLARAT | C1350: FIELD | E1350: J POLKINGHORNE | I1350: INKSTER | L1350: POWER | O1350: MOLONEY | R1350: LUBEEK | W1350: SPRINGVALE | X1350: 10 | Y1350: 6 | Z1350: 1 | AA1350: 1472 | AB1350: 1421 | AC1350: =(AA1350/AB1350)*100 -> 103.5890218156228 | AD1350: =(X1350*4)+(Z1350*2) -> 42
A1351: SPRINGVALE | C1351: O'BRIEN | E1351: CARROLL | H1351: SHEAHAN | K1351: COURTNEY | N1351: LITTLE | W1351: COLLINGWOOD | X1351: 9 | Y1351: 8 | Z1351: 0 | AA1351: 1586 | AB1351: 1619 | AC1351: =(AA1351/AB1351)*100 -> 97.961704756022243 | AD1351: =(X1351*4)+(Z1351*2) -> 36
A1352: GOALKICKERS | W1352: ESSENDON | X1352: 9 | Y1352: 8 | Z1352: 0 | AA1352: 1501 | AB1352: 1616 | AC1352: =(AA1352/AB1352)*100 -> 92.883663366336634 | AD1352: =(X1352*4)+(Z1352*2) -> 36
A1353: NORTH BALLARAT | C1353: BAKER 3 | F1353: INKSTER 2 | I1353: POWER | K1353: CLAYTON | M1353: RYALL | O1353: JURICA | Q1353: EDWARDS | S1353: JOLLY | W1353: FRANKSTON | X1353: 7 | Y1353: 9 | Z1353: 1 | AA1353: 1708 | AB1353: 1790 | AC1353: =(AA1353/AB1353)*100 -> 95.418994413407816 | AD1353: =(X1353*4)+(Z1353*2) -> 30
A1354: SPRINGVALE | C1354: SMITH 2 | F1354: IRISH 2 | I1354: COURTNEY | L1354: LOGAN | N1354: MEYER | P1354: PITT | W1354: PORT MELBOURNE | X1354: 5 | Y1354: 12 | Z1354: 0 | AA1354: 1509 | AB1354: 1646 | AC1354: =(AA1354/AB1354)*100 -> 91.676792223572306 | AD1354: =(X1354*4)+(Z1354*2) -> 20
W1355: MURRAY KANGAROOS | X1355: 5 | Y1355: 12 | Z1355: 0 | AA1355: 1463 | AB1355: 1669 | AC1355: =(AA1355/AB1355)*100 -> 87.657279808268427 | AD1355: =(X1355*4)+(Z1355*2) -> 20
A1356: WILLIAMSTOWN | C1356: 4 | D1356: 7 | E1356: =(C1356*6)+D1356 -> 31 | G1356: 8 | H1356: 10 | I1356: =(G1356*6)+H1356 -> 58 | K1356: 12 | L1356: 14 | M1356: =(K1356*6)+L1356 -> 86 | O1356: 16 | P1356: 18 | Q1356: =(O1356*6)+P1356 -> 114 | S1356: Venue: PORT MELBOURNE | W1356: PRESTON | X1356: 4 | Y1356: 13 | Z1356: 0 | AA1356: 1377 | AB1356: 1975 | AC1356: =(AA1356/AB1356)*100 -> 69.721518987341767 | AD1356: =(X1356*4)+(Z1356*2) -> 16
A1357: PORT MELBOURNE | C1357: 4 | D1357: 0 | E1357: =(C1357*6)+D1357 -> 24 | G1357: 8 | H1357: 7 | I1357: =(G1357*6)+H1357 -> 55 | K1357: 10 | L1357: 12 | M1357: =(K1357*6)+L1357 -> 72 | O1357: 14 | P1357: 18 | Q1357: =(O1357*6)+P1357 -> 102 | W1357: RICHMOND | X1357: 2 | Y1357: 14 | Z1357: 1 | AA1357: 1282 | AB1357: 1949 | AC1357: =(AA1357/AB1357)*100 -> 65.777321703437664 | AD1357: =(X1357*4)+(Z1357*2) -> 10
A1358: BEST PLAYERS | W1358: COBURG | X1358: 2 | Y1358: 15 | Z1358: 0 | AA1358: 1290 | AB1358: 1622 | AC1358: =(AA1358/AB1358)*100 -> 79.531442663378556 | AD1358: =(X1358*4)+(Z1358*2) -> 8
A1359: WILLIAMSTOWN | C1359: HOLLOW | F1359: MACRI | I1359: KOLYNIUK | L1359: TAYLOR | N1359: CAPE | Q1359: LLOYD | W1359: BENDIGO | X1359: 1 | Y1359: 16 | Z1359: 0 | AA1359: 1227 | AB1359: 2132 | AC1359: =(AA1359/AB1359)*100 -> 57.551594746716695 | AD1359: =(X1359*4)+(Z1359*2) -> 4
A1360: PORT MELBOURNE | C1360: SWAN | F1360: CROW | I1360: ROSE | L1360: DOYLE | N1360: GOODALE | Q1360: LEVAVOUX
A1361: GOALKICKERS | C1361: * | F1361: (3 GOALS SHORT) | P1361: TAYLOR
A1362: WILLIAMSTOWN | C1362: KOLYNIUK 4 | F1362: ROUND 2 | I1362: GHAZI 2 | K1362: BOWDEN | M1362: PLUNKETT | O1362: SMOKER | Q1362: DONALDSON
A1363: PORT MELBOURNE | C1363: CROWE 2 | E1363: MATTHEWS-HERALD 2 | J1363: SWAN 2 | L1363: O'CONNOR | N1363: DOYLE | P1363: ELLIOTT | R1363: TRAIL | T1363: NAISH
O1364: O'KEEFE | Q1364: BOSSONG | S1364: McMAHON
A1365: COLLINGWOOD | C1365: 1 | D1365: 3 | E1365: =(C1365*6)+D1365 -> 9 | G1365: 8 | H1365: 5 | I1365: =(G1365*6)+H1365 -> 53 | K1365: 10 | L1365: 8 | M1365: =(K1365*6)+L1365 -> 68 | O1365: 13 | P1365: 9 | Q1365: =(O1365*6)+P1365 -> 87 | S1365: Venue: VICTORIA PARK (Preston home game)
A1366: PRESTON | C1366: 1 | D1366: 8 | E1366: =(C1366*6)+D1366 -> 14 | G1366: 5 | H1366: 10 | I1366: =(G1366*6)+H1366 -> 40 | K1366: 7 | L1366: 12 | M1366: =(K1366*6)+L1366 -> 54 | O1366: 10 | P1366: 14 | Q1366: =(O1366*6)+P1366 -> 74
A1367: BEST PLAYERS
A1368: COLLINGWOOD | C1368: LYON | F1368: GRAY | I1368: ANSTEY | L1368: MARTELLO | N1368: WASLEY | Q1368: WATSON
A1369: PRESTON | C1369: CLARKE | F1369: CARACELLA | I1369: V EVANS | L1369: GROSSMAN | N1369: CANN
A1370: GOALKICKERS
A1371: COLLINGWOOD | C1371: SMITH 2 | E1371: TOOVEY 2 | G1371: GEORGE 2 | J1371: MARTELLO 2 | M1371: SHAW | O1371: GRAY | Q1371: ANSTEY | S1371: WATSON | V1371: WASLEY
A1372: PRESTON | C1372: HILL 3 | F1372: CANN | H1372: SCANLON | J1372: V EVANS | L1372: WEBBER | N1372: CLARKE | P1372: BAILEY | R1372: MANN
D1373: 16TH JULY | J1373: WEATHER
A1374: BENDIGO | C1374: 3 | D1374: 4 | E1374: =(C1374*6)+D1374 -> 22 | G1374: 6 | H1374: 7 | I1374: =(G1374*6)+H1374 -> 43 | K1374: 8 | L1374: 10 | M1374: =(K1374*6)+L1374 -> 58 | O1374: 14 | P1374: 13 | Q1374: =(O1374*6)+P1374 -> 97 | S1374: Venue: BENDIGO
A1375: MURRAY KANGAROOS | C1375: 1 | D1375: 5 | E1375: =(C1375*6)+D1375 -> 11 | G1375: 5 | H1375: 9 | I1375: =(G1375*6)+H1375 -> 39 | K1375: 10 | L1375: 15 | M1375: =(K1375*6)+L1375 -> 75 | O1375: 12 | P1375: 19 | Q1375: =(O1375*6)+P1375 -> 91
A1376: BEST PLAYERS
A1377: BENDIGO | C1377: CARTER | F1377: O'CALLAGHAN | I1377: WHITSED | L1377: ANGOVE | N1377: SCHMIDT | Q1377: KEOWN
A1378: MURRAY KANGAROOS | C1378: WOODLEY | F1378: WATT | I1378: LASSCOCK | L1378: HAY | N1378: YOUNIE
A1379: GOALKICKERS
A1380: BENDIGO | C1380: BOWER 4 | E1380: O'CALLAGHAN 2 | I1380: PROWSE 2 | L1380: CARETER | N1380: DILLON | P1380: O'TOOLE | R1380: TIERNEY | T1380: WALSH | W1380: WHITSED
A1381: MURRAY KANGAROOS | C1381: YOUNIE 5 | F1381: SPAULL 2 | I1381: ABLETT | K1381: ANDERSON | N1381: PAGAN | P1381: CALTHORPE | S1381: BOVALINO
A1383: ESSENDON | C1383: 2 | D1383: 3 | E1383: =(C1383*6)+D1383 -> 15 | G1383: 6 | H1383: 4 | I1383: =(G1383*6)+H1383 -> 40 | K1383: 11 | L1383: 6 | M1383: =(K1383*6)+L1383 -> 72 | O1383: 14 | P1383: 7 | Q1383: =(O1383*6)+P1383 -> 91 | S1383: Venue: WINDY HILL
A1384: COBURG | C1384: 4 | D1384: 3 | E1384: =(C1384*6)+D1384 -> 27 | G1384: 5 | H1384: 5 | I1384: =(G1384*6)+H1384 -> 35 | K1384: 6 | L1384: 8 | M1384: =(K1384*6)+L1384 -> 44 | O1384: 8 | P1384: 11 | Q1384: =(O1384*6)+P1384 -> 59
A1385: BEST PLAYERS
A1386: ESSENDON | C1386: JACOBS | F1386: PRIOR | I1386: BERBAKOV | L1386: McGRATH | N1386: FRASER
A1387: COBURG | C1387: LAPPIN | F1387: RYAN | I1387: HAOUCHER | L1387: O'CONNOR | N1387: DEPASQUALE | Q1387: TORTORA
A1388: GOALKICKERS
A1389: ESSENDON | C1389: EASTAUGH 3 | F1389: HILLE 2 | H1389: SHEPPARD 2 | K1389: PEVERILL 2 | N1389: McALISTER | Q1389: JACOBS | S1389: WHITTLE | V1389: BERBAKOV | X1389: ROBRAN
A1390: COBURG | C1390: OPPENLANDER 3 | G1390: O'CONNOR 3 | J1390: POTTER | L1390: WILLOUGHBY
A1392: BOX HILL | C1392: 5 | D1392: 2 | E1392: =(C1392*6)+D1392 -> 32 | G1392: 7 | H1392: 5 | I1392: =(G1392*6)+H1392 -> 47 | K1392: 12 | L1392: 9 | M1392: =(K1392*6)+L1392 -> 81 | O1392: 18 | P1392: 19 | Q1392: =(O1392*6)+P1392 -> 127 | S1392: Venue: FRANKSTON
A1393: FRANKSTON | C1393: 3 | D1393: 1 | E1393: =(C1393*6)+D1393 -> 19 | G1393: 9 | H1393: 2 | I1393: =(G1393*6)+H1393 -> 56 | K1393: 9 | L1393: 5 | M1393: =(K1393*6)+L1393 -> 59 | O1393: 9 | P1393: 5 | Q1393: =(O1393*6)+P1393 -> 59
A1394: BEST PLAYERS
A1395: BOX HILL | C1395: BATEMAN | F1395: McPHARLIN | I1395: NICHOLLS | L1395: TRELEVEN | N1395: COLLICA | Q1395: LOATS
A1396: FRANKSTON | C1396: MALLOY | F1396: GEORGIO | I1396: ROBERTS | L1396: DAFF
A1397: GOALKICKERS
A1398: BOX HILL | C1398: McPHARLIN 5 | F1398: LOATS 3 | I1398: COX 2 | K1398: HABERFIELD 2 | N1398: O'FARRELL 2 | Q1398: BATEMAN 2 | T1398: HARTIN | W1398: YOUNG
A1399: FRANKSTON | C1399: WILLIAMS 2 | F1399: BURNELL 2 | I1399: McCORMACK | L1399: LAWRENCE | N1399: SULLIVAN | Q1399: CUNNINGHAM | T1399: DAN CLARK
A1401: SANDRINGHAM | C1401: 2 | D1401: 6 | E1401: =(C1401*6)+D1401 -> 18 | G1401: 9 | H1401: 9 | I1401: =(G1401*6)+H1401 -> 63 | K1401: 11 | L1401: 13 | M1401: =(K1401*6)+L1401 -> 79 | O1401: 18 | P1401: 14 | Q1401: =(O1401*6)+P1401 -> 122 | S1401: Venue: BEACH ROAD
A1402: CARLTON | C1402: 5 | D1402: 1 | E1402: =(C1402*6)+D1402 -> 31 | G1402: 6 | H1402: 3 | I1402: =(G1402*6)+H1402 -> 39 | K1402: 9 | L1402: 6 | M1402: =(K1402*6)+L1402 -> 60 | O1402: 12 | P1402: 10 | Q1402: =(O1402*6)+P1402 -> 82
A1403: BEST PLAYERS
A1404: SANDRINGHAM | C1404: WARD | F1404: GODFREY | I1404: LIDDELL | L1404: SHANAHAN | O1404: KENNEDY | R1404: McKELLAR
A1405: CARLTON | C1405: PRENDERGAST | F1405: DOERING | I1405: MURPHY | L1405: DELULIO
A1406: GOALKICKERS | U1406: SEECAMP
A1407: SANDRINGHAM | C1407: SAUTNER 3 | F1407: SCOTT-BRANAGAN 3 | J1407: WARD 3 | L1407: TEMPLETON 2 | O1407: BRUCE | Q1407: MALONEY | S1407: KENNEDY | V1407: HAYNES | X1407: GODFREY | AA1407: BROADBRIDGE
A1408: CARLTON | C1408: MERRINGTON 2 | F1408: DOERING 2 | I1408: VANCE 2 | K1408: BACKWELL | N1408: MURPHY | P1408: PRENDERGAST | S1408: WHITE | U1408: DELULIO | X1408: PASSADOR
D1409: 17TH JULY | H1409: NIGHT MATCH | K1409: WEATHER
A1410: ST KILDA | C1410: 6 | D1410: 2 | E1410: =(C1410*6)+D1410 -> 38 | G1410: 10 | H1410: 2 | I1410: =(G1410*6)+H1410 -> 62 | K1410: 15 | L1410: 2 | M1410: =(K1410*6)+L1410 -> 92 | O1410: 17 | P1410: 3 | Q1410: =(O1410*6)+P1410 -> 105 | S1410: Venue: WAVERLEY
A1411: RICHMOND | C1411: 1 | D1411: 1 | E1411: =(C1411*6)+D1411 -> 7 | G1411: 1 | H1411: 4 | I1411: =(G1411*6)+H1411 -> 10 | K1411: 9 | L1411: 4 | M1411: =(K1411*6)+L1411 -> 58 | O1411: 9 | P1411: 6 | Q1411: =(O1411*6)+P1411 -> 60
A1412: BEST PLAYERS
A1413: ST KILDA | C1413: WALTON | F1413: HEATLEY | I1413: PLAPP | L1413: PITTS | O1413: YOUNG | R1413: TRAINIDIS
A1414: RICHMOND | C1414: ZANTUCK | F1414: SAMPSON | I1414: STEINFORT | L1414: ARTHURSON | O1414: DIMMATINA | R1414: M EDWARDS
A1415: GOALKICKERS
A1416: ST KILDA | C1416: WALTON 4 | F1416: TRIANIDIS 3 | I1416: WULF 3 | K1416: SCHWARZE 2 | N1416: MILNE | P1416: MITCHELL | S1416: MONKHURST | W1416: KEILY | X1416: ELLIOTT
A1417: RICHMOND | C1417: ZANTUCK 2 | F1417: M EDWARDS 2 | J1417: SAMPSON 2 | M1417: EVANS 2 | O1417: REYNOLDS | Q1417: STEINFORT | T1417: HART | W1417: WHITE
A1419: ROUND 18 | D1419: 21ST JULY | J1419: WEATHER
D1420: 1ST QTR | H1420: 2ND QTR | L1420: 3RD QTR | P1420: FINAL
A1421: CARLTON | C1421: 3 | D1421: 4 | E1421: =(C1421*6)+D1421 -> 22 | G1421: 8 | H1421: 5 | I1421: =(G1421*6)+H1421 -> 53 | K1421: 12 | L1421: 8 | M1421: =(K1421*6)+L1421 -> 80 | O1421: 15 | P1421: 13 | Q1421: =(O1421*6)+P1421 -> 103 | S1421: Venue: M.C.G. (C/R) | Y1421: LADDER | AB1421: ROUND | AD1421: 18
A1422: ESSENDON | C1422: 2 | D1422: 2 | E1422: =(C1422*6)+D1422 -> 14 | G1422: 4 | H1422: 5 | I1422: =(G1422*6)+H1422 -> 29 | K1422: 7 | L1422: 6 | M1422: =(K1422*6)+L1422 -> 48 | O1422: 12 | P1422: 8 | Q1422: =(O1422*6)+P1422 -> 80
A1423: BEST PLAYERS | W1423: TEAM | X1423: W | Y1423: L | Z1423: D | AA1423: FOR | AB1423: AGST | AC1423: % | AD1423: PTS
A1424: CARLTON | C1424: MASSIE | F1424: BACKWELL | I1424: MURPHY | L1424: CHATFIELD | O1424: DUKES | Q1424: FEVOLA
A1425: ESSENDON | C1425: McGRATH | F1425: HILLE | I1425: EASTAUGH | L1425: SWITALA | O1425: JOHNSON | Q1425: PRIOR | W1425: SANDRINGHAM | X1425: 15 | Y1425: 3 | Z1425: 0 | AA1425: 2007 | AB1425: 1376 | AC1425: =(AA1425/AB1425)*100 -> 145.85755813953489 | AD1425: =(X1425*4)+(Z1425*2) -> 60
A1426: GOALKICKERS | Q1426: CARROLL | W1426: ST KILDA | X1426: 13 | Y1426: 5 | Z1426: 0 | AA1426: 1945 | AB1426: 1449 | AC1426: =(AA1426/AB1426)*100 -> 134.23050379572118 | AD1426: =(X1426*4)+(Z1426*2) -> 52
A1427: CARLTON | C1427: FEVOLA 4 | E1427: DUKES 3 | G1427: MURPHY 2 | I1427: VANCE | K1427: PRENDERGAST | N1427: KELLY | P1427: DOERING | R1427: PASSADOR | W1427: NORTH BALLARAT | X1427: 13 | Y1427: 5 | Z1427: 0 | AA1427: 1588 | AB1427: 1212 | AC1427: =(AA1427/AB1427)*100 -> 131.02310231023102 | AD1427: =(X1427*4)+(Z1427*2) -> 52
A1428: ESSENDON | C1428: EASTAUGH 4 | F1428: SWITALA 2 | I1428: SHEPPARD | K1428: CRANAGE | M1428: FERNEE | O1428: PRIOR | Q1428: JOHNSON | S1428: GODDARD | W1428: CARLTON | X1428: 13 | Y1428: 5 | Z1428: 0 | AA1428: 1942 | AB1428: 1604 | AC1428: =(AA1428/AB1428)*100 -> 121.07231920199501 | AD1428: =(X1428*4)+(Z1428*2) -> 52
D1429: 22ND JULY | J1429: WEATHER | W1429: GEELONG | X1429: 13 | Y1429: 5 | Z1429: 0 | AA1429: 1916 | AB1429: 1593 | AC1429: =(AA1429/AB1429)*100 -> 120.27620841180162 | AD1429: =(X1429*4)+(Z1429*2) -> 52
A1430: SPRINGVALE | C1430: 5 | D1430: 3 | E1430: =(C1430*6)+D1430 -> 33 | G1430: 6 | H1430: 3 | I1430: =(G1430*6)+H1430 -> 39 | K1430: 10 | L1430: 7 | M1430: =(K1430*6)+L1430 -> 67 | O1430: 13 | P1430: 7 | Q1430: =(O1430*6)+P1430 -> 85 | S1430: Venue: WAVERLEY | W1430: BOX HILL | X1430: 13 | Y1430: 5 | Z1430: 0 | AA1430: 1807 | AB1430: 1517 | AC1430: =(AA1430/AB1430)*100 -> 119.11667765326301 | AD1430: =(X1430*4)+(Z1430*2) -> 52
A1431: SANDRINGHAM | C1431: 3 | D1431: 2 | E1431: =(C1431*6)+D1431 -> 20 | G1431: 7 | H1431: 7 | I1431: =(G1431*6)+H1431 -> 49 | K1431: 8 | L1431: 8 | M1431: =(K1431*6)+L1431 -> 56 | O1431: 8 | P1431: 10 | Q1431: =(O1431*6)+P1431 -> 58 | W1431: WILLIAMSTOWN | X1431: 12 | Y1431: 6 | Z1431: 0 | AA1431: 1777 | AB1431: 1680 | AC1431: =(AA1431/AB1431)*100 -> 105.77380952380952 | AD1431: =(X1431*4)+(Z1431*2) -> 48
A1432: BEST PLAYERS | W1432: SPRINGVALE | X1432: 11 | Y1432: 6 | Z1432: 1 | AA1432: 1557 | AB1432: 1479 | AC1432: =(AA1432/AB1432)*100 -> 105.2738336713996 | AD1432: =(X1432*4)+(Z1432*2) -> 46
A1433: SPRINGVALE | C1433: HARRISON | F1433: RIGG | I1433: SHEAHAN | L1433: LITTLE | O1433: PITT | Q1433: IRISH
A1434: SANDRINGHAM | C1434: MALONEY | F1434: HOPGOOD | I1434: LIDDELL | L1434: SHANAHAN | O1434: HAYNES | Q1434: PITT | W1434: WERRIBEE | X1434: 10 | Y1434: 7 | Z1434: 1 | AA1434: 1940 | AB1434: 1728 | AC1434: =(AA1434/AB1434)*100 -> 112.2685185185185 | AD1434: =(X1434*4)+(Z1434*2) -> 42
A1435: GOALKICKERS | W1435: COLLINGWOOD | X1435: 9 | Y1435: 9 | Z1435: 0 | AA1435: 1641 | AB1435: 1724 | AC1435: =(AA1435/AB1435)*100 -> 95.185614849187942 | AD1435: =(X1435*4)+(Z1435*2) -> 36
A1436: SPRINGVALE | C1436: SMITH 4 | F1436: IRISH 2 | I1436: MEYER 2 | K1436: PITT 2 | M1436: HARRISON | O1436: LOGAN | Q1436: O'BRIEN | W1436: ESSENDON | X1436: 9 | Y1436: 9 | Z1436: 0 | AA1436: 1581 | AB1436: 1719 | AC1436: =(AA1436/AB1436)*100 -> 91.972076788830719 | AD1436: =(X1436*4)+(Z1436*2) -> 36
A1437: SANDRINGHAM | C1437: TEMPLETON 2 | F1437: GRGIC | H1437: HAYNES | J1437: HOPGOOD | M1437: PITT | N1437: SHANAHAN | Q1437: SAUTNER | W1437: FRANKSTON | X1437: 8 | Y1437: 9 | Z1437: 1 | AA1437: 1839 | AB1437: 1832 | AC1437: =(AA1437/AB1437)*100 -> 100.38209606986899 | AD1437: =(X1437*4)+(Z1437*2) -> 34
W1438: PORT MELBOURNE | X1438: 6 | Y1438: 12 | Z1438: 0 | AA1438: 1689 | AB1438: 1700 | AC1438: =(AA1438/AB1438)*100 -> 99.352941176470594 | AD1438: =(X1438*4)+(Z1438*2) -> 24
A1439: PORT MELBOURNE | C1439: 5 | D1439: 10 | E1439: =(C1439*6)+D1439 -> 40 | G1439: 9 | H1439: 15 | I1439: =(G1439*6)+H1439 -> 69 | K1439: 17 | L1439: 19 | M1439: =(K1439*6)+L1439 -> 121 | O1439: 26 | P1439: 24 | Q1439: =(O1439*6)+P1439 -> 180 | S1439: Venue: WERRIBEE | W1439: MURRAY KANGAROOS | X1439: 5 | Y1439: 13 | Z1439: 0 | AA1439: 1502 | AB1439: 1749 | AC1439: =(AA1439/AB1439)*100 -> 85.877644368210397 | AD1439: =(X1439*4)+(Z1439*2) -> 20
A1440: WERRIBEE | C1440: 3 | D1440: 2 | E1440: =(C1440*6)+D1440 -> 20 | G1440: 6 | H1440: 3 | I1440: =(G1440*6)+H1440 -> 39 | K1440: 8 | L1440: 4 | M1440: =(K1440*6)+L1440 -> 52 | O1440: 8 | P1440: 6 | Q1440: =(O1440*6)+P1440 -> 54 | W1440: PRESTON | X1440: 4 | Y1440: 14 | Z1440: 0 | AA1440: 1432 | AB1440: 2095 | AC1440: =(AA1440/AB1440)*100 -> 68.353221957040574 | AD1440: =(X1440*4)+(Z1440*2) -> 16
A1441: BEST PLAYERS | W1441: RICHMOND | X1441: 3 | Y1441: 14 | Z1441: 1 | AA1441: 1400 | AB1441: 2006 | AC1441: =(AA1441/AB1441)*100 -> 69.790628115653035 | AD1441: =(X1441*4)+(Z1441*2) -> 14
A1442: PORT MELBOURNE | C1442: BENNETT | F1442: STEVENS | I1442: TOMSIC | L1442: ROSE | N1442: DIGUVINE | Q1442: KIRK | W1442: COBURG | X1442: 3 | Y1442: 15 | Z1442: 0 | AA1442: 1370 | AB1442: 1661 | AC1442: =(AA1442/AB1442)*100 -> 82.480433473810962 | AD1442: =(X1442*4)+(Z1442*2) -> 12
A1443: WERRIBEE | C1443: ATKINS | F1443: BUTTON | I1443: HARGREAVES | L1443: ALVEY | W1443: BENDIGO | X1443: 1 | Y1443: 17 | Z1443: 0 | AA1443: 1284 | AB1443: 2250 | AC1443: =(AA1443/AB1443)*100 -> 57.066666666666663 | AD1443: =(X1443*4)+(Z1443*2) -> 4
A1444: GOALKICKERS | H1444: KIRK | J1444: BOSSONG | L1444: ARNOLD | N1444: ROSE | P1444: HILLS | R1444: ELLIOTT
A1445: PORT MELBOURNE | C1445: SWAN 6 | E1445: STEVENS 4 | G1445: BENNETT 4 | J1445: FIXTER 2 | M1445: GOODALE 2 | P1445: CROWE | R1445: McCORMICK
A1446: WERRIBEE | C1446: MITCHELL 3 | F1446: WIGGINS 2 | I1446: SAUNDERS | L1446: SATTERLEY | O1446: ALVEY
D1447: 23RD JULY | J1447: WEATHER
A1448: RICHMOND | C1448: 3 | D1448: 3 | E1448: =(C1448*6)+D1448 -> 21 | G1448: 5 | H1448: 4 | I1448: =(G1448*6)+H1448 -> 34 | K1448: 9 | L1448: 6 | M1448: =(K1448*6)+L1448 -> 60 | O1448: 18 | P1448: 10 | Q1448: =(O1448*6)+P1448 -> 118 | S1448: Venue: M.C.G. (C/R)
A1449: BENDIGO | C1449: 2 | D1449: 1 | E1449: =(C1449*6)+D1449 -> 13 | G1449: 5 | H1449: 3 | I1449: =(G1449*6)+H1449 -> 33 | K1449: 5 | L1449: 8 | M1449: =(K1449*6)+L1449 -> 38 | O1449: 8 | P1449: 9 | Q1449: =(O1449*6)+P1449 -> 57
A1450: BEST PLAYERS
A1451: RICHMOND | C1451: T EDWARDS | F1451: STEINFORT | I1451: DEAN | L1451: ARTHURSON | O1451: M EDWARDS | R1451: BENNETT
A1452: BENDIGO | C1452: SUTHERLAND | F1452: WHITSED | I1452: O'CALLAGHAN | L1452: ANGOVE | O1452: CONNAUGHTON
A1453: GOALKICKERS
A1454: RICHMOND | C1454: HOLCOMBE 4 | F1454: BRADSHAW 3 | I1454: POWELL 2 | K1454: WHITE 2 | M1454: SAMPSON 2 | P1454: M EDWARDS 2 | S1454: EVANS | U1454: DEAN | W1454: PROCTOR
A1455: BENDIGO | C1455: BOWER 2 | F1455: PROWSE 2 | I1455: CARTER | K1455: BROCK SHIELS | N1455: SCHMIDT | Q1455: WALSH
A1457: FRANKSTON | C1457: 2 | D1457: 4 | E1457: =(C1457*6)+D1457 -> 16 | G1457: 9 | H1457: 5 | I1457: =(G1457*6)+H1457 -> 59 | K1457: 10 | L1457: 7 | M1457: =(K1457*6)+L1457 -> 67 | O1457: 20 | P1457: 11 | Q1457: =(O1457*6)+P1457 -> 131 | S1457: Venue: SHELL STADIUM
A1458: GEELONG | C1458: 3 | D1458: 2 | E1458: =(C1458*6)+D1458 -> 20 | G1458: 4 | H1458: 3 | I1458: =(G1458*6)+H1458 -> 27 | K1458: 5 | L1458: 11 | M1458: =(K1458*6)+L1458 -> 41 | O1458: 5 | P1458: 12 | Q1458: =(O1458*6)+P1458 -> 42
A1459: BEST PLAYERS
A1460: FRANKSTON | C1460: MALLOY | F1460: GEORGIOU | I1460: DAFF | K1460: BURGMAN | N1460: HOSE | Q1460: SULLIVAN
A1461: GEELONG | C1461: HAY | F1461: McKAY | I1461: CORRIGAN | K1461: ENRIGHT
A1462: GOALKICKERS
A1463: FRANKSTON | C1463: WILLIAMS 5 | F1463: McCORMACK 4 | J1463: D CLARKE 3 | M1463: SMITH 2 | O1463: SULLIVAN 2 | R1463: FERRARO 2 | U1463: HOSE | W1463: BURNELL
A1464: GEELONG | C1464: HAY 2 | F1464: HARDING | I1464: O'BRIEN | K1464: WILKINSON
A1466: COBURG | C1466: 1 | D1466: 0 | E1466: =(C1466*6)+D1466 -> 6 | G1466: 4 | H1466: 5 | I1466: =(G1466*6)+H1466 -> 29 | K1466: 4 | L1466: 6 | M1466: =(K1466*6)+L1466 -> 30 | O1466: 11 | P1466: 14 | Q1466: =(O1466*6)+P1466 -> 80 | S1466: Venue: LAVINGTON
A1467: MURRAY KANGAROOS | C1467: 2 | D1467: 0 | E1467: =(C1467*6)+D1467 -> 12 | G1467: 2 | H1467: 0 | I1467: =(G1467*6)+H1467 -> 12 | K1467: 6 | L1467: 2 | M1467: =(K1467*6)+L1467 -> 38 | O1467: 6 | P1467: 3 | Q1467: =(O1467*6)+P1467 -> 39
A1468: BEST PLAYERS
A1469: COBURG | C1469: McKENZIE-McHARG | G1469: LAPPIN | J1469: DEPASQUALE | M1469: POTTER | P1469: HAOUCHER | R1469: McLEOD
A1470: MURRAY KANGAROOS | C1470: CHANDLER | G1470: WOODLEY | J1470: YOUNIE | M1470: CALTHORPE
A1471: GOALKICKERS
A1472: COBURG | C1472: POTTER 3 | F1472: O'CONNOR 2 | I1472: HAOUCHER 2 | L1472: SHEATHER | N1472: CONDON | P1472: T LITTLE | R1472: WILLOUGHBY
A1473: MURRAY KANGAROOS | C1473: LOWTHER 2 | F1473: MOTLOP | I1473: WOODLEY | K1473: KINGSLEY | N1473: PAGAN
A1475: WILLIAMSTOWN | C1475: 1 | D1475: 1 | E1475: =(C1475*6)+D1475 -> 7 | G1475: 5 | H1475: 6 | I1475: =(G1475*6)+H1475 -> 36 | K1475: 9 | L1475: 8 | M1475: =(K1475*6)+L1475 -> 62 | O1475: 17 | P1475: 18 | Q1475: =(O1475*6)+P1475 -> 120 | S1475: Venue: WILLIAMSTOWN
A1476: PRESTON | C1476: 4 | D1476: 6 | E1476: =(C1476*6)+D1476 -> 30 | G1476: 4 | H1476: 9 | I1476: =(G1476*6)+H1476 -> 33 | K1476: 7 | L1476: 12 | M1476: =(K1476*6)+L1476 -> 54 | O1476: 7 | P1476: 13 | Q1476: =(O1476*6)+P1476 -> 55
A1477: BEST PLAYERS
A1478: WILLIAMSTOWN | C1478: LLOYD | F1478: GHAZI | I1478: M WEST | L1478: SMOKER | O1478: MACRI | Q1478: T WEST
A1479: PRESTON | C1479: BLIGHT | F1479: WEBBER | I1479: HABERMAN | L1479: GROSSMAN | O1479: CLARKE
A1480: GOALKICKERS
A1481: WILLIAMSTOWN | C1481: MAHONEY 3 | F1481: TAYLOR 2 | I1481: PLUNKETT 2 | L1481: MACRI 2 | N1481: BROWN 2 | Q1481: GIANSIRACUSA 2 | U1481: GHAZI | W1481: ANDERSON | X1481: CHRISTOFORO | AB1481: BOWDEN
A1482: PRESTON | C1482: FAVRIN 2 | F1482: CANN | H1482: SCANLON | J1482: D EVANS | M1482: CLARKE | O1482: CHAMBERS
A1484: BOX HILL | C1484: 6 | D1484: 2 | E1484: =(C1484*6)+D1484 -> 38 | G1484: 7 | H1484: 3 | I1484: =(G1484*6)+H1484 -> 45 | K1484: 11 | L1484: 7 | M1484: =(K1484*6)+L1484 -> 73 | O1484: 13 | P1484: 10 | Q1484: =(O1484*6)+P1484 -> 88 | S1484: Venue: BOX HILL
A1485: ST KILDA | C1485: 1 | D1485: 3 | E1485: =(C1485*6)+D1485 -> 9 | G1485: 3 | H1485: 6 | I1485: =(G1485*6)+H1485 -> 24 | K1485: 5 | L1485: 8 | M1485: =(K1485*6)+L1485 -> 38 | O1485: 9 | P1485: 12 | Q1485: =(O1485*6)+P1485 -> 66
A1486: BEST PLAYERS
A1487: BOX HILL | C1487: JOHNSON | F1487: TRELEVEN | I1487: YOUNG | L1487: TAYLOR | O1487: BREWER | R1487: LEKKAS
A1488: ST KILDA | C1488: RYAN | F1488: HEATLEY | I1488: WALTON | L1488: PITTS | O1488: YOUNG
A1489: GOALKICKERS
A1490: BOX HILL | C1490: COX 3 | E1490: CHAPMAN 3 | H1490: MANN 2 | J1490: TAYLOR | L1490: JOHNSON | N1490: LEKKAS | P1490: NICHOLLS | R1490: VANDENBERG
A1491: ST KILDA | C1491: DAVIS 2 | F1491: HEATLEY 2 | I1491: WULF | J1491: WALTON | M1491: CAMPBELL | O1491: TRAND | Q1491: TRIANIDIS
D1492: 24TH JULY | H1492: NIGHT MATCH | K1492: WEATHER
A1493: NORTH BALLARAT | C1493: 3 | D1493: 4 | E1493: =(C1493*6)+D1493 -> 22 | G1493: 5 | H1493: 8 | I1493: =(G1493*6)+H1493 -> 38 | K1493: 9 | L1493: 11 | M1493: =(K1493*6)+L1493 -> 65 | O1493: 15 | P1493: 15 | Q1493: =(O1493*6)+P1493 -> 105 | S1493: Venue: WAVERLEY (Collingwood home game)
A1494: COLLINGWOOD | C1494: 3 | D1494: 1 | E1494: =(C1494*6)+D1494 -> 19 | G1494: 3 | H1494: 2 | I1494: =(G1494*6)+H1494 -> 20 | K1494: 5 | L1494: 5 | M1494: =(K1494*6)+L1494 -> 35 | O1494: 8 | P1494: 7 | Q1494: =(O1494*6)+P1494 -> 55
A1495: BEST PLAYERS
A1496: NORTH BALLARAT | C1496: POWER | F1496: MOLONEY | I1496: CLAYTON | L1496: McCORKELL | O1496: FUNCKE | Q1496: GREIG
A1497: COLLINGWOOD | C1497: WATSON | F1497: HAWKING | I1497: ROACH | L1497: GEORGE | O1497: SMITH | Q1497: WASLEY
A1498: GOALKICKERS
A1499: NORTH BALLARAT | C1499: CLAYTON 2 | F1499: EDWARDS 2 | I1499: GREIG 2 | K1499: CLARKE 2 | M1499: JURICA | O1499: POWER | Q1499: FIELD | R1499: RYALL | T1499: BAKER | W1499: FUNCKE | X1499: MAHER
A1500: COLLINGWOOD | C1500: GRAY 2 | F1500: McKEE | H1500: ROCCA | J1500: SHARPEN | L1500: ROACH | N1500: JAMES | P1500: BRISTOW
A1502: ROUND 19 | D1502: 29TH JULY | J1502: WEATHER
D1503: 1ST QTR | H1503: 2ND QTR | L1503: 3RD QTR | P1503: FINAL
A1504: ST KILDA | C1504: 7 | D1504: 4 | E1504: =(C1504*6)+D1504 -> 46 | G1504: 13 | H1504: 11 | I1504: =(G1504*6)+H1504 -> 89 | K1504: 18 | L1504: 15 | M1504: =(K1504*6)+L1504 -> 123 | O1504: 24 | P1504: 19 | Q1504: =(O1504*6)+P1504 -> 163 | S1504: Venue: MOORABBIN | Y1504: LADDER | AB1504: ROUND | AD1504: 19
A1505: BENDIGO | C1505: 0 | D1505: 2 | E1505: =(C1505*6)+D1505 -> 2 | G1505: 1 | H1505: 3 | I1505: =(G1505*6)+H1505 -> 9 | K1505: 2 | L1505: 5 | M1505: =(K1505*6)+L1505 -> 17 | O1505: 6 | P1505: 6 | Q1505: =(O1505*6)+P1505 -> 42
A1506: BEST PLAYERS | W1506: TEAM | X1506: W | Y1506: L | Z1506: D | AA1506: FOR | AB1506: AGST | AC1506: % | AD1506: PTS
A1507: ST KILDA | C1507: MONKHURST | F1507: HEATLEY | I1507: McLAREN | L1507: ELLIOTT | O1507: DAVIS | R1507: BEETHAM
A1508: BENDIGO | C1508: WHITSED | F1508: CARTER | I1508: WALSH | L1508: PROWSE | O1508: O'CALLAGHAN | R1508: ANGOVE | W1508: SANDRINGHAM | X1508: 16 | Y1508: 3 | Z1508: 0 | AA1508: 2142 | AB1508: 1474 | AC1508: =(AA1508/AB1508)*100 -> 145.31886024423338 | AD1508: =(X1508*4)+(Z1508*2) -> 64
A1509: GOALKICKERS | D1509: WULF 2 | F1509: PITTS | H1509: MILNE | J1509: SCHWARZE | M1509: TRIANIDIS | P1509: BEETHAM | R1509: DAVIS | W1509: ST KILDA | X1509: 14 | Y1509: 5 | Z1509: 0 | AA1509: 2108 | AB1509: 1491 | AC1509: =(AA1509/AB1509)*100 -> 141.38162307176393 | AD1509: =(X1509*4)+(Z1509*2) -> 56
A1510: ST KILDA | C1510: MONKHORST 3 | F1510: HEAZELWOOD 3 | J1510: KIELY 2 | L1510: TRAND 2 | N1510: MITCHELL 2 | Q1510: ELLIOTT 2 | S1510: WOOD 2 | W1510: NORTH BALLARAT | X1510: 14 | Y1510: 5 | Z1510: 0 | AA1510: 1718 | AB1510: 1304 | AC1510: =(AA1510/AB1510)*100 -> 131.74846625766872 | AD1510: =(X1510*4)+(Z1510*2) -> 56
A1511: BENDIGO | C1511: WALSH 2 | F1511: CONNAUGHTON | J1511: DICKSON | L1511: GEDDES | N1511: KEOWN | W1511: CARLTON | X1511: 14 | Y1511: 5 | Z1511: 0 | AA1511: 2079 | AB1511: 1667 | AC1511: =(AA1511/AB1511)*100 -> 124.71505698860229 | AD1511: =(X1511*4)+(Z1511*2) -> 56
W1512: GEELONG | X1512: 13 | Y1512: 6 | Z1512: 0 | AA1512: 2017 | AB1512: 1723 | AC1512: =(AA1512/AB1512)*100 -> 117.0632617527568 | AD1512: =(X1512*4)+(Z1512*2) -> 52
A1513: WILLIAMSTOWN | C1513: 4 | D1513: 0 | E1513: =(C1513*6)+D1513 -> 24 | G1513: 7 | H1513: 4 | I1513: =(G1513*6)+H1513 -> 46 | K1513: 13 | L1513: 13 | M1513: =(K1513*6)+L1513 -> 91 | O1513: 22 | P1513: 15 | Q1513: =(O1513*6)+P1513 -> 147 | S1513: Venue: VICTORIA PARK | W1513: BOX HILL | X1513: 13 | Y1513: 6 | Z1513: 0 | AA1513: 1899 | AB1513: 1647 | AC1513: =(AA1513/AB1513)*100 -> 115.30054644808743 | AD1513: =(X1513*4)+(Z1513*2) -> 52
A1514: COLLINGWOOD | C1514: 3 | D1514: 3 | E1514: =(C1514*6)+D1514 -> 21 | G1514: 6 | H1514: 4 | I1514: =(G1514*6)+H1514 -> 40 | K1514: 6 | L1514: 6 | M1514: =(K1514*6)+L1514 -> 42 | O1514: 9 | P1514: 12 | Q1514: =(O1514*6)+P1514 -> 66 | W1514: WILLIAMSTOWN | X1514: 13 | Y1514: 6 | Z1514: 0 | AA1514: 1924 | AB1514: 1746 | AC1514: =(AA1514/AB1514)*100 -> 110.19473081328752 | AD1514: =(X1514*4)+(Z1514*2) -> 52
A1515: BEST PLAYERS | W1515: SPRINGVALE | X1515: 12 | Y1515: 6 | Z1515: 1 | AA1515: 1648 | AB1515: 1564 | AC1515: =(AA1515/AB1515)*100 -> 105.37084398976981 | AD1515: =(X1515*4)+(Z1515*2) -> 50
A1516: WILLIAMSTOWN | C1516: MAHONEY | F1516: LLOYD | I1516: KING | L1516: PLUNKETT | O1516: M WEST | R1516: MACRI
A1517: COLLINGWOOD | C1517: WATSON | F1517: ORCHARD | I1517: McKEE | L1517: STONE | O1517: PATTERSON | R1517: SHARPEN | W1517: WERRIBEE | X1517: 10 | Y1517: 8 | Z1517: 1 | AA1517: 2025 | AB1517: 1819 | AC1517: =(AA1517/AB1517)*100 -> 111.32490379329303 | AD1517: =(X1517*4)+(Z1517*2) -> 42
A1518: GOALKICKERS | N1518: BOWDEN | P1518: ANDERSON | S1518: CAPE | W1518: ESSENDON | X1518: 10 | Y1518: 9 | Z1518: 0 | AA1518: 1678 | AB1518: 1783 | AC1518: =(AA1518/AB1518)*100 -> 94.111048794167132 | AD1518: =(X1518*4)+(Z1518*2) -> 40
A1519: WILLIAMSTOWN | C1519: SMOKER 5 | F1519: TAYLOR 4 | I1519: LLOYD 3 | K1519: MAHONEY 2 | N1519: CHRISTOFORO 2 | R1519: PLUNKETT 2 | W1519: COLLINGWOOD | X1519: 9 | Y1519: 10 | Z1519: 0 | AA1519: 1707 | AB1519: 1871 | AC1519: =(AA1519/AB1519)*100 -> 91.234633885622657 | AD1519: =(X1519*4)+(Z1519*2) -> 36
A1520: COLLINGWOOD | C1520: WATSON 2 | F1520: PATTERSON | I1520: OBORNE | K1520: BLACK | M1520: JAMES | O1520: TOOVEY | Q1520: ANSTEY | S1520: TUCKEY | W1520: FRANKSTON | X1520: 8 | Y1520: 10 | Z1520: 1 | AA1520: 1903 | AB1520: 1915 | AC1520: =(AA1520/AB1520)*100 -> 99.373368146214105 | AD1520: =(X1520*4)+(Z1520*2) -> 34
W1521: PORT MELBOURNE | X1521: 6 | Y1521: 13 | Z1521: 0 | AA1521: 1787 | AB1521: 1835 | AC1521: =(AA1521/AB1521)*100 -> 97.3841961852861 | AD1521: =(X1521*4)+(Z1521*2) -> 24
A1522: SANDRINGHAM | C1522: 5 | D1522: 6 | E1522: =(C1522*6)+D1522 -> 36 | G1522: 7 | H1522: 9 | I1522: =(G1522*6)+H1522 -> 51 | K1522: 13 | L1522: 12 | M1522: =(K1522*6)+L1522 -> 90 | O1522: 20 | P1522: 15 | Q1522: =(O1522*6)+P1522 -> 135 | S1522: Venue: PORT MELBOURNE | W1522: MURRAY KANGAROOS | X1522: 6 | Y1522: 13 | Z1522: 0 | AA1522: 1632 | AB1522: 1850 | AC1522: =(AA1522/AB1522)*100 -> 88.21621621621621 | AD1522: =(X1522*4)+(Z1522*2) -> 24
A1523: PORT MELBOURNE | C1523: 3 | D1523: 0 | E1523: =(C1523*6)+D1523 -> 18 | G1523: 6 | H1523: 3 | I1523: =(G1523*6)+H1523 -> 39 | K1523: 13 | L1523: 6 | M1523: =(K1523*6)+L1523 -> 84 | O1523: 15 | P1523: 8 | Q1523: =(O1523*6)+P1523 -> 98 | W1523: COBURG | X1523: 4 | Y1523: 15 | Z1523: 0 | AA1523: 1483 | AB1523: 1744 | AC1523: =(AA1523/AB1523)*100 -> 85.034403669724767 | AD1523: =(X1523*4)+(Z1523*2) -> 16
A1524: BEST PLAYERS | W1524: PRESTON | X1524: 4 | Y1524: 15 | Z1524: 0 | AA1524: 1495 | AB1524: 2232 | AC1524: =(AA1524/AB1524)*100 -> 66.980286738351253 | AD1524: =(X1524*4)+(Z1524*2) -> 16
A1525: SANDRINGHAM | C1525: HAYNES | F1525: SAUTNER | I1525: PITT | K1525: GRGIC | N1525: LAMB | Q1525: MACGEORGE | W1525: RICHMOND | X1525: 3 | Y1525: 15 | Z1525: 1 | AA1525: 1483 | AB1525: 2119 | AC1525: =(AA1525/AB1525)*100 -> 69.985842378480413 | AD1525: =(X1525*4)+(Z1525*2) -> 14
A1526: PORT MELBOURNE | C1526: KIRK | F1526: ROSE | I1526: NAISH | K1526: BOLTON | N1526: BOSSONG | Q1526: CROWE | W1526: BENDIGO | X1526: 1 | Y1526: 18 | Z1526: 0 | AA1526: 1326 | AB1526: 2413 | AC1526: =(AA1526/AB1526)*100 -> 54.952341483630342 | AD1526: =(X1526*4)+(Z1526*2) -> 4
A1527: GOALKICKERS
A1528: SANDRINGHAM | C1528: SAUTNER 10 | F1528: HAYNES 4 | I1528: PITT 2 | K1528: GRGIC | M1528: TEMPLETON | P1528: HAYWARD | R1528: GEHLING
A1529: PORT MELBOURNE | C1529: CROWE 4 | F1529: BOLTON 2 | I1529: BENNETT 2 | L1529: KIRK 2 | N1529: FEAST | P1529: GOODALE | R1529: ELLIOTT | U1529: MATTHEWS-HERALD | X1529: NAISH
D1530: 30TH JULY | J1530: WEATHER
A1531: MURRAY KANGAROOS | C1531: 4 | D1531: 2 | E1531: =(C1531*6)+D1531 -> 26 | G1531: 10 | H1531: 5 | I1531: =(G1531*6)+H1531 -> 65 | K1531: 15 | L1531: 8 | M1531: =(K1531*6)+L1531 -> 98 | O1531: 20 | P1531: 10 | Q1531: =(O1531*6)+P1531 -> 130 | S1531: Venue: SHELL STADIUM
A1532: GEELONG | C1532: 4 | D1532: 5 | E1532: =(C1532*6)+D1532 -> 29 | G1532: 7 | H1532: 8 | I1532: =(G1532*6)+H1532 -> 50 | K1532: 11 | L1532: 11 | M1532: =(K1532*6)+L1532 -> 77 | O1532: 15 | P1532: 11 | Q1532: =(O1532*6)+P1532 -> 101
A1533: BEST PLAYERS
A1534: MURRAY KANGAROOS | C1534: WATT | F1534: CHANDLER | I1534: TEAGUE | K1534: LASSCOCK | N1534: KINGSLEY | Q1534: RAWLINGS
A1535: GEELONG | C1535: ARNOTT | F1535: HARDING | I1535: LINDSAY | K1535: T LYNCH | N1535: CHAPMAN | Q1535: STREET
A1536: GOALKICKERS
A1537: MURRAY KANGAROOS | C1537: KINGSLEY 8 | F1537: HEWITT 5 | I1537: SHOLL 2 | K1537: WATT | M1537: LASSCOCK | P1537: CALTHORPE | S1537: SPAULL | V1537: TEAGUE
A1538: GEELONG | C1538: STREET 5 | F1538: HARDING 3 | I1538: CHAPMAN 3 | L1538: ARNOTT | N1538: BYE | P1538: T CLARK | R1538: WILKINSON
A1540: NORTH BALLARAT | C1540: 3 | D1540: 3 | E1540: =(C1540*6)+D1540 -> 21 | G1540: 10 | H1540: 7 | I1540: =(G1540*6)+H1540 -> 67 | K1540: 14 | L1540: 9 | M1540: =(K1540*6)+L1540 -> 93 | O1540: 20 | P1540: 10 | Q1540: =(O1540*6)+P1540 -> 130 | S1540: Venue: BOX HILL
A1541: BOX HILL | C1541: 2 | D1541: 2 | E1541: =(C1541*6)+D1541 -> 14 | G1541: 5 | H1541: 5 | I1541: =(G1541*6)+H1541 -> 35 | K1541: 11 | L1541: 5 | M1541: =(K1541*6)+L1541 -> 71 | O1541: 14 | P1541: 8 | Q1541: =(O1541*6)+P1541 -> 92
A1542: BEST PLAYERS
A1543: NORTH BALLARAT | C1543: POWER | F1543: FUNCKE | I1543: FISHER | L1543: JURICA | O1543: LUNEEK | R1543: GREIG
A1544: BOX HILL | C1544: OBST | F1544: PUGSLEY | I1544: COX | L1544: MANN | O1544: VANDENBERG
A1545: GOALKICKERS
A1546: NORTH BALLARAT | C1546: POWER 4 | E1546: FREELAND 2 | H1546: JOLLY 2 | J1546: T POLKINGHORNE 2 | N1546: CLARKE 2 | Q1546: ? 2 | R1546: JURICA 2 | U1546: FIELD | W1546: CLAYTON | X1546: PEAKE | AA1546: FUNCKE
A1547: BOX HILL | C1547: HAZELL 2 | E1547: HABERFIELD | H1547: RODE | J1547: NICHOLLS | L1547: COX | M1547: PUGSLEY | O1547: LOATS | Q1547: COLLICA | S1547: McPHARLIN | W1547: MANN | X1547: BREWER | AA1547: JENKINS
A1549: COBURG | C1549: 1 | D1549: 1 | E1549: =(C1549*6)+D1549 -> 7 | G1549: 5 | H1549: 5 | I1549: =(G1549*6)+H1549 -> 35 | K1549: 9 | L1549: 8 | M1549: =(K1549*6)+L1549 -> 62 | O1549: 17 | P1549: 11 | Q1549: =(O1549*6)+P1549 -> 113 | S1549: Venue: COBURG
A1550: RICHMOND | C1550: 2 | D1550: 2 | E1550: =(C1550*6)+D1550 -> 14 | G1550: 3 | H1550: 7 | I1550: =(G1550*6)+H1550 -> 25 | K1550: 9 | L1550: 9 | M1550: =(K1550*6)+L1550 -> 63 | O1550: 12 | P1550: 11 | Q1550: =(O1550*6)+P1550 -> 83
A1551: BEST PLAYERS
A1552: COBURG | C1552: TORTORA | F1552: McLEOD | I1552: VERNON | L1552: BICER | O1552: LAPPIN | Q1552: MASSOUDI
A1553: RICHMOND | C1553: JAMES | F1553: STEINFORT | I1553: DEAN | L1553: SAMPSON
A1554: GOALKICKERS
A1555: COBURG | C1555: RYAN 4 | E1555: POTTER 4 | G1555: LANG 2 | I1555: SAUNDERS 2 | L1555: O'CONNOR 2 | O1555: McLEOD | Q1555: BICER | S1555: McKENZIE-McHARG
A1556: RICHMOND | C1556: JAMES 6 | F1556: M EDWARDS 2 | J1556: CAMPBELL | M1556: WHITE | O1556: ARTHURSON | R1556: BENNETT
A1558: ESSENDON | C1558: 6 | D1558: 2 | E1558: =(C1558*6)+D1558 -> 38 | G1558: 9 | H1558: 5 | I1558: =(G1558*6)+H1558 -> 59 | K1558: 12 | L1558: 8 | M1558: =(K1558*6)+L1558 -> 80 | O1558: 14 | P1558: 13 | Q1558: =(O1558*6)+P1558 -> 97 | S1558: Venue: FRANKSTON
A1559: FRANKSTON | C1559: 2 | D1559: 2 | E1559: =(C1559*6)+D1559 -> 14 | G1559: 4 | H1559: 3 | I1559: =(G1559*6)+H1559 -> 27 | K1559: 5 | L1559: 8 | M1559: =(K1559*6)+L1559 -> 38 | O1559: 9 | P1559: 10 | Q1559: =(O1559*6)+P1559 -> 64
A1560: BEST PLAYERS
A1561: ESSENDON | C1561: BOLTON | F1561: HENNEMAN | I1561: BARNARD | L1561: DENHAM | O1561: McGRATH | R1561: SWITALA
A1562: FRANKSTON | C1562: BURGMAN | F1562: CORRIGAN | I1562: HOSE | L1562: ROBERTS | O1562: GEORGIOU
A1563: GOALKICKERS
A1564: ESSENDON | C1564: PODSIADLY 2 | F1564: SWITALA 2 | I1564: McVEIGH 2 | L1564: EASTAUGH 2 | O1564: LALICH 2 | Q1564: McGRATH | S1564: FRASER | V1564: PEVERILL | X1564: HENNEMAN
A1565: FRANKSTON | C1565: WILLIAMS 2 | F1565: DAM CLARKE 2 | J1565: SMITH | L1565: FERRARO | N1565: SULLIVAN | Q1565: McCORMACK | T1565: GEORGE
A1567: SPRINGVALE | C1567: 7 | D1567: 3 | E1567: =(C1567*6)+D1567 -> 45 | G1567: 9 | H1567: 4 | I1567: =(G1567*6)+H1567 -> 58 | K1567: 11 | L1567: 5 | M1567: =(K1567*6)+L1567 -> 71 | O1567: 14 | P1567: 7 | Q1567: =(O1567*6)+P1567 -> 91 | S1567: Venue: WAVERLEY
A1568: WERRIBEE | C1568: 1 | D1568: 2 | E1568: =(C1568*6)+D1568 -> 8 | G1568: 4 | H1568: 7 | I1568: =(G1568*6)+H1568 -> 31 | K1568: 8 | L1568: 10 | M1568: =(K1568*6)+L1568 -> 58 | O1568: 12 | P1568: 13 | Q1568: =(O1568*6)+P1568 -> 85
A1569: BEST PLAYERS
A1570: SPRINGVALE | C1570: SHEAHAN | F1570: SMITH | I1570: CARROLL | L1570: CARMODY | O1570: TROLLOPE | R1570: IRISH
A1571: WERRIBEE | C1571: ROBERTSON | F1571: FROST | I1571: ALVEY | L1571: WILLS | O1571: DENT | R1571: DYER
A1572: GOALKICKERS
A1573: SPRINGVALE | C1573: SMITH 7 | F1573: O'BRIEN 2 | I1573: CAPLES | K1573: DELARUE | M1573: IRISH | O1573: LOGAN | Q1573: MEYER
A1574: WERRIBEE | C1574: DIROSA 2 | F1574: FAULKINER 2 | I1574: SOLOMON 2 | L1574: WIGGINS | N1574: BUTTON | P1574: ALVEY | R1574: HYDE | T1574: DYER | V1574: SMITH
D1575: 31ST JULY | H1575: NIGHT MATCH | K1575: WEATHER
A1576: CARLTON | C1576: 5 | D1576: 5 | E1576: =(C1576*6)+D1576 -> 35 | G1576: 11 | H1576: 9 | I1576: =(G1576*6)+H1576 -> 75 | K1576: 14 | L1576: 14 | M1576: =(K1576*6)+L1576 -> 98 | O1576: 20 | P1576: 17 | Q1576: =(O1576*6)+P1576 -> 137 | S1576: Venue: WAVERLEY
A1577: PRESTON | C1577: 3 | D1577: 3 | E1577: =(C1577*6)+D1577 -> 21 | G1577: 4 | H1577: 4 | I1577: =(G1577*6)+H1577 -> 28 | K1577: 7 | L1577: 7 | M1577: =(K1577*6)+L1577 -> 49 | O1577: 9 | P1577: 9 | Q1577: =(O1577*6)+P1577 -> 63
A1578: BEST PLAYERS
A1579: CARLTON | C1579: DUKES | F1579: PICKERING | I1579: FEVOLA | L1579: CHATFIELD | O1579: PRENDERGAST | R1579: BACKWELL
A1580: PRESTON | C1580: PENN | F1580: D EVANS | I1580: LEE | L1580: BLIGHT | O1580: CANN | R1580: ZORZI
A1581: GOALKICKERS
A1582: CARLTON | C1582: FEVOLA 8 | E1582: CARROLL 2 | H1582: PASSADOR 2 | K1582: MANSFIELD | N1582: PICKERING | Q1582: CHATFIELD | T1582: DOERING | W1582: O'LOUGHLIN | X1582: VALLEJO | AA1582: HARGREAVES | AC1582: BACKWELL
A1583: PRESTON | C1583: FAVRIN 2 | F1583: CANN 2 | I1583: WEBBER 2 | L1583: HILL | N1583: MANN | P1583: ZORZI
A1585: FINALS
A1586: ELIMINATION FINALS | G1586: 6TH AUGUST | M1586: WEATHER
D1587: 1ST QTR | H1587: 2ND QTR | L1587: 3RD QTR | P1587: FINAL
A1588: GEELONG | C1588: 3 | D1588: 5 | E1588: =(C1588*6)+D1588 -> 23 | G1588: 8 | H1588: 7 | I1588: =(G1588*6)+H1588 -> 55 | K1588: 13 | L1588: 8 | M1588: =(K1588*6)+L1588 -> 86 | O1588: 15 | P1588: 11 | Q1588: =(O1588*6)+P1588 -> 101 | S1588: Venue: PORT MELBOURNE
A1589: SPRINGVALE | C1589: 1 | D1589: 0 | E1589: =(C1589*6)+D1589 -> 6 | G1589: 3 | H1589: 1 | I1589: =(G1589*6)+H1589 -> 19 | K1589: 4 | L1589: 6 | M1589: =(K1589*6)+L1589 -> 30 | O1589: 8 | P1589: 12 | Q1589: =(O1589*6)+P1589 -> 60
A1590: BEST PLAYERS
A1591: GEELONG | C1591: LINDSAY | F1591: ARNOTT | I1591: T LYNCH | L1591: CAREY | N1591: FOSTER | Q1591: BAUER
A1592: SPRINGVALE | C1592: HARRISON | F1592: LITTLE | I1592: RIGG | L1592: MEYER | N1592: CARROLL | Q1592: PITT
A1593: GOALKICKERS
A1594: GEELONG | C1594: HARDING 3 | F1594: P LYNCH 3 | I1594: STREET 2 | K1594: T CLARK | M1594: COWELL | O1594: FOSTER | Q1594: LOWTHER | S1594: T LYNCH | V1594: O'BRIEN | X1594: WILKINSON
A1595: SPRINGVALE | C1595: MEYER 2 | F1595: PITT 2 | I1595: CAPLES | K1595: IRISH | M1595: O'BRIEN | O1595: SMITH
D1596: 5TH AUGUST | J1596: WEATHER
A1597: WILLIAMSTOWN | C1597: 5 | D1597: 2 | E1597: =(C1597*6)+D1597 -> 32 | G1597: 11 | H1597: 4 | I1597: =(G1597*6)+H1597 -> 70 | K1597: 19 | L1597: 11 | M1597: =(K1597*6)+L1597 -> 125 | O1597: 22 | P1597: 17 | Q1597: =(O1597*6)+P1597 -> 149 | S1597: Venue: PORT MELBOURNE
A1598: BOX HILL | C1598: 6 | D1598: 5 | E1598: =(C1598*6)+D1598 -> 41 | G1598: 8 | H1598: 11 | I1598: =(G1598*6)+H1598 -> 59 | K1598: 9 | L1598: 13 | M1598: =(K1598*6)+L1598 -> 67 | O1598: 15 | P1598: 14 | Q1598: =(O1598*6)+P1598 -> 104
A1599: BEST PLAYERS
A1600: WILLIAMSTOWN | C1600: T WEST | F1600: BOWDEN | I1600: MACRI | L1600: SMOKER | O1600: MAHONEY | R1600: TAYLOR
A1601: BOX HILL | C1601: MANN | F1601: BREWER | I1601: TRELEVEN | L1601: VANDENBERG | O1601: TAYLOR | R1601: COLLICA
A1602: GOALKICKERS
A1603: WILLIAMSTOWN | C1603: BOWDEN 7 | F1603: CHRISTOFORO 5 | J1603: MAHONEY 3 | M1603: SMOKER 2 | P1603: EAMES | R1603: ANDERSON | V1603: ROUND | X1603: GIANSIRACUSA | AB1603: M WEST
A1604: BOX HILL | C1604: HARTIN 3 | F1604: HAZELL 3 | I1604: HABERFIELD 2 | L1604: COLLICA 2 | N1604: TAYLOR | P1604: BREWER | R1604: COX | T1604: McPHARLIN | X1604: GEORGIADIS
A1606: QUALIFYING FINALS | G1606: 5TH AUGUST | M1606: WEATHER
A1607: NORTH BALLARAT | C1607: 4 | D1607: 8 | E1607: =(C1607*6)+D1607 -> 32 | G1607: 6 | H1607: 13 | I1607: =(G1607*6)+H1607 -> 49 | K1607: 12 | L1607: 19 | M1607: =(K1607*6)+L1607 -> 91 | O1607: 17 | P1607: 24 | Q1607: =(O1607*6)+P1607 -> 126 | S1607: Venue: NORTH BALLARAT
A1608: CARLTON | C1608: 3 | D1608: 1 | E1608: =(C1608*6)+D1608 -> 19 | G1608: 5 | H1608: 3 | I1608: =(G1608*6)+H1608 -> 33 | K1608: 7 | L1608: 3 | M1608: =(K1608*6)+L1608 -> 45 | O1608: 10 | P1608: 6 | Q1608: =(O1608*6)+P1608 -> 66
A1609: BEST PLAYERS
A1610: NORTH BALLARAT | C1610: FREELAND | F1610: GREIG | I1610: J POLKINGHORNE | M1610: MOLONEY
A1611: CARLTON | C1611: BACKWELL
A1612: GOALKICKERS | C1612: * | D1612: (3 GOALS SHORT)
A1613: NORTH BALLARAT | C1613: POWER 3 | F1613: CLARKE 2 | I1613: PEAKE 2 | K1613: JURICA 2 | M1613: CLAYTON | O1613: SOMERVILLE | R1613: RYALL | T1613: T POLKINGHORNE | X1613: MOLONEY
A1614: CARLTON | C1614: O'REILLY 2 | F1614: CARROLL 2 | I1614: BACKWELL | L1614: DOERING | N1614: PASSADOR | Q1614: O'LOUGHLIN | T1614: VALLEJO | W1614: WATSON
D1615: 7TH AUGUST | G1615: NIGHT MATCH | J1615: WEATHER
A1616: SANDRINGHAM | C1616: 2 | D1616: 5 | E1616: =(C1616*6)+D1616 -> 17 | G1616: 2 | H1616: 8 | I1616: =(G1616*6)+H1616 -> 20 | K1616: 6 | L1616: 12 | M1616: =(K1616*6)+L1616 -> 48 | O1616: 9 | P1616: 14 | Q1616: =(O1616*6)+P1616 -> 68 | S1616: Venue: WAVERLEY
A1617: ST KILDA | C1617: 1 | D1617: 3 | E1617: =(C1617*6)+D1617 -> 9 | G1617: 4 | H1617: 3 | I1617: =(G1617*6)+H1617 -> 27 | K1617: 7 | L1617: 6 | M1617: =(K1617*6)+L1617 -> 48 | O1617: 10 | P1617: 7 | Q1617: =(O1617*6)+P1617 -> 67
A1618: BEST PLAYERS
A1619: SANDRINGHAM | C1619: COGHLAN | F1619: GODFREY | I1619: BROADBRIDGE | L1619: MACGEORGE | O1619: HAYNES | Q1619: SEECAMP
A1620: ST KILDA | C1620: HEAZELWWOD | F1620: CRANAGE | I1620: PITTS | L1620: BROWN | O1620: DAVIS | Q1620: CAMPBELL
A1621: GOALKICKERS
A1622: SANDRINGHAM | C1622: BEAMS 2 | F1622: SAUTNER 2 | I1622: PITT 2 | L1622: OAKLEY 2 | O1622: MACGEORGE
A1623: ST KILDA | C1623: MILNE 3 | F1623: WULF 2 | I1623: DAVIS 2 | L1623: PITTS | N1623: BERRY | P1623: CAMPBELL
A1625: 1ST SEMI-FINAL | G1625: 13TH AUGUST | M1625: WEATHER
A1626: GEELONG | C1626: 4 | D1626: 6 | E1626: =(C1626*6)+D1626 -> 30 | G1626: 8 | H1626: 7 | I1626: =(G1626*6)+H1626 -> 55 | K1626: 8 | L1626: 9 | M1626: =(K1626*6)+L1626 -> 57 | O1626: 9 | P1626: 13 | Q1626: =(O1626*6)+P1626 -> 67 | S1626: Venue: PORT MELBOURNE
A1627: ST KILDA | C1627: 3 | D1627: 2 | E1627: =(C1627*6)+D1627 -> 20 | G1627: 5 | H1627: 8 | I1627: =(G1627*6)+H1627 -> 38 | K1627: 7 | L1627: 12 | M1627: =(K1627*6)+L1627 -> 54 | O1627: 8 | P1627: 14 | Q1627: =(O1627*6)+P1627 -> 62
A1628: BEST PLAYERS
A1629: GEELONG | C1629: HAY | F1629: ARNOTT | I1629: T LYNCH | L1629: HARDING | O1629: LOWTHER | R1629: MCKAY
A1630: ST KILDA | C1630: PLAPP | F1630: BROWN | I1630: YOUNG | L1630: TRIANIDIS | O1630: MONKHORST | R1630: PITTS
A1631: GOALKICKERS
A1632: GEELONG | C1632: P LYNCH 3 | F1632: LING 2 | I1632: ARNOTT | K1632: ENRIGHT | M1632: HARDING | O1632: O'BRIEN
A1633: ST KILDA | C1633: MILNE 3 | F1633: HEATLEY 2 | I1633: TOUNG | K1633: McLAREN | M1633: ELLIOTT
A1635: 2ND SEMI-FINAL | G1635: 12TH AUGUST
A1636: CARLTON | C1636: 3 | D1636: 2 | E1636: =(C1636*6)+D1636 -> 20 | G1636: 7 | H1636: 6 | I1636: =(G1636*6)+H1636 -> 48 | K1636: 13 | L1636: 10 | M1636: =(K1636*6)+L1636 -> 88 | O1636: 19 | P1636: 11 | Q1636: =(O1636*6)+P1636 -> 125 | S1636: Venue: PORT MELBOURNE
A1637: WILLIAMSTOWN | C1637: 1 | D1637: 1 | E1637: =(C1637*6)+D1637 -> 7 | G1637: 5 | H1637: 3 | I1637: =(G1637*6)+H1637 -> 33 | K1637: 5 | L1637: 5 | M1637: =(K1637*6)+L1637 -> 35 | O1637: 7 | P1637: 9 | Q1637: =(O1637*6)+P1637 -> 51
A1638: BEST PLAYERS
A1639: CARLTON | C1639: BACKWELL | F1639: CULPITT | I1639: MASSIE | L1639: NELSON | O1639: O'REILLY | Q1639: DOERING
A1640: WILLIAMSTOWN | C1640: ANDERSON | F1640: CARRICK | I1640: T WEST | L1640: BROWN | O1640: WOOD
A1641: GOALKICKERS
A1642: CARLTON | C1642: O'REILLY 7 | E1642: CULPITT 2 | G1642: ANDREW MERRINGTON 2 | L1642: BACKWELL | N1642: MASSIE | P1642: NELSON | R1642: VANCE | T1642: MURPHY | W1642: DOERING | X1642: PASSADOR | AA1642: KELLY
A1643: WILLIAMSTOWN | C1643: CHRISTOFORO 2 | G1643: GIANSIRACUSA 2 | K1643: ANDERSON | N1643: DONALDSON | Q1643: BOWDEN
A1645: PRELIMINARY FINALS | G1645: 19TH AUGUST | L1645: WEATHER
A1646: NORTH BALLARAT | C1646: 6 | D1646: 4 | E1646: =(C1646*6)+D1646 -> 40 | G1646: 12 | H1646: 6 | I1646: =(G1646*6)+H1646 -> 78 | K1646: 16 | L1646: 9 | M1646: =(K1646*6)+L1646 -> 105 | O1646: 20 | P1646: 13 | Q1646: =(O1646*6)+P1646 -> 133 | S1646: Venue: PORT MELBOURNE
A1647: GEELONG | C1647: 0 | D1647: 1 | E1647: =(C1647*6)+D1647 -> 1 | G1647: 1 | H1647: 4 | I1647: =(G1647*6)+H1647 -> 10 | K1647: 5 | L1647: 7 | M1647: =(K1647*6)+L1647 -> 37 | O1647: 12 | P1647: 7 | Q1647: =(O1647*6)+P1647 -> 79
A1648: BEST PLAYERS
A1649: NORTH BALLARAT | C1649: POWER | F1649: T POLKINGHORNE | J1649: JURICA | M1649: J POLKINGHORNE | Q1649: FUNCKE | S1649: FREELAND
A1650: GEELONG | C1650: WOJCINSKI | F1650: ARNOTT | J1650: COWELL | M1650: ENRIGHT | Q1650: WILKINSON
A1651: GOALKICKERS
A1652: NORTH BALLARAT | C1652: JURICA 5 | E1652: McCORKELL 4 | H1652: POWER 3 | J1652: T POLKINGHORNE 2 | N1652: MURRIHY | P1652: CLAYTON | R1652: PEAKE | T1652: FUNCKE | W1652: McDONALD | X1652: FISHER
A1653: GEELONG | C1653: WILKINSON 3 | F1653: BALDWIN 2 | I1653: T CLARK | K1653: COREY | M1653: HAY | N1653: KARAMAHE | Q1653: LINDSAY | S1653: O'BRIEN | U1653: COWELL
E1654: 20TH AUGUST | J1654: WEATHER
A1655: SANDRINGHAM | C1655: 4 | D1655: 3 | E1655: =(C1655*6)+D1655 -> 27 | G1655: 8 | H1655: 10 | I1655: =(G1655*6)+H1655 -> 58 | K1655: 17 | L1655: 17 | M1655: =(K1655*6)+L1655 -> 119 | O1655: 22 | P1655: 23 | Q1655: =(O1655*6)+P1655 -> 155 | S1655: Venue: PORT MELBOURNE
A1656: CARLTON | C1656: 0 | D1656: 6 | E1656: =(C1656*6)+D1656 -> 6 | G1656: 5 | H1656: 6 | I1656: =(G1656*6)+H1656 -> 36 | K1656: 9 | L1656: 7 | M1656: =(K1656*6)+L1656 -> 61 | O1656: 12 | P1656: 9 | Q1656: =(O1656*6)+P1656 -> 81
A1657: BEST PLAYERS
A1658: SANDRINGHAM | C1658: GODFREY | F1658: MACGEORGE | J1658: COGHLAN | M1658: SHANAHAN | P1658: BROADBRIDGE | S1658: MALONEY
A1659: CARLTON | C1659: BROWN | F1659: MASSIE | J1659: WHITE | M1659: MURPHY
A1660: GOALKICKERS
A1661: SANDRINGHAM | C1661: BEAMS 5 | F1661: WILLIAMS 4 | I1661: TEMPLETON 3 | L1661: SAUTNER 2 | N1661: PITT 2 | P1661: HAYNES | R1661: McKELLAR | U1661: BROADBRIDGE | X1661: FEBEY | Z1661: GEHLING | AB1661: GODFREY
A1662: CARLTON | C1662: O'REILLY 3 | F1662: PASSADOR 3 | I1662: CARROLL 2 | L1662: WHITE | N1662: DELULIO | P1662: MATTHEWS | R1662: ORLANDO
A1664: GRAND FINAL | D1664: 27TH AUGUST | K1664: WEATHER
A1665: SANDRINGHAM | C1665: 4 | D1665: 6 | E1665: =(C1665*6)+D1665 -> 30 | G1665: 8 | H1665: 10 | I1665: =(G1665*6)+H1665 -> 58 | K1665: 11 | L1665: 14 | M1665: =(K1665*6)+L1665 -> 80 | O1665: 15 | P1665: 18 | Q1665: =(O1665*6)+P1665 -> 108 | S1665: Venue: WAVERLEY
A1666: NORTH BALLARAT | C1666: 0 | D1666: 5 | E1666: =(C1666*6)+D1666 -> 5 | G1666: 3 | H1666: 5 | I1666: =(G1666*6)+H1666 -> 23 | K1666: 5 | L1666: 8 | M1666: =(K1666*6)+L1666 -> 38 | O1666: 11 | P1666: 11 | Q1666: =(O1666*6)+P1666 -> 77
A1667: BEST PLAYERS
A1668: SANDRINGHAM | D1668: LIDDELL | G1668: PITT | I1668: MALONEY | L1668: FEBEY | O1668: HAYNES | R1668: MACGEORGE
A1669: NORTH BALLARAT
A1670: GOALKICKERS
A1671: SANDRINGHAM | D1671: SAUTNER 6 | G1671: TEMPLETON 2 | J1671: BEAMS 2 | L1671: PITT 2 | N1671: HAYNES | P1671: WILLIAMS | R1671: FEBEY
A1672: NORTH BALLARAT