A1: Victorian Football League
A2: Season 2001
A3: © Copyright Wal Williams | F3: First created: 4 September 2016
A4: Contact: joywalwi at gmail dot com | F4: Last updated: 4 September 2016 | W4: VFA Results and tables - Link to the main index page
A5: You are free to copy this document in whole or part provided that proper acknowledgement is given to the author. All rights reserved.
A7: 2001 SEASON
A8: ROUND 1 | D8: 7TH APRIL | J8: WEATHER
D9: 1ST QTR | H9: 2ND QTR | L9: 3RD QTR | P9: FINAL | S9: Venue: OPTUS OVAL
A10: BOX HILL | C10: 0 | D10: 5 | E10: =(C10*6)+D10 -> 5 | G10: 5 | H10: 9 | I10: =(G10*6)+H10 -> 39 | K10: 14 | L10: 14 | M10: =(K10*6)+L10 -> 98 | O10: 17 | P10: 20 | Q10: =(O10*6)+P10 -> 122 | S10: UMPIRES | Y10: LADDER | AB10: ROUND | AD10: 1
A11: CARLTON | C11: 1 | D11: 3 | E11: =(C11*6)+D11 -> 9 | G11: 4 | H11: 5 | I11: =(G11*6)+H11 -> 29 | K11: 6 | L11: 7 | M11: =(K11*6)+L11 -> 43 | O11: 9 | P11: 11 | Q11: =(O11*6)+P11 -> 65
A12: BEST PLAYERS | W12: TEAM | X12: W | Y12: L | Z12: D | AA12: FOR | AB12: AGST | AC12: % | AD12: PTS
A13: BOX HILL | C13: O'FARRELL | F13: BARLOW | I13: ROCK | K13: DENT | N13: MOLONEY | Q13: NICHOLLS
A14: CARLTON | C14: PLUNKETT | F14: MANSFIELD | I14: VANCE | K14: MERRINGTON | N14: WIGGINS | W14: SANDRINGHAM | X14: 1 | Y14: 0 | Z14: 0 | AA14: 138 | AB14: 54 | AC14: =(AA14/AB14)*100 -> 255.55555555555554 | AD14: =(X14*4)+(Z14*2) -> 4
A15: GOALKICKERS | L15: LOATS | N15: LONIE | P15: PUGSLEY | R15: VANDENBERG | W15: WILLIAMSTOWN | X15: 1 | Y15: 0 | Z15: 0 | AA15: 100 | AB15: 48 | AC15: =(AA15/AB15)*100 -> 208.33333333333334 | AD15: =(X15*4)+(Z15*2) -> 4
A16: BOX HILL | C16: WILLIAMS 3 | F16: ROCK 2 | H16: BARLOW 2 | J16: O'FARRELL 2 | M16: GREENE | O16: COX | P16: NICHOLLS | R16: PASSADORE | W16: NORTH BALLARAT | X16: 1 | Y16: 0 | Z16: 0 | AA16: 113 | AB16: 57 | AC16: =(AA16/AB16)*100 -> 198.24561403508773 | AD16: =(X16*4)+(Z16*2) -> 4
A17: CARLTON | C17: McKEON 3 | F17: MERRINGTON 2 | J17: VANCE | L17: MATTHEWS | O17: CRANAGE | Q17: CAMPBELL | W17: BOX HILL | X17: 1 | Y17: 0 | Z17: 0 | AA17: 122 | AB17: 65 | AC17: =(AA17/AB17)*100 -> 187.69230769230768 | AD17: =(X17*4)+(Z17*2) -> 4
W18: MURRAY KANGAROOS | X18: 1 | Y18: 0 | Z18: 0 | AA18: 119 | AB18: 83 | AC18: =(AA18/AB18)*100 -> 143.37349397590361 | AD18: =(X18*4)+(Z18*2) -> 4
A19: SANDRINGHAM | C19: 3 | D19: 2 | E19: =(C19*6)+D19 -> 20 | G19: 7 | H19: 6 | I19: =(G19*6)+H19 -> 48 | K19: 13 | L19: 8 | M19: =(K19*6)+L19 -> 86 | O19: 21 | P19: 12 | Q19: =(O19*6)+P19 -> 138 | S19: Venue: BEACH ROAD | W19: FRANKSTON | X19: 1 | Y19: 0 | Z19: 0 | AA19: 117 | AB19: 93 | AC19: =(AA19/AB19)*100 -> 125.80645161290323 | AD19: =(X19*4)+(Z19*2) -> 4
A20: TASMANIA | C20: 3 | D20: 0 | E20: =(C20*6)+D20 -> 18 | G20: 7 | H20: 3 | I20: =(G20*6)+H20 -> 45 | K20: 7 | L20: 4 | M20: =(K20*6)+L20 -> 46 | O20: 8 | P20: 6 | Q20: =(O20*6)+P20 -> 54 | W20: WERRIBEE | X20: 1 | Y20: 0 | Z20: 0 | AA20: 42 | AB20: 34 | AC20: =(AA20/AB20)*100 -> 123.52941176470588 | AD20: =(X20*4)+(Z20*2) -> 4
A21: BEST PLAYERS | W21: SPRINGVALE | X21: 1 | Y21: 0 | Z21: 0 | AA21: 100 | AB21: 99 | AC21: =(AA21/AB21)*100 -> 101.01010101010101 | AD21: =(X21*4)+(Z21*2) -> 4
A22: SANDRINGHAM | C22: MACGEORGE | F22: TREGEAR | I22: WHEATLEY | L22: TEMPLETON | O22: THOMPSON | R22: RADFORD
A23: TASMANIA | C23: HOWARD | F23: DAVIS | I23: CALLANAN | L23: CARTER | O23: CARELESS | W23: GEELONG | X23: 0 | Y23: 1 | Z23: 0 | AA23: 99 | AB23: 100 | AC23: =(AA23/AB23)*100 -> 99 | AD23: =(X23*4)+(Z23*2) -> 0
A24: GOALKICKERS | Q24: THOMPSON | W24: COBURG | X24: 0 | Y24: 1 | Z24: 0 | AA24: 34 | AB24: 42 | AC24: =(AA24/AB24)*100 -> 80.952380952380949 | AD24: =(X24*4)+(Z24*2) -> 0
A25: SANDRINGHAM | C25: LYNCH 7 | E25: TEMPLETON 5 | H25: MACGEORGE 2 | K25: BINGHAM 2 | N25: TREGEAR | P25: O'BRIEN | R25: TARPEY | T25: FUNCKE | W25: ESSENDON | X25: 0 | Y25: 1 | Z25: 0 | AA25: 93 | AB25: 117 | AC25: =(AA25/AB25)*100 -> 79.487179487179489 | AD25: =(X25*4)+(Z25*2) -> 0
A26: TASMANIA | C26: CARTER 3 | F26: ALLEN | H26: GEAPPIN | J26: CALLINAN | M26: MILLER | O26: THURLEY | W26: NORTHERN BULLANTS | X26: 0 | Y26: 1 | Z26: 0 | AA26: 83 | AB26: 119 | AC26: =(AA26/AB26)*100 -> 69.747899159663859 | AD26: =(X26*4)+(Z26*2) -> 0
W27: CARLTON | X27: 0 | Y27: 1 | Z27: 0 | AA27: 65 | AB27: 122 | AC27: =(AA27/AB27)*100 -> 53.278688524590166 | AD27: =(X27*4)+(Z27*2) -> 0
A28: FRANKSTON | C28: 5 | D28: 3 | E28: =(C28*6)+D28 -> 33 | G28: 10 | H28: 6 | I28: =(G28*6)+H28 -> 66 | K28: 12 | L28: 8 | M28: =(K28*6)+L28 -> 80 | O28: 18 | P28: 9 | Q28: =(O28*6)+P28 -> 117 | S28: Venue: WINDY HILL | W28: PORT MELBOURNE | X28: 0 | Y28: 1 | Z28: 0 | AA28: 57 | AB28: 113 | AC28: =(AA28/AB28)*100 -> 50.442477876106196 | AD28: =(X28*4)+(Z28*2) -> 0
A29: ESSENDON | C29: 4 | D29: 2 | E29: =(C29*6)+D29 -> 26 | G29: 6 | H29: 5 | I29: =(G29*6)+H29 -> 41 | K29: 11 | L29: 8 | M29: =(K29*6)+L29 -> 74 | O29: 14 | P29: 9 | Q29: =(O29*6)+P29 -> 93 | W29: BENDIGO | X29: 0 | Y29: 1 | Z29: 0 | AA29: 48 | AB29: 100 | AC29: =(AA29/AB29)*100 -> 48 | AD29: =(X29*4)+(Z29*2) -> 0
A30: BEST PLAYERS | W30: TASMANIA | X30: 0 | Y30: 1 | Z30: 0 | AA30: 54 | AB30: 138 | AC30: =(AA30/AB30)*100 -> 39.130434782608695 | AD30: =(X30*4)+(Z30*2) -> 0
A31: FRANKSTON | C31: SAUTNER | F31: BEVERIDGE | I31: MALLOY | L31: FOLINO | N31: SULLIVAN | Q31: BURGMAN
A32: ESSENDON | C32: DENHAM | F32: BOLTON | I32: ROBRAN | L32: HILLE | N32: McGRATH | Q32: BANNISTER
A33: GOALKICKERS
A34: FRANKSTON | C34: SAUTNER 8 | F34: WILLIAMS 4 | I34: SIMISTER 3 | L34: BEVERIDGE 2 | O34: GEORGIOU
A35: ESSENDON | C35: BOLTON 2 | E35: KENNY 2 | G35: MAHONEY | I35: McGRATH | K35: BULLEN | M35: GODDARD | O35: DENHAM | Q35: HILLE | R35: RICHARDS
L36: YZE | M36: CRANAGE | P36: McALISTER
A37: SPRINGVALE | C37: 4 | D37: 4 | E37: =(C37*6)+D37 -> 28 | G37: 9 | H37: 8 | I37: =(G37*6)+H37 -> 62 | K37: 11 | L37: 11 | M37: =(K37*6)+L37 -> 77 | O37: 14 | P37: 16 | Q37: =(O37*6)+P37 -> 100 | S37: Venue: MOORABBIN
A38: GEELONG | C38: 4 | D38: 1 | E38: =(C38*6)+D38 -> 25 | G38: 8 | H38: 2 | I38: =(G38*6)+H38 -> 50 | K38: 14 | L38: 5 | M38: =(K38*6)+L38 -> 89 | O38: 15 | P38: 9 | Q38: =(O38*6)+P38 -> 99
A39: BEST PLAYERS
A40: SPRINGVALE | C40: HARRISON | F40: LAWRENCE | I40: KOSCHITZKE | L40: OLIVER | N40: ROBBINS | Q40: RIGG
A41: GEELONG | C41: KINGSLEY | F41: LING | I41: MERRIMAN | L41: HUNT | N41: McGRATH | Q41: CHAPMAN
A42: GOALKICKERS
A43: SPRINGVALE | C43: SMITH 4 | F43: MILNE 3 | I43: LAWRENCE 2 | L43: LOGAN | N43: O'BRIEN | P43: PITT | Q43: ROBBINS | S43: WALTON
A44: GEELONG | C44: KINGSLEY 4 | F44: BALDWIN 3 | I44: CHAPMAN | K44: T CLARK | M44: HOSKING | O44: LING | Q44: LOWTHER | S44: McGRATH | V44: O'BRIEN | X44: SHAW
A46: MURRAY KANGAROOS | C46: 7 | D46: 5 | E46: =(C46*6)+D46 -> 47 | G46: 11 | H46: 7 | I46: =(G46*6)+H46 -> 73 | K46: 16 | L46: 9 | M46: =(K46*6)+L46 -> 105 | O46: 18 | P46: 11 | Q46: =(O46*6)+P46 -> 119 | S46: Venue: PRESTON
A47: NORTH BULL | C47: 2 | D47: 0 | E47: =(C47*6)+D47 -> 12 | G47: 5 | H47: 2 | I47: =(G47*6)+H47 -> 32 | K47: 8 | L47: 3 | M47: =(K47*6)+L47 -> 51 | O47: 13 | P47: 5 | Q47: =(O47*6)+P47 -> 83
A48: BEST PLAYERS
A49: MURRAY KANGAROOS | C49: SMITH | F49: HARDING | I49: JONES | L49: TEAGUE | N49: McCORMICK | Q49: McLAREN
A50: NORTH BULL | C50: WEBBER | F50: PENN | I50: D EVANS
A51: GOALKICKERS
A52: MURRAY KANGAROOS | C52: HARDING 5 | F52: SMITH 3 | I52: JONES 3 | K52: MORELL 2 | M52: LANGE 2 | O52: McCORMICK | R52: MOTLOP | U52: McLAREN
A53: NORTH BULL | C53: WEBBER 5 | F53: GRAINGER 2 | I53: FAVRIN 2 | L53: RAMSAY | N53: LOWTHER | Q53: ZORZI | S53: PENN
F54: NIGHT MATCH
A55: NORTH BALLARAT | C55: 1 | D55: 4 | E55: =(C55*6)+D55 -> 10 | G55: 4 | H55: 10 | I55: =(G55*6)+H55 -> 34 | K55: 8 | L55: 13 | M55: =(K55*6)+L55 -> 61 | O55: 16 | P55: 17 | Q55: =(O55*6)+P55 -> 113 | S55: Venue: NORTH BALLARAT
A56: PORT MELBOURNE | C56: 0 | D56: 3 | E56: =(C56*6)+D56 -> 3 | G56: 1 | H56: 5 | I56: =(G56*6)+H56 -> 11 | K56: 4 | L56: 7 | M56: =(K56*6)+L56 -> 31 | O56: 8 | P56: 9 | Q56: =(O56*6)+P56 -> 57
A57: BEST PLAYERS
A58: NORTH BALLARAT | C58: MURRIHY | F58: FISHER | I58: J POLKINGHORNE | M58: CLAYTON | O58: COHEN | Q58: INKSTER
A59: PORT MELBOURNE | C59: BENNETT | F59: BUCHANAN | I59: MILHUISEN | M59: O'KEEFE | O59: STEVENS
A60: GOALKICKERS
A61: NORTH BALLARAT | C61: COLLARD 4 | F61: RYALL 3 | I61: McMAHON 2 | L61: SOMERVILLE | O61: JURICA | Q61: FISHER | S61: CLAYTON | V61: T POLKINGHORNE | X61: JENKINS | AA61: COHEN
A62: PORT MELBOURNE | C62: BUCHANAN 2 | F62: O'KEEFE | I62: TOMSIC | K62: BENNETT | M62: KENNELLY | O62: NICKS | Q62: TRAND
D63: 8TH APRIL | J63: WEATHER
A64: WILLIAMSTOWN | C64: 2 | D64: 2 | E64: =(C64*6)+D64 -> 14 | G64: 4 | H64: 5 | I64: =(G64*6)+H64 -> 29 | K64: 10 | L64: 14 | M64: =(K64*6)+L64 -> 74 | O64: 14 | P64: 16 | Q64: =(O64*6)+P64 -> 100 | S64: Venue: WILLIAMSTOWN
A65: BENDIGO | C65: 0 | D65: 5 | E65: =(C65*6)+D65 -> 5 | G65: 2 | H65: 8 | I65: =(G65*6)+H65 -> 20 | K65: 2 | L65: 8 | M65: =(K65*6)+L65 -> 20 | O65: 6 | P65: 12 | Q65: =(O65*6)+P65 -> 48
A66: BEST PLAYERS
A67: WILLIAMSTOWN | C67: DAVIS | F67: LLOYD | I67: TUCKEY | L67: TAYLOR | O67: ANDERSON | R67: SHAW
A68: BENDIGO | C68: PLIM | F68: BROWN | I68: GEDDES | L68: ATKINS | O68: NOLTE | R68: CARTER
A69: GOALKICKERS
A70: WILLIAMSTOWN | C70: TAYLOR 3 | F70: LANE 2 | I70: LLOYD 2 | K70: DIDAK 2 | M70: ROCCA | O70: SHEEHAN | Q70: WASLEY | S70: DAVIS | U70: BETHERAS
A71: BENDIGO | C71: LOCK 2 | F71: BROWN | H71: O'TOOLE | J71: ANGOVE | L71: ATKINS
A73: WERRIBEE | C73: 0 | D73: 2 | E73: =(C73*6)+D73 -> 2 | G73: 2 | H73: 6 | I73: =(G73*6)+H73 -> 18 | K73: 3 | L73: 9 | M73: =(K73*6)+L73 -> 27 | O73: 5 | P73: 12 | Q73: =(O73*6)+P73 -> 42 | S73: Venue: COBURG
A74: COBURG | C74: 1 | D74: 1 | E74: =(C74*6)+D74 -> 7 | G74: 1 | H74: 3 | I74: =(G74*6)+H74 -> 9 | K74: 2 | L74: 6 | M74: =(K74*6)+L74 -> 18 | O74: 4 | P74: 10 | Q74: =(O74*6)+P74 -> 34
A75: BEST PLAYERS
A76: WERRIBEE | C76: CONTESSA | F76: SMITH | I76: FROST | L76: GIANSIRCUSA
A77: COBURG | C77: BRIDERICK | F77: LAPPIN | I77: VARDY | L77: HART | N77: TAYLOR | Q77: PAGAN
A78: GOALKICKERS
A79: WERRIBEE | C79: SAUNDERS 2 | F79: GILBEE | I79: BOWDEN | K79: GIANSIRACUSA
A80: COBURG | C80: BRODERICK | F80: TAYLOR | I80: POYAS | K80: HYDE
A82: ROUND 2 | D82: 12TH APRIL | J82: WEATHER
D83: 1ST QTR | H83: 2ND QTR | L83: 3RD QTR | P83: FINAL | S83: Venue: OPTUS OVAL
A84: ESSENDON | C84: 2 | D84: 4 | E84: =(C84*6)+D84 -> 16 | G84: 5 | H84: 8 | I84: =(G84*6)+H84 -> 38 | K84: 9 | L84: 9 | M84: =(K84*6)+L84 -> 63 | O84: 11 | P84: 11 | Q84: =(O84*6)+P84 -> 77 | S84: UMPIRES | Y84: LADDER | AB84: ROUND | AD84: 2
A85: CARLTON | C85: 2 | D85: 2 | E85: =(C85*6)+D85 -> 14 | G85: 4 | H85: 4 | I85: =(G85*6)+H85 -> 28 | K85: 8 | L85: 5 | M85: =(K85*6)+L85 -> 53 | O85: 11 | P85: 7 | Q85: =(O85*6)+P85 -> 73
A86: BEST PLAYERS | W86: TEAM | X86: W | Y86: L | Z86: D | AA86: FOR | AB86: AGST | AC86: % | AD86: PTS
A87: ESSENDON | C87: BULLEN | F87: HILLE | I87: LALICH | L87: ROBRAN | N87: PEVERILL
A88: CARLTON | C88: DOERING | F88: WIGGINS | I88: PRENDERGAST | L88: SPORN | N88: PLUNKETT | W88: WERRIBEE | X88: 2 | Y88: 0 | Z88: 0 | AA88: 172 | AB88: 88 | AC88: =(AA88/AB88)*100 -> 195.45454545454547 | AD88: =(X88*4)+(Z88*2) -> 8
A89: GOALKICKERS | O89: LALICH | Q89: MAHONEY | W89: SANDRINGHAM | X89: 2 | Y89: 0 | Z89: 0 | AA89: 228 | AB89: 120 | AC89: =(AA89/AB89)*100 -> 190 | AD89: =(X89*4)+(Z89*2) -> 8
A90: ESSENDON | C90: BOLTON | E90: WALLIS | G90: BULLEN | I90: ROBRAN | K90: CRANAGE | M90: RICHARDS | O90: KENNY | Q90: HILLE | R90: D JOHNSON | W90: BOX HILL | X90: 2 | Y90: 0 | Z90: 0 | AA90: 245 | AB90: 141 | AC90: =(AA90/AB90)*100 -> 173.75886524822695 | AD90: =(X90*4)+(Z90*2) -> 8
A91: CARLTON | C91: McKEON 3 | F91: DOERING 2 | I91: LIVINGSTONE 2 | L91: PICKERING | N91: MATTHEWS | Q91: O'KEEFE | W91: SPRINGVALE | X91: 2 | Y91: 0 | Z91: 0 | AA91: 221 | AB91: 154 | AC91: =(AA91/AB91)*100 -> 143.50649350649351 | AD91: =(X91*4)+(Z91*2) -> 8
D92: 14TH APRIL | J92: WEATHER | O92: PRENDERGAST | W92: FRANKSTON | X92: 2 | Y92: 0 | Z92: 0 | AA92: 230 | AB92: 170 | AC92: =(AA92/AB92)*100 -> 135.29411764705884 | AD92: =(X92*4)+(Z92*2) -> 8
A93: SPRINGVALE | C93: 2 | D93: 3 | E93: =(C93*6)+D93 -> 15 | G93: 8 | H93: 15 | I93: =(G93*6)+H93 -> 63 | K93: 11 | L93: 17 | M93: =(K93*6)+L93 -> 83 | O93: 16 | P93: 25 | Q93: =(O93*6)+P93 -> 121 | S93: Venue: SPRINGVALE | W93: MURRAY KANGAROOS | X93: 2 | Y93: 0 | Z93: 0 | AA93: 237 | AB93: 183 | AC93: =(AA93/AB93)*100 -> 129.50819672131149 | AD93: =(X93*4)+(Z93*2) -> 8
A94: NORTH BALLARAT | C94: 2 | D94: 3 | E94: =(C94*6)+D94 -> 15 | G94: 4 | H94: 3 | I94: =(G94*6)+H94 -> 27 | K94: 6 | L94: 6 | M94: =(K94*6)+L94 -> 42 | O94: 8 | P94: 7 | Q94: =(O94*6)+P94 -> 55 | W94: COBURG | X94: 1 | Y94: 1 | Z94: 0 | AA94: 139 | AB94: 134 | AC94: =(AA94/AB94)*100 -> 103.73134328358209 | AD94: =(X94*4)+(Z94*2) -> 4
A95: BEST PLAYERS | W95: NORTH BALLARAT | X95: 1 | Y95: 1 | Z95: 0 | AA95: 168 | AB95: 178 | AC95: =(AA95/AB95)*100 -> 94.382022471910105 | AD95: =(X95*4)+(Z95*2) -> 4
A96: SPRINGVALE | C96: PITT | F96: YOUNG | I96: DELANY | L96: ROBBINS | N96: OLIVER | Q96: MILNE
A97: NORTH BALLARAT | C97: J POLKINGHORNE | G97: CLAYTON | I97: COLLARD | L97: RUYG | W97: ESSENDON | X97: 1 | Y97: 1 | Z97: 0 | AA97: 170 | AB97: 190 | AC97: =(AA97/AB97)*100 -> 89.473684210526315 | AD97: =(X97*4)+(Z97*2) -> 4
A98: GOALKICKERS | W98: WILLIAMSTOWN | X98: 1 | Y98: 1 | Z98: 0 | AA98: 154 | AB98: 178 | AC98: =(AA98/AB98)*100 -> 86.516853932584269 | AD98: =(X98*4)+(Z98*2) -> 4
A99: SPRINGVALE | C99: MILNE 4 | F99: PITT 3 | H99: SMITH 3 | J99: HARRISON 2 | M99: DAVIS | O99: DILLON | Q99: LOGAN | S99: WALTON | W99: GEELONG | X99: 0 | Y99: 2 | Z99: 0 | AA99: 165 | AB99: 190 | AC99: =(AA99/AB99)*100 -> 86.842105263157904 | AD99: =(X99*4)+(Z99*2) -> 0
A100: NORTH BALLARAT | C100: COLLARD 4 | F100: MAIN | H100: McMAHON | J100: RYALL | L100: T POLKINGHORNE | W100: NORTHERN BULLANTS | X100: 0 | Y100: 2 | Z100: 0 | AA100: 175 | AB100: 224 | AC100: =(AA100/AB100)*100 -> 78.125 | AD100: =(X100*4)+(Z100*2) -> 0
W101: CARLTON | X101: 0 | Y101: 2 | Z101: 0 | AA101: 138 | AB101: 199 | AC101: =(AA101/AB101)*100 -> 69.346733668341713 | AD101: =(X101*4)+(Z101*2) -> 0
A102: BOX HILL | C102: 4 | D102: 10 | E102: =(C102*6)+D102 -> 34 | G102: 10 | H102: 15 | I102: =(G102*6)+H102 -> 75 | K102: 15 | L102: 19 | M102: =(K102*6)+L102 -> 109 | O102: 17 | P102: 21 | Q102: =(O102*6)+P102 -> 123 | S102: Venue: BOX HILL | W102: PORT MELBOURNE | X102: 0 | Y102: 2 | Z102: 0 | AA102: 157 | AB102: 231 | AC102: =(AA102/AB102)*100 -> 67.96536796536796 | AD102: =(X102*4)+(Z102*2) -> 0
A103: BENDIGO | C103: 1 | D103: 0 | E103: =(C103*6)+D103 -> 6 | G103: 3 | H103: 5 | I103: =(G103*6)+H103 -> 23 | K103: 4 | L103: 6 | M103: =(K103*6)+L103 -> 30 | O103: 11 | P103: 10 | Q103: =(O103*6)+P103 -> 76 | W103: BENDIGO | X103: 0 | Y103: 2 | Z103: 0 | AA103: 124 | AB103: 223 | AC103: =(AA103/AB103)*100 -> 55.60538116591929 | AD103: =(X103*4)+(Z103*2) -> 0
A104: BEST PLAYERS | W104: TASMANIA | X104: 0 | Y104: 2 | Z104: 0 | AA104: 131 | AB104: 251 | AC104: =(AA104/AB104)*100 -> 52.191235059760956 | AD104: =(X104*4)+(Z104*2) -> 0
A105: BOX HILL | C105: O'FARRELL | F105: NICHOLLS | I105: HABERFIELD | L105: BAIRD | N105: HAZELL | Q105: COX
A106: BENDIGO | C106: ANDREWS | F106: BROWN | I106: TOINTON | L106: CAIL | N106: GATHERCOLE
A107: GOALKICKERS | Q107: LONIE | S107: PUGSLEY
A108: BOX HILL | C108: HABERFIELD 3 | F108: HAZELL 3 | I108: TUCK 3 | K108: COX 2 | M108: O'FARRELL 2 | P108: JOHNSON | R108: NICHOLLS
A109: BENDIGO | C109: BROWN 2 | F109: SCHMIDT 2 | I109: ELLIOTT 2 | L109: ANDERSON 2 | O109: O'CALLAGHAN | R109: O'TOOLE | T109: NOLTE
A111: FRANKSTON | C111: 3 | D111: 4 | E111: =(C111*6)+D111 -> 22 | G111: 6 | H111: 7 | I111: =(G111*6)+H111 -> 43 | K111: 10 | L111: 10 | M111: =(K111*6)+L111 -> 70 | O111: 17 | P111: 11 | Q111: =(O111*6)+P111 -> 113 | S111: Venue: NORTH HOBART OVAL
A112: TASMANIA | C112: 1 | D112: 2 | E112: =(C112*6)+D112 -> 8 | G112: 7 | H112: 5 | I112: =(G112*6)+H112 -> 47 | K112: 9 | L112: 8 | M112: =(K112*6)+L112 -> 62 | O112: 11 | P112: 11 | Q112: =(O112*6)+P112 -> 77
A113: BEST PLAYERS
A114: FRANKSTON | C114: MALLOY | F114: SAUTNER | I114: LITTLE | L114: BURGMAN | O114: ROBERTS
A115: TASMANIA | C115: DAVIS | F115: HOWARD | I115: CALLINAN | L115: WOOLDRIDGE | O115: J BRERETON | R115: M BRERETON
A116: GOALKICKERS
A117: FRANKSTON | C117: SAUTNER 8 | F117: BEVERIDGE 3 | I117: WILLIAMS 2 | L117: MALLOY | N117: MATTHEWS | Q117: ABLETT | S117: LYNCH
A118: TASMANIA | C118: BEAUMONT 3 | F118: BOLTON 2 | I118: CALLINAN 2 | L118: TREVENA | N118: GEAPPIN | P118: BERNES | R118: HOWARD
D119: 15TH APRIL | J119: WEATHER
A120: WERRIBEE | C120: 8 | D120: 3 | E120: =(C120*6)+D120 -> 51 | G120: 12 | H120: 7 | I120: =(G120*6)+H120 -> 79 | K120: 16 | L120: 14 | M120: =(K120*6)+L120 -> 110 | O120: 19 | P120: 16 | Q120: =(O120*6)+P120 -> 130 | S120: Venue: WERRIBEE
A121: WILLIAMSTOWN | C121: 3 | D121: 2 | E121: =(C121*6)+D121 -> 20 | G121: 4 | H121: 2 | I121: =(G121*6)+H121 -> 26 | K121: 6 | L121: 2 | M121: =(K121*6)+L121 -> 38 | O121: 8 | P121: 6 | Q121: =(O121*6)+P121 -> 54
A122: BEST PLAYERS
A123: WERRIBEE | C123: DOOLEY | F123: ROBERTSON | I123: FAULKINER | L123: WILLIAMS | O123: McMAHON | R123: GARLICK
A124: WILLIAMSTOWN | C124: NASH | F124: WOOD
A125: GOALKICKERS
A126: WERRIBEE | C126: WIGGINS 5 | F126: CHURCHILL 2 | I126: FULLER 2 | K126: GARLICK 2 | N126: KRETIUK 2 | Q126: CONTESSA | S126: DOOLEY | U126: DYER | W126: SAUNDERS | X126: SHEAHAN | AA126: SMITH
A127: WILLIAMSTOWN | C127: SCOTLAND 2 | F127: ANDERSON | I127: DAVIS | K127: WEST | M127: KELLY | O127: SHAW | Q127: DIDAK
A129: MURRAY KANGAROOS | C129: 3 | D129: 0 | E129: =(C129*6)+D129 -> 18 | G129: 9 | H129: 4 | I129: =(G129*6)+H129 -> 58 | K129: 14 | L129: 7 | M129: =(K129*6)+L129 -> 91 | O129: 18 | P129: 10 | Q129: =(O129*6)+P129 -> 118 | S129: Venue: LAVINGTON
A130: PORT MELBOURNE | C130: 6 | D130: 2 | E130: =(C130*6)+D130 -> 38 | G130: 7 | H130: 5 | I130: =(G130*6)+H130 -> 47 | K130: 10 | L130: 9 | M130: =(K130*6)+L130 -> 69 | O130: 15 | P130: 10 | Q130: =(O130*6)+P130 -> 100
A131: BEST PLAYERS
A132: MURRAY KANGAROOS | C132: MARTYN | F132: McCORMICK | I132: MORRELL | L132: PRATT | O132: AINLEY | R132: TEAGUE
A133: PORT MELBOURNE | C133: BENNETT | F133: EVANS | I133: O'KEEFE | L133: J STEVENS | O133: BROCKMAN | R133: ANSTEY
A134: GOALKICKERS
A135: MURRAY KANGAROOS | C135: LANG 3 | E135: MORRELL 2 | H135: SMITH 2 | J135: WOODLEY 2 | M135: JONES 2 | O135: MARTYN 2 | Q135: McCORMICK | T135: LASSCOCK | W135: SPAULL | X135: HARDING | AA135: STEVENS
A136: PORT MELBOURNE | C136: J STEVENS 3 | F136: S STEVENS 2 | I136: PIUTZ 2 | K136: DELUCA 2 | M136: SPENCER | O136: EVANS | Q136: SUNDQUIST | T136: O'KEEFE | W136: McMAHON | X136: ABLETT
A138: SANDRINGHAM | C138: 1 | D138: 4 | E138: =(C138*6)+D138 -> 10 | G138: 4 | H138: 4 | I138: =(G138*6)+H138 -> 28 | K138: 9 | L138: 8 | M138: =(K138*6)+L138 -> 62 | O138: 13 | P138: 12 | Q138: =(O138*6)+P138 -> 90 | S138: Venue: BEACH ROAD
A139: GEELONG | C139: 3 | D139: 2 | E139: =(C139*6)+D139 -> 20 | G139: 6 | H139: 9 | I139: =(G139*6)+H139 -> 45 | K139: 8 | L139: 11 | M139: =(K139*6)+L139 -> 59 | O139: 9 | P139: 12 | Q139: =(O139*6)+P139 -> 66
A140: BEST PLAYERS
A141: SANDRINGHAM | C141: MACGEORGE | F141: HAYWOOD | I141: GODFREY | L141: WHEATLEY | O141: LYNCH | Q141: LAMB
A142: GEELONG | C142: LING | F142: MERRIMAN | I142: CHAPMAN | L142: McGRATH
A143: GOALKICKERS
A144: SANDRINGHAM | C144: LYNCH 4 | E144: THOMPSON 2 | H144: BEAMS | J144: FUNCKE | L144: GODFREY | N144: PITT | P144: HAYWOOD | R144: BROADBRIDGE | V144: MACGEORGE
A145: GEELONG | C145: BALDWIN 2 | F145: CLARK 2 | I145: LING 2 | K145: CHAPMAN | M145: KINGSLEY | O145: STREET
A147: COBURG | C147: 4 | D147: 4 | E147: =(C147*6)+D147 -> 28 | G147: 6 | H147: 8 | I147: =(G147*6)+H147 -> 44 | K147: 13 | L147: 10 | M147: =(K147*6)+L147 -> 88 | O147: 15 | P147: 15 | Q147: =(O147*6)+P147 -> 105 | S147: Venue: COBURG
A148: NORTHERN BULLANTS | C148: 4 | D148: 2 | E148: =(C148*6)+D148 -> 26 | G148: 8 | H148: 3 | I148: =(G148*6)+H148 -> 51 | K148: 10 | L148: 5 | M148: =(K148*6)+L148 -> 65 | O148: 14 | P148: 8 | Q148: =(O148*6)+P148 -> 92
A149: BEST PLAYERS
A150: COBURG | C150: PROCTOR | F150: HART | I150: TAYLOR | L150: DEPASQUALE | O150: EDNIE | Q150: HOMEWOOD
A151: NORTHERN BULLANTS | C151: WATSON | F151: PATTERSON | I151: ZORZI | L151: GRAINGER | O151: BLIGHT
A152: GOALKICKERS
A153: COBURG | C153: KRAKOUER 2 | F153: KAVANAGH 2 | I153: PETTIFER 2 | L153: POYAS | N153: NEWMAN | P153: TAYLOR | R153: HYDE | T153: HART | V153: DEPASQUALE | X153: EDNIE | Z153: PROCTOR | AB153: MILLS
A154: NORTHERN BULLANTS | C154: GRAINGER 4 | F154: VAN BLOMMESTEIN 3 | K154: WATSON 2 | N154: FAVRIN 2 | Q154: CANN | S154: RAMSAY | V154: BAILEY
A156: ROUND 3 | D156: 21ST APRIL | J156: WEATHER
D157: 1ST QTR | H157: 2ND QTR | L157: 3RD QTR | P157: FINAL | S157: Venue: OPTUS OVAL
A158: TASMANIA | C158: 5 | D158: 1 | E158: =(C158*6)+D158 -> 31 | G158: 6 | H158: 2 | I158: =(G158*6)+H158 -> 38 | K158: 10 | L158: 3 | M158: =(K158*6)+L158 -> 63 | O158: 15 | P158: 4 | Q158: =(O158*6)+P158 -> 94 | S158: UMPIRES | Y158: LADDER | AB158: ROUND | AD158: 3
A159: CARLTON | C159: 3 | D159: 2 | E159: =(C159*6)+D159 -> 20 | G159: 7 | H159: 5 | I159: =(G159*6)+H159 -> 47 | K159: 9 | L159: 7 | M159: =(K159*6)+L159 -> 61 | O159: 13 | P159: 7 | Q159: =(O159*6)+P159 -> 85
A160: BEST PLAYERS | W160: TEAM | X160: W | Y160: L | Z160: D | AA160: FOR | AB160: AGST | AC160: % | AD160: PTS
A161: TASMANIA | C161: HOWARD | F161: ALLEN | I161: CARTER | L161: PRACIAK | O161: DAVIS | Q161: J BRERETON
A162: CARLTON | C162: WIGGINS | F162: SPORN | I162: PLUNKETT | L162: PRENDERGAST | O162: WHITE | W162: WERRIBEE | X162: 3 | Y162: 0 | Z162: 0 | AA162: 203 | AB162: 107 | AC162: =(AA162/AB162)*100 -> 189.71962616822429 | AD162: =(X162*4)+(Z162*2) -> 12
A163: GOALKICKERS | W163: SPRINGVALE | X163: 3 | Y163: 0 | Z163: 0 | AA163: 264 | AB163: 181 | AC163: =(AA163/AB163)*100 -> 145.85635359116023 | AD163: =(X163*4)+(Z163*2) -> 12
A164: TASMANIA | C164: ALLEN 6 | F164: CARTER 4 | I164: PRACIAK 2 | L164: CALLINAN | N164: BOLTON | P164: BEAUMONT | W164: BOX HILL | X164: 3 | Y164: 0 | Z164: 0 | AA164: 349 | AB164: 242 | AC164: =(AA164/AB164)*100 -> 144.21487603305786 | AD164: =(X164*4)+(Z164*2) -> 12
A165: CARLTON | C165: SPORN 2 | E165: JACOTINE 2 | H165: VANCE 2 | J165: LIVINGSTONE | M165: MERRINGTON | P165: FLEMING | R165: PICKERING | W165: SANDRINGHAM | X165: 2 | Y165: 1 | Z165: 0 | AA165: 329 | AB165: 224 | AC165: =(AA165/AB165)*100 -> 146.875 | AD165: =(X165*4)+(Z165*2) -> 8
L166: DOERING | N166: McKEON | P166: CAMPBELL | W166: MURRAY KANGAROOS | X166: 2 | Y166: 1 | Z166: 0 | AA166: 280 | AB166: 231 | AC166: =(AA166/AB166)*100 -> 121.21212121212122 | AD166: =(X166*4)+(Z166*2) -> 8
A167: BOX HILL | C167: 5 | D167: 0 | E167: =(C167*6)+D167 -> 30 | G167: 7 | H167: 3 | I167: =(G167*6)+H167 -> 45 | K167: 11 | L167: 5 | M167: =(K167*6)+L167 -> 71 | O167: 16 | P167: 8 | Q167: =(O167*6)+P167 -> 104 | S167: Venue: BOX HILL | W167: FRANKSTON | X167: 2 | Y167: 1 | Z167: 0 | AA167: 257 | AB167: 213 | AC167: =(AA167/AB167)*100 -> 120.65727699530517 | AD167: =(X167*4)+(Z167*2) -> 8
A168: SANDRINGHAM | C168: 3 | D168: 3 | E168: =(C168*6)+D168 -> 21 | G168: 8 | H168: 7 | I168: =(G168*6)+H168 -> 55 | K168: 11 | L168: 9 | M168: =(K168*6)+L168 -> 75 | O168: 15 | P168: 11 | Q168: =(O168*6)+P168 -> 101 | W168: WILLIAMSTOWN | X168: 2 | Y168: 1 | Z168: 0 | AA168: 231 | AB168: 210 | AC168: =(AA168/AB168)*100 -> 110 | AD168: =(X168*4)+(Z168*2) -> 8
A169: BEST PLAYERS | W169: NORTH BALLARAT | X169: 2 | Y169: 1 | Z169: 0 | AA169: 255 | AB169: 263 | AC169: =(AA169/AB169)*100 -> 96.958174904942965 | AD169: =(X169*4)+(Z169*2) -> 8
A170: BOX HILL | C170: O'FARRELL | F170: JOHNSON | I170: DENT | K170: LOATS | N170: LONIE | Q170: BAIRD
A171: SANDRINGHAM | C171: WILSON | F171: GODFREY | I171: PITT | K171: TARPEY | N171: RADFORD | Q171: TREGEAR | W171: GEELONG | X171: 1 | Y171: 2 | Z171: 0 | AA171: 213 | AB171: 233 | AC171: =(AA171/AB171)*100 -> 91.416309012875544 | AD171: =(X171*4)+(Z171*2) -> 4
A172: GOALKICKERS | R172: OSBORNE | W172: PORT MELBOURNE | X172: 1 | Y172: 2 | Z172: 0 | AA172: 254 | AB172: 289 | AC172: =(AA172/AB172)*100 -> 87.889273356401389 | AD172: =(X172*4)+(Z172*2) -> 4
A173: BOX HILL | C173: HAZELL 3 | E173: HABERFIELD 2 | H173: TUCK 2 | J173: LOATS 2 | L173: BARLOW 2 | N173: DENT | P173: RIES | Q173: WILLIAMS | S173: BATEMAN | W173: COBURG | X173: 1 | Y173: 2 | Z173: 0 | AA173: 171 | AB173: 211 | AC173: =(AA173/AB173)*100 -> 81.042654028436019 | AD173: =(X173*4)+(Z173*2) -> 4
A174: SANDRINGHAM | C174: PITT 5 | E174: TEMPLETON 2 | H174: GODFREY 2 | J174: TARPEY 2 | M174: WILSON | O174: SULLIVAN | Q174: LYNCH | S174: BEAMS | W174: ESSENDON | X174: 1 | Y174: 2 | Z174: 0 | AA174: 228 | AB174: 287 | AC174: =(AA174/AB174)*100 -> 79.442508710801391 | AD174: =(X174*4)+(Z174*2) -> 4
W175: TASMANIA | X175: 1 | Y175: 2 | Z175: 0 | AA175: 225 | AB175: 336 | AC175: =(AA175/AB175)*100 -> 66.964285714285708 | AD175: =(X175*4)+(Z175*2) -> 4
A176: PORT MELBOURNE | C176: 4 | D176: 4 | E176: =(C176*6)+D176 -> 28 | G176: 7 | H176: 9 | I176: =(G176*6)+H176 -> 51 | K176: 9 | L176: 11 | M176: =(K176*6)+L176 -> 65 | O176: 14 | P176: 13 | Q176: =(O176*6)+P176 -> 97 | S176: Venue: PORT MELBOURNE | W176: CARLTON | X176: 0 | Y176: 3 | Z176: 0 | AA176: 223 | AB176: 293 | AC176: =(AA176/AB176)*100 -> 76.109215017064841 | AD176: =(X176*4)+(Z176*2) -> 0
A177: ESSENDON | C177: 3 | D177: 2 | E177: =(C177*6)+D177 -> 20 | G177: 4 | H177: 5 | I177: =(G177*6)+H177 -> 29 | K177: 6 | L177: 9 | M177: =(K177*6)+L177 -> 45 | O177: 8 | P177: 10 | Q177: =(O177*6)+P177 -> 58 | W177: NORTHERN BULLANTS | X177: 0 | Y177: 3 | Z177: 0 | AA177: 194 | AB177: 255 | AC177: =(AA177/AB177)*100 -> 76.078431372549019 | AD177: =(X177*4)+(Z177*2) -> 0
A178: BEST PLAYERS | W178: BENDIGO | X178: 0 | Y178: 3 | Z178: 0 | AA178: 207 | AB178: 308 | AC178: =(AA178/AB178)*100 -> 67.20779220779221 | AD178: =(X178*4)+(Z178*2) -> 0
A179: PORT MELBOURNE | C179: BENNETT | F179: FEAST | I179: O'KEEFE | L179: SWAN | N179: SPENCER | Q179: McMAHON
A180: ESSENDON | C180: RICHARDS | F180: DENHAM | I180: DAVIES | L180: ROBRAN | N180: CRANAGE
A181: GOALKICKERS | R181: KENNELLY
A182: PORT MELBOURNE | C182: SWAN 3 | E182: McMAHON 3 | H182: SPENCER 2 | J182: BUCHANAN | M182: ANSTEY | O182: PILTZ | Q182: JAMES | S182: STEVENS
A183: ESSENDON | C183: MAHONEY 3 | F183: ROBRAN 2 | I183: DENHAM 2 | L183: MURPHY
A185: WILLIAMSTOWN | C185: 6 | D185: 3 | E185: =(C185*6)+D185 -> 39 | G185: 6 | H185: 8 | I185: =(G185*6)+H185 -> 44 | K185: 9 | L185: 14 | M185: =(K185*6)+L185 -> 68 | O185: 10 | P185: 17 | Q185: =(O185*6)+P185 -> 77 | S185: Venue: WILLIAMSTOWN
A186: COBURG | C186: 0 | D186: 3 | E186: =(C186*6)+D186 -> 3 | G186: 1 | H186: 4 | I186: =(G186*6)+H186 -> 10 | K186: 2 | L186: 5 | M186: =(K186*6)+L186 -> 17 | O186: 4 | P186: 8 | Q186: =(O186*6)+P186 -> 32
A187: BEST PLAYERS
A188: WILLIAMSTOWN | C188: TAYLOR | F188: STONE | I188: ROUND | L188: SCOTLAND | O188: WASLEY | Q188: SHAW
A189: COBURG | C189: EDNIE | F189: O'BRIEN | I189: LAPPIN | L189: MILLS
A190: GOALKICKERS
A191: WILLIAMSTOWN | C191: TAYLOR | E191: LLOYD | G191: SHAW | I191: BAYNES | K191: KINNEAR | M191: STONE | O191: LANE | Q191: SMOKER | S191: LOVETT-MURRAY | X191: SCOTLAND
A192: COBURG | C192: HOMEWOOD | F192: EDNIE | H192: O'BRIEN | J192: PETTIFER
D193: 22ND APRIL | J193: WEATHER
A194: GEELONG | C194: 0 | D194: 0 | E194: =(C194*6)+D194 -> 0 | G194: 2 | H194: 1 | I194: =(G194*6)+H194 -> 13 | K194: 4 | L194: 4 | M194: =(K194*6)+L194 -> 28 | O194: 7 | P194: 6 | Q194: =(O194*6)+P194 -> 48 | S194: Venue: SHELL STADIUM (C/R)
A195: MURRAY KANGAROOS | C195: 3 | D195: 3 | E195: =(C195*6)+D195 -> 21 | G195: 4 | H195: 5 | I195: =(G195*6)+H195 -> 29 | K195: 5 | L195: 7 | M195: =(K195*6)+L195 -> 37 | O195: 6 | P195: 7 | Q195: =(O195*6)+P195 -> 43
A196: BEST PLAYERS
A197: GEELONG | C197: C MOONEY | F197: McGRATH | I197: NICOLSON | L197: CORRIGAN | O197: HUNT | Q197: ROOKE
A198: MURRAY KANGAROOS | C198: TEAGUE | F198: OLARENSHAW | I198: PETRIE | L198: MOTLOP | O198: MORRELL
A199: GOALKICKERS
A200: GEELONG | C200: McGRATH 2 | F200: BALDWIN | I200: BRAY | K200: KINGSLEY | N200: SPOLDING | Q200: RYAN
A201: MURRAY KANGAROOS | C201: PETRIE 2 | F201: L SMITH | I201: McCORMICK | L201: HARDING | N201: S MOTLOP
A203: WERRIBEE | C203: 1 | D203: 3 | E203: =(C203*6)+D203 -> 9 | G203: 1 | H203: 4 | I203: =(G203*6)+H203 -> 10 | K203: 1 | L203: 10 | M203: =(K203*6)+L203 -> 16 | O203: 3 | P203: 13 | Q203: =(O203*6)+P203 -> 31 | S203: Venue: PRESTON
A204: NORTHERN BULLANTS | C204: 0 | D204: 0 | E204: =(C204*6)+D204 -> 0 | G204: 2 | H204: 4 | I204: =(G204*6)+H204 -> 16 | K204: 2 | L204: 5 | M204: =(K204*6)+L204 -> 17 | O204: 2 | P204: 7 | Q204: =(O204*6)+P204 -> 19
A205: BEST PLAYERS
A206: WERRIBEE | C206: FAULKINER | F206: DOOLEY | I206: FROST | K206: McMAHON | N206: CONTESSA | Q206: ROBERTSON
A207: NORTHERN BULLANTS | C207: PENN | F207: BONNADIO | I207: BAILEY | K207: WATSON | N207: CUSACK | Q207: EVANS
A208: GOALKICKERS
A209: WERRIBEE | C209: WIGGINS | F209: SMITH | I209: BIRSS
A210: NORTHERN BULLANTS | C210: GRAINGER | F210: VAN BLOMMESTEIN
A212: NORTH BALLARAT | C212: 0 | D212: 2 | E212: =(C212*6)+D212 -> 2 | G212: 5 | H212: 6 | I212: =(G212*6)+H212 -> 36 | K212: 8 | L212: 8 | M212: =(K212*6)+L212 -> 56 | O212: 13 | P212: 9 | Q212: =(O212*6)+P212 -> 87 | S212: Venue: BENDIGO
A213: BENDIGO | C213: 6 | D213: 3 | E213: =(C213*6)+D213 -> 39 | G213: 9 | H213: 3 | I213: =(G213*6)+H213 -> 57 | K213: 11 | L213: 6 | M213: =(K213*6)+L213 -> 72 | O213: 13 | P213: 7 | Q213: =(O213*6)+P213 -> 85
A214: BEST PLAYERS
A215: NORTH BALLARAT | C215: J POLKINGHORNE | G215: CLAYTON | J215: INKSTER | M215: RUYG | P215: HUTCHINSON | S215: MURRIHY
A216: BENDIGO | C216: CAIL | G216: BROWN | J216: O'TOOLE | M216: DICKSON | P216: WOOTTON
A217: GOALKICKERS
A218: NORTH BALLARAT | C218: COLLARD 4 | F218: BRADLY 2 | I218: BYE 2 | K218: CLAYTON | M218: JENKINS | O218: RUYG | Q218: BAKER | S218: McMAHON
A219: BENDIGO | C219: BROWN 6 | F219: O'TOOLE 3 | I219: CAMPBELL 2 | L219: KEOWN | N219: ATKINS
A221: SPRINGVALE | C221: 2 | D221: 1 | E221: =(C221*6)+D221 -> 13 | G221: 2 | H221: 2 | I221: =(G221*6)+H221 -> 14 | K221: 5 | L221: 5 | M221: =(K221*6)+L221 -> 35 | O221: 6 | P221: 7 | Q221: =(O221*6)+P221 -> 43 | S221: Venue: FRANKSTON
A222: FRANKSTON | C222: 1 | D222: 1 | E222: =(C222*6)+D222 -> 7 | G222: 3 | H222: 1 | I222: =(G222*6)+H222 -> 19 | K222: 4 | L222: 2 | M222: =(K222*6)+L222 -> 26 | O222: 4 | P222: 3 | Q222: =(O222*6)+P222 -> 27
A223: BEST PLAYERS
A224: SPRINGVALE | C224: HARRISON | F224: TROLLOPE | I224: LOGAN | K224: DAVIS | M224: ROBBINS | O224: CARMODY
A225: FRANKSTON | C225: NOTT | F225: D CLARKE
A226: GOALKICKERS
A227: SPRINGVALE | C227: WALTON 2 | F227: LOGAN | H227: O'BRIEN | J227: ROBBINS | M227: SMITH
A228: FRANKSTON | C228: WILLIAMS 2 | F228: ABLETT | H228: SAUTNER
A230: ROUND 4 | D230: 28TH APRIL | J230: WEATHER
D231: 1ST QTR | H231: 2ND QTR | L231: 3RD QTR | P231: FINAL | S231: Venue: OPTUS OVAL
A232: SPRINGVALE | C232: 2 | D232: 0 | E232: =(C232*6)+D232 -> 12 | G232: 6 | H232: 2 | I232: =(G232*6)+H232 -> 38 | K232: 8 | L232: 10 | M232: =(K232*6)+L232 -> 58 | O232: 11 | P232: 12 | Q232: =(O232*6)+P232 -> 78 | S232: UMPIRES | Y232: LADDER | AB232: ROUND | AD232: 4
A233: CARLTON | C233: 2 | D233: 2 | E233: =(C233*6)+D233 -> 14 | G233: 2 | H233: 6 | I233: =(G233*6)+H233 -> 18 | K233: 3 | L233: 10 | M233: =(K233*6)+L233 -> 28 | O233: 6 | P233: 11 | Q233: =(O233*6)+P233 -> 47
A234: BEST PLAYERS | W234: TEAM | X234: W | Y234: L | Z234: D | AA234: FOR | AB234: AGST | AC234: % | AD234: PTS
A235: SPRINGVALE | C235: HARRISON | F235: KNOWLES | I235: RIGG | K235: BERRY | N235: WALTON | Q235: CARROLL
A236: CARLTON | C236: FLEMMING | F236: LIVINGSTONE | I236: CRANAGE | W236: WERRIBEE | X236: 4 | Y236: 0 | Z236: 0 | AA236: 308 | AB236: 159 | AC236: =(AA236/AB236)*100 -> 193.71069182389937 | AD236: =(X236*4)+(Z236*2) -> 16
A237: GOALKICKERS | W237: SPRINGVALE | X237: 4 | Y237: 0 | Z237: 0 | AA237: 342 | AB237: 228 | AC237: =(AA237/AB237)*100 -> 150 | AD237: =(X237*4)+(Z237*2) -> 16
A238: SPRINGVALE | C238: BERRY 4 | F238: SMITH 3 | I238: KNOWLES 2 | L238: ELLIOTT | N238: PITT | W238: MURRAY KANGAROOS | X238: 3 | Y238: 1 | Z238: 0 | AA238: 445 | AB238: 315 | AC238: =(AA238/AB238)*100 -> 141.26984126984127 | AD238: =(X238*4)+(Z238*2) -> 12
A239: CARLTON | C239: FLEMMING 2 | F239: LIVINGSTONE 2 | J239: CRANAGE | M239: WHITE | W239: BOX HILL | X239: 3 | Y239: 1 | Z239: 0 | AA239: 401 | AB239: 347 | AC239: =(AA239/AB239)*100 -> 115.56195965417868 | AD239: =(X239*4)+(Z239*2) -> 12
W240: NORTH BALLARAT | X240: 3 | Y240: 1 | Z240: 0 | AA240: 331 | AB240: 334 | AC240: =(AA240/AB240)*100 -> 99.101796407185631 | AD240: =(X240*4)+(Z240*2) -> 12
A241: ESSENDON | C241: 5 | D241: 2 | E241: =(C241*6)+D241 -> 32 | G241: 5 | H241: 11 | I241: =(G241*6)+H241 -> 41 | K241: 7 | L241: 16 | M241: =(K241*6)+L241 -> 58 | O241: 9 | P241: 17 | Q241: =(O241*6)+P241 -> 71 | S241: Venue: WINDY HILL | W241: SANDRINGHAM | X241: 2 | Y241: 2 | Z241: 0 | AA241: 408 | AB241: 310 | AC241: =(AA241/AB241)*100 -> 131.61290322580646 | AD241: =(X241*4)+(Z241*2) -> 8
A242: WILLIAMSTOWN | C242: 4 | D242: 2 | E242: =(C242*6)+D242 -> 26 | G242: 6 | H242: 3 | I242: =(G242*6)+H242 -> 39 | K242: 8 | L242: 4 | M242: =(K242*6)+L242 -> 52 | O242: 10 | P242: 9 | Q242: =(O242*6)+P242 -> 69 | W242: WILLIAMSTOWN | X242: 2 | Y242: 2 | Z242: 0 | AA242: 300 | AB242: 281 | AC242: =(AA242/AB242)*100 -> 106.76156583629893 | AD242: =(X242*4)+(Z242*2) -> 8
A243: BEST PLAYERS | W243: GEELONG | X243: 2 | Y243: 2 | Z243: 0 | AA243: 326 | AB243: 307 | AC243: =(AA243/AB243)*100 -> 106.18892508143323 | AD243: =(X243*4)+(Z243*2) -> 8
A244: ESSENDON | C244: McGRATH | F244: LALICH | I244: ROBRAN | L244: BOLTON | N244: MOORCROFT | Q244: DENHAM
A245: WILLIAMSTOWN | C245: WEST | F245: CLOKE | I245: KINNEAR | L245: STONE | W245: FRANKSTON | X245: 2 | Y245: 2 | Z245: 0 | AA245: 331 | AB245: 326 | AC245: =(AA245/AB245)*100 -> 101.53374233128834 | AD245: =(X245*4)+(Z245*2) -> 8
A246: GOALKICKERS | W246: PORT MELBOURNE | X246: 2 | Y246: 2 | Z246: 0 | AA246: 340 | AB246: 368 | AC246: =(AA246/AB246)*100 -> 92.391304347826093 | AD246: =(X246*4)+(Z246*2) -> 8
A247: ESSENDON | C247: McALISTER 2 | F247: MAHONEY 2 | I247: DAVIS | K247: MOORCROFT | N247: WALLIS | P247: D JOHNSON | R247: McGRATH | W247: ESSENDON | X247: 2 | Y247: 2 | Z247: 0 | AA247: 299 | AB247: 356 | AC247: =(AA247/AB247)*100 -> 83.988764044943821 | AD247: =(X247*4)+(Z247*2) -> 8
A248: WILLIAMSTOWN | C248: TUCKEY 2 | F248: LANE 2 | I248: KINNEAR 2 | L248: TAYLOR | N248: WOOD | P248: DIDACK | R248: UKOVIC | W248: NORTHERN BULLANTS | X248: 1 | Y248: 3 | Z248: 0 | AA248: 316 | AB248: 313 | AC248: =(AA248/AB248)*100 -> 100.95846645367412 | AD248: =(X248*4)+(Z248*2) -> 4
W249: COBURG | X249: 1 | Y249: 3 | Z249: 0 | AA249: 242 | AB249: 287 | AC249: =(AA249/AB249)*100 -> 84.320557491289193 | AD249: =(X249*4)+(Z249*2) -> 4
A250: NORTH BALLARAT | C250: 2 | D250: 5 | E250: =(C250*6)+D250 -> 17 | G250: 5 | H250: 10 | I250: =(G250*6)+H250 -> 40 | K250: 8 | L250: 15 | M250: =(K250*6)+L250 -> 63 | O250: 10 | P250: 16 | Q250: =(O250*6)+P250 -> 76 | S250: NORTH BALLARAT | W250: TASMANIA | X250: 1 | Y250: 3 | Z250: 0 | AA250: 309 | AB250: 501 | AC250: =(AA250/AB250)*100 -> 61.676646706586823 | AD250: =(X250*4)+(Z250*2) -> 4
A251: COBURG | C251: 1 | D251: 4 | E251: =(C251*6)+D251 -> 10 | G251: 4 | H251: 6 | I251: =(G251*6)+H251 -> 30 | K251: 7 | L251: 10 | M251: =(K251*6)+L251 -> 52 | O251: 10 | P251: 11 | Q251: =(O251*6)+P251 -> 71 | W251: CARLTON | X251: 0 | Y251: 4 | Z251: 0 | AA251: 270 | AB251: 340 | AC251: =(AA251/AB251)*100 -> 79.411764705882348 | AD251: =(X251*4)+(Z251*2) -> 0
A252: BEST PLAYERS | W252: BENDIGO | X252: 0 | Y252: 4 | Z252: 0 | AA252: 265 | AB252: 430 | AC252: =(AA252/AB252)*100 -> 61.627906976744185 | AD252: =(X252*4)+(Z252*2) -> 0
A253: NORTH BALLARAT | C253: J POLKINGHORNE | G253: CLAYTON | J253: INKSTER | M253: SOMERVILLE | P253: McMAHON | R253: HUTCHINSON
A254: COBURG | C254: ZANTUCK | G254: O'BRIEN | J254: VARDY | M254: LAPPIN | P254: POYAS | R254: PETTIFER
A255: GOALKICKERS | O255: JENKINS | Q255: SOMERVILLE
A256: NORTH BALLARAT | C256: WEATHERLEY 2 | F256: J POLKINGHORNE | J256: COLLARD | L256: BRADLY | N256: BAKER | P256: McMAHON | R256: INKSTER
A257: COBURG | C257: POYAS 3 | F257: TAYLOR 2 | I257: NEWMAN | K257: LANG | M257: EDNIE | O257: MILLS | Q257: PROCTOR
A259: PORT MELBOURNE | C259: 4 | D259: 1 | E259: =(C259*6)+D259 -> 25 | G259: 7 | H259: 2 | I259: =(G259*6)+H259 -> 44 | K259: 10 | L259: 5 | M259: =(K259*6)+L259 -> 65 | O259: 13 | P259: 8 | Q259: =(O259*6)+P259 -> 86 | S259: Venue: BEACH ROAD
A260: SANDRINGHAM | C260: 4 | D260: 5 | E260: =(C260*6)+D260 -> 29 | G260: 7 | H260: 8 | I260: =(G260*6)+H260 -> 50 | K260: 10 | L260: 13 | M260: =(K260*6)+L260 -> 73 | O260: 10 | P260: 19 | Q260: =(O260*6)+P260 -> 79
A261: BEST PLAYERS
A262: PORT MELBOURNE | C262: BROCKMAN | F262: FILANDIA | I262: KENNELLY | L262: LUFF | N262: BUCHANAN | Q262: S STEVENS
A263: SANDRINGHAM | C263: BROADBRIDGE | F263: LAMB | I263: JOLLY | L263: WILSON | N263: McNICHOLAS
A264: GOALKICKERS
A265: PORT MELBOURNE | C265: BUCHANAN 2 | F265: FILANDIA 2 | I265: S STEVENS 2 | L265: ABLETT 2 | N265: DOYLE | P265: LUFF | Q265: SWAN | S265: ALEXANDER | V265: KENNELLY
A266: SANDRINGHAM | C266: TEMPLETON 4 | F266: WILSON | H266: PITT | I266: FUNCKE | K266: COGHLAN | M266: BEAMS | O266: THOMPSON
D267: 29TH APRIL | J267: WEATHER
A268: GEELONG | C268: 3 | D268: 5 | E268: =(C268*6)+D268 -> 23 | G268: 9 | H268: 8 | I268: =(G268*6)+H268 -> 62 | K268: 12 | L268: 13 | M268: =(K268*6)+L268 -> 85 | O268: 16 | P268: 17 | Q268: =(O268*6)+P268 -> 113 | S268: Venue: SHELL STADIUM (C/R)
A269: FRANKSTON | C269: 3 | D269: 2 | E269: =(C269*6)+D269 -> 20 | G269: 5 | H269: 5 | I269: =(G269*6)+H269 -> 35 | K269: 8 | L269: 8 | M269: =(K269*6)+L269 -> 56 | O269: 10 | P269: 14 | Q269: =(O269*6)+P269 -> 74
A270: BEST PLAYERS
A271: GEELONG | C271: CHAMBERS | F271: NICOLSON | I271: McGRATH | L271: KINGSLEY | O271: HOULIHAN | R271: BAUER
A272: FRANKSTON | C272: D CLARKE | F272: GEORGIOU
A273: GOALKICKERS
A274: GEELONG | C274: BALDWIN 5 | F274: HOULIHAN 4 | I274: KINGSLEY 3 | L274: McGRATH 2 | O274: CORRIGAN | R274: MERRIMAN
A275: FRANKSTON | C275: SAUTNER 5 | F275: GEORGIOU 2 | I275: SALISBURY | L275: MALLOY | N275: GREIG
A277: WERRIBEE | C277: 4 | D277: 1 | E277: =(C277*6)+D277 -> 25 | G277: 6 | H277: 3 | I277: =(G277*6)+H277 -> 39 | K277: 10 | L277: 8 | M277: =(K277*6)+L277 -> 68 | O277: 16 | P277: 9 | Q277: =(O277*6)+P277 -> 105 | S277: Venue: WERRIBEE
A278: BOX HILL | C278: 1 | D278: 6 | E278: =(C278*6)+D278 -> 12 | G278: 4 | H278: 8 | I278: =(G278*6)+H278 -> 32 | K278: 5 | L278: 11 | M278: =(K278*6)+L278 -> 41 | O278: 6 | P278: 16 | Q278: =(O278*6)+P278 -> 52
A279: BEST PLAYERS
A280: WERRIBEE | C280: ALVEY | F280: BIRSS | I280: ROBERTSON | L280: FAULKINER | O280: WIGGINS | Q280: FROST
A281: BOX HILL | C281: BATEMAN | F281: BREWER | I281: BAIRD | L281: O'FARRELL | O281: GREENE | Q281: RIES
A282: GOALKICKERS
A283: WERRIBEE | C283: McMAHON 4 | F283: BIRSS 4 | I283: WIGGINS 3 | L283: ALVEY 2 | N283: CHURCHILL | Q283: FAULKINER | T283: SHEAHAN
A284: BOX HILL | C284: BARLOW | F284: SMITH | I284: BAIRD | K284: OSBORNE | N284: PASSADOR | Q284: TUCK
A286: MURRAY KANGAROOS | C286: 3 | D286: 4 | E286: =(C286*6)+D286 -> 22 | G286: 11 | H286: 10 | I286: =(G286*6)+H286 -> 76 | K286: 17 | L286: 12 | M286: =(K286*6)+L286 -> 114 | O286: 25 | P286: 15 | Q286: =(O286*6)+P286 -> 165 | S286: Venue: DEVONPORT
A287: TASMANIA | C287: 3 | D287: 2 | E287: =(C287*6)+D287 -> 20 | G287: 5 | H287: 4 | I287: =(G287*6)+H287 -> 34 | K287: 9 | L287: 10 | M287: =(K287*6)+L287 -> 64 | O287: 12 | P287: 12 | Q287: =(O287*6)+P287 -> 84
A288: BEST PLAYERS
A289: MURRAY KANGAROOS | C289: MORRELL | F289: TEAGUE | I289: McLAREN | L289: HARDING | N289: MOTLOP | Q289: D SMITH
A290: TASMANIA | C290: DAVIS | F290: HOWARD | I290: WALKER | L290: COLE | N290: HUM | Q290: McKENDRICK
A291: GOALKICKERS
A292: MURRAY KANGAROOS | C292: MORRELL 7 | F292: HARDING 5 | I292: CALTHORPE 3 | L292: SMITH 3 | N292: CLAYTON 2 | Q292: PETRIE | S292: RAWLINGS | V292: CORCORAN | X292: LANGE | Z292: STEVENS
A293: TASMANIA | C293: BEAUMONT 6 | F293: WALKER 2 | I293: CALLINAN | L293: GEAPPEN | N293: ALLEN | P293: WILSON
A295: NORTHERN BULLANTS | C295: 2 | D295: 4 | E295: =(C295*6)+D295 -> 16 | G295: 8 | H295: 8 | I295: =(G295*6)+H295 -> 56 | K295: 12 | L295: 12 | M295: =(K295*6)+L295 -> 84 | O295: 18 | P295: 14 | Q295: =(O295*6)+P295 -> 122 | S295: Venue: PRESTON
A296: BENDIGO | C296: 2 | D296: 2 | E296: =(C296*6)+D296 -> 14 | G296: 2 | H296: 3 | I296: =(G296*6)+H296 -> 15 | K296: 5 | L296: 4 | M296: =(K296*6)+L296 -> 34 | O296: 9 | P296: 4 | Q296: =(O296*6)+P296 -> 58
A297: BEST PLAYERS
A298: NORTHERN BULLANTS | C298: CANN | F298: WATSON | I298: BLIGHT | L298: RASO | N298: BONNADIO | Q298: ZORZI
A299: BENDIGO | C299: TOINTON | F299: CARTER | I299: ATKINS | L299: CAIL | N299: ELLIOT
A300: GOALKICKERS
A301: NORTHERN BULLANTS | C301: FAVRIN 4 | E301: GRAINGER 3 | H301: WATSON 3 | K301: VAN BLOMMESTEIN 3 | P301: CANN 2 | R301: CARACELLA | U301: ZORZI | W301: COLLINS
A302: BENDIGO | C302: O'CALLAGHAN 2 | G302: ANDREWS | I302: CAMPBELL | K302: GEDDES | M302: O'TOOLE | O302: PLIM | Q302: SCHMIDT | S302: ELLIOT
A304: ROUND 5 | D304: 5TH MAY | J304: WEATHER
D305: 1ST QTR | H305: 2ND QTR | L305: 3RD QTR | P305: FINAL | S305: Venue: COBURG (MURRAY KANGAROOS. home game)
A306: MURRAY KANGAROOS | C306: 7 | D306: 3 | E306: =(C306*6)+D306 -> 45 | G306: 12 | H306: 6 | I306: =(G306*6)+H306 -> 78 | K306: 15 | L306: 8 | M306: =(K306*6)+L306 -> 98 | O306: 19 | P306: 14 | Q306: =(O306*6)+P306 -> 128 | S306: UMPIRES | Y306: LADDER | AB306: ROUND | AD306: 5
A307: COBURG | C307: 0 | D307: 2 | E307: =(C307*6)+D307 -> 2 | G307: 4 | H307: 6 | I307: =(G307*6)+H307 -> 30 | K307: 8 | L307: 9 | M307: =(K307*6)+L307 -> 57 | O307: 12 | P307: 10 | Q307: =(O307*6)+P307 -> 82
A308: BEST PLAYERS | W308: TEAM | X308: W | Y308: L | Z308: D | AA308: FOR | AB308: AGST | AC308: % | AD308: PTS
A309: MURRAY KANGAROOS | C309: SPAULL | F309: WATT | I309: GRANT | L309: LANGE | O309: RAWLINGS | R309: WOODLEY
A310: COBURG | C310: PETTIFER | F310: PIGGOTT | I310: PAGAN | L310: HOMEWOOD | O310: NEWMAN | W310: WERRIBEE | X310: 5 | Y310: 0 | Z310: 0 | AA310: 413 | AB310: 247 | AC310: =(AA310/AB310)*100 -> 167.2064777327935 | AD310: =(X310*4)+(Z310*2) -> 20
A311: GOALKICKERS | Q311: BURTON | W311: SPRINGVALE | X311: 5 | Y311: 0 | Z311: 0 | AA311: 421 | AB311: 305 | AC311: =(AA311/AB311)*100 -> 138.03278688524588 | AD311: =(X311*4)+(Z311*2) -> 20
A312: MURRAY KANGAROOS | C312: HARDING 5 | F312: LANGE 5 | H312: SMITH 2 | J312: CALTHORPE 2 | M312: SPAULL 2 | O312: CORCORAN | R312: McCORMICK | W312: BOX HILL | X312: 4 | Y312: 1 | Z312: 0 | AA312: 591 | AB312: 383 | AC312: =(AA312/AB312)*100 -> 154.30809399477806 | AD312: =(X312*4)+(Z312*2) -> 16
A313: COBURG | C313: PIGGOTT 4 | F313: KRAKOUER 2 | I313: PETTIFER | K313: POYAS | M313: PAGAN | O313: MILLS | Q313: TAYLOR | S313: ZANTUCK | W313: MURRAY KANGAROOS | X313: 4 | Y313: 1 | Z313: 0 | AA313: 573 | AB313: 397 | AC313: =(AA313/AB313)*100 -> 144.33249370277076 | AD313: =(X313*4)+(Z313*2) -> 16
W314: SANDRINGHAM | X314: 3 | Y314: 2 | Z314: 0 | AA314: 504 | AB314: 368 | AC314: =(AA314/AB314)*100 -> 136.95652173913044 | AD314: =(X314*4)+(Z314*2) -> 12
A315: ESSENDON | C315: 3 | D315: 9 | E315: =(C315*6)+D315 -> 27 | G315: 9 | H315: 14 | I315: =(G315*6)+H315 -> 68 | K315: 15 | L315: 17 | M315: =(K315*6)+L315 -> 107 | O315: 18 | P315: 19 | Q315: =(O315*6)+P315 -> 127 | S315: Venue: WINDY HILL | W315: GEELONG | X315: 3 | Y315: 2 | Z315: 0 | AA315: 409 | AB315: 383 | AC315: =(AA315/AB315)*100 -> 106.78851174934725 | AD315: =(X315*4)+(Z315*2) -> 12
A316: NORTH BALLARAT | C316: 1 | D316: 3 | E316: =(C316*6)+D316 -> 9 | G316: 3 | H316: 3 | I316: =(G316*6)+H316 -> 21 | K316: 6 | L316: 7 | M316: =(K316*6)+L316 -> 43 | O316: 10 | P316: 10 | Q316: =(O316*6)+P316 -> 70 | W316: ESSENDON | X316: 3 | Y316: 2 | Z316: 0 | AA316: 426 | AB316: 426 | AC316: =(AA316/AB316)*100 -> 100 | AD316: =(X316*4)+(Z316*2) -> 12
A317: BEST PLAYERS | W317: NORTH BALLARAT | X317: 3 | Y317: 2 | Z317: 0 | AA317: 401 | AB317: 461 | AC317: =(AA317/AB317)*100 -> 86.984815618221262 | AD317: =(X317*4)+(Z317*2) -> 12
A318: ESSENDON | C318: BOLTON | F318: ROBRAN | I318: BULLEN | L318: McGRATH | O318: SWITALA | R318: LALICH
A319: NORTH BALLARAT | C319: CLAYTON | F319: RYALL | I319: INKSTER | L319: JENKINS | W319: FRANKSTON | X319: 2 | Y319: 3 | Z319: 0 | AA319: 414 | AB319: 431 | AC319: =(AA319/AB319)*100 -> 96.055684454756388 | AD319: =(X319*4)+(Z319*2) -> 8
A320: GOALKICKERS | P320: SWITALA | R320: McALISTER | W320: WILLIAMSTOWN | X320: 2 | Y320: 3 | Z320: 0 | AA320: 366 | AB320: 392 | AC320: =(AA320/AB320)*100 -> 93.367346938775512 | AD320: =(X320*4)+(Z320*2) -> 8
A321: ESSENDON | C321: McGRATH 4 | F321: MAHONEY 4 | I321: HALL 3 | K321: HILLE | M321: LALICH | O321: BULLEN | Q321: BOLTON | S321: DAVIS | W321: PORT MELBOURNE | X321: 2 | Y321: 3 | Z321: 0 | AA321: 417 | AB321: 448 | AC321: =(AA321/AB321)*100 -> 93.080357142857139 | AD321: =(X321*4)+(Z321*2) -> 8
A322: NORTH BALLARAT | C322: COLLARD 3 | F322: WEATHERLEY 2 | J322: McMAHON | M322: INKSTER | O322: JENKINS | Q322: RYALL | S322: BAKER | W322: NORTHERN BULLANTS | X322: 1 | Y322: 4 | Z322: 0 | AA322: 392 | AB322: 396 | AC322: =(AA322/AB322)*100 -> 98.98989898989899 | AD322: =(X322*4)+(Z322*2) -> 4
W323: CARLTON | X323: 1 | Y323: 4 | Z323: 0 | AA323: 381 | AB323: 406 | AC323: =(AA323/AB323)*100 -> 93.842364532019701 | AD323: =(X323*4)+(Z323*2) -> 4
A324: BOX HILL | C324: 4 | D324: 7 | E324: =(C324*6)+D324 -> 31 | G324: 11 | H324: 15 | I324: =(G324*6)+H324 -> 81 | K324: 17 | L324: 19 | M324: =(K324*6)+L324 -> 121 | O324: 28 | P324: 22 | Q324: =(O324*6)+P324 -> 190 | S324: Venue: BOX HILL | W324: COBURG | X324: 1 | Y324: 4 | Z324: 0 | AA324: 324 | AB324: 415 | AC324: =(AA324/AB324)*100 -> 78.07228915662651 | AD324: =(X324*4)+(Z324*2) -> 4
A325: TASMANIA | C325: 3 | D325: 1 | E325: =(C325*6)+D325 -> 19 | G325: 4 | H325: 3 | I325: =(G325*6)+H325 -> 27 | K325: 4 | L325: 6 | M325: =(K325*6)+L325 -> 30 | O325: 5 | P325: 6 | Q325: =(O325*6)+P325 -> 36 | W325: TASMANIA | X325: 1 | Y325: 4 | Z325: 0 | AA325: 345 | AB325: 691 | AC325: =(AA325/AB325)*100 -> 49.927641099855279 | AD325: =(X325*4)+(Z325*2) -> 4
A326: BEST PLAYERS | W326: BENDIGO | X326: 0 | Y326: 5 | Z326: 0 | AA326: 323 | AB326: 526 | AC326: =(AA326/AB326)*100 -> 61.406844106463879 | AD326: =(X326*4)+(Z326*2) -> 0
A327: BOX HILL | C327: JOHNSON | F327: CAMPBELL | I327: COX | K327: ROCK | N327: GREENE | Q327: PASSADOR
A328: TASMANIA | C328: BRERETON | F328: GEAPPEN | I328: PROBERT | K328: WILSON
A329: GOALKICKERS | L329: COLLINS | N329: JOHNSON | P329: OSBORNE | R329: RIES | S329: ROCK
A330: BOX HILL | C330: PASSADOR 6 | F330: GREENE 4 | I330: HAZELL 3 | K330: LONIE 3 | M330: TUCK 3 | O330: PUGSLEY 2 | Q330: WILLIAMS 2
A331: TASMANIA | C331: ALLEN | E331: PRACIAK | G331: GEAPPEN | I331: ATKIN | K331: CARTER
D332: 6TH MAY | J332: WEATHER
A333: CARLTON | C333: 4 | D333: 3 | E333: =(C333*6)+D333 -> 27 | G333: 7 | H333: 10 | I333: =(G333*6)+H333 -> 52 | K333: 11 | L333: 11 | M333: =(K333*6)+L333 -> 77 | O333: 16 | P333: 15 | Q333: =(O333*6)+P333 -> 111 | S333: Venue: M.C.G. (C/R)
A334: WILLIAMSTOWN | C334: 3 | D334: 5 | E334: =(C334*6)+D334 -> 23 | G334: 5 | H334: 9 | I334: =(G334*6)+H334 -> 39 | K334: 7 | L334: 11 | M334: =(K334*6)+L334 -> 53 | O334: 9 | P334: 12 | Q334: =(O334*6)+P334 -> 66
A335: BEST PLAYERS
A336: CARLTON | C336: MERRINGTON | F336: CRANAGE | I336: NELSON | K336: PRENDERGAST | N336: CULPITT | Q336: CHRISTOU
A337: WILLIAMSTOWN | C337: ROACH | F337: CLOKE | I337: DIDAK | K337: WEST | N337: ANDERSON
A338: GOALKICKERS
A339: CARLTON | C339: MERRINGTON 4 | F339: CULPITT 3 | I339: WIGGINS 2 | L339: WHITE 2 | N339: NELSON | P339: CRANAGE | R339: PRENDERGAST | V339: FLEMING | X339: SINNOT
A340: WILLIAMSTOWN | C340: TUCKEY 2 | F340: ROUND 2 | I340: KINNEAR | K340: ROACH | M340: DIDAK | O340: LANE | Q340: LOVETT-MURRAY
A342: SPRINGVALE | C342: 2 | D342: 6 | E342: =(C342*6)+D342 -> 18 | G342: 4 | H342: 9 | I342: =(G342*6)+H342 -> 33 | K342: 9 | L342: 13 | M342: =(K342*6)+L342 -> 67 | O342: 11 | P342: 13 | Q342: =(O342*6)+P342 -> 79 | S342: Venue: MOORABBIN
A343: PORT MELBOURNE | C343: 3 | D343: 2 | E343: =(C343*6)+D343 -> 20 | G343: 4 | H343: 5 | I343: =(G343*6)+H343 -> 29 | K343: 6 | L343: 9 | M343: =(K343*6)+L343 -> 45 | O343: 10 | P343: 17 | Q343: =(O343*6)+P343 -> 77
A344: BEST PLAYERS
A345: SPRINGVALE | C345: SCHWARZE | F345: HARRISON | I345: SMITH
A346: PORT MELBOURNE | C346: BENNETT | F346: DOYLE | I346: FILANDIA | L346: STEVENS
A347: GOALKICKERS
A348: SPRINGVALE | C348: SMITH 4 | F348: CARMODY 2 | I348: DELARUE | K348: ELLIOTT | M348: PITT | N348: ROBBINS | Q348: YOUNG
A349: PORT MELBOURNE | C349: BUCHANAN 3 | F349: JAMES 2 | I349: SWAN | K349: LEWIS | M349: STEVENS | O349: KENNELLY | Q349: FILANDIA
A351: SANDRINGHAM | C351: 3 | D351: 5 | E351: =(C351*6)+D351 -> 23 | G351: 7 | H351: 9 | I351: =(G351*6)+H351 -> 51 | K351: 8 | L351: 15 | M351: =(K351*6)+L351 -> 63 | O351: 13 | P351: 18 | Q351: =(O351*6)+P351 -> 96 | S351: Venue: BENDIGO
A352: BENDIGO | C352: 2 | D352: 3 | E352: =(C352*6)+D352 -> 15 | G352: 4 | H352: 6 | I352: =(G352*6)+H352 -> 30 | K352: 7 | L352: 7 | M352: =(K352*6)+L352 -> 49 | O352: 8 | P352: 10 | Q352: =(O352*6)+P352 -> 58
A353: BEST PLAYERS
A354: SANDRINGHAM | C354: FUNCKE | F354: JOHNSTONE | I354: WILSON | L354: RYAN | N354: TEMPLETON | Q354: COGHLAN
A355: BENDIGO | C355: N CARTER | F355: KLIM | I355: CAIL | L355: LOCK | N355: GATHERCOLE | Q355: CAMPBELL
A356: GOALKICKERS
A357: SANDRINGHAM | C357: TEMPLETON 3 | F357: HAYWOOD 2 | I357: JOHNSTONE 2 | L357: McDONALD | N357: FUNCKE | P357: THOMPSON | R357: WILSON | T357: SULLIVAN | W357: McKELLAR
A358: BENDIGO | C358: CARTER 4 | F358: DILLON | H358: KEOWN | J358: KLIM | L358: VANDENHAM
A360: WERRIBEE | C360: 3 | D360: 3 | E360: =(C360*6)+D360 -> 21 | G360: 10 | H360: 8 | I360: =(G360*6)+H360 -> 68 | K360: 13 | L360: 11 | M360: =(K360*6)+L360 -> 89 | O360: 15 | P360: 15 | Q360: =(O360*6)+P360 -> 105 | S360: Venue: FRANKSTON
A361: FRANKSTON | C361: 4 | D361: 1 | E361: =(C361*6)+D361 -> 25 | G361: 5 | H361: 4 | I361: =(G361*6)+H361 -> 34 | K361: 11 | L361: 8 | M361: =(K361*6)+L361 -> 74 | O361: 13 | P361: 10 | Q361: =(O361*6)+P361 -> 88
A362: BEST PLAYERS
A363: WERRIBEE | C363: HAHN | F363: GIANSIRACUSA | J363: FAULKNER | M363: PULI | O363: SAUNDERS | R363: FULLER
A364: FRANKSTON | C364: MALLOY | F364: CLARKE | J364: GRAF | M364: SIMISTER | O364: PITTS
A365: GOALKICKERS
A366: WERRIBEE | C366: FULLER 4 | F366: BOWDEN 2 | I366: MITCHELL 2 | L366: BIRSS | N366: CHURCHILL | Q366: FROST | R366: HAHN | T366: PULI | V366: SAUNDERS | X366: SMITH
A367: FRANKSTON | C367: SAUTNER 4 | F367: CLARKE 3 | I367: SIMISTER 2 | L367: SULLIVAN | N367: MALLOY | P367: TAYLOR | R367: SALISBURY
A369: GEELONG | C369: 1 | D369: 1 | E369: =(C369*6)+D369 -> 7 | G369: 5 | H369: 4 | I369: =(G369*6)+H369 -> 34 | K369: 8 | L369: 6 | M369: =(K369*6)+L369 -> 54 | O369: 12 | P369: 11 | Q369: =(O369*6)+P369 -> 83 | S369: Venue: PRESTON
A370: NORTHERN BULLANTS | C370: 4 | D370: 6 | E370: =(C370*6)+D370 -> 30 | G370: 6 | H370: 7 | I370: =(G370*6)+H370 -> 43 | K370: 9 | L370: 10 | M370: =(K370*6)+L370 -> 64 | O370: 11 | P370: 10 | Q370: =(O370*6)+P370 -> 76
A371: BEST PLAYERS
A372: GEELONG | C372: CLARK | F372: CHAMBERS | I372: CHAPMAN | L372: CORRIGAN | O372: POWELL | R372: BALDWIN
A373: NORTHERN BULLANTS | C373: PENN | F373: RASO | I373: CANN | L373: BLIGHT | O373: BONNADIO | R373: VAN HATTUM
A374: GOALKICKERS
A375: GEELONG | C375: BALDWIN 5 | F375: CLARK 2 | I375: HOSKING | K375: HUNT | M375: KINGSLEY | O375: LING | Q375: ROOKE
A376: NORTHERN BULLANTS | C376: FAVRIN 3 | F376: CARACELLA 2 | I376: RAMSAY 2 | L376: VAN BLOMMESTEIN 2 | Q376: GRAINGER | T376: WATSON
A378: ROUND 6 | D378: 12TH MAY | J378: WEATHER
D379: 1ST QTR | H379: 2ND QTR | L379: 3RD QTR | P379: FINAL | S379: Venue: COBURG
A380: MURRAY KANGAROOS | C380: 8 | D380: 2 | E380: =(C380*6)+D380 -> 50 | G380: 15 | H380: 4 | I380: =(G380*6)+H380 -> 94 | K380: 20 | L380: 5 | M380: =(K380*6)+L380 -> 125 | O380: 23 | P380: 8 | Q380: =(O380*6)+P380 -> 146 | S380: UMPIRES | Y380: LADDER | AB380: ROUND | AD380: 6
A381: WILLIAMSTOWN | C381: 3 | D381: 1 | E381: =(C381*6)+D381 -> 19 | G381: 5 | H381: 3 | I381: =(G381*6)+H381 -> 33 | K381: 14 | L381: 7 | M381: =(K381*6)+L381 -> 91 | O381: 22 | P381: 7 | Q381: =(O381*6)+P381 -> 139
A382: BEST PLAYERS | W382: TEAM | X382: W | Y382: L | Z382: D | AA382: FOR | AB382: AGST | AC382: % | AD382: PTS
A383: MURRAY KANGAROOS | C383: WATT | F383: RAWLINGS | I383: L SMITH | L383: AINLEY | O383: McKERNAN | R383: SINCLAIR
A384: WILLIAMSTOWN | C384: CLOKE | F384: LLOYD | I384: WOOD | L384: WASLEY | O384: ANDERSON | R384: LANE | W384: WERRIBEE | X384: 6 | Y384: 0 | Z384: 0 | AA384: 498 | AB384: 314 | AC384: =(AA384/AB384)*100 -> 158.59872611464968 | AD384: =(X384*4)+(Z384*2) -> 24
A385: GOALKICKERS | N385: HARRIS | P385: COOPER | W385: SPRINGVALE | X385: 6 | Y385: 0 | Z385: 0 | AA385: 513 | AB385: 393 | AC385: =(AA385/AB385)*100 -> 130.53435114503819 | AD385: =(X385*4)+(Z385*2) -> 24
A386: MURRAY KANGAROOS | C386: L SMITH 5 | E386: RAWLINGS 4 | H386: HARDING 4 | J386: SPAULL 3 | L386: SINCLAIR 3 | N386: CALTHORPE | Q386: McKERNAN | W386: MURRAY KANGAROOS | X386: 5 | Y386: 1 | Z386: 0 | AA386: 719 | AB386: 536 | AC386: =(AA386/AB386)*100 -> 134.14179104477611 | AD386: =(X386*4)+(Z386*2) -> 20
A387: WILLIAMSTOWN | C387: LANE 6 | E387: CLOKE 4 | G387: DAVIS 3 | I387: WEST 2 | K387: UKOVIC 2 | M387: LLOYD 2 | O387: SCOTLAND 2 | R387: SHAW | W387: BOX HILL | X387: 4 | Y387: 2 | Z387: 0 | AA387: 679 | AB387: 475 | AC387: =(AA387/AB387)*100 -> 142.94736842105263 | AD387: =(X387*4)+(Z387*2) -> 16
W388: SANDRINGHAM | X388: 3 | Y388: 3 | Z388: 0 | AA388: 571 | AB388: 453 | AC388: =(AA388/AB388)*100 -> 126.04856512141281 | AD388: =(X388*4)+(Z388*2) -> 12
A389: PORT MELBOURNE | C389: 2 | D389: 5 | E389: =(C389*6)+D389 -> 17 | G389: 7 | H389: 7 | I389: =(G389*6)+H389 -> 49 | K389: 11 | L389: 9 | M389: =(K389*6)+L389 -> 75 | O389: 16 | P389: 12 | Q389: =(O389*6)+P389 -> 108 | S389: Venue: PORT MELBOURNE | W389: GEELONG | X389: 3 | Y389: 3 | Z389: 0 | AA389: 491 | AB389: 469 | AC389: =(AA389/AB389)*100 -> 104.69083155650321 | AD389: =(X389*4)+(Z389*2) -> 12
A390: NORTHERN BULLANTS | C390: 1 | D390: 3 | E390: =(C390*6)+D390 -> 9 | G390: 4 | H390: 4 | I390: =(G390*6)+H390 -> 28 | K390: 7 | L390: 6 | M390: =(K390*6)+L390 -> 48 | O390: 10 | P390: 8 | Q390: =(O390*6)+P390 -> 68 | W390: PORT MELBOURNE | X390: 3 | Y390: 3 | Z390: 0 | AA390: 525 | AB390: 516 | AC390: =(AA390/AB390)*100 -> 101.74418604651163 | AD390: =(X390*4)+(Z390*2) -> 12
A391: BEST PLAYERS | W391: FRANKSTON | X391: 3 | Y391: 3 | Z391: 0 | AA391: 512 | AB391: 510 | AC391: =(AA391/AB391)*100 -> 100.3921568627451 | AD391: =(X391*4)+(Z391*2) -> 12
A392: PORT MELBOURNE | C392: LEWIS | F392: KIRK | I392: DELUCA | L392: BUCHANAN | O392: McMAHON | R392: O'KEEFE
A393: NORTHERN BULLANTS | C393: BONADIO | F393: PENN | I393: ZORZI | L393: RASO | O393: BLIGHT | R393: GRAINGER | W393: ESSENDON | X393: 3 | Y393: 3 | Z393: 0 | AA393: 540 | AB393: 541 | AC393: =(AA393/AB393)*100 -> 99.815157116451019 | AD393: =(X393*4)+(Z393*2) -> 12
A394: GOALKICKERS | Q394: McMAHON | W394: NORTH BALLARAT | X394: 3 | Y394: 3 | Z394: 0 | AA394: 480 | AB394: 559 | AC394: =(AA394/AB394)*100 -> 85.867620751341676 | AD394: =(X394*4)+(Z394*2) -> 12
A395: PORT MELBOURNE | C395: BUCHANAN 3 | F395: LEWIS 3 | H395: STEVENS 2 | J395: KIRK 2 | L395: O'KEEFE 2 | N395: FILANDIA | P395: BROCKMAN | R395: SWAN | W395: CARLTON | X395: 2 | Y395: 4 | Z395: 0 | AA395: 467 | AB395: 488 | AC395: =(AA395/AB395)*100 -> 95.696721311475414 | AD395: =(X395*4)+(Z395*2) -> 8
A396: NORTHERN BULLANTS | C396: PENN 2 | E396: CARACELLA | H396: FAVRIN | J396: GRAINGER | M396: HABERMAN | P396: PATTERSON | R396: RASO | W396: WILLIAMSTOWN | X396: 2 | Y396: 4 | Z396: 0 | AA396: 505 | AB396: 538 | AC396: =(AA396/AB396)*100 -> 93.866171003717469 | AD396: =(X396*4)+(Z396*2) -> 8
M397: WATSON | O397: VAN BLOMMESTEIN | W397: COBURG | X397: 2 | Y397: 4 | Z397: 0 | AA397: 439 | AB397: 529 | AC397: =(AA397/AB397)*100 -> 82.986767485822313 | AD397: =(X397*4)+(Z397*2) -> 8
A398: WERRIBEE | C398: 5 | D398: 1 | E398: =(C398*6)+D398 -> 31 | G398: 8 | H398: 2 | I398: =(G398*6)+H398 -> 50 | K398: 11 | L398: 3 | M398: =(K398*6)+L398 -> 69 | O398: 13 | P398: 7 | Q398: =(O398*6)+P398 -> 85 | S398: Venue: BEACH ROAD | W398: TASMANIA | X398: 2 | Y398: 4 | Z398: 0 | AA398: 443 | AB398: 757 | AC398: =(AA398/AB398)*100 -> 58.520475561426686 | AD398: =(X398*4)+(Z398*2) -> 8
A399: SANDRINGHAM | C399: 3 | D399: 4 | E399: =(C399*6)+D399 -> 22 | G399: 5 | H399: 8 | I399: =(G399*6)+H399 -> 38 | K399: 7 | L399: 10 | M399: =(K399*6)+L399 -> 52 | O399: 9 | P399: 13 | Q399: =(O399*6)+P399 -> 67 | W399: NORTHERN BULLANTS | X399: 1 | Y399: 5 | Z399: 0 | AA399: 460 | AB399: 504 | AC399: =(AA399/AB399)*100 -> 91.269841269841265 | AD399: =(X399*4)+(Z399*2) -> 4
A400: BEST PLAYERS | W400: BENDIGO | X400: 0 | Y400: 6 | Z400: 0 | AA400: 389 | AB400: 624 | AC400: =(AA400/AB400)*100 -> 62.339743589743591 | AD400: =(X400*4)+(Z400*2) -> 0
A401: WERRIBEE | C401: GIRANSIRACUSA | F401: BOWDEN | I401: FAULKNER | L401: SAUNDERS | N401: HYDE | P401: FROST
A402: SANDRINGHAM | C402: LAMB | F402: TEMPLETON | I402: RADFORD | L402: WILSON | N402: BROADBRIDGE
A403: GOALKICKERS | P403: ROBERTSON
A404: WERRIBEE | C404: WIGGINS 4 | F404: MITCHELL 2 | I404: GIRANSIRACUSA 2 | M404: GILBEE | O404: FULLER | Q404: BOWDEN | S404: BAKER
A405: SANDRINGHAM | C405: TEMPLETON 3 | F405: MCDONALD 2 | I405: BEAMS 2 | L405: JOLLY | N405: O'BRIEN
D406: 13TH MAY | J406: WEATHER
A407: CARLTON | C407: 4 | D407: 5 | E407: =(C407*6)+D407 -> 29 | G407: 7 | H407: 7 | I407: =(G407*6)+H407 -> 49 | K407: 9 | L407: 10 | M407: =(K407*6)+L407 -> 64 | O407: 12 | P407: 14 | Q407: =(O407*6)+P407 -> 86 | S407: Venue: SHELL STADIUM (C/R)
A408: GEELONG | C408: 2 | D408: 1 | E408: =(C408*6)+D408 -> 13 | G408: 5 | H408: 6 | I408: =(G408*6)+H408 -> 36 | K408: 7 | L408: 9 | M408: =(K408*6)+L408 -> 51 | O408: 12 | P408: 10 | Q408: =(O408*6)+P408 -> 82
A409: BEST PLAYERS
A410: CARLTON | C410: PLUNKETT | F410: DOERING | I410: WHITE | L410: CULPITT | N410: SPORN | Q410: NELSON
A411: GEELONG | C411: LOWTHER | F411: LING | I411: BAUER | L411: ENRIGHT | N411: KARAMATIC | Q411: CORRIGAN
A412: GOALKICKERS
A413: CARLTON | C413: PLUNKETT 3 | F413: VANCE 2 | H413: BACKWELL | J413: NELSON | L413: CRANAGE | N413: WHITE | P413: CULPITT | R413: MATTHEWS | U413: PICKERING
A414: GEELONG | C414: KARAMATIC 4 | F414: T CLARK 2 | I414: LING 2 | K414: BIZZELL | M414: LOWTHER | O414: ROOKE | Q414: SINNOTT
A416: TASMANIA | C416: 2 | D416: 3 | E416: =(C416*6)+D416 -> 15 | G416: 6 | H416: 7 | I416: =(G416*6)+H416 -> 43 | K416: 10 | L416: 14 | M416: =(K416*6)+L416 -> 74 | O416: 13 | P416: 20 | Q416: =(O416*6)+P416 -> 98 | S416: Venue: BENDIGO
A417: BENDIGO | C417: 4 | D417: 2 | E417: =(C417*6)+D417 -> 26 | G417: 7 | H417: 4 | I417: =(G417*6)+H417 -> 46 | K417: 9 | L417: 5 | M417: =(K417*6)+L417 -> 59 | O417: 10 | P417: 6 | Q417: =(O417*6)+P417 -> 66
A418: BEST PLAYERS
A419: TASMANIA | C419: PRACIAK | F419: CARTER | I419: COLE | K419: HOWARD | N419: GEAPPEN | Q419: BROOKS
A420: BENDIGO | C420: ANDREWS | F420: LOCK | I420: CAMPBELL | K420: CAIL | N420: O'CALLAGHAN | Q420: JARDINE
A421: GOALKICKERS
A422: TASMANIA | C422: ALLEN 4 | F422: CALLINAN 2 | I422: COONEY 2 | L422: PRACIAK 2 | O422: ATKINS 2 | R422: DAVIS
A423: BENDIGO | C423: BROWN 3 | F423: CARTER 2 | I423: PETRIE 2 | L423: ANDERSON | N423: PLIM | P423: CURREN
A425: SPRINGVALE | C425: 4 | D425: 3 | E425: =(C425*6)+D425 -> 27 | G425: 9 | H425: 12 | I425: =(G425*6)+H425 -> 66 | K425: 10 | L425: 15 | M425: =(K425*6)+L425 -> 75 | O425: 12 | P425: 20 | Q425: =(O425*6)+P425 -> 92 | S425: Venue: MOORABBIN
A426: BOX HILL | C426: 8 | D426: 2 | E426: =(C426*6)+D426 -> 50 | G426: 8 | H426: 4 | I426: =(G426*6)+H426 -> 52 | K426: 12 | L426: 7 | M426: =(K426*6)+L426 -> 79 | O426: 13 | P426: 10 | Q426: =(O426*6)+P426 -> 88
A427: BEST PLAYERS
A428: SPRINGVALE | C428: WALTON | F428: O'BRIEN | I428: CARROLL | L428: HARRISON | O428: ROBBINS | R428: PITT
A429: BOX HILL | C429: CAMPBELL | F429: RIES | I429: ROCK | L429: COX | O429: O'FARRELL
A430: GOALKICKERS
A431: SPRINGVALE | C431: SMITH 5 | F431: BERRY 4 | I431: CARROLL | K431: O'BRIEN | M431: PITT
A432: BOX HILL | C432: JOHNSON 3 | F432: RIES 2 | I432: LOATS 2 | L432: PASSADOR | N432: NICHOLLS | Q432: BREWER | S432: GREENE | U432: OSBORNE | X432: ROCK
A434: FRANKSTON | C434: 5 | D434: 3 | E434: =(C434*6)+D434 -> 33 | G434: 6 | H434: 6 | I434: =(G434*6)+H434 -> 42 | K434: 12 | L434: 12 | M434: =(K434*6)+L434 -> 84 | O434: 14 | P434: 14 | Q434: =(O434*6)+P434 -> 98 | S434: Venue: FRANKSTON
A435: NORTH BALLARAT | C435: 2 | D435: 2 | E435: =(C435*6)+D435 -> 14 | G435: 6 | H435: 4 | I435: =(G435*6)+H435 -> 40 | K435: 6 | L435: 6 | M435: =(K435*6)+L435 -> 42 | O435: 12 | P435: 7 | Q435: =(O435*6)+P435 -> 79
A436: BEST PLAYERS
A437: FRANKSTON | C437: GEORGIOU | F437: MALLOY | I437: LYON | L437: SMITH | N437: SIMISTER
A438: NORTH BALLARAT | C438: CLAYTON | F438: INKSTER | I438: COLLARD | L438: BROWN | N438: T POLKINGHORNE | R438: J POLKINGHORNE
A439: GOALKICKERS
A440: FRANKSTON | C440: SIMISTER 4 | F440: SAUTNER 3 | I440: BEVERIDGE 2 | L440: GEORGIOU | N440: DAMON | P440: LYON | Q440: CLARKE | S440: FOLINO
A441: NORTH BALLARAT | C441: COLLARD 4 | F441: JENKINS 3 | I441: INKSTER 2 | L441: CLAYTON | N441: WEATHERBY | Q441: PRESTON
A443: COBURG | C443: 5 | D443: 5 | E443: =(C443*6)+D443 -> 35 | G443: 10 | H443: 7 | I443: =(G443*6)+H443 -> 67 | K443: 13 | L443: 10 | M443: =(K443*6)+L443 -> 88 | O443: 17 | P443: 13 | Q443: =(O443*6)+P443 -> 115 | S443: Venue: COBURG
A444: ESSENDON | C444: 2 | D444: 2 | E444: =(C444*6)+D444 -> 14 | G444: 9 | H444: 3 | I444: =(G444*6)+H444 -> 57 | K444: 14 | L444: 5 | M444: =(K444*6)+L444 -> 89 | O444: 18 | P444: 6 | Q444: =(O444*6)+P444 -> 114
A445: BEST PLAYERS
A446: COBURG | C446: MILLS | F446: HAYNES | I446: PETTIFER | L446: DEPASQUALE | O446: O'BRIEN | R446: NEWMAN
A447: ESSENDON | C447: BULLEN | F447: ROBRAN | I447: DAVIES | L447: RICHARDS | O447: HILLE
A448: GOALKICKERS
A449: COBURG | C449: HAYNES 5 | F449: MILLS 3 | I449: POYAS 3 | K449: HYDE | M449: TAYLOR | O449: WILLOUGHBY | R449: T LITTLE | U449: DEPASQUALE
A450: ESSENDON | C450: RICHARDS 3 | F450: ROBRAN 2 | I450: DENHAM 2 | L450: CLARKE 2 | N450: D JOHNSON | Q450: BANNISTER | T450: SWITALA | W450: McALISTER | X450: MAHONEY | AA450: CRANAGE | AC450: BULLEN
W451: HILLE | X451: MCGRATH
A452: ROUND 7 | D452: 19TH MAY | J452: WEATHER
D453: 1ST QTR | H453: 2ND QTR | L453: 3RD QTR | P453: FINAL | S453: Venue: OPTUS OVAL
A454: CARLTON | C454: 3 | D454: 2 | E454: =(C454*6)+D454 -> 20 | G454: 8 | H454: 4 | I454: =(G454*6)+H454 -> 52 | K454: 11 | L454: 8 | M454: =(K454*6)+L454 -> 74 | O454: 13 | P454: 12 | Q454: =(O454*6)+P454 -> 90 | S454: UMPIRES | Y454: LADDER | AB454: ROUND | AD454: 7
A455: NORTHERN BULLANTS | C455: 3 | D455: 2 | E455: =(C455*6)+D455 -> 20 | G455: 4 | H455: 3 | I455: =(G455*6)+H455 -> 27 | K455: 7 | L455: 6 | M455: =(K455*6)+L455 -> 48 | O455: 12 | P455: 9 | Q455: =(O455*6)+P455 -> 81
A456: BEST PLAYERS | W456: TEAM | X456: W | Y456: L | Z456: D | AA456: FOR | AB456: AGST | AC456: % | AD456: PTS
A457: CARLTON | C457: FLETCHER | F457: MERRINGTON | J457: PLUNKETT
A458: NORTHERN BULLANTS | C458: CANN | F458: TAYLOR | J458: VAN BLOMMESTEIN | N458: POSTLEWAITE | Q458: BLIGHT | S458: WATSON | W458: WERRIBEE | X458: 7 | Y458: 0 | Z458: 0 | AA458: 635 | AB458: 425 | AC458: =(AA458/AB458)*100 -> 149.41176470588235 | AD458: =(X458*4)+(Z458*2) -> 28
A459: GOALKICKERS | Q459: CRANAGE | W459: MURRAY KANGAROOS | X459: 6 | Y459: 1 | Z459: 0 | AA459: 810 | AB459: 612 | AC459: =(AA459/AB459)*100 -> 132.35294117647058 | AD459: =(X459*4)+(Z459*2) -> 24
A460: CARLTON | C460: PRENDERGAST 3 | F460: WHITE 2 | I460: CULPITT 2 | L460: PLUNKETT 2 | O460: PICKERING 2 | R460: JACOTINE | W460: SPRINGVALE | X460: 6 | Y460: 1 | Z460: 0 | AA460: 589 | AB460: 484 | AC460: =(AA460/AB460)*100 -> 121.69421487603307 | AD460: =(X460*4)+(Z460*2) -> 24
A461: NORTHERN BULLANTS | C461: VAN BLOMMESTEIN 4 | G461: WATSON 2 | J461: BLIGHT 2 | L461: CARACELLA | O461: LOWTHER | Q461: CANN | S461: BONADIO | W461: BOX HILL | X461: 5 | Y461: 2 | Z461: 0 | AA461: 842 | AB461: 518 | AC461: =(AA461/AB461)*100 -> 162.54826254826256 | AD461: =(X461*4)+(Z461*2) -> 20
W462: GEELONG | X462: 4 | Y462: 3 | Z462: 0 | AA462: 607 | AB462: 530 | AC462: =(AA462/AB462)*100 -> 114.52830188679246 | AD462: =(X462*4)+(Z462*2) -> 16
A463: BOX HILL | C463: 4 | D463: 3 | E463: =(C463*6)+D463 -> 27 | G463: 10 | H463: 5 | I463: =(G463*6)+H463 -> 65 | K463: 15 | L463: 9 | M463: =(K463*6)+L463 -> 99 | O463: 25 | P463: 13 | Q463: =(O463*6)+P463 -> 163 | S463: Venue: M.C.G. (C/R) | W463: FRANKSTON | X463: 4 | Y463: 3 | Z463: 0 | AA463: 645 | AB463: 570 | AC463: =(AA463/AB463)*100 -> 113.1578947368421 | AD463: =(X463*4)+(Z463*2) -> 16
A464: NORTH BALLARAT | C464: 2 | D464: 3 | E464: =(C464*6)+D464 -> 15 | G464: 6 | H464: 6 | I464: =(G464*6)+H464 -> 42 | K464: 6 | L464: 7 | M464: =(K464*6)+L464 -> 43 | O464: 6 | P464: 7 | Q464: =(O464*6)+P464 -> 43 | W464: ESSENDON | X464: 4 | Y464: 3 | Z464: 0 | AA464: 628 | AB464: 609 | AC464: =(AA464/AB464)*100 -> 103.11986863711002 | AD464: =(X464*4)+(Z464*2) -> 16
A465: BEST PLAYERS | W465: SANDRINGHAM | X465: 3 | Y465: 4 | Z465: 0 | AA465: 639 | AB465: 541 | AC465: =(AA465/AB465)*100 -> 118.11460258780038 | AD465: =(X465*4)+(Z465*2) -> 12
A466: BOX HILL | C466: NICHOLLS | F466: RIES | I466: GREENE | L466: COX | N466: BAIRD | Q466: VANDENBERG
A467: NORTH BALLARAT | C467: J POLKINGHORNE | G467: FISHER | I467: GREIG | L467: BRADLY | W467: COBURG | X467: 3 | Y467: 4 | Z467: 0 | AA467: 598 | AB467: 596 | AC467: =(AA467/AB467)*100 -> 100.33557046979867 | AD467: =(X467*4)+(Z467*2) -> 12
A468: GOALKICKERS | M468: GREENE 2 | O468: TUCK | Q468: MITCHELL | S468: ROCK | W468: CARLTON | X468: 3 | Y468: 4 | Z468: 0 | AA468: 557 | AB468: 569 | AC468: =(AA468/AB468)*100 -> 97.89103690685414 | AD468: =(X468*4)+(Z468*2) -> 12
A469: BOX HILL | C469: PASSADOR 4 | F469: NICHOLLS 3 | I469: PUGSLEY 3 | K469: HAZELL 2 | M469: RIES 2 | O469: OBST 2 | Q469: LONIE 2 | S469: OSBORNE 2 | W469: PORT MELBOURNE | X469: 3 | Y469: 4 | Z469: 0 | AA469: 636 | AB469: 653 | AC469: =(AA469/AB469)*100 -> 97.396630934150068 | AD469: =(X469*4)+(Z469*2) -> 12
A470: NORTH BALLARAT | C470: BRADLY 2 | F470: WEATHERLEY | I470: COLLARD | K470: BAKER | M470: MATTON | W470: NORTH BALLARAT | X470: 3 | Y470: 4 | Z470: 0 | AA470: 523 | AB470: 722 | AC470: =(AA470/AB470)*100 -> 72.4376731301939 | AD470: =(X470*4)+(Z470*2) -> 12
W471: WILLIAMSTOWN | X471: 2 | Y471: 5 | Z471: 0 | AA471: 565 | AB471: 671 | AC471: =(AA471/AB471)*100 -> 84.2026825633383 | AD471: =(X471*4)+(Z471*2) -> 8
A472: COBURG | C472: 10 | D472: 2 | E472: =(C472*6)+D472 -> 62 | G472: 17 | H472: 8 | I472: =(G472*6)+H472 -> 110 | K472: 22 | L472: 11 | M472: =(K472*6)+L472 -> 143 | O472: 24 | P472: 15 | Q472: =(O472*6)+P472 -> 159 | S472: Venue: COBURG | W472: TASMANIA | X472: 2 | Y472: 5 | Z472: 0 | AA472: 510 | AB472: 916 | AC472: =(AA472/AB472)*100 -> 55.67685589519651 | AD472: =(X472*4)+(Z472*2) -> 8
A473: TASMANIA | C473: 3 | D473: 2 | E473: =(C473*6)+D473 -> 20 | G473: 5 | H473: 6 | I473: =(G473*6)+H473 -> 36 | K473: 6 | L473: 7 | M473: =(K473*6)+L473 -> 43 | O473: 10 | P473: 7 | Q473: =(O473*6)+P473 -> 67 | W473: NORTHERN BULLANTS | X473: 1 | Y473: 6 | Z473: 0 | AA473: 541 | AB473: 594 | AC473: =(AA473/AB473)*100 -> 91.07744107744108 | AD473: =(X473*4)+(Z473*2) -> 4
A474: BEST PLAYERS | W474: BENDIGO | X474: 0 | Y474: 7 | Z474: 0 | AA474: 450 | AB474: 740 | AC474: =(AA474/AB474)*100 -> 60.810810810810814 | AD474: =(X474*4)+(Z474*2) -> 0
A475: COBURG | C475: HALL | F475: POYAS | I475: EDNIE | L475: NEWMAN | O475: COGHLAN | R475: PETTIFER
A476: TASMANIA | C476: DAVIS | F476: ALLEN | I476: CARELESS | L476: CALLINAN | O476: BOWRING | R476: PRACIAK
A477: GOALKICKERS | Q477: STEINFORT
A478: COBURG | C478: HALL 6 | E478: EDNIE 4 | G478: POYAS 4 | I478: PIGGOTT 3 | L478: TAYLOR 2 | N478: MILLS | P478: PAGAN | R478: PETTIFER | U478: LANG
A479: TASMANIA | C479: ALLEN 6 | F479: CALLINAN 2 | I479: CARTER | K479: WAGER
A481: ESSENDON | C481: 2 | D481: 1 | E481: =(C481*6)+D481 -> 13 | G481: 6 | H481: 1 | I481: =(G481*6)+H481 -> 37 | K481: 11 | L481: 3 | M481: =(K481*6)+L481 -> 69 | O481: 13 | P481: 10 | Q481: =(O481*6)+P481 -> 88 | S481: Venue: BEACH ROAD
A482: SANDRINGHAM | C482: 3 | D482: 1 | E482: =(C482*6)+D482 -> 19 | G482: 3 | H482: 4 | I482: =(G482*6)+H482 -> 22 | K482: 6 | L482: 5 | M482: =(K482*6)+L482 -> 41 | O482: 10 | P482: 8 | Q482: =(O482*6)+P482 -> 68
A483: BEST PLAYERS
A484: ESSENDON | C484: McGRATH | F484: PODSIADLY | I484: FORSTER-KNIGHT | M484: LALICH | O484: SWITALA | S484: DENHAM
A485: SANDRINGHAM | C485: RADFORD | F485: PITT
A486: GOALKICKERS
A487: ESSENDON | C487: GODDARD 6 | F487: MAHONEY 2 | I487: DAVIS 2 | L487: ROBRAN | N487: BULLER | P487: RICHARDS
A488: SANDRINGHAM | C488: SIMMONDS 3 | F488: THOMPSON 3 | I488: DOHERTY 2 | L488: TEMPLETON | O488: WILSON
A490: WERRIBEE | C490: 6 | D490: 4 | E490: =(C490*6)+D490 -> 40 | G490: 9 | H490: 13 | I490: =(G490*6)+H490 -> 67 | K490: 16 | L490: 21 | M490: =(K490*6)+L490 -> 117 | O490: 19 | P490: 23 | Q490: =(O490*6)+P490 -> 137 | S490: Venue: WERRIBEE
A491: PORT MELBOURNE | C491: 3 | D491: 0 | E491: =(C491*6)+D491 -> 18 | G491: 7 | H491: 0 | I491: =(G491*6)+H491 -> 42 | K491: 8 | L491: 0 | M491: =(K491*6)+L491 -> 48 | O491: 18 | P491: 3 | Q491: =(O491*6)+P491 -> 111
A492: BEST PLAYERS
A493: WERRIBEE | C493: ROBERTSON | F493: DOOLEY | I493: GIRANSIRACUSA | L493: SMITH | N493: SAUNDERS | Q493: FULLER
A494: PORT MELBOURNE | C494: ALOI | F494: ANSTEY | I494: BENNETT | L494: McMAHON | N494: STEVENS | Q494: SUNQUIST
A495: GOALKICKERS
A496: WERRIBEE | C496: DOOLEY 5 | F496: MITCHELL 2 | I496: GIANSIRACUSA 2 | M496: FULLER 2 | O496: SAUNDERS 2 | R496: MURPHY | U496: SMITH | W496: GILBEE | X496: CONTESSA | AA496: BOWDEN | AC496: McMAHON
A497: PORT MELBOURNE | C497: BUCHANAN 5 | F497: STEVENS 4 | I497: MILHUISEN 2 | L497: ALOI | M497: ALEXANDER | P497: PILTZ | R497: TRAND | T497: DELUCA | V497: SWAN | X497: FILANDIA
D498: 20TH MAY | J498: WEATHER
A499: MURRAY KANGAROOS | C499: 3 | D499: 1 | E499: =(C499*6)+D499 -> 19 | G499: 7 | H499: 4 | I499: =(G499*6)+H499 -> 46 | K499: 10 | L499: 8 | M499: =(K499*6)+L499 -> 68 | O499: 13 | P499: 13 | Q499: =(O499*6)+P499 -> 91 | S499: Venue: LAVINGTON
A500: SPRINGVALE | C500: 4 | D500: 3 | E500: =(C500*6)+D500 -> 27 | G500: 5 | H500: 5 | I500: =(G500*6)+H500 -> 35 | K500: 9 | L500: 8 | M500: =(K500*6)+L500 -> 62 | O500: 11 | P500: 10 | Q500: =(O500*6)+P500 -> 76
A501: BEST PLAYERS
A502: MURRAY KANGAROOS | C502: LANGE | F502: WATT | I502: HILTON | L502: JONES | N502: TEAGUE | Q502: WOODLEY
A503: SPRINGVALE | C503: O'BRIEN | F503: TROLLOPE | I503: DELARUE
A504: GOALKICKERS
A505: MURRAY KANGAROOS | C505: JONES 3 | F505: SPAULL 3 | I505: DICKETTS 2 | L505: HILTON | N505: LANGE | P505: PRATT | R505: SMITH | T505: WOODLEY
A506: SPRINGVALE | C506: CARMODY 3 | F506: O'BRIEN 3 | I506: CAPUANO | K506: LEWISON | M506: PITT | N506: SMITH | P506: TAYLOR
A508: FRANKSTON | C508: 5 | D508: 4 | E508: =(C508*6)+D508 -> 34 | G508: 11 | H508: 9 | I508: =(G508*6)+H508 -> 75 | K508: 16 | L508: 10 | M508: =(K508*6)+L508 -> 106 | O508: 20 | P508: 13 | Q508: =(O508*6)+P508 -> 133 | S508: Venue: FRANKSTON
A509: WILLIAMSTOWN | C509: 3 | D509: 2 | E509: =(C509*6)+D509 -> 20 | G509: 5 | H509: 2 | I509: =(G509*6)+H509 -> 32 | K509: 7 | L509: 5 | M509: =(K509*6)+L509 -> 47 | O509: 9 | P509: 6 | Q509: =(O509*6)+P509 -> 60
A510: BEST PLAYERS
A511: FRANKSTON | C511: ABLETT | F511: BURGMAN | I511: DAFF | K511: GEORGIOU | N511: MALLOY | Q511: LYON
A512: WILLIAMSTOWN | C512: TUCKEY | F512: DIMMATINA | I512: CLOKE | K512: ANDERSON | N512: WASLEY
A513: GOALKICKERS
A514: FRANKSTON | C514: SAUTNER 5 | F514: MALLOY 4 | I514: ANDERSON 2 | L514: LYON 2 | N514: FOLINO 2 | Q514: CLARKE | S514: PITTS | U514: McCORMACK | X514: BEVERIDGE | AA514: SALISBURY
A515: WILLIAMSTOWN | C515: TUCKEY 3 | F515: WOOD | H515: LOVETT-MURRAY | L515: SCOTLAND | N515: SMOKER | P515: LLOYD | R515: NASH
A517: GEELONG | C517: 2 | D517: 4 | E517: =(C517*6)+D517 -> 16 | G517: 6 | H517: 8 | I517: =(G517*6)+H517 -> 44 | K517: 10 | L517: 10 | M517: =(K517*6)+L517 -> 70 | O517: 17 | P517: 14 | Q517: =(O517*6)+P517 -> 116 | S517: Venue: BENDIGO
A518: BENDIGO | C518: 3 | D518: 7 | E518: =(C518*6)+D518 -> 25 | G518: 5 | H518: 8 | I518: =(G518*6)+H518 -> 38 | K518: 7 | L518: 11 | M518: =(K518*6)+L518 -> 53 | O518: 8 | P518: 13 | Q518: =(O518*6)+P518 -> 61
A519: BEST PLAYERS
A520: GEELONG | C520: ENRIGHT | F520: LOWTHER | I520: CHAMBERS | L520: HOSKING | N520: CORRIGAN | Q520: ROOKE
A521: BENDIGO | C521: ELLIOTT | F521: LOCK | I521: CAMPBELL | L521: CARTER | N521: ATKINS | Q521: JARDINE
A522: GOALKICKERS
A523: GEELONG | C523: RYAN 3 | E523: CHAMBERS 2 | H523: KARAMATIC 2 | K523: ROOKE 2 | M523: SPALDING 2 | P523: CLARK | R523: CORRIGAN | U523: FOSTER | W523: HOSKING | X523: MOONEY | AA523: NICHOLSON
A524: BENDIGO | C524: PETRIE 3 | F524: ATKINS 2 | I524: CARTER 2 | L524: ANDREWS
A526: ROUND 8 | D526: 25TH MAY | J526: WEATHER
D527: 1ST QTR | H527: 2ND QTR | L527: 3RD QTR | P527: FINAL | S527: Venue: M.C.G. (C/R) (MK home game)
A528: CARLTON | C528: 3 | D528: 2 | E528: =(C528*6)+D528 -> 20 | G528: 7 | H528: 6 | I528: =(G528*6)+H528 -> 48 | K528: 10 | L528: 9 | M528: =(K528*6)+L528 -> 69 | O528: 14 | P528: 11 | Q528: =(O528*6)+P528 -> 95 | S528: UMPIRES | Y528: LADDER | AB528: ROUND | AD528: 8
A529: MURRAY KANGAROOS | C529: 1 | D529: 2 | E529: =(C529*6)+D529 -> 8 | G529: 2 | H529: 6 | I529: =(G529*6)+H529 -> 18 | K529: 6 | L529: 8 | M529: =(K529*6)+L529 -> 44 | O529: 6 | P529: 11 | Q529: =(O529*6)+P529 -> 47
A530: BEST PLAYERS | W530: TEAM | X530: W | Y530: L | Z530: D | AA530: FOR | AB530: AGST | AC530: % | AD530: PTS
A531: CARLTON | C531: PICKERING | F531: PLUNKETT | I531: FLETCHER | L531: SINNOTT | O531: RICE | Q531: CULPITT
A532: MURRAY KANGAROOS | C532: MORRELL | F532: AINLEY | I532: HARDING | L532: TEAGUE | O532: PETRIE | Q532: COLLINS | W532: WERRIBEE | X532: 8 | Y532: 0 | Z532: 0 | AA532: 807 | AB532: 488 | AC532: =(AA532/AB532)*100 -> 165.36885245901641 | AD532: =(X532*4)+(Z532*2) -> 32
A533: GOALKICKERS | Q533: SINNOTT | W533: SPRINGVALE | X533: 7 | Y533: 1 | Z533: 0 | AA533: 724 | AB533: 585 | AC533: =(AA533/AB533)*100 -> 123.76068376068376 | AD533: =(X533*4)+(Z533*2) -> 28
A534: CARLTON | C534: CAMPBELL 3 | F534: CRANAGE 3 | I534: CULPITT 2 | K534: PRENDERGAST 2 | N534: CLARK | P534: BEASY | R534: PLUNKETT | W534: BOX HILL | X534: 6 | Y534: 2 | Z534: 0 | AA534: 968 | AB534: 575 | AC534: =(AA534/AB534)*100 -> 168.34782608695653 | AD534: =(X534*4)+(Z534*2) -> 24
A535: MURRAY KANGAROOS | C535: MORRELL 2 | F535: FEUEHARDT 2 | J535: STEVENS | M535: NEWTON | W535: MURRAY KANGAROOS | X535: 6 | Y535: 2 | Z535: 0 | AA535: 857 | AB535: 707 | AC535: =(AA535/AB535)*100 -> 121.21640735502122 | AD535: =(X535*4)+(Z535*2) -> 24
D536: 26TH MAY | J536: WEATHER | W536: FRANKSTON | X536: 5 | Y536: 3 | Z536: 0 | AA536: 717 | AB536: 638 | AC536: =(AA536/AB536)*100 -> 112.38244514106583 | AD536: =(X536*4)+(Z536*2) -> 20
A537: PORT MELBOURNE | C537: 5 | D537: 6 | E537: =(C537*6)+D537 -> 36 | G537: 8 | H537: 11 | I537: =(G537*6)+H537 -> 59 | K537: 10 | L537: 15 | M537: =(K537*6)+L537 -> 75 | O537: 14 | P537: 21 | Q537: =(O537*6)+P537 -> 105 | S537: Venue: PORT MELBOURNE | W537: GEELONG | X537: 4 | Y537: 4 | Z537: 0 | AA537: 652 | AB537: 592 | AC537: =(AA537/AB537)*100 -> 110.13513513513513 | AD537: =(X537*4)+(Z537*2) -> 16
A538: BENDIGO | C538: 4 | D538: 2 | E538: =(C538*6)+D538 -> 26 | G538: 5 | H538: 7 | I538: =(G538*6)+H538 -> 37 | K538: 8 | L538: 10 | M538: =(K538*6)+L538 -> 58 | O538: 13 | P538: 12 | Q538: =(O538*6)+P538 -> 90 | W538: CARLTON | X538: 4 | Y538: 4 | Z538: 0 | AA538: 652 | AB538: 616 | AC538: =(AA538/AB538)*100 -> 105.84415584415585 | AD538: =(X538*4)+(Z538*2) -> 16
A539: BEST PLAYERS | W539: COBURG | X539: 4 | Y539: 4 | Z539: 0 | AA539: 660 | AB539: 641 | AC539: =(AA539/AB539)*100 -> 102.96411856474259 | AD539: =(X539*4)+(Z539*2) -> 16
A540: PORT MELBOURNE | C540: ABLETT | F540: ALOI | I540: ANSTEY | L540: FILANDIA | O540: JAMES | Q540: MILHUISEN
A541: BENDIGO | C541: LOCK | F541: ELLIOTT | I541: O'CALLAGHAN | L541: CURRAN | O541: ANDREWS | Q541: CAIL | W541: PORT MELBOURNE | X541: 4 | Y541: 4 | Z541: 0 | AA541: 741 | AB541: 743 | AC541: =(AA541/AB541)*100 -> 99.730820995962304 | AD541: =(X541*4)+(Z541*2) -> 16
A542: GOALKICKERS | Q542: SPENCER | S542: ANSTEY | W542: ESSENDON | X542: 4 | Y542: 4 | Z542: 0 | AA542: 685 | AB542: 735 | AC542: =(AA542/AB542)*100 -> 93.197278911564624 | AD542: =(X542*4)+(Z542*2) -> 16
A543: PORT MELBOURNE | C543: ABLETT 3 | E543: DOYLE 3 | G543: STEVENS | I543: EVANS | K543: FEAST | M543: MILHUISEN | P543: FILANDIA | R543: ALEXANDER | W543: SANDRINGHAM | X543: 3 | Y543: 5 | Z543: 0 | AA543: 707 | AB543: 613 | AC543: =(AA543/AB543)*100 -> 115.33442088091354 | AD543: =(X543*4)+(Z543*2) -> 12
A544: BENDIGO | C544: BROWN 3 | F544: CARTER 2 | I544: HYLAND 2 | L544: PETRIE 2 | N544: WELSH 2 | Q544: CAMPBELL | T544: NOLTE | W544: NORTH BALLARAT | X544: 3 | Y544: 5 | Z544: 0 | AA544: 586 | AB544: 894 | AC544: =(AA544/AB544)*100 -> 65.548098434004473 | AD544: =(X544*4)+(Z544*2) -> 12
W545: TASMANIA | X545: 3 | Y545: 5 | Z545: 0 | AA545: 615 | AB545: 1005 | AC545: =(AA545/AB545)*100 -> 61.194029850746269 | AD545: =(X545*4)+(Z545*2) -> 12
A546: FRANKSTON | C546: 1 | D546: 1 | E546: =(C546*6)+D546 -> 7 | G546: 5 | H546: 5 | I546: =(G546*6)+H546 -> 35 | K546: 8 | L546: 9 | M546: =(K546*6)+L546 -> 57 | O546: 10 | P546: 12 | Q546: =(O546*6)+P546 -> 72 | S546: Venue: FRANKSTON | W546: WILLIAMSTOWN | X546: 2 | Y546: 6 | Z546: 0 | AA546: 666 | AB546: 806 | AC546: =(AA546/AB546)*100 -> 82.630272952853602 | AD546: =(X546*4)+(Z546*2) -> 8
A547: SANDRINGHAM | C547: 3 | D547: 5 | E547: =(C547*6)+D547 -> 23 | G547: 5 | H547: 8 | I547: =(G547*6)+H547 -> 38 | K547: 8 | L547: 11 | M547: =(K547*6)+L547 -> 59 | O547: 9 | P547: 14 | Q547: =(O547*6)+P547 -> 68 | W547: NORTHERN BULLANTS | X547: 1 | Y547: 7 | Z547: 0 | AA547: 630 | AB547: 699 | AC547: =(AA547/AB547)*100 -> 90.128755364806864 | AD547: =(X547*4)+(Z547*2) -> 4
A548: BEST PLAYERS | W548: BENDIGO | X548: 0 | Y548: 8 | Z548: 0 | AA548: 540 | AB548: 845 | AC548: =(AA548/AB548)*100 -> 63.905325443786985 | AD548: =(X548*4)+(Z548*2) -> 0
A549: FRANKSTON | C549: MALLOY | F549: ABLETT | I549: D CLARKE | L549: FRATER | N549: BEVERIDGE | Q549: SAUTNER
A550: SANDRINGHAM | C550: RYAN | F550: LAMB | I550: PITT | L550: RADFORD | N550: BROADBRIDGE | Q550: McKELLAR
A551: GOALKICKERS | Q551: SIMISTER
A552: FRANKSTON | C552: SAUTNER 4 | F552: MATTHEWS | I552: FOLINO | K552: SCOTT-BRANAGAN | O552: McCORMACK | R552: FRATER
A553: SANDRINGHAM | C553: MACGEORGE 2 | F553: BEAMS | H553: SIMMONDS | J553: THOMPSON | M553: SULLIVAN | O553: LIDDELL | Q553: PITT | R553: BROADBRIDGE
D554: 27TH MAY | J554: WEATHER
A555: COBURG | C555: 4 | D555: 1 | E555: =(C555*6)+D555 -> 25 | G555: 7 | H555: 3 | I555: =(G555*6)+H555 -> 45 | K555: 8 | L555: 5 | M555: =(K555*6)+L555 -> 53 | O555: 9 | P555: 8 | Q555: =(O555*6)+P555 -> 62 | S555: Venue: SHELL STADIUM (C/R)
A556: GEELONG | C556: 1 | D556: 1 | E556: =(C556*6)+D556 -> 7 | G556: 3 | H556: 2 | I556: =(G556*6)+H556 -> 20 | K556: 6 | L556: 3 | M556: =(K556*6)+L556 -> 39 | O556: 6 | P556: 9 | Q556: =(O556*6)+P556 -> 45
A557: BEST PLAYERS
A558: COBURG | C558: PROCTOR | F558: HOMEWOOD | I558: VARDY | L558: LAPPIN | N558: BRODERICK | Q558: HAYNES
A559: GEELONG | C559: BAUER | F559: CORRIGAN | I559: ENRIGHT | L559: LOWTHER | N559: C MOONEY
A560: GOALKICKERS
A561: COBURG | C561: HAYNES 2 | F561: PROCTOR 2 | I561: EDNIE 2 | L561: NEWMAN | N561: MILLS | P561: O'BRIEN
A562: GEELONG | C562: BRAY | E562: T CLARK | G562: KARAMATIC | J562: LOWTHER | M562: ROOKE | O562: SPOLDING
A564: SPRINGVALE | C564: 5 | D564: 7 | E564: =(C564*6)+D564 -> 37 | G564: 8 | H564: 9 | I564: =(G564*6)+H564 -> 57 | K564: 16 | L564: 11 | M564: =(K564*6)+L564 -> 107 | O564: 20 | P564: 15 | Q564: =(O564*6)+P564 -> 135 | S564: Venue: WILLIAMSTOWN
A565: WILLIAMSTOWN | C565: 2 | D565: 2 | E565: =(C565*6)+D565 -> 14 | G565: 9 | H565: 9 | I565: =(G565*6)+H565 -> 63 | K565: 12 | L565: 11 | M565: =(K565*6)+L565 -> 83 | O565: 14 | P565: 17 | Q565: =(O565*6)+P565 -> 101
A566: BEST PLAYERS
A567: SPRINGVALE | C567: ROBBINS | F567: WATSON | I567: HARRISON | L567: CARMODY | O567: PITT | Q567: ELLIOTT
A568: WILLIAMSTOWN | C568: CLOKE | F568: KINNEAR | I568: DIDAK | L568: SCOTLAND | O568: SHAW | Q568: WOOD
A569: GOALKICKERS
A570: SPRINGVALE | C570: DAVIS 3 | E570: LAWRENCE 3 | H570: PITT 3 | J570: CARMODY 2 | M570: SMITH 2 | O570: WALTON 2 | R570: BAKER | T570: BERRY | V570: CARROLL | X570: O'BRIEN | Z570: ROBBINS
A571: WILLIAMSTOWN | C571: HILL 5 | F571: CLOKE 2 | I571: DIDAK | K571: ANDERSON | N571: UKOVIC | P571: WOOD | R571: TUCKEY | T571: KINNEAR | W571: DIMMATINA
A573: WERRIBEE | C573: 5 | D573: 6 | E573: =(C573*6)+D573 -> 36 | G573: 9 | H573: 10 | I573: =(G573*6)+H573 -> 64 | K573: 16 | L573: 15 | M573: =(K573*6)+L573 -> 111 | O573: 26 | P573: 16 | Q573: =(O573*6)+P573 -> 172 | S573: Venue: NORTH BALLARAT
A574: NORTH BALLARAT | C574: 2 | D574: 0 | E574: =(C574*6)+D574 -> 12 | G574: 4 | H574: 1 | I574: =(G574*6)+H574 -> 25 | K574: 8 | L574: 2 | M574: =(K574*6)+L574 -> 50 | O574: 10 | P574: 3 | Q574: =(O574*6)+P574 -> 63
A575: BEST PLAYERS
A576: WERRIBEE | C576: MURPHY | F576: FULLER | I576: FROST | L576: GILBEE | O576: CONTESSA | R576: DOOLEY
A577: NORTH BALLARAT | C577: J POLKINGHORNE | G577: EDWARDS | J577: McMAHON
A578: GOALKICKERS | M578: CHURCHILL | P578: BOWDEN | R578: McMAHON | U578: BIRSS
A579: WERRIBEE | C579: MITCHELL 5 | F579: FULLER 4 | H579: GIRANSIRACUSA 3 | L579: SUTTON 2 | N579: CROSS 2 | P579: SAUNDERS 2 | S579: CONTESSA | V579: FROST | X579: MURPHY | AA579: GILBEE
A580: NORTH BALLARAT | C580: EDWARDS 2 | F580: McMAHON 2 | I580: MAIN | J580: JURICA | L580: BAKER | N580: RUYG | P580: WEATHERLEY | S580: BROWN
A582: TASMANIA | C582: 2 | D582: 2 | E582: =(C582*6)+D582 -> 14 | G582: 6 | H582: 9 | I582: =(G582*6)+H582 -> 45 | K582: 11 | L582: 13 | M582: =(K582*6)+L582 -> 79 | O582: 15 | P582: 15 | Q582: =(O582*6)+P582 -> 105 | S582: Venue: PRESTON
A583: NORTHERN BULLANTS | C583: 4 | D583: 1 | E583: =(C583*6)+D583 -> 25 | G583: 6 | H583: 2 | I583: =(G583*6)+H583 -> 38 | K583: 11 | L583: 5 | M583: =(K583*6)+L583 -> 71 | O583: 13 | P583: 11 | Q583: =(O583*6)+P583 -> 89
A584: BEST PLAYERS
A585: TASMANIA | C585: DAVIS | F585: COONEY | I585: HOWARD | L585: GEAPPIN | O585: BOWRING | Q585: CARELESS
A586: NORTHERN BULLANTS | C586: VAN HATTUM | F586: BONADIO | I586: TAYLOR | L586: RAMSAY
A587: GOALKICKERS
A588: TASMANIA | C588: COONEY 3 | F588: GEAPPIN 3 | I588: ALLEN 3 | L588: BOWRING | N588: WAGER | P588: DAVIS | R588: BRERETON | U588: THURLEY | X588: BRITTEN
A589: NORTHERN BULLANTS | C589: RAMSAY 4 | F589: WATSON 2 | I589: CARACELLA 2 | L589: BAUMGARTNER | O589: BLIGHT | Q589: RASO | R589: VAN BLOMMESTEIN | W589: GIBSON
A591: BOX HILL | C591: 5 | D591: 2 | E591: =(C591*6)+D591 -> 32 | G591: 7 | H591: 9 | I591: =(G591*6)+H591 -> 51 | K591: 13 | L591: 14 | M591: =(K591*6)+L591 -> 92 | O591: 18 | P591: 18 | Q591: =(O591*6)+P591 -> 126 | S591: Venue: WINDY HILL
A592: ESSENDON | C592: 2 | D592: 4 | E592: =(C592*6)+D592 -> 16 | G592: 3 | H592: 6 | I592: =(G592*6)+H592 -> 24 | K592: 4 | L592: 8 | M592: =(K592*6)+L592 -> 32 | O592: 8 | P592: 9 | Q592: =(O592*6)+P592 -> 57
A593: BEST PLAYERS
A594: BOX HILL | C594: BATEMAN | F594: LONIE | I594: LOATS | L594: WILLIAMS | O594: COX | Q594: MITCHELL
A595: ESSENDON | C595: BANNISTER | F595: SHEPPARD | I595: BULLEN | L595: LALICH
A596: GOALKICKERS
A597: BOX HILL | C597: PASSADOR 4 | F597: LOATS 3 | I597: NICHOLLS 2 | L597: SMITH 2 | N597: TUCK 2 | P597: HABERFIELD 2 | S597: GREENE | U597: HAZELL | X597: LONIE
A598: ESSENDON | C598: MAHONEY 2 | F598: BANNISTER 2 | I598: LALICH | K598: PODSIADLY | N598: BULLEN | P598: DAVIS
A600: ROUND 9 | D600: 2ND JUNE | J600: WEATHER
D601: 1ST QTR | H601: 2ND QTR | L601: 3RD QTR | P601: FINAL | S601: Venue: OPTUS OVAL
A602: CARLTON | C602: 2 | D602: 5 | E602: =(C602*6)+D602 -> 17 | G602: 4 | H602: 8 | I602: =(G602*6)+H602 -> 32 | K602: 10 | L602: 14 | M602: =(K602*6)+L602 -> 74 | O602: 14 | P602: 21 | Q602: =(O602*6)+P602 -> 105 | S602: UMPIRES | Y602: LADDER | AB602: ROUND | AD602: 9
A603: NORTH BALLARAT | C603: 3 | D603: 2 | E603: =(C603*6)+D603 -> 20 | G603: 4 | H603: 5 | I603: =(G603*6)+H603 -> 29 | K603: 4 | L603: 7 | M603: =(K603*6)+L603 -> 31 | O603: 8 | P603: 8 | Q603: =(O603*6)+P603 -> 56
A604: BEST PLAYERS | W604: TEAM | X604: W | Y604: L | Z604: D | AA604: FOR | AB604: AGST | AC604: % | AD604: PTS
A605: CARLTON | C605: PLUNKETT | F605: FLETCHER | I605: RICE | L605: CRANAGE | O605: CULPITT | R605: VANCE
A606: NORTH BALLARAT | C606: SOMERVILLE | F606: J POLKINGHORNE | J606: CLAYTON | M606: BROWN | O606: GREIG | R606: BEST | W606: WERRIBEE | X606: 9 | Y606: 0 | Z606: 0 | AA606: 969 | AB606: 568 | AC606: =(AA606/AB606)*100 -> 170.59859154929578 | AD606: =(X606*4)+(Z606*2) -> 36
A607: GOALKICKERS | N607: FLEMING | P607: CLARK | R607: CAMPBELL | W607: BOX HILL | X607: 7 | Y607: 2 | Z607: 0 | AA607: 1082 | AB607: 636 | AC607: =(AA607/AB607)*100 -> 170.12578616352201 | AD607: =(X607*4)+(Z607*2) -> 28
A608: CARLTON | C608: FLETCHER 3 | F608: NELSON 2 | I608: VANCE | K608: CRANAGE | M608: WHITE | O608: CULPITT | Q608: WIGGINS | S608: PLUNKETT | W608: SPRINGVALE | X608: 7 | Y608: 2 | Z608: 0 | AA608: 832 | AB608: 699 | AC608: =(AA608/AB608)*100 -> 119.02718168812589 | AD608: =(X608*4)+(Z608*2) -> 28
A609: NORTH BALLARAT | C609: BEST 3 | F609: INKSTER | I609: JURICA | K609: BROWN | M609: MAIN | N609: CLAYTON | W609: MURRAY KANGAROOS | X609: 6 | Y609: 3 | Z609: 0 | AA609: 937 | AB609: 869 | AC609: =(AA609/AB609)*100 -> 107.82508630609897 | AD609: =(X609*4)+(Z609*2) -> 24
W610: CARLTON | X610: 5 | Y610: 4 | Z610: 0 | AA610: 757 | AB610: 672 | AC610: =(AA610/AB610)*100 -> 112.64880952380953 | AD610: =(X610*4)+(Z610*2) -> 20
A611: WERRIBEE | C611: 8 | D611: 4 | E611: =(C611*6)+D611 -> 52 | G611: 14 | H611: 7 | I611: =(G611*6)+H611 -> 91 | K611: 21 | L611: 8 | M611: =(K611*6)+L611 -> 134 | O611: 25 | P611: 12 | Q611: =(O611*6)+P611 -> 162 | S611: Venue: WERRIBEE | W611: COBURG | X611: 5 | Y611: 4 | Z611: 0 | AA611: 764 | AB611: 720 | AC611: =(AA611/AB611)*100 -> 106.11111111111111 | AD611: =(X611*4)+(Z611*2) -> 20
A612: MURRAY KANGAROOS | C612: 3 | D612: 0 | E612: =(C612*6)+D612 -> 18 | G612: 5 | H612: 1 | I612: =(G612*6)+H612 -> 31 | K612: 7 | L612: 5 | M612: =(K612*6)+L612 -> 47 | O612: 12 | P612: 8 | Q612: =(O612*6)+P612 -> 80 | W612: FRANKSTON | X612: 5 | Y612: 4 | Z612: 0 | AA612: 778 | AB612: 752 | AC612: =(AA612/AB612)*100 -> 103.45744680851064 | AD612: =(X612*4)+(Z612*2) -> 20
A613: BEST PLAYERS | W613: ESSENDON | X613: 5 | Y613: 4 | Z613: 0 | AA613: 777 | AB613: 823 | AC613: =(AA613/AB613)*100 -> 94.410692588092346 | AD613: =(X613*4)+(Z613*2) -> 20
A614: WERRIBEE | C614: GIRANSIRACUSA | F614: FAULKNER | I614: SAUNDERS | L614: ROBERTSON | O614: MURPHY | R614: BIRSS
A615: MURRAY KANGAROOS | C615: AINLEY | F615: HARRIS | I615: TEAGUE | L615: SOFI | O615: MORRELL | R615: HILTON | W615: SANDRINGHAM | X615: 4 | Y615: 5 | Z615: 0 | AA615: 821 | AB615: 721 | AC615: =(AA615/AB615)*100 -> 113.86962552011096 | AD615: =(X615*4)+(Z615*2) -> 16
A616: GOALKICKERS | I616: FULLER 2 | K616: CHURCHILL | N616: DOOLEY | P616: ROBERTSON | R616: MURPHY | W616: GEELONG | X616: 4 | Y616: 5 | Z616: 0 | AA616: 721 | AB616: 687 | AC616: =(AA616/AB616)*100 -> 104.9490538573508 | AD616: =(X616*4)+(Z616*2) -> 16
A617: WERRIBEE | C617: GIRANSIRACUSA 5 | G617: SAUNDERS 4 | J617: GILBEE 4 | L617: BOWDEN 2 | N617: FAULKNER 2 | Q617: MITCHELL 2 | W617: PORT MELBOURNE | X617: 4 | Y617: 5 | Z617: 0 | AA617: 856 | AB617: 883 | AC617: =(AA617/AB617)*100 -> 96.942242355605885 | AD617: =(X617*4)+(Z617*2) -> 16
A618: MURRAY KANGAROOS | C618: NEWTON 2 | F618: L SMITH 2 | I618: MORRELL 2 | L618: ABRAHAM | N618: SOFI | P618: SPAULL | R618: HARDING | W618: TASMANIA | X618: 4 | Y618: 5 | Z618: 0 | AA618: 710 | AB618: 1074 | AC618: =(AA618/AB618)*100 -> 66.108007448789579 | AD618: =(X618*4)+(Z618*2) -> 16
O619: PRATT | Q619: PETRIE | W619: WILLIAMSTOWN | X619: 3 | Y619: 6 | Z619: 0 | AA619: 806 | AB619: 921 | AC619: =(AA619/AB619)*100 -> 87.51357220412595 | AD619: =(X619*4)+(Z619*2) -> 12
A620: WILLIAMSTOWN | C620: 3 | D620: 5 | E620: =(C620*6)+D620 -> 23 | G620: 8 | H620: 7 | I620: =(G620*6)+H620 -> 55 | K620: 16 | L620: 12 | M620: =(K620*6)+L620 -> 108 | O620: 21 | P620: 14 | Q620: =(O620*6)+P620 -> 140 | S620: Venue: WILLIAMSTOWN | W620: NORTH BALLARAT | X620: 3 | Y620: 6 | Z620: 0 | AA620: 642 | AB620: 999 | AC620: =(AA620/AB620)*100 -> 64.264264264264256 | AD620: =(X620*4)+(Z620*2) -> 12
A621: PORT MELBOURNE | C621: 3 | D621: 4 | E621: =(C621*6)+D621 -> 22 | G621: 8 | H621: 7 | I621: =(G621*6)+H621 -> 55 | K621: 10 | L621: 9 | M621: =(K621*6)+L621 -> 69 | O621: 17 | P621: 13 | Q621: =(O621*6)+P621 -> 115 | W621: NORTHERN BULLANTS | X621: 1 | Y621: 8 | Z621: 0 | AA621: 718 | AB621: 791 | AC621: =(AA621/AB621)*100 -> 90.77117572692795 | AD621: =(X621*4)+(Z621*2) -> 4
A622: BEST PLAYERS | W622: BENDIGO | X622: 0 | Y622: 9 | Z622: 0 | AA622: 619 | AB622: 949 | AC622: =(AA622/AB622)*100 -> 65.226554267650158 | AD622: =(X622*4)+(Z622*2) -> 0
A623: WILLIAMSTOWN | C623: ADKINS | F623: BROWN | I623: CAPE | K623: KINNEAR | N623: HILL | Q623: TAYLOR
A624: PORT MELBOURNE | C624: ALOI | F624: ABLETT | I624: ANSTEY | K624: SEYMOUR
A625: GOALKICKERS
A626: WILLIAMSTOWN | C626: TUCKEY 4 | E626: HILL 4 | G626: ADKINS 4 | I626: TAYLOR 3 | K626: KINNEAR 2 | N626: BOYD 2 | P626: SMOKER | R626: DEANGELIS
A627: PORT MELBOURNE | C627: BENNETT 3 | F627: MILHUISEN 3 | I627: ALOI 2 | K627: DELUCA 2 | M627: BUCHANAN | P627: FEAST | R627: AHMAT
K628: SPENCER | M628: McMAHON | P628: STEVENS | R628: ELLIOTT
A629: TASMANIA | C629: 4 | D629: 2 | E629: =(C629*6)+D629 -> 26 | G629: 8 | H629: 4 | I629: =(G629*6)+H629 -> 52 | K629: 11 | L629: 5 | M629: =(K629*6)+L629 -> 71 | O629: 15 | P629: 5 | Q629: =(O629*6)+P629 -> 95 | S629: Venue: YORK PARK (Launceston)
A630: GEELONG | C630: 0 | D630: 2 | E630: =(C630*6)+D630 -> 2 | G630: 2 | H630: 4 | I630: =(G630*6)+H630 -> 16 | K630: 7 | L630: 6 | M630: =(K630*6)+L630 -> 48 | O630: 10 | P630: 9 | Q630: =(O630*6)+P630 -> 69
A631: BEST PLAYERS
A632: TASMANIA | C632: HOWARD | F632: DAVIS | I632: CARTER | L632: ALLEN | N632: McKENDRICK | Q632: TAYLOR
A633: GEELONG | C633: ENRIGHT | F633: MOONEY | I633: CORRIGAN | L633: SINNOTT | N633: NICHOLSON | Q633: ROOKE
A634: GOALKICKERS
A635: TASMANIA | C635: ALLEN 6 | F635: MILLAR 3 | I635: CALLINAN 2 | L635: WAGER | N635: WALKER | P635: DAVIS | R635: GEAPPIN
A636: GEELONG | C636: MOONEY 3 | F636: HOSKING 2 | I636: BALDWIN 2 | L636: CORRIGAN | N636: HUNT | P636: KARAMATIC
D637: 3RD JUNE | J637: WEATHER
A638: BOX HILL | C638: 3 | D638: 5 | E638: =(C638*6)+D638 -> 23 | G638: 4 | H638: 8 | I638: =(G638*6)+H638 -> 32 | K638: 11 | L638: 9 | M638: =(K638*6)+L638 -> 75 | O638: 17 | P638: 12 | Q638: =(O638*6)+P638 -> 114 | S638: Venue: BOX HILL
A639: FRANKSTON | C639: 3 | D639: 5 | E639: =(C639*6)+D639 -> 23 | G639: 7 | H639: 7 | I639: =(G639*6)+H639 -> 49 | K639: 7 | L639: 10 | M639: =(K639*6)+L639 -> 52 | O639: 8 | P639: 13 | Q639: =(O639*6)+P639 -> 61
A640: BEST PLAYERS
A641: BOX HILL | C641: NICHOLLS | F641: DENT | I641: COX | K641: BREWER | N641: LONIE | Q641: CAMPBELL
A642: FRANKSTON | C642: BURGMAN | F642: ABLETT | I642: MALLOY
A643: GOALKICKERS
A644: BOX HILL | C644: NICHOLLS 5 | F644: TUCK 2 | H644: CAMPBELL 2 | K644: BREWER | M644: DENT | N644: LONIE | P644: MITCHELL | R644: OBST | T644: PASSADOR | W644: PUGSLEY | X644: RIES
A645: FRANKSTON | C645: SAUTNER 4 | F645: SALISBURY | I645: CLARKE | K645: SMITH | M645: DAMON
A647: SANDRINGHAM | C647: 5 | D647: 2 | E647: =(C647*6)+D647 -> 32 | G647: 9 | H647: 5 | I647: =(G647*6)+H647 -> 59 | K647: 11 | L647: 9 | M647: =(K647*6)+L647 -> 75 | O647: 17 | P647: 12 | Q647: =(O647*6)+P647 -> 114 | S647: Venue: MOORABBIN
A648: SPRINGVALE | C648: 2 | D648: 4 | E648: =(C648*6)+D648 -> 16 | G648: 7 | H648: 7 | I648: =(G648*6)+H648 -> 49 | K648: 11 | L648: 10 | M648: =(K648*6)+L648 -> 76 | O648: 16 | P648: 12 | Q648: =(O648*6)+P648 -> 108
A649: BEST PLAYERS
A650: SANDRINGHAM | C650: PITT | F650: WILSON | I650: MACGEORGE | L650: FEBEY | N650: FUNCKE | Q650: HACKETT
A651: SPRINGVALE | C651: O'BRIEN | F651: PITTS | I651: DAVIS | L651: OLIVER
A652: GOALKICKERS
A653: SANDRINGHAM | C653: BEAMS 5 | E653: PITT 3 | G653: TEMPLETON 3 | J653: HACKETT 2 | M653: FUNCKE 2 | P653: HAYWARD | S653: MACGEORGE
A654: SPRINGVALE | C654: BERRY 2 | E654: ROBBINS 2 | H654: CARROLL 2 | J654: SMITH 2 | L654: CARMODY | N654: DELARUE | P654: O'BRIEN | R654: PECKETT | U654: PITT | W654: RYAN | X654: WULF | Z654: WALTON
A656: ESSENDON | C656: 4 | D656: 2 | E656: =(C656*6)+D656 -> 26 | G656: 9 | H656: 3 | I656: =(G656*6)+H656 -> 57 | K656: 13 | L656: 7 | M656: =(K656*6)+L656 -> 85 | O656: 14 | P656: 8 | Q656: =(O656*6)+P656 -> 92 | S656: Venue: PRESTON
A657: NORTHERN BULLANTS | C657: 2 | D657: 5 | E657: =(C657*6)+D657 -> 17 | G657: 5 | H657: 6 | I657: =(G657*6)+H657 -> 36 | K657: 8 | L657: 11 | M657: =(K657*6)+L657 -> 59 | O657: 12 | P657: 16 | Q657: =(O657*6)+P657 -> 88
A658: BEST PLAYERS
A659: ESSENDON | C659: DENHAM | F659: CRANAGE | I659: PODSIADLY | L659: BANNISTER
A660: NORTHERN BULLANTS | C660: CARACELLA | F660: CANN | I660: RASO | L660: RAMSAY | O660: PENN | Q660: CRAMP
A661: GOALKICKERS
A662: ESSENDON | C662: HUNT 2 | E662: HAWKINS 2 | H662: CRANAGE 2 | K662: GODDARD | M662: MURPHY | O662: MAHONEY | Q662: DAVIES | S662: RICHARDS | V662: DENHAM | X662: BANNISTER | AA662: GOLDSWORTHY
A663: NORTHERN BULLANTS | C663: CARACELLA 3 | F663: CANN 2 | I663: GIBSON 2 | L663: WATSON | N663: RAMSAY | P663: BONADIO | R663: GRAINGER | U663: RASO
A665: COBURG | C665: 4 | D665: 5 | E665: =(C665*6)+D665 -> 29 | G665: 8 | H665: 9 | I665: =(G665*6)+H665 -> 57 | K665: 12 | L665: 12 | M665: =(K665*6)+L665 -> 84 | O665: 15 | P665: 14 | Q665: =(O665*6)+P665 -> 104 | S665: Venue: BENDIGO
A666: BENDIGO | C666: 1 | D666: 7 | E666: =(C666*6)+D666 -> 13 | G666: 4 | H666: 8 | I666: =(G666*6)+H666 -> 32 | K666: 6 | L666: 10 | M666: =(K666*6)+L666 -> 46 | O666: 11 | P666: 13 | Q666: =(O666*6)+P666 -> 79
A667: BEST PLAYERS
A668: COBURG | C668: McLEOD | F668: LAPPIN | I668: O'BRIEN | L668: ZANTUCK | O668: SZILLER | R668: PROCTOR
A669: BENDIGO | C669: LOCK | F669: ANDREWS | I669: SHIELS | L669: WALSH | O669: ELLIOT | R669: CAIL
A670: GOALKICKERS
A671: COBURG | C671: O'BRIEN 3 | F671: TAYLOR 2 | I671: TRACKER 2 | L671: PETTIFER 2 | O671: FIORA 2 | Q671: DEPASQUALE | T671: LAPPIN | V671: HAYNES | X671: ZANTUCK
A672: BENDIGO | C672: GATHERCOLE 2 | F672: ELLIOT 2 | I672: ANDREWS 2 | L672: PETRIE 2 | O672: PLIM | Q672: SHIELS | S672: WALSH
A674: ROUND 10 | D674: 9TH JUNE | J674: WEATHER
D675: 1ST QTR | H675: 2ND QTR | L675: 3RD QTR | P675: FINAL | S675: Venue: PUNT ROAD
A676: MURRAY KANGAROOS | C676: 4 | D676: 4 | E676: =(C676*6)+D676 -> 28 | G676: 9 | H676: 7 | I676: =(G676*6)+H676 -> 61 | K676: 11 | L676: 14 | M676: =(K676*6)+L676 -> 80 | O676: 19 | P676: 15 | Q676: =(O676*6)+P676 -> 129 | S676: UMPIRES | Y676: LADDER | AB676: ROUND | AD676: 10
A677: BENDIGO | C677: 2 | D677: 0 | E677: =(C677*6)+D677 -> 12 | G677: 4 | H677: 1 | I677: =(G677*6)+H677 -> 25 | K677: 7 | L677: 4 | M677: =(K677*6)+L677 -> 46 | O677: 7 | P677: 5 | Q677: =(O677*6)+P677 -> 47
A678: BEST PLAYERS | W678: TEAM | X678: W | Y678: L | Z678: D | AA678: FOR | AB678: AGST | AC678: % | AD678: PTS
A679: MURRAY KANGAROOS | C679: HARDING | F679: AINLEY | I679: GRIGG | L679: TEAGUE | O679: MORRELL | R679: SPAULL
A680: BENDIGO | C680: GATHERCOLE | F680: SHIELS | I680: SCHMIDT | L680: BROWN | O680: TONKIN | R680: CARTER | W680: WERRIBEE | X680: 10 | Y680: 0 | Z680: 0 | AA680: 1057 | AB680: 641 | AC680: =(AA680/AB680)*100 -> 164.89859594383776 | AD680: =(X680*4)+(Z680*2) -> 40
A681: GOALKICKERS | C681: ** | D681: (1 GOAL TOO MANY) | Q681: AINLEY | W681: BOX HILL | X681: 8 | Y681: 2 | Z681: 0 | AA681: 1184 | AB681: 701 | AC681: =(AA681/AB681)*100 -> 168.90156918687589 | AD681: =(X681*4)+(Z681*2) -> 32
A682: MURRAY KANGAROOS | C682: MORRELL 4 | F682: HARDING 4 | I682: NEWMAN 3 | L682: SPAULL 2 | N682: DUNNE 2 | P682: SINCLAIR 2 | R682: MOTLOP | W682: MURRAY KANGAROOS | X682: 7 | Y682: 3 | Z682: 0 | AA682: 1066 | AB682: 916 | AC682: =(AA682/AB682)*100 -> 116.37554585152839 | AD682: =(X682*4)+(Z682*2) -> 28
A683: BENDIGO | C683: BROWN 3 | F683: ELLIOT 2 | I683: WALSH 2 | L683: CAIL | W683: SPRINGVALE | X683: 7 | Y683: 3 | Z683: 0 | AA683: 935 | AB683: 828 | AC683: =(AA683/AB683)*100 -> 112.92270531400965 | AD683: =(X683*4)+(Z683*2) -> 28
W684: COBURG | X684: 6 | Y684: 4 | Z684: 0 | AA684: 857 | AB684: 806 | AC684: =(AA684/AB684)*100 -> 106.32754342431762 | AD684: =(X684*4)+(Z684*2) -> 24
A685: FRANKSTON | C685: 6 | D685: 1 | E685: =(C685*6)+D685 -> 37 | G685: 11 | H685: 3 | I685: =(G685*6)+H685 -> 69 | K685: 13 | L685: 5 | M685: =(K685*6)+L685 -> 83 | O685: 16 | P685: 9 | Q685: =(O685*6)+P685 -> 105 | S685: Venue: PORT MELBOURNE | W685: FRANKSTON | X685: 6 | Y685: 4 | Z685: 0 | AA685: 883 | AB685: 838 | AC685: =(AA685/AB685)*100 -> 105.36992840095465 | AD685: =(X685*4)+(Z685*2) -> 24
A686: PORT MELBOURNE | C686: 6 | D686: 2 | E686: =(C686*6)+D686 -> 38 | G686: 8 | H686: 5 | I686: =(G686*6)+H686 -> 53 | K686: 11 | L686: 6 | M686: =(K686*6)+L686 -> 72 | O686: 13 | P686: 8 | Q686: =(O686*6)+P686 -> 86 | W686: ESSENDON | X686: 6 | Y686: 4 | Z686: 0 | AA686: 906 | AB686: 926 | AC686: =(AA686/AB686)*100 -> 97.840172786177106 | AD686: =(X686*4)+(Z686*2) -> 24
A687: BEST PLAYERS | W687: CARLTON | X687: 5 | Y687: 5 | Z687: 0 | AA687: 843 | AB687: 765 | AC687: =(AA687/AB687)*100 -> 110.19607843137256 | AD687: =(X687*4)+(Z687*2) -> 20
A688: FRANKSTON | C688: BURGMAN | F688: BEVERIDGE | I688: SIMISTER | L688: GEORGIOU | O688: LYON | R688: PITTS
A689: PORT MELBOURNE | C689: BUCHANAN | F689: ELLIOTT | I689: EVANS | L689: O'KEEFE | O689: PILTZ | R689: WHITE | W689: SANDRINGHAM | X689: 4 | Y689: 6 | Z689: 0 | AA689: 890 | AB689: 796 | AC689: =(AA689/AB689)*100 -> 111.80904522613065 | AD689: =(X689*4)+(Z689*2) -> 16
A690: GOALKICKERS | W690: GEELONG | X690: 4 | Y690: 6 | Z690: 0 | AA690: 786 | AB690: 789 | AC690: =(AA690/AB690)*100 -> 99.619771863117862 | AD690: =(X690*4)+(Z690*2) -> 16
A691: FRANKSTON | C691: SAUTNER 5 | F691: SIMISTER 4 | I691: LYON 2 | K691: D CLARKE 2 | N691: MALLOY | P691: FRATER | R691: McCORMACK | W691: PORT MELBOURNE | X691: 4 | Y691: 6 | Z691: 0 | AA691: 942 | AB691: 988 | AC691: =(AA691/AB691)*100 -> 95.344129554655865 | AD691: =(X691*4)+(Z691*2) -> 16
A692: PORT MELBOURNE | C692: PILTZ 3 | E692: MILHUISEN 3 | H692: STEVENS 2 | K692: BUCHANAN | M692: O'KEEFE | O692: SPENCER | Q692: ABLETT | S692: ARNOLD | W692: WILLIAMSTOWN | X692: 4 | Y692: 6 | Z692: 0 | AA692: 881 | AB692: 990 | AC692: =(AA692/AB692)*100 -> 88.98989898989899 | AD692: =(X692*4)+(Z692*2) -> 16
W693: TASMANIA | X693: 4 | Y693: 6 | Z693: 0 | AA693: 783 | AB693: 1162 | AC693: =(AA693/AB693)*100 -> 67.383820998278836 | AD693: =(X693*4)+(Z693*2) -> 16
A694: ESSENDON | C694: 4 | D694: 1 | E694: =(C694*6)+D694 -> 25 | G694: 10 | H694: 6 | I694: =(G694*6)+H694 -> 66 | K694: 14 | L694: 10 | M694: =(K694*6)+L694 -> 94 | O694: 19 | P694: 15 | Q694: =(O694*6)+P694 -> 129 | S694: Venue: SHEPLEY OVAL | W694: NORTH BALLARAT | X694: 3 | Y694: 7 | Z694: 0 | AA694: 711 | AB694: 1095 | AC694: =(AA694/AB694)*100 -> 64.93150684931507 | AD694: =(X694*4)+(Z694*2) -> 12
A695: SPRINGVALE | C695: 6 | D695: 7 | E695: =(C695*6)+D695 -> 43 | G695: 9 | H695: 11 | I695: =(G695*6)+H695 -> 65 | K695: 13 | L695: 12 | M695: =(K695*6)+L695 -> 90 | O695: 15 | P695: 13 | Q695: =(O695*6)+P695 -> 103 | W695: NORTHERN BULLANTS | X695: 2 | Y695: 8 | Z695: 0 | AA695: 814 | AB695: 860 | AC695: =(AA695/AB695)*100 -> 94.651162790697668 | AD695: =(X695*4)+(Z695*2) -> 8
A696: BEST PLAYERS | W696: BENDIGO | X696: 0 | Y696: 10 | Z696: 0 | AA696: 666 | AB696: 1078 | AC696: =(AA696/AB696)*100 -> 61.781076066790355 | AD696: =(X696*4)+(Z696*2) -> 0
A697: ESSENDON | C697: BANNISTER | F697: SWITALA | I697: RICHARDS | L697: DENHAM | O697: BOLTON | Q697: D JOHNSON
A698: SPRINGVALE | C698: HARRISON | F698: CARMODY | I698: SCHWARZE | L698: TROLLOPE | O698: OLIVER
A699: GOALKICKERS | J699: DENHAM | L699: PODSIADLY | O699: CLARKE | Q699: WILSON
A700: ESSENDON | C700: HAWKINS 4 | F700: BANNISTER 3 | I700: MAHONEY 3 | L700: GODDARD 2 | O700: CRANAGE 2 | R700: WHITTLE
A701: SPRINGVALE | C701: CARMODY 2 | F701: DAVIS 2 | H701: HARRISON 2 | K701: PITT 2 | M701: ROBBINS 2 | O701: SMITH 2 | Q701: BERRY | S701: SCHWARZE
P702: WALTON
A703: COBURG | C703: 4 | D703: 2 | E703: =(C703*6)+D703 -> 26 | G703: 9 | H703: 6 | I703: =(G703*6)+H703 -> 60 | K703: 13 | L703: 9 | M703: =(K703*6)+L703 -> 87 | O703: 14 | P703: 9 | Q703: =(O703*6)+P703 -> 93 | S703: Venue: COBURG
A704: CARLTON | C704: 2 | D704: 2 | E704: =(C704*6)+D704 -> 14 | G704: 6 | H704: 3 | I704: =(G704*6)+H704 -> 39 | K704: 9 | L704: 6 | M704: =(K704*6)+L704 -> 60 | O704: 13 | P704: 8 | Q704: =(O704*6)+P704 -> 86
A705: BEST PLAYERS
A706: COBURG | C706: POYAS | F706: PETTIFER | I706: COUGHLAN | L706: PAGAN | O706: McLEOD | R706: SZILLER
A707: CARLTON | C707: MERRINGTON | F707: CULPITT | I707: WIGGINS
A708: GOALKICKERS
A709: COBURG | C709: POYAS 5 | F709: PETTIFER 5 | I709: NEWMAN | K709: FIORA | M709: HART | O709: EDNIE
A710: CARLTON | C710: SINNOTT 2 | F710: PLUNKETT 2 | I710: BEASY 2 | K710: BACKWELL | N710: CHATFIELD | Q710: MERRINGTON | T710: WHITE | V710: CULPITT | X710: PICKERING | AA710: RICE
A712: NORTHERN BULLANTS | C712: 4 | D712: 7 | E712: =(C712*6)+D712 -> 31 | G712: 6 | H712: 8 | I712: =(G712*6)+H712 -> 44 | K712: 9 | L712: 13 | M712: =(K712*6)+L712 -> 67 | O712: 13 | P712: 18 | Q712: =(O712*6)+P712 -> 96 | S712: Venue: NORTH BALLARAT
A713: NORTH BALLARAT | C713: 2 | D713: 0 | E713: =(C713*6)+D713 -> 12 | G713: 5 | H713: 4 | I713: =(G713*6)+H713 -> 34 | K713: 5 | L713: 6 | M713: =(K713*6)+L713 -> 36 | O713: 10 | P713: 9 | Q713: =(O713*6)+P713 -> 69
A714: BEST PLAYERS
A715: NORTHERN BULLANTS | C715: VAN HATTUM | F715: CANN | I715: WATSON | L715: CUSACK | N715: D EVANS | Q715: RAMSAY
A716: NORTH BALLARAT | C716: BROWN | F716: COLLARD | I716: JURICA | L716: RUYG | N716: CLAYTON
A717: GOALKICKERS
A718: NORTHERN BULLANTS | C718: CANN 4 | E718: GRAINGER 2 | H718: WATSON | J718: RAMSAY | L718: CARACELLA | O718: PATERSON | Q718: D EVANS | S718: CUSACK | V718: VAN BLOMMESTEIN
A719: NORTH BALLARAT | C719: COLLARD 5 | F719: BAKER 2 | I719: MAIN | K719: JIURICA | M719: RUYG
D720: 10TH JUNE | J720: WEATHER
A721: BOX HILL | C721: 6 | D721: 3 | E721: =(C721*6)+D721 -> 39 | G721: 11 | H721: 7 | I721: =(G721*6)+H721 -> 73 | K721: 13 | L721: 9 | M721: =(K721*6)+L721 -> 87 | O721: 15 | P721: 12 | Q721: =(O721*6)+P721 -> 102 | S721: Venue: SHELL STADIUM
A722: GEELONG | C722: 2 | D722: 1 | E722: =(C722*6)+D722 -> 13 | G722: 4 | H722: 1 | I722: =(G722*6)+H722 -> 25 | K722: 8 | L722: 3 | M722: =(K722*6)+L722 -> 51 | O722: 10 | P722: 5 | Q722: =(O722*6)+P722 -> 65
A723: BEST PLAYERS
A724: BOX HILL | C724: COX | F724: BREWER | I724: DENT | L724: RIES | O724: GREENE | R724: OSBORNE
A725: GEELONG | C725: C HUNT | F725: MOONEY | I725: NICHOLSON | L725: WOOLNOUGH | O725: HOSKING | R725: POWELL
A726: GOALKICKERS
A727: BOX HILL | C727: PUGSLEY 3 | F727: OSBORNE 3 | I727: HAZELL 2 | L727: PICIAONE 2 | O727: GREENE 2 | Q727: RIES | S727: MITCHELL | V727: WILLIAMS
A728: GEELONG | C728: BALDWIN 2 | F728: HOSKING 2 | I728: ROOKE 2 | L728: HUNT | N728: NICHOLSON | Q728: SHAW | S728: SPOLDING
A730: WERRIBEE | C730: 5 | D730: 2 | E730: =(C730*6)+D730 -> 32 | G730: 7 | H730: 4 | I730: =(G730*6)+H730 -> 46 | K730: 11 | L730: 8 | M730: =(K730*6)+L730 -> 74 | O730: 13 | P730: 10 | Q730: =(O730*6)+P730 -> 88 | S730: Venue: NORTH HOBART OVAL
A731: TASMANIA | C731: 4 | D731: 2 | E731: =(C731*6)+D731 -> 26 | G731: 5 | H731: 2 | I731: =(G731*6)+H731 -> 32 | K731: 9 | L731: 4 | M731: =(K731*6)+L731 -> 58 | O731: 11 | P731: 7 | Q731: =(O731*6)+P731 -> 73
A732: BEST PLAYERS
A733: WERRIBEE | C733: SMITH | F733: DIMMATINA | I733: McMAHON | L733: BIRSS | N733: MURPHY | Q733: FROST
A734: TASMANIA | C734: WALKER | F734: McHENDRICK | I734: COLE | L734: THURLEY | N734: CARTER | Q734: BEAUMONT
A735: GOALKICKERS
A736: WERRIBEE | C736: DIMMATINA 2 | F736: SAUNDERS 2 | I736: FULLER 2 | K736: DOOLEY 2 | M736: BOWDEN | O736: ALVEY | Q736: McMAHON | T736: MITCHELL | W736: ROBERTSON
A737: TASMANIA | C737: THURLEY 4 | F737: McHENDRICK 2 | J737: ATKIN | L737: GEAPPEN | N737: CARTER | P737: BRITTEN | R737: ALLEN
A739: WILLIAMSTOWN | C739: 3 | D739: 2 | E739: =(C739*6)+D739 -> 20 | G739: 7 | H739: 5 | I739: =(G739*6)+H739 -> 47 | K739: 11 | L739: 7 | M739: =(K739*6)+L739 -> 73 | O739: 11 | P739: 9 | Q739: =(O739*6)+P739 -> 75 | S739: Venue: BEACH ROAD
A740: SANDRINGHAM | C740: 2 | D740: 4 | E740: =(C740*6)+D740 -> 16 | G740: 5 | H740: 9 | I740: =(G740*6)+H740 -> 39 | K740: 5 | L740: 15 | M740: =(K740*6)+L740 -> 45 | O740: 8 | P740: 21 | Q740: =(O740*6)+P740 -> 69
A741: BEST PLAYERS
A742: WILLIAMSTOWN | C742: LLOYD | F742: SCOTLAND | I742: BROWN | L742: WEST | N742: KINNEAR | Q742: DIDAK
A743: SANDRINGHAM | C743: FEBEY | F743: MACGEORGE | I743: COGHLAN | L743: PITT | N743: HACKETT
A744: GOALKICKERS
A745: WILLIAMSTOWN | C745: LLOYD 2 | F745: TAYLOR 2 | I745: ANDERSON | L745: HILL | N745: TUCKEY | P745: CLOKE | R745: KING | T745: SMOKER | W745: ADKINS
A746: SANDRINGHAM | C746: HACKETT 3 | F746: PITT 2 | I746: MACGEORGE | L746: WILLIAMS | N746: FUNCKE
A748: ROUND 11 | D748: 16TH JUNE | J748: WEATHER
D749: 1ST QTR | H749: 2ND QTR | L749: 3RD QTR | P749: FINAL | S749: Venue: SHELL STADIUM (C/R)
A750: WERRIBEE | C750: 4 | D750: 4 | E750: =(C750*6)+D750 -> 28 | G750: 7 | H750: 6 | I750: =(G750*6)+H750 -> 48 | K750: 12 | L750: 4 | M750: =(K750*6)+L750 -> 76 | O750: 17 | P750: 15 | Q750: =(O750*6)+P750 -> 117 | S750: UMPIRES | Y750: LADDER | AB750: ROUND | AD750: 11
A751: GEELONG | C751: 1 | D751: 2 | E751: =(C751*6)+D751 -> 8 | G751: 2 | H751: 4 | I751: =(G751*6)+H751 -> 16 | K751: 7 | L751: 5 | M751: =(K751*6)+L751 -> 47 | O751: 6 | P751: 6 | Q751: =(O751*6)+P751 -> 42
A752: BEST PLAYERS | W752: TEAM | X752: W | Y752: L | Z752: D | AA752: FOR | AB752: AGST | AC752: % | AD752: PTS
A753: WERRIBEE | C753: CHURCHILL | F753: DOOLEY | I753: ROMERO | L753: FROST | O753: ALVEY | Q753: SAUNDERS
A754: GEELONG | C754: HUNT | F754: NICHOLSON | I754: CORRIGAN | L754: WOJINSKI | O754: BAUER | W754: WERRIBEE | X754: 11 | Y754: 0 | Z754: 0 | AA754: 1174 | AB754: 683 | AC754: =(AA754/AB754)*100 -> 171.8887262079063 | AD754: =(X754*4)+(Z754*2) -> 44
A755: GOALKICKERS | W755: BOX HILL | X755: 9 | Y755: 2 | Z755: 0 | AA755: 1288 | AB755: 798 | AC755: =(AA755/AB755)*100 -> 161.40350877192981 | AD755: =(X755*4)+(Z755*2) -> 36
A756: WERRIBEE | C756: DOOLEY 5 | E756: SUTTON 4 | G756: BIRSS 2 | I756: LAMB | K756: SAUNDERS | M756: BAKER | O756: CHURCHILL | Q756: HYDE | R756: ROMERO | W756: SPRINGVALE | X756: 8 | Y756: 3 | Z756: 0 | AA756: 1057 | AB756: 925 | AC756: =(AA756/AB756)*100 -> 114.27027027027027 | AD756: =(X756*4)+(Z756*2) -> 32
A757: GEELONG | C757: CORRIGAN 2 | F757: NICHOLSON 2 | I757: BALDWIN | L757: SINNOTT | W757: MURRAY KANGAROOS | X757: 7 | Y757: 4 | Z757: 0 | AA757: 1163 | AB757: 1020 | AC757: =(AA757/AB757)*100 -> 114.01960784313725 | AD757: =(X757*4)+(Z757*2) -> 28
W758: COBURG | X758: 7 | Y758: 4 | Z758: 0 | AA758: 939 | AB758: 881 | AC758: =(AA758/AB758)*100 -> 106.58342792281499 | AD758: =(X758*4)+(Z758*2) -> 28
A759: ESSENDON | C759: 4 | D759: 3 | E759: =(C759*6)+D759 -> 27 | G759: 6 | H759: 3 | I759: =(G759*6)+H759 -> 39 | K759: 7 | L759: 9 | M759: =(K759*6)+L759 -> 51 | O759: 9 | P759: 11 | Q759: =(O759*6)+P759 -> 65 | S759: Venue: WINDY HILL | W759: ESSENDON | X759: 7 | Y759: 4 | Z759: 0 | AA759: 971 | AB759: 965 | AC759: =(AA759/AB759)*100 -> 100.62176165803109 | AD759: =(X759*4)+(Z759*2) -> 28
A760: TASMANIA | C760: 1 | D760: 2 | E760: =(C760*6)+D760 -> 8 | G760: 2 | H760: 2 | I760: =(G760*6)+H760 -> 14 | K760: 4 | L760: 2 | M760: =(K760*6)+L760 -> 26 | O760: 6 | P760: 3 | Q760: =(O760*6)+P760 -> 39 | W760: CARLTON | X760: 6 | Y760: 5 | Z760: 0 | AA760: 944 | AB760: 854 | AC760: =(AA760/AB760)*100 -> 110.53864168618266 | AD760: =(X760*4)+(Z760*2) -> 24
A761: BEST PLAYERS | W761: FRANKSTON | X761: 6 | Y761: 5 | Z761: 0 | AA761: 975 | AB761: 939 | AC761: =(AA761/AB761)*100 -> 103.83386581469649 | AD761: =(X761*4)+(Z761*2) -> 24
A762: ESSENDON | C762: SWITALA | F762: BULLEN | I762: BOLTON | L762: D JOHNSON | O762: RICHARDS
A763: TASMANIA | C763: HOWARD | F763: CALLINAN | I763: WALKER | L763: WAGER | O763: MILLAR | W763: SANDRINGHAM | X763: 5 | Y763: 6 | Z763: 0 | AA763: 1009 | AB763: 856 | AC763: =(AA763/AB763)*100 -> 117.87383177570095 | AD763: =(X763*4)+(Z763*2) -> 20
A764: GOALKICKERS | W764: PORT MELBOURNE | X764: 4 | Y764: 7 | Z764: 0 | AA764: 1017 | AB764: 1070 | AC764: =(AA764/AB764)*100 -> 95.046728971962608 | AD764: =(X764*4)+(Z764*2) -> 16
A765: ESSENDON | C765: MAHONY 2 | F765: PAVEY 2 | H765: McALISTER | K765: JOHNSON | M765: DUKES | O765: HAWKINS | Q765: BOLTON | W765: GEELONG | X765: 4 | Y765: 7 | Z765: 0 | AA765: 828 | AB765: 906 | AC765: =(AA765/AB765)*100 -> 91.390728476821195 | AD765: =(X765*4)+(Z765*2) -> 16
A766: TASMANIA | C766: JONES | E766: THURLEY | G766: McKENDRICK | J766: HOWARD | M766: CALLINAN | O766: COONEY | W766: WILLIAMSTOWN | X766: 4 | Y766: 7 | Z766: 0 | AA766: 948 | AB766: 1070 | AC766: =(AA766/AB766)*100 -> 88.598130841121488 | AD766: =(X766*4)+(Z766*2) -> 16
W767: NORTH BALLARAT | X767: 4 | Y767: 7 | Z767: 0 | AA767: 791 | AB767: 1162 | AC767: =(AA767/AB767)*100 -> 68.07228915662651 | AD767: =(X767*4)+(Z767*2) -> 16
A768: SANDRINGHAM | C768: 0 | D768: 2 | E768: =(C768*6)+D768 -> 2 | G768: 4 | H768: 9 | I768: =(G768*6)+H768 -> 33 | K768: 14 | L768: 11 | M768: =(K768*6)+L768 -> 95 | O768: 17 | P768: 17 | Q768: =(O768*6)+P768 -> 119 | S768: Venue: BEACH ROAD | W768: TASMANIA | X768: 4 | Y768: 7 | Z768: 0 | AA768: 822 | AB768: 1227 | AC768: =(AA768/AB768)*100 -> 66.992665036674808 | AD768: =(X768*4)+(Z768*2) -> 16
A769: NORTHERN BULLANTS | C769: 3 | D769: 9 | E769: =(C769*6)+D769 -> 27 | G769: 5 | H769: 11 | I769: =(G769*6)+H769 -> 41 | K769: 7 | L769: 11 | M769: =(K769*6)+L769 -> 53 | O769: 8 | P769: 12 | Q769: =(O769*6)+P769 -> 60 | W769: NORTHERN BULLANTS | X769: 2 | Y769: 9 | Z769: 0 | AA769: 874 | AB769: 979 | AC769: =(AA769/AB769)*100 -> 89.274770173646573 | AD769: =(X769*4)+(Z769*2) -> 8
A770: BEST PLAYERS | W770: BENDIGO | X770: 0 | Y770: 11 | Z770: 0 | AA770: 763 | AB770: 1200 | AC770: =(AA770/AB770)*100 -> 63.583333333333336 | AD770: =(X770*4)+(Z770*2) -> 0
A771: SANDRINGHAM | C771: LIDDELL | F771: COGHLAN | I771: RIGONI | L771: TEMPLETON | O771: McKELLAR | R771: WILLIAMS
A772: NORTHERN BULLANTS | C772: RAMSAY | F772: GIESON | I772: LEE | L772: WATSON
A773: GOALKICKERS
A774: SANDRINGHAM | C774: WILSON 3 | E774: DOHERTY 3 | G774: WILLIAMS 2 | J774: JOLLY 2 | L774: BARROW 2 | N774: RIGONI 2 | P774: McKELLAR | R774: TEMPLETON | U774: CLARKE
A775: NORTHERN BULLANTS | C775: GRAINGER 3 | F775: WATSON 3 | I775: RASO | K775: LEE
A777: SPRINGVALE | C777: 6 | D777: 3 | E777: =(C777*6)+D777 -> 39 | G777: 9 | H777: 7 | I777: =(G777*6)+H777 -> 61 | K777: 11 | L777: 12 | M777: =(K777*6)+L777 -> 78 | O777: 18 | P777: 14 | Q777: =(O777*6)+P777 -> 122 | S777: Venue: BENDIGO
A778: BENDIGO | C778: 1 | D778: 4 | E778: =(C778*6)+D778 -> 10 | G778: 4 | H778: 6 | I778: =(G778*6)+H778 -> 30 | K778: 10 | L778: 8 | M778: =(K778*6)+L778 -> 68 | O778: 14 | P778: 13 | Q778: =(O778*6)+P778 -> 97
A779: BEST PLAYERS
A780: SPRINGVALE | C780: CARMODY | F780: PLAPP | I780: ROBBINSS | L780: DELARUE | O780: CARROLL | R780: YOUNG
A781: BENDIGO | C781: ATKINS | F781: POINTON | I781: BROWN | L781: SCHMITT | O781: LOCK | R781: WALSH
A782: GOALKICKERS
A783: SPRINGVALE | C783: CARMODY 3 | F783: SMITH 3 | H783: BERRY 2 | J783: CARROLL 2 | M783: O'BRIEN 2 | O783: PLAPP 2 | Q783: HARRISON | T783: ROBBINS | W783: WULF | X783: YOUNG
A784: BENDIGO | C784: BROWN 5 | F784: WALSH 4 | I784: ATKINS 2 | L784: ELLIOTT | N784: CARTER | P784: O'TOOLE
D785: 17TH JUNE | J785: WEATHER
A786: NORTH BALLARAT | C786: 1 | D786: 3 | E786: =(C786*6)+D786 -> 9 | G786: 6 | H786: 5 | I786: =(G786*6)+H786 -> 41 | K786: 8 | L786: 7 | M786: =(K786*6)+L786 -> 55 | O786: 12 | P786: 8 | Q786: =(O786*6)+P786 -> 80 | S786: Venue: WILLIAMSTOWN
A787: WILLIAMSTOWN | C787: 3 | D787: 1 | E787: =(C787*6)+D787 -> 19 | G787: 5 | H787: 4 | I787: =(G787*6)+H787 -> 34 | K787: 9 | L787: 8 | M787: =(K787*6)+L787 -> 62 | O787: 9 | P787: 13 | Q787: =(O787*6)+P787 -> 67
A788: BEST PLAYERS
A789: NORTH BALLARAT | C789: J POLKINGHORNE | G789: RUYG | I789: CLAYTON | L789: COLLARD | O789: MOLONEY | R789: MURRIHY
A790: WILLIAMSTOWN | C790: ANDERSON | G790: LLOYD | I790: SHAW | L790: WEST | O790: SHEEHAN | R790: SMOKER
A791: GOALKICKERS
A792: NORTH BALLARAT | C792: COLLARD 4 | F792: POWER 2 | H792: EDWARDS 2 | K792: J POLKINGHORNE | N792: FISHER | P792: BROWN | R792: BEACHAM
A793: WILLIAMSTOWN | C793: UKOVIC 2 | F793: TUCKEY 2 | I793: SCOTLAND 2 | L793: KING | N793: CLOKE | P793: TAYLOR
A795: CARLTON | C795: 6 | D795: 2 | E795: =(C795*6)+D795 -> 38 | G795: 10 | H795: 2 | I795: =(G795*6)+H795 -> 62 | K795: 12 | L795: 9 | M795: =(K795*6)+L795 -> 81 | O795: 15 | P795: 11 | Q795: =(O795*6)+P795 -> 101 | S795: Venue: FRANKSTON
A796: FRANKSTON | C796: 3 | D796: 0 | E796: =(C796*6)+D796 -> 18 | G796: 6 | H796: 2 | I796: =(G796*6)+H796 -> 38 | K796: 10 | L796: 5 | M796: =(K796*6)+L796 -> 65 | O796: 14 | P796: 8 | Q796: =(O796*6)+P796 -> 92
A797: BEST PLAYERS
A798: CARLTON | C798: WHITE | F798: PLUNKETT | I798: CRANAGE | L798: FLETCHER | O798: MERRINGTON | R798: O'KEEFE
A799: FRANKSTON | C799: ABLETT | F799: LITTLE | I799: BURGMAN | L799: FOLINO | O799: DAFF
A800: GOALKICKERS
A801: CARLTON | C801: BACKWELL 3 | F801: PLUNKETT 3 | I801: WHITE 2 | K801: SINNOTT 2 | M801: McKEON 2 | O801: CRANAGE | Q801: PRENDERGAST | T801: FLETCHER
A802: FRANKSTON | C802: SAUTNER 5 | F802: MALLOY 2 | I802: SALISBURY 2 | L802: BEVERIDGE | O802: WINTERTON | R802: GEORGIOU | U802: McCORMACK | X802: SIMISTER
A804: BOX HILL | C804: 3 | D804: 3 | E804: =(C804*6)+D804 -> 21 | G804: 6 | H804: 8 | I804: =(G804*6)+H804 -> 44 | K804: 11 | L804: 10 | M804: =(K804*6)+L804 -> 76 | O804: 15 | P804: 14 | Q804: =(O804*6)+P804 -> 104 | S804: Venue: BOX HILL
A805: MURRAY KANGAROOS | C805: 4 | D805: 4 | E805: =(C805*6)+D805 -> 28 | G805: 9 | H805: 6 | I805: =(G805*6)+H805 -> 60 | K805: 12 | L805: 9 | M805: =(K805*6)+L805 -> 81 | O805: 14 | P805: 13 | Q805: =(O805*6)+P805 -> 97
A806: BEST PLAYERS
A807: BOX HILL | C807: BREWER | F807: GEORGIADIS | I807: BARLOW | L807: COX | O807: TUCK | Q807: LORD
A808: MURRAY KANGAROOS | C808: RAWLINGS | F808: WATT | I808: JONES
A809: GOALKICKERS
A810: BOX HILL | C810: LORD 4 | E810: MITCHELL 2 | H810: HAZELL | J810: GEORGIADIS | M810: WILLIAMS | O810: BARLOW | Q810: TUCK | S810: COX | U810: BREWER | X810: PICCIAONE | AA810: RIES
A811: MURRAY KANGAROOS | C811: JONES 4 | E811: McLAREN 3 | H811: MORRELL 2 | K811: HARDING 2 | N811: WOODLEY | Q811: SINCLAIR | S811: SMITH
A813: COBURG | C813: 3 | D813: 0 | E813: =(C813*6)+D813 -> 18 | G813: 5 | H813: 2 | I813: =(G813*6)+H813 -> 32 | K813: 11 | L813: 3 | M813: =(K813*6)+L813 -> 69 | O813: 11 | P813: 16 | Q813: =(O813*6)+P813 -> 82 | S813: Venue: COBURG
A814: PORT MELBOURNE | C814: 5 | D814: 5 | E814: =(C814*6)+D814 -> 35 | G814: 7 | H814: 8 | I814: =(G814*6)+H814 -> 50 | K814: 10 | L814: 12 | M814: =(K814*6)+L814 -> 72 | O814: 12 | P814: 3 | Q814: =(O814*6)+P814 -> 75
A815: BEST PLAYERS
A816: COBURG | C816: EDNIE | F816: BURKE | I816: DE PASQUALE | M816: BURGIEL | O816: COGHLAN | R816: WESTON
A817: PORT MELBOURNE | C817: ABLETT | F817: BUCHANAN | I817: DOYLE | L817: KENNEALLY | O817: KIRK | R817: McMAHON
A818: GOALKICKERS
A819: COBURG | C819: EDNIE 4 | E819: BURGIEL 3 | H819: PETTIFER 2 | K819: POYAS | M819: MILLS | O819: HOMEWOOD | W819: 1OVER
A820: PORT MELBOURNE | C820: PLUTZ 2 | E820: STEVENS 2 | H820: BUCHANAN 2 | K820: BENNETT 2 | N820: FILANDIA | Q820: McMAHON | T820: O'KEEFE | W820: 1 SHORT
A822: ROUND 12 | D822: 30TH JUNE | J822: WEATHER
D823: 1ST QTR | H823: 2ND QTR | L823: 3RD QTR | P823: FINAL | S823: Venue: OPTUS OVAL
A824: CARLTON | C824: 5 | D824: 3 | E824: =(C824*6)+D824 -> 33 | G824: 8 | H824: 4 | I824: =(G824*6)+H824 -> 52 | K824: 11 | L824: 6 | M824: =(K824*6)+L824 -> 72 | O824: 14 | P824: 10 | Q824: =(O824*6)+P824 -> 94 | S824: UMPIRES | Y824: LADDER | AB824: ROUND | AD824: 12
A825: WERRIBEE | C825: 3 | D825: 4 | E825: =(C825*6)+D825 -> 22 | G825: 4 | H825: 7 | I825: =(G825*6)+H825 -> 31 | K825: 10 | L825: 9 | M825: =(K825*6)+L825 -> 69 | O825: 12 | P825: 11 | Q825: =(O825*6)+P825 -> 83
A826: BEST PLAYERS | W826: TEAM | X826: W | Y826: L | Z826: D | AA826: FOR | AB826: AGST | AC826: % | AD826: PTS
A827: CARLTON | C827: SPORN | F827: PICKFORD | I827: WATSON | L827: RICE | N827: DOERING | Q827: JACOTINE
A828: WERRIBEE | C828: COX | F828: SAUNDERS | I828: FAULKNER | L828: SMITH | N828: PULI | Q828: ALVEY | W828: WERRIBEE | X828: 11 | Y828: 1 | Z828: 0 | AA828: 1257 | AB828: 777 | AC828: =(AA828/AB828)*100 -> 161.77606177606179 | AD828: =(X828*4)+(Z828*2) -> 44
A829: GOALKICKERS | M829: SINNOT | O829: McKEON | W829: BOX HILL | X829: 10 | Y829: 2 | Z829: 0 | AA829: 1418 | AB829: 874 | AC829: =(AA829/AB829)*100 -> 162.24256292906179 | AD829: =(X829*4)+(Z829*2) -> 40
A830: CARLTON | C830: MERRINGTON 4 | F830: CRANAGE 2 | I830: WHITE 2 | K830: PICKERING 2 | N830: PRENDERGAST | Q830: FREDRICKS | W830: SPRINGVALE | X830: 9 | Y830: 3 | Z830: 0 | AA830: 1217 | AB830: 1029 | AC830: =(AA830/AB830)*100 -> 118.27016520894071 | AD830: =(X830*4)+(Z830*2) -> 36
A831: WERRIBEE | C831: SAUNDERS 5 | F831: DOOLEY 2 | I831: COX 2 | K831: FULLER 2 | N831: SMITH | W831: ESSENDON | X831: 8 | Y831: 4 | Z831: 0 | AA831: 1153 | AB831: 1066 | AC831: =(AA831/AB831)*100 -> 108.16135084427768 | AD831: =(X831*4)+(Z831*2) -> 32
W832: MURRAY KANGAROOS | X832: 7 | Y832: 5 | Z832: 0 | AA832: 1223 | AB832: 1087 | AC832: =(AA832/AB832)*100 -> 112.51149954001841 | AD832: =(X832*4)+(Z832*2) -> 28
A833: BOX HILL | C833: 5 | D833: 4 | E833: =(C833*6)+D833 -> 34 | G833: 11 | H833: 7 | I833: =(G833*6)+H833 -> 73 | K833: 14 | L833: 11 | M833: =(K833*6)+L833 -> 95 | O833: 19 | P833: 16 | Q833: =(O833*6)+P833 -> 130 | S833: Venue: PRESTON | W833: CARLTON | X833: 7 | Y833: 5 | Z833: 0 | AA833: 1038 | AB833: 937 | AC833: =(AA833/AB833)*100 -> 110.77908217716114 | AD833: =(X833*4)+(Z833*2) -> 28
A834: NORTHERN BULLANTS | C834: 3 | D834: 1 | E834: =(C834*6)+D834 -> 19 | G834: 4 | H834: 3 | I834: =(G834*6)+H834 -> 27 | K834: 10 | L834: 7 | M834: =(K834*6)+L834 -> 67 | O834: 11 | P834: 10 | Q834: =(O834*6)+P834 -> 76 | W834: FRANKSTON | X834: 7 | Y834: 5 | Z834: 0 | AA834: 1042 | AB834: 999 | AC834: =(AA834/AB834)*100 -> 104.30430430430431 | AD834: =(X834*4)+(Z834*2) -> 28
A835: BEST PLAYERS | W835: COBURG | X835: 7 | Y835: 5 | Z835: 0 | AA835: 1043 | AB835: 1041 | AC835: =(AA835/AB835)*100 -> 100.19212295869357 | AD835: =(X835*4)+(Z835*2) -> 28
A836: BOX HILL | C836: TUCK | F836: COX | I836: BAIRD | L836: BREWER | N836: HAZELL | Q836: GREENE
A837: NORTHERN BULLANTS | C837: GIBSON | F837: CANN | I837: RASO | L837: WATSON | N837: ZORZI | Q837: CRAMP | W837: SANDRINGHAM | X837: 6 | Y837: 6 | Z837: 0 | AA837: 1102 | AB837: 946 | AC837: =(AA837/AB837)*100 -> 116.49048625792813 | AD837: =(X837*4)+(Z837*2) -> 24
A838: GOALKICKERS | K838: WILLIAMS | M838: JOHNSON | P838: ROCK | R838: CAMPBELL | W838: GEELONG | X838: 5 | Y838: 7 | Z838: 0 | AA838: 931 | AB838: 1004 | AC838: =(AA838/AB838)*100 -> 92.729083665338635 | AD838: =(X838*4)+(Z838*2) -> 20
A839: BOX HILL | C839: TUCK 3 | E839: BREWER 3 | H839: HAZELL 2 | J839: PUGSLEY 2 | M839: GREENE 2 | O839: COLLINS | Q839: DENT | R839: COX | W839: TASMANIA | X839: 5 | Y839: 7 | Z839: 0 | AA839: 931 | AB839: 1329 | AC839: =(AA839/AB839)*100 -> 70.052671181339349 | AD839: =(X839*4)+(Z839*2) -> 20
A840: NORTHERN BULLANTS | C840: WATSON 5 | F840: CANN 2 | I840: GIBSON 2 | L840: ZORZI | N840: CLARK | W840: PORT MELBOURNE | X840: 4 | Y840: 8 | Z840: 0 | AA840: 1115 | AB840: 1173 | AC840: =(AA840/AB840)*100 -> 95.055413469735711 | AD840: =(X840*4)+(Z840*2) -> 16
W841: WILLIAMSTOWN | X841: 4 | Y841: 8 | Z841: 0 | AA841: 1050 | AB841: 1179 | AC841: =(AA841/AB841)*100 -> 89.05852417302799 | AD841: =(X841*4)+(Z841*2) -> 16
A842: SPRINGVALE | C842: 5 | D842: 5 | E842: =(C842*6)+D842 -> 35 | G842: 10 | H842: 7 | I842: =(G842*6)+H842 -> 67 | K842: 13 | L842: 12 | M842: =(K842*6)+L842 -> 90 | O842: 24 | P842: 16 | Q842: =(O842*6)+P842 -> 160 | S842: Venue: MOORABBIN | W842: NORTH BALLARAT | X842: 4 | Y842: 8 | Z842: 0 | AA842: 881 | AB842: 1255 | AC842: =(AA842/AB842)*100 -> 70.199203187250987 | AD842: =(X842*4)+(Z842*2) -> 16
A843: COBURG | C843: 4 | D843: 2 | E843: =(C843*6)+D843 -> 26 | G843: 7 | H843: 6 | I843: =(G843*6)+H843 -> 48 | K843: 9 | L843: 11 | M843: =(K843*6)+L843 -> 65 | O843: 15 | P843: 14 | Q843: =(O843*6)+P843 -> 104 | W843: NORTHERN BULLANTS | X843: 2 | Y843: 10 | Z843: 0 | AA843: 950 | AB843: 1109 | AC843: =(AA843/AB843)*100 -> 85.662759242560867 | AD843: =(X843*4)+(Z843*2) -> 8
A844: BEST PLAYERS | W844: BENDIGO | X844: 0 | Y844: 12 | Z844: 0 | AA844: 864 | AB844: 1382 | AC844: =(AA844/AB844)*100 -> 62.518089725036177 | AD844: =(X844*4)+(Z844*2) -> 0
A845: SPRINGVALE | C845: CARMODY | F845: O'BRIEN | I845: POWELL | L845: CARROLL | O845: OLIVER | R845: CAPUANO
A846: COBURG | C846: EDNIE | F846: HAYNES | I846: LANG | L846: HART | O846: DEPASQUALE
A847: GOALKICKERS | M847: O'BRIEN | O847: DELARUE | Q847: HARRISON
A848: SPRINGVALE | C848: CARMODY 5 | F848: POWELL 5 | I848: SMITH 3 | K848: SCHWARZE 3 | N848: CAPUANO 2 | Q848: PITT 2 | S848: BERRY
A849: COBURG | C849: HAYNES 5 | F849: LANG 4 | I849: ZANTUCK 3 | L849: NEWMAN | N849: DEPASQUALE | Q849: KRALOUER
A851: GEELONG | C851: 1 | D851: 1 | E851: =(C851*6)+D851 -> 7 | G851: 2 | H851: 3 | I851: =(G851*6)+H851 -> 15 | K851: 5 | L851: 11 | M851: =(K851*6)+L851 -> 41 | O851: 15 | P851: 13 | Q851: =(O851*6)+P851 -> 103 | S851: Venue: PORT MELBOURNE
A852: PORT MELBOURNE | C852: 6 | D852: 4 | E852: =(C852*6)+D852 -> 40 | G852: 10 | H852: 11 | I852: =(G852*6)+H852 -> 71 | K852: 13 | L852: 14 | M852: =(K852*6)+L852 -> 92 | O852: 14 | P852: 14 | Q852: =(O852*6)+P852 -> 98
A853: BEST PLAYERS
A854: GEELONG | C854: HUNT | F854: WOJCINSKI | I854: WOOLNOUGH | L854: ROOKE | O854: MOONEY | R854: CHAPMAN
A855: PORT MELBOURNE | C855: ANSTEY | F855: DOYLE | I855: FIXTER | L855: KENNELLY | O855: ROSE | R855: O'KEEFE
A856: GOALKICKERS
A857: GEELONG | C857: MOONEY 4 | F857: CHAPMAN 2 | I857: O'BRIEN 2 | K857: KARAMATIC 2 | N857: BALDWIN | P857: COREY | R857: HUNT | T857: STREET | V857: T CLARK
A858: PORT MELBOURNE | C858: FEAST 4 | F858: O'KEEFE 3 | I858: STEVENS 2 | K858: FIXTER | M858: McMAHON | P858: ALEXANDER | S858: DELUCA | V858: SWAN
A860: SANDRINGHAM | C860: 4 | D860: 2 | E860: =(C860*6)+D860 -> 26 | G860: 6 | H860: 3 | I860: =(G860*6)+H860 -> 39 | K860: 12 | L860: 7 | M860: =(K860*6)+L860 -> 79 | O860: 14 | P860: 9 | Q860: =(O860*6)+P860 -> 93 | S860: Venue: NORTH BALLARAT
A861: NORTH BALLARAT | C861: 1 | D861: 1 | E861: =(C861*6)+D861 -> 7 | G861: 9 | H861: 2 | I861: =(G861*6)+H861 -> 56 | K861: 12 | L861: 2 | M861: =(K861*6)+L861 -> 74 | O861: 14 | P861: 6 | Q861: =(O861*6)+P861 -> 90
A862: BEST PLAYERS
A863: SANDRINGHAM | C863: MACGEORGE | F863: LIDDELL | I863: GODFREY | L863: McNICHOLAS | O863: PITT | Q863: HAYWARD
A864: NORTH BALLARAT | C864: RUYG | F864: BROWN | I864: JURICA | L864: CLAYTON | O864: J POLKINGHORNE | S864: FISHER
A865: GOALKICKERS
A866: SANDRINGHAM | C866: GODFREY 3 | F866: JOLLY 3 | I866: PITT 2 | K866: GILL 2 | M866: BARROW 2 | P866: MACGEORGE | S866: TEMPLETON
A867: NORTH BALLARAT | C867: JURICA 5 | F867: COLLARD 4 | I867: FREELAND 2 | L867: INKSTER | N867: McMAHON | Q867: POWER
D868: 1ST JULY | J868: WEATHER
A869: ESSENDON | C869: 7 | D869: 3 | E869: =(C869*6)+D869 -> 45 | G869: 13 | H869: 9 | I869: =(G869*6)+H869 -> 87 | K869: 21 | L869: 15 | M869: =(K869*6)+L869 -> 141 | O869: 27 | P869: 20 | Q869: =(O869*6)+P869 -> 182 | S869: Venue: WINDY HILL
A870: BENDIGO | C870: 4 | D870: 1 | E870: =(C870*6)+D870 -> 25 | G870: 7 | H870: 4 | I870: =(G870*6)+H870 -> 46 | K870: 12 | L870: 6 | M870: =(K870*6)+L870 -> 78 | O870: 15 | P870: 11 | Q870: =(O870*6)+P870 -> 101
A871: BEST PLAYERS
A872: ESSENDON | C872: BULLEN | F872: ROBRAN | I872: BOLTON | L872: LALICH | O872: BANNISTER
A873: BENDIGO | C873: CARTER | F873: SHIELS | I873: O'CALLAGHAN | L873: WALSH | O873: BROWN | R873: ELSUM
A874: GOALKICKERS | W874: WILSON
A875: ESSENDON | C875: ROBRAN 4 | E875: BULLEN 3 | G875: RICHARDS 3 | J875: GODDARD 3 | M875: BANNISTER 2 | P875: LALICH 2 | R875: DUKES 2 | U875: DAVIS | W875: PODSIADLY | X875: MAHONEY | AA875: DENHAM | AC875: DAVIES | AD875: SWITALA | AF875: KENNY
A876: BENDIGO | C876: BROWN 5 | F876: WALSH 4 | I876: CAMPBELL 2 | L876: CLARKE | N876: ATKINS | P876: LOCK | R876: PLIM
A878: FRANKSTON | C878: 6 | D878: 3 | E878: =(C878*6)+D878 -> 39 | G878: 7 | H878: 6 | I878: =(G878*6)+H878 -> 48 | K878: 8 | L878: 10 | M878: =(K878*6)+L878 -> 58 | O878: 9 | P878: 13 | Q878: =(O878*6)+P878 -> 67 | S878: Venue: COBURG
A879: MURRAY KANGAROOS | C879: 1 | D879: 3 | E879: =(C879*6)+D879 -> 9 | G879: 2 | H879: 7 | I879: =(G879*6)+H879 -> 19 | K879: 4 | L879: 9 | M879: =(K879*6)+L879 -> 33 | O879: 8 | P879: 12 | Q879: =(O879*6)+P879 -> 60
A880: BEST PLAYERS
A881: FRANKSTON | C881: SULLIVAN | F881: ABLETT | I881: GEORGIOU | L881: MALLOY | O881: BURGMAN | R881: FERGUSON
A882: MURRAY KANGAROOS | C882: LASSCOCK | F882: SINCLAIR | I882: PRATT | L882: GRIGG | O882: PETRIE | R882: HILTON
A883: GOALKICKERS
A884: FRANKSTON | C884: SIMISTER 3 | F884: McCORMACK 2 | J884: SAUTNER 2 | M884: WINTERTON | P884: SULLIVAN
A885: MURRAY KANGAROOS | C885: L SMITH 3 | F885: JONES 2 | I885: SINCLAIR 2 | L885: McLAREN
A887: TASMANIA | C887: 6 | D887: 0 | E887: =(C887*6)+D887 -> 36 | G887: 11 | H887: 3 | I887: =(G887*6)+H887 -> 69 | K887: 15 | L887: 6 | M887: =(K887*6)+L887 -> 96 | O887: 17 | P887: 7 | Q887: =(O887*6)+P887 -> 109 | S887: Venue: DEVONPORT
A888: WILLIAMSTOWN | C888: 6 | D888: 3 | E888: =(C888*6)+D888 -> 39 | G888: 6 | H888: 6 | I888: =(G888*6)+H888 -> 42 | K888: 11 | L888: 8 | M888: =(K888*6)+L888 -> 74 | O888: 15 | P888: 12 | Q888: =(O888*6)+P888 -> 102
A889: BEST PLAYERS
A890: TASMANIA | C890: ATKINS | F890: CARTER | I890: HOWARD | L890: TAYLOR | O890: GEAPPEN | R890: MILLER
A891: WILLIAMSTOWN | C891: KINNEAR | F891: LLOYD | I891: SCOTLAND | L891: ANDERSON | O891: UKOVIC | R891: BROWN
A892: GOALKICKERS
A893: TASMANIA | C893: THURLEY 4 | F893: COONEY 3 | I893: ALLEN 2 | K893: TREVENA 2 | N893: CALLINAN 2 | Q893: MILLAR | S893: TAYLOR | V893: THOMPSON | X893: ATKINS
A894: WILLIAMSTOWN | C894: TUCKEY 4 | F894: DIDAK 3 | I894: SCOTLAND 2 | L894: TAYLOR | N894: CLOKE | P894: UKOVIC | R894: SHAW | T894: HILL | V894: KINNEAR
A896: ROUND 13 | D896: 7TH JULY | J896: WEATHER
D897: 1ST QTR | H897: 2ND QTR | L897: 3RD QTR | P897: FINAL | S897: Venue: WERRIBEE
A898: WERRIBEE | C898: 7 | D898: 2 | E898: =(C898*6)+D898 -> 44 | G898: 14 | H898: 4 | I898: =(G898*6)+H898 -> 88 | K898: 18 | L898: 8 | M898: =(K898*6)+L898 -> 116 | O898: 23 | P898: 13 | Q898: =(O898*6)+P898 -> 151 | S898: UMPIRES | Y898: LADDER | AB898: ROUND | AD898: 13
A899: ESSENDON | C899: 4 | D899: 3 | E899: =(C899*6)+D899 -> 27 | G899: 4 | H899: 5 | I899: =(G899*6)+H899 -> 29 | K899: 7 | L899: 6 | M899: =(K899*6)+L899 -> 48 | O899: 9 | P899: 6 | Q899: =(O899*6)+P899 -> 60
A900: BEST PLAYERS | W900: TEAM | X900: W | Y900: L | Z900: D | AA900: FOR | AB900: AGST | AC900: % | AD900: PTS
A901: WERRIBEE | C901: EAGLETON | F901: FAULKNER | I901: PULI | L901: BOWDEN | O901: MCMAHON | R901: DIMMATINA
A902: ESSENDON | C902: ROBRAN | F902: DENHAM | I902: FORSTER-KNIGHT | M902: PEVERILL | O902: BOLTON | W902: WERRIBEE | X902: 12 | Y902: 1 | Z902: 0 | AA902: 1408 | AB902: 837 | AC902: =(AA902/AB902)*100 -> 168.21983273596177 | AD902: =(X902*4)+(Z902*2) -> 48
A903: GOALKICKERS | E903: BOWDEN 2 | H903: LAMB | J903: FAULKNER | M903: HARGREAVE | P903: ROBERTSON | S903: SHEEHAN | W903: BOX HILL | X903: 11 | Y903: 2 | Z903: 0 | AA903: 1503 | AB903: 957 | AC903: =(AA903/AB903)*100 -> 157.05329153605015 | AD903: =(X903*4)+(Z903*2) -> 44
A904: WERRIBEE | C904: MITCHELL 4 | F904: McMAHON 3 | I904: CHURCHILL 3 | L904: SAUNDERS 2 | O904: EAGLETON 2 | R904: PULI 2 | W904: SPRINGVALE | X904: 9 | Y904: 4 | Z904: 0 | AA904: 1303 | AB904: 1120 | AC904: =(AA904/AB904)*100 -> 116.33928571428571 | AD904: =(X904*4)+(Z904*2) -> 36
A905: ESSENDON | C905: HALL 2 | E905: DAVIS | F905: D JOHNSON | I905: FORSTER-KNIGHT | M905: GODDARD | O905: ALESSIO | Q905: RICHARDS | S905: ROBRAN | W905: MURRAY KANGAROOS | X905: 8 | Y905: 5 | Z905: 0 | AA905: 1340 | AB905: 1187 | AC905: =(AA905/AB905)*100 -> 112.88963774220724 | AD905: =(X905*4)+(Z905*2) -> 32
W906: FRANKSTON | X906: 8 | Y906: 5 | Z906: 0 | AA906: 1165 | AB906: 1033 | AC906: =(AA906/AB906)*100 -> 112.7783155856728 | AD906: =(X906*4)+(Z906*2) -> 32
A907: MURRAY KANGAROOS | C907: 4 | D907: 3 | E907: =(C907*6)+D907 -> 27 | G907: 12 | H907: 6 | I907: =(G907*6)+H907 -> 78 | K907: 13 | L907: 12 | M907: =(K907*6)+L907 -> 90 | O907: 17 | P907: 15 | Q907: =(O907*6)+P907 -> 117 | S907: Venue: BEACH ROAD | W907: ESSENDON | X907: 8 | Y907: 5 | Z907: 0 | AA907: 1213 | AB907: 1217 | AC907: =(AA907/AB907)*100 -> 99.671322925225965 | AD907: =(X907*4)+(Z907*2) -> 32
A908: SANDRINGHAM | C908: 4 | D908: 3 | E908: =(C908*6)+D908 -> 27 | G908: 5 | H908: 5 | I908: =(G908*6)+H908 -> 35 | K908: 10 | L908: 8 | M908: =(K908*6)+L908 -> 68 | O908: 15 | P908: 10 | Q908: =(O908*6)+P908 -> 100 | W908: CARLTON | X908: 7 | Y908: 6 | Z908: 0 | AA908: 1109 | AB908: 1047 | AC908: =(AA908/AB908)*100 -> 105.92168099331423 | AD908: =(X908*4)+(Z908*2) -> 28
A909: BEST PLAYERS | W909: COBURG | X909: 7 | Y909: 6 | Z909: 0 | AA909: 1126 | AB909: 1126 | AC909: =(AA909/AB909)*100 -> 100 | AD909: =(X909*4)+(Z909*2) -> 28
A910: MURRAY KANGAROOS | C910: PETRIE | F910: LASSCOCK | I910: JONES | L910: D SMITH | O910: HILTON | R910: HARRIS
A911: SANDRINGHAM | C911: LIDDELL | F911: MACGEORGE | I911: FUNCKE | L911: TEMPLETON | O911: RADFORD | R911: GRGIC | W911: SANDRINGHAM | X911: 6 | Y911: 7 | Z911: 0 | AA911: 1202 | AB911: 1063 | AC911: =(AA911/AB911)*100 -> 113.07619943555973 | AD911: =(X911*4)+(Z911*2) -> 24
A912: GOALKICKERS | R912: McLAREN | W912: PORT MELBOURNE | X912: 5 | Y912: 8 | Z912: 0 | AA912: 1225 | AB912: 1244 | AC912: =(AA912/AB912)*100 -> 98.472668810289392 | AD912: =(X912*4)+(Z912*2) -> 20
A913: MURRAY KANGAROOS | C913: L SMITH 5 | F913: ABRAHAM 3 | I913: PETRIE 3 | K913: D SMITH | M913: COLLINS | O913: HARRIS | Q913: HARDING | S913: JONES | W913: WILLIAMSTOWN | X913: 5 | Y913: 8 | Z913: 0 | AA913: 1160 | AB913: 1237 | AC913: =(AA913/AB913)*100 -> 93.775262732417147 | AD913: =(X913*4)+(Z913*2) -> 20
A914: SANDRINGHAM | C914: TEMPLETON 3 | F914: FUNCKE 3 | I914: LYNCH 2 | K914: JOHNSTONE 2 | N914: MACGEORGE 2 | Q914: PITT | R914: BEAMS | W914: GEELONG | X914: 5 | Y914: 8 | Z914: 0 | AA914: 989 | AB914: 1114 | AC914: =(AA914/AB914)*100 -> 88.779174147217233 | AD914: =(X914*4)+(Z914*2) -> 20
P915: HACKETT | W915: NORTH BALLARAT | X915: 5 | Y915: 8 | Z915: 0 | AA915: 969 | AB915: 1315 | AC915: =(AA915/AB915)*100 -> 73.688212927756652 | AD915: =(X915*4)+(Z915*2) -> 20
A916: PORT MELBOURNE | C916: 1 | D916: 0 | E916: =(C916*6)+D916 -> 6 | G916: 11 | H916: 1 | I916: =(G916*6)+H916 -> 67 | K916: 15 | L916: 6 | M916: =(K916*6)+L916 -> 96 | O916: 17 | P916: 8 | Q916: =(O916*6)+P916 -> 110 | S916: Venue: PORT MELBOURNE | W916: TASMANIA | X916: 5 | Y916: 8 | Z916: 0 | AA916: 991 | AB916: 1417 | AC916: =(AA916/AB916)*100 -> 69.936485532815809 | AD916: =(X916*4)+(Z916*2) -> 20
A917: CARLTON | C917: 7 | D917: 4 | E917: =(C917*6)+D917 -> 46 | G917: 8 | H917: 9 | I917: =(G917*6)+H917 -> 57 | K917: 8 | L917: 10 | M917: =(K917*6)+L917 -> 58 | O917: 10 | P917: 11 | Q917: =(O917*6)+P917 -> 71 | W917: NORTHERN BULLANTS | X917: 3 | Y917: 10 | Z917: 0 | AA917: 1041 | AB917: 1195 | AC917: =(AA917/AB917)*100 -> 87.112970711297066 | AD917: =(X917*4)+(Z917*2) -> 12
A918: BEST PLAYERS | W918: BENDIGO | X918: 0 | Y918: 13 | Z918: 0 | AA918: 898 | AB918: 1505 | AC918: =(AA918/AB918)*100 -> 59.667774086378735 | AD918: =(X918*4)+(Z918*2) -> 0
A919: PORT MELBOURNE | C919: FEAST | F919: BUCHANAN | I919: ELLIOT | L919: EVANS | N919: FILANDIA | Q919: PILTZ
A920: CARLTON | C920: SPORN | F920: CRANAGE | I920: DOERING
A921: GOALKICKERS | Q921: McINERNEY
A922: PORT MELBOURNE | C922: BUCHANAN 6 | F922: STEVENS 3 | I922: FILANDIA 2 | L922: FEAST 2 | N922: ELLIOT | P922: ABLETT | R922: SWAN
A923: CARLTON | C923: BACKWELL 2 | F923: SINNOTT 2 | I923: CHATFIELD | L923: PRENDERGAST | O923: WHITE | Q923: SPORN | S923: FLEMING
P924: JACOTINE
A925: WILLIAMSTOWN | C925: 5 | D925: 4 | E925: =(C925*6)+D925 -> 34 | G925: 10 | H925: 10 | I925: =(G925*6)+H925 -> 70 | K925: 13 | L925: 12 | M925: =(K925*6)+L925 -> 90 | O925: 16 | P925: 14 | Q925: =(O925*6)+P925 -> 110 | S925: Venue: SHELL STADIUM
A926: GEELONG | C926: 1 | D926: 3 | E926: =(C926*6)+D926 -> 9 | G926: 4 | H926: 4 | I926: =(G926*6)+H926 -> 28 | K926: 6 | L926: 6 | M926: =(K926*6)+L926 -> 42 | O926: 8 | P926: 10 | Q926: =(O926*6)+P926 -> 58
A927: BEST PLAYERS
A928: WILLIAMSTOWN | C928: KING | F928: DIDAK | I928: TAYLOR | L928: SCOTLAND | O928: UKOVIC | R928: BROWN
A929: GEELONG | C929: MERRIMAN | F929: HUNT | I929: FOSTER | L929: WOOLNOUGH | O929: McKAY | R929: WOJCINSKI
A930: GOALKICKERS
A931: WILLIAMSTOWN | C931: SMOKER 3 | F931: SCOTLAND 3 | I931: TAYLOR 2 | K931: DIDAK 2 | M931: UKOVIC | O931: TUCKEY | Q931: HILL | R931: WOOD | T931: SHEEHAN | W931: RINTOUL
A932: GEELONG | C932: T CLARK 2 | F932: STREET 2 | I932: BALDWIN | K932: HUNT | M932: ROOKE | O932: WOJCINSKI
F933: NIGHT MATCH
A934: NORTH BALLARAT | C934: 1 | D934: 5 | E934: =(C934*6)+D934 -> 11 | G934: 6 | H934: 6 | I934: =(G934*6)+H934 -> 42 | K934: 8 | L934: 8 | M934: =(K934*6)+L934 -> 56 | O934: 13 | P934: 10 | Q934: =(O934*6)+P934 -> 88 | S934: Venue: YORK PARK (Launceston)
A935: TASMANIA | C935: 1 | D935: 2 | E935: =(C935*6)+D935 -> 8 | G935: 4 | H935: 5 | I935: =(G935*6)+H935 -> 29 | K935: 7 | L935: 10 | M935: =(K935*6)+L935 -> 52 | O935: 8 | P935: 12 | Q935: =(O935*6)+P935 -> 60
A936: BEST PLAYERS
A937: NORTH BALLARAT | C937: McMAHON | F937: SOMERVILLE | I937: JURICA | K937: POWER | N937: FISHER | Q937: CLAYTON
A938: TASMANIA | C938: WALKER | F938: McKENDRICK | I938: CARTER | K938: CARELESS | N938: TAYLOR
A939: GOALKICKERS
A940: NORTH BALLARAT | C940: POWER 4 | F940: CHATFIELD 2 | I940: McMAHON 2 | L940: COLLARD 2 | O940: CLAYTON | Q940: BROWN | S940: MAIN
A941: TASMANIA | C941: THOMPSON 3 | F941: ALLEN 2 | I941: ATKIN | K941: MILLAR | M941: DAVIS
D942: 8TH JULY | J942: WEATHER
A943: BOX HILL | C943: 3 | D943: 4 | E943: =(C943*6)+D943 -> 22 | G943: 6 | H943: 6 | I943: =(G943*6)+H943 -> 42 | K943: 9 | L943: 7 | M943: =(K943*6)+L943 -> 61 | O943: 13 | P943: 7 | Q943: =(O943*6)+P943 -> 85 | S943: Venue: BOX HILL
A944: COBURG | C944: 5 | D944: 5 | E944: =(C944*6)+D944 -> 35 | G944: 8 | H944: 6 | I944: =(G944*6)+H944 -> 54 | K944: 10 | L944: 9 | M944: =(K944*6)+L944 -> 69 | O944: 12 | P944: 11 | Q944: =(O944*6)+P944 -> 83
A945: BEST PLAYERS
A946: BOX HILL | C946: OBST | F946: NICHOLLS | I946: RIES | K946: GREENE | N946: TUCK | Q946: LONIE
A947: COBURG | C947: POYAS | F947: LAPPIN | I947: HAYNES | K947: EDNIE | N947: HOMEWOOD | Q947: COUGHLAN
A948: GOALKICKERS
A949: BOX HILL | C949: NICHOLLS 3 | F949: CLARKE 2 | I949: PUGSLEY | K949: TUCK | M949: ROCK | N949: WILLIAMS | Q949: RIES | R949: LONIE | T949: BANKS | V949: OBST
A950: COBURG | C950: HAYNES 3 | F950: BURGEIL 2 | I950: COUGHLAN 2 | L950: JAMES | N950: EDNIE | P950: POYAS | R950: LANG | T950: LAPPIN
A952: NORTHERN BULLANTS | C952: 5 | D952: 2 | E952: =(C952*6)+D952 -> 32 | G952: 8 | H952: 3 | I952: =(G952*6)+H952 -> 51 | K952: 12 | L952: 5 | M952: =(K952*6)+L952 -> 77 | O952: 14 | P952: 7 | Q952: =(O952*6)+P952 -> 91 | S952: Venue: PRESTON
A953: SPRINGVALE | C953: 3 | D953: 1 | E953: =(C953*6)+D953 -> 19 | G953: 8 | H953: 4 | I953: =(G953*6)+H953 -> 52 | K953: 11 | L953: 11 | M953: =(K953*6)+L953 -> 77 | O953: 12 | P953: 14 | Q953: =(O953*6)+P953 -> 86
A954: BEST PLAYERS
A955: NORTHERN BULLANTS | C955: GIBSON | F955: CRAMP | I955: CLARKE | L955: ZORZI | N955: FAVRIN | Q955: GRAINGER
A956: SPRINGVALE | C956: CRIPPS | F956: SCHWARZE | I956: RIEWOLDT | L956: KNOWLES
A957: GOALKICKERS
A958: NORTHERN BULLANTS | C958: FAVRIN 4 | F958: CARACELLA 2 | J958: GRAINGER 2 | M958: PENN 2 | O958: RAMSAY 2 | R958: ZORZI 2
A959: SPRINGVALE | C959: KNOWLES 3 | F959: CARMODY 2 | I959: ROBBINS | K959: PITT | M959: CRIPPS | O959: HARRISON | Q959: RIGG | R959: RIEWOLDT | U959: DELARUE
A961: FRANKSTON | C961: 0 | D961: 2 | E961: =(C961*6)+D961 -> 2 | G961: 6 | H961: 8 | I961: =(G961*6)+H961 -> 44 | K961: 15 | L961: 14 | M961: =(K961*6)+L961 -> 104 | O961: 17 | P961: 21 | Q961: =(O961*6)+P961 -> 123 | S961: Venue: BENDIGO
A962: BENDIGO | C962: 1 | D962: 4 | E962: =(C962*6)+D962 -> 10 | G962: 1 | H962: 6 | I962: =(G962*6)+H962 -> 12 | K962: 4 | L962: 9 | M962: =(K962*6)+L962 -> 33 | O962: 4 | P962: 10 | Q962: =(O962*6)+P962 -> 34
A963: BEST PLAYERS
A964: FRANKSTON | C964: WINTERTON | F964: LITTLE | I964: BURGMAN | L964: MALLOY | O964: McCORMACK | R964: DAFF
A965: BENDIGO | C965: O'CALLAGHAN | F965: ELSUM | I965: SHIELS | L965: LOCK | O965: ATKINS | R965: N CARTER
A966: GOALKICKERS
A967: FRANKSTON | C967: SALISBURY 3 | F967: FORTNAM 3 | I967: SIMISTER 3 | L967: McCORMACK 3 | O967: SULLIVAN | Q967: FOLINO | S967: CLARKE | U967: TIBERI | W967: BEVERIDGE
A968: BENDIGO | C968: ATKINS 3 | F968: WALSH
A970: ROUND 14 | D970: 14TH JULY | J970: WEATHER
D971: 1ST QTR | H971: 2ND QTR | L971: 3RD QTR | P971: FINAL | S971: Venue: OPTUS OVAL
A972: CARLTON | C972: 3 | D972: 2 | E972: =(C972*6)+D972 -> 20 | G972: 8 | H972: 4 | I972: =(G972*6)+H972 -> 52 | K972: 11 | L972: 6 | M972: =(K972*6)+L972 -> 72 | O972: 17 | P972: 6 | Q972: =(O972*6)+P972 -> 108 | S972: UMPIRES | Y972: LADDER | AB972: ROUND | AD972: 14
A973: SANDRINGHAM | C973: 2 | D973: 2 | E973: =(C973*6)+D973 -> 14 | G973: 6 | H973: 2 | I973: =(G973*6)+H973 -> 38 | K973: 10 | L973: 3 | M973: =(K973*6)+L973 -> 63 | O973: 13 | P973: 7 | Q973: =(O973*6)+P973 -> 85
A974: BEST PLAYERS | W974: TEAM | X974: W | Y974: L | Z974: D | AA974: FOR | AB974: AGST | AC974: % | AD974: PTS
A975: CARLTON | C975: DOERING | F975: RICE | I975: SPORN | L975: BACKWELL | O975: PICKFORD | R975: DURLING
A976: SANDRINGHAM | C976: CLARK | F976: A McDONALD | I976: MACGEORGE | L976: COGHLAN | O976: JOHNSTONE | R976: LIDDELL | W976: WERRIBEE | X976: 13 | Y976: 1 | Z976: 0 | AA976: 1585 | AB976: 874 | AC976: =(AA976/AB976)*100 -> 181.35011441647598 | AD976: =(X976*4)+(Z976*2) -> 52
A977: GOALKICKERS | I977: CAMPBELL | L977: CHATFIELD | N977: CLARK | P977: JACOTINE | R977: NELSON | W977: BOX HILL | X977: 11 | Y977: 3 | Z977: 0 | AA977: 1564 | AB977: 1022 | AC977: =(AA977/AB977)*100 -> 153.03326810176125 | AD977: =(X977*4)+(Z977*2) -> 44
A978: CARLTON | C978: CRANAGE 2 | F978: LOVETT 2 | I978: WAITE 2 | K978: SPORN 2 | M978: WHITE 2 | O978: BACKWELL | R978: BEASY | W978: SPRINGVALE | X978: 10 | Y978: 4 | Z978: 0 | AA978: 1391 | AB978: 1183 | AC978: =(AA978/AB978)*100 -> 117.58241758241759 | AD978: =(X978*4)+(Z978*2) -> 40
A979: SANDRINGHAM | C979: A McDONALD 2 | F979: TEMPLETON 2 | I979: JOLLY 2 | K979: LIDDELL 2 | M979: DOHERTY | O979: BEAMS | Q979: MACGEORGE | W979: MURRAY KANGAROOS | X979: 9 | Y979: 5 | Z979: 0 | AA979: 1440 | AB979: 1258 | AC979: =(AA979/AB979)*100 -> 114.46740858505564 | AD979: =(X979*4)+(Z979*2) -> 36
N980: JOHNSTONE | S980: PITT | W980: FRANKSTON | X980: 9 | Y980: 5 | Z980: 0 | AA980: 1262 | AB980: 1128 | AC980: =(AA980/AB980)*100 -> 111.87943262411349 | AD980: =(X980*4)+(Z980*2) -> 36
A981: WILLIAMSTOWN | C981: 5 | D981: 5 | E981: =(C981*6)+D981 -> 35 | G981: 7 | H981: 6 | I981: =(G981*6)+H981 -> 48 | K981: 12 | L981: 12 | M981: =(K981*6)+L981 -> 84 | O981: 13 | P981: 16 | Q981: =(O981*6)+P981 -> 94 | S981: Venue: WILLIAMSTOWN | W981: ESSENDON | X981: 9 | Y981: 5 | Z981: 0 | AA981: 1295 | AB981: 1294 | AC981: =(AA981/AB981)*100 -> 100.0772797527048 | AD981: =(X981*4)+(Z981*2) -> 36
A982: NORTHERN BULLANTS | C982: 2 | D982: 4 | E982: =(C982*6)+D982 -> 16 | G982: 5 | H982: 9 | I982: =(G982*6)+H982 -> 39 | K982: 8 | L982: 9 | M982: =(K982*6)+L982 -> 57 | O982: 11 | P982: 13 | Q982: =(O982*6)+P982 -> 79 | W982: CARLTON | X982: 8 | Y982: 6 | Z982: 0 | AA982: 1217 | AB982: 1132 | AC982: =(AA982/AB982)*100 -> 107.50883392226149 | AD982: =(X982*4)+(Z982*2) -> 32
A983: BEST PLAYERS | W983: COBURG | X983: 7 | Y983: 7 | Z983: 0 | AA983: 1221 | AB983: 1223 | AC983: =(AA983/AB983)*100 -> 99.836467702371223 | AD983: =(X983*4)+(Z983*2) -> 28
A984: WILLIAMSTOWN | C984: UKOVIC | F984: CLOKE | I984: TUCKEY | L984: KING | O984: ANDERSON | R984: KINNEAR
A985: NORTHERN BULLANTS | C985: ZORZI | F985: CRAMP | I985: SAGE | L985: GROSSMAN | O985: GIBSON | W985: SANDRINGHAM | X985: 6 | Y985: 8 | Z985: 0 | AA985: 1287 | AB985: 1171 | AC985: =(AA985/AB985)*100 -> 109.90606319385141 | AD985: =(X985*4)+(Z985*2) -> 24
A986: GOALKICKERS | W986: PORT MELBOURNE | X986: 6 | Y986: 8 | Z986: 0 | AA986: 1290 | AB986: 1305 | AC986: =(AA986/AB986)*100 -> 98.850574712643677 | AD986: =(X986*4)+(Z986*2) -> 24
A987: WILLIAMSTOWN | C987: TUCKEY 4 | F987: BURNS 2 | I987: UKOVIC 2 | L987: SCOTLAND 2 | O987: ANDERSON | Q987: CLOKE | S987: LANE | W987: WILLIAMSTOWN | X987: 6 | Y987: 8 | Z987: 0 | AA987: 1254 | AB987: 1316 | AC987: =(AA987/AB987)*100 -> 95.288753799392097 | AD987: =(X987*4)+(Z987*2) -> 24
A988: NORTHERN BULLANTS | C988: PENN 2 | E988: WATSON 2 | H988: GIBSON 2 | J988: SCANLON | L988: GRAINGER | O988: FAVRIN | Q988: CUSACK | S988: CLARKE | W988: GEELONG | X988: 5 | Y988: 9 | Z988: 0 | AA988: 1066 | AB988: 1196 | AC988: =(AA988/AB988)*100 -> 89.130434782608688 | AD988: =(X988*4)+(Z988*2) -> 20
W989: NORTH BALLARAT | X989: 5 | Y989: 9 | Z989: 0 | AA989: 1040 | AB989: 1415 | AC989: =(AA989/AB989)*100 -> 73.4982332155477 | AD989: =(X989*4)+(Z989*2) -> 20
A990: ESSENDON | C990: 3 | D990: 4 | E990: =(C990*6)+D990 -> 22 | G990: 7 | H990: 6 | I990: =(G990*6)+H990 -> 48 | K990: 11 | L990: 8 | M990: =(K990*6)+L990 -> 74 | O990: 12 | P990: 10 | Q990: =(O990*6)+P990 -> 82 | S990: Venue: WINDY HILL | W990: TASMANIA | X990: 5 | Y990: 9 | Z990: 0 | AA990: 1054 | AB990: 1505 | AC990: =(AA990/AB990)*100 -> 70.033222591362119 | AD990: =(X990*4)+(Z990*2) -> 20
A991: GEELONG | C991: 1 | D991: 2 | E991: =(C991*6)+D991 -> 8 | G991: 4 | H991: 3 | I991: =(G991*6)+H991 -> 27 | K991: 11 | L991: 4 | M991: =(K991*6)+L991 -> 70 | O991: 12 | P991: 5 | Q991: =(O991*6)+P991 -> 77 | W991: NORTHERN BULLANTS | X991: 3 | Y991: 11 | Z991: 0 | AA991: 1120 | AB991: 1289 | AC991: =(AA991/AB991)*100 -> 86.889061287820013 | AD991: =(X991*4)+(Z991*2) -> 12
A992: BEST PLAYERS | W992: BENDIGO | X992: 0 | Y992: 14 | Z992: 0 | AA992: 935 | AB992: 1682 | AC992: =(AA992/AB992)*100 -> 55.588585017835911 | AD992: =(X992*4)+(Z992*2) -> 0
A993: ESSENDON | C993: HILLE | F993: ROBRAN | I993: DAVIS | L993: ALESSIO | O993: SWITALA
A994: GEELONG | C994: CORRIGAN | F994: NICHOLSON | I994: CHAPMAN | L994: SINNOTT | O994: MERRIMAN | R994: LOWTHER
A995: GOALKICKERS
A996: ESSENDON | C996: HILLE 6 | F996: McALISTER 2 | J996: RICHARDS | M996: DAVIES | O996: KENNY | Q996: DAVIS
A997: GEELONG | C997: BALDWIN 3 | F997: KARAMATIC 3 | J997: O'BRIEN 2 | M997: CORRIGAN | O997: HOSKING | Q997: LOWTHER | S997: POWELL
A999: MURRAY KANGAROOS | C999: 9 | D999: 5 | E999: =(C999*6)+D999 -> 59 | G999: 12 | H999: 7 | I999: =(G999*6)+H999 -> 79 | K999: 15 | L999: 7 | M999: =(K999*6)+L999 -> 97 | O999: 15 | P999: 10 | Q999: =(O999*6)+P999 -> 100 | S999: Venue: NORTH BALLARAT
A1000: NORTH BALLARAT | C1000: 3 | D1000: 1 | E1000: =(C1000*6)+D1000 -> 19 | G1000: 4 | H1000: 5 | I1000: =(G1000*6)+H1000 -> 29 | K1000: 6 | L1000: 8 | M1000: =(K1000*6)+L1000 -> 44 | O1000: 10 | P1000: 11 | Q1000: =(O1000*6)+P1000 -> 71
A1001: BEST PLAYERS
A1002: MURRAY KANGAROOS | C1002: PETRIE | F1002: HARRIS | I1002: MORRELL | L1002: MOTLOP | O1002: HILTON | R1002: PRATT
A1003: NORTH BALLARAT | C1003: CLAYTON | F1003: FREELAND | I1003: GREIG | L1003: INKSTER | O1003: MURRIHY | R1003: BROWN
A1004: GOALKICKERS
A1005: MURRAY KANGAROOS | C1005: MORRELL 4 | F1005: PETRIE 3 | I1005: L SMITH 2 | L1005: NEWTON 2 | N1005: McLAREN | P1005: COOPER | R1005: ABRAHAM | U1005: HARDING
A1006: NORTH BALLARAT | C1006: CHATFIELD 2 | F1006: McMAHON 2 | I1006: CLAYTON | K1006: COLLARD | M1006: MAIN | N1006: BYE | P1006: BROWN | R1006: INKSTER
A1008: SPRINGVALE | C1008: 3 | D1008: 3 | E1008: =(C1008*6)+D1008 -> 21 | G1008: 8 | H1008: 7 | I1008: =(G1008*6)+H1008 -> 55 | K1008: 9 | L1008: 8 | M1008: =(K1008*6)+L1008 -> 62 | O1008: 13 | P1008: 10 | Q1008: =(O1008*6)+P1008 -> 88 | S1008: Venue: SHEPLEY OVAL
A1009: TASMANIA | C1009: 3 | D1009: 6 | E1009: =(C1009*6)+D1009 -> 24 | G1009: 4 | H1009: 6 | I1009: =(G1009*6)+H1009 -> 30 | K1009: 8 | L1009: 9 | M1009: =(K1009*6)+L1009 -> 57 | O1009: 9 | P1009: 9 | Q1009: =(O1009*6)+P1009 -> 63
A1010: BEST PLAYERS
A1011: SPRINGVALE | C1011: ELLIOT | F1011: KNOWLES | I1011: LEWISON | L1011: BLAKE | O1011: TROLLOPE | R1011: CARROLL
A1012: TASMANIA | C1012: WALKER | F1012: TAYLOR | I1012: CARTER | L1012: BOLTON | O1012: McKENDRICK | R1012: ATKIN
A1013: GOALKICKERS
A1014: SPRINGVALE | C1014: CAPUANO 3 | F1014: DELARUE 2 | I1014: KNOWLES 2 | L1014: PITT 2 | N1014: MILNE | P1014: LOGAN | R1014: DELANEY | U1014: DAVIS
A1015: TASMANIA | C1015: ALLEN 2 | F1015: PRACIAK 2 | I1015: ATKIN | K1015: MILLAR | M1015: McKENDRICK | P1015: HULM | R1015: GEAPPEN
D1016: 15TH JULY | J1016: WEATHER
A1017: PORT MELBOURNE | C1017: 2 | D1017: 2 | E1017: =(C1017*6)+D1017 -> 14 | G1017: 6 | H1017: 7 | I1017: =(G1017*6)+H1017 -> 43 | K1017: 8 | L1017: 10 | M1017: =(K1017*6)+L1017 -> 58 | O1017: 9 | P1017: 11 | Q1017: =(O1017*6)+P1017 -> 65 | S1017: Venue: BOX HILL
A1018: BOX HILL | C1018: 2 | D1018: 0 | E1018: =(C1018*6)+D1018 -> 12 | G1018: 3 | H1018: 2 | I1018: =(G1018*6)+H1018 -> 20 | K1018: 4 | L1018: 5 | M1018: =(K1018*6)+L1018 -> 29 | O1018: 9 | P1018: 7 | Q1018: =(O1018*6)+P1018 -> 61
A1019: BEST PLAYERS
A1020: PORT MELBOURNE | C1020: ROSE | F1020: LUFF | I1020: FILANDIA | L1020: BROCKMAN | O1020: KIRK | R1020: ELLIOTT
A1021: BOX HILL | C1021: MITCHELL | F1021: CLARKE | I1021: GREENE | L1021: GEORGIADIS | O1021: OBST | R1021: SMITH
A1022: GOALKICKERS
A1023: PORT MELBOURNE | C1023: MILHUISEN 2 | F1023: AHMAT | H1023: TRAND | J1023: KIRK | L1023: SUNDQUIST | N1023: STEVENS | P1023: BUCHANAN | R1023: EVANS
A1024: BOX HILL | C1024: GEORGIADIS 4 | G1024: OSBORNE | J1024: PASSADOR | M1024: ROCK | O1024: CLARKE | Q1024: PUGSLEY
A1026: WERRIBEE | C1026: 6 | D1026: 6 | E1026: =(C1026*6)+D1026 -> 42 | G1026: 15 | H1026: 10 | I1026: =(G1026*6)+H1026 -> 100 | K1026: 21 | L1026: 16 | M1026: =(K1026*6)+L1026 -> 142 | O1026: 26 | P1026: 21 | Q1026: =(O1026*6)+P1026 -> 177 | S1026: Venue: WERRIBEE
A1027: BENDIGO | C1027: 2 | D1027: 0 | E1027: =(C1027*6)+D1027 -> 12 | G1027: 4 | H1027: 4 | I1027: =(G1027*6)+H1027 -> 28 | K1027: 5 | L1027: 5 | M1027: =(K1027*6)+L1027 -> 35 | O1027: 5 | P1027: 7 | Q1027: =(O1027*6)+P1027 -> 37
A1028: BEST PLAYERS
A1029: WERRIBEE | C1029: FULLER | F1029: BOWDEN | I1029: ALVEY | L1029: DIMMATINA | O1029: DYER | Q1029: MITCHELL
A1030: BENDIGO | C1030: WALSH | F1030: CARTER | I1030: ELSUM
A1031: GOALKICKERS
A1032: WERRIBEE | C1032: BOWDEN 5 | F1032: MITCHELL 5 | I1032: FULLER 4 | K1032: DYER 2 | M1032: CURLEY 2 | O1032: BARTLETT 2 | R1032: CONTESSA | U1032: PULI | W1032: SAUNDERS | X1032: ROBERTSON | AA1032: DIMMATINA | AC1032: ALVEY
A1033: BENDIGO | C1033: ATKINS | F1033: ELSUM | I1033: GEDDES | K1033: TOINTON | N1033: WALSH
A1035: FRANKSTON | C1035: 4 | D1035: 2 | E1035: =(C1035*6)+D1035 -> 26 | G1035: 5 | H1035: 2 | I1035: =(G1035*6)+H1035 -> 32 | K1035: 10 | L1035: 2 | M1035: =(K1035*6)+L1035 -> 62 | O1035: 15 | P1035: 7 | Q1035: =(O1035*6)+P1035 -> 97 | S1035: Venue: FRANKSTON
A1036: COBURG | C1036: 5 | D1036: 5 | E1036: =(C1036*6)+D1036 -> 35 | G1036: 7 | H1036: 9 | I1036: =(G1036*6)+H1036 -> 51 | K1036: 13 | L1036: 11 | M1036: =(K1036*6)+L1036 -> 89 | O1036: 14 | P1036: 11 | Q1036: =(O1036*6)+P1036 -> 95
A1037: BEST PLAYERS
A1038: FRANKSTON | C1038: MALLOY | F1038: LITTLE | I1038: CADD | L1038: SALIBURY | O1038: FOLINO
A1039: COBURG | C1039: STEINFORT | F1039: COUGHLAN | I1039: LAPPIN | L1039: PAGAN | O1039: PROCTOR | R1039: JAMES
A1040: GOALKICKERS
A1041: FRANKSTON | C1041: SAUTNER 3 | F1041: SIMISTER 2 | I1041: CLARKE 2 | L1041: SALISBURY 2 | O1041: McCORMACK 2 | R1041: ANDERSON | U1041: CADD | W1041: FORTNAM | X1041: GEORGIOU
A1042: COBURG | C1042: JAMES 5 | F1042: MILLS 3 | I1042: LANG | J1042: PAGAN | L1042: KRAKOUER | N1042: ZANTUCK | Q1042: EDNIE | S1042: COUGHLAN
A1044: ROUND 15 | D1044: 21ST JULY | J1044: WEATHER
D1045: 1ST QTR | H1045: 2ND QTR | L1045: 3RD QTR | P1045: FINAL | S1045: Venue: OPTUS OVAL
A1046: CARLTON | C1046: 4 | D1046: 4 | E1046: =(C1046*6)+D1046 -> 28 | G1046: 8 | H1046: 9 | I1046: =(G1046*6)+H1046 -> 57 | K1046: 13 | L1046: 13 | M1046: =(K1046*6)+L1046 -> 91 | O1046: 21 | P1046: 21 | Q1046: =(O1046*6)+P1046 -> 147 | S1046: UMPIRES | Y1046: LADDER | AB1046: ROUND | AD1046: 15
A1047: BENDIGO | C1047: 1 | D1047: 2 | E1047: =(C1047*6)+D1047 -> 8 | G1047: 3 | H1047: 3 | I1047: =(G1047*6)+H1047 -> 21 | K1047: 5 | L1047: 5 | M1047: =(K1047*6)+L1047 -> 35 | O1047: 8 | P1047: 8 | Q1047: =(O1047*6)+P1047 -> 56
A1048: BEST PLAYERS | W1048: TEAM | X1048: W | Y1048: L | Z1048: D | AA1048: FOR | AB1048: AGST | AC1048: % | AD1048: PTS
A1049: CARLTON | C1049: BACKWELL | F1049: DOERING | I1049: CAMPBELL | L1049: SPORN | O1049: NELSON | R1049: CRANAGE
A1050: BENDIGO | C1050: DICKSON | F1050: CLARKE | I1050: ELSUM | L1050: DILLON | O1050: O'CALLAGHAN | R1050: BROWN | W1050: WERRIBEE | X1050: 14 | Y1050: 1 | Z1050: 0 | AA1050: 1704 | AB1050: 966 | AC1050: =(AA1050/AB1050)*100 -> 176.3975155279503 | AD1050: =(X1050*4)+(Z1050*2) -> 56
A1051: GOALKICKERS | I1051: WHITE | K1051: CULPITT | M1051: SPORN | O1051: FLEMING | Q1051: PICKERING | S1051: JACOTINE | W1051: BOX HILL | X1051: 11 | Y1051: 4 | Z1051: 0 | AA1051: 1635 | AB1051: 1112 | AC1051: =(AA1051/AB1051)*100 -> 147.03237410071944 | AD1051: =(X1051*4)+(Z1051*2) -> 44
A1052: CARLTON | C1052: LOVETT 4 | E1052: PRENDERGAST 3 | H1052: BEASY 3 | J1052: BACKWELL | L1052: CHATFIELD | O1052: NELSON | Q1052: CRANAGE | S1052: O'KEEFE | W1052: MURRAY KANGAROOS | X1052: 10 | Y1052: 5 | Z1052: 0 | AA1052: 1588 | AB1052: 1356 | AC1052: =(AA1052/AB1052)*100 -> 117.10914454277285 | AD1052: =(X1052*4)+(Z1052*2) -> 40
A1053: BENDIGO | C1053: BROWN 3 | F1053: ELSUM 2 | I1053: WALSH 2 | L1053: WILSON | W1053: SPRINGVALE | X1053: 10 | Y1053: 5 | Z1053: 0 | AA1053: 1483 | AB1053: 1302 | AC1053: =(AA1053/AB1053)*100 -> 113.90168970814132 | AD1053: =(X1053*4)+(Z1053*2) -> 40
W1054: CARLTON | X1054: 9 | Y1054: 6 | Z1054: 0 | AA1054: 1364 | AB1054: 1188 | AC1054: =(AA1054/AB1054)*100 -> 114.81481481481481 | AD1054: =(X1054*4)+(Z1054*2) -> 36
A1055: COBURG | C1055: 2 | D1055: 3 | E1055: =(C1055*6)+D1055 -> 15 | G1055: 5 | H1055: 5 | I1055: =(G1055*6)+H1055 -> 35 | K1055: 7 | L1055: 6 | M1055: =(K1055*6)+L1055 -> 48 | O1055: 12 | P1055: 10 | Q1055: =(O1055*6)+P1055 -> 82 | S1055: Venue: COBURG | W1055: FRANKSTON | X1055: 9 | Y1055: 6 | Z1055: 0 | AA1055: 1341 | AB1055: 1274 | AC1055: =(AA1055/AB1055)*100 -> 105.25902668759812 | AD1055: =(X1055*4)+(Z1055*2) -> 36
A1056: SANDRINGHAM | C1056: 5 | D1056: 5 | E1056: =(C1056*6)+D1056 -> 35 | G1056: 5 | H1056: 9 | I1056: =(G1056*6)+H1056 -> 39 | K1056: 9 | L1056: 12 | M1056: =(K1056*6)+L1056 -> 66 | O1056: 10 | P1056: 15 | Q1056: =(O1056*6)+P1056 -> 75 | W1056: ESSENDON | X1056: 9 | Y1056: 6 | Z1056: 0 | AA1056: 1393 | AB1056: 1442 | AC1056: =(AA1056/AB1056)*100 -> 96.601941747572823 | AD1056: =(X1056*4)+(Z1056*2) -> 36
A1057: BEST PLAYERS | W1057: COBURG | X1057: 8 | Y1057: 7 | Z1057: 0 | AA1057: 1303 | AB1057: 1298 | AC1057: =(AA1057/AB1057)*100 -> 100.38520801232667 | AD1057: =(X1057*4)+(Z1057*2) -> 32
A1058: COBURG | C1058: STEINFORT | F1058: VARDY | I1058: EDNIE | L1058: LAPPIN | O1058: POYAS | R1058: ZANTUCK
A1059: SANDRINGHAM | C1059: LIDDELL | F1059: McDONALD | I1059: JOLLY | L1059: HAYNES | O1059: COGHLAN | R1059: TREGEAR | W1059: PORT MELBOURNE | X1059: 7 | Y1059: 8 | Z1059: 0 | AA1059: 1382 | AB1059: 1393 | AC1059: =(AA1059/AB1059)*100 -> 99.210337401292165 | AD1059: =(X1059*4)+(Z1059*2) -> 28
A1060: GOALKICKERS | W1060: WILLIAMSTOWN | X1060: 7 | Y1060: 8 | Z1060: 0 | AA1060: 1344 | AB1060: 1387 | AC1060: =(AA1060/AB1060)*100 -> 96.899783705839937 | AD1060: =(X1060*4)+(Z1060*2) -> 28
A1061: COBURG | C1061: BURGEIL 3 | F1061: HAYNES 3 | I1061: JAMES 2 | K1061: KRAKOUER | N1061: HALL | P1061: HART | R1061: ZANTUCK | W1061: SANDRINGHAM | X1061: 6 | Y1061: 9 | Z1061: 0 | AA1061: 1362 | AB1061: 1253 | AC1061: =(AA1061/AB1061)*100 -> 108.69912210694335 | AD1061: =(X1061*4)+(Z1061*2) -> 24
A1062: SANDRINGHAM | C1062: BEAMS 3 | F1062: WILSON | H1062: FUNCKE | J1062: TEMPLETON | M1062: LIDDELL | O1062: GILL | Q1062: PITT | R1062: HAYNES | W1062: NORTH BALLARAT | X1062: 6 | Y1062: 9 | Z1062: 0 | AA1062: 1130 | AB1062: 1503 | AC1062: =(AA1062/AB1062)*100 -> 75.182967398536263 | AD1062: =(X1062*4)+(Z1062*2) -> 24
W1063: GEELONG | X1063: 5 | Y1063: 10 | Z1063: 0 | AA1063: 1154 | AB1063: 1286 | AC1063: =(AA1063/AB1063)*100 -> 89.73561430793157 | AD1063: =(X1063*4)+(Z1063*2) -> 20
A1064: PORT MELBOURNE | C1064: 5 | D1064: 2 | E1064: =(C1064*6)+D1064 -> 32 | G1064: 6 | H1064: 6 | I1064: =(G1064*6)+H1064 -> 42 | K1064: 8 | L1064: 11 | M1064: =(K1064*6)+L1064 -> 59 | O1064: 13 | P1064: 14 | Q1064: =(O1064*6)+P1064 -> 92 | S1064: Venue: NORTH HOBART OVAL | W1064: TASMANIA | X1064: 5 | Y1064: 10 | Z1064: 0 | AA1064: 1142 | AB1064: 1597 | AC1064: =(AA1064/AB1064)*100 -> 71.509079524107705 | AD1064: =(X1064*4)+(Z1064*2) -> 20
A1065: TASMANIA | C1065: 3 | D1065: 2 | E1065: =(C1065*6)+D1065 -> 20 | G1065: 7 | H1065: 3 | I1065: =(G1065*6)+H1065 -> 45 | K1065: 10 | L1065: 8 | M1065: =(K1065*6)+L1065 -> 68 | O1065: 13 | P1065: 10 | Q1065: =(O1065*6)+P1065 -> 88 | W1065: NORTHERN BULLANTS | X1065: 4 | Y1065: 11 | Z1065: 0 | AA1065: 1266 | AB1065: 1368 | AC1065: =(AA1065/AB1065)*100 -> 92.543859649122808 | AD1065: =(X1065*4)+(Z1065*2) -> 16
A1066: BEST PLAYERS | W1066: BENDIGO | X1066: 0 | Y1066: 15 | Z1066: 0 | AA1066: 991 | AB1066: 1829 | AC1066: =(AA1066/AB1066)*100 -> 54.182613449972663 | AD1066: =(X1066*4)+(Z1066*2) -> 0
A1067: PORT MELBOURNE | C1067: FEAST | F1067: ANSTEY | I1067: ROSE | L1067: ABLETT | O1067: FIXTER | R1067: TOMSIC
A1068: TASMANIA | C1068: WALKER | F1068: TREVENA | I1068: BOLTON | L1068: HULM | O1068: BLIGHT | R1068: GEAPPEN
A1069: GOALKICKERS
A1070: PORT MELBOURNE | C1070: STEVENS 3 | F1070: SWAN 3 | I1070: FIXTER 2 | L1070: ALOI 2 | N1070: BUCHANAN | Q1070: ABLETT | S1070: DELUCA
A1071: TASMANIA | C1071: BLIGHT 3 | F1071: CARTER 3 | I1071: CALLINAN 2 | L1071: MILLAR 2 | N1071: STREET | P1071: TREVENA | R1071: GEAPPEN
A1073: MURRAY KANGAROOS | C1073: 4 | D1073: 4 | E1073: =(C1073*6)+D1073 -> 28 | G1073: 8 | H1073: 11 | I1073: =(G1073*6)+H1073 -> 59 | K1073: 14 | L1073: 14 | M1073: =(K1073*6)+L1073 -> 98 | O1073: 22 | P1073: 16 | Q1073: =(O1073*6)+P1073 -> 148 | S1073: Venue: WINDY HILL
A1074: ESSENDON | C1074: 4 | D1074: 3 | E1074: =(C1074*6)+D1074 -> 27 | G1074: 8 | H1074: 4 | I1074: =(G1074*6)+H1074 -> 52 | K1074: 11 | L1074: 5 | M1074: =(K1074*6)+L1074 -> 71 | O1074: 15 | P1074: 8 | Q1074: =(O1074*6)+P1074 -> 98
A1075: BEST PLAYERS
A1076: MURRAY KANGAROOS | C1076: HILTON | F1076: HARDING | I1076: SPAULL | L1076: COOPER | O1076: OLARENSHAW | R1076: WHITE
A1077: ESSENDON | C1077: SWITALA | F1077: HILLE | I1077: DAVIES | L1077: FORSTER-KNIGHT | P1077: BULLEN | R1077: DENHAM
A1078: GOALKICKERS
A1079: MURRAY KANGAROOS | C1079: COOPER 7 | F1079: HARDING 5 | I1079: McLAREN 2 | L1079: L SMITH 2 | N1079: CLAYTON 2 | Q1079: SPAULL 2 | S1079: STEVENS | V1079: OLARENSHAW
A1080: ESSENDON | C1080: KENNY 3 | F1080: GODDARD 3 | I1080: BANNISTER 2 | L1080: HALL 2 | N1080: PAVEY 2 | Q1080: DENHAM | S1080: SWITALA | V1080: DAVIES
A1082: WERRIBEE | C1082: 4 | D1082: 3 | E1082: =(C1082*6)+D1082 -> 27 | G1082: 11 | H1082: 6 | I1082: =(G1082*6)+H1082 -> 72 | K1082: 14 | L1082: 8 | M1082: =(K1082*6)+L1082 -> 92 | O1082: 18 | P1082: 11 | Q1082: =(O1082*6)+P1082 -> 119 | S1082: Venue: WERRIBEE
A1083: SPRINGVALE | C1083: 5 | D1083: 3 | E1083: =(C1083*6)+D1083 -> 33 | G1083: 8 | H1083: 5 | I1083: =(G1083*6)+H1083 -> 53 | K1083: 12 | L1083: 6 | M1083: =(K1083*6)+L1083 -> 78 | O1083: 14 | P1083: 8 | Q1083: =(O1083*6)+P1083 -> 92
A1084: BEST PLAYERS
A1085: WERRIBEE | C1085: BOWDEN | F1085: CONTESSA | I1085: ROBERTSON | L1085: FROST | O1085: DIMMATINA | R1085: CURLEY
A1086: SPRINGVALE | C1086: LEWISON | F1086: CAPLES | I1086: CARROLL | L1086: DELARUE | O1086: O'BRIEN | R1086: DELANEY
A1087: GOALKICKERS
A1088: WERRIBEE | C1088: BOWDEN 5 | F1088: MITCHELL 4 | I1088: CONTESSA 2 | L1088: BARTLETT 2 | O1088: CHURCHILL | R1088: CURLEY | T1088: McMAHON | W1088: DIMMATINA | X1088: FULLER
A1089: SPRINGVALE | C1089: SMITH 3 | F1089: MILNE 3 | I1089: O'BRIEN 2 | L1089: TRIANIDES 2 | O1089: CARMODY 2 | R1089: PITT | T1089: CARROLL
D1090: 22ND JULY | J1090: WEATHER
A1091: NORTH BALLARAT | C1091: 5 | D1091: 2 | E1091: =(C1091*6)+D1091 -> 32 | G1091: 7 | H1091: 3 | I1091: =(G1091*6)+H1091 -> 45 | K1091: 12 | L1091: 4 | M1091: =(K1091*6)+L1091 -> 76 | O1091: 14 | P1091: 6 | Q1091: =(O1091*6)+P1091 -> 90 | S1091: Venue: NORTH BALLARAT
A1092: GEELONG | C1092: 3 | D1092: 4 | E1092: =(C1092*6)+D1092 -> 22 | G1092: 6 | H1092: 6 | I1092: =(G1092*6)+H1092 -> 42 | K1092: 8 | L1092: 9 | M1092: =(K1092*6)+L1092 -> 57 | O1092: 13 | P1092: 10 | Q1092: =(O1092*6)+P1092 -> 88
A1093: BEST PLAYERS
A1094: NORTH BALLARAT | C1094: CLAYTON | F1094: COLLARD | I1094: STEWART | L1094: J POLKINGHORNE | P1094: EDWARDS | R1094: BROWN
A1095: GEELONG | C1095: STREET | F1095: WOOLNOUGH | I1095: CHAPMAN | L1095: FOSTER | P1095: BALDWIN | R1095: LOWTHER
A1096: GOALKICKERS
A1097: NORTH BALLARAT | C1097: COLLARD 6 | F1097: CHATFIELD 2 | I1097: BYE | K1097: STEWART | M1097: CLAYTON | O1097: McMAHON | Q1097: COHEN | S1097: HUTCHINSON
A1098: GEELONG | C1098: BALDWIN 4 | F1098: SPOLDING 2 | I1098: STREET 2 | K1098: WOOLNOUGH 2 | N1098: LOWTHER | P1098: RYAN | R1098: BURN
A1100: WILLIAMSTOWN | C1100: 3 | D1100: 6 | E1100: =(C1100*6)+D1100 -> 24 | G1100: 5 | H1100: 9 | I1100: =(G1100*6)+H1100 -> 39 | K1100: 8 | L1100: 15 | M1100: =(K1100*6)+L1100 -> 63 | O1100: 12 | P1100: 18 | Q1100: =(O1100*6)+P1100 -> 90 | S1100: Venue: WILLIAMSTOWN
A1101: BOX HILL | C1101: 2 | D1101: 1 | E1101: =(C1101*6)+D1101 -> 13 | G1101: 3 | H1101: 2 | I1101: =(G1101*6)+H1101 -> 20 | K1101: 9 | L1101: 4 | M1101: =(K1101*6)+L1101 -> 58 | O1101: 11 | P1101: 5 | Q1101: =(O1101*6)+P1101 -> 71
A1102: BEST PLAYERS
A1103: WILLIAMSTOWN | C1103: KINNEAR | F1103: WOOD | I1103: ANDERSON | L1103: BURNS | O1103: WEST | Q1103: HILL
A1104: BOX HILL | C1104: BAIRD | F1104: WILLIAMS | I1104: GREENE | L1104: GEORGIADIS | O1104: RIES | Q1104: PUGSLEY
A1105: GOALKICKERS
A1106: WILLIAMSTOWN | C1106: KINNEAR 4 | F1106: BURNS 2 | I1106: LOVETT-MURRAY 2 | M1106: CLOKE | O1106: SCOTLAND | R1106: ANDERSON | U1106: HILL
A1107: BOX HILL | C1107: ROCK 2 | F1107: HABERFIELD 2 | I1107: DENT | K1107: GREENE | M1107: JACKSON | O1107: LONIE | Q1107: MITCHELL | T1107: OSBORNE | W1107: WOODS
A1109: NORTHERN BULLANTS | C1109: 6 | D1109: 3 | E1109: =(C1109*6)+D1109 -> 39 | G1109: 10 | H1109: 5 | I1109: =(G1109*6)+H1109 -> 65 | K1109: 13 | L1109: 9 | M1109: =(K1109*6)+L1109 -> 87 | O1109: 22 | P1109: 14 | Q1109: =(O1109*6)+P1109 -> 146 | S1109: Venue: PRESTON
A1110: FRANKSTON | C1110: 3 | D1110: 2 | E1110: =(C1110*6)+D1110 -> 20 | G1110: 4 | H1110: 5 | I1110: =(G1110*6)+H1110 -> 29 | K1110: 9 | L1110: 6 | M1110: =(K1110*6)+L1110 -> 60 | O1110: 12 | P1110: 7 | Q1110: =(O1110*6)+P1110 -> 79
A1111: BEST PLAYERS
A1112: NORTHERN BULLANTS | C1112: ZORZI | F1112: GIBSON | I1112: PENN | L1112: GROSSMAN | O1112: LEE | Q1112: FURLAN
A1113: FRANKSTON | C1113: SALISBURY | F1113: FOLINO | I1113: GEORGIOU
A1114: GOALKICKERS
A1115: NORTHERN BULLANTS | C1115: PENN 4 | E1115: WATSON 4 | H1115: FAVRIN 4 | J1115: LOWTHER 3 | M1115: RAMSAY 2 | P1115: GIBSON 2 | R1115: BONADIO | U1115: CARACELLA | X1115: FURLAN
A1116: FRANKSTON | C1116: SAUTNER 6 | F1116: SALISBURY 2 | I1116: C CLARKE | L1116: GEORGIOU | N1116: ANDERSON | Q1116: BEVERIDGE
A1118: ROUND 16 | D1118: 28TH JULY | J1118: WEATHER
D1119: 1ST QTR | H1119: 2ND QTR | L1119: 3RD QTR | P1119: FINAL | S1119: Venue: SHELL STADIUM (C/R)
A1120: SPRINGVALE | C1120: 2 | D1120: 2 | E1120: =(C1120*6)+D1120 -> 14 | G1120: 3 | H1120: 5 | I1120: =(G1120*6)+H1120 -> 23 | K1120: 6 | L1120: 10 | M1120: =(K1120*6)+L1120 -> 46 | O1120: 11 | P1120: 11 | Q1120: =(O1120*6)+P1120 -> 77 | S1120: UMPIRES | Y1120: LADDER | AB1120: ROUND | AD1120: 16
A1121: GEELONG | C1121: 1 | D1121: 3 | E1121: =(C1121*6)+D1121 -> 9 | G1121: 5 | H1121: 6 | I1121: =(G1121*6)+H1121 -> 36 | K1121: 8 | L1121: 8 | M1121: =(K1121*6)+L1121 -> 56 | O1121: 10 | P1121: 10 | Q1121: =(O1121*6)+P1121 -> 70
A1122: BEST PLAYERS | W1122: TEAM | X1122: W | Y1122: L | Z1122: D | AA1122: FOR | AB1122: AGST | AC1122: % | AD1122: PTS
A1123: SPRINGVALE | C1123: SCHWARZE | F1123: WALTON | I1123: HARRISON | L1123: TRIANIDES | O1123: LEWISON | R1123: OLIVER
A1124: GEELONG | C1124: CORRIGAN | F1124: WOOLNOUGH | I1124: STREET | L1124: MERRIMAN | O1124: WOJCINSKI | R1124: HUNT | W1124: WERRIBEE | X1124: 15 | Y1124: 1 | Z1124: 0 | AA1124: 1888 | AB1124: 1011 | AC1124: =(AA1124/AB1124)*100 -> 186.7457962413452 | AD1124: =(X1124*4)+(Z1124*2) -> 60
A1125: GOALKICKERS | W1125: BOX HILL | X1125: 12 | Y1125: 4 | Z1125: 0 | AA1125: 1749 | AB1125: 1209 | AC1125: =(AA1125/AB1125)*100 -> 144.66501240694788 | AD1125: =(X1125*4)+(Z1125*2) -> 48
A1126: SPRINGVALE | C1126: DILLON 2 | F1126: HARRISON 2 | I1126: OLIVER 2 | L1126: PITT 2 | N1126: TRIANIDIS 2 | R1126: O'BRIEN | W1126: MURRAY KANGAROOS | X1126: 11 | Y1126: 5 | Z1126: 0 | AA1126: 1676 | AB1126: 1422 | AC1126: =(AA1126/AB1126)*100 -> 117.86216596343178 | AD1126: =(X1126*4)+(Z1126*2) -> 44
A1127: GEELONG | C1127: BALDWIN 4 | F1127: CORRIGAN 2 | I1127: HOULIHAN | L1127: HUNT | N1127: KARAMATIC | Q1127: LOWTHER | W1127: SPRINGVALE | X1127: 11 | Y1127: 5 | Z1127: 0 | AA1127: 1560 | AB1127: 1372 | AC1127: =(AA1127/AB1127)*100 -> 113.70262390670554 | AD1127: =(X1127*4)+(Z1127*2) -> 44
W1128: FRANKSTON | X1128: 10 | Y1128: 6 | Z1128: 0 | AA1128: 1437 | AB1128: 1345 | AC1128: =(AA1128/AB1128)*100 -> 106.84014869888476 | AD1128: =(X1128*4)+(Z1128*2) -> 40
A1129: WERRIBEE | C1129: 5 | D1129: 5 | E1129: =(C1129*6)+D1129 -> 35 | G1129: 13 | H1129: 7 | I1129: =(G1129*6)+H1129 -> 85 | K1129: 20 | L1129: 12 | M1129: =(K1129*6)+L1129 -> 132 | O1129: 28 | P1129: 16 | Q1129: =(O1129*6)+P1129 -> 184 | S1129: Venue: WERRIBEE | W1129: CARLTON | X1129: 9 | Y1129: 7 | Z1129: 0 | AA1129: 1461 | AB1129: 1312 | AC1129: =(AA1129/AB1129)*100 -> 111.35670731707317 | AD1129: =(X1129*4)+(Z1129*2) -> 36
A1130: COBURG | C1130: 3 | D1130: 4 | E1130: =(C1130*6)+D1130 -> 22 | G1130: 3 | H1130: 6 | I1130: =(G1130*6)+H1130 -> 24 | K1130: 4 | L1130: 7 | M1130: =(K1130*6)+L1130 -> 31 | O1130: 6 | P1130: 9 | Q1130: =(O1130*6)+P1130 -> 45 | W1130: ESSENDON | X1130: 9 | Y1130: 7 | Z1130: 0 | AA1130: 1464 | AB1130: 1538 | AC1130: =(AA1130/AB1130)*100 -> 95.188556566970092 | AD1130: =(X1130*4)+(Z1130*2) -> 36
A1131: BEST PLAYERS | W1131: WILLIAMSTOWN | X1131: 8 | Y1131: 8 | Z1131: 0 | AA1131: 1526 | AB1131: 1470 | AC1131: =(AA1131/AB1131)*100 -> 103.80952380952382 | AD1131: =(X1131*4)+(Z1131*2) -> 32
A1132: WERRIBEE | C1132: FULLER | F1132: ROBERTSON | I1132: BARTLETT | L1132: ALVEY | O1132: FAULKNER | R1132: HARGREAVE
A1133: COBURG | C1133: STEINFORT | F1133: LAPPIN | I1133: POYAS | L1133: PAGAN | W1133: PORT MELBOURNE | X1133: 8 | Y1133: 8 | Z1133: 0 | AA1133: 1468 | AB1133: 1478 | AC1133: =(AA1133/AB1133)*100 -> 99.323410013531799 | AD1133: =(X1133*4)+(Z1133*2) -> 32
A1134: GOALKICKERS | G1134: GILBEE | I1134: BIRSS | J1134: CHURCHILL | M1134: DOOLEY | O1134: FAULKNER | R1134: McMAHON | W1134: COBURG | X1134: 8 | Y1134: 8 | Z1134: 0 | AA1134: 1348 | AB1134: 1482 | AC1134: =(AA1134/AB1134)*100 -> 90.958164642375166 | AD1134: =(X1134*4)+(Z1134*2) -> 32
A1135: WERRIBEE | C1135: FULLER 6 | E1135: MITCHELL 4 | H1135: HAHN 3 | J1135: BARTLETT 3 | M1135: CONTESSA 2 | P1135: LAMB 2 | R1135: ALVEY 2 | W1135: SANDRINGHAM | X1135: 7 | Y1135: 9 | Z1135: 0 | AA1135: 1456 | AB1135: 1320 | AC1135: =(AA1135/AB1135)*100 -> 110.3030303030303 | AD1135: =(X1135*4)+(Z1135*2) -> 28
A1136: COBURG | C1136: HALL 2 | F1136: HAYNES 2 | I1136: HART | J1136: POYAS | W1136: NORTH BALLARAT | X1136: 6 | Y1136: 10 | Z1136: 0 | AA1136: 1215 | AB1136: 1589 | AC1136: =(AA1136/AB1136)*100 -> 76.463184392699816 | AD1136: =(X1136*4)+(Z1136*2) -> 24
W1137: GEELONG | X1137: 5 | Y1137: 11 | Z1137: 0 | AA1137: 1224 | AB1137: 1363 | AC1137: =(AA1137/AB1137)*100 -> 89.801907556859874 | AD1137: =(X1137*4)+(Z1137*2) -> 20
A1138: FRANKSTON | C1138: 3 | D1138: 1 | E1138: =(C1138*6)+D1138 -> 19 | G1138: 6 | H1138: 4 | I1138: =(G1138*6)+H1138 -> 40 | K1138: 10 | L1138: 7 | M1138: =(K1138*6)+L1138 -> 67 | O1138: 14 | P1138: 12 | Q1138: =(O1138*6)+P1138 -> 96 | S1138: Venue: FRANKSTON | W1138: TASMANIA | X1138: 5 | Y1138: 11 | Z1138: 0 | AA1138: 1209 | AB1138: 1691 | AC1138: =(AA1138/AB1138)*100 -> 71.496156120638673 | AD1138: =(X1138*4)+(Z1138*2) -> 20
A1139: ESSENDON | C1139: 4 | D1139: 5 | E1139: =(C1139*6)+D1139 -> 29 | G1139: 6 | H1139: 5 | I1139: =(G1139*6)+H1139 -> 41 | K1139: 8 | L1139: 10 | M1139: =(K1139*6)+L1139 -> 58 | O1139: 10 | P1139: 11 | Q1139: =(O1139*6)+P1139 -> 71 | W1139: NORTHERN BULLANTS | X1139: 4 | Y1139: 12 | Z1139: 0 | AA1139: 1332 | AB1139: 1456 | AC1139: =(AA1139/AB1139)*100 -> 91.483516483516482 | AD1139: =(X1139*4)+(Z1139*2) -> 16
A1140: BEST PLAYERS | W1140: BENDIGO | X1140: 0 | Y1140: 16 | Z1140: 0 | AA1140: 1074 | AB1140: 2011 | AC1140: =(AA1140/AB1140)*100 -> 53.406265539532569 | AD1140: =(X1140*4)+(Z1140*2) -> 0
A1141: FRANKSTON | C1141: BURGMAN | F1141: SALIBURY | I1141: LITTLE | L1141: ROBERTS | O1141: FORTNAM | R1141: McCORMACK
A1142: ESSENDON | C1142: BOLTON | F1142: ROBRAN | I1142: BANNISTER | L1142: LALICH
A1143: GOALKICKERS | P1143: MITCHELL | R1143: BURGMAN
A1144: FRANKSTON | C1144: SALISBURY 3 | F1144: FORTNAM 3 | I1144: SIMISTER 2 | L1144: SAUTNER | N1144: McCORMACK | Q1144: BEVERIDGE | S1144: GEORGIOU
A1145: ESSENDON | C1145: HAWKINS 4 | F1145: ROBRAN 2 | I1145: GODDARD | K1145: DAVIES | M1145: BANNISTER | P1145: DENHAM
A1147: PORT MELBOURNE | C1147: 1 | D1147: 2 | E1147: =(C1147*6)+D1147 -> 8 | G1147: 6 | H1147: 7 | I1147: =(G1147*6)+H1147 -> 43 | K1147: 8 | L1147: 7 | M1147: =(K1147*6)+L1147 -> 55 | O1147: 13 | P1147: 8 | Q1147: =(O1147*6)+P1147 -> 86 | S1147: Venue: PORT MELBOURNE
A1148: NORTH BALLARAT | C1148: 4 | D1148: 5 | E1148: =(C1148*6)+D1148 -> 29 | G1148: 6 | H1148: 8 | I1148: =(G1148*6)+H1148 -> 44 | K1148: 10 | L1148: 11 | M1148: =(K1148*6)+L1148 -> 71 | O1148: 12 | P1148: 13 | Q1148: =(O1148*6)+P1148 -> 85
A1149: BEST PLAYERS
A1150: PORT MELBOURNE | C1150: PILTZ | F1150: DELUCA | I1150: McMAHON | L1150: SWAN | O1150: FILANDIA | R1150: ANSTEY
A1151: NORTH BALLARAT | C1151: HUTCHINSON | F1151: FISHER | I1151: MOLONEY | L1151: SOMERVILLE
A1152: GOALKICKERS
A1153: PORT MELBOURNE | C1153: PILTZ 4 | F1153: BUCHANAN 2 | I1153: STEVENS 2 | L1153: FILANDIA | N1153: McMAHON | Q1153: SWAN | R1153: McINERNEY | U1153: ALOI
A1154: NORTH BALLARAT | C1154: HUTCHINSON 3 | F1154: COLLARD 3 | I1154: CHATFIELD 2 | L1154: McMAHON | N1154: STUART | P1154: BYE | Q1154: MURRIHY
A1156: BOX HILL | C1156: 5 | D1156: 1 | E1156: =(C1156*6)+D1156 -> 31 | G1156: 9 | H1156: 5 | I1156: =(G1156*6)+H1156 -> 59 | K1156: 13 | L1156: 9 | M1156: =(K1156*6)+L1156 -> 87 | O1156: 17 | P1156: 12 | Q1156: =(O1156*6)+P1156 -> 114 | S1156: Venue: BOX HILL
A1157: CARLTON | C1157: 2 | D1157: 3 | E1157: =(C1157*6)+D1157 -> 15 | G1157: 6 | H1157: 5 | I1157: =(G1157*6)+H1157 -> 41 | K1157: 11 | L1157: 9 | M1157: =(K1157*6)+L1157 -> 75 | O1157: 14 | P1157: 13 | Q1157: =(O1157*6)+P1157 -> 97
A1158: BEST PLAYERS
A1159: BOX HILL | C1159: MITCHELL | F1159: NICHOLLS | I1159: BREWER | L1159: BAIRD | O1159: DENT | R1159: BANKS
A1160: CARLTON | C1160: BEASY | F1160: DURLING | I1160: CULPITT
A1161: GOALKICKERS | T1161: CAMPBELL
A1162: BOX HILL | C1162: DENT 3 | E1162: ROCK 2 | G1162: HABERFIELD 2 | J1162: NICHOLLS | M1162: LOATS | O1162: PUGSLEY | Q1162: GEORGIADIS | T1162: PASSADOR | W1162: MITCHELL | X1162: SMITH | Z1162: BANKS | AB1162: BREWER
A1163: CARLTON | C1163: BEASY 4 | F1163: MERRINGTON 2 | J1163: FLEMING 2 | M1163: McKEON 2 | P1163: BACKWELL | R1163: CRANAGE | U1163: FEVOLA | X1163: FERRARO
D1164: 29TH JULY | J1164: WEATHER
A1165: WILLIAMSTOWN | C1165: 5 | D1165: 6 | E1165: =(C1165*6)+D1165 -> 36 | G1165: 11 | H1165: 8 | I1165: =(G1165*6)+H1165 -> 74 | K1165: 19 | L1165: 14 | M1165: =(K1165*6)+L1165 -> 128 | O1165: 28 | P1165: 14 | Q1165: =(O1165*6)+P1165 -> 182 | S1165: Venue: BENDIGO
A1166: BENDIGO | C1166: 2 | D1166: 5 | E1166: =(C1166*6)+D1166 -> 17 | G1166: 7 | H1166: 6 | I1166: =(G1166*6)+H1166 -> 48 | K1166: 7 | L1166: 6 | M1166: =(K1166*6)+L1166 -> 48 | O1166: 12 | P1166: 11 | Q1166: =(O1166*6)+P1166 -> 83
A1167: BEST PLAYERS
A1168: WILLIAMSTOWN | C1168: DIMMATINA | F1168: JOHNSON | I1168: SMOKER | L1168: TUCKEY | O1168: DE ANGELIS | R1168: SCOTLAND
A1169: BENDIGO | C1169: N CARTER | F1169: O'TOOLE | I1169: GEDDES | L1169: PLIM | O1169: WALSH | R1169: ELSUM
A1170: GOALKICKERS | W1170: JOHNSON | X1170: UKOVIC | AA1170: SHERWIN
A1171: WILLIAMSTOWN | C1171: TUCKEY 5 | E1171: HILL 4 | G1171: DIMMATINA 3 | J1171: SCOTLAND 3 | M1171: LOVETT-MURRAY 2 | Q1171: SMOKER 2 | S1171: LLOYD | U1171: WEST | W1171: ANDERSON | X1171: CLOKE | Z1171: STONE | AB1171: RINTOUL
A1172: BENDIGO | C1172: N CARTER 3 | F1172: WALSH 2 | I1172: BROWN | K1172: CAIL | M1172: C CARTER | O1172: DILLON | Q1172: ELLIOTT | S1172: ELSUM | U1172: PLIM
A1174: MURRAY KANGAROOS | C1174: 3 | D1174: 1 | E1174: =(C1174*6)+D1174 -> 19 | G1174: 8 | H1174: 3 | I1174: =(G1174*6)+H1174 -> 51 | K1174: 11 | L1174: 6 | M1174: =(K1174*6)+L1174 -> 72 | O1174: 13 | P1174: 10 | Q1174: =(O1174*6)+P1174 -> 88 | S1174: Venue: LAVINGTON
A1175: NORTHERN BULLANTS | C1175: 2 | D1175: 4 | E1175: =(C1175*6)+D1175 -> 16 | G1175: 3 | H1175: 8 | I1175: =(G1175*6)+H1175 -> 26 | K1175: 4 | L1175: 10 | M1175: =(K1175*6)+L1175 -> 34 | O1175: 9 | P1175: 12 | Q1175: =(O1175*6)+P1175 -> 66
A1176: BEST PLAYERS
A1177: MURRAY KANGAROOS | C1177: HILTON | F1177: SPAULL | I1177: MOTLOP | L1177: McLAREN | O1177: D SMITH | R1177: GRRIGGS
A1178: NORTHERN BULLANTS | C1178: SAGE | F1178: RASO | I1178: CLAYTON | L1178: GROSSMAN
A1179: GOALKICKERS
A1180: MURRAY KANGAROOS | C1180: SPAULL 3 | F1180: D SMITH 2 | I1180: L SMITH 2 | L1180: JONES | N1180: OLARENSHAW | Q1180: LANGE | S1180: COOPER | U1180: SOFI | W1180: STEVENS
A1181: NORTHERN BULLANTS | C1181: FAVRIN 2 | F1181: SCANLON 2 | I1181: CLARKE | K1181: GIBSON | M1181: LEE | N1181: PATTERSON | Q1181: WATSON
A1183: SANDRINGHAM | C1183: 5 | D1183: 1 | E1183: =(C1183*6)+D1183 -> 31 | G1183: 11 | H1183: 7 | I1183: =(G1183*6)+H1183 -> 73 | K1183: 12 | L1183: 10 | M1183: =(K1183*6)+L1183 -> 82 | O1183: 14 | P1183: 10 | Q1183: =(O1183*6)+P1183 -> 94 | S1183: Venue: NORTH HOBART OVAL
A1184: TASMANIA | C1184: 3 | D1184: 1 | E1184: =(C1184*6)+D1184 -> 19 | G1184: 6 | H1184: 1 | I1184: =(G1184*6)+H1184 -> 37 | K1184: 8 | L1184: 4 | M1184: =(K1184*6)+L1184 -> 52 | O1184: 10 | P1184: 7 | Q1184: =(O1184*6)+P1184 -> 67
A1185: BEST PLAYERS
A1186: SANDRINGHAM | C1186: JOLLY | F1186: MACGEORGE | I1186: GRANT | L1186: GRGIC | O1186: TEMPLETON | R1186: COGHLAN
A1187: TASMANIA | C1187: HULM | F1187: TREVENA | I1187: BOLTON | L1187: HOWARD
A1188: GOALKICKERS
A1189: SANDRINGHAM | C1189: TEMPLETON 6 | F1189: GRGIC 2 | H1189: THOMPSON | K1189: JOHNSTONE | N1189: RADFORD | Q1189: MACGEORGE | T1189: GILL | V1189: DOHERTY
A1190: TASMANIA | C1190: CARTER 2 | F1190: BOLTON 2 | I1190: CALLINAN 2 | L1190: JONES | N1190: BLIGHT | P1190: THURLEY | R1190: MILLAR
A1192: ROUND 17 | D1192: 4TH AUGUST | J1192: WEATHER
D1193: 1ST QTR | H1193: 2ND QTR | L1193: 3RD QTR | P1193: FINAL | S1193: Venue: M.C.G. (C/R)
A1194: GEELONG | C1194: 2 | D1194: 3 | E1194: =(C1194*6)+D1194 -> 15 | G1194: 7 | H1194: 9 | I1194: =(G1194*6)+H1194 -> 51 | K1194: 12 | L1194: 10 | M1194: =(K1194*6)+L1194 -> 82 | O1194: 17 | P1194: 16 | Q1194: =(O1194*6)+P1194 -> 118 | S1194: UMPIRES | Y1194: LADDER | AB1194: ROUND | AD1194: 17
A1195: SANDRINGHAM | C1195: 2 | D1195: 2 | E1195: =(C1195*6)+D1195 -> 14 | G1195: 2 | H1195: 6 | I1195: =(G1195*6)+H1195 -> 18 | K1195: 4 | L1195: 8 | M1195: =(K1195*6)+L1195 -> 32 | O1195: 8 | P1195: 10 | Q1195: =(O1195*6)+P1195 -> 58
A1196: BEST PLAYERS | W1196: TEAM | X1196: W | Y1196: L | Z1196: D | AA1196: FOR | AB1196: AGST | AC1196: % | AD1196: PTS
A1197: GEELONG | C1197: HOSKING | F1197: WOOLNOUGH | I1197: HUNT | L1197: CORRIGAN | O1197: BAUER | R1197: O'BRIEN
A1198: SANDRINGHAM | C1198: MACGEORGE | F1198: COGHLAN | I1198: HAYWARD | L1198: JOHNSTONE | W1198: WERRIBEE | X1198: 16 | Y1198: 1 | Z1198: 0 | AA1198: 2003 | AB1198: 1107 | AC1198: =(AA1198/AB1198)*100 -> 180.93947606142729 | AD1198: =(X1198*4)+(Z1198*2) -> 64
A1199: GOALKICKERS | P1199: LOWTHER | R1199: NICHOLSON | W1199: BOX HILL | X1199: 13 | Y1199: 4 | Z1199: 0 | AA1199: 1916 | AB1199: 1273 | AC1199: =(AA1199/AB1199)*100 -> 150.51060487038492 | AD1199: =(X1199*4)+(Z1199*2) -> 52
A1200: GEELONG | C1200: BALDWIN 6 | F1200: P CHAPMAN 3 | I1200: O'BRIEN 2 | K1200: BAUER | M1200: CORRIGAN | O1200: FOSTER | Q1200: HOULIHAN | W1200: MURRAY KANGAROOS | X1200: 12 | Y1200: 5 | Z1200: 0 | AA1200: 1769 | AB1200: 1506 | AC1200: =(AA1200/AB1200)*100 -> 117.46347941567066 | AD1200: =(X1200*4)+(Z1200*2) -> 48
A1201: SANDRINGHAM | C1201: HAYWARD 2 | F1201: GILL 2 | H1201: TEMPLETON | K1201: BEAMS | M1201: GRANT | O1201: LIDDELL | W1201: SPRINGVALE | X1201: 11 | Y1201: 6 | Z1201: 0 | AA1201: 1653 | AB1201: 1480 | AC1201: =(AA1201/AB1201)*100 -> 111.68918918918919 | AD1201: =(X1201*4)+(Z1201*2) -> 44
W1202: FRANKSTON | X1202: 11 | Y1202: 6 | Z1202: 0 | AA1202: 1534 | AB1202: 1412 | AC1202: =(AA1202/AB1202)*100 -> 108.64022662889519 | AD1202: =(X1202*4)+(Z1202*2) -> 44
A1203: WERRIBEE | C1203: 4 | D1203: 5 | E1203: =(C1203*6)+D1203 -> 29 | G1203: 9 | H1203: 8 | I1203: =(G1203*6)+H1203 -> 62 | K1203: 10 | L1203: 10 | M1203: =(K1203*6)+L1203 -> 70 | O1203: 16 | P1203: 19 | Q1203: =(O1203*6)+P1203 -> 115 | S1203: Venue: WERRIBEE | W1203: ESSENDON | X1203: 10 | Y1203: 7 | Z1203: 0 | AA1203: 1540 | AB1203: 1606 | AC1203: =(AA1203/AB1203)*100 -> 95.890410958904098 | AD1203: =(X1203*4)+(Z1203*2) -> 40
A1204: NORTHERN BULLANTS | C1204: 6 | D1204: 4 | E1204: =(C1204*6)+D1204 -> 40 | G1204: 9 | H1204: 4 | I1204: =(G1204*6)+H1204 -> 58 | K1204: 15 | L1204: 4 | M1204: =(K1204*6)+L1204 -> 94 | O1204: 15 | P1204: 6 | Q1204: =(O1204*6)+P1204 -> 96 | W1204: CARLTON | X1204: 9 | Y1204: 8 | Z1204: 0 | AA1204: 1529 | AB1204: 1388 | AC1204: =(AA1204/AB1204)*100 -> 110.15850144092218 | AD1204: =(X1204*4)+(Z1204*2) -> 36
A1205: BEST PLAYERS | W1205: COBURG | X1205: 9 | Y1205: 8 | Z1205: 0 | AA1205: 1475 | AB1205: 1584 | AC1205: =(AA1205/AB1205)*100 -> 93.118686868686879 | AD1205: =(X1205*4)+(Z1205*2) -> 36
A1206: WERRIBEE | C1206: HARGREAVE | F1206: CONTESSA | I1206: SKIPPER | L1206: SAUNDERS | O1206: ROBERTSON | R1206: BIRSS
A1207: NORTHERN BULLANTS | C1207: SAGE | F1207: ZORZI | I1207: SCANLON | L1207: TAYLOR | O1207: LEE | R1207: GIBSON | W1207: WILLIAMSTOWN | X1207: 8 | Y1207: 9 | Z1207: 0 | AA1207: 1628 | AB1207: 1597 | AC1207: =(AA1207/AB1207)*100 -> 101.94113963681903 | AD1207: =(X1207*4)+(Z1207*2) -> 32
A1208: GOALKICKERS | P1208: SHEEHAN | R1208: JACK | W1208: PORT MELBOURNE | X1208: 8 | Y1208: 9 | Z1208: 0 | AA1208: 1552 | AB1208: 1571 | AC1208: =(AA1208/AB1208)*100 -> 98.790579248886061 | AD1208: =(X1208*4)+(Z1208*2) -> 32
A1209: WERRIBEE | C1209: MITCHELL 3 | F1209: SUTTON 3 | I1209: ALVEY 2 | K1209: LAMB 2 | M1209: DYER | N1209: CONTESSA | Q1209: GILBEE | S1209: SAUNDERS | W1209: SANDRINGHAM | X1209: 7 | Y1209: 10 | Z1209: 0 | AA1209: 1514 | AB1209: 1438 | AC1209: =(AA1209/AB1209)*100 -> 105.28511821974966 | AD1209: =(X1209*4)+(Z1209*2) -> 28
A1210: NORTHERN BULLANTS | C1210: LOWTHER 2 | F1210: PENN 2 | H1210: CARACELLA 2 | K1210: WATSON 2 | N1210: GIBSON 2 | Q1210: SCANLON | S1210: PATTERSON | W1210: NORTH BALLARAT | X1210: 7 | Y1210: 10 | Z1210: 0 | AA1210: 1323 | AB1210: 1682 | AC1210: =(AA1210/AB1210)*100 -> 78.656361474435201 | AD1210: =(X1210*4)+(Z1210*2) -> 28
N1211: FAVRIN | P1211: ZORZI | R1211: RASO | W1211: GEELONG | X1211: 6 | Y1211: 11 | Z1211: 0 | AA1211: 1342 | AB1211: 1421 | AC1211: =(AA1211/AB1211)*100 -> 94.440534834623506 | AD1211: =(X1211*4)+(Z1211*2) -> 24
A1212: NORTH BALLARAT | C1212: 5 | D1212: 2 | E1212: =(C1212*6)+D1212 -> 32 | G1212: 7 | H1212: 4 | I1212: =(G1212*6)+H1212 -> 46 | K1212: 16 | L1212: 5 | M1212: =(K1212*6)+L1212 -> 101 | O1212: 17 | P1212: 6 | Q1212: =(O1212*6)+P1212 -> 108 | S1212: Venue: NORTH BALLARAT | W1212: TASMANIA | X1212: 5 | Y1212: 12 | Z1212: 0 | AA1212: 1276 | AB1212: 1788 | AC1212: =(AA1212/AB1212)*100 -> 71.364653243847869 | AD1212: =(X1212*4)+(Z1212*2) -> 20
A1213: SPRINGVALE | C1213: 2 | D1213: 1 | E1213: =(C1213*6)+D1213 -> 13 | G1213: 9 | H1213: 5 | I1213: =(G1213*6)+H1213 -> 59 | K1213: 12 | L1213: 7 | M1213: =(K1213*6)+L1213 -> 79 | O1213: 14 | P1213: 9 | Q1213: =(O1213*6)+P1213 -> 93 | W1213: NORTHERN BULLANTS | X1213: 4 | Y1213: 13 | Z1213: 0 | AA1213: 1428 | AB1213: 1571 | AC1213: =(AA1213/AB1213)*100 -> 90.897517504774029 | AD1213: =(X1213*4)+(Z1213*2) -> 16
A1214: BEST PLAYERS | W1214: BENDIGO | X1214: 0 | Y1214: 17 | Z1214: 0 | AA1214: 1138 | AB1214: 2178 | AC1214: =(AA1214/AB1214)*100 -> 52.249770431588615 | AD1214: =(X1214*4)+(Z1214*2) -> 0
A1215: NORTH BALLARAT | C1215: CLAYTON | F1215: JURICA | I1215: HUTCHINSON | L1215: BYE | N1215: J POLKINGHORNE | R1215: RUYG
A1216: SPRINGVALE | C1216: PITT | F1216: LOGAN | I1216: LEWISON | L1216: O'BRIEN | N1216: ELLIOTT
A1217: GOALKICKERS
A1218: NORTH BALLARAT | C1218: CLAYTON 6 | F1218: JURICA 4 | I1218: BROWN 2 | L1218: INKSTER 2 | O1218: HUTCHINSON 2 | R1218: CHATFIELD
A1219: SPRINGVALE | C1219: PITT 5 | F1219: LOGAN 4 | I1219: DILLON 2 | L1219: CARMODY | N1219: DAVIS | P1219: SMITH
A1221: COBURG | C1221: 8 | D1221: 2 | E1221: =(C1221*6)+D1221 -> 50 | G1221: 14 | H1221: 3 | I1221: =(G1221*6)+H1221 -> 87 | K1221: 18 | L1221: 6 | M1221: =(K1221*6)+L1221 -> 114 | O1221: 20 | P1221: 7 | Q1221: =(O1221*6)+P1221 -> 127 | S1221: Venue: COBURG
A1222: WILLIAMSTOWN | C1222: 2 | D1222: 0 | E1222: =(C1222*6)+D1222 -> 12 | G1222: 8 | H1222: 1 | I1222: =(G1222*6)+H1222 -> 49 | K1222: 11 | L1222: 3 | M1222: =(K1222*6)+L1222 -> 69 | O1222: 16 | P1222: 6 | Q1222: =(O1222*6)+P1222 -> 102
A1223: BEST PLAYERS
A1224: COBURG | C1224: DEPASQUALE | F1224: STEINFORT | I1224: DAFFY | L1224: HAYNES | N1224: COUGHLAN | R1224: POYAS
A1225: WILLIAMSTOWN | C1225: BURNS | F1225: DIDAK | I1225: SHEAHAN | L1225: DE ANGELIS | O1225: SCOTLAND | R1225: STONE
A1226: GOALKICKERS
A1227: COBURG | C1227: HAYNES 6 | F1227: KRAKOUER 4 | I1227: NEWMAN 2 | L1227: POYAS 2 | N1227: HART | P1227: STEINFORT | R1227: McLEOD | U1227: HYDE | W1227: BAKER | X1227: EDNIE
A1228: WILLIAMSTOWN | C1228: TUCKEY 3 | F1228: DIDAK 3 | I1228: DE ANGELIS 3 | L1228: BURNS 2 | N1228: McKEE | P1228: ADKINS | R1228: RINTOUL | U1228: CLOKE | W1228: STONE
D1229: 5TH AUGUST | J1229: WEATHER
A1230: ESSENDON | C1230: 2 | D1230: 1 | E1230: =(C1230*6)+D1230 -> 13 | G1230: 5 | H1230: 4 | I1230: =(G1230*6)+H1230 -> 34 | K1230: 10 | L1230: 7 | M1230: =(K1230*6)+L1230 -> 67 | O1230: 11 | P1230: 10 | Q1230: =(O1230*6)+P1230 -> 76 | S1230: Venue: M.C.G. (C/R)
A1231: CARLTON | C1231: 4 | D1231: 3 | E1231: =(C1231*6)+D1231 -> 27 | G1231: 5 | H1231: 7 | I1231: =(G1231*6)+H1231 -> 37 | K1231: 5 | L1231: 11 | M1231: =(K1231*6)+L1231 -> 41 | O1231: 9 | P1231: 14 | Q1231: =(O1231*6)+P1231 -> 68
A1232: BEST PLAYERS
A1233: ESSENDON | C1233: BULLEN | F1233: BANNISTER | I1233: HILLE | L1233: HENNEMAN | O1233: DAVIES | R1233: DAVIS
A1234: CARLTON | C1234: CULPITT | F1234: MERRINGTON
A1235: GOALKICKERS
A1236: ESSENDON | C1236: SWITALA 3 | F1236: HAWKINS 3 | I1236: RICHARDS 2 | L1236: LONG | N1236: BULLEN | P1236: BANNISTER
A1237: CARLTON | C1237: DOERING 2 | F1237: WHITE 2 | I1237: CHATFIELD | L1237: MERRINGTON | O1237: FEVOLA | Q1237: FLEMING | S1237: McKEON
A1239: FRANKSTON | C1239: 0 | D1239: 5 | E1239: =(C1239*6)+D1239 -> 5 | G1239: 6 | H1239: 12 | I1239: =(G1239*6)+H1239 -> 48 | K1239: 9 | L1239: 15 | M1239: =(K1239*6)+L1239 -> 69 | O1239: 13 | P1239: 19 | Q1239: =(O1239*6)+P1239 -> 97 | S1239: Venue: FRANKSTON
A1240: TASMANIA | C1240: 3 | D1240: 1 | E1240: =(C1240*6)+D1240 -> 19 | G1240: 5 | H1240: 4 | I1240: =(G1240*6)+H1240 -> 34 | K1240: 8 | L1240: 5 | M1240: =(K1240*6)+L1240 -> 53 | O1240: 10 | P1240: 7 | Q1240: =(O1240*6)+P1240 -> 67
A1241: BEST PLAYERS
A1242: FRANKSTON | C1242: CLARKE | F1242: BURGMAN | I1242: ANDERSON | L1242: ABLETT | O1242: MITCHELL | R1242: SIMISTER
A1243: TASMANIA | C1243: HOWARD | F1243: STREET | I1243: INNES | L1243: DAVIS | O1243: WALKER | R1243: HULM
A1244: GOALKICKERS
A1245: FRANKSTON | C1245: SIMISTER 3 | F1245: FORTNAM 2 | I1245: ANDERSON 2 | L1245: BEVERIDGE 2 | O1245: CLARKE 2 | Q1245: MALLOY | S1245: WINTERTON
A1246: TASMANIA | C1246: MILLAR 2 | F1246: JONES 2 | I1246: STREET | K1246: HOWARD | M1246: BLIGHT | O1246: THURLEY | Q1246: GORDON | S1246: PRACIAK
A1248: BOX HILL | C1248: 6 | D1248: 4 | E1248: =(C1248*6)+D1248 -> 40 | G1248: 12 | H1248: 12 | I1248: =(G1248*6)+H1248 -> 84 | K1248: 16 | L1248: 18 | M1248: =(K1248*6)+L1248 -> 114 | O1248: 24 | P1248: 23 | Q1248: =(O1248*6)+P1248 -> 167 | S1248: Venue: BOX HILL
A1249: BENDIGO | C1249: 2 | D1249: 4 | E1249: =(C1249*6)+D1249 -> 16 | G1249: 3 | H1249: 6 | I1249: =(G1249*6)+H1249 -> 24 | K1249: 8 | L1249: 7 | M1249: =(K1249*6)+L1249 -> 55 | O1249: 9 | P1249: 10 | Q1249: =(O1249*6)+P1249 -> 64
A1250: BEST PLAYERS
A1251: BOX HILL | C1251: WATTS | F1251: PICIAONE | I1251: NICHOLLS | L1251: BALL | O1251: CAMPBELL | R1251: WILLIAMS
A1252: BENDIGO | C1252: ELLIOTT | F1252: CLARKE | I1252: WALSH | L1252: SMITH | O1252: GEDDES
A1253: GOALKICKERS | X1253: SMITH
A1254: BOX HILL | C1254: BREWER 3 | E1254: MURPHY 3 | G1254: BOYCE 2 | I1254: CAMPBELL 2 | L1254: NICHOLLS 2 | N1254: PICIAONE 2 | Q1254: WATTS 2 | S1254: WILLIAMS 2 | W1254: HABERFIELD | X1254: DENT | Z1254: OSBORNE | AB1254: BALL | AC1254: SOLOMON
A1255: BENDIGO | C1255: GEDDES 3 | F1255: ELLIOTT 2 | I1255: SCHMIDT 2 | L1255: BROWN | N1255: WALSH
A1257: MURRAY KANGAROOS | C1257: 2 | D1257: 2 | E1257: =(C1257*6)+D1257 -> 14 | G1257: 9 | H1257: 6 | I1257: =(G1257*6)+H1257 -> 60 | K1257: 12 | L1257: 8 | M1257: =(K1257*6)+L1257 -> 80 | O1257: 13 | P1257: 15 | Q1257: =(O1257*6)+P1257 -> 93 | S1257: Venue: PORT MELBOURNE
A1258: PORT MELBOURNE | C1258: 2 | D1258: 3 | E1258: =(C1258*6)+D1258 -> 15 | G1258: 5 | H1258: 4 | I1258: =(G1258*6)+H1258 -> 34 | K1258: 9 | L1258: 5 | M1258: =(K1258*6)+L1258 -> 59 | O1258: 13 | P1258: 6 | Q1258: =(O1258*6)+P1258 -> 84
A1259: BEST PLAYERS
A1260: MURRAY KANGAROOS | C1260: JONES | F1260: HILTON | I1260: D SMITH | L1260: MORRELL | O1260: LASSCOCK | R1260: VILLANI
A1261: PORT MELBOURNE | C1261: PILTZ | F1261: SPENCER | I1261: KENNELLY | L1261: McINERNEY
A1262: GOALKICKERS
A1263: MURRAY KANGAROOS | C1263: MORRELL 2 | F1263: COOPER 2 | I1263: STEVENS 2 | L1263: SOFI | M1263: D SMITH | O1263: MURRAY | Q1263: JONES | S1263: NEWMAN | W1263: VILLANI | X1263: PETRIE
A1264: PORT MELBOURNE | C1264: PILTZ 3 | F1264: STEVENS 2 | I1264: McINERNEY 2 | L1264: ABLETT | N1264: BUCHANAN | Q1264: PHIBBS | S1264: ALOI | U1264: ANSTEY | W1264: BARRY
A1266: ROUND 18 | D1266: 10TH AUGUST | G1266: NIGHT MATCH | J1266: WEATHER
D1267: 1ST QTR | H1267: 2ND QTR | L1267: 3RD QTR | P1267: FINAL | S1267: Venue: YORK PARK (Launceston)
A1268: CARLTON | C1268: 5 | D1268: 3 | E1268: =(C1268*6)+D1268 -> 33 | G1268: 10 | H1268: 5 | I1268: =(G1268*6)+H1268 -> 65 | K1268: 12 | L1268: 9 | M1268: =(K1268*6)+L1268 -> 81 | O1268: 17 | P1268: 14 | Q1268: =(O1268*6)+P1268 -> 116 | S1268: UMPIRES | Y1268: LADDER | AB1268: ROUND | AD1268: 18
A1269: TASMANIA | C1269: 0 | D1269: 2 | E1269: =(C1269*6)+D1269 -> 2 | G1269: 4 | H1269: 2 | I1269: =(G1269*6)+H1269 -> 26 | K1269: 6 | L1269: 3 | M1269: =(K1269*6)+L1269 -> 39 | O1269: 8 | P1269: 4 | Q1269: =(O1269*6)+P1269 -> 52
A1270: BEST PLAYERS | W1270: TEAM | X1270: W | Y1270: L | Z1270: D | AA1270: FOR | AB1270: AGST | AC1270: % | AD1270: PTS
A1271: CARLTON | C1271: CULPITT | F1271: DOERING | I1271: JACOTINE | L1271: DURLING | O1271: SINNOTT
A1272: TASMANIA | C1272: DAVIS | F1272: CARELESS | I1272: BOWRING | L1272: BOLTON | O1272: WAGER | R1272: WALKER | W1272: WERRIBEE | X1272: 16 | Y1272: 2 | Z1272: 0 | AA1272: 2104 | AB1272: 1215 | AC1272: =(AA1272/AB1272)*100 -> 173.16872427983537 | AD1272: =(X1272*4)+(Z1272*2) -> 64
A1273: GOALKICKERS | P1273: O'KEEFE | W1273: BOX HILL | X1273: 14 | Y1273: 4 | Z1273: 0 | AA1273: 2009 | AB1273: 1325 | AC1273: =(AA1273/AB1273)*100 -> 151.62264150943398 | AD1273: =(X1273*4)+(Z1273*2) -> 56
A1274: CARLTON | C1274: FEVOLA 5 | E1274: CULPITT 3 | G1274: BEASY 2 | I1274: McKEON | K1274: WHITE | M1274: WAITE | O1274: SINNOTT | Q1274: DOERING | S1274: CHRISTOU | W1274: SPRINGVALE | X1274: 12 | Y1274: 6 | Z1274: 0 | AA1274: 1759 | AB1274: 1552 | AC1274: =(AA1274/AB1274)*100 -> 113.33762886597938 | AD1274: =(X1274*4)+(Z1274*2) -> 48
A1275: TASMANIA | C1275: HULM 2 | F1275: ALLEN | H1275: MILLAR | J1275: WAGER | L1275: CALLINAN | O1275: BOLTON | Q1275: BROOKS | W1275: MURRAY KANGAROOS | X1275: 12 | Y1275: 6 | Z1275: 0 | AA1275: 1818 | AB1275: 1625 | AC1275: =(AA1275/AB1275)*100 -> 111.87692307692308 | AD1275: =(X1275*4)+(Z1275*2) -> 48
D1276: 11TH AUGUST | J1276: WEATHER | W1276: FRANKSTON | X1276: 11 | Y1276: 7 | Z1276: 0 | AA1276: 1606 | AB1276: 1518 | AC1276: =(AA1276/AB1276)*100 -> 105.79710144927536 | AD1276: =(X1276*4)+(Z1276*2) -> 44
A1277: GEELONG | C1277: 3 | D1277: 1 | E1277: =(C1277*6)+D1277 -> 19 | G1277: 10 | H1277: 4 | I1277: =(G1277*6)+H1277 -> 64 | K1277: 14 | L1277: 7 | M1277: =(K1277*6)+L1277 -> 91 | O1277: 18 | P1277: 11 | Q1277: =(O1277*6)+P1277 -> 119 | S1277: Venue: COBURG | W1277: CARLTON | X1277: 10 | Y1277: 8 | Z1277: 0 | AA1277: 1645 | AB1277: 1440 | AC1277: =(AA1277/AB1277)*100 -> 114.23611111111111 | AD1277: =(X1277*4)+(Z1277*2) -> 40
A1278: MURRAY KANGAROOS | C1278: 1 | D1278: 5 | E1278: =(C1278*6)+D1278 -> 11 | G1278: 3 | H1278: 5 | I1278: =(G1278*6)+H1278 -> 23 | K1278: 6 | L1278: 5 | M1278: =(K1278*6)+L1278 -> 41 | O1278: 7 | P1278: 7 | Q1278: =(O1278*6)+P1278 -> 49 | W1278: COBURG | X1278: 10 | Y1278: 8 | Z1278: 0 | AA1278: 1590 | AB1278: 1659 | AC1278: =(AA1278/AB1278)*100 -> 95.840867992766732 | AD1278: =(X1278*4)+(Z1278*2) -> 40
A1279: BEST PLAYERS | W1279: ESSENDON | X1279: 10 | Y1279: 8 | Z1279: 0 | AA1279: 1652 | AB1279: 1730 | AC1279: =(AA1279/AB1279)*100 -> 95.49132947976878 | AD1279: =(X1279*4)+(Z1279*2) -> 40
A1280: GEELONG | C1280: STREET | F1280: FOSTER | I1280: LOWTHER | L1280: P CHAPMAN | O1280: BALDWIN | R1280: COREY
A1281: MURRAY KANGAROOS | C1281: MOTLOP | F1281: PRATT | I1281: PETRIE | W1281: WILLIAMSTOWN | X1281: 9 | Y1281: 9 | Z1281: 0 | AA1281: 1736 | AB1281: 1698 | AC1281: =(AA1281/AB1281)*100 -> 102.23792697290929 | AD1281: =(X1281*4)+(Z1281*2) -> 36
A1282: GOALKICKERS | J1282: LOWTHER | L1282: WOOLNOUGH | O1282: O'BRIEN | Q1282: STREET | W1282: PORT MELBOURNE | X1282: 9 | Y1282: 9 | Z1282: 0 | AA1282: 1676 | AB1282: 1683 | AC1282: =(AA1282/AB1282)*100 -> 99.584076054664294 | AD1282: =(X1282*4)+(Z1282*2) -> 36
A1283: GEELONG | C1283: BALDWIN 5 | F1283: MENSCH 4 | I1283: P CHAPMAN | L1283: COREY | N1283: FOSTER | P1283: HOULIHAN | R1283: KARAMATIC | W1283: SANDRINGHAM | X1283: 7 | Y1283: 11 | Z1283: 0 | AA1283: 1566 | AB1283: 1531 | AC1283: =(AA1283/AB1283)*100 -> 102.28608752449379 | AD1283: =(X1283*4)+(Z1283*2) -> 28
A1284: MURRAY KANGAROOS | C1284: HARDING 3 | F1284: PARSONS | I1284: GILLILAND | L1284: STEVENS | N1284: L SMITH | W1284: GEELONG | X1284: 7 | Y1284: 11 | Z1284: 0 | AA1284: 1461 | AB1284: 1470 | AC1284: =(AA1284/AB1284)*100 -> 99.387755102040813 | AD1284: =(X1284*4)+(Z1284*2) -> 28
W1285: NORTH BALLARAT | X1285: 7 | Y1285: 10 | Z1285: 0 | AA1285: 1323 | AB1285: 1682 | AC1285: =(AA1285/AB1285)*100 -> 78.656361474435201 | AD1285: =(X1285*4)+(Z1285*2) -> 28
A1286: COBURG | C1286: 5 | D1286: 5 | E1286: =(C1286*6)+D1286 -> 35 | G1286: 7 | H1286: 7 | I1286: =(G1286*6)+H1286 -> 49 | K1286: 11 | L1286: 11 | M1286: =(K1286*6)+L1286 -> 77 | O1286: 16 | P1286: 19 | Q1286: =(O1286*6)+P1286 -> 115 | S1286: Venue: PRESTON | W1286: TASMANIA | X1286: 5 | Y1286: 13 | Z1286: 0 | AA1286: 1328 | AB1286: 1904 | AC1286: =(AA1286/AB1286)*100 -> 69.747899159663859 | AD1286: =(X1286*4)+(Z1286*2) -> 20
A1287: NORTHERN BULLANTS | C1287: 3 | D1287: 1 | E1287: =(C1287*6)+D1287 -> 19 | G1287: 8 | H1287: 4 | I1287: =(G1287*6)+H1287 -> 52 | K1287: 9 | L1287: 7 | M1287: =(K1287*6)+L1287 -> 61 | O1287: 11 | P1287: 9 | Q1287: =(O1287*6)+P1287 -> 75 | W1287: NORTHERN BULLANTS | X1287: 4 | Y1287: 14 | Z1287: 0 | AA1287: 1503 | AB1287: 1686 | AC1287: =(AA1287/AB1287)*100 -> 89.145907473309606 | AD1287: =(X1287*4)+(Z1287*2) -> 16
A1288: BEST PLAYERS | W1288: BENDIGO | X1288: 0 | Y1288: 18 | Z1288: 0 | AA1288: 1200 | AB1288: 2361 | AC1288: =(AA1288/AB1288)*100 -> 50.825921219822114 | AD1288: =(X1288*4)+(Z1288*2) -> 0
A1289: COBURG | C1289: EDNIE | F1289: PAGAN | I1289: STEINFORT | L1289: LAPPIN | O1289: KRAKOUER | R1289: PETTIFER
A1290: NORTHERN BULLANTS | C1290: WATSON | F1290: ZORZI | I1290: LEE | L1290: SAGE | O1290: RASO
A1291: GOALKICKERS | L1291: HOMEWOOD | N1291: HART | P1291: ZANTUCK | R1291: BURGEIL | T1291: EDNIE
A1292: COBURG | C1292: PETTIFER 4 | F1292: STEINFORT 2 | I1292: KRAKOUER 2 | L1292: DEPASQUALE | O1292: LAPPIN | Q1292: PROCTOR
A1293: NORTHERN BULLANTS | C1293: FAVRIN 3 | F1293: PENN | H1293: WATSON | J1293: RAMSAY | L1293: SCANLON | N1293: RASO | P1293: CLAYTON | R1293: ZORZI | T1293: BUNN
A1295: PORT MELBOURNE | C1295: 6 | D1295: 3 | E1295: =(C1295*6)+D1295 -> 39 | G1295: 12 | H1295: 5 | I1295: =(G1295*6)+H1295 -> 77 | K1295: 14 | L1295: 7 | M1295: =(K1295*6)+L1295 -> 91 | O1295: 19 | P1295: 10 | Q1295: =(O1295*6)+P1295 -> 124 | S1295: Venue: WINDY HILL
A1296: ESSENDON | C1296: 7 | D1296: 0 | E1296: =(C1296*6)+D1296 -> 42 | G1296: 11 | H1296: 0 | I1296: =(G1296*6)+H1296 -> 66 | K1296: 14 | L1296: 8 | M1296: =(K1296*6)+L1296 -> 92 | O1296: 17 | P1296: 10 | Q1296: =(O1296*6)+P1296 -> 112
A1297: BEST PLAYERS
A1298: PORT MELBOURNE | C1298: KENNELLY | F1298: FILANDIA | I1298: McMAHON | L1298: STEVENS | O1298: DELUCA | R1298: AHMAT
A1299: ESSENDON | C1299: BULLEN | F1299: DAVIS | I1299: HUNT | L1299: RIOLI
A1300: GOALKICKERS
A1301: PORT MELBOURNE | C1301: FILANDIA 5 | F1301: LUFF 3 | I1301: BUCHANAN 3 | L1301: STEVENS 3 | N1301: ANSTEY | P1301: BENNETT | R1301: SWAN | T1301: DELUCA | W1301: AHMAT
A1302: ESSENDON | C1302: HAWKINS 6 | F1302: PODSIADLY 4 | J1302: BULLEN 2 | M1302: CRANAGE 2 | P1302: RIOLI 2 | S1302: YZE
A1304: WILLIAMSTOWN | C1304: 4 | D1304: 1 | E1304: =(C1304*6)+D1304 -> 25 | G1304: 5 | H1304: 5 | I1304: =(G1304*6)+H1304 -> 35 | K1304: 11 | L1304: 7 | M1304: =(K1304*6)+L1304 -> 73 | O1304: 16 | P1304: 12 | Q1304: =(O1304*6)+P1304 -> 108 | S1304: Venue: WILLIAMSTOWN
A1305: WERRIBEE | C1305: 6 | D1305: 5 | E1305: =(C1305*6)+D1305 -> 41 | G1305: 9 | H1305: 7 | I1305: =(G1305*6)+H1305 -> 61 | K1305: 12 | L1305: 13 | M1305: =(K1305*6)+L1305 -> 85 | O1305: 14 | P1305: 17 | Q1305: =(O1305*6)+P1305 -> 101
A1306: BEST PLAYERS
A1307: WILLIAMSTOWN | C1307: TUCKEY | F1307: McKEE | I1307: SHEEHAN | L1307: DIDAK | N1307: SCOTLAND | Q1307: WEST
A1308: WERRIBEE | C1308: DYER | F1308: FAULKNER | I1308: CONTESSA | L1308: TAYLOR | N1308: HARGREAVE
A1309: GOALKICKERS
A1310: WILLIAMSTOWN | C1310: TUCKEY 5 | F1310: HILL 3 | I1310: SMOKER 2 | L1310: ROUND 2 | N1310: DIDAK 2 | Q1310: SHEEHAN | S1310: SCOTLAND
A1311: WERRIBEE | C1311: BOWDEN 4 | F1311: MITCHELL 3 | I1311: KRETIUK 3 | L1311: JACK | N1311: CONTESSA | Q1311: DYER | S1311: HAHN
D1312: 12TH AUGUST | J1312: WEATHER
A1313: SPRINGVALE | C1313: 3 | D1313: 3 | E1313: =(C1313*6)+D1313 -> 21 | G1313: 9 | H1313: 5 | I1313: =(G1313*6)+H1313 -> 59 | K1313: 14 | L1313: 9 | M1313: =(K1313*6)+L1313 -> 93 | O1313: 16 | P1313: 10 | Q1313: =(O1313*6)+P1313 -> 106 | S1313: Venue: SHEPLEY OVAL
A1314: FRANKSTON | C1314: 2 | D1314: 2 | E1314: =(C1314*6)+D1314 -> 14 | G1314: 7 | H1314: 5 | I1314: =(G1314*6)+H1314 -> 47 | K1314: 7 | L1314: 7 | M1314: =(K1314*6)+L1314 -> 49 | O1314: 10 | P1314: 12 | Q1314: =(O1314*6)+P1314 -> 72
A1315: BEST PLAYERS
A1316: SPRINGVALE | C1316: O'BRIEN | F1316: VOSS | I1316: LEWISON | L1316: DAVIS | N1316: YOUNG | Q1316: TROLLOPE
A1317: FRANKSTON | C1317: BURGMAN | F1317: ABLETT | I1317: LITTLE | L1317: SMITH
A1318: GOALKICKERS
A1319: SPRINGVALE | C1319: LOGAN 3 | E1319: POWELL 3 | G1319: DILLON 2 | I1319: CARMODY 2 | L1319: GALE 2 | N1319: WALTON | P1319: PITT | R1319: LEWISON | U1319: VOSS
A1320: FRANKSTON | C1320: SAUTNER 3 | F1320: MALLOY 3 | I1320: SIMISTER 2 | L1320: ABLETT | N1320: McCORMACK
A1322: BOX HILL | C1322: 1 | D1322: 3 | E1322: =(C1322*6)+D1322 -> 9 | G1322: 5 | H1322: 5 | I1322: =(G1322*6)+H1322 -> 35 | K1322: 9 | L1322: 6 | M1322: =(K1322*6)+L1322 -> 60 | O1322: 14 | P1322: 9 | Q1322: =(O1322*6)+P1322 -> 93 | S1322: Venue: BEACH ROAD
A1323: SANDRINGHAM | C1323: 2 | D1323: 3 | E1323: =(C1323*6)+D1323 -> 15 | G1323: 4 | H1323: 6 | I1323: =(G1323*6)+H1323 -> 30 | K1323: 6 | L1323: 8 | M1323: =(K1323*6)+L1323 -> 44 | O1323: 7 | P1323: 10 | Q1323: =(O1323*6)+P1323 -> 52
A1324: BEST PLAYERS
A1325: BOX HILL | C1325: OBST | F1325: WILLIAMS | I1325: OSBORNE | L1325: ROCK | O1325: BALL | Q1325: LONIE
A1326: SANDRINGHAM | C1326: CLARK | F1326: HACKETT | I1326: McNICHOLAS | L1326: COLLINS | O1326: HAYWARD | Q1326: THOMPSON
A1327: GOALKICKERS
A1328: BOX HILL | C1328: LONIE 4 | F1328: HAZELL 2 | I1328: WATTS 2 | L1328: GEORGIADIS 2 | O1328: MURPHY | Q1328: BALL | R1328: WILLIAMS | U1328: ROCK
A1329: SANDRINGHAM | C1329: MACGEORGE 2 | F1329: WHEATLEY | I1329: GODFREY | K1329: JOLLY | M1329: HACKETT | O1329: TEMPLETON
A1331: NORTH BALLARAT | C1331: 5 | D1331: 3 | E1331: =(C1331*6)+D1331 -> 33 | G1331: 14 | H1331: 8 | I1331: =(G1331*6)+H1331 -> 92 | K1331: 18 | L1331: 12 | M1331: =(K1331*6)+L1331 -> 120 | O1331: 28 | P1331: 15 | Q1331: =(O1331*6)+P1331 -> 183 | S1331: Venue: NORTH BALLARAT
A1332: BENDIGO | C1332: 5 | D1332: 3 | E1332: =(C1332*6)+D1332 -> 33 | G1332: 6 | H1332: 4 | I1332: =(G1332*6)+H1332 -> 40 | K1332: 9 | L1332: 7 | M1332: =(K1332*6)+L1332 -> 61 | O1332: 9 | P1332: 8 | Q1332: =(O1332*6)+P1332 -> 62
A1333: BEST PLAYERS
A1334: NORTH BALLARAT | C1334: CLAYTON | F1334: COLLARD | I1334: JURICA | L1334: McMAHON | O1334: BROWN | Q1334: BYE
A1335: BENDIGO | C1335: ANDERSON | F1335: ATKINS | I1335: O'TOOLE | L1335: CAMPBELL | O1335: SCHMIDT
A1336: GOALKICKERS
A1337: NORTH BALLARAT | C1337: COLLARD 9 | F1337: CLAYTON 6 | I1337: McMAHON 3 | L1337: JURICA 3 | N1337: PRESTON 2 | Q1337: FISHER | S1337: EDWARDS | W1337: HUTCHINSON | X1337: BYE | Z1337: BROWN
A1338: BENDIGO | C1338: O'TOOLE 2 | F1338: WALSH 2 | I1338: ANDERSON 2 | L1338: CLARKE | N1338: SCHMIDT | P1338: BROWN
A1340: ROUND 19 | D1340: 18TH AUGUST | J1340: WEATHER
D1341: 1ST QTR | H1341: 2ND QTR | L1341: 3RD QTR | P1341: FINAL | S1341: Venue: COBURG
A1342: MURRAY KANGAROOS | C1342: 5 | D1342: 4 | E1342: =(C1342*6)+D1342 -> 34 | G1342: 9 | H1342: 9 | I1342: =(G1342*6)+H1342 -> 63 | K1342: 12 | L1342: 11 | M1342: =(K1342*6)+L1342 -> 83 | O1342: 16 | P1342: 15 | Q1342: =(O1342*6)+P1342 -> 111 | S1342: UMPIRES | Y1342: LADDER | AB1342: ROUND | AD1342: 19
A1343: TASMANIA | C1343: 3 | D1343: 3 | E1343: =(C1343*6)+D1343 -> 21 | G1343: 5 | H1343: 5 | I1343: =(G1343*6)+H1343 -> 35 | K1343: 7 | L1343: 7 | M1343: =(K1343*6)+L1343 -> 49 | O1343: 10 | P1343: 8 | Q1343: =(O1343*6)+P1343 -> 68
A1344: BEST PLAYERS | W1344: TEAM | X1344: W | Y1344: L | Z1344: D | AA1344: FOR | AB1344: AGST | AC1344: % | AD1344: PTS
A1345: MURRAY KANGAROOS | C1345: MOTLOP | F1345: HILTON | I1345: PRATT | L1345: WHITE | O1345: SPAULL | R1345: SOFI
A1346: TASMANIA | C1346: WAGER | F1346: PROBERT | I1346: CARELESS | L1346: THURLEY | O1346: PRACIAK | R1346: RANSLEY | W1346: WERRIBEE | X1346: 17 | Y1346: 2 | Z1346: 0 | AA1346: 2238 | AB1346: 1281 | AC1346: =(AA1346/AB1346)*100 -> 174.70725995316158 | AD1346: =(X1346*4)+(Z1346*2) -> 68
A1347: GOALKICKERS | Q1347: MORRELL | W1347: BOX HILL | X1347: 14 | Y1347: 5 | Z1347: 0 | AA1347: 2075 | AB1347: 1459 | AC1347: =(AA1347/AB1347)*100 -> 142.22069910897875 | AD1347: =(X1347*4)+(Z1347*2) -> 56
A1348: MURRAY KANGAROOS | C1348: MOTLOP 4 | E1348: HARDING 4 | H1348: STEVENS 2 | J1348: L SMITH | L1348: D SMITH | N1348: SPAULL | P1348: KUSCHERT | R1348: PORTER | W1348: MURRAY KANGAROOS | X1348: 13 | Y1348: 6 | Z1348: 0 | AA1348: 1929 | AB1348: 1693 | AC1348: =(AA1348/AB1348)*100 -> 113.93975191966923 | AD1348: =(X1348*4)+(Z1348*2) -> 52
A1349: TASMANIA | C1349: COONEY 2 | F1349: ALLEN 2 | I1349: CARTER 2 | L1349: BLIGHT 2 | O1349: BOLTON | Q1349: PRACIAK | W1349: SPRINGVALE | X1349: 12 | Y1349: 7 | Z1349: 0 | AA1349: 1811 | AB1349: 1649 | AC1349: =(AA1349/AB1349)*100 -> 109.82413583990298 | AD1349: =(X1349*4)+(Z1349*2) -> 48
W1350: FRANKSTON | X1350: 12 | Y1350: 7 | Z1350: 0 | AA1350: 1710 | AB1350: 1611 | AC1350: =(AA1350/AB1350)*100 -> 106.14525139664805 | AD1350: =(X1350*4)+(Z1350*2) -> 48
A1351: CARLTON | C1351: 4 | D1351: 2 | E1351: =(C1351*6)+D1351 -> 26 | G1351: 6 | H1351: 5 | I1351: =(G1351*6)+H1351 -> 41 | K1351: 12 | L1351: 6 | M1351: =(K1351*6)+L1351 -> 78 | O1351: 15 | P1351: 7 | Q1351: =(O1351*6)+P1351 -> 97 | S1351: Venue: MOORABBIN | W1351: CARLTON | X1351: 11 | Y1351: 8 | Z1351: 0 | AA1351: 1742 | AB1351: 1492 | AC1351: =(AA1351/AB1351)*100 -> 116.75603217158177 | AD1351: =(X1351*4)+(Z1351*2) -> 44
A1352: SPRINGVALE | C1352: 3 | D1352: 4 | E1352: =(C1352*6)+D1352 -> 22 | G1352: 5 | H1352: 6 | I1352: =(G1352*6)+H1352 -> 36 | K1352: 5 | L1352: 11 | M1352: =(K1352*6)+L1352 -> 41 | O1352: 6 | P1352: 16 | Q1352: =(O1352*6)+P1352 -> 52 | W1352: COBURG | X1352: 11 | Y1352: 8 | Z1352: 0 | AA1352: 1703 | AB1352: 1716 | AC1352: =(AA1352/AB1352)*100 -> 99.242424242424249 | AD1352: =(X1352*4)+(Z1352*2) -> 44
A1353: BEST PLAYERS | W1353: WILLIAMSTOWN | X1353: 10 | Y1353: 9 | Z1353: 0 | AA1353: 1847 | AB1353: 1780 | AC1353: =(AA1353/AB1353)*100 -> 103.76404494382024 | AD1353: =(X1353*4)+(Z1353*2) -> 40
A1354: CARLTON | C1354: CULPITT | F1354: HOTTON | I1354: PICKERING | L1354: SPORN | O1354: WHITE | R1354: DURLING
A1355: SPRINGVALE | C1355: VOSS | F1355: TROLLOPE | I1355: ELLIOTT | L1355: RYAN | W1355: ESSENDON | X1355: 10 | Y1355: 9 | Z1355: 0 | AA1355: 1734 | AB1355: 1841 | AC1355: =(AA1355/AB1355)*100 -> 94.18794133623031 | AD1355: =(X1355*4)+(Z1355*2) -> 40
A1356: GOALKICKERS | L1356: CAMPBELL | O1356: BACKWELL | R1356: FLEMING | W1356: PORT MELBOURNE | X1356: 9 | Y1356: 10 | Z1356: 0 | AA1356: 1773 | AB1356: 1781 | AC1356: =(AA1356/AB1356)*100 -> 99.550814149354295 | AD1356: =(X1356*4)+(Z1356*2) -> 36
A1357: CARLTON | C1357: CRANAGE 4 | F1357: SPORN 2 | H1357: HOTTON 2 | J1357: BRAD CAMPBELL 2 | N1357: MERRINGTON | Q1357: CULPITT | S1357: BLAKE | W1357: SANDRINGHAM | X1357: 8 | Y1357: 11 | Z1357: 0 | AA1357: 1664 | AB1357: 1628 | AC1357: =(AA1357/AB1357)*100 -> 102.21130221130221 | AD1357: =(X1357*4)+(Z1357*2) -> 32
A1358: SPRINGVALE | C1358: CARMODY | F1358: DAVIS | H1358: DILLON | J1358: RYAN | L1358: PITT | N1358: DELARUE | W1358: GEELONG | X1358: 7 | Y1358: 12 | Z1358: 0 | AA1358: 1554 | AB1358: 1574 | AC1358: =(AA1358/AB1358)*100 -> 98.729351969504435 | AD1358: =(X1358*4)+(Z1358*2) -> 28
W1359: NORTH BALLARAT | X1359: 7 | Y1359: 12 | Z1359: 0 | AA1359: 1380 | AB1359: 1795 | AC1359: =(AA1359/AB1359)*100 -> 76.880222841225631 | AD1359: =(X1359*4)+(Z1359*2) -> 28
A1360: SANDRINGHAM | C1360: 3 | D1360: 3 | E1360: =(C1360*6)+D1360 -> 21 | G1360: 7 | H1360: 4 | I1360: =(G1360*6)+H1360 -> 46 | K1360: 9 | L1360: 9 | M1360: =(K1360*6)+L1360 -> 63 | O1360: 14 | P1360: 14 | Q1360: =(O1360*6)+P1360 -> 98 | S1360: Venue: PORT MELBOURNE | W1360: NORTHERN BULLANTS | X1360: 5 | Y1360: 14 | Z1360: 0 | AA1360: 1661 | AB1360: 1743 | AC1360: =(AA1360/AB1360)*100 -> 95.29546758462422 | AD1360: =(X1360*4)+(Z1360*2) -> 20
A1361: PORT MELBOURNE | C1361: 3 | D1361: 4 | E1361: =(C1361*6)+D1361 -> 22 | G1361: 5 | H1361: 4 | I1361: =(G1361*6)+H1361 -> 34 | K1361: 12 | L1361: 4 | M1361: =(K1361*6)+L1361 -> 76 | O1361: 15 | P1361: 7 | Q1361: =(O1361*6)+P1361 -> 97 | W1361: TASMANIA | X1361: 5 | Y1361: 14 | Z1361: 0 | AA1361: 1396 | AB1361: 2015 | AC1361: =(AA1361/AB1361)*100 -> 69.280397022332508 | AD1361: =(X1361*4)+(Z1361*2) -> 20
A1362: BEST PLAYERS | W1362: BENDIGO | X1362: 0 | Y1362: 19 | Z1362: 0 | AA1362: 1267 | AB1362: 2519 | AC1362: =(AA1362/AB1362)*100 -> 50.297737197300521 | AD1362: =(X1362*4)+(Z1362*2) -> 0
A1363: SANDRINGHAM | C1363: COGHLAN | F1363: JOHNSTONE | J1363: BEAMS | M1363: TREGEAR | P1363: HAYNES | R1363: CLARK
A1364: PORT MELBOURNE | C1364: LEWIS | F1364: FEAST | J1364: BENNETT | M1364: ABLETT | P1364: ELLIOTT | R1364: LUFF
A1365: GOALKICKERS
A1366: SANDRINGHAM | C1366: BEAMS 6 | F1366: TEMPLETON 2 | I1366: PITT 2 | K1366: HACKETT | M1366: HAYWARD | P1366: LIDDELL | R1366: JOHNSTONE
A1367: PORT MELBOURNE | C1367: LEWIS 3 | E1367: STEVENS 3 | H1367: FEAST 2 | J1367: EVANS 2 | L1367: PILTZ | N1367: AHMAT | P1367: LUFF | R1367: FOSDIKE | U1367: BARRY
A1369: WERRIBEE | C1369: 5 | D1369: 2 | E1369: =(C1369*6)+D1369 -> 32 | G1369: 10 | H1369: 6 | I1369: =(G1369*6)+H1369 -> 66 | K1369: 14 | L1369: 10 | M1369: =(K1369*6)+L1369 -> 94 | O1369: 20 | P1369: 14 | Q1369: =(O1369*6)+P1369 -> 134 | S1369: Venue: BOX HILL
A1370: BOX HILL | C1370: 4 | D1370: 1 | E1370: =(C1370*6)+D1370 -> 25 | G1370: 7 | H1370: 3 | I1370: =(G1370*6)+H1370 -> 45 | K1370: 8 | L1370: 4 | M1370: =(K1370*6)+L1370 -> 52 | O1370: 10 | P1370: 6 | Q1370: =(O1370*6)+P1370 -> 66
A1371: BEST PLAYERS
A1372: WERRIBEE | C1372: BIRSS | F1372: SAUNDERS | I1372: ROBERTSON | L1372: GILBEE | O1372: CONTESSA | R1372: BARTLETT
A1373: BOX HILL | C1373: MITCHELL | F1373: BALL | I1373: SMITH | L1373: NEAGLE | O1373: OSBORNE | R1373: WATTS
A1374: GOALKICKERS
A1375: WERRIBEE | C1375: SAUNDERS 4 | F1375: MITCHELL 4 | I1375: BOWDEN 2 | L1375: ROBERTSON 2 | O1375: ROBBINS 2 | Q1375: COX | R1375: CONTESSA | U1375: GILBEE | W1375: PULI | X1375: FULLER | Z1375: BARTLETT
A1376: BOX HILL | C1376: O'FARRELL 2 | F1376: RIES 2 | I1376: MURPHY 2 | L1376: NEAGLE | N1376: CAMPBELL | Q1376: MITCHELL | S1376: PASSADOR
D1377: 19TH AUGUST | J1377: WEATHER
A1378: COBURG | C1378: 5 | D1378: 2 | E1378: =(C1378*6)+D1378 -> 32 | G1378: 10 | H1378: 9 | I1378: =(G1378*6)+H1378 -> 69 | K1378: 11 | L1378: 10 | M1378: =(K1378*6)+L1378 -> 76 | O1378: 17 | P1378: 11 | Q1378: =(O1378*6)+P1378 -> 113 | S1378: Venue: COBURG
A1379: NORTH BALLARAT | C1379: 3 | D1379: 3 | E1379: =(C1379*6)+D1379 -> 21 | G1379: 5 | H1379: 3 | I1379: =(G1379*6)+H1379 -> 33 | K1379: 7 | L1379: 6 | M1379: =(K1379*6)+L1379 -> 48 | O1379: 8 | P1379: 9 | Q1379: =(O1379*6)+P1379 -> 57
A1380: BEST PLAYERS
A1381: COBURG | C1381: DEPASQUALE | F1381: COUGHLAN | I1381: JAMES | L1381: PROCTOR | O1381: HALL | Q1381: NEWMAN
A1382: NORTH BALLARAT | C1382: JURICA | F1382: POLKINGHORNE | I1382: RUYG | L1382: FISHER | O1382: SOMERVILLE | R1382: BROWN
A1383: GOALKICKERS
A1384: COBURG | C1384: JAMES 8 | F1384: EDNIE 2 | I1384: KRAKOUER 2 | L1384: HALL 2 | N1384: DEPASQUALE | Q1384: PETTIFER | S1384: BURGIEL
A1385: NORTH BALLARAT | C1385: FISHER 2 | F1385: CLAYTON 2 | I1385: POWER | K1385: COLLARD | M1385: McMAHON | O1385: COHEN
A1387: WILLIAMSTOWN | C1387: 7 | D1387: 4 | E1387: =(C1387*6)+D1387 -> 46 | G1387: 10 | H1387: 5 | I1387: =(G1387*6)+H1387 -> 65 | K1387: 14 | L1387: 10 | M1387: =(K1387*6)+L1387 -> 94 | O1387: 16 | P1387: 15 | Q1387: =(O1387*6)+P1387 -> 111 | S1387: Venue: WILLIAMSTOWN
A1388: ESSENDON | C1388: 4 | D1388: 4 | E1388: =(C1388*6)+D1388 -> 28 | G1388: 7 | H1388: 11 | I1388: =(G1388*6)+H1388 -> 53 | K1388: 8 | L1388: 13 | M1388: =(K1388*6)+L1388 -> 61 | O1388: 11 | P1388: 16 | Q1388: =(O1388*6)+P1388 -> 82
A1389: BEST PLAYERS
A1390: WILLIAMSTOWN | C1390: SCOTLAND | F1390: SHEEHAN | I1390: JOHNSON | L1390: DE ANGELIS | O1390: UKOVIC | Q1390: BETHERAS
A1391: ESSENDON | C1391: JOHNSON | F1391: MOORCROFT | I1391: HENNEMAN | L1391: BLUMFIELD | O1391: DENHAM
A1392: GOALKICKERS | T1392: JOHNSON
A1393: WILLIAMSTOWN | C1393: WOOD 2 | E1393: TUCKEY 2 | G1393: CLOKE 2 | I1393: ANDERSON | L1393: DIDAK | N1393: BETHERAS | Q1393: LOVETT-MURRAY | U1393: LLOYD | W1393: DE ANGELIS | X1393: HILL | Z1393: SCOTLAND | AB1393: SMOKER
A1394: ESSENDON | C1394: MOORCROFT 2 | F1394: BLUMFIELD 2 | I1394: LALICH | K1394: HALL | M1394: GODDARD | O1394: BULLEN | Q1394: DAVIES | S1394: DENHAM | V1394: CRANAGE
A1396: FRANKSTON | C1396: 4 | D1396: 1 | E1396: =(C1396*6)+D1396 -> 25 | G1396: 11 | H1396: 2 | I1396: =(G1396*6)+H1396 -> 68 | K1396: 11 | L1396: 4 | M1396: =(K1396*6)+L1396 -> 70 | O1396: 16 | P1396: 8 | Q1396: =(O1396*6)+P1396 -> 104 | S1396: Venue: FRANKSTON
A1397: GEELONG | C1397: 7 | D1397: 2 | E1397: =(C1397*6)+D1397 -> 44 | G1397: 10 | H1397: 3 | I1397: =(G1397*6)+H1397 -> 63 | K1397: 13 | L1397: 8 | M1397: =(K1397*6)+L1397 -> 86 | O1397: 14 | P1397: 9 | Q1397: =(O1397*6)+P1397 -> 93
A1398: BEST PLAYERS
A1399: FRANKSTON | C1399: SULLIVAN | F1399: BURGMAN | I1399: LITTLE | L1399: MALLOY | O1399: ROBERTS | R1399: LYON
A1400: GEELONG | C1400: MENSCH | F1400: LOWTHER | I1400: HOSKING | L1400: O'BRIEN | O1400: CHAPMAN | R1400: POWELL
A1401: GOALKICKERS
A1402: FRANKSTON | C1402: SAUTNER 4 | F1402: SIMISTER 4 | I1402: MCCORMACK 2 | L1402: SALISBURY | N1402: FOLINO | P1402: ANDERSON | R1402: FORTNAM | U1402: ABLETT | X1402: MALLOY
A1403: GEELONG | C1403: BALDWIN 2 | F1403: O'BRIEN 2 | I1403: HOSKING 2 | L1403: CHAPMAN | N1403: KARAMATIC | Q1403: LOWTHER | S1403: MENSCH | V1403: MERRIMAN | X1403: POWELL | Z1403: ROOKE | AB1403: SPOLDING
A1405: NORTHERN BULLANTS | C1405: 6 | D1405: 2 | E1405: =(C1405*6)+D1405 -> 38 | G1405: 10 | H1405: 8 | I1405: =(G1405*6)+H1405 -> 68 | K1405: 16 | L1405: 11 | M1405: =(K1405*6)+L1405 -> 107 | O1405: 24 | P1405: 14 | Q1405: =(O1405*6)+P1405 -> 158 | S1405: Venue: BENDIGO
A1406: BENDIGO | C1406: 5 | D1406: 1 | E1406: =(C1406*6)+D1406 -> 31 | G1406: 5 | H1406: 2 | I1406: =(G1406*6)+H1406 -> 32 | K1406: 8 | L1406: 4 | M1406: =(K1406*6)+L1406 -> 52 | O1406: 10 | P1406: 7 | Q1406: =(O1406*6)+P1406 -> 67
A1407: BEST PLAYERS
A1408: NORTHERN BULLANTS | C1408: SAGE | F1408: ZORZI | I1408: WATSON | L1408: SCANLON | O1408: LEE | R1408: LOWTHER
A1409: BENDIGO | C1409: GEDDES | F1409: BROWN | I1409: CAIL | L1409: ELSUM | O1409: WALSH | R1409: O'TOOLE
A1410: GOALKICKERS
A1411: NORTHERN BULLANTS | C1411: WATSON 5 | F1411: ZORZI 3 | H1411: FAVRIN 3 | J1411: PENN 2 | L1411: CANN 2 | N1411: CARACELLA 2 | Q1411: SCANLON 2 | T1411: VAN HATTUM | U1411: LEE | W1411: GIBSON | X1411: SAGE | Z1411: CLARKE
A1412: BENDIGO | C1412: BROWN 2 | F1412: GATHERCOLE 2 | J1412: DIXON | L1412: HYLAND | N1412: ELLIOTT | Q1412: ELSUM | S1412: SCHMIDT | V1412: WALSH
A1414: ROUND 20 | D1414: 25TH AUGUST | J1414: WEATHER
D1415: 1ST QTR | H1415: 2ND QTR | L1415: 3RD QTR | P1415: FINAL | S1415: Venue: OPTUS OVAL
A1416: CARLTON | C1416: 6 | D1416: 3 | E1416: =(C1416*6)+D1416 -> 39 | G1416: 8 | H1416: 10 | I1416: =(G1416*6)+H1416 -> 58 | K1416: 13 | L1416: 12 | M1416: =(K1416*6)+L1416 -> 90 | O1416: 14 | P1416: 18 | Q1416: =(O1416*6)+P1416 -> 102 | S1416: UMPIRES | Y1416: LADDER | AB1416: ROUND | AD1416: 20
A1417: WILLIAMSTOWN | C1417: 1 | D1417: 3 | E1417: =(C1417*6)+D1417 -> 9 | G1417: 3 | H1417: 5 | I1417: =(G1417*6)+H1417 -> 23 | K1417: 5 | L1417: 8 | M1417: =(K1417*6)+L1417 -> 38 | O1417: 8 | P1417: 13 | Q1417: =(O1417*6)+P1417 -> 61
A1418: BEST PLAYERS | W1418: TEAM | X1418: W | Y1418: L | Z1418: D | AA1418: FOR | AB1418: AGST | AC1418: % | AD1418: PTS
A1419: CARLTON | C1419: DOERING | F1419: CRANAGE | I1419: CHRISTOU | L1419: CAMPBELL | O1419: BEASY | Q1419: CLARK
A1420: WILLIAMSTOWN | C1420: UKOVIC | F1420: WEST | I1420: SHEEHAN | W1420: WERRIBEE | X1420: 18 | Y1420: 2 | Z1420: 0 | AA1420: 2357 | AB1420: 1360 | AC1420: =(AA1420/AB1420)*100 -> 173.30882352941177 | AD1420: =(X1420*4)+(Z1420*2) -> 72
A1421: GOALKICKERS | O1421: CAMPBELL | Q1421: BEASY | S1421: CLARK | W1421: BOX HILL | X1421: 15 | Y1421: 5 | Z1421: 0 | AA1421: 2240 | AB1421: 1521 | AC1421: =(AA1421/AB1421)*100 -> 147.27153188691651 | AD1421: =(X1421*4)+(Z1421*2) -> 60
A1422: CARLTON | C1422: WIGGINS 2 | E1422: FLEMING 2 | G1422: BACKWELL | I1422: MASSIE | K1422: NELSON | M1422: CRANAGE | O1422: MERRINGTON | R1422: RICE | T1422: WHITE | W1422: SPRINGVALE | X1422: 13 | Y1422: 7 | Z1422: 0 | AA1422: 1921 | AB1422: 1735 | AC1422: =(AA1422/AB1422)*100 -> 110.72046109510087 | AD1422: =(X1422*4)+(Z1422*2) -> 52
A1423: WILLIAMSTOWN | C1423: BETHERAS 2 | F1423: TUCKEY 2 | I1423: CLOKE | K1423: HILL | M1423: UKOVIC | O1423: DE ANGELIS | W1423: MURRAY KANGAROOS | X1423: 13 | Y1423: 7 | Z1423: 0 | AA1423: 1997 | AB1423: 1854 | AC1423: =(AA1423/AB1423)*100 -> 107.71305285868394 | AD1423: =(X1423*4)+(Z1423*2) -> 52
W1424: CARLTON | X1424: 12 | Y1424: 8 | Z1424: 0 | AA1424: 1844 | AB1424: 1553 | AC1424: =(AA1424/AB1424)*100 -> 118.73792659368962 | AD1424: =(X1424*4)+(Z1424*2) -> 48
A1425: BOX HILL | C1425: 5 | D1425: 6 | E1425: =(C1425*6)+D1425 -> 36 | G1425: 11 | H1425: 10 | I1425: =(G1425*6)+H1425 -> 76 | K1425: 15 | L1425: 13 | M1425: =(K1425*6)+L1425 -> 103 | O1425: 25 | P1425: 15 | Q1425: =(O1425*6)+P1425 -> 165 | S1425: Venue: YORK PARK (Launceston) | W1425: COBURG | X1425: 12 | Y1425: 8 | Z1425: 0 | AA1425: 1864 | AB1425: 1784 | AC1425: =(AA1425/AB1425)*100 -> 104.48430493273541 | AD1425: =(X1425*4)+(Z1425*2) -> 48
A1426: TASMANIA | C1426: 1 | D1426: 0 | E1426: =(C1426*6)+D1426 -> 6 | G1426: 3 | H1426: 1 | I1426: =(G1426*6)+H1426 -> 19 | K1426: 8 | L1426: 1 | M1426: =(K1426*6)+L1426 -> 49 | O1426: 10 | P1426: 2 | Q1426: =(O1426*6)+P1426 -> 62 | W1426: FRANKSTON | X1426: 12 | Y1426: 8 | Z1426: 0 | AA1426: 1789 | AB1426: 1730 | AC1426: =(AA1426/AB1426)*100 -> 103.41040462427746 | AD1426: =(X1426*4)+(Z1426*2) -> 48
A1427: BEST PLAYERS | W1427: ESSENDON | X1427: 11 | Y1427: 9 | Z1427: 0 | AA1427: 1797 | AB1427: 1893 | AC1427: =(AA1427/AB1427)*100 -> 94.928684627575279 | AD1427: =(X1427*4)+(Z1427*2) -> 44
A1428: BOX HILL | C1428: HAZELL | F1428: BREWER | I1428: RIES | L1428: NICHOLLS | O1428: MITCHELL | R1428: PASSADOR
A1429: TASMANIA | C1429: BOLTON | F1429: HOWARD | I1429: TAYLOR | L1429: WALKER | O1429: THURLEY | R1429: DAVIS | W1429: WILLIAMSTOWN | X1429: 10 | Y1429: 10 | Z1429: 0 | AA1429: 1908 | AB1429: 1882 | AC1429: =(AA1429/AB1429)*100 -> 101.38150903294367 | AD1429: =(X1429*4)+(Z1429*2) -> 40
A1430: GOALKICKERS | J1430: HABERFIELD 2 | M1430: MITCHELL | P1430: BALL | R1430: GEORGIADIS | W1430: SANDRINGHAM | X1430: 9 | Y1430: 11 | Z1430: 0 | AA1430: 1770 | AB1430: 1679 | AC1430: =(AA1430/AB1430)*100 -> 105.41989279332937 | AD1430: =(X1430*4)+(Z1430*2) -> 36
A1431: BOX HILL | C1431: PASSADOR 6 | F1431: HAZELL 4 | I1431: BREBNER 3 | L1431: NICHOLLS 3 | N1431: PUGSLEY 2 | Q1431: O'FARRELL 2 | W1431: PORT MELBOURNE | X1431: 9 | Y1431: 11 | Z1431: 0 | AA1431: 1859 | AB1431: 1891 | AC1431: =(AA1431/AB1431)*100 -> 98.307773664727662 | AD1431: =(X1431*4)+(Z1431*2) -> 36
A1432: TASMANIA | C1432: TREVENA 2 | F1432: BLIGHT 2 | I1432: THURLEY | K1432: MILLAR | M1432: WALKER | O1432: BOWRING | Q1432: ALLEN | S1432: CARTER | W1432: GEELONG | X1432: 7 | Y1432: 13 | Z1432: 0 | AA1432: 1617 | AB1432: 1718 | AC1432: =(AA1432/AB1432)*100 -> 94.121071012805587 | AD1432: =(X1432*4)+(Z1432*2) -> 28
W1433: NORTH BALLARAT | X1433: 7 | Y1433: 13 | Z1433: 0 | AA1433: 1432 | AB1433: 1858 | AC1433: =(AA1433/AB1433)*100 -> 77.072120559741649 | AD1433: =(X1433*4)+(Z1433*2) -> 28
A1434: SANDRINGHAM | C1434: 4 | D1434: 4 | E1434: =(C1434*6)+D1434 -> 28 | G1434: 8 | H1434: 9 | I1434: =(G1434*6)+H1434 -> 57 | K1434: 10 | L1434: 14 | M1434: =(K1434*6)+L1434 -> 74 | O1434: 15 | P1434: 16 | Q1434: =(O1434*6)+P1434 -> 106 | S1434: Venue: BEACH ROAD | W1434: NORTHERN BULLANTS | X1434: 6 | Y1434: 14 | Z1434: 0 | AA1434: 1805 | AB1434: 1806 | AC1434: =(AA1434/AB1434)*100 -> 99.944629014396455 | AD1434: =(X1434*4)+(Z1434*2) -> 24
A1435: BENDIGO | C1435: 2 | D1435: 4 | E1435: =(C1435*6)+D1435 -> 16 | G1435: 2 | H1435: 6 | I1435: =(G1435*6)+H1435 -> 18 | K1435: 5 | L1435: 9 | M1435: =(K1435*6)+L1435 -> 39 | O1435: 7 | P1435: 9 | Q1435: =(O1435*6)+P1435 -> 51 | W1435: TASMANIA | X1435: 5 | Y1435: 15 | Z1435: 0 | AA1435: 1458 | AB1435: 2180 | AC1435: =(AA1435/AB1435)*100 -> 66.88073394495413 | AD1435: =(X1435*4)+(Z1435*2) -> 20
A1436: BEST PLAYERS | W1436: BENDIGO | X1436: 0 | Y1436: 20 | Z1436: 0 | AA1436: 1318 | AB1436: 2625 | AC1436: =(AA1436/AB1436)*100 -> 50.209523809523816 | AD1436: =(X1436*4)+(Z1436*2) -> 0
A1437: SANDRINGHAM | C1437: WHELAN | F1437: HAYNES | I1437: CLARK | L1437: THOMPSON | O1437: MCKELLAR | R1437: COGHLAN
A1438: BENDIGO | C1438: GEDDES | F1438: CAMPBELL | I1438: GATHERCOLE | L1438: TOINTON | O1438: LOCK | R1438: BROWN
A1439: GOALKICKERS
A1440: SANDRINGHAM | C1440: BEAMS 3 | E1440: THOMPSON 3 | H1440: LIDDELL 2 | J1440: TEMPLETON 2 | M1440: COGHLAN 2 | P1440: LAMB | R1440: HAYNES | T1440: GRANT
A1441: BENDIGO | C1441: SCHMIDT 2 | F1441: ATKINS | I1441: BROWN | K1441: LOCK | M1441: WALSH | O1441: GATHERCOLE
A1443: SPRINGVALE | C1443: 2 | D1443: 2 | E1443: =(C1443*6)+D1443 -> 14 | G1443: 4 | H1443: 3 | I1443: =(G1443*6)+H1443 -> 27 | K1443: 12 | L1443: 4 | M1443: =(K1443*6)+L1443 -> 76 | O1443: 17 | P1443: 8 | Q1443: =(O1443*6)+P1443 -> 110 | S1443: Venue: PORT MELBOURNE
A1444: PORT MELBOURNE | C1444: 1 | D1444: 0 | E1444: =(C1444*6)+D1444 -> 6 | G1444: 3 | H1444: 2 | I1444: =(G1444*6)+H1444 -> 20 | K1444: 8 | L1444: 5 | M1444: =(K1444*6)+L1444 -> 53 | O1444: 13 | P1444: 8 | Q1444: =(O1444*6)+P1444 -> 86
A1445: BEST PLAYERS
A1446: SPRINGVALE | C1446: O'BRIEN | F1446: ROBBINS | I1446: DILLON | L1446: WULF | O1446: CAPUANO
A1447: PORT MELBOURNE | C1447: FOSDIKE | F1447: BENNETT | I1447: ALOI | L1447: ABLETT | O1447: FILANDIA | R1447: EVANS
A1448: GOALKICKERS
A1449: SPRINGVALE | C1449: O'BRIEN 4 | E1449: CAPUANO 2 | H1449: SMITH 2 | J1449: VOSS 2 | L1449: WALTON 2 | N1449: LOGAN | P1449: DELARUE | R1449: ROBBINS | U1449: PITT | W1449: LEWISON
A1450: PORT MELBOURNE | C1450: FEAST 3 | E1450: STEVENS 2 | H1450: PILTZ 2 | J1450: AHMAT | L1450: BUCHANAN | O1450: STAFFORD | Q1450: SPENCER | S1450: ALOI | U1450: BENNETT
A1452: COBURG | C1452: 2 | D1452: 3 | E1452: =(C1452*6)+D1452 -> 15 | G1452: 10 | H1452: 6 | I1452: =(G1452*6)+H1452 -> 66 | K1452: 16 | L1452: 7 | M1452: =(K1452*6)+L1452 -> 103 | O1452: 25 | P1452: 11 | Q1452: =(O1452*6)+P1452 -> 161 | S1452: Venue: COBURG
A1453: MURRAY KANGAROOS | C1453: 4 | D1453: 0 | E1453: =(C1453*6)+D1453 -> 24 | G1453: 5 | H1453: 0 | I1453: =(G1453*6)+H1453 -> 30 | K1453: 9 | L1453: 8 | M1453: =(K1453*6)+L1453 -> 62 | O1453: 10 | P1453: 8 | Q1453: =(O1453*6)+P1453 -> 68
A1454: BEST PLAYERS
A1455: COBURG | C1455: POYAS | F1455: DAFFY | I1455: HALL | K1455: DEPASQUALE | N1455: PAGAN | Q1455: PETTIFER
A1456: MURRAY KANGAROOS | C1456: SOFI | F1456: HILTON | I1456: HARDING | K1456: SPAULL | N1456: LASSCOCK
A1457: GOALKICKERS
A1458: COBURG | C1458: PETTIFER 6 | F1458: POYAS 5 | I1458: JAMES 4 | K1458: DAFFY 2 | M1458: KRAKOUER 2 | P1458: HAYNES 2 | S1458: HALL | U1458: HYDE | W1458: STEINFORT | X1458: LAPPIN
A1459: MURRAY KANGAROOS | C1459: HARDING 4 | F1459: LOWCOCK 2 | I1459: MORRELL | L1459: STEVENS | N1459: TRENFIELD | Q1459: COCHRANE
D1460: 26TH AUGUST | J1460: WEATHER
A1461: NORTHERN BULLANTS | C1461: 3 | D1461: 4 | E1461: =(C1461*6)+D1461 -> 22 | G1461: 10 | H1461: 7 | I1461: =(G1461*6)+H1461 -> 67 | K1461: 15 | L1461: 12 | M1461: =(K1461*6)+L1461 -> 102 | O1461: 22 | P1461: 12 | Q1461: =(O1461*6)+P1461 -> 144 | S1461: Venue: SHELL STADIUM (C/R)
A1462: GEELONG | C1462: 1 | D1462: 2 | E1462: =(C1462*6)+D1462 -> 8 | G1462: 4 | H1462: 4 | I1462: =(G1462*6)+H1462 -> 28 | K1462: 5 | L1462: 5 | M1462: =(K1462*6)+L1462 -> 35 | O1462: 9 | P1462: 9 | Q1462: =(O1462*6)+P1462 -> 63
A1463: BEST PLAYERS
A1464: NORTHERN BULLANTS | C1464: WATSON | F1464: ZORZI | I1464: LEE | K1464: RAMSAY | N1464: GIBSON | Q1464: TAYLOR
A1465: GEELONG | C1465: POWELL | F1465: MENSCH | I1465: ROOKE | K1465: O'BRIEN | N1465: SINNOTT
A1466: GOALKICKERS
A1467: NORTHERN BULLANTS | C1467: WATSON 9 | F1467: GIBSON 3 | I1467: PENN 2 | K1467: ZORZI 2 | M1467: FAVRIN 2 | O1467: CARACELLA 2 | R1467: CANN | T1467: LOWTHER
A1468: GEELONG | C1468: MENSCH 2 | F1468: SPOLDING 2 | I1468: BALDWIN | K1468: BAUER | M1468: S CHAPMAN | P1468: WOOLNOUGH | S1468: HUESTON
A1470: WERRIBEE | C1470: 5 | D1470: 5 | E1470: =(C1470*6)+D1470 -> 35 | G1470: 10 | H1470: 5 | I1470: =(G1470*6)+H1470 -> 65 | K1470: 14 | L1470: 6 | M1470: =(K1470*6)+L1470 -> 90 | O1470: 18 | P1470: 11 | Q1470: =(O1470*6)+P1470 -> 119 | S1470: Venue: WERRIBEE
A1471: FRANKSTON | C1471: 1 | D1471: 4 | E1471: =(C1471*6)+D1471 -> 10 | G1471: 6 | H1471: 5 | I1471: =(G1471*6)+H1471 -> 41 | K1471: 10 | L1471: 9 | M1471: =(K1471*6)+L1471 -> 69 | O1471: 11 | P1471: 13 | Q1471: =(O1471*6)+P1471 -> 79
A1472: BEST PLAYERS
A1473: WERRIBEE | C1473: BARTLETT | F1473: FAULKNER | I1473: HARGREAVE | L1473: BIRSS | O1473: COX | Q1473: DYER
A1474: FRANKSTON | C1474: BURGMAN | F1474: ABLETT | I1474: MALLOY | L1474: GEORGIOU | O1474: FOLINO | Q1474: BEVERIDGE
A1475: GOALKICKERS
A1476: WERRIBEE | C1476: SAUNDERS 4 | F1476: GILBEE 3 | H1476: BARTLETT 3 | K1476: COX 2 | M1476: CONTESSA | P1476: ROBERTSON | S1476: McMAHON | V1476: ROBBINS | X1476: BIRSS | Z1476: BAKER
A1477: FRANKSTON | C1477: SIMISTER 3 | F1477: GEORGIOU 3 | I1477: SAUTNER 2 | L1477: BEVERIDGE | N1477: McCORMACK | Q1477: ABLETT
A1479: ESSENDON | C1479: 1 | D1479: 2 | E1479: =(C1479*6)+D1479 -> 8 | G1479: 5 | H1479: 4 | I1479: =(G1479*6)+H1479 -> 34 | K1479: 7 | L1479: 5 | M1479: =(K1479*6)+L1479 -> 47 | O1479: 9 | P1479: 9 | Q1479: =(O1479*6)+P1479 -> 63 | S1479: Venue: NORTH BALLARAT
A1480: NORTH BALLARAT | C1480: 2 | D1480: 4 | E1480: =(C1480*6)+D1480 -> 16 | G1480: 3 | H1480: 6 | I1480: =(G1480*6)+H1480 -> 24 | K1480: 4 | L1480: 14 | M1480: =(K1480*6)+L1480 -> 38 | O1480: 6 | P1480: 16 | Q1480: =(O1480*6)+P1480 -> 52
A1481: BEST PLAYERS
A1482: ESSENDON | C1482: BLUMFIELD | F1482: BOLTON | I1482: DENHAM | L1482: DAVIS
A1483: NORTH BALLARAT | C1483: J POLKINGHORNE | G1483: JURICA | I1483: SOMERVILLE | L1483: FREELAND | O1483: HUTCHINSON | R1483: CLAYTON
A1484: GOALKICKERS
A1485: ESSENDON | C1485: BLUMFIELD 3 | F1485: MAHONEY 2 | I1485: McALISTER | L1485: BULLEN | N1485: DAVIES | P1485: HILLE
A1486: NORTH BALLARAT | C1486: JURICA | E1486: COLLARD | G1486: HUTCHINSON | J1486: FRITH | L1486: MAXWELL | N1486: O'KEEFE
A1488: FINALS
A1489: ELIMINATION FINAL | F1489: 2ND SEPTEMBER | J1489: WEATHER
D1490: 1ST QTR | H1490: 2ND QTR | L1490: 3RD QTR | P1490: FINAL | S1490: Venue: PORT MELBOURNE
A1491: CARLTON | C1491: 4 | D1491: 2 | E1491: =(C1491*6)+D1491 -> 26 | G1491: 6 | H1491: 8 | I1491: =(G1491*6)+H1491 -> 44 | K1491: 9 | L1491: 11 | M1491: =(K1491*6)+L1491 -> 65 | O1491: 12 | P1491: 16 | Q1491: =(O1491*6)+P1491 -> 88 | S1491: UMPIRES
A1492: ESSENDON | C1492: 3 | D1492: 2 | E1492: =(C1492*6)+D1492 -> 20 | G1492: 6 | H1492: 4 | I1492: =(G1492*6)+H1492 -> 40 | K1492: 9 | L1492: 9 | M1492: =(K1492*6)+L1492 -> 63 | O1492: 11 | P1492: 10 | Q1492: =(O1492*6)+P1492 -> 76
A1493: BEST PLAYERS
A1494: CARLTON | C1494: MASSIE | F1494: SPORN | I1494: MERRINGTON | L1494: RICE | N1494: CRANAGE
A1495: ESSENDON | C1495: HILLE | F1495: LALICH | I1495: DAVIS | L1495: McALISTER | N1495: RICHARDS
A1496: GOALKICKERS
A1497: CARLTON | C1497: MERRINGTON 2 | F1497: WHITE 2 | I1497: SPORN 2 | K1497: FLEMING 2 | N1497: BEASY 2 | Q1497: SINNOTT | S1497: WATSON
A1498: ESSENDON | C1498: HILLE 3 | F1498: MAHONEY 2 | I1498: HAWKINS 2 | L1498: GODDARD | N1498: BULLEN | P1498: RICHARDS | R1498: DENHAM
A1500: ELIMINATION FINAL
A1501: FRANKSTON | C1501: 2 | D1501: 1 | E1501: =(C1501*6)+D1501 -> 13 | G1501: 6 | H1501: 3 | I1501: =(G1501*6)+H1501 -> 39 | K1501: 11 | L1501: 9 | M1501: =(K1501*6)+L1501 -> 75 | O1501: 12 | P1501: 12 | Q1501: =(O1501*6)+P1501 -> 84 | S1501: Venue: BEACH ROAD
A1502: COBURG | C1502: 3 | D1502: 3 | E1502: =(C1502*6)+D1502 -> 21 | G1502: 5 | H1502: 3 | I1502: =(G1502*6)+H1502 -> 33 | K1502: 7 | L1502: 7 | M1502: =(K1502*6)+L1502 -> 49 | O1502: 10 | P1502: 12 | Q1502: =(O1502*6)+P1502 -> 72
A1503: BEST PLAYERS
A1504: FRANKSTON | C1504: BEVERIDGE | F1504: LITTLE | I1504: BURGMAN | L1504: ABLETT | N1504: SIMISTER
A1505: COBURG | C1505: STEINFORT | F1505: LAPPIN | I1505: DEPASQUALE | L1505: DAFFY | N1505: McLEOD | Q1505: PETTIFER
A1506: GOALKICKERS
A1507: FRANKSTON | C1507: SIMISTER 4 | F1507: FOLINO 2 | I1507: SAUTNER 2 | L1507: MALLOY | N1507: ANDERSON | Q1507: BEVERIDGE | T1507: FRATER
A1508: COBURG | C1508: HAYNES 4 | F1508: KRAKOUER | I1508: EDNIE | K1508: BOURKE | M1508: DAFFY | O1508: PETTIFER | Q1508: JAMES
A1510: QUALIFYING FINAL | F1510: 1ST SEPTEMBER | J1510: WEATHER
A1511: WERRIBEE | C1511: 4 | D1511: 3 | E1511: =(C1511*6)+D1511 -> 27 | G1511: 12 | H1511: 7 | I1511: =(G1511*6)+H1511 -> 79 | K1511: 16 | L1511: 14 | M1511: =(K1511*6)+L1511 -> 110 | O1511: 17 | P1511: 21 | Q1511: =(O1511*6)+P1511 -> 123 | S1511: Venue: WERRIBEE
A1512: MURRAY KANGAROOS | C1512: 2 | D1512: 3 | E1512: =(C1512*6)+D1512 -> 15 | G1512: 3 | H1512: 7 | I1512: =(G1512*6)+H1512 -> 25 | K1512: 6 | L1512: 8 | M1512: =(K1512*6)+L1512 -> 44 | O1512: 8 | P1512: 12 | Q1512: =(O1512*6)+P1512 -> 60
A1513: BEST PLAYERS
A1514: WERRIBEE | C1514: CHURCHILL | F1514: PULI | I1514: TAYLOR | L1514: BOWDEN | O1514: JACK | Q1514: GILBEE
A1515: MURRAY KANGAROOS | C1515: JONES | F1515: LASSCOCK | I1515: PRATT | L1515: WHITE | O1515: MORRELL | Q1515: STEVENS
A1516: GOALKICKERS
A1517: WERRIBEE | C1517: JACK 3 | E1517: GILBEE 3 | G1517: MITCHELL 2 | J1517: CHURCHILL 2 | M1517: FROST | O1517: LAMB | Q1517: SAUNDERS | T1517: SUTTON | V1517: BARTLETT | X1517: ROBERTSON | AA1517: TAYLOR
A1518: MURRAY KANGAROOS | C1518: HARDING 2 | F1518: COOPER 2 | I1518: JONES | K1518: SMITH | M1518: CORCORAN | P1518: PORTER
A1520: BOX HILL | C1520: 3 | D1520: 3 | E1520: =(C1520*6)+D1520 -> 21 | G1520: 4 | H1520: 5 | I1520: =(G1520*6)+H1520 -> 29 | K1520: 7 | L1520: 7 | M1520: =(K1520*6)+L1520 -> 49 | O1520: 10 | P1520: 11 | Q1520: =(O1520*6)+P1520 -> 71 | S1520: Venue: PORT MELBOURNE
A1521: SPRINGVALE | C1521: 3 | D1521: 2 | E1521: =(C1521*6)+D1521 -> 20 | G1521: 5 | H1521: 5 | I1521: =(G1521*6)+H1521 -> 35 | K1521: 7 | L1521: 8 | M1521: =(K1521*6)+L1521 -> 50 | O1521: 8 | P1521: 9 | Q1521: =(O1521*6)+P1521 -> 57
A1522: BEST PLAYERS
A1523: BOX HILL | C1523: RIES | F1523: BREWER | I1523: BAIRD | L1523: BANKS | O1523: MITCHELL | R1523: HOLLAND
A1524: SPRINGVALE | C1524: DILLON | F1524: WALTON | I1524: CARMODY | L1524: ELLIOTT
A1525: GOALKICKERS
A1526: BOX HILL | C1526: HOLLAND 4 | F1526: MITCHELL 2 | I1526: BREBNER | K1526: GEORGIADIS | N1526: NICHOLLS | Q1526: WATTS
A1527: SPRINGVALE | C1527: CARMODY 3 | F1527: PITT | H1527: LOGAN | J1527: TAYLOR | L1527: RYAN | N1527: SMITH
A1529: 1ST SEMI-FINAL | F1529: 8TH SEPTEMBER | J1529: WEATHER
A1530: MURRAY KANGAROOS | C1530: 4 | D1530: 4 | E1530: =(C1530*6)+D1530 -> 28 | G1530: 8 | H1530: 6 | I1530: =(G1530*6)+H1530 -> 54 | K1530: 12 | L1530: 8 | M1530: =(K1530*6)+L1530 -> 80 | O1530: 16 | P1530: 12 | Q1530: =(O1530*6)+P1530 -> 108 | S1530: Venue: PORT MELBOURNE
A1531: CARLTON | C1531: 2 | D1531: 2 | E1531: =(C1531*6)+D1531 -> 14 | G1531: 6 | H1531: 5 | I1531: =(G1531*6)+H1531 -> 41 | K1531: 9 | L1531: 8 | M1531: =(K1531*6)+L1531 -> 62 | O1531: 13 | P1531: 11 | Q1531: =(O1531*6)+P1531 -> 89
A1532: BEST PLAYERS
A1533: MURRAY KANGAROOS | C1533: TEAGUE | F1533: MOTLOP | I1533: PRATT | L1533: McLAREN | O1533: D SMITH | R1533: SPAULL
A1534: CARLTON | C1534: CULPITT | F1534: WIGGINS | I1534: BACKWELL | L1534: DOERING | O1534: FLEMING
A1535: GOALKICKERS
A1536: MURRAY KANGAROOS | C1536: COOPER 4 | F1536: HARDING 3 | I1536: MOTLOP 2 | L1536: L SMITH | N1536: D SMITH | P1536: PRATT | R1536: SOFI | T1536: LANGE | V1536: LASSCOCK | X1536: McLAREN
A1537: CARLTON | C1537: WHITE 3 | F1537: BACKWELL | I1537: MASSIE | K1537: NELSON | M1537: CRANAGE | O1537: O'KEEFE | Q1537: CULPITT | S1537: SPORN | U1537: CLARK | W1537: SINNOTT | Y1537: PICKFORD
A1539: 2ND SEMI-FINAL | F1539: 9TH SEPTEMBER | J1539: WEATHER
A1540: SPRINGVALE | C1540: 5 | D1540: 0 | E1540: =(C1540*6)+D1540 -> 30 | G1540: 6 | H1540: 7 | I1540: =(G1540*6)+H1540 -> 43 | K1540: 13 | L1540: 11 | M1540: =(K1540*6)+L1540 -> 89 | O1540: 16 | P1540: 12 | Q1540: =(O1540*6)+P1540 -> 108 | S1540: Venue: PORT MELBOURNE
A1541: FRANKSTON | C1541: 3 | D1541: 4 | E1541: =(C1541*6)+D1541 -> 22 | G1541: 6 | H1541: 10 | I1541: =(G1541*6)+H1541 -> 46 | K1541: 8 | L1541: 10 | M1541: =(K1541*6)+L1541 -> 58 | O1541: 9 | P1541: 16 | Q1541: =(O1541*6)+P1541 -> 70
A1542: BEST PLAYERS
A1543: SPRINGVALE | C1543: KNOWLES | F1543: ELLIOTT | I1543: RIGG | L1543: TROLLOPE
A1544: FRANKSTON | C1544: MALLOY | F1544: ABLETT | I1544: FRATER | L1544: SIMISTER | O1544: FOLINO
A1545: GOALKICKERS
A1546: SPRINGVALE | C1546: WALTON 4 | F1546: SMITH 4 | I1546: KNOWLES 3 | L1546: PITT | N1546: WULF | P1546: ROBBINS | R1546: LOGAN | T1546: YOUNG
A1547: FRANKSTON | C1547: SAUTNER 2 | F1547: SIMISTER 2 | I1547: ANDERSON 2 | L1547: WINTERTON | N1547: FORTNAM | Q1547: MATTHEWS
A1549: PRELIMINARY FINAL | G1549: 15TH SEPTEMBER | J1549: WEATHER
A1550: BOX HILL | C1550: 2 | D1550: 5 | E1550: =(C1550*6)+D1550 -> 17 | G1550: 5 | H1550: 8 | I1550: =(G1550*6)+H1550 -> 38 | K1550: 12 | L1550: 10 | M1550: =(K1550*6)+L1550 -> 82 | O1550: 14 | P1550: 12 | Q1550: =(O1550*6)+P1550 -> 96 | S1550: Venue: PORT MELBOURNE
A1551: MURRAY KANGAROOS | C1551: 4 | D1551: 2 | E1551: =(C1551*6)+D1551 -> 26 | G1551: 5 | H1551: 6 | I1551: =(G1551*6)+H1551 -> 36 | K1551: 9 | L1551: 10 | M1551: =(K1551*6)+L1551 -> 64 | O1551: 12 | P1551: 12 | Q1551: =(O1551*6)+P1551 -> 84
A1552: BEST PLAYERS
A1553: BOX HILL | C1553: OSBORNE | F1553: MITCHELL | I1553: ROCK | L1553: BAIRD | O1553: OBST
A1554: MURRAY KANGAROOS | C1554: MOTLOP | F1554: JONES | I1554: SOFI | L1554: D SMITH | O1554: LANGE | R1554: PRATT
A1555: GOALKICKERS
A1556: BOX HILL | C1556: PASSADOR 3 | F1556: PUGSLEY 3 | I1556: MITCHELL 3 | L1556: JOHNSON | N1556: GEORGIADIS | Q1556: WILLIAMS | T1556: O'FARRELL | W1556: BALL
A1557: MURRAY KANGAROOS | C1557: LANGE 4 | F1557: LOWCOCK 2 | I1557: HARDING 2 | L1557: JONES 2 | N1557: L SMITH | Q1557: HARRIS
A1559: PRELIMINARY FINAL | G1559: 16TH SEPTEMBER | J1559: WEATHER
A1560: WERRIBEE | C1560: 4 | D1560: 4 | E1560: =(C1560*6)+D1560 -> 28 | G1560: 10 | H1560: 11 | I1560: =(G1560*6)+H1560 -> 71 | K1560: 13 | L1560: 14 | M1560: =(K1560*6)+L1560 -> 92 | O1560: 18 | P1560: 15 | Q1560: =(O1560*6)+P1560 -> 123 | S1560: Venue: PORT MELBOURNE
A1561: SPRINGVALE | C1561: 5 | D1561: 4 | E1561: =(C1561*6)+D1561 -> 34 | G1561: 9 | H1561: 10 | I1561: =(G1561*6)+H1561 -> 64 | K1561: 12 | L1561: 14 | M1561: =(K1561*6)+L1561 -> 86 | O1561: 14 | P1561: 17 | Q1561: =(O1561*6)+P1561 -> 101
A1562: BEST PLAYERS
A1563: WERRIBEE | C1563: FAULKNER | F1563: BARTLETT | I1563: BIRSS | L1563: GIANSIRACUSA | P1563: ALVEY | R1563: MITCHELL
A1564: SPRINGVALE | C1564: ELLIOTT | F1564: ROBBINS | I1564: BLAKE | L1564: O'BRIEN | P1564: WALTON | R1564: YOUNG
A1565: GOALKICKERS
A1566: WERRIBEE | C1566: MITCHELL 4 | F1566: BOWDEN 3 | I1566: BARTLETT 3 | L1566: GIANSIRCUSA 2 | O1566: ALVEY 2 | Q1566: CHURCHILL | T1566: SAUNDERS | W1566: GILBEE | X1566: FULLER
A1567: SPRINGVALE | C1567: PITT 3 | E1567: ROBBINS 2 | H1567: SMITH 2 | J1567: WALTON 2 | M1567: YOUNG 2 | O1567: CARMODY | R1567: O'BRIEN | U1567: BLAKE
A1569: GRAND FINAL | D1569: 23RD SEPTEMBER | J1569: WEATHER
A1570: BOX HILL | C1570: 6 | D1570: 4 | E1570: =(C1570*6)+D1570 -> 40 | G1570: 10 | H1570: 7 | I1570: =(G1570*6)+H1570 -> 67 | K1570: 11 | L1570: 10 | M1570: =(K1570*6)+L1570 -> 76 | O1570: 13 | P1570: 13 | Q1570: =(O1570*6)+P1570 -> 91 | S1570: Venue: OPTUS OVAL
A1571: WERRIBEE | C1571: 3 | D1571: 3 | E1571: =(C1571*6)+D1571 -> 21 | G1571: 4 | H1571: 5 | I1571: =(G1571*6)+H1571 -> 29 | K1571: 6 | L1571: 6 | M1571: =(K1571*6)+L1571 -> 42 | O1571: 7 | P1571: 12 | Q1571: =(O1571*6)+P1571 -> 54
A1572: BEST PLAYERS
A1573: BOX HILL | C1573: BAIRD | F1573: MITCHELL | I1573: DENT | L1573: RIES | N1573: BALL | Q1573: PICIAONE
A1574: WERRIBEE | C1574: BARTLETT | F1574: MITCHELL | I1574: GIANSIRACUSA | L1574: ALVEY | N1574: GILBEE
A1575: GOALKICKERS
A1576: BOX HILL | C1576: O'FARRELL 3 | F1576: PASSADOR 3 | I1576: ROCK 2 | K1576: PUGSLEY 2 | N1576: LORD | P1576: PICIAONE | R1576: RIES
A1577: WERRIBEE | C1577: MITCHELL 3 | F1577: CONTESSA | I1577: CHURCHILL | L1577: BOWDEN | N1577: McMAHON