A1: Victorian Football League
A2: Season 2002
A3: © Copyright Wal Williams | F3: First created: 4 September 2016
A4: Contact: joywalwi at gmail dot com | F4: Last updated: 13 October 2016 | W4: VFA Results and tables - Link to the main index page
A5: You are free to copy this document in whole or part provided that proper acknowledgement is given to the author. All rights reserved.
A7: 2002 SEASON
A8: ROUND 1 | D8: 5TH APRIL | G8: NIGHT MATCH | J8: WEATHER
D9: 1ST QTR | H9: 2ND QTR | L9: 3RD QTR | P9: FINAL | S9: Venue: YORK PARK (Launceston)
A10: GEELONG | C10: 1 | D10: 3 | E10: =(C10*6)+D10 -> 9 | G10: 6 | H10: 8 | I10: =(G10*6)+H10 -> 44 | K10: 10 | L10: 13 | M10: =(K10*6)+L10 -> 73 | O10: 12 | P10: 15 | Q10: =(O10*6)+P10 -> 87 | S10: UMPIRES | Y10: LADDER | AB10: ROUND | AD10: 1
A11: TASMANIA | C11: 3 | D11: 0 | E11: =(C11*6)+D11 -> 18 | G11: 6 | H11: 0 | I11: =(G11*6)+H11 -> 36 | K11: 10 | L11: 3 | M11: =(K11*6)+L11 -> 63 | O11: 12 | P11: 4 | Q11: =(O11*6)+P11 -> 76
A12: BEST PLAYERS | W12: TEAM | X12: W | Y12: L | Z12: D | AA12: FOR | AB12: AGST | AC12: % | AD12: PTS
A13: GEELONG | C13: BRIGHT | F13: CHAPMAN | I13: JOHNSON | L13: POWELL | O13: SLADE | R13: TREVASKIS
A14: TASMANIA | C14: CALLINAN | F14: ATKIN | I14: HOWARD | L14: RONALDSON | O14: HEATLEY | W14: PORT MELBOURNE | X14: 1 | Y14: 0 | Z14: 0 | AA14: 96 | AB14: 42 | AC14: =(AA14/AB14)*100 -> 228.57142857142856 | AD14: =(X14*4)+(Z14*2) -> 4
A15: GOALKICKERS | W15: BOX HILL | X15: 1 | Y15: 0 | Z15: 0 | AA15: 154 | AB15: 84 | AC15: =(AA15/AB15)*100 -> 183.33333333333331 | AD15: =(X15*4)+(Z15*2) -> 4
A16: GEELONG | C16: BRIGHT 3 | F16: JOHNSON 3 | I16: HUNT | K16: KELLY | M16: KNUCKEY | O16: McCARTHY | Q16: O'BRIEN | S16: PLAYFAIR | W16: MURRAY KANGAROOS | X16: 1 | Y16: 0 | Z16: 0 | AA16: 139 | AB16: 79 | AC16: =(AA16/AB16)*100 -> 175.9493670886076 | AD16: =(X16*4)+(Z16*2) -> 4
A17: TASMANIA | C17: CALLINAN 5 | F17: HEATLEY 4 | I17: BEAMS 2 | K17: WAGER | W17: SANDRINGHAM | X17: 1 | Y17: 0 | Z17: 0 | AA17: 132 | AB17: 82 | AC17: =(AA17/AB17)*100 -> 160.97560975609758 | AD17: =(X17*4)+(Z17*2) -> 4
D18: 6TH APRIL | J18: WEATHER | W18: SPRINGVALE | X18: 1 | Y18: 0 | Z18: 0 | AA18: 140 | AB18: 98 | AC18: =(AA18/AB18)*100 -> 142.85714285714286 | AD18: =(X18*4)+(Z18*2) -> 4
A19: PORT MELBOURNE | C19: 3 | D19: 3 | E19: =(C19*6)+D19 -> 21 | G19: 4 | H19: 9 | I19: =(G19*6)+H19 -> 33 | K19: 10 | L19: 13 | M19: =(K19*6)+L19 -> 73 | O19: 13 | P19: 18 | Q19: =(O19*6)+P19 -> 96 | S19: Venue: OPTUS OVAL (C/R) | W19: WILLIAMSTOWN | X19: 1 | Y19: 0 | Z19: 0 | AA19: 114 | AB19: 80 | AC19: =(AA19/AB19)*100 -> 142.5 | AD19: =(X19*4)+(Z19*2) -> 4
A20: CARLTON | C20: 0 | D20: 2 | E20: =(C20*6)+D20 -> 2 | G20: 2 | H20: 4 | I20: =(G20*6)+H20 -> 16 | K20: 3 | L20: 5 | M20: =(K20*6)+L20 -> 23 | O20: 6 | P20: 6 | Q20: =(O20*6)+P20 -> 42 | W20: COBURG | X20: 1 | Y20: 0 | Z20: 0 | AA20: 123 | AB20: 94 | AC20: =(AA20/AB20)*100 -> 130.85106382978725 | AD20: =(X20*4)+(Z20*2) -> 4
A21: BEST PLAYERS | W21: GEELONG | X21: 1 | Y21: 0 | Z21: 0 | AA21: 87 | AB21: 76 | AC21: =(AA21/AB21)*100 -> 114.4736842105263 | AD21: =(X21*4)+(Z21*2) -> 4
A22: PORT MELBOURNE | C22: DOYLE | F22: ABLETT | I22: ANSTEY | L22: BUCHANAN
A23: CARLTON | C23: LIVINGSTONE | F23: FLEMING | I23: THORNTON | L23: DAVIES | W23: TASMANIA | X23: 0 | Y23: 1 | Z23: 0 | AA23: 76 | AB23: 87 | AC23: =(AA23/AB23)*100 -> 87.356321839080465 | AD23: =(X23*4)+(Z23*2) -> 0
A24: GOALKICKERS | W24: ESSENDON | X24: 0 | Y24: 1 | Z24: 0 | AA24: 94 | AB24: 123 | AC24: =(AA24/AB24)*100 -> 76.422764227642276 | AD24: =(X24*4)+(Z24*2) -> 0
A25: PORT MELBOURNE | C25: GILL 4 | E25: DOYLE 3 | G25: EVANS | I25: POWER | K25: SWAN | M25: R ABLETT | P25: L ABLETT | R25: BUCHANAN | W25: NORTH BALLARAT | X25: 0 | Y25: 1 | Z25: 0 | AA25: 80 | AB25: 114 | AC25: =(AA25/AB25)*100 -> 70.175438596491219 | AD25: =(X25*4)+(Z25*2) -> 0
A26: CARLTON | C26: SMITH | E26: WAITE | G26: FLEMING | I26: DOERING | K26: JANSEN | M26: ROSA | W26: BENDIGO | X26: 0 | Y26: 1 | Z26: 0 | AA26: 98 | AB26: 140 | AC26: =(AA26/AB26)*100 -> 70 | AD26: =(X26*4)+(Z26*2) -> 0
W27: FRANKSTON | X27: 0 | Y27: 1 | Z27: 0 | AA27: 82 | AB27: 132 | AC27: =(AA27/AB27)*100 -> 62.121212121212125 | AD27: =(X27*4)+(Z27*2) -> 0
A28: SPRINGVALE | C28: 4 | D28: 3 | E28: =(C28*6)+D28 -> 27 | G28: 10 | H28: 6 | I28: =(G28*6)+H28 -> 66 | K28: 16 | L28: 7 | M28: =(K28*6)+L28 -> 103 | O28: 21 | P28: 14 | Q28: =(O28*6)+P28 -> 140 | S28: Venue: BENDIGO | W28: WERRIBEE | X28: 0 | Y28: 1 | Z28: 0 | AA28: 79 | AB28: 139 | AC28: =(AA28/AB28)*100 -> 56.834532374100718 | AD28: =(X28*4)+(Z28*2) -> 0
A29: BENDIGO | C29: 5 | D29: 3 | E29: =(C29*6)+D29 -> 33 | G29: 11 | H29: 6 | I29: =(G29*6)+H29 -> 72 | K29: 13 | L29: 8 | M29: =(K29*6)+L29 -> 86 | O29: 15 | P29: 8 | Q29: =(O29*6)+P29 -> 98 | W29: NORTHERN BULLANTS | X29: 0 | Y29: 1 | Z29: 0 | AA29: 84 | AB29: 154 | AC29: =(AA29/AB29)*100 -> 54.54545454545454 | AD29: =(X29*4)+(Z29*2) -> 0
A30: BEST PLAYERS | W30: CARLTON | X30: 0 | Y30: 1 | Z30: 0 | AA30: 42 | AB30: 96 | AC30: =(AA30/AB30)*100 -> 43.75 | AD30: =(X30*4)+(Z30*2) -> 0
A31: SPRINGVALE | C31: TROLLOPE | F31: D CARROLL | I31: CRANSTON | L31: BEETHAM | O31: MONTAGNA | R31: CAPLES
A32: BENDIGO | C32: CARTER | F32: BRADLEY | I32: ELSUM | L32: BOWEN | O32: DOHERTY
A33: GOALKICKERS | L33: CLARKE | N33: DEHAY | P33: DILLON | R33: B SCHWARZE
A34: SPRINGVALE | C34: CARMODY 5 | F34: MONTAGNA 4 | I34: PITT 3 | K34: OLIVER 2 | M34: TROLLOPE | P34: HOULIHAN | R34: DALSANTO
A35: BENDIGO | C35: ELSUM 5 | E35: CARTER 2 | G35: BROWN 2 | I35: PROCTOR 2 | L35: CAMPBELL | O35: SCHMIDT | Q35: DOHERTY | T35: CAIL
A37: SANDRINGHAM | C37: 5 | D37: 2 | E37: =(C37*6)+D37 -> 32 | G37: 11 | H37: 8 | I37: =(G37*6)+H37 -> 74 | K37: 16 | L37: 9 | M37: =(K37*6)+L37 -> 105 | O37: 20 | P37: 12 | Q37: =(O37*6)+P37 -> 132 | S37: Venue: FRANKSTON
A38: FRANKSTON | C38: 1 | D38: 3 | E38: =(C38*6)+D38 -> 9 | G38: 5 | H38: 6 | I38: =(G38*6)+H38 -> 36 | K38: 9 | L38: 9 | M38: =(K38*6)+L38 -> 63 | O38: 12 | P38: 10 | Q38: =(O38*6)+P38 -> 82
A39: BEST PLAYERS
A40: SANDRINGHAM | C40: TREGEAR | F40: COGHLAN | I40: CLARK | L40: MILLER | O40: LYNCH | R40: WILLIAMS
A41: FRANKSTON | C41: McCORMACK | F41: SAUTNER | I41: GEORGIOU | L41: FERGUSON | O41: BURGMAN
A42: GOALKICKERS
A43: SANDRINGHAM | C43: TEMPLETON 5 | F43: COGHLAN 4 | I43: MILLER 3 | K43: WILLIAMS 2 | N43: WILSON 2 | Q43: FUNCKE 2 | S43: AINLEY | U43: TREGEAR
A44: FRANKSTON | C44: McCORMACK 4 | F44: SAUTNER 4 | I44: CLARKE | K44: CADD | M44: WINTERTON | P44: BLACK
A46: COBURG | C46: 5 | D46: 3 | E46: =(C46*6)+D46 -> 33 | G46: 8 | H46: 7 | I46: =(G46*6)+H46 -> 55 | K46: 12 | L46: 10 | M46: =(K46*6)+L46 -> 82 | O46: 18 | P46: 15 | Q46: =(O46*6)+P46 -> 123 | S46: Venue: COBURG
A47: ESSENDON | C47: 4 | D47: 1 | E47: =(C47*6)+D47 -> 25 | G47: 8 | H47: 3 | I47: =(G47*6)+H47 -> 51 | K47: 13 | L47: 7 | M47: =(K47*6)+L47 -> 85 | O47: 14 | P47: 10 | Q47: =(O47*6)+P47 -> 94
A48: BEST PLAYERS
A49: COBURG | C49: POYAS | F49: CHAFFEY | I49: TAYLOR | L49: PAGAN | N49: HYDE | Q49: TALBOT
A50: ESSENDON | C50: B McGRATH | F50: HAYNES | I50: BULLEN | L50: DARCY | N50: BANNISTER
A51: GOALKICKERS
A52: COBURG | C52: POYAS 5 | E52: PETTIFER 3 | H52: HUDSON 2 | K52: McGRATH 2 | N52: HART 2 | P52: EDNIE | R52: MILLS | T52: PAGAN | V52: TAYLOR
A53: ESSENDON | C53: BANNISTER 2 | F53: HOWARD | H53: WILSON | J53: HARVEY | L53: REYNOLDS | N53: MAHONEY | Q53: McALISTER | T53: WINTER | W53: HAWKINS | X53: HAYNES | AA53: DAVIES | AC53: C McGRATH
D54: 7TH APRIL | J54: WEATHER | O54: HUNT
A55: WILLIAMSTOWN | C55: 3 | D55: 3 | E55: =(C55*6)+D55 -> 21 | G55: 8 | H55: 5 | I55: =(G55*6)+H55 -> 53 | K55: 14 | L55: 7 | M55: =(K55*6)+L55 -> 91 | O55: 17 | P55: 12 | Q55: =(O55*6)+P55 -> 114 | S55: Venue: NORTH BALLARAT
A56: NORTH BALLARAT | C56: 3 | D56: 4 | E56: =(C56*6)+D56 -> 22 | G56: 6 | H56: 5 | I56: =(G56*6)+H56 -> 41 | K56: 10 | L56: 5 | M56: =(K56*6)+L56 -> 65 | O56: 12 | P56: 8 | Q56: =(O56*6)+P56 -> 80
A57: BEST PLAYERS
A58: WILLIAMSTOWN | C58: FLETCHER | F58: STEINFORT | I58: DOOLEY | L58: McKEE | N58: LLOYD | Q58: DIMMATINA
A59: NORTH BALLARAT | C59: JENKINS | F59: CLAYTON | I59: GREIG | L59: FIELD | N59: T POLKINGHORNE
A60: GOALKICKERS
A61: WILLIAMSTOWN | C61: DOOLEY 4 | E61: DIMMATINA 4 | H61: STEINFORT 2 | K61: ADKINS 2 | M61: COLE | O61: FLETCHER | Q61: ANDERSON | T61: LLOYD | V61: SMOKER
A62: NORTH BALLARAT | C62: BEST 3 | F62: FIELD 2 | I62: CLAYTON | K62: BROWN | M62: KING | N62: BRADLY | P62: JENKINS | R62: FRITH | T62: GREIG
A64: MURRAY KANGAROOS | C64: 5 | D64: 2 | E64: =(C64*6)+D64 -> 32 | G64: 9 | H64: 3 | I64: =(G64*6)+H64 -> 57 | K64: 12 | L64: 6 | M64: =(K64*6)+L64 -> 78 | O64: 22 | P64: 7 | Q64: =(O64*6)+P64 -> 139 | S64: Venue: WERRIBEE
A65: WERRIBEE | C65: 2 | D65: 3 | E65: =(C65*6)+D65 -> 15 | G65: 6 | H65: 6 | I65: =(G65*6)+H65 -> 42 | K65: 9 | L65: 12 | M65: =(K65*6)+L65 -> 66 | O65: 11 | P65: 13 | Q65: =(O65*6)+P65 -> 79
A66: BEST PLAYERS
A67: MURRAY KANGAROOS | C67: BLAKEY | F67: RAWLINGS | I67: McLAREN | L67: CROWE | N67: HALE | Q67: MORRELL
A68: WERRIBEE | C68: LAMB | F68: JAMES | I68: BOWDEN | L68: GILBEE
A69: GOALKICKERS
A70: MURRAY KANGAROOS | C70: HALE 5 | E70: MORRELL 4 | H70: D SMITH 2 | J70: SOFI 2 | L70: BLAKEY | N70: HARRIS | P70: LANGE | R70: TREGENZA | U70: RAWLINGS | X70: LAYCOCK | AA70: TEAGUE
A71: WERRIBEE | C71: WIGGINS 3 | F71: JAMES 3 | I71: BECKER | K71: McGUINNESS | N71: RAU | P71: SAUNDERS | R71: GILBEE
A73: BOX HILL | C73: 7 | D73: 1 | E73: =(C73*6)+D73 -> 43 | G73: 11 | H73: 7 | I73: =(G73*6)+H73 -> 73 | K73: 18 | L73: 12 | M73: =(K73*6)+L73 -> 120 | O73: 23 | P73: 16 | Q73: =(O73*6)+P73 -> 154 | S73: Venue: PRESTON
A74: NORTHERN BULLANTS | C74: 4 | D74: 3 | E74: =(C74*6)+D74 -> 27 | G74: 6 | H74: 3 | I74: =(G74*6)+H74 -> 39 | K74: 11 | L74: 5 | M74: =(K74*6)+L74 -> 71 | O74: 13 | P74: 6 | Q74: =(O74*6)+P74 -> 84
A75: BEST PLAYERS
A76: BOX HILL | C76: MITCHELL | F76: COLLINS | I76: WILLIAMS | L76: HOARE | N76: OSBORNE | Q76: PASSADOR
A77: NORTHERN BULLANTS | C77: LOWTHER | F77: RAMSAY | I77: PILLING | L77: HOOPER
A78: GOALKICKERS
A79: BOX HILL | C79: WILLIAMS 6 | F79: PASSADOR 5 | I79: HODGE 2 | K79: BAYFORD 2 | N79: ELSTONE 2 | Q79: COLLINS | S79: ALLEWAY | V79: HEENAN | X79: SMITH | Z79: OSBORNE | AB79: WHYMAN
A80: NORTHERN BULLANTS | C80: RAMSAY 2 | F80: SCANLON 2 | I80: PILLING 2 | K80: HOOPER 2 | N80: LOWTHER | P80: BRERETON | R80: GIBSON | T80: SHAW | V80: SAGE
A82: ROUND 2 | D82: 13TH APRIL | J82: WEATHER
D83: 1ST QTR | H83: 2ND QTR | L83: 3RD QTR | P83: FINAL | S83: Venue: WERRIBEE
A84: WERRIBEE | C84: 5 | D84: 2 | E84: =(C84*6)+D84 -> 32 | G84: 9 | H84: 4 | I84: =(G84*6)+H84 -> 58 | K84: 11 | L84: 8 | M84: =(K84*6)+L84 -> 74 | O84: 15 | P84: 10 | Q84: =(O84*6)+P84 -> 100 | S84: UMPIRES | Y84: LADDER | AB84: ROUND | AD84: 2
A85: NORTH BALLARAT | C85: 5 | D85: 2 | E85: =(C85*6)+D85 -> 32 | G85: 5 | H85: 5 | I85: =(G85*6)+H85 -> 35 | K85: 10 | L85: 9 | M85: =(K85*6)+L85 -> 69 | O85: 12 | P85: 11 | Q85: =(O85*6)+P85 -> 83
A86: BEST PLAYERS | W86: TEAM | X86: W | Y86: L | Z86: D | AA86: FOR | AB86: AGST | AC86: % | AD86: PTS
A87: WERRIBEE | C87: DIMMATINA | F87: FAULKNER | I87: CHURCHILL | L87: RUSCA | N87: SAUNDERS | Q87: MURPHY
A88: NORTH BALLARAT | C88: GREIG | F88: LUBEEK | I88: JENKINS | L88: CLAYTON | N88: KING | Q88: BRADLY | W88: SPRINGVALE | X88: 2 | Y88: 0 | Z88: 0 | AA88: 240 | AB88: 146 | AC88: =(AA88/AB88)*100 -> 164.38356164383561 | AD88: =(X88*4)+(Z88*2) -> 8
A89: GOALKICKERS | M89: POWER | O89: RAU | Q89: WIGGINS | W89: MURRAY KANGAROOS | X89: 2 | Y89: 0 | Z89: 0 | AA89: 235 | AB89: 154 | AC89: =(AA89/AB89)*100 -> 152.59740259740261 | AD89: =(X89*4)+(Z89*2) -> 8
A90: WERRIBEE | C90: CHURCHILL 3 | F90: SAUNDERS 3 | I90: MITCHELL 2 | L90: EAGLETON | N90: JAMES | P90: LAMB | R90: PICKEN | W90: SANDRINGHAM | X90: 2 | Y90: 0 | Z90: 0 | AA90: 220 | AB90: 153 | AC90: =(AA90/AB90)*100 -> 143.79084967320262 | AD90: =(X90*4)+(Z90*2) -> 8
A91: NORTH BALLARAT | C91: BRADLY 6 | F91: JENKINS 2 | I91: BYE | J91: BEARDSLEY | M91: SULLIVAN | O91: CLAYTON | W91: BOX HILL | X91: 2 | Y91: 0 | Z91: 0 | AA91: 191 | AB91: 144 | AC91: =(AA91/AB91)*100 -> 132.63888888888889 | AD91: =(X91*4)+(Z91*2) -> 8
W92: WILLIAMSTOWN | X92: 2 | Y92: 0 | Z92: 0 | AA92: 238 | AB92: 203 | AC92: =(AA92/AB92)*100 -> 117.24137931034481 | AD92: =(X92*4)+(Z92*2) -> 8
A93: BOX HILL | C93: 6 | D93: 5 | E93: =(C93*6)+D93 -> 41 | G93: 10 | H93: 7 | I93: =(G93*6)+H93 -> 67 | K93: 16 | L93: 12 | M93: =(K93*6)+L93 -> 108 | O93: 20 | P93: 17 | Q93: =(O93*6)+P93 -> 137 | S93: Venue: BOX HILL | W93: PORT MELBOURNE | X93: 1 | Y93: 1 | Z93: 0 | AA93: 178 | AB93: 139 | AC93: =(AA93/AB93)*100 -> 128.05755395683454 | AD93: =(X93*4)+(Z93*2) -> 4
A94: BENDIGO | C94: 1 | D94: 1 | E94: =(C94*6)+D94 -> 7 | G94: 5 | H94: 3 | I94: =(G94*6)+H94 -> 33 | K94: 7 | L94: 6 | M94: =(K94*6)+L94 -> 48 | O94: 9 | P94: 6 | Q94: =(O94*6)+P94 -> 60 | W94: COBURG | X94: 1 | Y94: 1 | Z94: 0 | AA94: 194 | AB94: 182 | AC94: =(AA94/AB94)*100 -> 106.5934065934066 | AD94: =(X94*4)+(Z94*2) -> 4
A95: BEST PLAYERS | W95: TASMANIA | X95: 1 | Y95: 1 | Z95: 0 | AA95: 173 | AB95: 169 | AC95: =(AA95/AB95)*100 -> 102.36686390532543 | AD95: =(X95*4)+(Z95*2) -> 4
A96: BOX HILL | C96: LADSON | F96: JOHNSON | I96: HODGE | L96: COLLINS | N96: MITCHELL | Q96: STONE
A97: BENDIGO | C97: PROCTOR | F97: BRADLEY | I97: BOVALINO | L97: CARTER | N97: CAIL | W97: GEELONG | X97: 1 | Y97: 1 | Z97: 0 | AA97: 162 | AB97: 173 | AC97: =(AA97/AB97)*100 -> 93.641618497109818 | AD97: =(X97*4)+(Z97*2) -> 4
A98: GOALKICKERS | Q98: TARRANT | S98: COLLINS | W98: WERRIBEE | X98: 1 | Y98: 1 | Z98: 0 | AA98: 179 | AB98: 222 | AC98: =(AA98/AB98)*100 -> 80.630630630630634 | AD98: =(X98*4)+(Z98*2) -> 4
A99: BOX HILL | C99: PASSADOR 6 | F99: BAYFORD 3 | I99: HODGE 3 | K99: LADSON 3 | M99: ALLEWAY | O99: CAMPBELL | Q99: GEORGIADIS | W99: NORTHERN BULLANTS | X99: 1 | Y99: 1 | Z99: 0 | AA99: 179 | AB99: 243 | AC99: =(AA99/AB99)*100 -> 73.66255144032921 | AD99: =(X99*4)+(Z99*2) -> 4
A100: BENDIGO | C100: PROCTOR 2 | F100: ELSUM 2 | I100: DILLON | K100: SCHMIDT | M100: CAIL | N100: CAMPBELL | W100: ESSENDON | X100: 0 | Y100: 2 | Z100: 0 | AA100: 183 | AB100: 218 | AC100: =(AA100/AB100)*100 -> 83.944954128440358 | AD100: =(X100*4)+(Z100*2) -> 0
W101: NORTH BALLARAT | X101: 0 | Y101: 2 | Z101: 0 | AA101: 163 | AB101: 214 | AC101: =(AA101/AB101)*100 -> 76.168224299065429 | AD101: =(X101*4)+(Z101*2) -> 0
A102: SPRINGVALE | C102: 7 | D102: 2 | E102: =(C102*6)+D102 -> 44 | G102: 12 | H102: 8 | I102: =(G102*6)+H102 -> 80 | K102: 14 | L102: 10 | M102: =(K102*6)+L102 -> 94 | O102: 14 | P102: 16 | Q102: =(O102*6)+P102 -> 100 | S102: Venue: MOORABBIN | W102: CARLTON | X102: 0 | Y102: 2 | Z102: 0 | AA102: 165 | AB102: 220 | AC102: =(AA102/AB102)*100 -> 75 | AD102: =(X102*4)+(Z102*2) -> 0
A103: FRANKSTON | C103: 0 | D103: 0 | E103: =(C103*6)+D103 -> 0 | G103: 2 | H103: 0 | I103: =(G103*6)+H103 -> 12 | K103: 5 | L103: 3 | M103: =(K103*6)+L103 -> 33 | O103: 7 | P103: 6 | Q103: =(O103*6)+P103 -> 48 | W103: BENDIGO | X103: 0 | Y103: 2 | Z103: 0 | AA103: 158 | AB103: 277 | AC103: =(AA103/AB103)*100 -> 57.039711191335741 | AD103: =(X103*4)+(Z103*2) -> 0
A104: BEST PLAYERS | W104: FRANKSTON | X104: 0 | Y104: 2 | Z104: 0 | AA104: 130 | AB104: 232 | AC104: =(AA104/AB104)*100 -> 56.034482758620683 | AD104: =(X104*4)+(Z104*2) -> 0
A105: SPRINGVALE | C105: DALSANTO | F105: PLAPP | I105: BEGLEY | L105: TROLLOPE | O105: RIGG | Q105: CALLAGHAN
A106: FRANKSTON | C106: ABLETT | F106: FERGUSON | I106: KREIG | L106: ANDERSON | O106: WINTERTON
A107: GOALKICKERS
A108: SPRINGVALE | C108: PITT 3 | E108: CARMODY 2 | H108: CALLAGHAN 2 | K108: BEGLEY 2 | M108: RIGG 2 | O108: JOWETT | Q108: CARROLL | S108: OLIVER
A109: FRANKSTON | C109: ANDERSON 2 | F109: CLARKE | H109: WINTERTON | J109: DOUST | L109: POLLARD | N109: DAMON
A111: WILLIAMSTOWN | C111: 6 | D111: 2 | E111: =(C111*6)+D111 -> 38 | G111: 12 | H111: 5 | I111: =(G111*6)+H111 -> 77 | K111: 15 | L111: 6 | M111: =(K111*6)+L111 -> 96 | O111: 19 | P111: 10 | Q111: =(O111*6)+P111 -> 124 | S111: Venue: WILLIAMSTOWN
A112: CARLTON | C112: 8 | D112: 3 | E112: =(C112*6)+D112 -> 51 | G112: 10 | H112: 5 | I112: =(G112*6)+H112 -> 65 | K112: 13 | L112: 9 | M112: =(K112*6)+L112 -> 87 | O112: 18 | P112: 15 | Q112: =(O112*6)+P112 -> 123
A113: BEST PLAYERS
A114: WILLIAMSTOWN | C114: McKEE | F114: ANDERSON | I114: DIMMATINA | L114: SMOKER | O114: LLOYD | Q114: DE ANGELIS
A115: CARLTON | C115: CRANAGE | F115: DAVIES | I115: FLEMING | L115: SMITH | O115: DOERING | Q115: ECCLES
A116: GOALKICKERS
A117: WILLIAMSTOWN | C117: SMOKER 6 | E117: DIMMATINA 2 | H117: LOVETT-MURRAY 2 | L117: FLETCHER | N117: DIDAK | P117: WEST | R117: COLE | T117: McKEE | W117: PODSIADLY | X117: DUKES | Z117: SHAW | AB117: ANDERSON
A118: CARLTON | C118: FEVOLA 3 | E118: GUTTERSON 3 | H118: WAITE 3 | J118: HOTTON 2 | M118: L SMITH 2 | P118: ECCLES | R118: DAVIS | T118: DOERING | W118: SINNOTT | X118: DAVIES
D119: 14TH APRIL | J119: WEATHER
A120: SANDRINGHAM | C120: 1 | D120: 4 | E120: =(C120*6)+D120 -> 10 | G120: 7 | H120: 6 | I120: =(G120*6)+H120 -> 48 | K120: 8 | L120: 9 | M120: =(K120*6)+L120 -> 57 | O120: 13 | P120: 10 | Q120: =(O120*6)+P120 -> 88 | S120: Venue: BEACH ROAD
A121: COBURG | C121: 2 | D121: 4 | E121: =(C121*6)+D121 -> 16 | G121: 7 | H121: 6 | I121: =(G121*6)+H121 -> 48 | K121: 7 | L121: 10 | M121: =(K121*6)+L121 -> 52 | O121: 10 | P121: 11 | Q121: =(O121*6)+P121 -> 71
A122: BEST PLAYERS
A123: SANDRINGHAM | C123: ELLIS | F123: TREGEAR | I123: CLARK | L123: WARD | N123: AINLEY
A124: COBURG | C124: TALBOT | F124: DEPASQUALE | I124: COUGHLAN | L124: PAGAN | N124: HUDSON | Q124: PETTIFER
A125: GOALKICKERS
A126: SANDRINGHAM | C126: TEMPLETON 4 | F126: MOLAN 2 | I126: WARD 2 | K126: WILLIAMS 2 | N126: COGHLAN 2 | Q126: MILLER
A127: COBURG | C127: HUDSON 4 | F127: PETTIFER 2 | I127: McGRATH | K127: BIDDISCOMBE | N127: PAGAN | P127: EDNIE
A129: TASMANIA | C129: 2 | D129: 4 | E129: =(C129*6)+D129 -> 16 | G129: 7 | H129: 10 | I129: =(G129*6)+H129 -> 52 | K129: 9 | L129: 12 | M129: =(K129*6)+L129 -> 66 | O129: 14 | P129: 13 | Q129: =(O129*6)+P129 -> 97 | S129: Venue: PORT MELBOURNE
A130: PORT MELBOURNE | C130: 2 | D130: 4 | E130: =(C130*6)+D130 -> 16 | G130: 6 | H130: 6 | I130: =(G130*6)+H130 -> 42 | K130: 10 | L130: 8 | M130: =(K130*6)+L130 -> 68 | O130: 12 | P130: 10 | Q130: =(O130*6)+P130 -> 82
A131: BEST PLAYERS
A132: TASMANIA | C132: ATKIN | F132: CARTER | I132: BEAMS | L132: BLIGHT | N132: WALKER | Q132: HOWARD
A133: PORT MELBOURNE | C133: R ABLETT | F133: FILANDIA | I133: GILL
A134: GOALKICKERS
A135: TASMANIA | C135: HEATLEY 6 | F135: BOLTON 2 | I135: MOLONEY 2 | L135: ATKIN 2 | N135: CALLINAN | Q135: BEAMS
A136: PORT MELBOURNE | C136: R ABLETT 4 | F136: DOYLE 2 | I136: FIXTER 2 | L136: L ABLETT | N136: FILANDIA | Q136: EVANS | S136: DELUCA
A138: MURRAY KANGAROOS | C138: 0 | D138: 6 | E138: =(C138*6)+D138 -> 6 | G138: 1 | H138: 9 | I138: =(G138*6)+H138 -> 15 | K138: 6 | L138: 11 | M138: =(K138*6)+L138 -> 47 | O138: 14 | P138: 12 | Q138: =(O138*6)+P138 -> 96 | S138: Venue: COBURG
A139: GEELONG | C139: 2 | D139: 4 | E139: =(C139*6)+D139 -> 16 | G139: 5 | H139: 10 | I139: =(G139*6)+H139 -> 40 | K139: 8 | L139: 13 | M139: =(K139*6)+L139 -> 61 | O139: 10 | P139: 15 | Q139: =(O139*6)+P139 -> 75
A140: BEST PLAYERS
A141: MURRAY KANGAROOS | C141: LANGE | F141: PETRIE | I141: J SMITH | L141: TEAGUE | N141: McLAREN | Q141: MORRELL
A142: GEELONG | C142: WOOLNOUGH | F142: JOHNSON | I142: WOJCINSKI | L142: KELLY | N142: RAHILLY
A143: GOALKICKERS
A144: MURRAY KANGAROOS | C144: PETRIE 2 | E144: MORRELL 2 | H144: WATT 2 | J144: BOURKE 2 | M144: McLAREN | O144: TEAGUE | Q144: WATSON | S144: D SMITH | W144: SINCLAIR | X144: LANGE
A145: GEELONG | C145: WHITE 3 | F145: BRIGHT 2 | I145: GARDINER | L145: McCARTHY | N145: O'BRIEN | P145: BLACKNEY | R145: WOOLNOUGH
A147: NORTHERN BULLANTS | C147: 5 | D147: 6 | E147: =(C147*6)+D147 -> 36 | G147: 6 | H147: 9 | I147: =(G147*6)+H147 -> 45 | K147: 11 | L147: 10 | M147: =(K147*6)+L147 -> 76 | O147: 14 | P147: 11 | Q147: =(O147*6)+P147 -> 95 | S147: Venue: PRESTON
A148: ESSENDON | C148: 1 | D148: 2 | E148: =(C148*6)+D148 -> 8 | G148: 7 | H148: 4 | I148: =(G148*6)+H148 -> 46 | K148: 8 | L148: 8 | M148: =(K148*6)+L148 -> 56 | O148: 13 | P148: 11 | Q148: =(O148*6)+P148 -> 89
A149: BEST PLAYERS
A150: NORTHERN BULLANTS | C150: RAMSAY | F150: REID | I150: PILLING | L150: COLLINS | N150: CANN | Q150: SAGE
A151: ESSENDON | C151: BANNISTER | F151: HAWKINS | I151: MAHONEY | L151: RICHARDS | N151: WINTER
A152: GOALKICKERS
A153: NORTHERN BULLANTS | C153: CANN 3 | E153: GRAINGER 2 | H153: PILLING 2 | J153: CARACELLA | M153: SCANLON | O153: RASO | Q153: WALSH | S153: REID | U153: PENN | W153: PATERSON
A154: ESSENDON | C154: HAWKINS 2 | F154: DARCY 2 | H154: HARVEY 2 | J154: WINTER | L154: BANNISTER | O154: RIOLI | Q154: HAYNES | S154: RICHARDS | V154: TOWNER | X154: WILSON
A156: ROUND 3 | D156: 20TH APRIL | J156: WEATHER
D157: 1ST QTR | H157: 2ND QTR | L157: 3RD QTR | P157: FINAL | S157: Venue: FRANKSTON
A158: CARLTON | C158: 3 | D158: 4 | E158: =(C158*6)+D158 -> 22 | G158: 6 | H158: 10 | I158: =(G158*6)+H158 -> 46 | K158: 8 | L158: 13 | M158: =(K158*6)+L158 -> 61 | O158: 15 | P158: 15 | Q158: =(O158*6)+P158 -> 105 | S158: UMPIRES | Y158: LADDER | AB158: ROUND | AD158: 3
A159: FRANKSTON | C159: 1 | D159: 2 | E159: =(C159*6)+D159 -> 8 | G159: 3 | H159: 6 | I159: =(G159*6)+H159 -> 24 | K159: 7 | L159: 6 | M159: =(K159*6)+L159 -> 48 | O159: 9 | P159: 8 | Q159: =(O159*6)+P159 -> 62
A160: BEST PLAYERS | W160: TEAM | X160: W | Y160: L | Z160: D | AA160: FOR | AB160: AGST | AC160: % | AD160: PTS
A161: CARLTON | C161: HOTTON | F161: DAVIES | I161: DOERING | L161: FEVOLA | O161: SINNOTT
A162: FRANKSTON | C162: FERGUSON | F162: ANDERSON | I162: WILLIS | L162: KREIG | O162: DAMON | Q162: GEORGIOU | W162: SANDRINGHAM | X162: 3 | Y162: 0 | Z162: 0 | AA162: 317 | AB162: 217 | AC162: =(AA162/AB162)*100 -> 146.08294930875576 | AD162: =(X162*4)+(Z162*2) -> 12
A163: GOALKICKERS | P163: GUTTERSON | W163: BOX HILL | X163: 3 | Y163: 0 | Z163: 0 | AA163: 316 | AB163: 226 | AC163: =(AA163/AB163)*100 -> 139.82300884955751 | AD163: =(X163*4)+(Z163*2) -> 12
A164: CARLTON | C164: THORNTON 3 | F164: L SMITH 2 | I164: WADE 2 | K164: HOTTON 2 | M164: SINNOTT 2 | O164: FEVOLA | Q164: BRAY | R164: DOERING | W164: GEELONG | X164: 2 | Y164: 1 | Z164: 0 | AA164: 305 | AB164: 225 | AC164: =(AA164/AB164)*100 -> 135.55555555555557 | AD164: =(X164*4)+(Z164*2) -> 8
A165: FRANKSTON | C165: SALISBURY 2 | F165: WILLIS 2 | I165: KREIG 2 | K165: McCORMACK | N165: POLLARD | Q165: CADD | W165: PORT MELBOURNE | X165: 2 | Y165: 1 | Z165: 0 | AA165: 300 | AB165: 231 | AC165: =(AA165/AB165)*100 -> 129.87012987012986 | AD165: =(X165*4)+(Z165*2) -> 8
W166: MURRAY KANGAROOS | X166: 2 | Y166: 1 | Z166: 0 | AA166: 327 | AB166: 276 | AC166: =(AA166/AB166)*100 -> 118.4782608695652 | AD166: =(X166*4)+(Z166*2) -> 8
A167: TASMANIA | C167: 4 | D167: 3 | E167: =(C167*6)+D167 -> 27 | G167: 9 | H167: 7 | I167: =(G167*6)+H167 -> 61 | K167: 11 | L167: 10 | M167: =(K167*6)+L167 -> 76 | O167: 22 | P167: 10 | Q167: =(O167*6)+P167 -> 142 | S167: Venue: NORTH HOBART OVAL | W167: TASMANIA | X167: 2 | Y167: 1 | Z167: 0 | AA167: 315 | AB167: 282 | AC167: =(AA167/AB167)*100 -> 111.70212765957446 | AD167: =(X167*4)+(Z167*2) -> 8
A168: ESSENDON | C168: 2 | D168: 3 | E168: =(C168*6)+D168 -> 15 | G168: 5 | H168: 5 | I168: =(G168*6)+H168 -> 35 | K168: 12 | L168: 10 | M168: =(K168*6)+L168 -> 82 | O168: 17 | P168: 11 | Q168: =(O168*6)+P168 -> 113 | W168: COBURG | X168: 2 | Y168: 1 | Z168: 0 | AA168: 307 | AB168: 278 | AC168: =(AA168/AB168)*100 -> 110.431654676259 | AD168: =(X168*4)+(Z168*2) -> 8
A169: BEST PLAYERS | W169: WERRIBEE | X169: 2 | Y169: 1 | Z169: 0 | AA169: 303 | AB169: 292 | AC169: =(AA169/AB169)*100 -> 103.76712328767124 | AD169: =(X169*4)+(Z169*2) -> 8
A170: TASMANIA | C170: HOWARD | F170: ATKIN | I170: BLIGHT | L170: THURLEY | O170: CALLINAN | R170: BEAMS
A171: ESSENDON | C171: MAHONEY | F171: BOLTON | I171: BANNISTER | L171: RIOLI | W171: SPRINGVALE | X171: 2 | Y171: 1 | Z171: 0 | AA171: 292 | AB171: 289 | AC171: =(AA171/AB171)*100 -> 101.03806228373702 | AD171: =(X171*4)+(Z171*2) -> 8
A172: GOALKICKERS | O172: BLIGHT | Q172: HOWARD | T172: WAGER | W172: WILLIAMSTOWN | X172: 2 | Y172: 1 | Z172: 0 | AA172: 320 | AB172: 328 | AC172: =(AA172/AB172)*100 -> 97.560975609756099 | AD172: =(X172*4)+(Z172*2) -> 8
A173: TASMANIA | C173: CALLINAN 5 | F173: BEAMS 5 | H173: HEATLEY 2 | J173: MOLONEY 2 | M173: M GEAPPEN 2 | P173: AHEARNE | R173: ATKIN | T173: CARTER | W173: CARLTON | X173: 1 | Y173: 2 | Z173: 0 | AA173: 270 | AB173: 282 | AC173: =(AA173/AB173)*100 -> 95.744680851063833 | AD173: =(X173*4)+(Z173*2) -> 4
A174: ESSENDON | C174: BANNISTER 4 | F174: MAHONEY 4 | I174: BOLTON 2 | K174: DAVIES 2 | M174: CAREY 2 | O174: DARCY | Q174: McALISTER | T174: HALL | W174: NORTHERN BULLANTS | X174: 1 | Y174: 2 | Z174: 0 | AA174: 249 | AB174: 367 | AC174: =(AA174/AB174)*100 -> 67.847411444141699 | AD174: =(X174*4)+(Z174*2) -> 4
D175: 21ST APRIL | J175: WEATHER | W175: ESSENDON | X175: 0 | Y175: 3 | Z175: 0 | AA175: 296 | AB175: 360 | AC175: =(AA175/AB175)*100 -> 82.222222222222214 | AD175: =(X175*4)+(Z175*2) -> 0
A176: GEELONG | C176: 4 | D176: 7 | E176: =(C176*6)+D176 -> 31 | G176: 12 | H176: 9 | I176: =(G176*6)+H176 -> 81 | K176: 17 | L176: 14 | M176: =(K176*6)+L176 -> 116 | O176: 21 | P176: 17 | Q176: =(O176*6)+P176 -> 143 | S176: Venue: SHELL STADIUM (C/R) | W176: NORTH BALLARAT | X176: 0 | Y176: 3 | Z176: 0 | AA176: 227 | AB176: 311 | AC176: =(AA176/AB176)*100 -> 72.9903536977492 | AD176: =(X176*4)+(Z176*2) -> 0
A177: SPRINGVALE | C177: 2 | D177: 1 | E177: =(C177*6)+D177 -> 13 | G177: 3 | H177: 4 | I177: =(G177*6)+H177 -> 22 | K177: 4 | L177: 7 | M177: =(K177*6)+L177 -> 31 | O177: 7 | P177: 10 | Q177: =(O177*6)+P177 -> 52 | W177: BENDIGO | X177: 0 | Y177: 3 | Z177: 0 | AA177: 254 | AB177: 390 | AC177: =(AA177/AB177)*100 -> 65.128205128205124 | AD177: =(X177*4)+(Z177*2) -> 0
A178: BEST PLAYERS | W178: FRANKSTON | X178: 0 | Y178: 3 | Z178: 0 | AA178: 192 | AB178: 337 | AC178: =(AA178/AB178)*100 -> 56.973293768545993 | AD178: =(X178*4)+(Z178*2) -> 0
A179: GEELONG | C179: WOOLNOUGH | F179: CHAPMAN | I179: S JOHNSON | L179: McCARTHY | O179: KELLY | Q179: PLAYFAIR
A180: SPRINGVALE | C180: CARROLL | F180: WULF | I180: PLAPP | L180: RIGG | O180: CALLAGHAN
A181: GOALKICKERS | P181: KNUCKEY | R181: O'BRIEN | T181: PLAYFAIR
A182: GEELONG | C182: McCARTHY 5 | F182: MENSCH 4 | I182: CHATFIELD 2 | L182: S JOHNSON 2 | O182: WHITE 2 | Q182: CHAPMAN 2 | T182: GARDINER
A183: SPRINGVALE | C183: PITT 2 | F183: OLIVER 2 | I183: PLAPP | K183: CARMODY | M183: WULF
A185: BOX HILL | C185: 2 | D185: 5 | E185: =(C185*6)+D185 -> 17 | G185: 6 | H185: 7 | I185: =(G185*6)+H185 -> 43 | K185: 11 | L185: 11 | M185: =(K185*6)+L185 -> 77 | O185: 18 | P185: 17 | Q185: =(O185*6)+P185 -> 125 | S185: Venue: BOX HILL
A186: WILLIAMSTOWN | C186: 5 | D186: 1 | E186: =(C186*6)+D186 -> 31 | G186: 9 | H186: 3 | I186: =(G186*6)+H186 -> 57 | K186: 11 | L186: 4 | M186: =(K186*6)+L186 -> 70 | O186: 13 | P186: 4 | Q186: =(O186*6)+P186 -> 82
A187: BEST PLAYERS
A188: BOX HILL | C188: CLARKE | F188: BREWER | I188: LADSON | L188: MITCHELL | O188: CAMPBELL | R188: STONE
A189: WILLIAMSTOWN | C189: FLETCHER | F189: DE ANGELIS | I189: LOVETT-MURRAY | M189: RIPPON | O189: DOOLEY | R189: COLE
A190: GOALKICKERS
A191: BOX HILL | C191: PASSADOR 4 | F191: ALLEWAY 3 | I191: BREWER 3 | L191: WILLIAMS 2 | O191: BAYFORD | Q191: TALLIS | S191: JOHNSON | V191: LADSON | X191: GEORGIADIS | AB191: ELSTONE
A192: WILLIAMSTOWN | C192: KINNEAR 3 | F192: ANDERSON 2 | I192: DIMMATINA | L192: DOOLEY | N192: LOVETT-MURRAY | R192: COLE | T192: PODSIADLY | W192: ADAMS | X192: PEARCE | Z192: RIPPON
A194: SANDRINGHAM | C194: 0 | D194: 3 | E194: =(C194*6)+D194 -> 3 | G194: 5 | H194: 5 | I194: =(G194*6)+H194 -> 35 | K194: 8 | L194: 9 | M194: =(K194*6)+L194 -> 57 | O194: 14 | P194: 13 | Q194: =(O194*6)+P194 -> 97 | S194: Venue: NORTH BALLARAT
A195: NORTH BALLARAT | C195: 2 | D195: 4 | E195: =(C195*6)+D195 -> 16 | G195: 4 | H195: 5 | I195: =(G195*6)+H195 -> 29 | K195: 5 | L195: 8 | M195: =(K195*6)+L195 -> 38 | O195: 9 | P195: 10 | Q195: =(O195*6)+P195 -> 64
A196: BEST PLAYERS
A197: SANDRINGHAM | C197: TREGEAR | F197: GODFREY | I197: LIDDELL | L197: COGHLAN | O197: LYNCH | Q197: ROBERTSON
A198: NORTH BALLARAT | C198: GREIG | F198: LUBEEK | I198: FIELD | L198: PERKINS
A199: GOALKICKERS
A200: SANDRINGHAM | C200: ROBERTSON 4 | F200: ROBBINS 2 | I200: THOMPSON 2 | L200: SULLIVAN | N200: FERRARO | P200: COGHLAN | R200: WILSON | T200: BREESE | V200: RADFORD
A201: NORTH BALLARAT | C201: SPOLDING 3 | F201: PERKINS 2 | I201: BEARDSLEY | L201: BEST | M201: BYE | N201: SULLIVAN
A203: WERRIBEE | C203: 8 | D203: 8 | E203: =(C203*6)+D203 -> 56 | G203: 12 | H203: 10 | I203: =(G203*6)+H203 -> 82 | K203: 14 | L203: 13 | M203: =(K203*6)+L203 -> 97 | O203: 18 | P203: 16 | Q203: =(O203*6)+P203 -> 124 | S203: Venue: PRESTON
A204: NORTHERN BULLANTS | C204: 3 | D204: 2 | E204: =(C204*6)+D204 -> 20 | G204: 7 | H204: 5 | I204: =(G204*6)+H204 -> 47 | K204: 7 | L204: 9 | M204: =(K204*6)+L204 -> 51 | O204: 10 | P204: 10 | Q204: =(O204*6)+P204 -> 70
A205: BEST PLAYERS
A206: WERRIBEE | C206: LAMB | F206: WIGGINS | I206: RAU | L206: ANTONOWICZ | O206: FAULKNER | R206: DYER
A207: NORTHERN BULLANTS | C207: STEVENSON | F207: TAYLOR | I207: STRANEY | L207: GRAINGER | O207: RAMSAY
A208: GOALKICKERS
A209: WERRIBEE | C209: WIGGINS 6 | F209: MITCHELL 4 | I209: RAU 3 | K209: McGUINNESS 2 | N209: LAMB 2 | Q209: JACK
A210: NORTHERN BULLANTS | C210: GRAINGER 5 | F210: CANN | H210: RAMSAY | J210: SCANLON | M210: PATERSON | P210: BAILEY
A212: PORT MELBOURNE | C212: 4 | D212: 3 | E212: =(C212*6)+D212 -> 27 | G212: 9 | H212: 5 | I212: =(G212*6)+H212 -> 59 | K212: 17 | L212: 7 | M212: =(K212*6)+L212 -> 109 | O212: 19 | P212: 8 | Q212: =(O212*6)+P212 -> 122 | S212: Venue: COBURG
A213: MURRAY KANGAROOS | C213: 2 | D213: 3 | E213: =(C213*6)+D213 -> 15 | G213: 6 | H213: 5 | I213: =(G213*6)+H213 -> 41 | K213: 6 | L213: 12 | M213: =(K213*6)+L213 -> 48 | O213: 13 | P213: 14 | Q213: =(O213*6)+P213 -> 92
A214: BEST PLAYERS
A215: PORT MELBOURNE | C215: O'LOUGHLIN | F215: COTCHETT | I215: R ABLETT | L215: GILL | N215: ROSE | Q215: EVANS
A216: MURRAY KANGAROOS | C216: PETRIE | F216: SINCLAIR | I216: McLAREN | L216: MOTLOP | N216: PRATT
A217: GOALKICKERS
A218: PORT MELBOURNE | C218: R ABLETT 5 | F218: POWER 3 | H218: ANSTEY 2 | J218: COTCHETT | M218: BUCHANAN | P218: L ABLETT | R218: FIXTER | T218: SUNDQUIST | W218: O'LOUGHLIN | X218: ALOI | Z218: DAFFEY | AB218: DELUCA
A219: MURRAY KANGAROOS | C219: TREGENZA 2 | F219: MORRELL 2 | I219: SOFI 2 | K219: LOWCOCK 2 | N219: RAWLINGS | Q219: PETRIE | S219: HARRIS | U219: HALE | W219: McLAREN
A221: COBURG | C221: 3 | D221: 3 | E221: =(C221*6)+D221 -> 21 | G221: 10 | H221: 5 | I221: =(G221*6)+H221 -> 65 | K221: 14 | L221: 9 | M221: =(K221*6)+L221 -> 93 | O221: 17 | P221: 11 | Q221: =(O221*6)+P221 -> 113 | S221: Venue: BENDIGO
A222: BENDIGO | C222: 6 | D222: 3 | E222: =(C222*6)+D222 -> 39 | G222: 9 | H222: 6 | I222: =(G222*6)+H222 -> 60 | K222: 14 | L222: 6 | M222: =(K222*6)+L222 -> 90 | O222: 15 | P222: 6 | Q222: =(O222*6)+P222 -> 96
A223: BEST PLAYERS
A224: COBURG | C224: EDNIE | F224: FARMER | I224: CARLSON | L224: TALBOT | N224: DEPASQUALE | Q224: CARLYLE
A225: BENDIGO | C225: CARTER | F225: BRADLEY | I225: BOVALINO | L225: BROWN | N225: CAIL | Q225: VANCE
A226: GOALKICKERS
A227: COBURG | C227: EDNIE 2 | E227: HUDSON 2 | H227: PETTIFER 2 | J227: FARMER 2 | M227: CARLSON | O227: HART | Q227: WESTON | S227: TALBOT | U227: PAGAN | W227: ROBERTS | X227: RAYSON | Z227: BICER | AB227: NEWMAN
A228: BENDIGO | C228: BROWN 3 | F228: PROCTOR 3 | I228: COOPER 2 | K228: CARTER 2 | M228: HAWKINS | O228: ELSUM | Q228: EATON | S228: GRIGG | U228: VANCE
A230: ROUND 4 | D230: 25TH APRIL | J230: WEATHER
D231: 1ST QTR | H231: 2ND QTR | L231: 3RD QTR | P231: FINAL | S231: Venue: NORTH HOBART OVAL
A232: TASMANIA | C232: 1 | D232: 3 | E232: =(C232*6)+D232 -> 9 | G232: 5 | H232: 7 | I232: =(G232*6)+H232 -> 37 | K232: 8 | L232: 12 | M232: =(K232*6)+L232 -> 60 | O232: 11 | P232: 12 | Q232: =(O232*6)+P232 -> 78 | S232: UMPIRES | Y232: LADDER | AB232: ROUND | AD232: 4
A233: FRANKSTON | C233: 5 | D233: 2 | E233: =(C233*6)+D233 -> 32 | G233: 8 | H233: 2 | I233: =(G233*6)+H233 -> 50 | K233: 9 | L233: 5 | M233: =(K233*6)+L233 -> 59 | O233: 11 | P233: 6 | Q233: =(O233*6)+P233 -> 72
A234: BEST PLAYERS | W234: TEAM | X234: W | Y234: L | Z234: D | AA234: FOR | AB234: AGST | AC234: % | AD234: PTS
A235: TASMANIA | C235: BEVERIDGE | F235: BLIGHT | I235: WALKER | L235: HOWARD | O235: WAGER | Q235: BEAMS
A236: FRANKSTON | C236: FERGUSON | F236: WINTERTON | I236: ABLETT | L236: BURGMAN | O236: WILLIS | Q236: ANDERSON | W236: GEELONG | X236: 3 | Y236: 1 | Z236: 0 | AA236: 508 | AB236: 267 | AC236: =(AA236/AB236)*100 -> 190.26217228464418 | AD236: =(X236*4)+(Z236*2) -> 12
A237: GOALKICKERS | M237: HEATHERBRIDGE | Q237: AHERNE | W237: SANDRINGHAM | X237: 3 | Y237: 1 | Z237: 0 | AA237: 397 | AB237: 300 | AC237: =(AA237/AB237)*100 -> 132.33333333333331 | AD237: =(X237*4)+(Z237*2) -> 12
A238: TASMANIA | C238: BEAMS 2 | E238: ATKIN 2 | G238: TAYLOR | I238: CALLINAN | K238: M GEAPPEN | N238: B GEAPPEN | Q238: MOLONEY | W238: PORT MELBOURNE | X238: 3 | Y238: 1 | Z238: 0 | AA238: 399 | AB238: 312 | AC238: =(AA238/AB238)*100 -> 127.88461538461537 | AD238: =(X238*4)+(Z238*2) -> 12
A239: FRANKSTON | C239: SAUTNER 3 | F239: CLARKE 2 | I239: ANDERSON | L239: FOLINO | N239: KENNEDY | P239: KREIG | R239: CLARKE | T239: LITTLE | W239: BOX HILL | X239: 3 | Y239: 1 | Z239: 0 | AA239: 408 | AB239: 331 | AC239: =(AA239/AB239)*100 -> 123.26283987915407 | AD239: =(X239*4)+(Z239*2) -> 12
D240: 27TH APRIL | J240: WEATHER | W240: WILLIAMSTOWN | X240: 3 | Y240: 1 | Z240: 0 | AA240: 488 | AB240: 411 | AC240: =(AA240/AB240)*100 -> 118.73479318734795 | AD240: =(X240*4)+(Z240*2) -> 12
A241: CARLTON | C241: 4 | D241: 0 | E241: =(C241*6)+D241 -> 24 | G241: 9 | H241: 4 | I241: =(G241*6)+H241 -> 58 | K241: 14 | L241: 5 | M241: =(K241*6)+L241 -> 89 | O241: 15 | P241: 9 | Q241: =(O241*6)+P241 -> 99 | S241: Venue: COBURG | W241: COBURG | X241: 3 | Y241: 1 | Z241: 0 | AA241: 412 | AB241: 370 | AC241: =(AA241/AB241)*100 -> 111.35135135135134 | AD241: =(X241*4)+(Z241*2) -> 12
A242: MURRAY KANGAROOS | C242: 4 | D242: 3 | E242: =(C242*6)+D242 -> 27 | G242: 5 | H242: 4 | I242: =(G242*6)+H242 -> 34 | K242: 8 | L242: 9 | M242: =(K242*6)+L242 -> 57 | O242: 10 | P242: 9 | Q242: =(O242*6)+P242 -> 69 | W242: TASMANIA | X242: 3 | Y242: 1 | Z242: 0 | AA242: 393 | AB242: 354 | AC242: =(AA242/AB242)*100 -> 111.01694915254237 | AD242: =(X242*4)+(Z242*2) -> 12
A243: BEST PLAYERS | W243: WERRIBEE | X243: 3 | Y243: 1 | Z243: 0 | AA243: 386 | AB243: 372 | AC243: =(AA243/AB243)*100 -> 103.76344086021506 | AD243: =(X243*4)+(Z243*2) -> 12
A244: CARLTON | C244: DAVIS | F244: FLETCHER | I244: CAMPBELL | L244: HEDGE | O244: DAVIES | Q244: CHRISTOU
A245: MURRAY KANGAROOS | C245: PETRIE | F245: TEAGUE | I245: RAWLINGS | L245: SINCLAIR | W245: MURRAY KANGAROOS | X245: 2 | Y245: 2 | Z245: 0 | AA245: 396 | AB245: 375 | AC245: =(AA245/AB245)*100 -> 105.6 | AD245: =(X245*4)+(Z245*2) -> 8
A246: GOALKICKERS | P246: SINNOTT | R246: GUTTERSON | W246: CARLTON | X246: 2 | Y246: 2 | Z246: 0 | AA246: 369 | AB246: 351 | AC246: =(AA246/AB246)*100 -> 105.12820512820514 | AD246: =(X246*4)+(Z246*2) -> 8
A247: CARLTON | C247: BEASY 4 | E247: O'KEEFE 2 | G247: WAITE 2 | I247: DAVIES | K247: CRANAGE | M247: FLETCHER | O247: FRANCHINA | R247: BRAY | W247: SPRINGVALE | X247: 2 | Y247: 2 | Z247: 0 | AA247: 373 | AB247: 388 | AC247: =(AA247/AB247)*100 -> 96.134020618556704 | AD247: =(X247*4)+(Z247*2) -> 8
A248: MURRAY KANGAROOS | C248: SINCLAIR 2 | F248: WATT 2 | I248: HARRIS | K248: COOPER | M248: TREGENZA | O248: PRATT | Q248: HALE | R248: SOFI | W248: NORTH BALLARAT | X248: 1 | Y248: 3 | Z248: 0 | AA248: 317 | AB248: 385 | AC248: =(AA248/AB248)*100 -> 82.337662337662337 | AD248: =(X248*4)+(Z248*2) -> 4
W249: NORTHERN BULLANTS | X249: 1 | Y249: 3 | Z249: 0 | AA249: 323 | AB249: 457 | AC249: =(AA249/AB249)*100 -> 70.678336980306341 | AD249: =(X249*4)+(Z249*2) -> 4
A250: WILLIAMSTOWN | C250: 4 | D250: 5 | E250: =(C250*6)+D250 -> 29 | G250: 11 | H250: 8 | I250: =(G250*6)+H250 -> 74 | K250: 19 | L250: 11 | M250: =(K250*6)+L250 -> 125 | O250: 25 | P250: 18 | Q250: =(O250*6)+P250 -> 168 | S250: Venue: WILLIAMSTOWN | W250: ESSENDON | X250: 0 | Y250: 4 | Z250: 0 | AA250: 379 | AB250: 528 | AC250: =(AA250/AB250)*100 -> 71.780303030303031 | AD250: =(X250*4)+(Z250*2) -> 0
A251: ESSENDON | C251: 3 | D251: 5 | E251: =(C251*6)+D251 -> 23 | G251: 6 | H251: 7 | I251: =(G251*6)+H251 -> 43 | K251: 9 | L251: 9 | M251: =(K251*6)+L251 -> 63 | O251: 12 | P251: 11 | Q251: =(O251*6)+P251 -> 83 | W251: FRANKSTON | X251: 0 | Y251: 4 | Z251: 0 | AA251: 264 | AB251: 415 | AC251: =(AA251/AB251)*100 -> 63.614457831325296 | AD251: =(X251*4)+(Z251*2) -> 0
A252: BEST PLAYERS | W252: BENDIGO | X252: 0 | Y252: 4 | Z252: 0 | AA252: 296 | AB252: 593 | AC252: =(AA252/AB252)*100 -> 49.915682967959526 | AD252: =(X252*4)+(Z252*2) -> 0
A253: WILLIAMSTOWN | C253: FLETCHER | F253: ADKINS | I253: JOHNSON | L253: O'BREE | N253: LOVETT-MURRAY | R253: SMOKER
A254: ESSENDON | C254: HARVEY | F254: BOLTON | I254: MAHONEY | L254: WALSH
A255: GOALKICKERS | E255: DOOLEY 2 | G255: COLE 2 | J255: KINNEAR | L255: FLETCHER | N255: PODSIADLY | Q255: LLOYD | S255: RICHARDS
A256: WILLIAMSTOWN | C256: ANDERSON 3 | F256: SWAN 3 | H256: SMOKER 2 | J256: O'BREE 2 | L256: PEARCE 2 | N256: LOVETT-MURRAY 2 | R256: JOHNSON 2
A257: ESSENDON | C257: CAREY 3 | F257: HARVEY 2 | I257: MAHONEY 2 | L257: HAYNES 2 | N257: HALL | P257: HOWARS | R257: RUNNELLS
A259: GEELONG | C259: 7 | D259: 4 | E259: =(C259*6)+D259 -> 46 | G259: 13 | H259: 8 | I259: =(G259*6)+H259 -> 86 | K259: 23 | L259: 11 | M259: =(K259*6)+L259 -> 149 | O259: 31 | P259: 17 | Q259: =(O259*6)+P259 -> 203 | S259: Venue: SHELL STADIUM
A260: BENDIGO | C260: 3 | D260: 0 | E260: =(C260*6)+D260 -> 18 | G260: 4 | H260: 3 | I260: =(G260*6)+H260 -> 27 | K260: 6 | L260: 4 | M260: =(K260*6)+L260 -> 40 | O260: 6 | P260: 6 | Q260: =(O260*6)+P260 -> 42
A261: BEST PLAYERS
A262: GEELONG | C262: O'BRIEN | F262: JOHNSON | I262: MENSCH | L262: KELLY | N262: GRGIC | Q262: CHAPMAN
A263: BENDIGO | C263: PROCTOR | F263: COOPER | I263: DOUGHTY
A264: GOALKICKERS | S264: WOOLNOUGH
A265: GEELONG | C265: MENSCH 5 | E265: O'BRIEN 5 | G265: GRGIC 4 | I265: JOHNSON 3 | L265: KELLY 2 | N265: CARRAZZO 2 | Q265: BLACKNEY 2 | T265: PLAYFAIR 2 | W265: RAHILLY 2 | X265: CHAPMAN | AA265: GARDINER | AC265: McGRATH
A266: BENDIGO | C266: DOUGHTY 3 | F266: COOPER 2 | I266: PROCTOR
D267: 28TH APRIL | J267: WEATHER
A268: NORTH BALLARAT | C268: 3 | D268: 2 | E268: =(C268*6)+D268 -> 20 | G268: 7 | H268: 3 | I268: =(G268*6)+H268 -> 45 | K268: 10 | L268: 4 | M268: =(K268*6)+L268 -> 64 | O268: 14 | P268: 6 | Q268: =(O268*6)+P268 -> 90 | S268: Venue: PRESTON
A269: NORTHERN BULLANTS | C269: 1 | D269: 3 | E269: =(C269*6)+D269 -> 9 | G269: 4 | H269: 5 | I269: =(G269*6)+H269 -> 29 | K269: 7 | L269: 7 | M269: =(K269*6)+L269 -> 49 | O269: 11 | P269: 8 | Q269: =(O269*6)+P269 -> 74
A270: BEST PLAYERS
A271: NORTH BALLARAT | C271: GREIG | F271: CLAYTON | I271: FIELD | K271: JENKINS | N271: LUBEEK | Q271: DAWES
A272: NORTHERN BULLANTS | C272: RAMSAY | F272: HOOPER | I272: ZORZI | K272: GROSSMAN | N272: WALSH
A273: GOALKICKERS
A274: NORTH BALLARAT | C274: SPOLDING 2 | F274: BRADLY 2 | I274: GREIG 2 | K274: CLAYTON 2 | N274: McMAHON 2 | Q274: SULLIVAN | S274: BEST | U274: FIELD | W274: JENKINS
A275: NORTHERN BULLANTS | C275: WALSH 5 | F275: GRAINGER 2 | I275: PENN 2 | K275: HOOPER | M275: FAVRIN
A277: COBURG | C277: 6 | D277: 2 | E277: =(C277*6)+D277 -> 38 | G277: 12 | H277: 3 | I277: =(G277*6)+H277 -> 75 | K277: 15 | L277: 6 | M277: =(K277*6)+L277 -> 96 | O277: 16 | P277: 9 | Q277: =(O277*6)+P277 -> 105 | S277: Venue: COBURG
A278: BOX HILL | C278: 3 | D278: 4 | E278: =(C278*6)+D278 -> 22 | G278: 8 | H278: 5 | I278: =(G278*6)+H278 -> 53 | K278: 9 | L278: 9 | M278: =(K278*6)+L278 -> 63 | O278: 13 | P278: 14 | Q278: =(O278*6)+P278 -> 92
A279: BEST PLAYERS
A280: COBURG | C280: PETTIFER | F280: EDNIE | I280: McGRATH | L280: TAYLOR | N280: MILLS | Q280: BUTLER
A281: BOX HILL | C281: JOHNSON | F281: STONE | I281: BREWER | L281: COLLINS | N281: PASSADOR | Q281: GREENE
A282: GOALKICKERS
A283: COBURG | C283: McGRATH 5 | F283: PETTIFER 4 | I283: FARMER 3 | L283: CARLSON 2 | O283: HART | Q283: TAYLOR
A284: BOX HILL | C284: PASSADOR 4 | F284: BREWER 3 | I284: WILLIAMS 2 | L284: ALLEWAY | N284: COLLINS | P284: GREENE | R284: JOHNSON
A286: PORT MELBOURNE | C286: 1 | D286: 3 | E286: =(C286*6)+D286 -> 9 | G286: 4 | H286: 8 | I286: =(G286*6)+H286 -> 32 | K286: 10 | L286: 12 | M286: =(K286*6)+L286 -> 72 | O286: 14 | P286: 15 | Q286: =(O286*6)+P286 -> 99 | S286: Venue: PORT MELBOURNE
A287: SPRINGVALE | C287: 2 | D287: 7 | E287: =(C287*6)+D287 -> 19 | G287: 4 | H287: 9 | I287: =(G287*6)+H287 -> 33 | K287: 8 | L287: 12 | M287: =(K287*6)+L287 -> 60 | O287: 11 | P287: 15 | Q287: =(O287*6)+P287 -> 81
A288: BEST PLAYERS
A289: PORT MELBOURNE | C289: SUNDQUIST | F289: ANSTEY | I289: BROCKMAN | L289: KENNELLY | N289: DELUCA | Q289: EVANS
A290: SPRINGVALE | C290: PLAPP | F290: MAGUIRE | I290: CARROLL | L290: HARRISON | N290: DAVIS
A291: GOALKICKERS
A292: PORT MELBOURNE | C292: R ABLETT 3 | F292: SUNDQUIST 2 | I292: BUCHANAN 2 | L292: FILANDIA 2 | O292: ALOI 2 | Q292: ANSTEY | S292: O'KEEFE | V292: O'LOUGHLIN
A293: SPRINGVALE | C293: PLAPP 5 | F293: SMITH 2 | I293: HOULIHAN | L293: MONTAGNA | O293: DAVIS | Q293: CRANSTON
A295: WERRIBEE | C295: 7 | D295: 3 | E295: =(C295*6)+D295 -> 45 | G295: 9 | H295: 8 | I295: =(G295*6)+H295 -> 62 | K295: 10 | L295: 12 | M295: =(K295*6)+L295 -> 72 | O295: 11 | P295: 17 | Q295: =(O295*6)+P295 -> 83 | S295: Venue: BEACH ROAD
A296: SANDRINGHAM | C296: 3 | D296: 2 | E296: =(C296*6)+D296 -> 20 | G296: 7 | H296: 3 | I296: =(G296*6)+H296 -> 45 | K296: 8 | L296: 7 | M296: =(K296*6)+L296 -> 55 | O296: 11 | P296: 14 | Q296: =(O296*6)+P296 -> 80
A297: BEST PLAYERS
A298: WERRIBEE | C298: HARGREAVE | F298: JAMES | I298: SAUNDERS | L298: LAMB | N298: DYER | Q298: SMITH
A299: SANDRINGHAM | C299: THOMPSON | F299: TREGEAR | I299: BRYAN | L299: GODFREY | N299: LAMB | Q299: HAYWARD
A300: GOALKICKERS
A301: WERRIBEE | C301: WIGGINS 3 | F301: MITCHELL 2 | I301: SAUNDERS 2 | L301: DYER | N301: LAMB | P301: CHURCHILL | S301: HAHN
A302: SANDRINGHAM | C302: ROBERTSON 3 | F302: TEMPLETON 2 | I302: GODFREY 2 | L302: THOMPSON 2 | O302: COGHLAN | Q302: OAKLEY
A304: ROUND 5 | D304: 4TH MAY | J304: WEATHER
D305: 1ST QTR | H305: 2ND QTR | L305: 3RD QTR | P305: FINAL | S305: Venue: WILLIAMSTOWN
A306: SPRINGVALE | C306: 3 | D306: 4 | E306: =(C306*6)+D306 -> 22 | G306: 5 | H306: 7 | I306: =(G306*6)+H306 -> 37 | K306: 8 | L306: 12 | M306: =(K306*6)+L306 -> 60 | O306: 12 | P306: 14 | Q306: =(O306*6)+P306 -> 86 | S306: UMPIRES | Y306: LADDER | AB306: ROUND | AD306: 5
A307: WILLIAMSTOWN | C307: 1 | D307: 6 | E307: =(C307*6)+D307 -> 12 | G307: 4 | H307: 8 | I307: =(G307*6)+H307 -> 32 | K307: 6 | L307: 11 | M307: =(K307*6)+L307 -> 47 | O307: 10 | P307: 17 | Q307: =(O307*6)+P307 -> 77
A308: BEST PLAYERS | W308: TEAM | X308: W | Y308: L | Z308: D | AA308: FOR | AB308: AGST | AC308: % | AD308: PTS
A309: SPRINGVALE | C309: CRANSTON | F309: HARRISON | I309: O'BRIEN | L309: DAVIS | O309: CARROLL | R309: SCHWARZE
A310: WILLIAMSTOWN | C310: PODSIADLY | F310: RIPPON | I310: ANDERSON | L310: SCOTLAND | O310: KINNEAR | R310: FLETCHER | W310: GEELONG | X310: 4 | Y310: 1 | Z310: 0 | AA310: 603 | AB310: 346 | AC310: =(AA310/AB310)*100 -> 174.27745664739885 | AD310: =(X310*4)+(Z310*2) -> 16
A311: GOALKICKERS | W311: SANDRINGHAM | X311: 4 | Y311: 1 | Z311: 0 | AA311: 529 | AB311: 388 | AC311: =(AA311/AB311)*100 -> 136.34020618556701 | AD311: =(X311*4)+(Z311*2) -> 16
A312: SPRINGVALE | C312: SMITH 3 | F312: O'BRIEN 2 | I312: J HOULIHAN 2 | L312: DAVIS 2 | N312: DEHEY | P312: SCHWARZE | R312: CRANSTON | W312: BOX HILL | X312: 4 | Y312: 1 | Z312: 0 | AA312: 553 | AB312: 447 | AC312: =(AA312/AB312)*100 -> 123.71364653243847 | AD312: =(X312*4)+(Z312*2) -> 16
A313: WILLIAMSTOWN | C313: COLE 2 | E313: DE ANGELIS 2 | H313: LLOYD | J313: SMOKER | L313: KINNEAR | N313: SWAN | P313: PODSIADLY | R313: SCOTLAND | W313: COBURG | X313: 4 | Y313: 1 | Z313: 0 | AA313: 541 | AB313: 449 | AC313: =(AA313/AB313)*100 -> 120.48997772828507 | AD313: =(X313*4)+(Z313*2) -> 16
W314: WERRIBEE | X314: 4 | Y314: 1 | Z314: 0 | AA314: 490 | AB314: 427 | AC314: =(AA314/AB314)*100 -> 114.75409836065573 | AD314: =(X314*4)+(Z314*2) -> 16
A315: COBURG | C315: 3 | D315: 6 | E315: =(C315*6)+D315 -> 24 | G315: 10 | H315: 9 | I315: =(G315*6)+H315 -> 69 | K315: 15 | L315: 11 | M315: =(K315*6)+L315 -> 101 | O315: 19 | P315: 15 | Q315: =(O315*6)+P315 -> 129 | S315: Venue: NORTH HOBART OVAL | W315: WILLIAMSTOWN | X315: 3 | Y315: 2 | Z315: 0 | AA315: 565 | AB315: 497 | AC315: =(AA315/AB315)*100 -> 113.68209255533199 | AD315: =(X315*4)+(Z315*2) -> 12
A316: TASMANIA | C316: 6 | D316: 0 | E316: =(C316*6)+D316 -> 36 | G316: 8 | H316: 2 | I316: =(G316*6)+H316 -> 50 | K316: 10 | L316: 6 | M316: =(K316*6)+L316 -> 66 | O316: 12 | P316: 7 | Q316: =(O316*6)+P316 -> 79 | W316: PORT MELBOURNE | X316: 3 | Y316: 2 | Z316: 0 | AA316: 487 | AB316: 444 | AC316: =(AA316/AB316)*100 -> 109.68468468468468 | AD316: =(X316*4)+(Z316*2) -> 12
A317: BEST PLAYERS | W317: SPRINGVALE | X317: 3 | Y317: 2 | Z317: 0 | AA317: 459 | AB317: 465 | AC317: =(AA317/AB317)*100 -> 98.709677419354833 | AD317: =(X317*4)+(Z317*2) -> 12
A318: COBURG | C318: D KELLAWAY | F318: ROGERS | I318: DEPASQUALE | L318: BIDDISCOMBE | O318: PAGAN | Q318: KRAKOUER
A319: TASMANIA | C319: HOWARD | F319: BOLTON | I319: WALKER | L319: THURLEY | W319: TASMANIA | X319: 3 | Y319: 2 | Z319: 0 | AA319: 472 | AB319: 483 | AC319: =(AA319/AB319)*100 -> 97.722567287784685 | AD319: =(X319*4)+(Z319*2) -> 12
A320: GOALKICKERS | O320: NEWMAN | Q320: DE PASQUALE | W320: MURRAY KANGAROOS | X320: 2 | Y320: 3 | Z320: 0 | AA320: 512 | AB320: 520 | AC320: =(AA320/AB320)*100 -> 98.461538461538467 | AD320: =(X320*4)+(Z320*2) -> 8
A321: COBURG | C321: POYAS 3 | E321: McGRATH 3 | H321: HART 3 | J321: KRAKOUER 3 | M321: TAYLOR 2 | O321: ROGERS | Q321: CARLSON | S321: CARLYLE | W321: CARLTON | X321: 2 | Y321: 3 | Z321: 0 | AA321: 424 | AB321: 455 | AC321: =(AA321/AB321)*100 -> 93.186813186813183 | AD321: =(X321*4)+(Z321*2) -> 8
A322: TASMANIA | C322: HEATLEY 4 | F322: DERBYSHIRE 2 | I322: B GEAPPEN 2 | L322: CALLINAN | O322: BEAMS | Q322: BLIGHT | S322: BOLTON | W322: NORTH BALLARAT | X322: 2 | Y322: 3 | Z322: 0 | AA322: 415 | AB322: 474 | AC322: =(AA322/AB322)*100 -> 87.552742616033754 | AD322: =(X322*4)+(Z322*2) -> 8
D323: 5TH MAY | J323: WEATHER | W323: ESSENDON | X323: 1 | Y323: 4 | Z323: 0 | AA323: 558 | AB323: 604 | AC323: =(AA323/AB323)*100 -> 92.384105960264904 | AD323: =(X323*4)+(Z323*2) -> 4
A324: ESSENDON | C324: 6 | D324: 6 | E324: =(C324*6)+D324 -> 42 | G324: 15 | H324: 7 | I324: =(G324*6)+H324 -> 97 | K324: 25 | L324: 13 | M324: =(K324*6)+L324 -> 163 | O324: 27 | P324: 17 | Q324: =(O324*6)+P324 -> 179 | S324: Venue: BENDIGO | W324: NORTHERN BULLANTS | X324: 1 | Y324: 4 | Z324: 0 | AA324: 402 | AB324: 552 | AC324: =(AA324/AB324)*100 -> 72.826086956521735 | AD324: =(X324*4)+(Z324*2) -> 4
A325: BENDIGO | C325: 3 | D325: 1 | E325: =(C325*6)+D325 -> 19 | G325: 5 | H325: 5 | I325: =(G325*6)+H325 -> 35 | K325: 6 | L325: 6 | M325: =(K325*6)+L325 -> 42 | O325: 11 | P325: 10 | Q325: =(O325*6)+P325 -> 76 | W325: FRANKSTON | X325: 0 | Y325: 5 | Z325: 0 | AA325: 353 | AB325: 513 | AC325: =(AA325/AB325)*100 -> 68.810916179337227 | AD325: =(X325*4)+(Z325*2) -> 0
A326: BEST PLAYERS | W326: BENDIGO | X326: 0 | Y326: 5 | Z326: 0 | AA326: 372 | AB326: 772 | AC326: =(AA326/AB326)*100 -> 48.186528497409327 | AD326: =(X326*4)+(Z326*2) -> 0
A327: ESSENDON | C327: BANNISTER | F327: MAHONEY | I327: WELSH | L327: DAVIES | O327: REYNOLDS | R327: BOLTON
A328: BENDIGO | C328: CARTER | F328: ELLIOTT | I328: DOUGHTY | L328: ELSUM
A329: GOALKICKERS | N329: HAYNES | P329: BULLEN | R329: REYNOLDS
A330: ESSENDON | C330: BANNISTER 8 | F330: HAWKINS 7 | I330: MAHONEY 3 | L330: BOLTON 2 | N330: RUNNELLS 2 | Q330: DARCY | S330: DAVIES
A331: BENDIGO | C331: DOUGHTY 2 | F331: ELSUM 2 | H331: CAMPBELL 2 | K331: CARTER | M331: CAIL | N331: HAWKINS | Q331: PROCTOR | S331: WHITSED
A333: BOX HILL | C333: 8 | D333: 3 | E333: =(C333*6)+D333 -> 51 | G333: 11 | H333: 4 | I333: =(G333*6)+H333 -> 70 | K333: 16 | L333: 5 | M333: =(K333*6)+L333 -> 101 | O333: 22 | P333: 13 | Q333: =(O333*6)+P333 -> 145 | S333: Venue: BOX HILL
A334: MURRAY KANGAROOS | C334: 4 | D334: 2 | E334: =(C334*6)+D334 -> 26 | G334: 8 | H334: 6 | I334: =(G334*6)+H334 -> 54 | K334: 12 | L334: 9 | M334: =(K334*6)+L334 -> 81 | O334: 17 | P334: 14 | Q334: =(O334*6)+P334 -> 116
A335: BEST PLAYERS
A336: BOX HILL | C336: CLARKE | F336: KANE | I336: MITCHELL | L336: REHN | O336: BALL | R336: GREENE
A337: MURRAY KANGAROOS | C337: TEAGUE | F337: SMITH | I337: SOFI | L337: WATSON | O337: HARDING
A338: GOALKICKERS
A339: BOX HILL | C339: PASSADOR 6 | F339: ELSTONE 3 | I339: NEAGLE 2 | K339: GREENE 2 | M339: WILLIAMS 2 | P339: ALLEWAY | R339: BAYFORD | U339: REHN | W339: GEORGIADIS | X339: BREWER | AA339: JOHNSON | AC339: CLARKE
A340: MURRAY KANGAROOS | C340: LOWCOCK 3 | F340: WATSON 3 | I340: TEAGUE 2 | K340: COOPER | M340: SMITH | O340: SOFI | P340: HALE | Q340: HARDING | S340: LANGE | U340: PETRIE | W340: McLAREN | X340: TRENFIELD
A342: WERRIBEE | C342: 4 | D342: 4 | E342: =(C342*6)+D342 -> 28 | G342: 7 | H342: 7 | I342: =(G342*6)+H342 -> 49 | K342: 9 | L342: 13 | M342: =(K342*6)+L342 -> 67 | O342: 15 | P342: 14 | Q342: =(O342*6)+P342 -> 104 | S342: Venue: WERRIBEE
A343: CARLTON | C343: 1 | D343: 0 | E343: =(C343*6)+D343 -> 6 | G343: 6 | H343: 5 | I343: =(G343*6)+H343 -> 41 | K343: 8 | L343: 7 | M343: =(K343*6)+L343 -> 55 | O343: 8 | P343: 7 | Q343: =(O343*6)+P343 -> 55
A344: BEST PLAYERS
A345: WERRIBEE | C345: ROBERTSON | F345: MITCHELL | I345: CROSS | L345: DYER | N345: FAULKNER | R345: BOWDEN
A346: CARLTON | C346: CAMPBELL | F346: CRANAGE | I346: HEDGE | L346: SMITH | N346: PICKERING
A347: GOALKICKERS
A348: WERRIBEE | C348: MITCHELL 5 | F348: CHURCHILL 2 | I348: RAU 2 | K348: HUNTER 2 | M348: McMAHON | P348: BOYD | R348: PICKEN | T348: POWER
A349: CARLTON | C349: THORNTON 2 | F349: CRANAGE | I349: DAVIS | K349: HEDGE | M349: GUTTERSON | P349: SMITH | R349: WAITE
A351: GEELONG | C351: 4 | D351: 5 | E351: =(C351*6)+D351 -> 29 | G351: 8 | H351: 6 | I351: =(G351*6)+H351 -> 54 | K351: 12 | L351: 9 | M351: =(K351*6)+L351 -> 81 | O351: 14 | P351: 11 | Q351: =(O351*6)+P351 -> 95 | S351: Venue: SHELL STADIUM
A352: NORTHERN BULLANTS | C352: 5 | D352: 5 | E352: =(C352*6)+D352 -> 35 | G352: 8 | H352: 9 | I352: =(G352*6)+H352 -> 57 | K352: 8 | L352: 12 | M352: =(K352*6)+L352 -> 60 | O352: 11 | P352: 13 | Q352: =(O352*6)+P352 -> 79
A353: BEST PLAYERS
A354: GEELONG | C354: MENSCH | F354: POWELL | I354: P CHAPMAN | L354: RAHILLY | N354: GRGIC | Q354: WOOLNOUGH
A355: NORTHERN BULLANTS | C355: CANN | F355: HOOPER | I355: ZORZI | L355: PENN | N355: STEVENSON
A356: GOALKICKERS
A357: GEELONG | C357: MENSCH 4 | F357: P CHAPMAN 2 | I357: GARDINER 2 | L357: O'BRIEN 2 | N357: GRGIC | P357: MERRIMAN | R357: McCARTHY | U357: RAHILLY
A358: NORTHERN BULLANTS | C358: PENN 2 | F358: CANN 2 | I358: FAVRIN | K358: GRAINGER | M358: HOOPER | O358: PILLING | Q358: TAYLOR | S358: WALSH | U358: ZORZI
A360: SANDRINGHAM | C360: 4 | D360: 4 | E360: =(C360*6)+D360 -> 28 | G360: 8 | H360: 11 | I360: =(G360*6)+H360 -> 59 | K360: 11 | L360: 16 | M360: =(K360*6)+L360 -> 82 | O360: 18 | P360: 24 | Q360: =(O360*6)+P360 -> 132 | S360: Venue: BEACH ROAD
A361: PORT MELBOURNE | C361: 7 | D361: 3 | E361: =(C361*6)+D361 -> 45 | G361: 9 | H361: 6 | I361: =(G361*6)+H361 -> 60 | K361: 12 | L361: 9 | M361: =(K361*6)+L361 -> 81 | O361: 13 | P361: 10 | Q361: =(O361*6)+P361 -> 88
A362: BEST PLAYERS
A363: SANDRINGHAM | C363: LIDDELL | F363: ROBERTSON | I363: MILLER | L363: GODFREY | O363: HAYWARD | R363: ROBBINS
A364: PORT MELBOURNE | C364: ABLETT | F364: ANSTEY | I364: BUCHANAN | L364: DELUCA
A365: GOALKICKERS
A366: SANDRINGHAM | C366: ROBERTSON 5 | F366: MILLER 3 | I366: TEMPLETON 2 | L366: SULLIVAN | N366: COGHLAN | P366: AINLEY | R366: WILSON | T366: BREESE | V366: FERRARO | X366: ROBBINS | AA366: LIDDELL
A367: PORT MELBOURNE | C367: ABLETT 5 | F367: BUCHANAN 3 | I367: O'LOUGHLIN 2 | L367: STEVENS | N367: ANSTEY | P367: McGLOWE
A369: NORTH BALLARAT | C369: 5 | D369: 1 | E369: =(C369*6)+D369 -> 31 | G369: 10 | H369: 4 | I369: =(G369*6)+H369 -> 64 | K369: 13 | L369: 6 | M369: =(K369*6)+L369 -> 84 | O369: 15 | P369: 8 | Q369: =(O369*6)+P369 -> 98 | S369: Venue: NORTH BALLARAT
A370: FRANKSTON | C370: 0 | D370: 6 | E370: =(C370*6)+D370 -> 6 | G370: 2 | H370: 7 | I370: =(G370*6)+H370 -> 19 | K370: 10 | L370: 8 | M370: =(K370*6)+L370 -> 68 | O370: 13 | P370: 11 | Q370: =(O370*6)+P370 -> 89
A371: BEST PLAYERS
A372: NORTH BALLARAT | C372: FIELD | F372: PERKINS | I372: JENKINS | L372: BEARDSLEY | O372: CLAYTON | R372: BROWN
A373: FRANKSTON | C373: ABLETT | F373: LITTLE | I373: BURGMAN
A374: GOALKICKERS
A375: NORTH BALLARAT | C375: JENKINS 2 | E375: BRADY 2 | G375: CLAYTON 2 | J375: BEARDSLEY | M375: COHEN | O375: DAWES | Q375: FIELD | S375: FRITH | U375: KING | W375: PERKINS | X375: SPOLDING | AA375: SULLIVAN
A376: FRANKSTON | C376: SAUTNER 6 | F376: WILLIS 2 | I376: BURGMAN 2 | L376: ANDERSON | N376: GEORGIOU | Q376: C CLARKE
A378: ROUND 6 | D378: 11TH MAY | J378: WEATHER
D379: 1ST QTR | H379: 2ND QTR | L379: 3RD QTR | P379: FINAL | S379: Venue: OPTUS OVAL
A380: CARLTON | C380: 4 | D380: 4 | E380: =(C380*6)+D380 -> 28 | G380: 10 | H380: 8 | I380: =(G380*6)+H380 -> 68 | K380: 17 | L380: 8 | M380: =(K380*6)+L380 -> 110 | O380: 18 | P380: 12 | Q380: =(O380*6)+P380 -> 120 | S380: UMPIRES | Y380: LADDER | AB380: ROUND | AD380: 6
A381: ESSENDON | C381: 4 | D381: 5 | E381: =(C381*6)+D381 -> 29 | G381: 7 | H381: 6 | I381: =(G381*6)+H381 -> 48 | K381: 10 | L381: 8 | M381: =(K381*6)+L381 -> 68 | O381: 14 | P381: 9 | Q381: =(O381*6)+P381 -> 93
A382: BEST PLAYERS | W382: TEAM | X382: W | Y382: L | Z382: D | AA382: FOR | AB382: AGST | AC382: % | AD382: PTS
A383: CARLTON | C383: CAMPBELL | F383: CRANAGE | I383: DAVIS | L383: DOERING | O383: HEDGE | Q383: O'KEEFE
A384: ESSENDON | C384: MAHONEY | F384: HAYNES | I384: REYNOLDS | L384: McALISTER | W384: BOX HILL | X384: 5 | Y384: 1 | Z384: 0 | AA384: 672 | AB384: 547 | AC384: =(AA384/AB384)*100 -> 122.85191956124315 | AD384: =(X384*4)+(Z384*2) -> 20
A385: GOALKICKERS | O385: BRIGGS | Q385: DAVIS | S385: OGIER | W385: WERRIBEE | X385: 5 | Y385: 1 | Z385: 0 | AA385: 600 | AB385: 502 | AC385: =(AA385/AB385)*100 -> 119.52191235059762 | AD385: =(X385*4)+(Z385*2) -> 20
A386: CARLTON | C386: FEVOLA 3 | E386: GUTTERSON 3 | H386: DOERING 2 | J386: HEDGSE 2 | M386: ROSA 2 | O386: SINNOTT 2 | R386: BRAY | W386: GEELONG | X386: 4 | Y386: 2 | Z386: 0 | AA386: 703 | AB386: 365 | AC386: =(AA386/AB386)*100 -> 192.60273972602738 | AD386: =(X386*4)+(Z386*2) -> 16
A387: ESSENDON | C387: REYNOLDS 3 | F387: MAHONEY 3 | I387: HAWKINS 3 | L387: McALISTER 2 | O387: RUNNALLS | Q387: HAYNES | S387: DARCY | W387: SANDRINGHAM | X387: 4 | Y387: 2 | Z387: 0 | AA387: 609 | AB387: 469 | AC387: =(AA387/AB387)*100 -> 129.85074626865671 | AD387: =(X387*4)+(Z387*2) -> 16
W388: PORT MELBOURNE | X388: 4 | Y388: 2 | Z388: 0 | AA388: 586 | AB388: 502 | AC388: =(AA388/AB388)*100 -> 116.73306772908367 | AD388: =(X388*4)+(Z388*2) -> 16
A389: TASMANIA | C389: 2 | D389: 3 | E389: =(C389*6)+D389 -> 15 | G389: 13 | H389: 6 | I389: =(G389*6)+H389 -> 84 | K389: 20 | L389: 10 | M389: =(K389*6)+L389 -> 130 | O389: 23 | P389: 12 | Q389: =(O389*6)+P389 -> 150 | S389: Venue: BENDIGO | W389: TASMANIA | X389: 4 | Y389: 2 | Z389: 0 | AA389: 622 | AB389: 556 | AC389: =(AA389/AB389)*100 -> 111.87050359712229 | AD389: =(X389*4)+(Z389*2) -> 16
A390: BENDIGO | C390: 5 | D390: 4 | E390: =(C390*6)+D390 -> 34 | G390: 6 | H390: 4 | I390: =(G390*6)+H390 -> 40 | K390: 9 | L390: 6 | M390: =(K390*6)+L390 -> 60 | O390: 11 | P390: 7 | Q390: =(O390*6)+P390 -> 73 | W390: COBURG | X390: 4 | Y390: 2 | Z390: 0 | AA390: 599 | AB390: 548 | AC390: =(AA390/AB390)*100 -> 109.30656934306569 | AD390: =(X390*4)+(Z390*2) -> 16
A391: BEST PLAYERS | W391: SPRINGVALE | X391: 4 | Y391: 2 | Z391: 0 | AA391: 540 | AB391: 545 | AC391: =(AA391/AB391)*100 -> 99.082568807339456 | AD391: =(X391*4)+(Z391*2) -> 16
A392: TASMANIA | C392: ATKIN | F392: THURLEY | I392: WALKER | L392: HOWARD | O392: JONES | R392: BLIGHT
A393: BENDIGO | C393: M BRADLY | F393: CARTER | I393: B BRADLEY | L393: BOVALINO | O393: CAMPBELL | W393: WILLIAMSTOWN | X393: 3 | Y393: 3 | Z393: 0 | AA393: 640 | AB393: 607 | AC393: =(AA393/AB393)*100 -> 105.43657331136738 | AD393: =(X393*4)+(Z393*2) -> 12
A394: GOALKICKERS | K394: ABBEY | M394: BOLTON | O394: CALLINAN | R394: DERBYSHIRE | W394: MURRAY KANGAROOS | X394: 3 | Y394: 3 | Z394: 0 | AA394: 639 | AB394: 615 | AC394: =(AA394/AB394)*100 -> 103.90243902439025 | AD394: =(X394*4)+(Z394*2) -> 12
A395: TASMANIA | C395: HEATLEY 6 | F395: WALKER 3 | I395: GEAPPEN 3 | L395: JONES 2 | N395: BEAMS 2 | Q395: WAGER 2 | S395: ATKIN | W395: CARLTON | X395: 3 | Y395: 3 | Z395: 0 | AA395: 544 | AB395: 548 | AC395: =(AA395/AB395)*100 -> 99.270072992700733 | AD395: =(X395*4)+(Z395*2) -> 12
A396: BENDIGO | C396: BROWN 4 | F396: CARTER 2 | I396: BOVALINO | K396: CAIL | M396: CAMPBELL | O396: HAWKINS | Q396: McNAMARA | T396: VANCE | W396: NORTH BALLARAT | X396: 2 | Y396: 4 | Z396: 0 | AA396: 510 | AB396: 601 | AC396: =(AA396/AB396)*100 -> 84.858569051580702 | AD396: =(X396*4)+(Z396*2) -> 8
W397: NORTHERN BULLANTS | X397: 2 | Y397: 4 | Z397: 0 | AA397: 534 | AB397: 630 | AC397: =(AA397/AB397)*100 -> 84.761904761904759 | AD397: =(X397*4)+(Z397*2) -> 8
A398: SPRINGVALE | C398: 3 | D398: 5 | E398: =(C398*6)+D398 -> 23 | G398: 8 | H398: 10 | I398: =(G398*6)+H398 -> 58 | K398: 10 | L398: 10 | M398: =(K398*6)+L398 -> 70 | O398: 11 | P398: 15 | Q398: =(O398*6)+P398 -> 81 | S398: Venue: BEACH ROAD | W398: ESSENDON | X398: 1 | Y398: 5 | Z398: 0 | AA398: 651 | AB398: 724 | AC398: =(AA398/AB398)*100 -> 89.917127071823202 | AD398: =(X398*4)+(Z398*2) -> 4
A399: SANDRINGHAM | C399: 2 | D399: 2 | E399: =(C399*6)+D399 -> 14 | G399: 3 | H399: 4 | I399: =(G399*6)+H399 -> 22 | K399: 8 | L399: 5 | M399: =(K399*6)+L399 -> 53 | O399: 12 | P399: 8 | Q399: =(O399*6)+P399 -> 80 | W399: FRANKSTON | X399: 0 | Y399: 6 | Z399: 0 | AA399: 431 | AB399: 645 | AC399: =(AA399/AB399)*100 -> 66.821705426356587 | AD399: =(X399*4)+(Z399*2) -> 0
A400: BEST PLAYERS | W400: BENDIGO | X400: 0 | Y400: 6 | Z400: 0 | AA400: 445 | AB400: 922 | AC400: =(AA400/AB400)*100 -> 48.264642082429496 | AD400: =(X400*4)+(Z400*2) -> 0
A401: SPRINGVALE | C401: HARRISON | F401: CARROLL | I401: PLAPP | L401: O'BRIEN | O401: CAPLES
A402: SANDRINGHAM | C402: FEBEY | F402: FERRARO | I402: AINLEY | L402: ROBBINS | O402: SULLIVAN | R402: OAKLEY
A403: GOALKICKERS
A404: SPRINGVALE | C404: PLAPP 4 | F404: PITT 2 | H404: HOULIHAN | K404: HARRISON | M404: McGUIRE | O404: O'BRIEN | Q404: MONTAGNA
A405: SANDRINGHAM | C405: OAKLEY 3 | F405: TEMPLETON 2 | I405: BREESE 2 | K405: COGHLAN | M405: HAYWARD | O405: TRELOAR | Q405: ROBBINS | S405: SULLIVAN
A407: WERRIBEE | C407: 6 | D407: 5 | E407: =(C407*6)+D407 -> 41 | G407: 8 | H407: 8 | I407: =(G407*6)+H407 -> 56 | K407: 11 | L407: 11 | M407: =(K407*6)+L407 -> 77 | O407: 16 | P407: 14 | Q407: =(O407*6)+P407 -> 110 | S407: Venue: WILLIAMSTOWN
A408: WILLIAMSTOWN | C408: 1 | D408: 2 | E408: =(C408*6)+D408 -> 8 | G408: 7 | H408: 4 | I408: =(G408*6)+H408 -> 46 | K408: 9 | L408: 7 | M408: =(K408*6)+L408 -> 61 | O408: 11 | P408: 9 | Q408: =(O408*6)+P408 -> 75
A409: BEST PLAYERS
A410: WERRIBEE | C410: MITCHELL | F410: CROSS | I410: ROBERTSON | L410: McMAHON | O410: HARGREAVE | R410: CHURCHILL
A411: WILLIAMSTOWN | C411: DOOLEY | F411: PEARCE | I411: LLOYD | L411: SCOTLAND | O411: WEST | R411: STEINFORT
A412: GOALKICKERS
A413: WERRIBEE | C413: MITCHELL 8 | F413: RAU 2 | H413: JACK 2 | J413: BOYD | L413: CHURCHILL | O413: COLBERT | Q413: HARGREAVE
A414: WILLIAMSTOWN | C414: SWAN 3 | E414: PODSIADLY 2 | H414: ADKINS | J414: ANDERSON | M414: DOOLEY | O414: FLETCHER | Q414: PEARCE | S414: SCOTLAND
D415: 12TH MAY | J415: WEATHER
A416: NORTHERN BULLANTS | C416: 5 | D416: 6 | E416: =(C416*6)+D416 -> 36 | G416: 6 | H416: 7 | I416: =(G416*6)+H416 -> 43 | K416: 16 | L416: 11 | M416: =(K416*6)+L416 -> 107 | O416: 20 | P416: 12 | Q416: =(O416*6)+P416 -> 132 | S416: Venue: FRANKSTON
A417: FRANKSTON | C417: 0 | D417: 3 | E417: =(C417*6)+D417 -> 3 | G417: 7 | H417: 6 | I417: =(G417*6)+H417 -> 48 | K417: 8 | L417: 8 | M417: =(K417*6)+L417 -> 56 | O417: 11 | P417: 12 | Q417: =(O417*6)+P417 -> 78
A418: BEST PLAYERS
A419: NORTHERN BULLANTS | C419: COLLINS | F419: STEVENSON | I419: HOOPER | L419: PATERSON | O419: TAYLOR | Q419: PENN
A420: FRANKSTON | C420: LITTLE | F420: C CLARKE | I420: FRATER | L420: SAUTNER
A421: GOALKICKERS
A422: NORTHERN BULLANTS | C422: FAVRIN 3 | F422: GRAINGER 3 | I422: PATERSON 3 | L422: WATSON 3 | N422: PILLING 2 | Q422: WALSH 2 | S422: CANN | U422: REID | W422: HOOPER | X422: ZORZI
A423: FRANKSTON | C423: SAUTNER 5 | F423: SALISBURY 2 | I423: WILLIS | K423: KREIG | M423: CADD | O423: D CLARKE
A425: MURRAY KANGAROOS | C425: 7 | D425: 6 | E425: =(C425*6)+D425 -> 48 | G425: 9 | H425: 8 | I425: =(G425*6)+H425 -> 62 | K425: 15 | L425: 12 | M425: =(K425*6)+L425 -> 102 | O425: 18 | P425: 19 | Q425: =(O425*6)+P425 -> 127 | S425: Venue: COBURG
A426: NORTH BALLARAT | C426: 5 | D426: 0 | E426: =(C426*6)+D426 -> 30 | G426: 7 | H426: 5 | I426: =(G426*6)+H426 -> 47 | K426: 12 | L426: 5 | M426: =(K426*6)+L426 -> 77 | O426: 15 | P426: 5 | Q426: =(O426*6)+P426 -> 95
A427: BEST PLAYERS
A428: MURRAY KANGAROOS | C428: CROWE | F428: HAMS | I428: LOWCOCK | L428: SMITH | O428: LANGE
A429: NORTH BALLARAT | C429: KING | F429: CLAYTON | I429: FRITH | L429: GREIG | O429: BROWN
A430: GOALKICKERS
A431: MURRAY KANGAROOS | C431: HARRIS 4 | E431: LOWCOCK 3 | H431: LANGE 2 | J431: PETRIE 2 | L431: SINCLAIR 2 | N431: WATSON 2 | Q431: HALE | S431: SMITH | U431: SOFI
A432: NORTH BALLARAT | C432: FRITH 3 | E432: SPOLDING 3 | H432: SULLIVAN 2 | K432: BRADLY 2 | M432: CLAYTON | O432: DAWES | Q432: GREIG | S432: McCORKELL | V432: McMAHON
A434: BOX HILL | C434: 4 | D434: 4 | E434: =(C434*6)+D434 -> 28 | G434: 7 | H434: 9 | I434: =(G434*6)+H434 -> 51 | K434: 14 | L434: 11 | M434: =(K434*6)+L434 -> 95 | O434: 18 | P434: 11 | Q434: =(O434*6)+P434 -> 119 | S434: Venue: BOX HILL
A435: GEELONG | C435: 5 | D435: 2 | E435: =(C435*6)+D435 -> 32 | G435: 9 | H435: 4 | I435: =(G435*6)+H435 -> 58 | K435: 12 | L435: 7 | M435: =(K435*6)+L435 -> 79 | O435: 15 | P435: 10 | Q435: =(O435*6)+P435 -> 100
A436: BEST PLAYERS
A437: BOX HILL | C437: MITCHELL | F437: FIRRITO | I437: KANE | K437: CLARKE | N437: BALL | Q437: PASSADOR
A438: GEELONG | C438: MENSCH | F438: KELLY | I438: STREET | K438: P CHAPMAN | N438: RAHILLY | Q438: GRGIC
A439: GOALKICKERS
A440: BOX HILL | C440: PASSADOR 5 | F440: WILLIAMS 4 | I440: BAYFORD 3 | L440: ALLEWAY | N440: CLARKE | P440: ELSTONE | R440: GREENE | T440: LONIE | V440: NEAGLE
A441: GEELONG | C441: MENSCH 5 | F441: P CHAPMAN 3 | I441: KELLY 2 | K441: McCARTHY 2 | N441: CARRAZZO | Q441: O'BRIEN | S441: PLAYFAIR
A443: PORT MELBOURNE | C443: 3 | D443: 3 | E443: =(C443*6)+D443 -> 21 | G443: 8 | H443: 4 | I443: =(G443*6)+H443 -> 52 | K443: 11 | L443: 9 | M443: =(K443*6)+L443 -> 75 | O443: 14 | P443: 15 | Q443: =(O443*6)+P443 -> 99 | S443: Venue: PORT MELBOURNE
A444: COBURG | C444: 1 | D444: 1 | E444: =(C444*6)+D444 -> 7 | G444: 7 | H444: 2 | I444: =(G444*6)+H444 -> 44 | K444: 7 | L444: 3 | M444: =(K444*6)+L444 -> 45 | O444: 8 | P444: 10 | Q444: =(O444*6)+P444 -> 58
A445: BEST PLAYERS
A446: PORT MELBOURNE | C446: BROCKMAN | F446: WARFE | I446: ROSE | K446: ABLETT | N446: McMAHON | Q446: COTCHETT
A447: COBURG | C447: NEWMAN | F447: CARLSON | I447: HYDE | K447: MILLER | N447: PAGAN
A448: GOALKICKERS
A449: PORT MELBOURNE | C449: ABLETT 6 | F449: STEVENS 4 | I449: ALOI | J449: EVANS | L449: GILL | M449: MILHUISEN
A450: COBURG | C450: POYAS 2 | F450: McGRATH 2 | I450: CARLSON | K450: FARMER | M450: MAGGIORE | P450: TAYLOR
A452: ROUND 7 | D452: 18TH MAY | J452: WEATHER
D453: 1ST QTR | H453: 2ND QTR | L453: 3RD QTR | P453: FINAL | S453: Venue: OPTUS OVAL
A454: BOX HILL | C454: 3 | D454: 6 | E454: =(C454*6)+D454 -> 24 | G454: 10 | H454: 9 | I454: =(G454*6)+H454 -> 69 | K454: 15 | L454: 12 | M454: =(K454*6)+L454 -> 102 | O454: 18 | P454: 15 | Q454: =(O454*6)+P454 -> 123 | S454: UMPIRES | Y454: LADDER | AB454: ROUND | AD454: 7
A455: CARLTON | C455: 1 | D455: 1 | E455: =(C455*6)+D455 -> 7 | G455: 5 | H455: 7 | I455: =(G455*6)+H455 -> 37 | K455: 7 | L455: 9 | M455: =(K455*6)+L455 -> 51 | O455: 9 | P455: 10 | Q455: =(O455*6)+P455 -> 64
A456: BEST PLAYERS | W456: TEAM | X456: W | Y456: L | Z456: D | AA456: FOR | AB456: AGST | AC456: % | AD456: PTS
A457: BOX HILL | C457: CLARKE | F457: FIRRITO | I457: BANKS | L457: COLLINS | O457: GREENE | R457: LONIE
A458: CARLTON | C458: SINNOTT | F458: DAVIS | I458: ROSA | W458: BOX HILL | X458: 6 | Y458: 1 | Z458: 0 | AA458: 795 | AB458: 611 | AC458: =(AA458/AB458)*100 -> 130.11456628477904 | AD458: =(X458*4)+(Z458*2) -> 24
A459: GOALKICKERS | K459: GEORGIADIS | N459: OSBORNE | P459: JOHNSON | R459: KANE | W459: GEELONG | X459: 5 | Y459: 2 | Z459: 0 | AA459: 843 | AB459: 439 | AC459: =(AA459/AB459)*100 -> 192.02733485193622 | AD459: =(X459*4)+(Z459*2) -> 20
A460: BOX HILL | C460: WILLIAMS 5 | F460: PASSADOR 4 | I460: BREWER 3 | L460: ELSTONE | N460: FIRRITO | P460: HEENAN | R460: GREENE | W460: SANDRINGHAM | X460: 5 | Y460: 2 | Z460: 0 | AA460: 751 | AB460: 507 | AC460: =(AA460/AB460)*100 -> 148.12623274161737 | AD460: =(X460*4)+(Z460*2) -> 20
A461: CARLTON | C461: MERRINGTON 2 | F461: SINNOTT 2 | I461: GUTTERSON | L461: OGIER | N461: FLEMING | P461: PRENDERGAST | S461: ROSA | W461: PORT MELBOURNE | X461: 5 | Y461: 2 | Z461: 0 | AA461: 676 | AB461: 582 | AC461: =(AA461/AB461)*100 -> 116.15120274914091 | AD461: =(X461*4)+(Z461*2) -> 20
W462: WERRIBEE | X462: 5 | Y462: 2 | Z462: 0 | AA462: 680 | AB462: 592 | AC462: =(AA462/AB462)*100 -> 114.86486486486487 | AD462: =(X462*4)+(Z462*2) -> 20
A463: PORT MELBOURNE | C463: 2 | D463: 3 | E463: =(C463*6)+D463 -> 15 | G463: 4 | H463: 4 | I463: =(G463*6)+H463 -> 28 | K463: 10 | L463: 8 | M463: =(K463*6)+L463 -> 68 | O463: 13 | P463: 12 | Q463: =(O463*6)+P463 -> 90 | S463: Venue: PORT MELBOURNE | W463: COBURG | X463: 5 | Y463: 2 | Z463: 0 | AA463: 675 | AB463: 600 | AC463: =(AA463/AB463)*100 -> 112.5 | AD463: =(X463*4)+(Z463*2) -> 20
A464: WERRIBEE | C464: 4 | D464: 3 | E464: =(C464*6)+D464 -> 27 | G464: 11 | H464: 4 | I464: =(G464*6)+H464 -> 70 | K464: 11 | L464: 6 | M464: =(K464*6)+L464 -> 72 | O464: 12 | P464: 8 | Q464: =(O464*6)+P464 -> 80 | W464: WILLIAMSTOWN | X464: 4 | Y464: 3 | Z464: 0 | AA464: 760 | AB464: 687 | AC464: =(AA464/AB464)*100 -> 110.62590975254732 | AD464: =(X464*4)+(Z464*2) -> 16
A465: BEST PLAYERS | W465: MURRAY KANGAROOS | X465: 4 | Y465: 3 | Z465: 0 | AA465: 738 | AB465: 683 | AC465: =(AA465/AB465)*100 -> 108.05270863836019 | AD465: =(X465*4)+(Z465*2) -> 16
A466: PORT MELBOURNE | C466: BENNETT | F466: ROSE | I466: WARFE | L466: COTCHETT | O466: BROCKMAN | R466: LOCKETT
A467: WERRIBEE | C467: ROBERTSON | F467: JACK | I467: PICKEN | L467: SMITH | O467: CROSS | R467: BOYD | W467: TASMANIA | X467: 4 | Y467: 3 | Z467: 0 | AA467: 690 | AB467: 655 | AC467: =(AA467/AB467)*100 -> 105.34351145038168 | AD467: =(X467*4)+(Z467*2) -> 16
A468: GOALKICKERS | W468: SPRINGVALE | X468: 4 | Y468: 3 | Z468: 0 | AA468: 592 | AB468: 648 | AC468: =(AA468/AB468)*100 -> 91.358024691358025 | AD468: =(X468*4)+(Z468*2) -> 16
A469: PORT MELBOURNE | C469: LOCKETT 4 | F469: BENNETT 3 | I469: BUCHANAN 2 | L469: ALEXANDER | O469: DAFFEY | Q469: O'LOUGHLIN | T469: STEVENS | W469: CARLTON | X469: 3 | Y469: 4 | Z469: 0 | AA469: 608 | AB469: 671 | AC469: =(AA469/AB469)*100 -> 90.611028315946356 | AD469: =(X469*4)+(Z469*2) -> 12
A470: WERRIBEE | C470: BOYD 2 | E470: MITCHELL 2 | H470: WIGGINS 2 | J470: CHURCHILL | M470: FITZPATRICK | P470: LAMB | R470: JACK | T470: PICKEN | W470: ESSENDON | X470: 2 | Y470: 5 | Z470: 0 | AA470: 754 | AB470: 776 | AC470: =(AA470/AB470)*100 -> 97.164948453608247 | AD470: =(X470*4)+(Z470*2) -> 8
O471: RAU | W471: NORTH BALLARAT | X471: 2 | Y471: 5 | Z471: 0 | AA471: 562 | AB471: 677 | AC471: =(AA471/AB471)*100 -> 83.013293943870011 | AD471: =(X471*4)+(Z471*2) -> 8
A472: ESSENDON | C472: 1 | D472: 4 | E472: =(C472*6)+D472 -> 10 | G472: 7 | H472: 6 | I472: =(G472*6)+H472 -> 48 | K472: 9 | L472: 9 | M472: =(K472*6)+L472 -> 63 | O472: 15 | P472: 13 | Q472: =(O472*6)+P472 -> 103 | S472: Venue: SHEPLEY OVAL | W472: NORTHERN BULLANTS | X472: 2 | Y472: 5 | Z472: 0 | AA472: 614 | AB472: 750 | AC472: =(AA472/AB472)*100 -> 81.86666666666666 | AD472: =(X472*4)+(Z472*2) -> 8
A473: SPRINGVALE | C473: 1 | D473: 1 | E473: =(C473*6)+D473 -> 7 | G473: 1 | H473: 1 | I473: =(G473*6)+H473 -> 7 | K473: 5 | L473: 9 | M473: =(K473*6)+L473 -> 39 | O473: 7 | P473: 10 | Q473: =(O473*6)+P473 -> 52 | W473: FRANKSTON | X473: 0 | Y473: 7 | Z473: 0 | AA473: 505 | AB473: 785 | AC473: =(AA473/AB473)*100 -> 64.331210191082803 | AD473: =(X473*4)+(Z473*2) -> 0
A474: BEST PLAYERS | W474: BENDIGO | X474: 0 | Y474: 7 | Z474: 0 | AA474: 483 | AB474: 1064 | AC474: =(AA474/AB474)*100 -> 45.394736842105267 | AD474: =(X474*4)+(Z474*2) -> 0
A475: ESSENDON | C475: MAHONEY | F475: HALL | I475: BOLTON | L475: RICHARDS
A476: SPRINGVALE | C476: O'BRIEN | F476: CAPLES | I476: CARMODY | L476: CRANSTON | O476: SMITH | Q476: BALL
A477: GOALKICKERS | Q477: BANNISTER
A478: ESSENDON | C478: HAYNES 4 | E478: ARCHARD 2 | H478: DARCY 2 | J478: HAWKINS 2 | M478: RUNNALLS 2 | P478: McALISTER | R478: GODDARD
A479: SPRINGVALE | C479: SMITH 3 | F479: CARMODY | I479: DEHEY | K479: HARRISON | N479: B SCHWARZE
F480: NIGHT MATCH
A481: MURRAY KANGAROOS | C481: 2 | D481: 5 | E481: =(C481*6)+D481 -> 17 | G481: 6 | H481: 8 | I481: =(G481*6)+H481 -> 44 | K481: 11 | L481: 11 | M481: =(K481*6)+L481 -> 77 | O481: 14 | P481: 15 | Q481: =(O481*6)+P481 -> 99 | S481: Venue: YORK PARK (Launceston)
A482: TASMANIA | C482: 1 | D482: 2 | E482: =(C482*6)+D482 -> 8 | G482: 4 | H482: 4 | I482: =(G482*6)+H482 -> 28 | K482: 7 | L482: 7 | M482: =(K482*6)+L482 -> 49 | O482: 10 | P482: 8 | Q482: =(O482*6)+P482 -> 68
A483: BEST PLAYERS
A484: MURRAY KANGAROOS | C484: WATSON | F484: SMITH | I484: BLAKEY | L484: RAWLINGS | O484: SINCLAIR | R484: CROWE
A485: TASMANIA | C485: LAYCOCK | F485: THURLEY | I485: A TAYLOR | L485: BLIGHT | O485: SANDER
A486: GOALKICKERS
A487: MURRAY KANGAROOS | C487: WATSON 3 | F487: BLAKEY 2 | I487: LOWCOCK 2 | L487: COOPER | N487: MOTLOP | P487: PETRIE | R487: TREGENZA
A488: TASMANIA | C488: BEAMS 2 | F488: ATKIN | H488: CALLINAN | J488: DERBYSHIRE | M488: B GEAPPEN | P488: HOWARD | R488: JONES | T488: TAYLOR | V488: THURLEY
D489: 19TH MAY | J489: WEATHER
A490: COBURG | C490: 6 | D490: 2 | E490: =(C490*6)+D490 -> 38 | G490: 8 | H490: 2 | I490: =(G490*6)+H490 -> 50 | K490: 11 | L490: 3 | M490: =(K490*6)+L490 -> 69 | O490: 12 | P490: 4 | Q490: =(O490*6)+P490 -> 76 | S490: Venue: NORTH BALLARAT
A491: NORTH BALLARAT | C491: 1 | D491: 1 | E491: =(C491*6)+D491 -> 7 | G491: 3 | H491: 7 | I491: =(G491*6)+H491 -> 25 | K491: 6 | L491: 7 | M491: =(K491*6)+L491 -> 43 | O491: 7 | P491: 10 | Q491: =(O491*6)+P491 -> 52
A492: BEST PLAYERS
A493: COBURG | C493: NEWMAN | F493: HUDSON | I493: DEPASQUALE | L493: HYDE | N493: MILLER | Q493: PAGAN
A494: NORTH BALLARAT | C494: JENKINS | F494: BROWN | I494: FLEMING | L494: CLAYTON | N494: HOCKING
A495: GOALKICKERS
A496: COBURG | C496: HUDSON 5 | F496: McGRATH 2 | I496: HART | K496: HYDE | M496: MILLER | O496: POYAS | Q496: TAYLOR
A497: NORTH BALLARAT | C497: CLAYTON 3 | F497: DAWES 2 | I497: O'KEEFE | K497: POLKINGHORNE
A499: GEELONG | C499: 4 | D499: 3 | E499: =(C499*6)+D499 -> 27 | G499: 9 | H499: 6 | I499: =(G499*6)+H499 -> 60 | K499: 13 | L499: 7 | M499: =(K499*6)+L499 -> 85 | O499: 22 | P499: 8 | Q499: =(O499*6)+P499 -> 140 | S499: Venue: SHELL STADIUM
A500: FRANKSTON | C500: 3 | D500: 1 | E500: =(C500*6)+D500 -> 19 | G500: 6 | H500: 2 | I500: =(G500*6)+H500 -> 38 | K500: 8 | L500: 6 | M500: =(K500*6)+L500 -> 54 | O500: 11 | P500: 8 | Q500: =(O500*6)+P500 -> 74
A501: BEST PLAYERS
A502: GEELONG | C502: KELLY | F502: JOHNSON | I502: WOOLNOUGH | L502: O'BRIEN | N502: CHATFIELD | Q502: MERRIMAN
A503: FRANKSTON | C503: CLARKE | F503: SAUTNER | I503: LITTLE | L503: KREIG | N503: BURGMAN | Q503: FRATER
A504: GOALKICKERS | R504: TREVASKIS
A505: GEELONG | C505: JOHNSON 4 | F505: O'BRIEN 3 | I505: CHAPMAN 2 | L505: GRGIC 2 | N505: KNUCKEY 2 | Q505: KELLY 2 | S505: WOOLNOUGH 2 | W505: CHAMBERS | X505: JOVANOVICH | AA505: McCARTHY | AC505: POWELL
A506: FRANKSTON | C506: SAUTNER 8 | F506: FERGUSON | I506: WILLIS | K506: WINTERTON
A508: SANDRINGHAM | C508: 5 | D508: 3 | E508: =(C508*6)+D508 -> 33 | G508: 8 | H508: 10 | I508: =(G508*6)+H508 -> 58 | K508: 17 | L508: 11 | M508: =(K508*6)+L508 -> 113 | O508: 20 | P508: 22 | Q508: =(O508*6)+P508 -> 142 | S508: Venue: BEACH ROAD
A509: BENDIGO | C509: 0 | D509: 2 | E509: =(C509*6)+D509 -> 2 | G509: 2 | H509: 6 | I509: =(G509*6)+H509 -> 18 | K509: 2 | L509: 7 | M509: =(K509*6)+L509 -> 19 | O509: 5 | P509: 8 | Q509: =(O509*6)+P509 -> 38
A510: BEST PLAYERS
A511: SANDRINGHAM | C511: WARD | F511: FERRARO | I511: COGHLAN | L511: ROBBINS | O511: TEMPLETON | R511: GRANT
A512: BENDIGO | C512: BROWN | F512: VANCE | I512: CARTER | L512: CAMPBELL
A513: GOALKICKERS
A514: SANDRINGHAM | C514: COGHLAN 3 | F514: TEMPLETON 3 | I514: BREESE 2 | K514: GRANT 2 | M514: JOLLY 2 | O514: WILSON 2 | Q514: GODFREY | S514: HAYWARD | V514: HOWARTH | X514: ROBBINS | AA514: SULLIVAN | AC514: WARD
A515: BENDIGO | C515: BROWN 3 | F515: JONES | H515: CARTER
A517: WILLIAMSTOWN | C517: 8 | D517: 1 | E517: =(C517*6)+D517 -> 49 | G517: 12 | H517: 4 | I517: =(G517*6)+H517 -> 76 | K517: 15 | L517: 6 | M517: =(K517*6)+L517 -> 96 | O517: 18 | P517: 12 | Q517: =(O517*6)+P517 -> 120 | S517: Venue: PRESTON
A518: NORTHERN BULLANTS | C518: 2 | D518: 2 | E518: =(C518*6)+D518 -> 14 | G518: 6 | H518: 5 | I518: =(G518*6)+H518 -> 41 | K518: 10 | L518: 6 | M518: =(K518*6)+L518 -> 66 | O518: 12 | P518: 8 | Q518: =(O518*6)+P518 -> 80
A519: BEST PLAYERS
A520: WILLIAMSTOWN | C520: LLOYD | F520: ADKINS | I520: DE ANGELIS | L520: DIDAK | O520: DIMMATINA | R520: SWAN
A521: NORTHERN BULLANTS | C521: RAMSAY | F521: BUNN | I521: STEVENSON | L521: PATERSON | O521: CANN | R521: ZORZI
A522: GOALKICKERS
A523: WILLIAMSTOWN | C523: SWAN 4 | E523: DOOLEY 2 | G523: PODSIADLY 2 | J523: KINNEAR 2 | M523: RIPPON 2 | O523: DIMMATINA | R523: FLETCHER | U523: SCOTLAND | X523: STEINFORT | AA523: RICHARDSON
A524: NORTHERN BULLANTS | C524: GRAINGER 4 | F524: CANN | H524: FAVRIN | J524: PILLING | L524: RAMSAY | N524: RASO | P524: SAGE | R524: WALSH
A526: ROUND 8 | D526: 25TH MAY | J526: WEATHER
D527: 1ST QTR | H527: 2ND QTR | L527: 3RD QTR | P527: FINAL | S527: Venue: SHELL STADIUM (C/R)
A528: GEELONG | C528: 5 | D528: 2 | E528: =(C528*6)+D528 -> 32 | G528: 8 | H528: 6 | I528: =(G528*6)+H528 -> 54 | K528: 8 | L528: 7 | M528: =(K528*6)+L528 -> 55 | O528: 13 | P528: 8 | Q528: =(O528*6)+P528 -> 86 | S528: UMPIRES | Y528: LADDER | AB528: ROUND | AD528: 8
A529: WERRIBEE | C529: 2 | D529: 3 | E529: =(C529*6)+D529 -> 15 | G529: 4 | H529: 4 | I529: =(G529*6)+H529 -> 28 | K529: 9 | L529: 5 | M529: =(K529*6)+L529 -> 59 | O529: 10 | P529: 7 | Q529: =(O529*6)+P529 -> 67
A530: BEST PLAYERS | W530: TEAM | X530: W | Y530: L | Z530: D | AA530: FOR | AB530: AGST | AC530: % | AD530: PTS
A531: GEELONG | C531: McGRATH | F531: RAHILLY | I531: JOVANOVIC | L531: CARRAZZO | O531: KNUCKEY | R531: GARDINER
A532: WERRIBEE | C532: CROSS | F532: ROBERTSON | I532: JAMES | L532: FAULKNER | W532: BOX HILL | X532: 7 | Y532: 1 | Z532: 0 | AA532: 942 | AB532: 667 | AC532: =(AA532/AB532)*100 -> 141.22938530734632 | AD532: =(X532*4)+(Z532*2) -> 28
A533: GOALKICKERS | O533: MOONEY | Q533: O'BRIEN | W533: GEELONG | X533: 6 | Y533: 2 | Z533: 0 | AA533: 929 | AB533: 506 | AC533: =(AA533/AB533)*100 -> 183.59683794466403 | AD533: =(X533*4)+(Z533*2) -> 24
A534: GEELONG | C534: GARDINER 4 | F534: McCARTHY 2 | I534: CARRAZZO | L534: S CHAPMAN | N534: HUNT | P534: S JOHNSON | R534: KNUCKEY | W534: COBURG | X534: 6 | Y534: 2 | Z534: 0 | AA534: 803 | AB534: 673 | AC534: =(AA534/AB534)*100 -> 119.31649331352155 | AD534: =(X534*4)+(Z534*2) -> 24
A535: WERRIBEE | C535: JAMES 3 | F535: MITCHELL 2 | I535: BAKER | K535: BOWDEN | M535: BOYD | N535: DYER | P535: McGUINNESS | W535: SANDRINGHAM | X535: 5 | Y535: 3 | Z535: 0 | AA535: 853 | AB535: 621 | AC535: =(AA535/AB535)*100 -> 137.35909822866347 | AD535: =(X535*4)+(Z535*2) -> 20
W536: WILLIAMSTOWN | X536: 5 | Y536: 3 | Z536: 0 | AA536: 911 | AB536: 766 | AC536: =(AA536/AB536)*100 -> 118.92950391644908 | AD536: =(X536*4)+(Z536*2) -> 20
A537: CARLTON | C537: 5 | D537: 5 | E537: =(C537*6)+D537 -> 35 | G537: 7 | H537: 11 | I537: =(G537*6)+H537 -> 53 | K537: 13 | L537: 12 | M537: =(K537*6)+L537 -> 90 | O537: 19 | P537: 15 | Q537: =(O537*6)+P537 -> 129 | S537: Venue: NORTH HOBART OVAL | W537: PORT MELBOURNE | X537: 5 | Y537: 3 | Z537: 0 | AA537: 785 | AB537: 693 | AC537: =(AA537/AB537)*100 -> 113.27561327561328 | AD537: =(X537*4)+(Z537*2) -> 20
A538: TASMANIA | C538: 1 | D538: 3 | E538: =(C538*6)+D538 -> 9 | G538: 7 | H538: 9 | I538: =(G538*6)+H538 -> 51 | K538: 12 | L538: 12 | M538: =(K538*6)+L538 -> 84 | O538: 13 | P538: 16 | Q538: =(O538*6)+P538 -> 94 | W538: WERRIBEE | X538: 5 | Y538: 3 | Z538: 0 | AA538: 747 | AB538: 678 | AC538: =(AA538/AB538)*100 -> 110.17699115044249 | AD538: =(X538*4)+(Z538*2) -> 20
A539: BEST PLAYERS | W539: MURRAY KANGAROOS | X539: 5 | Y539: 3 | Z539: 0 | AA539: 852 | AB539: 785 | AC539: =(AA539/AB539)*100 -> 108.53503184713375 | AD539: =(X539*4)+(Z539*2) -> 20
A540: CARLTON | C540: MERRINGTON | F540: BAILEY | I540: DOERING | L540: WIGGINS
A541: TASMANIA | C541: BLIGHT | F541: WALKER | I541: B GEAPPEN | L541: ATKIN | N541: M GEAPPEN | Q541: SANDERS | W541: TASMANIA | X541: 4 | Y541: 4 | Z541: 0 | AA541: 784 | AB541: 784 | AC541: =(AA541/AB541)*100 -> 100 | AD541: =(X541*4)+(Z541*2) -> 16
A542: GOALKICKERS | I542: PRENDERGAST | L542: JANSEN | N542: SINNOTT | P542: WAITE | R542: HEINRICH | W542: CARLTON | X542: 4 | Y542: 4 | Z542: 0 | AA542: 737 | AB542: 765 | AC542: =(AA542/AB542)*100 -> 96.33986928104575 | AD542: =(X542*4)+(Z542*2) -> 16
A543: CARLTON | C543: BAILEY 3 | E543: DAVIS 3 | G543: FEVOLA 2 | I543: FRANCHINA 2 | L543: MERRINGTON 2 | O543: FLEMING | Q543: GUTTERSON | W543: SPRINGVALE | X543: 4 | Y543: 4 | Z543: 0 | AA543: 665 | AB543: 776 | AC543: =(AA543/AB543)*100 -> 85.69587628865979 | AD543: =(X543*4)+(Z543*2) -> 16
A544: TASMANIA | C544: DERBYSHIRE 3 | F544: BOLTON 2 | I544: BLIGHT 2 | K544: CALLINAN 2 | N544: ATKIN | P544: BEAMS | R544: TAYLOR | W544: NORTHERN BULLANTS | X544: 3 | Y544: 5 | Z544: 0 | AA544: 813 | AB544: 807 | AC544: =(AA544/AB544)*100 -> 100.74349442379183 | AD544: =(X544*4)+(Z544*2) -> 12
N545: WALKER | W545: ESSENDON | X545: 3 | Y545: 5 | Z545: 0 | AA545: 865 | AB545: 885 | AC545: =(AA545/AB545)*100 -> 97.740112994350284 | AD545: =(X545*4)+(Z545*2) -> 12
A546: BOX HILL | C546: 4 | D546: 4 | E546: =(C546*6)+D546 -> 28 | G546: 9 | H546: 8 | I546: =(G546*6)+H546 -> 62 | K546: 15 | L546: 12 | M546: =(K546*6)+L546 -> 102 | O546: 22 | P546: 15 | Q546: =(O546*6)+P546 -> 147 | S546: Venue: BOX HILL | W546: NORTH BALLARAT | X546: 2 | Y546: 6 | Z546: 0 | AA546: 618 | AB546: 824 | AC546: =(AA546/AB546)*100 -> 75 | AD546: =(X546*4)+(Z546*2) -> 8
A547: NORTH BALLARAT | C547: 2 | D547: 1 | E547: =(C547*6)+D547 -> 13 | G547: 5 | H547: 4 | I547: =(G547*6)+H547 -> 34 | K547: 7 | L547: 6 | M547: =(K547*6)+L547 -> 48 | O547: 8 | P547: 8 | Q547: =(O547*6)+P547 -> 56 | W547: FRANKSTON | X547: 0 | Y547: 8 | Z547: 0 | AA547: 584 | AB547: 936 | AC547: =(AA547/AB547)*100 -> 62.393162393162392 | AD547: =(X547*4)+(Z547*2) -> 0
A548: BEST PLAYERS | W548: BENDIGO | X548: 0 | Y548: 8 | Z548: 0 | AA548: 540 | AB548: 1263 | AC548: =(AA548/AB548)*100 -> 42.755344418052253 | AD548: =(X548*4)+(Z548*2) -> 0
A549: BOX HILL | C549: BROWN | F549: JOHNSON | I549: ELSTONE | L549: KANE | N549: MITCHELL | Q549: HODGE
A550: NORTH BALLARAT | C550: BRADLY | F550: FLEMING | I550: JENKINS | L550: BEST
A551: GOALKICKERS | I551: BROWN | K551: WOODS | M551: HODGE | O551: MITCHELL | R551: STRONG
A552: BOX HILL | C552: PASSADOR 5 | F552: KANE 3 | H552: WILLIAMS 3 | K552: BREWER 2 | M552: OSBORNE 2 | P552: BALL | R552: BAYFORD
A553: NORTH BALLARAT | C553: BYE 2 | F553: SPOLDING 2 | I553: BEST | J553: COHEN | L553: FRASER | N553: FLEMING
A555: WILLIAMSTOWN | C555: 5 | D555: 5 | E555: =(C555*6)+D555 -> 35 | G555: 8 | H555: 9 | I555: =(G555*6)+H555 -> 57 | K555: 14 | L555: 14 | M555: =(K555*6)+L555 -> 98 | O555: 22 | P555: 19 | Q555: =(O555*6)+P555 -> 151 | S555: WILLIAMSTOWN
A556: FRANKSTON | C556: 2 | D556: 2 | E556: =(C556*6)+D556 -> 14 | G556: 5 | H556: 4 | I556: =(G556*6)+H556 -> 34 | K556: 7 | L556: 7 | M556: =(K556*6)+L556 -> 49 | O556: 12 | P556: 7 | Q556: =(O556*6)+P556 -> 79
A557: BEST PLAYERS
A558: WILLIAMSTOWN | C558: STEINFORT | F558: ANDERSON | I558: DIDAK | L558: DIMMATINA | O558: DOOLEY | Q558: SCOTLAND
A559: FRANKSTON | C559: SAUTNER | F559: CLARKE | I559: FRATER | L559: BURGMAN | O559: LITTLE | Q559: ANDERSON
A560: GOALKICKERS
A561: WILLIAMSTOWN | C561: LOVETT-MURRAY 4 | G561: STEINFORT 4 | J561: FLETCHER 3 | M561: ANDERSON 2 | P561: KINNEAR 2 | R561: ADKINS | T561: A R HILL | W561: PODSIADLY | X561: RIPPON | Z561: SCOTLAND | AB561: SHAW | AC561: RICHARDSON
A562: FRANKSTON | C562: SAUTNER 8 | F562: CLARKE | H562: LITTLE | J562: MATTHEWS | M562: WINTERTON
D563: 26TH MAY | J563: WEATHER
A564: MURRAY KANGAROOS | C564: 4 | D564: 2 | E564: =(C564*6)+D564 -> 26 | G564: 8 | H564: 3 | I564: =(G564*6)+H564 -> 51 | K564: 14 | L564: 3 | M564: =(K564*6)+L564 -> 87 | O564: 18 | P564: 6 | Q564: =(O564*6)+P564 -> 114 | S564: Venue: LAVINGTON
A565: SANDRINGHAM | C565: 7 | D565: 6 | E565: =(C565*6)+D565 -> 48 | G565: 11 | H565: 9 | I565: =(G565*6)+H565 -> 75 | K565: 13 | L565: 14 | M565: =(K565*6)+L565 -> 92 | O565: 14 | P565: 18 | Q565: =(O565*6)+P565 -> 102
A566: BEST PLAYERS
A567: MURRAY KANGAROOS | C567: TREGENZA | F567: McLAREN | I567: COOPER | L567: RAWLINGS | O567: SMITH | R567: SINCLAIR
A568: SANDRINGHAM | C568: JOLLY | F568: GODFREY | I568: WILLIAMS | L568: FERRARO | O568: GRANT | R568: LAMB
A569: GOALKICKERS
A570: MURRAY KANGAROOS | C570: TREGENZA 6 | F570: COOPER 4 | I570: LANGE 3 | K570: STEVENS 2 | N570: HALE | P570: D MOTLOP | R570: WATSON
A571: SANDRINGHAM | C571: WILLIAMS 3 | F571: COGHLAN 2 | I571: GODFREY 2 | L571: ROBBINS 2 | N571: TEMPLETON 2 | Q571: AINLEY | S571: JOLLY | U571: RADFORD
A573: COBURG | C573: 6 | D573: 2 | E573: =(C573*6)+D573 -> 38 | G573: 9 | H573: 2 | I573: =(G573*6)+H573 -> 56 | K573: 16 | L573: 5 | M573: =(K573*6)+L573 -> 101 | O573: 20 | P573: 8 | Q573: =(O573*6)+P573 -> 128 | S573: Venue: COBURG
A574: SPRINGVALE | C574: 3 | D574: 0 | E574: =(C574*6)+D574 -> 18 | G574: 8 | H574: 2 | I574: =(G574*6)+H574 -> 50 | K574: 9 | L574: 6 | M574: =(K574*6)+L574 -> 60 | O574: 11 | P574: 7 | Q574: =(O574*6)+P574 -> 73
A575: BEST PLAYERS
A576: COBURG | C576: COUGHLAN | F576: PETTIFER | I576: POYAS | L576: DEPASQUALE | O576: BUTLER | R576: TALBOT
A577: SPRINGVALE | C577: RIGG | F577: CARROLL | I577: HOULIHAN | L577: HARRISON | O577: O'BRIEN | R577: SMITH
A578: GOALKICKERS
A579: COBURG | C579: POYAS 4 | E579: HUDSON 2 | H579: MILLER 2 | J579: MILLS 2 | L579: PETTIFER 2 | N579: McGRATH 2 | Q579: COUGHLAN | T579: FARMER | W579: DEPASQUALE | X579: HART | Z579: HYDE
A580: SPRINGVALE | C580: SMITH 4 | F580: HARRISON 2 | I580: HOULIHAN | L580: SCHWARZE | O580: MADDOX | Q580: PITT | S580: TAYLOR
A582: ESSENDON | C582: 6 | D582: 1 | E582: =(C582*6)+D582 -> 37 | G582: 12 | H582: 2 | I582: =(G582*6)+H582 -> 74 | K582: 14 | L582: 3 | M582: =(K582*6)+L582 -> 87 | O582: 18 | P582: 3 | Q582: =(O582*6)+P582 -> 111 | S582: Venue: WINDY HILL
A583: PORT MELBOURNE | C583: 3 | D583: 3 | E583: =(C583*6)+D583 -> 21 | G583: 7 | H583: 8 | I583: =(G583*6)+H583 -> 50 | K583: 11 | L583: 10 | M583: =(K583*6)+L583 -> 76 | O583: 16 | P583: 13 | Q583: =(O583*6)+P583 -> 109
A584: BEST PLAYERS
A585: ESSENDON | C585: HOWARD | F585: BULLEN | I585: BANNISTER | L585: C McGRATH | O585: BOLTON | R585: RICHARDS
A586: PORT MELBOURNE | C586: O'KEEFE | F586: KENNELLY | I586: R ABLETT | L586: COTCHETT | O586: ALOI
A587: GOALKICKERS
A588: ESSENDON | C588: BANNISTER 6 | F588: HAYNES 3 | I588: HAWKINS 3 | L588: RUNNALLS 2 | O588: MOORCROFT 2 | R588: HENNEMAN | U588: McGRATH
A589: PORT MELBOURNE | C589: R ABLETT 6 | F589: LOCKETT 3 | I589: O'KEEFE 3 | L589: BUCHANAN 2 | O589: DOYLE | Q589: EVANS
A591: NORTHERN BULLANTS | C591: 6 | D591: 3 | E591: =(C591*6)+D591 -> 39 | G591: 11 | H591: 11 | I591: =(G591*6)+H591 -> 77 | K591: 18 | L591: 14 | M591: =(K591*6)+L591 -> 122 | O591: 30 | P591: 19 | Q591: =(O591*6)+P591 -> 199 | S591: Venue: BENDIGO
A592: BENDIGO | C592: 3 | D592: 3 | E592: =(C592*6)+D592 -> 21 | G592: 4 | H592: 4 | I592: =(G592*6)+H592 -> 28 | K592: 6 | L592: 7 | M592: =(K592*6)+L592 -> 43 | O592: 8 | P592: 9 | Q592: =(O592*6)+P592 -> 57
A593: BEST PLAYERS
A594: NORTHERN BULLANTS | C594: PENN | F594: CANN | I594: BUNN | L594: GRAINGER | O594: RASO | Q594: GIBSON
A595: BENDIGO | C595: CARTER | F595: M BRADLEY | I595: BOVALINO
A596: GOALKICKERS
A597: NORTHERN BULLANTS | C597: GRAINGER 6 | F597: CANN 4 | H597: GIBSON 4 | J597: PATERSON 3 | M597: WALSH 3 | O597: PENN 2 | Q597: ZORZI 2 | S597: CLARKE | U597: RASO | W597: RAMSAY | X597: PILLING | Z597: REID | AB597: SAGE
A598: BENDIGO | C598: BROWN 2 | F598: PROCTOR 2 | I598: BOVALINO | L598: CARTER | N598: LLOYD | P598: McNAMARA
A600: ROUND 9 | D600: 1ST JUNE | J600: WEATHER
D601: 1ST QTR | H601: 2ND QTR | L601: 3RD QTR | P601: FINAL | S601: Venue: WINDY HILL
A602: MURRAY KANGAROOS | C602: 4 | D602: 5 | E602: =(C602*6)+D602 -> 29 | G602: 10 | H602: 10 | I602: =(G602*6)+H602 -> 70 | K602: 18 | L602: 14 | M602: =(K602*6)+L602 -> 122 | O602: 26 | P602: 18 | Q602: =(O602*6)+P602 -> 174 | S602: UMPIRES | Y602: LADDER | AB602: ROUND | AD602: 9
A603: ESSENDON | C603: 3 | D603: 4 | E603: =(C603*6)+D603 -> 22 | G603: 6 | H603: 8 | I603: =(G603*6)+H603 -> 44 | K603: 8 | L603: 10 | M603: =(K603*6)+L603 -> 58 | O603: 11 | P603: 12 | Q603: =(O603*6)+P603 -> 78
A604: BEST PLAYERS | W604: TEAM | X604: W | Y604: L | Z604: D | AA604: FOR | AB604: AGST | AC604: % | AD604: PTS
A605: MURRAY KANGAROOS | C605: SMITH | F605: TREGENZA | I605: SINCLAIR | L605: RAWLINGS | O605: LANGE | Q605: WATT
A606: ESSENDON | C606: HALL | F606: DAVIES | I606: McALISTER | W606: BOX HILL | X606: 8 | Y606: 1 | Z606: 0 | AA606: 1135 | AB606: 718 | AC606: =(AA606/AB606)*100 -> 158.07799442896936 | AD606: =(X606*4)+(Z606*2) -> 32
A607: GOALKICKERS | M607: McLAREN | P607: MARSHALL | R607: SMITH | W607: GEELONG | X607: 7 | Y607: 2 | Z607: 0 | AA607: 1037 | AB607: 569 | AC607: =(AA607/AB607)*100 -> 182.24956063268894 | AD607: =(X607*4)+(Z607*2) -> 28
A608: MURRAY KANGAROOS | C608: TREGENZA 8 | F608: HALE 4 | H608: D MOTLOP 3 | K608: SINCLAIR 3 | N608: COOPER 2 | Q608: RAWLINGS 2 | T608: LANGE | W608: COBURG | X608: 7 | Y608: 2 | Z608: 0 | AA608: 898 | AB608: 756 | AC608: =(AA608/AB608)*100 -> 118.78306878306879 | AD608: =(X608*4)+(Z608*2) -> 28
A609: ESSENDON | C609: HAWKINS 6 | F609: HAYNES | H609: McALISTER | K609: MAHONEY | N609: RUNNALLS | Q609: WINTER | W609: MURRAY KANGAROOS | X609: 6 | Y609: 3 | Z609: 0 | AA609: 1026 | AB609: 863 | AC609: =(AA609/AB609)*100 -> 118.88760139049825 | AD609: =(X609*4)+(Z609*2) -> 24
W610: PORT MELBOURNE | X610: 6 | Y610: 3 | Z610: 0 | AA610: 915 | AB610: 808 | AC610: =(AA610/AB610)*100 -> 113.24257425742574 | AD610: =(X610*4)+(Z610*2) -> 24
A611: BOX HILL | C611: 9 | D611: 2 | E611: =(C611*6)+D611 -> 56 | G611: 14 | H611: 5 | I611: =(G611*6)+H611 -> 89 | K611: 22 | L611: 18 | M611: =(K611*6)+L611 -> 150 | O611: 30 | P611: 13 | Q611: =(O611*6)+P611 -> 193 | S611: Venue: FRANKSTON | W611: SANDRINGHAM | X611: 5 | Y611: 4 | Z611: 0 | AA611: 916 | AB611: 729 | AC611: =(AA611/AB611)*100 -> 125.65157750342935 | AD611: =(X611*4)+(Z611*2) -> 20
A612: FRANKSTON | C612: 1 | D612: 4 | E612: =(C612*6)+D612 -> 10 | G612: 3 | H612: 5 | I612: =(G612*6)+H612 -> 23 | K612: 4 | L612: 6 | M612: =(K612*6)+L612 -> 30 | O612: 7 | P612: 9 | Q612: =(O612*6)+P612 -> 51 | W612: WILLIAMSTOWN | X612: 5 | Y612: 4 | Z612: 0 | AA612: 1026 | AB612: 896 | AC612: =(AA612/AB612)*100 -> 114.50892857142858 | AD612: =(X612*4)+(Z612*2) -> 20
A613: BEST PLAYERS | W613: CARLTON | X613: 5 | Y613: 4 | Z613: 0 | AA613: 901 | AB613: 806 | AC613: =(AA613/AB613)*100 -> 111.78660049627791 | AD613: =(X613*4)+(Z613*2) -> 20
A614: BOX HILL | C614: WOODS | F614: CLARKE | I614: JOHNSON | L614: ALLEWAY | O614: GREENE | Q614: JOHNSON
A615: FRANKSTON | C615: N WINTERTON | F615: FRATER | I615: ANDERSON | L615: SAUTNER | W615: WERRIBEE | X615: 5 | Y615: 4 | Z615: 0 | AA615: 830 | AB615: 773 | AC615: =(AA615/AB615)*100 -> 107.3738680465718 | AD615: =(X615*4)+(Z615*2) -> 20
A616: GOALKICKERS | Q616: GREENE | S616: JOHNSON | W616: SPRINGVALE | X616: 5 | Y616: 4 | Z616: 0 | AA616: 787 | AB616: 818 | AC616: =(AA616/AB616)*100 -> 96.210268948655255 | AD616: =(X616*4)+(Z616*2) -> 20
A617: BOX HILL | C617: PASSADOR 6 | F617: BAYFORD 5 | I617: WOODS 5 | K617: BREWER 4 | M617: COLLINS 3 | O617: WILLIAMS 2 | R617: KANE 2 | T617: ALLEWAY | W617: NORTHERN BULLANTS | X617: 4 | Y617: 5 | Z617: 0 | AA617: 972 | AB617: 866 | AC617: =(AA617/AB617)*100 -> 112.24018475750577 | AD617: =(X617*4)+(Z617*2) -> 16
A618: FRANKSTON | C618: SAUTNER 4 | F618: DAMON | H618: LITTLE | J618: N WINTERTON | W618: TASMANIA | X618: 4 | Y618: 5 | Z618: 0 | AA618: 843 | AB618: 943 | AC618: =(AA618/AB618)*100 -> 89.395546129374338 | AD618: =(X618*4)+(Z618*2) -> 16
W619: ESSENDON | X619: 3 | Y619: 6 | Z619: 0 | AA619: 943 | AB619: 1059 | AC619: =(AA619/AB619)*100 -> 89.046270066100092 | AD619: =(X619*4)+(Z619*2) -> 12
A620: CARLTON | C620: 5 | D620: 4 | E620: =(C620*6)+D620 -> 34 | G620: 11 | H620: 6 | I620: =(G620*6)+H620 -> 72 | K620: 18 | L620: 13 | M620: =(K620*6)+L620 -> 121 | O620: 24 | P620: 20 | Q620: =(O620*6)+P620 -> 164 | S620: Venue: OPTUS OVAL | W620: NORTH BALLARAT | X620: 2 | Y620: 7 | Z620: 0 | AA620: 660 | AB620: 946 | AC620: =(AA620/AB620)*100 -> 69.767441860465112 | AD620: =(X620*4)+(Z620*2) -> 8
A621: BENDIGO | C621: 1 | D621: 0 | E621: =(C621*6)+D621 -> 6 | G621: 2 | H621: 2 | I621: =(G621*6)+H621 -> 14 | K621: 2 | L621: 4 | M621: =(K621*6)+L621 -> 16 | O621: 6 | P621: 5 | Q621: =(O621*6)+P621 -> 41 | W621: FRANKSTON | X621: 0 | Y621: 9 | Z621: 0 | AA621: 635 | AB621: 1129 | AC621: =(AA621/AB621)*100 -> 56.2444641275465 | AD621: =(X621*4)+(Z621*2) -> 0
A622: BEST PLAYERS | W622: BENDIGO | X622: 0 | Y622: 9 | Z622: 0 | AA622: 591 | AB622: 1427 | AC622: =(AA622/AB622)*100 -> 41.415557112824111 | AD622: =(X622*4)+(Z622*2) -> 0
A623: CARLTON | C623: DOERING | F623: SMITH | I623: GALLAGHER | L623: ECCLES | N623: FREEBORN
A624: BENDIGO | C624: DOHERTY | F624: EATON | I624: CAIL | L624: BRADLEY | N624: CARTER | Q624: VANCE
A625: GOALKICKERS | N625: MERRINGTON | Q625: PICKERING | T625: SINNOT
A626: CARLTON | C626: SMITH 6 | E626: ECCLES 4 | G626: DOERING 3 | I626: BAILEY 2 | K626: BRAY 2 | M626: BRIGGS | O626: DAVIS | Q626: FLEMING | S626: GUTTERSON
A627: BENDIGO | C627: VANCE 2 | F627: PROCTOR 2 | I627: BROWN | K627: CARTER
A629: SPRINGVALE | C629: 4 | D629: 4 | E629: =(C629*6)+D629 -> 28 | G629: 9 | H629: 9 | I629: =(G629*6)+H629 -> 63 | K629: 12 | L629: 12 | M629: =(K629*6)+L629 -> 84 | O629: 17 | P629: 20 | Q629: =(O629*6)+P629 -> 122 | S629: Venue: NORTH BALLARAT
A630: NORTH BALLARAT | C630: 1 | D630: 1 | E630: =(C630*6)+D630 -> 7 | G630: 3 | H630: 3 | I630: =(G630*6)+H630 -> 21 | K630: 5 | L630: 5 | M630: =(K630*6)+L630 -> 35 | O630: 6 | P630: 6 | Q630: =(O630*6)+P630 -> 42
A631: BEST PLAYERS
A632: SPRINGVALE | C632: O'BRIEN | F632: HARRISON | I632: CRANSTON | L632: DEHAY | N632: BEETHAM | Q632: CARROLL
A633: NORTH BALLARAT | C633: CLAYTON | F633: BYE | I633: GREIG | L633: POLKINGHORNE | O633: JENKINS | Q633: DAWES
A634: GOALKICKERS
A635: SPRINGVALE | C635: SMITH 5 | E635: PITTS 3 | G635: HOULIHAN 2 | J635: O'BRIEN 2 | M635: WULF 2 | O635: BEETHAM | Q635: HARRISON | S635: OLIVER
A636: NORTH BALLARAT | C636: BEST | E636: BYE | F636: CLAYTON | I636: HOCKING | K636: POLKINGHORNE | N636: SULLIVAN
D637: 2ND JUNE | J637: WEATHER
A638: GEELONG | C638: 2 | D638: 1 | E638: =(C638*6)+D638 -> 13 | G638: 5 | H638: 5 | I638: =(G638*6)+H638 -> 35 | K638: 10 | L638: 9 | M638: =(K638*6)+L638 -> 69 | O638: 16 | P638: 12 | Q638: =(O638*6)+P638 -> 108 | S638: Venue: BEACH ROAD
A639: SANDRINGHAM | C639: 4 | D639: 4 | E639: =(C639*6)+D639 -> 28 | G639: 5 | H639: 5 | I639: =(G639*6)+H639 -> 35 | K639: 7 | L639: 6 | M639: =(K639*6)+L639 -> 48 | O639: 9 | P639: 9 | Q639: =(O639*6)+P639 -> 63
A640: BEST PLAYERS
A641: GEELONG | C641: RAHILLY | F641: MOONEY | I641: GARDINER | L641: KNUCKEY | O641: McGRATH | Q641: FOSTER
A642: SANDRINGHAM | C642: HAYWARD | F642: WILLIAMS | I642: LAMB | L642: GODFREY
A643: GOALKICKERS
A644: GEELONG | C644: JOHNSON 3 | F644: CARRAZZO 2 | I644: GARDINER 2 | L644: McCARTHY 2 | O644: MOONEY 2 | R644: O'BRIEN 2 | U644: CHAPMAN | X644: KNUCKEY | AA644: MENSCH
A645: SANDRINGHAM | C645: ROBBINS 2 | F645: WILLIAMS 2 | I645: COGHLAN | K645: GRANT | M645: OAKLEY | O645: SCOTT-BRANAGAN | S645: TEMPLETON
A647: COBURG | C647: 6 | D647: 2 | E647: =(C647*6)+D647 -> 38 | G647: 10 | H647: 6 | I647: =(G647*6)+H647 -> 66 | K647: 11 | L647: 7 | M647: =(K647*6)+L647 -> 73 | O647: 14 | P647: 11 | Q647: =(O647*6)+P647 -> 95 | S647: Venue: WERRIBEE
A648: WERRIBEE | C648: 2 | D648: 3 | E648: =(C648*6)+D648 -> 15 | G648: 5 | H648: 5 | I648: =(G648*6)+H648 -> 35 | K648: 9 | L648: 9 | M648: =(K648*6)+L648 -> 63 | O648: 12 | P648: 11 | Q648: =(O648*6)+P648 -> 83
A649: BEST PLAYERS
A650: COBURG | C650: EDNIE | F650: ROBERTS | I650: DEPASQUALE | L650: HYDE | O650: BIDDISCOMBE | R650: KRAKOUER
A651: WERRIBEE | C651: PICKEN | F651: RAU | I651: LAMB | L651: ROBERTSON | O651: WIGGINS
A652: GOALKICKERS
A653: COBURG | C653: KRAKOUER 4 | F653: HUDSON 3 | I653: HYDE 2 | K653: BIDDISCOMBE | N653: HOMEWOOD | Q653: McGRATH | S653: MILLER | U653: POYAS
A654: WERRIBEE | C654: WIGGINS 3 | F654: RAU 3 | H654: BOWDEN | J654: BOYD | L654: MITCHELL | N654: POWER | P654: ROBERTSON | S654: SMITH
A656: PORT MELBOURNE | C656: 3 | D656: 3 | E656: =(C656*6)+D656 -> 21 | G656: 6 | H656: 7 | I656: =(G656*6)+H656 -> 43 | K656: 16 | L656: 9 | M656: =(K656*6)+L656 -> 105 | O656: 20 | P656: 10 | Q656: =(O656*6)+P656 -> 130 | S656: Venue: PORT MELBOURNE
A657: WILLIAMSTOWN | C657: 6 | D657: 5 | E657: =(C657*6)+D657 -> 41 | G657: 10 | H657: 9 | I657: =(G657*6)+H657 -> 69 | K657: 13 | L657: 12 | M657: =(K657*6)+L657 -> 90 | O657: 16 | P657: 19 | Q657: =(O657*6)+P657 -> 115
A658: BEST PLAYERS
A659: PORT MELBOURNE | C659: ALOI | F659: McPHERSON | I659: FOSDIKE | L659: McMAHON | O659: EVANS | Q659: SUNDQUIST
A660: WILLIAMSTOWN | C660: DOOLEY | F660: LLOYD | I660: STEINFORT | L660: DAVIDSON | O660: LOVETT-MURRAY | R660: COLE
A661: GOALKICKERS
A662: PORT MELBOURNE | C662: R ABLETT 4 | F662: ALOI 4 | H662: BUCHANAN 3 | K662: DAFFEY 2 | M662: McMAHON 2 | P662: EVANS | R662: FOSDIKE | U662: McPHERSON | X662: O'LOUGHLIN | AA662: SUNDQUIST
A663: WILLIAMSTOWN | C663: PODSIADLY 4 | F663: DAVIDSON 3 | I663: LOVETT-MURRAY 2 | M663: STEINFORT 2 | P663: LLOYD | R663: RICHARDS | U663: RIPPON | W663: SCOTLAND | X663: SMOKER
A665: NORTHERN BULLANTS | C665: 4 | D665: 4 | E665: =(C665*6)+D665 -> 28 | G665: 9 | H665: 7 | I665: =(G665*6)+H665 -> 61 | K665: 15 | L665: 9 | M665: =(K665*6)+L665 -> 99 | O665: 24 | P665: 15 | Q665: =(O665*6)+P665 -> 159 | S665: Venue: PRESTON
A666: TASMANIA | C666: 2 | D666: 1 | E666: =(C666*6)+D666 -> 13 | G666: 4 | H666: 2 | I666: =(G666*6)+H666 -> 26 | K666: 8 | L666: 3 | M666: =(K666*6)+L666 -> 51 | O666: 9 | P666: 5 | Q666: =(O666*6)+P666 -> 59
A667: BEST PLAYERS
A668: NORTHERN BULLANTS | C668: BUNN | F668: HOOPER | I668: SAGE | L668: PENN | O668: RAMSAY | R668: ZORZI
A669: TASMANIA | C669: BLIGHT | F669: M GEAPPEN | I669: A TAYLOR | L669: PRACIAK
A670: GOALKICKERS
A671: NORTHERN BULLANTS | C671: FAVRIN 5 | E671: PENN 4 | G671: HOOPER 3 | I671: GRAINGER 2 | L671: PILLING 2 | N671: SAGE 2 | P671: WALSH 2 | R671: CANN | T671: GIBSON | V671: PATERSON | X671: WATSON
A672: TASMANIA | C672: CALLINAN 2 | F672: A DERBYSHIRE 2 | J672: BEVERIDGE | M672: BOLTON | O672: HEATLEY | Q672: JONES | S672: A TAYLOR
A674: ROUND 10 | D674: 8TH JUNE | J674: WEATHER
D675: 1ST QTR | H675: 2ND QTR | L675: 3RD QTR | P675: FINAL | S675: Venue: MOORABBIN
A676: NORTHERN BULLANTS | C676: 3 | D676: 4 | E676: =(C676*6)+D676 -> 22 | G676: 5 | H676: 4 | I676: =(G676*6)+H676 -> 34 | K676: 8 | L676: 7 | M676: =(K676*6)+L676 -> 55 | O676: 9 | P676: 10 | Q676: =(O676*6)+P676 -> 64 | S676: UMPIRES | Y676: LADDER | AB676: ROUND | AD676: 10
A677: SPRINGVALE | C677: 2 | D677: 1 | E677: =(C677*6)+D677 -> 13 | G677: 4 | H677: 5 | I677: =(G677*6)+H677 -> 29 | K677: 5 | L677: 9 | M677: =(K677*6)+L677 -> 39 | O677: 6 | P677: 13 | Q677: =(O677*6)+P677 -> 49
A678: BEST PLAYERS | W678: TEAM | X678: W | Y678: L | Z678: D | AA678: FOR | AB678: AGST | AC678: % | AD678: PTS
A679: NORTHERN BULLANTS | C679: COLLINS | F679: ZORZI | I679: RAMSAY | L679: GIBSON | O679: PATERSON | R679: RASO
A680: SPRINGVALE | C680: RIGG | F680: DILLON | I680: B SCHWARZE | L680: CRANSTON | O680: CARROLL | R680: BEGLEY | W680: BOX HILL | X680: 8 | Y680: 1 | Z680: 1 | AA680: 1209 | AB680: 792 | AC680: =(AA680/AB680)*100 -> 152.65151515151516 | AD680: =(X680*4)+(Z680*2) -> 34
A681: GOALKICKERS | W681: GEELONG | X681: 8 | Y681: 2 | Z681: 0 | AA681: 1197 | AB681: 615 | AC681: =(AA681/AB681)*100 -> 194.63414634146341 | AD681: =(X681*4)+(Z681*2) -> 32
A682: NORTHERN BULLANTS | C682: ZORZI 2 | F682: CANN | H682: FAVRIN | J682: GIBSON | L682: PATERSON | N682: PENN | P682: PILLING | R682: WALSH | W682: MURRAY KANGAROOS | X682: 7 | Y682: 3 | Z682: 0 | AA682: 1135 | AB682: 929 | AC682: =(AA682/AB682)*100 -> 122.17438105489774 | AD682: =(X682*4)+(Z682*2) -> 28
A683: SPRINGVALE | C683: PITT 2 | E683: CARROLL | H683: HOULIHAN | J683: B SCHWARZE | M683: SMITH | W683: PORT MELBOURNE | X683: 7 | Y683: 3 | Z683: 0 | AA683: 1078 | AB683: 894 | AC683: =(AA683/AB683)*100 -> 120.58165548098434 | AD683: =(X683*4)+(Z683*2) -> 28
W684: COBURG | X684: 7 | Y684: 3 | Z684: 0 | AA684: 964 | AB684: 865 | AC684: =(AA684/AB684)*100 -> 111.44508670520233 | AD684: =(X684*4)+(Z684*2) -> 28
A685: GEELONG | C685: 9 | D685: 5 | E685: =(C685*6)+D685 -> 59 | G685: 10 | H685: 9 | I685: =(G685*6)+H685 -> 69 | K685: 19 | L685: 13 | M685: =(K685*6)+L685 -> 127 | O685: 24 | P685: 16 | Q685: =(O685*6)+P685 -> 160 | S685: Venue: OPTUS OVAL | W685: SANDRINGHAM | X685: 6 | Y685: 4 | Z685: 0 | AA685: 1008 | AB685: 814 | AC685: =(AA685/AB685)*100 -> 123.83292383292384 | AD685: =(X685*4)+(Z685*2) -> 24
A686: CARLTON | C686: 1 | D686: 1 | E686: =(C686*6)+D686 -> 7 | G686: 4 | H686: 3 | I686: =(G686*6)+H686 -> 27 | K686: 4 | L686: 6 | M686: =(K686*6)+L686 -> 30 | O686: 6 | P686: 10 | Q686: =(O686*6)+P686 -> 46 | W686: WERRIBEE | X686: 6 | Y686: 4 | Z686: 0 | AA686: 948 | AB686: 825 | AC686: =(AA686/AB686)*100 -> 114.90909090909092 | AD686: =(X686*4)+(Z686*2) -> 24
A687: BEST PLAYERS | W687: NORTHERN BULLANTS | X687: 5 | Y687: 5 | Z687: 0 | AA687: 1036 | AB687: 915 | AC687: =(AA687/AB687)*100 -> 113.224043715847 | AD687: =(X687*4)+(Z687*2) -> 20
A688: GEELONG | C688: JOHNSON | F688: CHATFIELD | I688: McGRATH | L688: ABLETT | O688: CARAZZO | R688: WOOLNOUGH
A689: CARLTON | C689: FLEMING | W689: WILLIAMSTOWN | X689: 5 | Y689: 5 | Z689: 0 | AA689: 1111 | AB689: 988 | AC689: =(AA689/AB689)*100 -> 112.4493927125506 | AD689: =(X689*4)+(Z689*2) -> 20
A690: GOALKICKERS | M690: MERRIMAN | O690: O'BRIEN | Q690: POWELL | S690: WOOLNOUGH | W690: CARLTON | X690: 5 | Y690: 5 | Z690: 0 | AA690: 947 | AB690: 966 | AC690: =(AA690/AB690)*100 -> 98.033126293995863 | AD690: =(X690*4)+(Z690*2) -> 20
A691: GEELONG | C691: JOHNSON 6 | F691: ABLETT 4 | I691: MENSCH 3 | K691: MOONEY 3 | M691: CARAZZO 2 | P691: HUNT | R691: McCARTHY | W691: SPRINGVALE | X691: 5 | Y691: 5 | Z691: 0 | AA691: 836 | AB691: 882 | AC691: =(AA691/AB691)*100 -> 94.784580498866205 | AD691: =(X691*4)+(Z691*2) -> 20
A692: CARLTON | C692: FREEBORN 2 | F692: BRAY | H692: HOLMES | J692: HOULIHAN | M692: PRENDERGAST | W692: TASMANIA | X692: 4 | Y692: 5 | Z692: 1 | AA692: 917 | AB692: 1017 | AC692: =(AA692/AB692)*100 -> 90.167158308751226 | AD692: =(X692*4)+(Z692*2) -> 18
W693: ESSENDON | X693: 4 | Y693: 6 | Z693: 0 | AA693: 1063 | AB693: 1171 | AC693: =(AA693/AB693)*100 -> 90.777113578138341 | AD693: =(X693*4)+(Z693*2) -> 16
A694: MURRAY KANGAROOS | C694: 3 | D694: 3 | E694: =(C694*6)+D694 -> 21 | G694: 7 | H694: 6 | I694: =(G694*6)+H694 -> 48 | K694: 12 | L694: 9 | M694: =(K694*6)+L694 -> 81 | O694: 16 | P694: 13 | Q694: =(O694*6)+P694 -> 109 | S694: Venue: COBURG | W694: NORTH BALLARAT | X694: 2 | Y694: 8 | Z694: 0 | AA694: 746 | AB694: 1109 | AC694: =(AA694/AB694)*100 -> 67.267808836789897 | AD694: =(X694*4)+(Z694*2) -> 8
A695: COBURG | C695: 3 | D695: 2 | E695: =(C695*6)+D695 -> 20 | G695: 5 | H695: 5 | I695: =(G695*6)+H695 -> 35 | K695: 7 | L695: 6 | M695: =(K695*6)+L695 -> 48 | O695: 10 | P695: 6 | Q695: =(O695*6)+P695 -> 66 | W695: FRANKSTON | X695: 0 | Y695: 10 | Z695: 0 | AA695: 747 | AB695: 1249 | AC695: =(AA695/AB695)*100 -> 59.807846277021618 | AD695: =(X695*4)+(Z695*2) -> 0
A696: BEST PLAYERS | W696: BENDIGO | X696: 0 | Y696: 10 | Z696: 0 | AA696: 643 | AB696: 1545 | AC696: =(AA696/AB696)*100 -> 41.618122977346275 | AD696: =(X696*4)+(Z696*2) -> 0
A697: MURRAY KANGAROOS | C697: RAWLINGS | F697: WATT | I697: PETRIE | L697: SMITH | N697: COCHRANE | Q697: BOURKE
A698: COBURG | C698: TALBOT | F698: MILLS | I698: TAYLOR
A699: GOALKICKERS
A700: MURRAY KANGAROOS | C700: TREGENZA 4 | F700: COOPER 3 | I700: LANGE 3 | K700: WATSON 2 | N700: HALE | P700: D MOTLOP | R700: PETRIE | T700: SMITH
A701: COBURG | C701: HART 2 | F701: KURET 2 | I701: TAYLOR 2 | L701: BUTLER | N701: FIORA | P701: EDNIE | R701: HUDSON
D702: 9TH JUNE | J702: WEATHER
A703: TASMANIA | C703: 2 | D703: 0 | E703: =(C703*6)+D703 -> 12 | G703: 6 | H703: 0 | I703: =(G703*6)+H703 -> 36 | K703: 8 | L703: 4 | M703: =(K703*6)+L703 -> 52 | O703: 11 | P703: 8 | Q703: =(O703*6)+P703 -> 74 | S703: Venue: ULVERSTONE
A704: BOX HILL | C704: 6 | D704: 2 | E704: =(C704*6)+D704 -> 38 | G704: 7 | H704: 4 | I704: =(G704*6)+H704 -> 46 | K704: 8 | L704: 7 | M704: =(K704*6)+L704 -> 55 | O704: 11 | P704: 8 | Q704: =(O704*6)+P704 -> 74
A705: BEST PLAYERS
A706: TASMANIA | C706: BEVERIDGE | F706: JONES | I706: STEPHENS | L706: SANDERS | O706: BLIGHT | Q706: M GEAPPEN
A707: BOX HILL | C707: JOHNSON | F707: RIES | I707: COX | L707: FIRRITO | O707: BREWER | Q707: LOATS
A708: GOALKICKERS
A709: TASMANIA | C709: HEATLEY 4 | F709: ABEY 2 | I709: ATKIN | K709: M GEAPPEN | N709: JONES | P709: SHACKLETON | S709: CARTER
A710: BOX HILL | C710: PASSADOR 3 | F710: BAYFORD 2 | I710: NICHOLLS 2 | L710: WILLIAMS 2 | O710: FIRRITO | Q710: RIES
A712: PORT MELBOURNE | C712: 7 | D712: 3 | E712: =(C712*6)+D712 -> 45 | G712: 12 | H712: 6 | I712: =(G712*6)+H712 -> 78 | K712: 16 | L712: 8 | M712: =(K712*6)+L712 -> 104 | O712: 25 | P712: 13 | Q712: =(O712*6)+P712 -> 163 | S712: Venue: PORT MELBOURNE
A713: NORTH BALLARAT | C713: 2 | D713: 6 | E713: =(C713*6)+D713 -> 18 | G713: 7 | H713: 6 | I713: =(G713*6)+H713 -> 48 | K713: 12 | L713: 8 | M713: =(K713*6)+L713 -> 80 | O713: 13 | P713: 8 | Q713: =(O713*6)+P713 -> 86
A714: BEST PLAYERS
A715: PORT MELBOURNE | C715: BENNETT | F715: L ABLETT | I715: PHIBBS | L715: EVANS | N715: O'LOUGHLIN | Q715: ANSTEY
A716: NORTH BALLARAT | C716: JENKINS | F716: CLAYTON | I716: DAWES | L716: BROWN | N716: GREIG | Q716: MURRIHY
A717: GOALKICKERS | S717: SUNDQUIST
A718: PORT MELBOURNE | C718: PHIBBS 5 | E718: O'LOUGHLIN 3 | H718: ALOI 2 | J718: EVANS 2 | L718: GILL 2 | N718: McGLONE 2 | Q718: McMAHON 2 | T718: POWELL 2 | W718: R ABLETT | X718: L ABLETT | AA718: POWER | AC718: ROBERTSON
A719: NORTH BALLARAT | C719: DAWES 3 | F719: BEST 3 | I719: CLAYTON 2 | L719: BROWN | N719: BYE | P719: JENKINS | R719: McNAMARA | U719: PERKINS
A721: ESSENDON | C721: 7 | D721: 0 | E721: =(C721*6)+D721 -> 42 | G721: 9 | H721: 1 | I721: =(G721*6)+H721 -> 55 | K721: 13 | L721: 7 | M721: =(K721*6)+L721 -> 85 | O721: 18 | P721: 12 | Q721: =(O721*6)+P721 -> 120 | S721: Venue: NORTH BALLARAT
A722: FRANKSTON | C722: 3 | D722: 1 | E722: =(C722*6)+D722 -> 19 | G722: 9 | H722: 6 | I722: =(G722*6)+H722 -> 60 | K722: 13 | L722: 7 | M722: =(K722*6)+L722 -> 85 | O722: 17 | P722: 10 | Q722: =(O722*6)+P722 -> 112
A723: BEST PLAYERS
A724: ESSENDON | C724: HALL | F724: McALISTER | I724: MAHONEY | L724: HENNEMAN
A725: FRANKSTON | C725: SAUTNER | F725: C CLARKE | I725: BURGMAN | L725: GEORGIOU | O725: ABLETT | Q725: LITTLE
A726: GOALKICKERS
A727: ESSENDON | C727: BULLEN 3 | F727: RUNNELLS 3 | I727: WINTER 3 | L727: HARVEY 2 | N727: McALISTER 2 | Q727: MAHONEY 2 | T727: BANNISTER | W727: HALL | X727: HUNT
A728: FRANKSTON | C728: SAUTNER 8 | F728: POLLARD 2 | I728: SALISBURY 2 | L728: ABLETT | N728: CADD | P728: C CLARKE | R728: GEORGIOU | U728: FERRARO
A730: SANDRINGHAM | C730: 3 | D730: 3 | E730: =(C730*6)+D730 -> 21 | G730: 6 | H730: 9 | I730: =(G730*6)+H730 -> 45 | K730: 7 | L730: 12 | M730: =(K730*6)+L730 -> 54 | O730: 13 | P730: 14 | Q730: =(O730*6)+P730 -> 92 | S730: Venue: WILLIAMSTOWN
A731: WILLIAMSTOWN | C731: 2 | D731: 2 | E731: =(C731*6)+D731 -> 14 | G731: 5 | H731: 3 | I731: =(G731*6)+H731 -> 33 | K731: 9 | L731: 7 | M731: =(K731*6)+L731 -> 61 | O731: 12 | P731: 13 | Q731: =(O731*6)+P731 -> 85
A732: BEST PLAYERS
A733: SANDRINGHAM | C733: HAYWARD | F733: LAMB | I733: OAKLEY | L733: FUNCKE | O733: McDONALD | R733: ARMSTRONG
A734: WILLIAMSTOWN | C734: FLETCHER | F734: SCOTLAND | I734: DOOLEY | L734: PEARCE
A735: GOALKICKERS
A736: SANDRINGHAM | C736: OAKLEY 5 | F736: ARMSTRONG 2 | J736: THOMPSON 2 | M736: COGHLAN | O736: FUNCKE | Q736: LIDDELL | S736: TREGEAR
A737: WILLIAMSTOWN | C737: CUMMINGS 3 | F737: DAVIDSON | I737: DOOLEY | K737: FLETCHER | M737: KINNEAR | O737: LOVETT-MURRAY | R737: PODSIADLY | U737: SCOTLAND | X737: CORCORAN | AA737: SWAN
A739: WERRIBEE | C739: 3 | D739: 4 | E739: =(C739*6)+D739 -> 22 | G739: 7 | H739: 11 | I739: =(G739*6)+H739 -> 53 | K739: 12 | L739: 12 | M739: =(K739*6)+L739 -> 84 | O739: 17 | P739: 16 | Q739: =(O739*6)+P739 -> 118 | S739: Venue: BENDIGO
A740: BENDIGO | C740: 2 | D740: 4 | E740: =(C740*6)+D740 -> 16 | G740: 2 | H740: 4 | I740: =(G740*6)+H740 -> 16 | K740: 5 | L740: 8 | M740: =(K740*6)+L740 -> 38 | O740: 7 | P740: 10 | Q740: =(O740*6)+P740 -> 52
A741: BEST PLAYERS
A742: WERRIBEE | C742: FAULKNER | F742: MITCHELL | I742: WIGGINS | L742: McMAHON | O742: POWER
A743: BENDIGO | C743: VANCE | F743: CAIL | I743: CARTER | L743: EATON | O743: PROCTOR
A744: GOALKICKERS
A745: WERRIBEE | C745: MITCHELL 5 | F745: WIGGINS 3 | I745: McGUINNESS 2 | L745: ANTONOWICZ | O745: BOWDEN | Q745: HAHN | S745: LAMB | U745: McMAHON | X745: SKIPPER | Z745: POWER
A746: BENDIGO | C746: BROWN 2 | F746: M BRADLEY 2 | I746: CAIL | J746: CARTER | L746: EATON
A748: ROUND 11 | D748: 22ND JUNE | J748: WEATHER
D749: 1ST QTR | H749: 2ND QTR | L749: 3RD QTR | P749: FINAL | S749: Venue: SHELL STADIUM
A750: GEELONG | C750: 3 | D750: 3 | E750: =(C750*6)+D750 -> 21 | G750: 7 | H750: 5 | I750: =(G750*6)+H750 -> 47 | K750: 10 | L750: 9 | M750: =(K750*6)+L750 -> 69 | O750: 14 | P750: 12 | Q750: =(O750*6)+P750 -> 96 | S750: UMPIRES | Y750: LADDER | AB750: ROUND | AD750: 11
A751: PORT MELBOURNE | C751: 1 | D751: 1 | E751: =(C751*6)+D751 -> 7 | G751: 5 | H751: 5 | I751: =(G751*6)+H751 -> 35 | K751: 5 | L751: 7 | M751: =(K751*6)+L751 -> 37 | O751: 9 | P751: 11 | Q751: =(O751*6)+P751 -> 65
A752: BEST PLAYERS | W752: TEAM | X752: W | Y752: L | Z752: D | AA752: FOR | AB752: AGST | AC752: % | AD752: PTS
A753: GEELONG | C753: MENSCH | F753: RAHILLY | I753: CHATFIELD | L753: McCARTHY | O753: STREET | R753: HUNT
A754: PORT MELBOURNE | C754: McPHERSON | F754: BARRY | I754: COTCHETT | L754: KIRK | O754: MATTHEWS | W754: GEELONG | X754: 9 | Y754: 2 | Z754: 0 | AA754: 1293 | AB754: 680 | AC754: =(AA754/AB754)*100 -> 190.14705882352939 | AD754: =(X754*4)+(Z754*2) -> 36
A755: GOALKICKERS | W755: BOX HILL | X755: 8 | Y755: 2 | Z755: 1 | AA755: 1291 | AB755: 890 | AC755: =(AA755/AB755)*100 -> 145.0561797752809 | AD755: =(X755*4)+(Z755*2) -> 34
A756: GEELONG | C756: McCARTHY 4 | F756: MENSCH 4 | I756: STREET 2 | L756: HUNT | N756: D JOHNSON | Q756: O'BRIEN | S756: RAHILLY | W756: COBURG | X756: 8 | Y756: 3 | Z756: 0 | AA756: 1062 | AB756: 928 | AC756: =(AA756/AB756)*100 -> 114.43965517241379 | AD756: =(X756*4)+(Z756*2) -> 32
A757: PORT MELBOURNE | C757: McPHERSON 3 | F757: KIRK 2 | I757: ALOI | J757: MATTHEWS | M757: O'KEEFE | O757: STEVENS | W757: SANDRINGHAM | X757: 7 | Y757: 4 | Z757: 0 | AA757: 1112 | AB757: 907 | AC757: =(AA757/AB757)*100 -> 122.60198456449835 | AD757: =(X757*4)+(Z757*2) -> 28
W758: MURRAY KANGAROOS | X758: 7 | Y758: 4 | Z758: 0 | AA758: 1251 | AB758: 1051 | AC758: =(AA758/AB758)*100 -> 119.02949571836345 | AD758: =(X758*4)+(Z758*2) -> 28
A759: COBURG | C759: 5 | D759: 7 | E759: =(C759*6)+D759 -> 37 | G759: 8 | H759: 13 | I759: =(G759*6)+H759 -> 61 | K759: 10 | L759: 18 | M759: =(K759*6)+L759 -> 78 | O759: 13 | P759: 20 | Q759: =(O759*6)+P759 -> 98 | S759: Venue: COBURG | W759: PORT MELBOURNE | X759: 7 | Y759: 4 | Z759: 0 | AA759: 1143 | AB759: 990 | AC759: =(AA759/AB759)*100 -> 115.45454545454545 | AD759: =(X759*4)+(Z759*2) -> 28
A760: FRANKSTON | C760: 0 | D760: 0 | E760: =(C760*6)+D760 -> 0 | G760: 2 | H760: 7 | I760: =(G760*6)+H760 -> 19 | K760: 4 | L760: 10 | M760: =(K760*6)+L760 -> 34 | O760: 8 | P760: 15 | Q760: =(O760*6)+P760 -> 63 | W760: WERRIBEE | X760: 7 | Y760: 4 | Z760: 0 | AA760: 1047 | AB760: 923 | AC760: =(AA760/AB760)*100 -> 113.43445287107259 | AD760: =(X760*4)+(Z760*2) -> 28
A761: BEST PLAYERS | W761: WILLIAMSTOWN | X761: 6 | Y761: 5 | Z761: 0 | AA761: 1210 | AB761: 1058 | AC761: =(AA761/AB761)*100 -> 114.36672967863895 | AD761: =(X761*4)+(Z761*2) -> 24
A762: COBURG | C762: FIORA | F762: PAGAN | I762: MILLS | L762: TAYLOR | O762: EDNIE
A763: FRANKSTON | C763: LITTLE | F763: D CLARKE | I763: FRATER | L763: SAUTNER | O763: WILLIS | Q763: WINTERTON | W763: NORTHERN BULLANTS | X763: 6 | Y763: 5 | Z763: 0 | AA763: 1158 | AB763: 1031 | AC763: =(AA763/AB763)*100 -> 112.31813773035888 | AD763: =(X763*4)+(Z763*2) -> 24
A764: GOALKICKERS | R764: TAYLOR | W764: CARLTON | X764: 6 | Y764: 5 | Z764: 0 | AA764: 1087 | AB764: 1011 | AC764: =(AA764/AB764)*100 -> 107.51730959446093 | AD764: =(X764*4)+(Z764*2) -> 24
A765: COBURG | C765: PETTIFER 3 | F765: HUDSON 3 | I765: McGRATH 2 | L765: FIORA | N765: MAGGIORE | Q765: MILLS | S765: POYAS | W765: SPRINGVALE | X765: 5 | Y765: 6 | Z765: 0 | AA765: 934 | AB765: 981 | AC765: =(AA765/AB765)*100 -> 95.208970438328237 | AD765: =(X765*4)+(Z765*2) -> 20
A766: FRANKSTON | C766: SAUTNER 6 | F766: FERGUSON | I766: KENNEDY | W766: ESSENDON | X766: 5 | Y766: 6 | Z766: 0 | AA766: 1161 | AB766: 1253 | AC766: =(AA766/AB766)*100 -> 92.657621707901043 | AD766: =(X766*4)+(Z766*2) -> 20
W767: TASMANIA | X767: 4 | Y767: 6 | Z767: 1 | AA767: 1010 | AB767: 1121 | AC767: =(AA767/AB767)*100 -> 90.098126672613745 | AD767: =(X767*4)+(Z767*2) -> 18
A768: WERRIBEE | C768: 3 | D768: 4 | E768: =(C768*6)+D768 -> 22 | G768: 8 | H768: 8 | I768: =(G768*6)+H768 -> 56 | K768: 11 | L768: 12 | M768: =(K768*6)+L768 -> 78 | O768: 14 | P768: 15 | Q768: =(O768*6)+P768 -> 99 | S768: Venue: MOORABBIN | W768: NORTH BALLARAT | X768: 2 | Y768: 9 | Z768: 0 | AA768: 791 | AB768: 1249 | AC768: =(AA768/AB768)*100 -> 63.330664531625303 | AD768: =(X768*4)+(Z768*2) -> 8
A769: SPRINGVALE | C769: 4 | D769: 4 | E769: =(C769*6)+D769 -> 28 | G769: 5 | H769: 7 | I769: =(G769*6)+H769 -> 37 | K769: 11 | L769: 12 | M769: =(K769*6)+L769 -> 78 | O769: 14 | P769: 14 | Q769: =(O769*6)+P769 -> 98 | W769: FRANKSTON | X769: 0 | Y769: 11 | Z769: 0 | AA769: 810 | AB769: 1347 | AC769: =(AA769/AB769)*100 -> 60.133630289532292 | AD769: =(X769*4)+(Z769*2) -> 0
A770: BEST PLAYERS | W770: BENDIGO | X770: 0 | Y770: 11 | Z770: 0 | AA770: 703 | AB770: 1644 | AC770: =(AA770/AB770)*100 -> 42.761557177615572 | AD770: =(X770*4)+(Z770*2) -> 0
A771: WERRIBEE | C771: CROSS | F771: POWER | I771: McMAHON | L771: HAHN | N771: PICKEN | Q771: ROBERTSON
A772: SPRINGVALE | C772: DAVIS | F772: DILLON | I772: BEGLEY | L772: CARROLL | N772: SMITH | Q772: TROLLOPE
A773: GOALKICKERS | P773: SMITH | R773: WIGGINS
A774: WERRIBEE | C774: ROBBINS 3 | E774: HAHN 2 | G774: MITCHELL 2 | J774: CROSS | L774: McMAHON | N774: McGUINNESS | Q774: POWER | S774: ROBERTSON
A775: SPRINGVALE | C775: SMITH 4 | F775: HARRISON 3 | I775: DAVIS 2 | K775: CARMODY 2 | N775: DILLON | P775: CRANSTON | R775: SCHWARZE
D776: 23RD JUNE | J776: WEATHER
A777: SANDRINGHAM | C777: 3 | D777: 2 | E777: =(C777*6)+D777 -> 20 | G777: 7 | H777: 8 | I777: =(G777*6)+H777 -> 50 | K777: 10 | L777: 10 | M777: =(K777*6)+L777 -> 70 | O777: 15 | P777: 14 | Q777: =(O777*6)+P777 -> 104 | S777: Venue: NORTH HOBART OVAL
A778: TASMANIA | C778: 4 | D778: 2 | E778: =(C778*6)+D778 -> 26 | G778: 8 | H778: 2 | I778: =(G778*6)+H778 -> 50 | K778: 12 | L778: 4 | M778: =(K778*6)+L778 -> 76 | O778: 14 | P778: 9 | Q778: =(O778*6)+P778 -> 93
A779: BEST PLAYERS
A780: SANDRINGHAM | C780: POWELL | F780: HAYWARD | I780: TEMPLETON | L780: GRANT | N780: McDONALD | Q780: BREESE
A781: TASMANIA | C781: BLIGHT | F781: CARELESS | I781: M GEAPPEN | L781: B GEAPPEN
A782: GOALKICKERS
A783: SANDRINGHAM | C783: TEMPLETON 4 | F783: WHEATLEY 2 | I783: AINLEY | K783: FERRARO | M783: FUNCKE | O783: HAYWARD | Q783: JAMAR | S783: LIDDELL | U783: ROBBINS | X783: WILSON
A784: TASMANIA | C784: BEAMS 4 | F784: BLIGHT 3 | I784: CALLINAN 2 | L784: M GEAPPEN 2 | O784: ATKIN | Q784: CARTER | S784: HULM
A786: NORTHERN BULLANTS | C786: 8 | D786: 3 | E786: =(C786*6)+D786 -> 51 | G786: 10 | H786: 5 | I786: =(G786*6)+H786 -> 65 | K786: 16 | L786: 9 | M786: =(K786*6)+L786 -> 105 | O786: 18 | P786: 14 | Q786: =(O786*6)+P786 -> 122 | S786: Venue: COBURG
A787: MURRAY KANGAROOS | C787: 5 | D787: 1 | E787: =(C787*6)+D787 -> 31 | G787: 9 | H787: 4 | I787: =(G787*6)+H787 -> 58 | K787: 10 | L787: 7 | M787: =(K787*6)+L787 -> 67 | O787: 17 | P787: 14 | Q787: =(O787*6)+P787 -> 116
A788: BEST PLAYERS
A789: NORTHERN BULLANTS | C789: SAGE | F789: CANN | I789: RASO | L789: WATSON | O789: COLLINS | R789: PATERSON
A790: MURRAY KANGAROOS | C790: PETRIE | F790: D MOTLOP | I790: RAWLINGS | L790: S MOTLOP | O790: HALE | R790: BAIRD
A791: GOALKICKERS
A792: NORTHERN BULLANTS | C792: WATSON 4 | F792: GIBSON 3 | I792: PATERSON 2 | L792: CANN | N792: COLLINS | P792: FAVRIN | R792: GRAINGER | U792: SAGE | W792: STEVENSON | X792: TAYLOR | Z792: WALSH | AB792: ZORZI
A793: MURRAY KANGAROOS | C793: TREGENZA 3 | F793: BOURKE 2 | I793: BAIRD 2 | K793: HALE 2 | M793: D MOTLOP 2 | P793: COOPER | R793: S MOTLOP | U793: PETRIE | W793: RAWLINGS | X793: WATSON | AA793: WATT
A795: CARLTON | C795: 3 | D795: 2 | E795: =(C795*6)+D795 -> 20 | G795: 8 | H795: 2 | I795: =(G795*6)+H795 -> 50 | K795: 15 | L795: 5 | M795: =(K795*6)+L795 -> 95 | O795: 22 | P795: 8 | Q795: =(O795*6)+P795 -> 140 | S795: Venue: NORTH BALLARAT
A796: NORTH BALLARAT | C796: 2 | D796: 1 | E796: =(C796*6)+D796 -> 13 | G796: 4 | H796: 5 | I796: =(G796*6)+H796 -> 29 | K796: 5 | L796: 8 | M796: =(K796*6)+L796 -> 38 | O796: 6 | P796: 9 | Q796: =(O796*6)+P796 -> 45
A797: BEST PLAYERS
A798: CARLTON | C798: CRANAGE | F798: ECCLES | I798: PRENDERGAST | L798: BEASY
A799: NORTH BALLARAT | C799: CLAYTON | F799: BRADLY | I799: MAXWELL | L799: MOLONEY
A800: GOALKICKERS
A801: CARLTON | C801: PRENDERGAST 4 | F801: HOULIHAN 3 | I801: BERRY 3 | K801: CRANAGE 2 | N801: OGIER 2 | P801: MATTHEWS 2 | S801: BEASY | U801: HEDGE | W801: BEAUMONT | X801: CHRISTOU | AA801: SINNOTT | AC801: WAITE
A802: NORTH BALLARAT | C802: BRADLY 4 | F802: GREIG | H802: MAIN
A804: WILLIAMSTOWN | C804: 5 | D804: 5 | E804: =(C804*6)+D804 -> 35 | G804: 8 | H804: 10 | I804: =(G804*6)+H804 -> 58 | K804: 13 | L804: 12 | M804: =(K804*6)+L804 -> 90 | O804: 14 | P804: 15 | Q804: =(O804*6)+P804 -> 99 | S804: Venue: WILLIAMSTOWN
A805: BENDIGO | C805: 2 | D805: 2 | E805: =(C805*6)+D805 -> 14 | G805: 7 | H805: 3 | I805: =(G805*6)+H805 -> 45 | K805: 9 | L805: 6 | M805: =(K805*6)+L805 -> 60 | O805: 10 | P805: 10 | Q805: =(O805*6)+P805 -> 70
A806: BEST PLAYERS
A807: WILLIAMSTOWN | C807: WEST | F807: STEINFORT | I807: PODSIADLY | L807: DAVIDSON | O807: DIMMATINA | R807: DE ANGELIS
A808: BENDIGO | C808: GATHERCOLE | F808: BOVALINO | I808: EATON | L808: CAIL | O808: M BRADLEY | R808: JONES
A809: GOALKICKERS
A810: WILLIAMSTOWN | C810: CUMMINGS 3 | F810: DAVIDSON 3 | I810: PEARCE 2 | K810: ANDERSON | M810: LLOYD | O810: PODSIADLY | Q810: RICHARDS | T810: SMOKER | V810: STEINFORT
A811: BENDIGO | C811: BROWN 3 | F811: ELSUM | H811: GATHERCOLE | K811: HAWKINS | M811: HICKEY | O811: PROCTOR | Q811: VANCE | S811: YOUNG
A813: ESSENDON | C813: 3 | D813: 3 | E813: =(C813*6)+D813 -> 21 | G813: 5 | H813: 5 | I813: =(G813*6)+H813 -> 35 | K813: 12 | L813: 7 | M813: =(K813*6)+L813 -> 79 | O813: 15 | P813: 8 | Q813: =(O813*6)+P813 -> 98 | S813: Venue: BOX HILL
A814: BOX HILL | C814: 2 | D814: 3 | E814: =(C814*6)+D814 -> 15 | G814: 7 | H814: 5 | I814: =(G814*6)+H814 -> 47 | K814: 10 | L814: 6 | M814: =(K814*6)+L814 -> 66 | O814: 12 | P814: 10 | Q814: =(O814*6)+P814 -> 82
A815: BEST PLAYERS
A816: ESSENDON | C816: BOLTON | F816: McALISTER | I816: HALL | L816: McVEIGH | O816: FORSTER-KNIGHT | S816: MERCURI
A817: BOX HILL | C817: BREWER | F817: BANKS | I817: HARFORD | L817: KANE | O817: FIRRITI | S817: OSBORNE
A818: GOALKICKERS
A819: ESSENDON | C819: HARVEY 3 | E819: ALESSIO 2 | H819: McVEIGH 2 | J819: BANNISTER | M819: BULLEN | O819: HENNEMAN | R819: HUNT | T819: McALISTER | W819: MAHONEY | X819: MERCURI | AA819: MOORCROFT
A820: BOX HILL | C820: ELSTONE 2 | F820: HARFORD 2 | I820: OSBORNE 2 | L820: PASSADOR 2 | O820: WILLIAMS 2 | R820: BOWYER | U820: LONIE
A822: ROUND 12 | D822: 29TH JUNE | J822: WEATHER
D823: 1ST QTR | H823: 2ND QTR | L823: 3RD QTR | P823: FINAL | S823: Venue: M.C.G. (C/R)
A824: GEELONG | C824: 4 | D824: 0 | E824: =(C824*6)+D824 -> 24 | G824: 7 | H824: 4 | I824: =(G824*6)+H824 -> 46 | K824: 9 | L824: 6 | M824: =(K824*6)+L824 -> 60 | O824: 12 | P824: 7 | Q824: =(O824*6)+P824 -> 79 | S824: UMPIRES | Y824: LADDER | AB824: ROUND | AD824: 12
A825: COBURG | C825: 3 | D825: 2 | E825: =(C825*6)+D825 -> 20 | G825: 6 | H825: 3 | I825: =(G825*6)+H825 -> 39 | K825: 10 | L825: 3 | M825: =(K825*6)+L825 -> 63 | O825: 12 | P825: 6 | Q825: =(O825*6)+P825 -> 78
A826: BEST PLAYERS | W826: TEAM | X826: W | Y826: L | Z826: D | AA826: FOR | AB826: AGST | AC826: % | AD826: PTS
A827: GEELONG | C827: HUNT | F827: McGRATH | I827: CARAZZO | L827: SLADE | O827: CHATFIELD | R827: MERRIMAN
A828: COBURG | C828: HOULIHAN | F828: TALBOT | I828: KNIGHTS | L828: PAGAN | O828: EDNIE | R828: BUTLER | W828: GEELONG | X828: 10 | Y828: 2 | Z828: 0 | AA828: 1372 | AB828: 758 | AC828: =(AA828/AB828)*100 -> 181.00263852242745 | AD828: =(X828*4)+(Z828*2) -> 40
A829: GOALKICKERS | W829: BOX HILL | X829: 8 | Y829: 3 | Z829: 1 | AA829: 1368 | AB829: 969 | AC829: =(AA829/AB829)*100 -> 141.1764705882353 | AD829: =(X829*4)+(Z829*2) -> 34
A830: GEELONG | C830: GRGIC 3 | E830: MENSCH 3 | H830: SLADE 2 | K830: ABLETT | M830: BLACKNEY | P830: JOHNSON | R830: STREET | W830: WERRIBEE | X830: 8 | Y830: 4 | Z830: 0 | AA830: 1232 | AB830: 960 | AC830: =(AA830/AB830)*100 -> 128.33333333333334 | AD830: =(X830*4)+(Z830*2) -> 32
A831: COBURG | C831: EDNIE 2 | E831: PETTIFER 2 | H831: BIDDISCOMBE | K831: HOULIHAN | M831: HYDE | O831: KNIGHTS | Q831: McGRATH | S831: MILLER | W831: SANDRINGHAM | X831: 8 | Y831: 4 | Z831: 0 | AA831: 1263 | AB831: 1003 | AC831: =(AA831/AB831)*100 -> 125.92223330009971 | AD831: =(X831*4)+(Z831*2) -> 32
M832: TAYLOR | O832: MILLS | Q832: NEWMAN | W832: PORT MELBOURNE | X832: 8 | Y832: 4 | Z832: 0 | AA832: 1241 | AB832: 1039 | AC832: =(AA832/AB832)*100 -> 119.44177093358999 | AD832: =(X832*4)+(Z832*2) -> 32
A833: SPRINGVALE | C833: 2 | D833: 3 | E833: =(C833*6)+D833 -> 15 | G833: 5 | H833: 7 | I833: =(G833*6)+H833 -> 37 | K833: 9 | L833: 9 | M833: =(K833*6)+L833 -> 63 | O833: 11 | P833: 13 | Q833: =(O833*6)+P833 -> 79 | S833: Venue: BOX HILL | W833: COBURG | X833: 8 | Y833: 4 | Z833: 0 | AA833: 1140 | AB833: 1007 | AC833: =(AA833/AB833)*100 -> 113.20754716981132 | AD833: =(X833*4)+(Z833*2) -> 32
A834: BOX HILL | C834: 5 | D834: 2 | E834: =(C834*6)+D834 -> 32 | G834: 5 | H834: 5 | I834: =(G834*6)+H834 -> 35 | K834: 8 | L834: 9 | M834: =(K834*6)+L834 -> 57 | O834: 11 | P834: 11 | Q834: =(O834*6)+P834 -> 77 | W834: MURRAY KANGAROOS | X834: 7 | Y834: 5 | Z834: 0 | AA834: 1343 | AB834: 1156 | AC834: =(AA834/AB834)*100 -> 116.1764705882353 | AD834: =(X834*4)+(Z834*2) -> 28
A835: BEST PLAYERS | W835: WILLIAMSTOWN | X835: 7 | Y835: 5 | Z835: 0 | AA835: 1315 | AB835: 1150 | AC835: =(AA835/AB835)*100 -> 114.34782608695653 | AD835: =(X835*4)+(Z835*2) -> 28
A836: SPRINGVALE | C836: PITT | F836: RIGG | I836: CARROLL | L836: WOODMAN | O836: SMITH | R836: DEHEY
A837: BOX HILL | C837: KANE | F837: FIRRITO | I837: CLARKE | L837: BALL | O837: WOODS | W837: CARLTON | X837: 7 | Y837: 5 | Z837: 0 | AA837: 1221 | AB837: 1142 | AC837: =(AA837/AB837)*100 -> 106.91768826619965 | AD837: =(X837*4)+(Z837*2) -> 28
A838: GOALKICKERS | W838: NORTHERN BULLANTS | X838: 6 | Y838: 6 | Z838: 0 | AA838: 1289 | AB838: 1165 | AC838: =(AA838/AB838)*100 -> 110.64377682403435 | AD838: =(X838*4)+(Z838*2) -> 24
A839: SPRINGVALE | C839: SMITH 4 | F839: WOODMAN 2 | I839: DEHEY | K839: FREDERICKS | N839: OLIVER | P839: PITT | Q839: SCHWARZE | W839: SPRINGVALE | X839: 6 | Y839: 6 | Z839: 0 | AA839: 1013 | AB839: 1058 | AC839: =(AA839/AB839)*100 -> 95.746691871455582 | AD839: =(X839*4)+(Z839*2) -> 24
A840: BOX HILL | C840: WILLIAMS 4 | F840: ALLEWAY 2 | I840: BALL | K840: BOYCE | M840: KANE | O840: LONIE | Q840: WHYMAN | W840: TASMANIA | X840: 5 | Y840: 6 | Z840: 1 | AA840: 1110 | AB840: 1213 | AC840: =(AA840/AB840)*100 -> 91.508656224237427 | AD840: =(X840*4)+(Z840*2) -> 22
D841: 30TH JUNE | J841: WEATHER | W841: ESSENDON | X841: 5 | Y841: 7 | Z841: 0 | AA841: 1257 | AB841: 1404 | AC841: =(AA841/AB841)*100 -> 89.529914529914535 | AD841: =(X841*4)+(Z841*2) -> 20
A842: TASMANIA | C842: 8 | D842: 1 | E842: =(C842*6)+D842 -> 49 | G842: 11 | H842: 2 | I842: =(G842*6)+H842 -> 68 | K842: 12 | L842: 2 | M842: =(K842*6)+L842 -> 74 | O842: 16 | P842: 4 | Q842: =(O842*6)+P842 -> 100 | S842: Venue: YORK PARK (Launceston) | W842: NORTH BALLARAT | X842: 2 | Y842: 10 | Z842: 0 | AA842: 883 | AB842: 1349 | AC842: =(AA842/AB842)*100 -> 65.455893254262421 | AD842: =(X842*4)+(Z842*2) -> 8
A843: NORTH BALLARAT | C843: 2 | D843: 0 | E843: =(C843*6)+D843 -> 12 | G843: 5 | H843: 2 | I843: =(G843*6)+H843 -> 32 | K843: 12 | L843: 6 | M843: =(K843*6)+L843 -> 78 | O843: 14 | P843: 8 | Q843: =(O843*6)+P843 -> 92 | W843: FRANKSTON | X843: 0 | Y843: 12 | Z843: 0 | AA843: 847 | AB843: 1532 | AC843: =(AA843/AB843)*100 -> 55.287206266318535 | AD843: =(X843*4)+(Z843*2) -> 0
A844: BEST PLAYERS | W844: BENDIGO | X844: 0 | Y844: 12 | Z844: 0 | AA844: 752 | AB844: 1742 | AC844: =(AA844/AB844)*100 -> 43.168771526980478 | AD844: =(X844*4)+(Z844*2) -> 0
A845: TASMANIA | C845: HEATLEY | F845: BEAMS | I845: A TAYLOR | L845: M GEAPPEN | O845: STEPHENS
A846: NORTH BALLARAT | C846: KING | F846: POLKINGHORNE | I846: CLAYTON | L846: DAWES | O846: BROWN | R846: JENKINS
A847: GOALKICKERS
A848: TASMANIA | C848: HEATLEY 9 | F848: BEAMS 5 | I848: S TAYLOR 2
A849: NORTH BALLARAT | C849: DAWES 4 | E849: BRADLY 2 | H849: POLKINGHORNE 2 | L849: BEST | M849: CLAYTON | O849: COHEN | Q849: FRITH | S849: KING | U849: SPOLDING
A851: WERRIBEE | C851: 9 | D851: 6 | E851: =(C851*6)+D851 -> 60 | G851: 15 | H851: 9 | I851: =(G851*6)+H851 -> 99 | K851: 20 | L851: 14 | M851: =(K851*6)+L851 -> 134 | O851: 28 | P851: 17 | Q851: =(O851*6)+P851 -> 185 | S851: Venue: WERRIBEE
A852: FRANKSTON | C852: 2 | D852: 0 | E852: =(C852*6)+D852 -> 12 | G852: 2 | H852: 3 | I852: =(G852*6)+H852 -> 15 | K852: 2 | L852: 6 | M852: =(K852*6)+L852 -> 18 | O852: 5 | P852: 7 | Q852: =(O852*6)+P852 -> 37
A853: BEST PLAYERS
A854: WERRIBEE | C854: CROSS | F854: POWER | I854: McMAHON | L854: McGUINNES | O854: WIGGINS | R854: FAULKNER
A855: FRANKSTON | C855: DAFF | F855: LITTLE | I855: ABLETT
A856: GOALKICKERS | T856: WIGGINS
A857: WERRIBEE | C857: McGUINNESS 6 | F857: MITCHELL 5 | I857: HAHN 3 | K857: McMAHON 3 | N857: POWER 2 | P857: CROSS 2 | R857: BARTLETT | U857: DYER | W857: BOWDEN | X857: LAMB | Z857: PENNY | AB857: ROBERTSON
A858: FRANKSTON | C858: BURGMAN | F858: KENNEDY | I858: LITTLE | K858: WILLIS | M858: WINTERTON
A860: WILLIAMSTOWN | C860: 3 | D860: 1 | E860: =(C860*6)+D860 -> 19 | G860: 8 | H860: 3 | I860: =(G860*6)+H860 -> 51 | K860: 10 | L860: 5 | M860: =(K860*6)+L860 -> 65 | O860: 16 | P860: 9 | Q860: =(O860*6)+P860 -> 105 | S860: Venue: COBURG
A861: MURRAY KANGAROOS | C861: 5 | D861: 3 | E861: =(C861*6)+D861 -> 33 | G861: 7 | H861: 5 | I861: =(G861*6)+H861 -> 47 | K861: 12 | L861: 8 | M861: =(K861*6)+L861 -> 80 | O861: 14 | P861: 8 | Q861: =(O861*6)+P861 -> 92
A862: BEST PLAYERS
A863: WILLIAMSTOWN | C863: LOVETT-MURRAY | F863: CROWE | I863: LLOYD | L863: STEINFORT | O863: DIMMATINA | R863: ADKINS
A864: MURRAY KANGAROOS | C864: McLAREN | F864: McCORMICK | I864: CROWE | L864: FOOTT | O864: PORTER | R864: PRATT
A865: GOALKICKERS
A866: WILLIAMSTOWN | C866: DIMMATINA 4 | F866: KINNEAR 2 | I866: DE ANGELIS 2 | L866: ANDERSON | N866: DAVIDSON | Q866: FLETCHER | S866: LLOYD | U866: PODSIADLY | X866: RICHARDSON | AA866: STEINFORT
A867: MURRAY KANGAROOS | C867: HALE 2 | E867: McCORMICK 2 | H867: PORTER 2 | J867: TREGENZA 2 | M867: WATSON 2 | P867: CLAYTON | R867: COOPER | T867: LANGE | V867: D MOTLOP
A869: CARLTON | C869: 6 | D869: 2 | E869: =(C869*6)+D869 -> 38 | G869: 11 | H869: 5 | I869: =(G869*6)+H869 -> 71 | K869: 17 | L869: 6 | M869: =(K869*6)+L869 -> 108 | O869: 21 | P869: 8 | Q869: =(O869*6)+P869 -> 134 | S869: Venue: OPTUS OVAL
A870: NORTHERN BULLANTS | C870: 3 | D870: 8 | E870: =(C870*6)+D870 -> 26 | G870: 8 | H870: 11 | I870: =(G870*6)+H870 -> 59 | K870: 12 | L870: 12 | M870: =(K870*6)+L870 -> 84 | O870: 19 | P870: 17 | Q870: =(O870*6)+P870 -> 131
A871: BEST PLAYERS
A872: CARLTON | C872: ECCLES | F872: HOTTON | I872: SINNOT | L872: BERRY | O872: PICKERING | R872: MATTHEWS
A873: NORTHERN BULLANTS | C873: CANN | F873: RAMSAY | I873: WATSON | L873: TAYLOR | O873: ZORZI
A874: GOALKICKERS
A875: CARLTON | C875: BERRY 4 | E875: MATTHEWS 4 | H875: BEASY 2 | J875: GUTTERSON 2 | M875: HOTTON 2 | O875: SINNOT 2 | Q875: WAITE 2 | S875: CRANAGE | V875: PRENDERGAST
A876: NORTHERN BULLANTS | C876: GIBSON 3 | E876: SAGE 3 | G876: TAYLOR 3 | I876: CANN 2 | K876: CLARKE | M876: FAVRIN | O876: PATERSON | R876: PENN | T876: PILLING | V876: RAMSAY | X876: ZORZI
A878: PORT MELBOURNE | C878: 3 | D878: 4 | E878: =(C878*6)+D878 -> 22 | G878: 8 | H878: 10 | I878: =(G878*6)+H878 -> 58 | K878: 12 | L878: 10 | M878: =(K878*6)+L878 -> 82 | O878: 14 | P878: 14 | Q878: =(O878*6)+P878 -> 98 | S878: Venue: BENDIGO
A879: BENDIGO | C879: 1 | D879: 4 | E879: =(C879*6)+D879 -> 10 | G879: 2 | H879: 4 | I879: =(G879*6)+H879 -> 16 | K879: 5 | L879: 5 | M879: =(K879*6)+L879 -> 35 | O879: 7 | P879: 7 | Q879: =(O879*6)+P879 -> 49
A880: BEST PLAYERS
A881: PORT MELBOURNE | C881: OBST | F881: EVANS | I881: ROSE | L881: KIRK | N881: GILL
A882: BENDIGO | C882: CARTER | F882: BOVALINO | I882: BROWN | L882: EATON | N882: CAIL | Q882: GATHERCOLE
A883: GOALKICKERS
A884: PORT MELBOURNE | C884: STEVENS 6 | F884: ABLETT | H884: ALOI | J884: ANSTEY | L884: HUNT | N884: KIRK | P884: McMAHON | R884: O'LOUGHLIN | U884: POWELL
A885: BENDIGO | C885: BROWN 4 | F885: ELLIOTT | I885: EATON | K885: YOUNG
A887: SANDRINGHAM | C887: 6 | D887: 4 | E887: =(C887*6)+D887 -> 40 | G887: 12 | H887: 9 | I887: =(G887*6)+H887 -> 81 | K887: 19 | L887: 10 | M887: =(K887*6)+L887 -> 124 | O887: 23 | P887: 13 | Q887: =(O887*6)+P887 -> 151 | S887: Venue: BEACH ROAD
A888: ESSENDON | C888: 2 | D888: 0 | E888: =(C888*6)+D888 -> 12 | G888: 5 | H888: 4 | I888: =(G888*6)+H888 -> 34 | K888: 8 | L888: 7 | M888: =(K888*6)+L888 -> 55 | O888: 14 | P888: 12 | Q888: =(O888*6)+P888 -> 96
A889: BEST PLAYERS
A890: SANDRINGHAM | C890: WHEATLEY | F890: ARMSTRONG | I890: TEMPLETON | L890: WILLIAMS | N890: LYNCH | Q890: McDONALD
A891: ESSENDON | C891: BANNISTER | F891: REYNOLDS | I891: MAHONEY | L891: DAVIES | N891: RICHARDS
A892: GOALKICKERS
A893: SANDRINGHAM | C893: TEMPLETON 7 | F893: WHEATLEY 5 | I893: OAKLEY 4 | L893: LIDDELL 2 | O893: WILLIAMS 2 | R893: ARMSTRONG | V893: GODFREY | X893: GRANT
A894: ESSENDON | C894: BANNISTER 2 | F894: HARVEY 2 | I894: RICHARDS 2 | L894: RUNNALLS 2 | O894: BULLEN | Q894: HAWKINS | S894: HOWARD | V894: SHEPHERD | X894: MAHONEY | AA894: WILSON
A896: ROUND 13 | D896: 6TH JULY | J896: WEATHER
D897: 1ST QTR | H897: 2ND QTR | L897: 3RD QTR | P897: FINAL | S897: Venue: PRESTON
A898: SANDRINGHAM | C898: 3 | D898: 5 | E898: =(C898*6)+D898 -> 23 | G898: 8 | H898: 5 | I898: =(G898*6)+H898 -> 53 | K898: 12 | L898: 8 | M898: =(K898*6)+L898 -> 80 | O898: 13 | P898: 11 | Q898: =(O898*6)+P898 -> 89 | S898: UMPIRES | Y898: LADDER | AB898: ROUND | AD898: 13
A899: NORTHERN BULLANTS | C899: 1 | D899: 2 | E899: =(C899*6)+D899 -> 8 | G899: 2 | H899: 7 | I899: =(G899*6)+H899 -> 19 | K899: 5 | L899: 11 | M899: =(K899*6)+L899 -> 41 | O899: 9 | P899: 14 | Q899: =(O899*6)+P899 -> 68
A900: BEST PLAYERS | W900: TEAM | X900: W | Y900: L | Z900: D | AA900: FOR | AB900: AGST | AC900: % | AD900: PTS
A901: SANDRINGHAM | C901: LIDDELL | F901: OAKLEY | I901: GODFREY | L901: LYNCH | N901: WILLIAMS | Q901: ARMSTRONG
A902: NORTHERN BULLANTS | C902: ZORZI | F902: CANN | I902: RAMSAY | L902: STEPHENSON | W902: GEELONG | X902: 11 | Y902: 2 | Z902: 0 | AA902: 1428 | AB902: 803 | AC902: =(AA902/AB902)*100 -> 177.83312577833127 | AD902: =(X902*4)+(Z902*2) -> 44
A903: GOALKICKERS | W903: WERRIBEE | X903: 9 | Y903: 4 | Z903: 0 | AA903: 1400 | AB903: 1019 | AC903: =(AA903/AB903)*100 -> 137.38959764474976 | AD903: =(X903*4)+(Z903*2) -> 36
A904: SANDRINGHAM | C904: OAKLEY 3 | E904: WILLIAMS 3 | H904: WILSON 2 | K904: FUNCKE | M904: GRANT | O904: HAYWARD | Q904: JAMAR | S904: LIDDELL | W904: SANDRINGHAM | X904: 9 | Y904: 4 | Z904: 0 | AA904: 1352 | AB904: 1071 | AC904: =(AA904/AB904)*100 -> 126.23716153127917 | AD904: =(X904*4)+(Z904*2) -> 36
A905: NORTHERN BULLANTS | C905: CANN 2 | F905: FAVRIN | H905: GRAINGER | J905: HOOPER | L905: PENN | M905: SAGE | N905: WEBBER | P905: ZORZI | W905: PORT MELBOURNE | X905: 9 | Y905: 4 | Z905: 0 | AA905: 1372 | AB905: 1161 | AC905: =(AA905/AB905)*100 -> 118.17398794142979 | AD905: =(X905*4)+(Z905*2) -> 36
W906: COBURG | X906: 9 | Y906: 4 | Z906: 0 | AA906: 1239 | AB906: 1054 | AC906: =(AA906/AB906)*100 -> 117.55218216318785 | AD906: =(X906*4)+(Z906*2) -> 36
A907: TASMANIA | C907: 1 | D907: 1 | E907: =(C907*6)+D907 -> 7 | G907: 7 | H907: 10 | I907: =(G907*6)+H907 -> 52 | K907: 7 | L907: 10 | M907: =(K907*6)+L907 -> 52 | O907: 13 | P907: 16 | Q907: =(O907*6)+P907 -> 94 | S907: Venue: WILLIAMSTOWN | W907: BOX HILL | X907: 8 | Y907: 4 | Z907: 1 | AA907: 1490 | AB907: 1100 | AC907: =(AA907/AB907)*100 -> 135.45454545454544 | AD907: =(X907*4)+(Z907*2) -> 34
A908: WILLIAMSTOWN | C908: 2 | D908: 9 | E908: =(C908*6)+D908 -> 21 | G908: 2 | H908: 12 | I908: =(G908*6)+H908 -> 24 | K908: 7 | L908: 20 | M908: =(K908*6)+L908 -> 62 | O908: 8 | P908: 21 | Q908: =(O908*6)+P908 -> 69 | W908: MURRAY KANGAROOS | X908: 7 | Y908: 6 | Z908: 0 | AA908: 1398 | AB908: 1220 | AC908: =(AA908/AB908)*100 -> 114.59016393442623 | AD908: =(X908*4)+(Z908*2) -> 28
A909: BEST PLAYERS | W909: WILLIAMSTOWN | X909: 7 | Y909: 6 | Z909: 0 | AA909: 1384 | AB909: 1244 | AC909: =(AA909/AB909)*100 -> 111.2540192926045 | AD909: =(X909*4)+(Z909*2) -> 28
A910: TASMANIA | C910: CARTER | F910: M GEAPPEN | I910: STEVENS | L910: ATKIN | N910: BEAMS | Q910: JENKINS
A911: WILLIAMSTOWN | C911: LLOYD | F911: KELLY | I911: STEINFORT | L911: DIMATTINA | N911: KINNEAR | Q911: PEARCE | W911: CARLTON | X911: 7 | Y911: 6 | Z911: 0 | AA911: 1268 | AB911: 1241 | AC911: =(AA911/AB911)*100 -> 102.17566478646253 | AD911: =(X911*4)+(Z911*2) -> 28
A912: GOALKICKERS | W912: SPRINGVALE | X912: 7 | Y912: 6 | Z912: 0 | AA912: 1077 | AB912: 1113 | AC912: =(AA912/AB912)*100 -> 96.7654986522911 | AD912: =(X912*4)+(Z912*2) -> 28
A913: TASMANIA | C913: HEATLEY 3 | F913: ATKIN 2 | H913: BEAMS 2 | J913: BLAKE 2 | L913: BEVERIDGE | O913: CARTER | Q913: M GEAPPEN | T913: WAGER | W913: TASMANIA | X913: 6 | Y913: 6 | Z913: 1 | AA913: 1204 | AB913: 1282 | AC913: =(AA913/AB913)*100 -> 93.915756630265207 | AD913: =(X913*4)+(Z913*2) -> 26
A914: WILLIAMSTOWN | C914: STEINFORT 2 | F914: PEARCE 2 | I914: DIMATTINA | L914: KINNEAR | N914: RALPH | P914: RIPPON | W914: NORTHERN BULLANTS | X914: 6 | Y914: 7 | Z914: 0 | AA914: 1357 | AB914: 1254 | AC914: =(AA914/AB914)*100 -> 108.21371610845294 | AD914: =(X914*4)+(Z914*2) -> 24
W915: ESSENDON | X915: 5 | Y915: 8 | Z915: 0 | AA915: 1316 | AB915: 1572 | AC915: =(AA915/AB915)*100 -> 83.715012722646307 | AD915: =(X915*4)+(Z915*2) -> 20
A916: SPRINGVALE | C916: 2 | D916: 10 | E916: =(C916*6)+D916 -> 22 | G916: 5 | H916: 13 | I916: =(G916*6)+H916 -> 43 | K916: 7 | L916: 15 | M916: =(K916*6)+L916 -> 57 | O916: 8 | P916: 16 | Q916: =(O916*6)+P916 -> 64 | S916: Venue: LAVINGTON | W916: NORTH BALLARAT | X916: 2 | Y916: 11 | Z916: 0 | AA916: 928 | AB916: 1405 | AC916: =(AA916/AB916)*100 -> 66.04982206405694 | AD916: =(X916*4)+(Z916*2) -> 8
A917: MURRAY KANGAROOS | C917: 0 | D917: 1 | E917: =(C917*6)+D917 -> 1 | G917: 4 | H917: 2 | I917: =(G917*6)+H917 -> 26 | K917: 5 | L917: 4 | M917: =(K917*6)+L917 -> 34 | O917: 8 | P917: 7 | Q917: =(O917*6)+P917 -> 55 | W917: FRANKSTON | X917: 1 | Y917: 12 | Z917: 0 | AA917: 949 | AB917: 1586 | AC917: =(AA917/AB917)*100 -> 59.83606557377049 | AD917: =(X917*4)+(Z917*2) -> 4
A918: BEST PLAYERS | W918: BENDIGO | X918: 0 | Y918: 13 | Z918: 0 | AA918: 806 | AB918: 1844 | AC918: =(AA918/AB918)*100 -> 43.709327548806939 | AD918: =(X918*4)+(Z918*2) -> 0
A919: SPRINGVALE | C919: DEHAY | F919: RIGG | I919: CALLAGHAN | L919: KNOBEL | O919: CARMODY | R919: O'BRIEN
A920: MURRAY KANGAROOS | C920: WATT | F920: SOFI | I920: McCORMICK | L920: LANGE
A921: GOALKICKERS
A922: SPRINGVALE | C922: CALLAGHAN 3 | F922: OLIVER 2 | I922: BEGLEY | K922: SCHWARZE | N922: SMITH
A923: MURRAY KANGAROOS | C923: TREGENZA 2 | F923: BOURKE 2 | I923: COOPER | K923: DURLING | M923: STEVENS | O923: WATSON
D924: 7TH JULY | J924: WEATHER
A925: GEELONG | C925: 3 | D925: 2 | E925: =(C925*6)+D925 -> 20 | G925: 7 | H925: 4 | I925: =(G925*6)+H925 -> 46 | K925: 8 | L925: 6 | M925: =(K925*6)+L925 -> 54 | O925: 8 | P925: 8 | Q925: =(O925*6)+P925 -> 56 | S925: Venue: NORTH BALLARAT
A926: NORTH BALLARAT | C926: 1 | D926: 3 | E926: =(C926*6)+D926 -> 9 | G926: 2 | H926: 4 | I926: =(G926*6)+H926 -> 16 | K926: 6 | L926: 8 | M926: =(K926*6)+L926 -> 44 | O926: 6 | P926: 9 | Q926: =(O926*6)+P926 -> 45
A927: BEST PLAYERS
A928: GEELONG | C928: CHAMBERS | F928: JOVANOVIC | I928: O'BRIEN | L928: MERRIMAN | O928: MENSCH | R928: CHATFIELD
A929: NORTH BALLARAT | C929: JENKINS | F929: MOLONEY | I929: POLKINGHORNE | L929: LUBEEK | O929: MIDGELY | R929: CLAYTON
A930: GOALKICKERS
A931: GEELONG | C931: MENSCH 3 | F931: BLACKNEY | I931: CHAMBERS | L931: O'BRIEN | N931: STREET | P931: TREVASKIS
A932: NORTH BALLARAT | C932: BEST 2 | F932: CLAYTON | I932: KING | K932: MAXWELL | M932: NAWROCKI
A934: PORT MELBOURNE | C934: 2 | D934: 1 | E934: =(C934*6)+D934 -> 13 | G934: 8 | H934: 4 | I934: =(G934*6)+H934 -> 52 | K934: 11 | L934: 5 | M934: =(K934*6)+L934 -> 71 | O934: 20 | P934: 11 | Q934: =(O934*6)+P934 -> 131 | S934: Venue: PORT MELBOURNE
A935: BOX HILL | C935: 8 | D935: 3 | E935: =(C935*6)+D935 -> 51 | G935: 11 | H935: 7 | I935: =(G935*6)+H935 -> 73 | K935: 18 | L935: 14 | M935: =(K935*6)+L935 -> 122 | O935: 18 | P935: 14 | Q935: =(O935*6)+P935 -> 122
A936: BEST PLAYERS
A937: PORT MELBOURNE | C937: KIRK | F937: ALEXANDER | I937: EVANS | K937: BENNETT | N937: J ANSTEY | Q937: SEYMOUR
A938: BOX HILL | C938: BANKS | F938: WILLIAMS | I938: BALL | K938: PICIAONE | N938: KANE
A939: GOALKICKERS
A940: PORT MELBOURNE | C940: R ABLETT 5 | F940: J ANSTEY 3 | I940: ALEXANDER 3 | L940: EVANS 2 | N940: HUNT 2 | P940: S ANSTEY | R940: BENNETT | U940: COTCHETT | X940: SEYMOUR | AA940: SUNDQUIST
A941: BOX HILL | C941: BANKS 5 | F941: WILLIAMS 5 | I941: PICIAONE 2 | L941: ALLEWAY | N941: BALL | P941: BAYFORD | R941: CASSIDY | U941: FIRRITO | X941: PASSADOR
A943: FRANKSTON | C943: 6 | D943: 1 | E943: =(C943*6)+D943 -> 37 | G943: 9 | H943: 6 | I943: =(G943*6)+H943 -> 60 | K943: 12 | L943: 8 | M943: =(K943*6)+L943 -> 80 | O943: 15 | P943: 12 | Q943: =(O943*6)+P943 -> 102 | S943: Venue: FRANKSTON
A944: BENDIGO | C944: 2 | D944: 2 | E944: =(C944*6)+D944 -> 14 | G944: 3 | H944: 6 | I944: =(G944*6)+H944 -> 24 | K944: 4 | L944: 11 | M944: =(K944*6)+L944 -> 35 | O944: 7 | P944: 12 | Q944: =(O944*6)+P944 -> 54
A945: BEST PLAYERS
A946: FRANKSTON | C946: KREIG | F946: C CLARKE | I946: ABLETT | K946: BURGMANN | N946: FOLINO | Q946: WILLIS
A947: BENDIGO | C947: CARTER | F947: HAWKINS | I947: E BOWEN | K947: EATON
A948: GOALKICKERS
A949: FRANKSTON | C949: SAUTNER 5 | F949: KREIG 4 | I949: ANDERSON 2 | L949: GEORGIOU | N949: POLLARD | Q949: SALISBURY | T949: N WINTERTON
A950: BENDIGO | C950: M BROWN 2 | F950: E BOWEN 2 | I950: KRAKOUER | L950: PROCTOR | N950: VANCE
A952: WERRIBEE | C952: 5 | D952: 3 | E952: =(C952*6)+D952 -> 33 | G952: 14 | H952: 8 | I952: =(G952*6)+H952 -> 92 | K952: 17 | L952: 12 | M952: =(K952*6)+L952 -> 114 | O952: 25 | P952: 18 | Q952: =(O952*6)+P952 -> 168 | S952: Venue: WERRIBEE
A953: ESSENDON | C953: 2 | D953: 4 | E953: =(C953*6)+D953 -> 16 | G953: 3 | H953: 7 | I953: =(G953*6)+H953 -> 25 | K953: 7 | L953: 9 | M953: =(K953*6)+L953 -> 51 | O953: 8 | P953: 11 | Q953: =(O953*6)+P953 -> 59
A954: BEST PLAYERS
A955: WERRIBEE | C955: DIMATTINA | F955: BARTLETT | I955: POWER | K955: MITCHELL | N955: BOWDEN | Q955: SETCHELL
A956: ESSENDON | C956: HILLE | F956: MAHONEY | I956: HUNT | K956: RICHARDS | N956: McALISTER | Q956: McGRATH
A957: GOALKICKERS | S957: SMITH
A958: WERRIBEE | C958: DIMATTINA 6 | F958: MITCHELL 4 | I958: HAHN 3 | K958: SETCHELL 2 | N958: SKIPPER 2 | Q958: WIGGINS 2 | T958: COLLINS | W958: FAULKNER | X958: GILBEE | Z958: LAMB | AB958: ROBBINS
A959: ESSENDON | C959: HARVEY 3 | F959: BULLEN | H959: HALL | J959: HILLE | L959: McALISTER | O959: SHEPHERD
A961: COBURG | C961: 0 | D961: 4 | E961: =(C961*6)+D961 -> 4 | G961: 5 | H961: 7 | I961: =(G961*6)+H961 -> 37 | K961: 9 | L961: 11 | M961: =(K961*6)+L961 -> 65 | O961: 14 | P961: 15 | Q961: =(O961*6)+P961 -> 99 | S961: Venue: COBURG
A962: CARLTON | C962: 1 | D962: 0 | E962: =(C962*6)+D962 -> 6 | G962: 2 | H962: 2 | I962: =(G962*6)+H962 -> 14 | K962: 4 | L962: 3 | M962: =(K962*6)+L962 -> 27 | O962: 7 | P962: 5 | Q962: =(O962*6)+P962 -> 47
A963: BEST PLAYERS
A964: COBURG | C964: MILLS | F964: PAGAN | I964: HOULIHAN | L964: MILLER | N964: TAYLOR | Q964: KRAKOUER
A965: CARLTON | C965: SINNOTT | F965: O'KEEFE | I965: BEASY
A966: GOALKICKERS
A967: COBURG | C967: HUDSON 4 | F967: MILLER 3 | I967: MILLS 2 | K967: KRAKOUER 2 | N967: TAYLOR 2 | Q967: HOULIHAN
A968: CARLTON | C968: GUTTERSON 2 | F968: HEDGE | H968: MATTHEWS | K968: PRENDERGAST | N968: WAITE | P968: WATSON
A970: ROUND 14 | D970: 13TH JULY | J970: WEATHER
D971: 1ST QTR | H971: 2ND QTR | L971: 3RD QTR | P971: FINAL | S971: Venue: WERRIBEE
A972: WERRIBEE | C972: 4 | D972: 2 | E972: =(C972*6)+D972 -> 26 | G972: 9 | H972: 7 | I972: =(G972*6)+H972 -> 61 | K972: 12 | L972: 10 | M972: =(K972*6)+L972 -> 82 | O972: 18 | P972: 18 | Q972: =(O972*6)+P972 -> 126 | S972: UMPIRES | Y972: LADDER | AB972: ROUND | AD972: 14
A973: BOX HILL | C973: 5 | D973: 8 | E973: =(C973*6)+D973 -> 38 | G973: 10 | H973: 11 | I973: =(G973*6)+H973 -> 71 | K973: 12 | L973: 14 | M973: =(K973*6)+L973 -> 86 | O973: 13 | P973: 14 | Q973: =(O973*6)+P973 -> 92
A974: BEST PLAYERS | W974: TEAM | X974: W | Y974: L | Z974: D | AA974: FOR | AB974: AGST | AC974: % | AD974: PTS
A975: WERRIBEE | C975: BIRSS | F975: SAUNDERS | I975: EAGLETON | L975: LAMB | N975: BOWDEN | Q975: FAULKNER
A976: BOX HILL | C976: MITCHELL | F976: GEORGIADIS | I976: ALLEWAY | L976: OSBORNE | N976: STONE | Q976: WLSTONE | W976: GEELONG | X976: 11 | Y976: 3 | Z976: 0 | AA976: 1494 | AB976: 883 | AC976: =(AA976/AB976)*100 -> 169.19592298980749 | AD976: =(X976*4)+(Z976*2) -> 44
A977: GOALKICKERS | M977: BIRSS | O977: POWER | Q977: WIGGINS | S977: PICKEN | W977: WERRIBEE | X977: 10 | Y977: 4 | Z977: 0 | AA977: 1526 | AB977: 1111 | AC977: =(AA977/AB977)*100 -> 137.35373537353735 | AD977: =(X977*4)+(Z977*2) -> 40
A978: WERRIBEE | C978: SAUNDERS 3 | F978: GILBEE 2 | H978: LAMB 2 | J978: BOWDEN 2 | M978: MITCHELL 2 | P978: EAGLETON 2 | S978: DYER | W978: COBURG | X978: 10 | Y978: 4 | Z978: 0 | AA978: 1336 | AB978: 1111 | AC978: =(AA978/AB978)*100 -> 120.25202520252026 | AD978: =(X978*4)+(Z978*2) -> 40
A979: BOX HILL | C979: ALLEWAY 3 | F979: BANKS 2 | H979: WATTS 2 | J979: WILLIAMS 2 | M979: BALL | O979: CASSIDY | Q979: OSBORNE | S979: PASSADOR | W979: PORT MELBOURNE | X979: 10 | Y979: 4 | Z979: 0 | AA979: 1487 | AB979: 1248 | AC979: =(AA979/AB979)*100 -> 119.15064102564104 | AD979: =(X979*4)+(Z979*2) -> 40
W980: SANDRINGHAM | X980: 9 | Y980: 5 | Z980: 0 | AA980: 1407 | AB980: 1144 | AC980: =(AA980/AB980)*100 -> 122.98951048951048 | AD980: =(X980*4)+(Z980*2) -> 36
A981: PORT MELBOURNE | C981: 1 | D981: 2 | E981: =(C981*6)+D981 -> 8 | G981: 6 | H981: 7 | I981: =(G981*6)+H981 -> 43 | K981: 10 | L981: 11 | M981: =(K981*6)+L981 -> 71 | O981: 17 | P981: 13 | Q981: =(O981*6)+P981 -> 115 | S981: Venue: FRANKSTON | W981: BOX HILL | X981: 8 | Y981: 5 | Z981: 1 | AA981: 1582 | AB981: 1226 | AC981: =(AA981/AB981)*100 -> 129.03752039151712 | AD981: =(X981*4)+(Z981*2) -> 34
A982: FRANKSTON | C982: 1 | D982: 2 | E982: =(C982*6)+D982 -> 8 | G982: 3 | H982: 4 | I982: =(G982*6)+H982 -> 22 | K982: 6 | L982: 5 | M982: =(K982*6)+L982 -> 41 | O982: 13 | P982: 9 | Q982: =(O982*6)+P982 -> 87 | W982: WILLIAMSTOWN | X982: 8 | Y982: 6 | Z982: 0 | AA982: 1464 | AB982: 1310 | AC982: =(AA982/AB982)*100 -> 111.7557251908397 | AD982: =(X982*4)+(Z982*2) -> 32
A983: BEST PLAYERS | W983: CARLTON | X983: 8 | Y983: 6 | Z983: 0 | AA983: 1341 | AB983: 1296 | AC983: =(AA983/AB983)*100 -> 103.47222222222223 | AD983: =(X983*4)+(Z983*2) -> 32
A984: PORT MELBOURNE | C984: BUCHANAN | F984: ALOI | I984: SEYMOUR | L984: OBST | N984: McPHERSON | Q984: PHIBBS
A985: FRANKSTON | C985: FOLINO | F985: BURGMANN | I985: ANDERSON | L985: SAUTNER | N985: N WINTERTON | Q985: LITTLE | W985: MURRAY KANGAROOS | X985: 7 | Y985: 6 | Z985: 1 | AA985: 1487 | AB985: 1309 | AC985: =(AA985/AB985)*100 -> 113.598166539343 | AD985: =(X985*4)+(Z985*2) -> 30
A986: GOALKICKERS | Q986: O'KEEFE | W986: TASMANIA | X986: 7 | Y986: 6 | Z986: 1 | AA986: 1296 | AB986: 1358 | AC986: =(AA986/AB986)*100 -> 95.434462444771725 | AD986: =(X986*4)+(Z986*2) -> 30
A987: PORT MELBOURNE | C987: BUCHANAN 4 | F987: PHIBBS 4 | H987: ALOI 2 | J987: R ABLETT 2 | M987: SEYMOUR | O987: McPHERSON | R987: ANSTEY | T987: EVANS | W987: SPRINGVALE | X987: 7 | Y987: 7 | Z987: 0 | AA987: 1153 | AB987: 1205 | AC987: =(AA987/AB987)*100 -> 95.684647302904565 | AD987: =(X987*4)+(Z987*2) -> 28
A988: FRANKSTON | C988: SAUTNER 7 | F988: TIBERI 2 | H988: FRATER | J988: ANDERSON | M988: D CLARKE | O988: POLLARD | W988: NORTHERN BULLANTS | X988: 6 | Y988: 8 | Z988: 0 | AA988: 1414 | AB988: 1351 | AC988: =(AA988/AB988)*100 -> 104.66321243523315 | AD988: =(X988*4)+(Z988*2) -> 24
W989: ESSENDON | X989: 6 | Y989: 8 | Z989: 0 | AA989: 1442 | AB989: 1628 | AC989: =(AA989/AB989)*100 -> 88.574938574938571 | AD989: =(X989*4)+(Z989*2) -> 24
A990: ESSENDON | C990: 3 | D990: 2 | E990: =(C990*6)+D990 -> 20 | G990: 9 | H990: 5 | I990: =(G990*6)+H990 -> 59 | K990: 11 | L990: 7 | M990: =(K990*6)+L990 -> 73 | O990: 19 | P990: 12 | Q990: =(O990*6)+P990 -> 126 | S990: Venue: WINDY HILL | W990: NORTH BALLARAT | X990: 2 | Y990: 12 | Z990: 0 | AA990: 984 | AB990: 1531 | AC990: =(AA990/AB990)*100 -> 64.27171783148269 | AD990: =(X990*4)+(Z990*2) -> 8
A991: NORTH BALLARAT | C991: 5 | D991: 6 | E991: =(C991*6)+D991 -> 36 | G991: 7 | H991: 6 | I991: =(G991*6)+H991 -> 48 | K991: 8 | L991: 7 | M991: =(K991*6)+L991 -> 55 | O991: 8 | P991: 8 | Q991: =(O991*6)+P991 -> 56 | W991: FRANKSTON | X991: 1 | Y991: 13 | Z991: 0 | AA991: 1036 | AB991: 1701 | AC991: =(AA991/AB991)*100 -> 60.905349794238681 | AD991: =(X991*4)+(Z991*2) -> 4
A992: BEST PLAYERS | W992: BENDIGO | X992: 0 | Y992: 13 | Z992: 1 | AA992: 895 | AB992: 1933 | AC992: =(AA992/AB992)*100 -> 46.301086394205896 | AD992: =(X992*4)+(Z992*2) -> 2
A993: ESSENDON | C993: MAHONEY | F993: RICHARDS | I993: DAVIES | L993: C McGRATH | O993: HALL
A994: NORTH BALLARAT | C994: JENKINS | F994: KING | I994: CLAYTON | L994: FIRTH | O994: POLKINGHORNE
A995: GOALKICKERS | O995: HOWARD | Q995: HALL
A996: ESSENDON | C996: HAWKINS 6 | F996: MAHONEY 4 | I996: ARCHARD 3 | L996: RUNNELLS | N996: DARCY | P996: BARNES | R996: C McGRATH
A997: NORTH BALLARAT | C997: CLAYTON 2 | F997: BEST 2 | I997: MIDGLEY | K997: DAWES | M997: SPOLDING | O997: BYE
A999: CARLTON | C999: 4 | D999: 5 | E999: =(C999*6)+D999 -> 29 | G999: 5 | H999: 6 | I999: =(G999*6)+H999 -> 36 | K999: 9 | L999: 12 | M999: =(K999*6)+L999 -> 66 | O999: 10 | P999: 13 | Q999: =(O999*6)+P999 -> 73 | S999: Venue: BEACH ROAD
A1000: SANDRINGHAM | C1000: 1 | D1000: 1 | E1000: =(C1000*6)+D1000 -> 7 | G1000: 3 | H1000: 3 | I1000: =(G1000*6)+H1000 -> 21 | K1000: 4 | L1000: 4 | M1000: =(K1000*6)+L1000 -> 28 | O1000: 8 | P1000: 7 | Q1000: =(O1000*6)+P1000 -> 55
A1001: BEST PLAYERS
A1002: CARLTON | C1002: PLUNKETT | F1002: MANSFIELD | I1002: CHRISTOU | L1002: DAVIES | O1002: O'KEEFE | R1002: DAVIS
A1003: SANDRINGHAM | C1003: ARMSTRONG | F1003: BROADBRIDGE | I1003: BREESE
A1004: GOALKICKERS
A1005: CARLTON | C1005: BEASY 2 | F1005: SINNOTT 2 | I1005: CRANAGE 2 | L1005: GUTTERSON 2 | O1005: CHRISTOU | Q1005: DAVIS
A1006: SANDRINGHAM | C1006: MILLER 2 | F1006: J RADFORD | I1006: OAKLEY | K1006: TEMPLETON | N1006: FUNCKE | P1006: JAMAR | R1006: McDONALD
A1008: COBURG | C1008: 2 | D1008: 6 | E1008: =(C1008*6)+D1008 -> 18 | G1008: 4 | H1008: 8 | I1008: =(G1008*6)+H1008 -> 32 | K1008: 8 | L1008: 11 | M1008: =(K1008*6)+L1008 -> 59 | O1008: 14 | P1008: 13 | Q1008: =(O1008*6)+P1008 -> 97 | S1008: Venue: PRESTON
A1009: NORTH BULL | C1009: 1 | D1009: 2 | E1009: =(C1009*6)+D1009 -> 8 | G1009: 2 | H1009: 4 | I1009: =(G1009*6)+H1009 -> 16 | K1009: 4 | L1009: 4 | M1009: =(K1009*6)+L1009 -> 28 | O1009: 8 | P1009: 9 | Q1009: =(O1009*6)+P1009 -> 57
A1010: BEST PLAYERS
A1011: COBURG | C1011: ROGERS | F1011: STEINFORT | I1011: WESTON | L1011: TALBOT | N1011: HOULIHAN | Q1011: TAYLOR
A1012: NORTH BULL | C1012: WATSON | F1012: RAMSAY | I1012: ZORZI | L1012: CANN | N1012: STEVENSON
A1013: GOALKICKERS
A1014: COBURG | C1014: KRAKOUER 2 | F1014: HUDSON 2 | I1014: TAYLOR 2 | K1014: ROGERS | M1014: KURET | O1014: McGRATH | Q1014: RICHARDSON | T1014: HOULIHAN | W1014: STEINFORT | X1014: KING | Z1014: HART
A1015: NORTH BULL | C1015: CANN 2 | F1015: ZORZI 2 | I1015: WATSON | K1015: GRAINGER | M1015: SAGE | N1015: STEVENSON
D1016: 14TH JULY | J1016: WEATHER
A1017: BENDIGO | C1017: 4 | D1017: 2 | E1017: =(C1017*6)+D1017 -> 26 | G1017: 8 | H1017: 7 | I1017: =(G1017*6)+H1017 -> 55 | K1017: 11 | L1017: 13 | M1017: =(K1017*6)+L1017 -> 79 | O1017: 12 | P1017: 17 | Q1017: =(O1017*6)+P1017 -> 89 | S1017: Venue: BENDIGO
A1018: MURRAY KANGAROOS | C1018: 3 | D1018: 6 | E1018: =(C1018*6)+D1018 -> 24 | G1018: 6 | H1018: 7 | I1018: =(G1018*6)+H1018 -> 43 | K1018: 10 | L1018: 13 | M1018: =(K1018*6)+L1018 -> 73 | O1018: 12 | P1018: 17 | Q1018: =(O1018*6)+P1018 -> 89
A1019: BEST PLAYERS
A1020: BENDIGO | C1020: EATON | F1020: BOVALINO | I1020: HUESTON | L1020: CARTER | N1020: PROCTOR | Q1020: N BOWEN
A1021: MURRAY KANGAROOS | C1021: HALE | F1021: WATT | I1021: McLAREN | L1021: LANGE
A1022: GOALKICKERS
A1023: BENDIGO | C1023: PROCTOR 3 | F1023: DOHERTY 2 | I1023: ELSUM 2 | K1023: BROWN | M1023: HAWKINS | P1023: HUESTON | R1023: LOUGHMAN | U1023: EATON
A1024: MURRAY KANGAROOS | C1024: TREGENZA 4 | F1024: BLAKEY 2 | I1024: BOURKE | K1024: CROWE | M1024: HALE | N1024: STEVENS | P1024: TRENFIELD
A1026: TASMANIA | C1026: 2 | D1026: 4 | E1026: =(C1026*6)+D1026 -> 16 | G1026: 7 | H1026: 6 | I1026: =(G1026*6)+H1026 -> 48 | K1026: 10 | L1026: 11 | M1026: =(K1026*6)+L1026 -> 71 | O1026: 13 | P1026: 14 | Q1026: =(O1026*6)+P1026 -> 92 | S1026: Venue: NORTH HOBART OVAL
A1027: SPRINGVALE | C1027: 3 | D1027: 4 | E1027: =(C1027*6)+D1027 -> 22 | G1027: 6 | H1027: 9 | I1027: =(G1027*6)+H1027 -> 45 | K1027: 7 | L1027: 13 | M1027: =(K1027*6)+L1027 -> 55 | O1027: 10 | P1027: 16 | Q1027: =(O1027*6)+P1027 -> 76
A1028: BEST PLAYERS
A1029: TASMANIA | C1029: ATKIN | F1029: BEVERIDGE | I1029: WALKER | L1029: WAGER | O1029: STEPHENS | R1029: JENKINS
A1030: SPRINGVALE | C1030: RIGG | F1030: SMITH | I1030: HARRISON | L1030: CALLAGHAN | O1030: SCHWARZE
A1031: GOALKICKERS
A1032: TASMANIA | C1032: BEAMS 3 | F1032: CALLINAN 2 | I1032: HEATLEY 2 | L1032: BEVERIDGE | N1032: BLIGHT | P1032: CARTER | R1032: M GEAPPEN | U1032: PRACIAK | X1032: WAGER
A1033: SPRINGVALE | C1033: SMITH 3 | F1033: SCHWARZE 2 | I1033: BEGLEY | K1033: CALLAGHAN | N1033: FREDERICKS | Q1033: O'BRIEN | S1033: OLIVER
A1035: WILLIAMSTOWN | C1035: 1 | D1035: 2 | E1035: =(C1035*6)+D1035 -> 8 | G1035: 4 | H1035: 9 | I1035: =(G1035*6)+H1035 -> 33 | K1035: 7 | L1035: 11 | M1035: =(K1035*6)+L1035 -> 53 | O1035: 11 | P1035: 14 | Q1035: =(O1035*6)+P1035 -> 80 | S1035: Venue: KARDINIA PARK
A1036: GEELONG | C1036: 2 | D1036: 2 | E1036: =(C1036*6)+D1036 -> 14 | G1036: 4 | H1036: 4 | I1036: =(G1036*6)+H1036 -> 28 | K1036: 7 | L1036: 6 | M1036: =(K1036*6)+L1036 -> 48 | O1036: 9 | P1036: 12 | Q1036: =(O1036*6)+P1036 -> 66
A1037: BEST PLAYERS
A1038: WILLIAMSTOWN | C1038: LONIE | F1038: ANDERSON | I1038: PODSIADLY | L1038: MOLLOY | N1038: DE ANGELIS | Q1038: DIMATTINA
A1039: GEELONG | C1039: WOOLNOUGH | F1039: STREET | I1039: SLADE | L1039: ABLETT | N1039: FOSTER | Q1039: McGRATH
A1040: GOALKICKERS
A1041: WILLIAMSTOWN | C1041: PODSIADLY 4 | F1041: MOLLOY 3 | I1041: DAVIDSON | K1041: KELLY | M1041: RALPH | O1041: SMOKER
A1042: GEELONG | C1042: McCARTHY 2 | F1042: MENSCH 2 | I1042: BARTEL | K1042: O'BRIEN | M1042: POWELL | O1042: SLADE | Q1042: STREET
A1044: ROUND 15 | D1044: 20TH JULY | J1044: WEATHER
D1045: 1ST QTR | H1045: 2ND QTR | L1045: 3RD QTR | P1045: FINAL | S1045: Venue: COBURG
A1046: COBURG | C1046: 4 | D1046: 1 | E1046: =(C1046*6)+D1046 -> 25 | G1046: 6 | H1046: 2 | I1046: =(G1046*6)+H1046 -> 38 | K1046: 8 | L1046: 5 | M1046: =(K1046*6)+L1046 -> 53 | O1046: 13 | P1046: 7 | Q1046: =(O1046*6)+P1046 -> 85 | S1046: UMPIRES | Y1046: LADDER | AB1046: ROUND | AD1046: 15
A1047: WILLIAMSTOWN | C1047: 3 | D1047: 4 | E1047: =(C1047*6)+D1047 -> 22 | G1047: 5 | H1047: 6 | I1047: =(G1047*6)+H1047 -> 36 | K1047: 9 | L1047: 7 | M1047: =(K1047*6)+L1047 -> 61 | O1047: 11 | P1047: 11 | Q1047: =(O1047*6)+P1047 -> 77
A1048: BEST PLAYERS | W1048: TEAM | X1048: W | Y1048: L | Z1048: D | AA1048: FOR | AB1048: AGST | AC1048: % | AD1048: PTS
A1049: COBURG | C1049: MILLS | F1049: TAYLOR | I1049: DE PASQUALE | L1049: TALBOT | O1049: HUDSON | R1049: HYDE
A1050: WILLIAMSTOWN | C1050: FLETCHER | F1050: McGOUGH | I1050: SWAN | L1050: DIMATTINA | O1050: ANDERSON | R1050: DE ANGELIS | W1050: GEELONG | X1050: 12 | Y1050: 3 | Z1050: 0 | AA1050: 1599 | AB1050: 986 | AC1050: =(AA1050/AB1050)*100 -> 162.17038539553752 | AD1050: =(X1050*4)+(Z1050*2) -> 48
A1051: GOALKICKERS | W1051: WERRIBEE | X1051: 11 | Y1051: 4 | Z1051: 0 | AA1051: 1648 | AB1051: 1159 | AC1051: =(AA1051/AB1051)*100 -> 142.19154443485763 | AD1051: =(X1051*4)+(Z1051*2) -> 44
A1052: COBURG | C1052: HUDSON 4 | F1052: HYDE 2 | H1052: McGRATH 2 | K1052: MILLER 2 | M1052: HART | O1052: KING | P1052: TAYLOR | W1052: PORT MELBOURNE | X1052: 11 | Y1052: 4 | Z1052: 0 | AA1052: 1590 | AB1052: 1310 | AC1052: =(AA1052/AB1052)*100 -> 121.37404580152671 | AD1052: =(X1052*4)+(Z1052*2) -> 44
A1053: WILLIAMSTOWN | C1053: LOVETT-MURRAY 2 | G1053: PODSIADLY 2 | J1053: SMOKER 2 | M1053: SWAN 2 | O1053: FLETCHER | Q1053: RALPH | S1053: KINNEAR | W1053: COBURG | X1053: 11 | Y1053: 4 | Z1053: 0 | AA1053: 1421 | AB1053: 1188 | AC1053: =(AA1053/AB1053)*100 -> 119.61279461279462 | AD1053: =(X1053*4)+(Z1053*2) -> 44
W1054: BOX HILL | X1054: 9 | Y1054: 5 | Z1054: 1 | AA1054: 1679 | AB1054: 1307 | AC1054: =(AA1054/AB1054)*100 -> 128.46212700841622 | AD1054: =(X1054*4)+(Z1054*2) -> 38
A1055: PORT MELBOURNE | C1055: 5 | D1055: 0 | E1055: =(C1055*6)+D1055 -> 30 | G1055: 7 | H1055: 7 | I1055: =(G1055*6)+H1055 -> 49 | K1055: 13 | L1055: 10 | M1055: =(K1055*6)+L1055 -> 88 | O1055: 15 | P1055: 13 | Q1055: =(O1055*6)+P1055 -> 103 | S1055: Venue: PRESTON | W1055: SANDRINGHAM | X1055: 9 | Y1055: 6 | Z1055: 0 | AA1055: 1488 | AB1055: 1241 | AC1055: =(AA1055/AB1055)*100 -> 119.90330378726833 | AD1055: =(X1055*4)+(Z1055*2) -> 36
A1056: NORTHERN BULLANTS | C1056: 4 | D1056: 1 | E1056: =(C1056*6)+D1056 -> 25 | G1056: 6 | H1056: 2 | I1056: =(G1056*6)+H1056 -> 38 | K1056: 8 | L1056: 3 | M1056: =(K1056*6)+L1056 -> 51 | O1056: 9 | P1056: 8 | Q1056: =(O1056*6)+P1056 -> 62 | W1056: MURRAY KANGAROOS | X1056: 8 | Y1056: 6 | Z1056: 1 | AA1056: 1605 | AB1056: 1390 | AC1056: =(AA1056/AB1056)*100 -> 115.46762589928056 | AD1056: =(X1056*4)+(Z1056*2) -> 34
A1057: BEST PLAYERS | W1057: WILLIAMSTOWN | X1057: 8 | Y1057: 7 | Z1057: 0 | AA1057: 1541 | AB1057: 1395 | AC1057: =(AA1057/AB1057)*100 -> 110.46594982078852 | AD1057: =(X1057*4)+(Z1057*2) -> 32
A1058: PORT MELBOURNE | C1058: O'LOUGHLIN | F1058: O'KEEFE | I1058: McMAHON | L1058: OBST | O1058: McPHERSON | R1058: SCHIRMER
A1059: NORTHERN BULLANTS | C1059: ZORZI | F1059: PENN | I1059: CANN | L1059: STEVENSON | O1059: VANSITART | W1059: CARLTON | X1059: 8 | Y1059: 7 | Z1059: 0 | AA1059: 1409 | AB1059: 1376 | AC1059: =(AA1059/AB1059)*100 -> 102.3982558139535 | AD1059: =(X1059*4)+(Z1059*2) -> 32
A1060: GOALKICKERS | W1060: SPRINGVALE | X1060: 8 | Y1060: 7 | Z1060: 0 | AA1060: 1233 | AB1060: 1273 | AC1060: =(AA1060/AB1060)*100 -> 96.857816182246665 | AD1060: =(X1060*4)+(Z1060*2) -> 32
A1061: PORT MELBOURNE | C1061: R ABLETT 4 | F1061: O'KEEFE 3 | I1061: PHIBBS 3 | K1061: FILANDIA 2 | N1061: ALEXANDER | Q1061: ALOI | S1061: McPHERSON | W1061: TASMANIA | X1061: 7 | Y1061: 7 | Z1061: 1 | AA1061: 1344 | AB1061: 1480 | AC1061: =(AA1061/AB1061)*100 -> 90.810810810810821 | AD1061: =(X1061*4)+(Z1061*2) -> 30
A1062: NORTHERN BULLANTS | C1062: GRAINGER 2 | F1062: ZORZI 2 | I1062: CANN | K1062: CRAMP | M1062: HOOPER | O1062: PENN | Q1062: SAGE | W1062: NORTHERN BULLANTS | X1062: 6 | Y1062: 9 | Z1062: 0 | AA1062: 1476 | AB1062: 1454 | AC1062: =(AA1062/AB1062)*100 -> 101.51306740027511 | AD1062: =(X1062*4)+(Z1062*2) -> 24
W1063: ESSENDON | X1063: 6 | Y1063: 9 | Z1063: 0 | AA1063: 1545 | AB1063: 1733 | AC1063: =(AA1063/AB1063)*100 -> 89.151759953837271 | AD1063: =(X1063*4)+(Z1063*2) -> 24
A1064: WERRIBEE | C1064: 8 | D1064: 3 | E1064: =(C1064*6)+D1064 -> 51 | G1064: 11 | H1064: 6 | I1064: =(G1064*6)+H1064 -> 72 | K1064: 13 | L1064: 8 | M1064: =(K1064*6)+L1064 -> 86 | O1064: 18 | P1064: 14 | Q1064: =(O1064*6)+P1064 -> 122 | S1064: Venue: WERRIBEE | W1064: NORTH BALLARAT | X1064: 3 | Y1064: 12 | Z1064: 0 | AA1064: 1073 | AB1064: 1562 | AC1064: =(AA1064/AB1064)*100 -> 68.693982074263758 | AD1064: =(X1064*4)+(Z1064*2) -> 12
A1065: TASMANIA | C1065: 1 | D1065: 2 | E1065: =(C1065*6)+D1065 -> 8 | G1065: 2 | H1065: 5 | I1065: =(G1065*6)+H1065 -> 17 | K1065: 4 | L1065: 6 | M1065: =(K1065*6)+L1065 -> 30 | O1065: 7 | P1065: 6 | Q1065: =(O1065*6)+P1065 -> 48 | W1065: FRANKSTON | X1065: 1 | Y1065: 14 | Z1065: 0 | AA1065: 1117 | AB1065: 1819 | AC1065: =(AA1065/AB1065)*100 -> 61.40736668499175 | AD1065: =(X1065*4)+(Z1065*2) -> 4
A1066: BEST PLAYERS | W1066: BENDIGO | X1066: 0 | Y1066: 14 | Z1066: 1 | AA1066: 926 | AB1066: 2022 | AC1066: =(AA1066/AB1066)*100 -> 45.796241345202773 | AD1066: =(X1066*4)+(Z1066*2) -> 2
A1067: WERRIBEE | C1067: GILBEE | F1067: EAGLETON | I1067: FAULKNER | L1067: WIGGINS | O1067: DYER | R1067: LAMB
A1068: TASMANIA | C1068: CARELESS | F1068: WALKER | I1068: WAGER | L1068: JONES | O1068: STEPHENS | R1068: HOWARD
A1069: GOALKICKERS | O1069: LAMB | Q1069: PICKEN | S1069: POWER
A1070: WERRIBEE | C1070: GILBEE 3 | E1070: MITCHELL 3 | H1070: WIGGINS 3 | J1070: FAULKNER 2 | M1070: JACK 2 | O1070: EAGLETON | R1070: McGUINNESS
A1071: TASMANIA | C1071: HEATLEY (2) | F1071: BEAMS | H1071: CARTER | J1071: SANDERS | L1071: TAYLOR | N1071: WAGER
A1073: SPRINGVALE | C1073: 6 | D1073: 1 | E1073: =(C1073*6)+D1073 -> 37 | G1073: 7 | H1073: 4 | I1073: =(G1073*6)+H1073 -> 46 | K1073: 11 | L1073: 6 | M1073: =(K1073*6)+L1073 -> 72 | O1073: 12 | P1073: 8 | Q1073: =(O1073*6)+P1073 -> 80 | S1073: Venue: OPTUS OVAL
A1074: CARLTON | C1074: 2 | D1074: 4 | E1074: =(C1074*6)+D1074 -> 16 | G1074: 4 | H1074: 5 | I1074: =(G1074*6)+H1074 -> 29 | K1074: 9 | L1074: 6 | M1074: =(K1074*6)+L1074 -> 60 | O1074: 10 | P1074: 8 | Q1074: =(O1074*6)+P1074 -> 68
A1075: BEST PLAYERS
A1076: SPRINGVALE | C1076: O'BRIEN | F1076: SMITH | I1076: CARMODY | L1076: HARRISON | O1076: DAVIS | R1076: OLIVER
A1077: CARLTON | C1077: WATSON | F1077: HEDGE | I1077: ECCLES | L1077: O'KEEFE | O1077: CRANAGE | R1077: PLUNKETT
A1078: GOALKICKERS
A1079: SPRINGVALE | C1079: SMITH 5 | F1079: DAVIS 2 | H1079: HARRISON | J1079: HOULIHAN | M1079: KNOBEL | O1079: O'BRIEN | Q1079: OLIVER
A1080: CARLTON | C1080: MERRINGTON 3 | F1080: BERRY 2 | I1080: HEDGE 2 | K1080: CRANAGE | M1080: GUTTERSON | P1080: PRENDERGAST
A1082: NORTH BALLARAT | C1082: 2 | D1082: 4 | E1082: =(C1082*6)+D1082 -> 16 | G1082: 6 | H1082: 9 | I1082: =(G1082*6)+H1082 -> 45 | K1082: 10 | L1082: 13 | M1082: =(K1082*6)+L1082 -> 73 | O1082: 12 | P1082: 17 | Q1082: =(O1082*6)+P1082 -> 89 | S1082: Venue: NORTH BALLARAT
A1083: BENDIGO | C1083: 2 | D1083: 3 | E1083: =(C1083*6)+D1083 -> 15 | G1083: 3 | H1083: 3 | I1083: =(G1083*6)+H1083 -> 21 | K1083: 3 | L1083: 4 | M1083: =(K1083*6)+L1083 -> 22 | O1083: 4 | P1083: 7 | Q1083: =(O1083*6)+P1083 -> 31
A1084: BEST PLAYERS
A1085: NORTH BALLARAT | C1085: GREIG | F1085: POLKINGHORNE | J1085: FRITH | M1085: JENKINS | P1085: CLAYTON | R1085: BRADLY
A1086: BENDIGO | C1086: HAWKINS | F1086: ANDERSON | J1086: BOVALINO | M1086: CAILS | P1086: VANCE
A1087: GOALKICKERS
A1088: NORTH BALLARAT | C1088: CLAYTON 2 | F1088: DAWES 2 | I1088: BRADLY | K1088: BEST | M1088: BROWN | O1088: BYE | P1088: FRITH | R1088: GREIG | T1088: MAXWELL | W1088: MIDGLEY
A1089: BENDIGO | C1089: ANDERSON | F1089: BOWEN | I1089: KRAKOUER | L1089: PROCTOR
D1090: 21ST JULY | J1090: WEATHER
A1091: BOX HILL | C1091: 2 | D1091: 2 | E1091: =(C1091*6)+D1091 -> 14 | G1091: 6 | H1091: 4 | I1091: =(G1091*6)+H1091 -> 40 | K1091: 11 | L1091: 11 | M1091: =(K1091*6)+L1091 -> 77 | O1091: 14 | P1091: 13 | Q1091: =(O1091*6)+P1091 -> 97 | S1091: Venue: BOX HILL
A1092: SANDRINGHAM | C1092: 3 | D1092: 1 | E1092: =(C1092*6)+D1092 -> 19 | G1092: 5 | H1092: 6 | I1092: =(G1092*6)+H1092 -> 36 | K1092: 8 | L1092: 7 | M1092: =(K1092*6)+L1092 -> 55 | O1092: 12 | P1092: 9 | Q1092: =(O1092*6)+P1092 -> 81
A1093: BEST PLAYERS
A1094: BOX HILL | C1094: WILLIAMS | F1094: ALLEWAY | I1094: SMITH | L1094: NEAGLE | O1094: OSBORNE | R1094: MITCHELL
A1095: SANDRINGHAM | C1095: MILLER | F1095: WILSON | I1095: BROADBRIDGE | L1095: LYNCH | O1095: CLARK
A1096: GOALKICKERS
A1097: BOX HILL | C1097: ALLEWAY 4 | F1097: PASSADOR 3 | I1097: WILLIAMS 2 | L1097: BANKS | N1097: BAYFORD | Q1097: MITCHELL | S1097: OSBORNE | V1097: PRICE
A1098: SANDRINGHAM | C1098: BREESE 2 | F1098: OAKLEY 2 | I1098: AINLEY | K1098: ARMSTRONG | N1098: BROADBRIDGE | Q1098: LIDDELL | S1098: MILLER | U1098: ROBBINS | X1098: ROGERS | Z1098: WILSON
A1100: MURRAY KANGAROOS | C1100: 5 | D1100: 3 | E1100: =(C1100*6)+D1100 -> 33 | G1100: 11 | H1100: 3 | I1100: =(G1100*6)+H1100 -> 69 | K1100: 14 | L1100: 4 | M1100: =(K1100*6)+L1100 -> 88 | O1100: 19 | P1100: 4 | Q1100: =(O1100*6)+P1100 -> 118 | S1100: Venue: FRANKSTON
A1101: FRANKSTON | C1101: 1 | D1101: 0 | E1101: =(C1101*6)+D1101 -> 6 | G1101: 4 | H1101: 4 | I1101: =(G1101*6)+H1101 -> 28 | K1101: 8 | L1101: 7 | M1101: =(K1101*6)+L1101 -> 55 | O1101: 12 | P1101: 9 | Q1101: =(O1101*6)+P1101 -> 81
A1102: BEST PLAYERS
A1103: MURRAY KANGAROOS | C1103: LANGE | F1103: STEVENS | I1103: COOPER | L1103: HARRIS | N1103: S MOTLOP | Q1103: WATT
A1104: FRANKSTON | C1104: FRATER | F1104: D CLARKE | I1104: GEORGIOU | L1104: SALISBURY | N1104: BURGMANN | Q1104: WINTERTON
A1105: GOALKICKERS
A1106: MURRAY KANGAROOS | C1106: LANGE 5 | F1106: TREGENZA 5 | I1106: HALE 2 | K1106: BLAKEY | M1106: BOURKE | O1106: FOOTT | Q1106: McCORMICK | T1106: S MOTLOP | W1106: PORTER | X1106: STEVENS
A1107: FRANKSTON | C1107: SAUTNER 4 | F1107: SALISBURY 4 | I1107: ABLETT | K1107: FERGUSON | M1107: FIDDES | O1107: FOLINO
A1109: GEELONG | C1109: 4 | D1109: 6 | E1109: =(C1109*6)+D1109 -> 30 | G1109: 8 | H1109: 11 | I1109: =(G1109*6)+H1109 -> 59 | K1109: 9 | L1109: 17 | M1109: =(K1109*6)+L1109 -> 71 | O1109: 14 | P1109: 21 | Q1109: =(O1109*6)+P1109 -> 105 | S1109: Venue: KARDINIA PARK
A1110: ESSENDON | C1110: 3 | D1110: 3 | E1110: =(C1110*6)+D1110 -> 21 | G1110: 8 | H1110: 5 | I1110: =(G1110*6)+H1110 -> 53 | K1110: 14 | L1110: 6 | M1110: =(K1110*6)+L1110 -> 90 | O1110: 16 | P1110: 7 | Q1110: =(O1110*6)+P1110 -> 103
A1111: BEST PLAYERS
A1112: GEELONG | C1112: ABLETT | F1112: CHATFIELD | I1112: BARTEL | L1112: MENSCH | N1112: SLADE | Q1112: STREET
A1113: ESSENDON | C1113: FORSTER-KNIGHT | G1113: HUNT | I1113: MAHONEY | L1113: O'KEEFE | N1113: C McGRATH | Q1113: BARNES
A1114: GOALKICKERS
A1115: GEELONG | C1115: MENSCH 3 | F1115: GARDINER 2 | I1115: McCARTHY 2 | L1115: WHITE 2 | N1115: ABLETT | P1115: BLACKNEY | R1115: CARAZZO | U1115: GRGIC | W1115: STREET
A1116: ESSENDON | C1116: HAWKINS 5 | F1116: McALISTER 2 | I1116: MAHONEY 2 | L1116: WHITE 2 | N1116: WILSON 2 | Q1116: BARNES | S1116: C McGRATH | W1116: T McGRATH
A1118: ROUND 16 | D1118: 27TH JULY | J1118: WEATHER
D1119: 1ST QTR | H1119: 2ND QTR | L1119: 3RD QTR | P1119: FINAL | S1119: Venue: COBURG
A1120: WERRIBEE | C1120: 6 | D1120: 8 | E1120: =(C1120*6)+D1120 -> 44 | G1120: 8 | H1120: 11 | I1120: =(G1120*6)+H1120 -> 59 | K1120: 13 | L1120: 15 | M1120: =(K1120*6)+L1120 -> 93 | O1120: 16 | P1120: 22 | Q1120: =(O1120*6)+P1120 -> 118 | S1120: UMPIRES | Y1120: LADDER | AB1120: ROUND | AD1120: 16
A1121: MURRAY KANGAROOS | C1121: 0 | D1121: 1 | E1121: =(C1121*6)+D1121 -> 1 | G1121: 4 | H1121: 5 | I1121: =(G1121*6)+H1121 -> 29 | K1121: 6 | L1121: 5 | M1121: =(K1121*6)+L1121 -> 41 | O1121: 6 | P1121: 13 | Q1121: =(O1121*6)+P1121 -> 49
A1122: BEST PLAYERS | W1122: TEAM | X1122: W | Y1122: L | Z1122: D | AA1122: FOR | AB1122: AGST | AC1122: % | AD1122: PTS
A1123: WERRIBEE | C1123: GILBEE | F1123: BOWDEN | I1123: SETCHELL | L1123: FAULKNER | O1123: ROBBINS | R1123: SMITH
A1124: MURRAY KANGAROOS | C1124: BAIRD | F1124: SOFI | I1124: PRATT | L1124: LANGE | W1124: GEELONG | X1124: 13 | Y1124: 3 | Z1124: 0 | AA1124: 1705 | AB1124: 1053 | AC1124: =(AA1124/AB1124)*100 -> 161.91832858499524 | AD1124: =(X1124*4)+(Z1124*2) -> 52
A1125: GOALKICKERS | W1125: WERRIBEE | X1125: 12 | Y1125: 4 | Z1125: 0 | AA1125: 1766 | AB1125: 1208 | AC1125: =(AA1125/AB1125)*100 -> 146.19205298013244 | AD1125: =(X1125*4)+(Z1125*2) -> 48
A1126: WERRIBEE | C1126: GILBEE 4 | E1126: ROBBINS 4 | G1126: EAGLETON 2 | J1126: PICKEN 2 | L1126: BARTLETT | O1126: BOWDEN | Q1126: HAHN | S1126: LAMB | W1126: COBURG | X1126: 12 | Y1126: 4 | Z1126: 0 | AA1126: 1539 | AB1126: 1258 | AC1126: =(AA1126/AB1126)*100 -> 122.33704292527823 | AD1126: =(X1126*4)+(Z1126*2) -> 48
A1127: MURRAY KANGAROOS | C1127: TREGENZA 2 | F1127: HARRIS | H1127: LANGE | J1127: SOFI | L1127: WATSON | W1127: PORT MELBOURNE | X1127: 11 | Y1127: 5 | Z1127: 0 | AA1127: 1666 | AB1127: 1403 | AC1127: =(AA1127/AB1127)*100 -> 118.74554526015682 | AD1127: =(X1127*4)+(Z1127*2) -> 44
W1128: BOX HILL | X1128: 10 | Y1128: 5 | Z1128: 1 | AA1128: 1813 | AB1128: 1401 | AC1128: =(AA1128/AB1128)*100 -> 129.40756602426836 | AD1128: =(X1128*4)+(Z1128*2) -> 42
A1129: GEELONG | C1129: 0 | D1129: 2 | E1129: =(C1129*6)+D1129 -> 2 | G1129: 11 | H1129: 5 | I1129: =(G1129*6)+H1129 -> 71 | K1129: 14 | L1129: 12 | M1129: =(K1129*6)+L1129 -> 96 | O1129: 15 | P1129: 16 | Q1129: =(O1129*6)+P1129 -> 106 | S1129: Venue: KARDINIA PARK | W1129: WILLIAMSTOWN | X1129: 9 | Y1129: 7 | Z1129: 0 | AA1129: 1630 | AB1129: 1458 | AC1129: =(AA1129/AB1129)*100 -> 111.79698216735254 | AD1129: =(X1129*4)+(Z1129*2) -> 36
A1130: TASMANIA | C1130: 3 | D1130: 4 | E1130: =(C1130*6)+D1130 -> 22 | G1130: 4 | H1130: 5 | I1130: =(G1130*6)+H1130 -> 29 | K1130: 5 | L1130: 6 | M1130: =(K1130*6)+L1130 -> 36 | O1130: 10 | P1130: 7 | Q1130: =(O1130*6)+P1130 -> 67 | W1130: SANDRINGHAM | X1130: 9 | Y1130: 7 | Z1130: 0 | AA1130: 1554 | AB1130: 1421 | AC1130: =(AA1130/AB1130)*100 -> 109.35960591133005 | AD1130: =(X1130*4)+(Z1130*2) -> 36
A1131: BEST PLAYERS | W1131: CARLTON | X1131: 9 | Y1131: 7 | Z1131: 0 | AA1131: 1502 | AB1131: 1452 | AC1131: =(AA1131/AB1131)*100 -> 103.4435261707989 | AD1131: =(X1131*4)+(Z1131*2) -> 36
A1132: GEELONG | C1132: McGRATH | F1132: CHATFIELD | I1132: SLADE | L1132: GRGIC | O1132: MENSCH | R1132: HUNT
A1133: TASMANIA | C1133: ATKIN | F1133: BEVERIDGE | I1133: M GEAPPEN | L1133: BLIGHT | O1133: RONALDSON | R1133: HEATLEY | W1133: SPRINGVALE | X1133: 9 | Y1133: 7 | Z1133: 0 | AA1133: 1358 | AB1133: 1368 | AC1133: =(AA1133/AB1133)*100 -> 99.269005847953224 | AD1133: =(X1133*4)+(Z1133*2) -> 36
A1134: GOALKICKERS | O1134: SLADE | Q1134: STREET | W1134: MURRAY KANGAROOS | X1134: 8 | Y1134: 7 | Z1134: 1 | AA1134: 1654 | AB1134: 1508 | AC1134: =(AA1134/AB1134)*100 -> 109.68169761273209 | AD1134: =(X1134*4)+(Z1134*2) -> 34
A1135: GEELONG | C1135: MENSCH 3 | E1135: BARTEL 2 | G1135: GARDINER 2 | J1135: WHITE 2 | L1135: CHAMBERS | N1135: GRGIC | P1135: HUNT | R1135: O'BRIEN | W1135: TASMANIA | X1135: 7 | Y1135: 8 | Z1135: 1 | AA1135: 1411 | AB1135: 1586 | AC1135: =(AA1135/AB1135)*100 -> 88.965952080706174 | AD1135: =(X1135*4)+(Z1135*2) -> 30
A1136: TASMANIA | C1136: HEATLEY 5 | F1136: BEAMS 3 | I1136: ATKIN | K1136: THURLEY | W1136: NORTHERN BULLANTS | X1136: 6 | Y1136: 10 | Z1136: 0 | AA1136: 1570 | AB1136: 1588 | AC1136: =(AA1136/AB1136)*100 -> 98.86649874055415 | AD1136: =(X1136*4)+(Z1136*2) -> 24
W1137: ESSENDON | X1137: 6 | Y1137: 10 | Z1137: 0 | AA1137: 1615 | AB1137: 1851 | AC1137: =(AA1137/AB1137)*100 -> 87.250135062128578 | AD1137: =(X1137*4)+(Z1137*2) -> 24
A1138: COBURG | C1138: 3 | D1138: 3 | E1138: =(C1138*6)+D1138 -> 21 | G1138: 6 | H1138: 8 | I1138: =(G1138*6)+H1138 -> 44 | K1138: 10 | L1138: 12 | M1138: =(K1138*6)+L1138 -> 72 | O1138: 17 | P1138: 16 | Q1138: =(O1138*6)+P1138 -> 118 | S1138: Venue: WINDY HILL | W1138: NORTH BALLARAT | X1138: 3 | Y1138: 13 | Z1138: 0 | AA1138: 1136 | AB1138: 1570 | AC1138: =(AA1138/AB1138)*100 -> 72.356687898089163 | AD1138: =(X1138*4)+(Z1138*2) -> 12
A1139: ESSENDON | C1139: 0 | D1139: 2 | E1139: =(C1139*6)+D1139 -> 2 | G1139: 2 | H1139: 2 | I1139: =(G1139*6)+H1139 -> 14 | K1139: 8 | L1139: 3 | M1139: =(K1139*6)+L1139 -> 51 | O1139: 11 | P1139: 4 | Q1139: =(O1139*6)+P1139 -> 70 | W1139: FRANKSTON | X1139: 2 | Y1139: 14 | Z1139: 0 | AA1139: 1231 | AB1139: 1885 | AC1139: =(AA1139/AB1139)*100 -> 65.305039787798407 | AD1139: =(X1139*4)+(Z1139*2) -> 8
A1140: BEST PLAYERS | W1140: BENDIGO | X1140: 0 | Y1140: 15 | Z1140: 1 | AA1140: 1021 | AB1140: 2147 | AC1140: =(AA1140/AB1140)*100 -> 47.554727526781555 | AD1140: =(X1140*4)+(Z1140*2) -> 2
A1141: COBURG | C1141: TAYLOR | F1141: SZILLER | I1141: HOULIHAN | L1141: VARDY | N1141: HUDSON | Q1141: CARLSON
A1142: ESSENDON | C1142: HUNT | F1142: BULLEN | I1142: McALISTER | L1142: C McGRATH | N1142: RICHARDS | Q1142: HARVEY
A1143: GOALKICKERS
A1144: COBURG | C1144: HUDSON 4 | F1144: HYDE 3 | H1144: BIDDISCOMBE 2 | K1144: MILLS 2 | M1144: TAYLOR 2 | O1144: VARDY 2 | Q1144: HART | S1144: HOULIHAN
A1145: ESSENDON | C1145: HARVEY 4 | F1145: McALISTER 3 | I1145: BULLEN | K1145: DAVIES | M1145: HAYNES | O1145: RUNNELLS
D1146: 28TH JULY | J1146: WEATHER
A1147: BOX HILL | C1147: 6 | D1147: 4 | E1147: =(C1147*6)+D1147 -> 40 | G1147: 12 | H1147: 10 | I1147: =(G1147*6)+H1147 -> 82 | K1147: 16 | L1147: 12 | M1147: =(K1147*6)+L1147 -> 108 | O1147: 20 | P1147: 14 | Q1147: =(O1147*6)+P1147 -> 134 | S1147: Venue: BOX HILL
A1148: NORTHERN BULLANTS | C1148: 5 | D1148: 1 | E1148: =(C1148*6)+D1148 -> 31 | G1148: 8 | H1148: 1 | I1148: =(G1148*6)+H1148 -> 49 | K1148: 11 | L1148: 3 | M1148: =(K1148*6)+L1148 -> 69 | O1148: 15 | P1148: 4 | Q1148: =(O1148*6)+P1148 -> 94
A1149: BEST PLAYERS
A1150: BOX HILL | C1150: MITCHELL | F1150: SMITH | I1150: BAXTER | L1150: CAMPBELL | O1150: COLLINS | Q1150: OSBORNE
A1151: NORTHERN BULLANTS | C1151: GROSSMAN | F1151: RAMSAY | I1151: RASO | L1151: LOWTHER | O1151: WATSON
A1152: GOALKICKERS
A1153: BOX HILL | C1153: PASSADOR 4 | F1153: BAYFORD 3 | I1153: ALLEWAY 2 | L1153: CAMPBELL 2 | O1153: MITCHELL 2 | R1153: OWEN 2 | U1153: BALL | W1153: COLLINS | X1153: HEENAN | Z1153: NICHOLLS | AB1153: OSBORNE
A1154: NORTHERN BULLANTS | C1154: RAMSAY 3 | F1154: LOWTHER 2 | I1154: PENN 2 | K1154: WATSON 2 | N1154: CANN | P1154: COLLINS | R1154: GIBSON | T1154: FURLAN | W1154: STEVENSON | X1154: SAGE
A1156: WILLIAMSTOWN | C1156: 2 | D1156: 6 | E1156: =(C1156*6)+D1156 -> 18 | G1156: 7 | H1156: 11 | I1156: =(G1156*6)+H1156 -> 53 | K1156: 9 | L1156: 17 | M1156: =(K1156*6)+L1156 -> 71 | O1156: 11 | P1156: 23 | Q1156: =(O1156*6)+P1156 -> 89 | S1156: Venue: WILLIAMSTOWN
A1157: NORTH BALLARAT | C1157: 0 | D1157: 2 | E1157: =(C1157*6)+D1157 -> 2 | G1157: 2 | H1157: 4 | I1157: =(G1157*6)+H1157 -> 16 | K1157: 5 | L1157: 8 | M1157: =(K1157*6)+L1157 -> 38 | O1157: 9 | P1157: 9 | Q1157: =(O1157*6)+P1157 -> 63
A1158: BEST PLAYERS
A1159: WILLIAMSTOWN | C1159: FLETCHER | F1159: COLE | I1159: LLOYD | L1159: McGOUGH | O1159: KINNEAR | R1159: ANDERSON
A1160: NORTH BALLARAT | C1160: CLAYTON | F1160: BEST | I1160: GREIG | L1160: MIDGLEY | O1160: BYE
A1161: GOALKICKERS
A1162: WILLIAMSTOWN | C1162: KINNEAR 2 | F1162: McGOUGH 2 | I1162: PEARCE 2 | K1162: SMOKER 2 | M1162: ANDERSON | P1162: HOLLAND | R1162: RALPH
A1163: NORTH BALLARAT | C1163: BEST 4 | F1163: BRIDGES | I1163: BROWN | K1163: KING | M1163: McCORKELL | P1163: MIDGLEY
A1165: FRANKSTON | C1165: 4 | D1165: 1 | E1165: =(C1165*6)+D1165 -> 25 | G1165: 10 | H1165: 3 | I1165: =(G1165*6)+H1165 -> 63 | K1165: 11 | L1165: 4 | M1165: =(K1165*6)+L1165 -> 70 | O1165: 18 | P1165: 6 | Q1165: =(O1165*6)+P1165 -> 114 | S1165: Venue: BEACH ROAD
A1166: SANDRINGHAM | C1166: 3 | D1166: 2 | E1166: =(C1166*6)+D1166 -> 20 | G1166: 5 | H1166: 5 | I1166: =(G1166*6)+H1166 -> 35 | K1166: 8 | L1166: 10 | M1166: =(K1166*6)+L1166 -> 58 | O1166: 9 | P1166: 12 | Q1166: =(O1166*6)+P1166 -> 66
A1167: BEST PLAYERS
A1168: FRANKSTON | C1168: FRATER | F1168: FOLINO | I1168: CLARKE | L1168: SAUTNER | O1168: MATTHEWS | R1168: SALISBURY
A1169: SANDRINGHAM | C1169: WILSON | F1169: BROADBRIDGE | I1169: GRANT | L1169: ROBBINS | O1169: A McDONALD
A1170: GOALKICKERS
A1171: FRANKSTON | C1171: SAUTNER 8 | F1171: SALISBURY 4 | I1171: LITTLE 3 | L1171: ANDERSON | O1171: GEORGIOU | Q1171: GREIG
A1172: SANDRINGHAM | C1172: ROBBINS 3 | F1172: WILSON 3 | I1172: OAKLEY 2 | L1172: LIDDELL
A1174: CARLTON | C1174: 7 | D1174: 4 | E1174: =(C1174*6)+D1174 -> 46 | G1174: 7 | H1174: 6 | I1174: =(G1174*6)+H1174 -> 48 | K1174: 9 | L1174: 8 | M1174: =(K1174*6)+L1174 -> 62 | O1174: 14 | P1174: 9 | Q1174: =(O1174*6)+P1174 -> 93 | S1174: Venue: PORT MELBOURNE
A1175: PORT MELBOURNE | C1175: 1 | D1175: 1 | E1175: =(C1175*6)+D1175 -> 7 | G1175: 4 | H1175: 5 | I1175: =(G1175*6)+H1175 -> 29 | K1175: 8 | L1175: 12 | M1175: =(K1175*6)+L1175 -> 60 | O1175: 10 | P1175: 16 | Q1175: =(O1175*6)+P1175 -> 76
A1176: BEST PLAYERS
A1177: CARLTON | C1177: ECCLES | F1177: PRENDERGAST | I1177: FLEMING | L1177: HEDGE | N1177: GUTTERSON | Q1177: DAVIS
A1178: PORT MELBOURNE | C1178: OBST | F1178: RIX | I1178: GILL | L1178: J ANSTEY | N1178: L ABLETT
A1179: GOALKICKERS
A1180: CARLTON | C1180: GUTTERSON 4 | F1180: MERRINGTON 2 | J1180: SMITH 2 | M1180: DAVIS | O1180: ECCLES | Q1180: FEVOLA | S1180: ROSA | U1180: HEDGE | W1180: HEINRICH
A1181: PORT MELBOURNE | C1181: McPHERSON 2 | F1181: PHIBBS 2 | I1181: L ABLETT | K1181: GILL | M1181: JAJOURA | O1181: MILHUISEN | R1181: ROBERTSON | U1181: RIX
A1183: SPRINGVALE | C1183: 5 | D1183: 4 | E1183: =(C1183*6)+D1183 -> 34 | G1183: 8 | H1183: 5 | I1183: =(G1183*6)+H1183 -> 53 | K1183: 12 | L1183: 8 | M1183: =(K1183*6)+L1183 -> 80 | O1183: 19 | P1183: 11 | Q1183: =(O1183*6)+P1183 -> 125 | S1183: Venue: OPTUS OVAL
A1184: BENDIGO | C1184: 2 | D1184: 1 | E1184: =(C1184*6)+D1184 -> 13 | G1184: 4 | H1184: 6 | I1184: =(G1184*6)+H1184 -> 30 | K1184: 9 | L1184: 9 | M1184: =(K1184*6)+L1184 -> 63 | O1184: 14 | P1184: 11 | Q1184: =(O1184*6)+P1184 -> 95
A1185: BEST PLAYERS
A1186: SPRINGVALE | C1186: SMITH | F1186: DAVIS | I1186: CARMODY | L1186: FREDERICKS | O1186: HARRISON | R1186: CARROLL
A1187: BENDIGO | C1187: CAMPBELL | F1187: VANCE | I1187: EATON | L1187: CARTER | O1187: CAIL | R1187: PROCTOR
A1188: GOALKICKERS
A1189: SPRINGVALE | C1189: SMITH 8 | E1189: DAVIS 2 | G1189: HARRISON 2 | J1189: HOULIHAN 2 | M1189: CARROLL | O1189: MADDOX | Q1189: PITT | S1189: SCHWARZE | V1189: WOODMAN
A1190: BENDIGO | C1190: DOHERTY 4 | F1190: DAVIES 3 | I1190: CARTER 2 | L1190: HAWKINS 2 | O1190: CAIL | Q1190: GATHERCOLE | T1190: LOUGHMAN
A1192: ROUND 17 | D1192: 3RD AUGUST | J1192: WEATHER
D1193: 1ST QTR | H1193: 2ND QTR | L1193: 3RD QTR | P1193: FINAL | S1193: Venue: YORK PARK (Launceston)
A1194: PORT MELBOURNE | C1194: 3 | D1194: 4 | E1194: =(C1194*6)+D1194 -> 22 | G1194: 7 | H1194: 7 | I1194: =(G1194*6)+H1194 -> 49 | K1194: 12 | L1194: 8 | M1194: =(K1194*6)+L1194 -> 80 | O1194: 13 | P1194: 11 | Q1194: =(O1194*6)+P1194 -> 89 | S1194: UMPIRES | Y1194: LADDER | AB1194: ROUND | AD1194: 17
A1195: TASMANIA | C1195: 6 | D1195: 0 | E1195: =(C1195*6)+D1195 -> 36 | G1195: 9 | H1195: 0 | I1195: =(G1195*6)+H1195 -> 54 | K1195: 10 | L1195: 4 | M1195: =(K1195*6)+L1195 -> 64 | O1195: 13 | P1195: 4 | Q1195: =(O1195*6)+P1195 -> 82
A1196: BEST PLAYERS | W1196: TEAM | X1196: W | Y1196: L | Z1196: D | AA1196: FOR | AB1196: AGST | AC1196: % | AD1196: PTS
A1197: PORT MELBOURNE | C1197: BUCHANAN | F1197: OBST | I1197: GILL | K1197: PHIBBS | N1197: SUNDQUIST | Q1197: S ANSTEY
A1198: TASMANIA | C1198: HOWARD | F1198: ATKIN | I1198: WALKER | K1198: DERBYSHIRE | N1198: M GEAPPEN | Q1198: BEVERIDGE | W1198: GEELONG | X1198: 14 | Y1198: 3 | Z1198: 0 | AA1198: 1847 | AB1198: 1121 | AC1198: =(AA1198/AB1198)*100 -> 164.76360392506692 | AD1198: =(X1198*4)+(Z1198*2) -> 56
A1199: GOALKICKERS | W1199: WERRIBEE | X1199: 13 | Y1199: 4 | Z1199: 0 | AA1199: 1933 | AB1199: 1270 | AC1199: =(AA1199/AB1199)*100 -> 152.2047244094488 | AD1199: =(X1199*4)+(Z1199*2) -> 52
A1200: PORT MELBOURNE | C1200: ABLETT 3 | F1200: BUCHANAN 3 | I1200: PHIBBS 3 | K1200: ALEXANDER | N1200: BROCKMAN | Q1200: S ANSTEY | S1200: SCHAUBLE | W1200: COBURG | X1200: 13 | Y1200: 4 | Z1200: 0 | AA1200: 1678 | AB1200: 1301 | AC1200: =(AA1200/AB1200)*100 -> 128.97770945426595 | AD1200: =(X1200*4)+(Z1200*2) -> 52
A1201: TASMANIA | C1201: DERBYSHIRE 4 | G1201: ALLEN 2 | J1201: HEATLEY 2 | M1201: BEAMS | O1201: BEVERIDGE | W1201: PORT MELBOURNE | X1201: 12 | Y1201: 5 | Z1201: 0 | AA1201: 1755 | AB1201: 1485 | AC1201: =(AA1201/AB1201)*100 -> 118.18181818181819 | AD1201: =(X1201*4)+(Z1201*2) -> 48
W1202: BOX HILL | X1202: 11 | Y1202: 5 | Z1202: 1 | AA1202: 1900 | AB1202: 1484 | AC1202: =(AA1202/AB1202)*100 -> 128.03234501347708 | AD1202: =(X1202*4)+(Z1202*2) -> 46
A1203: COBURG | C1203: 4 | D1203: 3 | E1203: =(C1203*6)+D1203 -> 27 | G1203: 10 | H1203: 6 | I1203: =(G1203*6)+H1203 -> 66 | K1203: 15 | L1203: 10 | M1203: =(K1203*6)+L1203 -> 100 | O1203: 21 | P1203: 13 | Q1203: =(O1203*6)+P1203 -> 139 | S1203: COBURG | W1203: CARLTON | X1203: 10 | Y1203: 7 | Z1203: 0 | AA1203: 1598 | AB1203: 1526 | AC1203: =(AA1203/AB1203)*100 -> 104.71821756225425 | AD1203: =(X1203*4)+(Z1203*2) -> 40
A1204: SANDRINGHAM | C1204: 2 | D1204: 3 | E1204: =(C1204*6)+D1204 -> 15 | G1204: 3 | H1204: 4 | I1204: =(G1204*6)+H1204 -> 22 | K1204: 5 | L1204: 6 | M1204: =(K1204*6)+L1204 -> 36 | O1204: 6 | P1204: 7 | Q1204: =(O1204*6)+P1204 -> 43 | W1204: WILLIAMSTOWN | X1204: 9 | Y1204: 8 | Z1204: 0 | AA1204: 1704 | AB1204: 1554 | AC1204: =(AA1204/AB1204)*100 -> 109.65250965250965 | AD1204: =(X1204*4)+(Z1204*2) -> 36
A1205: BEST PLAYERS | W1205: SANDRINGHAM | X1205: 9 | Y1205: 8 | Z1205: 0 | AA1205: 1597 | AB1205: 1560 | AC1205: =(AA1205/AB1205)*100 -> 102.37179487179486 | AD1205: =(X1205*4)+(Z1205*2) -> 36
A1206: COBURG | C1206: BIDDISCOMBE | F1206: EDNIE | I1206: SZILLER | K1206: HOULIHAN | N1206: CARLSON | Q1206: PAGAN
A1207: SANDRINGHAM | C1207: S FEBEY | F1207: LIDDELL | I1207: CLARK | K1207: TEMPLETON | N1207: AINLEY | W1207: SPRINGVALE | X1207: 9 | Y1207: 8 | Z1207: 0 | AA1207: 1431 | AB1207: 1451 | AC1207: =(AA1207/AB1207)*100 -> 98.621640248104754 | AD1207: =(X1207*4)+(Z1207*2) -> 36
A1208: GOALKICKERS | P1208: MAGGIORE | S1208: WESTON | W1208: MURRAY KANGAROOS | X1208: 8 | Y1208: 8 | Z1208: 1 | AA1208: 1722 | AB1208: 1650 | AC1208: =(AA1208/AB1208)*100 -> 104.36363636363637 | AD1208: =(X1208*4)+(Z1208*2) -> 34
A1209: COBURG | C1209: EDNIE 5 | E1209: TREMELLIN 4 | H1209: FLAHERTY 2 | K1209: HART 2 | M1209: McGRATH 2 | P1209: TAYLOR 2 | R1209: HYDE | T1209: KURET | W1209: TASMANIA | X1209: 7 | Y1209: 9 | Z1209: 1 | AA1209: 1493 | AB1209: 1675 | AC1209: =(AA1209/AB1209)*100 -> 89.134328358208961 | AD1209: =(X1209*4)+(Z1209*2) -> 30
A1210: SANDRINGHAM | C1210: MARSHALL 2 | F1210: ROGERS | H1210: SCOTT-BRANAGAN | L1210: TEMPLETON | O1210: WILSON | W1210: ESSENDON | X1210: 7 | Y1210: 10 | Z1210: 0 | AA1210: 1759 | AB1210: 1919 | AC1210: =(AA1210/AB1210)*100 -> 91.662324127149546 | AD1210: =(X1210*4)+(Z1210*2) -> 28
W1211: NORTHERN BULLANTS | X1211: 6 | Y1211: 11 | Z1211: 0 | AA1211: 1638 | AB1211: 1732 | AC1211: =(AA1211/AB1211)*100 -> 94.57274826789839 | AD1211: =(X1211*4)+(Z1211*2) -> 24
A1212: WERRIBEE | C1212: 8 | D1212: 5 | E1212: =(C1212*6)+D1212 -> 53 | G1212: 15 | H1212: 7 | I1212: =(G1212*6)+H1212 -> 97 | K1212: 18 | L1212: 12 | M1212: =(K1212*6)+L1212 -> 120 | O1212: 25 | P1212: 17 | Q1212: =(O1212*6)+P1212 -> 167 | S1212: Venue: NORTH BALLARAT | W1212: NORTH BALLARAT | X1212: 3 | Y1212: 14 | Z1212: 0 | AA1212: 1198 | AB1212: 1737 | AC1212: =(AA1212/AB1212)*100 -> 68.969487622337368 | AD1212: =(X1212*4)+(Z1212*2) -> 12
A1213: NORTH BALLARAT | C1213: 1 | D1213: 4 | E1213: =(C1213*6)+D1213 -> 10 | G1213: 3 | H1213: 6 | I1213: =(G1213*6)+H1213 -> 24 | K1213: 6 | L1213: 11 | M1213: =(K1213*6)+L1213 -> 47 | O1213: 8 | P1213: 14 | Q1213: =(O1213*6)+P1213 -> 62 | W1213: FRANKSTON | X1213: 3 | Y1213: 14 | Z1213: 0 | AA1213: 1314 | AB1213: 1958 | AC1213: =(AA1213/AB1213)*100 -> 67.109295199182839 | AD1213: =(X1213*4)+(Z1213*2) -> 12
A1214: BEST PLAYERS | W1214: BENDIGO | X1214: 0 | Y1214: 16 | Z1214: 1 | AA1214: 1104 | AB1214: 2234 | AC1214: =(AA1214/AB1214)*100 -> 49.418084153983891 | AD1214: =(X1214*4)+(Z1214*2) -> 2
A1215: WERRIBEE | C1215: EAGLETON | F1215: BOWDEN | I1215: DYER | K1215: CROSS | N1215: SAUNDERS | Q1215: RUSCA
A1216: NORTH BALLARAT | C1216: GREIG | F1216: POLKINGHOREN | J1216: JENKINS | M1216: MAXWELL
A1217: GOALKICKERS | D1217: BOWDEN | F1217: BOYD | H1217: COLBERT | J1217: MITCHELL | M1217: PICKEN | O1217: ROBBINS | Q1217: SAUNDERS | T1217: CROSS
A1218: WERRIBEE | C1218: BARTLETT 3 | F1218: RUSCA 3 | H1218: WIGGINS 3 | J1218: EAGLETON 2 | M1218: KNEZEVIC 2 | P1218: McGUINESS 2 | S1218: SMITH 2
A1219: NORTH BALLARAT | C1219: SPOLDING 2 | F1219: BEST | H1219: BYE | I1219: COHEN | K1219: DAWES | M1219: JENKINS | O1219: MIDGLEY
A1221: GEELONG | C1221: 2 | D1221: 4 | E1221: =(C1221*6)+D1221 -> 16 | G1221: 9 | H1221: 7 | I1221: =(G1221*6)+H1221 -> 61 | K1221: 15 | L1221: 10 | M1221: =(K1221*6)+L1221 -> 100 | O1221: 21 | P1221: 16 | Q1221: =(O1221*6)+P1221 -> 142 | S1221: Venue: KARDINIA PARK
A1222: MURRAY KANGAROOS | C1222: 3 | D1222: 0 | E1222: =(C1222*6)+D1222 -> 18 | G1222: 3 | H1222: 3 | I1222: =(G1222*6)+H1222 -> 21 | K1222: 6 | L1222: 5 | M1222: =(K1222*6)+L1222 -> 41 | O1222: 10 | P1222: 8 | Q1222: =(O1222*6)+P1222 -> 68
A1223: BEST PLAYERS
A1224: GEELONG | C1224: McCARTHY | F1224: SLADE | I1224: BLACKNEY | L1224: CHATFIELD | N1224: GRGIC | Q1224: POWELL
A1225: MURRAY KANGAROOS | C1225: PRATT | F1225: BLAKEY | I1225: SMITH | L1225: STEVENS
A1226: GOALKICKERS | R1226: O'BRIEN | U1226: WHITE
A1227: GEELONG | C1227: BLACKNEY 3 | F1227: MENSCH 3 | I1227: CHATFIELD 2 | L1227: MERRIMAN 2 | O1227: POWELL 2 | Q1227: STREET 2 | S1227: CHAMBERS | V1227: GARDINER | X1227: GRGIC | Z1227: JOVANOVIC | AC1227: McCARTHY
A1228: MURRAY KANGAROOS | C1228: BLAKEY 4 | F1228: LANGE 2 | I1228: MOTLOP | K1228: SOFI | M1228: TREGENZA | O1228: TRENFIELD
A1230: CARLTON | C1230: 5 | D1230: 4 | E1230: =(C1230*6)+D1230 -> 34 | G1230: 7 | H1230: 6 | I1230: =(G1230*6)+H1230 -> 48 | K1230: 10 | L1230: 9 | M1230: =(K1230*6)+L1230 -> 69 | O1230: 14 | P1230: 12 | Q1230: =(O1230*6)+P1230 -> 96 | S1230: Venue: OPTUS OVAL
A1231: WILLIAMSTOWN | C1231: 3 | D1231: 0 | E1231: =(C1231*6)+D1231 -> 18 | G1231: 5 | H1231: 6 | I1231: =(G1231*6)+H1231 -> 36 | K1231: 8 | L1231: 10 | M1231: =(K1231*6)+L1231 -> 58 | O1231: 10 | P1231: 14 | Q1231: =(O1231*6)+P1231 -> 74
A1232: BEST PLAYERS
A1233: CARLTON | C1233: DOERING | F1233: WATSON | I1233: FLEMING | L1233: WAITE | N1233: DAVIS | Q1233: HEDGE
A1234: WILLIAMSTOWN | C1234: FLETCHER | F1234: DE ANGELIS | I1234: HOLLAND | L1234: DIMATTINA | N1234: PEARCE
A1235: GOALKICKERS
A1236: CARLTON | C1236: BERRY 3 | E1236: DOERING 2 | H1236: GUTTERSON 2 | K1236: MERRINGTON 2 | N1236: FEVOLA | P1236: HOLMES | R1236: SMITH | T1236: SPORN | V1236: WAITE
A1237: WILLIAMSTOWN | C1237: DAVIDSON 2 | F1237: LOVETT-MURRAY 2 | J1237: CUMMINGS | M1237: DOOLEY | O1237: HOLLAND | Q1237: KELLY | S1237: KINNEAR | V1237: SMOKER
D1238: 4TH AUGUST | J1238: WEATHER
A1239: BOX HILL | C1239: 4 | D1239: 5 | E1239: =(C1239*6)+D1239 -> 29 | G1239: 5 | H1239: 9 | I1239: =(G1239*6)+H1239 -> 39 | K1239: 8 | L1239: 12 | M1239: =(K1239*6)+L1239 -> 60 | O1239: 12 | P1239: 15 | Q1239: =(O1239*6)+P1239 -> 87 | S1239: Venue: BENDIGO
A1240: BENDIGO | C1240: 2 | D1240: 3 | E1240: =(C1240*6)+D1240 -> 15 | G1240: 5 | H1240: 6 | I1240: =(G1240*6)+H1240 -> 36 | K1240: 8 | L1240: 8 | M1240: =(K1240*6)+L1240 -> 56 | O1240: 12 | P1240: 11 | Q1240: =(O1240*6)+P1240 -> 83
A1241: BEST PLAYERS
A1242: BOX HILL | C1242: MITCHELL | F1242: STONE | I1242: OSBORNE | L1242: M SMITH | N1242: GEORGIADIS | Q1242: PICIAONE
A1243: BENDIGO | C1243: ELLIOTT | F1243: PROCTOR | I1243: CARTER | L1243: GATHERCOLE | O1243: BOVALINO | Q1243: CAIL
A1244: GOALKICKERS
A1245: BOX HILL | C1245: M SMITH 4 | F1245: NICHOLS 3 | I1245: BARKER 2 | L1245: PASSADOR 2 | O1245: J SMITH
A1246: BENDIGO | C1246: BROWN 3 | F1246: DOHERTY 2 | I1246: EATON 2 | L1246: GATHERCOLE 2 | O1246: ELLIOTT
A1248: ESSENDON | C1248: 8 | D1248: 3 | E1248: =(C1248*6)+D1248 -> 51 | G1248: 13 | H1248: 6 | I1248: =(G1248*6)+H1248 -> 84 | K1248: 18 | L1248: 9 | M1248: =(K1248*6)+L1248 -> 117 | O1248: 22 | P1248: 12 | Q1248: =(O1248*6)+P1248 -> 144 | S1248: Venue: WINDY HILL
A1249: NORTHERN BULLANTS | C1249: 3 | D1249: 2 | E1249: =(C1249*6)+D1249 -> 20 | G1249: 5 | H1249: 4 | I1249: =(G1249*6)+H1249 -> 34 | K1249: 8 | L1249: 5 | M1249: =(K1249*6)+L1249 -> 53 | O1249: 10 | P1249: 8 | Q1249: =(O1249*6)+P1249 -> 68
A1250: BEST PLAYERS
A1251: ESSENDON | C1251: FORSTER-KNIGHT | G1251: C McGRATH | J1251: WELSH | M1251: HUNT | O1251: McALISTER | R1251: REYNOLDS
A1252: NORTHERN BULLANTS | C1252: GRAINGER | G1252: GROSSMAN | J1252: VANSITTART | M1252: PENN
A1253: GOALKICKERS
A1254: ESSENDON | C1254: HAWKINS 4 | F1254: MAHONEY 4 | I1254: BULLEN 3 | K1254: McALISTER 3 | N1254: BANNISTER 2 | Q1254: HAYNES 2 | S1254: SAAD 2 | V1254: REYNOLDS | X1254: WELSH
A1255: NORTHERN BULLANTS | C1255: PENN 2 | F1255: SALIBA 2 | I1255: CLARKE | K1255: GIBSON | M1255: RAMSAY | O1255: RASO | Q1255: SAGE | R1255: WATSON
A1257: FRANKSTON | C1257: 3 | D1257: 3 | E1257: =(C1257*6)+D1257 -> 21 | G1257: 4 | H1257: 5 | I1257: =(G1257*6)+H1257 -> 29 | K1257: 8 | L1257: 8 | M1257: =(K1257*6)+L1257 -> 56 | O1257: 12 | P1257: 11 | Q1257: =(O1257*6)+P1257 -> 83 | S1257: Venue: FRANKSTON
A1258: SPRINGVALE | C1258: 3 | D1258: 1 | E1258: =(C1258*6)+D1258 -> 19 | G1258: 5 | H1258: 2 | I1258: =(G1258*6)+H1258 -> 32 | K1258: 8 | L1258: 4 | M1258: =(K1258*6)+L1258 -> 52 | O1258: 11 | P1258: 7 | Q1258: =(O1258*6)+P1258 -> 73
A1259: BEST PLAYERS
A1260: FRANKSTON | C1260: D CLARKE | F1260: SALISBURY | I1260: ABLETT | L1260: N WINTERTON | O1260: WILLIS | R1260: FOLINO
A1261: SPRINGVALE | C1261: SMITH | F1261: MAGUIRE | I1261: CARROLL | L1261: CARMODY
A1262: GOALKICKERS
A1263: FRANKSTON | C1263: SALISBURY 4 | F1263: WILLIS 3 | I1263: SAUTNER 2 | L1263: GEORGIOU | N1263: FOLINO | P1263: LITTLE
A1264: SPRINGVALE | C1264: SMITH 5 | F1264: CARMODY 2 | I1264: HOULIHAN | L1264: MADDOX | N1264: PITT | P1264: WOODMAN
A1266: ROUND 18 | D1266: 10TH AUGUST | J1266: WEATHER
D1267: 1ST QTR | H1267: 2ND QTR | L1267: 3RD QTR | P1267: FINAL | S1267: Venue: WILLIAMSTOWN
A1268: WILLIAMSTOWN | C1268: 0 | D1268: 4 | E1268: =(C1268*6)+D1268 -> 4 | G1268: 5 | H1268: 9 | I1268: =(G1268*6)+H1268 -> 39 | K1268: 8 | L1268: 10 | M1268: =(K1268*6)+L1268 -> 58 | O1268: 13 | P1268: 13 | Q1268: =(O1268*6)+P1268 -> 91 | S1268: UMPIRES | Y1268: LADDER | AB1268: ROUND | AD1268: 18
A1269: BOX HILL | C1269: 2 | D1269: 2 | E1269: =(C1269*6)+D1269 -> 14 | G1269: 3 | H1269: 5 | I1269: =(G1269*6)+H1269 -> 23 | K1269: 5 | L1269: 12 | M1269: =(K1269*6)+L1269 -> 42 | O1269: 7 | P1269: 14 | Q1269: =(O1269*6)+P1269 -> 56
A1270: BEST PLAYERS | W1270: TEAM | X1270: W | Y1270: L | Z1270: D | AA1270: FOR | AB1270: AGST | AC1270: % | AD1270: PTS
A1271: WILLIAMSTOWN | C1271: HOLLAND | G1271: O'BREE | J1271: PEARCE | M1271: DE ANGELIS | P1271: WEST | R1271: SHAW
A1272: BOX HILL | C1272: GREENE | G1272: KANE | J1272: FIRRITO | M1272: M SMITH | P1272: JOHNSON | R1272: OSBORNE | W1272: GEELONG | X1272: 15 | Y1272: 3 | Z1272: 0 | AA1272: 1910 | AB1272: 1180 | AC1272: =(AA1272/AB1272)*100 -> 161.86440677966101 | AD1272: =(X1272*4)+(Z1272*2) -> 60
A1273: GOALKICKERS | P1273: LOVETT-MURRAY | W1273: WERRIBEE | X1273: 14 | Y1273: 4 | Z1273: 0 | AA1273: 2063 | AB1273: 1325 | AC1273: =(AA1273/AB1273)*100 -> 155.69811320754715 | AD1273: =(X1273*4)+(Z1273*2) -> 56
A1274: WILLIAMSTOWN | C1274: PODSIADLY 3 | F1274: DAVIDSON 2 | I1274: DE ANGELIS 2 | L1274: HOLLAND 2 | O1274: FLETCHER | Q1274: KINNEAR | S1274: SMOKER | W1274: COBURG | X1274: 14 | Y1274: 4 | Z1274: 0 | AA1274: 1805 | AB1274: 1348 | AC1274: =(AA1274/AB1274)*100 -> 133.90207715133531 | AD1274: =(X1274*4)+(Z1274*2) -> 56
A1275: BOX HILL | C1275: GREENE 3 | F1275: ALLEWAY | I1275: CLARKE | K1275: NICHOLS | M1275: OWEN | W1275: PORT MELBOURNE | X1275: 12 | Y1275: 6 | Z1275: 0 | AA1275: 1867 | AB1275: 1601 | AC1275: =(AA1275/AB1275)*100 -> 116.61461586508433 | AD1275: =(X1275*4)+(Z1275*2) -> 48
W1276: BOX HILL | X1276: 11 | Y1276: 6 | Z1276: 1 | AA1276: 1956 | AB1276: 1575 | AC1276: =(AA1276/AB1276)*100 -> 124.19047619047619 | AD1276: =(X1276*4)+(Z1276*2) -> 46
A1277: ESSENDON | C1277: 4 | D1277: 0 | E1277: =(C1277*6)+D1277 -> 24 | G1277: 10 | H1277: 2 | I1277: =(G1277*6)+H1277 -> 62 | K1277: 13 | L1277: 6 | M1277: =(K1277*6)+L1277 -> 84 | O1277: 16 | P1277: 7 | Q1277: =(O1277*6)+P1277 -> 103 | S1277: Venue: WINDY HILL | W1277: WILLIAMSTOWN | X1277: 10 | Y1277: 8 | Z1277: 0 | AA1277: 1795 | AB1277: 1610 | AC1277: =(AA1277/AB1277)*100 -> 111.49068322981365 | AD1277: =(X1277*4)+(Z1277*2) -> 40
A1278: TASMANIA | C1278: 2 | D1278: 2 | E1278: =(C1278*6)+D1278 -> 14 | G1278: 3 | H1278: 4 | I1278: =(G1278*6)+H1278 -> 22 | K1278: 6 | L1278: 8 | M1278: =(K1278*6)+L1278 -> 44 | O1278: 10 | P1278: 11 | Q1278: =(O1278*6)+P1278 -> 71 | W1278: CARLTON | X1278: 10 | Y1278: 8 | Z1278: 0 | AA1278: 1660 | AB1278: 1601 | AC1278: =(AA1278/AB1278)*100 -> 103.68519675202998 | AD1278: =(X1278*4)+(Z1278*2) -> 40
A1279: BEST PLAYERS | W1279: SANDRINGHAM | X1279: 10 | Y1279: 8 | Z1279: 0 | AA1279: 1667 | AB1279: 1626 | AC1279: =(AA1279/AB1279)*100 -> 102.52152521525215 | AD1279: =(X1279*4)+(Z1279*2) -> 40
A1280: ESSENDON | C1280: HALL | F1280: HUNT | I1280: HARVEY | L1280: RICHARDS | O1280: McALISTER | R1280: McGRATH
A1281: TASMANIA | C1281: WALKER | F1281: HOWARD | I1281: M GEAPPEN | L1281: ATKIN | O1281: BLIGHT | R1281: TAYLOR | W1281: MURRAY KANGAROOS | X1281: 9 | Y1281: 8 | Z1281: 1 | AA1281: 1838 | AB1281: 1762 | AC1281: =(AA1281/AB1281)*100 -> 104.3132803632236 | AD1281: =(X1281*4)+(Z1281*2) -> 38
A1282: GOALKICKERS | W1282: SPRINGVALE | X1282: 9 | Y1282: 9 | Z1282: 0 | AA1282: 1490 | AB1282: 1514 | AC1282: =(AA1282/AB1282)*100 -> 98.414795244385729 | AD1282: =(X1282*4)+(Z1282*2) -> 36
A1283: ESSENDON | C1283: HARVEY 5 | E1283: BANNISTER 3 | H1283: HAYNES 3 | J1283: DAVIES | L1283: McALISTER | N1283: McGRATH | Q1283: RUNNELLS | S1283: REYNOLDS | W1283: ESSENDON | X1283: 8 | Y1283: 10 | Z1283: 0 | AA1283: 1862 | AB1283: 1990 | AC1283: =(AA1283/AB1283)*100 -> 93.5678391959799 | AD1283: =(X1283*4)+(Z1283*2) -> 32
A1284: TASMANIA | C1284: BLIGHT | E1284: CARTER | G1284: DERBYSHIRE | J1284: B GEAPPEN | M1284: HEATLEY | O1284: JENKINS | Q1284: STEPHENS | S1284: TAYLOR | W1284: TASMANIA | X1284: 7 | Y1284: 10 | Z1284: 1 | AA1284: 1564 | AB1284: 1778 | AC1284: =(AA1284/AB1284)*100 -> 87.964004499437578 | AD1284: =(X1284*4)+(Z1284*2) -> 30
P1285: THOMPSON | S1285: WAGER | W1285: NORTHERN BULLANTS | X1285: 6 | Y1285: 12 | Z1285: 0 | AA1285: 1633 | AB1285: 1862 | AC1285: =(AA1285/AB1285)*100 -> 87.701396348012892 | AD1285: =(X1285*4)+(Z1285*2) -> 24
A1286: GEELONG | C1286: 2 | D1286: 4 | E1286: =(C1286*6)+D1286 -> 16 | G1286: 6 | H1286: 10 | I1286: =(G1286*6)+H1286 -> 46 | K1286: 6 | L1286: 11 | M1286: =(K1286*6)+L1286 -> 47 | O1286: 8 | P1286: 15 | Q1286: =(O1286*6)+P1286 -> 63 | S1286: Venue: MOORABBIN | W1286: FRANKSTON | X1286: 4 | Y1286: 14 | Z1286: 0 | AA1286: 1389 | AB1286: 2020 | AC1286: =(AA1286/AB1286)*100 -> 68.762376237623755 | AD1286: =(X1286*4)+(Z1286*2) -> 16
A1287: SPRINGVALE | C1287: 2 | D1287: 3 | E1287: =(C1287*6)+D1287 -> 15 | G1287: 4 | H1287: 4 | I1287: =(G1287*6)+H1287 -> 28 | K1287: 7 | L1287: 8 | M1287: =(K1287*6)+L1287 -> 50 | O1287: 8 | P1287: 11 | Q1287: =(O1287*6)+P1287 -> 59 | W1287: NORTH BALLARAT | X1287: 3 | Y1287: 15 | Z1287: 0 | AA1287: 1264 | AB1287: 1807 | AC1287: =(AA1287/AB1287)*100 -> 69.950193691200894 | AD1287: =(X1287*4)+(Z1287*2) -> 12
A1288: BEST PLAYERS | W1288: BENDIGO | X1288: 0 | Y1288: 17 | Z1288: 1 | AA1288: 1151 | AB1288: 2361 | AC1288: =(AA1288/AB1288)*100 -> 48.750529436679372 | AD1288: =(X1288*4)+(Z1288*2) -> 2
A1289: GEELONG | C1289: ABLETT | F1289: BARTEL | I1289: O'BRIEN | L1289: McGRATH | O1289: MENSCH | R1289: STREET
A1290: SPRINGVALE | C1290: PLAPP | F1290: CARROLL | I1290: HARRISON | L1290: RIGG | O1290: DAVIS | R1290: O'BRIEN
A1291: GOALKICKERS
A1292: GEELONG | C1292: ABLETT 3 | F1292: O'BRIEN 3 | I1292: D JOHNSON | L1292: MERRIMAN
A1293: SPRINGVALE | C1293: PLAPP 3 | F1293: HOULIHAN 2 | I1293: CLARKE | K1293: DAVIS | M1293: SCHWARZE
A1295: FRANKSTON | C1295: 3 | D1295: 2 | E1295: =(C1295*6)+D1295 -> 20 | G1295: 7 | H1295: 5 | I1295: =(G1295*6)+H1295 -> 47 | K1295: 8 | L1295: 7 | M1295: =(K1295*6)+L1295 -> 55 | O1295: 11 | P1295: 9 | Q1295: =(O1295*6)+P1295 -> 75 | S1295: Venue: OPTUS OVAL (C/R)
A1296: CARLTON | C1296: 4 | D1296: 1 | E1296: =(C1296*6)+D1296 -> 25 | G1296: 4 | H1296: 4 | I1296: =(G1296*6)+H1296 -> 28 | K1296: 6 | L1296: 8 | M1296: =(K1296*6)+L1296 -> 44 | O1296: 8 | P1296: 14 | Q1296: =(O1296*6)+P1296 -> 62
A1297: BEST PLAYERS
A1298: FRANKSTON | C1298: LITTLE | F1298: WILLIS | I1298: GEORGIOU | L1298: SAUTNER | O1298: CLARKE | R1298: ABLETT
A1299: CARLTON | C1299: SPORN | F1299: SINNOTT | I1299: BERRY | L1299: BUTLER
A1300: GOALKICKERS
A1301: FRANKSTON | C1301: SAUTNER 4 | F1301: WILLIS 3 | I1301: KREIG 2 | L1301: LITTLE | N1301: SALIBURY
A1302: CARLTON | C1302: JANSEN 2 | F1302: SINNOTT 2 | I1302: BERRY | K1302: GALLAGHER | N1302: HOULIHAN | Q1302: O'KEEFE
D1303: 11TH AUGUST | J1303: WEATHER
A1304: COBURG | C1304: 4 | D1304: 3 | E1304: =(C1304*6)+D1304 -> 27 | G1304: 10 | H1304: 6 | I1304: =(G1304*6)+H1304 -> 66 | K1304: 12 | L1304: 7 | M1304: =(K1304*6)+L1304 -> 79 | O1304: 18 | P1304: 19 | Q1304: =(O1304*6)+P1304 -> 127 | S1304: COBURG
A1305: BENDIGO | C1305: 2 | D1305: 3 | E1305: =(C1305*6)+D1305 -> 15 | G1305: 3 | H1305: 3 | I1305: =(G1305*6)+H1305 -> 21 | K1305: 6 | L1305: 4 | M1305: =(K1305*6)+L1305 -> 40 | O1305: 7 | P1305: 5 | Q1305: =(O1305*6)+P1305 -> 47
A1306: BEST PLAYERS
A1307: COBURG | C1307: TALBOT | F1307: SZILLER | I1307: CARLSON | L1307: EDNIE | N1307: WESTON | Q1307: BIDDISCOMBE
A1308: BENDIGO | C1308: BOVALINO | F1308: BROWN | I1308: CAIL | L1308: VANCE | N1308: GATHERCOLE
A1309: GOALKICKERS
A1310: COBURG | C1310: EDNIE 4 | E1310: PETTIFER 3 | H1310: BIDDISCOMBE 2 | K1310: HYDE 2 | M1310: DE PASQUALE | P1310: McGRATH | R1310: MAGGIORE | U1310: HART | W1310: STEINFORT | X1310: SZILLER | AA1310: TALBOT
A1311: BENDIGO | C1311: BROWN 2 | F1311: BOVALINO | I1311: DOHERTY | K1311: GATHERCOLE | N1311: HAWKINS | Q1311: PROCTOR
A1313: WERRIBEE | C1313: 4 | D1313: 1 | E1313: =(C1313*6)+D1313 -> 25 | G1313: 9 | H1313: 4 | I1313: =(G1313*6)+H1313 -> 58 | K1313: 13 | L1313: 9 | M1313: =(K1313*6)+L1313 -> 87 | O1313: 19 | P1313: 16 | Q1313: =(O1313*6)+P1313 -> 130 | S1313: Venue: WERRIBEE
A1314: NORTHERN BULLANTS | C1314: 4 | D1314: 3 | E1314: =(C1314*6)+D1314 -> 27 | G1314: 5 | H1314: 3 | I1314: =(G1314*6)+H1314 -> 33 | K1314: 6 | L1314: 5 | M1314: =(K1314*6)+L1314 -> 41 | O1314: 8 | P1314: 7 | Q1314: =(O1314*6)+P1314 -> 55
A1315: BEST PLAYERS
A1316: WERRIBEE | C1316: BARTLETT | F1316: EAGLETON | I1316: BOYD | L1316: RUSCA | N1316: SAUNDERS | Q1316: LAMB
A1317: NORTHERN BULLANTS | C1317: GROSSMAN | F1317: CANN | I1317: PATERSON | L1317: HOOPER | N1317: PENN
A1318: GOALKICKERS
A1319: WERRIBEE | C1319: MITCHELL 3 | F1319: BOWDEN 2 | I1319: RUSCA 2 | K1319: SAUNDERS 2 | N1319: SETCHELL 2 | Q1319: BARTLETT | S1319: BOYD | U1319: CROSS | W1319: KNEZEVIC | X1319: GILHAM | Z1319: HARRIS | AB1319: DYER | AC1319: LAMB
A1320: NORTHERN BULLANTS | C1320: COLLINS | F1320: GIBSON | H1320: HOOPER | J1320: PATERSON | M1320: PENN | N1320: RASO | P1320: SAGE | R1320: ZORZI
A1322: MURRAY KANGAROOS | C1322: 5 | D1322: 6 | E1322: =(C1322*6)+D1322 -> 36 | G1322: 7 | H1322: 9 | I1322: =(G1322*6)+H1322 -> 51 | K1322: 13 | L1322: 11 | M1322: =(K1322*6)+L1322 -> 89 | O1322: 17 | P1322: 14 | Q1322: =(O1322*6)+P1322 -> 116 | S1322: Venue: PORT MELBOURNE
A1323: PORT MELBOURNE | C1323: 2 | D1323: 0 | E1323: =(C1323*6)+D1323 -> 12 | G1323: 6 | H1323: 5 | I1323: =(G1323*6)+H1323 -> 41 | K1323: 10 | L1323: 5 | M1323: =(K1323*6)+L1323 -> 65 | O1323: 17 | P1323: 10 | Q1323: =(O1323*6)+P1323 -> 112
A1324: BEST PLAYERS
A1325: MURRAY KANGAROOS | C1325: SMITH | F1325: BAIRD | I1325: CLAYTON | L1325: McCARTNEY | O1325: COOPER | Q1325: SOFI
A1326: PORT MELBOURNE | C1326: S ANSTEY | F1326: FILANDIA | I1326: GILL | L1326: OBST
A1327: GOALKICKERS
A1328: MURRAY KANGAROOS | C1328: McCARTNEY 4 | F1328: LANGE 3 | I1328: JONES 2 | K1328: McCORMICK 2 | N1328: BOURKE | P1328: CLAYTON | R1328: HARRIS | T1328: McLAREN | W1328: MOTLOP | X1328: SMITH
A1329: PORT MELBOURNE | C1329: S ANSTEY 6 | F1329: FILANDIA 3 | I1329: B PHIBBS 3 | L1329: ABLETT | N1329: ALOI | P1329: BUCHANAN | R1329: OBST | T1329: MILHUISEN
A1331: SANDRINGHAM | C1331: 1 | D1331: 3 | E1331: =(C1331*6)+D1331 -> 9 | G1331: 3 | H1331: 6 | I1331: =(G1331*6)+H1331 -> 24 | K1331: 5 | L1331: 8 | M1331: =(K1331*6)+L1331 -> 38 | O1331: 10 | P1331: 10 | Q1331: =(O1331*6)+P1331 -> 70 | S1331: Venue: BEACH ROAD
A1332: NORTH BALLARAT | C1332: 3 | D1332: 4 | E1332: =(C1332*6)+D1332 -> 22 | G1332: 5 | H1332: 5 | I1332: =(G1332*6)+H1332 -> 35 | K1332: 8 | L1332: 6 | M1332: =(K1332*6)+L1332 -> 54 | O1332: 10 | P1332: 6 | Q1332: =(O1332*6)+P1332 -> 66
A1333: BEST PLAYERS
A1334: SANDRINGHAM | C1334: LYNCH | F1334: LIDDELL | I1334: TRELOAR | L1334: SUTTON | O1334: BREESE | R1334: GRANT
A1335: NORTH BALLARAT | C1335: MAXWELL | F1335: FRITH | I1335: MIDGLEY | L1335: O'KEEFE | O1335: GREIG | R1335: POLKINGHORNE
A1336: GOALKICKERS
A1337: SANDRINGHAM | C1337: SUTTON 2 | F1337: AINLEY | H1337: COGHLAN | J1337: FUNCKE | L1337: HOWARTH | N1337: LIDDELL | P1337: OAKLEY | R1337: TEMPLETON | U1337: TRELOAR
A1338: NORTH BALLARAT | C1338: MIDGLEY 4 | F1338: BYE 3 | I1338: BRIDGES | K1338: COHEN | M1338: GREIG
A1340: ROUND 19 | D1340: 17TH AUGUST | J1340: WEATHER
D1341: 1ST QTR | H1341: 2ND QTR | L1341: 3RD QTR | P1341: FINAL | S1341: Venue: BOX HILL
A1342: COBURG | C1342: 4 | D1342: 3 | E1342: =(C1342*6)+D1342 -> 27 | G1342: 9 | H1342: 4 | I1342: =(G1342*6)+H1342 -> 58 | K1342: 17 | L1342: 8 | M1342: =(K1342*6)+L1342 -> 110 | O1342: 20 | P1342: 11 | Q1342: =(O1342*6)+P1342 -> 131 | S1342: UMPIRES | Y1342: LADDER | AB1342: ROUND | AD1342: 19
A1343: BOX HILL | C1343: 2 | D1343: 4 | E1343: =(C1343*6)+D1343 -> 16 | G1343: 4 | H1343: 10 | I1343: =(G1343*6)+H1343 -> 34 | K1343: 4 | L1343: 13 | M1343: =(K1343*6)+L1343 -> 37 | O1343: 8 | P1343: 16 | Q1343: =(O1343*6)+P1343 -> 64
A1344: BEST PLAYERS | W1344: TEAM | X1344: W | Y1344: L | Z1344: D | AA1344: FOR | AB1344: AGST | AC1344: % | AD1344: PTS
A1345: COBURG | C1345: HYDE | F1345: BIDDISCOMBE | J1345: McGRATH | M1345: CARLSON | P1345: WESTON | R1345: HOULIHAN
A1346: BOX HILL | C1346: NICHOLS | F1346: GREENE | J1346: PASSADOR | M1346: LADSON | P1346: JOHNSON | W1346: GEELONG | X1346: 16 | Y1346: 3 | Z1346: 0 | AA1346: 2007 | AB1346: 1224 | AC1346: =(AA1346/AB1346)*100 -> 163.97058823529412 | AD1346: =(X1346*4)+(Z1346*2) -> 64
A1347: GOALKICKERS | N1347: MAGGIORE | Q1347: POYAS | S1347: RAYSON | W1347: WERRIBEE | X1347: 15 | Y1347: 4 | Z1347: 0 | AA1347: 2143 | AB1347: 1397 | AC1347: =(AA1347/AB1347)*100 -> 153.40014316392271 | AD1347: =(X1347*4)+(Z1347*2) -> 60
A1348: COBURG | C1348: HUDSON 4 | F1348: McGRATH 4 | I1348: PETTIFER 3 | L1348: KURET 2 | N1348: WESTON 2 | Q1348: HOULIHAN | S1348: HYDE | W1348: COBURG | X1348: 15 | Y1348: 4 | Z1348: 0 | AA1348: 1936 | AB1348: 1412 | AC1348: =(AA1348/AB1348)*100 -> 137.11048158640227 | AD1348: =(X1348*4)+(Z1348*2) -> 60
A1349: BOX HILL | C1349: ALLEWAY 2 | F1349: BANKS 2 | I1349: BAYFORD | K1349: JOHNSON | M1349: PASSADOR | P1349: WILLIAMS | W1349: PORT MELBOURNE | X1349: 13 | Y1349: 6 | Z1349: 0 | AA1349: 1969 | AB1349: 1688 | AC1349: =(AA1349/AB1349)*100 -> 116.64691943127963 | AD1349: =(X1349*4)+(Z1349*2) -> 52
W1350: BOX HILL | X1350: 11 | Y1350: 7 | Z1350: 1 | AA1350: 2020 | AB1350: 1706 | AC1350: =(AA1350/AB1350)*100 -> 118.40562719812426 | AD1350: =(X1350*4)+(Z1350*2) -> 46
A1351: PORT MELBOURNE | C1351: 2 | D1351: 3 | E1351: =(C1351*6)+D1351 -> 15 | G1351: 7 | H1351: 7 | I1351: =(G1351*6)+H1351 -> 49 | K1351: 9 | L1351: 8 | M1351: =(K1351*6)+L1351 -> 62 | O1351: 15 | P1351: 12 | Q1351: =(O1351*6)+P1351 -> 102 | S1351: Venue: MOORABBIN | W1351: MURRAY KANGAROOS | X1351: 10 | Y1351: 8 | Z1351: 1 | AA1351: 1954 | AB1351: 1834 | AC1351: =(AA1351/AB1351)*100 -> 106.54307524536533 | AD1351: =(X1351*4)+(Z1351*2) -> 42
A1352: SPRINGVALE | C1352: 3 | D1352: 2 | E1352: =(C1352*6)+D1352 -> 20 | G1352: 5 | H1352: 3 | I1352: =(G1352*6)+H1352 -> 33 | K1352: 10 | L1352: 8 | M1352: =(K1352*6)+L1352 -> 68 | O1352: 13 | P1352: 9 | Q1352: =(O1352*6)+P1352 -> 87 | W1352: WILLIAMSTOWN | X1352: 10 | Y1352: 9 | Z1352: 0 | AA1352: 1865 | AB1352: 1744 | AC1352: =(AA1352/AB1352)*100 -> 106.93807339449542 | AD1352: =(X1352*4)+(Z1352*2) -> 40
A1353: BEST PLAYERS | W1353: SANDRINGHAM | X1353: 10 | Y1353: 9 | Z1353: 0 | AA1353: 1739 | AB1353: 1706 | AC1353: =(AA1353/AB1353)*100 -> 101.93434935521688 | AD1353: =(X1353*4)+(Z1353*2) -> 40
A1354: PORT MELBOURNE | C1354: SCHNEIDER | F1354: ROBERTSON | I1354: ROSE | K1354: SUNDQUIST | N1354: McMAHON | Q1354: BARRY
A1355: SPRINGVALE | C1355: HARRISON | F1355: BLAKE | I1355: RIGG | K1355: SMITH | N1355: DAVIS | Q1355: MADDOX | W1355: CARLTON | X1355: 10 | Y1355: 9 | Z1355: 0 | AA1355: 1732 | AB1355: 1717 | AC1355: =(AA1355/AB1355)*100 -> 100.87361677344204 | AD1355: =(X1355*4)+(Z1355*2) -> 40
A1356: GOALKICKERS | P1356: McMAHON | R1356: ROBERTSON | W1356: SPRINGVALE | X1356: 9 | Y1356: 10 | Z1356: 0 | AA1356: 1577 | AB1356: 1616 | AC1356: =(AA1356/AB1356)*100 -> 97.586633663366342 | AD1356: =(X1356*4)+(Z1356*2) -> 36
A1357: PORT MELBOURNE | C1357: SUNDQUIST 4 | F1357: PHIBBS 3 | I1357: SCHNEIDER 2 | L1357: L ABLETT | N1357: ALOI | P1357: BUCHANAN | R1357: COTCHETT | W1357: ESSENDON | X1357: 9 | Y1357: 10 | Z1357: 0 | AA1357: 1996 | AB1357: 2060 | AC1357: =(AA1357/AB1357)*100 -> 96.893203883495147 | AD1357: =(X1357*4)+(Z1357*2) -> 36
A1358: SPRINGVALE | C1358: SMITH 5 | F1358: PITT 2 | I1358: SCHWARZE 2 | L1358: DAVIS | N1358: DEHEY | P1358: DILLON | R1358: HOULIHAN | W1358: TASMANIA | X1358: 8 | Y1358: 10 | Z1358: 1 | AA1358: 1676 | AB1358: 1859 | AC1358: =(AA1358/AB1358)*100 -> 90.155997848305532 | AD1358: =(X1358*4)+(Z1358*2) -> 34
W1359: NORTHERN BULLANTS | X1359: 6 | Y1359: 13 | Z1359: 0 | AA1359: 1710 | AB1359: 1957 | AC1359: =(AA1359/AB1359)*100 -> 87.378640776699029 | AD1359: =(X1359*4)+(Z1359*2) -> 24
A1360: WERRIBEE | C1360: 3 | D1360: 3 | E1360: =(C1360*6)+D1360 -> 21 | G1360: 6 | H1360: 4 | I1360: =(G1360*6)+H1360 -> 40 | K1360: 11 | L1360: 5 | M1360: =(K1360*6)+L1360 -> 71 | O1360: 12 | P1360: 8 | Q1360: =(O1360*6)+P1360 -> 80 | S1360: Venue: WERRIBEE | W1360: NORTH BALLARAT | X1360: 4 | Y1360: 15 | Z1360: 0 | AA1360: 1359 | AB1360: 1884 | AC1360: =(AA1360/AB1360)*100 -> 72.133757961783445 | AD1360: =(X1360*4)+(Z1360*2) -> 16
A1361: SANDRINGHAM | C1361: 1 | D1361: 5 | E1361: =(C1361*6)+D1361 -> 11 | G1361: 5 | H1361: 7 | I1361: =(G1361*6)+H1361 -> 37 | K1361: 9 | L1361: 9 | M1361: =(K1361*6)+L1361 -> 63 | O1361: 10 | P1361: 12 | Q1361: =(O1361*6)+P1361 -> 72 | W1361: FRANKSTON | X1361: 4 | Y1361: 15 | Z1361: 0 | AA1361: 1470 | AB1361: 2132 | AC1361: =(AA1361/AB1361)*100 -> 68.949343339587244 | AD1361: =(X1361*4)+(Z1361*2) -> 16
A1362: BEST PLAYERS | W1362: BENDIGO | X1362: 0 | Y1362: 18 | Z1362: 1 | AA1362: 1195 | AB1362: 2458 | AC1362: =(AA1362/AB1362)*100 -> 48.616761594792514 | AD1362: =(X1362*4)+(Z1362*2) -> 2
A1363: WERRIBEE | C1363: BARTLETT | F1363: SETCHELL | I1363: PICKEN | K1363: HARRIS | N1363: DYER | P1363: SAUNDERS
A1364: SANDRINGHAM | C1364: FEBEY | F1364: FUNCKE | I1364: LYNCH | K1364: McDONALD | N1364: RADFORD | P1364: TREGEAR
A1365: GOALKICKERS
A1366: WERRIBEE | C1366: MITCHELL 3 | F1366: SAUNDERS 3 | I1366: HARRIS 2 | L1366: WIGGINS 2 | O1366: FAULKNER | R1366: McGUINNESS
A1367: SANDRINGHAM | C1367: WILLIAMS 3 | F1367: FUNCKE 2 | I1367: WILSON 2 | L1367: FEBEY | N1367: LIDDELL | Q1367: TEMPLETON
A1369: NORTH BALLARAT | C1369: 3 | D1369: 3 | E1369: =(C1369*6)+D1369 -> 21 | G1369: 5 | H1369: 10 | I1369: =(G1369*6)+H1369 -> 40 | K1369: 9 | L1369: 14 | M1369: =(K1369*6)+L1369 -> 68 | O1369: 13 | P1369: 17 | Q1369: =(O1369*6)+P1369 -> 95 | S1369: Venue: NORTH BALLARAT
A1370: NORTHERN BULLANTS | C1370: 6 | D1370: 2 | E1370: =(C1370*6)+D1370 -> 38 | G1370: 7 | H1370: 4 | I1370: =(G1370*6)+H1370 -> 46 | K1370: 10 | L1370: 10 | M1370: =(K1370*6)+L1370 -> 70 | O1370: 11 | P1370: 11 | Q1370: =(O1370*6)+P1370 -> 77
A1371: BEST PLAYERS
A1372: NORTH BALLARAT | C1372: GREIG | F1372: CLAYTON | I1372: MIDGELEY | L1372: POLKINGHORNE | O1372: JENKINS | R1372: BRADLY
A1373: NORTHERN BULLANTS | C1373: VANSITTART | F1373: PATERSON | I1373: GRAINGER | L1373: CLARKE | O1373: PILLING | R1373: PENN
A1374: GOALKICKERS
A1375: NORTH BALLARAT | C1375: BRADLY 4 | F1375: MIDGELEY 3 | I1375: CLAYTON 2 | L1375: BYE | M1375: GREIG | O1375: JENKINS | Q1375: MAIN
A1376: NORTHERN BULLANTS | C1376: CANN 3 | F1376: CLARKE | H1376: GIBSON | J1376: HOOPER | L1376: PATERSON | N1376: PENN | P1376: RASO | R1376: WALSH | T1376: ZORZI
D1377: 18TH AUGUST | J1377: WEATHER
A1378: GEELONG | C1378: 2 | D1378: 3 | E1378: =(C1378*6)+D1378 -> 15 | G1378: 5 | H1378: 5 | I1378: =(G1378*6)+H1378 -> 35 | K1378: 8 | L1378: 12 | M1378: =(K1378*6)+L1378 -> 60 | O1378: 13 | P1378: 19 | Q1378: =(O1378*6)+P1378 -> 97 | S1378: Venue: BENDIGO
A1379: BENDIGO | C1379: 2 | D1379: 1 | E1379: =(C1379*6)+D1379 -> 13 | G1379: 6 | H1379: 3 | I1379: =(G1379*6)+H1379 -> 39 | K1379: 5 | L1379: 6 | M1379: =(K1379*6)+L1379 -> 36 | O1379: 6 | P1379: 8 | Q1379: =(O1379*6)+P1379 -> 44
A1380: BEST PLAYERS
A1381: GEELONG | C1381: ABLETT | F1381: BARTEL | I1381: HUNT | K1381: FOSTER | M1381: POWELL | O1381: D JOHNSON
A1382: BENDIGO | C1382: EATON | F1382: CARTER | I1382: BOVALINO | K1382: M BRADLEY | N1382: VANCE
A1383: GOALKICKERS
A1384: GEELONG | C1384: BLACKNEY 2 | F1384: MENSCH 2 | I1384: ABLETT | K1384: CALLAN | M1384: CARRAZZO | P1384: CHAMBERS | R1384: GRGIC | T1384: McCARTHY | W1384: O'BRIEN | X1384: PLAYFAIR | AA1384: STREET
A1385: BENDIGO | C1385: CARTER 2 | F1385: DOHERTY 2 | I1385: JACKSON | K1385: PROCTOR
A1387: MURRAY KANGAROOS | C1387: 3 | D1387: 7 | E1387: =(C1387*6)+D1387 -> 25 | G1387: 6 | H1387: 14 | I1387: =(G1387*6)+H1387 -> 50 | K1387: 10 | L1387: 17 | M1387: =(K1387*6)+L1387 -> 77 | O1387: 16 | P1387: 20 | Q1387: =(O1387*6)+P1387 -> 116 | S1387: Venue: OPTUS OVAL
A1388: CARLTON | C1388: 2 | D1388: 3 | E1388: =(C1388*6)+D1388 -> 15 | G1388: 8 | H1388: 5 | I1388: =(G1388*6)+H1388 -> 53 | K1388: 9 | L1388: 9 | M1388: =(K1388*6)+L1388 -> 63 | O1388: 10 | P1388: 12 | Q1388: =(O1388*6)+P1388 -> 72
A1389: BEST PLAYERS
A1390: MURRAY KANGAROOS | C1390: WATT | F1390: D MOTLOP | I1390: PETRIE | K1390: S MOTLOP | N1390: JONES | Q1390: LANGE
A1391: CARLTON | C1391: SINNOTT | F1391: WAITE | I1391: DAVIS
A1392: GOALKICKERS
A1393: MURRAY KANGAROOS | C1393: D MOTLOP 4 | F1393: PETRIE 4 | I1393: BOURKE 2 | L1393: JONES 2 | N1393: S MOTLOP 2 | Q1393: McLAREN | S1393: STEVENS
A1394: CARLTON | C1394: MATTHEWS 3 | F1394: FLEMING 2 | I1394: GUTTERSON | L1394: MANSFIELD | N1394: ROSA | P1394: SMITH | R1394: WAITE
A1396: TASMANIA | C1396: 3 | D1396: 0 | E1396: =(C1396*6)+D1396 -> 18 | G1396: 6 | H1396: 1 | I1396: =(G1396*6)+H1396 -> 37 | K1396: 10 | L1396: 3 | M1396: =(K1396*6)+L1396 -> 63 | O1396: 18 | P1396: 4 | Q1396: =(O1396*6)+P1396 -> 112 | S1396: Venue: FRANKSTON
A1397: FRANKSTON | C1397: 3 | D1397: 4 | E1397: =(C1397*6)+D1397 -> 22 | G1397: 8 | H1397: 6 | I1397: =(G1397*6)+H1397 -> 54 | K1397: 10 | L1397: 13 | M1397: =(K1397*6)+L1397 -> 73 | O1397: 11 | P1397: 15 | Q1397: =(O1397*6)+P1397 -> 81
A1398: BEST PLAYERS
A1399: TASMANIA | C1399: CARELESS | F1399: GEAPPEN | I1399: THURLEY | L1399: WALKER | N1399: HOWARD | Q1399: S TAYLOR
A1400: FRANKSTON | C1400: LYON | F1400: FERGUSON | I1400: D CLARKE | L1400: SAUTNER | N1400: POLLARD
A1401: GOALKICKERS
A1402: TASMANIA | C1402: THURLEY 5 | F1402: BLIGHT 3 | I1402: BEAMS 2 | K1402: CARTER 2 | M1402: HEATLEY 2 | P1402: BOLTON | R1402: DERBYSHIRE | U1402: JONES | W1402: GEAPPEN
A1403: FRANKSTON | C1403: SAUTNER 5 | F1403: SALISBURY 2 | J1403: D CLARKE | M1403: FOLINO | O1403: WILLIS | Q1403: WINTERTON
A1405: ESSENDON | C1405: 6 | D1405: 6 | E1405: =(C1405*6)+D1405 -> 42 | G1405: 9 | H1405: 10 | I1405: =(G1405*6)+H1405 -> 64 | K1405: 14 | L1405: 15 | M1405: =(K1405*6)+L1405 -> 99 | O1405: 19 | P1405: 20 | Q1405: =(O1405*6)+P1405 -> 134 | S1405: Venue: WINDY HILL
A1406: WILLIAMSTOWN | C1406: 1 | D1406: 3 | E1406: =(C1406*6)+D1406 -> 9 | G1406: 6 | H1406: 5 | I1406: =(G1406*6)+H1406 -> 41 | K1406: 9 | L1406: 6 | M1406: =(K1406*6)+L1406 -> 60 | O1406: 10 | P1406: 10 | Q1406: =(O1406*6)+P1406 -> 70
A1407: BEST PLAYERS
A1408: ESSENDON | C1408: BULLEN | F1408: HARVEY | I1408: RICHARDS | L1408: HILLE | N1408: McALISTER | Q1408: HALL
A1409: WILLIAMSTOWN | C1409: RICHARDSON | F1409: PODSIADLY | I1409: DEANGELIS | L1409: O'BREE
A1410: GOALKICKERS
A1411: ESSENDON | C1411: HAYNES 4 | F1411: HAWKINS 3 | I1411: BULLEN 2 | K1411: SAAD 2 | M1411: GODDARD | O1411: HALL | Q1411: T McGRATH | T1411: O'KEEFE | V1411: RUNNALLS | X1411: WINTER
A1412: WILLIAMSTOWN | C1412: PODSIADLY 4 | F1412: SWAN 2 | I1412: ADKINS | K1412: PEARCE | M1412: RICHARDSON | P1412: STEINFORT
A1414: ROUND 20 | D1414: 23RD AUGUST | G1414: NIGHT MATCH | J1414: WEATHER
D1415: 1ST QTR | H1415: 2ND QTR | L1415: 3RD QTR | P1415: FINAL | S1415: Venue: YORK PARK (Launceston)
A1416: COBURG | C1416: 2 | D1416: 6 | E1416: =(C1416*6)+D1416 -> 18 | G1416: 4 | H1416: 9 | I1416: =(G1416*6)+H1416 -> 33 | K1416: 8 | L1416: 10 | M1416: =(K1416*6)+L1416 -> 58 | O1416: 12 | P1416: 11 | Q1416: =(O1416*6)+P1416 -> 83 | S1416: UMPIRES | Y1416: LADDER | AB1416: ROUND | AD1416: 20
A1417: TASMANIA | C1417: 2 | D1417: 1 | E1417: =(C1417*6)+D1417 -> 13 | G1417: 3 | H1417: 3 | I1417: =(G1417*6)+H1417 -> 21 | K1417: 6 | L1417: 5 | M1417: =(K1417*6)+L1417 -> 41 | O1417: 8 | P1417: 6 | Q1417: =(O1417*6)+P1417 -> 54
A1418: BEST PLAYERS | W1418: TEAM | X1418: W | Y1418: L | Z1418: D | AA1418: FOR | AB1418: AGST | AC1418: % | AD1418: PTS
A1419: COBURG | C1419: HYDE | F1419: TALBOT | I1419: BIDDISCOMBE | L1419: VARDY | N1419: SZILLER | Q1419: PAGAN
A1420: TASMANIA | C1420: ATKIN | F1420: JENKINS | I1420: CARELESS | L1420: WALKER | N1420: HULM | Q1420: A TAYLOR | W1420: GEELONG | X1420: 17 | Y1420: 3 | Z1420: 0 | AA1420: 2171 | AB1420: 1278 | AC1420: =(AA1420/AB1420)*100 -> 169.87480438184664 | AD1420: =(X1420*4)+(Z1420*2) -> 68
A1421: GOALKICKERS | P1421: VARDY | W1421: WERRIBEE | X1421: 16 | Y1421: 4 | Z1421: 0 | AA1421: 2233 | AB1421: 1450 | AC1421: =(AA1421/AB1421)*100 -> 154 | AD1421: =(X1421*4)+(Z1421*2) -> 64
A1422: COBURG | C1422: EDNIE 3 | E1422: PETTIFER 2 | H1422: CARLSON | J1422: FLAHERTY | M1422: RAYSON | O1422: SZILLER | Q1422: TALBOT | S1422: TAYLOR | W1422: COBURG | X1422: 16 | Y1422: 4 | Z1422: 0 | AA1422: 2019 | AB1422: 1466 | AC1422: =(AA1422/AB1422)*100 -> 137.72169167803548 | AD1422: =(X1422*4)+(Z1422*2) -> 64
A1423: TASMANIA | C1423: BEAMS 3 | F1423: DERBYSHIRE | I1423: HEATLEY | K1423: HOWARD | M1423: STEVENSON | P1423: THURLEY | W1423: PORT MELBOURNE | X1423: 14 | Y1423: 6 | Z1423: 0 | AA1423: 2097 | AB1423: 1780 | AC1423: =(AA1423/AB1423)*100 -> 117.80898876404495 | AD1423: =(X1423*4)+(Z1423*2) -> 56
D1424: 24TH AUGUST | J1424: WEATHER | W1424: BOX HILL | X1424: 12 | Y1424: 7 | Z1424: 1 | AA1424: 2135 | AB1424: 1770 | AC1424: =(AA1424/AB1424)*100 -> 120.62146892655367 | AD1424: =(X1424*4)+(Z1424*2) -> 50
A1425: WERRIBEE | C1425: 4 | D1425: 3 | E1425: =(C1425*6)+D1425 -> 27 | G1425: 8 | H1425: 5 | I1425: =(G1425*6)+H1425 -> 53 | K1425: 9 | L1425: 8 | M1425: =(K1425*6)+L1425 -> 62 | O1425: 13 | P1425: 12 | Q1425: =(O1425*6)+P1425 -> 90 | S1425: Venue: OPTUS OVAL | W1425: WILLIAMSTOWN | X1425: 11 | Y1425: 9 | Z1425: 0 | AA1425: 1997 | AB1425: 1821 | AC1425: =(AA1425/AB1425)*100 -> 109.66501922020868 | AD1425: =(X1425*4)+(Z1425*2) -> 44
A1426: CARLTON | C1426: 1 | D1426: 4 | E1426: =(C1426*6)+D1426 -> 10 | G1426: 2 | H1426: 10 | I1426: =(G1426*6)+H1426 -> 22 | K1426: 4 | L1426: 14 | M1426: =(K1426*6)+L1426 -> 38 | O1426: 6 | P1426: 17 | Q1426: =(O1426*6)+P1426 -> 53 | W1426: MURRAY KANGAROOS | X1426: 10 | Y1426: 9 | Z1426: 1 | AA1426: 2018 | AB1426: 1949 | AC1426: =(AA1426/AB1426)*100 -> 103.54027706516162 | AD1426: =(X1426*4)+(Z1426*2) -> 42
A1427: BEST PLAYERS | W1427: SANDRINGHAM | X1427: 10 | Y1427: 10 | Z1427: 0 | AA1427: 1831 | AB1427: 1834 | AC1427: =(AA1427/AB1427)*100 -> 99.836423118865866 | AD1427: =(X1427*4)+(Z1427*2) -> 40
A1428: WERRIBEE | C1428: ROBERTSON | F1428: SKIPPER | I1428: JACK | L1428: WIGGINS | N1428: DYER
A1429: CARLTON | C1429: DAVIS | F1429: WAITE | I1429: PICKERING | L1429: MATTHEWS | N1429: WATSON | Q1429: GALLAGHER | W1429: CARLTON | X1429: 10 | Y1429: 10 | Z1429: 0 | AA1429: 1785 | AB1429: 1807 | AC1429: =(AA1429/AB1429)*100 -> 98.782512451577205 | AD1429: =(X1429*4)+(Z1429*2) -> 40
A1430: GOALKICKERS | W1430: ESSENDON | X1430: 10 | Y1430: 10 | Z1430: 0 | AA1430: 2091 | AB1430: 2144 | AC1430: =(AA1430/AB1430)*100 -> 97.527985074626869 | AD1430: =(X1430*4)+(Z1430*2) -> 40
A1431: WERRIBEE | C1431: SKIPPER 4 | F1431: BOWDEN 2 | I1431: JACK 2 | K1431: RAU 2 | M1431: BOYD | O1431: HUNTER | Q1431: McGUINNES | W1431: SPRINGVALE | X1431: 9 | Y1431: 11 | Z1431: 0 | AA1431: 1654 | AB1431: 1748 | AC1431: =(AA1431/AB1431)*100 -> 94.622425629290618 | AD1431: =(X1431*4)+(Z1431*2) -> 36
A1432: CARLTON | C1432: BERRY 2 | F1432: HACKETT | I1432: FLEMING | K1432: MATTHEWS | N1432: MERRINGTON | W1432: TASMANIA | X1432: 8 | Y1432: 11 | Z1432: 1 | AA1432: 1730 | AB1432: 1942 | AC1432: =(AA1432/AB1432)*100 -> 89.083419155509773 | AD1432: =(X1432*4)+(Z1432*2) -> 34
W1433: NORTHERN BULLANTS | X1433: 6 | Y1433: 14 | Z1433: 0 | AA1433: 1764 | AB1433: 2121 | AC1433: =(AA1433/AB1433)*100 -> 83.168316831683171 | AD1433: =(X1433*4)+(Z1433*2) -> 24
A1434: BOX HILL | C1434: 8 | D1434: 1 | E1434: =(C1434*6)+D1434 -> 49 | G1434: 10 | H1434: 4 | I1434: =(G1434*6)+H1434 -> 64 | K1434: 17 | L1434: 6 | M1434: =(K1434*6)+L1434 -> 108 | O1434: 18 | P1434: 7 | Q1434: =(O1434*6)+P1434 -> 115 | S1434: Venue: COBURG | W1434: NORTH BALLARAT | X1434: 5 | Y1434: 15 | Z1434: 0 | AA1434: 1485 | AB1434: 1944 | AC1434: =(AA1434/AB1434)*100 -> 76.388888888888886 | AD1434: =(X1434*4)+(Z1434*2) -> 20
A1435: MURRAY KANGAROOS | C1435: 1 | D1435: 1 | E1435: =(C1435*6)+D1435 -> 7 | G1435: 4 | H1435: 8 | I1435: =(G1435*6)+H1435 -> 32 | K1435: 7 | L1435: 9 | M1435: =(K1435*6)+L1435 -> 51 | O1435: 9 | P1435: 10 | Q1435: =(O1435*6)+P1435 -> 64 | W1435: FRANKSTON | X1435: 4 | Y1435: 16 | Z1435: 0 | AA1435: 1530 | AB1435: 2258 | AC1435: =(AA1435/AB1435)*100 -> 67.759078830823739 | AD1435: =(X1435*4)+(Z1435*2) -> 16
A1436: BEST PLAYERS | W1436: BENDIGO | X1436: 0 | Y1436: 19 | Z1436: 1 | AA1436: 1279 | AB1436: 2553 | AC1436: =(AA1436/AB1436)*100 -> 50.097924010967489 | AD1436: =(X1436*4)+(Z1436*2) -> 2
A1437: BOX HILL | C1437: GEORGIADIS | F1437: SMITH | I1437: ALLEWAY | L1437: NEAGLE | N1437: GREENE | Q1437: NICHOLS
A1438: MURRAY KANGAROOS | C1438: LANGE | F1438: McLAREN | I1438: PRATT | L1438: SOFI | N1438: McCORMICK
A1439: GOALKICKERS | R1439: NEAGLE
A1440: BOX HILL | C1440: PASSADOR 4 | F1440: ALLEWAY 4 | I1440: BAYFORD 4 | L1440: NICHOLS 2 | O1440: BANKS | Q1440: ELSTONE | S1440: FIRRITO
A1441: MURRAY KANGAROOS | C1441: TREGENZA 3 | F1441: LANGE | H1441: LOWCOCK | J1441: McCORMICK | M1441: McLAREN | O1441: STEVENS | Q1441: WATT
A1443: WILLIAMSTOWN | C1443: 5 | D1443: 1 | E1443: =(C1443*6)+D1443 -> 31 | G1443: 10 | H1443: 6 | I1443: =(G1443*6)+H1443 -> 66 | K1443: 14 | L1443: 11 | M1443: =(K1443*6)+L1443 -> 95 | O1443: 19 | P1443: 18 | Q1443: =(O1443*6)+P1443 -> 132 | S1443: Venue: MOORABBIN
A1444: SPRINGVALE | C1444: 5 | D1444: 5 | E1444: =(C1444*6)+D1444 -> 35 | G1444: 8 | H1444: 9 | I1444: =(G1444*6)+H1444 -> 57 | K1444: 9 | L1444: 10 | M1444: =(K1444*6)+L1444 -> 64 | O1444: 11 | P1444: 11 | Q1444: =(O1444*6)+P1444 -> 77
A1445: BEST PLAYERS
A1446: WILLIAMSTOWN | C1446: STEINFORT | F1446: SMOKER | I1446: BETHERAS | L1446: COLE | N1446: MOLLOY | Q1446: DIMATTINA
A1447: SPRINGVALE | C1447: CAPLES | F1447: DAVIS | I1447: CARROLL | L1447: HARRISON | N1447: B SCHWARZE | Q1447: CRANSTON
A1448: GOALKICKERS
A1449: WILLIAMSTOWN | C1449: PEARCE 3 | E1449: LLOYD 2 | G1449: MOLLOY 2 | I1449: PODSIADLY 2 | L1449: SMOKER 2 | N1449: STEINFORT 2 | Q1449: BETHERAS | S1449: DIMATTINA | V1449: LOVETT-MURRAY | X1449: KINNEAR | AA1449: FLETCHER | AC1449: SWAN
A1450: SPRINGVALE | C1450: HARRISON 2 | F1450: PITT 2 | H1450: SMITH 2 | J1450: CAPLES | L1450: CARMODY | N1450: DAVIS | P1450: OLIVER | R1450: RIGG
A1452: ESSENDON | C1452: 0 | D1452: 2 | E1452: =(C1452*6)+D1452 -> 2 | G1452: 2 | H1452: 6 | I1452: =(G1452*6)+H1452 -> 18 | K1452: 8 | L1452: 8 | M1452: =(K1452*6)+L1452 -> 56 | O1452: 14 | P1452: 11 | Q1452: =(O1452*6)+P1452 -> 95 | S1452: Venue: WINDY HILL
A1453: BENDIGO | C1453: 5 | D1453: 1 | E1453: =(C1453*6)+D1453 -> 31 | G1453: 8 | H1453: 2 | I1453: =(G1453*6)+H1453 -> 50 | K1453: 9 | L1453: 4 | M1453: =(K1453*6)+L1453 -> 58 | O1453: 13 | P1453: 6 | Q1453: =(O1453*6)+P1453 -> 84
A1454: BEST PLAYERS
A1455: ESSENDON | C1455: HUNT | F1455: C McGRATH | I1455: DAVIES | K1455: RICHARDS | N1455: HARVEY | Q1455: FORSTER-KNIGHT
A1456: BENDIGO | C1456: CANCE | F1456: CAIL | I1456: CAMPBELL | K1456: M BRADLEY | N1456: ELLIOTT | Q1456: PROCTOR
A1457: GOALKICKERS
A1458: ESSENDON | C1458: HAYNES 4 | F1458: HARVEY 3 | I1458: ARCHARD 2 | L1458: BANNISTER | N1458: HALL | P1458: McALISTER | R1458: McDONALD | U1458: MAHONEY
A1459: BENDIGO | C1459: CARTER 3 | F1459: BROWN 2 | I1459: M BRADLEY | L1459: CAIL | N1459: DOHERTY | P1459: EATON | R1459: ELSUM | T1459: PROCTOR | W1459: GATHERCOLE | X1459: SCHMIDT
D1460: 25TH AUGUST | J1460: WEATHER
A1461: GEELONG | C1461: 6 | D1461: 2 | E1461: =(C1461*6)+D1461 -> 38 | G1461: 15 | H1461: 4 | I1461: =(G1461*6)+H1461 -> 94 | K1461: 22 | L1461: 5 | M1461: =(K1461*6)+L1461 -> 137 | O1461: 26 | P1461: 8 | Q1461: =(O1461*6)+P1461 -> 164 | S1461: Venue: PRESTON
A1462: NORTHERN BULLANTS | C1462: 1 | D1462: 1 | E1462: =(C1462*6)+D1462 -> 7 | G1462: 2 | H1462: 2 | I1462: =(G1462*6)+H1462 -> 14 | K1462: 6 | L1462: 5 | M1462: =(K1462*6)+L1462 -> 41 | O1462: 8 | P1462: 6 | Q1462: =(O1462*6)+P1462 -> 54
A1463: BEST PLAYERS
A1464: GEELONG | C1464: ABLETT | F1464: MCCARTHY | I1464: GARDINER | L1464: O'BRIEN | O1464: WHITE | Q1464: D JOHNSON
A1465: NORTHERN BULLANTS | C1465: TAYLOR | F1465: GIBSON | I1465: SALIBA | L1465: HOOPER | O1465: GRAINGER
A1466: GOALKICKERS
A1467: GEELONG | C1467: O'BRIEN 5 | E1467: ABLETT 4 | G1467: McCARTHY 4 | J1467: GRGIC 3 | L1467: MENSCH 3 | N1467: McGRATH 3 | Q1467: GARDINER | S1467: D JOHNSON | V1467: KILPATRICK | X1467: PLAYFAIR
A1468: NORTHERN BULLANTS | C1468: GRAINGER 4 | F1468: GIBSON | H1468: RASO | J1468: REID | L1468: WALSH
A1470: PORT MELBOURNE | C1470: 4 | D1470: 5 | E1470: =(C1470*6)+D1470 -> 29 | G1470: 8 | H1470: 10 | I1470: =(G1470*6)+H1470 -> 58 | K1470: 15 | L1470: 14 | M1470: =(K1470*6)+L1470 -> 104 | O1470: 18 | P1470: 20 | Q1470: =(O1470*6)+P1470 -> 128 | S1470: Venue: PORT MELBOURNE
A1471: SANDRINGHAM | C1471: 2 | D1471: 2 | E1471: =(C1471*6)+D1471 -> 14 | G1471: 3 | H1471: 5 | I1471: =(G1471*6)+H1471 -> 23 | K1471: 9 | L1471: 6 | M1471: =(K1471*6)+L1471 -> 60 | O1471: 14 | P1471: 8 | Q1471: =(O1471*6)+P1471 -> 92
A1472: BEST PLAYERS
A1473: PORT MELBOURNE | C1473: STEVENS | F1473: BUCHANAN | I1473: L ABLETT | L1473: McMAHON | N1473: BROCKMAN | Q1473: O'LOUGHLIN
A1474: SANDRINGHAM | C1474: McDONALD | F1474: WILSON | I1474: LYNCH | L1474: ROGERS | N1474: ROBBINS | Q1474: AINLEY
A1475: GOALKICKERS
A1476: PORT MELBOURNE | C1476: STEVENS 6 | F1476: L ABLETT 2 | I1476: ANSTEY 2 | K1476: BUCHANAN 2 | N1476: O'LOUGHLIN 2 | Q1476: FILANDIA | S1476: PHIBBS | U1476: RIX | W1476: ROBERTSON
A1477: SANDRINGHAM | C1477: ROGERS 5 | F1477: ROBBINS 3 | I1477: BREESE | K1477: COGHLAN | M1477: JAMES | O1477: KANE | Q1477: LIDDELL | S1477: WILSON
A1479: NORTH BALLARAT | C1479: 4 | D1479: 2 | E1479: =(C1479*6)+D1479 -> 26 | G1479: 9 | H1479: 7 | I1479: =(G1479*6)+H1479 -> 61 | K1479: 14 | L1479: 10 | M1479: =(K1479*6)+L1479 -> 94 | O1479: 19 | P1479: 12 | Q1479: =(O1479*6)+P1479 -> 126 | S1479: Venue: FRANKSTON
A1480: FRANKSTON | C1480: 3 | D1480: 0 | E1480: =(C1480*6)+D1480 -> 18 | G1480: 4 | H1480: 4 | I1480: =(G1480*6)+H1480 -> 28 | K1480: 7 | L1480: 4 | M1480: =(K1480*6)+L1480 -> 46 | O1480: 9 | P1480: 6 | Q1480: =(O1480*6)+P1480 -> 60
A1481: BEST PLAYERS
A1482: NORTH BALLARAT | C1482: CLAYTON | F1482: GREIG | I1482: O'KEEFE | L1482: BRADLY | N1482: FRITH
A1483: FRANKSTON | C1483: FERGUSON | F1483: SAUTNER | I1483: POLLARD | L1483: KREIG | N1483: ABLETT | Q1483: D CLARKE
A1484: GOALKICKERS
A1485: NORTH BALLARAT | C1485: BRADLY 4 | F1485: SPOLDING 4 | I1485: CLAYTON 3 | L1485: BEST 2 | N1485: MAIN 2 | P1485: BYE | Q1485: FRITH | S1485: McCORKELL | V1485: TURNER
A1486: FRANKSTON | C1486: SAUTNER 6 | F1486: GEORGIOU | I1486: POLLARD | K1486: WINTERTON
A1488: FINALS
A1489: 1ST ELIMINATION | F1489: 31ST AUGUST | J1489: WEATHER
D1490: 1ST QTR | H1490: 2ND QTR | L1490: 3RD QTR | P1490: FINAL | S1490: Venue: BOX HILL
A1491: SANDRINGHAM | C1491: 3 | D1491: 1 | E1491: =(C1491*6)+D1491 -> 19 | G1491: 3 | H1491: 3 | I1491: =(G1491*6)+H1491 -> 21 | K1491: 4 | L1491: 8 | M1491: =(K1491*6)+L1491 -> 32 | O1491: 8 | P1491: 15 | Q1491: =(O1491*6)+P1491 -> 63 | S1491: UMPIRES
A1492: BOX HILL | C1492: 3 | D1492: 1 | E1492: =(C1492*6)+D1492 -> 19 | G1492: 4 | H1492: 5 | I1492: =(G1492*6)+H1492 -> 29 | K1492: 7 | L1492: 5 | M1492: =(K1492*6)+L1492 -> 47 | O1492: 9 | P1492: 7 | Q1492: =(O1492*6)+P1492 -> 61
A1493: BEST PLAYERS
A1494: SANDRINGHAM | C1494: LYNCH | F1494: MILLER | I1494: RADFORD | L1494: KANE | N1494: ROBBINS | Q1494: LIDDELL
A1495: BOX HILL | C1495: JOHNSON | F1495: FIRRITO | I1495: GEORGIADIS | L1495: NEAGLE | N1495: SMITH | Q1495: KANE
A1496: GOALKICKERS
A1497: SANDRINGHAM | C1497: TEMPLETON 2 | F1497: FUNCKE | H1497: HOWARTH | J1497: LIDDELL | L1497: McDONALD | O1497: ROBBINS | Q1497: ROGERS
A1498: BOX HILL | C1498: NICHOLS 3 | F1498: NEAGLE 2 | I1498: WILLIAMS 2 | L1498: PASSADOR | N1498: WITOWSKI
A1500: 2ND ELIMATION | F1500: 1ST SEPTEMBER | J1500: WEATHER
A1501: MURRAY KANGAROOS | C1501: 6 | D1501: 3 | E1501: =(C1501*6)+D1501 -> 39 | G1501: 9 | H1501: 6 | I1501: =(G1501*6)+H1501 -> 60 | K1501: 14 | L1501: 12 | M1501: =(K1501*6)+L1501 -> 96 | O1501: 18 | P1501: 18 | Q1501: =(O1501*6)+P1501 -> 126 | S1501: Venue: WILLIAMSTOWN
A1502: WILLIAMSTOWN | C1502: 8 | D1502: 3 | E1502: =(C1502*6)+D1502 -> 51 | G1502: 9 | H1502: 5 | I1502: =(G1502*6)+H1502 -> 59 | K1502: 10 | L1502: 8 | M1502: =(K1502*6)+L1502 -> 68 | O1502: 14 | P1502: 14 | Q1502: =(O1502*6)+P1502 -> 98
A1503: BEST PLAYERS
A1504: MURRAY KANGAROOS | C1504: COOPER | F1504: TREGENZA | I1504: LANGE | L1504: WATSON | N1504: PRATT | Q1504: McCORMICK
A1505: WILLIAMSTOWN | C1505: FLETCHER | F1505: LLOYD | I1505: KINNEAR | L1505: STEINFORT | N1505: CROW
A1506: GOALKICKERS
A1507: MURRAY KANGAROOS | C1507: TREGENZA 8 | F1507: LANGE 5 | I1507: CLAYTON 2 | L1507: BOURKE | N1507: S MOTLOP | Q1507: McLAREN
A1508: WILLIAMSTOWN | C1508: CUMMINGS 3 | F1508: KINNEAR 2 | I1508: PEARCE 2 | K1508: PODSIADLY 2 | N1508: SWAN 2 | P1508: ADKINS | R1508: DIMATTINA | U1508: STEINFORT
A1510: 1ST QUALIFYING | F1510: 31ST AUGUST | J1510: WEATHER
A1511: PORT MELBOURNE | C1511: 4 | D1511: 3 | E1511: =(C1511*6)+D1511 -> 27 | G1511: 10 | H1511: 6 | I1511: =(G1511*6)+H1511 -> 66 | K1511: 14 | L1511: 9 | M1511: =(K1511*6)+L1511 -> 93 | O1511: 18 | P1511: 9 | Q1511: =(O1511*6)+P1511 -> 117 | S1511: Venue: PORT MELBOURNE
A1512: GEELONG | C1512: 4 | D1512: 6 | E1512: =(C1512*6)+D1512 -> 30 | G1512: 9 | H1512: 7 | I1512: =(G1512*6)+H1512 -> 61 | K1512: 12 | L1512: 9 | M1512: =(K1512*6)+L1512 -> 81 | O1512: 16 | P1512: 14 | Q1512: =(O1512*6)+P1512 -> 110
A1513: BEST PLAYERS
A1514: PORT MELBOURNE | C1514: BUCHANAN | F1514: OBST | I1514: STEVENS | L1514: FILANDIA | N1514: RIX | P1514: McMAHON
A1515: GEELONG | C1515: BARTEL | F1515: McCARTHY | I1515: MENSCH | L1515: GRGIC | N1515: CHAMBERS
A1516: GOALKICKERS
A1517: PORT MELBOURNE | C1517: STEVENS 5 | F1517: ALOI 3 | H1517: BUCHANAN 3 | K1517: S ANSTEY | M1517: COTCHETT | O1517: EVANS | Q1517: FILANDIA | S1517: McMAHON | V1517: MOTT | X1517: PHIBBS
A1518: GEELONG | C1518: MENSCH 3 | F1518: ABLETT 2 | I1518: BLACKNEY 2 | L1518: BARTEL | N1518: CARRAZZO | Q1518: GARDINER | S1518: GRGIC | U1518: SHOLL | W1518: MERRIMAN | X1518: McGRATH | AA1518: O'BRIEN | AC1518: PLAYFAIR
A1520: 2ND QUALIFYING | F1520: 1ST SEPTEMBER | J1520: WEATHER
A1521: WERRIBEE | C1521: 3 | D1521: 4 | E1521: =(C1521*6)+D1521 -> 22 | G1521: 8 | H1521: 9 | I1521: =(G1521*6)+H1521 -> 57 | K1521: 10 | L1521: 11 | M1521: =(K1521*6)+L1521 -> 71 | O1521: 13 | P1521: 13 | Q1521: =(O1521*6)+P1521 -> 91 | S1521: Venue: PORT MELBOURNE
A1522: COBURG | C1522: 1 | D1522: 3 | E1522: =(C1522*6)+D1522 -> 9 | G1522: 4 | H1522: 3 | I1522: =(G1522*6)+H1522 -> 27 | K1522: 8 | L1522: 5 | M1522: =(K1522*6)+L1522 -> 53 | O1522: 14 | P1522: 6 | Q1522: =(O1522*6)+P1522 -> 90
A1523: BEST PLAYERS
A1524: WERRIBEE | C1524: BARTLETT | F1524: BIRSS | I1524: JACK | L1524: LAMB | N1524: HUNTER | Q1524: SETCHELL
A1525: COBURG | C1525: TALBOT | F1525: NEWMAN | I1525: CARLSON | L1525: KURET | N1525: HART | Q1525: TAYLOR
A1526: GOALKICKERS
A1527: WERRIBEE | C1527: JACK 3 | F1527: CHURCHILL 2 | I1527: SAUNDERS 2 | L1527: SKIPPER 2 | O1527: BIRSS | Q1527: BOYD | S1527: ROBERTSON | V1527: SMITH
A1528: COBURG | C1528: HUDSON 3 | F1528: McGRATH 3 | I1528: PETTIFER 3 | L1528: TAYLOR 2 | N1528: EDNIE | P1528: POYAS | R1528: RAYSON
A1530: 1ST SEMI | D1530: 8TH SEPTEMBER | J1530: WEATHER
A1531: GEELONG | C1531: 5 | D1531: 7 | E1531: =(C1531*6)+D1531 -> 37 | G1531: 7 | H1531: 9 | I1531: =(G1531*6)+H1531 -> 51 | K1531: 14 | L1531: 12 | M1531: =(K1531*6)+L1531 -> 96 | O1531: 18 | P1531: 15 | Q1531: =(O1531*6)+P1531 -> 123 | S1531: Venue: PORT MELBOURNE
A1532: SANDRINGHAM | C1532: 1 | D1532: 0 | E1532: =(C1532*6)+D1532 -> 6 | G1532: 3 | H1532: 1 | I1532: =(G1532*6)+H1532 -> 19 | K1532: 3 | L1532: 3 | M1532: =(K1532*6)+L1532 -> 21 | O1532: 4 | P1532: 9 | Q1532: =(O1532*6)+P1532 -> 33
A1533: BEST PLAYERS
A1534: GEELONG | C1534: CHAPMAN | F1534: HUNT | I1534: S JOHNSON | L1534: RAHILLY | N1534: STREET | Q1534: BARTEL
A1535: SANDRINGHAM | C1535: A McDONALD | F1535: MILLER | I1535: CLARK | L1535: LYNCH | N1535: RADFORD
A1536: GOALKICKERS
A1537: GEELONG | C1537: O'BRIEN 4 | F1537: McCARTHY 2 | I1537: MENSCH 2 | L1537: BARTEL | N1537: CHAMBERS | Q1537: CHAPMAN | S1537: GARDINER | V1537: GRGIC | X1537: S JOHNSON | AA1537: KELLY | AC1537: PLAYFAIR | AE1537: STREET | AF1537: WHITE
A1538: SANDRINGHAM | C1538: ROGERS 3 | F1538: BREESE
A1540: 2ND SEMI | D1540: 7TH SEPTEMBER | J1540: WEATHER
A1541: COBURG | C1541: 4 | D1541: 3 | E1541: =(C1541*6)+D1541 -> 27 | G1541: 8 | H1541: 8 | I1541: =(G1541*6)+H1541 -> 56 | K1541: 13 | L1541: 11 | M1541: =(K1541*6)+L1541 -> 89 | O1541: 14 | P1541: 15 | Q1541: =(O1541*6)+P1541 -> 99 | S1541: Venue: PORT MELBOURNE
A1542: MURRAY KANGAROOS | C1542: 2 | D1542: 3 | E1542: =(C1542*6)+D1542 -> 15 | G1542: 5 | H1542: 5 | I1542: =(G1542*6)+H1542 -> 35 | K1542: 10 | L1542: 5 | M1542: =(K1542*6)+L1542 -> 65 | O1542: 11 | P1542: 8 | Q1542: =(O1542*6)+P1542 -> 74
A1543: BEST PLAYERS
A1544: COBURG | C1544: HOULIHAN | F1544: SZILLER | I1544: McGRATH | L1544: STEINFORT | P1544: BIDDISCOMBE | T1544: EDNIE
A1545: MURRAY KANGAROOS | C1545: PRATT | F1545: McCARTHY | I1545: WATTS | L1545: D MOTLOP | P1545: CLAYTON | T1545: SMITH
A1546: GOALKICKERS
A1547: COBURG | C1547: McGRATH 3 | F1547: HUDSON 3 | I1547: MILLS 2 | K1547: EDNIE | M1547: POYAS | O1547: STEINFORT | R1547: SZILLER | U1547: PETTIFER | X1547: WATSON
A1548: MURRAY KANGAROOS | C1548: CLAYTON 3 | F1548: D MOTLOP 3 | I1548: STEVENS | L1548: HARRIS | N1548: LOWCOCK | Q1548: BURKE | S1548: TREGENZA
A1550: 1ST PRELIMINARY | G1550: 14TH SEPTEMBER | L1550: WEATHER
A1551: GEELONG | C1551: 0 | D1551: 4 | E1551: =(C1551*6)+D1551 -> 4 | G1551: 4 | H1551: 13 | I1551: =(G1551*6)+H1551 -> 37 | K1551: 9 | L1551: 17 | M1551: =(K1551*6)+L1551 -> 71 | O1551: 12 | P1551: 20 | Q1551: =(O1551*6)+P1551 -> 92 | S1551: Venue: PORT MELBOURNE
A1552: WERRIBEE | C1552: 2 | D1552: 6 | E1552: =(C1552*6)+D1552 -> 18 | G1552: 3 | H1552: 7 | I1552: =(G1552*6)+H1552 -> 25 | K1552: 6 | L1552: 8 | M1552: =(K1552*6)+L1552 -> 44 | O1552: 9 | P1552: 11 | Q1552: =(O1552*6)+P1552 -> 65
A1553: BEST PLAYERS
A1554: GEELONG | C1554: RAHILLY | F1554: MENSCH | I1554: SLADE | L1554: D JOHNSON | O1554: CHAPMAN | R1554: STREET
A1555: WERRIBEE | C1555: HAHN | F1555: ROBBINS | I1555: BARTLETT | L1555: CROSS | O1555: DYER | R1555: EAGLETON
A1556: GOALKICKERS
A1557: GEELONG | C1557: O'BRIEN 2 | F1557: BARTEL 2 | I1557: S JOHNSON 2 | L1557: CHAPMAN | N1557: FOSTER | P1557: D JOHNSON | S1557: WHITE | U1557: HUNT | W1557: McCARTHY
A1558: WERRIBEE | C1558: ROBBINS 2 | F1558: CHURCHILL | I1558: WIGGINS | L1558: ROBERTSON | O1558: MITCHELL | R1558: JACK | T1558: EAGLETON | W1558: POWER
A1560: 2ND PRELIMINARY | G1560: 15TH SEPTEMBER | L1560: WEATHER
A1561: PORT MELBOURNE | C1561: 7 | D1561: 0 | E1561: =(C1561*6)+D1561 -> 42 | G1561: 9 | H1561: 3 | I1561: =(G1561*6)+H1561 -> 57 | K1561: 10 | L1561: 8 | M1561: =(K1561*6)+L1561 -> 68 | O1561: 13 | P1561: 10 | Q1561: =(O1561*6)+P1561 -> 88 | S1561: Venue: PORT MELBOURNE
A1562: COBURG | C1562: 3 | D1562: 1 | E1562: =(C1562*6)+D1562 -> 19 | G1562: 5 | H1562: 4 | I1562: =(G1562*6)+H1562 -> 34 | K1562: 7 | L1562: 8 | M1562: =(K1562*6)+L1562 -> 50 | O1562: 12 | P1562: 13 | Q1562: =(O1562*6)+P1562 -> 85
A1563: BEST PLAYERS
A1564: PORT MELBOURNE | C1564: BENNETT | F1564: ROSE | I1564: McPHERSON | L1564: BROCKMAN | O1564: OBST | R1564: McMAHON
A1565: COBURG | C1565: TALBOT | F1565: HYDE | I1565: BIDDISCOMBE | L1565: TAYLOR | O1565: SZILLER | R1565: POYAS
A1566: GOALKICKERS
A1567: PORT MELBOURNE | C1567: McMAHON 2 | F1567: STEVENS 2 | I1567: McPHERSON 2 | L1567: ALOI 2 | N1567: S ANSTEY | Q1567: BUCHANAN | T1567: O'KEEFE | W1567: EVANS | X1567: ROSE
A1568: COBURG | C1568: PETTIFER 3 | F1568: HUDSON 2 | I1568: HOULIHAN 2 | L1568: MILLS | N1568: McGRATH | Q1568: SZILLER | S1568: TAYLOR | V1568: BIDDISCOMBE
A1570: GRAND | D1570: 22ND SEPTEMBER | J1570: WEATHER
A1571: GEELONG | C1571: 3 | D1571: 2 | E1571: =(C1571*6)+D1571 -> 20 | G1571: 7 | H1571: 6 | I1571: =(G1571*6)+H1571 -> 48 | K1571: 9 | L1571: 12 | M1571: =(K1571*6)+L1571 -> 66 | O1571: 15 | P1571: 15 | Q1571: =(O1571*6)+P1571 -> 105 | S1571: Venue: OPTUS OVAL
A1572: PORT MELBOURNE | C1572: 2 | D1572: 3 | E1572: =(C1572*6)+D1572 -> 15 | G1572: 7 | H1572: 5 | I1572: =(G1572*6)+H1572 -> 47 | K1572: 12 | L1572: 8 | M1572: =(K1572*6)+L1572 -> 80 | O1572: 12 | P1572: 11 | Q1572: =(O1572*6)+P1572 -> 83
A1573: BEST PLAYERS
A1574: GEELONG | C1574: RAHILLY | F1574: SLADE | I1574: MENSCH | L1574: BARTEL | N1574: CHAPMAN | Q1574: McGRATH
A1575: PORT MELBOURNE | C1575: BROCKMAN | F1575: OBST | I1575: ROSE | L1575: O'LOUGHLIN | N1575: McMAHON | Q1575: O'KEEFE
A1576: GOALKICKERS
A1577: GEELONG | C1577: MENSCH 3 | F1577: S JOHNSON 2 | I1577: ABLETT | K1577: CHAPMAN | M1577: CHATFIELD | P1577: GARDINER | R1577: HUNT | T1577: McCARTHY | W1577: McGRATH | X1577: O'BRIEN | Z1577: SLADE | AB1577: WHITE
A1578: PORT MELBOURNE | C1578: STEVENS 2 | F1578: GILL 2 | I1578: EVANS | K1578: L ABLETT | M1578: O'KEEFE | O1578: RIX | P1578: BUCHANAN | R1578: SCHNEIDER | U1578: ROBERTSON | X1578: PHIBBS