A1: Victorian Football League
A2: Season 2003
A3: © Copyright Wal Williams | F3: First created: 10 September 2016
A4: Contact: joywalwi at gmail dot com | F4: Last updated: 10 September 2016 | W4: VFA Results and tables - Link to the main index page
A5: You are free to copy this document in whole or part provided that proper acknowledgement is given to the author. All rights reserved.
A7: 2003 SEASON
A8: ROUND 1 | D8: 5TH APRIL | G8: NIGHT MATCH | J8: WEATHER
D9: 1ST QTR | H9: 2ND QTR | L9: 3RD QTR | P9: FINAL | S9: Venue: COBURG
A10: WERRIBEE | C10: 6 | D10: 5 | E10: =(C10*6)+D10 -> 41 | G10: 10 | H10: 9 | I10: =(G10*6)+H10 -> 69 | K10: 16 | L10: 11 | M10: =(K10*6)+L10 -> 107 | O10: 20 | P10: 12 | Q10: =(O10*6)+P10 -> 132 | S10: UMPIRES | Z10: LADDER | AC10: ROUND | AE10: 1
A11: COBURG | C11: 2 | D11: 3 | E11: =(C11*6)+D11 -> 15 | G11: 8 | H11: 7 | I11: =(G11*6)+H11 -> 55 | K11: 10 | L11: 12 | M11: =(K11*6)+L11 -> 72 | O11: 14 | P11: 16 | Q11: =(O11*6)+P11 -> 100
A12: BEST PLAYERS | W12: TEAM | X12: B | Y12: W | Z12: L | AA12: D | AB12: FOR | AC12: AGST | AD12: % | AE12: PTS
A13: WERRIBEE | C13: SETCHELL | F13: SKIPPER | I13: JACK | L13: CROSS | O13: BOYD | Q13: BRUTON
A14: COBURG | C14: KRAKOUER | F14: GEISCHEN | I14: STEINFORT | L14: McGRATH | O14: MILLS | Q14: VARDY | W14: PORT MELBOURNE | Y14: 1 | Z14: 0 | AA14: 0 | AB14: 116 | AC14: 45 | AD14: =(AB14/AC14)*100 -> 257.77777777777777 | AE14: =(Y14*4)+(AA14*2) -> 4
A15: GOALKICKERS | P15: SKIPPER | W15: WILLIAMSTOWN | Y15: 1 | Z15: 0 | AA15: 0 | AB15: 140 | AC15: 79 | AD15: =(AB15/AC15)*100 -> 177.2151898734177 | AE15: =(Y15*4)+(AA15*2) -> 4
A16: WERRIBEE | C16: MITCHELL 6 | F16: FAULKNER 3 | I16: JACK 3 | K16: TURNER 2 | M16: CROSS 2 | O16: WALSH | Q16: MURPHY | S16: RAU | W16: FRANKSTON | Y16: 1 | Z16: 0 | AA16: 0 | AB16: 110 | AC16: 79 | AD16: =(AB16/AC16)*100 -> 139.24050632911394 | AE16: =(Y16*4)+(AA16*2) -> 4
A17: COBURG | C17: NICHOLLS 3 | F17: FLEMING 2 | I17: MILLS 2 | K17: McGRATH 2 | N17: HYDE | P17: FLAHERTY | R17: TALBOT | W17: WERRIBEE | Y17: 1 | Z17: 0 | AA17: 0 | AB17: 132 | AC17: 100 | AD17: =(AB17/AC17)*100 -> 132 | AE17: =(Y17*4)+(AA17*2) -> 4
M18: RODE | O18: SIR | W18: SPRINGVALE | Y18: 1 | Z18: 0 | AA18: 0 | AB18: 119 | AC18: 94 | AD18: =(AB18/AC18)*100 -> 126.59574468085107 | AE18: =(Y18*4)+(AA18*2) -> 4
A19: SPRINGVALE | C19: 5 | D19: 4 | E19: =(C19*6)+D19 -> 34 | G19: 9 | H19: 5 | I19: =(G19*6)+H19 -> 59 | K19: 13 | L19: 7 | M19: =(K19*6)+L19 -> 85 | O19: 18 | P19: 11 | Q19: =(O19*6)+P19 -> 119 | S19: Venue: NORTH HOBART OVAL | W19: BENDIGO | Y19: 1 | Z19: 0 | AA19: 0 | AB19: 108 | AC19: 105 | AD19: =(AB19/AC19)*100 -> 102.85714285714285 | AE19: =(Y19*4)+(AA19*2) -> 4
A20: TASMANIA | C20: 2 | D20: 3 | E20: =(C20*6)+D20 -> 15 | G20: 5 | H20: 5 | I20: =(G20*6)+H20 -> 35 | K20: 12 | L20: 6 | M20: =(K20*6)+L20 -> 78 | O20: 14 | P20: 10 | Q20: =(O20*6)+P20 -> 94 | W20: NORTH BALLARAT | X20: 1 | Y20: 0 | Z20: 0 | AA20: 0 | AB20: 0 | AC20: 0 | AE20: =(Y20*4)+(AA20*2) -> 0
A21: BEST PLAYERS | W21: SANDRINGHAM | Y21: 0 | Z21: 1 | AA21: 0 | AB21: 105 | AC21: 108 | AD21: =(AB21/AC21)*100 -> 97.222222222222214 | AE21: =(Y21*4)+(AA21*2) -> 0
A22: SPRINGVALE | C22: PECKETT | F22: VOSS | I22: LAWRENCE | L22: CARROLL | O22: CARMODY | R22: KNOBEL
A23: TASMANIA | C23: B GEAPPEN | F23: RONALDSON | I23: THURLEY | L23: SAVAGE | O23: STEPHENS | R23: JENKINS | W23: TASMANIA | Y23: 0 | Z23: 1 | AA23: 0 | AB23: 94 | AC23: 119 | AD23: =(AB23/AC23)*100 -> 78.991596638655466 | AE23: =(Y23*4)+(AA23*2) -> 0
A24: GOALKICKERS | J24: DAL SANTO | L24: THOMAS | N24: HOULIHAN | Q24: FERGUSON | W24: COBURG | Y24: 0 | Z24: 1 | AA24: 0 | AB24: 100 | AC24: 132 | AD24: =(AB24/AC24)*100 -> 75.757575757575751 | AE24: =(Y24*4)+(AA24*2) -> 0
A25: SPRINGVALE | C25: LAWRENCE 4 | F25: KNOBEL 2 | I25: PITT 2 | K25: MURRAY 2 | M25: HARRISON 2 | P25: CARMODY | R25: VOSS | W25: BOX HILL | Y25: 0 | Z25: 1 | AA25: 0 | AB25: 79 | AC25: 110 | AD25: =(AB25/AC25)*100 -> 71.818181818181813 | AE25: =(Y25*4)+(AA25*2) -> 0
A26: TASMANIA | C26: THURLEY 4 | F26: CALLINAN 3 | I26: B GEAPPEN 2 | L26: STEPHENS 2 | N26: HEATLEY | P26: WILLIAMS | R26: BEAMS | W26: NORTHERN BULLANTS | Y26: 0 | Z26: 1 | AA26: 0 | AB26: 79 | AC26: 140 | AD26: =(AB26/AC26)*100 -> 56.428571428571431 | AE26: =(Y26*4)+(AA26*2) -> 0
D27: 6TH APRIL | J27: WEATHER | W27: GEELONG | Y27: 0 | Z27: 1 | AA27: 0 | AB27: 45 | AC27: 116 | AD27: =(AB27/AC27)*100 -> 38.793103448275865 | AE27: =(Y27*4)+(AA27*2) -> 0
A28: WILLIAMSTOWN | C28: 3 | D28: 3 | E28: =(C28*6)+D28 -> 21 | G28: 9 | H28: 7 | I28: =(G28*6)+H28 -> 61 | K28: 15 | L28: 12 | M28: =(K28*6)+L28 -> 102 | O28: 21 | P28: 14 | Q28: =(O28*6)+P28 -> 140 | S28: Venue: PRESTON
A29: NORTHERN BULLANTS | C29: 4 | D29: 3 | E29: =(C29*6)+D29 -> 27 | G29: 5 | H29: 5 | I29: =(G29*6)+H29 -> 35 | K29: 9 | L29: 5 | M29: =(K29*6)+L29 -> 59 | O29: 12 | P29: 7 | Q29: =(O29*6)+P29 -> 79
A30: BEST PLAYERS
A31: WILLIAMSTOWN | C31: LLOYD | F31: SCOTLAND | I31: MAHONEY | L31: CLOKE | N31: CRANAGE | Q31: SWAN
A32: NORTHERN BULLANTS | C32: DAVIES | F32: LIVINGSTONE | I32: FLETCHER | L32: McKENZIE | N32: WILLIAMS
A33: GOALKICKERS | P33: ANDERSON
A34: WILLIAMSTOWN | C34: MAHONEY 6 | F34: SCOTLAND 4 | I34: CRANAGE 4 | L34: BALDWIN 2 | O34: SWAN 2 | Q34: TAYLOR | S34: KINNEAR
A35: NORTHERN BULLANTS | C35: SAUTNER 4 | F35: MERRINGTON 2 | J35: GIBSON 2 | M35: PENN | N35: ALLAN | P35: PLUNKETT | R35: ECCLES
A37: FRANKSTON | C37: 0 | D37: 5 | E37: =(C37*6)+D37 -> 5 | G37: 4 | H37: 8 | I37: =(G37*6)+H37 -> 32 | K37: 10 | L37: 13 | M37: =(K37*6)+L37 -> 73 | O37: 16 | P37: 14 | Q37: =(O37*6)+P37 -> 110 | S37: Venue: FRANKSTON
A38: BOX HILL | C38: 4 | D38: 1 | E38: =(C38*6)+D38 -> 25 | G38: 7 | H38: 3 | I38: =(G38*6)+H38 -> 45 | K38: 8 | L38: 5 | M38: =(K38*6)+L38 -> 53 | O38: 12 | P38: 7 | Q38: =(O38*6)+P38 -> 79
A39: BEST PLAYERS
A40: FRANKSTON | C40: BEASY | F40: BLACK | I40: GEORGIOU | L40: FOLINO | O40: LYON | Q40: McCORMACK
A41: BOX HILL | C41: STONE | F41: CLARKE | I41: LARSON
A42: GOALKICKERS
A43: FRANKSTON | C43: BEASY 4 | E43: McCORMACK 3 | H43: LYON 2 | J43: D CLARKE 2 | M43: SHIPP | O43: HYNES | Q43: BLACK | S43: WINTERTON | W43: KEMPERMAN
A44: BOX HILL | C44: CLARKE 4 | F44: WILLIAMS 3 | I44: HARFORD 2 | L44: PUGSLEY | N44: KENNA | P44: JOHNSON
A46: BENDIGO | C46: 4 | D46: 0 | E46: =(C46*6)+D46 -> 24 | G46: 11 | H46: 4 | I46: =(G46*6)+H46 -> 70 | K46: 13 | L46: 5 | M46: =(K46*6)+L46 -> 83 | O46: 16 | P46: 12 | Q46: =(O46*6)+P46 -> 108 | S46: Venue: BEACH ROAD
A47: SANDRINGHAM | C47: 6 | D47: 6 | E47: =(C47*6)+D47 -> 42 | G47: 9 | H47: 9 | I47: =(G47*6)+H47 -> 63 | K47: 15 | L47: 12 | M47: =(K47*6)+L47 -> 102 | O47: 15 | P47: 15 | Q47: =(O47*6)+P47 -> 105
A48: BEST PLAYERS
A49: BENDIGO | C49: WELCH | F49: CAIL | I49: McGRATH | L49: HARVEY | N49: KEOWN | Q49: RICHARDS
A50: SANDRINGHAM | C50: RIVERS | F50: GALLAGHER | I50: RIGONI | L50: JAMAR | N50: WILSON | Q50: THOMPSON
A51: GOALKICKERS
A52: BENDIGO | C52: HARVEY 3 | E52: LAYCOCK 3 | H52: FORSTER-KINIGHT 2 | L52: CAIL 2 | N52: WUNDERLICH 2 | Q52: BROWN 2 | S52: CAMPBELL | W52: CARTER
A53: SANDRINGHAM | C53: POYAS 4 | E53: OAKLEY 3 | H53: WILSON 2 | J53: ROGERS 2 | M53: RIGONI | O53: GALLAGHER | R53: THOMPSON | V53: SMITH
A55: PORT MELBOURNE | C55: 6 | D55: 2 | E55: =(C55*6)+D55 -> 38 | G55: 10 | H55: 11 | I55: =(G55*6)+H55 -> 71 | K55: 11 | L55: 17 | M55: =(K55*6)+L55 -> 83 | O55: 16 | P55: 20 | Q55: =(O55*6)+P55 -> 116 | S55: Venue: SKILLED STAD (C/R)
A56: GEELONG | C56: 2 | D56: 3 | E56: =(C56*6)+D56 -> 15 | G56: 3 | H56: 4 | I56: =(G56*6)+H56 -> 22 | K56: 6 | L56: 6 | M56: =(K56*6)+L56 -> 42 | O56: 6 | P56: 9 | Q56: =(O56*6)+P56 -> 45
A57: BEST PLAYERS
A58: PORT MELBOURNE | C58: CLAYTON | F58: McMAHON | I58: TEAGUE | L58: ROSE | N58: BOURKE | Q58: OBST
A59: GEELONG | C59: SLADE | F59: FOSTER | I59: BARTEL | L59: WOJCINSKI | N59: WOOLNOUGH | Q59: HUNT
A60: GOALKICKERS
A61: PORT MELBOURNE | C61: ALLEWAY 3 | F61: CLAYTON 3 | I61: BOURKE 3 | K61: WATSON 2 | N61: JONES 2 | P61: McMAHON | R61: FIRRITO | U61: MOTLOP
A62: GEELONG | C62: BLACKNEY 2 | F62: McCARTHY | I62: SMITH | K62: STREET | M62: BRIGHT
A64: BYE | D64: NORTH BALLARAT
A66: ROUND 2 | D66: 12TH APRIL | J66: WEATHER
D67: 1ST QTR | H67: 2ND QTR | L67: 3RD QTR | P67: FINAL | S67: Venue: WERRIBEE
A68: SANDRINGHAM | C68: 1 | D68: 1 | E68: =(C68*6)+D68 -> 7 | G68: 3 | H68: 5 | I68: =(G68*6)+H68 -> 23 | K68: 9 | L68: 8 | M68: =(K68*6)+L68 -> 62 | O68: 14 | P68: 16 | Q68: =(O68*6)+P68 -> 100 | S68: UMPIRES | Z68: LADDER | AC68: ROUND | AE68: 2
A69: WERRIBEE | C69: 2 | D69: 4 | E69: =(C69*6)+D69 -> 16 | G69: 4 | H69: 9 | I69: =(G69*6)+H69 -> 33 | K69: 6 | L69: 10 | M69: =(K69*6)+L69 -> 46 | O69: 8 | P69: 12 | Q69: =(O69*6)+P69 -> 60
A70: BEST PLAYERS | W70: TEAM | X70: B | Y70: W | Z70: L | AA70: D | AB70: FOR | AC70: AGST | AD70: % | AE70: PTS
A71: SANDRINGHAM | C71: MOORCROFT | F71: ROBBINS | I71: VARDY | K71: JAMAR | N71: WILSON | Q71: RIVERS
A72: WERRIBEE | C72: McGUINNESS | F72: ROBERTSON | I72: JACK | K72: COLBERT | N72: BOYD | Q72: CROSS | W72: PORT MELBOURNE | Y72: 2 | Z72: 0 | AA72: 0 | AB72: 236 | AC72: 81 | AD72: =(AB72/AC72)*100 -> 291.35802469135803 | AE72: =(Y72*4)+(AA72*2) -> 8
A73: GOALKICKERS | W73: SPRINGVALE | Y73: 2 | Z73: 0 | AA73: 0 | AB73: 180 | AC73: 129 | AD73: =(AB73/AC73)*100 -> 139.53488372093022 | AE73: =(Y73*4)+(AA73*2) -> 8
A74: SANDRINGHAM | C74: VARDY 4 | E74: GALLAGHER 2 | H74: MOLAN 2 | J74: MOORCROFT 2 | M74: FISHER | O74: LIDDELL | Q74: POYAS | S74: ROBBINS | W74: WILLIAMSTOWN | X74: 1 | Y74: 1 | Z74: 0 | AA74: 0 | AB74: 140 | AC74: 79 | AD74: =(AB74/AC74)*100 -> 177.2151898734177 | AE74: =(Y74*4)+(AA74*2) -> 4
A75: WERRIBEE | C75: MITCHELL 2 | F75: WALSH 2 | I75: CROSS | K75: JACK | M75: PODSIADLY | P75: SMITH | W75: SANDRINGHAM | Y75: 1 | Z75: 1 | AA75: 0 | AB75: 205 | AC75: 168 | AD75: =(AB75/AC75)*100 -> 122.02380952380953 | AE75: =(Y75*4)+(AA75*2) -> 4
D76: 13TH APRIL | J76: WEATHER | W76: TASMANIA | Y76: 1 | Z76: 1 | AA76: 0 | AB76: 173 | AC76: 164 | AD76: =(AB76/AC76)*100 -> 105.48780487804879 | AE76: =(Y76*4)+(AA76*2) -> 4
A77: TASMANIA | C77: 3 | D77: 1 | E77: =(C77*6)+D77 -> 19 | G77: 5 | H77: 6 | I77: =(G77*6)+H77 -> 36 | K77: 9 | L77: 7 | M77: =(K77*6)+L77 -> 61 | O77: 12 | P77: 7 | Q77: =(O77*6)+P77 -> 79 | S77: Venue: ULVERSTONE | W77: FRANKSTON | Y77: 1 | Z77: 1 | AA77: 0 | AB77: 155 | AC77: 158 | AD77: =(AB77/AC77)*100 -> 98.101265822784811 | AE77: =(Y77*4)+(AA77*2) -> 4
A78: FRANKSTON | C78: 3 | D78: 3 | E78: =(C78*6)+D78 -> 21 | G78: 4 | H78: 6 | I78: =(G78*6)+H78 -> 30 | K78: 6 | L78: 7 | M78: =(K78*6)+L78 -> 43 | O78: 6 | P78: 9 | Q78: =(O78*6)+P78 -> 45 | W78: BENDIGO | Y78: 1 | Z78: 1 | AA78: 0 | AB78: 185 | AC78: 191 | AD78: =(AB78/AC78)*100 -> 96.858638743455501 | AE78: =(Y78*4)+(AA78*2) -> 4
A79: BEST PLAYERS | W79: WERRIBEE | Y79: 1 | Z79: 1 | AA79: 0 | AB79: 192 | AC79: 200 | AD79: =(AB79/AC79)*100 -> 96 | AE79: =(Y79*4)+(AA79*2) -> 4
A80: TASMANIA | C80: BARTLETT | F80: CRIPPS | I80: HOWARD | K80: ATKIN | N80: STEPHENS | Q80: DOERING
A81: FRANKSTON | C81: ROBERTS | F81: CLARKE | I81: GODDARD | K81: McCORMACK | N81: ABLETT | Q81: WINTERTON | W81: BOX HILL | Y81: 1 | Z81: 1 | AA81: 0 | AB81: 151 | AC81: 178 | AD81: =(AB81/AC81)*100 -> 84.831460674157299 | AE81: =(Y81*4)+(AA81*2) -> 4
A82: GOALKICKERS | W82: GEELONG | Y82: 1 | Z82: 1 | AA82: 0 | AB82: 131 | AC82: 193 | AD82: =(AB82/AC82)*100 -> 67.875647668393782 | AE82: =(Y82*4)+(AA82*2) -> 4
A83: TASMANIA | C83: BARTLETT 4 | F83: HEATLEY 3 | I83: CALLINAN 2 | L83: BEAMS | N83: BLIGHT | P83: MACMICHAEL | W83: NORTHERN BULLANTS | Y83: 0 | Z83: 2 | AA83: 0 | AB83: 147 | AC83: 212 | AD83: =(AB83/AC83)*100 -> 69.339622641509436 | AE83: =(Y83*4)+(AA83*2) -> 0
A84: FRANKSTON | C84: FERRARO 2 | F84: HYNES | H84: KEMPERMAN | K84: McCORMACK | N84: WINTERTON | W84: NORTH BALLARAT | X84: 1 | Y84: 0 | Z84: 1 | AA84: 0 | AB84: 35 | AC84: 61 | AD84: =(AB84/AC84)*100 -> 57.377049180327866 | AE84: =(Y84*4)+(AA84*2) -> 0
W85: COBURG | Y85: 0 | Z85: 2 | AA85: 0 | AB85: 136 | AC85: 252 | AD85: =(AB85/AC85)*100 -> 53.968253968253968 | AE85: =(Y85*4)+(AA85*2) -> 0
A86: BOX HILL | C86: 5 | D86: 4 | E86: =(C86*6)+D86 -> 34 | G86: 6 | H86: 9 | I86: =(G86*6)+H86 -> 45 | K86: 8 | L86: 10 | M86: =(K86*6)+L86 -> 58 | O86: 10 | P86: 12 | Q86: =(O86*6)+P86 -> 72 | S86: Venue: BOX HILL
A87: NORTHERN BULLANTS | C87: 2 | D87: 1 | E87: =(C87*6)+D87 -> 13 | G87: 6 | H87: 4 | I87: =(G87*6)+H87 -> 40 | K87: 9 | L87: 6 | M87: =(K87*6)+L87 -> 60 | O87: 10 | P87: 8 | Q87: =(O87*6)+P87 -> 68
A88: BEST PLAYERS
A89: BOX HILL | C89: CLARKE | F89: SCOTT | I89: CAMPBELL | L89: STONE | N89: JOHNSON | Q89: GEORGIADIS
A90: NORTHERN BULLANTS | C90: RASO | F90: WATSON | I90: BEASY
A91: GOALKICKERS
A92: BOX HILL | C92: HAZELL 2 | E92: LADSON 2 | H92: ANDERSON | J92: CLARKE | L92: GEORGIADIS | O92: KENNA | Q92: PUGSLEY | S92: WILLIAMS
A93: NORTHERN BULLANTS | C93: SAUTNER 4 | F93: BEASY 2 | I93: WATSON 2 | L93: CAMPBELL | N93: SIMPSON
A95: SPRINGVALE | C95: 1 | D95: 5 | E95: =(C95*6)+D95 -> 11 | G95: 3 | H95: 8 | I95: =(G95*6)+H95 -> 26 | K95: 5 | L95: 11 | M95: =(K95*6)+L95 -> 41 | O95: 8 | P95: 13 | Q95: =(O95*6)+P95 -> 61 | S95: Venue: NORTH BALLARAT
A96: NORTH BALLARAT | C96: 3 | D96: 0 | E96: =(C96*6)+D96 -> 18 | G96: 4 | H96: 3 | I96: =(G96*6)+H96 -> 27 | K96: 5 | L96: 4 | M96: =(K96*6)+L96 -> 34 | O96: 5 | P96: 5 | Q96: =(O96*6)+P96 -> 35
A97: BEST PLAYERS
A98: SPRINGVALE | C98: McGUIRE | F98: LAWRENCE | I98: CARROLL | L98: HOULIHAN | N98: CAPLES | Q98: CARMODY
A99: NORTH BALLARAT | C99: EWART | F99: PERKINS | I99: WINTER | L99: SPOLDING | N99: GREIG
A100: GOALKICKERS
A101: SPRINGVALE | C101: DEHEY 2 | F101: LAWRENCE 2 | I101: BROOKS | K101: HOULIHAN | N101: OLIVER | P101: PITT
A102: NORTH BALLARAT | C102: EDWARDS | F102: GREIG | H102: McCORKELL | K102: MILLER | M102: SPOLDING
A104: GEELONG | C104: 2 | D104: 5 | E104: =(C104*6)+D104 -> 17 | G104: 5 | H104: 8 | I104: =(G104*6)+H104 -> 38 | K104: 10 | L104: 11 | M104: =(K104*6)+L104 -> 71 | O104: 12 | P104: 14 | Q104: =(O104*6)+P104 -> 86 | S104: Venue: BENDIGO
A105: BENDIGO | C105: 2 | D105: 0 | E105: =(C105*6)+D105 -> 12 | G105: 5 | H105: 6 | I105: =(G105*6)+H105 -> 36 | K105: 9 | L105: 8 | M105: =(K105*6)+L105 -> 62 | O105: 11 | P105: 11 | Q105: =(O105*6)+P105 -> 77
A106: BEST PLAYERS
A107: GEELONG | C107: BARTEL | F107: SLADE | I107: CLARKE | L107: HUNT | N107: FINNIN | Q107: FOSTER
A108: BENDIGO | C108: BANNISTER | F108: RICHARDS | I108: McGRATH | L108: CAIL | N108: HARVEY
A109: GOALKICKERS
A110: GEELONG | C110: McCARTHY 3 | F110: BRIGHT 2 | I110: BYRNES | K110: CHAMBERS | N110: CLARKE | P110: FOSTER | R110: LONERGAN | V110: LORD | X110: STREET
A111: BENDIGO | C111: HARVEY 4 | F111: CAIL 3 | I111: BULLEN | K111: HAWKINS | M111: LAYCOCK | O111: McGRATH
A113: PORT MELBOURNE | C113: 4 | D113: 4 | E113: =(C113*6)+D113 -> 28 | G113: 8 | H113: 6 | I113: =(G113*6)+H113 -> 54 | K113: 11 | L113: 8 | M113: =(K113*6)+L113 -> 74 | O113: 18 | P113: 12 | Q113: =(O113*6)+P113 -> 120 | S113: Venue: PORT MELBOURNE
A114: COBURG | C114: 2 | D114: 2 | E114: =(C114*6)+D114 -> 14 | G114: 3 | H114: 7 | I114: =(G114*6)+H114 -> 25 | K114: 4 | L114: 11 | M114: =(K114*6)+L114 -> 35 | O114: 4 | P114: 12 | Q114: =(O114*6)+P114 -> 36
A115: BEST PLAYERS
A116: PORT MELBOURNE | C116: JONES | F116: OBST | I116: WATSON | L116: McCARTNEY | O116: ROSE | Q116: MILE
A117: COBURG | C117: CARLSON | F117: HYDE | I117: MILLS
A118: GOALKICKERS
A119: PORT MELBOURNE | C119: COTCHETT 4 | F119: JONES 4 | H119: ALEXANDER 2 | K119: GRIMA 2 | M119: ALLEWAY | O119: ANSTEY | Q119: BOURKE | S119: CLAYTON | V119: GILL | X119: WATSON
A120: COBURG | C120: GIESCHEN | F120: KRAKOUER | I120: MILLS | K120: PICKERING
A122: BYE | D122: WILLIAMSTOWN
A124: ROUND 3 | D124: 19TH APRIL | J124: WEATHER
D125: 1ST QTR | H125: 2ND QTR | L125: 3RD QTR | P125: FINAL | S125: Venue: BOX HILL
A126: BOX HILL | C126: 5 | D126: 3 | E126: =(C126*6)+D126 -> 33 | G126: 8 | H126: 4 | I126: =(G126*6)+H126 -> 52 | K126: 10 | L126: 6 | M126: =(K126*6)+L126 -> 66 | O126: 14 | P126: 10 | Q126: =(O126*6)+P126 -> 94 | S126: UMPIRES | Z126: LADDER | AC126: ROUND | AE126: 3
A127: TASMANIA | C127: 2 | D127: 1 | E127: =(C127*6)+D127 -> 13 | G127: 7 | H127: 3 | I127: =(G127*6)+H127 -> 45 | K127: 9 | L127: 5 | M127: =(K127*6)+L127 -> 59 | O127: 11 | P127: 9 | Q127: =(O127*6)+P127 -> 75
A128: BEST PLAYERS | W128: TEAM | X128: B | Y128: W | Z128: L | AA128: D | AB128: FOR | AC128: AGST | AD128: % | AE128: PTS
A129: BOX HILL | C129: COX | F129: ELSTONE | I129: McCABE | L129: SCOTT | O129: CAMPBELL | R129: THOMPSON
A130: TASMANIA | C130: BLIGHT | F130: M GEAPPEN | I130: B GEAPPEN | L130: HEATLEY | O130: STEPHENS | R130: JENKINS | W130: PORT MELBOURNE | Y130: 3 | Z130: 0 | AA130: 0 | AB130: 319 | AC130: 155 | AD130: =(AB130/AC130)*100 -> 205.80645161290323 | AE130: =(Y130*4)+(AA130*2) -> 12
A131: GOALKICKERS | P131: JOHNSON | R131: LADSON | W131: SPRINGVALE | X131: 1 | Y131: 2 | Z131: 0 | AA131: 0 | AB131: 180 | AC131: 129 | AD131: =(AB131/AC131)*100 -> 139.53488372093022 | AE131: =(Y131*4)+(AA131*2) -> 8
A132: BOX HILL | C132: THOMPSON 4 | F132: GREENE 3 | I132: BALL | J132: BAYFORD | L132: BOYLE | N132: COX | P132: GEORGIADIS | W132: SANDRINGHAM | Y132: 2 | Z132: 1 | AA132: 0 | AB132: 347 | AC132: 251 | AD132: =(AB132/AC132)*100 -> 138.24701195219126 | AE132: =(Y132*4)+(AA132*2) -> 8
A133: TASMANIA | C133: HEATLEY 2 | F133: BARTLETT 2 | I133: BEAMS 2 | K133: CANN | M133: CALLINAN | O133: M GEAPPEN | R133: THURLEY | W133: FRANKSTON | Y133: 2 | Z133: 1 | AA133: 0 | AB133: 287 | AC133: 224 | AD133: =(AB133/AC133)*100 -> 128.125 | AE133: =(Y133*4)+(AA133*2) -> 8
Q134: PEARS | W134: WERRIBEE | Y134: 2 | Z134: 1 | AA134: 0 | AB134: 348 | AC134: 301 | AD134: =(AB134/AC134)*100 -> 115.61461794019934 | AE134: =(Y134*4)+(AA134*2) -> 8
A135: PORT MELBOURNE | C135: 4 | D135: 3 | E135: =(C135*6)+D135 -> 27 | G135: 7 | H135: 4 | I135: =(G135*6)+H135 -> 46 | K135: 9 | L135: 7 | M135: =(K135*6)+L135 -> 61 | O135: 12 | P135: 11 | Q135: =(O135*6)+P135 -> 83 | S135: Venue: WILLIAMSTOWN | W135: BOX HILL | Y135: 2 | Z135: 1 | AA135: 0 | AB135: 245 | AC135: 253 | AD135: =(AB135/AC135)*100 -> 96.83794466403161 | AE135: =(Y135*4)+(AA135*2) -> 8
A136: WILLIAMSTOWN | C136: 2 | D136: 3 | E136: =(C136*6)+D136 -> 15 | G136: 5 | H136: 6 | I136: =(G136*6)+H136 -> 36 | K136: 8 | L136: 9 | M136: =(K136*6)+L136 -> 57 | O136: 10 | P136: 14 | Q136: =(O136*6)+P136 -> 74 | W136: WILLIAMSTOWN | X136: 1 | Y136: 1 | Z136: 1 | AA136: 0 | AB136: 214 | AC136: 162 | AD136: =(AB136/AC136)*100 -> 132.09876543209879 | AE136: =(Y136*4)+(AA136*2) -> 4
A137: BEST PLAYERS | W137: TASMANIA | Y137: 1 | Z137: 2 | AA137: 0 | AB137: 248 | AC137: 258 | AD137: =(AB137/AC137)*100 -> 96.124031007751938 | AE137: =(Y137*4)+(AA137*2) -> 4
A138: PORT MELBOURNE | C138: WATSON | F138: FIRRITO | I138: GRIMA | L138: ANSTEY | O138: McMAHON
A139: WILLIAMSTOWN | C139: FLETCHER | F139: CRANAGE | I139: CLOKE | L139: SWAN | O139: ANDERSON | R139: SHEEHAN | W139: BENDIGO | Y139: 1 | Z139: 2 | AA139: 0 | AB139: 286 | AC139: 347 | AD139: =(AB139/AC139)*100 -> 82.42074927953891 | AE139: =(Y139*4)+(AA139*2) -> 4
A140: GOALKICKERS | W140: GEELONG | Y140: 1 | Z140: 2 | AA140: 0 | AB140: 214 | AC140: 335 | AD140: =(AB140/AC140)*100 -> 63.880597014925378 | AE140: =(Y140*4)+(AA140*2) -> 4
A141: PORT MELBOURNE | C141: BOURKE 3 | F141: GRIMA 3 | I141: ALLEWAY 2 | L141: EVANS | N141: HARRIS | P141: WATSON | R141: OBST | W141: NORTHERN BULLANTS | X141: 1 | Y141: 0 | Z141: 2 | AA141: 0 | AB141: 147 | AC141: 212 | AD141: =(AB141/AC141)*100 -> 69.339622641509436 | AE141: =(Y141*4)+(AA141*2) -> 0
A142: WILLIAMSTOWN | C142: BALDWIN 2 | F142: DUKES 2 | H142: ANDERSON | K142: CLOKE | M142: KINNEAR | O142: MAHONEY | Q142: McGOUGH | S142: SWAN | W142: COBURG | X142: 1 | Y142: 0 | Z142: 2 | AA142: 0 | AB142: 136 | AC142: 252 | AD142: =(AB142/AC142)*100 -> 53.968253968253968 | AE142: =(Y142*4)+(AA142*2) -> 0
D143: 20TH APRIL | J143: WEATHER | W143: NORTH BALLARAT | X143: 1 | Y143: 0 | Z143: 2 | AA143: 0 | AB143: 101 | AC143: 193 | AD143: =(AB143/AC143)*100 -> 52.331606217616574 | AE143: =(Y143*4)+(AA143*2) -> 0
A144: FRANKSTON | C144: 3 | D144: 2 | E144: =(C144*6)+D144 -> 20 | G144: 9 | H144: 7 | I144: =(G144*6)+H144 -> 61 | K144: 16 | L144: 10 | M144: =(K144*6)+L144 -> 106 | O144: 20 | P144: 12 | Q144: =(O144*6)+P144 -> 132 | S144: Venue: FRANKSTON
A145: NORTH BALLARAT | C145: 5 | D145: 2 | E145: =(C145*6)+D145 -> 32 | G145: 7 | H145: 3 | I145: =(G145*6)+H145 -> 45 | K145: 9 | L145: 5 | M145: =(K145*6)+L145 -> 59 | O145: 10 | P145: 6 | Q145: =(O145*6)+P145 -> 66
A146: BEST PLAYERS
A147: FRANKSTON | C147: BLACK | F147: SHIPP | I147: ABLETT | L147: WHITE | O147: HYNES | Q147: FERRARO
A148: NORTH BALLARAT | C148: JENKINS | F148: WINTER | I148: BRADLEY | L148: GREIG
A149: GOALKICKERS
A150: FRANKSTON | C150: BLACK 6 | E150: HYNES 4 | H150: FERRARO 3 | K150: McCORMACK 2 | N150: BROWN | P150: ROBERTS | R150: SHIPP | U150: WILLIS | W150: WINTERTON
A151: NORTH BALLARAT | C151: BRADLEY 3 | F151: JENKINS 2 | I151: McCORKELL | L151: McMAHON | N151: MIDGLEY | Q151: O'KEEFE | S151: SPOLDING
A153: WERRIBEE | C153: 2 | D153: 4 | E153: =(C153*6)+D153 -> 16 | G153: 9 | H153: 10 | I153: =(G153*6)+H153 -> 64 | K153: 15 | L153: 15 | M153: =(K153*6)+L153 -> 105 | O153: 23 | P153: 18 | Q153: =(O153*6)+P153 -> 156 | S153: Venue: BENDIGO
A154: BENDIGO | C154: 4 | D154: 3 | E154: =(C154*6)+D154 -> 27 | G154: 8 | H154: 7 | I154: =(G154*6)+H154 -> 55 | K154: 11 | L154: 9 | M154: =(K154*6)+L154 -> 75 | O154: 15 | P154: 11 | Q154: =(O154*6)+P154 -> 101
A155: BEST PLAYERS
A156: WERRIBEE | C156: BOYD | F156: ROBERTSON | I156: JACK | K156: PODSIADLY | N156: HENDERSON | Q156: GILBEE
A157: BENDIGO | C157: BROWN | F157: KEOWN | I157: CAIL | K157: CORCORAN | N157: FORSTER-KNIGHT | R157: HALL
A158: GOALKICKERS
A159: WERRIBEE | C159: WIGGINS 5 | F159: GILBEE 4 | H159: BOYD 3 | J159: MITCHELL 3 | M159: EAGLETON 2 | P159: LAMB 2 | R159: COLBERT | U159: RAU | W159: FAULKNER | X159: JACK
A160: BENDIGO | C160: BROWN 5 | E160: CAIL 2 | G160: FITZGERALD 2 | J160: BULLEN | L160: CAMPBELL | O160: DAVIES | Q160: DOHERTY | T160: HALL | V160: WHITSED
A162: SANDRINGHAM | C162: 6 | D162: 2 | E162: =(C162*6)+D162 -> 38 | G162: 12 | H162: 7 | I162: =(G162*6)+H162 -> 79 | K162: 15 | L162: 12 | M162: =(K162*6)+L162 -> 102 | O162: 21 | P162: 16 | Q162: =(O162*6)+P162 -> 142 | S162: Venue: BEACH ROAD
A163: GEELONG | C163: 6 | D163: 1 | E163: =(C163*6)+D163 -> 37 | G163: 7 | H163: 6 | I163: =(G163*6)+H163 -> 48 | K163: 9 | L163: 8 | M163: =(K163*6)+L163 -> 62 | O163: 12 | P163: 11 | Q163: =(O163*6)+P163 -> 83
A164: BEST PLAYERS
A165: SANDRINGHAM | C165: MOORCROFT | F165: THOMPSON | I165: JAMAR | L165: TREGEAR | O165: ROBBINS | R165: GALLAGHER
A166: GEELONG | C166: S JOHNSON | F166: FINNIN | I166: PLAYFAIR | L166: LORD | O166: HUNT
A167: GOALKICKERS
A168: SANDRINGHAM | C168: MOORCROFT 5 | F168: JAMAR 2 | H168: ROGERS 2 | J168: THOMPSON 2 | M168: TREGEAR 2 | O168: WHEATLEY 2 | R168: AINLEY | U168: SMITH | W168: GALLAGHER | X168: OAKLEY | AA168: POYAS | AC168: FISHER
A169: GEELONG | C169: GARDNER 2 | F169: McCARTHY 2 | I169: BRIGHT | K169: BYRNES | M169: CALLAN | O169: HUNT | Q169: S JOHNSON | T169: LONERGAN | W169: LORD | X169: STREET
A171: BYE | D171: COBURG | G171: NORTHERN BULLANTS | K171: SPRINGVALE
A173: ROUND 4 | D173: 25TH APRIL | J173: WEATHER
D174: 1ST QTR | H174: 2ND QTR | L174: 3RD QTR | P174: FINAL | S174: Venue: BOX HILL
A175: BOX HILL | C175: 4 | D175: 4 | E175: =(C175*6)+D175 -> 28 | G175: 12 | H175: 8 | I175: =(G175*6)+H175 -> 80 | K175: 15 | L175: 8 | M175: =(K175*6)+L175 -> 98 | O175: 21 | P175: 10 | Q175: =(O175*6)+P175 -> 136 | S175: UMPIRES | Z175: LADDER | AC175: ROUND | AE175: 4
A176: COBURG | C176: 5 | D176: 2 | E176: =(C176*6)+D176 -> 32 | G176: 5 | H176: 4 | I176: =(G176*6)+H176 -> 34 | K176: 9 | L176: 6 | M176: =(K176*6)+L176 -> 60 | O176: 11 | P176: 7 | Q176: =(O176*6)+P176 -> 73
A177: BEST PLAYERS | W177: TEAM | X177: B | Y177: W | Z177: L | AA177: D | AB177: FOR | AC177: AGST | AD177: % | AE177: PTS
A178: BOX HILL
A179: COBURG | W179: PORT MELBOURNE | Y179: 4 | Z179: 0 | AA179: 0 | AB179: 435 | AC179: 250 | AD179: =(AB179/AC179)*100 -> 174 | AE179: =(Y179*4)+(AA179*2) -> 16
A180: GOALKICKERS | W180: SANDRINGHAM | Y180: 3 | Z180: 1 | AA180: 0 | AB180: 405 | AC180: 282 | AD180: =(AB180/AC180)*100 -> 143.61702127659575 | AE180: =(Y180*4)+(AA180*2) -> 12
A181: BOX HILL | W181: SPRINGVALE | X181: 1 | Y181: 3 | Z181: 0 | AA181: 0 | AB181: 300 | AC181: 229 | AD181: =(AB181/AC181)*100 -> 131.00436681222706 | AE181: =(Y181*4)+(AA181*2) -> 12
A182: COBURG | W182: BOX HILL | Y182: 3 | Z182: 1 | AA182: 0 | AB182: 381 | AC182: 326 | AD182: =(AB182/AC182)*100 -> 116.87116564417177 | AE182: =(Y182*4)+(AA182*2) -> 12
W183: WILLIAMSTOWN | X183: 1 | Y183: 2 | Z183: 1 | AA183: 0 | AB183: 368 | AC183: 195 | AD183: =(AB183/AC183)*100 -> 188.7179487179487 | AE183: =(Y183*4)+(AA183*2) -> 8
A184: PORT MELBOURNE | C184: 3 | D184: 5 | E184: =(C184*6)+D184 -> 23 | G184: 7 | H184: 9 | I184: =(G184*6)+H184 -> 51 | K184: 10 | L184: 11 | M184: =(K184*6)+L184 -> 71 | O184: 17 | P184: 14 | Q184: =(O184*6)+P184 -> 116 | S184: Venue: PRESTON | W184: TASMANIA | Y184: 2 | Z184: 2 | AA184: 0 | AB184: 425 | AC184: 312 | AD184: =(AB184/AC184)*100 -> 136.21794871794873 | AE184: =(Y184*4)+(AA184*2) -> 8
A185: NORTHERN BULLANTS | C185: 2 | D185: 4 | E185: =(C185*6)+D185 -> 16 | G185: 5 | H185: 4 | I185: =(G185*6)+H185 -> 34 | K185: 11 | L185: 9 | M185: =(K185*6)+L185 -> 75 | O185: 14 | P185: 11 | Q185: =(O185*6)+P185 -> 95 | W185: FRANKSTON | Y185: 2 | Z185: 2 | AA185: 0 | AB185: 318 | AC185: 282 | AD185: =(AB185/AC185)*100 -> 112.7659574468085 | AE185: =(Y185*4)+(AA185*2) -> 8
A186: BEST PLAYERS | W186: WERRIBEE | Y186: 2 | Z186: 2 | AA186: 0 | AB186: 381 | AC186: 455 | AD186: =(AB186/AC186)*100 -> 83.736263736263737 | AE186: =(Y186*4)+(AA186*2) -> 8
A187: PORT MELBOURNE | W187: BENDIGO | X187: 1 | Y187: 1 | Z187: 2 | AA187: 0 | AB187: 286 | AC187: 347 | AD187: =(AB187/AC187)*100 -> 82.42074927953891 | AE187: =(Y187*4)+(AA187*2) -> 4
A188: NORTHERN BULLANTS | W188: GEELONG | Y188: 1 | Z188: 3 | AA188: 0 | AB188: 314 | AC188: 455 | AD188: =(AB188/AC188)*100 -> 69.010989010989007 | AE188: =(Y188*4)+(AA188*2) -> 4
A189: GOALKICKERS | W189: NORTHERN BULLANTS | X189: 1 | Y189: 0 | Z189: 3 | AA189: 0 | AB189: 242 | AC189: 328 | AD189: =(AB189/AC189)*100 -> 73.780487804878049 | AE189: =(Y189*4)+(AA189*2) -> 0
A190: PORT MELBOURNE | W190: COBURG | X190: 1 | Y190: 0 | Z190: 3 | AA190: 0 | AB190: 209 | AC190: 388 | AD190: =(AB190/AC190)*100 -> 53.865979381443296 | AE190: =(Y190*4)+(AA190*2) -> 0
A191: NORTHERN BULLANTS | W191: NORTH BALLARAT | X191: 1 | Y191: 0 | Z191: 3 | AA191: 0 | AB191: 155 | AC191: 370 | AD191: =(AB191/AC191)*100 -> 41.891891891891895 | AE191: =(Y191*4)+(AA191*2) -> 0
A193: TASMANIA | C193: 5 | D193: 7 | E193: =(C193*6)+D193 -> 37 | G193: 10 | H193: 10 | I193: =(G193*6)+H193 -> 70 | K193: 18 | L193: 16 | M193: =(K193*6)+L193 -> 124 | O193: 26 | P193: 21 | Q193: =(O193*6)+P193 -> 177 | S193: Venue: NORTH HOBART OVAL
A194: NORTH BALLARAT | C194: 3 | D194: 1 | E194: =(C194*6)+D194 -> 19 | G194: 5 | H194: 5 | I194: =(G194*6)+H194 -> 35 | K194: 7 | L194: 6 | M194: =(K194*6)+L194 -> 48 | O194: 8 | P194: 6 | Q194: =(O194*6)+P194 -> 54
A195: BEST PLAYERS
A196: TASMANIA
A197: NORTH BALLARAT
A198: GOALKICKERS
A199: TASMANIA
A200: NORTH BALLARAT
D201: 26TH APRIL | J201: WEATHER
A202: SPRINGVALE | C202: 2 | D202: 1 | E202: =(C202*6)+D202 -> 13 | G202: 8 | H202: 7 | I202: =(G202*6)+H202 -> 55 | K202: 14 | L202: 8 | M202: =(K202*6)+L202 -> 92 | O202: 18 | P202: 12 | Q202: =(O202*6)+P202 -> 120 | S202: Venue: SHELL STADIUM
A203: GEELONG | C203: 6 | D203: 3 | E203: =(C203*6)+D203 -> 39 | G203: 8 | H203: 6 | I203: =(G203*6)+H203 -> 54 | K203: 11 | L203: 6 | M203: =(K203*6)+L203 -> 72 | O203: 15 | P203: 10 | Q203: =(O203*6)+P203 -> 100
A204: BEST PLAYERS
A205: SPRINGVALE
A206: GEELONG
A207: GOALKICKERS
A208: SPRINGVALE
A209: GEELONG
D210: 27TH APRIL | J210: WEATHER
A211: WILLIAMSTOWN | C211: 4 | D211: 5 | E211: =(C211*6)+D211 -> 29 | G211: 8 | H211: 12 | I211: =(G211*6)+H211 -> 60 | K211: 18 | L211: 14 | M211: =(K211*6)+L211 -> 122 | O211: 23 | P211: 16 | Q211: =(O211*6)+P211 -> 154 | S211: Venue: WERRIBEE
A212: WERRIBEE | C212: 1 | D212: 1 | E212: =(C212*6)+D212 -> 7 | G212: 1 | H212: 3 | I212: =(G212*6)+H212 -> 9 | K212: 3 | L212: 3 | M212: =(K212*6)+L212 -> 21 | O212: 4 | P212: 9 | Q212: =(O212*6)+P212 -> 33
A213: BEST PLAYERS
A214: WILLIAMSTOWN
A215: WERRIBEE
A216: GOALKICKERS
A217: WILLIAMSTOWN
A218: WERRIBEE
A220: SANDRINGHAM | C220: 4 | D220: 3 | E220: =(C220*6)+D220 -> 27 | G220: 5 | H220: 3 | I220: =(G220*6)+H220 -> 33 | K220: 5 | L220: 8 | M220: =(K220*6)+L220 -> 38 | O220: 8 | P220: 10 | Q220: =(O220*6)+P220 -> 58 | S220: Venue: BEACH ROAD
A221: FRANKSTON | C221: 1 | D221: 4 | E221: =(C221*6)+D221 -> 10 | G221: 2 | H221: 9 | I221: =(G221*6)+H221 -> 21 | K221: 3 | L221: 10 | M221: =(K221*6)+L221 -> 28 | O221: 3 | P221: 13 | Q221: =(O221*6)+P221 -> 31
A222: BEST PLAYERS
A223: SANDRINGHAM | C223: LYNCH | F223: JAMAR | I223: MOLAN | K223: POYAS | N223: LIDDELL | Q223: RIGONI
A224: FRANKSTON
A225: GOALKICKERS
A226: SANDRINGHAM | C226: MOLAN 3 | F226: WHEATLEY 2 | I226: ROBBINS | K226: ARMSTRONG | N226: POYAS
A227: FRANKSTON
A229: BYE | D229: BENDIGO
A231: ROUND 5 | D231: 3RD MAY | J231: WEATHER
D232: 1ST QTR | H232: 2ND QTR | L232: 3RD QTR | P232: FINAL | S232: Venue: SPRINGVALE
A233: SPRINGVALE | C233: 5 | D233: 2 | E233: =(C233*6)+D233 -> 32 | G233: 6 | H233: 4 | I233: =(G233*6)+H233 -> 40 | K233: 10 | L233: 5 | M233: =(K233*6)+L233 -> 65 | O233: 16 | P233: 9 | Q233: =(O233*6)+P233 -> 105 | S233: UMPIRES | Z233: LADDER | AC233: ROUND | AE233: 5
A234: WERRIBEE | C234: 0 | D234: 1 | E234: =(C234*6)+D234 -> 1 | G234: 4 | H234: 6 | I234: =(G234*6)+H234 -> 30 | K234: 7 | L234: 7 | M234: =(K234*6)+L234 -> 49 | O234: 11 | P234: 9 | Q234: =(O234*6)+P234 -> 75
A235: BEST PLAYERS | W235: TEAM | X235: B | Y235: W | Z235: L | AA235: D | AB235: FOR | AC235: AGST | AD235: % | AE235: PTS
A236: SPRINGVALE | C236: CAPUANO | F236: MILLER | I236: VOSS | K236: CAPLES | N236: T SCHWARZE | Q236: MURRAY
A237: WERRIBEE | C237: HUDSON | F237: SETCHELL | I237: PICKEN | K237: ROBERTSON | N237: JACK | Q237: BOYD | W237: PORT MELBOURNE | Y237: 4 | Z237: 1 | AA237: 0 | AB237: 541 | AC237: 369 | AD237: =(AB237/AC237)*100 -> 146.61246612466127 | AE237: =(Y237*4)+(AA237*2) -> 16
A238: GOALKICKERS | P238: T SCHWARZE | S238: WALDRON | W238: SPRINGVALE | X238: 1 | Y238: 4 | Z238: 0 | AA238: 0 | AB238: 405 | AC238: 304 | AD238: =(AB238/AC238)*100 -> 133.2236842105263 | AE238: =(Y238*4)+(AA238*2) -> 16
A239: SPRINGVALE | C239: B SCHWARZE 3 | F239: PITT 3 | H239: CAPUANO 2 | K239: KOSCH 2 | M239: VOSS 2 | O239: BARHAM | Q239: HOULIHAN | W239: BOX HILL | Y239: 4 | Z239: 1 | AA239: 0 | AB239: 500 | AC239: 432 | AD239: =(AB239/AC239)*100 -> 115.74074074074075 | AE239: =(Y239*4)+(AA239*2) -> 16
A240: WERRIBEE | C240: MITCHELL 2 | F240: MURPHY 2 | I240: KNEZEVIC | K240: RAU | L240: WIGGINS | N240: PICKEN | P240: EAGLETON | R240: JACK | W240: WILLIAMSTOWN | X240: 1 | Y240: 3 | Z240: 1 | AA240: 0 | AB240: 488 | AC240: 254 | AD240: =(AB240/AC240)*100 -> 192.1259842519685 | AE240: =(Y240*4)+(AA240*2) -> 12
O241: CULLINAN | W241: SANDRINGHAM | X241: 1 | Y241: 3 | Z241: 1 | AA241: 0 | AB241: 405 | AC241: 282 | AD241: =(AB241/AC241)*100 -> 143.61702127659575 | AE241: =(Y241*4)+(AA241*2) -> 12
A242: GEELONG | C242: 5 | D242: 2 | E242: =(C242*6)+D242 -> 32 | G242: 9 | H242: 4 | I242: =(G242*6)+H242 -> 58 | K242: 15 | L242: 6 | M242: =(K242*6)+L242 -> 96 | O242: 21 | P242: 8 | Q242: =(O242*6)+P242 -> 134 | S242: Venue: SHELL STADIUM | W242: FRANKSTON | Y242: 3 | Z242: 2 | AA242: 0 | AB242: 413 | AC242: 346 | AD242: =(AB242/AC242)*100 -> 119.364161849711 | AE242: =(Y242*4)+(AA242*2) -> 12
A243: COBURG | C243: 5 | D243: 4 | E243: =(C243*6)+D243 -> 34 | G243: 9 | H243: 6 | I243: =(G243*6)+H243 -> 60 | K243: 15 | L243: 9 | M243: =(K243*6)+L243 -> 99 | O243: 17 | P243: 11 | Q243: =(O243*6)+P243 -> 113 | W243: TASMANIA | X243: 1 | Y243: 2 | Z243: 2 | AA243: 0 | AB243: 425 | AC243: 312 | AD243: =(AB243/AC243)*100 -> 136.21794871794873 | AE243: =(Y243*4)+(AA243*2) -> 8
A244: BEST PLAYERS | W244: WERRIBEE | Y244: 2 | Z244: 3 | AA244: 0 | AB244: 456 | AC244: 560 | AD244: =(AB244/AC244)*100 -> 81.428571428571431 | AE244: =(Y244*4)+(AA244*2) -> 8
A245: GEELONG | C245: BYRNES | F245: LORD | I245: GARDINER | L245: CARRAZZO | O245: STREET | Q245: SPRIGGS | W245: GEELONG | Y245: 2 | Z245: 3 | AA245: 0 | AB245: 448 | AC245: 568 | AD245: =(AB245/AC245)*100 -> 78.873239436619713 | AE245: =(Y245*4)+(AA245*2) -> 8
A246: COBURG | C246: NICHOLLS | F246: HYDE | I246: SHULTZ | L246: CARLSON | O246: TALBOT | Q246: WHYMAN | W246: BENDIGO | X246: 1 | Y246: 1 | Z246: 3 | AA246: 0 | AB246: 350 | AC246: 442 | AD246: =(AB246/AC246)*100 -> 79.185520361990953 | AE246: =(Y246*4)+(AA246*2) -> 4
A247: GOALKICKERS | L247: FOSTER | N247: JOVANOVIC | Q247: LORD | S247: SMITH | W247: NORTHERN BULLANTS | X247: 2 | Y247: 0 | Z247: 3 | AA247: 0 | AB247: 242 | AC247: 328 | AD247: =(AB247/AC247)*100 -> 73.780487804878049 | AE247: =(Y247*4)+(AA247*2) -> 0
A248: GEELONG | C248: GARDINER 5 | F248: STREET 3 | I248: BRIGHT 2 | K248: MACKIE 2 | M248: McCARTHY 2 | P248: SPRIGGS 2 | R248: BYRNES | W248: COBURG | X248: 1 | Y248: 0 | Z248: 4 | AA248: 0 | AB248: 322 | AC248: 522 | AD248: =(AB248/AC248)*100 -> 61.685823754789268 | AE248: =(Y248*4)+(AA248*2) -> 0
A249: COBURG | C249: VARDY 4 | F249: WHYMAN 4 | I249: McGRATH 3 | L249: TAYLOR 2 | N249: HYDE | P249: NICHOLLS | R249: PICKERING | W249: NORTH BALLARAT | X249: 1 | Y249: 0 | Z249: 4 | AA249: 0 | AB249: 214 | AC249: 490 | AD249: =(AB249/AC249)*100 -> 43.673469387755105 | AE249: =(Y249*4)+(AA249*2) -> 0
O250: SIPTHORP
A251: FRANKSTON | C251: 4 | D251: 4 | E251: =(C251*6)+D251 -> 28 | G251: 8 | H251: 6 | I251: =(G251*6)+H251 -> 54 | K251: 10 | L251: 8 | M251: =(K251*6)+L251 -> 68 | O251: 14 | P251: 11 | Q251: =(O251*6)+P251 -> 95 | S251: Venue: BENDIGO
A252: BENDIGO | C252: 4 | D252: 2 | E252: =(C252*6)+D252 -> 26 | G252: 6 | H252: 4 | I252: =(G252*6)+H252 -> 40 | K252: 9 | L252: 8 | M252: =(K252*6)+L252 -> 62 | O252: 9 | P252: 10 | Q252: =(O252*6)+P252 -> 64
A253: BEST PLAYERS
A254: FRANKSTON | C254: D CLARKE | F254: McCORMACK | I254: WINTERTON | L254: KEMPERMAN | O254: ANDERSON | R254: BUTLER
A255: BENDIGO | C255: M BROWN | F255: HALL | I255: HOWARD | L255: RICHARDS | O255: BEASY
A256: GOALKICKERS
A257: FRANKSTON | C257: WINTERTON 3 | F257: BEASY 2 | I257: BLACK 2 | K257: McCORMACK 2 | N257: SHIPP 2 | P257: BROWN | R257: HUNTER | U257: HYNES
A258: BENDIGO | C258: RICHARDS 3 | F258: DAVIES 2 | I258: M BROWN | L258: CONNAUGHTON | O258: HALL | Q258: SCHMIDT
D259: 4TH MAY | J259: WEATHER
A260: WILLIAMSTOWN | C260: 3 | D260: 6 | E260: =(C260*6)+D260 -> 24 | G260: 8 | H260: 8 | I260: =(G260*6)+H260 -> 56 | K260: 14 | L260: 9 | M260: =(K260*6)+L260 -> 93 | O260: 18 | P260: 12 | Q260: =(O260*6)+P260 -> 120 | S260: Venue: FRANKSTON
A261: NORTH BALLARAT | C261: 1 | D261: 3 | E261: =(C261*6)+D261 -> 9 | G261: 4 | H261: 4 | I261: =(G261*6)+H261 -> 28 | K261: 5 | L261: 4 | M261: =(K261*6)+L261 -> 34 | O261: 9 | P261: 5 | Q261: =(O261*6)+P261 -> 59
A262: BEST PLAYERS
A263: WILLIAMSTOWN | C263: BALDWIN | F263: DUKES | I263: MAHONEY | L263: SHAW | O263: SCOTLAND | R263: CRANAGE
A264: NORTH BALLARAT | C264: JURICA | F264: MOLONEY | I264: FIELD | L264: JENKINS | O264: SAUNDERS
A265: GOALKICKERS
A266: WILLIAMSTOWN | C266: BALDWIN 9 | F266: MAHONEY 3 | I266: SCOTLAND 2 | L266: ANDERSON | N266: DAVIS | P266: LLOYD | R266: SWAN
A267: NORTH BALLARAT | C267: JURICA 2 | F267: SAUNDERS 2 | I267: McCORKELL | L267: McNAMARA | O267: PERKINS | Q267: RUDD | R267: WINTER
A269: BOX HILL | C269: 6 | D269: 5 | E269: =(C269*6)+D269 -> 41 | G269: 9 | H269: 9 | I269: =(G269*6)+H269 -> 63 | K269: 12 | L269: 11 | M269: =(K269*6)+L269 -> 83 | O269: 17 | P269: 17 | Q269: =(O269*6)+P269 -> 119 | S269: Venue: PORT MELBOURNE
A270: PORT MELBOURNE | C270: 3 | D270: 3 | E270: =(C270*6)+D270 -> 21 | G270: 6 | H270: 6 | I270: =(G270*6)+H270 -> 42 | K270: 12 | L270: 14 | M270: =(K270*6)+L270 -> 86 | O270: 15 | P270: 16 | Q270: =(O270*6)+P270 -> 106
A271: BEST PLAYERS
A272: BOX HILL | C272: S COX | F272: SEWELL | I272: HODGE | L272: WILLIAMS | O272: PICIAONE | R272: STONE
A273: PORT MELBOURNE | C273: SMITH | F273: TEAGUE | I273: McMAHON | L273: MORRELL
A274: GOALKICKERS
A275: BOX HILL | C275: WILLIAMS 4 | F275: HODGE 3 | I275: S COX 2 | K275: ANDERSON | N275: BAYFORD | P275: BOYLE | R275: GREENE | U275: KANE | W275: KENNA | X275: SEWELL | Z275: RIES
A276: PORT MELBOURNE | C276: MORRELL 4 | F276: ALLEWAY 2 | I276: McINTOSH 2 | L276: J CLAYTON | N276: DELUCA | P276: EVANS | R276: FIRRITO | U276: GRIMA | X276: McCARTNEY | AA276: WELLS
A278: BYE | D278: NORTHERN BULLANTS | H278: SANDRINGHAM | L278: TASMANIA
A280: ROUND 6 | D280: 10TH MAY | J280: WEATHER
D281: 1ST QTR | H281: 2ND QTR | L281: 3RD QTR | P281: FINAL | S281: Venue: BOX HILL
A282: BOX HILL | C282: 5 | D282: 1 | E282: =(C282*6)+D282 -> 31 | G282: 11 | H282: 7 | I282: =(G282*6)+H282 -> 73 | K282: 14 | L282: 10 | M282: =(K282*6)+L282 -> 94 | O282: 18 | P282: 15 | Q282: =(O282*6)+P282 -> 123 | S282: UMPIRES | Z282: LADDER | AC282: ROUND | AE282: 6
A283: SANDRINGHAM | C283: 4 | D283: 3 | E283: =(C283*6)+D283 -> 27 | G283: 7 | H283: 6 | I283: =(G283*6)+H283 -> 48 | K283: 8 | L283: 9 | M283: =(K283*6)+L283 -> 57 | O283: 9 | P283: 12 | Q283: =(O283*6)+P283 -> 66
A284: BEST PLAYERS | W284: TEAM | X284: B | Y284: W | Z284: L | AA284: D | AB284: FOR | AC284: AGST | AD284: % | AE284: PTS
A285: BOX HILL | C285: GREENE | F285: PICIAONE | I285: RIES | K285: LOATS | N285: HARFORD | Q285: S COX
A286: SANDRINGHAM | C286: LAMB | F286: CARROLL | I286: RADFORD | W286: BOX HILL | Y286: 5 | Z286: 1 | AA286: 0 | AB286: 623 | AC286: 498 | AD286: =(AB286/AC286)*100 -> 125.10040160642571 | AE286: =(Y286*4)+(AA286*2) -> 20
A287: GOALKICKERS | L287: GEORGIADIS | O287: PICIAONE | Q287: LOATS | W287: WILLIAMSTOWN | X287: 1 | Y287: 4 | Z287: 1 | AA287: 0 | AB287: 593 | AC287: 355 | AD287: =(AB287/AC287)*100 -> 167.04225352112675 | AE287: =(Y287*4)+(AA287*2) -> 16
A288: BOX HILL | C288: HARFORD 4 | F288: WILLIAMS 3 | I288: S COX 2 | K288: KENNA 2 | M288: SMITH 2 | O288: ANDERSON | Q288: BOYLE | W288: PORT MELBOURNE | X288: 1 | Y288: 4 | Z288: 1 | AA288: 0 | AB288: 541 | AC288: 369 | AD288: =(AB288/AC288)*100 -> 146.61246612466127 | AE288: =(Y288*4)+(AA288*2) -> 16
A289: SANDRINGHAM | C289: MOORCROFT 2 | F289: MOLAN 2 | I289: CARROLL | K289: HAYNES | M289: LYNCH | O289: POYAS | Q289: RIGONI | W289: FRANKSTON | Y289: 4 | Z289: 2 | AA289: 0 | AB289: 543 | AC289: 448 | AD289: =(AB289/AC289)*100 -> 121.20535714285714 | AE289: =(Y289*4)+(AA289*2) -> 16
W290: SPRINGVALE | X290: 1 | Y290: 4 | Z290: 1 | AA290: 0 | AB290: 507 | AC290: 434 | AD290: =(AB290/AC290)*100 -> 116.82027649769586 | AE290: =(Y290*4)+(AA290*2) -> 16
A291: NORTH BALLARAT | C291: 3 | D291: 1 | E291: =(C291*6)+D291 -> 19 | G291: 7 | H291: 3 | I291: =(G291*6)+H291 -> 45 | K291: 13 | L291: 8 | M291: =(K291*6)+L291 -> 86 | O291: 14 | P291: 10 | Q291: =(O291*6)+P291 -> 94 | S291: Venue: NORTH BALLARAT | W291: SANDRINGHAM | X291: 1 | Y291: 3 | Z291: 2 | AA291: 0 | AB291: 471 | AC291: 405 | AD291: =(AB291/AC291)*100 -> 116.2962962962963 | AE291: =(Y291*4)+(AA291*2) -> 12
A292: NORTHERN BULLANTS | C292: 5 | D292: 3 | E292: =(C292*6)+D292 -> 33 | G292: 7 | H292: 9 | I292: =(G292*6)+H292 -> 51 | K292: 12 | L292: 11 | M292: =(K292*6)+L292 -> 83 | O292: 13 | P292: 14 | Q292: =(O292*6)+P292 -> 92 | W292: GEELONG | Y292: 3 | Z292: 3 | AA292: 0 | AB292: 590 | AC292: 616 | AD292: =(AB292/AC292)*100 -> 95.779220779220779 | AE292: =(Y292*4)+(AA292*2) -> 12
A293: BEST PLAYERS | W293: TASMANIA | X293: 1 | Y293: 2 | Z293: 3 | AA293: 0 | AB293: 526 | AC293: 417 | AD293: =(AB293/AC293)*100 -> 126.13908872901678 | AE293: =(Y293*4)+(AA293*2) -> 8
A294: NORTH BALLARAT | C294: JURICA | F294: MOLONEY | I294: JENKINS | L294: FIELD | N294: COOK | P294: RUDD
A295: NORTHERN BULLANTS | C295: STINEAR | F295: ALLAN | I295: FLETCHER | W295: WERRIBEE | Y295: 2 | Z295: 4 | AA295: 0 | AB295: 504 | AC295: 702 | AD295: =(AB295/AC295)*100 -> 71.794871794871796 | AE295: =(Y295*4)+(AA295*2) -> 8
A296: GOALKICKERS | P296: SPOLDING | W296: BENDIGO | X296: 1 | Y296: 1 | Z296: 4 | AA296: 0 | AB296: 434 | AC296: 540 | AD296: =(AB296/AC296)*100 -> 80.370370370370367 | AE296: =(Y296*4)+(AA296*2) -> 4
A297: NORTH BALLARAT | C297: WINTER 3 | F297: MIDGLEY 3 | I297: O'KEEFE 3 | L297: McNAMARA 2 | O297: JENKINS | Q297: SEARL | W297: COBURG | X297: 1 | Y297: 1 | Z297: 4 | AA297: 0 | AB297: 420 | AC297: 606 | AD297: =(AB297/AC297)*100 -> 69.306930693069305 | AE297: =(Y297*4)+(AA297*2) -> 4
A298: NORTHERN BULLANTS | C298: ANGWIN 2 | E298: FLETCHER 2 | H298: GIBSON 2 | J298: SAUTNER 2 | M298: FRANCHINA | P298: GUTTERSON | W298: NORTH BALLARAT | X298: 1 | Y298: 1 | Z298: 4 | AA298: 0 | AB298: 308 | AC298: 582 | AD298: =(AB298/AC298)*100 -> 52.920962199312719 | AE298: =(Y298*4)+(AA298*2) -> 4
M299: MERRINGTON | P299: O'KEEFE | R299: STEVENSON | W299: NORTHERN BULLANTS | X299: 2 | Y299: 0 | Z299: 4 | AA299: 0 | AB299: 334 | AC299: 422 | AD299: =(AB299/AC299)*100 -> 79.146919431279613 | AE299: =(Y299*4)+(AA299*2) -> 0
A300: GEELONG | C300: 3 | D300: 4 | E300: =(C300*6)+D300 -> 22 | G300: 8 | H300: 4 | I300: =(G300*6)+H300 -> 52 | K300: 13 | L300: 10 | M300: =(K300*6)+L300 -> 88 | O300: 21 | P300: 16 | Q300: =(O300*6)+P300 -> 142 | S300: Venue: WERRIBEE
A301: WERRIBEE | C301: 3 | D301: 3 | E301: =(C301*6)+D301 -> 21 | G301: 5 | H301: 4 | I301: =(G301*6)+H301 -> 34 | K301: 6 | L301: 6 | M301: =(K301*6)+L301 -> 42 | O301: 7 | P301: 6 | Q301: =(O301*6)+P301 -> 48
A302: BEST PLAYERS
A303: GEELONG | C303: CARRAZZO | F303: GARDINER | I303: McCARTHY | L303: LORD | N303: COOK | Q303: PLAYFAIR
A304: WERRIBEE | C304: JACK | F304: HUDSON | I304: PODSIADLY | L304: CHURCHILL | N304: MORRIS
A305: GOALKICKERS
A306: GEELONG | C306: McCARTHY 4 | F306: LONERGAN 3 | I306: BRIGHT 2 | K306: GARDINER 2 | N306: LORD 2 | P306: MACKIE 2 | R306: PLAYFAIR 2 | V306: BYRNES | X306: MOONEY | AA306: MOLONEY | AC306: STREET
A307: WERRIBEE | C307: MURPHY 3 | F307: PICKEN | H307: ROBERTSON | K307: SETCHELL | N307: WIGGINS
D308: 11TH MAY | J308: WEATHER
A309: WILLIAMSTOWN | C309: 3 | D309: 4 | E309: =(C309*6)+D309 -> 22 | G309: 10 | H309: 8 | I309: =(G309*6)+H309 -> 68 | K309: 12 | L309: 11 | M309: =(K309*6)+L309 -> 83 | O309: 15 | P309: 15 | Q309: =(O309*6)+P309 -> 105 | S309: Venue: WILLIAMSTOWN
A310: TASMANIA | C310: 3 | D310: 2 | E310: =(C310*6)+D310 -> 20 | G310: 6 | H310: 4 | I310: =(G310*6)+H310 -> 40 | K310: 12 | L310: 5 | M310: =(K310*6)+L310 -> 77 | O310: 15 | P310: 11 | Q310: =(O310*6)+P310 -> 101
A311: BEST PLAYERS
A312: WILLIAMSTOWN | C312: KINNEAR | F312: MAHONEY | I312: FLETCHER | L312: CRANAGE | N312: LLOYD | Q312: BALDWIN
A313: TASMANIA | C313: BARTLETT | F313: STEPHENS | I313: STEVENSON | L313: HOWARD | N313: ATKIN | Q313: BEAMS
A314: GOALKICKERS
A315: WILLIAMSTOWN | C315: BALDWIN 3 | F315: CRANAGE 3 | I315: KINNEAR 3 | L315: C CLOKE | N315: MAHONEY | Q315: LLOYD | S315: NIXON | V315: PEARCE | X315: TAYLOR
A316: TASMANIA | C316: BEAMS 5 | F316: BARTLETT 3 | I316: HEATLEY 3 | L316: CALLINAN 2 | O316: GEAPPEN | Q316: STEPHENS
A318: FRANKSTON | C318: 3 | D318: 0 | E318: =(C318*6)+D318 -> 18 | G318: 7 | H318: 2 | I318: =(G318*6)+H318 -> 44 | K318: 15 | L318: 6 | M318: =(K318*6)+L318 -> 96 | O318: 20 | P318: 10 | Q318: =(O318*6)+P318 -> 130 | S318: Venue: SPRINGVALE
A319: SPRINGVALE | C319: 6 | D319: 4 | E319: =(C319*6)+D319 -> 40 | G319: 13 | H319: 5 | I319: =(G319*6)+H319 -> 83 | K319: 14 | L319: 8 | M319: =(K319*6)+L319 -> 92 | O319: 15 | P319: 12 | Q319: =(O319*6)+P319 -> 102
A320: BEST PLAYERS
A321: FRANKSTON | C321: SHIPP | F321: ODELL | I321: LYON | L321: McCORMACK | O321: ANDERSON | R321: CADD
A322: SPRINGVALE | C322: MONTAGNA | F322: MURRAY | I322: MOYLE | L322: PITT | O322: CARMODY | R322: MILLER
A323: GOALKICKERS
A324: FRANKSTON | C324: McCORMACK 3 | F324: ANDERSON 2 | I324: BEASY 2 | K324: BLACK 2 | M324: BROWN 2 | O324: CADD 2 | Q324: HYNES 2 | S324: SHIPP 2 | V324: FOLINO | X324: KEMPERMAN | Z324: WILLIS
A325: SPRINGVALE | C325: PITT 3 | E325: BROOKS 2 | G325: KNOBEL 2 | I325: T SCHWARZE 2 | L325: BARHAM | N325: BLAKE | P325: HOULIHAN | S325: MONTAGNA | W325: MOYLE | X325: B SCHWARZE
A327: COBURG | C327: 5 | D327: 2 | E327: =(C327*6)+D327 -> 32 | G327: 9 | H327: 6 | I327: =(G327*6)+H327 -> 60 | K327: 14 | L327: 11 | M327: =(K327*6)+L327 -> 95 | O327: 14 | P327: 14 | Q327: =(O327*6)+P327 -> 98 | S327: Venue: COBURG
A328: BENDIGO | C328: 4 | D328: 3 | E328: =(C328*6)+D328 -> 27 | G328: 5 | H328: 7 | I328: =(G328*6)+H328 -> 37 | K328: 8 | L328: 9 | M328: =(K328*6)+L328 -> 57 | O328: 12 | P328: 12 | Q328: =(O328*6)+P328 -> 84
A329: BEST PLAYERS
A330: COBURG | C330: CARLSON | F330: D KELLAWAY | I330: TALBOT | L330: HYDE | N330: WHYMAN | Q330: STEINFORT
A331: BENDIGO | C331: CARTER | F331: BULLEN | I331: McGRATH | L331: FORSTER-KNIGHT | P331: CAIL | R331: ROSA
A332: GOALKICKERS
A333: COBURG | C333: WHYMAN 3 | F333: HART 2 | I333: McGRATH 2 | L333: TALBOT 2 | N333: TAYLOR 2 | Q333: GIESCHEN | T333: KING | V333: STEINFORT
A334: BENDIGO | C334: CAIL 2 | E334: LAYCOCK 2 | H334: LOVETT-MURRAY 2 | L334: BROWN | N334: DAVIES | P334: HAWKINS | R334: HOWARD | V334: McGRATH | X334: WATSON
A336: BYE | D336: PORT MELBOURNE
A338: ROUND 7 | D338: 17TH MAY | G338: NIGHT MATCH | J338: WEATHER
D339: 1ST QTR | H339: 2ND QTR | L339: 3RD QTR | P339: FINAL | S339: Venue: YORK PARK (Launceston)
A340: TASMANIA | C340: 0 | D340: 3 | E340: =(C340*6)+D340 -> 3 | G340: 4 | H340: 7 | I340: =(G340*6)+H340 -> 31 | K340: 8 | L340: 11 | M340: =(K340*6)+L340 -> 59 | O340: 12 | P340: 15 | Q340: =(O340*6)+P340 -> 87 | S340: UMPIRES | Z340: LADDER | AC340: ROUND | AE340: 7
A341: BENDIGO | C341: 2 | D341: 10 | E341: =(C341*6)+D341 -> 22 | G341: 6 | H341: 13 | I341: =(G341*6)+H341 -> 49 | K341: 8 | L341: 18 | M341: =(K341*6)+L341 -> 66 | O341: 11 | P341: 21 | Q341: =(O341*6)+P341 -> 87
A342: BEST PLAYERS | W342: TEAM | X342: B | Y342: W | Z342: L | AA342: D | AB342: FOR | AC342: AGST | AD342: % | AE342: PTS
A343: TASMANIA | C343: THURLEY | F343: CRIPPS | I343: ATKIN | L343: DOERING | O343: GEAPPEN | Q343: CANN
A344: BENDIGO | C344: HALL | F344: ROSA | I344: CARTER | L344: LAYCOCK | O344: BULLEN | Q344: FORSTER-KNIGHT | W344: BOX HILL | Y344: 6 | Z344: 1 | AA344: 0 | AB344: 741 | AC344: 561 | AD344: =(AB344/AC344)*100 -> 132.08556149732621 | AE344: =(Y344*4)+(AA344*2) -> 24
A345: GOALKICKERS | W345: WILLIAMSTOWN | X345: 1 | Y345: 5 | Z345: 1 | AA345: 0 | AB345: 699 | AC345: 407 | AD345: =(AB345/AC345)*100 -> 171.74447174447175 | AE345: =(Y345*4)+(AA345*2) -> 20
A346: TASMANIA | C346: BARTLETT 3 | F346: CALLINAN 3 | I346: THURLEY 3 | L346: CANN | N346: CRIPPS | P346: HEATLEY | W346: PORT MELBOURNE | X346: 1 | Y346: 5 | Z346: 1 | AA346: 0 | AB346: 649 | AC346: 450 | AD346: =(AB346/AC346)*100 -> 144.22222222222223 | AE346: =(Y346*4)+(AA346*2) -> 20
A347: BENDIGO | C347: McGRATH 4 | F347: HAWKINS 2 | I347: WATSON 2 | L347: FORSTER-KNIGHT | P347: LOVETT-MURRAY | W347: SANDRINGHAM | X347: 1 | Y347: 4 | Z347: 2 | AA347: 0 | AB347: 572 | AC347: 458 | AD347: =(AB347/AC347)*100 -> 124.89082969432314 | AE347: =(Y347*4)+(AA347*2) -> 16
O348: WALSH | W348: SPRINGVALE | X348: 1 | Y348: 4 | Z348: 2 | AA348: 0 | AB348: 588 | AC348: 542 | AD348: =(AB348/AC348)*100 -> 108.4870848708487 | AE348: =(Y348*4)+(AA348*2) -> 16
A349: NORTHERN BULLANTS | C349: 7 | D349: 1 | E349: =(C349*6)+D349 -> 43 | G349: 8 | H349: 3 | I349: =(G349*6)+H349 -> 51 | K349: 18 | L349: 6 | M349: =(K349*6)+L349 -> 114 | O349: 19 | P349: 9 | Q349: =(O349*6)+P349 -> 123 | S349: Venue: PRESTON | W349: FRANKSTON | Y349: 4 | Z349: 3 | AA349: 0 | AB349: 595 | AC349: 554 | AD349: =(AB349/AC349)*100 -> 107.40072202166064 | AE349: =(Y349*4)+(AA349*2) -> 16
A350: WERRIBEE | C350: 5 | D350: 1 | E350: =(C350*6)+D350 -> 31 | G350: 9 | H350: 8 | I350: =(G350*6)+H350 -> 62 | K350: 11 | L350: 9 | M350: =(K350*6)+L350 -> 75 | O350: 15 | P350: 12 | Q350: =(O350*6)+P350 -> 102 | W350: GEELONG | X350: 1 | Y350: 3 | Z350: 3 | AA350: 0 | AB350: 590 | AC350: 616 | AD350: =(AB350/AC350)*100 -> 95.779220779220779 | AE350: =(Y350*4)+(AA350*2) -> 12
A351: BEST PLAYERS | W351: TASMANIA | X351: 1 | Y351: 2 | Z351: 3 | AA351: 1 | AB351: 613 | AC351: 504 | AD351: =(AB351/AC351)*100 -> 121.62698412698411 | AE351: =(Y351*4)+(AA351*2) -> 10
A352: NORTHERN BULLANTS | C352: RASO | F352: STINEAR | I352: NORMAN | L352: PLUNKETT | O352: SAUTNER
A353: WERRIBEE | C353: BRUNTON | F353: MICALIZZI | I353: HUDSON | W353: WERRIBEE | Y353: 2 | Z353: 5 | AA353: 0 | AB353: 606 | AC353: 825 | AD353: =(AB353/AC353)*100 -> 73.454545454545453 | AE353: =(Y353*4)+(AA353*2) -> 8
A354: GOALKICKERS | Q354: STEVENSON | W354: BENDIGO | X354: 1 | Y354: 1 | Z354: 4 | AA354: 1 | AB354: 521 | AC354: 627 | AD354: =(AB354/AC354)*100 -> 83.09409888357257 | AE354: =(Y354*4)+(AA354*2) -> 6
A355: NORTHERN BULLANTS | C355: SAUTNER 10 | F355: PLUNKETT 2 | I355: SIMPSON 2 | L355: GIBSON | N355: GUTTERSON | Q355: RAMSAY | S355: RASO | W355: NORTHERN BULLANTS | X355: 2 | Y355: 1 | Z355: 4 | AA355: 0 | AB355: 457 | AC355: 524 | AD355: =(AB355/AC355)*100 -> 87.213740458015266 | AE355: =(Y355*4)+(AA355*2) -> 4
A356: WERRIBEE | C356: MITCHELL 4 | F356: CONDOS 2 | I356: PICKEN 2 | K356: RAU 2 | M356: WIGGINS 2 | P356: CHURCHILL | R356: HUDSON | W356: COBURG | X356: 1 | Y356: 1 | Z356: 5 | AA356: 0 | AB356: 473 | AC356: 707 | AD356: =(AB356/AC356)*100 -> 66.902404526166904 | AE356: =(Y356*4)+(AA356*2) -> 4
D357: 18TH MAY | J357: WEATHER | Q357: SETCHELL | W357: NORTH BALLARAT | X357: 1 | Y357: 1 | Z357: 5 | AA357: 0 | AB357: 371 | AC357: 700 | AD357: =(AB357/AC357)*100 -> 53 | AE357: =(Y357*4)+(AA357*2) -> 4
A358: WILLIAMSTOWN | C358: 2 | D358: 3 | E358: =(C358*6)+D358 -> 15 | G358: 8 | H358: 5 | I358: =(G358*6)+H358 -> 53 | K358: 12 | L358: 5 | M358: =(K358*6)+L358 -> 77 | O358: 16 | P358: 10 | Q358: =(O358*6)+P358 -> 106 | S358: Venue: FRANKSTON
A359: FRANKSTON | C359: 3 | D359: 4 | E359: =(C359*6)+D359 -> 22 | G359: 5 | H359: 7 | I359: =(G359*6)+H359 -> 37 | K359: 7 | L359: 8 | M359: =(K359*6)+L359 -> 50 | O359: 7 | P359: 10 | Q359: =(O359*6)+P359 -> 52
A360: BEST PLAYERS
A361: WILLIAMSTOWN | C361: LLOYD | F361: McGOUGH | I361: C CLOKE | L361: MAHONEY | N361: KINNEAR | Q361: J CLOKE
A362: FRANKSTON | C362: GODDARD | F362: D CLARKE | I362: ROBERTS | L362: ODELL | N362: ABLETT
A363: GOALKICKERS
A364: WILLIAMSTOWN | C364: MAHONEY 3 | F364: RICHARDSON 3 | I364: SWAN 2 | K364: SCOTLAND 2 | N364: KINNEAR 2 | Q364: CRANAGE 2 | T364: BALDWIN | W364: PEARCE
A365: FRANKSTON | C365: HYNES 2 | F365: C CLARKE | I365: BLACK | K365: WINTERTON | N365: BEASY | P365: GEORGIOU
A367: BOX HILL | C367: 2 | D367: 6 | E367: =(C367*6)+D367 -> 18 | G367: 4 | H367: 9 | I367: =(G367*6)+H367 -> 33 | K367: 11 | L367: 16 | M367: =(K367*6)+L367 -> 82 | O367: 16 | P367: 22 | Q367: =(O367*6)+P367 -> 118 | S367: Venue: BOX HILL
A368: NORTH BALLARAT | C368: 1 | D368: 2 | E368: =(C368*6)+D368 -> 8 | G368: 4 | H368: 4 | I368: =(G368*6)+H368 -> 28 | K368: 7 | L368: 6 | M368: =(K368*6)+L368 -> 48 | O368: 9 | P368: 9 | Q368: =(O368*6)+P368 -> 63
A369: BEST PLAYERS
A370: BOX HILL | C370: BALL | F370: MITCHELL | I370: M SMITH | L370: CAMPBELL | O370: A COX | Q370: LONIE
A371: NORTH BALLARAT | C371: JENKINS | F371: MOLONEY | I371: SPOLDING | L371: JURICA | O371: GREIG | Q371: RUDD
A372: GOALKICKERS
A373: BOX HILL | C373: KENNA 3 | E373: LONIE 2 | G373: MITCHELL 2 | J373: BOYLE 2 | L373: ANDERSON | N373: BARKER | P373: CAMPBELL | R373: GRAHAM | V373: KANE | X373: SCOTT | AA373: WILLIAMS
A374: NORTH BALLARAT | C374: RUDD 2 | F374: WINTER | H374: O'KEEFE | J374: RYALL | L374: CLARK | N374: SPOLDING | Q374: MIDGLEY | S374: TURNER
A376: SANDRINGHAM | C376: 5 | D376: 7 | E376: =(C376*6)+D376 -> 37 | G376: 7 | H376: 9 | I376: =(G376*6)+H376 -> 51 | K376: 13 | L376: 13 | M376: =(K376*6)+L376 -> 91 | O376: 14 | P376: 17 | Q376: =(O376*6)+P376 -> 101 | S376: Venue: BEACH ROAD
A377: COBURG | C377: 0 | D377: 2 | E377: =(C377*6)+D377 -> 2 | G377: 3 | H377: 5 | I377: =(G377*6)+H377 -> 23 | K377: 6 | L377: 5 | M377: =(K377*6)+L377 -> 41 | O377: 7 | P377: 11 | Q377: =(O377*6)+P377 -> 53
A378: BEST PLAYERS
A379: SANDRINGHAM | C379: LIDDELL | F379: LAMB | I379: GALAGHER | L379: POYAS | O379: ROBBINS | R379: CLARKE
A380: COBURG | C380: STEINFORT | F380: GIESCHEN | I380: SHULZ | L380: PICKERING
A381: GOALKICKERS
A382: SANDRINGHAM | C382: HAYNES 2 | E382: ROBBINS 2 | H382: POYAS 2 | J382: RIVERS 2 | L382: LIDDELL 2 | N382: TREGEAR | P382: GALLAGHER | S382: MOLAN | V382: CLARKE
A383: COBURG | C383: McGRATH 2 | F383: WHYMAN | I383: PICKERING | L383: KURET | N383: TAYLOR | P383: HART
A385: PORT MELBOURNE | C385: 2 | D385: 1 | E385: =(C385*6)+D385 -> 13 | G385: 5 | H385: 6 | I385: =(G385*6)+H385 -> 36 | K385: 12 | L385: 9 | M385: =(K385*6)+L385 -> 81 | O385: 15 | P385: 18 | Q385: =(O385*6)+P385 -> 108 | S385: Venue: PORT MELBOURNE
A386: SPRINGVALE | C386: 3 | D386: 3 | E386: =(C386*6)+D386 -> 21 | G386: 8 | H386: 4 | I386: =(G386*6)+H386 -> 52 | K386: 10 | L386: 8 | M386: =(K386*6)+L386 -> 68 | O386: 12 | P386: 9 | Q386: =(O386*6)+P386 -> 81
A387: BEST PLAYERS
A388: PORT MELBOURNE | C388: HARRIS | F388: SMITH | I388: MCMAHON | L388: CLAYTON | O388: ROSE | R388: D MOTLOP
A389: SPRINGVALE | C389: FERGUSON | F389: CARROLL | I389: PITT | L389: BROOKS | O389: MONTAGNA | R389: T SCHWARZE
A390: GOALKICKERS
A391: PORT MELBOURNE | C391: CLAYTON 4 | F391: D MOTLOP 2 | I391: D HARRIS 2 | L391: ROCCA 2 | N391: McINTOSH | Q391: WELLS | S391: McMAHON | W391: HALE | X391: COTCHETT
A392: SPRINGVALE | C392: PITT 3 | F392: KNOBEL 2 | I392: T SCHWARZE 2 | L392: MONTAGNA 2 | O392: B SCHWARZE | R392: MURRAY | U392: BROOKS
A394: BYE | D394: GEELONG
A396: ROUND 8 | D396: 24TH MAY | G396: NIGHT MATCH | J396: WEATHER
D397: 1ST QTR | H397: 2ND QTR | L397: 3RD QTR | P397: FINAL | S397: Venue: YORK PARK (Launceston)
A398: SANDRINGHAM | C398: 2 | D398: 4 | E398: =(C398*6)+D398 -> 16 | G398: 5 | H398: 7 | I398: =(G398*6)+H398 -> 37 | K398: 9 | L398: 10 | M398: =(K398*6)+L398 -> 64 | O398: 10 | P398: 14 | Q398: =(O398*6)+P398 -> 74 | S398: UMPIRES | Z398: LADDER | AC398: ROUND | AE398: 8
A399: TASMANIA | C399: 2 | D399: 1 | E399: =(C399*6)+D399 -> 13 | G399: 5 | H399: 3 | I399: =(G399*6)+H399 -> 33 | K399: 8 | L399: 3 | M399: =(K399*6)+L399 -> 51 | O399: 11 | P399: 6 | Q399: =(O399*6)+P399 -> 72
A400: BEST PLAYERS | W400: TEAM | X400: B | Y400: W | Z400: L | AA400: D | AB400: FOR | AC400: AGST | AD400: % | AE400: PTS
A401: SANDRINGHAM | C401: ROBBINS | F401: POYAS | I401: HAYNES | L401: TREGEAR | O401: J RADFORD | R401: WALSH
A402: TASMANIA | C402: CALLINAN | F402: THURLEY | I402: HOWARD | L402: KIRK | O402: DOERING | R402: T GEAPPEN | W402: BOX HILL | Y402: 7 | Z402: 1 | AA402: 0 | AB402: 861 | AC402: 672 | AD402: =(AB402/AC402)*100 -> 128.125 | AE402: =(Y402*4)+(AA402*2) -> 28
A403: GOALKICKERS | W403: WILLIAMSTOWN | X403: 1 | Y403: 6 | Z403: 1 | AA403: 0 | AB403: 816 | AC403: 521 | AD403: =(AB403/AC403)*100 -> 156.6218809980806 | AE403: =(Y403*4)+(AA403*2) -> 24
A404: SANDRINGHAM | C404: MOLAN 3 | F404: MOORCROFT 2 | J404: RIVERS 2 | M404: BELL | N404: BREESE | P404: HAYNES | W404: PORT MELBOURNE | X404: 1 | Y404: 6 | Z404: 1 | AA404: 0 | AB404: 748 | AC404: 534 | AD404: =(AB404/AC404)*100 -> 140.07490636704119 | AE404: =(Y404*4)+(AA404*2) -> 24
A405: TASMANIA | C405: DERBYSHIRE 3 | F405: CALLINAN 2 | I405: ROBINSON 2 | L405: THURLEY 2 | O405: BEAMS | Q405: SAVAGE | W405: SANDRINGHAM | X405: 1 | Y405: 5 | Z405: 2 | AA405: 0 | AB405: 646 | AC405: 530 | AD405: =(AB405/AC405)*100 -> 121.88679245283018 | AE405: =(Y405*4)+(AA405*2) -> 20
W406: SPRINGVALE | X406: 1 | Y406: 4 | Z406: 3 | AA406: 0 | AB406: 702 | AC406: 659 | AD406: =(AB406/AC406)*100 -> 106.52503793626707 | AE406: =(Y406*4)+(AA406*2) -> 16
A407: BOX HILL | C407: 7 | D407: 1 | E407: =(C407*6)+D407 -> 43 | G407: 10 | H407: 2 | I407: =(G407*6)+H407 -> 62 | K407: 15 | L407: 4 | M407: =(K407*6)+L407 -> 94 | O407: 19 | P407: 6 | Q407: =(O407*6)+P407 -> 120 | S407: Venue: SHELL STADIUM | W407: FRANKSTON | Y407: 4 | Z407: 4 | AA407: 0 | AB407: 669 | AC407: 665 | AD407: =(AB407/AC407)*100 -> 100.6015037593985 | AE407: =(Y407*4)+(AA407*2) -> 16
A408: GEELONG | C408: 3 | D408: 1 | E408: =(C408*6)+D408 -> 19 | G408: 7 | H408: 2 | I408: =(G408*6)+H408 -> 44 | K408: 13 | L408: 3 | M408: =(K408*6)+L408 -> 81 | O408: 18 | P408: 3 | Q408: =(O408*6)+P408 -> 111 | W408: GEELONG | X408: 1 | Y408: 3 | Z408: 4 | AA408: 0 | AB408: 701 | AC408: 736 | AD408: =(AB408/AC408)*100 -> 95.244565217391312 | AE408: =(Y408*4)+(AA408*2) -> 12
A409: BEST PLAYERS | W409: TASMANIA | X409: 1 | Y409: 2 | Z409: 4 | AA409: 1 | AB409: 685 | AC409: 578 | AD409: =(AB409/AC409)*100 -> 118.5121107266436 | AE409: =(Y409*4)+(AA409*2) -> 10
A410: BOX HILL | C410: PICIANOE | F410: CLARKE | I410: SMITH | L410: CAMPBELL | O410: SEWELL | R410: BOYLE
A411: GEELONG | C411: PLAYFAIR | F411: GRGIC | I411: LONERGAN | L411: BYRNES | O411: CALLAN | R411: KINGSLEY | W411: NORTHERN BULLANTS | X411: 2 | Y411: 2 | Z411: 4 | AA411: 0 | AB411: 568 | AC411: 598 | AD411: =(AB411/AC411)*100 -> 94.983277591973248 | AE411: =(Y411*4)+(AA411*2) -> 8
A412: GOALKICKERS | W412: WERRIBEE | Y412: 2 | Z412: 6 | AA412: 0 | AB412: 690 | AC412: 924 | AD412: =(AB412/AC412)*100 -> 74.675324675324674 | AE412: =(Y412*4)+(AA412*2) -> 8
A413: BOX HILL | C413: BARKER 4 | E413: BOYLE 3 | G413: KENNA 3 | I413: ANDERSON 2 | L413: CLARKE 2 | N413: LADSON 2 | Q413: PICIAONE 2 | T413: BALL | W413: NORTH BALLARAT | X413: 1 | Y413: 2 | Z413: 5 | AA413: 0 | AB413: 482 | AC413: 790 | AD413: =(AB413/AC413)*100 -> 61.012658227848107 | AE413: =(Y413*4)+(AA413*2) -> 8
A414: GEELONG | C414: KINGSLEY 5 | F414: LONERGAN 3 | I414: MACKIE 3 | K414: BARTEL | M414: BYRNES | O414: COOK | Q414: JOHNSON | S414: PLAYFAIR | W414: BENDIGO | X414: 1 | Y414: 1 | Z414: 5 | AA414: 1 | AB414: 611 | AC414: 738 | AD414: =(AB414/AC414)*100 -> 82.791327913279133 | AE414: =(Y414*4)+(AA414*2) -> 6
O415: RAHILLY | R415: STREET | W415: COBURG | X415: 2 | Y415: 1 | Z415: 5 | AA415: 0 | AB415: 473 | AC415: 707 | AD415: =(AB415/AC415)*100 -> 66.902404526166904 | AE415: =(Y415*4)+(AA415*2) -> 4
A416: NORTHERN BULLANTS | C416: 4 | D416: 2 | E416: =(C416*6)+D416 -> 26 | G416: 6 | H416: 3 | I416: =(G416*6)+H416 -> 39 | K416: 10 | L416: 8 | M416: =(K416*6)+L416 -> 68 | O416: 17 | P416: 9 | Q416: =(O416*6)+P416 -> 111 | S416: Venue: PRESTON
A417: FRANKSTON | C417: 3 | D417: 1 | E417: =(C417*6)+D417 -> 19 | G417: 5 | H417: 4 | I417: =(G417*6)+H417 -> 34 | K417: 9 | L417: 6 | M417: =(K417*6)+L417 -> 60 | O417: 11 | P417: 8 | Q417: =(O417*6)+P417 -> 74
A418: BEST PLAYERS
A419: NORTHERN BULLANTS | C419: FRANCHINA | F419: MERRINGTON | I419: ALLAN | K419: MANTON | N419: PLUNKETT | Q419: RASO
A420: FRANKSTON | C420: LYON | F420: ROBERTS | I420: ABLETT | K420: GODDARD | N420: OGIER
A421: GOALKICKERS
A422: NORTHERN BULLANTS | C422: SAUTNER 6 | F422: WIGGINS 4 | I422: ALLAN 3 | K422: GUTTERSON 3 | N422: PLUNKETT
A423: FRANKSTON | C423: HYNES 2 | E423: OGIER 2 | G423: BUTLER | I423: BREWSTER | L423: KEMPERMAN | O423: McCORMACK | R423: WINTERTON | V423: WINTERS-KERR | Y423: WHITE
A425: PORT MELBOURNE | C425: 1 | D425: 5 | E425: =(C425*6)+D425 -> 11 | G425: 7 | H425: 10 | I425: =(G425*6)+H425 -> 52 | K425: 12 | L425: 17 | M425: =(K425*6)+L425 -> 89 | O425: 13 | P425: 21 | Q425: =(O425*6)+P425 -> 99 | S425: Venue: PORT MELBOURNE
A426: WERRIBEE | C426: 6 | D426: 3 | E426: =(C426*6)+D426 -> 39 | G426: 6 | H426: 7 | I426: =(G426*6)+H426 -> 43 | K426: 7 | L426: 10 | M426: =(K426*6)+L426 -> 52 | O426: 12 | P426: 12 | Q426: =(O426*6)+P426 -> 84
A427: BEST PLAYERS
A428: PORT MELBOURNE | C428: McCARTNEY | F428: CLAYTON | I428: ROSE | K428: D MOTLOP | N428: BOURKE | Q428: COTCHETT
A429: WERRIBEE | C429: EAGLETON | F429: CROSS | I429: HUDSON | K429: KRETIUK | N429: ANTONOWICZ | Q429: SKIPPER
A430: GOALKICKERS
A431: PORT MELBOURNE | C431: BOURKE 2 | F431: CLAYTON 2 | I431: HALE 2 | K431: C ALLEWAY | N431: ALOI | P431: DELUCA | R431: FIRRITO | U431: ROSE | W431: STEVENS | Y431: URCH
A432: WERRIBEE | C432: CONDOS 3 | F432: MITCHELL 3 | I432: HUDSON 2 | L432: COLBERT | N432: EAGLETON | Q432: KRETIUK | S432: SKIPPER
D433: 25TH MAY | J433: WEATHER
A434: NORTH BALLARAT | C434: 3 | D434: 5 | E434: =(C434*6)+D434 -> 23 | G434: 9 | H434: 8 | I434: =(G434*6)+H434 -> 62 | K434: 12 | L434: 12 | M434: =(K434*6)+L434 -> 84 | O434: 16 | P434: 15 | Q434: =(O434*6)+P434 -> 111 | S434: Venue: NORTH BALLARAT
A435: BENDIGO | C435: 3 | D435: 3 | E435: =(C435*6)+D435 -> 21 | G435: 4 | H435: 9 | I435: =(G435*6)+H435 -> 33 | K435: 6 | L435: 11 | M435: =(K435*6)+L435 -> 47 | O435: 13 | P435: 12 | Q435: =(O435*6)+P435 -> 90
A436: BEST PLAYERS
A437: NORTH BALLARAT | C437: JURICA | F437: JENKINS | I437: FIELD | K437: SAUNDERS | N437: O'KEEFE | Q437: MOLONEY
A438: BENDIGO | C438: T MCGRATH | F438: HARVEY | I438: DAVIES | K438: CARTER | N438: ROSA
A439: GOALKICKERS
A440: NORTH BALLARAT | C440: O'KEEFE 4 | F440: SAUNDERS 3 | I440: RUDD 3 | K440: CLARK 2 | M440: McCORKELL | P440: MIDGLEY | R440: SPOLDING | V440: WINTER
A441: BENDIGO | C441: HARVEY 3 | F441: HUNT 2 | I441: ROSA 2 | K441: WATSON 2 | N441: CAIL | P441: EATON | R441: FORSTER-KNIGHT | X441: LOVETT-MURRAY
A443: WILLIAMSTOWN | C443: 5 | D443: 5 | E443: =(C443*6)+D443 -> 35 | G443: 10 | H443: 8 | I443: =(G443*6)+H443 -> 68 | K443: 12 | L443: 14 | M443: =(K443*6)+L443 -> 86 | O443: 17 | P443: 15 | Q443: =(O443*6)+P443 -> 117 | S443: Venue: SPRINGVALE
A444: SPRINGVALE | C444: 3 | D444: 1 | E444: =(C444*6)+D444 -> 19 | G444: 10 | H444: 3 | I444: =(G444*6)+H444 -> 63 | K444: 14 | L444: 4 | M444: =(K444*6)+L444 -> 88 | O444: 18 | P444: 6 | Q444: =(O444*6)+P444 -> 114
A445: BEST PLAYERS
A446: WILLIAMSTOWN | C446: RICHARDSON | F446: BETHERAS | I446: KINNEAR | L446: SCOTLAND | O446: SHACKLETON | R446: MAHONEY
A447: SPRINGVALE | C447: PITT | F447: HARRISON | I447: MONTAGNA | L447: CARROLL | O447: MURRAY | R447: MOYLE
A448: GOALKICKERS
A449: WILLIAMSTOWN | C449: RICHARDSON 5 | F449: BALDWIN 3 | I449: MAHONEY 3 | L449: KINNEAR 2 | N449: CRANAGE | Q449: FLETCHER | U449: SHACKLETON | X449: RUNNALLS
A450: SPRINGVALE | C450: MONTAGNA 4 | F450: MURRAY 4 | I450: PITT 3 | K450: HOULIHAN 2 | N450: KNOBEL 2 | Q450: CALLAGHAN | U450: HARRISON | X450: MOYLE
A452: BYE | D452: COBURG
A454: ROUND 9 | D454: 31ST MAY | J454: WEATHER
D455: 1ST QTR | H455: 2ND QTR | L455: 3RD QTR | P455: FINAL | S455: Venue: BENDIGO
A456: NORTHERN BULLANTS | C456: 6 | D456: 4 | E456: =(C456*6)+D456 -> 40 | G456: 12 | H456: 7 | I456: =(G456*6)+H456 -> 79 | K456: 18 | L456: 12 | M456: =(K456*6)+L456 -> 120 | O456: 25 | P456: 12 | Q456: =(O456*6)+P456 -> 162 | S456: UMPIRES | Z456: LADDER | AC456: ROUND | AE456: 9
A457: BENDIGO | C457: 4 | D457: 3 | E457: =(C457*6)+D457 -> 27 | G457: 7 | H457: 4 | I457: =(G457*6)+H457 -> 46 | K457: 7 | L457: 11 | M457: =(K457*6)+L457 -> 53 | O457: 12 | P457: 15 | Q457: =(O457*6)+P457 -> 87
A458: BEST PLAYERS | W458: TEAM | X458: B | Y458: W | Z458: L | AA458: D | AB458: FOR | AC458: AGST | AD458: % | AE458: PTS
A459: NORTHERN BULLANTS | C459: PENN | F459: SIMPSON | I459: ECCLES | L459: RASO | N459: GIBSON | Q459: FRANCHINA
A460: BENDIGO | C460: HUNT | F460: O'KEEFE | I460: LAYCOCK | L460: HARVEY | N460: CAIL | W460: BOX HILL | Y460: 8 | Z460: 1 | AA460: 0 | AB460: 942 | AC460: 738 | AD460: =(AB460/AC460)*100 -> 127.64227642276423 | AE460: =(Y460*4)+(AA460*2) -> 32
A461: GOALKICKERS | D461: MERRINGTON 2 | G461: SIMPSON 2 | J461: STINEAR 2 | M461: ECCLES | O461: GIBSON | Q461: HEDGE | S461: ZORZI | W461: WILLIAMSTOWN | X461: 1 | Y461: 7 | Z461: 1 | AA461: 0 | AB461: 921 | AC461: 583 | AD461: =(AB461/AC461)*100 -> 157.97598627787306 | AE461: =(Y461*4)+(AA461*2) -> 28
A462: NORTHERN BULLANTS | C462: CAMPBELL 3 | F462: LIVINGSTONE 3 | I462: PENN 3 | K462: BEASY 2 | M462: FRANCHINA 2 | P462: GUTTERSON 2 | W462: PORT MELBOURNE | X462: 1 | Y462: 7 | Z462: 1 | AA462: 0 | AB462: 836 | AC462: 571 | AD462: =(AB462/AC462)*100 -> 146.40980735551662 | AE462: =(Y462*4)+(AA462*2) -> 28
A463: BENDIGO | C463: LAYCOCK 3 | F463: M BROWN 2 | I463: HARVEY 2 | L463: ROSA 2 | N463: O'KEEFE | P463: WUNDERLICH | S463: WALSH | W463: SANDRINGHAM | X463: 1 | Y463: 6 | Z463: 2 | AA463: 0 | AB463: 728 | AC463: 600 | AD463: =(AB463/AC463)*100 -> 121.33333333333334 | AE463: =(Y463*4)+(AA463*2) -> 24
W464: SPRINGVALE | X464: 1 | Y464: 4 | Z464: 4 | AA464: 0 | AB464: 768 | AC464: 740 | AD464: =(AB464/AC464)*100 -> 103.78378378378379 | AE464: =(Y464*4)+(AA464*2) -> 16
A465: BOX HILL | C465: 3 | D465: 1 | E465: =(C465*6)+D465 -> 19 | G465: 6 | H465: 6 | I465: =(G465*6)+H465 -> 42 | K465: 6 | L465: 8 | M465: =(K465*6)+L465 -> 44 | O465: 11 | P465: 15 | Q465: =(O465*6)+P465 -> 81 | S465: Venue: SPRINGVALE | W465: GEELONG | X465: 1 | Y465: 4 | Z465: 4 | AA465: 0 | AB465: 794 | AC465: 816 | AD465: =(AB465/AC465)*100 -> 97.303921568627445 | AE465: =(Y465*4)+(AA465*2) -> 16
A466: SPRINGVALE | C466: 3 | D466: 6 | E466: =(C466*6)+D466 -> 24 | G466: 5 | H466: 8 | I466: =(G466*6)+H466 -> 38 | K466: 8 | L466: 14 | M466: =(K466*6)+L466 -> 62 | O466: 8 | P466: 18 | Q466: =(O466*6)+P466 -> 66 | W466: FRANKSTON | Y466: 4 | Z466: 5 | AA466: 0 | AB466: 706 | AC466: 753 | AD466: =(AB466/AC466)*100 -> 93.758300132802134 | AE466: =(Y466*4)+(AA466*2) -> 16
A467: BEST PLAYERS | W467: NORTHERN BULLANTS | X467: 2 | Y467: 3 | Z467: 4 | AA467: 0 | AB467: 730 | AC467: 685 | AD467: =(AB467/AC467)*100 -> 106.56934306569343 | AE467: =(Y467*4)+(AA467*2) -> 12
A468: BOX HILL | C468: GEORGIADIS | F468: WILLIAMS | I468: STONE | L468: CAMPBELL | N468: CLARKE | Q468: GRAHAM
A469: SPRINGVALE | C469: BARHAM | F469: MOYLE | I469: HARRISON | L469: BROOKS | N469: MILLER | Q469: CARROLL | W469: TASMANIA | X469: 1 | Y469: 2 | Z469: 5 | AA469: 1 | AB469: 765 | AC469: 671 | AD469: =(AB469/AC469)*100 -> 114.00894187779433 | AE469: =(Y469*4)+(AA469*2) -> 10
A470: GOALKICKERS | W470: WERRIBEE | X470: 1 | Y470: 2 | Z470: 6 | AA470: 0 | AB470: 690 | AC470: 924 | AD470: =(AB470/AC470)*100 -> 74.675324675324674 | AE470: =(Y470*4)+(AA470*2) -> 8
A471: BOX HILL | C471: KENNA 3 | F471: WILLIAMS 2 | I471: ANDERSON | K471: BARKER | M471: A COX | O471: HARFORD | Q471: JOHNSON | S471: SEWELL | W471: NORTH BALLARAT | X471: 1 | Y471: 2 | Z471: 6 | AA471: 0 | AB471: 552 | AC471: 872 | AD471: =(AB471/AC471)*100 -> 63.302752293577981 | AE471: =(Y471*4)+(AA471*2) -> 8
A472: SPRINGVALE | C472: HOULIHAN 2 | F472: MOTT 2 | I472: BLAKE | K472: FISHER | M472: PITT | O472: B SCHWARZE | W472: BENDIGO | X472: 1 | Y472: 1 | Z472: 6 | AA472: 1 | AB472: 698 | AC472: 900 | AD472: =(AB472/AC472)*100 -> 77.555555555555557 | AE472: =(Y472*4)+(AA472*2) -> 6
D473: 1ST JUNE | J473: WEATHER | W473: COBURG | X473: 2 | Y473: 1 | Z473: 6 | AA473: 0 | AB473: 535 | AC473: 812 | AD473: =(AB473/AC473)*100 -> 65.886699507389153 | AE473: =(Y473*4)+(AA473*2) -> 4
A474: WILLIAMSTOWN | C474: 3 | D474: 2 | E474: =(C474*6)+D474 -> 20 | G474: 7 | H474: 3 | I474: =(G474*6)+H474 -> 45 | K474: 14 | L474: 7 | M474: =(K474*6)+L474 -> 91 | O474: 16 | P474: 9 | Q474: =(O474*6)+P474 -> 105 | S474: Venue: WILLIAMSTOWN
A475: COBURG | C475: 2 | D475: 4 | E475: =(C475*6)+D475 -> 16 | G475: 4 | H475: 4 | I475: =(G475*6)+H475 -> 28 | K475: 6 | L475: 4 | M475: =(K475*6)+L475 -> 40 | O475: 9 | P475: 8 | Q475: =(O475*6)+P475 -> 62
A476: BEST PLAYERS
A477: WILLIAMSTOWN | C477: SCOTLAND | F477: RICHARDSON | I477: SWAN | K477: FLETCHER | N477: FREEBORN | Q477: BETHERAS
A478: COBURG | C478: STEINFORT | F478: HART | I478: BIDDISCOMBE | L478: PETTIFER | N478: HOLLAND
A479: GOALKICKERS
A480: WILLIAMSTOWN | C480: RICHARDSON 5 | F480: KINNEAR 3 | I480: BALDWIN 2 | L480: MAHONEY 2 | O480: BETHERAS | R480: RUNNALLS | V480: SMOKER | X480: SHACKLETON
A481: COBURG | C481: MOORE 2 | F481: SCHULTZ 2 | I481: BIDDISCOMBE | L481: FLAHERTY | N481: GEISCHEN | Q481: HART | R481: McGRATH
A483: GEELONG | C483: 5 | D483: 6 | E483: =(C483*6)+D483 -> 36 | G483: 7 | H483: 10 | I483: =(G483*6)+H483 -> 52 | K483: 11 | L483: 13 | M483: =(K483*6)+L483 -> 79 | O483: 13 | P483: 15 | Q483: =(O483*6)+P483 -> 93 | S483: Venue: SHELL STADIUM (C/R)
A484: TASMANIA | C484: 3 | D484: 1 | E484: =(C484*6)+D484 -> 19 | G484: 6 | H484: 5 | I484: =(G484*6)+H484 -> 41 | K484: 9 | L484: 7 | M484: =(K484*6)+L484 -> 61 | O484: 12 | P484: 8 | Q484: =(O484*6)+P484 -> 80
A485: BEST PLAYERS
A486: GEELONG | C486: LONERGAN | F486: CALLAN | I486: S JOHNSON | L486: STREET | N486: CARAZZO | Q486: MACKIE
A487: TASMANIA | C487: KIRK | F487: CANN | I487: CALLINAN | L487: HOWARD | N487: ROBINSON | Q487: CRIPPS
A488: GOALKICKERS
A489: GEELONG | C489: LONERGAN 5 | F489: FINNIN 2 | I489: BARTEL | K489: BRIGHT | M489: BYRNES | O489: S JOHNSON | R489: KINGSLEY | V489: MACKIE
A490: TASMANIA | C490: CALLINAN 3 | F490: STEPHENS 2 | I490: ATKIN | K490: CANN | M490: DERBYSHIRE | P490: DOERING | R490: KIRK | U490: ROBINSON | X490: THURLEY
A492: SANDRINGHAM | C492: 5 | D492: 6 | E492: =(C492*6)+D492 -> 36 | G492: 6 | H492: 10 | I492: =(G492*6)+H492 -> 46 | K492: 8 | L492: 13 | M492: =(K492*6)+L492 -> 61 | O492: 11 | P492: 16 | Q492: =(O492*6)+P492 -> 82 | S492: Venue: NORTH BALLARAT
A493: NORTH BALLARAT | C493: 1 | D493: 2 | E493: =(C493*6)+D493 -> 8 | G493: 2 | H493: 5 | I493: =(G493*6)+H493 -> 17 | K493: 5 | L493: 7 | M493: =(K493*6)+L493 -> 37 | O493: 10 | P493: 10 | Q493: =(O493*6)+P493 -> 70
A494: BEST PLAYERS
A495: SANDRINGHAM | C495: GALLAGHER | F495: WALSH | I495: J RADFORD | L495: ROBBINS | O495: FERRARO | R495: LYNCH
A496: NORTH BALLARAT | C496: JURICA | F496: GREIG | I496: MIDGLEY | L496: SPOLDING | O496: COOK | R496: McCORKELL
A497: GOALKICKERS
A498: SANDRINGHAM | C498: HAYNES 3 | F498: MOLAN 2 | I498: BREESE | K498: CLARKE | M498: GALLAGHER | P498: HUNTER | R498: LYNCH | U498: ROBBINS
A499: NORTH BALLARAT | C499: MIDGLEY 2 | F499: SPOLDING 2 | I499: GREIG | K499: JURICA | M499: McCORKELL | P499: O'KEEFE | R499: SAUNDERS | V499: WINTER
A501: PORT MELBOURNE | C501: 5 | D501: 3 | E501: =(C501*6)+D501 -> 33 | G501: 7 | H501: 6 | I501: =(G501*6)+H501 -> 48 | K501: 10 | L501: 9 | M501: =(K501*6)+L501 -> 69 | O501: 12 | P501: 16 | Q501: =(O501*6)+P501 -> 88 | S501: Venue: FRANKSTON
A502: FRANKSTON | C502: 0 | D502: 1 | E502: =(C502*6)+D502 -> 1 | G502: 1 | H502: 1 | I502: =(G502*6)+H502 -> 7 | K502: 3 | L502: 5 | M502: =(K502*6)+L502 -> 23 | O502: 5 | P502: 7 | Q502: =(O502*6)+P502 -> 37
A503: BEST PLAYERS
A504: PORT MELBOURNE | C504: HALE | F504: FIRRITO | I504: ROSE | L504: ROBBINS | O504: STEVENS | R504: D MOTLOP
A505: FRANKSTON | C505: GEORGIOU | F505: ABLETT | I505: ROBERTS | L505: ODELL | O505: C CLARKE | R505: BREWSTER
A506: GOALKICKERS
A507: PORT MELBOURNE | C507: ALOI 2 | F507: CLAYTON 2 | I507: CROWE 2 | K507: PORTER 2 | M507: ALLEWAY | P507: BOURKE | R507: EVANS | T507: HALE
A508: FRANKSTON | C508: BROWN 2 | F508: SHIPP 2 | I508: McCORMACK
A510: BYE | D510: WERRIBEE
A512: ROUND 10 | D512: 7TH JUNE | J512: WEATHER
D513: 1ST QTR | H513: 2ND QTR | L513: 3RD QTR | P513: FINAL | S513: Venue: PRESTON
A514: NORTHERN BULLANTS | C514: 5 | D514: 4 | E514: =(C514*6)+D514 -> 34 | G514: 7 | H514: 6 | I514: =(G514*6)+H514 -> 48 | K514: 8 | L514: 7 | M514: =(K514*6)+L514 -> 55 | O514: 14 | P514: 12 | Q514: =(O514*6)+P514 -> 96 | S514: UMPIRES | Z514: LADDER | AC514: ROUND | AE514: 10
A515: GEELONG | C515: 2 | D515: 2 | E515: =(C515*6)+D515 -> 14 | G515: 8 | H515: 5 | I515: =(G515*6)+H515 -> 53 | K515: 11 | L515: 11 | M515: =(K515*6)+L515 -> 77 | O515: 12 | P515: 13 | Q515: =(O515*6)+P515 -> 85
A516: BEST PLAYERS | W516: TEAM | X516: B | Y516: W | Z516: L | AA516: D | AB516: FOR | AC516: AGST | AD516: % | AE516: PTS
A517: NORTHERN BULLANTS | C517: LIVINGSTONE | F517: RASO | I517: MANTON | L517: WATSON | O517: ALLAN | Q517: SAUTNER
A518: GEELONG | C518: CALLAN | F518: CARAZZO | I518: STREET | L518: BARTEL | O518: WOOLNOUGH | W518: BOX HILL | Y518: 9 | Z518: 1 | AA518: 0 | AB518: 1058 | AC518: 774 | AD518: =(AB518/AC518)*100 -> 136.69250645994833 | AE518: =(Y518*4)+(AA518*2) -> 36
A519: GOALKICKERS | W519: PORT MELBOURNE | X519: 1 | Y519: 8 | Z519: 1 | AA519: 0 | AB519: 944 | AC519: 620 | AD519: =(AB519/AC519)*100 -> 152.25806451612902 | AE519: =(Y519*4)+(AA519*2) -> 32
A520: NORTHERN BULLANTS | C520: SAUTNER 5 | F520: FRANCHINA 3 | I520: GIBSON 2 | L520: ALLAN | N520: HEDGE | P520: MERRINGTON | S520: MURPHY | W520: WILLIAMSTOWN | X520: 1 | Y520: 8 | Z520: 1 | AA520: 0 | AB520: 1044 | AC520: 687 | AD520: =(AB520/AC520)*100 -> 151.96506550218339 | AE520: =(Y520*4)+(AA520*2) -> 32
A521: GEELONG | C521: S JOHNSON 3 | F521: LONERGAN 3 | I521: GARDINER 2 | L521: PLAYFAIR 2 | O521: CLARKE | Q521: MOLONEY | W521: SANDRINGHAM | X521: 1 | Y521: 6 | Z521: 3 | AA521: 0 | AB521: 832 | AC521: 723 | AD521: =(AB521/AC521)*100 -> 115.07607192254494 | AE521: =(Y521*4)+(AA521*2) -> 24
W522: SPRINGVALE | X522: 1 | Y522: 5 | Z522: 4 | AA522: 0 | AB522: 866 | AC522: 812 | AD522: =(AB522/AC522)*100 -> 106.65024630541873 | AE522: =(Y522*4)+(AA522*2) -> 20
A523: PORT MELBOURNE | C523: 3 | D523: 3 | E523: =(C523*6)+D523 -> 21 | G523: 7 | H523: 7 | I523: =(G523*6)+H523 -> 49 | K523: 12 | L523: 8 | M523: =(K523*6)+L523 -> 80 | O523: 16 | P523: 12 | Q523: =(O523*6)+P523 -> 108 | S523: Venue: COBURG | W523: NORTHERN BULLANTS | X523: 2 | Y523: 4 | Z523: 4 | AA523: 0 | AB523: 826 | AC523: 770 | AD523: =(AB523/AC523)*100 -> 107.27272727272728 | AE523: =(Y523*4)+(AA523*2) -> 16
A524: COBURG | C524: 2 | D524: 2 | E524: =(C524*6)+D524 -> 14 | G524: 4 | H524: 2 | I524: =(G524*6)+H524 -> 26 | K524: 7 | L524: 5 | M524: =(K524*6)+L524 -> 47 | O524: 7 | P524: 7 | Q524: =(O524*6)+P524 -> 49 | W524: GEELONG | X524: 1 | Y524: 4 | Z524: 5 | AA524: 0 | AB524: 879 | AC524: 912 | AD524: =(AB524/AC524)*100 -> 96.381578947368425 | AE524: =(Y524*4)+(AA524*2) -> 16
A525: BEST PLAYERS | W525: FRANKSTON | X525: 1 | Y525: 4 | Z525: 5 | AA525: 0 | AB525: 706 | AC525: 753 | AD525: =(AB525/AC525)*100 -> 93.758300132802134 | AE525: =(Y525*4)+(AA525*2) -> 16
A526: PORT MELBOURNE | C526: CROWE | F526: SMITH | H526: FIRRITO | K526: ROSE | N526: COTCHETT | Q526: S MOTLOP
A527: COBURG | C527: CARLSON | F527: HART | H527: DRAGICEVIC | K527: STEINFORT | N527: PETTIFER | Q527: D KELLAWAY | W527: WERRIBEE | X527: 1 | Y527: 3 | Z527: 6 | AA527: 0 | AB527: 803 | AC527: 1002 | AD527: =(AB527/AC527)*100 -> 80.139720558882232 | AE527: =(Y527*4)+(AA527*2) -> 12
A528: GOALKICKERS | N528: FIRRITO | P528: McINTOSH | R528: S MOTLOP | W528: TASMANIA | X528: 1 | Y528: 2 | Z528: 6 | AA528: 1 | AB528: 837 | AC528: 769 | AD528: =(AB528/AC528)*100 -> 108.84265279583876 | AE528: =(Y528*4)+(AA528*2) -> 10
A529: PORT MELBOURNE | C529: J CLAYTON 3 | F529: BOURKE 3 | I529: ALLEWAY 2 | L529: McMAHON 2 | O529: D MOTLOP 2 | R529: BURCH | W529: NORTH BALLARAT | X529: 1 | Y529: 2 | Z529: 7 | AA529: 0 | AB529: 630 | AC529: 985 | AD529: =(AB529/AC529)*100 -> 63.959390862944169 | AE529: =(Y529*4)+(AA529*2) -> 8
A530: COBURG | C530: FLAHERTY 2 | F530: D KELLAWAY | I530: MOORE | K530: PETTIFER | M530: BIDDISCOMBE | P530: VARDY | W530: BENDIGO | X530: 1 | Y530: 1 | Z530: 7 | AA530: 1 | AB530: 734 | AC530: 1016 | AD530: =(AB530/AC530)*100 -> 72.244094488188978 | AE530: =(Y530*4)+(AA530*2) -> 6
W531: COBURG | X531: 2 | Y531: 1 | Z531: 7 | AA531: 0 | AB531: 584 | AC531: 920 | AD531: =(AB531/AC531)*100 -> 63.478260869565219 | AE531: =(Y531*4)+(AA531*2) -> 4
A532: SPRINGVALE | C532: 2 | D532: 6 | E532: =(C532*6)+D532 -> 18 | G532: 5 | H532: 9 | I532: =(G532*6)+H532 -> 39 | K532: 7 | L532: 13 | M532: =(K532*6)+L532 -> 55 | O532: 13 | P532: 20 | Q532: =(O532*6)+P532 -> 98 | S532: Venue: NORTH HOBART OVAL
A533: TASMANIA | C533: 2 | D533: 3 | E533: =(C533*6)+D533 -> 15 | G533: 4 | H533: 4 | I533: =(G533*6)+H533 -> 28 | K533: 8 | L533: 5 | M533: =(K533*6)+L533 -> 53 | O533: 11 | P533: 6 | Q533: =(O533*6)+P533 -> 72
A534: BEST PLAYERS
A535: SPRINGVALE | C535: HARRISON | F535: DAL SANTO | I535: CARROLL | L535: BARHAM | N535: MONTAGNA | Q535: OLIVER
A536: TASMANIA | C536: DOERING | F536: STEPHENS | I536: CANN | L536: KIRK | N536: HOWARD | Q536: ATKIN
A537: GOALKICKERS
A538: SPRINGVALE | C538: KOSCH 3 | E538: DAL SANTO 2 | H538: MOTT 2 | J538: PITT 2 | L538: HARRISON | O538: ROUDA | Q538: WULF | S538: HOULIHAN
A539: TASMANIA | C539: CANN 4 | F539: BLIGHT 3 | I539: KIRK 2 | K539: DERBYSHIRE | N539: HOWARD
A541: WERRIBEE | C541: 5 | D541: 4 | E541: =(C541*6)+D541 -> 34 | G541: 9 | H541: 8 | I541: =(G541*6)+H541 -> 62 | K541: 11 | L541: 13 | M541: =(K541*6)+L541 -> 79 | O541: 16 | P541: 17 | Q541: =(O541*6)+P541 -> 113 | S541: Venue: WERRIBEE
A542: NORTH BALLARAT | C542: 3 | D542: 4 | E542: =(C542*6)+D542 -> 22 | G542: 6 | H542: 7 | I542: =(G542*6)+H542 -> 43 | K542: 10 | L542: 9 | M542: =(K542*6)+L542 -> 69 | O542: 11 | P542: 12 | Q542: =(O542*6)+P542 -> 78
A543: BEST PLAYERS
A544: WERRIBEE | C544: ROBERTSON | F544: EAGLETON | I544: ANTONOWICZ | L544: HUDSON | N544: BOYD | Q544: CROSS
A545: NORTH BALLARAT | C545: JURICA | F545: MOLONEY | I545: FIELD | L545: RUDD | N545: CLARK | Q545: GREIG
A546: GOALKICKERS
A547: WERRIBEE | C547: MURPHY 3 | F547: MITCHELL 3 | I547: HUDSON 2 | L547: RAU 2 | N547: CONDOS | P547: EAGLETON | R547: JACK | T547: KNEZEVIC | X547: WALSH | Z547: WIGGINS
A548: NORTH BALLARAT | C548: RUDD 4 | F548: JURICA 2 | I548: SAUNDERS 2 | L548: McCORKELL | N548: O'KEEFE | P548: SPOLDING
G549: 8TH JUNE | M549: WEATHER
A550: BOX HILL | C550: 5 | D550: 5 | E550: =(C550*6)+D550 -> 35 | G550: 9 | H550: 8 | I550: =(G550*6)+H550 -> 62 | K550: 12 | L550: 13 | M550: =(K550*6)+L550 -> 85 | O550: 17 | P550: 14 | Q550: =(O550*6)+P550 -> 116 | S550: Venue: BOX HILL
A551: BENDIGO | C551: 1 | D551: 1 | E551: =(C551*6)+D551 -> 7 | G551: 2 | H551: 2 | I551: =(G551*6)+H551 -> 14 | K551: 4 | L551: 4 | M551: =(K551*6)+L551 -> 28 | O551: 5 | P551: 6 | Q551: =(O551*6)+P551 -> 36
A552: BEST PLAYERS
A553: BOX HILL | C553: HUNTER | F553: LONIE | I553: BARKER | L553: HARFORD | O553: CLARKE | R553: WILLIAMS
A554: BENDIGO | C554: ALESSIO | F554: BANNISTER | I554: CARTLERDGE | L554: HOWARD | O554: WATTS
A555: GOALKICKERS
A556: BOX HILL | C556: BARKER 7 | F556: WILLIAMS 3 | I556: ANDERSON | K556: BALL | M556: CLARKE | O556: COLLINS | Q556: HARFORD | T556: KENNA | W556: SMITH
A557: BENDIGO | C557: ALESSIO | F557: M BROWN | I557: HALL | K557: HARVEY | M557: LAYCOCK
A559: WILLIAMSTOWN | C559: 5 | D559: 2 | E559: =(C559*6)+D559 -> 32 | G559: 10 | H559: 2 | I559: =(G559*6)+H559 -> 62 | K559: 16 | L559: 5 | M559: =(K559*6)+L559 -> 101 | O559: 19 | P559: 9 | Q559: =(O559*6)+P559 -> 123 | S559: Venue: BEACH ROAD
A560: SANDRINGHAM | C560: 4 | D560: 1 | E560: =(C560*6)+D560 -> 25 | G560: 9 | H560: 2 | I560: =(G560*6)+H560 -> 56 | K560: 11 | L560: 3 | M560: =(K560*6)+L560 -> 69 | O560: 16 | P560: 8 | Q560: =(O560*6)+P560 -> 104
A561: BEST PLAYERS
A562: WILLIAMSTOWN | C562: KINNEAR | F562: McGOUGH | I562: MAHONEY | L562: BETHERAS | O562: SWAN | Q562: HOLLOW
A563: SANDRINGHAM | C563: POYAS | F563: WHEATLEY | I563: LYNCH | L563: J RADFORD | O563: WALSH | Q563: MILLER
A564: GOALKICKERS
A565: WILLIAMSTOWN | C565: KINNEAR 5 | F565: MAHONEY 3 | I565: BALDWIN 2 | L565: BETHERAS 2 | O565: McGOUGH 2 | R565: RUNNALLS 2 | W565: SWAN | X565: RAMSAY | AA565: SMOKER
A566: SANDRINGHAM | C566: POYAS 6 | F566: MILLER 2 | I566: FERRARO | K566: HAYNES | M566: HUNTER | O566: OAKLEY | Q566: RIVERS | S566: ROGERS | V566: TREGEAR | X566: WHEATLEY
A568: BYE | D568: FRANKSTON
A570: ROUND 11 | D570: 14TH JUNE | J570: WEATHER
D571: 1ST QTR | H571: 2ND QTR | L571: 3RD QTR | P571: FINAL | S571: Venue: WILLIAMSTOWN
A572: BOX HILL | C572: 0 | D572: 3 | E572: =(C572*6)+D572 -> 3 | G572: 2 | H572: 8 | I572: =(G572*6)+H572 -> 20 | K572: 4 | L572: 8 | M572: =(K572*6)+L572 -> 32 | O572: 8 | P572: 13 | Q572: =(O572*6)+P572 -> 61 | S572: UMPIRES | Z572: LADDER | AC572: ROUND | AE572: 11
A573: WILLIAMSTOWN | C573: 1 | D573: 3 | E573: =(C573*6)+D573 -> 9 | G573: 2 | H573: 4 | I573: =(G573*6)+H573 -> 16 | K573: 5 | L573: 7 | M573: =(K573*6)+L573 -> 37 | O573: 7 | P573: 8 | Q573: =(O573*6)+P573 -> 50
A574: BEST PLAYERS | W574: TEAM | X574: B | Y574: W | Z574: L | AA574: D | AB574: FOR | AC574: AGST | AD574: % | AE574: PTS
A575: BOX HILL | C575: HODGE | F575: CLARKE | I575: LONIE | L575: SEWELL | O575: BALL | Q575: KENNA
A576: WILLIAMSTOWN | C576: LLOYD | F576: CRANAGE | I576: COLE | L576: MAHONEY | O576: SWAN | Q576: BETHERAS | W576: BOX HILL | Y576: 10 | Z576: 1 | AA576: 0 | AB576: 1114 | AC576: 824 | AD576: =(AB576/AC576)*100 -> 135.19417475728156 | AE576: =(Y576*4)+(AA576*2) -> 40
A577: GOALKICKERS | W577: WILLIAMSTOWN | X577: 1 | Y577: 8 | Z577: 2 | AA577: 0 | AB577: 1094 | AC577: 748 | AD577: =(AB577/AC577)*100 -> 146.2566844919786 | AE577: =(Y577*4)+(AA577*2) -> 32
A578: BOX HILL | C578: KENNA 3 | F578: CLARKE | I578: HODGE | K578: KANE | M578: NEAGLE | O578: PUGSLEY | W578: PORT MELBOURNE | X578: 1 | Y578: 8 | Z578: 2 | AA578: 0 | AB578: 1025 | AC578: 719 | AD578: =(AB578/AC578)*100 -> 142.55910987482613 | AE578: =(Y578*4)+(AA578*2) -> 32
A579: WILLIAMSTOWN | C579: MAHONEY 3 | F579: NIXON 2 | I579: BETHERAS | L579: KINNEAR | W579: SANDRINGHAM | X579: 1 | Y579: 7 | Z579: 3 | AA579: 0 | AB579: 902 | AC579: 789 | AD579: =(AB579/AC579)*100 -> 114.32192648922688 | AE579: =(Y579*4)+(AA579*2) -> 28
D580: 15TH JUNE | J580: WEATHER | W580: NORTHERN BULLANTS | X580: 2 | Y580: 5 | Z580: 4 | AA580: 0 | AB580: 919 | AC580: 858 | AD580: =(AB580/AC580)*100 -> 107.10955710955712 | AE580: =(Y580*4)+(AA580*2) -> 20
A581: FRANKSTON | C581: 1 | D581: 3 | E581: =(C581*6)+D581 -> 9 | G581: 2 | H581: 7 | I581: =(G581*6)+H581 -> 19 | K581: 5 | L581: 9 | M581: =(K581*6)+L581 -> 39 | O581: 7 | P581: 16 | Q581: =(O581*6)+P581 -> 58 | S581: Venue: FRANKSTON | W581: SPRINGVALE | X581: 1 | Y581: 5 | Z581: 5 | AA581: 0 | AB581: 954 | AC581: 905 | AD581: =(AB581/AC581)*100 -> 105.41436464088399 | AE581: =(Y581*4)+(AA581*2) -> 20
A582: COBURG | C582: 3 | D582: 2 | E582: =(C582*6)+D582 -> 20 | G582: 4 | H582: 3 | I582: =(G582*6)+H582 -> 27 | K582: 6 | L582: 5 | M582: =(K582*6)+L582 -> 41 | O582: 8 | P582: 7 | Q582: =(O582*6)+P582 -> 55 | W582: GEELONG | X582: 1 | Y582: 5 | Z582: 5 | AA582: 0 | AB582: 943 | AC582: 944 | AD582: =(AB582/AC582)*100 -> 99.894067796610159 | AE582: =(Y582*4)+(AA582*2) -> 20
A583: BEST PLAYERS | W583: FRANKSTON | X583: 1 | Y583: 5 | Z583: 5 | AA583: 0 | AB583: 764 | AC583: 808 | AD583: =(AB583/AC583)*100 -> 94.554455445544548 | AE583: =(Y583*4)+(AA583*2) -> 20
A584: FRANKSTON | C584: HYNES | F584: ABLETT | I584: FOLINO | L584: D CLARKE | O584: KEMPERMAN | R584: WHITE
A585: COBURG | C585: CARLSON | F585: HOLLAND | I585: DE PASQUALE | L585: DRAGICEVIC | O585: STEINFORT | R585: HYDE | W585: WERRIBEE | X585: 1 | Y585: 3 | Z585: 7 | AA585: 0 | AB585: 869 | AC585: 1072 | AD585: =(AB585/AC585)*100 -> 81.06343283582089 | AE585: =(Y585*4)+(AA585*2) -> 12
A586: GOALKICKERS | W586: TASMANIA | X586: 2 | Y586: 2 | Z586: 6 | AA586: 1 | AB586: 837 | AC586: 769 | AD586: =(AB586/AC586)*100 -> 108.84265279583876 | AE586: =(Y586*4)+(AA586*2) -> 10
A587: FRANKSTON | C587: ABLETT | E587: BROWN | G587: D CLARKE | J587: DOUST | L587: HUNTER | N587: McCORMACK | Q587: WINTERTON | W587: BENDIGO | X587: 1 | Y587: 2 | Z587: 7 | AA587: 1 | AB587: 833 | AC587: 1097 | AD587: =(AB587/AC587)*100 -> 75.934366453965367 | AE587: =(Y587*4)+(AA587*2) -> 10
A588: COBURG | C588: FLAHERTY 3 | F588: HOLLAND 2 | I588: DRAGICEVIC | L588: HYDE | N588: SCHULTZ | W588: NORTH BALLARAT | X588: 1 | Y588: 2 | Z588: 8 | AA588: 0 | AB588: 662 | AC588: 1049 | AD588: =(AB588/AC588)*100 -> 63.107721639656809 | AE588: =(Y588*4)+(AA588*2) -> 8
W589: COBURG | X589: 2 | Y589: 1 | Z589: 8 | AA589: 0 | AB589: 639 | AC589: 978 | AD589: =(AB589/AC589)*100 -> 65.337423312883431 | AE589: =(Y589*4)+(AA589*2) -> 4
A590: NORTHERN BULLANTS | C590: 5 | D590: 4 | E590: =(C590*6)+D590 -> 34 | G590: 8 | H590: 5 | I590: =(G590*6)+H590 -> 53 | K590: 11 | L590: 11 | M590: =(K590*6)+L590 -> 77 | O590: 13 | P590: 15 | Q590: =(O590*6)+P590 -> 93 | S590: Venue: PRESTON
A591: SPRINGVALE | C591: 2 | D591: 4 | E591: =(C591*6)+D591 -> 16 | G591: 5 | H591: 6 | I591: =(G591*6)+H591 -> 36 | K591: 9 | L591: 6 | M591: =(K591*6)+L591 -> 60 | O591: 13 | P591: 10 | Q591: =(O591*6)+P591 -> 88
A592: BEST PLAYERS
A593: NORTHERN BULLANTS | C593: LIVINGSTON | F593: ZORZI | I593: GIBSON | L593: ECCLES | N593: HEDGE | Q593: MANTON
A594: SPRINGVALE | C594: MONTAGNA | F594: DAL SANTO | I594: HOULIHAN | L594: FISHER | N594: SINCLAIR | Q594: B SCHWARZE
A595: GOALKICKERS
A596: NORTHERN BULLANTS | C596: SAUTNER 5 | F596: ANGWIN | H596: BEASY | J596: CROAD | L596: ECCLES | N596: DAVIES | P596: GIBSON | R596: HEDGE | U596: PLUNKETT
A597: SPRINGVALE | C597: HOULIHAN 4 | F597: DAL SANTO 2 | I597: PITT 2 | K597: S HARRISON | N597: MOTT | P597: MONTAGNA | S597: THOMAS | W597: SINCLAIR
A599: GEELONG | C599: 3 | D599: 6 | E599: =(C599*6)+D599 -> 24 | G599: 5 | H599: 8 | I599: =(G599*6)+H599 -> 38 | K599: 6 | L599: 10 | M599: =(K599*6)+L599 -> 46 | O599: 8 | P599: 16 | Q599: =(O599*6)+P599 -> 64 | S599: Venue: NORTH BALLARAT
A600: NORTH BALLARAT | C600: 0 | D600: 3 | E600: =(C600*6)+D600 -> 3 | G600: 1 | H600: 5 | I600: =(G600*6)+H600 -> 11 | K600: 4 | L600: 8 | M600: =(K600*6)+L600 -> 32 | O600: 4 | P600: 8 | Q600: =(O600*6)+P600 -> 32
A601: BEST PLAYERS
A602: GEELONG | C602: BARTEL | F602: EGAN | I602: JORGENSEN | L602: WHITE | N602: S JOHNSON | Q602: CALLAN
A603: NORTH BALLARAT | C603: SPOLDING | F603: FIELD | I603: JURICA | L603: MOLONEY | N603: GREIG | Q603: JENKINS
A604: GOALKICKERS
A605: GEELONG | C605: S JOHNSON 3 | F605: BYRNES | H605: COOK | J605: GARDINER | M605: LONERGAN | P605: MACKIE
A606: NORTH BALLARAT | C606: EDWARDS | F606: JURICA | H606: SPOLDING | K606: O'KEEFE
A608: SANDRINGHAM | C608: 1 | D608: 5 | E608: =(C608*6)+D608 -> 11 | G608: 2 | H608: 13 | I608: =(G608*6)+H608 -> 25 | K608: 7 | L608: 15 | M608: =(K608*6)+L608 -> 57 | O608: 9 | P608: 16 | Q608: =(O608*6)+P608 -> 70 | S608: Venue: BEACH ROAD
A609: WERRIBEE | C609: 3 | D609: 5 | E609: =(C609*6)+D609 -> 23 | G609: 5 | H609: 7 | I609: =(G609*6)+H609 -> 37 | K609: 7 | L609: 11 | M609: =(K609*6)+L609 -> 53 | O609: 9 | P609: 12 | Q609: =(O609*6)+P609 -> 66
A610: BEST PLAYERS
A611: SANDRINGHAM | C611: ELLIS | F611: FERGUSON | I611: OAKLEY | L611: TREGEAR | N611: BRYAN | Q611: GALLAGHER
A612: WERRIBEE | C612: ANTONOWICZ | F612: BOYD | I612: PICKEN | L612: ROBERTSON | N612: SETCHELL
A613: GOALKICKERS
A614: SANDRINGHAM | C614: FERGUSON 3 | F614: FISHER | H614: GALLAGHER | K614: HOWARTH | N614: HUNTER | P614: LIDDELL | R614: OAKLEY
A615: WERRIBEE | C615: GILBEE 2 | F615: LAMB 2 | I615: ANTONOWICZ | L615: CONDOS | N615: HUDSON | P615: MITCHELL | R615: WIGGINS
A617: BENDIGO | C617: 2 | D617: 3 | E617: =(C617*6)+D617 -> 15 | G617: 7 | H617: 7 | I617: =(G617*6)+H617 -> 49 | K617: 10 | L617: 10 | M617: =(K617*6)+L617 -> 70 | O617: 14 | P617: 15 | Q617: =(O617*6)+P617 -> 99 | S617: Venue: BENDIGO
A618: PORT MELBOURNE | C618: 3 | D618: 4 | E618: =(C618*6)+D618 -> 22 | G618: 5 | H618: 6 | I618: =(G618*6)+H618 -> 36 | K618: 9 | L618: 13 | M618: =(K618*6)+L618 -> 67 | O618: 11 | P618: 15 | Q618: =(O618*6)+P618 -> 81
A619: BEST PLAYERS
A620: BENDIGO | C620: WATSON | F620: RICHARDS | I620: FORSTER-KNIGHT | M620: C McGRATH | P620: CARTER | R620: BANNISTER
A621: PORT MELBOURNE | C621: M STEVENS | F621: HALE | I621: S CLAYTON | M621: WATSON | P621: J CLAYTON
A622: GOALKICKERS
A623: BENDIGO | C623: RICHARDS 4 | F623: HALL 3 | I623: LAYCOCK 2 | L623: HOWARD | N623: JOHNS | P623: REYNOLDS | R623: ROSA | U623: WALSH
A624: PORT MELBOURNE | C624: McINTOSH 3 | F624: FILANDIA 2 | I624: ALLEWAY | K624: ALOI | M624: J CLAYTON | P624: S CLAYTON | S624: EVANS | W624: STEVENS
A626: BYE | D626: TASMANIA
A628: ROUND 12 | D628: 21ST JUNE | J628: WEATHER
D629: 1ST QTR | H629: 2ND QTR | L629: 3RD QTR | P629: FINAL | S629: Venue: NORTH BALLARAT
A630: FRANKSTON | C630: 4 | D630: 1 | E630: =(C630*6)+D630 -> 25 | G630: 7 | H630: 2 | I630: =(G630*6)+H630 -> 44 | K630: 9 | L630: 6 | M630: =(K630*6)+L630 -> 60 | O630: 10 | P630: 8 | Q630: =(O630*6)+P630 -> 68 | S630: UMPIRES | Z630: LADDER | AC630: ROUND | AE630: 12
A631: NORTH BALLARAT | C631: 1 | D631: 1 | E631: =(C631*6)+D631 -> 7 | G631: 4 | H631: 2 | I631: =(G631*6)+H631 -> 26 | K631: 8 | L631: 7 | M631: =(K631*6)+L631 -> 55 | O631: 8 | P631: 14 | Q631: =(O631*6)+P631 -> 62
A632: BEST PLAYERS | W632: TEAM | X632: B | Y632: W | Z632: L | AA632: D | AB632: FOR | AC632: AGST | AD632: % | AE632: PTS
A633: FRANKSTON | C633: FOLINO | F633: D CLARKE | I633: KEMPERMAN | L633: SHIPP | N633: ROBERTS | Q633: BROWN
A634: NORTH BALLARAT | C634: McCORKELL | F634: JURICA | I634: GREIG | L634: COOK | N634: MOLONEY | Q634: JENKINS | W634: BOX HILL | X634: 1 | Y634: 10 | Z634: 1 | AA634: 0 | AB634: 1114 | AC634: 824 | AD634: =(AB634/AC634)*100 -> 135.19417475728156 | AE634: =(Y634*4)+(AA634*2) -> 40
A635: GOALKICKERS | W635: WILLIAMSTOWN | X635: 1 | Y635: 9 | Z635: 2 | AA635: 0 | AB635: 1200 | AC635: 841 | AD635: =(AB635/AC635)*100 -> 142.6872770511296 | AE635: =(Y635*4)+(AA635*2) -> 36
A636: FRANKSTON | C636: D CLARKE 4 | F636: HYNES 2 | I636: ANDERSON | L636: BROWN | N636: SHIPP | P636: WILLIS | W636: PORT MELBOURNE | X636: 1 | Y636: 8 | Z636: 3 | AA636: 0 | AB636: 1144 | AC636: 846 | AD636: =(AB636/AC636)*100 -> 135.22458628841608 | AE636: =(Y636*4)+(AA636*2) -> 32
A637: NORTH BALLARAT | C637: McCORKELL 2 | F637: GREIG | H637: MILLER | J637: RYALL | L637: SPOLDING | N637: SAUNDERS | Q637: TURNER | W637: SANDRINGHAM | X637: 1 | Y637: 7 | Z637: 4 | AA637: 0 | AB637: 1011 | AC637: 922 | AD637: =(AB637/AC637)*100 -> 109.65292841648591 | AE637: =(Y637*4)+(AA637*2) -> 28
W638: SPRINGVALE | X638: 1 | Y638: 6 | Z638: 5 | AA638: 0 | AB638: 1097 | AC638: 1014 | AD638: =(AB638/AC638)*100 -> 108.1854043392505 | AE638: =(Y638*4)+(AA638*2) -> 24
A639: COBURG | C639: 4 | D639: 5 | E639: =(C639*6)+D639 -> 29 | G639: 7 | H639: 6 | I639: =(G639*6)+H639 -> 48 | K639: 9 | L639: 8 | M639: =(K639*6)+L639 -> 62 | O639: 10 | P639: 10 | Q639: =(O639*6)+P639 -> 70 | S639: Venue: COBURG | W639: FRANKSTON | X639: 1 | Y639: 6 | Z639: 5 | AA639: 0 | AB639: 832 | AC639: 870 | AD639: =(AB639/AC639)*100 -> 95.632183908045974 | AE639: =(Y639*4)+(AA639*2) -> 24
A640: NORTHERN BULLANTS | C640: 0 | D640: 0 | E640: =(C640*6)+D640 -> 0 | G640: 5 | H640: 3 | I640: =(G640*6)+H640 -> 33 | K640: 8 | L640: 6 | M640: =(K640*6)+L640 -> 54 | O640: 9 | P640: 7 | Q640: =(O640*6)+P640 -> 61 | W640: NORTHERN BULLANTS | X640: 2 | Y640: 5 | Z640: 5 | AA640: 0 | AB640: 980 | AC640: 928 | AD640: =(AB640/AC640)*100 -> 105.60344827586208 | AE640: =(Y640*4)+(AA640*2) -> 20
A641: BEST PLAYERS | W641: GEELONG | X641: 1 | Y641: 5 | Z641: 6 | AA641: 0 | AB641: 1017 | AC641: 1023 | AD641: =(AB641/AC641)*100 -> 99.413489736070375 | AE641: =(Y641*4)+(AA641*2) -> 20
A642: COBURG | C642: HYDE | E642: HOLLAND | H642: HOULIHAN | K642: DRAGICEVIC | N642: STEINFORT | Q642: DE PASQUALE
A643: NORTHERN BULLANTS | C643: EASO | E643: ANGWIN | H643: MANTON | K643: FINNIN | N643: WATSON | W643: TASMANIA | X643: 2 | Y643: 3 | Z643: 6 | AA643: 1 | AB643: 964 | AC643: 888 | AD643: =(AB643/AC643)*100 -> 108.55855855855856 | AE643: =(Y643*4)+(AA643*2) -> 14
A644: GOALKICKERS | W644: BENDIGO | X644: 1 | Y644: 3 | Z644: 7 | AA644: 1 | AB644: 912 | AC644: 1171 | AD644: =(AB644/AC644)*100 -> 77.882152006831774 | AE644: =(Y644*4)+(AA644*2) -> 14
A645: COBURG | C645: HOULIHAN 2 | F645: PETTIFER 2 | I645: SCHULTZ 2 | L645: VARDY 2 | N645: DRAGICEVIC | Q645: McGRATH | W645: WERRIBEE | X645: 1 | Y645: 3 | Z645: 8 | AA645: 0 | AB645: 962 | AC645: 1178 | AD645: =(AB645/AC645)*100 -> 81.663837011884553 | AE645: =(Y645*4)+(AA645*2) -> 12
A646: NORTHERN BULLANTS | C646: SAUTNER 3 | F646: ANGWIN 2 | I646: BEASY | K646: DAVIES | M646: ECCLES | O646: SIMPSON | W646: COBURG | X646: 2 | Y646: 2 | Z646: 8 | AA646: 0 | AB646: 709 | AC646: 1039 | AD646: =(AB646/AC646)*100 -> 68.238691049085659 | AE646: =(Y646*4)+(AA646*2) -> 8
D647: 22ND JUNE | J647: WEATHER | W647: NORTH BALLARAT | X647: 1 | Y647: 2 | Z647: 9 | AA647: 0 | AB647: 724 | AC647: 1117 | AD647: =(AB647/AC647)*100 -> 64.816472694718001 | AE647: =(Y647*4)+(AA647*2) -> 8
A648: WILLIAMSTOWN | C648: 3 | D648: 2 | E648: =(C648*6)+D648 -> 20 | G648: 5 | H648: 3 | I648: =(G648*6)+H648 -> 33 | K648: 10 | L648: 6 | M648: =(K648*6)+L648 -> 66 | O648: 16 | P648: 10 | Q648: =(O648*6)+P648 -> 106 | S648: Venue: WILLIAMSTOWN
A649: WERRIBEE | C649: 4 | D649: 3 | E649: =(C649*6)+D649 -> 27 | G649: 8 | H649: 6 | I649: =(G649*6)+H649 -> 54 | K649: 11 | L649: 8 | M649: =(K649*6)+L649 -> 74 | O649: 14 | P649: 9 | Q649: =(O649*6)+P649 -> 93
A650: BEST PLAYERS
A651: WILLIAMSTOWN | C651: FLETCHER | F651: BALDWIN | I651: SMOKER | L651: WEST | N651: COLE | P651: CLOKE
A652: WERRIBEE | C652: ROBERTSON | F652: WIGGINS | I652: McGUINNESS | L652: BOYD | N652: MORRIS
A653: GOALKICKERS
A654: WILLIAMSTOWN | C654: BALDWIN 7 | F654: MAHONEY 2 | I654: ANDERSON | L654: CLOKE | N654: FLETCHER | Q654: HILL | R654: HOLLOW | V654: SWAN | X654: WEST
A655: WERRIBEE | C655: WIGGINS 5 | F655: BIRSS | H655: CROSS | J655: FAULKNER | M655: GILBEE | O655: HARRIS | Q655: HUDSON | S655: MITCHELL | W655: MURPHY | X655: POWER
D656: 28TH JUNE | J656: WEATHER
A657: TASMANIA | C657: 7 | D657: 2 | E657: =(C657*6)+D657 -> 44 | G657: 10 | H657: 5 | I657: =(G657*6)+H657 -> 65 | K657: 13 | L657: 10 | M657: =(K657*6)+L657 -> 88 | O657: 19 | P657: 13 | Q657: =(O657*6)+P657 -> 127 | S657: Venue: NORTH HOBART OVAL
A658: PORT MELBOURNE | C658: 4 | D658: 4 | E658: =(C658*6)+D658 -> 28 | G658: 9 | H658: 7 | I658: =(G658*6)+H658 -> 61 | K658: 12 | L658: 10 | M658: =(K658*6)+L658 -> 82 | O658: 18 | P658: 11 | Q658: =(O658*6)+P658 -> 119
A659: BEST PLAYERS
A660: TASMANIA | C660: THURLEY | F660: CALLINAN | I660: RICHTER | L660: DERBYSHIRE | O660: SMITH | Q660: BARTLETT
A661: PORT MELBOURNE | C661: MORRELL | F661: OBST | I661: FILANDIA | L661: SMITH | O661: DAVEY | Q661: EVANS
A662: GOALKICKERS
A663: TASMANIA | C663: CALLINAN 4 | F663: THURLEY 4 | I663: HEATLEY 3 | L663: BARTLETT 2 | O663: ATKIN | Q663: BEAMS | S663: SMITH | V663: CANN | X663: THOMPSON | AA663: TAYLOR
A664: PORT MELBOURNE | C664: MORRELL 6 | F664: DAVEY 3 | I664: GRIMA 2 | K664: OBST 2 | M664: ALOI | N664: BOURKE | P664: FILANDIA | R664: SOFI | T664: WATSON
A666: BENDIGO | C666: 4 | D666: 4 | E666: =(C666*6)+D666 -> 28 | G666: 5 | H666: 4 | I666: =(G666*6)+H666 -> 34 | K666: 10 | L666: 5 | M666: =(K666*6)+L666 -> 65 | O666: 12 | P666: 7 | Q666: =(O666*6)+P666 -> 79 | S666: Venue: SHELL STADIUM
A667: GEELONG | C667: 1 | D667: 2 | E667: =(C667*6)+D667 -> 8 | G667: 4 | H667: 9 | I667: =(G667*6)+H667 -> 33 | K667: 8 | L667: 10 | M667: =(K667*6)+L667 -> 58 | O667: 10 | P667: 14 | Q667: =(O667*6)+P667 -> 74
A668: BEST PLAYERS
A669: BENDIGO | C669: RICHARDS | F669: HALL | I669: T McGRATH | L669: FORSTER-KNIGHT | P669: CARTER | R669: MERCURI
A670: GEELONG | C670: MOLONEY | F670: KELLY | I670: STREET | L670: CARRAZZO | O670: BYRNES | R670: PLAYFAIR
A671: GOALKICKERS
A672: BENDIGO | C672: BANNISTER 2 | F672: HAYNES 2 | I672: WALSH 2 | K672: WUNDERLICH 2 | N672: JOHNS | P672: MERCURI | R672: RICHARDS | V672: WILSON
A673: GEELONG | C673: PLAYFAIR 4 | F673: BYRNES 2 | I673: CARRAZZO 2 | L673: BRIGHT | N673: KELLY
D674: 29TH JUNE | J674: WEATHER
A675: SPRINGVALE | C675: 1 | D675: 1 | E675: =(C675*6)+D675 -> 7 | G675: 11 | H675: 3 | I675: =(G675*6)+H675 -> 69 | K675: 16 | L675: 10 | M675: =(K675*6)+L675 -> 106 | O675: 20 | P675: 13 | Q675: =(O675*6)+P675 -> 133 | S675: Venue: SPRINGVALE
A676: SANDRINGHAM | C676: 7 | D676: 7 | E676: =(C676*6)+D676 -> 49 | G676: 10 | H676: 7 | I676: =(G676*6)+H676 -> 67 | K676: 11 | L676: 8 | M676: =(K676*6)+L676 -> 74 | O676: 16 | P676: 13 | Q676: =(O676*6)+P676 -> 109
A677: BEST PLAYERS
A678: SPRINGVALE | C678: OLIVER | F678: BALL | I678: HARRISON | L678: MONTAGNA | O678: B SCHWARZE | R678: PITT
A679: SANDRINGHAM | C679: WHEATLEY | F679: LYNCH | I679: MOORCROFT | L679: HAYNES
A680: GOALKICKERS
A681: SPRINGVALE | C681: PITT 4 | E681: MONTAGNA 4 | H681: WULF 4 | J681: MOYLE 3 | M681: BLAKE | O681: BALL | Q681: HOULIHAN | U681: HARRISON | X681: B SCHWARZE
A682: SANDRINGHAM | C682: MOORCROFT 6 | F682: HAYNES 2 | I682: WHEATLEY 2 | L682: OAKLEY 2 | N682: GALLAGHER | Q682: ROBBINS | S682: JAMAR | W682: RADFORD
A684: BYE | D684: BOX HILL
A686: ROUND 13 | D686: 5TH JULY | J686: WEATHER
D687: 1ST QTR | H687: 2ND QTR | L687: 3RD QTR | P687: FINAL | S687: Venue: BEACH ROAD
A688: SANDRINGHAM | C688: 1 | D688: 5 | E688: =(C688*6)+D688 -> 11 | G688: 6 | H688: 7 | I688: =(G688*6)+H688 -> 43 | K688: 12 | L688: 8 | M688: =(K688*6)+L688 -> 80 | O688: 19 | P688: 10 | Q688: =(O688*6)+P688 -> 124 | S688: UMPIRES | Z688: LADDER | AC688: ROUND | AE688: 13
A689: NORTHERN BULLANTS | C689: 7 | D689: 4 | E689: =(C689*6)+D689 -> 46 | G689: 10 | H689: 5 | I689: =(G689*6)+H689 -> 65 | K689: 12 | L689: 8 | M689: =(K689*6)+L689 -> 80 | O689: 12 | P689: 10 | Q689: =(O689*6)+P689 -> 82
A690: BEST PLAYERS | W690: TEAM | X690: B | Y690: W | Z690: L | AA690: D | AB690: FOR | AC690: AGST | AD690: % | AE690: PTS
A691: SANDRINGHAM | C691: GALLAGHER | F691: JAMAR | I691: HAYNES | L691: FISHER | O691: ROBBINS | R691: RADFORD
A692: NORTHERN BULLANTS | C692: ECCLES | F692: SIMPSON | I692: WATSON | L692: VANSITTART | W692: BOX HILL | X692: 1 | Y692: 11 | Z692: 1 | AA692: 0 | AB692: 1194 | AC692: 884 | AD692: =(AB692/AC692)*100 -> 135.06787330316743 | AE692: =(Y692*4)+(AA692*2) -> 44
A693: GOALKICKERS | M693: MOORCROFT | O693: SMITH | Q693: OAKLEY | S693: FISHER | W693: PORT MELBOURNE | X693: 1 | Y693: 9 | Z693: 3 | AA693: 0 | AB693: 1248 | AC693: 905 | AD693: =(AB693/AC693)*100 -> 137.90055248618785 | AE693: =(Y693*4)+(AA693*2) -> 36
A694: SANDRINGHAM | C694: GALLAGHER 3 | F694: POYAS 3 | H694: S RADFORD 3 | K694: ROBBINS 2 | M694: RIGONI 2 | O694: HAYNES | Q694: HOWARTH | W694: WILLIAMSTOWN | X694: 1 | Y694: 9 | Z694: 3 | AA694: 0 | AB694: 1259 | AC694: 945 | AD694: =(AB694/AC694)*100 -> 133.22751322751321 | AE694: =(Y694*4)+(AA694*2) -> 36
A695: NORTHERN BULLANTS | C695: SAUTNER 4 | F695: SIMPSON 2 | I695: CROAD | K695: DAVIES | M695: MERRINGTON | P695: PLUNKETT | R695: STEVENSON | W695: SANDRINGHAM | X695: 1 | Y695: 8 | Z695: 4 | AA695: 0 | AB695: 1135 | AC695: 1004 | AD695: =(AB695/AC695)*100 -> 113.04780876494024 | AE695: =(Y695*4)+(AA695*2) -> 32
D696: 6TH JULY | J696: WEATHER | Q696: VANSITTART | W696: SPRINGVALE | X696: 1 | Y696: 6 | Z696: 6 | AA696: 0 | AB696: 1164 | AC696: 1108 | AD696: =(AB696/AC696)*100 -> 105.05415162454874 | AE696: =(Y696*4)+(AA696*2) -> 24
A697: TASMANIA | C697: 5 | D697: 1 | E697: =(C697*6)+D697 -> 31 | G697: 8 | H697: 6 | I697: =(G697*6)+H697 -> 54 | K697: 14 | L697: 8 | M697: =(K697*6)+L697 -> 92 | O697: 21 | P697: 10 | Q697: =(O697*6)+P697 -> 136 | S697: Venue: BELLERIVE OVAL | W697: GEELONG | X697: 1 | Y697: 6 | Z697: 6 | AA697: 0 | AB697: 1109 | AC697: 1087 | AD697: =(AB697/AC697)*100 -> 102.02391904323827 | AE697: =(Y697*4)+(AA697*2) -> 24
A698: COBURG | C698: 5 | D698: 3 | E698: =(C698*6)+D698 -> 33 | G698: 8 | H698: 5 | I698: =(G698*6)+H698 -> 53 | K698: 11 | L698: 8 | M698: =(K698*6)+L698 -> 74 | O698: 15 | P698: 8 | Q698: =(O698*6)+P698 -> 98 | W698: FRANKSTON | X698: 1 | Y698: 6 | Z698: 6 | AA698: 0 | AB698: 896 | AC698: 962 | AD698: =(AB698/AC698)*100 -> 93.139293139293144 | AE698: =(Y698*4)+(AA698*2) -> 24
A699: BEST PLAYERS | W699: NORTHERN BULLANTS | X699: 2 | Y699: 5 | Z699: 6 | AA699: 0 | AB699: 1062 | AC699: 1052 | AD699: =(AB699/AC699)*100 -> 100.95057034220531 | AE699: =(Y699*4)+(AA699*2) -> 20
A700: TASMANIA | C700: ATKIN | F700: DOERING | I700: TAYLOR | L700: BEAMS | O700: CANN | R700: CARELESS
A701: COBURG | C701: SCHULTZ | F701: KING | I701: VARDY | L701: STEINFORT | W701: TASMANIA | X701: 2 | Y701: 4 | Z701: 6 | AA701: 1 | AB701: 1100 | AC701: 986 | AD701: =(AB701/AC701)*100 -> 111.56186612576064 | AE701: =(Y701*4)+(AA701*2) -> 18
A702: GOALKICKERS | Q702: THURLEY | W702: BENDIGO | X702: 1 | Y702: 4 | Z702: 7 | AA702: 1 | AB702: 1006 | AC702: 1238 | AD702: =(AB702/AC702)*100 -> 81.260096930533123 | AE702: =(Y702*4)+(AA702*2) -> 18
A703: TASMANIA | C703: HEATLEY 5 | F703: CANN 4 | H703: BEAMS 4 | J703: BARTLETT 2 | M703: DRURY 2 | O703: CALLINAN | Q703: CRIPPS | S703: SMITH | W703: WERRIBEE | X703: 1 | Y703: 3 | Z703: 9 | AA703: 0 | AB703: 1022 | AC703: 1258 | AD703: =(AB703/AC703)*100 -> 81.240063593004777 | AE703: =(Y703*4)+(AA703*2) -> 12
A704: COBURG | C704: SHULTZ 4 | E704: BLUMFIELD 3 | H704: FLAHERTY 2 | K704: TALBOT | M704: GIESCHEN | O704: PETTIFER | Q704: McGRATH | T704: FIORA | W704: COBURG | X704: 2 | Y704: 2 | Z704: 9 | AA704: 0 | AB704: 807 | AC704: 1175 | AD704: =(AB704/AC704)*100 -> 68.680851063829778 | AE704: =(Y704*4)+(AA704*2) -> 8
W705: NORTH BALLARAT | X705: 2 | Y705: 2 | Z705: 9 | AA705: 0 | AB705: 724 | AC705: 1117 | AD705: =(AB705/AC705)*100 -> 64.816472694718001 | AE705: =(Y705*4)+(AA705*2) -> 8
A706: GEELONG | C706: 3 | D706: 3 | E706: =(C706*6)+D706 -> 21 | G706: 7 | H706: 5 | I706: =(G706*6)+H706 -> 47 | K706: 12 | L706: 7 | M706: =(K706*6)+L706 -> 79 | O706: 14 | P706: 8 | Q706: =(O706*6)+P706 -> 92 | S706: Venue: FRANKSTON
A707: FRANKSTON | C707: 2 | D707: 1 | E707: =(C707*6)+D707 -> 13 | G707: 5 | H707: 2 | I707: =(G707*6)+H707 -> 32 | K707: 7 | L707: 4 | M707: =(K707*6)+L707 -> 46 | O707: 9 | P707: 10 | Q707: =(O707*6)+P707 -> 64
A708: BEST PLAYERS
A709: GEELONG | C709: KELLY | F709: CHAMBERS | I709: COOK | L709: CLARKE | O709: PLAYFAIR | R709: WOOLNOUGH
A710: FRANKSTON | C710: ROBERTS | F710: O'NEILL | I710: McCORMACK | L710: GODDARD | O710: ABLETT | R710: SHIPP
A711: GOALKICKERS
A712: GEELONG | C712: LONERGAN 3 | F712: PLAYFAIR 3 | I712: BYRNES 3 | L712: BRIGHT 2 | N712: SMITH | P712: CLARKE | R712: GRGIC
A713: FRANKSTON | C713: HYNES 2 | F713: McCORMACK 2 | J713: ROBERTS 2 | M713: D CLARKE | P713: SHIPP | R713: C CLARKE
A715: BOX HILL | C715: 1 | D715: 2 | E715: =(C715*6)+D715 -> 8 | G715: 7 | H715: 8 | I715: =(G715*6)+H715 -> 50 | K715: 9 | L715: 11 | M715: =(K715*6)+L715 -> 65 | O715: 11 | P715: 14 | Q715: =(O715*6)+P715 -> 80 | S715: Venue: BOX HILL
A716: WERRIBEE | C716: 2 | D716: 1 | E716: =(C716*6)+D716 -> 13 | G716: 3 | H716: 1 | I716: =(G716*6)+H716 -> 19 | K716: 4 | L716: 3 | M716: =(K716*6)+L716 -> 27 | O716: 9 | P716: 6 | Q716: =(O716*6)+P716 -> 60
A717: BEST PLAYERS
A718: BOX HILL | C718: BALL | F718: WILLIAMS | I718: SCOTT | L718: SEWELL | O718: HARFORD | R718: MCCABE
A719: WERRIBEE | C719: ROBERTSON | F719: PODSIADLY | I719: BOYD | L719: CROSS | O719: SETCHELL | R719: BARRY
A720: GOALKICKERS
A721: BOX HILL | C721: WILLIAMS 4 | F721: LOATS 2 | I721: BAYFORD | K721: BOYLE | M721: HAZELL | O721: KANE | Q721: LADSON
A722: WERRIBEE | C722: McGUINNESS 2 | F722: MURPHY 2 | I722: SETCHELL | K722: FAULKNER | N722: ROBERTSON | Q722: TURNER | S722: BOYD
A724: BENDIGO | C724: 4 | D724: 2 | E724: =(C724*6)+D724 -> 26 | G724: 7 | H724: 4 | I724: =(G724*6)+H724 -> 46 | K724: 8 | L724: 5 | M724: =(K724*6)+L724 -> 53 | O724: 14 | P724: 10 | Q724: =(O724*6)+P724 -> 94 | S724: Venue: BENDIGO
A725: SPRINGVALE | C725: 2 | D725: 4 | E725: =(C725*6)+D725 -> 16 | G725: 3 | H725: 6 | I725: =(G725*6)+H725 -> 24 | K725: 8 | L725: 10 | M725: =(K725*6)+L725 -> 58 | O725: 9 | P725: 13 | Q725: =(O725*6)+P725 -> 67
A726: BEST PLAYERS
A727: BENDIGO | C727: LAYCOCK | F727: HALL | I727: CARTER | L727: HAYNES | O727: BARNARD | R727: O'KEEFE
A728: SPRINGVALE | C728: CARMODY | F728: PITT | I728: HARRISON | L728: BLAKE | O728: DALSANTO | R728: FISHER
A729: GOALKICKERS
A730: BENDIGO | C730: LAYCOCK 5 | F730: HARVEY 2 | I730: WALSH 2 | K730: T McGRATH 2 | N730: FORSTER-KNIGHT | R730: HENNEMAN | W730: CARTER
A731: SPRINGVALE | C731: PITT 2 | F731: MONTAGNA 2 | I731: CARMODY | K731: HARRISON | N731: BLAKE | P731: MOYLE | R731: WULF
A733: PORT MELBOURNE | C733: 5 | D733: 1 | E733: =(C733*6)+D733 -> 31 | G733: 6 | H733: 8 | I733: =(G733*6)+H733 -> 44 | K733: 10 | L733: 12 | M733: =(K733*6)+L733 -> 72 | O733: 15 | P733: 14 | Q733: =(O733*6)+P733 -> 104 | S733: Venue: PORT MELBOURNE
A734: WILLIAMSTOWN | C734: 2 | D734: 1 | E734: =(C734*6)+D734 -> 13 | G734: 3 | H734: 1 | I734: =(G734*6)+H734 -> 19 | K734: 4 | L734: 6 | M734: =(K734*6)+L734 -> 30 | O734: 8 | P734: 11 | Q734: =(O734*6)+P734 -> 59
A735: BEST PLAYERS
A736: PORT MELBOURNE | C736: TEAGUE | F736: J CLAYTON | I736: ROBBINS | L736: DELUCA | O736: DAVEY | R736: McINTOSH
A737: WILLIAMSTOWN | C737: WALKER | F737: RICHARDSON | I737: MULLINS | L737: BALDWIN | O737: FLETCHER | R737: KING
A738: GOALKICKERS
A739: PORT MELBOURNE | C739: McINTOSH 4 | F739: DAVEY 3 | I739: BOURKE 2 | L739: J CLAYTON 2 | O739: ALOI | Q739: ALLEWAY | T739: ROBBINS | W739: SMITH
A740: WILLIAMSTOWN | C740: BALDWIN 3 | F740: SWAN | H740: KING | J740: RICHARDSON | M740: MULLINS | O740: MAHONEY
A742: BYE | D742: NORTH BALLARAT
A744: ROUND 14 | D744: 12TH JULY | J744: WEATHER
D745: 1ST QTR | H745: 2ND QTR | L745: 3RD QTR | P745: FINAL | S745: Venue: WERRIBEE
A746: BENDIGO | C746: 5 | D746: 3 | E746: =(C746*6)+D746 -> 33 | G746: 8 | H746: 4 | I746: =(G746*6)+H746 -> 52 | K746: 13 | L746: 8 | M746: =(K746*6)+L746 -> 86 | O746: 18 | P746: 10 | Q746: =(O746*6)+P746 -> 118 | S746: UMPIRES | Z746: LADDER | AC746: ROUND | AE746: 14
A747: WERRIBEE | C747: 5 | D747: 1 | E747: =(C747*6)+D747 -> 31 | G747: 13 | H747: 3 | I747: =(G747*6)+H747 -> 81 | K747: 15 | L747: 5 | M747: =(K747*6)+L747 -> 95 | O747: 16 | P747: 8 | Q747: =(O747*6)+P747 -> 104
A748: BEST PLAYERS | W748: TEAM | X748: B | Y748: W | Z748: L | AA748: D | AB748: FOR | AC748: AGST | AD748: % | AE748: PTS
A749: BENDIGO
A750: WERRIBEE | W750: BOX HILL | X750: 1 | Y750: 12 | Z750: 1 | AA750: 0 | AB750: 1308 | AC750: 979 | AD750: =(AB750/AC750)*100 -> 133.60572012257407 | AE750: =(Y750*4)+(AA750*2) -> 48
A751: GOALKICKERS | W751: PORT MELBOURNE | X751: 1 | Y751: 10 | Z751: 3 | AA751: 0 | AB751: 1356 | AC751: 1008 | AD751: =(AB751/AC751)*100 -> 134.52380952380955 | AE751: =(Y751*4)+(AA751*2) -> 40
A752: BENDIGO | W752: WILLIAMSTOWN | X752: 2 | Y752: 9 | Z752: 3 | AA752: 0 | AB752: 1259 | AC752: 945 | AD752: =(AB752/AC752)*100 -> 133.22751322751321 | AE752: =(Y752*4)+(AA752*2) -> 36
A753: WERRIBEE | W753: SANDRINGHAM | X753: 1 | Y753: 8 | Z753: 5 | AA753: 0 | AB753: 1238 | AC753: 1112 | AD753: =(AB753/AC753)*100 -> 111.33093525179856 | AE753: =(Y753*4)+(AA753*2) -> 32
W754: GEELONG | X754: 1 | Y754: 7 | Z754: 6 | AA754: 0 | AB754: 1247 | AC754: 1182 | AD754: =(AB754/AC754)*100 -> 105.49915397631133 | AE754: =(Y754*4)+(AA754*2) -> 28
A755: TASMANIA | C755: 5 | D755: 3 | E755: =(C755*6)+D755 -> 33 | G755: 8 | H755: 5 | I755: =(G755*6)+H755 -> 53 | K755: 13 | L755: 6 | M755: =(K755*6)+L755 -> 84 | O755: 15 | P755: 11 | Q755: =(O755*6)+P755 -> 101 | S755: Venue: NORTH BALLARAT | W755: FRANKSTON | X755: 1 | Y755: 7 | Z755: 6 | AA755: 0 | AB755: 998 | AC755: 1037 | AD755: =(AB755/AC755)*100 -> 96.239151398264227 | AE755: =(Y755*4)+(AA755*2) -> 28
A756: NORTH BALLARAT | C756: 3 | D756: 1 | E756: =(C756*6)+D756 -> 19 | G756: 7 | H756: 4 | I756: =(G756*6)+H756 -> 46 | K756: 8 | L756: 7 | M756: =(K756*6)+L756 -> 55 | O756: 11 | P756: 11 | Q756: =(O756*6)+P756 -> 77 | W756: SPRINGVALE | X756: 1 | Y756: 6 | Z756: 7 | AA756: 0 | AB756: 1239 | AC756: 1210 | AD756: =(AB756/AC756)*100 -> 102.39669421487602 | AE756: =(Y756*4)+(AA756*2) -> 24
A757: BEST PLAYERS | W757: TASMANIA | X757: 2 | Y757: 5 | Z757: 6 | AA757: 1 | AB757: 1201 | AC757: 1063 | AD757: =(AB757/AC757)*100 -> 112.98212605832549 | AE757: =(Y757*4)+(AA757*2) -> 22
A758: TASMANIA
A759: NORTH BALLARAT | W759: BENDIGO | X759: 1 | Y759: 5 | Z759: 7 | AA759: 1 | AB759: 1124 | AC759: 1342 | AD759: =(AB759/AC759)*100 -> 83.75558867362146 | AE759: =(Y759*4)+(AA759*2) -> 22
A760: GOALKICKERS | W760: NORTHERN BULLANTS | X760: 2 | Y760: 5 | Z760: 7 | AA760: 0 | AB760: 1157 | AC760: 1166 | AD760: =(AB760/AC760)*100 -> 99.228130360205839 | AE760: =(Y760*4)+(AA760*2) -> 20
A761: TASMANIA | W761: WERRIBEE | X761: 1 | Y761: 3 | Z761: 10 | AA761: 0 | AB761: 1126 | AC761: 1376 | AD761: =(AB761/AC761)*100 -> 81.831395348837205 | AE761: =(Y761*4)+(AA761*2) -> 12
A762: NORTH BALLARAT | W762: COBURG | X762: 2 | Y762: 2 | Z762: 10 | AA762: 0 | AB762: 902 | AC762: 1313 | AD762: =(AB762/AC762)*100 -> 68.697638994668694 | AE762: =(Y762*4)+(AA762*2) -> 8
D763: 13TH JULY | J763: WEATHER | W763: NORTH BALLARAT | X763: 2 | Y763: 2 | Z763: 10 | AA763: 0 | AB763: 801 | AC763: 1218 | AD763: =(AB763/AC763)*100 -> 65.763546798029566 | AE763: =(Y763*4)+(AA763*2) -> 8
A764: FRANKSTON | C764: 6 | D764: 0 | E764: =(C764*6)+D764 -> 36 | G764: 9 | H764: 2 | I764: =(G764*6)+H764 -> 56 | K764: 11 | L764: 6 | M764: =(K764*6)+L764 -> 72 | O764: 15 | P764: 12 | Q764: =(O764*6)+P764 -> 102 | S764: Venue: FRANKSTON
A765: SPRINGVALE | C765: 2 | D765: 2 | E765: =(C765*6)+D765 -> 14 | G765: 8 | H765: 8 | I765: =(G765*6)+H765 -> 56 | K765: 8 | L765: 10 | M765: =(K765*6)+L765 -> 58 | O765: 10 | P765: 15 | Q765: =(O765*6)+P765 -> 75
A766: BEST PLAYERS
A767: WILLIAMSTOWN
A768: NORTHERN BULLANTS
A769: GOALKICKERS
A770: WILLIAMSTOWN
A771: NORTHERN BULLANTS
A773: BOX HILL | C773: 7 | D773: 9 | E773: =(C773*6)+D773 -> 51 | G773: 8 | H773: 14 | I773: =(G773*6)+H773 -> 62 | K773: 12 | L773: 15 | M773: =(K773*6)+L773 -> 87 | O773: 16 | P773: 18 | Q773: =(O773*6)+P773 -> 114 | S773: Venue: PRESTON
A774: NORTHERN BULLANTS | C774: 3 | D774: 1 | E774: =(C774*6)+D774 -> 19 | G774: 7 | H774: 3 | I774: =(G774*6)+H774 -> 45 | K774: 10 | L774: 4 | M774: =(K774*6)+L774 -> 64 | O774: 15 | P774: 5 | Q774: =(O774*6)+P774 -> 95
A775: BEST PLAYERS
A776: BOX HILL
A777: NORTHERN BULLANTS
A778: GOALKICKERS
A779: BOX HILL
A780: NORTHERN BULLANTS
A782: GEELONG | C782: 5 | D782: 1 | E782: =(C782*6)+D782 -> 31 | G782: 7 | H782: 2 | I782: =(G782*6)+H782 -> 44 | K782: 12 | L782: 7 | M782: =(K782*6)+L782 -> 79 | O782: 21 | P782: 12 | Q782: =(O782*6)+P782 -> 138 | S782: Venue: COBURG
A783: COBURG | C783: 2 | D783: 2 | E783: =(C783*6)+D783 -> 14 | G783: 5 | H783: 4 | I783: =(G783*6)+H783 -> 34 | K783: 9 | L783: 6 | M783: =(K783*6)+L783 -> 60 | O783: 14 | P783: 11 | Q783: =(O783*6)+P783 -> 95
A784: BEST PLAYERS
A785: GEELONG
A786: COBURG
A787: GOALKICKERS
A788: GEELONG
A789: COBURG
A791: PORT MELBOURNE | C791: 3 | D791: 3 | E791: =(C791*6)+D791 -> 21 | G791: 8 | H791: 7 | I791: =(G791*6)+H791 -> 55 | K791: 11 | L791: 11 | M791: =(K791*6)+L791 -> 77 | O791: 16 | P791: 12 | Q791: =(O791*6)+P791 -> 108 | S791: Venue: PORT MELBOURNE
A792: SANDRINGHAM | C792: 3 | D792: 3 | E792: =(C792*6)+D792 -> 21 | G792: 4 | H792: 7 | I792: =(G792*6)+H792 -> 31 | K792: 8 | L792: 9 | M792: =(K792*6)+L792 -> 57 | O792: 15 | P792: 13 | Q792: =(O792*6)+P792 -> 103
A793: BEST PLAYERS
A794: PORT MELBOURNE
A795: SANDRINGHAM | C795: OAKLEY | F795: HAYNES | I795: HUNTER | K795: FISHER | N795: ROBBINS | Q795: CARROLL
A796: GOALKICKERS
A797: PORT MELBOURNE
A798: SANDRINGHAM | C798: OAKLEY 8 | F798: FERRARO 2 | I798: RADFORD 2 | L798: GALLAGHER | O798: HAYNES | Q798: FISHER
A800: BYE | D800: WILLIAMSTOWN
A802: ROUND 15 | D802: 19TH JULY | J802: WEATHER
D803: 1ST QTR | H803: 2ND QTR | L803: 3RD QTR | P803: FINAL | S803: Venue: COBURG
A804: COBURG | C804: 2 | D804: 2 | E804: =(C804*6)+D804 -> 14 | G804: 10 | H804: 7 | I804: =(G804*6)+H804 -> 67 | K804: 13 | L804: 10 | M804: =(K804*6)+L804 -> 88 | O804: 18 | P804: 12 | Q804: =(O804*6)+P804 -> 120 | S804: UMPIRES | Z804: LADDER | AC804: ROUND | AE804: 15
A805: NORTH BALLARAT | C805: 4 | D805: 1 | E805: =(C805*6)+D805 -> 25 | G805: 5 | H805: 4 | I805: =(G805*6)+H805 -> 34 | K805: 9 | L805: 7 | M805: =(K805*6)+L805 -> 61 | O805: 11 | P805: 10 | Q805: =(O805*6)+P805 -> 76
A806: BEST PLAYERS | W806: TEAM | X806: B | Y806: W | Z806: L | AA806: D | AB806: FOR | AC806: AGST | AD806: % | AE806: PTS
A807: COBURG | C807: SHIR | F807: DEPASQUALE | I807: HART | K807: TALBOT | N807: TAYLOR | Q807: D KELLAWAY
A808: NORTH BALLARAT | C808: McCORKELL | F808: J SPOLDING | I808: GREIG | K808: JENKINS | W808: BOX HILL | X808: 2 | Y808: 12 | Z808: 1 | AA808: 0 | AB808: 1308 | AC808: 979 | AD808: =(AB808/AC808)*100 -> 133.60572012257407 | AE808: =(Y808*4)+(AA808*2) -> 48
A809: GOALKICKERS | I809: GIESCHEN | K809: TALBOT | M809: HART | O809: SHULZ | Q809: SIPTHORP | W809: PORT MELBOURNE | X809: 1 | Y809: 10 | Z809: 3 | AA809: 1 | AB809: 1466 | AC809: 1118 | AD809: =(AB809/AC809)*100 -> 131.12701252236135 | AE809: =(Y809*4)+(AA809*2) -> 42
A810: COBURG | C810: MILLS 4 | E810: TAYLOR 3 | G810: McGRATH 2 | J810: RANDELLO 2 | M810: DEPASQUALE | P810: FLAHERTY | W810: WILLIAMSTOWN | X810: 2 | Y810: 10 | Z810: 3 | AA810: 0 | AB810: 1358 | AC810: 995 | AD810: =(AB810/AC810)*100 -> 136.48241206030153 | AE810: =(Y810*4)+(AA810*2) -> 40
A811: NORTH BALLARAT | C811: BEARDSLEY 2 | F811: McCONNELL 2 | I811: JENKINS | K811: JURICA | M811: McCORKELL | P811: O'KEEFE | R811: SYMONS | W811: SANDRINGHAM | X811: 2 | Y811: 8 | Z811: 5 | AA811: 0 | AB811: 1238 | AC811: 1112 | AD811: =(AB811/AC811)*100 -> 111.33093525179856 | AE811: =(Y811*4)+(AA811*2) -> 32
M812: RUDD | O812: WINTER | W812: GEELONG | X812: 1 | Y812: 7 | Z812: 7 | AA812: 0 | AB812: 1313 | AC812: 1294 | AD812: =(AB812/AC812)*100 -> 101.46831530139104 | AE812: =(Y812*4)+(AA812*2) -> 28
A813: WILLIAMSTOWN | C813: 6 | D813: 3 | E813: =(C813*6)+D813 -> 39 | G813: 10 | H813: 6 | I813: =(G813*6)+H813 -> 66 | K813: 12 | L813: 12 | M813: =(K813*6)+L813 -> 84 | O813: 14 | P813: 15 | Q813: =(O813*6)+P813 -> 99 | S813: Venue: WILLIAMSTOWN | W813: FRANKSTON | X813: 1 | Y813: 7 | Z813: 7 | AA813: 0 | AB813: 1048 | AC813: 1136 | AD813: =(AB813/AC813)*100 -> 92.25352112676056 | AE813: =(Y813*4)+(AA813*2) -> 28
A814: FRANKSTON | C814: 1 | D814: 1 | E814: =(C814*6)+D814 -> 7 | G814: 2 | H814: 2 | I814: =(G814*6)+H814 -> 14 | K814: 5 | L814: 6 | M814: =(K814*6)+L814 -> 36 | O814: 7 | P814: 8 | Q814: =(O814*6)+P814 -> 50 | W814: TASMANIA | X814: 2 | Y814: 6 | Z814: 6 | AA814: 1 | AB814: 1337 | AC814: 1147 | AD814: =(AB814/AC814)*100 -> 116.56495204882302 | AE814: =(Y814*4)+(AA814*2) -> 26
A815: BEST PLAYERS | W815: SPRINGVALE | X815: 1 | Y815: 6 | Z815: 7 | AA815: 1 | AB815: 1349 | AC815: 1320 | AD815: =(AB815/AC815)*100 -> 102.1969696969697 | AE815: =(Y815*4)+(AA815*2) -> 26
A816: WILLIAMSTOWN | C816: SCOTLAND | F816: NIXON | I816: BALDWIN | L816: McGOUGH | N816: McKEE | Q816: RICHARDSON
A817: FRANKSTON | C817: HYNES | F817: ABLETT | I817: McCORMACK | L817: SHIPP | N817: ROBERTS | Q817: WHITE | W817: BENDIGO | X817: 2 | Y817: 5 | Z817: 7 | AA817: 1 | AB817: 1124 | AC817: 1342 | AD817: =(AB817/AC817)*100 -> 83.75558867362146 | AE817: =(Y817*4)+(AA817*2) -> 22
A818: GOALKICKERS | P818: SCOTLAND | W818: NORTHERN BULLANTS | X818: 2 | Y818: 5 | Z818: 8 | AA818: 0 | AB818: 1241 | AC818: 1302 | AD818: =(AB818/AC818)*100 -> 95.314900153609827 | AE818: =(Y818*4)+(AA818*2) -> 20
A819: WILLIAMSTOWN | C819: BALDWIN 4 | F819: NIXON 3 | H819: McKEE 2 | J819: DAVIS | L819: MAHONEY | N819: McGOUGH | Q819: RICHARDSON | W819: WERRIBEE | X819: 1 | Y819: 4 | Z819: 10 | AA819: 0 | AB819: 1238 | AC819: 1442 | AD819: =(AB819/AC819)*100 -> 85.852981969486819 | AE819: =(Y819*4)+(AA819*2) -> 16
A820: FRANKSTON | C820: ABLETT | E820: C CLARKE | G820: D CLARKE | J820: FOLINO | L820: GEORGIOU | N820: SHIPP | P820: WHITE | W820: COBURG | X820: 2 | Y820: 3 | Z820: 10 | AA820: 0 | AB820: 1022 | AC820: 1389 | AD820: =(AB820/AC820)*100 -> 73.578113750899931 | AE820: =(Y820*4)+(AA820*2) -> 12
D821: 20TH JULY | J821: WEATHER | W821: NORTH BALLARAT | X821: 2 | Y821: 2 | Z821: 11 | AA821: 0 | AB821: 877 | AC821: 1338 | AD821: =(AB821/AC821)*100 -> 65.545590433482815 | AE821: =(Y821*4)+(AA821*2) -> 8
A822: WERRIBEE | C822: 4 | D822: 0 | E822: =(C822*6)+D822 -> 24 | G822: 8 | H822: 2 | I822: =(G822*6)+H822 -> 50 | K822: 12 | L822: 5 | M822: =(K822*6)+L822 -> 77 | O822: 17 | P822: 10 | Q822: =(O822*6)+P822 -> 112 | S822: Venue: SHELL STADIUM (C/R)
A823: GEELONG | C823: 1 | D823: 4 | E823: =(C823*6)+D823 -> 10 | G823: 4 | H823: 10 | I823: =(G823*6)+H823 -> 34 | K823: 7 | L823: 12 | M823: =(K823*6)+L823 -> 54 | O823: 9 | P823: 12 | Q823: =(O823*6)+P823 -> 66
A824: BEST PLAYERS
A825: WERRIBEE | C825: SETCHELL | F825: RAU | I825: LAMB | L825: MITCHELL | O825: CONDOS | R825: ROBERTSON
A826: GEELONG | C826: BYRNES | F826: CARAZZO | I826: COOK | L826: FINNIN | O826: TREVASKIS
A827: GOALKICKERS
A828: WERRIBEE | C828: CONDOS 7 | F828: MITCHELL 7 | J828: BIRSS | L828: McMAHON | N828: PODSIADLY
A829: GEELONG | C829: BYRNES 3 | F829: CARAZZO 2 | I829: CLARKE | K829: GARDINER | N829: LYONS | P829: PLAYFAIR
A831: TASMANIA | C831: 4 | D831: 5 | E831: =(C831*6)+D831 -> 29 | G831: 10 | H831: 11 | I831: =(G831*6)+H831 -> 71 | K831: 13 | L831: 15 | M831: =(K831*6)+L831 -> 93 | O831: 20 | P831: 16 | Q831: =(O831*6)+P831 -> 136 | S831: Venue: YORK PARK (Launceston)
A832: NORTHERN BULLANTS | C832: 3 | D832: 0 | E832: =(C832*6)+D832 -> 18 | G832: 8 | H832: 3 | I832: =(G832*6)+H832 -> 51 | K832: 11 | L832: 5 | M832: =(K832*6)+L832 -> 71 | O832: 13 | P832: 6 | Q832: =(O832*6)+P832 -> 84
A833: BEST PLAYERS
A834: TASMANIA | C834: RICHTER | F834: JENKINS | I834: BLIGHT | L834: ATKIN | O834: WALKER | R834: TAYLOR
A835: NORTHERN BULLANTS | C835: McCORMICK | F835: FLETCHER | I835: SAAD | L835: ZORZI | O835: O'KEEFE
A836: GOALKICKERS
A837: TASMANIA | C837: BARTLETT 5 | F837: BEAMS 3 | I837: CANN 3 | K837: THURLEY 2 | N837: CRIPPS | P837: DERBYSHIRE | S837: DOERING | V837: HOWARD | X837: HEATLEY | AA837: THOMPSON | AD837: WAGER
A838: NORTHERN BULLANTS | C838: SAUTNER 4 | F838: GIBSON 3 | I838: SAAD 3 | K838: PLUNKETT | N838: RAMSAY | P838: ZORZI
A840: SPRINGVALE | C840: 4 | D840: 4 | E840: =(C840*6)+D840 -> 28 | G840: 7 | H840: 5 | I840: =(G840*6)+H840 -> 47 | K840: 12 | L840: 7 | M840: =(K840*6)+L840 -> 79 | O840: 17 | P840: 8 | Q840: =(O840*6)+P840 -> 110 | S840: Venue: SPRINGVALE
A841: PORT MELBOURNE | C841: 4 | D841: 4 | E841: =(C841*6)+D841 -> 28 | G841: 7 | H841: 8 | I841: =(G841*6)+H841 -> 50 | K841: 11 | L841: 13 | M841: =(K841*6)+L841 -> 79 | O841: 15 | P841: 20 | Q841: =(O841*6)+P841 -> 110
A842: BEST PLAYERS
A843: SPRINGVALE | C843: MILNE | F843: OLIVER | I843: BARHAM | L843: CARROLL | O843: MOYLE | R843: FISHER
A844: PORT MELBOURNE | C844: SMITH | F844: BOURKE | I844: OBST | L844: J CLAYTON | O844: S MOTLOP | R844: ALEXANDER
A845: GOALKICKERS
A846: SPRINGVALE | C846: MILNE 8 | F846: CALLAGHAN 3 | I846: HOULIHAN | L846: FERGUSON | O846: FISHER | Q846: MOYLE | S846: MURRAY | W846: THOMPSON
A847: PORT MELBOURNE | C847: DAVEY 4 | F847: J CLAYTON 3 | I847: ALEXANDER 2 | L847: McINTOSH 2 | O847: MORRELL 2 | R847: HARRIS | T847: McMAHON
A849: BYE | D849: BENDIGO | G849: BOX HILL | J849: SANDRINGHAM
A851: ROUND 16 | D851: 26TH JULY | J851: WEATHER
D852: 1ST QTR | H852: 2ND QTR | L852: 3RD QTR | P852: FINAL | S852: Venue: WILLIAMSTOWN
A853: WILLIAMSTOWN | C853: 0 | D853: 2 | E853: =(C853*6)+D853 -> 2 | G853: 8 | H853: 5 | I853: =(G853*6)+H853 -> 53 | K853: 11 | L853: 7 | M853: =(K853*6)+L853 -> 73 | O853: 13 | P853: 9 | Q853: =(O853*6)+P853 -> 87 | S853: UMPIRES | Z853: LADDER | AC853: ROUND | AE853: 16
A854: NORTHERN BULLANTS | C854: 3 | D854: 5 | E854: =(C854*6)+D854 -> 23 | G854: 5 | H854: 7 | I854: =(G854*6)+H854 -> 37 | K854: 7 | L854: 12 | M854: =(K854*6)+L854 -> 54 | O854: 8 | P854: 15 | Q854: =(O854*6)+P854 -> 63
A855: BEST PLAYERS | W855: TEAM | X855: B | Y855: W | Z855: L | AA855: D | AB855: FOR | AC855: AGST | AD855: % | AE855: PTS
A856: WILLIAMSTOWN | C856: CRANAGE | F856: MAHONEY | I856: SWAN | L856: FLETCHER | O856: KING | Q856: FREEBORN
A857: NORTHERN BULLANTS | C857: VANSITTART | F857: ZORZI | I857: PENN | L857: O'KEEFE | O857: MURPHY | W857: BOX HILL | X857: 2 | Y857: 13 | Z857: 1 | AA857: 0 | AB857: 1412 | AC857: 1037 | AD857: =(AB857/AC857)*100 -> 136.16200578592094 | AE857: =(Y857*4)+(AA857*2) -> 52
A858: GOALKICKERS | P858: KING | W858: WILLIAMSTOWN | X858: 2 | Y858: 11 | Z858: 3 | AA858: 0 | AB858: 1445 | AC858: 1058 | AD858: =(AB858/AC858)*100 -> 136.57844990548205 | AE858: =(Y858*4)+(AA858*2) -> 44
A859: WILLIAMSTOWN | C859: MAHONEY 3 | F859: FLETCHER 2 | I859: FREEBORN 2 | L859: TAYLOR 2 | N859: BALDWIN | Q859: CRANAGE | T859: DAVIS | W859: PORT MELBOURNE | X859: 2 | Y859: 10 | Z859: 3 | AA859: 1 | AB859: 1466 | AC859: 1118 | AD859: =(AB859/AC859)*100 -> 131.12701252236135 | AE859: =(Y859*4)+(AA859*2) -> 42
A860: NORTHERN BULLANTS | C860: SAUTNER 3 | F860: FLETCHER 2 | I860: ECCLES | K860: MERRINGTON | N860: ZORZI | W860: SANDRINGHAM | X860: 2 | Y860: 8 | Z860: 6 | AA860: 0 | AB860: 1304 | AC860: 1213 | AD860: =(AB860/AC860)*100 -> 107.50206100577083 | AE860: =(Y860*4)+(AA860*2) -> 32
W861: TASMANIA | X861: 2 | Y861: 7 | Z861: 6 | AA861: 1 | AB861: 1406 | AC861: 1186 | AD861: =(AB861/AC861)*100 -> 118.54974704890388 | AE861: =(Y861*4)+(AA861*2) -> 30
A862: TASMANIA | C862: 4 | D862: 3 | E862: =(C862*6)+D862 -> 27 | G862: 7 | H862: 7 | I862: =(G862*6)+H862 -> 49 | K862: 9 | L862: 8 | M862: =(K862*6)+L862 -> 62 | O862: 10 | P862: 9 | Q862: =(O862*6)+P862 -> 69 | S862: Venue: FRANKSTON | W862: SPRINGVALE | X862: 1 | Y862: 7 | Z862: 7 | AA862: 1 | AB862: 1496 | AC862: 1388 | AD862: =(AB862/AC862)*100 -> 107.78097982708934 | AE862: =(Y862*4)+(AA862*2) -> 30
A863: FRANKSTON | C863: 0 | D863: 3 | E863: =(C863*6)+D863 -> 3 | G863: 1 | H863: 5 | I863: =(G863*6)+H863 -> 11 | K863: 1 | L863: 7 | M863: =(K863*6)+L863 -> 13 | O863: 5 | P863: 9 | Q863: =(O863*6)+P863 -> 39 | W863: GEELONG | X863: 1 | Y863: 7 | Z863: 8 | AA863: 0 | AB863: 1371 | AC863: 1398 | AD863: =(AB863/AC863)*100 -> 98.068669527897001 | AE863: =(Y863*4)+(AA863*2) -> 28
A864: BEST PLAYERS | W864: FRANKSTON | X864: 1 | Y864: 7 | Z864: 8 | AA864: 0 | AB864: 1087 | AC864: 1205 | AD864: =(AB864/AC864)*100 -> 90.207468879668056 | AE864: =(Y864*4)+(AA864*2) -> 28
A865: TASMANIA | C865: STREET | F865: ATKIN | I865: BLIGHT | L865: HEATLEY | O865: HOWARD | R865: DOERING
A866: FRANKSTON | C866: ROBERTS | F866: CADD | I866: D CLARKE | L866: ANDERSON | O866: WILLIS | R866: LYON | W866: BENDIGO | X866: 2 | Y866: 6 | Z866: 7 | AA866: 1 | AB866: 1225 | AC866: 1408 | AD866: =(AB866/AC866)*100 -> 87.002840909090907 | AE866: =(Y866*4)+(AA866*2) -> 26
A867: GOALKICKERS | W867: NORTHERN BULLANTS | X867: 2 | Y867: 5 | Z867: 9 | AA867: 0 | AB867: 1304 | AC867: 1389 | AD867: =(AB867/AC867)*100 -> 93.88048956083513 | AE867: =(Y867*4)+(AA867*2) -> 20
A868: TASMANIA | C868: HEATLEY 4 | F868: CALLINAN 2 | I868: BARTLETT | K868: CANN | M868: TAYLOR | O868: WALKER | W868: WERRIBEE | X868: 1 | Y868: 5 | Z868: 10 | AA868: 0 | AB868: 1340 | AC868: 1483 | AD868: =(AB868/AC868)*100 -> 90.357383681726233 | AE868: =(Y868*4)+(AA868*2) -> 20
A869: FRANKSTON | C869: BEASY 2 | F869: ABLETT | H869: BREWSTER | J869: WINTERTON | W869: COBURG | X869: 2 | Y869: 3 | Z869: 11 | AA869: 0 | AB869: 1063 | AC869: 1491 | AD869: =(AB869/AC869)*100 -> 71.294433266264264 | AE869: =(Y869*4)+(AA869*2) -> 12
D870: 27TH JULY | J870: WEATHER | W870: NORTH BALLARAT | X870: 2 | Y870: 2 | Z870: 12 | AA870: 0 | AB870: 945 | AC870: 1485 | AD870: =(AB870/AC870)*100 -> 63.636363636363633 | AE870: =(Y870*4)+(AA870*2) -> 8
A871: BOX HILL | C871: 5 | D871: 3 | E871: =(C871*6)+D871 -> 33 | G871: 7 | H871: 9 | I871: =(G871*6)+H871 -> 51 | K871: 9 | L871: 14 | M871: =(K871*6)+L871 -> 68 | O871: 14 | P871: 20 | Q871: =(O871*6)+P871 -> 104 | S871: Venue: BOX HILL
A872: GEELONG | C872: 2 | D872: 5 | E872: =(C872*6)+D872 -> 17 | G872: 4 | H872: 5 | I872: =(G872*6)+H872 -> 29 | K872: 8 | L872: 10 | M872: =(K872*6)+L872 -> 58 | O872: 8 | P872: 10 | Q872: =(O872*6)+P872 -> 58
A873: BEST PLAYERS
A874: BOX HILL | C874: CLARKE | F874: PICIAONE | I874: JOHNSON | L874: LADSON | N874: KANE | Q874: HARFORD
A875: GEELONG | C875: CALLAN | F875: CARAZZO | I875: MURPHY | L875: KINGSLEY | N875: SMITH | Q875: McCARTHY
A876: GOALKICKERS
A877: BOX HILL | C877: LADSON 4 | F877: LOATS 3 | I877: CLARKE 2 | L877: ANDERSON | N877: JOHNSON | P877: McCABE | R877: PICIAONE | V877: RIX
A878: GEELONG | C878: KINGSLEY 3 | F878: McCARTHY 2 | I878: BIGGS | K878: MURPHY | M878: SMITH
A880: SPRINGVALE | C880: 4 | D880: 3 | E880: =(C880*6)+D880 -> 27 | G880: 10 | H880: 9 | I880: =(G880*6)+H880 -> 69 | K880: 15 | L880: 10 | M880: =(K880*6)+L880 -> 100 | O880: 22 | P880: 15 | Q880: =(O880*6)+P880 -> 147 | S880: Venue: SPRINGVALE
A881: NORTH BALLARAT | C881: 4 | D881: 3 | E881: =(C881*6)+D881 -> 27 | G881: 6 | H881: 4 | I881: =(G881*6)+H881 -> 40 | K881: 10 | L881: 7 | M881: =(K881*6)+L881 -> 67 | O881: 10 | P881: 8 | Q881: =(O881*6)+P881 -> 68
A882: BEST PLAYERS
A883: SPRINGVALE | C883: CARMODY | F883: MURRAY | I883: BARHAM | L883: CARROLL | N883: FISHER | Q883: OLIVER
A884: NORTH BALLARAT | C884: SPOLDING | F884: MOLONEY | I884: O'KEEFE | L884: JURICA
A885: GOALKICKERS
A886: SPRINGVALE | C886: CARMODY 6 | F886: BARHAM 4 | I886: CALLAGHAN 4 | L886: MURRAY 2 | N886: THOMPSON 2 | Q886: HOULIHAN | T886: OLIVER | W886: FISHER | X886: B SCHWARZE
A887: NORTH BALLARAT | C887: McCORKELL 2 | F887: SPOLDING 2 | I887: CLARK | K887: JURICA | M887: McCONNELL | P887: McNAMARA | S887: O'KEEFE | W887: WINTER
A889: WERRIBEE | C889: 3 | D889: 1 | E889: =(C889*6)+D889 -> 19 | G889: 6 | H889: 3 | I889: =(G889*6)+H889 -> 39 | K889: 11 | L889: 7 | M889: =(K889*6)+L889 -> 73 | O889: 15 | P889: 12 | Q889: =(O889*6)+P889 -> 102 | S889: Venue: WERRIBEE
A890: COBURG | C890: 4 | D890: 2 | E890: =(C890*6)+D890 -> 26 | G890: 4 | H890: 7 | I890: =(G890*6)+H890 -> 31 | K890: 4 | L890: 8 | M890: =(K890*6)+L890 -> 32 | O890: 5 | P890: 11 | Q890: =(O890*6)+P890 -> 41
A891: BEST PLAYERS
A892: WERRIBEE | C892: BIRSS | F892: HENDERSON | I892: MORRIS | L892: POWER | O892: PODSIADLY | R892: LAMB
A893: COBURG | C893: TALBOT | F893: KURET | I893: SHIR | L893: FLAHERTY | O893: PAGAN
A894: GOALKICKERS
A895: WERRIBEE | C895: PODSIADLY 5 | F895: LAMB 2 | I895: MURPHY 2 | L895: CONDOS | N895: POWER | P895: PICKEN | R895: SKIPPER | T895: SMITH | V895: WIGGINS
A896: COBURG | C896: KURET 3 | F896: FLAHERTY | I896: MILLS
A898: BENDIGO | C898: 4 | D898: 3 | E898: =(C898*6)+D898 -> 27 | G898: 8 | H898: 5 | I898: =(G898*6)+H898 -> 53 | K898: 10 | L898: 8 | M898: =(K898*6)+L898 -> 68 | O898: 15 | P898: 11 | Q898: =(O898*6)+P898 -> 101 | S898: Venue: BENDIGO
A899: SANDRINGHAM | C899: 5 | D899: 4 | E899: =(C899*6)+D899 -> 34 | G899: 6 | H899: 6 | I899: =(G899*6)+H899 -> 42 | K899: 7 | L899: 10 | M899: =(K899*6)+L899 -> 52 | O899: 9 | P899: 12 | Q899: =(O899*6)+P899 -> 66
A900: BEST PLAYERS
A901: BENDIGO | C901: RICHARDS | F901: HAYNES | I901: HUNT | L901: T McGRATH | O901: HENNEMAN | R901: CARTER
A902: SANDRINGHAM | C902: RIVERS | F902: GRANT | I902: HUNTER | L902: SMITH | O902: OAKLEY | R902: HOWARTH
A903: GOALKICKERS
A904: BENDIGO | C904: RICHARDS 5 | F904: HAYNES 3 | I904: CAIL | K904: DAVIES | M904: HALL | N904: JOHNS | P904: LAYCOCK | R904: LOVETT-MURRAY | X904: WALSH
A905: SANDRINGHAM | C905: OAKLEY 4 | F905: CARSON | I905: GALLAGHER | L905: HAYNES | N905: RADFORD | Q905: SMITH
A907: BYE | D907: PORT MELBOURNE
A909: ROUND 17 | D909: 2ND AUGUST | J909: WEATHER
D910: 1ST QTR | H910: 2ND QTR | L910: 3RD QTR | P910: FINAL | S910: Venue: PORT MELBOURNE
A911: PORT MELBOURNE | C911: 0 | D911: 7 | E911: =(C911*6)+D911 -> 7 | G911: 7 | H911: 12 | I911: =(G911*6)+H911 -> 54 | K911: 11 | L911: 14 | M911: =(K911*6)+L911 -> 80 | O911: 18 | P911: 19 | Q911: =(O911*6)+P911 -> 127 | S911: UMPIRES | Z911: LADDER | AC911: ROUND | AE911: 17
A912: GEELONG | C912: 6 | D912: 2 | E912: =(C912*6)+D912 -> 38 | G912: 8 | H912: 7 | I912: =(G912*6)+H912 -> 55 | K912: 11 | L912: 11 | M912: =(K912*6)+L912 -> 77 | O912: 13 | P912: 13 | Q912: =(O912*6)+P912 -> 91
A913: BEST PLAYERS | W913: TEAM | X913: B | Y913: W | Z913: L | AA913: D | AB913: FOR | AC913: AGST | AD913: % | AE913: PTS
A914: PORT MELBOURNE | C914: STEVENS | F914: HARRIS | I914: TEAGUE | L914: S MOTLOP | O914: J CLAYTON | R914: MORRELL
A915: GEELONG | C915: CARRAZZO | F915: WHITE | I915: CALLAN | L915: COOK | W915: BOX HILL | X915: 2 | Y915: 13 | Z915: 2 | AA915: 0 | AB915: 1487 | AC915: 1117 | AD915: =(AB915/AC915)*100 -> 133.12444046553267 | AE915: =(Y915*4)+(AA915*2) -> 52
A916: GOALKICKERS | P916: S MOTLOP | W916: PORT MELBOURNE | X916: 2 | Y916: 11 | Z916: 3 | AA916: 1 | AB916: 1593 | AC916: 1209 | AD916: =(AB916/AC916)*100 -> 131.76178660049629 | AE916: =(Y916*4)+(AA916*2) -> 46
A917: PORT MELBOURNE | C917: ALLEWAY 4 | F917: MORRELL 4 | I917: STEVENS 3 | L917: PHIBBS 2 | N917: WATSON 2 | Q917: DELUCA | S917: HARRIS | W917: WILLIAMSTOWN | X917: 2 | Y917: 11 | Z917: 4 | AA917: 0 | AB917: 1528 | AC917: 1164 | AD917: =(AB917/AC917)*100 -> 131.27147766323023 | AE917: =(Y917*4)+(AA917*2) -> 44
A918: GEELONG | C918: KINGSLEY 3 | F918: LONERGAN 2 | I918: BRIGHT | K918: BYRNES | M918: CALLAN | O918: CARAZZO | Q918: CLARKE | S918: FINNIN | W918: SANDRINGHAM | X918: 2 | Y918: 9 | Z918: 6 | AA918: 0 | AB918: 1404 | AC918: 1210 | AD918: =(AB918/AC918)*100 -> 116.03305785123968 | AE918: =(Y918*4)+(AA918*2) -> 36
N919: GARDINER | Q919: JORDAN | W919: TASMANIA | X919: 2 | Y919: 7 | Z919: 7 | AA919: 1 | AB919: 1503 | AC919: 1286 | AD919: =(AB919/AC919)*100 -> 116.87402799377915 | AE919: =(Y919*4)+(AA919*2) -> 30
A920: COBURG | C920: 4 | D920: 3 | E920: =(C920*6)+D920 -> 27 | G920: 6 | H920: 4 | I920: =(G920*6)+H920 -> 40 | K920: 10 | L920: 6 | M920: =(K920*6)+L920 -> 66 | O920: 12 | P920: 8 | Q920: =(O920*6)+P920 -> 80 | S920: Venue: COBURG | W920: SPRINGVALE | X920: 2 | Y920: 7 | Z920: 7 | AA920: 1 | AB920: 1496 | AC920: 1388 | AD920: =(AB920/AC920)*100 -> 107.78097982708934 | AE920: =(Y920*4)+(AA920*2) -> 30
A921: BOX HILL | C921: 2 | D921: 3 | E921: =(C921*6)+D921 -> 15 | G921: 6 | H921: 3 | I921: =(G921*6)+H921 -> 39 | K921: 8 | L921: 4 | M921: =(K921*6)+L921 -> 52 | O921: 11 | P921: 9 | Q921: =(O921*6)+P921 -> 75 | W921: BENDIGO | X921: 2 | Y921: 7 | Z921: 7 | AA921: 1 | AB921: 1336 | AC921: 1416 | AD921: =(AB921/AC921)*100 -> 94.350282485875709 | AE921: =(Y921*4)+(AA921*2) -> 30
A922: BEST PLAYERS | W922: GEELONG | X922: 1 | Y922: 7 | Z922: 9 | AA922: 0 | AB922: 1462 | AC922: 1525 | AD922: =(AB922/AC922)*100 -> 95.868852459016395 | AE922: =(Y922*4)+(AA922*2) -> 28
A923: COBURG | C923: HOULIHAN | F923: CARLYLE | I923: CARLSON | L923: HYDE | O923: WHYMAN | R923: VARDY
A924: BOX HILL | C924: KENNA | F924: SEWELL | I924: MCCABE | L924: S COX | O924: HEENAN | R924: LONIE | W924: FRANKSTON | X924: 1 | Y924: 7 | Z924: 9 | AA924: 0 | AB924: 1152 | AC924: 1291 | AD924: =(AB924/AC924)*100 -> 89.233152594887684 | AE924: =(Y924*4)+(AA924*2) -> 28
A925: GOALKICKERS | W925: WERRIBEE | X925: 1 | Y925: 6 | Z925: 10 | AA925: 0 | AB925: 1426 | AC925: 1548 | AD925: =(AB925/AC925)*100 -> 92.118863049095609 | AE925: =(Y925*4)+(AA925*2) -> 24
A926: COBURG | C926: WHYMAN 4 | F926: VARDY 3 | I926: HOULIHAN 2 | L926: BIDDISCOMBE | O926: PETTIFER | Q926: TREMELLIN | W926: NORTHERN BULLANTS | X926: 2 | Y926: 5 | Z926: 10 | AA926: 0 | AB926: 1412 | AC926: 1500 | AD926: =(AB926/AC926)*100 -> 94.13333333333334 | AE926: =(Y926*4)+(AA926*2) -> 20
A927: BOX HILL | C927: KENNA 4 | F927: S COX 2 | I927: LONIE 2 | L927: HAZELL | N927: HUNTER | P927: KANE | W927: COBURG | X927: 2 | Y927: 4 | Z927: 11 | AA927: 0 | AB927: 1143 | AC927: 1566 | AD927: =(AB927/AC927)*100 -> 72.988505747126439 | AE927: =(Y927*4)+(AA927*2) -> 16
W928: NORTH BALLARAT | X928: 2 | Y928: 3 | Z928: 12 | AA928: 0 | AB928: 1051 | AC928: 1568 | AD928: =(AB928/AC928)*100 -> 67.028061224489804 | AE928: =(Y928*4)+(AA928*2) -> 12
A929: NORTH BALLARAT | C929: 2 | D929: 1 | E929: =(C929*6)+D929 -> 13 | G929: 6 | H929: 5 | I929: =(G929*6)+H929 -> 41 | K929: 13 | L929: 8 | M929: =(K929*6)+L929 -> 86 | O929: 16 | P929: 10 | Q929: =(O929*6)+P929 -> 106 | S929: Venue: NORTH BALLARAT
A930: WILLIAMSTOWN | C930: 3 | D930: 3 | E930: =(C930*6)+D930 -> 21 | G930: 6 | H930: 6 | I930: =(G930*6)+H930 -> 42 | K930: 8 | L930: 8 | M930: =(K930*6)+L930 -> 56 | O930: 12 | P930: 11 | Q930: =(O930*6)+P930 -> 83
A931: BEST PLAYERS
A932: NORTH BALLARAT | C932: SAUNDERS | F932: MOLONEY | I932: McNAMARA | L932: McMAHON | O932: FIELD | Q932: JURICA
A933: WILLIAMSTOWN | C933: SCOTLAND | F933: HOLLOW | I933: MULLINS | L933: LLOYD
A934: GOALKICKERS | N934: McCORKELL | Q934: SHEEDY
A935: NORTH BALLARAT | C935: McMAHON 5 | F935: SAUNDERS 3 | I935: WINTER 2 | K935: FRITH | M935: JURICA | O935: MOLONEY | Q935: McCONNELL
A936: WILLIAMSTOWN | C936: SCOTLAND 5 | F936: DAVIS 2 | I936: FREEBORN 2 | L936: RICHARDSON 2 | O936: LLOYD
A938: SANDRINGHAM | C938: 6 | D938: 2 | E938: =(C938*6)+D938 -> 38 | G938: 8 | H938: 5 | I938: =(G938*6)+H938 -> 53 | K938: 14 | L938: 10 | M938: =(K938*6)+L938 -> 94 | O938: 15 | P938: 10 | Q938: =(O938*6)+P938 -> 100 | S938: Venue: BEACH ROAD
A939: TASMANIA | C939: 3 | D939: 2 | E939: =(C939*6)+D939 -> 20 | G939: 9 | H939: 4 | I939: =(G939*6)+H939 -> 58 | K939: 10 | L939: 5 | M939: =(K939*6)+L939 -> 65 | O939: 15 | P939: 7 | Q939: =(O939*6)+P939 -> 97
A940: BEST PLAYERS
A941: SANDRINGHAM | C941: FERGUSON | F941: FISHER | I941: THOMPSON | L941: HOWARTH | O941: GRANT | Q941: WHEATLEY
A942: TASMANIA | C942: HOWARD | F942: B GEAPPEN | I942: ATKIN | L942: BLIGHT | O942: CANN | Q942: HEATLEY
A943: GOALKICKERS
A944: SANDRINGHAM | C944: WHEATLEY 3 | F944: FERGUSON 3 | I944: FISHER 3 | L944: OAKLEY 2 | N944: THOMPSON 2 | Q944: CARSON | S944: HOWARTH
A945: TASMANIA | C945: B GEAPPEN 4 | F945: CALLINAN 2 | I945: CANN 2 | K945: HEATLEY 2 | M945: ATKIN | O945: BEAMS | Q945: M GEAPPEN | T945: HOWARD | W945: STREET
D946: 3RD AUGUST | J946: WEATHER
A947: BENDIGO | C947: 4 | D947: 7 | E947: =(C947*6)+D947 -> 31 | G947: 6 | H947: 8 | I947: =(G947*6)+H947 -> 44 | K947: 15 | L947: 12 | M947: =(K947*6)+L947 -> 102 | O947: 16 | P947: 15 | Q947: =(O947*6)+P947 -> 111 | S947: Venue: PRESTON
A948: NORTHERN BULLANTS | C948: 2 | D948: 1 | E948: =(C948*6)+D948 -> 13 | G948: 10 | H948: 8 | I948: =(G948*6)+H948 -> 68 | K948: 11 | L948: 9 | M948: =(K948*6)+L948 -> 75 | O948: 16 | P948: 12 | Q948: =(O948*6)+P948 -> 108
A949: BEST PLAYERS
A950: BENDIGO | C950: HALL | F950: C McGRATH | I950: DAVIES | L950: CARTER | O950: CAIL | Q950: FORSTER-KNIGHT
A951: NORTHERN BULLANTS | C951: FLETCHER | F951: PLUNKETT | I951: STINEAR | L951: SAUTNER | O951: VANSITTART
A952: GOALKICKERS
A953: BENDIGO | C953: HALL 4 | E953: HARVEY 2 | G953: FORSTER-KNIGHT 2 | K953: WALSH 2 | M953: BROWN | O953: DAVIES | Q953: CAIL | S953: LAYCOCK | W953: LOVETT-MURRAY | Y953: RICHARDS
A954: NORTHERN BULLANTS | C954: SAUTNER 4 | F954: PLUNKETT 2 | I954: STINEAR 2 | K954: ECCLES | M954: FLETCHER | P954: FRENCH | R954: GIBSON | U954: MATTHEWS | X954: MERRINGTON | AB954: PENN | AC954: SAAD
A956: WERRIBEE | C956: 5 | D956: 2 | E956: =(C956*6)+D956 -> 32 | G956: 9 | H956: 4 | I956: =(G956*6)+H956 -> 58 | K956: 11 | L956: 7 | M956: =(K956*6)+L956 -> 73 | O956: 13 | P956: 8 | Q956: =(O956*6)+P956 -> 86 | S956: Venue: WERRIBEE
A957: FRANKSTON | C957: 2 | D957: 0 | E957: =(C957*6)+D957 -> 12 | G957: 3 | H957: 2 | I957: =(G957*6)+H957 -> 20 | K957: 4 | L957: 3 | M957: =(K957*6)+L957 -> 27 | O957: 10 | P957: 5 | Q957: =(O957*6)+P957 -> 65
A958: BEST PLAYERS
A959: WERRIBEE | C959: GIANSIRACUSA | F959: HUDSON | I959: LAMB | L959: HENDERSON | O959: SETCHELL | R959: MORRIS
A960: FRANKSTON | C960: HYNES | F960: ROBERTS | I960: ABLETT | L960: GEORGIOU | O960: GODDARD
A961: GOALKICKERS
A962: WERRIBEE | C962: MITCHELL 4 | F962: PODSIADLY 4 | I962: HENDERSON 2 | M962: HUDSON | O962: MURPHY | Q962: SETCHELL
A963: FRANKSTON | C963: BLACK 2 | F963: HYNES 2 | I963: ABLETT | K963: C CLARKE | M963: D CLARKE | O963: McCORMACK | R963: OGIER | U963: WHITE
A965: BYE | D965: SPRINGVALE
A967: ROUND 18 | D967: 8TH AUGUST | G967: NIGHT MATCH | J967: WEATHER
D968: 1ST QTR | H968: 2ND QTR | L968: 3RD QTR | P968: FINAL | S968: Venue: YORK PARK (Launceston)
A969: WILLIAMSTOWN | C969: 3 | D969: 0 | E969: =(C969*6)+D969 -> 18 | G969: 7 | H969: 4 | I969: =(G969*6)+H969 -> 46 | K969: 10 | L969: 7 | M969: =(K969*6)+L969 -> 67 | O969: 13 | P969: 12 | Q969: =(O969*6)+P969 -> 90 | S969: UMPIRES | Z969: LADDER | AC969: ROUND | AE969: 18
A970: TASMANIA | C970: 3 | D970: 0 | E970: =(C970*6)+D970 -> 18 | G970: 5 | H970: 1 | I970: =(G970*6)+H970 -> 31 | K970: 6 | L970: 3 | M970: =(K970*6)+L970 -> 39 | O970: 7 | P970: 10 | Q970: =(O970*6)+P970 -> 52
A971: BEST PLAYERS | W971: TEAM | X971: B | Y971: W | Z971: L | AA971: D | AB971: FOR | AC971: AGST | AD971: % | AE971: PTS
A972: WILLIAMSTOWN | C972: FLETCHER | F972: CRANAGE | I972: HOLLOW | L972: SHACKLETON | O972: SCOTLAND | R972: MULLINS
A973: TASMANIA | C973: DOERING | F973: HEATLEY | I973: WAGER | L973: GILMOUR | O973: ATKIN | R973: WALKER | W973: BOX HILL | X973: 2 | Y973: 14 | Z973: 2 | AA973: 0 | AB973: 1622 | AC973: 1185 | AD973: =(AB973/AC973)*100 -> 136.87763713080167 | AE973: =(Y973*4)+(AA973*2) -> 56
A974: GOALKICKERS | Q974: WEST | W974: PORT MELBOURNE | X974: 2 | Y974: 12 | Z974: 3 | AA974: 1 | AB974: 1730 | AC974: 1320 | AD974: =(AB974/AC974)*100 -> 131.06060606060606 | AE974: =(Y974*4)+(AA974*2) -> 50
A975: WILLIAMSTOWN | C975: RICHARDSON 3 | F975: CLOKE 2 | H975: DAVIS 2 | J975: CRANAGE | M975: EICHNER | O975: MAHONEY | Q975: NIXON | S975: SMOKER | W975: WILLIAMSTOWN | X975: 2 | Y975: 12 | Z975: 4 | AA975: 0 | AB975: 1618 | AC975: 1216 | AD975: =(AB975/AC975)*100 -> 133.05921052631581 | AE975: =(Y975*4)+(AA975*2) -> 48
A976: TASMANIA | C976: BARTLETT 2 | F976: DOERING 2 | I976: CALLINAN | K976: CANN | M976: B GEAPPEN | W976: SANDRINGHAM | X976: 2 | Y976: 9 | Z976: 7 | AA976: 0 | AB976: 1496 | AC976: 1317 | AD976: =(AB976/AC976)*100 -> 113.59149582384207 | AE976: =(Y976*4)+(AA976*2) -> 36
D977: 9TH AUGUST | J977: WEATHER | W977: GEELONG | X977: 1 | Y977: 8 | Z977: 9 | AA977: 0 | AB977: 1569 | AC977: 1617 | AD977: =(AB977/AC977)*100 -> 97.031539888682744 | AE977: =(Y977*4)+(AA977*2) -> 32
A978: GEELONG | C978: 2 | D978: 2 | E978: =(C978*6)+D978 -> 14 | G978: 8 | H978: 4 | I978: =(G978*6)+H978 -> 52 | K978: 12 | L978: 9 | M978: =(K978*6)+L978 -> 81 | O978: 16 | P978: 11 | Q978: =(O978*6)+P978 -> 107 | S978: Venue: SHELL STADIUM | W978: FRANKSTON | X978: 1 | Y978: 8 | Z978: 9 | AA978: 0 | AB978: 1247 | AC978: 1381 | AD978: =(AB978/AC978)*100 -> 90.296886314265024 | AE978: =(Y978*4)+(AA978*2) -> 32
A979: SANDRINGHAM | C979: 2 | D979: 5 | E979: =(C979*6)+D979 -> 17 | G979: 5 | H979: 8 | I979: =(G979*6)+H979 -> 38 | K979: 6 | L979: 11 | M979: =(K979*6)+L979 -> 47 | O979: 13 | P979: 14 | Q979: =(O979*6)+P979 -> 92 | W979: TASMANIA | X979: 2 | Y979: 7 | Z979: 8 | AA979: 1 | AB979: 1555 | AC979: 1376 | AD979: =(AB979/AC979)*100 -> 113.00872093023256 | AE979: =(Y979*4)+(AA979*2) -> 30
A980: BEST PLAYERS | W980: SPRINGVALE | X980: 2 | Y980: 7 | Z980: 8 | AA980: 1 | AB980: 1605 | AC980: 1505 | AD980: =(AB980/AC980)*100 -> 106.64451827242524 | AE980: =(Y980*4)+(AA980*2) -> 30
A981: GEELONG | C981: CALLAN | F981: CARRAZZO | I981: STREET | L981: GARDINER | O981: MOONEY | R981: GRGIC
A982: SANDRINGHAM | C982: S RADFORD | F982: LAMB | I982: GREEN | L982: GALLAGHER | O982: BRYAN | R982: FERGUSON | W982: BENDIGO | X982: 2 | Y982: 7 | Z982: 8 | AA982: 1 | AB982: 1426 | AC982: 1511 | AD982: =(AB982/AC982)*100 -> 94.374586366644607 | AE982: =(Y982*4)+(AA982*2) -> 30
A983: GOALKICKERS | R983: McGRATH | W983: WERRIBEE | X983: 2 | Y983: 6 | Z983: 10 | AA983: 0 | AB983: 1426 | AC983: 1548 | AD983: =(AB983/AC983)*100 -> 92.118863049095609 | AE983: =(Y983*4)+(AA983*2) -> 24
A984: GEELONG | C984: BRIGHT 3 | E984: CALLAN 3 | G984: LONERGAN 2 | J984: MOONEY 2 | M984: STREET 2 | O984: BLAKE | Q984: BYRNES | S984: KINGSLEY | W984: NORTHERN BULLANTS | X984: 2 | Y984: 5 | Z984: 11 | AA984: 0 | AB984: 1523 | AC984: 1637 | AD984: =(AB984/AC984)*100 -> 93.036041539401353 | AE984: =(Y984*4)+(AA984*2) -> 20
A985: SANDRINGHAM | C985: FERGUSON 4 | F985: S RADFORD 2 | I985: OAKLEY 2 | L985: WHEATLEY 2 | O985: HAYNES | Q985: JAMAR | S985: POYAS | W985: COBURG | X985: 2 | Y985: 5 | Z985: 11 | AA985: 0 | AB985: 1260 | AC985: 1675 | AD985: =(AB985/AC985)*100 -> 75.223880597014926 | AE985: =(Y985*4)+(AA985*2) -> 20
W986: NORTH BALLARAT | X986: 2 | Y986: 3 | Z986: 13 | AA986: 0 | AB986: 1119 | AC986: 1703 | AD986: =(AB986/AC986)*100 -> 65.707574867880211 | AE986: =(Y986*4)+(AA986*2) -> 12
A987: PORT MELBOURNE | C987: 4 | D987: 7 | E987: =(C987*6)+D987 -> 31 | G987: 9 | H987: 10 | I987: =(G987*6)+H987 -> 64 | K987: 13 | L987: 14 | M987: =(K987*6)+L987 -> 92 | O987: 20 | P987: 17 | Q987: =(O987*6)+P987 -> 137 | S987: Venue: PORT MELBOURNE
A988: NORTHERN BULLANTS | C988: 3 | D988: 0 | E988: =(C988*6)+D988 -> 18 | G988: 8 | H988: 0 | I988: =(G988*6)+H988 -> 48 | K988: 11 | L988: 1 | M988: =(K988*6)+L988 -> 67 | O988: 18 | P988: 3 | Q988: =(O988*6)+P988 -> 111
A989: BEST PLAYERS
A990: PORT MELBOURNE | C990: HARRIS | F990: J CLAYTON | I990: COLBERT | L990: BOURKE | N990: FIRRITO | Q990: ROCCA
A991: NORTHERN BULLANTS | C991: SIMPSON | F991: VANSITTART | I991: FRANCHINA | L991: WATSON | N991: FLETCHER
A992: GOALKICKERS
A993: PORT MELBOURNE | C993: ROCCA 4 | E993: COOPER 3 | G993: M STEVENS 3 | J993: J CLAYTON 2 | M993: HALE 2 | O993: ALLEWAY | Q993: DELUCA | S993: FIRRITO | W993: SMITH | X993: S MOTLOP | AA993: HARRIS
A994: NORTHERN BULLANTS | C994: SAUTNER 4 | F994: FRANCHINA 2 | I994: McKENZIE 2 | L994: SAAD 2 | N994: SUMMERS 2 | Q994: FLETCHER | T994: GIBSON | W994: PLUNKETT | X994: SIMPSON | AA994: STINEAR | AC994: VANSITTART
D995: 10TH AUGUST | J995: WEATHER
A996: FRANKSTON | C996: 3 | D996: 6 | E996: =(C996*6)+D996 -> 24 | G996: 10 | H996: 8 | I996: =(G996*6)+H996 -> 68 | K996: 13 | L996: 9 | M996: =(K996*6)+L996 -> 87 | O996: 14 | P996: 11 | Q996: =(O996*6)+P996 -> 95 | S996: Venue: FRANKSTON
A997: BENDIGO | C997: 0 | D997: 1 | E997: =(C997*6)+D997 -> 1 | G997: 3 | H997: 3 | I997: =(G997*6)+H997 -> 21 | K997: 7 | L997: 8 | M997: =(K997*6)+L997 -> 50 | O997: 13 | P997: 12 | Q997: =(O997*6)+P997 -> 90
A998: BEST PLAYERS
A999: FRANKSTON | C999: GEORGIOU | F999: DOUST | I999: ROBERTS | L999: C CLARKE | O999: BEASY | Q999: HYNES
A1000: BENDIGO | C1000: McGRATH | F1000: HENNEMAN | I1000: HALL | L1000: CAMPBELL | O1000: HARVEY | Q1000: FORSTER-KNIGHT
A1001: GOALKICKERS
A1002: FRANKSTON | C1002: D CLARKE 4 | F1002: BEASY 3 | I1002: McCORMACK 2 | L1002: FOLINO | N1002: GEORGIOU | Q1002: HYNES | S1002: HUNTER | V1002: SHIPP
A1003: BENDIGO | C1003: LOVETT-MURRAY 3 | G1003: CAMPBELL 2 | J1003: HARVEY 2 | M1003: HALL 2 | O1003: JOHNS 2 | Q1003: BROWN | S1003: HENNEMAN
A1005: BOX HILL | C1005: 4 | D1005: 2 | E1005: =(C1005*6)+D1005 -> 26 | G1005: 11 | H1005: 3 | I1005: =(G1005*6)+H1005 -> 69 | K1005: 16 | L1005: 8 | M1005: =(K1005*6)+L1005 -> 104 | O1005: 21 | P1005: 9 | Q1005: =(O1005*6)+P1005 -> 135 | S1005: Venue: NORTH BALLARAT
A1006: NORTH BALLARAT | C1006: 2 | D1006: 3 | E1006: =(C1006*6)+D1006 -> 15 | G1006: 3 | H1006: 5 | I1006: =(G1006*6)+H1006 -> 23 | K1006: 6 | L1006: 5 | M1006: =(K1006*6)+L1006 -> 41 | O1006: 10 | P1006: 8 | Q1006: =(O1006*6)+P1006 -> 68
A1007: BEST PLAYERS
A1008: BOX HILL | C1008: SEWELL | F1008: ELSTONE | I1008: KENNA | L1008: TALLIS | N1008: COX | Q1008: KANE
A1009: NORTH BALLARAT | C1009: McCORKELL | F1009: McCONNELL | I1009: MOLONEY | L1009: JURICA | N1009: FIELD
A1010: GOALKICKERS
A1011: BOX HILL | C1011: KENNA 5 | E1011: S COX 4 | G1011: LOATS 3 | I1011: HUNTER 2 | K1011: PUGSLEY 2 | N1011: McCABE 2 | Q1011: ANDERSON | T1011: BOYLE | W1011: HARFORD
A1012: NORTH BALLARAT | C1012: McCORKELL 2 | F1012: SAUNDERS 2 | I1012: FRITH | K1012: JURICA | M1012: LUBEEK | O1012: McMAHON | Q1012: MOLONEY | S1012: SHEEDY
A1014: COBURG | C1014: 5 | D1014: 1 | E1014: =(C1014*6)+D1014 -> 31 | G1014: 8 | H1014: 4 | I1014: =(G1014*6)+H1014 -> 52 | K1014: 13 | L1014: 7 | M1014: =(K1014*6)+L1014 -> 85 | O1014: 18 | P1014: 9 | Q1014: =(O1014*6)+P1014 -> 117 | S1014: Venue: COBURG
A1015: SPRINGVALE | C1015: 4 | D1015: 3 | E1015: =(C1015*6)+D1015 -> 27 | G1015: 8 | H1015: 9 | I1015: =(G1015*6)+H1015 -> 57 | K1015: 13 | L1015: 12 | M1015: =(K1015*6)+L1015 -> 90 | O1015: 16 | P1015: 13 | Q1015: =(O1015*6)+P1015 -> 109
A1016: BEST PLAYERS
A1017: COBURG | C1017: PETTIFER | F1017: HOULIHAN | I1017: PAGAN | L1017: CARLSON | N1017: MILLS | Q1017: HYDE
A1018: SPRINGVALE | C1018: MOYLE | F1018: HOULIHAN | I1018: CALLAGHAN | L1018: MILNE | N1018: HARRISON | Q1018: KNOBEL
A1019: GOALKICKERS
A1020: COBURG | C1020: HOULIHAN 5 | F1020: PETTIFER 5 | I1020: TAYLOR 2 | L1020: TREMELLAN 2 | O1020: DRAGICEVIC | R1020: KING | T1020: MILLS | W1020: SHIR
A1021: SPRINGVALE | C1021: MILNE 5 | E1021: HOULIHAN 3 | H1021: B SCHWARZE 2 | K1021: BARHAM | M1021: CARROLL | O1021: KOSCH | Q1021: KNOBEL | S1021: MOYLE | U1021: PITT
A1023: BYE | D1023: WERRIBEE
A1025: ROUND 19 | D1025: 16TH AUGUST | J1025: WEATHER
D1026: 1ST QTR | H1026: 2ND QTR | L1026: 3RD QTR | P1026: FINAL | S1026: Venue: BENDIGO
A1027: COBURG | C1027: 3 | D1027: 4 | E1027: =(C1027*6)+D1027 -> 22 | G1027: 7 | H1027: 4 | I1027: =(G1027*6)+H1027 -> 46 | K1027: 11 | L1027: 8 | M1027: =(K1027*6)+L1027 -> 74 | O1027: 13 | P1027: 10 | Q1027: =(O1027*6)+P1027 -> 88 | S1027: UMPIRES | Z1027: LADDER | AC1027: ROUND | AE1027: 19
A1028: BENDIGO | C1028: 0 | D1028: 3 | E1028: =(C1028*6)+D1028 -> 3 | G1028: 3 | H1028: 4 | I1028: =(G1028*6)+H1028 -> 22 | K1028: 7 | L1028: 8 | M1028: =(K1028*6)+L1028 -> 50 | O1028: 11 | P1028: 13 | Q1028: =(O1028*6)+P1028 -> 79
A1029: BEST PLAYERS | W1029: TEAM | X1029: B | Y1029: W | Z1029: L | AA1029: D | AB1029: FOR | AC1029: AGST | AD1029: % | AE1029: PTS
A1030: COBURG | C1030: TALBOT | F1030: ROGERS | I1030: MILLS | L1030: SHIR | N1030: HYDE | Q1030: PAGAN
A1031: BENDIGO | C1031: HARVEY | F1031: FORSTER-KNIGHT | J1031: CAIL | L1031: ROSA | N1031: RICHARDS | W1031: BOX HILL | X1031: 2 | Y1031: 14 | Z1031: 3 | AA1031: 0 | AB1031: 1709 | AC1031: 1295 | AD1031: =(AB1031/AC1031)*100 -> 131.96911196911196 | AE1031: =(Y1031*4)+(AA1031*2) -> 56
A1032: GOALKICKERS | R1032: TAYLOR | W1032: PORT MELBOURNE | X1032: 2 | Y1032: 13 | Z1032: 3 | AA1032: 1 | AB1032: 1840 | AC1032: 1407 | AD1032: =(AB1032/AC1032)*100 -> 130.77469793887704 | AE1032: =(Y1032*4)+(AA1032*2) -> 54
A1033: COBURG | C1033: MILLS 2 | E1033: RAYSON 2 | G1033: ROGERS 2 | I1033: WHYMAN (2) | L1033: DRAGICEVIC | N1033: FLAHERTY | Q1033: SCHULZ | S1033: VARDY | W1033: WILLIAMSTOWN | X1033: 2 | Y1033: 13 | Z1033: 4 | AA1033: 0 | AB1033: 1764 | AC1033: 1270 | AD1033: =(AB1033/AC1033)*100 -> 138.89763779527559 | AE1033: =(Y1033*4)+(AA1033*2) -> 52
A1034: BENDIGO | C1034: BROWN 4 | F1034: LOVETT-MURRAY 2 | J1034: DAVIES | L1034: HUNT | N1034: JOHNS | P1034: LAYCOCK | R1034: RICHARDS | W1034: SANDRINGHAM | X1034: 2 | Y1034: 9 | Z1034: 8 | AA1034: 0 | AB1034: 1584 | AC1034: 1415 | AD1034: =(AB1034/AC1034)*100 -> 111.9434628975265 | AE1034: =(Y1034*4)+(AA1034*2) -> 36
W1035: SPRINGVALE | X1035: 2 | Y1035: 8 | Z1035: 8 | AA1035: 1 | AB1035: 1732 | AC1035: 1603 | AD1035: =(AB1035/AC1035)*100 -> 108.04741110417966 | AE1035: =(Y1035*4)+(AA1035*2) -> 34
A1036: PORT MELBOURNE | C1036: 6 | D1036: 1 | E1036: =(C1036*6)+D1036 -> 37 | G1036: 9 | H1036: 8 | I1036: =(G1036*6)+H1036 -> 62 | K1036: 13 | L1036: 10 | M1036: =(K1036*6)+L1036 -> 88 | O1036: 16 | P1036: 14 | Q1036: =(O1036*6)+P1036 -> 110 | S1036: Venue: BOX HILL | W1036: GEELONG | X1036: 1 | Y1036: 8 | Z1036: 10 | AA1036: 0 | AB1036: 1623 | AC1036: 1763 | AD1036: =(AB1036/AC1036)*100 -> 92.058990357345436 | AE1036: =(Y1036*4)+(AA1036*2) -> 32
A1037: BOX HILL | C1037: 4 | D1037: 2 | E1037: =(C1037*6)+D1037 -> 26 | G1037: 4 | H1037: 4 | I1037: =(G1037*6)+H1037 -> 28 | K1037: 11 | L1037: 5 | M1037: =(K1037*6)+L1037 -> 71 | O1037: 13 | P1037: 9 | Q1037: =(O1037*6)+P1037 -> 87 | W1037: FRANKSTON | X1037: 2 | Y1037: 8 | Z1037: 9 | AA1037: 0 | AB1037: 1247 | AC1037: 1381 | AD1037: =(AB1037/AC1037)*100 -> 90.296886314265024 | AE1037: =(Y1037*4)+(AA1037*2) -> 32
A1038: BEST PLAYERS | W1038: TASMANIA | X1038: 2 | Y1038: 7 | Z1038: 9 | AA1038: 1 | AB1038: 1614 | AC1038: 1507 | AD1038: =(AB1038/AC1038)*100 -> 107.100199071002 | AE1038: =(Y1038*4)+(AA1038*2) -> 30
A1039: PORT MELBOURNE | C1039: M STEVENS | F1039: S CLAYTON | I1039: ROSE | K1039: DELUCA | N1039: FIRRITO | Q1039: SMITH
A1040: BOX HILL | C1040: BALL | F1040: COX | I1040: SEWELL | K1040: SMITH | N1040: STONE | W1040: BENDIGO | X1040: 2 | Y1040: 7 | Z1040: 9 | AA1040: 1 | AB1040: 1505 | AC1040: 1599 | AD1040: =(AB1040/AC1040)*100 -> 94.121325828642895 | AE1040: =(Y1040*4)+(AA1040*2) -> 30
A1041: GOALKICKERS | P1041: WATSON | W1041: WERRIBEE | X1041: 2 | Y1041: 7 | Z1041: 10 | AA1041: 0 | AB1041: 1557 | AC1041: 1607 | AD1041: =(AB1041/AC1041)*100 -> 96.888612321095209 | AE1041: =(Y1041*4)+(AA1041*2) -> 28
A1042: PORT MELBOURNE | C1042: ROCCA 5 | E1042: S CLAYTON 4 | H1042: BOURKE 2 | K1042: DAVEY | M1042: HALE | O1042: ROBBINS | Q1042: M STEVENS | W1042: COBURG | X1042: 2 | Y1042: 6 | Z1042: 11 | AA1042: 0 | AB1042: 1348 | AC1042: 1754 | AD1042: =(AB1042/AC1042)*100 -> 76.852907639680737 | AE1042: =(Y1042*4)+(AA1042*2) -> 24
A1043: BOX HILL | C1043: ELSTONE 2 | E1043: HARFORD 2 | H1043: ANDERSON | J1043: BAYFORD | L1043: COX | M1043: HAZELL | O1043: HEENAN | Q1043: KANE | S1043: KENNA | W1043: NORTHERN BULLANTS | X1043: 2 | Y1043: 5 | Z1043: 12 | AA1043: 0 | AB1043: 1621 | AC1043: 1764 | AD1043: =(AB1043/AC1043)*100 -> 91.893424036281175 | AE1043: =(Y1043*4)+(AA1043*2) -> 20
N1044: PUGSLEY | Q1044: TALLIS | W1044: NORTH BALLARAT | X1044: 2 | Y1044: 4 | Z1044: 13 | AA1044: 0 | AB1044: 1217 | AC1044: 1791 | AD1044: =(AB1044/AC1044)*100 -> 67.950865438302628 | AE1044: =(Y1044*4)+(AA1044*2) -> 16
A1045: WERRIBEE | C1045: 6 | D1045: 5 | E1045: =(C1045*6)+D1045 -> 41 | G1045: 10 | H1045: 7 | I1045: =(G1045*6)+H1045 -> 67 | K1045: 15 | L1045: 8 | M1045: =(K1045*6)+L1045 -> 98 | O1045: 20 | P1045: 11 | Q1045: =(O1045*6)+P1045 -> 131 | S1045: Venue: BELLERIVE OVAL
A1046: TASMANIA | C1046: 1 | D1046: 1 | E1046: =(C1046*6)+D1046 -> 7 | G1046: 5 | H1046: 5 | I1046: =(G1046*6)+H1046 -> 35 | K1046: 7 | L1046: 9 | M1046: =(K1046*6)+L1046 -> 51 | O1046: 8 | P1046: 11 | Q1046: =(O1046*6)+P1046 -> 59
A1047: BEST PLAYERS
A1048: WERRIBEE | C1048: CROSS | F1048: SETCHELL | I1048: BOYD | L1048: HUDSON | O1048: MORRIS | Q1048: ROBERTSON
A1049: TASMANIA | C1049: CRIPPS | F1049: RONALDSON | I1049: GILMOUR | L1049: WAGER | O1049: TAYLOR | Q1049: B GEAPPEN
A1050: GOALKICKERS
A1051: WERRIBEE | C1051: MITCHELL 4 | F1051: BOYD 3 | H1051: PODSIADLY 3 | K1051: CONDOS 2 | M1051: CROSS 2 | O1051: HUDSON 2 | Q1051: GARLICK | S1051: HENDERSON | W1051: MURPHY | X1051: PICKEN
A1052: TASMANIA | C1052: BEAMS 2 | F1052: CALLINAN 2 | I1052: BARTLETT | K1052: B GEAPPEN | N1052: HEATLEY | P1052: RONALDSON
D1053: 17TH AUGUST | J1053: WEATHER
A1054: WILLIAMSTOWN | C1054: 2 | D1054: 3 | E1054: =(C1054*6)+D1054 -> 15 | G1054: 9 | H1054: 9 | I1054: =(G1054*6)+H1054 -> 63 | K1054: 16 | L1054: 12 | M1054: =(K1054*6)+L1054 -> 108 | O1054: 22 | P1054: 14 | Q1054: =(O1054*6)+P1054 -> 146 | S1054: Venue: WILLIAMSTOWN
A1055: GEELONG | C1055: 0 | D1055: 4 | E1055: =(C1055*6)+D1055 -> 4 | G1055: 1 | H1055: 6 | I1055: =(G1055*6)+H1055 -> 12 | K1055: 3 | L1055: 9 | M1055: =(K1055*6)+L1055 -> 27 | O1055: 7 | P1055: 12 | Q1055: =(O1055*6)+P1055 -> 54
A1056: BEST PLAYERS
A1057: WILLIAMSTOWN | C1057: LLOYD | F1057: BETHERAS | I1057: MOLLOY | L1057: BALDWIN | O1057: DAVIS | Q1057: CRANAGE
A1058: GEELONG | C1058: SMITH | F1058: LORD | I1058: McGRATH
A1059: GOALKICKERS
A1060: WILLIAMSTOWN | C1060: BALDWIN 7 | F1060: RICHARDSON 4 | J1060: DAVIS 2 | L1060: MOLLOY 2 | N1060: SMOKER 2 | Q1060: CLOKE | S1060: CROW | V1060: HILL | X1060: McGOUGH | AA1060: SHACKLETON
A1061: GEELONG | C1061: KINGSLEY 3 | F1061: BRIGHT | H1061: COOK | J1061: GARDINER | M1061: LLOYD
A1063: SPRINGVALE | C1063: 6 | D1063: 6 | E1063: =(C1063*6)+D1063 -> 42 | G1063: 14 | H1063: 6 | I1063: =(G1063*6)+H1063 -> 90 | K1063: 18 | L1063: 12 | M1063: =(K1063*6)+L1063 -> 120 | O1063: 19 | P1063: 13 | Q1063: =(O1063*6)+P1063 -> 127 | S1063: Venue: SPRINGVALE
A1064: NORTHERN BULLANTS | C1064: 2 | D1064: 1 | E1064: =(C1064*6)+D1064 -> 13 | G1064: 5 | H1064: 6 | I1064: =(G1064*6)+H1064 -> 36 | K1064: 8 | L1064: 10 | M1064: =(K1064*6)+L1064 -> 58 | O1064: 14 | P1064: 14 | Q1064: =(O1064*6)+P1064 -> 98
A1065: BEST PLAYERS
A1066: SPRINGVALE | C1066: CALLAHAN | F1066: BLACK | I1066: MILNE | L1066: HOULIHAN | O1066: MOYLE | Q1066: B SCHWARZE
A1067: NORTHERN BULLANTS | C1067: SAUTNER | F1067: FRENCH | I1067: PLUNKETT | L1067: WATSON
A1068: GOALKICKERS
A1069: SPRINGVALE | C1069: MILNE 6 | F1069: CALLAHAN 5 | I1069: MOYLE 2 | K1069: B SCHWARZE 2 | N1069: BLACK | P1069: CARMODY | R1069: OLIVER | V1069: PITT
A1070: NORTHERN BULLANTS | C1070: SAUTNER 7 | F1070: FRENCH 3 | I1070: ECCLES | K1070: GIBSON | M1070: PLUNKETT | O1070: STINEAR
A1072: NORTH BALLARAT | C1072: 4 | D1072: 3 | E1072: =(C1072*6)+D1072 -> 27 | G1072: 7 | H1072: 8 | I1072: =(G1072*6)+H1072 -> 50 | K1072: 10 | L1072: 8 | M1072: =(K1072*6)+L1072 -> 68 | O1072: 14 | P1072: 14 | Q1072: =(O1072*6)+P1072 -> 98 | S1072: Venue: BEACH ROAD
A1073: SANDRINGHAM | C1073: 3 | D1073: 4 | E1073: =(C1073*6)+D1073 -> 22 | G1073: 4 | H1073: 7 | I1073: =(G1073*6)+H1073 -> 31 | K1073: 9 | L1073: 11 | M1073: =(K1073*6)+L1073 -> 65 | O1073: 12 | P1073: 16 | Q1073: =(O1073*6)+P1073 -> 88
A1074: BEST PLAYERS
A1075: NORTH BALLARAT | C1075: JURICA | F1075: FIELD | I1075: McCONNELL | L1075: CLARK | N1075: MILLER | Q1075: McCORKELL
A1076: SANDRINGHAM | C1076: LYNCH | F1076: SMITH | I1076: LAMB | L1076: HAYNES
A1077: GOALKICKERS
A1078: NORTH BALLARAT | C1078: McCORKELL 3 | F1078: RUDD 3 | I1078: WINTER 2 | K1078: JURICA | M1078: McMAHON | P1078: O'KEEFE | R1078: RYALL | U1078: SAUNDERS | X1078: J SPOLDING
A1079: SANDRINGHAM | C1079: OAKLEY 3 | F1079: FISHER 2 | H1079: HAYNES | J1079: HOWARTH | M1079: JAMAR | O1079: S RADFORD | R1079: ROBBINS | V1079: WHEATLEY | X1079: WARNOCK
A1081: BYE | D1081: FRANKSTON
A1083: ROUND 20 | D1083: 23RD AUGUST | J1083: WEATHER
D1084: 1ST QTR | H1084: 2ND QTR | L1084: 3RD QTR | P1084: FINAL | S1084: Venue: NORTH HOBART OVAL
A1085: TASMANIA | C1085: 4 | D1085: 2 | E1085: =(C1085*6)+D1085 -> 26 | G1085: 7 | H1085: 6 | I1085: =(G1085*6)+H1085 -> 48 | K1085: 11 | L1085: 8 | M1085: =(K1085*6)+L1085 -> 74 | O1085: 14 | P1085: 10 | Q1085: =(O1085*6)+P1085 -> 94 | S1085: UMPIRES | Z1085: LADDER | AC1085: ROUND | AE1085: 20
A1086: BOX HILL | C1086: 1 | D1086: 4 | E1086: =(C1086*6)+D1086 -> 10 | G1086: 7 | H1086: 5 | I1086: =(G1086*6)+H1086 -> 47 | K1086: 8 | L1086: 12 | M1086: =(K1086*6)+L1086 -> 60 | O1086: 10 | P1086: 15 | Q1086: =(O1086*6)+P1086 -> 75
A1087: BEST PLAYERS | W1087: TEAM | X1087: B | Y1087: W | Z1087: L | AA1087: D | AB1087: FOR | AC1087: AGST | AD1087: % | AE1087: PTS
A1088: TASMANIA | C1088: CRIPPS | F1088: RICHTER | I1088: GILMOUR | L1088: WAGER | N1088: THURLEY | Q1088: BARTLETT
A1089: BOX HILL | C1089: KANE | F1089: COX | I1089: BALL | L1089: HUNTER | N1089: HEENAN | W1089: PORT MELBOURNE | X1089: 2 | Y1089: 14 | Z1089: 3 | AA1089: 1 | AB1089: 1918 | AC1089: 1439 | AD1089: =(AB1089/AC1089)*100 -> 133.28700486448923 | AE1089: =(Y1089*4)+(AA1089*2) -> 58
A1090: GOALKICKERS | O1090: HEATLEY | Q1090: RONALDSON | W1090: WILLIAMSTOWN | X1090: 2 | Y1090: 14 | Z1090: 4 | AA1090: 0 | AB1090: 1856 | AC1090: 1284 | AD1090: =(AB1090/AC1090)*100 -> 144.54828660436135 | AE1090: =(Y1090*4)+(AA1090*2) -> 56
A1091: TASMANIA | C1091: THURLEY 3 | E1091: BEAMS 2 | G1091: CANN 2 | I1091: BARTLETT | K1091: CALLINAN | M1091: CRIPPS | O1091: GILMOUR | Q1091: M GEAPPEN | W1091: BOX HILL | X1091: 2 | Y1091: 14 | Z1091: 4 | AA1091: 0 | AB1091: 1784 | AC1091: 1389 | AD1091: =(AB1091/AC1091)*100 -> 128.43772498200144 | AE1091: =(Y1091*4)+(AA1091*2) -> 56
A1092: BOX HILL | C1092: KANE 3 | F1092: ANDERSON 2 | I1092: HUNTER 2 | L1092: ELSTONE | N1092: HAZELL | P1092: MARGUCCIO | W1092: SANDRINGHAM | X1092: 2 | Y1092: 10 | Z1092: 8 | AA1092: 0 | AB1092: 1623 | AC1092: 1453 | AD1092: =(AB1092/AC1092)*100 -> 111.69993117687542 | AE1092: =(Y1092*4)+(AA1092*2) -> 40
W1093: TASMANIA | X1093: 2 | Y1093: 8 | Z1093: 9 | AA1093: 1 | AB1093: 1708 | AC1093: 1582 | AD1093: =(AB1093/AC1093)*100 -> 107.9646017699115 | AE1093: =(Y1093*4)+(AA1093*2) -> 34
A1094: WERRIBEE | C1094: 3 | D1094: 4 | E1094: =(C1094*6)+D1094 -> 22 | G1094: 7 | H1094: 6 | I1094: =(G1094*6)+H1094 -> 48 | K1094: 13 | L1094: 7 | M1094: =(K1094*6)+L1094 -> 85 | O1094: 15 | P1094: 9 | Q1094: =(O1094*6)+P1094 -> 99 | S1094: Venue: WERRIBEE | W1094: SPRINGVALE | X1094: 2 | Y1094: 8 | Z1094: 9 | AA1094: 1 | AB1094: 1793 | AC1094: 1702 | AD1094: =(AB1094/AC1094)*100 -> 105.34665099882491 | AE1094: =(Y1094*4)+(AA1094*2) -> 34
A1095: SPRINGVALE | C1095: 4 | D1095: 4 | E1095: =(C1095*6)+D1095 -> 28 | G1095: 5 | H1095: 5 | I1095: =(G1095*6)+H1095 -> 35 | K1095: 6 | L1095: 9 | M1095: =(K1095*6)+L1095 -> 45 | O1095: 8 | P1095: 13 | Q1095: =(O1095*6)+P1095 -> 61 | W1095: WERRIBEE | X1095: 2 | Y1095: 8 | Z1095: 10 | AA1095: 0 | AB1095: 1656 | AC1095: 1667 | AD1095: =(AB1095/AC1095)*100 -> 99.340131973605281 | AE1095: =(Y1095*4)+(AA1095*2) -> 32
A1096: BEST PLAYERS | W1096: GEELONG | X1096: 2 | Y1096: 8 | Z1096: 10 | AA1096: 0 | AB1096: 1623 | AC1096: 1763 | AD1096: =(AB1096/AC1096)*100 -> 92.058990357345436 | AE1096: =(Y1096*4)+(AA1096*2) -> 32
A1097: WERRIBEE | C1097: HUDSON | F1097: GARLICK | I1097: CROSS | L1097: SETCHELL | N1097: WIGGINS | Q1097: LAMB
A1098: SPRINGVALE | C1098: MILLER | F1098: MOYLE | I1098: PITT | L1098: BLACK | N1098: CARROLL | Q1098: WALDRON | W1098: FRANKSTON | X1098: 2 | Y1098: 8 | Z1098: 10 | AA1098: 0 | AB1098: 1285 | AC1098: 1420 | AD1098: =(AB1098/AC1098)*100 -> 90.492957746478879 | AE1098: =(Y1098*4)+(AA1098*2) -> 32
A1099: GOALKICKERS | P1099: SETCHELL | R1099: SMITH | W1099: BENDIGO | X1099: 2 | Y1099: 7 | Z1099: 10 | AA1099: 1 | AB1099: 1519 | AC1099: 1691 | AD1099: =(AB1099/AC1099)*100 -> 89.828503843879361 | AE1099: =(Y1099*4)+(AA1099*2) -> 30
A1100: WERRIBEE | C1100: CONDOS 2 | E1100: LAMB 2 | G1100: MITCHELL 2 | J1100: PODSIADLY 2 | M1100: WIGGINS 2 | O1100: CROSS | Q1100: GARLICK | S1100: MURPHY | W1100: NORTHERN BULLANTS | X1100: 2 | Y1100: 6 | Z1100: 12 | AA1100: 0 | AB1100: 1763 | AC1100: 1824 | AD1100: =(AB1100/AC1100)*100 -> 96.655701754385973 | AE1100: =(Y1100*4)+(AA1100*2) -> 24
A1101: SPRINGVALE | C1101: KOSCH 2 | F1101: OLIVER 2 | I1101: PITT 2 | K1101: CALLAGHAN | N1101: HOULIHAN | W1101: COBURG | X1101: 2 | Y1101: 6 | Z1101: 12 | AA1101: 0 | AB1101: 1408 | AC1101: 1896 | AD1101: =(AB1101/AC1101)*100 -> 74.261603375527429 | AE1101: =(Y1101*4)+(AA1101*2) -> 24
W1102: NORTH BALLARAT | X1102: 2 | Y1102: 4 | Z1102: 14 | AA1102: 0 | AB1102: 1249 | AC1102: 1869 | AD1102: =(AB1102/AC1102)*100 -> 66.827180310326369 | AE1102: =(Y1102*4)+(AA1102*2) -> 16
A1103: NORTHERN BULLANTS | C1103: 7 | D1103: 2 | E1103: =(C1103*6)+D1103 -> 44 | G1103: 10 | H1103: 5 | I1103: =(G1103*6)+H1103 -> 65 | K1103: 15 | L1103: 6 | M1103: =(K1103*6)+L1103 -> 96 | O1103: 22 | P1103: 10 | Q1103: =(O1103*6)+P1103 -> 142 | S1103: Venue: PRESTON
A1104: COBURG | C1104: 1 | D1104: 1 | E1104: =(C1104*6)+D1104 -> 7 | G1104: 2 | H1104: 2 | I1104: =(G1104*6)+H1104 -> 14 | K1104: 4 | L1104: 5 | M1104: =(K1104*6)+L1104 -> 29 | O1104: 9 | P1104: 6 | Q1104: =(O1104*6)+P1104 -> 60
A1105: BEST PLAYERS
A1106: NORTHERN BULLANTS | C1106: ZORZI | F1106: STEVENSON | I1106: SUMMERS | L1106: SAUTNER | O1106: ANGWIN | R1106: HEDGE
A1107: COBURG | C1107: DEPASQUALE | F1107: MILLS | I1107: BIDDISCOMBE | L1107: TALBOT
A1108: GOALKICKERS
A1109: NORTHERN BULLANTS | C1109: SAUTNER 8 | F1109: GUTTERSON 4 | I1109: ANGWIN 3 | L1109: FAVRIN 2 | N1109: HEDGE | P1109: MERRINGTON | S1109: PATERSON | W1109: SIMPSON | X1109: WATSON
A1110: COBURG | C1110: McGRATH 3 | F1110: TREMELLIN 2 | I1110: FLAHERTY | K1110: KING | M1110: KURET | O1110: TAYLOR
A1112: PORT MELBOURNE | C1112: 4 | D1112: 4 | E1112: =(C1112*6)+D1112 -> 28 | G1112: 6 | H1112: 7 | I1112: =(G1112*6)+H1112 -> 43 | K1112: 7 | L1112: 10 | M1112: =(K1112*6)+L1112 -> 52 | O1112: 11 | P1112: 12 | Q1112: =(O1112*6)+P1112 -> 78 | S1112: Venue: NORTH BALLARAT
A1113: NORTH BALLARAT | C1113: 0 | D1113: 2 | E1113: =(C1113*6)+D1113 -> 2 | G1113: 1 | H1113: 4 | I1113: =(G1113*6)+H1113 -> 10 | K1113: 2 | L1113: 6 | M1113: =(K1113*6)+L1113 -> 18 | O1113: 4 | P1113: 8 | Q1113: =(O1113*6)+P1113 -> 32
A1114: BEST PLAYERS
A1115: PORT MELBOURNE | C1115: DELUCA | F1115: WATSON | I1115: SMITH | L1115: FIRRITO | O1115: TEAGUE | R1115: BOURKE
A1116: NORTH BALLARAT | C1116: MOLONEY | F1116: CLARK | I1116: McCONNELL | L1116: JENKINS | O1116: LUBEEK | R1116: GREIG
A1117: GOALKICKERS
A1118: PORT MELBOURNE | C1118: DAVEY 2 | E1118: WATSON 2 | H1118: ALLEWAY | J1118: ANSTEY | L1118: BOURKE | N1118: COTCHETT | Q1118: CROWE | S1118: MORRELL | W1118: SMITH
A1119: NORTH BALLARAT | C1119: CLARK | E1119: LUBEEK | G1119: McCORKELL | J1119: WINTER
D1120: 24TH AUGUST | J1120: WEATHER
A1121: SANDRINGHAM | C1121: 0 | D1121: 0 | E1121: =(C1121*6)+D1121 -> 0 | G1121: 2 | H1121: 2 | I1121: =(G1121*6)+H1121 -> 14 | K1121: 4 | L1121: 4 | M1121: =(K1121*6)+L1121 -> 28 | O1121: 5 | P1121: 9 | Q1121: =(O1121*6)+P1121 -> 39 | S1121: Venue: FRANKSTON
A1122: FRANKSTON | C1122: 3 | D1122: 5 | E1122: =(C1122*6)+D1122 -> 23 | G1122: 5 | H1122: 6 | I1122: =(G1122*6)+H1122 -> 36 | K1122: 5 | L1122: 8 | M1122: =(K1122*6)+L1122 -> 38 | O1122: 5 | P1122: 8 | Q1122: =(O1122*6)+P1122 -> 38
A1123: BEST PLAYERS
A1124: SANDRINGHAM | C1124: BRYAN | F1124: GRANT | I1124: J RADFORD | L1124: ROBBINS | N1124: LYNCH | Q1124: MILLER
A1125: FRANKSTON | C1125: ROBERTS | F1125: C CLARKE | I1125: BLACK | L1125: CADD | N1125: ABLETT | Q1125: ODELL
A1126: GOALKICKERS
A1127: SANDRINGHAM | C1127: BRYAN | F1127: GADSDEN | I1127: HAYNES | K1127: MOORCROFT | N1127: OAKLEY
A1128: FRANKSTON | C1128: GEORGIOU 2 | F1128: ANDERSON | I1128: CADD | K1128: C CLARKE
A1130: WILLIAMSTOWN | C1130: 6 | D1130: 4 | E1130: =(C1130*6)+D1130 -> 40 | G1130: 9 | H1130: 5 | I1130: =(G1130*6)+H1130 -> 59 | K1130: 11 | L1130: 10 | M1130: =(K1130*6)+L1130 -> 76 | O1130: 13 | P1130: 14 | Q1130: =(O1130*6)+P1130 -> 92 | S1130: Venue: BENDIGO
A1131: BENDIGO | C1131: 0 | D1131: 3 | E1131: =(C1131*6)+D1131 -> 3 | G1131: 0 | H1131: 6 | I1131: =(G1131*6)+H1131 -> 6 | K1131: 1 | L1131: 6 | M1131: =(K1131*6)+L1131 -> 12 | O1131: 1 | P1131: 8 | Q1131: =(O1131*6)+P1131 -> 14
A1132: BEST PLAYERS
A1133: WILLIAMSTOWN | C1133: LLOYD | F1133: SHACKLETON | I1133: SWAN | M1133: BALDWIN | P1133: CLOKE | R1133: WEST
A1134: BENDIGO | C1134: HAWKINS | F1134: LAYCOCK | I1134: FORSTER-KNIGHT | M1134: C McGRATH | P1134: HALL | R1134: CARTER
A1135: GOALKICKERS
A1136: WILLIAMSTOWN | C1136: BALDWIN 5 | F1136: FREEBORN 2 | I1136: CLOKE | K1136: DAVIS | M1136: HOLLOW | O1136: LLOYD | Q1136: MAHONEY | T1136: SMOKER
A1137: BENDIGO | C1137: HUNT
A1139: BYE | D1139: GEELONG
A1141: FINALS
A1142: ELIMINATION FINAL | G1142: 3OTH AUGUST | J1142: WEATHER
D1143: 1ST QTR | H1143: 2ND QTR | L1143: 3RD QTR | P1143: FINAL | S1143: Venue: BELLERIVE OVAL
A1144: TASMANIA | C1144: 4 | D1144: 1 | E1144: =(C1144*6)+D1144 -> 25 | G1144: 10 | H1144: 3 | I1144: =(G1144*6)+H1144 -> 63 | K1144: 12 | L1144: 3 | M1144: =(K1144*6)+L1144 -> 75 | O1144: 18 | P1144: 10 | Q1144: =(O1144*6)+P1144 -> 118 | S1144: UMPIRES
A1145: GEELONG | C1145: 5 | D1145: 3 | E1145: =(C1145*6)+D1145 -> 33 | G1145: 7 | H1145: 4 | I1145: =(G1145*6)+H1145 -> 46 | K1145: 14 | L1145: 6 | M1145: =(K1145*6)+L1145 -> 90 | O1145: 16 | P1145: 7 | Q1145: =(O1145*6)+P1145 -> 103
A1146: BEST PLAYERS
A1147: TASMANIA | C1147: HEATLEY | F1147: CANN | I1147: ROBINSON | L1147: WAGER | N1147: BEAMS | Q1147: CRIPPS
A1148: GEELONG | C1148: SMITH | F1148: CLARKE | I1148: JORGENSEN | L1148: JOVANOVIC | N1148: JORDAN | Q1148: MOLONEY
A1149: GOALKICKERS
A1150: TASMANIA | C1150: HEATLEY 4 | F1150: BEAMS 3 | I1150: BARTLETT 2 | L1150: B GEAPPEN 2 | O1150: THURLEY 2 | R1150: CANN | U1150: CALLINAN | X1150: DERBYSHIRE | AA1150: M GEAPPEN | AD1150: ROBINSON
A1151: GEELONG | C1151: JORDAN 4 | F1151: FOSTER 3 | I1151: CARRAZZO 2 | L1151: WHITE 2 | N1151: GRGIC | P1151: LONERGAN | R1151: MACKIE | U1151: MOLONEY | X1151: SMITH
A1153: ELIMINATION FINAL | F1153: 31ST AUGUST | J1153: WEATHER
A1154: WERRIBEE | C1154: 4 | D1154: 1 | E1154: =(C1154*6)+D1154 -> 25 | G1154: 7 | H1154: 7 | I1154: =(G1154*6)+H1154 -> 49 | K1154: 13 | L1154: 11 | M1154: =(K1154*6)+L1154 -> 89 | O1154: 21 | P1154: 18 | Q1154: =(O1154*6)+P1154 -> 144 | S1154: Venue: PORT MELBOURNE
A1155: SPRINGVALE | C1155: 2 | D1155: 1 | E1155: =(C1155*6)+D1155 -> 13 | G1155: 3 | H1155: 5 | I1155: =(G1155*6)+H1155 -> 23 | K1155: 5 | L1155: 7 | M1155: =(K1155*6)+L1155 -> 37 | O1155: 6 | P1155: 8 | Q1155: =(O1155*6)+P1155 -> 44
A1156: BEST PLAYERS
A1157: WERRIBEE | C1157: GILBEE | F1157: SETCHELL | I1157: RAU | L1157: BOWDEN | N1157: HENDERSON | Q1157: LAMB
A1158: SPRINGVALE | C1158: WALDRON | F1158: BLACK | I1158: HARRISON | L1158: CARROLL
A1159: GOALKICKERS
A1160: WERRIBEE | C1160: BOWDEN 7 | F1160: JACK 3 | H1160: MITCHELL 3 | K1160: GILBEE 2 | M1160: PODSIADLY 2 | P1160: CHURCHILL | R1160: CONDOS | U1160: HENDERSON | X1160: SMITH
A1161: SPRINGVALE | C1161: WOODMAN 2 | F1161: BLACK | H1161: CARROLL | J1161: MILNE | L1161: PITT
A1163: QUALIFYING FINAL | G1163: 3OTH AUGUST | J1163: WEATHER
A1164: SANDRINGHAM | C1164: 6 | D1164: 4 | E1164: =(C1164*6)+D1164 -> 40 | G1164: 9 | H1164: 8 | I1164: =(G1164*6)+H1164 -> 62 | K1164: 15 | L1164: 13 | M1164: =(K1164*6)+L1164 -> 103 | O1164: 18 | P1164: 13 | Q1164: =(O1164*6)+P1164 -> 121 | S1164: Venue: PORT MELBOURNE
A1165: PORT MELBOURNE | C1165: 2 | D1165: 4 | E1165: =(C1165*6)+D1165 -> 16 | G1165: 5 | H1165: 7 | I1165: =(G1165*6)+H1165 -> 37 | K1165: 8 | L1165: 11 | M1165: =(K1165*6)+L1165 -> 59 | O1165: 14 | P1165: 18 | Q1165: =(O1165*6)+P1165 -> 102
A1166: BEST PLAYERS
A1167: SANDRINGHAM | C1167: POYAS | F1167: S RADFORD | I1167: MOORCROFT | L1167: OAKLEY | O1167: LAMB | Q1167: MILLER
A1168: PORT MELBOURNE | C1168: DAVEY | F1168: HALE | I1168: SMITH | L1168: CROWE | O1168: ALLEWAY
A1169: GOALKICKERS
A1170: SANDRINGHAM | C1170: OAKLEY 5 | F1170: MOORCROFT 4 | I1170: MILLER 2 | L1170: POYAS 2 | N1170: ROGERS 2 | Q1170: GRANT | S1170: HAYNES | W1170: J RADFORD
A1171: PORT MELBOURNE | C1171: DAVEY 3 | F1171: ALLEWAY 3 | I1171: ALOI 2 | K1171: FIRRITO 2 | N1171: ALEXANDER | Q1171: COOPER | S1171: MORRELL | W1171: SMITH
A1173: QUALIFYING FINAL | G1173: 3OTH AUGUST | J1173: WEATHER
A1174: WILLIAMSTOWN | C1174: 5 | D1174: 5 | E1174: =(C1174*6)+D1174 -> 35 | G1174: 9 | H1174: 8 | I1174: =(G1174*6)+H1174 -> 62 | K1174: 11 | L1174: 11 | M1174: =(K1174*6)+L1174 -> 77 | O1174: 16 | P1174: 14 | Q1174: =(O1174*6)+P1174 -> 110 | S1174: Venue: BOX HILL
A1175: BOX HILL | C1175: 2 | D1175: 1 | E1175: =(C1175*6)+D1175 -> 13 | G1175: 5 | H1175: 5 | I1175: =(G1175*6)+H1175 -> 35 | K1175: 6 | L1175: 9 | M1175: =(K1175*6)+L1175 -> 45 | O1175: 8 | P1175: 13 | Q1175: =(O1175*6)+P1175 -> 61
A1176: BEST PLAYERS
A1177: WILLIAMSTOWN | C1177: MOLLOY | F1177: FLETCHER | I1177: LLOYD | L1177: DAVIS | N1177: McKEE | Q1177: KING
A1178: BOX HILL | C1178: CAMPBELL | F1178: SCOTT | I1178: STONE | L1178: SEWELL | N1178: BALL | Q1178: PUGSLEY
A1179: GOALKICKERS
A1180: WILLIAMSTOWN | C1180: DAVIS 3 | E1180: McKEE 3 | G1180: BALDWIN 2 | J1180: McGOUGH 2 | M1180: BETHERAS | O1180: CLOKE | Q1180: MAHONEY | T1180: MAXWELL | X1180: MOLLOY | AA1180: SHACKLETON
A1181: BOX HILL
A1183: 1ST SEMI FINAL | F1183: 7TH SEPTEMBER | J1183: WEATHER
A1184: PORT MELBOURNE | C1184: 5 | D1184: 2 | E1184: =(C1184*6)+D1184 -> 32 | G1184: 9 | H1184: 4 | I1184: =(G1184*6)+H1184 -> 58 | K1184: 11 | L1184: 9 | M1184: =(K1184*6)+L1184 -> 75 | O1184: 17 | P1184: 14 | Q1184: =(O1184*6)+P1184 -> 116 | S1184: Venue: BELLERIVE OVAL
A1185: TASMANIA | C1185: 4 | D1185: 6 | E1185: =(C1185*6)+D1185 -> 30 | G1185: 7 | H1185: 13 | I1185: =(G1185*6)+H1185 -> 55 | K1185: 13 | L1185: 20 | M1185: =(K1185*6)+L1185 -> 98 | O1185: 14 | P1185: 21 | Q1185: =(O1185*6)+P1185 -> 105
A1186: BEST PLAYERS
A1187: PORT MELBOURNE | C1187: FIRRITO | F1187: ALLEWAY | I1187: DELUCA | L1187: McINTOSH | O1187: STEVENS
A1188: TASMANIA | C1188: ATKIN | F1188: CANN | I1188: THURLEY | L1188: CRIPPS | O1188: WAGER | R1188: DOERING
A1189: GOALKICKERS
A1190: PORT MELBOURNE | C1190: ALLEWAY 3 | F1190: BOURKE 2 | I1190: CLAYTON 2 | L1190: DAVEY 2 | N1190: GILL 2 | P1190: McMAHON 2 | S1190: FIRRITO | V1190: McINTOSH | X1190: SMITH | Z1190: STEVENS
A1191: TASMANIA | C1191: THURLEY 5 | F1191: CANN 3 | I1191: BEAMS 2 | L1191: BARTLETT | N1191: CALLINAN | Q1191: CRIPPS | S1191: ROBINSON
A1193: 2ND SEMI FINAL | F1193: 6TH SEPTEMBER | J1193: WEATHER
A1194: BOX HILL | C1194: 1 | D1194: 4 | E1194: =(C1194*6)+D1194 -> 10 | G1194: 3 | H1194: 6 | I1194: =(G1194*6)+H1194 -> 24 | K1194: 8 | L1194: 10 | M1194: =(K1194*6)+L1194 -> 58 | O1194: 12 | P1194: 12 | Q1194: =(O1194*6)+P1194 -> 84 | S1194: Venue: PORT MELBOURNE
A1195: WERRIBEE | C1195: 4 | D1195: 5 | E1195: =(C1195*6)+D1195 -> 29 | G1195: 9 | H1195: 9 | I1195: =(G1195*6)+H1195 -> 63 | K1195: 12 | L1195: 10 | M1195: =(K1195*6)+L1195 -> 82 | O1195: 12 | P1195: 11 | Q1195: =(O1195*6)+P1195 -> 83
A1196: BEST PLAYERS
A1197: BOX HILL | C1197: LOATS | F1197: LADSON | I1197: SCOTT | L1197: JOHNSON | O1197: BALL | Q1197: KENNA
A1198: WERRIBEE | C1198: HUDSON | F1198: SETCHELL | I1198: LAMB | L1198: CROSS | O1198: HASSETT | Q1198: HENDERSON
A1199: GOALKICKERS
A1200: BOX HILL | C1200: KENNA 3 | F1200: BRENNAN 2 | I1200: LADSON 2 | L1200: LOATS 2 | N1200: CLARKE | P1200: HUNTER | R1200: SMITH
A1201: WERRIBEE | C1201: CONDOS 3 | F1201: LAMB 2 | I1201: PODSIADLY 2 | L1201: CHURCHILL | N1201: HENDERSON | Q1201: PICKEN | S1201: RAU | U1201: SETCHELL
A1203: PRELIMINARY FINAL | F1203: 13TH SEPTEMBER | J1203: WEATHER
A1204: BOX HILL | C1204: 3 | D1204: 1 | E1204: =(C1204*6)+D1204 -> 19 | G1204: 5 | H1204: 4 | I1204: =(G1204*6)+H1204 -> 34 | K1204: 10 | L1204: 11 | M1204: =(K1204*6)+L1204 -> 71 | O1204: 14 | P1204: 14 | Q1204: =(O1204*6)+P1204 -> 98 | S1204: Venue: PORT MELBOURNE
A1205: SANDRINGHAM | C1205: 3 | D1205: 4 | E1205: =(C1205*6)+D1205 -> 22 | G1205: 8 | H1205: 6 | I1205: =(G1205*6)+H1205 -> 54 | K1205: 8 | L1205: 7 | M1205: =(K1205*6)+L1205 -> 55 | O1205: 9 | P1205: 9 | Q1205: =(O1205*6)+P1205 -> 63
A1206: BEST PLAYERS
A1207: BOX HILL
A1208: SANDRINGHAM | C1208: WHEATLEY | F1208: OAKLEY | I1208: RIGONI | L1208: ROBBINS | O1208: GRANT | Q1208: S RADFORD
A1209: GOALKICKERS
A1210: BOX HILL
A1211: SANDRINGHAM | C1211: OAKLEY 4 | F1211: N SMITH | I1211: TRELOAR | K1211: POYAS | M1211: MOORCROFT | P1211: RIGONI
A1213: PRELIMINARY FINAL | F1213: 14TH SEPTEMBER | J1213: WEATHER
A1214: WILLIAMSTOWN | C1214: 4 | D1214: 6 | E1214: =(C1214*6)+D1214 -> 30 | G1214: 9 | H1214: 9 | I1214: =(G1214*6)+H1214 -> 63 | K1214: 15 | L1214: 10 | M1214: =(K1214*6)+L1214 -> 100 | O1214: 17 | P1214: 11 | Q1214: =(O1214*6)+P1214 -> 113 | S1214: Venue: PORT MELBOURNE
A1215: PORT MELBOURNE | C1215: 2 | D1215: 4 | E1215: =(C1215*6)+D1215 -> 16 | G1215: 7 | H1215: 8 | I1215: =(G1215*6)+H1215 -> 50 | K1215: 10 | L1215: 11 | M1215: =(K1215*6)+L1215 -> 71 | O1215: 15 | P1215: 16 | Q1215: =(O1215*6)+P1215 -> 106
A1216: BEST PLAYERS
A1217: WILLIAMSTOWN
A1218: PORT MELBOURNE
A1219: GOALKICKERS
A1220: WILLIAMSTOWN
A1221: PORT MELBOURNE
A1223: GRAND FINAL | D1223: 21ST SEPTEMBER | J1223: WEATHER
A1224: WILLIAMSTOWN | C1224: 6 | D1224: 5 | E1224: =(C1224*6)+D1224 -> 41 | G1224: 9 | H1224: 9 | I1224: =(G1224*6)+H1224 -> 63 | K1224: 12 | L1224: 9 | M1224: =(K1224*6)+L1224 -> 81 | O1224: 13 | P1224: 14 | Q1224: =(O1224*6)+P1224 -> 92 | S1224: Venue: OPTUS OVAL
A1225: BOX HILL | C1225: 1 | D1225: 1 | E1225: =(C1225*6)+D1225 -> 7 | G1225: 2 | H1225: 4 | I1225: =(G1225*6)+H1225 -> 16 | K1225: 8 | L1225: 6 | M1225: =(K1225*6)+L1225 -> 54 | O1225: 9 | P1225: 9 | Q1225: =(O1225*6)+P1225 -> 63
A1226: BEST PLAYERS
A1227: WILLIAMSTOWN | C1227: FLETCHER | F1227: LLOYD | I1227: FREEBORN | L1227: RICHARDS | O1227: SWAN | R1227: WEST
A1228: BOX HILL | C1228: BALL | F1228: HAZELL | I1228: GREENE | L1228: NEAGLE | O1228: BAYFORD | R1228: KENNA
A1229: GOALKICKERS
A1230: WILLIAMSTOWN | C1230: BALDWIN 4 | F1230: MAHONEY 2 | I1230: MOLLOY 2 | L1230: CRANAGE | N1230: McGOUGH | Q1230: SMOKER | S1230: SWAN | V1230: WILLIAMS
A1231: BOX HILL | C1231: BAYFORD 2 | F1231: KENNA 2 | I1231: BALL | K1231: CAMPBELL | N1231: HARFORD | Q1231: JOHNSON | T1231: MARGUCCIO