A1: Victorian Football League
A2: Season 2004
A3: © Copyright Wal Williams | F3: First created: 10 September 2016
A4: Contact: joywalwi at gmail dot com | F4: Last updated: 13 October 2016 | W4: VFA Results and tables - Link to the main index page
A5: You are free to copy this document in whole or part provided that proper acknowledgement is given to the author. All rights reserved.
A7: 2004 SEASON
A8: ROUND 1 | D8: 3RD APRIL | J8: WEATHER
D9: 1ST QTR | H9: 2ND QTR | L9: 3RD QTR | P9: FINAL | S9: Venue: BOX HILL
A10: PORT MELBOURNE | C10: 7 | D10: 3 | E10: =(C10*6)+D10 -> 45 | G10: 10 | H10: 7 | I10: =(G10*6)+H10 -> 67 | K10: 14 | L10: 10 | M10: =(K10*6)+L10 -> 94 | O10: 20 | P10: 15 | Q10: =(O10*6)+P10 -> 135 | S10: UMPIRES | Z10: LADDER | AC10: ROUND | AE10: 1
A11: BOX HILL | C11: 1 | D11: 5 | E11: =(C11*6)+D11 -> 11 | G11: 7 | H11: 8 | I11: =(G11*6)+H11 -> 50 | K11: 11 | L11: 11 | M11: =(K11*6)+L11 -> 77 | O11: 13 | P11: 16 | Q11: =(O11*6)+P11 -> 94
A12: BEST PLAYERS | W12: TEAM | X12: B | Y12: W | Z12: L | AA12: D | AB12: FOR | AC12: AGST | AD12: % | AE12: PTS
A13: PORT MELBOURNE | C13: ROCCA | F13: WATSON | I13: HARVEY | L13: OBST | N13: ROBBINS
A14: BOX HILL | C14: TAYLOR | F14: HEIGHT | I14: BAILEY | L14: SEWELL | N14: OSBORNE | Q14: PUGSLEY | W14: NORTHERN BULLANTS | Y14: 1 | Z14: 0 | AA14: 0 | AB14: 149 | AC14: 64 | AD14: =(AB14/AC14)*100 -> 232.8125 | AE14: =(Y14*4)+(AA14*2) -> 4
A15: GOALKICKERS | P15: WATSON | R15: COTCHETT | W15: WERRIBEE | Y15: 1 | Z15: 0 | AA15: 0 | AB15: 124 | AC15: 56 | AD15: =(AB15/AC15)*100 -> 221.42857142857144 | AE15: =(Y15*4)+(AA15*2) -> 4
A16: PORT MELBOURNE | C16: ROCCA 8 | E16: HARDING 3 | H16: LAWRENCE 2 | K16: PITT 2 | M16: TROTTER | O16: HARVEY | Q16: SHORE | W16: SANDRINGHAM | Y16: 1 | Z16: 0 | AA16: 0 | AB16: 98 | AC16: 54 | AD16: =(AB16/AC16)*100 -> 181.4814814814815 | AE16: =(Y16*4)+(AA16*2) -> 4
A17: BOX HILL | C17: HARVEY 3 | E17: KANE 3 | G17: BRENNAN 2 | J17: HEIGHT | L17: MARGUCCCIO | O17: MILLER | Q17: OSBORNE | W17: TASMANIA | Y17: 1 | Z17: 0 | AA17: 0 | AB17: 121 | AC17: 82 | AD17: =(AB17/AC17)*100 -> 147.5609756097561 | AE17: =(Y17*4)+(AA17*2) -> 4
G18: NIGHT MATCH | P18: TAYLOR | W18: PORT MELBOURNE | Y18: 1 | Z18: 0 | AA18: 0 | AB18: 135 | AC18: 94 | AD18: =(AB18/AC18)*100 -> 143.61702127659575 | AE18: =(Y18*4)+(AA18*2) -> 4
A19: TASMANIA | C19: 3 | D19: 1 | E19: =(C19*6)+D19 -> 19 | G19: 7 | H19: 3 | I19: =(G19*6)+H19 -> 45 | K19: 11 | L19: 5 | M19: =(K19*6)+L19 -> 71 | O19: 19 | P19: 7 | Q19: =(O19*6)+P19 -> 121 | S19: Venue: YORK PARK (Launceston) | W19: FRANKSTON | Y19: 1 | Z19: 0 | AA19: 0 | AB19: 74 | AC19: 65 | AD19: =(AB19/AC19)*100 -> 113.84615384615384 | AE19: =(Y19*4)+(AA19*2) -> 4
A20: SPRINGVALE | C20: 6 | D20: 2 | E20: =(C20*6)+D20 -> 38 | G20: 9 | H20: 4 | I20: =(G20*6)+H20 -> 58 | K20: 10 | L20: 7 | M20: =(K20*6)+L20 -> 67 | O20: 12 | P20: 10 | Q20: =(O20*6)+P20 -> 82 | W20: BENDIGO | X20: 1 | Y20: 0 | Z20: 0 | AA20: 0 | AB20: 0 | AC20: 0 | AE20: =(Y20*4)+(AA20*2) -> 0
A21: BEST PLAYERS | W21: NORTH BALLARAT | Y21: 0 | Z21: 1 | AA21: 0 | AB21: 65 | AC21: 74 | AD21: =(AB21/AC21)*100 -> 87.837837837837839 | AE21: =(Y21*4)+(AA21*2) -> 0
A22: TASMANIA | C22: BARTLETT | F22: ATKIN | I22: STREET | L22: DRURY | N22: WAGER | Q22: HOWARD
A23: SPRINGVALE | C23: MOYLE | F23: STONE | I23: HOULIHAN | L23: CARROLL | N23: SCHWARZE | W23: BOX HILL | Y23: 0 | Z23: 1 | AA23: 0 | AB23: 94 | AC23: 135 | AD23: =(AB23/AC23)*100 -> 69.629629629629633 | AE23: =(Y23*4)+(AA23*2) -> 0
A24: GOALKICKERS | N24: WALKER | P24: WAGER | R24: ATKIN | W24: SPRINGVALE | Y24: 0 | Z24: 1 | AA24: 0 | AB24: 82 | AC24: 121 | AD24: =(AB24/AC24)*100 -> 67.768595041322314 | AE24: =(Y24*4)+(AA24*2) -> 0
A25: TASMANIA | C25: CALLINAN 3 | F25: DRURY 3 | H25: HALL 3 | J25: M GEAPPEN 2 | M25: VINEY 2 | O25: BROWN 2 | Q25: B GEAPPEN | W25: COBURG | Y25: 0 | Z25: 1 | AA25: 0 | AB25: 54 | AC25: 98 | AD25: =(AB25/AC25)*100 -> 55.102040816326522 | AE25: =(Y25*4)+(AA25*2) -> 0
A26: SPRINGVALE | C26: MOYLE 3 | F26: BROOKS 2 | I26: HOULIHAN 2 | L26: RIGG | N26: STONE | P26: WULF | R26: FERGUSON | W26: WILLIAMSTOWN | Y26: 0 | Z26: 1 | AA26: 0 | AB26: 56 | AC26: 124 | AD26: =(AB26/AC26)*100 -> 45.161290322580641 | AE26: =(Y26*4)+(AA26*2) -> 0
D27: 4TH APRIL | J27: WEATHER | P27: INGALL | W27: GEELONG | Y27: 0 | Z27: 1 | AA27: 0 | AB27: 64 | AC27: 149 | AD27: =(AB27/AC27)*100 -> 42.95302013422819 | AE27: =(Y27*4)+(AA27*2) -> 0
A28: NORTHERN BULLANTS | C28: 7 | D28: 4 | E28: =(C28*6)+D28 -> 46 | G28: 10 | H28: 9 | I28: =(G28*6)+H28 -> 69 | K28: 14 | L28: 13 | M28: =(K28*6)+L28 -> 97 | O28: 22 | P28: 17 | Q28: =(O28*6)+P28 -> 149 | S28: Venue: OPTUS OVAL (C/R)
A29: GEELONG | C29: 1 | D29: 5 | E29: =(C29*6)+D29 -> 11 | G29: 7 | H29: 7 | I29: =(G29*6)+H29 -> 49 | K29: 9 | L29: 9 | M29: =(K29*6)+L29 -> 63 | O29: 9 | P29: 10 | Q29: =(O29*6)+P29 -> 64
A30: BEST PLAYERS
A31: NORTHERN BULLANTS | C31: DAVIES | F31: McGRATH | I31: McCORMICK | L31: SIMPSON | O31: ZORZI | Q31: FRANCHINA
A32: GEELONG | C32: SPENCER | F32: MACKIE | I32: EGAN | L32: KOULOURRIOTES
A33: GOALKICKERS
A34: NORTHERN BULLANTS | C34: BEASY 4 | E34: MASLIN 4 | G34: MOTT 3 | I34: PLEMING 3 | L34: BENTICK 2 | N34: McCORMICK 2 | Q34: McGRATH 2 | T34: FRANCHINA | X34: ZORZI
A35: GEELONG | C35: GREAVES 3 | F35: KOULOURIOTIS 2 | J35: THURLEY 2 | M35: WOJCINSKI | P35: CALLAN
A37: WERRIBEE | C37: 3 | D37: 1 | E37: =(C37*6)+D37 -> 19 | G37: 10 | H37: 3 | I37: =(G37*6)+H37 -> 63 | K37: 13 | L37: 4 | M37: =(K37*6)+L37 -> 82 | O37: 19 | P37: 10 | Q37: =(O37*6)+P37 -> 124 | S37: Venue: WERRIBEE
A38: WILLIAMSTOWN | C38: 2 | D38: 7 | E38: =(C38*6)+D38 -> 19 | G38: 2 | H38: 8 | I38: =(G38*6)+H38 -> 20 | K38: 6 | L38: 11 | M38: =(K38*6)+L38 -> 47 | O38: 7 | P38: 14 | Q38: =(O38*6)+P38 -> 56
A39: BEST PLAYERS
A40: WERRIBEE | C40: McMAHON | F40: ROBERTSON | I40: B MURPHY | L40: SETCHELL | O40: PODSIADLY | R40: BASSETT
A41: WILLIAMSTOWN | C41: WEST | F41: CRANAGE | I41: WILLIAMS | L41: LLOYD | O41: JARROD | R41: SWAN
A42: GOALKICKERS
A43: WERRIBEE | C43: MURPHY 4 | E43: McMAHON 3 | H43: SKIPPER 3 | J43: RAY 2 | L43: GILBEE | N43: WALSH | P43: RAU | Q43: CONDOS | S43: HENDERSON | W43: BANDY | X43: BASSETT
A44: WILLIAMSTOWN | C44: B SHAW 2 | F44: LLOYD 2 | I44: KINNEAR | K44: JARROD | M44: DUKES
A46: SANDRINGHAM | C46: 1 | D46: 3 | E46: =(C46*6)+D46 -> 9 | G46: 8 | H46: 10 | I46: =(G46*6)+H46 -> 58 | K46: 9 | L46: 12 | M46: =(K46*6)+L46 -> 66 | O46: 14 | P46: 14 | Q46: =(O46*6)+P46 -> 98 | S46: Venue: BEACH ROAD
A47: COBURG | C47: 2 | D47: 3 | E47: =(C47*6)+D47 -> 15 | G47: 5 | H47: 6 | I47: =(G47*6)+H47 -> 36 | K47: 7 | L47: 9 | M47: =(K47*6)+L47 -> 51 | O47: 7 | P47: 12 | Q47: =(O47*6)+P47 -> 54
A48: BEST PLAYERS
A49: SANDRINGHAM | C49: BIDDLECOMBE | F49: NEWMAN | I49: O'KEEFFE | L49: RIGONI | O49: ARMSTRONG | R49: LAMB
A50: COBURG | C50: MOORE | F50: SHULZ | I50: KURET | L50: FLETCHER
A51: GOALKICKERS
A52: SANDRINGHAM | C52: NEWMAN 5 | F52: SAUTNER 2 | I52: GALLAGHER 2 | L52: SMITH | N52: HEFFERNAN | Q52: BIDDLECOMBE | V52: RIGONI | X52: FISHER
A53: COBURG | C53: SHULZE 2 | F53: RAINES | I53: O'CONNOR | L53: FLETCHER | N53: HOULIHAN | Q53: JACKSON
A55: FRANKSTON | C55: 1 | D55: 4 | E55: =(C55*6)+D55 -> 10 | G55: 4 | H55: 6 | I55: =(G55*6)+H55 -> 30 | K55: 8 | L55: 7 | M55: =(K55*6)+L55 -> 55 | O55: 11 | P55: 8 | Q55: =(O55*6)+P55 -> 74 | S55: Venue: NORTH BALLARAT
A56: NORTH BALLARAT | C56: 4 | D56: 2 | E56: =(C56*6)+D56 -> 26 | G56: 6 | H56: 3 | I56: =(G56*6)+H56 -> 39 | K56: 9 | L56: 3 | M56: =(K56*6)+L56 -> 57 | O56: 10 | P56: 5 | Q56: =(O56*6)+P56 -> 65
A57: BEST PLAYERS
A58: FRANKSTON | C58: WILLIS | F58: ABLETT | I58: BUTLER | L58: POLLARD | O58: ODELL | R58: MURPHY
A59: NORTH BALLARAT | C59: TUCKEY | F59: BIDDISCOMBE | I59: MOLONEY | L59: JENKINS
A60: GOALKICKERS
A61: FRANKSTON | C61: BERRY 2 | E61: CLARKE 2 | H61: LITTLECHILD 2 | L61: MARIGLIANI 2 | P61: McCORMACK 2 | S61: ANSTEY
A62: NORTH BALLARAT | C62: SAUNDERS 3 | F62: TUCKEY 2 | I62: TAYLOR 2 | L62: McMAHON | N62: JURICA | P62: MILLER
A64: BYE | D64: BENDIGO
A66: ROUND 2 | D66: 10TH APRIL | J66: WEATHER
D67: 1ST QTR | H67: 2ND QTR | L67: 3RD QTR | P67: FINAL | S67: Venue: WILLIAMSTOWN
A68: WILLIAMSTOWN | C68: 1 | D68: 7 | E68: =(C68*6)+D68 -> 13 | G68: 7 | H68: 9 | I68: =(G68*6)+H68 -> 51 | K68: 12 | L68: 9 | M68: =(K68*6)+L68 -> 81 | O68: 14 | P68: 9 | Q68: =(O68*6)+P68 -> 93 | S68: UMPIRES | Z68: LADDER | AC68: ROUND | AE68: 2
A69: BOX HILL | C69: 3 | D69: 3 | E69: =(C69*6)+D69 -> 21 | G69: 4 | H69: 6 | I69: =(G69*6)+H69 -> 30 | K69: 7 | L69: 11 | M69: =(K69*6)+L69 -> 53 | O69: 11 | P69: 17 | Q69: =(O69*6)+P69 -> 83
A70: BEST PLAYERS | W70: TEAM | X70: B | Y70: W | Z70: L | AA70: D | AB70: FOR | AC70: AGST | AD70: % | AE70: PTS
A71: WILLIAMSTOWN | C71: JARRAD | F71: WILLIAMS | I71: MULLINS | L71: BALDWIN | O71: KING | Q71: SHEEHAN
A72: BOX HILL | C72: PICIAONE | F72: RIX | I72: McCABE | L72: NEAGLE | O72: COX | Q72: BAILEY | W72: TASMANIA | Y72: 2 | Z72: 0 | AA72: 0 | AB72: 233 | AC72: 154 | AD72: =(AB72/AC72)*100 -> 151.29870129870127 | AE72: =(Y72*4)+(AA72*2) -> 8
A73: GOALKICKERS | W73: PORT MELBOURNE | Y73: 2 | Z73: 0 | AA73: 0 | AB73: 244 | AC73: 188 | AD73: =(AB73/AC73)*100 -> 129.78723404255319 | AE73: =(Y73*4)+(AA73*2) -> 8
A74: WILLIAMSTOWN | C74: BALDWIN 6 | F74: McKEE 2 | I74: WILLIAMS 2 | L74: PROCTOR | N74: MULLINS | P74: CROW | R74: JARRAD | W74: WERRIBEE | X74: 1 | Y74: 1 | Z74: 0 | AA74: 0 | AB74: 124 | AC74: 56 | AD74: =(AB74/AC74)*100 -> 221.42857142857144 | AE74: =(Y74*4)+(AA74*2) -> 4
A75: BOX HILL | C75: HARVEY 3 | F75: PICIAONE 3 | I75: HEIGHT 2 | L75: ALLEWAY | N75: BATEMAN | Q75: BRENNAN | W75: NORTH BALLARAT | Y75: 1 | Z75: 1 | AA75: 0 | AB75: 182 | AC75: 107 | AD75: =(AB75/AC75)*100 -> 170.09345794392522 | AE75: =(Y75*4)+(AA75*2) -> 4
W76: BENDIGO | X76: 1 | Y76: 1 | Z76: 0 | AA76: 0 | AB76: 132 | AC76: 95 | AD76: =(AB76/AC76)*100 -> 138.94736842105263 | AE76: =(Y76*4)+(AA76*2) -> 4
A77: BENDIGO | C77: 6 | D77: 5 | E77: =(C77*6)+D77 -> 41 | G77: 9 | H77: 10 | I77: =(G77*6)+H77 -> 64 | K77: 14 | L77: 16 | M77: =(K77*6)+L77 -> 100 | O77: 19 | P77: 18 | Q77: =(O77*6)+P77 -> 132 | S77: Venue: BENDIGO | W77: SANDRINGHAM | Y77: 1 | Z77: 1 | AA77: 0 | AB77: 170 | AC77: 166 | AD77: =(AB77/AC77)*100 -> 102.40963855421687 | AE77: =(Y77*4)+(AA77*2) -> 4
A78: GEELONG | C78: 4 | D78: 3 | E78: =(C78*6)+D78 -> 27 | G78: 6 | H78: 5 | I78: =(G78*6)+H78 -> 41 | K78: 9 | L78: 9 | M78: =(K78*6)+L78 -> 63 | O78: 14 | P78: 11 | Q78: =(O78*6)+P78 -> 95 | W78: NORTHERN BULLANTS | Y78: 1 | Z78: 1 | AA78: 0 | AB78: 182 | AC78: 181 | AD78: =(AB78/AC78)*100 -> 100.55248618784532 | AE78: =(Y78*4)+(AA78*2) -> 4
A79: BEST PLAYERS | W79: FRANKSTON | Y79: 1 | Z79: 1 | AA79: 0 | AB79: 168 | AC79: 174 | AD79: =(AB79/AC79)*100 -> 96.551724137931032 | AE79: =(Y79*4)+(AA79*2) -> 4
A80: BENDIGO | C80: BRADLEY | F80: CAMPBELL | I80: BOWEN | L80: LAYCCOCK | O80: ALVEY | Q80: NASH
A81: GEELONG | C81: D BYRNE | F81: McCARTHY | I81: OAKLEY | L81: CALLAN | O81: CLARK | W81: COBURG | Y81: 1 | Z81: 1 | AA81: 0 | AB81: 147 | AC81: 181 | AD81: =(AB81/AC81)*100 -> 81.215469613259671 | AE81: =(Y81*4)+(AA81*2) -> 4
A82: GOALKICKERS | R82: WALSH | W82: WILLIAMSTOWN | Y82: 1 | Z82: 1 | AA82: 0 | AB82: 149 | AC82: 207 | AD82: =(AB82/AC82)*100 -> 71.980676328502412 | AE82: =(Y82*4)+(AA82*2) -> 4
A83: BENDIGO | C83: LAYCOCK 7 | F83: HAWKINS 2 | I83: LOVETT 2 | K83: BRADLEY 2 | N83: ALVEY 2 | P83: STANTON 2 | S83: ROBBINS | W83: SPRINGVALE | Y83: 0 | Z83: 2 | AA83: 0 | AB83: 165 | AC83: 214 | AD83: =(AB83/AC83)*100 -> 77.10280373831776 | AE83: =(Y83*4)+(AA83*2) -> 0
A84: GEELONG | C84: McCARTHY 4 | F84: GREAVES 2 | I84: ABLETT 2 | K84: D BYRNE | M84: FOSTER | O84: LONERGAN | Q84: O'DWYER | S84: SMITH | W84: BOX HILL | Y84: 0 | Z84: 2 | AA84: 0 | AB84: 177 | AC84: 228 | AD84: =(AB84/AC84)*100 -> 77.631578947368425 | AE84: =(Y84*4)+(AA84*2) -> 0
N85: THURLEY | W85: GEELONG | Y85: 0 | Z85: 2 | AA85: 0 | AB85: 159 | AC85: 281 | AD85: =(AB85/AC85)*100 -> 56.583629893238431 | AE85: =(Y85*4)+(AA85*2) -> 0
A86: NORTH BALLARAT | C86: 1 | D86: 4 | E86: =(C86*6)+D86 -> 10 | G86: 5 | H86: 6 | I86: =(G86*6)+H86 -> 36 | K86: 10 | L86: 13 | M86: =(K86*6)+L86 -> 73 | O86: 17 | P86: 15 | Q86: =(O86*6)+P86 -> 117 | S86: Venue: NORTH BALLARAT
A87: NORTHERN BULLANTS | C87: 1 | D87: 1 | E87: =(C87*6)+D87 -> 7 | G87: 2 | H87: 5 | I87: =(G87*6)+H87 -> 17 | K87: 2 | L87: 6 | M87: =(K87*6)+L87 -> 18 | O87: 4 | P87: 9 | Q87: =(O87*6)+P87 -> 33
A88: BEST PLAYERS
A89: NORTH BALLARAT | C89: ECCLES | F89: SAUNDERS | I89: BYE | L89: RYALL | N89: McLEAN | Q89: PLUNKETT
A90: NORTHERN BULLANTS | C90: BOWYER | F90: WALKER | I90: McCORMICK
A91: GOALKICKERS
A92: NORTH BALLARAT | C92: SAUNDERS 4 | F92: TUCKEY 3 | I92: McGRATH 2 | L92: WHYMAN 2 | N92: HUTCHINSON | Q92: MILLER | S92: DINNELL | V92: ECCLES | X92: TAYLOR | AA92: PLUNKETT
A93: NORTHERN BULLANTS | C93: BEASY | F93: O'HAILPIN | I93: WALKER | L93: ZORZI
A95: TASMANIA | C95: 2 | D95: 3 | E95: =(C95*6)+D95 -> 15 | G95: 9 | H95: 5 | I95: =(G95*6)+H95 -> 59 | K95: 12 | L95: 9 | M95: =(K95*6)+L95 -> 81 | O95: 17 | P95: 10 | Q95: =(O95*6)+P95 -> 112 | S95: Venue: NORTH HOBART OVAL
A96: SANDRINGHAM | C96: 3 | D96: 2 | E96: =(C96*6)+D96 -> 20 | G96: 4 | H96: 5 | I96: =(G96*6)+H96 -> 29 | K96: 7 | L96: 9 | M96: =(K96*6)+L96 -> 51 | O96: 10 | P96: 12 | Q96: =(O96*6)+P96 -> 72
A97: BEST PLAYERS
A98: TASMANIA | C98: HOWARD | F98: WALKER | I98: BARTLETT | L98: ROBINSON | N98: B GEAPPEN | Q98: STREET
A99: SANDRINGHAM | C99: BELL | F99: BIDDLECOMBE | I99: MILLS | L99: BROADBRIDGE | O99: BISHOP
A100: GOALKICKERS
A101: TASMANIA | C101: BARTLETT 4 | F101: DRURY 3 | I101: CALLINAN 2 | L101: VINEY 2 | N101: BEAMS 2 | Q101: STREET | S101: B GEAPPEN | W101: M GEAPPEN | X101: HALL
A102: SANDRINGHAM | C102: SAUTNER 3 | F102: GALLAGHER 2 | J102: WILLIAMS 2 | M102: RIGONI | O102: MILLS | Q102: JOHNSON
D103: 11TH APRIL | J103: WEATHER
A104: PORT MELBOURNE | C104: 1 | D104: 6 | E104: =(C104*6)+D104 -> 12 | G104: 4 | H104: 10 | I104: =(G104*6)+H104 -> 34 | K104: 8 | L104: 11 | M104: =(K104*6)+L104 -> 59 | O104: 16 | P104: 13 | Q104: =(O104*6)+P104 -> 109 | S104: Venue: PORT MELBOURNE
A105: FRANKSTON | C105: 6 | D105: 5 | E105: =(C105*6)+D105 -> 41 | G105: 10 | H105: 6 | I105: =(G105*6)+H105 -> 66 | K105: 14 | L105: 9 | M105: =(K105*6)+L105 -> 93 | O105: 14 | P105: 10 | Q105: =(O105*6)+P105 -> 94
A106: BEST PLAYERS
A107: PORT MELBOURNE | C107: HALE | F107: J CLAYTON | I107: OBST | K107: GRIMA | N107: GIESCHEN
A108: FRANKSTON | C108: O'DELL | F108: BRYAN | I108: POLLARD | K108: FORTNAM | N108: DAMON
A109: GOALKICKERS
A110: PORT MELBOURNE | C110: McINTOSH 3 | F110: ROCCA 3 | I110: HALE 2 | K110: COTCHETT 2 | N110: GIESCHEN | Q110: SCHWARZE | T110: LAWRENCE | X110: WATSON | AA110: HARVEY | AC110: J CLAYTON
A111: FRANKSTON | C111: DAMON 3 | E111: BROWN 2 | G111: ANSTEY | I111: LITTLECHILD | L111: O'DELL | N111: BERRY | P111: CLARKE | R111: WILLIS | U111: FORTNAM | X111: McCORMACK | AB111: MARIGLANI
A113: COBURG | C113: 3 | D113: 0 | E113: =(C113*6)+D113 -> 18 | G113: 6 | H113: 3 | I113: =(G113*6)+H113 -> 39 | K113: 12 | L113: 7 | M113: =(K113*6)+L113 -> 79 | O113: 14 | P113: 9 | Q113: =(O113*6)+P113 -> 93 | S113: Venue: COBURG
A114: SPRINGVALE | C114: 2 | D114: 1 | E114: =(C114*6)+D114 -> 13 | G114: 4 | H114: 3 | I114: =(G114*6)+H114 -> 27 | K114: 6 | L114: 5 | M114: =(K114*6)+L114 -> 41 | O114: 12 | P114: 11 | Q114: =(O114*6)+P114 -> 83
A115: BEST PLAYERS
A116: COBURG | C116: PETTIFER | F116: HOULIHAN | I116: DRAGICEVIC | L116: KURET | N116: FLETCHER | Q116: ROACH
A117: SPRINGVALE | C117: FERGUSON | F117: ROUDA | I117: CAPLES | L117: GRAM | N117: MONTAGNA
A118: GOALKICKERS
A119: COBURG | C119: PETTIFER 4 | F119: HILTON 2 | I119: SHULZ 2 | K119: BLUMFIELD 2 | N119: O'CONNOR | Q119: OWEN | S119: DRAGICEVIC | W119: CARLSON
A120: SPRINGVALE | C120: MOYLE 3 | F120: HARRISON 2 | I120: STONE 2 | K120: MOTT | M120: MURRAY | O120: MONTAGNA | R120: SMITH | U120: CARMODY
A122: BYE | D122: WERRIBEE
A124: ROUND 3 | D124: 17TH APRIL | J124: WEATHER
D125: 1ST QTR | H125: 2ND QTR | L125: 3RD QTR | P125: FINAL | S125: Venue: PRESTON
A126: WERRIBEE | C126: 0 | D126: 0 | E126: =(C126*6)+D126 -> 0 | G126: 4 | H126: 6 | I126: =(G126*6)+H126 -> 30 | K126: 7 | L126: 9 | M126: =(K126*6)+L126 -> 51 | O126: 15 | P126: 14 | Q126: =(O126*6)+P126 -> 104 | S126: UMPIRES | Z126: LADDER | AC126: ROUND | AE126: 3
A127: NORTHERN BULLANTS | C127: 2 | D127: 7 | E127: =(C127*6)+D127 -> 19 | G127: 2 | H127: 7 | I127: =(G127*6)+H127 -> 19 | K127: 5 | L127: 11 | M127: =(K127*6)+L127 -> 41 | O127: 7 | P127: 14 | Q127: =(O127*6)+P127 -> 56
A128: BEST PLAYERS | W128: TEAM | X128: B | Y128: W | Z128: L | AA128: D | AB128: FOR | AC128: AGST | AD128: % | AE128: PTS
A129: WERRIBEE | C129: WIGGINS | F129: CROSS | I129: SKIPPER | L129: ROBERTSON | O129: GARLICK | R129: GILBEE
A130: NORTHERN BULLANTS | C130: ZORZI | F130: WIGGINS | I130: BOWYER | L130: WALKER | O130: McCORMICK | R130: HOOPER | W130: WERRIBEE | X130: 1 | Y130: 2 | Z130: 0 | AA130: 0 | AB130: 228 | AC130: 112 | AD130: =(AB130/AC130)*100 -> 203.57142857142856 | AE130: =(Y130*4)+(AA130*2) -> 8
A131: GOALKICKERS | O131: SKIPPER | Q131: WALSH | W131: SANDRINGHAM | Y131: 2 | Z131: 1 | AA131: 0 | AB131: 312 | AC131: 213 | AD131: =(AB131/AC131)*100 -> 146.47887323943664 | AE131: =(Y131*4)+(AA131*2) -> 8
A132: WERRIBEE | C132: CONDOS 3 | E132: GARLICK 2 | H132: GILBEE 2 | J132: MITCHELL 2 | M132: SETCHELL 2 | P132: BIRSS | R132: FAULKNER | W132: NORTH BALLARAT | Y132: 2 | Z132: 1 | AA132: 0 | AB132: 295 | AC132: 210 | AD132: =(AB132/AC132)*100 -> 140.47619047619045 | AE132: =(Y132*4)+(AA132*2) -> 8
A133: NORTHERN BULLANTS | C133: CLARKE 2 | F133: CAMPBELL | I133: HOOPER | K133: McGRATH | M133: O'HAILPIN | P133: BEASY | W133: PORT MELBOURNE | X133: 1 | Y133: 2 | Z133: 0 | AA133: 0 | AB133: 244 | AC133: 188 | AD133: =(AB133/AC133)*100 -> 129.78723404255319 | AE133: =(Y133*4)+(AA133*2) -> 8
W134: TASMANIA | Y134: 2 | Z134: 1 | AA134: 0 | AB134: 292 | AC134: 281 | AD134: =(AB134/AC134)*100 -> 103.91459074733096 | AE134: =(Y134*4)+(AA134*2) -> 8
A135: COBURG | C135: 4 | D135: 7 | E135: =(C135*6)+D135 -> 31 | G135: 6 | H135: 7 | I135: =(G135*6)+H135 -> 43 | K135: 13 | L135: 12 | M135: =(K135*6)+L135 -> 90 | O135: 15 | P135: 12 | Q135: =(O135*6)+P135 -> 102 | S135: Venue: WILLIAMSTOWN | W135: COBURG | Y135: 2 | Z135: 1 | AA135: 0 | AB135: 249 | AC135: 273 | AD135: =(AB135/AC135)*100 -> 91.208791208791212 | AE135: =(Y135*4)+(AA135*2) -> 8
A136: WILLIAMSTOWN | C136: 0 | D136: 0 | E136: =(C136*6)+D136 -> 0 | G136: 7 | H136: 2 | I136: =(G136*6)+H136 -> 44 | K136: 9 | L136: 4 | M136: =(K136*6)+L136 -> 58 | O136: 14 | P136: 8 | Q136: =(O136*6)+P136 -> 92 | W136: BENDIGO | X136: 1 | Y136: 1 | Z136: 1 | AA136: 0 | AB136: 235 | AC136: 208 | AD136: =(AB136/AC136)*100 -> 112.98076923076923 | AE136: =(Y136*4)+(AA136*2) -> 4
A137: BEST PLAYERS | W137: FRANKSTON | X137: 1 | Y137: 1 | Z137: 1 | AA137: 0 | AB137: 168 | AC137: 174 | AD137: =(AB137/AC137)*100 -> 96.551724137931032 | AE137: =(Y137*4)+(AA137*2) -> 4
A138: COBURG | C138: RODAN | F138: TALBOT | I138: TUCK | L138: HILTON | O138: FLEMING | R138: JORGENSEN
A139: WILLIAMSTOWN | C139: JARRAD | F139: CLOKE | I139: LLOYD | L139: McGOUGH | W139: GEELONG | Y139: 1 | Z139: 2 | AA139: 0 | AB139: 286 | AC139: 340 | AD139: =(AB139/AC139)*100 -> 84.117647058823536 | AE139: =(Y139*4)+(AA139*2) -> 4
A140: GOALKICKERS | M140: O'CONNOR | O140: KURET | Q140: TALBOT | S140: STEINFORT | W140: NORTHERN BULLANTS | Y140: 1 | Z140: 2 | AA140: 0 | AB140: 238 | AC140: 285 | AD140: =(AB140/AC140)*100 -> 83.508771929824562 | AE140: =(Y140*4)+(AA140*2) -> 4
A141: COBURG | C141: FLEMING 2 | E141: HILTON 2 | G141: RODAN 2 | I141: GILMOUR | K141: RAYSON | M141: FOLEY | O141: DRAGICEVIC | R141: RAINES | W141: WILLIAMSTOWN | Y141: 1 | Z141: 2 | AA141: 0 | AB141: 241 | AC141: 309 | AD141: =(AB141/AC141)*100 -> 77.993527508090608 | AE141: =(Y141*4)+(AA141*2) -> 4
A142: WILLIAMSTOWN | C142: BALDWIN 4 | F142: JARRAD 2 | I142: MORRISON 2 | L142: NIXON | N142: LLOYD | P142: PROCTOR | R142: KINNEAR | W142: BOX HILL | X142: 1 | Y142: 0 | Z142: 2 | AA142: 0 | AB142: 177 | AC142: 228 | AD142: =(AB142/AC142)*100 -> 77.631578947368425 | AE142: =(Y142*4)+(AA142*2) -> 0
D143: 18TH APRIL | J143: WEATHER | O143: CLOKE | Q143: SHEEHAN | W143: SPRINGVALE | Y143: 0 | Z143: 3 | AA143: 0 | AB143: 213 | AC143: 356 | AD143: =(AB143/AC143)*100 -> 59.831460674157299 | AE143: =(Y143*4)+(AA143*2) -> 0
A144: SANDRINGHAM | C144: 3 | D144: 2 | E144: =(C144*6)+D144 -> 20 | G144: 6 | H144: 6 | I144: =(G144*6)+H144 -> 42 | K144: 11 | L144: 9 | M144: =(K144*6)+L144 -> 75 | O144: 21 | P144: 16 | Q144: =(O144*6)+P144 -> 142 | S144: Venue: BEACH ROAD
A145: SPRINGVALE | C145: 1 | D145: 3 | E145: =(C145*6)+D145 -> 9 | G145: 4 | H145: 5 | I145: =(G145*6)+H145 -> 29 | K145: 6 | L145: 8 | M145: =(K145*6)+L145 -> 44 | O145: 6 | P145: 11 | Q145: =(O145*6)+P145 -> 47
A146: BEST PLAYERS
A147: SANDRINGHAM | C147: WILLIAMS | F147: McLEAN | I147: HUNTER | L147: ARMSTRONG | O147: BELL | Q147: HEFFERNAN
A148: SPRINGVALE | C148: S FISHER | F148: MURRAY | I148: HARRISON | L148: FERGUSON
A149: GOALKICKERS
A150: SANDRINGHAM | C150: SAUTNER 7 | F150: McLEAN 2 | I150: SMITH 2 | K150: JOHNSON 2 | N150: GALLAGHER 2 | Q150: HUNTER 2 | T150: JAMAR | W150: NEWMAN | Y150: ARMSTRONG | AC150: HEFFERNAN
A151: SPRINGVALE | C151: MURRAY 3 | F151: BROOKS | I151: KOSCH | K151: SMITH
A153: NORTH BALLARAT | C153: 6 | D153: 1 | E153: =(C153*6)+D153 -> 37 | G153: 8 | H153: 2 | I153: =(G153*6)+H153 -> 50 | K153: 15 | L153: 4 | M153: =(K153*6)+L153 -> 94 | O153: 18 | P153: 5 | Q153: =(O153*6)+P153 -> 113 | S153: Venue: NORTH BALLARAT
A154: BENDIGO | C154: 5 | D154: 7 | E154: =(C154*6)+D154 -> 37 | G154: 7 | H154: 11 | I154: =(G154*6)+H154 -> 53 | K154: 10 | L154: 13 | M154: =(K154*6)+L154 -> 73 | O154: 15 | P154: 13 | Q154: =(O154*6)+P154 -> 103
A155: BEST PLAYERS
A156: NORTH BALLARAT | C156: BYE | F156: McLEAN | I156: FIELD | L156: GREIG | O156: SAUMDERS | R156: McCORKELL
A157: BENDIGO | C157: RICHARDS | F157: BRADLEY | I157: STANTON | L157: LOVETT | O157: HUNT | R157: NASH
A158: GOALKICKERS
A159: NORTH BALLARAT | C159: SAUNDERS 4 | F159: DINNELL 3 | I159: TUCKEY 2 | K159: GREIG 2 | M159: WHYMAN 2 | P159: FIELD 2 | R159: TAYLOR | V159: McMAHON | X159: HUTCHINSON
A160: BENDIGO | C160: LOVETT 3 | E160: STANTON 2 | H160: BRADLEY 2 | J160: RICHARDS 2 | M160: SUMMERS | O160: HAWKINS | Q160: WINDERLICH | U160: GILILAND | X160: CAMPBELL | AA160: LAYCOCK
A162: GEELONG | C162: 4 | D162: 2 | E162: =(C162*6)+D162 -> 26 | G162: 8 | H162: 6 | I162: =(G162*6)+H162 -> 54 | K162: 14 | L162: 13 | M162: =(K162*6)+L162 -> 97 | O162: 18 | P162: 19 | Q162: =(O162*6)+P162 -> 127 | S162: Venue: YORK PARK (Launceston)
A163: TASMANIA | C163: 2 | D163: 3 | E163: =(C163*6)+D163 -> 15 | G163: 5 | H163: 5 | I163: =(G163*6)+H163 -> 35 | K163: 5 | L163: 8 | M163: =(K163*6)+L163 -> 38 | O163: 8 | P163: 11 | Q163: =(O163*6)+P163 -> 59
A164: BEST PLAYERS
A165: GEELONG | C165: EGAN | F165: McCARTHY | I165: CALLAN | L165: COOK | N165: SPRIGGS | Q165: BARTEL
A166: TASMANIA | C166: ATKIN | F166: BEAMS | I166: HOWARD | L166: HALL | N166: KIRK
A167: GOALKICKERS
A168: GEELONG | C168: GREAVES 6 | F168: BARTEL 2 | I168: THURLEY 2 | L168: KOULOURIOTIS 2 | P168: ABLETT | R168: ALLAN | U168: J BYRNE | X168: D BYRNE | AA168: FOSTER | AC168: O'DWYER
A169: TASMANIA | C169: BEAMS 2 | F169: ATKIN | H169: B GEAPPEN | J169: PAINE | L169: VINEY | N169: WAGER | P169: BROWN
A171: BYE | D171: BOX HILL | G171: FRANKSTON | J171: PORT MELBOURNE
A173: ROUND 4 | D173: 23RD APRIL | G173: NIGHT MATCH | J173: WEATHER
D174: 1ST QTR | H174: 2ND QTR | L174: 3RD QTR | P174: FINAL | S174: Venue: BENDIGO
A175: BENDIGO | C175: 4 | D175: 4 | E175: =(C175*6)+D175 -> 28 | G175: 10 | H175: 9 | I175: =(G175*6)+H175 -> 69 | K175: 16 | L175: 10 | M175: =(K175*6)+L175 -> 106 | O175: 20 | P175: 15 | Q175: =(O175*6)+P175 -> 135 | S175: UMPIRES | Z175: LADDER | AC175: ROUND | AE175: 4
A176: SPRINGVALE | C176: 1 | D176: 2 | E176: =(C176*6)+D176 -> 8 | G176: 5 | H176: 4 | I176: =(G176*6)+H176 -> 34 | K176: 8 | L176: 7 | M176: =(K176*6)+L176 -> 55 | O176: 8 | P176: 10 | Q176: =(O176*6)+P176 -> 58
A177: BEST PLAYERS | W177: TEAM | X177: B | Y177: W | Z177: L | AA177: D | AB177: FOR | AC177: AGST | AD177: % | AE177: PTS
A178: BENDIGO | C178: DOERING | F178: LOVETT | I178: WATSON | L178: CARTER | O178: CAMPBELL | R178: SUMMERS
A179: SPRINGVALE | C179: PARSONS | F179: MONTAGNA | I179: MILLER | W179: SANDRINGHAM | Y179: 3 | Z179: 1 | AA179: 0 | AB179: 441 | AC179: 270 | AD179: =(AB179/AC179)*100 -> 163.33333333333334 | AE179: =(Y179*4)+(AA179*2) -> 12
A180: GOALKICKERS | M180: DAVIES | O180: WALSH | Q180: WILSON | S180: HAYNES | W180: PORT MELBOURNE | X180: 1 | Y180: 3 | Z180: 0 | AA180: 0 | AB180: 368 | AC180: 248 | AD180: =(AB180/AC180)*100 -> 148.38709677419354 | AE180: =(Y180*4)+(AA180*2) -> 12
A181: BENDIGO | C181: LOVETT 6 | E181: WINDERLICH 2 | H181: CUPIDO 2 | J181: HAWKINS 2 | M181: DOERING 2 | P181: LAYCOCK | R181: SUMMERS | W181: TASMANIA | Y181: 3 | Z181: 1 | AA181: 0 | AB181: 435 | AC181: 347 | AD181: =(AB181/AC181)*100 -> 125.36023054755043 | AE181: =(Y181*4)+(AA181*2) -> 12
A182: SPRINGVALE | C182: INGALL 2 | F182: HEENAN | H182: MORSE | J182: KOSCH | L182: MURRAY | N182: FERGUSON | Q182: MOYLE | W182: COBURG | Y182: 3 | Z182: 1 | AA182: 0 | AB182: 335 | AC182: 335 | AD182: =(AB182/AC182)*100 -> 100 | AE182: =(Y182*4)+(AA182*2) -> 12
D183: 24TH APRIL | J183: WEATHER | W183: BENDIGO | X183: 1 | Y183: 2 | Z183: 1 | AA183: 0 | AB183: 370 | AC183: 266 | AD183: =(AB183/AC183)*100 -> 139.09774436090225 | AE183: =(Y183*4)+(AA183*2) -> 8
A184: WILLIAMSTOWN | C184: 2 | D184: 3 | E184: =(C184*6)+D184 -> 15 | G184: 7 | H184: 4 | I184: =(G184*6)+H184 -> 46 | K184: 11 | L184: 5 | M184: =(K184*6)+L184 -> 71 | O184: 13 | P184: 7 | Q184: =(O184*6)+P184 -> 85 | S184: Venue: FRANKSTON | W184: WERRIBEE | X184: 1 | Y184: 2 | Z184: 1 | AA184: 0 | AB184: 285 | AC184: 241 | AD184: =(AB184/AC184)*100 -> 118.25726141078839 | AE184: =(Y184*4)+(AA184*2) -> 8
A185: FRANKSTON | C185: 3 | D185: 5 | E185: =(C185*6)+D185 -> 23 | G185: 6 | H185: 7 | I185: =(G185*6)+H185 -> 43 | K185: 10 | L185: 8 | M185: =(K185*6)+L185 -> 68 | O185: 11 | P185: 12 | Q185: =(O185*6)+P185 -> 78 | W185: NORTH BALLARAT | Y185: 2 | Z185: 2 | AA185: 0 | AB185: 361 | AC185: 353 | AD185: =(AB185/AC185)*100 -> 102.26628895184136 | AE185: =(Y185*4)+(AA185*2) -> 8
A186: BEST PLAYERS | W186: WILLIAMSTOWN | Y186: 2 | Z186: 2 | AA186: 0 | AB186: 326 | AC186: 387 | AD186: =(AB186/AC186)*100 -> 84.237726098191217 | AE186: =(Y186*4)+(AA186*2) -> 8
A187: WILLIAMSTOWN | C187: MULLINS | F187: CRANAGE | I187: SHEEHAN | L187: McKEE | O187: THEODORE | R187: GERRANRD
A188: FRANKSTON | C188: FORTNAM | F188: BRYAN | I188: MURPHY | L188: ANSTEE | O188: O'DELL | W188: FRANKSTON | X188: 1 | Y188: 1 | Z188: 2 | AA188: 0 | AB188: 246 | AC188: 259 | AD188: =(AB188/AC188)*100 -> 94.980694980694977 | AE188: =(Y188*4)+(AA188*2) -> 4
A189: GOALKICKERS | W189: GEELONG | X189: 1 | Y189: 1 | Z189: 2 | AA189: 0 | AB189: 286 | AC189: 340 | AD189: =(AB189/AC189)*100 -> 84.117647058823536 | AE189: =(Y189*4)+(AA189*2) -> 4
A190: WILLIAMSTOWN | C190: BALDWIN 4 | F190: JARRAD 2 | I190: KNIGHT 2 | K190: SHEEHAN | M190: McKEE | O190: KINNEAR | Q190: MULLINS | S190: B SHAW | W190: NORTHERN BULLANTS | Y190: 1 | Z190: 3 | AA190: 0 | AB190: 298 | AC190: 409 | AD190: =(AB190/AC190)*100 -> 72.860635696821518 | AE190: =(Y190*4)+(AA190*2) -> 4
A191: FRANKSTON | C191: SHIPP 3 | F191: PHIBBS 3 | I191: BRYAN 2 | K191: MURPHY 2 | N191: BERRY | W191: BOX HILL | X191: 1 | Y191: 0 | Z191: 3 | AA191: 0 | AB191: 239 | AC191: 314 | AD191: =(AB191/AC191)*100 -> 76.114649681528661 | AE191: =(Y191*4)+(AA191*2) -> 0
D192: 25TH APRIL | J192: WEATHER | W192: SPRINGVALE | Y192: 0 | Z192: 4 | AA192: 0 | AB192: 271 | AC192: 491 | AD192: =(AB192/AC192)*100 -> 55.193482688391036 | AE192: =(Y192*4)+(AA192*2) -> 0
A193: TASMANIA | C193: 5 | D193: 3 | E193: =(C193*6)+D193 -> 33 | G193: 12 | H193: 4 | I193: =(G193*6)+H193 -> 76 | K193: 17 | L193: 8 | M193: =(K193*6)+L193 -> 110 | O193: 22 | P193: 11 | Q193: =(O193*6)+P193 -> 143 | S193: Venue: NORTH HOBART OVAL
A194: NORTH BALLARAT | C194: 2 | D194: 3 | E194: =(C194*6)+D194 -> 15 | G194: 6 | H194: 6 | I194: =(G194*6)+H194 -> 42 | K194: 8 | L194: 7 | M194: =(K194*6)+L194 -> 55 | O194: 9 | P194: 12 | Q194: =(O194*6)+P194 -> 66
A195: BEST PLAYERS
A196: TASMANIA | C196: JOVANOVIC | F196: BARTLETT | I196: SAVAGE | L196: DUTTON | O196: HALL | Q196: O'SIGN
A197: NORTH BALLARAT | C197: HUTCHINSON | F197: PLUNKETT | I197: FIELD | L197: TUCKEY
A198: GOALKICKERS
A199: TASMANIA | C199: DUTTON 5 | F199: BARTLETT 4 | I199: HALL 4 | K199: CALLINAN 2 | N199: BEAMS 2 | Q199: PLAPP 2 | S199: ATKIN | V199: M GEAPPEN | X199: VINEY
A200: NORTH BALLARAT | C200: PLUNKETT 2 | F200: HUTCHINSON 2 | J200: DINNELL 2 | M200: McGRATH | O200: SAUNDERS | R200: HEAD
A202: SANDRINGHAM | C202: 5 | D202: 5 | E202: =(C202*6)+D202 -> 35 | G202: 9 | H202: 9 | I202: =(G202*6)+H202 -> 63 | K202: 13 | L202: 13 | M202: =(K202*6)+L202 -> 91 | O202: 19 | P202: 15 | Q202: =(O202*6)+P202 -> 129 | S202: Venue: BEACH ROAD
A203: WERRIBEE | C203: 2 | D203: 2 | E203: =(C203*6)+D203 -> 14 | G203: 2 | H203: 4 | I203: =(G203*6)+H203 -> 16 | K203: 4 | L203: 6 | M203: =(K203*6)+L203 -> 30 | O203: 8 | P203: 9 | Q203: =(O203*6)+P203 -> 57
A204: BEST PLAYERS
A205: SANDRINGHAM | C205: WARD | F205: HEFFERNAN | I205: McLEAN | L205: LAMB | O205: CARROLL | Q205: WILLIAMS
A206: WERRIBEE | C206: HENDERSON | F206: FAULKNER | I206: McGUINNESS | L206: MORRIS
A207: GOALKICKERS
A208: SANDRINGHAM | C208: SAUTNER 6 | F208: McLEAN 2 | I208: WALSH 2 | K208: FISHER 2 | M208: SMITH | O208: JOHNSON | Q208: MILLS | S208: HEFFERNAN | W208: O'KEEFE | X208: GALLAGHER | AA208: WARD
A209: WERRIBEE | C209: HENDERSON 2 | F209: MITCHELL 2 | I209: BIRSS | K209: CROFT | M209: RAY | N209: WALSH
A211: COBURG | C211: 3 | D211: 4 | E211: =(C211*6)+D211 -> 22 | G211: 7 | H211: 9 | I211: =(G211*6)+H211 -> 51 | K211: 10 | L211: 11 | M211: =(K211*6)+L211 -> 71 | O211: 12 | P211: 14 | Q211: =(O211*6)+P211 -> 86 | S211: Venue: COBURG
A212: BOX HILL | C212: 0 | D212: 2 | E212: =(C212*6)+D212 -> 2 | G212: 3 | H212: 3 | I212: =(G212*6)+H212 -> 21 | K212: 6 | L212: 10 | M212: =(K212*6)+L212 -> 46 | O212: 8 | P212: 14 | Q212: =(O212*6)+P212 -> 62
A213: BEST PLAYERS
A214: COBURG | C214: O'CONNOR | F214: SHULZ | I214: FLETCHER | L214: DRAGICEVIC | O214: STEINFORT | R214: FOLEY
A215: BOX HILL | C215: ALLEWAY | F215: BATEMAN | I215: BAILEY | L215: TALLIS | O215: McGLYNN | R215: BRENNAN
A216: GOALKICKERS
A217: COBURG | C217: PETTIFER 4 | F217: CARLYLE | I217: FOLEY | K217: BLUMFIELD | N217: FLETCHER | Q217: DRAGICEVIC | T217: STEINFORT | X217: SHULZ | Z217: HILTON
A218: BOX HILL | C218: ALLEWAY 2 | F218: HARVEY | I218: HEIGHT | K218: NEAGLE | M218: PUGSLEY | O218: RIX | Q218: SHELTON
A220: PORT MELBOURNE | C220: 3 | D220: 1 | E220: =(C220*6)+D220 -> 19 | G220: 7 | H220: 5 | I220: =(G220*6)+H220 -> 47 | K220: 14 | L220: 10 | M220: =(K220*6)+L220 -> 94 | O220: 18 | P220: 16 | Q220: =(O220*6)+P220 -> 124 | S220: Venue: PORT MELBOURNE
A221: NORTHERN BULLANTS | C221: 6 | D221: 3 | E221: =(C221*6)+D221 -> 39 | G221: 7 | H221: 7 | I221: =(G221*6)+H221 -> 49 | K221: 8 | L221: 11 | M221: =(K221*6)+L221 -> 59 | O221: 8 | P221: 12 | Q221: =(O221*6)+P221 -> 60
A222: BEST PLAYERS
A223: PORT MELBOURNE | C223: J CLAYTON | F223: SCHWARZE | I223: OBST | L223: GIESCHEN | O223: ROBBINS | R223: JONES
A224: NORTHERN BULLANTS | C224: LIVINGSTON | F224: HARFORD | I224: HULME | L224: ZORZI | O224: WIGGINS | R224: SIMPSON
A225: GOALKICKERS
A226: PORT MELBOURNE | C226: HARVEY 4 | E226: ROCCA 3 | G226: PITT 2 | I226: J CLAYTON | L226: S CLAYTON | N226: COTCHETT | Q226: LAWRENCE | T226: ALEXANDER | W226: JONES | Y226: ALOI | AA226: RUDD | AC226: GIESCHEN
A227: NORTHERN BULLANTS | C227: ZORZI 2 | F227: FLEMING | I227: KENNA | K227: HULME | M227: HARFORD | O227: CARAZZO | Q227: BENTICK
A229: BYE | D229: GEELONG
A231: ROUND 5 | D231: 1ST MAY | J231: WEATHER
D232: 1ST QTR | H232: 2ND QTR | L232: 3RD QTR | P232: FINAL | S232: Venue: NORTH BALLARAT
A233: NORTH BALLARAT | C233: 2 | D233: 4 | E233: =(C233*6)+D233 -> 16 | G233: 5 | H233: 5 | I233: =(G233*6)+H233 -> 35 | K233: 11 | L233: 7 | M233: =(K233*6)+L233 -> 73 | O233: 12 | P233: 10 | Q233: =(O233*6)+P233 -> 82 | S233: UMPIRES | Z233: LADDER | AC233: ROUND | AE233: 5
A234: GEELONG | C234: 4 | D234: 5 | E234: =(C234*6)+D234 -> 29 | G234: 5 | H234: 8 | I234: =(G234*6)+H234 -> 38 | K234: 8 | L234: 12 | M234: =(K234*6)+L234 -> 60 | O234: 11 | P234: 13 | Q234: =(O234*6)+P234 -> 79
A235: BEST PLAYERS | W235: TEAM | X235: B | Y235: W | Z235: L | AA235: D | AB235: FOR | AC235: AGST | AD235: % | AE235: PTS
A236: NORTH BALLARAT | C236: FIELD | F236: ECCLES | I236: McCORKELL | L236: BYE | N236: McLEAN | Q236: GREIG
A237: GEELONG | C237: BARTEL | F237: CALLAN | I237: ROOKE | L237: SPRIGGS | N237: KOULOURIOTIS | W237: SANDRINGHAM | Y237: 4 | Z237: 1 | AA237: 0 | AB237: 549 | AC237: 362 | AD237: =(AB237/AC237)*100 -> 151.65745856353593 | AE237: =(Y237*4)+(AA237*2) -> 16
A238: GOALKICKERS | P238: McLEAN | W238: TASMANIA | Y238: 4 | Z238: 1 | AA238: 0 | AB238: 530 | AC238: 408 | AD238: =(AB238/AC238)*100 -> 129.90196078431373 | AE238: =(Y238*4)+(AA238*2) -> 16
A239: NORTH BALLARAT | C239: ECCLES 3 | E239: McCORKELL 2 | H239: BYE 2 | J239: TUCKEY | L239: HUTCHINSON | O239: FRITH | Q239: WHYMAN | W239: COBURG | Y239: 4 | Z239: 1 | AA239: 0 | AB239: 415 | AC239: 393 | AD239: =(AB239/AC239)*100 -> 105.59796437659033 | AE239: =(Y239*4)+(AA239*2) -> 16
A240: GEELONG | C240: THURLEY 3 | F240: ALLAN 2 | I240: S BYRNES 2 | L240: LONERGAN 2 | O240: McCARTHY 2 | W240: PORT MELBOURNE | X240: 1 | Y240: 3 | Z240: 1 | AA240: 0 | AB240: 432 | AC240: 318 | AD240: =(AB240/AC240)*100 -> 135.84905660377359 | AE240: =(Y240*4)+(AA240*2) -> 12
W241: WERRIBEE | X241: 1 | Y241: 3 | Z241: 1 | AA241: 0 | AB241: 355 | AC241: 305 | AD241: =(AB241/AC241)*100 -> 116.39344262295081 | AE241: =(Y241*4)+(AA241*2) -> 12
A242: COBURG | C242: 2 | D242: 2 | E242: =(C242*6)+D242 -> 14 | G242: 5 | H242: 2 | I242: =(G242*6)+H242 -> 32 | K242: 9 | L242: 5 | M242: =(K242*6)+L242 -> 59 | O242: 12 | P242: 8 | Q242: =(O242*6)+P242 -> 80 | S242: Venue: PRESTON | W242: NORTH BALLARAT | Y242: 3 | Z242: 2 | AA242: 0 | AB242: 443 | AC242: 432 | AD242: =(AB242/AC242)*100 -> 102.5462962962963 | AE242: =(Y242*4)+(AA242*2) -> 12
A243: NORTHERN BULLANTS | C243: 0 | D243: 6 | E243: =(C243*6)+D243 -> 6 | G243: 2 | H243: 10 | I243: =(G243*6)+H243 -> 22 | K243: 3 | L243: 11 | M243: =(K243*6)+L243 -> 29 | O243: 7 | P243: 16 | Q243: =(O243*6)+P243 -> 58 | W243: BENDIGO | X243: 1 | Y243: 2 | Z243: 2 | AA243: 0 | AB243: 431 | AC243: 361 | AD243: =(AB243/AC243)*100 -> 119.39058171745151 | AE243: =(Y243*4)+(AA243*2) -> 8
A244: BEST PLAYERS | W244: FRANKSTON | X244: 1 | Y244: 2 | Z244: 2 | AA244: 0 | AB244: 354 | AC244: 352 | AD244: =(AB244/AC244)*100 -> 100.56818181818181 | AE244: =(Y244*4)+(AA244*2) -> 8
A245: COBURG | C245: DRAGICEVIC | F245: ZANTUCK | I245: CARLSON | L245: PETTIFER | N245: TALBOT | Q245: MORRISON
A246: NORTHERN BULLANTS | C246: MOTT | F246: FISHER | I246: LIVINGSTON | L246: HULME | N246: FRANCHINA | Q246: BOYD | W246: WILLIAMSTOWN | X246: 1 | Y246: 2 | Z246: 2 | AA246: 0 | AB246: 326 | AC246: 387 | AD246: =(AB246/AC246)*100 -> 84.237726098191217 | AE246: =(Y246*4)+(AA246*2) -> 8
A247: GOALKICKERS | W247: NORTHERN BULLANTS | Y247: 1 | Z247: 4 | AA247: 0 | AB247: 356 | AC247: 489 | AD247: =(AB247/AC247)*100 -> 72.801635991820049 | AE247: =(Y247*4)+(AA247*2) -> 4
A248: COBURG | C248: ZANTUCK 6 | F248: PETTIFER 3 | I248: DRAGICEVIC | L248: O'CONNOR | N248: FOLEY | W248: GEELONG | X248: 1 | Y248: 1 | Z248: 3 | AA248: 0 | AB248: 293 | AC248: 422 | AD248: =(AB248/AC248)*100 -> 69.431279620853076 | AE248: =(Y248*4)+(AA248*2) -> 4
A249: NORTHERN BULLANTS | C249: FISHER 3 | F249: BENTICK 2 | I249: LIVINGSTON | L249: FRANCHINA | W249: BOX HILL | X249: 1 | Y249: 0 | Z249: 4 | AA249: 0 | AB249: 331 | AC249: 422 | AD249: =(AB249/AC249)*100 -> 78.436018957345979 | AE249: =(Y249*4)+(AA249*2) -> 0
D250: 2ND MAY | J250: WEATHER | W250: SPRINGVALE | Y250: 0 | Z250: 5 | AA250: 0 | AB250: 364 | AC250: 599 | AD250: =(AB250/AC250)*100 -> 60.767946577629381 | AE250: =(Y250*4)+(AA250*2) -> 0
A251: WERRIBEE | C251: 4 | D251: 5 | E251: =(C251*6)+D251 -> 29 | G251: 5 | H251: 11 | I251: =(G251*6)+H251 -> 41 | K251: 6 | L251: 13 | M251: =(K251*6)+L251 -> 49 | O251: 9 | P251: 16 | Q251: =(O251*6)+P251 -> 70 | S251: Venue: WERRIBEE
A252: PORT MELBOURNE | C252: 3 | D252: 3 | E252: =(C252*6)+D252 -> 21 | G252: 3 | H252: 4 | I252: =(G252*6)+H252 -> 22 | K252: 8 | L252: 8 | M252: =(K252*6)+L252 -> 56 | O252: 9 | P252: 10 | Q252: =(O252*6)+P252 -> 64
A253: BEST PLAYERS
A254: WERRIBEE | C254: MINSON | F254: CROSS | I254: SKIPPER | L254: McGUINNESS | O254: RAY | Q254: MITCHELL
A255: PORT MELBOURNE | C255: SCHWARZE | F255: WATSON | I255: URCH | L255: LAWRENCE | O255: TROTTER | Q255: BAIRD
A256: GOALKICKERS
A257: WERRIBEE | C257: SKIPPER 2 | F257: MITCHELL 2 | I257: CROSS | K257: HARGREAVE | N257: MORGAN | P257: RAY | Q257: SETCHELL
A258: PORT MELBOURNE | C258: ROCCA 3 | F258: RUDD 2 | I258: WATSON | K258: HARVEY | M258: McINTOSH | O258: HARDING
A260: SANDRINGHAM | C260: 1 | D260: 0 | E260: =(C260*6)+D260 -> 6 | G260: 5 | H260: 2 | I260: =(G260*6)+H260 -> 32 | K260: 14 | L260: 5 | M260: =(K260*6)+L260 -> 89 | O260: 17 | P260: 6 | Q260: =(O260*6)+P260 -> 108 | S260: Venue: BOX HILL
A261: BOX HILL | C261: 2 | D261: 5 | E261: =(C261*6)+D261 -> 17 | G261: 6 | H261: 6 | I261: =(G261*6)+H261 -> 42 | K261: 10 | L261: 6 | M261: =(K261*6)+L261 -> 66 | O261: 14 | P261: 8 | Q261: =(O261*6)+P261 -> 92
A262: BEST PLAYERS
A263: SANDRINGHAM | C263: WILLIAMS | F263: GALLAGHER | I263: SMITH | L263: O'KEEFE | O263: LAMB | Q263: FISHER
A264: BOX HILL | C264: GREENE | F264: BATEMAN | I264: BAILEY | L264: SEWELL | O264: NEAGLE | Q264: CAMPBELL
A265: GOALKICKERS
A266: SANDRINGHAM | C266: SMITH 4 | F266: VARDY 3 | I266: SYLVIA 3 | L266: GALLAGHER 2 | O266: FISHER 2 | R266: RIGONI | U266: McLEAN | X266: HUNTER
A267: BOX HILL | C267: TAYLOR 3 | F267: HARVEY 2 | I267: McGLYNN 2 | L267: SEWELL 2 | O267: ALLEWAY | Q267: BERGIN | S267: GREENE | V267: HEIGHT | X267: KANE
A269: FRANKSTON | C269: 4 | D269: 4 | E269: =(C269*6)+D269 -> 28 | G269: 7 | H269: 7 | I269: =(G269*6)+H269 -> 49 | K269: 9 | L269: 9 | M269: =(K269*6)+L269 -> 63 | O269: 16 | P269: 12 | Q269: =(O269*6)+P269 -> 108 | S269: Venue: SPRINGVALE
A270: SPRINGVALE | C270: 3 | D270: 4 | E270: =(C270*6)+D270 -> 22 | G270: 7 | H270: 7 | I270: =(G270*6)+H270 -> 49 | K270: 12 | L270: 9 | M270: =(K270*6)+L270 -> 81 | O270: 14 | P270: 9 | Q270: =(O270*6)+P270 -> 93
A271: BEST PLAYERS
A272: FRANKSTON | C272: BERRY | F272: FORTNAM | I272: FOLINO | L272: ANSTEY | N272: BRYAN | Q272: McCORMACK
A273: SPRINGVALE | C273: MURRAY | F273: ROUDA | I273: FERGUSON | L273: HARRISON | N273: R CLARKE
A274: GOALKICKERS
A275: FRANKSTON | C275: BERRY 7 | F275: FORTNAM 4 | I275: CLARKE 3 | L275: PHIBBS 2
A276: SPRINGVALE | C276: MURRAY 4 | F276: R CLARKE 3 | I276: FERGUSON 2 | L276: WALDRON | N276: S FISHER | Q276: HOULIHAN | U276: MOYLE | X276: MONTAGNA
A278: TASMANIA | C278: 6 | D278: 3 | E278: =(C278*6)+D278 -> 39 | G278: 9 | H278: 4 | I278: =(G278*6)+H278 -> 58 | K278: 11 | L278: 6 | M278: =(K278*6)+L278 -> 72 | O278: 14 | P278: 11 | Q278: =(O278*6)+P278 -> 95 | S278: Venue: NORTH HOBART OVAL
A279: BENDIGO | C279: 1 | D279: 1 | E279: =(C279*6)+D279 -> 7 | G279: 1 | H279: 4 | I279: =(G279*6)+H279 -> 10 | K279: 6 | L279: 5 | M279: =(K279*6)+L279 -> 41 | O279: 9 | P279: 7 | Q279: =(O279*6)+P279 -> 61
A280: BEST PLAYERS
A281: TASMANIA | C281: ROBINSON | F281: ATKIN | I281: B GEAPPEN | L281: PLAPP | N281: HALL | Q281: VINEY
A282: BENDIGO | C282: CAMPBELL | F282: WATSON | I282: CARTER | L282: WILSON
A283: GOALKICKERS
A284: TASMANIA | C284: BEAMS 4 | F284: PLAPP 4 | I284: CARELESS | K284: B GEAPPEN | N284: ROBINSON | Q284: HALL | R284: VINEY | U284: WAGER
A285: BENDIGO | C285: HAWKINS 3 | F285: CUPIDO 2 | I285: BRADLEY | K285: WINDERLICH | N285: WATSON | P285: ALVEY
A287: BYE | D287: WILLIAMSTOWN
A289: ROUND 6 | D289: 8TH MAY | J289: WEATHER
D290: 1ST QTR | H290: 2ND QTR | L290: 3RD QTR | P290: FINAL | S290: Venue: NORTH BALLARAT
A291: NORTH BALLARAT | C291: 5 | D291: 4 | E291: =(C291*6)+D291 -> 34 | G291: 9 | H291: 5 | I291: =(G291*6)+H291 -> 59 | K291: 16 | L291: 6 | M291: =(K291*6)+L291 -> 102 | O291: 20 | P291: 8 | Q291: =(O291*6)+P291 -> 128 | S291: UMPIRES | Z291: LADDER | AC291: ROUND | AE291: 6
A292: BOX HILL | C292: 2 | D292: 0 | E292: =(C292*6)+D292 -> 12 | G292: 5 | H292: 4 | I292: =(G292*6)+H292 -> 34 | K292: 7 | L292: 6 | M292: =(K292*6)+L292 -> 48 | O292: 9 | P292: 10 | Q292: =(O292*6)+P292 -> 64
A293: BEST PLAYERS | W293: TEAM | X293: B | Y293: W | Z293: L | AA293: D | AB293: FOR | AC293: AGST | AD293: % | AE293: PTS
A294: NORTH BALLARAT | C294: HUTCHINSON | F294: ECCLES | I294: FIELD | L294: MOLONEY | N294: TUCKEY | Q294: WHYMAN
A295: BOX HILL | C295: BRENNAN | F295: NEAGLE | I295: LADSON | W295: SANDRINGHAM | Y295: 5 | Z295: 1 | AA295: 0 | AB295: 651 | AC295: 416 | AD295: =(AB295/AC295)*100 -> 156.49038461538461 | AE295: =(Y295*4)+(AA295*2) -> 20
A296: GOALKICKERS | M296: McMAHON | O296: GREIG | Q296: McCORKELL | W296: PORT MELBOURNE | X296: 1 | Y296: 4 | Z296: 1 | AA296: 0 | AB296: 541 | AC296: 378 | AD296: =(AB296/AC296)*100 -> 143.12169312169311 | AE296: =(Y296*4)+(AA296*2) -> 16
A297: NORTH BALLARAT | C297: HUTCHINSON 5 | F297: WHYMAN 3 | I297: PLUNKETT 3 | L297: JURICA 3 | N297: TUCKEY 2 | Q297: DINNELL | W297: TASMANIA | X297: 1 | Y297: 4 | Z297: 1 | AA297: 0 | AB297: 530 | AC297: 408 | AD297: =(AB297/AC297)*100 -> 129.90196078431373 | AE297: =(Y297*4)+(AA297*2) -> 16
A298: BOX HILL | C298: B KANE 4 | F298: ALLEWAY | I298: CLARKE | K298: GREENE | M298: LADSON | O298: PICIAONE | W298: WERRIBEE | X298: 1 | Y298: 4 | Z298: 1 | AA298: 0 | AB298: 470 | AC298: 372 | AD298: =(AB298/AC298)*100 -> 126.34408602150538 | AE298: =(Y298*4)+(AA298*2) -> 16
W299: NORTH BALLARAT | Y299: 4 | Z299: 2 | AA299: 0 | AB299: 571 | AC299: 496 | AD299: =(AB299/AC299)*100 -> 115.12096774193547 | AE299: =(Y299*4)+(AA299*2) -> 16
A300: GEELONG | C300: 3 | D300: 3 | E300: =(C300*6)+D300 -> 21 | G300: 4 | H300: 8 | I300: =(G300*6)+H300 -> 32 | K300: 6 | L300: 14 | M300: =(K300*6)+L300 -> 50 | O300: 12 | P300: 15 | Q300: =(O300*6)+P300 -> 87 | S300: Venue: SHELL STADIUM | W300: COBURG | X300: 1 | Y300: 4 | Z300: 1 | AA300: 0 | AB300: 415 | AC300: 393 | AD300: =(AB300/AC300)*100 -> 105.59796437659033 | AE300: =(Y300*4)+(AA300*2) -> 16
A301: FRANKSTON | C301: 2 | D301: 1 | E301: =(C301*6)+D301 -> 13 | G301: 2 | H301: 3 | I301: =(G301*6)+H301 -> 15 | K301: 4 | L301: 5 | M301: =(K301*6)+L301 -> 29 | O301: 8 | P301: 8 | Q301: =(O301*6)+P301 -> 56 | W301: BENDIGO | X301: 1 | Y301: 2 | Z301: 3 | AA301: 0 | AB301: 498 | AC301: 476 | AD301: =(AB301/AC301)*100 -> 104.6218487394958 | AE301: =(Y301*4)+(AA301*2) -> 8
A302: BEST PLAYERS | W302: FRANKSTON | X302: 1 | Y302: 2 | Z302: 3 | AA302: 0 | AB302: 410 | AC302: 439 | AD302: =(AB302/AC302)*100 -> 93.394077448747154 | AE302: =(Y302*4)+(AA302*2) -> 8
A303: GEELONG | C303: CALLAN | F303: J BYRNE | I303: LONERGAN | L303: ROOKE | N303: S BYRNES | Q303: D BYRNE
A304: FRANKSTON | C304: FORTNAM | F304: ROBERTS | I304: MURPHY | L304: ABLETT | N304: GODDARD | Q304: FOLINO | W304: GEELONG | X304: 1 | Y304: 2 | Z304: 3 | AA304: 0 | AB304: 380 | AC304: 478 | AD304: =(AB304/AC304)*100 -> 79.497907949790786 | AE304: =(Y304*4)+(AA304*2) -> 8
A305: GOALKICKERS | P305: LONERGAN | W305: WILLIAMSTOWN | X305: 1 | Y305: 2 | Z305: 3 | AA305: 0 | AB305: 386 | AC305: 496 | AD305: =(AB305/AC305)*100 -> 77.822580645161281 | AE305: =(Y305*4)+(AA305*2) -> 8
A306: GEELONG | C306: McCARTHY 3 | F306: J BYRNE 2 | I306: S BYRNES 2 | L306: COOK | N306: S JOHNSON | Q306: FOSTER | S306: LOATS | W306: NORTHERN BULLANTS | Y306: 1 | Z306: 5 | AA306: 0 | AB306: 410 | AC306: 591 | AD306: =(AB306/AC306)*100 -> 69.373942470389167 | AE306: =(Y306*4)+(AA306*2) -> 4
A307: FRANKSTON | C307: BERRY 3 | F307: PHIBBS 2 | I307: LITTLECHILD 2 | M307: BROWN | W307: BOX HILL | X307: 1 | Y307: 0 | Z307: 5 | AA307: 0 | AB307: 395 | AC307: 550 | AD307: =(AB307/AC307)*100 -> 71.818181818181813 | AE307: =(Y307*4)+(AA307*2) -> 0
D308: 9TH MAY | J308: WEATHER | W308: SPRINGVALE | X308: 1 | Y308: 0 | Z308: 5 | AA308: 0 | AB308: 364 | AC308: 599 | AD308: =(AB308/AC308)*100 -> 60.767946577629381 | AE308: =(Y308*4)+(AA308*2) -> 0
A309: SANDRINGHAM | C309: 4 | D309: 1 | E309: =(C309*6)+D309 -> 25 | G309: 6 | H309: 5 | I309: =(G309*6)+H309 -> 41 | K309: 10 | L309: 9 | M309: =(K309*6)+L309 -> 69 | O309: 15 | P309: 12 | Q309: =(O309*6)+P309 -> 102 | S309: Venue: BEACH ROAD
A310: NORTHERN BULLANTS | C310: 2 | D310: 5 | E310: =(C310*6)+D310 -> 17 | G310: 3 | H310: 8 | I310: =(G310*6)+H310 -> 26 | K310: 6 | L310: 9 | M310: =(K310*6)+L310 -> 45 | O310: 7 | P310: 12 | Q310: =(O310*6)+P310 -> 54
A311: BEST PLAYERS
A312: SANDRINGHAM | C312: SYLVIA | F312: O'KEEFE | I312: WILLIAMS | L312: FISHER | O312: JOHNSON | R312: BROADBRIDGE
A313: NORTHERN BULLANTS | C313: HARFORD | F313: McCORMICK | I313: ZORZI | L313: McGRATH | O313: KENNA | R313: BEASY
A314: GOALKICKERS
A315: SANDRINGHAM | C315: SYLVIA 5 | F315: SAUTNER 3 | I315: FISHER 2 | L315: VARDY 2 | N315: MILLS | P315: JOHNSON | R315: RIGONI
A316: NORTHERN BULLANTS | C316: McGRATH 2 | F316: FISHER 2 | I316: HARFORD | K316: McCORMICK | N316: KENNA
A318: WERRIBEE | C318: 3 | D318: 4 | E318: =(C318*6)+D318 -> 22 | G318: 6 | H318: 7 | I318: =(G318*6)+H318 -> 43 | K318: 11 | L318: 10 | M318: =(K318*6)+L318 -> 76 | O318: 17 | P318: 13 | Q318: =(O318*6)+P318 -> 115 | S318: Venue: WERRIBEE
A319: BENDIGO | C319: 5 | D319: 0 | E319: =(C319*6)+D319 -> 30 | G319: 7 | H319: 1 | I319: =(G319*6)+H319 -> 43 | K319: 9 | L319: 5 | M319: =(K319*6)+L319 -> 59 | O319: 10 | P319: 7 | Q319: =(O319*6)+P319 -> 67
A320: BEST PLAYERS
A321: WERRIBEE | C321: HARGRAVE | F321: SKIPPER | I321: RAU | L321: GARLICK | O321: McMAHON | R321: KRETIUK
A322: BENDIGO | C322: WILSON | F322: RICHARDS | I322: McVEIGH
A323: GOALKICKERS
A324: WERRIBEE | C324: HARGRAVE 5 | F324: GARLICK 3 | I324: CONDOS 2 | L324: MORGAN 2 | N324: SKIPPER | P324: McMAHON | R324: MITCHELL | V324: PODSIADLY | X324: WALSH
A325: BENDIGO | C325: BRADLEY 2 | F325: HAWKINS 2 | I325: STANTON | K325: ALVEY | M325: McVEIGH | O325: WINDERLICH | R325: LOVETT | V325: CARTLEDGE
A327: PORT MELBOURNE | C327: 4 | D327: 2 | E327: =(C327*6)+D327 -> 26 | G327: 9 | H327: 5 | I327: =(G327*6)+H327 -> 59 | K327: 13 | L327: 10 | M327: =(K327*6)+L327 -> 88 | O327: 16 | P327: 13 | Q327: =(O327*6)+P327 -> 109 | S327: Venue: PORT MELBOURNE
A328: WILLIAMSTOWN | C328: 3 | D328: 3 | E328: =(C328*6)+D328 -> 21 | G328: 4 | H328: 3 | I328: =(G328*6)+H328 -> 27 | K328: 7 | L328: 5 | M328: =(K328*6)+L328 -> 47 | O328: 9 | P328: 6 | Q328: =(O328*6)+P328 -> 60
A329: BEST PLAYERS
A330: PORT MELBOURNE | C330: GIESCHEN | F330: WATSON | I330: OBST | K330: ROBBINS | N330: URCH | Q330: BAIRD
A331: WILLIAMSTOWN | C331: NIXON | F331: THEODORE | I331: WEST | K331: JARRAD
A332: GOALKICKERS
A333: PORT MELBOURNE | C333: PITT 3 | E333: HARVEY 3 | H333: WATSON 2 | J333: COTCHETT 2 | M333: GIESCHEN 2 | P333: McINTOSH | R333: ROCCA | U333: SCHWARZE | X333: OBST
A334: WILLIAMSTOWN | C334: WILLIAMS 3 | F334: MORRISON 2 | I334: CRANAGE | K334: LOCKYER | M334: MULLINS | O334: SHEEHAN
A336: BYE | D336: COBURG | G336: SPRINGVALE | K336: TASMANIA
A338: ROUND 7 | D338: 15TH MAY | J338: WEATHER
D339: 1ST QTR | H339: 2ND QTR | L339: 3RD QTR | P339: FINAL | S339: Venue: PORT MELBOURNE
A340: PORT MELBOURNE | C340: 4 | D340: 3 | E340: =(C340*6)+D340 -> 27 | G340: 7 | H340: 9 | I340: =(G340*6)+H340 -> 51 | K340: 13 | L340: 10 | M340: =(K340*6)+L340 -> 88 | O340: 15 | P340: 13 | Q340: =(O340*6)+P340 -> 103 | S340: UMPIRES | Z340: LADDER | AC340: ROUND | AE340: 7
A341: BENDIGO | C341: 5 | D341: 0 | E341: =(C341*6)+D341 -> 30 | G341: 9 | H341: 3 | I341: =(G341*6)+H341 -> 57 | K341: 12 | L341: 5 | M341: =(K341*6)+L341 -> 77 | O341: 14 | P341: 13 | Q341: =(O341*6)+P341 -> 97
A342: BEST PLAYERS | W342: TEAM | X342: B | Y342: W | Z342: L | AA342: D | AB342: FOR | AC342: AGST | AD342: % | AE342: PTS
A343: PORT MELBOURNE | C343: McINTOSH | F343: ROBBINS | I343: WATSON | L343: GILL | O343: OBST | R343: URCH
A344: BENDIGO | C344: CARTER | F344: DOERING | I344: MOORCROFT | L344: WINDERLICH | O344: WILSON | R344: HUNT | W344: SANDRINGHAM | Y344: 5 | Z344: 2 | AA344: 0 | AB344: 710 | AC344: 504 | AD344: =(AB344/AC344)*100 -> 140.87301587301587 | AE344: =(Y344*4)+(AA344*2) -> 20
A345: GOALKICKERS | H345: LAWRENCE | J345: SCHWARZE | M345: COTCHETT | O345: TROTTER | Q345: J CLAYTON | W345: PORT MELBOURNE | X345: 1 | Y345: 5 | Z345: 1 | AA345: 0 | AB345: 644 | AC345: 475 | AD345: =(AB345/AC345)*100 -> 135.57894736842104 | AE345: =(Y345*4)+(AA345*2) -> 20
A346: PORT MELBOURNE | C346: S CLAYTON 2 | F346: McINTOSH 2 | I346: JONES | K346: OBST | M346: GILL | N346: BAIRD | P346: HARVEY | R346: SHORE | W346: WERRIBEE | X346: 1 | Y346: 5 | Z346: 1 | AA346: 0 | AB346: 585 | AC346: 439 | AD346: =(AB346/AC346)*100 -> 133.25740318906605 | AE346: =(Y346*4)+(AA346*2) -> 20
A347: BENDIGO | C347: BRADLEY 3 | F347: WALSH 2 | I347: RICHARDS 2 | L347: HUNT | N347: CARTLEDGE | Q347: NASH | S347: WATSON | W347: TASMANIA | X347: 1 | Y347: 5 | Z347: 1 | AA347: 0 | AB347: 620 | AC347: 469 | AD347: =(AB347/AC347)*100 -> 132.19616204690831 | AE347: =(Y347*4)+(AA347*2) -> 20
D348: 16TH MAY | J348: WEATHER | M348: MOORCROFT | P348: DOERING | R348: WINDERLICH | W348: NORTH BALLARAT | X348: 1 | Y348: 4 | Z348: 2 | AA348: 0 | AB348: 571 | AC348: 496 | AD348: =(AB348/AC348)*100 -> 115.12096774193547 | AE348: =(Y348*4)+(AA348*2) -> 16
A349: GEELONG | C349: 0 | D349: 5 | E349: =(C349*6)+D349 -> 5 | G349: 4 | H349: 10 | I349: =(G349*6)+H349 -> 34 | K349: 8 | L349: 12 | M349: =(K349*6)+L349 -> 60 | O349: 12 | P349: 16 | Q349: =(O349*6)+P349 -> 88 | S349: Venue: SHELL STADIUM (C/R) | W349: COBURG | X349: 1 | Y349: 4 | Z349: 2 | AA349: 0 | AB349: 482 | AC349: 508 | AD349: =(AB349/AC349)*100 -> 94.881889763779526 | AE349: =(Y349*4)+(AA349*2) -> 16
A350: SANDRINGHAM | C350: 1 | D350: 1 | E350: =(C350*6)+D350 -> 7 | G350: 5 | H350: 2 | I350: =(G350*6)+H350 -> 32 | K350: 5 | L350: 3 | M350: =(K350*6)+L350 -> 33 | O350: 9 | P350: 5 | Q350: =(O350*6)+P350 -> 59 | W350: GEELONG | X350: 1 | Y350: 3 | Z350: 3 | AA350: 0 | AB350: 468 | AC350: 537 | AD350: =(AB350/AC350)*100 -> 87.150837988826808 | AE350: =(Y350*4)+(AA350*2) -> 12
A351: BEST PLAYERS | W351: WILLIAMSTOWN | X351: 1 | Y351: 3 | Z351: 3 | AA351: 0 | AB351: 509 | AC351: 607 | AD351: =(AB351/AC351)*100 -> 83.855024711696871 | AE351: =(Y351*4)+(AA351*2) -> 12
A352: GEELONG | C352: ENRIGHT | F352: BARTEL | I352: FOSTER | L352: EGAN | O352: S JOHNSON | R352: SPRIGGS
A353: SANDRINGHAM | C353: BELL | F353: FISHER | I353: RIGONI | L353: WALSH | O353: SYLVIA | R353: CROWE | W353: BENDIGO | X353: 1 | Y353: 2 | Z353: 4 | AA353: 0 | AB353: 595 | AC353: 579 | AD353: =(AB353/AC353)*100 -> 102.76338514680484 | AE353: =(Y353*4)+(AA353*2) -> 8
A354: GOALKICKERS | W354: FRANKSTON | X354: 1 | Y354: 2 | Z354: 4 | AA354: 0 | AB354: 471 | AC354: 529 | AD354: =(AB354/AC354)*100 -> 89.03591682419659 | AE354: =(Y354*4)+(AA354*2) -> 8
A355: GEELONG | C355: FOSTER 4 | F355: S JOHNSON 2 | J355: COOK 2 | M355: BARTEL | O355: J BYRNE | Q355: GREAVES | S355: MCCARTHY | W355: NORTHERN BULLANTS | Y355: 1 | Z355: 6 | AA355: 0 | AB355: 521 | AC355: 714 | AD355: =(AB355/AC355)*100 -> 72.969187675070017 | AE355: =(Y355*4)+(AA355*2) -> 4
A356: SANDRINGHAM | C356: SYLVIA 2 | F356: GALLAGHER 2 | J356: RIGONI | L356: WALSH | N356: SMITH | P356: SAUTNER | R356: VARDY | W356: SPRINGVALE | X356: 1 | Y356: 1 | Z356: 5 | AA356: 0 | AB356: 467 | AC356: 698 | AD356: =(AB356/AC356)*100 -> 66.905444126074499 | AE356: =(Y356*4)+(AA356*2) -> 4
W357: BOX HILL | X357: 1 | Y357: 0 | Z357: 6 | AA357: 0 | AB357: 494 | AC357: 653 | AD357: =(AB357/AC357)*100 -> 75.650842266462476 | AE357: =(Y357*4)+(AA357*2) -> 0
A358: WERRIBEE | C358: 8 | D358: 3 | E358: =(C358*6)+D358 -> 51 | G358: 11 | H358: 8 | I358: =(G358*6)+H358 -> 74 | K358: 14 | L358: 15 | M358: =(K358*6)+L358 -> 99 | O358: 16 | P358: 19 | Q358: =(O358*6)+P358 -> 115 | S358: Venue: WERRIBEE
A359: COBURG | C359: 0 | D359: 1 | E359: =(C359*6)+D359 -> 1 | G359: 3 | H359: 4 | I359: =(G359*6)+H359 -> 22 | K359: 5 | L359: 7 | M359: =(K359*6)+L359 -> 37 | O359: 10 | P359: 7 | Q359: =(O359*6)+P359 -> 67
A360: BEST PLAYERS
A361: WERRIBEE | C361: KOOPS | F361: MORGAN | I361: MORRIS | L361: GARLICK | O361: POWER | R361: McMAHON
A362: COBURG | C362: KURET | F362: DRAGICEVIC | I362: JORGENSEN | L362: FOLEY | O362: RAINES | R362: PETTIFER
A363: GOALKICKERS
A364: WERRIBEE | C364: MITCHELL 4 | F364: CROSS 2 | I364: POWER 2 | K364: GARLICK | M364: MINSON | O364: MORGAN | Q364: MURPHY | S364: RAY | U364: WALSH | X364: SKIPPER | AA364: WIGGINS
A365: COBURG | C365: MOORE 2 | F365: JORGENSEN | I365: DRAGICEVIC | L365: FOLEY | N365: O'CONNOR | Q365: McDONALD | T365: PETTIFER | W365: KURET | X365: MAGEE
A367: SPRINGVALE | C367: 2 | D367: 5 | E367: =(C367*6)+D367 -> 17 | G367: 5 | H367: 10 | I367: =(G367*6)+H367 -> 40 | K367: 10 | L367: 12 | M367: =(K367*6)+L367 -> 72 | O367: 15 | P367: 13 | Q367: =(O367*6)+P367 -> 103 | S367: Venue: SPRINGVALE
A368: BOX HILL | C368: 1 | D368: 2 | E368: =(C368*6)+D368 -> 8 | G368: 7 | H368: 10 | I368: =(G368*6)+H368 -> 52 | K368: 11 | L368: 12 | M368: =(K368*6)+L368 -> 78 | O368: 14 | P368: 15 | Q368: =(O368*6)+P368 -> 99
A369: BEST PLAYERS
A370: SPRINGVALE | C370: HARRISON | F370: MURRAY | I370: CLARKE | L370: MONTAGNA | O370: STONE
A371: BOX HILL | C371: HEIGHT | F371: TAYLOR | I371: CLIFTON | L371: BAILEY | O371: SCOTT | R371: SEWELL
A372: GOALKICKERS
A373: SPRINGVALE | C373: MURRAY 5 | F373: WULF 2 | H373: MONTAGNA 2 | K373: CLARKE | M373: BROOKS | O373: FERGUSON | Q373: HARRISON | T373: HEENAN | W373: CAPLES
A374: BOX HILL | C374: ALLEWAY 4 | F374: HEIGHT 3 | I374: HARVEY 2 | L374: TAYLOR 2 | O374: GREENE | Q374: SHELTON | S374: HOLLAND
A376: WILLIAMSTOWN | C376: 6 | D376: 4 | E376: =(C376*6)+D376 -> 40 | G376: 12 | H376: 4 | I376: =(G376*6)+H376 -> 76 | K376: 15 | L376: 8 | M376: =(K376*6)+L376 -> 98 | O376: 19 | P376: 9 | Q376: =(O376*6)+P376 -> 123 | S376: Venue: WILLIAMSTOWN
A377: NORTHERN BULLANTS | C377: 4 | D377: 2 | E377: =(C377*6)+D377 -> 26 | G377: 8 | H377: 5 | I377: =(G377*6)+H377 -> 53 | K377: 16 | L377: 7 | M377: =(K377*6)+L377 -> 103 | O377: 17 | P377: 9 | Q377: =(O377*6)+P377 -> 111
A378: BEST PLAYERS
A379: WILLIAMSTOWN | C379: LLOYD | F379: C CLOKE | I379: CRANAGE | L379: R SHAW | O379: WEST | Q379: KNIGHT
A380: NORTHERN BULLANTS | C380: O'HAILPIN | F380: ZORZI | I380: CLARKE | L380: MOTT | O380: SIMPSON | Q380: CARRAZZO
A381: GOALKICKERS
A382: WILLIAMSTOWN | C382: KNIGHT 5 | F382: ROWE 3 | H382: LAWRY 2 | J382: SHEEHAN 2 | M382: LLOYD 2 | O382: H SHAW 2 | R382: JARRAD | U382: MORRISON | X382: THEODORE
A383: NORTHERN BULLANTS | C383: O'HAILPIN 7 | F383: BEASY 2 | I383: FRANCHINA 2 | L383: BENTICK | N383: CLARKE | P383: GUTTERSON | S383: McGRATH | X383: PLEMING | AA383: SIMPSON
A385: TASMANIA | C385: 0 | D385: 1 | E385: =(C385*6)+D385 -> 1 | G385: 3 | H385: 9 | I385: =(G385*6)+H385 -> 27 | K385: 9 | L385: 9 | M385: =(K385*6)+L385 -> 63 | O385: 13 | P385: 12 | Q385: =(O385*6)+P385 -> 90 | S385: Venue: FRANKSTON
A386: FRANKSTON | C386: 3 | D386: 4 | E386: =(C386*6)+D386 -> 22 | G386: 4 | H386: 5 | I386: =(G386*6)+H386 -> 29 | K386: 5 | L386: 10 | M386: =(K386*6)+L386 -> 40 | O386: 8 | P386: 13 | Q386: =(O386*6)+P386 -> 61
A387: BEST PLAYERS
A388: TASMANIA | C388: ATKIN | F388: JOVANOVIC | I388: ROBINSON | L388: BEAMS | O388: WALKER | Q388: HOWARD
A389: FRANKSTON | C389: ABLETT | F389: ROBERTS | I389: LITTLECHILD | L389: ROBINON | O389: MURPHY
A390: GOALKICKERS
A391: TASMANIA | C391: ROBINSON 3 | F391: PLAPP 2 | I391: DRURY 2 | K391: ATKIN | M391: CALLINAN | O391: GEAPPEN | Q391: BARTLETT | T391: BEAMS | W391: VINEY
A392: FRANKSTON | C392: McCORMACK 3 | F392: LITTLECHILD 2 | J392: BEASY | L392: BERRY | N392: PHIBBS
A394: BYE | D394: NORTH BALLARAT
A396: ROUND 8 | D396: 22ND MAY | J396: WEATHER
D397: 1ST QTR | H397: 2ND QTR | L397: 3RD QTR | P397: FINAL | S397: Venue: SPRINGVALE
A398: NORTH BALLARAT | C398: 5 | D398: 1 | E398: =(C398*6)+D398 -> 31 | G398: 9 | H398: 4 | I398: =(G398*6)+H398 -> 58 | K398: 14 | L398: 5 | M398: =(K398*6)+L398 -> 89 | O398: 18 | P398: 9 | Q398: =(O398*6)+P398 -> 117 | S398: UMPIRES | Z398: LADDER | AC398: ROUND | AE398: 8
A399: SPRINGVALE | C399: 5 | D399: 3 | E399: =(C399*6)+D399 -> 33 | G399: 7 | H399: 6 | I399: =(G399*6)+H399 -> 48 | K399: 8 | L399: 14 | M399: =(K399*6)+L399 -> 62 | O399: 11 | P399: 19 | Q399: =(O399*6)+P399 -> 85
A400: BEST PLAYERS | W400: TEAM | X400: B | Y400: W | Z400: L | AA400: D | AB400: FOR | AC400: AGST | AD400: % | AE400: PTS
A401: NORTH BALLARAT | C401: ECCLES | F401: SAUNDERS | I401: MOLONEY | L401: FIELD | N401: PLUNKETT | Q401: GREIG
A402: SPRINGVALE | C402: HARRISON | F402: MONTAGNA | I402: STONE | L402: CARROLL | N402: WALDRON | Q402: HEENAN | W402: SANDRINGHAM | Y402: 6 | Z402: 2 | AA402: 0 | AB402: 813 | AC402: 598 | AD402: =(AB402/AC402)*100 -> 135.95317725752508 | AE402: =(Y402*4)+(AA402*2) -> 24
A403: GOALKICKERS | W403: PORT MELBOURNE | X403: 1 | Y403: 6 | Z403: 1 | AA403: 0 | AB403: 750 | AC403: 555 | AD403: =(AB403/AC403)*100 -> 135.13513513513513 | AE403: =(Y403*4)+(AA403*2) -> 24
A404: NORTH BALLARAT | C404: SAUNDERS 6 | F404: TUCKEY 3 | I404: HUTCHINSON 2 | M404: PLUNKETT 2 | P404: BYE | Q404: DINNELL | W404: WERRIBEE | X404: 1 | Y404: 5 | Z404: 2 | AA404: 0 | AB404: 675 | AC404: 546 | AD404: =(AB404/AC404)*100 -> 123.62637362637363 | AE404: =(Y404*4)+(AA404*2) -> 20
A405: SPRINGVALE | C405: HOULIHAN 4 | F405: WULF 2 | I405: HARRISON | K405: BRUIN | M405: MURRAY | O405: MOYLE | Q405: FERGUSON | W405: TASMANIA | X405: 1 | Y405: 5 | Z405: 2 | AA405: 0 | AB405: 700 | AC405: 575 | AD405: =(AB405/AC405)*100 -> 121.73913043478262 | AE405: =(Y405*4)+(AA405*2) -> 20
W406: NORTH BALLARAT | X406: 1 | Y406: 5 | Z406: 2 | AA406: 0 | AB406: 688 | AC406: 581 | AD406: =(AB406/AC406)*100 -> 118.41652323580034 | AE406: =(Y406*4)+(AA406*2) -> 20
A407: BOX HILL | C407: 4 | D407: 0 | E407: =(C407*6)+D407 -> 24 | G407: 8 | H407: 4 | I407: =(G407*6)+H407 -> 52 | K407: 8 | L407: 8 | M407: =(K407*6)+L407 -> 56 | O407: 16 | P407: 11 | Q407: =(O407*6)+P407 -> 107 | S407: Venue: BOX HILL | W407: GEELONG | X407: 1 | Y407: 4 | Z407: 3 | AA407: 0 | AB407: 585 | AC407: 602 | AD407: =(AB407/AC407)*100 -> 97.176079734219272 | AE407: =(Y407*4)+(AA407*2) -> 16
A408: WERRIBEE | C408: 3 | D408: 6 | E408: =(C408*6)+D408 -> 24 | G408: 4 | H408: 8 | I408: =(G408*6)+H408 -> 32 | K408: 10 | L408: 12 | M408: =(K408*6)+L408 -> 72 | O408: 13 | P408: 12 | Q408: =(O408*6)+P408 -> 90 | W408: COBURG | X408: 1 | Y408: 4 | Z408: 3 | AA408: 0 | AB408: 582 | AC408: 627 | AD408: =(AB408/AC408)*100 -> 92.822966507177028 | AE408: =(Y408*4)+(AA408*2) -> 16
A409: BEST PLAYERS | W409: BENDIGO | X409: 1 | Y409: 3 | Z409: 4 | AA409: 0 | AB409: 714 | AC409: 679 | AD409: =(AB409/AC409)*100 -> 105.15463917525774 | AE409: =(Y409*4)+(AA409*2) -> 12
A410: BOX HILL | C410: HOLLAND | F410: HEIGHT | I410: PICIAONE | L410: CLARKE | N410: GREENE | Q410: ALLEWAY
A411: WERRIBEE | C411: CROSS | F411: KRETIUK | I411: CROFT | L411: MCGUINNESS | O411: RAU | W411: WILLIAMSTOWN | X411: 1 | Y411: 3 | Z411: 4 | AA411: 0 | AB411: 574 | AC411: 724 | AD411: =(AB411/AC411)*100 -> 79.281767955801115 | AE411: =(Y411*4)+(AA411*2) -> 12
A412: GOALKICKERS | W412: FRANKSTON | X412: 1 | Y412: 2 | Z412: 5 | AA412: 0 | AB412: 565 | AC412: 632 | AD412: =(AB412/AC412)*100 -> 89.398734177215189 | AE412: =(Y412*4)+(AA412*2) -> 8
A413: BOX HILL | C413: HOLLAND 5 | F413: ALLEWAY 3 | I413: HEIGHT 3 | L413: THOMPSON 3 | O413: CLARKE | Q413: HARVEY | W413: BOX HILL | X413: 1 | Y413: 1 | Z413: 6 | AA413: 0 | AB413: 601 | AC413: 743 | AD413: =(AB413/AC413)*100 -> 80.888290713324366 | AE413: =(Y413*4)+(AA413*2) -> 4
A414: WERRIBEE | C414: MURPHY 2 | E414: MITCHELL 2 | H414: CROSS | J414: COONEY | L414: RAY | M414: WIGHT | O414: GELINGS | Q414: POWER | S414: SETCHELL | W414: NORTHERN BULLANTS | X414: 1 | Y414: 1 | Z414: 6 | AA414: 0 | AB414: 521 | AC414: 714 | AD414: =(AB414/AC414)*100 -> 72.969187675070017 | AE414: =(Y414*4)+(AA414*2) -> 4
N415: WALSH | P415: WIGGINS | W415: SPRINGVALE | X415: 1 | Y415: 1 | Z415: 6 | AA415: 0 | AB415: 552 | AC415: 815 | AD415: =(AB415/AC415)*100 -> 67.730061349693244 | AE415: =(Y415*4)+(AA415*2) -> 4
A416: PORT MELBOURNE | C416: 2 | D416: 4 | E416: =(C416*6)+D416 -> 16 | G416: 7 | H416: 5 | I416: =(G416*6)+H416 -> 47 | K416: 9 | L416: 8 | M416: =(K416*6)+L416 -> 62 | O416: 16 | P416: 10 | Q416: =(O416*6)+P416 -> 106 | S416: Venue: NORTH HOBART OVAL
A417: TASMANIA | C417: 4 | D417: 4 | E417: =(C417*6)+D417 -> 28 | G417: 8 | H417: 7 | I417: =(G417*6)+H417 -> 55 | K417: 10 | L417: 10 | M417: =(K417*6)+L417 -> 70 | O417: 11 | P417: 14 | Q417: =(O417*6)+P417 -> 80
A418: BEST PLAYERS
A419: PORT MELBOURNE | C419: LAWRENCE | F419: MCMAHON | I419: J CLAYTON | L419: OBST | N419: S CLAYTON | Q419: ROBBINS
A420: TASMANIA | C420: CARELESS | F420: ROBINSON | I420: DRURY | L420: HALL | N420: WAGER | Q420: WALKER
A421: GOALKICKERS | Q421: GILL | S421: WATSON
A422: PORT MELBOURNE | C422: LAWRENCE 3 | F422: JONES 2 | H422: STEVENS 2 | J422: J CLAYTON 2 | M422: McINTOSH 2 | P422: ROBBINS | R422: SHORE | U422: MCMAHON
A423: TASMANIA | C423: PLAPP 3 | F423: DRURY 3 | I423: ATKIN | K423: M GEAPPEN | N423: DUTTON | P423: HALL | R423: VINEY
D424: 23RD MAY | J424: WEATHER
A425: GEELONG | C425: 5 | D425: 3 | E425: =(C425*6)+D425 -> 33 | G425: 7 | H425: 6 | I425: =(G425*6)+H425 -> 48 | K425: 13 | L425: 11 | M425: =(K425*6)+L425 -> 89 | O425: 17 | P425: 15 | Q425: =(O425*6)+P425 -> 117 | S425: Venue: WILLIAMSTOWN
A426: WILLIAMSTOWN | C426: 3 | D426: 1 | E426: =(C426*6)+D426 -> 19 | G426: 6 | H426: 3 | I426: =(G426*6)+H426 -> 39 | K426: 7 | L426: 6 | M426: =(K426*6)+L426 -> 48 | O426: 9 | P426: 11 | Q426: =(O426*6)+P426 -> 65
A427: BEST PLAYERS
A428: GEELONG | C428: RAHILLY | F428: J BYRNE | I428: EGAN | L428: BARTEL | N428: D JOHNSON | Q428: SPRIGGS
A429: WILLIAMSTOWN | C429: LOCKYER | F429: LLOYD | I429: ROWE | L429: McKEE | N429: KING
A430: GOALKICKERS
A431: GEELONG | C431: McCARTHY 3 | F431: ALLAN 2 | I431: S BYRNES 2 | L431: J BYRNE 2 | O431: COOK 2 | Q431: LOATS 2 | S431: SPRIGGS 2 | W431: BLAKE | X431: RAHILLY
A432: WILLIAMSTOWN | C432: McKEE 3 | F432: SHACKLETON | I432: ROWE | K432: KNIGHT | M432: LOCKYER | O432: B SHAW | Q432: H SHAW
A434: SANDRINGHAM | C434: 8 | D434: 2 | E434: =(C434*6)+D434 -> 50 | G434: 13 | H434: 4 | I434: =(G434*6)+H434 -> 82 | K434: 15 | L434: 5 | M434: =(K434*6)+L434 -> 95 | O434: 16 | P434: 7 | Q434: =(O434*6)+P434 -> 103 | S434: Venue: FRANKSTON
A435: FRANKSTON | C435: 0 | D435: 3 | E435: =(C435*6)+D435 -> 3 | G435: 4 | H435: 5 | I435: =(G435*6)+H435 -> 29 | K435: 9 | L435: 8 | M435: =(K435*6)+L435 -> 62 | O435: 14 | P435: 10 | Q435: =(O435*6)+P435 -> 94
A436: BEST PLAYERS
A437: SANDRINGHAM | C437: SAUTNER | F437: READ | I437: ARMSTRONG | L437: O'KEEFE | O437: LAMB | Q437: WILLIAMS
A438: FRANKSTON | C438: FORTNAM | F438: ABLETT | I438: BERRY | L438: GODDARD | O438: ROBERTS | Q438: BUTLER
A439: GOALKICKERS
A440: SANDRINGHAM | C440: SAUTNER 11 | F440: RIGONI | I440: READ | K440: McLEAN | M440: ARMSTRONG | P440: O'KEEFE
A441: FRANKSTON | C441: BROWN 3 | F441: PHIBBS 3 | I441: BERRY 2 | K441: FORTNAM 2 | N441: ABLETT | P441: ANSTEY | R441: BRYAN | V441: MURPHY
A443: BENDIGO | C443: 6 | D443: 0 | E443: =(C443*6)+D443 -> 36 | G443: 11 | H443: 6 | I443: =(G443*6)+H443 -> 72 | K443: 14 | L443: 13 | M443: =(K443*6)+L443 -> 97 | O443: 17 | P443: 17 | Q443: =(O443*6)+P443 -> 119 | S443: Venue: COBURG
A444: COBURG | C444: 2 | D444: 3 | E444: =(C444*6)+D444 -> 15 | G444: 5 | H444: 4 | I444: =(G444*6)+H444 -> 34 | K444: 10 | L444: 8 | M444: =(K444*6)+L444 -> 68 | O444: 15 | P444: 10 | Q444: =(O444*6)+P444 -> 100
A445: BEST PLAYERS
A446: BENDIGO | C446: ALVEY | F446: WATSON | I446: DOERING | L446: WINDERLICH | O446: COSTER | R446: BRADLEY
A447: COBURG | C447: PETTIFER | F447: BLUMFIELD | I447: ZANTUCK | L447: ROGERS | O447: JORGENSEN | R447: PAGAN
A448: GOALKICKERS
A449: BENDIGO | C449: BRADLEY 4 | F449: LOVETT 3 | I449: WATSON 2 | L449: HAWKINS 2 | O449: NASH 2 | Q449: RICHARDS | T449: COSTER | W449: MOORCROFT | X449: WINDERLICH
A450: COBURG | C450: ZANTUCK 5 | F450: PETTIFER 4 | I450: KURET 2 | K450: BLUMFIELD 2 | N450: RODAN | P450: FOLEY
A452: BYE | D452: NTH BULLANTS
A454: ROUND 9 | D454: 29TH MAY | J454: WEATHER
D455: 1ST QTR | H455: 2ND QTR | L455: 3RD QTR | P455: FINAL | S455: Venue: YORK PARK (Launceston)
A456: TASMANIA | C456: 4 | D456: 3 | E456: =(C456*6)+D456 -> 27 | G456: 8 | H456: 5 | I456: =(G456*6)+H456 -> 53 | K456: 10 | L456: 6 | M456: =(K456*6)+L456 -> 66 | O456: 15 | P456: 9 | Q456: =(O456*6)+P456 -> 99 | S456: UMPIRES | Z456: LADDER | AC456: ROUND | AE456: 9
A457: WILLIAMSTOWN | C457: 3 | D457: 1 | E457: =(C457*6)+D457 -> 19 | G457: 4 | H457: 6 | I457: =(G457*6)+H457 -> 30 | K457: 5 | L457: 12 | M457: =(K457*6)+L457 -> 42 | O457: 6 | P457: 14 | Q457: =(O457*6)+P457 -> 50
A458: BEST PLAYERS | W458: TEAM | X458: B | Y458: W | Z458: L | AA458: D | AB458: FOR | AC458: AGST | AD458: % | AE458: PTS
A459: TASMANIA | C459: ATKIN | F459: HALL | I459: BROWN | L459: CARELESS | O459: LANG | R459: ROBINSON
A460: WILLIAMSTOWN | C460: WALKER | F460: WILLIAMS | I460: THEODORE | L460: CROW | O460: CRANAGE | W460: PORT MELBOURNE | X460: 1 | Y460: 7 | Z460: 1 | AA460: 0 | AB460: 872 | AC460: 626 | AD460: =(AB460/AC460)*100 -> 139.29712460063899 | AE460: =(Y460*4)+(AA460*2) -> 28
A461: GOALKICKERS | W461: SANDRINGHAM | X461: 1 | Y461: 6 | Z461: 2 | AA461: 0 | AB461: 813 | AC461: 598 | AD461: =(AB461/AC461)*100 -> 135.95317725752508 | AE461: =(Y461*4)+(AA461*2) -> 24
A462: TASMANIA | C462: BARTLETT 3 | F462: BEAMS 3 | I462: ATKIN 2 | K462: B GEAPPEN 2 | N462: DRURY 2 | P462: HALL | R462: HAW | T462: BROWN | W462: TASMANIA | X462: 1 | Y462: 6 | Z462: 2 | AA462: 0 | AB462: 799 | AC462: 625 | AD462: =(AB462/AC462)*100 -> 127.84 | AE462: =(Y462*4)+(AA462*2) -> 24
A463: WILLIAMSTOWN | C463: PROCTOR 2 | F463: MULLINS | I463: BALDWIN | K463: WEST | M463: NIXON | W463: WERRIBEE | X463: 1 | Y463: 5 | Z463: 3 | AA463: 0 | AB463: 770 | AC463: 663 | AD463: =(AB463/AC463)*100 -> 116.13876319758674 | AE463: =(Y463*4)+(AA463*2) -> 20
W464: NORTH BALLARAT | X464: 1 | Y464: 5 | Z464: 3 | AA464: 0 | AB464: 759 | AC464: 703 | AD464: =(AB464/AC464)*100 -> 107.96586059743956 | AE464: =(Y464*4)+(AA464*2) -> 20
A465: NORTHERN BULLANTS | C465: 3 | D465: 3 | E465: =(C465*6)+D465 -> 21 | G465: 10 | H465: 7 | I465: =(G465*6)+H465 -> 67 | K465: 15 | L465: 9 | M465: =(K465*6)+L465 -> 99 | O465: 17 | P465: 11 | Q465: =(O465*6)+P465 -> 113 | S465: Venue: PRESTON | W465: COBURG | X465: 1 | Y465: 5 | Z465: 3 | AA465: 0 | AB465: 685 | AC465: 726 | AD465: =(AB465/AC465)*100 -> 94.352617079889811 | AE465: =(Y465*4)+(AA465*2) -> 20
A466: BOX HILL | C466: 1 | D466: 3 | E466: =(C466*6)+D466 -> 9 | G466: 3 | H466: 4 | I466: =(G466*6)+H466 -> 22 | K466: 8 | L466: 5 | M466: =(K466*6)+L466 -> 53 | O466: 14 | P466: 9 | Q466: =(O466*6)+P466 -> 93 | W466: BENDIGO | X466: 1 | Y466: 4 | Z466: 4 | AA466: 0 | AB466: 788 | AC466: 745 | AD466: =(AB466/AC466)*100 -> 105.77181208053692 | AE466: =(Y466*4)+(AA466*2) -> 16
A467: BEST PLAYERS | W467: GEELONG | X467: 1 | Y467: 4 | Z467: 4 | AA467: 0 | AB467: 684 | AC467: 705 | AD467: =(AB467/AC467)*100 -> 97.021276595744681 | AE467: =(Y467*4)+(AA467*2) -> 16
A468: NORTHERN BULLANTS | C468: SIMPSON | F468: McGRATH | I468: CARRAZZO | L468: BENTICK | O468: HARFORD | R468: O'HAILPIN
A469: BOX HILL | C469: BRENNAN | F469: DIXON | I469: BARKER | L469: NEAGLE | O469: SHELTON | R469: WILLIAMS | W469: WILLIAMSTOWN | X469: 1 | Y469: 3 | Z469: 5 | AA469: 0 | AB469: 624 | AC469: 823 | AD469: =(AB469/AC469)*100 -> 75.820170109356013 | AE469: =(Y469*4)+(AA469*2) -> 12
A470: GOALKICKERS | Q470: KENNA | W470: FRANKSTON | X470: 1 | Y470: 2 | Z470: 6 | AA470: 0 | AB470: 631 | AC470: 706 | AD470: =(AB470/AC470)*100 -> 89.376770538243619 | AE470: =(Y470*4)+(AA470*2) -> 8
A471: NORTHERN BULLANTS | C471: O'HAILPIN 4 | F471: HARFORD 3 | I471: BENTICK 2 | K471: PLEMING 2 | M471: SIMPSON 2 | O471: BEASY | Q471: BOYD | R471: JORDAN | W471: NORTHERN BULLANTS | X471: 1 | Y471: 2 | Z471: 6 | AA471: 0 | AB471: 634 | AC471: 807 | AD471: =(AB471/AC471)*100 -> 78.562577447335812 | AE471: =(Y471*4)+(AA471*2) -> 8
A472: BOX HILL | C472: BARKER 3 | F472: DIXON 3 | I472: HARVEY 3 | L472: WILLIAMS 2 | O472: GREENE | Q472: NEAGLE | S472: TAYLOR | W472: SPRINGVALE | X472: 1 | Y472: 2 | Z472: 6 | AA472: 0 | AB472: 669 | AC472: 910 | AD472: =(AB472/AC472)*100 -> 73.516483516483518 | AE472: =(Y472*4)+(AA472*2) -> 8
F473: NIGHT MATCH | W473: BOX HILL | X473: 1 | Y473: 1 | Z473: 7 | AA473: 0 | AB473: 694 | AC473: 856 | AD473: =(AB473/AC473)*100 -> 81.074766355140184 | AE473: =(Y473*4)+(AA473*2) -> 4
A474: BENDIGO | C474: 3 | D474: 5 | E474: =(C474*6)+D474 -> 23 | G474: 5 | H474: 6 | I474: =(G474*6)+H474 -> 36 | K474: 7 | L474: 9 | M474: =(K474*6)+L474 -> 51 | O474: 10 | P474: 14 | Q474: =(O474*6)+P474 -> 74 | S474: Venue: BENDIGO
A475: FRANKSTON | C475: 2 | D475: 2 | E475: =(C475*6)+D475 -> 14 | G475: 7 | H475: 7 | I475: =(G475*6)+H475 -> 49 | K475: 9 | L475: 8 | M475: =(K475*6)+L475 -> 62 | O475: 9 | P475: 12 | Q475: =(O475*6)+P475 -> 66
A476: BEST PLAYERS
A477: BENDIGO | C477: LAYCOCK | F477: WILSON | I477: CARTER | L477: DOERING | O477: LOVETT | R477: WINDERLICH
A478: FRANKSTON | C478: GODDARD | F478: CLARKE | I478: PHIBBS | L478: KEMPERMAN | O478: ULMS | R478: BUTLER
A479: GOALKICKERS
A480: BENDIGO | C480: RICHARDS 3 | F480: STANTON 2 | I480: CARTER | K480: WELSH | M480: WILSON | O480: LOVETT | Q480: CUPIDO
A481: FRANKSTON | C481: PHIBBS 3 | F481: BERRY 2 | I481: FORTNAM | K481: ABLETT | M481: CLARKE | O481: LITTLECHILD
D482: 30TH MAY | J482: WEATHER
A483: PORT MELBOURNE | C483: 5 | D483: 3 | E483: =(C483*6)+D483 -> 33 | G483: 11 | H483: 8 | I483: =(G483*6)+H483 -> 74 | K483: 11 | L483: 13 | M483: =(K483*6)+L483 -> 79 | O483: 18 | P483: 14 | Q483: =(O483*6)+P483 -> 122 | S483: Venue: NORTH BALLARAT
A484: NORTH BALLARAT | C484: 1 | D484: 2 | E484: =(C484*6)+D484 -> 8 | G484: 5 | H484: 7 | I484: =(G484*6)+H484 -> 37 | K484: 10 | L484: 10 | M484: =(K484*6)+L484 -> 70 | O484: 10 | P484: 11 | Q484: =(O484*6)+P484 -> 71
A485: BEST PLAYERS
A486: PORT MELBOURNE | C486: LAWRENCE | F486: J CLAYTON | I486: SCHWARZE | L486: URCH | O486: HARDING | R486: ROBBINS
A487: NORTH BALLARAT | C487: MOLONEY | F487: BIDDISCOMBE | I487: WHYMAN
A488: GOALKICKERS
A489: PORT MELBOURNE | C489: HARDING 5 | F489: LAWRENCE 4 | I489: McINTOSH 2 | L489: McMAHON | N489: ROBBINS | P489: PORTER | R489: COTCHETT | V489: SHORE | X489: STEVENS | AA489: SCHWARZE
A490: NORTH BALLARAT | C490: ECCLES 2 | F490: SAUNDERS 2 | I490: DINNELL | K490: TUCKEY | M490: TAYLOR | O490: WHYMAN | Q490: PLUNKETT | U490: HUTCHINSON
A492: SPRINGVALE | C492: 5 | D492: 6 | E492: =(C492*6)+D492 -> 36 | G492: 10 | H492: 11 | I492: =(G492*6)+H492 -> 71 | K492: 14 | L492: 12 | M492: =(K492*6)+L492 -> 96 | O492: 17 | P492: 15 | Q492: =(O492*6)+P492 -> 117 | S492: Venue: WERRIBEE
A493: WERRIBEE | C493: 4 | D493: 3 | E493: =(C493*6)+D493 -> 27 | G493: 7 | H493: 6 | I493: =(G493*6)+H493 -> 48 | K493: 10 | L493: 8 | M493: =(K493*6)+L493 -> 68 | O493: 14 | P493: 11 | Q493: =(O493*6)+P493 -> 95
A494: BEST PLAYERS
A495: SPRINGVALE | C495: STONE | F495: PECKETT | I495: FISHER | L495: CAPLES | O495: FERGUSON | R495: WALDRON
A496: WERRIBEE | C496: MITCHELL | F496: MORRIS | I496: PODSIADLY | L496: CROFT | O496: CROSS | R496: RAU
A497: GOALKICKERS
A498: SPRINGVALE | C498: FISHER 3 | F498: HOULIHAN 3 | I498: HARRISON 2 | L498: WULF 2 | N498: SMITH 2 | P498: MURRAY 2 | R498: STONE | V498: FERGUSON | Y498: GRAM
A499: WERRIBEE | C499: MITCHELL 7 | F499: PODSIADLY 4 | J499: WIGGINS | M499: FAULKNER | P499: CROFT
A501: COBURG | C501: 4 | D501: 3 | E501: =(C501*6)+D501 -> 27 | G501: 8 | H501: 5 | I501: =(G501*6)+H501 -> 53 | K501: 13 | L501: 13 | M501: =(K501*6)+L501 -> 91 | O501: 15 | P501: 13 | Q501: =(O501*6)+P501 -> 103 | S501: Venue: COBURG
A502: GEELONG | C502: 4 | D502: 7 | E502: =(C502*6)+D502 -> 31 | G502: 8 | H502: 10 | I502: =(G502*6)+H502 -> 58 | K502: 9 | L502: 11 | M502: =(K502*6)+L502 -> 65 | O502: 14 | P502: 15 | Q502: =(O502*6)+P502 -> 99
A503: BEST PLAYERS
A504: COBURG | C504: O'CONNOR | F504: ROGERS | I504: TUCK | L504: DRAGICEVIC | O504: RAYSON | R504: RODAN
A505: GEELONG | C505: D JOHNSON | F505: J BYRNE | I505: CALLAN | L505: D BYRNE | O505: KOULOURIOTIS
A506: GOALKICKERS | S506: YOUNG
A507: COBURG | C507: GILMOUR 2 | F507: RODAN 2 | I507: CARLSON | K507: MORRISON | M507: NICHOLLS | O507: ROGERS | Q507: BLUMFIELD | T507: DRAGICEVIC | W507: FOLEY | X507: RAINES | AA507: O'CONNOR | AC507: ROACH
A508: GEELONG | C508: GREAVES 3 | F508: S BYRNES 2 | I508: SMITH 2 | K508: ALLEN 2 | M508: J BYRNE | O508: FOSTER | Q508: LOATS | S508: McCARTHY | W508: SPRIGGS
A510: BYE | D510: SANDRINGHAM
A512: ROUND 10 | D512: 5TH JUN | J512: WEATHER
D513: 1ST QTR | H513: 2ND QTR | L513: 3RD QTR | P513: FINAL | S513: Venue: PORT MELBOURNE
A514: PORT MELBOURNE | C514: 4 | D514: 3 | E514: =(C514*6)+D514 -> 27 | G514: 8 | H514: 9 | I514: =(G514*6)+H514 -> 57 | K514: 16 | L514: 9 | M514: =(K514*6)+L514 -> 105 | O514: 20 | P514: 12 | Q514: =(O514*6)+P514 -> 132 | S514: UMPIRES | Z514: LADDER | AC514: ROUND | AE514: 10
A515: SPRINGVALE | C515: 3 | D515: 4 | E515: =(C515*6)+D515 -> 22 | G515: 6 | H515: 6 | I515: =(G515*6)+H515 -> 42 | K515: 11 | L515: 8 | M515: =(K515*6)+L515 -> 74 | O515: 11 | P515: 13 | Q515: =(O515*6)+P515 -> 79
A516: BEST PLAYERS | W516: TEAM | X516: B | Y516: W | Z516: L | AA516: D | AB516: FOR | AC516: AGST | AD516: % | AE516: PTS
A517: PORT MELBOURNE | C517: LAWRENCE | F517: J CLAYTON | I517: HARVEY | L517: ROBBINS | O517: SINCLAIR | R517: LE CRAS
A518: SPRINGVALE | C518: HARRISON | F518: HEENAN | I518: GRAM | L518: WARNER | O518: STONE | W518: PORT MELBOURNE | X518: 1 | Y518: 8 | Z518: 1 | AA518: 0 | AB518: 1004 | AC518: 705 | AD518: =(AB518/AC518)*100 -> 142.41134751773049 | AE518: =(Y518*4)+(AA518*2) -> 32
A519: GOALKICKERS | E519: HARVEY | G519: URCH | I519: SINCLAIR | L519: McMAHON | N519: CORY JONES | Q519: CHAD JONES | W519: SANDRINGHAM | X519: 1 | Y519: 7 | Z519: 2 | AA519: 0 | AB519: 927 | AC519: 700 | AD519: =(AB519/AC519)*100 -> 132.42857142857142 | AE519: =(Y519*4)+(AA519*2) -> 28
A520: PORT MELBOURNE | C520: LAWRENCE 4 | F520: PITT 3 | H520: J CLAYTON 3 | K520: COTCHETT | M520: ROBBINS | O520: SHORE | Q520: McINTOSH | W520: NORTH BALLARAT | X520: 1 | Y520: 6 | Z520: 3 | AA520: 0 | AB520: 895 | AC520: 748 | AD520: =(AB520/AC520)*100 -> 119.6524064171123 | AE520: =(Y520*4)+(AA520*2) -> 24
A521: SPRINGVALE | C521: WARNER 3 | F521: FISHER 2 | I521: SMITH | K521: HEENAN | M521: KOSCH | O521: CARROLL | Q521: PECKETT | W521: TASMANIA | X521: 1 | Y521: 6 | Z521: 3 | AA521: 0 | AB521: 880 | AC521: 742 | AD521: =(AB521/AC521)*100 -> 118.59838274932615 | AE521: =(Y521*4)+(AA521*2) -> 24
N522: HOULIHAN | W522: WERRIBEE | X522: 1 | Y522: 5 | Z522: 4 | AA522: 0 | AB522: 836 | AC522: 781 | AD522: =(AB522/AC522)*100 -> 107.04225352112675 | AE522: =(Y522*4)+(AA522*2) -> 20
A523: NORTH BALLARAT | C523: 4 | D523: 3 | E523: =(C523*6)+D523 -> 27 | G523: 11 | H523: 6 | I523: =(G523*6)+H523 -> 72 | K523: 16 | L523: 13 | M523: =(K523*6)+L523 -> 109 | O523: 20 | P523: 16 | Q523: =(O523*6)+P523 -> 136 | S523: Venue: WILLIAMSTOWN | W523: GEELONG | X523: 1 | Y523: 5 | Z523: 4 | AA523: 0 | AB523: 802 | AC523: 771 | AD523: =(AB523/AC523)*100 -> 104.02075226977952 | AE523: =(Y523*4)+(AA523*2) -> 20
A524: WILLIAMSTOWN | C524: 0 | D524: 5 | E524: =(C524*6)+D524 -> 5 | G524: 3 | H524: 7 | I524: =(G524*6)+H524 -> 25 | K524: 4 | L524: 7 | M524: =(K524*6)+L524 -> 31 | O524: 6 | P524: 9 | Q524: =(O524*6)+P524 -> 45 | W524: COBURG | X524: 2 | Y524: 5 | Z524: 3 | AA524: 0 | AB524: 685 | AC524: 726 | AD524: =(AB524/AC524)*100 -> 94.352617079889811 | AE524: =(Y524*4)+(AA524*2) -> 20
A525: BEST PLAYERS | W525: BENDIGO | X525: 1 | Y525: 4 | Z525: 5 | AA525: 0 | AB525: 890 | AC525: 859 | AD525: =(AB525/AC525)*100 -> 103.60884749708963 | AE525: =(Y525*4)+(AA525*2) -> 16
A526: NORTH BALLARAT | C526: TUCKEY | F526: MOLONEY | I526: FIELD | L526: BIDDISCOMBE | O526: BYE | Q526: ECCLES
A527: WILLIAMSTOWN | C527: THEODORE | F527: PRESTIGIACOMO | J527: PROCTOR | M527: SHACKLETON | P527: H SHAW | R527: CROW | W527: FRANKSTON | X527: 1 | Y527: 3 | Z527: 6 | AA527: 0 | AB527: 710 | AC527: 771 | AD527: =(AB527/AC527)*100 -> 92.088197146562905 | AE527: =(Y527*4)+(AA527*2) -> 12
A528: GOALKICKERS | O528: HUTCHINSON | R528: PLUNKETT | W528: WILLIAMSTOWN | X528: 1 | Y528: 3 | Z528: 6 | AA528: 0 | AB528: 669 | AC528: 959 | AD528: =(AB528/AC528)*100 -> 69.760166840458808 | AE528: =(Y528*4)+(AA528*2) -> 12
A529: NORTH BALLARAT | C529: SAUNDERS 5 | F529: TUCKEY 4 | I529: TAYLOR 3 | K529: WHYMAN 3 | N529: GOODES | P529: O'KEEFE | R529: ECCLES | W529: BOX HILL | X529: 1 | Y529: 2 | Z529: 7 | AA529: 0 | AB529: 811 | AC529: 937 | AD529: =(AB529/AC529)*100 -> 86.55282817502669 | AE529: =(Y529*4)+(AA529*2) -> 8
A530: WILLIAMSTOWN | C530: PROCTOR 4 | F530: NIXON | H530: H SHAW | W530: NORTHERN BULLANTS | X530: 1 | Y530: 2 | Z530: 7 | AA530: 0 | AB530: 699 | AC530: 886 | AD530: =(AB530/AC530)*100 -> 78.893905191873586 | AE530: =(Y530*4)+(AA530*2) -> 8
W531: SPRINGVALE | X531: 1 | Y531: 2 | Z531: 7 | AA531: 0 | AB531: 748 | AC531: 1042 | AD531: =(AB531/AC531)*100 -> 71.785028790786953 | AE531: =(Y531*4)+(AA531*2) -> 8
A532: GEELONG | C532: 4 | D532: 2 | E532: =(C532*6)+D532 -> 26 | G532: 7 | H532: 8 | I532: =(G532*6)+H532 -> 50 | K532: 11 | L532: 14 | M532: =(K532*6)+L532 -> 80 | O532: 17 | P532: 16 | Q532: =(O532*6)+P532 -> 118 | S532: Venue: SHELL STADIUM
A533: WERRIBEE | C533: 3 | D533: 1 | E533: =(C533*6)+D533 -> 19 | G533: 7 | H533: 4 | I533: =(G533*6)+H533 -> 46 | K533: 9 | L533: 5 | M533: =(K533*6)+L533 -> 59 | O533: 10 | P533: 6 | Q533: =(O533*6)+P533 -> 66
A534: BEST PLAYERS
A535: GEELONG | C535: ENRIGHT | F535: RAHILLY | I535: J BYRNE | L535: LOATS | N535: LONERGAN | Q535: SPRIGGS
A536: WERRIBEE | C536: CROSS | F536: MURPHY | I536: MORRIS | L536: CROFT | N536: KRETIUK | Q536: STREET
A537: GOALKICKERS
A538: GEELONG | C538: LOATS 4 | E538: SPRIGGS 3 | G538: THURLEY 2 | J538: McCARTHY 2 | M538: CHAMBERS | P538: ENRIGHT | R538: S JOHNSON | W538: SMITH | Y538: LONERGAN | AB538: S BRYNES
A539: WERRIBEE | C539: MITCHELL 3 | F539: GILBEE 2 | I539: CROSS | K539: HENDERSON | N539: MURPHY | P539: SKIPPER | R539: WALSH
D540: 6TH JUNE | J540: WEATHER
A541: BOX HILL | C541: 2 | D541: 6 | E541: =(C541*6)+D541 -> 18 | G541: 5 | H541: 9 | I541: =(G541*6)+H541 -> 39 | K541: 11 | L541: 17 | M541: =(K541*6)+L541 -> 83 | O541: 16 | P541: 21 | Q541: =(O541*6)+P541 -> 117 | S541: Venue: BOX HILL
A542: TASMANIA | C542: 2 | D542: 1 | E542: =(C542*6)+D542 -> 13 | G542: 9 | H542: 5 | I542: =(G542*6)+H542 -> 59 | K542: 11 | L542: 7 | M542: =(K542*6)+L542 -> 73 | O542: 12 | P542: 9 | Q542: =(O542*6)+P542 -> 81
A543: BEST PLAYERS
A544: BOX HILL | C544: TALLIS | F544: CLARKE | I544: GREENE | L544: HARVEY | N544: BALL | Q544: ALLEWAY
A545: TASMANIA | C545: HALL | F545: PLAPP | I545: SAVAGE | L545: ROBINSON | N545: DRURY
A546: GOALKICKERS
A547: BOX HILL | C547: ALLEWAY 4 | F547: HARVEY 4 | I547: BREESE | K547: CLARKE | M547: GREENE | O547: KANE | Q547: SHELTON | S547: SEWELL | V547: TAYLOR | X547: WEINERT
A548: TASMANIA | C548: PLAPP 3 | F548: VINEY 2 | I548: ATKIN | K548: CARELESS | M548: GEAPPEN | O548: HALL | Q548: BARTLETT | S548: DRURY | U548: ROBINSON
A550: SANDRINGHAM | C550: 6 | D550: 5 | E550: =(C550*6)+D550 -> 41 | G550: 8 | H550: 8 | I550: =(G550*6)+H550 -> 56 | K550: 13 | L550: 16 | M550: =(K550*6)+L550 -> 94 | O550: 16 | P550: 18 | Q550: =(O550*6)+P550 -> 114 | S550: Venue: BEACH ROAD
A551: BENDIGO | C551: 4 | D551: 1 | E551: =(C551*6)+D551 -> 25 | G551: 9 | H551: 6 | I551: =(G551*6)+H551 -> 60 | K551: 11 | L551: 8 | M551: =(K551*6)+L551 -> 74 | O551: 15 | P551: 12 | Q551: =(O551*6)+P551 -> 102
A552: BEST PLAYERS
A553: SANDRINGHAM | C553: GALLAGHER | F553: MILLS | I553: JOHNSON | L553: HUNTER | N553: GODFREY | Q553: BELL
A554: BENDIGO | C554: HUNT | F554: HAYNES | I554: BULLEN | L554: DYSON | N554: DOERING | Q554: MOORCROFT
A555: GOALKICKERS
A556: SANDRINGHAM | C556: HOLLAND 3 | F556: HUNTER 2 | I556: JAMAR 2 | K556: SMITH 2 | M556: JOHNSON 2 | P556: FERRARO | R556: SYLVIA | V556: SAUTNER | X556: GALLAGHER | AA556: MILLS
A557: BENDIGO | C557: MOORCROFT 3 | F557: CUPIDO 3 | I557: BRADLEY 2 | L557: BULLEN 2 | N557: STANTON | Q557: LOVETT | S557: WALSH | V557: HAWKINS | X557: WILSON
A559: FRANKSTON | C559: 0 | D559: 1 | E559: =(C559*6)+D559 -> 1 | G559: 6 | H559: 2 | I559: =(G559*6)+H559 -> 38 | K559: 11 | L559: 5 | M559: =(K559*6)+L559 -> 71 | O559: 12 | P559: 7 | Q559: =(O559*6)+P559 -> 79 | S559: Venue: FRANKSTON
A560: NORTHERN BULLANTS | C560: 1 | D560: 4 | E560: =(C560*6)+D560 -> 10 | G560: 3 | H560: 4 | I560: =(G560*6)+H560 -> 22 | K560: 6 | L560: 7 | M560: =(K560*6)+L560 -> 43 | O560: 9 | P560: 11 | Q560: =(O560*6)+P560 -> 65
A561: BEST PLAYERS
A562: FRANKSTON | C562: BERRY | F562: BRYAN | I562: FORTNAM | L562: ABLETT | N562: SHIPP | Q562: FOLINO
A563: NORTHERN BULLANTS | C563: MCCORMICK | F563: BEASY | I563: WAITE | L563: HOOPER | N563: CLARKE | Q563: KENNA
A564: GOALKICKERS
A565: FRANKSTON | C565: BERRY 5 | F565: FORTNAM 3 | I565: BROWN 2 | L565: PHIBBS | N565: CLARKE
A566: NORTHERN BULLANTS | C566: GUTTERSON 3 | F566: LIVINGSTON | I566: CLARKE | K566: COLBERT | M566: O'HAILPIN | P566: BEASY | R566: PLEMING
A568: BYE | D568: COBURG
A570: ROUND 11 | D570: 12TH JUNE | J570: WEATHER
D571: 1ST QTR | H571: 2ND QTR | L571: 3RD QTR | P571: FINAL | S571: Venue: COBURG
A572: COBURG | C572: 5 | D572: 2 | E572: =(C572*6)+D572 -> 32 | G572: 5 | H572: 6 | I572: =(G572*6)+H572 -> 36 | K572: 10 | L572: 8 | M572: =(K572*6)+L572 -> 68 | O572: 11 | P572: 9 | Q572: =(O572*6)+P572 -> 75 | S572: UMPIRES | Z572: LADDER | AC572: ROUND | AE572: 11
A573: FRANKSTON | C573: 1 | D573: 0 | E573: =(C573*6)+D573 -> 6 | G573: 6 | H573: 3 | I573: =(G573*6)+H573 -> 39 | K573: 7 | L573: 5 | M573: =(K573*6)+L573 -> 47 | O573: 11 | P573: 8 | Q573: =(O573*6)+P573 -> 74
A574: BEST PLAYERS | W574: TEAM | X574: B | Y574: W | Z574: L | AA574: D | AB574: FOR | AC574: AGST | AD574: % | AE574: PTS
A575: COBURG | C575: TALBOT | F575: HILTON | I575: HOULIHAN | L575: ZANTUCK | O575: DRAGICEVIC | R575: MARSH
A576: FRANKSTON | C576: ROBERTS | F576: CLARKE | I576: SHIPP | L576: ABLETT | O576: FORTNAM | R576: O'DELL | W576: PORT MELBOURNE | X576: 1 | Y576: 9 | Z576: 1 | AA576: 0 | AB576: 1075 | AC576: 754 | AD576: =(AB576/AC576)*100 -> 142.57294429708222 | AE576: =(Y576*4)+(AA576*2) -> 36
A577: GOALKICKERS | W577: SANDRINGHAM | X577: 1 | Y577: 8 | Z577: 2 | AA577: 0 | AB577: 984 | AC577: 729 | AD577: =(AB577/AC577)*100 -> 134.97942386831278 | AE577: =(Y577*4)+(AA577*2) -> 32
A578: COBURG | C578: HOULIHAN 5 | F578: TUCK 2 | I578: PAGAN | K578: ROGERS | N578: HILTON | P578: FOLEY | W578: TASMANIA | X578: 1 | Y578: 6 | Z578: 4 | AA578: 0 | AB578: 896 | AC578: 775 | AD578: =(AB578/AC578)*100 -> 115.61290322580646 | AE578: =(Y578*4)+(AA578*2) -> 24
A579: FRANKSTON | C579: CLARKE 4 | F579: SHIPP 3 | I579: PHIBBS 2 | L579: BERRY | N579: BEASY | W579: NORTH BALLARAT | X579: 1 | Y579: 6 | Z579: 4 | AA579: 0 | AB579: 924 | AC579: 805 | AD579: =(AB579/AC579)*100 -> 114.78260869565217 | AE579: =(Y579*4)+(AA579*2) -> 24
D580: 13TH JUNE | J580: WEATHER | W580: WERRIBEE | X580: 1 | Y580: 6 | Z580: 4 | AA580: 0 | AB580: 869 | AC580: 797 | AD580: =(AB580/AC580)*100 -> 109.03387703889587 | AE580: =(Y580*4)+(AA580*2) -> 24
A581: PORT MELBOURNE | C581: 4 | D581: 3 | E581: =(C581*6)+D581 -> 27 | G581: 5 | H581: 5 | I581: =(G581*6)+H581 -> 35 | K581: 8 | L581: 10 | M581: =(K581*6)+L581 -> 58 | O581: 10 | P581: 11 | Q581: =(O581*6)+P581 -> 71 | S581: Venue: SHELL STADIUM (C/R) | W581: COBURG | X581: 2 | Y581: 6 | Z581: 3 | AA581: 0 | AB581: 760 | AC581: 800 | AD581: =(AB581/AC581)*100 -> 95 | AE581: =(Y581*4)+(AA581*2) -> 24
A582: GEELONG | C582: 3 | D582: 1 | E582: =(C582*6)+D582 -> 19 | G582: 4 | H582: 2 | I582: =(G582*6)+H582 -> 26 | K582: 5 | L582: 3 | M582: =(K582*6)+L582 -> 33 | O582: 7 | P582: 7 | Q582: =(O582*6)+P582 -> 49 | W582: BENDIGO | X582: 1 | Y582: 5 | Z582: 5 | AA582: 0 | AB582: 1002 | AC582: 935 | AD582: =(AB582/AC582)*100 -> 107.16577540106952 | AE582: =(Y582*4)+(AA582*2) -> 20
A583: BEST PLAYERS | W583: GEELONG | X583: 1 | Y583: 5 | Z583: 5 | AA583: 0 | AB583: 851 | AC583: 842 | AD583: =(AB583/AC583)*100 -> 101.06888361045129 | AE583: =(Y583*4)+(AA583*2) -> 20
A584: PORT MELBOURNE | C584: SINCLAIR | F584: COREY JONES | I584: J CLAYTON | L584: LAWRENCE | O584: SCHWARZE | R584: OBST
A585: GEELONG | C585: RAHILLY | F585: CALLAN | I585: LONERGAN | L585: D BYRNE | O585: SPRIGGS | W585: FRANKSTON | X585: 1 | Y585: 3 | Z585: 7 | AA585: 0 | AB585: 784 | AC585: 846 | AD585: =(AB585/AC585)*100 -> 92.671394799054369 | AE585: =(Y585*4)+(AA585*2) -> 12
A586: GOALKICKERS | W586: SPRINGVALE | X586: 1 | Y586: 3 | Z586: 7 | AA586: 0 | AB586: 833 | AC586: 1099 | AD586: =(AB586/AC586)*100 -> 75.796178343949052 | AE586: =(Y586*4)+(AA586*2) -> 12
A587: PORT MELBOURNE | C587: COREY JONES 3 | G587: LAWRENCE 2 | J587: PITT 2 | L587: J CLAYTON | O587: S HARVEY | Q587: CHAD JONES | W587: WILLIAMSTOWN | X587: 1 | Y587: 3 | Z587: 7 | AA587: 0 | AB587: 745 | AC587: 1071 | AD587: =(AB587/AC587)*100 -> 69.561157796451909 | AE587: =(Y587*4)+(AA587*2) -> 12
A588: GEELONG | C588: SPRIGGS 2 | F588: THURLEY 2 | I588: RAHILLY 2 | L588: SMITH | W588: BOX HILL | X588: 2 | Y588: 2 | Z588: 7 | AA588: 0 | AB588: 811 | AC588: 937 | AD588: =(AB588/AC588)*100 -> 86.55282817502669 | AE588: =(Y588*4)+(AA588*2) -> 8
W589: NORTHERN BULLANTS | X589: 1 | Y589: 2 | Z589: 8 | AA589: 0 | AB589: 756 | AC589: 971 | AD589: =(AB589/AC589)*100 -> 77.857878475798145 | AE589: =(Y589*4)+(AA589*2) -> 8
A590: WERRIBEE | C590: 4 | D590: 2 | E590: =(C590*6)+D590 -> 26 | G590: 4 | H590: 3 | I590: =(G590*6)+H590 -> 27 | K590: 4 | L590: 9 | M590: =(K590*6)+L590 -> 33 | O590: 4 | P590: 9 | Q590: =(O590*6)+P590 -> 33 | S590: Venue: DEVONPORT
A591: TASMANIA | C591: 1 | D591: 1 | E591: =(C591*6)+D591 -> 7 | G591: 2 | H591: 1 | I591: =(G591*6)+H591 -> 13 | K591: 2 | L591: 2 | M591: =(K591*6)+L591 -> 14 | O591: 2 | P591: 4 | Q591: =(O591*6)+P591 -> 16
A592: BEST PLAYERS
A593: WERRIBEE | C593: GARLICK | F593: GILBEE | I593: BIRSS | L593: SETCHELL | O593: SKIPPER | R593: PODSIADLY
A594: TASMANIA | C594: B GEAPPEN | F594: ATKIN | I594: PLAPP | L594: M GEAPPEN | O594: HOWARD
A595: GOALKICKERS
A596: WERRIBEE | C596: WALSH | F596: GARLICK | I596: MITCHELL | L596: MURPHY
A597: TASMANIA | C597: CALLINAN | F597: PLAPP
A599: SANDRINGHAM | C599: 2 | D599: 0 | E599: =(C599*6)+D599 -> 12 | G599: 4 | H599: 0 | I599: =(G599*6)+H599 -> 24 | K599: 5 | L599: 2 | M599: =(K599*6)+L599 -> 32 | O599: 9 | P599: 3 | Q599: =(O599*6)+P599 -> 57 | S599: Venue: NORTH BALLARAT
A600: NORTH BALLARAT | C600: 2 | D600: 4 | E600: =(C600*6)+D600 -> 16 | G600: 2 | H600: 6 | I600: =(G600*6)+H600 -> 18 | K600: 3 | L600: 8 | M600: =(K600*6)+L600 -> 26 | O600: 3 | P600: 11 | Q600: =(O600*6)+P600 -> 29
A601: BEST PLAYERS
A602: SANDRINGHAM | C602: CARROLL | F602: FISHER | I602: WARD | L602: MILLS | N602: BIDDLECOMBE | Q602: LAMB
A603: NORTH BALLARAT | C603: BIDDISCOMBE | F603: MOLONEY | I603: O'KEEFE | L603: HUTCHINSON | O603: RYALL
A604: GOALKICKERS
A605: SANDRINGHAM | C605: NEWMAN 3 | F605: FISHER 2 | I605: N SMITH | K605: SAUTNER | M605: CROWE | O605: JAMAR
A606: NORTH BALLARAT | C606: SAUNDERS | F606: O'KEEFE | I606: BIDDISCOMBE
A608: SPRINGVALE | C608: 2 | D608: 1 | E608: =(C608*6)+D608 -> 13 | G608: 8 | H608: 9 | I608: =(G608*6)+H608 -> 57 | K608: 8 | L608: 13 | M608: =(K608*6)+L608 -> 61 | O608: 11 | P608: 19 | Q608: =(O608*6)+P608 -> 85 | S608: Venue: SPRINGVALE
A609: NORTHERN BULLANTS | C609: 5 | D609: 6 | E609: =(C609*6)+D609 -> 36 | G609: 5 | H609: 6 | I609: =(G609*6)+H609 -> 36 | K609: 7 | L609: 7 | M609: =(K609*6)+L609 -> 49 | O609: 8 | P609: 9 | Q609: =(O609*6)+P609 -> 57
A610: BEST PLAYERS
A611: SPRINGVALE | C611: GRAM | F611: T SCHWARZE | I611: CAPLES | L611: WALDRON | O611: JAMES | Q611: TAYLOR
A612: NORTHERN BULLANTS | C612: D CLARKE | F612: McCORMICK | I612: HOOPER
A613: GOALKICKERS
A614: SPRINGVALE | C614: TAYLOR 4 | F614: PECKETT 2 | I614: BRUIN | K614: HEENAN | M614: CARMODY | O614: MONTAGNA | R614: HOULIHAN
A615: NORTHERN BULLANTS | C615: CARRAZZO 2 | F615: DAVIES 2 | I615: COLBERT | K615: BENTICK | M615: MCCORMICK | P615: MOTT
A617: BENDIGO | C617: 6 | D617: 5 | E617: =(C617*6)+D617 -> 41 | G617: 10 | H617: 8 | I617: =(G617*6)+H617 -> 68 | K617: 11 | L617: 13 | M617: =(K617*6)+L617 -> 79 | O617: 16 | P617: 16 | Q617: =(O617*6)+P617 -> 112 | S617: Venue: BENDIGO
A618: WILLIAMSTOWN | C618: 2 | D618: 3 | E618: =(C618*6)+D618 -> 15 | G618: 4 | H618: 8 | I618: =(G618*6)+H618 -> 32 | K618: 7 | L618: 12 | M618: =(K618*6)+L618 -> 54 | O618: 10 | P618: 16 | Q618: =(O618*6)+P618 -> 76
A619: BEST PLAYERS
A620: BENDIGO | C620: BULLEN | F620: DOERING | I620: MOORCROFT | L620: CARTER | O620: ALVEY | Q620: DYSON
A621: WILLIAMSTOWN | C621: CRANAGE | F621: LLOYD | I621: SHACKLETON | L621: JARRAD | O621: CROW | Q621: SWAN
A622: GOALKICKERS
A623: BENDIGO | C623: SUMMERS 2 | F623: DYSON 2 | H623: WALSH 2 | J623: MOORCROFT 2 | M623: CARTER 2 | O623: HAWKINS | Q623: BULLEN | S623: BRADLEY | W623: DOERING | X623: BOWEN | Z623: CARTLEDGE
A624: WILLIAMSTOWN | C624: CRANAGE 3 | F624: NIXON 2 | I624: SHACKLETON | L624: B SHAW | N624: MULLINS | Q624: UHI | R624: JARRAD
A626: BYE | D626: BOX HILL
A628: ROUND 12 | D628: 26TH JUNE | J628: WEATHER
D629: 1ST QTR | H629: 2ND QTR | L629: 3RD QTR | P629: FINAL | S629: Venue: PORT MELBOURNE
A630: SANDRINGHAM | C630: 6 | D630: 2 | E630: =(C630*6)+D630 -> 38 | G630: 9 | H630: 5 | I630: =(G630*6)+H630 -> 59 | K630: 13 | L630: 13 | M630: =(K630*6)+L630 -> 91 | O630: 14 | P630: 13 | Q630: =(O630*6)+P630 -> 97 | S630: UMPIRES | Z630: LADDER | AC630: ROUND | AE630: 12
A631: PORT MELBOURNE | C631: 1 | D631: 4 | E631: =(C631*6)+D631 -> 10 | G631: 4 | H631: 4 | I631: =(G631*6)+H631 -> 28 | K631: 7 | L631: 4 | M631: =(K631*6)+L631 -> 46 | O631: 13 | P631: 9 | Q631: =(O631*6)+P631 -> 87
A632: BEST PLAYERS | W632: TEAM | X632: B | Y632: W | Z632: L | AA632: D | AB632: FOR | AC632: AGST | AD632: % | AE632: PTS
A633: SANDRINGHAM | C633: WARD | F633: O'KEEFE | I633: WALSH | L633: MILLS | O633: JOHNSTONE | R633: GODFREY
A634: PORT MELBOURNE | C634: BAIRD | F634: SANSBURY | I634: LECRAS | L634: SHORE | W634: PORT MELBOURNE | X634: 1 | Y634: 9 | Z634: 2 | AA634: 0 | AB634: 1162 | AC634: 851 | AD634: =(AB634/AC634)*100 -> 136.54524089306699 | AE634: =(Y634*4)+(AA634*2) -> 36
A635: GOALKICKERS | W635: SANDRINGHAM | X635: 1 | Y635: 9 | Z635: 2 | AA635: 0 | AB635: 1081 | AC635: 816 | AD635: =(AB635/AC635)*100 -> 132.47549019607843 | AE635: =(Y635*4)+(AA635*2) -> 36
A636: SANDRINGHAM | C636: SAUTNER 5 | F636: GODFREY 5 | I636: FISHER | K636: MILLS | M636: ARMSTRONG | P636: RIGONI | W636: NORTH BALLARAT | X636: 1 | Y636: 7 | Z636: 4 | AA636: 0 | AB636: 993 | AC636: 827 | AD636: =(AB636/AC636)*100 -> 120.07255139056832 | AE636: =(Y636*4)+(AA636*2) -> 28
A637: PORT MELBOURNE | C637: LAWRENCE 2 | F637: PITT 2 | H637: JONES 2 | J637: SHORE 2 | L637: HALE | N637: McKERNAN | Q637: McMAHON | W637: WERRIBEE | X637: 1 | Y637: 7 | Z637: 4 | AA637: 0 | AB637: 919 | AC637: 839 | AD637: =(AB637/AC637)*100 -> 109.53516090584029 | AE637: =(Y637*4)+(AA637*2) -> 28
O638: ROBBINS | Q638: COTCHETT | W638: TASMANIA | X638: 2 | Y638: 6 | Z638: 4 | AA638: 0 | AB638: 896 | AC638: 775 | AD638: =(AB638/AC638)*100 -> 115.61290322580646 | AE638: =(Y638*4)+(AA638*2) -> 24
A639: NORTH BALLARAT | C639: 4 | D639: 4 | E639: =(C639*6)+D639 -> 28 | G639: 4 | H639: 7 | I639: =(G639*6)+H639 -> 31 | K639: 7 | L639: 12 | M639: =(K639*6)+L639 -> 54 | O639: 9 | P639: 15 | Q639: =(O639*6)+P639 -> 69 | S639: Venue: NORTH BALLARAT | W639: COBURG | X639: 2 | Y639: 6 | Z639: 4 | AA639: 0 | AB639: 782 | AC639: 869 | AD639: =(AB639/AC639)*100 -> 89.988492520138081 | AE639: =(Y639*4)+(AA639*2) -> 24
A640: COBURG | C640: 1 | D640: 2 | E640: =(C640*6)+D640 -> 8 | G640: 1 | H640: 5 | I640: =(G640*6)+H640 -> 11 | K640: 2 | L640: 6 | M640: =(K640*6)+L640 -> 18 | O640: 2 | P640: 10 | Q640: =(O640*6)+P640 -> 22 | W640: BENDIGO | X640: 1 | Y640: 5 | Z640: 6 | AA640: 0 | AB640: 1069 | AC640: 1081 | AD640: =(AB640/AC640)*100 -> 98.889916743755776 | AE640: =(Y640*4)+(AA640*2) -> 20
A641: BEST PLAYERS | W641: GEELONG | X641: 1 | Y641: 5 | Z641: 6 | AA641: 0 | AB641: 900 | AC641: 920 | AD641: =(AB641/AC641)*100 -> 97.826086956521735 | AE641: =(Y641*4)+(AA641*2) -> 20
A642: NORTH BALLARAT | C642: MOLONEY | F642: CLARK | I642: GREIG | L642: FOOTE | O642: FIELD | Q642: TAYLOR
A643: COBURG | C643: CARLSON | F643: KELLAWAY | I643: TUCK | L643: MORRISON | O643: PAGAN | W643: WILLIAMSTOWN | X643: 1 | Y643: 4 | Z643: 7 | AA643: 0 | AB643: 845 | AC643: 1153 | AD643: =(AB643/AC643)*100 -> 73.287077189939282 | AE643: =(Y643*4)+(AA643*2) -> 16
A644: GOALKICKERS | W644: FRANKSTON | X644: 1 | Y644: 3 | Z644: 8 | AA644: 0 | AB644: 826 | AC644: 896 | AD644: =(AB644/AC644)*100 -> 92.1875 | AE644: =(Y644*4)+(AA644*2) -> 12
A645: NORTH BALLARAT | C645: FOOTE 3 | F645: HUTCHINSON | I645: TUCKEY | K645: WHYMAN | M645: TAYLOR | O645: FIELD | Q645: DINNELL | W645: BOX HILL | X645: 2 | Y645: 3 | Z645: 7 | AA645: 0 | AB645: 889 | AC645: 986 | AD645: =(AB645/AC645)*100 -> 90.162271805273832 | AE645: =(Y645*4)+(AA645*2) -> 12
A646: COBURG | C646: MORRISON | F646: TUCK | W646: NORTHERN BULLANTS | X646: 1 | Y646: 3 | Z646: 8 | AA646: 0 | AB646: 902 | AC646: 1038 | AD646: =(AB646/AC646)*100 -> 86.897880539499042 | AE646: =(Y646*4)+(AA646*2) -> 12
D647: 27TH JUNE | J647: WEATHER | W647: SPRINGVALE | X647: 1 | Y647: 3 | Z647: 8 | AA647: 0 | AB647: 915 | AC647: 1199 | AD647: =(AB647/AC647)*100 -> 76.31359466221852 | AE647: =(Y647*4)+(AA647*2) -> 12
A648: BOX HILL | C648: 1 | D648: 11 | E648: =(C648*6)+D648 -> 17 | G648: 4 | H648: 11 | I648: =(G648*6)+H648 -> 35 | K648: 5 | L648: 17 | M648: =(K648*6)+L648 -> 47 | O648: 10 | P648: 18 | Q648: =(O648*6)+P648 -> 78 | S648: Venue: BOX HILL
A649: GEELONG | C649: 0 | D649: 0 | E649: =(C649*6)+D649 -> 0 | G649: 4 | H649: 4 | I649: =(G649*6)+H649 -> 28 | K649: 4 | L649: 6 | M649: =(K649*6)+L649 -> 30 | O649: 7 | P649: 7 | Q649: =(O649*6)+P649 -> 49
A650: BEST PLAYERS
A651: BOX HILL | C651: KANE | F651: SEWELL | I651: MILLER | L651: BARLOW | O651: CAMPBELL | R651: TALLIS
A652: GEELONG | C652: CHAMBERS | F652: KOULOURIOTIS | J652: J BYRNE | M652: RAHILLY | O652: CALLAN | R652: COOK
A653: GOALKICKERS
A654: BOX HILL | C654: ALLEWAY 3 | F654: KANE 2 | I654: MILLER 2 | K654: BATCHELOR | N654: CLIFTON | Q654: TAYLOR
A655: GEELONG | C655: COOK 3 | F655: D BYRNE | I655: GARDINER | K655: GREAVES | M655: LOATS
A657: WILLIAMSTOWN | C657: 4 | D657: 5 | E657: =(C657*6)+D657 -> 29 | G657: 6 | H657: 6 | I657: =(G657*6)+H657 -> 42 | K657: 12 | L657: 12 | M657: =(K657*6)+L657 -> 84 | O657: 14 | P657: 16 | Q657: =(O657*6)+P657 -> 100 | S657: Venue: SPRINGVALE
A658: SPRINGVALE | C658: 2 | D658: 1 | E658: =(C658*6)+D658 -> 13 | G658: 8 | H658: 7 | I658: =(G658*6)+H658 -> 55 | K658: 10 | L658: 7 | M658: =(K658*6)+L658 -> 67 | O658: 12 | P658: 10 | Q658: =(O658*6)+P658 -> 82
A659: BEST PLAYERS
A660: WILLIAMSTOWN | C660: SHACKLETON | F660: ROWE | I660: KING | L660: SWAN | O660: H SHAW | R660: CRANAGE
A661: SPRINGVALE | C661: MOYLE | F661: PECKETT | I661: S FISHER | L661: CARROLL
A662: GOALKICKERS
A663: WILLIAMSTOWN | C663: SWAN 2 | E663: H SHAW 2 | H663: KINNEAR | J663: B SHAW | L663: ROWE | N663: UHI | P663: CRANAGE | R663: PROCTOR | V663: NIXON | X663: THEODORE | AA663: JARRAD | AC663: KING
A664: SPRINGVALE | C664: MOYLE 4 | F664: HOULIHAN 3 | I664: MURRAY 2 | L664: S FISHER 2 | O664: PECKETT
A666: NORTHERN BULLANTS | C666: 2 | D666: 2 | E666: =(C666*6)+D666 -> 14 | G666: 12 | H666: 10 | I666: =(G666*6)+H666 -> 82 | K666: 15 | L666: 12 | M666: =(K666*6)+L666 -> 102 | O666: 22 | P666: 14 | Q666: =(O666*6)+P666 -> 146 | S666: Venue: PRESTON
A667: BENDIGO | C667: 1 | D667: 4 | E667: =(C667*6)+D667 -> 10 | G667: 4 | H667: 6 | I667: =(G667*6)+H667 -> 30 | K667: 7 | L667: 10 | M667: =(K667*6)+L667 -> 52 | O667: 9 | P667: 13 | Q667: =(O667*6)+P667 -> 67
A668: BEST PLAYERS
A669: NORTHERN BULLANTS | C669: SPORN | F669: DAVIES | I669: BEASY | L669: SIMPSON | O669: MCCORMICK | R669: WALKER
A670: BENDIGO | C670: RICHARDS | F670: DYSON | I670: COSGRIFF | L670: LAYCOCK
A671: GOALKICKERS
A672: NORTHERN BULLANTS | C672: BENTICK 3 | E672: CAMPBELL 3 | H672: DAVIES 3 | J672: SIMPSON 2 | M672: ZORZI 2 | O672: HARFORD | Q672: LIVINGSTON | T672: PLEMING | W672: VANSITTART | X672: MCCORMICK | AA672: WALKER
A673: BENDIGO | C673: RICHARDS 3 | F673: BULLEN | H673: DYSON | J673: CARTER | L673: CARTLEDGE | N673: ALVEY | P673: MOORCROFT
A675: WERRIBEE | C675: 6 | D675: 3 | E675: =(C675*6)+D675 -> 39 | G675: 6 | H675: 5 | I675: =(G675*6)+H675 -> 41 | K675: 7 | L675: 8 | M675: =(K675*6)+L675 -> 50 | O675: 7 | P675: 8 | Q675: =(O675*6)+P675 -> 50 | S675: Venue: FRANKSTON
A676: FRANKSTON | C676: 0 | D676: 2 | E676: =(C676*6)+D676 -> 2 | G676: 1 | H676: 4 | I676: =(G676*6)+H676 -> 10 | K676: 3 | L676: 7 | M676: =(K676*6)+L676 -> 25 | O676: 5 | P676: 12 | Q676: =(O676*6)+P676 -> 42
A677: BEST PLAYERS
A678: WERRIBEE | C678: CROFT | F678: GARLICK | I678: BASSETT | L678: BIRSS | O678: HENDERSON | R678: SKIPPER
A679: FRANKSTON | C679: ABLETT | F679: ROBERTS | I679: O'DELL | L679: ROBERTSON
A680: GOALKICKERS
A681: WERRIBEE | C681: SKIPPER 2 | F681: MITCHELL 2 | I681: CROFT | K681: MURPHY | M681: GILBEE
A682: FRANKSTON | C682: CLARKE 2 | F682: BERRY | H682: PHIBBS | J682: ROBERTSON
A684: BYE | D684: TASMANIA
A686: ROUND 13 | D686: 3RD JULY | J686: WEATHER
D687: 1ST QTR | H687: 2ND QTR | L687: 3RD QTR | P687: FINAL | S687: Venue: NORTH HOBART OVAL
A688: TASMANIA | C688: 3 | D688: 3 | E688: =(C688*6)+D688 -> 21 | G688: 7 | H688: 4 | I688: =(G688*6)+H688 -> 46 | K688: 10 | L688: 5 | M688: =(K688*6)+L688 -> 65 | O688: 12 | P688: 5 | Q688: =(O688*6)+P688 -> 77 | S688: UMPIRES | Z688: LADDER | AC688: ROUND | AE688: 13
A689: NORTHERN BULLANTS | C689: 3 | D689: 0 | E689: =(C689*6)+D689 -> 18 | G689: 6 | H689: 0 | I689: =(G689*6)+H689 -> 36 | K689: 9 | L689: 3 | M689: =(K689*6)+L689 -> 57 | O689: 11 | P689: 6 | Q689: =(O689*6)+P689 -> 72
A690: BEST PLAYERS | W690: TEAM | X690: B | Y690: W | Z690: L | AA690: D | AB690: FOR | AC690: AGST | AD690: % | AE690: PTS
A691: TASMANIA | C691: ROBINSON | F691: B GEAPPEN | I691: BEAMS | L691: PLAPP | N691: STREET | Q691: BARTLETT
A692: NORTHERN BULLANTS | C692: HARFORD | F692: McCORMICK | I692: HOOPER | L692: BENTICK | N692: SIMPSON | Q692: ZORZI | W692: SANDRINGHAM | X692: 1 | Y692: 10 | Z692: 2 | AA692: 0 | AB692: 1213 | AC692: 875 | AD692: =(AB692/AC692)*100 -> 138.62857142857143 | AE692: =(Y692*4)+(AA692*2) -> 40
A693: GOALKICKERS | P693: LING | R693: HENLEY | W693: PORT MELBOURNE | X693: 1 | Y693: 10 | Z693: 2 | AA693: 0 | AB693: 1256 | AC693: 916 | AD693: =(AB693/AC693)*100 -> 137.11790393013101 | AE693: =(Y693*4)+(AA693*2) -> 40
A694: TASMANIA | C694: BLIGHT 2 | E694: BEAMS 2 | G694: B GEAPPEN | J694: ROBINSON | M694: BARTETT | O694: SAVAGE | Q694: RICHTER | S694: PLAPP | W694: NORTH BALLARAT | X694: 1 | Y694: 8 | Z694: 4 | AA694: 0 | AB694: 1076 | AC694: 896 | AD694: =(AB694/AC694)*100 -> 120.08928571428572 | AE694: =(Y694*4)+(AA694*2) -> 32
A695: NORTHERN BULLANTS | C695: MOTT 4 | F695: KENNA 3 | I695: VANSITTART | L695: LIVINGSTON | O695: SIMPSON | Q695: CLARKE | W695: TASMANIA | X695: 2 | Y695: 7 | Z695: 4 | AA695: 0 | AB695: 973 | AC695: 847 | AD695: =(AB695/AC695)*100 -> 114.87603305785123 | AE695: =(Y695*4)+(AA695*2) -> 28
P696: CARRAZZO | W696: WERRIBEE | X696: 1 | Y696: 7 | Z696: 5 | AA696: 0 | AB696: 988 | AC696: 922 | AD696: =(AB696/AC696)*100 -> 107.15835140997831 | AE696: =(Y696*4)+(AA696*2) -> 28
A697: NORTH BALLARAT | C697: 5 | D697: 2 | E697: =(C697*6)+D697 -> 32 | G697: 8 | H697: 6 | I697: =(G697*6)+H697 -> 54 | K697: 9 | L697: 12 | M697: =(K697*6)+L697 -> 66 | O697: 11 | P697: 17 | Q697: =(O697*6)+P697 -> 83 | S697: Venue: WERRIBEE | W697: GEELONG | X697: 1 | Y697: 6 | Z697: 6 | AA697: 0 | AB697: 1003 | AC697: 1017 | AD697: =(AB697/AC697)*100 -> 98.623402163225165 | AE697: =(Y697*4)+(AA697*2) -> 24
A698: WERRIBEE | C698: 3 | D698: 2 | E698: =(C698*6)+D698 -> 20 | G698: 6 | H698: 6 | I698: =(G698*6)+H698 -> 42 | K698: 9 | L698: 8 | M698: =(K698*6)+L698 -> 62 | O698: 10 | P698: 9 | Q698: =(O698*6)+P698 -> 69 | W698: COBURG | X698: 2 | Y698: 6 | Z698: 5 | AA698: 0 | AB698: 847 | AC698: 963 | AD698: =(AB698/AC698)*100 -> 87.954309449636554 | AE698: =(Y698*4)+(AA698*2) -> 24
A699: BEST PLAYERS | W699: BENDIGO | X699: 1 | Y699: 5 | Z699: 7 | AA699: 0 | AB699: 1137 | AC699: 1192 | AD699: =(AB699/AC699)*100 -> 95.385906040268452 | AE699: =(Y699*4)+(AA699*2) -> 20
A700: NORTH BALLARAT | C700: FIELD | F700: CLARKE | I700: HUTCHINSON | L700: MOLONEY | N700: BIDDISCOMBE | Q700: GREIG
A701: WERRIBEE | C701: SKIPPER | F701: GARLICK | I701: HENDERSON | L701: PODSIADLY | N701: CROFT | Q701: GLEESON | W701: BOX HILL | X701: 2 | Y701: 4 | Z701: 7 | AA701: 0 | AB701: 1000 | AC701: 1054 | AD701: =(AB701/AC701)*100 -> 94.876660341555976 | AE701: =(Y701*4)+(AA701*2) -> 16
A702: GOALKICKERS | Q702: FIELD | W702: WILLIAMSTOWN | X702: 1 | Y702: 4 | Z702: 8 | AA702: 0 | AB702: 904 | AC702: 1285 | AD702: =(AB702/AC702)*100 -> 70.350194552529189 | AE702: =(Y702*4)+(AA702*2) -> 16
A703: NORTH BALLARAT | C703: HUTCHINSON 2 | F703: TUCKEY 2 | I703: WHYMAN 2 | L703: GREIG | N703: CLARK | P703: GOODES | R703: DINNELL | W703: FRANKSTON | X703: 2 | Y703: 3 | Z703: 8 | AA703: 0 | AB703: 826 | AC703: 896 | AD703: =(AB703/AC703)*100 -> 92.1875 | AE703: =(Y703*4)+(AA703*2) -> 12
A704: WERRIBEE | C704: MITCHELL 3 | F704: WALSH 2 | I704: SKIPPER | K704: LAMB | M704: GLEESON | O704: FAULKNER | Q704: BASSETT | W704: NORTHERN BULLANTS | X704: 1 | Y704: 3 | Z704: 9 | AA704: 0 | AB704: 974 | AC704: 1115 | AD704: =(AB704/AC704)*100 -> 87.354260089686093 | AE704: =(Y704*4)+(AA704*2) -> 12
W705: SPRINGVALE | X705: 1 | Y705: 3 | Z705: 9 | AA705: 0 | AB705: 1012 | AC705: 1302 | AD705: =(AB705/AC705)*100 -> 77.726574500768052 | AE705: =(Y705*4)+(AA705*2) -> 12
A706: GEELONG | C706: 4 | D706: 3 | E706: =(C706*6)+D706 -> 27 | G706: 8 | H706: 6 | I706: =(G706*6)+H706 -> 54 | K706: 13 | L706: 11 | M706: =(K706*6)+L706 -> 89 | O706: 15 | P706: 13 | Q706: =(O706*6)+P706 -> 103 | S706: Venue: SHELL STADIUM
A707: SPRINGVALE | C707: 2 | D707: 4 | E707: =(C707*6)+D707 -> 16 | G707: 7 | H707: 6 | I707: =(G707*6)+H707 -> 48 | K707: 10 | L707: 6 | M707: =(K707*6)+L707 -> 66 | O707: 14 | P707: 13 | Q707: =(O707*6)+P707 -> 97
A708: BEST PLAYERS
A709: GEELONG | C709: CALLAN | F709: FOSTER | I709: KOULOURIOTIS | L709: J BYRNE | O709: CHAMBERS | R709: SPRIGGS
A710: SPRINGVALE | C710: S FISHER | F710: HARRISON | I710: HEENAN | L710: BRUIN | O710: PECKETT
A711: GOALKICKERS
A712: GEELONG | C712: SPRIGGS 3 | E712: BYRNES 2 | G712: GARDINER 2 | J712: GREAVES 2 | M712: KOULOURIOTIS 2 | Q712: J BYRNE | S712: CHAMBERS | W712: LONERGAN | Y712: McCARTHY
A713: SPRINGVALE | C713: S FISHER 5 | F713: WULF 3 | I713: HARRISON 2 | L713: MONTAGNA 2 | O713: BRUIN | Q713: PECKETT
D714: 4TH JULY | J714: WEATHER
A715: BOX HILL | C715: 6 | D715: 6 | E715: =(C715*6)+D715 -> 42 | G715: 9 | H715: 7 | I715: =(G715*6)+H715 -> 61 | K715: 13 | L715: 13 | M715: =(K715*6)+L715 -> 91 | O715: 16 | P715: 15 | Q715: =(O715*6)+P715 -> 111 | S715: Venue: BENDIGO
A716: BENDIGO | C716: 1 | D716: 3 | E716: =(C716*6)+D716 -> 9 | G716: 3 | H716: 5 | I716: =(G716*6)+H716 -> 23 | K716: 5 | L716: 8 | M716: =(K716*6)+L716 -> 38 | O716: 9 | P716: 14 | Q716: =(O716*6)+P716 -> 68
A717: BEST PLAYERS
A718: BOX HILL | C718: HOLLAND | F718: BAILEY | I718: PUGSLEY | L718: SHELTON | O718: BARKER | R718: COX
A719: BENDIGO | C719: BOWEN | F719: PEREZ | I719: ROSA | L719: DOERING | O719: MOORCROFT | R719: ALVEY
A720: GOALKICKERS
A721: BOX HILL | C721: HOLLAND 4 | F721: ALLEWAY 2 | I721: SHELTON 2 | L721: BAILEY | N721: BARKER | P721: CLIFTON | R721: COLLINS | U721: COX | W721: NEAGLE | X721: WEINERT | AA721: RIX
A722: BENDIGO | C722: NASH 2 | F722: WILSON | I722: DOERING | K722: BRADLEY | M722: ALVEY | O722: WATSON | Q722: MOORCROFT | U722: SUMMERS
A724: SANDRINGHAM | C724: 1 | D724: 4 | E724: =(C724*6)+D724 -> 10 | G724: 7 | H724: 7 | I724: =(G724*6)+H724 -> 49 | K724: 8 | L724: 12 | M724: =(K724*6)+L724 -> 60 | O724: 19 | P724: 18 | Q724: =(O724*6)+P724 -> 132 | S724: Venue: BEACH ROAD
A725: WILLIAMSTOWN | C725: 5 | D725: 2 | E725: =(C725*6)+D725 -> 32 | G725: 6 | H725: 3 | I725: =(G725*6)+H725 -> 39 | K725: 9 | L725: 5 | M725: =(K725*6)+L725 -> 59 | O725: 9 | P725: 5 | Q725: =(O725*6)+P725 -> 59
A726: BEST PLAYERS
A727: SANDRINGHAM | C727: O'KEEFE | F727: SYLVIA | I727: FISHER | L727: CROWE | N727: BIDDLECOMBE | Q727: RIGONI
A728: WILLIAMSTOWN | C728: CROW | F728: KINNEAR | I728: WEST | L728: MAXWELL | N728: R SHAW | Q728: B SHAW
A729: GOALKICKERS
A730: SANDRINGHAM | C730: SYLVIA 7 | F730: SAUTNER 2 | I730: FISHER 2 | L730: GALLAGHER 2 | O730: CROWE 2 | Q730: JOLLY | S730: MILLS | V730: NEWMAN | X730: GODFREY
A731: WILLIAMSTOWN | C731: KINNEAR 6 | F731: JARRAD | I731: McGOUGH | L731: MULLINS
A733: PORT MELBOURNE | C733: 3 | D733: 1 | E733: =(C733*6)+D733 -> 19 | G733: 6 | H733: 5 | I733: =(G733*6)+H733 -> 41 | K733: 12 | L733: 8 | M733: =(K733*6)+L733 -> 80 | O733: 14 | P733: 10 | Q733: =(O733*6)+P733 -> 94 | S733: Venue: COBURG
A734: COBURG | C734: 3 | D734: 2 | E734: =(C734*6)+D734 -> 20 | G734: 5 | H734: 7 | I734: =(G734*6)+H734 -> 37 | K734: 6 | L734: 9 | M734: =(K734*6)+L734 -> 45 | O734: 8 | P734: 17 | Q734: =(O734*6)+P734 -> 65
A735: BEST PLAYERS
A736: PORT MELBOURNE | C736: BAIRD | F736: HARVEY | I736: S CLAYTON | L736: WATSON | N736: URCH | Q736: PITT
A737: COBURG | C737: JACKSON | F737: O'CONNOR | I737: PAGAN | L737: RAYSON | N737: CARLSON
A738: GOALKICKERS
A739: PORT MELBOURNE | C739: McKERNAN 3 | F739: JONES 2 | I739: S HARVEY 2 | L739: HALE | N739: OBST | P739: SCHWARZE | R739: TROTTER | V739: PITT | X739: S CLAYTON | AA739: GRIMA
A740: COBURG | C740: O'CONNOR 3 | F740: HOULIHAN 2 | I740: ROACH | K740: HARTIGAN | N740: RAINES
A742: BYE | D742: FRANKSTON
A744: ROUND 14 | D744: 10TH JULY | J744: WEATHER
D745: 1ST QTR | H745: 2ND QTR | L745: 3RD QTR | P745: FINAL | S745: Venue: WERRIBEE
A746: NORTHERN BULLANTS | C746: 6 | D746: 1 | E746: =(C746*6)+D746 -> 37 | G746: 7 | H746: 3 | I746: =(G746*6)+H746 -> 45 | K746: 11 | L746: 5 | M746: =(K746*6)+L746 -> 71 | O746: 13 | P746: 5 | Q746: =(O746*6)+P746 -> 83 | S746: UMPIRES | Z746: LADDER | AC746: ROUND | AE746: 14
A747: WERRIBEE | C747: 4 | D747: 3 | E747: =(C747*6)+D747 -> 27 | G747: 6 | H747: 8 | I747: =(G747*6)+H747 -> 44 | K747: 8 | L747: 13 | M747: =(K747*6)+L747 -> 61 | O747: 9 | P747: 21 | Q747: =(O747*6)+P747 -> 75
A748: BEST PLAYERS | W748: TEAM | X748: B | Y748: W | Z748: L | AA748: D | AB748: FOR | AC748: AGST | AD748: % | AE748: PTS
A749: NORTHERN BULLANTS | C749: HARFORD | F749: ZORZI | I749: CARRAZZO | L749: BENTICK | O749: STEVENSON | R749: LIVINGSTON
A750: WERRIBEE | C750: CROFT | F750: BIRSS | I750: BASSETT | W750: SANDRINGHAM | X750: 1 | Y750: 11 | Z750: 2 | AA750: 0 | AB750: 1342 | AC750: 941 | AD750: =(AB750/AC750)*100 -> 142.61424017003188 | AE750: =(Y750*4)+(AA750*2) -> 44
A751: GOALKICKERS | W751: PORT MELBOURNE | X751: 1 | Y751: 10 | Z751: 3 | AA751: 0 | AB751: 1352 | AC751: 1074 | AD751: =(AB751/AC751)*100 -> 125.88454376163874 | AE751: =(Y751*4)+(AA751*2) -> 40
A752: NORTHERN BULLANTS | C752: KENNA 4 | F752: MOTT 4 | I752: ZORZI 2 | L752: BENTICK | N752: DAV CLARKE | Q752: COLBERT | W752: TASMANIA | X752: 2 | Y752: 8 | Z752: 4 | AA752: 0 | AB752: 1084 | AC752: 927 | AD752: =(AB752/AC752)*100 -> 116.93635382955772 | AE752: =(Y752*4)+(AA752*2) -> 32
A753: WERRIBEE | C753: COONEY 3 | F753: BASSETT | I753: BIRSS | K753: GLEESON | M753: HARGRAVES | P753: MITCHELL | R753: WALSH | W753: NORTH BALLARAT | X753: 1 | Y753: 8 | Z753: 5 | AA753: 0 | AB753: 1156 | AC753: 1007 | AD753: =(AB753/AC753)*100 -> 114.79642502482621 | AE753: =(Y753*4)+(AA753*2) -> 32
D754: 11TH JULY | J754: WEATHER | W754: WERRIBEE | X754: 1 | Y754: 7 | Z754: 6 | AA754: 0 | AB754: 1063 | AC754: 1005 | AD754: =(AB754/AC754)*100 -> 105.77114427860697 | AE754: =(Y754*4)+(AA754*2) -> 28
A755: COBURG | C755: 6 | D755: 2 | E755: =(C755*6)+D755 -> 38 | G755: 12 | H755: 4 | I755: =(G755*6)+H755 -> 76 | K755: 18 | L755: 4 | M755: =(K755*6)+L755 -> 112 | O755: 23 | P755: 7 | Q755: =(O755*6)+P755 -> 145 | S755: Venue: BOX HILL | W755: GEELONG | X755: 1 | Y755: 7 | Z755: 6 | AA755: 0 | AB755: 1110 | AC755: 1078 | AD755: =(AB755/AC755)*100 -> 102.96846011131726 | AE755: =(Y755*4)+(AA755*2) -> 28
A756: BOX HILL | C756: 0 | D756: 1 | E756: =(C756*6)+D756 -> 1 | G756: 2 | H756: 5 | I756: =(G756*6)+H756 -> 17 | K756: 5 | L756: 10 | M756: =(K756*6)+L756 -> 40 | O756: 11 | P756: 14 | Q756: =(O756*6)+P756 -> 80 | W756: COBURG | X756: 2 | Y756: 7 | Z756: 5 | AA756: 0 | AB756: 992 | AC756: 1043 | AD756: =(AB756/AC756)*100 -> 95.110258868648131 | AE756: =(Y756*4)+(AA756*2) -> 28
A757: BEST PLAYERS | W757: BENDIGO | X757: 2 | Y757: 5 | Z757: 7 | AA757: 0 | AB757: 1137 | AC757: 1192 | AD757: =(AB757/AC757)*100 -> 95.385906040268452 | AE757: =(Y757*4)+(AA757*2) -> 20
A758: COBURG | C758: GILMOUR | F758: RAINES | I758: O'CONNOR | L758: ROACH | O758: CARLSON | R758: RODAN
A759: BOX HILL | C759: BARKER | F759: TALLIS | I759: WILSON | L759: BATCHELOR | O759: RIX | W759: WILLIAMSTOWN | X759: 1 | Y759: 5 | Z759: 8 | AA759: 0 | AB759: 1062 | AC759: 1381 | AD759: =(AB759/AC759)*100 -> 76.900796524257785 | AE759: =(Y759*4)+(AA759*2) -> 20
A760: GOALKICKERS | G760: RAINES | I760: ROACH | K760: O'CONNOR | N760: FIORA | P760: RANDELLO | R760: FOLEY | W760: BOX HILL | X760: 2 | Y760: 4 | Z760: 8 | AA760: 0 | AB760: 1080 | AC760: 1199 | AD760: =(AB760/AC760)*100 -> 90.075062552126766 | AE760: =(Y760*4)+(AA760*2) -> 16
A761: COBURG | C761: GILMOUR 7 | F761: HOULIHAN 3 | I761: MARSH 2 | K761: DRAGICEVIC 2 | N761: CARLSON | P761: JORGENSON | R761: RODAN | W761: NORTHERN BULLANTS | X761: 1 | Y761: 4 | Z761: 9 | AA761: 0 | AB761: 1057 | AC761: 1190 | AD761: =(AB761/AC761)*100 -> 88.823529411764696 | AE761: =(Y761*4)+(AA761*2) -> 16
A762: BOX HILL | C762: BARKER 3 | F762: HOLLAND 2 | I762: PUGSLEY 2 | L762: COLLINS | N762: LADSON | P762: TALLIS | R762: TAYLOR | W762: FRANKSTON | X762: 2 | Y762: 3 | Z762: 9 | AA762: 0 | AB762: 887 | AC762: 1003 | AD762: =(AB762/AC762)*100 -> 88.434695912263209 | AE762: =(Y762*4)+(AA762*2) -> 12
W763: SPRINGVALE | X763: 1 | Y763: 3 | Z763: 10 | AA763: 0 | AB763: 1078 | AC763: 1431 | AD763: =(AB763/AC763)*100 -> 75.3319357092942 | AE763: =(Y763*4)+(AA763*2) -> 12
A764: SANDRINGHAM | C764: 5 | D764: 7 | E764: =(C764*6)+D764 -> 37 | G764: 5 | H764: 10 | I764: =(G764*6)+H764 -> 40 | K764: 14 | L764: 14 | M764: =(K764*6)+L764 -> 98 | O764: 19 | P764: 15 | Q764: =(O764*6)+P764 -> 129 | S764: Venue: SPRINGVALE
A765: SPRINGVALE | C765: 2 | D765: 0 | E765: =(C765*6)+D765 -> 12 | G765: 4 | H765: 8 | I765: =(G765*6)+H765 -> 32 | K765: 4 | L765: 9 | M765: =(K765*6)+L765 -> 33 | O765: 9 | P765: 12 | Q765: =(O765*6)+P765 -> 66
A766: BEST PLAYERS
A767: SANDRINGHAM | C767: JOLLY | F767: RIGONI | I767: MILLS | L767: FISHER | N767: FERGUSON | Q767: GALLAGHER
A768: SPRINGVALE | C768: BRUIN | F768: F FREDERICKS | I768: PECKETT | L768: HARRISON
A769: GOALKICKERS
A770: SANDRINGHAM | C770: SAUTNER 5 | F770: GALLAGHER 4 | I770: FERGUSON 2 | L770: O'KEEFE 2 | N770: MILLS | P770: JAMAR | R770: FISHER | U770: LIDDELL | X770: WILLIAMS | AA770: HALL
A771: SPRINGVALE | C771: BRUIN 2 | F771: RAFFERTY 2 | I771: WULF 2 | L771: S FREDERICKS | O771: MORSE | Q771: PECKETT
A773: WILLIAMSTOWN | C773: 8 | D773: 3 | E773: =(C773*6)+D773 -> 51 | G773: 12 | H773: 7 | I773: =(G773*6)+H773 -> 79 | K773: 21 | L773: 9 | M773: =(K773*6)+L773 -> 135 | O773: 24 | P773: 14 | Q773: =(O773*6)+P773 -> 158 | S773: Venue: WERRIBEE
A774: PORT MELBOURNE | C774: 4 | D774: 1 | E774: =(C774*6)+D774 -> 25 | G774: 10 | H774: 8 | I774: =(G774*6)+H774 -> 68 | K774: 11 | L774: 9 | M774: =(K774*6)+L774 -> 75 | O774: 14 | P774: 12 | Q774: =(O774*6)+P774 -> 96
A775: BEST PLAYERS
A776: WILLIAMSTOWN | C776: CROW | F776: LLOYD | I776: McGOUGH | L776: R SHAW | N776: WILLIAMS | Q776: SHACKLETON
A777: PORT MELBOURNE | C777: LAWRENCE | F777: S CLAYTON | I777: SANSBURY
A778: GOALKICKERS | W778: WALKER
A779: WILLIAMSTOWN | C779: LLOYD 4 | E779: KING 4 | G779: B SHAW 2 | I779: MULLINS 2 | L779: CRANAGE 2 | O779: KINNEAR 2 | Q779: H SHAW 2 | T779: JARRAD | W779: LOKAN | X779: SMOKER | AA779: R SHAW | AC779: SHACKLETON
A780: PORT MELBOURNE | C780: URCH 2 | E780: SCHWARZE 2 | H780: PITT | I780: HALE | J780: TROTTER | L780: JONES | N780: LAWRENCE | Q780: S CLAYTON | T780: S HARVEY | X780: McKERNAN | AA780: SANSBURY | AD780: COTCHETT
A782: GEELONG | C782: 4 | D782: 4 | E782: =(C782*6)+D782 -> 28 | G782: 7 | H782: 5 | I782: =(G782*6)+H782 -> 47 | K782: 14 | L782: 9 | M782: =(K782*6)+L782 -> 93 | O782: 16 | P782: 11 | Q782: =(O782*6)+P782 -> 107 | S782: Venue: FRANKSTON
A783: FRANKSTON | C783: 2 | D783: 4 | E783: =(C783*6)+D783 -> 16 | G783: 4 | H783: 8 | I783: =(G783*6)+H783 -> 32 | K783: 6 | L783: 9 | M783: =(K783*6)+L783 -> 45 | O783: 8 | P783: 13 | Q783: =(O783*6)+P783 -> 61
A784: BEST PLAYERS
A785: GEELONG | C785: RAHILLY | F785: FOSTER | I785: HAYNES | L785: J BYRNE | O785: BUCKLAND | R785: COOK
A786: FRANKSTON | C786: CLARKE | F786: ABLETT | I786: WINTERTON | L786: MINCHINGTON
A787: GOALKICKERS
A788: GEELONG | C788: LONERGAN 5 | F788: S BYRNES 3 | I788: McCARTHY 3 | L788: JORDAN 2 | N788: J BYRNE | P788: COOK | R788: SPRIGGS
A789: FRANKSTON | C789: CLARKE 2 | F789: MARIGLIANI 2 | J789: POLLARD 2 | M789: BRYAN | O789: WINTERTON
A791: TASMANIA | C791: 7 | D791: 1 | E791: =(C791*6)+D791 -> 43 | G791: 11 | H791: 5 | I791: =(G791*6)+H791 -> 71 | K791: 13 | L791: 10 | M791: =(K791*6)+L791 -> 88 | O791: 16 | P791: 15 | Q791: =(O791*6)+P791 -> 111 | S791: NORTH BALLARAT
A792: NORTH BALLARAT | C792: 4 | D792: 0 | E792: =(C792*6)+D792 -> 24 | G792: 6 | H792: 1 | I792: =(G792*6)+H792 -> 37 | K792: 9 | L792: 3 | M792: =(K792*6)+L792 -> 57 | O792: 12 | P792: 8 | Q792: =(O792*6)+P792 -> 80
A793: BEST PLAYERS
A794: TASMANIA | C794: ROBINSON | F794: ATKIN | I794: JOVANOVIC | L794: PLAPP | O794: PETERSON | R794: WALKER
A795: NORTH BALLARAT | C795: HUTCHINSON | F795: FIELD | I795: CLARK | L795: WHYMAN | O795: SAUNDERS
A796: GOALKICKERS
A797: TASMANIA | C797: PLAPP 6 | E797: CALLINAN 2 | H797: HALL 2 | J797: ATKIN | L797: ROBINSON | O797: BLIGHT | Q797: BEAMS | S797: HENLEY | U797: LING
A798: NORTH BALLARAT | C798: McMAHON 3 | F798: WHYMAN 3 | I798: FOOTT 2 | L798: SAUNDERS 2 | O798: BYE | Q798: GOODES
A800: BYE | D800: BENDIGO
A802: ROUND 15 | D802: 17TH JULY | J802: WEATHER
D803: 1ST QTR | H803: 2ND QTR | L803: 3RD QTR | P803: FINAL | S803: Venue: BEACH ROAD
A804: BOX HILL | C804: 5 | D804: 4 | E804: =(C804*6)+D804 -> 34 | G804: 6 | H804: 6 | I804: =(G804*6)+H804 -> 42 | K804: 9 | L804: 9 | M804: =(K804*6)+L804 -> 63 | O804: 11 | P804: 11 | Q804: =(O804*6)+P804 -> 77 | S804: UMPIRES | Z804: LADDER | AC804: ROUND | AE804: 15
A805: SANDRINGHAM | C805: 1 | D805: 2 | E805: =(C805*6)+D805 -> 8 | G805: 2 | H805: 6 | I805: =(G805*6)+H805 -> 18 | K805: 5 | L805: 6 | M805: =(K805*6)+L805 -> 36 | O805: 8 | P805: 8 | Q805: =(O805*6)+P805 -> 56
A806: BEST PLAYERS | W806: TEAM | X806: B | Y806: W | Z806: L | AA806: D | AB806: FOR | AC806: AGST | AD806: % | AE806: PTS
A807: BOX HILL | C807: PICIAONE | F807: LADSON | I807: HOLLAND | L807: HEIGHT | O807: RIX | Q807: SHELTON
A808: SANDRINGHAM | C808: BIZZELL | F808: ARMSTRONG | I808: C LIDDELL | L808: JOLLY | O808: JAMAR | Q808: CROWE | W808: SANDRINGHAM | X808: 1 | Y808: 11 | Z808: 3 | AA808: 0 | AB808: 1398 | AC808: 1018 | AD808: =(AB808/AC808)*100 -> 137.32809430255404 | AE808: =(Y808*4)+(AA808*2) -> 44
A809: GOALKICKERS | W809: PORT MELBOURNE | X809: 1 | Y809: 11 | Z809: 3 | AA809: 0 | AB809: 1511 | AC809: 1153 | AD809: =(AB809/AC809)*100 -> 131.0494362532524 | AE809: =(Y809*4)+(AA809*2) -> 44
A810: BOX HILL | C810: LADSON 3 | F810: BATCHELOR 2 | I810: HEIGHT 2 | L810: ALLEWAY | N810: BAILEY | P810: HOLLAND | R810: TAYLOR | W810: TASMANIA | X810: 2 | Y810: 9 | Z810: 4 | AA810: 0 | AB810: 1160 | AC810: 1000 | AD810: =(AB810/AC810)*100 -> 116 | AE810: =(Y810*4)+(AA810*2) -> 36
A811: SANDRINGHAM | C811: SAUTNER 3 | F811: GALLAGHER | I811: C LIDDELL | L811: HUNTER | N811: NEWMAN | Q811: BIZZELL | W811: NORTH BALLARAT | X811: 1 | Y811: 8 | Z811: 6 | AA811: 0 | AB811: 1219 | AC811: 1128 | AD811: =(AB811/AC811)*100 -> 108.06737588652481 | AE811: =(Y811*4)+(AA811*2) -> 32
W812: COBURG | X812: 2 | Y812: 8 | Z812: 5 | AA812: 0 | AB812: 1092 | AC812: 1120 | AD812: =(AB812/AC812)*100 -> 97.5 | AE812: =(Y812*4)+(AA812*2) -> 32
A813: TASMANIA | C813: 2 | D813: 0 | E813: =(C813*6)+D813 -> 12 | G813: 5 | H813: 2 | I813: =(G813*6)+H813 -> 32 | K813: 6 | L813: 8 | M813: =(K813*6)+L813 -> 44 | O813: 11 | P813: 10 | Q813: =(O813*6)+P813 -> 76 | S813: Venue: NORTH HOBART OVAL | W813: WERRIBEE | X813: 2 | Y813: 7 | Z813: 6 | AA813: 0 | AB813: 1063 | AC813: 1005 | AD813: =(AB813/AC813)*100 -> 105.77114427860697 | AE813: =(Y813*4)+(AA813*2) -> 28
A814: GEELONG | C814: 3 | D814: 7 | E814: =(C814*6)+D814 -> 25 | G814: 7 | H814: 10 | I814: =(G814*6)+H814 -> 52 | K814: 8 | L814: 11 | M814: =(K814*6)+L814 -> 59 | O814: 10 | P814: 13 | Q814: =(O814*6)+P814 -> 73 | W814: GEELONG | X814: 1 | Y814: 7 | Z814: 7 | AA814: 0 | AB814: 1183 | AC814: 1154 | AD814: =(AB814/AC814)*100 -> 102.51299826689775 | AE814: =(Y814*4)+(AA814*2) -> 28
A815: BEST PLAYERS | W815: BOX HILL | X815: 2 | Y815: 5 | Z815: 8 | AA815: 0 | AB815: 1157 | AC815: 1255 | AD815: =(AB815/AC815)*100 -> 92.191235059760956 | AE815: =(Y815*4)+(AA815*2) -> 20
A816: TASMANIA | C816: B GEAPPEN | F816: ROBINSON | I816: CALLINAN | L816: CARELESS | O816: PAULL | Q816: LING
A817: GEELONG | C817: ENRIGHT | F817: EGAN | I817: FOSTER | L817: BUCKLAND | O817: SPRIGGS | W817: NORTHERN BULLANTS | X817: 1 | Y817: 5 | Z817: 9 | AA817: 0 | AB817: 1157 | AC817: 1272 | AD817: =(AB817/AC817)*100 -> 90.959119496855351 | AE817: =(Y817*4)+(AA817*2) -> 20
A818: GOALKICKERS | W818: BENDIGO | X818: 2 | Y818: 5 | Z818: 8 | AA818: 0 | AB818: 1216 | AC818: 1351 | AD818: =(AB818/AC818)*100 -> 90.007401924500371 | AE818: =(Y818*4)+(AA818*2) -> 20
A819: TASMANIA | C819: CALLINAN 4 | F819: B GEAPPEN 2 | J819: TUPP 2 | M819: LING 2 | O819: BARTLETT | W819: WILLIAMSTOWN | X819: 1 | Y819: 5 | Z819: 9 | AA819: 0 | AB819: 1144 | AC819: 1481 | AD819: =(AB819/AC819)*100 -> 77.245104659014174 | AE819: =(Y819*4)+(AA819*2) -> 20
A820: GEELONG | C820: HAYNES 3 | F820: THURLEY 3 | J820: BYRNE | L820: KOULORIOTIS | O820: LONERGAN | R820: SPRIGGS | W820: FRANKSTON | X820: 2 | Y820: 4 | Z820: 9 | AA820: 0 | AB820: 1008 | AC820: 1066 | AD820: =(AB820/AC820)*100 -> 94.55909943714822 | AE820: =(Y820*4)+(AA820*2) -> 16
D821: 18TH JULY | J821: WEATHER | W821: SPRINGVALE | X821: 1 | Y821: 3 | Z821: 11 | AA821: 0 | AB821: 1155 | AC821: 1531 | AD821: =(AB821/AC821)*100 -> 75.440888308295229 | AE821: =(Y821*4)+(AA821*2) -> 12
A822: COBURG | C822: 4 | D822: 4 | E822: =(C822*6)+D822 -> 28 | G822: 8 | H822: 7 | I822: =(G822*6)+H822 -> 55 | K822: 13 | L822: 8 | M822: =(K822*6)+L822 -> 86 | O822: 15 | P822: 10 | Q822: =(O822*6)+P822 -> 100 | S822: Venue: SPRINGVALE
A823: SPRINGVALE | C823: 4 | D823: 0 | E823: =(C823*6)+D823 -> 24 | G823: 6 | H823: 1 | I823: =(G823*6)+H823 -> 37 | K823: 10 | L823: 2 | M823: =(K823*6)+L823 -> 62 | O823: 12 | P823: 5 | Q823: =(O823*6)+P823 -> 77
A824: BEST PLAYERS
A825: COBURG | C825: DRAGESEVIC | F825: MARSH | I825: FOLEY | L825: CHAFFEY | O825: O'CONNOR | R825: RAINES
A826: SPRINGVALE | C826: X CLARKE | F826: MURRAY | I826: HARRISON | L826: CARROLL | O826: BROOKS
A827: GOALKICKERS
A828: COBURG | C828: DRAGISEVIC 3 | F828: JORGENSON 2 | I828: MARSH 2 | K828: GILMOUR 2 | N828: CARLSON 2 | Q828: RAINES | S828: TALBOT | V828: CHAFFEY | X828: NICHOLS
A829: SPRINGVALE | C829: MURRAY 5 | F829: BROOKS 2 | I829: R CLARKE | L829: HOULIHAN | N829: TAYLOR | P829: X CLARKE | R829: MORSE
A831: NORTHERN BULLANTS | C831: 6 | D831: 1 | E831: =(C831*6)+D831 -> 37 | G831: 10 | H831: 4 | I831: =(G831*6)+H831 -> 64 | K831: 15 | L831: 8 | M831: =(K831*6)+L831 -> 98 | O831: 15 | P831: 10 | Q831: =(O831*6)+P831 -> 100 | S831: Venue: PRESTON
A832: WILLIAMSTOWN | C832: 3 | D832: 0 | E832: =(C832*6)+D832 -> 18 | G832: 7 | H832: 6 | I832: =(G832*6)+H832 -> 48 | K832: 7 | L832: 9 | M832: =(K832*6)+L832 -> 51 | O832: 11 | P832: 16 | Q832: =(O832*6)+P832 -> 82
A833: BEST PLAYERS
A834: NORTHERN BULLANTS | C834: CARRAZZO | F834: MOTT | I834: ZORZI | L834: HARFORD | O834: DAV CLARKE | R834: VANSITTART
A835: WILLIAMSTOWN | C835: THEODORE | F835: LLOYD | I835: CRANAGE | L835: WILLIAMS | O835: JARRAD | R835: CROW
A836: GOALKICKERS
A837: NORTHERN BULLANTS | C837: MOTT 4 | F837: HOOPER 3 | I837: ZORZI 2 | K837: KENNA | M837: HARFORD | O837: PLEMING | Q837: VANSITTART | U837: RASO | W837: WAITE
A838: WILLIAMSTOWN | C838: KING 3 | F838: MORRISON 2 | I838: PEARCE 2 | L838: LLOYD | N838: SHEEHAN | Q838: B SHAW | S838: H SHAW
A840: PORT MELBOURNE | C840: 7 | D840: 8 | E840: =(C840*6)+D840 -> 50 | G840: 12 | H840: 12 | I840: =(G840*6)+H840 -> 84 | K840: 19 | L840: 14 | M840: =(K840*6)+L840 -> 128 | O840: 24 | P840: 15 | Q840: =(O840*6)+P840 -> 159 | S840: Venue: PORT MELBOURNE
A841: BENDIGO | C841: 2 | D841: 3 | E841: =(C841*6)+D841 -> 15 | G841: 5 | H841: 7 | I841: =(G841*6)+H841 -> 37 | K841: 8 | L841: 8 | M841: =(K841*6)+L841 -> 56 | O841: 11 | P841: 13 | Q841: =(O841*6)+P841 -> 79
A842: BEST PLAYERS
A843: PORT MELBOURNE | C843: HALE | F843: BAIRD | I843: LECRAS | L843: S CLAYTON | O843: WATSON | R843: McKERNAN
A844: BENDIGO | C844: DOERING | F844: HUNT | I844: NASH | L844: MOORCROFT | O844: ROBBINS | R844: LAYCOCK
A845: GOALKICKERS
A846: PORT MELBOURNE | C846: HALE 5 | E846: ALOI 3 | G846: HARDING 3 | J846: S CLAYTON 3 | M846: McKERNAN 3 | P846: SANSBURY 2 | S846: GRIMA 2 | V846: McMAHON | X846: JONES | Z846: COTCHETT
A847: BENDIGO | C847: MOORCROFT 2 | F847: ROBBINS 2 | I847: HUNT 2 | K847: WALSH | M847: SUMMERS | O847: CARTER | Q847: NASH | S847: FITZGERALD
A849: FRANKSTON | C849: 3 | D849: 4 | E849: =(C849*6)+D849 -> 22 | G849: 7 | H849: 9 | I849: =(G849*6)+H849 -> 51 | K849: 10 | L849: 11 | M849: =(K849*6)+L849 -> 71 | O849: 18 | P849: 13 | Q849: =(O849*6)+P849 -> 121 | S849: Venue: FRANKSTON
A850: NORTH BALLARAT | C850: 5 | D850: 2 | E850: =(C850*6)+D850 -> 32 | G850: 7 | H850: 3 | I850: =(G850*6)+H850 -> 45 | K850: 10 | L850: 3 | M850: =(K850*6)+L850 -> 63 | O850: 10 | P850: 3 | Q850: =(O850*6)+P850 -> 63
A851: BEST PLAYERS
A852: FRANKSTON | C852: ROBERTS | F852: WINTERTON | I852: ANSTEY | L852: LITTLECHILD | O852: BREWSTER | R852: MURPHY
A853: NORTH BALLARAT | C853: MOLONEY | F853: TAYLOR | I853: WHYMAN
A854: GOALKICKERS
A855: FRANKSTON | C855: PHIBBS 3 | E855: MARIGLIANI 3 | H855: WINTERTON 3 | K855: McCORMICK 2 | N855: BERRY | P855: FORTNAM | R855: BRYAN | U855: HUNTER | X855: ROBERTSON | AA855: CLARKE | AC855: LOUREY
A856: NORTH BALLARAT | C856: WHYMAN 4 | F856: SAUNDERS 2 | I856: TUCKEY 2 | L856: HUTCHINSON | O856: McMAHON
A858: BYE | D858: WERRIBEE
A860: ROUND 16 | D860: 24TH JULY | J860: WEATHER
D861: 1ST QTR | H861: 2ND QTR | L861: 3RD QTR | P861: FINAL | S861: Venue: BENDIGO
A862: WERRIBEE | C862: 3 | D862: 2 | E862: =(C862*6)+D862 -> 20 | G862: 8 | H862: 6 | I862: =(G862*6)+H862 -> 54 | K862: 11 | L862: 10 | M862: =(K862*6)+L862 -> 76 | O862: 14 | P862: 12 | Q862: =(O862*6)+P862 -> 96 | S862: UMPIRES | Z862: LADDER | AC862: ROUND | AE862: 16
A863: BENDIGO | C863: 1 | D863: 1 | E863: =(C863*6)+D863 -> 7 | G863: 2 | H863: 1 | I863: =(G863*6)+H863 -> 13 | K863: 2 | L863: 2 | M863: =(K863*6)+L863 -> 14 | O863: 4 | P863: 3 | Q863: =(O863*6)+P863 -> 27
A864: BEST PLAYERS | W864: TEAM | X864: B | Y864: W | Z864: L | AA864: D | AB864: FOR | AC864: AGST | AD864: % | AE864: PTS
A865: WERRIBEE | C865: HARRISON | F865: GARLICK | I865: BANDY | L865: WIGGINS | O865: MORGAN | R865: MURPHY
A866: BENDIGO | C866: MOORCROFT | F866: CARTER | I866: DOERING | L866: ROSA | O866: WILSON | R866: ALVEY | W866: SANDRINGHAM | X866: 2 | Y866: 11 | Z866: 3 | AA866: 0 | AB866: 1398 | AC866: 1018 | AD866: =(AB866/AC866)*100 -> 137.32809430255404 | AE866: =(Y866*4)+(AA866*2) -> 44
A867: GOALKICKERS | W867: PORT MELBOURNE | X867: 2 | Y867: 11 | Z867: 3 | AA867: 0 | AB867: 1511 | AC867: 1153 | AD867: =(AB867/AC867)*100 -> 131.0494362532524 | AE867: =(Y867*4)+(AA867*2) -> 44
A868: WERRIBEE | C868: WIGGINS 3 | F868: PODSIADLY 3 | I868: MITCHELL 3 | L868: LAMB 2 | N868: GARLICK | P868: FAULKNER | S868: BANDY | W868: TASMANIA | X868: 2 | Y868: 9 | Z868: 5 | AA868: 0 | AB868: 1216 | AC868: 1082 | AD868: =(AB868/AC868)*100 -> 112.38447319778189 | AE868: =(Y868*4)+(AA868*2) -> 36
A869: BENDIGO | C869: MOORCROFT | F869: CUPIDO | I869: LOVETT | K869: BROWN | W869: NORTH BALLARAT | X869: 1 | Y869: 9 | Z869: 6 | AA869: 0 | AB869: 1300 | AC869: 1194 | AD869: =(AB869/AC869)*100 -> 108.87772194304857 | AE869: =(Y869*4)+(AA869*2) -> 36
W870: COBURG | X870: 2 | Y870: 9 | Z870: 5 | AA870: 0 | AB870: 1174 | AC870: 1176 | AD870: =(AB870/AC870)*100 -> 99.829931972789126 | AE870: =(Y870*4)+(AA870*2) -> 36
A871: NORTH BALLARAT | C871: 3 | D871: 2 | E871: =(C871*6)+D871 -> 20 | G871: 5 | H871: 3 | I871: =(G871*6)+H871 -> 33 | K871: 7 | L871: 5 | M871: =(K871*6)+L871 -> 47 | O871: 12 | P871: 9 | Q871: =(O871*6)+P871 -> 81 | S871: Venue: SHELL STADIUM | W871: WERRIBEE | X871: 2 | Y871: 8 | Z871: 6 | AA871: 0 | AB871: 1159 | AC871: 1032 | AD871: =(AB871/AC871)*100 -> 112.3062015503876 | AE871: =(Y871*4)+(AA871*2) -> 32
A872: GEELONG | C872: 1 | D872: 4 | E872: =(C872*6)+D872 -> 10 | G872: 1 | H872: 6 | I872: =(G872*6)+H872 -> 12 | K872: 6 | L872: 9 | M872: =(K872*6)+L872 -> 45 | O872: 9 | P872: 12 | Q872: =(O872*6)+P872 -> 66 | W872: GEELONG | X872: 1 | Y872: 7 | Z872: 8 | AA872: 0 | AB872: 1249 | AC872: 1236 | AD872: =(AB872/AC872)*100 -> 101.05177993527508 | AE872: =(Y872*4)+(AA872*2) -> 28
A873: BEST PLAYERS | W873: BOX HILL | X873: 2 | Y873: 6 | Z873: 8 | AA873: 0 | AB873: 1297 | AC873: 1315 | AD873: =(AB873/AC873)*100 -> 98.631178707224336 | AE873: =(Y873*4)+(AA873*2) -> 24
A874: NORTH BALLARAT | C874: TUCKEY | F874: FRITH | I874: SAUNDERS | L874: ECCLES | O874: McLEAN | R874: McNAMARA
A875: GEELONG | C875: BUCKLAND | F875: BLAKE | I875: D BYRNE | L875: ENRIGHT | O875: EGAN | W875: WILLIAMSTOWN | X875: 1 | Y875: 6 | Z875: 9 | AA875: 0 | AB875: 1227 | AC875: 1545 | AD875: =(AB875/AC875)*100 -> 79.417475728155338 | AE875: =(Y875*4)+(AA875*2) -> 24
A876: GOALKICKERS | W876: NORTHERN BULLANTS | X876: 2 | Y876: 5 | Z876: 9 | AA876: 0 | AB876: 1157 | AC876: 1272 | AD876: =(AB876/AC876)*100 -> 90.959119496855351 | AE876: =(Y876*4)+(AA876*2) -> 20
A877: NORTH BALLARAT | C877: TUCKEY 4 | F877: WHYMAN 3 | I877: FRITH 2 | L877: FOOTT | N877: SAUNDERS | Q877: McCORKELL | W877: BENDIGO | X877: 2 | Y877: 5 | Z877: 9 | AA877: 0 | AB877: 1243 | AC877: 1447 | AD877: =(AB877/AC877)*100 -> 85.901865929509327 | AE877: =(Y877*4)+(AA877*2) -> 20
A878: GEELONG | C878: TENACE 2 | F878: D BYRNE | I878: COOK | K878: ENRIGHT | M878: HAYNES | O878: MACKIE | Q878: PLAYFAIR | T878: SMITH | W878: FRANKSTON | X878: 2 | Y878: 4 | Z878: 10 | AA878: 0 | AB878: 1072 | AC878: 1149 | AD878: =(AB878/AC878)*100 -> 93.298520452567445 | AE878: =(Y878*4)+(AA878*2) -> 16
D879: 25TH JULY | J879: WEATHER | W879: SPRINGVALE | X879: 1 | Y879: 3 | Z879: 12 | AA879: 0 | AB879: 1215 | AC879: 1671 | AD879: =(AB879/AC879)*100 -> 72.710951526032318 | AE879: =(Y879*4)+(AA879*2) -> 12
A880: COBURG | C880: 4 | D880: 3 | E880: =(C880*6)+D880 -> 27 | G880: 7 | H880: 5 | I880: =(G880*6)+H880 -> 47 | K880: 10 | L880: 8 | M880: =(K880*6)+L880 -> 68 | O880: 12 | P880: 10 | Q880: =(O880*6)+P880 -> 82 | S880: Venue: YORK PARK (Launceston)
A881: TASMANIA | C881: 1 | D881: 2 | E881: =(C881*6)+D881 -> 8 | G881: 6 | H881: 2 | I881: =(G881*6)+H881 -> 38 | K881: 6 | L881: 6 | M881: =(K881*6)+L881 -> 42 | O881: 8 | P881: 8 | Q881: =(O881*6)+P881 -> 56
A882: BEST PLAYERS
A883: COBURG | C883: CARLSON | F883: JORGENSON | I883: MORRISON | L883: TUCK | O883: FLETCHER | R883: RAINES
A884: TASMANIA | C884: DUNNE | F884: ATKIN | I884: JOVANOVIC
A885: GOALKICKERS
A886: COBURG | C886: FLETCHER 4 | F886: MARSH 2 | I886: MORRISON 2 | L886: PAGAN | N886: COUGHLAN | Q886: TUCK
A887: TASMANIA | C887: LING 2 | F887: PLAPP 2 | I887: SAVAGE | K887: HENLEY | M887: KIRK | N887: WAGER
A889: BOX HILL | C889: 3 | D889: 4 | E889: =(C889*6)+D889 -> 22 | G889: 10 | H889: 10 | I889: =(G889*6)+H889 -> 70 | K889: 15 | L889: 14 | M889: =(K889*6)+L889 -> 104 | O889: 20 | P889: 20 | Q889: =(O889*6)+P889 -> 140 | S889: Venue: BOX HILL
A890: SPRINGVALE | C890: 3 | D890: 4 | E890: =(C890*6)+D890 -> 22 | G890: 4 | H890: 4 | I890: =(G890*6)+H890 -> 28 | K890: 6 | L890: 5 | M890: =(K890*6)+L890 -> 41 | O890: 9 | P890: 6 | Q890: =(O890*6)+P890 -> 60
A891: BEST PLAYERS
A892: BOX HILL | C892: SHELTON | F892: PICIAONE | I892: COX | L892: HEIGHT | O892: OSBORNE | R892: SEWELL
A893: SPRINGVALE | C893: STONE | F893: ROUDA | I893: HARRISON | L893: N CARMODY | O893: CARROLL
A894: GOALKICKERS
A895: BOX HILL | C895: TAYLOR 5 | E895: HOWAT 3 | G895: ALLEWAY 2 | J895: CAMPBELL 2 | M895: HEIGHT 2 | O895: PUGSLEY 2 | R895: BATCHELOR | W895: COX | Y895: MILLER | AB895: SHELTON
A896: SPRINGVALE | C896: MURRAY 3 | F896: ROUDA 2 | I896: SMITH | K896: WALDRON | M896: WORNER | O896: WULF
A898: WILLIAMSTOWN | C898: 3 | D898: 1 | E898: =(C898*6)+D898 -> 19 | G898: 8 | H898: 2 | I898: =(G898*6)+H898 -> 50 | K898: 11 | L898: 6 | M898: =(K898*6)+L898 -> 72 | O898: 12 | P898: 11 | Q898: =(O898*6)+P898 -> 83 | S898: Venue: WILLIAMSTOWN
A899: FRANKSTON | C899: 4 | D899: 0 | E899: =(C899*6)+D899 -> 24 | G899: 6 | H899: 2 | I899: =(G899*6)+H899 -> 38 | K899: 7 | L899: 5 | M899: =(K899*6)+L899 -> 47 | O899: 9 | P899: 10 | Q899: =(O899*6)+P899 -> 64
A900: BEST PLAYERS
A901: WILLIAMSTOWN | C901: NIXON | F901: LLOYD | I901: SWAN | K901: McGOUGH | N901: CRANAGE | Q901: WILLIAMS
A902: FRANKSTON | C902: ANSTEY | F902: WINTERTON | I902: MURPHY | K902: BRYAN | N902: O'DELL
A903: GOALKICKERS
A904: WILLIAMSTOWN | C904: McGOUGH 2 | F904: NIXON 2 | H904: WILLIAMS | J904: CRANAGE | M904: KINNEAR | O904: CROW | Q904: SHACKLETON | U904: H SHAW | X904: SMOKER | AA904: MORRISON
A905: FRANKSTON | C905: BERRY 3 | F905: BRYAN | H905: ANSTEY | J905: FORTNAM | M905: LITTLECHILD | P905: FOLINO | R905: McCORMICK
A907: BYE | D907: NTH BULLANTS | H907: PORT MELBOURNE | L907: SANDRINGHAM
A909: ROUND 17 | D909: 31ST JULY | J909: WEATHER
D910: 1ST QTR | H910: 2ND QTR | L910: 3RD QTR | P910: FINAL | S910: Venue: PORT MELBOURNE
A911: PORT MELBOURNE | C911: 2 | D911: 4 | E911: =(C911*6)+D911 -> 16 | G911: 9 | H911: 7 | I911: =(G911*6)+H911 -> 61 | K911: 16 | L911: 12 | M911: =(K911*6)+L911 -> 108 | O911: 21 | P911: 15 | Q911: =(O911*6)+P911 -> 141 | S911: UMPIRES | Z911: LADDER | AC911: ROUND | AE911: 17
A912: NORTH BALLARAT | C912: 2 | D912: 4 | E912: =(C912*6)+D912 -> 16 | G912: 4 | H912: 7 | I912: =(G912*6)+H912 -> 31 | K912: 8 | L912: 9 | M912: =(K912*6)+L912 -> 57 | O912: 12 | P912: 11 | Q912: =(O912*6)+P912 -> 83
A913: BEST PLAYERS | W913: TEAM | X913: B | Y913: W | Z913: L | AA913: D | AB913: FOR | AC913: AGST | AD913: % | AE913: PTS
A914: PORT MELBOURNE | C914: URCH | F914: SCHWARZE | I914: TROTTER | L914: S CLAYTON | O914: McKERNAN | R914: LAWRENCE
A915: NORTH BALLARAT | C915: SAUNDERS | F915: FIELD | I915: RYALL | L915: CLARK | W915: PORT MELBOURNE | X915: 2 | Y915: 12 | Z915: 3 | AA915: 0 | AB915: 1652 | AC915: 1236 | AD915: =(AB915/AC915)*100 -> 133.6569579288026 | AE915: =(Y915*4)+(AA915*2) -> 48
A916: GOALKICKERS | I916: MCMAHON | K916: LECRAS | M916: HARDING | O916: ALEXANDER | R916: JONES | W916: SANDRINGHAM | X916: 2 | Y916: 11 | Z916: 4 | AA916: 0 | AB916: 1472 | AC916: 1100 | AD916: =(AB916/AC916)*100 -> 133.81818181818181 | AE916: =(Y916*4)+(AA916*2) -> 44
A917: PORT MELBOURNE | C917: McKERNAN 4 | F917: S CLAYTON 3 | I917: J CLAYTON 2 | L917: ALOI 2 | N917: PITT 2 | P917: GILL | Q917: ROBBINS | S917: GIBSON | W917: TASMANIA | X917: 2 | Y917: 10 | Z917: 5 | AA917: 0 | AB917: 1314 | AC917: 1164 | AD917: =(AB917/AC917)*100 -> 112.88659793814433 | AE917: =(Y917*4)+(AA917*2) -> 40
A918: NORTH BALLARAT | C918: SAUNDERS 6 | F918: TUCKEY 2 | I918: FRITH | K918: TAYLOR | M918: PLUNKETT | O918: BYE | W918: COBURG | X918: 2 | Y918: 10 | Z918: 5 | AA918: 0 | AB918: 1256 | AC918: 1250 | AD918: =(AB918/AC918)*100 -> 100.48 | AE918: =(Y918*4)+(AA918*2) -> 40
W919: WERRIBEE | X919: 2 | Y919: 9 | Z919: 6 | AA919: 0 | AB919: 1294 | AC919: 1095 | AD919: =(AB919/AC919)*100 -> 118.17351598173515 | AE919: =(Y919*4)+(AA919*2) -> 36
A920: BOX HILL | C920: 2 | D920: 1 | E920: =(C920*6)+D920 -> 13 | G920: 5 | H920: 7 | I920: =(G920*6)+H920 -> 37 | K920: 5 | L920: 10 | M920: =(K920*6)+L920 -> 40 | O920: 12 | P920: 14 | Q920: =(O920*6)+P920 -> 86 | S920: Venue: BOX HILL | W920: NORTH BALLARAT | X920: 1 | Y920: 9 | Z920: 7 | AA920: 0 | AB920: 1283 | AC920: 1335 | AD920: =(AB920/AC920)*100 -> 96.104868913857672 | AE920: =(Y920*4)+(AA920*2) -> 36
A921: NORTHERN BULLANTS | C921: 5 | D921: 5 | E921: =(C921*6)+D921 -> 35 | G921: 6 | H921: 7 | I921: =(G921*6)+H921 -> 43 | K921: 8 | L921: 10 | M921: =(K921*6)+L921 -> 58 | O921: 11 | P921: 11 | Q921: =(O921*6)+P921 -> 77 | W921: GEELONG | X921: 2 | Y921: 7 | Z921: 8 | AA921: 0 | AB921: 1249 | AC921: 1236 | AD921: =(AB921/AC921)*100 -> 101.05177993527508 | AE921: =(Y921*4)+(AA921*2) -> 28
A922: BEST PLAYERS | W922: BOX HILL | X922: 2 | Y922: 7 | Z922: 8 | AA922: 0 | AB922: 1383 | AC922: 1382 | AD922: =(AB922/AC922)*100 -> 100.07235890014472 | AE922: =(Y922*4)+(AA922*2) -> 28
A923: BOX HILL | C923: THURGOOD | F923: SEWELL | I923: COX | L923: BRENNAN | N923: ALLEWAY | Q923: BATCHELOR
A924: NORTHERN BULLANTS | C924: HARFORD | F924: DAVIES | I924: RASO | L924: MOTT | N924: BOYD | Q924: McCORMICK | W924: BENDIGO | X924: 2 | Y924: 6 | Z924: 9 | AA924: 0 | AB924: 1364 | AC924: 1519 | AD924: =(AB924/AC924)*100 -> 89.795918367346943 | AE924: =(Y924*4)+(AA924*2) -> 24
A925: GOALKICKERS | W925: WILLIAMSTOWN | X925: 1 | Y925: 6 | Z925: 10 | AA925: 0 | AB925: 1309 | AC925: 1643 | AD925: =(AB925/AC925)*100 -> 79.671332927571513 | AE925: =(Y925*4)+(AA925*2) -> 24
A926: BOX HILL | C926: ALLEWAY 4 | F926: HARVEY 3 | I926: SEWELL 2 | L926: BATCHELOR | O926: KANE | Q926: MILLER | W926: NORTHERN BULLANTS | X926: 2 | Y926: 5 | Z926: 10 | AA926: 0 | AB926: 1234 | AC926: 1358 | AD926: =(AB926/AC926)*100 -> 90.86892488954345 | AE926: =(Y926*4)+(AA926*2) -> 20
A927: NORTHERN BULLANTS | C927: DAVIES 2 | F927: KENNA 2 | I927: CLARKE | K927: HARFORD | M927: HOOPER | O927: MOTT | Q927: RASO | R927: REID | T927: ZORZI | W927: FRANKSTON | X927: 2 | Y927: 4 | Z927: 11 | AA927: 0 | AB927: 1144 | AC927: 1270 | AD927: =(AB927/AC927)*100 -> 90.078740157480325 | AE927: =(Y927*4)+(AA927*2) -> 16
W928: SPRINGVALE | X928: 1 | Y928: 3 | Z928: 13 | AA928: 0 | AB928: 1278 | AC928: 1806 | AD928: =(AB928/AC928)*100 -> 70.7641196013289 | AE928: =(Y928*4)+(AA928*2) -> 12
A929: WERRIBEE | C929: 6 | D929: 1 | E929: =(C929*6)+D929 -> 37 | G929: 8 | H929: 4 | I929: =(G929*6)+H929 -> 52 | K929: 15 | L929: 7 | M929: =(K929*6)+L929 -> 97 | O929: 21 | P929: 9 | Q929: =(O929*6)+P929 -> 135 | S929: Venue: SPRINGVALE
A930: SPRINGVALE | C930: 3 | D930: 1 | E930: =(C930*6)+D930 -> 19 | G930: 7 | H930: 2 | I930: =(G930*6)+H930 -> 44 | K930: 10 | L930: 3 | M930: =(K930*6)+L930 -> 63 | O930: 10 | P930: 3 | Q930: =(O930*6)+P930 -> 63
A931: BEST PLAYERS
A932: WERRIBEE | C932: PODSIADLY | F932: MORGAN | I932: FAULKNER | L932: GLEESON | N932: RAU | Q932: MURPHY
A933: SPRINGVALE | C933: STONE | F933: MURRAY | I933: HARRISON | L933: WULF | N933: HEENAN
A934: GOALKICKERS
A935: WERRIBEE | C935: PODSIADLY 10 | F935: MITCHELL 2 | I935: LAMB 2 | K935: FAULKNER 2 | N935: DAVIS 2 | Q935: GLEESON | S935: MURPHY | V935: SKIPPER
A936: SPRINGVALE | C936: MURRAY 3 | F936: R CLARKE 2 | I936: ROUDA | K936: BRUIN | M936: MOYLE | O936: WULF | Q936: BROOKS
D937: 1ST AUGUST | J937: WEATHER
A938: COBURG | C938: 3 | D938: 2 | E938: =(C938*6)+D938 -> 20 | G938: 5 | H938: 6 | I938: =(G938*6)+H938 -> 36 | K938: 9 | L938: 7 | M938: =(K938*6)+L938 -> 61 | O938: 12 | P938: 10 | Q938: =(O938*6)+P938 -> 82 | S938: Venue: WERRIBEE
A939: SANDRINGHAM | C939: 4 | D939: 1 | E939: =(C939*6)+D939 -> 25 | G939: 7 | H939: 3 | I939: =(G939*6)+H939 -> 45 | K939: 9 | L939: 4 | M939: =(K939*6)+L939 -> 58 | O939: 11 | P939: 8 | Q939: =(O939*6)+P939 -> 74
A940: BEST PLAYERS
A941: COBURG | C941: MORRISON | F941: NICHOLLS | I941: WELLER | L941: FOLEY | N941: TUCK | Q941: O'CONNOR
A942: SANDRINGHAM | C942: GALLAGHER | F942: O'KEEFE | I942: FISHER | L942: WILLIAMS | N942: BELL | Q942: BIDDLECOMBE
A943: GOALKICKERS
A944: COBURG | C944: MORRISON 8 | F944: O'CONNOR 2 | I944: FLETCHER | K944: RAINES
A945: SANDRINGHAM | C945: GODFREY 3 | F945: SAUTNER 2 | I945: NEWMAN 2 | L945: LAMB | N945: SYLVIA | P945: McLEAN | R945: FISHER
A947: TASMANIA | C947: 2 | D947: 7 | E947: =(C947*6)+D947 -> 19 | G947: 5 | H947: 8 | I947: =(G947*6)+H947 -> 38 | K947: 9 | L947: 11 | M947: =(K947*6)+L947 -> 65 | O947: 14 | P947: 14 | Q947: =(O947*6)+P947 -> 98 | S947: Venue: WILLIAMSTOWN
A948: WILLIAMSTOWN | C948: 4 | D948: 6 | E948: =(C948*6)+D948 -> 30 | G948: 6 | H948: 6 | I948: =(G948*6)+H948 -> 42 | K948: 8 | L948: 8 | M948: =(K948*6)+L948 -> 56 | O948: 12 | P948: 10 | Q948: =(O948*6)+P948 -> 82
A949: BEST PLAYERS
A950: TASMANIA | C950: JOVANOVIC | F950: CARELESS | I950: SAVAGE | L950: STEPHENS | O950: STREET | R950: WAGER
A951: WILLIAMSTOWN | C951: NIXON | F951: LLOYD | I951: McGOUGH | L951: KINNEAR | O951: SWAN | R951: CROW
A952: GOALKICKERS
A953: TASMANIA | C953: CALLINAN 3 | F953: BEAMS 2 | I953: PLAPP 2 | K953: STEPHENS 2 | N953: LING 2 | P953: ATKIN | R953: ROBINSON | V953: HALL
A954: WILLIAMSTOWN | C954: H SHAW 3 | F954: KNIGHT 2 | I954: SHEEHAN | K954: B SHAW | M954: MORRISON | P954: SMOKER | R954: WILLIAMS | V954: KINNEAR | Y954: PEARCE
A956: BENDIGO | C956: 5 | D956: 4 | E956: =(C956*6)+D956 -> 34 | G956: 11 | H956: 6 | I956: =(G956*6)+H956 -> 72 | K956: 15 | L956: 12 | M956: =(K956*6)+L956 -> 102 | O956: 18 | P956: 13 | Q956: =(O956*6)+P956 -> 121 | S956: Venue: FRANKSTON
A957: FRANKSTON | C957: 4 | D957: 2 | E957: =(C957*6)+D957 -> 26 | G957: 6 | H957: 4 | I957: =(G957*6)+H957 -> 40 | K957: 6 | L957: 6 | M957: =(K957*6)+L957 -> 42 | O957: 11 | P957: 6 | Q957: =(O957*6)+P957 -> 72
A958: BEST PLAYERS
A959: BENDIGO | C959: LAYCOCK | F959: MERCURI | I959: BULLEN | L959: WALSH | O959: ROSA | R959: LOVETT
A960: FRANKSTON | C960: MURPHY | F960: BARRY | I960: BRYAN | L960: WINTERTON | O960: LITTLECHILD
A961: GOALKICKERS
A962: BENDIGO | C962: LAYCOCK 4 | F962: MERCURI 4 | I962: BRADLEY 3 | L962: LOVETT 2 | N962: WINDERLICH 2 | Q962: BULLEN | S962: DYSON | V962: NASH
A963: FRANKSTON | C963: BEASY 2 | E963: ROBERTS | G963: McCORMACK | J963: LITTLECHILD | M963: CLARKE | O963: BRYAN | Q963: FORTNAM | T963: BREWSTER | X963: PHIBBS | AB963: WINTERTON
A965: BYE | D965: GEELONG
A967: ROUND 18 | D967: 7TH AUGUST | J967: WEATHER
D968: 1ST QTR | H968: 2ND QTR | L968: 3RD QTR | P968: FINAL | S968: Venue: SHELL STADIUM
A969: BENDIGO | C969: 5 | D969: 3 | E969: =(C969*6)+D969 -> 33 | G969: 9 | H969: 6 | I969: =(G969*6)+H969 -> 60 | K969: 19 | L969: 8 | M969: =(K969*6)+L969 -> 122 | O969: 22 | P969: 12 | Q969: =(O969*6)+P969 -> 144 | S969: UMPIRES | Z969: LADDER | AC969: ROUND | AE969: 18
A970: GEELONG | C970: 6 | D970: 4 | E970: =(C970*6)+D970 -> 40 | G970: 8 | H970: 8 | I970: =(G970*6)+H970 -> 56 | K970: 10 | L970: 9 | M970: =(K970*6)+L970 -> 69 | O970: 16 | P970: 11 | Q970: =(O970*6)+P970 -> 107
A971: BEST PLAYERS | W971: TEAM | X971: B | Y971: W | Z971: L | AA971: D | AB971: FOR | AC971: AGST | AD971: % | AE971: PTS
A972: BENDIGO | C972: CARTER | F972: LOVETT | I972: WUNDERLICH | L972: HUNT | O972: MERCURI | R972: MOORCROFT
A973: GEELONG | C973: EGAN | F973: MCCARTHY | I973: THURLEY | L973: GREAVES | O973: CHAMBERS | W973: PORT MELBOURNE | X973: 2 | Y973: 13 | Z973: 3 | AA973: 0 | AB973: 1845 | AC973: 1297 | AD973: =(AB973/AC973)*100 -> 142.25134926754049 | AE973: =(Y973*4)+(AA973*2) -> 52
A974: GOALKICKERS | F974: ROSA | H974: WILSON | J974: WINDERLICH | M974: CAMPBELL | P974: DAVIES | R974: SUMMERS | W974: SANDRINGHAM | X974: 2 | Y974: 11 | Z974: 5 | AA974: 0 | AB974: 1533 | AC974: 1175 | AD974: =(AB974/AC974)*100 -> 130.46808510638297 | AE974: =(Y974*4)+(AA974*2) -> 44
A975: BENDIGO | C975: LOVETT 4 | E975: WATSON 3 | H975: NASH 2 | J975: MOORCROFT 2 | M975: COSGRIFF 2 | P975: MERCURI 2 | R975: BRADLEY | W975: COBURG | X975: 2 | Y975: 11 | Z975: 5 | AA975: 0 | AB975: 1311 | AC975: 1279 | AD975: =(AB975/AC975)*100 -> 102.50195465207193 | AE975: =(Y975*4)+(AA975*2) -> 44
A976: GEELONG | C976: GREAVES 5 | F976: EGAN 2 | H976: HAYNES 2 | J976: MCCARTHY 2 | M976: BLAKE | O976: J BYRNE | Q976: COOK | R976: MACKIE | W976: WERRIBEE | X976: 2 | Y976: 10 | Z976: 6 | AA976: 0 | AB976: 1369 | AC976: 1156 | AD976: =(AB976/AC976)*100 -> 118.42560553633218 | AE976: =(Y976*4)+(AA976*2) -> 40
N977: THURLEY | W977: NORTH BALLARAT | X977: 1 | Y977: 10 | Z977: 7 | AA977: 0 | AB977: 1384 | AC977: 1357 | AD977: =(AB977/AC977)*100 -> 101.98968312453943 | AE977: =(Y977*4)+(AA977*2) -> 40
A978: COBURG | C978: 1 | D978: 1 | E978: =(C978*6)+D978 -> 7 | G978: 2 | H978: 2 | I978: =(G978*6)+H978 -> 14 | K978: 4 | L978: 6 | M978: =(K978*6)+L978 -> 30 | O978: 8 | P978: 7 | Q978: =(O978*6)+P978 -> 55 | S978: Venue: COBURG | W978: TASMANIA | X978: 2 | Y978: 10 | Z978: 6 | AA978: 0 | AB978: 1375 | AC978: 1357 | AD978: =(AB978/AC978)*100 -> 101.32645541635961 | AE978: =(Y978*4)+(AA978*2) -> 40
A979: NORTHERN BULLANTS | C979: 2 | D979: 2 | E979: =(C979*6)+D979 -> 14 | G979: 4 | H979: 2 | I979: =(G979*6)+H979 -> 26 | K979: 4 | L979: 3 | M979: =(K979*6)+L979 -> 27 | O979: 4 | P979: 5 | Q979: =(O979*6)+P979 -> 29 | W979: BOX HILL | X979: 2 | Y979: 8 | Z979: 8 | AA979: 0 | AB979: 1480 | AC979: 1444 | AD979: =(AB979/AC979)*100 -> 102.49307479224376 | AE979: =(Y979*4)+(AA979*2) -> 32
A980: BEST PLAYERS | W980: GEELONG | X980: 2 | Y980: 7 | Z980: 9 | AA980: 0 | AB980: 1356 | AC980: 1380 | AD980: =(AB980/AC980)*100 -> 98.260869565217391 | AE980: =(Y980*4)+(AA980*2) -> 28
A981: COBURG | C981: MARSH | F981: PAGAN | I981: BLUMFIELD | L981: NICHOLLS | O981: RAINES | R981: TALBOT
A982: NORTHERN BULLANTS | C982: BEASY | F982: VANSITTART | I982: ZORZI | L982: McCORMICK | O982: DAVIES | R982: STEVENSON | W982: BENDIGO | X982: 2 | Y982: 7 | Z982: 9 | AA982: 0 | AB982: 1508 | AC982: 1626 | AD982: =(AB982/AC982)*100 -> 92.742927429274289 | AE982: =(Y982*4)+(AA982*2) -> 28
A983: GOALKICKERS | W983: WILLIAMSTOWN | X983: 2 | Y983: 6 | Z983: 10 | AA983: 0 | AB983: 1309 | AC983: 1643 | AD983: =(AB983/AC983)*100 -> 79.671332927571513 | AE983: =(Y983*4)+(AA983*2) -> 24
A984: COBURG | C984: MARSH 2 | F984: ROACH 2 | I984: NICHOLLS 2 | L984: FOLEY | N984: TUCK | W984: NORTHERN BULLANTS | X984: 2 | Y984: 5 | Z984: 11 | AA984: 0 | AB984: 1263 | AC984: 1413 | AD984: =(AB984/AC984)*100 -> 89.384288747346076 | AE984: =(Y984*4)+(AA984*2) -> 20
A985: NORTHERN BULLANTS | C985: MCCORMICK | F985: JAMES | H985: VANSITTART | K985: ZORZI | W985: FRANKSTON | X985: 2 | Y985: 4 | Z985: 12 | AA985: 0 | AB985: 1206 | AC985: 1367 | AD985: =(AB985/AC985)*100 -> 88.222384784198965 | AE985: =(Y985*4)+(AA985*2) -> 16
W986: SPRINGVALE | X986: 1 | Y986: 3 | Z986: 14 | AA986: 0 | AB986: 1300 | AC986: 1907 | AD986: =(AB986/AC986)*100 -> 68.169900367068692 | AE986: =(Y986*4)+(AA986*2) -> 12
A987: NORTH BALLARAT | C987: 2 | D987: 3 | E987: =(C987*6)+D987 -> 15 | G987: 6 | H987: 5 | I987: =(G987*6)+H987 -> 41 | K987: 11 | L987: 7 | M987: =(K987*6)+L987 -> 73 | O987: 15 | P987: 11 | Q987: =(O987*6)+P987 -> 101 | S987: Venue: NORTH BALLARAT
A988: SPRINGVALE | C988: 2 | D988: 2 | E988: =(C988*6)+D988 -> 14 | G988: 3 | H988: 2 | I988: =(G988*6)+H988 -> 20 | K988: 3 | L988: 2 | M988: =(K988*6)+L988 -> 20 | O988: 3 | P988: 4 | Q988: =(O988*6)+P988 -> 22
A989: BEST PLAYERS
A990: NORTH BALLARAT | C990: FIELD | F990: ECCLES | I990: McLEAN | L990: McNAMARA | O990: SAUNDERS | R990: GREIG
A991: SPRINGVALE | C991: COLLINS | F991: MOTT | I991: RIGG | L991: KNOBEL | O991: MORSE | R991: BROOKS
A992: GOALKICKERS
A993: NORTH BALLARAT | C993: HUTCHINSON 3 | F993: McCONNELL 3 | I993: TUCKEY 2 | K993: SAUNDERS 2 | N993: JURICA 2 | Q993: TAYLOR | S993: ECCLES | W993: McCORKELL
A994: SPRINGVALE | C994: BROOKS 2 | F994: MILNE
D995: 8TH AUGUST | J995: WEATHER
A996: BOX HILL | C996: 5 | D996: 2 | E996: =(C996*6)+D996 -> 32 | G996: 5 | H996: 2 | I996: =(G996*6)+H996 -> 32 | K996: 11 | L996: 6 | M996: =(K996*6)+L996 -> 72 | O996: 15 | P996: 7 | Q996: =(O996*6)+P996 -> 97 | S996: Venue: FRANKSTON
A997: FRANKSTON | C997: 1 | D997: 6 | E997: =(C997*6)+D997 -> 12 | G997: 4 | H997: 10 | I997: =(G997*6)+H997 -> 34 | K997: 5 | L997: 10 | M997: =(K997*6)+L997 -> 40 | O997: 8 | P997: 14 | Q997: =(O997*6)+P997 -> 62
A998: BEST PLAYERS
A999: BOX HILL | C999: SEWELL | F999: LONIE | I999: BALL | L999: RIX | O999: TALLIS | R999: BAILEY
A1000: FRANKSTON | C1000: ROBERTS | F1000: MURPHY | I1000: BEASY | L1000: WINTERTON | O1000: ULMS | R1000: POLLARD
A1001: GOALKICKERS
A1002: BOX HILL | C1002: BAILEY 3 | F1002: HARVEY 3 | I1002: PUGSLEY 3 | L1002: GREENE 2 | N1002: ALLEWAY | Q1002: HEIGHT | S1002: SEWELL | W1002: TAYLOR
A1003: FRANKSTON | C1003: BEASY 3 | F1003: McCORMACK 2 | J1003: MURPHY | L1003: HUNTER | N1003: ROBERTS
A1005: WERRIBEE | C1005: 3 | D1005: 4 | E1005: =(C1005*6)+D1005 -> 22 | G1005: 5 | H1005: 6 | I1005: =(G1005*6)+H1005 -> 36 | K1005: 7 | L1005: 11 | M1005: =(K1005*6)+L1005 -> 53 | O1005: 10 | P1005: 15 | Q1005: =(O1005*6)+P1005 -> 75 | S1005: Venue: WERRIBEE
A1006: SANDRINGHAM | C1006: 0 | D1006: 4 | E1006: =(C1006*6)+D1006 -> 4 | G1006: 4 | H1006: 8 | I1006: =(G1006*6)+H1006 -> 32 | K1006: 7 | L1006: 10 | M1006: =(K1006*6)+L1006 -> 52 | O1006: 8 | P1006: 13 | Q1006: =(O1006*6)+P1006 -> 61
A1007: BEST PLAYERS
A1008: WERRIBEE | C1008: HENDERSON | F1008: POWER | I1008: ROBERTSON | L1008: CROFT | N1008: RAU | Q1008: FAULKNER
A1009: SANDRINGHAM | C1009: LAMB | F1009: FISHER | I1009: WILLIAMS | L1009: CARROLL | N1009: LIDDELL | Q1009: JOLLY
A1010: GOALKICKERS
A1011: WERRIBEE | C1011: DAVIS 2 | F1011: MITCHELL 2 | I1011: BOWDEN | K1011: FAULKNER | N1011: MURPHY | P1011: SMITH | R1011: POWER | U1011: RAU
A1012: SANDRINGHAM | C1012: FISHER 2 | F1012: FERGUSON 2 | I1012: JAMAR | K1012: GALLAGHER | N1012: WILLIAMS | Q1012: SAUTNER
A1014: PORT MELBOURNE | C1014: 8 | D1014: 2 | E1014: =(C1014*6)+D1014 -> 50 | G1014: 15 | H1014: 8 | I1014: =(G1014*6)+H1014 -> 98 | K1014: 23 | L1014: 14 | M1014: =(K1014*6)+L1014 -> 152 | O1014: 29 | P1014: 19 | Q1014: =(O1014*6)+P1014 -> 193 | S1014: Venue: PORT MELBOURNE
A1015: TASMANIA | C1015: 3 | D1015: 0 | E1015: =(C1015*6)+D1015 -> 18 | G1015: 3 | H1015: 3 | I1015: =(G1015*6)+H1015 -> 21 | K1015: 6 | L1015: 5 | M1015: =(K1015*6)+L1015 -> 41 | O1015: 9 | P1015: 7 | Q1015: =(O1015*6)+P1015 -> 61
A1016: BEST PLAYERS
A1017: PORT MELBOURNE | C1017: J CLAYTON | F1017: BAIRD | I1017: GILL | L1017: GIBSON | N1017: SCHWARZE | Q1017: PITT
A1018: TASMANIA | C1018: WALKER | F1018: HOWARD | I1018: CALLINAN | L1018: HALL | N1018: STREET
A1019: GOALKICKERS
A1020: PORT MELBOURNE | C1020: J CLAYTON 6 | F1020: PITT 5 | H1020: GILL 4 | J1020: JONES 3 | L1020: HARVEY 2 | N1020: McMAHON 2 | Q1020: GIBSON | S1020: SCHWARZE | W1020: SANSBURY | X1020: BAIRD | Z1020: GRIMA | AB1020: ALOI | AC1020: WATSON
A1021: TASMANIA | C1021: CALLINAN 3 | F1021: GEAPPEN | I1021: DRURY | K1021: HALL | M1021: STEPHENS | P1021: HENLEY | R1021: SHERMAN
A1023: BYE | D1023: WILLIAMSTOWN
A1025: ROUND 19 | D1025: 14TH AUGUST | J1025: WEATHER
D1026: 1ST QTR | H1026: 2ND QTR | L1026: 3RD QTR | P1026: FINAL | S1026: Venue: BENDIGO
A1027: BENDIGO | C1027: 1 | D1027: 1 | E1027: =(C1027*6)+D1027 -> 7 | G1027: 5 | H1027: 6 | I1027: =(G1027*6)+H1027 -> 36 | K1027: 7 | L1027: 7 | M1027: =(K1027*6)+L1027 -> 49 | O1027: 9 | P1027: 11 | Q1027: =(O1027*6)+P1027 -> 65 | S1027: UMPIRES | Z1027: LADDER | AC1027: ROUND | AE1027: 19
A1028: COBURG | C1028: 1 | D1028: 4 | E1028: =(C1028*6)+D1028 -> 10 | G1028: 1 | H1028: 7 | I1028: =(G1028*6)+H1028 -> 13 | K1028: 3 | L1028: 10 | M1028: =(K1028*6)+L1028 -> 28 | O1028: 4 | P1028: 11 | Q1028: =(O1028*6)+P1028 -> 35
A1029: BEST PLAYERS | W1029: TEAM | X1029: B | Y1029: W | Z1029: L | AA1029: D | AB1029: FOR | AC1029: AGST | AD1029: % | AE1029: PTS
A1030: BENDIGO | C1030: LOVETT | F1030: HUNT | I1030: DAVIES | L1030: DOERING | O1030: CARTER | R1030: CUPIDO
A1031: COBURG | C1031: PAGAN | F1031: O'CONNOR | I1031: CARUSO | L1031: ISAILOVIC | W1031: PORT MELBOURNE | X1031: 2 | Y1031: 13 | Z1031: 4 | AA1031: 0 | AB1031: 1920 | AC1031: 1425 | AD1031: =(AB1031/AC1031)*100 -> 134.73684210526315 | AE1031: =(Y1031*4)+(AA1031*2) -> 52
A1032: GOALKICKERS | W1032: SANDRINGHAM | X1032: 2 | Y1032: 12 | Z1032: 5 | AA1032: 0 | AB1032: 1661 | AC1032: 1250 | AD1032: =(AB1032/AC1032)*100 -> 132.88 | AE1032: =(Y1032*4)+(AA1032*2) -> 48
A1033: BENDIGO | C1033: CUPIDO 2 | F1033: HAYNES 2 | I1033: LOVETT | K1033: BRADLEY | M1033: HAWKINS | O1033: WILSON | Q1033: WEBSTER | W1033: WERRIBEE | X1033: 2 | Y1033: 11 | Z1033: 6 | AA1033: 0 | AB1033: 1461 | AC1033: 1240 | AD1033: =(AB1033/AC1033)*100 -> 117.8225806451613 | AE1033: =(Y1033*4)+(AA1033*2) -> 44
A1034: COBURG | C1034: A RAINES | F1034: MORRISON | I1034: ISAILOVIC | L1034: FOLEY | W1034: TASMANIA | X1034: 2 | Y1034: 11 | Z1034: 6 | AA1034: 0 | AB1034: 1483 | AC1034: 1444 | AD1034: =(AB1034/AC1034)*100 -> 102.70083102493075 | AE1034: =(Y1034*4)+(AA1034*2) -> 44
W1035: NORTH BALLARAT | X1035: 1 | Y1035: 11 | Z1035: 7 | AA1035: 0 | AB1035: 1416 | AC1035: 1380 | AD1035: =(AB1035/AC1035)*100 -> 102.60869565217392 | AE1035: =(Y1035*4)+(AA1035*2) -> 44
A1036: BOX HILL | C1036: 2 | D1036: 1 | E1036: =(C1036*6)+D1036 -> 13 | G1036: 4 | H1036: 2 | I1036: =(G1036*6)+H1036 -> 26 | K1036: 6 | L1036: 7 | M1036: =(K1036*6)+L1036 -> 43 | O1036: 12 | P1036: 10 | Q1036: =(O1036*6)+P1036 -> 82 | S1036: Venue: SHELL STADIUM (C/R) | W1036: COBURG | X1036: 2 | Y1036: 11 | Z1036: 6 | AA1036: 0 | AB1036: 1346 | AC1036: 1344 | AD1036: =(AB1036/AC1036)*100 -> 100.14880952380953 | AE1036: =(Y1036*4)+(AA1036*2) -> 44
A1037: GEELONG | C1037: 5 | D1037: 1 | E1037: =(C1037*6)+D1037 -> 31 | G1037: 8 | H1037: 1 | I1037: =(G1037*6)+H1037 -> 49 | K1037: 8 | L1037: 4 | M1037: =(K1037*6)+L1037 -> 52 | O1037: 11 | P1037: 5 | Q1037: =(O1037*6)+P1037 -> 71 | W1037: BOX HILL | X1037: 2 | Y1037: 9 | Z1037: 8 | AA1037: 0 | AB1037: 1562 | AC1037: 1515 | AD1037: =(AB1037/AC1037)*100 -> 103.1023102310231 | AE1037: =(Y1037*4)+(AA1037*2) -> 36
A1038: BEST PLAYERS | W1038: BENDIGO | X1038: 2 | Y1038: 8 | Z1038: 9 | AA1038: 0 | AB1038: 1573 | AC1038: 1661 | AD1038: =(AB1038/AC1038)*100 -> 94.701986754966882 | AE1038: =(Y1038*4)+(AA1038*2) -> 32
A1039: BOX HILL | C1039: KANE | F1039: RIX | I1039: MILLER | L1039: TALLIS | O1039: HEIGHT | R1039: BRENNAN
A1040: GEELONG | C1040: PLAYFAIR | F1040: CHAMBERS | I1040: BUCKLAND | L1040: D BYRNE | O1040: GREAVES | W1040: GEELONG | X1040: 2 | Y1040: 7 | Z1040: 10 | AA1040: 0 | AB1040: 1427 | AC1040: 1462 | AD1040: =(AB1040/AC1040)*100 -> 97.606019151846795 | AE1040: =(Y1040*4)+(AA1040*2) -> 28
A1041: GOALKICKERS | W1041: WILLIAMSTOWN | X1041: 2 | Y1041: 6 | Z1041: 11 | AA1041: 0 | AB1041: 1393 | AC1041: 1735 | AD1041: =(AB1041/AC1041)*100 -> 80.288184438040346 | AE1041: =(Y1041*4)+(AA1041*2) -> 24
A1042: BOX HILL | C1042: HEIGHT 3 | F1042: KANE 3 | I1042: JOLLEY 2 | L1042: MILLER 2 | O1042: BATCHELOR | R1042: SEWELL | W1042: NORTHERN BULLANTS | X1042: 2 | Y1042: 5 | Z1042: 12 | AA1042: 0 | AB1042: 1286 | AC1042: 1445 | AD1042: =(AB1042/AC1042)*100 -> 88.996539792387537 | AE1042: =(Y1042*4)+(AA1042*2) -> 20
A1043: GEELONG | C1043: GREAVES 4 | F1043: HAYNES 2 | I1043: LONERGAN 2 | L1043: BUCKLAND | N1043: D BYRNE | Q1043: CHAMBERS | W1043: FRANKSTON | X1043: 2 | Y1043: 4 | Z1043: 13 | AA1043: 0 | AB1043: 1293 | AC1043: 1475 | AD1043: =(AB1043/AC1043)*100 -> 87.66101694915254 | AE1043: =(Y1043*4)+(AA1043*2) -> 16
W1044: SPRINGVALE | X1044: 2 | Y1044: 3 | Z1044: 14 | AA1044: 0 | AB1044: 1300 | AC1044: 1907 | AD1044: =(AB1044/AC1044)*100 -> 68.169900367068692 | AE1044: =(Y1044*4)+(AA1044*2) -> 12
A1045: NORTH BALLARAT | C1045: 1 | D1045: 3 | E1045: =(C1045*6)+D1045 -> 9 | G1045: 1 | H1045: 3 | I1045: =(G1045*6)+H1045 -> 9 | K1045: 4 | L1045: 6 | M1045: =(K1045*6)+L1045 -> 30 | O1045: 4 | P1045: 8 | Q1045: =(O1045*6)+P1045 -> 32 | S1045: Venue: PRESTON
A1046: NORTHERN BULLANTS | C1046: 1 | D1046: 2 | E1046: =(C1046*6)+D1046 -> 8 | G1046: 1 | H1046: 4 | I1046: =(G1046*6)+H1046 -> 10 | K1046: 1 | L1046: 5 | M1046: =(K1046*6)+L1046 -> 11 | O1046: 3 | P1046: 5 | Q1046: =(O1046*6)+P1046 -> 23
A1047: BEST PLAYERS
A1048: NORTH BALLARAT | C1048: MOLONEY | F1048: McCORKELL | I1048: CLARK | L1048: TAYLOR | O1048: FRITH | Q1048: JURICA
A1049: NORTHERN BULLANTS | C1049: McCORMICK | F1049: BEASY | I1049: ZORZI | L1049: HOOPER | O1049: DAV CLARKE | R1049: BUNN
A1050: GOALKICKERS
A1051: NORTH BALLARAT | C1051: SAUNDERS 2 | F1051: FIELD | H1051: TAYLOR
A1052: NORTHERN BULLANTS | C1052: DAV CLARKE | F1052: KENNA | H1052: ZORZI
D1053: 15TH AUGUST | J1053: WEATHER
A1054: TASMANIA | C1054: 4 | D1054: 6 | E1054: =(C1054*6)+D1054 -> 30 | G1054: 6 | H1054: 8 | I1054: =(G1054*6)+H1054 -> 44 | K1054: 13 | L1054: 10 | M1054: =(K1054*6)+L1054 -> 88 | O1054: 16 | P1054: 12 | Q1054: =(O1054*6)+P1054 -> 108 | S1054: Venue: NORTH HOBART OVAL
A1055: FRANKSTON | C1055: 1 | D1055: 2 | E1055: =(C1055*6)+D1055 -> 8 | G1055: 4 | H1055: 6 | I1055: =(G1055*6)+H1055 -> 30 | K1055: 7 | L1055: 10 | M1055: =(K1055*6)+L1055 -> 52 | O1055: 12 | P1055: 15 | Q1055: =(O1055*6)+P1055 -> 87
A1056: BEST PLAYERS
A1057: TASMANIA | C1057: PLAPP | F1057: WALKER | I1057: BARTLETT | L1057: SAVAGE | O1057: JOVANOVIC | R1057: STREET
A1058: FRANKSTON | C1058: BRYAN | F1058: ROBERTS | I1058: MURPHY | L1058: McCORMACK | O1058: WINTERTON | R1058: BEASY
A1059: GOALKICKERS
A1060: TASMANIA | C1060: PLAPP 5 | E1060: BARTLETT 3 | H1060: LING 2 | J1060: CALLINAN 2 | M1060: STEPHENS | P1060: BEAMS | R1060: M GEAPPEN | W1060: BLIGHT
A1061: FRANKSTON | C1061: McCORMACK 4 | F1061: BEASY 2 | I1061: WINTERTON 2 | L1061: BERRY | N1061: BRYAN | P1061: MARIGLIANI | R1061: OGIER
A1063: WERRIBEE | C1063: 5 | D1063: 4 | E1063: =(C1063*6)+D1063 -> 34 | G1063: 6 | H1063: 4 | I1063: =(G1063*6)+H1063 -> 40 | K1063: 10 | L1063: 6 | M1063: =(K1063*6)+L1063 -> 66 | O1063: 14 | P1063: 8 | Q1063: =(O1063*6)+P1063 -> 92 | S1063: Venue: WILLIAMSTOWN
A1064: WILLIAMSTOWN | C1064: 2 | D1064: 3 | E1064: =(C1064*6)+D1064 -> 15 | G1064: 8 | H1064: 7 | I1064: =(G1064*6)+H1064 -> 55 | K1064: 9 | L1064: 10 | M1064: =(K1064*6)+L1064 -> 64 | O1064: 12 | P1064: 12 | Q1064: =(O1064*6)+P1064 -> 84
A1065: BEST PLAYERS
A1066: WERRIBEE | C1066: KOOPS | F1066: ROBERTSON | I1066: HENDERSON | L1066: CROFT | O1066: GARLICK
A1067: WILLIAMSTOWN | C1067: SWAN | F1067: THEODORE | I1067: LLOYD | L1067: SHACKLETON | O1067: ROWE | R1067: CRANAGE
A1068: GOALKICKERS
A1069: WERRIBEE | C1069: MITCHELL 3 | F1069: SKIPPER 2 | I1069: LAMB 2 | K1069: SMITH | M1069: ROBERTSON | P1069: HENDERSON | S1069: GLEESON | W1069: CROFT | X1069: CONDOS | AA1069: BOWDEN
A1070: WILLIAMSTOWN | C1070: SWAN 3 | F1070: SHEEHAN 2 | I1070: DUKES 2 | K1070: WILLIAMS | M1070: LAWRY | O1070: JARRAD | Q1070: KINNEAR | S1070: SHACKLETON
A1072: SANDRINGHAM | C1072: 8 | D1072: 2 | E1072: =(C1072*6)+D1072 -> 50 | G1072: 11 | H1072: 5 | I1072: =(G1072*6)+H1072 -> 71 | K1072: 15 | L1072: 7 | M1072: =(K1072*6)+L1072 -> 97 | O1072: 20 | P1072: 8 | Q1072: =(O1072*6)+P1072 -> 128 | S1072: Venue: BEACH ROAD
A1073: PORT MELBOURNE | C1073: 0 | D1073: 2 | E1073: =(C1073*6)+D1073 -> 2 | G1073: 2 | H1073: 4 | I1073: =(G1073*6)+H1073 -> 16 | K1073: 4 | L1073: 6 | M1073: =(K1073*6)+L1073 -> 30 | O1073: 11 | P1073: 9 | Q1073: =(O1073*6)+P1073 -> 75
A1074: BEST PLAYERS
A1075: SANDRINGHAM | C1075: CARROLL | F1075: WALSH | I1075: FISHER | L1075: SAUTNER | O1075: SMITH | R1075: WARD
A1076: PORT MELBOURNE | C1076: LAWRENCE | F1076: J CLAYTON | I1076: ROBBINS | L1076: PERRY
A1077: GOALKICKERS
A1078: SANDRINGHAM | C1078: SAUTNER 6 | F1078: SMITH 4 | H1078: McLEAN 3 | J1078: JAMAR | L1078: O'KEEFE | N1078: CONROY | P1078: FISHER | R1078: MOLAN | V1078: WALSH | X1078: WARD
A1079: PORT MELBOURNE | C1079: S CLAYTON 2 | F1079: LAWRENCE 2 | I1079: OBST 2 | L1079: ALOI 2 | N1079: McMAHON | Q1079: ROBBINS | S1079: HARVEY
A1081: BYE | D1081: SPRINGVALE
A1083: ROUND 20 | D1083: 21ST AUGUST | J1083: WEATHER
D1084: 1ST QTR | H1084: 2ND QTR | L1084: 3RD QTR | P1084: FINAL | S1084: Venue: COBURG
A1085: WERRIBEE | C1085: 3 | D1085: 2 | E1085: =(C1085*6)+D1085 -> 20 | G1085: 6 | H1085: 6 | I1085: =(G1085*6)+H1085 -> 42 | K1085: 9 | L1085: 9 | M1085: =(K1085*6)+L1085 -> 63 | O1085: 15 | P1085: 14 | Q1085: =(O1085*6)+P1085 -> 104 | S1085: UMPIRES | Z1085: LADDER | AC1085: ROUND | AE1085: 20
A1086: COBURG | C1086: 4 | D1086: 4 | E1086: =(C1086*6)+D1086 -> 28 | G1086: 4 | H1086: 5 | I1086: =(G1086*6)+H1086 -> 29 | K1086: 5 | L1086: 5 | M1086: =(K1086*6)+L1086 -> 35 | O1086: 6 | P1086: 9 | Q1086: =(O1086*6)+P1086 -> 45
A1087: BEST PLAYERS | W1087: TEAM | X1087: B | Y1087: W | Z1087: L | AA1087: D | AB1087: FOR | AC1087: AGST | AD1087: % | AE1087: PTS
A1088: WERRIBEE | C1088: BOYD | F1088: FAULKNER | I1088: LAMB | L1088: McGUINNES | O1088: CONDOS | R1088: GLEESON
A1089: COBURG | C1089: MOORE | F1089: A RAINES | I1089: O'CONNOR | L1089: CARLSON | W1089: PORT MELBOURNE | X1089: 2 | Y1089: 14 | Z1089: 4 | AA1089: 0 | AB1089: 2035 | AC1089: 1504 | AD1089: =(AB1089/AC1089)*100 -> 135.30585106382981 | AE1089: =(Y1089*4)+(AA1089*2) -> 56
A1090: GOALKICKERS | P1090: MITCHELL | S1090: RAU | W1090: SANDRINGHAM | X1090: 2 | Y1090: 13 | Z1090: 5 | AA1090: 0 | AB1090: 1730 | AC1090: 1293 | AD1090: =(AB1090/AC1090)*100 -> 133.79737045630318 | AE1090: =(Y1090*4)+(AA1090*2) -> 52
A1091: WERRIBEE | C1091: LAMB 3 | E1091: FAULKNER 2 | H1091: CONDOS 2 | J1091: GLEESON 2 | M1091: DAVIS 2 | O1091: LYONS | Q1091: HENDERSON | W1091: WERRIBEE | X1091: 2 | Y1091: 12 | Z1091: 6 | AA1091: 0 | AB1091: 1565 | AC1091: 1285 | AD1091: =(AB1091/AC1091)*100 -> 121.78988326848248 | AE1091: =(Y1091*4)+(AA1091*2) -> 48
A1092: COBURG | C1092: FLETCHER 2 | F1092: O'CONNOR 2 | I1092: FIORA | K1092: RAINES | W1092: NORTH BALLARAT | X1092: 2 | Y1092: 11 | Z1092: 7 | AA1092: 0 | AB1092: 1416 | AC1092: 1380 | AD1092: =(AB1092/AC1092)*100 -> 102.60869565217392 | AE1092: =(Y1092*4)+(AA1092*2) -> 44
W1093: TASMANIA | X1093: 2 | Y1093: 11 | Z1093: 7 | AA1093: 0 | AB1093: 1558 | AC1093: 1596 | AD1093: =(AB1093/AC1093)*100 -> 97.61904761904762 | AE1093: =(Y1093*4)+(AA1093*2) -> 44
A1094: BOX HILL | C1094: 3 | D1094: 3 | E1094: =(C1094*6)+D1094 -> 21 | G1094: 6 | H1094: 7 | I1094: =(G1094*6)+H1094 -> 43 | K1094: 13 | L1094: 7 | M1094: =(K1094*6)+L1094 -> 85 | O1094: 14 | P1094: 13 | Q1094: =(O1094*6)+P1094 -> 97 | S1094: Venue: BOX HILL | W1094: COBURG | X1094: 2 | Y1094: 11 | Z1094: 7 | AA1094: 0 | AB1094: 1391 | AC1094: 1448 | AD1094: =(AB1094/AC1094)*100 -> 96.063535911602202 | AE1094: =(Y1094*4)+(AA1094*2) -> 44
A1095: WILLIAMSTOWN | C1095: 3 | D1095: 2 | E1095: =(C1095*6)+D1095 -> 20 | G1095: 5 | H1095: 5 | I1095: =(G1095*6)+H1095 -> 35 | K1095: 7 | L1095: 8 | M1095: =(K1095*6)+L1095 -> 50 | O1095: 10 | P1095: 12 | Q1095: =(O1095*6)+P1095 -> 72 | W1095: BOX HILL | X1095: 2 | Y1095: 10 | Z1095: 8 | AA1095: 0 | AB1095: 1659 | AC1095: 1587 | AD1095: =(AB1095/AC1095)*100 -> 104.53686200378071 | AE1095: =(Y1095*4)+(AA1095*2) -> 40
A1096: BEST PLAYERS | W1096: BENDIGO | X1096: 2 | Y1096: 9 | Z1096: 9 | AA1096: 0 | AB1096: 1725 | AC1096: 1736 | AD1096: =(AB1096/AC1096)*100 -> 99.366359447004598 | AE1096: =(Y1096*4)+(AA1096*2) -> 36
A1097: BOX HILL | C1097: BAILEY | F1097: MILLER | I1097: BREESE | L1097: CLIFTON | O1097: BALL | R1097: OSBORNE
A1098: WILLIAMSTOWN | C1098: THEODORE | F1098: LOKAN | I1098: SWAN | L1098: LLOYD | O1098: McKEE | R1098: LAWRY | W1098: GEELONG | X1098: 2 | Y1098: 7 | Z1098: 11 | AA1098: 0 | AB1098: 1506 | AC1098: 1567 | AD1098: =(AB1098/AC1098)*100 -> 96.10721123165284 | AE1098: =(Y1098*4)+(AA1098*2) -> 28
A1099: GOALKICKERS | R1099: TAYLOR | W1099: WILLIAMSTOWN | X1099: 2 | Y1099: 6 | Z1099: 12 | AA1099: 0 | AB1099: 1465 | AC1099: 1832 | AD1099: =(AB1099/AC1099)*100 -> 79.967248908296938 | AE1099: =(Y1099*4)+(AA1099*2) -> 24
A1100: BOX HILL | C1100: MILLER 4 | E1100: HEIGHT 3 | G1100: ALLEWAY 2 | J1100: DAWSON | L1100: OSBORNE | O1100: PUGSLEY | Q1100: RUDOLPH | W1100: FRANKSTON | X1100: 2 | Y1100: 5 | Z1100: 13 | AA1100: 0 | AB1100: 1388 | AC1100: 1551 | AD1100: =(AB1100/AC1100)*100 -> 89.490651192778842 | AE1100: =(Y1100*4)+(AA1100*2) -> 20
A1101: WILLIAMSTOWN | C1101: DUKES 2 | E1101: JARRAD 2 | G1101: SHACKLETON | J1101: SMOKER | L1101: KINNEAR | O1101: KNIGHT | Q1101: CRANAGE | W1101: NORTHERN BULLANTS | X1101: 2 | Y1101: 5 | Z1101: 13 | AA1101: 0 | AB1101: 1329 | AC1101: 1514 | AD1101: =(AB1101/AC1101)*100 -> 87.780713342140032 | AE1101: =(Y1101*4)+(AA1101*2) -> 20
D1102: 22ND AUGUST | J1102: WEATHER | Q1102: PEARCE | W1102: SPRINGVALE | X1102: 2 | Y1102: 3 | Z1102: 15 | AA1102: 0 | AB1102: 1376 | AC1102: 2002 | AD1102: =(AB1102/AC1102)*100 -> 68.731268731268742 | AE1102: =(Y1102*4)+(AA1102*2) -> 12
A1103: BENDIGO | C1103: 4 | D1103: 5 | E1103: =(C1103*6)+D1103 -> 29 | G1103: 10 | H1103: 10 | I1103: =(G1103*6)+H1103 -> 70 | K1103: 20 | L1103: 16 | M1103: =(K1103*6)+L1103 -> 136 | O1103: 22 | P1103: 20 | Q1103: =(O1103*6)+P1103 -> 152 | S1103: Venue: BENDIGO
A1104: TASMANIA | C1104: 2 | D1104: 1 | E1104: =(C1104*6)+D1104 -> 13 | G1104: 4 | H1104: 6 | I1104: =(G1104*6)+H1104 -> 30 | K1104: 5 | L1104: 9 | M1104: =(K1104*6)+L1104 -> 39 | O1104: 10 | P1104: 15 | Q1104: =(O1104*6)+P1104 -> 75
A1105: BEST PLAYERS
A1106: BENDIGO | C1106: MERCURI | F1106: HAYNES | I1106: DOERING | L1106: CARTER | O1106: CAMPBELL | R1106: BOWEN
A1107: TASMANIA | C1107: CALLINAN | F1107: WALKER | I1107: PLAPP | L1107: KIRK
A1108: GOALKICKERS | N1108: WILSON | P1108: COSGRIFF | R1108: MOORCROFT
A1109: BENDIGO | C1109: MERCURI 6 | F1109: HAYNES 5 | I1109: CAMPBELL 2 | L1109: NASH 2 | N1109: HENNEMAN | Q1109: DOERING | S1109: LOVETT | W1109: WELLMAN
A1110: TASMANIA | C1110: BEAMS 3 | F1110: KIRK 3 | I1110: M GEAPPEN | L1110: BARTLETT | N1110: PLAPP | P1110: BROWN
A1112: SANDRINGHAM | C1112: 2 | D1112: 2 | E1112: =(C1112*6)+D1112 -> 14 | G1112: 5 | H1112: 5 | I1112: =(G1112*6)+H1112 -> 35 | K1112: 7 | L1112: 8 | M1112: =(K1112*6)+L1112 -> 50 | O1112: 10 | P1112: 9 | Q1112: =(O1112*6)+P1112 -> 69 | S1112: Venue: PRESTON
A1113: NORTHERN BULLANTS | C1113: 1 | D1113: 3 | E1113: =(C1113*6)+D1113 -> 9 | G1113: 3 | H1113: 3 | I1113: =(G1113*6)+H1113 -> 21 | K1113: 6 | L1113: 6 | M1113: =(K1113*6)+L1113 -> 42 | O1113: 6 | P1113: 7 | Q1113: =(O1113*6)+P1113 -> 43
A1114: BEST PLAYERS
A1115: SANDRINGHAM | C1115: CONROY | F1115: WILLIAMS | I1115: CARROLL | L1115: GADSDEN | O1115: LIDDELL | R1115: FISHER
A1116: NORTHERN BULLANTS | C1116: ZORZI | F1116: BEASY | I1116: KENNA | L1116: DAV CLARKE | O1116: McCORMICK | R1116: COLBERT
A1117: GOALKICKERS
A1118: SANDRINGHAM | C1118: MOLAN 2 | F1118: NEWMAN 2 | I1118: SAUTNER | K1118: BIDDLECOMBE | N1118: FISHER | P1118: O'KEEFE | R1118: SMITH | U1118: FLETCHER
A1119: NORTHERN BULLANTS | C1119: COLBERT 2 | F1119: GUTTERSON 2 | J1119: DAV CLARKE | M1119: ZORZI
A1121: FRANKSTON | C1121: 2 | D1121: 4 | E1121: =(C1121*6)+D1121 -> 16 | G1121: 7 | H1121: 5 | I1121: =(G1121*6)+H1121 -> 47 | K1121: 10 | L1121: 9 | M1121: =(K1121*6)+L1121 -> 69 | O1121: 14 | P1121: 11 | Q1121: =(O1121*6)+P1121 -> 95 | S1121: Venue: FRANKSTON
A1122: SPRINGVALE | C1122: 2 | D1122: 5 | E1122: =(C1122*6)+D1122 -> 17 | G1122: 3 | H1122: 7 | I1122: =(G1122*6)+H1122 -> 25 | K1122: 4 | L1122: 9 | M1122: =(K1122*6)+L1122 -> 33 | O1122: 11 | P1122: 10 | Q1122: =(O1122*6)+P1122 -> 76
A1123: BEST PLAYERS
A1124: FRANKSTON | D1124: MURPHY | G1124: GODDARD | J1124: ROBERTS | M1124: ABLETT | P1124: POLLARD | S1124: TAYLOR
A1125: SPRINGVALE | D1125: N CARMODY | G1125: HARRISON | J1125: CARROLL | M1125: CAPLES | P1125: ROUDA | S1125: MURRAY
A1126: GOALKICKERS
A1127: FRANKSTON | D1127: BEASY 3 | G1127: MARIGLIANI 3 | J1127: CLARKE 3 | M1127: ROBERTSON | P1127: MURPHY | R1127: ULMS | U1127: MCCORMACK | X1127: LITTLECHILD
A1128: SPRINGVALE | D1128: MILNE 5 | G1128: WULF 2 | I1128: HARRISON | L1128: MURRAY | N1128: BROOKS | P1128: R CLARKE
A1130: PORT MELBOURNE | C1130: 4 | D1130: 4 | E1130: =(C1130*6)+D1130 -> 28 | G1130: 6 | H1130: 7 | I1130: =(G1130*6)+H1130 -> 43 | K1130: 12 | L1130: 11 | M1130: =(K1130*6)+L1130 -> 83 | O1130: 15 | P1130: 15 | Q1130: =(O1130*6)+P1130 -> 105 | S1130: Venue: PORT MELBOURNE
A1131: GEELONG | C1131: 8 | D1131: 4 | E1131: =(C1131*6)+D1131 -> 52 | G1131: 9 | H1131: 6 | I1131: =(G1131*6)+H1131 -> 60 | K1131: 11 | L1131: 6 | M1131: =(K1131*6)+L1131 -> 72 | O1131: 12 | P1131: 7 | Q1131: =(O1131*6)+P1131 -> 79
A1132: BEST PLAYERS
A1133: PORT MELBOURNE | C1133: ROBBINS | F1133: BAIRD | I1133: J CLAYTON | L1133: FIRRITO | O1133: S CLAYTON | R1133: PERRY
A1134: GEELONG | C1134: SPRIGGS | F1134: D BYRNE | I1134: EGAN | L1134: S BYRNES | O1134: BUCKLAND | R1134: RAHILLY
A1135: GOALKICKERS
A1136: PORT MELBOURNE | C1136: HARDING 3 | F1136: GILL 2 | I1136: J CLAYTON 2 | L1136: RUDD 2 | N1136: JONES | P1136: FIRRITO | R1136: PITT | T1136: ROBBINS | W1136: LECRAS | X1136: BAIRD
A1137: GEELONG | C1137: GREAVES 4 | F1137: D BYRNE 2 | I1137: HAYNES 2 | L1137: SPRIGGS 2 | O1137: J BYRNE | Q1137: S BYRNES
A1139: BYE | D1139: NORTH BALLARAT
A1141: ELIMNATION FINAL | E1141: 28TH AUGUST | H1141: NIGHT MATCH | L1141: WEATHER
D1142: 1ST QTR | H1142: 2ND QTR | L1142: 3RD QTR | P1142: FINAL | S1142: Venue: YORK PARK (Launceston)
A1143: TASMANIA | C1143: 7 | D1143: 3 | E1143: =(C1143*6)+D1143 -> 45 | G1143: 9 | H1143: 4 | I1143: =(G1143*6)+H1143 -> 58 | K1143: 12 | L1143: 7 | M1143: =(K1143*6)+L1143 -> 79 | O1143: 16 | P1143: 10 | Q1143: =(O1143*6)+P1143 -> 106 | S1143: UMPIRES
A1144: BENDIGO | C1144: 3 | D1144: 0 | E1144: =(C1144*6)+D1144 -> 18 | G1144: 8 | H1144: 4 | I1144: =(G1144*6)+H1144 -> 52 | K1144: 13 | L1144: 7 | M1144: =(K1144*6)+L1144 -> 85 | O1144: 13 | P1144: 9 | Q1144: =(O1144*6)+P1144 -> 87
A1145: BEST PLAYERS
A1146: TASMANIA | C1146: CARELESS | F1146: CALLINAN | I1146: KIRK | L1146: B GEAPPEN | O1146: PLAPP | R1146: BLIGHT
A1147: BENDIGO | C1147: DOERING | F1147: CAMPBELL | I1147: ALVEY | L1147: RICHARDS | O1147: BRADLEY | R1147: CARTER
A1148: GOALKICKERS
A1149: TASMANIA | C1149: BARTLETT 3 | F1149: PLAPP 3 | I1149: ATKIN 2 | K1149: CALLINAN 2 | N1149: BEAMS 2 | Q1149: KIRK 2 | S1149: LING | U1149: DRURY
A1150: BENDIGO | C1150: CAMPBELL 3 | F1150: WALSH 2 | I1150: RICHARDS 2 | L1150: HENNEMAN | N1150: HAWKINS | Q1150: NASH | R1150: ROBINS
A1152: ELIMINATION FINAL | E1152: 28TH AUGUST | J1152: WEATHER
A1153: BOX HILL | C1153: 1 | D1153: 4 | E1153: =(C1153*6)+D1153 -> 10 | G1153: 2 | H1153: 8 | I1153: =(G1153*6)+H1153 -> 20 | K1153: 5 | L1153: 11 | M1153: =(K1153*6)+L1153 -> 41 | O1153: 9 | P1153: 14 | Q1153: =(O1153*6)+P1153 -> 68 | S1153: Venue: COBURG
A1154: COBURG | C1154: 2 | D1154: 1 | E1154: =(C1154*6)+D1154 -> 13 | G1154: 6 | H1154: 6 | I1154: =(G1154*6)+H1154 -> 42 | K1154: 7 | L1154: 9 | M1154: =(K1154*6)+L1154 -> 51 | O1154: 8 | P1154: 11 | Q1154: =(O1154*6)+P1154 -> 59
A1155: BEST PLAYERS
A1156: BOX HILL | C1156: RIX | F1156: ALLEWAY | I1156: OSBORNE | L1156: HEIGHT | O1156: RUDOLPH | R1156: GREENE
A1157: COBURG | C1157: TALBOT | F1157: HOULIHAN | I1157: KURET | L1157: TUCK | O1157: O'CONNOR | R1157: YOUNG
A1158: GOALKICKERS
A1159: BOX HILL | C1159: TAYLOR 3 | F1159: ALLEWAY | I1159: BARKER | K1159: HARVEY | M1159: HEIGHT | O1159: MILLER | Q1159: PUGSLEY
A1160: COBURG | C1160: TUCK 2 | F1160: DRAGICEVIC | I1160: HOULIHAN | L1160: ARCHIBALD | O1160: FOLEY | Q1160: MOORE | S1160: MORRISON
A1162: QUALIFYING FINAL | E1162: 29TH AUGUST | J1162: WEATHER
A1163: PORT MELBOURNE | C1163: 2 | D1163: 5 | E1163: =(C1163*6)+D1163 -> 17 | G1163: 8 | H1163: 9 | I1163: =(G1163*6)+H1163 -> 57 | K1163: 12 | L1163: 15 | M1163: =(K1163*6)+L1163 -> 87 | O1163: 17 | P1163: 20 | Q1163: =(O1163*6)+P1163 -> 122 | S1163: Venue: PORT MELBOURNE
A1164: NORTH BALLARAT | C1164: 5 | D1164: 1 | E1164: =(C1164*6)+D1164 -> 31 | G1164: 5 | H1164: 7 | I1164: =(G1164*6)+H1164 -> 37 | K1164: 5 | L1164: 9 | M1164: =(K1164*6)+L1164 -> 39 | O1164: 8 | P1164: 12 | Q1164: =(O1164*6)+P1164 -> 60
A1165: BEST PLAYERS
A1166: PORT MELBOURNE | C1166: J CLAYTON | F1166: GRIMA | I1166: SANSBURY | L1166: GIBSON | O1166: LAWRENCE | R1166: PERRY
A1167: NORTH BALLARAT | C1167: JURICA | F1167: PLUNKETT | I1167: TAYLOR | L1167: O'KEEFE
A1168: GOALKICKERS
A1169: PORT MELBOURNE | C1169: GILL 3 | F1169: SHORE 3 | I1169: RUDD 2 | K1169: HALE 2 | M1169: COTCHETT | P1169: LAWRENCE | R1169: ALOI | T1169: J CLAYTON | W1169: PITT
A1170: NORTH BALLARAT | C1170: HUTCHINSON 2 | G1170: TAYLOR 2 | J1170: PLUNKETT | M1170: WHYMAN | O1170: FIELD | Q1170: TUCKEY
A1172: QUALIFYING FINAL | E1172: 28TH AUGUST | J1172: WEATHER
A1173: SANDRINGHAM | C1173: 2 | D1173: 5 | E1173: =(C1173*6)+D1173 -> 17 | G1173: 6 | H1173: 7 | I1173: =(G1173*6)+H1173 -> 43 | K1173: 8 | L1173: 11 | M1173: =(K1173*6)+L1173 -> 59 | O1173: 11 | P1173: 17 | Q1173: =(O1173*6)+P1173 -> 83 | S1173: Venue: PORT MELBOURNE
A1174: WERRIBEE | C1174: 0 | D1174: 2 | E1174: =(C1174*6)+D1174 -> 2 | G1174: 2 | H1174: 3 | I1174: =(G1174*6)+H1174 -> 15 | K1174: 4 | L1174: 8 | M1174: =(K1174*6)+L1174 -> 32 | O1174: 7 | P1174: 10 | Q1174: =(O1174*6)+P1174 -> 52
A1175: BEST PLAYERS
A1176: SANDRINGHAM | C1176: CARROLL | F1176: FERGUSON | I1176: LAMB | L1176: McLEAN | O1176: GALLAGHER | R1176: CONROY
A1177: WERRIBEE | C1177: MORRIS | F1177: FAULKNER | I1177: McGUINNESS
A1178: GOALKICKERS
A1179: SANDRINGHAM | C1179: McLEAN 3 | F1179: MILLS 2 | I1179: JOLLY 2 | K1179: BIDDLECOMBE | N1179: GALLAGHER | Q1179: WARNOCK | T1179: GADSDEN
A1180: WERRIBEE | C1180: BARRY | E1180: CROFT | G1180: DAVIS | I1180: GLEESON | K1180: LAMB | M1180: MITCHELL | O1180: CONDOS
A1182: 1ST SEMI FINAL | E1182: 4TH SEPTEMBER | J1182: WEATHER
A1183: TASMANIA | C1183: 3 | D1183: 3 | E1183: =(C1183*6)+D1183 -> 21 | G1183: 7 | H1183: 6 | I1183: =(G1183*6)+H1183 -> 48 | K1183: 8 | L1183: 8 | M1183: =(K1183*6)+L1183 -> 56 | O1183: 15 | P1183: 9 | Q1183: =(O1183*6)+P1183 -> 99 | S1183: Venue: BELLERIVE OVAL
A1184: NORTH BALLARAT | C1184: 1 | D1184: 1 | E1184: =(C1184*6)+D1184 -> 7 | G1184: 8 | H1184: 2 | I1184: =(G1184*6)+H1184 -> 50 | K1184: 12 | L1184: 4 | M1184: =(K1184*6)+L1184 -> 76 | O1184: 13 | P1184: 6 | Q1184: =(O1184*6)+P1184 -> 84
A1185: BEST PLAYERS
A1186: TASMANIA | C1186: ATKIN | F1186: JOVANOVIC | I1186: B GEAPPEN | L1186: CARELESS | O1186: BARTLETT | R1186: WALKER
A1187: NORTH BALLARAT | C1187: MOLONEY | F1187: TAYLOR | I1187: SAUNDERS | L1187: TUCKEY | O1187: FIELD | R1187: CLARK
A1188: GOALKICKERS
A1189: TASMANIA | C1189: CALLINAN 3 | F1189: BEAMS 2 | I1189: BARTLETT 2 | L1189: PLAPP 2 | N1189: DRURY 2 | P1189: CARELESS | R1189: B GEAPPEN | U1189: BROWN | X1189: BLIGHT
A1190: NORTH BALLARAT | C1190: TAYLOR 4 | F1190: SAUNDERS 2 | I1190: BIDDISCOMBE 2 | M1190: WHYMAN 2 | P1190: PLUNKETT | R1190: TUCKEY | T1190: FIELD
A1192: 2ND SEMI FINAL | E1192: 5TH SEPTEMBER | J1192: WEATHER
A1193: BOX HILL | C1193: 6 | D1193: 2 | E1193: =(C1193*6)+D1193 -> 38 | G1193: 8 | H1193: 7 | I1193: =(G1193*6)+H1193 -> 55 | K1193: 12 | L1193: 9 | M1193: =(K1193*6)+L1193 -> 81 | O1193: 13 | P1193: 11 | Q1193: =(O1193*6)+P1193 -> 89 | S1193: Venue: PORT MELBOURNE
A1194: WERRIBEE | C1194: 3 | D1194: 3 | E1194: =(C1194*6)+D1194 -> 21 | G1194: 3 | H1194: 9 | I1194: =(G1194*6)+H1194 -> 27 | K1194: 6 | L1194: 12 | M1194: =(K1194*6)+L1194 -> 48 | O1194: 11 | P1194: 15 | Q1194: =(O1194*6)+P1194 -> 81
A1195: BEST PLAYERS
A1196: BOX HILL | C1196: BAILEY | F1196: SEWELL | I1196: KANE | L1196: RIX | O1196: COX | R1196: BALL
A1197: WERRIBEE | C1197: CROSS | F1197: GARLICK | I1197: CROFT | L1197: KRETIUK | O1197: PODSIADLY | R1197: McGUINNES
A1198: GOALKICKERS
A1199: BOX HILL | C1199: HEIGHT 2 | F1199: KANE 2 | I1199: ALLEWAY 2 | L1199: HARVEY 2 | N1199: BAILEY | P1199: CAMPBELL | R1199: MILLER | T1199: BALL | V1199: CLIFTON
A1200: WERRIBEE | C1200: LAMB 3 | F1200: MITCHELL 3 | I1200: PODSIADLY 3 | L1200: MURPHY | N1200: DAVIS
A1203: PRELIMINARY FINAL | F1203: 11TH SEPTEMBER | J1203: WEATHER
D1204: 1ST QTR | H1204: 2ND QTR | L1204: 3RD QTR | P1204: FINAL | S1204: Venue: PORT MELBOURNE
A1205: PORT MELBOURNE | C1205: 2 | D1205: 3 | E1205: =(C1205*6)+D1205 -> 15 | G1205: 7 | H1205: 6 | I1205: =(G1205*6)+H1205 -> 48 | K1205: 10 | L1205: 7 | M1205: =(K1205*6)+L1205 -> 67 | O1205: 11 | P1205: 15 | Q1205: =(O1205*6)+P1205 -> 81 | S1205: UMPIRES
A1206: BOX HILL | C1206: 3 | D1206: 0 | E1206: =(C1206*6)+D1206 -> 18 | G1206: 5 | H1206: 3 | I1206: =(G1206*6)+H1206 -> 33 | K1206: 6 | L1206: 5 | M1206: =(K1206*6)+L1206 -> 41 | O1206: 8 | P1206: 5 | Q1206: =(O1206*6)+P1206 -> 53
A1207: BEST PLAYERS
A1208: PORT MELBOURNE | C1208: J CLAYTON | F1208: COTCHETT | I1208: GRIMA | L1208: HALE | N1208: BAIRD | Q1208: GILL
A1209: BOX HILL | C1209: BAILEY | F1209: BRENNAN | I1209: BALL | L1209: HARVEY | N1209: RUDOLPH | Q1209: SEWELL
A1210: GOALKICKERS
A1211: PORT MELBOURNE | C1211: LAWRENCE 2 | F1211: GILL 2 | H1211: SANSBURY 2 | K1211: ROBBINS | M1211: J CLAYTON | P1211: GRIMA | R1211: ALOI | T1211: RUDD
A1212: BOX HILL | C1212: SEWELL 2 | F1212: PUGSLEY | I1212: NEAGLE | K1212: MILLER | M1212: ALLEWAY | O1212: RUDOLPH | Q1212: HARVEY
A1214: PRELIMINARY FINAL | F1214: 12TH SEPTEMBER | J1214: WEATHER
A1215: SANDRINGHAM | C1215: 1 | D1215: 2 | E1215: =(C1215*6)+D1215 -> 8 | G1215: 7 | H1215: 4 | I1215: =(G1215*6)+H1215 -> 46 | K1215: 9 | L1215: 7 | M1215: =(K1215*6)+L1215 -> 61 | O1215: 12 | P1215: 10 | Q1215: =(O1215*6)+P1215 -> 82 | S1215: Venue: PORT MELBOURNE
A1216: TASMANIA | C1216: 4 | D1216: 2 | E1216: =(C1216*6)+D1216 -> 26 | G1216: 5 | H1216: 4 | I1216: =(G1216*6)+H1216 -> 34 | K1216: 6 | L1216: 5 | M1216: =(K1216*6)+L1216 -> 41 | O1216: 6 | P1216: 8 | Q1216: =(O1216*6)+P1216 -> 44
A1217: BEST PLAYERS
A1218: SANDRINGHAM | C1218: GALLAGHER | F1218: FERGUSON | I1218: C LIDDELL | L1218: CARROLL | O1218: LAMB | Q1218: JAMAR
A1219: TASMANIA | C1219: M GEAPPEN | F1219: BLIGHT | I1219: CARELESS | L1219: JOVANOVIC | O1219: PLAPP | Q1219: WAGER
A1220: GOALKICKERS
A1221: SANDRINGHAM | C1221: GALLAGHER 3 | F1221: SAUTNER 3 | I1221: FISHER 2 | K1221: ARMSTRONG | N1221: JAMAR | P1221: N SMITH | R1221: GADSDEN
A1222: TASMANIA | C1222: BARTLETT 2 | F1222: ATKIN | H1222: BEAMS | J1222: PLAPP | L1222: HALL
A1224: GRAND FINAL | D1224: 19TH SEPTEMBER | J1224: WEATHER
A1225: SANDRINGHAM | C1225: 3 | D1225: 3 | E1225: =(C1225*6)+D1225 -> 21 | G1225: 7 | H1225: 7 | I1225: =(G1225*6)+H1225 -> 49 | K1225: 9 | L1225: 11 | M1225: =(K1225*6)+L1225 -> 65 | O1225: 9 | P1225: 13 | Q1225: =(O1225*6)+P1225 -> 67 | S1225: Venue: OPTUS OVAL
A1226: PORT MELBOURNE | C1226: 4 | D1226: 3 | E1226: =(C1226*6)+D1226 -> 27 | G1226: 6 | H1226: 5 | I1226: =(G1226*6)+H1226 -> 41 | K1226: 7 | L1226: 7 | M1226: =(K1226*6)+L1226 -> 49 | O1226: 9 | P1226: 9 | Q1226: =(O1226*6)+P1226 -> 63
A1227: BEST PLAYERS
A1228: SANDRINGHAM | C1228: RIGONI | F1228: SYLVIA | I1228: BELL | L1228: CROWE | O1228: SAUTNER | R1228: FISHER
A1229: PORT MELBOURNE | C1229: J CLAYTON | F1229: GRIMA | I1229: ROBBINS | L1229: S CLAYTON | O1229: PITT
A1230: GOALKICKERS
A1231: SANDRINGHAM | C1231: SAUTNER 4 | F1231: WILLIAMS 2 | I1231: CROWE | K1231: GALLAGHER | N1231: SYLVIA
A1232: PORT MELBOURNE | C1232: J CLAYTON 2 | F1232: GRIMA 2 | I1232: PITT 2 | K1232: ALOI | M1232: BAIRD | O1232: HARDING